{
  "metadata": {
    "title": "Characterization and reactivity of Al<ce:inf loc=post>2</ce:inf>O<ce:inf loc=post>3</ce:inf>–ZrO<ce:inf loc=post>2</ce:inf> supported vanadium oxide catalysts",
    "authors": "; ; ",
    "journal": "Journal of Molecular Catalysis A: Chemical",
    "date": "2006-01-16",
    "doi": "10.1016/j.molcata.2005.07.036",
    "abstract": "",
    "uri": "https://api.elsevier.com/content/article/pii/S138111690500508X",
    "pii": "S138111690500508X"
  },
  "fulltext": {
    "full-text-retrieval-response": {
      "scopus-eid": "2-s2.0-29144471882",
      "originalText": "serial JL 271358 291210 291744 291790 291809 31 Journal of Molecular Catalysis A: Chemical JOURNALMOLECULARCATALYSISACHEMICAL 2005-09-23 2005-09-23 2010-03-29T20:21:43 1-s2.0-S138111690500508X S1381-1169(05)00508-X S138111690500508X 10.1016/j.molcata.2005.07.036 S300 S300.1 FULL-TEXT 1-s2.0-S1381116905X02242 2015-05-15T05:56:33.000448-04:00 0 0 20060116 2006 2005-09-23T00:00:00Z articleinfo crossmark dco dateupdated tomb dateloaded datesearch indexeddate issuelist volumelist yearnav absattachment articletitlenorm authfirstinitialnorm authfirstsurnamenorm cid cids contenttype copyright dateloadedtxt docsubtype doctype doi eid ewtransactionid hubeid issfirst issn issnnorm itemstage itemtransactionid itemweight openaccess openarchive pg pgfirst pglast pii piinorm pubdatestart pubdatetxt pubyr sortorder srctitle srctitlenorm srctype subheadings volfirst volissue webpdf webpdfpagecount figure table body mmlmath acknowledge affil articletitle auth authfirstini authfull authkeywords authlast primabst ref specialabst alllist content subj ssids 1381-1169 13811169 243 243 2 2 Volume 243, Issue 2 3 149 157 149 157 20060116 16 January 2006 2006-01-16 2006 article fla Copyright © 2005 Elsevier B.V. All rights reserved. CHARACTERIZATIONREACTIVITYAL2O3ZRO2SUPPORTEDVANADIUMOXIDECATALYSTS CHARY K 1 Introduction 2 Experimental 3 Results and discussion 4 Conclusions Acknowledgements References PARK 2000 55 S MARTIN 2000 61 A CHARY 1998 6792 K CAVANI 1987 245 P ANDERSSON 1979 383 A CAVALLI 1987 639 P ANDERSSON 1979 383 A ANDERSSON 1986 204 A WENT 1992 479 G NAG 1990 127 N PIECK 2002 2642 C CHARY 1984 2622 K LAKSHMI 2001 199 J STOBBEKREEMERS 1995 130 A CHARY 1995 14424 K ADAMSKI 1999 113 A ECKERT 1989 6796 H KOZLOWSKI 1983 5176 R TANAKA 1988 2987 T SCHAPER 1983 211 H SAHIBEDDINE 2002 159 A FARMER 2002 1015 S DOMINGUEZ 2000 119 J LARESE 2002 467 C PEETERS 1998 28 I ARENA 1999 189 F GILLLAMBIAS 1985 520 F EBERHARDT 1996 27 M MEUNIER 1986 329 G WACHS 1996 437 I CHARY 1998 314 K KORANNE 1994 369 M BOSCH 1984 2479 H ROOZEBOOM 1980 2783 F DIAS 1995 344 C BOND 1997 91 G HUUHTANEN 1993 159 J WAGNER 1978 C HANDBOOKXRAYPHOTOELECTRONSPECTROSCOPY BOND 1996 437 G WACHS 1997 67 I WAGNER 1981 211 C CENTI 1992 2617 G SCHRAMLMARTH 1991 2635 M MADON 1982 438 R SINGH 2001 1 U CHARYX2006X149 CHARYX2006X149X157 CHARYX2006X149XK CHARYX2006X149X157XK item S1381-1169(05)00508-X S138111690500508X 1-s2.0-S138111690500508X 10.1016/j.molcata.2005.07.036 271358 2010-10-08T06:13:52.84217-04:00 2006-01-16 1-s2.0-S138111690500508X-main.pdf https://s3.amazonaws.com/prod-ucs-content-store-us-east/content/pii:S138111690500508X/MAIN/application/pdf/d7943e67418ac7dd2762a13783252967/main.pdf https://s3-eu-west-1.amazonaws.com/prod-ucs-content-store-eu-west/content/pii:S138111690500508X/MAIN/application/pdf/d7943e67418ac7dd2762a13783252967/main.pdf main.pdf pdf true 282706 MAIN 9 1-s2.0-S138111690500508X-main_1.png https://s3.amazonaws.com/prod-ucs-content-store-us-east/content/pii:S138111690500508X/PREVIEW/image/png/6bd55507b6bf19201a0d1908b19152c1/main_1.png https://s3-eu-west-1.amazonaws.com/prod-ucs-content-store-eu-west/content/pii:S138111690500508X/PREVIEW/image/png/6bd55507b6bf19201a0d1908b19152c1/main_1.png main_1.png png 63999 849 656 IMAGE-WEB-PDF 1 1-s2.0-S138111690500508X-si1.gif https://s3.amazonaws.com/prod-ucs-content-store-us-east/content/pii:S138111690500508X/STRIPIN/image/gif/49ba6706879b3a0a458e87082b604c4b/si1.gif https://s3-eu-west-1.amazonaws.com/prod-ucs-content-store-eu-west/content/pii:S138111690500508X/STRIPIN/image/gif/49ba6706879b3a0a458e87082b604c4b/si1.gif si1 si1.gif gif 967 22 239 ALTIMG 1-s2.0-S138111690500508X-gr3.gif https://s3.amazonaws.com/prod-ucs-content-store-us-east/content/pii:S138111690500508X/gr3/DOWNSAMPLED/image/gif/27469ab7ed00e10a1624d2b15a1f3926/gr3.gif https://s3-eu-west-1.amazonaws.com/prod-ucs-content-store-eu-west/content/pii:S138111690500508X/gr3/DOWNSAMPLED/image/gif/27469ab7ed00e10a1624d2b15a1f3926/gr3.gif gr3 gr3.gif gif 13818 748 249 IMAGE-DOWNSAMPLED 1-s2.0-S138111690500508X-gr3.sml https://s3.amazonaws.com/prod-ucs-content-store-us-east/content/pii:S138111690500508X/gr3/THUMBNAIL/image/gif/68b009b4a9a5be71a3bcd9cce59828bf/gr3.sml https://s3-eu-west-1.amazonaws.com/prod-ucs-content-store-eu-west/content/pii:S138111690500508X/gr3/THUMBNAIL/image/gif/68b009b4a9a5be71a3bcd9cce59828bf/gr3.sml gr3 gr3.sml sml 656 93 31 IMAGE-THUMBNAIL 1-s2.0-S138111690500508X-gr5.gif https://s3.amazonaws.com/prod-ucs-content-store-us-east/content/pii:S138111690500508X/gr5/DOWNSAMPLED/image/gif/641ba89465d0f68801efdc5146c5635a/gr5.gif https://s3-eu-west-1.amazonaws.com/prod-ucs-content-store-eu-west/content/pii:S138111690500508X/gr5/DOWNSAMPLED/image/gif/641ba89465d0f68801efdc5146c5635a/gr5.gif gr5 gr5.gif gif 11814 474 258 IMAGE-DOWNSAMPLED 1-s2.0-S138111690500508X-gr5.sml https://s3.amazonaws.com/prod-ucs-content-store-us-east/content/pii:S138111690500508X/gr5/THUMBNAIL/image/gif/88cfb4fe9345b7067a4d4b0e99fe5408/gr5.sml https://s3-eu-west-1.amazonaws.com/prod-ucs-content-store-eu-west/content/pii:S138111690500508X/gr5/THUMBNAIL/image/gif/88cfb4fe9345b7067a4d4b0e99fe5408/gr5.sml gr5 gr5.sml sml 1072 94 51 IMAGE-THUMBNAIL 1-s2.0-S138111690500508X-gr11.jpg https://s3.amazonaws.com/prod-ucs-content-store-us-east/content/pii:S138111690500508X/gr11/DOWNSAMPLED/image/jpeg/bf578b421f963f1d7db7ba944cb21b7c/gr11.jpg https://s3-eu-west-1.amazonaws.com/prod-ucs-content-store-eu-west/content/pii:S138111690500508X/gr11/DOWNSAMPLED/image/jpeg/bf578b421f963f1d7db7ba944cb21b7c/gr11.jpg gr11 gr11.jpg jpg 14189 263 308 IMAGE-DOWNSAMPLED 1-s2.0-S138111690500508X-gr11.sml https://s3.amazonaws.com/prod-ucs-content-store-us-east/content/pii:S138111690500508X/gr11/THUMBNAIL/image/gif/ae71c834be80fe552a0fff4d5593fa4f/gr11.sml https://s3-eu-west-1.amazonaws.com/prod-ucs-content-store-eu-west/content/pii:S138111690500508X/gr11/THUMBNAIL/image/gif/ae71c834be80fe552a0fff4d5593fa4f/gr11.sml gr11 gr11.sml sml 1964 93 109 IMAGE-THUMBNAIL 1-s2.0-S138111690500508X-gr1.jpg https://s3.amazonaws.com/prod-ucs-content-store-us-east/content/pii:S138111690500508X/gr1/DOWNSAMPLED/image/jpeg/358919dfd9b0a7f93d1de56826ad66e5/gr1.jpg https://s3-eu-west-1.amazonaws.com/prod-ucs-content-store-eu-west/content/pii:S138111690500508X/gr1/DOWNSAMPLED/image/jpeg/358919dfd9b0a7f93d1de56826ad66e5/gr1.jpg gr1 gr1.jpg jpg 16299 263 297 IMAGE-DOWNSAMPLED 1-s2.0-S138111690500508X-gr1.sml https://s3.amazonaws.com/prod-ucs-content-store-us-east/content/pii:S138111690500508X/gr1/THUMBNAIL/image/gif/59305bf079471074e357373b26c6e294/gr1.sml https://s3-eu-west-1.amazonaws.com/prod-ucs-content-store-eu-west/content/pii:S138111690500508X/gr1/THUMBNAIL/image/gif/59305bf079471074e357373b26c6e294/gr1.sml gr1 gr1.sml sml 2168 93 105 IMAGE-THUMBNAIL 1-s2.0-S138111690500508X-gr9.gif https://s3.amazonaws.com/prod-ucs-content-store-us-east/content/pii:S138111690500508X/gr9/DOWNSAMPLED/image/gif/c11c127d0aa1b1cb29c137193d48661f/gr9.gif https://s3-eu-west-1.amazonaws.com/prod-ucs-content-store-eu-west/content/pii:S138111690500508X/gr9/DOWNSAMPLED/image/gif/c11c127d0aa1b1cb29c137193d48661f/gr9.gif gr9 gr9.gif gif 8675 325 257 IMAGE-DOWNSAMPLED 1-s2.0-S138111690500508X-gr9.sml https://s3.amazonaws.com/prod-ucs-content-store-us-east/content/pii:S138111690500508X/gr9/THUMBNAIL/image/gif/479d6dedc6bf48bd53b42fb2854d6e36/gr9.sml https://s3-eu-west-1.amazonaws.com/prod-ucs-content-store-eu-west/content/pii:S138111690500508X/gr9/THUMBNAIL/image/gif/479d6dedc6bf48bd53b42fb2854d6e36/gr9.sml gr9 gr9.sml sml 1374 94 74 IMAGE-THUMBNAIL 1-s2.0-S138111690500508X-fx1.gif https://s3.amazonaws.com/prod-ucs-content-store-us-east/content/pii:S138111690500508X/fx1/DOWNSAMPLED/image/gif/f7be57d0636496f8e5924f4e18fcac1f/fx1.gif https://s3-eu-west-1.amazonaws.com/prod-ucs-content-store-eu-west/content/pii:S138111690500508X/fx1/DOWNSAMPLED/image/gif/f7be57d0636496f8e5924f4e18fcac1f/fx1.gif fx1 true fx1.gif gif 1746 75 205 IMAGE-DOWNSAMPLED 1-s2.0-S138111690500508X-fx1.sml https://s3.amazonaws.com/prod-ucs-content-store-us-east/content/pii:S138111690500508X/fx1/THUMBNAIL/image/gif/ff233cbc37b617fb374274054f72b4f6/fx1.sml https://s3-eu-west-1.amazonaws.com/prod-ucs-content-store-eu-west/content/pii:S138111690500508X/fx1/THUMBNAIL/image/gif/ff233cbc37b617fb374274054f72b4f6/fx1.sml fx1 true fx1.sml sml 872 46 125 IMAGE-THUMBNAIL 1-s2.0-S138111690500508X-gr8.jpg https://s3.amazonaws.com/prod-ucs-content-store-us-east/content/pii:S138111690500508X/gr8/DOWNSAMPLED/image/jpeg/2976a305b2dd24f57a50195163c76497/gr8.jpg https://s3-eu-west-1.amazonaws.com/prod-ucs-content-store-eu-west/content/pii:S138111690500508X/gr8/DOWNSAMPLED/image/jpeg/2976a305b2dd24f57a50195163c76497/gr8.jpg gr8 gr8.jpg jpg 16312 255 298 IMAGE-DOWNSAMPLED 1-s2.0-S138111690500508X-gr8.sml https://s3.amazonaws.com/prod-ucs-content-store-us-east/content/pii:S138111690500508X/gr8/THUMBNAIL/image/gif/3f399558ad5e96b1d2d34756ce3c348a/gr8.sml https://s3-eu-west-1.amazonaws.com/prod-ucs-content-store-eu-west/content/pii:S138111690500508X/gr8/THUMBNAIL/image/gif/3f399558ad5e96b1d2d34756ce3c348a/gr8.sml gr8 gr8.sml sml 2217 93 109 IMAGE-THUMBNAIL 1-s2.0-S138111690500508X-gr6.gif https://s3.amazonaws.com/prod-ucs-content-store-us-east/content/pii:S138111690500508X/gr6/DOWNSAMPLED/image/gif/96e5a3aecae95fe8b11f2aab9fbd2bf5/gr6.gif https://s3-eu-west-1.amazonaws.com/prod-ucs-content-store-eu-west/content/pii:S138111690500508X/gr6/DOWNSAMPLED/image/gif/96e5a3aecae95fe8b11f2aab9fbd2bf5/gr6.gif gr6 gr6.gif gif 10158 467 257 IMAGE-DOWNSAMPLED 1-s2.0-S138111690500508X-gr6.sml https://s3.amazonaws.com/prod-ucs-content-store-us-east/content/pii:S138111690500508X/gr6/THUMBNAIL/image/gif/2e196cf393d85583149f4bcaf23f1d3e/gr6.sml https://s3-eu-west-1.amazonaws.com/prod-ucs-content-store-eu-west/content/pii:S138111690500508X/gr6/THUMBNAIL/image/gif/2e196cf393d85583149f4bcaf23f1d3e/gr6.sml gr6 gr6.sml sml 983 93 51 IMAGE-THUMBNAIL 1-s2.0-S138111690500508X-gr2.gif https://s3.amazonaws.com/prod-ucs-content-store-us-east/content/pii:S138111690500508X/gr2/DOWNSAMPLED/image/gif/ca6bc46486762577977530fa5049f160/gr2.gif https://s3-eu-west-1.amazonaws.com/prod-ucs-content-store-eu-west/content/pii:S138111690500508X/gr2/DOWNSAMPLED/image/gif/ca6bc46486762577977530fa5049f160/gr2.gif gr2 gr2.gif gif 19421 849 263 IMAGE-DOWNSAMPLED 1-s2.0-S138111690500508X-gr2.sml https://s3.amazonaws.com/prod-ucs-content-store-us-east/content/pii:S138111690500508X/gr2/THUMBNAIL/image/gif/9d606d180e03649557c337ab7a4a420b/gr2.sml https://s3-eu-west-1.amazonaws.com/prod-ucs-content-store-eu-west/content/pii:S138111690500508X/gr2/THUMBNAIL/image/gif/9d606d180e03649557c337ab7a4a420b/gr2.sml gr2 gr2.sml sml 715 94 29 IMAGE-THUMBNAIL 1-s2.0-S138111690500508X-gr4.gif https://s3.amazonaws.com/prod-ucs-content-store-us-east/content/pii:S138111690500508X/gr4/DOWNSAMPLED/image/gif/afa026a06dbbe13930ccd490e08844f2/gr4.gif https://s3-eu-west-1.amazonaws.com/prod-ucs-content-store-eu-west/content/pii:S138111690500508X/gr4/DOWNSAMPLED/image/gif/afa026a06dbbe13930ccd490e08844f2/gr4.gif gr4 gr4.gif gif 11486 492 255 IMAGE-DOWNSAMPLED 1-s2.0-S138111690500508X-gr4.sml https://s3.amazonaws.com/prod-ucs-content-store-us-east/content/pii:S138111690500508X/gr4/THUMBNAIL/image/gif/2fee18842b9dc6e01fed387f20bae4a6/gr4.sml https://s3-eu-west-1.amazonaws.com/prod-ucs-content-store-eu-west/content/pii:S138111690500508X/gr4/THUMBNAIL/image/gif/2fee18842b9dc6e01fed387f20bae4a6/gr4.sml gr4 gr4.sml sml 952 93 48 IMAGE-THUMBNAIL 1-s2.0-S138111690500508X-gr7.gif https://s3.amazonaws.com/prod-ucs-content-store-us-east/content/pii:S138111690500508X/gr7/DOWNSAMPLED/image/gif/5a1ad65c2def054f1a80bc2c7464f9d2/gr7.gif https://s3-eu-west-1.amazonaws.com/prod-ucs-content-store-eu-west/content/pii:S138111690500508X/gr7/DOWNSAMPLED/image/gif/5a1ad65c2def054f1a80bc2c7464f9d2/gr7.gif gr7 gr7.gif gif 11637 453 255 IMAGE-DOWNSAMPLED 1-s2.0-S138111690500508X-gr7.sml https://s3.amazonaws.com/prod-ucs-content-store-us-east/content/pii:S138111690500508X/gr7/THUMBNAIL/image/gif/1cac5d4a425bf63f4a1ef5684232f6cc/gr7.sml https://s3-eu-west-1.amazonaws.com/prod-ucs-content-store-eu-west/content/pii:S138111690500508X/gr7/THUMBNAIL/image/gif/1cac5d4a425bf63f4a1ef5684232f6cc/gr7.sml gr7 gr7.sml sml 1054 92 52 IMAGE-THUMBNAIL 1-s2.0-S138111690500508X-gr10.jpg https://s3.amazonaws.com/prod-ucs-content-store-us-east/content/pii:S138111690500508X/gr10/DOWNSAMPLED/image/jpeg/a3bfceb55646cd45c2e7538de2723dc6/gr10.jpg https://s3-eu-west-1.amazonaws.com/prod-ucs-content-store-eu-west/content/pii:S138111690500508X/gr10/DOWNSAMPLED/image/jpeg/a3bfceb55646cd45c2e7538de2723dc6/gr10.jpg gr10 gr10.jpg jpg 18423 273 300 IMAGE-DOWNSAMPLED 1-s2.0-S138111690500508X-gr10.sml https://s3.amazonaws.com/prod-ucs-content-store-us-east/content/pii:S138111690500508X/gr10/THUMBNAIL/image/gif/993f35438f782623b19edc96b1701495/gr10.sml https://s3-eu-west-1.amazonaws.com/prod-ucs-content-store-eu-west/content/pii:S138111690500508X/gr10/THUMBNAIL/image/gif/993f35438f782623b19edc96b1701495/gr10.sml gr10 gr10.sml sml 2178 93 102 IMAGE-THUMBNAIL MOLCAA 5427 S1381-1169(05)00508-X 10.1016/j.molcata.2005.07.036 Elsevier B.V. Fig. 1 Oxygen uptake plotted as a function of V2O5 loading on Al2O3–ZrO2 support T ads = T red =643K. Fig. 2 Electron spin resonance spectra of V2O5/Al2O3–ZrO2 catalysts. Fig. 3 Temperature-programmed reduction profiles of pure V2O5 and V2O5/Al2O3–ZrO2 catalysts. Fig. 4 XPS O 1s binding energy for Al2O3–ZrO2 support and V2O5/Al2O3–ZrO2 catalysts. Fig. 5 Zr 3d XPS of the Al2O3–ZrO2 support and V2O5/Al2O3–ZrO2 Catalysts. Fig. 6 Al 2p XPS of the Al2O3–ZrO2 support and V2O5/Al2O3–ZrO2 catalysts. Fig. 7 V 2p XPS of V2O5/Al2O3–ZrO2 catalysts. Fig. 8 XPS intensity ratio versus V2O5 loading for the V2O5/Al2O3–ZrO2. Fig. 9 UV–vis diffuse reflectance spectra of the V2O5/Al2O3–ZrO2 catalysts. Fig. 10 Ammoxidation of toluene over various V2O5/Al2O3–ZrO2 catalysts (reaction temperature 643K). Fig. 11 Dependence of turn over frequency (TOF) on surface vanadia content. Table 1 Oxygen uptake, dispersion, oxygen atom site density and surface areas of V2O5/Al2O3–ZrO2 catalysts S. No. V2O5 on Al2O3–ZrO2 (wt.%) BET surface area (m2 g−1) Oxygen uptake a (μmolg−1) Oxygen atom site density (1018 m−2) Dispersion b (O/V) 1 2.50 140 127 1.1 92 2 5.00 128 239 2.3 87 3 7.50 121 341 3.4 83 4 10.0 117 411 4.2 75 5 12.5 114 491 5.2 71 6 15.0 102 518 6.1 63 7 20.0 94 567 7.3 52 a T (reduction)= T (adsorption)=643K. b Dispersion: fraction of vanadium atoms at the surface assuming Oads/Vsurf =1. Table 2 Spin Hamiltonian parameters of V4+ in V2O5/Al2O3–ZrO2 catalysts S. No. V2O5 on Al2O3–ZrO2 (wt.%) g ∥ A ∥ (Gauss) g ⊥ A ⊥ (Gauss) 1 2.50 1.972 196 1.989 71.0 2 5.00 1.980 177 1.989 64.5 4 10.0 1.988 191 1.992 67.5 5 12.5 1.984 182 1.991 65.3 6 15.0 1.987 176 1.989 64.3 7 20.0 1.986 177 1.989 61.3 Table 3 Temperature-programmed reduction of V2O5/Al2O3–ZrO2 catalysts S. No. V2O5 on Al2O3–ZrO2 (wt.%) T Red (K) H2 consumption (μmolg−1) 1 2.50 778 263 2 5.00 793 544 3 7.50 803 825 4 10.0 788 1071 5 12.5 809 1383 6 15.0 814 1660 Table 4 Binding energies (eV), FWHM, XPS atomic ratios of O 1s, Zr 3d5/2 Al 2p3/2 and V 2p3/2 for V2O5/Al2O3–ZrO2 catalysts V2O5 on Al2O3–ZrO2 (wt.%) O 1s position Position and FWHM a of Zr 3d5/2 Position and FWHM of Al 2p3/2 Position and FWHM of V 2p3/2 XPS Intensity V 2p/Zr 3d XPS Intensity V 2p/Al 2p 0 532.1 182.9(1.7) 75.4(2.1) – – – 2.5 532.0 183.2(1.8) 75.6(2.1) 518.1(2.1) 0.234 0.084 7.5 531.7 183.3(1.7) 75.7(1.9) 518.0(1.8) 0.502 0.212 10.0 531.2 182.9(1.7) 75.5(1.9) 517.9(1.7) 0.620 0.244 12.5 530.9 182.9(1.6) 75.5(1.8) 517.8(1.7) 0.765 0.254 15.0 531.3 183.0(1.6) 75.4(1.9) 518.1(1.7) 0.730 0.206 20.0 531.8 183.8(1.5) 75.7(1.9) 518.2(1.8) 0.755 0.232 a Parentheses are FWHM values. Characterization and reactivity of Al2O3–ZrO2 supported vanadium oxide catalysts Komandur V.R. Chary a ⁎ Chinthala Praveen Kumar a Dhachapally Naresh a Thallada Bhaskar b Yusaku Sakata b a Catalysis Division, Indian Institute of Chemical Technology, Hyderabad-500 007, India b Department of Applied Chemistry, Faculty of Engineering, Okayama University, 3-1-1 Tsushima Naka, 700-8530 Okayama, Japan ⁎ Corresponding author. Tel.: +91 40 27193162; fax: +91 40 27160921. Graphical abstract The Al2O3–ZrO2 mixed oxide is an interesting mixed oxide support to investigate the dispersion of vanadia and catalytic properties. Vanadium oxide supported on Al2O3–ZrO2 catalysts are found to be highly active and selective for the vapor phase ammoxidation of toluene to benzonitrile. This paper provides information on the surface species determined by various characterization techniques like oxygen chemisorption, ESR, XPS, TPR and UVDRS. Vanadium oxide catalysts with V2O5 loadings ranging from 2.5 to 20wt.% supported on Al2O3–ZrO2 (1:1wt.%) mixed oxide have been prepared by wet impregnation method. The calcined samples were characterized by X-ray diffraction (XRD), BET surface area, pulse oxygen chemisorption, electron spin resonance (ESR), temperature-programmed reduction (TPR) of H2, X-ray photoelectron spectroscopy (XPS), and UV–vis diffuse reflectance spectroscopy (UVDRS). The catalytic properties have been evaluated for vapor phase ammoxidation of toluene to benzonitrile. Dispersion of vanadia was determined by the pulse oxygen chemisorption method at 643K. Vanadia is found to be present in a highly dispersed state at lower loadings and dispersion decreases steadily with increase of vanadia loading. The ESR spectra obtained under ambient conditions shows the presence of V4+ in tetrahedral symmetry. The TPR results show a single reduction peak corresponding to V5+→V3+. XPS results reveal that vanadium is present in a fully oxidized state (+5) in all the samples. The intensity ratio V 2p3/2/Al 2p3/2 and V 2p3/2/Zr 3d5/2 is found to increase with increase in vanadia loading up to 12.5wt.% and levels off at higher vanadia loadings. The UV–vis diffuse reflectance spectra indicate the existence of isolated and clusterized tetrahedral (Td) V5+ species in all catalysts. Ammoxidation activity increases with vanadia loading up to 12.5wt.%, which corresponds to monolayer coverage and remains constant at higher vanadia loadings. The catalytic activity in ammoxidation of toluene to benzonitrile has been correlated to the oxygen chemisorption sites. Keywords Alumina–zirconia Vanadia XRD ESR XPS Ammoxidation 1 Introduction Supported vanadium oxides have been widely investigated as they represent an important group of catalysts for number of selective oxidation reactions and selective catalytic reduction of NO with NH3 [1–8]. The surface structures of vanadia supported on oxides such Al2O3, SiO2, ZrO2 and TiO2 are quite different from that of bulk vanadia. The efficiency of supported vanadium oxide catalysts mainly depends on the dispersion of the active phase, which in turn can be greatly influenced by the nature of supported oxide, the kind of promoters/additives present and the method of preparation of the catalysts. In the recent past many studies have been focused related to structural information of the supported vanadium oxides with their catalytic properties [9–14]. Several sophisticated techniques including ESR [15,16], 51V solid state NMR [15,17], electron spectroscopy for chemical analysis [10,11], extended X-ray absorption fine structure (EXAFS) [18,19] and laser Raman spectroscopy [9,11] have been employed to characterize Al2O3 and ZrO2 supported vanadium oxide catalysts in order to understand the relation between catalytic activity and structural aspects. The inherent favorable properties of both alumina and zirconia supports can be explored by the combination of both supports in a mixed oxide. Reports in the literature show that the addition of La, Zr and Si modify the alumina surface area and its thermal stability [20]. The combination of Al2O3 and ZrO2 provides greater mechanical strength, which results in improved resistance to attrition [21,22]. In recent years Al2O3–ZrO2-based materials have been employed as catalysts in numerous catalytic applications [13,23,24]. A basic knowledge of the structure–activity relationship observed in heterogeneous catalytic oxidation is of great importance for the development of new catalytic materials and for improving the performance of existing catalysts [25]. To this end, methods such as oxygen chemisorption, XPS studies etc., have been extensively used in recent years to find the active phase dispersion in supported metal oxide systems [10,15,26–28]. Gil-Llambias et al. [27] have reported a linear dependence between XPS intensity ratio of V 2p–Al 2p or Ti 2p peaks and a function of V2O5 loading. Similar observations have also been made by Meunier et al. [29]. In the present investigation, we report a systematic study on the characterization of vanadia catalysts supported on Al2O3–ZrO2 by XRD, oxygen chemisorption, ESR, TPR, UV-DRS and XPS measurements. The catalytic properties were evaluated for ammoxidation of toluene to benzonitrile. The purpose of this work is to estimate the dispersion of vanadia supported on Al2O3–ZrO2 binary oxide and also to identify the changes in the structure of vanadium oxide species as a function of an active component loading. The catalytic properties in ammoxidation of toluene were correlated with oxygen chemisorption and other characterization techniques. 2 Experimental Al2O3–ZrO2 (1:1) mixed oxide support was prepared by co-precipitation method. The requisite quantities of aqueous solutions containing aluminium nitrate hydrate (Merck), zirconyl nitrate hydrate (Merck) and diluted ammonia were continuously stirred for 6h at 343K. The precipitation was completed after 4–5h of stirring at the pH of the solution ≈9. The precipitate thus obtained was filtered, washed several times with demineralized water till it is free from nitrates. The wet cake was dried for 16h at 383K and calcined in static air at 773K for 6h. The resulting mixed oxide had BET surface area of 163m2/g. A series of V2O5 catalysts with vanadia loadings ranging from 2.5 to 20wt.% supported on Al2O3–ZrO2 were prepared by wet impregnation of the support using oxalic acid solution containing requisite amount of ammonium metavanadate (1:2 weight ratio between ammonium metavanadate and oxalic acid). The catalysts were subsequently dried at 383K for 16h and calcined in air at 773K for 6h. X-ray diffractograms of V2O5/Al2O3–ZrO2 catalysts were recorded on Bruker D-8 diffractometer using graphite filtered Cu Kα radiation (λ =1.5418Å). Oxygen chemisorption was measured by dynamic method on Auto Chem 2910 (Micromeritics, USA) instrument. Prior to adsorption measurements, 0.5g of the sample was reduced in a flow of hydrogen (50ml/min) at 643K for 2h and flushed out subsequently in a pure He flow (purity 99.995%) for an hour at the same temperature. Oxygen uptake was determined by injecting pulses of oxygen from a calibrated on-line sampling valve into a He stream passing over reduced samples at 643K. Adsorption was deemed to be complete after at least three successive peaks showed the same area. The BET surface area of the catalyst samples was measured on a Pulse Chemisorb 2700 (Micromeritics) unit by nitrogen physisorption at 77K. ESR measurements were recorded at room temperature on a Bruker ESP 300 E (X-band) spectrometer (ν =9.473GHz) with 100kHz modulations. The samples in powder form were loaded in quartz tubes (4mm internal diameter). A microwave power of 20mW and modulation amplitude of 4G was used for each measurement. TPR experiments were carried out on Auto Chem 2910 instrument. Prior to TPR studies the catalyst sample was pretreated at 673K for 2h in flowing hydrocarbon free dry air in order to eliminate the moisture and to ensure complete oxidation. After pretreatment the sample was cooled to room temperature. Carrier gas (5% hydrogen–95% argon) purified through oxy-trap and molecular sieves was allowed to pass over the sample. Temperature was increased from ambient to 1273K at a heating rate of 10K/min and the data was recorded simultaneously. The hydrogen consumption values are calculated using GRAMS/32 software. The UV–vis diffuse reflectance spectra were recorded on a GBC UV–vis Cintra 10e spectrometer with an integrating sphere reflectance accessory using pellets of 50mg catalyst sample grounded with 2.5g of KBr. The KBr was used as diluent and reference material. The accessory is a barium sulphate-coated integrating sphere with light detection by a built-in photomultifier tube attached to the base of the sphere. The sphere is supplied with spectral on reference discs to provide optimal performance across the wavelength range from 200 to 800nm. The sphere is fitted with 10mm cell holders and solid sample holders for both reference and a sample positions in order to perform the measurements of reflectance absorbance of samples placed in the rear (reflectance) solid sample holder. X-ray photoemission spectra were recorded on a KRATOS AXIS 165 equipped with Mg Kα radiation (1253.6eV) at 75W apparatus using the Mg Kα anode and a hemispherical analyzer, connected to a five-channel detector. The C 1s line at 284.6eV was used as an internal standard for the correction of binding energies. The background pressure during the data acquisition was kept below 10−10 bar. Spectra were deconvoluted using Sun Solaris based Vision 2 curve resolver. The location and the full width at half maximum (FWHM) for all species were first determined using the spectrum of a pure sample. The location and FWHM of products, which were not obtained as pure species, were adjusted until the best fit was obtained. Symmetric Gaussian shapes were used in all cases. Binding energies for identical samples were, in general, reproducible to within ±0.1eV. Calculations of the atomic ratios V/Zr and V/Al were performed by determining the V 2p3/2, Zr 3d5/2 and Al 2p3/2 peak areas, after subtracting the inelastic background and correction of intensities by the respective sensitive factors. The ammoxidation of toluene to benzonitrile reaction was carried out in a fixed-bed down-flow reactor with 20mm internal diameter made of Pyrex glass. 0.5g of the catalyst with a 18–25-mesh size diluted with an equal amount of quartz grains of the same dimensions was charged into the reactor supported on a glass wool bed. In order to minimize the adverse thermal effects, the catalyst particles were diluted to its same volume with quartz grains of similar particle size. Prior to introducing the reactant toluene with a syringe pump (B-Braun perfusor, Germany) the catalyst was reduced at 643K for 2h in hydrogen flow (40ml/min) and then the reactor was fed with toluene, ammonia and air in the molar ratio of 1:13:26. The zone above the catalyst bed was filled-up with quartz glass particles to serve as the preheater. It is heated up to 423K by way of electrical furnace for adequate vaporization of liquid feed. The reaction products benzonitrile and benzene were analyzed by HP 6890 gas chromatograph equipped with a flame ionization detector (FID) using HP-5 capillary column. 3 Results and discussion The Al2O3–ZrO2 binary oxide support prepared by co-precipitation method is found to be X-ray amorphous. Different loadings of vanadia supported on Al2O3–ZrO2 catalysts are also found to be amorphous. This observation suggests that deposited vanadia is in well dispersed state on alumina–zirconia support probably in the form of highly active monomeric VO4 units and two dimensional (V–O–V) structures [30] which seems to be responsible for the ammoxidation of toluene to benzonitrile. XRD also indicates that no compound is formed due to the interaction between V2O5 and Al2O3 or ZrO2. The surface area of the catalysts decreases with increasing vanadia content due to blocking of pores with the deposition of vanadia on pore surface of the support (Table 1 ). The oxygen uptake plotted as a function of V2O5 loading at 643K is shown in Fig. 1 for vanadia/alumina–zirconia catalysts. The oxygen uptake by alumina–zirconia support under similar conditions was found to be negligible. The oxygen uptakes were found to increase with vanadia loading up to 12.5wt.% of V2O5 and levels off at higher vanadia loadings. This can be attributed to the formation of a vanadium oxide monolayer on alumina–zirconia. The saturation level off of oxygen uptake (Fig. 1) at 12.5wt.% vanadia loading might be due to the formation of a crystalline vanadia phase. This phase upon pre-reduction with hydrogen does not appreciably chemisorb oxygen. The dashed line in Fig. 1 corresponds to an oxygen atom per a vanadium atom. The dispersion of vanadia can be defined as a fraction of total O atoms titrated (determined from oxygen uptake) to total V atoms present in the sample [15]. A substantial decrease in the dispersion of vanadia is observed with increasing V2O5 content in the catalysts. For the same composition of V2O5, the dispersion of vanadia supported on mixed alumina–zirconia support was found to be more than that of vanadia supported on simple zirconia [31] and alumina [15] supports. Electron spin resonance spectroscopy has been widely used for characterizing supported vanadia catalysts to determine the possible coordination environment i.e., symmetry of vanadium and the effect of support on vanadyl bond strength. The V4+ species in the catalysts exhibit clear eight line hyperfine splitting due to interaction between electron spin (S =+1/2) and nuclear spin (I =+7/2). It can be noticed that the spectra contains a pattern of eight parallel and eight perpendicular hyperfine components, which is a sign of vanadyl ions in axial symmetry. The ESR spectra of calcined V2O5/Al2O3–ZrO2 catalysts recorded at ambient temperature are shown in Fig. 2 . The spin Hamiltonian parameters such as g ∥, A ∥, g ⊥ and A ⊥ values are given in Table 2 . The observed components of g factor show that the g tensor of V4+ has axial symmetry. The broadening of ESR spectra at higher loadings of vanadia might be due to the presence of different surface crystalline vanadia. These results further support the vanadia dispersion determined by the oxygen chemisorption method. The high dispersion of vanadia is consistent with the appearance of a well-resolved ESR spectrum in lower vanadia loading samples. The decrease in the intensity of the ESR spectra with increasing of vanadia loading in the catalyst is attributed to spin-spin coupling. The changes in ESR spectral features with vanadia loading might be due to the presence of different vanadia species on Al2O3–ZrO2. The present ESR results are in agreement with our earlier reports [15]. The TPR profiles of bulk V2O5 and various V2O5/Al2O3–ZrO2 catalysts are shown in Fig. 3 . It was found that bulk V2O5 exhibited multiple major reduction peaks when reduced in 5% H2 +95% Ar up to 1273K. Koranne et al. [32] and Bosch et al. [33] have reported similar observations, and they have attributed this phenomenon to the following reduction sequence: V 2 O 5 ⟶ ( 1 ) V 6 O 13 ⟶ ( 2 ) V 2 O 4 ⟶ ( 3 ) V 2 O 3 The sharp peak at 965K corresponds to the reduction of V2O5 to V6O13 (first peak). The second peak at 1003K is associated with the reduction of V6O13 to V2O4, and the third peak at 1067K corresponds to V2O3 formed by the reduction of V2O4. The TPR profiles of the samples show only a single reduction peak corresponding to V5+→V3+. It is expected that particle size increases with increase in vanadia loading and the vanadia becomes difficult to reduce due to bulk diffusion limitations. This causes a shift in the TPR peaks to higher temperatures. Thus, the reduction temperature (T red) shifted to higher temperatures (778–814K) when vanadia loading was increased from 2.5 to 20wt.% (Table 3 ). This is an indication of increased particle size of microcrystalline vanadia with higher loadings. It is clear that dispersion decreases when the crystallite size increases, which is in good agreement with the fact that smaller crystallites are reduced faster than the bigger ones. The shift in reduction temperature indicates that the reducibility of vanadia decreases with loading on Al2O3–ZrO2. The reduction of bulk V2O5 occurred at much higher temperatures than Al2O3–ZrO2 supported vanadia due to increased diffusional limitations in bulk V2O5 in accordance with the above trend. This is consistent with the work of Koranne et al. [32] and Roozeboom et al. [34]. They have also shown that the supported vanadium oxide catalysts reduce at much lower temperature than bulk vanadia and the reducibility of vanadia is strongly influenced by the kind of support used. Bond et al. [35,36] also reported that the VO x monolayer species is reduced in a single step from V5+ to V3+. X-ray photoelectron spectroscopy (XPS) is highly surface sensitive technique and considered as one of the best technique for studying the dispersion of V2O5 on various supports. The nature of surface species of the V2O5/Al2O3–ZrO2 catalysts was investigated by the XPS technique (Figs. 4–7 ). The photoelectron peaks of O 1s, Zr 3d, Al 2p and V 2p are shown in Figs. 4–7, respectively. The binding energy of O 1s is observed at ∼532eV in Fig. 4. The 1s O profile is due to the overlapping contribution of oxygen from ZrO2 and Al2O3 in the case of mixed Al2O3–ZrO2 support and to ZrO2, Al2O3 and V2O5 in the case of the V2O5/Al2O3–ZrO2 catalyst samples, respectively. With the increase in vanadia loading there is a slight shift in the O 1s B.E values towards lower side. This is due to a contribution from the second O 1s component due to lattice oxygen in the added vanadium phase [37]. Fig. 5 shows the binding energies of Zr photoelectron peaks at ∼182.9 and ∼185.3eV for Zr 3d5/2 and Zr 3d3/2 lines, respectively. The binding energies of Zr 3d5/2 and its full width half maximum (FWHF) values are shown in Table 4 . These values did not change much with different vanadia loadings. The constant FWHM values are around 1.7, implying that only one type of doublet is present. This provides evidence for the presence of a single type of zirconium oxide with an oxidation state of 4+. The intensity of Zr 3d core level spectra does not change much with the increase in vanadia loading. Fig. 6 shows the binding energy of Al 2p photoelectron peak at ∼75.5eV for Al 2p3/2, which is in agreement with the values reported in the literature [38]. There is a slight increase in the binding energies of Zr 3d and Al 2p in supported vanadia catalysts. This can be attributed to the strong interactions between the vanadium oxide and support oxides. The binding energies of Al 2p3/2 and its FWHM values are reported in Table 4. The constant binding energies of Al 2p3/2 and FWHM values indicate the presence of one type of aluminium oxide with an oxidation state of 3+. The V 2p photoelectron peaks of vanadia catalysts at ∼517.9 and ∼524.2eV correspond to the V 2p3/2 and V 2p1/2 states are shown in Fig. 7. Increasing the vanadia loading does not change in the peak parameters (Table 4), suggesting that only one type of vanadium oxide with +5 oxidation state is present in all the samples. There has been some discussion over the years about the oxidation state of the surface vanadia species in calcined supported vanadia catalysts [39]. Only V (5+) is observed in calcined supported vanadia catalysts by XPS, when the sample is not artificially reduced by the measuring conditions. Traces of V (4+) are also present and not detected by XPS. It is well known that V (5+) does not have any unpaired electrons and no EPR signals where as V (4+) is EPR active. Thus, calcined supported vanadia catalysts possess V (5+) species and with trace amounts of V (4+) species [39,40]. The surface atomic ratios were calculated from the XPS peak intensity ratios, normalized by atomic sensitivity factors [41]. Fig. 8 indicates that there is a surface enrichment of V with respect to Zr or Al. At higher vanadia contents, the surface V/Zr and V/Al ratio remains practically constant or increases very little. This reveals that at 12.5wt.% vanadia and above loadings there is a segregation of vanadium oxide. The relative dispersion of vanadium on the support surface also determined from XPS measurements of the V2O5/Al2O3–ZrO2 catalysts presented in Table 4 and Fig. 8. The XPS data were quantified for V/Zr and V/Al atomic ratios. It is evident form Fig. 8 that V/Zr and V/Al atomic ratio is not proportional to the vanadia loading. Up to 12.5wt.% monolayer loading, the increase in the atomic ratio is almost linear, which indicates a high dispersion of vanadia below monolayer loading. At higher loadings, the V/Al ratio is constant and no appreciable surface enrichment of V/Zr atomic ratios is observed. This confirms the formation of agglomerates and crystallites at higher vanadia loadings. These results are in agreement with the studies of Huuhtanen and Andersson [37] and confirm that at low vanadia loadings dispersion is high and at higher loadings the dispersion decreases. The activity of the catalysts in the ammoxidation of toluene to benzonitrile was also found to increase up to 12.5wt.% loading and leveled off at higher loadings. The DR-UV–vis spectra of V2O5/Al2O3–ZrO2 catalysts are shown in Fig. 9 . The charge transfer (CT) spectra of V5+ ions (d 0) were recorded between 200 and 800nm for Al2O3–ZrO2 supported VO x catalysts containing 2.5–20wt.% of V2O5. In all the catalysts the spectrum is dominated by two charge transfer (CT) bands of V5+ (d 0) at 288 and 367nm (Fig. 9). The energy of oxygen→vanadium charge transfer absorption band, which is correlated with the minimum diffuse reflectance, is strongly influenced by the number of ligands surrounding the central vanadium ion. Thus, it can be used to obtain very useful information on the coordination of vanadium ions in different surface species [42,43]. The spectral features of the catalysts, consisting of an absorption band at 288nm arise from the charge transfer in di- or oligo-meric structures formed by the condensation of monomeric species and V5+ ion in tetrahedral coordination [43]. The blue shift of this band has been observed from 288 to 311nm with increase in vanadia loadings. In all the systems the charge transfer band at ∼375nm is due to V5+ ions coordinated by five oxygen ligands in the form of a square pyramidal [43]. The results of ammoxidation of toluene at 643K over various V2O5/Al2O3–ZrO2 catalysts are presented in Fig. 10 . The conversion of toluene was found to increase with increase of vanadia loading up to 12.5wt.% vanadia, and decreases at higher vanadia loadings. The decrease in activity of the catalysts beyond 12.5wt.% is due to agglomeration of V2O5 micro crystallites or completion of monolayer. Thus, the findings of oxygen chemisorption and XPS results further support the catalytic properties. The selectivity of benzonitrile formation is found to be independent of vanadia content in the catalyst. In the present study the catalysts have been pre-reduced in hydrogen and thus the reduced surface contains V4+ stabilized on alumina–zirconia surface. Experiments were conducted to establish the effect of mass transfer limitations during the ammoxidation reaction. The mass transfer limitations were evaluated using the Madon and Boudart test [44,45]. The rate of ammoxidation increased proportionally with the weight of catalysts indicating absence of any mass transfer limitations during the reaction. The rate of conversion of toluene (at a reaction temperature of 643K and molar ratio of toluene:NH3:air=1:13:26) has been expressed interms of rate of toluene molecules converted per second per surface of V2O5 molecule, which termed as turn over frequency (TOF). This has been calculated by considering the dispersion of V2O5 obtained from oxygen chemisorption at 643K. A plot of turn over frequency versus the surface vanadia content is shown in Fig. 11 . The TOF was found to be almost constant (≈5.35×10−3 S−1) up to 10wt.% V2O5 and decreases at higher vanadia loadings. Up to 10wt.% V2O5 loading, per site activity (constant TOF) is constant with increase in surface vanadia sites. The decrease in TOF beyond 10wt.% V2O5 loading indicates the formation of crystalline V2O5 particles. 4 Conclusions The Al2O3–ZrO2 binary oxide is an interesting support to investigate the dispersion of vanadium oxide and catalytic properties. The oxygen chemisorption results suggested that vanadium oxide is highly dispersed on Al2O3–ZrO2 support at lower vanadia loadings and the dispersion decreases with increase in vanadia loadings. XPS results further support the above findings. XPS results indicated the presence of V5+ in all the catalysts and did not show any reducible species. TPR results indicated that the reducibility of vanadia decreases with increase of vanadia loading. Al2O3–ZrO2 was found to be a competent support and it plays an important role in the enhancement of V2O5 activity in the ammoxidation of toluene. Acknowledgements KVRC Thanks Royal Society of Chemistry, UK for the award of RSC Journals grant for international authors. CHPK thanks Council of Scientific and Industrial research (CSIR), New Delhi for the award of Senior Research Fellowship (SRF). References [1] S. Park R.J. Gorte J.M. Vohs Appl. Catal. A: Gen. 200 2000 55 [2] A. Martin B. Lucke Catal. Today 57 2000 61 [3] K.V.R. Chary G. Kishan T. Bhaskar Ch. Sivaraj J. Phys. Chem. 102 1998 6792 [4] P. Cavani F. Cavani I. Manenti F. Trifiro Catal. Today. 1 1987 245 [5] A. Andersson S.T. Lundin J. Catal. 58 1979 383 [6] P. Cavalli F. Cavani I. Manenti F. Trifiro Ind. Eng. Chem. Res. 26 1987 639 [7] A. Andersson S.T. Lundin J. Catal. 58 1979 383 [8] A. Andersson P. Jan-Olov Bovin Walter J. Catal. 98 1986 204 [9] G.T. Went L.J. Leu A.T. Bell J. Catal. 134 1992 479 [10] N.K. Nag F.E. Massoth J. Catal. 124 1990 127 [11] C.L. Pieck S. del Val M. Lopez Granados M.A. Banares J.L.G. Fierro Langmuir 18 2002 2642 [12] K.V.R. Chary B.M. Reddy N.K. Nag V.S. Subrahmanyam C.S. Sundanda J. Phys. Chem. 88 1984 2622 [13] J.L. Lakshmi N.J. Ihasz J.B. Miller J. Mol. Catal. A: Chem. 165 2001 199 [14] A.W. Stobbe-Kreemers G.C. Van Leerdam J.P. Jacobs H.H. Brongersma J.J.F. Scholten J. Catal. 152 1995 130 [15] K.V.R. Chary G. Kishan J. Phys. Chem. 99 1995 14424 [16] A. Adamski Z. Sojka K. Direk M. Che Solid State Ionics 117 1999 113 [17] H. Eckert I.E. Wachs J. Phys. Chem. 93 1989 6796 [18] R. Kozlowski R.F. Pettifer J.M. Thomas J. Phys. Chem. 87 1983 5176 [19] T. Tanaka H. Yamashita R. Tsuchitani T. Funabiki S. Yoshida J. Chem. Soc. Faraday Trans. 1 84 1988 2987 [20] H. Schaper E.B.M. Doesburg L.L. Van Reigen Appl. Catal. A: Gen. 7 1983 211 [21] A. Sahibed-Dine B. Bouanis K. Nohair M. Bensitel Ceram. Int. 28 2002 159 [22] S.C. Farmer A. Sayir Eng. Fract. Mech. 69 2002 1015 [23] J.M. Dominguez J.L. Hernandez G. Sandoval Appl. Catal. A: Gen. 197 2000 119 [24] C. Larese J.M. Campos-Martin J.J. Calvino G. Blanco J.L.G. Fierro Z.C. Kang J. Catal. 208 2002 467 [25] I. Peeters A.W. Denier van der Gon M.A. Reijme P.J. Kooyman A.M. de Jong J. Van Grondelle H.H. Brongersma R.A. Van Santen J. Catal. 173 1998 28 [26] F. Arena F. Frusteri A. Parmaliana Appl. Catal. A 176 1999 189 [27] F.J. Gil-Llambias A.M. Escuday J.L.G. Fierro A. Lopez- Agudo J. Catal. 95 1985 520 [28] M.A. Eberhardt A. Proctor M. Houalla D.M. Hercules J. Catal. 160 1996 27 [29] G. Meunier B. Mocaer S. Kasztelan L.R. Le Coustumer J. Grimblot J.P. Bonelle Appl. Catal. 21 1986 329 [30] I.E. Wachs Catal. Today 27 1996 437 [31] K.V.R. Chary G. Kishan K.V. Narayana T. Bhaskar J. Chem. Res. (S) 1998 314 [32] M.M. Koranne J.G. Goodwin Jr. G. Marcelin J. Catal. 148 1994 369 [33] H. Bosch B.J. Kip J.G. van Ommen P.J. Gellings J. Chem. Soc. Faraday Trans. 1 80 1984 2479 [34] F.J. Roozeboom M.C. Mittlemeijer-Hazeleger J.A. Mouljin M. Medema V.H.J. de beer P.J. Gellings J. Phys. Chem. B. 84 1980 2783 [35] C.R. Dias M.F. Portela G.C. Bond J. Catal. 157 1995 344 [36] G.C. Bond Appl. Catal. A. 157 1997 91 [37] J. Huuhtanen S.L.T. Andersson Appl. Catal. 98 1993 159 [38] C.D. Wagner W.M. Riggs I.E. Davis J.F. Moulder G.E. Muilenberg Handbook of X-ray Photoelectron Spectroscopy 1978 Perkin-Elmer Corporation Minnesota [39] G.C. Bond J.C. Vedrine Catal. Today 27 1996 437 [40] I.E. Wachs B.M. Weckhuysen Appl. Catal. A: Gen. 157 1997 67 [41] C.D. Wagner L.E. Davis M.V. Zeller J.A. Taylor R.H. Raymond L.H. Gale Surf. Interface Anal. 3 1981 211 [42] G. Centi S. Perathoner F. Trifiro A. Aboukais C.F. Aissi M. Guelton J. Phys. Chem. 96 1992 2617 [43] M. Schraml-Marth A. Wokaum M. Pohl H.L. Krauss J. Chem. Soc. Faraday. Trans. 87 1991 2635 [44] R.J. Madon M. Boudart Ind. Eng. Chem. Fund. 21 1982 438 [45] U.K. Singh M.A. Vannice Appl. Catal. A: Gen. 213 2001 1",
      "scopus-id": "29144471882",
      "coredata": {
        "eid": "1-s2.0-S138111690500508X",
        "dc:description": "Vanadium oxide catalysts with V2O5 loadings ranging from 2.5 to 20wt.% supported on Al2O3–ZrO2 (1:1wt.%) mixed oxide have been prepared by wet impregnation method. The calcined samples were characterized by X-ray diffraction (XRD), BET surface area, pulse oxygen chemisorption, electron spin resonance (ESR), temperature-programmed reduction (TPR) of H2, X-ray photoelectron spectroscopy (XPS), and UV–vis diffuse reflectance spectroscopy (UVDRS). The catalytic properties have been evaluated for vapor phase ammoxidation of toluene to benzonitrile. Dispersion of vanadia was determined by the pulse oxygen chemisorption method at 643K. Vanadia is found to be present in a highly dispersed state at lower loadings and dispersion decreases steadily with increase of vanadia loading. The ESR spectra obtained under ambient conditions shows the presence of V4+ in tetrahedral symmetry. The TPR results show a single reduction peak corresponding to V5+→V3+. XPS results reveal that vanadium is present in a fully oxidized state (+5) in all the samples. The intensity ratio V 2p3/2/Al 2p3/2 and V 2p3/2/Zr 3d5/2 is found to increase with increase in vanadia loading up to 12.5wt.% and levels off at higher vanadia loadings. The UV–vis diffuse reflectance spectra indicate the existence of isolated and clusterized tetrahedral (Td) V5+ species in all catalysts. Ammoxidation activity increases with vanadia loading up to 12.5wt.%, which corresponds to monolayer coverage and remains constant at higher vanadia loadings. The catalytic activity in ammoxidation of toluene to benzonitrile has been correlated to the oxygen chemisorption sites.",
        "openArchiveArticle": "false",
        "prism:coverDate": "2006-01-16",
        "openaccessUserLicense": null,
        "prism:aggregationType": "Journal",
        "prism:url": "https://api.elsevier.com/content/article/pii/S138111690500508X",
        "dc:creator": [
          {
            "@_fa": "true",
            "$": "Chary, Komandur V.R."
          },
          {
            "@_fa": "true",
            "$": "Kumar, Chinthala Praveen"
          },
          {
            "@_fa": "true",
            "$": "Naresh, Dhachapally"
          },
          {
            "@_fa": "true",
            "$": "Bhaskar, Thallada"
          },
          {
            "@_fa": "true",
            "$": "Sakata, Yusaku"
          }
        ],
        "link": [
          {
            "@_fa": "true",
            "@rel": "self",
            "@href": "https://api.elsevier.com/content/article/pii/S138111690500508X"
          },
          {
            "@_fa": "true",
            "@rel": "scidir",
            "@href": "https://www.sciencedirect.com/science/article/pii/S138111690500508X"
          }
        ],
        "dc:format": "application/json",
        "openaccessType": null,
        "pii": "S1381-1169(05)00508-X",
        "prism:volume": "243",
        "prism:publisher": "Elsevier B.V.",
        "dc:title": "Characterization and reactivity of Al2O3–ZrO2 supported vanadium oxide catalysts",
        "prism:copyright": "Copyright © 2005 Elsevier B.V. All rights reserved.",
        "openaccess": "0",
        "prism:issn": "13811169",
        "prism:issueIdentifier": "2",
        "dcterms:subject": [
          {
            "@_fa": "true",
            "$": "Alumina–zirconia"
          },
          {
            "@_fa": "true",
            "$": "Vanadia"
          },
          {
            "@_fa": "true",
            "$": "XRD"
          },
          {
            "@_fa": "true",
            "$": "ESR"
          },
          {
            "@_fa": "true",
            "$": "XPS"
          },
          {
            "@_fa": "true",
            "$": "Ammoxidation"
          }
        ],
        "openaccessArticle": "false",
        "prism:publicationName": "Journal of Molecular Catalysis A: Chemical",
        "prism:number": "2",
        "openaccessSponsorType": null,
        "prism:pageRange": "149-157",
        "prism:endingPage": "157",
        "pubType": "fla",
        "prism:coverDisplayDate": "16 January 2006",
        "prism:doi": "10.1016/j.molcata.2005.07.036",
        "prism:startingPage": "149",
        "dc:identifier": "doi:10.1016/j.molcata.2005.07.036",
        "openaccessSponsorName": null
      },
      "objects": {
        "object": [
          {
            "@category": "thumbnail",
            "@height": "22",
            "@width": "239",
            "@_fa": "true",
            "$": "https://api.elsevier.com/content/object/eid/1-s2.0-S138111690500508X-si1.gif?httpAccept=%2A%2F%2A",
            "@multimediatype": "GIF image file",
            "@type": "ALTIMG",
            "@size": "967",
            "@ref": "si1",
            "@mimetype": "image/gif"
          },
          {
            "@category": "standard",
            "@height": "748",
            "@width": "249",
            "@_fa": "true",
            "$": "https://api.elsevier.com/content/object/eid/1-s2.0-S138111690500508X-gr3.gif?httpAccept=%2A%2F%2A",
            "@multimediatype": "GIF image file",
            "@type": "IMAGE-DOWNSAMPLED",
            "@size": "13818",
            "@ref": "gr3",
            "@mimetype": "image/gif"
          },
          {
            "@category": "thumbnail",
            "@height": "93",
            "@width": "31",
            "@_fa": "true",
            "$": "https://api.elsevier.com/content/object/eid/1-s2.0-S138111690500508X-gr3.sml?httpAccept=%2A%2F%2A",
            "@multimediatype": "GIF image file",
            "@type": "IMAGE-THUMBNAIL",
            "@size": "656",
            "@ref": "gr3",
            "@mimetype": "image/gif"
          },
          {
            "@category": "standard",
            "@height": "474",
            "@width": "258",
            "@_fa": "true",
            "$": "https://api.elsevier.com/content/object/eid/1-s2.0-S138111690500508X-gr5.gif?httpAccept=%2A%2F%2A",
            "@multimediatype": "GIF image file",
            "@type": "IMAGE-DOWNSAMPLED",
            "@size": "11814",
            "@ref": "gr5",
            "@mimetype": "image/gif"
          },
          {
            "@category": "thumbnail",
            "@height": "94",
            "@width": "51",
            "@_fa": "true",
            "$": "https://api.elsevier.com/content/object/eid/1-s2.0-S138111690500508X-gr5.sml?httpAccept=%2A%2F%2A",
            "@multimediatype": "GIF image file",
            "@type": "IMAGE-THUMBNAIL",
            "@size": "1072",
            "@ref": "gr5",
            "@mimetype": "image/gif"
          },
          {
            "@category": "standard",
            "@height": "263",
            "@width": "308",
            "@_fa": "true",
            "$": "https://api.elsevier.com/content/object/eid/1-s2.0-S138111690500508X-gr11.jpg?httpAccept=%2A%2F%2A",
            "@multimediatype": "JPEG image file",
            "@type": "IMAGE-DOWNSAMPLED",
            "@size": "14189",
            "@ref": "gr11",
            "@mimetype": "image/jpeg"
          },
          {
            "@category": "thumbnail",
            "@height": "93",
            "@width": "109",
            "@_fa": "true",
            "$": "https://api.elsevier.com/content/object/eid/1-s2.0-S138111690500508X-gr11.sml?httpAccept=%2A%2F%2A",
            "@multimediatype": "GIF image file",
            "@type": "IMAGE-THUMBNAIL",
            "@size": "1964",
            "@ref": "gr11",
            "@mimetype": "image/gif"
          },
          {
            "@category": "standard",
            "@height": "263",
            "@width": "297",
            "@_fa": "true",
            "$": "https://api.elsevier.com/content/object/eid/1-s2.0-S138111690500508X-gr1.jpg?httpAccept=%2A%2F%2A",
            "@multimediatype": "JPEG image file",
            "@type": "IMAGE-DOWNSAMPLED",
            "@size": "16299",
            "@ref": "gr1",
            "@mimetype": "image/jpeg"
          },
          {
            "@category": "thumbnail",
            "@height": "93",
            "@width": "105",
            "@_fa": "true",
            "$": "https://api.elsevier.com/content/object/eid/1-s2.0-S138111690500508X-gr1.sml?httpAccept=%2A%2F%2A",
            "@multimediatype": "GIF image file",
            "@type": "IMAGE-THUMBNAIL",
            "@size": "2168",
            "@ref": "gr1",
            "@mimetype": "image/gif"
          },
          {
            "@category": "standard",
            "@height": "325",
            "@width": "257",
            "@_fa": "true",
            "$": "https://api.elsevier.com/content/object/eid/1-s2.0-S138111690500508X-gr9.gif?httpAccept=%2A%2F%2A",
            "@multimediatype": "GIF image file",
            "@type": "IMAGE-DOWNSAMPLED",
            "@size": "8675",
            "@ref": "gr9",
            "@mimetype": "image/gif"
          },
          {
            "@category": "thumbnail",
            "@height": "94",
            "@width": "74",
            "@_fa": "true",
            "$": "https://api.elsevier.com/content/object/eid/1-s2.0-S138111690500508X-gr9.sml?httpAccept=%2A%2F%2A",
            "@multimediatype": "GIF image file",
            "@type": "IMAGE-THUMBNAIL",
            "@size": "1374",
            "@ref": "gr9",
            "@mimetype": "image/gif"
          },
          {
            "@category": "standard",
            "@height": "75",
            "@width": "205",
            "@_fa": "true",
            "$": "https://api.elsevier.com/content/object/eid/1-s2.0-S138111690500508X-fx1.gif?httpAccept=%2A%2F%2A",
            "@multimediatype": "GIF image file",
            "@type": "IMAGE-DOWNSAMPLED",
            "@size": "1746",
            "@ref": "fx1",
            "@mimetype": "image/gif"
          },
          {
            "@category": "thumbnail",
            "@height": "46",
            "@width": "125",
            "@_fa": "true",
            "$": "https://api.elsevier.com/content/object/eid/1-s2.0-S138111690500508X-fx1.sml?httpAccept=%2A%2F%2A",
            "@multimediatype": "GIF image file",
            "@type": "IMAGE-THUMBNAIL",
            "@size": "872",
            "@ref": "fx1",
            "@mimetype": "image/gif"
          },
          {
            "@category": "standard",
            "@height": "255",
            "@width": "298",
            "@_fa": "true",
            "$": "https://api.elsevier.com/content/object/eid/1-s2.0-S138111690500508X-gr8.jpg?httpAccept=%2A%2F%2A",
            "@multimediatype": "JPEG image file",
            "@type": "IMAGE-DOWNSAMPLED",
            "@size": "16312",
            "@ref": "gr8",
            "@mimetype": "image/jpeg"
          },
          {
            "@category": "thumbnail",
            "@height": "93",
            "@width": "109",
            "@_fa": "true",
            "$": "https://api.elsevier.com/content/object/eid/1-s2.0-S138111690500508X-gr8.sml?httpAccept=%2A%2F%2A",
            "@multimediatype": "GIF image file",
            "@type": "IMAGE-THUMBNAIL",
            "@size": "2217",
            "@ref": "gr8",
            "@mimetype": "image/gif"
          },
          {
            "@category": "standard",
            "@height": "467",
            "@width": "257",
            "@_fa": "true",
            "$": "https://api.elsevier.com/content/object/eid/1-s2.0-S138111690500508X-gr6.gif?httpAccept=%2A%2F%2A",
            "@multimediatype": "GIF image file",
            "@type": "IMAGE-DOWNSAMPLED",
            "@size": "10158",
            "@ref": "gr6",
            "@mimetype": "image/gif"
          },
          {
            "@category": "thumbnail",
            "@height": "93",
            "@width": "51",
            "@_fa": "true",
            "$": "https://api.elsevier.com/content/object/eid/1-s2.0-S138111690500508X-gr6.sml?httpAccept=%2A%2F%2A",
            "@multimediatype": "GIF image file",
            "@type": "IMAGE-THUMBNAIL",
            "@size": "983",
            "@ref": "gr6",
            "@mimetype": "image/gif"
          },
          {
            "@category": "standard",
            "@height": "849",
            "@width": "263",
            "@_fa": "true",
            "$": "https://api.elsevier.com/content/object/eid/1-s2.0-S138111690500508X-gr2.gif?httpAccept=%2A%2F%2A",
            "@multimediatype": "GIF image file",
            "@type": "IMAGE-DOWNSAMPLED",
            "@size": "19421",
            "@ref": "gr2",
            "@mimetype": "image/gif"
          },
          {
            "@category": "thumbnail",
            "@height": "94",
            "@width": "29",
            "@_fa": "true",
            "$": "https://api.elsevier.com/content/object/eid/1-s2.0-S138111690500508X-gr2.sml?httpAccept=%2A%2F%2A",
            "@multimediatype": "GIF image file",
            "@type": "IMAGE-THUMBNAIL",
            "@size": "715",
            "@ref": "gr2",
            "@mimetype": "image/gif"
          },
          {
            "@category": "standard",
            "@height": "492",
            "@width": "255",
            "@_fa": "true",
            "$": "https://api.elsevier.com/content/object/eid/1-s2.0-S138111690500508X-gr4.gif?httpAccept=%2A%2F%2A",
            "@multimediatype": "GIF image file",
            "@type": "IMAGE-DOWNSAMPLED",
            "@size": "11486",
            "@ref": "gr4",
            "@mimetype": "image/gif"
          },
          {
            "@category": "thumbnail",
            "@height": "93",
            "@width": "48",
            "@_fa": "true",
            "$": "https://api.elsevier.com/content/object/eid/1-s2.0-S138111690500508X-gr4.sml?httpAccept=%2A%2F%2A",
            "@multimediatype": "GIF image file",
            "@type": "IMAGE-THUMBNAIL",
            "@size": "952",
            "@ref": "gr4",
            "@mimetype": "image/gif"
          },
          {
            "@category": "standard",
            "@height": "453",
            "@width": "255",
            "@_fa": "true",
            "$": "https://api.elsevier.com/content/object/eid/1-s2.0-S138111690500508X-gr7.gif?httpAccept=%2A%2F%2A",
            "@multimediatype": "GIF image file",
            "@type": "IMAGE-DOWNSAMPLED",
            "@size": "11637",
            "@ref": "gr7",
            "@mimetype": "image/gif"
          },
          {
            "@category": "thumbnail",
            "@height": "92",
            "@width": "52",
            "@_fa": "true",
            "$": "https://api.elsevier.com/content/object/eid/1-s2.0-S138111690500508X-gr7.sml?httpAccept=%2A%2F%2A",
            "@multimediatype": "GIF image file",
            "@type": "IMAGE-THUMBNAIL",
            "@size": "1054",
            "@ref": "gr7",
            "@mimetype": "image/gif"
          },
          {
            "@category": "standard",
            "@height": "273",
            "@width": "300",
            "@_fa": "true",
            "$": "https://api.elsevier.com/content/object/eid/1-s2.0-S138111690500508X-gr10.jpg?httpAccept=%2A%2F%2A",
            "@multimediatype": "JPEG image file",
            "@type": "IMAGE-DOWNSAMPLED",
            "@size": "18423",
            "@ref": "gr10",
            "@mimetype": "image/jpeg"
          },
          {
            "@category": "thumbnail",
            "@height": "93",
            "@width": "102",
            "@_fa": "true",
            "$": "https://api.elsevier.com/content/object/eid/1-s2.0-S138111690500508X-gr10.sml?httpAccept=%2A%2F%2A",
            "@multimediatype": "GIF image file",
            "@type": "IMAGE-THUMBNAIL",
            "@size": "2178",
            "@ref": "gr10",
            "@mimetype": "image/gif"
          }
        ]
      },
      "link": {
        "@rel": "abstract",
        "@href": "https://api.elsevier.com/content/abstract/scopus_id/29144471882"
      }
    }
  }
}