{
  "metadata": {
    "title": "Enhancing nucleophilicity in ionic liquid [bmim]HSO<ce:inf loc=post>4</ce:inf>: A recyclable media and catalyst for the halogenation of alcohols",
    "authors": "; ; ",
    "journal": "Journal of Molecular Catalysis A: Chemical",
    "date": "2009-04-01",
    "doi": "10.1016/j.molcata.2008.11.040",
    "abstract": "",
    "uri": "https://api.elsevier.com/content/article/pii/S1381116908005608",
    "pii": "S1381116908005608"
  },
  "fulltext": {
    "full-text-retrieval-response": {
      "scopus-eid": "2-s2.0-62649090096",
      "originalText": "serial JL 271358 291210 291744 291790 291809 31 Journal of Molecular Catalysis A: Chemical JOURNALMOLECULARCATALYSISACHEMICAL 2008-12-10 2008-12-10 2010-04-16T17:45:36 1-s2.0-S1381116908005608 S1381-1169(08)00560-8 S1381116908005608 10.1016/j.molcata.2008.11.040 S300 S300.1 FULL-TEXT 1-s2.0-S1381116909X00038 2015-05-15T05:56:33.307883-04:00 0 0 20090401 2009 2008-12-10T00:00:00Z articleinfo crossmark dco dateupdated tomb dateloaded datesearch indexeddate issuelist volumelist yearnav absattachment articletitlenorm authfirstinitialnorm authfirstsurnamenorm cid cids contenttype copyright dateloadedtxt docsubtype doctype doi eid ewtransactionid hubeid issfirst issn issnnorm itemstage itemtransactionid itemweight openaccess openarchive pg pgfirst pglast pii piinorm pubdatestart pubdatetxt pubyr sortorder srctitle srctitlenorm srctype subheadings volfirst volissue webpdf webpdfpagecount figure table body acknowledge affil articletitle auth authfirstini authfull authkeywords authlast primabst ref specialabst alllist content subj ssids 1381-1169 13811169 302 302 1 2 1 2 Volume 302, Issues 1–2 5 11 14 11 14 20090401 1 April 2009 2009-04-01 2009 article fla Copyright © 2008 Elsevier B.V. All rights reserved. ENHANCINGNUCLEOPHILICITYINIONICLIQUIDBMIMHSO4ARECYCLABLEMEDIACATALYSTFORHALOGENATIONALCOHOLS GUPTA N 1 Introduction 2 Experimental 2.1 Synthesis of [bmim]HSO4 2.2 Synthesis of aryl or alkyl halides using thermal heating 2.3 Synthesis of aryl and alkyl halides using microwave energy 2.4 Recycling of the ionic liquid 3 Results and discussion 4 Conclusion Acknowledgements References WILKES 2004 11 J 2002 IONICLIQUIDSINSYNTHESIS FUKUMOTO 2006 3081 K MO 2006 4152 J YAO 2003 3395 Q HANDY 2006 4659 S OU 2006 731 W SCURTO 2006 3681 A SINGH 2006 2893 J KIM 2003 4281 D CROWHURST 2004 11549 L CAVAZZA 2004 3633 M JUDEH 2002 9381 Z CHIAPPE 2003 6710 C REN 2001 3727 R LANCASTER 2004 5986 N WHEELER 2001 887 C KIM 2002 10278 D MAKOSZA 2000 1399 M DOCKX 1973 441 J KAD 1997 1079 G YUE 1991 5451 E LAROCK 1989 R COMPREHENSIVEORGANICTRANSFORMATIONS SCHWESINGER 1987 1167 R KUNISHIMA 1997 7542 M SANFILIPPO 1982 2831 J KUIVILA 1985 416 H DIEDERICH 1998 F METALCATALYSEDCROSSCOUPLINGREACTIONS LI 2003 J NAMEREACTIONSACOLLECTIONDETAILEDREACTIONMECHANISMS KIM 2004 3186 D SINGH 2005 57 V GUPTA 2007 1323 N KANG 1985 1161 S LEADBEATER 2002 3145 N GUPTAX2009X11 GUPTAX2009X11X14 GUPTAX2009X11XN GUPTAX2009X11X14XN item S1381-1169(08)00560-8 S1381116908005608 1-s2.0-S1381116908005608 10.1016/j.molcata.2008.11.040 271358 2010-09-21T22:44:13.022206-04:00 2009-04-01 1-s2.0-S1381116908005608-main.pdf https://s3.amazonaws.com/prod-ucs-content-store-us-east/content/pii:S1381116908005608/MAIN/application/pdf/ead63d94f5f6356f224740d2a5892ae6/main.pdf https://s3-eu-west-1.amazonaws.com/prod-ucs-content-store-eu-west/content/pii:S1381116908005608/MAIN/application/pdf/ead63d94f5f6356f224740d2a5892ae6/main.pdf main.pdf pdf true 195527 MAIN 4 1-s2.0-S1381116908005608-main_1.png https://s3.amazonaws.com/prod-ucs-content-store-us-east/content/pii:S1381116908005608/PREVIEW/image/png/d8a484d2d302c9d77cb2ad1faefca07e/main_1.png https://s3-eu-west-1.amazonaws.com/prod-ucs-content-store-eu-west/content/pii:S1381116908005608/PREVIEW/image/png/d8a484d2d302c9d77cb2ad1faefca07e/main_1.png main_1.png png 56274 849 656 IMAGE-WEB-PDF 1 1-s2.0-S1381116908005608-sc1.jpg https://s3.amazonaws.com/prod-ucs-content-store-us-east/content/pii:S1381116908005608/sc1/DOWNSAMPLED/image/jpeg/ca746a619a8ea4c61b33eaa7a2903afb/sc1.jpg https://s3-eu-west-1.amazonaws.com/prod-ucs-content-store-eu-west/content/pii:S1381116908005608/sc1/DOWNSAMPLED/image/jpeg/ca746a619a8ea4c61b33eaa7a2903afb/sc1.jpg sc1 sc1.jpg jpg 4799 66 376 IMAGE-DOWNSAMPLED 1-s2.0-S1381116908005608-sc1.sml https://s3.amazonaws.com/prod-ucs-content-store-us-east/content/pii:S1381116908005608/sc1/THUMBNAIL/image/gif/dce507d56d92ad2d1c11d404cb8ff3aa/sc1.sml https://s3-eu-west-1.amazonaws.com/prod-ucs-content-store-eu-west/content/pii:S1381116908005608/sc1/THUMBNAIL/image/gif/dce507d56d92ad2d1c11d404cb8ff3aa/sc1.sml sc1 sc1.sml sml 983 38 219 IMAGE-THUMBNAIL 1-s2.0-S1381116908005608-sc2.jpg https://s3.amazonaws.com/prod-ucs-content-store-us-east/content/pii:S1381116908005608/sc2/DOWNSAMPLED/image/jpeg/cbc626ad02e3e790efa8c31c2da03319/sc2.jpg https://s3-eu-west-1.amazonaws.com/prod-ucs-content-store-eu-west/content/pii:S1381116908005608/sc2/DOWNSAMPLED/image/jpeg/cbc626ad02e3e790efa8c31c2da03319/sc2.jpg sc2 sc2.jpg jpg 5923 48 376 IMAGE-DOWNSAMPLED 1-s2.0-S1381116908005608-sc2.sml https://s3.amazonaws.com/prod-ucs-content-store-us-east/content/pii:S1381116908005608/sc2/THUMBNAIL/image/gif/fdac391a4b777916722ad6af4e64aba6/sc2.sml https://s3-eu-west-1.amazonaws.com/prod-ucs-content-store-eu-west/content/pii:S1381116908005608/sc2/THUMBNAIL/image/gif/fdac391a4b777916722ad6af4e64aba6/sc2.sml sc2 sc2.sml sml 1054 28 219 IMAGE-THUMBNAIL 1-s2.0-S1381116908005608-gr1.jpg https://s3.amazonaws.com/prod-ucs-content-store-us-east/content/pii:S1381116908005608/gr1/DOWNSAMPLED/image/jpeg/38b62d7b9e39576588c88eccb73b987c/gr1.jpg https://s3-eu-west-1.amazonaws.com/prod-ucs-content-store-eu-west/content/pii:S1381116908005608/gr1/DOWNSAMPLED/image/jpeg/38b62d7b9e39576588c88eccb73b987c/gr1.jpg gr1 gr1.jpg jpg 9795 160 333 IMAGE-DOWNSAMPLED 1-s2.0-S1381116908005608-gr1.sml https://s3.amazonaws.com/prod-ucs-content-store-us-east/content/pii:S1381116908005608/gr1/THUMBNAIL/image/gif/5afcb1e4fbef49807e577cec356a2624/gr1.sml https://s3-eu-west-1.amazonaws.com/prod-ucs-content-store-eu-west/content/pii:S1381116908005608/gr1/THUMBNAIL/image/gif/5afcb1e4fbef49807e577cec356a2624/gr1.sml gr1 gr1.sml sml 3369 105 219 IMAGE-THUMBNAIL 1-s2.0-S1381116908005608-fx2.gif https://s3.amazonaws.com/prod-ucs-content-store-us-east/content/pii:S1381116908005608/fx2/DOWNSAMPLED/image/gif/7cd950465bd2e66d478f1acb476329fa/fx2.gif https://s3-eu-west-1.amazonaws.com/prod-ucs-content-store-eu-west/content/pii:S1381116908005608/fx2/DOWNSAMPLED/image/gif/7cd950465bd2e66d478f1acb476329fa/fx2.gif fx2 fx2.gif gif 368 31 40 IMAGE-DOWNSAMPLED 1-s2.0-S1381116908005608-fx2.sml https://s3.amazonaws.com/prod-ucs-content-store-us-east/content/pii:S1381116908005608/fx2/THUMBNAIL/image/gif/14a13502720d2ad324d3d0dcc275c1a1/fx2.sml https://s3-eu-west-1.amazonaws.com/prod-ucs-content-store-eu-west/content/pii:S1381116908005608/fx2/THUMBNAIL/image/gif/14a13502720d2ad324d3d0dcc275c1a1/fx2.sml fx2 fx2.sml sml 2367 164 211 IMAGE-THUMBNAIL 1-s2.0-S1381116908005608-fx3.gif https://s3.amazonaws.com/prod-ucs-content-store-us-east/content/pii:S1381116908005608/fx3/DOWNSAMPLED/image/gif/16c055409fb5d753628af8fd69e76ca5/fx3.gif https://s3-eu-west-1.amazonaws.com/prod-ucs-content-store-eu-west/content/pii:S1381116908005608/fx3/DOWNSAMPLED/image/gif/16c055409fb5d753628af8fd69e76ca5/fx3.gif fx3 fx3.gif gif 922 56 79 IMAGE-DOWNSAMPLED 1-s2.0-S1381116908005608-fx3.sml https://s3.amazonaws.com/prod-ucs-content-store-us-east/content/pii:S1381116908005608/fx3/THUMBNAIL/image/gif/1ca7bf2948485b48ef6b56e3c2b4de1f/fx3.sml https://s3-eu-west-1.amazonaws.com/prod-ucs-content-store-eu-west/content/pii:S1381116908005608/fx3/THUMBNAIL/image/gif/1ca7bf2948485b48ef6b56e3c2b4de1f/fx3.sml fx3 fx3.sml sml 3078 154 219 IMAGE-THUMBNAIL 1-s2.0-S1381116908005608-fx4.gif https://s3.amazonaws.com/prod-ucs-content-store-us-east/content/pii:S1381116908005608/fx4/DOWNSAMPLED/image/gif/243c08e89266b7b82dc2b1b988248c2c/fx4.gif https://s3-eu-west-1.amazonaws.com/prod-ucs-content-store-eu-west/content/pii:S1381116908005608/fx4/DOWNSAMPLED/image/gif/243c08e89266b7b82dc2b1b988248c2c/fx4.gif fx4 fx4.gif gif 536 33 63 IMAGE-DOWNSAMPLED 1-s2.0-S1381116908005608-fx4.sml https://s3.amazonaws.com/prod-ucs-content-store-us-east/content/pii:S1381116908005608/fx4/THUMBNAIL/image/gif/d73be9d4ac509ea0316f1127725c42c6/fx4.sml https://s3-eu-west-1.amazonaws.com/prod-ucs-content-store-eu-west/content/pii:S1381116908005608/fx4/THUMBNAIL/image/gif/d73be9d4ac509ea0316f1127725c42c6/fx4.sml fx4 fx4.sml sml 2290 114 219 IMAGE-THUMBNAIL 1-s2.0-S1381116908005608-fx5.gif https://s3.amazonaws.com/prod-ucs-content-store-us-east/content/pii:S1381116908005608/fx5/DOWNSAMPLED/image/gif/5ea6aeb8c473ad2b6c272dd1de635797/fx5.gif https://s3-eu-west-1.amazonaws.com/prod-ucs-content-store-eu-west/content/pii:S1381116908005608/fx5/DOWNSAMPLED/image/gif/5ea6aeb8c473ad2b6c272dd1de635797/fx5.gif fx5 fx5.gif gif 527 38 70 IMAGE-DOWNSAMPLED 1-s2.0-S1381116908005608-fx5.sml https://s3.amazonaws.com/prod-ucs-content-store-us-east/content/pii:S1381116908005608/fx5/THUMBNAIL/image/gif/39b1c2fe0d2a70fa95575f4cba591337/fx5.sml https://s3-eu-west-1.amazonaws.com/prod-ucs-content-store-eu-west/content/pii:S1381116908005608/fx5/THUMBNAIL/image/gif/39b1c2fe0d2a70fa95575f4cba591337/fx5.sml fx5 fx5.sml sml 1957 118 219 IMAGE-THUMBNAIL 1-s2.0-S1381116908005608-fx6.gif https://s3.amazonaws.com/prod-ucs-content-store-us-east/content/pii:S1381116908005608/fx6/DOWNSAMPLED/image/gif/fab09dd856e949926b6bb4f314e247a4/fx6.gif https://s3-eu-west-1.amazonaws.com/prod-ucs-content-store-eu-west/content/pii:S1381116908005608/fx6/DOWNSAMPLED/image/gif/fab09dd856e949926b6bb4f314e247a4/fx6.gif fx6 fx6.gif gif 571 38 79 IMAGE-DOWNSAMPLED 1-s2.0-S1381116908005608-fx6.sml https://s3.amazonaws.com/prod-ucs-content-store-us-east/content/pii:S1381116908005608/fx6/THUMBNAIL/image/gif/e7fa788cc2c280c33fee00de684f96d7/fx6.sml https://s3-eu-west-1.amazonaws.com/prod-ucs-content-store-eu-west/content/pii:S1381116908005608/fx6/THUMBNAIL/image/gif/e7fa788cc2c280c33fee00de684f96d7/fx6.sml fx6 fx6.sml sml 1848 105 219 IMAGE-THUMBNAIL 1-s2.0-S1381116908005608-fx7.gif https://s3.amazonaws.com/prod-ucs-content-store-us-east/content/pii:S1381116908005608/fx7/DOWNSAMPLED/image/gif/075876d2e20a6a6d335816af5b9b9c1c/fx7.gif https://s3-eu-west-1.amazonaws.com/prod-ucs-content-store-eu-west/content/pii:S1381116908005608/fx7/DOWNSAMPLED/image/gif/075876d2e20a6a6d335816af5b9b9c1c/fx7.gif fx7 fx7.gif gif 468 35 61 IMAGE-DOWNSAMPLED 1-s2.0-S1381116908005608-fx7.sml https://s3.amazonaws.com/prod-ucs-content-store-us-east/content/pii:S1381116908005608/fx7/THUMBNAIL/image/gif/2a644c821d35cedffe2c1c1a47a95c5e/fx7.sml https://s3-eu-west-1.amazonaws.com/prod-ucs-content-store-eu-west/content/pii:S1381116908005608/fx7/THUMBNAIL/image/gif/2a644c821d35cedffe2c1c1a47a95c5e/fx7.sml fx7 fx7.sml sml 1975 125 219 IMAGE-THUMBNAIL 1-s2.0-S1381116908005608-fx8.gif https://s3.amazonaws.com/prod-ucs-content-store-us-east/content/pii:S1381116908005608/fx8/DOWNSAMPLED/image/gif/e48f2128efeea7cb58041ee144fc13de/fx8.gif https://s3-eu-west-1.amazonaws.com/prod-ucs-content-store-eu-west/content/pii:S1381116908005608/fx8/DOWNSAMPLED/image/gif/e48f2128efeea7cb58041ee144fc13de/fx8.gif fx8 fx8.gif gif 533 34 79 IMAGE-DOWNSAMPLED 1-s2.0-S1381116908005608-fx8.sml https://s3.amazonaws.com/prod-ucs-content-store-us-east/content/pii:S1381116908005608/fx8/THUMBNAIL/image/gif/1c404be4151988b1769b6a059fcc0b7a/fx8.sml https://s3-eu-west-1.amazonaws.com/prod-ucs-content-store-eu-west/content/pii:S1381116908005608/fx8/THUMBNAIL/image/gif/1c404be4151988b1769b6a059fcc0b7a/fx8.sml fx8 fx8.sml sml 1775 96 219 IMAGE-THUMBNAIL 1-s2.0-S1381116908005608-fx1.jpg https://s3.amazonaws.com/prod-ucs-content-store-us-east/content/pii:S1381116908005608/fx1/DOWNSAMPLED/image/jpeg/ed4a64d12fa241793e8421b6cf5a33c9/fx1.jpg https://s3-eu-west-1.amazonaws.com/prod-ucs-content-store-eu-west/content/pii:S1381116908005608/fx1/DOWNSAMPLED/image/jpeg/ed4a64d12fa241793e8421b6cf5a33c9/fx1.jpg fx1 true fx1.jpg jpg 7696 148 376 IMAGE-DOWNSAMPLED 1-s2.0-S1381116908005608-fx1.sml https://s3.amazonaws.com/prod-ucs-content-store-us-east/content/pii:S1381116908005608/fx1/THUMBNAIL/image/gif/b12ce1ec7c3709f6139836ae26377705/fx1.sml https://s3-eu-west-1.amazonaws.com/prod-ucs-content-store-eu-west/content/pii:S1381116908005608/fx1/THUMBNAIL/image/gif/b12ce1ec7c3709f6139836ae26377705/fx1.sml fx1 true fx1.sml sml 1570 86 219 IMAGE-THUMBNAIL 1-s2.0-S1381116908005608-fx9.gif https://s3.amazonaws.com/prod-ucs-content-store-us-east/content/pii:S1381116908005608/fx9/DOWNSAMPLED/image/gif/3c23ef46000ebdecd99f59eb23a844d5/fx9.gif https://s3-eu-west-1.amazonaws.com/prod-ucs-content-store-eu-west/content/pii:S1381116908005608/fx9/DOWNSAMPLED/image/gif/3c23ef46000ebdecd99f59eb23a844d5/fx9.gif fx9 fx9.gif gif 496 28 99 IMAGE-DOWNSAMPLED 1-s2.0-S1381116908005608-fx9.sml https://s3.amazonaws.com/prod-ucs-content-store-us-east/content/pii:S1381116908005608/fx9/THUMBNAIL/image/gif/b1ec53ae121512491e5744d2fb02c594/fx9.sml https://s3-eu-west-1.amazonaws.com/prod-ucs-content-store-eu-west/content/pii:S1381116908005608/fx9/THUMBNAIL/image/gif/b1ec53ae121512491e5744d2fb02c594/fx9.sml fx9 fx9.sml sml 1203 62 219 IMAGE-THUMBNAIL MOLCAA 7364 S1381-1169(08)00560-8 10.1016/j.molcata.2008.11.040 Elsevier B.V. Fig. 1 %Age conversion of BzOH to BzBr under microwave irradiation. Scheme 1 Scheme 2 Table 1 Halogenation of different aromatic and aliphatic alcohols using [bmim]HSO4 and metal salts at 80°C and under microwave irradiation. S. no. R a Alkali metal salt used Reaction time Yield (%) b MWI (160W) (min) Conventional (h) MWI Conventional 1. NaI 7 15 90 75 NaBr 8 16 88 72 2. NaI 8 16 87 78 NaBr 10 18 85 75 3. NaI 7 15 85 77 NaBr 9 16 84 74 4. NaI 7 15 90 74 NaBr 8 16 89 73 5. NaI 8 16 82 70 NaBr 9 17 80 70 6. NaI 7 15 85 71 NaBr 8 16 81 71 7. NaI 7 15 75 64 NaBr 9 18 74 62 8. NaI 9 20 68 59 NaBr 10 20 64 55 9. H3C–[CH2]8– NaI 8 18 72 62 NaBr 10 20 70 61 10 H3C–[CH2]4– NaI 8 18 71 60 NaBr 10 20 71 59 a All the compounds were characterised on the basis of 1H NMR and IR spectral data. b Isolated and unoptimised yields. Table 2 Reaction of benzyl alcohol with NaBr in different solvents. S. no. Solvent used Yield (%) of benzyl bromide 1. [bmim]HSO4 90 2. [bmim]HSO4/H2O 0 3. H2O 0 4. CH3OH 0 5. DMSO 0 Enhancing nucleophilicity in ionic liquid [bmim]HSO4: A recyclable media and catalyst for the halogenation of alcohols Neeraj Gupta Goverdhan L. Kad Jasvinder Singh ⁎ Department of Chemistry and Centre of Advanced Studies in Chemistry, Panjab University, Chandigarh 160014, India ⁎ Corresponding author. Tel.: +91 172 2541435; fax: +91 172 2545074. Graphical abstract Ionic liquid 1-butyl-3-methylimidazolium hydrogen sulphate [bmim]HSO4 has been demonstrated as an efficient reusable catalyst and solvent, for the halogenation of aromatic and aliphatic alcohols with alkali metal salts (NaBr, NaI) in conjunction with microwave and thermal heating. Bronsted acidic ionic liquid 1-butyl-3-methylimidazolium hydrogen sulphate [bmim]HSO4 has been demonstrated as an efficient reusable catalyst and solvent, for halogenation of aromatic and aliphatic alcohols in conjunction with microwave and thermal heating. Use of microwave energy not only accelerates the reaction rate, but also provides enhanced yields. Moreover, anhydrous ionic liquid facilitates nucleophilic attack of halide ions on alcohols, thus indicating the enhancement in their nucleophilic character. Easy work up, good yields and facile regeneration of the ionic liquid further increases the scope of the developed methodology. Keywords Ionic liquid [bmim]HSO4 Halogenation Alkali metal salts Nucleophilic substitution Microwave energy 1 Introduction Sustainable industrial development must employ less polluting neoteric solvents and this quest for new reaction media leads to the exploration of different ionic liquids [1–4]. Interest to explore various inorganic and organic reactions in ionic liquids, particularly, those based on 1,3-dialkylimidazolium cations [4–7] has flourished in recent time. Because of tremendous useful properties of ionic liquids such as vanishingly low vapour pressure, low co-ordinating ability and thermal/chemical stability, these have been used as an attractive alternative to traditional volatile organic solvents in various chemical processes, and in liquid–liquid extractions as documented by recent literature [1–7]. On the other hand, immiscibility of ionic liquid in different organic solvents paves the way for biphasic [8,9] separation of desirable products. There is a controversy [10,11] whether ionic liquids accelerate or decelerate the nucleophilic substitution reactions. Although many types of reactions have been investigated in ionic liquid, but very few examples of nucleophilic substitution reactions [12–18] are present in the literature. These reactions are traditionally often been carried out using phase transfer catalyst [19,20] and because of the fact that IL are comprised of bulky organic cation, they seem to be an excellent substitute for phase transfer catalysis along with quarternary ammonium salts, crown ether derivatives and phosphonium salts. Alkali metal salts containing different halide anions viz., chloride, bromide and iodide are economical and can serve as nucleophile [21] in substitution reactions. Halogenation of alcohols is one of the most important functional group transformation in organic chemistry. Halogen containing compounds are very useful intermediates in organic synthesis [22]. They are useful substrates or intermediates in elimination [23,24], rearrangement [25], lithiation [26,27] and carbon–carbon coupling [28,29] reactions and appropriate for the attack by numerous nucleophiles [17,21,30]. Because of our ongoing efforts to explore acidic ionic liquid [9,31,32] [bmim]HSO4 in different organic reactions, we report herein, its use in nucleophilic substitution reaction for the first time and utilizing it for the transformation of alcohols into halides, using metal halides. 2 Experimental Ionic liquid [bmim]HSO4 was prepared by the reported method [31]. Improved version of the process is also reported using microwave reactor Plazmatronika (RM 2001 PC) (see Section 2.1). Microwave assisted reactions were also carried out in domestic microwave oven [LGMS194A (800W)]. Ultrasound assisted reaction was carried out using Branson [B-2200 EI (60W, 47kHz)] ultrasonic cleaning bath. 2.1 Synthesis of [bmim]HSO4 In a flame-dried assembly, 1-bromobutane (2mmol) and 1-methyl imidazole (2mmol) were stirred together under microwave irradiation at 60–80°C for 6min (three cycles each having heating period 2min, cooling period 2min and power of magnetron 80%). NaHSO4 (2.5mmol) was added to the resulting light yellow viscous liquid [(bmim)Br] and irradiated with microwaves for 40s at 50–70°C (two cycles each having heating period 20s, cooling period 30s and power of magnetron 80%) or exposed to ultrasonic waves for 1h. Resulting mixture was extracted with dichloromethane (2×20mL) and evaporation of solvent under reduced pressure afforded orange coloured viscous liquid [bmim]HSO4. Alternatively, in a dry assembly H2SO4 (2mmol) was added dropwise to the light pale yellow liquid [bmim]Br prepared earlier, and stirred at 50°C for 15h to ensure complete ion exchange. The resulting orange viscous liquid was extracted with diethylether (2×20mL) to ensure the removal of any organic impurity and the ionic liquid prepared was dried under vacuum for 6h. 2.2 Synthesis of aryl or alkyl halides using thermal heating In a flame-dried assembly [bmim]HSO4 (6mmol) and NaX [X=Br, I] (7.5mmol) were stirred at 80°C for half an hour, followed by addition of alcohol (5mmol) and stirring continued at the same temperature for the time specified (Table 1 ). After the completion of the reaction (monitored by TLC) the product was extracted with diethyl ether (3×20mL). Combined organic layer was washed with brine and dried over anhydrous sodium sulfate. Evaporation of the solvent under reduced pressure afforded the crude product that was purified by column chromatography using ethyl acetate and n-hexane (1:9) to obtain product. 2.3 Synthesis of aryl and alkyl halides using microwave energy Ionic liquid [bmim]HSO4 (1.2mmol) and MX (NaI, NaBr, CsCl) (1.5mmol) were stirred together in a vial (10mL) under microwave irradiation in microwave reactor [Plazmatronika (RM 2001 PC)] at 60–80°C for 1min, followed by cooling period of 1min. Alcohol (1mmol) was added to vial, sealed properly and irradiated for 10min in microwave reactor at 80–90°C (five cycles each having heating period 2min, cooling period 1min and power of magnetron 80%). Alternatively, the reaction mixture can also be irradiated in domestic microwave oven [LGMS194A (800W)] at 160W for the time specified (Table 1) with the mechanical shaking after each 30s irradiation time. Resulting mixture was allowed to cool, followed by extraction with diethyl ether (3×10mL). Combined organic layer was washed with brine and dried over anhydrous sodium sulfate. Evaporation of the solvent under reduced pressure afforded the crude product that was purified by column chromatography using ethyl acetate and n-hexane (1:9) to obtain product in good yield. 2.4 Recycling of the ionic liquid Residual ionic liquid (obtained in Section 2.2) was mixed thoroughly with NaHSO4 (10mmol) and irradiated with microwaves [160W in LGMS-194A (800W)] for 30s. Resulting mixture was extracted with DCM (3×10mL). Evaporation of the solvent under reduced pressure afforded the ionic liquid [bmim]HSO4 (40%). 3 Results and discussion Our first task was to analyze the behaviour of alkali metal salt, such as sodium bromide, towards halogenation reaction in acidic ionic liquid [bmim]HSO4. The general methodology involved addition of substrate to preheated mixture of ionic liquid [bmim]HSO4 and sodium bromide, for 15–20h (Scheme 1 ). Aromatic and aliphatic alcohols are converted to their respective bromides in moderate to good yields (Table 1) when the substrate is refluxed with a preheated mixture of sodium bromide and [bmim]HSO4. In continuation of our work involving use of non-conventional techniques and media in organic synthesis [9,21], we explored the use of microwave energy for this specific task. It was observed that microwave energy increases the rate as well as overall yield of the reaction. Encouraged by these results, we next set out to investigate the use of sodium iodide and sodium chloride for iodination and chlorination respectively. During chlorination very poor results were obtained and results of iodination were found to be compatible with the previous one (Table 1). To determine the accelerating effect of microwaves during the conversion, we determined the percentage of benzyl bromide formed from benzyl alcohol at various stages of reaction from NMR data. Approximately 90% conversion of alcohol to bromide (Fig. 1 ) was observed after 10min irradiation period (five cycles each having heating period 2min, cooling period 1min, power of magnetron 80%, temperature range 80–90°C). Yield of benzyl bromide did not increase further by increasing the irradiation time. Moreover, alkali metal salt (NaBr/NaI) on treatment with allylic alcohols (Table 1, S. nos. 7 and 8) in ionic liquid [bmim]HSO4 afforded the substituted product without the formation of any ring substituted or addition product. Cinnamyl alcohol (Table 1, S. no. 7) when treated with sodium bromide afforded corresponding bromide that exhibited doublet at δ 6.61 (J =12.4Hz) indicating the presence of double bond [33] and upfield shift in the signal of saturated methylene protons containing alcoholic group. Monohalogenation of diols [34] is often a stubborn problem in different synthetic endeavoures, as there is considerable formation of disubstituted product. Immiscibility of ionic liquid with different organic solvents, and their tendency to form biphasic media, could offer an excellent solution for this specific task. Keeping in mind good yields of monotetrahydropyranyl ethers obtained in our previous work [9], we decided to perform the monobromination of pentan-1,5-diol (4mmol) using NaBr (4mmol) in biphasic media of ionic liquid [bmim]HSO4 (4.8mmol) and hexane (5mL). Diol, when subjected to same reaction conditions as alcohols, provided moderate selectivity (disubstituted, monosubstituted and unreacted alcohol in the ratio 2.8:3.5:3.7 as indicated by gas chromatography), but when the reaction was carried out in biphasic media using n-hexane and [bmim]HSO4, increase in selectivity was observed (Scheme 2 ) (ratio of disubstituted, monosubstituted and unreacted alcohol obtained is 1.8:4.7:3.5). However, the formation of dibromides could not be prevented completely. {Caution: Monohalogenation or the related biphasic reactions should never be tried in any closed vessel in domestic microwave oven, like other microwave-assisted reactions. Though hexane is microwave inactive, but in presence of ionic substances it can undergo heating*, that can result in explosion [35]}. After the completion of the reaction ionic liquid used can be regenerated (see Section 2.4) using NaHSO4, which eliminates the use of corrosive and toxic substances in the regeneration process. Residual ionic liquid is believed to contain [bmim]2SO4, [bmim]OH and ion exchange by NaHSO4 regenerates the acidic ionic liquid [bmim]HSO4. The ionic liquid, thus prepared can also be used for other organic transformations and we have used it for the formation of tetrahydropyranyl ethers [9]. To study the role of ionic liquid in the nucleophilic substitution reactions, we decided to perform the aforementioned conversion in different solvents (Table 2 ). Keeping the time and energy source constant for the conversion of benzyl alcohol to benzyl bromide (Scheme 1, S. no. 1., Table 1) using NaBr, it was observed that the formation of bromide takes place only in case of anhydrous [bmim]HSO4. However, when equimolar amount of water was added to the ionic liquid no formation of product was observed. So we concluded that anhydrous [bmim]HSO4 accelerates the nucleophilic substitution reaction by its ionic character, whereas presence of water decelerate the reaction probably due to its solvation effect. Reaction does not proceed at all in other solvents like water, methanol and dimethyl sulfoxide, therefore indicating the need of protonation of alcohols by the ionic liquid and facilitating the attack of halide ion to form the corresponding substituted product, thus manifesting the catalytic role of [bmim]HSO4. 4 Conclusion In conclusion, we have found that metal salts behave as good source of nucleophiles in anhydrous ionic liquid [bmim]HSO4, and can be used to synthesize aryl and alkyl halides from the corresponding alcohols, using microwave and thermal energy. Simple experimental and product isolation procedures, combined with ease of regeneration and reuse of ionic liquid, are expected to contribute towards the development of green methodologies. Acknowledgements The authors are thankful to UGC and CSIR-New Delhi (India) for providing financial assistance. We are also thankful to Vasundhara Singh (Punjab Engineering College, Chandigarh 160012) for assisting in gas chromatographic analysis of bromopentanol and Jasamrit Kaur (Scientist DST, Panjab University, Chandigarh) for providing Plazmatronica. References [1] J.S. Wilkes J. Mol. Catal. A: Chem. 214 2004 11 [2] P. Wasserscheid T. Welton Ionic Liquids in Synthesis 2002 Wiley-VCH Weinheim [3] K. Fukumoto H. Ohno Chem. Commun. 29 2006 3081 [4] J. Mo J. Xiao Angew. Chem. Int. Ed. 45 2006 4152 [5] Q.W. Yao Y.L. Zhang Angew. Chem. Int. Ed. 42 2003 3395 [6] S.T. Handy J. Org. Chem. 71 2006 4659 [7] W.-H. Ou HuangF Z.-Z. Green Chem. 8 2006 731 [8] A.M. Scurto W. Leitner Chem. Commun. 35 2006 3681 [9] J. Singh N. Gupta G.L. Kad J. Kaur Synth. Commun. 36 2006 2893 [10] D.W. Kim C.E. Song D.Y. Chi J. Org. Chem. 68 2003 4281 [11] L. Crowhurst N.L. Lancaster M. Juan P. Arlandis T. Welton J. Am. Chem. Soc. 126 2004 11549 [12] M. Cavazza F. Pietra Tetrahedron Lett. 45 2004 3633 [13] Z.M.A. Judeh H.-Y. Shen Chi S B.C. L.-C. Feng S. Selvasothi Tetrahedron Lett. 43 2002 9381 [14] C. Chiappe D. Pieraccini P. Saullo J. Org. Chem. 68 2003 6710 [15] R.X. Ren J.X. Wu Org. Lett. 3 2001 3727 [16] N.L. Lancaster T. Welton J. Org. Chem. 69 2004 5986 [17] C. Wheeler K.N. West C.L. Liotta C.A. Eckert Chem. Commun. 2001 887 [18] D.W. Kim C.E. Song D.Y. Chi J. Am. Chem. Soc. 124 2002 10278 [19] M. Makosza Pure Appl. Chem. 72 2000 1399 [20] J. Dockx Synthesis 1973 441 [21] G.L. Kad V. Singh K.P. Kaur J. Singh Tetrahedron. Lett. 38 1997 1079 [22] E. Yue W.J.M. Gerdes C.A. Mathis J. Org. Chem. 56 1991 5451 [23] R.C. Larock Comprehensive Organic Transformations 1989 VCH New York 151 [24] R. Schwesinger H. Schlemper Angew. Chem. Int. Ed. 26 1987 1167 [25] M. Kunishima K. Hioki K. Kono A. Kato S. Tani J. Org. Chem. 62 1997 7542 [26] J. San Filippo Jr. J. Silbermann J. Am. Chem. Soc. 104 1982 2831 [27] H.G. Kuivila J. Am. Chem. Soc. 107 1985 416 [28] F. Diederich P.J. Stang Metal Catalysed Cross-coupling Reactions 1998 Wiley-VCH Weinheim [29] J.J. Li Name Reactions: A Collection of Detailed Reaction Mechanisms second edition 2003 Springer-Verlag Berlin, Heidelberg, New York [30] D.W. Kim D.J. Hong J.W. Seo H.S. Kim H.K. Kim C.E. Song D.Y. Chi J. Org. Chem. 69 2004 3186 [31] V. Singh S. Kaur V. Sapehiyia J. Singh G.L. Kad Catal. Commun. 6 2005 57 [32] N. Gupta Sonu G.L. Kad J. Singh Catal. Commun. 2007 1323 [33] Cinnamyl bromide: IR (neat)/ν max cm−1: 3022, 2922, 1660, 1200, 640. 1H NMR (CDCl3, 300MHz) δ: 7.42–7.34 (m, 5H, ArH), 6.61 (d, 1H, J =12.4Hz, Ar–CHCH–), 4.58–4.49 (m, 1H, Ar–CHCH-), 3.42 (d, 2H, J =6.3Hz, –CH2Br). Cinnamyl iodide: IR (neat)/ν max cm−1: 3010, 2928, 1650, 1190, 510. 1H NMR (CDCl3, 300MHz) δ: 7.41–7.30 (m, 5H, ArH), 6.58 (d, 1H, J =12.2Hz, Ar–CH CH–), 4.50–4.41 (m, 1H, Ar–CHCH–), 3.34 (d, 2H, J =6.1Hz, –CH2Br). [34] S.K. Kang W.S. Kim B.H. Moon Synthesis 1985 1161 [35] N.E. Leadbeater H.M. Torenius J. Org. Chem. 67 2002 3145",
      "scopus-id": "62649090096",
      "coredata": {
        "eid": "1-s2.0-S1381116908005608",
        "dc:description": "Bronsted acidic ionic liquid 1-butyl-3-methylimidazolium hydrogen sulphate [bmim]HSO4 has been demonstrated as an efficient reusable catalyst and solvent, for halogenation of aromatic and aliphatic alcohols in conjunction with microwave and thermal heating. Use of microwave energy not only accelerates the reaction rate, but also provides enhanced yields. Moreover, anhydrous ionic liquid facilitates nucleophilic attack of halide ions on alcohols, thus indicating the enhancement in their nucleophilic character. Easy work up, good yields and facile regeneration of the ionic liquid further increases the scope of the developed methodology.",
        "openArchiveArticle": "false",
        "prism:coverDate": "2009-04-01",
        "openaccessUserLicense": null,
        "prism:aggregationType": "Journal",
        "prism:url": "https://api.elsevier.com/content/article/pii/S1381116908005608",
        "dc:creator": [
          {
            "@_fa": "true",
            "$": "Gupta, Neeraj"
          },
          {
            "@_fa": "true",
            "$": "Kad, Goverdhan L."
          },
          {
            "@_fa": "true",
            "$": "Singh, Jasvinder"
          }
        ],
        "link": [
          {
            "@_fa": "true",
            "@rel": "self",
            "@href": "https://api.elsevier.com/content/article/pii/S1381116908005608"
          },
          {
            "@_fa": "true",
            "@rel": "scidir",
            "@href": "https://www.sciencedirect.com/science/article/pii/S1381116908005608"
          }
        ],
        "dc:format": "application/json",
        "openaccessType": null,
        "pii": "S1381-1169(08)00560-8",
        "prism:volume": "302",
        "prism:publisher": "Elsevier B.V.",
        "dc:title": "Enhancing nucleophilicity in ionic liquid [bmim]HSO4: A recyclable media and catalyst for the halogenation of alcohols",
        "prism:copyright": "Copyright © 2008 Elsevier B.V. All rights reserved.",
        "openaccess": "0",
        "prism:issn": "13811169",
        "prism:issueIdentifier": "1-2",
        "dcterms:subject": [
          {
            "@_fa": "true",
            "$": "Ionic liquid"
          },
          {
            "@_fa": "true",
            "$": "[bmim]HSO4"
          },
          {
            "@_fa": "true",
            "$": "Halogenation"
          },
          {
            "@_fa": "true",
            "$": "Alkali metal salts"
          },
          {
            "@_fa": "true",
            "$": "Nucleophilic substitution"
          },
          {
            "@_fa": "true",
            "$": "Microwave energy"
          }
        ],
        "openaccessArticle": "false",
        "prism:publicationName": "Journal of Molecular Catalysis A: Chemical",
        "prism:number": "1-2",
        "openaccessSponsorType": null,
        "prism:pageRange": "11-14",
        "prism:endingPage": "14",
        "pubType": "fla",
        "prism:coverDisplayDate": "1 April 2009",
        "prism:doi": "10.1016/j.molcata.2008.11.040",
        "prism:startingPage": "11",
        "dc:identifier": "doi:10.1016/j.molcata.2008.11.040",
        "openaccessSponsorName": null
      },
      "objects": {
        "object": [
          {
            "@category": "standard",
            "@height": "66",
            "@width": "376",
            "@_fa": "true",
            "$": "https://api.elsevier.com/content/object/eid/1-s2.0-S1381116908005608-sc1.jpg?httpAccept=%2A%2F%2A",
            "@multimediatype": "JPEG image file",
            "@type": "IMAGE-DOWNSAMPLED",
            "@size": "4799",
            "@ref": "sc1",
            "@mimetype": "image/jpeg"
          },
          {
            "@category": "thumbnail",
            "@height": "38",
            "@width": "219",
            "@_fa": "true",
            "$": "https://api.elsevier.com/content/object/eid/1-s2.0-S1381116908005608-sc1.sml?httpAccept=%2A%2F%2A",
            "@multimediatype": "GIF image file",
            "@type": "IMAGE-THUMBNAIL",
            "@size": "983",
            "@ref": "sc1",
            "@mimetype": "image/gif"
          },
          {
            "@category": "standard",
            "@height": "48",
            "@width": "376",
            "@_fa": "true",
            "$": "https://api.elsevier.com/content/object/eid/1-s2.0-S1381116908005608-sc2.jpg?httpAccept=%2A%2F%2A",
            "@multimediatype": "JPEG image file",
            "@type": "IMAGE-DOWNSAMPLED",
            "@size": "5923",
            "@ref": "sc2",
            "@mimetype": "image/jpeg"
          },
          {
            "@category": "thumbnail",
            "@height": "28",
            "@width": "219",
            "@_fa": "true",
            "$": "https://api.elsevier.com/content/object/eid/1-s2.0-S1381116908005608-sc2.sml?httpAccept=%2A%2F%2A",
            "@multimediatype": "GIF image file",
            "@type": "IMAGE-THUMBNAIL",
            "@size": "1054",
            "@ref": "sc2",
            "@mimetype": "image/gif"
          },
          {
            "@category": "standard",
            "@height": "160",
            "@width": "333",
            "@_fa": "true",
            "$": "https://api.elsevier.com/content/object/eid/1-s2.0-S1381116908005608-gr1.jpg?httpAccept=%2A%2F%2A",
            "@multimediatype": "JPEG image file",
            "@type": "IMAGE-DOWNSAMPLED",
            "@size": "9795",
            "@ref": "gr1",
            "@mimetype": "image/jpeg"
          },
          {
            "@category": "thumbnail",
            "@height": "105",
            "@width": "219",
            "@_fa": "true",
            "$": "https://api.elsevier.com/content/object/eid/1-s2.0-S1381116908005608-gr1.sml?httpAccept=%2A%2F%2A",
            "@multimediatype": "GIF image file",
            "@type": "IMAGE-THUMBNAIL",
            "@size": "3369",
            "@ref": "gr1",
            "@mimetype": "image/gif"
          },
          {
            "@category": "standard",
            "@height": "31",
            "@width": "40",
            "@_fa": "true",
            "$": "https://api.elsevier.com/content/object/eid/1-s2.0-S1381116908005608-fx2.gif?httpAccept=%2A%2F%2A",
            "@multimediatype": "GIF image file",
            "@type": "IMAGE-DOWNSAMPLED",
            "@size": "368",
            "@ref": "fx2",
            "@mimetype": "image/gif"
          },
          {
            "@category": "thumbnail",
            "@height": "164",
            "@width": "211",
            "@_fa": "true",
            "$": "https://api.elsevier.com/content/object/eid/1-s2.0-S1381116908005608-fx2.sml?httpAccept=%2A%2F%2A",
            "@multimediatype": "GIF image file",
            "@type": "IMAGE-THUMBNAIL",
            "@size": "2367",
            "@ref": "fx2",
            "@mimetype": "image/gif"
          },
          {
            "@category": "standard",
            "@height": "56",
            "@width": "79",
            "@_fa": "true",
            "$": "https://api.elsevier.com/content/object/eid/1-s2.0-S1381116908005608-fx3.gif?httpAccept=%2A%2F%2A",
            "@multimediatype": "GIF image file",
            "@type": "IMAGE-DOWNSAMPLED",
            "@size": "922",
            "@ref": "fx3",
            "@mimetype": "image/gif"
          },
          {
            "@category": "thumbnail",
            "@height": "154",
            "@width": "219",
            "@_fa": "true",
            "$": "https://api.elsevier.com/content/object/eid/1-s2.0-S1381116908005608-fx3.sml?httpAccept=%2A%2F%2A",
            "@multimediatype": "GIF image file",
            "@type": "IMAGE-THUMBNAIL",
            "@size": "3078",
            "@ref": "fx3",
            "@mimetype": "image/gif"
          },
          {
            "@category": "standard",
            "@height": "33",
            "@width": "63",
            "@_fa": "true",
            "$": "https://api.elsevier.com/content/object/eid/1-s2.0-S1381116908005608-fx4.gif?httpAccept=%2A%2F%2A",
            "@multimediatype": "GIF image file",
            "@type": "IMAGE-DOWNSAMPLED",
            "@size": "536",
            "@ref": "fx4",
            "@mimetype": "image/gif"
          },
          {
            "@category": "thumbnail",
            "@height": "114",
            "@width": "219",
            "@_fa": "true",
            "$": "https://api.elsevier.com/content/object/eid/1-s2.0-S1381116908005608-fx4.sml?httpAccept=%2A%2F%2A",
            "@multimediatype": "GIF image file",
            "@type": "IMAGE-THUMBNAIL",
            "@size": "2290",
            "@ref": "fx4",
            "@mimetype": "image/gif"
          },
          {
            "@category": "standard",
            "@height": "38",
            "@width": "70",
            "@_fa": "true",
            "$": "https://api.elsevier.com/content/object/eid/1-s2.0-S1381116908005608-fx5.gif?httpAccept=%2A%2F%2A",
            "@multimediatype": "GIF image file",
            "@type": "IMAGE-DOWNSAMPLED",
            "@size": "527",
            "@ref": "fx5",
            "@mimetype": "image/gif"
          },
          {
            "@category": "thumbnail",
            "@height": "118",
            "@width": "219",
            "@_fa": "true",
            "$": "https://api.elsevier.com/content/object/eid/1-s2.0-S1381116908005608-fx5.sml?httpAccept=%2A%2F%2A",
            "@multimediatype": "GIF image file",
            "@type": "IMAGE-THUMBNAIL",
            "@size": "1957",
            "@ref": "fx5",
            "@mimetype": "image/gif"
          },
          {
            "@category": "standard",
            "@height": "38",
            "@width": "79",
            "@_fa": "true",
            "$": "https://api.elsevier.com/content/object/eid/1-s2.0-S1381116908005608-fx6.gif?httpAccept=%2A%2F%2A",
            "@multimediatype": "GIF image file",
            "@type": "IMAGE-DOWNSAMPLED",
            "@size": "571",
            "@ref": "fx6",
            "@mimetype": "image/gif"
          },
          {
            "@category": "thumbnail",
            "@height": "105",
            "@width": "219",
            "@_fa": "true",
            "$": "https://api.elsevier.com/content/object/eid/1-s2.0-S1381116908005608-fx6.sml?httpAccept=%2A%2F%2A",
            "@multimediatype": "GIF image file",
            "@type": "IMAGE-THUMBNAIL",
            "@size": "1848",
            "@ref": "fx6",
            "@mimetype": "image/gif"
          },
          {
            "@category": "standard",
            "@height": "35",
            "@width": "61",
            "@_fa": "true",
            "$": "https://api.elsevier.com/content/object/eid/1-s2.0-S1381116908005608-fx7.gif?httpAccept=%2A%2F%2A",
            "@multimediatype": "GIF image file",
            "@type": "IMAGE-DOWNSAMPLED",
            "@size": "468",
            "@ref": "fx7",
            "@mimetype": "image/gif"
          },
          {
            "@category": "thumbnail",
            "@height": "125",
            "@width": "219",
            "@_fa": "true",
            "$": "https://api.elsevier.com/content/object/eid/1-s2.0-S1381116908005608-fx7.sml?httpAccept=%2A%2F%2A",
            "@multimediatype": "GIF image file",
            "@type": "IMAGE-THUMBNAIL",
            "@size": "1975",
            "@ref": "fx7",
            "@mimetype": "image/gif"
          },
          {
            "@category": "standard",
            "@height": "34",
            "@width": "79",
            "@_fa": "true",
            "$": "https://api.elsevier.com/content/object/eid/1-s2.0-S1381116908005608-fx8.gif?httpAccept=%2A%2F%2A",
            "@multimediatype": "GIF image file",
            "@type": "IMAGE-DOWNSAMPLED",
            "@size": "533",
            "@ref": "fx8",
            "@mimetype": "image/gif"
          },
          {
            "@category": "thumbnail",
            "@height": "96",
            "@width": "219",
            "@_fa": "true",
            "$": "https://api.elsevier.com/content/object/eid/1-s2.0-S1381116908005608-fx8.sml?httpAccept=%2A%2F%2A",
            "@multimediatype": "GIF image file",
            "@type": "IMAGE-THUMBNAIL",
            "@size": "1775",
            "@ref": "fx8",
            "@mimetype": "image/gif"
          },
          {
            "@category": "standard",
            "@height": "148",
            "@width": "376",
            "@_fa": "true",
            "$": "https://api.elsevier.com/content/object/eid/1-s2.0-S1381116908005608-fx1.jpg?httpAccept=%2A%2F%2A",
            "@multimediatype": "JPEG image file",
            "@type": "IMAGE-DOWNSAMPLED",
            "@size": "7696",
            "@ref": "fx1",
            "@mimetype": "image/jpeg"
          },
          {
            "@category": "thumbnail",
            "@height": "86",
            "@width": "219",
            "@_fa": "true",
            "$": "https://api.elsevier.com/content/object/eid/1-s2.0-S1381116908005608-fx1.sml?httpAccept=%2A%2F%2A",
            "@multimediatype": "GIF image file",
            "@type": "IMAGE-THUMBNAIL",
            "@size": "1570",
            "@ref": "fx1",
            "@mimetype": "image/gif"
          },
          {
            "@category": "standard",
            "@height": "28",
            "@width": "99",
            "@_fa": "true",
            "$": "https://api.elsevier.com/content/object/eid/1-s2.0-S1381116908005608-fx9.gif?httpAccept=%2A%2F%2A",
            "@multimediatype": "GIF image file",
            "@type": "IMAGE-DOWNSAMPLED",
            "@size": "496",
            "@ref": "fx9",
            "@mimetype": "image/gif"
          },
          {
            "@category": "thumbnail",
            "@height": "62",
            "@width": "219",
            "@_fa": "true",
            "$": "https://api.elsevier.com/content/object/eid/1-s2.0-S1381116908005608-fx9.sml?httpAccept=%2A%2F%2A",
            "@multimediatype": "GIF image file",
            "@type": "IMAGE-THUMBNAIL",
            "@size": "1203",
            "@ref": "fx9",
            "@mimetype": "image/gif"
          }
        ]
      },
      "link": {
        "@rel": "abstract",
        "@href": "https://api.elsevier.com/content/abstract/scopus_id/62649090096"
      }
    }
  }
}