{
  "metadata": {
    "title": "Structures of molybdenum silica catalysts reduced by ethanol, and their relations to catalytic oxidation reactions: I. Structure changes of Mo/SiO<ce:inf loc=post>2</ce:inf> with gradual reduction by ethanol",
    "authors": "Y Kikutani",
    "journal": "Journal of Molecular Catalysis A: Chemical",
    "date": "1999-06-10",
    "doi": "10.1016/S1381-1169(98)00309-4",
    "abstract": "",
    "uri": "https://api.elsevier.com/content/article/pii/S1381116998003094",
    "pii": "S1381116998003094"
  },
  "fulltext": {
    "full-text-retrieval-response": {
      "scopus-eid": "2-s2.0-0033542375",
      "originalText": "serial JL 271358 291210 291744 291790 291809 31 Journal of Molecular Catalysis A: Chemical JOURNALMOLECULARCATALYSISACHEMICAL 1999-04-16 1999-04-16 2010-04-18T14:19:10 1-s2.0-S1381116998003094 S1381-1169(98)00309-4 S1381116998003094 10.1016/S1381-1169(98)00309-4 S300 S300.1 FULL-TEXT 1-s2.0-S1381116900X00994 2015-05-15T05:56:33.651043-04:00 0 0 19990610 1999 1999-04-16T00:00:00Z articleinfo crossmark dco dateupdated tomb dateloaded datesearch indexeddate issuelist volumelist yearnav articletitlenorm authfirstinitialnorm authfirstsurnamenorm cid cids contenttype copyright dateloadedtxt docsubtype doctype doi eid ewtransactionid hubeid issfirst issn issnnorm itemstage itemtransactionid itemweight openaccess openarchive pg pgfirst pglast pii piinorm pubdatestart pubdatetxt pubyr sortorder srctitle srctitlenorm srctype subheadings volfirst volissue webpdf webpdfpagecount figure table body acknowledge affil articletitle auth authfirstini authfull authkeywords authlast primabst ref alllist content subj ssids 1381-1169 13811169 142 142 2 2 Volume 142, Issue 2 15 247 263 247 263 19990610 10 June 1999 1999-06-10 1999 converted-article fla Copyright © 1999 Elsevier Science B.V. All rights reserved. STRUCTURESMOLYBDENUMSILICACATALYSTSREDUCEDBYETHANOLRELATIONSCATALYTICOXIDATIONREACTIONS KIKUTANI Y 1 Introduction 2 Experimental 2.1 Preparation of catalysts 2.1.1 Catalysts prepared from MoO2(acac)2·2 H2O 2.1.2 Catalysts prepared from Mo2(C3H5)4 2.1.3 Catalysts prepared from [Mo3O2(OAc)6(H2O)(OH)2]·xH2O 2.1.4 Catalysts prepared from AHM 2.2 EXAFS spectroscopy [32] 2.3 Diffuse reflectance (DR) UV–VIS spectroscopy 3 Results 3.1 Calcined Mo/SiO2 3.2 Mo/SiO2 reduced by ethanol 4 Discussion 4.1 Calcined catalysts 4.2 Reduced catalysts 5 Conclusions Acknowledgements References IWASAWA 1987 187 Y IWASAWA 1993 21 Y IWASAWA 1978 2968 Y IWASAWA 1979 1465 Y IWASAWA 1983 373 Y IWASAWA 1985 105 Y MARCINKOWSKA 1984 49 K MARCINKOWSKA 1985 189 K MARCINKOWSKA 1986 75 K STENCEL 1986 4739 J RODRINGO 1986 2690 L DEBOER 1991 227 M ROARK 1992 71 R ROARK 1992 77 R WILLIAMS 1993 430 C CHE 1986 123 M LOUIS 1988 354 C LOUIS 1992 156 C LOUIS 1993 C OYAMA 1996 7173 S ZHANG 1996 10759 W ZHANG 1996 67 W CHENG 1996 477 W KISFALUDI 1991 192 G MENSCH 1988 4961 C DELARCO 1993 48 M BIRNBAUM 1983 2723 A BIRNBAUM 1984 1617 A SANCHEZ 1982 3194 C GOMEZROMERO 1996 12448 P THOUVENOT 1991 2829 R MIYANAGA 1989 1791 T REHR 1991 5135 J ICHIDA 1980 1382 H STADNICKA 1977 3859 K OKUMURA 1996 440 K KIHLBORG 1963 1485 L LIMBERG 1996 4439 C ARITANI 1996 5440 H POPE 1991 34 M JEANNIN 1980 2933 Y KIKUTANIX1999X247 KIKUTANIX1999X247X263 KIKUTANIX1999X247XY KIKUTANIX1999X247X263XY item S1381-1169(98)00309-4 S1381116998003094 1-s2.0-S1381116998003094 10.1016/S1381-1169(98)00309-4 271358 2010-09-29T22:35:22.169032-04:00 1999-06-10 1-s2.0-S1381116998003094-main.pdf https://s3.amazonaws.com/prod-ucs-content-store-us-east/content/pii:S1381116998003094/MAIN/application/pdf/b4865361f0e7632301999c1f62372c2c/main.pdf https://s3-eu-west-1.amazonaws.com/prod-ucs-content-store-eu-west/content/pii:S1381116998003094/MAIN/application/pdf/b4865361f0e7632301999c1f62372c2c/main.pdf main.pdf pdf true 687360 MAIN 17 1-s2.0-S1381116998003094-main_1.png https://s3.amazonaws.com/prod-ucs-content-store-us-east/content/pii:S1381116998003094/PREVIEW/image/png/f339ecbe32c98272085ef5cd61fab72d/main_1.png https://s3-eu-west-1.amazonaws.com/prod-ucs-content-store-eu-west/content/pii:S1381116998003094/PREVIEW/image/png/f339ecbe32c98272085ef5cd61fab72d/main_1.png main_1.png png 56579 849 656 IMAGE-WEB-PDF 1 1-s2.0-S1381116998003094-si2.gif https://s3.amazonaws.com/prod-ucs-content-store-us-east/content/pii:S1381116998003094/STRIPIN/image/gif/919cceeab076f36f845f216b7bfdab55/si2.gif https://s3-eu-west-1.amazonaws.com/prod-ucs-content-store-eu-west/content/pii:S1381116998003094/STRIPIN/image/gif/919cceeab076f36f845f216b7bfdab55/si2.gif si2 si2.gif gif 233 14 29 ALTIMG 1-s2.0-S1381116998003094-si1.gif https://s3.amazonaws.com/prod-ucs-content-store-us-east/content/pii:S1381116998003094/STRIPIN/image/gif/164b80eda7f4681dcca242f1edd003ed/si1.gif https://s3-eu-west-1.amazonaws.com/prod-ucs-content-store-eu-west/content/pii:S1381116998003094/STRIPIN/image/gif/164b80eda7f4681dcca242f1edd003ed/si1.gif si1 si1.gif gif 928 13 263 ALTIMG 1-s2.0-S1381116998003094-sc1.sml https://s3.amazonaws.com/prod-ucs-content-store-us-east/content/pii:S1381116998003094/sc1/THUMBNAIL/image/gif/3fe56aa46698078f97204db2f3dbd22d/sc1.sml https://s3-eu-west-1.amazonaws.com/prod-ucs-content-store-eu-west/content/pii:S1381116998003094/sc1/THUMBNAIL/image/gif/3fe56aa46698078f97204db2f3dbd22d/sc1.sml sc1 sc1.sml sml 1093 61 125 IMAGE-THUMBNAIL 1-s2.0-S1381116998003094-sc1.gif https://s3.amazonaws.com/prod-ucs-content-store-us-east/content/pii:S1381116998003094/sc1/DOWNSAMPLED/image/gif/7b6d0df2e66bff2868fcff93cdc1eb11/sc1.gif https://s3-eu-west-1.amazonaws.com/prod-ucs-content-store-eu-west/content/pii:S1381116998003094/sc1/DOWNSAMPLED/image/gif/7b6d0df2e66bff2868fcff93cdc1eb11/sc1.gif sc1 sc1.gif gif 12607 337 686 IMAGE-DOWNSAMPLED 1-s2.0-S1381116998003094-sc2.sml https://s3.amazonaws.com/prod-ucs-content-store-us-east/content/pii:S1381116998003094/sc2/THUMBNAIL/image/gif/dfd083c599a36b9d87027e3bdda1bfb8/sc2.sml https://s3-eu-west-1.amazonaws.com/prod-ucs-content-store-eu-west/content/pii:S1381116998003094/sc2/THUMBNAIL/image/gif/dfd083c599a36b9d87027e3bdda1bfb8/sc2.sml sc2 sc2.sml sml 1486 93 101 IMAGE-THUMBNAIL 1-s2.0-S1381116998003094-sc2.gif https://s3.amazonaws.com/prod-ucs-content-store-us-east/content/pii:S1381116998003094/sc2/DOWNSAMPLED/image/gif/01abeec14efbd9eea6d9e6a5e96c695e/sc2.gif https://s3-eu-west-1.amazonaws.com/prod-ucs-content-store-eu-west/content/pii:S1381116998003094/sc2/DOWNSAMPLED/image/gif/01abeec14efbd9eea6d9e6a5e96c695e/sc2.gif sc2 sc2.gif gif 11244 382 413 IMAGE-DOWNSAMPLED 1-s2.0-S1381116998003094-gr1.sml https://s3.amazonaws.com/prod-ucs-content-store-us-east/content/pii:S1381116998003094/gr1/THUMBNAIL/image/gif/1debb211707b47f54fcf1749b19b7670/gr1.sml https://s3-eu-west-1.amazonaws.com/prod-ucs-content-store-eu-west/content/pii:S1381116998003094/gr1/THUMBNAIL/image/gif/1debb211707b47f54fcf1749b19b7670/gr1.sml gr1 gr1.sml sml 2020 93 74 IMAGE-THUMBNAIL 1-s2.0-S1381116998003094-gr1.gif https://s3.amazonaws.com/prod-ucs-content-store-us-east/content/pii:S1381116998003094/gr1/DOWNSAMPLED/image/gif/9c3817523a7bd16670874324b9797f29/gr1.gif https://s3-eu-west-1.amazonaws.com/prod-ucs-content-store-eu-west/content/pii:S1381116998003094/gr1/DOWNSAMPLED/image/gif/9c3817523a7bd16670874324b9797f29/gr1.gif gr1 gr1.gif gif 34055 598 476 IMAGE-DOWNSAMPLED 1-s2.0-S1381116998003094-gr2.sml https://s3.amazonaws.com/prod-ucs-content-store-us-east/content/pii:S1381116998003094/gr2/THUMBNAIL/image/gif/e3b5927412e963e4aa468f8446cfb76a/gr2.sml https://s3-eu-west-1.amazonaws.com/prod-ucs-content-store-eu-west/content/pii:S1381116998003094/gr2/THUMBNAIL/image/gif/e3b5927412e963e4aa468f8446cfb76a/gr2.sml gr2 gr2.sml sml 2418 94 78 IMAGE-THUMBNAIL 1-s2.0-S1381116998003094-gr2.gif https://s3.amazonaws.com/prod-ucs-content-store-us-east/content/pii:S1381116998003094/gr2/DOWNSAMPLED/image/gif/82583cb581b28a64ecde0169f1a124b1/gr2.gif https://s3-eu-west-1.amazonaws.com/prod-ucs-content-store-eu-west/content/pii:S1381116998003094/gr2/DOWNSAMPLED/image/gif/82583cb581b28a64ecde0169f1a124b1/gr2.gif gr2 gr2.gif gif 38073 574 478 IMAGE-DOWNSAMPLED 1-s2.0-S1381116998003094-gr3.sml https://s3.amazonaws.com/prod-ucs-content-store-us-east/content/pii:S1381116998003094/gr3/THUMBNAIL/image/gif/76ccaa05d17eb3215fab72c70c46b640/gr3.sml https://s3-eu-west-1.amazonaws.com/prod-ucs-content-store-eu-west/content/pii:S1381116998003094/gr3/THUMBNAIL/image/gif/76ccaa05d17eb3215fab72c70c46b640/gr3.sml gr3 gr3.sml sml 1854 94 74 IMAGE-THUMBNAIL 1-s2.0-S1381116998003094-gr3.gif https://s3.amazonaws.com/prod-ucs-content-store-us-east/content/pii:S1381116998003094/gr3/DOWNSAMPLED/image/gif/7c7a5deb36f64be3d3adbd1a5909ee33/gr3.gif https://s3-eu-west-1.amazonaws.com/prod-ucs-content-store-eu-west/content/pii:S1381116998003094/gr3/DOWNSAMPLED/image/gif/7c7a5deb36f64be3d3adbd1a5909ee33/gr3.gif gr3 gr3.gif gif 31261 599 473 IMAGE-DOWNSAMPLED 1-s2.0-S1381116998003094-gr4.sml https://s3.amazonaws.com/prod-ucs-content-store-us-east/content/pii:S1381116998003094/gr4/THUMBNAIL/image/gif/4f045254a8c6b970ff3a37ee99cfc4c4/gr4.sml https://s3-eu-west-1.amazonaws.com/prod-ucs-content-store-eu-west/content/pii:S1381116998003094/gr4/THUMBNAIL/image/gif/4f045254a8c6b970ff3a37ee99cfc4c4/gr4.sml gr4 gr4.sml sml 1305 93 72 IMAGE-THUMBNAIL 1-s2.0-S1381116998003094-gr4.gif https://s3.amazonaws.com/prod-ucs-content-store-us-east/content/pii:S1381116998003094/gr4/DOWNSAMPLED/image/gif/3eda62a40446c49e922b8113a8dfe3ff/gr4.gif https://s3-eu-west-1.amazonaws.com/prod-ucs-content-store-eu-west/content/pii:S1381116998003094/gr4/DOWNSAMPLED/image/gif/3eda62a40446c49e922b8113a8dfe3ff/gr4.gif gr4 gr4.gif gif 11656 414 320 IMAGE-DOWNSAMPLED 1-s2.0-S1381116998003094-gr5.sml https://s3.amazonaws.com/prod-ucs-content-store-us-east/content/pii:S1381116998003094/gr5/THUMBNAIL/image/gif/ce2076cf735ba6b272baed4c89fe80da/gr5.sml https://s3-eu-west-1.amazonaws.com/prod-ucs-content-store-eu-west/content/pii:S1381116998003094/gr5/THUMBNAIL/image/gif/ce2076cf735ba6b272baed4c89fe80da/gr5.sml gr5 gr5.sml sml 1280 92 58 IMAGE-THUMBNAIL 1-s2.0-S1381116998003094-gr5.gif https://s3.amazonaws.com/prod-ucs-content-store-us-east/content/pii:S1381116998003094/gr5/DOWNSAMPLED/image/gif/faf603d4e83114580fd2340508d1650b/gr5.gif https://s3-eu-west-1.amazonaws.com/prod-ucs-content-store-eu-west/content/pii:S1381116998003094/gr5/DOWNSAMPLED/image/gif/faf603d4e83114580fd2340508d1650b/gr5.gif gr5 gr5.gif gif 17965 524 329 IMAGE-DOWNSAMPLED 1-s2.0-S1381116998003094-gr6.sml https://s3.amazonaws.com/prod-ucs-content-store-us-east/content/pii:S1381116998003094/gr6/THUMBNAIL/image/gif/55f765848ee38804b76cd8edd24341f5/gr6.sml https://s3-eu-west-1.amazonaws.com/prod-ucs-content-store-eu-west/content/pii:S1381116998003094/gr6/THUMBNAIL/image/gif/55f765848ee38804b76cd8edd24341f5/gr6.sml gr6 gr6.sml sml 2590 93 112 IMAGE-THUMBNAIL 1-s2.0-S1381116998003094-gr6.gif https://s3.amazonaws.com/prod-ucs-content-store-us-east/content/pii:S1381116998003094/gr6/DOWNSAMPLED/image/gif/31ec406b3e12806705f4883ea8e88ba6/gr6.gif https://s3-eu-west-1.amazonaws.com/prod-ucs-content-store-eu-west/content/pii:S1381116998003094/gr6/DOWNSAMPLED/image/gif/31ec406b3e12806705f4883ea8e88ba6/gr6.gif gr6 gr6.gif gif 22437 393 473 IMAGE-DOWNSAMPLED 1-s2.0-S1381116998003094-gr7.sml https://s3.amazonaws.com/prod-ucs-content-store-us-east/content/pii:S1381116998003094/gr7/THUMBNAIL/image/gif/518accecdee019ffbab458bd13aef678/gr7.sml https://s3-eu-west-1.amazonaws.com/prod-ucs-content-store-eu-west/content/pii:S1381116998003094/gr7/THUMBNAIL/image/gif/518accecdee019ffbab458bd13aef678/gr7.sml gr7 gr7.sml sml 1449 93 124 IMAGE-THUMBNAIL 1-s2.0-S1381116998003094-gr7.gif https://s3.amazonaws.com/prod-ucs-content-store-us-east/content/pii:S1381116998003094/gr7/DOWNSAMPLED/image/gif/18b89d05764e0b0cc59eac280fe80d1b/gr7.gif https://s3-eu-west-1.amazonaws.com/prod-ucs-content-store-eu-west/content/pii:S1381116998003094/gr7/DOWNSAMPLED/image/gif/18b89d05764e0b0cc59eac280fe80d1b/gr7.gif gr7 gr7.gif gif 5560 242 321 IMAGE-DOWNSAMPLED MOLCAA 2074 S1381-1169(98)00309-4 10.1016/S1381-1169(98)00309-4 Elsevier Science B.V. Scheme. 1 Schemes proposed by Iwasawa et al. for the preparation of the fixed molybdenum monomer and dimer catalysts. Scheme. 2 Schemes proposed by Iwasawa et al. for the structural changes of the fixed molybdenum monomer and dimer catalysts with reduction by ethanol. Fig. 1 Mo K-edge EXAFS of calcined molybdenum silica catalysts derived from various precursors. (a) k 3-weighted EXAFS spectrum of calcined 2.5 wt.% Mo3/SiO2. Fourier transforms of k 3-weighted Mo K-edge EXAFS for calcined Mo/SiO2: (b) 2.0 wt.% Mo1/SiO2; (c) 2.1 wt.% Mo2/SiO2; (d) 2.5 wt.% Mo3/SiO2; (e) 2.0 wt.% Mo7/SiO2; (f) 2.5 wt.% Mo3/SiO2 measured at low temperature (ca. 100 K) (Fuji-Davison #952 silica was used as supports). Fig. 2 Effect of hydration on Mo K-edge EXAFS of calcined Mo/SiO2. k 3-weighted EXAFS spectra and their Fourier transforms for 2.1 wt.% Mo2/SiO2: (a), (b) exposed over night to water vapor in a closed circulating system; (c), (d) after 5-day exposure to moist air. k 3-weighted Mo K-edge EXAFS oscillations (e), and their Fourier transform spectrum (f) of silicomolybdic acid, which were obtained with a BN diluted disk, are presented as a reference. Fig. 3 Mo K-edge EXAFS spectra of molybdenum silica catalysts from various precursors reduced by ethanol at 433 K. (a) k 3-weighted EXAFS spectrum of 2.5 wt.% Mo3/SiO2 reduced by ethanol at 433 K. Fourier transforms of k 3-weighted Mo K-edge EXAFS for molybdenum silica catalysts reduced by ethanol at 433 K: (b) 2.0 wt.% Mo1/SiO2; (c) 2.1 wt.% Mo2/SiO2; (d) 2.5 wt.% Mo3/SiO2; (e) 2.0 wt.% Mo7/SiO2 (Fuji-Davison #952 silica was used as supports. Initial pressures of ethanol were about 30 Torr and reaction time was 180 min). Fig. 4 Estimation of acetaldehyde formation accompanied with reduction of Mo/SiO2 by ethanol at various temperatures. (a) Products in a reaction of 2.5 wt.% Mo3/SiO2 with ethanol at 513 K. (b) Net amount of acetaldehyde formation with reduction of the catalysts, estimated by substructing amount of the ethane formation from the total acetaldehyde formation (Reaction temperatures: 433–513 K). Fig. 5 Reduction temperature dependence of Mo K-edge EXAFS of Mo/SiO2 reduced by ethanol. (a) EXAFS Fourier transformed spectra of 2.5 wt.% Mo3/SiO2 reduced by ethanol in the temperature range of 403–513 K, and (b) those of 2.1 wt.% Mo2/SiO2 in the range of 433–513 K. In each case, spectrum was taken after the reduction virtually had ceased. For Mo2/SiO2 reduced at 513 K, a sample with prolonged contact with ethanol was also measured. Reaction time was 150 and 360 min, respectively. Fig. 6 Mo–Mo EXAFS peaks of reduced molybdenum oxides on supports. Fourier transforms of k 3-weighted Mo K-edge EXAFS for the following: (a) 2.5 wt.% Mo3/SiO2 reduced by methanol at 513 K; (b) 2.5 wt.% Mo3/SiO2 reduced by H2 at 773 K (average oxidation state of the latter was estimated to be ca. +5 with H2 consumption); (c) 2.5 wt.% Mo3/Al2O3 reduced by ethanol at 513 K; (d) 9.7 wt.% Mo1/Al2O3 reduced by ethanol at 513 K. Fourier transformation range for 2.5 wt.% Mo3/Al2O3 was 3.5–12.9 Å−1. Fig. 7 UV–VIS spectra of 0.6 wt.% Mo1/SiO2: (a) with ethanol adsorbed at room temperature; (b) reduced by ca. 20 Torr of ethanol at 433 K, 10 min; (c) at 433 K, 60 min; (d) at 513 K, 120 min. Distortions near 850 nm were due to incompleteness of smoothing discontinuities accompanied with exchange of detectors. Table 1 Curve fitting results for silica supported molybdenum catalysts reduced by ethanol Sample B.S. C.N. R ΔE 0 D.W. R f Mo1/SiO2 433 K Mo 0.4 (0.2) 2.63 (0.02) −2 (8) 0.059 (0.019) 4.8% O 0.5 (0.2) 1.70 (0.02) −1 (10) 0.054 (0.019) O 1.4 (0.7) 2.01 (0.02) −4 (8) 0.083 (0.020) Mo2/SiO2 433 K Mo 0.5 (0.2) 2.63 (0.02) −5 (7) 0.059 (0.017) 4.7% O 0.6 (0.3) 1.70 (0.02) −1 (9) 0.066 (0.018) O 2.4 (0.9) 1.99 (0.02) −8 (7) 0.097 (0.015) Mo2/SiO2 483 K Mo 0.8 (0.3) 2.62 (0.02) 0 (6) 0.069 (0.016) 4.2% O 0.4 (0.2) 1.68 (0.04) 8 (18) 0.04 (0.05) O 2.8 (0.9) 2.01 (0.02) −6 (7) 0.090 (0.015) Mo2/SiO2 513 K (150 min) Mo 0.9 (0.3) 2.62 (0.02) 0 (5) 0.068 (0.012) 2.8% O 0.5 (0.3) 1.69 (0.03) 8 (13) 0.06 (0.03) O 3.0 (0.9) 2.00 (0.02) −6 (5) 0.093 (0.012) Mo2/SiO2 513 K (360 min) Mo 0.9 (0.3) 2.61 (0.02) −0 (5) 0.070 (0.013) 3.4% O 0.2 (0.2) 1.68 (0.05) 3 (26) 0.03 (0.12) O 3.3 (0.9) 2.00 (0.02) −8 (5) 0.091 (0.011) Mo3/SiO2 403 K Mo 0.3 (0.2) 2.65 (0.04) 3 (13) 0.06 (0.04) 5.1% O 0.7 (0.2) 1.69 (0.01) −3 (6) 0.054 (0.014) O 1.1 (0.7) 2.02 (0.04) 5 (13) 0.09 (0.04) Mo3/SiO2 433 K Mo 0.5 (0.2) 2.63 (0.02) −5 (7) 0.056 (0.018) 4.0% O 0.5 (0.2) 1.69 (0.02) −1 (10) 0.054 (0.023) O 1.9 (0.7) 1.99 (0.02) −8 (7) 0.085 (0.016) Mo3/SiO2 448 K Mo 0.6 (0.2) 2.65 (0.02) 2 (7) 0.056 (0.017) 3.2% O 0.5 (0.2) 1.69 (0.02) 8 (10) 0.049 (0.020) O 2.0 (0.7) 2.00 (0.02) −5 (5) 0.079 (0.017) Mo3/SiO2 513 K Mo 0.8 (0.3) 2.61 (0.02) 0 (6) 0.061 (0.015) 4.2% O 0.7 (0.8) 1.68 (0.04) −2 (13) 0.08 (0.03) O 4.2 (1.2) 1.97 (0.02) −9 (5) 0.101 (0.014) Mo7/SiO2 433 K Mo 0.4 (0.2) 2.63 (0.02) −3 (8) 0.056 (0.020) 5.2% O 0.4 (0.2) 1.70 (0.02) −1 (11) 0.047 (0.023) O 1.1 (0.6) 2.01 (0.02) −4 (9) 0.076 (0.020) B.S.: backscatterer. C.N.: coordination number. R: distance/Å. ΔE 0: energy correction/eV. D.W.: Debye–Waller factor/Å2. R f: R-factor. Fourier transformation range: 3.5–16 Å−1. Inverse Fourier transformation range: 1.03–2.67±0.05 Å. Numbers in parentheses are errors. They represent the maximum ambiguities of the parameters not to make R f value twice at the local minima. Table 2 Curve fitting results for silica supported molybdenum catalysts reduced by methanol and H2 Sample B.S. C.N. R ΔE 0 D.W. R f Mo3/SiO2 reduced by MeOH Mo 0.7 (0.3) 2.63 (0.02) −1 (7) 0.070 (0.017) 4.2% O 0.4 (0.2) 1.67 (0.03) −1 (15) 0.05 (0.04) O 2.4 (0.7) 2.01 (0.02) −5 (6) 0.086 (0.013) Mo3/SiO2 reduced by H2 Mo 0.4 (0.2) 2.62 (0.02) −6 (8) 0.07 (0.02) 4.1% O 0.2 (0.1) 1.65 (0.04) −3 (18) 0.05 (0.05) O 2.2 (0.7) 2.00 (0.02) −8 (6) 0.095 (0.013) B.S.: backscatterer. C.N.: coordination number. R: distance/Å. ΔE 0: energy correction/eV. D.W.: Debye–Waller factor/Å2. R f: R-factor. Fourier transformation range: 3.5–16 Å−1. Inverse Fourier transformation range: 1.0–2.67 Å (MeOH) and 1.0–2.6 Å (H2). Table 3 Curve fitting results for alumina supported molybdenum catalysts reduced by ethanol Sample B.S. C.N. R ΔE 0 D.W. R f Mo3/Al2O3 2.5 wt.% Mo 0.8 (0.3) 2.66 (0.02) 2 (6) 0.094 (0.016) 1.6% O 0.5 (0.1) 1.67 (0.01) −6 (6) 0.050 (0.013) O 1.3 (0.2) 2.03 (0.01) −4 (4) 0.067 (0.009) Mo1/Al2O3 9.7 wt.% Mo 1.0 (0.4) 2.63 (0.02) 4 (5) 0.098 (0.016) 1.3% O 0.4 (0.2) 1.66 (0.02) −0 (9) 0.06 (0.02) O 2.9 (0.4) 2.01 (0.01) −7 (3) 0.086 (0.006) B.S.: backscatterer. C.N.: coordination number. R: distance/Å. ΔE 0: energy correction/eV. D.W.: Debye–Waller factor/Å2. R f: R-factor. Fourier transformation range: 3.5–12.9 (2.5 wt.%) and 3.4–16.0 (9.7 wt.%) Å−1. Inverse Fourier transformation range: 0.98–2.67 Å. Table 4 Curve fitting results using Mo–Al parameters for alumina supported molybdenum catalysts reduced by ethanol Sample B.S. C.N. R ΔE 0 D.W. R f Mo3/Al2O3 2.5 wt.% Al 0.7 (0.4) 2.70 (0.03) 8 (8) 0.05 (0.05) 3.0% O 1.0 (0.3) 1.68 (0.02) −6 (7) 0.080 (0.016) O 2.1 (0.7) 2.02 (0.02) −4 (4) 0.082 (0.016) Mo1/Al2O3 9.7 wt.% Al 1.0 (0.6) 2.68 (0.04) 8 (7) 0.07 (0.03) 2.5% O 0.4 (0.2) 1.67 (0.03) −0 (11) 0.06 (0.03) O 3.3 (0.7) 2.00 (0.01) −7 (4) 0.093 (0.010) B.S.: backscatterer. C.N.: coordination number. R: distance/Å. ΔE 0: energy correction/eV. D.W.: Debye–Waller factor/Å2. R f: R-factor. Fourier transformation range: 3.5–12.9 (2.5 wt.%) and 3.4–16.0 (9.7 wt.%) Å−1. Inverse Fourier transformation range: 0.98–2.67 (2.5 wt.%) and 1.01–2.67 (9.7 wt.%). Structures of molybdenum silica catalysts reduced by ethanol, and their relations to catalytic oxidation reactions I. Structure changes of Mo/SiO2 with gradual reduction by ethanol Y Kikutani 2-5-15 Takaidohigashi, Suginami-ku, Tokyo 168-0072, Japan Structural changes of silica supported molybdenum catalysts accompanied with reduction by ethanol were investigated with EXAFS and UV–VIS spectroscopies. Catalysts made from four different precursors were investigated, and it was demonstrated that the dependence on preparation method was small. Catalysts prepared by the reaction between surface hydroxide groups and organometallic complexes are called `fixed catalysts' and some researchers assert that fixed Mo/SiO2 have uniform and specific molecular-like active sites, which remains controversial. It was found that what had been proposed as characteristics of the molecular-like active sites of the fixed catalysts were merely prejudiced interpretation of a few aspects in the structural changes common to Mo/SiO2 in general. At least two distinctive states existed in the course of reduction. One has IVCT (intervalence charge transfer) absorption band and corresponds to shallow reductions. The other has 2.6 Å Mo–Mo bond and average oxidation state of it was estimated to be +5. Structure similar to the latter was found also on alumina supported Mo catalysts and can be considered thermodynamically stable. Keywords Molybdenum Fixed catalysts EXAFS UV–VIS Ethanol Intervalence charge transfer (IVCT) band 1 Introduction Usually, heterogeneous solid catalysts are comprised of many atoms under many different situations. They are sticking to and correlating with each other. This ill-defined nature makes researches of heterogeneous catalyses difficult. Frequently, different researchers give contradictory results on the same heterogeneous system, and consensus can seldom be reached from the discrepancy. Catalysts prepared utilizing reaction between surface hydroxide groups and organometallic compounds are called fixed (or immobilized, heterogenized homogeneous) catalysts. Researchers engaged in fixed catalysts has been thinking that they can avoid the problem of heterogeneous catalysts. Unlike many diverse reactions occurring in an ordinary impregnation process, they think, a selective and clean reaction in a fixing method will produce active sites which are molecularly well-defined and reflect incipient structure of the precursor complexes [1–4]. Fixed molybdenum monomer and dimer catalysts proposed by Iwasawa et al. are most representative example of the fixed catalysts. These authors asserted that allyl molybdenum complexes, Mo(C3H5)4 and Mo2(C3H5)4, react with OH groups on silica to give well-defined monomeric [5, 6]and dimeric [7–9]molybdenum sites, respectively, reflecting initial nuclearity of the precursor complexes. They also asserted that the bonds anchoring Mo to the supports were so firm that the monomeric and pair-like structures were conserved even under treatments with oxygen or hydrogen at high temperatures like 773 K (Scheme. 1 ). Iwasawa et al. investigated reactivities of the fixed monomer and dimer catalysts and concluded that uniform and unique monomer and dimer sites were really existing. On the other hand, fixed molybdenum catalysts are sometimes regarded as questionable. As molybdenum is an important element in many mixed oxide catalysts, supported molybdenum oxides are frequently investigated, even though they are not practically in use by themselves [10–29]. For Mo/SiO2 systems, catalysts of relatively low loadings are mainly studied, because interactions between silica and supported molybdenum oxide species are weak and microcrystals of MoO3 are inevitably formed where the loadings are high. Some researchers who were investigating low loading Mo/SiO2 catalysts tried to make the fixed catalysts for comparison. Kaliaguine and his coworkers applied the UV–VIS and other techniques to compare the fixed Mo monomer catalysts prepared with Mo(C3H5)4 and conventional ammonium heptamolybdate (AHM) impregnated catalysts [10–14]. Contrary to the insistence of Iwasawa et al., they concluded that there were no large differences between them. Instead significant difference was observed between samples with different hydration states. They suggested that silicomolybdic acids (SMA) were formed by the extraction of Si from supports upon exposure to atmospheric conditions. They also showed that the fixed catalysts were not so strongly fixed that water easily removed most molybdenum from the support. Research groups of Koningsberger and Wachs used catalysts prepared by many different precursors and silica, and investigated them with Raman and EXAFS spectroscopies [15–18]. They insisted that after calcination, any molybdenum on SiO2, including those prepared from Mo2(C3H5)4, would spread on the supports, and after hydration, polymolybdate-like structures were formed. They also compared the catalytic activity of these catalysts in methanol oxidation and found no significant difference. Based on these results, they claimed that the difference in catalysis of the Mo/SiO2 with different preparation methods is not so drastic as has been imagined, and that structural changes of the catalysts under some conditions are much important. Whether it was really possible to prepare well-defined molecular-like active sites or not is a critical problem, and thus more detailed inspection is needed. Pointing out that catalysts newly prepared by the fixing method are not special or showing that some reported properties of the fixed catalysts are not reproducible is not enough in itself, because from the view point of the fixed catalysts researchers, these refutations are resulting from insufficient skill in preparation of the catalysts [4]. It is necessary to pay more attention to evidence presented for the fixed catalysts. We have to reconsider whether the evidence really demonstrated that the active sites of the fixed catalysts were well-defined and molecular-like. And if it did not, we have to reconsider what it really was. Structures of the fixed monomer and dimer molybdenum silica catalysts reduced by ethanol were first investigated by Iwasawa et al. [5, 8, 9]. They believed that reduction of both the monomer and dimer catalysts by ethanol were clean one-step reactions, in which exactly one ethanol molecule react with one active site. Oxidation state of a monomer site after calcination is +6 and it is reduced to +4 with formation of one acetaldehyde molecule per one molybdenum atom. Oxidation state of a dimer site after calcination is +6 and it is reduced to +5 with formation of 0.5 acetaldehyde molecule per one molybdenum atom (Scheme. 2 ). To support the reaction scheme, EXAFS spectra were presented [9]. An EXAFS spectrum of the dimer catalysts after calcination at 773 K was very similar to that of the monomer catalysts and it indicated no peak corresponding to Mo–Mo bonds. But when it was measured at 80 K, Mo–Mo peak was observed. From these results it was speculated that the disappearance of Mo–Mo features in the spectrum of the calcined catalysts at room temperature was thermal vibration and the molybdenum pairs remained intact though there was only a negligible peak for Mo–Mo in the spectrum. A spectrum of the catalysts reduced by ethanol at 433 K showed a peak corresponding to Mo–Mo distances about 0.26 nm. Although the coordination number was only 0.5, Iwasawa et al. assumed that this was an indication of the uniform dimer structure. EXAFS spectrum of the monomer catalysts reduced by ethanol was not issued. In this paper, structural changes of Mo/SiO2 catalysts accompanied with reduction by ethanol were investigated more thoroughly, aiming to give rational explanation for both the old data of the fixed catalysts and for the refutation against it. 2 Experimental 2.1 Preparation of catalysts 2.1.1 Catalysts prepared from MoO2(acac)2·2 H2O MoO2(acac)2·2H2O was commercial reagent (Wako–Dojindo) and was not purified further. SiO2 (Fuji-Davison's #952 silica: 250 m2/g) and Al2O3 (Nishio γ-alumina A-11: 120 m2/g) were used as supports, and they were impregnated with methanol solution containing appropriate amount of MoO2(acac)2·2 H2O. Then the solvent was removed by heating in a water-bath, and dried at 373 K. 2.1.2 Catalysts prepared from Mo2(C3H5)4 Fuji-Davison #952 silica were used as supports. Otherwise the catalysts were prepared by the same method as the literature [7]. Mo2(C3H5)4 was synthesized under high purity Ar (99.9999%) and recrystallized in pentane at 193 K. SiO2, which was pretreated by evacuation at 473 K, was mixed with pentane solution of Mo2(C3H5)4 at 273 K. Unreacted Mo2(C3H5)4 was removed by washing repeatedly with pentane, and the loadings of the catalysts were estimated from the amount of Mo2(C3H5)4 in the initial solution and in the wash liquid. The catalysts were dried by evacuation and sealed in U-shaped Pyrex-glass tubes. All the processes in the catalyst preparation were performed in a flow of high purity Ar or under vacuum. 2.1.3 Catalysts prepared from [Mo3O2(OAc)6(H2O)(OH)2]·xH2O [Mo3O2(OAc)6(H2O)(OH)2]·xH2O was made by literature method [30, 31]with a slight modification, namely, the amount of Zn metal added as a reducing agent was decreased from 3–7 times excess to the stoichiometric value. NMR measurements in CD3OD confirmed that there only bridging acetate ligands existed, and estimate value of hydrating water was determined with peaks in the spectra. Methanol solution of [Mo3O2(OAc)6(H2O)(OH)2]·xH2O was impregnated on #952 silica or Nishio γ-alumina. The solvent was removed by evacuation. 2.1.4 Catalysts prepared from AHM They were prepared by impregnation of SiO2 (Davison #952) with AHM in water solution. The catalysts were calcined at 773 K for 1 h. In the following, these catalysts are denoted as Mo1/support, Mo2/support, Mo3/support and Mo7/support, respectively, referring to their precursors' nuclearity. 2.2 EXAFS spectroscopy [32] Mo K-edge EXAFS spectra were measured with a Si(111) double crystal monochromator at the BL-7C station and with a Si(311) channel-cut monochromator at the BL-10B station of the Photon Factory in the National Laboratory for High Energy Physics. Synchrotron ring energy was 2.5 GeV and the ring current was about 200–350 mA. Samples were sealed in glass cells with Kapton (Toray–Dupont) windows without contacting air. Spectra were taken at room temperature unless otherwise mentioned. For low temperature measurement, a cryostat was used to cool samples. Obtained spectra were analyzed by curve-fitting method with a program `REX' provided by RIGAKU. Spectra of Mo foil (for Mo–Mo) and K2MoO4 (Mo–O) were used as references (of phase and amplitude functions). Fourier Transformations were performed within the range of 3.5–16 Å−1, unless otherwise mentioned. 2.3 Diffuse reflectance (DR) UV–VIS spectroscopy Samples were transferred to flat quartz cells without air exposure, and the spectra were recorded by HITACHI U3500 spectrometer equipped with a integrating sphere. Reflection from MgO (Wako, 0.1 mm) in the same cell was used as a reference with 100% reflection. Ordinates of the graphs were logarithms of Kubelka–Munk remission function F(R) [33]. 3 Results 3.1 Calcined Mo/SiO2 It is not necessary to comment much about calcined Mo/SiO2, because the results obtained here were basically the same as those presented by de Boer et al. [15]. Fig. 1 shows EXAFS spectra of the calcined Mo/SiO2. Backscattering from Mo can be detected only in a noise level, and no significant variations can be seen among those spectra with different precursors. A spectrum obtained at lower temperature (100 K) was not so different from the one obtained at room temperature (Fig. 1(f)). Fig. 2 shows structural change of calcined Mo/SiO2 when they were exposed to air humidity. As de Boer and coworkers have pointed out, a Mo–Mo peak appeared. The Mo–Mo peak for the sample exposed to moist air for a longer time was larger than that of the one exposed for a shorter time. The position of the second shells in the spectra is similar to that of Keggin type heteropolyanion [SiMo12O40]4−. The first shell in the spectrum of the more highly hydrated sample is significantly smaller than that of less hydrated samples or that of samples just after calcination. 3.2 Mo/SiO2 reduced by ethanol When calcined Mo/SiO2 were exposed to ethanol at 433 K without oxygen, the molybdenum species were reduced and acetaldehyde was formed. Ethene and diethyl ether were also detected but they were formed by the dehydration of ethanol and were not related to the reduction of the catalysts (water must be also formed but was not measured). Fig. 3 shows k 3-weighted EXAFS Fourier transformed (FT) spectra of the catalysts when the formation of acetaldehyde was virtually stopped in the reduction with ethanol at 433 K, namely at the point where structural change of the catalysts at this temperature was almost completed. The spectra of the catalysts prepared from different precursors are similar to each other and also to the spectra of the fixed dimer catalysts obtained previously in the literature under comparable conditions [9]. Fig. 4 (a) shows a profile of product formation in the reaction of 2.5 wt.% Mo3/SiO2 with ethanol at 513 K. When the reaction temperature was above 473 K, ethane was formed together with ethene, diethyl ether and acetaldehyde, but dihydrogen was not detected. Formation of one molecule of acetaldehyde is accompanied with two electron reduction of the catalysts. Ethane may be formed by a disproportionation reaction of two molecules of ethanol into acetaldehyde and ethane (Eq. (1)), though detailed reaction mechanism is not clear (1) 2C 2 H 5 OH→CH 3 CHO+C 2 H 6+H 2 O Thus, change in the average oxidation states of molybdenum species can be deduced from the amount of acetaldehyde formation minus the amount of ethane formation. Time courses of net acetaldehyde formation accompanied by the reduction of the catalysts are plotted in Fig. 4(b) for reduction temperatures from 433 to 513 K (for temperatures lower than 473 K, the lines coincide with amounts of acetaldehyde formation, because ethane was not detectable). Each line seems to asymptotically converging to a certain value and the value depends on the reduction temperature. In other words, molybdenum species will be reduced to a certain limit for a given temperature and further reduction proceeds only slowly. Above 473 K the temperature dependence of the limit gets smaller and the molybdenum species would not be reduced lower than +5, which corresponds to 0.5 acetaldehyde formation per molybdenum atom. The same phenomena were observed with the catalysts from the other precursors. EXAFS FT spectra of 2.5 wt.% Mo3/SiO2 reduced by ethanol at 403–513 K are shown in Fig. 5 (a), and those of 2.1 wt.% Mo2/SiO2 reduced at 433–513 K are in Fig. 5(b). Again, the catalysts derived from different precursors show quite small differences. At first sight of the spectra, it can be recognized that the Fourier components mainly comprise of two distinct shells. The two peaks grow as the reduction temperature is raised from 433 up to 473 K, but the positions of the peaks scarcely change. Over 473 K, changes in the spectra are less significant, as synchronizing with the oxidation level change of the molybdenum which can be seen in Fig. 4(b). The EXAFS curve fitting results for the reduced Mo/SiO2 are summarized in Table 1 . Fig. 6 (a) shows EXAFS FT spectrum of 2.5 wt.% Mo3/SiO2 reduced with methanol of an initial pressure of 40 Torr at 513 K 360 min. Fig. 6(b) shows EXAFS FT spectrum of 2.5 wt.% Mo3/SiO2 reduced by dihydrogen at 773 K 180 min. The spectra for these two types of catalysts contain the same characteristic Mo–Mo peaks. Curve fitting results for them are summarized in Table 2 . Structural change of molybdenum catalysts supported on alumina was also compared. Ethanol of initial pressure 40 Torr was introduced to 2.5 wt.% Mo3/Al2O3 at 513 K. Alumina supports catalyze competing dehydration reaction so efficiently that ethanol in a closed circular system will consumed rapidly. So reaction gas was evacuated and ethanol was added in each 30 min. Spectrum obtained after 90 min of reduction are shown in Fig. 6(c). Spectrum of 9.7 wt.% Mo1/Al2O3 treated in the same way as above were shown in Fig. 6(d). Curve fitting parameters for them are listed on Table 3 . Mo–Mo peaks were also observed but the EXAFS oscillation amplitudes were smaller than those of corresponding silica supported catalysts because of larger Debye–Waller-like factors of the Mo–Mo bonds in the molybdenum species supported on alumina. In Fig. 7 the UV–VIS spectra of a low loading 0.6 wt.% Mo1/SiO2 are presented. Here, the low loading catalysts were chosen because those of higher loadings had so strong absorption that reflection from them were very weak. Though the low loading catalyst may have fewer active components as will be described in the part II, the feature of them was the same as that of higher loading one (UV–VIS spectra of 2.0 wt.% Mo1/SiO2 were basically the same as the 0.6 wt.% ones but contained considerable uncertainties). The spectra of calcined catalysts had peaks near 300 nm and they may correspond to LMCT from oxygen to molybdenum. For the catalysts reduced at 433 K, a strong absorption appears at about 750 nm, which is a well known absorption band of molybdenum blue due to intervalence charge transfer (IVCT) between Mo(5+) and Mo(6+) centers [21, 34–36]. Evolution of the absorption of the catalysts in the course of reduction did not progress in a linear way. IVCT band grew at the first stage, but as the catalysts were reduced further broad absorption expanding from 400 nm into the visible region got stronger and finally the IVCT band slightly diminished. 4 Discussion 4.1 Calcined catalysts It was confirmed in the present experiments that no Mo–Mo EXAFS peak is observable for calcined low loading Mo/SiO2, and that is totally in line with the results of researchers who claim that the fixed catalysts are not correct. It is also not contradict with the results for the fixed monomer and dimer catalysts by Iwasawa et al., as far as spectra taken at room temperature are concerned. Only the Mo–Mo peak observed at low temperature for the dimer catalysts was inconsistent, because it did not appear this time. To get a collective view, rational explanation for the appearance of the Mo–Mo peak is inevitable. So the peak will be considered thoroughly in the following. It should be underscored that position of the Mo–Mo peak for the fixed dimer catalysts is remarkably close to that of hydrated Mo/SiO2 catalysts. Effect of adsorbed water on the structures of Mo/SiO2 has been investigated by EXAFS [15], UV–VIS spectroscopy [11], and 29 Si NMR [37]. Among them the NMR result is most eminent because whereas other method could suggest only the formation of polymolybdate-like structure in the presence of adsorbed water, NMR could present that Si was incorporated into the position which is similar to the tetrahedral site in [SiMo12O40]4−. De Boer et al. had tried EXAFS curve fitting method with hydrated structure of molybdenum silica catalysts though they did not commented what type of molybdate it was. They might have thought that it is beyond the limitation of this spectroscopy. SMA's EXAFS FT spectrum has two characteristic shells. One is a very vague Mo–O shell which may be caused by interference of signals from different bond lengths [38]. The other is a Mo–Mo shell near 3.0 Å which is accompanied with a smaller peak at 3.5 Å. Both of the characteristics were found also in the spectrum of the Mo/SiO2 catalysts exposed to moist air for a long time (Fig. 2(d)), and it is quite reasonable to consider the structure of molybdenum under that condition to be similar to SMA. By model calculation using the Feff 6 program [39]and X-ray crystal structure parameters of a Keggin anion [40], it was realized that the shape of the second shell is mainly derived from the overlapped backscatterings of edge- and corner-sharing molybdenum atoms getting back directly or with a reflection at an oxygen atom. Such an overlap of many comparably weighted EXAFS oscillations with different path length usually gives a spectrum difficult to analyze with curve fitting methods. It is noteworthy that when the larger peak of the second shell was inverse Fourier transformed and curve fitting was done with the oscillations, they could be fitted with only one Mo backscatterer model quite well, though the parameter of coordination number was liable to get too small for the real Keggin structure. The peak alters its position nearly 0.1 Å with different choice of FT filtering range, and the variation is quite larger than a peak from a single distance. That is because of the interference of many contributions [41]. Mo/SiO2 which was not so completely hydrated (Fig. 2(b)) had a second shell almost at the same position as SMA. There were some differences in the dependence on different choice of FT filtering range. Whether there existed a structure other than SMA or it was a result of interference between signal from SMA and signal from molybdenum remaining in different states is not clear. Because the distance is similar to SMA, the structure of hydrated Mo/SiO2 must contain edge-shared Mo coordination spheres in any way. With the same choice of FT range, the Mo–Mo peak in the partly hydrated Mo/SiO2 coincided well with that of the fixed dimer's peak. So it is highly probable that the leakage of the cell had led to the partial construction of polymolybdate-like structure in the low temperature measurement by Iwasawa et al., and the second shell peak was mistaken as an indication of paired molybdenum ions fixed on the support. The structure of the dimer catalysts proposed by Iwasawa et al. was comprised of two molybdenum atoms which were nearby but with no oxygen ion to bind them together. They thought that random and independent thermal vibration of the two molybdenum atoms caused the large Debye–Waller-like factor. But this model is not realistic in itself. Considering simple geometry with Mo–O distances of about 1.7 Å and repulsion between two Mo(6+) ions, the structure proposed by Iwasawa et al. is unfeasible [36]. If two molybdenum oxo species were placed without sharing any oxygen ligands, the distance between the two molybdenum should be much larger than the value of 3.3 Å (Iwasawa et al. reported the distance was 3.0 Å, but it might have been a local minimum of the curve fitting). Even in MgMo2O7, which has Mo2O7 2− anion where two MoO4 tetrahedra share a vertex, the shortest distance between Mo–Mo is 3.685 Å [42]. The observed Mo–Mo distance is attributed to that of edge-shared Mo(6+) coordination polyhedra. It is hard to think of a thermal Debye–Waller-like factor so large as to obscure Mo–Mo signal with such a strong interaction. De Boer et al. [15]also argued with a spectrum of calcined Mo/SiO2 without contacting air humidity that molybdenum species were spread over the silica support as monomers because there no Mo–Mo derived oscillations in the EXAFS were observed. The present experiments support the absence of the peak, but it cannot be said unambiguously that molybdenum were really spread monomerically. If there were large static disorders around molybdenum, many slightly different Mo–Mo distances can result in destructive interference of the EXAFS waves. Peak of heteropoly anions were often much smaller than expected from the real number of near atoms, and for molybdenum oxo species on amorphous supports, static disorder must be much larger. It was observed that EXAFS oscillation of silica supported zirconia contained no clear Zr–Zr peaks whereas the loading was corresponding to monolayer zirconium oxide [43]. 4.2 Reduced catalysts The 2.6 Å Mo–Mo bond observed in the fixed dimer catalysts was proposed as the most distinctive feature for unique and well-defined dimeric active sites [9]. In the present experiments, it was shown that Mo/SiO2 prepared by different methods also had the same characteristic, and it conclusively denies uniqueness of the fixed catalysts. Now we have to reinterpret the experimental results as representing some structures generally appearing on Mo/SiO2 with comparable loadings and conditions. Iwasawa et al. thought that formation of the 2.6 Å Mo–Mo bond was direct transformation of the Mo(6+)–Mo(6+) pair into Mo(5+)–Mo(5+) dimer, but it is groundless. Time courses of acetaldehyde formation in Fig. 4 and EXAFS spectra in Fig. 5 suggest that the structure was made with more complicated processes rather than a simple one step reduction. From some graphs presented by Iwasawa et al. themselves, it is confirmed that at 423 K or 436 K, the old monomer [5]and the dimer catalysts [8]were also not reduced by ethanol to average oxidation state +5, though these authors did not seem to be aware of it. UV–VIS spectra in Fig. 7 also support that. At least two states of reduced molybdenum oxo species should be considered to understand the structural changes, which are called in the present report the blue state (IVCT absorption at 750 nm) and the brown state (absorption at 400 nm), respectively, from their colors. The dark brown color which appears on the catalysts reduced at higher temperatures may be due to an excitation to the energy levels of the 2.6 Å Mo–Mo bonds. Simple d-electron transitions of isolated molybdenum should have much weaker absorbance. This bond length and the coordination number as large as 0.8 are uncommon in bulk molybdenum oxides, and it is not attributable to known compounds. In the shear structures of the partially reduced molybdenum oxides and in the so-called molybdenum bronzes, d-electrons were delocalized and do not form such a strong metal–metal bond as short as 2.6 Å. In Mo17O47, Mo–Mo distance of 2.63 Å can be found but average oxidation state of the solid is much higher than +5 and the contribution from the short Mo–Mo bond to the whole structure is much smaller [44]. MoO2 has a rutile-like structure in which a double-bond-like interaction keeps two Mo(4+) atoms at 2.51 Å (coordination number 1). So it is incapable to draw a distinct picture of the brown state structure from the EXAFS data. The bond length 2.6 Å can be thought of as that of a single bond. But even when Mo–Mo single bond is assumed a structure containing triangular Mo(4+)3 unit, for example, may also be possible besides Mo(5+)2 dimer structure. The structural units containing 2.6 Å Mo–Mo bond can exist as isolated ones dispersed on the silica supports, or they may be a part of more aggregated polyanion or particles. For example, aggregation of Mo(5+) oxochloride alkoxide is thought to proceed via polymerization of dimeric units with a Mo–Mo bond [45]. Whether the units are isolated or aggregated cannot be determined only by EXAFS. There must be some interaction between the supports and the molybdenum species with the Mo–Mo bonds. Quite larger Debye–Waller-like factors of the Mo–Mo bonds in the alumina supported catalysts may be derived from interaction stronger than that of Mo/SiO2 catalysts. This does not imply that dispersed species are more likely, because if the aggregates were sufficiently small, the interactions with the supports may alter the structures in the aggregates significantly. The large Debye–Waller factors remind us of the EXAFS measurements of reduced Mo–Mg mixed oxides reported by Aritani et al. [46]. Mixed oxides containing low molybdenum proportions reduced by dihydrogen showed a second shell in Mo K-edge EXAFS FT spectra at similar position as in the present experiments with Mo/SiO2 and Mo/Al2O3. They concluded using the curve fitting method that the peaks were from Mo–Mg bonds. It is also possible to use Mo–Al model for the EXAFS spectra of the Mo/Al2O3 catalysts, for example, as shown in Table 4 . Mg and Al have similar backscattering properties because atomic numbers of them only differ by one. Magnesium oxide supports are also suggested to have strong interactions with supported materials. It may be possible that the strong interaction caused large Debye–Waller-like factors to make large k part of the Mo–Mo EXAFS oscillation to diminish and render the shape of overall amplitude resembling that of lighter elements. The same situation may be concluded in this experiment because no attractive interactions can be expected between Mo and Mg or Al to get them as close to 2.6 Å. To summarize, the brown state of the reduced molybdenum species may be considered to have molybdenum units with the 2.6 Å Mo–Mo bond(s), but the extent of aggregation of the units is not clear. They have some interactions with supports and are so stable as to be formed with a variety of oxide supports. The strong IVCT absorption is responsible for the blue state of reduced molybdenum species. This kind of absorption is associated with electron transfer from Mo(5+) to Mo(6+). The structure may be similar to those of other molybdenum compounds which exhibit IVCT absorption. So, the structure may be suggested as aggregates of at least several molybdenum atoms, only a part of which are reduced to oxidation state +5. Distances between molybdenum atoms in the aggregates must be not as short as 2.6 Å. The 2.6 Å bonds in the brown state means considerable mixing of the energy levels of the molybdenum atoms while there must be localized orbitals which can be considered as separate potential wells for IVCT to occur. It is known from X-ray crystallography that polyoxomolybdates which is reduced to the oxidation state with IVCT absorption have almost the same atomic positions as those of non-reduced anions [34]. On the other hand, molybdenum atoms in the aggregates must not be so far apart in order to make the charge transfer possible. Usually, there are bridging oxygen ions in aggregates which exhibit IVCT absorption. Thus, the distance between molybdenum atoms of Mo/SiO2 in the blue state may be distributed around 3.5 Å which is typical for the distances of molybdenum atoms in oxidized polymeric molybdenum oxo compounds. But even in the EXAFS spectra of the catalysts reduced by ethanol at 433 K where the proportion of the brown state molybdenum species should be about 50% of the maximum, no other Mo–Mo bonds could be seen. One possibility to explain the absence of EXAFS Mo–Mo peaks for the blue state is that proportion of molybdenum species in the blue state was small. Then the rest of the molybdenum might be dispersed monomerically and their contributions to EXAFS had no Mo–Mo characters. They were likely to be at oxidation state +6 because if they were monomeric Mo(+5)s, they should have exhibited EPR signals which were not observed in the previous reports of the reduced fixed Mo/SiO2, and oxidation states lower than +5 were unlikely considering the limited amount of acetaldehyde formation with the reduction of the catalysts by ethanol. This assumption has one difficulty because IVCT band which rivals LMCT peak is too strong for minor impurities in the catalysts (relative intensities of IVCT to LMCT absorption in the case of Keggin type polyanion with reduction of one electron per one anion was reported to be roughly 1:5 [35]. UV–VIS DRS of amorphous molybdenum blue was shown by Che et al. in which LMCT and IVCT absorption have nearly the same intensities [21]). If the UV–VIS spectra represents correct absorption strength, the situation was that the proportion of molybdenum in the blue state was large though the Mo–Mo distance of them were not observable in EXAFS measurements. So second possibility to explain the spectra of Mo/SiO2 reduced by ethanol at 433 K is that extremely large static disorders in the aggregates of molybdenum in the blue state. Third possibility is a hybrid of the first and the second, namely that Mo–Mo bonds other than the 2.6 Å bond could not be observed because some parts of the molybdenum were dispersed and the other large part were aggregates with large disorder. The third explanation is most likely, considering effect of loadings on the catalytic activities which will be discussed in the following paper. Whether the aggregates were already formed in the calcined catalysts or they were formed by contact with ethanol is not clear. The reduction pathway of Mo/SiO2 is also not clear. It may be an analog of those for polyoxoanions if the blue state plays a major role in the process as in the second and third assumptions. In the first stage of reduction of many polymolybdates, cyclic voltammetries showed several reversible one- or two-electron reduction sequences, which yield mixed-valence species with IVCT absorption [47]. Further reductions often alter the structures of polyanions more markedly. The most interesting among them is a brown-colored reduced Keggin-type tungstate [SiW3 IVW9 VIO40H6]4− [48]. In the reduced anion, six localized d-electrons make metal–metal bonds between three W(4+)s to form a structure similar to triangular [W3 IVO4]4+ aqua cation. Further reduction is considered to result in the formation of more W(4+)3 units inside the anions. In the case of Mo/SiO2 catalysts structural changes with reduction might be different in detail as metal atoms are molybdenum and the final average oxidation state is +5, but similar scheme is possible to explain the experimental results, namely formation of some structural units with metal–metal bond from IVCT mixed-valence states by acquisition of more electrons. Proportion of the brown state units in the blue state aggregates may be determined by the reduction conditions. There was no firm evidence to eliminate the possibilities of direct formation of the brown state species from the oxidized state but it is harder to explain the behavior of the catalysts on different temperature reductions. Blue and dark brown colors of the fixed molybdenum monomer catalysts were observed by Iwasawa et al. and they were not aware that those absorption were too intense for d–d absorption of monomerically dispersed Mo oxo species [5, 6, 8]. They also reported some graphs from which the fixed monomer and dimer catalysts were not reduced by ethanol to average oxidation state +5, though they should be reduced to +4 and +5, respectively, according to their assumption [5, 8]. Considering these results, also the fixed catalysts prepared by Iwasawa et al. were not special. These authors proposed much evidence for the monomer and dimer catalysts. For example, H2 and O2 uptake values of the fixed monomer and dimer catalysts coincided completely to the stoichiometric values for non-existing monomers and dimers. Why it happened like that is beyond explanation. 5 Conclusions In this investigation, the dispute about the fixed molybdenum catalysts was settled by demonstrating that many features proposed for the unique fixed monomer and dimer catalysts can be also observed in Mo/SiO2 catalysts prepared by other methods. It was also demonstrated that interpreting those features as evidence for uniform monomeric or dimeric sites is full of inconsistencies. Reduction of Mo/SiO2 catalysts by ethanol is a complicated process in which at least two distinctive structures are involved rather than a simple one-step reaction proposed for the fixed monomer and dimer catalysts. Acknowledgements The author greatly thanks Dr. Ichikuni at Chiba University and Mr. Kawaguchi at Kao K.K. for some catalysts preparations. The EXAFS measurements were performed under the approval of the Photon Factory Program Advisory Committee (Proposal No. 93G164). References 1 Y.I. Yermakov, B.N. Kuznetsov, V.A. Zakharov, Catalysis by Metal Supported Complexes, Elsevier, Amsterdam, 1981. 2 Y. Iwasawa (Ed.), Tailored Metal Catalysts, Reidel, Dordrecht, 1986. 3 Y. Iwasawa Adv. Catal. 35 1987 187 4 Y. Iwasawa Catal. Today 18 1993 21 5 Y. Iwasawa Y. Nakano S. Ogasawara J. Chem. Soc., Faraday Trans. 74 1978 2968 6 Y. Iwasawa S. Ogasawara J. Chem. Soc., Faraday Trans. 75 1979 1465 7 Y. Iwasawa M. Yamagishi J. Catal. 82 1983 373 8 Y. Iwasawa, H. Tanaka, Proc. 8th Int. Congr. Catal. Berlin, IV, 1984, 381. 9 Y. Iwasawa K. Asakura H. Ishii H. Kuroda Z. Phys. Chem. N.F. 144 1985 105 10 K. Marcinkowska S. Kaliaguine P.C. Roberge J. Catal. 90 1984 49 11 K. Marcinkowska L. Rodringo S. Kaliaguine J. Mol. Catal. 33 1985 189 12 K. Marcinkowska L. Rodringo S. Kaliaguine P.C. Roberge J. Catal. 97 1986 75 13 J.M. Stencel J.R. Diehl J.R. D'Este L.E. Makovsky L. Rodringo K. Marcinkowska A. Adnot P.C. Roberge S. Kaliaguine J. Phys. Chem. 90 1986 4739 14 L. Rodringo K. Marcinkowska A. Adnot P.C. Roberge S. Kaliaguine J. Phys. Chem. 90 1986 2690 15 M. de Boer A.J. Dillen D.C. Koningsberger J.W. Geus M.A. Vuurman I.E. Wachs Catal. Lett. 11 1991 227 16 R.D. Roark S.D. Kohler J.G. Ekerdt Catal. Lett. 16 1992 71 17 R.D. Roark S.D. Kohler J.G. Ekerdt D.S. Kim I.E. Wachs Catal. Lett. 16 1992 77 18 C.C. Williams J.G. Ekerdt J. Catal. 141 1993 430 19 M. Che C. Louis J.M. Tatibout Polyhedron 5 1986 123 20 C. Louis J.-M. Tatibout M. Che J. Catal. 109 1988 354 21 C. Louis M. Che J. Catal. 135 1992 156 22 C. Louis M. Che M. Anpo J. Catal. 141 1993 23 S.T. Oyama W. Zhang J. Am. Chem. Soc. 118 1996 7173 24 W. Zhang S.T. Oyama J. Phys. Chem. 100 1996 10759 25 W. Zhang S.T. Oyama W.L. Holstein Catal. Lett. 39 1996 67 26 W.-H. Cheng J. Catal. 158 1996 477 27 G. Kisfaludi J. Leyrer H. Knözinger R. Prins J. Catal. 130 1991 192 28 C.T.J. Mensch J.A.R. van Veen V. van Wingerden M.P. van Dijk J. Phys. Chem. 92 1988 4961 29 M. del Arco S.R.G. Carrazán V. Rives F.J. Gil-Llambı́as P. Malet J. Catal. 141 1993 48 30 A. Birnbaum F.A. Cotton Z. Dori D.O. Marler G.M. Reisner W. Schwotzer M. Shaia Inorg. Chem. 22 1983 2723 31 A. Birnbaum F.A. Cotton Z. Dori M. Kapon Inorg. Chem. 23 1984 1617 32 B.K. Teo, EXAFS: Basic Principles and Data Analysis, Springer, Berlin, 1986. 33 W.N. Delgass, G.L. Haller, R. Kellerman, J.H. Lunsford, Spectroscopy in Heterogeneous Catalysis, Academic Press, London, 1979. 34 C. Sanchez J. Livage J.P. Launay M. Fournier Y. Jeannin J. Am. Chem. Soc. 104 1982 3194 35 P. Gómez-Romero N. Casań-Pastor J. Phys. Chem. 100 1996 12448 36 M.T. Pope, in: S.J. Lippard (Ed.), Progress in Inorganic Chemistry, Vol. 39, Wiley, Chichester, 1991, p. 181. 37 R. Thouvenot M. Fournier C. Rocchiccioli-Deltcheff J. Chem. Soc., Faraday Trans. 87 1991 2829 38 T. Miyanaga T. Fujikawa N. Matsubayashi T. Fukumoto K. Yokoi I. Watanabe S. Iketa Bull. Chem. Soc. Jpn. 62 1989 1791 39 J.J. Rehr J. Mustre de Leon S.I. Zabinsky R.C. Albers J. Am. Chem. Soc. 113 1991 5135 40 H. Ichida A. Kobayashi Y. Sasaki Acta Cryst. B 36 1980 1382 41 Y. Kikutani, unpublished data. 42 K. Stadnicka J. Haber R. Kozlowski Acta Cryst. B 33 1977 3859 43 K. Okumura Y. Iwasawa J. Catal. 164 1996 440 44 L. Kihlborg Acta Chem. Scand. 17 1963 1485 45 C. Limberg A.J. Downs A.J. Blake S. Parsons Inorg. Chem. 35 1996 4439 46 H. Aritani T. Tanaka T. Funabiki S. Yoshida M. Kudo S. Hasegawa J. Phys. Chem. 100 1996 5440 47 M.T. Pope A. Müller Angew. Chem., Int. Ed. Engl. 30 1991 34 48 Y. Jeannin J.P. Launay M.A.S. Sedjadi Inorg. Chem. 19 1980 2933",
      "scopus-id": "0033542375",
      "coredata": {
        "eid": "1-s2.0-S1381116998003094",
        "dc:description": "Structural changes of silica supported molybdenum catalysts accompanied with reduction by ethanol were investigated with EXAFS and UV–VIS spectroscopies. Catalysts made from four different precursors were investigated, and it was demonstrated that the dependence on preparation method was small. Catalysts prepared by the reaction between surface hydroxide groups and organometallic complexes are called `fixed catalysts' and some researchers assert that fixed Mo/SiO2 have uniform and specific molecular-like active sites, which remains controversial. It was found that what had been proposed as characteristics of the molecular-like active sites of the fixed catalysts were merely prejudiced interpretation of a few aspects in the structural changes common to Mo/SiO2 in general. At least two distinctive states existed in the course of reduction. One has IVCT (intervalence charge transfer) absorption band and corresponds to shallow reductions. The other has 2.6 Å Mo–Mo bond and average oxidation state of it was estimated to be +5. Structure similar to the latter was found also on alumina supported Mo catalysts and can be considered thermodynamically stable.",
        "openArchiveArticle": "false",
        "prism:coverDate": "1999-06-10",
        "openaccessUserLicense": null,
        "prism:aggregationType": "Journal",
        "prism:url": "https://api.elsevier.com/content/article/pii/S1381116998003094",
        "dc:creator": {
          "@_fa": "true",
          "$": "Kikutani, Y"
        },
        "link": [
          {
            "@_fa": "true",
            "@rel": "self",
            "@href": "https://api.elsevier.com/content/article/pii/S1381116998003094"
          },
          {
            "@_fa": "true",
            "@rel": "scidir",
            "@href": "https://www.sciencedirect.com/science/article/pii/S1381116998003094"
          }
        ],
        "dc:format": "application/json",
        "openaccessType": null,
        "pii": "S1381-1169(98)00309-4",
        "prism:volume": "142",
        "prism:publisher": "Elsevier Science B.V.",
        "dc:title": "Structures of molybdenum silica catalysts reduced by ethanol, and their relations to catalytic oxidation reactions I. Structure changes of Mo/SiO2 with gradual reduction by ethanol",
        "prism:copyright": "Copyright © 1999 Elsevier Science B.V. All rights reserved.",
        "openaccess": "0",
        "prism:issn": "13811169",
        "prism:issueIdentifier": "2",
        "dcterms:subject": [
          {
            "@_fa": "true",
            "$": "Molybdenum"
          },
          {
            "@_fa": "true",
            "$": "Fixed catalysts"
          },
          {
            "@_fa": "true",
            "$": "EXAFS"
          },
          {
            "@_fa": "true",
            "$": "UV–VIS"
          },
          {
            "@_fa": "true",
            "$": "Ethanol"
          },
          {
            "@_fa": "true",
            "$": "Intervalence charge transfer (IVCT) band"
          }
        ],
        "openaccessArticle": "false",
        "prism:publicationName": "Journal of Molecular Catalysis A: Chemical",
        "prism:number": "2",
        "openaccessSponsorType": null,
        "prism:pageRange": "247-263",
        "prism:endingPage": "263",
        "pubType": "fla",
        "prism:coverDisplayDate": "10 June 1999",
        "prism:doi": "10.1016/S1381-1169(98)00309-4",
        "prism:startingPage": "247",
        "dc:identifier": "doi:10.1016/S1381-1169(98)00309-4",
        "openaccessSponsorName": null
      },
      "objects": {
        "object": [
          {
            "@category": "thumbnail",
            "@height": "14",
            "@width": "29",
            "@_fa": "true",
            "$": "https://api.elsevier.com/content/object/eid/1-s2.0-S1381116998003094-si2.gif?httpAccept=%2A%2F%2A",
            "@multimediatype": "GIF image file",
            "@type": "ALTIMG",
            "@size": "233",
            "@ref": "si2",
            "@mimetype": "image/gif"
          },
          {
            "@category": "thumbnail",
            "@height": "13",
            "@width": "263",
            "@_fa": "true",
            "$": "https://api.elsevier.com/content/object/eid/1-s2.0-S1381116998003094-si1.gif?httpAccept=%2A%2F%2A",
            "@multimediatype": "GIF image file",
            "@type": "ALTIMG",
            "@size": "928",
            "@ref": "si1",
            "@mimetype": "image/gif"
          },
          {
            "@category": "thumbnail",
            "@height": "61",
            "@width": "125",
            "@_fa": "true",
            "$": "https://api.elsevier.com/content/object/eid/1-s2.0-S1381116998003094-sc1.sml?httpAccept=%2A%2F%2A",
            "@multimediatype": "GIF image file",
            "@type": "IMAGE-THUMBNAIL",
            "@size": "1093",
            "@ref": "sc1",
            "@mimetype": "image/gif"
          },
          {
            "@category": "standard",
            "@height": "337",
            "@width": "686",
            "@_fa": "true",
            "$": "https://api.elsevier.com/content/object/eid/1-s2.0-S1381116998003094-sc1.gif?httpAccept=%2A%2F%2A",
            "@multimediatype": "GIF image file",
            "@type": "IMAGE-DOWNSAMPLED",
            "@size": "12607",
            "@ref": "sc1",
            "@mimetype": "image/gif"
          },
          {
            "@category": "thumbnail",
            "@height": "93",
            "@width": "101",
            "@_fa": "true",
            "$": "https://api.elsevier.com/content/object/eid/1-s2.0-S1381116998003094-sc2.sml?httpAccept=%2A%2F%2A",
            "@multimediatype": "GIF image file",
            "@type": "IMAGE-THUMBNAIL",
            "@size": "1486",
            "@ref": "sc2",
            "@mimetype": "image/gif"
          },
          {
            "@category": "standard",
            "@height": "382",
            "@width": "413",
            "@_fa": "true",
            "$": "https://api.elsevier.com/content/object/eid/1-s2.0-S1381116998003094-sc2.gif?httpAccept=%2A%2F%2A",
            "@multimediatype": "GIF image file",
            "@type": "IMAGE-DOWNSAMPLED",
            "@size": "11244",
            "@ref": "sc2",
            "@mimetype": "image/gif"
          },
          {
            "@category": "thumbnail",
            "@height": "93",
            "@width": "74",
            "@_fa": "true",
            "$": "https://api.elsevier.com/content/object/eid/1-s2.0-S1381116998003094-gr1.sml?httpAccept=%2A%2F%2A",
            "@multimediatype": "GIF image file",
            "@type": "IMAGE-THUMBNAIL",
            "@size": "2020",
            "@ref": "gr1",
            "@mimetype": "image/gif"
          },
          {
            "@category": "standard",
            "@height": "598",
            "@width": "476",
            "@_fa": "true",
            "$": "https://api.elsevier.com/content/object/eid/1-s2.0-S1381116998003094-gr1.gif?httpAccept=%2A%2F%2A",
            "@multimediatype": "GIF image file",
            "@type": "IMAGE-DOWNSAMPLED",
            "@size": "34055",
            "@ref": "gr1",
            "@mimetype": "image/gif"
          },
          {
            "@category": "thumbnail",
            "@height": "94",
            "@width": "78",
            "@_fa": "true",
            "$": "https://api.elsevier.com/content/object/eid/1-s2.0-S1381116998003094-gr2.sml?httpAccept=%2A%2F%2A",
            "@multimediatype": "GIF image file",
            "@type": "IMAGE-THUMBNAIL",
            "@size": "2418",
            "@ref": "gr2",
            "@mimetype": "image/gif"
          },
          {
            "@category": "standard",
            "@height": "574",
            "@width": "478",
            "@_fa": "true",
            "$": "https://api.elsevier.com/content/object/eid/1-s2.0-S1381116998003094-gr2.gif?httpAccept=%2A%2F%2A",
            "@multimediatype": "GIF image file",
            "@type": "IMAGE-DOWNSAMPLED",
            "@size": "38073",
            "@ref": "gr2",
            "@mimetype": "image/gif"
          },
          {
            "@category": "thumbnail",
            "@height": "94",
            "@width": "74",
            "@_fa": "true",
            "$": "https://api.elsevier.com/content/object/eid/1-s2.0-S1381116998003094-gr3.sml?httpAccept=%2A%2F%2A",
            "@multimediatype": "GIF image file",
            "@type": "IMAGE-THUMBNAIL",
            "@size": "1854",
            "@ref": "gr3",
            "@mimetype": "image/gif"
          },
          {
            "@category": "standard",
            "@height": "599",
            "@width": "473",
            "@_fa": "true",
            "$": "https://api.elsevier.com/content/object/eid/1-s2.0-S1381116998003094-gr3.gif?httpAccept=%2A%2F%2A",
            "@multimediatype": "GIF image file",
            "@type": "IMAGE-DOWNSAMPLED",
            "@size": "31261",
            "@ref": "gr3",
            "@mimetype": "image/gif"
          },
          {
            "@category": "thumbnail",
            "@height": "93",
            "@width": "72",
            "@_fa": "true",
            "$": "https://api.elsevier.com/content/object/eid/1-s2.0-S1381116998003094-gr4.sml?httpAccept=%2A%2F%2A",
            "@multimediatype": "GIF image file",
            "@type": "IMAGE-THUMBNAIL",
            "@size": "1305",
            "@ref": "gr4",
            "@mimetype": "image/gif"
          },
          {
            "@category": "standard",
            "@height": "414",
            "@width": "320",
            "@_fa": "true",
            "$": "https://api.elsevier.com/content/object/eid/1-s2.0-S1381116998003094-gr4.gif?httpAccept=%2A%2F%2A",
            "@multimediatype": "GIF image file",
            "@type": "IMAGE-DOWNSAMPLED",
            "@size": "11656",
            "@ref": "gr4",
            "@mimetype": "image/gif"
          },
          {
            "@category": "thumbnail",
            "@height": "92",
            "@width": "58",
            "@_fa": "true",
            "$": "https://api.elsevier.com/content/object/eid/1-s2.0-S1381116998003094-gr5.sml?httpAccept=%2A%2F%2A",
            "@multimediatype": "GIF image file",
            "@type": "IMAGE-THUMBNAIL",
            "@size": "1280",
            "@ref": "gr5",
            "@mimetype": "image/gif"
          },
          {
            "@category": "standard",
            "@height": "524",
            "@width": "329",
            "@_fa": "true",
            "$": "https://api.elsevier.com/content/object/eid/1-s2.0-S1381116998003094-gr5.gif?httpAccept=%2A%2F%2A",
            "@multimediatype": "GIF image file",
            "@type": "IMAGE-DOWNSAMPLED",
            "@size": "17965",
            "@ref": "gr5",
            "@mimetype": "image/gif"
          },
          {
            "@category": "thumbnail",
            "@height": "93",
            "@width": "112",
            "@_fa": "true",
            "$": "https://api.elsevier.com/content/object/eid/1-s2.0-S1381116998003094-gr6.sml?httpAccept=%2A%2F%2A",
            "@multimediatype": "GIF image file",
            "@type": "IMAGE-THUMBNAIL",
            "@size": "2590",
            "@ref": "gr6",
            "@mimetype": "image/gif"
          },
          {
            "@category": "standard",
            "@height": "393",
            "@width": "473",
            "@_fa": "true",
            "$": "https://api.elsevier.com/content/object/eid/1-s2.0-S1381116998003094-gr6.gif?httpAccept=%2A%2F%2A",
            "@multimediatype": "GIF image file",
            "@type": "IMAGE-DOWNSAMPLED",
            "@size": "22437",
            "@ref": "gr6",
            "@mimetype": "image/gif"
          },
          {
            "@category": "thumbnail",
            "@height": "93",
            "@width": "124",
            "@_fa": "true",
            "$": "https://api.elsevier.com/content/object/eid/1-s2.0-S1381116998003094-gr7.sml?httpAccept=%2A%2F%2A",
            "@multimediatype": "GIF image file",
            "@type": "IMAGE-THUMBNAIL",
            "@size": "1449",
            "@ref": "gr7",
            "@mimetype": "image/gif"
          },
          {
            "@category": "standard",
            "@height": "242",
            "@width": "321",
            "@_fa": "true",
            "$": "https://api.elsevier.com/content/object/eid/1-s2.0-S1381116998003094-gr7.gif?httpAccept=%2A%2F%2A",
            "@multimediatype": "GIF image file",
            "@type": "IMAGE-DOWNSAMPLED",
            "@size": "5560",
            "@ref": "gr7",
            "@mimetype": "image/gif"
          }
        ]
      },
      "link": {
        "@rel": "abstract",
        "@href": "https://api.elsevier.com/content/abstract/scopus_id/0033542375"
      }
    }
  }
}