{
  "metadata": {
    "title": "Hydrotalcite-supported gold catalysts for a selective aerobic oxidation of benzyl alcohol driven by visible light",
    "authors": "; ; ",
    "journal": "Journal of Molecular Catalysis A: Chemical",
    "date": "2014-12-31",
    "doi": "10.1016/j.molcata.2014.08.023",
    "abstract": "",
    "uri": "https://api.elsevier.com/content/article/pii/S1381116914003707",
    "pii": "S1381116914003707"
  },
  "fulltext": {
    "full-text-retrieval-response": {
      "scopus-eid": "2-s2.0-84906849541",
      "originalText": "serial JL 271358 291210 291744 291790 291809 31 Journal of Molecular Catalysis A: Chemical JOURNALMOLECULARCATALYSISACHEMICAL 2014-08-22 2014-08-22 2014-11-28T00:56:14 1-s2.0-S1381116914003707 S1381-1169(14)00370-7 S1381116914003707 10.1016/j.molcata.2014.08.023 S300 S300.1 FULL-TEXT 1-s2.0-S1381116914X00117 2015-05-15T05:56:33.63776-04:00 0 0 20141201 20141231 2014 2014-08-22T20:31:09.2395Z absattachment articleinfo articletitlenorm authfirstinitialnorm authfirstsurnamenorm cid cids contenttype copyright crossmark dateloaded dateloadedtxt datesearch datesort dateupdated dco docsubtype doctype doi eid ewtransactionid hubeid indexeddate issn issnnorm itemstage itemtransactionid itemweight openaccess openarchive pg pgfirst pglast pii piinorm pubdateend pubdatestart pubdatetxt pubyr sectiontitle sortorder srctitle srctitlenorm srctype ssids alllist content subj subheadings suppl tomb volfirst volissue volumelist webpdf webpdfpagecount yearnav figure table body mmlmath acknowledge affil articletitle auth authfirstini authfull authkeywords authlast grantnumber grantsponsor grantsponsorid highlightsabst primabst ref specialabst 1381-1169 13811169 true 395 395 C Volume 395 19 128 136 128 136 201412 December 2014 2014-12-01 2014-12-31 2014 Regular Papers article fla Copyright © 2014 Elsevier B.V. All rights reserved. HYDROTALCITESUPPORTEDGOLDCATALYSTSFORASELECTIVEAEROBICOXIDATIONBENZYLALCOHOLDRIVENBYVISIBLELIGHT YU J 1 Introduction 2 Experimental 2.1 Preparation of HT 2.2 Preparation of Au/HT-x catalyst 2.3 Recycling use of catalyst 2.4 Catalyst characterization 2.5 Catalytic test: aerobic oxidation of benzyl alcohol 2.6 Hydrogen peroxide test 3 Results and discussion 3.1 Catalysts characterization 3.2 Activity tests 3.3 Effect of light intensity and light wavelength 3.4 Oxidation of various alcohols 3.5 Reaction mechanism 4 Conclusion Acknowledgements References YUAN 2010 4054 4058 B ZHU 2010 9657 9661 H CHEN 2008 5353 5356 X LIU 2009 1250 1252 H RAPTIS 2009 3133 3136 C SU 2008 7131 7135 F CHEN 2010 414 419 X KE 2012 3509 3511 X MEYER 2010 314 321 O ABELLO 2005 728 739 S KWON 2011 6914 6917 Y FANG 2011 1247 1256 W KIMURA 2012 7111 7117 K WANG 2012 7 15 X ZHANG 2012 8048 8056 X CHEN 2013 230 235 G JOHNSTON 2012 12202 12206 E YUAN 2011 11069 11074 Y NISHIMURA 2000 1245 1246 T MITSUDOME 2008 138 141 T WANG 2012 2189 2197 L KAIZUKA 2010 15096 15098 K HUANG 2013 217 226 X DIXIT 2013 458 468 M KAKIUCHI 2001 6620 6625 N KAWABATA 2005 206 215 T DIMITRATOS 2012 20 44 N LIU 2012 12122 12129 P SU 2008 334 337 F SARINA 2013 5793 5801 S BADER 1988 1109 1115 H DEBECKER 2009 3920 3935 D HAN 2009 2016 2026 J CHEN 2013 206 218 T HAIDER 2009 349 354 P CONTE 2009 7189 7196 M ZHU 2009 7524 7526 H ZOPE 2010 74 78 B GOWRISANKAR 2011 5139 5143 S ZHANG 2009 6081 6084 M TSUKAMOTO 2012 6309 6315 D SHIMIZU 2009 2341 2351 K SHANG 2011 9938 9947 C TONGSAKUL 2012 16182 16187 D WITTSTOCK 2010 319 322 A DENG 2005 9267 9270 X ABAD 2008 212 222 A MITSUDOME 2009 1890 1896 T RODRIGUEZREYES 2012 1129 1134 J YUX2014X128 YUX2014X128X136 YUX2014X128XJ YUX2014X128X136XJ item S1381-1169(14)00370-7 S1381116914003707 1-s2.0-S1381116914003707 10.1016/j.molcata.2014.08.023 271358 2014-11-27T22:02:26.693105-05:00 2014-12-01 2014-12-31 1-s2.0-S1381116914003707-main.pdf https://s3.amazonaws.com/prod-ucs-content-store-us-east/content/pii:S1381116914003707/MAIN/application/pdf/f108f5f87928403c0c26da1e115df637/main.pdf https://s3-eu-west-1.amazonaws.com/prod-ucs-content-store-eu-west/content/pii:S1381116914003707/MAIN/application/pdf/f108f5f87928403c0c26da1e115df637/main.pdf main.pdf pdf true 2313548 MAIN 9 1-s2.0-S1381116914003707-main_1.png https://s3.amazonaws.com/prod-ucs-content-store-us-east/content/pii:S1381116914003707/PREVIEW/image/png/d8fe723cd96e454188d8865096262608/main_1.png https://s3-eu-west-1.amazonaws.com/prod-ucs-content-store-eu-west/content/pii:S1381116914003707/PREVIEW/image/png/d8fe723cd96e454188d8865096262608/main_1.png main_1.png png 58569 849 656 IMAGE-WEB-PDF 1 1-s2.0-S1381116914003707-si1.gif https://s3.amazonaws.com/prod-ucs-content-store-us-east/content/pii:S1381116914003707/STRIPIN/image/gif/82504ae51a1428c5959b7c355f428976/si1.gif https://s3-eu-west-1.amazonaws.com/prod-ucs-content-store-eu-west/content/pii:S1381116914003707/STRIPIN/image/gif/82504ae51a1428c5959b7c355f428976/si1.gif si1 si1.gif gif 1042 23 255 ALTIMG 1-s2.0-S1381116914003707-sc1_lrg.jpg https://s3.amazonaws.com/prod-ucs-content-store-us-east/content/pii:S1381116914003707/sc1/HIGHRES/image/jpeg/68d9efa85f1d5340419d9b133c5857fe/sc1_lrg.jpg https://s3-eu-west-1.amazonaws.com/prod-ucs-content-store-eu-west/content/pii:S1381116914003707/sc1/HIGHRES/image/jpeg/68d9efa85f1d5340419d9b133c5857fe/sc1_lrg.jpg sc1 sc1_lrg.jpg jpg 172572 2041 2044 IMAGE-HIGH-RES 1-s2.0-S1381116914003707-gr6_lrg.jpg https://s3.amazonaws.com/prod-ucs-content-store-us-east/content/pii:S1381116914003707/gr6/HIGHRES/image/jpeg/38a132581bf1a1c5d252b6d71d8423fb/gr6_lrg.jpg https://s3-eu-west-1.amazonaws.com/prod-ucs-content-store-eu-west/content/pii:S1381116914003707/gr6/HIGHRES/image/jpeg/38a132581bf1a1c5d252b6d71d8423fb/gr6_lrg.jpg gr6 gr6_lrg.jpg jpg 214000 2376 1547 IMAGE-HIGH-RES 1-s2.0-S1381116914003707-gr5_lrg.jpg https://s3.amazonaws.com/prod-ucs-content-store-us-east/content/pii:S1381116914003707/gr5/HIGHRES/image/jpeg/d2955a52f1c489a0e9ea97f7c3bc0ded/gr5_lrg.jpg https://s3-eu-west-1.amazonaws.com/prod-ucs-content-store-eu-west/content/pii:S1381116914003707/gr5/HIGHRES/image/jpeg/d2955a52f1c489a0e9ea97f7c3bc0ded/gr5_lrg.jpg gr5 gr5_lrg.jpg jpg 143384 1214 1542 IMAGE-HIGH-RES 1-s2.0-S1381116914003707-gr4_lrg.jpg https://s3.amazonaws.com/prod-ucs-content-store-us-east/content/pii:S1381116914003707/gr4/HIGHRES/image/jpeg/bc4367ac4aa4db99caab03792084c59f/gr4_lrg.jpg https://s3-eu-west-1.amazonaws.com/prod-ucs-content-store-eu-west/content/pii:S1381116914003707/gr4/HIGHRES/image/jpeg/bc4367ac4aa4db99caab03792084c59f/gr4_lrg.jpg gr4 gr4_lrg.jpg jpg 326118 2275 1537 IMAGE-HIGH-RES 1-s2.0-S1381116914003707-gr3eg_lrg.jpg https://s3.amazonaws.com/prod-ucs-content-store-us-east/content/pii:S1381116914003707/gr3eg/HIGHRES/image/jpeg/ac060cb03c91ba6134890c2e36550503/gr3eg_lrg.jpg https://s3-eu-west-1.amazonaws.com/prod-ucs-content-store-eu-west/content/pii:S1381116914003707/gr3eg/HIGHRES/image/jpeg/ac060cb03c91ba6134890c2e36550503/gr3eg_lrg.jpg gr3eg gr3eg_lrg.jpg jpg 1058139 3244 2917 IMAGE-HIGH-RES 1-s2.0-S1381116914003707-gr3ad_lrg.jpg https://s3.amazonaws.com/prod-ucs-content-store-us-east/content/pii:S1381116914003707/gr3ad/HIGHRES/image/jpeg/865d929e1f3d8b35b2995db30ad602f0/gr3ad_lrg.jpg https://s3-eu-west-1.amazonaws.com/prod-ucs-content-store-eu-west/content/pii:S1381116914003707/gr3ad/HIGHRES/image/jpeg/865d929e1f3d8b35b2995db30ad602f0/gr3ad_lrg.jpg gr3ad gr3ad_lrg.jpg jpg 1388764 4375 2961 IMAGE-HIGH-RES 1-s2.0-S1381116914003707-gr2_lrg.jpg https://s3.amazonaws.com/prod-ucs-content-store-us-east/content/pii:S1381116914003707/gr2/HIGHRES/image/jpeg/f7e2b143e09d55eb2bb4437c84f590b7/gr2_lrg.jpg https://s3-eu-west-1.amazonaws.com/prod-ucs-content-store-eu-west/content/pii:S1381116914003707/gr2/HIGHRES/image/jpeg/f7e2b143e09d55eb2bb4437c84f590b7/gr2_lrg.jpg gr2 gr2_lrg.jpg jpg 189968 1368 1705 IMAGE-HIGH-RES 1-s2.0-S1381116914003707-gr1_lrg.jpg https://s3.amazonaws.com/prod-ucs-content-store-us-east/content/pii:S1381116914003707/gr1/HIGHRES/image/jpeg/3d110e6ff76cca022a297d9ecff667d0/gr1_lrg.jpg https://s3-eu-west-1.amazonaws.com/prod-ucs-content-store-eu-west/content/pii:S1381116914003707/gr1/HIGHRES/image/jpeg/3d110e6ff76cca022a297d9ecff667d0/gr1_lrg.jpg gr1 gr1_lrg.jpg jpg 864910 2406 3000 IMAGE-HIGH-RES 1-s2.0-S1381116914003707-fx1_lrg.jpg https://s3.amazonaws.com/prod-ucs-content-store-us-east/content/pii:S1381116914003707/fx1/HIGHRES/image/jpeg/34462c09951a0d54b6e6bc7afbfa879e/fx1_lrg.jpg https://s3-eu-west-1.amazonaws.com/prod-ucs-content-store-eu-west/content/pii:S1381116914003707/fx1/HIGHRES/image/jpeg/34462c09951a0d54b6e6bc7afbfa879e/fx1_lrg.jpg fx1 true fx1_lrg.jpg jpg 154382 655 2213 IMAGE-HIGH-RES 1-s2.0-S1381116914003707-fx2_lrg.gif https://s3.amazonaws.com/prod-ucs-content-store-us-east/content/pii:S1381116914003707/fx2/HIGHRES/image/gif/52bfd71aff7f0fd5ef84d45631921eb9/fx2_lrg.gif https://s3-eu-west-1.amazonaws.com/prod-ucs-content-store-eu-west/content/pii:S1381116914003707/fx2/HIGHRES/image/gif/52bfd71aff7f0fd5ef84d45631921eb9/fx2_lrg.gif fx2 fx2_lrg.gif gif 15867 352 3000 IMAGE-HIGH-RES 1-s2.0-S1381116914003707-sc1.jpg https://s3.amazonaws.com/prod-ucs-content-store-us-east/content/pii:S1381116914003707/sc1/DOWNSAMPLED/image/jpeg/84eed2198fd35368783a2bd9e7796267/sc1.jpg https://s3-eu-west-1.amazonaws.com/prod-ucs-content-store-eu-west/content/pii:S1381116914003707/sc1/DOWNSAMPLED/image/jpeg/84eed2198fd35368783a2bd9e7796267/sc1.jpg sc1 sc1.jpg jpg 20859 460 461 IMAGE-DOWNSAMPLED 1-s2.0-S1381116914003707-gr6.jpg https://s3.amazonaws.com/prod-ucs-content-store-us-east/content/pii:S1381116914003707/gr6/DOWNSAMPLED/image/jpeg/5b3573854189e56f4dedf89ecff579c7/gr6.jpg https://s3-eu-west-1.amazonaws.com/prod-ucs-content-store-eu-west/content/pii:S1381116914003707/gr6/DOWNSAMPLED/image/jpeg/5b3573854189e56f4dedf89ecff579c7/gr6.jpg gr6 gr6.jpg jpg 28130 536 349 IMAGE-DOWNSAMPLED 1-s2.0-S1381116914003707-gr5.jpg https://s3.amazonaws.com/prod-ucs-content-store-us-east/content/pii:S1381116914003707/gr5/DOWNSAMPLED/image/jpeg/d879f9b8a4f9ac135dc80762a20af72a/gr5.jpg https://s3-eu-west-1.amazonaws.com/prod-ucs-content-store-eu-west/content/pii:S1381116914003707/gr5/DOWNSAMPLED/image/jpeg/d879f9b8a4f9ac135dc80762a20af72a/gr5.jpg gr5 gr5.jpg jpg 16677 274 348 IMAGE-DOWNSAMPLED 1-s2.0-S1381116914003707-gr4.jpg https://s3.amazonaws.com/prod-ucs-content-store-us-east/content/pii:S1381116914003707/gr4/DOWNSAMPLED/image/jpeg/ae403faf3f3d2706fd89869332bef3e0/gr4.jpg https://s3-eu-west-1.amazonaws.com/prod-ucs-content-store-eu-west/content/pii:S1381116914003707/gr4/DOWNSAMPLED/image/jpeg/ae403faf3f3d2706fd89869332bef3e0/gr4.jpg gr4 gr4.jpg jpg 37840 514 347 IMAGE-DOWNSAMPLED 1-s2.0-S1381116914003707-gr3eg.jpg https://s3.amazonaws.com/prod-ucs-content-store-us-east/content/pii:S1381116914003707/gr3eg/DOWNSAMPLED/image/jpeg/abfe52bab041af52eefbdd755006afb7/gr3eg.jpg https://s3-eu-west-1.amazonaws.com/prod-ucs-content-store-eu-west/content/pii:S1381116914003707/gr3eg/DOWNSAMPLED/image/jpeg/abfe52bab041af52eefbdd755006afb7/gr3eg.jpg gr3eg gr3eg.jpg jpg 122567 733 659 IMAGE-DOWNSAMPLED 1-s2.0-S1381116914003707-gr3ad.jpg https://s3.amazonaws.com/prod-ucs-content-store-us-east/content/pii:S1381116914003707/gr3ad/DOWNSAMPLED/image/jpeg/4d84e42c6093bf40b337cee50c914d3a/gr3ad.jpg https://s3-eu-west-1.amazonaws.com/prod-ucs-content-store-eu-west/content/pii:S1381116914003707/gr3ad/DOWNSAMPLED/image/jpeg/4d84e42c6093bf40b337cee50c914d3a/gr3ad.jpg gr3ad gr3ad.jpg jpg 167365 988 669 IMAGE-DOWNSAMPLED 1-s2.0-S1381116914003707-gr2.jpg https://s3.amazonaws.com/prod-ucs-content-store-us-east/content/pii:S1381116914003707/gr2/DOWNSAMPLED/image/jpeg/db9ab592628a557bc1ec5bae1cc17ccd/gr2.jpg https://s3-eu-west-1.amazonaws.com/prod-ucs-content-store-eu-west/content/pii:S1381116914003707/gr2/DOWNSAMPLED/image/jpeg/db9ab592628a557bc1ec5bae1cc17ccd/gr2.jpg gr2 gr2.jpg jpg 21717 309 385 IMAGE-DOWNSAMPLED 1-s2.0-S1381116914003707-gr1.jpg https://s3.amazonaws.com/prod-ucs-content-store-us-east/content/pii:S1381116914003707/gr1/DOWNSAMPLED/image/jpeg/cfaa445a72b001f23107044487a9ceae/gr1.jpg https://s3-eu-west-1.amazonaws.com/prod-ucs-content-store-eu-west/content/pii:S1381116914003707/gr1/DOWNSAMPLED/image/jpeg/cfaa445a72b001f23107044487a9ceae/gr1.jpg gr1 gr1.jpg jpg 87567 544 678 IMAGE-DOWNSAMPLED 1-s2.0-S1381116914003707-fx1.jpg https://s3.amazonaws.com/prod-ucs-content-store-us-east/content/pii:S1381116914003707/fx1/DOWNSAMPLED/image/jpeg/36642e95cebdcf5668173c758485a5bd/fx1.jpg https://s3-eu-west-1.amazonaws.com/prod-ucs-content-store-eu-west/content/pii:S1381116914003707/fx1/DOWNSAMPLED/image/jpeg/36642e95cebdcf5668173c758485a5bd/fx1.jpg fx1 true fx1.jpg jpg 20101 148 500 IMAGE-DOWNSAMPLED 1-s2.0-S1381116914003707-fx2.gif https://s3.amazonaws.com/prod-ucs-content-store-us-east/content/pii:S1381116914003707/fx2/DOWNSAMPLED/image/gif/768f3239663149072ba9227b173d532b/fx2.gif https://s3-eu-west-1.amazonaws.com/prod-ucs-content-store-eu-west/content/pii:S1381116914003707/fx2/DOWNSAMPLED/image/gif/768f3239663149072ba9227b173d532b/fx2.gif fx2 fx2.gif gif 2255 40 339 IMAGE-DOWNSAMPLED 1-s2.0-S1381116914003707-fx2.sml https://s3.amazonaws.com/prod-ucs-content-store-us-east/content/pii:S1381116914003707/fx2/THUMBNAIL/image/gif/a6f8d7414ab1aa0303d9e00cbe4d12ac/fx2.sml https://s3-eu-west-1.amazonaws.com/prod-ucs-content-store-eu-west/content/pii:S1381116914003707/fx2/THUMBNAIL/image/gif/a6f8d7414ab1aa0303d9e00cbe4d12ac/fx2.sml fx2 fx2.sml sml 1260 26 219 IMAGE-THUMBNAIL 1-s2.0-S1381116914003707-sc1.sml https://s3.amazonaws.com/prod-ucs-content-store-us-east/content/pii:S1381116914003707/sc1/THUMBNAIL/image/gif/5ec7a65d99e7c074539a40123d4ed223/sc1.sml https://s3-eu-west-1.amazonaws.com/prod-ucs-content-store-eu-west/content/pii:S1381116914003707/sc1/THUMBNAIL/image/gif/5ec7a65d99e7c074539a40123d4ed223/sc1.sml sc1 sc1.sml sml 2777 164 164 IMAGE-THUMBNAIL 1-s2.0-S1381116914003707-gr6.sml https://s3.amazonaws.com/prod-ucs-content-store-us-east/content/pii:S1381116914003707/gr6/THUMBNAIL/image/gif/5ca2b167ee66b66349eec984a2bd6b0c/gr6.sml https://s3-eu-west-1.amazonaws.com/prod-ucs-content-store-eu-west/content/pii:S1381116914003707/gr6/THUMBNAIL/image/gif/5ca2b167ee66b66349eec984a2bd6b0c/gr6.sml gr6 gr6.sml sml 4103 163 106 IMAGE-THUMBNAIL 1-s2.0-S1381116914003707-gr5.sml https://s3.amazonaws.com/prod-ucs-content-store-us-east/content/pii:S1381116914003707/gr5/THUMBNAIL/image/gif/6c80f1b2541a02aa685af6e7668123e0/gr5.sml https://s3-eu-west-1.amazonaws.com/prod-ucs-content-store-eu-west/content/pii:S1381116914003707/gr5/THUMBNAIL/image/gif/6c80f1b2541a02aa685af6e7668123e0/gr5.sml gr5 gr5.sml sml 4323 164 208 IMAGE-THUMBNAIL 1-s2.0-S1381116914003707-gr4.sml https://s3.amazonaws.com/prod-ucs-content-store-us-east/content/pii:S1381116914003707/gr4/THUMBNAIL/image/gif/783135e511568802a42d83277fa3915a/gr4.sml https://s3-eu-west-1.amazonaws.com/prod-ucs-content-store-eu-west/content/pii:S1381116914003707/gr4/THUMBNAIL/image/gif/783135e511568802a42d83277fa3915a/gr4.sml gr4 gr4.sml sml 3666 163 110 IMAGE-THUMBNAIL 1-s2.0-S1381116914003707-gr3eg.sml https://s3.amazonaws.com/prod-ucs-content-store-us-east/content/pii:S1381116914003707/gr3eg/THUMBNAIL/image/gif/8eb038e1ac342e473189f4f74e3bd83d/gr3eg.sml https://s3-eu-west-1.amazonaws.com/prod-ucs-content-store-eu-west/content/pii:S1381116914003707/gr3eg/THUMBNAIL/image/gif/8eb038e1ac342e473189f4f74e3bd83d/gr3eg.sml gr3eg gr3eg.sml sml 6436 163 147 IMAGE-THUMBNAIL 1-s2.0-S1381116914003707-gr3ad.sml https://s3.amazonaws.com/prod-ucs-content-store-us-east/content/pii:S1381116914003707/gr3ad/THUMBNAIL/image/gif/5bf79e9c1753da0c0a46b9a983398444/gr3ad.sml https://s3-eu-west-1.amazonaws.com/prod-ucs-content-store-eu-west/content/pii:S1381116914003707/gr3ad/THUMBNAIL/image/gif/5bf79e9c1753da0c0a46b9a983398444/gr3ad.sml gr3ad gr3ad.sml sml 6228 164 111 IMAGE-THUMBNAIL 1-s2.0-S1381116914003707-gr2.sml https://s3.amazonaws.com/prod-ucs-content-store-us-east/content/pii:S1381116914003707/gr2/THUMBNAIL/image/gif/cd10557b84be90173785353f9e6e9b9d/gr2.sml https://s3-eu-west-1.amazonaws.com/prod-ucs-content-store-eu-west/content/pii:S1381116914003707/gr2/THUMBNAIL/image/gif/cd10557b84be90173785353f9e6e9b9d/gr2.sml gr2 gr2.sml sml 5196 164 204 IMAGE-THUMBNAIL 1-s2.0-S1381116914003707-gr1.sml https://s3.amazonaws.com/prod-ucs-content-store-us-east/content/pii:S1381116914003707/gr1/THUMBNAIL/image/gif/5b75d397a359480909799666ec6e62ed/gr1.sml https://s3-eu-west-1.amazonaws.com/prod-ucs-content-store-eu-west/content/pii:S1381116914003707/gr1/THUMBNAIL/image/gif/5b75d397a359480909799666ec6e62ed/gr1.sml gr1 gr1.sml sml 7735 164 204 IMAGE-THUMBNAIL 1-s2.0-S1381116914003707-fx1.sml https://s3.amazonaws.com/prod-ucs-content-store-us-east/content/pii:S1381116914003707/fx1/THUMBNAIL/image/gif/035f8fa5a58230f532fb1b28d3ae4cfa/fx1.sml https://s3-eu-west-1.amazonaws.com/prod-ucs-content-store-eu-west/content/pii:S1381116914003707/fx1/THUMBNAIL/image/gif/035f8fa5a58230f532fb1b28d3ae4cfa/fx1.sml fx1 true fx1.sml sml 4235 65 219 IMAGE-THUMBNAIL MOLCAA 9238 S1381-1169(14)00370-7 10.1016/j.molcata.2014.08.023 Elsevier B.V. Fig. 1 (A) XRD patterns of the supports: (a) γ-Al2O3, (b) MgO, (c) HT-1, (d) HT-2, (e) HT-3, and (f) HT-4. (B) Partially enlarged picture of (A). (C) XRD patterns of the catalysts with various supports: (a) Au/γ-Al2O3, (b) Au/Mg(OH)2, (c) Au/HT-1, (d) Au/HT-2, (e) Au/HT-3, and (f) Au/HT-4. (D) XRD patterns of the Au/HT-3 with various gold contents: (a) HT-3, (b) 0.5wt% Au/HT-3, (c) 1wt% Au/HT-3, (d) 2wt% Au/HT-3, (e) 3wt% Au/HT-3. Fig. 2 XPS spectra of the Au 4f core level line for 2wt% Au/HT-3. Fig. 3 TEM images of the (a) 0.5wt% Au/HT-3, (b) 1wt% Au/HT-3, (c) 2wt% Au/HT-3, (d) 3wt% Au/HT-3, (e) recycled 2wt% Au/HT-3 after irradiation with light, (f) recycled 2wt% Au/HT-3 after a reaction in the dark, (g) HRTEM images of Au nanoparticles. (a1–f1) Distributions of corresponding particle size. Fig. 4 (A) UV–visible diffuse reflectance spectra of the Au/HT-3 with various gold contents and HT-3: (a) 0.5wt% Au/HT-3, (b) 1wt% Au/HT-3, (c) 2wt% Au/HT-3, (d) 3wt% Au/HT-3, (e) HT-3. (B) UV–visible diffuse reflectance spectra of the catalysts with different supports and supports: (a) Au/γ-Al2O3, (b) Au/Mg(OH)2, (c) Au/HT-1, (d) Au/HT-2, (e) Au/HT-4, and (f) all kinds of supports related with the above catalysts. Fig. 5 The CO2-TPD of different supports. Fig. 6 (A) Effect of light intensity on the photooxidation of benzyl alcohol. (B) Effect of the range of light wavelengths on the photooxidation of benzyl alcohol. Scheme 1 The mechanism for the photo-catalyzed aerobic oxidations of benzyl alcohol on 2wt% Au/HT-3. Table 1 Crystal spacing of HT-x. Entry Catalysts d value (nm) 1 HT-1 0.772 2 HT-2 0.783 3 HT-3 0.787 4 HT-4 0.796 Table 2 Gold content and nanoparticle size of the supported gold catalysts. Entry Catalysts Au content a (wt%) Mean Au size b (nm) 1 0.5wt% Au/HT-3 0.35 9.28 2 1wt% Au/HT-3 0.85 11.20 3 2wt% Au/HT-3 1.96 10.54 4 3wt% Au/HT-3 2.24 11.66 5 2wt% Au/HT-1 1.80 10.23 6 2wt% Au/HT-2 1.82 9.82 7 2wt% Au/HT-4 1.62 11.84 8 2wt% Au/γ-Al2O3 1.24 10.54 9 2wt% Au/Mg(OH)2 1.16 11.00 10 2wt% Au/HT-3 1.31 11.24 c (10.71) d a Measured by AAS. b Obtained from TEM. c The recycled catalyst after light reaction. d The recycled catalyst after dark reaction. Table 3 Effect of the solvent on the aerobic oxidation of benzyl alcohol over 2wt% Au/HT-3. a Entry Solvent In visible light b In the dark b Conv. (%) Sel. (%) Conv. (%) Sel. (%) 1 Toluene 42.8 97.58 5.76 >99 2 Mesitylene 49.55 >99 29.26 >99 3 Benzotrifluoride 72.93 96.78 3.57 >99 4 1,4-dioxane 56.32 94.92 24.12 93.55 5 DMF 20.68 >99 6.29 >99 6 DMSO 0 0 0 0 a Reaction conditions: solvent (10mL), benzyl alcohol (2mmol), catalyst (50mg), O2 (1atm), exposure time (48h). Light source: LED lamp. The light intensity between 400 and 800nm is 1.70Wcm−2. The solution temperature during exposure is 313K. b Conversion rate and selectivity are determined by GC. Table 4 Oxidation of benzyl alcohol over supported gold catalysts. a Entry Catalysts In visible light b In the dark b Conv. (%) Sel. (%) Conv. (%) Sel. (%) 1 – 0 0 0 0 2 HT-3 0 0 0 0 3 0.5wt% Au/HT-3 28.32 91.56 1.44 >99 4 1wt% Au/HT-3 36.01 92.59 2.53 >99 5 2wt% Au/HT-3 57.53 93.82 4.78 91.47 6 3wt% Au/HT-3 55.97 94.82 3.77 90.98 7 c 2wt% Au/HT-3 0 0 0 0 8 2wt% Au/HT-1 36.78 94.90 3.17 >99 9 2wt% Au/HT-2 61.66 93.46 4.91 >99 10 2wt% Au/HT-4 52.89 91.31 5.20 89.45 11 2wt% Au/γ-Al2O3 7.63 >99 1.30 >99 12 2wt% Au/Mg(OH)2 6.09 >99 2.17 >99 13 d 2wt% Au/HT-3 27.73 91.38 0.97 >99 14 e 2wt% Au/HT-3 49.44 94.04 1.86 >99 15 f 2wt% Au/HT-3 71.24(<1) c 93.19(>99) c 1.13 >99 a Reaction conditions: benzotrifluoride (10mL), benzyl alcohol (2mmol), catalyst (50mg), O2 (1atm), exposure time (24h). Light source: LED lamp. The light intensity between 400 and 800nm is 1.70Wcm−2. The solution temperature during exposure is 313K. b Conversion rate and selectivity are determined by GC. c The reaction is carried out under Ar. d The reusing of the catalyst by method 1 for the second time after light reaction. e The reusing of the catalyst by method 2 for the second time after light reaction. f TEMPO (0.042mmol) was added into the reaction system. Table 5 Oxidation of different alcohols over 2wt% Au/HT-3. a Entry Substrate Target product In visible light b In the dark b Conv. (%) Sel. (%) Conv. (%) Sel. (%) 1 Benzyl alcohol Benzyl aldehyde 57.41 93.82 3.68 91.47 2 4-Methylbenzyl alcohol 4-Methylbenzyl aldehyde 57.25 >99 2.87 >99 3 4-Methoxybenzyl alcohol 4-Methoxybenzyl aldehyde 60.73 >99 8.94 >99 4 4-Chlorobenzyl alcohol 4-Chlorobenzyl aldehyde 29.98 >99 2.30 >99 5 1-Phenyl ethanol Acetophenone 90.13 >99 1.69 >99 6 Cinnamyl alcohol Cinnamyl aldehyde 47.65 >99 2.31 83.74 7 c Crotyl alcohol Crotonaldehyde 54.85 79.87 3.12 94.95 8 d Furfuryl alcohol Furfuryl aldehyde 77.12 25.23 2.84 99.72 9 d Pyridine methanol Pyridine formaldehyde 66.23 69.09 14.39 81.38 10 d 1-Octanol Octanal 10.74 >99 2.37 >99 11 d 2-Octanol 2-Octanone 10.13 >99 0 >99 a Reaction conditions: benzotrifluoride (10mL), alcohol (2mmol), catalyst (50mg), O2 (1atm), exposure time (24h). Light source: LED lamp. The light intensity between 400 and 800nm is 1.70Wcm−2. The solution temperature during exposure is 313K. b Conversion rate is determined by GC. c Reaction conditions: 1,4-dioxane (10mL), alcohol (2mmol), catalyst (50mg), O2 (1atm), exposure time (22h). Light source: LED lamp. The light intensity between 400 and 800nm is 1.70Wcm−2. The solution temperature during exposure is 313K. d Reaction conditions: 1,4-dioxane (10mL), alcohol (2mmol), catalyst (50mg), O2 (1atm), exposure time (46h). Light source: LED lamp. The light intensity between 400 and 800nm is 1.70Wcm−2. The solution temperature during exposure is 313K. Hydrotalcite-supported gold catalysts for a selective aerobic oxidation of benzyl alcohol driven by visible light Jing Yu Jingyi Li ⁎ Huili Wei Jianwei Zheng Haiquan Su Xiaojing Wang College of Chemistry and Chemical Engineering, Inner Mongolia University, Hohhot, Inner Mongolia 010021, People's Republic of China College of Chemistry and Chemical Engineering, Inner Mongolia University Hohhot Inner Mongolia 010021 People's Republic of China ⁎ Corresponding author. Tel.: +86 471 4995411; fax: +86 471 4992981. Graphical abstract Hydrotalcite-supported gold nanoparticles are studied as photocatalysts for the aerobic oxidation of benzyl alcohol and its derivatives without additional base under irradiation by visible light. The effects of the solvent, the hydrotalcite constitution and the gold content on the catalytic reaction are studied. The reactions utilizing benzotrifluoride as the solvent yield the best results. When varying the gold content and support, 2wt% Au/HT-3 exhibits good catalytic activity. Furthermore, the rate of conversion under visible light is far superior to that in the dark. The catalytic activity can be tuned by manipulating the intensity or wavelength of the light. A reaction mechanism is proposed to rationalize these results: the primary reason for the lower activity observed on recycled catalysts is that the basic sites of hydrotalcite are decreased during the reaction in light. Keywords Gold Nanoparticles Hydrotalcite Photooxidation Benzyl alcohol 1 Introduction Using catalysts can enable access to mild and environmentally friendly conditions. Currently, researchers are focused on metal nanoparticles, particularly the catalytic activity of supported gold nanoparticles. Supported gold nanoparticles have been found to catalyze many reactions, such as CC couplings [1], the reduction of nitrobenzene [2], the oxidation of organic contaminants [3], phenol hydrogenation to form cyclohexanone [4], the isomerization of epoxides to form allylic alcohols [5] and the esterification of alcohols [6]. Gold nanoparticles have a localized surface plasmon resonance effect (LSPR) [7] under visible light irradiation. The LSPR effect is the collective oscillation of conduction electrons of gold nanoparticles, which resonate with the electromagnetic field of the incident light, so forming high-energy electrons on the gold surface. These high-energy electrons can offer energy to the reaction system, so gold nanoparticles can absorb light energy, and make it into their internal energy [8], which can make the reactant across the reaction barrier. Consequently, sunlight can be utilized. Hydrotalcite ( HT : [ M 1 − x 2 + M x 3 + ( OH ) ] x + [ A n − ] x / n ⋅ y H 2 O ) is an interesting inorganic layered building block material that contains metallic hydroxide layers with interlayered anions to balance the positive charges [9]. The metallic cations are in brucite-like sheets, while the anions in the interlayer are flexible and diverse [10]. Acidic and basic sites exist on hydrotalcite, and these sites can play crucial roles during reactions [11]. Moreover, the structure of the most common hydrotalcite is Mg6Al2(OH)16CO3·nH2O. The dehydrogenation of benzyl alcohol is a representative photocatalytic reaction [12], and the various factors that affect the activity of the catalysts have been studied. Different carriers, such as TiO2 [13], Al2O3 [14], zeolite [15], MOFs [16], MCFs [17] and different metals (such as Au [18], Pd [19], Ag [20], Au–Pd [21], Au–Pt [22], Au–Ag [23], Cu [24]) have been examined. Different catalytic conditions [25] and mechanisms [26] have also been assessed. However, despite the great effort has been expended, numerous aspects remain unclear. In this study, gold nanoparticles were loaded onto various supports and used as photocatalysts for the selective aerobic oxidation of benzyl alcohol under mild conditions. Adding base is not necessary in this reaction. Usually, base is required in reactions over supported gold catalysts because the bases activate the hydroxyl group on the alcohols [27]. In our study, benzyl alcohol was converted into benzaldehyde with a high selectivity after 24h under irradiation by visible light. Meanwhile, almost no reaction occurred in the dark under the same conditions. To confirm that the reaction is light-promoted, the light intensity and wavelength were varied. A possible reaction mechanism based on the experimental results was proposed. 2 Experimental 2.1 Preparation of HT The hydrotalcite supports (HT-x, x: Mg/Al mole rations, and x =1, 2, 3 and 4) were prepared using a co-precipitation method. (1) A certain ratio of MgCl2·6H2O and AlCl3·6H2O was dissolved in redistilled water (1L) under stirring. (2) NaOH and Na2CO3·10H2O were dissolved in redistilled water (4L). (3) The solution formed in (1) was added drop-wise into the solution formed in (2) with vigorous stirring over approximately 30min. (4) The mixed suspension was centrifuged and a white solid was obtained. Subsequently the solid was washed six times with Na2CO3 (0.1molL−1). (5) The wet cake was dried at 80°C for 20h in an oven [28]. 2.2 Preparation of Au/HT-x catalyst The 2wt% Au/HT-3 catalysts were prepared using a sequential deposition/reduction approach. HT-3 (2.5g) was dispersed in redistilled water (50mL) and sonicated for 10min. The pH of the solution was adjusted to 10 using NaOH (0.5molL−1) with stirring. Afterward, the HAuCl4 solution was added dropwise under sonication. Subsequently, lysine (20mL) was added to the mixture. After stirring for 30min, a fresh NaBH4 solution was added. This slurry was filtered before being washed with deionized water and ethanol, respectively. The resulting mixture was dried at 60°C for 12h. The other catalysts, including 2wt% Au/HT-x (x =1, 2 and 4), y wt% Au/HT-3 (y: 0.5, 1, 2 and 3, respectively), 2wt% Au/γ-Al2O3 and 2wt% Au/Mg(OH)2 were prepared using the same method [28]. 2.3 Recycling use of catalyst Method 1: Firstly, catalyst and reactant were separated via centrifugation. Afterward, the catalyst was washed with deionized water and ethanol. Finally, the catalyst was dried at 60°C for 12h. The recycled catalyst was reused in the next run under the same conditions [29]. Method 2: Firstly, catalyst and reactant were separated via centrifugation. Afterward, the catalyst was washed with Na2CO3 (0.1molL−1) and ethanol. Finally, the catalyst was dried at 60°C for 12h. The recycled catalyst was reused in the next run under the same conditions. 2.4 Catalyst characterization The X-ray diffraction patterns (XRD) of the samples were recorded on a RIGAKU D/MAX-2500 X-ray diffractometer using CuKα radiation (λ =1.5405Å) at 40kV and 100mA. The diffraction data were collected from 5° to 80°. The gold contents of the samples were quantitated using atomic absorption spectroscopy (AAS) on a GBC AVANTA YX-05 instrument. The X-ray photoelectron spectroscopy (XPS) measurements were performed on a Kratos XSAM800 using AlKα radiation. The binding energy was calibrated using the C1s photoelectron peak at 284.8eV as a reference. The particle sizes and morphologies of the samples were determined using transmission electron micrographs (TEM) taken on a FEI Tecnai G2 F20 S-Twin apparatus with a 200kV acceleration voltage. UV–visible diffuse reflectance spectra (UV–vis DRS) were detected on U-3900 made by Hitachi. Temperature-programmed desorption of CO2 (CO2-TPD) was performed on a Micromeritics AutoChem 2920 II instrument. The product was quantitatively analyzed with a GC-2014C gas chromatograph (GC). The identity of the product was confirmed via gas chromatography–mass spectrometry (GC–MS) on a Finnigan LCQ Advantage MAX instrument. 2.5 Catalytic test: aerobic oxidation of benzyl alcohol The reaction was carried out in a batch-type reaction with stirring. Typically, the catalyst powder (50mg), benzyl alcohol (2mmol) and solvent (10mL) were placed in a 50mL round-bottom flask; a LED lamp (200W, 400–800nm) was used as a light source. The system was filled with pure oxygen and sealed. A small amount of reactant was separated at regular intervals and quantitatively analyzed by GC. Afterward, the products were identified with a GC–MS spectrometer. For comparison, the reaction was performed simultaneously in the dark under the same conditions [30]. 2.6 Hydrogen peroxide test This kind of examination method is put forward by H. Bader et al. in 1988 [31]. The particular way is shown as follows: the sample (9mL) after 24h was placed in a 50mL round-bottom flask. The buffer solution (pH=6, 1mL) was added to achieve pH 6 in the final solution with stirring. Then DPD reagent (N,N-diethyl-1,4-phenylenediammonium sulphate, 17μL) and POD reagent (peroxidase product from horseradish, 17μL) were added in the solution [31]. 3 Results and discussion 3.1 Catalysts characterization The structures of various supports and catalysts are confirmed by XRD analysis. Fig. 1A shows the XRD patterns of the supports, including γ-Al2O3, MgO and hydrotalcite with various Mg/Al ratios (HT-x, x stands for Mg/Al mole rations, x =1, 2, 3 and 4), and revealing a series of characteristic patterns of inorganic structures. Fig. 1A (c–f) shows a series of characteristic patterns for the hydrotalcite structure. The diffraction peaks could be indexed to a pure hexagonal phase of hydrotalcites, especially the characteristic reflections (003) that exhibit a high intensity and a narrow line width [28]. The lattice parameters of HT-3 are a =3.058±0.004Å, c =23.969±0.062Å, α =90°, β =90°, γ =120°, and V =190.47Å3. Fig. 1B is the local amplification of Fig. 1A from 5° to 30°, and blue shifts of these peaks appear when increasing the Mg/Al ratio. The inter-planar crystal spacing is measured using the (003) diffraction peak with the Bragg formula (2d sin θ = nλ). The d value increases with the molar proportions of magnesium (Table 1 ). This phenomenon shows that a lattice expansion makes the XRD peaks move toward a smaller angle. Fig. 1C shows the characteristic peaks of supported samples (Au/γ-Al2O3, Au/Mg(OH)2 and Au/HT-x) with the same gold content (2wt%). An XRD pattern almost identical to HT-x was obtained for Au/HT-x, indicating that the crystal structure of the nano-crystalline support is conserved. Moreover, the characteristic diffraction peaks of the Au nanoparticles can be observed within the patterns. The MgO turned into brucite after the catalyst was prepared; possibly similar to a “memory effect” of hydrotalcite. (Calcined hydrotalcites can be reconstructed back to a layered structure when it is in contact with water and appropriate anions. This property is called retro-topotactical transformation. And it is also known as the “memory effect” [32].). Fig. 1D shows the XRD patterns of Au/HT-3 with different gold contents. The Au diffraction peaks intensify when the gold content increases. This phenomenon reveals that the size of the gold nanoparticles increases with the gold content, agreeing with the TEM data. The crystal structure of HT-3 is retained after the gold nanoparticles are deposited. Fig. 2 shows the corresponding Au 4f XPS spectra of the 2wt% Au/HT-3. The catalysts clearly contain Au0. As shown in Fig. 2 , the binding energies for the Au 4f7/2 (83.70eV) and Au 4f5/2 (87.35eV) electrons are observed. The binding energies of these two peaks correspond to the reduced state of gold [12,33]. The higher binding energy (88.90eV) corresponds to the XPS spectra of Mg 2S. The gold content is analyzed using atomic absorption spectroscopy (AAS), and the results are shown in Table 2 . The realistic gold content of the samples is slightly smaller than the theoretical value. Comparing the results of the catalysts (Table 2, entries 3 and 5–9) reveals that the nature of the supports affects the gold content [34]. The particle size distribution is determined by TEM, ranging from 8 to 12nm. The results are given in Table 2 and Fig. 3 and S1 . The TEM image shows that the Au nanoparticles are spherical and highly dispersed. The mean diameter of the gold nanoparticles increases slightly after increasing the gold content except for the 1wt% Au/HT-3 (Table 2, entries 1–4). The high-resolution TEM (HRTEM) images reveal the well-defined crystalline gold nanoparticles and the marked inter-planar spacing is about 0.238nm that corresponds to the (111) plane for face-centered cubic gold. Haider and coworkers found that a catalyst with 9nm Au particles is the most active when aerobically oxidizing 1-phenylethanol over Au/Cu–Mg–Al–O [35]. The UV–visible diffuse reflectance spectra of the catalysts are shown in Fig. 4 . An absorption band appears at about 520–530nm, which is the characteristic SPR absorption band of Au nanoparticles. A red shift of the peak at about 520–530nm occurs from 0.5wt% Au/HT-3 to 3wt% Au/HT-3, which explains the increase of Au particle size (the result is consistent with that of XRD and TEM. It is shown in Fig. 4A). The basic sites of supports were examined by temperature-programmed desorption (TPD) of CO2. As shown in Fig. 5 , the desorption of CO2 was observed from HT-x, Al2O3, and MgO, which indicates that basic sites exist on these supports. From the intensity and area of the CO2 desorption peak, we can see that HT-x possess relatively more basic sites. Only very weak CO2 desorption peaks could be discerned in the case of Al2O3 and MgO, which suggests that these supports have fewer basic sites. 3.2 Activity tests To determine the optimal reaction conditions, we tested various solvents, supports and gold contents. The 2wt% Au/HT-3 was initially tested during the photocatalytic aerobic oxidation of benzyl alcohol while using O2 as the oxidant in different solvents. Of the solvents tested (Table 3 ), moderate conversions (more than 40%) of benzyl alcohol with a high selectivity for benzyl aldehyde were obtained when using less polar solvents, such as toluene, mesitylene, benzotrifluoride and 1,4-dioxane; the conversion was the highest (72.93%) when benzotrifluoride was used (Table 3, entries 1–4). In contrast, polar solvents (Table 3, entries 5 and 6) caused a significant drop in conversion because they may compete with the reactants for the catalytic sites. Therefore, we chose to use benzotrifluoride in the later experiments. The conversion under light was far higher than that in dark. Therefore, the catalysts could catalyze the light-induced oxidation of benzyl alcohol. Subsequently, the effects of the support and gold content were tested. Because of the experimental limitations, a few differences in the gold content and size distribution appeared within the series of catalysts (these catalysts included 2wt% Au/HT-x and y wt% Au/HT-3); however, these data were within the allowable error range. The results for the oxidation of benzyl alcohol are summarized in Table 4 . No conversion occurred without the catalyst or with only the HT-3 support (Table 4, entries 1 and 2), confirming that the gold nanoparticles are crucial for the reaction system. No reaction occurred without O2 (Table 4, entry 7). Therefore, oxygen participates in the reaction. Subsequently, the photocatalytic aerobic oxidation of benzyl alcohol was carried out over y wt% Au/HT-3 with different gold contents (Table 4, entries 3–6). The conversion rate showed a reversed U-shape when increasing the gold content; 2wt% Au/HT-3 exhibited the highest conversion (57.53%) for the selective aerobic oxidation of benzyl alcohol. After the radical scavengers TEMPO were added into the reaction system, the conversation under visible light irradiation was greatly improved, but it had no effect on the reaction in dark. And it is worth noting that no reaction occurred in Ar atmosphere even after the addition of TEMPO. Therefore, it suggests that light and O2 are essential factors in the reaction process (Table 4, entry 15). For comparison, catalysts with different supports and the same gold content (2wt%) were tested during the aerobic oxidation of benzyl alcohol with O2 and benzotrifluoride. The 2wt% Au/HT-x (Table 4, entry 5 and entries 8–10) provided a moderate conversion of benzyl alcohol and a high selectivity for benzaldehyde; benzyl benzoate was obtained as the sole byproduct. Of the various supports tested, a highest catalytic activity was obtained over 2wt% Au/HT-2 (61.66%). Little conversion proceeded over Au/γ-Al2O3 or Au/Mg(OH)2 (Table 4, entries 11 and 12). These inferior activities indicate that the cooperation of magnesium and aluminum is critical for this catalytic reaction. These experimental results clearly indicate that the 2wt% Au/HT-3 is a suitable catalyst for the selective light-induced aerobic oxidation of benzyl alcohol. We chose HT-3 as a support because it is the most common hydrotalcite structure. In addition, the cooperative interaction between the gold and the support is essential. 3.3 Effect of light intensity and light wavelength To verify that the catalytic reaction is light-promoted, the effects of the light intensity and wavelength were studied. The conversion of benzyl alcohol over 2wt% Au/HT-3 increased gradually when the light intensified. The different light intensity (including 0.32, 0.78, 1.10, 1.34Wcm−1) was transformed, and the results are shown in Fig. 6A. This trend reveals a strong dependence on the intensity of the light when oxidizing benzyl alcohol. A higher light intensity can provide more energy to Au nanoparticles. Consequently, a higher light intensity benefited the interaction between the Au nanoparticles and the reactants, favoring the formation of AuH bonds [36], increasing the conversion. Moreover, more oxygen molecules can be activated on the gold nanoparticles, promoting the completion of the catalytic cycle. When using different light wavelengths (including 400–800, 450–800, 510–800, 550–800 and 600–800nm), the reaction was carried out under identical conditions. The results are summarized in Fig. 6B. The conversion of benzyl alcohol gradually declined as the wavelength increased up to 550nm; after that point, the conversion rapidly decreased. These results are consistent with the strong absorption of gold nanoparticles at 515–535nm [37]. Therefore, the above results indicate that the catalytic reaction is light-promoted. 3.4 Oxidation of various alcohols Subsequently, the reaction was extended to benzyl alcohol derivatives and aliphatic alcohols under the same reaction conditions, generating the corresponding aldehydes or ketones with a high selectivity. The results are summarized in Table 5 . The benzyl alcohol derivatives containing electron-donating groups (Table 5, entries 2 and 3) are oxidized more easily than those with electron-withdrawing groups (Table 5, entry 4). Furthermore, the oxidization of secondary alcohols, such as 1-phenyl ethanol, occurred with a high conversion (90.13%, Table 5, entry 5). The aerobic oxidation of allylic alcohols, such as cinnamyl alcohol and crotyl alcohol (Table 5, entries 6 and 7) also proceeded efficiently over 2wt% Au/HT-3 (47.65% and 54.85% conversion, respectively) with a high selectivity (>99% and 79.87%, respectively). Meanwhile, this catalyst can convert hetero-aromatic alcohols, such as furfuryl alcohol and pyridine methanol (Table 5, entries 8 and 9), to their corresponding aldehydes with high conversions (77.12% and 66.23%, respectively). In addition, catalytic activity was apparent even for aliphatic alcohols, such as 1-octanol and 2-octanol (Table 5, entries 10 and 11). The conversion of most of the light-promoted reactions was 20 times greater than that in the dark, demonstrating that the gold materials are photocatalysts. 3.5 Reaction mechanism Based on the experimental results, a reaction pathway was proposed for this oxidation. A possible mechanism for the photocatalytic aerobic oxidation of benzyl alcohol over Au/HT-3 is presented in Scheme 1 [38–44]. The first step of the reaction is adsorption of benzyl alcohol on the hydrotalcite supports. Subsequently, the Brønsted-basic sites on the hydrotalcite facilitate β-hydrogen atom elimination, generating a water molecule and forming the metal–alkoxide intermediate. Under visible light irradiation, gold nanoparticles activated oxygen molecules due to the LSPR effect [45,46]. Afterward, the hydrogen atom on the α-carbon of the benzyl alcohol was passed onto the Au nanoparticles, forming an adsorbed peroxide species (AuOOH) and the selective oxidation product benzaldehyde. This species reacts with hydrogen atom on the α-carbon of another benzyl alcohol to form adsorbed hydrogen peroxide (AuHOOH), hydrogen peroxide were detected in the reaction by the test of hydrogen peroxide. Finally, the H2O2 can decompose (E a =0.17eV) or desorb (E a =0.19eV) from the gold nanoparticles. The support is partially restored to its initial state, and the reaction cycle is completed. Seven key elementary steps in the reaction are shown as follows: (1) PhCH2OH+OH−(HT-3)→PhCH2O-HT-3+H2O (2) Au*+O2 →AuOO (3) PhCH2O-HT-3+AuOO+ hv →AuOOH (4) AuOOH+PhCH2O-HT-3→AuHOOH+PhCHO+e− (HT-3) (5) AuHOOH→2OH+Au* (6) HO+e− (HT-3)→OH− (HT-3) (7) AuHOOH→H2O2(sol)+Au* We also found that the catalytic activity of the recycled catalyst after washed by water is obviously decreased (Table 4, entry 13). Some researchers have suggested three reasons for this decrease in catalytic activity: (1) the gold nanoparticles fall off the support [47], (2) the gold nanoparticles agglomerate [48] or (3) the organic reactants can poison the catalyst [49]. To identify the major factor, the recovered catalyst was characterized. The AAS results show that gold nanoparticles fall off the support after recycling, leaving a gold content of 1.31wt% (Table 2, entry 10), which is between 1wt% and 2wt%. According to the effects of the gold content on the catalytic efficiency, the conversion rate when using the recycled catalyst should be between 36.01% and 57.53% (Table 4, entry 4 and 5). However, the conversion is actually 27.73%, falling outside of the theoretical range (Table 4, entry 13). But the conversion returned to 49.44% after the catalysts was washed with Na2CO3, which showed the basic sites of the support had an effect on the catalytic activity. This phenomenon suggested that the basic site was reduced during the reaction (Table 4, entry 14). The TEM image of the recycled catalyst indicates that the mean diameter of the gold nanoparticles is similar to that of the originals (Table 2, entries 3 and 10), suggesting that the gold nanoparticles have not agglomerated. We also propose that no organic reactants are adsorbed on the catalyst surface after washing and drying the catalyst, no poisoning occurs. According to the mechanism, the desorption of H2O2 decreases the Brønsted-base sites on the HT during the reaction, explaining the decrease in conversion over the recycled catalyst. The formation of molecular H2O2 consumes two hydrogens from two benzyl alcohol molecules are involved in the reaction. This process will consume two hydroxyl groups on the hydrotalcite. However, only some of the H2O2 is decomposed into hydroxylate and returned to the hydrotalcite. Consequently, the Brønsted-basic sites on the HT decrease after catalytic cycle. The reactivity declines as the reaction sites decrease. Meanwhile, the nature of the support will also affect the loading sites of the gold nanoparticles, so gold content of the recycled catalyst is lower than the initial one. In a word, the lower activity of the recycled catalyst is due to the decrease of Brønsted-basic sites on the HT, which reduce the catalytic sites and gold content. 4 Conclusion These heterogeneous catalysts can photocatalyze the aerobic oxidation of benzyl alcohol and its derivatives. The reaction proceeds with good conversion and selectivity. Using non-polar solvents is beneficial for this oxidation reaction. The gold content of Au/HT-3 and the nature of the supports strongly influence activity. The light intensity and wavelength experiments validate the ability of the catalysts to photocatalyze the oxidation of benzyl alcohol. A possible reaction mechanism is proposed. And this mechanism explains the reduction of catalytic activity when reusing it reasonably. Acknowledgements This work was financially supported by NSFC (Nos. 20567002 and 21067007), as well as by the Scientific Research Startup Fund of Inner Mongolia University (203044), the Education Department of Inner Mongolia Autonomous Region (NJ04093), Chunhui Plan of the Education Ministry (Z2004-2-15030 and Z2009-1-01005), the Natural Science Fund of Inner Mongolia (2010MS0203 and 2014MS0201), “513 talents” Plan of Inner Mongolia University and 2013 Annual Grassland Talents Project of Inner Mongolia Autonomous Region. References [1] B.Z. Yuan Y.Y. Pan Y.W. Li B.L. Yin H.F. Jiang Angew. Chem. Int. Ed. 49 2010 4054 4058 [2] H.Y. Zhu X.B. Ke X.Z. Yang S. Sarina H.W. Liu Angew. Chem. Int. Ed. 49 2010 9657 9661 [3] X. Chen H.Y. Zhu J.C. Zhao Z.F. Zheng X.P. Gao Angew. Chem. Int. Ed. 47 2008 5353 5356 [4] H.Z. Liu T. Jiang B.X. Han S.G. Liang Y.X. Zhou Science 326 2009 1250 1252 [5] C. Raptis H. Garcia M. Stratakis Angew. Chem. Int. Ed. 48 2009 3133 3136 [6] F.Z. Su J. Ni H. Sun Y. Cao H.Y. He K.N. Fan Chem. Eur. J. 14 2008 7131 7135 [7] X. Chen Z.F. Zheng X.B. Ke E. Jaatinen T.F. Xie D.J. Wang C. Guo J.C. Zhao H.Y. Zhu Green Chem. 12 2010 414 419 [8] X.B. Ke S. Sarina J. Zhao X.G. Zhang J. Chang H.Y. Zhu Chem. Commun. 48 2012 3509 3511 [9] O. Meyer F. Roessner R.A. Rakoczy R.W. Fischer ChemCatChem 2 2010 314 321 [10] S. Abelló F. Medina D. Tichit J. Pérez-Ramírez J.C. Groen J.E. Sueiras P. Salagre Y. Cesteros Chem. Eur. J. 11 2005 728 739 [11] Y. Kwon S.C.S. Lai P. Rodriguez M.T.M. Koper J. Am. Chem. Soc. 133 2011 6914 6917 [12] W.H. Fang J.S. Chen Q.H. Zhang W.P. Deng Y. Wang Chem. Eur. J. 17 2011 1247 1256 [13] K. Kimura S. Naya Y. Jin-nouchi H. Tada J. Phys. Chem. C 116 2012 7111 7117 [14] X.M. Wang G.J. Wu N.J. Guan L.D. Li Appl. Catal. B 115–116 2012 7 15 [15] X.G. Zhang X.B. Ke H.Y. Zhu Chem. Eur. J. 18 2012 8048 8056 [16] G.Z. Chen S.J. Wu H.L. Liu H.F. Jiang Y.W. Li Green Chem. 15 2013 230 235 [17] E.V. Johnston O. Verho M.D. Kärkäs M. Shakeri C.W. Tai P. Palmgren K. Eriksson S. Oscarsson J.E. Bäckvall Chem. Eur. J. 18 2012 12202 12206 [18] Y. Yuan N. Yan P.J. Dyson Inorg. Chem. 50 2011 11069 11074 [19] T. Nishimura N. Kakiuchi M. Inoue S. Uemura Chem. Commun. 2000 1245 1246 [20] T. Mitsudome Y. Mikami H. Funai T. Mizugaki K. Jitsukawa K. Kaneda Angew. Chem. Int. Ed. 47 2008 138 141 [21] L. Wang W. Zhang S.J. Zeng D.S. Su X.J. Meng F.S. Xiao Chin. J. Chem. 30 2012 2189 2197 [22] K. Kaizuka H. Miyamura S. Kobayashi J. Am. Chem. Soc. 132 2010 15096 15098 [23] X.M. Huang X.G. Wang X.S. Wang X.X. Wang M.W. Tan W.Z. Ding X.G. Lu J. Catal. 301 2013 217 226 [24] M. Dixit M. Mishra P.A. Joshi D.O. Shah J. Ind. Eng. Chem. 19 2013 458 468 [25] N. Kakiuchi Y. Maeda T. Nishimura S. Uemura J. Org. Chem. 66 2001 6620 6625 [26] T. Kawabata Y. Shinozuka Y. Ohishi T. Shishido K. Takaki K. Takehira J. Mol. Catal. A 236 2005 206 215 [27] N. Dimitratos J.A. Lopez-Sanchez G.J. Hutchings Chem. Sci. 3 2012 20 44 [28] P. Liu C. Li E.J.M. Hensen Chem. Eur. J. 18 2012 12122 12129 [29] F.Z. Su Y.M. Liu L.C. Wang Y. Cao H.Y. He K.N. Fan Angew. Chem. Int. Ed. 47 2008 334 337 [30] S. Sarina H.Y. Zhu E. Jaatinen Q. Xiao H.W. Liu J.F. Jia C. Chen J. Zhao J. Am. Chem. Soc. 135 2013 5793 5801 [31] H. Bader V. Sturzenegger J. Hoigné Water Res. 22 1988 1109 1115 [32] D.P. Debecker E.M. Gaigneaux G. Busca Chem. Eur. J. 15 2009 3920 3935 [33] J. Han Y. Liu R. Guo J. Am. Chem. Soc. 131 2009 2016 2026 [34] T. Chen F.Z. Zhang Y. Zhu Catal. Lett. 143 2013 206 218 [35] P. Haider J.D. Grunwaldt A. Baiker Catal. Today 141 2009 349 354 [36] M. Conte H. Miyamura S. Kobayashi V. Chechik J. Am. Chem. Soc. 131 2009 7189 7196 [37] H.Y. Zhu X. Chen Z.F. Zheng X.B. Ke E. Jaatinen J.C. Zhao C. Guo T.F. Xie D.J. Wang Chem. Commun. 2009 7524 7526 [38] B.N. Zope D.D. Hibbitts M. Neurock R.J. Davis Science 330 2010 74 78 [39] S. Gowrisankar H. Neumann M. Beller Angew. Chem. Int. Ed. 50 2011 5139 5143 [40] M. Zhang Q. Wang C.C. Chen L. Zang W.H. Ma J.C. Zhao Angew. Chem. Int. Ed. 48 2009 6081 6084 [41] D. Tsukamoto Y. Shiraishi Y. Sugano S. Ichikawa S. Tanaka T. Hirai J. Am. Chem. Soc. 134 2012 6309 6315 [42] K. Shimizu K. Sugino K. Sawabe A. Satsuma Chem. Eur. J. 15 2009 2341 2351 [43] C. Shang Z.P. Liu J. Am. Chem. Soc. 133 2011 9938 9947 [44] D. Tongsakul S. Nishimura C. Thammacharoen S. Ekgasit K. Ebitani Ind. Eng. Chem. Res. 51 2012 16182 16187 [45] A. Wittstock V. Zielasek J. Biener C.M. Friend M. Bäumer Science 327 2010 319 322 [46] X. Deng B. Min A. Guloy J. Am. Chem. Soc. 127 2005 9267 9270 [47] A. Abad A. Corma H. García Chem. Eur. J. 14 2008 212 222 [48] T. Mitsudome A. Noujima T. Mizugaki K. Jitsukawa K. Kaneda Adv. Synth. Catal. 351 2009 1890 1896 [49] J.C.F. Rodriguez-Reyes C.M. Friend R.J. Madix Surf. Sci. 606 2012 1129 1134",
      "scopus-id": "84906849541",
      "coredata": {
        "eid": "1-s2.0-S1381116914003707",
        "dc:description": "Hydrotalcite-supported gold nanoparticles are studied as photocatalysts for the aerobic oxidation of benzyl alcohol and its derivatives without additional base under irradiation by visible light. The effects of the solvent, the hydrotalcite constitution and the gold content on the catalytic reaction are studied. The reactions utilizing benzotrifluoride as the solvent yield the best results. When varying the gold content and support, 2wt% Au/HT-3 exhibits good catalytic activity. Furthermore, the rate of conversion under visible light is far superior to that in the dark. The catalytic activity can be tuned by manipulating the intensity or wavelength of the light. A reaction mechanism is proposed to rationalize these results: the primary reason for the lower activity observed on recycled catalysts is that the basic sites of hydrotalcite are decreased during the reaction in light.",
        "openArchiveArticle": "false",
        "prism:coverDate": "2014-12-31",
        "openaccessUserLicense": null,
        "prism:aggregationType": "Journal",
        "prism:url": "https://api.elsevier.com/content/article/pii/S1381116914003707",
        "dc:creator": [
          {
            "@_fa": "true",
            "$": "Yu, Jing"
          },
          {
            "@_fa": "true",
            "$": "Li, Jingyi"
          },
          {
            "@_fa": "true",
            "$": "Wei, Huili"
          },
          {
            "@_fa": "true",
            "$": "Zheng, Jianwei"
          },
          {
            "@_fa": "true",
            "$": "Su, Haiquan"
          },
          {
            "@_fa": "true",
            "$": "Wang, Xiaojing"
          }
        ],
        "link": [
          {
            "@_fa": "true",
            "@rel": "self",
            "@href": "https://api.elsevier.com/content/article/pii/S1381116914003707"
          },
          {
            "@_fa": "true",
            "@rel": "scidir",
            "@href": "https://www.sciencedirect.com/science/article/pii/S1381116914003707"
          }
        ],
        "dc:format": "application/json",
        "openaccessType": null,
        "pii": "S1381-1169(14)00370-7",
        "prism:volume": "395",
        "prism:publisher": "Elsevier B.V.",
        "dc:title": "Hydrotalcite-supported gold catalysts for a selective aerobic oxidation of benzyl alcohol driven by visible light",
        "prism:copyright": "Copyright © 2014 Elsevier B.V. All rights reserved.",
        "openaccess": "0",
        "prism:issn": "13811169",
        "dcterms:subject": [
          {
            "@_fa": "true",
            "$": "Gold"
          },
          {
            "@_fa": "true",
            "$": "Nanoparticles"
          },
          {
            "@_fa": "true",
            "$": "Hydrotalcite"
          },
          {
            "@_fa": "true",
            "$": "Photooxidation"
          },
          {
            "@_fa": "true",
            "$": "Benzyl alcohol"
          }
        ],
        "openaccessArticle": "false",
        "prism:publicationName": "Journal of Molecular Catalysis A: Chemical",
        "openaccessSponsorType": null,
        "prism:pageRange": "128-136",
        "prism:endingPage": "136",
        "pubType": "fla",
        "prism:coverDisplayDate": "December 2014",
        "prism:doi": "10.1016/j.molcata.2014.08.023",
        "prism:startingPage": "128",
        "dc:identifier": "doi:10.1016/j.molcata.2014.08.023",
        "openaccessSponsorName": null
      },
      "objects": {
        "object": [
          {
            "@category": "thumbnail",
            "@height": "23",
            "@width": "255",
            "@_fa": "true",
            "$": "https://api.elsevier.com/content/object/eid/1-s2.0-S1381116914003707-si1.gif?httpAccept=%2A%2F%2A",
            "@multimediatype": "GIF image file",
            "@type": "ALTIMG",
            "@size": "1042",
            "@ref": "si1",
            "@mimetype": "image/gif"
          },
          {
            "@category": "high",
            "@height": "2041",
            "@width": "2044",
            "@_fa": "true",
            "$": "https://api.elsevier.com/content/object/eid/1-s2.0-S1381116914003707-sc1_lrg.jpg?httpAccept=%2A%2F%2A",
            "@multimediatype": "JPEG image file",
            "@type": "IMAGE-HIGH-RES",
            "@size": "172572",
            "@ref": "sc1",
            "@mimetype": "image/jpeg"
          },
          {
            "@category": "high",
            "@height": "2376",
            "@width": "1547",
            "@_fa": "true",
            "$": "https://api.elsevier.com/content/object/eid/1-s2.0-S1381116914003707-gr6_lrg.jpg?httpAccept=%2A%2F%2A",
            "@multimediatype": "JPEG image file",
            "@type": "IMAGE-HIGH-RES",
            "@size": "214000",
            "@ref": "gr6",
            "@mimetype": "image/jpeg"
          },
          {
            "@category": "high",
            "@height": "1214",
            "@width": "1542",
            "@_fa": "true",
            "$": "https://api.elsevier.com/content/object/eid/1-s2.0-S1381116914003707-gr5_lrg.jpg?httpAccept=%2A%2F%2A",
            "@multimediatype": "JPEG image file",
            "@type": "IMAGE-HIGH-RES",
            "@size": "143384",
            "@ref": "gr5",
            "@mimetype": "image/jpeg"
          },
          {
            "@category": "high",
            "@height": "2275",
            "@width": "1537",
            "@_fa": "true",
            "$": "https://api.elsevier.com/content/object/eid/1-s2.0-S1381116914003707-gr4_lrg.jpg?httpAccept=%2A%2F%2A",
            "@multimediatype": "JPEG image file",
            "@type": "IMAGE-HIGH-RES",
            "@size": "326118",
            "@ref": "gr4",
            "@mimetype": "image/jpeg"
          },
          {
            "@category": "high",
            "@height": "3244",
            "@width": "2917",
            "@_fa": "true",
            "$": "https://api.elsevier.com/content/object/eid/1-s2.0-S1381116914003707-gr3eg_lrg.jpg?httpAccept=%2A%2F%2A",
            "@multimediatype": "JPEG image file",
            "@type": "IMAGE-HIGH-RES",
            "@size": "1058139",
            "@ref": "gr3eg",
            "@mimetype": "image/jpeg"
          },
          {
            "@category": "high",
            "@height": "4375",
            "@width": "2961",
            "@_fa": "true",
            "$": "https://api.elsevier.com/content/object/eid/1-s2.0-S1381116914003707-gr3ad_lrg.jpg?httpAccept=%2A%2F%2A",
            "@multimediatype": "JPEG image file",
            "@type": "IMAGE-HIGH-RES",
            "@size": "1388764",
            "@ref": "gr3ad",
            "@mimetype": "image/jpeg"
          },
          {
            "@category": "high",
            "@height": "1368",
            "@width": "1705",
            "@_fa": "true",
            "$": "https://api.elsevier.com/content/object/eid/1-s2.0-S1381116914003707-gr2_lrg.jpg?httpAccept=%2A%2F%2A",
            "@multimediatype": "JPEG image file",
            "@type": "IMAGE-HIGH-RES",
            "@size": "189968",
            "@ref": "gr2",
            "@mimetype": "image/jpeg"
          },
          {
            "@category": "high",
            "@height": "2406",
            "@width": "3000",
            "@_fa": "true",
            "$": "https://api.elsevier.com/content/object/eid/1-s2.0-S1381116914003707-gr1_lrg.jpg?httpAccept=%2A%2F%2A",
            "@multimediatype": "JPEG image file",
            "@type": "IMAGE-HIGH-RES",
            "@size": "864910",
            "@ref": "gr1",
            "@mimetype": "image/jpeg"
          },
          {
            "@category": "high",
            "@height": "655",
            "@width": "2213",
            "@_fa": "true",
            "$": "https://api.elsevier.com/content/object/eid/1-s2.0-S1381116914003707-fx1_lrg.jpg?httpAccept=%2A%2F%2A",
            "@multimediatype": "JPEG image file",
            "@type": "IMAGE-HIGH-RES",
            "@size": "154382",
            "@ref": "fx1",
            "@mimetype": "image/jpeg"
          },
          {
            "@category": "high",
            "@height": "352",
            "@width": "3000",
            "@_fa": "true",
            "$": "https://api.elsevier.com/content/object/eid/1-s2.0-S1381116914003707-fx2_lrg.gif?httpAccept=%2A%2F%2A",
            "@multimediatype": "GIF image file",
            "@type": "IMAGE-HIGH-RES",
            "@size": "15867",
            "@ref": "fx2",
            "@mimetype": "image/gif"
          },
          {
            "@category": "standard",
            "@height": "460",
            "@width": "461",
            "@_fa": "true",
            "$": "https://api.elsevier.com/content/object/eid/1-s2.0-S1381116914003707-sc1.jpg?httpAccept=%2A%2F%2A",
            "@multimediatype": "JPEG image file",
            "@type": "IMAGE-DOWNSAMPLED",
            "@size": "20859",
            "@ref": "sc1",
            "@mimetype": "image/jpeg"
          },
          {
            "@category": "standard",
            "@height": "536",
            "@width": "349",
            "@_fa": "true",
            "$": "https://api.elsevier.com/content/object/eid/1-s2.0-S1381116914003707-gr6.jpg?httpAccept=%2A%2F%2A",
            "@multimediatype": "JPEG image file",
            "@type": "IMAGE-DOWNSAMPLED",
            "@size": "28130",
            "@ref": "gr6",
            "@mimetype": "image/jpeg"
          },
          {
            "@category": "standard",
            "@height": "274",
            "@width": "348",
            "@_fa": "true",
            "$": "https://api.elsevier.com/content/object/eid/1-s2.0-S1381116914003707-gr5.jpg?httpAccept=%2A%2F%2A",
            "@multimediatype": "JPEG image file",
            "@type": "IMAGE-DOWNSAMPLED",
            "@size": "16677",
            "@ref": "gr5",
            "@mimetype": "image/jpeg"
          },
          {
            "@category": "standard",
            "@height": "514",
            "@width": "347",
            "@_fa": "true",
            "$": "https://api.elsevier.com/content/object/eid/1-s2.0-S1381116914003707-gr4.jpg?httpAccept=%2A%2F%2A",
            "@multimediatype": "JPEG image file",
            "@type": "IMAGE-DOWNSAMPLED",
            "@size": "37840",
            "@ref": "gr4",
            "@mimetype": "image/jpeg"
          },
          {
            "@category": "standard",
            "@height": "733",
            "@width": "659",
            "@_fa": "true",
            "$": "https://api.elsevier.com/content/object/eid/1-s2.0-S1381116914003707-gr3eg.jpg?httpAccept=%2A%2F%2A",
            "@multimediatype": "JPEG image file",
            "@type": "IMAGE-DOWNSAMPLED",
            "@size": "122567",
            "@ref": "gr3eg",
            "@mimetype": "image/jpeg"
          },
          {
            "@category": "standard",
            "@height": "988",
            "@width": "669",
            "@_fa": "true",
            "$": "https://api.elsevier.com/content/object/eid/1-s2.0-S1381116914003707-gr3ad.jpg?httpAccept=%2A%2F%2A",
            "@multimediatype": "JPEG image file",
            "@type": "IMAGE-DOWNSAMPLED",
            "@size": "167365",
            "@ref": "gr3ad",
            "@mimetype": "image/jpeg"
          },
          {
            "@category": "standard",
            "@height": "309",
            "@width": "385",
            "@_fa": "true",
            "$": "https://api.elsevier.com/content/object/eid/1-s2.0-S1381116914003707-gr2.jpg?httpAccept=%2A%2F%2A",
            "@multimediatype": "JPEG image file",
            "@type": "IMAGE-DOWNSAMPLED",
            "@size": "21717",
            "@ref": "gr2",
            "@mimetype": "image/jpeg"
          },
          {
            "@category": "standard",
            "@height": "544",
            "@width": "678",
            "@_fa": "true",
            "$": "https://api.elsevier.com/content/object/eid/1-s2.0-S1381116914003707-gr1.jpg?httpAccept=%2A%2F%2A",
            "@multimediatype": "JPEG image file",
            "@type": "IMAGE-DOWNSAMPLED",
            "@size": "87567",
            "@ref": "gr1",
            "@mimetype": "image/jpeg"
          },
          {
            "@category": "standard",
            "@height": "148",
            "@width": "500",
            "@_fa": "true",
            "$": "https://api.elsevier.com/content/object/eid/1-s2.0-S1381116914003707-fx1.jpg?httpAccept=%2A%2F%2A",
            "@multimediatype": "JPEG image file",
            "@type": "IMAGE-DOWNSAMPLED",
            "@size": "20101",
            "@ref": "fx1",
            "@mimetype": "image/jpeg"
          },
          {
            "@category": "standard",
            "@height": "40",
            "@width": "339",
            "@_fa": "true",
            "$": "https://api.elsevier.com/content/object/eid/1-s2.0-S1381116914003707-fx2.gif?httpAccept=%2A%2F%2A",
            "@multimediatype": "GIF image file",
            "@type": "IMAGE-DOWNSAMPLED",
            "@size": "2255",
            "@ref": "fx2",
            "@mimetype": "image/gif"
          },
          {
            "@category": "thumbnail",
            "@height": "26",
            "@width": "219",
            "@_fa": "true",
            "$": "https://api.elsevier.com/content/object/eid/1-s2.0-S1381116914003707-fx2.sml?httpAccept=%2A%2F%2A",
            "@multimediatype": "GIF image file",
            "@type": "IMAGE-THUMBNAIL",
            "@size": "1260",
            "@ref": "fx2",
            "@mimetype": "image/gif"
          },
          {
            "@category": "thumbnail",
            "@height": "164",
            "@width": "164",
            "@_fa": "true",
            "$": "https://api.elsevier.com/content/object/eid/1-s2.0-S1381116914003707-sc1.sml?httpAccept=%2A%2F%2A",
            "@multimediatype": "GIF image file",
            "@type": "IMAGE-THUMBNAIL",
            "@size": "2777",
            "@ref": "sc1",
            "@mimetype": "image/gif"
          },
          {
            "@category": "thumbnail",
            "@height": "163",
            "@width": "106",
            "@_fa": "true",
            "$": "https://api.elsevier.com/content/object/eid/1-s2.0-S1381116914003707-gr6.sml?httpAccept=%2A%2F%2A",
            "@multimediatype": "GIF image file",
            "@type": "IMAGE-THUMBNAIL",
            "@size": "4103",
            "@ref": "gr6",
            "@mimetype": "image/gif"
          },
          {
            "@category": "thumbnail",
            "@height": "164",
            "@width": "208",
            "@_fa": "true",
            "$": "https://api.elsevier.com/content/object/eid/1-s2.0-S1381116914003707-gr5.sml?httpAccept=%2A%2F%2A",
            "@multimediatype": "GIF image file",
            "@type": "IMAGE-THUMBNAIL",
            "@size": "4323",
            "@ref": "gr5",
            "@mimetype": "image/gif"
          },
          {
            "@category": "thumbnail",
            "@height": "163",
            "@width": "110",
            "@_fa": "true",
            "$": "https://api.elsevier.com/content/object/eid/1-s2.0-S1381116914003707-gr4.sml?httpAccept=%2A%2F%2A",
            "@multimediatype": "GIF image file",
            "@type": "IMAGE-THUMBNAIL",
            "@size": "3666",
            "@ref": "gr4",
            "@mimetype": "image/gif"
          },
          {
            "@category": "thumbnail",
            "@height": "163",
            "@width": "147",
            "@_fa": "true",
            "$": "https://api.elsevier.com/content/object/eid/1-s2.0-S1381116914003707-gr3eg.sml?httpAccept=%2A%2F%2A",
            "@multimediatype": "GIF image file",
            "@type": "IMAGE-THUMBNAIL",
            "@size": "6436",
            "@ref": "gr3eg",
            "@mimetype": "image/gif"
          },
          {
            "@category": "thumbnail",
            "@height": "164",
            "@width": "111",
            "@_fa": "true",
            "$": "https://api.elsevier.com/content/object/eid/1-s2.0-S1381116914003707-gr3ad.sml?httpAccept=%2A%2F%2A",
            "@multimediatype": "GIF image file",
            "@type": "IMAGE-THUMBNAIL",
            "@size": "6228",
            "@ref": "gr3ad",
            "@mimetype": "image/gif"
          },
          {
            "@category": "thumbnail",
            "@height": "164",
            "@width": "204",
            "@_fa": "true",
            "$": "https://api.elsevier.com/content/object/eid/1-s2.0-S1381116914003707-gr2.sml?httpAccept=%2A%2F%2A",
            "@multimediatype": "GIF image file",
            "@type": "IMAGE-THUMBNAIL",
            "@size": "5196",
            "@ref": "gr2",
            "@mimetype": "image/gif"
          },
          {
            "@category": "thumbnail",
            "@height": "164",
            "@width": "204",
            "@_fa": "true",
            "$": "https://api.elsevier.com/content/object/eid/1-s2.0-S1381116914003707-gr1.sml?httpAccept=%2A%2F%2A",
            "@multimediatype": "GIF image file",
            "@type": "IMAGE-THUMBNAIL",
            "@size": "7735",
            "@ref": "gr1",
            "@mimetype": "image/gif"
          },
          {
            "@category": "thumbnail",
            "@height": "65",
            "@width": "219",
            "@_fa": "true",
            "$": "https://api.elsevier.com/content/object/eid/1-s2.0-S1381116914003707-fx1.sml?httpAccept=%2A%2F%2A",
            "@multimediatype": "GIF image file",
            "@type": "IMAGE-THUMBNAIL",
            "@size": "4235",
            "@ref": "fx1",
            "@mimetype": "image/gif"
          }
        ]
      },
      "link": {
        "@rel": "abstract",
        "@href": "https://api.elsevier.com/content/abstract/scopus_id/84906849541"
      }
    }
  }
}