{
  "metadata": {
    "title": "Reaction kinetics of the ethene tetramerization catalyst system CrCl<ce:inf loc=post>3</ce:inf>(THF)<ce:inf loc=post>3</ce:inf>, Ph<ce:inf loc=post>2</ce:inf>PN(<ce:sup loc=pre><ce:italic>i</ce:italic></ce:sup>Pr)PPh<ce:inf loc=post>2</ce:inf> and MAO: The unexpected and unusual formation of odd-numbered 1-olefins",
    "authors": "; ; ",
    "journal": "Journal of Molecular Catalysis A: Chemical",
    "date": "2009-01-05",
    "doi": "10.1016/j.molcata.2008.09.026",
    "abstract": "",
    "uri": "https://api.elsevier.com/content/article/pii/S1381116908004196",
    "pii": "S1381116908004196"
  },
  "fulltext": {
    "full-text-retrieval-response": {
      "scopus-eid": "2-s2.0-57149097250",
      "originalText": "serial JL 271358 291210 291744 291790 291809 31 Journal of Molecular Catalysis A: Chemical JOURNALMOLECULARCATALYSISACHEMICAL 2008-10-05 2008-10-05 2010-04-16T17:45:36 1-s2.0-S1381116908004196 S1381-1169(08)00419-6 S1381116908004196 10.1016/j.molcata.2008.09.026 S300 S300.1 FULL-TEXT 1-s2.0-S1381116908X00160 2015-05-15T05:56:33.307883-04:00 0 0 20090105 2009 2008-10-05T00:00:00Z articleinfo crossmark dco dateupdated tomb dateloaded datesearch indexeddate issuelist volumelist yearnav absattachment articletitlenorm authfirstinitialnorm authfirstsurnamenorm cid cids contenttype copyright dateloadedtxt docsubtype doctype doi eid ewtransactionid hubeid issfirst issn issnnorm itemstage itemtransactionid itemweight openaccess openarchive pg pgfirst pglast pii piinorm pubdatestart pubdatetxt pubyr sectiontitle sortorder srctitle srctitlenorm srctype subheadings volfirst volissue webpdf webpdfpagecount figure table body mmlmath acknowledge affil articletitle auth authfirstini authfull authkeywords authlast primabst pubtype ref specialabst alllist content subj ssids 1381-1169 13811169 297 297 1 1 Volume 297, Issue 1 3 1 8 1 8 20090105 5 January 2009 2009-01-05 2009 Editor Choice paper article fla Copyright © 2008 Elsevier B.V. All rights reserved. REACTIONKINETICSETHENETETRAMERIZATIONCATALYSTSYSTEMCRCL3THF3PH2PNIPRPPH2MAOUNEXPECTEDUNUSUALFORMATIONODDNUMBERED1OLEFINS WOHL A 1 Introduction 2 Experimental 2.1 Materials 2.2 Reactor equipment and ethene oligomerization procedure 2.3 Catalyst preparation 3 Results and discussion 3.1 Influence of the ligand/chromium ratio on reaction kinetics 3.2 Influence of the ligand/chromium ratio on product distribution 4 Conclusion Acknowledgments References BURRIDGE 2008 E STEINBORN 2007 D GRUNDLAGENDERMETALLORGANISCHENKOMPLEXKATALYSE DOSSETT 2001 699 S COOLEY 2001 4769 N CARTER 2002 858 A DIXON 2004 3641 J BOLLMANN 2004 14712 A MCGUINNESS 2003 334 D MCGUINNESS 2003 5272 D MCGUINNESS 2005 552 D ELOWE 2006 5255 P BLUHM 2005 713 M NENU 1865 C WASS 2007 816 D MANYIK 1977 197 R BRIGGS 1989 674 J AGAPIE 2004 1304 T AGAPIE 2007 14281 T YU 2003 808 Z TOBISCH 2003 5392 S VANRENSBURG 2004 1207 W BLOK 2003 2564 A KOHN 2008 245; R YANG 2000 29 Y WALSH 2006 184 R JIANG 2006 161 T WOHLX2009X1 WOHLX2009X1X8 WOHLX2009X1XA WOHLX2009X1X8XA item S1381-1169(08)00419-6 S1381116908004196 1-s2.0-S1381116908004196 10.1016/j.molcata.2008.09.026 271358 2010-09-21T22:41:48.723419-04:00 2009-01-05 1-s2.0-S1381116908004196-main.pdf https://s3.amazonaws.com/prod-ucs-content-store-us-east/content/pii:S1381116908004196/MAIN/application/pdf/ba2a3e7e1aca3dcde4a84309abe4cee6/main.pdf https://s3-eu-west-1.amazonaws.com/prod-ucs-content-store-eu-west/content/pii:S1381116908004196/MAIN/application/pdf/ba2a3e7e1aca3dcde4a84309abe4cee6/main.pdf main.pdf pdf true 948624 MAIN 8 1-s2.0-S1381116908004196-main_1.png https://s3.amazonaws.com/prod-ucs-content-store-us-east/content/pii:S1381116908004196/PREVIEW/image/png/48cf189261f568a0b2e6014c15e03253/main_1.png https://s3-eu-west-1.amazonaws.com/prod-ucs-content-store-eu-west/content/pii:S1381116908004196/PREVIEW/image/png/48cf189261f568a0b2e6014c15e03253/main_1.png main_1.png png 50853 849 656 IMAGE-WEB-PDF 1 1-s2.0-S1381116908004196-si1.gif https://s3.amazonaws.com/prod-ucs-content-store-us-east/content/pii:S1381116908004196/STRIPIN/image/gif/ebe6b2bd1bda928a4e2521ad784d895b/si1.gif https://s3-eu-west-1.amazonaws.com/prod-ucs-content-store-eu-west/content/pii:S1381116908004196/STRIPIN/image/gif/ebe6b2bd1bda928a4e2521ad784d895b/si1.gif si1 si1.gif gif 613 20 165 ALTIMG 1-s2.0-S1381116908004196-sc1.jpg https://s3.amazonaws.com/prod-ucs-content-store-us-east/content/pii:S1381116908004196/sc1/DOWNSAMPLED/image/jpeg/0a3efdcd6e45c9277be6138d9ddb7f41/sc1.jpg https://s3-eu-west-1.amazonaws.com/prod-ucs-content-store-eu-west/content/pii:S1381116908004196/sc1/DOWNSAMPLED/image/jpeg/0a3efdcd6e45c9277be6138d9ddb7f41/sc1.jpg sc1 sc1.jpg jpg 8477 232 279 IMAGE-DOWNSAMPLED 1-s2.0-S1381116908004196-sc1.sml https://s3.amazonaws.com/prod-ucs-content-store-us-east/content/pii:S1381116908004196/sc1/THUMBNAIL/image/gif/e699688e3f75256cff458a4ff5c4c5e4/sc1.sml https://s3-eu-west-1.amazonaws.com/prod-ucs-content-store-eu-west/content/pii:S1381116908004196/sc1/THUMBNAIL/image/gif/e699688e3f75256cff458a4ff5c4c5e4/sc1.sml sc1 sc1.sml sml 1014 93 112 IMAGE-THUMBNAIL 1-s2.0-S1381116908004196-sc2.jpg https://s3.amazonaws.com/prod-ucs-content-store-us-east/content/pii:S1381116908004196/sc2/DOWNSAMPLED/image/jpeg/26206ea9069878c6e066690e6661f003/sc2.jpg https://s3-eu-west-1.amazonaws.com/prod-ucs-content-store-eu-west/content/pii:S1381116908004196/sc2/DOWNSAMPLED/image/jpeg/26206ea9069878c6e066690e6661f003/sc2.jpg sc2 sc2.jpg jpg 7689 230 267 IMAGE-DOWNSAMPLED 1-s2.0-S1381116908004196-sc2.sml https://s3.amazonaws.com/prod-ucs-content-store-us-east/content/pii:S1381116908004196/sc2/THUMBNAIL/image/gif/b3edf134c0c49a9dfd4c41cd6735ce13/sc2.sml https://s3-eu-west-1.amazonaws.com/prod-ucs-content-store-eu-west/content/pii:S1381116908004196/sc2/THUMBNAIL/image/gif/b3edf134c0c49a9dfd4c41cd6735ce13/sc2.sml sc2 sc2.sml sml 1001 93 108 IMAGE-THUMBNAIL 1-s2.0-S1381116908004196-sc3.jpg https://s3.amazonaws.com/prod-ucs-content-store-us-east/content/pii:S1381116908004196/sc3/DOWNSAMPLED/image/jpeg/5363401726fe6fd62f71ac7a2c3a253b/sc3.jpg https://s3-eu-west-1.amazonaws.com/prod-ucs-content-store-eu-west/content/pii:S1381116908004196/sc3/DOWNSAMPLED/image/jpeg/5363401726fe6fd62f71ac7a2c3a253b/sc3.jpg sc3 sc3.jpg jpg 8219 230 278 IMAGE-DOWNSAMPLED 1-s2.0-S1381116908004196-sc3.sml https://s3.amazonaws.com/prod-ucs-content-store-us-east/content/pii:S1381116908004196/sc3/THUMBNAIL/image/gif/c8e1fdc0b92d9d2020a9fc2fa7c2e985/sc3.sml https://s3-eu-west-1.amazonaws.com/prod-ucs-content-store-eu-west/content/pii:S1381116908004196/sc3/THUMBNAIL/image/gif/c8e1fdc0b92d9d2020a9fc2fa7c2e985/sc3.sml sc3 sc3.sml sml 1049 93 113 IMAGE-THUMBNAIL 1-s2.0-S1381116908004196-sc4.jpg https://s3.amazonaws.com/prod-ucs-content-store-us-east/content/pii:S1381116908004196/sc4/DOWNSAMPLED/image/jpeg/659289db01afe55037f31c6a655ed29a/sc4.jpg https://s3-eu-west-1.amazonaws.com/prod-ucs-content-store-eu-west/content/pii:S1381116908004196/sc4/DOWNSAMPLED/image/jpeg/659289db01afe55037f31c6a655ed29a/sc4.jpg sc4 sc4.jpg jpg 13085 290 348 IMAGE-DOWNSAMPLED 1-s2.0-S1381116908004196-sc4.sml https://s3.amazonaws.com/prod-ucs-content-store-us-east/content/pii:S1381116908004196/sc4/THUMBNAIL/image/gif/58e84a2cb6203fe92dcdefcc312ace77/sc4.sml https://s3-eu-west-1.amazonaws.com/prod-ucs-content-store-eu-west/content/pii:S1381116908004196/sc4/THUMBNAIL/image/gif/58e84a2cb6203fe92dcdefcc312ace77/sc4.sml sc4 sc4.sml sml 1119 93 112 IMAGE-THUMBNAIL 1-s2.0-S1381116908004196-sc5.jpg https://s3.amazonaws.com/prod-ucs-content-store-us-east/content/pii:S1381116908004196/sc5/DOWNSAMPLED/image/jpeg/30201f28de7411d5e35a65be0851da4a/sc5.jpg https://s3-eu-west-1.amazonaws.com/prod-ucs-content-store-eu-west/content/pii:S1381116908004196/sc5/DOWNSAMPLED/image/jpeg/30201f28de7411d5e35a65be0851da4a/sc5.jpg sc5 sc5.jpg jpg 15513 214 501 IMAGE-DOWNSAMPLED 1-s2.0-S1381116908004196-sc5.sml https://s3.amazonaws.com/prod-ucs-content-store-us-east/content/pii:S1381116908004196/sc5/THUMBNAIL/image/gif/11b63cfc3b39d6e18971a42ce04a248c/sc5.sml https://s3-eu-west-1.amazonaws.com/prod-ucs-content-store-eu-west/content/pii:S1381116908004196/sc5/THUMBNAIL/image/gif/11b63cfc3b39d6e18971a42ce04a248c/sc5.sml sc5 sc5.sml sml 797 53 125 IMAGE-THUMBNAIL 1-s2.0-S1381116908004196-gr1.jpg https://s3.amazonaws.com/prod-ucs-content-store-us-east/content/pii:S1381116908004196/gr1/DOWNSAMPLED/image/jpeg/1057c87ce3433b9f4d3eb4e8816bb4af/gr1.jpg https://s3-eu-west-1.amazonaws.com/prod-ucs-content-store-eu-west/content/pii:S1381116908004196/gr1/DOWNSAMPLED/image/jpeg/1057c87ce3433b9f4d3eb4e8816bb4af/gr1.jpg gr1 gr1.jpg jpg 66679 493 678 IMAGE-DOWNSAMPLED 1-s2.0-S1381116908004196-gr1.sml https://s3.amazonaws.com/prod-ucs-content-store-us-east/content/pii:S1381116908004196/gr1/THUMBNAIL/image/gif/9cf32aee06fbe2410041ee2be0760bb4/gr1.sml https://s3-eu-west-1.amazonaws.com/prod-ucs-content-store-eu-west/content/pii:S1381116908004196/gr1/THUMBNAIL/image/gif/9cf32aee06fbe2410041ee2be0760bb4/gr1.sml gr1 gr1.sml sml 1846 91 125 IMAGE-THUMBNAIL 1-s2.0-S1381116908004196-gr2.jpg https://s3.amazonaws.com/prod-ucs-content-store-us-east/content/pii:S1381116908004196/gr2/DOWNSAMPLED/image/jpeg/30024998c88c62685451077b6ee3bf16/gr2.jpg https://s3-eu-west-1.amazonaws.com/prod-ucs-content-store-eu-west/content/pii:S1381116908004196/gr2/DOWNSAMPLED/image/jpeg/30024998c88c62685451077b6ee3bf16/gr2.jpg gr2 gr2.jpg jpg 28497 236 378 IMAGE-DOWNSAMPLED 1-s2.0-S1381116908004196-gr2.sml https://s3.amazonaws.com/prod-ucs-content-store-us-east/content/pii:S1381116908004196/gr2/THUMBNAIL/image/gif/8337b8ea4737303ff3ccfc2c95f3168e/gr2.sml https://s3-eu-west-1.amazonaws.com/prod-ucs-content-store-eu-west/content/pii:S1381116908004196/gr2/THUMBNAIL/image/gif/8337b8ea4737303ff3ccfc2c95f3168e/gr2.sml gr2 gr2.sml sml 2537 78 125 IMAGE-THUMBNAIL 1-s2.0-S1381116908004196-gr3.jpg https://s3.amazonaws.com/prod-ucs-content-store-us-east/content/pii:S1381116908004196/gr3/DOWNSAMPLED/image/jpeg/29f688c4c8a005cd21e7f6ab31af800c/gr3.jpg https://s3-eu-west-1.amazonaws.com/prod-ucs-content-store-eu-west/content/pii:S1381116908004196/gr3/DOWNSAMPLED/image/jpeg/29f688c4c8a005cd21e7f6ab31af800c/gr3.jpg gr3 gr3.jpg jpg 32473 316 523 IMAGE-DOWNSAMPLED 1-s2.0-S1381116908004196-gr3.sml https://s3.amazonaws.com/prod-ucs-content-store-us-east/content/pii:S1381116908004196/gr3/THUMBNAIL/image/gif/830f25b0cdf3685317f0c36dae43bb7e/gr3.sml https://s3-eu-west-1.amazonaws.com/prod-ucs-content-store-eu-west/content/pii:S1381116908004196/gr3/THUMBNAIL/image/gif/830f25b0cdf3685317f0c36dae43bb7e/gr3.sml gr3 gr3.sml sml 1924 76 125 IMAGE-THUMBNAIL 1-s2.0-S1381116908004196-gr4.jpg https://s3.amazonaws.com/prod-ucs-content-store-us-east/content/pii:S1381116908004196/gr4/DOWNSAMPLED/image/jpeg/57652a1bc6e67958ca3a744eab75ab6d/gr4.jpg https://s3-eu-west-1.amazonaws.com/prod-ucs-content-store-eu-west/content/pii:S1381116908004196/gr4/DOWNSAMPLED/image/jpeg/57652a1bc6e67958ca3a744eab75ab6d/gr4.jpg gr4 gr4.jpg jpg 33197 309 524 IMAGE-DOWNSAMPLED 1-s2.0-S1381116908004196-gr4.sml https://s3.amazonaws.com/prod-ucs-content-store-us-east/content/pii:S1381116908004196/gr4/THUMBNAIL/image/gif/3dc1ed99c52084a1b7780d2cc41e48a0/gr4.sml https://s3-eu-west-1.amazonaws.com/prod-ucs-content-store-eu-west/content/pii:S1381116908004196/gr4/THUMBNAIL/image/gif/3dc1ed99c52084a1b7780d2cc41e48a0/gr4.sml gr4 gr4.sml sml 1857 74 125 IMAGE-THUMBNAIL 1-s2.0-S1381116908004196-gr5.jpg https://s3.amazonaws.com/prod-ucs-content-store-us-east/content/pii:S1381116908004196/gr5/DOWNSAMPLED/image/jpeg/c1c786840330f73cc3dcbf4a36027ad1/gr5.jpg https://s3-eu-west-1.amazonaws.com/prod-ucs-content-store-eu-west/content/pii:S1381116908004196/gr5/DOWNSAMPLED/image/jpeg/c1c786840330f73cc3dcbf4a36027ad1/gr5.jpg gr5 gr5.jpg jpg 31204 229 385 IMAGE-DOWNSAMPLED 1-s2.0-S1381116908004196-gr5.sml https://s3.amazonaws.com/prod-ucs-content-store-us-east/content/pii:S1381116908004196/gr5/THUMBNAIL/image/gif/35284cb558c008c6f6ee522cb81cab63/gr5.sml https://s3-eu-west-1.amazonaws.com/prod-ucs-content-store-eu-west/content/pii:S1381116908004196/gr5/THUMBNAIL/image/gif/35284cb558c008c6f6ee522cb81cab63/gr5.sml gr5 gr5.sml sml 2027 74 125 IMAGE-THUMBNAIL 1-s2.0-S1381116908004196-gr6.jpg https://s3.amazonaws.com/prod-ucs-content-store-us-east/content/pii:S1381116908004196/gr6/DOWNSAMPLED/image/jpeg/70d88807f0d8ab436fa80f5ff933794d/gr6.jpg https://s3-eu-west-1.amazonaws.com/prod-ucs-content-store-eu-west/content/pii:S1381116908004196/gr6/DOWNSAMPLED/image/jpeg/70d88807f0d8ab436fa80f5ff933794d/gr6.jpg gr6 gr6.jpg jpg 35418 304 523 IMAGE-DOWNSAMPLED 1-s2.0-S1381116908004196-gr6.sml https://s3.amazonaws.com/prod-ucs-content-store-us-east/content/pii:S1381116908004196/gr6/THUMBNAIL/image/gif/dbde0b89a6f0cf21f31304e611481da3/gr6.sml https://s3-eu-west-1.amazonaws.com/prod-ucs-content-store-eu-west/content/pii:S1381116908004196/gr6/THUMBNAIL/image/gif/dbde0b89a6f0cf21f31304e611481da3/gr6.sml gr6 gr6.sml sml 1985 73 125 IMAGE-THUMBNAIL 1-s2.0-S1381116908004196-gr7.jpg https://s3.amazonaws.com/prod-ucs-content-store-us-east/content/pii:S1381116908004196/gr7/DOWNSAMPLED/image/jpeg/8143ca227e1d6566ebb58f925fa3b6fd/gr7.jpg https://s3-eu-west-1.amazonaws.com/prod-ucs-content-store-eu-west/content/pii:S1381116908004196/gr7/DOWNSAMPLED/image/jpeg/8143ca227e1d6566ebb58f925fa3b6fd/gr7.jpg gr7 gr7.jpg jpg 37033 302 521 IMAGE-DOWNSAMPLED 1-s2.0-S1381116908004196-gr7.sml https://s3.amazonaws.com/prod-ucs-content-store-us-east/content/pii:S1381116908004196/gr7/THUMBNAIL/image/gif/493976ff5443241fe451ac59f2f59739/gr7.sml https://s3-eu-west-1.amazonaws.com/prod-ucs-content-store-eu-west/content/pii:S1381116908004196/gr7/THUMBNAIL/image/gif/493976ff5443241fe451ac59f2f59739/gr7.sml gr7 gr7.sml sml 1948 72 125 IMAGE-THUMBNAIL 1-s2.0-S1381116908004196-fx1.jpg https://s3.amazonaws.com/prod-ucs-content-store-us-east/content/pii:S1381116908004196/fx1/DOWNSAMPLED/image/jpeg/c4268609dc8b0b045f8afc9dc0e42159/fx1.jpg https://s3-eu-west-1.amazonaws.com/prod-ucs-content-store-eu-west/content/pii:S1381116908004196/fx1/DOWNSAMPLED/image/jpeg/c4268609dc8b0b045f8afc9dc0e42159/fx1.jpg fx1 true fx1.jpg jpg 31163 179 278 IMAGE-DOWNSAMPLED 1-s2.0-S1381116908004196-fx1.sml https://s3.amazonaws.com/prod-ucs-content-store-us-east/content/pii:S1381116908004196/fx1/THUMBNAIL/image/gif/41ee202fcb857ade7f8f8de78623ab06/fx1.sml https://s3-eu-west-1.amazonaws.com/prod-ucs-content-store-eu-west/content/pii:S1381116908004196/fx1/THUMBNAIL/image/gif/41ee202fcb857ade7f8f8de78623ab06/fx1.sml fx1 true fx1.sml sml 5530 141 219 IMAGE-THUMBNAIL MOLCAA 7278 S1381-1169(08)00419-6 10.1016/j.molcata.2008.09.026 Elsevier B.V. Fig. 1 Schematic of the 0.3lParr kinetic test rig. Fig. 2 Effect of ligand/Cr molar ratio on ethene uptake rate. Fig. 3 Measured product distribution at ligand/Cr=0.5mol/mol. Reaction conditions: solvent toluene; temperature=50°C; pressure=30bar; MAO/Cr=150mol/mol; ligand/Cr=0.5mol/mol; reaction time=120min. The solid line indicates a Schulz–Flory (SF) weight-distribution (for comparison) with a chain propagation probability of p =0.63±0.01. Error limits were estimated on the basis of the precision of the analytical data and the quality of the fit to the SF-formalism. Fig. 4 Distribution of odd-numbered α-olefins at ligand/Cr=0.5mol/mol. Reaction conditions as Fig. 3. The solid line indicates a Schulz–Flory (SF) weight-distribution (for comparison), shifted against the corresponding even-numbered distribution by about one C-unit. The chain propagation probability was determined as p =0.63±0.015. Fig. 5 Formation of odd-numbered 1-olefins at sub-stoichiometric ligand/Cr molar ratios. Reaction conditions: solvent toluene; temperature=50°C; pressure=30bar; MAO/Cr=150mol/mol; ligand/Cr=0.25, 0.5 and 0.75mol/mol; ligand/Cr=0.5mol/mol; reaction time=120min. Fig. 6 As Fig. 3 but Ligand/Cr=0.25mol/mol. Reaction conditions as Fig. 3 but ligand/Cr=0.25mol/mol and chain propagation probability p =0.56±0.01. Fig. 7 Distribution of odd-numbered α-olefins at ligand/Cr=0.25mol/mol. Reaction conditions as Fig. 3 but ligand/Cr=0.25mol/mol and chain propagation probability p =0.56±0.02. The solid line indicates a Schulz–Flory (SF) weight-distribution (for comparison), shifted against the corresponding even-numbered distribution (Fig. 6) by about one C-unit. Scheme 1 Ethene oligomerization via a chain mechanism. Scheme 2 Ethene oligomerization via a ring mechanism. Scheme 3 Ethene trimerization to 1-hexene. Scheme 4 Ethene tetramerization to 1-octene. Scheme 5 Simplified principle for the formation of odd-numbered LAOs. Table 1 Effects of ligand/Cr molar ratios on catalytic activity and product selectivity. Ligand/Cr (mol/mol) Activity (kg/(gcath)) Product selectivity (wt.%) Polymer (g) 1-C4= 1-C6= 1-C8= 1-C10= 1-C12= 1-C14= 1-C16= 1-C18= Odd-numbered LAOs 0.25 a 1.4 10.0 17.9 29.6 8.7 5.9 3.4 1.7 0.8 6.9 0.61 0.5 a 3.1 8.3 17.1 24.2 9.5 7.7 5.9 4.5 3.5 5.7 0.52 0.75 a 1.4 1.7 18.7 61.7 1.1 0.5 0.4 0.3 0.2 1.6 0.45 1.0 1.9 0.6 25.2 62.5 0.7 0.3 0.3 0.1 0.2 0.7 0.09 2.0 1.3 0.7 21.2 61.6 0.7 0.4 0.3 0.1 0.5 0.0 0.05 Reaction conditions: solvent toluene; temperature=50°C; pressure=30bar; MAO/Cr=150mol/mol; reaction time=60min. a Reaction time=120min. Editor Choice Paper Reaction kinetics of the ethene tetramerization catalyst system CrCl3(THF)3, Ph2PN( i Pr)PPh2 and MAO: The unexpected and unusual formation of odd-numbered 1-olefins Anina Wöhl a Wolfgang Müller a Normen Peulecke b Bernd H. Müller b Stephan Peitz b Detlef Heller b Uwe Rosenthal b ⁎ a Linde AG, Linde Engineering Division, Dr.-Carl-von-Linde-Str. 6-14, 82049 Pullach, Germany b Leibniz-Institut für Katalyse an der Universität Rostock e.V., Albert-Einstein-Str. 29 A, 18059 Rostock, Germany ⁎ Corresponding author. Tel.: +49 381 1281 176; fax: +49 381 1281 51176. This paper describes a kinetic investigation of the ethene tetramerization catalyst system comprising CrCl3(THF)3, a bis(diphenylphosphino)isopropylamine Ph2PN( i Pr)PPh2 as ligand and MAO as catalyst activator. The main focus of the experimental study lied on the influence of the ligand to chromium molar ratio on the catalyst performance and the selectivity towards 1-octene. It was found that a sub-stoichiometric ligand/Cr ratio leads to a Schulz–Flory product distribution, while unusual odd-numbered 1-olefins as by-products were formed. Graphical abstract For the ethene tetramerization catalyst system of CrCl3(THF)3, Ph2PN( i Pr)PPh2 and MAO the ligand/Cr ratio influences remarkably the product distribution. With sub-stoichiometric ligand/Cr ratios the selective process towards 1-hexene and 1-octene changes into a Schulz–Flory-like distribution and odd numbered 1-olefins are formed. This has consequences for the understanding of the catalytic system. Most likely, with the ratio of 0.5 binuclear complexes “(PNP)Cr2” (0.5:1) or higher aggregates with bridging PNP ligands are formed, showing a completely different behavior regarding kinetics and selectivity. The selectivity towards 1-hexene and 1-octene can only be reached by adjustment of a stoichiometric ratio of ligand to chromium, either by a monometallic center like “(PNP)Cr” (1:1) or a bimetallic center like “(PNP)2Cr2” (1:1). Keywords Ethene tetramerization 1-Octene Aluminoxane Chromium Diphosphinoamine Selective oligomerization Product distribution Reaction kinetics 1 Introduction Linear alpha olefins (LAOs) are useful and versatile intermediates for many industrially important substances like co-monomers for HDPE or LLDPE, alcohols, aldehydes, carboxylic acids or sulfonates. Conventional full range producers of LAOs, which obtain a wide product distribution, have to meet a formidable challenge to match the market demand. The reason is that each market segment served exhibits a very different behavior in terms of market size and growth, geography, fragmentation etc. The conventional technologies, like the Shell Higher Olefin Process (SHOP) or the state-of-the-art α-Sablin process, are based on an ethene insertion/β-elimination mechanism via chain growth (Scheme 1 ) resulting in a Schulz–Flory product distribution [1]. Thus, the on-purpose production of the most economically viable LAOs, i.e. comonomer-grade 1-hexene and more recently 1-octene, appears highly desirable [2]. For selective ethene oligomerization routes, a ring mechanism is generally accepted, instead of the chain-growth pathway. In this ring mechanism, two ethene units coordinate at the catalytically active site and form a metallacyclopentane via oxidative coupling. Insertions of further ethene units result in larger metallacycles. Through β-elimination/reductive elimination the desired LAOs are released (Scheme 2 ) [3]. For the high selectivity to 1-hexene during ethene trimerization, the difference in the relative stability of the formed five- and seven-membered rings with respect to elimination is the determining factor of this mechanistic suggestion (Scheme 3 ) [2]. A mechanism for tetramerization of ethene to yield 1-octene, based on metallacycles as intermediates, requires discrimination between seven- and nine-membered rings. Some studies conclude that the generally accepted metallacyclic mechanism for the selective oligomerization cannot explain the selectivity to 1-octene (Scheme 4 ) [4,5]. If the tetramerization is not explainable by the presented monometallic mechanism, alternatively a bimetallic mechanisms based on two chromium centers appears conceivable [6]. Nevertheless, in 2004 a catalyst system for selective ethene tetramerization was reported, using a modified bis(diarylphosphino)amine (PNP) chromium catalyst which gives up to 68wt.% 1-octene along with 1-hexene as the main by-product [2k]. On the basis of these systems, ligand effects were investigated in detail. In general, more sterically hindered ligands favor trimerization over tetramerization. Methoxy substituents in ortho position of the aryl groups also have a strong effect of supporting trimerization. Nitrogen substituents exhibit a subtle influence which could not yet be fully rationalized [2]. Several publications [7] deal with kinetic investigations of these selective tri- and tetramerization catalysts, making an important contribution to the understanding of the catalytic mechanism with the goal to optimize reactor design and process parameters, particularly with regard of an enhancement of activity and selectivity. Walsh et al. [7b] investigated the reaction kinetics of the ethene tetramerization catalyst consisting of the pre-catalyst Cr(acac)3, Ph2PN( i Pr)PPh2 as ligand and MAO as activator. It was found that the initial reaction rate follows a typical Arrhenius behavior with an apparent activation energy of 64.6kJ/(molK) in the temperature range between 35 and 45°C. However, the deactivation rate is strongly influenced by temperature. A reaction rate model was developed to provide a good description of reaction performance and selectivity data, accounting for the effects of pressure, temperature and time on stream. Increased temperature and decreased pressure result in increased 1-hexene and decreased 1-octene selectivity, while time on stream-data indicate the occurrence of secondary incorporation reactions of 1-hexene and 1-octene. The typical ethene tetramerization reaction yields a complex mixture of olefins, such as predominantly 1-hexene and 1-octene and smaller quantities of C10 along with heavier alpha olefins. Additionally, small amounts of C6 cyclics such as methylene cyclopentane and methyl cyclopentane are formed as well as branched C10, C12 and C14 olefins which are produced by secondary co-oligomerization of 1-C6 and 1-C8. Odd numbered LAOs were not described as by-products. Some discrepancies regarding the influence of ethene concentration are noteworthy. For instance Manyik et al. [3b] and Yang et al. [7a] reported a second-order dependence on ethene concentration for two different chromium-based ethene trimerization catalyst systems. These results lead to the conclusion that the rate-determining step is the formation of a metallacyclopentane intermediate via two coordinated ethene molecules. Contrary to these results, modeling studies carried out by van Rensburg et al. [5c] for a chromium-pyrrolyl catalyst support a first-order dependence with respect to ethene concentration. Blok et al. [5d] as well as Tobisch and Ziegler [5b] investigated theoretically the titanium-catalyzed trimerization mechanism and also identified the metallacycle growth as rate-determining step, consequently leading to a first-order dependency. Kuhlmann [7d] found in his studies on the Cr/PNP-system a first-order ethene dependency for the trimerization reaction and a second-order dependency for the tetramerization. This results in a overall reaction order of 1.71, which is in good agreement with the observed non-integer reaction order of 1.57 by Walsh et al. [7b], suggesting a competition of two different pathways for tri- and tetramerization. To the best of our knowledge, in these and other publications in this field the effect of ligand/Cr molar ratios on catalytic performance was investigated only in one paper from Jiang et al. [7c]. It was described that the ligand/Cr molar ratio has significant effects on catalytic activity and selectivity in chromium-catalyzed ethene tetramerization to 1-octene. It was shown that an increase of the ligand/Cr molar ratio from 1 to 4 resulted in a decrease in catalytic activity. The highest selectivity towards 1-octene was achieved with a ligand/Cr molar ratio of 2. The authors explained this tentatively by the formation of active Cr species via the interaction with other catalytic components ‘of proper ratios’. Lower ligand/Cr molar ratios than 1 were not investigated. We here report the results of a kinetic study carried out on the bis(diphenylphosphino)isopropylamine Ph2PN( i Pr)PPh2/CrCl3(THF)3/MAO ethene tetramerization catalyst system. More specifically, the ligand to Cr-molar ratio was investigated in detail. It was found that this ratio has a remarkable influence on the product distribution. 2 Experimental 2.1 Materials All chemicals were handled either in a glove box or under inert argon atmosphere by using standard Schlenk techniques. CrCl3(THF)3 (97% purity) was obtained from Sigma–Aldrich and used without further purification. MAO solution (10 wt.% in toluene) was delivered by Sigma–Aldrich. The bis(diphenylphosphino)isopropylamine ligand was synthesized according to a published procedure [2k]. Toluene (>99.9% purity) was obtained by Merck Chemicals and was dried over sodium with benzophenone and was then distilled in inert gas atmosphere (N2). Argon 5.0 and ethene 3.0 were purchased from Linde Gas and used as received. 2.2 Reactor equipment and ethene oligomerization procedure The syntheses were performed in a 0.3 lParr autoclave equipped with a hollow shaft gas-entrainment stirrer. The ethene supply was maintained by an aluminum pressurized gas cylinder on a balance to monitor the ethene consumption over time by means of a computerized data acquisition system. The autoclave's temperature was measured by a thermocouple inside the reactor's liquid phase and controlled by an electrical heating jacket and a water cooling-coil, submerged in the liquid phase. The autoclave could be depressurized and evacuated by means of a rotary vane vacuum pump (10−1 mbar). For inertization, a low pressure argon supply (1.5 bar absolute) was used. A complete P&ID-schematic of the experimental test rig is given in Fig. 1 . Before conducting an experiment, the reactor was heated to 100°C at reduced pressure for several hours to eliminate traces of water, oxygen and oxygenated impurities. The reactor was then allowed to cool down to ambient temperature and the prepared catalyst solution was transferred to the evacuated reactor by means of the pressure differential to the argon inert atmosphere. The speed of the gas entrainment stirrer was set to 1000rpm to exclude gas-to-liquid mass transfer limitations. This was verified earlier by separate measurements of the volumetric mass transfer coefficients (ethene into toluene) as a function of agitation speed. In the next step, the reactor was pressurized with ethene to 30bar (absolute pressure). All reactions were performed at a constant reaction temperature of 50°C. After the reaction, the reaction solution was discharged by transferring the liquid by means of the headspace pressure via the reactor's dip tube into a round-bottom flask with HCl-acidified water for catalyst quenching. The volume of the gaseous product phase was measured by a gas meter and collected completely in a gasbag. The mass balance of the experiment was determined via quantification and GC–FID analysis of the gaseous and liquid products separately, followed by comparison to the ethene uptake data. 2.3 Catalyst preparation All reactions were performed using 1mmol/l Cr concentration and a MAO/Cr ratio of 150. In this investigation the ligand/Cr molar ratios were varied in the range from 0.25 to 2.0. For the catalyst preparation, a suitable amount of the PNP ligand Ph2PN( i Pr)PPh2, and CrCl3(THF)3 was weighed in and charged to a Schlenk tube under inert atmosphere. A volume of 100ml dried toluene was added and the solution was stirred by means of a magnetic stirrer. After dissolving Cr-compound and ligand, the required amount of MAO was added. The solution was immediately transferred to the reactor and the reaction was started by opening the ethene supply. 3 Results and discussion 3.1 Influence of the ligand/chromium ratio on reaction kinetics In separate gas-to-liquid mass transfer experiments, the mass transfer coefficient of ethene to toluene was determined to be kla≥1100h−1 at 50°C in the current experimental configuration, rendering the mass transport at least a factor of 100 faster than the characteristic time scale of the reaction. This was further supported by a kinetic model-based evaluation of the ethene uptake curves in the absence of the reaction system, taking into account the temperature- and pressure-dependent equilibrium solubility of ethene in toluene. Clearly, the composition of the liquid phase changes with residence time as products are being formed. However, even if the phase transfer slowed down over time due to changing composition of the reaction mass, so does the tri-/tetramerization reaction itself, due to the observed catalyst deactivation. Therefore, the phase transfer is not expected to become competitive with the intrinsic kinetics of the chemical reaction. Based on these considerations, the kinetic behavior of the chromium-catalyzed tetramerization reaction is reflected by the time characteristics of the ethene uptake curve. This ethene uptake curve (Fig. 2 ), is not influenced by the ligand/Cr molar ratios above 1.0. In general, the time characteristics and the curvature of the obtained ethene uptake curves are qualitatively similar to the ones published by Walsh et al. [7b] at a ligand/Cr molar ratio of 1.35 and a temperature of 50°C. Although other parameters, such as pressure, solvent, catalyst concentration or MAO/Cr ratio and a different catalyst preparation procedure (charging of the catalyst under ethene pressure) were applied, the measured curves show the typical induction period and the catalyst deactivation over time as described in [7b]. As shown in Table 1 , the activity decreases significantly by doubling the ligand/Cr molar ratio from 1.0 to 2.0. Variations of activity values from published results [7b,c] can probably be traced back to the fact that different reaction conditions were chosen. Using a sub-stoichiometric ligand/Cr molar ratio of 0.5, meaning that two chromium units form the active catalyst with one ligand, results in a dramatic change in the kinetic behavior (Fig. 2). After a long induction period of 40min the reaction starts and then accelerates to a small extent, as indicated by the mild upward curvature. 3.2 Influence of the ligand/chromium ratio on product distribution Contrary to the results of Jiang et al. [7c], we found that the selectivity towards 1-octene is not strongly affected by high ligand/Cr ratios and we see only a slight decrease while increasing the ligand/Cr ratio from 1.0 to 2.0. The selectivity towards 1-hexene also decreases in this regime. At a ligand/Cr ratio of 2.0, a higher amount of undesirable side-products, like branched decenes, are formed. However, in general the selectivity towards 1-hexene and 1-octene is considerable (Table 1). Using the sub-stoichiometric ligand/Cr molar ratio, the high selectivity towards the main products vanishes gradually and the mechanism changes from the metallacycle to a typical insertion/β-elimination. This results in a superposition of a Schulz–Flory distribution and a residual selective reaction, the latter leading particularly to a higher 1-octene peak than expected on the basis of a Schulz–Flory distribution only. While at a ligand to chromium ratio of 0.75mol/mol the creation of higher alkenes is unincisive, a further reduction of the ligand/Cr ratio decreases the selectivity towards 1-hexene and 1-octene. The amount of formed polymer also increases with decreasing ligand/Cr ratio. Surprisingly, at sub-stoichiometric ligand/Cr-ratios, also odd-numbered olefins are formed as by-products (Fig. 3 ), an observation that, to the best of our knowledge, was not reported anywhere before. As illustrated by Fig. 3, at ligand/Cr=0.5mol/mol, the obtained product distribution of even-numbered (regarding the carbon-chain length) α-olefins widely follows a Schulz–Flory weight distribution, f w ( x ) = x ( 1 − p ) 2 p ( x − 1 ) with a chain propagation probability of p =0.63±0.01 and x =number of monomer units (ethene) incorporated into the carbon chain. Only the 1-butene and the 1-octene yield does not follow this statistical distribution, the latter clearly owing to an underlying, ‘residual’, selective tetramerization mechanism. Also the 1-butene concentration is significantly lower than expected on the basis of the statistical product distribution and it can be speculated in how far this can be interpreted in terms of 1-octene formation via dimerization of two C4-units. Like the expected even-numbered 1-olefins, the odd-numbered 1-olefins follow a distribution which is slightly shifted by about one C-unit in the carbon chain with respect to the distribution of the corresponding even-numbered 1-olefins (Fig. 4 ). Remarkably, the chain propagation probability for this odd-numbered distribution was determined to be p =0.63±0.015 as well. This suggests that the odd-numbered distribution is closely linked to the even-numbered product distribution, in fact, that it is even directly derived from the latter. The total percentage of odd-numbered 1-olefins is a function of the ligand/Cr ratio and increases significantly with decreasing ratio (Fig. 5 ). This leads to the question, how the product distribution behavior changes at even lower ligand/Cr ratios than 0.5, e.g. at the lowest ratio investigated in this study, namely ligand/Cr=0.25mol/mol. As shown in Fig. 6 for the even-numbered products and Fig. 7 for the odd-numbered ones, respectively, one observes a totally equivalent behavior compared to the situation at ligand/Cr=0.5mol/mol: again, the even-numbered products can be described by a Schulz–Flory distribution if an underlying ‘residual’ selective tetramerization reaction channel is assumed to account for the high 1-octene figure. Again, far less 1-butene is observed than expected on the basis of a Schulz–Flory distribution alone and the odd-numbered distribution can be fitted reasonably well with a Schulz–Flory, shifted by about one C-unit (Fig. 7). The important difference to the situation at ligand/Cr=0.5mol/mol is that both, even- and odd-numbered product distributions, indicate one single consistent figure for the chain propagation probability of p =0.56±0.02. The lower value of p as compared to ligand/Cr=0.5mol/mol characterizes the gradual shift to narrower product distributions as the ligand/Cr ratio is being lowered. These results strongly suggest, that the unexpected formation of odd-numbered linear α-olefins in Ph2PN(iPr)PPh2/CrCl3(THF)3/MAO systems at sub-stoichiometric ligand/Cr ratios (below about ligand/Cr=0.5mol/mol) proceeds via the initially formed ‘regular’ α-olefins with even-numbered carbon chain length. 4 Conclusion The most important result of the investigation presented here is the fact that the ligand/Cr ratio influences remarkably the product distribution. At a ligand/chromium ratio of 0.5 the selective process towards 1-hexene and 1-octene changes into a Schulz–Flory-like distribution with some residual selective reaction to 1-C8= and possibly 1-C6=. Moreover, odd numbered 1-olefins are formed at sub-stoichiometric ratios. This has two consequences for the understanding of the catalytic system. The first conclusion is that with sub-stoichiometric ligand/Cr ratios a completely different active catalyst species is formed from chromium and the chelating PNP–ligand than the well known SASOL catalyst with a stoichiometric ligand/Cr ratio “(PNP)Cr” (1:1). Most likely, with the ratio of 0.5 binuclear complexes “(PNP)Cr2” (0.5:1) or higher aggregates with bridging PNP ligands are formed, showing a completely different behavior regarding kinetics and selectivity. Secondly, it is likely that after the alkylation with MAO such binuclear complexes result in methyl compounds “(PNP)Cr2(Me) n ”. An elimination of methane favors the creation of chromium carbene “CrCH2” groups. These carbene groups could react with recently formed even-numbered LAOs like RCH2 CH2 CHCH2 in a metathesis reaction to ethene and to long-chain carbenes “CrCHCH2 CH2 R”, resulting in the observed odd numbered LAOs like, e.g., H2CCHCH2 R (Scheme 5 ). Clearly, a sharp discrimination between the different catalytic species is impossible and an equilibrium of differently acting centers always exists. Consequently, a smooth transition between the different ligand/Cr ratios and their respective behaviors is observed. For instance, the enhanced polymer formation, especially at very low ligand/Cr ratios, can be explained by an increasing number of “naked” Cr species (Ligand: Cr=0:1) in the equilibria. We also conclude that binuclear complexes with one bridging PNP ligand and two chromium atoms such as “(PNP)Cr2” (0.5:1) or higher aggregates are responsible for the Schulz–Flory product distribution and the formation of odd-numbered LAOs. The selectivity towards 1-hexene and 1-octene can only be reached by adjustment of a stoichiometric ratio of ligand to chromium, either by a monometallic center like “(PNP)Cr” (1:1) or a bimetallic center as “(PNP)2Cr2” (1:1). Acknowledgments We would like to express their gratitude to Linde Engineering for the financial support and for the permission to publish this work. Furthermore, we wish to thank Linde Engineering's R&D Chemistry Department for their valuable contributions as well as the chemical staff at LIKAT, in particular Petra Bartels for her assistance with the ligand synthesis. References [1] (a) E. Greiner, R. Gubler, Y. Inoguchi, Linear Alpha Olefins, CEH Marketing Research Report, Chemical Economics Handbook, SRI International, Menlo Park, SF, May 2004. (b) “Alpha Olefins”, M. Morgan, PERP Report 02/03-4, Nexant Chem Systems, January 2004. (c) P. Quinlan, World Petrochemical Conference, Houston, USA, March 2005. (d) E. Burridge ICIS Chemical Business 2008 (e) D. Steinborn Grundlagen der metallorganischen Komplexkatalyse 2007 B.G. Teubner Verlag Wiesbaden [2] (a) W.K. Reagan, Phillips Petroleum Company, EP, 0417477, 1991. (b) W.K. Reagan, J.W. Freeman, B.K. Conroy, T.M. Pettijohn, E.A. Benham, Phillips Petroleum Company, EP, 0608447, 1994. (c) R.D. Knudsen, J.W. Freeman, M.E. Lashier, Phillips Petroleum Company, US Patent 5,563,312 (1996). (d) J.W. Freeman, J.L. Buster, R.D. Knudsen, Phillips Petroleum Company, US Patent 5,856,257 (1999). (e) W.K. Reagan, J.W. Freeman, B.K. Conroy, T.M. Pettijohn, E.A. Benham, Phillips Petroleum Company, US Patent 5,451,645 (1995). (f) S.J. Dossett A. Gillon A.G. Orpen J.S. Fleming P.G. Pringle D.F. Wass M.D. Jones Chem. Commun. 2001 699 (g) N.A. Cooley S.M. Green D.F. Wass K. Heslop A.G. Orpen P.G. Pringle Organometallics 20 2001 4769 (h) A. Carter S.A. Cohen N.A. Cooley A. Murphy J. Scutt D.F. Wass Chem. Commun. 2002 858 (i) D.F. Wass, BP Chemicals Ltd, WO, 02/04119, 2002. (j) J.T. Dixon F.M. Hess M.J. Green D.H. Morgan J. Organomet. Chem. 689 2004 3641 (k) A. Bollmann K. Blann J.T. Dixon F.M. Hess E. Killian H. Maumela D.S. McGuinness D.H. Morgan A. Nevelling S. Otto M. Overett A.M.Z. Slawin P. Wasserscheid S. Kuhlmann J. Am. Chem. Soc. 126 2004 14712 (l) D.S. McGuinness P. Wasserscheid W. Keim J.T. Dixon J.J.C. Grove C. Hu U. Englert Chem. Commun. 2003 334 (m) D.S. McGuinness P. Wasserscheid W. Keim D.H. Morgan J.T. Dixon A. Bollmann H. Maumela F.M. Hess U. Englert J. Am. Chem. Soc. 125 2003 5272 (n) D.S. McGuinness P. Wasserscheid D.H. Morgan J.T. Dixon Organometallics 24 2005 552 (o) P.R. Elowe C. McCann P.G. Pringle S.K. Spitzmesser J.E. Bercaw Organometallics 25 2006 5255 (p) M.E. Bluhm O. Walter M. Döring J. Organomet. Chem. 690 2005 713 (q) C.N. Nenu B.M. Weckhuysen Chem. Commun. 2005 1865 (r) D.F. Wass Dalton Trans. 2007 816 and references cited therein [3] (a) R.M. Manyik, W.E. Walker, T.P. Wilson, Union Carbide Corporation, US Patent 3,300,458 (1967). (b) R.M. Manyik W.E. Walker T.P. Wilson J. Catal. 47 1977 197 (c) J.R. Briggs J. Chem. Soc. Chem. Commun. 1989 674 [4] (a) T. Agapie S.J. Schofer J.A. Labinger J.E. Bercaw J. Am. Chem. Soc. 126 2004 1304 (b) T. Agapie J.A. Labinger J.E. Bercaw J. Am. Chem. Soc. 129 2007 14281 [5] (a) Z.-X. Yu K.N. Houk Angew. Chem. Int. Ed. 42 2003 808 (b) S. Tobisch T. Ziegler Organometallics 22 2003 5392 (c) W.J. van Rensburg C. Grove J.P. Steynberg K.B. Stark J.J. Huyser P.J. Steynberg Organometallics 23 2004 1207 (d) A.N.J. Blok P.H.M. Budzelaar A.W. Gal Organometallics 22 2003 2564 [6] R.D. Köhn Angew. Chem. Int. Ed. 47 2008 245; and references cited therein [7] (a) Y. Yang H. Kim J. Lee H. Paik H.G. Jang Appl. Catal. A: Gen. 193 2000 29 (b) R. Walsh D.H. Morgan A. Bollmann J.T. Dixon Appl. Catal. A: Gen. 306 2006 184 (c) T. Jiang Y. Ning B. Zhang J. Li G. Wang J. Yi Q. Huang Appl. Catal. A: Gen. 259 2006 161 (d) S. Kuhlmann, Dissertation, Technische Fakultät der Friedrich-Alexander-Universität Erlangen-Nürnberg, 2006.",
      "scopus-id": "57149097250",
      "coredata": {
        "eid": "1-s2.0-S1381116908004196",
        "dc:description": "This paper describes a kinetic investigation of the ethene tetramerization catalyst system comprising CrCl3(THF)3, a bis(diphenylphosphino)isopropylamine Ph2PN( i Pr)PPh2 as ligand and MAO as catalyst activator. The main focus of the experimental study lied on the influence of the ligand to chromium molar ratio on the catalyst performance and the selectivity towards 1-octene. It was found that a sub-stoichiometric ligand/Cr ratio leads to a Schulz–Flory product distribution, while unusual odd-numbered 1-olefins as by-products were formed.",
        "openArchiveArticle": "false",
        "prism:coverDate": "2009-01-05",
        "openaccessUserLicense": null,
        "prism:aggregationType": "Journal",
        "prism:url": "https://api.elsevier.com/content/article/pii/S1381116908004196",
        "dc:creator": [
          {
            "@_fa": "true",
            "$": "Wöhl, Anina"
          },
          {
            "@_fa": "true",
            "$": "Müller, Wolfgang"
          },
          {
            "@_fa": "true",
            "$": "Peulecke, Normen"
          },
          {
            "@_fa": "true",
            "$": "Müller, Bernd H."
          },
          {
            "@_fa": "true",
            "$": "Peitz, Stephan"
          },
          {
            "@_fa": "true",
            "$": "Heller, Detlef"
          },
          {
            "@_fa": "true",
            "$": "Rosenthal, Uwe"
          }
        ],
        "link": [
          {
            "@_fa": "true",
            "@rel": "self",
            "@href": "https://api.elsevier.com/content/article/pii/S1381116908004196"
          },
          {
            "@_fa": "true",
            "@rel": "scidir",
            "@href": "https://www.sciencedirect.com/science/article/pii/S1381116908004196"
          }
        ],
        "dc:format": "application/json",
        "openaccessType": null,
        "pii": "S1381-1169(08)00419-6",
        "prism:volume": "297",
        "prism:publisher": "Elsevier B.V.",
        "dc:title": "Reaction kinetics of the ethene tetramerization catalyst system CrCl3(THF)3, Ph2PN( i Pr)PPh2 and MAO: The unexpected and unusual formation of odd-numbered 1-olefins",
        "prism:copyright": "Copyright © 2008 Elsevier B.V. All rights reserved.",
        "openaccess": "0",
        "prism:issn": "13811169",
        "prism:issueIdentifier": "1",
        "dcterms:subject": [
          {
            "@_fa": "true",
            "$": "Ethene tetramerization"
          },
          {
            "@_fa": "true",
            "$": "1-Octene"
          },
          {
            "@_fa": "true",
            "$": "Aluminoxane"
          },
          {
            "@_fa": "true",
            "$": "Chromium"
          },
          {
            "@_fa": "true",
            "$": "Diphosphinoamine"
          },
          {
            "@_fa": "true",
            "$": "Selective oligomerization"
          },
          {
            "@_fa": "true",
            "$": "Product distribution"
          },
          {
            "@_fa": "true",
            "$": "Reaction kinetics"
          }
        ],
        "openaccessArticle": "false",
        "prism:publicationName": "Journal of Molecular Catalysis A: Chemical",
        "prism:number": "1",
        "openaccessSponsorType": null,
        "prism:pageRange": "1-8",
        "prism:endingPage": "8",
        "pubType": "fla",
        "prism:coverDisplayDate": "5 January 2009",
        "prism:doi": "10.1016/j.molcata.2008.09.026",
        "prism:startingPage": "1",
        "dc:identifier": "doi:10.1016/j.molcata.2008.09.026",
        "openaccessSponsorName": null
      },
      "objects": {
        "object": [
          {
            "@category": "thumbnail",
            "@height": "20",
            "@width": "165",
            "@_fa": "true",
            "$": "https://api.elsevier.com/content/object/eid/1-s2.0-S1381116908004196-si1.gif?httpAccept=%2A%2F%2A",
            "@multimediatype": "GIF image file",
            "@type": "ALTIMG",
            "@size": "613",
            "@ref": "si1",
            "@mimetype": "image/gif"
          },
          {
            "@category": "standard",
            "@height": "232",
            "@width": "279",
            "@_fa": "true",
            "$": "https://api.elsevier.com/content/object/eid/1-s2.0-S1381116908004196-sc1.jpg?httpAccept=%2A%2F%2A",
            "@multimediatype": "JPEG image file",
            "@type": "IMAGE-DOWNSAMPLED",
            "@size": "8477",
            "@ref": "sc1",
            "@mimetype": "image/jpeg"
          },
          {
            "@category": "thumbnail",
            "@height": "93",
            "@width": "112",
            "@_fa": "true",
            "$": "https://api.elsevier.com/content/object/eid/1-s2.0-S1381116908004196-sc1.sml?httpAccept=%2A%2F%2A",
            "@multimediatype": "GIF image file",
            "@type": "IMAGE-THUMBNAIL",
            "@size": "1014",
            "@ref": "sc1",
            "@mimetype": "image/gif"
          },
          {
            "@category": "standard",
            "@height": "230",
            "@width": "267",
            "@_fa": "true",
            "$": "https://api.elsevier.com/content/object/eid/1-s2.0-S1381116908004196-sc2.jpg?httpAccept=%2A%2F%2A",
            "@multimediatype": "JPEG image file",
            "@type": "IMAGE-DOWNSAMPLED",
            "@size": "7689",
            "@ref": "sc2",
            "@mimetype": "image/jpeg"
          },
          {
            "@category": "thumbnail",
            "@height": "93",
            "@width": "108",
            "@_fa": "true",
            "$": "https://api.elsevier.com/content/object/eid/1-s2.0-S1381116908004196-sc2.sml?httpAccept=%2A%2F%2A",
            "@multimediatype": "GIF image file",
            "@type": "IMAGE-THUMBNAIL",
            "@size": "1001",
            "@ref": "sc2",
            "@mimetype": "image/gif"
          },
          {
            "@category": "standard",
            "@height": "230",
            "@width": "278",
            "@_fa": "true",
            "$": "https://api.elsevier.com/content/object/eid/1-s2.0-S1381116908004196-sc3.jpg?httpAccept=%2A%2F%2A",
            "@multimediatype": "JPEG image file",
            "@type": "IMAGE-DOWNSAMPLED",
            "@size": "8219",
            "@ref": "sc3",
            "@mimetype": "image/jpeg"
          },
          {
            "@category": "thumbnail",
            "@height": "93",
            "@width": "113",
            "@_fa": "true",
            "$": "https://api.elsevier.com/content/object/eid/1-s2.0-S1381116908004196-sc3.sml?httpAccept=%2A%2F%2A",
            "@multimediatype": "GIF image file",
            "@type": "IMAGE-THUMBNAIL",
            "@size": "1049",
            "@ref": "sc3",
            "@mimetype": "image/gif"
          },
          {
            "@category": "standard",
            "@height": "290",
            "@width": "348",
            "@_fa": "true",
            "$": "https://api.elsevier.com/content/object/eid/1-s2.0-S1381116908004196-sc4.jpg?httpAccept=%2A%2F%2A",
            "@multimediatype": "JPEG image file",
            "@type": "IMAGE-DOWNSAMPLED",
            "@size": "13085",
            "@ref": "sc4",
            "@mimetype": "image/jpeg"
          },
          {
            "@category": "thumbnail",
            "@height": "93",
            "@width": "112",
            "@_fa": "true",
            "$": "https://api.elsevier.com/content/object/eid/1-s2.0-S1381116908004196-sc4.sml?httpAccept=%2A%2F%2A",
            "@multimediatype": "GIF image file",
            "@type": "IMAGE-THUMBNAIL",
            "@size": "1119",
            "@ref": "sc4",
            "@mimetype": "image/gif"
          },
          {
            "@category": "standard",
            "@height": "214",
            "@width": "501",
            "@_fa": "true",
            "$": "https://api.elsevier.com/content/object/eid/1-s2.0-S1381116908004196-sc5.jpg?httpAccept=%2A%2F%2A",
            "@multimediatype": "JPEG image file",
            "@type": "IMAGE-DOWNSAMPLED",
            "@size": "15513",
            "@ref": "sc5",
            "@mimetype": "image/jpeg"
          },
          {
            "@category": "thumbnail",
            "@height": "53",
            "@width": "125",
            "@_fa": "true",
            "$": "https://api.elsevier.com/content/object/eid/1-s2.0-S1381116908004196-sc5.sml?httpAccept=%2A%2F%2A",
            "@multimediatype": "GIF image file",
            "@type": "IMAGE-THUMBNAIL",
            "@size": "797",
            "@ref": "sc5",
            "@mimetype": "image/gif"
          },
          {
            "@category": "standard",
            "@height": "493",
            "@width": "678",
            "@_fa": "true",
            "$": "https://api.elsevier.com/content/object/eid/1-s2.0-S1381116908004196-gr1.jpg?httpAccept=%2A%2F%2A",
            "@multimediatype": "JPEG image file",
            "@type": "IMAGE-DOWNSAMPLED",
            "@size": "66679",
            "@ref": "gr1",
            "@mimetype": "image/jpeg"
          },
          {
            "@category": "thumbnail",
            "@height": "91",
            "@width": "125",
            "@_fa": "true",
            "$": "https://api.elsevier.com/content/object/eid/1-s2.0-S1381116908004196-gr1.sml?httpAccept=%2A%2F%2A",
            "@multimediatype": "GIF image file",
            "@type": "IMAGE-THUMBNAIL",
            "@size": "1846",
            "@ref": "gr1",
            "@mimetype": "image/gif"
          },
          {
            "@category": "standard",
            "@height": "236",
            "@width": "378",
            "@_fa": "true",
            "$": "https://api.elsevier.com/content/object/eid/1-s2.0-S1381116908004196-gr2.jpg?httpAccept=%2A%2F%2A",
            "@multimediatype": "JPEG image file",
            "@type": "IMAGE-DOWNSAMPLED",
            "@size": "28497",
            "@ref": "gr2",
            "@mimetype": "image/jpeg"
          },
          {
            "@category": "thumbnail",
            "@height": "78",
            "@width": "125",
            "@_fa": "true",
            "$": "https://api.elsevier.com/content/object/eid/1-s2.0-S1381116908004196-gr2.sml?httpAccept=%2A%2F%2A",
            "@multimediatype": "GIF image file",
            "@type": "IMAGE-THUMBNAIL",
            "@size": "2537",
            "@ref": "gr2",
            "@mimetype": "image/gif"
          },
          {
            "@category": "standard",
            "@height": "316",
            "@width": "523",
            "@_fa": "true",
            "$": "https://api.elsevier.com/content/object/eid/1-s2.0-S1381116908004196-gr3.jpg?httpAccept=%2A%2F%2A",
            "@multimediatype": "JPEG image file",
            "@type": "IMAGE-DOWNSAMPLED",
            "@size": "32473",
            "@ref": "gr3",
            "@mimetype": "image/jpeg"
          },
          {
            "@category": "thumbnail",
            "@height": "76",
            "@width": "125",
            "@_fa": "true",
            "$": "https://api.elsevier.com/content/object/eid/1-s2.0-S1381116908004196-gr3.sml?httpAccept=%2A%2F%2A",
            "@multimediatype": "GIF image file",
            "@type": "IMAGE-THUMBNAIL",
            "@size": "1924",
            "@ref": "gr3",
            "@mimetype": "image/gif"
          },
          {
            "@category": "standard",
            "@height": "309",
            "@width": "524",
            "@_fa": "true",
            "$": "https://api.elsevier.com/content/object/eid/1-s2.0-S1381116908004196-gr4.jpg?httpAccept=%2A%2F%2A",
            "@multimediatype": "JPEG image file",
            "@type": "IMAGE-DOWNSAMPLED",
            "@size": "33197",
            "@ref": "gr4",
            "@mimetype": "image/jpeg"
          },
          {
            "@category": "thumbnail",
            "@height": "74",
            "@width": "125",
            "@_fa": "true",
            "$": "https://api.elsevier.com/content/object/eid/1-s2.0-S1381116908004196-gr4.sml?httpAccept=%2A%2F%2A",
            "@multimediatype": "GIF image file",
            "@type": "IMAGE-THUMBNAIL",
            "@size": "1857",
            "@ref": "gr4",
            "@mimetype": "image/gif"
          },
          {
            "@category": "standard",
            "@height": "229",
            "@width": "385",
            "@_fa": "true",
            "$": "https://api.elsevier.com/content/object/eid/1-s2.0-S1381116908004196-gr5.jpg?httpAccept=%2A%2F%2A",
            "@multimediatype": "JPEG image file",
            "@type": "IMAGE-DOWNSAMPLED",
            "@size": "31204",
            "@ref": "gr5",
            "@mimetype": "image/jpeg"
          },
          {
            "@category": "thumbnail",
            "@height": "74",
            "@width": "125",
            "@_fa": "true",
            "$": "https://api.elsevier.com/content/object/eid/1-s2.0-S1381116908004196-gr5.sml?httpAccept=%2A%2F%2A",
            "@multimediatype": "GIF image file",
            "@type": "IMAGE-THUMBNAIL",
            "@size": "2027",
            "@ref": "gr5",
            "@mimetype": "image/gif"
          },
          {
            "@category": "standard",
            "@height": "304",
            "@width": "523",
            "@_fa": "true",
            "$": "https://api.elsevier.com/content/object/eid/1-s2.0-S1381116908004196-gr6.jpg?httpAccept=%2A%2F%2A",
            "@multimediatype": "JPEG image file",
            "@type": "IMAGE-DOWNSAMPLED",
            "@size": "35418",
            "@ref": "gr6",
            "@mimetype": "image/jpeg"
          },
          {
            "@category": "thumbnail",
            "@height": "73",
            "@width": "125",
            "@_fa": "true",
            "$": "https://api.elsevier.com/content/object/eid/1-s2.0-S1381116908004196-gr6.sml?httpAccept=%2A%2F%2A",
            "@multimediatype": "GIF image file",
            "@type": "IMAGE-THUMBNAIL",
            "@size": "1985",
            "@ref": "gr6",
            "@mimetype": "image/gif"
          },
          {
            "@category": "standard",
            "@height": "302",
            "@width": "521",
            "@_fa": "true",
            "$": "https://api.elsevier.com/content/object/eid/1-s2.0-S1381116908004196-gr7.jpg?httpAccept=%2A%2F%2A",
            "@multimediatype": "JPEG image file",
            "@type": "IMAGE-DOWNSAMPLED",
            "@size": "37033",
            "@ref": "gr7",
            "@mimetype": "image/jpeg"
          },
          {
            "@category": "thumbnail",
            "@height": "72",
            "@width": "125",
            "@_fa": "true",
            "$": "https://api.elsevier.com/content/object/eid/1-s2.0-S1381116908004196-gr7.sml?httpAccept=%2A%2F%2A",
            "@multimediatype": "GIF image file",
            "@type": "IMAGE-THUMBNAIL",
            "@size": "1948",
            "@ref": "gr7",
            "@mimetype": "image/gif"
          },
          {
            "@category": "standard",
            "@height": "179",
            "@width": "278",
            "@_fa": "true",
            "$": "https://api.elsevier.com/content/object/eid/1-s2.0-S1381116908004196-fx1.jpg?httpAccept=%2A%2F%2A",
            "@multimediatype": "JPEG image file",
            "@type": "IMAGE-DOWNSAMPLED",
            "@size": "31163",
            "@ref": "fx1",
            "@mimetype": "image/jpeg"
          },
          {
            "@category": "thumbnail",
            "@height": "141",
            "@width": "219",
            "@_fa": "true",
            "$": "https://api.elsevier.com/content/object/eid/1-s2.0-S1381116908004196-fx1.sml?httpAccept=%2A%2F%2A",
            "@multimediatype": "GIF image file",
            "@type": "IMAGE-THUMBNAIL",
            "@size": "5530",
            "@ref": "fx1",
            "@mimetype": "image/gif"
          }
        ]
      },
      "link": {
        "@rel": "abstract",
        "@href": "https://api.elsevier.com/content/abstract/scopus_id/57149097250"
      }
    }
  }
}