{
  "metadata": {
    "title": "Activity of phenoxy-imine titanium catalysts in ethylene polymerization: A quantum chemical approach",
    "authors": "; ; ",
    "journal": "Journal of Molecular Catalysis A: Chemical",
    "date": "2016-11-30",
    "doi": "10.1016/j.molcata.2016.07.010",
    "abstract": "",
    "uri": "https://api.elsevier.com/content/article/pii/S1381116916302606",
    "pii": "S1381116916302606"
  },
  "fulltext": {
    "full-text-retrieval-response": {
      "scopus-eid": "2-s2.0-84978419529",
      "originalText": "serial JL 271358 291210 291744 291790 291809 31 Journal of Molecular Catalysis A: Chemical JOURNALMOLECULARCATALYSISACHEMICAL 2016-07-14 2016-07-14 2016-07-18 2016-07-18 2019-10-28T13:34:12 1-s2.0-S1381116916302606 S1381-1169(16)30260-6 S1381116916302606 10.1016/j.molcata.2016.07.010 S300 S300.5 FULL-TEXT 1-s2.0-S1381116916X0009X 2019-10-30T00:36:17.477107Z 0 0 20161101 20161130 2016 2016-07-14T21:56:21.482702Z absattachment articleinfo articletitlenorm authfirstinitialnorm authfirstsurnamenorm cid cids contenttype copyright crossmark dateloaded dateloadedtxt datesearch datesort dateupdated dco docsubtype doctype doi eid ewtransactionid hubeid indexeddate issn issnnorm itemstage itemtransactionid itemweight openaccess openarchive pg pgfirst pglast pii piinorm pubdateend pubdatestart pubdatetxt pubyr sectiontitle sortorder srctitle srctitlenorm srctype ssids alllist content subj subheadings suppl tomb volfirst volissue volumelist webpdf webpdfpagecount yearnav figure table e-component body mmlmath acknowledge affil appendices articletitle auth authfirstini authfull authkeywords authlast highlightsabst primabst ref specialabst 1381-1169 13811169 true 423 423 C Volume 423 35 285 292 285 292 201611 November 2016 2016-11-01 2016-11-30 2016 Regular Papers article fla © 2016 Elsevier B.V. All rights reserved. ACTIVITYPHENOXYIMINETITANIUMCATALYSTSINETHYLENEPOLYMERIZATIONAQUANTUMCHEMICALAPPROACH NIKITIN S 1 Introduction 2 Computational methods 3 Results and discussion 3.1 The calculated structures of FI titanium catalysts 3.2 Analysis of the polymerization mechanism 3.3 Correlations between experimental activity values and theoretical data 3.4 Correlations between theoretical data for different chemical species in ethylene polymerization 4 Conclusions Acknowledgements Appendix A Supplementary data References VASILE 2000 xiii C PLASTICSENGINEERING59 STEVENS 1990 M POLYMERCHEMISTRYINTRODUCTION MAKIO 2011 2363 2449 H SINN 1980 390 392 H GUO 2015 109 114 S IVANCHEV 2009 276 282 S IVANCHEVA 2011 118 123 N IVANCHEVA 2012 1404 1412 N IVANCHEVA 2007 301 303 N DOKLADYPHYSICALCHEMISTRY IVANCHEVA 2012 836 842 N IVANCHEV 2006 213 225 S FURUYAMA 2005 4398 4413 R IWASHITA 2014 599 610 A MITANI 2003 2396 2403 M SAKUMA 2007 193 207 A CRUZ 2007 7672 7678 V CRUZ 2007 4663 4674 V CRUZ 2004 2061 2072 V CRUZ 2005 5095 5102 V MARTINEZ 2012 1673 1679 S YANG 2014 1810 1817 W YANG 2015 473 479 W YANG 2015 1125 1133 W YI 2016 J ISHII 2002 11 16 S WU 2008 3164 3168 C NEESE 2012 73 78 F BECKE 1988 3098 A PERDEW 1986 8822 J SCHAFER 1992 2571 2577 A KLAMT 1993 799 805 A NIKOLAIENKO 2014 15 22 T IVANCHEV 2005 165 168 S DOKLADYPHYSICALCHEMISTRY IVANCHEV 2012 191 199 S MALINSKAYA 2007 1515 1522 M SAITO 2002 59 65 J MAKIO 2002 477 493 H MATSUGI 2008 1264 1277 T MATSUI 2001 63 73 S TERAO 2011 254 265 H MITANI 2004 137 158 M MAKIO 2009 1532 1544 H TALSI 2007 490 504 E TALSI 2013 914 922 E LIU 2013 4686 4695 W GIAMMARINO 2014 365 368 G JOHNSON 2006 3088 3098 A FLISAK 2010 83 89 Z FUKUI 1968 1989 1997 K ZIJLSTRA 2015 19 43 H FLISAK 2012 124 130 Z IVANCHEVA 2007 829 834 N SCHEINER 1997 S MOLECULARINTERACTIONSVANDERWAALSSTRONGLYBOUNDCOMPLEXES PARSCH 2002 5664 5672 J KOOPMANS 1934 104 113 T TSUNEDA 2010 174101 T PEARSON 1986 8440 8441 R PEARSON 1963 3533 3539 R PARR 1991 1854 1855 R FURUYAMA 2003 31 42 R NIKITINX2016X285 NIKITINX2016X285X292 NIKITINX2016X285XS NIKITINX2016X285X292XS 2018-07-18T00:00:00Z http://creativecommons.org/licenses/by-nc-nd/4.0/ © 2016 Elsevier B.V. All rights reserved. 2019-03-16T17:38:33.622Z http://vtw.elsevier.com/data/voc/AddOnTypes/50.7/nlp S1381116916302606 Russian Foundation for Basic Research 15-03-05250 a Российский Фонд Фундаментальных Исследований (РФФИ) http://data.elsevier.com/vocabulary/SciValFunders/501100002261 http://sws.geonames.org/2017370/ Swedish LUNARC Center for High-Performance Computing Russian Foundation for Basic Research (project # 15-03-05250 a) and Swedish LUNARC Center for High-Performance Computing are kindly acknowledged for the financial support and provided resources. Terunori Fujita and Haruyuki Makio are acknowledged for supplying the Cartesian coordinates for one of their complexes. The authors thank Frederik Diness, Nina P. Gritsan, and Vitaly G. Kiselev for inspiring discussions and advice. Appendix A item S1381-1169(16)30260-6 S1381116916302606 1-s2.0-S1381116916302606 10.1016/j.molcata.2016.07.010 271358 2019-10-30T00:36:17.477107Z 2016-11-01 2016-11-30 1-s2.0-S1381116916302606-main.pdf https://s3.amazonaws.com/prod-ucs-content-store-us-east/content/pii:S1381116916302606/MAIN/application/pdf/7400b045ef0653ad662ed96b0bd2fc9d/main.pdf main.pdf pdf true 1745813 MAIN 8 1-s2.0-S1381116916302606-main_1.png https://s3.amazonaws.com/prod-ucs-content-store-us-east/content/pii:S1381116916302606/PREVIEW/image/png/4f7259fd4c9f824377bd8d60a88f355e/main_1.png main_1.png png 58888 849 656 IMAGE-WEB-PDF 1 1-s2.0-S1381116916302606-fx1.sml https://s3.amazonaws.com/prod-ucs-content-store-us-east/content/pii:S1381116916302606/fx1/THUMBNAIL/image/gif/c6abb5bf3903bf58012fb13741c744cb/fx1.sml fx1 true fx1.sml sml 5725 88 219 IMAGE-THUMBNAIL 1-s2.0-S1381116916302606-fx10.sml https://s3.amazonaws.com/prod-ucs-content-store-us-east/content/pii:S1381116916302606/fx10/THUMBNAIL/image/gif/b6cd5bf252d202dac26529eed23e6a69/fx10.sml fx10 fx10.sml sml 3115 88 219 IMAGE-THUMBNAIL 1-s2.0-S1381116916302606-fx2.sml https://s3.amazonaws.com/prod-ucs-content-store-us-east/content/pii:S1381116916302606/fx2/THUMBNAIL/image/gif/78b01934b339197c76715e43698fc432/fx2.sml fx2 fx2.sml sml 4942 88 219 IMAGE-THUMBNAIL 1-s2.0-S1381116916302606-fx3.sml https://s3.amazonaws.com/prod-ucs-content-store-us-east/content/pii:S1381116916302606/fx3/THUMBNAIL/image/gif/ea0b6afa5f8b308c4c3610a53526da48/fx3.sml fx3 fx3.sml sml 6207 88 219 IMAGE-THUMBNAIL 1-s2.0-S1381116916302606-fx4.sml https://s3.amazonaws.com/prod-ucs-content-store-us-east/content/pii:S1381116916302606/fx4/THUMBNAIL/image/gif/109073749df531ae54caac32304889dd/fx4.sml fx4 fx4.sml sml 4892 88 219 IMAGE-THUMBNAIL 1-s2.0-S1381116916302606-fx5.sml https://s3.amazonaws.com/prod-ucs-content-store-us-east/content/pii:S1381116916302606/fx5/THUMBNAIL/image/gif/442d13b498bc43317ed1ecfc90465709/fx5.sml fx5 fx5.sml sml 6217 88 219 IMAGE-THUMBNAIL 1-s2.0-S1381116916302606-fx6.sml https://s3.amazonaws.com/prod-ucs-content-store-us-east/content/pii:S1381116916302606/fx6/THUMBNAIL/image/gif/e5f3a700bb9180e484fe9cb76d4dea2e/fx6.sml fx6 fx6.sml sml 2886 88 219 IMAGE-THUMBNAIL 1-s2.0-S1381116916302606-fx7.sml https://s3.amazonaws.com/prod-ucs-content-store-us-east/content/pii:S1381116916302606/fx7/THUMBNAIL/image/gif/9183ca65dacdf5027ee1d8375f6dca49/fx7.sml fx7 fx7.sml sml 3291 88 219 IMAGE-THUMBNAIL 1-s2.0-S1381116916302606-fx8.sml https://s3.amazonaws.com/prod-ucs-content-store-us-east/content/pii:S1381116916302606/fx8/THUMBNAIL/image/gif/adf2e933850b782bb00d39046ce27068/fx8.sml fx8 fx8.sml sml 3490 88 219 IMAGE-THUMBNAIL 1-s2.0-S1381116916302606-fx9.sml https://s3.amazonaws.com/prod-ucs-content-store-us-east/content/pii:S1381116916302606/fx9/THUMBNAIL/image/gif/ee4549d3220a4eb351df2ddd90c67b40/fx9.sml fx9 fx9.sml sml 3672 88 219 IMAGE-THUMBNAIL 1-s2.0-S1381116916302606-gr1.sml https://s3.amazonaws.com/prod-ucs-content-store-us-east/content/pii:S1381116916302606/gr1/THUMBNAIL/image/gif/f84ccbaa334e0c0f7eda296039c8c1a8/gr1.sml gr1 gr1.sml sml 4099 83 219 IMAGE-THUMBNAIL 1-s2.0-S1381116916302606-gr2.sml https://s3.amazonaws.com/prod-ucs-content-store-us-east/content/pii:S1381116916302606/gr2/THUMBNAIL/image/gif/f28cd29cac3b8585d8d6dc3988ecb2d9/gr2.sml gr2 gr2.sml sml 4449 164 133 IMAGE-THUMBNAIL 1-s2.0-S1381116916302606-gr3.sml https://s3.amazonaws.com/prod-ucs-content-store-us-east/content/pii:S1381116916302606/gr3/THUMBNAIL/image/gif/64b6b962253c7479017311606c7865a9/gr3.sml gr3 gr3.sml sml 3834 164 200 IMAGE-THUMBNAIL 1-s2.0-S1381116916302606-gr4.sml https://s3.amazonaws.com/prod-ucs-content-store-us-east/content/pii:S1381116916302606/gr4/THUMBNAIL/image/gif/4f73a2faecbc153e4024155730328b08/gr4.sml gr4 gr4.sml sml 6381 89 219 IMAGE-THUMBNAIL 1-s2.0-S1381116916302606-gr5.sml https://s3.amazonaws.com/prod-ucs-content-store-us-east/content/pii:S1381116916302606/gr5/THUMBNAIL/image/gif/13e411a85ed3848994ba06db6ab2eec5/gr5.sml gr5 gr5.sml sml 4388 163 124 IMAGE-THUMBNAIL 1-s2.0-S1381116916302606-gr6.sml https://s3.amazonaws.com/prod-ucs-content-store-us-east/content/pii:S1381116916302606/gr6/THUMBNAIL/image/gif/c8d55036c585864cd15894a0765d1491/gr6.sml gr6 gr6.sml sml 3792 164 196 IMAGE-THUMBNAIL 1-s2.0-S1381116916302606-gr7.sml https://s3.amazonaws.com/prod-ucs-content-store-us-east/content/pii:S1381116916302606/gr7/THUMBNAIL/image/gif/6d9618f93e8145da23cb85e8ed3fe670/gr7.sml gr7 gr7.sml sml 7477 63 219 IMAGE-THUMBNAIL 1-s2.0-S1381116916302606-gr8.sml https://s3.amazonaws.com/prod-ucs-content-store-us-east/content/pii:S1381116916302606/gr8/THUMBNAIL/image/gif/06319ef58e8283e3479824bdbd83065b/gr8.sml gr8 gr8.sml sml 4918 164 214 IMAGE-THUMBNAIL 1-s2.0-S1381116916302606-fx1.jpg https://s3.amazonaws.com/prod-ucs-content-store-us-east/content/pii:S1381116916302606/fx1/DOWNSAMPLED/image/jpeg/2251ed44a70c11c0fdac2dd57ba0a242/fx1.jpg fx1 true fx1.jpg jpg 20244 200 500 IMAGE-DOWNSAMPLED 1-s2.0-S1381116916302606-fx10.jpg https://s3.amazonaws.com/prod-ucs-content-store-us-east/content/pii:S1381116916302606/fx10/DOWNSAMPLED/image/jpeg/203d12e4e809fc762f63ec7731b8b848/fx10.jpg fx10 fx10.jpg jpg 9064 200 500 IMAGE-DOWNSAMPLED 1-s2.0-S1381116916302606-fx2.jpg https://s3.amazonaws.com/prod-ucs-content-store-us-east/content/pii:S1381116916302606/fx2/DOWNSAMPLED/image/jpeg/df1348ba3b3b0561c1a1694fea5ce282/fx2.jpg fx2 fx2.jpg jpg 5398 200 500 IMAGE-DOWNSAMPLED 1-s2.0-S1381116916302606-fx3.jpg https://s3.amazonaws.com/prod-ucs-content-store-us-east/content/pii:S1381116916302606/fx3/DOWNSAMPLED/image/jpeg/35fa7e7202365c7d756734510f64e13c/fx3.jpg fx3 fx3.jpg jpg 5491 200 500 IMAGE-DOWNSAMPLED 1-s2.0-S1381116916302606-fx4.jpg https://s3.amazonaws.com/prod-ucs-content-store-us-east/content/pii:S1381116916302606/fx4/DOWNSAMPLED/image/jpeg/52254f623d7917480406e6e4a4410d65/fx4.jpg fx4 fx4.jpg jpg 5426 200 500 IMAGE-DOWNSAMPLED 1-s2.0-S1381116916302606-fx5.jpg https://s3.amazonaws.com/prod-ucs-content-store-us-east/content/pii:S1381116916302606/fx5/DOWNSAMPLED/image/jpeg/e2ee4771616796130dd53b0044011034/fx5.jpg fx5 fx5.jpg jpg 5577 200 500 IMAGE-DOWNSAMPLED 1-s2.0-S1381116916302606-fx6.jpg https://s3.amazonaws.com/prod-ucs-content-store-us-east/content/pii:S1381116916302606/fx6/DOWNSAMPLED/image/jpeg/498050f02cd115d4b9702f366143ea89/fx6.jpg fx6 fx6.jpg jpg 7943 200 500 IMAGE-DOWNSAMPLED 1-s2.0-S1381116916302606-fx7.jpg https://s3.amazonaws.com/prod-ucs-content-store-us-east/content/pii:S1381116916302606/fx7/DOWNSAMPLED/image/jpeg/648366d555b122b0821252b184aa4886/fx7.jpg fx7 fx7.jpg jpg 9648 200 500 IMAGE-DOWNSAMPLED 1-s2.0-S1381116916302606-fx8.jpg https://s3.amazonaws.com/prod-ucs-content-store-us-east/content/pii:S1381116916302606/fx8/DOWNSAMPLED/image/jpeg/93d0ef87d08c5a5ef19db898695758af/fx8.jpg fx8 fx8.jpg jpg 8137 200 500 IMAGE-DOWNSAMPLED 1-s2.0-S1381116916302606-fx9.jpg https://s3.amazonaws.com/prod-ucs-content-store-us-east/content/pii:S1381116916302606/fx9/DOWNSAMPLED/image/jpeg/7613d7e706e788dfab21058fd9f259ed/fx9.jpg fx9 fx9.jpg jpg 8998 200 500 IMAGE-DOWNSAMPLED 1-s2.0-S1381116916302606-gr1.jpg https://s3.amazonaws.com/prod-ucs-content-store-us-east/content/pii:S1381116916302606/gr1/DOWNSAMPLED/image/jpeg/37d47557a0a4960c11f4e23bb1062de3/gr1.jpg gr1 gr1.jpg jpg 28326 256 674 IMAGE-DOWNSAMPLED 1-s2.0-S1381116916302606-gr2.jpg https://s3.amazonaws.com/prod-ucs-content-store-us-east/content/pii:S1381116916302606/gr2/DOWNSAMPLED/image/jpeg/7a575c45b09ce79e61230d57a4af7aeb/gr2.jpg gr2 gr2.jpg jpg 74814 873 710 IMAGE-DOWNSAMPLED 1-s2.0-S1381116916302606-gr3.jpg https://s3.amazonaws.com/prod-ucs-content-store-us-east/content/pii:S1381116916302606/gr3/DOWNSAMPLED/image/jpeg/844f898b3448eac62ab9572868207e81/gr3.jpg gr3 gr3.jpg jpg 18145 323 393 IMAGE-DOWNSAMPLED 1-s2.0-S1381116916302606-gr4.jpg https://s3.amazonaws.com/prod-ucs-content-store-us-east/content/pii:S1381116916302606/gr4/DOWNSAMPLED/image/jpeg/ebbaeefc89fedb7edf2e248e1ed8a823/gr4.jpg gr4 gr4.jpg jpg 39723 285 701 IMAGE-DOWNSAMPLED 1-s2.0-S1381116916302606-gr5.jpg https://s3.amazonaws.com/prod-ucs-content-store-us-east/content/pii:S1381116916302606/gr5/DOWNSAMPLED/image/jpeg/4b48fce5d44a1319e09d0ef55eb6247f/gr5.jpg gr5 gr5.jpg jpg 11034 255 194 IMAGE-DOWNSAMPLED 1-s2.0-S1381116916302606-gr6.jpg https://s3.amazonaws.com/prod-ucs-content-store-us-east/content/pii:S1381116916302606/gr6/DOWNSAMPLED/image/jpeg/22fd76b4f8d9eefc9af5114756a439bf/gr6.jpg gr6 gr6.jpg jpg 17936 329 393 IMAGE-DOWNSAMPLED 1-s2.0-S1381116916302606-gr7.jpg https://s3.amazonaws.com/prod-ucs-content-store-us-east/content/pii:S1381116916302606/gr7/DOWNSAMPLED/image/jpeg/5cba8c4fdcbc84f3178b735da60d3d1a/gr7.jpg gr7 gr7.jpg jpg 32065 184 640 IMAGE-DOWNSAMPLED 1-s2.0-S1381116916302606-gr8.jpg https://s3.amazonaws.com/prod-ucs-content-store-us-east/content/pii:S1381116916302606/gr8/DOWNSAMPLED/image/jpeg/719e964e11b6ae217ed55abe5cf1af4c/gr8.jpg gr8 gr8.jpg jpg 42957 455 593 IMAGE-DOWNSAMPLED 1-s2.0-S1381116916302606-fx1_lrg.jpg https://s3.amazonaws.com/prod-ucs-content-store-us-east/content/pii:S1381116916302606/fx1/HIGHRES/image/jpeg/db0e8d46810c35f59c8962d6ba3bf458/fx1_lrg.jpg fx1 true fx1_lrg.jpg jpg 148919 886 2213 IMAGE-HIGH-RES 1-s2.0-S1381116916302606-fx10_lrg.jpg https://s3.amazonaws.com/prod-ucs-content-store-us-east/content/pii:S1381116916302606/fx10/HIGHRES/image/jpeg/b16ff0e4ccb5458654354ab0e7b0e44a/fx10_lrg.jpg fx10 fx10_lrg.jpg jpg 57314 886 2213 IMAGE-HIGH-RES 1-s2.0-S1381116916302606-fx2_lrg.jpg https://s3.amazonaws.com/prod-ucs-content-store-us-east/content/pii:S1381116916302606/fx2/HIGHRES/image/jpeg/672cc607b8ec02333939bc5ed9b9aca7/fx2_lrg.jpg fx2 fx2_lrg.jpg jpg 43232 886 2213 IMAGE-HIGH-RES 1-s2.0-S1381116916302606-fx3_lrg.jpg https://s3.amazonaws.com/prod-ucs-content-store-us-east/content/pii:S1381116916302606/fx3/HIGHRES/image/jpeg/e540c984db2dc3075219ea50a3f94529/fx3_lrg.jpg fx3 fx3_lrg.jpg jpg 44800 886 2213 IMAGE-HIGH-RES 1-s2.0-S1381116916302606-fx4_lrg.jpg https://s3.amazonaws.com/prod-ucs-content-store-us-east/content/pii:S1381116916302606/fx4/HIGHRES/image/jpeg/ba9e7897522e348156e93f36b0ab25ca/fx4_lrg.jpg fx4 fx4_lrg.jpg jpg 42150 886 2213 IMAGE-HIGH-RES 1-s2.0-S1381116916302606-fx5_lrg.jpg https://s3.amazonaws.com/prod-ucs-content-store-us-east/content/pii:S1381116916302606/fx5/HIGHRES/image/jpeg/122473c29999c498c40dbb2f967449a7/fx5_lrg.jpg fx5 fx5_lrg.jpg jpg 45478 886 2213 IMAGE-HIGH-RES 1-s2.0-S1381116916302606-fx6_lrg.jpg https://s3.amazonaws.com/prod-ucs-content-store-us-east/content/pii:S1381116916302606/fx6/HIGHRES/image/jpeg/878918432c5202f6573aa326756055c6/fx6_lrg.jpg fx6 fx6_lrg.jpg jpg 50782 886 2213 IMAGE-HIGH-RES 1-s2.0-S1381116916302606-fx7_lrg.jpg https://s3.amazonaws.com/prod-ucs-content-store-us-east/content/pii:S1381116916302606/fx7/HIGHRES/image/jpeg/620a141c127a58a5cedbbd71587ec2bc/fx7_lrg.jpg fx7 fx7_lrg.jpg jpg 62121 886 2213 IMAGE-HIGH-RES 1-s2.0-S1381116916302606-fx8_lrg.jpg https://s3.amazonaws.com/prod-ucs-content-store-us-east/content/pii:S1381116916302606/fx8/HIGHRES/image/jpeg/a2d98eba4b33afb2200a1b2ffe43474a/fx8_lrg.jpg fx8 fx8_lrg.jpg jpg 59081 886 2213 IMAGE-HIGH-RES 1-s2.0-S1381116916302606-fx9_lrg.jpg https://s3.amazonaws.com/prod-ucs-content-store-us-east/content/pii:S1381116916302606/fx9/HIGHRES/image/jpeg/bda58adc1ef4e917403d4619102a88ee/fx9_lrg.jpg fx9 fx9_lrg.jpg jpg 61567 886 2213 IMAGE-HIGH-RES 1-s2.0-S1381116916302606-gr1_lrg.jpg https://s3.amazonaws.com/prod-ucs-content-store-us-east/content/pii:S1381116916302606/gr1/HIGHRES/image/jpeg/008273f72db4e6a0cbff1fcd38276556/gr1_lrg.jpg gr1 gr1_lrg.jpg jpg 221118 1132 2986 IMAGE-HIGH-RES 1-s2.0-S1381116916302606-gr2_lrg.jpg https://s3.amazonaws.com/prod-ucs-content-store-us-east/content/pii:S1381116916302606/gr2/HIGHRES/image/jpeg/3d872635402ce0cb5b89eb1b55fab94c/gr2_lrg.jpg gr2 gr2_lrg.jpg jpg 627212 3868 3146 IMAGE-HIGH-RES 1-s2.0-S1381116916302606-gr3_lrg.jpg https://s3.amazonaws.com/prod-ucs-content-store-us-east/content/pii:S1381116916302606/gr3/HIGHRES/image/jpeg/def59437f4b3f3ba228a4903fb6e1008/gr3_lrg.jpg gr3 gr3_lrg.jpg jpg 131481 1431 1743 IMAGE-HIGH-RES 1-s2.0-S1381116916302606-gr4_lrg.jpg https://s3.amazonaws.com/prod-ucs-content-store-us-east/content/pii:S1381116916302606/gr4/HIGHRES/image/jpeg/59b655b5298ecc8a9c9a577ddb6defbe/gr4_lrg.jpg gr4 gr4_lrg.jpg jpg 335970 1264 3104 IMAGE-HIGH-RES 1-s2.0-S1381116916302606-gr5_lrg.jpg https://s3.amazonaws.com/prod-ucs-content-store-us-east/content/pii:S1381116916302606/gr5/HIGHRES/image/jpeg/3f9036cc5514eb8acde7549b51f545a7/gr5_lrg.jpg gr5 gr5_lrg.jpg jpg 77276 1132 861 IMAGE-HIGH-RES 1-s2.0-S1381116916302606-gr6_lrg.jpg https://s3.amazonaws.com/prod-ucs-content-store-us-east/content/pii:S1381116916302606/gr6/HIGHRES/image/jpeg/9cba453869d83cec5e3f6c27afbf0140/gr6_lrg.jpg gr6 gr6_lrg.jpg jpg 127065 1458 1743 IMAGE-HIGH-RES 1-s2.0-S1381116916302606-gr7_lrg.jpg https://s3.amazonaws.com/prod-ucs-content-store-us-east/content/pii:S1381116916302606/gr7/HIGHRES/image/jpeg/0e74be088e44f1ff7df9ce6f0996cd9f/gr7_lrg.jpg gr7 gr7_lrg.jpg jpg 293463 813 2833 IMAGE-HIGH-RES 1-s2.0-S1381116916302606-gr8_lrg.jpg https://s3.amazonaws.com/prod-ucs-content-store-us-east/content/pii:S1381116916302606/gr8/HIGHRES/image/jpeg/a1cc5f50f39306bd830a7d55b5aa9300/gr8_lrg.jpg gr8 gr8_lrg.jpg jpg 302271 2014 2625 IMAGE-HIGH-RES 1-s2.0-S1381116916302606-mmc1.docx https://s3.amazonaws.com/prod-ucs-content-store-us-east/content/pii:S1381116916302606/mmc1/MAIN/application/vnd.openxmlformats-officedocument.wordprocessingml.document/b0221a9a269434673974a20ae98ef455/mmc1.docx mmc1 mmc1.docx docx 1508834 APPLICATION 1-s2.0-S1381116916302606-si1.gif https://s3.amazonaws.com/prod-ucs-content-store-us-east/content/pii:S1381116916302606/STRIPIN/image/gif/545f97affa7d43158ccfa0cd87517858/si1.gif si1 si1.gif gif 991 41 191 ALTIMG 1-s2.0-S1381116916302606-si10.gif https://s3.amazonaws.com/prod-ucs-content-store-us-east/content/pii:S1381116916302606/STRIPIN/image/gif/33f7e06181e2fe298dc1d099cf437951/si10.gif si10 si10.gif gif 355 16 60 ALTIMG 1-s2.0-S1381116916302606-si11.gif https://s3.amazonaws.com/prod-ucs-content-store-us-east/content/pii:S1381116916302606/STRIPIN/image/gif/d27e59d407fc1c02a3a97ef61a9173c0/si11.gif si11 si11.gif gif 880 34 237 ALTIMG 1-s2.0-S1381116916302606-si12.gif https://s3.amazonaws.com/prod-ucs-content-store-us-east/content/pii:S1381116916302606/STRIPIN/image/gif/06cbf2e8348fc3a723545672b2a7330f/si12.gif si12 si12.gif gif 108 11 7 ALTIMG 1-s2.0-S1381116916302606-si13.gif https://s3.amazonaws.com/prod-ucs-content-store-us-east/content/pii:S1381116916302606/STRIPIN/image/gif/c5e9123e0201f270cc404f029367f3bd/si13.gif si13 si13.gif gif 131 11 12 ALTIMG 1-s2.0-S1381116916302606-si2.gif https://s3.amazonaws.com/prod-ucs-content-store-us-east/content/pii:S1381116916302606/STRIPIN/image/gif/b664068a3d16abde43811c11ae7a6a1f/si2.gif si2 si2.gif gif 235 16 39 ALTIMG 1-s2.0-S1381116916302606-si3.gif https://s3.amazonaws.com/prod-ucs-content-store-us-east/content/pii:S1381116916302606/STRIPIN/image/gif/cbbf6256a1c8d7c9af853ada5493605b/si3.gif si3 si3.gif gif 220 13 35 ALTIMG 1-s2.0-S1381116916302606-si4.gif https://s3.amazonaws.com/prod-ucs-content-store-us-east/content/pii:S1381116916302606/STRIPIN/image/gif/b37870d957a62757ee47ee8d74f86b79/si4.gif si4 si4.gif gif 151 11 17 ALTIMG 1-s2.0-S1381116916302606-si5.gif https://s3.amazonaws.com/prod-ucs-content-store-us-east/content/pii:S1381116916302606/STRIPIN/image/gif/4a495a5fb1e2637319e79d78f122fc45/si5.gif si5 si5.gif gif 270 16 42 ALTIMG 1-s2.0-S1381116916302606-si6.gif https://s3.amazonaws.com/prod-ucs-content-store-us-east/content/pii:S1381116916302606/STRIPIN/image/gif/2a744484000436a0ea8f393237e99a53/si6.gif si6 si6.gif gif 635 16 155 ALTIMG 1-s2.0-S1381116916302606-si7.gif https://s3.amazonaws.com/prod-ucs-content-store-us-east/content/pii:S1381116916302606/STRIPIN/image/gif/c18b04cc46c2b5d87be4ae1ba1d58e76/si7.gif si7 si7.gif gif 170 14 22 ALTIMG 1-s2.0-S1381116916302606-si8.gif https://s3.amazonaws.com/prod-ucs-content-store-us-east/content/pii:S1381116916302606/STRIPIN/image/gif/d41595e39426c7557c373fc638e26baa/si8.gif si8 si8.gif gif 225 15 38 ALTIMG 1-s2.0-S1381116916302606-si9.gif https://s3.amazonaws.com/prod-ucs-content-store-us-east/content/pii:S1381116916302606/STRIPIN/image/gif/2ef198de4386df3dfd5c9b9f1ab3085c/si9.gif si9 si9.gif gif 265 15 44 ALTIMG MOLCAA 9944 S1381-1169(16)30260-6 10.1016/j.molcata.2016.07.010 Elsevier B.V. Fig. 1 Chemical structures of FI titanium catalysts studied in this work. Fig. 1 Fig. 2 The mechanism of ethylene polymerization on FI titanium catalysts 1–21. Here IC is the initial complex, ACn —active cation, Cocat.—cocatalyst anion, IPn —ionic pair, and PCn —π‐complex. Subindex n denotes the number of monomer units in the attached polymeric chain Pn . Fig. 2 Fig. 3 Calculated changes in free energy in the course of one step of the propagation reaction during ethylene polymerization on FI catalyst 3. Here, ACn , PCn , and TSn denote the active site, π‐complex, and transition state containing n monomer units in the attached polymer chain, respectively. Fig. 3 Fig. 4 Optimized structures of active cations formed from “living” 21 (left, r(H‐F)=2.392 Å, q(H)=0.095 a.u., q(F)=−0.127 a.u.) and non-fluorinated 3 (right) catalysts. All hydrogen atoms, except the ones in the growing polymeric chain and in the N‐aryl moieties of the FI ligand, are omitted for clarity. Fig. 4 Fig. 5 The energy level diagram for the ground state of the n‐propyl active cation of FI catalyst 3. HOMO and LUMO are depicted as doublets corresponding to two equivalent FI ligands in the structure of the catalyst. Fig. 5 Fig. 6 Correlations between experimental activities and theoretical inversed HOMO‐LUMO gaps for catalysts 1–18 (■), 19–20 ( ), and 21 ( ). Fig. 6 Fig. 7 Calculated HOMOs of catalysts 10 (left) and 1 (right). Hydrogen atoms are omitted for clarity. Fig. 7 Fig. 8 Correlations between the calculated inversed HOMO-LUMO gap values for the ligand (L−), dichloride complex (L2TiCl2), π‐complex-propyl (L2Ti(C2H4)‐C3H7 +), active cation-pentyl (L2Ti‐C5H11 +), and active cation-propyl (L2Ti‐C3H7 +) of FI catalysts 1–18 (■), 19–20 ( ), and 21 ( ). Fig. 8 Table 1 Activation barriers and changes in energy (kJ/mol, T=298 K) calculated for elementary stages of the propagation reaction during ethylene polymerization on FI catalyst 3. Table 1 Reaction ΔG 0 ΔH 0 -TΔS 0 19.4 (22.1) a −25.4 (−22.7) 48.5 (48.5) 10.8 (13.8) −32.0 (−29.0) 46.9 (46.9) 17.0 (16.9) 8.1 (8.0) 4.2 (4.2) −62.4 (−62.5) −70.8 (−70.9) 10.0 (10.0) −51.7 (−48.8) −102.8 (−99.9) 56.9 (56.9) a Including a solvent correction. Table 2 Theoretical and published experimental data [6–10,33–36] on FI catalysts 1–21. In the subsequent correlations, activity values measured at 40°C were used. Table 2 Catalyst R1 R2 R3 Gap a MAC b Activity Ref. eV a.u. kg(PE)·mol(Ti)−1·MPa−1·h−1 1 tBu H H 2.07 0.88 4100 c [36] 2 tBu H m-OAll 1.73 0.91 17800 [8] 3 tBu H p-OAll 1.66 0.90 54200 [9] 4 tBu Me H 1.94 0.88 17100 c [33] 5 tBu Me m-OAll 1.82 0.90 13600 [7] 6 tBu Me p-OAll 1.68 0.90 39000 [7] 7 tBu tBu H 1.95 0.82 19400 c [52] 8 tBu tBu m-OAll 1.84 0.91 12400 [8] 9 tBu tBu p-OAll 1.72 0.90 33000 [9] 10 Cumyl H H 1.65 0.90 27400 c [6] 11 Cumyl H m-OAll 1.73 0.90 32600 [10] 12 Cumyl H p-OAll 1.70 0.89 34500 [6] 13 Cumyl Me H 1.71 0.90 34050 c [35] 14 Cumyl Me m-OAll 1.79 0.89 19800 [7] 15 Cumyl Me p-OAll 1.72 0.89 29400 [7] 16 Cumyl Cumyl H 1.70 0.90 18550 c [35] 17 Cumyl Cumyl m-OAll 1.75 0.89 26000 [10] 18 Cumyl Cumyl p-OAll 1.73 0.90 25700 [6] 19 1.20 0.99 28250 c [6] 20 1.33 0.95 25050 c [6] 21 “living” 2.07 0.77 16450 c [52] a The energy gap between HOMO and LUMO in the n-propyl active cationic species calculated in this work. The average value for complexes 1–20 is 1.72±0.19eV. b The Mulliken atomic charge on Ti in the n-propyl active cationic species calculated in this work. The average value for complexes 1–20 is 0.90±0.03 a.u. c The value was estimated as [activity(30°C)+activity(50°C)]/2 (see Supporting information for details). Activity of phenoxy-imine titanium catalysts in ethylene polymerization: A quantum chemical approach Sergey V. Nikitin a b ⁎ Viktor V. Nikitin c Ivan I. Oleynik a b Irina V. Oleynik a b Elena G. Bagryanskaya a b ⁎ a N. N. Vorozhtsov Novosibirsk Institute of Organic Chemistry SB RAS, 9 Lavrentieva Ave., Novosibirsk, 630090, Russia N. N. Vorozhtsov Novosibirsk Institute of Organic Chemistry SB RAS 9 Lavrentieva Ave. Novosibirsk 630090 Russia b Novosibirsk State University, 2 Pirogova St., Novosibirsk, 630090 Russia Novosibirsk State University 2 Pirogova St. Novosibirsk 630090 Russia c Centre for Mathematical Sciences, Lund University, 22100 Lund, Sweden Centre for Mathematical Sciences Lund University Lund 22100 Sweden ⁎ Corresponding authors at: N. N. Vorozhtsov Novosibirsk Institute of Organic Chemistry SB RAS, 9 Lavrentieva Ave., Novosibirsk, 630090, Russia. N. N. Vorozhtsov Novosibirsk Institute of Organic Chemistry SB RAS 9 Lavrentieva Ave. Novosibirsk 630090 Russia Graphical abstract The mechanism of ethylene polymerization on phenoxy-imine (FI) titanium catalysts was studied theoretically to identify the major factors affecting the catalytic activity. Geometry optimizations of FI ligands, octahedral titanium dichloride complexes, active cationic species, and their π‐complexes with ethylene as well as calculations of the energy profile of chain propagation were performed at the BP86-D3 level. We found that the calculated energy gaps between frontier orbitals (HOMO and LUMO) in the active cations of the catalysts correlate with the experimental activity values. High activities of FI catalysts with α‐Cumyl groups were attributed to smaller HOMO-LUMO gaps due to hyperconjugation between π-systems of α‐Cumyl and (N‐aryl)salicylaldimine moieties in the active cations. The correlation provides a qualitative estimate of the catalytic activity for further design of new FI titanium complexes. Keywords Phenoxy-imine FI catalyst Ethylene polymerization Catalytic activity DFT 1 Introduction Novel polyolefinic materials, e.g. ultra-high-molecular-weight polyethylene (UHMWPE), attract the attention of both scientists and engineers due to many useful properties, namely, light weight, excellent mechanical strength, chemical inertness, flexibility, resistance to abrasion, and recyclability. Moreover, UHMWPE is an inexpensive and commercially available substance. These features make it a competitive raw material for manufacture of various valuable products, such as ship ropes, biological prostheses, bullet-proof vests and helmets, protective gloves, car bumpers, and artificial ice [1,2]. Nowadays UHMWPE is mostly prepared by coordination polymerization of ethylene on three main types of catalysts: Ziegler-Natta, metallocene, and post-metallocene [3]. Homogeneous single-site catalytic systems based on phenoxy-imine (FI) titanium dichloride complexes of the post-metallocene type with methylalumoxane (MAO) as a cocatalyst were reported to show high activity in olefin polymerization [4]. The chemical structure of such complexes facilitates the synthesis of a large variety of catalysts, that in turn allows for preparation of UHMWPE of various molecular weight distribution, structure, and morphology [3,5]. Recent studies by Ivanchev et al. [6–10] revealed that FI titanium catalysts bearing a double bond in the ligand structure are capable of self-immobilization during ethylene polymerization. This process results in special morphological features of the resulting PE and thereby makes the product recyclable by a cold gel-formation procedure [11]. Furthermore, Fujita et al. [12–15] demonstrated that the use of FI catalysts with ortho-fluorinated N‐aryl groups allows to perform olefin polymerization in controlled “living” mode and thus to synthesize polymers of various well-defined architectures. Such modifications in the structure of a FI ligand primarily affect catalytic activity and molecular weight distribution of the resulting polymer [3]. In many cases nontrivial organic syntheses of the catalysts as well as numerous polymerization experiments and characterization assays of final polymers are required to find out how these parameters vary for different complexes. Thus, a simple method for estimation of activity and molecular weight distribution without any chemical experiments would be a powerful tool for design of new active FI catalysts. Many studies have been conducted on correlations between experimental values of catalytic activities in ethylene polymerization and theoretical quantum chemical parameters. Remarkable results in this field have been obtained by Cruz and co-workers [16–20] who applied the 3D‐QSAR approach to research into single-site polymerization catalysts of both the metallocene and the post-metallocene type. The authors established relations for quantitative evaluation of both catalytic activity and polymer molecular weight with a high degree of accuracy. The strong predictive power of the proposed method can be associated with thorough consideration of structural aspects in both steric and electronic effects of a ligand. In recent studies, Sun et al. [21–24] demonstrated that activity values for post-metallocene catalysts with late transition metals can be quantitatively predicted using hybrid DFT-QEq calculations. In these works, apart from initial complexes, correlations were determined for active species formed during the polymerization process. These results are of special interest since it is well-known that the initial form of a post-metallocene catalyst by itself cannot perform ethylene polymerization, and the structure of the active species in general differs considerably from that of the pre-catalyst. Within the framework of the “ligand-oriented concept,” Fujita et al. [25] found correlation between experimental activity of FI catalysts and electronic flexibility of the ligand which in turn was determined by the energies of frontier orbitals (HOMO and LUMO) in the ligand structure calculated at the MNDO-PM3 level. Employing MM‐QEq calculations, HuaYi and co-workers [26] evaluated the influence of the metal net charge in a large number of FI titanium and zirconium dichloride complexes. Although structure-activity relations in these studies had more qualitative nature, both research groups came to the conclusion that electron-withdrawing groups in the ligand of a complex are favorable for high activity in ethylene polymerization under mild conditions. In the present work, we theoretically analyze the mechanism of ethylene polymerization on FI titanium dichloride complexes and establish correlations for qualitative estimation of the catalytic activity values by means of DFT calculations of active cationic species and related structures. 2 Computational methods All computations were performed using the ORCA 3.0.3 software package [27] on a parallel platform of the LUNARC center for high-performance computing [21]. Optimal parameters for the calculations (the DFT functional and the basis set) were chosen after a comparison of optimized geometries of dichloride complexes with the corresponding experimental X‐ray structures (see Supporting information). The geometry optimizations were performed with BP86 exchange-correlation functional and SVP split-valence basis set for all atoms [28–30]. In the case of energy barrier calculations, the D3BJ atom-pairwise dispersion correction with Becke-Johnson damping was added to the functional, and the basis set was extended to TZVP. In order to confirm the type of stationary points (minima or transition states), eigenvalues of the numerical hessian were computed. For assessment of the solvent effect in the energy barrier calculations (for single point energies) we utilizied the COSMO continuum solvation model [31]. Natural population analysis was performed in the JANPA 1.02 software [32]. 3 Results and discussion 3.1 The calculated structures of FI titanium catalysts For our computations we selected a series of FI titanium catalysts 1–21 that were previously used for ethylene polymerization by Ivanchev and Fujita and co-workers (Fig. 1 ) [6–10,33–36]. The series includes two complete sets containing nine dichloride complexes with α‐tBu and α‐Cumyl [2‐(2‐phenylpropyl)] substituents in the ligand structure (1–18). Each set includes six self-immobilizing catalysts with an allyloxy group (OAll) in the N‐aryl moiety. Such sets were chosen to find a theoretical explanation of the higher catalytic activities of FI titanium and zirconium dichloride complexes bearing α‐Cumyl substituents as compared to their α‐tBu analogs. This phenomenon was previously attributed to higher steric bulkiness of α‐Cumyl(s) as compared with α‐tBu(s) [37,40]. Here, we show that the electronic structure of an α‐Cumyl group is also responsible for high activities of the corresponding catalysts. In order to evaluate the impact of the steric effect and the “living” character of the polymerization on the activity, we also analyzed two FI titanium catalysts with α‐1‐(4‐(tert‐butyl)phenyl)ethyl substituents (19, 20) and one with ortho‐fluorinated N‐aryl groups (21). Note that, since the accurate structure-activity relation was not the aim of this work, we used activity values that were measured under close but not exactly the same experimental conditions (see Supporting information). For some catalysts, due to the lack of the necessary experimental data, the activities were estimated from two closest temperature points. It is well-known that catalytic activity is strongly affected by polymerization conditions. Nonetheless, we believe that for qualitative relations between experimental and theoretical data, which are the aim of this work, the accuracy of the estimated values is acceptable. 3.2 Analysis of the polymerization mechanism The time-averaged activity of FI titanium catalysts 1–21 in ethylene polymerization measured by Ivanchev [6–10,34] and Fujita et al. [3,12–15,25,37–40] is defined as (1) a c t i v i t y = ¯ M C 2 H 4 ∫ 0 τ W p ( t ) d t C T i p C 2 H 4 τ , where M C 2 H 4 and p C 2 H 4 denote the molecular weight and the pressure of ethylene, respectively; c Ti − the initial concentration of a catalyst, τ − polymerization time; and W p ( t ) is the propagation rate given by (2) W p = k eff [ Ti ] act [ C 2 H 4 ] , where k eff is the effective rate constant (activity of a single active site), and [ Ti ] act and [ C 2 H 4 ] denote concentrations of active sites and ethylene, respectively. Assuming that the polymerization process is carried out under the same conditions, the catalytic activity should be determined by a composite function of k eff [ Ti ] act . In order to estimate contributions of different chemical interactions into the activity of FI catalysts 1–21 in ethylene polymerization, we proposed a model of the mechanism starting from octahedral titanium dichloride complexes (Fig. 2 ). Note that the real mechanism can be more complicated and in general depends on the composition of a catalytic system [3]. Nevertheless, it always contains three main stages that are listed in Fig. 2. The first activation stage results in formation of an active site (AC0 ) from an initial titanium complex (IC). As shown previously [3,41–44], the active site has cationic nature and exists in the medium predominantly in the form of an ionic pair (IP0 ) with a large molecule of a cocatalyst. This stage is often assumed to be rapid and quantitative in the polymerization [45]. Thus, it does not affect the activity of FI catalysts 1–21 significantly. The next propagation reaction depicted in Fig. 2 plays a key role in the activity of FI complexes because it involves an elementary stage where the monomer is consumed. The monomer consumption at this stage was experimentally proven by Bryliakov with co‐workers [44]. The last termination stage can be subdivided into two types depending on whether it results in a decrease of the active site concentration. The active termination is presented in our model by means of two β‐hydrogen transfer reactions from a polymeric chain to a metal center and to a monomer moiety. As demonstrated theoretically by Villani et al. [46], these two types of H‐transfer have the biggest contribution to the active termination. Since the number of active sites does not change after both reactions, their influence on the activity is also negligible. The inactive termination results in a decrease in the concentration of active cations (ACn ). Therefore, this stage always lessens the final activity of a catalyst. The mechanism underlying such deactivation is not clear, but it is believed to include a ligand transfer from the FI catalyst to a molecule of the cocatalyst [3,44]. It is then not surprising that sterically hindered substituents in the ligand structure are favorable for highly active catalysts because they reduce the contribution of the deactivation reaction, i.e. make the active site more stable. In the present work, for the sake of the simplicity we omit the active cation isomerization described previously [42,47] and perform calculations of all chemical species and transition states for the N,N‐cis‐O,O‐trans diastereomer that has the lowest energy among all other isomers [48]. On the whole, besides the deactivation reaction, only the propagation stage notably affects the activity of FI titanium catalysts. As shown in Fig. 2, the propagation reaction includes three elementary stages: dissociation of ionic pairs (IPn) into active cationic (ACn) species, π‐complex (PCn) formation, and ethylene insertion into the polymeric chain. The last stage is followed by association of the formed cation with a cocatalyst anion and is assumed to be identical to the reverse first stage. The dissociation of ionic pairs affects the number of active sites in the polymerization ( [ Ti ] act , Eq. (2)), whereas the second and third elementary stages determine the activity of a single active site ( k eff , Eq. (2)). We calculated the energy profile for the last two stages of chain propagation to identify the rate- k eff limiting reaction and chemical species whose structures mostly affect the effective constant keff . Fig. 3 and Table 1 show changes in energy in the course of one step of the propagation reaction during ethylene polymerization on FI catalyst 3. As seen both in vacuum and in toluene, the transition state TS2 has higher free energy than TS1 does. This means that the third elementary stage (monomer insertion into the attached polymeric chain) represents the highest energy barrier in the chain propagation and therefore this reaction is the rate-limiting stage of the propagation process. Hence, the effective rate constant k eff is determined by the difference in free energy between reagents (AC1 + C2H4 ) and the transition state TS2 (see Supporting information for details). It should also be noted that activation barriers (ΔG0 ) for both elementary stages are small, in accordance with the catalytic nature of the reaction. Moreover, a solvent correction for free energies can be well associated with the entropic term ( ‐TΔS0 ). More substantial system reorganization at the second stage results in a greater impact of the solvent effect on energy. At both elementary stages enthalpic and entropic terms make opposite contributions into the free energy. Nonetheless, the formation energy of a weak coordinate bond between ethylene and titanium cannot account for the entropic term at the second stage. Consequently, the highly exothermic formation of two strong σ‐bonds in the third elementary reaction serves as the driving force behind the propagation process. 3.3 Correlations between experimental activity values and theoretical data The dissociation of ionic pairs into active cationic species and the π‐complex formation in the propagation reaction directly depend on the structure of the active site and cocatalyst (Fig. 2). According to Fukui basic principle of the nature of chemical reactions [49], the first stage in the propagation reaction is controlled by Coulomb, exchange, and orbital interaction terms. The contribution of each term depends on the structure of the cocatalyst. For instance, in the case of a weakly coordinating anion B(C6F5)4 −, the exchange and orbital interactions are negligible. Unfortunately, for methylalumoxane (MAO) used with the FI titanium catalysts that were studied in the works of Ivanchev and Fujita et al. [6–10,33–36] it is difficult to calculate the contributions of each term becasuse the cocatalyst presents a complex mixture of chemical compounds whose structures are unclear [50]. Nevertheless, Flisak et al. [51] estimated the impact of the Coulomb interaction at 70% for the counterion binding to MeB(C6F5)3 −, which has a structure similar (in the sense of binding) to that of oligomers of MAO. Assuming that the Coulomb interaction makes a major contribution to the dissociation of ionic pairs of the catalysts, the main differences at this stage can be attributed to various charge distribution in the active cation and the steric effect. Here, we estimated the first term as differences in the Mulliken atomic charge on titanium in optimized structures of active cations formed from initial FI dichloride complexes 1–21. Table 2 shows experimentally measured activities [6–10,33–36] and the calculated HOMO-LUMO gaps as well, as the Mulliken atomic charges (MAC) on titanium for catalysts 1–21. One can see that except for “living” catalyst 21, variation of MAC for all complexes in question is very small. A notable difference in the atomic net charge on titanium for complex 21 can be attributed to a special structure of its active cation with an intramolecular attractive interaction between α‐fluorine of an N‐aryl moiety and β‐hydrogen of the growing polymeric chain (Fig. 4 , left). Coulomb energy of this interaction is thought to be −7kJ/mol, which is still consistent with other theoretical and experimental data [53,54]. Thus, the major differences in the number of active sites in ethylene polymerization on “nonliving” FI catalysts 1–20 can be ascribed to the steric effect. As shown in Fig. 2, the third elementary stage in the propagation reaction involves the early transition state TS2 whose electronic structure is then similar to π-complex PC1 . Within the framework of the Fukui theory, the interaction between a neutral molecule of ethylene and a positively charged active cation yielding a π-complex is mostly controlled by the polarization term, i.e. by the energy gap between HOMO and LUMO (Fig. 5 ). Table 2 shows that the variation of HOMO-LUMO gap values reaches 11%. in optimized structures for active cations formed from corresponding FI dichloride complexes 1–20. Overall, we can conclude that the steric effect and the electronic structure of the active cationic species (determined by their HOMO-LUMO gaps) should be the major factors affecting activities of FI catalysts 1–20. In order to confirm this conclusion, we plotted experimentally measured activities of catalysts 1–20 in ethylene polymerization versus theoretically calculated inversed HOMO-LUMO gap values for cationic species formed from the corresponding dichloride complexes in the polymerization process. Fig. 6 clearly shows that there is a good correlation (R 2 =0.54) between experimental and theoretical data for complexes with α‐tBu and α‐Cumyl substituents in the ligand structure (1–18). The data on “living” catalyst 21 are as expected out of this correlation because of a special structure of its active cation (Fig. 4, left). Comparing the data obtained for FI catalysts 1–18 and 19–20, we can draw the conclusion that the steric hindrance of α‐tBu substituents and hindrance of α‐Cumyl substituents are similar and greater than that of the α‐1‐(4‐(tert‐butyl)phenyl)ethyl group. This state of affair results in higher activities of complexes 3 and 12 as compared with their analog 20 in spite of a smaller HOMO-LUMO gap in the active cation 20 (Table 2). Interestingly, self-immobilizing catalysts belong to the same correlation as the corresponding complexes without an allyloxy group in the N‐aryl moiety. This means that the influence of self-immobilization on the activity of the FI catalysts in question is less significant than the steric effect or the “living” character of the polymerization. Furthermore, the established correlation explains why FI titanium catalysts with α‐Cumyl substituents are more active in ethylene polymerization than their α‐tBu analogs. Gathering the electron density on their atoms, α‐Cumyl groups delocalize HOMO of the cationic species and thereby make it more diffusive (Fig. 7 , left). This phenomenon leads to an increase in HOMO energy (a decrease in the HOMO-LUMO gap, Fig. 5) and finally causes an increase in a growth of their catalytic activity in the polymerization (Table 2). It is also worth noting that, using the Koopmans theorem [55,56], one can easily determine the correlation between the inversed value of the HOMO-LUMO gap and Pearson’s chemical softness [57] as (3) S = 2 I − A ≈ 2 ε LUMO − ε HOMO = 2 gap , where I and A denote the ionization potential and the electron affinity, respectively. As a consequence, higher activity of FI catalysts (whose active cations have smaller HOMO-LUMO gaps) correlates with well-known Pearson’s HSAB principle [58]. Being a soft base, ethylene tends to react with softer active cations that are classified as Pearson’s acids. On the other hand, according to Parr’s principle of maximum hardness [59], a decrease in the HOMO-LUMO gap leads to an increase in the overall chemical reactivity of the active cation. Hence, sterically hindered substituents in the FI ligand structure are favorable for catalysts highly active in ethylene polymerization because such substituents increase the kinetic stability of the active site. Note that this result was also observed in the experiments of Ivanchev and Fujita with their co‐workers. [35,37,40,52,60]. 3.4 Correlations between theoretical data for different chemical species in ethylene polymerization Quantum chemical calculations of a large molecule of an active cation appear to be time-consuming and resource-intensive. Moreover, active cations are much more labile chemical compounds than the initial titanium dichloride complexes. At this point, computations on small FI ligands or octahedral titanium dichloride complexes for correlations with experimental data seem more attractive. On the other hand, Fig. 8 shows that the calculated HOMO-LUMO gaps for active FI titanium cations correlate neither with the ones for FI ligands nor with those for the octahedral dichloride complexes. As a result there is no correlation between theoretical and experimental data for ligands and dichloride complexes (see Supporting information). It is then difficult to estimate activity of FI titanium catalysts from quantum chemical calculations of these species. On the contrary, there is a rather strong correlation between the calculated gap values for active cations and their π‐complexes with ethylene. This means that the propagation reaction can be considered a small perturbation in the electronic structure of the active site during the polymerization. This finding also supports that the Fukui theory [49] may be used for estimation of the interaction energy between ethylene and an active cation from calculated HOMO-LUMO gap values. 4 Conclusions The mechanism of ethylene polymerization on FI titanium catalysts has been studied by means of the density functional theory. We found that the propagation reaction has a strong influence on activity of the catalysts. Calculations of the energy profile of the chain propagation have revealed that ethylene insertion into the attached polymeric chain determines the effective activity of a single active site in the polymerization. Both the electronic and steric effect of the ligand determine the total catalytic activity. The major factor affecting the activity of FI titanium catalysts depends on the structure of the active site. For FI titanium dichloride complexes with α‐tBu and α‐Cumyl substituents, experimentally determined activity values correlate with the calculated HOMO-LUMO gaps in active cationic species. We showed that α‐Cumyl groups in a FI ligand stabilize the active cation making it more sterically hindered. On the other hand, these groups increase electronic flexibility of the cation via hyperconjugation with the π‐system of aryl moieties, thereby making the catalysts more active in the ethylene polymerization. The DFT calculations allow for estimation of changes in the electronic structure of FI titanium complexes caused by addition of new substituents to aryl moieties. Therefore they can be useful for the design of new highly active catalysts for ethylene polymerization. Nevertheless, our estimates have qualitative nature, and further studies are needed for more accurate prediction of the catalytic activity. Acknowledgements Russian Foundation for Basic Research (project # 15-03-05250 a) and Swedish LUNARC Center for High-Performance Computing are kindly acknowledged for the financial support and provided resources. Terunori Fujita and Haruyuki Makio are acknowledged for supplying the Cartesian coordinates for one of their complexes. The authors thank Frederik Diness, Nina P. Gritsan, and Vitaly G. Kiselev for inspiring discussions and advice. Appendix A Supplementary data Supplementary data associated with this article can be found, in the online version, at http://dx.doi.org/10.1016/j.molcata.2016.07.010. Appendix A Supplementary data The following is Supplementary data to this article: Selection of optimal parameters for calculations; ethylene polymerization conditions for catalysts 1–21; correlations activity−HOMO-LUMO gap for FI ligands, dichloride complexes, π-complexes, and active cations; and Cartesian coordinates for calculated structures. References [1] C. Vasile Plastics Engineering 59 2000 Marcel Dekker New York xiii 1014 p. ill. 1029 cm [2] M.P. Stevens Polymer Chemistry: An Introduction 2nd ed. 1990 Oxford University Press New York [3] H. Makio H. Terao A. Iwashita T. Fujita Chem. Rev. 111 2011 2363 2449 [4] H. Sinn W. Kaminsky H.J. Vollmer R. Woldt Angew. Chem. Internat. Ed. 19 1980 390 392 in English [5] S. Guo H. Fan Z. Bu B.-G. Li S. Zhu Polymer 80 2015 109 114 [6] S. Ivanchev M.Y. Vasil’eva N. Ivancheva V. Badaev I. Oleinik E. Sviridova G. Tolstikov Polym. Sci. Ser. B 51 2009 276 282 [7] N. Ivancheva V. Badaev E. Sviridova D. Nikolaev I. Oleinik S. Ivanchev Russ. J. Appl. Chem. 84 2011 118 123 [8] N. Ivancheva S.Y. Khaikin E. Sviridova S. Fedorov D. Sanieva O. Molev I. Oleinik S. Ivanchev Russ. J. Appl. Chem. 85 2012 1404 1412 [9] N. Ivancheva M.Y. Malinskaya I. Oleinik S.Y. Khaikin S. Ivanchev G. Tolstikov Doklady Physical Chemistry 2007 Springer 301 303 [10] N. Ivancheva D. Sanieva S. Fedorov I. Oleinik I. Oleinik G. Tolstikov S. Ivanchev Russ. Chem. Bull. 61 2012 836 842 [11] S. Ivanchev A. Ozerin Polym. Sci. Ser. B 48 2006 213 225 [12] R. Furuyama J. Saito S. Ishii H. Makio M. Mitani H. Tanaka T. Fujita J. Organomet. Chem. 690 2005 4398 4413 [13] A. Iwashita M.C. Chan H. Makio T. Fujita Catal. Sci. Technol. 4 2014 599 610 [14] M. Mitani T. Nakano T. Fujita Chem.—Eur. J. 9 2003 2396 2403 [15] A. Sakuma M.-S. Weiser T. Fujita Polym. J. 39 2007 193 207 [16] V. Cruz J. Martinez J. Martinez-Salazar J. Ramos M. Reyes A. Toro-Labbe S. Gutierrez-Oliva Polymer 48 2007 7672 7678 [17] V. Cruz S. Martinez J. Martinez-Salazar D. Polo-Cerón S. Gómez-Ruiz M. Fajardo S. Prashar Polymer 48 2007 4663 4674 [18] V. Cruz J. Ramos A. Munoz-Escalona P. Lafuente B. Pena J. Martinez-Salazar Polymer 45 2004 2061 2072 [19] V.L. Cruz J. Ramos S. Martinez A. Muñoz-Escalona J. Martinez-Salazar Organometallics 24 2005 5095 5102 [20] S. Martínez V.L. Cruz J. Ramos J. Martínez-Salazar Organometallics 31 2012 1673 1679 [21] W. Yang Y. Chen W.H. Sun Macromol. Chem. Phys. 215 2014 1810 1817 [22] W. Yang Y. Chen W.H. Sun Macromol. React. Eng. 9 2015 473 479 [23] W. Yang J. Yi W.H. Sun Macromol. Chem. Phys. 216 2015 1125 1133 [24] J. Yi W. Yang W.H. Sun Macromol. Chem. Phys. 2016 [25] S.-i. Ishii J. Saito M. Mitani J.-i. Mohri N. Matsukawa Y. Tohi S. Matsui N. Kashiwa T. Fujita J. Mol. Catal. A: Chem. 179 2002 11 16 [26] C. Wu H. Li Y. Feng Y. Hu Chin. Sci. Bull. 53 2008 3164 3168 [27] F. Neese Wiley Interdiscip. Rev. Comput. Mol. Sci. 2 2012 73 78 [28] A.D. Becke Phys. Rev. A 38 1988 3098 [29] J.P. Perdew Phys. Rev. B 33 1986 8822 [30] A. Schäfer H. Horn R. Ahlrichs J. Chem. Phys. 97 1992 2571 2577 [31] A. Klamt G. Schüürmann J. Chem. Soc., Perkin Trans. 2 1993 799 805 [32] T.Y. Nikolaienko L.A. Bulavin D.M. Hovorun Comput. Theor. Chem. 1050 2014 15 22 [33] S. Ivanchev V. Trunov V. Rybakov D. Al'bov D. Rogozin Doklady Physical Chemistry 2005 Springer 165 168 [34] S.S. Ivanchev A.V. Yakimansky N.I. Ivancheva I.I. Oleinik G.A. Tolstikov Eur. Polym. J. 48 2012 191 199 [35] M.Y. Malinskaya N. Ivancheva I. Oleinik G. Tolstikov S. Ivanchev Russ. J. Appl. Chem. 80 2007 1515 1522 [36] J. Saito M. Mitani S. Matsui Y. Tohi H. Makio T. Nakano H. Tanaka N. Kashiwa T. Fujita Macromol. Chem. Phys. 203 2002 59 65 [37] H. Makio N. Kashiwa T. Fujita Adv. Synth. Catal. 344 2002 477 493 [38] T. Matsugi T. Fujita Chem. Soc. Rev. 37 2008 1264 1277 [39] S. Matsui T. Fujita Catal. Today 66 2001 63 73 [40] H. Terao A. Iwashita N. Matsukawa S. Ishii M. Mitani H. Tanaka T. Nakano T. Fujita ACS Catal. 1 2011 254 265 [41] M. Mitani J. Saito S.i. Ishii Y. Nakayama H. Makio N. Matsukawa S. Matsui J.i. Mohri R. Furuyama H. Terao Chemi. Rec. 4 2004 137 158 [42] H. Makio T. Fujita Acc. Chem. Res. 42 2009 1532 1544 [43] E. Talsi K. Bryliakov N. Semikolenova V. Zakharov M. Bochmann Kinet. Catal. 48 2007 490 504 [44] E.P. Talsi K.P. Bryliakov Top. Catal. 56 2013 914 922 [45] W. Liu S. Guo H. Fan W. Wang B.G. Li S. Zhu AlChE J. 59 2013 4686 4695 [46] G. Giammarino V. Villani Macromol. Theory Simul. 23 2014 365 368 [47] A.L. Johnson M.G. Davidson M.D. Lunn M.F. Mahon Eur. J. Inorg. Chem. 2006 2006 3088 3098 [48] Z. Flisak J. Mol. Catal. A: Chem. 316 2010 83 89 [49] K. Fukui H. Fujimoto Bull. Chem. Soc. Jpn. 41 1968 1989 1997 [50] H.S. Zijlstra S. Harder Eur. J. Inorg. Chem. 2015 2015 19 43 [51] Z. Flisak A. Shiga J. Organomet. Chem. 718 2012 124 130 [52] N. Ivancheva M.Y. Malinskaya S. Ivanchev I. Oleinik A. Kochnev G. Tolstikov Kinet. Catal. 48 2007 829 834 [53] S. Scheiner S. Scheiner Molecular Interactions From van der Waals to Strongly Bound Complexes 1997 Wiley Press [54] J. Parsch J.W. Engels J. Am. Chem. Soc. 124 2002 5664 5672 [55] T. Koopmans Physica 1 1934 104 113 [56] T. Tsuneda J.-W. Song S. Suzuki K. Hirao J. Chem. Phys. 133 2010 174101 [57] R.G. Pearson Proc. Natl. Acad. Sci. 83 1986 8440 8441 [58] R.G. Pearson J. Am. Chem. Soc. 85 1963 3533 3539 [59] R.G. Parr P.K. Chattaraj J. Am. Chem. Soc. 113 1991 1854 1855 [60] R. Furuyama J. Saito S.-i. Ishii M. Mitani S. Matsui Y. Tohi H. Makio N. Matsukawa H. Tanaka T. Fujita J. Mol. Catal. A: Chem. 200 2003 31 42",
      "scopus-id": "84978419529",
      "coredata": {
        "eid": "1-s2.0-S1381116916302606",
        "dc:description": "The mechanism of ethylene polymerization on phenoxy-imine (FI) titanium catalysts was studied theoretically to identify the major factors affecting the catalytic activity. Geometry optimizations of FI ligands, octahedral titanium dichloride complexes, active cationic species, and their π‐complexes with ethylene as well as calculations of the energy profile of chain propagation were performed at the BP86-D3 level. We found that the calculated energy gaps between frontier orbitals (HOMO and LUMO) in the active cations of the catalysts correlate with the experimental activity values. High activities of FI catalysts with α‐Cumyl groups were attributed to smaller HOMO-LUMO gaps due to hyperconjugation between π-systems of α‐Cumyl and (N‐aryl)salicylaldimine moieties in the active cations. The correlation provides a qualitative estimate of the catalytic activity for further design of new FI titanium complexes.",
        "openArchiveArticle": "false",
        "prism:coverDate": "2016-11-30",
        "openaccessUserLicense": null,
        "prism:aggregationType": "Journal",
        "prism:url": "https://api.elsevier.com/content/article/pii/S1381116916302606",
        "dc:creator": [
          {
            "@_fa": "true",
            "$": "Nikitin, Sergey V."
          },
          {
            "@_fa": "true",
            "$": "Nikitin, Viktor V."
          },
          {
            "@_fa": "true",
            "$": "Oleynik, Ivan I."
          },
          {
            "@_fa": "true",
            "$": "Oleynik, Irina V."
          },
          {
            "@_fa": "true",
            "$": "Bagryanskaya, Elena G."
          }
        ],
        "link": [
          {
            "@_fa": "true",
            "@rel": "self",
            "@href": "https://api.elsevier.com/content/article/pii/S1381116916302606"
          },
          {
            "@_fa": "true",
            "@rel": "scidir",
            "@href": "https://www.sciencedirect.com/science/article/pii/S1381116916302606"
          }
        ],
        "dc:format": "application/json",
        "openaccessType": null,
        "pii": "S1381-1169(16)30260-6",
        "prism:volume": "423",
        "prism:publisher": "Elsevier B.V.",
        "dc:title": "Activity of phenoxy-imine titanium catalysts in ethylene polymerization: A quantum chemical approach",
        "prism:copyright": "© 2016 Elsevier B.V. All rights reserved.",
        "openaccess": "0",
        "prism:issn": "13811169",
        "dcterms:subject": [
          {
            "@_fa": "true",
            "$": "Phenoxy-imine"
          },
          {
            "@_fa": "true",
            "$": "FI catalyst"
          },
          {
            "@_fa": "true",
            "$": "Ethylene polymerization"
          },
          {
            "@_fa": "true",
            "$": "Catalytic activity"
          },
          {
            "@_fa": "true",
            "$": "DFT"
          }
        ],
        "openaccessArticle": "false",
        "prism:publicationName": "Journal of Molecular Catalysis A: Chemical",
        "openaccessSponsorType": null,
        "prism:pageRange": "285-292",
        "prism:endingPage": "292",
        "pubType": "fla",
        "prism:coverDisplayDate": "November 2016",
        "prism:doi": "10.1016/j.molcata.2016.07.010",
        "prism:startingPage": "285",
        "dc:identifier": "doi:10.1016/j.molcata.2016.07.010",
        "openaccessSponsorName": null
      },
      "objects": {
        "object": [
          {
            "@category": "thumbnail",
            "@height": "88",
            "@width": "219",
            "@_fa": "true",
            "$": "https://api.elsevier.com/content/object/eid/1-s2.0-S1381116916302606-fx1.sml?httpAccept=%2A%2F%2A",
            "@multimediatype": "GIF image file",
            "@type": "IMAGE-THUMBNAIL",
            "@size": "5725",
            "@ref": "fx1",
            "@mimetype": "image/gif"
          },
          {
            "@category": "thumbnail",
            "@height": "88",
            "@width": "219",
            "@_fa": "true",
            "$": "https://api.elsevier.com/content/object/eid/1-s2.0-S1381116916302606-fx10.sml?httpAccept=%2A%2F%2A",
            "@multimediatype": "GIF image file",
            "@type": "IMAGE-THUMBNAIL",
            "@size": "3115",
            "@ref": "fx10",
            "@mimetype": "image/gif"
          },
          {
            "@category": "thumbnail",
            "@height": "88",
            "@width": "219",
            "@_fa": "true",
            "$": "https://api.elsevier.com/content/object/eid/1-s2.0-S1381116916302606-fx2.sml?httpAccept=%2A%2F%2A",
            "@multimediatype": "GIF image file",
            "@type": "IMAGE-THUMBNAIL",
            "@size": "4942",
            "@ref": "fx2",
            "@mimetype": "image/gif"
          },
          {
            "@category": "thumbnail",
            "@height": "88",
            "@width": "219",
            "@_fa": "true",
            "$": "https://api.elsevier.com/content/object/eid/1-s2.0-S1381116916302606-fx3.sml?httpAccept=%2A%2F%2A",
            "@multimediatype": "GIF image file",
            "@type": "IMAGE-THUMBNAIL",
            "@size": "6207",
            "@ref": "fx3",
            "@mimetype": "image/gif"
          },
          {
            "@category": "thumbnail",
            "@height": "88",
            "@width": "219",
            "@_fa": "true",
            "$": "https://api.elsevier.com/content/object/eid/1-s2.0-S1381116916302606-fx4.sml?httpAccept=%2A%2F%2A",
            "@multimediatype": "GIF image file",
            "@type": "IMAGE-THUMBNAIL",
            "@size": "4892",
            "@ref": "fx4",
            "@mimetype": "image/gif"
          },
          {
            "@category": "thumbnail",
            "@height": "88",
            "@width": "219",
            "@_fa": "true",
            "$": "https://api.elsevier.com/content/object/eid/1-s2.0-S1381116916302606-fx5.sml?httpAccept=%2A%2F%2A",
            "@multimediatype": "GIF image file",
            "@type": "IMAGE-THUMBNAIL",
            "@size": "6217",
            "@ref": "fx5",
            "@mimetype": "image/gif"
          },
          {
            "@category": "thumbnail",
            "@height": "88",
            "@width": "219",
            "@_fa": "true",
            "$": "https://api.elsevier.com/content/object/eid/1-s2.0-S1381116916302606-fx6.sml?httpAccept=%2A%2F%2A",
            "@multimediatype": "GIF image file",
            "@type": "IMAGE-THUMBNAIL",
            "@size": "2886",
            "@ref": "fx6",
            "@mimetype": "image/gif"
          },
          {
            "@category": "thumbnail",
            "@height": "88",
            "@width": "219",
            "@_fa": "true",
            "$": "https://api.elsevier.com/content/object/eid/1-s2.0-S1381116916302606-fx7.sml?httpAccept=%2A%2F%2A",
            "@multimediatype": "GIF image file",
            "@type": "IMAGE-THUMBNAIL",
            "@size": "3291",
            "@ref": "fx7",
            "@mimetype": "image/gif"
          },
          {
            "@category": "thumbnail",
            "@height": "88",
            "@width": "219",
            "@_fa": "true",
            "$": "https://api.elsevier.com/content/object/eid/1-s2.0-S1381116916302606-fx8.sml?httpAccept=%2A%2F%2A",
            "@multimediatype": "GIF image file",
            "@type": "IMAGE-THUMBNAIL",
            "@size": "3490",
            "@ref": "fx8",
            "@mimetype": "image/gif"
          },
          {
            "@category": "thumbnail",
            "@height": "88",
            "@width": "219",
            "@_fa": "true",
            "$": "https://api.elsevier.com/content/object/eid/1-s2.0-S1381116916302606-fx9.sml?httpAccept=%2A%2F%2A",
            "@multimediatype": "GIF image file",
            "@type": "IMAGE-THUMBNAIL",
            "@size": "3672",
            "@ref": "fx9",
            "@mimetype": "image/gif"
          },
          {
            "@category": "thumbnail",
            "@height": "83",
            "@width": "219",
            "@_fa": "true",
            "$": "https://api.elsevier.com/content/object/eid/1-s2.0-S1381116916302606-gr1.sml?httpAccept=%2A%2F%2A",
            "@multimediatype": "GIF image file",
            "@type": "IMAGE-THUMBNAIL",
            "@size": "4099",
            "@ref": "gr1",
            "@mimetype": "image/gif"
          },
          {
            "@category": "thumbnail",
            "@height": "164",
            "@width": "133",
            "@_fa": "true",
            "$": "https://api.elsevier.com/content/object/eid/1-s2.0-S1381116916302606-gr2.sml?httpAccept=%2A%2F%2A",
            "@multimediatype": "GIF image file",
            "@type": "IMAGE-THUMBNAIL",
            "@size": "4449",
            "@ref": "gr2",
            "@mimetype": "image/gif"
          },
          {
            "@category": "thumbnail",
            "@height": "164",
            "@width": "200",
            "@_fa": "true",
            "$": "https://api.elsevier.com/content/object/eid/1-s2.0-S1381116916302606-gr3.sml?httpAccept=%2A%2F%2A",
            "@multimediatype": "GIF image file",
            "@type": "IMAGE-THUMBNAIL",
            "@size": "3834",
            "@ref": "gr3",
            "@mimetype": "image/gif"
          },
          {
            "@category": "thumbnail",
            "@height": "89",
            "@width": "219",
            "@_fa": "true",
            "$": "https://api.elsevier.com/content/object/eid/1-s2.0-S1381116916302606-gr4.sml?httpAccept=%2A%2F%2A",
            "@multimediatype": "GIF image file",
            "@type": "IMAGE-THUMBNAIL",
            "@size": "6381",
            "@ref": "gr4",
            "@mimetype": "image/gif"
          },
          {
            "@category": "thumbnail",
            "@height": "163",
            "@width": "124",
            "@_fa": "true",
            "$": "https://api.elsevier.com/content/object/eid/1-s2.0-S1381116916302606-gr5.sml?httpAccept=%2A%2F%2A",
            "@multimediatype": "GIF image file",
            "@type": "IMAGE-THUMBNAIL",
            "@size": "4388",
            "@ref": "gr5",
            "@mimetype": "image/gif"
          },
          {
            "@category": "thumbnail",
            "@height": "164",
            "@width": "196",
            "@_fa": "true",
            "$": "https://api.elsevier.com/content/object/eid/1-s2.0-S1381116916302606-gr6.sml?httpAccept=%2A%2F%2A",
            "@multimediatype": "GIF image file",
            "@type": "IMAGE-THUMBNAIL",
            "@size": "3792",
            "@ref": "gr6",
            "@mimetype": "image/gif"
          },
          {
            "@category": "thumbnail",
            "@height": "63",
            "@width": "219",
            "@_fa": "true",
            "$": "https://api.elsevier.com/content/object/eid/1-s2.0-S1381116916302606-gr7.sml?httpAccept=%2A%2F%2A",
            "@multimediatype": "GIF image file",
            "@type": "IMAGE-THUMBNAIL",
            "@size": "7477",
            "@ref": "gr7",
            "@mimetype": "image/gif"
          },
          {
            "@category": "thumbnail",
            "@height": "164",
            "@width": "214",
            "@_fa": "true",
            "$": "https://api.elsevier.com/content/object/eid/1-s2.0-S1381116916302606-gr8.sml?httpAccept=%2A%2F%2A",
            "@multimediatype": "GIF image file",
            "@type": "IMAGE-THUMBNAIL",
            "@size": "4918",
            "@ref": "gr8",
            "@mimetype": "image/gif"
          },
          {
            "@category": "standard",
            "@height": "200",
            "@width": "500",
            "@_fa": "true",
            "$": "https://api.elsevier.com/content/object/eid/1-s2.0-S1381116916302606-fx1.jpg?httpAccept=%2A%2F%2A",
            "@multimediatype": "JPEG image file",
            "@type": "IMAGE-DOWNSAMPLED",
            "@size": "20244",
            "@ref": "fx1",
            "@mimetype": "image/jpeg"
          },
          {
            "@category": "standard",
            "@height": "200",
            "@width": "500",
            "@_fa": "true",
            "$": "https://api.elsevier.com/content/object/eid/1-s2.0-S1381116916302606-fx10.jpg?httpAccept=%2A%2F%2A",
            "@multimediatype": "JPEG image file",
            "@type": "IMAGE-DOWNSAMPLED",
            "@size": "9064",
            "@ref": "fx10",
            "@mimetype": "image/jpeg"
          },
          {
            "@category": "standard",
            "@height": "200",
            "@width": "500",
            "@_fa": "true",
            "$": "https://api.elsevier.com/content/object/eid/1-s2.0-S1381116916302606-fx2.jpg?httpAccept=%2A%2F%2A",
            "@multimediatype": "JPEG image file",
            "@type": "IMAGE-DOWNSAMPLED",
            "@size": "5398",
            "@ref": "fx2",
            "@mimetype": "image/jpeg"
          },
          {
            "@category": "standard",
            "@height": "200",
            "@width": "500",
            "@_fa": "true",
            "$": "https://api.elsevier.com/content/object/eid/1-s2.0-S1381116916302606-fx3.jpg?httpAccept=%2A%2F%2A",
            "@multimediatype": "JPEG image file",
            "@type": "IMAGE-DOWNSAMPLED",
            "@size": "5491",
            "@ref": "fx3",
            "@mimetype": "image/jpeg"
          },
          {
            "@category": "standard",
            "@height": "200",
            "@width": "500",
            "@_fa": "true",
            "$": "https://api.elsevier.com/content/object/eid/1-s2.0-S1381116916302606-fx4.jpg?httpAccept=%2A%2F%2A",
            "@multimediatype": "JPEG image file",
            "@type": "IMAGE-DOWNSAMPLED",
            "@size": "5426",
            "@ref": "fx4",
            "@mimetype": "image/jpeg"
          },
          {
            "@category": "standard",
            "@height": "200",
            "@width": "500",
            "@_fa": "true",
            "$": "https://api.elsevier.com/content/object/eid/1-s2.0-S1381116916302606-fx5.jpg?httpAccept=%2A%2F%2A",
            "@multimediatype": "JPEG image file",
            "@type": "IMAGE-DOWNSAMPLED",
            "@size": "5577",
            "@ref": "fx5",
            "@mimetype": "image/jpeg"
          },
          {
            "@category": "standard",
            "@height": "200",
            "@width": "500",
            "@_fa": "true",
            "$": "https://api.elsevier.com/content/object/eid/1-s2.0-S1381116916302606-fx6.jpg?httpAccept=%2A%2F%2A",
            "@multimediatype": "JPEG image file",
            "@type": "IMAGE-DOWNSAMPLED",
            "@size": "7943",
            "@ref": "fx6",
            "@mimetype": "image/jpeg"
          },
          {
            "@category": "standard",
            "@height": "200",
            "@width": "500",
            "@_fa": "true",
            "$": "https://api.elsevier.com/content/object/eid/1-s2.0-S1381116916302606-fx7.jpg?httpAccept=%2A%2F%2A",
            "@multimediatype": "JPEG image file",
            "@type": "IMAGE-DOWNSAMPLED",
            "@size": "9648",
            "@ref": "fx7",
            "@mimetype": "image/jpeg"
          },
          {
            "@category": "standard",
            "@height": "200",
            "@width": "500",
            "@_fa": "true",
            "$": "https://api.elsevier.com/content/object/eid/1-s2.0-S1381116916302606-fx8.jpg?httpAccept=%2A%2F%2A",
            "@multimediatype": "JPEG image file",
            "@type": "IMAGE-DOWNSAMPLED",
            "@size": "8137",
            "@ref": "fx8",
            "@mimetype": "image/jpeg"
          },
          {
            "@category": "standard",
            "@height": "200",
            "@width": "500",
            "@_fa": "true",
            "$": "https://api.elsevier.com/content/object/eid/1-s2.0-S1381116916302606-fx9.jpg?httpAccept=%2A%2F%2A",
            "@multimediatype": "JPEG image file",
            "@type": "IMAGE-DOWNSAMPLED",
            "@size": "8998",
            "@ref": "fx9",
            "@mimetype": "image/jpeg"
          },
          {
            "@category": "standard",
            "@height": "256",
            "@width": "674",
            "@_fa": "true",
            "$": "https://api.elsevier.com/content/object/eid/1-s2.0-S1381116916302606-gr1.jpg?httpAccept=%2A%2F%2A",
            "@multimediatype": "JPEG image file",
            "@type": "IMAGE-DOWNSAMPLED",
            "@size": "28326",
            "@ref": "gr1",
            "@mimetype": "image/jpeg"
          },
          {
            "@category": "standard",
            "@height": "873",
            "@width": "710",
            "@_fa": "true",
            "$": "https://api.elsevier.com/content/object/eid/1-s2.0-S1381116916302606-gr2.jpg?httpAccept=%2A%2F%2A",
            "@multimediatype": "JPEG image file",
            "@type": "IMAGE-DOWNSAMPLED",
            "@size": "74814",
            "@ref": "gr2",
            "@mimetype": "image/jpeg"
          },
          {
            "@category": "standard",
            "@height": "323",
            "@width": "393",
            "@_fa": "true",
            "$": "https://api.elsevier.com/content/object/eid/1-s2.0-S1381116916302606-gr3.jpg?httpAccept=%2A%2F%2A",
            "@multimediatype": "JPEG image file",
            "@type": "IMAGE-DOWNSAMPLED",
            "@size": "18145",
            "@ref": "gr3",
            "@mimetype": "image/jpeg"
          },
          {
            "@category": "standard",
            "@height": "285",
            "@width": "701",
            "@_fa": "true",
            "$": "https://api.elsevier.com/content/object/eid/1-s2.0-S1381116916302606-gr4.jpg?httpAccept=%2A%2F%2A",
            "@multimediatype": "JPEG image file",
            "@type": "IMAGE-DOWNSAMPLED",
            "@size": "39723",
            "@ref": "gr4",
            "@mimetype": "image/jpeg"
          },
          {
            "@category": "standard",
            "@height": "255",
            "@width": "194",
            "@_fa": "true",
            "$": "https://api.elsevier.com/content/object/eid/1-s2.0-S1381116916302606-gr5.jpg?httpAccept=%2A%2F%2A",
            "@multimediatype": "JPEG image file",
            "@type": "IMAGE-DOWNSAMPLED",
            "@size": "11034",
            "@ref": "gr5",
            "@mimetype": "image/jpeg"
          },
          {
            "@category": "standard",
            "@height": "329",
            "@width": "393",
            "@_fa": "true",
            "$": "https://api.elsevier.com/content/object/eid/1-s2.0-S1381116916302606-gr6.jpg?httpAccept=%2A%2F%2A",
            "@multimediatype": "JPEG image file",
            "@type": "IMAGE-DOWNSAMPLED",
            "@size": "17936",
            "@ref": "gr6",
            "@mimetype": "image/jpeg"
          },
          {
            "@category": "standard",
            "@height": "184",
            "@width": "640",
            "@_fa": "true",
            "$": "https://api.elsevier.com/content/object/eid/1-s2.0-S1381116916302606-gr7.jpg?httpAccept=%2A%2F%2A",
            "@multimediatype": "JPEG image file",
            "@type": "IMAGE-DOWNSAMPLED",
            "@size": "32065",
            "@ref": "gr7",
            "@mimetype": "image/jpeg"
          },
          {
            "@category": "standard",
            "@height": "455",
            "@width": "593",
            "@_fa": "true",
            "$": "https://api.elsevier.com/content/object/eid/1-s2.0-S1381116916302606-gr8.jpg?httpAccept=%2A%2F%2A",
            "@multimediatype": "JPEG image file",
            "@type": "IMAGE-DOWNSAMPLED",
            "@size": "42957",
            "@ref": "gr8",
            "@mimetype": "image/jpeg"
          },
          {
            "@category": "high",
            "@height": "886",
            "@width": "2213",
            "@_fa": "true",
            "$": "https://api.elsevier.com/content/object/eid/1-s2.0-S1381116916302606-fx1_lrg.jpg?httpAccept=%2A%2F%2A",
            "@multimediatype": "JPEG image file",
            "@type": "IMAGE-HIGH-RES",
            "@size": "148919",
            "@ref": "fx1",
            "@mimetype": "image/jpeg"
          },
          {
            "@category": "high",
            "@height": "886",
            "@width": "2213",
            "@_fa": "true",
            "$": "https://api.elsevier.com/content/object/eid/1-s2.0-S1381116916302606-fx10_lrg.jpg?httpAccept=%2A%2F%2A",
            "@multimediatype": "JPEG image file",
            "@type": "IMAGE-HIGH-RES",
            "@size": "57314",
            "@ref": "fx10",
            "@mimetype": "image/jpeg"
          },
          {
            "@category": "high",
            "@height": "886",
            "@width": "2213",
            "@_fa": "true",
            "$": "https://api.elsevier.com/content/object/eid/1-s2.0-S1381116916302606-fx2_lrg.jpg?httpAccept=%2A%2F%2A",
            "@multimediatype": "JPEG image file",
            "@type": "IMAGE-HIGH-RES",
            "@size": "43232",
            "@ref": "fx2",
            "@mimetype": "image/jpeg"
          },
          {
            "@category": "high",
            "@height": "886",
            "@width": "2213",
            "@_fa": "true",
            "$": "https://api.elsevier.com/content/object/eid/1-s2.0-S1381116916302606-fx3_lrg.jpg?httpAccept=%2A%2F%2A",
            "@multimediatype": "JPEG image file",
            "@type": "IMAGE-HIGH-RES",
            "@size": "44800",
            "@ref": "fx3",
            "@mimetype": "image/jpeg"
          },
          {
            "@category": "high",
            "@height": "886",
            "@width": "2213",
            "@_fa": "true",
            "$": "https://api.elsevier.com/content/object/eid/1-s2.0-S1381116916302606-fx4_lrg.jpg?httpAccept=%2A%2F%2A",
            "@multimediatype": "JPEG image file",
            "@type": "IMAGE-HIGH-RES",
            "@size": "42150",
            "@ref": "fx4",
            "@mimetype": "image/jpeg"
          },
          {
            "@category": "high",
            "@height": "886",
            "@width": "2213",
            "@_fa": "true",
            "$": "https://api.elsevier.com/content/object/eid/1-s2.0-S1381116916302606-fx5_lrg.jpg?httpAccept=%2A%2F%2A",
            "@multimediatype": "JPEG image file",
            "@type": "IMAGE-HIGH-RES",
            "@size": "45478",
            "@ref": "fx5",
            "@mimetype": "image/jpeg"
          },
          {
            "@category": "high",
            "@height": "886",
            "@width": "2213",
            "@_fa": "true",
            "$": "https://api.elsevier.com/content/object/eid/1-s2.0-S1381116916302606-fx6_lrg.jpg?httpAccept=%2A%2F%2A",
            "@multimediatype": "JPEG image file",
            "@type": "IMAGE-HIGH-RES",
            "@size": "50782",
            "@ref": "fx6",
            "@mimetype": "image/jpeg"
          },
          {
            "@category": "high",
            "@height": "886",
            "@width": "2213",
            "@_fa": "true",
            "$": "https://api.elsevier.com/content/object/eid/1-s2.0-S1381116916302606-fx7_lrg.jpg?httpAccept=%2A%2F%2A",
            "@multimediatype": "JPEG image file",
            "@type": "IMAGE-HIGH-RES",
            "@size": "62121",
            "@ref": "fx7",
            "@mimetype": "image/jpeg"
          },
          {
            "@category": "high",
            "@height": "886",
            "@width": "2213",
            "@_fa": "true",
            "$": "https://api.elsevier.com/content/object/eid/1-s2.0-S1381116916302606-fx8_lrg.jpg?httpAccept=%2A%2F%2A",
            "@multimediatype": "JPEG image file",
            "@type": "IMAGE-HIGH-RES",
            "@size": "59081",
            "@ref": "fx8",
            "@mimetype": "image/jpeg"
          },
          {
            "@category": "high",
            "@height": "886",
            "@width": "2213",
            "@_fa": "true",
            "$": "https://api.elsevier.com/content/object/eid/1-s2.0-S1381116916302606-fx9_lrg.jpg?httpAccept=%2A%2F%2A",
            "@multimediatype": "JPEG image file",
            "@type": "IMAGE-HIGH-RES",
            "@size": "61567",
            "@ref": "fx9",
            "@mimetype": "image/jpeg"
          },
          {
            "@category": "high",
            "@height": "1132",
            "@width": "2986",
            "@_fa": "true",
            "$": "https://api.elsevier.com/content/object/eid/1-s2.0-S1381116916302606-gr1_lrg.jpg?httpAccept=%2A%2F%2A",
            "@multimediatype": "JPEG image file",
            "@type": "IMAGE-HIGH-RES",
            "@size": "221118",
            "@ref": "gr1",
            "@mimetype": "image/jpeg"
          },
          {
            "@category": "high",
            "@height": "3868",
            "@width": "3146",
            "@_fa": "true",
            "$": "https://api.elsevier.com/content/object/eid/1-s2.0-S1381116916302606-gr2_lrg.jpg?httpAccept=%2A%2F%2A",
            "@multimediatype": "JPEG image file",
            "@type": "IMAGE-HIGH-RES",
            "@size": "627212",
            "@ref": "gr2",
            "@mimetype": "image/jpeg"
          },
          {
            "@category": "high",
            "@height": "1431",
            "@width": "1743",
            "@_fa": "true",
            "$": "https://api.elsevier.com/content/object/eid/1-s2.0-S1381116916302606-gr3_lrg.jpg?httpAccept=%2A%2F%2A",
            "@multimediatype": "JPEG image file",
            "@type": "IMAGE-HIGH-RES",
            "@size": "131481",
            "@ref": "gr3",
            "@mimetype": "image/jpeg"
          },
          {
            "@category": "high",
            "@height": "1264",
            "@width": "3104",
            "@_fa": "true",
            "$": "https://api.elsevier.com/content/object/eid/1-s2.0-S1381116916302606-gr4_lrg.jpg?httpAccept=%2A%2F%2A",
            "@multimediatype": "JPEG image file",
            "@type": "IMAGE-HIGH-RES",
            "@size": "335970",
            "@ref": "gr4",
            "@mimetype": "image/jpeg"
          },
          {
            "@category": "high",
            "@height": "1132",
            "@width": "861",
            "@_fa": "true",
            "$": "https://api.elsevier.com/content/object/eid/1-s2.0-S1381116916302606-gr5_lrg.jpg?httpAccept=%2A%2F%2A",
            "@multimediatype": "JPEG image file",
            "@type": "IMAGE-HIGH-RES",
            "@size": "77276",
            "@ref": "gr5",
            "@mimetype": "image/jpeg"
          },
          {
            "@category": "high",
            "@height": "1458",
            "@width": "1743",
            "@_fa": "true",
            "$": "https://api.elsevier.com/content/object/eid/1-s2.0-S1381116916302606-gr6_lrg.jpg?httpAccept=%2A%2F%2A",
            "@multimediatype": "JPEG image file",
            "@type": "IMAGE-HIGH-RES",
            "@size": "127065",
            "@ref": "gr6",
            "@mimetype": "image/jpeg"
          },
          {
            "@category": "high",
            "@height": "813",
            "@width": "2833",
            "@_fa": "true",
            "$": "https://api.elsevier.com/content/object/eid/1-s2.0-S1381116916302606-gr7_lrg.jpg?httpAccept=%2A%2F%2A",
            "@multimediatype": "JPEG image file",
            "@type": "IMAGE-HIGH-RES",
            "@size": "293463",
            "@ref": "gr7",
            "@mimetype": "image/jpeg"
          },
          {
            "@category": "high",
            "@height": "2014",
            "@width": "2625",
            "@_fa": "true",
            "$": "https://api.elsevier.com/content/object/eid/1-s2.0-S1381116916302606-gr8_lrg.jpg?httpAccept=%2A%2F%2A",
            "@multimediatype": "JPEG image file",
            "@type": "IMAGE-HIGH-RES",
            "@size": "302271",
            "@ref": "gr8",
            "@mimetype": "image/jpeg"
          },
          {
            "@category": "standard",
            "@_fa": "true",
            "$": "https://api.elsevier.com/content/object/eid/1-s2.0-S1381116916302606-mmc1.docx?httpAccept=%2A%2F%2A",
            "@multimediatype": "Microsoft Word file",
            "@type": "APPLICATION",
            "@size": "1508834",
            "@ref": "mmc1",
            "@mimetype": "application/word"
          },
          {
            "@category": "thumbnail",
            "@height": "41",
            "@width": "191",
            "@_fa": "true",
            "$": "https://api.elsevier.com/content/object/eid/1-s2.0-S1381116916302606-si1.gif?httpAccept=%2A%2F%2A",
            "@multimediatype": "GIF image file",
            "@type": "ALTIMG",
            "@size": "991",
            "@ref": "si1",
            "@mimetype": "image/gif"
          },
          {
            "@category": "thumbnail",
            "@height": "16",
            "@width": "60",
            "@_fa": "true",
            "$": "https://api.elsevier.com/content/object/eid/1-s2.0-S1381116916302606-si10.gif?httpAccept=%2A%2F%2A",
            "@multimediatype": "GIF image file",
            "@type": "ALTIMG",
            "@size": "355",
            "@ref": "si10",
            "@mimetype": "image/gif"
          },
          {
            "@category": "thumbnail",
            "@height": "34",
            "@width": "237",
            "@_fa": "true",
            "$": "https://api.elsevier.com/content/object/eid/1-s2.0-S1381116916302606-si11.gif?httpAccept=%2A%2F%2A",
            "@multimediatype": "GIF image file",
            "@type": "ALTIMG",
            "@size": "880",
            "@ref": "si11",
            "@mimetype": "image/gif"
          },
          {
            "@category": "thumbnail",
            "@height": "11",
            "@width": "7",
            "@_fa": "true",
            "$": "https://api.elsevier.com/content/object/eid/1-s2.0-S1381116916302606-si12.gif?httpAccept=%2A%2F%2A",
            "@multimediatype": "GIF image file",
            "@type": "ALTIMG",
            "@size": "108",
            "@ref": "si12",
            "@mimetype": "image/gif"
          },
          {
            "@category": "thumbnail",
            "@height": "11",
            "@width": "12",
            "@_fa": "true",
            "$": "https://api.elsevier.com/content/object/eid/1-s2.0-S1381116916302606-si13.gif?httpAccept=%2A%2F%2A",
            "@multimediatype": "GIF image file",
            "@type": "ALTIMG",
            "@size": "131",
            "@ref": "si13",
            "@mimetype": "image/gif"
          },
          {
            "@category": "thumbnail",
            "@height": "16",
            "@width": "39",
            "@_fa": "true",
            "$": "https://api.elsevier.com/content/object/eid/1-s2.0-S1381116916302606-si2.gif?httpAccept=%2A%2F%2A",
            "@multimediatype": "GIF image file",
            "@type": "ALTIMG",
            "@size": "235",
            "@ref": "si2",
            "@mimetype": "image/gif"
          },
          {
            "@category": "thumbnail",
            "@height": "13",
            "@width": "35",
            "@_fa": "true",
            "$": "https://api.elsevier.com/content/object/eid/1-s2.0-S1381116916302606-si3.gif?httpAccept=%2A%2F%2A",
            "@multimediatype": "GIF image file",
            "@type": "ALTIMG",
            "@size": "220",
            "@ref": "si3",
            "@mimetype": "image/gif"
          },
          {
            "@category": "thumbnail",
            "@height": "11",
            "@width": "17",
            "@_fa": "true",
            "$": "https://api.elsevier.com/content/object/eid/1-s2.0-S1381116916302606-si4.gif?httpAccept=%2A%2F%2A",
            "@multimediatype": "GIF image file",
            "@type": "ALTIMG",
            "@size": "151",
            "@ref": "si4",
            "@mimetype": "image/gif"
          },
          {
            "@category": "thumbnail",
            "@height": "16",
            "@width": "42",
            "@_fa": "true",
            "$": "https://api.elsevier.com/content/object/eid/1-s2.0-S1381116916302606-si5.gif?httpAccept=%2A%2F%2A",
            "@multimediatype": "GIF image file",
            "@type": "ALTIMG",
            "@size": "270",
            "@ref": "si5",
            "@mimetype": "image/gif"
          },
          {
            "@category": "thumbnail",
            "@height": "16",
            "@width": "155",
            "@_fa": "true",
            "$": "https://api.elsevier.com/content/object/eid/1-s2.0-S1381116916302606-si6.gif?httpAccept=%2A%2F%2A",
            "@multimediatype": "GIF image file",
            "@type": "ALTIMG",
            "@size": "635",
            "@ref": "si6",
            "@mimetype": "image/gif"
          },
          {
            "@category": "thumbnail",
            "@height": "14",
            "@width": "22",
            "@_fa": "true",
            "$": "https://api.elsevier.com/content/object/eid/1-s2.0-S1381116916302606-si7.gif?httpAccept=%2A%2F%2A",
            "@multimediatype": "GIF image file",
            "@type": "ALTIMG",
            "@size": "170",
            "@ref": "si7",
            "@mimetype": "image/gif"
          },
          {
            "@category": "thumbnail",
            "@height": "15",
            "@width": "38",
            "@_fa": "true",
            "$": "https://api.elsevier.com/content/object/eid/1-s2.0-S1381116916302606-si8.gif?httpAccept=%2A%2F%2A",
            "@multimediatype": "GIF image file",
            "@type": "ALTIMG",
            "@size": "225",
            "@ref": "si8",
            "@mimetype": "image/gif"
          },
          {
            "@category": "thumbnail",
            "@height": "15",
            "@width": "44",
            "@_fa": "true",
            "$": "https://api.elsevier.com/content/object/eid/1-s2.0-S1381116916302606-si9.gif?httpAccept=%2A%2F%2A",
            "@multimediatype": "GIF image file",
            "@type": "ALTIMG",
            "@size": "265",
            "@ref": "si9",
            "@mimetype": "image/gif"
          }
        ]
      },
      "link": {
        "@rel": "abstract",
        "@href": "https://api.elsevier.com/content/abstract/scopus_id/84978419529"
      }
    }
  }
}