{
  "metadata": {
    "title": "Highly selective catalytic preparation of bis(4-oxo-benzo-2-cyclohexen-1-yl) amine from 1-naphthylamine oxidation over metalloporphyrin catalysts by molecular oxygen under air pressure and by hydrogen peroxide",
    "authors": "; ; ",
    "journal": "Journal of Molecular Catalysis A: Chemical",
    "date": "2006-06-01",
    "doi": "10.1016/j.molcata.2006.02.039",
    "abstract": "",
    "uri": "https://api.elsevier.com/content/article/pii/S1381116906005528",
    "pii": "S1381116906005528"
  },
  "fulltext": {
    "full-text-retrieval-response": {
      "scopus-eid": "2-s2.0-33646161460",
      "originalText": "serial JL 271358 291210 291744 291790 291809 31 Journal of Molecular Catalysis A: Chemical JOURNALMOLECULARCATALYSISACHEMICAL 2006-03-20 2006-03-20 2015-10-23T13:17:20 1-s2.0-S1381116906005528 S1381-1169(06)00552-8 S1381116906005528 10.1016/j.molcata.2006.02.039 S300 S300.2 FULL-TEXT 1-s2.0-S1381116906X02339 2015-10-23T11:57:56.660425-04:00 0 0 20060601 2006 2006-03-20T00:00:00Z absattachment articleinfo articletitlenorm authfirstinitialnorm authfirstsurnamenorm cid cids contenttype copyright crossmark dateloaded dateloadedtxt datesearch datesort dateupdated dco docsubtype doctype doi eid ewtransactionid hubeid indexeddate issfirst issn issnnorm issuelist itemstage itemtransactionid itemweight openaccess openarchive pg pgfirst pglast pii piinorm pubdatestart pubdatetxt pubyr sortorder srctitle srctitlenorm srctype ssids alllist content subj subheadings tomb volfirst volissue volumelist webpdf webpdfpagecount yearnav figure table body mmlmath acknowledge affil articletitle auth authfirstini authfull authkeywords authlast primabst ref specialabst 1381-1169 13811169 false 252 252 1 2 1 2 Volume 252, Issues 1–2 11 56 62 56 62 20060601 1 June 2006 2006-06-01 2006 article fla Copyright © 2006 Elsevier B.V. All rights reserved. HIGHLYSELECTIVECATALYTICPREPARATIONBIS4OXOBENZO2CYCLOHEXEN1YLAMINE1NAPHTHYLAMINEOXIDATIONOVERMETALLOPORPHYRINCATALYSTSBYMOLECULAROXYGENUNDERAIRPRESSUREBYHYDROGENPEROXIDE CHEN T 1 Introduction 2 Experimental 2.1 Reagents and instrument 2.2 Catalytic reactions 2.3 Product characterization 3 Result and discussion 3.1 Catalytic mechanism 3.2 Catalytic condition optimization 3.2.1 Activities of different MTPP catalysts and their amount selection 3.2.2 Influence of the amount of sodium hydroxide 3.2.3 Reacting time selections 3.2.4 Temperature impacting 3.2.5 Influences of oxidant amount and reacting media for (H2O2 +FeTPPCl) system 4 Conclusions Acknowledgement References HUSZANK 2005 224 R HAN 2005 402 J TRAYLOR 1984 279 P LYONS 1990 181 J EVANS 2000 1541 S EVANS 2001 174 S YAN 2000 65 Y YAN 2005 387 Y MARTIROSYAN 2004 1488 G SILVA 2004 200 E ITO 2005 834 R CHEN 2005 55 T XIA 1999 42 R MOON 1993 6992 D YANG 1992 2182 H SHONO 1984 811 T ADLER 1967 4761 A LINDSEY 1987 827 836 J XIE 1987 J APPLICATIONIRSPECTRAINORGANICPHARMICCHEMISTRY FRESENIUS 1989 W TABLESSPECTRALDATAFORSTRUCTUREDETERMINATIONORGANICCOMPOUNDS JEAN 1998 2167 B SHAIK 1998 193 S KUNAI 1986 6012 A PANICUCCI 1990 6063 R TRAYLOR 1990 178 T PALMER 1979 G PORPHYRINS SCHMITZ 1995 47 B TRAYLOR 1984 279 P POORTER 1984 1895 B ARMENGOL 1999 1915 E DING 1997 693 K KORBER 2002 7163 K CHENX2006X56 CHENX2006X56X62 CHENX2006X56XT CHENX2006X56X62XT item S1381-1169(06)00552-8 S1381116906005528 1-s2.0-S1381116906005528 10.1016/j.molcata.2006.02.039 271358 2015-10-23T11:57:56.660425-04:00 2006-06-01 1-s2.0-S1381116906005528-main.pdf https://s3.amazonaws.com/prod-ucs-content-store-us-east/content/pii:S1381116906005528/MAIN/application/pdf/ae3d679d886803ad09ea79408b809bad/main.pdf https://s3-eu-west-1.amazonaws.com/prod-ucs-content-store-eu-west/content/pii:S1381116906005528/MAIN/application/pdf/ae3d679d886803ad09ea79408b809bad/main.pdf main.pdf pdf true 366933 MAIN 7 1-s2.0-S1381116906005528-main_1.png https://s3-eu-west-1.amazonaws.com/prod-ucs-content-store-eu-west/content/pii:S1381116906005528/PREVIEW/image/png/d7358c0cd1608648629ce880f41e4883/main_1.png https://s3.amazonaws.com/prod-ucs-content-store-us-east/content/pii:S1381116906005528/PREVIEW/image/png/d7358c0cd1608648629ce880f41e4883/main_1.png main_1.png png 68543 849 656 IMAGE-WEB-PDF 1 1-s2.0-S1381116906005528-sc2_lrg.jpg https://s3-eu-west-1.amazonaws.com/prod-ucs-content-store-eu-west/content/pii:S1381116906005528/sc2/HIGHRES/image/jpeg/b5ed86c0f4655096ea9a4e29f7082c64/sc2_lrg.jpg https://s3.amazonaws.com/prod-ucs-content-store-us-east/content/pii:S1381116906005528/sc2/HIGHRES/image/jpeg/b5ed86c0f4655096ea9a4e29f7082c64/sc2_lrg.jpg sc2 sc2_lrg.jpg jpg 247314 1470 2164 IMAGE-HIGH-RES 1-s2.0-S1381116906005528-sc1_lrg.jpg https://s3-eu-west-1.amazonaws.com/prod-ucs-content-store-eu-west/content/pii:S1381116906005528/sc1/HIGHRES/image/jpeg/9cc1a11409a17eac78d82dd7ab5b857c/sc1_lrg.jpg https://s3.amazonaws.com/prod-ucs-content-store-us-east/content/pii:S1381116906005528/sc1/HIGHRES/image/jpeg/9cc1a11409a17eac78d82dd7ab5b857c/sc1_lrg.jpg sc1 sc1_lrg.jpg jpg 98648 408 1472 IMAGE-HIGH-RES 1-s2.0-S1381116906005528-gr7_lrg.jpg https://s3-eu-west-1.amazonaws.com/prod-ucs-content-store-eu-west/content/pii:S1381116906005528/gr7/HIGHRES/image/jpeg/4f6ee4b7054ad45a6ebff92ffd153e52/gr7_lrg.jpg https://s3.amazonaws.com/prod-ucs-content-store-us-east/content/pii:S1381116906005528/gr7/HIGHRES/image/jpeg/4f6ee4b7054ad45a6ebff92ffd153e52/gr7_lrg.jpg gr7 gr7_lrg.jpg jpg 114781 1340 1668 IMAGE-HIGH-RES 1-s2.0-S1381116906005528-gr6_lrg.jpg https://s3.amazonaws.com/prod-ucs-content-store-us-east/content/pii:S1381116906005528/gr6/HIGHRES/image/jpeg/cf5b6890dc8ed23dfc256056936c82c2/gr6_lrg.jpg https://s3-eu-west-1.amazonaws.com/prod-ucs-content-store-eu-west/content/pii:S1381116906005528/gr6/HIGHRES/image/jpeg/cf5b6890dc8ed23dfc256056936c82c2/gr6_lrg.jpg gr6 gr6_lrg.jpg jpg 120865 1273 1673 IMAGE-HIGH-RES 1-s2.0-S1381116906005528-gr5_lrg.jpg https://s3-eu-west-1.amazonaws.com/prod-ucs-content-store-eu-west/content/pii:S1381116906005528/gr5/HIGHRES/image/jpeg/6e4a4bbedd4c42378a3fb1f4174e2598/gr5_lrg.jpg https://s3.amazonaws.com/prod-ucs-content-store-us-east/content/pii:S1381116906005528/gr5/HIGHRES/image/jpeg/6e4a4bbedd4c42378a3fb1f4174e2598/gr5_lrg.jpg gr5 gr5_lrg.jpg jpg 162690 1310 1701 IMAGE-HIGH-RES 1-s2.0-S1381116906005528-gr4_lrg.jpg https://s3.amazonaws.com/prod-ucs-content-store-us-east/content/pii:S1381116906005528/gr4/HIGHRES/image/jpeg/1610da2333745de1b30c43b2cd3a6296/gr4_lrg.jpg https://s3-eu-west-1.amazonaws.com/prod-ucs-content-store-eu-west/content/pii:S1381116906005528/gr4/HIGHRES/image/jpeg/1610da2333745de1b30c43b2cd3a6296/gr4_lrg.jpg gr4 gr4_lrg.jpg jpg 119612 1274 1678 IMAGE-HIGH-RES 1-s2.0-S1381116906005528-gr3_lrg.jpg https://s3-eu-west-1.amazonaws.com/prod-ucs-content-store-eu-west/content/pii:S1381116906005528/gr3/HIGHRES/image/jpeg/c32a2c663465ab46c2d9b1b5f15dcc90/gr3_lrg.jpg https://s3.amazonaws.com/prod-ucs-content-store-us-east/content/pii:S1381116906005528/gr3/HIGHRES/image/jpeg/c32a2c663465ab46c2d9b1b5f15dcc90/gr3_lrg.jpg gr3 gr3_lrg.jpg jpg 137241 1330 1691 IMAGE-HIGH-RES 1-s2.0-S1381116906005528-gr2_lrg.jpg https://s3-eu-west-1.amazonaws.com/prod-ucs-content-store-eu-west/content/pii:S1381116906005528/gr2/HIGHRES/image/jpeg/b94280fe1042e4cd902d9ac9f7e68860/gr2_lrg.jpg https://s3.amazonaws.com/prod-ucs-content-store-us-east/content/pii:S1381116906005528/gr2/HIGHRES/image/jpeg/b94280fe1042e4cd902d9ac9f7e68860/gr2_lrg.jpg gr2 gr2_lrg.jpg jpg 272582 2032 1232 IMAGE-HIGH-RES 1-s2.0-S1381116906005528-gr1_lrg.jpg https://s3-eu-west-1.amazonaws.com/prod-ucs-content-store-eu-west/content/pii:S1381116906005528/gr1/HIGHRES/image/jpeg/8f669ef5b637bfb62b3e174eaed05229/gr1_lrg.jpg https://s3.amazonaws.com/prod-ucs-content-store-us-east/content/pii:S1381116906005528/gr1/HIGHRES/image/jpeg/8f669ef5b637bfb62b3e174eaed05229/gr1_lrg.jpg gr1 gr1_lrg.jpg jpg 252866 966 2609 IMAGE-HIGH-RES 1-s2.0-S1381116906005528-fx1_lrg.jpg https://s3-eu-west-1.amazonaws.com/prod-ucs-content-store-eu-west/content/pii:S1381116906005528/fx1/HIGHRES/image/jpeg/6c8e546d63fa4eae6a4547df41ce8f3c/fx1_lrg.jpg https://s3.amazonaws.com/prod-ucs-content-store-us-east/content/pii:S1381116906005528/fx1/HIGHRES/image/jpeg/6c8e546d63fa4eae6a4547df41ce8f3c/fx1_lrg.jpg fx1 true fx1_lrg.jpg jpg 98648 408 1472 IMAGE-HIGH-RES 1-s2.0-S1381116906005528-sc2.jpg https://s3-eu-west-1.amazonaws.com/prod-ucs-content-store-eu-west/content/pii:S1381116906005528/sc2/DOWNSAMPLED/image/jpeg/aa751c0ace594806208caff4170fb111/sc2.jpg https://s3.amazonaws.com/prod-ucs-content-store-us-east/content/pii:S1381116906005528/sc2/DOWNSAMPLED/image/jpeg/aa751c0ace594806208caff4170fb111/sc2.jpg sc2 sc2.jpg jpg 46719 332 489 IMAGE-DOWNSAMPLED 1-s2.0-S1381116906005528-sc1.jpg https://s3.amazonaws.com/prod-ucs-content-store-us-east/content/pii:S1381116906005528/sc1/DOWNSAMPLED/image/jpeg/11f45a7f647000ddeeb6521e6e6d080c/sc1.jpg https://s3-eu-west-1.amazonaws.com/prod-ucs-content-store-eu-west/content/pii:S1381116906005528/sc1/DOWNSAMPLED/image/jpeg/11f45a7f647000ddeeb6521e6e6d080c/sc1.jpg sc1 sc1.jpg jpg 24839 92 332 IMAGE-DOWNSAMPLED 1-s2.0-S1381116906005528-gr7.jpg https://s3-eu-west-1.amazonaws.com/prod-ucs-content-store-eu-west/content/pii:S1381116906005528/gr7/DOWNSAMPLED/image/jpeg/8c1c85869f7a6e62773a4995c2e0109c/gr7.jpg https://s3.amazonaws.com/prod-ucs-content-store-us-east/content/pii:S1381116906005528/gr7/DOWNSAMPLED/image/jpeg/8c1c85869f7a6e62773a4995c2e0109c/gr7.jpg gr7 gr7.jpg jpg 28895 302 376 IMAGE-DOWNSAMPLED 1-s2.0-S1381116906005528-gr6.jpg https://s3.amazonaws.com/prod-ucs-content-store-us-east/content/pii:S1381116906005528/gr6/DOWNSAMPLED/image/jpeg/09240879c1c460fb5c3cceb79f43fec7/gr6.jpg https://s3-eu-west-1.amazonaws.com/prod-ucs-content-store-eu-west/content/pii:S1381116906005528/gr6/DOWNSAMPLED/image/jpeg/09240879c1c460fb5c3cceb79f43fec7/gr6.jpg gr6 gr6.jpg jpg 30932 288 378 IMAGE-DOWNSAMPLED 1-s2.0-S1381116906005528-gr5.jpg https://s3.amazonaws.com/prod-ucs-content-store-us-east/content/pii:S1381116906005528/gr5/DOWNSAMPLED/image/jpeg/7a1aaad78c7d049f45b6514b868130b7/gr5.jpg https://s3-eu-west-1.amazonaws.com/prod-ucs-content-store-eu-west/content/pii:S1381116906005528/gr5/DOWNSAMPLED/image/jpeg/7a1aaad78c7d049f45b6514b868130b7/gr5.jpg gr5 gr5.jpg jpg 38842 296 384 IMAGE-DOWNSAMPLED 1-s2.0-S1381116906005528-gr4.jpg https://s3-eu-west-1.amazonaws.com/prod-ucs-content-store-eu-west/content/pii:S1381116906005528/gr4/DOWNSAMPLED/image/jpeg/02d2eede32c47cff63c8111b87463b91/gr4.jpg https://s3.amazonaws.com/prod-ucs-content-store-us-east/content/pii:S1381116906005528/gr4/DOWNSAMPLED/image/jpeg/02d2eede32c47cff63c8111b87463b91/gr4.jpg gr4 gr4.jpg jpg 29679 288 379 IMAGE-DOWNSAMPLED 1-s2.0-S1381116906005528-gr3.jpg https://s3-eu-west-1.amazonaws.com/prod-ucs-content-store-eu-west/content/pii:S1381116906005528/gr3/DOWNSAMPLED/image/jpeg/5651364663d0ff91f181cff71d7f939c/gr3.jpg https://s3.amazonaws.com/prod-ucs-content-store-us-east/content/pii:S1381116906005528/gr3/DOWNSAMPLED/image/jpeg/5651364663d0ff91f181cff71d7f939c/gr3.jpg gr3 gr3.jpg jpg 34090 300 382 IMAGE-DOWNSAMPLED 1-s2.0-S1381116906005528-gr2.jpg https://s3-eu-west-1.amazonaws.com/prod-ucs-content-store-eu-west/content/pii:S1381116906005528/gr2/DOWNSAMPLED/image/jpeg/cda2cc1c1fd98e7fe9a57e0ad7d3c25f/gr2.jpg https://s3.amazonaws.com/prod-ucs-content-store-us-east/content/pii:S1381116906005528/gr2/DOWNSAMPLED/image/jpeg/cda2cc1c1fd98e7fe9a57e0ad7d3c25f/gr2.jpg gr2 gr2.jpg jpg 52169 459 278 IMAGE-DOWNSAMPLED 1-s2.0-S1381116906005528-gr1.jpg https://s3-eu-west-1.amazonaws.com/prod-ucs-content-store-eu-west/content/pii:S1381116906005528/gr1/DOWNSAMPLED/image/jpeg/7aa0c44227bbfdae0eb6f4c11fe799d9/gr1.jpg https://s3.amazonaws.com/prod-ucs-content-store-us-east/content/pii:S1381116906005528/gr1/DOWNSAMPLED/image/jpeg/7aa0c44227bbfdae0eb6f4c11fe799d9/gr1.jpg gr1 gr1.jpg jpg 38118 218 589 IMAGE-DOWNSAMPLED 1-s2.0-S1381116906005528-fx1.jpg https://s3-eu-west-1.amazonaws.com/prod-ucs-content-store-eu-west/content/pii:S1381116906005528/fx1/DOWNSAMPLED/image/jpeg/66d9f655cbc413b8173e98c8d0898a5b/fx1.jpg https://s3.amazonaws.com/prod-ucs-content-store-us-east/content/pii:S1381116906005528/fx1/DOWNSAMPLED/image/jpeg/66d9f655cbc413b8173e98c8d0898a5b/fx1.jpg fx1 true fx1.jpg jpg 24839 92 332 IMAGE-DOWNSAMPLED 1-s2.0-S1381116906005528-sc2.sml https://s3.amazonaws.com/prod-ucs-content-store-us-east/content/pii:S1381116906005528/sc2/THUMBNAIL/image/gif/65bdcc32b43b22dc42a6a536032d0a17/sc2.sml https://s3-eu-west-1.amazonaws.com/prod-ucs-content-store-eu-west/content/pii:S1381116906005528/sc2/THUMBNAIL/image/gif/65bdcc32b43b22dc42a6a536032d0a17/sc2.sml sc2 sc2.sml sml 5190 149 219 IMAGE-THUMBNAIL 1-s2.0-S1381116906005528-sc1.sml https://s3.amazonaws.com/prod-ucs-content-store-us-east/content/pii:S1381116906005528/sc1/THUMBNAIL/image/gif/26e6797fecc90052c5668bf2eabac127/sc1.sml https://s3-eu-west-1.amazonaws.com/prod-ucs-content-store-eu-west/content/pii:S1381116906005528/sc1/THUMBNAIL/image/gif/26e6797fecc90052c5668bf2eabac127/sc1.sml sc1 sc1.sml sml 3739 61 219 IMAGE-THUMBNAIL 1-s2.0-S1381116906005528-gr7.sml https://s3-eu-west-1.amazonaws.com/prod-ucs-content-store-eu-west/content/pii:S1381116906005528/gr7/THUMBNAIL/image/gif/16ca39212a62ca5896d6f03b7837bf0a/gr7.sml https://s3.amazonaws.com/prod-ucs-content-store-us-east/content/pii:S1381116906005528/gr7/THUMBNAIL/image/gif/16ca39212a62ca5896d6f03b7837bf0a/gr7.sml gr7 gr7.sml sml 3543 164 204 IMAGE-THUMBNAIL 1-s2.0-S1381116906005528-gr6.sml https://s3.amazonaws.com/prod-ucs-content-store-us-east/content/pii:S1381116906005528/gr6/THUMBNAIL/image/gif/6b8654b2ae12fb86575ecab0e09a40be/gr6.sml https://s3-eu-west-1.amazonaws.com/prod-ucs-content-store-eu-west/content/pii:S1381116906005528/gr6/THUMBNAIL/image/gif/6b8654b2ae12fb86575ecab0e09a40be/gr6.sml gr6 gr6.sml sml 3776 164 215 IMAGE-THUMBNAIL 1-s2.0-S1381116906005528-gr5.sml https://s3-eu-west-1.amazonaws.com/prod-ucs-content-store-eu-west/content/pii:S1381116906005528/gr5/THUMBNAIL/image/gif/8b3a6c7875de99639c28cdef3fcde265/gr5.sml https://s3.amazonaws.com/prod-ucs-content-store-us-east/content/pii:S1381116906005528/gr5/THUMBNAIL/image/gif/8b3a6c7875de99639c28cdef3fcde265/gr5.sml gr5 gr5.sml sml 5062 164 213 IMAGE-THUMBNAIL 1-s2.0-S1381116906005528-gr4.sml https://s3-eu-west-1.amazonaws.com/prod-ucs-content-store-eu-west/content/pii:S1381116906005528/gr4/THUMBNAIL/image/gif/b5d023674c40cc503d3d304822cf4ebc/gr4.sml https://s3.amazonaws.com/prod-ucs-content-store-us-east/content/pii:S1381116906005528/gr4/THUMBNAIL/image/gif/b5d023674c40cc503d3d304822cf4ebc/gr4.sml gr4 gr4.sml sml 3981 164 216 IMAGE-THUMBNAIL 1-s2.0-S1381116906005528-gr3.sml https://s3-eu-west-1.amazonaws.com/prod-ucs-content-store-eu-west/content/pii:S1381116906005528/gr3/THUMBNAIL/image/gif/9b7ff5d414501bdb2e1f91de3993b9a8/gr3.sml https://s3.amazonaws.com/prod-ucs-content-store-us-east/content/pii:S1381116906005528/gr3/THUMBNAIL/image/gif/9b7ff5d414501bdb2e1f91de3993b9a8/gr3.sml gr3 gr3.sml sml 4136 164 208 IMAGE-THUMBNAIL 1-s2.0-S1381116906005528-gr2.sml https://s3-eu-west-1.amazonaws.com/prod-ucs-content-store-eu-west/content/pii:S1381116906005528/gr2/THUMBNAIL/image/gif/03869b9693c705639cb673a34a9248f4/gr2.sml https://s3.amazonaws.com/prod-ucs-content-store-us-east/content/pii:S1381116906005528/gr2/THUMBNAIL/image/gif/03869b9693c705639cb673a34a9248f4/gr2.sml gr2 gr2.sml sml 9649 163 99 IMAGE-THUMBNAIL 1-s2.0-S1381116906005528-gr1.sml https://s3.amazonaws.com/prod-ucs-content-store-us-east/content/pii:S1381116906005528/gr1/THUMBNAIL/image/gif/e06eb77cfca2daa8d9626b4dc95fd09c/gr1.sml https://s3-eu-west-1.amazonaws.com/prod-ucs-content-store-eu-west/content/pii:S1381116906005528/gr1/THUMBNAIL/image/gif/e06eb77cfca2daa8d9626b4dc95fd09c/gr1.sml gr1 gr1.sml sml 3715 81 219 IMAGE-THUMBNAIL 1-s2.0-S1381116906005528-fx1.sml https://s3.amazonaws.com/prod-ucs-content-store-us-east/content/pii:S1381116906005528/fx1/THUMBNAIL/image/gif/26e6797fecc90052c5668bf2eabac127/fx1.sml https://s3-eu-west-1.amazonaws.com/prod-ucs-content-store-eu-west/content/pii:S1381116906005528/fx1/THUMBNAIL/image/gif/26e6797fecc90052c5668bf2eabac127/fx1.sml fx1 true fx1.sml sml 3739 61 219 IMAGE-THUMBNAIL 1-s2.0-S1381116906005528-si2.gif https://s3.amazonaws.com/prod-ucs-content-store-us-east/content/pii:S1381116906005528/STRIPIN/image/gif/cecaa4e16bd799b97dbe53cbfb15b578/si2.gif https://s3-eu-west-1.amazonaws.com/prod-ucs-content-store-eu-west/content/pii:S1381116906005528/STRIPIN/image/gif/cecaa4e16bd799b97dbe53cbfb15b578/si2.gif si2 si2.gif gif 173 15 24 ALTIMG 1-s2.0-S1381116906005528-si1.gif https://s3-eu-west-1.amazonaws.com/prod-ucs-content-store-eu-west/content/pii:S1381116906005528/STRIPIN/image/gif/55103a043494b60542925d0076d95110/si1.gif https://s3.amazonaws.com/prod-ucs-content-store-us-east/content/pii:S1381116906005528/STRIPIN/image/gif/55103a043494b60542925d0076d95110/si1.gif si1 si1.gif gif 239 15 39 ALTIMG MOLCAA 5809 S1381-1169(06)00552-8 10.1016/j.molcata.2006.02.039 Elsevier B.V. Fig. 1 In situ UV–vis spectrum varying, (a) FeTPPCl+H2O2; (b) 1-naphthylamine+(a)-6, after (1) 5min; (2) 10min; (3) 15min. Fig. 2 The in situ EPR spectra of the catalytic system. (a) TPPFeCl+NaOH in MeOH solution. (b)–(e) H2O2 +(a), 10min, 20min, 35min, and 45min. (f)–(i) 1-Naphthylamine+(e), 5min, 15min, 25min, and 30min. Fig. 3 M-TPPCl catalyst amount selection, V MeOH =30mL, m NaOH =2.5g, m 1−NA =0.4g. Change the amount of M-TPPCl catalysts, (a) H2O2 system: FeTPPCl as catalyst, t =40min, T =313K, (b) O2 system: MnTPPCl as catalyst, t =3h, T =333K. Fig. 4 NaOH dosage selection, V MeOH =30mL, m 1−NA =0.4g. Change the amount of NaOH. (a) H2O2 system: m FeTPPCl =0.5mg, V H 2 O 2 =1.5mL, t =60min, T =313K. (b) O2 system: m MnTPPCl =1.5mg, P O 2 =1atm, t =3h, T =333K. Fig. 5 Reaction time selection, V MeOH =30mL, m 1−NA =0.4g, m NaOH =2.5g. (a) H2O2 system: m FeTPPCl =0.5mg, V H 2 O 2 =1.5mL, T =313K. (b) O2 system: m MnTPPCl =1.5mg, P O 2 =1atm, T =333K. Fig. 6 Affirmance of reaction temperature, V MeOH =30mL, m 1−NA =0.4g, m NaOH =2.5g. (a) H2O2 system: m FeTPPCl =0.5mg, V H 2 O 2 =1.5mL, t =1h. (b) O2 system: m MnTPPCl =1.5mg, P O 2 =1atm, t =3h. Fig. 7 Selection of H2O2 amount for system using MnTPPCl as the catalyst, V MeOH =30mL, m FeTPPCl =0.5mg, m 1−NA =0.4g, m NaOH =2.5g, T =40°C, t =1h, H2O2 (30% aq.) as oxygen source. Scheme 1 A novel compound of bis(4-oxo-benzo-2-cyclohexen-1-yl) amine (BOBCHA), is catalytic prepared coupling-oxidation over metalloporphyrin catalysts. Scheme 2 A possible catalytic mechanism for producing BOBCHA with H2O2 as oxygen donor over FeTPPCl catalyst. Table 1 Activity compare of different metalloporphyrin catalysts a Metalloporphyrin catalyst Yield of BOBCHA/% O2 as oxidant H2O2 as oxidant Fe-T(4-OCH3)PPCl 46.88 19.71 Fe-T(4-OH)PPCl 38.43 24.63 Fe-TPPCl 52.31 51.64 Fe-T(4-F)PPCl 51.91 27.03 Fe-T(4-NO2)PPCl 32.74 5.34 Mn-T(4-OCH3)PPCl 29.62 0.84 Mn-TPPCl 65.32 19.07 Mn-T(4-F)PPCl 47.28 10.94 Mn-T(4-NO2)PPCl 56.41 0.63 Mn-T(3-NO2)PPCl 40.94 1.62 Co-T(4-OCH3)PP 17.94 3.70 Co-TPP 32.21 2.21 Co-T(4-NO2)PP 29.97 14.86 Co-T(4-F)PP 8.16 0.18 a All catalysts are based on the structure of 5,10,15,20-tetraphenylporphyrin-metal complexs (M-TPP), and the substituent at the phenyl ring is labeled in the brackets. Reaction conditions: V MeOH =30ml, m NaOH =2.5g, m 1−NA =0.4g. For H2O2 system: T =313k, t =1h, m Catalyst =0.5mg, V H 2 O 2 =1.5ml. For O2 system: T =333k, t =3h, m Catalyst =1.5mg, P O 2 =1atm. Highly selective catalytic preparation of bis(4-oxo-benzo-2-cyclohexen-1-yl) amine from 1-naphthylamine oxidation over metalloporphyrin catalysts by molecular oxygen under air pressure and by hydrogen peroxide Tie Chen a Enhua Kang b Guiping Tan a Sijie Liu c Shaodan Zheng a Keer Yang a Shanling Tong a Chiguang Fang c ⁎ Fengshou Xiao b ⁎ Yan Yan a ⁎ a Department of Chemistry & Advanced Material Institute, Shantou University, Shantou, Guangdong 515063, China b College of Chemistry, State Key Lab of Synthesis & Preparative Chemistry, Jilin University, Changchun, Jilin 130012, China c Jilin Provincial Center for Disease Prevention and Control, Changchun, Jilin 130021, China ⁎ Corresponding authors. Tel.: +86 754 2903388. Graphical abstract In the presence of molecular oxygen or hydrogen peroxide, 1-naphthylamine (1-NA) was catalytically converted into bis(4-oxo-benzo-2-cyclohexen-1-yl) amine (BOBCHA) over metalloporphyrin catalysts through an oxidative-coupling way. UV–vis, IR, NMR, MS, mp determinations and elemental analysis were employed for product characterization. A possible catalytic mechanism based on in situ UV–vis and EPR determinations was proposed. A spectrophotometric method was established for quantitative analysis of the product according to its characteristic absorption at λ max =465nm. The influences of reaction conditions, such as solvents, temperature, reaction time, medium alkalinity, as well as species and amount of the catalysts were discussed in detail. Keywords Metalloporphyrin 1-Naphthylamine Selective catalysis Oxidative-coupling Molecular oxygen Hydrogen peroxide Bis(4-oxo-benzo-2-cyclohexen-1-yl) amine 1 Introduction Metalloporphyrin researches were focused on mimic model compounds of biological enzymes based on their extremely high selectivity in catalytic conversions of hydrocarbons. Recently, water-soluble ferrous porphyrin, with similar structure as heme, was investigated of thermal and photoinduced properties to unambiguously prove its sitting-atop structure [1]. In another report, iron porphyrin complex catalyzed efficiently alcohol oxidations to the corresponding carbonyl compounds via a high-valent iron-oxo porphyrin intermediate [2]. For getting higher anti-oxidative endurance of the catalysts, some metalloporphyrins with halogen substituted were prepared as the third generation catalysts and applied to catalyze the epoxidation and hydroxylation of hydrocarbons using different strong oxidant [3–6]. But traditional synthetic metalloporphyrins also exhibited higher catalytic activities and strong endurance in the oxidative preparation of 2-hydroxy-1,4-naphthoquinone from 1- or 2-naphthol, as we reported before [7,8]. Metalloporphyrin catalysts also exhibited high activities in NO disproportionation [9], photosensitised degradation of 4-chlorophenol [10] and unique direct oxidative conversion of N-acyl-l-proline to N-Acyl-l-glutamate [11]. Our primary research indicated that, under the similar catalytic conditions as literature [8] stated bis(4-oxo-benzo-2-cyclohexen-1-yl) amine (BOBCHA) was prepared when the reactants, 1- or 2-naphthol was replaced by 1-naphthylamine (1-NA) [12]. But, no catalytic mechanistic evidences were provided due to the difficulty in observing catalytic intermediates between iron porphyrin catalyst and O2 during the reaction. We presents here, in a methanolic alkaline medium, 1-naphthylamine is converted into bis(4-oxo-benzo-2-cyclohexen-1-yl) amine over 5,10,15,20-tetraphenyl porphyrinato manganese chloride (MnTPPCl) catalyst by O2 with conversion of 78.5% and selectivity at 100%, and over 5,10,15,20-tetraphenyl porphyrinato iron chloride (FeTPPCl) catalyst by H2O2 with conversion of 79.6% and with the same selectivity. Based on in situ determinations of FeTPPCl with H2O2, a possible catalytic mechanism was proposed and the various factors influencing the catalysis were also discussed. With resembling molecular structure, BOBCHA should have the similar properties to naphthoquinone. It would be used as a receptor to modulate ryanodine in scarcoplasmic reticulum [13] and as the intermediate of fine chemicals preparation. For instance, by electrochemical method, BOBCHA could be polymerized into an oligomer film with excellent optical characteristics [14–16] to provide itself a potential application future. 2 Experimental 2.1 Reagents and instrument Metalloporphyrin catalysts were prepared by the methods of Adler et al. [17] and Lindsey et al. [18]. Molecular oxygen with purity of 99.99%, methanol, and 1-naphthylamine were purchased with purity higher than 99.99%. An aqueous solution of hydrogen peroxide (30wt%) and all other reagents with purities higher than 99.9% were directly used without further purification. The experiments were monitored by a Shimadzu UV-240 spectrophotometer (operating conditions: 40nm/cm, 0.0–1.5A; wavelength range: 200–800nm; sample concentration: 0.0001–0.1mol/dm3), a Nicolet FTIR 5-PC spectrometer (operating conditions: slow scanning speed; resolution power: 4cm−1; wave number range: 400–4000cm−1, KBr), a VG-Quattro series connection mass spectrometer (operating conditions: laser source; 200°C; ionization voltage: 70eV; analytic current: 500μA; sample feed: Desorption Electro-Impact (DEI), range: 0–300 m/z), a UNTY-400 NMR spectrometer (operating conditions: 300MHz, standard substance is CDCl3), a Brucker ER 200D EPR spectrometer (operating conditions: at room temperature; microwave frequency: 9.67GHz; microwave power: 2mW; midfield: 348.62mT; scan range: 600.0mT; scan time: 200s; modulation frequency: 100kHz; field modulation: 0.125mT) and a X4 microscope melting point apparatus. 2.2 Catalytic reactions For preparing BOBCHA, 0.40g of 1-NA, 2.50g of NaOH, and 1.50mg (2.13×10−3 mmol) of MnTPPCl were dissolved in 20ml of MeOH at 333K, followed by bubbling of molecular oxygen with pressure at 1atm (101.325kPa). Color of the reaction mixture was changed from straw yellow to red gradually (see Scheme 1 ). After 5h of reaction under continuous stirring, the addition of water into the mixture produced red precipitates. The red product was purified by chromatography (using SiO2 gel column with toluene as eluant). Finally, 0.63g of a red powder was obtained in 78.5% yield. In another catalytic system with H2O2 as an oxygen source, the above MnTPPCl catalyst was replaced by 3.0mg (4.25×10−3 mmol) of TPPFeCl and at 313K while other conditions kept constant. After 40min of reaction, the red powder was obtained in yield of 79.6%. 2.3 Product characterization The product was quantitatively analyzed by HPLC and UV–vis techniques. It was also characterized by means of melting point measurement, element analysis, GC-MS, IR and 1H NMR determination. Bis(4-oxo-benzo-2-cyclohexen-1-yl)amine: (Melting point: 232–233°C); (Found: C, 79.46; H 5.08; N 4.52. Calc. for C20H15NO2: C, 79.73; H, 4.98; N, 4.65%); v max(KBr)/cm−1 3444(NH); 1691(CO) [19]; δ H =7.25, 7.42, 7.26, 7.69(H-naph.); 6.88, 6.86(HCC); 2.0(HN) [20]; mass spectrum m/z =301 (molecular ion). The UV–vis spectrum of BOBCHA in CH2Cl2 showed 3 absorptions at 289nm (ɛ =8.2×104), 345nm (ɛ =4.6×104), and 490nm (ɛ =2.0×104), and that in CH3OH showed two absorptions at 277nm (ɛ =3.9×104) and 465nm (ɛ =2.3×104), respectively. Meanwhile, other substances in the catalytic system, such as NaOH, O2, H2O2 and 1-NA, with no absorption appeared around 350–800nm. Therefore, the absorption of BOBCHA at 465nm can be directly used as the characteristic peak to analyze BOBCHA quantitatively. The linear regressive equation of standard curve for BOBCHA analysis is as A =0.02526+0.3612×10−6CBOBCHA (linear correlative coefficient, r =0.9994). In the concentration range of (0.142–4.656)×10−6 mol/dm3, the standard curve displays a well linear correlation. 3 Result and discussion 3.1 Catalytic mechanism FeTPPCl reacted with H2O2 to form a high valence metalloporphyrin complex, an active catalytic intermediate for the oxidation from 1- and 2-naphthol to 2-hydroxy-1,4-naphthoquinone [7]. The catalytic intermediate is the same one in the oxidative-coupling of 1-NA to form BOBCHA. UV–vis spectrum of FeTPPCl shows an absorption peak at 415nm (Soret band). By adding H2O2 into this solution, an in situ determination reveals a new absorption peak at 461nm [the absorption of OFe(V)TPPOH, Soret band], meanwhile the Soret band of FeTPPOH weakens gradually with an isobestic point emerging at 436nm (Fig. 1a). Followed by adding 1-NA into the reaction system, the absorption at 461nm assigned to the new species of metalloporphyrin disappears gradually, possibly owing to the consumption of the intermediate during the formation of BOBCHA (Fig. 1b). These evidences indicate that the active catalytic intermediate must be a new species of metalloporphyrin, [OFe(V)TPPOH]. The formation of OFe(V)TPPOH is just similar to the high-valent iron-oxo entities of cytochrome P-450 with H2O2 as oxygen donating [21,22]. EPR spectra of the catalytic oxidation have confirmed the suggestion. Fig. 2 shows the in situ EPR determination spectra of FeTPPCl reacting with H2O2 and 1-naphthylamine. Fe(III)TPPCl (presenting in Fe(III)TPPOH form in the methanolic alkaline medium) itself displays a strong EPR signal at g =2.225 (Fig. 2a). By adding H2O2 into the solution, this signal becomes much weaker than before, and disappears completely after 45-min reaction (Fig. 2b–e). The EPR signal disappearance means the formation of high valence of OFe(V)TPPOH. The high valence species is paramagnetic, but is “EPR-inert” one giving a broad spectrum, and hence, is difficult to be detected (see Fig. 2e) [26]. When 1-NA is added to the methanol solution with OFe(V)TPPOH, the paramagnetic signal appears again, possibly due to the reaction of OFe(V)TPPOH with 1-NA to produce the product, BOBCHA and the original catalyst, Fe(III)TPPOH (see Fig. 2f–i). Therefore, a possible catalytic mechanism for oxidative-coupling of 1-NA by H2O2 is proposed as in Scheme 2 . In the alkaline methanol media, the balance chloric anion in Fe(III)TPPCl is replayed by hydroxyl anion to form Fe(III)TPPOH, and Fe(III)TPPOH is coordinated further at the opposite axial trend by H2O2 to produce (HOOH)Fe(III)TPPOH (step 1). This unstable (HOOH)Fe(III)TPPOH rapidly dissociates into a high valence form of OFe(V)TPPOH, the catalytic intermediate; by the synergism of dehydration and oxidation (step 2) [21–25]. Meanwhile, 1-NA can be polymerized into an oligmer (step 3) in oxidative ambience [27], and the oligmer is oxidized by OFe(V)TPPOH (step 4) to form BOBCHA after deamination (step 5) and oxidation (step 6). In the molecular oxygen system, the catalytic intermediate is in accordance with the model of cytochrome P-450 in hydroxylation of hydrocarbons [21,22]. Therefore, the catalytic intermediates in both H2O2 and O2 oxidative-coupling of 1-NA are considered as an OM(V) porphyrin form. 3.2 Catalytic condition optimization 3.2.1 Activities of different MTPP catalysts and their amount selection Influences of the kind and the amount of metalloporphyrin catalysts on the oxidative-coupling of 1-NA were examined. The different effects of metalloporphyrin catalysts are list in Table 1 (the reacting conditions were given under the table). Notably, among metalloporphyrin catalysts with same center metal, M-TPP displays the highest activity in all system of O2 oxygen donor and H2O2 oxygen donor, excepting Co-T(4-NO2)PP catalyst in H2O2 system. These indicate the substituent groups at phenyl rings in metalloporphyrin including both the electron donating OCH3, OH, and the electron attracting F, NO2, are all unfavorable for getting high catalytic activities in the oxidative-coupling. The special demand to form BOBCHA may be account for the amounts and stabilities of high valence metalloporphyrin intermediates in the oxidative-coupling of 1-NA. In fact, the absorbance peaks of OFe(V)T(p-F)PPOH, OFe(V)TPPOH and Fe(V)T(p-OCH3)PPOH appear at λ max =462nm (ɛ =1.38×104), λ max =465nm (ɛ =2.25×104) and λ max =468nm (ɛ =2.60×104), respectively. During the formation of the catalytic intermediates, the electron donating groups (OCH3) around porphyrin rings make redox potential descend while the electron attracting groups (F) make that arise. The redox potential arising reduces the catalytic intermediate amount, and as a result, less BOBCHA is produced. Contrarily, the redox potential descending increases the catalytic intermediate amount and meanwhile makes the catalytic intermediate too stable in kinetics to react with 1-NA. Therefore, less BOBCHA is produced too. Obviously, both amount and stabilities of the intermediate come from metalloporphyrin without any electron donating or accepting groups, such as MTPPCl, are more suitable in the catalytic preparation of BOBCHA. The intermediate spectra change along with time after adding 1-NA also indicates kinetic stability of the intermediate. Within 15min, the intermediate spectrum of OFe(V)TPPOH is almost changed into its original spectrum of FeTPPOH catalyst (see Fig. 1b), while the intermediate spectrum of OFe(V)T(p-OCH3)PPOH becoming into that of Fe(III)T(p-OCH3)PPOH almost takes 40min. The rate to consume OFe(V)TPPOH is rather faster than that to consume OFe(V)T(p-OCH3)PPOH based on Fe(III)T(p-OCH3)PPOH, with 4 methoxyls, the strong electron donating substituents. The experimental data in Table 1 also indicate that FeTPPCl and MnTPPCl are with relative higher activities than other ones in O2 and H2O2 systems, respectively. After metalloporphyrin catalyst selections, the amount of FeTPPCl and MnTPPCl catalysts for the two catalytic systems were examined (see Fig. 3 ). When 1.5mg of MnTPPCl (for O2 system) or 3.0mg of FeTPPCl (H2O2 system) are added, the highest conversions from 1-NA into BOBCHA reach at 65.3% and 79.6%, respectively under the relative reacting conditions. Less or more catalysts than the best amounts will descend the yield of BOBCHA. The polymer formation of 1-NA may account for the conversion falling [27]. Meanwhile, high concentration of metalloporphyrin catalyst may accelerate the formation of an inactive species of μ-oxygen dimmer, [Por-M-O-M-Por], to descend concentration of the active intermediate of OM(V)TPP. As a result, the yield of BOBCHA would be reduced consequentially [28,29]. 3.2.2 Influence of the amount of sodium hydroxide Fig. 4 presents the influence of sodium hydroxide amount in the methanol solution. Alkali reacting medium is beneficial for both decreasing the redox potential and promoting the organic reaction rate. In the catalytic oxidation of 1-NA, sodium hydroxide displays a very important role. Without sodium hydroxide, no BOBCHA can be detected. Therefore, the conversion of 1-NA to BOBCHA also increases with the amount of NaOH in the reaction solution before its amount reaches 2.5g for both systems. The MeOH solution as reaction mediate becomes much sticky to barrier the collision between the reactants when the added amount of NaOH is beyond 2.5g. Under definite reaction conditions, the highest conversions of 1-NA are at 66.18% and 53.20% for O2 and H2O2 systems, respectively. 3.2.3 Reacting time selections The oxidants of O2 and H2O2 are with different oxidative abilities. So the reaction rates between two catalysis systems are different too. Fig. 5 shows the best reacting times are 35–40min for (FeTPPCl+H2O2) system and 5h for (MnTPPCl+O2) system. Obviously, the strong oxidant H2O2 needs much shorter time than the weak oxidant O2 does to make the catalytic oxidative-coupling of 1-NA get equilibrium. Remarkably, after long time reaction (especially for the system with suitable amount of H2O2 as much stronger oxidant), the yields of BOBCHA do not descend any longer. Then BOBCHA can be considered as a very stable product under the catalytic conditions. 3.2.4 Temperature impacting Temperature is an important factor to accelerate chemical rate, to shorten the equilibrium time and even to change the reaction direction or to vary the products. For getting its influences on both H2O2 and O2 systems, the oxidative-couplings were carried out at different temperatures. Fig. 6a shows the temperature influencing on (H2O2 +FeTPPCl) system, and the best temperature range is from 35°C to 40°C (308–313K). The yields of BOBCHA are lower when the reaction temperature selected is out of the best range. Below 35°C or above 40°C, the reaction rate is small or the BOBCHA may be further oxidized by H2O2, and as results to reduce the yield of BOBCHA. But for (O2 +MnTPPCl) system (Fig. 6b), the yield of BOBCHA ascends along with the reaction temperature rising, until reaching the reflux temperature of MeOH solution. So BOBCHA could not be oxidized by the weaker oxidant of O2 at the reflux temperature. 3.2.5 Influences of oxidant amount and reacting media for (H2O2 +FeTPPCl) system In the (H2O2 +FeTPPCl) system, the oxidant amount influence to the catalysis was investigated. Fig. 7 shows the best amount of H2O2 (30wt% aqueous solution) in preparing of BOBCHA is 1.5mL at adding rate of 1 drop/6s. Under the definite conditions, excess amount of H2O2 will oxidize BOBCHA to descend its yield. Furthermore, different solvents were employed for selection of reacting media in catalytic preparation of BOBCHA. Experimental results indicate that both MeOH and EtOH are much better solvents with suitable polarizing properties. Relatively, water-soluble solvents, including acetonitrile, acetone and even water itself, and other water-unsolvable solvents, including ether, dichloromethane, chloroform, benzene and toluene, are all unsuitable media for the catalytic oxidative-coupling of 1-NA. Except methanol and ethanol, although sodium hydroxide is with enough solubility in the other water-soluble solvents, they can supply unsuitable polarities for the catalysis. Otherwise, sodium hydroxide is undissolvable in the water-unsolvable solvents for supplying the necessary alkaline to the catalysis. Therefore, both the polarity and the alkaline of the reacting medium should be strictly controlled for getting high conversion from 1-NA to BOBCHA. Summarizing all above, the optimizing catalytic conditions to prepare BOBCHA are (1) for (O2 +MnTPPCl) system: m MnTPPCl =1.5mg, m 1−NA =0.4g, V MeOH =30mL, m NaOH =2.5g, t =5h, T =333K (60°C), P O 2 =1atm, yield BOBCHA =78.51%; and (2) for (H2O2 +FeTPPCl) system: m FeTPPCl =3.0mg, m 1−NA =0.4g, V MeOH =30mL, m NaOH =2.5g, t =40min, T =308–313K (35°C–40°C), V H 2 O 2 =1.5mL, yieldBOBCHA =79.62%. 4 Conclusions 1-Naphthylamine (1-NA) can be converted into the novel oxidative-coupling product of bis(4-oxo-benzo-2-cyclohexen-1-yl) amine (BOBCHA) over metalloporphyrin catalysts by both molecular oxygen and hydrogen peroxide aqueous solution (30wt%), respectively. The molecular structure of BOBCHA is much different from that of 1,1′-bi-2-naphthol with 2-naphthol as reactant [30], and from that of the cross-coupling product with 2-naphthol and 2-naphthylamine as reactant [31,32], the traditional oxidative-coupling products. These oxidative-coupling reactions exhibit characters as below: (1) relative low temperature is needed in preparing BOBCHA with high selectivity and conversion; (2) both strictly polarity and strong alkali of the reacting medium is demanded, and more suitable reacting media are methanol and ethanol; (3) low solubility of BOBCHA makes it easy to separate from the reacting medium; (4) metalloporphyrin catalysts are stable enough to anti-oxidize and can be reused after seperation; and (5) with a special molecular structure and color change property in different media, BOBCHA would be found as a potential useful function material. Acknowledgement Thanks professor K.P. Dennis Ng (Department of Chemistry, The Chinese University of Hong Kong) for determination of the 1H NMR. References [1] R. Huszank O. Horvath Chem. Commun. 2005 224 [2] J.H. Han S.K. Yoo J.S. Seo S.J. Hong S.K. Kim C. Kim Dalton Trans. 2005 402 [3] P.S. Traylor D. Dolphin T.G. Traylor Chem. Commun. 1984 279 [4] J.E. Lyons P.E. Ellis Catal. Lett. 8 1990 181 [5] S. Evans J.R. Lindsey Perkin Trans. 2 2000 1541 [6] S. Evans J.R. Lindsay J. Chem. Soc., Perkin Trans. 2 2001 174 [7] Y. Yan F.S. Xiao G.D. Zheng K.J. Zhen C.G. Fang J. Mol. Catal. A: Chem. 2000 65 [8] Y. Yan E.H. Kang K.E. Yang S.L. Tong C.G. Fang S.J. Liu F.S. Xiao Catal. Commun. 5 2005 387 [9] G.G. Martirosyan A.S. Azizyan T.S. Kurtikyan P.C. Ford Chem. Commun. 2004 1488 [10] E. Silva M.M. Pereira H.D. Burrows M.E. Azenha M. Sarakha M. Bolte Photochem. Photobiol. Sci. 3 2004 200 [11] R. Ito N. Umezawa T. Higuchi J. Am. Chem. Soc. 127 2005 834 [12] T. Chen N.H. Kang G.P. Tan K.E. Yang S.L. Tong F.S. Xiao Y. Yan Chem. Res. Chin. Univ. 21 Suppl. 2005 55 [13] R.H. Xia Space Med. Med. Eng. 12 1999 42 [14] D.-K. Moon K. Osahada T. Marnyama K. Kubata T. Yamamoto Macromolecules 26 1993 6992 [15] H. Yang F.F. Fan S. Yau A.J. Bard J. Electrochem. Soc. 139 1992 2182 [16] T. Shono Tetrahedron 40 1984 811 [17] A.D. Adler F.R. Longo J.D. Finarelliet Org. Chem. 32 1967 4761 [18] J.S. Lindsey I.C. Schreiman H.C.P.C. Hsu A.M. Kearney Marguerettaz J. Org. Chem. 52 1987 827 836 [19] J.Y. Xie J.B. Chang X.M. Wang The Application of IR Spectra in Organic and Pharmic Chemistry first ed. 1987 Science and Technology Press Beijing, China p. 88 [20] W. Fresenius J.F.K. Huber E. Pungor G.A. Rechnitz W. Simon Th. S. West Tables of Spectral Data for Structure Determination of Organic Compounds second ed. 1989 Springer-Verlag Berlin Heidelberg H340–H350 [21] B. Jean M. Bernard Chem. Commun. 1998 2167 [22] S. Shaik M. Filatov D. Schröder H. Schwarz Chem. Eur. J. 4 1998 193 [23] A. Kunai S. Harta S. Ito K. Sasaki J. Am. Chem. Soc. 108 1986 6012 [24] R. Panicucci T.C. Bruice J. Am. Chem. Soc. 112 1990 6063 [25] T.G. Traylor F. Xu J. Am. Chem. Soc. 112 1990 178 [26] G. Palmer D. Dolphin The Porphyrins vol. IV 1979 Academic Press New York Phys. Chem. Part B [27] B.K. Schmitz W.B. Euler J. Electroanal. Chem. 39 1995 47 [28] P.S. Traylor D. Dolphin T.G. Traylor Chem. Commun. 1984 279 [29] B.D. Poorter B. Maunier Tetrahedron Lett. 25 1984 1895 [30] E. Armengol A. Corma H. Garcia J. Primo Eur. J. Org. Chem. 1999 1915 [31] K. Ding Q. Xu Y. Wang J. Liu Z. Yu B. Du Y. Wu H. Koshima T. Matsuura Chem. Commun. 1997 693 [32] K. Körber W. Tang X. Hu X. Zhang Tetrahedron Lett. 43 2002 7163",
      "scopus-id": "33646161460",
      "coredata": {
        "eid": "1-s2.0-S1381116906005528",
        "dc:description": "In the presence of molecular oxygen or hydrogen peroxide, 1-naphthylamine (1-NA) was catalytically converted into bis(4-oxo-benzo-2-cyclohexen-1-yl) amine (BOBCHA) over metalloporphyrin catalysts through an oxidative-coupling way. UV–vis, IR, NMR, MS, mp determinations and elemental analysis were employed for product characterization. A possible catalytic mechanism based on in situ UV–vis and EPR determinations was proposed. A spectrophotometric method was established for quantitative analysis of the product according to its characteristic absorption at λ max =465nm. The influences of reaction conditions, such as solvents, temperature, reaction time, medium alkalinity, as well as species and amount of the catalysts were discussed in detail.",
        "openArchiveArticle": "false",
        "prism:coverDate": "2006-06-01",
        "openaccessUserLicense": null,
        "prism:aggregationType": "Journal",
        "prism:url": "https://api.elsevier.com/content/article/pii/S1381116906005528",
        "dc:creator": [
          {
            "@_fa": "true",
            "$": "Chen, Tie"
          },
          {
            "@_fa": "true",
            "$": "Kang, Enhua"
          },
          {
            "@_fa": "true",
            "$": "Tan, Guiping"
          },
          {
            "@_fa": "true",
            "$": "Liu, Sijie"
          },
          {
            "@_fa": "true",
            "$": "Zheng, Shaodan"
          },
          {
            "@_fa": "true",
            "$": "Yang, Keer"
          },
          {
            "@_fa": "true",
            "$": "Tong, Shanling"
          },
          {
            "@_fa": "true",
            "$": "Fang, Chiguang"
          },
          {
            "@_fa": "true",
            "$": "Xiao, Fengshou"
          },
          {
            "@_fa": "true",
            "$": "Yan, Yan"
          }
        ],
        "link": [
          {
            "@_fa": "true",
            "@rel": "self",
            "@href": "https://api.elsevier.com/content/article/pii/S1381116906005528"
          },
          {
            "@_fa": "true",
            "@rel": "scidir",
            "@href": "https://www.sciencedirect.com/science/article/pii/S1381116906005528"
          }
        ],
        "dc:format": "application/json",
        "openaccessType": null,
        "pii": "S1381-1169(06)00552-8",
        "prism:volume": "252",
        "prism:publisher": "Elsevier B.V.",
        "dc:title": "Highly selective catalytic preparation of bis(4-oxo-benzo-2-cyclohexen-1-yl) amine from 1-naphthylamine oxidation over metalloporphyrin catalysts by molecular oxygen under air pressure and by hydrogen peroxide",
        "prism:copyright": "Copyright © 2006 Elsevier B.V. All rights reserved.",
        "openaccess": "0",
        "prism:issn": "13811169",
        "prism:issueIdentifier": "1-2",
        "dcterms:subject": [
          {
            "@_fa": "true",
            "$": "Metalloporphyrin"
          },
          {
            "@_fa": "true",
            "$": "1-Naphthylamine"
          },
          {
            "@_fa": "true",
            "$": "Selective catalysis"
          },
          {
            "@_fa": "true",
            "$": "Oxidative-coupling"
          },
          {
            "@_fa": "true",
            "$": "Molecular oxygen"
          },
          {
            "@_fa": "true",
            "$": "Hydrogen peroxide"
          },
          {
            "@_fa": "true",
            "$": "Bis(4-oxo-benzo-2-cyclohexen-1-yl) amine"
          }
        ],
        "openaccessArticle": "false",
        "prism:publicationName": "Journal of Molecular Catalysis A: Chemical",
        "prism:number": "1-2",
        "openaccessSponsorType": null,
        "prism:pageRange": "56-62",
        "prism:endingPage": "62",
        "pubType": "fla",
        "prism:coverDisplayDate": "1 June 2006",
        "prism:doi": "10.1016/j.molcata.2006.02.039",
        "prism:startingPage": "56",
        "dc:identifier": "doi:10.1016/j.molcata.2006.02.039",
        "openaccessSponsorName": null
      },
      "objects": {
        "object": [
          {
            "@category": "high",
            "@height": "1470",
            "@width": "2164",
            "@_fa": "true",
            "$": "https://api.elsevier.com/content/object/eid/1-s2.0-S1381116906005528-sc2_lrg.jpg?httpAccept=%2A%2F%2A",
            "@multimediatype": "JPEG image file",
            "@type": "IMAGE-HIGH-RES",
            "@size": "247314",
            "@ref": "sc2",
            "@mimetype": "image/jpeg"
          },
          {
            "@category": "high",
            "@height": "408",
            "@width": "1472",
            "@_fa": "true",
            "$": "https://api.elsevier.com/content/object/eid/1-s2.0-S1381116906005528-sc1_lrg.jpg?httpAccept=%2A%2F%2A",
            "@multimediatype": "JPEG image file",
            "@type": "IMAGE-HIGH-RES",
            "@size": "98648",
            "@ref": "sc1",
            "@mimetype": "image/jpeg"
          },
          {
            "@category": "high",
            "@height": "1340",
            "@width": "1668",
            "@_fa": "true",
            "$": "https://api.elsevier.com/content/object/eid/1-s2.0-S1381116906005528-gr7_lrg.jpg?httpAccept=%2A%2F%2A",
            "@multimediatype": "JPEG image file",
            "@type": "IMAGE-HIGH-RES",
            "@size": "114781",
            "@ref": "gr7",
            "@mimetype": "image/jpeg"
          },
          {
            "@category": "high",
            "@height": "1273",
            "@width": "1673",
            "@_fa": "true",
            "$": "https://api.elsevier.com/content/object/eid/1-s2.0-S1381116906005528-gr6_lrg.jpg?httpAccept=%2A%2F%2A",
            "@multimediatype": "JPEG image file",
            "@type": "IMAGE-HIGH-RES",
            "@size": "120865",
            "@ref": "gr6",
            "@mimetype": "image/jpeg"
          },
          {
            "@category": "high",
            "@height": "1310",
            "@width": "1701",
            "@_fa": "true",
            "$": "https://api.elsevier.com/content/object/eid/1-s2.0-S1381116906005528-gr5_lrg.jpg?httpAccept=%2A%2F%2A",
            "@multimediatype": "JPEG image file",
            "@type": "IMAGE-HIGH-RES",
            "@size": "162690",
            "@ref": "gr5",
            "@mimetype": "image/jpeg"
          },
          {
            "@category": "high",
            "@height": "1274",
            "@width": "1678",
            "@_fa": "true",
            "$": "https://api.elsevier.com/content/object/eid/1-s2.0-S1381116906005528-gr4_lrg.jpg?httpAccept=%2A%2F%2A",
            "@multimediatype": "JPEG image file",
            "@type": "IMAGE-HIGH-RES",
            "@size": "119612",
            "@ref": "gr4",
            "@mimetype": "image/jpeg"
          },
          {
            "@category": "high",
            "@height": "1330",
            "@width": "1691",
            "@_fa": "true",
            "$": "https://api.elsevier.com/content/object/eid/1-s2.0-S1381116906005528-gr3_lrg.jpg?httpAccept=%2A%2F%2A",
            "@multimediatype": "JPEG image file",
            "@type": "IMAGE-HIGH-RES",
            "@size": "137241",
            "@ref": "gr3",
            "@mimetype": "image/jpeg"
          },
          {
            "@category": "high",
            "@height": "2032",
            "@width": "1232",
            "@_fa": "true",
            "$": "https://api.elsevier.com/content/object/eid/1-s2.0-S1381116906005528-gr2_lrg.jpg?httpAccept=%2A%2F%2A",
            "@multimediatype": "JPEG image file",
            "@type": "IMAGE-HIGH-RES",
            "@size": "272582",
            "@ref": "gr2",
            "@mimetype": "image/jpeg"
          },
          {
            "@category": "high",
            "@height": "966",
            "@width": "2609",
            "@_fa": "true",
            "$": "https://api.elsevier.com/content/object/eid/1-s2.0-S1381116906005528-gr1_lrg.jpg?httpAccept=%2A%2F%2A",
            "@multimediatype": "JPEG image file",
            "@type": "IMAGE-HIGH-RES",
            "@size": "252866",
            "@ref": "gr1",
            "@mimetype": "image/jpeg"
          },
          {
            "@category": "high",
            "@height": "408",
            "@width": "1472",
            "@_fa": "true",
            "$": "https://api.elsevier.com/content/object/eid/1-s2.0-S1381116906005528-fx1_lrg.jpg?httpAccept=%2A%2F%2A",
            "@multimediatype": "JPEG image file",
            "@type": "IMAGE-HIGH-RES",
            "@size": "98648",
            "@ref": "fx1",
            "@mimetype": "image/jpeg"
          },
          {
            "@category": "standard",
            "@height": "332",
            "@width": "489",
            "@_fa": "true",
            "$": "https://api.elsevier.com/content/object/eid/1-s2.0-S1381116906005528-sc2.jpg?httpAccept=%2A%2F%2A",
            "@multimediatype": "JPEG image file",
            "@type": "IMAGE-DOWNSAMPLED",
            "@size": "46719",
            "@ref": "sc2",
            "@mimetype": "image/jpeg"
          },
          {
            "@category": "standard",
            "@height": "92",
            "@width": "332",
            "@_fa": "true",
            "$": "https://api.elsevier.com/content/object/eid/1-s2.0-S1381116906005528-sc1.jpg?httpAccept=%2A%2F%2A",
            "@multimediatype": "JPEG image file",
            "@type": "IMAGE-DOWNSAMPLED",
            "@size": "24839",
            "@ref": "sc1",
            "@mimetype": "image/jpeg"
          },
          {
            "@category": "standard",
            "@height": "302",
            "@width": "376",
            "@_fa": "true",
            "$": "https://api.elsevier.com/content/object/eid/1-s2.0-S1381116906005528-gr7.jpg?httpAccept=%2A%2F%2A",
            "@multimediatype": "JPEG image file",
            "@type": "IMAGE-DOWNSAMPLED",
            "@size": "28895",
            "@ref": "gr7",
            "@mimetype": "image/jpeg"
          },
          {
            "@category": "standard",
            "@height": "288",
            "@width": "378",
            "@_fa": "true",
            "$": "https://api.elsevier.com/content/object/eid/1-s2.0-S1381116906005528-gr6.jpg?httpAccept=%2A%2F%2A",
            "@multimediatype": "JPEG image file",
            "@type": "IMAGE-DOWNSAMPLED",
            "@size": "30932",
            "@ref": "gr6",
            "@mimetype": "image/jpeg"
          },
          {
            "@category": "standard",
            "@height": "296",
            "@width": "384",
            "@_fa": "true",
            "$": "https://api.elsevier.com/content/object/eid/1-s2.0-S1381116906005528-gr5.jpg?httpAccept=%2A%2F%2A",
            "@multimediatype": "JPEG image file",
            "@type": "IMAGE-DOWNSAMPLED",
            "@size": "38842",
            "@ref": "gr5",
            "@mimetype": "image/jpeg"
          },
          {
            "@category": "standard",
            "@height": "288",
            "@width": "379",
            "@_fa": "true",
            "$": "https://api.elsevier.com/content/object/eid/1-s2.0-S1381116906005528-gr4.jpg?httpAccept=%2A%2F%2A",
            "@multimediatype": "JPEG image file",
            "@type": "IMAGE-DOWNSAMPLED",
            "@size": "29679",
            "@ref": "gr4",
            "@mimetype": "image/jpeg"
          },
          {
            "@category": "standard",
            "@height": "300",
            "@width": "382",
            "@_fa": "true",
            "$": "https://api.elsevier.com/content/object/eid/1-s2.0-S1381116906005528-gr3.jpg?httpAccept=%2A%2F%2A",
            "@multimediatype": "JPEG image file",
            "@type": "IMAGE-DOWNSAMPLED",
            "@size": "34090",
            "@ref": "gr3",
            "@mimetype": "image/jpeg"
          },
          {
            "@category": "standard",
            "@height": "459",
            "@width": "278",
            "@_fa": "true",
            "$": "https://api.elsevier.com/content/object/eid/1-s2.0-S1381116906005528-gr2.jpg?httpAccept=%2A%2F%2A",
            "@multimediatype": "JPEG image file",
            "@type": "IMAGE-DOWNSAMPLED",
            "@size": "52169",
            "@ref": "gr2",
            "@mimetype": "image/jpeg"
          },
          {
            "@category": "standard",
            "@height": "218",
            "@width": "589",
            "@_fa": "true",
            "$": "https://api.elsevier.com/content/object/eid/1-s2.0-S1381116906005528-gr1.jpg?httpAccept=%2A%2F%2A",
            "@multimediatype": "JPEG image file",
            "@type": "IMAGE-DOWNSAMPLED",
            "@size": "38118",
            "@ref": "gr1",
            "@mimetype": "image/jpeg"
          },
          {
            "@category": "standard",
            "@height": "92",
            "@width": "332",
            "@_fa": "true",
            "$": "https://api.elsevier.com/content/object/eid/1-s2.0-S1381116906005528-fx1.jpg?httpAccept=%2A%2F%2A",
            "@multimediatype": "JPEG image file",
            "@type": "IMAGE-DOWNSAMPLED",
            "@size": "24839",
            "@ref": "fx1",
            "@mimetype": "image/jpeg"
          },
          {
            "@category": "thumbnail",
            "@height": "149",
            "@width": "219",
            "@_fa": "true",
            "$": "https://api.elsevier.com/content/object/eid/1-s2.0-S1381116906005528-sc2.sml?httpAccept=%2A%2F%2A",
            "@multimediatype": "GIF image file",
            "@type": "IMAGE-THUMBNAIL",
            "@size": "5190",
            "@ref": "sc2",
            "@mimetype": "image/gif"
          },
          {
            "@category": "thumbnail",
            "@height": "61",
            "@width": "219",
            "@_fa": "true",
            "$": "https://api.elsevier.com/content/object/eid/1-s2.0-S1381116906005528-sc1.sml?httpAccept=%2A%2F%2A",
            "@multimediatype": "GIF image file",
            "@type": "IMAGE-THUMBNAIL",
            "@size": "3739",
            "@ref": "sc1",
            "@mimetype": "image/gif"
          },
          {
            "@category": "thumbnail",
            "@height": "164",
            "@width": "204",
            "@_fa": "true",
            "$": "https://api.elsevier.com/content/object/eid/1-s2.0-S1381116906005528-gr7.sml?httpAccept=%2A%2F%2A",
            "@multimediatype": "GIF image file",
            "@type": "IMAGE-THUMBNAIL",
            "@size": "3543",
            "@ref": "gr7",
            "@mimetype": "image/gif"
          },
          {
            "@category": "thumbnail",
            "@height": "164",
            "@width": "215",
            "@_fa": "true",
            "$": "https://api.elsevier.com/content/object/eid/1-s2.0-S1381116906005528-gr6.sml?httpAccept=%2A%2F%2A",
            "@multimediatype": "GIF image file",
            "@type": "IMAGE-THUMBNAIL",
            "@size": "3776",
            "@ref": "gr6",
            "@mimetype": "image/gif"
          },
          {
            "@category": "thumbnail",
            "@height": "164",
            "@width": "213",
            "@_fa": "true",
            "$": "https://api.elsevier.com/content/object/eid/1-s2.0-S1381116906005528-gr5.sml?httpAccept=%2A%2F%2A",
            "@multimediatype": "GIF image file",
            "@type": "IMAGE-THUMBNAIL",
            "@size": "5062",
            "@ref": "gr5",
            "@mimetype": "image/gif"
          },
          {
            "@category": "thumbnail",
            "@height": "164",
            "@width": "216",
            "@_fa": "true",
            "$": "https://api.elsevier.com/content/object/eid/1-s2.0-S1381116906005528-gr4.sml?httpAccept=%2A%2F%2A",
            "@multimediatype": "GIF image file",
            "@type": "IMAGE-THUMBNAIL",
            "@size": "3981",
            "@ref": "gr4",
            "@mimetype": "image/gif"
          },
          {
            "@category": "thumbnail",
            "@height": "164",
            "@width": "208",
            "@_fa": "true",
            "$": "https://api.elsevier.com/content/object/eid/1-s2.0-S1381116906005528-gr3.sml?httpAccept=%2A%2F%2A",
            "@multimediatype": "GIF image file",
            "@type": "IMAGE-THUMBNAIL",
            "@size": "4136",
            "@ref": "gr3",
            "@mimetype": "image/gif"
          },
          {
            "@category": "thumbnail",
            "@height": "163",
            "@width": "99",
            "@_fa": "true",
            "$": "https://api.elsevier.com/content/object/eid/1-s2.0-S1381116906005528-gr2.sml?httpAccept=%2A%2F%2A",
            "@multimediatype": "GIF image file",
            "@type": "IMAGE-THUMBNAIL",
            "@size": "9649",
            "@ref": "gr2",
            "@mimetype": "image/gif"
          },
          {
            "@category": "thumbnail",
            "@height": "81",
            "@width": "219",
            "@_fa": "true",
            "$": "https://api.elsevier.com/content/object/eid/1-s2.0-S1381116906005528-gr1.sml?httpAccept=%2A%2F%2A",
            "@multimediatype": "GIF image file",
            "@type": "IMAGE-THUMBNAIL",
            "@size": "3715",
            "@ref": "gr1",
            "@mimetype": "image/gif"
          },
          {
            "@category": "thumbnail",
            "@height": "61",
            "@width": "219",
            "@_fa": "true",
            "$": "https://api.elsevier.com/content/object/eid/1-s2.0-S1381116906005528-fx1.sml?httpAccept=%2A%2F%2A",
            "@multimediatype": "GIF image file",
            "@type": "IMAGE-THUMBNAIL",
            "@size": "3739",
            "@ref": "fx1",
            "@mimetype": "image/gif"
          },
          {
            "@category": "thumbnail",
            "@height": "15",
            "@width": "24",
            "@_fa": "true",
            "$": "https://api.elsevier.com/content/object/eid/1-s2.0-S1381116906005528-si2.gif?httpAccept=%2A%2F%2A",
            "@multimediatype": "GIF image file",
            "@type": "ALTIMG",
            "@size": "173",
            "@ref": "si2",
            "@mimetype": "image/gif"
          },
          {
            "@category": "thumbnail",
            "@height": "15",
            "@width": "39",
            "@_fa": "true",
            "$": "https://api.elsevier.com/content/object/eid/1-s2.0-S1381116906005528-si1.gif?httpAccept=%2A%2F%2A",
            "@multimediatype": "GIF image file",
            "@type": "ALTIMG",
            "@size": "239",
            "@ref": "si1",
            "@mimetype": "image/gif"
          }
        ]
      },
      "link": {
        "@rel": "abstract",
        "@href": "https://api.elsevier.com/content/abstract/scopus_id/33646161460"
      }
    }
  }
}