{
  "metadata": {
    "title": "Preparation of heterogeneous catalysts supported on mesoporous molecular sieves modified with various N-groups and their use in the Heck reaction",
    "authors": "; ; ",
    "journal": "Journal of Molecular Catalysis A: Chemical",
    "date": "2009-04-01",
    "doi": "10.1016/j.molcata.2008.11.025",
    "abstract": "",
    "uri": "https://api.elsevier.com/content/article/pii/S1381116908005633",
    "pii": "S1381116908005633"
  },
  "fulltext": {
    "full-text-retrieval-response": {
      "scopus-eid": "2-s2.0-62649107110",
      "originalText": "serial JL 271358 291210 291744 291790 291809 31 Journal of Molecular Catalysis A: Chemical JOURNALMOLECULARCATALYSISACHEMICAL 2008-11-28 2008-11-28 2010-04-16T17:45:36 1-s2.0-S1381116908005633 S1381-1169(08)00563-3 S1381116908005633 10.1016/j.molcata.2008.11.025 S300 S300.1 FULL-TEXT 1-s2.0-S1381116909X00038 2022-06-21T06:16:38.553855Z 0 0 20090401 2009 2008-11-28T00:00:00Z articleinfo crossmark dco dateupdated tomb dateloaded datesearch indexeddate issuelist volumelist yearnav absattachment articletitlenorm authfirstinitialnorm authfirstsurnamenorm cid cids contenttype copyright dateloadedtxt docsubtype doctype doi eid ewtransactionid hubeid issfirst issn issnnorm itemstage itemtransactionid itemweight openaccess openarchive pg pgfirst pglast pii piinorm pubdatestart pubdatetxt pubyr sortorder srctitle srctitlenorm srctype subheadings volfirst volissue webpdf webpdfpagecount figure table body acknowledge affil articletitle auth authfirstini authfull authkeywords authlast primabst ref specialabst alllist content subj ssids 1381-1169 13811169 302 302 1 2 1 2 Volume 302, Issues 1–2 8 28 35 28 35 20090401 1 April 2009 2009-04-01 2009 article fla Copyright © 2008 Elsevier B.V. All rights reserved. PREPARATIONHETEROGENEOUSCATALYSTSSUPPORTEDMESOPOROUSMOLECULARSIEVESMODIFIEDVARIOUSNGROUPSUSEINHECKREACTION DEMEL J 1 Introduction 2 Results and discussion 2.1 Preparation and characterisation of the catalysts 2.2 Catalytic tests 3 Conclusions 4 Experimental 4.1 Materials and methods 4.2 Preparation of catalysts 4.2.1 Modification of material 1 4.2.2 Preparation of catalyst 3 4.2.3 Preparation of catalyst 4 4.2.4 Preparation of catalyst 5 4.2.5 Preparation of catalyst 6 4.2.6 Preparation of catalyst 7 4.2.7 Preparation of catalyst 8 4.3 Catalytic tests Acknowledgements References BRASE 1998 99 166 S METALCATALYZEDCROSSCOUPLINGREACTIONS BRASE 2004 217 315 S METALCATALYZEDCROSSCOUPLINGREACTIONS HECK 1972 2320 R MIZOROKI 1971 581 T ASTRUC 2007 1884 D JEFFERY 1984 1287 T PRYJOMSKARAY 2006 3 I REETZ 2004 1559 M REETZ 1996 1921 M CHANDRASEKHAR 2002 4399 S GNIEWEK 2005 332 A CORMA 2006 87 A MEIER 2006 3001 M BELETSKAYA 2006 154 I RIBIERE 2006 10456 P SCOTT 2005 692 R AUGUSTINE 1995 277 R MEHNERT 1998 12289 C CORMA 2002 179 A CORMA 2003 41 A CORMA 2004 77 A PAPP 2005 7725 A LI 2004 1990 L CORMA 2005 97 A BECK 1992 10834 J TAGUCHI 2005 1 A HU 2005 1561 Q CRUDDEN 2005 10045 C XU 2007 98 Q WEBB 2007 97 J CRUDDEN 2007 247 C SHIMIZU 2004 141 K PAETZOLD 2001 517 E KOSSLICK 2001 537 H HORNIAKOVA 2004 73 J CLARK 2000 53 J MUBOFU 2001 23 E PAUL 2004 107 S LAGASI 2002 61 M GONZALEZARELLANO 2004 C MACQUARRIE 2001 102 D YI 1990 297 P ZHOU 2002 289 J MANDAL 2004 3714 S ZHAO 2004 139 S VASSYLYEV 2005 6865 O POLSHETTIWAR 2007 6784 V LI 2007 1635 H SUJANDI 2007 1446 SUJANDI 2006 4131 AIKEN 1999 1 J SCHMID 1992 1709 G HAGEN 2005 1819 C HAGEN 2005 4423 C JASKA 2004 1334 C JASKA 2004 9776 C DEMEL 2008 63 J THATHAGAR 2006 2886 M DEMEL 2007 127 J DEMELX2009X28 DEMELX2009X28X35 DEMELX2009X28XJ DEMELX2009X28X35XJ 2022-06-10T15:23:38.376Z http://vtw.elsevier.com/data/voc/AddOnTypes/50.7/aggregated-refined Ministry of Education, Youth and Sport of the Czech Republic LC06070 MSM0021620857 MŠMT Ministerstvo Školství, Mládeže a Tělovýchovy http://data.elsevier.com/vocabulary/SciValFunders/501100001823 http://sws.geonames.org/3077311/ Grant Agency of the Czech Republic 104/09/0561 GA ČR Grantová Agentura České Republiky http://data.elsevier.com/vocabulary/SciValFunders/501100001824 http://sws.geonames.org/3077311/ This work was financially supported by the Grant Agency of the Czech Republic (project no. 104/09/0561) and is a part of the long-term research projects of Faculty of Science, Charles University supported by the Ministry of Education, Youth and Sport of the Czech Republic (project nos. LC06070 and MSM0021620857). item S1381-1169(08)00563-3 S1381116908005633 1-s2.0-S1381116908005633 10.1016/j.molcata.2008.11.025 271358 2010-09-21T22:44:13.020965-04:00 2009-04-01 1-s2.0-S1381116908005633-main.pdf https://s3.amazonaws.com/prod-ucs-content-store-us-east/content/pii:S1381116908005633/MAIN/application/pdf/73ac772eac9c7da3f2033b53e8f86942/main.pdf https://s3-eu-west-1.amazonaws.com/prod-ucs-content-store-eu-west/content/pii:S1381116908005633/MAIN/application/pdf/73ac772eac9c7da3f2033b53e8f86942/main.pdf main.pdf pdf true 1331429 MAIN 8 1-s2.0-S1381116908005633-main_1.png https://s3.amazonaws.com/prod-ucs-content-store-us-east/content/pii:S1381116908005633/PREVIEW/image/png/64cbfc3a630d550bf10518d8ead1174f/main_1.png https://s3-eu-west-1.amazonaws.com/prod-ucs-content-store-eu-west/content/pii:S1381116908005633/PREVIEW/image/png/64cbfc3a630d550bf10518d8ead1174f/main_1.png main_1.png png 59087 849 656 IMAGE-WEB-PDF 1 1-s2.0-S1381116908005633-sc1.jpg https://s3.amazonaws.com/prod-ucs-content-store-us-east/content/pii:S1381116908005633/sc1/DOWNSAMPLED/image/jpeg/4de8c272f502885ab22112a381cf76a1/sc1.jpg https://s3-eu-west-1.amazonaws.com/prod-ucs-content-store-eu-west/content/pii:S1381116908005633/sc1/DOWNSAMPLED/image/jpeg/4de8c272f502885ab22112a381cf76a1/sc1.jpg sc1 sc1.jpg jpg 35981 274 753 IMAGE-DOWNSAMPLED 1-s2.0-S1381116908005633-sc1.sml https://s3.amazonaws.com/prod-ucs-content-store-us-east/content/pii:S1381116908005633/sc1/THUMBNAIL/image/gif/c7c1e9bf6138f994d4208dce7095f3ec/sc1.sml https://s3-eu-west-1.amazonaws.com/prod-ucs-content-store-eu-west/content/pii:S1381116908005633/sc1/THUMBNAIL/image/gif/c7c1e9bf6138f994d4208dce7095f3ec/sc1.sml sc1 sc1.sml sml 2230 80 219 IMAGE-THUMBNAIL 1-s2.0-S1381116908005633-sc2.jpg https://s3.amazonaws.com/prod-ucs-content-store-us-east/content/pii:S1381116908005633/sc2/DOWNSAMPLED/image/jpeg/5204f6e36170769612fbedc5e0bf9c4e/sc2.jpg https://s3-eu-west-1.amazonaws.com/prod-ucs-content-store-eu-west/content/pii:S1381116908005633/sc2/DOWNSAMPLED/image/jpeg/5204f6e36170769612fbedc5e0bf9c4e/sc2.jpg sc2 sc2.jpg jpg 4979 52 386 IMAGE-DOWNSAMPLED 1-s2.0-S1381116908005633-sc2.sml https://s3.amazonaws.com/prod-ucs-content-store-us-east/content/pii:S1381116908005633/sc2/THUMBNAIL/image/gif/301d0fdd7790c6e38fe91f6fcf375b00/sc2.sml https://s3-eu-west-1.amazonaws.com/prod-ucs-content-store-eu-west/content/pii:S1381116908005633/sc2/THUMBNAIL/image/gif/301d0fdd7790c6e38fe91f6fcf375b00/sc2.sml sc2 sc2.sml sml 856 29 219 IMAGE-THUMBNAIL 1-s2.0-S1381116908005633-gr1.jpg https://s3.amazonaws.com/prod-ucs-content-store-us-east/content/pii:S1381116908005633/gr1/DOWNSAMPLED/image/jpeg/40c2d893b3c58b63b516d13db1a6928c/gr1.jpg https://s3-eu-west-1.amazonaws.com/prod-ucs-content-store-eu-west/content/pii:S1381116908005633/gr1/DOWNSAMPLED/image/jpeg/40c2d893b3c58b63b516d13db1a6928c/gr1.jpg gr1 gr1.jpg jpg 23254 305 376 IMAGE-DOWNSAMPLED 1-s2.0-S1381116908005633-gr1.sml https://s3.amazonaws.com/prod-ucs-content-store-us-east/content/pii:S1381116908005633/gr1/THUMBNAIL/image/gif/57834866070bbc21819b95725aec3052/gr1.sml https://s3-eu-west-1.amazonaws.com/prod-ucs-content-store-eu-west/content/pii:S1381116908005633/gr1/THUMBNAIL/image/gif/57834866070bbc21819b95725aec3052/gr1.sml gr1 gr1.sml sml 3861 164 202 IMAGE-THUMBNAIL 1-s2.0-S1381116908005633-gr2.jpg https://s3.amazonaws.com/prod-ucs-content-store-us-east/content/pii:S1381116908005633/gr2/DOWNSAMPLED/image/jpeg/5dd4b64b566ba03fbb5f1281d1c18d04/gr2.jpg https://s3-eu-west-1.amazonaws.com/prod-ucs-content-store-eu-west/content/pii:S1381116908005633/gr2/DOWNSAMPLED/image/jpeg/5dd4b64b566ba03fbb5f1281d1c18d04/gr2.jpg gr2 gr2.jpg jpg 21046 303 367 IMAGE-DOWNSAMPLED 1-s2.0-S1381116908005633-gr2.sml https://s3.amazonaws.com/prod-ucs-content-store-us-east/content/pii:S1381116908005633/gr2/THUMBNAIL/image/gif/5863c4d09fa5a893f1ecf33c1011dab4/gr2.sml https://s3-eu-west-1.amazonaws.com/prod-ucs-content-store-eu-west/content/pii:S1381116908005633/gr2/THUMBNAIL/image/gif/5863c4d09fa5a893f1ecf33c1011dab4/gr2.sml gr2 gr2.sml sml 3369 164 198 IMAGE-THUMBNAIL 1-s2.0-S1381116908005633-gr3.jpg https://s3.amazonaws.com/prod-ucs-content-store-us-east/content/pii:S1381116908005633/gr3/DOWNSAMPLED/image/jpeg/d66664740c2440ef5d2ed1a57d6e9989/gr3.jpg https://s3-eu-west-1.amazonaws.com/prod-ucs-content-store-eu-west/content/pii:S1381116908005633/gr3/DOWNSAMPLED/image/jpeg/d66664740c2440ef5d2ed1a57d6e9989/gr3.jpg gr3 gr3.jpg jpg 13879 311 376 IMAGE-DOWNSAMPLED 1-s2.0-S1381116908005633-gr3.sml https://s3.amazonaws.com/prod-ucs-content-store-us-east/content/pii:S1381116908005633/gr3/THUMBNAIL/image/gif/595f36bd8f49a7598f2c6a8777a6d924/gr3.sml https://s3-eu-west-1.amazonaws.com/prod-ucs-content-store-eu-west/content/pii:S1381116908005633/gr3/THUMBNAIL/image/gif/595f36bd8f49a7598f2c6a8777a6d924/gr3.sml gr3 gr3.sml sml 2353 164 198 IMAGE-THUMBNAIL 1-s2.0-S1381116908005633-gr4.jpg https://s3.amazonaws.com/prod-ucs-content-store-us-east/content/pii:S1381116908005633/gr4/DOWNSAMPLED/image/jpeg/f09820b038a484c5254977b61e405b0c/gr4.jpg https://s3-eu-west-1.amazonaws.com/prod-ucs-content-store-eu-west/content/pii:S1381116908005633/gr4/DOWNSAMPLED/image/jpeg/f09820b038a484c5254977b61e405b0c/gr4.jpg gr4 gr4.jpg jpg 19219 295 376 IMAGE-DOWNSAMPLED 1-s2.0-S1381116908005633-gr4.sml https://s3.amazonaws.com/prod-ucs-content-store-us-east/content/pii:S1381116908005633/gr4/THUMBNAIL/image/gif/8c72c2690259c8ffbd5f5a5bdb25c55c/gr4.sml https://s3-eu-west-1.amazonaws.com/prod-ucs-content-store-eu-west/content/pii:S1381116908005633/gr4/THUMBNAIL/image/gif/8c72c2690259c8ffbd5f5a5bdb25c55c/gr4.sml gr4 gr4.sml sml 3470 164 209 IMAGE-THUMBNAIL 1-s2.0-S1381116908005633-gr5.jpg https://s3.amazonaws.com/prod-ucs-content-store-us-east/content/pii:S1381116908005633/gr5/DOWNSAMPLED/image/jpeg/8d188050d67f0f62e63438b6f2794165/gr5.jpg https://s3-eu-west-1.amazonaws.com/prod-ucs-content-store-eu-west/content/pii:S1381116908005633/gr5/DOWNSAMPLED/image/jpeg/8d188050d67f0f62e63438b6f2794165/gr5.jpg gr5 gr5.jpg jpg 101252 339 687 IMAGE-DOWNSAMPLED 1-s2.0-S1381116908005633-gr5.sml https://s3.amazonaws.com/prod-ucs-content-store-us-east/content/pii:S1381116908005633/gr5/THUMBNAIL/image/gif/10fe138d24ef8f798d43235893ee9c09/gr5.sml https://s3-eu-west-1.amazonaws.com/prod-ucs-content-store-eu-west/content/pii:S1381116908005633/gr5/THUMBNAIL/image/gif/10fe138d24ef8f798d43235893ee9c09/gr5.sml gr5 gr5.sml sml 7292 108 219 IMAGE-THUMBNAIL 1-s2.0-S1381116908005633-gr6.jpg https://s3.amazonaws.com/prod-ucs-content-store-us-east/content/pii:S1381116908005633/gr6/DOWNSAMPLED/image/jpeg/42ef3313cc04dce82be12ae986d56517/gr6.jpg https://s3-eu-west-1.amazonaws.com/prod-ucs-content-store-eu-west/content/pii:S1381116908005633/gr6/DOWNSAMPLED/image/jpeg/42ef3313cc04dce82be12ae986d56517/gr6.jpg gr6 gr6.jpg jpg 100273 339 685 IMAGE-DOWNSAMPLED 1-s2.0-S1381116908005633-gr6.sml https://s3.amazonaws.com/prod-ucs-content-store-us-east/content/pii:S1381116908005633/gr6/THUMBNAIL/image/gif/b341c3ea8d8fdc96ecbeb361f92342f7/gr6.sml https://s3-eu-west-1.amazonaws.com/prod-ucs-content-store-eu-west/content/pii:S1381116908005633/gr6/THUMBNAIL/image/gif/b341c3ea8d8fdc96ecbeb361f92342f7/gr6.sml gr6 gr6.sml sml 7344 108 219 IMAGE-THUMBNAIL 1-s2.0-S1381116908005633-gr7.jpg https://s3.amazonaws.com/prod-ucs-content-store-us-east/content/pii:S1381116908005633/gr7/DOWNSAMPLED/image/jpeg/13397082cc6a7ec71133e8c0937b29ac/gr7.jpg https://s3-eu-west-1.amazonaws.com/prod-ucs-content-store-eu-west/content/pii:S1381116908005633/gr7/DOWNSAMPLED/image/jpeg/13397082cc6a7ec71133e8c0937b29ac/gr7.jpg gr7 gr7.jpg jpg 70174 339 687 IMAGE-DOWNSAMPLED 1-s2.0-S1381116908005633-gr7.sml https://s3.amazonaws.com/prod-ucs-content-store-us-east/content/pii:S1381116908005633/gr7/THUMBNAIL/image/gif/5abff61ed22e975b378d7dee771f2b10/gr7.sml https://s3-eu-west-1.amazonaws.com/prod-ucs-content-store-eu-west/content/pii:S1381116908005633/gr7/THUMBNAIL/image/gif/5abff61ed22e975b378d7dee771f2b10/gr7.sml gr7 gr7.sml sml 6181 108 219 IMAGE-THUMBNAIL 1-s2.0-S1381116908005633-fx1.jpg https://s3.amazonaws.com/prod-ucs-content-store-us-east/content/pii:S1381116908005633/fx1/DOWNSAMPLED/image/jpeg/0b2ec8447609cbdbf8c881f9ef0104fc/fx1.jpg https://s3-eu-west-1.amazonaws.com/prod-ucs-content-store-eu-west/content/pii:S1381116908005633/fx1/DOWNSAMPLED/image/jpeg/0b2ec8447609cbdbf8c881f9ef0104fc/fx1.jpg fx1 true fx1.jpg jpg 3267 58 254 IMAGE-DOWNSAMPLED 1-s2.0-S1381116908005633-fx1.sml https://s3.amazonaws.com/prod-ucs-content-store-us-east/content/pii:S1381116908005633/fx1/THUMBNAIL/image/gif/1e6aed87772fbd8da147cc0ef125142b/fx1.sml https://s3-eu-west-1.amazonaws.com/prod-ucs-content-store-eu-west/content/pii:S1381116908005633/fx1/THUMBNAIL/image/gif/1e6aed87772fbd8da147cc0ef125142b/fx1.sml fx1 true fx1.sml sml 1104 50 219 IMAGE-THUMBNAIL MOLCAA 7367 S1381-1169(08)00563-3 10.1016/j.molcata.2008.11.025 Elsevier B.V. Fig. 1 Nitrogen adsorption isotherms for material 1 (A), material 2 (B), and catalyst 3 (C). The isotherms for material 2 and catalyst 3 are shifted by 200 and 400cm3 g−1, respectively, to avoid overlapping. Fig. 2 FTIR spectra of catalyst 3, its parent material 2 and Pd(OAc)2 in Nujol mulls. For clarity, the spectra were shifted along the A-axis. Fig. 3 Kinetic profiles of the coupling reaction with catalysts 3, 7 and 8 under hydrothermal conditions (160°C) in the presence of sodium acetate as the base. Fig. 4 X-ray powder diffraction patterns of fresh catalyst 3 (bottom trace) and the sample recovered from the reaction mixture after conventional heating to 160°C for 4h (top trace). Fig. 5 HR TEM images of fresh catalyst 3: a view of the representative area (left) and a detail of the metallic particles (right). Fig. 6 HR TEM images of catalyst 3 recovered after conventional hydrothermal reaction: a view of the representative area (left) and a detail of the metallic particles (right). Fig. 7 HR TEM images of catalyst 3 recovered from a MW-treated reaction mixture: a general view (left) and a detailed view of the aggregated particles (right). Scheme 1 The modified mesoporous molecular sieves studied. Scheme 2 Table 1 Analytical and textural characteristics of 1–8. Sample Pd content (mmolg−1) N/Pd atom ratio BET surface area (m2 g−1) Void volume (cm3 g−1) Pore size (nm) Material 1 – – 700 0.95 6.2 Material 2 – – 495 1.27 8.0 Catalyst 3 0.110 6.5 472 1.12 8.0 Catalyst 4 0.099 44 219 0.43 5.0 Catalyst 5 0.103 17 390 0.79 5.9 Catalyst 6 0.093 4.3 424 0.67 5.3 Catalyst 7 0.101 16 430 0.84 5.7 Catalyst 8 0.103 12 381 1.01 8.1 Table 2 Summary of the catalytic results a . Entry Catalyst Conditions Base Conversion (%) b 1 3 MW, 30min – 5 2 6 MW, 30min – 1 3 7 MW, 30min – 14 4 8 MW, 30min – 5 5 3 MW, 30min + 84 6 3 c MW, 30min + 39 7 4 MW, 30min + 0 8 5 MW, 30min + 9 9 6 MW, 30min + 33 10 7 MW, 30min + 90 11 7 d MW, 30min + 34 12 8 MW, 30min + 94 13 3 T, 4h – 2 14 7 T, 4h – 5 15 8 T, 4h – 1 16 3 T, 4h + 84 17 7 T, 4h + 71 18 8 T, 4h + 57 a The reactions were performed under nitrogen atmosphere at 160°C (solvothermal experiments, T) or 165°C (microware irradiation, MW) with n-butyl acrylate (0.5mmol), bromobenzene (0.75mmol), sodium acetate as the base (0.75mmol, if appropriate), mesitylene (internal standard, 0.42mmol), DMA (2.5mL) and catalyst (1mol% with respect to n-butyl acrylate). For details, see Section 4. b Determined by gas chromatography. c 0.5mol% Pd. d Recycled catalyst 7 (from experiment no. 10). Table 3 The amount of leached-out palladium. Entry Catalyst Heating a Pd in solution (ppm) % total Pd 1 3 MW 23 11 2 4 MW 13 6 3 5 MW Trace b <1 4 6 MW 121 57 5 7 MW 7 s3 6 8 MW 107 50 7 3 T (hot) c 27 13 8 3 T (cold) c 18 8 a Heating for 30min (MW) or 4h (T). b Below ca. 2.5ppm (detection limit). c The catalyst was filtered off before (hot) or after (cold) cooling of the reaction mixture using a syringe PTFE filter (declared pore size 0.45μm). Preparation of heterogeneous catalysts supported on mesoporous molecular sieves modified with various N-groups and their use in the Heck reaction Jan Demel a b Sujandi c Sang-Eon Park c Jiří Čejka b ⁎ Petr Štěpnička a ⁎ a Charles University in Prague, Faculty of Science, Department of Inorganic Chemistry, Hlavova 2030, 12840 Prague 2, Czech Republic b J. Heyrovský Institute of Physical Chemistry, Academy of Sciences of the Czech Republic, v.v.i, Dolejškova 3, 18223 Prague 8, Czech Republic c Laboratory of Nano-Green Catalysis, Nano Center for Fine Chemicals Fusion Technology, Department of Chemistry, Inha University, Incheon 402-751, Republic of Korea ⁎ Corresponding authors. Fax: +420 221 951 253. Graphical abstract Catalytic performance of supported catalysts obtained from mesoporous molecular sieves modified with N-donor groups and palladium(II) acetate in the Heck coupling is controlled by the modifying group. The most efficient catalyst possessing ≡SiCH2CH2CH2NH2 and ≡SiCH2CH2CH2NHCH2CH2NEt2 groups afforded the coupling product in conversion as high as 90% under microwave irradiation for 30min and up to 84% under solvothermal conditions (160°C/4h) when combined with sodium acetate. The latter catalyst also displayed considerable bifunctional (i.e., metal-containing and basic) character. A series of supported catalysts has been prepared from palladium(II) acetate and mesoporous molecular sieves bearing various N-donor groups at their surface and probed in the Heck coupling between n-butyl acrylate and bromobenzene to give n-butyl cinnamate. The results indicate that the catalytic activity as well as the amount of leached metal depends on the nature of the nitrogen modifying group. The best catalysts were obtained from the sieves bearing the ≡SiCH2CH2CH2NH2 or ≡SiCH2CH2CH2NHCH2CH2NEt2 groups at the surface. When combined with sodium acetate, the former catalyst provided the coupling product with conversions as high as 84% under microwave irradiation for 30min and 84% under solvothermal conditions (160°C/4h) whereas application of the latter catalyst resulted in conversions 90% and 71% under identical reaction conditions (all at 1mol% Pd loading). Conversions of 5% and 14%, respectively, were achieved with these catalysts under microwave conditions without an external base, which corresponds to the consumption of 77% and 88% amine sites by the liberated HBr. The particle growth leading to the catalyst deactivation was studied by high-resolution transmission electron microscopy and by X-ray powder diffraction. Keywords Supported catalysts Palladium Bifunctional catalysts Nanoparticles Mesoporous molecular sieves Heck reaction TEM measurements 1 Introduction Heck reaction is a powerful synthetic tool for the construction of organic molecules via C–C bond coupling between aryl halides and alkenes [1]. Although many efficient catalytic systems have been reported in the literature, including those tailored for specific substrates and reaction conditions, the search for new catalytic systems is still challenging. The current catalyst design is mainly aimed at the development of catalysts that avoid elaborate (and often expensive) supporting ligands, could be re-used and are environmentally benign. Ligand-free catalysts have been tested soon after the discovery of the Heck reaction [2]. Later on, it was found that the ligandless coupling proceeds more easily in the presence of additives that stabilise the palladium particles formed (nanoparticles) [3] via preventing their aggregation. The typical stabilising agents are tetraalkylammonium salts [4], polar solvents [5], polymers [6], and dendrimers [7]. Several research groups have deposited palladium species also onto various solid supports [8]. Mesoporous molecular sieves of MCM-41 and SBA-15 types [8b,g,f] are among the most frequently tested supports because of their large surface areas, high thermal stability, narrow pore size distribution and well-defined ordered structure [9]. However, since the metallic particles often tend to leach from the support, it is advantageous to modify the solid matrix so as to provide an additional stabilisation of the metallic particles. Indeed, a number of palladium catalysts prepared by using siliceous supports modified with various N-containing organic groups has been reported in the literature [10]. The prominent examples include silica-bound Schiff bases [11] and molecular sieves possessing aliphatic amino or ammonium groups at their surface [12]. We found such materials particularly attractive since their properties might be easily tuned via modifying groups. In addition, the combination of palladium nanoparticles and basic sites capable of binding the acidic by-products can allow for the design of highly active bifunctional catalysts. In search of such materials, we have designed a series of palladium catalysts supported with aminoalkyl group-modified mesoporous molecular sieves. In this contribution, we report on the preparation and characterisation of these materials and results of their catalytic testing in the Heck reaction of n-butyl acrylate and bromobenzene. 2 Results and discussion 2.1 Preparation and characterisation of the catalysts 3-Chloropropyl- (cubic with MCM-48 type morphology; material 1) and 3-aminopropyl-modified (SBA-15 type; material 2) all-siliceous molecular sieves were prepared by direct template synthesis in a microwave oven using Pluronic tri-block copolymer as an organic template and sodium metasilicate as the silica source [13,14]. These sieves were subsequently converted to materials bearing pendant N-groups at the surface via alkylation reactions with the appropriate amine (for the 3-chloropropylated sieve) or by condensation with 2-pyridinecarboxaldehyde (3-aminopropylated sieve). The resulting materials were treated with palladium(II) acetate to give catalysts 3–8 (Scheme 1 ). For the sake of comparison, the series of catalysts was designed comprising the N-groups reported in the literature as well as newly prepared ones. From the modifying groups already established in the literature, we chose (2-pyridyl)imine (catalyst 8) [11a–e,g], –(CH2)3NH2 (catalyst 3) [12b–e], –(CH2)3NH(CH2)2NH2 (catalyst 5) [12e,g], and –(CH2)3NEt2 (catalyst 6) [12d]. On the other hand, the newly introduced materials are those bearing the –(CH2)3NH(CH2)2N[(CH2)2NH2]2 (catalyst 4) and –(CH2)3NH(CH2)2NEt2 groups (catalyst 7). Since one of the main goals of this study was to find nitrogen groups that would not only stabilise active palladium species during the reaction but also bind the acidic by-products, our catalysts possessed an excess of nitrogen groups over the palladium to possibly ensure bifunctional reactivity. The (N-group)/Pd molar ratios ranged from 4.3 for catalyst 6 to 11.2 for catalyst 4 while the atomic N/Pd ratios were even higher for the catalysts bearing groups possessing two or more nitrogen atoms (catalysts 4–8; see Table 1 ). The resulting materials were characterised by elemental analysis, IR spectroscopy, powder X-ray diffraction, nitrogen adsorption isotherms and by high-resolution transmission electron microscopy (HR TEM). In all cases, the palladium content determined by ICP optical emission spectroscopy corresponded well to the amount of Pd(OAc)2 added to the catalysts precursors, indicating practically quantitative deposition of palladium onto the support. Complementary information concerning the degree of surface exchange reaction in catalysts 4–7 was deduced from the chlorine content that corresponds to the amount of unreacted chloropropyl groups [15]. The low chlorine content in catalysts 5 and 7 implies that most of the 3-chloropropyl groups were converted into the respective nitrogen-containing ones (5: no Cl detected; 7: less than ca. 10% Cl remained). By contrast, the extent of the exchange reaction in catalyst 6 as determined from chlorine and nitrogen contents was ca. 40%. This corresponds to a relatively lower reaction temperature compelled from the lower boiling point of the diethylamine educt. X-ray diffraction patterns of the parent materials 1 and 2 and of catalyst 3 showed three or four peaks in the range 2θ <10° typical of ordered mesoporous molecular sieves. Although catalyst 3 exerted slightly lower diffraction intensities compared with the parent material 2 (probably due to its lower regularity), the diffraction data indicate that the support remains largely unchanged after deposition of palladium species. X-ray diffraction also provided valuable information about the growth of palladium nanoparticles (see below). Nitrogen adsorption isotherms recorded for materials 1–8 all displayed a sharp increase in the adsorbed amount in the p/p 0 range of 0.6–0.8 characteristic of mesoporous molecular sieves with narrow pore size distributions (Fig. 1 ). The calculated textural parameters (Table 1) evidenced good quality and ordered structure of the materials. Material 1, a cubic MCM-48 type mesoporous molecular sieve [13], showed significantly larger surface areas and smaller pores than the hexagonal SBA-15 type material 2 [14]. In the case of SBA-15 type materials, the introduction of functional groups (2 → 3 and 8) led to a decrease in the surface area and void volume (the larger modifying group expectedly caused a more pronounced change), while the pore size remained practically the same. The textural properties MCM-48 type materials (1 → 4–7) followed similar though less regular trends. FTIR spectra (Fig. 2 ) were rather inconclusive about the nature of Pd(OAc)2–N-surface interaction, probably due to an excess of nitrogen groups as compared with the amount of anchored palladium. For instance, material 2 displayed a clearly discernible band of NH2 scissoring vibration at 1594cm−1. Addition of palladium(II) acetate to material 2 resulted in a broad composite band between ca. 1500 and 1700cm−1 attributable to scissoring vibration of the NH2 groups with a contribution from ν as(CH3CO2) and the support. A band at 1413cm−1 with a shoulder at 1492cm−1 could be assigned to ν s(CH3CO2), again with a contribution from the vibrational modes of the support. 2.2 Catalytic tests Catalytic activity of the prepared catalysts has been probed in the model Heck reaction between bromobenzene and n-butyl acrylate to give n-butyl cinnamate (Scheme 2 ). The reactions were carried out in N,N-dimethylacetamide (DMA) under microwave irradiation and conventional hydrothermal conditions. The catalytic tests were all performed at 1mol% palladium loading and under similar conditions to allow for a direct assessment of the catalyst performance, namely of the influence of the surface-modifying groups. Materials containing no palladium did not exert any catalytic activity [16]. The results summarised in Table 2 reveal that all catalysts do not necessarily require the presence of an external base for the coupling to proceed: i.e., they are bifunctional. Yet, the amounts of the coupling product were rather low, always lower than the amount of the available base. For instance, the molar ratios n(butyl cinnamate)/n(N) were 0.69 for entry 1, 0.25 for entry 2, 0.88 for entry 3, and 0.42 for entry 4 (under microwave irradiation), and 0.28 for entry 13, 0.31 for entry 14, and 0.08 for entry 15 (under conventional heating). Apparently, the best results were obtained with catalyst 7 under microwave irradiation, where the conversion reached 14% in 30min (entry 3 in Table 2) and most of the available base (N-atoms) was consumed (88% based on theoretical amount of liberated HBr). This catalyst also showed relatively low leaching of the metal component, corresponding to only 3% of the total Pd added to the reaction mixture (Table 3 ). Generally, all the catalysts performed much better in the presence of anhydrous sodium acetate as the external base. The low conversions obtained with catalysts 4 and 5 (entries 7 and 8 in Table 2) can be tentatively attributed to an insufficient activation of the Pd source to active metal (Pd(II)→Pd(0)) under the reaction conditions. This assumption is supported by visual observations as these materials either do not change their colour during the reaction or become only slightly greyish. Catalysts 4 and 5 also showed the lowest amounts of the leached-out metal. This could be a sign of strong Pd-support interactions limiting the amount of the available active metal in the reacting system. The influence of the structure of the anchoring group is probably complex and may change in the presence and the absence of the external base. Nevertheless, the low amount of the leached metal from catalysts 4 and 5 suggests that not the number of nitrogen atoms in the anchoring group but rather their type is the decisive factor controlling the stabilisation (and availability) of the metal component. This can be demonstrated also in the pair of catalysts 3 and 6. Whereas the use of catalyst 3 bearing only the primary amino groups resulted in 84% conversion, its congener possessing tertiary amine groups (–NEt2) showed 33% conversion. The fact that the amounts of leached metal are just opposite, 11% for 3 and 57% for 6 (Table 2), seems to reflect a weaker Pd-surface (Pd-N) interaction in the latter case. Apart from varying overall conversions, the catalyst exerted also different reaction rates. A comparison of kinetic profiles for the coupling reactions performed in the presence of sodium acetate (Fig. 3 ) reveal that catalyst 3 reacted relatively slowly but steadily, acting probably as a source of active metal for the educts. When the amount of palladium in the system was reduced to a half (cf. entries 5 and 6 in Table 2), the catalytic activity dropped to about a half as well. Catalysts 7 and 8 showed a rapid increase in the amount of the coupling product followed by deactivation. In the case of catalyst 7, this can be attributed to a deficiency of the active metal that is not supplied fast enough from the support to compete with relatively rapid deactivation (e.g., growth of metallic particles). On the other hand, the loss of the activity of 8 probably reflects massive leaching of the metal and its rapid deactivation (Table 3). The aggregation of the metallic particles was evidenced by the comparison of the X-ray diffraction patterns recorded for catalyst 3 before and after the reaction under thermal conditions (Fig. 4 ). The fresh catalyst did not exhibit any detectable peak in the region of the (111) diffraction of palladium metal [17] but the recycled one showed a broad diffraction peak, indicating an increase in the coherent diffraction volume and, hence, in the particles size. The particle growth during the reaction was established also by HR TEM analysis. In the microscopic images of the fresh catalyst 3 (Fig. 5 ), there were seen only small spherical metallic particles ca. 5nm in diameter, well dispersed in the support [18]. The same catalyst recovered from the reaction mixture treated under conventional heating (160°C for 4h) showed slightly larger particles (ca. 7–8nm) yet well separated and distributed in the solid matrix (Fig. 6 ). By contrast, catalyst 3 recovered after MW treatment displayed large aggregates consisting of smaller spherical domains (Fig. 7 ). This observation is in line with our previous findings suggesting that the deactivation of the catalyst due to particle growth is faster under MW irradiation than under conventional heating [19]. In addition, the shape of the aggregates indicates that, in addition to the atom chopping mechanism [3,20], simple clustering of metallic particles may also be involved in the particle growth. 3 Conclusions In summary, the catalysts obtained by reacting mesoporous molecular sieves possessing N-donor groups at their surface with palladium(II) acetate catalyse the model Heck reaction both in a standard (with external base) or bifunctional manner under conventional thermal activation or microwave irradiation. It appears likely that the Pd-doped sieves serve as a reservoir of small palladium particles (atoms) that efficiently catalyse the coupling reaction and are (at least partially; see Table 3) re-deposited on the support [21]. The nature of the modifying N-groups seems to determine in large extent the activity of the formed catalyst through controlling, e.g., leaching of the metal component and catalyst deactivation. The most efficient systems bearing the ≡SiCH2CH2CH2NH2 (catalyst 3) and ≡SiCH2CH2CH2NHCH2CH2NEt2 (catalyst 7) groups at their surface appear to be the best catalysts in the series studied, showing relatively low metal leaching and very good activities under both thermal and MW conditions that by far exceed those reported for systems based on unmodified MCM-41 and its ion-exchanged analogues [22] (Note: catalyst 8 gave a higher conversion under solvothermal conditions but suffered from extensive metal leaching). Additionally, catalyst 7 exerts the most pronounced bifunctional character, again surpassing the analogues featuring inorganic basic sites [8d,e,19,22]. As evidenced by HR TEM and by X-ray powder diffraction measurements, growth of the metallic particles is the main deactivation process, leading to a loss of activity upon repeated use. 4 Experimental 4.1 Materials and methods Palladium(II) acetate (Aldrich), mesitylene (Fluka), bromobenzene (Aldrich), n-butyl acrylate (Aldrich), n-butyl cinnamate (Alfa Aesar), dry N,N-dimethylacetamide (Aldrich), diethylamine (Aldrich), poly(ethylene glycol)-block-poly(propylene glycol)-block-poly(ethylene glycol) (Pluronic P123, (ethylene oxide)20(propylene oxide)70(ethylene oxide)20; Aldrich), (3-aminopropyl)triethoxysilane (Aldrich), 3-chloropropyltriethoxysilane (Aldrich), 2-pyridinecarboxaldehyde (Aldrich), N,N,N-tris(2-aminoethyl)amine (Aldrich), 1,2-diaminoethane (Aldrich), and N-{2-(N,N-diethylamino)ethyl}amine (Aldrich) were used without further purification. Toluene was dried over molecular sieve 4 A. Sodium acetate was freshly melted before use to remove traces of water. All the catalysts were handled in air. Nitrogen adsorption isotherms were measured on a Micromeritics ASAP 2020 volumetric instrument at −196°C. Prior to the measurements the samples were carefully degassed at 130°C until pressure of 10−3 Pa was attained (at least for 24h). The textural parameters are summarised in Table 1. X-ray powder diffractograms were recorded with a Bruker D8 X-ray powder diffractometer equipped with a graphite monochromator and position-sensitive detector (Våntec–1) using Cu Kα radiation (λ =1.5412Å) and Bragg–Brentano arrangement (data acquisition details: low 2θ-region: 2θ =0.5–10°, step 0.008536° at 0.5s per step; high 2θ-region: 2θ =36.5–41.8°, step 0.008536° at 25s per step). FT IR spectra were recorded on a Nicolet Magna-IR AEM spectrometer using a cell connected to a vacuum apparatus (128 scans, 4cm−1 resolution). Samples were pressed into self-supporting wafers with the density of ca. 10mgcm−2. Prior to the measurement, the samples were evacuated overnight in order to remove adsorbed water. The palladium content was determined on an ICP-OES spectrometer (IRIS Intrepid II; Thermo Electron Corp.) equipped with an axial plasma and ultrasonic CETAC nebuliser, model U-5000AT+ (conditions: plasma power 1150W, nebuliser pressure 25.0 psi, auxiliary gas flux 1.0mLmin−1, sample uptake 2.4mLmin−1). The samples were first dried at 100°C for 3h and then mineralised in a mixture of concentrated HF and HNO3 (volume ratio 2/3; Suprapur Merck) at 50°C for 15min and diluted with re-distilled water. Analytical line 324.270nm was used for Pd measurements. The content of carbon, hydrogen, nitrogen and chloride was determined by the standard combustion analysis. High-resolution transmission electron micrographs were obtained on a Philips EM 201 instrument operating at 80kV. Copper grid coated with a holey carbon support film was used to prepare the samples: the catalyst samples were dispersed in little ethanol, sonicated for 10min and the carbon coated copper grid was dipped into this suspension. Chloropropylated mesoporous molecular sieve (material 1) was prepared by direct synthesis under microwave irradiation as follows. Template tri-block copolymer P123 (10.0g) and sodium silicate nonahydrate (27.35g, 0.0962mol) were dissolved in water (256mL) by stirring at room temperature for several hours. Then, 35% HCl (67.5mL, 0.78mol) was added and the mixture vessel was immersed into a water bath kept at 50°C. After 1min, (3-chloropropyl)triethoxysilane (1.88g, 7.8mmol; this amount corresponds to 7.5% of all Si atoms in the reaction solution) was added, and the resulting mixture was stirred at 50°C for 1h and then put into microwave oven and heated to 100°C for 3h (see Ref. [13]). Characterisation data for material 1 are as follows: powder X-ray diffraction (2θ/°): 0.91 (s), 1.59 (m), 1.81 (m). Elemental analysis: C 9.7mmolg−1, Cl 0.80mmolg−1. Aminopropylated mesoporous molecular sieve (material 2) was prepared by a procedure similar to the preparation of 1. Template tri-block copolymer P123 (10.0g) and sodium silicate nonahydrate (27.35g, 0.0962mol) were dissolved in water (256mL) by stirring at room temperature for several hours and the solution was treated with (3-aminopropyl)triethoxysilane (1.73g, 7.8mmol; this amount corresponds to 7.5% of all Si atoms in the mixture). The resulting mixture was transferred to a water bath maintained at 50°C and, after 10min, 35% HCl (67.5mL, 0.78mol) was added. The mixture was stirred at 50°C for 1h and then heated in a microwave oven to 100°C for 2h. For details, see Ref. [14]. Characterisation data for material 2 are as follows: IR (cm−1): 3738 (s), 3374 (m), 3312 (m), 2979 (w), 2941 (s), 2874 (s), 1962 (w), 1862 (m), 1593 (s), 1449 (m), 1411 (m), 1392 (w). Powder X-ray diffraction (2θ/°): 0.81 (s), 1.3 (m), 1.6 (m), 2.1 (w). 4.2 Preparation of catalysts 4.2.1 Modification of material 1 Mixture of material 1 (1g) and the corresponding amine (17mmol) in toluene (30mL) was stirred at 100°C for 30h under nitrogen (the reaction with diethylamine was performed at 60°C due to the lower boiling point of this amine). The solid was filtered off, washed out with ethanol and dried. The resulting yellowish powder was stirred in mixture of 25% aqueous ammonia and ethanol (1:3, ca. 100mL) for 3h, the mixture was filtered, and the residue was washed with ethanol and dried in air at 80°C. The resulting solid was directly used in the next step (i.e., for the reaction with palladium(II) acetate; see the following sections). 4.2.2 Preparation of catalyst 3 Material 2 (1g) was added to a solution of palladium acetate (22.5mg, 0.1mmol) in dichloromethane (30mL). The mixture was stirred for 1h at room temperature and then filtered. The solid was thoroughly washed with dichloromethane and dried in air at room temperature. Characterisation: powder X-ray diffraction (2θ/°): 0.8 (s), 1.3 (m), 1.5 (m), 2.0 (w). Elemental analysis: Pd 0.110mmolg−1, C 4.4mmolg−1, N 0.72mmolg−1. IR (cm−1): 3738 (s), 3307 (w), 2937 (m), 1977 (w), 1863 (m), scissoring NH2 1592 (s), 1561 (s), 1410 (s). 4.2.3 Preparation of catalyst 4 Catalyst 4 was prepared by deposition of palladium acetate onto solid support bearing the N-{2-[N,N-bis(2-aminoethyl)aminoethyl]}aminopropyl groups, as given above for catalyst 3. Characterisation: elemental analysis: Pd 0.099mmolg−1, C 11.0mmolg−1, N 4.4mmolg−1, Cl 0.4mmolg−1. IR (cm−1): 1848 (w), 1658 (s), 1597 (s), 1461 (s), 1410 (w), 1354 (m). IR of the parent, amine-modified material (cm−1): 1846 (w), 1649 (s), 1597 (s), 1462 (s), 1409 (w), 1371 (m), 1354 (m). 4.2.4 Preparation of catalyst 5 Catalyst 5 was prepared by deposition of palladium acetate onto solid support containing N-[N-(2-aminoethyl)]aminopropyl groups, as given above for catalyst 3. Characterisation: elemental analysis: Pd 0.103mmolg−1, C 6.6mmolg−1, N 1.8mmolg−1, Cl 0.0mmolg−1. IR (cm−1): 1864 (w), 1656 (s), 1598 (s), 1562 (s), 1552 (s), 1462 (m), 1452 (m), 1412 (s), 1352 (w). IR of the parent, amine-modified material (cm−1): 1968 (w), 1859 (m), 1657 (s), 1602 (s), 1499 (w), 1459 (m), 1412 (w), 1354 (m). 4.2.5 Preparation of catalyst 6 Catalyst 6 was prepared by deposition of palladium acetate onto solid support containing N-(N,N-diethyl)aminopropyl groups, as given above for catalyst 3. Characterisation: elemental analysis: Pd 0.093mmolg−1, C 5.8mmolg−1, N 0.4mmolg−1, Cl 0.7mmolg−1. IR (cm−1): 1973 (w), 1863 (m), 1711 (w), 1558 (s), 1473 (m), 1445 (m), 1412 (s). IR of the parent, amine-modified material (cm−1): 1961 (w), 1863 (m), 1634 (m), 1474 (s), 1461 (s), 1447 (s), 1411 (s), 1396 (m), 1352 (s). 4.2.6 Preparation of catalyst 7 Catalyst 7 was prepared by deposition of palladium acetate onto solid support containing N-[2-(N,N-diethylamino)ethyl]aminopropyl groups, as given above for catalyst 3. Characterisation: elemental analysis: Pd 0.101mmolg−1, C 8.6mmolg−1, N 1.6mmolg−1, Cl 0.1mmolg−1. IR (cm−1): 1983 (w), 1861 (m), 1564 (s), 1470 (s), 1461 (s), 1409 (s), 1395 (s). IR of the parent, amine-modified material (cm−1): 1955 (w), 1855 (m), 1646 (m), 1473 (s), 1472 (s), 1410 (w), 1391 (s), 1352 (m). 4.2.7 Preparation of catalyst 8 Pyridine-2-carboxaldehyde (0.749g, 7mmol) was added to a suspension of material 2 (1g) in ethanol (100mL). The reaction vessel was flushed with nitrogen and the mixture was stirred at room temperature for 17h. Then, the solid part was filtered, washed with ethanol and dried at 80°C on air. Subsequent deposition of palladium acetate was carried out as given above for catalyst 3. Characterisation: elemental analysis: Pd 0.103mmolg−1, C 5.9mmolg−1, N 1.2mmolg−1. IR (cm−1): 3736 (s), 3292 (w), 2937 (s), 1971 (w), 1863 (m), 1722 (m), 1597 (s), 1566 (s), 1550 (s), 1477 (m), 1440 (m), 1412 (s). IR of the parent, N-modified material (cm−1): 1955 (w), 1855 (m), 1646 (m), 1473 (s), 1472 (s), 1410 (w), 1391 (s), 1352 (m). 4.3 Catalytic tests Catalytic tests under microwave irradiation were performed in a microwave oven CEM Discover in a 50mL round flask equipped with a condenser. Hydrothermal catalytic experiments were carried out with a Heidolph Synthesis I (system of 16-parallel reactions). The reaction mixture consisted of n-butyl acrylate (64mg, 0.5mmol), bromobenzene (118mg, 0.75mmol), sodium acetate (63mg, 0.75mmol) if appropriate, mesitylene (50mg, 0.42mmol), DMA (2.5mL) and 50mg of catalyst (1mol% Pd with respect to n-butyl acrylate). The reaction mixture was thoroughly flushed with nitrogen prior to the reaction. Reactions performed under microwave irradiation were carried out at the temperature 165°C (boiling point of DMA) with continuous microwave power 300W. Reactions under conventional hydrothermal conditions were performed at 160°C. The progress of the reaction was monitored by taking samples that were subsequently centrifuged at 4000rpm and analysed by a high-resolution gas chromatography (Agilent 6890 chromatograph equipped with a flame ionisation detector and HP-1 column or Agilent 6850 chromatograph equipped with a flame ionisation detector and HP-5). The identity of the reaction product was checked by GC–MS (Agilent 5975). Acknowledgements This work was financially supported by the Grant Agency of the Czech Republic (project no. 104/09/0561) and is a part of the long-term research projects of Faculty of Science, Charles University supported by the Ministry of Education, Youth and Sport of the Czech Republic (project nos. LC06070 and MSM0021620857). References [1] (a) S. Bräse A. de Meijere F. Diederich P.J. Stang Metal-Catalyzed Cross-Coupling Reactions 1998 Wiley–VCH New York 99 166 (b) S. Bräse A. de Meijere A. de Meijere F. Diederich Metal-Catalyzed Cross-Coupling Reactions 2nd ed. 2004 Wiley–VCH Weinheim 217 315 [2] (a) R.F. Heck J.P. Nolley J. Org. Chem. 37 1972 2320 (b) T. Mizoroki K. Mori A. Ozaki Bull. Chem. Soc. Jpn. 44 1971 581 [3] For a recent introductory review, see: D. Astruc Inorg. Chem. 46 2007 1884 [4] (a) T. Jeffery Chem. Commun. 1984 1287 (b) I. Pryjomska-Ray A.M. Trzeciak J.J. Ziółkowski J. Mol. Catal. A: Chem. 257 2006 3 (c) M.T. Reetz J.G. de Vries Chem. Commun. 2004 1559 [5] M.T. Reetz G. Lohmer Chem. Commun. 1996 1921 [6] (a) S. Chandrasekhar C. Narsihmulu S.S. Sultana N.R. Reddy Org. Lett. 4 2002 4399 (b) A. Gniewek A.M. Trzeciak J.J. Ziółkowski L. Kępiński J. Wrzyszcz W. Tylus J. Catal. 229 2005 332 (c) A. Corma H. García A. Leyva J. Catal. 240 2006 87 (d) M.A.R. Meier M. Filali J.-F. Gohy U.S. Schubert J. Mater. Chem. 16 2006 3001 (e) I.P. Beletskaya A.N. Kashin A.E. Litvinov V.S. Tyurin P.M. Valetsky G. van Koten Organometallics 25 2006 154 (f) P. Ribière V. Declerck Y. Nédellec N. Yadav-Bhatnagar J. Martinez F. Lamaty Tetrahedron 62 2006 10456 [7] R.W.J. Scott O.M. Wilson R.M. Crooks J. Phys. Chem. B 109 2005 692 [8] (a) R.L. Augustine S.T. O’Leary J. Mol. Catal. A: Chem. 95 1995 277 (b) C.P. Mehnert D.W. Weaver J.Y. Ying J. Am. Chem. Soc. 120 1998 12289 (c) A. Corma H. García A. Leyva Appl. Catal. A 236 2002 179 (d) A. Corma H. García A. Leyva A. Primo Appl. Catal. A 247 2003 41 (e) A. Corma H. García A. Leyva A. Primo Appl. Catal. A 257 2004 77 (f) A. Papp G. Galbács Á. Molnár Tetrahedron Lett. 46 2005 7725 (g) L. Li J. Shi J. Yan Chem. Commun. 2004 1990 (h) A. Corma H. Garcia A. Leyva J. Mol. Catal. A: Chem. 230 2005 97 [9] (a) J.S. Beck J.C. Vartuli J.W. Roth M.E. Leonowicz C.T. Kresge K.D. Schmitt C.T.-W. Chu D.H. Olson E.W. Sheppard S.B. McCullen J.B. Higgins J.L. Schlenker J. Am. Chem. Soc. 114 1992 10834 (b) A. Taguchi F. Schüth Micropor. Mesopor. Mater. 77 2005 1 [10] For selected examples of alternative approaches that making use of other anchoring groups, see: (a) Q. Hu J.E. Hampsey N. Jiang C. Li Y. Lu Chem. Mater. 17 2005 1561 (b) C.M. Crudden M. Sateesh R. Lewis J. Am. Chem. Soc. 127 2005 10045 (c) Q. Xu W. Hao M. Cai Catal. Lett. 118 2007 98 (d) J.D. Webb S. MacQuarrie K. McEleney C.M. Crudden J. Catal. 252 2007 97 (e) C.M. Crudden K. McEleney S.L. MacQuarrie A. Blanc M. Sateesh J.D. Webb Pure Appl. Chem. 79 2007 247 (f) K. Shimizu S. Koizumi T. Hatamachi H. Yoshida S. Komai T. Kodama Y. Kitayama J. Catal. 288 2004 141 (g) E. Paetzold G. Oehme H. Fuhrmann M. Richter R. Eckelt M.-M. Pohl H. Kosslick Micropor. Mesopor. Mater. 44–45 2001 517 (h) H. Kosslick I. Mönnich E. Paetzold H. Fuhrmann R. Fricke D. Müller G. Oehme Micropor. Mesopor. Mater. 44–45 2001 537 [11] (a) J. Horniakova T. Raja Y. Kubota Y. Sugi J. Mol. Catal. A: Chem. 217 2004 73 (b) J.H. Clark D.J. Macquarrie E.B. Mobofu Green Chem. 2 2000 53 (c) E.B. Mubofu J.H. Clark D.J. Macquarrie Green Chem. 3 2001 23 (d) S. Paul J.H. Clark J. Mol. Catal. A: Chem. 215 2004 107 (e) M. Lagasi P. Moggi J. Mol. Catal. A: Chem. 182–183 2002 61 (f) C. González-Arellano A. Corma M. Iglesias F. Sánchez Adv. Synth. Catal. 346 2004 1758 (g) D.J. Macquarrie B. Gotov Š. Toma Platinum Met. Rev. 45 2001 102 [12] (a) P. Yi Z. Zhuangyu H. Hongwen J. Mol. Catal. 62 1990 297 (b) J. Zhou R. Zhou L. Mo S. Zhao X. Zheng J. Mol. Catal. A: Chem. 178 2002 289 (c) S. Mandal D. Roy R.V. Chaudhari M. Sastry Chem. Mater. 16 2004 3714 (d) S.F. Zhao R.X. Zhou X.M. Zheng J. Mol. Catal. A: Chem. 211 2004 139 (e) O. Vassylyev J. Chen A.P. Panarello J.G. Khinast Tetrahedron Lett. 46 2005 6865 (f) V. Polshettiwar P. Hesemann J.J.E. Moreau Tetrahedron 63 2007 6784 (g) H. Li L. Wang P. Li Synthesis 2007 1635 [13] Sujandi S.-E. Park Stud. Surf. Sci. Catal. 170 2007 1446 [14] Sujandi S.-E. Park D.-S. Han S.-C. Han M.-J. Jin T. Ohsuna Chem. Commun. 2006 4131 [15] Interpretations based on elemental analysis of samples showing low chlorine contents should be taken with care due to relatively large uncertainity of experimental values close to the detection limit. [16] There was no coupling product detected in the reactions performed (solvothermal reactions for 4h) in the presence of material 1 or the precursor sieve to catalyst 7 (i.e., with the respective amine-modified sieve containing no palladium). [17] PDF card 5-0681: palladium, cubic, space group Fm–3m (no. 225), a =3.8898Å at 26°C; hkl 111, d =2.246Å, relative intensity=100, 2θ ≈40° at Cu Kα. [18] It should be noted, however, that TEM is not fully reliable in this case as the electron beam may induce formation of metallic particles: (a) J.D. Aiken III R.G. Finke J. Mol. Catal. A: Chem. 145 1999 1 (b) G. Schmid Chem. Rev. 92 1992 1709 (c) C.M. Hagen L. Vieille-Petit G. Laurenczy G. Süss-Fink R.G. Finke Organometallics 24 2005 1819 (d) C.M. Hagen J.A. Widegren P.M. Maitlis R.G. Finke J. Am. Chem. Soc. 127 2005 4423 (e) C.A. Jaska I. Manners J. Am. Chem. Soc. 126 2004 1334 (f) C.A. Jaska I. Manners J. Am. Chem. Soc. 126 2004 9776 [19] J. Demel S.-E. Park J. Čejka P. Štěpnička Catal. Today 132 2008 63 [20] M.B. Thathagar J.E. ten Elshof G. Rothenberg Angew. Chem. Int. Ed. 45 2006 2886 [21] See Ref. [3] and references cited therein. [22] J. Demel J. Čejka P. Štěpnička J. Mol. Catal. A: Chem. 274 2007 127",
      "scopus-id": "62649107110",
      "coredata": {
        "eid": "1-s2.0-S1381116908005633",
        "dc:description": "A series of supported catalysts has been prepared from palladium(II) acetate and mesoporous molecular sieves bearing various N-donor groups at their surface and probed in the Heck coupling between n-butyl acrylate and bromobenzene to give n-butyl cinnamate. The results indicate that the catalytic activity as well as the amount of leached metal depends on the nature of the nitrogen modifying group. The best catalysts were obtained from the sieves bearing the ≡SiCH2CH2CH2NH2 or ≡SiCH2CH2CH2NHCH2CH2NEt2 groups at the surface. When combined with sodium acetate, the former catalyst provided the coupling product with conversions as high as 84% under microwave irradiation for 30min and 84% under solvothermal conditions (160°C/4h) whereas application of the latter catalyst resulted in conversions 90% and 71% under identical reaction conditions (all at 1mol% Pd loading). Conversions of 5% and 14%, respectively, were achieved with these catalysts under microwave conditions without an external base, which corresponds to the consumption of 77% and 88% amine sites by the liberated HBr. The particle growth leading to the catalyst deactivation was studied by high-resolution transmission electron microscopy and by X-ray powder diffraction.",
        "openArchiveArticle": "false",
        "prism:coverDate": "2009-04-01",
        "openaccessUserLicense": null,
        "prism:aggregationType": "Journal",
        "prism:url": "https://api.elsevier.com/content/article/pii/S1381116908005633",
        "dc:creator": [
          {
            "@_fa": "true",
            "$": "Demel, Jan"
          },
          {
            "@_fa": "true",
            "$": "Sujandi,"
          },
          {
            "@_fa": "true",
            "$": "Park, Sang-Eon"
          },
          {
            "@_fa": "true",
            "$": "Čejka, Jiří"
          },
          {
            "@_fa": "true",
            "$": "Štěpnička, Petr"
          }
        ],
        "link": [
          {
            "@_fa": "true",
            "@rel": "self",
            "@href": "https://api.elsevier.com/content/article/pii/S1381116908005633"
          },
          {
            "@_fa": "true",
            "@rel": "scidir",
            "@href": "https://www.sciencedirect.com/science/article/pii/S1381116908005633"
          }
        ],
        "dc:format": "application/json",
        "openaccessType": null,
        "pii": "S1381-1169(08)00563-3",
        "prism:volume": "302",
        "prism:publisher": "Elsevier B.V.",
        "dc:title": "Preparation of heterogeneous catalysts supported on mesoporous molecular sieves modified with various N-groups and their use in the Heck reaction",
        "prism:copyright": "Copyright © 2008 Elsevier B.V. All rights reserved.",
        "openaccess": "0",
        "prism:issn": "13811169",
        "prism:issueIdentifier": "1-2",
        "dcterms:subject": [
          {
            "@_fa": "true",
            "$": "Supported catalysts"
          },
          {
            "@_fa": "true",
            "$": "Palladium"
          },
          {
            "@_fa": "true",
            "$": "Bifunctional catalysts"
          },
          {
            "@_fa": "true",
            "$": "Nanoparticles"
          },
          {
            "@_fa": "true",
            "$": "Mesoporous molecular sieves"
          },
          {
            "@_fa": "true",
            "$": "Heck reaction"
          },
          {
            "@_fa": "true",
            "$": "TEM measurements"
          }
        ],
        "openaccessArticle": "false",
        "prism:publicationName": "Journal of Molecular Catalysis A: Chemical",
        "prism:number": "1-2",
        "openaccessSponsorType": null,
        "prism:pageRange": "28-35",
        "prism:endingPage": "35",
        "pubType": "fla",
        "prism:coverDisplayDate": "1 April 2009",
        "prism:doi": "10.1016/j.molcata.2008.11.025",
        "prism:startingPage": "28",
        "dc:identifier": "doi:10.1016/j.molcata.2008.11.025",
        "openaccessSponsorName": null
      },
      "objects": {
        "object": [
          {
            "@category": "standard",
            "@height": "274",
            "@width": "753",
            "@_fa": "true",
            "$": "https://api.elsevier.com/content/object/eid/1-s2.0-S1381116908005633-sc1.jpg?httpAccept=%2A%2F%2A",
            "@multimediatype": "JPEG image file",
            "@type": "IMAGE-DOWNSAMPLED",
            "@size": "35981",
            "@ref": "sc1",
            "@mimetype": "image/jpeg"
          },
          {
            "@category": "thumbnail",
            "@height": "80",
            "@width": "219",
            "@_fa": "true",
            "$": "https://api.elsevier.com/content/object/eid/1-s2.0-S1381116908005633-sc1.sml?httpAccept=%2A%2F%2A",
            "@multimediatype": "GIF image file",
            "@type": "IMAGE-THUMBNAIL",
            "@size": "2230",
            "@ref": "sc1",
            "@mimetype": "image/gif"
          },
          {
            "@category": "standard",
            "@height": "52",
            "@width": "386",
            "@_fa": "true",
            "$": "https://api.elsevier.com/content/object/eid/1-s2.0-S1381116908005633-sc2.jpg?httpAccept=%2A%2F%2A",
            "@multimediatype": "JPEG image file",
            "@type": "IMAGE-DOWNSAMPLED",
            "@size": "4979",
            "@ref": "sc2",
            "@mimetype": "image/jpeg"
          },
          {
            "@category": "thumbnail",
            "@height": "29",
            "@width": "219",
            "@_fa": "true",
            "$": "https://api.elsevier.com/content/object/eid/1-s2.0-S1381116908005633-sc2.sml?httpAccept=%2A%2F%2A",
            "@multimediatype": "GIF image file",
            "@type": "IMAGE-THUMBNAIL",
            "@size": "856",
            "@ref": "sc2",
            "@mimetype": "image/gif"
          },
          {
            "@category": "standard",
            "@height": "305",
            "@width": "376",
            "@_fa": "true",
            "$": "https://api.elsevier.com/content/object/eid/1-s2.0-S1381116908005633-gr1.jpg?httpAccept=%2A%2F%2A",
            "@multimediatype": "JPEG image file",
            "@type": "IMAGE-DOWNSAMPLED",
            "@size": "23254",
            "@ref": "gr1",
            "@mimetype": "image/jpeg"
          },
          {
            "@category": "thumbnail",
            "@height": "164",
            "@width": "202",
            "@_fa": "true",
            "$": "https://api.elsevier.com/content/object/eid/1-s2.0-S1381116908005633-gr1.sml?httpAccept=%2A%2F%2A",
            "@multimediatype": "GIF image file",
            "@type": "IMAGE-THUMBNAIL",
            "@size": "3861",
            "@ref": "gr1",
            "@mimetype": "image/gif"
          },
          {
            "@category": "standard",
            "@height": "303",
            "@width": "367",
            "@_fa": "true",
            "$": "https://api.elsevier.com/content/object/eid/1-s2.0-S1381116908005633-gr2.jpg?httpAccept=%2A%2F%2A",
            "@multimediatype": "JPEG image file",
            "@type": "IMAGE-DOWNSAMPLED",
            "@size": "21046",
            "@ref": "gr2",
            "@mimetype": "image/jpeg"
          },
          {
            "@category": "thumbnail",
            "@height": "164",
            "@width": "198",
            "@_fa": "true",
            "$": "https://api.elsevier.com/content/object/eid/1-s2.0-S1381116908005633-gr2.sml?httpAccept=%2A%2F%2A",
            "@multimediatype": "GIF image file",
            "@type": "IMAGE-THUMBNAIL",
            "@size": "3369",
            "@ref": "gr2",
            "@mimetype": "image/gif"
          },
          {
            "@category": "standard",
            "@height": "311",
            "@width": "376",
            "@_fa": "true",
            "$": "https://api.elsevier.com/content/object/eid/1-s2.0-S1381116908005633-gr3.jpg?httpAccept=%2A%2F%2A",
            "@multimediatype": "JPEG image file",
            "@type": "IMAGE-DOWNSAMPLED",
            "@size": "13879",
            "@ref": "gr3",
            "@mimetype": "image/jpeg"
          },
          {
            "@category": "thumbnail",
            "@height": "164",
            "@width": "198",
            "@_fa": "true",
            "$": "https://api.elsevier.com/content/object/eid/1-s2.0-S1381116908005633-gr3.sml?httpAccept=%2A%2F%2A",
            "@multimediatype": "GIF image file",
            "@type": "IMAGE-THUMBNAIL",
            "@size": "2353",
            "@ref": "gr3",
            "@mimetype": "image/gif"
          },
          {
            "@category": "standard",
            "@height": "295",
            "@width": "376",
            "@_fa": "true",
            "$": "https://api.elsevier.com/content/object/eid/1-s2.0-S1381116908005633-gr4.jpg?httpAccept=%2A%2F%2A",
            "@multimediatype": "JPEG image file",
            "@type": "IMAGE-DOWNSAMPLED",
            "@size": "19219",
            "@ref": "gr4",
            "@mimetype": "image/jpeg"
          },
          {
            "@category": "thumbnail",
            "@height": "164",
            "@width": "209",
            "@_fa": "true",
            "$": "https://api.elsevier.com/content/object/eid/1-s2.0-S1381116908005633-gr4.sml?httpAccept=%2A%2F%2A",
            "@multimediatype": "GIF image file",
            "@type": "IMAGE-THUMBNAIL",
            "@size": "3470",
            "@ref": "gr4",
            "@mimetype": "image/gif"
          },
          {
            "@category": "standard",
            "@height": "339",
            "@width": "687",
            "@_fa": "true",
            "$": "https://api.elsevier.com/content/object/eid/1-s2.0-S1381116908005633-gr5.jpg?httpAccept=%2A%2F%2A",
            "@multimediatype": "JPEG image file",
            "@type": "IMAGE-DOWNSAMPLED",
            "@size": "101252",
            "@ref": "gr5",
            "@mimetype": "image/jpeg"
          },
          {
            "@category": "thumbnail",
            "@height": "108",
            "@width": "219",
            "@_fa": "true",
            "$": "https://api.elsevier.com/content/object/eid/1-s2.0-S1381116908005633-gr5.sml?httpAccept=%2A%2F%2A",
            "@multimediatype": "GIF image file",
            "@type": "IMAGE-THUMBNAIL",
            "@size": "7292",
            "@ref": "gr5",
            "@mimetype": "image/gif"
          },
          {
            "@category": "standard",
            "@height": "339",
            "@width": "685",
            "@_fa": "true",
            "$": "https://api.elsevier.com/content/object/eid/1-s2.0-S1381116908005633-gr6.jpg?httpAccept=%2A%2F%2A",
            "@multimediatype": "JPEG image file",
            "@type": "IMAGE-DOWNSAMPLED",
            "@size": "100273",
            "@ref": "gr6",
            "@mimetype": "image/jpeg"
          },
          {
            "@category": "thumbnail",
            "@height": "108",
            "@width": "219",
            "@_fa": "true",
            "$": "https://api.elsevier.com/content/object/eid/1-s2.0-S1381116908005633-gr6.sml?httpAccept=%2A%2F%2A",
            "@multimediatype": "GIF image file",
            "@type": "IMAGE-THUMBNAIL",
            "@size": "7344",
            "@ref": "gr6",
            "@mimetype": "image/gif"
          },
          {
            "@category": "standard",
            "@height": "339",
            "@width": "687",
            "@_fa": "true",
            "$": "https://api.elsevier.com/content/object/eid/1-s2.0-S1381116908005633-gr7.jpg?httpAccept=%2A%2F%2A",
            "@multimediatype": "JPEG image file",
            "@type": "IMAGE-DOWNSAMPLED",
            "@size": "70174",
            "@ref": "gr7",
            "@mimetype": "image/jpeg"
          },
          {
            "@category": "thumbnail",
            "@height": "108",
            "@width": "219",
            "@_fa": "true",
            "$": "https://api.elsevier.com/content/object/eid/1-s2.0-S1381116908005633-gr7.sml?httpAccept=%2A%2F%2A",
            "@multimediatype": "GIF image file",
            "@type": "IMAGE-THUMBNAIL",
            "@size": "6181",
            "@ref": "gr7",
            "@mimetype": "image/gif"
          },
          {
            "@category": "standard",
            "@height": "58",
            "@width": "254",
            "@_fa": "true",
            "$": "https://api.elsevier.com/content/object/eid/1-s2.0-S1381116908005633-fx1.jpg?httpAccept=%2A%2F%2A",
            "@multimediatype": "JPEG image file",
            "@type": "IMAGE-DOWNSAMPLED",
            "@size": "3267",
            "@ref": "fx1",
            "@mimetype": "image/jpeg"
          },
          {
            "@category": "thumbnail",
            "@height": "50",
            "@width": "219",
            "@_fa": "true",
            "$": "https://api.elsevier.com/content/object/eid/1-s2.0-S1381116908005633-fx1.sml?httpAccept=%2A%2F%2A",
            "@multimediatype": "GIF image file",
            "@type": "IMAGE-THUMBNAIL",
            "@size": "1104",
            "@ref": "fx1",
            "@mimetype": "image/gif"
          }
        ]
      },
      "link": {
        "@rel": "abstract",
        "@href": "https://api.elsevier.com/content/abstract/scopus_id/62649107110"
      }
    }
  }
}