{
  "metadata": {
    "title": "Iron and copper immobilised on mesoporous MCM-41 molecular sieves as catalysts for the oxidation of cyclohexane",
    "authors": "; ; ",
    "journal": "Journal of Molecular Catalysis A: Chemical",
    "date": "1999-07-22",
    "doi": "10.1016/S1381-1169(99)00031-X",
    "abstract": "",
    "uri": "https://api.elsevier.com/content/article/pii/S138111699900031X",
    "pii": "S138111699900031X"
  },
  "fulltext": {
    "full-text-retrieval-response": {
      "scopus-eid": "2-s2.0-0033595297",
      "originalText": "serial JL 271358 291210 291744 291790 291809 31 Journal of Molecular Catalysis A: Chemical JOURNALMOLECULARCATALYSISACHEMICAL 1999-06-02 1999-06-02 2010-04-18T14:19:10 1-s2.0-S138111699900031X S1381-1169(99)00031-X S138111699900031X 10.1016/S1381-1169(99)00031-X S300 S300.1 FULL-TEXT 1-s2.0-S1381116900X01021 2015-05-15T05:56:33.651043-04:00 0 0 19990722 1999 1999-06-02T00:00:00Z articleinfo crossmark dco dateupdated tomb dateloaded datesearch indexeddate issuelist volumelist yearnav articletitlenorm authfirstinitialnorm authfirstsurnamenorm cid cids contenttype copyright dateloadedtxt docsubtype doctype doi eid ewtransactionid hubeid issfirst issn issnnorm itemstage itemtransactionid itemweight openaccess openarchive pg pgfirst pglast pii piinorm pubdatestart pubdatetxt pubyr sortorder srctitle srctitlenorm srctype subheadings volfirst volissue webpdf webpdfpagecount figure table body acknowledge affil articletitle auth authfirstini authfull authkeywords authlast primabst ref alllist content subj ssids 1381-1169 13811169 144 144 1 1 Volume 144, Issue 1 11 91 99 91 99 19990722 22 July 1999 1999-07-22 1999 converted-article fla Copyright © 1999 Elsevier Science B.V. All rights reserved. IRONCOPPERIMMOBILISEDMESOPOROUSMCM41MOLECULARSIEVESCATALYSTSFOROXIDATIONCYCLOHEXANE CARVALHO W 1 Introduction 2 Experimental 2.1 Materials 2.2 Synthesis 2.3 Characterisation 2.4 Oxidation of cyclohexane 3 Results and discussion 4 Conclusions Acknowledgements References VINCENT 1990 1447 J BARTON 1997 3 D SCHUCHARDT 1991 955 U SHELDON 1991 566 R NOTARI 1991 343 B HONICKE 1996 214 D ARENDS 1997 1144 I BALKUS 1995 159 K KUCHEROV 1994 323 A PIRES 1997 1025 E PIRES 1998 69 E ROMANO 1990 33 U HUYBRECHTS 1990 240 D RIGUTTO 1991 L1 M CENTI 1992 2617 G RATNASAMY 1991 329 P MONTES 1990 6425 C CORNARO 1991 165 U CORREA 1997 277 M KRESGE 1992 710 C BECK 1992 10834 J CARVALHO 1997 408 W MASCHMEYER 1995 159 T TANEV 1994 321 P TANEV 1995 865 P MEIER 1992 449 W ERNST 1997 1021 S CORMA 1994 69 A HUO 1996 1147 Q SCHUTH 1995 1306 F GOLDFARB 1994 6344 D BORDIGA 1996 486 S RATNASAMY 1991 329 P SPINACE 1995 631 E CARVALHOX1999X91 CARVALHOX1999X91X99 CARVALHOX1999X91XW CARVALHOX1999X91X99XW item S1381-1169(99)00031-X S138111699900031X 1-s2.0-S138111699900031X 10.1016/S1381-1169(99)00031-X 271358 2010-09-29T22:35:56.651058-04:00 1999-07-22 1-s2.0-S138111699900031X-main.pdf https://s3.amazonaws.com/prod-ucs-content-store-us-east/content/pii:S138111699900031X/MAIN/application/pdf/7de8ed38ce25456e760c729fe74c201d/main.pdf https://s3-eu-west-1.amazonaws.com/prod-ucs-content-store-eu-west/content/pii:S138111699900031X/MAIN/application/pdf/7de8ed38ce25456e760c729fe74c201d/main.pdf main.pdf pdf true 167132 MAIN 9 1-s2.0-S138111699900031X-main_1.png https://s3.amazonaws.com/prod-ucs-content-store-us-east/content/pii:S138111699900031X/PREVIEW/image/png/8f21a3cfdda851aeaf8a37d78a73d724/main_1.png https://s3-eu-west-1.amazonaws.com/prod-ucs-content-store-eu-west/content/pii:S138111699900031X/PREVIEW/image/png/8f21a3cfdda851aeaf8a37d78a73d724/main_1.png main_1.png png 60433 849 656 IMAGE-WEB-PDF 1 1-s2.0-S138111699900031X-si9.gif https://s3.amazonaws.com/prod-ucs-content-store-us-east/content/pii:S138111699900031X/STRIPIN/image/gif/f5e3af9466b3a6889be4a563a36dff45/si9.gif https://s3-eu-west-1.amazonaws.com/prod-ucs-content-store-eu-west/content/pii:S138111699900031X/STRIPIN/image/gif/f5e3af9466b3a6889be4a563a36dff45/si9.gif si9 si9.gif gif 192 14 25 ALTIMG 1-s2.0-S138111699900031X-si8.gif https://s3.amazonaws.com/prod-ucs-content-store-us-east/content/pii:S138111699900031X/STRIPIN/image/gif/919cceeab076f36f845f216b7bfdab55/si6.gif https://s3-eu-west-1.amazonaws.com/prod-ucs-content-store-eu-west/content/pii:S138111699900031X/STRIPIN/image/gif/919cceeab076f36f845f216b7bfdab55/si6.gif si8 si8.gif gif 233 14 29 ALTIMG 1-s2.0-S138111699900031X-si7.gif https://s3.amazonaws.com/prod-ucs-content-store-us-east/content/pii:S138111699900031X/STRIPIN/image/gif/30a6913e1cd16c33450125f5f316712b/si10.gif https://s3-eu-west-1.amazonaws.com/prod-ucs-content-store-eu-west/content/pii:S138111699900031X/STRIPIN/image/gif/30a6913e1cd16c33450125f5f316712b/si10.gif si7 si7.gif gif 149 14 20 ALTIMG 1-s2.0-S138111699900031X-si6.gif https://s3.amazonaws.com/prod-ucs-content-store-us-east/content/pii:S138111699900031X/STRIPIN/image/gif/919cceeab076f36f845f216b7bfdab55/si6.gif https://s3-eu-west-1.amazonaws.com/prod-ucs-content-store-eu-west/content/pii:S138111699900031X/STRIPIN/image/gif/919cceeab076f36f845f216b7bfdab55/si6.gif si6 si6.gif gif 233 14 29 ALTIMG 1-s2.0-S138111699900031X-si5.gif https://s3.amazonaws.com/prod-ucs-content-store-us-east/content/pii:S138111699900031X/STRIPIN/image/gif/f5e3af9466b3a6889be4a563a36dff45/si9.gif https://s3-eu-west-1.amazonaws.com/prod-ucs-content-store-eu-west/content/pii:S138111699900031X/STRIPIN/image/gif/f5e3af9466b3a6889be4a563a36dff45/si9.gif si5 si5.gif gif 192 14 25 ALTIMG 1-s2.0-S138111699900031X-si4.gif https://s3.amazonaws.com/prod-ucs-content-store-us-east/content/pii:S138111699900031X/STRIPIN/image/gif/919cceeab076f36f845f216b7bfdab55/si6.gif https://s3-eu-west-1.amazonaws.com/prod-ucs-content-store-eu-west/content/pii:S138111699900031X/STRIPIN/image/gif/919cceeab076f36f845f216b7bfdab55/si6.gif si4 si4.gif gif 233 14 29 ALTIMG 1-s2.0-S138111699900031X-si3.gif https://s3.amazonaws.com/prod-ucs-content-store-us-east/content/pii:S138111699900031X/STRIPIN/image/gif/f5e3af9466b3a6889be4a563a36dff45/si9.gif https://s3-eu-west-1.amazonaws.com/prod-ucs-content-store-eu-west/content/pii:S138111699900031X/STRIPIN/image/gif/f5e3af9466b3a6889be4a563a36dff45/si9.gif si3 si3.gif gif 192 14 25 ALTIMG 1-s2.0-S138111699900031X-si2.gif https://s3.amazonaws.com/prod-ucs-content-store-us-east/content/pii:S138111699900031X/STRIPIN/image/gif/919cceeab076f36f845f216b7bfdab55/si6.gif https://s3-eu-west-1.amazonaws.com/prod-ucs-content-store-eu-west/content/pii:S138111699900031X/STRIPIN/image/gif/919cceeab076f36f845f216b7bfdab55/si6.gif si2 si2.gif gif 233 14 29 ALTIMG 1-s2.0-S138111699900031X-si14.gif https://s3.amazonaws.com/prod-ucs-content-store-us-east/content/pii:S138111699900031X/STRIPIN/image/gif/f5e3af9466b3a6889be4a563a36dff45/si9.gif https://s3-eu-west-1.amazonaws.com/prod-ucs-content-store-eu-west/content/pii:S138111699900031X/STRIPIN/image/gif/f5e3af9466b3a6889be4a563a36dff45/si9.gif si14 si14.gif gif 192 14 25 ALTIMG 1-s2.0-S138111699900031X-si13.gif https://s3.amazonaws.com/prod-ucs-content-store-us-east/content/pii:S138111699900031X/STRIPIN/image/gif/919cceeab076f36f845f216b7bfdab55/si6.gif https://s3-eu-west-1.amazonaws.com/prod-ucs-content-store-eu-west/content/pii:S138111699900031X/STRIPIN/image/gif/919cceeab076f36f845f216b7bfdab55/si6.gif si13 si13.gif gif 233 14 29 ALTIMG 1-s2.0-S138111699900031X-si12.gif https://s3.amazonaws.com/prod-ucs-content-store-us-east/content/pii:S138111699900031X/STRIPIN/image/gif/30a6913e1cd16c33450125f5f316712b/si10.gif https://s3-eu-west-1.amazonaws.com/prod-ucs-content-store-eu-west/content/pii:S138111699900031X/STRIPIN/image/gif/30a6913e1cd16c33450125f5f316712b/si10.gif si12 si12.gif gif 149 14 20 ALTIMG 1-s2.0-S138111699900031X-si11.gif https://s3.amazonaws.com/prod-ucs-content-store-us-east/content/pii:S138111699900031X/STRIPIN/image/gif/919cceeab076f36f845f216b7bfdab55/si6.gif https://s3-eu-west-1.amazonaws.com/prod-ucs-content-store-eu-west/content/pii:S138111699900031X/STRIPIN/image/gif/919cceeab076f36f845f216b7bfdab55/si6.gif si11 si11.gif gif 233 14 29 ALTIMG 1-s2.0-S138111699900031X-si10.gif https://s3.amazonaws.com/prod-ucs-content-store-us-east/content/pii:S138111699900031X/STRIPIN/image/gif/30a6913e1cd16c33450125f5f316712b/si10.gif https://s3-eu-west-1.amazonaws.com/prod-ucs-content-store-eu-west/content/pii:S138111699900031X/STRIPIN/image/gif/30a6913e1cd16c33450125f5f316712b/si10.gif si10 si10.gif gif 149 14 20 ALTIMG 1-s2.0-S138111699900031X-si1.gif https://s3.amazonaws.com/prod-ucs-content-store-us-east/content/pii:S138111699900031X/STRIPIN/image/gif/30a6913e1cd16c33450125f5f316712b/si10.gif https://s3-eu-west-1.amazonaws.com/prod-ucs-content-store-eu-west/content/pii:S138111699900031X/STRIPIN/image/gif/30a6913e1cd16c33450125f5f316712b/si10.gif si1 si1.gif gif 149 14 20 ALTIMG 1-s2.0-S138111699900031X-gr1.sml https://s3.amazonaws.com/prod-ucs-content-store-us-east/content/pii:S138111699900031X/gr1/THUMBNAIL/image/gif/a883968b31580df8d4fbf3bfbf0b41fa/gr1.sml https://s3-eu-west-1.amazonaws.com/prod-ucs-content-store-eu-west/content/pii:S138111699900031X/gr1/THUMBNAIL/image/gif/a883968b31580df8d4fbf3bfbf0b41fa/gr1.sml gr1 gr1.sml sml 1360 94 121 IMAGE-THUMBNAIL 1-s2.0-S138111699900031X-gr1.gif https://s3.amazonaws.com/prod-ucs-content-store-us-east/content/pii:S138111699900031X/gr1/DOWNSAMPLED/image/gif/8456d35fb7a818967f0c04e86a0e34d5/gr1.gif https://s3-eu-west-1.amazonaws.com/prod-ucs-content-store-eu-west/content/pii:S138111699900031X/gr1/DOWNSAMPLED/image/gif/8456d35fb7a818967f0c04e86a0e34d5/gr1.gif gr1 gr1.gif gif 5316 255 329 IMAGE-DOWNSAMPLED 1-s2.0-S138111699900031X-gr2.sml https://s3.amazonaws.com/prod-ucs-content-store-us-east/content/pii:S138111699900031X/gr2/THUMBNAIL/image/gif/fbc13e4a11dbb89954062cf0fe92c190/gr2.sml https://s3-eu-west-1.amazonaws.com/prod-ucs-content-store-eu-west/content/pii:S138111699900031X/gr2/THUMBNAIL/image/gif/fbc13e4a11dbb89954062cf0fe92c190/gr2.sml gr2 gr2.sml sml 598 92 42 IMAGE-THUMBNAIL 1-s2.0-S138111699900031X-gr2.gif https://s3.amazonaws.com/prod-ucs-content-store-us-east/content/pii:S138111699900031X/gr2/DOWNSAMPLED/image/gif/72d5e8edd6cee3216c542fe23ed7e938/gr2.gif https://s3-eu-west-1.amazonaws.com/prod-ucs-content-store-eu-west/content/pii:S138111699900031X/gr2/DOWNSAMPLED/image/gif/72d5e8edd6cee3216c542fe23ed7e938/gr2.gif gr2 gr2.gif gif 10458 705 323 IMAGE-DOWNSAMPLED 1-s2.0-S138111699900031X-gr3.sml https://s3.amazonaws.com/prod-ucs-content-store-us-east/content/pii:S138111699900031X/gr3/THUMBNAIL/image/gif/23ac6ed035751cc1c030c2455022de48/gr3.sml https://s3-eu-west-1.amazonaws.com/prod-ucs-content-store-eu-west/content/pii:S138111699900031X/gr3/THUMBNAIL/image/gif/23ac6ed035751cc1c030c2455022de48/gr3.sml gr3 gr3.sml sml 1525 86 125 IMAGE-THUMBNAIL 1-s2.0-S138111699900031X-gr3.gif https://s3.amazonaws.com/prod-ucs-content-store-us-east/content/pii:S138111699900031X/gr3/DOWNSAMPLED/image/gif/d2f6975ebe8da9c8f1d86dc229a2435b/gr3.gif https://s3-eu-west-1.amazonaws.com/prod-ucs-content-store-eu-west/content/pii:S138111699900031X/gr3/DOWNSAMPLED/image/gif/d2f6975ebe8da9c8f1d86dc229a2435b/gr3.gif gr3 gr3.gif gif 6102 223 324 IMAGE-DOWNSAMPLED 1-s2.0-S138111699900031X-gr4.sml https://s3.amazonaws.com/prod-ucs-content-store-us-east/content/pii:S138111699900031X/gr4/THUMBNAIL/image/gif/77f99448edf8466f6533a9e1c98e0820/gr4.sml https://s3-eu-west-1.amazonaws.com/prod-ucs-content-store-eu-west/content/pii:S138111699900031X/gr4/THUMBNAIL/image/gif/77f99448edf8466f6533a9e1c98e0820/gr4.sml gr4 gr4.sml sml 767 94 60 IMAGE-THUMBNAIL 1-s2.0-S138111699900031X-gr4.gif https://s3.amazonaws.com/prod-ucs-content-store-us-east/content/pii:S138111699900031X/gr4/DOWNSAMPLED/image/gif/ca8ac6009c15fb3745228e2c2a1df002/gr4.gif https://s3-eu-west-1.amazonaws.com/prod-ucs-content-store-eu-west/content/pii:S138111699900031X/gr4/DOWNSAMPLED/image/gif/ca8ac6009c15fb3745228e2c2a1df002/gr4.gif gr4 gr4.gif gif 8782 513 329 IMAGE-DOWNSAMPLED 1-s2.0-S138111699900031X-gr5.sml https://s3.amazonaws.com/prod-ucs-content-store-us-east/content/pii:S138111699900031X/gr5/THUMBNAIL/image/gif/a3806af98d6ea838dfd8ae7241e6b023/gr5.sml https://s3-eu-west-1.amazonaws.com/prod-ucs-content-store-eu-west/content/pii:S138111699900031X/gr5/THUMBNAIL/image/gif/a3806af98d6ea838dfd8ae7241e6b023/gr5.sml gr5 gr5.sml sml 1437 94 110 IMAGE-THUMBNAIL 1-s2.0-S138111699900031X-gr5.gif https://s3.amazonaws.com/prod-ucs-content-store-us-east/content/pii:S138111699900031X/gr5/DOWNSAMPLED/image/gif/c55f083946cd24acdfb5a0c38ecc002c/gr5.gif https://s3-eu-west-1.amazonaws.com/prod-ucs-content-store-eu-west/content/pii:S138111699900031X/gr5/DOWNSAMPLED/image/gif/c55f083946cd24acdfb5a0c38ecc002c/gr5.gif gr5 gr5.gif gif 6320 280 329 IMAGE-DOWNSAMPLED MOLCAA 2180 S1381-1169(99)00031-X 10.1016/S1381-1169(99)00031-X Elsevier Science B.V. Fig. 1 X-ray diffractograms of Si-, (NC3)Si-, Fe- and Cu-MCM-41. Fig. 2 1 H , 29 Si CP MAS NMR spectra of Si-MCM-41 (a) and (NC3)Si-MCM-41 (b). Fig. 3 13 C MAS NMR spectrum of (NC3)Si-MCM-41. Fig. 4 ESR spectra of (a) Fe(NC3)Si-MCM-41 and (b) calcined Fe-MCM-41. Fig. 5 Proposed structure of the active site of Fe(NC3)Si-MCM-41. Table 1 Unit cell parameter a 0 and results of the elemental analysis and specific surface area (BET) of Si-, (NC3)Si-, M(NC3)Si and M-MCM-41 MCM-41 a 0 (Å) Metal content (%) C content (%) N content (%) C:N (NC3): metal BET (m2/g) Si- 44.3 – 33.6 1.9 20.2 – 1296 a (NC3)Si- 39.2 – 6.1 2.2 3.2 – n.d. Fe(NC3)Si- n.d. 2.3 6.1 2.2 3.2 3.8 582 Cu(NC3)Si- n.d. 2.9 6.1 2.2 3.2 3.5 n.d. Fe 46.3 1.0 33.5 2.0 19.1 – 1164 a Cu 48.5 0.8 16.8 1.0 19.2 – 350 a a Determined after calcination; n.d.=not determined. Table 2 Results of the oxidation of cyclohexane with aqueous H2O2 catalysed by M(NC3)Si-MCM-41 and M-MCM-41 MCM-41 Metal content (%) Temperature (°C) Products (mmol) Turnover number H2O2 efficiency (%) Leaching (%) one ol Fe(NC3)Si-a 2.3 25 0.1 0.1 5 2 n.d. Fe(NC3)Si-a 2.3 70 0.2 0.1 7 3 39 Fe(NC3)Si-a 2.3 100 3.2 0.4 88 34 35 Fe(NC3)Si-b 1.5 100 1.7 0.5 83 20 30 Fe(NC3)Si-c 1.0 100 1.1 0.5 86 14 n.d. Liquid phased – 100 0.2 0.2 – 4 – Cu(NC3)Si-a 2.9 25 0.1 0.1 4 2 n.d. Cu(NC3)Si-a 2.9 100 0.6 0.3 20 8 27 Fe-a 1.0 100 0.7 0.3 55 9 22 Cu-a 0.8 100 0.2 0.1 3 3 74 Reaction conditions: acetone/cyclohexane/H2O2 (30%)=15/2/2/ (v/v/v); 100 mg catalyst; 12 h; one=cyclohexanone; ol=cyclohexanol. aFirst reaction cycle; bsecond reaction cycle; cthird reaction cycle; dliquid phase from the first reaction cycle; n.d.=not determined. Iron and copper immobilised on mesoporous MCM-41 molecular sieves as catalysts for the oxidation of cyclohexane Wagner Alves Carvalho a Martin Wallau b Ulf Schuchardt b * a Instituto de Ciências Biológicas e Quı́mica, Pontifı́cia Universidade Católica de Campinas, Caixa Postal 1111, 13020-904, Campinas, SP, Brazil b Instituto de Quı́mica, Universidade Estadual de Campinas, Caixa Postal 6154, 13083-970, Campinas, SP, Brazil * Corresponding author. Fax: +55-19-788-3023; E-mail: ulf@iqm.unicamp.br A pure silica mesoporous molecular sieve analogous to MCM-41 (Si-MCM-41) was organofunctionalised with 3-aminopropyltrimethoxysilane. The resulting organofunctionalised Si-MCM-41 ((NC3)Si-MCM-41) was suspended in alcoholic solutions of iron and copper salts to form the respective metal complexes (M(NC3)Si-MCM-41). Iron and copper were also incorporated into the framework of mesoporous MCM-41 metallosilicates (M-MCM-41) by hydrothermal synthesis. All these catalysts were employed in the liquid phase oxidation of cyclohexane with aqueous H2O2 (30%). The results show that the M(NC3)Si-MCM-41 are more active than the corresponding M-MCM-41. The activity of the catalysts decreases in the following order: Fe(NC3)Si-MCM-41≫Fe-MCM-41≫Cu(NC3)Si-MCM-41≫Cu-MCM-41. However, when the catalysts are recycled, leaching of the metals is observed. The good catalytic activity found for Fe(NC3)Si-MCM-41 can be attributed to the heterogenised iron complex. Keywords MCM-41 molecular sieves Organofunctionalisation Iron catalyst Copper catalyst Cyclohexane oxidation 1 Introduction Metal complexes with nitrogen containing molecules are widely used as model compounds for mimicking the catalytic properties of monooxygenases, which catalyse the selective hydroxylation of alkanes and other substrates [1]. It was shown that especially iron and copper complexes are active catalysts for the mimicking of monooxygenases [2]. Also Gif-systems [3–5], which use iron and copper salts in a mixture of pyridine and acetic acid are good biomimetic catalytic systems. We studied the Gif-systems as catalysts for the oxidation of cyclohexane and could show that they are active at room temperature [6]. However, due to the formation of metal–oxygen–metal bonds, these catalysts deactivate rapidly. It was already suggested that the immobilisation of transition metals in the stable matrix of zeolites and zeotypes would allow the preparation of stable catalysts for the liquid phase oxidation of organic compounds [7]. Since the first description of the microporous zeotype TS-1 [8]as catalyst for the liquid phase oxidation of organic compounds and its successful application as catalyst in large-scale processes such as the hydroxylation of phenol [9]and the ammoxidation of cyclohexanone [10], large efforts have been done to study the catalytic properties of other so-called redox molecular sieves [11]. In general there are three different possibilities to create redox active sites in molecular sieves [11]: the encapsulation of organic metal complexes into the zeolite pores and cavities [12], the exchange of the charge-compensating cations like Na+ by redox active cations like transition metals [13]and rare earth metals [14, 15], or the substitution of the structure building atoms like Si and Al, by redox active metals such as Ti, V, Cr, Mn, Fe and Co [16–23]. The mesoporous molecular sieves of the M41S family [24, 25]can be prepared with pore diameters between 15 and 100 Å. It was shown that the incorporation of transition metals into the framework of MCM-41 [26–29], one of the members of the M41S family, allows the preparation of active catalysts for the oxidative transformation of molecules too bulky to enter the channels of TS-1 and other microporous redox molecular sieves with pore diameters in the range between 4 and 13 Å [11, 30]. Also the incorporation of metal phthalocyanine complexes in the pores of MCM-41 molecular sieves and its application as catalyst in the liquid phase oxidation were described [31]. Mesoporous MCM-41 molecular sieves whose properties resemble that of amorphous silica [25], contain a large number of silanol groups at the surface of their channels, which enable its organofunctionalisation by the reaction with SiR(OCH3)3 compounds where R is a functionalised organic group. In this paper we describe the organofunctionalisation of MCM-41 silicate (Si-MCM-41) with 3-aminopropyltrimethoxysilane (H2NC3H6Si(OCH3)3), and the complexation of iron and copper on the organofunctionalised Si-MCM-41 ((NC3)Si-MCM-41) to give active metal catalysts (M(NC3)Si-MCM-41, with M=Fe or Cu). We will also describe the hydrothermal synthesis of MCM-41 molecular sieves in the presence of iron and copper salts in order to incorporate the metals in the framework of MCM-41. The catalytic activity of these catalysts (M-MCM-41, with M=Fe or Cu) for the oxidation of cyclohexane with aqueous H2O2 (30%) in the liquid phase is compared to that of the M(NC3)Si-MCM-41. 2 Experimental 2.1 Materials For the synthesis of the MCM-41 molecular sieves, Aerosil-200 (Degussa) or silicium(IV) ethoxide (TEOS, Aldrich) as silica sources, cetyltrimethylammonium bromide (CTMABr, Aldrich) as template, tetraethylammonium hydroxide (TMAOH, Aldrich) and sodium hydroxide (Aldrich) as hydroxyl ion sources, iron(III) nitrate (Aldrich) and copper(II) acetate (Aldrich) as metal sources were used. The organofunctionalisation with 3-aminopropyltrimethoxysilane (H2NC3H6Si(OCH3)3, Aldrich) was carried out in toluene (Aldrich). For the oxidation of cyclohexane, acetone (Aldrich) and aqueous hydrogen peroxide (H2O2 (30%), Merck) as oxidant were used. All these reagents were employed without further purification. Cyclohexane was supplied by Nitrocarbono and purified by stirring a volumetric mixture (1:1) of cyclohexane and concentrated sulphuric acid for 12 h at room temperature in a one-neck flask equipped with a reflux condenser [32]. After separation, the organic phase was washed with water, with an aqueous solution of sodium carbonate (5%) and with water until its pH was neutral. Finally, the cyclohexane was dried over calcium chloride, filtered and distilled. 2.2 Synthesis Metal-free Si-MCM-41 was synthesised by a method given by Corma et al. [33]. A reaction gel with the molar composition: 1 SiO2:0.18 CTMABr:0.26 TMAOH:27 H2O was prepared by suspending Aerosil 200 in an aqueous solution of TMAOH and subsequent addition of a suspension of CTMABr in water. The final mixture was transferred into an autoclave and heated at 140°C for 16 h. The resulting solid was separated, washed with water and dried in an oven at 120°C. The occluded template molecules were removed by calcination at 540°C for 1 h under a stream of nitrogen (100 ml/min) and for 6 h under a stream of air. For the organofunctionalisation, the calcined Si-MCM-41 (5 g) was dried under vacuum at 300°C for 24 h and subsequently suspended in 180 ml of toluene. To the stirred suspension, 2 ml (11 mmol) of H2NC3H6Si(OCH3)3 was added at room temperature and the stirred mixture was refluxed at 100°C for 2 days. After filtering off, the functionalised (NC3)Si-MCM-41 was washed with water and ethyl ether and dried at 100°C under vacuum. The complexation of iron and copper ions at (NC3)Si-MCM-41 was carried out at room temperature by stirring a suspension of 0.5 g of the organofunctionalised material in 100 ml of a 0.01 M alcoholic solution of Fe(NO3)3 or of Cu(OOC2H3)2, respectively, for 3 h. After separation by filtration, the catalysts (M(NC3)Si-MCM-41) were washed with ethanol and acetone and dried at 100°C under vacuum. For the incorporation of iron and copper into the MCM-41 molecular sieve framework, a synthesis similar to that described by Huo et al. [34]was used. Reaction gels with the following molar composition: 1 SiO2:0.20 CTMABr:0.50 NaOH:0.018 M n+:150 H2O (with M n+=Fe3+ or Cu2+) were prepared by adding TEOS and the respective metal source into a stirred solution of CTMABr and NaOH. The final mixture was stirred at room temperature for 2 h. Subsequently, the precipitated solid was separated by filtration, washed with water and transferred into an autoclave, which was placed for 12 days in an oven preheated to 100°C. After filtration and washing, the M-MCM-41 was dried in an oven and the occluded template was removed by calcination as described above for Si-MCM-41. 2.3 Characterisation The X-ray diffractograms of the solids were recorded on a Shimadzu XD-2A diffractometer with Cu-Kα radiation between 2 and 10° (2θ) with a scanning rate of 2°/min. The SEM micrographies of the calcined solids were obtained in a Jeol JSM T-300 Scanning Electron Microscopy operated at 20 kV. The metal contents of the solids were determined by X-ray fluorescence analysis with a Spectrace TX-5000 spectrometer, using mechanical mixtures of the corresponding metal oxide and SiO2 for the calibration curves. The carbon, hydrogen and nitrogen contents of the uncalcined Si-MCM-41, M-MCM-41 and the (NC3)Si-MCM-41 were determined with a Perkin-Elmer 2401 C/H/N analyser. The specific surface areas of the calcined solids were determined by the BET method using the adsorption of nitrogen measured with a Micromeritics Flowsorb II 2300 equipment. The solid state 29 Si and 13 C MAS NMR spectra were recorded on a Bruker AC 300/P spectrometer at 59.6 and 75.4 MHz, respectively, using zirconium oxide rotors, a rotation frequency of 4000 Hz, and tetramethyl silane as external standard. For the 29 Si MAS NMR spectra, 1200 scans with 5 s between each scan were accumulated. The 1 H , 29 Si CP MAS NMR spectra were recorded at the following conditions: 90° pulse for 10.6 μs, contact time 3 ms and accumulation of 300 to 6000 scans with 3 s between each scan. The 13 C MAS NMR spectra were obtained by accumulation of 300 scans with 5 s between each scan. The ESR spectra of the Fe(NC3)Si-, and Fe-MCM-41 were obtained at room temperature in the X band at 9 GHz with DPPH as reference recorded on a Bruker ESP 300E spectrometer. 2.4 Oxidation of cyclohexane The oxidation of cyclohexane was carried out in a 30 ml Teflon lined and magnetically stirred autoclave heated in an oil bath to 373 K for 12 h. A total volume of 19 ml with a volumetric ratio acetone:cyclohexane:H2O2 (30%)=15:2:2 and 100 mg of the catalyst were used. After 12 h the reaction mixture was quenched to room temperature and the catalyst was separated by filtration. The products were analysed with an HP 5890 series II gas chromatograph equipped with a packed column (4 m×1/8 in.) of Carbowax 20M (15%) on Chromosorb W-HP and a flame ionisation detector. The temperature was raised at a rate of 10 K/min from 313 to 443 K and kept there for 10 min. Cyclohexane, cyclohexanol and cyclohexanone were quantified using calibration curves and cyclooctane as internal standard. The oxidation products were identified using an HP 5980 series II gas chromatograph equipped with a 25 m HP-1 capillary column coupled to an HP 5970B mass spectrometer. The temperature was kept at 313 K for 10 min and subsequently raised at a rate of 10 K/min up to 523 K. In the leaching experiments, the catalyst and the liquid phase were separated at reaction temperature by filtration after reaction, the liquid phase was transferred into the autoclave together with new portions of cyclohexane and H2O2 and heated to 373 K for another 12 h. 3 Results and discussion The X-ray diffractograms of the uncalcined Si-, Fe- and Cu-MCM-41 and the organfunctionalised (NC3)Si-MCM-41 are shown in Fig. 1 . For Si- and Fe-MCM-41 and for (NC3)Si-MCM-41, four well resolved Bragg reflexes are observed, which can be indexed in a pseudo-hexagonal symmetry with hkl triplets of 100, 110, 200 and 210. The presence of these four Bragg reflexes is a first indication that the obtained molecular sieves have a highly ordered pore system with a high porosity [35]. The presence of four Bragg reflexes for (NC3)Si-MCM-41 shows that the organofunctionalisation did not affect the order of the pore structure of the parent Si-MCM-41 molecular sieve. On the other hand, for Cu-MCM-41 only the peak attributed to hkl=100 can be observed, which indicates that its pore system is less ordered and that its porosity is low. The unit cell parameter a 0 of the different MCM-41 molecular sieves, calculated from the peak with hkl=100 by the formula a 0=2d 100/√3, are given in Table 1 . The increase of a 0 for Fe- and Cu-MCM-41 compared with a 0 of Si-MCM-41 might be taken as an indication of the incorporation of the metals in the MCM-41 framework. The organofunctionalisation of Si-MCM-41 reduces the a 0 from 44.3 to 39.2 Å. We believe that the H2N(C3H6)Si groups were immobilised on the surface of MCM-41 channels by reaction with SiOH groups of defect sites. This process reduces the defect sites of the material, resulting in a more dense structure with a lower a 0 value and a reduction of the pore size by the immobilised H2N(C3H6)Si groups. The results of the elemental analysis and the specific surface area (BET) of the calcined material which are given in Table 1 show that Cu-MCM-41 possesses a lower content of occluded organic material and a lower specific surface area than the Si- and Fe-MCM-41, thus confirming its lower porosity. The decrease of the BET surface area for Fe(NC3)Si-MCM-41 shows that the pore volume of the molecular sieve is reduced by the immobilised complex. Scanning electron microscopy shows the presence of large amounts of amorphous material in Cu-MCM-41 indicating that the presence of copper ions hampers the formation of the MCM-41 mesophase, thus resulting in the low porosity of this material. A C:N ratio around 19, observed for the uncalcined Si- and M-MCM-41, demonstrates that the template molecules are occluded during the synthesis without decomposition as it was already observed for other MCM-41 materials [24–26]. In Fig. 2 are given the 1 H , 29 Si CP MAS NMR spectra of (a) Si-MCM-41 and (b) (NC3)Si-MCM-41. The peaks around δ=−90, −99 and −109 ppm are attributed to (Si–O–)2Si(OH)2 groups (Q2) with two OH groups attached to the silicon atom, (Si–O–)3Si(OH) groups (Q3) with one OH group attached to the silicon atom and (Si–O–)4Si groups (Q4) with no OH attached to the silicon atom, respectively [36]. The high intensities of the Q2 and Q3 peaks show the large number of OH groups present at the surface of the non-crystalline Si-MCM-41 framework. The successful anchoring of H2NC3H6Si(OCH3)3 at the channel surface is demonstrated by Fig. 2b. Here the decreased intensity of the Q3 and Q2 peaks, relative to the Q4 peak, indicates the esterification of the free hydroxyl groups by the trimethoxy silylester. The additional peaks around δ=−65 and −55 ppm can be attributed to (Si–O–)3Si(C3H6NH2) groups with no OH group attached to the silicon atom and to (Si–O–)2Si(OH)(C3H6NH2) with one OH group attached to the silicon atom [36], respectively, as it is schematised in Fig. 2b. It can be calculated from the elemental analysis of (NC3)Si-MCM-41, which is given in Table 1, that approximately 1.6 mmol of H2NC3H6Si(OCH3)3 was anchored per 1 g of Si-MCM-41, which corresponds to approximately 73% of the H2NC3H6Si(OCH3)3 used for the organofunctionalisation. This is only slightly less than the maximum amount of approximately 76% of the used H2NC3H6Si(OCH3)3, calculated considering that approximately 30% of the silicon atoms in calcined Si-MCM-41 have silanol groups [25]. That not all silanol groups, originally present in the Si-MCM-41, are esterificated. This is confirmed by the 1 H , 29 Si CP MAS NMR spectrum of (NC3)Si-MCM-41 (Fig. 2b) as after the organofunctionalisation Q3 groups are still present. From the elemental analysis of (NC3)Si-MCM-41 given in Table 1, a C:N ratio around 3 can be calculated, thus demonstrating that the H2NC3H6Si(OCH3)3 is incorporated into the molecular sieve without decomposition of the functional 3-aminopropyl group. The preservation of the 3-aminopropyl unit after the organofunctionalisation is confirmed by the 13 C MAS NMR spectrum, given in Fig. 3 . Three peaks with equal intensity at around δ=10, 22 and 43 ppm can be attributed to the three different C-atoms of the 3-aminopropyl group. After the complexation of the metals Fe(NC3)Si-MCM-41 and Cu(NC3)Si-MCM-41 show a orange and blue coloration, respectively, which indicates the formation of a complex of the metals with the immobilised 3-aminopropyl units. The successful complexation of the metals is also supported by the 3-aminopropyl:metal ratio which can be calculated from the nitrogen and metal content of the M(NC3)Si-MCM-41, and which indicates a coordination number of 4 for iron as well as for copper. The incorporation of iron into the MCM-41 framework is confirmed by the white colour of the `as made' Fe-MCM-41, which indicates the absence of extra-framework iron oxide species. On the other hand, Cu-MCM-41 presents a grey colour, indicating the presence of extra-framework copper oxide species. The ESR spectrum of Fe(NC3)Si-MCM-41, given in Fig. 4 a, shows signals at g=2.0 and g=4.3. The signal at g=2.0 is attributed to Fe(III) in octahedral coordination with a high symmetry [37], suggesting that the Fe(III) cations are complexed by four 3-aminopropyl units and two water molecules as it is schematised in Fig. 5 . As described by Bordiga et al. [38], the strong hydrogen bonds of the water molecules ensure the symmetry of the ferric ions surrounded by the nitrogen atoms of the 3-aminopropyl units. The weak signal at g=4.3 might be attributed to iron cations compensating negative framework charges [38], which are due to the incorporation of traces of aluminium present in the used chemicals. The presence of such charge compensating iron cations would also explain why the 3-aminopropyl:metal ratio, given in Table 1, is lower than 4. The ESR spectrum of the calcined Fe-MCM-41 (Fig. 4b), where the iron is incorporated in the framework, shows signals at g=4.3 and 2.0, which can be attributed to Fe(III) in tetrahedral coordination with strong rhombic distortion and Fe(III) in octahedral coordination, respectively [38]. A comparison of the ESR spectrum of the calcined Fe-MCM-41 (Fig. 4b) with that of the uncalcined Fe-MCM-41 (not shown) reveals an increase of Fe(III) in octahedral coordination after calcination. This indicates that during the calcination, which is necessary to remove the occluded template molecules, tetrahedral Fe(III) is transformed in extra-framework iron oxide. The demetallation of the Fe-MCM-41 by the calcination process is also confirmed by the change of colour from white for the uncalcined Fe-MCM-41 to brown for the calcined Fe-MCM-41 which is characteristic for the presence of extra-framework iron oxide species [39]. The results of the oxidation of cyclohexane with aqueous H2O2 (30%) catalysed by iron and copper immobilised on mesoporous MCM-41 molecular sieves are given in Table 2 . It can be seen that the M(NC3)Si-MCM-41 are, in contrast to iron and copper salts, used as homogeneous catalysts [6], inactive at room temperature and even at 70°C. On the other hand, Ernst et al. [31]observed that iron phthalocyanine complexes immobilised on mesoporous MCM-41 are more active than the free complex, while the immobilised copper phthalocyanine was also inactive at room temperature. Table 2 reveals that at 100°C all catalysts prepared in this study are, with exception of Cu-MCM-41, active for the oxidation of cyclohexane. The negligible conversion observed for Cu-MCM-41 and the very high metal loss indicate that the Cu is not incorporated in the MCM-41 structure but present as catalytically inactive copper oxide which is simply washed out of the solid under the reaction conditions. It should be remarked that at 100°C the Fe(NC3)Si-MCM-41 is more active than the microporous zeotype TS-1 under the same conditions [40], as it is demonstrated by the amount of products 3.6 and 2.8 mmol, the turnover numbers of 88 and 76 and the peroxide efficiencies of 34% and 22% for Fe(NC3)Si-MCM-41 and TS-1 [40], respectively. However, if Fe(NC3)Si-MCM-41 is recycled, leaching of the metal is observed (the liquid phase which is separated at reaction temperature is lightly brown) and the catalyst deactivates progressively, although the turnover number remains constant and the observed loss of activity is proportional to the amount of leached iron, thus demonstrating that the complexated iron keeps its activity. In contrast Cu(NC3)Si-MCM-41 deactivates after the first reaction cycle. The relative stability of the Fe(NC3)Si-MCM-41 is in contrast with the results described by Ernst et al. [31], who observed a complete and irreversible loss of the activity of the iron phthalocyanine immobilised on MCM-41 after 2 h of reaction time. The leaching of Fe(NC3)Si-MCM-41 is probably caused by complexation of the iron by the polar product molecules. This would explain why the leached iron is no longer active for cyclohexane oxidation under our reaction conditions (Table 2). Homogeneous iron complexes were less active under these conditions as the nitrogen ligands are necessary to stabilise the activated complex [41]. Therefore, the catalytic activity can be attributed to iron complexed by the organofunctionalised MCM-41. Iron complexed on amorphous silica organofunctionalised by the same method showed a much lower activity for cyclohexane oxidation under similar conditions. Only 0.3 mmol of one and 0.2 mmol of ol (turnover number 20) were obtained after 12 h at 100°C [42]. We, therefore, believe that the ordered pore system supplied by the MCM-41 is responsible for the observed activity. This pore system favours the formation of an octahedral structure, with the iron and the four nitrogen atoms in the same plane (Fig. 5), as observed in porphyrins. In amorphous silica it seems to be more difficult to form such a complex. 4 Conclusions Mesoporous Si-MCM-41 can be easily organofunctionalised by anchoring (H2NC3H6Si(OCH3)3 at the surface of the Si-MCM-41 channels. The resulting (NC3)Si-MCM-41 forms stable complexes with iron and copper. Iron can also be incorporated in the MCM-41 framework by hydrothermal synthesis. However, copper ions in the synthesis gel lead to an almost amorphous silica phase with precipitated copper oxide on it. Fe(NC3)Si-MCM-41 shows a good activity for oxidising cyclohexane with H2O2 at 100°C, however approximately 30% of the iron leach from the catalyst in each reaction cycle. The leached iron is complexed by the reaction products and shows nearly no activity. The good catalytic activity of Fe(NC3)Si-MCM-41 is explained by an octahedral coordination with four nitrogen ligands in the same plane. Acknowledgements This work was financed by Fundação de Amparo à Pesquisa do Estado de São Paulo (FAPESP). Fellowships from the Conselho Nacional de Desenvolvimento Cientı́fico e Tecnológico (CNPq) are acknowledged. The authors thank Dr. Regina Buffon for carefully reading this manuscript and Professor Douglas W. Franco, University of São Paulo in São Carlos for recording the ESR spectra. References 1 R.A. Sheldon, J.K. Kochi, Metal-Catalyzed Oxidations of Organic Compounds, Academic Press, New York, 1981, p. 216. 2 J.B. Vincent G.L. Olivier-Lilley B.A. Averill Chem. Rev. 90 1990 1447 3 D.H.R. Barton, M.J. Gastinger, W.B. Motherwell, J. Chem. Soc., Chem. Commun. (1983) 41. 4 D.H.R. Barton, M.J. Gastinger, W.B.J. Motherwell, J. Chem. Soc., Chem. Commun. (1983) 731. 5 D.H.R. Barton J. Mol. Catal. A 117 1997 3 6 U. Schuchardt C.E.Z. Krähembühl W.A. Carvalho New J. Chem. 15 1991 955 7 R.A. Sheldon CHEMTECH 21 1991 566 8 B. Notari Stud. Surf. Sci. Catal. 60 1991 343 9 E. Roland, P. Kleinschmit, in: B. Elvers, S. Hawkins (Eds.), Ullmann's Encyclopedia of Industrial Chemistry, Vol. A28, VCH, Weinheim, 1996, p. 497. 10 D. Hönicke A. Seidel-Morgenstern Nachr. Chem. Tech. Lab. 44 1996 214 11 I.W.C.E. Arends R.A. Sheldon M. Wallau U. Schuchardt Angew. Chem., Int. Ed. Engl. 36 1997 1144 12 K.J. Balkus Jr. A.G.J. Gabrielov Inclusion Phenom. Mol. Recognit. Chem. 21 1995 159 13 A.V. Kucherov A.A. Slinkin J. Mol. Catal. 90 1994 323 14 E.L. Pires M. Wallau U. Schuchardt Stud. Surf. Sci. Catal. 110 1997 1025 15 E.L. Pires M. Wallau U. Schuchardt J. Mol. Catal. A 136 1998 69 16 U. Romano A. Esposito F. Maspero C. Neri M.G. Clerici Stud. Surf. Sci. Catal. 55 1990 33 17 D.R.C. Huybrechts L. De Bruycker P.A. Jacobs Nature 345 1990 240 18 M.S. Rigutto H. van Bekkum Appl. Catal. 68 1991 L1 19 G. Centi S. Perathoner F. Trifirò A. Aboukais C.F. Aissi M. Guelton J. Phys. Chem. 96 1992 2617 20 P. Ratnasamy R. Kumar Catal. Today 9 1991 329 21 C. Montes M.E. Davis B. Murray M. Narayana J. Phys. Chem. 94 1990 6425 22 U. Cornaro P. Jiru Z. Tvaruzkova K. Habersberger Stud. Surf. Sci. Catal. 69 1991 165 23 M.L.S. Corrêa M. Wallau U. Schuchardt Stud. Surf. Sci. Catal. 105 1997 277 24 C.T. Kresge M.E. Leonowicz J.C. Vartuli J.S. Beck Nature 359 1992 710 25 J.S. Beck J.C. Vartuli W.J. Roth M.E. Leonowicz C.T. Kresge K.D. Schmitt C.T.-W. Chu D.H. Olson E.W. Sheppard S.B. McCullen J.B. Higgins J.L. Schlenker J. Am. Chem. Soc. 114 1992 10834 26 W.A. Carvalho P.B. Varaldo M. Wallau U. Schuchardt Zeolites 18 1997 408 27 T. Maschmeyer F. Rey G. Sankar J.M. Thomas Nature 378 1995 159 28 P.T. Tanev M. Chibwe T.J. Pinnavaia Nature 368 1994 321 29 P.T. Tanev T.J. Pinnavaia Science 267 1995 865 30 W.M. Meier D.H. Olson Zeolites 12 1992 449 31 S. Ernst R. Gläser M. Selle Stud. Surf. Sci. Catal. 105 1997 1021 32 D.D. Perrin, W.L.F. Armarego, Purification of Laboratory Chemicals, 3rd edn., Pergamon, Oxford, 1988, p. 131. 33 A. Corma M.T. Navarro J. Pérez-Pariente F. Sánchez Stud. Surf. Sci. Catal. 84 1994 69 34 Q. Huo D.I. Margolese G.D. Stucky Chem. Mater. 8 1996 1147 35 F. Schüth Ber. Bunsenges Phys. Chem. 99 1995 1306 36 G.E. Maciel, P.D. Ellis, in: A.T. Bell, A. Pines (Eds.), NMR Techniques in Catalysis Marcel Dekker, New York, 1994. 37 D. Goldfarb M. Bernardo K.G. Strohmaier D.E.W. Vaughan H. Thomann J. Am. Chem. Soc. 116 1994 6344 38 S. Bordiga R. Buzzoni F. Geobaldo C. Lamberti E. Giamello A. Zecchina G. Leofanti G. Petrini G. Tozzola G. Vlaic J. Catal. 158 1996 486 39 P. Ratnasamy R. Kumar Catal. Today 9 1991 329 40 E.V. Spinacé H.O. Pastore U. Schuchardt J. Catal. 157 1995 631 41 U. Schuchardt, W.A. Carvalho, E.V. Spinacé, Synlett (1993) 713. 42 A.R. Cestari, PhD Thesis, Universidade Estadual de Campinas, 1996.",
      "scopus-id": "0033595297",
      "coredata": {
        "eid": "1-s2.0-S138111699900031X",
        "dc:description": "A pure silica mesoporous molecular sieve analogous to MCM-41 (Si-MCM-41) was organofunctionalised with 3-aminopropyltrimethoxysilane. The resulting organofunctionalised Si-MCM-41 ((NC3)Si-MCM-41) was suspended in alcoholic solutions of iron and copper salts to form the respective metal complexes (M(NC3)Si-MCM-41). Iron and copper were also incorporated into the framework of mesoporous MCM-41 metallosilicates (M-MCM-41) by hydrothermal synthesis. All these catalysts were employed in the liquid phase oxidation of cyclohexane with aqueous H2O2 (30%). The results show that the M(NC3)Si-MCM-41 are more active than the corresponding M-MCM-41. The activity of the catalysts decreases in the following order: Fe(NC3)Si-MCM-41≫Fe-MCM-41≫Cu(NC3)Si-MCM-41≫Cu-MCM-41. However, when the catalysts are recycled, leaching of the metals is observed. The good catalytic activity found for Fe(NC3)Si-MCM-41 can be attributed to the heterogenised iron complex.",
        "openArchiveArticle": "false",
        "prism:coverDate": "1999-07-22",
        "openaccessUserLicense": null,
        "prism:aggregationType": "Journal",
        "prism:url": "https://api.elsevier.com/content/article/pii/S138111699900031X",
        "dc:creator": [
          {
            "@_fa": "true",
            "$": "Carvalho, Wagner Alves"
          },
          {
            "@_fa": "true",
            "$": "Wallau, Martin"
          },
          {
            "@_fa": "true",
            "$": "Schuchardt, Ulf"
          }
        ],
        "link": [
          {
            "@_fa": "true",
            "@rel": "self",
            "@href": "https://api.elsevier.com/content/article/pii/S138111699900031X"
          },
          {
            "@_fa": "true",
            "@rel": "scidir",
            "@href": "https://www.sciencedirect.com/science/article/pii/S138111699900031X"
          }
        ],
        "dc:format": "application/json",
        "openaccessType": null,
        "pii": "S1381-1169(99)00031-X",
        "prism:volume": "144",
        "prism:publisher": "Elsevier Science B.V.",
        "dc:title": "Iron and copper immobilised on mesoporous MCM-41 molecular sieves as catalysts for the oxidation of cyclohexane",
        "prism:copyright": "Copyright © 1999 Elsevier Science B.V. All rights reserved.",
        "openaccess": "0",
        "prism:issn": "13811169",
        "prism:issueIdentifier": "1",
        "dcterms:subject": [
          {
            "@_fa": "true",
            "$": "MCM-41 molecular sieves"
          },
          {
            "@_fa": "true",
            "$": "Organofunctionalisation"
          },
          {
            "@_fa": "true",
            "$": "Iron catalyst"
          },
          {
            "@_fa": "true",
            "$": "Copper catalyst"
          },
          {
            "@_fa": "true",
            "$": "Cyclohexane oxidation"
          }
        ],
        "openaccessArticle": "false",
        "prism:publicationName": "Journal of Molecular Catalysis A: Chemical",
        "prism:number": "1",
        "openaccessSponsorType": null,
        "prism:pageRange": "91-99",
        "prism:endingPage": "99",
        "pubType": "fla",
        "prism:coverDisplayDate": "22 July 1999",
        "prism:doi": "10.1016/S1381-1169(99)00031-X",
        "prism:startingPage": "91",
        "dc:identifier": "doi:10.1016/S1381-1169(99)00031-X",
        "openaccessSponsorName": null
      },
      "objects": {
        "object": [
          {
            "@category": "thumbnail",
            "@height": "14",
            "@width": "25",
            "@_fa": "true",
            "$": "https://api.elsevier.com/content/object/eid/1-s2.0-S138111699900031X-si9.gif?httpAccept=%2A%2F%2A",
            "@multimediatype": "GIF image file",
            "@type": "ALTIMG",
            "@size": "192",
            "@ref": "si9",
            "@mimetype": "image/gif"
          },
          {
            "@category": "thumbnail",
            "@height": "14",
            "@width": "29",
            "@_fa": "true",
            "$": "https://api.elsevier.com/content/object/eid/1-s2.0-S138111699900031X-si8.gif?httpAccept=%2A%2F%2A",
            "@multimediatype": "GIF image file",
            "@type": "ALTIMG",
            "@size": "233",
            "@ref": "si8",
            "@mimetype": "image/gif"
          },
          {
            "@category": "thumbnail",
            "@height": "14",
            "@width": "20",
            "@_fa": "true",
            "$": "https://api.elsevier.com/content/object/eid/1-s2.0-S138111699900031X-si7.gif?httpAccept=%2A%2F%2A",
            "@multimediatype": "GIF image file",
            "@type": "ALTIMG",
            "@size": "149",
            "@ref": "si7",
            "@mimetype": "image/gif"
          },
          {
            "@category": "thumbnail",
            "@height": "14",
            "@width": "29",
            "@_fa": "true",
            "$": "https://api.elsevier.com/content/object/eid/1-s2.0-S138111699900031X-si6.gif?httpAccept=%2A%2F%2A",
            "@multimediatype": "GIF image file",
            "@type": "ALTIMG",
            "@size": "233",
            "@ref": "si6",
            "@mimetype": "image/gif"
          },
          {
            "@category": "thumbnail",
            "@height": "14",
            "@width": "25",
            "@_fa": "true",
            "$": "https://api.elsevier.com/content/object/eid/1-s2.0-S138111699900031X-si5.gif?httpAccept=%2A%2F%2A",
            "@multimediatype": "GIF image file",
            "@type": "ALTIMG",
            "@size": "192",
            "@ref": "si5",
            "@mimetype": "image/gif"
          },
          {
            "@category": "thumbnail",
            "@height": "14",
            "@width": "29",
            "@_fa": "true",
            "$": "https://api.elsevier.com/content/object/eid/1-s2.0-S138111699900031X-si4.gif?httpAccept=%2A%2F%2A",
            "@multimediatype": "GIF image file",
            "@type": "ALTIMG",
            "@size": "233",
            "@ref": "si4",
            "@mimetype": "image/gif"
          },
          {
            "@category": "thumbnail",
            "@height": "14",
            "@width": "25",
            "@_fa": "true",
            "$": "https://api.elsevier.com/content/object/eid/1-s2.0-S138111699900031X-si3.gif?httpAccept=%2A%2F%2A",
            "@multimediatype": "GIF image file",
            "@type": "ALTIMG",
            "@size": "192",
            "@ref": "si3",
            "@mimetype": "image/gif"
          },
          {
            "@category": "thumbnail",
            "@height": "14",
            "@width": "29",
            "@_fa": "true",
            "$": "https://api.elsevier.com/content/object/eid/1-s2.0-S138111699900031X-si2.gif?httpAccept=%2A%2F%2A",
            "@multimediatype": "GIF image file",
            "@type": "ALTIMG",
            "@size": "233",
            "@ref": "si2",
            "@mimetype": "image/gif"
          },
          {
            "@category": "thumbnail",
            "@height": "14",
            "@width": "25",
            "@_fa": "true",
            "$": "https://api.elsevier.com/content/object/eid/1-s2.0-S138111699900031X-si14.gif?httpAccept=%2A%2F%2A",
            "@multimediatype": "GIF image file",
            "@type": "ALTIMG",
            "@size": "192",
            "@ref": "si14",
            "@mimetype": "image/gif"
          },
          {
            "@category": "thumbnail",
            "@height": "14",
            "@width": "29",
            "@_fa": "true",
            "$": "https://api.elsevier.com/content/object/eid/1-s2.0-S138111699900031X-si13.gif?httpAccept=%2A%2F%2A",
            "@multimediatype": "GIF image file",
            "@type": "ALTIMG",
            "@size": "233",
            "@ref": "si13",
            "@mimetype": "image/gif"
          },
          {
            "@category": "thumbnail",
            "@height": "14",
            "@width": "20",
            "@_fa": "true",
            "$": "https://api.elsevier.com/content/object/eid/1-s2.0-S138111699900031X-si12.gif?httpAccept=%2A%2F%2A",
            "@multimediatype": "GIF image file",
            "@type": "ALTIMG",
            "@size": "149",
            "@ref": "si12",
            "@mimetype": "image/gif"
          },
          {
            "@category": "thumbnail",
            "@height": "14",
            "@width": "29",
            "@_fa": "true",
            "$": "https://api.elsevier.com/content/object/eid/1-s2.0-S138111699900031X-si11.gif?httpAccept=%2A%2F%2A",
            "@multimediatype": "GIF image file",
            "@type": "ALTIMG",
            "@size": "233",
            "@ref": "si11",
            "@mimetype": "image/gif"
          },
          {
            "@category": "thumbnail",
            "@height": "14",
            "@width": "20",
            "@_fa": "true",
            "$": "https://api.elsevier.com/content/object/eid/1-s2.0-S138111699900031X-si10.gif?httpAccept=%2A%2F%2A",
            "@multimediatype": "GIF image file",
            "@type": "ALTIMG",
            "@size": "149",
            "@ref": "si10",
            "@mimetype": "image/gif"
          },
          {
            "@category": "thumbnail",
            "@height": "14",
            "@width": "20",
            "@_fa": "true",
            "$": "https://api.elsevier.com/content/object/eid/1-s2.0-S138111699900031X-si1.gif?httpAccept=%2A%2F%2A",
            "@multimediatype": "GIF image file",
            "@type": "ALTIMG",
            "@size": "149",
            "@ref": "si1",
            "@mimetype": "image/gif"
          },
          {
            "@category": "thumbnail",
            "@height": "94",
            "@width": "121",
            "@_fa": "true",
            "$": "https://api.elsevier.com/content/object/eid/1-s2.0-S138111699900031X-gr1.sml?httpAccept=%2A%2F%2A",
            "@multimediatype": "GIF image file",
            "@type": "IMAGE-THUMBNAIL",
            "@size": "1360",
            "@ref": "gr1",
            "@mimetype": "image/gif"
          },
          {
            "@category": "standard",
            "@height": "255",
            "@width": "329",
            "@_fa": "true",
            "$": "https://api.elsevier.com/content/object/eid/1-s2.0-S138111699900031X-gr1.gif?httpAccept=%2A%2F%2A",
            "@multimediatype": "GIF image file",
            "@type": "IMAGE-DOWNSAMPLED",
            "@size": "5316",
            "@ref": "gr1",
            "@mimetype": "image/gif"
          },
          {
            "@category": "thumbnail",
            "@height": "92",
            "@width": "42",
            "@_fa": "true",
            "$": "https://api.elsevier.com/content/object/eid/1-s2.0-S138111699900031X-gr2.sml?httpAccept=%2A%2F%2A",
            "@multimediatype": "GIF image file",
            "@type": "IMAGE-THUMBNAIL",
            "@size": "598",
            "@ref": "gr2",
            "@mimetype": "image/gif"
          },
          {
            "@category": "standard",
            "@height": "705",
            "@width": "323",
            "@_fa": "true",
            "$": "https://api.elsevier.com/content/object/eid/1-s2.0-S138111699900031X-gr2.gif?httpAccept=%2A%2F%2A",
            "@multimediatype": "GIF image file",
            "@type": "IMAGE-DOWNSAMPLED",
            "@size": "10458",
            "@ref": "gr2",
            "@mimetype": "image/gif"
          },
          {
            "@category": "thumbnail",
            "@height": "86",
            "@width": "125",
            "@_fa": "true",
            "$": "https://api.elsevier.com/content/object/eid/1-s2.0-S138111699900031X-gr3.sml?httpAccept=%2A%2F%2A",
            "@multimediatype": "GIF image file",
            "@type": "IMAGE-THUMBNAIL",
            "@size": "1525",
            "@ref": "gr3",
            "@mimetype": "image/gif"
          },
          {
            "@category": "standard",
            "@height": "223",
            "@width": "324",
            "@_fa": "true",
            "$": "https://api.elsevier.com/content/object/eid/1-s2.0-S138111699900031X-gr3.gif?httpAccept=%2A%2F%2A",
            "@multimediatype": "GIF image file",
            "@type": "IMAGE-DOWNSAMPLED",
            "@size": "6102",
            "@ref": "gr3",
            "@mimetype": "image/gif"
          },
          {
            "@category": "thumbnail",
            "@height": "94",
            "@width": "60",
            "@_fa": "true",
            "$": "https://api.elsevier.com/content/object/eid/1-s2.0-S138111699900031X-gr4.sml?httpAccept=%2A%2F%2A",
            "@multimediatype": "GIF image file",
            "@type": "IMAGE-THUMBNAIL",
            "@size": "767",
            "@ref": "gr4",
            "@mimetype": "image/gif"
          },
          {
            "@category": "standard",
            "@height": "513",
            "@width": "329",
            "@_fa": "true",
            "$": "https://api.elsevier.com/content/object/eid/1-s2.0-S138111699900031X-gr4.gif?httpAccept=%2A%2F%2A",
            "@multimediatype": "GIF image file",
            "@type": "IMAGE-DOWNSAMPLED",
            "@size": "8782",
            "@ref": "gr4",
            "@mimetype": "image/gif"
          },
          {
            "@category": "thumbnail",
            "@height": "94",
            "@width": "110",
            "@_fa": "true",
            "$": "https://api.elsevier.com/content/object/eid/1-s2.0-S138111699900031X-gr5.sml?httpAccept=%2A%2F%2A",
            "@multimediatype": "GIF image file",
            "@type": "IMAGE-THUMBNAIL",
            "@size": "1437",
            "@ref": "gr5",
            "@mimetype": "image/gif"
          },
          {
            "@category": "standard",
            "@height": "280",
            "@width": "329",
            "@_fa": "true",
            "$": "https://api.elsevier.com/content/object/eid/1-s2.0-S138111699900031X-gr5.gif?httpAccept=%2A%2F%2A",
            "@multimediatype": "GIF image file",
            "@type": "IMAGE-DOWNSAMPLED",
            "@size": "6320",
            "@ref": "gr5",
            "@mimetype": "image/gif"
          }
        ]
      },
      "link": {
        "@rel": "abstract",
        "@href": "https://api.elsevier.com/content/abstract/scopus_id/0033595297"
      }
    }
  }
}