{
  "metadata": {
    "title": "Zeolite catalysts for Halon conversion",
    "authors": "; ; ",
    "journal": "Journal of Molecular Catalysis A: Chemical",
    "date": "2002-03-25",
    "doi": "10.1016/S1381-1169(01)00344-2",
    "abstract": "",
    "uri": "https://api.elsevier.com/content/article/pii/S1381116901003442",
    "pii": "S1381116901003442"
  },
  "fulltext": {
    "full-text-retrieval-response": {
      "scopus-eid": "2-s2.0-0037170510",
      "originalText": "serial JL 271358 291210 291744 291790 291809 31 Journal of Molecular Catalysis A: Chemical JOURNALMOLECULARCATALYSISACHEMICAL 2002-03-15 2002-03-15 2010-04-18T17:18:08 1-s2.0-S1381116901003442 S1381-1169(01)00344-2 S1381116901003442 10.1016/S1381-1169(01)00344-2 S300 S300.1 FULL-TEXT 1-s2.0-S1381116900X01483 2015-05-15T05:56:33.301439-04:00 0 0 20020325 2002 2002-03-15T00:00:00Z articleinfo crossmark dco dateupdated tomb dateloaded datesearch indexeddate issuelist volumelist yearnav articletitlenorm authfirstinitialnorm authfirstsurnamenorm cid cids confdate confeditor confloc contenttype copyright dateloadedtxt docsubtype doctype doi eid ewtransactionid hubeid issfirst issn issnnorm itemstage itemtransactionid itemweight openaccess openarchive pg pgfirst pglast pii piinorm pubdatestart pubdatetxt pubyr sortorder srctitle srctitlenorm srctype subheadings vol volfirst volissue webpdf webpdfpagecount figure body acknowledge affil articletitle auth authfirstini authfull authkeywords authlast primabst ref alllist content subj ssids 1381-1169 13811169 181 181 1 2 1 2 Volume 181, Issues 1–2 8 63 72 63 72 20020325 25 March 2002 2002-03-25 2002 Fifteenth Indian National Symposium on Catalysis and Second Conference of the Indo-Pacific Catalysis Association Pune,India 23–25 January 2001 20010123 20010125 A.V.Ramaswamy,S.Sivasanker,P.Ratnasamy converted-article fla Copyright © 2002 Elsevier Science B.V. All rights reserved. ZEOLITECATALYSTSFORHALONCONVERSION HOWE R 1 Introduction 2 Experimental 3 Results and discussion 3.1 Pyrolysis of CF3Br 3.2 Reaction of CF3Br with methane 3.3 Future prospects Acknowledgements References BICKLE 1992 449 G TAJIMA 1997 97 M NIEDERSEN 1999 225 K COQ 1993 21 B COQ 1995 11159 B KEMNITZ 1998 97 E JUSZCZYK 1998 311 W OHNISHI 1994 29 R KARPINSKI 1996 378 Z MALINOWSKI 1999 53 A MORI 2000 1985 T MORI 1996 73 T LI 2000 219 K LI 2000 4067 K KONYA 1997 1509 Z LI 2000 355 K ELLIS 1995 190 P HESS 1994 270 A GROHMAN 1998 1453 I VANBOKHAVEN 1999 7537 J BOZELLI 1992 1 J TAPSCOTT 1995 151 R TRAN 2001 3139 R HOWEX2002X63 HOWEX2002X63X72 HOWEX2002X63XR HOWEX2002X63X72XR item S1381-1169(01)00344-2 S1381116901003442 1-s2.0-S1381116901003442 10.1016/S1381-1169(01)00344-2 271358 2010-10-03T19:44:09.397368-04:00 2002-03-25 1-s2.0-S1381116901003442-main.pdf https://s3.amazonaws.com/prod-ucs-content-store-us-east/content/pii:S1381116901003442/MAIN/application/pdf/2b18d97dab506cd71b72c4f9fd535c14/main.pdf https://s3-eu-west-1.amazonaws.com/prod-ucs-content-store-eu-west/content/pii:S1381116901003442/MAIN/application/pdf/2b18d97dab506cd71b72c4f9fd535c14/main.pdf main.pdf pdf true 123845 MAIN 10 1-s2.0-S1381116901003442-main_1.png https://s3.amazonaws.com/prod-ucs-content-store-us-east/content/pii:S1381116901003442/PREVIEW/image/png/6a9bfbd8cbce345c275af427a2239a39/main_1.png https://s3-eu-west-1.amazonaws.com/prod-ucs-content-store-eu-west/content/pii:S1381116901003442/PREVIEW/image/png/6a9bfbd8cbce345c275af427a2239a39/main_1.png main_1.png png 60335 849 656 IMAGE-WEB-PDF 1 1-s2.0-S1381116901003442-si9.gif https://s3.amazonaws.com/prod-ucs-content-store-us-east/content/pii:S1381116901003442/STRIPIN/image/gif/a8d5187280de7fdb6500ec452497f02e/si10.gif https://s3-eu-west-1.amazonaws.com/prod-ucs-content-store-eu-west/content/pii:S1381116901003442/STRIPIN/image/gif/a8d5187280de7fdb6500ec452497f02e/si10.gif si9 si9.gif gif 227 14 32 ALTIMG 1-s2.0-S1381116901003442-si8.gif https://s3.amazonaws.com/prod-ucs-content-store-us-east/content/pii:S1381116901003442/STRIPIN/image/gif/919cceeab076f36f845f216b7bfdab55/si8.gif https://s3-eu-west-1.amazonaws.com/prod-ucs-content-store-eu-west/content/pii:S1381116901003442/STRIPIN/image/gif/919cceeab076f36f845f216b7bfdab55/si8.gif si8 si8.gif gif 233 14 29 ALTIMG 1-s2.0-S1381116901003442-si7.gif https://s3.amazonaws.com/prod-ucs-content-store-us-east/content/pii:S1381116901003442/STRIPIN/image/gif/a8d5187280de7fdb6500ec452497f02e/si10.gif https://s3-eu-west-1.amazonaws.com/prod-ucs-content-store-eu-west/content/pii:S1381116901003442/STRIPIN/image/gif/a8d5187280de7fdb6500ec452497f02e/si10.gif si7 si7.gif gif 227 14 32 ALTIMG 1-s2.0-S1381116901003442-si6.gif https://s3.amazonaws.com/prod-ucs-content-store-us-east/content/pii:S1381116901003442/STRIPIN/image/gif/c07c78df402561196f977140004e9e12/si6.gif https://s3-eu-west-1.amazonaws.com/prod-ucs-content-store-eu-west/content/pii:S1381116901003442/STRIPIN/image/gif/c07c78df402561196f977140004e9e12/si6.gif si6 si6.gif gif 783 13 221 ALTIMG 1-s2.0-S1381116901003442-si5.gif https://s3.amazonaws.com/prod-ucs-content-store-us-east/content/pii:S1381116901003442/STRIPIN/image/gif/eae8e76ca9773f4f0ea428c501245519/si5.gif https://s3-eu-west-1.amazonaws.com/prod-ucs-content-store-eu-west/content/pii:S1381116901003442/STRIPIN/image/gif/eae8e76ca9773f4f0ea428c501245519/si5.gif si5 si5.gif gif 776 13 214 ALTIMG 1-s2.0-S1381116901003442-si4.gif https://s3.amazonaws.com/prod-ucs-content-store-us-east/content/pii:S1381116901003442/STRIPIN/image/gif/d6850a4d5f830867b663716b624106a4/si4.gif https://s3-eu-west-1.amazonaws.com/prod-ucs-content-store-eu-west/content/pii:S1381116901003442/STRIPIN/image/gif/d6850a4d5f830867b663716b624106a4/si4.gif si4 si4.gif gif 676 13 183 ALTIMG 1-s2.0-S1381116901003442-si3.gif https://s3.amazonaws.com/prod-ucs-content-store-us-east/content/pii:S1381116901003442/STRIPIN/image/gif/c786c062d10ac1fc95384167a0e15bc2/si3.gif https://s3-eu-west-1.amazonaws.com/prod-ucs-content-store-eu-west/content/pii:S1381116901003442/STRIPIN/image/gif/c786c062d10ac1fc95384167a0e15bc2/si3.gif si3 si3.gif gif 568 13 141 ALTIMG 1-s2.0-S1381116901003442-si2.gif https://s3.amazonaws.com/prod-ucs-content-store-us-east/content/pii:S1381116901003442/STRIPIN/image/gif/ceb93be5a1ed2dd66e5bb7ddb46c1c71/si2.gif https://s3-eu-west-1.amazonaws.com/prod-ucs-content-store-eu-west/content/pii:S1381116901003442/STRIPIN/image/gif/ceb93be5a1ed2dd66e5bb7ddb46c1c71/si2.gif si2 si2.gif gif 632 13 153 ALTIMG 1-s2.0-S1381116901003442-si14.gif https://s3.amazonaws.com/prod-ucs-content-store-us-east/content/pii:S1381116901003442/STRIPIN/image/gif/e7cd1c567611683f724307e711a5b1c3/si14.gif https://s3-eu-west-1.amazonaws.com/prod-ucs-content-store-eu-west/content/pii:S1381116901003442/STRIPIN/image/gif/e7cd1c567611683f724307e711a5b1c3/si14.gif si14 si14.gif gif 987 14 286 ALTIMG 1-s2.0-S1381116901003442-si13.gif https://s3.amazonaws.com/prod-ucs-content-store-us-east/content/pii:S1381116901003442/STRIPIN/image/gif/8d1f14b3075a3744263bb9d3d39fb48b/si13.gif https://s3-eu-west-1.amazonaws.com/prod-ucs-content-store-eu-west/content/pii:S1381116901003442/STRIPIN/image/gif/8d1f14b3075a3744263bb9d3d39fb48b/si13.gif si13 si13.gif gif 637 13 158 ALTIMG 1-s2.0-S1381116901003442-si12.gif https://s3.amazonaws.com/prod-ucs-content-store-us-east/content/pii:S1381116901003442/STRIPIN/image/gif/2586e102e5dcd471e408295eb9d2de41/si12.gif https://s3-eu-west-1.amazonaws.com/prod-ucs-content-store-eu-west/content/pii:S1381116901003442/STRIPIN/image/gif/2586e102e5dcd471e408295eb9d2de41/si12.gif si12 si12.gif gif 781 13 224 ALTIMG 1-s2.0-S1381116901003442-si11.gif https://s3.amazonaws.com/prod-ucs-content-store-us-east/content/pii:S1381116901003442/STRIPIN/image/gif/f1b5f01a2d2d872f77646b5ead85127b/si11.gif https://s3-eu-west-1.amazonaws.com/prod-ucs-content-store-eu-west/content/pii:S1381116901003442/STRIPIN/image/gif/f1b5f01a2d2d872f77646b5ead85127b/si11.gif si11 si11.gif gif 613 13 166 ALTIMG 1-s2.0-S1381116901003442-si10.gif https://s3.amazonaws.com/prod-ucs-content-store-us-east/content/pii:S1381116901003442/STRIPIN/image/gif/a8d5187280de7fdb6500ec452497f02e/si10.gif https://s3-eu-west-1.amazonaws.com/prod-ucs-content-store-eu-west/content/pii:S1381116901003442/STRIPIN/image/gif/a8d5187280de7fdb6500ec452497f02e/si10.gif si10 si10.gif gif 227 14 32 ALTIMG 1-s2.0-S1381116901003442-si1.gif https://s3.amazonaws.com/prod-ucs-content-store-us-east/content/pii:S1381116901003442/STRIPIN/image/gif/abdc27c7931aae100e24a73119842c0a/si1.gif https://s3-eu-west-1.amazonaws.com/prod-ucs-content-store-eu-west/content/pii:S1381116901003442/STRIPIN/image/gif/abdc27c7931aae100e24a73119842c0a/si1.gif si1 si1.gif gif 897 17 246 ALTIMG 1-s2.0-S1381116901003442-fx1.sml https://s3.amazonaws.com/prod-ucs-content-store-us-east/content/pii:S1381116901003442/fx1/THUMBNAIL/image/gif/caafc881627c64b6f37c5448e2e0fe04/fx1.sml https://s3-eu-west-1.amazonaws.com/prod-ucs-content-store-eu-west/content/pii:S1381116901003442/fx1/THUMBNAIL/image/gif/caafc881627c64b6f37c5448e2e0fe04/fx1.sml fx1 fx1.sml sml 573 24 125 IMAGE-THUMBNAIL 1-s2.0-S1381116901003442-fx1.gif https://s3.amazonaws.com/prod-ucs-content-store-us-east/content/pii:S1381116901003442/fx1/DOWNSAMPLED/image/gif/9e1e0a3b125d8276995b58f205cd838a/fx1.gif https://s3-eu-west-1.amazonaws.com/prod-ucs-content-store-eu-west/content/pii:S1381116901003442/fx1/DOWNSAMPLED/image/gif/9e1e0a3b125d8276995b58f205cd838a/fx1.gif fx1 fx1.gif gif 1637 56 289 IMAGE-DOWNSAMPLED 1-s2.0-S1381116901003442-gr1.sml https://s3.amazonaws.com/prod-ucs-content-store-us-east/content/pii:S1381116901003442/gr1/THUMBNAIL/image/gif/ea8e2c43ef12a0f2dddca01275969127/gr1.sml https://s3-eu-west-1.amazonaws.com/prod-ucs-content-store-eu-west/content/pii:S1381116901003442/gr1/THUMBNAIL/image/gif/ea8e2c43ef12a0f2dddca01275969127/gr1.sml gr1 gr1.sml sml 807 92 60 IMAGE-THUMBNAIL 1-s2.0-S1381116901003442-gr1.gif https://s3.amazonaws.com/prod-ucs-content-store-us-east/content/pii:S1381116901003442/gr1/DOWNSAMPLED/image/gif/13e31d62bfa705012bdbdacb44a23852/gr1.gif https://s3-eu-west-1.amazonaws.com/prod-ucs-content-store-eu-west/content/pii:S1381116901003442/gr1/DOWNSAMPLED/image/gif/13e31d62bfa705012bdbdacb44a23852/gr1.gif gr1 gr1.gif gif 6341 422 274 IMAGE-DOWNSAMPLED 1-s2.0-S1381116901003442-gr2.sml https://s3.amazonaws.com/prod-ucs-content-store-us-east/content/pii:S1381116901003442/gr2/THUMBNAIL/image/gif/4ff9afc3def3719c65c44171324d9f3b/gr2.sml https://s3-eu-west-1.amazonaws.com/prod-ucs-content-store-eu-west/content/pii:S1381116901003442/gr2/THUMBNAIL/image/gif/4ff9afc3def3719c65c44171324d9f3b/gr2.sml gr2 gr2.sml sml 1267 93 60 IMAGE-THUMBNAIL 1-s2.0-S1381116901003442-gr2.gif https://s3.amazonaws.com/prod-ucs-content-store-us-east/content/pii:S1381116901003442/gr2/DOWNSAMPLED/image/gif/78eb910ff77034c120a02d1882196879/gr2.gif https://s3-eu-west-1.amazonaws.com/prod-ucs-content-store-eu-west/content/pii:S1381116901003442/gr2/DOWNSAMPLED/image/gif/78eb910ff77034c120a02d1882196879/gr2.gif gr2 gr2.gif gif 11886 423 274 IMAGE-DOWNSAMPLED 1-s2.0-S1381116901003442-gr3.sml https://s3.amazonaws.com/prod-ucs-content-store-us-east/content/pii:S1381116901003442/gr3/THUMBNAIL/image/gif/397100b1a02d66ab40aa61327f1da79b/gr3.sml https://s3-eu-west-1.amazonaws.com/prod-ucs-content-store-eu-west/content/pii:S1381116901003442/gr3/THUMBNAIL/image/gif/397100b1a02d66ab40aa61327f1da79b/gr3.sml gr3 gr3.sml sml 898 92 45 IMAGE-THUMBNAIL 1-s2.0-S1381116901003442-gr3.gif https://s3.amazonaws.com/prod-ucs-content-store-us-east/content/pii:S1381116901003442/gr3/DOWNSAMPLED/image/gif/6ce9a3f36aed265cf802e8bdf8a69934/gr3.gif https://s3-eu-west-1.amazonaws.com/prod-ucs-content-store-eu-west/content/pii:S1381116901003442/gr3/DOWNSAMPLED/image/gif/6ce9a3f36aed265cf802e8bdf8a69934/gr3.gif gr3 gr3.gif gif 7691 426 208 IMAGE-DOWNSAMPLED 1-s2.0-S1381116901003442-gr4.sml https://s3.amazonaws.com/prod-ucs-content-store-us-east/content/pii:S1381116901003442/gr4/THUMBNAIL/image/gif/9fe4bfa6344f4b7e2c3a8503d90e0fd6/gr4.sml https://s3-eu-west-1.amazonaws.com/prod-ucs-content-store-eu-west/content/pii:S1381116901003442/gr4/THUMBNAIL/image/gif/9fe4bfa6344f4b7e2c3a8503d90e0fd6/gr4.sml gr4 gr4.sml sml 1517 93 118 IMAGE-THUMBNAIL 1-s2.0-S1381116901003442-gr4.gif https://s3.amazonaws.com/prod-ucs-content-store-us-east/content/pii:S1381116901003442/gr4/DOWNSAMPLED/image/gif/60b4989bffa49e605970cbe8b9448bfb/gr4.gif https://s3-eu-west-1.amazonaws.com/prod-ucs-content-store-eu-west/content/pii:S1381116901003442/gr4/DOWNSAMPLED/image/gif/60b4989bffa49e605970cbe8b9448bfb/gr4.gif gr4 gr4.gif gif 10546 433 549 IMAGE-DOWNSAMPLED 1-s2.0-S1381116901003442-gr5.sml https://s3.amazonaws.com/prod-ucs-content-store-us-east/content/pii:S1381116901003442/gr5/THUMBNAIL/image/gif/8af651370fff95020220024d90c86ddf/gr5.sml https://s3-eu-west-1.amazonaws.com/prod-ucs-content-store-eu-west/content/pii:S1381116901003442/gr5/THUMBNAIL/image/gif/8af651370fff95020220024d90c86ddf/gr5.sml gr5 gr5.sml sml 1039 93 60 IMAGE-THUMBNAIL 1-s2.0-S1381116901003442-gr5.gif https://s3.amazonaws.com/prod-ucs-content-store-us-east/content/pii:S1381116901003442/gr5/DOWNSAMPLED/image/gif/7ab8fab33d498be46502db4fc15ae2a0/gr5.gif https://s3-eu-west-1.amazonaws.com/prod-ucs-content-store-eu-west/content/pii:S1381116901003442/gr5/DOWNSAMPLED/image/gif/7ab8fab33d498be46502db4fc15ae2a0/gr5.gif gr5 gr5.gif gif 9109 424 275 IMAGE-DOWNSAMPLED 1-s2.0-S1381116901003442-gr6.sml https://s3.amazonaws.com/prod-ucs-content-store-us-east/content/pii:S1381116901003442/gr6/THUMBNAIL/image/gif/d0904f66f68ee6096b41241848ef1302/gr6.sml https://s3-eu-west-1.amazonaws.com/prod-ucs-content-store-eu-west/content/pii:S1381116901003442/gr6/THUMBNAIL/image/gif/d0904f66f68ee6096b41241848ef1302/gr6.sml gr6 gr6.sml sml 771 92 45 IMAGE-THUMBNAIL 1-s2.0-S1381116901003442-gr6.gif https://s3.amazonaws.com/prod-ucs-content-store-us-east/content/pii:S1381116901003442/gr6/DOWNSAMPLED/image/gif/ce39f8f047881e5860e67bae1b53d155/gr6.gif https://s3-eu-west-1.amazonaws.com/prod-ucs-content-store-eu-west/content/pii:S1381116901003442/gr6/DOWNSAMPLED/image/gif/ce39f8f047881e5860e67bae1b53d155/gr6.gif gr6 gr6.gif gif 6646 426 208 IMAGE-DOWNSAMPLED MOLCAA 3348 S1381-1169(01)00344-2 10.1016/S1381-1169(01)00344-2 Elsevier Science B.V. Fig. 1 Aluminium K-edge XANES spectra of (a) γ-Al2O3 and (b) β-AlF3 formed by reaction with CF3Br up to 973K. Fig. 2 Aluminium K-edge XANES spectra of (a) fresh NiZSM-5 catalyst, and following exposure to CF3Br at 973K for (b) 20min; (c) 90min; and (d) 6h. Fig. 3 Nickel K-edge EXAFS Fourier transforms of a fresh NiZSM-5 catalyst, and following exposure to CF3Br at 973K for different times. Fig. 4 Comparison of observed and fitted nickel K-edge EXAFS Fourier transforms for a NiZSM-5 catalyst exposed to CF3Br at 973K for 5min. Solid line: observed data; dashed line (circles): fitted data for a first shell of 4.5 oxygens at a distance of 0.203nm and 3.2 nickels at 0.296nm; dashed line (triangles): fitted data for a first shell of 3.8 fluorines at 0.201nm and 3.2 nickels at 0.296nm. Fig. 5 Aluminium K-edge XANES spectra of (a) fresh NiZSM-5 catalyst and one used in the reaction of CF3Br with CH4 at 873K for (b) 15min; and (c) 3h. Fig. 6 Nickel K-edge EXAFS Fourier transforms of a fresh NiZSM-5 catalyst and one used in the reaction of CF3Br with CH4 at 873K for 3h. Zeolite catalysts for Halon conversion Russell F. Howe a b * Stuart Thomson b Yannan Yang b Kai Lee c Eric M. Kennedy c Bogdan Z. Dlugogorski c a Chemistry Department, University of Aberdeen, Aberdeen AB24 3UE, Scotland, UK b Chemistry Department, University of New South Wales, New South Wales, Australia c Department of Chemical Engineering, University of Newcastle, Newcastle, Australia * Corresponding author. Tel.: +44-1224-272948; fax: +44-1224-272921 Al and Ni K-edge XANES and EXAFS experiments have been undertaken to characterise the chemical states of aluminium and nickel in NiZSM-5 catalysts used for the pyrolysis and hydrodehalogenation with methane of Halon 1301 (CF3Br). It is shown that pyrolysis of Halon 1301 over NiZSM-5 involves both extra-framework aluminium fluoride or hydroxyfluoride species and aggregated nickel species, probably fluorided. Reaction products are CF4 and C2F6. The reaction between Halon 1301 and methane over NiZSM-5 produces CHF3 and CH3Br as major, but not exclusive products. In the presence of CH4 framework dealumination and aggregation of nickel is inhibited. Future prospects for utilising these and similar catalysts in reactions of other Halons and CFCs to produce useful fluorocarbon products as an alternative to destruction are briefly discussed. Keywords Zeolites Halons XANES EXAFS NiZSM-5 Methane 1 Introduction The well known problem of stratospheric ozone depletion by chlorine and bromine containing compounds has been addressed through the Montreal protocol, which in its more recent revisions calls for a phase out in the production of Halons (bromine containing fluorocarbons and chlorofluorocarbons) by 1994, and of CFCs by 1996. The use of CFCs in developed countries is now banned, and many countries are moving to ban the use of Halons. This legislation has initiated extensive research into possible replacements for Halons and CFCs, and to a lesser extent into methods for disposal of existing stockpiles. A number of destruction technologies for CFCS and Halons are currently in use or under development. Thermal incineration, an established method, is energy inefficient and produces environmentally hazardous by-products; the alternative plasma arc process is environmentally more acceptable, but much more expensive [1]. Other lower temperature catalytic destruction processes are being studied, but catalyst deactivation remains a problem [2,3]. Given the high initial costs of producing Halons and CFCs, there is a considerable incentive to find non-destructive processes which remove the ozone depleting bromine and chlorine atoms while retaining the carbon–fluorine bonds, forming fluorocarbons (FCs) or hydroflurocarbons (HFCs). These materials are not ozone depleting, and have value as products. A number of groups are investigating catalytic hydrodechlorination of CFCs as a route to HFCs [4–12]. The general chemistry required can be represented as follows: C x F y Cl z+zH 2→C x F y H z+zHCl Supported palladium catalysts appear to be the most active, and show the highest selectivities for retention of CF bonds (the undesired reaction pathway is the complete hydrogenation of the CFC to an alkane, forming HF as well as HCl). It is noteworthy that fluorided supports show particularly high activity and selectivity. Coq et al. [4,5] showed that oxide supports were converted to fluoride supports during the reaction of CCl2F2 with hydrogen over supported palladium. The reaction of oxides such as alumina or zirconia with fluorocarbons is known to cause replacement of oxide and hydroxide ions with fluoride ions [6]. Other workers have claimed that a surface palladium carbide phase is the active component in supported palladium catalysts [7]. Promotion of palladium–silica catalysts with bismuth or thallium was found by Ohnishi et al. to dramatically enhance the selectivity to olefinic products in the hydrodehalogenation of CCl2FCClF2 [8]. Karpinski et al. studied the hydrodehalogenation of the closely related CFC CCl2CF3, over palladium–alumina and found that a high hydrogen over-pressure was needed to maintain selectivity to the desired HCF product CH2FCF3 [9]. Metals other than palladium are less active for hydrodehalogenation, but may show different product selectivities. For example, reaction of CF2Cl2 with hydrogen over ruthenium supported on carbon or magnesium fluoride gave high selectivities to the mono-substituted product CF2HCl [10]. Similar selectivity to the mono-substituted product CHClFCF3 was observed for the reaction of CCl2FCF3 with hydrogen over silica supported ruthenium [11], while CCl3CF3 over the same catalysts forms C4 coupling products [12]. Despite this attention paid to CFCs, there appear to be no reports in the open literature of catalytic hydrodehalogenation of Halons. Halons 1211 (CF2ClBr), 1301 (CF3Br) and 2402 (C2F4Br2) are all used as fire retarding agents, and have ozone depleting potentials considerably higher than CFCs. The homogeneous gas phase reaction of CF2ClBr with hydrogen is reported to begin above 673K, forming CHF2Cl, CHF2Br, CH2F2 and CH4 [13], while the reaction of CF3Br with hydrogen can be enhanced by UV irradiation, forming CHF3 [14]. Thermal reaction of CF3Br with hydrogen has been studied more recently by three of the present authors; conversions of 80% were achieved at 973K and 1s residence time, with a selectivity to CHF3 in excess of 80% [15]. Li et al. [16,17] studied the homogeneous gas phase pyrolysis of CF3Br over the temperature range 673–1073K, with residence times between 0.1 and 2.0s. The homogeneous reaction begins at about 873K, and the conversion increases exponentially with increasing temperature. The major carbon containing products are C2F6 and CF4; at low temperatures the selectivity to C2F6 is close to 100%, but CF4 yield increases with increasing temperature. C2F6 formation can be envisaged to involve dimerisation of two CF3 radicals: 2CF 3 Br→C 2 F 6+Br 2 Bromine was detected as a reaction product, although not quantified. CF4 formation, on the other hand, must involve CF bond cleavage. The authors were able to model the observed conversions and selectivities with a 12 step reaction mechanism [17]. The initial reaction step is thermal cleavage of the CBr bond: CF 3 Br→CF 3 +Br followed by attack of a bromine atom on a second CF3Br molecule: Br +CF 3 Br→CF 3 +Br 2 C2F6 is generated by recombination of two CF3 radicals. CF4 may be formed from attack of CF3 on a further CF3Br molecule: CF 3 +CF 3 Br→CF 4+CF 2 Br Further subsequent reactions lead to the formation of minor products such as CBr2F2 and termination of the chain reaction. We were interested to determine if the reaction rates and product selectivities for this pyrolysis reaction could be altered by intercepting the reaction pathway with zeolite catalysts. Konya et al. have described the adsorption and decomposition of CFCs over different Y zeolites [18]. They observed a dominant role of zeolite acidity in the decomposition, and found by infrared spectroscopy that transition metal ions enhanced both the formation and decomposition of phosgene as a surface intermediate in the decomposition process. Phosgene could also be detected in the gas phase at elevated temperatures. The authors inferred that phosgene formation involved continuous dealumination of the zeolite framework, i.e. the decomposition reaction was stoichiometric rather than catalytic. Zeolite ZSM-5 is known to have a structure which tolerates very substantial framework dealumination, and can have strong Bronsted acidity. Accordingly, we examined the pyrolysis of CF3Br in the presence of HZSM-5 and a Ni2+ exchanged ZSM-5 [16]. NiZSM-5 in particular significantly enhances the decomposition reaction, and catalytic decomposition begins at temperatures 200K lower than the homogeneous gas phase reaction. There is initially 100% conversion of CF3Br over NiZSM-5 at this temperature for the first 50min on stream, followed by deactivation to a steady state conversion of around 25%. During the initial period of high activity, the major carbon containing product detected is CF4, with 70% selectivity, but during the later deactivation this falls to around 10% and C2F6 becomes the major product. For HZSM-5, on the other hand, the initial high conversion of CF3Br is immediately lost, and the steady state conversion falls to less than 10%, only slightly higher than the homogeneous gas phase value at this temperature. C2F6 is the only significant carbon containing product detected over HZSM-5. We have also reported previously the hydrodehalogenation of CF3Br over transition metal exchanged ZSM-5 zeolites, using methane rather than hydrogen as the source of hydrogen atoms [19,20]. Methane is available at low cost from natural gas, offers multiple hydrogen atoms per molecule, and in principle forms alkyl halide products rather than corrosive hydrogen halides. A homogeneous gas phase reaction occurs between CF3Br and CH4 on heating above 850K. The kinetics and product distributions obtained in this reaction have been described in [17]. At temperatures below 900K there is an approximately equal conversion of the two reactants, and the major products are those expected for simple halogen exchange: CH 4+CF 3 Br→CH 3 Br+CHF 3 As in the pyrolysis reaction described above, the reaction is considered to be initiated by thermal cleavage of CBr bonds generating CF3 radicals. These then attack CH4, forming CHF3 and CH3 radicals; the CH3 radicals then strip a bromine atom from a further CF3Br molecule. At higher temperatures, the conversion of methane falls below that of CF3Br, and other products such as C2H2F2, C2H4 and CHBrF2 appear in minor yields. The variations of product selectivities with temperature and reactant feed ratio could be adequately simulated with a multi-step free radical mechanism. Interception of this reaction with zeolite catalysts lowers substantially the temperature required for significant conversion. At 873K, the initial conversions of CF3Br and CH4 over HZSM-5 are 10-fold higher than those of the homogeneous reaction at the same flow rate, but the catalyst deactivates over a 2h period to steady state conversions which are only slightly higher than those in the homogeneous reaction. On the other hand, the NiZSM-5 catalyst, after an initial break in period, maintains high steady state conversions for more than 20h before beginning to slowly deactivate. The steady state conversion of CF3Br over NiZSM-5 exceeds that of methane under all conditions. The product selectivities over the NiZSM-5 catalyst were found to vary little with time on stream. Steady state selectivities at 873K were around 40% to CH3Br, 30% to CHF3, 12% to CH2Br2, and around 5–6% to minor products C2F6, C2H4, C2H2 and C2H2F2. The activity of used nickel catalysts could be regenerated almost completely by treatment in a hydrogen stream at 623K for 3h, whereas an oxidative treatment (expected to remove coke) had little effect [20]. Catalytic performance similar to that achieved with NiZSM-5 is also seen with CuZSM-5 and MnZSM-5 [19]. In order to better understand the changes occurring in the zeolite catalysts during pyrolysis and hydrodehalogenation of CF3Br, we have carried out detailed characterisation studies on fresh catalysts and on samples removed from the reactor at various times on stream. This paper describes in particular new results obtained using Al and Ni K-edge XANES and EXAFS to monitor changes in the coordination and chemical environment occurring during catalyst break-in and deactivation. 2 Experimental Experimental details of catalysts used in our work, of the plug flow microreactor used for catalyst testing and of the standard characterisation techniques employed can be found in previously published articles [16,20]. Al K-edge XANES data were measured in total electron yield mode (channeltron detector) on Beam Line 3-3 at the Stanford Synchrotron Radiation Laboratory. Pressed discs of catalyst were mounted using conducting tape on a sample holder inserted into a vacuum chamber (10−6 Torr) interfaced to the beam line via a diamond window. A YB66(400) double crystal monochromator was used, and spectra collected in step-scan mode at room temperature. Ni K-edge EXAFS data were measured in transmission mode at Beam Line 20B (the Australian National Beam Line Facility) at the Photon Factory, Japan, using a Si(111) monochromator. Processing and fitting of the EXAFS data was undertaken with the program XFIT [21]. 3 Results and discussion 3.1 Pyrolysis of CF3Br Remarkably, X-ray diffraction patterns of used catalysts showed no loss of zeolite crystallinity, even after many hours on stream at reaction temperatures, and chemical analysis showed no loss of aluminium or nickel. 27 Al NMR spectra showed however that the characteristic signal of tetrahedral framework aluminium in the fresh zeolite catalysts was completely lost after exposure to CF3Br for only a few minutes at 973K. This loss of framework aluminium was confirmed in 29 Si spectra, which showed a narrowing of line width typical of a dealuminated framework. NiZSM-5 catalysts exposed to CF3Br on stream for several hours or more gave a new signal in the 27 Al NMR spectrum characteristic of octahedral aluminium. The appearance of this signal coincided with the deactivation of the catalyst and the change in product selectivity referred to above. These changes in the NMR spectra were interpreted in terms of a two stage process (at least for NiZSM-5), in which exposure to CF3Br causes rapid removal of aluminium from the zeolite framework to form a low symmetry extra-framework aluminium species which is NMR invisible, followed by conversion of this species to an octahedral extra-framework species. XPS analysis of the used catalyst samples revealed that there was a significant depletion of surface aluminium from the zeolites; in the case of HZSM-5 aluminium could no longer be detected by XPS after 9h on stream. XPS also showed however that high concentrations of surface fluorine are present in used catalysts. For example, after 9h on stream, a NiZSM-5 catalyst gave an F:Si ratio of 0.167 by XPS, which was reduced appreciably on argon ion sputtering [16]. Oxides such as alumina are known to undergo halogen exchange reactions with halocarbons. This chemistry has been extensively studied by Kemnitz and Menz, and recently reviewed [6]. A sample of γ-alumina was accordingly tested for CF3Br pyrolysis activity. It was found that although high conversions of CF3Br were measured for short periods of time at temperatures as low as 773K, negligible amounts of fluorocarbon products were detected, and examination of the used catalyst by X-ray powder diffraction showed that it had been quantitatively converted to β-AlF3. This clearly results from a stoichiometric reaction between γ-alumina and CF3Br. Although we have not studied in detail the chemistry of this reaction, the resulting bulk phase appears to have little catalytic activity for the pyrolysis reaction. The reaction with γ-alumina provides some clues about what may be occurring with the zeolite catalyst. The substitution of fluorine into alumina through reaction with CHClF2 occurs via hydroxyfluoride intermediate phases [22], and similar chemistry occurring with CF3Br at Bronsted acid sites in the zeolite catalysts would be expected to form aluminium hydroxyfluoride species which may be partially or completely detached from the zeolite framework, e.g. Such species would contain aluminium in a low symmetry environment, and the resulting quadrupolar broadening would render them invisible to the conventional one pulse NMR experiment. A spectroscopic signature of aluminium fluoride species can be obtained however from the aluminium K-edge XANES spectrum. The K-edge XANES spectrum arises from X-ray excited electronic transitions from the 1s orbital to higher bound states. The energies of these states and therefore the observed X-ray absorption energies are sensitive to the coordination environment. Fig. 1 shows Al XANES spectra of γ-alumina before and after exposure to CF3Br at 773K for 4h and 973K for 2h. The X-ray diffraction pattern of the treated sample confirmed it to be β-AlF3. The XANES of the AlF3 phase is closely similar to that reported previously by Grohman et al. [23], comprising a strong white line peak (the dipole allowed 1s to 2p transition) at 1570eV with a higher energy shoulder. It is noteworthy that the white line peak is shifted to higher energy by about 4eV relative to the first peak in the alumina spectrum. Fig. 2 shows a series of Al K-edge XANES spectra measured from NiZSM-5 catalysts before and after reaction with CF3Br at 973K for various lengths of time. The aluminium content of the zeolite is low (Si:Al=50), which means that the signals observed are very weak. The fresh catalyst shows a XANES spectrum characteristic of aluminium in tetrahedral coordination in a zeolite framework [24]. After brief exposure to CF3Br at 973K, the white line signal of tetrahedral framework aluminium is replaced by a new signal at higher energy which is in the identical position to that measured from the alumina sample converted to β-AlF3. This new signal is reduced in intensity in catalyst samples removed from the reactor after longer times on stream, and can be barely detected after 6h of reaction. The loss of intensity is consistent with XPS results showing depletion of surface aluminium, since both techniques measure surface composition only. The Al XANES data do indicate however that the aluminium remaining in the surface layers of the zeolite is in a fluoride environment. As described by Li et al. [16], FTIR measurements of pyridine chemisorption show that used catalysts contain both Bronsted and Lewis acidity. In the case of HZSM-5, the acid sites can no longer be detected after the catalyst has been on stream for several hours, whereas in NiZSM-5 acid sites are still present after 9h on stream. Bronsted and Lewis acidity are both found in alumina catalysts partially halogen exchanged with CHClF2 [22]. The fluoride and hydroxyfluoride extra-framework aluminium species that we propose are formed on exposure of the zeolite catalysts to CF3Br would be expected to show similar acidic properties. The coordination state of the Ni ions in NiZSM-5 is also changed on exposure to CF3Br at reaction temperatures. This can be clearly seen in the Ni K-edge EXAFS Fourier transforms presented in Fig. 3 . The fresh catalyst contains Ni in ion exchange sites, showing a single oxygen coordination shell. After brief exposure to CF3Br at 973K, the intensity of the first shell is reduced and a strong second shell appears due to Ni–Ni interactions at a distance (after phase correction) of 0.296nm. As shown in Fig. 4 the observed Fourier transform of the catalyst taken from the reactor after 5min exposure to CF3Br can be fitted equally well to two different structural models: NiO, with 4.5 oxygens at a distance of 0.203nm and 3.2 nickels at a distance of 0.296nm, or NiF2, with 3.8 fluorines at a distance of 0.201nm and the same Ni:Ni parameters as the first model. EXAFS is unable to clearly differentiate between oxygen and fluorine nearest neighbors, given the similarity of the back scattering amplitude and phase shift parameters for these two atoms. The observed Ni–Ni distance is close to those in both NiO (0.297nm) and NiF2 (0.308nm) [25]. The first shell Ni–F distance is close to the longer of the Ni–F distances in NiF2 (0.2018nm), whereas the fitted Ni–O distance is significantly shorter than that in NiO (0.2097nm). However, we cannot conclude unambiguously from these data that a nickel fluoride species is formed, even if the alternative nickel oxide species seems chemically less plausible. What is clear is that whatever the nickel species is that is formed in the zeolite pores on initial exposure to CF3Br remains unchanged throughout the lifetime of the catalyst. This species comprises NiF2 or NiO clusters dispersed within the zeolite pores (since there is no surface enrichment of Ni detected by XPS). The Fourier transforms in Fig. 3 show a broadening of the second shell Ni:Ni peak at longer reaction times, indicating increasing disorder in the system, but there is no other obvious change in the state of the nickel. To summarise, from the characterisation experiments on used catalyst samples, the following conclusions can be drawn about the chemistry occurring during pyrolysis of CF3Br. • There is rapid attack of CF3Br on Bronsted acid sites in the zeolites, producing extra-framework aluminium fluoride and/or hydroxyfluoride species. • The acid sites associated with the extra-framework aluminium species promote the formation of C2F6, but these sites are rapidly deactivated in HZSM-5. • In NiZSM-5 an extra-framework nickel species is rapidly formed which may be a fluoride species; this appears to promote CF4 formation. • CF4 formation at Ni sites is inhibited after about 2h on stream at 973K, but C2F6 formation at acid sites continues, i.e. the deactivation of sites responsible for C2F6 formation in HZSM-5 does not occur in the NiZSM-5 zeolite. • The ZSM-5 zeolite framework survives exposure to CF3Br at elevated temperatures. 3.2 Reaction of CF3Br with methane As for the pyrolysis reaction, X-ray diffraction measurements on the zeolite catalysts used for the hydrodehalogenation reaction show that the zeolite structures remain intact, and 27 Al NMR measurements show that tetrahedral framework aluminium is lost, although not as rapidly as in the case of pyrolysis. Fig. 5 shows aluminium K-edge XANES spectra of a fresh NiZSM-5 zeolite and of catalyst samples taken from the reactor after 15min and 3h on stream. This again indicates the formation of aluminium fluoride species, as revealed by the ca. 4eV shift in position of the white line peak to higher energy (in comparison with Fig. 1). The signal intensity remains however significantly higher than for the same catalysts used in pyrolysis of CF3Br, suggesting there is less loss of surface aluminium. An explanation for these differences can be offered in terms of the established gas phase mechanism for the reaction. If it is assumed that attack of CF3 radicals on Bronsted acid sites causes framework dealumination and formation of extra-framework aluminium fluoride or hydroxyfluoride species, methane will intercept these radicals and inhibit to some extent the dealumination process. It is noteworthy that the lifetime of the HZSM-5 zeolite is considerably longer for the reaction of CF3Br with methane than it is for the pyrolysis reaction. There is also a significant difference in the behaviour of the nickel in NiZSM-5 between the reaction with methane and the pyrolysis reaction. Fig. 6 compares the Ni K-edge EXAFS Fourier transforms of the fresh NiZSM-5 catalyst and one removed from the reactor after several hours on stream. There is no indication of any strong Ni:Ni interactions appearing in the Fourier transform of the used catalyst. As noted above, EXAFS is unable to determine if the original oxygen coordination shell has been replaced by fluorine in the used catalyst, but it is certain that the formation of extra-framework NiF2 or NiO clusters seen in used pyrolysis catalysts is not occurring in the presence of methane. The ability of a hydrogen treatment to restore the activity of a used catalyst is similar to that reported for Rh–SiO2 catalysts deactivated by chlorine during the hydrodechlorination of trichloroethylene [26]. This suggests that fluorine deposition in the NiZSM-5 may be responsible for the deactivation occurring at longer reaction times. The reaction chemistry of CF3Br with methane over the NiZSM-5 catalysts is complex, but we suggest that, as in pyrolysis, cleavage of CBr bonds is the crucial initiating step. Whether the subsequent reaction steps involve gas phase radicals (as in the homogeneous case) or adsorbed species is not yet clear. The role of the nickel cations may be to promote CBr bond cleavage. As noted above, other transition metal exchanged ZSM-5 zeolites are also active for this reaction [19]; although we have not yet examined these catalysts in the same detail, the transition metal component is presumed to play a similar role. 3.3 Future prospects The work to date with zeolite catalysts has established that the reaction of Halon 1301 with methane achieves the desired result of removal of bromine from the Halon. The catalytic mechanism involved is not yet clear however, and catalyst optimisation has not yet been achieved. In particular, further improvement of the selectivity to CHF3 is desirable. Although ZSM-5 zeolites offer the advantages of high surface area, stable framework structure and facile dealumination to form the extra-framework aluminium species which appear to be important in this chemistry, other zeolites such as beta may provide similar advantages. Other high surface area supports for the transition metal component also need to be explored. The product of hydrodebromination of Halon 1301, CHF3, has potential as a precursor for the production of the replacement for the Halon, CF3I. This material, known commercially as triiodide, is non-ozone depleting and has fire suppressant properties only slightly inferior to those of Halons [27]. A new catalytic technology for CF3I production from CHF3 has been recently described [28]. This involves gas phase reaction of CHF3 with I2 in the presence of oxygen over a carbon supported alkali metal salt catalyst, at temperatures between 400 and 600°C. The reaction ostensibly could be written as CHF 3+I 2→CF 3 I+HI but it has been shown that the actual reaction stoichiometry is [29] 3CHF 3+I 2→2CF 3 I+C+3HF The role of oxygen in the reaction is to inhibit carbon deposition and poisoning of the catalyst. The pyrolysis and/or hydrodehalogenation of other Halons offers further opportunities for catalysis. For example, the elimination of bromine from Halon 2402 may provide a useful route to perfluoroethene: C 2 F 4 Br 2→C 2 F 4+Br 2 The homogeneous reaction of Halon 1211 with methane in the gas phase has been shown recently to give high yields of the coupling product C2H2F2 at 1073K [30]. This reaction can be formally written as CF 2 ClBr+CH 4→CF 2 CH 2+HCl+HBr although the actual reaction pathway is more complex than this, involving free radical abstraction and coupling reactions. The possibility of enhancing this reaction at lower temperatures with heterogeneous catalysts is intriguing, both from the viewpoint of Halon conversion to useful products, and from the more fundamental aspect of catalytic methane activation. Finally, the catalytic hydrodehalogenation of CFCs with methane rather than hydrogen clearly needs to be pursued further, given the success of this process with Halons. The catalytic chemistry of fluorocarbons more generally, both synthesis and inter-conversion, offers many opportunities for innovative research, both with zeolites and with other types of catalyst. Acknowledgements This work has received partial support from the Australian Research Council Small Grant Scheme. EXAFS measurements at the Photon Factory were supported by the Australian Synchrotron Research Program, and at SSRL by the Access to Major Research Facilities Program. References [1] G.M. Bickle T. Suzuki Y. Mitarai Chem. Eng. Trans. I 70 1992 449 [2] M. Tajima M. Niwa Y. Fujii Y. Koinuma R. Aizawa S. Kushiyama S. Kobayashi K. Mizuno H. Ohuchi Appl. Catal. B14 1997 97 [3] K.U. Niedersen E. Lieske E. Kemnitz Green Chem. 1 1999 225 [4] B. Coq J.M. Cognion F. Figueras D. Tournigant J. Catal. 141 1993 21 [5] B. Coq F. Figueras S. Hub D. Tournigant J. Phys. Chem. 99 1995 11159 [6] E. Kemnitz D.H. Menz Progr. Solid State Chem. 26 1998 97 [7] W. Juszczyk A. Malinowski Z. Karpinski Appl. Catal. A166 1998 311 [8] R. Ohnishi W.L. Wang M. Ichikawa Appl. Catal. A113 1994 29 [9] Z. Karpinski K. Early J. D’Itri J. Catal. 164 1996 378 [10] A. Malinowski W. Juszczyk M. Bonarowska M. Wojciechowska Z. Kowalczyk Z. Karpinski React. Kinet. Catal. Lett. 68 1999 53 [11] T. Mori Y. Morikawa Elsevier studies in surface science and catalysis 130 2000 1985 [12] T. Mori W. Ueda Y. Morikawa Catal. Lett. 38 1996 73 [13] H.J.P. de Lijser, R. Louw, P. Mulder, J. Chem. Soc., Perkin Trans. II (1994) 139. [14] S. Gulati, M. Lavid, Chemical Processes in Combustion, 1993, p. 69. [15] K. Li, E.M. Kennedy, B. Moghtaderi, B.Z. Dlugogorski, et al., Environ. Sci. Tech. 34 (2000) 584. [16] K. Li F. Oghanna E.M. Kennedy B.Z. Dlugogorski A. Fazeli S. Thomson R.F. Howe Microp. Mesop. Mater. 35/36 2000 219 [17] K. Li E.M. Kennedy B.Z. Dlugogorski Chem. Eng. Sci. 55 2000 4067 [18] Z. Konya I. Kannus I. Kiricsi Elsevier studies in surface science and catalysis 105 1997 1509 [19] K. Li, E.M. Kennedy, B. Dlugogorski, R.F. Howe, Chem. Commun. (1999) 709. [20] K. Li E.M. Kennedy B. Dlugogorski R.F. Howe Catal. Today 63 2000 355 [21] P.A. Ellis H.C. Freeman J. Synchrotron Rad. 2 1995 190 [22] A. Hess E. Kemnitz A. Lippitz W.E.S. Unger D.H. Menz J. Catal. 148 1994 270 [23] I. Grohman A. Hess E. Kemnitz W. Feintrup W.E.S. Unger J. Wong M. Rowen T. Tanaka M. Froba J. Mater. Chem. 8 1998 1453 [24] J.A. van Bokhaven H. Sambe D.E. Ramaker D.C. Koningsberger J. Phys. Chem. 103B 1999 7537 [25] Gmelin Handbuch der Anorganische Chemie, Springer, Berlin, 1980. [26] J.W. Bozelli Y.M. Chen Chem. Eng. Commun. 115 1992 1 [27] R.E. Tapscott S.R. Skaggs D. Dierdorf Am. Chem. Soc. Symp. Ser. 611 1995 151 [28] N. Nagasaki, N. Suzuki, S. Nakano, N. Kunihiro, US Patent 5,892,136 (1999). [29] N. Nagasaki, N. Suzuki, S. Nakano, N. Kunihiro, in: Proceedings of the CF3I Symposium, Newcastle, Australia, 2000. [30] R. Tran E.M. Kennedy B.Z. Dlugogorski Ind. Eng. Chem. Res. 40 2001 3139",
      "scopus-id": "0037170510",
      "coredata": {
        "eid": "1-s2.0-S1381116901003442",
        "dc:description": "Al and Ni K-edge XANES and EXAFS experiments have been undertaken to characterise the chemical states of aluminium and nickel in NiZSM-5 catalysts used for the pyrolysis and hydrodehalogenation with methane of Halon 1301 (CF3Br). It is shown that pyrolysis of Halon 1301 over NiZSM-5 involves both extra-framework aluminium fluoride or hydroxyfluoride species and aggregated nickel species, probably fluorided. Reaction products are CF4 and C2F6. The reaction between Halon 1301 and methane over NiZSM-5 produces CHF3 and CH3Br as major, but not exclusive products. In the presence of CH4 framework dealumination and aggregation of nickel is inhibited. Future prospects for utilising these and similar catalysts in reactions of other Halons and CFCs to produce useful fluorocarbon products as an alternative to destruction are briefly discussed.",
        "openArchiveArticle": "false",
        "prism:coverDate": "2002-03-25",
        "openaccessUserLicense": null,
        "prism:aggregationType": "Journal",
        "prism:url": "https://api.elsevier.com/content/article/pii/S1381116901003442",
        "dc:creator": [
          {
            "@_fa": "true",
            "$": "Howe, Russell F."
          },
          {
            "@_fa": "true",
            "$": "Thomson, Stuart"
          },
          {
            "@_fa": "true",
            "$": "Yang, Yannan"
          },
          {
            "@_fa": "true",
            "$": "Lee, Kai"
          },
          {
            "@_fa": "true",
            "$": "Kennedy, Eric M."
          },
          {
            "@_fa": "true",
            "$": "Dlugogorski, Bogdan Z."
          }
        ],
        "link": [
          {
            "@_fa": "true",
            "@rel": "self",
            "@href": "https://api.elsevier.com/content/article/pii/S1381116901003442"
          },
          {
            "@_fa": "true",
            "@rel": "scidir",
            "@href": "https://www.sciencedirect.com/science/article/pii/S1381116901003442"
          }
        ],
        "dc:format": "application/json",
        "openaccessType": null,
        "pii": "S1381-1169(01)00344-2",
        "prism:volume": "181",
        "prism:publisher": "Elsevier Science B.V.",
        "dc:title": "Zeolite catalysts for Halon conversion",
        "prism:copyright": "Copyright © 2002 Elsevier Science B.V. All rights reserved.",
        "prism:issueName": "Fifteenth Indian National Symposium on Catalysis and Second Conference of the Indo-Pacific Catalysis Association",
        "openaccess": "0",
        "prism:issn": "13811169",
        "prism:issueIdentifier": "1-2",
        "dcterms:subject": [
          {
            "@_fa": "true",
            "$": "Zeolites"
          },
          {
            "@_fa": "true",
            "$": "Halons"
          },
          {
            "@_fa": "true",
            "$": "XANES"
          },
          {
            "@_fa": "true",
            "$": "EXAFS"
          },
          {
            "@_fa": "true",
            "$": "NiZSM-5"
          },
          {
            "@_fa": "true",
            "$": "Methane"
          }
        ],
        "openaccessArticle": "false",
        "prism:publicationName": "Journal of Molecular Catalysis A: Chemical",
        "prism:number": "1-2",
        "openaccessSponsorType": null,
        "prism:pageRange": "63-72",
        "prism:endingPage": "72",
        "pubType": "fla",
        "prism:coverDisplayDate": "25 March 2002",
        "prism:doi": "10.1016/S1381-1169(01)00344-2",
        "prism:startingPage": "63",
        "dc:identifier": "doi:10.1016/S1381-1169(01)00344-2",
        "openaccessSponsorName": null
      },
      "objects": {
        "object": [
          {
            "@category": "thumbnail",
            "@height": "14",
            "@width": "32",
            "@_fa": "true",
            "$": "https://api.elsevier.com/content/object/eid/1-s2.0-S1381116901003442-si9.gif?httpAccept=%2A%2F%2A",
            "@multimediatype": "GIF image file",
            "@type": "ALTIMG",
            "@size": "227",
            "@ref": "si9",
            "@mimetype": "image/gif"
          },
          {
            "@category": "thumbnail",
            "@height": "14",
            "@width": "29",
            "@_fa": "true",
            "$": "https://api.elsevier.com/content/object/eid/1-s2.0-S1381116901003442-si8.gif?httpAccept=%2A%2F%2A",
            "@multimediatype": "GIF image file",
            "@type": "ALTIMG",
            "@size": "233",
            "@ref": "si8",
            "@mimetype": "image/gif"
          },
          {
            "@category": "thumbnail",
            "@height": "14",
            "@width": "32",
            "@_fa": "true",
            "$": "https://api.elsevier.com/content/object/eid/1-s2.0-S1381116901003442-si7.gif?httpAccept=%2A%2F%2A",
            "@multimediatype": "GIF image file",
            "@type": "ALTIMG",
            "@size": "227",
            "@ref": "si7",
            "@mimetype": "image/gif"
          },
          {
            "@category": "thumbnail",
            "@height": "13",
            "@width": "221",
            "@_fa": "true",
            "$": "https://api.elsevier.com/content/object/eid/1-s2.0-S1381116901003442-si6.gif?httpAccept=%2A%2F%2A",
            "@multimediatype": "GIF image file",
            "@type": "ALTIMG",
            "@size": "783",
            "@ref": "si6",
            "@mimetype": "image/gif"
          },
          {
            "@category": "thumbnail",
            "@height": "13",
            "@width": "214",
            "@_fa": "true",
            "$": "https://api.elsevier.com/content/object/eid/1-s2.0-S1381116901003442-si5.gif?httpAccept=%2A%2F%2A",
            "@multimediatype": "GIF image file",
            "@type": "ALTIMG",
            "@size": "776",
            "@ref": "si5",
            "@mimetype": "image/gif"
          },
          {
            "@category": "thumbnail",
            "@height": "13",
            "@width": "183",
            "@_fa": "true",
            "$": "https://api.elsevier.com/content/object/eid/1-s2.0-S1381116901003442-si4.gif?httpAccept=%2A%2F%2A",
            "@multimediatype": "GIF image file",
            "@type": "ALTIMG",
            "@size": "676",
            "@ref": "si4",
            "@mimetype": "image/gif"
          },
          {
            "@category": "thumbnail",
            "@height": "13",
            "@width": "141",
            "@_fa": "true",
            "$": "https://api.elsevier.com/content/object/eid/1-s2.0-S1381116901003442-si3.gif?httpAccept=%2A%2F%2A",
            "@multimediatype": "GIF image file",
            "@type": "ALTIMG",
            "@size": "568",
            "@ref": "si3",
            "@mimetype": "image/gif"
          },
          {
            "@category": "thumbnail",
            "@height": "13",
            "@width": "153",
            "@_fa": "true",
            "$": "https://api.elsevier.com/content/object/eid/1-s2.0-S1381116901003442-si2.gif?httpAccept=%2A%2F%2A",
            "@multimediatype": "GIF image file",
            "@type": "ALTIMG",
            "@size": "632",
            "@ref": "si2",
            "@mimetype": "image/gif"
          },
          {
            "@category": "thumbnail",
            "@height": "14",
            "@width": "286",
            "@_fa": "true",
            "$": "https://api.elsevier.com/content/object/eid/1-s2.0-S1381116901003442-si14.gif?httpAccept=%2A%2F%2A",
            "@multimediatype": "GIF image file",
            "@type": "ALTIMG",
            "@size": "987",
            "@ref": "si14",
            "@mimetype": "image/gif"
          },
          {
            "@category": "thumbnail",
            "@height": "13",
            "@width": "158",
            "@_fa": "true",
            "$": "https://api.elsevier.com/content/object/eid/1-s2.0-S1381116901003442-si13.gif?httpAccept=%2A%2F%2A",
            "@multimediatype": "GIF image file",
            "@type": "ALTIMG",
            "@size": "637",
            "@ref": "si13",
            "@mimetype": "image/gif"
          },
          {
            "@category": "thumbnail",
            "@height": "13",
            "@width": "224",
            "@_fa": "true",
            "$": "https://api.elsevier.com/content/object/eid/1-s2.0-S1381116901003442-si12.gif?httpAccept=%2A%2F%2A",
            "@multimediatype": "GIF image file",
            "@type": "ALTIMG",
            "@size": "781",
            "@ref": "si12",
            "@mimetype": "image/gif"
          },
          {
            "@category": "thumbnail",
            "@height": "13",
            "@width": "166",
            "@_fa": "true",
            "$": "https://api.elsevier.com/content/object/eid/1-s2.0-S1381116901003442-si11.gif?httpAccept=%2A%2F%2A",
            "@multimediatype": "GIF image file",
            "@type": "ALTIMG",
            "@size": "613",
            "@ref": "si11",
            "@mimetype": "image/gif"
          },
          {
            "@category": "thumbnail",
            "@height": "14",
            "@width": "32",
            "@_fa": "true",
            "$": "https://api.elsevier.com/content/object/eid/1-s2.0-S1381116901003442-si10.gif?httpAccept=%2A%2F%2A",
            "@multimediatype": "GIF image file",
            "@type": "ALTIMG",
            "@size": "227",
            "@ref": "si10",
            "@mimetype": "image/gif"
          },
          {
            "@category": "thumbnail",
            "@height": "17",
            "@width": "246",
            "@_fa": "true",
            "$": "https://api.elsevier.com/content/object/eid/1-s2.0-S1381116901003442-si1.gif?httpAccept=%2A%2F%2A",
            "@multimediatype": "GIF image file",
            "@type": "ALTIMG",
            "@size": "897",
            "@ref": "si1",
            "@mimetype": "image/gif"
          },
          {
            "@category": "thumbnail",
            "@height": "24",
            "@width": "125",
            "@_fa": "true",
            "$": "https://api.elsevier.com/content/object/eid/1-s2.0-S1381116901003442-fx1.sml?httpAccept=%2A%2F%2A",
            "@multimediatype": "GIF image file",
            "@type": "IMAGE-THUMBNAIL",
            "@size": "573",
            "@ref": "fx1",
            "@mimetype": "image/gif"
          },
          {
            "@category": "standard",
            "@height": "56",
            "@width": "289",
            "@_fa": "true",
            "$": "https://api.elsevier.com/content/object/eid/1-s2.0-S1381116901003442-fx1.gif?httpAccept=%2A%2F%2A",
            "@multimediatype": "GIF image file",
            "@type": "IMAGE-DOWNSAMPLED",
            "@size": "1637",
            "@ref": "fx1",
            "@mimetype": "image/gif"
          },
          {
            "@category": "thumbnail",
            "@height": "92",
            "@width": "60",
            "@_fa": "true",
            "$": "https://api.elsevier.com/content/object/eid/1-s2.0-S1381116901003442-gr1.sml?httpAccept=%2A%2F%2A",
            "@multimediatype": "GIF image file",
            "@type": "IMAGE-THUMBNAIL",
            "@size": "807",
            "@ref": "gr1",
            "@mimetype": "image/gif"
          },
          {
            "@category": "standard",
            "@height": "422",
            "@width": "274",
            "@_fa": "true",
            "$": "https://api.elsevier.com/content/object/eid/1-s2.0-S1381116901003442-gr1.gif?httpAccept=%2A%2F%2A",
            "@multimediatype": "GIF image file",
            "@type": "IMAGE-DOWNSAMPLED",
            "@size": "6341",
            "@ref": "gr1",
            "@mimetype": "image/gif"
          },
          {
            "@category": "thumbnail",
            "@height": "93",
            "@width": "60",
            "@_fa": "true",
            "$": "https://api.elsevier.com/content/object/eid/1-s2.0-S1381116901003442-gr2.sml?httpAccept=%2A%2F%2A",
            "@multimediatype": "GIF image file",
            "@type": "IMAGE-THUMBNAIL",
            "@size": "1267",
            "@ref": "gr2",
            "@mimetype": "image/gif"
          },
          {
            "@category": "standard",
            "@height": "423",
            "@width": "274",
            "@_fa": "true",
            "$": "https://api.elsevier.com/content/object/eid/1-s2.0-S1381116901003442-gr2.gif?httpAccept=%2A%2F%2A",
            "@multimediatype": "GIF image file",
            "@type": "IMAGE-DOWNSAMPLED",
            "@size": "11886",
            "@ref": "gr2",
            "@mimetype": "image/gif"
          },
          {
            "@category": "thumbnail",
            "@height": "92",
            "@width": "45",
            "@_fa": "true",
            "$": "https://api.elsevier.com/content/object/eid/1-s2.0-S1381116901003442-gr3.sml?httpAccept=%2A%2F%2A",
            "@multimediatype": "GIF image file",
            "@type": "IMAGE-THUMBNAIL",
            "@size": "898",
            "@ref": "gr3",
            "@mimetype": "image/gif"
          },
          {
            "@category": "standard",
            "@height": "426",
            "@width": "208",
            "@_fa": "true",
            "$": "https://api.elsevier.com/content/object/eid/1-s2.0-S1381116901003442-gr3.gif?httpAccept=%2A%2F%2A",
            "@multimediatype": "GIF image file",
            "@type": "IMAGE-DOWNSAMPLED",
            "@size": "7691",
            "@ref": "gr3",
            "@mimetype": "image/gif"
          },
          {
            "@category": "thumbnail",
            "@height": "93",
            "@width": "118",
            "@_fa": "true",
            "$": "https://api.elsevier.com/content/object/eid/1-s2.0-S1381116901003442-gr4.sml?httpAccept=%2A%2F%2A",
            "@multimediatype": "GIF image file",
            "@type": "IMAGE-THUMBNAIL",
            "@size": "1517",
            "@ref": "gr4",
            "@mimetype": "image/gif"
          },
          {
            "@category": "standard",
            "@height": "433",
            "@width": "549",
            "@_fa": "true",
            "$": "https://api.elsevier.com/content/object/eid/1-s2.0-S1381116901003442-gr4.gif?httpAccept=%2A%2F%2A",
            "@multimediatype": "GIF image file",
            "@type": "IMAGE-DOWNSAMPLED",
            "@size": "10546",
            "@ref": "gr4",
            "@mimetype": "image/gif"
          },
          {
            "@category": "thumbnail",
            "@height": "93",
            "@width": "60",
            "@_fa": "true",
            "$": "https://api.elsevier.com/content/object/eid/1-s2.0-S1381116901003442-gr5.sml?httpAccept=%2A%2F%2A",
            "@multimediatype": "GIF image file",
            "@type": "IMAGE-THUMBNAIL",
            "@size": "1039",
            "@ref": "gr5",
            "@mimetype": "image/gif"
          },
          {
            "@category": "standard",
            "@height": "424",
            "@width": "275",
            "@_fa": "true",
            "$": "https://api.elsevier.com/content/object/eid/1-s2.0-S1381116901003442-gr5.gif?httpAccept=%2A%2F%2A",
            "@multimediatype": "GIF image file",
            "@type": "IMAGE-DOWNSAMPLED",
            "@size": "9109",
            "@ref": "gr5",
            "@mimetype": "image/gif"
          },
          {
            "@category": "thumbnail",
            "@height": "92",
            "@width": "45",
            "@_fa": "true",
            "$": "https://api.elsevier.com/content/object/eid/1-s2.0-S1381116901003442-gr6.sml?httpAccept=%2A%2F%2A",
            "@multimediatype": "GIF image file",
            "@type": "IMAGE-THUMBNAIL",
            "@size": "771",
            "@ref": "gr6",
            "@mimetype": "image/gif"
          },
          {
            "@category": "standard",
            "@height": "426",
            "@width": "208",
            "@_fa": "true",
            "$": "https://api.elsevier.com/content/object/eid/1-s2.0-S1381116901003442-gr6.gif?httpAccept=%2A%2F%2A",
            "@multimediatype": "GIF image file",
            "@type": "IMAGE-DOWNSAMPLED",
            "@size": "6646",
            "@ref": "gr6",
            "@mimetype": "image/gif"
          }
        ]
      },
      "link": {
        "@rel": "abstract",
        "@href": "https://api.elsevier.com/content/abstract/scopus_id/0037170510"
      }
    }
  }
}