{
  "metadata": {
    "title": "Gas phase hydrogenation of benzaldehyde over supported copper catalysts",
    "authors": "; ; ",
    "journal": "Journal of Molecular Catalysis A: Chemical",
    "date": "2000-12-18",
    "doi": "10.1016/S1381-1169(00)00199-0",
    "abstract": "",
    "uri": "https://api.elsevier.com/content/article/pii/S1381116900001990",
    "pii": "S1381116900001990"
  },
  "fulltext": {
    "full-text-retrieval-response": {
      "scopus-eid": "2-s2.0-0034684711",
      "originalText": "serial JL 271358 291210 291744 291790 291809 31 Journal of Molecular Catalysis A: Chemical JOURNALMOLECULARCATALYSISACHEMICAL 2000-12-14 2000-12-14 2010-04-18T20:21:34 1-s2.0-S1381116900001990 S1381-1169(00)00199-0 S1381116900001990 10.1016/S1381-1169(00)00199-0 S300 S300.1 FULL-TEXT 1-s2.0-S1381116900X0129X 2015-05-15T05:55:31.049811-04:00 0 0 20001218 2000 2000-12-14T00:00:00Z articleinfo crossmark dco dateupdated tomb dateloaded datesearch indexeddate issuelist volumelist yearnav articletitlenorm authfirstinitialnorm authfirstsurnamenorm cid cids contenttype copyright dateloadedtxt docsubtype doctype doi eid ewtransactionid hubeid issfirst issn issnnorm itemstage itemtransactionid itemweight openaccess openarchive pg pgfirst pglast pii piinorm pubdatestart pubdatetxt pubyr sortorder srctitle srctitlenorm srctype subheadings volfirst volissue webpdf webpdfpagecount figure table body affil articletitle auth authfirstini authfull authkeywords authlast primabst ref alllist content subj ssids 1381-1169 13811169 164 164 1 2 1 2 Volume 164, Issues 1–2 23 205 216 205 216 20001218 18 December 2000 2000-12-18 2000 converted-article fla Copyright © 2000 Elsevier Science B.V. All rights reserved. GASPHASEHYDROGENATIONBENZALDEHYDEOVERSUPPORTEDCOPPERCATALYSTS SAADI A 1 Introduction 2 Experimental 2.1 Catalysts preparation, BET surface area, reducibility 2.2 Catalytic testings 3 Results 3.1 Catalysts characterization 3.2 Catalytic activity 3.2.1 Hydrogenation of benzaldehyde 3.2.1.1 Activity 3.2.1.2 Selectivity 3.2.2 Reduction of benzaldehyde under N2 flow 4 Discussion 4.1 Reduction of benzaldehyde under N2 flow 4.1.1 Reaction at 100°C. Formation of benzylalcohol 4.1.2 Reaction at 350°C. Formation of benzene 4.2 Hydrogenation of benzaldehyde 4.2.1 Activity 4.2.1.1 Copper supported on SiO2 and Al2O3 irreducible supports 4.2.1.2 Copper catalysts supported on TiO2, ZrO2 and CeO2 reducible oxides 4.2.2 Selectivity 4.2.2.1 Benzylalcohol selectivity 4.2.2.2 Toluene selectivity 4.2.2.3 Benzene selectivity 5 Conclusions References CHAMBERS 1997 301 A MARINELL 1995 59 T VANNICE 1997 166 M KEANE 1997 261 M HAFFAD 1997 85 D JENCK 1980 141 J HUBAULT 1989 170 R HUBAULT 1986 231 R NIGHTINGALE 1949 1089 D ADKINS 1948 695 H CAROTHERS 1924 1675 W MENSCHKE 1960 R BALTZLY 1976 928 R PAGANELLI 1990 375 S SCHREIFELS 1981 1263 J JALOWIECKI 1987 375 L BECHARA 1985 15 R DAAGE 1985 355 M BALI 1987 715 720 F SIEGEL 1973 139 S AMARA 1987 153 M HUBAUT 1992 25 R KING 1982 274 S COUDURIER 1969 1121 M KOUSTAL 1993 573 C LEPELTIER 1997 131 F LEPELTIER 1997 91 F BALI 1995 1405 1416 F DUPREZ 1984 219 225 D MESBAHBENYOUCEF 1987 33 46 Z DUPREZ 1990 1 D HEIBA 1964 471 E JAYAMANI 1983 485 M JAYAMANI 1984 527 M SAADIX2000X205 SAADIX2000X205X216 SAADIX2000X205XA SAADIX2000X205X216XA item S1381-1169(00)00199-0 S1381116900001990 1-s2.0-S1381116900001990 10.1016/S1381-1169(00)00199-0 271358 2010-09-30T18:13:49.890922-04:00 2000-12-18 1-s2.0-S1381116900001990-main.pdf https://s3.amazonaws.com/prod-ucs-content-store-us-east/content/pii:S1381116900001990/MAIN/application/pdf/d625a8367c022c8d0b580b85ae2467bc/main.pdf https://s3-eu-west-1.amazonaws.com/prod-ucs-content-store-eu-west/content/pii:S1381116900001990/MAIN/application/pdf/d625a8367c022c8d0b580b85ae2467bc/main.pdf main.pdf pdf true 373525 MAIN 12 1-s2.0-S1381116900001990-main_1.png https://s3.amazonaws.com/prod-ucs-content-store-us-east/content/pii:S1381116900001990/PREVIEW/image/png/55dfa2af4b5223f1f471aa94bc7018fe/main_1.png https://s3-eu-west-1.amazonaws.com/prod-ucs-content-store-eu-west/content/pii:S1381116900001990/PREVIEW/image/png/55dfa2af4b5223f1f471aa94bc7018fe/main_1.png main_1.png png 55197 849 656 IMAGE-WEB-PDF 1 1-s2.0-S1381116900001990-si7.gif https://s3.amazonaws.com/prod-ucs-content-store-us-east/content/pii:S1381116900001990/STRIPIN/image/gif/73a65ca13669dc5a8ec7606e8573f344/si7.gif https://s3-eu-west-1.amazonaws.com/prod-ucs-content-store-eu-west/content/pii:S1381116900001990/STRIPIN/image/gif/73a65ca13669dc5a8ec7606e8573f344/si7.gif si7 si7.gif gif 1752 24 436 ALTIMG 1-s2.0-S1381116900001990-si6.gif https://s3.amazonaws.com/prod-ucs-content-store-us-east/content/pii:S1381116900001990/STRIPIN/image/gif/b8abf2749ba34df055c5e6777fdf94cc/si6.gif https://s3-eu-west-1.amazonaws.com/prod-ucs-content-store-eu-west/content/pii:S1381116900001990/STRIPIN/image/gif/b8abf2749ba34df055c5e6777fdf94cc/si6.gif si6 si6.gif gif 1619 28 405 ALTIMG 1-s2.0-S1381116900001990-si5.gif https://s3.amazonaws.com/prod-ucs-content-store-us-east/content/pii:S1381116900001990/STRIPIN/image/gif/071e753546ea1e27f2a381ba0511eeeb/si5.gif https://s3-eu-west-1.amazonaws.com/prod-ucs-content-store-eu-west/content/pii:S1381116900001990/STRIPIN/image/gif/071e753546ea1e27f2a381ba0511eeeb/si5.gif si5 si5.gif gif 1777 28 433 ALTIMG 1-s2.0-S1381116900001990-si4.gif https://s3.amazonaws.com/prod-ucs-content-store-us-east/content/pii:S1381116900001990/STRIPIN/image/gif/548a118b1d30a5dfb23b50bda4695691/si4.gif https://s3-eu-west-1.amazonaws.com/prod-ucs-content-store-eu-west/content/pii:S1381116900001990/STRIPIN/image/gif/548a118b1d30a5dfb23b50bda4695691/si4.gif si4 si4.gif gif 1744 18 455 ALTIMG 1-s2.0-S1381116900001990-si3.gif https://s3.amazonaws.com/prod-ucs-content-store-us-east/content/pii:S1381116900001990/STRIPIN/image/gif/d372e5ebabca283bee2adacf82d9fce0/si3.gif https://s3-eu-west-1.amazonaws.com/prod-ucs-content-store-eu-west/content/pii:S1381116900001990/STRIPIN/image/gif/d372e5ebabca283bee2adacf82d9fce0/si3.gif si3 si3.gif gif 1787 25 449 ALTIMG 1-s2.0-S1381116900001990-si2.gif https://s3.amazonaws.com/prod-ucs-content-store-us-east/content/pii:S1381116900001990/STRIPIN/image/gif/5b75ac367e7a6825bba0d1cdad757a9c/si2.gif https://s3-eu-west-1.amazonaws.com/prod-ucs-content-store-eu-west/content/pii:S1381116900001990/STRIPIN/image/gif/5b75ac367e7a6825bba0d1cdad757a9c/si2.gif si2 si2.gif gif 1556 18 445 ALTIMG 1-s2.0-S1381116900001990-si1.gif https://s3.amazonaws.com/prod-ucs-content-store-us-east/content/pii:S1381116900001990/STRIPIN/image/gif/44ea62c4edd21a61b1614c9582c26e78/si1.gif https://s3-eu-west-1.amazonaws.com/prod-ucs-content-store-eu-west/content/pii:S1381116900001990/STRIPIN/image/gif/44ea62c4edd21a61b1614c9582c26e78/si1.gif si1 si1.gif gif 1582 18 445 ALTIMG 1-s2.0-S1381116900001990-gr1.sml https://s3.amazonaws.com/prod-ucs-content-store-us-east/content/pii:S1381116900001990/gr1/THUMBNAIL/image/gif/6ec072658ccfa41987a24df6b76a62a1/gr1.sml https://s3-eu-west-1.amazonaws.com/prod-ucs-content-store-eu-west/content/pii:S1381116900001990/gr1/THUMBNAIL/image/gif/6ec072658ccfa41987a24df6b76a62a1/gr1.sml gr1 gr1.sml sml 1243 94 112 IMAGE-THUMBNAIL 1-s2.0-S1381116900001990-gr1.gif https://s3.amazonaws.com/prod-ucs-content-store-us-east/content/pii:S1381116900001990/gr1/DOWNSAMPLED/image/gif/91139e5dea4b6b55c41e8466aea43102/gr1.gif https://s3-eu-west-1.amazonaws.com/prod-ucs-content-store-eu-west/content/pii:S1381116900001990/gr1/DOWNSAMPLED/image/gif/91139e5dea4b6b55c41e8466aea43102/gr1.gif gr1 gr1.gif gif 4792 252 301 IMAGE-DOWNSAMPLED 1-s2.0-S1381116900001990-gr2.sml https://s3.amazonaws.com/prod-ucs-content-store-us-east/content/pii:S1381116900001990/gr2/THUMBNAIL/image/gif/6c1b07a2eb754cc87c9963dbbf61de43/gr2.sml https://s3-eu-west-1.amazonaws.com/prod-ucs-content-store-eu-west/content/pii:S1381116900001990/gr2/THUMBNAIL/image/gif/6c1b07a2eb754cc87c9963dbbf61de43/gr2.sml gr2 gr2.sml sml 1312 93 101 IMAGE-THUMBNAIL 1-s2.0-S1381116900001990-gr2.gif https://s3.amazonaws.com/prod-ucs-content-store-us-east/content/pii:S1381116900001990/gr2/DOWNSAMPLED/image/gif/c09a3cf689b215a2891e1313ba2f79cf/gr2.gif https://s3-eu-west-1.amazonaws.com/prod-ucs-content-store-eu-west/content/pii:S1381116900001990/gr2/DOWNSAMPLED/image/gif/c09a3cf689b215a2891e1313ba2f79cf/gr2.gif gr2 gr2.gif gif 7121 303 329 IMAGE-DOWNSAMPLED 1-s2.0-S1381116900001990-gr3.sml https://s3.amazonaws.com/prod-ucs-content-store-us-east/content/pii:S1381116900001990/gr3/THUMBNAIL/image/gif/bc7c22ea63b62e5d90454454374dc359/gr3.sml https://s3-eu-west-1.amazonaws.com/prod-ucs-content-store-eu-west/content/pii:S1381116900001990/gr3/THUMBNAIL/image/gif/bc7c22ea63b62e5d90454454374dc359/gr3.sml gr3 gr3.sml sml 962 92 44 IMAGE-THUMBNAIL 1-s2.0-S1381116900001990-gr3.gif https://s3.amazonaws.com/prod-ucs-content-store-us-east/content/pii:S1381116900001990/gr3/DOWNSAMPLED/image/gif/a0f8b4932142cbd51ca9be97925451e0/gr3.gif https://s3-eu-west-1.amazonaws.com/prod-ucs-content-store-eu-west/content/pii:S1381116900001990/gr3/DOWNSAMPLED/image/gif/a0f8b4932142cbd51ca9be97925451e0/gr3.gif gr3 gr3.gif gif 19011 571 272 IMAGE-DOWNSAMPLED 1-s2.0-S1381116900001990-gr4.sml https://s3.amazonaws.com/prod-ucs-content-store-us-east/content/pii:S1381116900001990/gr4/THUMBNAIL/image/gif/4b2a3710dcf935a4cc1e280a4c336cd5/gr4.sml https://s3-eu-west-1.amazonaws.com/prod-ucs-content-store-eu-west/content/pii:S1381116900001990/gr4/THUMBNAIL/image/gif/4b2a3710dcf935a4cc1e280a4c336cd5/gr4.sml gr4 gr4.sml sml 1194 93 45 IMAGE-THUMBNAIL 1-s2.0-S1381116900001990-gr4.gif https://s3.amazonaws.com/prod-ucs-content-store-us-east/content/pii:S1381116900001990/gr4/DOWNSAMPLED/image/gif/269c97e5497d89c72b8adbdfe46e49e3/gr4.gif https://s3-eu-west-1.amazonaws.com/prod-ucs-content-store-eu-west/content/pii:S1381116900001990/gr4/DOWNSAMPLED/image/gif/269c97e5497d89c72b8adbdfe46e49e3/gr4.gif gr4 gr4.gif gif 20764 546 263 IMAGE-DOWNSAMPLED 1-s2.0-S1381116900001990-gr5.sml https://s3.amazonaws.com/prod-ucs-content-store-us-east/content/pii:S1381116900001990/gr5/THUMBNAIL/image/gif/d699694c28e3136fde5a836b2a89d090/gr5.sml https://s3-eu-west-1.amazonaws.com/prod-ucs-content-store-eu-west/content/pii:S1381116900001990/gr5/THUMBNAIL/image/gif/d699694c28e3136fde5a836b2a89d090/gr5.sml gr5 gr5.sml sml 1048 93 44 IMAGE-THUMBNAIL 1-s2.0-S1381116900001990-gr5.gif https://s3.amazonaws.com/prod-ucs-content-store-us-east/content/pii:S1381116900001990/gr5/DOWNSAMPLED/image/gif/494c61a6f7a2ead72845520d1b1fef64/gr5.gif https://s3-eu-west-1.amazonaws.com/prod-ucs-content-store-eu-west/content/pii:S1381116900001990/gr5/DOWNSAMPLED/image/gif/494c61a6f7a2ead72845520d1b1fef64/gr5.gif gr5 gr5.gif gif 17596 553 263 IMAGE-DOWNSAMPLED 1-s2.0-S1381116900001990-gr6.sml https://s3.amazonaws.com/prod-ucs-content-store-us-east/content/pii:S1381116900001990/gr6/THUMBNAIL/image/gif/0068c17bac75064591a564eb385d1da4/gr6.sml https://s3-eu-west-1.amazonaws.com/prod-ucs-content-store-eu-west/content/pii:S1381116900001990/gr6/THUMBNAIL/image/gif/0068c17bac75064591a564eb385d1da4/gr6.sml gr6 gr6.sml sml 1804 91 125 IMAGE-THUMBNAIL 1-s2.0-S1381116900001990-gr6.gif https://s3.amazonaws.com/prod-ucs-content-store-us-east/content/pii:S1381116900001990/gr6/DOWNSAMPLED/image/gif/dcb313c893e91c1bfe6c59d8f34094da/gr6.gif https://s3-eu-west-1.amazonaws.com/prod-ucs-content-store-eu-west/content/pii:S1381116900001990/gr6/DOWNSAMPLED/image/gif/dcb313c893e91c1bfe6c59d8f34094da/gr6.gif gr6 gr6.gif gif 6085 219 302 IMAGE-DOWNSAMPLED 1-s2.0-S1381116900001990-gr7.sml https://s3.amazonaws.com/prod-ucs-content-store-us-east/content/pii:S1381116900001990/gr7/THUMBNAIL/image/gif/f228443aafa53ce8f0b53095d699a740/gr7.sml https://s3-eu-west-1.amazonaws.com/prod-ucs-content-store-eu-west/content/pii:S1381116900001990/gr7/THUMBNAIL/image/gif/f228443aafa53ce8f0b53095d699a740/gr7.sml gr7 gr7.sml sml 1026 93 66 IMAGE-THUMBNAIL 1-s2.0-S1381116900001990-gr7.gif https://s3.amazonaws.com/prod-ucs-content-store-us-east/content/pii:S1381116900001990/gr7/DOWNSAMPLED/image/gif/e7c7d427d8207b2d6956029282f269d2/gr7.gif https://s3-eu-west-1.amazonaws.com/prod-ucs-content-store-eu-west/content/pii:S1381116900001990/gr7/DOWNSAMPLED/image/gif/e7c7d427d8207b2d6956029282f269d2/gr7.gif gr7 gr7.gif gif 9392 438 312 IMAGE-DOWNSAMPLED 1-s2.0-S1381116900001990-gr8.sml https://s3.amazonaws.com/prod-ucs-content-store-us-east/content/pii:S1381116900001990/gr8/THUMBNAIL/image/gif/07e832bdb0cc2a5a454cc68ab07d7bae/gr8.sml https://s3-eu-west-1.amazonaws.com/prod-ucs-content-store-eu-west/content/pii:S1381116900001990/gr8/THUMBNAIL/image/gif/07e832bdb0cc2a5a454cc68ab07d7bae/gr8.sml gr8 gr8.sml sml 1308 93 114 IMAGE-THUMBNAIL 1-s2.0-S1381116900001990-gr8.gif https://s3.amazonaws.com/prod-ucs-content-store-us-east/content/pii:S1381116900001990/gr8/DOWNSAMPLED/image/gif/a515455a11b826f52bebd7d4dbca7ef7/gr8.gif https://s3-eu-west-1.amazonaws.com/prod-ucs-content-store-eu-west/content/pii:S1381116900001990/gr8/DOWNSAMPLED/image/gif/a515455a11b826f52bebd7d4dbca7ef7/gr8.gif gr8 gr8.gif gif 4449 227 277 IMAGE-DOWNSAMPLED 1-s2.0-S1381116900001990-fx1.sml https://s3.amazonaws.com/prod-ucs-content-store-us-east/content/pii:S1381116900001990/fx1/THUMBNAIL/image/gif/6bb8f5a3980e544f79faa0f7dde7b468/fx1.sml https://s3-eu-west-1.amazonaws.com/prod-ucs-content-store-eu-west/content/pii:S1381116900001990/fx1/THUMBNAIL/image/gif/6bb8f5a3980e544f79faa0f7dde7b468/fx1.sml fx1 fx1.sml sml 904 43 125 IMAGE-THUMBNAIL 1-s2.0-S1381116900001990-fx1.gif https://s3.amazonaws.com/prod-ucs-content-store-us-east/content/pii:S1381116900001990/fx1/DOWNSAMPLED/image/gif/60a98e901bb42bb65fceca6e63df1326/fx1.gif https://s3-eu-west-1.amazonaws.com/prod-ucs-content-store-eu-west/content/pii:S1381116900001990/fx1/DOWNSAMPLED/image/gif/60a98e901bb42bb65fceca6e63df1326/fx1.gif fx1 fx1.gif gif 1937 79 229 IMAGE-DOWNSAMPLED 1-s2.0-S1381116900001990-fx2.sml https://s3.amazonaws.com/prod-ucs-content-store-us-east/content/pii:S1381116900001990/fx2/THUMBNAIL/image/gif/5691085d6db614b8d82dd14f4ed3ea93/fx2.sml https://s3-eu-west-1.amazonaws.com/prod-ucs-content-store-eu-west/content/pii:S1381116900001990/fx2/THUMBNAIL/image/gif/5691085d6db614b8d82dd14f4ed3ea93/fx2.sml fx2 fx2.sml sml 718 35 125 IMAGE-THUMBNAIL 1-s2.0-S1381116900001990-fx2.gif https://s3.amazonaws.com/prod-ucs-content-store-us-east/content/pii:S1381116900001990/fx2/DOWNSAMPLED/image/gif/24d7bacf19dcb833835fcee433f9137d/fx2.gif https://s3-eu-west-1.amazonaws.com/prod-ucs-content-store-eu-west/content/pii:S1381116900001990/fx2/DOWNSAMPLED/image/gif/24d7bacf19dcb833835fcee433f9137d/fx2.gif fx2 fx2.gif gif 2789 96 339 IMAGE-DOWNSAMPLED 1-s2.0-S1381116900001990-fx3.sml https://s3.amazonaws.com/prod-ucs-content-store-us-east/content/pii:S1381116900001990/fx3/THUMBNAIL/image/gif/6cc70dabc771fa31c65b4a045c745c1d/fx3.sml https://s3-eu-west-1.amazonaws.com/prod-ucs-content-store-eu-west/content/pii:S1381116900001990/fx3/THUMBNAIL/image/gif/6cc70dabc771fa31c65b4a045c745c1d/fx3.sml fx3 fx3.sml sml 519 17 125 IMAGE-THUMBNAIL 1-s2.0-S1381116900001990-fx3.gif https://s3.amazonaws.com/prod-ucs-content-store-us-east/content/pii:S1381116900001990/fx3/DOWNSAMPLED/image/gif/c4fc454c4845ca843fbd4bc633ca38a9/fx3.gif https://s3-eu-west-1.amazonaws.com/prod-ucs-content-store-eu-west/content/pii:S1381116900001990/fx3/DOWNSAMPLED/image/gif/c4fc454c4845ca843fbd4bc633ca38a9/fx3.gif fx3 fx3.gif gif 2078 45 339 IMAGE-DOWNSAMPLED MOLCAA 2721 S1381-1169(00)00199-0 10.1016/S1381-1169(00)00199-0 Elsevier Science B.V. Fig. 1 TPR profile of the Cu/SiO2 catalyst. Fig. 2 Conversion of benzaldehyde with time on stream at 350°C under H2 flow for the supported copper catalysts. Pre-treatment: H2/350°C. Fig. 3 Steady-state conversion of benzaldehyde under H2 flow as a function of the reaction temperature for: (a) Cu/SiO2 and Cu/γ-Al2O3; (b) Cu/TiO2, Cu/ZrO2 and Cu/CeO2. Pre-treatment: H2/350°C. Fig. 4 Steady-state selectivity to toluene under H2 flow as a function of the reaction temperature for: (a) Cu/SiO2 and Cu/γ-Al2O3; (b) Cu/TiO2, Cu/ZrO2 and Cu/CeO2. Pre-treatment: H2/350°C. Fig. 5 Steady-state selectivity to benzene under H2 flow as a function of the reaction temperature for: (a) Cu/SiO2 and Cu/γ-Al2O3; (b) Cu/TiO2, Cu/ZrO2 and Cu/CeO2. Pre-treatment: H2/350°C. Fig. 6 Conversion of benzaldehyde with time on stream at 100°C under H2 flow for the Cu/SiO2 catalyst. Pre-treatment: H2/350°C. Fig. 7 Conversion of benzaldehyde with time on stream at 100°C and 350°C under N2 flow for the Cu/ZrO2 and Cu/CeO2 catalysts. Pre-treatment: N2/350°C. Fig. 8 Conversion of benzaldehyde with time on stream at 100°C or 350°C under N2 flow for the Cu/SiO2 catalyst. Pre-treatment: H2/350°C. Table 1 BET surface area and reducibility of the copper catalysts Catalyst Cu/SiO2 Cu/γ-Al2O3 Cu/TiO2 Cu/ZrO2 Cu/CeO2 % Cu (w/w) 7.4 7.9 7.4 8.1 9.2 Support origin Fluka Fluka Merck Merck Labosi Support BET surface area (m2 g−1) 200.0 72.0 80.0 50.0 100.0 Catalyst BET surface area (m2 g−1) 162.0 52.2 53.0 38.0 35.5 T°C of peak of reduction 260 (40%) a 360 (60%) 350 (95%) 420 (5%) 370 (100%) 330 (40%) 380 (60%) 350 (99%) 490 (1%) % of reduction 73.7 100 59.3 81.3 62.3 a Proportion of the surface area of the temperature peak. Table 2 Steady-state benzene yield in the reduction of benzaldehyde under N2 or H2 flow over the copper catalysts Catalyst Reaction PhCHO/N2/350°C Reaction PhCHO/H2/350°C Pre-treatment Pre-treatment N2/350°C (%) H2/350°C (%) H2/350°C (%) Cu/SiO2 12.5 51.0 8.0 Cu/γ-Al2O3 28.8 88.0 64.8 Cu/TiO2 18.4 24.0 3.4 Cu/ZrO2 28.4 40.0 3.4 Cu/CeO2 10.1 39.0 49.6 Gas phase hydrogenation of benzaldehyde over supported copper catalysts A Saadi a Z Rassoul a M.M Bettahar b * a Laboratoire de Chimie du Gaz Naturel, Institut de Chimie, USTHB, BP32 El-Alia, 16111 Bab-Ezzouar, Algeria b Laboratoire de Catalyse Hétérogène, UMR-CNRS 7565, Université Henri Poincaré, Nancy-I, Faculté des Sciences, BP 239, 54506, Vandoeuvre-lès-Nancy Cedex, France * Corresponding author. Tel.: +33-3-83-912066 ext. 3125; fax: +33-3-83-912181 Benzaldehyde hydrogenation over copper catalysts supported on Al2O3, SiO2, TiO2, CeO2 and ZrO2 has been studied at atmospheric pressure and 100–350°C. The reaction competitively produced benzylalcohol, toluene and benzene with yields depending on the nature of the support and reaction temperature. The obtained order of activity was attributed to metal and acid–base surface properties. The important gap in activity (multiplied by 2 to 23) between 300°C and 350°C, observed for all catalysts except Cu/SiO2, was attributed to an adsorption phenomenon, i.e. base sites or low reaction temperature inhibited the reaction course, whereas acidic sites or high reaction temperature enhanced the catalyst activity. Benzylalcohol was obtained with high selectivity (83% at 68% of conversion) from only 100°C with the SiO2 acidic support, whereas selective formation of toluene or benzene was observed at higher reaction temperature and depended on the nature of the support. The relative selectivity of toluene and benzylalcohol was governed by the adsorption strength the alcohol OH function on the catalyst surface. High selectivity to benzene was attributed to the easiness of the catalyst to break the CH aldehydic bond and stability of the surface organic entity formed. The parallel study of the reduction of benzaldehyde under N2 flow threw some light on the relation between metal and acid–base surface properties of the catalysts and reaction paths in benzaldehyde hydrogenation. Keywords Copper Catalysts Supports Benzaldehyde Hydrogenation 1 Introduction The selective hydrogenation of unsaturated carbonyl compounds has recently received a growing interest since it is an important step in the preparation of fine chemicals [1–6]. It was found in liquid phase that, in general, aldehydes are more reactive than ketones, which in turn were more reactive than olefins and a phenyl substituent activated both CO and CC bond hydrogenation [7–9]. On the other hand, copper-based catalysts, mainly copper chromite, are known to preferentially hydrogenate the carbonyl group [7–10]. In the hydrogenation of aromatic compounds, the benzene ring and the carbonyl group should be hydrogenated but hydrogenolysis should also compete with hydrogenation [4–6]. The obtained selectivities mainly depended on the nature of the catalyst [4,5,11–13]. Until recently, the studies on the selective hydrogenation of benzaldehyde to benzyl alcohol have been largely devoted to the liquid phase system [7,10,14–21], whereas relatively few studies have been reported for the gas phase system [4–6]. In the latter case, metal [4,5] and metal oxide [6] catalysts were used. The hydrogenation of benzaldehyde over Pt catalysts supported on TiO2, Al2O3 and SiO2 in the range temperature of 60–220°C was reported [4]. No hydrogenation of the aromatic ring was found for Pt/TiO2 but an important metal-support interaction and a high temperature H2 pre-treatment effect, which enhanced both conversion and selectivity to benzylalcohol. These performances were attributed to special sites formed at the interface of platinum and titania phases, which activate CO bond hydrogenation [4]. It was shown that benzene and toluene by-products were formed directly from benzaldehyde and benzylalcohol, respectively, and a Langmuir–Hinshelwood model, with the addition of the second hydrogen atom as rate determining step, fits the data satisfactorily. The hydrogenation of benzaldehyde and o-tolualdehyde to the corresponding alcohols was studied over Ni/SiO2 in the temperature range of 110–300°C [4]. No ring hydrogenation was detected and the by-products arose from the direct hydrogenolysis of the aryl–carbonyl CC bond [5]. As to metal oxides as catalysts, one of us have shown that their catalytic properties in the hydrogenation of benzaldehyde to benzyl alcohol depends on their reducibility and, also, on their surface acid–base properties [6]. Toluene and benzene by-products arose from benzylalcohol and benzaldehyde hydrogenolysis, respectively [6]. According to the above data, one can expect changes in the metal active phase properties by interaction with the support. Also, we have undertaken the study of the hydrogenation properties of 10% copper catalysts impregnated on Al2O3, SiO2, TiO2, ZrO2 and CeO2 supports: Al2O3 and SiO2 are both irreducible oxides and, also, amphoteric and weakly acidic, respectively; TiO2, ZrO2 and CeO2 are reducible oxides and, in addition, behave as acidic or basic oxides [6]. In the present paper, we report the results obtained in the hydrogenation of benzaldehyde over the copper catalysts at atmospheric pressure in the reaction temperature range of 100–350°C. The catalysts activity was related to their reducibility and acid–base properties as determined by TPR measurements and behaviour in the reduction of benzaldehyde under N2 flow [6]. 2 Experimental 2.1 Catalysts preparation, BET surface area, reducibility The catalysts were prepared by impregnation of an aqueous suspension of the support by copper nitrate, then evaporating the solvent at 80°C and drying at the same temperature for 12 h. The obtained precursors were calcined in air for 3 h. All the supports were commercial materials (Table 1) and calcined for 2 h at 500°C in air before impregnation. The specific area measurements were performed by the classical BET method on a Coultronics 2100 E device using N2 asprobemolecule. The reducibility experiments were carried out on a pulse chromatographic reactor. The sample (0.3 g) was dried at 150°C for 2 h in argon (99.95%, Air Liquide) and then cooled to room temperature under argon flow. The flow was then switched to hydrogen (99.995%, Air Liquide) and the sample heated up to 500°C at a rate of 4°C min−1. The degree of reduction of copper was calculated assuming its oxidation state was +2 after calcination. 2.2 Catalytic testings Benzaldehyde (Aldrich, 99.98%) was degassed under nitrogen purge before use. H2 and N2 (Air Liquide) were passed through Supelco molecular sieve traps and Oxytraps (Altech). The catalytic performances were carried out in a fixed-bed glass tubular reactor with 0.2 g samples at atmospheric pressure and the total flow rate was 50 cm3 min−1. The reactant gas feed consisted of 3.2 Torr of benzaldehyde and 250 Torr of H2 diluted in N2. Gaseous benzaldehyde was obtained by bubbling N2 in liquid benzaldehyde maintained at constant temperature (50°C) in a suitable saturator. Before testing, the catalysts were in situ reduced for 2 h at 350°C in a current of H2 with a flow rate of 20 cm3 min−1. The gaseous reactant and products were heated upstream and outstream in order to avoid their condensation and analyzed on line by a FID gas chromatograph (Delsi IGC 121 ML) equipped with a carbosieve column. Each reaction temperature was maintained constant until the corresponding steady-state was reached as indicated by the gas chromatograph analysis of the exit gas samples. For each catalyst the reaction temperature was changed in a crossing order: 350°C, 150°C, 250°C, 100°C, 300°C. An ascending order did not sensibly modify the obtained steady-state activities. Varying the flow rate in the range from 10 to 80 cm3 min−1 showed that no mass transfer limitations occurred when the sample weight was ≤0.2 g. 3 Results 3.1 Catalysts characterization The BET surface area and reducibility properties of the catalysts are reported in Table 1. The specific area of the catalysts increased with that of the corresponding supports and were in the range of 38–162 m2 g−1. However, this range of specific area is lower than that of the supports (72–200 m2 g−1), that is, the support lost from 20% to 60% of its area after impregnation of the copper phase. During the impregnation stage of the preparation, surface hydroxyl groups (OHsurf) of the support were consumed by reaction with the active phase precursor. Such a surface reaction may have caused the decrease of available surface area of the support, probably by closure of the pores. In other respects, the XRD spectra showed the characteristic bands of the copper phase and support [22]. The pattern for the supports was that of crystallized materials with well-defined bands except for the amorphous SiO2 support. The copper phase consisted of small particles with a mean size of about 4–5 nm (for the Cu/SiO2 and Cu/Al2O3 catalysts) and 7–10 nm (for the Cu/TiO2, Cu/ZrO2 and Cu/CeO2 catalysts). In addition, for the Cu/ZrO2 catalyst, STEM experiments showed small metal copper particles, well dispersed both on the surface (mean size of about 15 nm) and in the bulk (mean size of about 8 nm) of the solid [22]. Under H2 atmosphere, the supported CuO phase was reduced to two steps as illustrated in Fig. 1 , except for the Cu/TiO2 catalyst for which only one step was observed. The reduction was uncomplete (60–80%), except for the Cu/Al2O3 catalyst (Table 1). The first peak of reduction should correspond to isolated and easily reducible CuO particles, whereas the second peak should correspond to larger CuO particles or/and CuO particles more strongly interacting with the support. These assumptions are in good accordance with the STEM experiments in the case of the Cu/ZrO2 catalyst [22]. The uncomplete reduction of the catalysts should also be explained by the existence of copper particles strongly bounded to the support. 3.2 Catalytic activity 3.2.1 Hydrogenation of benzaldehyde The bare oxides were almost all inactive in benzaldehyde hydrogenation in the whole range of reaction temperature: only a very little activity (conversion of about 5%) and at high reaction temperature (350°C) was found in the case of the reducible TiO2, ZrO2 and CeO2 bare oxides. Toluene and benzene were formed in the latter case. Much higher conversions were obtained in the presence of copper, notably at 350°C, indicating that the latter is the main component of the active site. The copper catalysts exhibited initial deactivation before the steady-state was established and the degree (10–30%) and duration (1–3 h) of deactivation depended on the nature of the support and reaction temperature. Fig. 2 reports activity results with time on stream at 350°C. It can be noted in this figure that no initial deactivation occurred at 350°C for the Cu/SiO2 and Cu/Al2O3 catalysts but, for the latter, a drop of conversion from 100% to 60% is observed after about a 4-h work. The decrease of activity is attributable to poisoning by carbonaceous overlayer since the activity was almost totally recovered after regeneration by calcination then re-reduction. 3.2.1.1 Activity The steady-state conversion increased with the reaction temperature for all catalysts (Fig. 3) . The level and order of conversions depended on both the reaction temperature and nature of the support. The Cu/SiO2 catalyst showed high activity from 100°C (68.2% of conversion), whereas the other catalysts began to be active only from 150°C (<5% of conversion). On the other hand, the maximum of conversion was very high (100%) for the Cu/SiO2 and Cu/Al2O3 catalysts, whereas it reached lower values (11.2–61.1%) for the other catalysts. The highest activity was observed at 250°C for Cu/SiO2 and 350°C for the other catalysts. On the other hand, strikingly, a gap of activity was observed between 300°C and 350°C in the case of the Al2O3 supported catalyst, the conversion of which was multiplied by 23 (Fig. 3a). Although to a lesser extent, a similar behaviour was also observed for the reducible supports: in the same range of temperature, the activity was multiplied by 5.4 for TiO2 and about 2 for CeO2 and ZrO2 (Fig. 3b). For the SiO2-supported catalyst the conversion increased gradually in the whole range of reaction temperature (Fig. 3a). 3.2.1.2 Selectivity The reaction products were benzyl alcohol, toluene and benzene. No aromatic ring hydrogenation was observed. ⋅ Benzyl alcohol was produced only on the Cu/SiO2 catalyst and at the reaction temperature of 100°C (83.5% selectivity at 68.2% of conversion). No benzyl alcohol (or only traces as for Cu/CeO2) was observed for the other catalysts, whatever the reaction temperature. ⋅ High selectivity to toluene (>90%) was observed for the Cu/SiO2, Cu/CeO2 and Cu/TiO2 catalysts, whereas, the Cu/Al2O3 and Cu/ZrO2 catalysts exhibited lower selectivity values (<70%) (Fig. 4) . The maximum of selectivity to toluene appeared at low reaction temperature for Cu/SiO2, Cu/Al2O3 and Cu/CeO2 (≤250°C) but at higher reaction temperature for Cu/TiO2 and Cu/ZrO2 (350°C). ⋅ The most selective catalyst to benzene was Cu/TiO2 (100% at 150°C), whereas the least selective was Cu/SiO2, even at a high reaction temperature (<10% at 350°C) (Fig. 5) . In contrast to toluene, the selectivity to benzene increased with the reaction temperature for the Cu/SiO2, Cu/Al2O3 and Cu/CeO2 catalysts but decreased in the case of the Cu/TiO2 and Cu/ZrO2 catalysts (Fig. 5). The maximum of benzene selectivity was obtained at a high reaction temperature (350°C) for Cu/SiO2 (8.0%), Cu/Al2O3 (64.8%) and Cu/CeO2 (90.3%), and at lower temperature (150°C) for Cu/TiO2 (100%) and Cu/ZrO2 (65.9%) (Fig. 5). ⋅ It is worth to note that, during the steady-state setting-up of the Cu/SiO2 catalyst, toluene was formed as primary product and benzylalcohol as secondary product (Fig. 6) . Benzene also arose as primary product, which disappeared after the steady-state activity was reached. 3.2.2 Reduction of benzaldehyde under N2 flow Under N2 flow, benzaldehyde was reduced stoichiometrically to benzylalcohol (100% of selectivity) at 100°C and catalytically to benzene (100% of selectivity) at 350°C (Figs. 7 and 8 ; Table 2 ). Carbon monoxide was co-produced with benzene. The observed reaction path depended on the nature of the catalyst or pre-treatment and reaction temperature. Benzylalcohol appeared only with the Cu/CeO2 and Cu/ZrO2 catalysts (initial conversion of 3.4% or 1.2%, respectively; Fig. 7) pre-treated under N2 flow or the Cu/SiO2 catalyst (initial conversion of 38%; Fig. 8) pre-treated under H2 flow. In contrast, benzene was produced with all the catalysts (Table 2) and the yield was higher when the pre-treatment was H2 (up to 88%) than N2 (up 28.8%) flow. For the catalysts supported on the irreducible oxides, alumina gave better conversion (28.8% or 88.8% as compared to 12.5% or 51.0%) whatever the pre-treatment, whereas, the order of activity depended on the pre-treatment for the reducible supports: Cu/ZrO 2>Cu/TiO 2>Cu/CeO 2 N 2 flowpre-treatment Cu/ZrO 2>Cu/CeO 2>Cu/TiO 2 H 2 flowpre-treatment The latter order is different from that observed in benzene yield in benzaldehyde hydrogenation at the same reaction temperature (Table 2). 4 Discussion In the discussion of the results of benzaldehyde hydrogenation, we have to bear in mind the nature of both the copper active site and organic molecules. It is now well recognized that the active site in copper catalyzed hydrogenation reactions is the association of copper(I) in an octahedral environment with hydride ion [9,23–28]. The ionic character of this site explains its strong reactivity toward the highly polarized CO double bond of carbonyl compounds [7–9,23–30] but also with the CO simple bond of the alcohol product [4,24,30] and, as a consequence, the competitive adsorption between the reactant and product. In turn, this competitive adsorption should influence the reaction yields and lead to secondary reactions of the alcohol product [4–6,24,30]. On the other hand, aldehydes are known as reductants through hydride release [30], then benzaldehyde should decompose to benzene [4–6,31]. In addition, all these paths should be accelerated or inhibited according to the nature of the support and reaction conditions. The support may both modify the electronic structure of the copper active site and play an important role in the adsorption and desorption of the reactant and product molecules. Let us then discuss in more detail the obtained results in this study. We first consider the results obtained in the reduction of benzaldehyde under N2 flow because they give useful information on the acid–base and reducibility properties of the catalysts. 4.1 Reduction of benzaldehyde under N2 flow 4.1.1 Reaction at 100°C. Formation of benzylalcohol (i) After N2 pre-treatment, only benzylalcohol was obtained as a result of the Cannizzaro reaction for the Cu/ZrO2 and Cu/CeO2 catalysts [6]. This reaction stoichiometrically consumes surface OHsurf groups then ends up (Fig. 7). It concomitantly forms benzyl alcohol and benzoate surface species (PhCOOsurf) and the overall process should be written as follows: PhCHO g +OH surf ⇄PhCHOO surf → PhCHO g PhCOO surf +PhCH 2 OH g In this process, the pre-equilibrium step is probably rate limiting, then it follows that the obtained results reflect the surface mobility (or nucleophilicity) or concentration order of the OHsurf groups in the case of the oxidized catalysts, that is: Cu/CeO 2>Cu/ZrO 2≫Cu/TiO 2=Cu/Al 2 O 3=Cu/SiO 2≅0 Moreover, the Cannizzaro reaction probably mainly proceeded through the support surface. Indeed, we have shown elsewhere [32], that, in the same reaction conditions, the bare CeO2 support was much more active (25.0% of conversion) than the corresponding copper catalyst (3.4% of conversion, Table 2). Although less marked, similar behaviour was observed for the bare ZrO2 support (2.0% of conversion instead of 1.2%). As to other bare TiO2, Al2O3, SiO2 supports, they were totally inactive [32] as were the corresponding copper catalysts (Table 2). It may be concluded that the oxidized supported copper catalysts contained lesser amount of active OHsurf groups than the bare supports. By the way, a similar decrease in active OHsurf groups concentration should have occurred during the impregnation step of the catalyst preparation, probably by reaction between these groups and the copper precursor, thus leading to the decrease of the BET specific area as reported above (Table 1). (ii) Benzylalcohol obtained after H2 pre-treatment for the Cu/SiO2 catalyst was probably a result of hydrogen spillover. This behaviour is in good agreement with the reducibility (Table 1) and hydrogenation activity results (Fig. 3): the reduced copper phase was shown to be active from 100°C only on the silica support (see also discussion below). Further, the lack of activity in the case of the Cu/ZrO2 and Cu/CeO2 catalysts in the reduced state should indicate that the surface OH groups, active in the Cannizzaro reaction (Fig. 7), have been removed by the H2 pre-treatment [6]. 4.1.2 Reaction at 350°C. Formation of benzene Benzaldehyde is known to dissociatively adsorb as benzoate species on basic oxides at room temperature [6,33] and subsequent heating leads to the decomposition of these species into benzene and CO2 [6,33–35]. The mechanism is believed to be an oxido-reduction process where the metal oxide surface (denoted MOMsurf) is reduced by gaseous benzaldehyde [6,34]: PhCHO g ⇆ MOM surf [PhCOOM surf +MH surf ] → −MOM surf PhH g +CO 2g to metal benzoate (denoted PhCOOMsurf) and hydride (denoted MHsurf) surface species. This step, corresponding to the CH bond breaking, is probably rate limiting. The formation of the benzoate species should proceed either in one single step or through that of the ketal-like intermediate (PhCHOOM surf) [6,35]. (i) A similar mechanism should proceed in the case of our unreduced (pre-treated under N2 flow) copper catalysts at the reaction temperature of 350°C. Copper is probably involved in such a mechanism since, in the absence of copper, the bare support oxides were almost inactive in the same reaction conditions [32]. Besides, copper is known for a long time ago as an efficient catalyst for the decarboxylation of benzoate salts in liquid medium [36]. Moreover, it has been shown that the actual catalyst is cuprous ion and the intermediate the cuprous salt of the aromatic acid [PhCOOCu(I)] [36]. Also, as far as reaction mechanisms in liquid medium hold for gas phase reactions and if one supposes that reduced copper is formed during the thermal pre-treatment or the setting of the steady-state, copper benzoate species (PhCOOCusurf) may have been the reaction intermediate in the reduction of benzaldehyde to benzene on the present supported copper catalysts. In such a case, the oxygenate species, formed on the support, migrated on copper where it was subsequently reduced to benzene. Similar surface processes are often invoked in the case of oxygenate species evidenced on supported copper catalysts during the reduction of the carbon oxides [37,38]. (ii) The above mechanism should also hold for the reduced (pre-treatment under H2 flow) catalysts. The increase in benzene yield after the reductive pre-treatment should be attributed to the increase of the amount of reduced active phase (Table 2). However, change in the reaction path on the reduced as compared to the unreduced copper phase have to be considered. Thus, the decomposition of benzaldehyde into benzene, over reduced copper particles instead of acid–base sites, is not excluded. The reaction intermediate should be the copper benzoyl surface species: PhCHO g ⇆ 2Cu surf [PhCOCu surf +CuH surf ] → −2Cu surf PhH g +CO g A similar entity, the carbonyl surface species, has also been invoked in the case of supported copper catalysts during the reduction of the carbon monoxide [37]. In any case, such a mechanism should be suitable in the case of copper supported on the acidic SiO2 support on which the benzoate surface entity is less likely to form. 4.2 Hydrogenation of benzaldehyde 4.2.1 Activity 4.2.1.1 Copper supported on SiO2 and Al2O3 irreducible supports According to the TPR results (Table 1), the high activity of Cu/SiO2 as compared to that of Cu/Al2O3 may be related to its better reducibility. Indeed, the first peak of reduction of Cu/SiO2 arose at 260°C, whereas, it appeared at 350°C only for Cu/Al2O3. However, the sudden increase of the conversion (from 5% to 100%) observed for the latter between 300°C and 350°C (Fig. 3) suggests that, besides reducibility properties, support acid–base properties of the catalysts should also be involved. In such a case, the activity of Cu/Al2O3 should be governed by the adsorption strength of the reactant or product molecules, as surface benzoate or alcoholate species [6,33–35], on acid–base sites of the support. The inhibiting effect of stable surface oxygenated products has indeed been invoked for the hydrogenation of conjugated carbonyl compounds on copper-based catalysts [7–9,24,29,30,35,36]. Benzoate or alcoholate species formation was also invoked during the hydrogenation of benzaldehyde over copper catalysts supported on chromium oxide [8,9,23,24]. In addition, the IRTF study of the adsorption of benzaldehyde over metal oxides [35] strengthens the hypothesis of the intervention of the acid–base properties of the SiO2 or Al2O3 supports in the case of copper catalysts. Indeed, the study [35] showed that the adsorption of benzaldehyde on silica occurs through a hydrogen bond of the oxygen atom of the CO group to the surface silanol groups, whereas, for the rather basic alumina, it involves a nucleophilic attack at the carbonyl center by surface oxygen (or hydroxyl), producing surface benzoate species [36]. These species were stable up to 300°C even under hydrogen atmosphere [35]. Also, for the present alumina supported copper catalyst, intermediate oxygenated surface species formed should have acted as inhibiting entities, maintaining low activity up to 300°C. At higher reaction temperatures, these species readily decomposed, whereas, the metallic copper sites became more active, thus explaining why an important gap in conversion of benzaldehyde was observed (Fig. 3). For the Cu/SiO2 catalyst, no or little base sites were available for strong adsorption of the reactant or product molecules; then no inhibition of the reaction course was detected. 4.2.1.2 Copper catalysts supported on TiO2, ZrO2 and CeO2 reducible oxides The Cu/ZrO2 catalyst exhibited the lowest activity in the whole range of reaction temperature (Fig. 3). This behaviour may be explained by a strong metal–support interaction, which led to the insertion of part of the copper phase in the bulk [22] and, consequently, lowered the catalytic activity. Similar interaction may also exist for the Cu/TiO2 and Cu/CeO2 catalysts. In other respects, as suggested above for Cu/Al2O3, the gap of activity observed between 300°C and 350°C (Fig. 3) should also involve acid–base and not only metal properties of the copper catalysts supported on the reducible oxides. Further studies are needed to describe in more detail the involved chemical processes. 4.2.2 Selectivity The fact that the aromatic nucleus is unreactive while the carbonyl substituent undergoes hydrogenation and hydrogenolysis suggests that the aromatic aldehyde reacts principally with the catalyst via the carbonyl function. It should be assumed that in the adsorbed benzaldehyde both the aromatic ring and the carbonyl group lie parallel to the active surface [5]. In such a case, the adsorbed hydrogen preferably attack the carbonyl group due to energy barriers [2,5,8]. 4.2.2.1 Benzylalcohol selectivity Benzylalcohol was produced with high selectivity at high conversion on copper supported on the acidic SiO2 support only (Fig. 6). This support favoured the reduction of the carbonyl compound to the corresponding alcohol, even at high conversion, probably mainly through the inhibition of the adsorption of the benzylalcohol reaction product [4]. As to the chemical process of benzylalcohol formation, it can be supposed to be a 1–2 nucleophilic addition, with a high polarization of the transition state, as in the case of the hydrogenation of conjugated carbonyl compounds [2,7–9,23,24]: PhCHO g +CuH surf →[PhCH 2 OCu surf ] → H 2g PhCH 2 OH g +CuH surf For the other more basic catalysts, no benzylalcohol was detected in the exit gas (Fig. 4) probably because, more strongly held on the catalyst surface, it was subsequently chemically converted before desorption. 4.2.2.2 Toluene selectivity It is generally believed that toluene is the product of the consecutive reaction of hydrogenolysis of benzylalcohol [2–8]. Indeed, flowing the Cu/SiO2 catalyst with benzylalcohol instead of benzaldehyde, selectively led to toluene production. However, benzylalcohol is a complex molecule possessing several active centers such as the acidic proton and basic oxygen of the OH function and the reductive hydrogen of the CH exocyclic function. All these centers may interact with the copper or support phase or dihydrogen molecule. Also several pathways can be envisaged for toluene formation from benzylalcohol. (i) It has been reported that mixed copper oxides such as CuCrO [9,23], CuZrO [39], CuZnO [39–42] are hydrogen reservoirs and the occluded hydrogen postulated to be of hydridic nature [9,23,26,39]. On the other hand, the hydrogenolysis of allylalcohol to the corresponding hydrocarbon was studied on copper supported on chromium oxide and it was shown that the CrH but not the CuH species was the active site [8,9]. The chromium ion was suggested to play the role of strong Lewis acid site interacting with the oxygen atom of the alcohol molecule and the mechanism postulated to be concerted [8,9]. Then, we think that the present oxide supports, except perhaps SiO2 (see below), formed metal hydride as active species for the reduction of benzylalcohol to toluene: In other words, the active site should be bifunctional in nature on which the metal cation and hydride entities interacted with the oxygen and carbon atoms of the alcohol molecule, respectively. In such a case, the activity in toluene should reflect the aptitude of the support oxide to both adsorb the alcohol (Lewis acid property) and dissociate H2 (metal property). This conclusion may hold for the TiO2, ZrO2 and CeO2 reducible oxides, which are more prone to form metal hydride species. (ii) The copper mixed oxide CuAlO has also been shown to be reservoir of occluded hydrogen of hydridic nature [26]. Also, the above mechanism can be postulated for the formation of toluene from benzylalcohol in the case of copper supported on the Al2O3 irreducible oxide. (iii) In the case of the Cu/SiO2 catalyst, no CuSiO mixed metal oxides were reported, to our best knowledge. On the other hand, we have above reported that benzaldehyde adsorption resulted in the interaction between its oxygen atom and the hydrogen atom of the silanol groups [35]. Also, one is allowed to think that toluene formation probably resulted in the protonation of the alcohol function on a silanol Brönsted acid site (HOSisurf) followed by the hydrogenolysis of the protonated specie on an adjacent copper site: (iv) We have shown that, strikingly, toluene appeared as a primary product over the Cu/SiO2 catalyst at 100°C (Fig. 5). The formation of toluene as primary product and at a so low reaction temperature, suggests the existence of another reaction path than that described above. This path probably involves very active sites on which toluene quickly formed in the early stages of the reaction where the partial pressure of both reactants and products were low (time≅0; Fig. 5). These sites were then poisoned at higher conversion (time>100 min; Fig. 5) by the one or the other reactant molecule, even water. The possible route should be the benzylalcohol dismutation to toluene, benzaldehyde and water on the silica support [43–45]: The reaction probably proceeds through hydride transfer between two adsorbed benzylalcohol molecules over specific acid–base sites of the support [43,44]. These sites should be poisoned with time on stream. Such a mechanism was reported for benzylalcohol dismutation to toluene over alumina catalyst [44]. The catalyst was shown to deactivate by prolonged usage or by water addition [44]. 4.2.2.3 Benzene selectivity In the catalytic hydrogenation of benzaldehyde, benzene is believed to be the product of the hydrogenolysis of the external CC bond of benzaldehyde [4,5]. Gas phase kinetic studies of benzaldehyde over platinum [4] or nickel [5] catalysts showed that benzene was produced directly from the reactant molecule and not from the alcohol or toluene intermediates. Carbon monoxide was identified as co-product of benzene [4]. However, no mechanistic route has been proposed for the reaction. As to copper catalysts, no studies have been reported on the hydrogenolysis of benzaldehyde to benzene. Moreover, it has been reported that this reaction not occurs on copper catalysts [20]. In the present case, benzene is formed in benzaldehyde hydrogenation on copper catalysts (Fig. 5). The above discussion suggests that the reaction path to benzene involves the intervention of an oxygenate surface precursor, the stability of which depends on the nature of the support and reaction temperature [6,32–34]. It is worth to note that, at the reaction temperature of 350°C, the benzene yield was higher in the absence (24.0–88.0%) than in the presence (3.4–49.6%) of H2 (Table 2). These results may be attributed to the competitive formation of toluene under H2 flow (Fig. 4). However, other factors such as the presence of water molecules formed in the reactive atmosphere or the nature of the H2 reductant should also play a role in the observed yields. In the same way, for the Cu/ZrO2 catalyst, the conversion of benzaldehyde was more important in the absence (40%; Table 2) than in the presence (11.2%; Fig. 3) of H2. In this case, the presence H2 in the reactive atmosphere seemed to inhibit the active sites of benzene formation. These facts show that other investigations are necessary to get more insight on the mechanism of reduction of benzaldehyde to benzene on supported copper catalysts. 5 Conclusions The hydrogenation of benzaldehyde over copper catalysts supported on Al2O3, SiO2, TiO2, ZrO2 and CeO2 at atmospheric pressure and 100–350°C produced competitively benzylalcohol, toluene and benzene with yields depending on the nature of the support and the reaction temperature. The order of activity was attributed to both metal and acid–base properties of the catalysts. The latter properties induced adsorption phenomena which, for example, explained the important gap in activity (multiplied by 2 to 23) between 300°C and 350°C observed for all catalysts except Cu/SiO2: the lower the reaction temperature the strongly held were the benzaldehyde or benzylalcohol molecules the stronger was the inhibiting effect of the support on the reaction course; conversely, the higher the reaction temperature the lower the adsorption effect the higher the conversion of benzaldehyde. In connection, benzylalcohol was selectively obtained (83% at 68% of conversion) at 100°C with the copper catalyst supported on the acidic SiO2 oxide. Toluene product arose from the hydrogenolysis of benzylalcohol on probably bifunctional sites involving metal hydride species. As to benzene, it resulted from benzaldehyde hydrogenolysis, probably through a copper surface oxygenate specie. Useful information on the surface properties of the catalysts and the reaction course were given by comparing the transformations of benzaldehyde under H2 or N2 atmosphere. References [1] P. Gallezot, A. Giroir-Fender, D. Richard, in: W. Pascoe (Ed.), Catalysis of Organic Reactions, Marcel Dekker, New York, 1991, p. 1. [2] A Chambers S.D Jackson D Stirling G Webb J. Catal. 168 1997 301 [3] T.B.L.W Marinell V Ponec J. Catal. 156 1995 59 [4] M.A Vannice D Poondi J. Catal. 169 1997 166 [5] M.A Keane Appl. Catal., A 118 1997 261 [6] D Haffad U Kameswari M.M Bettahar A Chambellan J.C Lavalley J. Catal. 172 1997 85 [7] J Jenck J.E Germain J.Catal. 65 1980 141 [8] R Hubault J.P Bonnelle J. Mol. Catal. 55 1989 170 [9] R Hubault M Daage J.P Bonnelle Appl. Catal. 22 1986 231 [10] D Nightingale H.D Radford J. Am. Chem. Soc. 71 1949 1089 [11] M. Fiefelder, Practical Catalytic Hydrogenation, Wiley-Interscience, New York, 1971. [12] P.N. Rylander, Catalytic Hydrogenation in Organic Synthesis, Academic Press, London, 1979. [13] P.N. Rylander, Hydrogenation Methods, Academic Press, London, 1985. [14] H Adkins H.R Billica J. Am. Chem. Soc. 70 1948 695 [15] W.H Carothers R Adams J. Am. Chem. Soc. 46 1924 1675 [16] R Menschke W.H Hartung J. Org. Chem. 25 1960 [17] R Baltzly J. Org. Chem. 41 1976 928 [18] W.H. Carothers, R. Adams, J. Am. Chem. Soc., 47 51925° 1047. [19] S Paganelli U Matteoti A Scrivanti C Botteghi J. Organomet. Chem. 397 1990 375 [20] J.A Schreifels P.C Maybury W.E Swartz J. Org. Chem. 46 1981 1263 [21] M. Herskowitz, in: M. Guisnet (Ed.), Heterogeneous Catalysis and Fine Chemicals, Elsevier, Amsterdam, 1991, p. 105. [22] A. Saadi, Z. Rassoul, M.M. Bettahar, J. Barrault, in preparation. [23] L Jalowiecki G Wrobel M Daage J.P Bonnelle Appl. Catal. 107 1987 375 [24] R Bechara G Wrobel M Daage J.P Bonnelle Appl. Catal. 16 1985 15 [25] M Daage J.P Bonnelle Appl. Catal. 16 1985 355 [26] F Bali G Wröbel L Jalowiecki J Bonnelle M.M Bettahar New J. Chem. 11 1987 715 720 [27] S Siegel J. Catal. 30 1973 139 [28] M Amara M.M Bettahar L Gingembre D Olivier Appl. Catal. 35 1987 153 [29] R. Hubault, J.P. Bonnelle, in: M. Guisnet (Ed.), Heterogeneous Catalysis and Fine Chemicals, Elsevier, Amsterdam, 1991, p. 287. [30] R Hubaut React. Kinet. Catal. Lett. 46 1992 25 [31] J. March, Advanced Organic Chemistry, Int. Stud. edn., McGraw-Hill, Tokyo, 1997. [32] A. Saadi, Z. Rassoul, M.M. Bettahar, in preparation. [33] S.T King E.J Strojny J. Catal. 76 1982 274 [34] M Coudurier G Wieker-Coudurier C Naccache B Vital-Mathieu Bull. Soc. Chim. Fr. 4 1969 1121 [35] C.A Koustal P.A.J.M Angeware V Ponec J. Catal. 143 1993 573 [36] J. March, Advanced Organic Chemistry, Int. Stud. edn., McGraw-Hill, Tokyo, 1997. p. 507. [37] F Lepeltier P Chaumette J Saussey M.M Bettahar J.C Lavalley J. Mol. Catal. A: Chem. 122 1997 131 [38] F Lepeltier P Chaumette J Saussey M.M Bettahar J.C Lavalley J. Mol. Catal. A: Chem. 132 1997 91 [39] F Bali M.M Bettahar G Wröbel J.P Bonnelle J. Chim. Phys. 92 1995 1405 1416 [40] D Duprez J Barbier Z Ferhat-Hamida M.M Bettahar Appl. Catal. 12 1984 219 225 [41] Z Mesbah-Benyoucef M.M Bettahar J Barrault A Tranchant P Messina Mol. Chem. 2 1987 33 46 [42] D Duprez Z Ferhat-Hamida J Barbier M.M Bettahar J. Catal. 124 1990 1 [43] E.A.I Heiba P.S Landis J. Catal. 3 1964 471 [44] M Jayamani C.N Pillai J. Catal. 82 1983 485 [45] M Jayamani N Murugesan C.N Pillai J. Catal. 85 1984 527",
      "scopus-id": "0034684711",
      "coredata": {
        "eid": "1-s2.0-S1381116900001990",
        "dc:description": "Benzaldehyde hydrogenation over copper catalysts supported on Al2O3, SiO2, TiO2, CeO2 and ZrO2 has been studied at atmospheric pressure and 100–350°C. The reaction competitively produced benzylalcohol, toluene and benzene with yields depending on the nature of the support and reaction temperature. The obtained order of activity was attributed to metal and acid–base surface properties. The important gap in activity (multiplied by 2 to 23) between 300°C and 350°C, observed for all catalysts except Cu/SiO2, was attributed to an adsorption phenomenon, i.e. base sites or low reaction temperature inhibited the reaction course, whereas acidic sites or high reaction temperature enhanced the catalyst activity. Benzylalcohol was obtained with high selectivity (83% at 68% of conversion) from only 100°C with the SiO2 acidic support, whereas selective formation of toluene or benzene was observed at higher reaction temperature and depended on the nature of the support. The relative selectivity of toluene and benzylalcohol was governed by the adsorption strength the alcohol OH function on the catalyst surface. High selectivity to benzene was attributed to the easiness of the catalyst to break the CH aldehydic bond and stability of the surface organic entity formed. The parallel study of the reduction of benzaldehyde under N2 flow threw some light on the relation between metal and acid–base surface properties of the catalysts and reaction paths in benzaldehyde hydrogenation.",
        "openArchiveArticle": "false",
        "prism:coverDate": "2000-12-18",
        "openaccessUserLicense": null,
        "prism:aggregationType": "Journal",
        "prism:url": "https://api.elsevier.com/content/article/pii/S1381116900001990",
        "dc:creator": [
          {
            "@_fa": "true",
            "$": "Saadi, A"
          },
          {
            "@_fa": "true",
            "$": "Rassoul, Z"
          },
          {
            "@_fa": "true",
            "$": "Bettahar, M.M"
          }
        ],
        "link": [
          {
            "@_fa": "true",
            "@rel": "self",
            "@href": "https://api.elsevier.com/content/article/pii/S1381116900001990"
          },
          {
            "@_fa": "true",
            "@rel": "scidir",
            "@href": "https://www.sciencedirect.com/science/article/pii/S1381116900001990"
          }
        ],
        "dc:format": "application/json",
        "openaccessType": null,
        "pii": "S1381-1169(00)00199-0",
        "prism:volume": "164",
        "prism:publisher": "Elsevier Science B.V.",
        "dc:title": "Gas phase hydrogenation of benzaldehyde over supported copper catalysts",
        "prism:copyright": "Copyright © 2000 Elsevier Science B.V. All rights reserved.",
        "openaccess": "0",
        "prism:issn": "13811169",
        "prism:issueIdentifier": "1-2",
        "dcterms:subject": [
          {
            "@_fa": "true",
            "$": "Copper"
          },
          {
            "@_fa": "true",
            "$": "Catalysts"
          },
          {
            "@_fa": "true",
            "$": "Supports"
          },
          {
            "@_fa": "true",
            "$": "Benzaldehyde"
          },
          {
            "@_fa": "true",
            "$": "Hydrogenation"
          }
        ],
        "openaccessArticle": "false",
        "prism:publicationName": "Journal of Molecular Catalysis A: Chemical",
        "prism:number": "1-2",
        "openaccessSponsorType": null,
        "prism:pageRange": "205-216",
        "prism:endingPage": "216",
        "pubType": "fla",
        "prism:coverDisplayDate": "18 December 2000",
        "prism:doi": "10.1016/S1381-1169(00)00199-0",
        "prism:startingPage": "205",
        "dc:identifier": "doi:10.1016/S1381-1169(00)00199-0",
        "openaccessSponsorName": null
      },
      "objects": {
        "object": [
          {
            "@category": "thumbnail",
            "@height": "24",
            "@width": "436",
            "@_fa": "true",
            "$": "https://api.elsevier.com/content/object/eid/1-s2.0-S1381116900001990-si7.gif?httpAccept=%2A%2F%2A",
            "@multimediatype": "GIF image file",
            "@type": "ALTIMG",
            "@size": "1752",
            "@ref": "si7",
            "@mimetype": "image/gif"
          },
          {
            "@category": "thumbnail",
            "@height": "28",
            "@width": "405",
            "@_fa": "true",
            "$": "https://api.elsevier.com/content/object/eid/1-s2.0-S1381116900001990-si6.gif?httpAccept=%2A%2F%2A",
            "@multimediatype": "GIF image file",
            "@type": "ALTIMG",
            "@size": "1619",
            "@ref": "si6",
            "@mimetype": "image/gif"
          },
          {
            "@category": "thumbnail",
            "@height": "28",
            "@width": "433",
            "@_fa": "true",
            "$": "https://api.elsevier.com/content/object/eid/1-s2.0-S1381116900001990-si5.gif?httpAccept=%2A%2F%2A",
            "@multimediatype": "GIF image file",
            "@type": "ALTIMG",
            "@size": "1777",
            "@ref": "si5",
            "@mimetype": "image/gif"
          },
          {
            "@category": "thumbnail",
            "@height": "18",
            "@width": "455",
            "@_fa": "true",
            "$": "https://api.elsevier.com/content/object/eid/1-s2.0-S1381116900001990-si4.gif?httpAccept=%2A%2F%2A",
            "@multimediatype": "GIF image file",
            "@type": "ALTIMG",
            "@size": "1744",
            "@ref": "si4",
            "@mimetype": "image/gif"
          },
          {
            "@category": "thumbnail",
            "@height": "25",
            "@width": "449",
            "@_fa": "true",
            "$": "https://api.elsevier.com/content/object/eid/1-s2.0-S1381116900001990-si3.gif?httpAccept=%2A%2F%2A",
            "@multimediatype": "GIF image file",
            "@type": "ALTIMG",
            "@size": "1787",
            "@ref": "si3",
            "@mimetype": "image/gif"
          },
          {
            "@category": "thumbnail",
            "@height": "18",
            "@width": "445",
            "@_fa": "true",
            "$": "https://api.elsevier.com/content/object/eid/1-s2.0-S1381116900001990-si2.gif?httpAccept=%2A%2F%2A",
            "@multimediatype": "GIF image file",
            "@type": "ALTIMG",
            "@size": "1556",
            "@ref": "si2",
            "@mimetype": "image/gif"
          },
          {
            "@category": "thumbnail",
            "@height": "18",
            "@width": "445",
            "@_fa": "true",
            "$": "https://api.elsevier.com/content/object/eid/1-s2.0-S1381116900001990-si1.gif?httpAccept=%2A%2F%2A",
            "@multimediatype": "GIF image file",
            "@type": "ALTIMG",
            "@size": "1582",
            "@ref": "si1",
            "@mimetype": "image/gif"
          },
          {
            "@category": "thumbnail",
            "@height": "94",
            "@width": "112",
            "@_fa": "true",
            "$": "https://api.elsevier.com/content/object/eid/1-s2.0-S1381116900001990-gr1.sml?httpAccept=%2A%2F%2A",
            "@multimediatype": "GIF image file",
            "@type": "IMAGE-THUMBNAIL",
            "@size": "1243",
            "@ref": "gr1",
            "@mimetype": "image/gif"
          },
          {
            "@category": "standard",
            "@height": "252",
            "@width": "301",
            "@_fa": "true",
            "$": "https://api.elsevier.com/content/object/eid/1-s2.0-S1381116900001990-gr1.gif?httpAccept=%2A%2F%2A",
            "@multimediatype": "GIF image file",
            "@type": "IMAGE-DOWNSAMPLED",
            "@size": "4792",
            "@ref": "gr1",
            "@mimetype": "image/gif"
          },
          {
            "@category": "thumbnail",
            "@height": "93",
            "@width": "101",
            "@_fa": "true",
            "$": "https://api.elsevier.com/content/object/eid/1-s2.0-S1381116900001990-gr2.sml?httpAccept=%2A%2F%2A",
            "@multimediatype": "GIF image file",
            "@type": "IMAGE-THUMBNAIL",
            "@size": "1312",
            "@ref": "gr2",
            "@mimetype": "image/gif"
          },
          {
            "@category": "standard",
            "@height": "303",
            "@width": "329",
            "@_fa": "true",
            "$": "https://api.elsevier.com/content/object/eid/1-s2.0-S1381116900001990-gr2.gif?httpAccept=%2A%2F%2A",
            "@multimediatype": "GIF image file",
            "@type": "IMAGE-DOWNSAMPLED",
            "@size": "7121",
            "@ref": "gr2",
            "@mimetype": "image/gif"
          },
          {
            "@category": "thumbnail",
            "@height": "92",
            "@width": "44",
            "@_fa": "true",
            "$": "https://api.elsevier.com/content/object/eid/1-s2.0-S1381116900001990-gr3.sml?httpAccept=%2A%2F%2A",
            "@multimediatype": "GIF image file",
            "@type": "IMAGE-THUMBNAIL",
            "@size": "962",
            "@ref": "gr3",
            "@mimetype": "image/gif"
          },
          {
            "@category": "standard",
            "@height": "571",
            "@width": "272",
            "@_fa": "true",
            "$": "https://api.elsevier.com/content/object/eid/1-s2.0-S1381116900001990-gr3.gif?httpAccept=%2A%2F%2A",
            "@multimediatype": "GIF image file",
            "@type": "IMAGE-DOWNSAMPLED",
            "@size": "19011",
            "@ref": "gr3",
            "@mimetype": "image/gif"
          },
          {
            "@category": "thumbnail",
            "@height": "93",
            "@width": "45",
            "@_fa": "true",
            "$": "https://api.elsevier.com/content/object/eid/1-s2.0-S1381116900001990-gr4.sml?httpAccept=%2A%2F%2A",
            "@multimediatype": "GIF image file",
            "@type": "IMAGE-THUMBNAIL",
            "@size": "1194",
            "@ref": "gr4",
            "@mimetype": "image/gif"
          },
          {
            "@category": "standard",
            "@height": "546",
            "@width": "263",
            "@_fa": "true",
            "$": "https://api.elsevier.com/content/object/eid/1-s2.0-S1381116900001990-gr4.gif?httpAccept=%2A%2F%2A",
            "@multimediatype": "GIF image file",
            "@type": "IMAGE-DOWNSAMPLED",
            "@size": "20764",
            "@ref": "gr4",
            "@mimetype": "image/gif"
          },
          {
            "@category": "thumbnail",
            "@height": "93",
            "@width": "44",
            "@_fa": "true",
            "$": "https://api.elsevier.com/content/object/eid/1-s2.0-S1381116900001990-gr5.sml?httpAccept=%2A%2F%2A",
            "@multimediatype": "GIF image file",
            "@type": "IMAGE-THUMBNAIL",
            "@size": "1048",
            "@ref": "gr5",
            "@mimetype": "image/gif"
          },
          {
            "@category": "standard",
            "@height": "553",
            "@width": "263",
            "@_fa": "true",
            "$": "https://api.elsevier.com/content/object/eid/1-s2.0-S1381116900001990-gr5.gif?httpAccept=%2A%2F%2A",
            "@multimediatype": "GIF image file",
            "@type": "IMAGE-DOWNSAMPLED",
            "@size": "17596",
            "@ref": "gr5",
            "@mimetype": "image/gif"
          },
          {
            "@category": "thumbnail",
            "@height": "91",
            "@width": "125",
            "@_fa": "true",
            "$": "https://api.elsevier.com/content/object/eid/1-s2.0-S1381116900001990-gr6.sml?httpAccept=%2A%2F%2A",
            "@multimediatype": "GIF image file",
            "@type": "IMAGE-THUMBNAIL",
            "@size": "1804",
            "@ref": "gr6",
            "@mimetype": "image/gif"
          },
          {
            "@category": "standard",
            "@height": "219",
            "@width": "302",
            "@_fa": "true",
            "$": "https://api.elsevier.com/content/object/eid/1-s2.0-S1381116900001990-gr6.gif?httpAccept=%2A%2F%2A",
            "@multimediatype": "GIF image file",
            "@type": "IMAGE-DOWNSAMPLED",
            "@size": "6085",
            "@ref": "gr6",
            "@mimetype": "image/gif"
          },
          {
            "@category": "thumbnail",
            "@height": "93",
            "@width": "66",
            "@_fa": "true",
            "$": "https://api.elsevier.com/content/object/eid/1-s2.0-S1381116900001990-gr7.sml?httpAccept=%2A%2F%2A",
            "@multimediatype": "GIF image file",
            "@type": "IMAGE-THUMBNAIL",
            "@size": "1026",
            "@ref": "gr7",
            "@mimetype": "image/gif"
          },
          {
            "@category": "standard",
            "@height": "438",
            "@width": "312",
            "@_fa": "true",
            "$": "https://api.elsevier.com/content/object/eid/1-s2.0-S1381116900001990-gr7.gif?httpAccept=%2A%2F%2A",
            "@multimediatype": "GIF image file",
            "@type": "IMAGE-DOWNSAMPLED",
            "@size": "9392",
            "@ref": "gr7",
            "@mimetype": "image/gif"
          },
          {
            "@category": "thumbnail",
            "@height": "93",
            "@width": "114",
            "@_fa": "true",
            "$": "https://api.elsevier.com/content/object/eid/1-s2.0-S1381116900001990-gr8.sml?httpAccept=%2A%2F%2A",
            "@multimediatype": "GIF image file",
            "@type": "IMAGE-THUMBNAIL",
            "@size": "1308",
            "@ref": "gr8",
            "@mimetype": "image/gif"
          },
          {
            "@category": "standard",
            "@height": "227",
            "@width": "277",
            "@_fa": "true",
            "$": "https://api.elsevier.com/content/object/eid/1-s2.0-S1381116900001990-gr8.gif?httpAccept=%2A%2F%2A",
            "@multimediatype": "GIF image file",
            "@type": "IMAGE-DOWNSAMPLED",
            "@size": "4449",
            "@ref": "gr8",
            "@mimetype": "image/gif"
          },
          {
            "@category": "thumbnail",
            "@height": "43",
            "@width": "125",
            "@_fa": "true",
            "$": "https://api.elsevier.com/content/object/eid/1-s2.0-S1381116900001990-fx1.sml?httpAccept=%2A%2F%2A",
            "@multimediatype": "GIF image file",
            "@type": "IMAGE-THUMBNAIL",
            "@size": "904",
            "@ref": "fx1",
            "@mimetype": "image/gif"
          },
          {
            "@category": "standard",
            "@height": "79",
            "@width": "229",
            "@_fa": "true",
            "$": "https://api.elsevier.com/content/object/eid/1-s2.0-S1381116900001990-fx1.gif?httpAccept=%2A%2F%2A",
            "@multimediatype": "GIF image file",
            "@type": "IMAGE-DOWNSAMPLED",
            "@size": "1937",
            "@ref": "fx1",
            "@mimetype": "image/gif"
          },
          {
            "@category": "thumbnail",
            "@height": "35",
            "@width": "125",
            "@_fa": "true",
            "$": "https://api.elsevier.com/content/object/eid/1-s2.0-S1381116900001990-fx2.sml?httpAccept=%2A%2F%2A",
            "@multimediatype": "GIF image file",
            "@type": "IMAGE-THUMBNAIL",
            "@size": "718",
            "@ref": "fx2",
            "@mimetype": "image/gif"
          },
          {
            "@category": "standard",
            "@height": "96",
            "@width": "339",
            "@_fa": "true",
            "$": "https://api.elsevier.com/content/object/eid/1-s2.0-S1381116900001990-fx2.gif?httpAccept=%2A%2F%2A",
            "@multimediatype": "GIF image file",
            "@type": "IMAGE-DOWNSAMPLED",
            "@size": "2789",
            "@ref": "fx2",
            "@mimetype": "image/gif"
          },
          {
            "@category": "thumbnail",
            "@height": "17",
            "@width": "125",
            "@_fa": "true",
            "$": "https://api.elsevier.com/content/object/eid/1-s2.0-S1381116900001990-fx3.sml?httpAccept=%2A%2F%2A",
            "@multimediatype": "GIF image file",
            "@type": "IMAGE-THUMBNAIL",
            "@size": "519",
            "@ref": "fx3",
            "@mimetype": "image/gif"
          },
          {
            "@category": "standard",
            "@height": "45",
            "@width": "339",
            "@_fa": "true",
            "$": "https://api.elsevier.com/content/object/eid/1-s2.0-S1381116900001990-fx3.gif?httpAccept=%2A%2F%2A",
            "@multimediatype": "GIF image file",
            "@type": "IMAGE-DOWNSAMPLED",
            "@size": "2078",
            "@ref": "fx3",
            "@mimetype": "image/gif"
          }
        ]
      },
      "link": {
        "@rel": "abstract",
        "@href": "https://api.elsevier.com/content/abstract/scopus_id/0034684711"
      }
    }
  }
}