{
  "metadata": {
    "title": "Catalytic oxidation of thioanisole Ph–S–CH<ce:inf loc=post>3</ce:inf> over VO<ce:inf loc=post><ce:italic>x</ce:italic></ce:inf>/SiO<ce:inf loc=post>2</ce:inf> and VO<ce:inf loc=post><ce:italic>x</ce:italic></ce:inf>/Al<ce:inf loc=post>2</ce:inf>O<ce:inf loc=post>3</ce:inf> catalysts prepared by sol–gel method",
    "authors": "; ; ",
    "journal": "Journal of Molecular Catalysis A: Chemical",
    "date": "2006-08-01",
    "doi": "10.1016/j.molcata.2006.04.010",
    "abstract": "",
    "uri": "https://api.elsevier.com/content/article/pii/S1381116906007345",
    "pii": "S1381116906007345"
  },
  "fulltext": {
    "full-text-retrieval-response": {
      "scopus-eid": "2-s2.0-33746198764",
      "originalText": "serial JL 271358 291210 291744 291790 291809 31 Journal of Molecular Catalysis A: Chemical JOURNALMOLECULARCATALYSISACHEMICAL 2006-05-06 2006-05-06 2010-03-29T20:21:43 1-s2.0-S1381116906007345 S1381-1169(06)00734-5 S1381116906007345 10.1016/j.molcata.2006.04.010 S300 S300.1 FULL-TEXT 1-s2.0-S1381116906X02364 2015-05-15T05:56:33.323092-04:00 0 0 20060801 2006 2006-05-06T00:00:00Z articleinfo crossmark dco dateupdated tomb dateloaded datesearch indexeddate issuelist volumelist yearnav absattachment articletitlenorm authfirstinitialnorm authfirstsurnamenorm cid cids contenttype copyright dateloadedtxt docsubtype doctype doi eid ewtransactionid hubeid issfirst issn issnnorm itemstage itemtransactionid itemweight openaccess openarchive pg pgfirst pglast pii piinorm pubdatestart pubdatetxt pubyr sortorder srctitle srctitlenorm srctype subheadings volfirst volissue webpdf webpdfpagecount figure table body affil articletitle auth authfirstini authfull authkeywords authlast primabst ref specialabst alllist content subj ssids 1381-1169 13811169 255 255 1 2 1 2 Volume 255, Issues 1–2 14 62 68 62 68 20060801 1 August 2006 2006-08-01 2006 article fla Copyright © 2006 Elsevier B.V. All rights reserved. CATALYTICOXIDATIONTHIOANISOLEPHSCH3OVERVOXSIO2VOXAL2O3CATALYSTSPREPAREDBYSOLGELMETHOD MOUSSA N 1 Introduction 2 Experimental 2.1 Preparation of VOx/SiO2 and VOx/Al2O3 catalysts 2.2 Characterization 2.3 Sulfoxidation reaction 3 Results and discussion 3.1 Catalyst properties 3.2 Homogeneous reactions 3.3 Heterogeneous reactions with TBHP 3.4 Heterogeneous reactions with H2O2 4 Conclusion References CARRENO 1995 1717 M ADAM 2002 3 W CONTE 1997 93 V MAURYA 2003 163 M CONTE 1997 335 V HARTUNG 2002 67 J LEGTENBARG 2003 89 A BOLM 2003 245 C ZIOLEK 2004 145 150 M FRAILE 1998 1807 J IWAMATO 2001 271 M HULEA 1996 499 V HULEA 1996 325 V REDDY 1992 84 R KHOLDEEVA 2000 417 O KANTAM 2004 19 M TRUKHAN 2001 603 N FUERTE 2004 227 A ARENDS 2001 175 187 I DAVIES 2000 1807 L DAVIES 2001 632 L BAIKER 1988 273 A NEUMANN 1995 85 R MOUSSA 2005 127 N BARAKET 2000 89 L WECKHUYSEN 2003 25 B FERREIRA 2000 290 M KHODAKOV 1999 205 A WACHS 1997 67 I INUMARU 1997 133 K WACHS 2003 13 I ROUTARY 2004 103 K WENT 1990 4240 G MAGG 2004 88 N ARGYL 2002 139 M WACHS 2005 79 I OYAMA 1989 6786 S WACHS 1990 570 I OLTHOF 2000 1516 B BULUSHEV 2002 115 D EVANS 2004 292 O GARCIA 2005 1 T SHYLESH 2005 359 S WACHS 1996 437 I MOUSSAX2006X62 MOUSSAX2006X62X68 MOUSSAX2006X62XN MOUSSAX2006X62X68XN item S1381-1169(06)00734-5 S1381116906007345 1-s2.0-S1381116906007345 10.1016/j.molcata.2006.04.010 271358 2010-10-08T06:19:53.282072-04:00 2006-08-01 1-s2.0-S1381116906007345-main.pdf https://s3.amazonaws.com/prod-ucs-content-store-us-east/content/pii:S1381116906007345/MAIN/application/pdf/fc7ba9f390bf6fe1b954ad8c9ade2c67/main.pdf https://s3-eu-west-1.amazonaws.com/prod-ucs-content-store-eu-west/content/pii:S1381116906007345/MAIN/application/pdf/fc7ba9f390bf6fe1b954ad8c9ade2c67/main.pdf main.pdf pdf true 390831 MAIN 7 1-s2.0-S1381116906007345-main_1.png https://s3.amazonaws.com/prod-ucs-content-store-us-east/content/pii:S1381116906007345/PREVIEW/image/png/41d3f39f1b37b3a9b1ae582cbe106ccf/main_1.png https://s3-eu-west-1.amazonaws.com/prod-ucs-content-store-eu-west/content/pii:S1381116906007345/PREVIEW/image/png/41d3f39f1b37b3a9b1ae582cbe106ccf/main_1.png main_1.png png 69306 849 656 IMAGE-WEB-PDF 1 1-s2.0-S1381116906007345-gr1.jpg https://s3.amazonaws.com/prod-ucs-content-store-us-east/content/pii:S1381116906007345/gr1/DOWNSAMPLED/image/jpeg/edc21988bc73767dbd51313955225e8f/gr1.jpg https://s3-eu-west-1.amazonaws.com/prod-ucs-content-store-eu-west/content/pii:S1381116906007345/gr1/DOWNSAMPLED/image/jpeg/edc21988bc73767dbd51313955225e8f/gr1.jpg gr1 gr1.jpg jpg 7320 63 323 IMAGE-DOWNSAMPLED 1-s2.0-S1381116906007345-gr1.sml https://s3.amazonaws.com/prod-ucs-content-store-us-east/content/pii:S1381116906007345/gr1/THUMBNAIL/image/gif/e2563d5477428435178f364970b2c6f7/gr1.sml https://s3-eu-west-1.amazonaws.com/prod-ucs-content-store-eu-west/content/pii:S1381116906007345/gr1/THUMBNAIL/image/gif/e2563d5477428435178f364970b2c6f7/gr1.sml gr1 gr1.sml sml 606 24 125 IMAGE-THUMBNAIL 1-s2.0-S1381116906007345-gr2.jpg https://s3.amazonaws.com/prod-ucs-content-store-us-east/content/pii:S1381116906007345/gr2/DOWNSAMPLED/image/jpeg/1c1c53b907e4844116370b7308da0044/gr2.jpg https://s3-eu-west-1.amazonaws.com/prod-ucs-content-store-eu-west/content/pii:S1381116906007345/gr2/DOWNSAMPLED/image/jpeg/1c1c53b907e4844116370b7308da0044/gr2.jpg gr2 gr2.jpg jpg 6421 99 193 IMAGE-DOWNSAMPLED 1-s2.0-S1381116906007345-gr2.sml https://s3.amazonaws.com/prod-ucs-content-store-us-east/content/pii:S1381116906007345/gr2/THUMBNAIL/image/gif/fde42c7843b50007deb6acf190cb103a/gr2.sml https://s3-eu-west-1.amazonaws.com/prod-ucs-content-store-eu-west/content/pii:S1381116906007345/gr2/THUMBNAIL/image/gif/fde42c7843b50007deb6acf190cb103a/gr2.sml gr2 gr2.sml sml 1172 64 125 IMAGE-THUMBNAIL 1-s2.0-S1381116906007345-gr3.jpg https://s3.amazonaws.com/prod-ucs-content-store-us-east/content/pii:S1381116906007345/gr3/DOWNSAMPLED/image/jpeg/2f96c012617a28e57c0f135432d7a1f9/gr3.jpg https://s3-eu-west-1.amazonaws.com/prod-ucs-content-store-eu-west/content/pii:S1381116906007345/gr3/DOWNSAMPLED/image/jpeg/2f96c012617a28e57c0f135432d7a1f9/gr3.jpg gr3 gr3.jpg jpg 30017 268 352 IMAGE-DOWNSAMPLED 1-s2.0-S1381116906007345-gr3.sml https://s3.amazonaws.com/prod-ucs-content-store-us-east/content/pii:S1381116906007345/gr3/THUMBNAIL/image/gif/8d3b86654a958d7253616308fec94f59/gr3.sml https://s3-eu-west-1.amazonaws.com/prod-ucs-content-store-eu-west/content/pii:S1381116906007345/gr3/THUMBNAIL/image/gif/8d3b86654a958d7253616308fec94f59/gr3.sml gr3 gr3.sml sml 3039 94 123 IMAGE-THUMBNAIL 1-s2.0-S1381116906007345-gr4.jpg https://s3.amazonaws.com/prod-ucs-content-store-us-east/content/pii:S1381116906007345/gr4/DOWNSAMPLED/image/jpeg/af5b6456475dc8395e27926c904448f3/gr4.jpg https://s3-eu-west-1.amazonaws.com/prod-ucs-content-store-eu-west/content/pii:S1381116906007345/gr4/DOWNSAMPLED/image/jpeg/af5b6456475dc8395e27926c904448f3/gr4.jpg gr4 gr4.jpg jpg 32884 284 356 IMAGE-DOWNSAMPLED 1-s2.0-S1381116906007345-gr4.sml https://s3.amazonaws.com/prod-ucs-content-store-us-east/content/pii:S1381116906007345/gr4/THUMBNAIL/image/gif/27da1eeb939ec0c4e7c07f74f6fdb0d1/gr4.sml https://s3-eu-west-1.amazonaws.com/prod-ucs-content-store-eu-west/content/pii:S1381116906007345/gr4/THUMBNAIL/image/gif/27da1eeb939ec0c4e7c07f74f6fdb0d1/gr4.sml gr4 gr4.sml sml 3190 93 117 IMAGE-THUMBNAIL 1-s2.0-S1381116906007345-gr5.jpg https://s3.amazonaws.com/prod-ucs-content-store-us-east/content/pii:S1381116906007345/gr5/DOWNSAMPLED/image/jpeg/a2f388b1c97822a5f76e7f479edde087/gr5.jpg https://s3-eu-west-1.amazonaws.com/prod-ucs-content-store-eu-west/content/pii:S1381116906007345/gr5/DOWNSAMPLED/image/jpeg/a2f388b1c97822a5f76e7f479edde087/gr5.jpg gr5 gr5.jpg jpg 37866 266 360 IMAGE-DOWNSAMPLED 1-s2.0-S1381116906007345-gr5.sml https://s3.amazonaws.com/prod-ucs-content-store-us-east/content/pii:S1381116906007345/gr5/THUMBNAIL/image/gif/092ce1340d7adf6d20796a0cf93af68c/gr5.sml https://s3-eu-west-1.amazonaws.com/prod-ucs-content-store-eu-west/content/pii:S1381116906007345/gr5/THUMBNAIL/image/gif/092ce1340d7adf6d20796a0cf93af68c/gr5.sml gr5 gr5.sml sml 3744 92 125 IMAGE-THUMBNAIL 1-s2.0-S1381116906007345-gr6.jpg https://s3.amazonaws.com/prod-ucs-content-store-us-east/content/pii:S1381116906007345/gr6/DOWNSAMPLED/image/jpeg/0fe2acffb9b10626e807f06ba0cb1169/gr6.jpg https://s3-eu-west-1.amazonaws.com/prod-ucs-content-store-eu-west/content/pii:S1381116906007345/gr6/DOWNSAMPLED/image/jpeg/0fe2acffb9b10626e807f06ba0cb1169/gr6.jpg gr6 gr6.jpg jpg 34095 270 366 IMAGE-DOWNSAMPLED 1-s2.0-S1381116906007345-gr6.sml https://s3.amazonaws.com/prod-ucs-content-store-us-east/content/pii:S1381116906007345/gr6/THUMBNAIL/image/gif/05501da4621e13ec59e77a0657493a72/gr6.sml https://s3-eu-west-1.amazonaws.com/prod-ucs-content-store-eu-west/content/pii:S1381116906007345/gr6/THUMBNAIL/image/gif/05501da4621e13ec59e77a0657493a72/gr6.sml gr6 gr6.sml sml 3631 92 125 IMAGE-THUMBNAIL 1-s2.0-S1381116906007345-gr7.jpg https://s3.amazonaws.com/prod-ucs-content-store-us-east/content/pii:S1381116906007345/gr7/DOWNSAMPLED/image/jpeg/615c386a1eecdd97115dee782042aafe/gr7.jpg https://s3-eu-west-1.amazonaws.com/prod-ucs-content-store-eu-west/content/pii:S1381116906007345/gr7/DOWNSAMPLED/image/jpeg/615c386a1eecdd97115dee782042aafe/gr7.jpg gr7 gr7.jpg jpg 29929 344 355 IMAGE-DOWNSAMPLED 1-s2.0-S1381116906007345-gr7.sml https://s3.amazonaws.com/prod-ucs-content-store-us-east/content/pii:S1381116906007345/gr7/THUMBNAIL/image/gif/d9f9dae645562072a5fe31d901dd552b/gr7.sml https://s3-eu-west-1.amazonaws.com/prod-ucs-content-store-eu-west/content/pii:S1381116906007345/gr7/THUMBNAIL/image/gif/d9f9dae645562072a5fe31d901dd552b/gr7.sml gr7 gr7.sml sml 2372 93 96 IMAGE-THUMBNAIL 1-s2.0-S1381116906007345-gr8.jpg https://s3.amazonaws.com/prod-ucs-content-store-us-east/content/pii:S1381116906007345/gr8/DOWNSAMPLED/image/jpeg/3ae547fed845dd1fb9c24b1bdd5b0fc4/gr8.jpg https://s3-eu-west-1.amazonaws.com/prod-ucs-content-store-eu-west/content/pii:S1381116906007345/gr8/DOWNSAMPLED/image/jpeg/3ae547fed845dd1fb9c24b1bdd5b0fc4/gr8.jpg gr8 gr8.jpg jpg 25198 296 358 IMAGE-DOWNSAMPLED 1-s2.0-S1381116906007345-gr8.sml https://s3.amazonaws.com/prod-ucs-content-store-us-east/content/pii:S1381116906007345/gr8/THUMBNAIL/image/gif/acf3bac3b12bc0d0dd3f0282e2c087be/gr8.sml https://s3-eu-west-1.amazonaws.com/prod-ucs-content-store-eu-west/content/pii:S1381116906007345/gr8/THUMBNAIL/image/gif/acf3bac3b12bc0d0dd3f0282e2c087be/gr8.sml gr8 gr8.sml sml 2465 94 113 IMAGE-THUMBNAIL 1-s2.0-S1381116906007345-fx1.jpg https://s3.amazonaws.com/prod-ucs-content-store-us-east/content/pii:S1381116906007345/fx1/DOWNSAMPLED/image/jpeg/52f6c1023ef5315afff8e618414c370c/fx1.jpg https://s3-eu-west-1.amazonaws.com/prod-ucs-content-store-eu-west/content/pii:S1381116906007345/fx1/DOWNSAMPLED/image/jpeg/52f6c1023ef5315afff8e618414c370c/fx1.jpg fx1 true fx1.jpg jpg 10903 108 326 IMAGE-DOWNSAMPLED 1-s2.0-S1381116906007345-fx1.sml https://s3.amazonaws.com/prod-ucs-content-store-us-east/content/pii:S1381116906007345/fx1/THUMBNAIL/image/gif/d55ef42982c8692f58665dc555754fb4/fx1.sml https://s3-eu-west-1.amazonaws.com/prod-ucs-content-store-eu-west/content/pii:S1381116906007345/fx1/THUMBNAIL/image/gif/d55ef42982c8692f58665dc555754fb4/fx1.sml fx1 true fx1.sml sml 748 41 125 IMAGE-THUMBNAIL MOLCAA 5943 S1381-1169(06)00734-5 10.1016/j.molcata.2006.04.010 Elsevier B.V. Fig. 1 Oxidation of sulfide. Fig. 2 Different oxidized vanadium species. Fig. 3 Raman spectra of VO x /SiO2 xerogels: (a) calcined V/Si=0.2, (b) calcined V/Si=0.1, (c) non calcined V/Si=0.2, (d) non-calcined V/Si=0.1. Fig. 4 Raman spectra of VO x /SiO2 aerogels: (a) calcined V/Si=0.2, (b) calcined V/Si=0.1, (c) non-calcined V/Si=0.2, (d) non-calcined V/Si=0.1. Fig. 5 Raman spectra of VO x /Al2O3 xerogels: (a) non calcined V/Al=0.2, (b) calcined V/Al=0.2, (c) non-calcined V/Al=0.1, (d) calcined V/Al=0.1. Fig. 6 Raman spectra of VO x /Al2O3 aerogels: (a) non-calcined V/Al=0.2, (b) non-calcined V/Al=0.1, (c) calcined V/Al=0.2, (d) calcined V/Al=0.1. Fig. 7 Kinetic of sulfoxidation of thioanisole over non calcined V/Al=0.05 aerogel catalyst. Fig. 8 Kinetic of sulfoxidation of thioanisole over calcined V/Al=0.05 aerogel catalyst. Table 1 Textural properties of VO x /SiO2 and VO x /Al2O3 catalysts as function of V loading Drying mode V/M(Si, Al) nominal ratio V/Si V/Al V-content a (wt.%) S BET (m2/g) dp b (Å) V-content (wt.%) S BET (m2/g) dp (Å) Xerogels 0.05 3.35 303 27 2.5 382 118 0.05C c 3.7 225 17 3.2 142 210 0.1 5.7 306 27 3.7 411 34 0.1C 6 375 32 5.2 367 32 0.2 8.2 251 24 6.7 Np a – 0.2C 11.2 420 23 11.3 Np – Aerogels 0.05 2.8 861 46 2.5 414 116 0.05C 3.7 864 45 2.5 339 114 0.1 6.6 244 89 5.5 241 192 0.1C 7.1 264 93 6.1 256 165 0.2 8.8 526 44 10.9 353 124 0.2C 9.7 679 47 11.2 378 127 a Determined with ICP. b Mean pore diameter determined with BJH method. c C: Calcined. Np: nonporous. Table 2 Homogeneous liquid phase oxidation of thioanisole Entry Catalyst Oxidant Solvent Time Thioanisole conversion (%) Sulfoxide selectivity (%) Sulfone selectivity (%) 1 — TBHP CH2Cl2 24h 30 98 2 2 — H2O2 MeOH 30h 22.5 71 29 3 V(acac)3 TBHP CH2Cl2 1min 25 94 6 25min 92 96 4 1.5h 96 92 8 4 VO(acac)2 TBHP CH2Cl2 1min 78 93 7 25min 98 88 12 1.5h 98 86 14 5 V(acac)3 H2O2 MeOH 1min 92 85 15 6 VO(acac)2 H2O2 MeOH 1min 92 85 15 Entries 1, 2: reaction was carried out without catalysts. Thioanisole: oxidant: vanadium=1:1.1:0.1 (molar ratio), solvent=5ml, T =25°C. Table 3 Thioanisole oxidation with TBHP over VO x /SiO2 catalysts Entry Drying mode V/Si nominal ratio Thioanisol conversion (%) Sulfoxide selectivity (%) Sulfone selectivity (%) Time (h) Observation a 1 Xerogel 0.05 95 96 4 3 Homogeneous 2 0.05C b 92 97 3 3 Homogeneous 3 0.1 99 94 6 6 Heterogeneous 4 0.1C 99 91 9 6 Heterogeneous 5 0.2 83 97 3 8 Heterogeneous 6 0.2C 99 94 6 6 Heterogeneous 7 Aerogel 0.05 99 91 9 1 Homogeneous 8 0.05C 99 82 18 1 Homogeneous 9 0.1 95 97 3 1.5 Homogeneous 10 0.1C 95 97 3 1 Homogeneous 11 0.2 99 91 9 1 Homogeneous 12 0.2C 97 90 10 1 Homogeneous Thioanisole: oxidant=1:1.1 (molar ratio), solvent=5ml, T =25°C. a Heterogeneous: without vanadium leaching. Homogeneous: with vanadium leaching. b C: calcined. Table 4 Thioanisole oxidation with TBHP over VO x /Al2O3 catalysts Entry Drying mode V/Al nominal ratio Thioanisol conversion (%) Sulfoxide selectivity (%) Sulfone selectivity (%) Time (h) Observation a 1 Xerogel 0.05 0 – – 3 Inactive 2 0.05C b 13 79 21 8 Heterogeneous 3 0.1 0 – – 6 Inactive 4 0.1C 51 78 22 6 Heterogeneous 5 0.2 33 97 3 6 Heterogeneous 6 0.2C 39 97 3 6 Heterogeneous 7 Aerogel 0.05 52 79 21 7 Heterogeneous 8 0.05C 43 68 32 7 Heterogeneous 9 0.1 62 72 27 7 Heterogeneous 10 0.1C 65 55 45 6 Heterogeneous 11 0.2 51 71 29 2 Partially homog. 12 0.2C 77 67 33 2 Partially homog. Thioanisole: oxidant=1:1.1 (molar ratio), solvent=5ml, T =25°C. a Heterogeneous: without vanadium leaching. Homogeneous: with vanadium leaching. b C: calcined. Table 5 Thioanisole oxidation with H2O2 over typical VO x /SiO2 and VO x /Al2O3 catalysts V/M ratio Catalyst Thioanisole conversion (%) Sulfoxide selectivity (%) Sulfone selectivity (%) Time Observation V/Si=0.2 Calcined xerogel 90 ND ND 10min Homogeneous Calcined aerogel 98 81 19 1min Homogeneous V/Al=0.2 Calcined xerogel 35 55 45 24h ND Calcined aerogel 94 83 17 30min Partially homogeneous Recovered calcined aerogel 14 56 44 25min ND ND: not determined. Thioanisole: oxidant=1:1.1 (molar ratio), solvent=5ml, T =25°C. Catalytic oxidation of thioanisole Ph–S–CH3 over VO x /SiO2 and VO x /Al2O3 catalysts prepared by sol–gel method N. Moussa a ⁎ José M. Fraile b A. Ghorbel a José A. Mayoral b a Laboratoire de Catalyse et de Chimie des Matériaux, Département de Chimie, Faculté des Sciences de Tunis, Campus Universitaire 2092, ElManar, Tunis, Tunisie b Departamento de Química Orgánica, Instituto de Ciencia de Materiales de Aragón, Facultad de Ciencias, Universidad de Zaragoza, CSIC, E-50009 Zaragoza, Spain ⁎ Corresponding author. The catalytic oxidation of thioanisole to the sulfoxide and sulfone using TBHP or H2O2 as oxidants in CH2Cl2 or MeOH as solvents was carried out over VO x /SiO2 or VO x /Al2O3 catalysts prepared by a sol–gel method. It was found that the catalytic activity and selectivity of the reaction depended on the nature of the support (SiO2 or Al2O3), the drying mode (xerogel or aerogel), the calcination of the solid and the vanadium-peroxide species formed. The TBHP/CH2Cl2 system gave a very high activity and selectivity, mainly in the cases of vanadia-silica xerogels, with total thioanisole conversion and a sulfoxide/sulfone ratio of 97/3. This activity was truly heterogeneous but vanadium leaching was observed with vanadia-silica aerogels. In contrast, vanadia-alumina catalysts were less active and less selective. The use of the H2O2/MeOH system led to vanadium leaching with all types of catalysts. Graphical abstract Keywords VO x /SiO2 VO x /Al2O3 Sol–gel Xerogel Aerogel Sulfoxidation Peroxide Leaching 1 Introduction The oxidation of sulfides to sulfoxides and sulfones has been a widely researched subject due to interest in sulfoxides as intermediates in organic synthesis and their presence in biologically active compounds [1]. Sulfoxides are obtained by partial oxidation of sulfides in the presence of an oxidant such as TBHP or H2O2 and further oxidation of the sulfoxide leads to the sulfone (Fig. 1 )—the extent of this overoxidation reaction depends on the electrophilicity of the oxidant [2]. H2O2 and TBHP are relatively weak oxidants and require activation by the addition of transition metal ions to give reactive peroxo species. One example is vanadium (Fig. 2 ). The reactivity and selectivity depend on the nature of the peroxometal species and its oxidizing power [2–6]. Catalytic epoxidation and sulfoxidation reactions can be carried out in the liquid phase with soluble metal complexes of Ti, V, Re, Mn, Cr, and W [2,7,8]. Easier and more environmentally benign processes can be obtained by replacing homogeneous catalysts with heterogeneous ones [9]. Among the supported metals used in sulfoxidation reactions, titanium is probably most widely employed [9–15]. More recently, reports have been published concerning the preparation of different heterogeneous vanadium catalysts based on titanium oxide [16], mesoporous silica [17], and USY zeolite [18]. Kantam et al. [16] tested VO(acac)2-TiO2, prepared by impregnation, in the sulfoxidation of thioanisole Ph–S–CH3; the results showed a thioanisole conversion of 99% in 1.5h and a sulfoxide/sulfone ratio of 97/3. However, Trukhan et al. [17] found a problem of vanadium leaching into the solution and this accounts for the high thioanisole conversion of 98% after only 4min. The same leaching problem was also observed in the case of silica-supported titanium catalysts in the same reaction [10]. Leaching resulting from metal-oxygen bond solvolysis is due to the chelating effect of the oxidant and/or the products and by-products, as shown in the epoxidation of allyl alcohol with TS-1 catalyst [19–21]. Most heterogeneous vanadium catalysts are supported catalysts prepared by impregnation. Recently, the sol–gel method has been used for the preparation of vanadia-silica catalysts, which have been tested in reactions such as selective catalytic reduction of nitric oxide with ammonia [22], the oxidation of alkenes [23] and the epoxidation of allyl alcohol [24]. However, the preparation of vanadia-alumina catalysts has not been as widely explored [25]. Supported vanadia catalys have been studied by many spectroscopic techniques in order to establish the effect of the support on vanadia dispersion and the type of vanadium species present [26–35]. Wachs et al. [31,36] and Weckhuysen and Keller [26] recently described the possible structures of supported vanadium species and their effects on the catalytic activity. Different species may be present on SiO2 and Al2O3 supports: isolated VO4 species, polymeric VO4 species, crystalline V2O5 and mixed oxide with support [26]. In this paper we present the results of our research concerning the catalytic properties of VO x /SiO2 and VO x /Al2O3 catalysts, prepared by sol–gel processes, in the oxidation of thioanisole. The work is focused on the effect of the support and the drying mode (xerogel or aerogel) on the reaction selectivity and vanadium stability towards leaching. 2 Experimental 2.1 Preparation of VOx/SiO2 and VOx/Al2O3 catalysts Vanadia-silica gels were prepared by adding V(acac)3 (Fluka, 95%) to a mixture of 1-propanol (Across, 99%) and aqueous HNO3 (0.7N). The mixture was stirred at 70°C until V(acac)3 was completely dissolved, then TEOS (Acros, 98%) in 1-propanol was added to the solution. The total volume of 1-propanol was 16.6ml. In all preparations the molar composition TEOS:H2O:HNO3 was kept constant at 1:4:0.35. Vanadia-alumina gels were prepared by adding V(acac)3 to a 1M solution of Al(O-sBu)3 (Acros, 97%) in 2-butanol (Across, 99%). The mixture was stirred at 50°C for 1h, until V(acac)3 was completely dissolved. The mixture was cooled to 30°C and distilled water was added to the solution to give a ratio H2O:Al=3. In the preparation of both catalysts the V/M (Si, Al) molar ratios were maintained at 0.05, 0.1 and 0.2. The resulting gels were dried either in an oven at 120°C for 24h (xerogel), or under supercritical solvent conditions in an autoclave (aerogel). Finally, the solids were calcined under an air flow at 500°C for 5h. 2.2 Characterization The specific surface areas (S BET) and the average pore diameters were determined by nitrogen physisorption at 77K using a Micromeritics ASAP-2000 instrument. The Raman spectra were recorded on a Renishaw NIR 780TFSeries Laser and the samples were excited with a 785nm NIR laser, under ambient temperature. 2.3 Sulfoxidation reaction The oxidant (1.1mmol), anhydrous TBHP in isooctane (3M) or H2O2 (30% aq), was added to a mixture of thioanisole (1mmol, Aldrich 99%) and catalyst (25mg) in the reaction solvent (5ml), anhydrous dichloromethane or methanol, at 25°C under argon. The progress of the reaction was followed by GC. Vanadium leaching [19] was assessed by stirring a reaction mixture containing the catalyst for 10–15min and then removing the catalyst by filtration. The reaction in the resulting solution was monitored by GC. 3 Results and discussion 3.1 Catalyst properties The specific surfaces areas, average pore diameters and the vanadium loading of the prepared catalysts are presented in Table 1 . For the same vanadium loading, VO x /SiO2 catalysts develop, in general, higher surface areas than VO x /Al2O3 catalysts. However, the latter have larger average pore diameters, which is of interest because of the easy diffusion of reactants to the active sites. The Raman spectra of VO x /SiO2 xerogels are shown in Fig. 3 . At a vanadium loading of 9.74%, two types of vanadium species are detected in the calcined sample; (a) monomeric vanadyl groups (V=O) as revealed by a band near 1025cm−1, in agreement with analogous bands found in the case of vanadium catalysts supported on different oxides (silica, alumina, and titania) (1026–1042cm−1) [33,37–42] or mesoporous vanadium silicates (1030cm−1) [43], and (b) crystalline V2O5 species characterized by peaks at 295, 311, 412, 495, 536, 711, and 1004cm−1, in agreement with the bands found in the case of vanadium catalysts supported on different oxides (283–285, 305, 405–407, 483–486, 525–527, 699–703 and 995–997cm−1) [33,37,39]. The same species are detected in the case of the calcined aerogel (Fig. 4a) but in this case with a shift of 10cm−1 towards lower wavenumbers, which indicates that the V=O bond strength is weaker in aerogels than in xerogels [33]. This shift could also be caused by a change in the vanadium coordination or by a decrease in the bond angle or in the bond strength of the OVO groups bridging VOV or VOsupport bonds [44]. Defined peaks were not detected for most of the non-calcined aerogels, a finding that can be attributed to a number of different factors: the high dispersion of vanadium, the poor crystallinity of V2O5 or fluorescence phenomena [28]. The Raman spectra of VO x /Al2O3 catalysts are represented in Figs. 5 and 6 for xerogels and aerogels, respectively. In the case of aerogels, significant peaks are not observed and this could be due to fluorescence phenomena [28]. At a vanadium loading of 10.9%, non-calcined xerogels present a Raman band at 1038cm-1, which is attributed to monomeric vanadyl groups (V=O), and bands towards 964, 698, 573, 472 and 428cm−1, which can be attributed to polymeric species–probably (VO3) n [26,33]. After calcination at 500°C, VO x /Al2O3 xerogels exhibit a broad band centered at 933cm−1 for vanadium loading of 6.1% and at 967cm−1 for a vanadium loading of 11.2%. These bands correspond to polymeric vanadates [26,33]. None of these frequencies can be assigned to crystalline V2O5. An increase in the vanadium loading causes a shift of 10cm−1 towards higher frequency for non-calcined xerogels and a shift of 34cm−1 for calcined ones. This can be attributed to an increase in the chain length of polyvanadate species [33] and, as a consequence, an increase in the surface concentration of bridging VOV bonds. Raman spectroscopy shows that the characteristics of the supported vanadium species depend on the nature of the support, the drying method and the calcination. These species are isolated vanadyl species (V=O) and either crystalline V2O5 for the SiO2 support or polyvanadate (VO3) n for Al2O3. 3.2 Homogeneous reactions As a control, the homogeneous oxidation of thioanisole with H2O2 and TBHP is evaluated. The results presented in Table 2 show that in the absence of catalyst (entries 1, 2) neither H2O2 nor TBHP is a powerful oxidant and they have a different effect on the selectivity; TBHP in CH2Cl2 is more selective than H2O2 in MeOH. The activation of H2O2 and TBHP by vanadium precursors such as V(acac)3 and VO(acac)2 accelerates the reaction by forming oxidized vanadium complexes (entries 3–6). The reactivity and selectivity depend on the nature of the vanadium species [5]. Vanadium salts such as VO(acac)2, V(acac)3, NaVO3 and V2O5 form peroxocomplex 1 or peroxycomplex 2 in the presence of H2O2 and TBHP, respectively [5]. When the V(acac)3/TBHP complex is used, a sulfoxide/sulfone ratio of 92/8 is obtained and this is better than that observed with the VO(acac)2/TBHP complex (sulfoxide/sulfone ratio=86/14). Furthermore, the use of H2O2 leads to no difference between V(acac)3 and VO(acac)2 and a fast thioanisole conversion and lower selectivity are obtained. These findings reflect the stronger oxidizing power of peroxovanadium species 1 formed with H2O2 in comparison to the peroxyvanadium species 2 obtained with TBHP. These results confirm that sulfur oxidation with TBHP is more selective than that with H2O2, as in the case of the epoxidation reaction [5]. From this study, it is clear that both activity and selectivity depend on the species formed between vanadium and the oxidant (TBHP or H2O2). 3.3 Heterogeneous reactions with TBHP The results of the TBHP oxidation of thioanisole with VO x /SiO2 catalysts are gathered in Table 3 . Xerogels (entries 1–6) exhibit a high sulfide conversion with high sulfoxide selectivity. Almost total conversion can be obtained after 6h with a sulfoxide/sulfone ratio of 96/4. Only marginal differences are observed between the calcined and non-calcined xerogels. In general, the calcined xerogels are slightly less selective and more active, especially the solid with a high vanadium loading. In all cases the heterogeneous nature of the reaction is tested by filtration under reaction conditions at short reaction time and monitoring the solution. Except for xerogel with V/Si=0.05, oxidation activity is not observed in the solutions with other VO x /SiO2 xerogels, indicating that leaching of active vanadium to the solution does not occur. In contrast, VO x /SiO2 aerogels exhibit a very high activity, with a thioanisole conversion above 95% in only 1–2h. The filtration experiments show that this activity is due in part to soluble vanadium leached from the solids. Vanadium leaching was also observed by Trukhan et al. [17] and Fuerte et al. [18]. The reactions are performed under the same conditions for both xerogels and aerogels and vanadium leaching can therefore be explained in terms of weaker bridging O–V–O– groups [37], as shown by the Raman spectra. These results demonstrate that vanadium stability in heterogeneous catalysts prepared by a sol–gel process depends on the drying mode. The results of thioanisole oxidation over VO x /Al2O3 catalysts are given in Table 4 . In the case of xerogels, thioanisole conversion and sulfoxide selectivity increase with increasing V/Al ratio and calcination is crucial in obtaining active catalysts, mainly at low vanadium loadings. Among the calcined xerogels, the best conversion (62% in 9h) and selectivity (sulfoxide/sulfone ratio=97/3) were obtained with the catalyst with the highest vanadium loading, although this catalyst is nonporous (see Table 1). The effect of calcination is not so positive with aerogels. An increase in thioanisole conversion is only observed at a high vanadium loading: With calcined aerogels thioanisole oxidation to sulfoxide is the primary reaction, but after 1h the sulfoxide concentration is sufficiently high to lead to sulfone formation. The evolution of the conversion and the selectivity in the thioanisole oxidation with TBHP over calcined and non-calcined aerogels for a vanadium loading of 2.46% are shown in Figs. 7 and 8 . The sulfoxide selectivity, although always low, is slightly better with non-calcined aerogels. On the other hand, the results show that aerogels exhibit a higher activity but a lower selectivity than xerogels. The results in Tables 3 and 4 illustrate that VO x /SiO2 catalysts are more active and selective than VO x /Al2O3 catalysts. The differences in activity and selectivity between VO x /SiO2 and VO x /Al2O3 confirm the existence of different vanadium species, which are further highlighted by the Raman spectroscopy. From a correlation of the activity and spectroscopic results, it seems that the V2O5 present on silica-supported catalysts is more selective than the polyvanadate groups detected on alumina. Furthermore, the low reactivity of VO x /Al2O3 may be related to the presence of relatively unreactive polymerized surface vanadia species. A change in the support provides indirect evidence for the role of the bridging V–O–support bonds in determining the catalyst activity and the homogeneity or heterogeneity of the sulfoxidation reaction. Since vanadium bonds to alumina are known to be stronger than in silica [26,34], an extremely strong bond with the surface seems to be detrimental to the activity and selectivity. However, an extremely weak bond, as in the case of VO x /SiO2 aerogels, leads to significant leaching of active vanadium species. The best compromise between catalytic performance (better with weaker bonds) and stability (better with stronger bonds) seems to be the VO x /SiO2 xerogel system, whose medium strength V–O–Si bonds give rise to a stable solid with high catalytic activity and excellent sulfoxide selectivity. 3.4 Heterogeneous reactions with H2O2 Finally, it is of interest to assess the stability of vanadium in the H2O2/MeOH medium. This study was carried out on the calcined catalysts with the highest vanadium loading. The results presented in Table 5 show that the use of calcined silica-based catalysts gives a thioanisole conversion higher than 90% in just a few minutes. The test for leaching showed that this activity is due to the presence of homogeneous catalyst from vanadium leaching. The ready solubility of vanadium in the presence of H2O2 (compared to TBHP) is probably due to the formation of the peroxovanadium complex 1, which is more stable than peroxyvanadium complex 2 [6]. The calcined alumina xerogel leads to a lower conversion with H2O2 than with TBHP. The selectivity is also significantly reduced and is even lower than that obtained in the non-catalyzed homogeneous reaction. The calcined alumina aerogel shows a better activity, but again this is due in part to leaching of active vanadium species. The recovery of the aerogel for reuse gave rise to a reduction in activity and also in selectivity. This selectivity is identical to that obtained with the calcined xerogel, which seems to indicate that oxidation on both solids takes place through the same intermediate, probably due to a similarity between the two surface vanadium species. 4 Conclusion VO x /SiO2 and VO x /Al2O3 catalysts with different V/M (Si, Al) ratios were prepared by a sol–gel method. The effect of the support, the drying mode (xerogel or aerogel), the V/M ratio and calcination were studied in the oxidation of thioanisole. Catalytic tests showed that VO x /SiO2 xerogels are the most active and selective systems, with a thioanisole conversion of 98% and a sulfoxide/sulfone ratio of 97/3. On the other hand, VO x /SiO2 aerogels are very active but less selective than xerogels, although this high activity is due to vanadium leaching in the solution. The stability of vanadium on the catalysts depends on the vanadium-support interaction, which is weaker in aerogels than in xerogels. In the range of V/Si ratios selected we did not notice any effect of calcination on the thioanisole oxidation and only the drying mode has a critical effect on the vanadium stability. VO x /Al2O3 catalysts are less active and less selective than VO x /SiO2 catalysts. This difference in activity and selectivity with the change in support indicates the role of the bridging V–O–support bonds. Raman spectroscopy shows the existence of crystalline V2O5 on the silica support and polyvanadates on the alumina support–these findings explain the differences in activity and selectivity. The low activity of VO x /Al2O3 could be related to the presence of relatively unreative polymerized surface vanadia species. Complexation of vanadium species by different oxidants, such as H2O2 or TBHP, involves the formation of diverse peroxovanadium species that give rise to distinct activity and selectivity. This observation indicates that activity and selectivity are related, not only to the vanadium species but also to the peroxovanadium species. The use of different oxidants indicates that vanadium is not stable toward leaching, particularly with H2O2. References [1] M.C. Carreño Chem. Rev. 95 1995 1717 [2] W. Adam W. Malisch K.J. Roschmann C.R. Saha-Möller W.A. Schenk J. Organomet. Chem. 661 2002 3 [3] V. Conte F. Di Furia S. Moro J. Mol. Catal. A: Chem. 120 1997 93 [4] M.R. Maurya Coord. Chem. Rev. 237 2003 163 [5] V. Conte F. Di Furia G. Licini Appl. Catal. A: Gen. 157 1997 335 [6] J. Hartung M. Greb J. Organomet. Chem. 661 2002 67 [7] A.G.J. Legtenbarg R. Hage B.L. Feringa Coord. Chem. Rev. 237 2003 89 [8] C. Bolm Coord. Chem. Rev. 237 2003 245 [9] M. Ziolek Catal. Today 90 2004 145 150 [10] J.M. Fraile J.I. García B. Lázaro J.A. Mayoral Chem. Commun. 1998 1807 [11] M. Iwamato Y. Tanaka J. Hirosumi N. Kita S. Triwahyono Microp. Mesop. Mater. 48 2001 271 [12] V. Hulea P. Moreau J. Mol. Catal A: Chem. 113 1996 499 [13] V. Hulea P. Moreau F. Di Renzo J. Mol. Catal A: Chem. 111 1996 325 [14] R.S. Reddy J.S. Reddy R. Kumar P. Kumar Chem. Commun. 1992 84 [15] O.A. Kholdeeva A.Y. Derevyankin A.N. Shmakov N.N. Trukhan E.A. Paukshits A. Tuel V. Romannikov J. Mol. Catal. A: Chem. 158 2000 417 [16] M.L. Kantam B. Neelima Ch.V. Reddy M.K. Chaudhuri S.K. Dehury Catal. Lett. 95 2004 19 [17] N.N. Trukhan A.Y. Derevyankin A.N. Shmakov E.A. Paukshits O.A. Kholdeeva V. Romannikov Microp. Mesop. Mater. 44–45 2001 603 [18] A. Fuerte M. Iglesias F. Sánchez A. Corma J. Mol. Catal. A: Chem. 211 2004 227 [19] I.W.C.E. Arends A. Sheldon Appl. Catal. A: Gen. 212 2001 175 187 [20] L. Davies P. McMorn D. Bethell P.C. Bulman Page F. King F.E. Hancock G.J. Hutchings Chem. Commun. 2000 1807 [21] L. Davies P. McMorn D. Bethell P.C. Bulman Page F. King F.E. Hancock G.J. Hutchings Phys. Chem. Chem. Phys. 3 2001 632 [22] A. Baiker P. Dollenmeiller M. Glinski A. Reller V.K. Sharma J. Catal. 111 1988 273 [23] R. Neumann M. Levin-Elad Appl. Catal A: Gen. 122 1995 85 [24] N. Moussa A. Ghorbel P. Grange J. Sol–gel Sci. Technol. 33 2005 127 [25] L. Baraket A. Ghorbel J. Sol–gel Sci. Technol. 19 2000 89 [26] B.M. Weckhuysen D.E. Keller Catal. Today 78 2003 25 [27] M.L. Ferreira M. Volpe J. Mol. Catal. A: Chem. 164 2000 290 [28] A. Khodakov B. Olthof A.T. Bell E. Iglesia J. Catal. 181 1999 205 [29] I.E. Wachs B.M. Weckhuysen Appl. Catal. A: Gen. 157 1997 67 [30] K. Inumaru M. Misono T. Okuhara Appl. Catal. A: Gen. 149 1997 133 [31] I.E. Wachs Y. Chen J.M. Jehng L.E. Briand T. Tanaka Catal. Today 78 2003 13 [32] K. Routary K.R.S.K. Reddy G. Deo Appl. Catal. A: Gen. 265 2004 103 [33] G.T. Went S.T. Oyama A.T. Bell J. Phys. Chem. 94 1990 4240 [34] N. Magg B. Immaraporn J.B. Giorgi T. Schroeder M. Bäumer J. Döbler Z. Wu E. Kondratenko M. Cherian M. Baerns P.C. Stair J. Sauer H.-J. Freund J. Catal. 226 2004 88 [35] M.D. Argyl K. Chen A.T. Bell E. Iglesia J. Catal. 208 2002 139 [36] I.E. Wachs Catal. Today 100 2005 79 [37] S.T. Oyama G.T. Went K.B. Lewis A.T. Bell G.A. Somorjai J. Phys. Chem. 93 1989 6786 [38] I.E. Wachs J. Catal. 124 1990 570 [39] B. Olthof A. Khodakov A.T. Bell E. Iglesia J. Phys. Chem. B 104 2000 1516 [40] D.A. Bulushev L. Kiwi-Minsker F. Rainone A. Renken J. Catal. 205 2002 115 [41] O.R. Evans A.T. Bell T.D. Tilley J. Catal. 226 2004 292 [42] T. Garcia B. Solsona D.M. Murphy K.L. Antcliff S.H. Taylor J. Catal. 229 2005 1 [43] S. Shylesh A.P. Singh J. Catal. 233 2005 359 [44] I.E. Wachs Catal. Today 27 1996 437",
      "scopus-id": "33746198764",
      "coredata": {
        "eid": "1-s2.0-S1381116906007345",
        "dc:description": "The catalytic oxidation of thioanisole to the sulfoxide and sulfone using TBHP or H2O2 as oxidants in CH2Cl2 or MeOH as solvents was carried out over VO x /SiO2 or VO x /Al2O3 catalysts prepared by a sol–gel method. It was found that the catalytic activity and selectivity of the reaction depended on the nature of the support (SiO2 or Al2O3), the drying mode (xerogel or aerogel), the calcination of the solid and the vanadium-peroxide species formed. The TBHP/CH2Cl2 system gave a very high activity and selectivity, mainly in the cases of vanadia-silica xerogels, with total thioanisole conversion and a sulfoxide/sulfone ratio of 97/3. This activity was truly heterogeneous but vanadium leaching was observed with vanadia-silica aerogels. In contrast, vanadia-alumina catalysts were less active and less selective. The use of the H2O2/MeOH system led to vanadium leaching with all types of catalysts.",
        "openArchiveArticle": "false",
        "prism:coverDate": "2006-08-01",
        "openaccessUserLicense": null,
        "prism:aggregationType": "Journal",
        "prism:url": "https://api.elsevier.com/content/article/pii/S1381116906007345",
        "dc:creator": [
          {
            "@_fa": "true",
            "$": "Moussa, N."
          },
          {
            "@_fa": "true",
            "$": "Fraile, José M."
          },
          {
            "@_fa": "true",
            "$": "Ghorbel, A."
          },
          {
            "@_fa": "true",
            "$": "Mayoral, José A."
          }
        ],
        "link": [
          {
            "@_fa": "true",
            "@rel": "self",
            "@href": "https://api.elsevier.com/content/article/pii/S1381116906007345"
          },
          {
            "@_fa": "true",
            "@rel": "scidir",
            "@href": "https://www.sciencedirect.com/science/article/pii/S1381116906007345"
          }
        ],
        "dc:format": "application/json",
        "openaccessType": null,
        "pii": "S1381-1169(06)00734-5",
        "prism:volume": "255",
        "prism:publisher": "Elsevier B.V.",
        "dc:title": "Catalytic oxidation of thioanisole Ph–S–CH3 over VO x /SiO2 and VO x /Al2O3 catalysts prepared by sol–gel method",
        "prism:copyright": "Copyright © 2006 Elsevier B.V. All rights reserved.",
        "openaccess": "0",
        "prism:issn": "13811169",
        "prism:issueIdentifier": "1-2",
        "dcterms:subject": [
          {
            "@_fa": "true",
            "$": "VO x /SiO2"
          },
          {
            "@_fa": "true",
            "$": "VO x /Al2O3"
          },
          {
            "@_fa": "true",
            "$": "Sol–gel"
          },
          {
            "@_fa": "true",
            "$": "Xerogel"
          },
          {
            "@_fa": "true",
            "$": "Aerogel"
          },
          {
            "@_fa": "true",
            "$": "Sulfoxidation"
          },
          {
            "@_fa": "true",
            "$": "Peroxide"
          },
          {
            "@_fa": "true",
            "$": "Leaching"
          }
        ],
        "openaccessArticle": "false",
        "prism:publicationName": "Journal of Molecular Catalysis A: Chemical",
        "prism:number": "1-2",
        "openaccessSponsorType": null,
        "prism:pageRange": "62-68",
        "prism:endingPage": "68",
        "pubType": "fla",
        "prism:coverDisplayDate": "1 August 2006",
        "prism:doi": "10.1016/j.molcata.2006.04.010",
        "prism:startingPage": "62",
        "dc:identifier": "doi:10.1016/j.molcata.2006.04.010",
        "openaccessSponsorName": null
      },
      "objects": {
        "object": [
          {
            "@category": "standard",
            "@height": "63",
            "@width": "323",
            "@_fa": "true",
            "$": "https://api.elsevier.com/content/object/eid/1-s2.0-S1381116906007345-gr1.jpg?httpAccept=%2A%2F%2A",
            "@multimediatype": "JPEG image file",
            "@type": "IMAGE-DOWNSAMPLED",
            "@size": "7320",
            "@ref": "gr1",
            "@mimetype": "image/jpeg"
          },
          {
            "@category": "thumbnail",
            "@height": "24",
            "@width": "125",
            "@_fa": "true",
            "$": "https://api.elsevier.com/content/object/eid/1-s2.0-S1381116906007345-gr1.sml?httpAccept=%2A%2F%2A",
            "@multimediatype": "GIF image file",
            "@type": "IMAGE-THUMBNAIL",
            "@size": "606",
            "@ref": "gr1",
            "@mimetype": "image/gif"
          },
          {
            "@category": "standard",
            "@height": "99",
            "@width": "193",
            "@_fa": "true",
            "$": "https://api.elsevier.com/content/object/eid/1-s2.0-S1381116906007345-gr2.jpg?httpAccept=%2A%2F%2A",
            "@multimediatype": "JPEG image file",
            "@type": "IMAGE-DOWNSAMPLED",
            "@size": "6421",
            "@ref": "gr2",
            "@mimetype": "image/jpeg"
          },
          {
            "@category": "thumbnail",
            "@height": "64",
            "@width": "125",
            "@_fa": "true",
            "$": "https://api.elsevier.com/content/object/eid/1-s2.0-S1381116906007345-gr2.sml?httpAccept=%2A%2F%2A",
            "@multimediatype": "GIF image file",
            "@type": "IMAGE-THUMBNAIL",
            "@size": "1172",
            "@ref": "gr2",
            "@mimetype": "image/gif"
          },
          {
            "@category": "standard",
            "@height": "268",
            "@width": "352",
            "@_fa": "true",
            "$": "https://api.elsevier.com/content/object/eid/1-s2.0-S1381116906007345-gr3.jpg?httpAccept=%2A%2F%2A",
            "@multimediatype": "JPEG image file",
            "@type": "IMAGE-DOWNSAMPLED",
            "@size": "30017",
            "@ref": "gr3",
            "@mimetype": "image/jpeg"
          },
          {
            "@category": "thumbnail",
            "@height": "94",
            "@width": "123",
            "@_fa": "true",
            "$": "https://api.elsevier.com/content/object/eid/1-s2.0-S1381116906007345-gr3.sml?httpAccept=%2A%2F%2A",
            "@multimediatype": "GIF image file",
            "@type": "IMAGE-THUMBNAIL",
            "@size": "3039",
            "@ref": "gr3",
            "@mimetype": "image/gif"
          },
          {
            "@category": "standard",
            "@height": "284",
            "@width": "356",
            "@_fa": "true",
            "$": "https://api.elsevier.com/content/object/eid/1-s2.0-S1381116906007345-gr4.jpg?httpAccept=%2A%2F%2A",
            "@multimediatype": "JPEG image file",
            "@type": "IMAGE-DOWNSAMPLED",
            "@size": "32884",
            "@ref": "gr4",
            "@mimetype": "image/jpeg"
          },
          {
            "@category": "thumbnail",
            "@height": "93",
            "@width": "117",
            "@_fa": "true",
            "$": "https://api.elsevier.com/content/object/eid/1-s2.0-S1381116906007345-gr4.sml?httpAccept=%2A%2F%2A",
            "@multimediatype": "GIF image file",
            "@type": "IMAGE-THUMBNAIL",
            "@size": "3190",
            "@ref": "gr4",
            "@mimetype": "image/gif"
          },
          {
            "@category": "standard",
            "@height": "266",
            "@width": "360",
            "@_fa": "true",
            "$": "https://api.elsevier.com/content/object/eid/1-s2.0-S1381116906007345-gr5.jpg?httpAccept=%2A%2F%2A",
            "@multimediatype": "JPEG image file",
            "@type": "IMAGE-DOWNSAMPLED",
            "@size": "37866",
            "@ref": "gr5",
            "@mimetype": "image/jpeg"
          },
          {
            "@category": "thumbnail",
            "@height": "92",
            "@width": "125",
            "@_fa": "true",
            "$": "https://api.elsevier.com/content/object/eid/1-s2.0-S1381116906007345-gr5.sml?httpAccept=%2A%2F%2A",
            "@multimediatype": "GIF image file",
            "@type": "IMAGE-THUMBNAIL",
            "@size": "3744",
            "@ref": "gr5",
            "@mimetype": "image/gif"
          },
          {
            "@category": "standard",
            "@height": "270",
            "@width": "366",
            "@_fa": "true",
            "$": "https://api.elsevier.com/content/object/eid/1-s2.0-S1381116906007345-gr6.jpg?httpAccept=%2A%2F%2A",
            "@multimediatype": "JPEG image file",
            "@type": "IMAGE-DOWNSAMPLED",
            "@size": "34095",
            "@ref": "gr6",
            "@mimetype": "image/jpeg"
          },
          {
            "@category": "thumbnail",
            "@height": "92",
            "@width": "125",
            "@_fa": "true",
            "$": "https://api.elsevier.com/content/object/eid/1-s2.0-S1381116906007345-gr6.sml?httpAccept=%2A%2F%2A",
            "@multimediatype": "GIF image file",
            "@type": "IMAGE-THUMBNAIL",
            "@size": "3631",
            "@ref": "gr6",
            "@mimetype": "image/gif"
          },
          {
            "@category": "standard",
            "@height": "344",
            "@width": "355",
            "@_fa": "true",
            "$": "https://api.elsevier.com/content/object/eid/1-s2.0-S1381116906007345-gr7.jpg?httpAccept=%2A%2F%2A",
            "@multimediatype": "JPEG image file",
            "@type": "IMAGE-DOWNSAMPLED",
            "@size": "29929",
            "@ref": "gr7",
            "@mimetype": "image/jpeg"
          },
          {
            "@category": "thumbnail",
            "@height": "93",
            "@width": "96",
            "@_fa": "true",
            "$": "https://api.elsevier.com/content/object/eid/1-s2.0-S1381116906007345-gr7.sml?httpAccept=%2A%2F%2A",
            "@multimediatype": "GIF image file",
            "@type": "IMAGE-THUMBNAIL",
            "@size": "2372",
            "@ref": "gr7",
            "@mimetype": "image/gif"
          },
          {
            "@category": "standard",
            "@height": "296",
            "@width": "358",
            "@_fa": "true",
            "$": "https://api.elsevier.com/content/object/eid/1-s2.0-S1381116906007345-gr8.jpg?httpAccept=%2A%2F%2A",
            "@multimediatype": "JPEG image file",
            "@type": "IMAGE-DOWNSAMPLED",
            "@size": "25198",
            "@ref": "gr8",
            "@mimetype": "image/jpeg"
          },
          {
            "@category": "thumbnail",
            "@height": "94",
            "@width": "113",
            "@_fa": "true",
            "$": "https://api.elsevier.com/content/object/eid/1-s2.0-S1381116906007345-gr8.sml?httpAccept=%2A%2F%2A",
            "@multimediatype": "GIF image file",
            "@type": "IMAGE-THUMBNAIL",
            "@size": "2465",
            "@ref": "gr8",
            "@mimetype": "image/gif"
          },
          {
            "@category": "standard",
            "@height": "108",
            "@width": "326",
            "@_fa": "true",
            "$": "https://api.elsevier.com/content/object/eid/1-s2.0-S1381116906007345-fx1.jpg?httpAccept=%2A%2F%2A",
            "@multimediatype": "JPEG image file",
            "@type": "IMAGE-DOWNSAMPLED",
            "@size": "10903",
            "@ref": "fx1",
            "@mimetype": "image/jpeg"
          },
          {
            "@category": "thumbnail",
            "@height": "41",
            "@width": "125",
            "@_fa": "true",
            "$": "https://api.elsevier.com/content/object/eid/1-s2.0-S1381116906007345-fx1.sml?httpAccept=%2A%2F%2A",
            "@multimediatype": "GIF image file",
            "@type": "IMAGE-THUMBNAIL",
            "@size": "748",
            "@ref": "fx1",
            "@mimetype": "image/gif"
          }
        ]
      },
      "link": {
        "@rel": "abstract",
        "@href": "https://api.elsevier.com/content/abstract/scopus_id/33746198764"
      }
    }
  }
}