{
  "metadata": {
    "title": "The effect of carbon monoxide on the oligomerization of acetylene in hydrogen over a Ni/SiO<ce:inf loc=post>2</ce:inf> catalyst",
    "authors": "; ; ",
    "journal": "Journal of Molecular Catalysis A: Chemical",
    "date": "2009-07-15",
    "doi": "10.1016/j.molcata.2009.03.004",
    "abstract": "",
    "uri": "https://api.elsevier.com/content/article/pii/S1381116909001265",
    "pii": "S1381116909001265"
  },
  "fulltext": {
    "full-text-retrieval-response": {
      "scopus-eid": "2-s2.0-66849109372",
      "originalText": "serial JL 271358 291210 291744 291790 291809 31 Journal of Molecular Catalysis A: Chemical JOURNALMOLECULARCATALYSISACHEMICAL 2009-03-20 2009-03-20 2010-04-16T17:45:36 1-s2.0-S1381116909001265 S1381-1169(09)00126-5 S1381116909001265 10.1016/j.molcata.2009.03.004 S300 S300.2 FULL-TEXT 1-s2.0-S1381116909X00099 2015-05-15T05:56:33.307883-04:00 0 0 20090715 2009 2009-03-20T00:00:00Z articleinfo crossmark dco dateupdated tomb dateloaded datesearch indexeddate issuelist volumelist yearnav absattachment articletitlenorm authfirstinitialnorm authfirstsurnamenorm cid cids contenttype copyright dateloadedtxt docsubtype doctype doi eid ewtransactionid hubeid issfirst issn issnnorm itemstage itemtransactionid itemweight openaccess openarchive pg pgfirst pglast pii piinorm pubdatestart pubdatetxt pubyr sectiontitle sortorder srctitle srctitlenorm srctype subheadings volfirst volissue webpdf webpdfpagecount figure table body acknowledge affil articletitle auth authfirstini authfull authkeywords authlast primabst ref specialabst alllist content subj ssids 1381-1169 13811169 307 307 1 2 1 2 Volume 307, Issues 1–2 5 13 20 13 20 20090715 15 July 2009 2009-07-15 2009 Regular papers article fla Crown copyright © 2009 Published by Elsevier B.V. All rights reserved. EFFECTCARBONMONOXIDEOLIGOMERIZATIONACETYLENEINHYDROGENOVERANISIO2CATALYST TRIMM D 1 Introduction 2 Experimental 3 Results 3.1 Catalyst characteristics and activity for CO hydrogenation 3.2 The effect of carbon monoxide on deactivation during acetylene oligomerization 3.3 The effect of carbon monoxide on selectivity to C1–C4 products 3.4 Effect of carbon monoxide on the composition of the liquid fraction 3.5 Effect of carbon monoxide on subsequent hydrogenation over Pt/SiO2 placed downstream 4 Discussion 5 Conclusions Acknowledgements References 2004 FISCHERTROPSCHTECHNOLOGY HALL 2002 59 K HALL 2005 243 K PETERS 1932 423 K PETROV 1934 300 A ANTSUS 1944 317 L SHERIDAN 1945 133 J TRIMM 2007 309 D TRIMM 2008 63 D VANNICE 1977 228 M VENEZIA 1997 463 A LEE 1986 472 C PEREIRA 1994 135 E VANMEERTEN 1982 29 R DALMON 1983 45 J CHEN 2002 147 P HWANG 2003 499 K TANG 2004 13300 D RIOUX 2008 1 R RIOUX 2008 198 R DEMUTH 1979 365 J LAPINSKI 1990 4599 M BAO 1994 722 S WEINELT 1995 9709 M SHEPPARD 1998 181 N HAUG 2001 11480 K LEHWALD 1979 425 S DEMUTH 1980 127 J STROSCIO 1984 499 J ZAERA 1987 4318 F NEUBAUER 2003 1710 R VATTUONE 2000 1 L BROWN 1999 21 W FAHMI 1997 53 A MEDLIN 2003 217 J GODA 2006 11823 A STUDT 2008 1320 F SPIEWAK 1995 17640 B SHEN 1997 2735 J PODKOLZIN 2004 217 S SHETH 2005 12449 P STUCKLESS 1993 2202 J DERROUICHE 2006 208 S NIKLASSON 1988 1370 C GUIMON 2003 199 C NIESKENS 2006 1068 D JACKSON 1998 29 S YANG 2006 118 S MA 1999 345 A SONG 1999 193 Z TRIMMX2009X13 TRIMMX2009X13X20 TRIMMX2009X13XD TRIMMX2009X13X20XD item S1381-1169(09)00126-5 S1381116909001265 1-s2.0-S1381116909001265 10.1016/j.molcata.2009.03.004 271358 2010-09-21T22:46:00.842353-04:00 2009-07-15 1-s2.0-S1381116909001265-main.pdf https://s3.amazonaws.com/prod-ucs-content-store-us-east/content/pii:S1381116909001265/MAIN/application/pdf/8f818ec37f486515a81b3f48299ff16e/main.pdf https://s3-eu-west-1.amazonaws.com/prod-ucs-content-store-eu-west/content/pii:S1381116909001265/MAIN/application/pdf/8f818ec37f486515a81b3f48299ff16e/main.pdf main.pdf pdf true 1036061 MAIN 8 1-s2.0-S1381116909001265-main_1.png https://s3.amazonaws.com/prod-ucs-content-store-us-east/content/pii:S1381116909001265/PREVIEW/image/png/e39ac80010ccb1d8768ecc5a92c2bf39/main_1.png https://s3-eu-west-1.amazonaws.com/prod-ucs-content-store-eu-west/content/pii:S1381116909001265/PREVIEW/image/png/e39ac80010ccb1d8768ecc5a92c2bf39/main_1.png main_1.png png 84981 849 656 IMAGE-WEB-PDF 1 1-s2.0-S1381116909001265-sc1.jpg https://s3.amazonaws.com/prod-ucs-content-store-us-east/content/pii:S1381116909001265/sc1/DOWNSAMPLED/image/jpeg/250e76a4f201c82528e7f42532289393/sc1.jpg https://s3-eu-west-1.amazonaws.com/prod-ucs-content-store-eu-west/content/pii:S1381116909001265/sc1/DOWNSAMPLED/image/jpeg/250e76a4f201c82528e7f42532289393/sc1.jpg sc1 sc1.jpg jpg 9761 103 323 IMAGE-DOWNSAMPLED 1-s2.0-S1381116909001265-sc1.sml https://s3.amazonaws.com/prod-ucs-content-store-us-east/content/pii:S1381116909001265/sc1/THUMBNAIL/image/gif/898de39dce947f9f90c4892856029489/sc1.sml https://s3-eu-west-1.amazonaws.com/prod-ucs-content-store-eu-west/content/pii:S1381116909001265/sc1/THUMBNAIL/image/gif/898de39dce947f9f90c4892856029489/sc1.sml sc1 sc1.sml sml 2296 70 219 IMAGE-THUMBNAIL 1-s2.0-S1381116909001265-sc2.jpg https://s3.amazonaws.com/prod-ucs-content-store-us-east/content/pii:S1381116909001265/sc2/DOWNSAMPLED/image/jpeg/a8eb1d73e08986b371a90211e86f8bc8/sc2.jpg https://s3-eu-west-1.amazonaws.com/prod-ucs-content-store-eu-west/content/pii:S1381116909001265/sc2/DOWNSAMPLED/image/jpeg/a8eb1d73e08986b371a90211e86f8bc8/sc2.jpg sc2 sc2.jpg jpg 5188 60 278 IMAGE-DOWNSAMPLED 1-s2.0-S1381116909001265-sc2.sml https://s3.amazonaws.com/prod-ucs-content-store-us-east/content/pii:S1381116909001265/sc2/THUMBNAIL/image/gif/088ccb0412d85ad7eda171f5597e2d33/sc2.sml https://s3-eu-west-1.amazonaws.com/prod-ucs-content-store-eu-west/content/pii:S1381116909001265/sc2/THUMBNAIL/image/gif/088ccb0412d85ad7eda171f5597e2d33/sc2.sml sc2 sc2.sml sml 1664 47 219 IMAGE-THUMBNAIL 1-s2.0-S1381116909001265-gr1.jpg https://s3.amazonaws.com/prod-ucs-content-store-us-east/content/pii:S1381116909001265/gr1/DOWNSAMPLED/image/jpeg/c2bd86a3e704efb1b7d9e4599fcfc648/gr1.jpg https://s3-eu-west-1.amazonaws.com/prod-ucs-content-store-eu-west/content/pii:S1381116909001265/gr1/DOWNSAMPLED/image/jpeg/c2bd86a3e704efb1b7d9e4599fcfc648/gr1.jpg gr1 gr1.jpg jpg 84408 275 553 IMAGE-DOWNSAMPLED 1-s2.0-S1381116909001265-gr1.sml https://s3.amazonaws.com/prod-ucs-content-store-us-east/content/pii:S1381116909001265/gr1/THUMBNAIL/image/gif/f3a915adac52e55440bcbdcd69dba9a8/gr1.sml https://s3-eu-west-1.amazonaws.com/prod-ucs-content-store-eu-west/content/pii:S1381116909001265/gr1/THUMBNAIL/image/gif/f3a915adac52e55440bcbdcd69dba9a8/gr1.sml gr1 gr1.sml sml 5641 109 219 IMAGE-THUMBNAIL 1-s2.0-S1381116909001265-gr2.jpg https://s3.amazonaws.com/prod-ucs-content-store-us-east/content/pii:S1381116909001265/gr2/DOWNSAMPLED/image/jpeg/dcd7673f88a2a0ec5e754cac67702a5e/gr2.jpg https://s3-eu-west-1.amazonaws.com/prod-ucs-content-store-eu-west/content/pii:S1381116909001265/gr2/DOWNSAMPLED/image/jpeg/dcd7673f88a2a0ec5e754cac67702a5e/gr2.jpg gr2 gr2.jpg jpg 13982 304 312 IMAGE-DOWNSAMPLED 1-s2.0-S1381116909001265-gr2.sml https://s3.amazonaws.com/prod-ucs-content-store-us-east/content/pii:S1381116909001265/gr2/THUMBNAIL/image/gif/dc0b8d655fbb11f9adac16898274d2d0/gr2.sml https://s3-eu-west-1.amazonaws.com/prod-ucs-content-store-eu-west/content/pii:S1381116909001265/gr2/THUMBNAIL/image/gif/dc0b8d655fbb11f9adac16898274d2d0/gr2.sml gr2 gr2.sml sml 2314 164 168 IMAGE-THUMBNAIL 1-s2.0-S1381116909001265-gr3.jpg https://s3.amazonaws.com/prod-ucs-content-store-us-east/content/pii:S1381116909001265/gr3/DOWNSAMPLED/image/jpeg/0c9dc218f3d2ef1fbdd1bb802ff27867/gr3.jpg https://s3-eu-west-1.amazonaws.com/prod-ucs-content-store-eu-west/content/pii:S1381116909001265/gr3/DOWNSAMPLED/image/jpeg/0c9dc218f3d2ef1fbdd1bb802ff27867/gr3.jpg gr3 gr3.jpg jpg 37901 294 595 IMAGE-DOWNSAMPLED 1-s2.0-S1381116909001265-gr3.sml https://s3.amazonaws.com/prod-ucs-content-store-us-east/content/pii:S1381116909001265/gr3/THUMBNAIL/image/gif/90f22a1c0ed0dcd10a40cbcacb313aba/gr3.sml https://s3-eu-west-1.amazonaws.com/prod-ucs-content-store-eu-west/content/pii:S1381116909001265/gr3/THUMBNAIL/image/gif/90f22a1c0ed0dcd10a40cbcacb313aba/gr3.sml gr3 gr3.sml sml 3437 108 219 IMAGE-THUMBNAIL 1-s2.0-S1381116909001265-gr4.jpg https://s3.amazonaws.com/prod-ucs-content-store-us-east/content/pii:S1381116909001265/gr4/DOWNSAMPLED/image/jpeg/651f45a25cd467925e17c9d65dae0b06/gr4.jpg https://s3-eu-west-1.amazonaws.com/prod-ucs-content-store-eu-west/content/pii:S1381116909001265/gr4/DOWNSAMPLED/image/jpeg/651f45a25cd467925e17c9d65dae0b06/gr4.jpg gr4 gr4.jpg jpg 17147 317 317 IMAGE-DOWNSAMPLED 1-s2.0-S1381116909001265-gr4.sml https://s3.amazonaws.com/prod-ucs-content-store-us-east/content/pii:S1381116909001265/gr4/THUMBNAIL/image/gif/dddf48b152a3263405927b18a5dc94e6/gr4.sml https://s3-eu-west-1.amazonaws.com/prod-ucs-content-store-eu-west/content/pii:S1381116909001265/gr4/THUMBNAIL/image/gif/dddf48b152a3263405927b18a5dc94e6/gr4.sml gr4 gr4.sml sml 2516 164 164 IMAGE-THUMBNAIL 1-s2.0-S1381116909001265-gr5.jpg https://s3.amazonaws.com/prod-ucs-content-store-us-east/content/pii:S1381116909001265/gr5/DOWNSAMPLED/image/jpeg/3b75d6e3ecb39d041721ab03161ab037/gr5.jpg https://s3-eu-west-1.amazonaws.com/prod-ucs-content-store-eu-west/content/pii:S1381116909001265/gr5/DOWNSAMPLED/image/jpeg/3b75d6e3ecb39d041721ab03161ab037/gr5.jpg gr5 gr5.jpg jpg 15597 314 318 IMAGE-DOWNSAMPLED 1-s2.0-S1381116909001265-gr5.sml https://s3.amazonaws.com/prod-ucs-content-store-us-east/content/pii:S1381116909001265/gr5/THUMBNAIL/image/gif/fbbf08833557e33320d25191b14d080d/gr5.sml https://s3-eu-west-1.amazonaws.com/prod-ucs-content-store-eu-west/content/pii:S1381116909001265/gr5/THUMBNAIL/image/gif/fbbf08833557e33320d25191b14d080d/gr5.sml gr5 gr5.sml sml 2250 164 166 IMAGE-THUMBNAIL 1-s2.0-S1381116909001265-gr6.jpg https://s3.amazonaws.com/prod-ucs-content-store-us-east/content/pii:S1381116909001265/gr6/DOWNSAMPLED/image/jpeg/23e53167d671a0b0a3ef0644429724df/gr6.jpg https://s3-eu-west-1.amazonaws.com/prod-ucs-content-store-eu-west/content/pii:S1381116909001265/gr6/DOWNSAMPLED/image/jpeg/23e53167d671a0b0a3ef0644429724df/gr6.jpg gr6 gr6.jpg jpg 19812 346 360 IMAGE-DOWNSAMPLED 1-s2.0-S1381116909001265-gr6.sml https://s3.amazonaws.com/prod-ucs-content-store-us-east/content/pii:S1381116909001265/gr6/THUMBNAIL/image/gif/2a35e24fe4dc0cdcd525e48ce29530fa/gr6.sml https://s3-eu-west-1.amazonaws.com/prod-ucs-content-store-eu-west/content/pii:S1381116909001265/gr6/THUMBNAIL/image/gif/2a35e24fe4dc0cdcd525e48ce29530fa/gr6.sml gr6 gr6.sml sml 3219 163 170 IMAGE-THUMBNAIL 1-s2.0-S1381116909001265-gr7.jpg https://s3.amazonaws.com/prod-ucs-content-store-us-east/content/pii:S1381116909001265/gr7/DOWNSAMPLED/image/jpeg/40f3f783aeb1c289e6920130851f2a11/gr7.jpg https://s3-eu-west-1.amazonaws.com/prod-ucs-content-store-eu-west/content/pii:S1381116909001265/gr7/DOWNSAMPLED/image/jpeg/40f3f783aeb1c289e6920130851f2a11/gr7.jpg gr7 gr7.jpg jpg 26588 375 360 IMAGE-DOWNSAMPLED 1-s2.0-S1381116909001265-gr7.sml https://s3.amazonaws.com/prod-ucs-content-store-us-east/content/pii:S1381116909001265/gr7/THUMBNAIL/image/gif/a34a4ea50c4c425a45c880721ccd0b32/gr7.sml https://s3-eu-west-1.amazonaws.com/prod-ucs-content-store-eu-west/content/pii:S1381116909001265/gr7/THUMBNAIL/image/gif/a34a4ea50c4c425a45c880721ccd0b32/gr7.sml gr7 gr7.sml sml 3312 164 157 IMAGE-THUMBNAIL 1-s2.0-S1381116909001265-gr8.jpg https://s3.amazonaws.com/prod-ucs-content-store-us-east/content/pii:S1381116909001265/gr8/DOWNSAMPLED/image/jpeg/5e3f040af6fe249b17aef87b3fc71462/gr8.jpg https://s3-eu-west-1.amazonaws.com/prod-ucs-content-store-eu-west/content/pii:S1381116909001265/gr8/DOWNSAMPLED/image/jpeg/5e3f040af6fe249b17aef87b3fc71462/gr8.jpg gr8 gr8.jpg jpg 18820 316 317 IMAGE-DOWNSAMPLED 1-s2.0-S1381116909001265-gr8.sml https://s3.amazonaws.com/prod-ucs-content-store-us-east/content/pii:S1381116909001265/gr8/THUMBNAIL/image/gif/39bc4d4b7bc0e6ea5cb60fb8b725651c/gr8.sml https://s3-eu-west-1.amazonaws.com/prod-ucs-content-store-eu-west/content/pii:S1381116909001265/gr8/THUMBNAIL/image/gif/39bc4d4b7bc0e6ea5cb60fb8b725651c/gr8.sml gr8 gr8.sml sml 2687 163 164 IMAGE-THUMBNAIL 1-s2.0-S1381116909001265-gr9.jpg https://s3.amazonaws.com/prod-ucs-content-store-us-east/content/pii:S1381116909001265/gr9/DOWNSAMPLED/image/jpeg/947697b5e0cc9d2b336d1c066691a861/gr9.jpg https://s3-eu-west-1.amazonaws.com/prod-ucs-content-store-eu-west/content/pii:S1381116909001265/gr9/DOWNSAMPLED/image/jpeg/947697b5e0cc9d2b336d1c066691a861/gr9.jpg gr9 gr9.jpg jpg 30388 358 369 IMAGE-DOWNSAMPLED 1-s2.0-S1381116909001265-gr9.sml https://s3.amazonaws.com/prod-ucs-content-store-us-east/content/pii:S1381116909001265/gr9/THUMBNAIL/image/gif/5629b63d174f4579df8b505117567a06/gr9.sml https://s3-eu-west-1.amazonaws.com/prod-ucs-content-store-eu-west/content/pii:S1381116909001265/gr9/THUMBNAIL/image/gif/5629b63d174f4579df8b505117567a06/gr9.sml gr9 gr9.sml sml 4132 164 169 IMAGE-THUMBNAIL 1-s2.0-S1381116909001265-gr10.jpg https://s3.amazonaws.com/prod-ucs-content-store-us-east/content/pii:S1381116909001265/gr10/DOWNSAMPLED/image/jpeg/ef84bcce5c53b907cf211b3d9037165f/gr10.jpg https://s3-eu-west-1.amazonaws.com/prod-ucs-content-store-eu-west/content/pii:S1381116909001265/gr10/DOWNSAMPLED/image/jpeg/ef84bcce5c53b907cf211b3d9037165f/gr10.jpg gr10 gr10.jpg jpg 34637 300 343 IMAGE-DOWNSAMPLED 1-s2.0-S1381116909001265-gr10.sml https://s3.amazonaws.com/prod-ucs-content-store-us-east/content/pii:S1381116909001265/gr10/THUMBNAIL/image/gif/0f16defec8dfed45854fb4fff1961356/gr10.sml https://s3-eu-west-1.amazonaws.com/prod-ucs-content-store-eu-west/content/pii:S1381116909001265/gr10/THUMBNAIL/image/gif/0f16defec8dfed45854fb4fff1961356/gr10.sml gr10 gr10.sml sml 3375 163 187 IMAGE-THUMBNAIL 1-s2.0-S1381116909001265-fx1.jpg https://s3.amazonaws.com/prod-ucs-content-store-us-east/content/pii:S1381116909001265/fx1/DOWNSAMPLED/image/jpeg/6cebe4437712d1fb2dceee88e6c054cf/fx1.jpg https://s3-eu-west-1.amazonaws.com/prod-ucs-content-store-eu-west/content/pii:S1381116909001265/fx1/DOWNSAMPLED/image/jpeg/6cebe4437712d1fb2dceee88e6c054cf/fx1.jpg fx1 true fx1.jpg jpg 8827 141 376 IMAGE-DOWNSAMPLED 1-s2.0-S1381116909001265-fx1.sml https://s3.amazonaws.com/prod-ucs-content-store-us-east/content/pii:S1381116909001265/fx1/THUMBNAIL/image/gif/21872c1a641a5f16c124b9fe4737abcf/fx1.sml https://s3-eu-west-1.amazonaws.com/prod-ucs-content-store-eu-west/content/pii:S1381116909001265/fx1/THUMBNAIL/image/gif/21872c1a641a5f16c124b9fe4737abcf/fx1.sml fx1 true fx1.sml sml 1618 82 219 IMAGE-THUMBNAIL MOLCAA 7484 S1381-1169(09)00126-5 10.1016/j.molcata.2009.03.004 Fig. 1 Product distribution versus time on stream for reaction over Ni/SiO2 at 200°C in the absence and presence of carbon monoxide. (A) With feed comprising 25% C2H2/65% H2/10% N2 with total flow rate of 50cm3/min; (B) with feed of 25% C2H2/65% H2/2% CO/8% N2 with the same total flow. Fig. 2 Effect of carbon monoxide on maximum acetylene conversion and acetylene conversion after 300min of reaction at 200°C for feed comprising 25% C2H2/65% H2/x% CO/(10− x)% N2 with total flow rate of 50cm3/min. Fig. 3 Selectivity versus time on stream for reaction over Ni/SiO2 at 200°C in the absence and presence of 2% CO. (A) With feed comprising 25% C2H2/65% H2/10% N2 with total flow rate of 50cm3/min; (B) with feed of 25% C2H2/65% H2/2% CO/8% N2 with the same total flow. Fig. 4 Dependence of average selectivity on % CO during reaction over Ni/SiO2 at 200°C using mixtures with composition 25% C2H2/65% H2/x% CO/(10− x)% N2 and a total flow rate of 50cm3/min. Fig. 5 Effect of % CO on alkane production for C2–C4 products of the reaction of 25% C2H2/65% H2/x% CO/(10− x)% N2 mixtures over Ni/SiO2 at 200°C with total flow rate of 50cm3/min. Fig. 6 Full range chromatograms of the liquids produced by reaction at 200°C. (A) With feed comprising 25% C2H2/65% H2/10% N2 with total flow rate of 50cm3/min; (B) with feed of 25% C2H2/65% H2/2% CO/8% N2 with the same total flow. Fig. 7 C6 regions of the chromatograms shown in Fig. 6. Minor numbered peaks as follows: (3) 2-ethyl-1-butene; (4) mixture of trans-2, cis-3 and trans-3-hexene; (5) cis-3-methyl-2-pentene; (8) cis-2-methyl-1,3-pentadiene; (9) C6-diene; (11) 5-methyl-1,3-cyclopentadiene; (12) cis-3-methyl-1,3-pentadiene. Fig. 8 Effect of CO on distribution between C6 products in liquids formed during reaction of 25% C2H2/65% H2/x% CO/(10− x)% N2 mixtures over Ni/SiO2 at 200°C. Total flow rate of 50cm3/min. Fig. 9 C8 regions of the chromatograms shown in Fig. 6. Fig. 10 Effect of CO on the C6 region of chromatograms of liquids formed during reaction over 200mg Ni/SiO2 with 200mg of 2% Pt/SiO2 downstream at 200°C. (A) When using a feed comprising 25% C2H2/75% H2 with a total flow rate of 50cm3/min; (B) when using a feed comprising 25% C2H2/70% H2/5% CO at the same total flow. Scheme 1 . Scheme 2 . Table 1 Effect of CO on carbon number distribution (in %) for liquid products. a . Retention time range (min) Carbon number range % CO in feed 0 2 5 10 4.65–9.24 C6 +C7 8 17 14 20 9.24–16.02 “C8” b 21 29 25 30 16.02–21.60 “C9 +C10” c 22 21 20 21 21.60–50.00 “C11 +” c 49 34 41 29 a Obtained by integration of FID chromatograms of the form shown in Fig. 6 between the time limits shown. b Includes toluene and branched nonenes with retention times less than that of p-xylene (16.02min). c See text for qualifications as to carbon numbers. Table 2 Effect of CO on overall selectivity (in %) for gaseous and liquid products combined. a . Fraction % CO in feed 0 0.5 2 5 10 CH4 2.2 1.0 0.9 0.8 0.9 C2 51 47 41 37 38 C3 +C4 16 22 21 22 22 C5–C10 24 26 31 32 34 C11+ 7 5 6 8 6 a As % of acetylene reacted. Calculated by combination of data for the distribution within liquid fractions alone (Table 1) with that for the overall distribution (such as that shown in Fig. 1). The effect of carbon monoxide on the oligomerization of acetylene in hydrogen over a Ni/SiO2 catalyst David L. Trimm a ⁎ Irene O.Y. Liu b Noel W. Cant c a CSIRO Petroleum, Clayton South, VIC 3169, Australia b School of Chemical Sciences and Engineering, The University of New South Wales, Sydney, NSW 2053, Australia c Department of Chemistry and Biomolecular Sciences, Macquarie University, NSW 2119, Australia ⁎ Corresponding author. Graphical abstract Carbon monoxide has two effects on the reaction of acetylene–hydrogen mixtures over a Ni/SiO2 catalyst. Although it does not react, it improves acetylene conversion, initially and with time, and increases the selectivity to C4 and higher products at the expense of ethylene and ethane by approximately 10%. The effect of small amounts of carbon monoxide on the oligomerization of acetylene over a low loaded Ni/SiO2 catalyst has been investigated. Although CO does not participate in the reaction it has two beneficial effects if oligomer products are desired. Conversion of acetylene is higher, both initially and over time, and the selectivity to C4–C10 product is improved relative to C2 hydrogenation. Higher products are predominantly aliphatic alkenes. CO increases formation of branched products relative to linear ones and dienes relative to alkenes while suppressing benzene and higher aromatics. In the absence of CO, unsaturated products can be largely hydrogenated to alkanes if a Pt/SiO2 catalyst is located immediately downstream the Ni/SiO2 but the hydrogenation of dienes and trienes proceeds only as far as alkenes when the feed contains CO. The twin effects of CO can be interpreted on the basis that CO competes for nickel sites that would otherwise be able to accept hydrogen atoms from H2 or C2H2. The Ni/SiO2 catalyst was sensitive to feed impurities such as phosphine present in some grades of acetylene but deactivation was not complete. Keywords Acetylene oligomerization Carbon monoxide Ni/SiO2 catalyst Deactivation Product distribution 1 Introduction The conversion of natural gas to synthetic liquid fuels is a well-established process with commercial plants now operating in South Africa, Malaysia and Qatar and another very large plant under construction in Qatar. All use the Fischer–Tropsch route with methane converted first to a mixture of carbon monoxide and hydrogen (syngas) and then to hydrocarbons over an iron- or cobalt-based catalyst [1]. However the process is not well suited to small or medium sized offshore gas deposits because the size and nature of the plant precludes installation on floating platforms. A route that might be more suitable is the pyrolysis of methane to acetylene/ethylene mixtures followed by conversion to liquid fuel as patented recently by Hall et al. [2–4]. The initial report emphasised direct oligomerization of acetylene [5] but a later publication envisaged the selective hydrogenation of acetylene to ethylene followed by ethylene oligomerization [6]. The oligomerization of acetylene in a hydrogen carrier over high nickel content catalysts was first described in the 1930s and 1940s [7–10]. In recent work we have shown that 2% Ni/SiO2 is more stable than catalysts containing more nickel on carriers such as zeolites and alumina [11]. Complete conversion of acetylene was possible at temperatures as low as 140°C with ca. 27% of the acetylene converted to C5+ material, 15% to a C4 fraction and most of the remainder to ethylene. This raised the possibility of using oligomerization to strip acetylene from a methane pyrolysis stream with the ethylene produced then further oligomerized to synthetic fuel in a second stage. In addition to acetylene and ethylene, methane pyrolysis streams can contain carbon monoxide if water is used to moderate carbon formation and/or to quench the product stream at high temperature. The aim of the present work was to determine if these other components affected acetylene oligomerization over a low-loaded Ni/SiO2 catalyst. Our previous work showed that the product distribution from the oligomerisation of acetylene in hydrogen alone was extremely complex with considerable quantities of branched and linear products and also of molecules with an odd number of carbon atoms [12]. Alkenes dominated, followed by alkanes and dienes with a low yield of aromatics. The present studies show that carbon monoxide affects this distribution in a beneficial way—both in terms of product distribution and in terms of catalyst activity over time. 2 Experimental Full details of the catalyst preparation, characterisation, testing and analytical procedures can be found in reference [12]. In essence, 200mg samples of the Ni/SiO2 catalyst were held in a 6mm I.D. Pyrex reactor mounted vertically. Liquid products were collected in a lower receiver cooled to 0°C. Samples of the liquid accumulated over the period of reaction were analysed by GC–MS and by FID–GC using identical Rtx-1 capillary columns programmed at the same rate. The identity of compounds responsible for particular peaks were established by measurements of elusion orders relative to it in extensive literature tabulations of Kovats indices for the same type of column [12]. The identity of two isomers of particular interest, cis- and trans-3-methyl-1,3-pentadiene, was also verified by matching product chromatograms against that of a mixture of the two isomers, the composition of which was established by proton NMR [12]. Gases passing through the ice trap were analysed on line with two additional chromatographs, one for C1, C2 and iso-C4 compounds, the other for individual C1, C2, C3 and C4 compounds plus C5 and C6+ components as partially resolved envelopes. The Ni/SiO2 catalysts were made in batches of 5g by incipient wetness impregnation of silica gel (Davison grade 62, surface area 285m2/g, particle size 75–250μm) using a solution of Ni(NO3)2 of concentration such that the final Ni content of the catalyst was 2.0wt%. After drying, each batch of catalyst was calcined in air. The 200mg samples to be tested were then reduced in the reactor according to a set program that ended with 3h in pure hydrogen at 450°C. In some experiments, 200mg samples of 2wt% Pt/SiO2 made similarly, were located below the Ni/SiO2 and were co-reduced in the reactor at the same time. The standard feed stream comprised 25% C2H2, 65–75% H2, 0–10% CO, with N2 as the balance gas as needed. The mixtures were made up using separate mass flow controllers arranged to give a total flow rate of 50cm3/min. The acetylene was instrument grade containing <2ppm of PH3, H2S and NH3 taken together. It also contained some acetone, which passed over the Ni/SiO2 without reaction but was hydrogenated on Pt/SiO2 (if present) to the extent noted previously [12]. One-off experiments were also carried out using a less pure grade of acetylene known to contain much higher concentrations of phosphine as explained in Section 3.2. 3 Results 3.1 Catalyst characteristics and activity for CO hydrogenation As described previously [12], the surface area of the nickel particles in the reduced samples was typically 1.1m2/g(catalyst) based on CO uptake measurements with an average metal particle diameter of ∼9nm (as measured by TEM and XRD), equivalent to a dispersion of ∼10%. The XRD patterns of some reduced samples showed small quantities of NiO but it was unclear if the NiO was a consequence of incomplete reduction or of re-oxidation while exposed to air before and during the determination of the diffraction pattern. The activity of the Ni/SiO2 for hydrogenation of CO was determined using a 10% CO, 65% H2, balance N2 mixture at the standard flow rate of 50cm3/min. After 2h of reaction, the conversion of CO over 200mg of Ni/SiO2 at 200°C was 0.8% based on the sum of the methane and ethane produced (with selectivities of 84% and 16% respectively). The conversion is equivalent to a turnover frequency of 3.3×10−3 molecules (CO) per surface Ni atom per second. The range expected by extrapolation of literature data for low dispersion catalysts measured at temperatures from 240 to 275°C [13–16] is 0.8 to 3×10−3/s, calculated assuming an activation energy of 100kJ/mol and kinetic orders of −0.4 in CO and 0.9 in H2 [17,18]. 3.2 The effect of carbon monoxide on deactivation during acetylene oligomerization Preliminary tests show that the differences brought about by the presence of CO were most pronounced at a reaction temperature of 200°C. Fig. 1 compares reaction characteristics over time when using 25% C2H2, 65% H2 feeds with and without 2% CO. The conversion of C2H2 was clearly greater when CO was present and the quantity of higher products (C3–C6 vapors and liquids condensable at 0°C) considerably larger. The data for the two experiments were assembled on the basis that the liquid products, collected as a single fraction over the entire period of reaction, were produced at intermediate times at rates proportional to the conversion of acetylene. The overall mole balances are quite good bearing in mind this assumption, the need to allow for the 30–50% reduction in flow rate that accompanied reaction, and the summation of more than 10 individual C1–C4 compounds and many more C5 and C6 products in unresolved envelopes. The calculations also exclude the deposition of carbonaceous matter on the catalysts (1–2% of the acetylene fed over the 300min of reaction) that may have been deposited non-uniformly over time. The difference in product distribution between Fig. 1A and B was not due to the contribution of products formed by the reaction of CO since, within the accuracy of the measurements, no CO reacted, and nor would methanation be expected on the basis of the tests described above. Indeed the yield of methane was less when CO was present (∼0.8%) than in its absence (∼1.5%). Thus the effect on product distribution must be a consequence of the influence of CO on the C2H2/H2 reaction itself. Experiments with other concentrations of CO at 200°C showed that both the maximum acetylene conversion attained, and the conversion noted after 300min of reaction increased with the CO concentrations up to 5% CO and then plateaued or declined slightly (Fig. 2 ). The effect of 5% CO was also tested at 150 and 170°C. At both temperatures the conversion of C2H2 was complete for the standard 300min of reaction, as found previously for reaction at 140°C [12], and the effect of CO on catalyst deactivation could not be assessed. However the effect on product distribution was qualitatively the same as that at 200°C, i.e. proportionally more C4, C6 and higher products were produced with CO present. Unlike CO, inclusion of water (2%) had no discernible effect on the extent of acetylene hydrogenation at 200°C. Likewise ethylene had little effect when added at the 20% level. For example, when using a 1:1:3 C2H2/C2H4/H2 mixture, the percentage of the C2H2 unreacted after 300min of reaction at 200°C was 24% compared with 25% in a matching experiment with a 1:1:3 C2H2/N2/H2 feed. Net ethylene production [i.e. C2H4(in) less C2H4(out)] was also similar, 39% when the feed contained ethylene versus 36% when it was not, and ethane formation was also similar (6% and 5% respectively). During screening it was also found that the Ni/SiO2 catalyst was sensitive to the impurities present in industrial grade acetylene. When using a welding grade acetylene, stated by the supplier to contain approximately 600ppm PH3, 10ppm H2S, 40ppm NH3 and possibly some AsH3, the conversion at 150°C fell steeply from 100% to 25% over the period between 60 and 100min of operation and then more gradually to a plateau of 20%. 3.3 The effect of carbon monoxide on selectivity to C1–C4 products Fig. 3 shows the data in Fig. 1 plotted in terms of selectivity (the percentage of acetylene converted to a particular product relative to that converted to all products). The selectivity to each product was largely independent of time from 100min of reaction onwards despite considerable changes in C2H2 conversion. Given this relative constancy, the intrinsic effect of CO on product distribution was conveniently assessed in terms of the conversion averaged over the period from 100 to 300min of reaction. As shown in Fig. 4 , the average selectivity to C2 products (ethane+ethylene) fell from just over 50% in the absence of CO to ∼38% with 10% CO in the feed, with most of the change already apparent when 2% CO was present. Conversely the selectivities to C4, C6 and liquid products all increased from less than 15% to between 16% and 20%. Selectivities to the minor C3 and C5 products showed little change, consistent with the conclusion that CO was not incorporated to make hydrocarbons, but that to methane almost halved. In addition to affecting the overall product selectivity in the above ways, CO had a clear effect on the alkane to alkene ratio as shown in Fig. 5 . The percentage of ethane relative to ethane+ethylene taken together fell from 15% in the absence of CO to 7% when 10% CO was present. The yield of alkane was also lower for C3 and C4 products but the fall-off with increasing percentage of CO was less pronounced. Irrespective of CO concentration, the distribution within C4 products was always highly olefinic and far from equilibrium. For the experiments on which Figs. 4 and 5 are based, the composition of this fraction with 2%, 5% and 10% CO present was 1-butene ≅37%, cis-2-butene also ≅37%, isobutene ≅12%, trans-2-butene ≅7%, 1,3-butadiene ≅7%, n-butane ≅2% and isobutane <0.5%. The selectivity to 1-butene was somewhat higher (46%), and that to cis-2-butene was correspondingly lower (24%), in the absence of CO. 3.4 Effect of carbon monoxide on the composition of the liquid fraction Fig. 6 compares the flame ionization detector (FID) chromatogram of the liquid collected at 0°C during the experiment carried out in the absence of CO with that obtained when 2% CO was present in the feed. Clearly CO caused an increase in the intensities of peaks due to C6 products relative to those for C8 products. A reduction in the extended envelope of C11–C18 is equally obvious. The chromatograms of liquids produced by experiments with 5% and 10% CO presence were qualitatively similar to that in Fig. 6B. Integration of the chromatograms to obtain the product distribution by carbon number was inevitably somewhat arbitrary due to overlaps in the retention times of molecules with different carbon numbers and small drifts in baseline during elution. Table 1 shows the relative amounts calculated using the best compromise for retention time cut-offs. Note that the fraction denoted “C8” actually includes toluene, which eluted with a retention time (∼10.1min) that was longer than those for some low-boiling branched octenes that were formed in small amounts and eluted earlier than 10min. The “C8” fraction also includes a small number of branched nonenes that eluted before p-xylene. Similarly the “C9 +C10” fraction may include some low boiling branched C11 alkenes, and the “C11+” fraction some high boiling C10 polyenes and aromatics. The data show, in general terms, that CO doubles the amounts of the C6 +C7 fraction, and increases that of the “C8” fraction to a lesser extent, with a corresponding decrease in “C11+” material—but the trend is rather irregular due to the uncertainties in integration. Carbon monoxide also altered the distribution between individual products with the same carbon number as shown in Fig. 7 for C6 compounds identified with certainty by GC–MS and other means as described in Section 2 and reference [12]. For reasons of clarity, the naming of compounds on the figure has been restricted to the major products. The names of other numbered products are given in the legend and a list identifying more minor products can be found in our earlier work [12]. Most significantly, carbon monoxide reduced the extent to which benzene (peak 14) was formed in relative terms, increased formation of trans-3-methyl-1,3-pentadiene (peak 13) but decreased that of 1,3,5-hexatrienes (peak 10). The tendency of CO to favour production of branched products over linear ones was also apparent amongst the principal C6 alkenes with more 3-methyl-1-pentene (peak 1) relative to 1-hexene (peak 2) and cis-2-hexene (peak 6). This behaviour extended to higher CO concentrations (Fig. 8 ) and to the product distribution within the “C8” region (Fig. 9 ) where the relative amounts of toluene, ethylbenzene, styrene and the sum of the o- and m-xylene formed all fell in relative terms when 2% (or more) CO was present. 3.5 Effect of carbon monoxide on subsequent hydrogenation over Pt/SiO2 placed downstream As part of our previous work it was shown that the unsaturated products produced by acetylene oligomerization over Ni/SiO2 could be largely hydrogenated to alkanes at 140°C if an equal weight of Pt/SiO2 was placed immediately downstream [12]. In the absence of CO this was found also to be possible at 200°C in the present work. As shown in Fig. 10A, n-hexane (peak a1), formed by the hydrogenation of linear C6 alkenes and polyenes, and 3-methylpentane (peak a2), formed from their branched counterparts, were the major products. The dienes and trienes responsible for peaks 8–13 in the chromatogram of the product from oligomerization over Ni/SiO2 alone (Fig. 7A) were removed completely. The extent of hydrogenation over Pt/SiO2 was much less when the feed contained 5% CO (Fig. 10B). The polyenes formed over Ni/SiO2 alone (Fig. 7B) were still largely hydrogenated, although traces did remain, but production of alkanes was almost non-existent. The alkenes increased to the largest amount by hydrogenation were trans- and cis-3-methyl-2-pentene (peaks 7 and 5), formed by the hydrogenation of the corresponding dienes (peaks 13 and 12 respectively), and 1-hexene (peak 6) from linear hexadienes and trienes. The same pattern was apparent for higher products (not shown). In the absence of CO, the C8 alkenes and trienes formed during oligomerization over Ni/SiO2 alone (Fig. 9A) were largely hydrogenated to alkanes, the most important of which were 3-methylheptane, 3-ethylhexane and n-octane as found previously [12]. With CO present only polyenes (peaks denoted by 4 in Fig. 9B) were hydrogenated and then only as far the corresponding alkenes (numbered 2 and 3). The absence of hydrogenation of alkenes to alkanes in the presence of CO is to be expected given the many definitive studies showing that CO is a very strong inhibitor of ethylene hydrogenation over Pt, both silica-supported and as single crystals [19–23]. 4 Discussion Under the conditions employed here, the inclusion of carbon monoxide aided the conversion of acetylene to oligomers in two ways. It allowed higher conversion (Fig. 2) and increased the yields of useful fractions (Fig. 1). As shown in Table 2 , calculated by combination of data for gaseous and liquid products, the selectivity to LPG (C3 +C4) was raised from 16% to 22% and that of the gasoline fraction (C5–C10) from 24% to 34%. These increases occurred almost entirely at the expense of hydrogenation to C2 products, since formation of diesel components (C11+) was little changed. The increase in oligomerization can be explained in the following way. Acetylene adsorbs molecularly on bare nickel surfaces at low temperature [24–29] but dissociates readily to form ethynyl (HCC) and/or methylidyne (HC≡) species at or below room temperature and then carbon at still higher temperature [30–34]. The initial heat of adsorption to form the dissociated species is in the range 190–250kJ/mol [35,36]. The heat of adsorption of the molecular species has not been measured but calculations give values in the range 180–285kJ/mol [37–40]. By contrast the dissociative adsorption of H2 on nickel has a heat of 80kJ/mol [41,42]. While binding energies may be substantially lower at the high coverages present during hydrogenation the difference in bond strength will remain. Thus under hydrogenation conditions using C2H2 and H2 alone, the nickel surface should be largely covered by acetylene and its fragments together with other spectator species such as ethylidyne (CH3C≡) and vinylidene (H2CC), as described in recent DFT studies of the Pt(111) and Pd(111) systems [43,44]. Adsorption of H2 should be restricted to gaps between the more strongly bound hydrocarbon species. The initial heat of adsorption of carbon monoxide on nickel is ∼130kJ/mol [41,42,45,46] which infers that it is not expected to displace acetylene but should adsorb in preference to H2. Thus H2 dissociation should be inhibited, and the availability of surface hydrogen atoms is less, when CO is present. Inhibition of H2 dissociation by CO in the absence of acetylene is well established for Ni/SiO2 from H2/D2 exchange measurements [47]. If less surface hydrogen is available, and oligomerization follows a chain growth mechanism as found previously [12], then the probability of termination of surface *C2 or higher *C2n intermediates (hydrogen content omitted) to form the corresponding C2 or C2n gaseous products should be reduced relative to that of chain propagation to the next highest surface intermediate *C2n +2. This will favour production of higher molecular weight products as observed. Likewise, if the surface hydrogen concentration is lower then one would expect a lesser extent of hydrogenation of alkenes to alkanes, in agreement with the data in Fig. 5 (Scheme 1 ). Although the presence of CO increased the yield of oligomers from C4 to C10 (Table 2), the effect did not persist to still higher carbon numbers. Indeed, as is clearly evident from the chromatograms in Fig. 6, the product spectrum is distinctly truncated above C10. There are two possible explanations. One is that the additional crowding introduced by the adsorption of CO at gaps between hydrocarbon species hinders the growth of long chains. While various ways by which this might occur can be envisaged, we know of no literature data to support the proposition. An alternative possibility is that the lower surface hydrogen concentration with CO present leads to an increase in multiple unsaturation, and hence to greater reactivity amongst larger molecules, resulting in condensation to products that are deposited on the catalyst as carbonaceous matter. Such loss to the catalyst would truncate the distribution in the liquid fraction as observed. There is experimental support for this idea. As noted in Section 3.2, some acetylene was lost as carbonaceous deposits on the catalysts. While the proportion was small in terms of the acetylene fed (1–2%) it was substantial relative to the weight of catalyst and varied with the CO content. In the absence of CO the weight gain over 5h of reaction was typically 20% (i.e. ten times the weight of Ni present). This gain is in line with the microbalance data of Guimon et al. [48] that showed a gain of 0.2mg (coke)/mg(catalyst) over 3h of reaction at 175°C using a 15% C2H2/60% H2 feed. In our experiments the weight gain was considerably greater with CO present—approximately 40% over 5h when the feed contained 10% CO. Indeed the increase to mass was visibly obvious. Over the course of reaction, the catalyst bed grew in length by an amount commensurate with the gain in weight. Given the larger amount of deposited material it is somewhat surprising that inclusion of CO did not induce deactivation but conferred higher conversion, both initially and over the course of reaction (Figs. 1 and 2). The implication is that this type of deposited material is located on the support or in some other form that does not block reaction sites on the nickel surface.The origin of the beneficial effect of CO on overall conversion is not obvious but one possible explanation is as follows. The C2H2 +H2 reaction as studied here is somewhat unusual in that the conversion, both initially and over time, is lower at higher temperatures [12]. This is possible if the activation energies of reactions producing deactivating species are higher than that of the reaction itself. Methylidyne and carbidic carbon, the most stable decomposition products of acetylene, are possible deactivating species. The path to such species on nickel surfaces is not certain but on Ni(100) the dissociation appears to be sequential, acetylene to ethynyl (CCH) to methylidyne and carbon [34], as also indicated by calculations for a Rh(100) surface [49]. Formation of ethynyl can be represented in the following way with the surface species depicted in diσ/diπ form as is the case for the adsorption of acetylene on a Ni(111) surface [26] (Scheme 2 ). The dissociation of adsorbed acetylene to form the ethynyl species requires transfer of H to an adjacent vacant site (*) and hence would be hindered by co-adsorbed CO. In this way carbon monoxide could hinder acetylene dissociation and hence the production of deactivating species. The lesser amount of CH4 formed under steady state conditions, 0.8% with CO present versus 1.5% in its absence (Fig. 3), is consistent with this interpretation. The inhibition of C2H2 dissociation by CO should be particularly effective when the pretreated catalysts containing bare nickel surfaces are first contacted with the reaction mixture. The initial sticking probabilities for C2H2 and CO are similar (each 0.7–0.8 [35,36,45]) so some of the C2H2 first adsorbed will have adsorbed CO as instantaneous nearest neighbours and this will lessen the probability of dissociation to form carbon on active sites. The higher initial activity for acetylene oligomerization with CO present may be a consequence of this effect. The above explanations for the twin effects of CO, higher activity overall and a favouring of LPG and gasoline fractions, are linked. In both cases CO competes for surface sites that can accept hydrogen atoms, in the first instance from acetylene, in the second from molecular hydrogen dissociation. The explanation is also consistent with the data of Jackson and Hodgson [50] for the co-adsorption of CO and propyne on Ni/Al2O3 at 300°C. Adsorption of CO was strongly suppressed by propyne. Even so, CO restricted the formation of methane through the decomposition of propyne favouring self-hydrogenation to propene and the continued deposition of carbonaceous material in amounts that greatly exceeded the nickel surface area and were thought to have migrated to the support. The incomplete deactivation caused by impurities in welding grade acetylene is likely to be caused by the conversion of Ni particles to Ni2P given the work of Yang et al. [51] which shows that phosphine, the principle impurity present, reacts readily with Ni at 150°C and above. The retention of some activity by the phosphided catalyst is not surprising given reports that amorphous nickel–phosphorus alloys have considerable activity for the selective hydrogenation of acetylene [52,53]. 5 Conclusions Although carbon monoxide does not participate directly in acetylene oligomerization over Ni/SiO2, its presence has two beneficial effects. It improves the conversion, both initially and over time, and improves the selectivity to useful LPG and gasoline range products over C2 products. However the favouring of oligomer production is not apparent above C10. Methane and higher alkanes are always minor products and carbon monoxide increases the dominance by alkenes amongst C2–C4 products while lowering methane further. Carbon monoxide also alters the distribution of products in condensable material. Amongst C6 products, it favours branched products over linear ones and dienes relative to alkenes while disfavouring benzene (and also higher aromatics). The major benefits of CO can be explained by current knowledge concerning adsorption on nickel surfaces on the basis that carbon monoxide competes for adsorption sites that would otherwise be available to accept hydrogen atoms derived by the dissociation of hydrogen or acetylene. If the concentration of hydrogen atoms at the surface is lower, then propagation of surface species should be favoured relative to termination to gaseous products. If acetylene dissociation is disfavoured then less surface carbon will ensue and activity should be higher as a result. The truncation of production of oligomers greater than C10 is most likely a reflection of the condensation of highly unsaturated products to carbonaceous material on the support given that the gain in catalyst weight during reaction is higher when carbon monoxide is present. Acknowledgements One of us (DLT) is most grateful to the Australian Research Council for the award of a Federation Fellowship and to the CSIRO and the University of New South Wales for the provision of the associated research funding that supported this project. References [1] A.P. Steynberg M.E. Dry Fischer–Tropsch Technology Studies in Surface Science and Catalysis vol. 152 2004 Elsevier Amsterdam [2] K.R. Hall, J.A. Bullin, P.T. Eubank, A. Akgerman, R.G. Anthony, United States Patent 6,130,260 (2000). [3] K.R. Hall, J.A. Bullin, P.T. Eubank, A. Akgerman, R.G. Anthony, United States Patent 6,323,247 (2001). [4] K.R. Hall, J.A. Bullin, P.T. Eubank, A. Akgerman, R.G. Anthony, United States Patent 6,602,920 (2003). [5] K.R. Hall A. Akgerman R.G. Anthony P.T. Eubank J.A. Bullin J.G. Cantrell B.R. Weber J. Betsill APPEA J. 2002 59 [6] K.R. Hall Catal. Today 106 2005 243 [7] K. Peters L. Neumann Ges. Abhandl. Kenntnis Kohle 11 1932 423 [8] A.D. Petrov L.I. Antsus Dokl. Akad. Nauk. SSSR, Ser. A 4 1934 300 [9] L.I. Antsus A.D. Petrov Petroleum Refiner 23 1944 317 [10] J. Sheridan J. Chem. Soc. 1945 133 [11] D. Trimm I. Liu N. Cant Stud. Surf. Sci. Catal. 172 2007 309 [12] D.L. Trimm I.O.Y. Liu N.W. Cant J. Mol. Catal. A 288 2008 63 [13] M.A. Vannice J. Catal. 50 1977 228 [14] A.M. Venezia A. Parmaliana A. Mezzapica G. Deganello J. Catal. 172 1997 463 [15] C. Lee L.D. Schmidt J.F. Moulder T.W. Rusch J. Catal. 99 1986 472 [16] E.B. Pereira G.A. Martin Appl. Catal. A: Gen. 115 1994 135 [17] R.Z.C. van Meerten J.G. Vollenbroek M.H.J.M. de Croon P.F.M.T. van Nisselrooy J.W.E. Coenen Appl. Catal. 3 1982 29 [18] J.A. Dalmon G.A. Martin J. Catal. 84 1983 45 [19] P. Chen S. Westerberg K.Y. Kung J. Zhu J. Grunes G.A. Somorjai Appl. Catal. A: Gen. 229 2002 147 [20] K.S. Hwang M. Yang J. Zhu J. Grunes G.A. Somorjai J. Mol. Catal. A 204–205 2003 499 [21] D.C. Tang K.S. Hwang M. Sameron G.A. Somorjai J. Phys. Chem. B 108 2004 13300 [22] R.M. Rioux R. Komor H. Song J.D. Hoefelmeyer M. Grass K. Niesz P. Yang G.A. Somorjai J. Catal. 254 2008 1 [23] R.M. Rioux J.D. Hoefelmeyer M. Grass H. Song K. Niesz P. Yang G.A. Somorjai Langmuir 24 2008 198 [24] J.E. Demuth H. Ibach Surf. Sci. 85 1979 365 [25] M.P. Lapinski J.G. Ekerdt J. Phys. Chem. 94 1990 4599 [26] S. Bao P. Hofmann K.-M. Schindler V. Fritzsche A.M. Bradshaw D.P. Woodruff C. Casado M.C. Asencio Surf. Sci. 307–309 1994 722 [27] M. Weinelt W. Huber P. Zebisch H.-P. Steinruck P. Ulbright U. Birkenheuer J.C. Boettger N. Rosch J. Chem. Phys. 102 1995 9709 [28] N. Sheppard C. De La Cruz Adv. Catal. 42 1998 181 [29] K.L. Haug T. Burgi M. Gostein T.R. Trautmann S.T. Ceyer J. Phys. Chem. B 105 2001 11480 [30] S. Lehwald H. Ibach Surf. Sci. 89 1979 425 [31] J.E. Demuth Surf. Sci. 93 1980 127 [32] J.A. Stroscio S.R. Bare W. Ho Surf. Sci. 148 1984 499 [33] F. Zaera R.B. Hall J. Phys. Chem. 91 1987 4318 [34] R. Neubauer C.M. Whelan R. Denecke H.-P. Steinruck J. Chem. Phys. 119 2003 1710 [35] L. Vattuone Y.Y. Yeo R. Kose D.A. King Surf. Sci. 447 2000 1 [36] W.A. Brown R. Kose D.A. King J. Mol. Catal. A 141 1999 21 [37] A. Fahmi R.A. van Santen Surf. Sci. 371 1997 53 [38] J.W. Medlin M.D. Allendorf J. Phys. Chem. B 107 2003 217 [39] A.M. Goda M.A. Barteau J.G. Chen J. Phys. Chem. B 110 2006 11823 [40] F. Studt F. Abild-Pederson T. Bligaard R.Z. Sorensen C.H. Christensen J.K. Norskov Science 320 2008 1320 [41] B.E. Spiewak J. Shen J.A. Dumesic J. Phys. Chem. 99 1995 17640 [42] J. Shen B.E. Spiewak J.A. Dumesic Langmuir 13 1997 2735 [43] S.G. Podkolzin R. Alcala J.A. Dumesic J. Mol. Catal. A 218 2004 217 [44] P.A. Sheth M. Neurock C.M. Smith J. Phys. Chem. B 109 2005 12449 [45] J.T. Stuckless N. Al-Sarrat C. Wartnaby D.A. King J. Chem. Phys. 99 1993 2202 [46] S. Derrouiche D. Bianchi Appl. Catal. A: Gen. 313 2006 208 [47] C. Niklasson B. Andersson Ind. Eng. Chem. Res. 27 1988 1370 [48] C. Guimon A. Auroux E. Romero A. Monzon Appl. Catal. A: Gen. 251 2003 199 [49] D.L.S. Nieskens F. Ample-Navarro M.M.M. Jansen D. Curulla-Ferre J. Ricart H. Niemantsverdriet ChemPhysChem 7 2006 1068 [50] S.D. Jackson A. Hodgson React. Kinet. Catal. Lett. 64 1998 29 [51] S. Yang C. Liang R. Prins J. Catal. 237 2006 118 [52] A.-Z. Ma Fenzi Cuihua 13 1999 345 [53] Z. Song Z. Hao D. Tan H. Lei X. Bao W. Sun Z. Min Cuihua Xuebao 20 1999 193",
      "scopus-id": "66849109372",
      "coredata": {
        "eid": "1-s2.0-S1381116909001265",
        "dc:description": "The effect of small amounts of carbon monoxide on the oligomerization of acetylene over a low loaded Ni/SiO2 catalyst has been investigated. Although CO does not participate in the reaction it has two beneficial effects if oligomer products are desired. Conversion of acetylene is higher, both initially and over time, and the selectivity to C4–C10 product is improved relative to C2 hydrogenation. Higher products are predominantly aliphatic alkenes. CO increases formation of branched products relative to linear ones and dienes relative to alkenes while suppressing benzene and higher aromatics. In the absence of CO, unsaturated products can be largely hydrogenated to alkanes if a Pt/SiO2 catalyst is located immediately downstream the Ni/SiO2 but the hydrogenation of dienes and trienes proceeds only as far as alkenes when the feed contains CO. The twin effects of CO can be interpreted on the basis that CO competes for nickel sites that would otherwise be able to accept hydrogen atoms from H2 or C2H2. The Ni/SiO2 catalyst was sensitive to feed impurities such as phosphine present in some grades of acetylene but deactivation was not complete.",
        "openArchiveArticle": "false",
        "prism:coverDate": "2009-07-15",
        "openaccessUserLicense": null,
        "prism:aggregationType": "Journal",
        "prism:url": "https://api.elsevier.com/content/article/pii/S1381116909001265",
        "dc:creator": [
          {
            "@_fa": "true",
            "$": "Trimm, David L."
          },
          {
            "@_fa": "true",
            "$": "Liu, Irene O.Y."
          },
          {
            "@_fa": "true",
            "$": "Cant, Noel W."
          }
        ],
        "link": [
          {
            "@_fa": "true",
            "@rel": "self",
            "@href": "https://api.elsevier.com/content/article/pii/S1381116909001265"
          },
          {
            "@_fa": "true",
            "@rel": "scidir",
            "@href": "https://www.sciencedirect.com/science/article/pii/S1381116909001265"
          }
        ],
        "dc:format": "application/json",
        "openaccessType": null,
        "pii": "S1381-1169(09)00126-5",
        "prism:volume": "307",
        "prism:publisher": "Published by Elsevier B.V.",
        "dc:title": "The effect of carbon monoxide on the oligomerization of acetylene in hydrogen over a Ni/SiO2 catalyst",
        "prism:copyright": "Crown copyright © 2009 Published by Elsevier B.V. All rights reserved.",
        "openaccess": "0",
        "prism:issn": "13811169",
        "prism:issueIdentifier": "1-2",
        "dcterms:subject": [
          {
            "@_fa": "true",
            "$": "Acetylene oligomerization"
          },
          {
            "@_fa": "true",
            "$": "Carbon monoxide"
          },
          {
            "@_fa": "true",
            "$": "Ni/SiO2 catalyst"
          },
          {
            "@_fa": "true",
            "$": "Deactivation"
          },
          {
            "@_fa": "true",
            "$": "Product distribution"
          }
        ],
        "openaccessArticle": "false",
        "prism:publicationName": "Journal of Molecular Catalysis A: Chemical",
        "prism:number": "1-2",
        "openaccessSponsorType": null,
        "prism:pageRange": "13-20",
        "prism:endingPage": "20",
        "pubType": "fla",
        "prism:coverDisplayDate": "15 July 2009",
        "prism:doi": "10.1016/j.molcata.2009.03.004",
        "prism:startingPage": "13",
        "dc:identifier": "doi:10.1016/j.molcata.2009.03.004",
        "openaccessSponsorName": null
      },
      "objects": {
        "object": [
          {
            "@category": "standard",
            "@height": "103",
            "@width": "323",
            "@_fa": "true",
            "$": "https://api.elsevier.com/content/object/eid/1-s2.0-S1381116909001265-sc1.jpg?httpAccept=%2A%2F%2A",
            "@multimediatype": "JPEG image file",
            "@type": "IMAGE-DOWNSAMPLED",
            "@size": "9761",
            "@ref": "sc1",
            "@mimetype": "image/jpeg"
          },
          {
            "@category": "thumbnail",
            "@height": "70",
            "@width": "219",
            "@_fa": "true",
            "$": "https://api.elsevier.com/content/object/eid/1-s2.0-S1381116909001265-sc1.sml?httpAccept=%2A%2F%2A",
            "@multimediatype": "GIF image file",
            "@type": "IMAGE-THUMBNAIL",
            "@size": "2296",
            "@ref": "sc1",
            "@mimetype": "image/gif"
          },
          {
            "@category": "standard",
            "@height": "60",
            "@width": "278",
            "@_fa": "true",
            "$": "https://api.elsevier.com/content/object/eid/1-s2.0-S1381116909001265-sc2.jpg?httpAccept=%2A%2F%2A",
            "@multimediatype": "JPEG image file",
            "@type": "IMAGE-DOWNSAMPLED",
            "@size": "5188",
            "@ref": "sc2",
            "@mimetype": "image/jpeg"
          },
          {
            "@category": "thumbnail",
            "@height": "47",
            "@width": "219",
            "@_fa": "true",
            "$": "https://api.elsevier.com/content/object/eid/1-s2.0-S1381116909001265-sc2.sml?httpAccept=%2A%2F%2A",
            "@multimediatype": "GIF image file",
            "@type": "IMAGE-THUMBNAIL",
            "@size": "1664",
            "@ref": "sc2",
            "@mimetype": "image/gif"
          },
          {
            "@category": "standard",
            "@height": "275",
            "@width": "553",
            "@_fa": "true",
            "$": "https://api.elsevier.com/content/object/eid/1-s2.0-S1381116909001265-gr1.jpg?httpAccept=%2A%2F%2A",
            "@multimediatype": "JPEG image file",
            "@type": "IMAGE-DOWNSAMPLED",
            "@size": "84408",
            "@ref": "gr1",
            "@mimetype": "image/jpeg"
          },
          {
            "@category": "thumbnail",
            "@height": "109",
            "@width": "219",
            "@_fa": "true",
            "$": "https://api.elsevier.com/content/object/eid/1-s2.0-S1381116909001265-gr1.sml?httpAccept=%2A%2F%2A",
            "@multimediatype": "GIF image file",
            "@type": "IMAGE-THUMBNAIL",
            "@size": "5641",
            "@ref": "gr1",
            "@mimetype": "image/gif"
          },
          {
            "@category": "standard",
            "@height": "304",
            "@width": "312",
            "@_fa": "true",
            "$": "https://api.elsevier.com/content/object/eid/1-s2.0-S1381116909001265-gr2.jpg?httpAccept=%2A%2F%2A",
            "@multimediatype": "JPEG image file",
            "@type": "IMAGE-DOWNSAMPLED",
            "@size": "13982",
            "@ref": "gr2",
            "@mimetype": "image/jpeg"
          },
          {
            "@category": "thumbnail",
            "@height": "164",
            "@width": "168",
            "@_fa": "true",
            "$": "https://api.elsevier.com/content/object/eid/1-s2.0-S1381116909001265-gr2.sml?httpAccept=%2A%2F%2A",
            "@multimediatype": "GIF image file",
            "@type": "IMAGE-THUMBNAIL",
            "@size": "2314",
            "@ref": "gr2",
            "@mimetype": "image/gif"
          },
          {
            "@category": "standard",
            "@height": "294",
            "@width": "595",
            "@_fa": "true",
            "$": "https://api.elsevier.com/content/object/eid/1-s2.0-S1381116909001265-gr3.jpg?httpAccept=%2A%2F%2A",
            "@multimediatype": "JPEG image file",
            "@type": "IMAGE-DOWNSAMPLED",
            "@size": "37901",
            "@ref": "gr3",
            "@mimetype": "image/jpeg"
          },
          {
            "@category": "thumbnail",
            "@height": "108",
            "@width": "219",
            "@_fa": "true",
            "$": "https://api.elsevier.com/content/object/eid/1-s2.0-S1381116909001265-gr3.sml?httpAccept=%2A%2F%2A",
            "@multimediatype": "GIF image file",
            "@type": "IMAGE-THUMBNAIL",
            "@size": "3437",
            "@ref": "gr3",
            "@mimetype": "image/gif"
          },
          {
            "@category": "standard",
            "@height": "317",
            "@width": "317",
            "@_fa": "true",
            "$": "https://api.elsevier.com/content/object/eid/1-s2.0-S1381116909001265-gr4.jpg?httpAccept=%2A%2F%2A",
            "@multimediatype": "JPEG image file",
            "@type": "IMAGE-DOWNSAMPLED",
            "@size": "17147",
            "@ref": "gr4",
            "@mimetype": "image/jpeg"
          },
          {
            "@category": "thumbnail",
            "@height": "164",
            "@width": "164",
            "@_fa": "true",
            "$": "https://api.elsevier.com/content/object/eid/1-s2.0-S1381116909001265-gr4.sml?httpAccept=%2A%2F%2A",
            "@multimediatype": "GIF image file",
            "@type": "IMAGE-THUMBNAIL",
            "@size": "2516",
            "@ref": "gr4",
            "@mimetype": "image/gif"
          },
          {
            "@category": "standard",
            "@height": "314",
            "@width": "318",
            "@_fa": "true",
            "$": "https://api.elsevier.com/content/object/eid/1-s2.0-S1381116909001265-gr5.jpg?httpAccept=%2A%2F%2A",
            "@multimediatype": "JPEG image file",
            "@type": "IMAGE-DOWNSAMPLED",
            "@size": "15597",
            "@ref": "gr5",
            "@mimetype": "image/jpeg"
          },
          {
            "@category": "thumbnail",
            "@height": "164",
            "@width": "166",
            "@_fa": "true",
            "$": "https://api.elsevier.com/content/object/eid/1-s2.0-S1381116909001265-gr5.sml?httpAccept=%2A%2F%2A",
            "@multimediatype": "GIF image file",
            "@type": "IMAGE-THUMBNAIL",
            "@size": "2250",
            "@ref": "gr5",
            "@mimetype": "image/gif"
          },
          {
            "@category": "standard",
            "@height": "346",
            "@width": "360",
            "@_fa": "true",
            "$": "https://api.elsevier.com/content/object/eid/1-s2.0-S1381116909001265-gr6.jpg?httpAccept=%2A%2F%2A",
            "@multimediatype": "JPEG image file",
            "@type": "IMAGE-DOWNSAMPLED",
            "@size": "19812",
            "@ref": "gr6",
            "@mimetype": "image/jpeg"
          },
          {
            "@category": "thumbnail",
            "@height": "163",
            "@width": "170",
            "@_fa": "true",
            "$": "https://api.elsevier.com/content/object/eid/1-s2.0-S1381116909001265-gr6.sml?httpAccept=%2A%2F%2A",
            "@multimediatype": "GIF image file",
            "@type": "IMAGE-THUMBNAIL",
            "@size": "3219",
            "@ref": "gr6",
            "@mimetype": "image/gif"
          },
          {
            "@category": "standard",
            "@height": "375",
            "@width": "360",
            "@_fa": "true",
            "$": "https://api.elsevier.com/content/object/eid/1-s2.0-S1381116909001265-gr7.jpg?httpAccept=%2A%2F%2A",
            "@multimediatype": "JPEG image file",
            "@type": "IMAGE-DOWNSAMPLED",
            "@size": "26588",
            "@ref": "gr7",
            "@mimetype": "image/jpeg"
          },
          {
            "@category": "thumbnail",
            "@height": "164",
            "@width": "157",
            "@_fa": "true",
            "$": "https://api.elsevier.com/content/object/eid/1-s2.0-S1381116909001265-gr7.sml?httpAccept=%2A%2F%2A",
            "@multimediatype": "GIF image file",
            "@type": "IMAGE-THUMBNAIL",
            "@size": "3312",
            "@ref": "gr7",
            "@mimetype": "image/gif"
          },
          {
            "@category": "standard",
            "@height": "316",
            "@width": "317",
            "@_fa": "true",
            "$": "https://api.elsevier.com/content/object/eid/1-s2.0-S1381116909001265-gr8.jpg?httpAccept=%2A%2F%2A",
            "@multimediatype": "JPEG image file",
            "@type": "IMAGE-DOWNSAMPLED",
            "@size": "18820",
            "@ref": "gr8",
            "@mimetype": "image/jpeg"
          },
          {
            "@category": "thumbnail",
            "@height": "163",
            "@width": "164",
            "@_fa": "true",
            "$": "https://api.elsevier.com/content/object/eid/1-s2.0-S1381116909001265-gr8.sml?httpAccept=%2A%2F%2A",
            "@multimediatype": "GIF image file",
            "@type": "IMAGE-THUMBNAIL",
            "@size": "2687",
            "@ref": "gr8",
            "@mimetype": "image/gif"
          },
          {
            "@category": "standard",
            "@height": "358",
            "@width": "369",
            "@_fa": "true",
            "$": "https://api.elsevier.com/content/object/eid/1-s2.0-S1381116909001265-gr9.jpg?httpAccept=%2A%2F%2A",
            "@multimediatype": "JPEG image file",
            "@type": "IMAGE-DOWNSAMPLED",
            "@size": "30388",
            "@ref": "gr9",
            "@mimetype": "image/jpeg"
          },
          {
            "@category": "thumbnail",
            "@height": "164",
            "@width": "169",
            "@_fa": "true",
            "$": "https://api.elsevier.com/content/object/eid/1-s2.0-S1381116909001265-gr9.sml?httpAccept=%2A%2F%2A",
            "@multimediatype": "GIF image file",
            "@type": "IMAGE-THUMBNAIL",
            "@size": "4132",
            "@ref": "gr9",
            "@mimetype": "image/gif"
          },
          {
            "@category": "standard",
            "@height": "300",
            "@width": "343",
            "@_fa": "true",
            "$": "https://api.elsevier.com/content/object/eid/1-s2.0-S1381116909001265-gr10.jpg?httpAccept=%2A%2F%2A",
            "@multimediatype": "JPEG image file",
            "@type": "IMAGE-DOWNSAMPLED",
            "@size": "34637",
            "@ref": "gr10",
            "@mimetype": "image/jpeg"
          },
          {
            "@category": "thumbnail",
            "@height": "163",
            "@width": "187",
            "@_fa": "true",
            "$": "https://api.elsevier.com/content/object/eid/1-s2.0-S1381116909001265-gr10.sml?httpAccept=%2A%2F%2A",
            "@multimediatype": "GIF image file",
            "@type": "IMAGE-THUMBNAIL",
            "@size": "3375",
            "@ref": "gr10",
            "@mimetype": "image/gif"
          },
          {
            "@category": "standard",
            "@height": "141",
            "@width": "376",
            "@_fa": "true",
            "$": "https://api.elsevier.com/content/object/eid/1-s2.0-S1381116909001265-fx1.jpg?httpAccept=%2A%2F%2A",
            "@multimediatype": "JPEG image file",
            "@type": "IMAGE-DOWNSAMPLED",
            "@size": "8827",
            "@ref": "fx1",
            "@mimetype": "image/jpeg"
          },
          {
            "@category": "thumbnail",
            "@height": "82",
            "@width": "219",
            "@_fa": "true",
            "$": "https://api.elsevier.com/content/object/eid/1-s2.0-S1381116909001265-fx1.sml?httpAccept=%2A%2F%2A",
            "@multimediatype": "GIF image file",
            "@type": "IMAGE-THUMBNAIL",
            "@size": "1618",
            "@ref": "fx1",
            "@mimetype": "image/gif"
          }
        ]
      },
      "link": {
        "@rel": "abstract",
        "@href": "https://api.elsevier.com/content/abstract/scopus_id/66849109372"
      }
    }
  }
}