{
  "metadata": {
    "title": "Fischer–Tropsch synthesis over cobalt catalysts supported on nanostructured alumina with various morphologies",
    "authors": "; ; ",
    "journal": "Journal of Molecular Catalysis A: Chemical",
    "date": "2012-11-30",
    "doi": "10.1016/j.molcata.2012.07.009",
    "abstract": "",
    "uri": "https://api.elsevier.com/content/article/pii/S1381116912002221",
    "pii": "S1381116912002221"
  },
  "fulltext": {
    "full-text-retrieval-response": {
      "scopus-eid": "2-s2.0-84866047916",
      "originalText": "serial JL 271358 291210 291744 291790 291809 31 Journal of Molecular Catalysis A: Chemical JOURNALMOLECULARCATALYSISACHEMICAL 2012-07-16 2012-07-16 2012-09-07T04:19:01 1-s2.0-S1381116912002221 S1381-1169(12)00222-1 S1381116912002221 10.1016/j.molcata.2012.07.009 S300 S300.1 FULL-TEXT 1-s2.0-S1381116912X00086 2015-05-15T05:56:33.607047-04:00 0 0 20121101 20121130 2012 2012-07-16T00:00:00Z articleinfo crossmark dco dateupdated tomb dateloaded datesearch indexeddate volumelist yearnav absattachment articletitlenorm authfirstinitialnorm authfirstsurnamenorm cid cids contenttype copyright dateloadedtxt docsubtype doctype doi eid ewtransactionid hubeid issn issnnorm itemstage itemtransactionid itemweight openaccess openarchive pg pgfirst pglast pii piinorm pubdateend pubdatestart pubdatetxt pubyr sectiontitle sortorder srctitle srctitlenorm srctype subheadings suppl volfirst volissue webpdf webpdfpagecount figure table body acknowledge affil articletitle auth authfirstini authfull authkeywords authlast primabst ref specialabst alllist content subj ssids 1381-1169 13811169 false 363 364 363 364 C Volumes 363–364 46 335 342 335 342 201211 November 2012 2012-11-01 2012-11-30 2012 Regular Papers article fla Copyright © 2012 Elsevier B.V. All rights reserved. FISCHERTROPSCHSYNTHESISOVERCOBALTCATALYSTSSUPPORTEDNANOSTRUCTUREDALUMINAVARIOUSMORPHOLOGIES LIU C 1 Introduction 2 Experimental 2.1 Preparation of support 2.2 Preparation of catalyst 2.3 Support and catalyst characterization 2.4 Fischer–Tropsch synthesis 3 Results and discussion 3.1 Characterization of support 3.1.1 X-ray powder diffraction XRD 3.1.2 Nitrogen adsorption–desorption 3.1.3 Transmission electron microscopy 3.2 Characterization of catalyst 3.2.1 X-ray powder diffraction XRD 3.2.2 Nitrogen adsorption–desorption 3.2.3 Temperature-programmed reduction (TPR) 3.2.4 H2-temperature programmed desorption (H2-TPD) and O2 pulse reoxidation 3.3 Activity and selectivity of catalysts in Fischer–Tropsch synthesis 4 Conclusion Acknowledgments References ZHANG 2010 1030 1058 Q CHU 2007 215 230 W KHODAKOV 2007 1692 1744 A IGLESIA 1997 59 78 E KHODAKOV 2002 230 241 A BECHARA 2001 343 353 R LI 2002 255 262 J BEZEMER 2006 3956 3964 G XIONG 2011 26 40 H REUEL 1984 78 88 R MARTINEZ 2007 162 173 A STORSAETER 2005 139 152 S WEI 2001 137 150 D MARTINEZ 2009 292 305 A XIONG 2005 512 516 H LESAINT 2008 131 135 C RANE 2010 160 167 S ZHANG 2003 121 133 J BORG 2007 89 100 O JI 2009 7186 7199 Y PRIETO 2009 129 144 G BORG 2009 70 77 O XIONG 2008 68 76 H SAIB 2010 271 282 A TSAKOUMIS 2010 162 182 N ARSLAN 2008 5716 5719 I BORG 2008 224 230 O TSUBAKI 2001 311 315 N PARK 2009 81 87 S ANDERSON 1948 2465 2472 R LIUX2012X335 LIUX2012X335X342 LIUX2012X335XC LIUX2012X335X342XC item S1381-1169(12)00222-1 S1381116912002221 1-s2.0-S1381116912002221 10.1016/j.molcata.2012.07.009 271358 2012-09-07T01:02:52.222635-04:00 2012-11-01 2012-11-30 1-s2.0-S1381116912002221-main.pdf https://s3.amazonaws.com/prod-ucs-content-store-us-east/content/pii:S1381116912002221/MAIN/application/pdf/e6c1bfb7e511e4b0f624f2dd5c3b13d0/main.pdf https://s3-eu-west-1.amazonaws.com/prod-ucs-content-store-eu-west/content/pii:S1381116912002221/MAIN/application/pdf/e6c1bfb7e511e4b0f624f2dd5c3b13d0/main.pdf main.pdf pdf true 2170591 MAIN 8 1-s2.0-S1381116912002221-main_1.png https://s3-eu-west-1.amazonaws.com/prod-ucs-content-store-eu-west/content/pii:S1381116912002221/PREVIEW/image/png/fe1acc9190a00b5cddae1d3b4634dcdb/main_1.png https://s3.amazonaws.com/prod-ucs-content-store-us-east/content/pii:S1381116912002221/PREVIEW/image/png/fe1acc9190a00b5cddae1d3b4634dcdb/main_1.png main_1.png png 62610 849 656 IMAGE-WEB-PDF 1 1-s2.0-S1381116912002221-gr1.jpg https://s3.amazonaws.com/prod-ucs-content-store-us-east/content/pii:S1381116912002221/gr1/DOWNSAMPLED/image/jpeg/6d8d6018d3e88155722bc11e4480ac95/gr1.jpg https://s3-eu-west-1.amazonaws.com/prod-ucs-content-store-eu-west/content/pii:S1381116912002221/gr1/DOWNSAMPLED/image/jpeg/6d8d6018d3e88155722bc11e4480ac95/gr1.jpg gr1 gr1.jpg jpg 35742 289 362 IMAGE-DOWNSAMPLED 1-s2.0-S1381116912002221-gr1.sml https://s3.amazonaws.com/prod-ucs-content-store-us-east/content/pii:S1381116912002221/gr1/THUMBNAIL/image/gif/e879972b843c1f975652eb2c3ec2d673/gr1.sml https://s3-eu-west-1.amazonaws.com/prod-ucs-content-store-eu-west/content/pii:S1381116912002221/gr1/THUMBNAIL/image/gif/e879972b843c1f975652eb2c3ec2d673/gr1.sml gr1 gr1.sml sml 4792 164 205 IMAGE-THUMBNAIL 1-s2.0-S1381116912002221-gr1_lrg.jpg https://s3.amazonaws.com/prod-ucs-content-store-us-east/content/pii:S1381116912002221/gr1/HIGHRES/image/jpeg/1b7505610d2fdcdfce1c6f305e9af376/gr1_lrg.jpg https://s3-eu-west-1.amazonaws.com/prod-ucs-content-store-eu-west/content/pii:S1381116912002221/gr1/HIGHRES/image/jpeg/1b7505610d2fdcdfce1c6f305e9af376/gr1_lrg.jpg gr1 gr1_lrg.jpg jpg 232837 1282 1605 IMAGE-HIGH-RES 1-s2.0-S1381116912002221-gr2.jpg https://s3.amazonaws.com/prod-ucs-content-store-us-east/content/pii:S1381116912002221/gr2/DOWNSAMPLED/image/jpeg/5afcfd889b443e03a45ca5cdc246fa3a/gr2.jpg https://s3-eu-west-1.amazonaws.com/prod-ucs-content-store-eu-west/content/pii:S1381116912002221/gr2/DOWNSAMPLED/image/jpeg/5afcfd889b443e03a45ca5cdc246fa3a/gr2.jpg gr2 gr2.jpg jpg 65006 566 376 IMAGE-DOWNSAMPLED 1-s2.0-S1381116912002221-gr2.sml https://s3.amazonaws.com/prod-ucs-content-store-us-east/content/pii:S1381116912002221/gr2/THUMBNAIL/image/gif/c891500ee68738a1a9f8f16047f9c2a1/gr2.sml https://s3-eu-west-1.amazonaws.com/prod-ucs-content-store-eu-west/content/pii:S1381116912002221/gr2/THUMBNAIL/image/gif/c891500ee68738a1a9f8f16047f9c2a1/gr2.sml gr2 gr2.sml sml 3153 164 109 IMAGE-THUMBNAIL 1-s2.0-S1381116912002221-gr2_lrg.jpg https://s3.amazonaws.com/prod-ucs-content-store-us-east/content/pii:S1381116912002221/gr2/HIGHRES/image/jpeg/86a95c0a515fcbd795a9f34c684b1c35/gr2_lrg.jpg https://s3-eu-west-1.amazonaws.com/prod-ucs-content-store-eu-west/content/pii:S1381116912002221/gr2/HIGHRES/image/jpeg/86a95c0a515fcbd795a9f34c684b1c35/gr2_lrg.jpg gr2 gr2_lrg.jpg jpg 423345 2508 1667 IMAGE-HIGH-RES 1-s2.0-S1381116912002221-gr3.jpg https://s3.amazonaws.com/prod-ucs-content-store-us-east/content/pii:S1381116912002221/gr3/DOWNSAMPLED/image/jpeg/eb0011264a7b97288b8c7576dc42455c/gr3.jpg https://s3-eu-west-1.amazonaws.com/prod-ucs-content-store-eu-west/content/pii:S1381116912002221/gr3/DOWNSAMPLED/image/jpeg/eb0011264a7b97288b8c7576dc42455c/gr3.jpg gr3 gr3.jpg jpg 173256 944 376 IMAGE-DOWNSAMPLED 1-s2.0-S1381116912002221-gr3.sml https://s3.amazonaws.com/prod-ucs-content-store-us-east/content/pii:S1381116912002221/gr3/THUMBNAIL/image/gif/2cd38e88c161582e3612597619bdbbee/gr3.sml https://s3-eu-west-1.amazonaws.com/prod-ucs-content-store-eu-west/content/pii:S1381116912002221/gr3/THUMBNAIL/image/gif/2cd38e88c161582e3612597619bdbbee/gr3.sml gr3 gr3.sml sml 5947 163 65 IMAGE-THUMBNAIL 1-s2.0-S1381116912002221-gr3_lrg.jpg https://s3.amazonaws.com/prod-ucs-content-store-us-east/content/pii:S1381116912002221/gr3/HIGHRES/image/jpeg/208496356d7abdebc05fa354b4dd56c3/gr3_lrg.jpg https://s3-eu-west-1.amazonaws.com/prod-ucs-content-store-eu-west/content/pii:S1381116912002221/gr3/HIGHRES/image/jpeg/208496356d7abdebc05fa354b4dd56c3/gr3_lrg.jpg gr3 gr3_lrg.jpg jpg 2067498 4184 1667 IMAGE-HIGH-RES 1-s2.0-S1381116912002221-gr4.jpg https://s3.amazonaws.com/prod-ucs-content-store-us-east/content/pii:S1381116912002221/gr4/DOWNSAMPLED/image/jpeg/5dc05528b08ebce4d5d49935779ca620/gr4.jpg https://s3-eu-west-1.amazonaws.com/prod-ucs-content-store-eu-west/content/pii:S1381116912002221/gr4/DOWNSAMPLED/image/jpeg/5dc05528b08ebce4d5d49935779ca620/gr4.jpg gr4 gr4.jpg jpg 39944 295 371 IMAGE-DOWNSAMPLED 1-s2.0-S1381116912002221-gr4.sml https://s3.amazonaws.com/prod-ucs-content-store-us-east/content/pii:S1381116912002221/gr4/THUMBNAIL/image/gif/ceab72cedbda0691bab13e8fff24be02/gr4.sml https://s3-eu-west-1.amazonaws.com/prod-ucs-content-store-eu-west/content/pii:S1381116912002221/gr4/THUMBNAIL/image/gif/ceab72cedbda0691bab13e8fff24be02/gr4.sml gr4 gr4.sml sml 5062 164 206 IMAGE-THUMBNAIL 1-s2.0-S1381116912002221-gr4_lrg.jpg https://s3.amazonaws.com/prod-ucs-content-store-us-east/content/pii:S1381116912002221/gr4/HIGHRES/image/jpeg/76623b8f963c460655de94e7c5c6a889/gr4_lrg.jpg https://s3-eu-west-1.amazonaws.com/prod-ucs-content-store-eu-west/content/pii:S1381116912002221/gr4/HIGHRES/image/jpeg/76623b8f963c460655de94e7c5c6a889/gr4_lrg.jpg gr4 gr4_lrg.jpg jpg 280540 1307 1643 IMAGE-HIGH-RES 1-s2.0-S1381116912002221-gr5.jpg https://s3.amazonaws.com/prod-ucs-content-store-us-east/content/pii:S1381116912002221/gr5/DOWNSAMPLED/image/jpeg/9154e80004f5cc13a8582d9be7031e48/gr5.jpg https://s3-eu-west-1.amazonaws.com/prod-ucs-content-store-eu-west/content/pii:S1381116912002221/gr5/DOWNSAMPLED/image/jpeg/9154e80004f5cc13a8582d9be7031e48/gr5.jpg gr5 gr5.jpg jpg 60062 578 376 IMAGE-DOWNSAMPLED 1-s2.0-S1381116912002221-gr5.sml https://s3.amazonaws.com/prod-ucs-content-store-us-east/content/pii:S1381116912002221/gr5/THUMBNAIL/image/gif/be28380b0bc5f512d4bc1fe9def9e258/gr5.sml https://s3-eu-west-1.amazonaws.com/prod-ucs-content-store-eu-west/content/pii:S1381116912002221/gr5/THUMBNAIL/image/gif/be28380b0bc5f512d4bc1fe9def9e258/gr5.sml gr5 gr5.sml sml 2940 163 106 IMAGE-THUMBNAIL 1-s2.0-S1381116912002221-gr5_lrg.jpg https://s3.amazonaws.com/prod-ucs-content-store-us-east/content/pii:S1381116912002221/gr5/HIGHRES/image/jpeg/604955d76cfab6bdb21abf0d4ae53df8/gr5_lrg.jpg https://s3-eu-west-1.amazonaws.com/prod-ucs-content-store-eu-west/content/pii:S1381116912002221/gr5/HIGHRES/image/jpeg/604955d76cfab6bdb21abf0d4ae53df8/gr5_lrg.jpg gr5 gr5_lrg.jpg jpg 413816 2562 1667 IMAGE-HIGH-RES 1-s2.0-S1381116912002221-gr6.jpg https://s3.amazonaws.com/prod-ucs-content-store-us-east/content/pii:S1381116912002221/gr6/DOWNSAMPLED/image/jpeg/b20b1a3997754e52947a7d1315d90cbb/gr6.jpg https://s3-eu-west-1.amazonaws.com/prod-ucs-content-store-eu-west/content/pii:S1381116912002221/gr6/DOWNSAMPLED/image/jpeg/b20b1a3997754e52947a7d1315d90cbb/gr6.jpg gr6 gr6.jpg jpg 37370 294 364 IMAGE-DOWNSAMPLED 1-s2.0-S1381116912002221-gr6.sml https://s3.amazonaws.com/prod-ucs-content-store-us-east/content/pii:S1381116912002221/gr6/THUMBNAIL/image/gif/92459a0d9f7a5b2f08dcf2e4264f6d1b/gr6.sml https://s3-eu-west-1.amazonaws.com/prod-ucs-content-store-eu-west/content/pii:S1381116912002221/gr6/THUMBNAIL/image/gif/92459a0d9f7a5b2f08dcf2e4264f6d1b/gr6.sml gr6 gr6.sml sml 4482 164 203 IMAGE-THUMBNAIL 1-s2.0-S1381116912002221-gr6_lrg.jpg https://s3.amazonaws.com/prod-ucs-content-store-us-east/content/pii:S1381116912002221/gr6/HIGHRES/image/jpeg/66be91423cdb1fec57f07bd63cd7578a/gr6_lrg.jpg https://s3-eu-west-1.amazonaws.com/prod-ucs-content-store-eu-west/content/pii:S1381116912002221/gr6/HIGHRES/image/jpeg/66be91423cdb1fec57f07bd63cd7578a/gr6_lrg.jpg gr6 gr6_lrg.jpg jpg 234700 1299 1611 IMAGE-HIGH-RES 1-s2.0-S1381116912002221-gr7.jpg https://s3.amazonaws.com/prod-ucs-content-store-us-east/content/pii:S1381116912002221/gr7/DOWNSAMPLED/image/jpeg/a920f2963dccd76fa81b6680e70b6e51/gr7.jpg https://s3-eu-west-1.amazonaws.com/prod-ucs-content-store-eu-west/content/pii:S1381116912002221/gr7/DOWNSAMPLED/image/jpeg/a920f2963dccd76fa81b6680e70b6e51/gr7.jpg gr7 gr7.jpg jpg 48159 594 379 IMAGE-DOWNSAMPLED 1-s2.0-S1381116912002221-gr7.sml https://s3.amazonaws.com/prod-ucs-content-store-us-east/content/pii:S1381116912002221/gr7/THUMBNAIL/image/gif/baacf55ef2b34011acd2300f0444de85/gr7.sml https://s3-eu-west-1.amazonaws.com/prod-ucs-content-store-eu-west/content/pii:S1381116912002221/gr7/THUMBNAIL/image/gif/baacf55ef2b34011acd2300f0444de85/gr7.sml gr7 gr7.sml sml 2217 163 104 IMAGE-THUMBNAIL 1-s2.0-S1381116912002221-gr7_lrg.jpg https://s3.amazonaws.com/prod-ucs-content-store-us-east/content/pii:S1381116912002221/gr7/HIGHRES/image/jpeg/49945869375be7868fbd4e6ea25ff827/gr7_lrg.jpg https://s3-eu-west-1.amazonaws.com/prod-ucs-content-store-eu-west/content/pii:S1381116912002221/gr7/HIGHRES/image/jpeg/49945869375be7868fbd4e6ea25ff827/gr7_lrg.jpg gr7 gr7_lrg.jpg jpg 299654 2632 1678 IMAGE-HIGH-RES 1-s2.0-S1381116912002221-gr8.jpg https://s3.amazonaws.com/prod-ucs-content-store-us-east/content/pii:S1381116912002221/gr8/DOWNSAMPLED/image/jpeg/be22724d09a7fa0d8c8031ae893bef11/gr8.jpg https://s3-eu-west-1.amazonaws.com/prod-ucs-content-store-eu-west/content/pii:S1381116912002221/gr8/DOWNSAMPLED/image/jpeg/be22724d09a7fa0d8c8031ae893bef11/gr8.jpg gr8 gr8.jpg jpg 32090 286 390 IMAGE-DOWNSAMPLED 1-s2.0-S1381116912002221-gr8.sml https://s3.amazonaws.com/prod-ucs-content-store-us-east/content/pii:S1381116912002221/gr8/THUMBNAIL/image/gif/d1ad1c8e134ad699203f367046f9f11f/gr8.sml https://s3-eu-west-1.amazonaws.com/prod-ucs-content-store-eu-west/content/pii:S1381116912002221/gr8/THUMBNAIL/image/gif/d1ad1c8e134ad699203f367046f9f11f/gr8.sml gr8 gr8.sml sml 4108 161 219 IMAGE-THUMBNAIL 1-s2.0-S1381116912002221-gr8_lrg.jpg https://s3.amazonaws.com/prod-ucs-content-store-us-east/content/pii:S1381116912002221/gr8/HIGHRES/image/jpeg/5fbf4c95376e243b138dc97568d6b4f0/gr8_lrg.jpg https://s3-eu-west-1.amazonaws.com/prod-ucs-content-store-eu-west/content/pii:S1381116912002221/gr8/HIGHRES/image/jpeg/5fbf4c95376e243b138dc97568d6b4f0/gr8_lrg.jpg gr8 gr8_lrg.jpg jpg 196192 1268 1728 IMAGE-HIGH-RES 1-s2.0-S1381116912002221-gr9.jpg https://s3.amazonaws.com/prod-ucs-content-store-us-east/content/pii:S1381116912002221/gr9/DOWNSAMPLED/image/jpeg/dbf39ff851688cd95792f7ff3be0f0eb/gr9.jpg https://s3-eu-west-1.amazonaws.com/prod-ucs-content-store-eu-west/content/pii:S1381116912002221/gr9/DOWNSAMPLED/image/jpeg/dbf39ff851688cd95792f7ff3be0f0eb/gr9.jpg gr9 gr9.jpg jpg 23988 259 376 IMAGE-DOWNSAMPLED 1-s2.0-S1381116912002221-gr9.sml https://s3.amazonaws.com/prod-ucs-content-store-us-east/content/pii:S1381116912002221/gr9/THUMBNAIL/image/gif/5bce865ea8386da524176fa50749775c/gr9.sml https://s3-eu-west-1.amazonaws.com/prod-ucs-content-store-eu-west/content/pii:S1381116912002221/gr9/THUMBNAIL/image/gif/5bce865ea8386da524176fa50749775c/gr9.sml gr9 gr9.sml sml 2628 151 219 IMAGE-THUMBNAIL 1-s2.0-S1381116912002221-gr9_lrg.jpg https://s3.amazonaws.com/prod-ucs-content-store-us-east/content/pii:S1381116912002221/gr9/HIGHRES/image/jpeg/8b6c36a777802289587f2c7082453459/gr9_lrg.jpg https://s3-eu-west-1.amazonaws.com/prod-ucs-content-store-eu-west/content/pii:S1381116912002221/gr9/HIGHRES/image/jpeg/8b6c36a777802289587f2c7082453459/gr9_lrg.jpg gr9 gr9_lrg.jpg jpg 112404 1148 1667 IMAGE-HIGH-RES 1-s2.0-S1381116912002221-gr10.jpg https://s3.amazonaws.com/prod-ucs-content-store-us-east/content/pii:S1381116912002221/gr10/DOWNSAMPLED/image/jpeg/b993b9c59853b8c70ed21d164cca8c25/gr10.jpg https://s3-eu-west-1.amazonaws.com/prod-ucs-content-store-eu-west/content/pii:S1381116912002221/gr10/DOWNSAMPLED/image/jpeg/b993b9c59853b8c70ed21d164cca8c25/gr10.jpg gr10 gr10.jpg jpg 59102 376 376 IMAGE-DOWNSAMPLED 1-s2.0-S1381116912002221-gr10.sml https://s3.amazonaws.com/prod-ucs-content-store-us-east/content/pii:S1381116912002221/gr10/THUMBNAIL/image/gif/5f65376a6d980af49d013a3f1c1af488/gr10.sml https://s3-eu-west-1.amazonaws.com/prod-ucs-content-store-eu-west/content/pii:S1381116912002221/gr10/THUMBNAIL/image/gif/5f65376a6d980af49d013a3f1c1af488/gr10.sml gr10 gr10.sml sml 9122 164 164 IMAGE-THUMBNAIL 1-s2.0-S1381116912002221-gr10_lrg.jpg https://s3.amazonaws.com/prod-ucs-content-store-us-east/content/pii:S1381116912002221/gr10/HIGHRES/image/jpeg/90748949d8df37c04cd7239f6505c6d0/gr10_lrg.jpg https://s3-eu-west-1.amazonaws.com/prod-ucs-content-store-eu-west/content/pii:S1381116912002221/gr10/HIGHRES/image/jpeg/90748949d8df37c04cd7239f6505c6d0/gr10_lrg.jpg gr10 gr10_lrg.jpg jpg 709203 1669 1667 IMAGE-HIGH-RES 1-s2.0-S1381116912002221-fx1.jpg https://s3.amazonaws.com/prod-ucs-content-store-us-east/content/pii:S1381116912002221/fx1/DOWNSAMPLED/image/jpeg/000ab4dfbfc9ebcf6a3b43f0bb295488/fx1.jpg https://s3-eu-west-1.amazonaws.com/prod-ucs-content-store-eu-west/content/pii:S1381116912002221/fx1/DOWNSAMPLED/image/jpeg/000ab4dfbfc9ebcf6a3b43f0bb295488/fx1.jpg fx1 true fx1.jpg jpg 15593 200 273 IMAGE-DOWNSAMPLED 1-s2.0-S1381116912002221-fx1.sml https://s3.amazonaws.com/prod-ucs-content-store-us-east/content/pii:S1381116912002221/fx1/THUMBNAIL/image/gif/ef4276dcc5b8973a96b814666b46d2f1/fx1.sml https://s3-eu-west-1.amazonaws.com/prod-ucs-content-store-eu-west/content/pii:S1381116912002221/fx1/THUMBNAIL/image/gif/ef4276dcc5b8973a96b814666b46d2f1/fx1.sml fx1 true fx1.sml sml 5596 160 219 IMAGE-THUMBNAIL 1-s2.0-S1381116912002221-fx1_lrg.jpg https://s3.amazonaws.com/prod-ucs-content-store-us-east/content/pii:S1381116912002221/fx1/HIGHRES/image/jpeg/a96f22f20d5eb082e5a1b2b1fafd4301/fx1_lrg.jpg https://s3-eu-west-1.amazonaws.com/prod-ucs-content-store-eu-west/content/pii:S1381116912002221/fx1/HIGHRES/image/jpeg/a96f22f20d5eb082e5a1b2b1fafd4301/fx1_lrg.jpg fx1 fx1_lrg.jpg jpg 114263 886 1209 IMAGE-HIGH-RES MOLCAA 8471 S1381-1169(12)00222-1 10.1016/j.molcata.2012.07.009 Elsevier B.V. Fig. 1 Powder XRD pattern of the supports. Fig. 2 Nitrogen adsorption–desorption isotherms and pore size distributions of the support. Note: The adsorption–desorption isotherms of Al2O3-P, Al2O3-H, Al2O3-R and Al2O3-F was up shifted successively by about 200cm3 g−1 relative to the curve below. The pore distribution curves of Al2O3-P, Al2O3-H, Al2O3-R and Al2O3-F was up shifted successively by about 0.013cm3 g−1 relative to the curve below. Fig. 3 TEM images of the support and catalyst: (a) Al2O3-P; (b) Al2O3-H; (c) Al2O3-R; (d) Al2O3-F; (e) Al2O3-C; (f) Co/Al2O3-P; (g) Co/Al2O3-H; (h) Co/Al2O3-R; (i) Co/Al2O3-F; and (j) Co/Al2O3-C. Fig. 4 Powder XRD pattern of the catalysts. Fig. 5 Nitrogen adsorption/desorption isotherms and pore size distributions of the catalysts. Note: The adsorption–desorption isotherms of Co/Al2O3-P, Co/Al2O3-H, Co/Al2O3-R and Co/Al2O3-F was up shifted successively by about 200cm3 g−1 relative to the curve below. The pore distribution curves of Co/Al2O3-P, Co/Al2O3-H, Co/Al2O3-R and Co/Al2O3-F was up shifted successively by about 0.01cm3 g−1 relative to the curve below. Fig. 6 TPR pattern of the catalysts. Fig. 7 Cobalt metal particle sizes with catalyst pore sizes, over the catalysts. Fig. 8 CO conversion with reaction time, over the catalysts. Fig. 9 CO initial conversion, TOF with cobalt particle size, over the catalysts. Cobalt particle sizes calculated from H2 chemisorption data. Turnover frequency (TOF) calculated from CO initial conversion, space velocities and H2 chemisorption data. Fig. 10 TEM images of the unused, reduced and passivated catalysts: (a) Al2O3-P; (b) Al2O3-F; and the used catalysts: (c) Al2O3-P; (d) Al2O3-F. Table 1 Nitrogen adsorption results and crystallites size for the support and catalysts. Sample BJH pore size (nm) Average pore size (nm) S BET (m2 g−1) Pore volume (cm3 g−1) Crystallites size a (nm) Al2O3-F 20.9 27.7 260.8 1.80 – Al2O3-R 7.4, 20.3 29.9 287.4 2.15 – Al2O3-H 6.9, 39.7 30.1 276.6 2.08 – Al2O3-P 7.3, 50.0 33.2 290.0 2.41 – Al2O3-C 7.4 14.0 259.2 0.91 – Co/Al2O3-F 6.9, 25.8 14.6 216.7 0.79 15.6 Co/Al2O3-R 4.9 5.4 215.2 0.29 12.2 Co/Al2O3-H 5.4 6.3 225.3 0.35 14.1 Co/Al2O3-P 5.6 7.0 200.7 0.35 15.3 Co/Al2O3-C 7.4 12.6 186.5 0.59 14.2 a Average diameter of Co3O4 crystallite, obtained by XRD measurement. Table 2 The synthesis condition of nanostructured alumina with various morphology. Sample Ammonium carbonate solution addition method pH value of the sol Morphology of sample Al2O3-F Drop wise 7.5 Fibers Al2O3-H Drop wise 8.5 Rods and particles Al2O3-P Drop wise 9.5 Particles Al2O3-R Pour directly 9.5 Rods Table 3 H2-TPD and O2 titration data of the catalysts was measured by AMI-200 unit. Catalyst H2 desorbed (μmolg−1) d uncorrected a (%) D uncorrected b (nm) O2 uptaked (μmolg−1) Reducibility (%) d corrected c (%) D corrected d (nm) Co/Al2O3-F 103.2 8.11 12.8 1346.3 78.94 10.27 10.1 Co/Al2O3-R 124.5 9.76 10.6 1066.6 62.54 15.61 6.6 Co/Al2O3-H 117.0 9.19 11.2 1130.8 66.31 13.86 7.4 Co/Al2O3-P 112.4 8.83 11.8 1215.2 71.27 12.39 8.4 Co/Al2O3-C 93.1 7.30 14.8 1352.2 79.29 9.21 11.7 a The uncorrected catalyst dispersion. b The uncorrected metal crystallite diameter. c The corrected catalyst dispersion. d The corrected metal crystallite diameter. Table 4 Performances of the catalysts in a fixed bed reactor. a Catalyst CO initial conversion (%) CO conversion at steady state (%) Hydrocarbon selectivity (mol%) C1 C2 C3 C4 C5+ Co/Al2O3-F 22.5 21.7 11.25 1.44 4.38 7.92 75.01 Co/Al2O3-R 25.9 21.3 12.97 1.50 4.56 8.08 72.89 Co/Al2O3-H 24.0 19.6 12.38 1.66 4.83 8.52 72.61 Co/Al2O3-P 23.5 19.3 12.07 1.74 5.07 9.04 72.08 Co/Al2O3-C 19.8 16.5 14.23 1.60 5.22 7.32 71.63 a Reaction conditions: H2/CO=2, 483K, 1.0MPa, 4SLg−1 h−1, CO conversion and hydrocarbon selectivity were collected at 100h. Fischer–Tropsch synthesis over cobalt catalysts supported on nanostructured alumina with various morphologies Chengchao Liu a Jinlin Li a ⁎ Yuhua Zhang a b Sufang Chen b c Junjiang Zhu a Kongyong Liew a a Key Laboratory of Catalysis and Materials Science of the State Ethnic Affairs & Commission Ministry of Education, South-Central University for Nationalities, Wuhan, Hubei 430074, China b College of Chemistry, Chemical Engineering and Materials Science Soochow University, Suzhou 215123, China c Key Laboratory for Green Chemical Process of Ministry of Education, School of Chemical Engineering and Pharmacy, Wuhan Institute of Technology, Wuhan, Hubei 430073, China ⁎ Corresponding author. Tel.: +86 27 67843016; fax: +86 27 67842752. Graphical abstract The cobalt catalyst supported on the nanostructured alumina increased the CO conversion by 20–30%, compared to commercial alumina. Among the nanostructured alumina, the nanofiber supported catalyst has improved stability through the large, stable and interconnected bird nest-like pore structures with large cobalt particle size and showed the best catalytic performance. Highlights ► The morphologies of nanostructured Al2O3 effect on cobalt catalysts for FTS were reported. ► Nano-Al2O3 supports undergo reconstruction during the catalyst preparation. ► Nano-Al2O3 improved CO conversion by 20–30% compared to commercial Al2O3. ► Al2O3 nanofibers have improved catalyst stability through bird nest-like pores. Nanostructured aluminas with controllable morphologies were prepared and used as support of cobalt catalysts for Fischer–Tropsch synthesis. The supported cobalt catalysts were prepared by incipient wetness impregnation method and characterized by transmission electron microscopy (TEM), X-ray diffraction (XRD), temperature programmed reduction (TPR), N2 adsorption–desorption, hydrogen chemisorption and oxygen titration. Catalytic activity of the cobalt catalysts for Fischer–Tropsch synthesis (FTS) was evaluated on a fixed bed reactor. It was found that the nanostructured alumina supports undergo reconstruction during the catalyst preparation resulting in catalysts having high dispersion after reduction. The cobalt catalyst supported on the nanostructured alumina increased the CO conversion by 20–30%, compared to commercial alumina. Among the nanostructured catalysts, the alumina nanorods supported catalyst, shows the best dispersion and highest CO initial conversion. Our work disclosed that the alumina nanofibers supported catalysts have larger, stable and interconnected bird nest-like pores. In addition, the structure exhibited higher stability and lower methane selectivity for FTS. Keywords Fischer–Tropsch synthesis Cobalt catalysts Nanostructured alumina Morphology 1 Introduction Catalytic synthesis of liquid fuels and valuable chemicals, using natural gas and coal, as well as renewable biomass resources by Fischer–Tropsch synthesis (FTS) is a well-established technology. The development of novel catalysts with good performance is the key to improving FT technologies and it is one of the main focuses in the academic community. The typical active metals used in Fischer–Tropsch catalysts are Fe, Co, and Ru, although several other metals, such as Ni and Rh, also exhibit activities [1]. Among these metals are supported cobalt catalysts, which show good selectivity to long-chain paraffin, strong resistance to deactivation for FTS and low activity for water gas shift reaction [2–4]. Various supports, such as silica [5], alumina [6], titania [7], carbon [8,9], magnesia [10] and zeolites [11], have been used to enhance the catalytic activity and selectivity of these cobalt catalysts. It was found that the reducibility and dispersions of supported cobalt catalysts were significantly influenced by the type and structure of the support and thereby influenced the activity and selectivity [12]. Thus, selecting a suitable material as support of cobalt catalyst for FTS is a crucial step. Alumina is one of the most frequently used supports in FTS, due to its good mechanical properties, strong resistance to attrition and controllable surface properties [13]. Many good works have been reported with the effect of alumina as a support of cobalt catalyst for FTS. It was found that the surface area [14], porosity [6,15,16], crystallite phase [17], as well as surface chemical properties [18] of the alumina support, influences significantly the catalytic performances of the catalysts. For example, Xiong et al. [15] reported that alumina with larger pore sizes, leads to larger Co3O4 particle sizes. Borg et al. [19] studied the effect of γ-Al2O3 support variables on Fischer–Tropsch synthesis performance, discovered that the size of the Co3O4 cobalt particles was controlled by the support pore size. Rane et al. [17] observed that cobalt catalysts supported on α- and δ-Al2O3, show higher C5+ selectivity, than those supported on γ- and θ-Al2O3. However, there are scarcely any works focusing on the effect of morphology of nanostructured alumina support on performance for cobalt Fischer–Tropsch synthesis catalysts. As far as we know, only Martínez et al. [14] recently found that RuCo catalyst supported on nanofibrous alumina, showed higher dispersion and macroporosity than that supported on commercial alumina. Herein, in this work, nanostructured alumina with large porosity and various morphologies were synthesized and used as support of cobalt catalyst for FTS. The effect of morphology of nanostructured alumina support on performance of the prepared catalysts will be discussed in detail within throughout this reported research. 2 Experimental 2.1 Preparation of support Nanostructured alumina was synthesized with the following procedures. Typically, 5g Al(NO3)3·9H2O, was dissolved in 100ml anhydrous ethanol, while stirring. The solution was then heated to 353K and ammonium carbonate solution (1moll−1) was added drop-wise, or poured all at once, with the pH controlled at 7.5, 8.5 and 9.5. The resulting sol was continuously stirred for 2h and aged at 353K, for 24h. After that, the products were filtered and washed with de-ionized water, followed by anhydrous ethanol several times. The white precipitates were dried at 383K, for 12h and calcined at 873K (heating rate of 2Kmin−1) for 5h, in static air. The obtained support was denoted as Al2O3-(n), where n equaled F, R, H and P, represented fibers, rods, hybrids and particles, respectively. Next, commercial alumina (>99.0%, Sasol, Z600200, Germany), denoted as Al2O3-(C), was used for comparison. 2.2 Preparation of catalyst The catalyst samples were prepared by incipient wetness impregnation of the respective nanostructured γ-alumina, with the desired amount of aqueous cobalt nitrate. The catalysts were dried at 393K, for 12h, followed by calcination at 623K, for 6h. The cobalt loading in the catalyst was 15wt%. These samples were denoted as Co/Al2O3-(n). 2.3 Support and catalyst characterization X-ray diffraction (XRD) patterns for the samples were done on a Brukers advanced-D8 diffractometer, using monochromatized Cu Kα radiation (λ =1.54056Å), equipped with a Vanter-1 detector and operated at 40kV and 40mA. The diffraction was recorded between 2θ =10° and 80° with a ramp of 0.016°. Crystallite phases were determined by comparing the diffraction patterns with those in the standard powder XRD files (JCPDS). Co3O4 particle size was calculated using the Scherrer equation (d =(0.89λ/B cos θ)(180°/π)), from the most intense Co3O4 peak (2θ =36.9°). Transmission electron microscopy (TEM) images of the samples were obtained with a FEI Tecnai G2-20 instrument. The samples were prepared by depositing a drop of the dispersion of the powder in ethanol with ultrasonication onto a copper microscope grid, covered with perforated carbon and dried in air for several minutes. The N2 adsorption–desorption isotherms were obtained with a Quantachrome Autosorb-1-C-TCD-MS instrument, at 77K. The samples were degassed at 473K, for 6h prior to the N2 physisorption experiment. The specific surface area was calculated using the Brunauer–Emmet–Teller (BET) model for adsorption data, in a relative pressure range of 0.05–0.30. Pore volumes were calculated from the adsorption data at relative pressure (P/P0) of 0.995. The pore size distribution was estimated using the Barret–Joyner–Halenda (BJH) method from the desorption branches of the isotherms. H2 temperature programmed reduction (TPR) experiments were performed using a Quantachrome Autosorb-1-C-TCD-MS instrument. The calcined catalysts (0.12g) were first flushed with argon at 423K, for 1h, to remove traces of water and then cooled to 323K. Subsequently, the sample was reduced from 323K to 1073K (held 30min), at a heating rate of 10Kmin−1 under 10% H2/Ar mixture, with a flow rate of 30mlmin−1. The H2 consumption (TCD signal) was recorded automatically by a PC. Hydrogen chemisorption and oxygen titration measurement were performed using the Zeton Altamira AMI-200 unit. The catalysts were reduced in flowing H2 at 723K, for 12h, then cooled to 373K, under hydrogen gas flow and purged with argon and held at this temperature under flowing Ar, in order to desorb the remaining chemisorbed H2. Moreover, the TCD signal was recorded until it returned to the baseline. Subsequently, an oxygen titration procedure was performed. The reduced catalyst was reoxidized at 723K, by purging it with oxygen pulses until no further consumption of O2, was detected by the TCD located downstream. The methods to calculate the cobalt catalyst dispersion and reduction degree have been reported previously [15]. 2.4 Fischer–Tropsch synthesis FTS was performed in a stainless steel fixed-bed reactor (id=12mm) at 483K and 1.0MPa. The catalysts (ca. 0.5g) were mixed with 5g of inert silicon carbide particles to improve the temperature distribution. The samples were reduced in situ in a H2 flow (6NLh−1 g−1, 298K, 0.1MPa), at atmospheric pressure. The reactor temperature was raised from room temperature to 373K at 2Kmin−1, then to 723K, at a rate of 1Kmin−1. After 10h of reduction at 723K, the reactor was cooled to 373K. At that temperature, the system pressure was increased to 1.0MPa and synthesis gas of molar ratio H2/CO=2 were introduced into the reactor with space velocity of 4SLg−1 h−1 (273K, 0.1MPa). The reactor temperature was increased slowly to 483K. The resulting effluent gaseous products were analyzed online using an Agilent MicroGC 3000A gas chromatograph (GC) equipped, with a TCD detector. The liquid product analysis was performed with an Agilent 6890GC, equipped with a FID detector. The solid wax was dissolved in dimethylbenzene and analyzed with an Agilent 4890GC. The reported activity and selectivity data were obtained at close to a steady state after at least 60h of reaction. The hydrocarbon selectivity was calculated by the total carbon mass balance. Notwithstanding, the methods to calculate hydrocarbon selectivity have been reported previously [15]. 3 Results and discussion 3.1 Characterization of support 3.1.1 X-ray powder diffraction XRD Fig. 1 shows the XRD patterns of the prepared and commercial alumina in the range of 2θ =10–80°. The diffraction peaks at 37.6°, 39.5°, 45.7° and 67.0° are attributed to the γ-Al2O3 phase (JCPDS: 47-1308). The relatively broad peak at 67.0° indicates they have similar γ-Al2O3 phases. Rane et al. [17], has suggested that the alumina phase affected the performances of the cobalt catalysts. In this research, the effect of alumina phases on catalysts performances during the FTS reactions could thus, be completely excluded. 3.1.2 Nitrogen adsorption–desorption The N2 adsorption–desorption isotherms of the prepared and commercial alumina are shown in Fig. 2 . The isotherms were of type IV, with H3 and H4 hysteresis loops, indicating typical slit-type pores of interparticle voids, generated in solids of corrugated plate or, fiber-like morphology [14]. For Al2O3-P, Al2O3-H and Al2O3-R, the two hysteresis loops in the isotherms indicate the presence of hierarchical mesopores. The pore size distributions were obtained from the desorption branch of the isotherms, utilizing the BJH method as shown in Fig. 2. The samples displayed bimodal pore size distributions with pore diameters of 7.3 and 50.0nm, for Al2O3-P, 6.9 and 39.7nm, for Al2O3-H, 7.4 and 20.3nm, for Al2O3-R, while only one broad distribution with pore size ranging from 7.3 to 35.8nm, was observed for sample Al2O3-F. The commercial alumina Al2O3-C, displays a unimodal pore size distribution at around 7.4nm. The textural parameters of all support and catalysts samples are shown in Table 1 . The prepared aluminas and commercial alumina have similar surface area in the range of 260–290m2 g−1, while the prepared alumina have large pore volumes (1.80–2.41cm3 g−1), compared to the commercial one (0.91cm3 g−1). 3.1.3 Transmission electron microscopy TEM images of the prepared and commercial alumina are presented in Fig. 3a–e. The morphology of the alumina sample was affected both by the addition method of (NH4)2CO3 and pH values of the sol (show in Table 2 ). Al2O3-P, is composed mainly of the spherical nanoparticles with an average diameter of 6–8nm and highly developed porous structures between the particles. Another example is Al2O3-H, which consists of a mixture of spherical nanoparticles, with an average diameter of 6–8nm and nanorods, with diameters of 6–8nm and lengths of 30–50nm. Still another sample, Al2O3-R is composed of nanorods with diameters of 6–8nm and lengths of 40–80nm. In addition, Al2O3-F consisted of nanofibers, with an average diameter of 5–6nm and lengths of 80–300nm. Combined with the pore size distribution results, it can be inferred that for nanostructured alumina, with bimodal pore size distributions, the small pores were produced via random accumulation of spherical particles and the large pores were produced from that of nanorods or nanofibres. However, the random mixing of the long nanofibers led to a bird nest-like structure, with an irregular and broad pore size distribution. A representative TEM image of the commercial alumina Al2O3-C is shown in Fig. 3e, which shows rod-like particles that are closely arranged in a worm-like porous network. 3.2 Characterization of catalyst 3.2.1 X-ray powder diffraction XRD X-ray diffraction profiles of the catalysts are shown in Fig. 4 , which show diffraction peaks indexed both to the Al2O3 support and to the Co3O4 phase [15]. Borg et al. [19] reported that the Co3O4 crystallite size increased with increasing Al2O3 pore sizes. However, Martínez et al. [14] reported that the final cobalt dispersion is mainly determined by the specific surface area of the alumina support, rather than by its pore size. In our work, the sizes of the Co3O4 crystallites calculated from XRD data using the Scherrer formula are shown in Table 1. The size of cobalt oxide crystallites on Al2O3-F (with broad distribution have large pore at 20nm) is 15.6nm. On the other hand, while the cobalt oxide crystallites sizes on Al2O3-R, Al2O3-H and Al2O3-P, with bimodal pore structure, have similar small pores at 7nm and various large pores at 20–50nm, cobalt oxide crystallites size increased with the increase of the large pores. This is consistent with Borg's [19] result, that the Co3O4 particle sizes were controlled by the support pore size. However, the Al2O3-C with unimodal pore size distribution has smaller pore sizes and lower surface area among the various samples. The supported catalyst has the intermediate cobalt oxide crystallite size at 14.1nm. Thus, the pore structure of support which is dependent upon the morphology and stacking of the primary particle of nanostructured alumina also influences the initial cobalt oxide crystallite dispersion. 3.2.2 Nitrogen adsorption–desorption The N2 adsorption–desorption isotherms and pore distribution of the catalysts are shown in Fig. 5 . It is noticed that the hysteresis loops and pore distributions of the catalysts have been changed from that of the parent alumina support for Co/Al2O3-P, Co/Al2O3-H and Co/Al2O3-R. As a result, the pore structure of the alumina has been changed after cobalt loading, as confirmed by the TEM images (Fig. 3f–h). The arrangement of spherical alumina nanoparticles becomes closer. However, Co/Al2O3-F retained the pore sizes at 6.9–25.8nm and Co/Al2O3-C retained the pore size at 7.4nm. These supports retained their pore structures after the cobalt loading, as confirmed by the TEM images (Fig. 3i and j). Please note the arrangement of original alumina particles has not been changed significantly. These results indicated Co/Al2O3-F, with bird nest-like structures and Co/Al2O3-C, with closely arranged primary particles have stable pore structures. The surface area and pore volume of the catalysts are listed in Table 1. The supported cobalt catalysts show decreased surface area and pore volume, suggesting that parts of the cobalt species enter into the pores of the supports. It is also noted that the reductions in pore volume in the loaded catalysts, Co/Al2O3-P, Co/Al2O3-H and Co/Al2O3-R are more than that of Co/Al2O3-F and Co/Al2O3-C, indicating that the original alumina nanoparticles, in which they were closely arranged, caused a decrease in pore volume. 3.2.3 Temperature-programmed reduction (TPR) TPR profiles of the prepared catalysts are shown in Fig. 6 . Three reduction peaks are observed at temperature ranges of <563, 563–633 and >633K, for all the catalysts. The small peak below 563K, could be attributed to the reductive decomposition of residual Co(NO3)2 and amorphous CoO(OH) species [20]. The second peak at 563–633K is attributed to the reduction of Co3O4 to CoO. The broad high temperature reduction peak (>633K) is ascribed to the subsequent reduction of CoO to Co0. The reducibility of the supported cobalt catalysts was affected by cobalt particle size [21] and metal-support interaction [12]. The TPR pattern of Co/Al2O3-C, Co/Al2O3-P and Co/Al2O3-F catalysts, shows a shoulder peak at 645K, which may be due to the reduction of large CoO particle to Co0. The second reduction peak for all five catalysts was located in a marrow region about 600K. It is suggested that the reduction of Co3O4 to CoO is not affected by the nature of the catalyst. A similar conclusion has been reported by Borg et al. [22]. The third reduction peak for Co/Al2O3-F and Co/Al2O3-C catalysts at lower temperatures than that of the other catalysts was perhaps due to the larger CoO particles on the catalysts interacting more weakly with the support. However, a shoulder peak at 920K, for Co/Al2O3-F is higher than that for Co/Al2O3-C. It is indicative that the metal-support interaction is stronger for Co/Al2O3-F than for Co/Al2O3-C catalysts. Comparing the temperature of the third peak of all catalysts, the metal-support interaction of all catalysts increased in the sequence: Co/Al2O3-C, <Co/Al2O3-F, <Co/Al2O3-P, <Co/Al2O3-H, <Co/Al2O3-R. 3.2.4 H2-temperature programmed desorption (H2-TPD) and O2 pulse reoxidation Table 3 presents the H2-temperature programmed desorption and O2 pulse re-oxidation results for the catalysts after reduction at 723K, for 10h. It is clearly seen that the support affected the catalysts reducibility regarding cobalt dispersion and cobalt particle size. The degree of reduction decreased in the sequence: Co/Al2O3-C, >Co/Al2O3-F, >Co/Al2O3-P, >Co/Al2O3-H and >Co/Al2O3-R. The catalyst's reducibility data is in agreement with the TPR results. The H2 chemisorption results showed that nanostructured alumina supported catalysts have higher cobalt dispersion and smaller cobalt metal particle sizes compared with Co/Al2O3-C. However, these catalysts have similar or larger average cobalt oxide sizes than Co/Al2O3-C as determined by XRD. This is perhaps because during the preparation of the nanostructured alumina catalysts, more cobalt species remained undecomposed as shown in the TPR results. These cobalt species experienced enhanced metal-support interactions resulting in more small cobalt particles in the support's pores after reduction. The direct reduction of the cobalt nitrate can improve the dispersion of the catalysts [4]. The mean metal Co particle sizes derived from XRD and H2 chemisorption measurements for catalysts supported on R, H, and P nanostructured aluminas show larger discrepancies than Co/Al2O3-F and Co/Al2O3-C catalysts. There may be two reasons: (1) The very small cobalt oxide particles may be missed by XRD due to significant XRD line broadening [2]. Compared with the catalysts Co/Al2O3-F and Co/Al2O3-C, the catalysts Co/Al2O3-R, Co/Al2O3-H, and Co/Al2O3-P may have more smaller Co nanoparticles located in the smaller mesopores would hardly be detected by XRD. (2) In the catalyst reduction process, the change in cobalt particle size varies due to the different structures of the catalysts perhaps the bimodal distribution of Co/Al2O3-F may have also contributed to the larger discrepancy in particle size determined by the two methods. Co particle size could be determined by the porosity of the support [5,19]. However, in our work, the nanostructured alumina supported catalysts represent various reconstructured pore structures, Therefore, we believe the porosity of the catalysts have larger impact on the final cobalt metal particle size. As shown in Fig. 7A the average cobalt metal particle size for the Co/Al2O3-R, Co/Al2O3-H, Co/Al2O3-P and Co/Al2O3-C catalysts, continuously increases with catalyst average pore sizes except for Co/Al2O3-F. However, as shown in Fig. 7B, only the small pore at 6.9nm, which appear after the cobalt loading, was considered for Co/Al2O3-F, the linear relation between the cobalt metal particle size and catalyst BJH pore sizes is maintained. The cobalt metal particle sizes increased significantly with increasing pore size which is in agreement with our previous result [23]. This may indicate that the pore size of catalysts influences the final cobalt crystallite dispersion. 3.3 Activity and selectivity of catalysts in Fischer–Tropsch synthesis The CO conversion over the catalysts is presented in Fig. 8 and Table 4 . The nanostructured alumina supported catalysts improved the catalytic activity by 20–30%, compared with the commercial alumina supported catalysts. It is generally accepted that the activity of cobalt catalysts for FTS is dependent upon the amount of the exposed active metal cobalt sites. The amount of exposed active metal cobalt sites depended upon the metal cobalt particle sizes and reducibility. The turnover frequency (TOF) of these catalysts, based upon H2 chemisorption and CO initial conversions, have also been calculated. The relationship between cobalt particle sizes and turnover frequency is show in Fig. 9 . As can be seen, the initial activity of FTS decreases as the size of cobalt particles is increased from 6.6 to 11.7nm, while the TOF is relatively unchanged for these cobalt catalysts, with cobalt particle sizes in the range of 6–12nm. The effect of cobalt particle size on TOF of FTS has been investigated previously [8]. It has been suggested that the intrinsic site reaction rate remained invariant for cobalt particle sizes larger than 6–8nm. Thus, constant turnover frequency for the catalysts, suggests that the decrease in the initial activity of FTS, was caused by a decrease in the number of active cobalt sites of the catalysts. Consequently, it is suggested that the support affected the rate of FTS through affecting the cobalt dispersion and catalyst reducibility. The performance of the catalysts at steady state (100h) is summarized in Table 4. The alumina nanofiber catalyst showed the highest FT activity among the catalysts studied. Alumina nanofiber supported catalysts have high activity due to its stability during reaction, as seen from Fig. 8. Sintering is one of the main deactivation mechanisms for cobalt based FTS catalysts [24], which is highly influenced by the support. The mobility of the cobalt crystals on various supports contributes significantly to the sintering behavior [25]. The mobility of the active metal particles may be affected by the crystal structure and the nature of the site. It has been suggested that the three-dimensional cobalt aggregates were formed from the interlocking of alumina crystallites and cobalt oxide [26,27]. Fig. 10a and b presents the TEM results of the catalysts Co/Al2O3-P and Co/Al2O3-F, after reduction at 723K under H2 for 10h and passivation in a flow of 1% O2/He. Fig. 10c and d presents the TEM results of the catalysts Co/Al2O3-P and Co/Al2O3-F, after use at 483K for 110h. The stability of the alumina nanofiber supported catalysts, may be due to the presence of the large, stable and interconnected, bird nest-like pore structures, which could reduce the contact between the cobalt species aggregates. Thus, the distances between the cobalt crystallites after reduction on bird nest-like structures were farther than that of other close structures (see Fig. 10a and b), such as reconstructured nanostructured alumina and commercial alumina, and the sintering of the metallic phases during reaction was subdued (see Fig. 10c and d). The distances between the cobalt crystallites were nearly unchanged for unused and after used catalysts Co/Al2O3-F (see Fig. 10b and d). Moreover, the presence of the stable, larger pores or bimodal pore size distribution [28,29] in Co/Al2O3-F, is likely to facilitate the diffusion of reactants and products decreasing the accumulation of high molecular weight carbon species, hence increasing the accessibility of cobalt active sites for the reaction. The selectivity data are displayed in Table 4. Compared with Co/Al2O3-C, the nanostructured alumina supported catalysts show higher C5+ selectivity and lower CH4 selectivity, as well as higher CO conversion. The reason may be that higher CO conversion led to a higher selectivity resulting in heavier hydrocarbons [12]. The products selectivities for the Co/Al2O3-P, Co/Al2O3-H and Co/Al2O3-R catalysts, showed a small difference between the different supports. However, the Co/Al2O3-F catalyst showed similar activity, but different selectivity suggests that the change in methane and C5+ selectivity are dependent upon the size of cobalt crystallites and catalyst's pores. This is similar to what has been reported [5,30], that higher methane selectivity was observed on catalysts with narrow pore and small cobalt particles. 4 Conclusion Various morphologies of nanostructured aluminas were synthesized using alumina nitrate. The effect of morphology of the nanostructured alumina supported cobalt catalysts on selectively and activity for FTS reaction have been investigated. The support's morphology of the nanostructured alumina significantly influenced the catalytic performance. The pore structures of the nanostructured alumina, which is dependent upon the morphology and stacking of the primary particle, have undergone reconstruction during the catalyst preparation resulting in more exposed cobalt active sites on the catalyst. Among the nanostructured alumina, the nanofiber supported catalyst has improved stability through the large, stable and interconnected bird nest-like pore structures with large cobalt particle size and showed the best catalytic performance. Acknowledgments Financial supports by the National Science Foundation of China (Grant No. 21073238), National Basic Research Program of China (Grant No. 2011CB211704), and Natural Science Foundation of Hubei Province of China (Grant No. 2009CDA049) are gratefully acknowledged. References [1] Q. Zhang J. Kang Y. Wang ChemCatChem 2 2010 1030 1058 [2] W. Chu P.A. Chernavskii L. Gengembre G.A. Pankina P. Fongarland A.Y. Khodakov J. Catal. 252 2007 215 230 [3] A.Y. Khodakov W. Chu P. Fongarland Chem. Rev. 107 2007 1692 1744 [4] E. Iglesia Appl. Catal. A: Gen. 161 1997 59 78 [5] A.Y. Khodakov A. Griboval-Constant R. Bechara V.L. Zholobenko J. Catal. 206 2002 230 241 [6] R. Bechara D. Balloy D. Vanhove Appl. Catal. A: Gen. 207 2001 343 353 [7] J. Li G. Jacobs T. Das B.H. Davis Appl. Catal. A: Gen. 233 2002 255 262 [8] G.L. Bezemer J.H. Bitter H.P.C.E. Kuipers H. Oosterbeek J.E. Holewijn X. Xu F. Kapteijn A.J. van Dillen K.P. de Jong J. Am. Chem. Soc. 128 2006 3956 3964 [9] H. Xiong M.A.M. Motchelaho M. Moyo L.L. Jewell N.J. Coville J. Catal. 278 2011 26 40 [10] R.C. Reuel C.H. Bartholomew J. Catal. 85 1984 78 88 [11] A. Martínez J. Rollán M.A. Arribas H.S. Cerqueira A.F. Costa E.F.S. Aguiar J. Catal. 249 2007 162 173 [12] S. Storsæter B. Tøtdal J.C. Walmsley B.S. Tanem A. Holmen J. Catal. 236 2005 139 152 [13] D. Wei J.G. Goodwin Jr. R. Oukaci A.H. Singleton Appl. Catal. A: Gen. 210 2001 137 150 [14] A. Martínez G. Prieto J. Rollán J. Catal. 263 2009 292 305 [15] H. Xiong Y. Zhang S. Wang J. Li Catal. Commun. 6 2005 512 516 [16] C. Lesaint W.R. Glomm Ø. Borg S. Eri E. Rytter G. Øye Appl. Catal. A: Gen. 351 2008 131 135 [17] S. Rane Ø. Borg J. Yang E. Rytter A. Holmen Appl. Catal. A: Gen. 388 2010 160 167 [18] J. Zhang J. Chen J. Ren Y. Sun Appl. Catal. A: Gen. 243 2003 121 133 [19] Ø. Borg S. Eri E.A. Blekkan S. Storsæter H. Wigum E. Rytter A. Holmen J. Catal. 248 2007 89 100 [20] Y. Ji Z. Zhao A. Duan G. Jiang J. Liu J. Phys. Chem. C 113 2009 7186 7199 [21] G. Prieto A. Martínez P. Concepción R. Moreno-Tost J. Catal. 266 2009 129 144 [22] Ø. Borg N. Hammer S. Eri O.A. Lindvåg R. Myrstad E.A. Blekkan M. Rønning E. Rytter A. Holmen Catal. Today 142 2009 70 77 [23] H. Xiong Y. Zhang K. Liew J. Li J. Mol. Catal. A: Chem. 295 2008 68 76 [24] A.M. Saib D.J. Moodley I.M. Ciobîca M.M. Hauman B.H. Sigwebela C.J. Weststrate J.W. Niemantsverdriet J. van de Loosdrecht Catal. Today 154 2010 271 282 [25] N.E. Tsakoumis M. Rønning Ø. Borg E. Rytter A. Holmen Catal. Today 154 2010 162 182 [26] I. Arslan J.C. Walmsley E. Rytter E. Bergene P.A. Midgley J. Am. Chem. Soc. 130 2008 5716 5719 [27] Ø. Borg J. Walmsley R. Dehghan B. Tanem E. Blekkan S. Eri E. Rytter A. Holmen Catal. Lett. 126 2008 224 230 [28] N. Tsubaki Y. Zhang S. Sun H. Mori Y. Yoneyama X. Li K. Fujimoto Catal. Commun. 2 2001 311 315 [29] S.-J. Park J.W. Bae J.-H. Oh K.V.R. Chary P.S.S. Prasad K.-W. Jun Y.-W. Rhee J. Mol. Catal. A: Chem. 298 2009 81 87 [30] R.B. Anderson W.K. Hall L.J.E. Hofer J. Am. Chem. Soc. 70 1948 2465 2472",
      "scopus-id": "84866047916",
      "coredata": {
        "eid": "1-s2.0-S1381116912002221",
        "dc:description": "Nanostructured aluminas with controllable morphologies were prepared and used as support of cobalt catalysts for Fischer–Tropsch synthesis. The supported cobalt catalysts were prepared by incipient wetness impregnation method and characterized by transmission electron microscopy (TEM), X-ray diffraction (XRD), temperature programmed reduction (TPR), N2 adsorption–desorption, hydrogen chemisorption and oxygen titration. Catalytic activity of the cobalt catalysts for Fischer–Tropsch synthesis (FTS) was evaluated on a fixed bed reactor. It was found that the nanostructured alumina supports undergo reconstruction during the catalyst preparation resulting in catalysts having high dispersion after reduction. The cobalt catalyst supported on the nanostructured alumina increased the CO conversion by 20–30%, compared to commercial alumina. Among the nanostructured catalysts, the alumina nanorods supported catalyst, shows the best dispersion and highest CO initial conversion. Our work disclosed that the alumina nanofibers supported catalysts have larger, stable and interconnected bird nest-like pores. In addition, the structure exhibited higher stability and lower methane selectivity for FTS.",
        "openArchiveArticle": "false",
        "prism:coverDate": "2012-11-30",
        "openaccessUserLicense": null,
        "prism:aggregationType": "Journal",
        "prism:url": "https://api.elsevier.com/content/article/pii/S1381116912002221",
        "dc:creator": [
          {
            "@_fa": "true",
            "$": "Liu, Chengchao"
          },
          {
            "@_fa": "true",
            "$": "Li, Jinlin"
          },
          {
            "@_fa": "true",
            "$": "Zhang, Yuhua"
          },
          {
            "@_fa": "true",
            "$": "Chen, Sufang"
          },
          {
            "@_fa": "true",
            "$": "Zhu, Junjiang"
          },
          {
            "@_fa": "true",
            "$": "Liew, Kongyong"
          }
        ],
        "link": [
          {
            "@_fa": "true",
            "@rel": "self",
            "@href": "https://api.elsevier.com/content/article/pii/S1381116912002221"
          },
          {
            "@_fa": "true",
            "@rel": "scidir",
            "@href": "https://www.sciencedirect.com/science/article/pii/S1381116912002221"
          }
        ],
        "dc:format": "application/json",
        "openaccessType": null,
        "pii": "S1381-1169(12)00222-1",
        "prism:volume": "363",
        "prism:publisher": "Elsevier B.V.",
        "dc:title": "Fischer–Tropsch synthesis over cobalt catalysts supported on nanostructured alumina with various morphologies",
        "prism:copyright": "Copyright © 2012 Elsevier B.V. All rights reserved.",
        "openaccess": "0",
        "prism:issn": "13811169",
        "dcterms:subject": [
          {
            "@_fa": "true",
            "$": "Fischer–Tropsch synthesis"
          },
          {
            "@_fa": "true",
            "$": "Cobalt catalysts"
          },
          {
            "@_fa": "true",
            "$": "Nanostructured alumina"
          },
          {
            "@_fa": "true",
            "$": "Morphology"
          }
        ],
        "openaccessArticle": "false",
        "prism:publicationName": "Journal of Molecular Catalysis A: Chemical",
        "openaccessSponsorType": null,
        "prism:pageRange": "335-342",
        "prism:endingPage": "342",
        "pubType": "fla",
        "prism:coverDisplayDate": "November 2012",
        "prism:doi": "10.1016/j.molcata.2012.07.009",
        "prism:startingPage": "335",
        "dc:identifier": "doi:10.1016/j.molcata.2012.07.009",
        "openaccessSponsorName": null
      },
      "objects": {
        "object": [
          {
            "@category": "standard",
            "@height": "289",
            "@width": "362",
            "@_fa": "true",
            "$": "https://api.elsevier.com/content/object/eid/1-s2.0-S1381116912002221-gr1.jpg?httpAccept=%2A%2F%2A",
            "@multimediatype": "JPEG image file",
            "@type": "IMAGE-DOWNSAMPLED",
            "@size": "35742",
            "@ref": "gr1",
            "@mimetype": "image/jpeg"
          },
          {
            "@category": "thumbnail",
            "@height": "164",
            "@width": "205",
            "@_fa": "true",
            "$": "https://api.elsevier.com/content/object/eid/1-s2.0-S1381116912002221-gr1.sml?httpAccept=%2A%2F%2A",
            "@multimediatype": "GIF image file",
            "@type": "IMAGE-THUMBNAIL",
            "@size": "4792",
            "@ref": "gr1",
            "@mimetype": "image/gif"
          },
          {
            "@category": "high",
            "@height": "1282",
            "@width": "1605",
            "@_fa": "true",
            "$": "https://api.elsevier.com/content/object/eid/1-s2.0-S1381116912002221-gr1_lrg.jpg?httpAccept=%2A%2F%2A",
            "@multimediatype": "JPEG image file",
            "@type": "IMAGE-HIGH-RES",
            "@size": "232837",
            "@ref": "gr1",
            "@mimetype": "image/jpeg"
          },
          {
            "@category": "standard",
            "@height": "566",
            "@width": "376",
            "@_fa": "true",
            "$": "https://api.elsevier.com/content/object/eid/1-s2.0-S1381116912002221-gr2.jpg?httpAccept=%2A%2F%2A",
            "@multimediatype": "JPEG image file",
            "@type": "IMAGE-DOWNSAMPLED",
            "@size": "65006",
            "@ref": "gr2",
            "@mimetype": "image/jpeg"
          },
          {
            "@category": "thumbnail",
            "@height": "164",
            "@width": "109",
            "@_fa": "true",
            "$": "https://api.elsevier.com/content/object/eid/1-s2.0-S1381116912002221-gr2.sml?httpAccept=%2A%2F%2A",
            "@multimediatype": "GIF image file",
            "@type": "IMAGE-THUMBNAIL",
            "@size": "3153",
            "@ref": "gr2",
            "@mimetype": "image/gif"
          },
          {
            "@category": "high",
            "@height": "2508",
            "@width": "1667",
            "@_fa": "true",
            "$": "https://api.elsevier.com/content/object/eid/1-s2.0-S1381116912002221-gr2_lrg.jpg?httpAccept=%2A%2F%2A",
            "@multimediatype": "JPEG image file",
            "@type": "IMAGE-HIGH-RES",
            "@size": "423345",
            "@ref": "gr2",
            "@mimetype": "image/jpeg"
          },
          {
            "@category": "standard",
            "@height": "944",
            "@width": "376",
            "@_fa": "true",
            "$": "https://api.elsevier.com/content/object/eid/1-s2.0-S1381116912002221-gr3.jpg?httpAccept=%2A%2F%2A",
            "@multimediatype": "JPEG image file",
            "@type": "IMAGE-DOWNSAMPLED",
            "@size": "173256",
            "@ref": "gr3",
            "@mimetype": "image/jpeg"
          },
          {
            "@category": "thumbnail",
            "@height": "163",
            "@width": "65",
            "@_fa": "true",
            "$": "https://api.elsevier.com/content/object/eid/1-s2.0-S1381116912002221-gr3.sml?httpAccept=%2A%2F%2A",
            "@multimediatype": "GIF image file",
            "@type": "IMAGE-THUMBNAIL",
            "@size": "5947",
            "@ref": "gr3",
            "@mimetype": "image/gif"
          },
          {
            "@category": "high",
            "@height": "4184",
            "@width": "1667",
            "@_fa": "true",
            "$": "https://api.elsevier.com/content/object/eid/1-s2.0-S1381116912002221-gr3_lrg.jpg?httpAccept=%2A%2F%2A",
            "@multimediatype": "JPEG image file",
            "@type": "IMAGE-HIGH-RES",
            "@size": "2067498",
            "@ref": "gr3",
            "@mimetype": "image/jpeg"
          },
          {
            "@category": "standard",
            "@height": "295",
            "@width": "371",
            "@_fa": "true",
            "$": "https://api.elsevier.com/content/object/eid/1-s2.0-S1381116912002221-gr4.jpg?httpAccept=%2A%2F%2A",
            "@multimediatype": "JPEG image file",
            "@type": "IMAGE-DOWNSAMPLED",
            "@size": "39944",
            "@ref": "gr4",
            "@mimetype": "image/jpeg"
          },
          {
            "@category": "thumbnail",
            "@height": "164",
            "@width": "206",
            "@_fa": "true",
            "$": "https://api.elsevier.com/content/object/eid/1-s2.0-S1381116912002221-gr4.sml?httpAccept=%2A%2F%2A",
            "@multimediatype": "GIF image file",
            "@type": "IMAGE-THUMBNAIL",
            "@size": "5062",
            "@ref": "gr4",
            "@mimetype": "image/gif"
          },
          {
            "@category": "high",
            "@height": "1307",
            "@width": "1643",
            "@_fa": "true",
            "$": "https://api.elsevier.com/content/object/eid/1-s2.0-S1381116912002221-gr4_lrg.jpg?httpAccept=%2A%2F%2A",
            "@multimediatype": "JPEG image file",
            "@type": "IMAGE-HIGH-RES",
            "@size": "280540",
            "@ref": "gr4",
            "@mimetype": "image/jpeg"
          },
          {
            "@category": "standard",
            "@height": "578",
            "@width": "376",
            "@_fa": "true",
            "$": "https://api.elsevier.com/content/object/eid/1-s2.0-S1381116912002221-gr5.jpg?httpAccept=%2A%2F%2A",
            "@multimediatype": "JPEG image file",
            "@type": "IMAGE-DOWNSAMPLED",
            "@size": "60062",
            "@ref": "gr5",
            "@mimetype": "image/jpeg"
          },
          {
            "@category": "thumbnail",
            "@height": "163",
            "@width": "106",
            "@_fa": "true",
            "$": "https://api.elsevier.com/content/object/eid/1-s2.0-S1381116912002221-gr5.sml?httpAccept=%2A%2F%2A",
            "@multimediatype": "GIF image file",
            "@type": "IMAGE-THUMBNAIL",
            "@size": "2940",
            "@ref": "gr5",
            "@mimetype": "image/gif"
          },
          {
            "@category": "high",
            "@height": "2562",
            "@width": "1667",
            "@_fa": "true",
            "$": "https://api.elsevier.com/content/object/eid/1-s2.0-S1381116912002221-gr5_lrg.jpg?httpAccept=%2A%2F%2A",
            "@multimediatype": "JPEG image file",
            "@type": "IMAGE-HIGH-RES",
            "@size": "413816",
            "@ref": "gr5",
            "@mimetype": "image/jpeg"
          },
          {
            "@category": "standard",
            "@height": "294",
            "@width": "364",
            "@_fa": "true",
            "$": "https://api.elsevier.com/content/object/eid/1-s2.0-S1381116912002221-gr6.jpg?httpAccept=%2A%2F%2A",
            "@multimediatype": "JPEG image file",
            "@type": "IMAGE-DOWNSAMPLED",
            "@size": "37370",
            "@ref": "gr6",
            "@mimetype": "image/jpeg"
          },
          {
            "@category": "thumbnail",
            "@height": "164",
            "@width": "203",
            "@_fa": "true",
            "$": "https://api.elsevier.com/content/object/eid/1-s2.0-S1381116912002221-gr6.sml?httpAccept=%2A%2F%2A",
            "@multimediatype": "GIF image file",
            "@type": "IMAGE-THUMBNAIL",
            "@size": "4482",
            "@ref": "gr6",
            "@mimetype": "image/gif"
          },
          {
            "@category": "high",
            "@height": "1299",
            "@width": "1611",
            "@_fa": "true",
            "$": "https://api.elsevier.com/content/object/eid/1-s2.0-S1381116912002221-gr6_lrg.jpg?httpAccept=%2A%2F%2A",
            "@multimediatype": "JPEG image file",
            "@type": "IMAGE-HIGH-RES",
            "@size": "234700",
            "@ref": "gr6",
            "@mimetype": "image/jpeg"
          },
          {
            "@category": "standard",
            "@height": "594",
            "@width": "379",
            "@_fa": "true",
            "$": "https://api.elsevier.com/content/object/eid/1-s2.0-S1381116912002221-gr7.jpg?httpAccept=%2A%2F%2A",
            "@multimediatype": "JPEG image file",
            "@type": "IMAGE-DOWNSAMPLED",
            "@size": "48159",
            "@ref": "gr7",
            "@mimetype": "image/jpeg"
          },
          {
            "@category": "thumbnail",
            "@height": "163",
            "@width": "104",
            "@_fa": "true",
            "$": "https://api.elsevier.com/content/object/eid/1-s2.0-S1381116912002221-gr7.sml?httpAccept=%2A%2F%2A",
            "@multimediatype": "GIF image file",
            "@type": "IMAGE-THUMBNAIL",
            "@size": "2217",
            "@ref": "gr7",
            "@mimetype": "image/gif"
          },
          {
            "@category": "high",
            "@height": "2632",
            "@width": "1678",
            "@_fa": "true",
            "$": "https://api.elsevier.com/content/object/eid/1-s2.0-S1381116912002221-gr7_lrg.jpg?httpAccept=%2A%2F%2A",
            "@multimediatype": "JPEG image file",
            "@type": "IMAGE-HIGH-RES",
            "@size": "299654",
            "@ref": "gr7",
            "@mimetype": "image/jpeg"
          },
          {
            "@category": "standard",
            "@height": "286",
            "@width": "390",
            "@_fa": "true",
            "$": "https://api.elsevier.com/content/object/eid/1-s2.0-S1381116912002221-gr8.jpg?httpAccept=%2A%2F%2A",
            "@multimediatype": "JPEG image file",
            "@type": "IMAGE-DOWNSAMPLED",
            "@size": "32090",
            "@ref": "gr8",
            "@mimetype": "image/jpeg"
          },
          {
            "@category": "thumbnail",
            "@height": "161",
            "@width": "219",
            "@_fa": "true",
            "$": "https://api.elsevier.com/content/object/eid/1-s2.0-S1381116912002221-gr8.sml?httpAccept=%2A%2F%2A",
            "@multimediatype": "GIF image file",
            "@type": "IMAGE-THUMBNAIL",
            "@size": "4108",
            "@ref": "gr8",
            "@mimetype": "image/gif"
          },
          {
            "@category": "high",
            "@height": "1268",
            "@width": "1728",
            "@_fa": "true",
            "$": "https://api.elsevier.com/content/object/eid/1-s2.0-S1381116912002221-gr8_lrg.jpg?httpAccept=%2A%2F%2A",
            "@multimediatype": "JPEG image file",
            "@type": "IMAGE-HIGH-RES",
            "@size": "196192",
            "@ref": "gr8",
            "@mimetype": "image/jpeg"
          },
          {
            "@category": "standard",
            "@height": "259",
            "@width": "376",
            "@_fa": "true",
            "$": "https://api.elsevier.com/content/object/eid/1-s2.0-S1381116912002221-gr9.jpg?httpAccept=%2A%2F%2A",
            "@multimediatype": "JPEG image file",
            "@type": "IMAGE-DOWNSAMPLED",
            "@size": "23988",
            "@ref": "gr9",
            "@mimetype": "image/jpeg"
          },
          {
            "@category": "thumbnail",
            "@height": "151",
            "@width": "219",
            "@_fa": "true",
            "$": "https://api.elsevier.com/content/object/eid/1-s2.0-S1381116912002221-gr9.sml?httpAccept=%2A%2F%2A",
            "@multimediatype": "GIF image file",
            "@type": "IMAGE-THUMBNAIL",
            "@size": "2628",
            "@ref": "gr9",
            "@mimetype": "image/gif"
          },
          {
            "@category": "high",
            "@height": "1148",
            "@width": "1667",
            "@_fa": "true",
            "$": "https://api.elsevier.com/content/object/eid/1-s2.0-S1381116912002221-gr9_lrg.jpg?httpAccept=%2A%2F%2A",
            "@multimediatype": "JPEG image file",
            "@type": "IMAGE-HIGH-RES",
            "@size": "112404",
            "@ref": "gr9",
            "@mimetype": "image/jpeg"
          },
          {
            "@category": "standard",
            "@height": "376",
            "@width": "376",
            "@_fa": "true",
            "$": "https://api.elsevier.com/content/object/eid/1-s2.0-S1381116912002221-gr10.jpg?httpAccept=%2A%2F%2A",
            "@multimediatype": "JPEG image file",
            "@type": "IMAGE-DOWNSAMPLED",
            "@size": "59102",
            "@ref": "gr10",
            "@mimetype": "image/jpeg"
          },
          {
            "@category": "thumbnail",
            "@height": "164",
            "@width": "164",
            "@_fa": "true",
            "$": "https://api.elsevier.com/content/object/eid/1-s2.0-S1381116912002221-gr10.sml?httpAccept=%2A%2F%2A",
            "@multimediatype": "GIF image file",
            "@type": "IMAGE-THUMBNAIL",
            "@size": "9122",
            "@ref": "gr10",
            "@mimetype": "image/gif"
          },
          {
            "@category": "high",
            "@height": "1669",
            "@width": "1667",
            "@_fa": "true",
            "$": "https://api.elsevier.com/content/object/eid/1-s2.0-S1381116912002221-gr10_lrg.jpg?httpAccept=%2A%2F%2A",
            "@multimediatype": "JPEG image file",
            "@type": "IMAGE-HIGH-RES",
            "@size": "709203",
            "@ref": "gr10",
            "@mimetype": "image/jpeg"
          },
          {
            "@category": "standard",
            "@height": "200",
            "@width": "273",
            "@_fa": "true",
            "$": "https://api.elsevier.com/content/object/eid/1-s2.0-S1381116912002221-fx1.jpg?httpAccept=%2A%2F%2A",
            "@multimediatype": "JPEG image file",
            "@type": "IMAGE-DOWNSAMPLED",
            "@size": "15593",
            "@ref": "fx1",
            "@mimetype": "image/jpeg"
          },
          {
            "@category": "thumbnail",
            "@height": "160",
            "@width": "219",
            "@_fa": "true",
            "$": "https://api.elsevier.com/content/object/eid/1-s2.0-S1381116912002221-fx1.sml?httpAccept=%2A%2F%2A",
            "@multimediatype": "GIF image file",
            "@type": "IMAGE-THUMBNAIL",
            "@size": "5596",
            "@ref": "fx1",
            "@mimetype": "image/gif"
          },
          {
            "@category": "high",
            "@height": "886",
            "@width": "1209",
            "@_fa": "true",
            "$": "https://api.elsevier.com/content/object/eid/1-s2.0-S1381116912002221-fx1_lrg.jpg?httpAccept=%2A%2F%2A",
            "@multimediatype": "JPEG image file",
            "@type": "IMAGE-HIGH-RES",
            "@size": "114263",
            "@ref": "fx1",
            "@mimetype": "image/jpeg"
          }
        ]
      },
      "link": {
        "@rel": "abstract",
        "@href": "https://api.elsevier.com/content/abstract/scopus_id/84866047916"
      }
    }
  }
}