{
  "metadata": {
    "title": "Zirconium <ce:italic>bis</ce:italic>-cyclopentadienyl compounds: An investigation into the influence of substituent effects on the ethene polymerisation behaviour of (CpR)<ce:inf loc=post>2</ce:inf>ZrCl<ce:inf loc=post>2</ce:inf>/MAO catalysts",
    "authors": "; ; ",
    "journal": "Journal of Molecular Catalysis A: Chemical",
    "date": "2002-09-30",
    "doi": "10.1016/S1381-1169(02)00342-4",
    "abstract": "",
    "uri": "https://api.elsevier.com/content/article/pii/S1381116902003424",
    "pii": "S1381116902003424"
  },
  "fulltext": {
    "full-text-retrieval-response": {
      "scopus-eid": "2-s2.0-0037200968",
      "originalText": "serial JL 271358 291210 291744 291790 291809 31 Journal of Molecular Catalysis A: Chemical JOURNALMOLECULARCATALYSISACHEMICAL 2002-08-28 2002-08-28 2010-04-18T17:18:08 1-s2.0-S1381116902003424 S1381-1169(02)00342-4 S1381116902003424 10.1016/S1381-1169(02)00342-4 S300 S300.1 FULL-TEXT 1-s2.0-S1381116900X01550 2015-05-15T05:56:33.301439-04:00 0 0 20020930 2002 2002-08-28T00:00:00Z articleinfo crossmark dco dateupdated tomb dateloaded datesearch indexeddate issuelist volumelist yearnav absattachment articletitlenorm authfirstinitialnorm authfirstsurnamenorm cid cids contenttype copyright dateloadedtxt docsubtype doctype doi eid ewtransactionid hubeid issfirst issn issnnorm itemstage itemtransactionid itemweight openaccess openarchive pg pgfirst pglast pii piinorm pubdatestart pubdatetxt pubyr sortorder srctitle srctitlenorm srctype subheadings volfirst volissue webpdf webpdfpagecount figure table body acknowledge affil articletitle auth authfirstini authfull authkeywords authlast primabst ref specialabst alllist content subj ssids 1381-1169 13811169 188 188 1 2 1 2 Volume 188, Issues 1–2 14 105 113 105 113 20020930 30 September 2002 2002-09-30 2002 converted-article fla Copyright © 2002 Elsevier Science B.V. All rights reserved. ZIRCONIUMBISCYCLOPENTADIENYLCOMPOUNDS GRIMMER N 1 Introduction 2 Results and discussion 2.1 Steric measurements 2.2 Polymerisation studies 3 Conclusions 4 Methods section 4.1 Steric size measurements 4.2 Polymerisation studies Acknowledgements References TOLMAN 1977 313 348 C CHIEN 1988 2369 2380 J HENRICIOLIVE 1971 105 115 G MOHRING 1992 41 50 P EWEN 1986 271 292 J MARIN 1990 236 V NEKHAEVA 1991 139 146 L JANIAK 1996 1517 1529 C TOLMAN 1970 2956 2965 C WHITE 1994 95 158 D TAVERNER 1996 1612 1623 B IMMIRZI 1977 L41 L42 A HORTMANN 1992 51 55 K BURGER 1993 127 140 P ERKER 1989 454 460 G ERKER 1989 1715 1722 G ERKER 1985 321 323 G ERKER 1987 201 211 G BENN 1988 777 778 R HENRICIOLIVE 1967 790 798 G FINK 1981 3265 3278 G FINK 1985 158 166 G YANG 1994 10015 10031 X JIA 1997 842 857 L ALELYUNAS 1991 1406 1416 Y LEE 1992 2115 2122 I PICCOLROVAZZI 1990 3098 3105 N LUHTANEN 2002 49 T JANIAK 1995 219 234 C EWEN 1986 271 291 J MALLIN 1988 421 425 D LEINO 1998 171 179 R LEE 1999 181 190 B KAMINSKY 1986 377 387 W BRINTZINGER 1995 1143 1170 H ALLEN 1991 187 204 F ALLEN 1993 31 F WANG 1993 506 J BONDI 1964 441 451 A JORDAN 1989 2892 2903 R RENAUT 1978 35 42 P HANSCH 1991 165 195 C GRIMMERX2002X105 GRIMMERX2002X105X113 GRIMMERX2002X105XN GRIMMERX2002X105X113XN item S1381-1169(02)00342-4 S1381116902003424 1-s2.0-S1381116902003424 10.1016/S1381-1169(02)00342-4 271358 2010-10-03T19:46:21.143449-04:00 2002-09-30 1-s2.0-S1381116902003424-main.pdf https://s3.amazonaws.com/prod-ucs-content-store-us-east/content/pii:S1381116902003424/MAIN/application/pdf/b9b82e6b04b1a4efa5bc8d405e9575ec/main.pdf https://s3-eu-west-1.amazonaws.com/prod-ucs-content-store-eu-west/content/pii:S1381116902003424/MAIN/application/pdf/b9b82e6b04b1a4efa5bc8d405e9575ec/main.pdf main.pdf pdf true 160366 MAIN 9 1-s2.0-S1381116902003424-main_1.png https://s3.amazonaws.com/prod-ucs-content-store-us-east/content/pii:S1381116902003424/PREVIEW/image/png/9db4b0c03f742531b704f7217e556430/main_1.png https://s3-eu-west-1.amazonaws.com/prod-ucs-content-store-eu-west/content/pii:S1381116902003424/PREVIEW/image/png/9db4b0c03f742531b704f7217e556430/main_1.png main_1.png png 54531 849 656 IMAGE-WEB-PDF 1 1-s2.0-S1381116902003424-si9.gif https://s3.amazonaws.com/prod-ucs-content-store-us-east/content/pii:S1381116902003424/STRIPIN/image/gif/fc31212e6ec5ded0b6dde74190f8296c/si9.gif https://s3-eu-west-1.amazonaws.com/prod-ucs-content-store-eu-west/content/pii:S1381116902003424/STRIPIN/image/gif/fc31212e6ec5ded0b6dde74190f8296c/si9.gif si9 si9.gif gif 1649 15 518 ALTIMG 1-s2.0-S1381116902003424-si8.gif https://s3.amazonaws.com/prod-ucs-content-store-us-east/content/pii:S1381116902003424/STRIPIN/image/gif/2204346af9749b7b7b1df798ddd252af/si8.gif https://s3-eu-west-1.amazonaws.com/prod-ucs-content-store-eu-west/content/pii:S1381116902003424/STRIPIN/image/gif/2204346af9749b7b7b1df798ddd252af/si8.gif si8 si8.gif gif 684 18 122 ALTIMG 1-s2.0-S1381116902003424-si7.gif https://s3.amazonaws.com/prod-ucs-content-store-us-east/content/pii:S1381116902003424/STRIPIN/image/gif/e7be2201fb9b23d5f84eafc0950a35d9/si7.gif https://s3-eu-west-1.amazonaws.com/prod-ucs-content-store-eu-west/content/pii:S1381116902003424/STRIPIN/image/gif/e7be2201fb9b23d5f84eafc0950a35d9/si7.gif si7 si7.gif gif 1211 16 319 ALTIMG 1-s2.0-S1381116902003424-si6.gif https://s3.amazonaws.com/prod-ucs-content-store-us-east/content/pii:S1381116902003424/STRIPIN/image/gif/ef26f35f1fe4ddcf6e00d7f4c1dd859f/si6.gif https://s3-eu-west-1.amazonaws.com/prod-ucs-content-store-eu-west/content/pii:S1381116902003424/STRIPIN/image/gif/ef26f35f1fe4ddcf6e00d7f4c1dd859f/si6.gif si6 si6.gif gif 702 18 134 ALTIMG 1-s2.0-S1381116902003424-si5.gif https://s3.amazonaws.com/prod-ucs-content-store-us-east/content/pii:S1381116902003424/STRIPIN/image/gif/550a145448038aad6941b5c67d548a6c/si26.gif https://s3-eu-west-1.amazonaws.com/prod-ucs-content-store-eu-west/content/pii:S1381116902003424/STRIPIN/image/gif/550a145448038aad6941b5c67d548a6c/si26.gif si5 si5.gif gif 203 14 25 ALTIMG 1-s2.0-S1381116902003424-si4.gif https://s3.amazonaws.com/prod-ucs-content-store-us-east/content/pii:S1381116902003424/STRIPIN/image/gif/a8cae2091e7baaf64a7a0abce0f2af99/si25.gif https://s3-eu-west-1.amazonaws.com/prod-ucs-content-store-eu-west/content/pii:S1381116902003424/STRIPIN/image/gif/a8cae2091e7baaf64a7a0abce0f2af99/si25.gif si4 si4.gif gif 202 14 27 ALTIMG 1-s2.0-S1381116902003424-si35.gif https://s3.amazonaws.com/prod-ucs-content-store-us-east/content/pii:S1381116902003424/STRIPIN/image/gif/ef26f35f1fe4ddcf6e00d7f4c1dd859f/si6.gif https://s3-eu-west-1.amazonaws.com/prod-ucs-content-store-eu-west/content/pii:S1381116902003424/STRIPIN/image/gif/ef26f35f1fe4ddcf6e00d7f4c1dd859f/si6.gif si35 si35.gif gif 702 18 134 ALTIMG 1-s2.0-S1381116902003424-si34.gif https://s3.amazonaws.com/prod-ucs-content-store-us-east/content/pii:S1381116902003424/STRIPIN/image/gif/a8cae2091e7baaf64a7a0abce0f2af99/si25.gif https://s3-eu-west-1.amazonaws.com/prod-ucs-content-store-eu-west/content/pii:S1381116902003424/STRIPIN/image/gif/a8cae2091e7baaf64a7a0abce0f2af99/si25.gif si34 si34.gif gif 202 14 27 ALTIMG 1-s2.0-S1381116902003424-si33.gif https://s3.amazonaws.com/prod-ucs-content-store-us-east/content/pii:S1381116902003424/STRIPIN/image/gif/550a145448038aad6941b5c67d548a6c/si26.gif https://s3-eu-west-1.amazonaws.com/prod-ucs-content-store-eu-west/content/pii:S1381116902003424/STRIPIN/image/gif/550a145448038aad6941b5c67d548a6c/si26.gif si33 si33.gif gif 203 14 25 ALTIMG 1-s2.0-S1381116902003424-si32.gif https://s3.amazonaws.com/prod-ucs-content-store-us-east/content/pii:S1381116902003424/STRIPIN/image/gif/550a145448038aad6941b5c67d548a6c/si26.gif https://s3-eu-west-1.amazonaws.com/prod-ucs-content-store-eu-west/content/pii:S1381116902003424/STRIPIN/image/gif/550a145448038aad6941b5c67d548a6c/si26.gif si32 si32.gif gif 203 14 25 ALTIMG 1-s2.0-S1381116902003424-si31.gif https://s3.amazonaws.com/prod-ucs-content-store-us-east/content/pii:S1381116902003424/STRIPIN/image/gif/297e64d1b4ef77232fc00cdb29433539/si31.gif https://s3-eu-west-1.amazonaws.com/prod-ucs-content-store-eu-west/content/pii:S1381116902003424/STRIPIN/image/gif/297e64d1b4ef77232fc00cdb29433539/si31.gif si31 si31.gif gif 1938 18 464 ALTIMG 1-s2.0-S1381116902003424-si30.gif https://s3.amazonaws.com/prod-ucs-content-store-us-east/content/pii:S1381116902003424/STRIPIN/image/gif/7db425e41d7f8cb9ffcc524e0aa8303c/si30.gif https://s3-eu-west-1.amazonaws.com/prod-ucs-content-store-eu-west/content/pii:S1381116902003424/STRIPIN/image/gif/7db425e41d7f8cb9ffcc524e0aa8303c/si30.gif si30 si30.gif gif 445 17 75 ALTIMG 1-s2.0-S1381116902003424-si3.gif https://s3.amazonaws.com/prod-ucs-content-store-us-east/content/pii:S1381116902003424/STRIPIN/image/gif/550a145448038aad6941b5c67d548a6c/si26.gif https://s3-eu-west-1.amazonaws.com/prod-ucs-content-store-eu-west/content/pii:S1381116902003424/STRIPIN/image/gif/550a145448038aad6941b5c67d548a6c/si26.gif si3 si3.gif gif 203 14 25 ALTIMG 1-s2.0-S1381116902003424-si29.gif https://s3.amazonaws.com/prod-ucs-content-store-us-east/content/pii:S1381116902003424/STRIPIN/image/gif/8604b42f5f5393cfad8cdab2b93c3cc5/si29.gif https://s3-eu-west-1.amazonaws.com/prod-ucs-content-store-eu-west/content/pii:S1381116902003424/STRIPIN/image/gif/8604b42f5f5393cfad8cdab2b93c3cc5/si29.gif si29 si29.gif gif 865 31 187 ALTIMG 1-s2.0-S1381116902003424-si28.gif https://s3.amazonaws.com/prod-ucs-content-store-us-east/content/pii:S1381116902003424/STRIPIN/image/gif/550a145448038aad6941b5c67d548a6c/si26.gif https://s3-eu-west-1.amazonaws.com/prod-ucs-content-store-eu-west/content/pii:S1381116902003424/STRIPIN/image/gif/550a145448038aad6941b5c67d548a6c/si26.gif si28 si28.gif gif 203 14 25 ALTIMG 1-s2.0-S1381116902003424-si27.gif https://s3.amazonaws.com/prod-ucs-content-store-us-east/content/pii:S1381116902003424/STRIPIN/image/gif/63eb5e212ac62dd78cb460c59bec0b87/si27.gif https://s3-eu-west-1.amazonaws.com/prod-ucs-content-store-eu-west/content/pii:S1381116902003424/STRIPIN/image/gif/63eb5e212ac62dd78cb460c59bec0b87/si27.gif si27 si27.gif gif 422 14 86 ALTIMG 1-s2.0-S1381116902003424-si26.gif https://s3.amazonaws.com/prod-ucs-content-store-us-east/content/pii:S1381116902003424/STRIPIN/image/gif/550a145448038aad6941b5c67d548a6c/si26.gif https://s3-eu-west-1.amazonaws.com/prod-ucs-content-store-eu-west/content/pii:S1381116902003424/STRIPIN/image/gif/550a145448038aad6941b5c67d548a6c/si26.gif si26 si26.gif gif 203 14 25 ALTIMG 1-s2.0-S1381116902003424-si25.gif https://s3.amazonaws.com/prod-ucs-content-store-us-east/content/pii:S1381116902003424/STRIPIN/image/gif/a8cae2091e7baaf64a7a0abce0f2af99/si25.gif https://s3-eu-west-1.amazonaws.com/prod-ucs-content-store-eu-west/content/pii:S1381116902003424/STRIPIN/image/gif/a8cae2091e7baaf64a7a0abce0f2af99/si25.gif si25 si25.gif gif 202 14 27 ALTIMG 1-s2.0-S1381116902003424-si24.gif https://s3.amazonaws.com/prod-ucs-content-store-us-east/content/pii:S1381116902003424/STRIPIN/image/gif/550a145448038aad6941b5c67d548a6c/si26.gif https://s3-eu-west-1.amazonaws.com/prod-ucs-content-store-eu-west/content/pii:S1381116902003424/STRIPIN/image/gif/550a145448038aad6941b5c67d548a6c/si26.gif si24 si24.gif gif 203 14 25 ALTIMG 1-s2.0-S1381116902003424-si23.gif https://s3.amazonaws.com/prod-ucs-content-store-us-east/content/pii:S1381116902003424/STRIPIN/image/gif/a8cae2091e7baaf64a7a0abce0f2af99/si25.gif https://s3-eu-west-1.amazonaws.com/prod-ucs-content-store-eu-west/content/pii:S1381116902003424/STRIPIN/image/gif/a8cae2091e7baaf64a7a0abce0f2af99/si25.gif si23 si23.gif gif 202 14 27 ALTIMG 1-s2.0-S1381116902003424-si22.gif https://s3.amazonaws.com/prod-ucs-content-store-us-east/content/pii:S1381116902003424/STRIPIN/image/gif/92a937de85996cf8da9e1b774759e7cb/si22.gif https://s3-eu-west-1.amazonaws.com/prod-ucs-content-store-eu-west/content/pii:S1381116902003424/STRIPIN/image/gif/92a937de85996cf8da9e1b774759e7cb/si22.gif si22 si22.gif gif 1123 36 215 ALTIMG 1-s2.0-S1381116902003424-si21.gif https://s3.amazonaws.com/prod-ucs-content-store-us-east/content/pii:S1381116902003424/STRIPIN/image/gif/94372bb47590a1a2cb2ed35b74e5029a/si21.gif https://s3-eu-west-1.amazonaws.com/prod-ucs-content-store-eu-west/content/pii:S1381116902003424/STRIPIN/image/gif/94372bb47590a1a2cb2ed35b74e5029a/si21.gif si21 si21.gif gif 475 14 111 ALTIMG 1-s2.0-S1381116902003424-si20.gif https://s3.amazonaws.com/prod-ucs-content-store-us-east/content/pii:S1381116902003424/STRIPIN/image/gif/550a145448038aad6941b5c67d548a6c/si26.gif https://s3-eu-west-1.amazonaws.com/prod-ucs-content-store-eu-west/content/pii:S1381116902003424/STRIPIN/image/gif/550a145448038aad6941b5c67d548a6c/si26.gif si20 true si20.gif gif 203 14 25 ALTIMG 1-s2.0-S1381116902003424-si2.gif https://s3.amazonaws.com/prod-ucs-content-store-us-east/content/pii:S1381116902003424/STRIPIN/image/gif/a8cae2091e7baaf64a7a0abce0f2af99/si25.gif https://s3-eu-west-1.amazonaws.com/prod-ucs-content-store-eu-west/content/pii:S1381116902003424/STRIPIN/image/gif/a8cae2091e7baaf64a7a0abce0f2af99/si25.gif si2 si2.gif gif 202 14 27 ALTIMG 1-s2.0-S1381116902003424-si19.gif https://s3.amazonaws.com/prod-ucs-content-store-us-east/content/pii:S1381116902003424/STRIPIN/image/gif/a8cae2091e7baaf64a7a0abce0f2af99/si25.gif https://s3-eu-west-1.amazonaws.com/prod-ucs-content-store-eu-west/content/pii:S1381116902003424/STRIPIN/image/gif/a8cae2091e7baaf64a7a0abce0f2af99/si25.gif si19 true si19.gif gif 202 14 27 ALTIMG 1-s2.0-S1381116902003424-si18.gif https://s3.amazonaws.com/prod-ucs-content-store-us-east/content/pii:S1381116902003424/STRIPIN/image/gif/fc9ac4f5fe701593d59662a120d30eff/si18.gif https://s3-eu-west-1.amazonaws.com/prod-ucs-content-store-eu-west/content/pii:S1381116902003424/STRIPIN/image/gif/fc9ac4f5fe701593d59662a120d30eff/si18.gif si18 si18.gif gif 782 16 196 ALTIMG 1-s2.0-S1381116902003424-si17.gif https://s3.amazonaws.com/prod-ucs-content-store-us-east/content/pii:S1381116902003424/STRIPIN/image/gif/1daf76e7d35493363d1307c6b490d4f6/si17.gif https://s3-eu-west-1.amazonaws.com/prod-ucs-content-store-eu-west/content/pii:S1381116902003424/STRIPIN/image/gif/1daf76e7d35493363d1307c6b490d4f6/si17.gif si17 si17.gif gif 652 18 122 ALTIMG 1-s2.0-S1381116902003424-si16.gif https://s3.amazonaws.com/prod-ucs-content-store-us-east/content/pii:S1381116902003424/STRIPIN/image/gif/1d7010d89913fc747be52de9affc1a42/si16.gif https://s3-eu-west-1.amazonaws.com/prod-ucs-content-store-eu-west/content/pii:S1381116902003424/STRIPIN/image/gif/1d7010d89913fc747be52de9affc1a42/si16.gif si16 si16.gif gif 1222 16 319 ALTIMG 1-s2.0-S1381116902003424-si15.gif https://s3.amazonaws.com/prod-ucs-content-store-us-east/content/pii:S1381116902003424/STRIPIN/image/gif/51df506de105451dc9e7a46ae80b7c90/si15.gif https://s3-eu-west-1.amazonaws.com/prod-ucs-content-store-eu-west/content/pii:S1381116902003424/STRIPIN/image/gif/51df506de105451dc9e7a46ae80b7c90/si15.gif si15 si15.gif gif 929 17 240 ALTIMG 1-s2.0-S1381116902003424-si14.gif https://s3.amazonaws.com/prod-ucs-content-store-us-east/content/pii:S1381116902003424/STRIPIN/image/gif/4292e10aed3de18b08a87a0ad3971174/si14.gif https://s3-eu-west-1.amazonaws.com/prod-ucs-content-store-eu-west/content/pii:S1381116902003424/STRIPIN/image/gif/4292e10aed3de18b08a87a0ad3971174/si14.gif si14 si14.gif gif 593 18 122 ALTIMG 1-s2.0-S1381116902003424-si13.gif https://s3.amazonaws.com/prod-ucs-content-store-us-east/content/pii:S1381116902003424/STRIPIN/image/gif/e1cd883437c37bf8a13f7507643dcd1b/si13.gif https://s3-eu-west-1.amazonaws.com/prod-ucs-content-store-eu-west/content/pii:S1381116902003424/STRIPIN/image/gif/e1cd883437c37bf8a13f7507643dcd1b/si13.gif si13 si13.gif gif 556 15 119 ALTIMG 1-s2.0-S1381116902003424-si12.gif https://s3.amazonaws.com/prod-ucs-content-store-us-east/content/pii:S1381116902003424/STRIPIN/image/gif/a2d122df12425e56a3a895c18750a405/si12.gif https://s3-eu-west-1.amazonaws.com/prod-ucs-content-store-eu-west/content/pii:S1381116902003424/STRIPIN/image/gif/a2d122df12425e56a3a895c18750a405/si12.gif si12 si12.gif gif 637 18 121 ALTIMG 1-s2.0-S1381116902003424-si11.gif https://s3.amazonaws.com/prod-ucs-content-store-us-east/content/pii:S1381116902003424/STRIPIN/image/gif/ed1c3623425aa07da619002b2118bc94/si11.gif https://s3-eu-west-1.amazonaws.com/prod-ucs-content-store-eu-west/content/pii:S1381116902003424/STRIPIN/image/gif/ed1c3623425aa07da619002b2118bc94/si11.gif si11 si11.gif gif 579 15 142 ALTIMG 1-s2.0-S1381116902003424-si10.gif https://s3.amazonaws.com/prod-ucs-content-store-us-east/content/pii:S1381116902003424/STRIPIN/image/gif/9f92e4f9ed30a0b43798ebbe1d781376/si10.gif https://s3-eu-west-1.amazonaws.com/prod-ucs-content-store-eu-west/content/pii:S1381116902003424/STRIPIN/image/gif/9f92e4f9ed30a0b43798ebbe1d781376/si10.gif si10 si10.gif gif 672 18 122 ALTIMG 1-s2.0-S1381116902003424-si1.gif https://s3.amazonaws.com/prod-ucs-content-store-us-east/content/pii:S1381116902003424/STRIPIN/image/gif/82d1c75beda70bf4c489058b42e07414/si1.gif https://s3-eu-west-1.amazonaws.com/prod-ucs-content-store-eu-west/content/pii:S1381116902003424/STRIPIN/image/gif/82d1c75beda70bf4c489058b42e07414/si1.gif si1 si1.gif gif 376 17 69 ALTIMG 1-s2.0-S1381116902003424-fx1.sml https://s3.amazonaws.com/prod-ucs-content-store-us-east/content/pii:S1381116902003424/fx1/THUMBNAIL/image/gif/c7b34efb13afbb5af86afc17bf16dab8/fx1.sml https://s3-eu-west-1.amazonaws.com/prod-ucs-content-store-eu-west/content/pii:S1381116902003424/fx1/THUMBNAIL/image/gif/c7b34efb13afbb5af86afc17bf16dab8/fx1.sml fx1 true fx1.sml sml 1805 71 125 IMAGE-THUMBNAIL 1-s2.0-S1381116902003424-fx1.gif https://s3.amazonaws.com/prod-ucs-content-store-us-east/content/pii:S1381116902003424/fx1/DOWNSAMPLED/image/gif/9d19d4d7daecbdf6db1159a58a22d18a/fx1.gif https://s3-eu-west-1.amazonaws.com/prod-ucs-content-store-eu-west/content/pii:S1381116902003424/fx1/DOWNSAMPLED/image/gif/9d19d4d7daecbdf6db1159a58a22d18a/fx1.gif fx1 true fx1.gif gif 10244 185 327 IMAGE-DOWNSAMPLED 1-s2.0-S1381116902003424-gr1.sml https://s3.amazonaws.com/prod-ucs-content-store-us-east/content/pii:S1381116902003424/gr1/THUMBNAIL/image/gif/5c4ede95e333536b3ddea3eeac5f049f/gr1.sml https://s3-eu-west-1.amazonaws.com/prod-ucs-content-store-eu-west/content/pii:S1381116902003424/gr1/THUMBNAIL/image/gif/5c4ede95e333536b3ddea3eeac5f049f/gr1.sml gr1 gr1.sml sml 1492 84 125 IMAGE-THUMBNAIL 1-s2.0-S1381116902003424-gr1.gif https://s3.amazonaws.com/prod-ucs-content-store-us-east/content/pii:S1381116902003424/gr1/DOWNSAMPLED/image/gif/62c8a87ab4dde8f57c88b8867a0e4c21/gr1.gif https://s3-eu-west-1.amazonaws.com/prod-ucs-content-store-eu-west/content/pii:S1381116902003424/gr1/DOWNSAMPLED/image/gif/62c8a87ab4dde8f57c88b8867a0e4c21/gr1.gif gr1 gr1.gif gif 5259 218 326 IMAGE-DOWNSAMPLED 1-s2.0-S1381116902003424-gr2.sml https://s3.amazonaws.com/prod-ucs-content-store-us-east/content/pii:S1381116902003424/gr2/THUMBNAIL/image/gif/380536afb809bc4df0f8383b142da348/gr2.sml https://s3-eu-west-1.amazonaws.com/prod-ucs-content-store-eu-west/content/pii:S1381116902003424/gr2/THUMBNAIL/image/gif/380536afb809bc4df0f8383b142da348/gr2.sml gr2 gr2.sml sml 1569 92 125 IMAGE-THUMBNAIL 1-s2.0-S1381116902003424-gr2.gif https://s3.amazonaws.com/prod-ucs-content-store-us-east/content/pii:S1381116902003424/gr2/DOWNSAMPLED/image/gif/471119e00b075d65b34f85d703aa12a0/gr2.gif https://s3-eu-west-1.amazonaws.com/prod-ucs-content-store-eu-west/content/pii:S1381116902003424/gr2/DOWNSAMPLED/image/gif/471119e00b075d65b34f85d703aa12a0/gr2.gif gr2 gr2.gif gif 5367 238 324 IMAGE-DOWNSAMPLED 1-s2.0-S1381116902003424-gr3.sml https://s3.amazonaws.com/prod-ucs-content-store-us-east/content/pii:S1381116902003424/gr3/THUMBNAIL/image/gif/d4739538ace6602f519fea1b78ebc875/gr3.sml https://s3-eu-west-1.amazonaws.com/prod-ucs-content-store-eu-west/content/pii:S1381116902003424/gr3/THUMBNAIL/image/gif/d4739538ace6602f519fea1b78ebc875/gr3.sml gr3 gr3.sml sml 1797 71 125 IMAGE-THUMBNAIL 1-s2.0-S1381116902003424-gr3.gif https://s3.amazonaws.com/prod-ucs-content-store-us-east/content/pii:S1381116902003424/gr3/DOWNSAMPLED/image/gif/141817a5d40ee9cfaf6a93df5439a904/gr3.gif https://s3-eu-west-1.amazonaws.com/prod-ucs-content-store-eu-west/content/pii:S1381116902003424/gr3/DOWNSAMPLED/image/gif/141817a5d40ee9cfaf6a93df5439a904/gr3.gif gr3 gr3.gif gif 14919 231 409 IMAGE-DOWNSAMPLED 1-s2.0-S1381116902003424-gr4.sml https://s3.amazonaws.com/prod-ucs-content-store-us-east/content/pii:S1381116902003424/gr4/THUMBNAIL/image/gif/2f9597e4066f97c5152bcc76b67d3f34/gr4.sml https://s3-eu-west-1.amazonaws.com/prod-ucs-content-store-eu-west/content/pii:S1381116902003424/gr4/THUMBNAIL/image/gif/2f9597e4066f97c5152bcc76b67d3f34/gr4.sml gr4 gr4.sml sml 1124 94 73 IMAGE-THUMBNAIL 1-s2.0-S1381116902003424-gr4.gif https://s3.amazonaws.com/prod-ucs-content-store-us-east/content/pii:S1381116902003424/gr4/DOWNSAMPLED/image/gif/40b334800e4136b64c3738df73846aa2/gr4.gif https://s3-eu-west-1.amazonaws.com/prod-ucs-content-store-eu-west/content/pii:S1381116902003424/gr4/DOWNSAMPLED/image/gif/40b334800e4136b64c3738df73846aa2/gr4.gif gr4 gr4.gif gif 4138 253 197 IMAGE-DOWNSAMPLED 1-s2.0-S1381116902003424-gr5.sml https://s3.amazonaws.com/prod-ucs-content-store-us-east/content/pii:S1381116902003424/gr5/THUMBNAIL/image/gif/bce2db1174b28f601ecba80307f0620d/gr5.sml https://s3-eu-west-1.amazonaws.com/prod-ucs-content-store-eu-west/content/pii:S1381116902003424/gr5/THUMBNAIL/image/gif/bce2db1174b28f601ecba80307f0620d/gr5.sml gr5 gr5.sml sml 1193 89 125 IMAGE-THUMBNAIL 1-s2.0-S1381116902003424-gr5.gif https://s3.amazonaws.com/prod-ucs-content-store-us-east/content/pii:S1381116902003424/gr5/DOWNSAMPLED/image/gif/87d0969e38a2c0939bdf45ec39b8a9b8/gr5.gif https://s3-eu-west-1.amazonaws.com/prod-ucs-content-store-eu-west/content/pii:S1381116902003424/gr5/DOWNSAMPLED/image/gif/87d0969e38a2c0939bdf45ec39b8a9b8/gr5.gif gr5 gr5.gif gif 6322 329 464 IMAGE-DOWNSAMPLED MOLCAA 3716 S1381-1169(02)00342-4 10.1016/S1381-1169(02)00342-4 Elsevier Science B.V. Fig. 1 Ligand profile plots for the Zr–Cp fragment. Fig. 2 Ligand profile plots for the Zr–Cp t Bu fragment. Fig. 3 Three-dimensional, numerical solid angle profile plot for the cyclopentadienyl ligand. Fig. 4 Diagram illustrating the cga measurement. Fig. 5 Correlation between cga and activity. Table 1 Table of steric measurements for a set of (C5H4R)–Zr fragments a R θ 1 (°) b θ 2 (°) c Ω (°) d Ω N (°) e cga (°) f H 135 116 117 120 96 g Me 140 128 122 125 91 Et 143 132 126 129 87 i Pr 143 135 128 130 86 t Bu 148 139 133 135 81 h SiMe3 146 144 131 134 85 CH2Ph 146 – 129 131 81 CMe2Ph 147 145 136 136 83 a The size of the C5H4R ligands were determined from the perspective of the zirconium nucleus. Three of the structures that were retrieved from the CSD, namely the ethyl, tert-butyl and benzyl substituted ligands, were reported without their hydrogen atoms placed. The average CCp–H (CCp: carbon atom in the 5-membered cyclopentadienyl ring) bond length in those structures that had their H-atoms placed is 0.940Å. This distance was used to place the H-atoms, at 180° to the cyclopentadienyl ring, in the aforementioned compounds. b The Tolman cone angle [1,11,47]. c Cone angle previously used to calculate the size of cyclopentadienyl ligands [4,10]. d Solid angle calculated using analytical methods [13]. e Numerical solid angle [14]. f Co-ordination gap aperture [15,16]. g Refs. [16] and [10] report values of 95° and 92°, respectively. h Ref. [10] reports a value of 58°. Table 2 Ethene polymerisation data for a set of (CpR)2ZrCl2/MAO catalysts a R Activity (×107 gPE (molZrh)−1) b T m (°C) c M w (gmol−1) M w/M N θ (°) d cga (°) e F f H (1) 6.68 136.5 314400 1.9 135 96 0.03 Me (2) 7.54 136.4 329400 2.0 140 91 0.01 Et (3) 9.72 137.7 577600 2.2 143 87 0 i Pr (4) 8.70 138.9 446200 2.4 143 86 0.04 t Bu (5) 2.06 135.4 276700 2.1 148 81 −0.02 SiMe3 (6) 9.23 137.2 232100 2.0 146 85 0.01 CMe2Ph (7) 0.192 135.4 512300 2.2 147 83 0.05 a Conditions: 400ml toluene; mol Zr=4.16×10−8mol; [Al]:[Zr]=30000:1; T p=50°C; P p=2bar C2H4; t p=45min. b The activities reported are the average of three or more polymerisation reactions per catalyst. c Melting point determined by DSC. These values have been obtained from the remelted samples at a heating rate of 10°C/min. d Tolman cone angle of CpR ligand as measured from the perspective of the metal. e Co-ordination gap aperture measured according to Ref. [10]. f Hammett substituent parameter, F [48]. Table 3 Comparison of ethene polymerisation results from studies on the (C5H5−n R n )2ZrCl2/MAO system Activity series a (R b ) Co-catalyst c Polymerisation conditions Reference Et∼SiMe 3>i Pr>Me>H>t Bu>CMe 2 Ph MAO [Al]:[Zr]=30000; T p=50°C; P p=2bar; t p=45min This work H>Me 4+H>Me 5+H>t Bu+H>Me 4>Me 5>t Bu 2+H>t Bu>t Bu 3 MAO [Al]:[Zr]=160000:1; T p=70°C; P p=5bar; t p=30min [10] Me>Et>H>Me5 MAO [Al]:[Zr]=24000; T p=80°C; P p=4bar; t p=30min [6] i Pr>Et>H>n Pr MAO [Al]:[Zr]=17083; T p=70°C; P p=7.5bar [7] SiMe 3>H>t Bu MAO [Al]:[Zr]=11176; T p=70°C; P p=7bar [9] Cy>i Pr>n Bu>n Pr>Et>Me MAO Not given [8] t Bu>SiMe 3>Et>i Pr>H>Me∼CMe 2 Ph EAO [Al]:[Zr]=42500; T p=70°C; P p=10bar; t p=45min [4,5] i Pr>Me>t Bu>t Bu 2>H EAO Not given [8] a Catalyst activities listed in descending order. b Most entries are for mono-substituted cyclopentadienyl groups, if there is more than one ring substituent on a ring, this is indicated by a subscript (n) after the R-group. If the two Cp rings are not the same, this is indicated by two R-groups separated by “+”. c The co-catalyst used in the polymerisation, EAO or MAO. Zirconium bis-cyclopentadienyl compounds An investigation into the influence of substituent effects on the ethene polymerisation behaviour of (CpR)2ZrCl2/MAO catalysts Neil E. Grimmer Neil J. Coville ∗ Charles B. de Koning Molecular Sciences Institute, School of Chemistry, University of the Witwatersrand, Private Bag 3, Johannesburg, PO Wits 2050, South Africa * Corresponding author. Tel.: +27-11-717-6738; fax: +27-11-339-7967. A systematic investigation into the ethene polymerisation behaviour of a series of (CpR)ZrCl2/MAO catalysts was carried out. The results were interpreted in terms of both steric (quantified by cone and solid angle measurement methods) and electronic (Hammet substituent parameters) ligand parameters. A comparative investigation into the ethene polymerisation behaviour of several mono-substituted metallocene catalysts ((CpR)2ZrCl2/MAO; R=H, Me, Et, i Pr , t Bu , SiMe3, CMe2Ph) was performed. The activity of the catalysts was found to be dependant on both steric (quantified using the Tolman cone angle, analytical solid angle and numerical solid angle measurement methods) and electronic effects (Hammett substituent parameters). The highest activity was found for the catalysts with R=Et and SiMe3. Keywords Homogeneous catalysis Zirconium Cyclopentadienyl Metallocene 1 Introduction It has long been realised that the steric and electronic parameters of a particular ligand cannot be viewed in isolation and it is usually a combination of the two effects that can be correlated with the properties and behaviour of a compound. Tolman proposed the use of a multivariate approach where, for example a measurable parameter Z could be analysed with respect to both steric and electronic parameters according to the following equation: (1) Z=aθ+bν+c In this equation θ is a steric parameter; ν an electronic contribution; and a, b and c, the regression coefficients [1]. The percentage contribution of the steric effect could then be determined using the following equation: (2) stericeffect (%)= a a+b × 100 1 Over the years, the polymerisation activities of metallocenes have been rationalised in terms of both steric and electronic effects. Chien and Razavi [2] have, for example, argued that steric bulk stabilises a catalyst while the electron donating substituents on the ligand increase activity. In their 1971 review article, Henrici-Olivé and Olivé [3] highlighted the importance of electronic effects in catalytic reactions. These influence not only the σ-bond formed between the olefin and the metal, but also the retrodative back donation of electron density into the π∗-antibonding orbital of the olefin. Clearly all these factors, steric and electronic, influence the rate of insertion of an olefin into a growing polymer chain. A previous investigation by our group into the polymerisation behaviour of a set of (CpR)2ZrCl2 (R=H (1), Me (2), Et (3), i Pr (4), t Bu (5), SiMe3 (6) and CMe2Ph (7)) catalysts showed that their activities could be quantitatively rationalised in terms of steric and electronic effects [4,5]. The study was, however, carried out using ethylaluminoxane (EAO) as the co-catalyst. Most polymerisation studies involving metallocene catalysts reported in the literature have been performed using methylaluminoxane (MAO) as the co-catalyst. Interestingly only scattered reports in which a systematic study of the effect of ring substituent steric and electronic effects have on the polymerisation activity of metallocene catalysts, using MAO as the co-catalyst, have appeared in the literature [2,6–10]. The objective of this study was to assess by a systematic study whether the relative contributions of ring substituents to steric and electronic effects could be determined for the (CpR)ZrCl2/MAO system. 2 Results and discussion 2.1 Steric measurements Two fragment types were set up for the various steric calculations. In one set of fragments, all the Zr–CCp (CCp: carbon atom in cyclopentadienyl ring) bond lengths were left the same length. In the other, bond lengths that were unequal (as obtained from X-ray crystallography data) were left unchanged. Only small differences between the results could be found. Therefore, the effect of slight differences in bond lengths and by implication ring-tilt, can be ruled out in the measurement of the size of mono-substituted cyclopentadienyl rings. The results from the various calculations of the steric sizes of the (C5H4R)–Zr (R=H, Me, Et, i Pr , t Bu , SiMe3 and CMe2Ph) fragments, as determined from the Tolman cone angle (θ), analytical solid angle (Ω) and numerical solid angle (Ω N) calculations are collected in Table 1 [1,11–14]. As can be seen from the data in Table 1, the different steric calculations give remarkably different results and depend on the steric measurement used. Generally the ligand size decreases in the following order: θ>Ω N >Ω. The solid angle calculations measures smaller sizes than that of the Tolman cone angle because the latter calculation overestimates the size of a ligand by assuming it has cylindrical symmetry. The numerical solid angle calculation by contrast traces a non-cylindrical cone around the outer van der Waals radii of the atoms in the ligand. The analytical solid angle algorithm measures an even smaller size by also subtracting out the spaces within a ligand. In our case, the small difference between the two solid angle calculations results from the small space found at the centre of the cyclopentadienyl group. The differences in the values for the Tolman cone angle reported previously for the CpR ligands (θ 2 in Table 1) [4] result from the different bond length and angular values used in the calculations. Figs. 1 and 2 depict the ligand profiles (a plot of the size of a ligand as a function of distance from the metal) of two cyclopentadienyl ligands (R=H and t Bu ) using the three measurement methods and illustrate the differences in results obtained from the respective calculations. For the unsubstituted cyclopentadienyl ring, the disparities between the different calculation procedures are not large. However, upon ring substitution marked differences are observed. The non-cylindrical nature of these ligands can be seen in the three-dimensional numerical solid angle plot for an unsubstituted cyclopentadienyl ligand (Fig. 3 ). Brintzinger has proposed the concept of the co-ordination gap aperture (cga) to rationalise the olefin polymerisation results of ansa-metallocenes [15,16]. It was used it to quantify the space available to a monomer approaching an active catalytic site. The co-ordination gap differs from the Cpcen–Zr–Cpcen (Cpcen: centroid of cyclopentadienyl ligand) angle, in that it is the largest angle formed by the intersection of the two planes at the metal centre, which touch the inner van der Waals radii of the two cyclopentadienyl groups. Clearly, the size of this angle is intimately linked to the nature of the ligand and its substituents. The cga was originally designed for use with ansa-metallocenes where it was found that the β-substituents on the C5 rings influenced the size of the gap aperture. The ligands on unbridged metallocenes on the other hand are usually free to rotate about the Zr–Cpcen axis making the choice of one specific β-carbon on the C5 ring less meaningful. We have therefore employed the use of Tolman cone angles, using a rotating cyclopentadienyl ligand (see Table 1) as proposed by Janiak et al. [10], to measure the cga (Eq. (3), Fig. 4 ). (3) cga=360°− α1 2 − α2 2 −β where α 1 and α 2 are the cone angles for the ligand in question, and β the angle between the metal and the two ring centroids. Using this procedure, we calculated the cga for Cp2ZrCl2 to be 96°. This value is very close to that calculated by Brintzinger’s, viz. 95° [16]. Clearly use of the solid angle values would have given too large an aperture (114° for the solid angle measurement). An important point that must be kept in mind, however, is that these calculations depend on the assumption of unhindered ring rotation. Although the bulky tert-butyl substituted cyclopentadienyl rings in the (CpR)2ZrCl2 metallocene displays unhindered rotation this does not hold true once the chlorine atoms are replaced by a bulkier entity [17,18]. Erker has demonstrated that even the co-ordination of a modest butadiene ligand to the zirconium atom results in a substantial barrier to rotation in the ( Cp t Bu)2 Zr entity [17–21]. Thus in polymerisation reactions, where a bulky polymer chain occupies the open sector of the bent metallocene, rotation of the cyclopentadienyl ligands with bulky substituents is expected to be restricted. 2.2 Polymerisation studies The polymerisation reaction conditions chosen in the study were selected not to optimise the amount of polymer produced, but to obtain an insight into the effect that the R-groups have on the polymerisation behaviour of the (CpR)2ZrCl2 complexes under similar reaction conditions. Although it is an easy task to select conditions where the catalysts would produce polymer at a high rate during the entire reaction period, conditions were employed that resulted in an initial high uptake of ethene followed by a deactivation curve after a certain period of time. This time period is dependent on the nature of the CpR ligand. The choice of reaction conditions also avoided the production of excessive polymer in the reactor, minimising diffusion-controlled processes in which the reaction becomes heterogeneous in nature due to the precipitation of polymer during the polymerisation reaction. The reaction conditions eventually used, which met these requirements, were a very low catalyst concentration (4.16×10−8 mol) and a high [Al]:[Zr] ratio (30000:1). The polymerisation data is collected in Table 2 . It is now widely accepted that the polymerisation of olefins by metallocenes is effected through a cationic metallic species. It has however been demonstrated that the polymerisation mechanism of Henrici-Olivé and Olivé [22], which assumes that all the metal species are initially capable of participating in the polymerisation reaction, is not correct. Kinetic studies by Fink et al. [23,24] have shown that a much more complex situation arises where successive equilibria convert alkylaluminium and metallocene species between Lewis acid–base and dissociated ion pairs. Only the separated ion pairs are capable of inserting olefin molecules, whereas the non-separated species can be regarded as “dormant” and not capable of contributing to polymer growth. It is likely that polymerisation reaction conditions and the metallocene ligands have a direct impact on the equilibria described in the aforementioned papers by Fink. In this study, we have not investigated this issue. Instead, the activities of the metallocenes under investigation have only been related to the steric and electronic properties of their ligands by measuring the amount of polymer formed at the end of the polymerisation reaction. Thus, an attempt has been made to associate ground state effects with polymerisation activity. The activities of the (CpR)2ZrCl2 complexes decrease in the following order: Et( 3 )∼SiMe 3( 6 )>i Pr( 4 )>Me( 2 )>H( 1 )>t Bu( 5 )>CMe 2 Ph( 7 ). As a first assumption, it is tempting to assume that electronic parameters are predominantly responsible for the activity differences. This is illustrated by the greater polymerisation activity exhibited by 6 when compared to the metallocenes 5 and 7, all of which are similarly sized ligands. However, the lower activity exhibited by the latter two compounds is more likely to result from intramolecular co-ordination of the ligand substituents to the active polymerisation centre, thereby inhibiting the polymerisation reaction. Metallocene complexes demonstrating intramolecular co-ordination of t Bu or CMe2Ph to a cationic metal centre have been reported in the literature [25–27]. There does appear to be an optimum electron density needed on the metal to ensure high activity, with this requirement seemingly being met in our case by the most active catalysts, 3 and 6. This ideal value is associated with a cyclopentadienyl ligand in which the ring substituent has a Hammett constant of F=0. The stability of the M–C bond (the bond formed by the metal to the growing polymer chain) has long been recognised as being important in catalytic reactions [3,22]. For example, donor ligands destabilise the M–C bond, increasing the rate of monomer insertion in the process. Other researchers have also pointed out the same correlation of activity to electron density at the metal. Chien and Razavi [2] and Jordan and co-workers [28] have, for example, related the increased insertion rate of monomer to an increased electron density at the active site. It is interesting to note the sensitivity of the polymerisation reaction to electronic effects over the small range of Hammett substituent constants, F, investigated (−0.02 to 0.05). Chlorine and fluorine have F-values which are far removed from this range (F Cl=0.42 and F F=0.45). These values explain the very low polymerisation activity of metallocenes with chlorine and fluorine substituted indenyl ligands [29,30]. Steric effects are also expected to play a significant role in these catalytic reactions. For example, steric bulk has been proposed to contribute to catalyst stability by limiting reductive disproportionation reactions that lead to catalyst deactivation [2]. In our results, the higher activity of 3 and 6 compared to 2 seems to support this proposal. All three catalysts have similar Hammett constants, but there is a vast difference in their activities. This probably results from the added protection of the metal site provided by the bulkier ethyl and trimethylsilyl groups. As with electronic effects, there appears to be an optimum value that results in high activities, this angle size lies between θ=143° and 146°. Thus, ligands with a θ-value in this range have a cga sufficiently wide to allow polymerisation to efficiently take place and still protect the catalyst from deactivation pathways. It is evident from the above discussion that there is no simple correlation between activity and either the steric size or the electronic parameters of the substituents. Attempts to correlate the polymerisation activity simultaneously to both the Hammett substituent constants and steric size using multiple regression analysis also failed to deliver statistically acceptable results. This suggests that there is a more complex, non-linear relationship between the substituent parameters and activity. In our procedure, we have simplified the approach by considering the effect of R on the structure (CpR)2ZrCl2—it is appreciated that the actual structure is almost certainly of the type (CpR)2ZrR′+ and this simplification may have some influence on the results. Further, we have assumed that the influence of MAO is a constant for all the complexes studied. The structure of MAO is complicated [31] and this assumption of a constant effect of MAO on the different catalysts will have to be confirmed. If the polymerisation results for catalysts 5 and 7 are excluded (both of which are affected by intramolecular co-ordination of their ligand substituents to the metal [25–27]), there appears to be a modest correlation (R 2=0.83) between increasing activity and decreasing cga (Fig. 5 ). This suggests that bulkier substituents protect the active polymerisation site on the metal, thus prolonging the life of the catalyst. It should be borne in mind that the observed trend of increasing activity with decreasing co-ordination gap is related to mono-substituted or cyclopentadienyl ligands with small substituents. Janiak et al. [10,32] have shown that large substituents or multi-substituted cyclopentadienyl ligands, as expected, inhibit polymerisation activity. The results from several polymerisation studies similar to ours, but with a smaller ligand set, are summarised in Table 3 and corroborate our findings that both steric and electronic effects influence the activity of (CpR)2ZrCl2/aluminoxane catalysts. What can also be seen is that small alkyl and electron donating substituents increase polymerisation activity, whilst the size of the cyclopentadienyl ligands severely inhibits activity. Reaction conditions employed during a polymerisation reaction certainly affect the activity series by influencing the equilibria described by Fink et al. [23,24] and leads to the differences reflected in Table 3. The steric and electronic parameters of some of the substituents are very similar and different reaction conditions could result in an inversion of their position in an activity series. What is interesting is the effect that changing the co-catalyst has on the activity series. In a previous study by our group [4,5], metallocene 5 exhibited the highest activity when EAO was used as the co-catalyst. In this study, it is the second least active catalyst. In addition to this, 6 was observed to be less active than 5, also contrary to our current findings. The bulkier ethyl groups and lower degree of oligomerisation in EAO may prevent an effective interaction of the aluminoxane Al–O–Al groups with the active catalyst site. The action of EAO activated catalysts may therefore provide a greater insight into the action of the CpR ligands. The molecular weights of the polymers are slightly higher than those reported elsewhere in the literature for mono-substituted and unsubstituted zirconocene catalysts [33–36]. It has been argued previously that low concentrations of catalyst, as used in this study, favour dissociated active polymerisation sites, resulting in chain propagation instead of chain termination [10,37,38]. Bimolecular deactivation pathways involving two catalytic centres, which result in lower molecular weights, are also limited at lower catalyst concentrations [10,37,38]. 3 Conclusions The factors governing the activity of a catalyst are complex and not easily understood. We have shown that both ground state steric and electronic effects influence catalytic activity of (CpR)2ZrCl2 metallocenes and when MAO is used as a co-catalyst, a fine control of steric and electronic parameters are required to ensure optimum activity. The catalysts are stabilised by small substituents on the cyclopentadienyl rings that helps prevent their deactivation by bimolecular disproportionation. However, these substituents cannot be too large as the cga, the space around the catalyst in which polymerisation occurs, becomes too crowded and monomer insertion is inhibited. Substituent electronic parameters are also important in governing the activity of a catalyst as the cyclopentadienyl substituent affects the electrophilicity of the metal as well as the strength of the M–C bond (the bond to the growing polymer chain). 4 Methods section 4.1 Steric size measurements The size of this substituted cyclopentadienyl ligands was determined using the Tolman cone angle [1,11], analytical solid angle [12,13], and numerical solid angle methods [14]. The steric measurements were made using the co-ordinates of the crystal structures retrieved from the Cambridge Structural Database [39,40]. As we were concerned with assessing the size of the C5H4R ligand, measured from the perspective of the metal, the structure had to be modified so as to facilitate the calculations. The two chlorine atoms and one of the C5H4R rings were removed from the crystal data file leaving the remaining cyclopentadienyl ring attached to the zirconium atom. No crystallographic structure for (CpCMe2Ph)2ZrCl2 has as yet been determined. However, the structure of an analogous compound (CpCMe2-p-tolyl)2HfCl2, has been reported [41]. The co-ordinates of this structure were used in the steric measurements, after the methyl group had been removed from the p-tolyl ring to give the appropriate –CMe2Ph ring substituent. The assumption of its similarity to the structure of (CpCMe2Ph)2ZrCl2 is supported by the observation that the ring centroid–hafnium (Cpcen–Hf) length of 2.207Å, is close to the average Cpcen–Zr length of 2.202Å for the above zirconocenes. The last modification made to the structures was to ensure that the CCp–Zr bond lengths in the individual fragments were all of the same length so as to eliminate ring-tilt. This modification is unnecessary as the calculations reveal that both ring-tilt corrected and uncorrected fragments give similar results. The fragments that were generated by the above procedures were then submitted to the program ‘Steric’ [42], which calculates the Tolman cone, solid and numerical solid angles according to the appropriate algorithm. In addition to these standard measurements of size, the algorithms have been developed so as to provide steric profiles of the ligands under investigation. These profiles provide a measure of the size of the ligand as a function of distance from the point of observation, which in our case is the zirconium atom. The Bondi data set of van der Waals and covalent radii were used in all calculations [43]. The results from the calculation are collected in Table 1. The last steric measurement made was that of the cga [15,16]. The procedure used here is similar to that employed by Janiak et al. [10] (Eq. (3), Fig. 4). We have used the size for the cyclopentadienyl ligand given by the Tolman cone angle generated in our studies to calculate the cga. These results are also listed in Table 1. 4.2 Polymerisation studies Cp2ZrCl2 (1) was purchased from Aldrich and used without further purification. The remaining (CpR)2ZrCl2 metallocenes were synthesised according to published procedures (R=Me (2) [44], Et (3), t Bu (5) and SiMe3 (6) [45], i Pr (4) and CMe2Ph (7) [46]). Toluene was used as the solvent in all of the polymerisation reactions. The solvent was collected in a still after heating under reflux over molten sodium for 6h. When fresh toluene was added to the still, its contents were heated under reflux for a minimum of 72h before use in any polymerisation reaction. The reactor was prepared for each polymerisation reaction by heating for 13h at 80°C under vacuum, cooled to 60°C, and then filled with argon. The MAO used in the reactions was obtained from Witco as a 10% solution in toluene and was used as received. Under argon counter-flow, 360ml of toluene was added to the reactor via cannula tubing from a measuring cylinder, the reactor pressurised to 2bar ethene pressure and cooled to the polymerisation temperature of 50°C. The required amount of catalyst (4.16×10−8 mol) was taken from a stock solution of metallocene in toluene and mixed with MAO ([Al]:[Zr]=30000:1) in 40ml of toluene. This was stirred for 10min at 50°C and then added under ethene counter-flow to the reactor via cannula tubing. The reactor was sealed, pressurised to 2bar ethene pressure and the polymerisation reaction carried out over 45min. Venting the reactor to the atmosphere and adding a solution of 10ml 32% HCl in 90ml methanol terminated the reaction. The entire contents from the polymerisation reactor were stirred at room temperature for 3h before being collected by filtration onto a glass frit. The polymer was washed with methanol until no longer acidic and dried under reduced pressure to constant mass. Polymer melting points were determined on a DuPont 910 differential scanning calorimeter, from the remelted samples at a heating rate of 10°Cmin−1. Polymer molecular weights were determined by the Deutsche Kunststoffinstitut, Darmstadt. Acknowledgements We would like to thank the University of the Witwatersrand, AECI, THRIP and the FRD (NRF) for the funding that has made this work possible. References [1] C.A. Tolman Chem. Rev. 77 1977 313 348 [2] J.C.W. Chien A. Razavi J. Polym. Sci., Part A 26 1988 2369 2380 [3] G. Henrici-Olivé S. Olivé Angew. Chem. Int. Ed. Engl. 10 1971 105 115 [4] P.C. Möhring N.J. Coville J. Mol. Catal. 77 1992 41 50 [5] P.C. Möhring, Ph.D. Thesis, University of the Witwatersrand, 1993. [6] J.A. Ewen Stud. Surf. Sci. Catal. 25 1986 271 292 [7] V.P. Mar’in L.A. Nekhaeva L.I. Vyshinskaya B.A. Krentsel’ N.I. Ivanova Organomet. Chem. USSR 3 1990 236 [8] G.P. Belov, The effect of zirconocene nature and aluminoxane preparation method on the polymerisation kinetics of olefins, in: Proceedings of the IUPAC International Symposium on Olefin and Vinyl Functionalisation, Hangzhou, China, 1991. [9] L.A. Nekhaeva G.N. Bondarenko S.V. Rykov A.I. Nekhaev B.A. Krentsel V.P. Mar’in L.I. Vyshinskaya I.M. Khrapova A.V. Polonskii N.N. Korneev J. Organomet. Chem. 406 1991 139 146 [10] C. Janiak K.C.H. Lange U. Versteeg D. Lentz P.H.M. Budzelaar Chem. Ber. 129 1996 1517 1529 [11] C.A. Tolman J. Am. Chem. Soc. 92 1970 2956 2965 [12] D. White N.J. Coville Adv. Organomet. Chem. 36 1994 95 158 [13] B.C. Taverner J. Comput. Chem. 17 1996 1612 1623 [14] A. Immirzi A. Musco Inorg. Chim. Acta 25 1977 L41 L42 [15] K. Hortmann H.-H. Brintzinger New J. Chem. 16 1992 51 55 [16] P. Burger K. Hortmann H.-H. Brintzinger Makromol. Chem., Macromol. Symp. 66 1993 127 140 [17] G. Erker R. Nolte G. Tainturier A. Rheingold Organometallics 8 1989 454 460 [18] G. Erker Pure Appl. Chem. 61 1989 1715 1722 [19] G. Erker T. Mühlenbernd R. Benn A. Rufinska Y.-H. Tsay C. Krüger Angew. Chem. Int. Ed. Engl. 24 1985 321 323 [20] G. Erker T. Mühlenbernd J. Organomet. Chem. 319 1987 201 211 [21] R. Benn H. Grondey R. Nolte G. Erker Organometallics 7 1988 777 778 [22] G. Henrici-Olivé S. Olivé Angew. Chem. Int. Ed. Engl. 6 1967 790 798 [23] G. Fink W. Zoller Makromol. Chem. 182 1981 3265 3278 [24] G. Fink W. Fenzyl R. Mynott Z. Naturforsch. b 40 1985 158 166 [25] X. Yang C.L. Church T.J. Marks J. Am. Chem. Soc. 116 1994 10015 10031 [26] L. Jia X. Yang C.L. Stern T.J. Marks Organometallics 16 1997 842 857 [27] L.H. Doerrer, M.L.H. Green, D. Häußinger, J. Saßmannshausen, J. Chem. Soc., Dalton Trans. (1999) 2111–2118. [28] Y.W. Alelyunas R.F. Jordan S.F. Echols S.L. Borkowsky P.K. Bradley Organometallics 10 1991 1406 1416 [29] I.-M. Lee W.J. Gauthier J.M. Ball B. Iyengar S. Collins Organometallics 11 1992 2115 2122 [30] N. Piccolrovazzi P. Pino G. Consiglio A. Sironi M. Moret Organometallics 9 1990 3098 3105 [31] T.N.P. Luhtanen M. Linnolahti T.A. Pakkanen J. Organomet. Chem. 648 2002 49 [32] C. Janiak U. Versteeg K.C.H. Lange R. Weimann E. Hahn J. Organomet. Chem. 501 1995 219 234 [33] J.A. Ewen Stud. Surf. Sci. Catal. 25 1986 271 291 [34] D.T. Mallin M.D. Rausch J.C.W. Chien Polym. Bull. 20 1988 421 425 [35] R. Leino H.J.G. Luttikhedde A. Lehtonen R. Sillanpää A. Penninkangas J. Strandén J. Mattinen J.H. Näsman J. Organomet. Chem. 558 1998 171 179 [36] B.Y. Lee J.W. Han Y.K. Chung S.W. Lee J. Organomet. Chem. 587 1999 181 190 [37] W. Kaminsky K. Külper S. Niedoba Makromol. Chem., Macromol. Symp. 3 1986 377 387 [38] H.H. Brintzinger D. Fischer R. Mülhaupt B. Rieger R.M. Waymouth Angew. Chem. Int. Ed. Engl. 34 1995 1143 1170 [39] F.H. Allen J.E. Davies J.J. Galoy O. Johnson O. Kennard C.F. Macrae E.M. Mitchell J.M. Smith D.G. Watson J. Chem. Inf. Comput. Sci. 31 1991 187 204 [40] F.H. Allen O. Kennard Chem. Des. Autom. News 8 1993 31 [41] J.-X. Wang S.-S. Chen X.-K. Wang H.-G. Wang Huaxue Xuebao (Acta Chim. Sinica) 51 1993 506 [42] B.C. Taverner, Steric 1.12B 1997 (this program may be downloaded via the internet from the following URL: http://www.gh.wits.ac.za). [43] A. Bondi J. Phys. Chem. 68 1964 441 451 [44] R.F. Jordan R.E. LaPointe P.K. Bradley N. Baenziger Organometallics 8 1989 2892 2903 [45] M.F. Lappert, C.J. Pickett, P.I. Riley, P.I.W. Yarrow, J. Chem. Soc., Dalton Trans. (1981) 805–813. [46] P. Renaut G. Tainturier B. Gautheron J. Organomet. Chem. 148 1978 35 42 [47] R.W. Taft, in: M.S. Newman (Ed.), Steric Effects in Organic Chemistry, Wiley, New York, 1956, p. 556. [48] C. Hansch A. Leo R.W. Taft Chem. Rev. 91 1991 165 195",
      "scopus-id": "0037200968",
      "coredata": {
        "eid": "1-s2.0-S1381116902003424",
        "dc:description": "A comparative investigation into the ethene polymerisation behaviour of several mono-substituted metallocene catalysts ((CpR)2ZrCl2/MAO; R=H, Me, Et, i Pr , t Bu , SiMe3, CMe2Ph) was performed. The activity of the catalysts was found to be dependant on both steric (quantified using the Tolman cone angle, analytical solid angle and numerical solid angle measurement methods) and electronic effects (Hammett substituent parameters). The highest activity was found for the catalysts with R=Et and SiMe3.",
        "openArchiveArticle": "false",
        "prism:coverDate": "2002-09-30",
        "openaccessUserLicense": null,
        "prism:aggregationType": "Journal",
        "prism:url": "https://api.elsevier.com/content/article/pii/S1381116902003424",
        "dc:creator": [
          {
            "@_fa": "true",
            "$": "Grimmer, Neil E."
          },
          {
            "@_fa": "true",
            "$": "Coville, Neil J."
          },
          {
            "@_fa": "true",
            "$": "de Koning, Charles B."
          }
        ],
        "link": [
          {
            "@_fa": "true",
            "@rel": "self",
            "@href": "https://api.elsevier.com/content/article/pii/S1381116902003424"
          },
          {
            "@_fa": "true",
            "@rel": "scidir",
            "@href": "https://www.sciencedirect.com/science/article/pii/S1381116902003424"
          }
        ],
        "dc:format": "application/json",
        "openaccessType": null,
        "pii": "S1381-1169(02)00342-4",
        "prism:volume": "188",
        "prism:publisher": "Elsevier Science B.V.",
        "dc:title": "Zirconium bis-cyclopentadienyl compounds An investigation into the influence of substituent effects on the ethene polymerisation behaviour of (CpR)2ZrCl2/MAO catalysts",
        "prism:copyright": "Copyright © 2002 Elsevier Science B.V. All rights reserved.",
        "openaccess": "0",
        "prism:issn": "13811169",
        "prism:issueIdentifier": "1-2",
        "dcterms:subject": [
          {
            "@_fa": "true",
            "$": "Homogeneous catalysis"
          },
          {
            "@_fa": "true",
            "$": "Zirconium"
          },
          {
            "@_fa": "true",
            "$": "Cyclopentadienyl"
          },
          {
            "@_fa": "true",
            "$": "Metallocene"
          }
        ],
        "openaccessArticle": "false",
        "prism:publicationName": "Journal of Molecular Catalysis A: Chemical",
        "prism:number": "1-2",
        "openaccessSponsorType": null,
        "prism:pageRange": "105-113",
        "prism:endingPage": "113",
        "pubType": "fla",
        "prism:coverDisplayDate": "30 September 2002",
        "prism:doi": "10.1016/S1381-1169(02)00342-4",
        "prism:startingPage": "105",
        "dc:identifier": "doi:10.1016/S1381-1169(02)00342-4",
        "openaccessSponsorName": null
      },
      "objects": {
        "object": [
          {
            "@category": "thumbnail",
            "@height": "15",
            "@width": "518",
            "@_fa": "true",
            "$": "https://api.elsevier.com/content/object/eid/1-s2.0-S1381116902003424-si9.gif?httpAccept=%2A%2F%2A",
            "@multimediatype": "GIF image file",
            "@type": "ALTIMG",
            "@size": "1649",
            "@ref": "si9",
            "@mimetype": "image/gif"
          },
          {
            "@category": "thumbnail",
            "@height": "18",
            "@width": "122",
            "@_fa": "true",
            "$": "https://api.elsevier.com/content/object/eid/1-s2.0-S1381116902003424-si8.gif?httpAccept=%2A%2F%2A",
            "@multimediatype": "GIF image file",
            "@type": "ALTIMG",
            "@size": "684",
            "@ref": "si8",
            "@mimetype": "image/gif"
          },
          {
            "@category": "thumbnail",
            "@height": "16",
            "@width": "319",
            "@_fa": "true",
            "$": "https://api.elsevier.com/content/object/eid/1-s2.0-S1381116902003424-si7.gif?httpAccept=%2A%2F%2A",
            "@multimediatype": "GIF image file",
            "@type": "ALTIMG",
            "@size": "1211",
            "@ref": "si7",
            "@mimetype": "image/gif"
          },
          {
            "@category": "thumbnail",
            "@height": "18",
            "@width": "134",
            "@_fa": "true",
            "$": "https://api.elsevier.com/content/object/eid/1-s2.0-S1381116902003424-si6.gif?httpAccept=%2A%2F%2A",
            "@multimediatype": "GIF image file",
            "@type": "ALTIMG",
            "@size": "702",
            "@ref": "si6",
            "@mimetype": "image/gif"
          },
          {
            "@category": "thumbnail",
            "@height": "14",
            "@width": "25",
            "@_fa": "true",
            "$": "https://api.elsevier.com/content/object/eid/1-s2.0-S1381116902003424-si5.gif?httpAccept=%2A%2F%2A",
            "@multimediatype": "GIF image file",
            "@type": "ALTIMG",
            "@size": "203",
            "@ref": "si5",
            "@mimetype": "image/gif"
          },
          {
            "@category": "thumbnail",
            "@height": "14",
            "@width": "27",
            "@_fa": "true",
            "$": "https://api.elsevier.com/content/object/eid/1-s2.0-S1381116902003424-si4.gif?httpAccept=%2A%2F%2A",
            "@multimediatype": "GIF image file",
            "@type": "ALTIMG",
            "@size": "202",
            "@ref": "si4",
            "@mimetype": "image/gif"
          },
          {
            "@category": "thumbnail",
            "@height": "18",
            "@width": "134",
            "@_fa": "true",
            "$": "https://api.elsevier.com/content/object/eid/1-s2.0-S1381116902003424-si35.gif?httpAccept=%2A%2F%2A",
            "@multimediatype": "GIF image file",
            "@type": "ALTIMG",
            "@size": "702",
            "@ref": "si35",
            "@mimetype": "image/gif"
          },
          {
            "@category": "thumbnail",
            "@height": "14",
            "@width": "27",
            "@_fa": "true",
            "$": "https://api.elsevier.com/content/object/eid/1-s2.0-S1381116902003424-si34.gif?httpAccept=%2A%2F%2A",
            "@multimediatype": "GIF image file",
            "@type": "ALTIMG",
            "@size": "202",
            "@ref": "si34",
            "@mimetype": "image/gif"
          },
          {
            "@category": "thumbnail",
            "@height": "14",
            "@width": "25",
            "@_fa": "true",
            "$": "https://api.elsevier.com/content/object/eid/1-s2.0-S1381116902003424-si33.gif?httpAccept=%2A%2F%2A",
            "@multimediatype": "GIF image file",
            "@type": "ALTIMG",
            "@size": "203",
            "@ref": "si33",
            "@mimetype": "image/gif"
          },
          {
            "@category": "thumbnail",
            "@height": "14",
            "@width": "25",
            "@_fa": "true",
            "$": "https://api.elsevier.com/content/object/eid/1-s2.0-S1381116902003424-si32.gif?httpAccept=%2A%2F%2A",
            "@multimediatype": "GIF image file",
            "@type": "ALTIMG",
            "@size": "203",
            "@ref": "si32",
            "@mimetype": "image/gif"
          },
          {
            "@category": "thumbnail",
            "@height": "18",
            "@width": "464",
            "@_fa": "true",
            "$": "https://api.elsevier.com/content/object/eid/1-s2.0-S1381116902003424-si31.gif?httpAccept=%2A%2F%2A",
            "@multimediatype": "GIF image file",
            "@type": "ALTIMG",
            "@size": "1938",
            "@ref": "si31",
            "@mimetype": "image/gif"
          },
          {
            "@category": "thumbnail",
            "@height": "17",
            "@width": "75",
            "@_fa": "true",
            "$": "https://api.elsevier.com/content/object/eid/1-s2.0-S1381116902003424-si30.gif?httpAccept=%2A%2F%2A",
            "@multimediatype": "GIF image file",
            "@type": "ALTIMG",
            "@size": "445",
            "@ref": "si30",
            "@mimetype": "image/gif"
          },
          {
            "@category": "thumbnail",
            "@height": "14",
            "@width": "25",
            "@_fa": "true",
            "$": "https://api.elsevier.com/content/object/eid/1-s2.0-S1381116902003424-si3.gif?httpAccept=%2A%2F%2A",
            "@multimediatype": "GIF image file",
            "@type": "ALTIMG",
            "@size": "203",
            "@ref": "si3",
            "@mimetype": "image/gif"
          },
          {
            "@category": "thumbnail",
            "@height": "31",
            "@width": "187",
            "@_fa": "true",
            "$": "https://api.elsevier.com/content/object/eid/1-s2.0-S1381116902003424-si29.gif?httpAccept=%2A%2F%2A",
            "@multimediatype": "GIF image file",
            "@type": "ALTIMG",
            "@size": "865",
            "@ref": "si29",
            "@mimetype": "image/gif"
          },
          {
            "@category": "thumbnail",
            "@height": "14",
            "@width": "25",
            "@_fa": "true",
            "$": "https://api.elsevier.com/content/object/eid/1-s2.0-S1381116902003424-si28.gif?httpAccept=%2A%2F%2A",
            "@multimediatype": "GIF image file",
            "@type": "ALTIMG",
            "@size": "203",
            "@ref": "si28",
            "@mimetype": "image/gif"
          },
          {
            "@category": "thumbnail",
            "@height": "14",
            "@width": "86",
            "@_fa": "true",
            "$": "https://api.elsevier.com/content/object/eid/1-s2.0-S1381116902003424-si27.gif?httpAccept=%2A%2F%2A",
            "@multimediatype": "GIF image file",
            "@type": "ALTIMG",
            "@size": "422",
            "@ref": "si27",
            "@mimetype": "image/gif"
          },
          {
            "@category": "thumbnail",
            "@height": "14",
            "@width": "25",
            "@_fa": "true",
            "$": "https://api.elsevier.com/content/object/eid/1-s2.0-S1381116902003424-si26.gif?httpAccept=%2A%2F%2A",
            "@multimediatype": "GIF image file",
            "@type": "ALTIMG",
            "@size": "203",
            "@ref": "si26",
            "@mimetype": "image/gif"
          },
          {
            "@category": "thumbnail",
            "@height": "14",
            "@width": "27",
            "@_fa": "true",
            "$": "https://api.elsevier.com/content/object/eid/1-s2.0-S1381116902003424-si25.gif?httpAccept=%2A%2F%2A",
            "@multimediatype": "GIF image file",
            "@type": "ALTIMG",
            "@size": "202",
            "@ref": "si25",
            "@mimetype": "image/gif"
          },
          {
            "@category": "thumbnail",
            "@height": "14",
            "@width": "25",
            "@_fa": "true",
            "$": "https://api.elsevier.com/content/object/eid/1-s2.0-S1381116902003424-si24.gif?httpAccept=%2A%2F%2A",
            "@multimediatype": "GIF image file",
            "@type": "ALTIMG",
            "@size": "203",
            "@ref": "si24",
            "@mimetype": "image/gif"
          },
          {
            "@category": "thumbnail",
            "@height": "14",
            "@width": "27",
            "@_fa": "true",
            "$": "https://api.elsevier.com/content/object/eid/1-s2.0-S1381116902003424-si23.gif?httpAccept=%2A%2F%2A",
            "@multimediatype": "GIF image file",
            "@type": "ALTIMG",
            "@size": "202",
            "@ref": "si23",
            "@mimetype": "image/gif"
          },
          {
            "@category": "thumbnail",
            "@height": "36",
            "@width": "215",
            "@_fa": "true",
            "$": "https://api.elsevier.com/content/object/eid/1-s2.0-S1381116902003424-si22.gif?httpAccept=%2A%2F%2A",
            "@multimediatype": "GIF image file",
            "@type": "ALTIMG",
            "@size": "1123",
            "@ref": "si22",
            "@mimetype": "image/gif"
          },
          {
            "@category": "thumbnail",
            "@height": "14",
            "@width": "111",
            "@_fa": "true",
            "$": "https://api.elsevier.com/content/object/eid/1-s2.0-S1381116902003424-si21.gif?httpAccept=%2A%2F%2A",
            "@multimediatype": "GIF image file",
            "@type": "ALTIMG",
            "@size": "475",
            "@ref": "si21",
            "@mimetype": "image/gif"
          },
          {
            "@category": "thumbnail",
            "@height": "14",
            "@width": "25",
            "@_fa": "true",
            "$": "https://api.elsevier.com/content/object/eid/1-s2.0-S1381116902003424-si20.gif?httpAccept=%2A%2F%2A",
            "@multimediatype": "GIF image file",
            "@type": "ALTIMG",
            "@size": "203",
            "@ref": "si20",
            "@mimetype": "image/gif"
          },
          {
            "@category": "thumbnail",
            "@height": "14",
            "@width": "27",
            "@_fa": "true",
            "$": "https://api.elsevier.com/content/object/eid/1-s2.0-S1381116902003424-si2.gif?httpAccept=%2A%2F%2A",
            "@multimediatype": "GIF image file",
            "@type": "ALTIMG",
            "@size": "202",
            "@ref": "si2",
            "@mimetype": "image/gif"
          },
          {
            "@category": "thumbnail",
            "@height": "14",
            "@width": "27",
            "@_fa": "true",
            "$": "https://api.elsevier.com/content/object/eid/1-s2.0-S1381116902003424-si19.gif?httpAccept=%2A%2F%2A",
            "@multimediatype": "GIF image file",
            "@type": "ALTIMG",
            "@size": "202",
            "@ref": "si19",
            "@mimetype": "image/gif"
          },
          {
            "@category": "thumbnail",
            "@height": "16",
            "@width": "196",
            "@_fa": "true",
            "$": "https://api.elsevier.com/content/object/eid/1-s2.0-S1381116902003424-si18.gif?httpAccept=%2A%2F%2A",
            "@multimediatype": "GIF image file",
            "@type": "ALTIMG",
            "@size": "782",
            "@ref": "si18",
            "@mimetype": "image/gif"
          },
          {
            "@category": "thumbnail",
            "@height": "18",
            "@width": "122",
            "@_fa": "true",
            "$": "https://api.elsevier.com/content/object/eid/1-s2.0-S1381116902003424-si17.gif?httpAccept=%2A%2F%2A",
            "@multimediatype": "GIF image file",
            "@type": "ALTIMG",
            "@size": "652",
            "@ref": "si17",
            "@mimetype": "image/gif"
          },
          {
            "@category": "thumbnail",
            "@height": "16",
            "@width": "319",
            "@_fa": "true",
            "$": "https://api.elsevier.com/content/object/eid/1-s2.0-S1381116902003424-si16.gif?httpAccept=%2A%2F%2A",
            "@multimediatype": "GIF image file",
            "@type": "ALTIMG",
            "@size": "1222",
            "@ref": "si16",
            "@mimetype": "image/gif"
          },
          {
            "@category": "thumbnail",
            "@height": "17",
            "@width": "240",
            "@_fa": "true",
            "$": "https://api.elsevier.com/content/object/eid/1-s2.0-S1381116902003424-si15.gif?httpAccept=%2A%2F%2A",
            "@multimediatype": "GIF image file",
            "@type": "ALTIMG",
            "@size": "929",
            "@ref": "si15",
            "@mimetype": "image/gif"
          },
          {
            "@category": "thumbnail",
            "@height": "18",
            "@width": "122",
            "@_fa": "true",
            "$": "https://api.elsevier.com/content/object/eid/1-s2.0-S1381116902003424-si14.gif?httpAccept=%2A%2F%2A",
            "@multimediatype": "GIF image file",
            "@type": "ALTIMG",
            "@size": "593",
            "@ref": "si14",
            "@mimetype": "image/gif"
          },
          {
            "@category": "thumbnail",
            "@height": "15",
            "@width": "119",
            "@_fa": "true",
            "$": "https://api.elsevier.com/content/object/eid/1-s2.0-S1381116902003424-si13.gif?httpAccept=%2A%2F%2A",
            "@multimediatype": "GIF image file",
            "@type": "ALTIMG",
            "@size": "556",
            "@ref": "si13",
            "@mimetype": "image/gif"
          },
          {
            "@category": "thumbnail",
            "@height": "18",
            "@width": "121",
            "@_fa": "true",
            "$": "https://api.elsevier.com/content/object/eid/1-s2.0-S1381116902003424-si12.gif?httpAccept=%2A%2F%2A",
            "@multimediatype": "GIF image file",
            "@type": "ALTIMG",
            "@size": "637",
            "@ref": "si12",
            "@mimetype": "image/gif"
          },
          {
            "@category": "thumbnail",
            "@height": "15",
            "@width": "142",
            "@_fa": "true",
            "$": "https://api.elsevier.com/content/object/eid/1-s2.0-S1381116902003424-si11.gif?httpAccept=%2A%2F%2A",
            "@multimediatype": "GIF image file",
            "@type": "ALTIMG",
            "@size": "579",
            "@ref": "si11",
            "@mimetype": "image/gif"
          },
          {
            "@category": "thumbnail",
            "@height": "18",
            "@width": "122",
            "@_fa": "true",
            "$": "https://api.elsevier.com/content/object/eid/1-s2.0-S1381116902003424-si10.gif?httpAccept=%2A%2F%2A",
            "@multimediatype": "GIF image file",
            "@type": "ALTIMG",
            "@size": "672",
            "@ref": "si10",
            "@mimetype": "image/gif"
          },
          {
            "@category": "thumbnail",
            "@height": "17",
            "@width": "69",
            "@_fa": "true",
            "$": "https://api.elsevier.com/content/object/eid/1-s2.0-S1381116902003424-si1.gif?httpAccept=%2A%2F%2A",
            "@multimediatype": "GIF image file",
            "@type": "ALTIMG",
            "@size": "376",
            "@ref": "si1",
            "@mimetype": "image/gif"
          },
          {
            "@category": "thumbnail",
            "@height": "71",
            "@width": "125",
            "@_fa": "true",
            "$": "https://api.elsevier.com/content/object/eid/1-s2.0-S1381116902003424-fx1.sml?httpAccept=%2A%2F%2A",
            "@multimediatype": "GIF image file",
            "@type": "IMAGE-THUMBNAIL",
            "@size": "1805",
            "@ref": "fx1",
            "@mimetype": "image/gif"
          },
          {
            "@category": "standard",
            "@height": "185",
            "@width": "327",
            "@_fa": "true",
            "$": "https://api.elsevier.com/content/object/eid/1-s2.0-S1381116902003424-fx1.gif?httpAccept=%2A%2F%2A",
            "@multimediatype": "GIF image file",
            "@type": "IMAGE-DOWNSAMPLED",
            "@size": "10244",
            "@ref": "fx1",
            "@mimetype": "image/gif"
          },
          {
            "@category": "thumbnail",
            "@height": "84",
            "@width": "125",
            "@_fa": "true",
            "$": "https://api.elsevier.com/content/object/eid/1-s2.0-S1381116902003424-gr1.sml?httpAccept=%2A%2F%2A",
            "@multimediatype": "GIF image file",
            "@type": "IMAGE-THUMBNAIL",
            "@size": "1492",
            "@ref": "gr1",
            "@mimetype": "image/gif"
          },
          {
            "@category": "standard",
            "@height": "218",
            "@width": "326",
            "@_fa": "true",
            "$": "https://api.elsevier.com/content/object/eid/1-s2.0-S1381116902003424-gr1.gif?httpAccept=%2A%2F%2A",
            "@multimediatype": "GIF image file",
            "@type": "IMAGE-DOWNSAMPLED",
            "@size": "5259",
            "@ref": "gr1",
            "@mimetype": "image/gif"
          },
          {
            "@category": "thumbnail",
            "@height": "92",
            "@width": "125",
            "@_fa": "true",
            "$": "https://api.elsevier.com/content/object/eid/1-s2.0-S1381116902003424-gr2.sml?httpAccept=%2A%2F%2A",
            "@multimediatype": "GIF image file",
            "@type": "IMAGE-THUMBNAIL",
            "@size": "1569",
            "@ref": "gr2",
            "@mimetype": "image/gif"
          },
          {
            "@category": "standard",
            "@height": "238",
            "@width": "324",
            "@_fa": "true",
            "$": "https://api.elsevier.com/content/object/eid/1-s2.0-S1381116902003424-gr2.gif?httpAccept=%2A%2F%2A",
            "@multimediatype": "GIF image file",
            "@type": "IMAGE-DOWNSAMPLED",
            "@size": "5367",
            "@ref": "gr2",
            "@mimetype": "image/gif"
          },
          {
            "@category": "thumbnail",
            "@height": "71",
            "@width": "125",
            "@_fa": "true",
            "$": "https://api.elsevier.com/content/object/eid/1-s2.0-S1381116902003424-gr3.sml?httpAccept=%2A%2F%2A",
            "@multimediatype": "GIF image file",
            "@type": "IMAGE-THUMBNAIL",
            "@size": "1797",
            "@ref": "gr3",
            "@mimetype": "image/gif"
          },
          {
            "@category": "standard",
            "@height": "231",
            "@width": "409",
            "@_fa": "true",
            "$": "https://api.elsevier.com/content/object/eid/1-s2.0-S1381116902003424-gr3.gif?httpAccept=%2A%2F%2A",
            "@multimediatype": "GIF image file",
            "@type": "IMAGE-DOWNSAMPLED",
            "@size": "14919",
            "@ref": "gr3",
            "@mimetype": "image/gif"
          },
          {
            "@category": "thumbnail",
            "@height": "94",
            "@width": "73",
            "@_fa": "true",
            "$": "https://api.elsevier.com/content/object/eid/1-s2.0-S1381116902003424-gr4.sml?httpAccept=%2A%2F%2A",
            "@multimediatype": "GIF image file",
            "@type": "IMAGE-THUMBNAIL",
            "@size": "1124",
            "@ref": "gr4",
            "@mimetype": "image/gif"
          },
          {
            "@category": "standard",
            "@height": "253",
            "@width": "197",
            "@_fa": "true",
            "$": "https://api.elsevier.com/content/object/eid/1-s2.0-S1381116902003424-gr4.gif?httpAccept=%2A%2F%2A",
            "@multimediatype": "GIF image file",
            "@type": "IMAGE-DOWNSAMPLED",
            "@size": "4138",
            "@ref": "gr4",
            "@mimetype": "image/gif"
          },
          {
            "@category": "thumbnail",
            "@height": "89",
            "@width": "125",
            "@_fa": "true",
            "$": "https://api.elsevier.com/content/object/eid/1-s2.0-S1381116902003424-gr5.sml?httpAccept=%2A%2F%2A",
            "@multimediatype": "GIF image file",
            "@type": "IMAGE-THUMBNAIL",
            "@size": "1193",
            "@ref": "gr5",
            "@mimetype": "image/gif"
          },
          {
            "@category": "standard",
            "@height": "329",
            "@width": "464",
            "@_fa": "true",
            "$": "https://api.elsevier.com/content/object/eid/1-s2.0-S1381116902003424-gr5.gif?httpAccept=%2A%2F%2A",
            "@multimediatype": "GIF image file",
            "@type": "IMAGE-DOWNSAMPLED",
            "@size": "6322",
            "@ref": "gr5",
            "@mimetype": "image/gif"
          }
        ]
      },
      "link": {
        "@rel": "abstract",
        "@href": "https://api.elsevier.com/content/abstract/scopus_id/0037200968"
      }
    }
  }
}