{
  "metadata": {
    "title": "Water-soluble <ce:italic>cis</ce:italic>-[(NHC)PdBr<ce:inf loc=post>2</ce:inf>(TPPTS)] catalysts and their applications in Suzuki–Miyaura coupling of aryl chlorides",
    "authors": "; ; ",
    "journal": "Journal of Molecular Catalysis A: Chemical",
    "date": "2011-09-01",
    "doi": "10.1016/j.molcata.2011.08.008",
    "abstract": "",
    "uri": "https://api.elsevier.com/content/article/pii/S1381116911003268",
    "pii": "S1381116911003268"
  },
  "fulltext": {
    "full-text-retrieval-response": {
      "scopus-eid": "2-s2.0-80052968865",
      "originalText": "serial JL 271358 291210 291744 291790 291809 31 Journal of Molecular Catalysis A: Chemical JOURNALMOLECULARCATALYSISACHEMICAL 2011-08-22 2011-08-22 2011-09-17T22:26:51 1-s2.0-S1381116911003268 S1381-1169(11)00326-8 S1381116911003268 10.1016/j.molcata.2011.08.008 S300 S300.1 FULL-TEXT 1-s2.0-S1381116911X00134 2015-05-15T05:56:33.607047-04:00 0 0 20110901 2011 2011-08-22T00:00:00Z articleinfo crossmark dco dateupdated tomb dateloaded datesearch indexeddate issuelist volumelist yearnav absattachment articletitlenorm authfirstinitialnorm authfirstsurnamenorm cid cids contenttype copyright dateloadedtxt docsubtype doctype doi eid ewtransactionid hubeid issfirst issn issnnorm itemstage itemtransactionid itemweight openaccess openarchive pg pgfirst pglast pii piinorm pubdatestart pubdatetxt pubyr sortorder srctitle srctitlenorm srctype subheadings volfirst volissue webpdf webpdfpagecount figure table body acknowledge affil articletitle auth authfirstini authfull authkeywords authlast primabst ref specialabst alllist content subj ssids 1381-1169 13811169 348 348 1 2 1 2 Volume 348, Issues 1–2 13 88 93 88 93 20110901 1 September 2011 2011-09-01 2011 article fla Crown copyright © 2011 Published by Elsevier B.V. All rights reserved. WATERSOLUBLECISNHCPDBR2TPPTSCATALYSTSAPPLICATIONSINSUZUKIMIYAURACOUPLINGARYLCHLORIDES TURKMEN H 1 Introduction 2 Results and discussion 2.1 Thermogravimetric analyses (TGA) 2.2 Cyclic voltammetry of compounds (1c, 2c, 3c) 2.3 Suzuki–Miyaura coupling 2.4 Catalyst recycling 3 Conclusion 4 Experimental 4.1 General procedures 4.2 General procedure for the preparation 2; cleavage of the dimer 1 with TPPTS 4.3 General procedure for the Suzuki coupling reactions 4.4 Recycling of catalyst 4.5 Electrochemical measurements Acknowledgements References SUZUKI 2002 83 90 A MIYAURA 1995 2457 2483 N MARZIALE 2011 169 177 A MARZIALE 2010 35 38 A TU 2010 10598 10600 T FLECKENSTEIN 2010 694 711 C MARTIN 2008 1461 1473 R ANDERSON 2005 6329 6333 K LEE 2009 2912 2920 D LEE 2008 356 360 D MARION 2006 4101 4111 N NAVARRO 2006 5142 5148 O DIEZGONZALES 2009 3612 3676 S ORGAN 2009 2383 2387 M TURKMEN 2009 7039 7044 H NASIELSKI 2010 10844 10853 J WESKAMP 1999 348 352 T HERRMANN 2001 616 628 W HUYNH 2006 3267 3274 H TURKMEN 2006 3749 3759 H TURKMEN 2009 285 294 H LIAO 2009 405 417 C CHAN 2010 463 472 K DIEBOLT 2010 1443 1450 O GENET 1999 305 317 J BAI 2005 535 553 L ALANSO 2008 3047 3101 F ZHOU 2009 697 702 J ARVELA 2005 2101 2104 R GULCEMAL 2010 5602 5606 S SHAUGHNESSY 2009 643 710 K FIHRI 2011 3116 3121 A POLSHETTIWAR 2010 502 522 V SHAUGHNESSY 2006 1827 1835 K DUPUIS 2001 6523 6526 C KATTI 1999 9 17 K PINAULT 2003 1 25 N ROY 2010 1014 1022 S FLENKENSTEIN 2007 2870 2872 C GODOY 2011 684 688 F MOORE 2008 576 593 L BHANAGE 2000 342 345 B HAHN 1999 241 245 F HUYNH 2005 3854 3860 H GRIM 1970 56 60 S CETINKAYA 1973 906 912 B AMATORE 1995 1818 1826 C PYTKOWICZ 2003 166 179 J TURKMENX2011X88 TURKMENX2011X88X93 TURKMENX2011X88XH TURKMENX2011X88X93XH item S1381-1169(11)00326-8 S1381116911003268 1-s2.0-S1381116911003268 10.1016/j.molcata.2011.08.008 271358 2011-09-17T20:09:43.696529-04:00 2011-09-01 1-s2.0-S1381116911003268-main.pdf https://s3.amazonaws.com/prod-ucs-content-store-us-east/content/pii:S1381116911003268/MAIN/application/pdf/5745dea8be7ae6dfcba757b5ba40ba5c/main.pdf https://s3-eu-west-1.amazonaws.com/prod-ucs-content-store-eu-west/content/pii:S1381116911003268/MAIN/application/pdf/5745dea8be7ae6dfcba757b5ba40ba5c/main.pdf main.pdf pdf true 654925 MAIN 6 1-s2.0-S1381116911003268-main_1.png https://s3-eu-west-1.amazonaws.com/prod-ucs-content-store-eu-west/content/pii:S1381116911003268/PREVIEW/image/png/bbc67ead469e0bf81d0d7165f2f33231/main_1.png https://s3.amazonaws.com/prod-ucs-content-store-us-east/content/pii:S1381116911003268/PREVIEW/image/png/bbc67ead469e0bf81d0d7165f2f33231/main_1.png main_1.png png 60751 849 656 IMAGE-WEB-PDF 1 1-s2.0-S1381116911003268-fx1.jpg https://s3.amazonaws.com/prod-ucs-content-store-us-east/content/pii:S1381116911003268/fx1/DOWNSAMPLED/image/jpeg/6ffd8bcebe68cd774ffee57b8f827567/fx1.jpg https://s3-eu-west-1.amazonaws.com/prod-ucs-content-store-eu-west/content/pii:S1381116911003268/fx1/DOWNSAMPLED/image/jpeg/6ffd8bcebe68cd774ffee57b8f827567/fx1.jpg fx1 true fx1.jpg jpg 13416 200 500 IMAGE-DOWNSAMPLED 1-s2.0-S1381116911003268-fx1.sml https://s3.amazonaws.com/prod-ucs-content-store-us-east/content/pii:S1381116911003268/fx1/THUMBNAIL/image/gif/f9a6bcbd0a65f0fad16cf6c7a40afc5b/fx1.sml https://s3-eu-west-1.amazonaws.com/prod-ucs-content-store-eu-west/content/pii:S1381116911003268/fx1/THUMBNAIL/image/gif/f9a6bcbd0a65f0fad16cf6c7a40afc5b/fx1.sml fx1 true fx1.sml sml 2987 88 219 IMAGE-THUMBNAIL 1-s2.0-S1381116911003268-fx1_lrg.jpg https://s3.amazonaws.com/prod-ucs-content-store-us-east/content/pii:S1381116911003268/fx1/HIGHRES/image/jpeg/fd2e1d555711f712a5cf0fc1005b6358/fx1_lrg.jpg https://s3-eu-west-1.amazonaws.com/prod-ucs-content-store-eu-west/content/pii:S1381116911003268/fx1/HIGHRES/image/jpeg/fd2e1d555711f712a5cf0fc1005b6358/fx1_lrg.jpg fx1 fx1_lrg.jpg jpg 116257 886 2213 IMAGE-HIGH-RES 1-s2.0-S1381116911003268-fx2.jpg https://s3.amazonaws.com/prod-ucs-content-store-us-east/content/pii:S1381116911003268/fx2/DOWNSAMPLED/image/jpeg/608d1ddae50428dcc153bc5d5449da71/fx2.jpg https://s3-eu-west-1.amazonaws.com/prod-ucs-content-store-eu-west/content/pii:S1381116911003268/fx2/DOWNSAMPLED/image/jpeg/608d1ddae50428dcc153bc5d5449da71/fx2.jpg fx2 fx2.jpg jpg 8765 83 451 IMAGE-DOWNSAMPLED 1-s2.0-S1381116911003268-fx2.sml https://s3.amazonaws.com/prod-ucs-content-store-us-east/content/pii:S1381116911003268/fx2/THUMBNAIL/image/gif/aef36bd9a3bff15749cc4a127220c77b/fx2.sml https://s3-eu-west-1.amazonaws.com/prod-ucs-content-store-eu-west/content/pii:S1381116911003268/fx2/THUMBNAIL/image/gif/aef36bd9a3bff15749cc4a127220c77b/fx2.sml fx2 fx2.sml sml 2068 40 219 IMAGE-THUMBNAIL 1-s2.0-S1381116911003268-fx2_lrg.jpg https://s3.amazonaws.com/prod-ucs-content-store-us-east/content/pii:S1381116911003268/fx2/HIGHRES/image/jpeg/cc9ab2516279f1db28b76477d6ad6212/fx2_lrg.jpg https://s3-eu-west-1.amazonaws.com/prod-ucs-content-store-eu-west/content/pii:S1381116911003268/fx2/HIGHRES/image/jpeg/cc9ab2516279f1db28b76477d6ad6212/fx2_lrg.jpg fx2 fx2_lrg.jpg jpg 69806 369 1997 IMAGE-HIGH-RES 1-s2.0-S1381116911003268-fx3.jpg https://s3.amazonaws.com/prod-ucs-content-store-us-east/content/pii:S1381116911003268/fx3/DOWNSAMPLED/image/jpeg/7bfb0b75ba2538c0a7a5c43452e6a1f1/fx3.jpg https://s3-eu-west-1.amazonaws.com/prod-ucs-content-store-eu-west/content/pii:S1381116911003268/fx3/DOWNSAMPLED/image/jpeg/7bfb0b75ba2538c0a7a5c43452e6a1f1/fx3.jpg fx3 fx3.jpg jpg 8198 54 477 IMAGE-DOWNSAMPLED 1-s2.0-S1381116911003268-fx3.sml https://s3.amazonaws.com/prod-ucs-content-store-us-east/content/pii:S1381116911003268/fx3/THUMBNAIL/image/gif/eb50bcd970b1f1d2de54bd4044f2d48c/fx3.sml https://s3-eu-west-1.amazonaws.com/prod-ucs-content-store-eu-west/content/pii:S1381116911003268/fx3/THUMBNAIL/image/gif/eb50bcd970b1f1d2de54bd4044f2d48c/fx3.sml fx3 fx3.sml sml 1925 25 219 IMAGE-THUMBNAIL 1-s2.0-S1381116911003268-fx3_lrg.jpg https://s3.amazonaws.com/prod-ucs-content-store-us-east/content/pii:S1381116911003268/fx3/HIGHRES/image/jpeg/0f61fb3ec24e12313b377018ff5b27ca/fx3_lrg.jpg https://s3-eu-west-1.amazonaws.com/prod-ucs-content-store-eu-west/content/pii:S1381116911003268/fx3/HIGHRES/image/jpeg/0f61fb3ec24e12313b377018ff5b27ca/fx3_lrg.jpg fx3 fx3_lrg.jpg jpg 61128 237 2113 IMAGE-HIGH-RES 1-s2.0-S1381116911003268-fx4.jpg https://s3.amazonaws.com/prod-ucs-content-store-us-east/content/pii:S1381116911003268/fx4/DOWNSAMPLED/image/jpeg/728f075407b75b74da721cc30509c9a1/fx4.jpg https://s3-eu-west-1.amazonaws.com/prod-ucs-content-store-eu-west/content/pii:S1381116911003268/fx4/DOWNSAMPLED/image/jpeg/728f075407b75b74da721cc30509c9a1/fx4.jpg fx4 fx4.jpg jpg 8829 83 451 IMAGE-DOWNSAMPLED 1-s2.0-S1381116911003268-fx4.sml https://s3.amazonaws.com/prod-ucs-content-store-us-east/content/pii:S1381116911003268/fx4/THUMBNAIL/image/gif/7736a66da01812106b229998257b9eb6/fx4.sml https://s3-eu-west-1.amazonaws.com/prod-ucs-content-store-eu-west/content/pii:S1381116911003268/fx4/THUMBNAIL/image/gif/7736a66da01812106b229998257b9eb6/fx4.sml fx4 fx4.sml sml 2071 40 219 IMAGE-THUMBNAIL 1-s2.0-S1381116911003268-fx4_lrg.jpg https://s3.amazonaws.com/prod-ucs-content-store-us-east/content/pii:S1381116911003268/fx4/HIGHRES/image/jpeg/ca3bd880ffc540c6fb213d9684473f56/fx4_lrg.jpg https://s3-eu-west-1.amazonaws.com/prod-ucs-content-store-eu-west/content/pii:S1381116911003268/fx4/HIGHRES/image/jpeg/ca3bd880ffc540c6fb213d9684473f56/fx4_lrg.jpg fx4 fx4_lrg.jpg jpg 69980 369 1997 IMAGE-HIGH-RES 1-s2.0-S1381116911003268-gr1.jpg https://s3.amazonaws.com/prod-ucs-content-store-us-east/content/pii:S1381116911003268/gr1/DOWNSAMPLED/image/jpeg/2b209492359ef6ab25f51801864d7397/gr1.jpg https://s3-eu-west-1.amazonaws.com/prod-ucs-content-store-eu-west/content/pii:S1381116911003268/gr1/DOWNSAMPLED/image/jpeg/2b209492359ef6ab25f51801864d7397/gr1.jpg gr1 gr1.jpg jpg 21854 154 715 IMAGE-DOWNSAMPLED 1-s2.0-S1381116911003268-gr1.sml https://s3.amazonaws.com/prod-ucs-content-store-us-east/content/pii:S1381116911003268/gr1/THUMBNAIL/image/gif/8f0c5b3fd557849642c355e372e1c837/gr1.sml https://s3-eu-west-1.amazonaws.com/prod-ucs-content-store-eu-west/content/pii:S1381116911003268/gr1/THUMBNAIL/image/gif/8f0c5b3fd557849642c355e372e1c837/gr1.sml gr1 gr1.sml sml 1486 47 219 IMAGE-THUMBNAIL 1-s2.0-S1381116911003268-gr1_lrg.jpg https://s3.amazonaws.com/prod-ucs-content-store-us-east/content/pii:S1381116911003268/gr1/HIGHRES/image/jpeg/5628ffb2b3187604788aafa5f71a75ef/gr1_lrg.jpg https://s3-eu-west-1.amazonaws.com/prod-ucs-content-store-eu-west/content/pii:S1381116911003268/gr1/HIGHRES/image/jpeg/5628ffb2b3187604788aafa5f71a75ef/gr1_lrg.jpg gr1 gr1_lrg.jpg jpg 137582 680 3167 IMAGE-HIGH-RES 1-s2.0-S1381116911003268-gr2.jpg https://s3.amazonaws.com/prod-ucs-content-store-us-east/content/pii:S1381116911003268/gr2/DOWNSAMPLED/image/jpeg/48c608493162fd4d92d9666b0c88213f/gr2.jpg https://s3-eu-west-1.amazonaws.com/prod-ucs-content-store-eu-west/content/pii:S1381116911003268/gr2/DOWNSAMPLED/image/jpeg/48c608493162fd4d92d9666b0c88213f/gr2.jpg gr2 gr2.jpg jpg 89147 437 809 IMAGE-DOWNSAMPLED 1-s2.0-S1381116911003268-gr2.sml https://s3.amazonaws.com/prod-ucs-content-store-us-east/content/pii:S1381116911003268/gr2/THUMBNAIL/image/gif/f9be1732023b1bd2f89bfa770e804396/gr2.sml https://s3-eu-west-1.amazonaws.com/prod-ucs-content-store-eu-west/content/pii:S1381116911003268/gr2/THUMBNAIL/image/gif/f9be1732023b1bd2f89bfa770e804396/gr2.sml gr2 gr2.sml sml 6762 118 219 IMAGE-THUMBNAIL 1-s2.0-S1381116911003268-gr2_lrg.jpg https://s3.amazonaws.com/prod-ucs-content-store-us-east/content/pii:S1381116911003268/gr2/HIGHRES/image/jpeg/7aafbd39d5f38799323bce9ca9744d91/gr2_lrg.jpg https://s3-eu-west-1.amazonaws.com/prod-ucs-content-store-eu-west/content/pii:S1381116911003268/gr2/HIGHRES/image/jpeg/7aafbd39d5f38799323bce9ca9744d91/gr2_lrg.jpg gr2 gr2_lrg.jpg jpg 635989 1936 3583 IMAGE-HIGH-RES 1-s2.0-S1381116911003268-gr3.jpg https://s3.amazonaws.com/prod-ucs-content-store-us-east/content/pii:S1381116911003268/gr3/DOWNSAMPLED/image/jpeg/28856780a030f480649e5bce868d470b/gr3.jpg https://s3-eu-west-1.amazonaws.com/prod-ucs-content-store-eu-west/content/pii:S1381116911003268/gr3/DOWNSAMPLED/image/jpeg/28856780a030f480649e5bce868d470b/gr3.jpg gr3 gr3.jpg jpg 31082 294 395 IMAGE-DOWNSAMPLED 1-s2.0-S1381116911003268-gr3.sml https://s3.amazonaws.com/prod-ucs-content-store-us-east/content/pii:S1381116911003268/gr3/THUMBNAIL/image/gif/ca84c7764186841d02c5d72a2e09fa91/gr3.sml https://s3-eu-west-1.amazonaws.com/prod-ucs-content-store-eu-west/content/pii:S1381116911003268/gr3/THUMBNAIL/image/gif/ca84c7764186841d02c5d72a2e09fa91/gr3.sml gr3 gr3.sml sml 4712 163 219 IMAGE-THUMBNAIL 1-s2.0-S1381116911003268-gr3_lrg.jpg https://s3.amazonaws.com/prod-ucs-content-store-us-east/content/pii:S1381116911003268/gr3/HIGHRES/image/jpeg/3d83e250068e2b7998f0c0c5b684fa4c/gr3_lrg.jpg https://s3-eu-west-1.amazonaws.com/prod-ucs-content-store-eu-west/content/pii:S1381116911003268/gr3/HIGHRES/image/jpeg/3d83e250068e2b7998f0c0c5b684fa4c/gr3_lrg.jpg gr3 gr3_lrg.jpg jpg 205062 1303 1748 IMAGE-HIGH-RES 1-s2.0-S1381116911003268-sc1.jpg https://s3.amazonaws.com/prod-ucs-content-store-us-east/content/pii:S1381116911003268/sc1/DOWNSAMPLED/image/jpeg/9c3c02a55c25401b218fe5af15466bda/sc1.jpg https://s3-eu-west-1.amazonaws.com/prod-ucs-content-store-eu-west/content/pii:S1381116911003268/sc1/DOWNSAMPLED/image/jpeg/9c3c02a55c25401b218fe5af15466bda/sc1.jpg sc1 sc1.jpg jpg 23145 278 579 IMAGE-DOWNSAMPLED 1-s2.0-S1381116911003268-sc1.sml https://s3.amazonaws.com/prod-ucs-content-store-us-east/content/pii:S1381116911003268/sc1/THUMBNAIL/image/gif/284ef4d37214f200e2cb3f6b893eca8e/sc1.sml https://s3-eu-west-1.amazonaws.com/prod-ucs-content-store-eu-west/content/pii:S1381116911003268/sc1/THUMBNAIL/image/gif/284ef4d37214f200e2cb3f6b893eca8e/sc1.sml sc1 sc1.sml sml 3281 105 219 IMAGE-THUMBNAIL 1-s2.0-S1381116911003268-sc1_lrg.jpg https://s3.amazonaws.com/prod-ucs-content-store-us-east/content/pii:S1381116911003268/sc1/HIGHRES/image/jpeg/c4af846a6537f09efbe854d428f2edac/sc1_lrg.jpg https://s3-eu-west-1.amazonaws.com/prod-ucs-content-store-eu-west/content/pii:S1381116911003268/sc1/HIGHRES/image/jpeg/c4af846a6537f09efbe854d428f2edac/sc1_lrg.jpg sc1 sc1_lrg.jpg jpg 198662 1229 2563 IMAGE-HIGH-RES MOLCAA 8194 S1381-1169(11)00326-8 10.1016/j.molcata.2011.08.008 Fig. 1 Time-dependent 31P NMR spectra showing the trans–cis isomerization of a mixed NHC-phosphine complex, 2c. Fig. 2 The TGA and DTG curves of complexes (1c–4c). Fig. 3 Cyclic voltammogram of 1mM complex (1c–3c) in a solution of water–acetonitrile mixture (1:1, v/v) at room temperature vs. Ag/AgCl reference electrode (scan rate: 100mV/s). Scheme 1 Reagents and conditions: P(PhSO3Na)3, DMSO, RT, 36h. Table 1 Screening of bases and reaction conditions. . Entry 2c [Pd]% Bases Time Yield (%) 1 1 KOH 4 99 2 0.1 KOH 4 78 3 0.01 KOH 4 40 4 0.001 KOH 4 10 5 1 NaOH 4 79 6 1 K2CO3 4 67 7 1 K3PO4 4 54 8 1 Et3N 4 58 9 1 KOH 2 67 10 1 KOH 0.5 34 11 1 KOH 4 54 a a Reaction temperature was set to 80°C. Table 2 The Suzuki coupling reaction of aryl chlorides with phenylboronic acid. . Entry Complex Aryl chloride Conversion (%) Yield (%) a 1 2a 4-Chloroacetophenone 100 94(93) 2 2b ” 100 94(91) 3 2c ” 100 99(93) 4 2d ” 99 93 5 2a 4-Chlorotoluene 99 85(89) 6 2b ” 98 83(85) 7 2c ” 95 90(89) 8 2d ” 96 80 9 2a 4-Chloroanisole 87 82(87) 10 2b ” 81 78(85) 11 2c ” 87 88(88) 12 2d ” 82 80 13 2a 4-Chlorobenzaldehyde 91 79(91) 14 2b ” 94 80(88) 15 2c ” 99 89(92) 16 2d ” 85 78 17 2a 2-Chloroanisole 90 70 18 2b ” 83 73 19 2c ” 89 81 20 2d ” 86 72 21 2a 1-Chloro-4-nitrobenzene 93 89 22 2b ” 90 85 23 2c ” 95 93 24 2d ” 88 82 25 2a 4-Chlorobenzonitrile 89 83 26 2b ” 90 85 27 2c ” 92 88 28 2d ” 88 85 29 2a 2-Chloro-p-xylene 58 42 30 2b ” 55 40 31 2c ” 60 45 32 2d ” 56 39 a The yields shown in parentheses were taken from Ref. [13]. Table 3 Recyclic of catalyst 2c. . Entry Yield (%) Trial Yield (%) a 1 99(99) 4 83(48) 2 94(67) 5 72(41) 3 88(63) 6 54(30) a The yields shown in parentheses were taken from Ref. [13]. Water-soluble cis-[(NHC)PdBr2(TPPTS)] catalysts and their applications in Suzuki–Miyaura coupling of aryl chlorides Hayati Türkmen ⁎ Levent Pelit Bekir Çetinkaya Department of Chemistry, Ege University, 35100 Bornova-Izmir, Turkey ⁎ Corresponding author. Graphical abstract Highlights ► Water soluble complexes were prepared. ► These complexes were active in the Suzuki cross-coupling reactions. ► Makes the catalyst reusable. ► This process is ecologically and economically acceptable. New palladium(II) complexes (2), bearing NHC/TPPTS ligands, (NHC=benzimidazol-2-ylidene; TPPTS=triphenylphosphine-3,3′,3″-trisulfonic acid trisodium salt) have been prepared and characterized by elemental analyses and spectroscopic methods. Their ability to catalyze the Suzuki–Miyaura reaction in neat water has been studied at 100°C. Very high activities have been observed in the coupling of phenylboronic acid with aryl chlorides in the presence of 1% of the catalyst. We have compared the electronic properties of cis-[PdBr2(NHC)(TPPTS)] with the related complexes, [PdX2(NHC)]2 and [trans-PdBr2(NHC)(pdca)] (pdca=pyridine-2,6-dicarboxyic acid) (3) via three different techniques: cyclic voltammetry, thermogravimetric analysis and 13C NMR spectroscopy. Keywords Water soluble complexes Cross-coupling Palladium Electronic effects NHC 1 Introduction Since 1979 the Suzuki–Miyaura coupling reaction has been employed for the synthesis of functionalised biaryls which constitute important building blocks for various chemicals such as pharmaceuticals, herbicides and intermediates for material chemistry [1]. A variety of Pd(0) and Pd(II) catalysts promote these couplings, and these catalysts are usually complexes which contain phosphorus ligands [2]. Recently much attention has been paid to develop milder and operationally more simple procedures for these coupling reactions. Some important developments include the use of palladacycles [3,4], pincer palladium catalysts [5], electron-rich phosphines [6,7] and β-oximinato(phosphanyl)palladium complexes and their immobilized versions [8]. More recently, NHC ligands have been able to challenge the widely used tertiary phosphines as popular ligands for this process [9–11]. Mixed-ligand complexes of the type [PdX2(NHC)L] (L=phosphine, pyridine, 3-chloropyridine, pyridine-2,6-dicarboxylic acid), in comparison to those of their bis(NHC) analogues, have been reported to give superior activity [12–14]. The NHC ligands offer several advantages. For example, NHC ligands are more electron-donating and generally form stronger bonds to the metal than phosphine ligands, resulting in a reduced tendency to dissociate. Thus, replacement of phosphines by NHC ligands can provide some significant improvements over conventional phosphine bearing analogues. Herrmann and others [15–22] have developed a series of mixed Pd(II) complexes bearing NHC/PR3 ligands for C–C bond formation. The high efficiency of these complexes in comparison to [PdX2(NHC)2] or [PdX2(PR3)2] has been attributed to ready dissociation of PR3 from the Pd atom to allow formation of a coordinatively unsaturated metal centre and the strong electron-donating ability of the NHC ligand. On the other hand, there has been a long-standing interest in aqueous-phase, palladium-catalyzed cross-coupling reactions [23–36]. Water is an attractive replacement for traditional organic solvents because it is inexpensive, nontoxic, and nonflammable. In addition, the use of water-soluble catalysts in aqueous/biphasic mixtures combines the advantages of homogeneous and heterogeneous catalysis, i.e., separation of the organic products from the catalysts, high activity and selectivity under mild conditions. This goal has led to the development of new hydrophilic ligands and derived complexes. Water-solubility is generally achievable by introduction of functionalities such as –SO3 −, COO−, NR4 + into the ligands and their incorporation into the organometallic catalysts. In this context, a few sulfonated imidazol(in)ium salts have been synthesized and applied successfully in the aqueous phase Suzuki–Miyaura coupling reactions of aryl halides [37–39]. Naturally, one could anticipate that this concept would also operate with hydrophilic phosphines such as TPPTS, because PPh3 and TPPTS have the same structural motif. In view of the high reactivity of the mixed (NHC)/PR3 palladium(II) complexes we envisioned that a benzimidazole based NHC and TPPTS combination would be effective in the coupling reactions of aryl chlorides under mild conditions in water. TPPTS has been selected as the ligand to enforce solubility of the catalyst in water because it is commercially available and is one of the most common hydrophilic phosphines employed in the development of active water-soluble metal catalysts. Although, the cone angle value of TPPTS (145°) was found to be the same as PPh3, the electron-donating ability of TPPTS is slightly less than PPh3 as determined by the CO frequency of trans-[RhCl(CO)L2] [40]. 2 Results and discussion Synthesis and characterization of complexes. Dimeric Pd(II) complexes, bearing one NHC per metal centre and two bridging bromides, readily available from Pd(OAc)2 and NHC precursors, can react with nucleophiles such as PPh3 [19]. Similarly, cleavage of the dimer 1 with 2 equiv. of commercially available TPPTS in DMSO at RT after 36h stirring afforded cis-[PdBr2(NHC)(TPPTS)], 2(a–d) (Scheme 1 ). All compounds are soluble in water and DMSO and they are stable in the solid state and in solution. Their identity was established by analytical and NMR data, and, in addition, thermal gravimetric analysis (TGA) and cyclic voltammetry (CV) were applied to the complexes 1c, 2c, 3c. 13C {1H} NMR signals of the Pd–Ccarb of 2 (ä 173.9–174.3) were observed to shift slightly to lower field as compared to their signals in the PPh3 complexes. This might be due to the more electron-poor Pd(II) centre because of the TPPTS ligand's electron density. The presence of TPPTS is clearly demonstrated by 31P NMR spectroscopy, where one signal corresponding to the cis configuration was observed at ä ≈27ppm, the signal of free TPPTS (ä −4.8ppm) shifted downfield ∼35ppm [41]. As both cis and trans isomers of palladium complexes of types [PdX2(NHC)L] [15–22] and [PdX2(NHC)2] [42,43] are known, we wondered if initially a trans isomer formed. Thus, in a separate experiment, we terminated the cleavage reaction of 1c with TPPTS after 30min and the obtained product was monitored by 31P NMR spectroscopy. Fig. 1 depicts the time-dependent 31P NMR spectra in the range of 0–100ppm recorded in d 6-DMSO at room temperature. Indeed, the predominant species after 0.5h is trans-2c (19.91ppm), which slowly isomerizes to cis-2c (26.99ppm) with a 30% conversion after 16h. However, after standing 36h the trans-2c has transformed into cis-2c exclusively. The isomerization reaction is much faster when monitored at 80°C. The assignments of the resonances in the 31P NMR spectra could be achieved by comparison with the related data of PPh3 and the general observation that for a particular phosphine ligand, the P value of the trans-isomer is up field from that of the cis-isomer [44]. The trans-complex is kinetically controlled, whereas the cis-isomer is thermodynamically the more favored [45]. 2.1 Thermogravimetric analyses (TGA) The thermal behavior of the complexes (1c–4c) was investigated using thermogravimetric analysis (TGA) Fig. 2 . The dimeric complex (1c) decomposes in one step which was observed to be in a temperature range between 350°C and 400°C with a total mass loss of 36%. Similar to 1c, 3c decomposes in a one step process, but at a lower temperature. For comparison, we have included cis-dibromo[N-(pentamethylbenzyl)-N-(2-methoxyethyl)benzimidazol-2-ylidene] (triphenylphosphine)palladium(II), 4c [19]. The higher thermal stability of 2c may be attributed to the ionic nature of TPPTS ligand. 2.2 Cyclic voltammetry of compounds (1c, 2c, 3c) Cyclic voltammograms for processes involving complexes under study are presented in Fig. 3 . All complexes exhibit similar voltammetric features. Complex 1c was reduced in the two waves at about +350mV and −165mV respectively. In the reverse scan, two anodic much lower current intensity waves were observed at +85mV and +560mV respectively. This is indicative of irreversible processes, which may be related to slow electron transfer to Pd(II) (electrochemical irreversibility) or to instability of the reduced species of Pd(II) (chemical irreversibility) or to both of them. Considering the well known redox properties of palladium, the observed cathodic peaks can be attributed to the reduction of Pd(II) to Pd(0). Two reversible reduction peaks were also observed for 3c at 0mV, followed by a second one of much higher current intensity at −420mV. Upon scan inversion, two oxidation waves were detected at −2mV and −335mV respectively. Similarly two reversible reduction waves were observed at about −350mV and −525mV for 2c. Two oxidation waves were detected on the reverse scan at −325mV and −560mV respectively. These oxidation waves characterized the complex generated by the reduction of the initial complexes. An interesting aspect about the voltammetric behavior of the complexes (2c, 3c) is the presence of two peaks, though of dissimilar height. This indicates the presence of different species in solution, most likely due to the substitution of the Cl− anions bound to the metal with coordinating solvent molecules. The ease of reduction of palladium(II) complexes investigated here has been in the order 1c > 3c > 2c. The reduction wave of 1c was shifted to a more negative potential by substitution with TPPTS and pdca by about 700mV and 350mV respectively. From the reduction potentials of the palladium(II) complexes, one observes that, for a given ligand, the introduction of TPPTS onto the Pd(II) complexes resulted in more negative potentials [46,47]. The reduction potential of the complex is related to the charge density on metal. Thus, stronger electron-donor ligands will form Pd(II) complexes with a smaller positive charge density on the metal. As a result the reduction potential will shift to more negative values. The reduction potential of the complexes show that the TPPTS is a greater electron donor than other ligands and consequently the Pd(II) ligated by TPPTS ligands is less easily reduced than complexes ligated by bromide and pdca. As a result the TPPTS ligand increased the catalytic activity of Pd(II) complexes. These results were also in good agreement with catalytic tests. 2.3 Suzuki–Miyaura coupling The water-soluble complexes (2) were assessed for their activity in the Suzuki–Miyaura coupling by studying the reaction of phenylboronic acid with activated and non activated aryl chlorides in neat water. We adopted reaction conditions that have been used previously and trans-[PdBr2(NHC)(pdc)] (pdca=pyridine-2,6-dicarboxylic acid) complexes were also included into these studies for the sake of comparison [13]. A mixture of phenylboronic acid (1.2 equiv), aryl chloride (1.0 equiv) KOH (2.0 equiv), and 1mol% catalyst was heated at 100°C for 4h. The coupling products, insoluble in water, were simply filtered off and washed with water. We have not experienced purification problems caused by the dechlorinated side-products or the excess of phenylboronic acid. We surveyed the effect of bases, the catalyst loading and reaction times on the cross-coupling reaction between 4-chloroacetophenone and phenylboronic acid using complex 2c as a palladium source. As shown in Table 1 , among organic and inorganic bases examined, it has been found that KOH is the most efficient (entry 1), other bases, such as NaOH, K2CO3, K3PO4 and Et3N were slightly less efficient (entries 5–8), but 4-acetyldiphenyl was still formed in moderate GC yields. When the palladium loading decreased from 1% to 0.1%, a slightly lower GC yield was obtained (entry 2). Compared to the trans-[PdBr2(NHC)(pda)] catalyst reported previously, the activity of the cis-[PdBr2(NHC)(TPPTS)] complex in Suzuki coupling reactions is significantly improved. The reaction of p-chloroacetophenone and phenylboronic acid (Table 2 , entry 3) gave good yields. Although optimization studies have been not carried out, these compare with the use of activated aryl chlorides under identical conditions (entries 5–20), to give moderate to excellent yields of unsymmetrical biaryls. The similar reactivity trends with our previous report is in agreement with the stronger donating ability of alkyl substituents, making the donor atoms more electron-rich. 2.4 Catalyst recycling We examined the possibility of reusing the catalyst 2c for the Suzuki–Miyaura reaction of 4-chloroacetophenone and phenylboronic acid and the reactions were conducted under the same conditions. After the first reaction, the solid product was separated by filtration (99% yield). To the filtrate containing 2c fresh substrates, KOH and sufficient distilled water were added to bring the volume to 5.0mL. The yields for the 2nd, 3rd and 4th cycles were 94%, 88% and 83% respectively (Table 3 ). The catalyst 2c appears to be reusable for 6 cycles for the reaction of 4-chloroacetophenone; however, on the sixth cycle the yield dropped to 54%. 3 Conclusion The coordination of sulfonated phosphine (m-TPPTS) to the PdBr2(NHC) fragment affords stable and water-soluble complexes which are initially trans-isomers. However, they convert into thermodynamically more stable cis-isomers in polar solutions. The cis-isomer is active towards the Suzuki–Miyaura coupling of phenylboronic acid and chloroarenes in water at 100°C. Advantages of the reaction protocol are: (i) ease of catalyst-product separation; (ii) ability for recycling for at least four runs. Thus, this process is ecologically and economically acceptable. Further catalytic applications of novel NHC ligands with TPPTS in water are currently being investigated. 4 Experimental 4.1 General procedures The complexes 1, 3c and 4c were prepared according to the literature methods [13,19]. NMR spectra were recorded at 297K on a Varian Mercury AS 400 at 400MHz (1H), 100.56MHz (13C), 161.87MHz (31P). Elemental analyses were carried out by the analytical service of TUBITAK with a Carlo Erba Strumentazione Model 1106 apparatus. The yields of C–C coupling products were determined using GC and NMR. Thermogravimetric (TG) and differential thermogravimetric (DTG) curves were obtained using a Perkin–Elmer Pyris 6 analyzer in the range 50–600°C in alumina crucibles under nitrogen (flux rate: 20cm3 min−1) at a heating rate of 20°Cmin−1 using alumina as reference. 4.2 General procedure for the preparation 2; cleavage of the dimer 1 with TPPTS A sample of 1 (0.5mmol) and triphenylphosphine-3,3′,3″-trisulfonic acid trisodium salt, TPPTS (1.0mmol) were dissolved in 10mL of dimethyl sulfoxide. The mixture was stirred at ambient temperature for 36h. The volume of the solution was reduced to ca 5mL in vacuo. Diethyl ether (10mL) was added to the solution to obtain a bright cream precipitate which was collected by filtration, washed with 10mL of diethyl ether, and dried in vacuo. 2a: Yield: 0.52g, 93.0%. 1H NMR (400MHz, DMSO): ä TPPTS-H: 7.93 (d, 1H, J =1.9Hz); 7.83 (d, 1H, J =1.9Hz); 7.71 (d, 1H, J =1.2Hz,); 7.61 (b, 2H), 7.50 (b, 2H), 7.37 (m, 3H); 7.26 (b, 2H, J =1.2Hz), 7.14 (t, 1H, J =1.8Hz, Ar–H), 7.06 (t, 1H, J =1.9Hz, Ar–H), 6.91 (s, 2H, CH2C6 H 2(CH3)3), 6.91 (d, 1H, J =2.0Hz, Ar–H), 6.23 (d, 1H, J =2.0Hz, Ar–H), 5.72 (d, 1H, J =2.2Hz, CH2C6 H 2(CH3)3), 5. 26 (d, 1H, J =2.1Hz, CH 2C6H2(CH3)3), 5.15 (d, 1H, J =2.2Hz, CH 2C6H2(CH3)3), 4.57, 4.99 (d, 1H, J =2.2Hz, CH2C6 H 2(CH3)3), 4.64 (m, 2H, NCH 2CH2OCH3), 3.96, 3.87 (b, 2H, NCH2CH 2OCH3), 2.54 (s, 3H, NCH2CH2OCH 3), 2.50 (s, 3H, CH2C6H2(CH 3)3), 2.26 (s, 6H, CH2C6H2(CH 3)3). 13C NMR (100MHz, DMSO): ä 173.9 (C–Pd), 147.1, 135.3, 135.0, 134.6, 134.4, 133.8, 132.7, 129.7, 129.4, 128.8, 128.7, 128.6, 123.4, 122.8, 112.3, 110.9 (Ar–C, TPPTS-C, C 6H2(CH3)3), 70.6 (NCH2CH2OCH3), 58.9 (NCH2 CH2OCH3), 51.3 (CH2C6H2(CH3)3), 48.8 (NCH2CH2OCH3), 20.7, 16.7 (CH2C6H2(CH3)3). 31P NMR (162.0Hz, DMSO): ä 27.1. Anal. Calc. for C38H36Br2N2Na3O10PPdS3 (M=1143.07) C 39.93, H 3.17, N 2.45. Found C 40.01, H 3.13, N 2.39%. 2b: Yield: 0.46g, 81.0%. 1H NMR (400MHz, DMSO): ä TPPTS-H: 7.92 (d, 1H, J =2.0Hz), 7.80 (d, 1H, J =1.9Hz); 7.66 (d, 1H, J =1.9Hz); 7.19–6.93 (b, 12H, Ar–H, CH2C6 H(CH3)4), 6.65 (b, 1H, Ar–H), 6.31 (b, 1H, Ar–H), 5.54 (b, 1H, CH 2C6H(CH3)4), 5.11 (b, 1H, CH 2C6H(CH3)4), 4.63 (b, 1H, NCH 2CH2OCH3), 4.34 (b, 1H, NCH 2CH2OCH3), 3.84 (b, 2H, NCH2CH 2OCH3), 2.50 (s, 3H, NCH2CH2OCH 3), 2.43 (s, 6H, CH2C6H(CH 3)4), 2.30 (s, 6H, CH2C6H(CH 3)4). 13C NMR (100MHz, DMSO): ä 174.3 (C–Pd), 149.1, 149.0, 148.9, 136.7, 135.4, 134.7, 133.4, 133.2, 132.9, 132.4, 132.3, 132.2, 129.9, 129.6, 129.5, 129.2, 129.1, 127.2, 123.6, 123.1, 112.8, 110.7 (Ar–C, TPPTS-C, C 6H(CH3)4), 70.6 (NCH2CH2OCH3), 58.8 (NCH2 CH2OCH3), 51.7 (CH2C6H(CH3)4), 48.6 (NCH2CH2OCH3), 17.8, 17.3 (CH2C6H(CH3)4). 31P NMR (162.0Hz, DMSO): ä 26.9. Anal. Calc. for C39H38Br2N2Na3O10PPdS3 (M=1157.09) C 40.48, H 3.31, N 2.42. Found C 40.41, H 3.27, N 2.49%. 2c: Yield: 0.49g, 84.0%. 1H NMR (400MHz, DMSO): ä TPPTS-H: 7.96–7.84 (m, 2H), 7.71–7.56 (m, 10H), 7.34 (d, 1H, J =1.9Hz, Ar–H), 7.06 (t, 1H, J =1.9Hz, Ar–H), 6.78 (t, 1H, J =2Hz, Ar–H), 6.18 (d, 1H, J =1.9Hz, Ar–H), 5.62 (d, 1H, J =2.1Hz, CH2C6(CH3)5), 5.19 (d, 1H, J =2.2Hz, CH 2C6(CH3)5), 4.57 (m, 2H, NCH 2CH2OCH3), 3.85, 3.80 (b, 2H, NCH2CH 2OCH3), 2.49 (s, 3H, NCH2CH2OCH 3), 2.40 (s, 6H, CH2C6(CH 3)5), 2.32 (s, 6H, CH2C6(CH 3)5), 2.24 (s, 3H, CH2C6(CH 3)5). 13C NMR (100MHz, DMSO): ä 174.3 (C–Pd), 149.1, 149.0, 148.9, 136.6, 135.4, 134.7, 133.4, 133.2, 132.9, 132.4, 132.1, 132.0, 129.9, 129.6, 129.4, 129.2, 129.1, 127.2, 123.6, 123.0, 112.8, 110.8 (Ar–C, TPPTS-C, C 6(CH3)5), 70.5 (NCH2CH2OCH3), 58.8 (NCH2 CH2OCH3), 51.7 (CH2C6(CH3)5), 48.6 (NCH2CH2OCH3), 17.8, 17.3, 16.7 (CH2C6(CH3)5). 31P NMR (162.0Hz, DMSO): ä 26.9. Anal. Calc. for C40H40Br2N2Na3O10PPdS3 (M=1171.12) C 41.02, H 3.44, N 2.39. Found C 41.12, H 3.50, N 2.33%. 2d: Yield: 0.49g, 84.0%. 1H NMR (400MHz, DMSO): ä TPPTS-H: 7.96–7.84 (m, 2H), 7.71–7.56 (m, 10H), 7.34 (d, 1H, J =1.9Hz, Ar–H), 7.06 (t, 1H, J =1.9Hz, Ar–H), 6.78 (t, 1H, J =2Hz, Ar–H), 6.18 (d, 1H, J =1.9Hz, Ar–H), 5.62 (d, 1H, J =2.1Hz, CH2C6(CH3)5), 5.19 (d, 1H, J =2.2Hz, CH 2C6(CH3)5), 4.57 (m, 2H, NCH 2CH2OCH3), 3.85, 3.80 (b, 2H, NCH2CH 2OCH3), 2.49 (s, 3H, NCH2CH2OCH 3), 2.40 (s, 6H, CH2C6(CH 3)5), 2.32 (s, 6H, CH2C6(CH 3)5), 2.24 (s, 3H, CH2C6(CH 3)5). 13C NMR (100MHz, DMSO): ä 174.2 (C–Pd), 149.1, 149.0, 148.9, 136.6, 135.4, 134.7, 133.4, 133.2, 132.9, 132.4, 132.1, 132.0, 129.9, 129.6, 129.4, 129.2, 129.1, 127.2, 123.6, 123.0, 112.8, 110.8 (Ar–C, TPPTS-C, C 6(CH3)5), 70.5 (NCH2CH2OCH3), 58.8 (NCH2 CH2OCH3), 51.7 (CH2C6(CH3)5), 48.6 (NCH2CH2OCH3), 17.8, 17.3, 16.7 (CH2C6(CH3)5). 31P NMR (162.0Hz, DMSO): ä 26.9. Anal. Calc. for C40H40Br2N2Na3O10PPdS3 (M=1171.12) C 41.02, H 3.44, N 2.39. Found C 41.12, H 3.50, N 2.33%. 4.3 General procedure for the Suzuki coupling reactions A two-necked 25mL flask fitted with a reflux condenser was charged with aryl chlorides (1.0mmol), 2mmol KOH, phenylboronic acid (1.5mmol), diethyleneglycol-di-n-butylether (0.6mmol, internal standard), 1.0% 2a–d in 6mL of H2O was added. The flask was placed in a preheated oil bath (100°C) under air atmosphere, temperature 100°C, and 4h. The conversion was monitored by gas chromatography following filtration or extractions with CH2Cl2. Yields were determined by gas chromatography for an average of two runs. 4.4 Recycling of catalyst The flask was charged with catalyst 2c, 4-chloroacetophenone (1.0mmol), 2mmol KOH, phenylboronic acid (1.5mmol), and diethyleneglycol-di-n-butylether (0.6mmol, internal standard). The reaction was carried out in water at 100°C. After cooling to room temperature, the organic products were removed by filtration. The aqueous phase was then transferred to a new reaction flask for next cycle. Yields were determined by gas chromatography for an average of two runs. 4.5 Electrochemical measurements All reagents used in this work were of analytical grade and all solutions were prepared using ultra pure water supplied from a Milli-Q purification system (18.2MΩcm, Millipore System Inc.). The electrochemical measurements were performed in a conventional three-electrode electrochemical cell using a Palmsence electrochemical analyzer interfaced with a PC. A platinum wire served as a counter electrode, and the reference electrode is saturated Ag/AgCl. A stationary platinum disk was used as a working electrode. Cyclic voltammetric measurements were obtained with sweeping from +1000 to −800mV at 100mV/s scan rate. The electrochemical behavior of Pd(II) complexes (1c–3c) was analyzed by cyclic voltammetry in 1mM acetonitrile–water mixture (1:1, v/v) solutions of the complexes (1c–3c) containing 0.05M KCl supporting electrolyte. All electrolyte solutions were purged by high purity argon for 5min prior to any measurements at room temperature. Acknowledgements Financial support from Ege University (Project 2010-FEN-046 and 2010-Fen- 076) and The Turkish Academy of Sciences (TUBA) is gratefully acknowledged. We also thank to Dr. S. Astley at Ege University Chemistry Department for the manuscript reading. References [1] A. Suzuki J. Organomet. Chem. 653 2002 83 90 [2] N. Miyaura A. Suzuki Chem. Rev. 95 1995 2457 2483 [3] A.N. Marziale D. Jantke S.H. Faul T. Reiner E. Herdtweck J. Eppinger Green Chem. 13 2011 169 177 [4] A.N. Marziale S.H. Faul T. Reiner S. Schneider J. Eppinger Green Chem. 12 2010 35 38 [5] T. Tu X. Feng Z. Wang X. Liu Dalton Trans. 2010 10598 10600 and references therein [6] (a) C.A. Fleckenstein H. Plenio Chem. Soc. Rev. 39 2010 694 711 (b) R. Martin S.L. Buchwald Acc. Chem. Res. 42 2008 1461 1473 [7] K.W. Anderson S.L. Buchwald Angew. Chem. Int. Ed. 117 2005 6329 6333 [8] (a) D.-H. Lee M. Choi B.-W. Yu R. Ryoo A. Taher S. Hossain M.-J. Jin Adv. Synth. Catal. 357 2009 2912 2920 (b) D.-H. Lee J.-Y. Jung I.-M. Lee M.-J. Jin Eur. J. Org. Chem. 2008 356 360 [9] N. Marion O. Navarro J. Mei E.D. Stevens N.M. Scott S.P. Nolan J. Am. Chem. Soc. 128 2006 4101 4111 [10] O. Navarro N. Marion J. Mei S.P. Nolan Chem. Eur. J. 12 2006 5142 5148 [11] S. Diez-gonzales N. Marion S.P. Nolan Chem. Rev. 109 2009 3612 3676 [12] M.G. Organ S. Çalimsiz M. Sayah K.H. Hoi A.J. Lough Angew. Chem. Int. Ed. 48 2009 2383 2387 [13] H. Türkmen R. Can B. Çetinkaya Dalton Trans. 2009 7039 7044 [14] J. Nasielski N. Hadei G. Achonduh E. Assen E.A.B. Kantcev C.J. O’Brien A. Lough M.G. Organ Chem. Eur. J. 16 2010 10844 10853 [15] T. Weskamp V.P.W. Böhm W.A. Herrmann J. Organomet. Chem. 585 1999 348 352 [16] W.A. Herrmann V.P.W. Böhm C.W.K. Gstöttmayr M. Grosche C.-P. Reisinger T. Weskamp J. Organomet. Chem. 617–618 2001 616 628 [17] H.V. Huynh Y. Han J.H.H. Ho G.K. Tan Organometallics 25 2006 3267 3274 [18] H. Türkmen B. Çetinkaya J. Organomet. Chem. 691 2006 3749 3759 [19] H. Türkmen T. Pape F.E. Hahn B. Çetinkaya Eur. J. Inorg. Chem. 2009 285 294 [20] C.-Y. Liao K.-T. Chan C.-Y. Tu Y.-W. Chang C.-H. Hu H.M. Lee Chem. Eur. J. 15 2009 405 417 [21] K.-T. Chan Y. Hua W.-S. Lin J.-R. Wu S.-J. Chen F.-X. Liao C.-H. Hu H.M. Lee Organometallics 29 2010 463 472 [22] O. Diebolt V. Jurcik R.C. Costa P. Braunstein L. Cavallo S.P. Nolan A.M.Z. Slavin C.S.J. Cazin Organometallics 29 2010 1443 1450 [23] J.P. Genet M. Savignac J. Organomet. Chem. 576 1999 305 317 [24] I.P. Beletskaya, A.V. Cheprakov, in: E.-I. Negishi (Ed.), Handbook of Organopalladium Chemistry for Organic Synthesis, vol. 2, John Wiley & Sons, New York, 2002, p. 2957. [25] L. Bai J.-X. Wang Curr. Org. Chem. 9 2005 535 553 [26] F. Alanso I.P. Beletskaya M. Yus Tetrahedron 64 2008 3047 3101 [27] J. Zhou X. Guo C. Tu X. Sun J. Organomet. Chem. 694 2009 697 702 [28] R.K. Arvela N.E. Leadbeater Org. Lett. 7 2005 2101 2104 [29] S. Gülcemal I. Kani F. Yilmaz B. Çetinkaya Tetrahedron 66 2010 5602 5606 [30] K.H. Shaughnessy Chem. Rev. 109 2009 643 710 [31] A. Fihri D. Luart C. Len A. Solhy C. Chevrin V. Polshettiwar Dalton Trans. 2011 3116 3121 [32] V. Polshettiwar A. Decottignies C. Len A. Fihri Chemsuschem 3 2010 502 522 [33] K.H. Shaughnessy Eur. J. Org. Chem. 2006 1827 1835 [34] C. Dupuis K. Adiey L. Charruault V. Michelet M. Savignac J.-P. Genet Tetrahedron Lett. 42 2001 6523 6526 [35] K.V. Katti H. Gali C.J. Smith D.E. Berning Acc. Chem. Res. 32 1999 9 17 [36] N. Pinault D.W. Bruce Coord. Chem. Rev. 241 2003 1 25 [37] S. Roy H. Plenio Adv. Synth. Catal. 252 2010 1014 1022 [38] C. Flenkenstein S. Roy S. Leuthausser H. Plenio Chem. Commun. 2007 2870 2872 [39] F. Godoy C. Segarra M. Poyatnos E. Paris Organometallics 30 2011 684 688 [40] L.R. Moore E.C. Western R. Craciun J.M. Spruell D.A. Dixon K.P. O’halloran K.H. Shaughnessy Organometallics 27 2008 576 593 [41] B.M. Bhanage S.S. Divekar R.M. Deshpande R.V. Chaudhari Org. Process Res. Dev. 4 2000 342 345 [42] F.E. Hahn M. Foth J. Organomet. Chem. 585 1999 241 245 [43] H.V. Huynh J.H.H. Ho T.C. Neo L.L. Koh J. Organomet. Chem. 690 2005 3854 3860 [44] S.O. Grim R.L. Keiter Inorg. Chim. Acta 4 1970 56 60 [45] B. Çetinkaya E. Çetinkaya M.F. Lappert Dalton Trans. 1973 906 912 [46] C. Amatore E. Carre A. Jutand M.A. M’Barki Organometallics 14 1995 1818 1826 [47] J. Pytkowicz S. Roland P. Mangeney G. Meyer A. Jutand J. Organomet. Chem. 678 2003 166 179",
      "scopus-id": "80052968865",
      "coredata": {
        "eid": "1-s2.0-S1381116911003268",
        "dc:description": "New palladium(II) complexes (2), bearing NHC/TPPTS ligands, (NHC=benzimidazol-2-ylidene; TPPTS=triphenylphosphine-3,3′,3″-trisulfonic acid trisodium salt) have been prepared and characterized by elemental analyses and spectroscopic methods. Their ability to catalyze the Suzuki–Miyaura reaction in neat water has been studied at 100°C. Very high activities have been observed in the coupling of phenylboronic acid with aryl chlorides in the presence of 1% of the catalyst. We have compared the electronic properties of cis-[PdBr2(NHC)(TPPTS)] with the related complexes, [PdX2(NHC)]2 and [trans-PdBr2(NHC)(pdca)] (pdca=pyridine-2,6-dicarboxyic acid) (3) via three different techniques: cyclic voltammetry, thermogravimetric analysis and 13C NMR spectroscopy.",
        "openArchiveArticle": "false",
        "prism:coverDate": "2011-09-01",
        "openaccessUserLicense": null,
        "prism:aggregationType": "Journal",
        "prism:url": "https://api.elsevier.com/content/article/pii/S1381116911003268",
        "dc:creator": [
          {
            "@_fa": "true",
            "$": "Türkmen, Hayati"
          },
          {
            "@_fa": "true",
            "$": "Pelit, Levent"
          },
          {
            "@_fa": "true",
            "$": "Çetinkaya, Bekir"
          }
        ],
        "link": [
          {
            "@_fa": "true",
            "@rel": "self",
            "@href": "https://api.elsevier.com/content/article/pii/S1381116911003268"
          },
          {
            "@_fa": "true",
            "@rel": "scidir",
            "@href": "https://www.sciencedirect.com/science/article/pii/S1381116911003268"
          }
        ],
        "dc:format": "application/json",
        "openaccessType": null,
        "pii": "S1381-1169(11)00326-8",
        "prism:volume": "348",
        "prism:publisher": "Published by Elsevier B.V.",
        "dc:title": "Water-soluble cis-[(NHC)PdBr2(TPPTS)] catalysts and their applications in Suzuki–Miyaura coupling of aryl chlorides",
        "prism:copyright": "Crown copyright © 2011 Published by Elsevier B.V. All rights reserved.",
        "openaccess": "0",
        "prism:issn": "13811169",
        "prism:issueIdentifier": "1-2",
        "dcterms:subject": [
          {
            "@_fa": "true",
            "$": "Water soluble complexes"
          },
          {
            "@_fa": "true",
            "$": "Cross-coupling"
          },
          {
            "@_fa": "true",
            "$": "Palladium"
          },
          {
            "@_fa": "true",
            "$": "Electronic effects"
          },
          {
            "@_fa": "true",
            "$": "NHC"
          }
        ],
        "openaccessArticle": "false",
        "prism:publicationName": "Journal of Molecular Catalysis A: Chemical",
        "prism:number": "1-2",
        "openaccessSponsorType": null,
        "prism:pageRange": "88-93",
        "prism:endingPage": "93",
        "pubType": "fla",
        "prism:coverDisplayDate": "1 September 2011",
        "prism:doi": "10.1016/j.molcata.2011.08.008",
        "prism:startingPage": "88",
        "dc:identifier": "doi:10.1016/j.molcata.2011.08.008",
        "openaccessSponsorName": null
      },
      "objects": {
        "object": [
          {
            "@category": "standard",
            "@height": "200",
            "@width": "500",
            "@_fa": "true",
            "$": "https://api.elsevier.com/content/object/eid/1-s2.0-S1381116911003268-fx1.jpg?httpAccept=%2A%2F%2A",
            "@multimediatype": "JPEG image file",
            "@type": "IMAGE-DOWNSAMPLED",
            "@size": "13416",
            "@ref": "fx1",
            "@mimetype": "image/jpeg"
          },
          {
            "@category": "thumbnail",
            "@height": "88",
            "@width": "219",
            "@_fa": "true",
            "$": "https://api.elsevier.com/content/object/eid/1-s2.0-S1381116911003268-fx1.sml?httpAccept=%2A%2F%2A",
            "@multimediatype": "GIF image file",
            "@type": "IMAGE-THUMBNAIL",
            "@size": "2987",
            "@ref": "fx1",
            "@mimetype": "image/gif"
          },
          {
            "@category": "high",
            "@height": "886",
            "@width": "2213",
            "@_fa": "true",
            "$": "https://api.elsevier.com/content/object/eid/1-s2.0-S1381116911003268-fx1_lrg.jpg?httpAccept=%2A%2F%2A",
            "@multimediatype": "JPEG image file",
            "@type": "IMAGE-HIGH-RES",
            "@size": "116257",
            "@ref": "fx1",
            "@mimetype": "image/jpeg"
          },
          {
            "@category": "standard",
            "@height": "83",
            "@width": "451",
            "@_fa": "true",
            "$": "https://api.elsevier.com/content/object/eid/1-s2.0-S1381116911003268-fx2.jpg?httpAccept=%2A%2F%2A",
            "@multimediatype": "JPEG image file",
            "@type": "IMAGE-DOWNSAMPLED",
            "@size": "8765",
            "@ref": "fx2",
            "@mimetype": "image/jpeg"
          },
          {
            "@category": "thumbnail",
            "@height": "40",
            "@width": "219",
            "@_fa": "true",
            "$": "https://api.elsevier.com/content/object/eid/1-s2.0-S1381116911003268-fx2.sml?httpAccept=%2A%2F%2A",
            "@multimediatype": "GIF image file",
            "@type": "IMAGE-THUMBNAIL",
            "@size": "2068",
            "@ref": "fx2",
            "@mimetype": "image/gif"
          },
          {
            "@category": "high",
            "@height": "369",
            "@width": "1997",
            "@_fa": "true",
            "$": "https://api.elsevier.com/content/object/eid/1-s2.0-S1381116911003268-fx2_lrg.jpg?httpAccept=%2A%2F%2A",
            "@multimediatype": "JPEG image file",
            "@type": "IMAGE-HIGH-RES",
            "@size": "69806",
            "@ref": "fx2",
            "@mimetype": "image/jpeg"
          },
          {
            "@category": "standard",
            "@height": "54",
            "@width": "477",
            "@_fa": "true",
            "$": "https://api.elsevier.com/content/object/eid/1-s2.0-S1381116911003268-fx3.jpg?httpAccept=%2A%2F%2A",
            "@multimediatype": "JPEG image file",
            "@type": "IMAGE-DOWNSAMPLED",
            "@size": "8198",
            "@ref": "fx3",
            "@mimetype": "image/jpeg"
          },
          {
            "@category": "thumbnail",
            "@height": "25",
            "@width": "219",
            "@_fa": "true",
            "$": "https://api.elsevier.com/content/object/eid/1-s2.0-S1381116911003268-fx3.sml?httpAccept=%2A%2F%2A",
            "@multimediatype": "GIF image file",
            "@type": "IMAGE-THUMBNAIL",
            "@size": "1925",
            "@ref": "fx3",
            "@mimetype": "image/gif"
          },
          {
            "@category": "high",
            "@height": "237",
            "@width": "2113",
            "@_fa": "true",
            "$": "https://api.elsevier.com/content/object/eid/1-s2.0-S1381116911003268-fx3_lrg.jpg?httpAccept=%2A%2F%2A",
            "@multimediatype": "JPEG image file",
            "@type": "IMAGE-HIGH-RES",
            "@size": "61128",
            "@ref": "fx3",
            "@mimetype": "image/jpeg"
          },
          {
            "@category": "standard",
            "@height": "83",
            "@width": "451",
            "@_fa": "true",
            "$": "https://api.elsevier.com/content/object/eid/1-s2.0-S1381116911003268-fx4.jpg?httpAccept=%2A%2F%2A",
            "@multimediatype": "JPEG image file",
            "@type": "IMAGE-DOWNSAMPLED",
            "@size": "8829",
            "@ref": "fx4",
            "@mimetype": "image/jpeg"
          },
          {
            "@category": "thumbnail",
            "@height": "40",
            "@width": "219",
            "@_fa": "true",
            "$": "https://api.elsevier.com/content/object/eid/1-s2.0-S1381116911003268-fx4.sml?httpAccept=%2A%2F%2A",
            "@multimediatype": "GIF image file",
            "@type": "IMAGE-THUMBNAIL",
            "@size": "2071",
            "@ref": "fx4",
            "@mimetype": "image/gif"
          },
          {
            "@category": "high",
            "@height": "369",
            "@width": "1997",
            "@_fa": "true",
            "$": "https://api.elsevier.com/content/object/eid/1-s2.0-S1381116911003268-fx4_lrg.jpg?httpAccept=%2A%2F%2A",
            "@multimediatype": "JPEG image file",
            "@type": "IMAGE-HIGH-RES",
            "@size": "69980",
            "@ref": "fx4",
            "@mimetype": "image/jpeg"
          },
          {
            "@category": "standard",
            "@height": "154",
            "@width": "715",
            "@_fa": "true",
            "$": "https://api.elsevier.com/content/object/eid/1-s2.0-S1381116911003268-gr1.jpg?httpAccept=%2A%2F%2A",
            "@multimediatype": "JPEG image file",
            "@type": "IMAGE-DOWNSAMPLED",
            "@size": "21854",
            "@ref": "gr1",
            "@mimetype": "image/jpeg"
          },
          {
            "@category": "thumbnail",
            "@height": "47",
            "@width": "219",
            "@_fa": "true",
            "$": "https://api.elsevier.com/content/object/eid/1-s2.0-S1381116911003268-gr1.sml?httpAccept=%2A%2F%2A",
            "@multimediatype": "GIF image file",
            "@type": "IMAGE-THUMBNAIL",
            "@size": "1486",
            "@ref": "gr1",
            "@mimetype": "image/gif"
          },
          {
            "@category": "high",
            "@height": "680",
            "@width": "3167",
            "@_fa": "true",
            "$": "https://api.elsevier.com/content/object/eid/1-s2.0-S1381116911003268-gr1_lrg.jpg?httpAccept=%2A%2F%2A",
            "@multimediatype": "JPEG image file",
            "@type": "IMAGE-HIGH-RES",
            "@size": "137582",
            "@ref": "gr1",
            "@mimetype": "image/jpeg"
          },
          {
            "@category": "standard",
            "@height": "437",
            "@width": "809",
            "@_fa": "true",
            "$": "https://api.elsevier.com/content/object/eid/1-s2.0-S1381116911003268-gr2.jpg?httpAccept=%2A%2F%2A",
            "@multimediatype": "JPEG image file",
            "@type": "IMAGE-DOWNSAMPLED",
            "@size": "89147",
            "@ref": "gr2",
            "@mimetype": "image/jpeg"
          },
          {
            "@category": "thumbnail",
            "@height": "118",
            "@width": "219",
            "@_fa": "true",
            "$": "https://api.elsevier.com/content/object/eid/1-s2.0-S1381116911003268-gr2.sml?httpAccept=%2A%2F%2A",
            "@multimediatype": "GIF image file",
            "@type": "IMAGE-THUMBNAIL",
            "@size": "6762",
            "@ref": "gr2",
            "@mimetype": "image/gif"
          },
          {
            "@category": "high",
            "@height": "1936",
            "@width": "3583",
            "@_fa": "true",
            "$": "https://api.elsevier.com/content/object/eid/1-s2.0-S1381116911003268-gr2_lrg.jpg?httpAccept=%2A%2F%2A",
            "@multimediatype": "JPEG image file",
            "@type": "IMAGE-HIGH-RES",
            "@size": "635989",
            "@ref": "gr2",
            "@mimetype": "image/jpeg"
          },
          {
            "@category": "standard",
            "@height": "294",
            "@width": "395",
            "@_fa": "true",
            "$": "https://api.elsevier.com/content/object/eid/1-s2.0-S1381116911003268-gr3.jpg?httpAccept=%2A%2F%2A",
            "@multimediatype": "JPEG image file",
            "@type": "IMAGE-DOWNSAMPLED",
            "@size": "31082",
            "@ref": "gr3",
            "@mimetype": "image/jpeg"
          },
          {
            "@category": "thumbnail",
            "@height": "163",
            "@width": "219",
            "@_fa": "true",
            "$": "https://api.elsevier.com/content/object/eid/1-s2.0-S1381116911003268-gr3.sml?httpAccept=%2A%2F%2A",
            "@multimediatype": "GIF image file",
            "@type": "IMAGE-THUMBNAIL",
            "@size": "4712",
            "@ref": "gr3",
            "@mimetype": "image/gif"
          },
          {
            "@category": "high",
            "@height": "1303",
            "@width": "1748",
            "@_fa": "true",
            "$": "https://api.elsevier.com/content/object/eid/1-s2.0-S1381116911003268-gr3_lrg.jpg?httpAccept=%2A%2F%2A",
            "@multimediatype": "JPEG image file",
            "@type": "IMAGE-HIGH-RES",
            "@size": "205062",
            "@ref": "gr3",
            "@mimetype": "image/jpeg"
          },
          {
            "@category": "standard",
            "@height": "278",
            "@width": "579",
            "@_fa": "true",
            "$": "https://api.elsevier.com/content/object/eid/1-s2.0-S1381116911003268-sc1.jpg?httpAccept=%2A%2F%2A",
            "@multimediatype": "JPEG image file",
            "@type": "IMAGE-DOWNSAMPLED",
            "@size": "23145",
            "@ref": "sc1",
            "@mimetype": "image/jpeg"
          },
          {
            "@category": "thumbnail",
            "@height": "105",
            "@width": "219",
            "@_fa": "true",
            "$": "https://api.elsevier.com/content/object/eid/1-s2.0-S1381116911003268-sc1.sml?httpAccept=%2A%2F%2A",
            "@multimediatype": "GIF image file",
            "@type": "IMAGE-THUMBNAIL",
            "@size": "3281",
            "@ref": "sc1",
            "@mimetype": "image/gif"
          },
          {
            "@category": "high",
            "@height": "1229",
            "@width": "2563",
            "@_fa": "true",
            "$": "https://api.elsevier.com/content/object/eid/1-s2.0-S1381116911003268-sc1_lrg.jpg?httpAccept=%2A%2F%2A",
            "@multimediatype": "JPEG image file",
            "@type": "IMAGE-HIGH-RES",
            "@size": "198662",
            "@ref": "sc1",
            "@mimetype": "image/jpeg"
          }
        ]
      },
      "link": {
        "@rel": "abstract",
        "@href": "https://api.elsevier.com/content/abstract/scopus_id/80052968865"
      }
    }
  }
}