{
  "metadata": {
    "title": "Rh(0) nanoparticles as catalyst precursors for the solventless hydroformylation of olefins",
    "authors": "; ; ",
    "journal": "Journal of Molecular Catalysis A: Chemical",
    "date": "2006-06-01",
    "doi": "10.1016/j.molcata.2006.02.063",
    "abstract": "",
    "uri": "https://api.elsevier.com/content/article/pii/S1381116906006017",
    "pii": "S1381116906006017"
  },
  "fulltext": {
    "full-text-retrieval-response": {
      "scopus-eid": "2-s2.0-33646144436",
      "originalText": "serial JL 271358 291210 291744 291790 291809 31 Journal of Molecular Catalysis A: Chemical JOURNALMOLECULARCATALYSISACHEMICAL 2006-04-03 2006-04-03 2015-10-23T13:17:20 1-s2.0-S1381116906006017 S1381-1169(06)00601-7 S1381116906006017 10.1016/j.molcata.2006.02.063 S300 S300.2 FULL-TEXT 1-s2.0-S1381116906X02339 2020-11-22T11:57:37.104227Z 0 0 20060601 2006 2006-04-03T00:00:00Z absattachment articleinfo articletitlenorm authfirstinitialnorm authfirstsurnamenorm cid cids contenttype copyright crossmark dateloaded dateloadedtxt datesearch datesort dateupdated dco docsubtype doctype doi eid ewtransactionid hubeid indexeddate issfirst issn issnnorm issuelist itemstage itemtransactionid itemweight openaccess openarchive pg pgfirst pglast pii piinorm pubdatestart pubdatetxt pubyr sortorder srctitle srctitlenorm srctype ssids alllist content subj subheadings tomb volfirst volissue volumelist webpdf webpdfpagecount yearnav figure table body acknowledge affil articletitle auth authfirstini authfull authkeywords authlast primabst ref specialabst 1381-1169 13811169 false 252 252 1 2 1 2 Volume 252, Issues 1–2 35 212 218 212 218 20060601 1 June 2006 2006-06-01 2006 article fla Copyright © 2006 Elsevier B.V. All rights reserved. RH0NANOPARTICLESCATALYSTPRECURSORSFORSOLVENTLESSHYDROFORMYLATIONOLEFINS BRUSS A 1 Introduction 2 Results and discussion 3 Conclusions 4 Experimental 4.1 General 4.2 XRD analysis of the isolated nanoparticles 4.3 TEM analysis 4.4 Nanoparticle formation and isolation 4.5 Catalytic experiments Acknowledgements References 1999 CATALYSISINTEGRATEDAPPROACHSECONDREVISEDENLARGEDEDITIONINSTUDSURFSCICATAL1999123 VALDEN 1998 1647 M LEWIS 1993 2693 L KRALIK 2001 113 M AIKEN 1999 1 J ROUCOUX 2002 3757 A BONNEMANN 2001 2455 H BELL 2003 1688 A JANSAT 2004 1592 S FONSECA 2005 847 G FONSECA 2003 3263 G SILVEIRA 2004 3734 E CASSOL 2005 3298 C KAMER 2004 2409 P VANLEEUWEN 2004 141 P BOHNEN 2002 1 H BROWN 1991 677 D HORVATH 1988 C17 I CERIOTTI 1984 309 A HARLEY 1983 53 A LI 2004 4131 C LI 2003 5540 C LIU 2000 124 G GARLAND 1993 535 M FYHR 1993 1753 C KRANENBURG 1995 3081 M SUAREZ 1996 1217 P DUPONT 2002 4228 J FONSECA 2003 3263 G YATES 1979 1219 J GELESKY 2005 4588 M UMPIERRE 2005 1404 A DUPONT 2004 341 J SWEENY 2001 712 B GALLO 2002 4339 V BRUSSX2006X212 BRUSSX2006X212X218 BRUSSX2006X212XA BRUSSX2006X212X218XA 2020-11-19T10:35:18.379Z http://vtw.elsevier.com/data/voc/AddOnTypes/50.7/nlp S1381116906006017 CNPq CNPq Conselho Nacional de Desenvolvimento Científico e Tecnológico http://data.elsevier.com/vocabulary/SciValFunders/501100003593 http://sws.geonames.org/3469034/ CAPES CAPES Coordenação de Aperfeiçoamento de Pessoal de Nível Superior http://data.elsevier.com/vocabulary/SciValFunders/501100002322 http://sws.geonames.org/3469034/ CT-PETRO Thanks are due to the following Brazilian agencies: CNPq, CAPES and CT-PETRO for partial financial support. item S1381-1169(06)00601-7 S1381116906006017 1-s2.0-S1381116906006017 10.1016/j.molcata.2006.02.063 271358 2015-10-23T11:57:56.662667-04:00 2006-06-01 1-s2.0-S1381116906006017-main.pdf https://s3.amazonaws.com/prod-ucs-content-store-us-east/content/pii:S1381116906006017/MAIN/application/pdf/feed1d86b0539ce7d552df4eaac2190f/main.pdf https://s3-eu-west-1.amazonaws.com/prod-ucs-content-store-eu-west/content/pii:S1381116906006017/MAIN/application/pdf/feed1d86b0539ce7d552df4eaac2190f/main.pdf main.pdf pdf true 420202 MAIN 7 1-s2.0-S1381116906006017-main_1.png https://s3.amazonaws.com/prod-ucs-content-store-us-east/content/pii:S1381116906006017/PREVIEW/image/png/cb8ba44f1e7e2f84e06e8840ee035182/main_1.png https://s3-eu-west-1.amazonaws.com/prod-ucs-content-store-eu-west/content/pii:S1381116906006017/PREVIEW/image/png/cb8ba44f1e7e2f84e06e8840ee035182/main_1.png main_1.png png 70612 849 656 IMAGE-WEB-PDF 1 1-s2.0-S1381116906006017-gr7_lrg.jpg https://s3-eu-west-1.amazonaws.com/prod-ucs-content-store-eu-west/content/pii:S1381116906006017/gr7/HIGHRES/image/jpeg/45e4819cf460ece1e4addfcefa79713c/gr7_lrg.jpg https://s3.amazonaws.com/prod-ucs-content-store-us-east/content/pii:S1381116906006017/gr7/HIGHRES/image/jpeg/45e4819cf460ece1e4addfcefa79713c/gr7_lrg.jpg gr7 gr7_lrg.jpg jpg 262146 970 900 IMAGE-HIGH-RES 1-s2.0-S1381116906006017-gr5_lrg.jpg https://s3.amazonaws.com/prod-ucs-content-store-us-east/content/pii:S1381116906006017/gr5/HIGHRES/image/jpeg/ee7bba769af4c2ae1054353c92d2d12b/gr5_lrg.jpg https://s3-eu-west-1.amazonaws.com/prod-ucs-content-store-eu-west/content/pii:S1381116906006017/gr5/HIGHRES/image/jpeg/ee7bba769af4c2ae1054353c92d2d12b/gr5_lrg.jpg gr5 gr5_lrg.jpg jpg 150366 1482 1690 IMAGE-HIGH-RES 1-s2.0-S1381116906006017-gr4_lrg.jpg https://s3-eu-west-1.amazonaws.com/prod-ucs-content-store-eu-west/content/pii:S1381116906006017/gr4/HIGHRES/image/jpeg/8b44244e172113fc5cd3dceb6375520a/gr4_lrg.jpg https://s3.amazonaws.com/prod-ucs-content-store-us-east/content/pii:S1381116906006017/gr4/HIGHRES/image/jpeg/8b44244e172113fc5cd3dceb6375520a/gr4_lrg.jpg gr4 gr4_lrg.jpg jpg 174153 1275 1682 IMAGE-HIGH-RES 1-s2.0-S1381116906006017-gr3_lrg.jpg https://s3.amazonaws.com/prod-ucs-content-store-us-east/content/pii:S1381116906006017/gr3/HIGHRES/image/jpeg/e5dcb8985bc39c1af20be42a5c5a86df/gr3_lrg.jpg https://s3-eu-west-1.amazonaws.com/prod-ucs-content-store-eu-west/content/pii:S1381116906006017/gr3/HIGHRES/image/jpeg/e5dcb8985bc39c1af20be42a5c5a86df/gr3_lrg.jpg gr3 gr3_lrg.jpg jpg 142248 1281 1680 IMAGE-HIGH-RES 1-s2.0-S1381116906006017-gr2_lrg.jpg https://s3.amazonaws.com/prod-ucs-content-store-us-east/content/pii:S1381116906006017/gr2/HIGHRES/image/jpeg/56410af5b155322684f04ee350590300/gr2_lrg.jpg https://s3-eu-west-1.amazonaws.com/prod-ucs-content-store-eu-west/content/pii:S1381116906006017/gr2/HIGHRES/image/jpeg/56410af5b155322684f04ee350590300/gr2_lrg.jpg gr2 gr2_lrg.jpg jpg 906887 2469 2632 IMAGE-HIGH-RES 1-s2.0-S1381116906006017-gr1_lrg.jpg https://s3.amazonaws.com/prod-ucs-content-store-us-east/content/pii:S1381116906006017/gr1/HIGHRES/image/jpeg/984b1820c3a94ea0844bc975bc1037cd/gr1_lrg.jpg https://s3-eu-west-1.amazonaws.com/prod-ucs-content-store-eu-west/content/pii:S1381116906006017/gr1/HIGHRES/image/jpeg/984b1820c3a94ea0844bc975bc1037cd/gr1_lrg.jpg gr1 gr1_lrg.jpg jpg 213285 1031 2767 IMAGE-HIGH-RES 1-s2.0-S1381116906006017-sc1_lrg.gif https://s3-eu-west-1.amazonaws.com/prod-ucs-content-store-eu-west/content/pii:S1381116906006017/sc1/HIGHRES/image/gif/21969b460dcfaf8734e85e4071c8c0f0/sc1_lrg.gif https://s3.amazonaws.com/prod-ucs-content-store-us-east/content/pii:S1381116906006017/sc1/HIGHRES/image/gif/21969b460dcfaf8734e85e4071c8c0f0/sc1_lrg.gif sc1 sc1_lrg.gif gif 19955 478 5146 IMAGE-HIGH-RES 1-s2.0-S1381116906006017-gr6_lrg.gif https://s3.amazonaws.com/prod-ucs-content-store-us-east/content/pii:S1381116906006017/gr6/HIGHRES/image/gif/fc57d942d859672e6635ac81064433a5/gr6_lrg.gif https://s3-eu-west-1.amazonaws.com/prod-ucs-content-store-eu-west/content/pii:S1381116906006017/gr6/HIGHRES/image/gif/fc57d942d859672e6635ac81064433a5/gr6_lrg.gif gr6 gr6_lrg.gif gif 118513 1964 5411 IMAGE-HIGH-RES 1-s2.0-S1381116906006017-fx1_lrg.gif https://s3-eu-west-1.amazonaws.com/prod-ucs-content-store-eu-west/content/pii:S1381116906006017/fx1/HIGHRES/image/gif/d93766dbece544aeca6b310bb77a99db/fx1_lrg.gif https://s3.amazonaws.com/prod-ucs-content-store-us-east/content/pii:S1381116906006017/fx1/HIGHRES/image/gif/d93766dbece544aeca6b310bb77a99db/fx1_lrg.gif fx1 true fx1_lrg.gif gif 16745 474 3334 IMAGE-HIGH-RES 1-s2.0-S1381116906006017-gr7.jpg https://s3.amazonaws.com/prod-ucs-content-store-us-east/content/pii:S1381116906006017/gr7/DOWNSAMPLED/image/jpeg/bbe6bf1b0b049ee9aa6a3b3dece5ebb9/gr7.jpg https://s3-eu-west-1.amazonaws.com/prod-ucs-content-store-eu-west/content/pii:S1381116906006017/gr7/DOWNSAMPLED/image/jpeg/bbe6bf1b0b049ee9aa6a3b3dece5ebb9/gr7.jpg gr7 gr7.jpg jpg 71836 365 339 IMAGE-DOWNSAMPLED 1-s2.0-S1381116906006017-gr5.jpg https://s3.amazonaws.com/prod-ucs-content-store-us-east/content/pii:S1381116906006017/gr5/DOWNSAMPLED/image/jpeg/2dc628269f2649e02c72fda880972a82/gr5.jpg https://s3-eu-west-1.amazonaws.com/prod-ucs-content-store-eu-west/content/pii:S1381116906006017/gr5/DOWNSAMPLED/image/jpeg/2dc628269f2649e02c72fda880972a82/gr5.jpg gr5 gr5.jpg jpg 33092 334 381 IMAGE-DOWNSAMPLED 1-s2.0-S1381116906006017-gr4.jpg https://s3-eu-west-1.amazonaws.com/prod-ucs-content-store-eu-west/content/pii:S1381116906006017/gr4/DOWNSAMPLED/image/jpeg/4ec175b1e6f1525fb1f677971a6dda3a/gr4.jpg https://s3.amazonaws.com/prod-ucs-content-store-us-east/content/pii:S1381116906006017/gr4/DOWNSAMPLED/image/jpeg/4ec175b1e6f1525fb1f677971a6dda3a/gr4.jpg gr4 gr4.jpg jpg 40835 288 380 IMAGE-DOWNSAMPLED 1-s2.0-S1381116906006017-gr3.jpg https://s3-eu-west-1.amazonaws.com/prod-ucs-content-store-eu-west/content/pii:S1381116906006017/gr3/DOWNSAMPLED/image/jpeg/cea5e7f3808c607d0199c72d60fbf185/gr3.jpg https://s3.amazonaws.com/prod-ucs-content-store-us-east/content/pii:S1381116906006017/gr3/DOWNSAMPLED/image/jpeg/cea5e7f3808c607d0199c72d60fbf185/gr3.jpg gr3 gr3.jpg jpg 35521 289 379 IMAGE-DOWNSAMPLED 1-s2.0-S1381116906006017-gr2.jpg https://s3.amazonaws.com/prod-ucs-content-store-us-east/content/pii:S1381116906006017/gr2/DOWNSAMPLED/image/jpeg/33f10cb39fcb76cee775a7436808119b/gr2.jpg https://s3-eu-west-1.amazonaws.com/prod-ucs-content-store-eu-west/content/pii:S1381116906006017/gr2/DOWNSAMPLED/image/jpeg/33f10cb39fcb76cee775a7436808119b/gr2.jpg gr2 gr2.jpg jpg 101113 557 594 IMAGE-DOWNSAMPLED 1-s2.0-S1381116906006017-gr1.jpg https://s3-eu-west-1.amazonaws.com/prod-ucs-content-store-eu-west/content/pii:S1381116906006017/gr1/DOWNSAMPLED/image/jpeg/1c8851051114011e79e3d7477654b394/gr1.jpg https://s3.amazonaws.com/prod-ucs-content-store-us-east/content/pii:S1381116906006017/gr1/DOWNSAMPLED/image/jpeg/1c8851051114011e79e3d7477654b394/gr1.jpg gr1 gr1.jpg jpg 39565 233 625 IMAGE-DOWNSAMPLED 1-s2.0-S1381116906006017-sc1.gif https://s3.amazonaws.com/prod-ucs-content-store-us-east/content/pii:S1381116906006017/sc1/DOWNSAMPLED/image/gif/1aff1a9eb1cdbadee2da5e667719670f/sc1.gif https://s3-eu-west-1.amazonaws.com/prod-ucs-content-store-eu-west/content/pii:S1381116906006017/sc1/DOWNSAMPLED/image/gif/1aff1a9eb1cdbadee2da5e667719670f/sc1.gif sc1 sc1.gif gif 4665 54 581 IMAGE-DOWNSAMPLED 1-s2.0-S1381116906006017-gr6.gif https://s3-eu-west-1.amazonaws.com/prod-ucs-content-store-eu-west/content/pii:S1381116906006017/gr6/DOWNSAMPLED/image/gif/40a330078f0ca523ae66c5658cf38eff/gr6.gif https://s3.amazonaws.com/prod-ucs-content-store-us-east/content/pii:S1381116906006017/gr6/DOWNSAMPLED/image/gif/40a330078f0ca523ae66c5658cf38eff/gr6.gif gr6 gr6.gif gif 23063 222 611 IMAGE-DOWNSAMPLED 1-s2.0-S1381116906006017-fx1.gif https://s3-eu-west-1.amazonaws.com/prod-ucs-content-store-eu-west/content/pii:S1381116906006017/fx1/DOWNSAMPLED/image/gif/408ae930bb3afaaef9fa36980ac34b56/fx1.gif https://s3.amazonaws.com/prod-ucs-content-store-us-east/content/pii:S1381116906006017/fx1/DOWNSAMPLED/image/gif/408ae930bb3afaaef9fa36980ac34b56/fx1.gif fx1 true fx1.gif gif 4110 53 376 IMAGE-DOWNSAMPLED 1-s2.0-S1381116906006017-sc1.sml https://s3.amazonaws.com/prod-ucs-content-store-us-east/content/pii:S1381116906006017/sc1/THUMBNAIL/image/gif/ab43700518b93435942d9fac3a9ac4b3/sc1.sml https://s3-eu-west-1.amazonaws.com/prod-ucs-content-store-eu-west/content/pii:S1381116906006017/sc1/THUMBNAIL/image/gif/ab43700518b93435942d9fac3a9ac4b3/sc1.sml sc1 sc1.sml sml 1737 20 219 IMAGE-THUMBNAIL 1-s2.0-S1381116906006017-gr6.sml https://s3.amazonaws.com/prod-ucs-content-store-us-east/content/pii:S1381116906006017/gr6/THUMBNAIL/image/gif/23d756e0d5dac770f4c92255c351af2f/gr6.sml https://s3-eu-west-1.amazonaws.com/prod-ucs-content-store-eu-west/content/pii:S1381116906006017/gr6/THUMBNAIL/image/gif/23d756e0d5dac770f4c92255c351af2f/gr6.sml gr6 gr6.sml sml 5440 79 219 IMAGE-THUMBNAIL 1-s2.0-S1381116906006017-fx1.sml https://s3-eu-west-1.amazonaws.com/prod-ucs-content-store-eu-west/content/pii:S1381116906006017/fx1/THUMBNAIL/image/gif/0e26b68fb6446c10ec69542cc387826e/fx1.sml https://s3.amazonaws.com/prod-ucs-content-store-us-east/content/pii:S1381116906006017/fx1/THUMBNAIL/image/gif/0e26b68fb6446c10ec69542cc387826e/fx1.sml fx1 true fx1.sml sml 2334 31 219 IMAGE-THUMBNAIL 1-s2.0-S1381116906006017-gr7.sml https://s3.amazonaws.com/prod-ucs-content-store-us-east/content/pii:S1381116906006017/gr7/THUMBNAIL/image/gif/66a6f38ab4b800c379b47b008df61e0f/gr7.sml https://s3-eu-west-1.amazonaws.com/prod-ucs-content-store-eu-west/content/pii:S1381116906006017/gr7/THUMBNAIL/image/gif/66a6f38ab4b800c379b47b008df61e0f/gr7.sml gr7 gr7.sml sml 28118 164 152 IMAGE-THUMBNAIL 1-s2.0-S1381116906006017-gr5.sml https://s3-eu-west-1.amazonaws.com/prod-ucs-content-store-eu-west/content/pii:S1381116906006017/gr5/THUMBNAIL/image/gif/f56c0c63ed463cf4a315abc767de1d9a/gr5.sml https://s3.amazonaws.com/prod-ucs-content-store-us-east/content/pii:S1381116906006017/gr5/THUMBNAIL/image/gif/f56c0c63ed463cf4a315abc767de1d9a/gr5.sml gr5 gr5.sml sml 3728 164 187 IMAGE-THUMBNAIL 1-s2.0-S1381116906006017-gr4.sml https://s3-eu-west-1.amazonaws.com/prod-ucs-content-store-eu-west/content/pii:S1381116906006017/gr4/THUMBNAIL/image/gif/be302c24ab0e95b517b3bb36c12b5e52/gr4.sml https://s3.amazonaws.com/prod-ucs-content-store-us-east/content/pii:S1381116906006017/gr4/THUMBNAIL/image/gif/be302c24ab0e95b517b3bb36c12b5e52/gr4.sml gr4 gr4.sml sml 5483 164 216 IMAGE-THUMBNAIL 1-s2.0-S1381116906006017-gr3.sml https://s3-eu-west-1.amazonaws.com/prod-ucs-content-store-eu-west/content/pii:S1381116906006017/gr3/THUMBNAIL/image/gif/170394debd93eec5a793b0377489ca36/gr3.sml https://s3.amazonaws.com/prod-ucs-content-store-us-east/content/pii:S1381116906006017/gr3/THUMBNAIL/image/gif/170394debd93eec5a793b0377489ca36/gr3.sml gr3 gr3.sml sml 4609 164 215 IMAGE-THUMBNAIL 1-s2.0-S1381116906006017-gr2.sml https://s3.amazonaws.com/prod-ucs-content-store-us-east/content/pii:S1381116906006017/gr2/THUMBNAIL/image/gif/fc3345c522d587a820ae1e1f73516c53/gr2.sml https://s3-eu-west-1.amazonaws.com/prod-ucs-content-store-eu-west/content/pii:S1381116906006017/gr2/THUMBNAIL/image/gif/fc3345c522d587a820ae1e1f73516c53/gr2.sml gr2 gr2.sml sml 21657 164 175 IMAGE-THUMBNAIL 1-s2.0-S1381116906006017-gr1.sml https://s3-eu-west-1.amazonaws.com/prod-ucs-content-store-eu-west/content/pii:S1381116906006017/gr1/THUMBNAIL/image/gif/4c5cd5dd283e5aebe815b0cc8e06e7ae/gr1.sml https://s3.amazonaws.com/prod-ucs-content-store-us-east/content/pii:S1381116906006017/gr1/THUMBNAIL/image/gif/4c5cd5dd283e5aebe815b0cc8e06e7ae/gr1.sml gr1 gr1.sml sml 3842 82 219 IMAGE-THUMBNAIL MOLCAA 5838 S1381-1169(06)00601-7 10.1016/j.molcata.2006.02.063 Elsevier B.V. Fig. 1 X-ray diffraction pattern of the isolated Rh(0) nanoparticles dispersed in BMI·BF4 before (left) and after (right) the hydroformylation reaction. Fig. 2 Parts of the transmission electron micrograph and histograms illustrating the particle size distribution of the Rh(0) nanoparticles dispersed in BMI·BF4 before (left) and after the hydroformylation reaction (right). Fig. 3 Hydroformylation of 1-hexene (▴), 1-octene (■) and 1-decene (●) (10mmol) by Rh(0) nanoparticles (5mg) at 100°C and 50atm of CO/H2 (1/1). Fig. 4 Hydroformylation of 1-hexene by Rh(0) nanoparticles and Rh/C. (■) Rh(0) (5.0nm) first run; (●) Rh(0) recovered; (▴) organic phase recovered; (▾) Rh(0)/Xantphos; (♦) Rh/C. Fig. 5 Part of the IR spectra of the Rh(0) nanoparticles (CaF2 pellets) under 1bar of CO (20h). Fig. 6 Rietveld's refinament of X-ray diffraction patterns of the Rh(0) nanoparticles before (left) and after (right) the hydroformylation reaction. Fig. 7 High resolution transmission electron micrograph (HRTEM) of the Rh(0) nanoparticles dispersed in BMI·BF4 before the hydroformylation reaction. Scheme 1 Table 1 Hydroformylation of olefins by Rh(0) nanoparticles a Entry Catalyst Olefin t (h) b cv. (%) c l/b d Is. e (%) It. f (h) 1 Rh(0) 1-Decene 18 100 1.5 <1 2.5 2 Rh(0) 1-Octene 13 100 1.7 <1 <1 3 Rh(0) 1-Hexene 41 100 1.8 <1 2.0 4 Rh from 3 1-Hexene 6 100 1.8 <1 <1 5 Rh from 4 1-Hexene 19 100 1.5 <1 <1 6 Rh from 5 1-Hexene 19 100 1.3 <1 1.0 7 Rh from 6 1-Hexene 21 100 1.5 <1 <1 8 Rh from 7 1-Hexene 19 98 1.4 <1 <1 9 Org. phase from 3 1-Hexene 16 100 1.8 <1 <1 10 Rh(0)/Xantphos g 1-Hexene 30 100 25 <1 4.0 11 Org. phase from 10 1-Hexene 18 97 2.0 <1 <1 a Reaction conditions: Rh(0) (5mg); olefin (10mmol); CO/H2 (1/1, 50bar); and T =100°C. b Time for the CO/H2 consumption without the induction time. c Olefin conversion. d Ratio linear/branched aldehydes. e Percentage of internal olefins. f Induction time required for the beginning of CO/H2 consumption. g Xantphos (10mg, 0.017mmol). Table 2 Hydroformylation of olefins by Rh(0) nanoparticles with different sizes and Rh/C a Entry Catalyst Olefin t (h) b cv. (%) c l/b d Is. e (%) It. f (h) 1 Rh(0) (5.0nm) 1-Decene 18 100 1.5 <1 2.5 2 Rh(0) (5.0nm) 1-Hexene 41 100 1.8 <1 2.0 3 Rh(0) (2.7nm) 1-Hexene 23 93 1.9 17 3.0 4 Rh(0) (2.7nm) 1-Decene 40 92 0.5 11 2.0 5 Rh(0) (15nm) 1-Decene 22 4 1.1 2 4.0 6 Rh(0) (15nm) 1-Decene 46 72 2.0 54 3.5 7 Rh/C (5%) 1-Hexene 20 21 1.5 16 2.0 a Reaction conditions: Rh(0) (5mg); olefin (10mmol); CO/H2 (1/1, 50bar); and T =100°C. b Time for the CO/H2 consumption without the induction time. c Olefin conversion. d Ratio linear/branched aldehydes. e Percentage of internal olefins. f Induction time required for the beginning of CO/H2 consumption. Rh(0) nanoparticles as catalyst precursors for the solventless hydroformylation of olefins Arnoldo J. Bruss a b Marcos A. Gelesky a Giovanna Machado a Jairton Dupont a ⁎ a Laboratory of Molecular Catalysis, Institute of Chemistry, UFRGS, Av. Bento Gonçalves 9500, Porto Alegre 91501-970, RS, Brazil b Universidad de Carabobo, Facultad de Ingeniería, Centro de Investigaciones Químicas, Valencia, Edo Carabobo, Venezuela ⁎ Corresponding author. Tel.: +55 51 33166321; fax: +55 51 33167304. Graphical abstract The hydroformylation of 1-alkenes can be performed in solventless conditions using ligand-modified or unmodified Rh(0) nanoparticles prepared in imidazolium ionic liquids as catalyst precursors. There is a strong influence of the nanoparticle size on the hydroformylation reaction. Aldehydes are generated when 5.0nm Rh(0) nanoparticles are used in the hydroformylation of 1-alkenes and l/b selectivities up to 25 can be achieved by addition of Xantphos (9,9-dimethyl-4,5-bis(diphenylphosphino)xanthene). Although small nanoparticles also generate catalytically active species the chemoselectivity decreases (around 11–17% of olefin isomerization) compared to those performed with the 5.0nm nanoparticles. In contrast, the large sized nanoparticles (15nm) produce only small amounts of aldehydes similar to that observed with a classical heterogeneous Rh/C catalyst precursor. TEM, XRD, IR and NMR experiments indicated that these Rh(0) nanoparticles are probably degraded under the reaction conditions into soluble mononuclear Rh-carbonyl catalytically active species. Keywords Nanoparticles Rhodium Hydroformylation Metal-carbonyl Surface 1 Introduction The high surface area-to-volume ratio of solid-supported metal nanoparticles is mainly responsible for their catalytic properties and this can be exploited in many industrially important reactions [1]. Recently, it was found that soluble or non-supported nanoscale materials can in some cases give rise to novel and unique catalytic behaviour [2]. This has been possible, to a large extent, due to the significant recent advances in controlling synthetic pathways to metal nanoparticle. This has rendered possible a better fundamental understanding of the catalytic properties of metal nanoparticles by studying soluble or non-supported transition-metal nanoparticles as “model” materials [3–7]. In this respect, it is expected that transition-metal nanoparticles of 1–10nm in size will exhibit physical–chemical properties intermediate between those of the smallest element from which they can be composed and those of the bulk material [8]. Indeed, in many cases this new generation of nanoparticles gives rise to unique catalytic activities/selectivities and their metal-surface properties can be modulated by the addition of ligands, for example Ref. [9]. However, in other cases these nanomaterials behave like classical heterogeneous catalysts [10–12] and in some other cases these soluble materials are degraded, under the reaction conditions, generating monometallic homogenous catalytically active species [13]. The hydroformylation of olefins is catalyzed by a plethora of monometallic complexes modified or not by several different types of ligands [14–16]. Molecular clusters have also been investigated but under the hydroformylation conditions these multinuclear compounds degraded into at least bimetallic species, which promote the reaction [17–23]. For example, multinuclear compounds such as [Rh4(CO)12] and [Rh6(CO)16] are transformed into [RhH(CO)3], which is responsible for the catalytic activity [24,25]. Therefore, the hydroformylation of olefins can constitute a chemical reaction probe for investigating the properties of transition-metal nanoparticles, i.e., if they possess typical molecular metal cluster or surface-like catalytic properties. We wish to disclose herein our results concerning the catalytic properties of Rh(0) nanoparticles in the solventless hydroformylation of olefins in the presence and absence of Xantphos (9,9-dimethyl-4,5-bis(diphenylphosphino)xanthene) [26]. 2 Results and discussion The Rh(0) nanoparticles were prepared by simple hydrogen reduction of RhCl3·nH2O dissolved in 1-n-butyl-3-methylimidazolium tetrafluoroborate (BMI·BF4) ionic liquid [27] using a similar experimental protocol recently developed for the preparation of various stable transition-metal nanoparticles [28]. The Rh(0) nanoparticles were isolated by centrifugation, washed with methanol, dried under reduced pressure and analyzed by X-ray powder (XRD) diffraction and transmission electron microscopy (TEM). The XRD pattern (Fig. 1 ) confirmed the crystalline Rh(0) and it was adjusted by indexation of five Bragg reflections corresponding to the Rh(0) (111), (200), (220), (311) and (222) as face-centered cubic (fcc) with lattice parameter a =3.8028. A mean diameter of 4.6nm could be estimated from the XRD diffraction pattern by means of the Debye-Scherrer equation (using the parameters obtained with Rietveld's refinements) which corresponds well with the average diameter of 5.0±1.0nm determined from TEM images (see below). The size and morphology of the Rh(0) nanoparticles in the ionic liquid were also investigated in situ by TEM analysis. The nanoparticle-size distribution was estimated from the measurement of about 600 particle diameters, assuming a spherical shape, found in an arbitrary chosen area in enlarged microphotographs (Fig. 2 ). These particles display a monomodal size distribution with an average diameter of 5.0±1.0nm. The isolated Rh(0) nanoparticles were mixed with 1-hexene, 1-octene or 1-decene in an autoclave and a CO/H2 mixture (50bar, 1:1) was admitted to the system at 100°C and 660rpm stirring rate. Note that these reactions are performed in a typical “solventless” condition where the substrates and products are per-definition the solvent(s) of the catalytic process. The fall in the syngas pressure in the autoclave was monitored with a pressure transducer interfaced with a PC. The olefin consumption and the formation of the products were also followed by GC and GC–MS. At the end of the reaction the nanoparticles were easily separated as a black powder by a simple decantation procedure. The conversion of the olefins during the hydroformylation reaction is presented in Fig. 3 . The results obtained under different conditions are summarized in Table 1 . In all experiments, induction periods of 1–4h (not shown in Fig. 3) were observed indicating the transformation of the nanoparticles into catalytically active species. Aldehydes were the major products observed in all reactions without any trace of hydrogenation products (Scheme 1 ), except in the reactions performed with large Rh nanoparticles or Rh/C (entries 5–7, Table 2 ). This is quite surprising since Rh(0) nanoparticles are highly active catalysts for the hydrogenation of olefins [29]. The mean diameter of 4.8nm estimated from the XRD diffraction pattern by means of the Debye-Scherrer equation of the isolated metal particles from the ionic liquid after the hydroformylation indicated no modification on their size. However, the recovered nanoparticles analyzed by TEM (Fig. 2) showed a significant narrowing of overall particle size with a slight increase of particle size, in particular those with 5–6nm (see histograms in Fig. 2). Indeed, a mean diameter of 5.4±1.0nm was estimated from the measurement of about 600 particle diameters, assuming a spherical shape, found in an arbitrary chosen area in enlarged microphotographs of the Rh(0) in the ionic liquid after the hydroformylation of 1-hexene. This process is typical of an Ostwald ripening-type mechanism, i.e., the growth of larger nanoparticles from those of smaller size which have a higher solubility than the larger ones. Moreover, this process may explain the presence of monometallic rhodium species in solution during the hydroformylation reaction (see below). The recovered nanoparticles could be re-used five times without significant changes in their catalytic activities (see entries 4–8, Table 1). The l/b ratio (1.1–1.8) obtained with the nanoparticles is the same as the one usually obtained with unmodified rhodium complexes under homogeneous or biphasic conditions [15]. Note that the 1-hexene hydroformylation is slower in the first run (Table 1, entry 3) than the recharges using the recovery Rh(0) nanoparticles (Table 1, entries 4–6). This is probably due to the presence of more exposed surface atoms after the first hydroformylation run. However, the mixture of solid Xantphos and Rh(0) nanoparticles also gives rise to only aldehyde products but a l/b (linear/branched) ratio of 25 (entry 10, Table 1) typical of Rh-Xantphos molecular catalysts.[26] This suggests the possible formation of modified Xantphos nanoparticle species and/or the degradation of the nanoparticles with the formation of molecular Rh-Xantphos complexes that are in fact the catalytically active species. In other to verify these hypotheses the recovered organic phase of the unmodified Rh nanoparticles was used as a catalyst precursor for the hydroformylation of 1-hexene (entry 9, Table 1) and hydroformylation occurred with a 1.8 l/b selectivity. Even though the catalytic activity of this organic phase was modest compared to that observed with the recovered nanoparticles (entry 4, Table 1) this is an indication of the presence of soluble Rh species (Fig. 4 ). The appearance, in the IR spectra, in an organic solution, of a weak stretching band at 1814cm−1 (besides the CO stretching band of the aldehydes at 1780 and 1790cm−1) is an indication of the presence of a carbonyl ligand attached to a Rh cluster nucleus. Rh ionic species was not observed by ESI-MS in both positive and negative modes of the organic phase. We have also checked the organic phase of the reaction performed in the presence of Xantphos (entry 11, Table 1) by 31P-{1H} NMR. The 31P-{1H} NMR spectrum shows only two broad singlets at 28.7 and 30.2ppm, which can be attributed to the Xantphos associated with Rh-carbonyl compounds. Interestingly, the addition of Xantphos to the organic phase recovered from the hydroformylation of 1-hexene promoted by Xantphos-Rh nanoparticles suppresses the catalytic activity of this solution. Moreover, the 31P-{1H} NMR spectrum of a mixture of Rh(0) nanoparticles, Xantphos and aldehyde shows two relatively broad peaks centered at 32ppm and no peak corresponding to free-Xantphos was observed, suggesting that all the Xantphos ligand interacts with the Rh centers. The IR spectra of the Rh(0) nanoparticles (CaF2 pellets) under 1bar of CO during 20h shows bands at 2088 and 2019cm−1 (Fig. 5 ) characteristic of Rh(CO)2 species present in Rh surfaces covered by CO [30]. The same IR spectrum was obtained for the Rh nanoparticles under 1bar of CO/H2 (1/1) during 24h. We have also tested smaller (2.7nm) [11] and larger (15nm) [31] Rh(0) nanoparticles prepared by hydrogen reduction of RhCl3·nH2O and [RhCl(cod)]2, respectively, dissolved in 1-n-butyl-3-methylimidazolium hexafluorophosphate ionic liquid (see Table 2). There is a strong influence of the nanoparticle size on the hydroformylation reaction: although small nanoparticles also generate catalytically active species the chemoselectivity decreases (around 11–17% of olefin isomerization) compared to those performed with the 5.0nm nanoparticles. In contrast, the large sized nanoparticles produce only small amounts of aldehydes similar to that observed with a classical heterogeneous Rh/C catalyst precursor (compare entries 5–6 and 7, Table 2). It is obvious that the lower catalytic activity observed with the large sized nanoparticles is related with the presence of less Rh atoms on the surface than those with 5.0nm. It is also important to note that the isolated nanoparticles prepared either in 1-n-butyl-3-methylimidazolium tetrafluoroborate or hexafluorophosphate contains residual ionic liquids on their surfaces as observed by XPS analysis [31,32]. Therefore, the higher catalytic activity obtained with the 5.0nm nanoparticles (prepared in 1-n-butyl-3-methylimidazolium tetrafluoroborate) compared to those obtained with the 2.7 and 15nm (both prepared in 1-n-butyl-3-methylimidazolium hexafluorophosphate) can be also due to the presence of more exposed Rh atoms on their surface since BF4 anion is much less coordinating than PF6 anion [33]. 3 Conclusions We demonstrated that unmodified or ligand-modified 5.0nm Rh(0) nanoparticles are catalyst precursors for the hydroformylation of 1-alkenes. Although at this stage of our studies we cannot exclude that the hydroformylation reaction occurs at the nanoparticle surface, most of the data including the induction periods observed in all reactions starting from the nanoparticles are indicative of nanoparticle degradation under the reaction conditions into soluble mononuclear Rh-carbonyl catalytically active species as observed earlier in the reactions performed with Rh-carbonyl molecular clusters [17]. However, whatever the path involved in the formation of the catalytically active species it is clear that it depends on the size of the starting Rh nanoparticles. 4 Experimental 4.1 General All reactions were performed under an argon atmosphere using Schlenk techniques. The substrates (Acros or Aldrich) were obtained from commercial sources and used as received. The ionic liquids were prepared according to known procedures [27], dried over molecular sieves (4Å) and their purity was checked by an AgNO3 test, 1H and 13C NMR, and Cyclic Voltametry. The water [34] (<0.1wt%) and chloride [35] (<1.4mg/L) contents in the ionic liquids used were determined by known methods. NMR analyses were performed on a Varian Inova 300 spectrometer. Infrared spectra were obtained on a Bomen B-102 spectrometer. 4.2 XRD analysis of the isolated nanoparticles For the XRD analyses the nanoparticles were isolated as a fine powder and placed in the sample holder. The wide angle X-ray diffraction (WAXD) experiments were carried out on a SIEMENS D500 diffractometer equipped with curved graphite crystal using Cu Kα radiation (λ =1.5406Å). The diffraction data were collected at room temperature in a Bragg-Brentano θ–2θ geometry. The equipment was operated at 40kV and 20mA with scan range between 10° and 100°. The diffractograms were obtained with a constant step 0.05. The Rietveld's refinement (Fig. 6 ) was obtained using the FULLPROF code. 4.3 TEM analysis The nanoparticle size and morphology of the particles isolated before and after hydroformylation reaction were investigated in situ by TEM analysis carried out directly on the ionic liquid nanoparticle-containing phase. The morphologies of the obtained particles were carried out on a JEOL JEM-2010 equipped with an energy dispersive X-ray spectroscopy (EDS) system and JEOL JEM-1200 EXII electron microscope operating at an accelerating voltage of 200 and 120kV, respectively. The samples for TEM were prepared by deposition on a carbon-coated copper grid of the rhodium nanoparticles dispersed in the ionic liquid at room temperature. The histograms of the nanoparticles size distribution were obtained from measurement of about 300 particles (600 counts), and were reproduced in different regions of the Cu grid, assuming spherical shape, found in an arbitrary chosen area of enlarged micrographs. The HRTEM images (Fig. 7 ) were analyzed by in Gatan Software from which it was obtained the Fourier transformed. 4.4 Nanoparticle formation and isolation In a typical experiment, a Fischer Porter bottle containing a red solution of RhCl3·xH2O (26mg, 0.1mmol) in methanol (5mL) was added to BMI·BF4 (1mL) and stirred at room temperature for 15min. The volatiles were then removed under reduced pressure (0.1bar) at 75°C for 1h. The system was kept at 75°C and hydrogen (4bar) was admitted to the system. After stirring for 1h a black solution was obtained and 15mL of methanol were added and the nanoparticles were isolated by centrifugation (3000rpm) for 5min and washed with methanol (3×15mL) and dried under reduced pressure. The Rh samples thus obtained were prepared for TEM and X-ray analysis, and for catalytic experiments. 4.5 Catalytic experiments Catalytic experiments were performed in a 50mL capacity stainless-steel reaction vessel (Parr) using a mechanic stirrer (660rpm). The fall in the CO/H2 pressure in the reaction vessel was monitored with a pressure transducer interfaced through a Novus converter to a PC and the data workup via Microcal Origin 5.0. The Rh(0) nanoparticles (5mg) and the desired olefin (10mmol) were transferred under argon to the reaction vessel. Thereafter, the reaction vessel was pressurized with 50bar of CO/H2 (1/1) and the reaction was initiated by placing the reaction vessel into a temperature-controlled oil bath preheated at 100°C. Catalytic reactions were terminated by removing the vessel from the oil bath and depressurized after cooling in an ice bath. In all cases the organic layer was readily separated from the solid nanoparticles. The organic phase was analyzed by GC using a Varian gas chromatograph with a FID and 30m long capillary column with a dimethylpolysiloxane stationary phase and using di-n-butyl ether as standard. The organic compounds were characterized by GC–MS and by comparison of their GC retention times with those of authentic samples. Acknowledgements Thanks are due to the following Brazilian agencies: CNPq, CAPES and CT-PETRO for partial financial support. References [1] R.A. Van Santen P.W.N.M. Van Leeuwen J.A. Moulijn B.A. Averill Catalysis: An Integrated Approach, second, revised and enlarged edition [in: Stud. Surf. Sci. Catal. (1999) 123] 1999 Elsevier Amsterdam [2] M. Valden X. Lai D.W. Goodman Science 281 1998 1647 [3] L.N. Lewis Chem. Rev. 93 1993 2693 [4] M. Kralik A. Biffis J. Mol. Catal. A: Chem. 177 2001 113 [5] J.D. Aiken R.G. Finke J. Mol. Catal. A: Chem. 145 1999 1 [6] A. Roucoux J. Schulz H. Patin Chem. Rev. 102 2002 3757 [7] H. Bonnemann R.M. Richards Eur. J. Inorg. Chem. 2001 2455 [8] A.T. Bell Science 299 2003 1688 [9] S. Jansat M. Gomez K. Philippot G. Muller E. Guiu C. Claver S. Castillon B. Chaudret J. Am. Chem. Soc. 126 2004 1592 [10] G.S. Fonseca E.T. Silveira M.A. Gelesky J. Dupont Adv. Synth. Catal. 347 2005 847 [11] G.S. Fonseca A.P. Umpierre P.F.P. Fichtner S.R. Teixeira J. Dupont Chem. Eur. J. 9 2003 3263 [12] E.T. Silveira A.P. Umpierre L.M. Rossi G. Machado J. Morais G.V. Soares I.L.R. Baumvol S.R. Teixeira P.F.P. Fichtner J. Dupont Chem. Eur. J. 10 2004 3734 [13] C.C. Cassol A.P. Umpierre G. Machado S.I. Wolke J. Dupont J. Am. Chem. Soc. 127 2005 3298 [14] P.C.J. Kamer A. van Rooy G.C. Schoemaker P.W.N.M. Van Leeuwen Coord. Chem. Rev. 248 2004 2409 [15] P.W.N.M. Van Leeuwen C. Claver Compr. Coord. Chem. II 9 2004 141 [16] H.-W. Bohnen B. Cornils Adv. Catal. 47 2002 1 [17] D.T. Brown T. Eguchi B.T. Heaton J.A. Iggo R. Whyman J. Chem. Soc. Dalton Trans. 1991 677 [18] I.T. Horvath M. Garland G. Bor P. Pino J. Organomet. Chem. 358 1988 C17 [19] A. Ceriotti L. Garlaschelli G. Longoni M.C. Malatesta D. Strumolo A. Fumagalli S. Martinengo J. Mol. Catal. 24 1984 309 [20] A.D. Harley G.J. Guskey G.L. Geoffroy Organometallics 2 1983 53 [21] C.Z. Li E. Widjaja M. Garland Organometallics 23 2004 4131 [22] C.Z. Li E. Widjaja M. Garland J. Am. Chem. Soc. 125 2003 5540 [23] G.W. Liu M. Garland J. Organomet. Chem. 613 2000 124 [24] M. Garland Organometallics 12 1993 535 [25] C. Fyhr M. Garland Organometallics 12 1993 1753 [26] M. Kranenburg Y.E.M. Vanderburgt P.C.J. Kamer P. Vanleeuwen K. Goubitz J. Fraanje Organometallics 14 1995 3081 [27] P.A.Z. Suarez J.E.L. Dullius S. Einloft R.F. DeSouza J. Dupont Polyhedron 15 1996 1217 [28] J. Dupont G.S. Fonseca A.P. Umpierre P.F.P. Fichtner S.R. Teixeira J. Am. Chem. Soc. 124 2002 4228 [29] G.S. Fonseca A.P. Umpierre P.F.P. Fichtner S.R. Teixeira J. Dupont Chem. Eur. J. 9 2003 3263 [30] J.T. Yates T.M. Duncan S.D. Worley R.W. Vaughan J. Chem. Phys. 70 1979 1219 [31] M.A. Gelesky A.P. Umpierre G. Machado R.R.B. Correia W.C. Magno J. Morais G. Ebeling J. Dupont J. Am. Chem. Soc. 127 2005 4588 [32] A.P. Umpierre G. Machado G.H. Fecher J. Morais J. Dupont Adv. Synth. Catal. 347 2005 1404 [33] J. Dupont J. Braz. Chem. Soc. 15 2004 341 [34] B.K. Sweeny D.G. Peters Electrochem. Commun. 3 2001 712 [35] V. Gallo P. Mastrorilli C.F. Nobile G. Romanazzi G.P. Suranna J. Chem. Soc. Dalton Trans. 2002 4339",
      "scopus-id": "33646144436",
      "coredata": {
        "eid": "1-s2.0-S1381116906006017",
        "dc:description": "The hydroformylation of 1-alkenes can be performed in solventless conditions using ligand-modified or unmodified Rh(0) nanoparticles prepared in imidazolium ionic liquids as catalyst precursors. There is a strong influence of the nanoparticle size on the hydroformylation reaction. Aldehydes are generated when 5.0nm Rh(0) nanoparticles are used in the hydroformylation of 1-alkenes and l/b selectivities up to 25 can be achieved by addition of Xantphos (9,9-dimethyl-4,5-bis(diphenylphosphino)xanthene). Although small nanoparticles also generate catalytically active species the chemoselectivity decreases (around 11–17% of olefin isomerization) compared to those performed with the 5.0nm nanoparticles. In contrast, the large sized nanoparticles (15nm) produce only small amounts of aldehydes similar to that observed with a classical heterogeneous Rh/C catalyst precursor. TEM, XRD, IR and NMR experiments indicated that these Rh(0) nanoparticles are probably degraded under the reaction conditions into soluble mononuclear Rh-carbonyl catalytically active species.",
        "openArchiveArticle": "false",
        "prism:coverDate": "2006-06-01",
        "openaccessUserLicense": null,
        "prism:aggregationType": "Journal",
        "prism:url": "https://api.elsevier.com/content/article/pii/S1381116906006017",
        "dc:creator": [
          {
            "@_fa": "true",
            "$": "Bruss, Arnoldo J."
          },
          {
            "@_fa": "true",
            "$": "Gelesky, Marcos A."
          },
          {
            "@_fa": "true",
            "$": "Machado, Giovanna"
          },
          {
            "@_fa": "true",
            "$": "Dupont, Jairton"
          }
        ],
        "link": [
          {
            "@_fa": "true",
            "@rel": "self",
            "@href": "https://api.elsevier.com/content/article/pii/S1381116906006017"
          },
          {
            "@_fa": "true",
            "@rel": "scidir",
            "@href": "https://www.sciencedirect.com/science/article/pii/S1381116906006017"
          }
        ],
        "dc:format": "application/json",
        "openaccessType": null,
        "pii": "S1381-1169(06)00601-7",
        "prism:volume": "252",
        "prism:publisher": "Elsevier B.V.",
        "dc:title": "Rh(0) nanoparticles as catalyst precursors for the solventless hydroformylation of olefins",
        "prism:copyright": "Copyright © 2006 Elsevier B.V. All rights reserved.",
        "openaccess": "0",
        "prism:issn": "13811169",
        "prism:issueIdentifier": "1-2",
        "dcterms:subject": [
          {
            "@_fa": "true",
            "$": "Nanoparticles"
          },
          {
            "@_fa": "true",
            "$": "Rhodium"
          },
          {
            "@_fa": "true",
            "$": "Hydroformylation"
          },
          {
            "@_fa": "true",
            "$": "Metal-carbonyl"
          },
          {
            "@_fa": "true",
            "$": "Surface"
          }
        ],
        "openaccessArticle": "false",
        "prism:publicationName": "Journal of Molecular Catalysis A: Chemical",
        "prism:number": "1-2",
        "openaccessSponsorType": null,
        "prism:pageRange": "212-218",
        "prism:endingPage": "218",
        "pubType": "fla",
        "prism:coverDisplayDate": "1 June 2006",
        "prism:doi": "10.1016/j.molcata.2006.02.063",
        "prism:startingPage": "212",
        "dc:identifier": "doi:10.1016/j.molcata.2006.02.063",
        "openaccessSponsorName": null
      },
      "objects": {
        "object": [
          {
            "@category": "high",
            "@height": "970",
            "@width": "900",
            "@_fa": "true",
            "$": "https://api.elsevier.com/content/object/eid/1-s2.0-S1381116906006017-gr7_lrg.jpg?httpAccept=%2A%2F%2A",
            "@multimediatype": "JPEG image file",
            "@type": "IMAGE-HIGH-RES",
            "@size": "262146",
            "@ref": "gr7",
            "@mimetype": "image/jpeg"
          },
          {
            "@category": "high",
            "@height": "1482",
            "@width": "1690",
            "@_fa": "true",
            "$": "https://api.elsevier.com/content/object/eid/1-s2.0-S1381116906006017-gr5_lrg.jpg?httpAccept=%2A%2F%2A",
            "@multimediatype": "JPEG image file",
            "@type": "IMAGE-HIGH-RES",
            "@size": "150366",
            "@ref": "gr5",
            "@mimetype": "image/jpeg"
          },
          {
            "@category": "high",
            "@height": "1275",
            "@width": "1682",
            "@_fa": "true",
            "$": "https://api.elsevier.com/content/object/eid/1-s2.0-S1381116906006017-gr4_lrg.jpg?httpAccept=%2A%2F%2A",
            "@multimediatype": "JPEG image file",
            "@type": "IMAGE-HIGH-RES",
            "@size": "174153",
            "@ref": "gr4",
            "@mimetype": "image/jpeg"
          },
          {
            "@category": "high",
            "@height": "1281",
            "@width": "1680",
            "@_fa": "true",
            "$": "https://api.elsevier.com/content/object/eid/1-s2.0-S1381116906006017-gr3_lrg.jpg?httpAccept=%2A%2F%2A",
            "@multimediatype": "JPEG image file",
            "@type": "IMAGE-HIGH-RES",
            "@size": "142248",
            "@ref": "gr3",
            "@mimetype": "image/jpeg"
          },
          {
            "@category": "high",
            "@height": "2469",
            "@width": "2632",
            "@_fa": "true",
            "$": "https://api.elsevier.com/content/object/eid/1-s2.0-S1381116906006017-gr2_lrg.jpg?httpAccept=%2A%2F%2A",
            "@multimediatype": "JPEG image file",
            "@type": "IMAGE-HIGH-RES",
            "@size": "906887",
            "@ref": "gr2",
            "@mimetype": "image/jpeg"
          },
          {
            "@category": "high",
            "@height": "1031",
            "@width": "2767",
            "@_fa": "true",
            "$": "https://api.elsevier.com/content/object/eid/1-s2.0-S1381116906006017-gr1_lrg.jpg?httpAccept=%2A%2F%2A",
            "@multimediatype": "JPEG image file",
            "@type": "IMAGE-HIGH-RES",
            "@size": "213285",
            "@ref": "gr1",
            "@mimetype": "image/jpeg"
          },
          {
            "@category": "high",
            "@height": "478",
            "@width": "5146",
            "@_fa": "true",
            "$": "https://api.elsevier.com/content/object/eid/1-s2.0-S1381116906006017-sc1_lrg.gif?httpAccept=%2A%2F%2A",
            "@multimediatype": "GIF image file",
            "@type": "IMAGE-HIGH-RES",
            "@size": "19955",
            "@ref": "sc1",
            "@mimetype": "image/gif"
          },
          {
            "@category": "high",
            "@height": "1964",
            "@width": "5411",
            "@_fa": "true",
            "$": "https://api.elsevier.com/content/object/eid/1-s2.0-S1381116906006017-gr6_lrg.gif?httpAccept=%2A%2F%2A",
            "@multimediatype": "GIF image file",
            "@type": "IMAGE-HIGH-RES",
            "@size": "118513",
            "@ref": "gr6",
            "@mimetype": "image/gif"
          },
          {
            "@category": "high",
            "@height": "474",
            "@width": "3334",
            "@_fa": "true",
            "$": "https://api.elsevier.com/content/object/eid/1-s2.0-S1381116906006017-fx1_lrg.gif?httpAccept=%2A%2F%2A",
            "@multimediatype": "GIF image file",
            "@type": "IMAGE-HIGH-RES",
            "@size": "16745",
            "@ref": "fx1",
            "@mimetype": "image/gif"
          },
          {
            "@category": "standard",
            "@height": "365",
            "@width": "339",
            "@_fa": "true",
            "$": "https://api.elsevier.com/content/object/eid/1-s2.0-S1381116906006017-gr7.jpg?httpAccept=%2A%2F%2A",
            "@multimediatype": "JPEG image file",
            "@type": "IMAGE-DOWNSAMPLED",
            "@size": "71836",
            "@ref": "gr7",
            "@mimetype": "image/jpeg"
          },
          {
            "@category": "standard",
            "@height": "334",
            "@width": "381",
            "@_fa": "true",
            "$": "https://api.elsevier.com/content/object/eid/1-s2.0-S1381116906006017-gr5.jpg?httpAccept=%2A%2F%2A",
            "@multimediatype": "JPEG image file",
            "@type": "IMAGE-DOWNSAMPLED",
            "@size": "33092",
            "@ref": "gr5",
            "@mimetype": "image/jpeg"
          },
          {
            "@category": "standard",
            "@height": "288",
            "@width": "380",
            "@_fa": "true",
            "$": "https://api.elsevier.com/content/object/eid/1-s2.0-S1381116906006017-gr4.jpg?httpAccept=%2A%2F%2A",
            "@multimediatype": "JPEG image file",
            "@type": "IMAGE-DOWNSAMPLED",
            "@size": "40835",
            "@ref": "gr4",
            "@mimetype": "image/jpeg"
          },
          {
            "@category": "standard",
            "@height": "289",
            "@width": "379",
            "@_fa": "true",
            "$": "https://api.elsevier.com/content/object/eid/1-s2.0-S1381116906006017-gr3.jpg?httpAccept=%2A%2F%2A",
            "@multimediatype": "JPEG image file",
            "@type": "IMAGE-DOWNSAMPLED",
            "@size": "35521",
            "@ref": "gr3",
            "@mimetype": "image/jpeg"
          },
          {
            "@category": "standard",
            "@height": "557",
            "@width": "594",
            "@_fa": "true",
            "$": "https://api.elsevier.com/content/object/eid/1-s2.0-S1381116906006017-gr2.jpg?httpAccept=%2A%2F%2A",
            "@multimediatype": "JPEG image file",
            "@type": "IMAGE-DOWNSAMPLED",
            "@size": "101113",
            "@ref": "gr2",
            "@mimetype": "image/jpeg"
          },
          {
            "@category": "standard",
            "@height": "233",
            "@width": "625",
            "@_fa": "true",
            "$": "https://api.elsevier.com/content/object/eid/1-s2.0-S1381116906006017-gr1.jpg?httpAccept=%2A%2F%2A",
            "@multimediatype": "JPEG image file",
            "@type": "IMAGE-DOWNSAMPLED",
            "@size": "39565",
            "@ref": "gr1",
            "@mimetype": "image/jpeg"
          },
          {
            "@category": "standard",
            "@height": "54",
            "@width": "581",
            "@_fa": "true",
            "$": "https://api.elsevier.com/content/object/eid/1-s2.0-S1381116906006017-sc1.gif?httpAccept=%2A%2F%2A",
            "@multimediatype": "GIF image file",
            "@type": "IMAGE-DOWNSAMPLED",
            "@size": "4665",
            "@ref": "sc1",
            "@mimetype": "image/gif"
          },
          {
            "@category": "standard",
            "@height": "222",
            "@width": "611",
            "@_fa": "true",
            "$": "https://api.elsevier.com/content/object/eid/1-s2.0-S1381116906006017-gr6.gif?httpAccept=%2A%2F%2A",
            "@multimediatype": "GIF image file",
            "@type": "IMAGE-DOWNSAMPLED",
            "@size": "23063",
            "@ref": "gr6",
            "@mimetype": "image/gif"
          },
          {
            "@category": "standard",
            "@height": "53",
            "@width": "376",
            "@_fa": "true",
            "$": "https://api.elsevier.com/content/object/eid/1-s2.0-S1381116906006017-fx1.gif?httpAccept=%2A%2F%2A",
            "@multimediatype": "GIF image file",
            "@type": "IMAGE-DOWNSAMPLED",
            "@size": "4110",
            "@ref": "fx1",
            "@mimetype": "image/gif"
          },
          {
            "@category": "thumbnail",
            "@height": "20",
            "@width": "219",
            "@_fa": "true",
            "$": "https://api.elsevier.com/content/object/eid/1-s2.0-S1381116906006017-sc1.sml?httpAccept=%2A%2F%2A",
            "@multimediatype": "GIF image file",
            "@type": "IMAGE-THUMBNAIL",
            "@size": "1737",
            "@ref": "sc1",
            "@mimetype": "image/gif"
          },
          {
            "@category": "thumbnail",
            "@height": "79",
            "@width": "219",
            "@_fa": "true",
            "$": "https://api.elsevier.com/content/object/eid/1-s2.0-S1381116906006017-gr6.sml?httpAccept=%2A%2F%2A",
            "@multimediatype": "GIF image file",
            "@type": "IMAGE-THUMBNAIL",
            "@size": "5440",
            "@ref": "gr6",
            "@mimetype": "image/gif"
          },
          {
            "@category": "thumbnail",
            "@height": "31",
            "@width": "219",
            "@_fa": "true",
            "$": "https://api.elsevier.com/content/object/eid/1-s2.0-S1381116906006017-fx1.sml?httpAccept=%2A%2F%2A",
            "@multimediatype": "GIF image file",
            "@type": "IMAGE-THUMBNAIL",
            "@size": "2334",
            "@ref": "fx1",
            "@mimetype": "image/gif"
          },
          {
            "@category": "thumbnail",
            "@height": "164",
            "@width": "152",
            "@_fa": "true",
            "$": "https://api.elsevier.com/content/object/eid/1-s2.0-S1381116906006017-gr7.sml?httpAccept=%2A%2F%2A",
            "@multimediatype": "GIF image file",
            "@type": "IMAGE-THUMBNAIL",
            "@size": "28118",
            "@ref": "gr7",
            "@mimetype": "image/gif"
          },
          {
            "@category": "thumbnail",
            "@height": "164",
            "@width": "187",
            "@_fa": "true",
            "$": "https://api.elsevier.com/content/object/eid/1-s2.0-S1381116906006017-gr5.sml?httpAccept=%2A%2F%2A",
            "@multimediatype": "GIF image file",
            "@type": "IMAGE-THUMBNAIL",
            "@size": "3728",
            "@ref": "gr5",
            "@mimetype": "image/gif"
          },
          {
            "@category": "thumbnail",
            "@height": "164",
            "@width": "216",
            "@_fa": "true",
            "$": "https://api.elsevier.com/content/object/eid/1-s2.0-S1381116906006017-gr4.sml?httpAccept=%2A%2F%2A",
            "@multimediatype": "GIF image file",
            "@type": "IMAGE-THUMBNAIL",
            "@size": "5483",
            "@ref": "gr4",
            "@mimetype": "image/gif"
          },
          {
            "@category": "thumbnail",
            "@height": "164",
            "@width": "215",
            "@_fa": "true",
            "$": "https://api.elsevier.com/content/object/eid/1-s2.0-S1381116906006017-gr3.sml?httpAccept=%2A%2F%2A",
            "@multimediatype": "GIF image file",
            "@type": "IMAGE-THUMBNAIL",
            "@size": "4609",
            "@ref": "gr3",
            "@mimetype": "image/gif"
          },
          {
            "@category": "thumbnail",
            "@height": "164",
            "@width": "175",
            "@_fa": "true",
            "$": "https://api.elsevier.com/content/object/eid/1-s2.0-S1381116906006017-gr2.sml?httpAccept=%2A%2F%2A",
            "@multimediatype": "GIF image file",
            "@type": "IMAGE-THUMBNAIL",
            "@size": "21657",
            "@ref": "gr2",
            "@mimetype": "image/gif"
          },
          {
            "@category": "thumbnail",
            "@height": "82",
            "@width": "219",
            "@_fa": "true",
            "$": "https://api.elsevier.com/content/object/eid/1-s2.0-S1381116906006017-gr1.sml?httpAccept=%2A%2F%2A",
            "@multimediatype": "GIF image file",
            "@type": "IMAGE-THUMBNAIL",
            "@size": "3842",
            "@ref": "gr1",
            "@mimetype": "image/gif"
          }
        ]
      },
      "link": {
        "@rel": "abstract",
        "@href": "https://api.elsevier.com/content/abstract/scopus_id/33646144436"
      }
    }
  }
}