{
  "metadata": {
    "title": "Oxidative dehydrogenation of ethanol to acetaldehyde on V<ce:inf loc=post>2</ce:inf>O<ce:inf loc=post>5</ce:inf>/TiO<ce:inf loc=post>2</ce:inf>-SiO<ce:inf loc=post>2</ce:inf> catalysts obtained by grafting vanadium and titanium alkoxides on silica",
    "authors": "; ; ",
    "journal": "Journal of Molecular Catalysis A: Chemical",
    "date": "2003-09-15",
    "doi": "10.1016/S1381-1169(03)00345-5",
    "abstract": "",
    "uri": "https://api.elsevier.com/content/article/pii/S1381116903003455",
    "pii": "S1381116903003455"
  },
  "fulltext": {
    "full-text-retrieval-response": {
      "scopus-eid": "2-s2.0-0041836318",
      "originalText": "serial JL 271358 291210 291744 291790 291809 31 Journal of Molecular Catalysis A: Chemical JOURNALMOLECULARCATALYSISACHEMICAL 2003-06-11 2003-06-11 2010-04-18T22:33:40 1-s2.0-S1381116903003455 S1381-1169(03)00345-5 S1381116903003455 10.1016/S1381-1169(03)00345-5 S300 S300.1 FULL-TEXT 1-s2.0-S1381116900X01744 2015-05-15T05:56:32.920819-04:00 0 0 20030915 2003 2003-06-11T00:00:00Z articleinfo crossmark dco dateupdated tomb dateloaded datesearch indexeddate volumelist yearnav absattachment articletitlenorm authfirstinitialnorm authfirstsurnamenorm cid cids confeditor contenttype copyright dateloadedtxt docsubtype doctype doi eid ewtransactionid hubeid issn issnnorm itemstage itemtransactionid itemweight openaccess openarchive pg pgfirst pglast pii piinorm pubdatestart pubdatetxt pubyr sortorder srctitle srctitlenorm srctype subheadings suppl vol volfirst volissue webpdf webpdfpagecount figure table body acknowledge affil articletitle auth authfirstini authfull authkeywords authlast dedication primabst ref specialabst alllist content subj ssids 1381-1169 13811169 204 205 204 205 C Volumes 204–205 66 617 627 617 627 20030915 15 September 2003 2003-09-15 2003 In honour of Prof. R. Ugo on the occasion of his 65th. Birthday D. Roberto and R. Psaro converted-article fla Copyright © 2003 Elsevier Science B.V. All rights reserved. OXIDATIVEDEHYDROGENATIONETHANOLACETALDEHYDEV2O5TIO2SIO2CATALYSTSOBTAINEDBYGRAFTINGVANADIUMTITANIUMALKOXIDESSILICA SANTACESARIA E 1 Introduction 2 Experimental 2.1 Catalysts and supports preparation methods 2.2 Catalysts and supports characterisation methods 2.2.1 Catalytic runs 3 Results and discussion 3.1 Comparison of the performances of catalysts, respectively, prepared by grafting and impregnation 3.2 Effects of dispersion, vanadium load and solvent on the catalysts performances 3.3 Influence of the preparation procedure on the catalytic performances 3.4 Spectroscopic investigations 3.5 Correlation between catalyst properties and catalytic behaviour 4 Conclusions Acknowledgements References BOND 1987 219 G OYAMA 1990 5022 5028 S WANG 1986 1173 1176 L ALLAKHVERDOVA 1992 261 N COLE 1976 2744 D GASIOR 1984 87 M VOGT 1988 313 E IENGO 1999 97 109 P REICHMANN 1987 111 M REICHMANN 1987 315 M RAJADHYAKSHA 1989 67 R WATHOZ 1991 149 P GALANFERERES 1994 3711 M GALANFERERES 1995 1342 M QUARANTA 1992 147 N QUARANTA 1997 1 N SORRENTINO 2000 1 13 A RAJADHYAKSHA 1989 67 79 R BRUNAUER 1938 309 S DOLLIMORE 1964 109 D COMITE 2003 151 165 A WENT 1992 479 491 G ASTORINO 1995 482 E ODENBRAND 1990 541 C BOND 1997 91 103 G SANTACESARIAX2003X617 SANTACESARIAX2003X617X627 SANTACESARIAX2003X617XE SANTACESARIAX2003X617X627XE item S1381-1169(03)00345-5 S1381116903003455 1-s2.0-S1381116903003455 10.1016/S1381-1169(03)00345-5 271358 2010-10-04T20:44:30.810376-04:00 2003-09-15 1-s2.0-S1381116903003455-main.pdf https://s3.amazonaws.com/prod-ucs-content-store-us-east/content/pii:S1381116903003455/MAIN/application/pdf/192e3449e9058e9f372ca82ba6e20331/main.pdf https://s3-eu-west-1.amazonaws.com/prod-ucs-content-store-eu-west/content/pii:S1381116903003455/MAIN/application/pdf/192e3449e9058e9f372ca82ba6e20331/main.pdf main.pdf pdf true 142043 MAIN 11 1-s2.0-S1381116903003455-main_1.png https://s3.amazonaws.com/prod-ucs-content-store-us-east/content/pii:S1381116903003455/PREVIEW/image/png/a1ce88f2f413a20c78579f6bb911906b/main_1.png https://s3-eu-west-1.amazonaws.com/prod-ucs-content-store-eu-west/content/pii:S1381116903003455/PREVIEW/image/png/a1ce88f2f413a20c78579f6bb911906b/main_1.png main_1.png png 60691 849 656 IMAGE-WEB-PDF 1 1-s2.0-S1381116903003455-si1.gif https://s3.amazonaws.com/prod-ucs-content-store-us-east/content/pii:S1381116903003455/STRIPIN/image/gif/c13fe810bce2c9e51338fdc0f96e7014/si1.gif https://s3-eu-west-1.amazonaws.com/prod-ucs-content-store-eu-west/content/pii:S1381116903003455/STRIPIN/image/gif/c13fe810bce2c9e51338fdc0f96e7014/si1.gif si1 si1.gif gif 413 11 85 ALTIMG 1-s2.0-S1381116903003455-fx1.sml https://s3.amazonaws.com/prod-ucs-content-store-us-east/content/pii:S1381116903003455/fx1/THUMBNAIL/image/gif/a95d9d119f9aa65b9c543f9a1fafab63/fx1.sml https://s3-eu-west-1.amazonaws.com/prod-ucs-content-store-eu-west/content/pii:S1381116903003455/fx1/THUMBNAIL/image/gif/a95d9d119f9aa65b9c543f9a1fafab63/fx1.sml fx1 true fx1.sml sml 2022 57 125 IMAGE-THUMBNAIL 1-s2.0-S1381116903003455-fx1.jpg https://s3.amazonaws.com/prod-ucs-content-store-us-east/content/pii:S1381116903003455/fx1/DOWNSAMPLED/image/jpeg/39161a8720e13eae13726adf47f40b1a/fx1.jpg https://s3-eu-west-1.amazonaws.com/prod-ucs-content-store-eu-west/content/pii:S1381116903003455/fx1/DOWNSAMPLED/image/jpeg/39161a8720e13eae13726adf47f40b1a/fx1.jpg fx1 true fx1.jpg jpg 22530 156 345 IMAGE-DOWNSAMPLED 1-s2.0-S1381116903003455-gr1.sml https://s3.amazonaws.com/prod-ucs-content-store-us-east/content/pii:S1381116903003455/gr1/THUMBNAIL/image/gif/b5a4b32f8b02e5156398f3739f353374/gr1.sml https://s3-eu-west-1.amazonaws.com/prod-ucs-content-store-eu-west/content/pii:S1381116903003455/gr1/THUMBNAIL/image/gif/b5a4b32f8b02e5156398f3739f353374/gr1.sml gr1 gr1.sml sml 1621 70 125 IMAGE-THUMBNAIL 1-s2.0-S1381116903003455-gr1.gif https://s3.amazonaws.com/prod-ucs-content-store-us-east/content/pii:S1381116903003455/gr1/DOWNSAMPLED/image/gif/f0b50358a7ee6f84a6ade4d53f426776/gr1.gif https://s3-eu-west-1.amazonaws.com/prod-ucs-content-store-eu-west/content/pii:S1381116903003455/gr1/DOWNSAMPLED/image/gif/f0b50358a7ee6f84a6ade4d53f426776/gr1.gif gr1 gr1.gif gif 8519 236 423 IMAGE-DOWNSAMPLED 1-s2.0-S1381116903003455-gr2.sml https://s3.amazonaws.com/prod-ucs-content-store-us-east/content/pii:S1381116903003455/gr2/THUMBNAIL/image/gif/ae5ee116861da10222cc32b358d2241d/gr2.sml https://s3-eu-west-1.amazonaws.com/prod-ucs-content-store-eu-west/content/pii:S1381116903003455/gr2/THUMBNAIL/image/gif/ae5ee116861da10222cc32b358d2241d/gr2.sml gr2 gr2.sml sml 1684 73 125 IMAGE-THUMBNAIL 1-s2.0-S1381116903003455-gr2.gif https://s3.amazonaws.com/prod-ucs-content-store-us-east/content/pii:S1381116903003455/gr2/DOWNSAMPLED/image/gif/82a6bbfbafa6ca9f916c4c8781bc2a2e/gr2.gif https://s3-eu-west-1.amazonaws.com/prod-ucs-content-store-eu-west/content/pii:S1381116903003455/gr2/DOWNSAMPLED/image/gif/82a6bbfbafa6ca9f916c4c8781bc2a2e/gr2.gif gr2 gr2.gif gif 8291 239 409 IMAGE-DOWNSAMPLED 1-s2.0-S1381116903003455-gr3.sml https://s3.amazonaws.com/prod-ucs-content-store-us-east/content/pii:S1381116903003455/gr3/THUMBNAIL/image/gif/0f651614a78133ee0e8e63439c582766/gr3.sml https://s3-eu-west-1.amazonaws.com/prod-ucs-content-store-eu-west/content/pii:S1381116903003455/gr3/THUMBNAIL/image/gif/0f651614a78133ee0e8e63439c582766/gr3.sml gr3 gr3.sml sml 2261 94 119 IMAGE-THUMBNAIL 1-s2.0-S1381116903003455-gr3.gif https://s3.amazonaws.com/prod-ucs-content-store-us-east/content/pii:S1381116903003455/gr3/DOWNSAMPLED/image/gif/d97b0266af70236da470daf1da7e0881/gr3.gif https://s3-eu-west-1.amazonaws.com/prod-ucs-content-store-eu-west/content/pii:S1381116903003455/gr3/DOWNSAMPLED/image/gif/d97b0266af70236da470daf1da7e0881/gr3.gif gr3 gr3.gif gif 13815 340 432 IMAGE-DOWNSAMPLED 1-s2.0-S1381116903003455-gr4.sml https://s3.amazonaws.com/prod-ucs-content-store-us-east/content/pii:S1381116903003455/gr4/THUMBNAIL/image/gif/5f3e6ad902048111d61570e2f085dce8/gr4.sml https://s3-eu-west-1.amazonaws.com/prod-ucs-content-store-eu-west/content/pii:S1381116903003455/gr4/THUMBNAIL/image/gif/5f3e6ad902048111d61570e2f085dce8/gr4.sml gr4 gr4.sml sml 2232 94 119 IMAGE-THUMBNAIL 1-s2.0-S1381116903003455-gr4.gif https://s3.amazonaws.com/prod-ucs-content-store-us-east/content/pii:S1381116903003455/gr4/DOWNSAMPLED/image/gif/6b9ba69450acb25c7d044317981c32c7/gr4.gif https://s3-eu-west-1.amazonaws.com/prod-ucs-content-store-eu-west/content/pii:S1381116903003455/gr4/DOWNSAMPLED/image/gif/6b9ba69450acb25c7d044317981c32c7/gr4.gif gr4 gr4.gif gif 14566 358 455 IMAGE-DOWNSAMPLED MOLCAA 4133 S1381-1169(03)00345-5 10.1016/S1381-1169(03)00345-5 Elsevier Science B.V. Fig. 1 A comparison of the activities of different catalysts obtained by grafting and impregnation. Fig. 2 A comparison of the selectivities shown by the different catalysts, respectively, prepared by grafting and impregnation. Fig. 3 A comparison of the activities and selectivities shown by the different catalysts prepared by grafting following different procedures. Fig. 4 A comparison of the activities and selectivities shown by the different catalysts prepared by grafting following different procedures. Table 1 Some properties of the used supports and catalysts Supports and catalysts Acronym Preparation method Grafting solvent Ti(OR)4 used for each step (mmolg−1) TiO2 supported (mmolg−1) BET area (m2 g−1) Pore volume (cm3 g−1) V2O5 supported (wt.%) Oreducib/Vsupported SiO2 (Aldrich) SA – – – – 450 0.72 – – SiO2 (Grace) S – – – – 305 1.02 – – TiO2 T – – – – 125 – – – TiO2-SiO2 (Aldrich) TSMA Grafting Toluene 2.27 3.3 355 0.51 – – TiO2-SiO2 (Grace) TSM1 Grafting Toluene 1.37 2.2 225 0.76 – – TiO2-SiO2 (Grace) TSM Grafting Toluene 0.95 1.4 299 0.27 – – V2O5/TiO2 Vi/T Impregnation – – – 62 – 6.0 <0.01 V2O5/TiO2 VH/T Grafting n-Hexane – – 70 – 5.3 0.2 V2O5/TiO2-SiO2 Vi/TSMA Impregnation – – – 240 – 6.0 0.3 V2O5/TiO2-SiO2 VH/TSMA Grafting n-Hexane – – 200 – 6.0 0.3 V2O5/TiO2-SiO2 VH/TSM1 Grafting n-Hexane – – – 0.36 2.0 0.3 V2O5/TiO2-SiO2 VH/TSM Grafting n-Hexane – – 249 0.29 0.8 0.7 V2O5/TiO2-SiO2 VhI/TSM Grafting 2-Propanol – – 314 0.26 0.9 0.6 V2O5/TiO2-SiO2 VI/TSM Grafting 2-Propanol – – 214 0.24 0.5 1.0 V2O5-TiO2/SiO2 a (Th-V)I/S Grafting 2-Propanol – – – – 0.9 – V2O5-TiO2/SiO2 b (V-T)hI/S Grafting 2-Propanol – – – – 0.8 – a H2O/Ti=1. b H2O/(V-T)h=1; for both catalysts Ti/V=12. Table 2 Reagents employed in the preparation of supports and catalysts Supports and catalysts Acronym Preparation procedure Amount of solid (g) Volume of solvent (ml) Ti(OR)4 (g) VO(OR)3 (g) Water (g) NH4VO3 (g) TiO2-SiO2 (Aldrich) TSMA A 6 60 3.866 – – – TiO2-SiO2 (Grace) TSM1 A 6 60 2.334 – – – TiO2-SiO2 (Grace) TSM A 6 60 1.619 – – – V2O5/TiO2 Vi/T B 2.5 30 – – – 0.225 V2O5/TiO2 VH/T C 6 75 – 0.853 – – V2O5/TiO2-SiO2 Vi/TSMA B 2.5 30 – – – 0.225 V2O5/TiO2-SiO2 VH/TSMA C 6 75 – 0.967 – – V2O5/TiO2-SiO2 VH/TSM1 C 6 75 – 0.322 – – V2O5/TiO2-SiO2 VH/TSM C 6 75 – 0.129 – – V2O5/TiO2-SiO2 VhI/TSM D 4 40 – 1.035 0.076 – V2O5/TiO2-SiO2 VI/TSM C 4 40 – 0.537 – – V2O5-TiO2/SiO2 (Th-V)I/S E 3 40 1.125 0.081 0.071 – V2O5-TiO2/SiO2 (V-T)hI/S F 3 40 1.125 0.081 0.077 – Table 3 Results of catalytic test reaction Catalyst V2O5 (wt.%) Temperature (°C) Ethanol conversion Selectivities Acetaldehyde Acetic acid Acetals CO2 Vi/T 6 98 0.0592 1.0000 0 0 0 120 0.1741 0.8350 0.0250 0.1400 0 142 0.8067 0.5040 0.0470 0.1440 0.2780 155 0.8464 0.4830 0.0530 0.1480 0.3050 177 0.9187 0.4180 0.0870 0.1400 0.3280 VH/T 5.3 119 0.1250 0.9500 0.0310 0 0 142.5 0.5630 0.7650 0.0310 0.0250 0.1800 157 0.6970 0.7070 0.0110 0.0950 0.1870 Vi/TSMA 6 100 0.2033 0.8413 0.0279 0.1308 0 120 0.4764 0.5656 0.0794 0.2123 0.1381 154 0.8741 0.4797 0.0701 0.2069 0.2270 174 0.9078 0.3809 0.1339 0.0933 0.3679 VH/TSMA 6 100 0.0748 1.0000 0 0 0 120 0.1790 0.8727 0.0257 0.1015 0 141 0.3386 0.8360 0.0420 0.1220 0 157 0.7647 0.6760 0.0550 0.1420 0.1270 176 0.8095 0.5820 0.0840 0.1350 0.1990 VH/TSM1 2 104 0.0108 1.0000 0 0 0 121 0.0446 0.9650 0.0350 0 0 142 0.0941 0.8190 0.0380 0.1430 0 155 0.1557 0.8740 0.0470 0.0790 0 177 0.4129 0.7580 0.0740 0.0700 0.0920 VH/TSM 0.8 104 0.0222 0.8737 0.0189 0.1074 0 124 0.0767 0.9070 0.0200 0.0270 0 142 0.2882 0.8670 0.0290 0.0730 0 VhI/TSM 0.9 104 0.0334 0.9280 0.0240 0 0 124 0.0817 0.8770 0.0330 0.0400 0 144 0.2307 0.8510 0.0420 0.0700 0 161 0.5437 0.7860 0.0630 0.0940 0.0530 184 0.7641 0.7000 0.0860 0.1050 0.0930 VI/TSM 0.5 95 0.0087 0.9520 0.0480 0 0 112 0.0153 0.9540 0.0460 0 0 131 0.0782 0.8720 0.0360 0.0340 0 149 0.1425 0.8350 0.0530 0.0470 0 166 0.2488 0.6970 0.0640 0.1010 0.1240 181 0.5527 0.7310 0.0750 0.1030 0.0770 (Th-V)I/S 0.9 93 0.0029 1.0000 0 0 0 112 0.0086 0.9280 0 0 0 133 0.0361 0.9660 0.0340 0 0 150 0.1577 0.9920 0.0080 0 0 172 0.2126 0.9310 0.0110 0.0350 0 190 0.5093 0.8910 0.0090 0.0470 0.0040 (V-T)hI/S 0.8 94 0.0025 1.0000 0 0 0 113 0.0090 0.9600 0.0400 0 0 131 0.0307 0.9800 0.0200 0 0 158 0.1316 0.9230 0.0160 0.0280 0 175 0.2777 0.9320 0.0170 0.0400 0 Catalyst weight 0.5g; ethanol 1.1mlh−1; oxygen 7.7mlmin−1; helium 22mlmin−1; W/F=26.4gcat (hmol ethanol)−1. Oxidative dehydrogenation of ethanol to acetaldehyde on V2O5/TiO2-SiO2 catalysts obtained by grafting vanadium and titanium alkoxides on silica Dedicated to Professor Renato Ugo on the occasion of his 65th birthday E Santacesaria ∗ A Sorrentino R Tesser M Di Serio A Ruggiero Dipartimento di Chimica, Complesso Universitario di Monte S. Angelo, Via Cinthia, 80126 Napoli, Italy * Corresponding author. Tel.: +39-081-674027; fax: +39-081-674026. Oxidative dehydrogenation of ethanol to acetaldehyde has been studied on catalysts prepared by grafting vanadyl tri-isopropoxide on silica coated with TiO2 or alternatively by reacting vanadyl tri-isopropoxide with titanium tetra-isopropoxide and grafting the obtained bimetallic alkoxide directly on silica. This catalyst resulted less active but more selective in the mentioned reaction. The difference between the mentioned catalysts is depicted in the scheme showing more V–O–Ti instead of V–O–V bonds for the selective catalyst. Oxidative dehydrogenation of ethanol to acetaldehyde has been performed on vanadium based catalysts prepared by grafting on titania–silica supports with different procedures. A comparison of the performances of the prepared catalysts in terms of activity and selectivity has been made. Grafting technique gives place to well dispersed catalysts that resulted more selective than catalysts prepared by impregnation. In particular, very selective catalysts have been obtained by grafting vanadium–titanium bimetallic alkoxides directly on silica support. The effect of both the preparation methods and the used supports on the catalytic performances have been studied and an attempt to correlate the observed properties with the obtained results has been made. Keywords Catalyst preparation Grafting alkoxides Vanadium Ethanol oxidative dehydrogenation 1 Introduction Catalysts of V2O5 supported on TiO2 or SiO2 have been studied by different authors in the selective oxidation of alcohols to aldehydes [1,2]. In particular, it has been observed that both pure V2O5 [3] and V2O5 supported on SiO2 [4] are active and selective in the oxidative dehydrogenation of ethanol to acetaldehyde. The properties of vanadium oxide, supported on different carriers, such as: silica, alumina, titania, have been investigated [1,2,5] and it is possible to conclude that the nature of vanadium oxide dispersed phase strongly depends on the interaction between vanadium oxide and the support. It is well known, for example, that TiO2 in the form of anatase interacts very strongly with vanadium oxide favouring molecular dispersion of the active phase [6,7]. However, V2O5 directly supported on TiO2 presents some drawbacks that are: limited specific surface area and lower resistance to sintering than other oxides. It is then known that silica, on the contrary, produces a weak interaction with vanadium oxide, therefore, V2O5 supported on silica, shows high tendency to agglomerates, during calcination, with the formation of a low dispersed active phase. A TiO2 support with high and thermostable specific surface area can be obtained by coating silica surface with TiO2 [8,9]. Different V2O5 catalysts, supported on TiO2-SiO2 mixed oxides have been prepared, for example, for the selective catalytic reduction of NO with NH3 [10–15]. Quaranta et al. [16] have compared the properties of different catalysts, respectively, prepared by impregnating vanadium acetyl-acetonate, dissolved in ethanol solution, on TiO2-SiO2, TiO2 and SiO2 supports, and their performances in the oxidative dehydrogenation of ethanol to acetaldehyde [16]. The same authors have prepared the support TiO2-SiO2 by coating silica with titania by treating silica with an excess of TiCl3. The obtained support has been used to prepare the corresponding V2O5 impregnated catalyst. Catalyst of the type V2O5/TiO2-SiO2 have shown about the same activity of V2O5/TiO2, but higher selectivity to acetaldehyde. The same authors have also studied the effect of titanium amount in the V2O5/TiO2-SiO2 systems on the oxidative dehydrogenation (ODH) of ethanol [17]. In the present work a TiO2-SiO2 supports have been prepared by a multistep grafting of titanium tetra-isopropoxide on silica following a procedure described in more detail elsewhere [9,18,19]. This support, together with a simple SiO2 support, have been employed in the preparation of V2O5 based catalysts by grafting vanadyl tri-isopropoxide with three different grafting procedures: (a) grafting vanadyl tri-isopropoxide, dissolved in n-hexane, on a TiO2-SiO2 support; (b) grafting vanadyl tri-isopropoxide, dissolved in isopropanol and partially hydrolysed, by a controlled procedure, before grafting on a TiO2-SiO2 support; (c) grafting, directly on uncoated SiO2 support, mixtures of titanium and vanadyl alkoxides, dissolved in isopropanol and submitted to partial hydrolysis, before grafting. Partial hydrolysis of vanadyl tri-isopropoxide, before grafting on TiO2-SiO2 support, has been made with the aim to evaluate the effect of vanadium aggregation on the catalytic performances. On the contrary, the scope of the partial hydrolysis of mixtures of titanium and vanadyl alkoxides was to obtain vanadium–titanium bimetallic alkoxides in isopropanol solution that can be anchored directly on a SiO2 support with an opportune molar ratio between the two metals. In this way, the vanadium based catalyst preparation, having a favourable TiO2 chemical environment, is largely simplified. In the meantime, obtained catalysts resulted more dispersed and more selective in the mentioned reaction. For a useful comparison, some catalysts have also been prepared in a traditional way by impregnation. In this work, the effects of the preparation methods and of the used supports, on the properties and catalytic performances, have been studied and an attempt has been made to correlate the observed properties with the obtained performances. 2 Experimental 2.1 Catalysts and supports preparation methods The TiO2-SiO2 support was prepared with a three steps grafting procedure using titanium isopropoxide, dissolved in toluene, and a commercial SiO2. We have used two different types of commercial silica: (i) a silica Aldrich (450m2 g−1), calcined at 500°C for 2h; (ii) a silica Grace S432 (305m2 g−1), calcined at 500°C for 2h, in one case, and for 8h in another one. The amount of titanium isopropoxide, dissolved in toluene and used in each grafting step, roughly corresponds to a monolayer or to a moderate excess with respect to a monolayer, by assuming a conventional stoichiometry of 1 hydroxyl for 1 alkoxide molecule. Silica, after calcination, at 500°C, for 2–8h, was contacted with the mentioned solution by refluxing, at the boiling point of the solvent, for 6h. Then, the solid has been recovered by filtration, washed with toluene, dried at 100°C, steamed for 2h at 130–190°C for eliminating, by hydrolysis, the residual alkoxide groups from the surface and finally calcined at 500°C. The described procedure has been repeated three times to obtain TiO2-SiO2 support, that is, silica well coated with an amount of TiO2 greater than the one correspondent to a monolayer. Some properties of the obtained silica coated supports are reported in Table 1 . In the same Table are also summarised the differences in both the adopted preparation procedures such as: the type of silica and the amounts of titanium alkoxide used for each grafting step. The amount of grafted titanium was determined after dissolution in concentrated sulphuric acid, by reacting with H2O2, as reported by Snell and Ettre [20]. More details concerning preparation methods, supports properties and amounts of reagents employed are reported in Table 2 and in previous papers [9,18,19]. The density of the OH groups on the silica surface was determined by means of thermogravimetric analysis (TGA) or by electrochemical titrations, as previously reported [9]. Silica supports, coated of titania with the three steps grafting procedure were then contacted with different solutions of vanadyl tri-isopropoxide, dissoved in n-hexane or isopropanol, at room temperature, for 24h, under He atmosphere. After reaction the samples were filtered, washed with the used solvent, dried at 105°C, steamed at 190°C for 2h and calcined, at 500°C, for 2h. Vanadium load was determined by atomic adsorption spectroscopy, after dissolution in concentrated sulphuric acid. In Table 1 a list of all the prepared catalysts is reported, together with the conditions adopted for the preparation, the loading of TiO2 and V2O5 and other properties. In the last column of Table 1 is also reported an index of the vanadium dispersion, corresponding to oxygen uptake for vanadium atom, determined by TPR/TPO with oxygen pulses. The acronyms used for the catalysts are easily interpretable and summarise both the preparation methods and the compositions. We have named, for example: S, SiO2; T, TiO2; TSM and TSM1, Grace silica coated with TiO2 by the three steps grafting procedure and by following two different calcinating procedures: TSMA, Aldrich silica coated with TiO2 by the three steps grafting procedure; H, n-hexane solvent of the precursor; I, isopropanol solvent. Suffix h corresponds to a hydrolysed alkoxide. Catalysts of VH/TSM and VH/TSM1 series, for example, were prepared by grafting vanadyl tri-isopropoxide dissolved in n-hexane on TiO2-SiO2 supports. Catalyst VhI/TSM was prepared by grafting partially hydrolysed vanadyl tri-isopropoxide, dissolved in 2-propanol, on the corresponding support. Hydrolysis was carried out, in this case, by dissolving 1ml of vanadyl tri-isopropoxide in 4ml of 2-propanol and by adding a stoichiometric amount of water (1mol of water/1mol of vanadyl tri-isopropoxide) containing traces of HCl acting as catalyst. The aim was initially to obtain a less dispersed catalysts by favouring through the hydrolysis the aggregation by condensation of the vanadyl tri-isopropoxide molecules but the presence of the parent alcohol largely prevent the condensation reaction. Moreover, the grafting yield in this case is not quantitative always for the influence of the solvent (the parent alcohol) on the grafting equilibrium. As a consequence, small amounts of vanadium oxide (about 1wt.%) are loaded on the support. Catalysts of (V-T)I/S series have been prepared by grafting a bimetallic vanadium–titanium alkoxide, dissolved in isopropanol, directly on SiO2. The bimetallic alkoxide has been obtained in two different ways: by hydrolysing, for example, titanium tetra-isopropoxide with a stoichiometric amount of water and reacting it with vanadyl tri-isopropoxide (Th-V)I/S, or by hydrolysing a mixture of the two alkoxides both dissolved in isopropanol (T-V)hI/S. The molar ratio titanium–vanadium has been kept 12:1 in both cases. For these catalysts the hydrolysis step had the objective to obtain a bimetallic precursor, formed by condensation of the two alkoxide species, that can then be anchored directly on silica surface. Some catalysts have been prepared, at last, in a traditional way by wet impregnation of the support with an ammonium vanadate aqueous solution [21]. The suffix i indicates catalysts prepared by impregnation. To summarise we adopted six different catalysts preparation procedures indicated in Table 2 by (A)–(F). Details about these procedures are reported as follows. (A) The amount of titanium alkoxide reported in Table 2 was dissolved in the solvent and the obtained solution was contacted with the solid under solvent reflux for 6h. The solid was then filtered, washed and dried. This procedure was repeated three times. (B) The amount of solid support reported in Table 2 was contacted with a solution of ammonium metavanadate and oxalic acid (0.25g) and heated. When water was completely evaporated the solid was recovered and calcined at 500°C for 18h. (C) This is the standard grafting procedure. The amount of alkoxide indicated in Table 2 was used to prepare a solution with the reported solvent and this solution was put in contact with the related amount of solid. After the reaction, the solid was filtered, washed, dried, steamed with water vapour at 150°C for 2h and calcined at 500°C for 2h. (D) A partially hydrolysed vanadyl tri-isopropoxide was prepared by a preliminary hydrolysis step in which 1:1 molar ratio of water/alkoxyde was used in the presence of traces of HCl as catalysts. The obtained precursor is then contacted with the reported amount of solid and the preparation proceed as in item (C). (E) Bimetallic precursor have been prepared by previously hydrolysing titanium tetra-isopropoxide with the reported amount of water (molar ratio 1:1), containing traces of HCl, and reacting then with vanadyl tri-isopropoxide. The obtained solution was contacted with the reported amount of solid as for item (C). (F) Bimetallic precursor have been prepared with a procedure similar to that reported at point E but now the hydrolysis has been performed on a mixture of the two different alkoxides of vanadium and titanium dissolved in 2-propanol. A molar ratio of 1:12 for V:Ti was adopted for preparing the mixture and water, containing traces of HCl, was added in order to obtain a molar ratio water/(V+Ti) equal to 1. 2.2 Catalysts and supports characterisation methods The morphological characterisation and elemental composition of the catalyst were carried out by SEM on a JEOL JSM 5600LV instrument coupled with an EDX analyser. XRD patterns were recorded on a X3000 Seifert diffractometer equipped with a lithium fluoride monochromator on the diffracted beam. The scans were collected within the range of 4–44 (2θ) using Mo Kα radiation. Diffuse reflectance spectra were obtained on a UV-Vis scanning spectrophotometer Shimatzu AV2101, equipped with an integrating sphere, using BaSO4 as reference. UV-Vis spectra were recorded in the diffuse reflectance mode (R) and transformed to a magnitude proportional to the extinction coefficient (K) through the Kubelka–Munk function (F(R)). FTIR and DRIFT spectra have been made by using a NICOLET AVATAR 360 instrument. Samples were examined in a DRIFT cell, at room temperature, after the outgassing in vacuum, at 400°C, for 1h. Textural analysis was carried out on a Thermoquest Sorptomatic 1990 Instrument (Fisons Instruments), by determining the nitrogen adsorption/desorption isotherms, at 77K. Before analysis, the samples were heated overnight under vacuum up to 473K (heating rate=1Kmin−1). The specific surface area and pore distributions were determined by using the BET and Dollimore–Heal methods [22,23]. 2.2.1 Catalytic runs All the catalysts were tested in the oxidative dehydrogenation of ethanol to acetaldehyde. The tests were carried out in a continuous flow fixed-bed microreactor, that is, a stainless steel tube of 10 mm inner diameter operating at atmospheric pressure. The explored temperature range was 100–200°C, with a residence time of ethanol normally kept at W/F=26.4gcat h−1 mol of ethanol. The fed reacting mixtures ethanol–oxygen–helium was: ethanol (Fluka 99.9%) 1.1mlh−1 (as liquid), oxygen (SOL 99%) 7.7mlh−1 and helium (SOL 99%) 22mlh−1 as diluent and carrier gas for GC. Reagents and products were analysed by on-line gas chromatograph HP 5890A using a column Restek Rt-Q plot 30 m×0.32 mm. Conversion and selectivities to products were calculated on a carbon atom basis. The conversion corresponds to the ratio between reacted and fed ethanol, while, the selectivities are calculated as ethanol transformed to each product with respect to the total ethanol reacted. 3 Results and discussion All the performed catalytic runs are reported in Table 3 . From these data, reaction rates can be calculated at different temperatures and an estimation of the activation energy can be made. We have found a value falling in the range 16–20kcalmol−1 in agreement with Oyama and Somorjai [2]. As it can be seen from Table 3, acetaldehyde is always the main reaction product. Observed by-products, in order of importance are: acetic acid, acetals and carbon dioxide. Small amounts of ethyl acetate, ethyl ether and ethylene have sometime observed. 3.1 Comparison of the performances of catalysts, respectively, prepared by grafting and impregnation From the data concerning catalytic tests, reported in Table 3, it is possible to observe, first of all, that catalysts prepared by grafting, with high vanadium load, are less active but more selective than the corresponding catalysts prepared by impregnation. This can be appreciated also in Figs. 1 and 2 , where are reported, respectively, the conversion as a function of the temperature, and the selectivity to acetaldehyde, as a function of the ethanol conversion, for catalysts both impregnated and grafted on, respectively, TiO2 and TiO2-SiO2 supports, all containing about the same amount of V2O5, corresponding to 5–6wt.%. 3.2 Effects of dispersion, vanadium load and solvent on the catalysts performances In Fig. 3 , the conversion obtained at different temperatures and the selectivities to acetaldehyde, as a function of the conversion, for different catalysts, all prepared by grafting, are reported. As it can be seen, by comparing the performances of the catalysts VH/TSMA and VH/TSM1, activities roughly increase with the vanadium load. However, also the dispersion (see last column of Table 1) seems to be an important factor in determining catalyst activity, because, catalysts that appear highly dispersed, such as VI/TSM, containing low vanadium charge, can be more active than catalysts containing more vanadium, such as VH/TSM1, but in a less dispersed form. Catalyst VI/TSM allows to point out also the influence of the solvent. The use of the parent alcohol, as a solvent, gives place to low grafting yields for the detrimental effect of the solvent on the grafting equilibrium reaction. However, catalyst prepared in this way have higher dispersion also for the effect of solvation, that is, vanadyl tri-isopropoxide results less aggregated in isopropanol than in n-hexane. By concluding, vanadium load and dispersion are key factors in determining catalytic activity. Despite the strong differences observed in catalytic activities for the catalysts prepared by grafting, selectivities are poorly affected by both vanadium load and dispersion, being the selectivity trend with conversion quite similar for all these catalysts, as it can be appreciated in Fig. 3. A difference in selectivity is, on the contrary, observed by comparing grafted and impregnated catalysts, being selectivity of grafted catalysts significantly higher. 3.3 Influence of the preparation procedure on the catalytic performances In Fig. 4 , the conversions obtained, at different temperatures, and selectivities as a function of conversions, for catalysts containing comparable amounts of vanadia (about 1%), but prepared with different procedures, are compared. As it can be observed, catalysts prepared by grafting, directly on silica, titanium–vanadium bimetallic alkoxide obtained by partial hydrolysis of titanium alkoxide, and then reacted with vanadium alkoxide (catalyst (Th-V)I/S) or by partial hydrolysis of a mixture of the two alkoxides (catalyst (T-V)hI/S), are less active but more selective than the other prepared catalysts. Selectivities shown by these catalysts are also more stable with the conversion than all the other tested catalysts. It is interesting to observe also that the catalyst, prepared by partially hydrolysing vanadyl tri-isopropoxide, dissolved in isopropanol before grafting on TiO2-SiO2 support (VhI/TSM), has an activity that is comparable with the catalyst prepared by grafting vanadyl tri-isopropoxide, dissolved in n-hexane, on the same support. This, probably means that the two mentioned catalysts have similar dispersions, being the aggregation induced by the hydrolysis contrasted by the presence of the parent alcohol, that is, for this reason vanadium alkoxide aggregation by condensation was not achieved. Surface area of TiO2-SiO2 supports remains comparable with that of the original support also after three grafting steps. Pore volumes are, on the contrary, reduced for the appearance of micropores. In all cases, titania phase is largely amorphous with a small portion of crystalline phase in the form of anatase. Specific surface area of the prepared catalysts are reported in Table 1. Supporting vanadia, by both grafting and impregnation, normally gives place to a decrease of the specific surface area, also for a small vanadium charge. Pore distributions, on the contrary are poorly affected by the presence of vanadia on the support. The interpretation of these phenomena is quite difficult because many factors are involved in the different preparation steps. Consider, for example, grafting stoichiometry that can change according the adopted conditions, the steaming procedure and calcination that can give place to a deep surface modification. 3.4 Spectroscopic investigations Spectroscopic investigations of all the mentioned catalysts have been made in other previous works, where, the same catalysts have been used in oxidative dehydrogenation of other molecule such as propane [24] and isobutane [25]. In those papers, the results of the spectroscopic investigations are reported in details, while, the main findings are here simply summarised with a look to the consequences for the specific examined reaction. All the catalysts have shown a diffraction spectra quite similar to that of the support. However, we have never observed the presence of crystalline V2O5. The support is mainly constituted by an amorphous part. Catalysts prepared by grafting vanadium from n-hexane solvent, on titania–silica supports, show the same morphological features observed on the corresponding supports. Grafted vanadium species are then supposed to be highly dispersed on the carriers. On the contrary, on catalysts of (V-T)I/S series, prepared by grafting bimetallic titanium–vanadium alkoxide directly on silica, has been noticed the presence of amorphous aggregates composed, according to EDX analysis, mainly of titanium and vanadium, while, vanadium is never present on the silica surface. FTIR and DRIFT spectra have been collected for many supports and catalysts reported in Table 1. The absence of crystalline V2O5 is confirmed, because, the corresponding band, at 1020cm−1, is never observed, while absorption at 960–990cm−1 confirms the formation of polyvanadylic species, of low nuclearity, also at low vanadium charge [26]. The original SiO2 support shows an intense band of absorption at 3747cm−1 corresponding to isolated silanol groups Si–OH [27,28]. This peak completely disappears as a consequence of the titanium alkoxide grafting. The spectrum for (T-V)hI/S and (Th-V)I/S shows many silanol groups, in agreement with the fact that, in this case, a bimetallic alkoxide of vanadium and titanium is directly grafted on silica, without forming a monolayer. Some useful information can be derived from the observation of the V–O–V absorption bands, in the range 550–800cm−1, corresponding to an increase of the aggregation degree and a consequent decrease of the V2O5 dispersion. Absorption bands of this type have been observed for all the catalysts of VH/TSM, VH/TSM1 and VhI/TSM type. For catalysts obtained from bimetallic precursors, subjected to hydrolysis (such as: (V-T)hI/S, (Vh-T)I/S), polyvanadylic V–O–V absorption bands completely disappear. This means the presence of isolated monovanadylic species and conversely a prevalence of V–O–Ti bonds with respect to V–O–V ones. 3.5 Correlation between catalyst properties and catalytic behaviour All the prepared catalysts have been tested in the ODH of ethanol, giving place to significant differences of both activities and selectivities. The group of catalysts prepared, for example, by grafting different amounts of vanadyl tri-isopropoxide, dissolved in n-hexane, on a support of silica coated with an amount of TiO2 greater than a monolayer, give place to almost quantitative grafting reaction (see catalysts of VH/TSM1 and VH/TSM type reported in Table 1). The activities of these catalysts resulted roughly related to the vanadium content, as it can be seen from Fig. 3. This behaviour suggests a good dispersion for all the catalysts prepared by grafting. This is not contradictory with the DRIFT analyses of these catalysts showing the presence of polyvanadylic groups, because, it is well known the tendency of V2O5 to give monolayered structures on TiO2 surfaces [29], until to reach a complete coverage. The apolar solvent n-hexane, favours the molecular aggregation giving place, at least, to a dimeric structure [30]. Activities to acetaldehyde of these catalysts are lower than the ones shown by impregnated catalysts, while selectivities are higher. This means that in general dispersion has a positive effect on selectivity giving place to uniform active sites that are more selective even less active. This is confirmed by the behaviour of the catalysts prepared by grafting vanadium–titanium bimetallic alkoxides, dissolved in isopropanol, directly on silica, and prepared by partial hydrolysis (catalysts (Th-V)I/S and (V-T)hI/S). Both catalysts have the same behaviour, probably because, the vanadium–titanium bimetallic alkoxide precursor formed is the same. Titanium alkoxide reacts more fastly than vanadium alkoxide giving place to mononuclear specie Ti(OR)3OH. This, can react with vanadyl tri-isopropoxide giving a bimetallic alkoxide. It is interesting to point out that the most selective catalysts (Th-V)I/S and (V-T)hI/S do not show, at the DRIFT analysis, the presence of polyvanadylic groups in the wave number range 550–800cm−1, while, these groups are present for both VH/TSM and VhI/TSM catalysts. This can be interpreted with the formation of isolated vanadium oxide groups directly bounded to titanium oxide grafted on the silica support. Therefore, the prevalence of V–O–Ti bonds in these catalysts with respect to V–O–V bonds in the others, could be the reason of the observed highest selectivity. 4 Conclusions We have confirmed that TiO2 chemical environment has a positive effect in the ODH of ethanol to acetaldehyde also for catalyst prepared by grafting. A new preparation method of vanadium based catalysts with a TiO2 favourable environment has been realised in this work. The adopted preparation route related to catalysts (Th-V)I/S and (V-T)hI/S, is simpler and cheaper not requiring the long and expensive procedure of three steps grafting of titanium alkoxide on silica. Surprisingly, with this procedure we obtained also a remarkable improvement in the selectivity of the oxidative dehydrogenation of ethanol to acetaldehyde. An attempt has been made in order to explain the increase of the observed selectivities on the basis of catalysts properties and adopted preparation procedures. Acknowledgements Thanks are due to MIUR for the financial support. References [1] G.C Bond S Flamerz Appl. Catal. 33 1987 219 [2] S.T Oyama G.A Somorjai J. Phys. Chem. 94 1990 5022 5028 [3] L Wang K Eguchi H Arai T Seiyama Chem. Lett. 7 1986 1173 1176 [4] N.Kh Allakhverdova K.Yu Adzhamov T Alkhazov Kinet. Katal. 33 1992 261 [5] A. Van Hengstum, J.G. van Ommen, H. Bosch, P.J. Gellings, in: Proceedings of the 8th International Congress on Catalysis, vol. 4, Berlin, 1984, Verlag Chemie, Weinheim, 1984, p. 297. [6] D.J Cole C.F Cullis D.J Hucknall J. Chem. Soc., Faraday Trans. I 72 1976 2744 [7] M Gasior I Gasior B Grzybowska Appl. Catal. 10 1984 87 [8] E.T.C Vogt A Boot A.J van Dillen J.W Geus F.J.J.G Janssen F.M.G van der Kerkhof J. Catal. 114 1988 313 [9] P Iengo G Aprile M Di Serio D Gazzoli E Santacesaria Appl. Catal. 178 1999 97 109 [10] M.G Reichmann A.T Bell Langmuir 3 1987 111 [11] M.G Reichmann A.T Bell Appl. Catal. 32 1987 315 [12] R.A Rajadhyaksha G Hausinger H Zeilinger A Ramstetter H Schmelz H Knozinger Appl. Catal. 51 1989 67 [13] P Wathoz M Ruwet T Machej P Grange Appl. Catal. 69 1991 149 [14] M Galan-Fereres R Mariscal L.J Alemany J.L.G Fierro J.A Anderson J. Chem. Soc., Faraday Trans. 90 1994 3711 [15] M Galan-Fereres L.J Alemany R Mariscal M.A Bañares J.A Anderson J.L.G Fierro Chem. Mater. 7 1995 1342 [16] N.E Quaranta V Cortés Corberán J.L.G Fierro Stud. Surf. Sci. Catal. 72 1992 147 [17] N.E Quaranta V Cortés Corberán J.L.G Fierro J. Catal. 171 1997 1 [18] A Sorrentino S Rega D Sannino A Magliano P Ciambelli E Santacesaria Appl. Catal. A: Gen. 5350 2000 1 13 [19] R. Monaci, E. Rombi, V. Solinas, A. Sorrentino, E. Santacesaria, G. Colon, Appl. Catal. A: Gen. (2001) 203–212. [20] F.R.D. Snell, L.S. Ettre, Encyclopedia of Industrial Chemical Analysis, vol. 19, Interscience, New York, 1974, pp. 107–109. [21] R.A Rajadhyaksha G Hausinger H Zeilinger A Ramstetter H Schmelz H Knozinger Appl. Catal. 51 1989 67 79 [22] S Brunauer P.H Emmet E Teller J. Am. Chem. Soc. 60 1938 309 [23] D Dollimore G.R Heal J. Appl. Chem. 14 1964 109 [24] A Comite A Sorrentino G Capannelli M Di Serio R Tesser E Santacesaria J. Mol. Catal. A: Chem. 198 2003 151 165 [25] V. Iannazzo, G. Neri, S. Galvagno, M. Di Serio, R. Tesser, E. Santacesaria, Appl. Catal. A: Gen., 2003, in press. [26] G.T Went L.-J Leu A.T Bell J. Catal. 134 1992 479 491 [27] E Astorino J.B Peri R.J Wiley G Busca J. Catal. 157 1995 482 [28] C.U.I Odenbrand S.L.T Andersson L.A.H Andersson J.G.M Brandin G Busca J. Catal. 125 1990 541 [29] G.C Bond Appl. Catal. A: Gen. 157 1997 91 103 [30] D.C. Bradley, R.C. Merothra, D.P. Gaur, Metal Alkoxides, Academic Press, New York, 1978.",
      "scopus-id": "0041836318",
      "coredata": {
        "eid": "1-s2.0-S1381116903003455",
        "dc:description": "Oxidative dehydrogenation of ethanol to acetaldehyde has been performed on vanadium based catalysts prepared by grafting on titania–silica supports with different procedures. A comparison of the performances of the prepared catalysts in terms of activity and selectivity has been made. Grafting technique gives place to well dispersed catalysts that resulted more selective than catalysts prepared by impregnation. In particular, very selective catalysts have been obtained by grafting vanadium–titanium bimetallic alkoxides directly on silica support. The effect of both the preparation methods and the used supports on the catalytic performances have been studied and an attempt to correlate the observed properties with the obtained results has been made.",
        "openArchiveArticle": "false",
        "prism:coverDate": "2003-09-15",
        "openaccessUserLicense": null,
        "prism:aggregationType": "Journal",
        "prism:url": "https://api.elsevier.com/content/article/pii/S1381116903003455",
        "dc:creator": [
          {
            "@_fa": "true",
            "$": "Santacesaria, E"
          },
          {
            "@_fa": "true",
            "$": "Sorrentino, A"
          },
          {
            "@_fa": "true",
            "$": "Tesser, R"
          },
          {
            "@_fa": "true",
            "$": "Di Serio, M"
          },
          {
            "@_fa": "true",
            "$": "Ruggiero, A"
          }
        ],
        "link": [
          {
            "@_fa": "true",
            "@rel": "self",
            "@href": "https://api.elsevier.com/content/article/pii/S1381116903003455"
          },
          {
            "@_fa": "true",
            "@rel": "scidir",
            "@href": "https://www.sciencedirect.com/science/article/pii/S1381116903003455"
          }
        ],
        "dc:format": "application/json",
        "openaccessType": null,
        "pii": "S1381-1169(03)00345-5",
        "prism:volume": "204",
        "prism:publisher": "Elsevier Science B.V.",
        "dc:title": "Oxidative dehydrogenation of ethanol to acetaldehyde on V2O5/TiO2-SiO2 catalysts obtained by grafting vanadium and titanium alkoxides on silica",
        "prism:copyright": "Copyright © 2003 Elsevier Science B.V. All rights reserved.",
        "prism:issueName": "In honour of Prof. R. Ugo on the occasion of his 65th. Birthday",
        "openaccess": "0",
        "prism:issn": "13811169",
        "dcterms:subject": [
          {
            "@_fa": "true",
            "$": "Catalyst preparation"
          },
          {
            "@_fa": "true",
            "$": "Grafting alkoxides"
          },
          {
            "@_fa": "true",
            "$": "Vanadium"
          },
          {
            "@_fa": "true",
            "$": "Ethanol oxidative dehydrogenation"
          }
        ],
        "openaccessArticle": "false",
        "prism:publicationName": "Journal of Molecular Catalysis A: Chemical",
        "openaccessSponsorType": null,
        "prism:pageRange": "617-627",
        "prism:endingPage": "627",
        "pubType": "fla",
        "prism:coverDisplayDate": "15 September 2003",
        "prism:doi": "10.1016/S1381-1169(03)00345-5",
        "prism:startingPage": "617",
        "dc:identifier": "doi:10.1016/S1381-1169(03)00345-5",
        "openaccessSponsorName": null
      },
      "objects": {
        "object": [
          {
            "@category": "thumbnail",
            "@height": "11",
            "@width": "85",
            "@_fa": "true",
            "$": "https://api.elsevier.com/content/object/eid/1-s2.0-S1381116903003455-si1.gif?httpAccept=%2A%2F%2A",
            "@multimediatype": "GIF image file",
            "@type": "ALTIMG",
            "@size": "413",
            "@ref": "si1",
            "@mimetype": "image/gif"
          },
          {
            "@category": "thumbnail",
            "@height": "57",
            "@width": "125",
            "@_fa": "true",
            "$": "https://api.elsevier.com/content/object/eid/1-s2.0-S1381116903003455-fx1.sml?httpAccept=%2A%2F%2A",
            "@multimediatype": "GIF image file",
            "@type": "IMAGE-THUMBNAIL",
            "@size": "2022",
            "@ref": "fx1",
            "@mimetype": "image/gif"
          },
          {
            "@category": "standard",
            "@height": "156",
            "@width": "345",
            "@_fa": "true",
            "$": "https://api.elsevier.com/content/object/eid/1-s2.0-S1381116903003455-fx1.jpg?httpAccept=%2A%2F%2A",
            "@multimediatype": "JPEG image file",
            "@type": "IMAGE-DOWNSAMPLED",
            "@size": "22530",
            "@ref": "fx1",
            "@mimetype": "image/jpeg"
          },
          {
            "@category": "thumbnail",
            "@height": "70",
            "@width": "125",
            "@_fa": "true",
            "$": "https://api.elsevier.com/content/object/eid/1-s2.0-S1381116903003455-gr1.sml?httpAccept=%2A%2F%2A",
            "@multimediatype": "GIF image file",
            "@type": "IMAGE-THUMBNAIL",
            "@size": "1621",
            "@ref": "gr1",
            "@mimetype": "image/gif"
          },
          {
            "@category": "standard",
            "@height": "236",
            "@width": "423",
            "@_fa": "true",
            "$": "https://api.elsevier.com/content/object/eid/1-s2.0-S1381116903003455-gr1.gif?httpAccept=%2A%2F%2A",
            "@multimediatype": "GIF image file",
            "@type": "IMAGE-DOWNSAMPLED",
            "@size": "8519",
            "@ref": "gr1",
            "@mimetype": "image/gif"
          },
          {
            "@category": "thumbnail",
            "@height": "73",
            "@width": "125",
            "@_fa": "true",
            "$": "https://api.elsevier.com/content/object/eid/1-s2.0-S1381116903003455-gr2.sml?httpAccept=%2A%2F%2A",
            "@multimediatype": "GIF image file",
            "@type": "IMAGE-THUMBNAIL",
            "@size": "1684",
            "@ref": "gr2",
            "@mimetype": "image/gif"
          },
          {
            "@category": "standard",
            "@height": "239",
            "@width": "409",
            "@_fa": "true",
            "$": "https://api.elsevier.com/content/object/eid/1-s2.0-S1381116903003455-gr2.gif?httpAccept=%2A%2F%2A",
            "@multimediatype": "GIF image file",
            "@type": "IMAGE-DOWNSAMPLED",
            "@size": "8291",
            "@ref": "gr2",
            "@mimetype": "image/gif"
          },
          {
            "@category": "thumbnail",
            "@height": "94",
            "@width": "119",
            "@_fa": "true",
            "$": "https://api.elsevier.com/content/object/eid/1-s2.0-S1381116903003455-gr3.sml?httpAccept=%2A%2F%2A",
            "@multimediatype": "GIF image file",
            "@type": "IMAGE-THUMBNAIL",
            "@size": "2261",
            "@ref": "gr3",
            "@mimetype": "image/gif"
          },
          {
            "@category": "standard",
            "@height": "340",
            "@width": "432",
            "@_fa": "true",
            "$": "https://api.elsevier.com/content/object/eid/1-s2.0-S1381116903003455-gr3.gif?httpAccept=%2A%2F%2A",
            "@multimediatype": "GIF image file",
            "@type": "IMAGE-DOWNSAMPLED",
            "@size": "13815",
            "@ref": "gr3",
            "@mimetype": "image/gif"
          },
          {
            "@category": "thumbnail",
            "@height": "94",
            "@width": "119",
            "@_fa": "true",
            "$": "https://api.elsevier.com/content/object/eid/1-s2.0-S1381116903003455-gr4.sml?httpAccept=%2A%2F%2A",
            "@multimediatype": "GIF image file",
            "@type": "IMAGE-THUMBNAIL",
            "@size": "2232",
            "@ref": "gr4",
            "@mimetype": "image/gif"
          },
          {
            "@category": "standard",
            "@height": "358",
            "@width": "455",
            "@_fa": "true",
            "$": "https://api.elsevier.com/content/object/eid/1-s2.0-S1381116903003455-gr4.gif?httpAccept=%2A%2F%2A",
            "@multimediatype": "GIF image file",
            "@type": "IMAGE-DOWNSAMPLED",
            "@size": "14566",
            "@ref": "gr4",
            "@mimetype": "image/gif"
          }
        ]
      },
      "link": {
        "@rel": "abstract",
        "@href": "https://api.elsevier.com/content/abstract/scopus_id/0041836318"
      }
    }
  }
}