{
  "metadata": {
    "title": "Propane conversion over a H-ZSM5 acid catalyst: Part 1. Observed kinetics",
    "authors": "; ; ",
    "journal": "Journal of Molecular Catalysis A: Chemical",
    "date": "2004-07-01",
    "doi": "10.1016/j.molcata.2004.02.015",
    "abstract": "",
    "uri": "https://api.elsevier.com/content/article/pii/S138111690400113X",
    "pii": "S138111690400113X"
  },
  "fulltext": {
    "full-text-retrieval-response": {
      "scopus-eid": "2-s2.0-2342519357",
      "originalText": "serial JL 271358 291210 291744 291790 291809 31 Journal of Molecular Catalysis A: Chemical JOURNALMOLECULARCATALYSISACHEMICAL 2004-04-13 2004-04-13 2010-03-28T13:36:59 1-s2.0-S138111690400113X S1381-1169(04)00113-X S138111690400113X 10.1016/j.molcata.2004.02.015 S300 S300.1 FULL-TEXT 1-s2.0-S1381116900X01884 2015-05-15T05:56:32.920819-04:00 0 0 20040701 2004 2004-04-13T00:00:00Z articleinfo crossmark dco dateupdated tomb dateloaded datesearch indexeddate issuelist volumelist yearnav absattachment articletitlenorm authfirstinitialnorm authfirstsurnamenorm cid cids contenttype copyright dateloadedtxt docsubtype doctype doi eid ewtransactionid hubeid issfirst issn issnnorm itemstage itemtransactionid itemweight openaccess openarchive pg pgfirst pglast pii piinorm pubdatestart pubdatetxt pubyr sortorder srctitle srctitlenorm srctype subheadings volfirst volissue webpdf webpdfpagecount figure table body acknowledge affil articletitle auth authfirstini authfull authkeywords authlast primabst ref specialabst alllist content subj ssids 1381-1169 13811169 216 216 1 1 Volume 216, Issue 1 18 131 137 131 137 20040701 1 July 2004 2004-07-01 2004 converted-article fla Copyright © 2004 Elsevier B.V. All rights reserved. PROPANECONVERSIONOVERAHZSM5ACIDCATALYST WANG X 1 Introduction 2 Experimental 3 Results and discussion 4 Conclusions Acknowledgements References JENTOFT 1997 1 13 F BANDIERA 1990 309 316 J KWAK 1994 456 463 B KRANNILA 1992 115 124 H NARBESHUBER 1995 388 395 T NARBESHUBER 1997 127 136 T BANDIERA 1997 283 300 J RUDHAM 1995 1689 1794 R IVANOVA 1999 107 116 I WANGX2004X131 WANGX2004X131X137 WANGX2004X131XX WANGX2004X131X137XX item S1381-1169(04)00113-X S138111690400113X 1-s2.0-S138111690400113X 10.1016/j.molcata.2004.02.015 271358 2010-10-15T16:14:09.980791-04:00 2004-07-01 1-s2.0-S138111690400113X-main.pdf https://s3.amazonaws.com/prod-ucs-content-store-us-east/content/pii:S138111690400113X/MAIN/application/pdf/be0f6fed6ba5d8c9371fdf2911e5d15f/main.pdf https://s3-eu-west-1.amazonaws.com/prod-ucs-content-store-eu-west/content/pii:S138111690400113X/MAIN/application/pdf/be0f6fed6ba5d8c9371fdf2911e5d15f/main.pdf main.pdf pdf true 163181 MAIN 7 1-s2.0-S138111690400113X-main_1.png https://s3.amazonaws.com/prod-ucs-content-store-us-east/content/pii:S138111690400113X/PREVIEW/image/png/89ee5b30dc59a5fca79a977afcf29a37/main_1.png https://s3-eu-west-1.amazonaws.com/prod-ucs-content-store-eu-west/content/pii:S138111690400113X/PREVIEW/image/png/89ee5b30dc59a5fca79a977afcf29a37/main_1.png main_1.png png 66892 849 656 IMAGE-WEB-PDF 1 1-s2.0-S138111690400113X-si9.gif https://s3.amazonaws.com/prod-ucs-content-store-us-east/content/pii:S138111690400113X/STRIPIN/image/gif/9b8918077df25a9a3696076ec1601552/si9.gif https://s3-eu-west-1.amazonaws.com/prod-ucs-content-store-eu-west/content/pii:S138111690400113X/STRIPIN/image/gif/9b8918077df25a9a3696076ec1601552/si9.gif si9 si9.gif gif 756 20 216 ALTIMG 1-s2.0-S138111690400113X-si8.gif https://s3.amazonaws.com/prod-ucs-content-store-us-east/content/pii:S138111690400113X/STRIPIN/image/gif/b7b74e3082e9c716dae442514fae1849/si8.gif https://s3-eu-west-1.amazonaws.com/prod-ucs-content-store-eu-west/content/pii:S138111690400113X/STRIPIN/image/gif/b7b74e3082e9c716dae442514fae1849/si8.gif si8 si8.gif gif 642 20 180 ALTIMG 1-s2.0-S138111690400113X-si7.gif https://s3.amazonaws.com/prod-ucs-content-store-us-east/content/pii:S138111690400113X/STRIPIN/image/gif/f5e3af9466b3a6889be4a563a36dff45/si2.gif https://s3-eu-west-1.amazonaws.com/prod-ucs-content-store-eu-west/content/pii:S138111690400113X/STRIPIN/image/gif/f5e3af9466b3a6889be4a563a36dff45/si2.gif si7 si7.gif gif 192 14 25 ALTIMG 1-s2.0-S138111690400113X-si6.gif https://s3.amazonaws.com/prod-ucs-content-store-us-east/content/pii:S138111690400113X/STRIPIN/image/gif/6febb5a255c816acb0459b30fba2bf01/si6.gif https://s3-eu-west-1.amazonaws.com/prod-ucs-content-store-eu-west/content/pii:S138111690400113X/STRIPIN/image/gif/6febb5a255c816acb0459b30fba2bf01/si6.gif si6 si6.gif gif 658 13 166 ALTIMG 1-s2.0-S138111690400113X-si5.gif https://s3.amazonaws.com/prod-ucs-content-store-us-east/content/pii:S138111690400113X/STRIPIN/image/gif/7999f05535bb3129bf0e6e187b9a4daa/si5.gif https://s3-eu-west-1.amazonaws.com/prod-ucs-content-store-eu-west/content/pii:S138111690400113X/STRIPIN/image/gif/7999f05535bb3129bf0e6e187b9a4daa/si5.gif si5 si5.gif gif 634 13 160 ALTIMG 1-s2.0-S138111690400113X-si4.gif https://s3.amazonaws.com/prod-ucs-content-store-us-east/content/pii:S138111690400113X/STRIPIN/image/gif/85722ade4ce674549bea62059616146e/si4.gif https://s3-eu-west-1.amazonaws.com/prod-ucs-content-store-eu-west/content/pii:S138111690400113X/STRIPIN/image/gif/85722ade4ce674549bea62059616146e/si4.gif si4 si4.gif gif 2089 37 456 ALTIMG 1-s2.0-S138111690400113X-si3.gif https://s3.amazonaws.com/prod-ucs-content-store-us-east/content/pii:S138111690400113X/STRIPIN/image/gif/f5e3af9466b3a6889be4a563a36dff45/si2.gif https://s3-eu-west-1.amazonaws.com/prod-ucs-content-store-eu-west/content/pii:S138111690400113X/STRIPIN/image/gif/f5e3af9466b3a6889be4a563a36dff45/si2.gif si3 si3.gif gif 192 14 25 ALTIMG 1-s2.0-S138111690400113X-si2.gif https://s3.amazonaws.com/prod-ucs-content-store-us-east/content/pii:S138111690400113X/STRIPIN/image/gif/f5e3af9466b3a6889be4a563a36dff45/si2.gif https://s3-eu-west-1.amazonaws.com/prod-ucs-content-store-eu-west/content/pii:S138111690400113X/STRIPIN/image/gif/f5e3af9466b3a6889be4a563a36dff45/si2.gif si2 si2.gif gif 192 14 25 ALTIMG 1-s2.0-S138111690400113X-si15.gif https://s3.amazonaws.com/prod-ucs-content-store-us-east/content/pii:S138111690400113X/STRIPIN/image/gif/754e92be86b827102fca0f11a1d215a3/si15.gif https://s3-eu-west-1.amazonaws.com/prod-ucs-content-store-eu-west/content/pii:S138111690400113X/STRIPIN/image/gif/754e92be86b827102fca0f11a1d215a3/si15.gif si15 si15.gif gif 812 22 212 ALTIMG 1-s2.0-S138111690400113X-si14.gif https://s3.amazonaws.com/prod-ucs-content-store-us-east/content/pii:S138111690400113X/STRIPIN/image/gif/4a0c237c8eee642ebe544cf68eba720a/si14.gif https://s3-eu-west-1.amazonaws.com/prod-ucs-content-store-eu-west/content/pii:S138111690400113X/STRIPIN/image/gif/4a0c237c8eee642ebe544cf68eba720a/si14.gif si14 si14.gif gif 804 22 206 ALTIMG 1-s2.0-S138111690400113X-si13.gif https://s3.amazonaws.com/prod-ucs-content-store-us-east/content/pii:S138111690400113X/STRIPIN/image/gif/432e73f61b381fcf458d7b3fb78eb8fa/si13.gif https://s3-eu-west-1.amazonaws.com/prod-ucs-content-store-eu-west/content/pii:S138111690400113X/STRIPIN/image/gif/432e73f61b381fcf458d7b3fb78eb8fa/si13.gif si13 si13.gif gif 540 19 124 ALTIMG 1-s2.0-S138111690400113X-si12.gif https://s3.amazonaws.com/prod-ucs-content-store-us-east/content/pii:S138111690400113X/STRIPIN/image/gif/d53f1b8d66a316eb6ba0d6a07593e906/si12.gif https://s3-eu-west-1.amazonaws.com/prod-ucs-content-store-eu-west/content/pii:S138111690400113X/STRIPIN/image/gif/d53f1b8d66a316eb6ba0d6a07593e906/si12.gif si12 si12.gif gif 627 21 162 ALTIMG 1-s2.0-S138111690400113X-si11.gif https://s3.amazonaws.com/prod-ucs-content-store-us-east/content/pii:S138111690400113X/STRIPIN/image/gif/6ddd0767cf7fc3a379474a6c6f7b7fd7/si11.gif https://s3-eu-west-1.amazonaws.com/prod-ucs-content-store-eu-west/content/pii:S138111690400113X/STRIPIN/image/gif/6ddd0767cf7fc3a379474a6c6f7b7fd7/si11.gif si11 si11.gif gif 729 20 207 ALTIMG 1-s2.0-S138111690400113X-si10.gif https://s3.amazonaws.com/prod-ucs-content-store-us-east/content/pii:S138111690400113X/STRIPIN/image/gif/c39486ad9b11c41c5dacc5c535cb857a/si10.gif https://s3-eu-west-1.amazonaws.com/prod-ucs-content-store-eu-west/content/pii:S138111690400113X/STRIPIN/image/gif/c39486ad9b11c41c5dacc5c535cb857a/si10.gif si10 si10.gif gif 855 21 252 ALTIMG 1-s2.0-S138111690400113X-si1.gif https://s3.amazonaws.com/prod-ucs-content-store-us-east/content/pii:S138111690400113X/STRIPIN/image/gif/f5e3af9466b3a6889be4a563a36dff45/si2.gif https://s3-eu-west-1.amazonaws.com/prod-ucs-content-store-eu-west/content/pii:S138111690400113X/STRIPIN/image/gif/f5e3af9466b3a6889be4a563a36dff45/si2.gif si1 si1.gif gif 192 14 25 ALTIMG 1-s2.0-S138111690400113X-fx1.sml https://s3.amazonaws.com/prod-ucs-content-store-us-east/content/pii:S138111690400113X/fx1/THUMBNAIL/image/gif/86b336d401914c83c7fd3238ee2b1f5f/fx1.sml https://s3-eu-west-1.amazonaws.com/prod-ucs-content-store-eu-west/content/pii:S138111690400113X/fx1/THUMBNAIL/image/gif/86b336d401914c83c7fd3238ee2b1f5f/fx1.sml fx1 true fx1.sml sml 1022 91 125 IMAGE-THUMBNAIL 1-s2.0-S138111690400113X-fx1.gif https://s3.amazonaws.com/prod-ucs-content-store-us-east/content/pii:S138111690400113X/fx1/DOWNSAMPLED/image/gif/533f16b8d12065d8747d49c17f92de59/fx1.gif https://s3-eu-west-1.amazonaws.com/prod-ucs-content-store-eu-west/content/pii:S138111690400113X/fx1/DOWNSAMPLED/image/gif/533f16b8d12065d8747d49c17f92de59/fx1.gif fx1 true fx1.gif gif 2588 182 249 IMAGE-DOWNSAMPLED 1-s2.0-S138111690400113X-gr1.sml https://s3.amazonaws.com/prod-ucs-content-store-us-east/content/pii:S138111690400113X/gr1/THUMBNAIL/image/gif/ea79639d2799d455bd1baa66bcc3f749/gr1.sml https://s3-eu-west-1.amazonaws.com/prod-ucs-content-store-eu-west/content/pii:S138111690400113X/gr1/THUMBNAIL/image/gif/ea79639d2799d455bd1baa66bcc3f749/gr1.sml gr1 gr1.sml sml 2756 94 124 IMAGE-THUMBNAIL 1-s2.0-S138111690400113X-gr1.jpg https://s3.amazonaws.com/prod-ucs-content-store-us-east/content/pii:S138111690400113X/gr1/DOWNSAMPLED/image/jpeg/ee8619993f83a43491f74cd8f515dab6/gr1.jpg https://s3-eu-west-1.amazonaws.com/prod-ucs-content-store-eu-west/content/pii:S138111690400113X/gr1/DOWNSAMPLED/image/jpeg/ee8619993f83a43491f74cd8f515dab6/gr1.jpg gr1 gr1.jpg jpg 31653 273 362 IMAGE-DOWNSAMPLED 1-s2.0-S138111690400113X-gr2.sml https://s3.amazonaws.com/prod-ucs-content-store-us-east/content/pii:S138111690400113X/gr2/THUMBNAIL/image/gif/bfb399262677821b046da15018f2aefb/gr2.sml https://s3-eu-west-1.amazonaws.com/prod-ucs-content-store-eu-west/content/pii:S138111690400113X/gr2/THUMBNAIL/image/gif/bfb399262677821b046da15018f2aefb/gr2.sml gr2 gr2.sml sml 2948 86 125 IMAGE-THUMBNAIL 1-s2.0-S138111690400113X-gr2.gif https://s3.amazonaws.com/prod-ucs-content-store-us-east/content/pii:S138111690400113X/gr2/DOWNSAMPLED/image/gif/e1f82d5215f3660841f1de4da95582f4/gr2.gif https://s3-eu-west-1.amazonaws.com/prod-ucs-content-store-eu-west/content/pii:S138111690400113X/gr2/DOWNSAMPLED/image/gif/e1f82d5215f3660841f1de4da95582f4/gr2.gif gr2 gr2.gif gif 18201 319 465 IMAGE-DOWNSAMPLED 1-s2.0-S138111690400113X-gr3.sml https://s3.amazonaws.com/prod-ucs-content-store-us-east/content/pii:S138111690400113X/gr3/THUMBNAIL/image/gif/97c0850e80451f4baab3547fc97dc359/gr3.sml https://s3-eu-west-1.amazonaws.com/prod-ucs-content-store-eu-west/content/pii:S138111690400113X/gr3/THUMBNAIL/image/gif/97c0850e80451f4baab3547fc97dc359/gr3.sml gr3 gr3.sml sml 1982 93 113 IMAGE-THUMBNAIL 1-s2.0-S138111690400113X-gr3.gif https://s3.amazonaws.com/prod-ucs-content-store-us-east/content/pii:S138111690400113X/gr3/DOWNSAMPLED/image/gif/9c6405dfa279514dab981858b6b20ff9/gr3.gif https://s3-eu-west-1.amazonaws.com/prod-ucs-content-store-eu-west/content/pii:S138111690400113X/gr3/DOWNSAMPLED/image/gif/9c6405dfa279514dab981858b6b20ff9/gr3.gif gr3 gr3.gif gif 3732 182 221 IMAGE-DOWNSAMPLED 1-s2.0-S138111690400113X-gr4.sml https://s3.amazonaws.com/prod-ucs-content-store-us-east/content/pii:S138111690400113X/gr4/THUMBNAIL/image/gif/2d2555fcc7728aad8a5c6c54502c37b6/gr4.sml https://s3-eu-west-1.amazonaws.com/prod-ucs-content-store-eu-west/content/pii:S138111690400113X/gr4/THUMBNAIL/image/gif/2d2555fcc7728aad8a5c6c54502c37b6/gr4.sml gr4 gr4.sml sml 2196 91 125 IMAGE-THUMBNAIL 1-s2.0-S138111690400113X-gr4.gif https://s3.amazonaws.com/prod-ucs-content-store-us-east/content/pii:S138111690400113X/gr4/DOWNSAMPLED/image/gif/9ddcf976efbc785b9148fe07834934ef/gr4.gif https://s3-eu-west-1.amazonaws.com/prod-ucs-content-store-eu-west/content/pii:S138111690400113X/gr4/DOWNSAMPLED/image/gif/9ddcf976efbc785b9148fe07834934ef/gr4.gif gr4 gr4.gif gif 3660 151 207 IMAGE-DOWNSAMPLED 1-s2.0-S138111690400113X-gr5.sml https://s3.amazonaws.com/prod-ucs-content-store-us-east/content/pii:S138111690400113X/gr5/THUMBNAIL/image/gif/251811c78355c7060788e5e28488482e/gr5.sml https://s3-eu-west-1.amazonaws.com/prod-ucs-content-store-eu-west/content/pii:S138111690400113X/gr5/THUMBNAIL/image/gif/251811c78355c7060788e5e28488482e/gr5.sml gr5 gr5.sml sml 1960 93 123 IMAGE-THUMBNAIL 1-s2.0-S138111690400113X-gr5.gif https://s3.amazonaws.com/prod-ucs-content-store-us-east/content/pii:S138111690400113X/gr5/DOWNSAMPLED/image/gif/994ee3a6e9635c3b63ee966f5abc36f1/gr5.gif https://s3-eu-west-1.amazonaws.com/prod-ucs-content-store-eu-west/content/pii:S138111690400113X/gr5/DOWNSAMPLED/image/gif/994ee3a6e9635c3b63ee966f5abc36f1/gr5.gif gr5 gr5.gif gif 3217 164 216 IMAGE-DOWNSAMPLED 1-s2.0-S138111690400113X-gr6.sml https://s3.amazonaws.com/prod-ucs-content-store-us-east/content/pii:S138111690400113X/gr6/THUMBNAIL/image/gif/09f2e950dd8df0189080895cd9ef3bcf/gr6.sml https://s3-eu-west-1.amazonaws.com/prod-ucs-content-store-eu-west/content/pii:S138111690400113X/gr6/THUMBNAIL/image/gif/09f2e950dd8df0189080895cd9ef3bcf/gr6.sml gr6 gr6.sml sml 1857 93 113 IMAGE-THUMBNAIL 1-s2.0-S138111690400113X-gr6.gif https://s3.amazonaws.com/prod-ucs-content-store-us-east/content/pii:S138111690400113X/gr6/DOWNSAMPLED/image/gif/53d5428090f07398d0bf29b34eef1cff/gr6.gif https://s3-eu-west-1.amazonaws.com/prod-ucs-content-store-eu-west/content/pii:S138111690400113X/gr6/DOWNSAMPLED/image/gif/53d5428090f07398d0bf29b34eef1cff/gr6.gif gr6 gr6.gif gif 3161 167 203 IMAGE-DOWNSAMPLED 1-s2.0-S138111690400113X-gr7.sml https://s3.amazonaws.com/prod-ucs-content-store-us-east/content/pii:S138111690400113X/gr7/THUMBNAIL/image/gif/4607ce887b4555d93462226fa43f652f/gr7.sml https://s3-eu-west-1.amazonaws.com/prod-ucs-content-store-eu-west/content/pii:S138111690400113X/gr7/THUMBNAIL/image/gif/4607ce887b4555d93462226fa43f652f/gr7.sml gr7 gr7.sml sml 1985 93 112 IMAGE-THUMBNAIL 1-s2.0-S138111690400113X-gr7.gif https://s3.amazonaws.com/prod-ucs-content-store-us-east/content/pii:S138111690400113X/gr7/DOWNSAMPLED/image/gif/5217c1a98e877d3a3af46657a09e2579/gr7.gif https://s3-eu-west-1.amazonaws.com/prod-ucs-content-store-eu-west/content/pii:S138111690400113X/gr7/DOWNSAMPLED/image/gif/5217c1a98e877d3a3af46657a09e2579/gr7.gif gr7 gr7.gif gif 3465 170 205 IMAGE-DOWNSAMPLED MOLCAA 4554 S1381-1169(04)00113-X 10.1016/j.molcata.2004.02.015 Elsevier B.V. Fig. 1 Products molar selectivities from a 9.1kPa propane feed as a function of reaction temperature. Traces of aromatics as well as pentenes and heptenes were hardly detected. Conversions were 0.28% at 623K, 0.75% at 673K, 2.63% at 723K, and 10.61% at 773K. Fig. 2 Products molar yields against propane conversion over H-ZSM5 at: (a) 623K, (b) 673K, (c) 723K, and (d) 773K. Fig. 3 Olefin to paraffin ratio extrapolated at zero conversion as a function of temperature. Fig. 4 Arrhenius plot for the overall propane consumption rate, assuming first-order reaction rate on propane. Fig. 5 Rate of methane formation versus propane partial pressure over H-ZSM5 at 623K. Fig. 6 Second-order component of methane rate against butanes rate, at 623K. Fig. 7 Arrhenius plots for the formation of primary products resulting from propane transformation over H-ZSM5: (+) C1, (○) C2 , and (▴) C3 . Table 1 Initial products molar selectivities as calculated from extrapolating molar yields against conversion curves in the limit of zero conversion Products (mol%) Initial product molar selectivity (%) 623K 673K 723K 773K C1 10.34 34.49 56.60 70.68 C2 0.00 0.00 0.00 0.00 C2  9.51 36.44 55.99 72.60 C3  93.58 64.24 45.39 29.12 i-C4 0.33 0.00 0.00 0.00 n-C4 1.26 2.75 1.71 1.37 C4  0.28 0.66 0.24 0.00 C2 /C1 ratio 0.92 1.06 0.99 1.03 Olefins/paraffins ratio 8.66 2.72 1.74 1.41 Percentage conversion at 3.0kPa 0.06 0.22 0.79 2.99 5.1kPa 0.12 0.40 1.28 5.11 7.1kPa 0.19 0.61 1.85 7.60 9.1kPa 0.28 0.75 2.63 10.61 Table 2 Reaction orders on propane for each of the primary products obtained from propane transformation over H-ZSM5 Experimental reaction order 623K 673K 723K 773K Propane 1.44 1.15 1.10 1.29 Methane 1.47 1.17 1.15 1.35 Ethene 1.58 1.07 1.06 1.15 Propene 1.29 1.05 0.91 1.06 Propane conversion over a H-ZSM5 acid catalyst Part 1. Observed kinetics X. Wang a H. Carabineiro b F. Lemos b ∗ M.A.N.D.A. Lemos b F. Ramôa Ribeiro b a Institute of Industrial Catalysis, Dalian University of Technology, 158 Zhongshan Road, 116012 Dalian, China b Centro de Engenharia Biológica e Quı́mica, Instituto Superior Técnico, Av. Rovisco Pais, 1049-001 Lisboa, Portugal * Corresponding author. Tel.: +351-1-8419073; fax: +351-1-8419062. Propane conversion over H-ZSM5 zeolite follows two parallel reaction pathways: monomolecular cracking/dehydrogenation prevailing at high temperatures and low propane pressure involving pentacoordinated carbonium ions; bimolecular classical cracking through carbenium chain carriers is enhanced at low temperatures and high propane pressures. Dehydrogenation reactions are favored at low temperatures, while at higher temperatures cracking dominates. This is the first of a series of papers concerning the transformation of propane over a H-ZSM5 catalyst comprising experimental data, a kinetic model, and molecular dynamics calculations. The aim of this work is to provide a more fundamental insight on the catalytic processes involving light alkanes activation over solid acid catalysts. Experimental data for propane cracking was collected in the temperature range 623–773K and low propane feed partial pressures varying from 3.0 to 9.1kPa. The results show the existence of two parallel reaction pathways: (1) two monomolecular initiation steps (protolytic cracking or dehydrogenation), characterized by a relatively high activation energy, which becomes predominant at low conversions and high temperatures. Bond rupture may occur on either a CC or CH position leading to stoichiometric amounts of methane and ethene, or hydrogen and propene, respectively, when extrapolated at zero conversion; (2) a bimolecular route (classical cracking mechanism) with lower activation energy which involves carbenium ions chain carriers, and whose relative importance grows with increasing conversion and decreasing temperature, as secondary products, mainly olefins, become important. It is also clear that dehydrogenation reactions are favored at low temperatures, while at higher temperatures cracking is the dominant reaction pathway. Keywords Propane Kinetics Zeolite H-ZSM5 Catalytic cracking 1 Introduction The study of the transformation of small alkanes is important from several points of view: on one hand small alkanes are potentially valuable feedstocks for the production of several chemical species but are hard to activate and transform, except for the reaction where they are most used, i.e. combustion; on the other hand, their intrinsically difficult transformation over acid sites makes them very interesting species for the probing of the fundamentals on acid-catalyzed transformation of hydrocarbons over solid acids (namely zeolites), which is a very important reaction at the industrial level, both in the petroleum and the petrochemical domains. H-ZSM5 is a strong acidic catalyst, an important feature for the activation of small alkanes, and possesses a very narrow range of acid strengths which is an important factor to simplify kinetic analysis. Despite the fact that the transformation of propane is, predictably, a simple transformation, with only propene, ethene, methane, and hydrogen as expected products, its kinetics shows a variety of features that will enable us to probe into the chemistry of the adsorbed hydrocarbons, namely carbenium and carbonium ions, and into the interactions of the adsorbed species and gas-phase species. In fact, the existence of a significant number of secondary products can provide insight into these interactions, which occur even at relatively low conversion levels. The information that can be gathered from the studies of small alkane conversion can bear light into the reactivity of heavier alkanes and into processes that are as important as catalytic cracking. The catalytic cracking of short-chain alkanes has been subject of several papers in the literature. A comprehensive review on the mechanism of catalytic cracking of light alkanes (C3C6) is given by Jentoft and Gates [1]. Bandiera and Ben Taarit [2] have studied the cracking reaction of propane over H-ZSM5 (Si/Al=13) and de-aluminated H-mordenite, and found that the relative rates for dehydrogenation and cracking did not depend on temperature nor on catalyst acid strength or acid sites topology. In fact, similar activation energies (142kJmol−1) were observed for both cracking and dehydrogenation in the absence of secondary reactions for both catalysts. Therefore the active sites responsible for dehydrogenation and cracking were proposed to be of the same nature and acid strength regardless the zeolite structure or composition. Based on these findings, the authors suggest that the rate limiting step is the formation and subsequent decomposition of a common pentacoordinated carbonium ion to yield both dehydrogenation and cracking products over the same type of active sites at a fixed relative rate, governed by the energetics and statistical considerations on the carbonium ions involved. Based on the results from Kwak and Sachtler [3] Jentoft and Gates [1] explain the relative cracking to dehydrogenation ratio of propane on a pure statistical basis, i.e., assuming similar carbonium ion energetics either for CC or CH bond rupture. Krannila et al. [4] reached the same conclusions from the results of n-butane reaction over H-ZSM5. Upon extrapolation to the limit of zero conversion their results indicate a statistical decomposition of the carbonium ion into equimolar amounts of hydrogen + butenes, methane + propene, and ethane + ethene with the corresponding rates being nearly the same and having the same activation energy of ca. 140kJmol−1. In addition to the stated monomolecular conversion of n-butane, a significant contribution of bimolecular hydride transfer steps becomes more important with increasing conversion and decreasing temperature. Narbeshuber et al. [5,6] analyzed the conversion of light alkanes and also found a higher cracking rate relative to dehydrogenation for propane. However, they observed that the cracking to dehydrogenation ratio increased with temperature. Apparent activation energies for cracking and dehydrogenation of 155 and 95kJmol−1, respectively, were obtained. This contradicts the original proposal from Bandiera and Ben Taarit [2] who found at low conversion that the dehydrogenation to cracking ratio was temperature independent. Accordingly, Bandiera and Ben Taarit [7] later reported that actually the relative selectivities to primary protolytic dehydrogenation and cracking, depending on the catalyst acid strength by using catalysts with varying Si/Al ratios. They concluded that a stronger acidity favored selectivity towards cracking while the dehydrogenation selectivity was lowered. Furthermore Rudham and Winstaley [8], in opposition to Bandiera and Ben Taarit [2], proposed that dehydrogenation could be partially decoupled from cracking by introducing Lewis acid sites, leading to a temperature dependent dehydrogenation to cracking ratio. Narbeshuber et al. [6] have put in evidence using 13 C isotopic labeling studies that the rate determining steps of cracking and dehydrogenation are different. They conclude that protolytic cracking is rate limiting whereas dehydrogenation is controlled by olefin desorption. Evidence was also pointed to the existence of two pathways for dehydrogenation of alkanes, one of them presumably occurring on extra framework aluminium moities, in contrast with cracking which is known to occur exclusively on Brönsted acid sites. By using an in situ 13 C MAS NMR technique Ivanova et al. [9] confirmed the monofunctional mechanism involving protonation of propane over strong Brönsted sites on H-ZSM5, which can evolve to 13 C scrambling in propane, cracking, dehydrogenation, and disproportionation products. Depending on the propane partial pressure, two distinct regimes were found. At low pressures, monomolecular dehydrogenation of propane occurred, which produced an increase of the oligomerization of propene and subsequent cracking to yield mainly i-butane. At high propane pressure, a bimolecular disproportionation route prevails, yielding ethane, n-butane, and i-butane. It appears that some controversy still subsists regarding the detailed mechanism of light alkanes cracking. In the present study, propane transformation over H-ZSM5 was carried under conditions so that primary monomolecular pathways were privileged although secondary reactions were also present to a limited extent. Since secondary reactions result from the interaction of adsorbed carbenium intermediates and feed molecules, the underlying kinetics constitutes a useful probe to provide insight into the bimolecular mechanism. 2 Experimental The kinetic measurements were performed in an interrupted-flow quartz reactor having 10mm ID. Propane (analyzed 99.90% C3, 0.0065% C2 , 0.0922% cis-2-C4 ) was previously dried through a zeolite X bed and subsequently diluted in dry nitrogen, whose flow rate was set (Brooks mass-flow controller) to give 3.0, 5.1, 7.1, and 9.1kPa propane partial pressure in the feed. The H-ZSM5 zeolite was used as provided (ca. Si/Al=30) after pre-treatment in a purified nitrogen flow at 773K for 4h prior to reaction. The reaction was carried at 623, 673, 723, and 773K under atmospheric pressure. Propane molar flow rate and catalyst mass were kept constant at 0.0085molh−1 and 100mg (WHSV=3.74h−1) respectively. The reactant was fed in 6min. pulses, and then, interrupted for the duration of the analysis, while nitrogen kept flowing through the reactor. Product analysis was carried-out in a Perkin-Elmer (Perkin-Elmer 8420) gas chromatograph equipped with a 50m KCl/Al2O3 PLOT column and a flame ionization detector. Products selectivities were normalized on a molar basis to assess the reaction stoichiometry using: molar selectivity product i= product i weight fraction MM i ×MM C 3 3 Results and discussion Preliminary test runs carried out on an empty reactor did not show any products resulting from thermal reaction in the temperature range covered by these studies. Neither the conversion nor the product distribution changed with time-on-stream, indicating that no visible deactivation was observed under reaction conditions. For each set of experimental conditions, two independent measurements were made. Conversions were kept under ca. 11%, thus ensuring a differential mode operation in order to limit the extent of secondary reactions. Whatever the experimental conditions used, three main products were identified, namely methane, ethene, and propene. Other reaction products such as ethane, butanes, and butenes were also detected in substantially lower amounts. Propene was found to be the main product at low temperature while methane and ethene prevailed at higher temperatures. From Fig. 1 two main trends were observed as temperature increased from 623 to 773K. While the dehydrogenation product (propene) selectivity decreases with increasing temperature, cracking products methane and ethene both increase at nearly the same rate, therefore suggesting a common precursor. Trace amounts of heavier products including aromatics were only observed at higher temperatures and propane partial pressure. In order to clarify primary and secondary products contributions, plots of molar yields against conversion were drawn for each reaction temperature as shown in Fig. 2 . Initial product molar selectivities were obtained from curve slopes extrapolated to zero conversion. At 623K propene appears as the main primary product as it can be seen in Fig. 2a. A secondary contribution accounts for its non-linearity, especially at higher conversions. As the conversion increases, more propene is adsorbed on the catalyst surface to yield adsorbed propyl carbenium ions. Consequently, bimolecular steps between carbenium ions and gas-phase species will be enhanced. The other two primary products, methane and ethene, show initial equimolar selectivity in agreement with the stoichiometry of the protolytic CC bond rupture of the alkanium ion, as originally proposed by Haag and Dessau [10]. At higher conversion, the selectivity for ethylene increases above that of methane, as secondary reactions become more important. At low temperatures, ethene is formed both as a primary and secondary product, the latter resulting from propene oligomerization followed by classical β-scission (Eq. (1)). (1) 2C 3 H 6→C 2 H 4+C 4 H 8 Besides, also n-butane appears to have a non-negligible primary contribution as seen in Table 1 . However, no reactions involving propane can account for the presence of n-butane among primary products. For n-butane to be formed as a primary product in the early stages of the reaction, propane disproportionation, as described in Eq. (2), would have to take place: (2) 2C 3 H 8→C 2 H 6+C 4 H 10 Accordingly, also equimolar amounts of ethane would be formed from propane disproportionation, which is not consistent with our observations. Therefore, we propose instead that n-butane is formed from the butene impurity (0.09%) originally present in the propane feedstock that can immediately adsorb on the catalyst acid sites, forming butyl carbenium ions that can abstract hydride ions from propane to yield butanes and adsorbed propyl ions. This also explains why a smaller amount of butenes is present in the reaction products at low temperatures compared to those originally present in the propane feedstock as impurities. From 13 C MAS NMR in situ mechanistic studies by Derouane [9] also observed the formation of butane in the early stages of propane transformation over H-MFI. Depending on the propane coverage, two regimes were identified: low propane pressure, where mainly i-butane was formed from propane dehydrogenation followed by oligomerization and cracking; and high propane pressure, where bimolecular disproportionation of propane occurred yielding both butane isomers and ethane. Under the experimental conditions used, the low propane pressure regime applies, and hence, i-butane was expected to predominate relative to n-butane, contrarily to the observations. This, however, gives additional support to the importance of the presence of an olefine impurity in the feedstock. There is a different behavior between the n- and iso-butane isomers: n-C4 is a primary product, while i-C4 appears as a secondary product. According to our proposal stated above, n-C4 comes from butene impurities adsorption followed by hydride transfer with a propane feed molecule (Eqs. (3) and (4)): (3) n-C 4 +H +→n-C 4 + (4) n-C 4 ++C 3→C 3 ++n-C 4 where H+ represents an acid site. Secondary i-C4 proceeds from a different reaction pathway involving oligomerization of adsorbed propyl ions and subsequent cracking to yield ethylene and isobutyl carbenium. The latter can further abstract an hydride ion from a propane molecule leaving an adsorbed propyl and producing i-C4 (Eqs. (5) and (6)). (5) C 3 ++C 3 2−→C 6 +→C 2  +i-C 4 + (6) i-C 4 ++C 3→C 3 ++i-C 4 At high temperature (773K), the same primary products methane, ethylene, propene, and some n-butane were observed, as shown in Fig. 2d. However, as conversion increases the selectivity for ethene decreases below that of methane, contrarily to the observations at low temperatures. This may mean that ethene is now being consumed in secondary reactions. The secondary products distribution is also affected at high temperature. As seen in Fig. 2, ethane becomes the predominant secondary product followed by butenes. Ethane can be formed through hydride transfer from a feed propane molecule to an adsorbed ethyl carbenium leaving an adsorbed propyl on the acid site (Eq. (7)). (7) C 2 2−+C 3→C 3  +C 2 + Product initial selectivities extrapolated at zero conversion are given in Table 1, together with ethene to methane and olefin to paraffin ratios (Fig. 3 ). Ethene to methane initial ratio agrees with a protolytic pathway through a non-classical pentacoordinated carbonium [10] that cracks to give methane and leaves an ethyl ion adsorbed on the catalyst surface, which may then desorb as ethylene or further react to yield other products. In contrast to Bandiera and Ben Taarit observation [2], the selectivities for dehydrogenation and for cracking of propane over H-ZSM5 were found strongly dependent on the reaction temperature. As seen in Table 1 the ratio dehydrogenation/cracking is particularly high at low temperatures and approaches unity as temperature increases (Fig. 3). For each temperature, the kinetic rate constants for the overall rate were calculated assuming first-order kinetics with respect to propane. As shown in Fig. 4 , they strongly deviate from the presumed Arrhenius law. At low temperatures, the slope appears to be less pronounced than at high temperatures, which indicates a strongly activated process at high temperatures. This is what we expect from a competitive mechanism where two parallel reactions are to occur. Whenever two parallel reactions are possible, the faster pathway will prevail and determine the global reaction rate. Therefore, if we have two or more possible pathways having distinct activation energies, the overall reaction will proceed at a rate governed by the one having a lower activation energy at low temperatures and by the one possessing a higher activation energy at high temperatures. By considering two first-order parallel reactions for propane consumption, we were able to describe the temperature dependency of the overall rate constant. This implies the existence of two parallel reaction pathways, having distinct activation energies. Experimental reaction orders for propane and its primary products were investigated at each temperature. The values obtained are presented in Table 2 . All primary products experience a reduction of the experimental reaction order with increasing temperature. An exception, however, occurs at 500°C, where an apparent increase may be related with a deviation from differential behavior at higher conversion (ca. 11%), since reaction orders were calculated based on outlet propane partial pressure assuming differential operation. However, the conversion at 500°C is somewhat high, and the reactor deviates from differential mode, approaching a PFR regime. Since in a PFR, the reactant’s outlet partial pressure is lower than in a CSTR, this leads to a false increase in the apparent reaction order. Nevertheless, the results indicate an evolution in the reaction order from low to higher temperatures that is consistent with the existence of two distinct reaction mechanisms: • A bimolecular pathway with a relatively small activation energy prevailing at lower temperatures. Important second-order effects are visible in all primary products, including methane. • A monomolecular route involving pentacoordinated carbonium ions which cracks via protolytic route in a CC or CH bond position to yield methane and ethyl, or propyl and hydrogen. This pathway has a lower reaction order as well as higher activation energy, and prevails mainly at high temperatures. Narbeshuber et al. [5,6] reported first-order reaction rates on methane, ethylene, and propene primary products from propane cracking, based on kinetic data collected in the temperature range from 723 to 823K. This is true, especially at high temperatures where monomolecular cracking prevails. At lower temperatures, however, we observe first-order plus second-order reaction rates on methane, ethane, and ethene. This is not surprising for olefins since they are highly reactive, and tend to favor classical bimolecular oligomerization/cracking routes. While this holds for ethene and propene, it cannot explain the observed second-order effect in methane rate, which is a rather inert molecule under the present conditions. Therefore, a different explanation for methane excess relative to first-order rate has to be sought. Let us consider the rate of methane formation r C1 (Eq. (8)) as a primary plus secondary reaction order on propane, which fits well the experimental data as shown in Fig. 5 (as well as data at other temperatures). (8) r C 1 =k1P+k2P2 The first-order k 1 P contribution to methane is well-established as coming from monomolecular propane CC bond rupture (Eq. (9)). (9) C 3 H 8+H + → k1 CH 4+C 2 H 5 + Products other than propane, namely butanes, can also undergo monomolecular cracking to give methane. Narbeshuber et al. [5] showed that n-butane monomolecular cracking is even faster than propane cracking. Bandiera and Ben Taarit [2] have also previously attributed excess methane formation to the monomolecular cracking of higher alkanes. In view of this, we can propose that the second-order effects on methane formation is due to the rate of butanes formed, assuming that the monomolecular cracking reaction represented in Eq. (10) occurs: (10) C 4 H 10+H + → k1 CH 4+C 3 H 7 + In fact, if we look at Fig. 6 , we can see that it shows a linear relation between the butanes that are formed and the excess methane formation at 623K. The same linear trends were observed at all reaction temperatures studied (not shown), thereby reinforcing our assumption that the second-order behavior on methane rate comes from monomolecular cracking of product butanes. Apparent activation energies were determined from first-order rate constants on propene, methane, and ethane (see Fig. 7 ) formation. Methane and ethene formation showed comparable activation energies of 152±13 and 142±10kJmol−1, respectively, while the dehydrogenation reaction revealed a lower value of 70±32kJmol−1 (uncertainties were estimated for a 95% confidence level). Furthermore, the Arrhenius fit quality increased as products’ second-order contributions became less important, as expected. Apparent activation energies are in good agreement with previously published values from Narbeshuber et al. [5], who found 155 and 95kJmol−1 energy barriers for monomolecular cracking and dehydrogenation, respectively. 4 Conclusions Propane activation over H-ZSM5 was found to proceed through two parallel reaction pathways. A monomolecular mechanism involving non-classical pentacoordinated carbonium ions, resulting from the protolytic attack of a CC or CH bond over strong Brönsted acid sites; the former leading to cracking and the later to monomolecular dehydrogenation. These two processes have distinct apparent activation energies, and therefore, must involve different carbonium ions, depending on the type of bond cleaved. At low temperatures, however, experimental reaction orders as well as an excess ethene constitute evidence of the classical bimolecular mechanism that proceeds through carbenium ions acting as chain carriers. This process has a lower activation energy, and involves hydride transfer, oligomerization, and β-scission reactions. The presence of butene impurities in the reactant feedstock is responsible for the appearence of n-butane as a primary product. The excess methane formed is explained from subsequent monomolecular cracking of higher alkanes, namely butanes. Further work has been undertaken so as to probe the kinetic mechanism of the reaction in terms of elementary steps occurring on the catalyst surface as well as molecular dynamics theoretical studies to elucidate on the energetics of the transition states and intermediates involved. These studies will be presented in forthcoming papers. Acknowledgements The authors wish to acknowledge the Portuguese Science and Technology Foundation (FCT) for a post-doctoral grant for X. Wang (PRAXIS XXI/BPD/16340/98), a Ph.D. scholarship for Hugo Carabineiro (BD/6855/01), and for financial support, with partial E.U. FEDER structural funding, under the project PRAXIS/P/EQU/11221/1998. References [1] F.C. Jentoft B.C. Gates Top. Catal. 4 1997 1 13 [2] J. Bandiera Y. Ben Taarit Appl. Catal. 62 1990 309 316 [3] B.S. Kwak W.M.H. Sachtler J. Catal. 145 1994 456 463 [4] H. Krannila W.O. Haag B.C. Gates J. Catal. 135 1992 115 124 [5] T.F. Narbeshuber H. Vinek J.A. Lercher J. Catal. 157 1995 388 395 [6] T.F. Narbeshuber A. Brait K. Seshan J.A. Lercher J. Catal. 172 1997 127 136 [7] J. Bandiera M. Dufaux Y. Ben Taârit Appl. Catal. A 148 1997 283 300 [8] R. Rudham A.W. Winstaley J. Chem. Soc., Faraday Trans. 91 11 1995 1689 1794 [9] I. Ivanova A. Rebrov E. Pomakhina E.G. Derouane J. Mol. Catal. A 141 1999 107 116 [10] W.O. Haag, R.M. Dessau, in: Proceedings of the Eight International Congress on Catalysis, vol. 2, Berlin, Dechema, Frankfurt-am-Main, 1984, p. 305.",
      "scopus-id": "2342519357",
      "coredata": {
        "eid": "1-s2.0-S138111690400113X",
        "dc:description": "This is the first of a series of papers concerning the transformation of propane over a H-ZSM5 catalyst comprising experimental data, a kinetic model, and molecular dynamics calculations. The aim of this work is to provide a more fundamental insight on the catalytic processes involving light alkanes activation over solid acid catalysts. Experimental data for propane cracking was collected in the temperature range 623–773K and low propane feed partial pressures varying from 3.0 to 9.1kPa. The results show the existence of two parallel reaction pathways: (1) two monomolecular initiation steps (protolytic cracking or dehydrogenation), characterized by a relatively high activation energy, which becomes predominant at low conversions and high temperatures. Bond rupture may occur on either a CC or CH position leading to stoichiometric amounts of methane and ethene, or hydrogen and propene, respectively, when extrapolated at zero conversion; (2) a bimolecular route (classical cracking mechanism) with lower activation energy which involves carbenium ions chain carriers, and whose relative importance grows with increasing conversion and decreasing temperature, as secondary products, mainly olefins, become important. It is also clear that dehydrogenation reactions are favored at low temperatures, while at higher temperatures cracking is the dominant reaction pathway.",
        "openArchiveArticle": "false",
        "prism:coverDate": "2004-07-01",
        "openaccessUserLicense": null,
        "prism:aggregationType": "Journal",
        "prism:url": "https://api.elsevier.com/content/article/pii/S138111690400113X",
        "dc:creator": [
          {
            "@_fa": "true",
            "$": "Wang, X."
          },
          {
            "@_fa": "true",
            "$": "Carabineiro, H."
          },
          {
            "@_fa": "true",
            "$": "Lemos, F."
          },
          {
            "@_fa": "true",
            "$": "Lemos, M.A.N.D.A."
          },
          {
            "@_fa": "true",
            "$": "Ramôa Ribeiro, F."
          }
        ],
        "link": [
          {
            "@_fa": "true",
            "@rel": "self",
            "@href": "https://api.elsevier.com/content/article/pii/S138111690400113X"
          },
          {
            "@_fa": "true",
            "@rel": "scidir",
            "@href": "https://www.sciencedirect.com/science/article/pii/S138111690400113X"
          }
        ],
        "dc:format": "application/json",
        "openaccessType": null,
        "pii": "S1381-1169(04)00113-X",
        "prism:volume": "216",
        "prism:publisher": "Elsevier B.V.",
        "dc:title": "Propane conversion over a H-ZSM5 acid catalyst Part 1. Observed kinetics",
        "prism:copyright": "Copyright © 2004 Elsevier B.V. All rights reserved.",
        "openaccess": "0",
        "prism:issn": "13811169",
        "prism:issueIdentifier": "1",
        "dcterms:subject": [
          {
            "@_fa": "true",
            "$": "Propane"
          },
          {
            "@_fa": "true",
            "$": "Kinetics"
          },
          {
            "@_fa": "true",
            "$": "Zeolite H-ZSM5"
          },
          {
            "@_fa": "true",
            "$": "Catalytic cracking"
          }
        ],
        "openaccessArticle": "false",
        "prism:publicationName": "Journal of Molecular Catalysis A: Chemical",
        "prism:number": "1",
        "openaccessSponsorType": null,
        "prism:pageRange": "131-137",
        "prism:endingPage": "137",
        "pubType": "fla",
        "prism:coverDisplayDate": "1 July 2004",
        "prism:doi": "10.1016/j.molcata.2004.02.015",
        "prism:startingPage": "131",
        "dc:identifier": "doi:10.1016/j.molcata.2004.02.015",
        "openaccessSponsorName": null
      },
      "objects": {
        "object": [
          {
            "@category": "thumbnail",
            "@height": "20",
            "@width": "216",
            "@_fa": "true",
            "$": "https://api.elsevier.com/content/object/eid/1-s2.0-S138111690400113X-si9.gif?httpAccept=%2A%2F%2A",
            "@multimediatype": "GIF image file",
            "@type": "ALTIMG",
            "@size": "756",
            "@ref": "si9",
            "@mimetype": "image/gif"
          },
          {
            "@category": "thumbnail",
            "@height": "20",
            "@width": "180",
            "@_fa": "true",
            "$": "https://api.elsevier.com/content/object/eid/1-s2.0-S138111690400113X-si8.gif?httpAccept=%2A%2F%2A",
            "@multimediatype": "GIF image file",
            "@type": "ALTIMG",
            "@size": "642",
            "@ref": "si8",
            "@mimetype": "image/gif"
          },
          {
            "@category": "thumbnail",
            "@height": "14",
            "@width": "25",
            "@_fa": "true",
            "$": "https://api.elsevier.com/content/object/eid/1-s2.0-S138111690400113X-si7.gif?httpAccept=%2A%2F%2A",
            "@multimediatype": "GIF image file",
            "@type": "ALTIMG",
            "@size": "192",
            "@ref": "si7",
            "@mimetype": "image/gif"
          },
          {
            "@category": "thumbnail",
            "@height": "13",
            "@width": "166",
            "@_fa": "true",
            "$": "https://api.elsevier.com/content/object/eid/1-s2.0-S138111690400113X-si6.gif?httpAccept=%2A%2F%2A",
            "@multimediatype": "GIF image file",
            "@type": "ALTIMG",
            "@size": "658",
            "@ref": "si6",
            "@mimetype": "image/gif"
          },
          {
            "@category": "thumbnail",
            "@height": "13",
            "@width": "160",
            "@_fa": "true",
            "$": "https://api.elsevier.com/content/object/eid/1-s2.0-S138111690400113X-si5.gif?httpAccept=%2A%2F%2A",
            "@multimediatype": "GIF image file",
            "@type": "ALTIMG",
            "@size": "634",
            "@ref": "si5",
            "@mimetype": "image/gif"
          },
          {
            "@category": "thumbnail",
            "@height": "37",
            "@width": "456",
            "@_fa": "true",
            "$": "https://api.elsevier.com/content/object/eid/1-s2.0-S138111690400113X-si4.gif?httpAccept=%2A%2F%2A",
            "@multimediatype": "GIF image file",
            "@type": "ALTIMG",
            "@size": "2089",
            "@ref": "si4",
            "@mimetype": "image/gif"
          },
          {
            "@category": "thumbnail",
            "@height": "14",
            "@width": "25",
            "@_fa": "true",
            "$": "https://api.elsevier.com/content/object/eid/1-s2.0-S138111690400113X-si3.gif?httpAccept=%2A%2F%2A",
            "@multimediatype": "GIF image file",
            "@type": "ALTIMG",
            "@size": "192",
            "@ref": "si3",
            "@mimetype": "image/gif"
          },
          {
            "@category": "thumbnail",
            "@height": "14",
            "@width": "25",
            "@_fa": "true",
            "$": "https://api.elsevier.com/content/object/eid/1-s2.0-S138111690400113X-si2.gif?httpAccept=%2A%2F%2A",
            "@multimediatype": "GIF image file",
            "@type": "ALTIMG",
            "@size": "192",
            "@ref": "si2",
            "@mimetype": "image/gif"
          },
          {
            "@category": "thumbnail",
            "@height": "22",
            "@width": "212",
            "@_fa": "true",
            "$": "https://api.elsevier.com/content/object/eid/1-s2.0-S138111690400113X-si15.gif?httpAccept=%2A%2F%2A",
            "@multimediatype": "GIF image file",
            "@type": "ALTIMG",
            "@size": "812",
            "@ref": "si15",
            "@mimetype": "image/gif"
          },
          {
            "@category": "thumbnail",
            "@height": "22",
            "@width": "206",
            "@_fa": "true",
            "$": "https://api.elsevier.com/content/object/eid/1-s2.0-S138111690400113X-si14.gif?httpAccept=%2A%2F%2A",
            "@multimediatype": "GIF image file",
            "@type": "ALTIMG",
            "@size": "804",
            "@ref": "si14",
            "@mimetype": "image/gif"
          },
          {
            "@category": "thumbnail",
            "@height": "19",
            "@width": "124",
            "@_fa": "true",
            "$": "https://api.elsevier.com/content/object/eid/1-s2.0-S138111690400113X-si13.gif?httpAccept=%2A%2F%2A",
            "@multimediatype": "GIF image file",
            "@type": "ALTIMG",
            "@size": "540",
            "@ref": "si13",
            "@mimetype": "image/gif"
          },
          {
            "@category": "thumbnail",
            "@height": "21",
            "@width": "162",
            "@_fa": "true",
            "$": "https://api.elsevier.com/content/object/eid/1-s2.0-S138111690400113X-si12.gif?httpAccept=%2A%2F%2A",
            "@multimediatype": "GIF image file",
            "@type": "ALTIMG",
            "@size": "627",
            "@ref": "si12",
            "@mimetype": "image/gif"
          },
          {
            "@category": "thumbnail",
            "@height": "20",
            "@width": "207",
            "@_fa": "true",
            "$": "https://api.elsevier.com/content/object/eid/1-s2.0-S138111690400113X-si11.gif?httpAccept=%2A%2F%2A",
            "@multimediatype": "GIF image file",
            "@type": "ALTIMG",
            "@size": "729",
            "@ref": "si11",
            "@mimetype": "image/gif"
          },
          {
            "@category": "thumbnail",
            "@height": "21",
            "@width": "252",
            "@_fa": "true",
            "$": "https://api.elsevier.com/content/object/eid/1-s2.0-S138111690400113X-si10.gif?httpAccept=%2A%2F%2A",
            "@multimediatype": "GIF image file",
            "@type": "ALTIMG",
            "@size": "855",
            "@ref": "si10",
            "@mimetype": "image/gif"
          },
          {
            "@category": "thumbnail",
            "@height": "14",
            "@width": "25",
            "@_fa": "true",
            "$": "https://api.elsevier.com/content/object/eid/1-s2.0-S138111690400113X-si1.gif?httpAccept=%2A%2F%2A",
            "@multimediatype": "GIF image file",
            "@type": "ALTIMG",
            "@size": "192",
            "@ref": "si1",
            "@mimetype": "image/gif"
          },
          {
            "@category": "thumbnail",
            "@height": "91",
            "@width": "125",
            "@_fa": "true",
            "$": "https://api.elsevier.com/content/object/eid/1-s2.0-S138111690400113X-fx1.sml?httpAccept=%2A%2F%2A",
            "@multimediatype": "GIF image file",
            "@type": "IMAGE-THUMBNAIL",
            "@size": "1022",
            "@ref": "fx1",
            "@mimetype": "image/gif"
          },
          {
            "@category": "standard",
            "@height": "182",
            "@width": "249",
            "@_fa": "true",
            "$": "https://api.elsevier.com/content/object/eid/1-s2.0-S138111690400113X-fx1.gif?httpAccept=%2A%2F%2A",
            "@multimediatype": "GIF image file",
            "@type": "IMAGE-DOWNSAMPLED",
            "@size": "2588",
            "@ref": "fx1",
            "@mimetype": "image/gif"
          },
          {
            "@category": "thumbnail",
            "@height": "94",
            "@width": "124",
            "@_fa": "true",
            "$": "https://api.elsevier.com/content/object/eid/1-s2.0-S138111690400113X-gr1.sml?httpAccept=%2A%2F%2A",
            "@multimediatype": "GIF image file",
            "@type": "IMAGE-THUMBNAIL",
            "@size": "2756",
            "@ref": "gr1",
            "@mimetype": "image/gif"
          },
          {
            "@category": "standard",
            "@height": "273",
            "@width": "362",
            "@_fa": "true",
            "$": "https://api.elsevier.com/content/object/eid/1-s2.0-S138111690400113X-gr1.jpg?httpAccept=%2A%2F%2A",
            "@multimediatype": "JPEG image file",
            "@type": "IMAGE-DOWNSAMPLED",
            "@size": "31653",
            "@ref": "gr1",
            "@mimetype": "image/jpeg"
          },
          {
            "@category": "thumbnail",
            "@height": "86",
            "@width": "125",
            "@_fa": "true",
            "$": "https://api.elsevier.com/content/object/eid/1-s2.0-S138111690400113X-gr2.sml?httpAccept=%2A%2F%2A",
            "@multimediatype": "GIF image file",
            "@type": "IMAGE-THUMBNAIL",
            "@size": "2948",
            "@ref": "gr2",
            "@mimetype": "image/gif"
          },
          {
            "@category": "standard",
            "@height": "319",
            "@width": "465",
            "@_fa": "true",
            "$": "https://api.elsevier.com/content/object/eid/1-s2.0-S138111690400113X-gr2.gif?httpAccept=%2A%2F%2A",
            "@multimediatype": "GIF image file",
            "@type": "IMAGE-DOWNSAMPLED",
            "@size": "18201",
            "@ref": "gr2",
            "@mimetype": "image/gif"
          },
          {
            "@category": "thumbnail",
            "@height": "93",
            "@width": "113",
            "@_fa": "true",
            "$": "https://api.elsevier.com/content/object/eid/1-s2.0-S138111690400113X-gr3.sml?httpAccept=%2A%2F%2A",
            "@multimediatype": "GIF image file",
            "@type": "IMAGE-THUMBNAIL",
            "@size": "1982",
            "@ref": "gr3",
            "@mimetype": "image/gif"
          },
          {
            "@category": "standard",
            "@height": "182",
            "@width": "221",
            "@_fa": "true",
            "$": "https://api.elsevier.com/content/object/eid/1-s2.0-S138111690400113X-gr3.gif?httpAccept=%2A%2F%2A",
            "@multimediatype": "GIF image file",
            "@type": "IMAGE-DOWNSAMPLED",
            "@size": "3732",
            "@ref": "gr3",
            "@mimetype": "image/gif"
          },
          {
            "@category": "thumbnail",
            "@height": "91",
            "@width": "125",
            "@_fa": "true",
            "$": "https://api.elsevier.com/content/object/eid/1-s2.0-S138111690400113X-gr4.sml?httpAccept=%2A%2F%2A",
            "@multimediatype": "GIF image file",
            "@type": "IMAGE-THUMBNAIL",
            "@size": "2196",
            "@ref": "gr4",
            "@mimetype": "image/gif"
          },
          {
            "@category": "standard",
            "@height": "151",
            "@width": "207",
            "@_fa": "true",
            "$": "https://api.elsevier.com/content/object/eid/1-s2.0-S138111690400113X-gr4.gif?httpAccept=%2A%2F%2A",
            "@multimediatype": "GIF image file",
            "@type": "IMAGE-DOWNSAMPLED",
            "@size": "3660",
            "@ref": "gr4",
            "@mimetype": "image/gif"
          },
          {
            "@category": "thumbnail",
            "@height": "93",
            "@width": "123",
            "@_fa": "true",
            "$": "https://api.elsevier.com/content/object/eid/1-s2.0-S138111690400113X-gr5.sml?httpAccept=%2A%2F%2A",
            "@multimediatype": "GIF image file",
            "@type": "IMAGE-THUMBNAIL",
            "@size": "1960",
            "@ref": "gr5",
            "@mimetype": "image/gif"
          },
          {
            "@category": "standard",
            "@height": "164",
            "@width": "216",
            "@_fa": "true",
            "$": "https://api.elsevier.com/content/object/eid/1-s2.0-S138111690400113X-gr5.gif?httpAccept=%2A%2F%2A",
            "@multimediatype": "GIF image file",
            "@type": "IMAGE-DOWNSAMPLED",
            "@size": "3217",
            "@ref": "gr5",
            "@mimetype": "image/gif"
          },
          {
            "@category": "thumbnail",
            "@height": "93",
            "@width": "113",
            "@_fa": "true",
            "$": "https://api.elsevier.com/content/object/eid/1-s2.0-S138111690400113X-gr6.sml?httpAccept=%2A%2F%2A",
            "@multimediatype": "GIF image file",
            "@type": "IMAGE-THUMBNAIL",
            "@size": "1857",
            "@ref": "gr6",
            "@mimetype": "image/gif"
          },
          {
            "@category": "standard",
            "@height": "167",
            "@width": "203",
            "@_fa": "true",
            "$": "https://api.elsevier.com/content/object/eid/1-s2.0-S138111690400113X-gr6.gif?httpAccept=%2A%2F%2A",
            "@multimediatype": "GIF image file",
            "@type": "IMAGE-DOWNSAMPLED",
            "@size": "3161",
            "@ref": "gr6",
            "@mimetype": "image/gif"
          },
          {
            "@category": "thumbnail",
            "@height": "93",
            "@width": "112",
            "@_fa": "true",
            "$": "https://api.elsevier.com/content/object/eid/1-s2.0-S138111690400113X-gr7.sml?httpAccept=%2A%2F%2A",
            "@multimediatype": "GIF image file",
            "@type": "IMAGE-THUMBNAIL",
            "@size": "1985",
            "@ref": "gr7",
            "@mimetype": "image/gif"
          },
          {
            "@category": "standard",
            "@height": "170",
            "@width": "205",
            "@_fa": "true",
            "$": "https://api.elsevier.com/content/object/eid/1-s2.0-S138111690400113X-gr7.gif?httpAccept=%2A%2F%2A",
            "@multimediatype": "GIF image file",
            "@type": "IMAGE-DOWNSAMPLED",
            "@size": "3465",
            "@ref": "gr7",
            "@mimetype": "image/gif"
          }
        ]
      },
      "link": {
        "@rel": "abstract",
        "@href": "https://api.elsevier.com/content/abstract/scopus_id/2342519357"
      }
    }
  }
}