{
  "metadata": {
    "title": "Magnetic nanoparticle supported polyoxometalate: An efficient and reusable catalyst for solvent-free synthesis of α-aminophosphonates",
    "authors": "; ; ",
    "journal": "Journal of Molecular Catalysis A: Chemical",
    "date": "2013-07-31",
    "doi": "10.1016/j.molcata.2013.02.018",
    "abstract": "",
    "uri": "https://api.elsevier.com/content/article/pii/S1381116913000800",
    "pii": "S1381116913000800"
  },
  "fulltext": {
    "full-text-retrieval-response": {
      "scopus-eid": "2-s2.0-84876904124",
      "originalText": "serial JL 271358 291210 291744 291790 291809 31 Journal of Molecular Catalysis A: Chemical JOURNALMOLECULARCATALYSISACHEMICAL 2013-02-28 2013-02-28 2013-04-27T00:23:05 1-s2.0-S1381116913000800 S1381-1169(13)00080-0 S1381116913000800 10.1016/j.molcata.2013.02.018 S300 S300.1 FULL-TEXT 1-s2.0-S1381116913X00056 2015-05-15T05:56:33.63776-04:00 0 0 20130701 20130731 2013 2013-02-28T00:00:00Z articleinfo crossmark dco dateupdated tomb dateloaded datesearch indexeddate volumelist yearnav absattachment articletitlenorm authfirstinitialnorm authfirstsurnamenorm cid cids contenttype copyright dateloadedtxt docsubtype doctype doi eid ewtransactionid hubeid issn issnnorm itemstage itemtransactionid itemweight openaccess openarchive pg pgfirst pglast pii piinorm pubdateend pubdatestart pubdatetxt pubyr sortorder srctitle srctitlenorm srctype subheadings suppl volfirst volissue webpdf webpdfpagecount figure table body acknowledge affil articletitle auth authfirstini authfull authkeywords authlast primabst ref specialabst alllist content subj ssids 1381-1169 13811169 false 373 373 C Volume 373 6 25 29 25 29 201307 July 2013 2013-07-01 2013-07-31 2013 article fla Copyright © 2013 Elsevier B.V. All rights reserved. MAGNETICNANOPARTICLESUPPORTEDPOLYOXOMETALATEEFFICIENTREUSABLECATALYSTFORSOLVENTFREESYNTHESISAMINOPHOSPHONATES HAMADI H 1 Introduction 2 Experimental 2.1 General 2.2 Synthesis of PTA supported on imidazole functionalized Si-MNPs 2.3 General procedure of catalytic α-aminophosphonates synthesis 3 Results and discussion 3.1 Characterization of PTA/Si-imid@ Si-MNPs 3.2 α-Aminophosphonates synthesis 3.3 Catalyst recycling 4 Conclusions Acknowledgment References LIM 2010 412 C SHYLESH 2010 3428 S RIENTE 2011 7350 P ABUREZIG 2006 5279 R QIANG 2006 489 Y KONG 2012 183 A TURTELLI 2008 339 R CANNAS 2008 6364 C POLSHETTIWAR 2011 3036 V MIZUNO 1998 199 N POPE 1991 34 M ZHENG 2011 12325 X ZHANG 2011 189 Z CUI 2012 17 X ATHERTON 1986 29 F RAO 2008 512 X KRAICHEVA 2009 3363 I KAFARSKI 1991 193 P BAILAR 1939 132 J MAAZ 2007 289 K DENG 2005 87 Y SOFIA 2009 21114 L MEHNERT 2005 50 C ONO 2001 1832 H MA 2003 219 M HE 2005 167 Y SIAHKALI 2000 57 A CULLITY 1978 B ELEMENTSXRAYDIFFRACTION XIAO 2009 1078 Q ZHANG 2006 257 S MODAK 2009 169 S TAJBAKHSH 2008 352 M REZAEI 2009 4266 Z ORDONEZ 2009 17 M HEYDARI 2007 1224 A HAMADIX2013X25 HAMADIX2013X25X29 HAMADIX2013X25XH HAMADIX2013X25X29XH item S1381-1169(13)00080-0 S1381116913000800 1-s2.0-S1381116913000800 10.1016/j.molcata.2013.02.018 271358 2013-04-27T03:11:23.892472-04:00 2013-07-01 2013-07-31 1-s2.0-S1381116913000800-main.pdf https://s3.amazonaws.com/prod-ucs-content-store-us-east/content/pii:S1381116913000800/MAIN/application/pdf/13a003dd32249b79fc29202d60be1c7f/main.pdf https://s3-eu-west-1.amazonaws.com/prod-ucs-content-store-eu-west/content/pii:S1381116913000800/MAIN/application/pdf/13a003dd32249b79fc29202d60be1c7f/main.pdf main.pdf pdf true 1132492 MAIN 5 1-s2.0-S1381116913000800-main_1.png https://s3-eu-west-1.amazonaws.com/prod-ucs-content-store-eu-west/content/pii:S1381116913000800/PREVIEW/image/png/e48da6e022224dd25873fbb6f4246de1/main_1.png https://s3.amazonaws.com/prod-ucs-content-store-us-east/content/pii:S1381116913000800/PREVIEW/image/png/e48da6e022224dd25873fbb6f4246de1/main_1.png main_1.png png 59442 849 656 IMAGE-WEB-PDF 1 1-s2.0-S1381116913000800-fx1_lrg.jpg https://s3.amazonaws.com/prod-ucs-content-store-us-east/content/pii:S1381116913000800/fx1/HIGHRES/image/jpeg/d24992d8b6c195ed3d98bf64bb5c4c31/fx1_lrg.jpg https://s3-eu-west-1.amazonaws.com/prod-ucs-content-store-eu-west/content/pii:S1381116913000800/fx1/HIGHRES/image/jpeg/d24992d8b6c195ed3d98bf64bb5c4c31/fx1_lrg.jpg fx1 true fx1_lrg.jpg jpg 116516 494 2213 IMAGE-HIGH-RES 1-s2.0-S1381116913000800-gr6_lrg.jpg https://s3.amazonaws.com/prod-ucs-content-store-us-east/content/pii:S1381116913000800/gr6/HIGHRES/image/jpeg/d4586b4b675bc2eb96ce0a473724abe9/gr6_lrg.jpg https://s3-eu-west-1.amazonaws.com/prod-ucs-content-store-eu-west/content/pii:S1381116913000800/gr6/HIGHRES/image/jpeg/d4586b4b675bc2eb96ce0a473724abe9/gr6_lrg.jpg gr6 gr6_lrg.jpg jpg 140274 1090 1479 IMAGE-HIGH-RES 1-s2.0-S1381116913000800-gr5_lrg.jpg https://s3.amazonaws.com/prod-ucs-content-store-us-east/content/pii:S1381116913000800/gr5/HIGHRES/image/jpeg/cf62d097dc60664e7009b313c7bcac27/gr5_lrg.jpg https://s3-eu-west-1.amazonaws.com/prod-ucs-content-store-eu-west/content/pii:S1381116913000800/gr5/HIGHRES/image/jpeg/cf62d097dc60664e7009b313c7bcac27/gr5_lrg.jpg gr5 gr5_lrg.jpg jpg 140054 844 1663 IMAGE-HIGH-RES 1-s2.0-S1381116913000800-gr4_lrg.jpg https://s3.amazonaws.com/prod-ucs-content-store-us-east/content/pii:S1381116913000800/gr4/HIGHRES/image/jpeg/c773000d258bb9846694e1a4cacc3ec8/gr4_lrg.jpg https://s3-eu-west-1.amazonaws.com/prod-ucs-content-store-eu-west/content/pii:S1381116913000800/gr4/HIGHRES/image/jpeg/c773000d258bb9846694e1a4cacc3ec8/gr4_lrg.jpg gr4 gr4_lrg.jpg jpg 109438 1308 1477 IMAGE-HIGH-RES 1-s2.0-S1381116913000800-gr3_lrg.jpg https://s3.amazonaws.com/prod-ucs-content-store-us-east/content/pii:S1381116913000800/gr3/HIGHRES/image/jpeg/905f4782d1522f52a7b4346313f89299/gr3_lrg.jpg https://s3-eu-west-1.amazonaws.com/prod-ucs-content-store-eu-west/content/pii:S1381116913000800/gr3/HIGHRES/image/jpeg/905f4782d1522f52a7b4346313f89299/gr3_lrg.jpg gr3 gr3_lrg.jpg jpg 172423 758 1000 IMAGE-HIGH-RES 1-s2.0-S1381116913000800-gr2_lrg.jpg https://s3.amazonaws.com/prod-ucs-content-store-us-east/content/pii:S1381116913000800/gr2/HIGHRES/image/jpeg/e0a87a5b60c937e141e48a7ccb87d49f/gr2_lrg.jpg https://s3-eu-west-1.amazonaws.com/prod-ucs-content-store-eu-west/content/pii:S1381116913000800/gr2/HIGHRES/image/jpeg/e0a87a5b60c937e141e48a7ccb87d49f/gr2_lrg.jpg gr2 gr2_lrg.jpg jpg 217544 1108 1666 IMAGE-HIGH-RES 1-s2.0-S1381116913000800-gr1_lrg.jpg https://s3.amazonaws.com/prod-ucs-content-store-us-east/content/pii:S1381116913000800/gr1/HIGHRES/image/jpeg/7c3f6c82e3a06f4a8bcd3525729a92dc/gr1_lrg.jpg https://s3-eu-west-1.amazonaws.com/prod-ucs-content-store-eu-west/content/pii:S1381116913000800/gr1/HIGHRES/image/jpeg/7c3f6c82e3a06f4a8bcd3525729a92dc/gr1_lrg.jpg gr1 gr1_lrg.jpg jpg 172079 1124 2172 IMAGE-HIGH-RES 1-s2.0-S1381116913000800-sc2_lrg.jpg https://s3.amazonaws.com/prod-ucs-content-store-us-east/content/pii:S1381116913000800/sc2/HIGHRES/image/jpeg/4e9ee1fb8e7ecceec2cbccade1d4cb02/sc2_lrg.jpg https://s3-eu-west-1.amazonaws.com/prod-ucs-content-store-eu-west/content/pii:S1381116913000800/sc2/HIGHRES/image/jpeg/4e9ee1fb8e7ecceec2cbccade1d4cb02/sc2_lrg.jpg sc2 sc2_lrg.jpg jpg 389744 1701 3000 IMAGE-HIGH-RES 1-s2.0-S1381116913000800-sc1_lrg.jpg https://s3.amazonaws.com/prod-ucs-content-store-us-east/content/pii:S1381116913000800/sc1/HIGHRES/image/jpeg/eb3f9398620e5bc051b102d75e536dd5/sc1_lrg.jpg https://s3-eu-west-1.amazonaws.com/prod-ucs-content-store-eu-west/content/pii:S1381116913000800/sc1/HIGHRES/image/jpeg/eb3f9398620e5bc051b102d75e536dd5/sc1_lrg.jpg sc1 sc1_lrg.jpg jpg 180899 655 2917 IMAGE-HIGH-RES 1-s2.0-S1381116913000800-fx1.jpg https://s3.amazonaws.com/prod-ucs-content-store-us-east/content/pii:S1381116913000800/fx1/DOWNSAMPLED/image/jpeg/f94f2022945da8586282446cbc3c5c42/fx1.jpg https://s3-eu-west-1.amazonaws.com/prod-ucs-content-store-eu-west/content/pii:S1381116913000800/fx1/DOWNSAMPLED/image/jpeg/f94f2022945da8586282446cbc3c5c42/fx1.jpg fx1 true fx1.jpg jpg 14482 112 500 IMAGE-DOWNSAMPLED 1-s2.0-S1381116913000800-gr6.jpg https://s3.amazonaws.com/prod-ucs-content-store-us-east/content/pii:S1381116913000800/gr6/DOWNSAMPLED/image/jpeg/e4c239990db220f70ac8706608bc4009/gr6.jpg https://s3-eu-west-1.amazonaws.com/prod-ucs-content-store-eu-west/content/pii:S1381116913000800/gr6/DOWNSAMPLED/image/jpeg/e4c239990db220f70ac8706608bc4009/gr6.jpg gr6 gr6.jpg jpg 24002 246 334 IMAGE-DOWNSAMPLED 1-s2.0-S1381116913000800-gr5.jpg https://s3.amazonaws.com/prod-ucs-content-store-us-east/content/pii:S1381116913000800/gr5/DOWNSAMPLED/image/jpeg/a5b7b535dda2f0acf54ef3ee62ae65e0/gr5.jpg https://s3-eu-west-1.amazonaws.com/prod-ucs-content-store-eu-west/content/pii:S1381116913000800/gr5/DOWNSAMPLED/image/jpeg/a5b7b535dda2f0acf54ef3ee62ae65e0/gr5.jpg gr5 gr5.jpg jpg 21178 190 375 IMAGE-DOWNSAMPLED 1-s2.0-S1381116913000800-gr4.jpg https://s3.amazonaws.com/prod-ucs-content-store-us-east/content/pii:S1381116913000800/gr4/DOWNSAMPLED/image/jpeg/b88fb0dd75354998d6aad7bacce541c7/gr4.jpg https://s3-eu-west-1.amazonaws.com/prod-ucs-content-store-eu-west/content/pii:S1381116913000800/gr4/DOWNSAMPLED/image/jpeg/b88fb0dd75354998d6aad7bacce541c7/gr4.jpg gr4 gr4.jpg jpg 23419 295 333 IMAGE-DOWNSAMPLED 1-s2.0-S1381116913000800-gr3.jpg https://s3.amazonaws.com/prod-ucs-content-store-us-east/content/pii:S1381116913000800/gr3/DOWNSAMPLED/image/jpeg/347b3590a06e932581bc741af2da4149/gr3.jpg https://s3-eu-west-1.amazonaws.com/prod-ucs-content-store-eu-west/content/pii:S1381116913000800/gr3/DOWNSAMPLED/image/jpeg/347b3590a06e932581bc741af2da4149/gr3.jpg gr3 gr3.jpg jpg 39390 285 376 IMAGE-DOWNSAMPLED 1-s2.0-S1381116913000800-gr2.jpg https://s3.amazonaws.com/prod-ucs-content-store-us-east/content/pii:S1381116913000800/gr2/DOWNSAMPLED/image/jpeg/6a3951fb5fbc3af081b14232c3277eb1/gr2.jpg https://s3-eu-west-1.amazonaws.com/prod-ucs-content-store-eu-west/content/pii:S1381116913000800/gr2/DOWNSAMPLED/image/jpeg/6a3951fb5fbc3af081b14232c3277eb1/gr2.jpg gr2 gr2.jpg jpg 30410 250 376 IMAGE-DOWNSAMPLED 1-s2.0-S1381116913000800-gr1.jpg https://s3.amazonaws.com/prod-ucs-content-store-us-east/content/pii:S1381116913000800/gr1/DOWNSAMPLED/image/jpeg/c6c7416aeb25e2a746b4002e05d194e2/gr1.jpg https://s3-eu-west-1.amazonaws.com/prod-ucs-content-store-eu-west/content/pii:S1381116913000800/gr1/DOWNSAMPLED/image/jpeg/c6c7416aeb25e2a746b4002e05d194e2/gr1.jpg gr1 gr1.jpg jpg 25904 254 490 IMAGE-DOWNSAMPLED 1-s2.0-S1381116913000800-sc2.jpg https://s3.amazonaws.com/prod-ucs-content-store-us-east/content/pii:S1381116913000800/sc2/DOWNSAMPLED/image/jpeg/11a8f5c30d70f5fe778a660c6b2c3452/sc2.jpg https://s3-eu-west-1.amazonaws.com/prod-ucs-content-store-eu-west/content/pii:S1381116913000800/sc2/DOWNSAMPLED/image/jpeg/11a8f5c30d70f5fe778a660c6b2c3452/sc2.jpg sc2 sc2.jpg jpg 44494 384 678 IMAGE-DOWNSAMPLED 1-s2.0-S1381116913000800-sc1.jpg https://s3.amazonaws.com/prod-ucs-content-store-us-east/content/pii:S1381116913000800/sc1/DOWNSAMPLED/image/jpeg/26cf4d55e65beafbf7fbacabcd54787d/sc1.jpg https://s3-eu-west-1.amazonaws.com/prod-ucs-content-store-eu-west/content/pii:S1381116913000800/sc1/DOWNSAMPLED/image/jpeg/26cf4d55e65beafbf7fbacabcd54787d/sc1.jpg sc1 sc1.jpg jpg 29374 148 659 IMAGE-DOWNSAMPLED 1-s2.0-S1381116913000800-fx1.sml https://s3.amazonaws.com/prod-ucs-content-store-us-east/content/pii:S1381116913000800/fx1/THUMBNAIL/image/gif/aa562eb684d8007fa5ff0a2e49804371/fx1.sml https://s3-eu-west-1.amazonaws.com/prod-ucs-content-store-eu-west/content/pii:S1381116913000800/fx1/THUMBNAIL/image/gif/aa562eb684d8007fa5ff0a2e49804371/fx1.sml fx1 true fx1.sml sml 3703 49 219 IMAGE-THUMBNAIL 1-s2.0-S1381116913000800-gr6.sml https://s3.amazonaws.com/prod-ucs-content-store-us-east/content/pii:S1381116913000800/gr6/THUMBNAIL/image/gif/f09abbae4ebbaf0fd1c39e918b01cca2/gr6.sml https://s3-eu-west-1.amazonaws.com/prod-ucs-content-store-eu-west/content/pii:S1381116913000800/gr6/THUMBNAIL/image/gif/f09abbae4ebbaf0fd1c39e918b01cca2/gr6.sml gr6 gr6.sml sml 8869 161 219 IMAGE-THUMBNAIL 1-s2.0-S1381116913000800-gr5.sml https://s3.amazonaws.com/prod-ucs-content-store-us-east/content/pii:S1381116913000800/gr5/THUMBNAIL/image/gif/0bd2e8a612b2ccacc4022f3598595eea/gr5.sml https://s3-eu-west-1.amazonaws.com/prod-ucs-content-store-eu-west/content/pii:S1381116913000800/gr5/THUMBNAIL/image/gif/0bd2e8a612b2ccacc4022f3598595eea/gr5.sml gr5 gr5.sml sml 4518 111 219 IMAGE-THUMBNAIL 1-s2.0-S1381116913000800-gr4.sml https://s3.amazonaws.com/prod-ucs-content-store-us-east/content/pii:S1381116913000800/gr4/THUMBNAIL/image/gif/900db15078285cdf6c46b8d4723121a3/gr4.sml https://s3-eu-west-1.amazonaws.com/prod-ucs-content-store-eu-west/content/pii:S1381116913000800/gr4/THUMBNAIL/image/gif/900db15078285cdf6c46b8d4723121a3/gr4.sml gr4 gr4.sml sml 3023 164 185 IMAGE-THUMBNAIL 1-s2.0-S1381116913000800-gr3.sml https://s3.amazonaws.com/prod-ucs-content-store-us-east/content/pii:S1381116913000800/gr3/THUMBNAIL/image/gif/8fdbd8933c569538c0e594951441c7ef/gr3.sml https://s3-eu-west-1.amazonaws.com/prod-ucs-content-store-eu-west/content/pii:S1381116913000800/gr3/THUMBNAIL/image/gif/8fdbd8933c569538c0e594951441c7ef/gr3.sml gr3 gr3.sml sml 10934 164 216 IMAGE-THUMBNAIL 1-s2.0-S1381116913000800-gr2.sml https://s3.amazonaws.com/prod-ucs-content-store-us-east/content/pii:S1381116913000800/gr2/THUMBNAIL/image/gif/3b83a24b3eae91468779c0e7c48c9a8c/gr2.sml https://s3-eu-west-1.amazonaws.com/prod-ucs-content-store-eu-west/content/pii:S1381116913000800/gr2/THUMBNAIL/image/gif/3b83a24b3eae91468779c0e7c48c9a8c/gr2.sml gr2 gr2.sml sml 4428 146 219 IMAGE-THUMBNAIL 1-s2.0-S1381116913000800-gr1.sml https://s3.amazonaws.com/prod-ucs-content-store-us-east/content/pii:S1381116913000800/gr1/THUMBNAIL/image/gif/be096bb32a49510eae8b9fcc2d72b7f3/gr1.sml https://s3-eu-west-1.amazonaws.com/prod-ucs-content-store-eu-west/content/pii:S1381116913000800/gr1/THUMBNAIL/image/gif/be096bb32a49510eae8b9fcc2d72b7f3/gr1.sml gr1 gr1.sml sml 3121 113 219 IMAGE-THUMBNAIL 1-s2.0-S1381116913000800-sc2.sml https://s3.amazonaws.com/prod-ucs-content-store-us-east/content/pii:S1381116913000800/sc2/THUMBNAIL/image/gif/da82515256ceb281c108321a938b5148/sc2.sml https://s3-eu-west-1.amazonaws.com/prod-ucs-content-store-eu-west/content/pii:S1381116913000800/sc2/THUMBNAIL/image/gif/da82515256ceb281c108321a938b5148/sc2.sml sc2 sc2.sml sml 4247 124 219 IMAGE-THUMBNAIL 1-s2.0-S1381116913000800-sc1.sml https://s3.amazonaws.com/prod-ucs-content-store-us-east/content/pii:S1381116913000800/sc1/THUMBNAIL/image/gif/a8bdf47b28eac48175c17ba78926b363/sc1.sml https://s3-eu-west-1.amazonaws.com/prod-ucs-content-store-eu-west/content/pii:S1381116913000800/sc1/THUMBNAIL/image/gif/a8bdf47b28eac48175c17ba78926b363/sc1.sml sc1 sc1.sml sml 2400 49 219 IMAGE-THUMBNAIL MOLCAA 8679 S1381-1169(13)00080-0 10.1016/j.molcata.2013.02.018 Elsevier B.V. Scheme 1 PTA/Si-imid@ Si-MNPs catalyzed synthesis of α-aminophosphonates. Scheme 2 Schematic representation of the formation of PTA/Si-imid@ Si-MNPs. Fig. 1 FT-IR spectrum of PTA/Si-imid@ Si-MNPs. Fig. 2 XRD patterns of (a) MNPs, (b) Si-MNPs and (c) PTA/Si-imid@ Si-MNPs. Fig. 3 TEM image of PTA/Si-imid@ Si-MNPs. Fig. 4 Hysteresis loops of (a) MNPs, (b) Si-MNPs and (c) PTA/Si-imid@ Si-MNPs. Fig. 5 TGA of PTA/Si-imid@ Si-MNPs. Fig. 6 Catalyst recycling experiments for α-aminophosphonates synthesis. Table 1 Effect of various catalysts and solvents on the synthesis of α-aminophosphonates. Entry Catalyst Solvent Time (min) Yield b (%) 1 PTA/Si-imid@SiMNPs CH3CN 20 80 2 PTA/Si-imid@SiMNPs CH2Cl2 30 85 3 PTA/Si-imid@SiMNPs EtOH 45 75 4 PTA/Si-imid@SiMNPs (CH3)2CO 45 60 5 SiMNPs Neat 120 30 6 Si-imid@SiMNPs Neat 120 74 7 PTA/Si-imid@SiMNPs Neat 15 95 a All reaction conditions: benzaldehyde (1mmol), aniline (1mmol), P(OEt)3 (1.2mmol), catalyst (0.05g) at room temperature. b Isolated yield. Table 2 Synthesis of diversified α-aminophosphonates in the presence of PTA/Si-imid@ Si-MNPs. a Entry Aldehyde R1 (amine) R2 Time (min) Yield b (%) 1 RH H Me 15 94 2 RH H Et 15 95 3 RH 2-Br Et 20 97 4 RH 4-F Et 35 86 5 RH 4-OMe Et 30 88 6 RH 4-NO2 Me 30 91 7 R3-OMe H Me 20 88 8 R3-OMe H Et 20 91 9 R3-OMe 4-Br Et 30 90 10 R3-OMe 4-F Et 25 91 11 R3-OMe 4-OMe Et 20 92 12 R2-Br H Me 20 94 13 R2-Br H Et 30 91 14 R2-Br 4-Br Et 30 89 15 R2-Br 4-F Et 20 94 16 R2-Br 4-OMe Et 20 97 17 R4-OMe H Me 35 92 18 R4-OMe H Et 20 94 19 R4-OMe 4-Br Et 25 90 20 R4-OMe 4-F Et 20 87 21 R4-OMe 2-Br Et 20 92 22 R4-NO2 H Me 15 97 23 R4-NO2 H Et 15 96 24 R4-NO2 2-Aminopyridine Me 25 78 25 Furfural H Me 30 81 26 Furfural 2-Aminopyridine Me 40 68 a All reaction condition: aldehydes (1mmol), amine (1mmol), P(OMe)3/P(OEt)3 (1.2mmol) and 0.05g of PTA/Si-imid@ Si-MNPs at room temperature. b Isolated yields. Magnetic nanoparticle supported polyoxometalate: An efficient and reusable catalyst for solvent-free synthesis of α-aminophosphonates H. Hamadi a M. Kooti a ⁎ M. Afshari a Z. Ghiasifar b N. Adibpour c a Department of Chemistry, College of Science, Shahid Chamran University, Ahvaz 61357-43169, Iran b Department of Chemistry, Science and Research Khouzestan Branch, Islamic Azad University, Ahvaz, Iran c Department of Pharmacology and Toxicology, School of Pharmacy, Ahvaz Jundishpur University of Medical Sciences, Ahvaz, Iran ⁎ Corresponding author. Tel.: +98 916 1115451; fax: +98 6113331042. Graphical abstract Highlights ► Phosphotungstic acid supported on functionalized cobalt ferrite was prepared. ► Silica coated cobalt ferrite nanoparticles were used as support. ► This composite was used as catalyst for synthesis of α-aminophosphonates. ► Economically and environmentally benign procedure. ► The catalyst can be readily separated from solution by magnetic field. A new magnetically separable catalyst consisting of phosphotungstic acid (PTA) supported on imidazole functionalized silica coated cobalt ferrite nanoparticles was prepared. The synthesized catalyst was characterized by X-ray powder diffraction (XRD), transmission electron microscopy (TEM), vibrating sample magnetometry (VSM), thermogravimetric analysis (TGA), Fourier transform infrared (FT-IR), and inductively coupled plasma atomic emission spectroscopy (ICP-AES). The immobilized phosphotungstic acid was shown to be an efficient heterogeneous catalyst for the synthesis of α-aminophosphonates under solvent-free conditions at room temperature. The catalyst is readily recovered by simple magnetic decantation and can be recycled several times with no significant loss of catalytic activity. Keywords Cobalt ferrite α-Aminophosphonates Magnetic nanoparticles Surface functionalization Phosphotungstic acid 1 Introduction The choice of an efficient support could significantly improve the activity, selectivity, recycling, and reproducibility of catalyst systems. In recent years, magnetic nanoparticles (MNPs) have emerged as attractive solid supports for immobilization of homogeneous catalysts [1,2]. This is because the magnetic nanoparticles can be well dispersed in the reaction mixtures in the absence of magnetic field providing large surface for readily access of substrate molecules. More importantly, after completing the reactions, the MNPs supported catalysts can be isolated efficiently from the product solution through a simple magnetic separation process thereby eliminating the requirement of catalyst filtration and centrifugation [3,4]. Among the various magnetic nanoparticles, magnetite (Fe3O4) is the most widely used magnetic substance for catalysts support [5,6]. However, Fe3O4 is fairly reactive to acidic environment and since it contains Fe2+, which is readily oxidized, the MNPs of Fe3O4 are vulnerable to lose magnetism. On the contrary, cobalt ferrite (CoFe2O4) which is a typical ferromagnetic oxide with spinel structure has high thermal stability, moderate magnetization, remarkable chemical stability and mechanical hardness [7,8]. Therefore, cobalt ferrite can show better performance than magnetite as support for homogeneous catalysts. In most cases, the catalytic species cannot be introduced directly on the surface of MNPs supports and modification or functionalization of the MNPs surface is required prior to catalyst immobilization. In a recent review, Basset and co-workers have reported myriad catalytic systems devised by employing some superparamagnetic nanoparticles as a support, and their performance in catalyzing various organic reactions [9]. Polyoxometalates (POMs) and their derivatives have been widely used in organic synthesis and catalytic reactions as acid and oxidation catalysts because of their strong acidity and favourable redox properties [10,11]. Although many procedures have been performed to immobilize polyoxometalates on solid materials, only few reports have recently appeared in the literature about polyoxometalates supported-MNPs. The first example of non-covalent immobilization of POMs on MNPs was reported by Luo and co-workers [12]. These researchers have used Fe3O4 MNPs as core and after coating this core with silica, the surface was functionalized with imidazulium group. In the final step, PTA was immobilized on the surface of silica coated MNPs in THF by sonication. The prepared composite was used as efficient acid catalyst for the Friedel–Crafts reaction of indole and chalcones, In another report, oxidation of dibenzothiophene with H2O2 was studied by Ding and co-workers using two types nanosized catalysts consisting of phosphotungstic acid (H3PW12O40) supported on surface-modified Fe3O4. In this study high conversions were obtained and the catalysts could be easily separated from the reaction solution by applying an external magnetic field and recycled several times [13]. The oxidation of dibenzothiophene with hydrogen peroxide was also studied by another researcher group using a recyclable amphiphilic catalyst in which phosphotungstic acid was immobilized on surface modified MNPs [14]. In the present work, we designed a methodology for constructing of a magnetically recoverable nanocatalyst in which phosphotungstic acid (PTA) was immobilized on imidazole functionalized silica coated cobalt ferrite nanoparticles. In view of the immense importance of α-aminophosphonates [15–18], the as-synthesized catalyst was utilized for the preparation of these organophosphorous compounds at room temperature under solvent-free conditions (see Scheme 1 ). 2 Experimental 2.1 General All chemicals were purchased from Sigma–Aldrich or Merck and used as received. Phosphotungstic acid (PTA) was synthesized according to the literature [19]. X-ray diffraction (XRD) patterns were recorded with a Philips X-ray diffractometer (Model PW1840). FT-IR spectra were obtained using BOMEM MB-Series 1998 FT-IR spectrometer. Magnetic properties of all nanoparticles were measured with a vibrating sample magnetometer (VSM, Meghnatis Daghigh Kavir Company, Iran) at room temperature. The content of tungsten of the PTA/Si-imid@ Si-MNPs catalyst was determined using an ICP-AES instrument (HORIBA Jobin Yvon, Longjumeau Cedex, France). The catalyst sample was first dissolved in concentrated hydrochloric acid and after filtration, the aqueous solution is converted to aerosols via a nebulizer. The aerosols are transported to the inductively coupled plasma with argon flowrate of 12L/min. NMR spectra were recorded in CDCl3 on a Bruker Advanced DPX 400MHz spectrometer. 2.2 Synthesis of PTA supported on imidazole functionalized Si-MNPs Cobalt ferrite MNPs were synthesized using the procedure reported by Maaz et al. [20]. Silica coated CoFe2O4 nanoparticles (Si-MNPs) were prepared by using a reported sol–gel method [21]. The synthesis of PTA supported on imidazole functionalized Si-MNPs were achieved by using the previously reported method with some modification [22]. In our modified procedure 3-chloromethoxypropylsilane and imidazole in 1:1 molar ratio were reacted first to obtain product 1 (see Scheme 2 ). This product was then dissolved in ethanol followed by addition of Si-MNPs and the mixture was refluxed for 24h to give product 3. Finally, PTA/Si-imid@ Si-MNPs composite was obtained by treating of product 3 with PTA in refluxing acetonitrile. 2.3 General procedure of catalytic α-aminophosphonates synthesis A mixture of an aldehyde (1mmol), aniline (1mmol), triethyl phosphate or trimethyl phosphate (1.2mmol) and PTA/Si-imid@ Si-MNPs catalyst (0.05g) was stirred for an appropriate time at room temperature. The progress of the reaction was monitored by TLC. At the end of the reaction, CH3Cl was added to dilute the reaction mixture and the organic layer was simply decanted by means of an external magnet. The isolated solution was purified on a silica-gel plate to obtain pure product. The identities of the products were confirmed by FT-IR and 1H NMR spectral data. 3 Results and discussion 3.1 Characterization of PTA/Si-imid@ Si-MNPs Immobilization of PTA on imidazole functionalized MNPs combines the advantages of ionic liquids with those of heterogeneous catalysts [23]. The PTA moiety in the synthesized catalyst is bonded strongly to Si-imid@ Si-MNPs by means of ionic interaction. The as-synthesized PTA/Si-imid@ Si-MNPs catalyst was characterized by various techniques. The FT-IR spectrum of PTA/Si-imid@ Si-MNPs, shows weak peaks in the range between 1400 and 1630cm−1 assigned to the imidazole ring and two more bands at 890cm−1 and 981cm−1 attributed to the immobilized PTA [24]. In addition, the characteristic peaks of FeO at 588cm−1 [25] and SiOSi at 1079cm−1 and 808cm−1 [24] were also observed (Fig. 1 ). The X-ray diffraction patterns of MNPs, Si-MNPs and PTA/Si-imid@ Si-MNPs are shown in Fig. 2 . The peaks are compatible with pure CoFe2O4 phase (JCPDS PDF #221086), indicating the retention of cubic reverse spinel structure of CoFe2O4 during coating and functionalization. A weak broad bump appeared in the patterns of Si-MNPs and PTA/Si-imid@ Si-MNPs (Fig. 2b and c), at 2θ =18–28°, could be assigned to an amorphous silica phase in the shell of CoFe2O4. There are, however, no characteristic peaks of PTA in the XRD pattern of PTA/Si-imid@ Si-MNPs. This indicates that PTA species are well-dispersed on the surface of Si-imid@ Si-MNPs and probably there is no crystalline phase of this heteropoly acid to be detected by XRD analysis [26,27]. The crystallite sizes of cobalt ferrite MNPs, Si-MNPs and PTA/Si-imid@ Si-MNPs estimated using the well-known Scherer formula [28] were found to be 25.5nm, 34.7nm and 34.9nm respectively. The growth of magnetic nanoparticles on coating with silica was also occurred in the previously reported composites [29–31]. No explanation was given for this observation in any of the reported works; however, this increase might be due to the strong interaction of SiO groups with the metal cations on the surface of the MNPs which in turn brings the crystallites closer to each other and fuse them to somewhat larger particles. The TEM image of PTA/Si-imid@ Si-MNPs is presented in Fig. 3 , showing that most of the particles have quasi-spherical shape. The average size of these nanoparticles is in the range of 20–30nm which shows a close agreement with the values calculated by XRD data. Interestingly, the magnetic core is visible as a dark spot inside the bright spherical SiO2 thin shell in the TEM image of PTA/Si-imid@ Si-MNPs sample. Magnetic measurements for MNPs, Si-MNPs and PTA/Si-imid@ Si-MNPs were performed using a vibrating sample magnetometer (VSM) with a peak field of 8kOe and their hysteresis curves are presented in Fig. 4 . It could be seen from the loops in Fig. 4 that saturation magnetization (M S) of MNPs, Si-MNPs and PTA/Si-imid@ Si-MNPs are 59.42, 38.93 and 21.84emug−1 respectively. The decrease in mass saturation magnetization may be ascribed to the contribution of the non-magnetic silica shell and functionalized groups. Interestingly, although the M S values of the silica coated and functionalized MNPs samples have remarkably decreased, they still could be efficiently separated from solution with a permanent magnet. There are two weight loss steps in TGA curve of PTA/Si-imid@ Si-MNP catalyst (Fig. 5 ). The first mass loss of 1.7% (between 60 and 218°C) may be due to removal of surface adsorbed water of the catalyst. The loss of weight at temperatures higher than 218°C can be ascribed to the decomposition of Si-imid groups. The TGA analysis of the as-prepared catalyst showed that the loading of immidazolium moiety about 0.36mmol/g. Moreover, the tungsten content of the catalyst, as determined by ICP-AES, was 0.98mmol/g. This is another proof for the fact that PTA was immobilized onto the imidazole functionalized silica coated CoFe2O4. 3.2 α-Aminophosphonates synthesis In order to optimize the reaction conditions of α-aminophosphonates synthesis, various experiments were carried out at room temperature using benzaldehyde, aniline and triethylphosphate substrates in the presence of PTA/Si-imid@ Si-MNPs as catalyst. Firstly, we screened different solvents such as CH3CN, acetone, CH2Cl2, and EtOH to find out the effect of solvent on the progress of reaction. The results are given in Table 1 . When this reaction was carried out under solvent-free conditions, however, much better results were obtained (see Table 1). Secondly, to see the effectiveness of PTA species on this catalysis reaction, we have also examined Si-MNPs and Si-imid@ Si-MNPs in addition to PTA/Si-imid@ Si-MNPs as catalysts in separate experiments. As seen in Table 1, PTA/Si-imid@ Si-MNPs showed the best catalytic activity for the α-aminophosphonates synthesis. In order to explore the scope and the limitations of this novel catalytic method of α-aminophosphonates synthesis, we investigated various aromatic aldehydes and amines containing either electron withdrawing or electron donating functional groups with P(OEt)3 and P(OMe)3 under solvent-free conditions. The given results in Table 2 show that this one pot, three component condensations completed within 15–40min, with good isolated yields. The lower yields obtained for furfural and 2-amino pyridine are probably due to the lower reactivity of the heterocyclic substrates. Many methods have been so far developed for the synthesis of α-aminophosphonates [32–35]. However, in spite of their potential utility, most of these synthetic routes still have certain limitations such as use of solvents and toxic catalyst, longer reaction time, elevated temperature, and comparative more tedious work up purification procedures, thereby restrict their applications. Our catalysis synthesis of α-aminophosphonates can eliminate almost all these drawbacks since high yield of α-aminophosphonates was obtained in a short reaction time at room temperature under solventless condition. Most importantly, the catalyst can be readily separated from the reaction product by means of magnetic decantation and used for several time with no noticeable loss of its activity. 3.3 Catalyst recycling To evaluate the stability and level of reusability of the catalyst, we conducted experiments of α-aminophosphonates synthesis using the recycled PTA/Si-imid@ Si-MNPs catalyst. After the completion of the first reaction, the catalyst was washed with CH3Cl and the solution was removed by magnetic decantation. The left used catalyst was washed with methanol and CHCl3 and dried. A new reaction was then conducted with fresh reactants under similar conditions. It was found that the developed catalyst could be used at least five times without any change in reactivity (see Fig. 6 ). ICP-AES analysis has shown that slight leaching of the catalyst from support (0.92wt%) occurred only in the first run and no leaching was observed in the next runs. Moreover, the FT-IR spectrum of the recovered catalyst showed no change after using it for five times. This indicates that no significant leaching of the PTA species occurred from support on using and reusing the catalyst. 4 Conclusions In summary, we have successfully developed a novel type of non-covalently immobilized H3PW12O40 catalyst using surface-modified CoFe2O4 magnetic nanoparticles as support. The synthesized catalyst was confirmed by XRD, FT-IR, TGA, TEM, ICP-AES, and VSM techniques. The immobilized phosphotungstic acid was shown to be an efficient heterogeneous catalyst for synthesis of α-aminophosphonates under solvent-free conditions at room temperature. Moreover, the immobilized PTA catalyst could be easily recovered by simple magnetic decantation and reused at least five times without significant loss of activity. Acknowledgment The authors wish to acknowledge the support of this work by the Research Council of Shahid Chamran University, Ahvaz, Iran. References [1] C.W. Lim I.S. Lee Nano Today 5 2010 412 [2] S. Shylesh V. Schunemann W.R. Thiel Angew. Chem. Int. Ed. 49 2010 3428 [3] P. Riente C. Mendoza M.A. Pericas J. Mater. Chem. 21 2011 7350 [4] R. Abu-Rezig H. Alper D. Wang M.L. Post J. Am. Chem. Soc. 128 2006 5279 [5] Y. Qiang J. Antony J. Nutting D. Sikes D. Meyer J. Nanopart. Res. 8 2006 489 [6] A. Kong P. Wang H. Zhang F. Yang S.P. Huang Y. Shan Appl. Catal., A 417 2012 183 [7] R.S. Turtelli G.V. Duong J. Magn. Magn. Mater. 320 2008 339 [8] C. Cannas A. Ardu A. Musinu D. Peddis G. Piccaluga Chem. Mater. 20 2008 6364 [9] V. Polshettiwar R. Luque A. Fihri H. Zhu M. Bouhrara J.M. Basset Chem. Rev. 111 2011 3036 [10] N. Mizuno M. Misono Chem. Rev. 98 1998 199 [11] M.T. Pope A. Muller Angew. Chem. Int. Ed. 30 1991 34 [12] X. Zheng L. Zhang J. Li S. Luo J.P. Cheng Chem. Commun. 47 2011 12325 [13] Z. Zhang F. Zhang Q. Zhu W. Zhao B. Ma Y. Ding J. Colloid Interface Sci. 360 2011 189 [14] X. Cui D. Yao H. Li J. Yang D. Hu J. Hazard. Mater. 205 2012 17 [15] F.R. Atherton C.H. Hassall R.W. Lambert J. Med. Chem. 29 1986 29 [16] X. Rao Z. Song L. He Heteroat. Chem. 19 2008 512 [17] I. Kraicheva A. Bogomilova I. Tsacheva G. Momekov K. Troev Eur. J. Med. Chem. 44 2009 3363 [18] P. Kafarski B. Lejczak Phosphorus Sulfur Silicon Relat. Elem. 63 1991 193 [19] J.C. Bailar Inorg. Synth. 1 1939 132 [20] K. Maaz A. Mumtaz S.K. Hasanain A. Ceylan J. Magn. Magn. Mater. 308 2007 289 [21] Y.H. Deng C.C. Wang J.H. Hu W.L. Yang S.K. Fu Colloids Surf., A 262 2005 87 [22] L.T.A. Sofia A. Krishnan M. Sankar N.K. Kala Raj P. Manikandan P.R. Rajamohanan T.G. Ajithkumar J. Phys. Chem. C 113 2009 21114 [23] C.P. Mehnert J. Chem. Eur. 11 2005 50 [24] H. Ono T. Katsumata Appl. Phys. Lett. 78 2001 1832 [25] M. Ma Y. Zhang W. Yu H.Y. Shen H. Zhang N. Gu Colloids Surf., A 212 2003 219 [26] Y. He C.S. Woo H.G. Kim H.I. Lee Appl. Catal., A 281 2005 167 [27] A.G. Siahkali A. Philippou J. Dwyer M.W. Anderson Appl. Catal., A 192 2000 57 [28] B.D. Cullity Elements of X-ray Diffraction 1978 Addison-Wesley London [29] Q. Xiao C. Xiao Nanoscale Res. Lett. 4 2009 1078 [30] S. Zhang D. Dong Y. Sui Z. Liu H. Wang Z. Qian W. Su J. Alloys Compd. 415 2006 257 [31] S. Modak S. Karan S.K. Roy S. Mukherjee D. Das P.K. Chakrabarti J. Magn. Magn. Mater. 321 2009 169 [32] M. Tajbakhsh A. Heydari H. Alinezhad M. Ghanei S. Khaksar Synthesis 2008 352 [33] Z. Rezaei H. Firouzabadi N. Iranpoor A. Ghaderi M.R. Jafari A.A. Jafari H.R. Zare Eur. J. Med. Chem. 44 2009 4266 [34] M. Ordonez H. Rojas-Cabrera C. Cativiela Tetrahedron 65 2009 17 [35] A. Heydari H. Hamadi M. Pourayoubi Catal. Commun. 8 2007 1224",
      "scopus-id": "84876904124",
      "coredata": {
        "eid": "1-s2.0-S1381116913000800",
        "dc:description": "A new magnetically separable catalyst consisting of phosphotungstic acid (PTA) supported on imidazole functionalized silica coated cobalt ferrite nanoparticles was prepared. The synthesized catalyst was characterized by X-ray powder diffraction (XRD), transmission electron microscopy (TEM), vibrating sample magnetometry (VSM), thermogravimetric analysis (TGA), Fourier transform infrared (FT-IR), and inductively coupled plasma atomic emission spectroscopy (ICP-AES). The immobilized phosphotungstic acid was shown to be an efficient heterogeneous catalyst for the synthesis of α-aminophosphonates under solvent-free conditions at room temperature. The catalyst is readily recovered by simple magnetic decantation and can be recycled several times with no significant loss of catalytic activity.",
        "openArchiveArticle": "false",
        "prism:coverDate": "2013-07-31",
        "openaccessUserLicense": null,
        "prism:aggregationType": "Journal",
        "prism:url": "https://api.elsevier.com/content/article/pii/S1381116913000800",
        "dc:creator": [
          {
            "@_fa": "true",
            "$": "Hamadi, H."
          },
          {
            "@_fa": "true",
            "$": "Kooti, M."
          },
          {
            "@_fa": "true",
            "$": "Afshari, M."
          },
          {
            "@_fa": "true",
            "$": "Ghiasifar, Z."
          },
          {
            "@_fa": "true",
            "$": "Adibpour, N."
          }
        ],
        "link": [
          {
            "@_fa": "true",
            "@rel": "self",
            "@href": "https://api.elsevier.com/content/article/pii/S1381116913000800"
          },
          {
            "@_fa": "true",
            "@rel": "scidir",
            "@href": "https://www.sciencedirect.com/science/article/pii/S1381116913000800"
          }
        ],
        "dc:format": "application/json",
        "openaccessType": null,
        "pii": "S1381-1169(13)00080-0",
        "prism:volume": "373",
        "prism:publisher": "Elsevier B.V.",
        "dc:title": "Magnetic nanoparticle supported polyoxometalate: An efficient and reusable catalyst for solvent-free synthesis of α-aminophosphonates",
        "prism:copyright": "Copyright © 2013 Elsevier B.V. All rights reserved.",
        "openaccess": "0",
        "prism:issn": "13811169",
        "dcterms:subject": [
          {
            "@_fa": "true",
            "$": "Cobalt ferrite"
          },
          {
            "@_fa": "true",
            "$": "α-Aminophosphonates"
          },
          {
            "@_fa": "true",
            "$": "Magnetic nanoparticles"
          },
          {
            "@_fa": "true",
            "$": "Surface functionalization"
          },
          {
            "@_fa": "true",
            "$": "Phosphotungstic acid"
          }
        ],
        "openaccessArticle": "false",
        "prism:publicationName": "Journal of Molecular Catalysis A: Chemical",
        "openaccessSponsorType": null,
        "prism:pageRange": "25-29",
        "prism:endingPage": "29",
        "pubType": "fla",
        "prism:coverDisplayDate": "July 2013",
        "prism:doi": "10.1016/j.molcata.2013.02.018",
        "prism:startingPage": "25",
        "dc:identifier": "doi:10.1016/j.molcata.2013.02.018",
        "openaccessSponsorName": null
      },
      "objects": {
        "object": [
          {
            "@category": "high",
            "@height": "494",
            "@width": "2213",
            "@_fa": "true",
            "$": "https://api.elsevier.com/content/object/eid/1-s2.0-S1381116913000800-fx1_lrg.jpg?httpAccept=%2A%2F%2A",
            "@multimediatype": "JPEG image file",
            "@type": "IMAGE-HIGH-RES",
            "@size": "116516",
            "@ref": "fx1",
            "@mimetype": "image/jpeg"
          },
          {
            "@category": "high",
            "@height": "1090",
            "@width": "1479",
            "@_fa": "true",
            "$": "https://api.elsevier.com/content/object/eid/1-s2.0-S1381116913000800-gr6_lrg.jpg?httpAccept=%2A%2F%2A",
            "@multimediatype": "JPEG image file",
            "@type": "IMAGE-HIGH-RES",
            "@size": "140274",
            "@ref": "gr6",
            "@mimetype": "image/jpeg"
          },
          {
            "@category": "high",
            "@height": "844",
            "@width": "1663",
            "@_fa": "true",
            "$": "https://api.elsevier.com/content/object/eid/1-s2.0-S1381116913000800-gr5_lrg.jpg?httpAccept=%2A%2F%2A",
            "@multimediatype": "JPEG image file",
            "@type": "IMAGE-HIGH-RES",
            "@size": "140054",
            "@ref": "gr5",
            "@mimetype": "image/jpeg"
          },
          {
            "@category": "high",
            "@height": "1308",
            "@width": "1477",
            "@_fa": "true",
            "$": "https://api.elsevier.com/content/object/eid/1-s2.0-S1381116913000800-gr4_lrg.jpg?httpAccept=%2A%2F%2A",
            "@multimediatype": "JPEG image file",
            "@type": "IMAGE-HIGH-RES",
            "@size": "109438",
            "@ref": "gr4",
            "@mimetype": "image/jpeg"
          },
          {
            "@category": "high",
            "@height": "758",
            "@width": "1000",
            "@_fa": "true",
            "$": "https://api.elsevier.com/content/object/eid/1-s2.0-S1381116913000800-gr3_lrg.jpg?httpAccept=%2A%2F%2A",
            "@multimediatype": "JPEG image file",
            "@type": "IMAGE-HIGH-RES",
            "@size": "172423",
            "@ref": "gr3",
            "@mimetype": "image/jpeg"
          },
          {
            "@category": "high",
            "@height": "1108",
            "@width": "1666",
            "@_fa": "true",
            "$": "https://api.elsevier.com/content/object/eid/1-s2.0-S1381116913000800-gr2_lrg.jpg?httpAccept=%2A%2F%2A",
            "@multimediatype": "JPEG image file",
            "@type": "IMAGE-HIGH-RES",
            "@size": "217544",
            "@ref": "gr2",
            "@mimetype": "image/jpeg"
          },
          {
            "@category": "high",
            "@height": "1124",
            "@width": "2172",
            "@_fa": "true",
            "$": "https://api.elsevier.com/content/object/eid/1-s2.0-S1381116913000800-gr1_lrg.jpg?httpAccept=%2A%2F%2A",
            "@multimediatype": "JPEG image file",
            "@type": "IMAGE-HIGH-RES",
            "@size": "172079",
            "@ref": "gr1",
            "@mimetype": "image/jpeg"
          },
          {
            "@category": "high",
            "@height": "1701",
            "@width": "3000",
            "@_fa": "true",
            "$": "https://api.elsevier.com/content/object/eid/1-s2.0-S1381116913000800-sc2_lrg.jpg?httpAccept=%2A%2F%2A",
            "@multimediatype": "JPEG image file",
            "@type": "IMAGE-HIGH-RES",
            "@size": "389744",
            "@ref": "sc2",
            "@mimetype": "image/jpeg"
          },
          {
            "@category": "high",
            "@height": "655",
            "@width": "2917",
            "@_fa": "true",
            "$": "https://api.elsevier.com/content/object/eid/1-s2.0-S1381116913000800-sc1_lrg.jpg?httpAccept=%2A%2F%2A",
            "@multimediatype": "JPEG image file",
            "@type": "IMAGE-HIGH-RES",
            "@size": "180899",
            "@ref": "sc1",
            "@mimetype": "image/jpeg"
          },
          {
            "@category": "standard",
            "@height": "112",
            "@width": "500",
            "@_fa": "true",
            "$": "https://api.elsevier.com/content/object/eid/1-s2.0-S1381116913000800-fx1.jpg?httpAccept=%2A%2F%2A",
            "@multimediatype": "JPEG image file",
            "@type": "IMAGE-DOWNSAMPLED",
            "@size": "14482",
            "@ref": "fx1",
            "@mimetype": "image/jpeg"
          },
          {
            "@category": "standard",
            "@height": "246",
            "@width": "334",
            "@_fa": "true",
            "$": "https://api.elsevier.com/content/object/eid/1-s2.0-S1381116913000800-gr6.jpg?httpAccept=%2A%2F%2A",
            "@multimediatype": "JPEG image file",
            "@type": "IMAGE-DOWNSAMPLED",
            "@size": "24002",
            "@ref": "gr6",
            "@mimetype": "image/jpeg"
          },
          {
            "@category": "standard",
            "@height": "190",
            "@width": "375",
            "@_fa": "true",
            "$": "https://api.elsevier.com/content/object/eid/1-s2.0-S1381116913000800-gr5.jpg?httpAccept=%2A%2F%2A",
            "@multimediatype": "JPEG image file",
            "@type": "IMAGE-DOWNSAMPLED",
            "@size": "21178",
            "@ref": "gr5",
            "@mimetype": "image/jpeg"
          },
          {
            "@category": "standard",
            "@height": "295",
            "@width": "333",
            "@_fa": "true",
            "$": "https://api.elsevier.com/content/object/eid/1-s2.0-S1381116913000800-gr4.jpg?httpAccept=%2A%2F%2A",
            "@multimediatype": "JPEG image file",
            "@type": "IMAGE-DOWNSAMPLED",
            "@size": "23419",
            "@ref": "gr4",
            "@mimetype": "image/jpeg"
          },
          {
            "@category": "standard",
            "@height": "285",
            "@width": "376",
            "@_fa": "true",
            "$": "https://api.elsevier.com/content/object/eid/1-s2.0-S1381116913000800-gr3.jpg?httpAccept=%2A%2F%2A",
            "@multimediatype": "JPEG image file",
            "@type": "IMAGE-DOWNSAMPLED",
            "@size": "39390",
            "@ref": "gr3",
            "@mimetype": "image/jpeg"
          },
          {
            "@category": "standard",
            "@height": "250",
            "@width": "376",
            "@_fa": "true",
            "$": "https://api.elsevier.com/content/object/eid/1-s2.0-S1381116913000800-gr2.jpg?httpAccept=%2A%2F%2A",
            "@multimediatype": "JPEG image file",
            "@type": "IMAGE-DOWNSAMPLED",
            "@size": "30410",
            "@ref": "gr2",
            "@mimetype": "image/jpeg"
          },
          {
            "@category": "standard",
            "@height": "254",
            "@width": "490",
            "@_fa": "true",
            "$": "https://api.elsevier.com/content/object/eid/1-s2.0-S1381116913000800-gr1.jpg?httpAccept=%2A%2F%2A",
            "@multimediatype": "JPEG image file",
            "@type": "IMAGE-DOWNSAMPLED",
            "@size": "25904",
            "@ref": "gr1",
            "@mimetype": "image/jpeg"
          },
          {
            "@category": "standard",
            "@height": "384",
            "@width": "678",
            "@_fa": "true",
            "$": "https://api.elsevier.com/content/object/eid/1-s2.0-S1381116913000800-sc2.jpg?httpAccept=%2A%2F%2A",
            "@multimediatype": "JPEG image file",
            "@type": "IMAGE-DOWNSAMPLED",
            "@size": "44494",
            "@ref": "sc2",
            "@mimetype": "image/jpeg"
          },
          {
            "@category": "standard",
            "@height": "148",
            "@width": "659",
            "@_fa": "true",
            "$": "https://api.elsevier.com/content/object/eid/1-s2.0-S1381116913000800-sc1.jpg?httpAccept=%2A%2F%2A",
            "@multimediatype": "JPEG image file",
            "@type": "IMAGE-DOWNSAMPLED",
            "@size": "29374",
            "@ref": "sc1",
            "@mimetype": "image/jpeg"
          },
          {
            "@category": "thumbnail",
            "@height": "49",
            "@width": "219",
            "@_fa": "true",
            "$": "https://api.elsevier.com/content/object/eid/1-s2.0-S1381116913000800-fx1.sml?httpAccept=%2A%2F%2A",
            "@multimediatype": "GIF image file",
            "@type": "IMAGE-THUMBNAIL",
            "@size": "3703",
            "@ref": "fx1",
            "@mimetype": "image/gif"
          },
          {
            "@category": "thumbnail",
            "@height": "161",
            "@width": "219",
            "@_fa": "true",
            "$": "https://api.elsevier.com/content/object/eid/1-s2.0-S1381116913000800-gr6.sml?httpAccept=%2A%2F%2A",
            "@multimediatype": "GIF image file",
            "@type": "IMAGE-THUMBNAIL",
            "@size": "8869",
            "@ref": "gr6",
            "@mimetype": "image/gif"
          },
          {
            "@category": "thumbnail",
            "@height": "111",
            "@width": "219",
            "@_fa": "true",
            "$": "https://api.elsevier.com/content/object/eid/1-s2.0-S1381116913000800-gr5.sml?httpAccept=%2A%2F%2A",
            "@multimediatype": "GIF image file",
            "@type": "IMAGE-THUMBNAIL",
            "@size": "4518",
            "@ref": "gr5",
            "@mimetype": "image/gif"
          },
          {
            "@category": "thumbnail",
            "@height": "164",
            "@width": "185",
            "@_fa": "true",
            "$": "https://api.elsevier.com/content/object/eid/1-s2.0-S1381116913000800-gr4.sml?httpAccept=%2A%2F%2A",
            "@multimediatype": "GIF image file",
            "@type": "IMAGE-THUMBNAIL",
            "@size": "3023",
            "@ref": "gr4",
            "@mimetype": "image/gif"
          },
          {
            "@category": "thumbnail",
            "@height": "164",
            "@width": "216",
            "@_fa": "true",
            "$": "https://api.elsevier.com/content/object/eid/1-s2.0-S1381116913000800-gr3.sml?httpAccept=%2A%2F%2A",
            "@multimediatype": "GIF image file",
            "@type": "IMAGE-THUMBNAIL",
            "@size": "10934",
            "@ref": "gr3",
            "@mimetype": "image/gif"
          },
          {
            "@category": "thumbnail",
            "@height": "146",
            "@width": "219",
            "@_fa": "true",
            "$": "https://api.elsevier.com/content/object/eid/1-s2.0-S1381116913000800-gr2.sml?httpAccept=%2A%2F%2A",
            "@multimediatype": "GIF image file",
            "@type": "IMAGE-THUMBNAIL",
            "@size": "4428",
            "@ref": "gr2",
            "@mimetype": "image/gif"
          },
          {
            "@category": "thumbnail",
            "@height": "113",
            "@width": "219",
            "@_fa": "true",
            "$": "https://api.elsevier.com/content/object/eid/1-s2.0-S1381116913000800-gr1.sml?httpAccept=%2A%2F%2A",
            "@multimediatype": "GIF image file",
            "@type": "IMAGE-THUMBNAIL",
            "@size": "3121",
            "@ref": "gr1",
            "@mimetype": "image/gif"
          },
          {
            "@category": "thumbnail",
            "@height": "124",
            "@width": "219",
            "@_fa": "true",
            "$": "https://api.elsevier.com/content/object/eid/1-s2.0-S1381116913000800-sc2.sml?httpAccept=%2A%2F%2A",
            "@multimediatype": "GIF image file",
            "@type": "IMAGE-THUMBNAIL",
            "@size": "4247",
            "@ref": "sc2",
            "@mimetype": "image/gif"
          },
          {
            "@category": "thumbnail",
            "@height": "49",
            "@width": "219",
            "@_fa": "true",
            "$": "https://api.elsevier.com/content/object/eid/1-s2.0-S1381116913000800-sc1.sml?httpAccept=%2A%2F%2A",
            "@multimediatype": "GIF image file",
            "@type": "IMAGE-THUMBNAIL",
            "@size": "2400",
            "@ref": "sc1",
            "@mimetype": "image/gif"
          }
        ]
      },
      "link": {
        "@rel": "abstract",
        "@href": "https://api.elsevier.com/content/abstract/scopus_id/84876904124"
      }
    }
  }
}