{
  "metadata": {
    "title": "Mesoporous SBA-15 supported silver nanoparticles as environmentally friendly catalysts for three-component reaction of aldehydes, alkynes and amines with glycol as a “green” solvent",
    "authors": "; ; ",
    "journal": "Journal of Molecular Catalysis A: Chemical",
    "date": "2010-05-17",
    "doi": "10.1016/j.molcata.2010.03.007",
    "abstract": "",
    "uri": "https://api.elsevier.com/content/article/pii/S1381116910001044",
    "pii": "S1381116910001044"
  },
  "fulltext": {
    "full-text-retrieval-response": {
      "scopus-eid": "2-s2.0-77951204725",
      "originalText": "serial JL 271358 291210 291744 291790 291809 31 Journal of Molecular Catalysis A: Chemical JOURNALMOLECULARCATALYSISACHEMICAL 2010-03-10 2010-03-10 2010-10-31T16:33:17 1-s2.0-S1381116910001044 S1381-1169(10)00104-4 S1381116910001044 10.1016/j.molcata.2010.03.007 S300 S300.1 FULL-TEXT 1-s2.0-S1381116910X00061 2015-05-15T05:56:33.607047-04:00 0 0 20100517 2010 2010-03-10T00:00:00Z articleinfo crossmark dco dateupdated tomb dateloaded datesearch indexeddate issuelist volumelist yearnav absattachment articletitlenorm authfirstinitialnorm authfirstsurnamenorm cid cids contenttype copyright dateloadedtxt docsubtype doctype doi eid ewtransactionid hubeid issfirst issn issnnorm itemstage itemtransactionid itemweight openaccess openarchive pg pgfirst pglast pii piinorm pubdatestart pubdatetxt pubyr sectiontitle sortorder srctitle srctitlenorm srctype subheadings volfirst volissue webpdf webpdfpagecount figure table e-component body acknowledge affil appendices articletitle auth authfirstini authfull authkeywords authlast primabst ref specialabst alllist content subj ssids 1381-1169 13811169 323 323 1 2 1 2 Volume 323, Issues 1–2 9 40 44 40 44 20100517 17 May 2010 2010-05-17 2010 Regular papers article fla Copyright © 2010 Elsevier B.V. All rights reserved. MESOPOROUSSBA15SUPPORTEDSILVERNANOPARTICLESENVIRONMENTALLYFRIENDLYCATALYSTSFORTHREECOMPONENTREACTIONALDEHYDESALKYNESAMINESGLYCOLAGREENSOLVENT YONG G 1 Introduction 2 Experimental 2.1 Catalyst preparation 2.2 Catalyst characterization 2.3 Catalytic studies 3 Results and discussion 3.1 Characterization of the catalysts 3.2 Catalytic studies 4 Conclusions Acknowledgements Appendix A Supplementary data References WEI 2003 4473 4475 C HARVEY 1996 2268 2272 D FURSTNER 2000 6785 6786 A YAMAMOTO 2005 10804 10805 Y LEE 2007 3503 3507 E YAN 2007 4323 4326 B RUSSO 2007 10671 10683 O SHIBASAKI 1987 3488 3489 M GOMMERMANN 2004 2324 2325 N JIANG 2004 2543 2546 B XU 2005 2821 2824 Q KABALKA 2001 676 678 G WEI 2002 5638 5639 C HUMA 2002 6485 6488 H GOMMERMANN 2003 5763 5766 N SHI 2004 1001 1003 L WEI 2004 5749 5754 C HUANG 2006 1528 1532 B GOMMERMANN 2006 4380 4392 N DU 2008 695 700 W JI 2004 42 44 J ZHANG 2005 366 370 Y YAO 2005 4395 4398 X WEI 2003 9584 9585 C LO 2006 1529 1532 V ZHANG 2008 4358 4361 X LO 2009 583 591 V CHEN 2009 2895 2898 W SAKAGUCHI 2001 2534 2536 S FISCHER 2001 4319 4321 C SAKAGUCHI 2004 1638 1639 S ZANI 2007 2587 2600 L RAMU 2007 7184 7190 E ZHANG 2009 4364 4367 Y LI 2004 2443 2446 Z PARK 2005 1315 1317 S CHOUDARY 2004 7319 7321 B KANTAM 2005 2329 2332 M REDDY 2006 7563 7566 K KANTAM 2007 7332 7334 M MAGGI 2008 1435 1439 R KANTAM 2008 3083 3086 M YAN 2006 81 85 W KIDWAI 2007 742 745 M KIDWAI 2007 1581 1584 M WANG 2009 447 450 S ZHOU 2008 80 90 Y LI 2007 5455 5459 P WANG 2008 2255 2261 M PATIL 2008 4440 4445 M LI 2008 6650 6654 P LI 2008 667 672 L GUAN 2009 49 56 Y TSONCHEVA 2009 365 374 T TIAN 2009 211 216 D ZHU 2005 221 226 W CITRIN 1983 3160 3175 P QU 2005 15842 15848 Z YONGX2010X40 YONGX2010X40X44 YONGX2010X40XG YONGX2010X40X44XG item S1381-1169(10)00104-4 S1381116910001044 1-s2.0-S1381116910001044 10.1016/j.molcata.2010.03.007 271358 2010-12-01T15:35:43.158789-05:00 2010-05-17 1-s2.0-S1381116910001044-main.pdf https://s3.amazonaws.com/prod-ucs-content-store-us-east/content/pii:S1381116910001044/MAIN/application/pdf/06e8e67573d45d7c4c28488a3b0ea9e5/main.pdf https://s3-eu-west-1.amazonaws.com/prod-ucs-content-store-eu-west/content/pii:S1381116910001044/MAIN/application/pdf/06e8e67573d45d7c4c28488a3b0ea9e5/main.pdf main.pdf pdf true 471739 MAIN 5 1-s2.0-S1381116910001044-main_1.png https://s3-eu-west-1.amazonaws.com/prod-ucs-content-store-eu-west/content/pii:S1381116910001044/PREVIEW/image/png/51c0c453fff0561184ee3768eb2412a4/main_1.png https://s3.amazonaws.com/prod-ucs-content-store-us-east/content/pii:S1381116910001044/PREVIEW/image/png/51c0c453fff0561184ee3768eb2412a4/main_1.png main_1.png png 58665 849 656 IMAGE-WEB-PDF 1 1-s2.0-S1381116910001044-fx1.jpg https://s3.amazonaws.com/prod-ucs-content-store-us-east/content/pii:S1381116910001044/fx1/DOWNSAMPLED/image/jpeg/7769003f012c396bfe482fbfb22fa834/fx1.jpg https://s3-eu-west-1.amazonaws.com/prod-ucs-content-store-eu-west/content/pii:S1381116910001044/fx1/DOWNSAMPLED/image/jpeg/7769003f012c396bfe482fbfb22fa834/fx1.jpg fx1 true fx1.jpg jpg 18316 97 222 IMAGE-DOWNSAMPLED 1-s2.0-S1381116910001044-fx1.sml https://s3.amazonaws.com/prod-ucs-content-store-us-east/content/pii:S1381116910001044/fx1/THUMBNAIL/image/gif/065177c77a04dfa1cf95861f17d472fe/fx1.sml https://s3-eu-west-1.amazonaws.com/prod-ucs-content-store-eu-west/content/pii:S1381116910001044/fx1/THUMBNAIL/image/gif/065177c77a04dfa1cf95861f17d472fe/fx1.sml fx1 true fx1.sml sml 3239 95 219 IMAGE-THUMBNAIL 1-s2.0-S1381116910001044-fx1_lrg.jpg https://s3.amazonaws.com/prod-ucs-content-store-us-east/content/pii:S1381116910001044/fx1/HIGHRES/image/jpeg/c8b255d70546dc4ceefd9c6ab86c1c39/fx1_lrg.jpg https://s3-eu-west-1.amazonaws.com/prod-ucs-content-store-eu-west/content/pii:S1381116910001044/fx1/HIGHRES/image/jpeg/c8b255d70546dc4ceefd9c6ab86c1c39/fx1_lrg.jpg fx1 fx1_lrg.jpg jpg 65674 429 984 IMAGE-HIGH-RES 1-s2.0-S1381116910001044-gr1.jpg https://s3.amazonaws.com/prod-ucs-content-store-us-east/content/pii:S1381116910001044/gr1/DOWNSAMPLED/image/jpeg/1bb6a3d25c4b9a11b159d12f438474f2/gr1.jpg https://s3-eu-west-1.amazonaws.com/prod-ucs-content-store-eu-west/content/pii:S1381116910001044/gr1/DOWNSAMPLED/image/jpeg/1bb6a3d25c4b9a11b159d12f438474f2/gr1.jpg gr1 gr1.jpg jpg 7549 252 272 IMAGE-DOWNSAMPLED 1-s2.0-S1381116910001044-gr1.sml https://s3.amazonaws.com/prod-ucs-content-store-us-east/content/pii:S1381116910001044/gr1/THUMBNAIL/image/gif/070ea8cf11a67d12bbed0ffaee6bad14/gr1.sml https://s3-eu-west-1.amazonaws.com/prod-ucs-content-store-eu-west/content/pii:S1381116910001044/gr1/THUMBNAIL/image/gif/070ea8cf11a67d12bbed0ffaee6bad14/gr1.sml gr1 gr1.sml sml 1949 164 177 IMAGE-THUMBNAIL 1-s2.0-S1381116910001044-gr1_lrg.jpg https://s3.amazonaws.com/prod-ucs-content-store-us-east/content/pii:S1381116910001044/gr1/HIGHRES/image/jpeg/53c91d58d5c17d8882fcaa2402a7a006/gr1_lrg.jpg https://s3-eu-west-1.amazonaws.com/prod-ucs-content-store-eu-west/content/pii:S1381116910001044/gr1/HIGHRES/image/jpeg/53c91d58d5c17d8882fcaa2402a7a006/gr1_lrg.jpg gr1 gr1_lrg.jpg jpg 61083 1117 1207 IMAGE-HIGH-RES 1-s2.0-S1381116910001044-gr2.jpg https://s3.amazonaws.com/prod-ucs-content-store-us-east/content/pii:S1381116910001044/gr2/DOWNSAMPLED/image/jpeg/9d35ac41215e58ac6bdd8a17475ece4b/gr2.jpg https://s3-eu-west-1.amazonaws.com/prod-ucs-content-store-eu-west/content/pii:S1381116910001044/gr2/DOWNSAMPLED/image/jpeg/9d35ac41215e58ac6bdd8a17475ece4b/gr2.jpg gr2 gr2.jpg jpg 9484 193 299 IMAGE-DOWNSAMPLED 1-s2.0-S1381116910001044-gr2.sml https://s3.amazonaws.com/prod-ucs-content-store-us-east/content/pii:S1381116910001044/gr2/THUMBNAIL/image/gif/863099968eecd6dc5e85ee0bf92378e3/gr2.sml https://s3-eu-west-1.amazonaws.com/prod-ucs-content-store-eu-west/content/pii:S1381116910001044/gr2/THUMBNAIL/image/gif/863099968eecd6dc5e85ee0bf92378e3/gr2.sml gr2 gr2.sml sml 2849 141 219 IMAGE-THUMBNAIL 1-s2.0-S1381116910001044-gr2_lrg.jpg https://s3.amazonaws.com/prod-ucs-content-store-us-east/content/pii:S1381116910001044/gr2/HIGHRES/image/jpeg/0dd3534e65f5d7235fa0105c34fa28f2/gr2_lrg.jpg https://s3-eu-west-1.amazonaws.com/prod-ucs-content-store-eu-west/content/pii:S1381116910001044/gr2/HIGHRES/image/jpeg/0dd3534e65f5d7235fa0105c34fa28f2/gr2_lrg.jpg gr2 gr2_lrg.jpg jpg 77837 857 1327 IMAGE-HIGH-RES 1-s2.0-S1381116910001044-gr4.jpg https://s3.amazonaws.com/prod-ucs-content-store-us-east/content/pii:S1381116910001044/gr4/DOWNSAMPLED/image/jpeg/ef2134b09b9331cb09a1ed0cfd2ca179/gr4.jpg https://s3-eu-west-1.amazonaws.com/prod-ucs-content-store-eu-west/content/pii:S1381116910001044/gr4/DOWNSAMPLED/image/jpeg/ef2134b09b9331cb09a1ed0cfd2ca179/gr4.jpg gr4 gr4.jpg jpg 62124 240 508 IMAGE-DOWNSAMPLED 1-s2.0-S1381116910001044-gr4.sml https://s3.amazonaws.com/prod-ucs-content-store-us-east/content/pii:S1381116910001044/gr4/THUMBNAIL/image/gif/198b9ea43e0f21c4ccc8435ae8525e2a/gr4.sml https://s3-eu-west-1.amazonaws.com/prod-ucs-content-store-eu-west/content/pii:S1381116910001044/gr4/THUMBNAIL/image/gif/198b9ea43e0f21c4ccc8435ae8525e2a/gr4.sml gr4 gr4.sml sml 8483 104 219 IMAGE-THUMBNAIL 1-s2.0-S1381116910001044-gr4_lrg.jpg https://s3.amazonaws.com/prod-ucs-content-store-us-east/content/pii:S1381116910001044/gr4/HIGHRES/image/jpeg/473b6252b24657f6ea0c7e9259e40226/gr4_lrg.jpg https://s3-eu-west-1.amazonaws.com/prod-ucs-content-store-eu-west/content/pii:S1381116910001044/gr4/HIGHRES/image/jpeg/473b6252b24657f6ea0c7e9259e40226/gr4_lrg.jpg gr4 gr4_lrg.jpg jpg 245188 639 1350 IMAGE-HIGH-RES 1-s2.0-S1381116910001044-gr5.jpg https://s3.amazonaws.com/prod-ucs-content-store-us-east/content/pii:S1381116910001044/gr5/DOWNSAMPLED/image/jpeg/9d527d80e07f35a40a39501721cbe00e/gr5.jpg https://s3-eu-west-1.amazonaws.com/prod-ucs-content-store-eu-west/content/pii:S1381116910001044/gr5/DOWNSAMPLED/image/jpeg/9d527d80e07f35a40a39501721cbe00e/gr5.jpg gr5 gr5.jpg jpg 33343 522 332 IMAGE-DOWNSAMPLED 1-s2.0-S1381116910001044-gr5.sml https://s3.amazonaws.com/prod-ucs-content-store-us-east/content/pii:S1381116910001044/gr5/THUMBNAIL/image/gif/b6f436f92a3ec716c7cc68fd5872cec6/gr5.sml https://s3-eu-west-1.amazonaws.com/prod-ucs-content-store-eu-west/content/pii:S1381116910001044/gr5/THUMBNAIL/image/gif/b6f436f92a3ec716c7cc68fd5872cec6/gr5.sml gr5 gr5.sml sml 2523 164 104 IMAGE-THUMBNAIL 1-s2.0-S1381116910001044-gr5_lrg.jpg https://s3.amazonaws.com/prod-ucs-content-store-us-east/content/pii:S1381116910001044/gr5/HIGHRES/image/jpeg/789a1aab1176d2de424ef24030628c64/gr5_lrg.jpg https://s3-eu-west-1.amazonaws.com/prod-ucs-content-store-eu-west/content/pii:S1381116910001044/gr5/HIGHRES/image/jpeg/789a1aab1176d2de424ef24030628c64/gr5_lrg.jpg gr5 gr5_lrg.jpg jpg 256642 2316 1473 IMAGE-HIGH-RES 1-s2.0-S1381116910001044-sc1.gif https://s3.amazonaws.com/prod-ucs-content-store-us-east/content/pii:S1381116910001044/sc1/DOWNSAMPLED/image/gif/884cc34e1b8db5d235dac716e8f5ca52/sc1.gif https://s3-eu-west-1.amazonaws.com/prod-ucs-content-store-eu-west/content/pii:S1381116910001044/sc1/DOWNSAMPLED/image/gif/884cc34e1b8db5d235dac716e8f5ca52/sc1.gif sc1 sc1.gif gif 2295 60 362 IMAGE-DOWNSAMPLED 1-s2.0-S1381116910001044-sc1.sml https://s3.amazonaws.com/prod-ucs-content-store-us-east/content/pii:S1381116910001044/sc1/THUMBNAIL/image/gif/44607fa8707f39346046a7de9822919a/sc1.sml https://s3-eu-west-1.amazonaws.com/prod-ucs-content-store-eu-west/content/pii:S1381116910001044/sc1/THUMBNAIL/image/gif/44607fa8707f39346046a7de9822919a/sc1.sml sc1 sc1.sml sml 1162 36 219 IMAGE-THUMBNAIL 1-s2.0-S1381116910001044-sc1_lrg.gif https://s3.amazonaws.com/prod-ucs-content-store-us-east/content/pii:S1381116910001044/sc1/HIGHRES/image/gif/ac07b18e98c449a16b4bdeec17b2c626/sc1_lrg.gif https://s3-eu-west-1.amazonaws.com/prod-ucs-content-store-eu-west/content/pii:S1381116910001044/sc1/HIGHRES/image/gif/ac07b18e98c449a16b4bdeec17b2c626/sc1_lrg.gif sc1 sc1_lrg.gif gif 16232 530 3208 IMAGE-HIGH-RES 1-s2.0-S1381116910001044-mmc1.doc https://s3.amazonaws.com/prod-ucs-content-store-us-east/content/pii:S1381116910001044/mmc1/MAIN/application/msword/4a752381d5267be11f66e6a8a25ff18c/mmc1.doc https://s3-eu-west-1.amazonaws.com/prod-ucs-content-store-eu-west/content/pii:S1381116910001044/mmc1/MAIN/application/msword/4a752381d5267be11f66e6a8a25ff18c/mmc1.doc mmc1 mmc1.doc doc 733184 APPLICATION 1-s2.0-S1381116910001044-gr3.jpg https://s3.amazonaws.com/prod-ucs-content-store-us-east/content/pii:S1381116910001044/gr3/DOWNSAMPLED/image/jpeg/3bf35d51cab7c4e514eb0d6f307b3ac8/gr3.jpg https://s3-eu-west-1.amazonaws.com/prod-ucs-content-store-eu-west/content/pii:S1381116910001044/gr3/DOWNSAMPLED/image/jpeg/3bf35d51cab7c4e514eb0d6f307b3ac8/gr3.jpg gr3 gr3.jpg jpg 20995 181 251 IMAGE-DOWNSAMPLED 1-s2.0-S1381116910001044-gr3.sml https://s3.amazonaws.com/prod-ucs-content-store-us-east/content/pii:S1381116910001044/gr3/THUMBNAIL/image/gif/032cb5fda4a26675a1e05019493e44b8/gr3.sml https://s3-eu-west-1.amazonaws.com/prod-ucs-content-store-eu-west/content/pii:S1381116910001044/gr3/THUMBNAIL/image/gif/032cb5fda4a26675a1e05019493e44b8/gr3.sml gr3 gr3.sml sml 2747 158 219 IMAGE-THUMBNAIL 1-s2.0-S1381116910001044-gr3_lrg.jpg https://s3.amazonaws.com/prod-ucs-content-store-us-east/content/pii:S1381116910001044/gr3/HIGHRES/image/jpeg/eeb4ebed2a1d26cd4d6e3e10ecd1fe24/gr3_lrg.jpg https://s3-eu-west-1.amazonaws.com/prod-ucs-content-store-eu-west/content/pii:S1381116910001044/gr3/HIGHRES/image/jpeg/eeb4ebed2a1d26cd4d6e3e10ecd1fe24/gr3_lrg.jpg gr3 gr3_lrg.jpg jpg 76982 802 1112 IMAGE-HIGH-RES MOLCAA 7787 S1381-1169(10)00104-4 10.1016/j.molcata.2010.03.007 Elsevier B.V. Fig. 1 Small angle X-ray diffraction patterns of pristine SBA-15 (a) and AgSBA-15 (b) samples. Fig. 2 Wide-angle XRD pattern of calcined AgSBA-15 sample. Fig. 3 XPS spectrum of AgSBA-15 sample. Fig. 4 TEM images of the AgSBA-15 catalyst viewed along (left) [001] and (right) [100] directions. Fig. 5 The nitrogen adsorption and desorption isotherms and pore size distribution curves (insets) for AgSBA-15 (a) and SBA-15 (b) samples. Scheme 1 Three-component synthesis of propargylamines catalyzed by AgSBA-15. Table 1 Effect of solvents on the A3-coupling reaction using AgSBA-15-6 as catalyst a . Run Solvent Yield b (%) 1 CH2Cl2 0 2 CHCl3 0 3 Toluene 42 4 CH3OH 48 5 CH3CN 65 6 H2O Trace 7 Glycol 73 a Reaction conditions: butaldehyde (1.0mmol), diethylamine (1.2mmol), phenylacetylene (1.5mmol), AgSBA-15-6 (5mol%), solvent (5ml), nitrogen, 100°C, 2h. b Isolated yields. Table 2 Recycling of the catalytic system for the A3-coupling reaction a . Run 1 2 3 4 5 Yield b (%) 73.4 72.8 71.5 68.0 26.2 a Reaction conditions: butaldehyde (1.0mmol), diethylamine (1.2mmol), phenylacetylene (1.5mmol), AgSBA-15-6 (5mol%), glycol (5ml), nitrogen, 100°C, 2h. b Isolated yields. Table 3 Effect of Ag-nanoparticle size on A3-coupling reaction a . Catalyst Ag content b (%) Particle size c (nm) Yield d (%) Butaldehyde Pentanal SBA-15 0 0 0 AgSBA-15-1 0.26 4-5 35.0 28.1 AgSBA-15-2 0.42 4-5 37.1 28.6 6.78 4-5 56.4 49.3 AgSBA-15-3 3.23 8 46.2 44.9 AgSBA-15-4 5.28 8 61.0 59.7 AgSBA-15-5 5.89 8 65.3 61.3 AgSBA-15-6 6.86 8 73.4 68.0 AgSBA-15-7 10.62 12 66.0 56.4 AgSBA-15-8 20.03 33 44.0 42.2 AgSBA-15-9 32.15 40 30.1 28.0 AgSBA-15-10 49.72 41 26.2 22.6 The underlines emphasize catalysts with similar Ag content but different particle sizes exhibit different yields. a Reaction conditions: aldehydes (1.0mmol), diethylamine (1.2mmol), phenylacetylene (1.5mmol), catalysts (5mol%), glycol (5ml), nitrogen, 100°C. b Determined by ICP. c Estimated by the Scherrer equation from XRD patterns. d Isolated yields. Table 4 A3-coupling of aldehydes, alkynes and secondary amines a . Run Aldehydes Alkynes Amines Time (min) Yield b (%) 1 Paraformaldehyde Phenylacetylene Diethylamine 30 95.0 2 Butaldehyde Phenylacetylene Diethylamine 120 73.4 3 Pentanal Phenylacetylene Diethylamine 240 68.0 4 Heptaldehyde Phenylacetylene Diethylamine 240 52.0 5 Paraformaldehyde Phenylacetylene Piperidine 30 95.0 6 Butaldehyde Phenylacetylene Piperidine 120 61.0 7 Pentanal Phenylacetylene Piperidine 240 53.2 8 Heptaldehyde Phenylacetylene Piperidine 240 42.8 9 Paraformaldehyde Hex-1-yne Diethylamine 30 86.0 10 Butaldehyde Hex-1-yne Diethylamine 120 68.0 11 Heptaldehyde Hex-1-yne Diethylamine 240 50.0 12 Paraformaldehyde Hex-1-yne Piperidine 30 80.0 13 Butaldehyde Hex-1-yne Piperidine 120 57.0 14 Heptaldehyde Hex-1-yne Piperidine 240 40.0 a Reaction conditions: aldehydes (1.0mmol), secondary amines (1.2mmol), alkynes (1.5mmol), AgSBA-15-6 (5mol%), glycol (5ml), nitrogen, 100°C (for paraformaldehyde 75°C). b Isolated yields. Mesoporous SBA-15 supported silver nanoparticles as environmentally friendly catalysts for three-component reaction of aldehydes, alkynes and amines with glycol as a “green” solvent Guo-Ping Yong a ⁎ Dong Tian a b Hong-Wu Tong a Shao-Min Liu a ⁎⁎ a Department of Chemistry, University of Science and Technology of China, 96 Jinzhai Road, Hefei 230026, PR China b Department of Chemistry, Huainan Normal College, Huainan 232001, PR China ⁎ Corresponding author. Tel.: +86 551 360 0924; fax: +86 551 360 1592. ⁎⁎ Corresponding author. Graphical abstract Mesoporous SBA-15 supported silver nanoparticles can catalyze A3-coupling reaction of aldehydes, alkynes and amines in more environmentally friendly medium with glycol as “green” solvent. The catalysts could be recovered easily and used repetitively four times. It is also found that the maximum reaction yield has been obtained for an average Ag-nanoparticle size of about 8nm. The mesoporous SBA-15 supported silver nanoparticles catalyst system with a highly ordered hexagonal mesostructure was prepared by an in situ reduction method using hexamethylenetetramine as mild and efficient reducing agent. These AgSBA-15 materials act as environmentally friendly catalysts in A3-coupling reactions of aldehydes, amines, and terminal alkynes with glycol as a “green” solvent. It is also found that the maximum reaction yield has been obtained for an average Ag-nanoparticle size of about 8nm. The catalyst could also be recovered easily and used repetitively four times without significantly affecting the catalytic activity. The heterogeneous catalysts were fully characterized by N2 adsorption and desorption, XRD, TEM, ICP and XPS. Keywords A3-coupling reaction Glycol Heterogeneous catalysis SBA-15 Silver nanoparticles 1 Introduction Three-component coupling reactions of aldehyde, alkyne, and amine (A3-coupling) have attracted much attention, because their coupling products, propargylamines, are versatile building blocks for the synthesis of N-containing heterocyclic compounds such as pyrrolidines, oxazoles and pyrroles [1–7], and key intermediates for natural product synthesis [8–11]. There has been an ongoing interest to develop homogeneous transition metal salt catalysts for this three component (A3-coupling) reaction, such as Cu(I) salts [4,12–20], Ag(I) salts [1,21–23], Au(I)/Au(III) salts [18,24–27], Fe(III) salts [28], and Ir, In and Zn compounds [29–34]. Ag(I) and Cu(I) salts in ionic liquids have also been developed to achieve the recyclability of the catalysts [35,36]. However, using the above-mentioned protocols, reactions were carried out in either toxic solvent like toluene, or expensive system, such as ionic liquids. Heterogeneous catalysis offers the opportunity for easy separation and recycling of the catalyst. Thus, the development of improved synthetic methods for the preparation of propargylamines remains an active research area. As heterogeneous catalysis systems, hydroxyapatite-supported copper (Cu-HAP), layered double hydroxide supported gold (LDH-AuCl4) and heteropolyacid-supported silver (Ag-HPA) [37–39], zinc dust, AgY zeolite, nanocrystalline CuO and CeO2- or ZrO2-stabilized Au(III) [26,40–42] were successfully used to catalyze A3-coupling reactions with reusability of catalysts. Recently, Ag-, Au- and Cu-nanoparticles as reusable catalysts have also been reported [43–46]. However, almost all of these A3-coupling reaction protocols were carried out in toxic solvents. It is desirable to develop highly efficient catalysts for A3-coupling reactions in environmentally friendly medium. Most recently, environmentally friendly A3-coupling reactions in water [18,47] or under solvent-free conditions [48–51] have been described. However, no mesoporous silica supported Ag-nanoparticles as reusable catalyst for A3-coupling reactions in environmentally friendly medium has so far been reported. According to their narrow pore size distribution, high specific surface area (600–1000m2 g−1) and large pore volume, SBA-15 mesoporous silica materials are promising catalyst supports [52–54]. An in situ reduction method using hexamethylenetetramine (HMTA) as mild and efficient reducing agent for the preparation mesoporous SBA-15 supported silver nanoparticles has been recently disclosed by our group [55]. Herein, we report a novel recyclable SBA-15 supported silver nanoparticles catalyst for A3-coupling reaction. Furthermore, we first demonstrate the silver nanoparticles-catalyzed A3-coupling reactions can be carried out in a more environmentally benign medium. As far as we know, this kind of silver nanoparticles-catalyzed “green” reaction has not been reported before. 2 Experimental All reagents were purchased from commercial sources and were used as received. 2.1 Catalyst preparation Pure mesoporous silica SBA-15 material was hydrothermally synthesized using tri-block copolymer pluronic P123 as a template in acidic conditions. The gel solution was prepared by dispersing 8g of P123 in 60g of distilled water, followed by 15min of vigorous stirring at 40°C. The resulting solution was mixed with 48g of HCl (37%) and 190g of H2O and stirred for another 17h. Finally, 21.2g of tetraethylorthosilicate (TEOS) solution was added dropwise in the gel mixture at 40°C with stirring for 9h before being placed in a Teflon autoclave at 100°C for 12h. After the completion of synthesis, the product was filtered, washed with distilled water, and air-dried overnight at 50°C. The solid was calcined at 550°C (heating rate 2°Cmin−1) for 5h. Supported AgSBA-15 catalysts were synthesized via in situ reduction method using hexamethylenetetramine (HMTA) as reducing agent. A series of AgSBA-15 catalysts were prepared as follows: 1g of tri-block copolymer pluronic P123 was dissolved in 30g of H2O to get a clear solution. Thereafter, 3g of nitric acid was added, and the solution was stirred at 35°C for 1h. Then, 0.35g of HMTA and various amounts of AgNO3 (such as 0.035, 0.070, 0.10, 0.125, 0.15, 0.175, 0.20, 0.25, 0.50, and 1.0g) were added, and the resulting mixture was stirred for another 3h at 35°C while darkening. After 2.13g of TEOS was added and continuously stirred at 35°C for 20h while darkening, the mixture was crystallized at 100°C for 48h under static and darkening conditions. The resulting solid was filtered, washed several times with water and ethanol, and then dried for 10h at 50°C under vacuum condition. Finally, the solid was calcined in air at 550°C (heating rate 2°Cmin−1) for 5h. The corresponding AgSBA-15 catalysts were named as AgSBA-15-1, AgSBA-15-2, AgSBA-15-3, AgSBA-15-4, AgSBA-15-5, AgSBA-15-6, Ag-SBA-15-7, AgSBA-15-8, AgSBA-15-9, and AgSBA-15-10, respectively. 2.2 Catalyst characterization Powder X-ray diffraction (PXRD) patterns were recorded on a Philips X’Pert PRO SUPER diffractometer operating with nickel-filtered Cu-Kα radiation. X-ray photoelectron spectroscopy (XPS) measurements were performed on a ESCALAB 250 high performance electron spectrometer using monochromatized Al-Kα excitation source (hν =1486.6eV). Transmission electron micrographs (TEM) were taken on a JEOL-2010 electron microscope operating at 200kV. N2 adsorption and desorption isotherms were obtained at −196°C on an Omnisorp 100CX instrument. The specific surface area was calculated using the BET model. The content of Ag loaded in mesoporous silica was determined by Atomscan Advantage inductively coupled high frequency plasma atomic emission spectrometry (ICP-AES). 2.3 Catalytic studies Typical procedure for the A3-coupling reaction: in a 50ml round bottom flask, aldehydes (1.0mmol), secondary amines (1.2mmol) and alkynes (1.5mmol) in glycol (5ml) were mixed and stirred under a nitrogen atmosphere. To this, AgSBA-15 catalyst (5mol%) was added. The resulting solution was refluxed at 75 or 100°C for the appropriate time mentioned in Table 4. The progress of reaction was monitored by TLC. After the completion of the reaction, the reaction mixture was cooled and extracted with ether for three times, and the ether layer was dried over anhydrous Na2SO4, and the ether was removed under reduced pressure to afford the crude product. The crude product was subjected to purification by silica gel column chromatography using ethyl acetate and petroleum ether (1:10) as an eluent to yield the propargylamines. The structures of all the products were unambiguously established on the basis of their 1H NMR data (all 1H NMR spectra were recorded on an Avance AV300 spectrometer using CDCl3 as solvent). 3 Results and discussion 3.1 Characterization of the catalysts The calcined AgSBA-15 catalysts retained its hexagonally packed porous structure as shown in the small angle XRD pattern (Fig. 1 ), one major peak at 2θ ≈1° together with two additional peaks can be observed, which are the characteristic of the hexagonal mesoporous structure of SBA-15. Different from the other reports, in which the peak intensities usually decrease after guest loading, comparatively, the intensity in this case has somewhat increase after loading Ag, especially for (100) reflection. It is more likely that the sample thickness/homogeneity was different in the XRD experiments. Interestingly, after loading Ag, the (100) peak is shifted to higher 2θ value, which is attributed to the network shrinkage (the a 0 parameters of SBA-15 and AgSBA-15 are 11.55 and 10.59nm, respectively). AgNO3 could be adsorbed on the EO moiety surfaces to form a complex with the micelles formed by P123 in aqueous solution, which possibly resulted in the long hydrophobic chain shrinkage of P123 [56], giving rise to the network shrinkage of AgSBA-15. Silver metal has major diffraction peaks at 2θ =38°, 44.2°, 64.4°, and 77.6°, corresponding to the (111), (200), (220) and (311) lattice planes of the cubic structure of Ag, which are clearly found in the wide-angle X-ray diffraction data (2θ =35–80°) of AgSBA-15 (Fig. 2 ), confirming the formation of crystalline silver. Fig. 3 shows the X-ray photoelectron spectrum of AgSBA-15 in the Ag 3d5/2 and Ag 3d3/2. The Ag 3d5/2 peak is centered at 368.23eV. This binding energy matches well with that of Ag (0) 3d5/2 [57] and no obvious peak of Ag+ is observed, which indicates that the silver element has been totally reduced and confined on the surface of the SBA-15. As shown in Fig. 4 , the TEM images of AgSBA-15 show hexagonal array of mesoporous channels, as indicated by the above SAXRD result. Although some silver ions were reduced on the outer surface of the SBA-15, no bulk aggregation of the metal can be found. The uniform dispersion of Ag-nanoparticles on the inner surface and on the outer surface of AgSBA-15 channels can be clearly observed. The existence of the Ag-nanoparticles can be further proved by energy dispersive spectroscopy analysis of X-rays (EDAX). Fig. 5 shows the nitrogen adsorption and desorption isotherms of SBA-15 and AgSBA-15. Type IV isotherm curves with a well-defined step clearly indicate that these materials possess a mesoporous structure with cylindrical channels. Three well-distinguished regions of the adsorption isotherms are obvious: (1) monolayer multilayer adsorption (P/P 0 =0–0.5); (2) capillary condensation (P/P 0 =0.5–0.8) and (3) multilayer adsorption on the outer surface (P/P 0 =0.8–1.0). A sharp inflection in the relative pressure (P/P 0) between 0.5 and 0.8 corresponds to capillary condensation within uniform mesopores, and is a function of the pore diameter. The uniform pore size distribution is demonstrated by the sharpness of this step and displayed in the insets of Fig. 5a and b. The decreases of the BET surface area, BJH pore volume and average pore size together with the increased thickness of the pore wall, can be attributed to the incorporation of Ag-nanoparticles on SBA-15. However, the BET surface area of AgSBA-15 (525m2 g−1) is lower than SBA-15 (773m2 g−1), which can be attributed to the agglomeration of Ag-nanoparticles that partly block the pore space of mesoporous channels. 3.2 Catalytic studies Our initial investigation focused on the effect of solvents on the A3-coupling reactions of butaldehyde, phenylacetylene, and diethylamine (Scheme 1 ). In general, A3-coupling reactions were carried out in toluene, CH3CN, THF, and other solvents. Here, different solvents were employed in the A3-coupling using AgSBA-15-6 as catalyst at 100°C, and the results are summarized in Table 1 . From Table 1, it is evident that glycol and CH3CN are suitable reaction solvents for A3-coupling reaction (runs 5 and 7), whereas toluene and CH3OH afforded lower yields (runs 3 and 4). No or trace products were obtained when the reactions were carried out in CH2Cl2, CHCl3 or H2O. Although the polar solvents, such as glycol or CH3CN afforded good yields, when water was used as the solvent, only a trace amount of product was observed even after a prolonged reaction time. To avoid the use of volatile solvents and to reduce the environmental pollution, all the three-component coupling reactions were performed with glycol as “green” solvent. Heterogeneous catalysts offer ease of handling and purification through simple filtration. They also allow catalyst recovery and recycling, another interesting eco-friendly aspect of these catalysts. In order to examine this possibility, we carried out the A3-coupling reaction several times with the same AgSBA-15-6 catalyst under the same condition. Before reuse, the solid was separated from the reaction medium by filtration, washed with dichloromethane and finally dried at 40°C. The reaction yield (Table 2 ) shows that AgSBA-15-6 catalyst can be repeatedly used four times without apparent decrease in its catalytic activity. At the same time, the Ag content in the fresh and used catalyst after 4 cycles was found to be similar (Ag in the fresh catalyst: 6.86%, and in the used catalyst after 4 cycles: 6.50%, analyzed by ICP). These studies clearly demonstrate that the silver is strongly bonded onto the silica surface during the reaction. A series of experiments were carried out in an effort to investigate catalytic action of Ag-nanoparticles with different sizes and the results are presented in Table 3 . Ag-nanoparticles with different sizes, ranging from about 4–5 to 41nm (estimated by the Scherrer equation from XRD patterns), were prepared using various AgNO3 amounts during preparation procedure. The study shows that the catalytic action is dependent on the Ag-nanoparticles size (Table 3). The maximum reaction yield has been observed for an average Ag-nanoparticle size of about 8nm, because Ag-nanoparticles with average size of 7nm show more excellent catalytic activity [58]. With a decrease in particle size, a trend of decreasing reaction yield has been found for Ag-nanoparticle size of less than 8nm, even if the catalytic amount of AgSBA-15-2 catalyst (particle size ∼4–5nm) was increased in order to make Ag content up to 6.78%, which was similar to the Ag content (6.86%) of AgSBA-15-6 catalyst (particle size ∼8nm). Furthermore, those above 8nm also show a steady decline of reaction yield with increasing Ag-nanoparticles size. It has been postulated that in the case of particles of average size less than 8nm, a downward shift of the Fermi level takes place, with a consequent increase of band gap energy. As a result, the particles require more energy to pump electrons to the adsorbed ions for electron transfer reaction [44]. This leads to a reduction in reaction yield when catalyzed by smaller particles. As for Ag-nanoparticles larger than 8nm, the decrease in catalytic efficiency could be ascribed to less adsorption surface area with increasing particle size. From Table 3, it is also found that with similar Ag-nanoparticles size (AgSBA-15-3–AgSBA-15-6), the reaction yield increases with increasing Ag content. With above conditions in hand, we then explored the scope of this AgSBA-15-catalyzed A3-coupling reaction (Table 4 ). The effect of the aldehydes with various aliphatic chain lengths was examined. According to the steric hindrance, the longer aliphatic chain, the more difficult reaction, and the reverse should also be true. When increasing the steric hindrance of aldehydes (runs 3 and 4), it consumed longer time to complete the reaction and gave a decrease in yield. The effect of the amine was also examined, and it was found that cyclic secondary amine, piperidine, gave similar results to diethylamine in terms of reaction time, except that yield were lowered, which may also be consequence of steric hindrance. As a result, the reaction was found to be highly affected by the steric hindrance of the aldehydes, which is probably ascribed to the limitation effect of the SBA-15 channels that strongly influence the addition of iminium ions to activated alkynes. This hypothesis is consistent with our result that aromatic aldehydes could only afford trace or even no products. 4 Conclusions In summary, a new heterogeneous catalyst system, AgSBA-15, has been successfully prepared by an in situ reduction method using HMTA as mild and efficient reducing agent, which can catalyze A3-coupling reaction in more environmentally friendly medium with glycol as a “green” solvent. It is also found that the maximum reaction yield has been achieved for an average Ag-nanoparticle size of about 8nm. Furthermore, the catalyst can be readily recovered and reused for several cycles with only a slight decrease in catalytic activity. Acknowledgements This work was financially supported by National Nature Science Foundation of China (Grant No. 20872135) and China National Tobacco Corporation (110200701007). Appendix A Supplementary data Supplementary data associated with this article can be found, in the online version, at doi:10.1016/j.molcata.2010.03.007. Appendix A Supplementary data Pore structure parameters of SBA-15 and AgSBA-15; EDAX of AgSBA-15; wide-angle XRD patterns of calcined AgSBA-15-1∼AgSBA-15-10; probable mechanism of the A3-coupling reaction catalyzed by AgSBA-15 catalyst; 1H NMR data for products of A3-coupling reactions. References [1] C.M. Wei Z.G. Li C.J. Li Org. Lett. 5 2003 4473 4475 [2] D.F. Harvey D.M. Sigano J. Org. Chem. 61 1996 2268 2272 [3] A. Fürstner H. Szillat F. Stelzer J. Am. Chem. Soc. 122 2000 6785 6786 [4] Y. Yamamoto H. Hayashi T. Saigoku H. Nishiyama J. Am. Chem. Soc. 127 2005 10804 10805 [5] E.-S. Lee H.-S. Yeom J.-H. Hwang S. Shin Eur. J. Org. Chem. 2007 3503 3507 [6] B. Yan Y.H. Liu Org. Lett. 9 2007 4323 4326 [7] O. Russo S. Messaoudi A. Hamze N. Olivi J.-F. Peyrat J.-D. Brion S. Sicsic I. Berque-Bestel M. Alami Tetrahedron 63 2007 10671 10683 [8] M. Shibasaki Y. Ishida G. Iwasaki T. Iimori J. Org. Chem. 52 1987 3488 3489 [9] N. Gommermann P. Knochel Chem. Commun. 2004 2324 2325 [10] B. Jiang M. Xu Angew. Chem. Int. Ed. 43 2004 2543 2546 [11] Q. Xu E. Rozners Org. Lett. 7 2005 2821 2824 [12] G.W. Kabalka L. Wang R.M. Pagni Synlett 2001 676 678 [13] C.M. Wei C.J. Li J. Am. Chem. Soc. 124 2002 5638 5639 [14] H.Z.S. Huma R. Halder S.S. Karla J. Das J. Iqbal Tetrahedron Lett. 43 2002 6485 6488 [15] N. Gommermann C. Koradin K. Polborn P. Knochel Angew. Chem. Int. Ed. 42 2003 5763 5766 [16] L. Shi Y.Q. Tu M. Wang F.M. Zhang C.A. Fan Org. Lett. 6 2004 1001 1003 [17] C. Wei J.T. Mague C.J. Li Proc. Natl. Acad. Sci. 101 2004 5749 5754 [18] B.S. Huang X.Q. Yao C.J. Li Adv. Synth. Catal. 348 2006 1528 1532 [19] N. Gommermann P. Knochel Chem. Eur. J. 12 2006 4380 4392 [20] W.Q. Du J.M. Zhang R. Wu Q. Liang S.Z. Zhu J. Fluorine Chem. 129 2008 695 700 [21] J.X. Ji T.T.L. Au-Yeung J. Wu C.W. Yip A.S.C. Chan Adv. Synth. Catal. 346 2004 42 44 [22] Y. Zhang A.M. Santos E. Herdtweck J. Mink F.E. Kühn New J. Chem. 29 2005 366 370 [23] X.Q. Yao C.J. Li Org. Lett. 7 2005 4395 4398 [24] C. Wei C.J. Li J. Am. Chem. Soc. 125 2003 9584 9585 [25] V.K.Y. Lo Y. Liu M.K. Wong C.M. Che Org. Lett. 8 2006 1529 1532 [26] X. Zhang A. Corma Angew. Chem. Int. Ed. 47 2008 4358 4361 [27] V.K.Y. Lo K.K.Y. Kung M.K. Wong C.M. Che J. Organomet. Chem. 694 2009 583 591 [28] W.W. Chen R.V. Nguyen C.J. Li Tetrahedron Lett. 50 2009 2895 2898 [29] S. Sakaguchi T. Kubo Y. Ishii Angew. Chem. Int. Ed. 40 2001 2534 2536 [30] C. Fischer E.M. Carreira Org. Lett. 3 2001 4319 4321 [31] S. Sakaguchi T. Mizuta M. Furuwan T. Kubo Y. Ishii Chem. Commun. 2004 1638 1639 [32] L. Zani T. Eichhorn C. Bolm Chem. Eur. J. 13 2007 2587 2600 [33] E. Ramu R. Varala N. Sreelatha S.R. Adapa Tetrahedron Lett. 48 2007 7184 7190 [34] Y.C. Zhang P.H. Li M. Wang L. Wang J. Org. Chem. 74 2009 4364 4367 [35] Z. Li C. Wei L. Chen R.S. Varma C.J. Li Tetrahedron Lett. 45 2004 2443 2446 [36] S.B. Park H. Alper Chem. Commun. 2005 1315 1317 [37] B.M. Choudary C. Sridhar M.L. Kantam B. Sreedhar Tetrahedron Lett. 45 2004 7319 7321 [38] M.L. Kantam B.V. Prakash C.R.V. Reddy B. Sreedhar Synlett 2005 2329 2332 [39] K.M. Reddy N.S. Babu I. Suryanarayana P.S.S. Prasad N. Lingaiah Tetrahedron Lett. 47 2006 7563 7566 [40] M.L. Kantam V. Balasubrahmanyam K.B.S. Kumar G.T. Venkanna Tetrahedron Lett. 48 2007 7332 7334 [41] R. Maggi A. Bello C. Oro G. Sartori L. Soldi Tetrahedron 64 2008 1435 1439 [42] M.L. Kantam S. Laha J. Yadav S. Bhargava Tetrahedron Lett. 49 2008 3083 3086 [43] W.J. Yan R. Wang Z.Q. Xu J.K. Xu L. Lin Z.Q. Shen Y.F. Zhou J. Mol. Catal. A: Chem. 255 2006 81 85 [44] M. Kidwai V. Bansal A. Kumar S. Mozumdar Green Chem. 9 2007 742 745 [45] M. Kidwai V. Bansal N.K. Mishra A. Kumar S. Mozumdar Synlett 2007 1581 1584 [46] S.J. Wang X.X. He L.X. Song Z.Y. Wang Synlett 2009 447 450 [47] Y.Q. Zhou T.T. He Z.Y. Wang Arkivoc 2008 80 90 [48] P.H. Li L. Wang Tetrahedron 63 2007 5455 5459 [49] M. Wang P.H. Li. L. Wang Eur. J. Org. Chem. 2008 2255 2261 [50] M.K. Patil M. Keller B.M. Reddy P. Pale J. Sommer Eur. J. Org. Chem. 2008 4440 4445 [51] P.H. Li L. Wang Y.C. Zhang M. Wang Tetrahedron Lett. 49 2008 6650 6654 [52] L. Li J.L. Shi Adv. Synth. Catal. 350 2008 667 672 [53] Y.J. Guan E.J.M. Hensen Appl. Catal. A 361 2009 49 56 [54] T. Tsoncheva L. Ivanova J. Rosenholm M. Linden Appl. Catal. B 89 2009 365 374 [55] D. Tian G.P. Yong Y. Dai X.Y. Yan S.M. Liu Catal. Lett. 130 2009 211 216 [56] W.P. Zhu Y.C. Han L.J. An Micropor. Mesopor. Mater. 80 2005 221 226 [57] P.H. Citrin G.K. Wertheim T. Baer Phys. Rev. B 27 1983 3160 3175 [58] Z.P. Qu W.X. Huang M.J. Cheng X.H. Bao J. Phys. Chem. B 109 2005 15842 15848",
      "scopus-id": "77951204725",
      "coredata": {
        "eid": "1-s2.0-S1381116910001044",
        "dc:description": "The mesoporous SBA-15 supported silver nanoparticles catalyst system with a highly ordered hexagonal mesostructure was prepared by an in situ reduction method using hexamethylenetetramine as mild and efficient reducing agent. These AgSBA-15 materials act as environmentally friendly catalysts in A3-coupling reactions of aldehydes, amines, and terminal alkynes with glycol as a “green” solvent. It is also found that the maximum reaction yield has been obtained for an average Ag-nanoparticle size of about 8nm. The catalyst could also be recovered easily and used repetitively four times without significantly affecting the catalytic activity. The heterogeneous catalysts were fully characterized by N2 adsorption and desorption, XRD, TEM, ICP and XPS.",
        "openArchiveArticle": "false",
        "prism:coverDate": "2010-05-17",
        "openaccessUserLicense": null,
        "prism:aggregationType": "Journal",
        "prism:url": "https://api.elsevier.com/content/article/pii/S1381116910001044",
        "dc:creator": [
          {
            "@_fa": "true",
            "$": "Yong, Guo-Ping"
          },
          {
            "@_fa": "true",
            "$": "Tian, Dong"
          },
          {
            "@_fa": "true",
            "$": "Tong, Hong-Wu"
          },
          {
            "@_fa": "true",
            "$": "Liu, Shao-Min"
          }
        ],
        "link": [
          {
            "@_fa": "true",
            "@rel": "self",
            "@href": "https://api.elsevier.com/content/article/pii/S1381116910001044"
          },
          {
            "@_fa": "true",
            "@rel": "scidir",
            "@href": "https://www.sciencedirect.com/science/article/pii/S1381116910001044"
          }
        ],
        "dc:format": "application/json",
        "openaccessType": null,
        "pii": "S1381-1169(10)00104-4",
        "prism:volume": "323",
        "prism:publisher": "Elsevier B.V.",
        "dc:title": "Mesoporous SBA-15 supported silver nanoparticles as environmentally friendly catalysts for three-component reaction of aldehydes, alkynes and amines with glycol as a “green” solvent",
        "prism:copyright": "Copyright © 2010 Elsevier B.V. All rights reserved.",
        "openaccess": "0",
        "prism:issn": "13811169",
        "prism:issueIdentifier": "1-2",
        "dcterms:subject": [
          {
            "@_fa": "true",
            "$": "A3-coupling reaction"
          },
          {
            "@_fa": "true",
            "$": "Glycol"
          },
          {
            "@_fa": "true",
            "$": "Heterogeneous catalysis"
          },
          {
            "@_fa": "true",
            "$": "SBA-15"
          },
          {
            "@_fa": "true",
            "$": "Silver nanoparticles"
          }
        ],
        "openaccessArticle": "false",
        "prism:publicationName": "Journal of Molecular Catalysis A: Chemical",
        "prism:number": "1-2",
        "openaccessSponsorType": null,
        "prism:pageRange": "40-44",
        "prism:endingPage": "44",
        "pubType": "fla",
        "prism:coverDisplayDate": "17 May 2010",
        "prism:doi": "10.1016/j.molcata.2010.03.007",
        "prism:startingPage": "40",
        "dc:identifier": "doi:10.1016/j.molcata.2010.03.007",
        "openaccessSponsorName": null
      },
      "objects": {
        "object": [
          {
            "@category": "standard",
            "@height": "97",
            "@width": "222",
            "@_fa": "true",
            "$": "https://api.elsevier.com/content/object/eid/1-s2.0-S1381116910001044-fx1.jpg?httpAccept=%2A%2F%2A",
            "@multimediatype": "JPEG image file",
            "@type": "IMAGE-DOWNSAMPLED",
            "@size": "18316",
            "@ref": "fx1",
            "@mimetype": "image/jpeg"
          },
          {
            "@category": "thumbnail",
            "@height": "95",
            "@width": "219",
            "@_fa": "true",
            "$": "https://api.elsevier.com/content/object/eid/1-s2.0-S1381116910001044-fx1.sml?httpAccept=%2A%2F%2A",
            "@multimediatype": "GIF image file",
            "@type": "IMAGE-THUMBNAIL",
            "@size": "3239",
            "@ref": "fx1",
            "@mimetype": "image/gif"
          },
          {
            "@category": "high",
            "@height": "429",
            "@width": "984",
            "@_fa": "true",
            "$": "https://api.elsevier.com/content/object/eid/1-s2.0-S1381116910001044-fx1_lrg.jpg?httpAccept=%2A%2F%2A",
            "@multimediatype": "JPEG image file",
            "@type": "IMAGE-HIGH-RES",
            "@size": "65674",
            "@ref": "fx1",
            "@mimetype": "image/jpeg"
          },
          {
            "@category": "standard",
            "@height": "252",
            "@width": "272",
            "@_fa": "true",
            "$": "https://api.elsevier.com/content/object/eid/1-s2.0-S1381116910001044-gr1.jpg?httpAccept=%2A%2F%2A",
            "@multimediatype": "JPEG image file",
            "@type": "IMAGE-DOWNSAMPLED",
            "@size": "7549",
            "@ref": "gr1",
            "@mimetype": "image/jpeg"
          },
          {
            "@category": "thumbnail",
            "@height": "164",
            "@width": "177",
            "@_fa": "true",
            "$": "https://api.elsevier.com/content/object/eid/1-s2.0-S1381116910001044-gr1.sml?httpAccept=%2A%2F%2A",
            "@multimediatype": "GIF image file",
            "@type": "IMAGE-THUMBNAIL",
            "@size": "1949",
            "@ref": "gr1",
            "@mimetype": "image/gif"
          },
          {
            "@category": "high",
            "@height": "1117",
            "@width": "1207",
            "@_fa": "true",
            "$": "https://api.elsevier.com/content/object/eid/1-s2.0-S1381116910001044-gr1_lrg.jpg?httpAccept=%2A%2F%2A",
            "@multimediatype": "JPEG image file",
            "@type": "IMAGE-HIGH-RES",
            "@size": "61083",
            "@ref": "gr1",
            "@mimetype": "image/jpeg"
          },
          {
            "@category": "standard",
            "@height": "193",
            "@width": "299",
            "@_fa": "true",
            "$": "https://api.elsevier.com/content/object/eid/1-s2.0-S1381116910001044-gr2.jpg?httpAccept=%2A%2F%2A",
            "@multimediatype": "JPEG image file",
            "@type": "IMAGE-DOWNSAMPLED",
            "@size": "9484",
            "@ref": "gr2",
            "@mimetype": "image/jpeg"
          },
          {
            "@category": "thumbnail",
            "@height": "141",
            "@width": "219",
            "@_fa": "true",
            "$": "https://api.elsevier.com/content/object/eid/1-s2.0-S1381116910001044-gr2.sml?httpAccept=%2A%2F%2A",
            "@multimediatype": "GIF image file",
            "@type": "IMAGE-THUMBNAIL",
            "@size": "2849",
            "@ref": "gr2",
            "@mimetype": "image/gif"
          },
          {
            "@category": "high",
            "@height": "857",
            "@width": "1327",
            "@_fa": "true",
            "$": "https://api.elsevier.com/content/object/eid/1-s2.0-S1381116910001044-gr2_lrg.jpg?httpAccept=%2A%2F%2A",
            "@multimediatype": "JPEG image file",
            "@type": "IMAGE-HIGH-RES",
            "@size": "77837",
            "@ref": "gr2",
            "@mimetype": "image/jpeg"
          },
          {
            "@category": "standard",
            "@height": "240",
            "@width": "508",
            "@_fa": "true",
            "$": "https://api.elsevier.com/content/object/eid/1-s2.0-S1381116910001044-gr4.jpg?httpAccept=%2A%2F%2A",
            "@multimediatype": "JPEG image file",
            "@type": "IMAGE-DOWNSAMPLED",
            "@size": "62124",
            "@ref": "gr4",
            "@mimetype": "image/jpeg"
          },
          {
            "@category": "thumbnail",
            "@height": "104",
            "@width": "219",
            "@_fa": "true",
            "$": "https://api.elsevier.com/content/object/eid/1-s2.0-S1381116910001044-gr4.sml?httpAccept=%2A%2F%2A",
            "@multimediatype": "GIF image file",
            "@type": "IMAGE-THUMBNAIL",
            "@size": "8483",
            "@ref": "gr4",
            "@mimetype": "image/gif"
          },
          {
            "@category": "high",
            "@height": "639",
            "@width": "1350",
            "@_fa": "true",
            "$": "https://api.elsevier.com/content/object/eid/1-s2.0-S1381116910001044-gr4_lrg.jpg?httpAccept=%2A%2F%2A",
            "@multimediatype": "JPEG image file",
            "@type": "IMAGE-HIGH-RES",
            "@size": "245188",
            "@ref": "gr4",
            "@mimetype": "image/jpeg"
          },
          {
            "@category": "standard",
            "@height": "522",
            "@width": "332",
            "@_fa": "true",
            "$": "https://api.elsevier.com/content/object/eid/1-s2.0-S1381116910001044-gr5.jpg?httpAccept=%2A%2F%2A",
            "@multimediatype": "JPEG image file",
            "@type": "IMAGE-DOWNSAMPLED",
            "@size": "33343",
            "@ref": "gr5",
            "@mimetype": "image/jpeg"
          },
          {
            "@category": "thumbnail",
            "@height": "164",
            "@width": "104",
            "@_fa": "true",
            "$": "https://api.elsevier.com/content/object/eid/1-s2.0-S1381116910001044-gr5.sml?httpAccept=%2A%2F%2A",
            "@multimediatype": "GIF image file",
            "@type": "IMAGE-THUMBNAIL",
            "@size": "2523",
            "@ref": "gr5",
            "@mimetype": "image/gif"
          },
          {
            "@category": "high",
            "@height": "2316",
            "@width": "1473",
            "@_fa": "true",
            "$": "https://api.elsevier.com/content/object/eid/1-s2.0-S1381116910001044-gr5_lrg.jpg?httpAccept=%2A%2F%2A",
            "@multimediatype": "JPEG image file",
            "@type": "IMAGE-HIGH-RES",
            "@size": "256642",
            "@ref": "gr5",
            "@mimetype": "image/jpeg"
          },
          {
            "@category": "standard",
            "@height": "60",
            "@width": "362",
            "@_fa": "true",
            "$": "https://api.elsevier.com/content/object/eid/1-s2.0-S1381116910001044-sc1.gif?httpAccept=%2A%2F%2A",
            "@multimediatype": "GIF image file",
            "@type": "IMAGE-DOWNSAMPLED",
            "@size": "2295",
            "@ref": "sc1",
            "@mimetype": "image/gif"
          },
          {
            "@category": "thumbnail",
            "@height": "36",
            "@width": "219",
            "@_fa": "true",
            "$": "https://api.elsevier.com/content/object/eid/1-s2.0-S1381116910001044-sc1.sml?httpAccept=%2A%2F%2A",
            "@multimediatype": "GIF image file",
            "@type": "IMAGE-THUMBNAIL",
            "@size": "1162",
            "@ref": "sc1",
            "@mimetype": "image/gif"
          },
          {
            "@category": "high",
            "@height": "530",
            "@width": "3208",
            "@_fa": "true",
            "$": "https://api.elsevier.com/content/object/eid/1-s2.0-S1381116910001044-sc1_lrg.gif?httpAccept=%2A%2F%2A",
            "@multimediatype": "GIF image file",
            "@type": "IMAGE-HIGH-RES",
            "@size": "16232",
            "@ref": "sc1",
            "@mimetype": "image/gif"
          },
          {
            "@category": "standard",
            "@_fa": "true",
            "$": "https://api.elsevier.com/content/object/eid/1-s2.0-S1381116910001044-mmc1.doc?httpAccept=%2A%2F%2A",
            "@multimediatype": "Microsoft Word file",
            "@type": "APPLICATION",
            "@size": "733184",
            "@ref": "mmc1",
            "@mimetype": "application/word"
          },
          {
            "@category": "standard",
            "@height": "181",
            "@width": "251",
            "@_fa": "true",
            "$": "https://api.elsevier.com/content/object/eid/1-s2.0-S1381116910001044-gr3.jpg?httpAccept=%2A%2F%2A",
            "@multimediatype": "JPEG image file",
            "@type": "IMAGE-DOWNSAMPLED",
            "@size": "20995",
            "@ref": "gr3",
            "@mimetype": "image/jpeg"
          },
          {
            "@category": "thumbnail",
            "@height": "158",
            "@width": "219",
            "@_fa": "true",
            "$": "https://api.elsevier.com/content/object/eid/1-s2.0-S1381116910001044-gr3.sml?httpAccept=%2A%2F%2A",
            "@multimediatype": "GIF image file",
            "@type": "IMAGE-THUMBNAIL",
            "@size": "2747",
            "@ref": "gr3",
            "@mimetype": "image/gif"
          },
          {
            "@category": "high",
            "@height": "802",
            "@width": "1112",
            "@_fa": "true",
            "$": "https://api.elsevier.com/content/object/eid/1-s2.0-S1381116910001044-gr3_lrg.jpg?httpAccept=%2A%2F%2A",
            "@multimediatype": "JPEG image file",
            "@type": "IMAGE-HIGH-RES",
            "@size": "76982",
            "@ref": "gr3",
            "@mimetype": "image/jpeg"
          }
        ]
      },
      "link": {
        "@rel": "abstract",
        "@href": "https://api.elsevier.com/content/abstract/scopus_id/77951204725"
      }
    }
  }
}