{
  "metadata": {
    "title": "Effect of precursor acidity on zeolite supported Pd catalyst properties and hydrodeoxygenation activity for the production of biofuel",
    "authors": "; ; ",
    "journal": "Journal of Molecular Catalysis A: Chemical",
    "date": "2015-05-01",
    "doi": "10.1016/j.molcata.2015.01.033",
    "abstract": "",
    "uri": "https://api.elsevier.com/content/article/pii/S1381116915000485",
    "pii": "S1381116915000485"
  },
  "fulltext": {
    "full-text-retrieval-response": {
      "scopus-eid": "2-s2.0-84923924162",
      "originalText": "serial JL 271358 291210 291744 291790 291809 31 Journal of Molecular Catalysis A: Chemical JOURNALMOLECULARCATALYSISACHEMICAL 2015-02-03 2015-02-03 2015-03-16T16:56:58 1-s2.0-S1381116915000485 S1381-1169(15)00048-5 S1381116915000485 10.1016/j.molcata.2015.01.033 S300 S300.1 FULL-TEXT 1-s2.0-S1381116915X00033 2015-05-15T05:56:33.63776-04:00 0 0 20150501 2015 2015-02-03T07:33:17.61779Z absattachment articleinfo articletitlenorm authfirstinitialnorm authfirstsurnamenorm cid cids contenttype copyright crossmark dateloaded dateloadedtxt datesearch datesort dateupdated dco docsubtype doctype doi eid ewtransactionid hubeid indexeddate issn issnnorm itemstage itemtransactionid itemweight openaccess openarchive pg pgfirst pglast pii piinorm pubdatestart pubdatetxt pubyr sectiontitle sortorder srctitle srctitlenorm srctype ssids alllist content subj subheadings suppl tomb volfirst volissue volumelist webpdf webpdfpagecount yearnav figure table body mmlmath acknowledge affil articletitle auth authfirstini authfull authkeywords authlast grantnumber grantsponsor highlightsabst orcid primabst pubtype ref specialabst 1381-1169 13811169 true 400 400 C Volume 400 25 179 186 179 186 20150501 1 May 2015 2015-05-01 2015 Regular Papers article fla Copyright © 2015 Elsevier B.V. All rights reserved. EFFECTPRECURSORACIDITYZEOLITESUPPORTEDPDCATALYSTPROPERTIESHYDRODEOXYGENATIONACTIVITYFORPRODUCTIONBIOFUEL AYODELE O 1 Introduction 2 Experimental 2.1 Materials 2.2 Catalyst development 2.3 Catalyst characterization 2.3.1 Thermal gravimetric analysis (TGA) 2.3.2 X-ray fluorescence (XRF) 2.3.3 Energy dispersive X-ray (EDX) 2.3.4 Scanning electron microscopy (SEM) 2.3.5 Nitrogen adsorption–desorption measurements (BET method) 2.3.6 X-ray diffraction (XRD) 2.3.7 Fourier transformed infrared (FTIR) spectroscopy 2.3.8 Raman spectroscopy 2.4 Oleic acid hydrodeoxygenation experiments 3 Results and discussion 3.1 Catalyst characterization 3.1.1 X-ray fluorescence 3.1.2 Energy dispersive X-ray (EDX) 3.1.3 Scanning electron microscopy (SEM) 3.1.4 Nitrogen adsorption/desorption isotherm 3.1.5 X-ray diffraction (XRD) 3.1.6 Thermal gravimetric analysis (TGA) 3.1.7 Fourier’s transform infrared spectroscopy (FTIR) 3.1.7.1 Raman spectroscopy 3.2 Catalytic activities of Pd/Z and FPd/Z on the hydrodeoxygenation and isomerization of oleic acid into biofuel 4 Conclusion Acknowledgment References RIDA 2013 99 105 K WANG 2014 50 56 J AYODELE 2013 171 181 O AYODELE 2014 285 293 O MILINA 2015 M DUAN 2011 485 493 A JAMIL 2011 198 203 T AYODELE 2013 966 974 O AYODELE 2012 301 309 O IBRAHIM 2010 842 847 H HUI 2009 165 175 K ZHOU 2014 110 114 Z SHAMS 2007 268 277 K KAZEMIMOGHADAM 2011 438 442 M ELMEKKAWI 2014 723 730 D MA 2014 495 499 Y AYODELE 2013 74 83 O AYODELE 2015 O GHULE 2010 86 92 A DANUTHAIA 2011 74 81 T XIAOLING 2012 1889 1900 L XUE 2012 29 35 T JIA 2012 10874 10881 H POMMIER 1999 1665 1672 B GANNOUNI 2012 227 237 A LI 2012 504 511 J OHTSUKA 1999 133 139 H YU 2001 23 34 Y RAY 2006 107 116 F IMMER 2010 134 139 J ZHANG 2015 H KOVACS 2011 237 243 S SOUSA 2012 105 111 L PARK 2011 182 189 J GUZMAN 2010 38 43 A SOTELOBOYAS 2011 2791 2799 R AYODELE 2015 O AYODELE 2015 O SIMACEK 2009 456 460 P AYODELEX2015X179 AYODELEX2015X179X186 AYODELEX2015X179XO AYODELEX2015X179X186XO item S1381-1169(15)00048-5 S1381116915000485 1-s2.0-S1381116915000485 10.1016/j.molcata.2015.01.033 271358 2015-03-16T15:58:15.814962-04:00 2015-05-01 1-s2.0-S1381116915000485-main.pdf https://s3.amazonaws.com/prod-ucs-content-store-us-east/content/pii:S1381116915000485/MAIN/application/pdf/a958816448f732202a4a3990c3f96b43/main.pdf https://s3-eu-west-1.amazonaws.com/prod-ucs-content-store-eu-west/content/pii:S1381116915000485/MAIN/application/pdf/a958816448f732202a4a3990c3f96b43/main.pdf main.pdf pdf true 2117516 MAIN 8 1-s2.0-S1381116915000485-main_1.png https://s3-eu-west-1.amazonaws.com/prod-ucs-content-store-eu-west/content/pii:S1381116915000485/PREVIEW/image/png/5edc34edeb525ecfc0d457f9cb4d2fc9/main_1.png https://s3.amazonaws.com/prod-ucs-content-store-us-east/content/pii:S1381116915000485/PREVIEW/image/png/5edc34edeb525ecfc0d457f9cb4d2fc9/main_1.png main_1.png png 57804 849 656 IMAGE-WEB-PDF 1 1-s2.0-S1381116915000485-si1.gif https://s3.amazonaws.com/prod-ucs-content-store-us-east/content/pii:S1381116915000485/STRIPIN/image/gif/0c80a933b492c23f46eb6bd8dac81156/si1.gif https://s3-eu-west-1.amazonaws.com/prod-ucs-content-store-eu-west/content/pii:S1381116915000485/STRIPIN/image/gif/0c80a933b492c23f46eb6bd8dac81156/si1.gif si1 si1.gif gif 618 37 148 ALTIMG 1-s2.0-S1381116915000485-gr8_lrg.jpg https://s3.amazonaws.com/prod-ucs-content-store-us-east/content/pii:S1381116915000485/gr8/HIGHRES/image/jpeg/2fa939d54fb8cf06ec48040fc8810df9/gr8_lrg.jpg https://s3-eu-west-1.amazonaws.com/prod-ucs-content-store-eu-west/content/pii:S1381116915000485/gr8/HIGHRES/image/jpeg/2fa939d54fb8cf06ec48040fc8810df9/gr8_lrg.jpg gr8 gr8_lrg.jpg jpg 146278 975 1500 IMAGE-HIGH-RES 1-s2.0-S1381116915000485-gr7_lrg.jpg https://s3.amazonaws.com/prod-ucs-content-store-us-east/content/pii:S1381116915000485/gr7/HIGHRES/image/jpeg/9420c2c907473cf9712541f6e3e241b3/gr7_lrg.jpg https://s3-eu-west-1.amazonaws.com/prod-ucs-content-store-eu-west/content/pii:S1381116915000485/gr7/HIGHRES/image/jpeg/9420c2c907473cf9712541f6e3e241b3/gr7_lrg.jpg gr7 gr7_lrg.jpg jpg 170041 563 1022 IMAGE-HIGH-RES 1-s2.0-S1381116915000485-gr6_lrg.jpg https://s3.amazonaws.com/prod-ucs-content-store-us-east/content/pii:S1381116915000485/gr6/HIGHRES/image/jpeg/d3b32a7ee323a8ee3a2a64335cb1b9ef/gr6_lrg.jpg https://s3-eu-west-1.amazonaws.com/prod-ucs-content-store-eu-west/content/pii:S1381116915000485/gr6/HIGHRES/image/jpeg/d3b32a7ee323a8ee3a2a64335cb1b9ef/gr6_lrg.jpg gr6 gr6_lrg.jpg jpg 101837 580 1019 IMAGE-HIGH-RES 1-s2.0-S1381116915000485-gr5_lrg.jpg https://s3.amazonaws.com/prod-ucs-content-store-us-east/content/pii:S1381116915000485/gr5/HIGHRES/image/jpeg/ae523583d691d0ca28d79be3602d1250/gr5_lrg.jpg https://s3-eu-west-1.amazonaws.com/prod-ucs-content-store-eu-west/content/pii:S1381116915000485/gr5/HIGHRES/image/jpeg/ae523583d691d0ca28d79be3602d1250/gr5_lrg.jpg gr5 gr5_lrg.jpg jpg 134286 1249 750 IMAGE-HIGH-RES 1-s2.0-S1381116915000485-gr4_lrg.jpg https://s3.amazonaws.com/prod-ucs-content-store-us-east/content/pii:S1381116915000485/gr4/HIGHRES/image/jpeg/9a1f50a2a1283d7b98f3e402fd91347e/gr4_lrg.jpg https://s3-eu-west-1.amazonaws.com/prod-ucs-content-store-eu-west/content/pii:S1381116915000485/gr4/HIGHRES/image/jpeg/9a1f50a2a1283d7b98f3e402fd91347e/gr4_lrg.jpg gr4 gr4_lrg.jpg jpg 87625 549 1000 IMAGE-HIGH-RES 1-s2.0-S1381116915000485-gr3_lrg.jpg https://s3.amazonaws.com/prod-ucs-content-store-us-east/content/pii:S1381116915000485/gr3/HIGHRES/image/jpeg/6a8e3059a264e552933e3331c9755383/gr3_lrg.jpg https://s3-eu-west-1.amazonaws.com/prod-ucs-content-store-eu-west/content/pii:S1381116915000485/gr3/HIGHRES/image/jpeg/6a8e3059a264e552933e3331c9755383/gr3_lrg.jpg gr3 gr3_lrg.jpg jpg 122528 598 992 IMAGE-HIGH-RES 1-s2.0-S1381116915000485-gr2_lrg.jpg https://s3.amazonaws.com/prod-ucs-content-store-us-east/content/pii:S1381116915000485/gr2/HIGHRES/image/jpeg/882e346da8de1b047de08a1abab720f9/gr2_lrg.jpg https://s3-eu-west-1.amazonaws.com/prod-ucs-content-store-eu-west/content/pii:S1381116915000485/gr2/HIGHRES/image/jpeg/882e346da8de1b047de08a1abab720f9/gr2_lrg.jpg gr2 gr2_lrg.jpg jpg 1253894 3755 1667 IMAGE-HIGH-RES 1-s2.0-S1381116915000485-gr1_lrg.jpg https://s3.amazonaws.com/prod-ucs-content-store-us-east/content/pii:S1381116915000485/gr1/HIGHRES/image/jpeg/a31134349d7edab9cb3ccd8bbdd832d9/gr1_lrg.jpg https://s3-eu-west-1.amazonaws.com/prod-ucs-content-store-eu-west/content/pii:S1381116915000485/gr1/HIGHRES/image/jpeg/a31134349d7edab9cb3ccd8bbdd832d9/gr1_lrg.jpg gr1 gr1_lrg.jpg jpg 329730 2827 1167 IMAGE-HIGH-RES 1-s2.0-S1381116915000485-fx1_lrg.jpg https://s3.amazonaws.com/prod-ucs-content-store-us-east/content/pii:S1381116915000485/fx1/HIGHRES/image/jpeg/af86e814c717ab1e5b73d98117e57b96/fx1_lrg.jpg https://s3-eu-west-1.amazonaws.com/prod-ucs-content-store-eu-west/content/pii:S1381116915000485/fx1/HIGHRES/image/jpeg/af86e814c717ab1e5b73d98117e57b96/fx1_lrg.jpg fx1 true fx1_lrg.jpg jpg 124441 886 2213 IMAGE-HIGH-RES 1-s2.0-S1381116915000485-gr8.jpg https://s3.amazonaws.com/prod-ucs-content-store-us-east/content/pii:S1381116915000485/gr8/DOWNSAMPLED/image/jpeg/327eaf6e5d61632ff5e77d2300d362c4/gr8.jpg https://s3-eu-west-1.amazonaws.com/prod-ucs-content-store-eu-west/content/pii:S1381116915000485/gr8/DOWNSAMPLED/image/jpeg/327eaf6e5d61632ff5e77d2300d362c4/gr8.jpg gr8 gr8.jpg jpg 24262 220 339 IMAGE-DOWNSAMPLED 1-s2.0-S1381116915000485-gr7.jpg https://s3.amazonaws.com/prod-ucs-content-store-us-east/content/pii:S1381116915000485/gr7/DOWNSAMPLED/image/jpeg/a2d0bcd8ef70754fe41f5f3fc9b8b7d6/gr7.jpg https://s3-eu-west-1.amazonaws.com/prod-ucs-content-store-eu-west/content/pii:S1381116915000485/gr7/DOWNSAMPLED/image/jpeg/a2d0bcd8ef70754fe41f5f3fc9b8b7d6/gr7.jpg gr7 gr7.jpg jpg 39123 212 384 IMAGE-DOWNSAMPLED 1-s2.0-S1381116915000485-gr6.jpg https://s3.amazonaws.com/prod-ucs-content-store-us-east/content/pii:S1381116915000485/gr6/DOWNSAMPLED/image/jpeg/c27553ba6ca8dba7c8a9d5c838d5d90e/gr6.jpg https://s3-eu-west-1.amazonaws.com/prod-ucs-content-store-eu-west/content/pii:S1381116915000485/gr6/DOWNSAMPLED/image/jpeg/c27553ba6ca8dba7c8a9d5c838d5d90e/gr6.jpg gr6 gr6.jpg jpg 28267 218 383 IMAGE-DOWNSAMPLED 1-s2.0-S1381116915000485-gr5.jpg https://s3.amazonaws.com/prod-ucs-content-store-us-east/content/pii:S1381116915000485/gr5/DOWNSAMPLED/image/jpeg/c62cbb8738d5274f3da9b0834c303a79/gr5.jpg https://s3-eu-west-1.amazonaws.com/prod-ucs-content-store-eu-west/content/pii:S1381116915000485/gr5/DOWNSAMPLED/image/jpeg/c62cbb8738d5274f3da9b0834c303a79/gr5.jpg gr5 gr5.jpg jpg 38310 470 282 IMAGE-DOWNSAMPLED 1-s2.0-S1381116915000485-gr4.jpg https://s3.amazonaws.com/prod-ucs-content-store-us-east/content/pii:S1381116915000485/gr4/DOWNSAMPLED/image/jpeg/f131a6d557ac402d6542942918870af2/gr4.jpg https://s3-eu-west-1.amazonaws.com/prod-ucs-content-store-eu-west/content/pii:S1381116915000485/gr4/DOWNSAMPLED/image/jpeg/f131a6d557ac402d6542942918870af2/gr4.jpg gr4 gr4.jpg jpg 25116 206 376 IMAGE-DOWNSAMPLED 1-s2.0-S1381116915000485-gr3.jpg https://s3.amazonaws.com/prod-ucs-content-store-us-east/content/pii:S1381116915000485/gr3/DOWNSAMPLED/image/jpeg/de5325e668065f3ec89bc4b32d64fde0/gr3.jpg https://s3-eu-west-1.amazonaws.com/prod-ucs-content-store-eu-west/content/pii:S1381116915000485/gr3/DOWNSAMPLED/image/jpeg/de5325e668065f3ec89bc4b32d64fde0/gr3.jpg gr3 gr3.jpg jpg 34420 225 373 IMAGE-DOWNSAMPLED 1-s2.0-S1381116915000485-gr2.jpg https://s3.amazonaws.com/prod-ucs-content-store-us-east/content/pii:S1381116915000485/gr2/DOWNSAMPLED/image/jpeg/eef1ed745274469223f989c765d247c4/gr2.jpg https://s3-eu-west-1.amazonaws.com/prod-ucs-content-store-eu-west/content/pii:S1381116915000485/gr2/DOWNSAMPLED/image/jpeg/eef1ed745274469223f989c765d247c4/gr2.jpg gr2 gr2.jpg jpg 125737 847 376 IMAGE-DOWNSAMPLED 1-s2.0-S1381116915000485-gr1.jpg https://s3.amazonaws.com/prod-ucs-content-store-us-east/content/pii:S1381116915000485/gr1/DOWNSAMPLED/image/jpeg/39f3aa023554ceed9a0359f5588cc977/gr1.jpg https://s3-eu-west-1.amazonaws.com/prod-ucs-content-store-eu-west/content/pii:S1381116915000485/gr1/DOWNSAMPLED/image/jpeg/39f3aa023554ceed9a0359f5588cc977/gr1.jpg gr1 gr1.jpg jpg 56425 637 263 IMAGE-DOWNSAMPLED 1-s2.0-S1381116915000485-fx1.jpg https://s3.amazonaws.com/prod-ucs-content-store-us-east/content/pii:S1381116915000485/fx1/DOWNSAMPLED/image/jpeg/3a4c34fea8d76d556879c1e5dddcd618/fx1.jpg https://s3-eu-west-1.amazonaws.com/prod-ucs-content-store-eu-west/content/pii:S1381116915000485/fx1/DOWNSAMPLED/image/jpeg/3a4c34fea8d76d556879c1e5dddcd618/fx1.jpg fx1 true fx1.jpg jpg 14971 200 500 IMAGE-DOWNSAMPLED 1-s2.0-S1381116915000485-gr8.sml https://s3.amazonaws.com/prod-ucs-content-store-us-east/content/pii:S1381116915000485/gr8/THUMBNAIL/image/gif/6ce231d9e23796bc75e7866029c39f48/gr8.sml https://s3-eu-west-1.amazonaws.com/prod-ucs-content-store-eu-west/content/pii:S1381116915000485/gr8/THUMBNAIL/image/gif/6ce231d9e23796bc75e7866029c39f48/gr8.sml gr8 gr8.sml sml 5566 142 219 IMAGE-THUMBNAIL 1-s2.0-S1381116915000485-gr7.sml https://s3.amazonaws.com/prod-ucs-content-store-us-east/content/pii:S1381116915000485/gr7/THUMBNAIL/image/gif/d7577dcf8b599a4d4a52be02d54e9513/gr7.sml https://s3-eu-west-1.amazonaws.com/prod-ucs-content-store-eu-west/content/pii:S1381116915000485/gr7/THUMBNAIL/image/gif/d7577dcf8b599a4d4a52be02d54e9513/gr7.sml gr7 gr7.sml sml 7739 121 219 IMAGE-THUMBNAIL 1-s2.0-S1381116915000485-gr6.sml https://s3.amazonaws.com/prod-ucs-content-store-us-east/content/pii:S1381116915000485/gr6/THUMBNAIL/image/gif/923b47d4e7ca8bd973ddff2d854c3361/gr6.sml https://s3-eu-west-1.amazonaws.com/prod-ucs-content-store-eu-west/content/pii:S1381116915000485/gr6/THUMBNAIL/image/gif/923b47d4e7ca8bd973ddff2d854c3361/gr6.sml gr6 gr6.sml sml 5343 125 219 IMAGE-THUMBNAIL 1-s2.0-S1381116915000485-gr5.sml https://s3.amazonaws.com/prod-ucs-content-store-us-east/content/pii:S1381116915000485/gr5/THUMBNAIL/image/gif/96c247c79c4858837dca033e72f720e4/gr5.sml https://s3-eu-west-1.amazonaws.com/prod-ucs-content-store-eu-west/content/pii:S1381116915000485/gr5/THUMBNAIL/image/gif/96c247c79c4858837dca033e72f720e4/gr5.sml gr5 gr5.sml sml 3411 163 98 IMAGE-THUMBNAIL 1-s2.0-S1381116915000485-gr4.sml https://s3.amazonaws.com/prod-ucs-content-store-us-east/content/pii:S1381116915000485/gr4/THUMBNAIL/image/gif/36880224a6d923369c272a78c8fdfc95/gr4.sml https://s3-eu-west-1.amazonaws.com/prod-ucs-content-store-eu-west/content/pii:S1381116915000485/gr4/THUMBNAIL/image/gif/36880224a6d923369c272a78c8fdfc95/gr4.sml gr4 gr4.sml sml 5109 120 219 IMAGE-THUMBNAIL 1-s2.0-S1381116915000485-gr3.sml https://s3.amazonaws.com/prod-ucs-content-store-us-east/content/pii:S1381116915000485/gr3/THUMBNAIL/image/gif/2d0b83e540f79394a666c3d9fdf5fd29/gr3.sml https://s3-eu-west-1.amazonaws.com/prod-ucs-content-store-eu-west/content/pii:S1381116915000485/gr3/THUMBNAIL/image/gif/2d0b83e540f79394a666c3d9fdf5fd29/gr3.sml gr3 gr3.sml sml 6203 132 219 IMAGE-THUMBNAIL 1-s2.0-S1381116915000485-gr2.sml https://s3.amazonaws.com/prod-ucs-content-store-us-east/content/pii:S1381116915000485/gr2/THUMBNAIL/image/gif/bbd35c921b024a3281fc1269c02b44ae/gr2.sml https://s3-eu-west-1.amazonaws.com/prod-ucs-content-store-eu-west/content/pii:S1381116915000485/gr2/THUMBNAIL/image/gif/bbd35c921b024a3281fc1269c02b44ae/gr2.sml gr2 gr2.sml sml 7612 162 72 IMAGE-THUMBNAIL 1-s2.0-S1381116915000485-gr1.sml https://s3.amazonaws.com/prod-ucs-content-store-us-east/content/pii:S1381116915000485/gr1/THUMBNAIL/image/gif/358418369ae2d495805765db426fd4e0/gr1.sml https://s3-eu-west-1.amazonaws.com/prod-ucs-content-store-eu-west/content/pii:S1381116915000485/gr1/THUMBNAIL/image/gif/358418369ae2d495805765db426fd4e0/gr1.sml gr1 gr1.sml sml 3413 162 67 IMAGE-THUMBNAIL 1-s2.0-S1381116915000485-fx1.sml https://s3.amazonaws.com/prod-ucs-content-store-us-east/content/pii:S1381116915000485/fx1/THUMBNAIL/image/gif/3985452ccf7d22f1e413baacaac1d239/fx1.sml https://s3-eu-west-1.amazonaws.com/prod-ucs-content-store-eu-west/content/pii:S1381116915000485/fx1/THUMBNAIL/image/gif/3985452ccf7d22f1e413baacaac1d239/fx1.sml fx1 true fx1.sml sml 3051 88 219 IMAGE-THUMBNAIL MOLCAA 9416 S1381-1169(15)00048-5 10.1016/j.molcata.2015.01.033 Elsevier B.V. Fig. 1 XRF spectra of ZLT, Pd/Z and FPd/Z samples. Fig. 2 EDX and SEM of ZLT, Pd/Z and FPd/Z samples. Fig. 3 Nitrogen adsorption/desorption isotherm of the ZLT, Pd/Z and FPd/Z samples. Fig. 4 X-ray diffraction of the ZLT, Pd/Z and FPd/Z samples. Fig. 5 Thermal gravimetric analysis of (a) ZLT and Pd/Z, (b) ZLT and FPd/Z. Fig. 6 FTIR spectra of ZLT, Pd/Z and FPd/Z samples. Fig. 7 Raman spectra of ZLT, Pd/Z and FPd/Z samples. Fig. 8 Product distribution of the HDO of oleic acid at 360°C, 20mg catalyst loading, 20 bar, 10% H2 gas flow and 60min. Table 1 Elemental composition of ZLT, Pd/Z and FPd/Z samples. Sample Elemental composition (%) Si/Al Si Al O2 Na Ca F Pd ZLT 16.88 16.48 49.58 12.41 4.65 0.00 0 1.02 Pd/Z 21.11 9.59 55.90 8.70 2.81 0.00 1.89 2.20 FPd/Z 22.37 6.44 54.81 4.51 1.71 8.30 1.86 3.45 Table 2 Textural properties of ZLT, Pd/Z and FPd/Z samples. Sample Surface area (m2/g) Pore volume (cm3/g) Pore diameter (nm) Average particle size (nm) ZLT 202 0.13 10.41 10404 Pd/Z 371 0.23 14.58 4655 FPd/Z 427 0.29 20.11 2534 Heterogeneous catalysis Effect of precursor acidity on zeolite supported Pd catalyst properties and hydrodeoxygenation activity for the production of biofuel O.B. Ayodele a b ⁎ Hamisu U. Farouk a c Jibril Mohammed d Yoshimitsu Uemura b W.M.A.W. Daud a ⁎⁎ a Department of Chemical Engineering, Faculty of Engineering, University of Malaya, Kuala Lumpur, Malaysia Department of Chemical Engineering Faculty of Engineering University of Malaya Kuala Lumpur Malaysia b Centre for Biofuel and Biochemical Research, Department of Chemical Engineering, Universiti Teknologi PETRONAS, Tronoh, Perak, Malaysia Centre for Biofuel and Biochemical Research Department of Chemical Engineering Universiti Teknologi PETRONAS Tronoh Perak Malaysia c Department of Pure and Industrial Chemistry, Faculty of Science, Bayero University Kano, P.M.B. 3011, Kano State, Nigeria Department of Pure and Industrial Chemistry Faculty of Science Bayero University Kano Kano State P.M.B. 3011 Nigeria d Department of Chemical Engineering, Abubakar Tafawa Balewa University, P.M.B 0248, Bauchi State, Nigeria Department of Chemical Engineering Abubakar Tafawa Balewa University Bauchi State P.M.B 0248 Nigeria ⁎ Corresponding author at: Department of Chemical Engineering, Faculty of Engineering, University of Malaya, Kuala Lumpur, Malaysia. Tel.: +60 164955453. ⁎⁎ Corresponding author. Graphical abstract In this study, two different zeolite (ZLT) supported palladium catalysts (Pd/Zs) of varying acidity were synthesized, characterized and tested for biofuel production. The first Pd/Z was synthesized via the incorporation of palladium oxalate complex (PdOxC) prepared from the functionalization of H2PdCl4 with oxalic acid at pH 5.3 into ZLT. The PdOxC was further modified with drops of HF until pH 3.7 and incorporated into ZLT to synthesize zeolite supported fluoride ion modified PdOxC catalyst (FPd/Z). Their characterization results showed that there is considerable crystallinity loss in Pd/Z, while FPd/Z showed drastic crystallinity loss according to the SEM and XRD results. In addition, the specific surface area and porosity of ZLT increased from 202m2/g and 0.13cm3/g to 371m2/g and 0.23cm3/g in Pd/Z, and 427m2/g and 0.29cm3/g in FPd/Z catalysts, respectively. Pd/Z catalyst produces 56% n-C18H38 and 11% iso-C18H38, while FPd/Z produces 58% n-C18H38 and 28% iso-C18H38 in the hydrodeoxygenation (HDO) and isomerization (ISO) steps, respectively. The enhancements in the catalysts properties are due to the acidic effect of OxA via the incorporation of PdOxC, while the additional enhancements in the properties and the ISO activity of FPd/Z was ascribed to the acidic effect of fluoride ion modification. It is obvious that OxA functionalization and subsequent fluoride ion modification are highly invaluable toward biofuel production. Keywords Biofuel Palladium catalyst Hydrodeoxygenation Isomerization Oleic acid 1 Introduction Aluminosilicates have been widely applied over the decades in various areas such as adsorption in water purification and treatments [1–4], catalysis for different operations such as production of chemicals, pharmaceuticals and fuel, as well as in environmental air pollution abatement [5,6]. Clays and zeolites are two typical aluminosilicates that have received tremendous attention. Kaolinites, bentonite and montmorillonite seem to be the most studied clay minerals for various research and industrial processes [6–9], on the other hand, there are over 200 known types of zeolites of different categories and classifications such as the MCM, Y–types, Z–types, Beta zeolites, N–types, etc. used for different applications. Recently, the application of zeolites is gaining more attention that clays minerals in virtually every field where aluminosilicates are employed, and as such zeolites are presently being rapidly synthesized from different clay minerals especially kaolinite [1,2,6,7]. Their selectivity is one of their excellent qualities that made them interesting material for catalyst support especially in petroleum and petrochemical industries. Naturally, occurring zeolites are usually impure and contaminated at varying degrees by other materials such as metals, quartz, or other zeolites types. Consequently, naturally occurring zeolites are not good candidates for many important commercial applications especially where uniformity and purity are essential, and this explains their recent massive synthetic productions [10]. Zeolite A is one of the zeolite types which hitherto has not been frequently used perhaps due to its susceptibility to dissolution under severe acid attack and because it is rarely found pure in nature. It has high thermal and structural stabilities, uniform pore structure, large surface area and possesses excellent adsorption, screening and ion exchange performance [11,12]. Although the synthesis technique of zeolite A is very mature, the exploration for more economic and effective raw materials is still the focus of attentions [12]. Recently, Hui et al. [11] reported a novel and cheap route of zeolite A production with improved structural stability from coal fly ash (CFA) which hitherto is a waste product of combustion of coal in coal-fired power stations with about 800 million tons per annum. Similarly, as an improvement to the existing zeolite A production from kaolinite via the two steps procedure of thermal treatment to transform kaolinite into metakaolin and alkali treatment, Wang et al. [2] reported the hydrothermal synthesis of high purity zeolite A from natural kaolin without the thermal treatment step to reduce the cost of production. These and many another studies [1,2,13–15] have made the production and application of zeolite A attractive; however, in all these studies, zeolite A was applied mostly for adsorption and other related environmental problem. Information regarding its application as catalyst support for biofuel production is rarely found up till now [14,15], unlike other zeolite types such as HY and HZSM-5 zeolites [16], NaX zeolite [17], Al-MCM-41 [18] that have been extensively studied and reported for different feed stocks. Therefore, in this study, zeolite A is expediently modified with two different types of metal-organic framework catalyst precursors. Firstly with palladium oxalate (PdOxC) freshly prepared via the functionalization of palladium salt with oxalic acid, and the second, with fluoride ion enhanced PdOxC to study the effect of PdOxC acidity on the synthesized catalysts properties and hydrodeoxygenation and isomerization activity for the production of high grade biofuel from oleic acid. 2 Experimental 2.1 Materials Analytical grade zeolite A and hydrofluoric acid (68%) were purchased from F.S. Chemicals, while dihydridopalladium(IV) chloride and anhydrous oxalic acid are from Sigma–Aldrich. All materials were used without any pretreatment. 2.2 Catalyst development Two types of catalysts with varying acidity were synthesized. The first was zeolite supported palladium catalyst (Pd/Z) synthesized via functionalization of 9.44mmol of H2PdCl4 with equimolar aqueous oxalic acid (OxA) and was aged for 60min to guarantee the formation of the polynuclear palladium(II) oxalate complexes (PdOxC) in an aluminum foil wrapped 500mL conical flask because of the metal-oxalate complex photo-sensitivity [19]. The PdOxC was subsequently added gradually to 50g zeolite (ZLT) dispersion under stirring for 4h at 50°C for the incorporation of PdOxC particles into the ZLT support, the pH was observed to stabilized at 5.3±0.3 (using EcoScan SC11-4115, Exatech Enterprise pH meter) as the stirring progressed. The second catalyst was synthesized following the same protocol except that the PdOxC was modified with drops of 1.5M hydrofluoric acid until the pH of the fluoride ion modified complex (FPdOxC) was stabilized at 3.7±0.2. The Pd/Z and the obtained fluoride ion modified zeolite supported palladium catalyst (FPd/Z) was filtered and washed to remove the chloride ions followed by drying at 100°C for 12h and calcined at 400°C for 3h based on some few preliminary studies. 2.3 Catalyst characterization 2.3.1 Thermal gravimetric analysis (TGA) TGA was carried out with a SHIMADZU DTG-60/60H instrument to determine the heat treatment required during calcination. 2g of each sample was heated in a silica crucible at a constant heating rate of 10°C/min operating in a stream of N2 atmosphere with a flow rate of 40mL/min from 30 to 700°C and the weight loss per time, weight loss per temperature increment and temperature increment versus time were recorded. 2.3.2 X-ray fluorescence (XRF) XRF analysis of the samples was done using a μXay μEDX 100 Shimadzu, NY and X-ray tube of rhodium anode and scintillation detector operating on a 40mA current and 40mV voltage to determine the chemical composition of the sample. High-energy X-rays were used to bombard the samples pressed into circular discs to cause ionization of their component atoms. The detected spectra were amplified and recorded using the computer program installed on the XRF analyzer. 2.3.3 Energy dispersive X-ray (EDX) EDX was performed to determine the elemental composition variation in the synthesized catalysts compared to the ZLT using EDX microanalysis system (Oxford INCA 400, Germany) connected to the FESEM machine. The EDX analysis used Mn-Kα as the energy source operated at 15kV of accelerating voltage, 155eV resolutions and 22.4° take off angle. 2.3.4 Scanning electron microscopy (SEM) SEM was used to study the surface morphology of all the samples. The analysis was carried out using a scanning electron microscope (Model EMJEOL-JSM6301-F) with an Oxford INCA/ENERGY-350 microanalysis system. The samples were evenly distributed on a black double sided carbon tape attached to the aluminum stub and vacuumed for about 10min prior to analysis. 2.3.5 Nitrogen adsorption–desorption measurements (BET method) N2 adsorption–desorption measurements were performed at liquid N2 temperature (−196°C) with an autosorb BET apparatus, Micromeritics ASAP 2020 to determine the surface area, pore size and structure, and the pore volume. Before each measurement, the samples were first degassed at 350°C for 2h and thereafter kept at liquid nitrogen temperature to adsorb nitrogen. 2.3.6 X-ray diffraction (XRD) XRD patterns of the samples were measured with Philip PW 1820 diffractometer to determine the crystal phase and structure of the samples. Diffraction patterns were recorded in the range of 5–90° (2θ) with a scanning rate of 2°/min and a step size of 0.01° with Cu Kα radiation. The X-ray tube was operated at 40kV and 120mA. 2.3.7 Fourier transformed infrared (FTIR) spectroscopy FTIR analyses were performed on the samples to determine the functional groups present in order to understand the chemistry of the synthesized catalyst with respect to the support. The instrument used is PerkinElmer spectrum GX infrared spectrometer with resolution of 4cm−1 operating in the range of 4000–400cm−1. 2.3.8 Raman spectroscopy The Raman spectra of all the samples were obtained with a Spex Triplemate spectrograph coupled to a tracor Northern 1024 large area intensified diode array detector. The excitation source was a 488-nm line (Lexel model no. 95 Ar+) laser with a grating monochromator used to reject any spurious lines and background from the laser before the radiation entered the spectrometer. The spectra were taken with 1cm−1 resolution. 2.4 Oleic acid hydrodeoxygenation experiments Oleic acid (OA) was hydrodeoxygenated in a 100mL high pressure semi-batch reactor. The catalysts activities on the HDO process were tested at the previously [20] best observed reaction conditions of 360°C, 20bar and 100mL/min for temperature, pressure and gas flow rate, respectively. The flow of carrier gas and reaction pressure inlet and outlet were controlled by a flow (Brooks 58505 S) and a pressure controller (Brooks 5866), respectively. In a typical experiment, 40g (∼45mL) of OA was added to the reactor followed by a known amount of catalyst (depending on the type of catalysts to be studied) and the catalyst was reduced in situ under flowing H2 at 200°C for 1h prior to use after which the reactor was purged with He. The operating temperature was established and monitored by a type-K Omega thermocouple placed inside the reactor. Before the reaction started, 100mL/min of 90vol% N2 and 10vol% H2 was passed through the reactor until the desired reaction pressure was reached and the reaction commences by turning on the stirrer at an earlier predetermined speed of 2000rpm. Based on preliminary studies, all experiments were performed under 60min and the reactor set up was cooled by forced air before dismantled for product analysis. Liquid samples withdrawn from the reactor were dissolved in pyridine and thereafter silylated with (100wt% excess of) N,O-bis(trimethyl)-trifluoroacetamide, BSTFA in an oven at 60°C for 1h prior to GC analysis. The internal standard eicosane, C20H42 was added for quantitative calculations. The withdrawn samples were analyzed with a gas chromatograph (GC, HP 6890) equipped with DB-5 column (60m×0.32mm×0.5mm) and a flame ionization detector. 1μL sample was injected into the GC with split ratio of 50:1 and helium was used as the carrier gas. The chromatographic program was well-adjusted to achieve satisfactory separation of the desired product and the product identification was validated with a gas chromatograph–mass spectrometer (GC–MS). Since there was technical limitation in online analysis of the evolved gases (Mgas) during the study, they were calculated according to Eq. (1), and the product distribution was evaluated using Eq. (2). (1) Mgas=[M b + M H2 –M a ] (2) ω i ( % ) = n i Σ i = 1 j n i × 100 where M b is the mass of reactor with the OA and catalyst before reaction, M H2 is the mass of total H2 gas required during the experiment evaluated from the H2 flow rate and its density and M a is the mass of the reactor with the liquid product and used catalyst after the reaction. Similarly, ω i (%) is the mass fraction of the components in the liquid product. 3 Results and discussion 3.1 Catalyst characterization 3.1.1 X-ray fluorescence The XRF spectra of ZLT, Pd/Z and FPd/Z are shown in Fig. 1 , the spectrum of ZLT showed its characteristics peaks between 0.51 and 23keV. The successful intercalation of PdOxC into the framework of ZLT support is seen in the XRF plot of Pd/Z at Lβ1 of 3.20keV and another growing peak is observed at 21.2keV which possibly confirmed successful dispersion of Pd from PdOxC since Pd (Kα) is only metal that has such peak at 21.2keV according to the EDXRF-EPSILON 3 XL, PANalytical standard card. However, in contrast with the two Pd peaks observed in the Pd/Z catalyst, FPd/Z catalyst showed three Pd peaks at Lα1 of 2.99keV, Lβ1 of 3.20 and 21.2keV, in addition, the Pd peaks in the FPd/Z catalyst appeared to be comparably more intense than those in the Pd/Z catalyst. These suggest that the effect of fluoride ion functionalization is effective at guaranteeing higher Pd particle dispersion and probably minimizes the degree of hydration effect on the active metal during the catalyst synthesis stage as seen in Table 1 . 3.1.2 Energy dispersive X-ray (EDX) The elemental composition of the ZLT, Pd/Z and FPd/Z samples in Table 1 showed that silica and alumina are the main components of ZLT with some oxides of calcium and sodium, its Si/Al ratio was found to be ∼1.02 which is typical of zeolite A. After successful incorporation of acidic PdOxC and FPdOxC catalyst precursors into ZLT and calcination, the Si/Al ratio increased to 2.2 and 3.45, respectively, in Pd/Z and FPd/Z catalysts (Table 1) due to the reduction in framework and extra-framework aluminum. Typically, reduction/removal of framework and extra-framework alumina has been ascribed to effect of thermal treatment and protonation from acid attacks, respectively [19]. However, since both catalysts were subjected to same thermal treatments, the comparably higher Si/Al ratio of FPd/Z compared to Pd/Z was ascribed to the effect of fluoride ion functionalization at the synthesis stage. Both Pd/Z and FPd/Z catalysts showed increment in the amount of O2 which can be ascribed to the presence of oxalate functional group of the PdOxC and FPdOxC precursors. Similarly the incorporation of Pd earlier seen in Fig. 1 and Table 1 can be further corroborated in Fig. 2 b and c between the 2.0 and 3.8keV in the EDX spectra which also showed the presence of fluoride ion in the FPd/Z catalyst (Fig. 2c). From Table 1, the observed quantity of Pd (average of three runs) in Pd/Z and FPd/Z catalysts is 1.89% and 1.86% which is slightly lower than the calculated 2% and this probably could be due to the effect of degree of hydration at the catalyst synthesis stages [8]. 3.1.3 Scanning electron microscopy (SEM) The SEM morphology of the ZLT, Pd/Z and FPd/Z samples shown in Fig. 2 (inset) revealed conspicuous degree of morphological variations in Pd/Z and FPd/Z catalysts which are expected to have a substantial contributory effect on their catalytic activities. The morphology of ZLT in Fig. 2a (inset) depicts agglomerates of sharp micro-sized cubical symmetry crystal structure [12,20,21] which can be seen to have loss considerable crystallinity in Pd/Z (Fig. 2b (inset)) and become apparent amorphous in FPd/Z (Fig. 2c (inset)) after the catalyst synthesis. The loss of crystallinity in both catalysts can be seen to have considerably reduced their particles sizes with attendant increase in surface area compared to the ZLT support as shown in Table 2 (BET analysis). As earlier mentioned, aluminosilicates usually experience loss of crystallinity under acid influence and thermal treatment which is usually accompanied by increase in the specific surface area, and such loss of crystallinity is a function of the acid type and concentration as well as the degree of thermal treatment [22]. The considerable loss of crystallinity in Pd/Z can be ascribed to the combined effect of OxA functionalization and proper calcination at the Pd/Z synthesis stage resulting in dealumination from the lattice structure, while the apparent amorphous observed in FPd/Z can be ascribed to the additional crystallinity loss due to intense dealumination effect from fluoride ion. This result further corroborates earlier observation in Table 1. 3.1.4 Nitrogen adsorption/desorption isotherm As earlier observed in the catalysts morphology micrographs that the effects of OxA functionalization and thermal treatment resulted into loss of crystallinity which is more severe in the FPd/Z catalyst due to the fluoride ion modification, the textural properties results of the samples in Table 2 showed that there is reduction in the average particle sizes (APS) of Pd/Z and FPd/Z compared to the ZLT. As expected, the reduction in the APS can be seen to have increased the specific surface area and porosity of both Pd/Z and FPd/Z, as usual, these enhancements are more pronounced in the FPd/Z catalyst due to the additional effect of fluoride ion modification. From the isotherms of the samples shown in Fig. 3 , ZLT sample exhibited Type II isotherms at lower relative pressures which is a characteristic of the formation of monolayer followed by multilayer [21,22]. However, after catalyst synthesis, both Pd/Z and FPd/Z eventually conformed to Type IV isotherm with the steep uptake of N2 owing to the development of inter-particle voids formed by agglomeration of the micro- or nano-sized and plate-like particles containing slit-shaped pores which are typical of H3 hysteresis loop [3,7,22]. This observation is typical of solids having considerable degree of mesopores [19]. The increase in the amount of N2 adsorbed in the Pd/Z and FPd/Z compared to ZLT also supports the data in Table 2 which is in accordance with previous reports that loss of crystallinity usually leads to increase in the pore volume and specific surface area [19–23]. As expected, the FPd/Z showed more N2 uptake and wider hysteresis loop than Pd/Z due to the effect of the fluoride ion modification. 3.1.5 X-ray diffraction (XRD) The XRD pattern for the ZLT support and the synthesized Pd/Z and FPd/Z catalysts is shown in Fig. 4 . According to the JCPDS card 43-0142, the characteristics peaks at 2θ =7.2°, 10.0°, 12.4°, 16.06°, 21.64°, 24.0°, 27.10°, 30.0°, 34.16°, 43.6° and 52.3° in the ZLT support are typical of highly crystalline zeolite A [11,12]. After the catalyst synthesis, Pd/Z showed considerable crystallinity loss while FPd/Z reflects almost complete amorphous structure. These observations corroborate the earlier results seen in the samples SEM morphology and it was ascribed to the varying intensities of acid attack and also the thermal treatment that removes extra framework and framework aluminum, respectively, leading to increase in their Si/Al ratios (Table 1). Typically, loss of crystallinity has been ascribed to proper calcination which in turn improves the catalytic activity of the synthesized catalysts, in fact Jia et al., [23] reported a linear relationship between excessive thermal treatments and crystallinity (i.e. crystal growth) but an inverse correlation with catalytic activity. Consequently, the loss of crystallinity in the Pd/Z and FPd/Z catalysts indicates high Pd dispersion in the matrix of ZLT support which is a pointer to excellent catalytic activity [21]. In addition, the absence of bulk Pd peaks that are usually seen around 2θ =18° and 34° [18,24,25] further confirmed that the Pd particles are highly dispersed due to increase in the catalysts acidity at synthesis stage [21,26], i.e. OxA functionalization in both catalysts and additional fluoride ion modification on FPd/Z. Furthermore, in view of the minuscule quantity of Pd used during the synthesis (Table 1) there is speculation that the Pd particles might also have been partly covered by the ZLT particles. However, the lowering of the diffraction between 2θ of 2.3° and 5.4° in Pd/Z owing to the expansion of the ZLT lattice structure due to intimate contact of the incorporated PdOxC [21], and the presence of the miniature peaks at 38.4°, 44.6° and 58.7° in FPd/Z further confirmed the successful incorporation of Pd particles into the matrix of the ZLT support. 3.1.6 Thermal gravimetric analysis (TGA) The TGA profiles of ZLT, Pd/Z and FPd/Z as well as that of the uncalcined Pd/Z and FPd/Z are shown in Fig. 5 a–b. All the samples showed three characteristics weight loss regions (WLR) typical of the aluminosilicates. The first WLR is due to loosely held moisture and physisorbed water that can be rapidly removed at a temperature around 150°C [4,9]. The second WLR which is usually observe between 200–500°C was ascribed to the existence of strongly bonded water molecules that are domiciled in the first coordination sphere and also probably due to partial occlusion of organic matter [3,19]. The third WLR comprises of the structural hydroxyl groups that will condense and dehydrate at temperatures above 500°C [9,19]. A careful study of Fig. 5 shows that the uncalcined catalysts showed increase in weight loss compared ZLT due to the hydration effect of the catalyst precursors (PdOxC and FPdOxC) incorporation into ZLT at the catalysts synthesis stages. Although the weight loss is not very pronounced in the first weight loss region ostensibly due to the effect of drying at 100°C for 12h, which implied that the drying stage was able to reduce considerable amount of physissorbed and freely bounded water molecules [19]. Furthermore, it can be observed that there is a marginal increase in the weight loss of the uncalcined Pd/Z, but the weight loss in the uncalcined FPd/Z is very conspicuous due to the effect of protonation from the fluoride ion modification at the FPd/Z synthesis stage that increased the surface area and the amount of amorphous silica (BET, EDX and SEM results), thereby increasing the amount of adsorbed and strongly bonded water. This observation is also consistent with previous study where phosphoric acid was employed [19]. The observed increase in the weight loss of the uncalcined catalysts even after drying is an indication that their synthesis protocol was able to guarantee the penetration of aqueous catalyst precursor into the lattice structure of ZLT. After calcination at 400°C, both Pd/Z and FPd/Z showed reduction in weight loss, which suggests that the thermal treatment during the calcination step was adequate to expel both the physisorbed, strongly bonded water molecules and any occluded organic matter thus leaving behind only the PdOxC and FPdOxC particles, respectively, on the ZLT support. Previous works have shown that adequate calcination around 400°C increases catalyst surface area and pore volume which in turn increases the number of active sites thereby guaranteeing a high active metal dispersion [4,21]. 3.1.7 Fourier’s transform infrared spectroscopy (FTIR) The FTIR spectra of the ZLT support, Pd/Z and FPd/Z are presented in Fig. 6 . The ZLT sample reflects the existence of strongly bonded zeolitic water in the region 3665–2980cm−1 with a minimal around 3366cm−1 and another band at 1655cm−1 which is attributed to physisorbed water molecules vibration [3,4]. Previous reports [18,27] have shown that the presence of these water molecules is detrimental to the activities of HDO catalysts due to agglomeration of active metal. According to the authors, proper calcination has been highly invaluable to reduce or completely remove the water molecules thus guarantee proper active metal dispersion. From Fig. 6, it is obvious that the thermal treatment during the calcination step is adequate as the water molecule bands at 3665–2980cm−1 and at 1655cm−1 had completely disappeared in both Pd/Z and FPd/Z, and this observation corroborates the result in the samples TGA profile in Fig. 5. According to Li et al. [26], the presence of exchangeable cations and incorporated active metals in aluminosilicates are usually seen in the lower wavenumber below 1000cm−1 especially in the region 900–600cm−1. A carefully analysis of the three spectrums (excluding the reflections of water molecules) shows that there is a good match until around 1200cm−1 and the mismatch became obvious below 1000cm−1 especially with the relocation of the strong absorption at 940cm−1 in ZLT support to 1050cm−1 in Pd/Z and FPd/Z. Similarly, the moderate absorption band at 675cm−1 in the ZLT support also relocated to 753cm−1 with reduced intensities in both Pd/Z and FPd/Z, and it almost disappeared in the latter probably to the fluoride ion modification. These observations are indications of successful formation of SiOPd bond due to the incorporation of Pd into the ZLT matrix [4]. In addition, the appearance of a new miniature band at 576cm−1 can be ascribed to the formation of another bond between Pd particles and Si–Al structure of the support [25]. 3.1.7.1 Raman spectroscopy The Raman spectra in Fig. 7 showed the characteristic bands of ZLT, Pd/Z and FPd/Z samples. Characteristics distinctive peaks of zeolite A are observed in the spectrum of ZLT at 280, 330, 400, 490, 700, 977, 1030, 1150 and 1457cm−1. Previous work [28] on Raman spectroscopy characterization of zeolite A has shown that it possesses 4-, 6- and 8- membered rings, and smaller rings give bands at higher frequency. Consequently, the band at 280cm−1 in the ZLT sample can be assigned to the bending mode of the 8 membered rings. Similarly, the bands at 330 and 410cm−1 are due to the bending mode of 6-membered SiOAl rings while the strongest band at 490cm−1 is assigned to the bending mode of 4-membered SiOAl rings [28]. Typically, Raman bands in the region of 600–900cm−1 are assigned to symmetric TO stretching modes, on the other hand, the bands at 977, 1030 and 1150cm−1 are ascribed to asymmetric TO stretching motions. A clearly distinctive band at 800cm−1 which obviously is not a characteristic of zeolite A can be seen in spectrum of ZLT which possibly signifies the presence certain impurities since Raman peak at 800cm−1 is typical of 5-memebered ring of zeolite ZSM-5. The effect of the catalysts precursors (i.e. PdOxC and FPdOxC) incorporation into the ZLT can be observed to have developed series of multiple stretches of background noise-like vibrations (BNV) in the Pd/Z and FPd/Z catalysts. These BNV according to Ghule et al., [19] reflects the presence of carbonate anion (CO3 2−) from organics (i.e. oxalate) with D3h symmetry usually exhibiting four normal vibrational modes which consist of a symmetric stretching vibration (ν 1) around 1063cm−1, an out-of-plane bend (ν 2) around 879cm−1, a doubly degenerate antisymmetric stretch (ν 3) around 1415cm−1 and lastly doubly degenerate bending mode (ν 4) around 680cm−1 [29]. The presence of these BNV even after calcination implied that the Pd particles in the Pd/Z and FPd/Z retained their oxalate ligand structure [19]. After the catalyst synthesis, earlier bands seen at 490 and 1150cm−1 in the ZLT were seen to have slightly denatured and shifted to 480 and 1120cm−1, respectively in both the Pd/Z and FPd/Z, while the band at 800cm−1 disappeared completely probably due to the acidic effect of oxalic acid functionalization and calcination that resulted into loss of crystallinity earlier observed in the SEM and XRD results (Fig. 2 (inset) and Fig. 4). The comparably severe loss of crystallinity in the FPd/Z catalyst compared to Pd/Z earlier observed in the SEM and XRD results which gave rise to its comparably higher Si/Al ratio (Table 1) also explains why certain peaks such as at 443, 480, 575, 740, 1040 and 1120cm−1 are less intense in the FPd/Z catalyst. The new band at 443cm−1 and the bands at 648, 740 and 928cm−1 confirmed the presence of dispersed palladium particles in the Pd/Z and FPd/Z catalyst [18,25,27]. 3.2 Catalytic activities of Pd/Z and FPd/Z on the hydrodeoxygenation and isomerization of oleic acid into biofuel Recently in attempt to gain thorough insight into the hydrodeoxygenation (HDO) process of different feed stocks, studies on reaction variables such as effects of reaction pressure and temperature, H2 gas flow rate, catalyst loading and even types of reactors and mode of operations have been well studied and reported [20,30–34]. However, since existing hydrotreating units of conventional crude oil refineries can be adapted for the HDO process of biofuel production, studies on expedient synthesis of suitable catalysts such as types of the support and metals [34], systematic catalyst preparation procedure [20,26,35] and additives such as sulfur [36] and phosphorus [31] are currently receiving attention. In this direction, we recently, functionalized nickel with oxalic acid and supported on alumina for the hydrodeoxygenation of oleic acid into high grade biofuel [18]. At the best operational conditions of 20 bar, 360°C and 100ml/min of gas flow, the catalyst showed superior activities to other alumina supported Ni catalysts in literature. In addition, the catalyst was able to achieve skeletal isomerization of already hydrodeoxygenated n-paraffin due to the effect of the oxalic acid functionalization. As a step further, in this work we modified palladium oxalate catalyst with fluoride ion and compared its activities with unmodified palladium oxalate catalyst at the earlier best observed operation condition for the HDO of oleic acid and the result is shown in Fig. 8 . It is very obvious that FPd/Z possesses both higher HDO and isomerization activities compared to Pd/Z. Even though Pd/Z and FPd/Z showed almost same n-C18H38 quantity, but the fact that the latter has superior isomerization ability confirmed that it is more prospective for industrial application since it is well known that n-C18H38 produced in the HDO step is the substrate for the isomerization step to produce the iso-C18H38. The enhanced HDO activity of FPd/Z compared to Pd/Z was ascribed to its increased acidity at the synthesis stages which improves the solubility of Pd in the support and facilitates the formation of Pd (II) polynuclear complex which in turn guarantees high Pd dispersion as seen in the XRD result (Fig. 4). In addition, its increased acidity also modified its morphology from crystalline into amorphous (Fig. 2 (insets)) and enhanced its textural properties (Table 2) which in turn increases the N 2 adsorption/desorption isotherm hysteresis loop as shown in Fig. 3. This observation is in agreement with the works of Li et al. [26] on the functionalization of NiMo/γ-Al2O3 catalysts with varying quantities of urea. They reported that the urea functionalization greatly enhances the textural properties and the solubility of Mo and Ni particles in the support as well as facilitates the formation of molybdate and polymolybdate species due to increased acidity. Generally, aluminosilicates gradually transform from crystalline form into amorphous under acid attacks [19,37] thus leading to increase in Si/Al ratio as seen in Table 1. Such transformation is usually accompanied with reduction in particle size which in turn increased the specific surface area and porosity as observed in Table 2. Such morphological and textural properties variation has been reported to increase catalyst activities by ensuring well dispersed active metal particles [22,26]. Therefore, the enhanced textural properties of FPd/Z compared to Pd/Z will equally provide additional and sufficient surface area for active metal incorporation and also guarantee unrestricted access for the reacting molecules owing to enhanced porosity [19,22]. Furthermore, both catalysts were seen to produce isomerized products, while FPd/Z produces about 28% iso-C18H38, Pd/Z produces only 11%. The presence of the iso-C18H38 was due to FPd/Z increased acidity. Previous studies [32,35] have shown that catalysts with increased acidity are highly favorable for paraffin skeletal isomerization. Typically, the presence of isomerized product is considered an advantage due to the ability of iso-paraffin fractions to lower the biofuel freezing point by about 20°C since n-paraffin (C16–C18) has comparable high freezing point (between 18°C and 28°C) which is a disadvantage to their cold flow properties such as cold filter plugging point [32,38]. The increased iso-C18H38 content in FPd/Z compared to Pd/Z was unarguably due to the fluoride ion functionalization which further increased the acidity of FPd/Z. The presence of C17H36 in Fig. 8 when using Pd/Z confirmed instances of decarboxylation or decarbonylation, and this is further corroborated by the increase in the amount of gases (such as CO2/CO). Unfortunately, as earlier commented (Section 2.4) the online identification and quantification of these gases were not technically feasible during this study, hence determination of the gas species was not possible. The amount of the lumped unidentified products such as unreacted oleic acid, oligomerized products and other functional group is also higher in Pd/Z showing that its activity and selectivity is comparably inferior to FPd/Z. It is obvious that effect of fluoride ion functionalization is highly invaluable since only the iso-paraffin content of FPd/Z fall within the range (20–40%) reported by Šimácˇek et al. [39] that could significantly improve the cold flow properties (CFPP, pour point, cloud point, etc.) of biofuel. 4 Conclusion Two different zeolite supported catalysts were synthesized from palladium functionalized with oxalic acid, one was further modified with fluoride ion to increase its acidity. The fluoride ion modified palladium oxalate zeolite supported catalyst (FPd/Z) showed considerable enhancement in textural properties and loss of crystallinity compared to the palladium oxalate zeolite supported catalyst (Pd/Z) due to the effect of the fluoride ion. In addition, the FPd/Z also showed relatively stronger Pd intensity according to the EDX results as well as higher Pd dispersion. Their catalytic activity tested at 20 bar, 360°C, 100ml/min of H2 gas flow and 20mg of each catalyst loading showed that both Pd/Z and FPd/Z shared similar hydrodeoxygenation activities producing 56% n-C18H38 and 58% n-C18H38, respectively, but FPd/Z has superior isomerization ability producing 28% iso-C18H38 while Pd/Z produces 11% iso-C18H38. Finally, the results showed that with expedient synthesis protocol, cheap zeolite A can be successfully used as biofuel hydrodeoxygenation and isomerization catalyst support to cut down production cost and make the process economically attractive. Acknowledgment The authors sincerely acknowledge the financial support from Higher Impact Research-Minisrty of Higher Education project no D000011-16001 of the Faculty of Engineering, University of Malaya. References [1] K. Rida S. Bouraoui S. Hadnine Appl. Clay Sci. 83–84 2013 99 105 [2] J.-Q. Wang Y.-X. Huang Y. Pan J.-X. Mi Micropor. Mesopor. Mater. 199 1 2014 50 56 [3] O.B. Ayodele B.H. Hameed Appl. Clay Sci. 83–84 2013 171 181 [4] O.B. Ayodele O.S. Togunwa Appl. Catal. A 470 2014 285 293 [5] M. Milina S. Mitchell P. Crivelli D. Cooke J. Pérez-Ramı́rez Nat. Commun. 2015 10.1038/ncomms4922 [6] A. Duan G. Wan Y. Zhang Z. Zhao G. Jiang J. Liu Catal. Today 175 2011 485 493 [7] T.S. Jamil T.A. Gad-Allah H.S. Ibrahim T.S. Saleh Solid State Sci. 13 2011 198 203 [8] O.B. Ayodele B.H. Hameed J. Ind. Eng. Chem. 19 2013 966 974 [9] O.B. Ayodele J.K. Lim B.H. Hameed Appl. Catal. A 413–414 2012 301 309 [10] H.S. Ibrahim T.S. Jamil E.Z. Hegazy J. Hazard. Mater. 182 2010 842 847 [11] K.S. Hui K.N. Hui S.K. Lee Int. J. Chem. Biol. Eng. 2 4 2009 165 175 [12] Z. Zhou G. Jin H. Liu J. Wu J. Mei Appl. Clay Sci. 97–98 2014 110 114 [13] K. Shams S.J. Mirmohammadi Micropor. Mesopor. Mater. 106 2007 268 277 [14] M. Kazemimoghadam T. Mohammadi Desalination 278 2011 438 442 [15] D.M. EL-Mekkawi M.M. Selim J. Env. Chem. Eng. 2 2014 723 730 [16] Y. Ma C. Yan A. Alshameri X. Qiu C. Zhou D. li Adv. Powder Technol. 25 2014 495 499 [17] O.B. Ayodele Appl. Clay Sci. 72 2013 74 83 [18] O.B. Ayodele H.F. Abbas W.M.A.W. Daud Energy Convers. Manage. 2015 http://dx.doi.org/10.1016/j.enconman.2014.05.099 [19] A.V. Ghule K. Ghule T. Punde J. Liu S. Tzing J. Chang H. Chang Y. Ling Mater. Chem. Phys. 119 2010 86 92 [20] T. Danuthaia T. Sooknoi S. Jongpatiwut T. Rirksomboon S. Osuwan D.E. Resasco Appl. Catal. A 409–410 2011 74 81 [21] L. Xiaoling W. Yan W. Xujin Z. Yafei G. Yanjun X. Qinghu X. Jun D. Feng D. Tao Chin. J. Catal. 33 2012 1889 1900 [22] T. Xue Y.M. Wang M.Y. He Micropor. Mesopor. Mater. 156 2012 29 35 [23] H. Jia J. Stark L.Q. Zhou C. Ling T. Sekito Z. Markin RSC Adv. 2 2012 10874 10881 [24] B. Pommier P. Gelin Phys. Chem. Chem. Phys. 1 1999 1665 1672 [25] A. Gannouni X. Rozanska B. Albela M.S. Zina F. Delbecq L. Bonneviot A. Ghorbel J. Catal. 289 2012 227 237 [26] J. Li Z. Xia W. Lai J. Zheng B. Chen X. Yi W. Fang Fuel 97 2012 504 511 [27] H. Ohtsuka T. Tabata Appl. Catal. B 21 1999 133 139 [28] Y. Yu G. Xiong C. Li F.S. Xiao Micropor. Mesopor. Mater. 46 2001 23 34 [29] F. Ray W. Matt M. Wayde M. Stuart Neues Jahrbuch für Mineralogie Abhandlungen 183 1 2006 107 116 [30] J.G. Immer M.J. Kelly H.H. Lamb Appl. Catal. A 375 2010 134 139 [31] H. Zhang H. Lin W. Wang Y. Zheng P. Hu Appl. Catal. B 2015 http://dx.doi.org/doi:10.1016/j.apcatb.2013.12.006 [32] S. Kovacs T. Kasza A. Thernesz I.W. Horvath J. Hancsok Chem. Eng. J. 176–177 2011 237 243 [33] L.A. Sousa J.L. Zotin V. Teixeira da Silva Appl. Catal. A 449 2012 105 111 [34] J. Park J.K. Lee J. Miyawaki Y.-K. Kim S.H. Yoon I. Mochida Fuel 90 2011 182 189 [35] A. Guzman J.E. Torres L.P. Prada M.L. Nunez Catal. Today 156 2010 38 43 [36] R. Sotelo-Boyás Y. Liu T. Minowa Ind. Eng. Chem. Res. 50 5 2011 2791 2799 [37] O.B. Ayodele W.M.A.W. Daud J. Taiwan Inst. Chem. Eng. 2015 http://dx.doi.org/10.1016/j.jtice.2014.09.031 [38] O.B. Ayodele H.U. Farouk J. Mohammed Y. Uemura W.M.A.W. Daud J. Taiwan Inst. Chem. Eng. 2015 http://dx.doi.org/10.1016/j.jtice.2014.12.014 [39] P. ̌Simǎcek D. Kubǐcka G. ̌Sebor M. Pospǐsil Fuel 88 2009 456 460",
      "scopus-id": "84923924162",
      "coredata": {
        "eid": "1-s2.0-S1381116915000485",
        "dc:description": "In this study, two different zeolite (ZLT) supported palladium catalysts (Pd/Zs) of varying acidity were synthesized, characterized and tested for biofuel production. The first Pd/Z was synthesized via the incorporation of palladium oxalate complex (PdOxC) prepared from the functionalization of H2PdCl4 with oxalic acid at pH 5.3 into ZLT. The PdOxC was further modified with drops of HF until pH 3.7 and incorporated into ZLT to synthesize zeolite supported fluoride ion modified PdOxC catalyst (FPd/Z). Their characterization results showed that there is considerable crystallinity loss in Pd/Z, while FPd/Z showed drastic crystallinity loss according to the SEM and XRD results. In addition, the specific surface area and porosity of ZLT increased from 202m2/g and 0.13cm3/g to 371m2/g and 0.23cm3/g in Pd/Z, and 427m2/g and 0.29cm3/g in FPd/Z catalysts, respectively. Pd/Z catalyst produces 56% n-C18H38 and 11% iso-C18H38, while FPd/Z produces 58% n-C18H38 and 28% iso-C18H38 in the hydrodeoxygenation (HDO) and isomerization (ISO) steps, respectively. The enhancements in the catalysts properties are due to the acidic effect of OxA via the incorporation of PdOxC, while the additional enhancements in the properties and the ISO activity of FPd/Z was ascribed to the acidic effect of fluoride ion modification. It is obvious that OxA functionalization and subsequent fluoride ion modification are highly invaluable toward biofuel production.",
        "openArchiveArticle": "false",
        "prism:coverDate": "2015-05-01",
        "openaccessUserLicense": null,
        "prism:aggregationType": "Journal",
        "prism:url": "https://api.elsevier.com/content/article/pii/S1381116915000485",
        "dc:creator": [
          {
            "@_fa": "true",
            "$": "Ayodele, O.B."
          },
          {
            "@_fa": "true",
            "$": "Farouk, Hamisu U."
          },
          {
            "@_fa": "true",
            "$": "Mohammed, Jibril"
          },
          {
            "@_fa": "true",
            "$": "Uemura, Yoshimitsu"
          },
          {
            "@_fa": "true",
            "$": "Daud, W.M.A.W."
          }
        ],
        "link": [
          {
            "@_fa": "true",
            "@rel": "self",
            "@href": "https://api.elsevier.com/content/article/pii/S1381116915000485"
          },
          {
            "@_fa": "true",
            "@rel": "scidir",
            "@href": "https://www.sciencedirect.com/science/article/pii/S1381116915000485"
          }
        ],
        "dc:format": "application/json",
        "openaccessType": null,
        "pii": "S1381-1169(15)00048-5",
        "prism:volume": "400",
        "prism:publisher": "Elsevier B.V.",
        "dc:title": "Effect of precursor acidity on zeolite supported Pd catalyst properties and hydrodeoxygenation activity for the production of biofuel",
        "prism:copyright": "Copyright © 2015 Elsevier B.V. All rights reserved.",
        "openaccess": "0",
        "prism:issn": "13811169",
        "dcterms:subject": [
          {
            "@_fa": "true",
            "$": "Biofuel"
          },
          {
            "@_fa": "true",
            "$": "Palladium catalyst"
          },
          {
            "@_fa": "true",
            "$": "Hydrodeoxygenation"
          },
          {
            "@_fa": "true",
            "$": "Isomerization"
          },
          {
            "@_fa": "true",
            "$": "Oleic acid"
          }
        ],
        "openaccessArticle": "false",
        "prism:publicationName": "Journal of Molecular Catalysis A: Chemical",
        "openaccessSponsorType": null,
        "prism:pageRange": "179-186",
        "prism:endingPage": "186",
        "pubType": "fla",
        "prism:coverDisplayDate": "1 May 2015",
        "prism:doi": "10.1016/j.molcata.2015.01.033",
        "prism:startingPage": "179",
        "dc:identifier": "doi:10.1016/j.molcata.2015.01.033",
        "openaccessSponsorName": null
      },
      "objects": {
        "object": [
          {
            "@category": "thumbnail",
            "@height": "37",
            "@width": "148",
            "@_fa": "true",
            "$": "https://api.elsevier.com/content/object/eid/1-s2.0-S1381116915000485-si1.gif?httpAccept=%2A%2F%2A",
            "@multimediatype": "GIF image file",
            "@type": "ALTIMG",
            "@size": "618",
            "@ref": "si1",
            "@mimetype": "image/gif"
          },
          {
            "@category": "high",
            "@height": "975",
            "@width": "1500",
            "@_fa": "true",
            "$": "https://api.elsevier.com/content/object/eid/1-s2.0-S1381116915000485-gr8_lrg.jpg?httpAccept=%2A%2F%2A",
            "@multimediatype": "JPEG image file",
            "@type": "IMAGE-HIGH-RES",
            "@size": "146278",
            "@ref": "gr8",
            "@mimetype": "image/jpeg"
          },
          {
            "@category": "high",
            "@height": "563",
            "@width": "1022",
            "@_fa": "true",
            "$": "https://api.elsevier.com/content/object/eid/1-s2.0-S1381116915000485-gr7_lrg.jpg?httpAccept=%2A%2F%2A",
            "@multimediatype": "JPEG image file",
            "@type": "IMAGE-HIGH-RES",
            "@size": "170041",
            "@ref": "gr7",
            "@mimetype": "image/jpeg"
          },
          {
            "@category": "high",
            "@height": "580",
            "@width": "1019",
            "@_fa": "true",
            "$": "https://api.elsevier.com/content/object/eid/1-s2.0-S1381116915000485-gr6_lrg.jpg?httpAccept=%2A%2F%2A",
            "@multimediatype": "JPEG image file",
            "@type": "IMAGE-HIGH-RES",
            "@size": "101837",
            "@ref": "gr6",
            "@mimetype": "image/jpeg"
          },
          {
            "@category": "high",
            "@height": "1249",
            "@width": "750",
            "@_fa": "true",
            "$": "https://api.elsevier.com/content/object/eid/1-s2.0-S1381116915000485-gr5_lrg.jpg?httpAccept=%2A%2F%2A",
            "@multimediatype": "JPEG image file",
            "@type": "IMAGE-HIGH-RES",
            "@size": "134286",
            "@ref": "gr5",
            "@mimetype": "image/jpeg"
          },
          {
            "@category": "high",
            "@height": "549",
            "@width": "1000",
            "@_fa": "true",
            "$": "https://api.elsevier.com/content/object/eid/1-s2.0-S1381116915000485-gr4_lrg.jpg?httpAccept=%2A%2F%2A",
            "@multimediatype": "JPEG image file",
            "@type": "IMAGE-HIGH-RES",
            "@size": "87625",
            "@ref": "gr4",
            "@mimetype": "image/jpeg"
          },
          {
            "@category": "high",
            "@height": "598",
            "@width": "992",
            "@_fa": "true",
            "$": "https://api.elsevier.com/content/object/eid/1-s2.0-S1381116915000485-gr3_lrg.jpg?httpAccept=%2A%2F%2A",
            "@multimediatype": "JPEG image file",
            "@type": "IMAGE-HIGH-RES",
            "@size": "122528",
            "@ref": "gr3",
            "@mimetype": "image/jpeg"
          },
          {
            "@category": "high",
            "@height": "3755",
            "@width": "1667",
            "@_fa": "true",
            "$": "https://api.elsevier.com/content/object/eid/1-s2.0-S1381116915000485-gr2_lrg.jpg?httpAccept=%2A%2F%2A",
            "@multimediatype": "JPEG image file",
            "@type": "IMAGE-HIGH-RES",
            "@size": "1253894",
            "@ref": "gr2",
            "@mimetype": "image/jpeg"
          },
          {
            "@category": "high",
            "@height": "2827",
            "@width": "1167",
            "@_fa": "true",
            "$": "https://api.elsevier.com/content/object/eid/1-s2.0-S1381116915000485-gr1_lrg.jpg?httpAccept=%2A%2F%2A",
            "@multimediatype": "JPEG image file",
            "@type": "IMAGE-HIGH-RES",
            "@size": "329730",
            "@ref": "gr1",
            "@mimetype": "image/jpeg"
          },
          {
            "@category": "high",
            "@height": "886",
            "@width": "2213",
            "@_fa": "true",
            "$": "https://api.elsevier.com/content/object/eid/1-s2.0-S1381116915000485-fx1_lrg.jpg?httpAccept=%2A%2F%2A",
            "@multimediatype": "JPEG image file",
            "@type": "IMAGE-HIGH-RES",
            "@size": "124441",
            "@ref": "fx1",
            "@mimetype": "image/jpeg"
          },
          {
            "@category": "standard",
            "@height": "220",
            "@width": "339",
            "@_fa": "true",
            "$": "https://api.elsevier.com/content/object/eid/1-s2.0-S1381116915000485-gr8.jpg?httpAccept=%2A%2F%2A",
            "@multimediatype": "JPEG image file",
            "@type": "IMAGE-DOWNSAMPLED",
            "@size": "24262",
            "@ref": "gr8",
            "@mimetype": "image/jpeg"
          },
          {
            "@category": "standard",
            "@height": "212",
            "@width": "384",
            "@_fa": "true",
            "$": "https://api.elsevier.com/content/object/eid/1-s2.0-S1381116915000485-gr7.jpg?httpAccept=%2A%2F%2A",
            "@multimediatype": "JPEG image file",
            "@type": "IMAGE-DOWNSAMPLED",
            "@size": "39123",
            "@ref": "gr7",
            "@mimetype": "image/jpeg"
          },
          {
            "@category": "standard",
            "@height": "218",
            "@width": "383",
            "@_fa": "true",
            "$": "https://api.elsevier.com/content/object/eid/1-s2.0-S1381116915000485-gr6.jpg?httpAccept=%2A%2F%2A",
            "@multimediatype": "JPEG image file",
            "@type": "IMAGE-DOWNSAMPLED",
            "@size": "28267",
            "@ref": "gr6",
            "@mimetype": "image/jpeg"
          },
          {
            "@category": "standard",
            "@height": "470",
            "@width": "282",
            "@_fa": "true",
            "$": "https://api.elsevier.com/content/object/eid/1-s2.0-S1381116915000485-gr5.jpg?httpAccept=%2A%2F%2A",
            "@multimediatype": "JPEG image file",
            "@type": "IMAGE-DOWNSAMPLED",
            "@size": "38310",
            "@ref": "gr5",
            "@mimetype": "image/jpeg"
          },
          {
            "@category": "standard",
            "@height": "206",
            "@width": "376",
            "@_fa": "true",
            "$": "https://api.elsevier.com/content/object/eid/1-s2.0-S1381116915000485-gr4.jpg?httpAccept=%2A%2F%2A",
            "@multimediatype": "JPEG image file",
            "@type": "IMAGE-DOWNSAMPLED",
            "@size": "25116",
            "@ref": "gr4",
            "@mimetype": "image/jpeg"
          },
          {
            "@category": "standard",
            "@height": "225",
            "@width": "373",
            "@_fa": "true",
            "$": "https://api.elsevier.com/content/object/eid/1-s2.0-S1381116915000485-gr3.jpg?httpAccept=%2A%2F%2A",
            "@multimediatype": "JPEG image file",
            "@type": "IMAGE-DOWNSAMPLED",
            "@size": "34420",
            "@ref": "gr3",
            "@mimetype": "image/jpeg"
          },
          {
            "@category": "standard",
            "@height": "847",
            "@width": "376",
            "@_fa": "true",
            "$": "https://api.elsevier.com/content/object/eid/1-s2.0-S1381116915000485-gr2.jpg?httpAccept=%2A%2F%2A",
            "@multimediatype": "JPEG image file",
            "@type": "IMAGE-DOWNSAMPLED",
            "@size": "125737",
            "@ref": "gr2",
            "@mimetype": "image/jpeg"
          },
          {
            "@category": "standard",
            "@height": "637",
            "@width": "263",
            "@_fa": "true",
            "$": "https://api.elsevier.com/content/object/eid/1-s2.0-S1381116915000485-gr1.jpg?httpAccept=%2A%2F%2A",
            "@multimediatype": "JPEG image file",
            "@type": "IMAGE-DOWNSAMPLED",
            "@size": "56425",
            "@ref": "gr1",
            "@mimetype": "image/jpeg"
          },
          {
            "@category": "standard",
            "@height": "200",
            "@width": "500",
            "@_fa": "true",
            "$": "https://api.elsevier.com/content/object/eid/1-s2.0-S1381116915000485-fx1.jpg?httpAccept=%2A%2F%2A",
            "@multimediatype": "JPEG image file",
            "@type": "IMAGE-DOWNSAMPLED",
            "@size": "14971",
            "@ref": "fx1",
            "@mimetype": "image/jpeg"
          },
          {
            "@category": "thumbnail",
            "@height": "142",
            "@width": "219",
            "@_fa": "true",
            "$": "https://api.elsevier.com/content/object/eid/1-s2.0-S1381116915000485-gr8.sml?httpAccept=%2A%2F%2A",
            "@multimediatype": "GIF image file",
            "@type": "IMAGE-THUMBNAIL",
            "@size": "5566",
            "@ref": "gr8",
            "@mimetype": "image/gif"
          },
          {
            "@category": "thumbnail",
            "@height": "121",
            "@width": "219",
            "@_fa": "true",
            "$": "https://api.elsevier.com/content/object/eid/1-s2.0-S1381116915000485-gr7.sml?httpAccept=%2A%2F%2A",
            "@multimediatype": "GIF image file",
            "@type": "IMAGE-THUMBNAIL",
            "@size": "7739",
            "@ref": "gr7",
            "@mimetype": "image/gif"
          },
          {
            "@category": "thumbnail",
            "@height": "125",
            "@width": "219",
            "@_fa": "true",
            "$": "https://api.elsevier.com/content/object/eid/1-s2.0-S1381116915000485-gr6.sml?httpAccept=%2A%2F%2A",
            "@multimediatype": "GIF image file",
            "@type": "IMAGE-THUMBNAIL",
            "@size": "5343",
            "@ref": "gr6",
            "@mimetype": "image/gif"
          },
          {
            "@category": "thumbnail",
            "@height": "163",
            "@width": "98",
            "@_fa": "true",
            "$": "https://api.elsevier.com/content/object/eid/1-s2.0-S1381116915000485-gr5.sml?httpAccept=%2A%2F%2A",
            "@multimediatype": "GIF image file",
            "@type": "IMAGE-THUMBNAIL",
            "@size": "3411",
            "@ref": "gr5",
            "@mimetype": "image/gif"
          },
          {
            "@category": "thumbnail",
            "@height": "120",
            "@width": "219",
            "@_fa": "true",
            "$": "https://api.elsevier.com/content/object/eid/1-s2.0-S1381116915000485-gr4.sml?httpAccept=%2A%2F%2A",
            "@multimediatype": "GIF image file",
            "@type": "IMAGE-THUMBNAIL",
            "@size": "5109",
            "@ref": "gr4",
            "@mimetype": "image/gif"
          },
          {
            "@category": "thumbnail",
            "@height": "132",
            "@width": "219",
            "@_fa": "true",
            "$": "https://api.elsevier.com/content/object/eid/1-s2.0-S1381116915000485-gr3.sml?httpAccept=%2A%2F%2A",
            "@multimediatype": "GIF image file",
            "@type": "IMAGE-THUMBNAIL",
            "@size": "6203",
            "@ref": "gr3",
            "@mimetype": "image/gif"
          },
          {
            "@category": "thumbnail",
            "@height": "162",
            "@width": "72",
            "@_fa": "true",
            "$": "https://api.elsevier.com/content/object/eid/1-s2.0-S1381116915000485-gr2.sml?httpAccept=%2A%2F%2A",
            "@multimediatype": "GIF image file",
            "@type": "IMAGE-THUMBNAIL",
            "@size": "7612",
            "@ref": "gr2",
            "@mimetype": "image/gif"
          },
          {
            "@category": "thumbnail",
            "@height": "162",
            "@width": "67",
            "@_fa": "true",
            "$": "https://api.elsevier.com/content/object/eid/1-s2.0-S1381116915000485-gr1.sml?httpAccept=%2A%2F%2A",
            "@multimediatype": "GIF image file",
            "@type": "IMAGE-THUMBNAIL",
            "@size": "3413",
            "@ref": "gr1",
            "@mimetype": "image/gif"
          },
          {
            "@category": "thumbnail",
            "@height": "88",
            "@width": "219",
            "@_fa": "true",
            "$": "https://api.elsevier.com/content/object/eid/1-s2.0-S1381116915000485-fx1.sml?httpAccept=%2A%2F%2A",
            "@multimediatype": "GIF image file",
            "@type": "IMAGE-THUMBNAIL",
            "@size": "3051",
            "@ref": "fx1",
            "@mimetype": "image/gif"
          }
        ]
      },
      "link": {
        "@rel": "abstract",
        "@href": "https://api.elsevier.com/content/abstract/scopus_id/84923924162"
      }
    }
  }
}