{
  "metadata": {
    "title": "Faster initiating olefin metathesis catalysts from introducing double bonds into cyclopropyl, cyclobutyl and cyclopentyl derivatives of Hoveyda-Grubbs precatalysts",
    "authors": "; ; ",
    "journal": "Molecular Catalysis",
    "date": "2017-05-31",
    "doi": "10.1016/j.mcat.2016.12.018",
    "abstract": "",
    "uri": "https://api.elsevier.com/content/article/pii/S1381116916305799",
    "pii": "S1381116916305799"
  },
  "fulltext": {
    "full-text-retrieval-response": {
      "scopus-eid": "2-s2.0-85029644423",
      "originalText": "serial JL 315758 291210 291744 291790 291809 31 Molecular Catalysis MOLECULARCATALYSIS 2017-04-01 2017-04-01 2017-04-01 2017-04-01 2017-03-31T21:48:52 1-s2.0-S1381116916305799 S1381-1169(16)30579-9 S1381116916305799 10.1016/j.mcat.2016.12.018 S300 S300.1 FULL-TEXT 1-s2.0-S2468823117X00072 2021-10-25T09:39:35.811206Z 0 0 20170501 20170531 2017 2017-04-01T01:20:04.154706Z absattachment articleinfo articletitlenorm authfirstinitialnorm authfirstsurnamenorm cid cids contenttype copyright crossmark dateloaded dateloadedtxt datesearch datesort dateupdated dco docsubtype doctype doi eid ewtransactionid hubeid indexeddate issn issnnorm itemstage itemtransactionid itemweight openaccess openarchive pg pgfirst pglast pii piinorm pubdateend pubdatestart pubdatetxt pubyr sectiontitle sortorder srctitle srctitlenorm srctype ssids alllist content subj subheadings suppl tomb volfirst volissue volumelist webpdf webpdfpagecount yearnav figure table e-component body acknowledge affil appendices articletitle auth authfirstini authfull authkeywords authlast grantsponsor primabst ref specialabst 2468-8231 24688231 true 433 433 C Volume 433 39 313 320 313 320 201705 May 2017 2017-05-01 2017-05-31 2017 Regular Papers article fla © 2017 Elsevier B.V. All rights reserved. FASTERINITIATINGOLEFINMETATHESISCATALYSTSINTRODUCINGDOUBLEBONDSCYCLOPROPYLCYCLOBUTYLCYCLOPENTYLDERIVATIVESHOVEYDAGRUBBSPRECATALYSTS TRZASKOWSKI B 1 Introduction 2 Methods 2.1 Computational details 3 Results and discussion 3.1 Structural studies 3.2 Performance in metathesis initiation 4 Conclusions Acknowledgments Appendix A Supplementary data References GESSLER 2000 9973 9976 S GARBER 2000 8168 8179 S SCHROCK 2003 4592 4633 R VOUGIOUKALAKIS 2010 1746 1787 G SAMOJLOWICZ 2009 3708 3742 C BARBASIEWICZ 2007 193 203 M CONSORTI 2009 4527 4533 C BIENIEK 2011 4144 4158 M ZHANG 2014 1 9 Y LIU 2014 51 54 G KOS 2013 439 447 P ENGLE 2015 5782 5792 K THIEL 2012 1104 1114 V VORFALT 2010 5533 5536 T ZHAO 2005 161103 Y LUO 2011 13683 13689 S ZHAO 2008 157 167 Y CAVALLO 2002 8965 8973 L VYBOISCHIKOV 2005 3921 3935 S NAUMOV 2008 963 970 S SOLANSMONFORT 2010 7331 7343 X NELSON 2014 4290 4294 J SLIWA 2016 621 628 P MINENKOV 2013 2099 2111 Y NELSON 2014 10355 10375 D ASHWORTH 2013 1929 1939 I PUMP 2014 2806 2813 E ASHWORTH 2011 5428 5430 I ZUKOWSKA 2013 2192 2198 K TRZASKOWSKI 2013 3625 3630 B MICHROWSKA 2004 9318 9325 A PAZIO 2015 563 570 A PAZIO 2015 20021 20026 A HOREGLAD 2015 3480 3496 P TRZASKOWSKI 2016 133 138 B TRZASKOWSKI 2016 21423 21429 B BENITEZ 2008 2643 2645 D BENITEZ 2008 6194 6196 D YANG 2011 4196 4200 H VYBOISHCHIKOV 2002 3962 3975 S ADLHART 2004 3496 3510 C DIESENDRUCK 2009 10819 10825 C LOVE 2002 4035 4037 J CHANG 2000 3211 3219 C WILSON 1979 199 209 R CASKEY 2006 7422 7424 S WAKAMATSU 2002 2403 2405 H TRZASKOWSKIX2017X313 TRZASKOWSKIX2017X313X320 TRZASKOWSKIX2017X313XB TRZASKOWSKIX2017X313X320XB 2019-04-01T00:00:00Z http://creativecommons.org/licenses/by-nc-nd/4.0/ © 2017 Elsevier B.V. All rights reserved. 0 item S1381-1169(16)30579-9 S1381116916305799 1-s2.0-S1381116916305799 10.1016/j.mcat.2016.12.018 315758 2017-03-31T20:20:04.154706-04:00 2017-05-01 2017-05-31 1-s2.0-S1381116916305799-main.pdf https://s3-eu-west-1.amazonaws.com/prod-ucs-content-store-eu-west/content/pii:S1381116916305799/MAIN/application/pdf/02dba4bd0001c2b8d1b91fef43357d15/main.pdf https://s3.amazonaws.com/prod-ucs-content-store-us-east/content/pii:S1381116916305799/MAIN/application/pdf/02dba4bd0001c2b8d1b91fef43357d15/main.pdf main.pdf pdf true 1509643 MAIN 8 1-s2.0-S1381116916305799-main_1.png https://s3-eu-west-1.amazonaws.com/prod-ucs-content-store-eu-west/content/pii:S1381116916305799/PREVIEW/image/png/f46d29fa0d58df57dc90bf87fa78d8df/main_1.png https://s3.amazonaws.com/prod-ucs-content-store-us-east/content/pii:S1381116916305799/PREVIEW/image/png/f46d29fa0d58df57dc90bf87fa78d8df/main_1.png main_1.png png 56082 849 656 IMAGE-WEB-PDF 1 1-s2.0-S1381116916305799-fx1.sml https://s3-eu-west-1.amazonaws.com/prod-ucs-content-store-eu-west/content/pii:S1381116916305799/fx1/THUMBNAIL/image/gif/52d829a3f11d9f0a8289af34b553afef/fx1.sml https://s3.amazonaws.com/prod-ucs-content-store-us-east/content/pii:S1381116916305799/fx1/THUMBNAIL/image/gif/52d829a3f11d9f0a8289af34b553afef/fx1.sml fx1 true fx1.sml sml 3761 88 219 IMAGE-THUMBNAIL 1-s2.0-S1381116916305799-fx2.sml https://s3-eu-west-1.amazonaws.com/prod-ucs-content-store-eu-west/content/pii:S1381116916305799/fx2/THUMBNAIL/image/gif/14b5eab3692cc01785bd7bf9a5f5658a/fx2.sml https://s3.amazonaws.com/prod-ucs-content-store-us-east/content/pii:S1381116916305799/fx2/THUMBNAIL/image/gif/14b5eab3692cc01785bd7bf9a5f5658a/fx2.sml fx2 fx2.sml sml 1963 88 219 IMAGE-THUMBNAIL 1-s2.0-S1381116916305799-gr1.sml https://s3-eu-west-1.amazonaws.com/prod-ucs-content-store-eu-west/content/pii:S1381116916305799/gr1/THUMBNAIL/image/gif/0b06dbec0c3350fe2eabdd95a51fb2bf/gr1.sml https://s3.amazonaws.com/prod-ucs-content-store-us-east/content/pii:S1381116916305799/gr1/THUMBNAIL/image/gif/0b06dbec0c3350fe2eabdd95a51fb2bf/gr1.sml gr1 gr1.sml sml 4306 93 219 IMAGE-THUMBNAIL 1-s2.0-S1381116916305799-gr2.sml https://s3-eu-west-1.amazonaws.com/prod-ucs-content-store-eu-west/content/pii:S1381116916305799/gr2/THUMBNAIL/image/gif/313f81a8cc4715e95287127bdcd709b7/gr2.sml https://s3.amazonaws.com/prod-ucs-content-store-us-east/content/pii:S1381116916305799/gr2/THUMBNAIL/image/gif/313f81a8cc4715e95287127bdcd709b7/gr2.sml gr2 gr2.sml sml 5964 144 219 IMAGE-THUMBNAIL 1-s2.0-S1381116916305799-gr3.sml https://s3-eu-west-1.amazonaws.com/prod-ucs-content-store-eu-west/content/pii:S1381116916305799/gr3/THUMBNAIL/image/gif/1935598b26b0c2e1b648b510b6da5638/gr3.sml https://s3.amazonaws.com/prod-ucs-content-store-us-east/content/pii:S1381116916305799/gr3/THUMBNAIL/image/gif/1935598b26b0c2e1b648b510b6da5638/gr3.sml gr3 gr3.sml sml 5752 134 219 IMAGE-THUMBNAIL 1-s2.0-S1381116916305799-gr4.sml https://s3-eu-west-1.amazonaws.com/prod-ucs-content-store-eu-west/content/pii:S1381116916305799/gr4/THUMBNAIL/image/gif/5fbdd8314fbdecf60add9432f18be90e/gr4.sml https://s3.amazonaws.com/prod-ucs-content-store-us-east/content/pii:S1381116916305799/gr4/THUMBNAIL/image/gif/5fbdd8314fbdecf60add9432f18be90e/gr4.sml gr4 gr4.sml sml 5605 138 219 IMAGE-THUMBNAIL 1-s2.0-S1381116916305799-gr5.sml https://s3-eu-west-1.amazonaws.com/prod-ucs-content-store-eu-west/content/pii:S1381116916305799/gr5/THUMBNAIL/image/gif/7b49b527d8b4bb98527aa15f25c9b319/gr5.sml https://s3.amazonaws.com/prod-ucs-content-store-us-east/content/pii:S1381116916305799/gr5/THUMBNAIL/image/gif/7b49b527d8b4bb98527aa15f25c9b319/gr5.sml gr5 gr5.sml sml 5864 150 219 IMAGE-THUMBNAIL 1-s2.0-S1381116916305799-gr6.sml https://s3-eu-west-1.amazonaws.com/prod-ucs-content-store-eu-west/content/pii:S1381116916305799/gr6/THUMBNAIL/image/gif/2be145160dcd9f124f45c63e4efa27b9/gr6.sml https://s3.amazonaws.com/prod-ucs-content-store-us-east/content/pii:S1381116916305799/gr6/THUMBNAIL/image/gif/2be145160dcd9f124f45c63e4efa27b9/gr6.sml gr6 gr6.sml sml 5731 164 181 IMAGE-THUMBNAIL 1-s2.0-S1381116916305799-fx1.jpg https://s3-eu-west-1.amazonaws.com/prod-ucs-content-store-eu-west/content/pii:S1381116916305799/fx1/DOWNSAMPLED/image/jpeg/8f0019b7f098a5ec81b54f18b9cdb313/fx1.jpg https://s3.amazonaws.com/prod-ucs-content-store-us-east/content/pii:S1381116916305799/fx1/DOWNSAMPLED/image/jpeg/8f0019b7f098a5ec81b54f18b9cdb313/fx1.jpg fx1 true fx1.jpg jpg 17290 200 500 IMAGE-DOWNSAMPLED 1-s2.0-S1381116916305799-fx2.jpg https://s3-eu-west-1.amazonaws.com/prod-ucs-content-store-eu-west/content/pii:S1381116916305799/fx2/DOWNSAMPLED/image/jpeg/dc13dd55642c6b3a21ec00cfcb809202/fx2.jpg https://s3.amazonaws.com/prod-ucs-content-store-us-east/content/pii:S1381116916305799/fx2/DOWNSAMPLED/image/jpeg/dc13dd55642c6b3a21ec00cfcb809202/fx2.jpg fx2 fx2.jpg jpg 7108 200 500 IMAGE-DOWNSAMPLED 1-s2.0-S1381116916305799-gr1.jpg https://s3-eu-west-1.amazonaws.com/prod-ucs-content-store-eu-west/content/pii:S1381116916305799/gr1/DOWNSAMPLED/image/jpeg/ad0e2b8ddb12df184b7d39549015814c/gr1.jpg https://s3.amazonaws.com/prod-ucs-content-store-us-east/content/pii:S1381116916305799/gr1/DOWNSAMPLED/image/jpeg/ad0e2b8ddb12df184b7d39549015814c/gr1.jpg gr1 gr1.jpg jpg 39408 319 753 IMAGE-DOWNSAMPLED 1-s2.0-S1381116916305799-gr2.jpg https://s3-eu-west-1.amazonaws.com/prod-ucs-content-store-eu-west/content/pii:S1381116916305799/gr2/DOWNSAMPLED/image/jpeg/8d3f8620dea098d8c28ca6a41441460b/gr2.jpg https://s3.amazonaws.com/prod-ucs-content-store-us-east/content/pii:S1381116916305799/gr2/DOWNSAMPLED/image/jpeg/8d3f8620dea098d8c28ca6a41441460b/gr2.jpg gr2 gr2.jpg jpg 59544 496 753 IMAGE-DOWNSAMPLED 1-s2.0-S1381116916305799-gr3.jpg https://s3-eu-west-1.amazonaws.com/prod-ucs-content-store-eu-west/content/pii:S1381116916305799/gr3/DOWNSAMPLED/image/jpeg/647d3d17bdb5583cedc18a28cf749d6c/gr3.jpg https://s3.amazonaws.com/prod-ucs-content-store-us-east/content/pii:S1381116916305799/gr3/DOWNSAMPLED/image/jpeg/647d3d17bdb5583cedc18a28cf749d6c/gr3.jpg gr3 gr3.jpg jpg 34667 347 565 IMAGE-DOWNSAMPLED 1-s2.0-S1381116916305799-gr4.jpg https://s3-eu-west-1.amazonaws.com/prod-ucs-content-store-eu-west/content/pii:S1381116916305799/gr4/DOWNSAMPLED/image/jpeg/bbeda2e96b37d52e84e56a9843995e06/gr4.jpg https://s3.amazonaws.com/prod-ucs-content-store-us-east/content/pii:S1381116916305799/gr4/DOWNSAMPLED/image/jpeg/bbeda2e96b37d52e84e56a9843995e06/gr4.jpg gr4 gr4.jpg jpg 34232 356 565 IMAGE-DOWNSAMPLED 1-s2.0-S1381116916305799-gr5.jpg https://s3-eu-west-1.amazonaws.com/prod-ucs-content-store-eu-west/content/pii:S1381116916305799/gr5/DOWNSAMPLED/image/jpeg/6824184a98c3f900bf0951c733c6acb5/gr5.jpg https://s3.amazonaws.com/prod-ucs-content-store-us-east/content/pii:S1381116916305799/gr5/DOWNSAMPLED/image/jpeg/6824184a98c3f900bf0951c733c6acb5/gr5.jpg gr5 gr5.jpg jpg 34858 388 565 IMAGE-DOWNSAMPLED 1-s2.0-S1381116916305799-gr6.jpg https://s3-eu-west-1.amazonaws.com/prod-ucs-content-store-eu-west/content/pii:S1381116916305799/gr6/DOWNSAMPLED/image/jpeg/6fad408c4f97bd8b673697bdcd0b3d80/gr6.jpg https://s3.amazonaws.com/prod-ucs-content-store-us-east/content/pii:S1381116916305799/gr6/DOWNSAMPLED/image/jpeg/6fad408c4f97bd8b673697bdcd0b3d80/gr6.jpg gr6 gr6.jpg jpg 74296 681 753 IMAGE-DOWNSAMPLED 1-s2.0-S1381116916305799-mmc1.docx https://s3-eu-west-1.amazonaws.com/prod-ucs-content-store-eu-west/content/pii:S1381116916305799/mmc1/MAIN/application/msword/2c3bb6b7307144c19593c9e4fbad781f/mmc1.docx https://s3.amazonaws.com/prod-ucs-content-store-us-east/content/pii:S1381116916305799/mmc1/MAIN/application/msword/2c3bb6b7307144c19593c9e4fbad781f/mmc1.docx mmc1 mmc1.docx docx 347519 APPLICATION MCAT 18 S1381-1169(16)30579-9 10.1016/j.mcat.2016.12.018 Elsevier B.V. Fig. 1 Hoveyda-Grubbs catalyst 1 and its selected derivatives investigated earlier. Fig. 1 Fig. 2 Derivatives of the Hoveyda-Grubbs catalyst studied in this work, including the atom numbering scheme used throughout this work. Fig. 2 Fig. 3 Calculated free energies of activation (ΔG‡) and relative free energies of the precatalyst, activated catalyst and catalyst with the associated olefin of complexes 9, 13–15 and 26. All values are in kcal/mol and relative to the corresponding precatalyst. Here we see that 13 and 26 have both low barriers for activation, a low energy activated catalyst, and a low energy for association with olefin, making these systems the most promising. Fig. 3 Fig. 4 Calculated free energies of activation (ΔG‡) and relative free energies of the precatalyst, activated catalyst and catalyst with the associated olefin of complexes 16–19 and 27. Fig. 4 Fig. 5 Calculated free energies of activation (ΔG‡) and relative free energies of the precatalyst, activated catalyst and catalyst with the associated olefin of complexes 20–23, 25 and 28. Fig. 5 Fig. 6 Correlation plots between Gibbs free energy of activation and selected structural and computational parameters: a) bond strength, b) Ru1 partial ESP charge, c) O1 partial ESP charge, d) O1 partial natural charge, e) C5 partial Mulliken charge, f) C5 partial NBO charge. Fig. 6 Table 1 The comparison of structural parameters of investigated compounds. Table 1 1 x-ray 9 13 14 15 16 17 18 19 20 21 22 23 24 25 26 27 28 Bond length (Å) Ru1-C2Ru1-C1Ru1-O1 1.8291.9792.256 1.8341.9682.295 1.8311.9662.342 1.8321.9652.333 1.8341.9712.288 1.8331.9672.305 1.8311.9652.318 1.8351.9702.292 1.8331.9652.310 1.8311.9682.336 1.8311.9702.309 1.8341.9722.299 1.8321.9702.374 1.8321.9692.305 1.8341.9702.294 1.8271.9722.355 1.8291.9712.322 1.8261.9712.364 O1-C4O1-C5 1.3701.469 1.3551.407 1.3781.345 1.3801.339 1.3511.446 1.3511.426 1.3681.370 1.3521.427 1.3721.351 1.3521.447 1.3651.382 1.3501.451 1.3551.446 1.3661.375 1.3531.427 1.3481.414 1.3421.433 1.3421.454 Plane angle (degrees) N1-C1-N2C1-Ru1-C2Cl1-Ru1-Cl2 107.2101.4156.3 106.8102.8159.0 107.1103.0159.6 107.1102.9177.9 106.7102.9159.4 106.8102.9160.3 107.1103.4160.6 106.8102.6160.8 107.2103.4160.0 107.0102.3162.1 107.2103.5161.2 106.8102.0161.1 106.6101.1163.6 107.1103.4161.1 106.9103.0161.4 107.0101.2157.4 107.1102.3158.8 107.3101.6160.9 Natural partial charges Ru1 – 0.31 0.31 0.32 0.30 0.30 0.32 0.31 0.31 0.31 0.31 0.32 0.32 0.32 0.32 0.32 0.31 0.31 C1 – 0.49 0.50 0.50 0.49 0.49 0.50 0.49 0.50 0.49 0.49 0.49 0.50 0.49 0.49 0.50 0.50 0.50 O1 – −0.52 −0.49 −0.49 −0.54 −0.52 −0.50 −0.53 −0.49 −0.53 −0.51 −0.53 −0.54 −0.50 −0.52 −0.51 −0.51 −0.52 C2 – 0.00 −0.01 −0.01 0.00 0.01 0.00 0.00 0.00 0.01 0.00 0.01 0.01 0.00 0.00 −0.01 0.00 0.00 C4 – 0.40 0.38 0.38 0.40 0.40 0.38 0.40 0.37 0.40 0.38 0.40 0.40 0.38 0.40 0.42 0.43 0.43 C5 – 0.08 0.31 0.33 0.03 0.10 0.30 0.09 0.33 0.10 0.31 0.08 0.11 0.32 0.05 0.07 0.09 0.10 Faster initiating olefin metathesis catalysts from introducing double bonds into cyclopropyl, cyclobutyl and cyclopentyl derivatives of Hoveyda-Grubbs precatalysts B. Trzaskowski a ⁎ W.A. Goddard b K. Grela c a Centre of New Technologies, University of Warsaw, 02-097 Warszawa, Poland Centre of New Technologies University of Warsaw Warszawa 02-097 Poland b Materials and Process Simulation Center, California Institute of Technology, Pasadena, CA 91125, USA Materials and Process Simulation Center California Institute of Technology Pasadena CA 91125 USA c Faculty of Chemistry, University of Warsaw, 02-089 Warszawa, Poland Faculty of Chemistry University of Warsaw Warszawa 02-089 Poland ⁎ Corresponding author. Graphical abstract We have used the M06-D3 flavor of density functional theory (DFT) to investigate the structures and free energies of initiation for a series of Hoveyda-Grubbs-like complexes in which the isopropoxy part replaced by selected saturated or unsaturated derivatives of cyclopropane, cyclobutane and cyclopentane. We show that the introduction of the double bond into this part of the complex weakens the ruthenium-oxygen bond, creating a series of potential catalysts capable of fast initiation metathesis. The addition to the nitro group in the para position of the benzylidene part of the complex also creates a potentially highly efficient ruthenium catalyst. We demonstrate that the Gibbs free energy of activation correlates with various structural and computational parameters of the precatalyst, including the Ru-O bond strength and partial charges on selected atoms. Keywords DFT Olefin metathesis Ruthenium Hoveyda-Grubbs catalyst Double-bond 1 Introduction The second generation Hoveyda-Grubbs catalyst 1, first synthesized in 2000, was one of the first efficient, phosphine-free ruthenium-based metathesis catalysts and which is still widely used today [1,2]. One of the most important advantages of 1 is the relative ease of introducing structural modifications to various parts of the catalyst to tune its electronic properties and catalytic activity. There three most important classes of such modifications include structural adjustments in the carbene part, the benzylidene part, and the isopropoxy moiety [3–5]. The changes in the isopropoxy part of 1 may have a particularly pronounced effect on the catalytic activity of Hoveyda-Grubbs-like catalysts. Grela showed that a simple substitution of the isopropoxy moiety with a methyl group (2) makes the catalyst much less active than 1 [6]. The same investigation found, however, that the introduction of ethylbenzene (3) or ethyl-para-nitrobenzene (4) improves catalytic activity, although it also reduces the stability of such complexes. The attempt to synthesize the CF3-substituted complex was unsuccessful. In 2009 the same group reported a dimethylpropanoic acid substitution (5), though no catalytic activity was reported [7]. Consorti et al. showed that the isopropoxy moiety can be replaced by ionophilic groups (6) and immobilized in ionic liquids without losing catalytic activity [8]. More recently, Grela and Lavigne synthesized a series of Hoveyda-Grubbs derivatives generated from monofunctionalized styrenyl ethers that exhibit improved catalytic properties (7) [9]. A similar set of complexes that included additional Ru-O interaction has been synthesized in 2014 in Wang group and shown to exhibit relatively fast initiation in ring-closing metathesis [10,11]. Also, a series of 2-aryloxy Hoveyda-Grubbs complexes (8) synthesized in the Plenio group showed excellent stability and fast initiation at low temperatures [12]. Finally, the most recent example of isopropoxy modification is the study by the Grubbs group, which synthesized and characterized four new, efficient Hoveyda-Grubbs derivatives including bulky, saturated groups (9-12) [13] (Fig. 1 ). Based on the seminal work by Plenio, who showed that the precatalyst activation/initiation is the rate-limiting step of the entire catalytic cycle for Hoveyda-Grubbs-like catalysts [14,15] and recent advances in density functional theory with modern functionals accurately describing organometallic systems and subtle van der Waals interactions [16–18], more and more groups have been using computational modelling to study olefin metathesis catalysts [19–24]. The mechanism of the entire catalytic cycle of olefin metathesis for Hoveyda-Grubbs-like catalysts has been described thoroughly in a number of computational studies, which show excellent agreement with experimental data [25–28]. There are three theoretically plausible initiation paths for the Hoveyda-Grubbs-type catalysts: associative, dissociative, and interchange. In the associative path, which in most cases has the highest free enthalpy barrier [29] making it very unlikely, activation of the precatalyst starts with olefin association followed by Ru1-O1 bond dissociation. The dissociative path is opposite starting with Ru1-O1 bond dissociation followed by olefin association. In the third, interchange mechanism both events occur simultaneously. The recent experimental and computational results suggest that the dissociative mechanism is the most favorable option for the case of large and moderate olefins, but for very small olefins the initiation may follow either the dissociative, interchange or both mechanisms in parallel [14,15]. As a result, for most cases of practical importance in organic synthesis one needs only consider the dissociative mechanism as the likely initiation pathway for any new, hypothetical precatalysts, particularly for ruthenium complexes that are structurally similar to 1 and 9. Many computational estimates for the free energy barrier of activating metathesis catalysts, including Hoveyda-Grubbs-like systems, are accurate to within 1–2kcal/mol [30,31]. Such accuracy allows us to predict reliably the initiation rates for this class of catalysts and their overall usefulness in olefin metathesis prior to their synthesis. Due to this high accuracy of the theoretical methods, we can now use the computational results to guide synthetic chemists in preparation of new catalysts most likely to be active or to contributing a better understanding of the structure-activity relationships for this class of compounds. In this work we used such a reliable DFT-based approach to study computationally a set of 16 new derivatives of 9. Prior to starting this investigation, we estimated the free energy barrier (ΔG‡) of initiation of 9 using the M06-D3/LACVP** method to be ΔG‡ =21.7kcal/mol. The experimental estimate for the reaction rate of 9 at 10°C is 0.721±0.004·10−4 s−1, which based on the Eyring equation, leads to 21.9kcal/mol, in perfect agreement with the experiment [13]. The newly designed candidates for catalysts included selected cycloalkane derivatives replacing the cyclopropane moiety of 9, including cyclopropene (13–15), cyclobutane (16), cyclobutene (17–18), cyclobutadiene (19), cyclopentane (20), cyclopentene (21–23) and cyclopentadiene (24–25). Additionally, we performed calculations for three cycloalkane derivatives bearing a nitro group in the para position of the benzylidene moiety, similarly to the very fast Grela nitro catalyst (26–28) [32]. For each complex we predicted its geometric and electronic structure and estimated the free energy barriers for the metathesis initiation step, which we compared with the original Hoveyda-Grubbs catalyst. We also searched for structure-reactivity relationships that could further guide experimental chemists in identifying new, efficient metathesis catalysts for synthesis (Fig. 2 ). 2 Methods 2.1 Computational details Throughout this work we have used a computational protocol similar to our previous computational investigations, shown earlier to be a good choice for studying ruthenium catalysts of olefin metathesis [30,31,33–37]. Starting models of precatalysts were prepared on the basis of the crystal structure of 9 (CCDC refcode: WUJCAH) [13], while the starting structures of all other stationary points were prepared based on our previous calculations and geometries of stationary points for similar systems [30,33]. We have used an all-atom model for all studied catalysts and the cis-2-butene molecule to model the substrate of olefin metathesis. For each stationary point we have confirmed that all vibration frequencies are positive for minima and that only one is imaginary for transition states. For the geometry optimization step we used the 6–31G** basis set for C, N, O, Cl and H atoms, while the Ru atom was described by the Los Alamos angular momentum projected effective core potential (ECP) using the double-ζ contraction of valence functions (denoted as LACVP**) [17]. All calculations used the standard energy convergence criterion of 5×10−5 Hartree. Additionally, for each stationary point we performed solvation calculations using the Poisson-Boltzmann self-consistent polarizable continuum method as implemented in Jaguar v.7.9 (Schrodinger, 2013) to represent dichloromethane, using the dielectric constant of 8.93 and the effective radius 2.33Å. We also performed single-point energy calculations using a triple-ζ basis set, LACV3P++**. Free energies were defined as the sum of electronic energy (from single-point M06-D3/LACV3P++** calculations), solvation energy, zero-point energy correction, thermal correction to enthalpy, and the negative product of temperature and entropy (at 298K). In this study we have used the M06-D3 density functional, which was previously shown to be a good choice for studying ruthenium-based catalysts, giving accurate energies for a number of Grubbs and Hoveyda systems [38,39]. The M06 functional already includes some medium-range dispersion, but the D3 parameter in M06-D3 was chosen to reflect this. Indeed including the D3 correction to M06 was shown to improve the results for many organic reactions when calculating the differences in relative energies [17]. Based on out previous results and benchmarks provided by other groups we can estimate the accuracy of the used method to fall around the 1–2kcal/mol range [17]. 3 Results and discussion 3.1 Structural studies The DFT-optimized geometries of complexes 13-28 are presented in Table 1 and compared to systems 1 and 9. As in our previous studies and investigations by other groups we see very little variability in the vital structural parameters of these systems [13,33,34,37]. There are, however, some differences that have potentially important consequences regarding initiation. The Ru-O distance varies between 2.29 and 2.37Å (2.30Å for 9) suggesting that some complexes have a weaker Ru-O bond, which implies easier Ru-O bond breaking and faster initiation. There is also some variability in the O1-C5 bond length, with values between 1.34Å (for systems with a double bond next to the C5 atom) and 1.45Å (for systems without the neighboring double bond). These values also impact the partial charges on the O1 and C5 atoms. The O1 Mulliken and natural partial charges are almost identical for all systems, but the ESP charges show fluctuations between −0.20 and −0.57 e. On the other hand, C5 partial charges show a range of values for all three methods of estimating charges. There are also non-negligible relationships between these mentioned distances and partial charges, including a negative correlation between the Ru-O distance and C5 ESP charge (R2 =0.27), as well as strong correlations between O1-C5 distance and C5 NBO charge (R2 =0.82), O1 NBO charge (R2 =0.82), C5 Mulliken charge (R2 =0.81) and O1 ESP charge (R2 =0.43), which are mostly obvious from the structural point of view. On the other hand, there is no (R2 =0.00) correlation between the Ru1-C1 and Ru1-O1 bond lengths, which might have been expected due to the known trans effect [33,34,40–42]. These results indicate, however, that there might be some rational relationships between selected structural parameters and free energy of initiation, which we describe in the next section. Hoveyda-Grubbs-like complexes exhibit also cis-trans isomerism, which may have important consequences on their catalytic activity. Goddard and coworkers showed that the trans-chloride isomer of 1 is characterized by much lower free energy barriers than for cis for most steps in the catalytic cycle, including the rate-limiting ones [39]. The trans isomer is favored for most of the commonly used Ru-based metathesis catalysts, though cis isomers also have their uses. A number of similar compounds with a different NHC and other structural modification can adopt such conformation [28,43]. In the case of complexes 13-28 the trans isomer is favored over the cis one for most systems, excluding 13 and 21. For these two cases the free energy difference is, however, very small (−2.38kcal/mol for 13 and −0.15kcal/mol for 21), suggesting that both isomers may co-exist in the solution. The free energy difference between cis and trans isomers is, however, also small for some other studied complexes, ranging from 0.19kcal/mol (for 16) to 5.04kcal/mol (for 23). These values are much lower than for the Hoveyda-Grubbs catalyst 1, where the trans isomer is 8.5kcal/mol lower in energy than cis [37], resulting in almost exclusive presence of the trans isomer in the solution. 3.2 Performance in metathesis initiation The Gibbs free energy barriers for activation of 9 and 13–28 are presented in Fig. 3 . We see that the ΔG‡ values fall within the broad 12.84–23.89kcal/mol range, suggesting that some of these systems can be very fast metathesis initiators, while some are on the level of or slower than the standard Hoveyda-Grubbs catalyst 1. To better characterize the structure-reactivity relationships between the complexes and the impact of the presence of the double-bond, we decided to partition the systems into three groups based on the size of the cyclic moiety. The first group is composed of cyclopropane/cyclopropene derivatives of 1 and consists of five complexes: 9, 13–15 and 26 (Fig. 3). Previously synthesized complex 9 is a relatively slow catalyst, on the level of the Hoveyda-Grubbs catalyst 1 [13]. Our calculations suggest that the introduction of the double bond to the cyclopropane part of the system lowers the Gibbs free energy barrier of activation substantially (21.72–15.82–19.09kcal/mol). According to these results 13 is the fastest catalyst in the non-nitro catalysts with the ΔG‡ value of 15.8kcal/mol, which at 10°C should translate into approximately 50,000 faster activation compared to 9. Complex 14 with the ΔG‡ value of 18.1kcal/mol seems to be also a good candidate for a relatively quickly-initiating catalyst, with estimated initiation rate constant of 0.6×10−1 s−1. On the other hand, complex 15 with the double bond located further from the C5 atom seems to initiate similarly to 9 (ΔG‡ =19.09kcal/mol). Finally, the nitro-substituted complex 26 is characterized by the ΔG‡ value of 15.49kcal/mol, indicating very fast initiation on the level of the 3rd generation Grubbs complex [44,31]. This result is expected, since the introduction of the nitro group to the benzylidene moiety in the para position is known to enhance the initiation rate, although not to this large an extent [32]. Modification of the cyclopropane moiety (9) to a cyclobutane moiety (16) produces a precatalyst with essentially the same initiation ΔG‡ value (21.7kcal/mol versus 22.1kcal/mol). The introduction of the double bond yields similar results as in the previous case (Fig. 4 ). Complexes with the double bond directly next to the C5 atom are characterized by small ΔG‡ values (13.9kcal/mol for 17 and 14.9kcal/mol for 19), while complexes with the double bond located further from the C5 atom yield initiation rates similar to the complex without the double bond (21.0kcal/mol for 18). Interestingly, the addition of the para-nitro group (27) makes the cyclobutane complex more active (ΔG‡ =19.7kcal/mol), but to a smaller extent than in the case of the cyclopropane derivative. Using the well-known Eyring equation we can translate these Gibbs free energy values into estimated initiation rates at 10°C to obtain the following estimates of the reaction rates: 0.5×10−4 s−1 for 16, 1×102 s−1 for 17, 0.7×10−3 s−1 for 18, 2×101 s−1 for 19 and 0.4×10−2 s−1 for 27. Finally, we modified the cyclopropyl part of 9 with cyclopentane, cyclopentene, or cyclopentadiene moieties to obtain complexes 20–25 and 28 (Fig. 5 ). As in the previous examples the substituents with no double bond (20) or with one/two double bonds far from the C5 atom (22, 23, 25) produce complexes with estimated ΔG‡ initiation values of approximately 20kcal/mol, on the level of the standard Hoveyda-Grubbs catalyst 1. On the other hand, complex 21 with the double bond at C5 is the fastest initiating catalyst of this study with the ΔG‡ =12.8kcal/mol, translating to 8×102 s−1. Intriguingly, the addition of the nitro group to the benzylidene part to produce 28 does not alter the ΔG‡ value (the difference between 20 and 28 of 0.4kcal/mol is negligible). This somewhat unexpected result is already pronounced at the precatalyst level. The analysis of the O1 and C5 ESP partial charges for the cyclopropane-substituted series reveals relatively large differences between cyclopropane series (O1: −0.41, C5: −0.03 for 9, O1: −0.31, C5: −0.15 for 26), but much smaller differences in the cyclopentane series (O1: −0.46, C5: 0.17 for 20, O1: −0.41, C5: 0.15 for 28). For the last complex in this series, namely 24, we do not provide Gibbs free energies estimates, since our calculations suggest that this system is unstable. While the calculations for the precatalyst converge and suggest that the expected structure is stable, optimization of the transition state converges to a completely different structure with a bicyclic ring. Such a structure is probably a result of strong interaction between the cylcopentadiene double bond and the Ru center, similar to the case of olefin association to ruthenium ion. Thus we believe that the complex is unstable. A related point to consider here is, however, the stability of all hypothetical complexes investigated in this work. Unfortunately our standard computational approach with implicit solvent not provide an estimate for the kinetic stability of the complexes in solution. A computational study of all possible degradation paths in standard solvents is, not feasible due to the limited knowledge about these processes for Hoveyda-Grubbs-like complexes. To sum it up, we cannot be certain that every complexes studied here is stable (particularly with 3- and 4-membered ring), but the known stability of similar systems forming complexes with transition metals and the experimental stability of 9 indicates that these complexes may be stable [45–47]. On a related note, it is worth noticing that the synthesis of some of the investigated complexes may be a challenging task. Most of Hoveyda-Grubbs-like an Grela-like catalysts are synthesized from the Grubbs 2nd generation catalyst, which itself is a potent metathesis catalysts, via replacement of the PCy3 moiety with a benzylidene precursor. As a result it is likely that some for some the studied systems, particularly 15, 18, 19, 22 and 23, their precursors may undergo a ring-opening metathesis polymerization in the presence of the Grubbs 2nd generation catalyst, before the synthesis of the desired complex takes place. In these cases an alternative synthetic approach starting e.g. from an easy to handle precursor [(p-cymene)RuCl2]2 and without presence of any phosphine ligand could a viable options. We should also mention that some of the Gibbs free energy values for initiation, via Ru1-O1 bond dissociation are so low that initiation is likely not the rate-limiting step of the entire catalytic cycle. The experimental initiation rate for one of the fastest derivative of Hoveyda-Grubbs analogue, the Blechert-Wakamatsu catalyst, is equal to 3.4s−1 at 25°C, giving the ΔG‡ of initiation equal to 16.7kcal/mol [48]. On the other hand the estimated ΔG barriers of selected steps after olefin association in the metathesis catalytic cycle of 1 are between 15 and 17kcal/mol [29]. Since all complexes studied in this work are structurally similar to 1 we should expect that for all complexes in this study with the ΔG‡ values below 16–17kcal/mol, including 13, 17, 19, 21 and 26, the true reaction rate are lower than the initiation rate estimates and in the range of approximately 0.5×10−1 s−1–1.5×101 s−1. The second, important goal of this study was to investigate the possible relationships between selected structural parameters of these precatalysts with the predicted ΔG‡ values to find relationships that could be helpful for future i designs of potent metathesis catalysts. In recent studies Engle et al. found an interesting negative correlation between the initiation rates and the Ru1-O1 bond strengths (defined as the energy difference between the activated catalysts and the precatalyst) for a large series of Hoveyda-Grubbs derivatives [13]. We recently analyzed a series of computationally designed coumarin derivatives of 1 and found a similar correlation [49], although a different series of benzofuran derivatives of 1 did not show such correlation [37]. Due to these findings we decided to examine correlations between all structural and computational parameters listed in Table 1 for all investigated complexes (Fig. 6 ). First, the relationship between the initiation rates and Ru1-O1 bond strengths (as defined in Ref. [13]) is indeed present (R2 =0.68). This is an important result since it allows one to accurately estimate the precatalyst potential for the metathesis reaction by merely calculating the activated catalyst, which is much less time-consuming and complex than optimization of the transition state. For of our set of precatalysts there are also other strong correlations. Most notably, there is a strong negative correlation between the initiation ΔG‡ and the C5 Mulliken partial charge (R2 =0.59) and C5 NBO partial charge (R2 =0.54) as well as the O1 ESP partial charge (R2 =0.43) and O1 NBO partial charge (R2 =0.40). There are also some more surprising correlations, including the one between the initiation ΔG‡ and the C4 Mulliken partial charge (R2 =0.56) as well as the Ru1 ESP partial charge (R2 =0.48). The overall conclusions from this set of correlations is that an electron-rich group attached to the C5 atom modifies the electron density in such manner, that the C5 atom attains a positive partial charge, while the O1 atom becomes less negatively charged. This phenomenon, in turn, makes the Ru1-O1 bond weaker and allow for easier Ru1-O1 bond breaking, leading to faster initiation of the precatalyst. 4 Conclusions Despite the wealth of ruthenium-based metathesis catalysts and Hoveyda-Grubbs-like complexes in particular, there remains a need for new, efficient systems able to catalyze this important reaction. Since the mechanism of the entire catalytic cycle of metathesis is known, computational methods based on modern, very accurate DFT functionals, can be used to design new candidates for catalyst. From the computational point of view, the main difficulty in such studies is the optimization of transition states, which is a necessary step in estimating Gibbs free energies and rate constants. Consequently, it is useful to find indicators that are both easy and fast to calculate while providing a good estimate of the reaction (or at least initiation) rate. In this work we estimated the Gibbs free energies of activation for sixteen new derivatives of Hoveyda-Grubbs catalyst 1 with the isopropyl moiety changed to various saturated and unsaturated cyclopropane, cyclobutane and cyclopentane substituents. We show that the introduction of the double bond to the C5 carbon atom, adjacent to the O1 oxygen atom coordinating the ruthenium center weakens the Ru-O bond, producing fast initiating complexes and candidates for efficient metathesis catalysts. For five new complexes (13, 17, 19, 21, 26) the estimated initiation ΔG‡ is below 16kcal/mol, suggesting a very fast initiation, on the level of 3rd generation, phosphorous-containing Grubbs catalyst. Two other complexes (14, 15) show initiation ΔG‡ values in the 18–19kcal/mol range, implying also fast initiation, on the level of the very efficient Grela nitro catalyst. Systems with the double bond positioned further from the O1 oxygen atom have minor impact on the energetics of the initiation step. We hope that these results will encourage experimental groups to synthesize the most promising complexes to experimentally test their catalytic activities. Additionally, we found several interesting relationships between the obtained Gibbs free energy of initiation values and selected structural and computational parameters of the precatalysts. First, we confirmed a previously known correlation between ΔG‡ values and Ru-O bond strengths, which allows for a relatively fast estimation of initiation free enthalpies through calculating only the energies of precatalysts and activated catalyst. Second, we found several interesting relationships between ΔG‡ values and partial charges on C5 and O1 atoms using different charge partitioning schemes. The ΔG‡-C5 partial charge correlation seems to be particularly useful when considering other structural modifications in the isopropyl part of the Hoveyda-Grubbs catalyst 1, allowing a very fast estimate of the complex potency in metathesis based on a single optimization of the precatalyst only. Acknowledgments This work was supported by the National Centre for Research and Development (grant SImPLeCAT to B.T. and K.G.). The calculations were partially performed at the Interdisciplinary Center for Mathematical and Computational Modelling (University of Warsaw) under G53-9 computational grant and at Caltech with support from NSF CHE 1214158. Appendix A Supplementary data Supplementary data associated with this article can be found, in the online version, at http://dx.doi.org/10.1016/j.mcat.2016.12.018. Appendix A Supplementary data The following is Supplementary data to this article: Geometric parameters, energies, regression plots, partial charges and Cartesian coordinates of all investigated systems. References [1] S. Gessler S. Randl S. Blechert Tetrahedron Lett. 41 2000 9973 9976 [2] S.B. Garber J.S. Kingsbury B.L. Gray A.H. Hoveyda J. Am. Chem. Soc. 122 2000 8168 8179 [3] R.R. Schrock A.H. Hoveyda Angew. Chem. Int. Ed. 42 2003 4592 4633 [4] G.C. Vougioukalakis R.H. Grubbs Chem. Rev. 110 2010 1746 1787 [5] C. Samojłowicz M. Bieniek K. Grela Chem. Rev. 109 2009 3708 3742 [6] M. Barbasiewicz M. Bieniek A. Michrowska A. Szadkowska A. Makal K. Woźniak K. Grela Adv. Synth. Catal. 349 2007 193 203 [7] K. Grela, private communication (CCDC deposition number 759845). [8] C.S. Consorti G.L.P. Aydos G. Ebeling J. Dupont Organometallics 28 2009 4527 4533 [9] M. Bieniek C. Samojłowicz V. Sashuk R. Bujok P. Śledź N. Lugan G. Lavigne D. Arlt K. Grela Organometallics 30 2011 4144 4158 [10] Y. Zhang M. Shao H. Zhang Y. Li D. Liu Y. Cheng G. Liu J. Wang J. Organomet. Chem. 756 2014 1 9 [11] G. Liu M. Shao H. Zhang J. Wang Polyhedron 76 2014 51 54 [12] P. Kos R. Savka H. Plenio Adv. Synth. Catal. 355 2013 439 447 [13] K.M. Engle G. Lu S.-X. Luo L.M. Henling M.K. Takase P. Liu K.N. Houk R.H. Grubbs J. Am. Chem. Soc. 137 2015 5782 5792 [14] V. Thiel M. Hendann K.-J. Wannowius H.J. Plenio J. Am. Chem. Soc. 134 2012 1104 1114 [15] T. Vorfalt K.-J. Wannowius H.J. Plenio Angew. Chem. Int. Ed. 49 2010 5533 5536 [16] Y. Zhao N.E. Schultz D.G. Truhlar J. Chem. Phys. 123 2005 161103 [17] S. Luo Y. Zhao D.G. Truhlar Phys. Chem. Chem. Phys. 13 2011 13683 13689 [18] Y. Zhao D.G. Truhlar Acc. Chem. Res. 41 2008 157 167 [19] L. Cavallo J. Am. Chem. Soc. 124 2002 8965 8973 [20] S.F. Vyboischikov W. Thiel Chem. Eur. J. 11 2005 3921 3935 [21] S. Naumov M.R. Buchmeiser J. Phys. Org. Chem. 21 2008 963 970 [22] X. Solans-Monfort R. Pleixats M. Sodupe Chem. Eur. J. 16 2010 7331 7343 [23] J.W. Nelson L.M. Grundy Y. Dang Z.-X. Wang X. Wang Organometallics 33 2014 4290 4294 [24] P. Śliwa K. Kurleto J. Handzlik S. Rogalski P. Żak B. Wyrzykiewicz C. Pietraszuk Organometallics 35 2016 621 628 [25] Y. Minenkov G. Occhipinti V.R. Jensen Organometallics 32 2013 2099 2111 [26] D.J. Nelson S. Manzini C.A. Urbina-Blanco S.P. Nolan Chem. Commun. 50 2014 10355 10375 [27] I.W. Ashworth I.H. Hillier D.J. Nelson J.M. Percy M.A. Vincent ACS Catal. 3 2013 1929 1939 [28] E. Pump A. Poater M. Zirngast A. Torvisco R. Fischer L. Cavallo C. Slugovc Organometallics 33 2014 2806 2813 [29] I.W. Ashworth I.H. Hillier D.J. Nelson J.M. Percy M.A. Vincent Chem. Commun. 47 2011 5428 5430 [30] K. Żukowska A. Szadkowska B. Trzaskowski A. Pazio Ł. Pączek K. Woźniak K. Grela Organometallics 32 2013 2192 2198 [31] B. Trzaskowski K. Grela Organometallics 32 2013 3625 3630 [32] A. Michrowska R. Bujok S. Harutyunyan V. Sashuk G. Dolgonos K. Grela J. Am. Chem. Soc. 126 2004 9318 9325 [33] A. Pazio K. Woźniak K. Grela B. Trzaskowski Organometallics 34 2015 563 570 [34] A. Pazio K. Woźniak K. Grela B. Trzaskowski Dalton Trans. 44 2015 20021 20026 [35] P. Horeglad M. Cybularczyk B. Trzaskowski G.Z. Żukowska M. Dranka J. Zachara Organometallics 34 2015 3480 3496 [36] B. Trzaskowski K. Grela Catal. Commun. 86 2016 133 138 [37] B. Trzaskowski K. Ostrowska RSC Adv. 6 2016 21423 21429 [38] D. Benitez E. Tkatchouk W.A. Goddard Organometallics 28 2008 2643 2645 [39] D. Benitez E. Tkatchouk W.A. Goddard Chem. Commun. 46 2008 6194 6196 [40] H.-C. Yang Y.-C. Huang Y.-K. Lan T.-Y. Luh Y. Zhao D.G. Truhlar Organometallics 30 2011 4196 4200 [41] S.F. Vyboishchikov M. Buhl W. Thiel Chem. Eur. J. 8 2002 3962 3975 [42] C. Adlhart P. Chen J. Am. Chem. Soc. 126 2004 3496 3510 [43] C.E. Diesendruck E. Tzur A. Ben-Asuly I. Goldberg B.F. Strau N.G. Lemcoff Inorg. Chem. 48 2009 10819 10825 [44] J.A. Love J.P. Morgan T.M. Trnka R.H. Grubbs Angew. Chem. Int. Ed. Engl. 41 2002 4035 4037 [45] C.-W. Chang Y.-C. Lin G.-H. Lee Y. Wang Organometallics 19 2000 3211 3219 [46] R.D. Wilson Y. Kamitori H. Ogoshi Z.-I. Yoshida J.A. Ibers J. Organomet. Chem. 173 1979 199 209 [47] S.R. Caskey M.H. Stewart M.J.A. Johnson J.W. Kampf Angew. Chem. Int. Ed. 45 2006 7422 7424 [48] H. Wakamatsu S. Blechert Angew. Chem. Int. Ed. 41 2002 2403 2405 [49] B. Trzaskowski, K. Grela, Catal. Commun., accepted, doi: 10.1016/j.catcom.2016.12.014.",
      "scopus-id": "85029644423",
      "coredata": {
        "eid": "1-s2.0-S1381116916305799",
        "dc:description": "We have used the M06-D3 flavor of density functional theory (DFT) to investigate the structures and free energies of initiation for a series of Hoveyda-Grubbs-like complexes in which the isopropoxy part replaced by selected saturated or unsaturated derivatives of cyclopropane, cyclobutane and cyclopentane. We show that the introduction of the double bond into this part of the complex weakens the ruthenium-oxygen bond, creating a series of potential catalysts capable of fast initiation metathesis. The addition to the nitro group in the para position of the benzylidene part of the complex also creates a potentially highly efficient ruthenium catalyst. We demonstrate that the Gibbs free energy of activation correlates with various structural and computational parameters of the precatalyst, including the Ru-O bond strength and partial charges on selected atoms.",
        "openArchiveArticle": "false",
        "prism:coverDate": "2017-05-31",
        "openaccessUserLicense": null,
        "prism:aggregationType": "Journal",
        "prism:url": "https://api.elsevier.com/content/article/pii/S1381116916305799",
        "dc:creator": [
          {
            "@_fa": "true",
            "$": "Trzaskowski, B."
          },
          {
            "@_fa": "true",
            "$": "Goddard, W.A."
          },
          {
            "@_fa": "true",
            "$": "Grela, K."
          }
        ],
        "link": [
          {
            "@_fa": "true",
            "@rel": "self",
            "@href": "https://api.elsevier.com/content/article/pii/S1381116916305799"
          },
          {
            "@_fa": "true",
            "@rel": "scidir",
            "@href": "https://www.sciencedirect.com/science/article/pii/S1381116916305799"
          }
        ],
        "dc:format": "application/json",
        "openaccessType": null,
        "pii": "S1381-1169(16)30579-9",
        "prism:volume": "433",
        "prism:publisher": "Elsevier B.V.",
        "dc:title": "Faster initiating olefin metathesis catalysts from introducing double bonds into cyclopropyl, cyclobutyl and cyclopentyl derivatives of Hoveyda-Grubbs precatalysts",
        "prism:copyright": "© 2017 Elsevier B.V. All rights reserved.",
        "openaccess": "0",
        "prism:issn": "24688231",
        "dcterms:subject": [
          {
            "@_fa": "true",
            "$": "DFT"
          },
          {
            "@_fa": "true",
            "$": "Olefin metathesis"
          },
          {
            "@_fa": "true",
            "$": "Ruthenium"
          },
          {
            "@_fa": "true",
            "$": "Hoveyda-Grubbs catalyst"
          },
          {
            "@_fa": "true",
            "$": "Double-bond"
          }
        ],
        "openaccessArticle": "false",
        "prism:publicationName": "Molecular Catalysis",
        "openaccessSponsorType": null,
        "prism:pageRange": "313-320",
        "prism:endingPage": "320",
        "pubType": "fla",
        "prism:coverDisplayDate": "May 2017",
        "prism:doi": "10.1016/j.mcat.2016.12.018",
        "prism:startingPage": "313",
        "dc:identifier": "doi:10.1016/j.mcat.2016.12.018",
        "openaccessSponsorName": null
      },
      "objects": {
        "object": [
          {
            "@category": "thumbnail",
            "@height": "88",
            "@width": "219",
            "@_fa": "true",
            "$": "https://api.elsevier.com/content/object/eid/1-s2.0-S1381116916305799-fx1.sml?httpAccept=%2A%2F%2A",
            "@multimediatype": "GIF image file",
            "@type": "IMAGE-THUMBNAIL",
            "@size": "3761",
            "@ref": "fx1",
            "@mimetype": "image/gif"
          },
          {
            "@category": "thumbnail",
            "@height": "88",
            "@width": "219",
            "@_fa": "true",
            "$": "https://api.elsevier.com/content/object/eid/1-s2.0-S1381116916305799-fx2.sml?httpAccept=%2A%2F%2A",
            "@multimediatype": "GIF image file",
            "@type": "IMAGE-THUMBNAIL",
            "@size": "1963",
            "@ref": "fx2",
            "@mimetype": "image/gif"
          },
          {
            "@category": "thumbnail",
            "@height": "93",
            "@width": "219",
            "@_fa": "true",
            "$": "https://api.elsevier.com/content/object/eid/1-s2.0-S1381116916305799-gr1.sml?httpAccept=%2A%2F%2A",
            "@multimediatype": "GIF image file",
            "@type": "IMAGE-THUMBNAIL",
            "@size": "4306",
            "@ref": "gr1",
            "@mimetype": "image/gif"
          },
          {
            "@category": "thumbnail",
            "@height": "144",
            "@width": "219",
            "@_fa": "true",
            "$": "https://api.elsevier.com/content/object/eid/1-s2.0-S1381116916305799-gr2.sml?httpAccept=%2A%2F%2A",
            "@multimediatype": "GIF image file",
            "@type": "IMAGE-THUMBNAIL",
            "@size": "5964",
            "@ref": "gr2",
            "@mimetype": "image/gif"
          },
          {
            "@category": "thumbnail",
            "@height": "134",
            "@width": "219",
            "@_fa": "true",
            "$": "https://api.elsevier.com/content/object/eid/1-s2.0-S1381116916305799-gr3.sml?httpAccept=%2A%2F%2A",
            "@multimediatype": "GIF image file",
            "@type": "IMAGE-THUMBNAIL",
            "@size": "5752",
            "@ref": "gr3",
            "@mimetype": "image/gif"
          },
          {
            "@category": "thumbnail",
            "@height": "138",
            "@width": "219",
            "@_fa": "true",
            "$": "https://api.elsevier.com/content/object/eid/1-s2.0-S1381116916305799-gr4.sml?httpAccept=%2A%2F%2A",
            "@multimediatype": "GIF image file",
            "@type": "IMAGE-THUMBNAIL",
            "@size": "5605",
            "@ref": "gr4",
            "@mimetype": "image/gif"
          },
          {
            "@category": "thumbnail",
            "@height": "150",
            "@width": "219",
            "@_fa": "true",
            "$": "https://api.elsevier.com/content/object/eid/1-s2.0-S1381116916305799-gr5.sml?httpAccept=%2A%2F%2A",
            "@multimediatype": "GIF image file",
            "@type": "IMAGE-THUMBNAIL",
            "@size": "5864",
            "@ref": "gr5",
            "@mimetype": "image/gif"
          },
          {
            "@category": "thumbnail",
            "@height": "164",
            "@width": "181",
            "@_fa": "true",
            "$": "https://api.elsevier.com/content/object/eid/1-s2.0-S1381116916305799-gr6.sml?httpAccept=%2A%2F%2A",
            "@multimediatype": "GIF image file",
            "@type": "IMAGE-THUMBNAIL",
            "@size": "5731",
            "@ref": "gr6",
            "@mimetype": "image/gif"
          },
          {
            "@category": "standard",
            "@height": "200",
            "@width": "500",
            "@_fa": "true",
            "$": "https://api.elsevier.com/content/object/eid/1-s2.0-S1381116916305799-fx1.jpg?httpAccept=%2A%2F%2A",
            "@multimediatype": "JPEG image file",
            "@type": "IMAGE-DOWNSAMPLED",
            "@size": "17290",
            "@ref": "fx1",
            "@mimetype": "image/jpeg"
          },
          {
            "@category": "standard",
            "@height": "200",
            "@width": "500",
            "@_fa": "true",
            "$": "https://api.elsevier.com/content/object/eid/1-s2.0-S1381116916305799-fx2.jpg?httpAccept=%2A%2F%2A",
            "@multimediatype": "JPEG image file",
            "@type": "IMAGE-DOWNSAMPLED",
            "@size": "7108",
            "@ref": "fx2",
            "@mimetype": "image/jpeg"
          },
          {
            "@category": "standard",
            "@height": "319",
            "@width": "753",
            "@_fa": "true",
            "$": "https://api.elsevier.com/content/object/eid/1-s2.0-S1381116916305799-gr1.jpg?httpAccept=%2A%2F%2A",
            "@multimediatype": "JPEG image file",
            "@type": "IMAGE-DOWNSAMPLED",
            "@size": "39408",
            "@ref": "gr1",
            "@mimetype": "image/jpeg"
          },
          {
            "@category": "standard",
            "@height": "496",
            "@width": "753",
            "@_fa": "true",
            "$": "https://api.elsevier.com/content/object/eid/1-s2.0-S1381116916305799-gr2.jpg?httpAccept=%2A%2F%2A",
            "@multimediatype": "JPEG image file",
            "@type": "IMAGE-DOWNSAMPLED",
            "@size": "59544",
            "@ref": "gr2",
            "@mimetype": "image/jpeg"
          },
          {
            "@category": "standard",
            "@height": "347",
            "@width": "565",
            "@_fa": "true",
            "$": "https://api.elsevier.com/content/object/eid/1-s2.0-S1381116916305799-gr3.jpg?httpAccept=%2A%2F%2A",
            "@multimediatype": "JPEG image file",
            "@type": "IMAGE-DOWNSAMPLED",
            "@size": "34667",
            "@ref": "gr3",
            "@mimetype": "image/jpeg"
          },
          {
            "@category": "standard",
            "@height": "356",
            "@width": "565",
            "@_fa": "true",
            "$": "https://api.elsevier.com/content/object/eid/1-s2.0-S1381116916305799-gr4.jpg?httpAccept=%2A%2F%2A",
            "@multimediatype": "JPEG image file",
            "@type": "IMAGE-DOWNSAMPLED",
            "@size": "34232",
            "@ref": "gr4",
            "@mimetype": "image/jpeg"
          },
          {
            "@category": "standard",
            "@height": "388",
            "@width": "565",
            "@_fa": "true",
            "$": "https://api.elsevier.com/content/object/eid/1-s2.0-S1381116916305799-gr5.jpg?httpAccept=%2A%2F%2A",
            "@multimediatype": "JPEG image file",
            "@type": "IMAGE-DOWNSAMPLED",
            "@size": "34858",
            "@ref": "gr5",
            "@mimetype": "image/jpeg"
          },
          {
            "@category": "standard",
            "@height": "681",
            "@width": "753",
            "@_fa": "true",
            "$": "https://api.elsevier.com/content/object/eid/1-s2.0-S1381116916305799-gr6.jpg?httpAccept=%2A%2F%2A",
            "@multimediatype": "JPEG image file",
            "@type": "IMAGE-DOWNSAMPLED",
            "@size": "74296",
            "@ref": "gr6",
            "@mimetype": "image/jpeg"
          },
          {
            "@category": "standard",
            "@_fa": "true",
            "$": "https://api.elsevier.com/content/object/eid/1-s2.0-S1381116916305799-mmc1.docx?httpAccept=%2A%2F%2A",
            "@multimediatype": "Microsoft Word file",
            "@type": "APPLICATION",
            "@size": "347519",
            "@ref": "mmc1",
            "@mimetype": "application/word"
          }
        ]
      },
      "link": {
        "@rel": "abstract",
        "@href": "https://api.elsevier.com/content/abstract/scopus_id/85029644423"
      }
    }
  }
}