{
  "metadata": {
    "title": "Effect of preparation protocol on the surface acidity of molybdenum catalysts supported on titania and zirconia",
    "authors": "; ; ",
    "journal": "Journal of Molecular Catalysis A: Chemical",
    "date": "2016-12-15",
    "doi": "10.1016/j.molcata.2016.10.006",
    "abstract": "",
    "uri": "https://api.elsevier.com/content/article/pii/S1381116916304277",
    "pii": "S1381116916304277"
  },
  "fulltext": {
    "full-text-retrieval-response": {
      "scopus-eid": "2-s2.0-84990210492",
      "originalText": "serial JL 271358 291210 291744 291790 291809 31 Journal of Molecular Catalysis A: Chemical JOURNALMOLECULARCATALYSISACHEMICAL 2016-10-04 2016-10-04 2016-10-08 2016-10-08 2019-10-28T13:34:12 1-s2.0-S1381116916304277 S1381-1169(16)30427-7 S1381116916304277 10.1016/j.molcata.2016.10.006 S300 S300.2 FULL-TEXT 1-s2.0-S1381116916X00118 2019-10-30T00:38:56.048209Z 0 0 20161215 2016 2016-10-05T00:18:37.902924Z absattachment articleinfo articletitlenorm authfirstinitialnorm authfirstsurnamenorm cid cids contenttype copyright crossmark dateloaded dateloadedtxt datesearch datesort dateupdated dco docsubtype doctype doi eid ewtransactionid hubeid indexeddate issn issnnorm itemstage itemtransactionid itemweight openaccess openarchive pg pgfirst pglast pii piinorm pubdatestart pubdatetxt pubyr sectiontitle sortorder srctitle srctitlenorm srctype ssids alllist content subj subheadings suppl tomb volfirst volissue volumelist webpdf webpdfpagecount yearnav figure table e-component body affil appendices articletitle auth authfirstini authfull authkeywords authlast highlightsabst orcid primabst ref specialabst 1381-1169 13811169 true 425 425 C Volume 425 20 157 165 157 165 20161215 15 December 2016 2016-12-15 2016 Regular Papers article fla © 2016 Elsevier B.V. All rights reserved. EFFECTPREPARATIONPROTOCOLSURFACEACIDITYMOLYBDENUMCATALYSTSSUPPORTEDTITANIAZIRCONIA LAMINE N 1 Introduction 2 Experimental 2.1 Catalyst preparation 2.1.1 Support preparation 2.1.2 Catalyst preparation 2.2 Catalyst characterization 2.3 Catalytic test 3 Results and discussion 3.1 X-Ray diffraction 3.1.1 Mo-Zr catalysts 3.1.2 Mo-Ti catalysts 3.2 Surface area measurements and elementary analysis 3.3 Laser Raman spectroscopy analysis 3.3.1 The solids Mo-Zr calcined at 450°C 3.3.2 The solids Mo-Zr calcined at 700°C 3.3.3 The solids Mo-Ti 3.4 Isopropanol decomposition tests 4 Conclusion Funding Appendix A Supplementary data References RAMIREZ 2004 19 30 J BREYSSE 1991 489 505 M AFANASIEV 1999 147 160 P SCHROCK 2007 55 77 R HOVEYDA 2007 243 251 A GRASSELLI 2003 5 22 R GUERREROPEREZ 2004 93 99 M CAVANI 1995 307 313 F CHRISTODOULAKIS 2006 16 25 A DAMYANOVA 2002 271 284 S BRUNET 2005 143 172 S KLOSE 2005 68 80 B VU 2005 453 467 T PENA 2004 9927 9936 D HADJIIVANOV 1996 61 69 K TAUSTER 1978 170 175 S TAUSTER 1978 29 35 S BADOGA 2014 30 38 S CHARY 2004 283 291 K CIAMBELLI 2005 143 149 P BREYSSE 2003 5 16 M LOUIS 1988 354 366 C BANARES 1993 406 417 M MAITY 2001 115 119 S RAMIREZ 1989 211 223 J DESIKAN 1992 3357 3365 A PAYEN 1991 521 539 E WANG 1999 239 252 J VALARIVAN 1994 429 440 R ARAMENDIA 1999 115 125 M ARATA 1975 3377 3378 K PINES 1948 533 537 H ZHANG 1999 1293 1300 Q JUNG 2000 27 42 K ROSSMEDGAARDEN 2008 108 125 E CHEN 2000 421 430 K CALAFAT 2000 215 223 A SRINIVASAN 1995 725 730 R ZHAO 1997 237 244 B REDDY 2005 71 78 B TSILOMELEKIS 2007 139 147 G HALKIDES 2003 415 426 T LIU 1998 314 324 Z MESTL 1998 451 570 G XIE 2000 10059 10068 S DUFRESNE 1981 2344 2351 P ONO 1987 1761 1770 T HU 1995 10897 10910 H KIM 1992 539 553 D ZHAO 1996 167 174 B TSILOMELEKIS 2013 1869 1888 G GERVASINI 1991 190 198 A MCKENZIE 1992 547 561 A DAUTZENBERG 1974 142 144 D CHAABENE 2003 411 419 S BERTEAU 1985 859 868 P MARTIN 2003 365 376 C MORTERRA 1980 2102 2113 C BALLINGER 1991 3041 3045 T TUREK 2012 102 110 W HADJIIVANOV 2001 129 133 K BAERTSCH 2002 44 57 C SAMARANCH 2006 1581 1586 B LAMINEX2016X157 LAMINEX2016X157X165 LAMINEX2016X157XN LAMINEX2016X157X165XN 2018-10-08T00:00:00.000Z http://creativecommons.org/licenses/by-nc-nd/4.0/ © 2016 Elsevier B.V. All rights reserved. 2019-03-15T08:49:52.651Z http://vtw.elsevier.com/data/voc/AddOnTypes/50.7/nlp S1381116916304277 USTHB Algerian Ministry of Higher Education and Scientific Research Ministry of Higher Education and Scientific Research http://data.elsevier.com/vocabulary/SciValFunders/100010450 http://sws.geonames.org/2215636/ MESRS MESRS Ministère de l'Enseignement Supérieur et de la Recherche Scientifique http://data.elsevier.com/vocabulary/SciValFunders/501100002717 http://sws.geonames.org/2589581/ This work was supported by the Algerian Ministry of Higher Education and Scientific Research “MESRS” and USTHB Chemistry Faculty (PhD scholarship and Travel Grant for N. Lamine). Appendix A item S1381-1169(16)30427-7 S1381116916304277 1-s2.0-S1381116916304277 10.1016/j.molcata.2016.10.006 271358 2019-10-30T00:38:56.048209Z 2016-12-15 1-s2.0-S1381116916304277-main.pdf https://s3.amazonaws.com/prod-ucs-content-store-us-east/content/pii:S1381116916304277/MAIN/application/pdf/c000a51cdacfbae23c0227fd30e11c03/main.pdf main.pdf pdf true 1076953 MAIN 9 1-s2.0-S1381116916304277-main_1.png https://s3.amazonaws.com/prod-ucs-content-store-us-east/content/pii:S1381116916304277/PREVIEW/image/png/9de650c97ebca5cd8e97e00e98d0b4e5/main_1.png main_1.png png 56107 849 656 IMAGE-WEB-PDF 1 1-s2.0-S1381116916304277-fx1.sml https://s3.amazonaws.com/prod-ucs-content-store-us-east/content/pii:S1381116916304277/fx1/THUMBNAIL/image/gif/587e095f9f5d4eaa1aee298b9fe06789/fx1.sml fx1 true fx1.sml sml 5009 88 219 IMAGE-THUMBNAIL 1-s2.0-S1381116916304277-gr1.sml https://s3.amazonaws.com/prod-ucs-content-store-us-east/content/pii:S1381116916304277/gr1/THUMBNAIL/image/gif/6b679841e89753721d9acab631f0455e/gr1.sml gr1 gr1.sml sml 8169 164 175 IMAGE-THUMBNAIL 1-s2.0-S1381116916304277-gr2.sml https://s3.amazonaws.com/prod-ucs-content-store-us-east/content/pii:S1381116916304277/gr2/THUMBNAIL/image/gif/367e816eff09ddfd746807c141aa1237/gr2.sml gr2 gr2.sml sml 4014 164 90 IMAGE-THUMBNAIL 1-s2.0-S1381116916304277-gr3.sml https://s3.amazonaws.com/prod-ucs-content-store-us-east/content/pii:S1381116916304277/gr3/THUMBNAIL/image/gif/9ec01cd545a0eb71b22243175c3aa000/gr3.sml gr3 gr3.sml sml 7938 164 198 IMAGE-THUMBNAIL 1-s2.0-S1381116916304277-gr4.sml https://s3.amazonaws.com/prod-ucs-content-store-us-east/content/pii:S1381116916304277/gr4/THUMBNAIL/image/gif/08d1119b256599ec97fe490eadb99c54/gr4.sml gr4 gr4.sml sml 6290 164 179 IMAGE-THUMBNAIL 1-s2.0-S1381116916304277-gr5.sml https://s3.amazonaws.com/prod-ucs-content-store-us-east/content/pii:S1381116916304277/gr5/THUMBNAIL/image/gif/96634686e49a2ff68587a7d7caab54cb/gr5.sml gr5 gr5.sml sml 4900 119 219 IMAGE-THUMBNAIL 1-s2.0-S1381116916304277-gr6.sml https://s3.amazonaws.com/prod-ucs-content-store-us-east/content/pii:S1381116916304277/gr6/THUMBNAIL/image/gif/55e0c3126e2c7510a7dfd1f0eabf275b/gr6.sml gr6 gr6.sml sml 6667 102 219 IMAGE-THUMBNAIL 1-s2.0-S1381116916304277-fx1.jpg https://s3.amazonaws.com/prod-ucs-content-store-us-east/content/pii:S1381116916304277/fx1/DOWNSAMPLED/image/jpeg/9719baab621aa9455d1d6162c2c1339e/fx1.jpg fx1 true fx1.jpg jpg 20420 200 500 IMAGE-DOWNSAMPLED 1-s2.0-S1381116916304277-gr1.jpg https://s3.amazonaws.com/prod-ucs-content-store-us-east/content/pii:S1381116916304277/gr1/DOWNSAMPLED/image/jpeg/de4e5bda52c148e008ab6302b745bf47/gr1.jpg gr1 gr1.jpg jpg 70001 530 565 IMAGE-DOWNSAMPLED 1-s2.0-S1381116916304277-gr2.jpg https://s3.amazonaws.com/prod-ucs-content-store-us-east/content/pii:S1381116916304277/gr2/DOWNSAMPLED/image/jpeg/77dfbbc0916feea2e790e4d949be0915/gr2.jpg gr2 gr2.jpg jpg 30974 548 301 IMAGE-DOWNSAMPLED 1-s2.0-S1381116916304277-gr3.jpg https://s3.amazonaws.com/prod-ucs-content-store-us-east/content/pii:S1381116916304277/gr3/DOWNSAMPLED/image/jpeg/09be1400dffe22c47bc61adc16695802/gr3.jpg gr3 gr3.jpg jpg 56795 468 565 IMAGE-DOWNSAMPLED 1-s2.0-S1381116916304277-gr4.jpg https://s3.amazonaws.com/prod-ucs-content-store-us-east/content/pii:S1381116916304277/gr4/DOWNSAMPLED/image/jpeg/cdbd45e387e4a36be478a560ebe47491/gr4.jpg gr4 gr4.jpg jpg 24090 310 339 IMAGE-DOWNSAMPLED 1-s2.0-S1381116916304277-gr5.jpg https://s3.amazonaws.com/prod-ucs-content-store-us-east/content/pii:S1381116916304277/gr5/DOWNSAMPLED/image/jpeg/90911eb6cba71d4950bfd2b91604e662/gr5.jpg gr5 gr5.jpg jpg 17290 204 376 IMAGE-DOWNSAMPLED 1-s2.0-S1381116916304277-gr6.jpg https://s3.amazonaws.com/prod-ucs-content-store-us-east/content/pii:S1381116916304277/gr6/DOWNSAMPLED/image/jpeg/3aa59dc6dbeb561bdfd65205caa7f8d9/gr6.jpg gr6 gr6.jpg jpg 34156 262 565 IMAGE-DOWNSAMPLED 1-s2.0-S1381116916304277-fx1_lrg.jpg https://s3.amazonaws.com/prod-ucs-content-store-us-east/content/pii:S1381116916304277/fx1/HIGHRES/image/jpeg/ff275657a45320f5a8244062fecb4e7d/fx1_lrg.jpg fx1 true fx1_lrg.jpg jpg 154525 886 2213 IMAGE-HIGH-RES 1-s2.0-S1381116916304277-gr1_lrg.jpg https://s3.amazonaws.com/prod-ucs-content-store-us-east/content/pii:S1381116916304277/gr1/HIGHRES/image/jpeg/617d4d4eab18efb89f2027446e9f5f7c/gr1_lrg.jpg gr1 gr1_lrg.jpg jpg 543504 2345 2500 IMAGE-HIGH-RES 1-s2.0-S1381116916304277-gr2_lrg.jpg https://s3.amazonaws.com/prod-ucs-content-store-us-east/content/pii:S1381116916304277/gr2/HIGHRES/image/jpeg/39205520c20a901f64a8dfc651f27e62/gr2_lrg.jpg gr2 gr2_lrg.jpg jpg 255072 2425 1333 IMAGE-HIGH-RES 1-s2.0-S1381116916304277-gr3_lrg.jpg https://s3.amazonaws.com/prod-ucs-content-store-us-east/content/pii:S1381116916304277/gr3/HIGHRES/image/jpeg/b3a0a3600672800d10203d8290bfb3d0/gr3_lrg.jpg gr3 gr3_lrg.jpg jpg 440627 2071 2500 IMAGE-HIGH-RES 1-s2.0-S1381116916304277-gr4_lrg.jpg https://s3.amazonaws.com/prod-ucs-content-store-us-east/content/pii:S1381116916304277/gr4/HIGHRES/image/jpeg/d1d9a652d6c80e44e7fae4f214048c5c/gr4_lrg.jpg gr4 gr4_lrg.jpg jpg 188310 1375 1502 IMAGE-HIGH-RES 1-s2.0-S1381116916304277-gr5_lrg.jpg https://s3.amazonaws.com/prod-ucs-content-store-us-east/content/pii:S1381116916304277/gr5/HIGHRES/image/jpeg/ad70fe71b6be64f14950c81bb3483f51/gr5_lrg.jpg gr5 gr5_lrg.jpg jpg 113500 903 1667 IMAGE-HIGH-RES 1-s2.0-S1381116916304277-gr6_lrg.jpg https://s3.amazonaws.com/prod-ucs-content-store-us-east/content/pii:S1381116916304277/gr6/HIGHRES/image/jpeg/f7fd6f74875a11c7baaa44fd7e59683f/gr6_lrg.jpg gr6 gr6_lrg.jpg jpg 241098 1160 2500 IMAGE-HIGH-RES 1-s2.0-S1381116916304277-mmc1.docx https://s3.amazonaws.com/prod-ucs-content-store-us-east/content/pii:S1381116916304277/mmc1/MAIN/application/vnd.openxmlformats-officedocument.wordprocessingml.document/8b4a48de9b1200d648ec48a180cef442/mmc1.docx mmc1 mmc1.docx docx 158923 APPLICATION MOLCAA 10068 S1381-1169(16)30427-7 10.1016/j.molcata.2016.10.006 Elsevier B.V. Fig. 1 X-Ray diffraction patterns of pure ZrO2 and Mo-Zr samples calcined at (a) 450°C and (b) 700°C. Fig. 1 Fig. 2 X-Ray diffraction patterns for pure TiO2 and Mo-Ti solids calcined at 450°C. Fig. 2 Fig. 3 Raman spectra of zirconia supported molybdenum catalysts calcined at (a) 450°C and (b) 700°C. Fig. 3 Fig. 4 Raman spectra of Mo-Ti solids calcined at 450°C. Fig. 4 Fig. 5 Propene yield as a function of surface molybdenum density. Fig. 5 Fig. 6 Propene yield as a function of molybdenum density; (a): hydroxide impregnation protocol; (b): oxide impregnation protocol. Fig. 6 Table 1 Physicochemical characteristics of zirconia, titania supports and of molybdenum supported solids. Table 1 Solids Calcination temperature %Mo a t-ZrO2 (vol.%) BET area (m2/g) surface Density b (Mo at/nm2) Mo-Zr catalysts ZrO2-450 450 – 41 71 5-MoZrOH-450 450 4.1 97 99 2.6 10-MoZrOH-450 450 7.9 100 111 4.5 15-MoZrOH-450 450 12.5 100 67 11.8 5-MoZrO2-450 450 3.9 30 80 3.0 10-MoZrO2-450 450 8.3 73 90 5.8 ZrO2-700 700 – 11 25 – 5-Mo-ZrOH-700 700 4.1 100 49 5.2 10-MoZrOH-700 700 9.2 96 98 5.9 15-MoZrOH-700 700 10.2 94 37 17.2 5-MoZrO2-700 700 4.1 60 47 5.4 10-MoZrO2-700 700 8.1 47 53 9.6 Mo-Ti catalysts TiO2-450 450 – 64 – 5-MoTiOH-450 450 5.0 93 3.3 10-MoTiOH-450 450 7 115 3.8 15-MoTiOH-450 450 11.8 93 7.9 5-MoTiO2-450 450 5.1 37 8.7 10-MoTiO2-450 450 7.7 73 6.6 a Determined from X-Ray Fluorescence analysis. b Calculated from the XRF molybdenum content value. Table 2 Conversion and selectivities in the isopropanol decomposition reaction. Table 2 Solid Surface Density (Mo-at/nm2) Conversion (%) Propene selectivity (%) Ether selectivity (%) Acetone selectivity (%) ZrO2-450 – Inactive – – – ZrO2-700 – Inactive – – – 5-MoZrOH-450 2.6 Inactive – – – 5-MoZrOH-700 5.2 17.1 65.8 32.9 1.3 10-MoZrOH-450 4.5 19.2 63.1 20.8 11 10-MoZrOH-700 5.9 59.6 96.6 2.8 0.6 15-MoZrOH-450 11.8 40.7 93.8 3.7 2.5 15-MoZrOH-700 17.2 39.1 100 0 0 5-MoZrO2-450 3.04 9.5 53.1 15.5 31.4 5-MoZrO2-700 5.4 26.6 83 10.8 6.2 10-MoZrO2-450 5.8 37.8 85.2 10.1 4.7 10-MoZrO2-700 9.6 17.3 85.2 10.7 4.1 TiO2-450 – Inactive – – – 5-MoTiOH-450 3.3 1.4 58.2 27.9 10.4 10-MoTiOH-450 3.8 11.8 74.9 20.2 2.7 15-MoTiOH-450 7.9 56.1 95 2.2 2.8 5-MoTiO2-450 8.7 21.3 75.1 16 9 10-MoTiO2-450 6.6 74.8 98.4 0.9 0.7 Table 3 Propene and diisopropylether yields for solids with close molybdenum densities and prepared via different protocols. Table 3 Iso-density(Mo-At/nm2) ∼6 ∼8 ∼10 Density value(Mo-At/nm2) 5.75 5.89 7.86 7.9 9.56 11.76 Solid 10MoZrO2-450 10MoZrOH-700 5MoTiO2-450 15MoTiOH-450 10MoZrO2-700 15MoZrOH-450 Propene yield (%) 32.2 57.6 16 53.3 14.7 38.2 Diisopropylether yield (%) 3.8 1.7 3.4 1.2 1.9 1.5 Effect of preparation protocol on the surface acidity of molybdenum catalysts supported on titania and zirconia Nacéra Lamine a Amel Benadda a ⁎ Amar Djadoun b Akila Barama a Juliette Blanchard c a Laboratoire des Matériaux Catalytiques et Catalyse en Chimie Organique, Faculté de Chimie, USTHB, BP32, El Alia, Bab Ezzouar 16111 Algiers, Algeria Laboratoire des Matériaux Catalytiques et Catalyse en Chimie Organique Faculté de Chimie USTHB BP32, El Alia Bab Ezzouar Algiers 16111 Algeria b Laboratoire de Géophysique, FSTGAT, USTHB, BP 32, El Alia, Bab Ezzouar 16111 Algiers, Algeria Laboratoire de Géophysique FSTGAT USTHB BP 32 El Alia Bab Ezzouar Algiers 16111 Algeria c Sorbonne Universités, UPMC Univ Paris 6, UMR CNRS 7197, Laboratoire de Réactivité de Surface, F75005 Paris, France Sorbonne Universités UPMC Univ Paris 6 UMR CNRS 7197 Laboratoire de Réactivité de Surface Paris F75005 France ⁎ Corresponding author. Graphical abstract Molybdenum catalysts supported on titania and zirconia have been prepared via the impregnation on the corresponding hydroxides and oxides. The solids have been characterized by surface area measurements, XR-Fluorescence analysis, XRD and Raman Spectroscopy. The isopropanol decomposition reaction has been used to probe their acidic properties. These analyses revealed that introduction of molybdenum on the surfaces of the hydroxides and the oxides results in an increase of the specific surface area. Impregnation on the hydroxide leads to a comparatively better molybdenum dispersion and to a greater surface acidity. This indicates that the acid sites on hydroxide derived solids are stronger and more numerous than on their oxide derived counterpart. Keywords Molybdena Zirconium hydroxide Titanium hydroxide Impregnation Isopropanol decomposition 1 Introduction Molybdenum is an element that has been widely studied as catalyst component; it has been shown that, due to the electronic and structural properties of molybdenum oxides, they can be used as the main active phase or as an additive for many catalytic systems [1–3]. Indeed, molybdenum based catalysts are used in numerous industrial processes such as: olefins and alkynes metathesis, ammoxidation and oxidative dehydrogenation of light alkanes and hydrodesulphurization [4–11]. Molybdenum oxide is generally supported on metal oxides such as SiO2, Al2O3, ZrO2, SnO2, MgO, CaO and TiO2 in order to prevent its sintering. In these supported catalysts, the molybdenum constitutes the active phase and is dispersed on an oxide with a higher surface area. Molybdenum oxide-support interactions affect the structure and electronic properties of the active phase and influence therefore the catalytic performances of the solids. These interactions depend on the nature of the support, the active phase loading and the thermal treatment. Titania and zirconia have been the object of great interest in the field of heterogeneous catalysis [12–17]. Both oxides are n-type semi-conductors and zirconia presents specific characteristics such as high thermal stability, extreme hardness, stability under reducing conditions and both acid and base functions whereas titania is well known to present SMSI properties as reported in early studies carried on Pt/TiO2 and Ir/TiO2 catalysts [16,17]. Among supported molybdenum oxide, Mo/TiO2 and Mo/ZrO2 have been extensively studied [1,2,18–21]. Molybdenum sulfide supported on TiO2 and ZrO2 showed improved performances as hydrotreating catalysts thanks to higher dispersion and reducibility of molybdenum oxide phase when supported on titania and zirconia than on alumina and silica [2,21–25]. In fact, the molybdenum species-support interactions depend on the acid-base properties of the support: the more basic the support, the stronger the interaction [26] and both TiO2 and ZrO2 are less acidic than Al2O3. Moreover, Payen et al. have shown that the critical dispersion capacity for molybdenum oxo-species is higher on zirconia than on alumina [27]. Isopropanol decomposition has been widely used, among other test reactions, to probe acid-base properties of solid materials. It presents the advantage that dehydration; dehydrogenation and condensation reactions can occur simultaneously [28]. The analysis of the products distribution gives information about strength and density of catalysts’ acid-base sites [29–31]. The purpose of the present work is to investigate the effect of the preparation method on the surface acidity of zirconia and titania supported molybdenum catalysts by means of the isopropanol decomposition test reaction. 2 Experimental 2.1 Catalyst preparation The solids Mo/ZrO2 and Mo/TiO2 were prepared by the classic Ippatieff impregnation method [32] starting from zirconium/titanium hydroxides and oxides. 2.1.1 Support preparation First, the oxyhydroxides ZrOx(OH)4-2x and TiOx(OH)4-2x were prepared starting from ZrO(NO3)2 (Alfa Aesar 99.9%) and TiCl4 (Merck 99%) respectively. A 3M solution of TiCl4 (pH=0.5) was prepared by adding pure TiCl4 slowly to distilled water placed in an ice-water bath because the dissolution is very exothermic and may be explosive [33]. Ammonia solution (6N) was then added to the previous solution under stirring until the pH reached 9–10. For zirconium oxyhydroxide preparation, ammonia solution was added dropwise to a 0.5M ZrO(NO3)2 solution (initial pH=2) until the pH reached 9.5. The resulting gels were aged for 24h then filtered and washed thoroughly with distilled water until the filtrate reached a neutral pH. The powders were lastly dried at 100°C overnight. 2.1.2 Catalyst preparation For the first series of catalysts, Zr(OH)4 and Ti(OH)4 were dry impregnated with an aqueous solution of ammonium heptamolybdate (AHM) (NH4)6Mo7O24,4H2O, provider: Strem Chemicals) whose concentration was adjusted in order to obtain different molybdenum loadings. The samples were dried at 100°C overnight and further calcined in air for 4h at 450 and 700°C for the Mo/ZrO2 catalysts and at 450°C only for the Mo/TiO2 systems. The solids of this series were labelled x-MoMOH-T where x represents the molybdenum loading, M the support cation symbol and T the calcination temperature. For the second batch of catalysts, Zr(OH)4 and Ti(OH)4 were first calcined at 450°C for 4h before being used as supports. The obtained oxides were impregnated following the procedure used for the first series. The solids of this series are noted x-MoMO2-T where x represents the molybdenum loading, M the support cation symbol and T the calcination temperature. 2.2 Catalyst characterization All samples were characterized using the following physico-chemical methods: Surface area measurements : Specific surface areas of samples (after outgassing during 1h at 523K under vacuum) were determined by nitrogen adsorption at 77K on a Micromeritics ASAP 2060 system. Powder X-ray diffraction (XRD) : X-ray diffraction patterns were collected with a Philips diffractometer (type PW 1710) using CuKα radiation (λ=1,5418Å). X-ray fluorescence analysis (XRF) : the molybdenum content was determined by X-ray fluorescence analyses conducted under He flow with an energy dispersive spectrometer (XEPOS with Turboquant powder software) equipped with a 50-W end-window X-ray tube to excite the samples. Laser Raman spectroscopy : The Raman spectra were obtained using a BRUKER RAM II Raman spectrometer equipped with a Ge detector and using the 1064nm excitation line of Nd-YAG laser. The data were collected by keeping the power at 30mW and by recording 2000 scans per spectrum with a spectral resolution of 4cm−1. 2.3 Catalytic test The isopropanol decomposition reaction was carried at 393K in a fixed-bed continuous flow reactor under atmospheric pressure (see Supplementary information file) and in the absence of oxygen. Prior to catalytic tests, 0.05g of the solid was heated under flowing nitrogen at 250°C for 1h. The isopropanol was fed by flowing nitrogen (40mLmin−1) through a saturator kept at 0°C to produce a pressure of 9mmHg. The reaction was followed using on-line gas chromatography. Conversion and selectivities were calculated at steady state which was typically reached after less than 1h of reaction. 3 Results and discussion 3.1 X-Ray diffraction 3.1.1 Mo-Zr catalysts Fig. 1 depicts the XRD diffractograms of the solids supported on zirconia. Calcination of zirconium hydroxide at 450 and 700°C results in a mixture of monoclinic (m-ZrO2) and tetragonal (t-ZrO2), with a predominance of the monoclinic phase especially at 700°C (see Table 1 ). This is consistent with previous studies which have shown that the metastable tetragonal phase was formed at low calcination temperatures, that its proportion was maximum at 400°C and that it gradually declined after calcination at higher temperatures (up to 1200°C) due to its transformation into monoclinic zirconia [34,35]. For the samples prepared by impregnation of Zr(OH)4 with AHM, the tetragonal phase is the main form of zirconia whatever the calcination temperature. This clearly confirms that the molybdenum stabilizes the metastable tetragonal phase as reported in several studies [36,37]. The tetragonal-monoclinic transformation at low temperatures has been proposed to occur via oxygen adsorption on specific sites, which seem to be also the anchoring sites for oxoanions such as sulfates and molybdates. Hence, the incorporation of oxoanions results in the inhibition of the phase transformation [38]. Considering the solids prepared by impregnation on ZrO2 followed by calcination at 450°C, the diffractogram of the solid 5-MoZrO2-450 is similar to the one of Zr(OH)4-450 with a predominance of the monoclinic zirconia phase, whereas, for the higher loading (10%), the proportion of tetragonal phase is higher than in the calcined support. At 700°C, the proportion of the tetragonal phase is more important in the solids containing molybdenum than in the support calcined at the same temperature. For the solids supported on ZrO2, the calcination of the catalyst implies, for the zirconia phase, an additional thermal treatment at 450 or 700°C after the initial calcination step of Zr(OH)4 at 450°C. This second thermal treatment results in a further crystallization of zirconia; the presence of molybdenum during this thermal treatment favors the formation of t-ZrO2 at the expense of m-ZrO2, leading to an increase of the proportion of tetragonal phase in the Mo/ZrO2 solids compared to the support alone. Weak XRD lines corresponding to MoO3 were only observed on the pattern of the catalyst with the highest Mo loading (10% Mo), prepared by impregnation on ZrO2 and calcined at 450°C. Zr(MoO4)2 mixed oxide phase lines were observed on the diffractograms of the solids calcined at 700°C and with relatively high molybdenum loading, which is consistent with reported data in the literature [3,36]. 3.1.2 Mo-Ti catalysts The XRD patterns of the calcined catalysts prepared by using either Ti(OH)4 or TiO2 as support (Fig. 2 ) indicate, for all Mo loading and independently of preparation protocol, a high dispersion of molybdenum on the support as no peaks except those of the anatase phase were observed. 3.2 Surface area measurements and elementary analysis The molybdenum contents, BET surface areas and molybdenum surface densities of the Mo-Zr and Mo-Ti catalysts are shown in Table 1. The N2 adsorption-desorption isotherms and pore size distributions of selected samples are given in the Supplementary information file. Whatever the preparation protocol and the calcination temperature, the introduction of molybdenum on zirconium hydroxide or oxide resulted in a greater surface area of the catalyst compared to the support. Moreover, within one preparation protocol, the greater the molybdenum loading is, the higher the surface area of the supported solid. Additionally, the areas of the solids prepared by impregnation on Zr(OH)4 are superior to those of the solids prepared by impregnation on ZrO2. The larger surface area of molybdenum supported on Zr(OH)4 compared to Zr(OH)4 alone after calcination at the same temperature has been widely commented in the literature [39,40]. It has been proposed that promoters (cations or anions) decrease the sintering and grain-growth rates of zirconia, which results in a greater surface area and a hindrance of the tetragonal-monoclinic transformation [40]. Conversely, the increase of the surface area of an oxide after its impregnation by another component is not common. Indeed, it is generally admitted that impregnation results in a decrease of the surface, because (i) the active phase contributes to the overall weight of the catalyst and hence decreases the surface area by the mere fact that the proportion of high surface area support is lower in the catalyst than in the staring support; (ii) the active phase may partially block the support pores. We believe that as molybdenum exists as large oxo-species in the impregnation solution and as the zirconia has been prepared in the laboratory at mild conditions (calcination of Zr(OH)4 at 450°C for 4h), the interaction between the oxygen atoms of the oxo-species and the zirconia surface defects may result in the de-agglomeration of zirconia particles leading to an increase of the surface area. Similarly to the Mo-ZrOH solids, the surface areas of the Mo-TiOH systems are larger than that of the pure TiO2 obtained by calcination of the titanium hydroxide at the same temperature. Hence, the presence of molybdenum also reduces the titania grain growth during the thermal treatment of the titanium hydroxide. For the samples supported on TiO2, a decrease in the specific surface area of the sample is first noted upon the impregnation of the support with 5wt% of molybdenum, then as the molybdenum content increases to 10wt%, the surface area increases and becomes greater than the initial surface of the support. This finding is different from the results observed for the ZrO2 supported solids, where the surface of the supported solids are, whatever the molybdenum loading, superior to the support surface area. This difference may be attributed to the difference in crystallinity between ZrO2 and TiO2. Indeed, ZrO2 seems, based on the broadness of the lines of ZrO2 diffractogram, to be slightly less crystallized than TiO2. This implies the existence of a larger number of surface defects which are responsible for the interaction of molybdenum oxo-species with the support and, therefore for the enlargement of the surface area of the supported solids compared to the supports. It is noteworthy that a non-monotonic variation of the surface area of titania supported solids with increasing transition metal loading has already been reported by Tsilomelekis and Halkides [41,42]. 3.3 Laser Raman spectroscopy analysis Supported molybdenum oxide has been thoroughly studied by Raman spectroscopy in the literature; assignment of the Raman bands is based on a careful examination of these previous reports. 3.3.1 The solids Mo-Zr calcined at 450°C Fig. 3 .a presents the Raman spectra of the Mo-Zr systems calcined at 450°C. The bands present on all spectra (Figs. 3a and 3b) at low wavenumber (612–645cm−1) are characteristic of the zirconium oxide (the one appearing at ca. 613cm−1 corresponds to m-ZrO2 and the second one at ca. 640cm−1 corresponds to t-ZrO2). The bands appearing in the 950 and 996cm−1 range have been attributed to the stretching of terminal Mo=O bonds [43–47]; when this band appears at high wavenumber (ca. 990–997cm−1) and that is accompanied by a band at 819–820cm−1 [43,44], it is a strong indication of the formation of MoO3 crystallites. These bands can even be observed at Mo concentration for which the crystallization of MoO3 is not detectable by XRD due to the small size of the particles. Based on this, 10-MoZrOH-450, 15-MoZrOH-450 and 10-MoZrO2-450 contain MoO3 crystallites. The band corresponding to ν(Mo=O) modes in MoO6 octahedra within polymolybdates is located at lower wavenumbers (ca. 974–978cm−1) and its exact position is very sensitive to the size of the polymolybdate cluster and to the degree of hydration [36,43,44,46]. It is associated with a band at ca. 870–885cm−1 that is due to Mo-O-Mo vibrations in two-dimensional polymolybdates [47–49]. From these assignments, the solids 5-Mo-ZrO2-450, 10-MoZrO2-450, 10-MoZrOH-450 and 15-MoZrOH-450 contain polymolybdates clusters. The band corresponding to ν(Mo=O) modes in isolated molybdates is located at even lower wavenumbers, ca. 956cm−1 [43,48]. Based on this, the solid 5-MoZrOH-450 contains isolated molybdates. The second band, observed at 821cm−1 on the spectrum of this solid may correspond to the antisymmetric vibration mode of Mo-O-Zr [43,50]. 3.3.2 The solids Mo-Zr calcined at 700°C Fig. 3.b presents the Raman spectra of the Mo-Zr systems calcined at 700°C. For all these solids, the two bands characteristic of the formation of crystalline MoO3 are absent. Instead, new bands at 940 and 740cm−1 are clearly visible. They have been assigned, together with a ν(Mo=O) stretching band at 996cm−1, to the formation of the mixed oxide Zr(MoO4)2 [43,44]. These three bands are clearly visible on the spectra of 10-MoZrOH, 15-MoZrOH and 10-MoZrO2, i.e. for the solids having the highest molybdenum densities. Moreover the Raman spectra of these solids exhibit bands at 976–980, 950–966, 850–884 and 807–810cm−1. The first two bands were attributed to the stretching vibration mode of terminal Mo=O bonds within the polymolybdates and isolated molybdates respectively, the bands at 850–884cm−1 and 807–810cm−1 correspond to the antisymmetric vibration modes (Mo-O-Mo) and (Mo-O-Zr) respectively. The spectra of the solids with the lowest molybdenum loading (5%) exhibit a broad band in the Mo=O stretching region. The broadness of this band indicates that it may be constituted by two bands corresponding to the Mo=O stretching bond in isolated molybdates and polymolybdates. The presence of the bands corresponding to the Mo-O-Zr and Mo-O-Mo stretching confirms the coexistence of both types of molybdates. From the analysis of the Raman spectra, it can be concluded that molybdenum on zirconia exists as isolated molybdate species only at low molybdenum density. At 450°C, for intermediate to high Mo densities, polymolybates are observed, and also, at densities higher than 4.46 Mo-at/nm2, crystalline MoO3 is formed. At 700°C, the MoO3 bands are absent and bands characteristic of Zr(MoO4)2 are observed at high loadings (molybdenum density ≥5.9Mo-at/nm2) whereas bands characteristic of polymolybdates are observed at all loadings and bands of isolated molybdates are observed at low and intermediate loadings. 700°C is well above the Tammann temperature of MoO3; hence, a thermal spreading of MoO3 is expected to occur during thermal treatment at 700°C [51], which could explain why the samples calcined at 700°C contain, at the same Mo loading, a larger proportion of (poly)molybdate in interaction with the support (antisymmetric Mo-O-Zr vibration at 807–810cm−1) than those calcined at 450°C. 3.3.3 The solids Mo-Ti The Raman spectra of the Mo-Ti solids are represented on Fig. 4 . They all have been normalized with respect to the strong band at 634cm−1 assigned to TiO2 (Anatase). All the spectra displayed a band at 953–976cm−1; as the molybdenum density increases, this band is blue-shifted and its intensity increases. This band has been attributed to the stretching of terminal Mo=O bonds of surface molybdate species. For 5-MoTiOH-450 (i.e. the solid with the lowest molybdenum density), this band is located at 953cm−1 and could be assigned to the Mo=O stretching mode of isolated molybdates with a tetrahedral configuration [41,48]. As the molybdenum density increases, the ν(Mo=O) band shifts to higher wavenumbers (ca. 968–976cm−1). This can be explained by a growth of polymolybdates species with an octahedral coordination [48]. Additionally, new features appear at ∼815–820cm−1 and 878cm−1. The band at 878cm−1 is attributed to Mo-O-Mo linkages within polymolybdates species [48], whereas the band at 815–820cm−1 is assigned to the antisymmetric stretching of Mo-O-Mo bonds within micro-crystalline MoO3. Another band characteristic of MoO3 is expected around 995cm−1. It is observed on the spectrum of 10-MoTiO2 spectra (at ca. 991cm−1). It is however not clearly visible on the spectra of 5-MoTiO2 and 15-MoTiOH but may be masked by the intense band at 976cm−1 band for these two solids. 3.4 Isopropanol decomposition tests The isopropanol (IPA) decomposition reaction has been widely used to probe acid-base and/or redox properties of catalysts depending on the reaction atmosphere [52]. Indeed, under inert atmosphere, the IPA undergoes dehydration leading to propene and diisopropylether over acid and/or basic sites and is dehydrogenated to acetone over basic sites according to the following reactions: Intramolecular dehydration (CH3)2CHOH→CH2CHCH3 +H2O Intermolecular dehydration 2 (CH3)2CHOH→(CH3)2CHOCH(CH3)2 +H2O Dehydrogenation (CH3)2CHOH→CH3COCH3 +H2 According to the literature, solid oxides with acidic character lead mainly to the formation of propene and diisopropylether; dehydrogenation reaction requires strong basic sites and occurs at temperatures above 573K [53]; propene formation necessitates strong acid sites [54,55] whereas the formation of diisopropylether involves weak acid sites [56].The conversions and the selectivities for isopropanol decomposition reaction are reported in Table 2 . Bare supports, prepared by calcination of Zr(OH)4 and Ti(OH)4 at 450 or 700°C, are inactive at the reaction temperature chosen for this study. ZrO2 and TiO2 possess mainly Lewis acid sites associated with Zr4+ and Ti4+ ions [57,58]. Yet, these Lewis acid sites seem to be inactive towards the isopropanol decomposition at 120°C. This is likely due to the fact that, at moderate temperatures, the Lewis acid sites of oxides such as alumina, titania and zirconia are hydroxylated and hence their Lewis acidity is masked (replaced by the weak Brønsted acidity of the surface hydroxyls) and a thermal treatment above 300°C is required to reveal it [59–61]. Moreover, considering that the isopropanol decomposition reaction produces water, even if a few Lewis sites were present after the pretreatment at 250°C, they would deactivate immediately by reaction with water molecules produced by the reaction. This finding is consistent with the results reported by Baertsch [62] who found that aluminium oxide is inactive in butanol dehydration reaction at 130°C despite the presence of Lewis acid sites. The inactivity of the bare supports and the development of a catalytic activity upon the introduction of molybdenum on the support surfaces may indicate that the acid activity of the solids is mainly due to Brønsted acid sites in agreement with the conclusions of Samaranch et al. [63]. Besides the supports, all the supported catalysts, except 5-MoTiOH-450 and 5-MoZrOH-450, present an appreciable catalytic activity. Propene is the major product and the proportions of ether and acetone are very small on the most active catalysts. Only the samples with the lowest Mo loading (and hence the lowest activity) have significant selectivities towards ether and acetone. Assuming that the formation of propene is directly related to the abundance of Brønsted acid sites, a correlation between the propene yield and the molybdenum density has been attempted (Fig. 5 ). The correlation is quite good but not perfect as the propene yield happened to vary quite irregularly with the molybdenum density. A more careful look to Fig. 5 reveals that the correlation between propene yield and molybdenum density is very good when considering the two preparation protocols separately (Fig. 6 a & b). For the two preparation methods the maximum propene yield is obtained for the solids presenting a molybdenum density of about 6 Mo-At/nm2. This indicates that these solids present the highest proportion of strong acid sites as the rate of dehydration to propene increases with the strength of the acid sites [60]. The solids with densities below 5 Mo-At/nm2 present the lowest propene yields but exhibit at the same time the highest ether selectivities (Table 2). This clearly indicates that they contain weak acid sites as the dehydration to ether does not depend on the acid sites strength. Hence, in addition to the molybdenum density, the preparation protocol affects the number and the strength of the created acid sites. Indeed, if we compare the propene yield obtained on solids presenting close molybdenum densities and supported on the same support, but synthesized via different protocols (Table 3 ), we observe that impregnation on the hydroxide leads always to a higher propene yield and hence to a surface with stronger acid sites. Based on this, we can conclude that the variation of the concentration and strength of acid sites as a function of the molybdenum density and protocol preparation can be related to the structure of molybdenum species, as follows: • At very low molybdenum density (0–3.3 Mo-At/nm2, Solids 5-MoZrOH-450, 5-MoTiOH-450 and 5-MoZrO2-450) the molybdenum exists mainly as isolated molybdates species and the activity of these solids is very low or null which means that isolated molybdates do not have Brønsted acid sites. • As molybdenum density increases (3.5-5.5 Mo/nm2, Solids 10-MoTiOH-450, 10-MoZrOH-450, 5-MoZrOH-700, 5-MoZrO2-700) the molybdenum exists as polymolydates and isolated molybdates. For these solids the isopropanol conversion is within 12–27% and the propene selectivity is between 63 and 83%, which indicates the formation of acid sites with different strength. • At molybdenum density close to 6 Mo-At/nm2(Solids 10-MoZrOH-700 and 10-MoTiO2-450) Raman spectroscopy and XRD have shown that these solids contain polymolybdates species with small amounts of microcrystalline MoO3 for 10MoTiO2-450 and Zr(MoO4)2 for 10-MoZrOH-700. These solids present the largest proportion of polymolybdates and led to the highest propene yield and hence have the most acid surfaces (in terms of number and strength of acid sites). • At High molybdenum surface densities (8–17 Mo/nm2) the solids contain either crystalline MoO3 and polymolybdates (5-MoTiO2-450, 15-MoTiOH-450, 15-MoZrOH-450) or isolated molybdates, polymolybdates and large particles of mixed oxide Zr(MoO4)2 (10-MoZrO2-700 and 15-MoZrOH-700). Involvement of part of the molybdenum in crystalline structures results in the diminution of the proportion of surface molybdate species and leads to a lower propene yield. From the above discussion, we can conclude that the polymolybdates clusters are the molybdenum species responsible for the presence of strong Brønsted acid sites able to decompose isopropanol to propene. The optimum proportion of these polymolybdates is reached at a molybdenum density around 6 Mo-At/nm2. 4 Conclusion TiO2 and ZrO2 supported molybdenum oxide solids have been prepared by impregnation of ammonium heptamolybdate on the corresponding oxyhydroxide MOx(OH)4-2x and oxide MO2. An increase of the surface area has been observed upon the addition of molybdenum for most of the prepared solids. Moreover, the solids prepared by impregnation on the hydroxides have higher surface areas than the solids prepared by impregnation on the oxide. This has been assigned to an inhibition of the grain-growth of the supports by the introduction of molybdenum; this grain-growth inhibition also hinders the tetragonal to monoclinic transformation for zirconia upon thermal treatment. Raman spectroscopy allowed determining the speciation of molybdenum (isolated molybdate, polymolybdate, MoO3 and Zr(MoO4)2) and was shown to better detect the formation of crystalline MoO3 than XRD. Raman spectroscopy especially showed that the polymerization of molybdenum species on the surface of the support is higher for the catalysts prepared with the oxides than with the oxyhydroxides. The study of isopropanol decomposition led to the conclusion that, at comparable molybdenum densities, impregnation on the oxyhydroxide leads always to a surface with stronger acid sites. The strength and the density of acid sites are optimal at a molybdenum density of ca. 6 Mo-At/nm2. The correlation between the structure of molybdenum species and the activity related to strong Brønsted acid sites (conversion of isopropanol to propene) allowed us concluding that the polymolybdates clusters are the molybdenum species responsible for the strong Brønsted acid sites and that the optimum proportion of these polymolybdates is reached at a molybdenum density of ca. 6 Mo-At/nm2. Funding This work was supported by the Algerian Ministry of Higher Education and Scientific Research “MESRS” and USTHB Chemistry Faculty (PhD scholarship and Travel Grant for N. Lamine). Appendix A Supplementary data Supplementary data associated with this article can be found, in the online version, at http://dx.doi.org/10.1016/j.molcata.2016.10.006. Appendix A Supplementary data The following is Supplementary data to this article: References [1] J. Ramírez G. Macías L. Cedeño A. Gutiérrez-Alejandre R. Cuevas P. Castillo The role of titania in supported Mo, CoMo, NiMo, and NiW hydrodesulfurization catalysts: analysis of past and new evidences, Catal Catal. Today 98 2004 19 30 10.1016/j.cattod.2004.07.050 [2] M. Breysse J.L. Portefaix M. Vrinat Support effects on hydrotreating catalysts Catal. Today 10 1991 489 505 10.1016/0920-5861(91)80035-8 [3] P. Afanasiev A. Thiollier M. Breysse J.L. Dubois Control of the textural properties of zirconium oxide Top. Catal. 8 1999 147 160 10.1023/A:1019109127118 [4] R.R. Schrock C. Czekelius Recent advances in the syntheses and applications of molybdenum and tungsten alkylidene and alkylidyne catalysts for the metathesis of alkenes and alkynes Adv. Synth. Catal. 349 2007 55 77 10.1002/adsc.200600459 [5] A.H. Hoveyda A.R. Zhugralin The remarkable metal-catalysed olefin metathesis reaction Nature 450 2007 243 251 10.1038/nature06351 [6] R.K. Grasselli J.D. Burrington D.J. Buttrey P. DeSanto C.G. Lugmair A.F. Volpe T. Weingand Multifunctionality of Active Centers in (Amm)oxidation Catalysts: From Bi–Mo–Ox to Mo–V–Nb–(Te, Sb)–Ox Top. Catal. 23 2003 5 22 10.1023/A:1024859917786 [7] M.O. Guerrero-Pérez J.N. Al-Saeedi V.V. Guliants M.A. Bañares Catalytic properties of mixed Mo-V-Sb-Nb-O oxides catalysts for the ammoxidation of propane to acrylonitrile Appl. Catal. Gen. 260 2004 93 99 10.1016/j.apcata.2003.10.004 [8] F. Cavani F. Trifirò The oxidative dehydrogenation of ethane and propane as an alternative way for the production of light olefins Catal. Today 24 1995 307 313 10.1016/0920-5861(95)00051-G [9] A. Christodoulakis E. Heracleous A.A. Lemonidou S. Boghosian An operando Raman study of structure and reactivity of alumina-supported molybdenum oxide catalysts for the oxidative dehydrogenation of ethane J. Catal. 242 2006 16 25 10.1016/j.jcat.2006.05.024 [10] S. Damyanova L. Petrov M.A. Centeno P. Grange Characterization of molybdenum hydrodesulfurization catalysts supported on ZrO2-Al2O3 and ZrO2-SiO2 carriers Appl. Catal. Gen. 224 2002 271 284 10.1016/S0926-860X(01)00849-3 [11] S. Brunet D. Mey G. Pérot C. Bouchy F. Diehl On the hydrodesulfurization of FCC gasoline: a review Appl. Catal. Gen. 278 2005 143 172 10.1016/j.apcata.2004.10.012 [12] B.S. Klose F.C. Jentoft R. Schlögl In situ diffuse-reflectance infrared spectroscopic investigation of promoted sulfated zirconia catalysts during n-butane isomerization J. Catal. 233 2005 68 80 10.1016/j.jcat.2005.04.011 [13] T.N. Vu J. van Gestel J.P. Gilson C. Collet J.P. Dath J.C. Duchet Platinum tungstated zirconia isomerization catalysts: part I. Characterization of acid and metal properties J. Catal. 231 2005 453 467 10.1016/j.jcat.2005.01.037 [14] D.A. Peña B.S. Uphade E.P. Reddy P.G. Smirniotis Identification of surface species on titania-Supported manganese, chromium, and copper oxide low-temperature SCR catalysts J. Phys. Chem. B 108 2004 9927 9936 10.1021/JP0313122 [15] K.I. Hadjiivanov D.G. Klissurski Surface chemistry of titania (anatase) and titania-supported catalysts Chem. Soc. Rev. 25 1996 61 69 10.1039/cs9962500061 [16] S.J. Tauster S.C. Fung R.L. Garten Strong metal-support interactions. Group 8 noble metals supported on titanium dioxide J. Am. Chem. Soc. 100 1978 170 175 10.1021/ja00469a029 [17] S.J. Tauster S.C. Fung Strong metal-support interactions: occurrence among the binary oxides of groups IIA–VB J. Catal. 55 1978 29 35 10.1016/0021-9517(78)90182-3 [18] S. Badoga R.V. Sharma A.K. Dalai J. Adjaye Hydrotreating of heavy gas oil on mesoporous zirconia supported NiMo catalyst with EDTA Fuel 128 2014 30 38 10.1016/j.fuel.2014.02.056 [19] K.V.R. Chary K.R. Reddy G. Kishan J.W. Niemantsverdriet G. Mestl Structure and catalytic properties of molybdenum oxide catalysts supported on zirconia J. Catal. 226 2004 283 291 10.1016/j.jcat.2004.04.028 [20] P. Ciambelli D. Sannino V. Palma V. Vaiano Photocatalysed selective oxidation of cyclohexane to benzene on MoOx/TiO2 Catal. Today 99 2005 143 149 10.1016/j.cattod.2004.09.034 [21] M. Breysse P. Afanasiev C. Geantet M. Vrinat Overview of support effects in hydrotreating catalysts Catal. Today 86 2003 5 16 10.1016/S0920-5861(03)00400-0 [22] C. Louis J.-M. Tatibouët M. Che Catalytic properties of silica-supported molybdenum catalysts in methanol oxidation: the influence of molybdenum dispersion J. Catal. 109 1988 354 366 10.1016/0021-9517(88)90218-7 [23] M.A. Banares J.L.G. Fierro J.B. Moffat The partial oxidation of methane on MoO3/SiO2 catalysts: influence of the molybdenum content and type of oxidant J. Catal. 142 1993 406 417 10.1006/jcat.1993.1218 [24] S.K. Maity M.S. Rana S.K. Bej J. Ancheyta-Juárez G.M. Dhar T.S.R.P. Rao TiO2–ZrO2 mixed oxide as a support for hydrotreating catalyst Catal. Lett. 72 2001 115 119 10.1023/A:1009045412926 [25] J. Ramirez S. Fuentes G. Díaz M. Vrinat M. Breysse M. Lacroix Hydrodesulphurization activity and characterization of sulphided molybdenum and cobalt—molybdenum catalysts comparison of alumina, silica—alumina and titania supported catalysts Appl. Catal. 52 1989 211 223 10.1016/0166-9834(89)80004-1 [26] A.N. Desikan L. Huang S.T. Oyama Structure and dispersion of molybdenum oxide supported on alumina and titania J. Chem. Soc. Faraday Trans. 88 1992 3357 3365 10.1039/FT9928803357 [27] E. Payen L. Gengembre F. Mauge J.C. Duchet J.C. Lavalley Surface properties of zirconia catalyst carriers: interaction with oxomolybdates species Catal. Today 10 1991 521 539 10.1016/0920-5861(91)80037-A [28] J.A. Wang X. Bokhimi O. Novaro T. López F. Tzompantzi R. Gómez J. Navarrete M.E. Llanos E. López-Salinas Effects of structural defects and acid-basic properties on the activity and selectivity of isopropanol decomposition on nanocrystallite sol-gel alumina catalyst J. Mol. Catal. Chem. 137 1999 239 252 10.1016/s1381-1169(98)00077-6 [29] R. Valarivan C.N. Pillai C.S. Swamy Decomposition of 2-propanol on an intermetallic compound for hydrogen storage React. Kinet. Catal. Lett. 53 1994 429 440 10.1007/BF02073052 [30] M.A. Aramendı́a V. Boráu I.M. Garcı́a C. Jiménez A. Marinas J.M. Marinas A. Porras F.J. Urbano Comparison of different organic test reactions over acid-base catalysts Appl. Catal. Gen. 184 1999 115 125 10.1016/s0926-860x(99)00096-4 [31] K. Arata H. Sawamura The dehydration and dehydrogenation of ethanol catalyzed by TiO2–ZrO2 Bull. Chem. Soc. Jpn. 48 1975 3377 3378 10.1246/bcsj.48.3377 [32] H. Pines R.C. Olberg V.N. Ipatieff Studies in the terpene series VIII 1 effect of catalyst, solvent and temperature on the dehydrogenation of pinane and p-menthane J. Am. Chem. Soc. 70 1948 533 537 10.1021/ja01182a031 [33] Q.-H. Zhang L. Gao J.-K. Guo Preparation and characterization of nanosized TiO2 powders from aqueous TiCl4 solution Nanostruct. Mater. 11 1999 1293 1300 10.1016/S0965-9773(99)00421-3 [34] K.T. Jung A.T. Bell The effects of synthesis and pretreatment conditions on the bulk structure and surface properties of zirconia J. Mol. Catal. Chem. 163 2000 27 42 10.1016/S1381-1169(00)00397-6 [35] E.I. Ross-Medgaarden W.V. Knowles T. Kim M.S. Wong W. Zhou C.J. Kiely I.E. Wachs New insights into the nature of the acidic catalytic active sites present in ZrO2-supported tungsten oxide catalysts J. Catal. 256 2008 108 125 10.1016/j.jcat.2008.03.003 [36] K. Chen S. Xie E. Iglesia A.T. Bell Structure and properties of zirconia-Supported molybdenum oxide catalysts for oxidative dehydrogenation of propane J. Catal. 189 2000 421 430 10.1006/jcat.1999.2720 [37] A. Calafat L. Avilán J. Aldana The influence of preparation conditions on the surface area and phase formation of MoO3/ZrO2 catalysts Appl. Catal. Gen. 201 2000 215 223 10.1016/S0926-860X(00)00441-5 [38] R. Srinivasan T. Watkins C. Hubbard B.H. Davis Sulfated zirconia catalysts. The crystal phases and their transformations Chem. Mater. 7 1995 725 730 10.1021/cm00052a018 [39] B.Y. Zhao X.P. Xu H.R. Ma D.H. Sun J.M. Gao Monolayer dispersion of oxides and salts on surface of ZrO2 and its application in preparation of ZrO2-supported catalysts with high surface areas Catal. Lett. 45 1997 237 244 10.1023/A:1019048503124 [40] B.M. Reddy P.M. Sreekanth V.R. Reddy Modified zirconia solid acid catalysts for organic synthesis and transformations J. Mol. Catal. Chem. 225 2005 71 78 10.1016/j.molcata.2004.09.003 [41] G. Tsilomelekis A. Christodoulakis S. Boghosian Support effects on structure and activity of molybdenum oxide catalysts for the oxidative dehydrogenation of ethane Catal. Today. 127 2007 139 147 10.1016/j.cattod.2007.03.026 [42] T.I. Halkides D.I. Kondarides X.E. Verykios Catalytic reduction of NO by C3H6 over Rh/TiO2 catalysts Appl. Catal. B Environ. 41 2003 415 426 10.1016/S0926-3373(02)00176-5 [43] Z. Liu Y. Chen Spectroscopic studies on tetragonal ZrO2-supported MoO3 and NiO-MoO3 systems J. Catal. 177 1998 314 324 10.1006/jcat.1998.2123 [44] G. Mestl T.K.K. Srinivasan Raman spectroscopy of monolayer-type catalysts: supported molybdenum oxides Catal. Rev. 40 1998 451 570 10.1080/01614949808007114 [45] S. Xie K. Chen A.T. Bell E. Iglesia Structural characterization of molybdenum oxide supported on zirconia J. Phys. Chem. B 104 2000 10059 10068 10.1021/jp002419h [46] P. Dufresne E. Payen J. Grimblot J.P. Bonnelle Study of nickel-molybdenum-.gamma.-aluminum oxide catalysts by X-ray photoelectron and Raman spectroscopy. Comparison with cobalt-molybdenum-.gamma.-aluminum oxide catalysts J. Phys. Chem. 85 1981 2344 2351 10.1021/j150616a010 [47] T. Ono H. Miyata Y. Kubokawa Catalytic activity and structure of Mo oxide highly dispersed on ZrO2 for oxidation reactions J. Chem. Soc. Faraday Trans. Phys. Chem. Condens. Phases. 83 1987 1761 1770 10.1039/F19878301761 [48] H. Hu I.E. Wachs S.R. Bare Surface structures of supported molybdenum oxide catalysts: characterization by raman and Mo L3-Edge XANES J. Phys. Chem. 99 1995 10897 10910 10.1021/j100027a034 [49] D.S. Kim K. Segawa T. Soeya I.E. Wachs Surface structures of supported molybdenum oxide catalysts under ambient conditions J. Catal. 136 1992 539 553 10.1016/0021-9517(92)90084-U [50] B. Zhao X. Wang H. Ma Y. Tang Raman spectroscopy studies on the structure of MoO3/ZrO2 solid superacid J. Mol. Catal. Chem. 108 1996 167 174 10.1016/1381-1169(96)00008-8 [51] G. Tsilomelekis S. Boghosian On the configuration, molecular structure and vibrational properties of MoOx sites on alumina, zirconia, titania and silica, Catal Sci. Technol. 3 2013 1869 1888 10.1039/C3CY00057E [52] A. Gervasini A. Auroux Acidity and basicity of metal oxide surfaces II. Determination by catalytic decomposition of isopropanol J. Catal. 131 1991 190 198 10.1016/0021-9517(91)90335-2 [53] A.L. McKenzie C.T. Fishel R.J. Davis Investigation of the surface structure and basic properties of calcined hydrotalcites J. Catal. 138 1992 547 561 10.1016/0021-9517(92)90306-3 [54] D. Dautzenberg H. Knözinger Influence of steric and inductive effects on product distributions in the dehydration of secondary alcohols on alumina J. Catal. 33 1974 142 144 10.1016/0021-9517(74)90254-1 [55] S.B. Chaabene L. Bergaoui A. Ghorbel J.F. Lambert P. Grange Acidic properties of a clay prepared from the reaction of zirconyl chloride solution containing sulfate ions with montmorillonite Appl. Catal. Gen. 252 2003 411 419 10.1016/S0926-860X(03)00491-5 [56] P. Berteau M. Ruwet B. Delmon Reaction pathways in 1-butanol dehydration on γ-Alumina Bull. Sociétés Chim. Belg. 94 1985 859 868 10.1002/bscb.19850941113 [57] C. Martı́n G. Solana P. Malet V. Rives Nb2O5-supported WO3: a comparative study with WO3/Al2O3 Catal. Today 78 2003 365 376 10.1016/S0920-5861(02)00301-2 [58] C. Morterra G. Ghiotti E. Garrone E. Fisicaro Spectroscopic study of anatase properties. Part 3. Surface acidity J. Chem. Soc. Faraday Trans. Phys. Chem. Condens. Phases. 76 1980 2102 2113 10.1039/F19807602102 [59] T.H. Ballinger J.T. Yates IR spectroscopic detection of Lewis acid sites on alumina using adsorbed carbon monoxide. Correlation with aluminum-hydroxyl group removal Langmuir 7 1991 3041 3045 10.1021/la00060a022 [60] W. Turek A. Krowiak Evaluation of oxide catalysts’ properties based on isopropyl alcohol conversion Appl. Catal. Gen. 417-418 2012 102 110 10.1016/j.apcata.2011.12.030 [61] K. Hadjiivanov J.-C. Lavalley FT–IR spectroscopic study of CO adsorption on monoclinic zirconia of different hydroxylation degrees Catal. Commun. 2 2001 129 133 10.1016/S1566-7367(01)00020-6 [62] C.D. Baertsch K.T. Komala Y.-H. Chua E. Iglesia Genesis of brønsted acid sites during dehydration of 2-butanol on tungsten oxide catalysts J. Catal. 205 2002 44 57 10.1006/jcat.2001.3426 [63] B. Samaranch P. Ramírez de la Piscina G. Clet M. Houalla N. Homs Study of the structure, acidic, and catalytic properties of binary mixed-oxide MoO3-ZrO2 systems Chem Mater. 18 2006 1581 1586 10.1021/cm052433c",
      "scopus-id": "84990210492",
      "coredata": {
        "eid": "1-s2.0-S1381116916304277",
        "dc:description": "Molybdenum catalysts supported on titania and zirconia have been prepared via the impregnation on the corresponding hydroxides and oxides. The solids have been characterized by surface area measurements, XR-Fluorescence analysis, XRD and Raman Spectroscopy. The isopropanol decomposition reaction has been used to probe their acidic properties. These analyses revealed that introduction of molybdenum on the surfaces of the hydroxides and the oxides results in an increase of the specific surface area. Impregnation on the hydroxide leads to a comparatively better molybdenum dispersion and to a greater surface acidity. This indicates that the acid sites on hydroxide derived solids are stronger and more numerous than on their oxide derived counterpart.",
        "openArchiveArticle": "false",
        "prism:coverDate": "2016-12-15",
        "openaccessUserLicense": null,
        "prism:aggregationType": "Journal",
        "prism:url": "https://api.elsevier.com/content/article/pii/S1381116916304277",
        "dc:creator": [
          {
            "@_fa": "true",
            "$": "Lamine, Nacéra"
          },
          {
            "@_fa": "true",
            "$": "Benadda, Amel"
          },
          {
            "@_fa": "true",
            "$": "Djadoun, Amar"
          },
          {
            "@_fa": "true",
            "$": "Barama, Akila"
          },
          {
            "@_fa": "true",
            "$": "Blanchard, Juliette"
          }
        ],
        "link": [
          {
            "@_fa": "true",
            "@rel": "self",
            "@href": "https://api.elsevier.com/content/article/pii/S1381116916304277"
          },
          {
            "@_fa": "true",
            "@rel": "scidir",
            "@href": "https://www.sciencedirect.com/science/article/pii/S1381116916304277"
          }
        ],
        "dc:format": "application/json",
        "openaccessType": null,
        "pii": "S1381-1169(16)30427-7",
        "prism:volume": "425",
        "prism:publisher": "Elsevier B.V.",
        "dc:title": "Effect of preparation protocol on the surface acidity of molybdenum catalysts supported on titania and zirconia",
        "prism:copyright": "© 2016 Elsevier B.V. All rights reserved.",
        "openaccess": "0",
        "prism:issn": "13811169",
        "dcterms:subject": [
          {
            "@_fa": "true",
            "$": "Molybdena"
          },
          {
            "@_fa": "true",
            "$": "Zirconium hydroxide"
          },
          {
            "@_fa": "true",
            "$": "Titanium hydroxide"
          },
          {
            "@_fa": "true",
            "$": "Impregnation"
          },
          {
            "@_fa": "true",
            "$": "Isopropanol decomposition"
          }
        ],
        "openaccessArticle": "false",
        "prism:publicationName": "Journal of Molecular Catalysis A: Chemical",
        "openaccessSponsorType": null,
        "prism:pageRange": "157-165",
        "prism:endingPage": "165",
        "pubType": "fla",
        "prism:coverDisplayDate": "15 December 2016",
        "prism:doi": "10.1016/j.molcata.2016.10.006",
        "prism:startingPage": "157",
        "dc:identifier": "doi:10.1016/j.molcata.2016.10.006",
        "openaccessSponsorName": null
      },
      "objects": {
        "object": [
          {
            "@category": "thumbnail",
            "@height": "88",
            "@width": "219",
            "@_fa": "true",
            "$": "https://api.elsevier.com/content/object/eid/1-s2.0-S1381116916304277-fx1.sml?httpAccept=%2A%2F%2A",
            "@multimediatype": "GIF image file",
            "@type": "IMAGE-THUMBNAIL",
            "@size": "5009",
            "@ref": "fx1",
            "@mimetype": "image/gif"
          },
          {
            "@category": "thumbnail",
            "@height": "164",
            "@width": "175",
            "@_fa": "true",
            "$": "https://api.elsevier.com/content/object/eid/1-s2.0-S1381116916304277-gr1.sml?httpAccept=%2A%2F%2A",
            "@multimediatype": "GIF image file",
            "@type": "IMAGE-THUMBNAIL",
            "@size": "8169",
            "@ref": "gr1",
            "@mimetype": "image/gif"
          },
          {
            "@category": "thumbnail",
            "@height": "164",
            "@width": "90",
            "@_fa": "true",
            "$": "https://api.elsevier.com/content/object/eid/1-s2.0-S1381116916304277-gr2.sml?httpAccept=%2A%2F%2A",
            "@multimediatype": "GIF image file",
            "@type": "IMAGE-THUMBNAIL",
            "@size": "4014",
            "@ref": "gr2",
            "@mimetype": "image/gif"
          },
          {
            "@category": "thumbnail",
            "@height": "164",
            "@width": "198",
            "@_fa": "true",
            "$": "https://api.elsevier.com/content/object/eid/1-s2.0-S1381116916304277-gr3.sml?httpAccept=%2A%2F%2A",
            "@multimediatype": "GIF image file",
            "@type": "IMAGE-THUMBNAIL",
            "@size": "7938",
            "@ref": "gr3",
            "@mimetype": "image/gif"
          },
          {
            "@category": "thumbnail",
            "@height": "164",
            "@width": "179",
            "@_fa": "true",
            "$": "https://api.elsevier.com/content/object/eid/1-s2.0-S1381116916304277-gr4.sml?httpAccept=%2A%2F%2A",
            "@multimediatype": "GIF image file",
            "@type": "IMAGE-THUMBNAIL",
            "@size": "6290",
            "@ref": "gr4",
            "@mimetype": "image/gif"
          },
          {
            "@category": "thumbnail",
            "@height": "119",
            "@width": "219",
            "@_fa": "true",
            "$": "https://api.elsevier.com/content/object/eid/1-s2.0-S1381116916304277-gr5.sml?httpAccept=%2A%2F%2A",
            "@multimediatype": "GIF image file",
            "@type": "IMAGE-THUMBNAIL",
            "@size": "4900",
            "@ref": "gr5",
            "@mimetype": "image/gif"
          },
          {
            "@category": "thumbnail",
            "@height": "102",
            "@width": "219",
            "@_fa": "true",
            "$": "https://api.elsevier.com/content/object/eid/1-s2.0-S1381116916304277-gr6.sml?httpAccept=%2A%2F%2A",
            "@multimediatype": "GIF image file",
            "@type": "IMAGE-THUMBNAIL",
            "@size": "6667",
            "@ref": "gr6",
            "@mimetype": "image/gif"
          },
          {
            "@category": "standard",
            "@height": "200",
            "@width": "500",
            "@_fa": "true",
            "$": "https://api.elsevier.com/content/object/eid/1-s2.0-S1381116916304277-fx1.jpg?httpAccept=%2A%2F%2A",
            "@multimediatype": "JPEG image file",
            "@type": "IMAGE-DOWNSAMPLED",
            "@size": "20420",
            "@ref": "fx1",
            "@mimetype": "image/jpeg"
          },
          {
            "@category": "standard",
            "@height": "530",
            "@width": "565",
            "@_fa": "true",
            "$": "https://api.elsevier.com/content/object/eid/1-s2.0-S1381116916304277-gr1.jpg?httpAccept=%2A%2F%2A",
            "@multimediatype": "JPEG image file",
            "@type": "IMAGE-DOWNSAMPLED",
            "@size": "70001",
            "@ref": "gr1",
            "@mimetype": "image/jpeg"
          },
          {
            "@category": "standard",
            "@height": "548",
            "@width": "301",
            "@_fa": "true",
            "$": "https://api.elsevier.com/content/object/eid/1-s2.0-S1381116916304277-gr2.jpg?httpAccept=%2A%2F%2A",
            "@multimediatype": "JPEG image file",
            "@type": "IMAGE-DOWNSAMPLED",
            "@size": "30974",
            "@ref": "gr2",
            "@mimetype": "image/jpeg"
          },
          {
            "@category": "standard",
            "@height": "468",
            "@width": "565",
            "@_fa": "true",
            "$": "https://api.elsevier.com/content/object/eid/1-s2.0-S1381116916304277-gr3.jpg?httpAccept=%2A%2F%2A",
            "@multimediatype": "JPEG image file",
            "@type": "IMAGE-DOWNSAMPLED",
            "@size": "56795",
            "@ref": "gr3",
            "@mimetype": "image/jpeg"
          },
          {
            "@category": "standard",
            "@height": "310",
            "@width": "339",
            "@_fa": "true",
            "$": "https://api.elsevier.com/content/object/eid/1-s2.0-S1381116916304277-gr4.jpg?httpAccept=%2A%2F%2A",
            "@multimediatype": "JPEG image file",
            "@type": "IMAGE-DOWNSAMPLED",
            "@size": "24090",
            "@ref": "gr4",
            "@mimetype": "image/jpeg"
          },
          {
            "@category": "standard",
            "@height": "204",
            "@width": "376",
            "@_fa": "true",
            "$": "https://api.elsevier.com/content/object/eid/1-s2.0-S1381116916304277-gr5.jpg?httpAccept=%2A%2F%2A",
            "@multimediatype": "JPEG image file",
            "@type": "IMAGE-DOWNSAMPLED",
            "@size": "17290",
            "@ref": "gr5",
            "@mimetype": "image/jpeg"
          },
          {
            "@category": "standard",
            "@height": "262",
            "@width": "565",
            "@_fa": "true",
            "$": "https://api.elsevier.com/content/object/eid/1-s2.0-S1381116916304277-gr6.jpg?httpAccept=%2A%2F%2A",
            "@multimediatype": "JPEG image file",
            "@type": "IMAGE-DOWNSAMPLED",
            "@size": "34156",
            "@ref": "gr6",
            "@mimetype": "image/jpeg"
          },
          {
            "@category": "high",
            "@height": "886",
            "@width": "2213",
            "@_fa": "true",
            "$": "https://api.elsevier.com/content/object/eid/1-s2.0-S1381116916304277-fx1_lrg.jpg?httpAccept=%2A%2F%2A",
            "@multimediatype": "JPEG image file",
            "@type": "IMAGE-HIGH-RES",
            "@size": "154525",
            "@ref": "fx1",
            "@mimetype": "image/jpeg"
          },
          {
            "@category": "high",
            "@height": "2345",
            "@width": "2500",
            "@_fa": "true",
            "$": "https://api.elsevier.com/content/object/eid/1-s2.0-S1381116916304277-gr1_lrg.jpg?httpAccept=%2A%2F%2A",
            "@multimediatype": "JPEG image file",
            "@type": "IMAGE-HIGH-RES",
            "@size": "543504",
            "@ref": "gr1",
            "@mimetype": "image/jpeg"
          },
          {
            "@category": "high",
            "@height": "2425",
            "@width": "1333",
            "@_fa": "true",
            "$": "https://api.elsevier.com/content/object/eid/1-s2.0-S1381116916304277-gr2_lrg.jpg?httpAccept=%2A%2F%2A",
            "@multimediatype": "JPEG image file",
            "@type": "IMAGE-HIGH-RES",
            "@size": "255072",
            "@ref": "gr2",
            "@mimetype": "image/jpeg"
          },
          {
            "@category": "high",
            "@height": "2071",
            "@width": "2500",
            "@_fa": "true",
            "$": "https://api.elsevier.com/content/object/eid/1-s2.0-S1381116916304277-gr3_lrg.jpg?httpAccept=%2A%2F%2A",
            "@multimediatype": "JPEG image file",
            "@type": "IMAGE-HIGH-RES",
            "@size": "440627",
            "@ref": "gr3",
            "@mimetype": "image/jpeg"
          },
          {
            "@category": "high",
            "@height": "1375",
            "@width": "1502",
            "@_fa": "true",
            "$": "https://api.elsevier.com/content/object/eid/1-s2.0-S1381116916304277-gr4_lrg.jpg?httpAccept=%2A%2F%2A",
            "@multimediatype": "JPEG image file",
            "@type": "IMAGE-HIGH-RES",
            "@size": "188310",
            "@ref": "gr4",
            "@mimetype": "image/jpeg"
          },
          {
            "@category": "high",
            "@height": "903",
            "@width": "1667",
            "@_fa": "true",
            "$": "https://api.elsevier.com/content/object/eid/1-s2.0-S1381116916304277-gr5_lrg.jpg?httpAccept=%2A%2F%2A",
            "@multimediatype": "JPEG image file",
            "@type": "IMAGE-HIGH-RES",
            "@size": "113500",
            "@ref": "gr5",
            "@mimetype": "image/jpeg"
          },
          {
            "@category": "high",
            "@height": "1160",
            "@width": "2500",
            "@_fa": "true",
            "$": "https://api.elsevier.com/content/object/eid/1-s2.0-S1381116916304277-gr6_lrg.jpg?httpAccept=%2A%2F%2A",
            "@multimediatype": "JPEG image file",
            "@type": "IMAGE-HIGH-RES",
            "@size": "241098",
            "@ref": "gr6",
            "@mimetype": "image/jpeg"
          },
          {
            "@category": "standard",
            "@_fa": "true",
            "$": "https://api.elsevier.com/content/object/eid/1-s2.0-S1381116916304277-mmc1.docx?httpAccept=%2A%2F%2A",
            "@multimediatype": "Microsoft Word file",
            "@type": "APPLICATION",
            "@size": "158923",
            "@ref": "mmc1",
            "@mimetype": "application/word"
          }
        ]
      },
      "link": {
        "@rel": "abstract",
        "@href": "https://api.elsevier.com/content/abstract/scopus_id/84990210492"
      }
    }
  }
}