{
  "metadata": {
    "title": "Theoretical study of ethylene polymerization on Ziegler–Natta catalysts and on metallocene catalysts",
    "authors": "Akinobu Shiga",
    "journal": "Journal of Molecular Catalysis A: Chemical",
    "date": "1999-10-20",
    "doi": "10.1016/S1381-1169(99)00277-0",
    "abstract": "",
    "uri": "https://api.elsevier.com/content/article/pii/S1381116999002770",
    "pii": "S1381116999002770"
  },
  "fulltext": {
    "full-text-retrieval-response": {
      "scopus-eid": "2-s2.0-0033589313",
      "originalText": "serial JL 271358 291210 291744 291790 291809 31 Journal of Molecular Catalysis A: Chemical JOURNALMOLECULARCATALYSISACHEMICAL 2000-01-11 2000-01-11 2010-04-18T14:19:10 1-s2.0-S1381116999002770 S1381-1169(99)00277-0 S1381116999002770 10.1016/S1381-1169(99)00277-0 S300 S300.1 FULL-TEXT 1-s2.0-S1381116900X01069 2015-05-15T05:56:33.651043-04:00 0 0 19991020 1999 2000-01-11T00:00:00Z articleinfo crossmark dco dateupdated tomb dateloaded datesearch indexeddate issuelist volumelist yearnav articletitlenorm authfirstinitialnorm authfirstsurnamenorm cid cids contenttype copyright dateloadedtxt docsubtype doctype doi eid ewtransactionid hubeid issfirst issn issnnorm itemstage itemtransactionid itemweight openaccess openarchive pg pgfirst pglast pii piinorm pubdatestart pubdatetxt pubyr sortorder srctitle srctitlenorm srctype subheadings volfirst volissue webpdf webpdfpagecount figure table body acknowledge affil appendices articletitle auth authfirstini authfull authkeywords authlast footnotes primabst ref alllist content subj ssids 1381-1169 13811169 146 146 1 2 1 2 Volume 146, Issues 1–2 37 325 334 325 334 19991020 20 October 1999 1999-10-20 1999 converted-article fla Copyright © 1999 Elsevier Science B.V. All rights reserved. THEORETICALSTUDYETHYLENEPOLYMERIZATIONZIEGLERNATTACATALYSTSMETALLOCENECATALYSTS SHIGA A 1 Introduction 2 Methods 2.1 Models 2.2 PIO analysis 2.3 LFO calculation 3 Results and discussion 3.1 PIO analysis 3.2 Oh-d1methyltitanium chloride cluster/ethylene systems 3.3 Td-d0[CH3TiCp2]+1/C2H4 system 3.4 Td-d1[CH3TiCp2]/C2H4 system 3.4.1 α spin system 3.4.2 β spin system 3.5 RI of the model systems 4 Conclusion Acknowledgements Appendix A References KAWAMURAKURIBAYASHI 1992 2359 H KAWAMURAKURIBAYASHI 1992 8687 H YOSHIDA 1995 746 T YOSHIDA 1996 766 T FROESE 1997 7190 R LOHRENZ 1995 91 J LOHRENZ 1995 12793 J FAN 1995 2018 L MUSAEV 1997 367 D MUSAEV 1933 16 D PROSENC 1997 3889 M MARGL 1996 4434 P WOO 1997 3454 T BOERO 1998 2746 M FUJIMOTO 1981 7452 H FUJIMOTO 1984 3539 H FUJIMOTO 1985 6157 H FUJIMOTO 1987 448 H SHIGA 1989 95 A SHIGA 1992 135 A SHIGA 1993 95 A SHIGA 1994 243 A FUJIMOTO 1986 2768 H FUJIMOTO 1991 989 H OMOTO 1996 1751 K SHIGA 1997 1867 A NATTA 1959 21 G NATTA 1961 399 G RODRIGUEZ 1966 1905 L RODRIGUEZ 1966 1917 L VANLOOY 1966 1927 H RODRIGUEZ 1966 1951 L RODRIGUEZ 1966 1971 L WILCHINSKY 1973 351 Z KATSUMI 1989 72 H SHIGAX1999X325 SHIGAX1999X325X334 SHIGAX1999X325XA SHIGAX1999X325X334XA item S1381-1169(99)00277-0 S1381116999002770 1-s2.0-S1381116999002770 10.1016/S1381-1169(99)00277-0 271358 2010-09-29T22:37:18.764549-04:00 1999-10-20 1-s2.0-S1381116999002770-main.pdf https://s3.amazonaws.com/prod-ucs-content-store-us-east/content/pii:S1381116999002770/MAIN/application/pdf/40cdcde2fc4ee1ced977afc33aafd927/main.pdf https://s3-eu-west-1.amazonaws.com/prod-ucs-content-store-eu-west/content/pii:S1381116999002770/MAIN/application/pdf/40cdcde2fc4ee1ced977afc33aafd927/main.pdf main.pdf pdf true 255515 MAIN 10 1-s2.0-S1381116999002770-main_1.png https://s3.amazonaws.com/prod-ucs-content-store-us-east/content/pii:S1381116999002770/PREVIEW/image/png/34c4f2bf82f02a779cf4b633f03d750e/main_1.png https://s3-eu-west-1.amazonaws.com/prod-ucs-content-store-eu-west/content/pii:S1381116999002770/PREVIEW/image/png/34c4f2bf82f02a779cf4b633f03d750e/main_1.png main_1.png png 60930 849 656 IMAGE-WEB-PDF 1 1-s2.0-S1381116999002770-si9.gif https://s3.amazonaws.com/prod-ucs-content-store-us-east/content/pii:S1381116999002770/STRIPIN/image/gif/368f8c55301332d1c746acd7b6431397/si9.gif https://s3-eu-west-1.amazonaws.com/prod-ucs-content-store-eu-west/content/pii:S1381116999002770/STRIPIN/image/gif/368f8c55301332d1c746acd7b6431397/si9.gif si9 si9.gif gif 2260 20 613 ALTIMG 1-s2.0-S1381116999002770-si8.gif https://s3.amazonaws.com/prod-ucs-content-store-us-east/content/pii:S1381116999002770/STRIPIN/image/gif/c96cac2dfd76c1195a476be6ac683098/si8.gif https://s3-eu-west-1.amazonaws.com/prod-ucs-content-store-eu-west/content/pii:S1381116999002770/STRIPIN/image/gif/c96cac2dfd76c1195a476be6ac683098/si8.gif si8 si8.gif gif 1540 19 410 ALTIMG 1-s2.0-S1381116999002770-si7.gif https://s3.amazonaws.com/prod-ucs-content-store-us-east/content/pii:S1381116999002770/STRIPIN/image/gif/7bfada41d49de1ec9fb893c4a4326c64/si7.gif https://s3-eu-west-1.amazonaws.com/prod-ucs-content-store-eu-west/content/pii:S1381116999002770/STRIPIN/image/gif/7bfada41d49de1ec9fb893c4a4326c64/si7.gif si7 si7.gif gif 2273 20 613 ALTIMG 1-s2.0-S1381116999002770-si6.gif https://s3.amazonaws.com/prod-ucs-content-store-us-east/content/pii:S1381116999002770/STRIPIN/image/gif/8b41cc8c808fbb1a242bffe2f878e7b3/si6.gif https://s3-eu-west-1.amazonaws.com/prod-ucs-content-store-eu-west/content/pii:S1381116999002770/STRIPIN/image/gif/8b41cc8c808fbb1a242bffe2f878e7b3/si6.gif si6 si6.gif gif 1608 21 425 ALTIMG 1-s2.0-S1381116999002770-si5.gif https://s3.amazonaws.com/prod-ucs-content-store-us-east/content/pii:S1381116999002770/STRIPIN/image/gif/32a49ef36d0083d0c732a83ef5a8434c/si5.gif https://s3-eu-west-1.amazonaws.com/prod-ucs-content-store-eu-west/content/pii:S1381116999002770/STRIPIN/image/gif/32a49ef36d0083d0c732a83ef5a8434c/si5.gif si5 si5.gif gif 2183 21 622 ALTIMG 1-s2.0-S1381116999002770-si48.gif https://s3.amazonaws.com/prod-ucs-content-store-us-east/content/pii:S1381116999002770/STRIPIN/image/gif/9d77b0cba5f1768963f0ed36fcfdc3ad/si48.gif https://s3-eu-west-1.amazonaws.com/prod-ucs-content-store-eu-west/content/pii:S1381116999002770/STRIPIN/image/gif/9d77b0cba5f1768963f0ed36fcfdc3ad/si48.gif si48 si48.gif gif 1512 19 395 ALTIMG 1-s2.0-S1381116999002770-si47.gif https://s3.amazonaws.com/prod-ucs-content-store-us-east/content/pii:S1381116999002770/STRIPIN/image/gif/798e4dc5a4ba28867650d06a3bc272ed/si47.gif https://s3-eu-west-1.amazonaws.com/prod-ucs-content-store-eu-west/content/pii:S1381116999002770/STRIPIN/image/gif/798e4dc5a4ba28867650d06a3bc272ed/si47.gif si47 si47.gif gif 2526 21 732 ALTIMG 1-s2.0-S1381116999002770-si46.gif https://s3.amazonaws.com/prod-ucs-content-store-us-east/content/pii:S1381116999002770/STRIPIN/image/gif/c04b4645da383f99096a2eaf2f80ddfb/si46.gif https://s3-eu-west-1.amazonaws.com/prod-ucs-content-store-eu-west/content/pii:S1381116999002770/STRIPIN/image/gif/c04b4645da383f99096a2eaf2f80ddfb/si46.gif si46 si46.gif gif 6127 62 929 ALTIMG 1-s2.0-S1381116999002770-si45.gif https://s3.amazonaws.com/prod-ucs-content-store-us-east/content/pii:S1381116999002770/STRIPIN/image/gif/4f69e9ce11b2dc444f6c3418be15371a/si45.gif https://s3-eu-west-1.amazonaws.com/prod-ucs-content-store-eu-west/content/pii:S1381116999002770/STRIPIN/image/gif/4f69e9ce11b2dc444f6c3418be15371a/si45.gif si45 si45.gif gif 5637 61 904 ALTIMG 1-s2.0-S1381116999002770-si44.gif https://s3.amazonaws.com/prod-ucs-content-store-us-east/content/pii:S1381116999002770/STRIPIN/image/gif/b4c89f27c10d5500e26b6e2b44515cc6/si44.gif https://s3-eu-west-1.amazonaws.com/prod-ucs-content-store-eu-west/content/pii:S1381116999002770/STRIPIN/image/gif/b4c89f27c10d5500e26b6e2b44515cc6/si44.gif si44 si44.gif gif 1137 18 308 ALTIMG 1-s2.0-S1381116999002770-si43.gif https://s3.amazonaws.com/prod-ucs-content-store-us-east/content/pii:S1381116999002770/STRIPIN/image/gif/b5a34b96e6de832cc4c558fc2575647a/si43.gif https://s3-eu-west-1.amazonaws.com/prod-ucs-content-store-eu-west/content/pii:S1381116999002770/STRIPIN/image/gif/b5a34b96e6de832cc4c558fc2575647a/si43.gif si43 si43.gif gif 2097 60 280 ALTIMG 1-s2.0-S1381116999002770-si42.gif https://s3.amazonaws.com/prod-ucs-content-store-us-east/content/pii:S1381116999002770/STRIPIN/image/gif/547d628573aa521a369b01a0bedca629/si42.gif https://s3-eu-west-1.amazonaws.com/prod-ucs-content-store-eu-west/content/pii:S1381116999002770/STRIPIN/image/gif/547d628573aa521a369b01a0bedca629/si42.gif si42 si42.gif gif 1766 50 256 ALTIMG 1-s2.0-S1381116999002770-si41.gif https://s3.amazonaws.com/prod-ucs-content-store-us-east/content/pii:S1381116999002770/STRIPIN/image/gif/d80e66bd92737f95c0672ea3793dbc2c/si41.gif https://s3-eu-west-1.amazonaws.com/prod-ucs-content-store-eu-west/content/pii:S1381116999002770/STRIPIN/image/gif/d80e66bd92737f95c0672ea3793dbc2c/si41.gif si41 si41.gif gif 2126 64 313 ALTIMG 1-s2.0-S1381116999002770-si40.gif https://s3.amazonaws.com/prod-ucs-content-store-us-east/content/pii:S1381116999002770/STRIPIN/image/gif/8f301cc6955e4aab85cf531694ba1b6d/si40.gif https://s3-eu-west-1.amazonaws.com/prod-ucs-content-store-eu-west/content/pii:S1381116999002770/STRIPIN/image/gif/8f301cc6955e4aab85cf531694ba1b6d/si40.gif si40 si40.gif gif 1939 55 287 ALTIMG 1-s2.0-S1381116999002770-si4.gif https://s3.amazonaws.com/prod-ucs-content-store-us-east/content/pii:S1381116999002770/STRIPIN/image/gif/fc6a347b5bef63050585169b1006482a/si4.gif https://s3-eu-west-1.amazonaws.com/prod-ucs-content-store-eu-west/content/pii:S1381116999002770/STRIPIN/image/gif/fc6a347b5bef63050585169b1006482a/si4.gif si4 si4.gif gif 1603 19 439 ALTIMG 1-s2.0-S1381116999002770-si39.gif https://s3.amazonaws.com/prod-ucs-content-store-us-east/content/pii:S1381116999002770/STRIPIN/image/gif/9f295fb52f8548fd43cf45a2962fc4cd/si39.gif https://s3-eu-west-1.amazonaws.com/prod-ucs-content-store-eu-west/content/pii:S1381116999002770/STRIPIN/image/gif/9f295fb52f8548fd43cf45a2962fc4cd/si39.gif si39 si39.gif gif 1174 47 184 ALTIMG 1-s2.0-S1381116999002770-si38.gif https://s3.amazonaws.com/prod-ucs-content-store-us-east/content/pii:S1381116999002770/STRIPIN/image/gif/d208de6470bdc6f5adb8d03cd2c77d7e/si38.gif https://s3-eu-west-1.amazonaws.com/prod-ucs-content-store-eu-west/content/pii:S1381116999002770/STRIPIN/image/gif/d208de6470bdc6f5adb8d03cd2c77d7e/si38.gif si38 si38.gif gif 969 47 188 ALTIMG 1-s2.0-S1381116999002770-si37.gif https://s3.amazonaws.com/prod-ucs-content-store-us-east/content/pii:S1381116999002770/STRIPIN/image/gif/eacff6a40309843b334216ec1096543c/si37.gif https://s3-eu-west-1.amazonaws.com/prod-ucs-content-store-eu-west/content/pii:S1381116999002770/STRIPIN/image/gif/eacff6a40309843b334216ec1096543c/si37.gif si37 si37.gif gif 977 47 186 ALTIMG 1-s2.0-S1381116999002770-si36.gif https://s3.amazonaws.com/prod-ucs-content-store-us-east/content/pii:S1381116999002770/STRIPIN/image/gif/8e587634444a1ef31afe61af5c9a708e/si36.gif https://s3-eu-west-1.amazonaws.com/prod-ucs-content-store-eu-west/content/pii:S1381116999002770/STRIPIN/image/gif/8e587634444a1ef31afe61af5c9a708e/si36.gif si36 si36.gif gif 1294 47 305 ALTIMG 1-s2.0-S1381116999002770-si35.gif https://s3.amazonaws.com/prod-ucs-content-store-us-east/content/pii:S1381116999002770/STRIPIN/image/gif/26323ab8821f9b4ba844b71a60730f16/si35.gif https://s3-eu-west-1.amazonaws.com/prod-ucs-content-store-eu-west/content/pii:S1381116999002770/STRIPIN/image/gif/26323ab8821f9b4ba844b71a60730f16/si35.gif si35 si35.gif gif 472 22 100 ALTIMG 1-s2.0-S1381116999002770-si34.gif https://s3.amazonaws.com/prod-ucs-content-store-us-east/content/pii:S1381116999002770/STRIPIN/image/gif/568216e8df95b668691fd78250c050da/si34.gif https://s3-eu-west-1.amazonaws.com/prod-ucs-content-store-eu-west/content/pii:S1381116999002770/STRIPIN/image/gif/568216e8df95b668691fd78250c050da/si34.gif si34 si34.gif gif 1881 52 448 ALTIMG 1-s2.0-S1381116999002770-si33.gif https://s3.amazonaws.com/prod-ucs-content-store-us-east/content/pii:S1381116999002770/STRIPIN/image/gif/2508771bf4b535d43a9c84ad5040ecfa/si33.gif https://s3-eu-west-1.amazonaws.com/prod-ucs-content-store-eu-west/content/pii:S1381116999002770/STRIPIN/image/gif/2508771bf4b535d43a9c84ad5040ecfa/si33.gif si33 si33.gif gif 1674 52 375 ALTIMG 1-s2.0-S1381116999002770-si32.gif https://s3.amazonaws.com/prod-ucs-content-store-us-east/content/pii:S1381116999002770/STRIPIN/image/gif/1bba61354d8e648ae318247f66e33a46/si32.gif https://s3-eu-west-1.amazonaws.com/prod-ucs-content-store-eu-west/content/pii:S1381116999002770/STRIPIN/image/gif/1bba61354d8e648ae318247f66e33a46/si32.gif si32 si32.gif gif 1519 52 360 ALTIMG 1-s2.0-S1381116999002770-si31.gif https://s3.amazonaws.com/prod-ucs-content-store-us-east/content/pii:S1381116999002770/STRIPIN/image/gif/312664c35987c739d37c4a80ed1b8b12/si31.gif https://s3-eu-west-1.amazonaws.com/prod-ucs-content-store-eu-west/content/pii:S1381116999002770/STRIPIN/image/gif/312664c35987c739d37c4a80ed1b8b12/si31.gif si31 si31.gif gif 1383 52 283 ALTIMG 1-s2.0-S1381116999002770-si30.gif https://s3.amazonaws.com/prod-ucs-content-store-us-east/content/pii:S1381116999002770/STRIPIN/image/gif/cc70f8752a3ef8c273139dfb0607545e/si30.gif https://s3-eu-west-1.amazonaws.com/prod-ucs-content-store-eu-west/content/pii:S1381116999002770/STRIPIN/image/gif/cc70f8752a3ef8c273139dfb0607545e/si30.gif si30 si30.gif gif 1126 41 201 ALTIMG 1-s2.0-S1381116999002770-si3.gif https://s3.amazonaws.com/prod-ucs-content-store-us-east/content/pii:S1381116999002770/STRIPIN/image/gif/b4d54c06eef4b964592e561318c3a51e/si3.gif https://s3-eu-west-1.amazonaws.com/prod-ucs-content-store-eu-west/content/pii:S1381116999002770/STRIPIN/image/gif/b4d54c06eef4b964592e561318c3a51e/si3.gif si3 si3.gif gif 2245 19 642 ALTIMG 1-s2.0-S1381116999002770-si29.gif https://s3.amazonaws.com/prod-ucs-content-store-us-east/content/pii:S1381116999002770/STRIPIN/image/gif/c2c80f0844eb33463508a9710cb5864f/si29.gif https://s3-eu-west-1.amazonaws.com/prod-ucs-content-store-eu-west/content/pii:S1381116999002770/STRIPIN/image/gif/c2c80f0844eb33463508a9710cb5864f/si29.gif si29 si29.gif gif 2744 52 624 ALTIMG 1-s2.0-S1381116999002770-si28.gif https://s3.amazonaws.com/prod-ucs-content-store-us-east/content/pii:S1381116999002770/STRIPIN/image/gif/a34d4029ced8c14d854bed7fe479ab81/si28.gif https://s3-eu-west-1.amazonaws.com/prod-ucs-content-store-eu-west/content/pii:S1381116999002770/STRIPIN/image/gif/a34d4029ced8c14d854bed7fe479ab81/si28.gif si28 si28.gif gif 227 14 40 ALTIMG 1-s2.0-S1381116999002770-si27.gif https://s3.amazonaws.com/prod-ucs-content-store-us-east/content/pii:S1381116999002770/STRIPIN/image/gif/5cbea1bb1e94e8487c917959d32a9aca/si27.gif https://s3-eu-west-1.amazonaws.com/prod-ucs-content-store-eu-west/content/pii:S1381116999002770/STRIPIN/image/gif/5cbea1bb1e94e8487c917959d32a9aca/si27.gif si27 si27.gif gif 164 14 21 ALTIMG 1-s2.0-S1381116999002770-si26.gif https://s3.amazonaws.com/prod-ucs-content-store-us-east/content/pii:S1381116999002770/STRIPIN/image/gif/842749f68bb6d3bbb2426dcb4ab90064/si26.gif https://s3-eu-west-1.amazonaws.com/prod-ucs-content-store-eu-west/content/pii:S1381116999002770/STRIPIN/image/gif/842749f68bb6d3bbb2426dcb4ab90064/si26.gif si26 si26.gif gif 164 14 19 ALTIMG 1-s2.0-S1381116999002770-si25.gif https://s3.amazonaws.com/prod-ucs-content-store-us-east/content/pii:S1381116999002770/STRIPIN/image/gif/a4a92cea5b71acc8a10689bec25bcd3d/si25.gif https://s3-eu-west-1.amazonaws.com/prod-ucs-content-store-eu-west/content/pii:S1381116999002770/STRIPIN/image/gif/a4a92cea5b71acc8a10689bec25bcd3d/si25.gif si25 si25.gif gif 217 15 27 ALTIMG 1-s2.0-S1381116999002770-si24.gif https://s3.amazonaws.com/prod-ucs-content-store-us-east/content/pii:S1381116999002770/STRIPIN/image/gif/a4a92cea5b71acc8a10689bec25bcd3d/si25.gif https://s3-eu-west-1.amazonaws.com/prod-ucs-content-store-eu-west/content/pii:S1381116999002770/STRIPIN/image/gif/a4a92cea5b71acc8a10689bec25bcd3d/si25.gif si24 si24.gif gif 217 15 27 ALTIMG 1-s2.0-S1381116999002770-si23.gif https://s3.amazonaws.com/prod-ucs-content-store-us-east/content/pii:S1381116999002770/STRIPIN/image/gif/a4a92cea5b71acc8a10689bec25bcd3d/si25.gif https://s3-eu-west-1.amazonaws.com/prod-ucs-content-store-eu-west/content/pii:S1381116999002770/STRIPIN/image/gif/a4a92cea5b71acc8a10689bec25bcd3d/si25.gif si23 si23.gif gif 217 15 27 ALTIMG 1-s2.0-S1381116999002770-si22.gif https://s3.amazonaws.com/prod-ucs-content-store-us-east/content/pii:S1381116999002770/STRIPIN/image/gif/842749f68bb6d3bbb2426dcb4ab90064/si26.gif https://s3-eu-west-1.amazonaws.com/prod-ucs-content-store-eu-west/content/pii:S1381116999002770/STRIPIN/image/gif/842749f68bb6d3bbb2426dcb4ab90064/si26.gif si22 si22.gif gif 164 14 19 ALTIMG 1-s2.0-S1381116999002770-si21.gif https://s3.amazonaws.com/prod-ucs-content-store-us-east/content/pii:S1381116999002770/STRIPIN/image/gif/842749f68bb6d3bbb2426dcb4ab90064/si26.gif https://s3-eu-west-1.amazonaws.com/prod-ucs-content-store-eu-west/content/pii:S1381116999002770/STRIPIN/image/gif/842749f68bb6d3bbb2426dcb4ab90064/si26.gif si21 si21.gif gif 164 14 19 ALTIMG 1-s2.0-S1381116999002770-si20.gif https://s3.amazonaws.com/prod-ucs-content-store-us-east/content/pii:S1381116999002770/STRIPIN/image/gif/a4a92cea5b71acc8a10689bec25bcd3d/si25.gif https://s3-eu-west-1.amazonaws.com/prod-ucs-content-store-eu-west/content/pii:S1381116999002770/STRIPIN/image/gif/a4a92cea5b71acc8a10689bec25bcd3d/si25.gif si20 si20.gif gif 217 15 27 ALTIMG 1-s2.0-S1381116999002770-si2.gif https://s3.amazonaws.com/prod-ucs-content-store-us-east/content/pii:S1381116999002770/STRIPIN/image/gif/a2a0a9d5470b0516e52cfb3b9de55295/si2.gif https://s3-eu-west-1.amazonaws.com/prod-ucs-content-store-eu-west/content/pii:S1381116999002770/STRIPIN/image/gif/a2a0a9d5470b0516e52cfb3b9de55295/si2.gif si2 si2.gif gif 1305 19 345 ALTIMG 1-s2.0-S1381116999002770-si19.gif https://s3.amazonaws.com/prod-ucs-content-store-us-east/content/pii:S1381116999002770/STRIPIN/image/gif/842749f68bb6d3bbb2426dcb4ab90064/si26.gif https://s3-eu-west-1.amazonaws.com/prod-ucs-content-store-eu-west/content/pii:S1381116999002770/STRIPIN/image/gif/842749f68bb6d3bbb2426dcb4ab90064/si26.gif si19 si19.gif gif 164 14 19 ALTIMG 1-s2.0-S1381116999002770-si18.gif https://s3.amazonaws.com/prod-ucs-content-store-us-east/content/pii:S1381116999002770/STRIPIN/image/gif/842749f68bb6d3bbb2426dcb4ab90064/si26.gif https://s3-eu-west-1.amazonaws.com/prod-ucs-content-store-eu-west/content/pii:S1381116999002770/STRIPIN/image/gif/842749f68bb6d3bbb2426dcb4ab90064/si26.gif si18 si18.gif gif 164 14 19 ALTIMG 1-s2.0-S1381116999002770-si17.gif https://s3.amazonaws.com/prod-ucs-content-store-us-east/content/pii:S1381116999002770/STRIPIN/image/gif/95107cac543ab257ca70b3a10cd7ac4b/si17.gif https://s3-eu-west-1.amazonaws.com/prod-ucs-content-store-eu-west/content/pii:S1381116999002770/STRIPIN/image/gif/95107cac543ab257ca70b3a10cd7ac4b/si17.gif si17 si17.gif gif 2298 21 614 ALTIMG 1-s2.0-S1381116999002770-si16.gif https://s3.amazonaws.com/prod-ucs-content-store-us-east/content/pii:S1381116999002770/STRIPIN/image/gif/da785bf613052575f3da73410fd2b71e/si16.gif https://s3-eu-west-1.amazonaws.com/prod-ucs-content-store-eu-west/content/pii:S1381116999002770/STRIPIN/image/gif/da785bf613052575f3da73410fd2b71e/si16.gif si16 si16.gif gif 1364 19 394 ALTIMG 1-s2.0-S1381116999002770-si15.gif https://s3.amazonaws.com/prod-ucs-content-store-us-east/content/pii:S1381116999002770/STRIPIN/image/gif/aa258a85f575f316ecde938a7dbdece1/si15.gif https://s3-eu-west-1.amazonaws.com/prod-ucs-content-store-eu-west/content/pii:S1381116999002770/STRIPIN/image/gif/aa258a85f575f316ecde938a7dbdece1/si15.gif si15 si15.gif gif 1549 20 407 ALTIMG 1-s2.0-S1381116999002770-si14.gif https://s3.amazonaws.com/prod-ucs-content-store-us-east/content/pii:S1381116999002770/STRIPIN/image/gif/1d731592059911ddffcfc66ed462e1c8/si14.gif https://s3-eu-west-1.amazonaws.com/prod-ucs-content-store-eu-west/content/pii:S1381116999002770/STRIPIN/image/gif/1d731592059911ddffcfc66ed462e1c8/si14.gif si14 si14.gif gif 1512 19 410 ALTIMG 1-s2.0-S1381116999002770-si13.gif https://s3.amazonaws.com/prod-ucs-content-store-us-east/content/pii:S1381116999002770/STRIPIN/image/gif/022f1898c24cf7a9fb13a408294d9b2f/si13.gif https://s3-eu-west-1.amazonaws.com/prod-ucs-content-store-eu-west/content/pii:S1381116999002770/STRIPIN/image/gif/022f1898c24cf7a9fb13a408294d9b2f/si13.gif si13 si13.gif gif 2241 20 613 ALTIMG 1-s2.0-S1381116999002770-si12.gif https://s3.amazonaws.com/prod-ucs-content-store-us-east/content/pii:S1381116999002770/STRIPIN/image/gif/288435ab2a946ab244cd0a1456815fe6/si12.gif https://s3-eu-west-1.amazonaws.com/prod-ucs-content-store-eu-west/content/pii:S1381116999002770/STRIPIN/image/gif/288435ab2a946ab244cd0a1456815fe6/si12.gif si12 si12.gif gif 1496 19 410 ALTIMG 1-s2.0-S1381116999002770-si11.gif https://s3.amazonaws.com/prod-ucs-content-store-us-east/content/pii:S1381116999002770/STRIPIN/image/gif/06dc3b99957b58fdd05efcaba8dccfb4/si11.gif https://s3-eu-west-1.amazonaws.com/prod-ucs-content-store-eu-west/content/pii:S1381116999002770/STRIPIN/image/gif/06dc3b99957b58fdd05efcaba8dccfb4/si11.gif si11 si11.gif gif 2256 20 613 ALTIMG 1-s2.0-S1381116999002770-si10.gif https://s3.amazonaws.com/prod-ucs-content-store-us-east/content/pii:S1381116999002770/STRIPIN/image/gif/3daee0e40400e5f575475bbad2612f4a/si10.gif https://s3-eu-west-1.amazonaws.com/prod-ucs-content-store-eu-west/content/pii:S1381116999002770/STRIPIN/image/gif/3daee0e40400e5f575475bbad2612f4a/si10.gif si10 si10.gif gif 1408 19 410 ALTIMG 1-s2.0-S1381116999002770-si1.gif https://s3.amazonaws.com/prod-ucs-content-store-us-east/content/pii:S1381116999002770/STRIPIN/image/gif/53de10be31c052ba0e50711e02d7cf18/si1.gif https://s3-eu-west-1.amazonaws.com/prod-ucs-content-store-eu-west/content/pii:S1381116999002770/STRIPIN/image/gif/53de10be31c052ba0e50711e02d7cf18/si1.gif si1 si1.gif gif 2212 19 641 ALTIMG 1-s2.0-S1381116999002770-gr1.sml https://s3.amazonaws.com/prod-ucs-content-store-us-east/content/pii:S1381116999002770/gr1/THUMBNAIL/image/gif/29cdc439f6c72a25de8362c5dd38415f/gr1.sml https://s3-eu-west-1.amazonaws.com/prod-ucs-content-store-eu-west/content/pii:S1381116999002770/gr1/THUMBNAIL/image/gif/29cdc439f6c72a25de8362c5dd38415f/gr1.sml gr1 gr1.sml sml 1309 43 125 IMAGE-THUMBNAIL 1-s2.0-S1381116999002770-gr1.gif https://s3.amazonaws.com/prod-ucs-content-store-us-east/content/pii:S1381116999002770/gr1/DOWNSAMPLED/image/gif/975e4df258c2d289fd420deb917a91d0/gr1.gif https://s3-eu-west-1.amazonaws.com/prod-ucs-content-store-eu-west/content/pii:S1381116999002770/gr1/DOWNSAMPLED/image/gif/975e4df258c2d289fd420deb917a91d0/gr1.gif gr1 gr1.gif gif 13531 241 702 IMAGE-DOWNSAMPLED 1-s2.0-S1381116999002770-gr2.sml https://s3.amazonaws.com/prod-ucs-content-store-us-east/content/pii:S1381116999002770/gr2/THUMBNAIL/image/gif/adaebf1a0f09258556e8f92ac4567219/gr2.sml https://s3-eu-west-1.amazonaws.com/prod-ucs-content-store-eu-west/content/pii:S1381116999002770/gr2/THUMBNAIL/image/gif/adaebf1a0f09258556e8f92ac4567219/gr2.sml gr2 gr2.sml sml 913 93 65 IMAGE-THUMBNAIL 1-s2.0-S1381116999002770-gr2.gif https://s3.amazonaws.com/prod-ucs-content-store-us-east/content/pii:S1381116999002770/gr2/DOWNSAMPLED/image/gif/af2e1d9436976b6771907daccebb47b4/gr2.gif https://s3-eu-west-1.amazonaws.com/prod-ucs-content-store-eu-west/content/pii:S1381116999002770/gr2/DOWNSAMPLED/image/gif/af2e1d9436976b6771907daccebb47b4/gr2.gif gr2 gr2.gif gif 24618 883 620 IMAGE-DOWNSAMPLED 1-s2.0-S1381116999002770-gr3.sml https://s3.amazonaws.com/prod-ucs-content-store-us-east/content/pii:S1381116999002770/gr3/THUMBNAIL/image/gif/3f5f8895b7fe3062f1cfc9ae8ac9ad92/gr3.sml https://s3-eu-west-1.amazonaws.com/prod-ucs-content-store-eu-west/content/pii:S1381116999002770/gr3/THUMBNAIL/image/gif/3f5f8895b7fe3062f1cfc9ae8ac9ad92/gr3.sml gr3 gr3.sml sml 1554 76 125 IMAGE-THUMBNAIL 1-s2.0-S1381116999002770-gr3.gif https://s3.amazonaws.com/prod-ucs-content-store-us-east/content/pii:S1381116999002770/gr3/DOWNSAMPLED/image/gif/484bc00347c26b67f7ec60d3ec5fb4a2/gr3.gif https://s3-eu-west-1.amazonaws.com/prod-ucs-content-store-eu-west/content/pii:S1381116999002770/gr3/DOWNSAMPLED/image/gif/484bc00347c26b67f7ec60d3ec5fb4a2/gr3.gif gr3 gr3.gif gif 27242 427 702 IMAGE-DOWNSAMPLED MOLCAA 2409 S1381-1169(99)00277-0 10.1016/S1381-1169(99)00277-0 Elsevier Science B.V. Fig. 1 A schematic illustration of a CH3Ti16Cl47 cluster cut-off from the edge of the basal face of TiCl3 crystalline. Fig. 2 A schematic illustration of models. Fig. 3 Contour maps of PIO-1 and PIO-2 of model systems; (a) Oh-d1(1)/C2H4, (b) Td-d0(5)/C2H4, (c) Td-d1(5)/C2H4 α spin. Table 1 Eigenvalues of PIOs of the ethylene coordinated state of the model systems Model system PIO-1 PIO-2 PIO-3 PIO-4 PIO-5 PIO-6 … PIO-12 Oh-d1(1)/C2H4 0.469 0.159 0.067 0.050 0.037 0.017 … 0.000 Oh-d1(2)/C2H4 0.523 0.155 0.066 0.049 0.039 0.017 … 0.000 Oh-d1(3)/C2H4 0.599 0.155 0.066 0.051 0.039 0.017 … 0.000 Oh-d1(4)/C2H4 0.635 0.157 0.066 0.051 0.041 0.017 … 0.000 Td-d0(5)/C2H4 0.194 0.130 0.051 0.031 0.018 0.013 … 0.000 Td-d1(5)/C2H4; α spin 0.172 0.046 0.013 0.011 0.006 0.004 … 0.000 Td-d1(5)/C2H4; β spin 0.049 0.033 0.013 0.008 0.005 0.003 … 0.000 Table 2 LCAO representation of PIO-1 and PIO-2 of the ethylene coordinated state of the model systems a PIO-1 Oh-d1(1)/C2H4; catalyst part φ1′=−0.215 Tid xy+0.585 Tid xz+0.2410 Tid xy−0.4010 Tid xz−0.4114 Tid yz−0.2817 Tid xz+…, C2H4 part ψ 1′=0.81Cαp x −0.80Cβp x +…, Oh-d1(2)/C2H4; catalyst part φ1′=0.615 Tid xz+0.2410 Tid xy−0.4810 Tid xz+…, C2H4 part ψ 1′=0.81Cαp x −0.80Cβp x +…, Oh-d1(3)/C2H4; catalyst part φ1′=−0.215 Tid xy+0.665 Tid xz+0.2410 Tid xy−0.4110 Tid xz−0.2421 Tid xz−0.2028 Tid xy+…, C2H4 part ψ 1′=0.81Cαp x −0.81Cβp x +…, Oh-d1(4)/C2H4; catalyst part φ1′=0.715 Tid xz+0.2810 Tid xy−0.3510 Tid xz−0.2414 Tid yz+…, C2H4 part ψ 1′=0.82Cαp x −0.81Cβp x +…, Td-d0(5)/C2H4; catalyst part φ1′=−0.745 Tid x2–y2 +0.385 Tid z2 +0.225 Tid xz+0.217 Cp x+0.2116 Cp y−0.2918 Cp y+…, C2H4 part ψ 1′=0.78Cαp x +0.44Cβp x +…, Td-d1(5)/C2H4; α spin, catalyst part φ1′=−0.221 Cp x−0.215 Tid z2 +0.885 Tid xz+0.236 Cp y+…, C2H4 part ψ 1′=0.80Cαp x −0.82Cβp x +…, β spin, almost the same values as those of the Td-d0(5) model system PIO-2 Oh-d1(1)/C2H4; catalyst part φ2′=−0.475 Tid x2–y2 +0.355 Tid z2 +0.296 Cls+0.546 Clp x+0.238 Clp x+0.349 Clp x+…, C2H4 part ψ2′=−0.20Cαs+0.50Cαp x+0.52Cβp x−0.2010 Hs+…, Oh-d1(2)/C2H4; catalyst part φ2′=−0.455 Tid x2–y2 +0.345 Tid z2 +0.316 Cls+0.536 Clp x+0.228 Clp x+0.369 Clp x+…, C2H4 part ψ2′=−0.21Cαs+0.48Cαp x+0.51Cβp x−0.2110 Hs+…, Oh-d1(3)/C2H4; catalyst part φ2′=−0.455 Tid x2–y2 +0.345 Tid z2 +0.316 Cls+0.546 Clp x+0.238 Clp x+0.359 Clp x+…, C2H4 part ψ2′=−0.21Cαs+0.49Cαp x+0.50Cβp x−0.2010 Hs+…, Oh-d1(4)/C2H4; catalyst part φ2′=−0.445 Tid x2–y2 +0.345 Tid z2 +0.316 Cls+0.536 Clp x+0.238 Clp x+0.359 Clp x+…, C2H4 part ψ2′=−0.21Cαs+0.49Cαp x+0.50Cβp x+0.2010 Hs+…, Td-d0(5)/C2H4; catalyst part φ2′=0.561 Cp x−0.481 Cp z−0.222 Hs+0.275 Tid x2–y2 +…, C2H4 part ψ2′=0.49Cαp x−0.78Cβp x−0.2711 Hs−0.2712 Hs+…, Td-d1(5)/C2H4; α spin, catalyst part φ2′=−0.745 Tid x2–y2 +0.445 Tid z2 +0.257 Cp y+0.209 Cp y+0.2411 Cp y−0.2618 Cp y+…, C2H4 part ψ 2′=0.63Cαp x +0.62Cβp x +…, β spin, almost the same values as those of Td-d0(5) model system a A suffix number at the left shoulder of the atomic formula indicates the number of the atomic formula in the models shown in Fig. 2. Table 3 LFO energies, nucleo- and electrophilicity of the methyltitaniums and the RI of ethylene insertion of methyltitaniums/C2H4 systems λ Aocc (eV) λ Aunocc (eV) λ Bocc (eV) λ Bunocc (eV) Nucleophilicity [1/(λ Bunocc −λ Aocc )] Electrophilicity [1/(λ Aunocc −λ Bocc )] RI Oh-d1(1)/C2H4 −10.43 −1.07 −17.54 −8.29 0.472 0.061 1.07 Oh-d1(2)/C2H4 −10.41 0.07 −18.03 −8.30 0.474 0.055 1.06 Oh-d1(3)/C2H4 −10.69 0.46 −18.02 −8.30 0.418 0.054 0.94 Oh-d1(4)/C2H4 −10.34 0.36 −18.02 −8.30 0.490 0.054 1.09 Td-d0(5)/C2H4 −13.32 −8.47 −13.20 −6.65 0.150 0.211 0.72 Td-d1(5)/C2H4; α spin −10.44 −8.23 −13.20 −8.25 0.457 0.201 0.66 Td-d1(5)/C2H4; β spin −13.32 −8.47 −13.20 −6.65 0.150 0.211 0.36 1.02 Table 4 Bond lengths (Å) and bond angles (°) of models Bond length (Å) Bond angle (°) Ti– 1 C a 2.030 1 C –Ti–Cl 90.0 Ti– c Cp b Cl–Ti–Cl 90.0 Ti–Cl 2.220 1 C –Ti–Cα 105.64 Ti–Cα, Cβ 2.510 1 C –Ti– c Cp 105.64 c Cp –Ti– c Cp 123.60 Cα–Cβ 1.350 Ti–Cα–Cβ 74.36 C–C 1.540 Ti– 1 C – 2 H 74.70 C–2 H 1.190 *(1)c–Cα–Cβ 173.40 C–H 1.080 *(2)c–Cα–Cβ 173.40 H–C–H 109.50 H–C–C (in Cp) 108.00 H–Cα, Cβ–H 120.00 a A suffix number at the left shoulder of the atomic fomula indicates the number of the atomic fomula in the models shown in Fig. 2. bCp means a center of Cp ring. c*(1) or *(2) means a middle point of the two hydrogen atoms of the methylene group of the ethylene molecule. Table 5 Extended Hückel parameters Orbital Hii (eV) ζ 1 ζ 2 C1 C2 H1s −13.60 1.30 C2s −21.40 1.625 C2p −11.40 1.625 Cl3s −30.00 2.033 Cl3p −15.00 2.033 Ti4s −8.97 1.075 Ti4p −5.44 0.675 Ti3d −10.81 4.533 1.40 0.4206 0.7389 Theoretical study of ethylene polymerization on Ziegler–Natta catalysts and on metallocene catalysts Akinobu Shiga * Tsukuba Research Laboratory, Sumitomo Chemical, 6 Kitahara, Tsukuba, Ibaraki 300-3294, Japan * Tel.: +81-298-64-4160; fax: +81-298-64-4729; E-mail: shiga@tuc.sumitomo-chem.cp.jp Ethylene insertion on Oh-d1CH3Ti n chloride clusters/C2H4 (model systems of Ziegler–Natta catalysts) and Td-d0,-d1CH3TiCp2/C2H4 (model systems of metallocene catalysts) were studied by using paired interacting orbitals (PIO) analysis and LFO calculation. Electron delocalization from catalytic site to ethylene and that from ethylene to catalytic site played a crucial role in ethylene insertion. The former depends on the nucleophilicity of the active site and the latter on the electrophilicity of the active site. They were quantitatively estimated by LFO calculation. In the case of Oh systems, the electrophilicity of the catalyst decreased because of the Cl anion located trans to the ethylene in the reaction plane. In the case of Td systems, since the electrophilicity was not weakened because of the absence of the trans ligand to the ethylene, the nucleophilicity and electrophilicity were well balanced. The Oh-d1Ti4 cluster could be a suitable model of the active site on the TiCl3 crystalline surface. Keywords Ziegler–Natta catalysts Ethylene Electrophilicity 1 Introduction Highly active Ziegler–Natta catalysts have modernized the manufacturing process of polyolefin. Since the discovery of highly active metallocene catalysts by Kaminsky et al., much interest has been directed to homogeneous catalysts because of their possibilities of producing versatile polymers: syndiotactic polypropylene, syndiotactic polystyrene, ethylene/α-olefin copolymer with very sharp molecular weight distribution, etc. The needs of catalysts which enable to control molecular weight and its distribution, copolymerization ratio, regio- and stereoselectivities, and so on, are increasing more to produce polymers with desirable chemical and physical properties. It may be especially useful to know the difference between the polymerization mechanism on heterogeneous catalysts and that on homogeneous catalysts in order to develop such sophisticated catalysts. Theoretical study of polymerization mechanism is indispensable. As the recent progress in ab initio MO and ab initio MD computational calculations by using not only HF methods but also DF methods, many theoretical studies on polymerization mechanism have been reported [1–14]. From a practical point of view, ab initio calculations are not easy to apply to the large catalytic systems used in industry. In addition, MOs spread over the whole molecular system and, therefore, it is not easy to understand the catalytic interactions between the active site and the olefin molecule. The requirement of a not time-consuming method for analysing the calculated results and predicting the catalytic activities will increase as the catalytic systems become larger in size. Fujimoto et al. [15–18] proposed a method of determining unequivocally the orbitals which should play dominant roles in chemical interactions between two systems. Interactions were represented compactly in terms of a few pairs of localized orbitals. In each orbital pair, one orbital belongs to one fragment species, that is a catalyst, and the other orbitals to the other fragment species, that is a reactant. They called those orbitals “paired interacting orbitals” (PIO). Although this analysis was proposed originally for ab initio calculations, we reported that this approach was also useful in analysing the results of extended Hückel calculations [19–22]. Fujimoto et al. [23, 24] and Omoto et al. [25] also proposed the way of estimating the electrophilicity and nucleophilicity of active sites based on electron delocalization. By using this method, we predicted the reactivities of ethylene insertion into the Ti-methyl bond in d0-methyltitanium complexes [26]. Most of the theoretical studies have been done assuming the model of homogeneous catalysts in which an active site has a tetrahedral (Td) structure. In the case of heterogeneous catalysts, an active site has an octahedral (Oh) structure. In this paper, we study ethylene insertion on Oh-d1CH3Ti n chloride cluster/C2H4 systems, as models of Ziegler–Natta catalysts, and on Td-d0,-d1CH3TiCp2/C2H4 systems, as models of metallocene catalysts, by using PIO analysis and LFO calculation. 2 Methods 2.1 Models Many kinetic, morphological and crystallographic studies of Ziegler–Natta catalysts have revealed that the precursor of an active site is located on the edge of the basal face of violet TiCl3 crystalline surfaces [27–36]. Fig. 1 shows the structure of a CH3Ti16Cl47 cluster which has been removed from the edge of the basal face of the violet TiCl3 crystalline. We employed four numbers of Oh-d1[CH3Ti n Cl3n−1]: (n=4, 6, 8) neutral clusters, as the active site model of heterogeneous catalysts, and Td-d0,-d1[CH3TiCp2] m : (m=1, 0), as the active site model of homogeneous catalysts. They are shown in Fig. 2 . 2.2 PIO analysis We have examined an ethylene coordinated state based on the Cossee insertion mechanism. The geometry optimization technique was not adopted for determining the structures of the ethylene coordinated state of the models. The details of the models are given in Appendix A. We then divided an ethylene coordinated state of model complex (combined system C) into a methyltitanium chloride portion (fragment A) and an ethylene molecule (fragment B). The geometries of [A] and [B] were the same as those in the original complex ([A−B][C]). The MOs of [A], [B] and [C] were calculated by the extended Hückel method. The extended Hückel parameters are given in Appendix A. PIOs were obtained by applying the procedure that was proposed by Fujimoto et al. [15–18]. It is summarized as follows: (1) we expand the MOs of a complex in terms of the MOs of two fragment species, to determine the expansion coefficients c i,f , c m+j,f and d k,f ,d n+l,f in Eq. (1) (1) Φf= ∑ l=1 m ci,fφi+ ∑ j=1 M−m cm+j,fφm+j+ ∑ k=1 n dk,fψk+ ∑ l=1 N−n dn+l,fψn+l,f=1,2,…,m+n, where Φ is a MO of the complex [C], φ and ψ are the MOs of the fragment [A] and fragment [B], respectively, m and n indicate the number of the occupied MOs of A and B, respectively, and M and N represent the number of the MOs of A and B, respectively; (2) we construct an interaction matrix P which represents the interaction between the MOs of the fragment [A] and the MOs of the fragment [B] (2) P = pi,k pi,n+l pm+j,k pm+j,n+l in which pi,k=nt,u ∑ f=1 m+n ci,fdk,f i=l∼m,k=l∼n pi,n+l=nt,u ∑ f=1 m+n ci,fdn+l,f i=1∼m,l=1∼N−n pm+j,k=nt,u ∑ f=1 m+n cm+j,fdk,f j=1∼M−m,k=1∼n pm+j,n+l=nt,u ∑ f=1 m+n cm+j,fdn+l,f j=1∼M−m,l=1∼N−n; (3) we get transformation matrix U A (for A) and U B (for B) by (3) P ̃ PU A = U A Γ (4) U B s,v=(γv)−1/2 ∑ r N pr,s U A r,v v=1,2,…,N and, finally, (4) we obtain the PIOs by Eqs. (5) and (6) (5) φv′= ∑ r N U A r,vφr for A (6) ψv′= ∑ s N U B s,vψs for B The N×M (N≤M) orbital interactions in the complex C can thus be reduced to the interactions of N PIOs, N indicating the smaller of the numbers of MOs of the two fragments, A and B. 2.3 LFO calculation LFO energies were calculated according to the procedure proposed by Fujimoto et al. [23, 24] and Omoto et al. [25]. The reference orbital, which is determined by PIO analysis, denoted here by δ r can be expanded in terms of the occupied MOs φi and the unoccupied MOs φj of a methyltitanium complex (A) (7) δ r = ∑ i occ di,rφi+ ∑ i unocc dj,rφj Then, the occupied and unoccupied orbital that are the closest to δ r are respectively defined by (8) φ occ δ r = ∑ i occ di,rφi / ∑ i occ d2 i,r 1/2 (9) φ unocc δ r = ∑ j unocc dj,rφj / ∑ j unocc d2 j,r 1/2 These orbitals are given by a linear combination of the occupied and unoccupied canonical MOs, respectively, and, therefore, the electron-donating and -accepting strength is evaluated by (10) λ occ δ r = ∑ i occ d2 i,rεi / ∑ i occ d2 i,r (11) λ unocc δ r = ∑ j unocc d2 j,rεj / ∑ j unocc d2 j,r where εi and εj are the orbital energies of the component MOs φi and φj . With the same procedure as described above, we can obtain the electron-donating and -accepting strength of the ethylene molecule (B). Then, a reactivity index (RI) is defined by Eq. (12). (12) RI=1/(λ Aunocc −λ Bocc )+1/(λ Bunocc −λ Aocc ) The first term on the right-hand side estimates the magnitude of electron delocalization from the ethylene molecule (B) to the methyltitanium complex (A) and the second term estimates that from A to B. PIO and LFO calculations were carried out on LUMMOX system [37]. 3 Results and discussion 3.1 PIO analysis Eigenvalues of PIOs in the models, the AO components of PIO-1 and PIO-2 are summarized in Table 1 Table 2 , respectively. Contour maps of PIO-1 and PIO-2 of the models are shown in Fig. 3 . We obtained 12 PIOs, PIO-1 to PIO-12. The eigenvalues tell us that PIO-1 and PIO-2 have much larger contribution to the interaction relative to 10 other orbital pairs. This is reasonable, because two bonds are formed in the insertion process. We examine PIO-1 and PIO-2 precisely. 3.2 Oh-d1methyltitanium chloride cluster/ethylene systems Table 2 tells us that the main component of the ethylene part of PIO-1 is the π* orbital in all the Oh-d1 model systems. This signifies that PIO-1 represents electron delocalization from the occupied orbitals of the catalyst part which are mainly composed of the Tid(t2g) orbitals (see Table 2), to the ethylene π* orbital: that is back-donation. On the other, the main components of the ethylene part of PIO-2 are the π orbital and some few other occupied orbitals, and the main components of the catalyst part of PIO-2 are the mixtures of some unoccupied orbitals and some occupied orbitals in all the Oh-d1 model systems. This indicates that PIO-2 represents electron delocalization from the ethylene π orbital to the unoccupied orbitals of the catalyst part which are composed of Tid(eg) orbitals: that is donation, but a repulsive interaction intervenes between the occupied C2s and H1s orbitals of ethylene and the occupied Cl3p orbitals of the catalyst. These results are compactly shown with the contour maps of PIO-1 and PIO-2 of the model systems. One example is shown in Fig. 3(a). 3.3 Td-d0[CH3TiCp2]+1/C2H4 system The main component of the ethylene part of PIO-1 of the Td-d0(5)/C2H4 system is the π orbital and the main components of the catalyst part of PIO-1 are the unoccupied orbitals which are mainly composed of the Tid(eg) orbitals. In contrast, the main components of the ethylene part of PIO-2 of this system are the π* orbital and some few other occupied orbitals and the main components of the catalyst part of PIO-2 are the occupied orbitals which mainly composed of the methyl Cp orbitals and Tid(eg) orbitals. In the case of Td-d0(5)/C2H4 system, main interaction is electron delocalization from the ethylene to the catalyst: that is donation, and subsidiary one is electron delocalization from the catalyst to the ethylene: that is back-donation. Contour maps of PIO-1 and PIO-2 of Td-d0(5)/C2H4 system are shown in Fig. 3(b). 3.4 Td-d1[CH3TiCp2]/C2H4 system 3.4.1 α spin system The main component of the ethylene part of PIO-1 of the Td-d1(5)/C2H4 system is the π* orbital and the main components of the catalyst part are the occupied orbitals which are composed of the mixture of the Cp orbitals of the methyl group, the Tid orbitals and the Cp orbitals of the Cp group. The PIO-1 of this model system represents electron delocalization from the catalyst to the ethylene molecule: this is also back-donation. The main component of the ethylene part of PIO-2 of this model system is π* orbital and the main components of the catalyst part are the unoccupied Tid(eg) orbitals. The PIO-2 indicates electron delocalization from the ethylene molecule to the catalyst: this is donation. Contour maps of PIO-1 and PIO-2 of Td-d1(5)/C2H4 system; (α spin), are shown in Fig. 3(c). 3.4.2 β spin system The PIOs of the β spin system of Td-d1(5)/C2H4 system are almost the same PIOs as those of Td-d0(5)/C2H4 system. From the discussions described above, we can conclude that electron delocalization from the catalyst to the ethylene molecule and that from the ethylene molecule to the catalyst play crucial roles in ethylene insertion. The former depends on the nucleophilicity (electron donability) of the catalytic site and the latter depends on the electrophilicity (electron acceptability) of the catalytic site. The next thing to do is to estimate the strength of the nucleo- and electrophilicity of the catalyst quantitatively by using the LFO scheme. 3.5 RI of the model systems According to the results of the PIO analysis on the model systems described above, we determined a reference orbital δ r. We show reference orbitals of the Oh-d1(1)/C2H4 system for an example. Four reference orbitals are determined as follows:for the occupied orbital space of the catalyst; (δ r ) Aocc =−0.161 Cp z−0.215 Tid xy+0.585 Tid xz+0.145 Tid yz−0.119 Clp z+0.2410 Tid xy−0.4010 Tid xz−0.1511 Clp x+0.1111 Clp z−0.1213 Clp z−0.1214 Tid xy−0.1314 Tid xz−0.4114 Tid yz+0.1515 Clp y−0.2817 Tid xz+0.1517 Tid yz, 1 A suffix number at the left shoulder of the atomic formula indicates the number of the atomic formula in the models shown in Fig. 2. 1 for the unoccupied orbital space; (δ r ) Aunocc =0.181 Cp x−0.115 Tis+0.125 Tip x−0.475 Tid z2 +0.296 Cls+0.546 Clp x−0.166 Clp y+0.117 Clp x+0.167 Clp y+0.238 Clp x+0.119 Cls+0.349 Clp x+0.1310 Tip y+0.1110 Tip z+0.1614 Tis−0.1414 Tip y−0.1614 Tid x2–y2 −0.1414 Tid xy, for the occupied orbital space of the ethylene; (δ r ) Bocc =−0.20Cα s+0.50Cα p x−0.15Cβ s+0.52Cβ p x−0.179 Hs−0.2010 Hs−0.1411 Hs−0.1312 Hs, for the unoccupied orbital space;(δ r ) Bunocc =0.81Cα p x−0.80Cβ p x+0.109 Hs−0.1112 Hs. LFO energies, nucleo- and electrophilicity of the methyltitaniums and the RI for the ethylene insertion are summarized in Table 3 . The differences of these values are not large in the Oh-d1(1)–(4)/C2H4 systems. It can be sufficient to employ Oh-d1methyltitanium chloride cluster(1) as a model of the active site of the TiCl3 catalyst. It is also observed in the case of Oh-d1methyltianium complexes that the nucleophilicity is markedly large in comparison with the electrophilicity. The decrease of the electrophilicity is caused by the Cl anion located trans to the coordinated ethylene molecule. This is a characteristic feature of the Oh structure of the model systems. In the case of Td systems (metallocene type catalysts), since the electrophilicity of the catalyst is not weakened because of the absence of the Cl anion located trans to the ethylene molecule the nucleophilicity and the electrophilicity of the catalyst are well balanced. RI of the Td-d1 system is large in comparison with that of the Td-d0 system owing to the contribution of the nucleophilicity of the spin part of the Td-d1 system. The RI of the Td-d1 system and those of the Oh-d1 systems are almost the same, however further investigation is needed as for the comparison between the real catalytic activities of them because the balance of the nucleophilicity and the electrophilicity of both systems is rather different. 4 Conclusion The difference between the structure of the Oh and Td model systems is that in the former system there are two ligands (two Cl anions) in the ethylene insertion plane, which is composed of the Ti atom, the carbon atom of the methyl group and two carbon atoms of the ethylene, whereas in the latter, none of the ligands is located in the plane. Since a ligand located trans to the ethylene in the insertion plane decreases the electrophilicity of the catalyst, the driving force of the ethylene insertion mainly depends on the Ti3d electron delocalization to the ethylene in the Oh model systems. On the other hand, disappearing such a limitation, mutual electron delocalizations are well balanced in the Td model systems. By using LFO calculations based on PIO analysis we can estimate the electrophilicity and the nucleophilicity of the catalyst and can predict the RI of the ethylene insertion. Finally, we mention stereospecificity of the catalyst. The origin of the stereospecificity of the Td model systems comes from c 2 symmetry structure of the models. On the other, the Oh model systems belong to c 1 symmetry structure. In addition, both of a position for the ethylene coordination and a route of the ethylene to the position are restricted to only one in the Oh systems. The Oh systems are favorable to give isotactic polymers. Acknowledgements We thank Professor H. Fujimoto for helpful advice and Sumitomo Chemical for permission to publish. Appendix A Geometrical parameters of models are given in Table 4 . Coulomb integrals and orbital exponents are listed in Table 5 . References 1 H. Kawamura-Kuribayashi N. Koga K. Morokuma J. Am. Chem. Soc. 114 1992 2359 2 H. Kawamura-Kuribayashi N. Koga K. Morokuma J. Am. Chem. Soc. 114 1992 8687 3 T. Yoshida N. Koga K. Morokuma Organometallics 14 1995 746 4 T. Yoshida N. Koga K. Morokuma Organometallics 15 1996 766 5 R.D.J. Froese D.G. Musaev T. Matsubara K. Morokuma J. Am. Chem. Soc. 119 1997 7190 6 J.C.W. Lohrenz T.K. Woo T. Ziegler J. Organomet. Chem. 497 1995 91 7 J.C.W. Lohrenz T.K. Woo T. Ziegler J. Am. Chem. Soc. 117 1995 12793 8 L. Fan D. Harrison T.K. Woo T. Ziegler Organometallics 14 1995 2018 9 D.G. Musaev R.D.J. Froese M. Svensson K. Morokuma J. Am. Chem. Soc. 119 1997 367 10 D.G. Musaev M. Svensson K. Morokuma S. Strömberg K. Zetterberg P.E.M. Siegbahn Organometallics 1997 1933 16 11 M.H. Prosenc H.H. Brintzinger Organometallics 16 1997 3889 12 P. Margl J.C.W. Lohrenz T. Ziegler P.E. Blöchl J. Am. Chem. Soc. 118 1996 4434 13 T.K. Woo P.M. Margl T. Ziegler P.E. Blöchl Organometallics 16 1997 3454 14 M. Boero M. Parrinello K. Terakura J. Am. Chem. Soc. 120 1998 2746 15 H. Fujimoto N. Koga K. Fukui J. Am. Chem. Soc. 103 1981 7452 16 H. Fujimoto N. Koga I. Hataue J. Phys. Chem. 88 1984 3539 17 H. Fujimoto T. Yamasaki H. Mizutani N. Koga J. Am. Chem. Soc. 107 1985 6157 18 H. Fujimoto Acc. Chem. Res. 20 1987 448 19 A. Shiga H. Kawamura T. Ebara T. Sasaki Y. Kikuzono J. Organomet. Chem. 366 1989 95 20 A. Shiga H. Kawamura-Kuribayashi T. Sasaki J. Mol. Catal. 77 1992 135 21 A. Shiga H. Kawamura-Kuribayashi T. Sasaki J. Mol. Catal. 79 1993 95 22 A. Shiga H. Kawamura-Kuribayashi T. Sasaki J. Mol. Catal. 87 1994 243 23 H. Fujimoto Y. Mizutani K. Iwase J. Phys. Chem. 90 1986 2768 24 H. Fujimoto K. Hatakeyama S. Kawasaki Y. Oishi J. Chem. Soc., Perkin Trans. 2 1991 989 25 K. Omoto Y. Sawada H. Fujimoto J. Am. Chem. Soc. 118 1996 1751 26 A. Shiga J. Macromol. Sci. A34 1997 1867 27 G. Natta J. Polym. Sci. 34 1959 21 28 T. Keii, Kinetics of Ziegler–Natta Polymerization, Kodansha, Tokyo, 1972. 29 J. Boor Jr., Ziegler–Natta Catalysts and Polymerization, Academic Press, New York, 1979. 30 G. Natta P. Corradini G. Allegra J. Polym. Sci. 51 1961 399 31 L.A.M. Rodriguez H.M. van Looy J.A. Gabant J. Polym. Sci. A1 4 1966 1905 32 L.A.M. Rodriguez H.M. van Looy J.A. Gabant J. Polym. Sci. A1 4 1966 1917 33 H.M. van Looy L.A.M. Rodriguez J.A. Gabant J. Polym. Sci. A1 4 1966 1927 34 L.A.M. Rodriguez H.M. van Looy J. Polym. Sci. A1 4 1966 1951 35 L.A.M. Rodriguez H.M. van Looy J. Polym. Sci. A1 4 1966 1971 36 Z.W. Wilchinsky R.W. Looney E.G.M. Tornqvist J. Catal. 28 1973 351 37 H. Katsumi Y. Kikuzono M. Yoshida A. Shiga H. Fujimoto Chem. Info. Comp. Sci. (Jpn.) 12 1989 72 Preprint",
      "scopus-id": "0033589313",
      "coredata": {
        "eid": "1-s2.0-S1381116999002770",
        "dc:description": "Ethylene insertion on Oh-d1CH3Ti n chloride clusters/C2H4 (model systems of Ziegler–Natta catalysts) and Td-d0,-d1CH3TiCp2/C2H4 (model systems of metallocene catalysts) were studied by using paired interacting orbitals (PIO) analysis and LFO calculation. Electron delocalization from catalytic site to ethylene and that from ethylene to catalytic site played a crucial role in ethylene insertion. The former depends on the nucleophilicity of the active site and the latter on the electrophilicity of the active site. They were quantitatively estimated by LFO calculation. In the case of Oh systems, the electrophilicity of the catalyst decreased because of the Cl anion located trans to the ethylene in the reaction plane. In the case of Td systems, since the electrophilicity was not weakened because of the absence of the trans ligand to the ethylene, the nucleophilicity and electrophilicity were well balanced. The Oh-d1Ti4 cluster could be a suitable model of the active site on the TiCl3 crystalline surface.",
        "openArchiveArticle": "false",
        "prism:coverDate": "1999-10-20",
        "openaccessUserLicense": null,
        "prism:aggregationType": "Journal",
        "prism:url": "https://api.elsevier.com/content/article/pii/S1381116999002770",
        "dc:creator": {
          "@_fa": "true",
          "$": "Shiga, Akinobu"
        },
        "link": [
          {
            "@_fa": "true",
            "@rel": "self",
            "@href": "https://api.elsevier.com/content/article/pii/S1381116999002770"
          },
          {
            "@_fa": "true",
            "@rel": "scidir",
            "@href": "https://www.sciencedirect.com/science/article/pii/S1381116999002770"
          }
        ],
        "dc:format": "application/json",
        "openaccessType": null,
        "pii": "S1381-1169(99)00277-0",
        "prism:volume": "146",
        "prism:publisher": "Elsevier Science B.V.",
        "dc:title": "Theoretical study of ethylene polymerization on Ziegler–Natta catalysts and on metallocene catalysts",
        "prism:copyright": "Copyright © 1999 Elsevier Science B.V. All rights reserved.",
        "openaccess": "0",
        "prism:issn": "13811169",
        "prism:issueIdentifier": "1-2",
        "dcterms:subject": [
          {
            "@_fa": "true",
            "$": "Ziegler–Natta catalysts"
          },
          {
            "@_fa": "true",
            "$": "Ethylene"
          },
          {
            "@_fa": "true",
            "$": "Electrophilicity"
          }
        ],
        "openaccessArticle": "false",
        "prism:publicationName": "Journal of Molecular Catalysis A: Chemical",
        "prism:number": "1-2",
        "openaccessSponsorType": null,
        "prism:pageRange": "325-334",
        "prism:endingPage": "334",
        "pubType": "fla",
        "prism:coverDisplayDate": "20 October 1999",
        "prism:doi": "10.1016/S1381-1169(99)00277-0",
        "prism:startingPage": "325",
        "dc:identifier": "doi:10.1016/S1381-1169(99)00277-0",
        "openaccessSponsorName": null
      },
      "objects": {
        "object": [
          {
            "@category": "thumbnail",
            "@height": "20",
            "@width": "613",
            "@_fa": "true",
            "$": "https://api.elsevier.com/content/object/eid/1-s2.0-S1381116999002770-si9.gif?httpAccept=%2A%2F%2A",
            "@multimediatype": "GIF image file",
            "@type": "ALTIMG",
            "@size": "2260",
            "@ref": "si9",
            "@mimetype": "image/gif"
          },
          {
            "@category": "thumbnail",
            "@height": "19",
            "@width": "410",
            "@_fa": "true",
            "$": "https://api.elsevier.com/content/object/eid/1-s2.0-S1381116999002770-si8.gif?httpAccept=%2A%2F%2A",
            "@multimediatype": "GIF image file",
            "@type": "ALTIMG",
            "@size": "1540",
            "@ref": "si8",
            "@mimetype": "image/gif"
          },
          {
            "@category": "thumbnail",
            "@height": "20",
            "@width": "613",
            "@_fa": "true",
            "$": "https://api.elsevier.com/content/object/eid/1-s2.0-S1381116999002770-si7.gif?httpAccept=%2A%2F%2A",
            "@multimediatype": "GIF image file",
            "@type": "ALTIMG",
            "@size": "2273",
            "@ref": "si7",
            "@mimetype": "image/gif"
          },
          {
            "@category": "thumbnail",
            "@height": "21",
            "@width": "425",
            "@_fa": "true",
            "$": "https://api.elsevier.com/content/object/eid/1-s2.0-S1381116999002770-si6.gif?httpAccept=%2A%2F%2A",
            "@multimediatype": "GIF image file",
            "@type": "ALTIMG",
            "@size": "1608",
            "@ref": "si6",
            "@mimetype": "image/gif"
          },
          {
            "@category": "thumbnail",
            "@height": "21",
            "@width": "622",
            "@_fa": "true",
            "$": "https://api.elsevier.com/content/object/eid/1-s2.0-S1381116999002770-si5.gif?httpAccept=%2A%2F%2A",
            "@multimediatype": "GIF image file",
            "@type": "ALTIMG",
            "@size": "2183",
            "@ref": "si5",
            "@mimetype": "image/gif"
          },
          {
            "@category": "thumbnail",
            "@height": "19",
            "@width": "395",
            "@_fa": "true",
            "$": "https://api.elsevier.com/content/object/eid/1-s2.0-S1381116999002770-si48.gif?httpAccept=%2A%2F%2A",
            "@multimediatype": "GIF image file",
            "@type": "ALTIMG",
            "@size": "1512",
            "@ref": "si48",
            "@mimetype": "image/gif"
          },
          {
            "@category": "thumbnail",
            "@height": "21",
            "@width": "732",
            "@_fa": "true",
            "$": "https://api.elsevier.com/content/object/eid/1-s2.0-S1381116999002770-si47.gif?httpAccept=%2A%2F%2A",
            "@multimediatype": "GIF image file",
            "@type": "ALTIMG",
            "@size": "2526",
            "@ref": "si47",
            "@mimetype": "image/gif"
          },
          {
            "@category": "thumbnail",
            "@height": "62",
            "@width": "929",
            "@_fa": "true",
            "$": "https://api.elsevier.com/content/object/eid/1-s2.0-S1381116999002770-si46.gif?httpAccept=%2A%2F%2A",
            "@multimediatype": "GIF image file",
            "@type": "ALTIMG",
            "@size": "6127",
            "@ref": "si46",
            "@mimetype": "image/gif"
          },
          {
            "@category": "thumbnail",
            "@height": "61",
            "@width": "904",
            "@_fa": "true",
            "$": "https://api.elsevier.com/content/object/eid/1-s2.0-S1381116999002770-si45.gif?httpAccept=%2A%2F%2A",
            "@multimediatype": "GIF image file",
            "@type": "ALTIMG",
            "@size": "5637",
            "@ref": "si45",
            "@mimetype": "image/gif"
          },
          {
            "@category": "thumbnail",
            "@height": "18",
            "@width": "308",
            "@_fa": "true",
            "$": "https://api.elsevier.com/content/object/eid/1-s2.0-S1381116999002770-si44.gif?httpAccept=%2A%2F%2A",
            "@multimediatype": "GIF image file",
            "@type": "ALTIMG",
            "@size": "1137",
            "@ref": "si44",
            "@mimetype": "image/gif"
          },
          {
            "@category": "thumbnail",
            "@height": "60",
            "@width": "280",
            "@_fa": "true",
            "$": "https://api.elsevier.com/content/object/eid/1-s2.0-S1381116999002770-si43.gif?httpAccept=%2A%2F%2A",
            "@multimediatype": "GIF image file",
            "@type": "ALTIMG",
            "@size": "2097",
            "@ref": "si43",
            "@mimetype": "image/gif"
          },
          {
            "@category": "thumbnail",
            "@height": "50",
            "@width": "256",
            "@_fa": "true",
            "$": "https://api.elsevier.com/content/object/eid/1-s2.0-S1381116999002770-si42.gif?httpAccept=%2A%2F%2A",
            "@multimediatype": "GIF image file",
            "@type": "ALTIMG",
            "@size": "1766",
            "@ref": "si42",
            "@mimetype": "image/gif"
          },
          {
            "@category": "thumbnail",
            "@height": "64",
            "@width": "313",
            "@_fa": "true",
            "$": "https://api.elsevier.com/content/object/eid/1-s2.0-S1381116999002770-si41.gif?httpAccept=%2A%2F%2A",
            "@multimediatype": "GIF image file",
            "@type": "ALTIMG",
            "@size": "2126",
            "@ref": "si41",
            "@mimetype": "image/gif"
          },
          {
            "@category": "thumbnail",
            "@height": "55",
            "@width": "287",
            "@_fa": "true",
            "$": "https://api.elsevier.com/content/object/eid/1-s2.0-S1381116999002770-si40.gif?httpAccept=%2A%2F%2A",
            "@multimediatype": "GIF image file",
            "@type": "ALTIMG",
            "@size": "1939",
            "@ref": "si40",
            "@mimetype": "image/gif"
          },
          {
            "@category": "thumbnail",
            "@height": "19",
            "@width": "439",
            "@_fa": "true",
            "$": "https://api.elsevier.com/content/object/eid/1-s2.0-S1381116999002770-si4.gif?httpAccept=%2A%2F%2A",
            "@multimediatype": "GIF image file",
            "@type": "ALTIMG",
            "@size": "1603",
            "@ref": "si4",
            "@mimetype": "image/gif"
          },
          {
            "@category": "thumbnail",
            "@height": "47",
            "@width": "184",
            "@_fa": "true",
            "$": "https://api.elsevier.com/content/object/eid/1-s2.0-S1381116999002770-si39.gif?httpAccept=%2A%2F%2A",
            "@multimediatype": "GIF image file",
            "@type": "ALTIMG",
            "@size": "1174",
            "@ref": "si39",
            "@mimetype": "image/gif"
          },
          {
            "@category": "thumbnail",
            "@height": "47",
            "@width": "188",
            "@_fa": "true",
            "$": "https://api.elsevier.com/content/object/eid/1-s2.0-S1381116999002770-si38.gif?httpAccept=%2A%2F%2A",
            "@multimediatype": "GIF image file",
            "@type": "ALTIMG",
            "@size": "969",
            "@ref": "si38",
            "@mimetype": "image/gif"
          },
          {
            "@category": "thumbnail",
            "@height": "47",
            "@width": "186",
            "@_fa": "true",
            "$": "https://api.elsevier.com/content/object/eid/1-s2.0-S1381116999002770-si37.gif?httpAccept=%2A%2F%2A",
            "@multimediatype": "GIF image file",
            "@type": "ALTIMG",
            "@size": "977",
            "@ref": "si37",
            "@mimetype": "image/gif"
          },
          {
            "@category": "thumbnail",
            "@height": "47",
            "@width": "305",
            "@_fa": "true",
            "$": "https://api.elsevier.com/content/object/eid/1-s2.0-S1381116999002770-si36.gif?httpAccept=%2A%2F%2A",
            "@multimediatype": "GIF image file",
            "@type": "ALTIMG",
            "@size": "1294",
            "@ref": "si36",
            "@mimetype": "image/gif"
          },
          {
            "@category": "thumbnail",
            "@height": "22",
            "@width": "100",
            "@_fa": "true",
            "$": "https://api.elsevier.com/content/object/eid/1-s2.0-S1381116999002770-si35.gif?httpAccept=%2A%2F%2A",
            "@multimediatype": "GIF image file",
            "@type": "ALTIMG",
            "@size": "472",
            "@ref": "si35",
            "@mimetype": "image/gif"
          },
          {
            "@category": "thumbnail",
            "@height": "52",
            "@width": "448",
            "@_fa": "true",
            "$": "https://api.elsevier.com/content/object/eid/1-s2.0-S1381116999002770-si34.gif?httpAccept=%2A%2F%2A",
            "@multimediatype": "GIF image file",
            "@type": "ALTIMG",
            "@size": "1881",
            "@ref": "si34",
            "@mimetype": "image/gif"
          },
          {
            "@category": "thumbnail",
            "@height": "52",
            "@width": "375",
            "@_fa": "true",
            "$": "https://api.elsevier.com/content/object/eid/1-s2.0-S1381116999002770-si33.gif?httpAccept=%2A%2F%2A",
            "@multimediatype": "GIF image file",
            "@type": "ALTIMG",
            "@size": "1674",
            "@ref": "si33",
            "@mimetype": "image/gif"
          },
          {
            "@category": "thumbnail",
            "@height": "52",
            "@width": "360",
            "@_fa": "true",
            "$": "https://api.elsevier.com/content/object/eid/1-s2.0-S1381116999002770-si32.gif?httpAccept=%2A%2F%2A",
            "@multimediatype": "GIF image file",
            "@type": "ALTIMG",
            "@size": "1519",
            "@ref": "si32",
            "@mimetype": "image/gif"
          },
          {
            "@category": "thumbnail",
            "@height": "52",
            "@width": "283",
            "@_fa": "true",
            "$": "https://api.elsevier.com/content/object/eid/1-s2.0-S1381116999002770-si31.gif?httpAccept=%2A%2F%2A",
            "@multimediatype": "GIF image file",
            "@type": "ALTIMG",
            "@size": "1383",
            "@ref": "si31",
            "@mimetype": "image/gif"
          },
          {
            "@category": "thumbnail",
            "@height": "41",
            "@width": "201",
            "@_fa": "true",
            "$": "https://api.elsevier.com/content/object/eid/1-s2.0-S1381116999002770-si30.gif?httpAccept=%2A%2F%2A",
            "@multimediatype": "GIF image file",
            "@type": "ALTIMG",
            "@size": "1126",
            "@ref": "si30",
            "@mimetype": "image/gif"
          },
          {
            "@category": "thumbnail",
            "@height": "19",
            "@width": "642",
            "@_fa": "true",
            "$": "https://api.elsevier.com/content/object/eid/1-s2.0-S1381116999002770-si3.gif?httpAccept=%2A%2F%2A",
            "@multimediatype": "GIF image file",
            "@type": "ALTIMG",
            "@size": "2245",
            "@ref": "si3",
            "@mimetype": "image/gif"
          },
          {
            "@category": "thumbnail",
            "@height": "52",
            "@width": "624",
            "@_fa": "true",
            "$": "https://api.elsevier.com/content/object/eid/1-s2.0-S1381116999002770-si29.gif?httpAccept=%2A%2F%2A",
            "@multimediatype": "GIF image file",
            "@type": "ALTIMG",
            "@size": "2744",
            "@ref": "si29",
            "@mimetype": "image/gif"
          },
          {
            "@category": "thumbnail",
            "@height": "14",
            "@width": "40",
            "@_fa": "true",
            "$": "https://api.elsevier.com/content/object/eid/1-s2.0-S1381116999002770-si28.gif?httpAccept=%2A%2F%2A",
            "@multimediatype": "GIF image file",
            "@type": "ALTIMG",
            "@size": "227",
            "@ref": "si28",
            "@mimetype": "image/gif"
          },
          {
            "@category": "thumbnail",
            "@height": "14",
            "@width": "21",
            "@_fa": "true",
            "$": "https://api.elsevier.com/content/object/eid/1-s2.0-S1381116999002770-si27.gif?httpAccept=%2A%2F%2A",
            "@multimediatype": "GIF image file",
            "@type": "ALTIMG",
            "@size": "164",
            "@ref": "si27",
            "@mimetype": "image/gif"
          },
          {
            "@category": "thumbnail",
            "@height": "14",
            "@width": "19",
            "@_fa": "true",
            "$": "https://api.elsevier.com/content/object/eid/1-s2.0-S1381116999002770-si26.gif?httpAccept=%2A%2F%2A",
            "@multimediatype": "GIF image file",
            "@type": "ALTIMG",
            "@size": "164",
            "@ref": "si26",
            "@mimetype": "image/gif"
          },
          {
            "@category": "thumbnail",
            "@height": "15",
            "@width": "27",
            "@_fa": "true",
            "$": "https://api.elsevier.com/content/object/eid/1-s2.0-S1381116999002770-si25.gif?httpAccept=%2A%2F%2A",
            "@multimediatype": "GIF image file",
            "@type": "ALTIMG",
            "@size": "217",
            "@ref": "si25",
            "@mimetype": "image/gif"
          },
          {
            "@category": "thumbnail",
            "@height": "15",
            "@width": "27",
            "@_fa": "true",
            "$": "https://api.elsevier.com/content/object/eid/1-s2.0-S1381116999002770-si24.gif?httpAccept=%2A%2F%2A",
            "@multimediatype": "GIF image file",
            "@type": "ALTIMG",
            "@size": "217",
            "@ref": "si24",
            "@mimetype": "image/gif"
          },
          {
            "@category": "thumbnail",
            "@height": "15",
            "@width": "27",
            "@_fa": "true",
            "$": "https://api.elsevier.com/content/object/eid/1-s2.0-S1381116999002770-si23.gif?httpAccept=%2A%2F%2A",
            "@multimediatype": "GIF image file",
            "@type": "ALTIMG",
            "@size": "217",
            "@ref": "si23",
            "@mimetype": "image/gif"
          },
          {
            "@category": "thumbnail",
            "@height": "14",
            "@width": "19",
            "@_fa": "true",
            "$": "https://api.elsevier.com/content/object/eid/1-s2.0-S1381116999002770-si22.gif?httpAccept=%2A%2F%2A",
            "@multimediatype": "GIF image file",
            "@type": "ALTIMG",
            "@size": "164",
            "@ref": "si22",
            "@mimetype": "image/gif"
          },
          {
            "@category": "thumbnail",
            "@height": "14",
            "@width": "19",
            "@_fa": "true",
            "$": "https://api.elsevier.com/content/object/eid/1-s2.0-S1381116999002770-si21.gif?httpAccept=%2A%2F%2A",
            "@multimediatype": "GIF image file",
            "@type": "ALTIMG",
            "@size": "164",
            "@ref": "si21",
            "@mimetype": "image/gif"
          },
          {
            "@category": "thumbnail",
            "@height": "15",
            "@width": "27",
            "@_fa": "true",
            "$": "https://api.elsevier.com/content/object/eid/1-s2.0-S1381116999002770-si20.gif?httpAccept=%2A%2F%2A",
            "@multimediatype": "GIF image file",
            "@type": "ALTIMG",
            "@size": "217",
            "@ref": "si20",
            "@mimetype": "image/gif"
          },
          {
            "@category": "thumbnail",
            "@height": "19",
            "@width": "345",
            "@_fa": "true",
            "$": "https://api.elsevier.com/content/object/eid/1-s2.0-S1381116999002770-si2.gif?httpAccept=%2A%2F%2A",
            "@multimediatype": "GIF image file",
            "@type": "ALTIMG",
            "@size": "1305",
            "@ref": "si2",
            "@mimetype": "image/gif"
          },
          {
            "@category": "thumbnail",
            "@height": "14",
            "@width": "19",
            "@_fa": "true",
            "$": "https://api.elsevier.com/content/object/eid/1-s2.0-S1381116999002770-si19.gif?httpAccept=%2A%2F%2A",
            "@multimediatype": "GIF image file",
            "@type": "ALTIMG",
            "@size": "164",
            "@ref": "si19",
            "@mimetype": "image/gif"
          },
          {
            "@category": "thumbnail",
            "@height": "14",
            "@width": "19",
            "@_fa": "true",
            "$": "https://api.elsevier.com/content/object/eid/1-s2.0-S1381116999002770-si18.gif?httpAccept=%2A%2F%2A",
            "@multimediatype": "GIF image file",
            "@type": "ALTIMG",
            "@size": "164",
            "@ref": "si18",
            "@mimetype": "image/gif"
          },
          {
            "@category": "thumbnail",
            "@height": "21",
            "@width": "614",
            "@_fa": "true",
            "$": "https://api.elsevier.com/content/object/eid/1-s2.0-S1381116999002770-si17.gif?httpAccept=%2A%2F%2A",
            "@multimediatype": "GIF image file",
            "@type": "ALTIMG",
            "@size": "2298",
            "@ref": "si17",
            "@mimetype": "image/gif"
          },
          {
            "@category": "thumbnail",
            "@height": "19",
            "@width": "394",
            "@_fa": "true",
            "$": "https://api.elsevier.com/content/object/eid/1-s2.0-S1381116999002770-si16.gif?httpAccept=%2A%2F%2A",
            "@multimediatype": "GIF image file",
            "@type": "ALTIMG",
            "@size": "1364",
            "@ref": "si16",
            "@mimetype": "image/gif"
          },
          {
            "@category": "thumbnail",
            "@height": "20",
            "@width": "407",
            "@_fa": "true",
            "$": "https://api.elsevier.com/content/object/eid/1-s2.0-S1381116999002770-si15.gif?httpAccept=%2A%2F%2A",
            "@multimediatype": "GIF image file",
            "@type": "ALTIMG",
            "@size": "1549",
            "@ref": "si15",
            "@mimetype": "image/gif"
          },
          {
            "@category": "thumbnail",
            "@height": "19",
            "@width": "410",
            "@_fa": "true",
            "$": "https://api.elsevier.com/content/object/eid/1-s2.0-S1381116999002770-si14.gif?httpAccept=%2A%2F%2A",
            "@multimediatype": "GIF image file",
            "@type": "ALTIMG",
            "@size": "1512",
            "@ref": "si14",
            "@mimetype": "image/gif"
          },
          {
            "@category": "thumbnail",
            "@height": "20",
            "@width": "613",
            "@_fa": "true",
            "$": "https://api.elsevier.com/content/object/eid/1-s2.0-S1381116999002770-si13.gif?httpAccept=%2A%2F%2A",
            "@multimediatype": "GIF image file",
            "@type": "ALTIMG",
            "@size": "2241",
            "@ref": "si13",
            "@mimetype": "image/gif"
          },
          {
            "@category": "thumbnail",
            "@height": "19",
            "@width": "410",
            "@_fa": "true",
            "$": "https://api.elsevier.com/content/object/eid/1-s2.0-S1381116999002770-si12.gif?httpAccept=%2A%2F%2A",
            "@multimediatype": "GIF image file",
            "@type": "ALTIMG",
            "@size": "1496",
            "@ref": "si12",
            "@mimetype": "image/gif"
          },
          {
            "@category": "thumbnail",
            "@height": "20",
            "@width": "613",
            "@_fa": "true",
            "$": "https://api.elsevier.com/content/object/eid/1-s2.0-S1381116999002770-si11.gif?httpAccept=%2A%2F%2A",
            "@multimediatype": "GIF image file",
            "@type": "ALTIMG",
            "@size": "2256",
            "@ref": "si11",
            "@mimetype": "image/gif"
          },
          {
            "@category": "thumbnail",
            "@height": "19",
            "@width": "410",
            "@_fa": "true",
            "$": "https://api.elsevier.com/content/object/eid/1-s2.0-S1381116999002770-si10.gif?httpAccept=%2A%2F%2A",
            "@multimediatype": "GIF image file",
            "@type": "ALTIMG",
            "@size": "1408",
            "@ref": "si10",
            "@mimetype": "image/gif"
          },
          {
            "@category": "thumbnail",
            "@height": "19",
            "@width": "641",
            "@_fa": "true",
            "$": "https://api.elsevier.com/content/object/eid/1-s2.0-S1381116999002770-si1.gif?httpAccept=%2A%2F%2A",
            "@multimediatype": "GIF image file",
            "@type": "ALTIMG",
            "@size": "2212",
            "@ref": "si1",
            "@mimetype": "image/gif"
          },
          {
            "@category": "thumbnail",
            "@height": "43",
            "@width": "125",
            "@_fa": "true",
            "$": "https://api.elsevier.com/content/object/eid/1-s2.0-S1381116999002770-gr1.sml?httpAccept=%2A%2F%2A",
            "@multimediatype": "GIF image file",
            "@type": "IMAGE-THUMBNAIL",
            "@size": "1309",
            "@ref": "gr1",
            "@mimetype": "image/gif"
          },
          {
            "@category": "standard",
            "@height": "241",
            "@width": "702",
            "@_fa": "true",
            "$": "https://api.elsevier.com/content/object/eid/1-s2.0-S1381116999002770-gr1.gif?httpAccept=%2A%2F%2A",
            "@multimediatype": "GIF image file",
            "@type": "IMAGE-DOWNSAMPLED",
            "@size": "13531",
            "@ref": "gr1",
            "@mimetype": "image/gif"
          },
          {
            "@category": "thumbnail",
            "@height": "93",
            "@width": "65",
            "@_fa": "true",
            "$": "https://api.elsevier.com/content/object/eid/1-s2.0-S1381116999002770-gr2.sml?httpAccept=%2A%2F%2A",
            "@multimediatype": "GIF image file",
            "@type": "IMAGE-THUMBNAIL",
            "@size": "913",
            "@ref": "gr2",
            "@mimetype": "image/gif"
          },
          {
            "@category": "standard",
            "@height": "883",
            "@width": "620",
            "@_fa": "true",
            "$": "https://api.elsevier.com/content/object/eid/1-s2.0-S1381116999002770-gr2.gif?httpAccept=%2A%2F%2A",
            "@multimediatype": "GIF image file",
            "@type": "IMAGE-DOWNSAMPLED",
            "@size": "24618",
            "@ref": "gr2",
            "@mimetype": "image/gif"
          },
          {
            "@category": "thumbnail",
            "@height": "76",
            "@width": "125",
            "@_fa": "true",
            "$": "https://api.elsevier.com/content/object/eid/1-s2.0-S1381116999002770-gr3.sml?httpAccept=%2A%2F%2A",
            "@multimediatype": "GIF image file",
            "@type": "IMAGE-THUMBNAIL",
            "@size": "1554",
            "@ref": "gr3",
            "@mimetype": "image/gif"
          },
          {
            "@category": "standard",
            "@height": "427",
            "@width": "702",
            "@_fa": "true",
            "$": "https://api.elsevier.com/content/object/eid/1-s2.0-S1381116999002770-gr3.gif?httpAccept=%2A%2F%2A",
            "@multimediatype": "GIF image file",
            "@type": "IMAGE-DOWNSAMPLED",
            "@size": "27242",
            "@ref": "gr3",
            "@mimetype": "image/gif"
          }
        ]
      },
      "link": {
        "@rel": "abstract",
        "@href": "https://api.elsevier.com/content/abstract/scopus_id/0033589313"
      }
    }
  }
}