{
  "metadata": {
    "title": "<ce:italic>NNN</ce:italic>-pincer-copper complex immobilized on magnetic nanoparticles as a powerful hybrid catalyst for aerobic oxidative coupling and cycloaddition reactions in water",
    "authors": "; ",
    "journal": "Journal of Molecular Catalysis A: Chemical",
    "date": "2017-01-31",
    "doi": "10.1016/j.molcata.2016.11.007",
    "abstract": "",
    "uri": "https://api.elsevier.com/content/article/pii/S1381116916304812",
    "pii": "S1381116916304812"
  },
  "fulltext": {
    "full-text-retrieval-response": {
      "scopus-eid": "2-s2.0-84999268288",
      "originalText": "serial JL 271358 291210 291744 291790 291809 31 Journal of Molecular Catalysis A: Chemical JOURNALMOLECULARCATALYSISACHEMICAL 2016-11-06 2016-11-06 2016-12-01 2016-12-01 2016-12-01T14:15:38 1-s2.0-S1381116916304812 S1381-1169(16)30481-2 S1381116916304812 10.1016/j.molcata.2016.11.007 S300 S300.1 FULL-TEXT 1-s2.0-S1381116916X0012X 2016-12-01T10:03:08.009508-05:00 0 0 20170101 20170131 2017 2016-11-06T15:33:31.663192Z absattachment articleinfo articletitlenorm authfirstinitialnorm authfirstsurnamenorm cid cids contenttype copyright crossmark dateloaded dateloadedtxt datesearch datesort dateupdated dco docsubtype doctype doi eid ewtransactionid hubeid indexeddate issn issnnorm itemstage itemtransactionid itemweight openaccess openarchive pg pgfirst pglast pii piinorm pubdateend pubdatestart pubdatetxt pubyr sortorder srctitle srctitlenorm srctype ssids alllist content subj subheadings suppl tomb volfirst volissue volumelist webpdf webpdfpagecount yearnav figure table e-component body affil appendices articletitle auth authfirstini authfull authkeywords authlast dedication highlightsabst primabst ref specialabst 1381-1169 13811169 true 426 426 PA Volume 426, Part A 17 117 129 117 129 201701 January 2017 2017-01-01 2017-01-31 2017 article fla © 2016 Elsevier B.V. All rights reserved. NNNPINCERCOPPERCOMPLEXIMMOBILIZEDMAGNETICNANOPARTICLESAPOWERFULHYBRIDCATALYSTFORAEROBICOXIDATIVECOUPLINGCYCLOADDITIONREACTIONSINWATER ZOHREH N 1 Introduction 2 Experimental 2.1 Materials and methods 2.2 Preparation of amine functionalized magnetic nanoparticles (MNP@APTS) 2.3 Synthesis of APTS-functionalized TCT (compound 1) 2.4 Preparation of pincer ligand TCT/Amp-functionalized magnetic nanoparticles (MNP@TCT/Amp) 2.5 Preparation of NNN-pincer type nanomagnetic copper catalyst (MNP@NNN-Pincer/Cu) 2.6 Synthesis of 2,4,6-tri(aminopyridinyl)-1,3,5-triazine ligand (ligand A) 2.7 General procedure for aerobic oxidative homocoupling reaction of terminal alkyne 2.8 General procedure for azide/alkyne cycloaddition reaction (click reaction) 2.9 Reusability test of catalyst MNP@NNN-pincer/Cu in click reaction 3 Result and discussion 3.1 Synthesis and characterization of catalyst 3.2 Reactions and scopes 4 Conclusion Appendix A Supplementary data References ALBRECHT 2001 3750 3781 M ASAY 2015 17432 17447 M LI 2015 116 138 H SZABO 2010 56 63 K MOULTON 1976 1020 1024 C VANKOTEN 1989 1681 1694 G MURUGESAN 2016 416 439 S YOUNUS 2015 283 330 H YANG 2016 1392 1398 D ZHANG 2016 337 343 H LEFEVRE 2011 1 7 X GUNANATHAN 2014 12024 12087 C SCHNEIDER 2012 412 429 S WERKMEISTER 2015 12226 12250 S TYSON 2015 14475 14482 G ARUMUGAM 2016 3295 3301 V BELLONE 2015 850 856 D FILONENKO 2014 1526 1530 G MURUGESAN 2016 3097 3100 S SIMLER 2016 2717 2720 T GARCIA 2015 1164 1171 P HONG 2016 3159 3162 S SHI 2016 4828 4834 J MOURE 2014 2070 2080 M HERASYMCHUK 2016 2121 2129 K LANGLOTZ 2008 4748 4752 B DENG 2014 93 97 Q GAWANDE 2013 3371 3393 M BURGESS 2016 1780 1783 S RASEROALMANSA 2013 3092 3100 A RIMOLDI 2015 4575 4586 M DELPOZO 2011 2471 2481 C TAMAMI 2013 10 16 B SOBHANI 2015 36552 36559 S GHOTBINEJAD 2014 8590 8596 M KANG 2014 8709 8713 P GHOTBINEJAD 2014 78 84 M ZHANG 2016 645 652 Y ZOHREH 2016 73 80 N POURJAVADI 2014 46418 46426 A ZOHREH 2014 50047 50055 N POURJAVADI 2016 1729 1736 A VEISI 2014 5311 5314 H NASRESFAHANI 2014 1437 1443 M GUPTA 2015 17843 17850 N GONG 2014 100 107 D GARTIA 2012 322 327 Y ZOHREH 2016 203 209 N POURJAVADI 2013 2913 2919 A BAROT 2016 77 84 N ALHMOUD 2014 514 522 L MAATEN 2014 112 116 B CHENG 2014 1849 1852 G LIU 2015 736 738 Y LI 2014 70 74 F BISWAS 2016 5069 5080 S YAN 2016 1232 1236 S SHI 2016 233 239 X NASRESFAHANI 2014 14291 14296 M LI 2016 794 797 S MANDAL 2007 4955 4960 S GROLL 2016 B AKBARI 2016 47 54 A SINGH 2015 158 163 D JLALIA 2014 56 61 I GU 2011 1576 1583 S DEBOER 2012 336 342 S CHEISSON 2014 13399 13409 T WANG 2016 5424 5431 C LIU 2016 3308 3313 X POURJAVADI 2015 29609 29617 A DUAN 2016 2621 2630 H ZEIDLER 2015 409 418 J CHENG 2012 2144 2153 H TORNOE 2004 312 324 C DASILVA 2009 373 383 F YAMADA 2012 9285 9290 Y ZOHREHX2017X117 ZOHREHX2017X117X129 ZOHREHX2017X117XN ZOHREHX2017X117X129XN 2018-12-01T00:00:00.000Z UnderEmbargo http://creativecommons.org/licenses/by-nc-nd/4.0/ © 2016 Elsevier B.V. All rights reserved. item S1381-1169(16)30481-2 S1381116916304812 1-s2.0-S1381116916304812 10.1016/j.molcata.2016.11.007 271358 2016-12-01T09:27:33.242301-05:00 2017-01-01 2017-01-31 1-s2.0-S1381116916304812-main.pdf https://s3-eu-west-1.amazonaws.com/prod-ucs-content-store-eu-west/content/pii:S1381116916304812/MAIN/application/pdf/ef8c50fad57b157a8f13ad38d6bd5808/main.pdf https://s3.amazonaws.com/prod-ucs-content-store-us-east/content/pii:S1381116916304812/MAIN/application/pdf/ef8c50fad57b157a8f13ad38d6bd5808/main.pdf main.pdf pdf true 3250982 MAIN 13 1-s2.0-S1381116916304812-main_1.png https://s3-eu-west-1.amazonaws.com/prod-ucs-content-store-eu-west/content/pii:S1381116916304812/PREVIEW/image/png/cf7ef2d370fef3d34d12e289bf73bc56/main_1.png https://s3.amazonaws.com/prod-ucs-content-store-us-east/content/pii:S1381116916304812/PREVIEW/image/png/cf7ef2d370fef3d34d12e289bf73bc56/main_1.png main_1.png png 52938 849 656 IMAGE-WEB-PDF 1 1-s2.0-S1381116916304812-fx1.sml https://s3-eu-west-1.amazonaws.com/prod-ucs-content-store-eu-west/content/pii:S1381116916304812/fx1/THUMBNAIL/image/gif/1f468743c531b7d1ffcc9c89f2c9b9e3/fx1.sml https://s3.amazonaws.com/prod-ucs-content-store-us-east/content/pii:S1381116916304812/fx1/THUMBNAIL/image/gif/1f468743c531b7d1ffcc9c89f2c9b9e3/fx1.sml fx1 true fx1.sml sml 5077 88 219 IMAGE-THUMBNAIL 1-s2.0-S1381116916304812-fx2.sml https://s3-eu-west-1.amazonaws.com/prod-ucs-content-store-eu-west/content/pii:S1381116916304812/fx2/THUMBNAIL/image/gif/f62cb422dcf4074560097255db53f2b6/fx2.sml https://s3.amazonaws.com/prod-ucs-content-store-us-east/content/pii:S1381116916304812/fx2/THUMBNAIL/image/gif/f62cb422dcf4074560097255db53f2b6/fx2.sml fx2 fx2.sml sml 2985 88 219 IMAGE-THUMBNAIL 1-s2.0-S1381116916304812-fx3.sml https://s3-eu-west-1.amazonaws.com/prod-ucs-content-store-eu-west/content/pii:S1381116916304812/fx3/THUMBNAIL/image/gif/e651422f9d4816670a9b3b43e301953c/fx3.sml https://s3.amazonaws.com/prod-ucs-content-store-us-east/content/pii:S1381116916304812/fx3/THUMBNAIL/image/gif/e651422f9d4816670a9b3b43e301953c/fx3.sml fx3 fx3.sml sml 1807 88 219 IMAGE-THUMBNAIL 1-s2.0-S1381116916304812-fx4.sml https://s3-eu-west-1.amazonaws.com/prod-ucs-content-store-eu-west/content/pii:S1381116916304812/fx4/THUMBNAIL/image/gif/6ed2350e942f48977f17aaa4f3ed9aa8/fx4.sml https://s3.amazonaws.com/prod-ucs-content-store-us-east/content/pii:S1381116916304812/fx4/THUMBNAIL/image/gif/6ed2350e942f48977f17aaa4f3ed9aa8/fx4.sml fx4 fx4.sml sml 3565 88 219 IMAGE-THUMBNAIL 1-s2.0-S1381116916304812-fx5.sml https://s3-eu-west-1.amazonaws.com/prod-ucs-content-store-eu-west/content/pii:S1381116916304812/fx5/THUMBNAIL/image/gif/8a11abf1b74a4b90992c1ddb06f905f0/fx5.sml https://s3.amazonaws.com/prod-ucs-content-store-us-east/content/pii:S1381116916304812/fx5/THUMBNAIL/image/gif/8a11abf1b74a4b90992c1ddb06f905f0/fx5.sml fx5 fx5.sml sml 1949 88 219 IMAGE-THUMBNAIL 1-s2.0-S1381116916304812-fx6.sml https://s3-eu-west-1.amazonaws.com/prod-ucs-content-store-eu-west/content/pii:S1381116916304812/fx6/THUMBNAIL/image/gif/d2a29ab7afaa5634cfd5c89234a6ef2d/fx6.sml https://s3.amazonaws.com/prod-ucs-content-store-us-east/content/pii:S1381116916304812/fx6/THUMBNAIL/image/gif/d2a29ab7afaa5634cfd5c89234a6ef2d/fx6.sml fx6 fx6.sml sml 2744 88 219 IMAGE-THUMBNAIL 1-s2.0-S1381116916304812-fx7.sml https://s3-eu-west-1.amazonaws.com/prod-ucs-content-store-eu-west/content/pii:S1381116916304812/fx7/THUMBNAIL/image/gif/bf343a8860bbc6a6c63e6959391b808f/fx7.sml https://s3.amazonaws.com/prod-ucs-content-store-us-east/content/pii:S1381116916304812/fx7/THUMBNAIL/image/gif/bf343a8860bbc6a6c63e6959391b808f/fx7.sml fx7 fx7.sml sml 3512 88 219 IMAGE-THUMBNAIL 1-s2.0-S1381116916304812-fx8.sml https://s3-eu-west-1.amazonaws.com/prod-ucs-content-store-eu-west/content/pii:S1381116916304812/fx8/THUMBNAIL/image/gif/1ab396e58c511fc28f8fffa8f175d2b0/fx8.sml https://s3.amazonaws.com/prod-ucs-content-store-us-east/content/pii:S1381116916304812/fx8/THUMBNAIL/image/gif/1ab396e58c511fc28f8fffa8f175d2b0/fx8.sml fx8 fx8.sml sml 1545 88 219 IMAGE-THUMBNAIL 1-s2.0-S1381116916304812-fx9.sml https://s3-eu-west-1.amazonaws.com/prod-ucs-content-store-eu-west/content/pii:S1381116916304812/fx9/THUMBNAIL/image/gif/c5bcc27fc2eee433b1ff1fb339b56db5/fx9.sml https://s3.amazonaws.com/prod-ucs-content-store-us-east/content/pii:S1381116916304812/fx9/THUMBNAIL/image/gif/c5bcc27fc2eee433b1ff1fb339b56db5/fx9.sml fx9 fx9.sml sml 1969 88 219 IMAGE-THUMBNAIL 1-s2.0-S1381116916304812-gr1.sml https://s3-eu-west-1.amazonaws.com/prod-ucs-content-store-eu-west/content/pii:S1381116916304812/gr1/THUMBNAIL/image/gif/2b1a22864a5f218ecc155e1b0ec5319c/gr1.sml https://s3.amazonaws.com/prod-ucs-content-store-us-east/content/pii:S1381116916304812/gr1/THUMBNAIL/image/gif/2b1a22864a5f218ecc155e1b0ec5319c/gr1.sml gr1 gr1.sml sml 8609 133 219 IMAGE-THUMBNAIL 1-s2.0-S1381116916304812-gr2.sml https://s3-eu-west-1.amazonaws.com/prod-ucs-content-store-eu-west/content/pii:S1381116916304812/gr2/THUMBNAIL/image/gif/79edb75624a5cc44afda05666da697c6/gr2.sml https://s3.amazonaws.com/prod-ucs-content-store-us-east/content/pii:S1381116916304812/gr2/THUMBNAIL/image/gif/79edb75624a5cc44afda05666da697c6/gr2.sml gr2 gr2.sml sml 4053 69 219 IMAGE-THUMBNAIL 1-s2.0-S1381116916304812-gr3.sml https://s3-eu-west-1.amazonaws.com/prod-ucs-content-store-eu-west/content/pii:S1381116916304812/gr3/THUMBNAIL/image/gif/f7ad60357c98bc484c1698b145286f7f/gr3.sml https://s3.amazonaws.com/prod-ucs-content-store-us-east/content/pii:S1381116916304812/gr3/THUMBNAIL/image/gif/f7ad60357c98bc484c1698b145286f7f/gr3.sml gr3 gr3.sml sml 5394 88 219 IMAGE-THUMBNAIL 1-s2.0-S1381116916304812-gr4.sml https://s3-eu-west-1.amazonaws.com/prod-ucs-content-store-eu-west/content/pii:S1381116916304812/gr4/THUMBNAIL/image/gif/4b734c8364bb48b5d8edd2a451ad1c36/gr4.sml https://s3.amazonaws.com/prod-ucs-content-store-us-east/content/pii:S1381116916304812/gr4/THUMBNAIL/image/gif/4b734c8364bb48b5d8edd2a451ad1c36/gr4.sml gr4 gr4.sml sml 3794 122 219 IMAGE-THUMBNAIL 1-s2.0-S1381116916304812-gr5.sml https://s3-eu-west-1.amazonaws.com/prod-ucs-content-store-eu-west/content/pii:S1381116916304812/gr5/THUMBNAIL/image/gif/215bcb211356481845573b3cc2cdc42f/gr5.sml https://s3.amazonaws.com/prod-ucs-content-store-us-east/content/pii:S1381116916304812/gr5/THUMBNAIL/image/gif/215bcb211356481845573b3cc2cdc42f/gr5.sml gr5 gr5.sml sml 5913 164 211 IMAGE-THUMBNAIL 1-s2.0-S1381116916304812-gr6.sml https://s3-eu-west-1.amazonaws.com/prod-ucs-content-store-eu-west/content/pii:S1381116916304812/gr6/THUMBNAIL/image/gif/65ca46ec4b462901f6f8421aa43ad207/gr6.sml https://s3.amazonaws.com/prod-ucs-content-store-us-east/content/pii:S1381116916304812/gr6/THUMBNAIL/image/gif/65ca46ec4b462901f6f8421aa43ad207/gr6.sml gr6 gr6.sml sml 9768 79 219 IMAGE-THUMBNAIL 1-s2.0-S1381116916304812-gr7.sml https://s3-eu-west-1.amazonaws.com/prod-ucs-content-store-eu-west/content/pii:S1381116916304812/gr7/THUMBNAIL/image/gif/d245250235cd81b4f5b3af73a34463c2/gr7.sml https://s3.amazonaws.com/prod-ucs-content-store-us-east/content/pii:S1381116916304812/gr7/THUMBNAIL/image/gif/d245250235cd81b4f5b3af73a34463c2/gr7.sml gr7 gr7.sml sml 5638 102 219 IMAGE-THUMBNAIL 1-s2.0-S1381116916304812-sc1.sml https://s3-eu-west-1.amazonaws.com/prod-ucs-content-store-eu-west/content/pii:S1381116916304812/sc1/THUMBNAIL/image/gif/73888611e96f97d4f4d9c25f789f90be/sc1.sml https://s3.amazonaws.com/prod-ucs-content-store-us-east/content/pii:S1381116916304812/sc1/THUMBNAIL/image/gif/73888611e96f97d4f4d9c25f789f90be/sc1.sml sc1 sc1.sml sml 4632 62 219 IMAGE-THUMBNAIL 1-s2.0-S1381116916304812-sc2.sml https://s3-eu-west-1.amazonaws.com/prod-ucs-content-store-eu-west/content/pii:S1381116916304812/sc2/THUMBNAIL/image/gif/b3c37f9cb0b66f7486e54968b90ea90a/sc2.sml https://s3.amazonaws.com/prod-ucs-content-store-us-east/content/pii:S1381116916304812/sc2/THUMBNAIL/image/gif/b3c37f9cb0b66f7486e54968b90ea90a/sc2.sml sc2 sc2.sml sml 5050 124 219 IMAGE-THUMBNAIL 1-s2.0-S1381116916304812-sc3.sml https://s3-eu-west-1.amazonaws.com/prod-ucs-content-store-eu-west/content/pii:S1381116916304812/sc3/THUMBNAIL/image/gif/4701c091e15fbf330309e20ef9fe06a3/sc3.sml https://s3.amazonaws.com/prod-ucs-content-store-us-east/content/pii:S1381116916304812/sc3/THUMBNAIL/image/gif/4701c091e15fbf330309e20ef9fe06a3/sc3.sml sc3 sc3.sml sml 3815 86 219 IMAGE-THUMBNAIL 1-s2.0-S1381116916304812-sc4.sml https://s3-eu-west-1.amazonaws.com/prod-ucs-content-store-eu-west/content/pii:S1381116916304812/sc4/THUMBNAIL/image/gif/50f3d6c1db45404fead6da169b18e634/sc4.sml https://s3.amazonaws.com/prod-ucs-content-store-us-east/content/pii:S1381116916304812/sc4/THUMBNAIL/image/gif/50f3d6c1db45404fead6da169b18e634/sc4.sml sc4 sc4.sml sml 3699 67 219 IMAGE-THUMBNAIL 1-s2.0-S1381116916304812-sc5.sml https://s3-eu-west-1.amazonaws.com/prod-ucs-content-store-eu-west/content/pii:S1381116916304812/sc5/THUMBNAIL/image/gif/c386dfe79493621fe0562e5300becaa3/sc5.sml https://s3.amazonaws.com/prod-ucs-content-store-us-east/content/pii:S1381116916304812/sc5/THUMBNAIL/image/gif/c386dfe79493621fe0562e5300becaa3/sc5.sml sc5 sc5.sml sml 2550 39 219 IMAGE-THUMBNAIL 1-s2.0-S1381116916304812-sc6.sml https://s3-eu-west-1.amazonaws.com/prod-ucs-content-store-eu-west/content/pii:S1381116916304812/sc6/THUMBNAIL/image/gif/95f6cddff6a9698c320dad36a19ca6c7/sc6.sml https://s3.amazonaws.com/prod-ucs-content-store-us-east/content/pii:S1381116916304812/sc6/THUMBNAIL/image/gif/95f6cddff6a9698c320dad36a19ca6c7/sc6.sml sc6 sc6.sml sml 6564 155 219 IMAGE-THUMBNAIL 1-s2.0-S1381116916304812-sc7.sml https://s3-eu-west-1.amazonaws.com/prod-ucs-content-store-eu-west/content/pii:S1381116916304812/sc7/THUMBNAIL/image/gif/35002b624bcd764e8537f45419852361/sc7.sml https://s3.amazonaws.com/prod-ucs-content-store-us-east/content/pii:S1381116916304812/sc7/THUMBNAIL/image/gif/35002b624bcd764e8537f45419852361/sc7.sml sc7 sc7.sml sml 2586 38 219 IMAGE-THUMBNAIL 1-s2.0-S1381116916304812-fx1.jpg https://s3-eu-west-1.amazonaws.com/prod-ucs-content-store-eu-west/content/pii:S1381116916304812/fx1/DOWNSAMPLED/image/jpeg/4d547771e5613de5dd3ee5bfb96969e8/fx1.jpg https://s3.amazonaws.com/prod-ucs-content-store-us-east/content/pii:S1381116916304812/fx1/DOWNSAMPLED/image/jpeg/4d547771e5613de5dd3ee5bfb96969e8/fx1.jpg fx1 true fx1.jpg jpg 17682 200 500 IMAGE-DOWNSAMPLED 1-s2.0-S1381116916304812-fx2.jpg https://s3-eu-west-1.amazonaws.com/prod-ucs-content-store-eu-west/content/pii:S1381116916304812/fx2/DOWNSAMPLED/image/jpeg/425498cbbc5b2516aeda235cb1ec6fbf/fx2.jpg https://s3.amazonaws.com/prod-ucs-content-store-us-east/content/pii:S1381116916304812/fx2/DOWNSAMPLED/image/jpeg/425498cbbc5b2516aeda235cb1ec6fbf/fx2.jpg fx2 fx2.jpg jpg 11396 200 500 IMAGE-DOWNSAMPLED 1-s2.0-S1381116916304812-fx3.jpg https://s3-eu-west-1.amazonaws.com/prod-ucs-content-store-eu-west/content/pii:S1381116916304812/fx3/DOWNSAMPLED/image/jpeg/7cffedbd01572694260193cd8ebb63db/fx3.jpg https://s3.amazonaws.com/prod-ucs-content-store-us-east/content/pii:S1381116916304812/fx3/DOWNSAMPLED/image/jpeg/7cffedbd01572694260193cd8ebb63db/fx3.jpg fx3 fx3.jpg jpg 5968 200 500 IMAGE-DOWNSAMPLED 1-s2.0-S1381116916304812-fx4.jpg https://s3-eu-west-1.amazonaws.com/prod-ucs-content-store-eu-west/content/pii:S1381116916304812/fx4/DOWNSAMPLED/image/jpeg/6a1084b7818d725a61b6021b508d880b/fx4.jpg https://s3.amazonaws.com/prod-ucs-content-store-us-east/content/pii:S1381116916304812/fx4/DOWNSAMPLED/image/jpeg/6a1084b7818d725a61b6021b508d880b/fx4.jpg fx4 fx4.jpg jpg 19912 200 500 IMAGE-DOWNSAMPLED 1-s2.0-S1381116916304812-fx5.jpg https://s3-eu-west-1.amazonaws.com/prod-ucs-content-store-eu-west/content/pii:S1381116916304812/fx5/DOWNSAMPLED/image/jpeg/c84c02c64c73113ddd4c4c4ca8fddb27/fx5.jpg https://s3.amazonaws.com/prod-ucs-content-store-us-east/content/pii:S1381116916304812/fx5/DOWNSAMPLED/image/jpeg/c84c02c64c73113ddd4c4c4ca8fddb27/fx5.jpg fx5 fx5.jpg jpg 6307 200 500 IMAGE-DOWNSAMPLED 1-s2.0-S1381116916304812-fx6.jpg https://s3-eu-west-1.amazonaws.com/prod-ucs-content-store-eu-west/content/pii:S1381116916304812/fx6/DOWNSAMPLED/image/jpeg/62c614c30cd4c3385ee4c46183861392/fx6.jpg https://s3.amazonaws.com/prod-ucs-content-store-us-east/content/pii:S1381116916304812/fx6/DOWNSAMPLED/image/jpeg/62c614c30cd4c3385ee4c46183861392/fx6.jpg fx6 fx6.jpg jpg 15778 200 500 IMAGE-DOWNSAMPLED 1-s2.0-S1381116916304812-fx7.jpg https://s3-eu-west-1.amazonaws.com/prod-ucs-content-store-eu-west/content/pii:S1381116916304812/fx7/DOWNSAMPLED/image/jpeg/f749a4003ebd77d729222a4b04284227/fx7.jpg https://s3.amazonaws.com/prod-ucs-content-store-us-east/content/pii:S1381116916304812/fx7/DOWNSAMPLED/image/jpeg/f749a4003ebd77d729222a4b04284227/fx7.jpg fx7 fx7.jpg jpg 19827 200 500 IMAGE-DOWNSAMPLED 1-s2.0-S1381116916304812-fx8.jpg https://s3-eu-west-1.amazonaws.com/prod-ucs-content-store-eu-west/content/pii:S1381116916304812/fx8/DOWNSAMPLED/image/jpeg/1f6523e8da47db271c93756a0cdeb930/fx8.jpg https://s3.amazonaws.com/prod-ucs-content-store-us-east/content/pii:S1381116916304812/fx8/DOWNSAMPLED/image/jpeg/1f6523e8da47db271c93756a0cdeb930/fx8.jpg fx8 fx8.jpg jpg 4166 200 500 IMAGE-DOWNSAMPLED 1-s2.0-S1381116916304812-fx9.jpg https://s3-eu-west-1.amazonaws.com/prod-ucs-content-store-eu-west/content/pii:S1381116916304812/fx9/DOWNSAMPLED/image/jpeg/79aa41d9f1996457190a8d61d7d4cb73/fx9.jpg https://s3.amazonaws.com/prod-ucs-content-store-us-east/content/pii:S1381116916304812/fx9/DOWNSAMPLED/image/jpeg/79aa41d9f1996457190a8d61d7d4cb73/fx9.jpg fx9 fx9.jpg jpg 6222 200 500 IMAGE-DOWNSAMPLED 1-s2.0-S1381116916304812-gr1.jpg https://s3-eu-west-1.amazonaws.com/prod-ucs-content-store-eu-west/content/pii:S1381116916304812/gr1/DOWNSAMPLED/image/jpeg/25e9d2da4d5ccf1fde10d63a0b2cd520/gr1.jpg https://s3.amazonaws.com/prod-ucs-content-store-us-east/content/pii:S1381116916304812/gr1/DOWNSAMPLED/image/jpeg/25e9d2da4d5ccf1fde10d63a0b2cd520/gr1.jpg gr1 gr1.jpg jpg 70549 457 753 IMAGE-DOWNSAMPLED 1-s2.0-S1381116916304812-gr2.jpg https://s3-eu-west-1.amazonaws.com/prod-ucs-content-store-eu-west/content/pii:S1381116916304812/gr2/DOWNSAMPLED/image/jpeg/dba352fa83028244f7bdf5e125ce1891/gr2.jpg https://s3.amazonaws.com/prod-ucs-content-store-us-east/content/pii:S1381116916304812/gr2/DOWNSAMPLED/image/jpeg/dba352fa83028244f7bdf5e125ce1891/gr2.jpg gr2 gr2.jpg jpg 29587 215 678 IMAGE-DOWNSAMPLED 1-s2.0-S1381116916304812-gr3.jpg https://s3-eu-west-1.amazonaws.com/prod-ucs-content-store-eu-west/content/pii:S1381116916304812/gr3/DOWNSAMPLED/image/jpeg/892c513a14673a43eeae317891d922d7/gr3.jpg https://s3.amazonaws.com/prod-ucs-content-store-us-east/content/pii:S1381116916304812/gr3/DOWNSAMPLED/image/jpeg/892c513a14673a43eeae317891d922d7/gr3.jpg gr3 gr3.jpg jpg 33971 273 681 IMAGE-DOWNSAMPLED 1-s2.0-S1381116916304812-gr4.jpg https://s3-eu-west-1.amazonaws.com/prod-ucs-content-store-eu-west/content/pii:S1381116916304812/gr4/DOWNSAMPLED/image/jpeg/4ae2a76b6ca28c064ea208dd84565446/gr4.jpg https://s3.amazonaws.com/prod-ucs-content-store-us-east/content/pii:S1381116916304812/gr4/DOWNSAMPLED/image/jpeg/4ae2a76b6ca28c064ea208dd84565446/gr4.jpg gr4 gr4.jpg jpg 19054 317 568 IMAGE-DOWNSAMPLED 1-s2.0-S1381116916304812-gr5.jpg https://s3-eu-west-1.amazonaws.com/prod-ucs-content-store-eu-west/content/pii:S1381116916304812/gr5/DOWNSAMPLED/image/jpeg/9eed07b8a3599b15095c1f9d3c6f2c48/gr5.jpg https://s3.amazonaws.com/prod-ucs-content-store-us-east/content/pii:S1381116916304812/gr5/DOWNSAMPLED/image/jpeg/9eed07b8a3599b15095c1f9d3c6f2c48/gr5.jpg gr5 gr5.jpg jpg 28581 379 489 IMAGE-DOWNSAMPLED 1-s2.0-S1381116916304812-gr6.jpg https://s3-eu-west-1.amazonaws.com/prod-ucs-content-store-eu-west/content/pii:S1381116916304812/gr6/DOWNSAMPLED/image/jpeg/15a8fb53b5021956aff4308fc5bc9b68/gr6.jpg https://s3.amazonaws.com/prod-ucs-content-store-us-east/content/pii:S1381116916304812/gr6/DOWNSAMPLED/image/jpeg/15a8fb53b5021956aff4308fc5bc9b68/gr6.jpg gr6 gr6.jpg jpg 40972 204 565 IMAGE-DOWNSAMPLED 1-s2.0-S1381116916304812-gr7.jpg https://s3-eu-west-1.amazonaws.com/prod-ucs-content-store-eu-west/content/pii:S1381116916304812/gr7/DOWNSAMPLED/image/jpeg/be3939b235efbd5a7d10166ce52ba55f/gr7.jpg https://s3.amazonaws.com/prod-ucs-content-store-us-east/content/pii:S1381116916304812/gr7/DOWNSAMPLED/image/jpeg/be3939b235efbd5a7d10166ce52ba55f/gr7.jpg gr7 gr7.jpg jpg 31567 264 565 IMAGE-DOWNSAMPLED 1-s2.0-S1381116916304812-sc1.jpg https://s3-eu-west-1.amazonaws.com/prod-ucs-content-store-eu-west/content/pii:S1381116916304812/sc1/DOWNSAMPLED/image/jpeg/ebaa83d75a6e10c93cc7817c0ddaf1d5/sc1.jpg https://s3.amazonaws.com/prod-ucs-content-store-us-east/content/pii:S1381116916304812/sc1/DOWNSAMPLED/image/jpeg/ebaa83d75a6e10c93cc7817c0ddaf1d5/sc1.jpg sc1 sc1.jpg jpg 10158 85 301 IMAGE-DOWNSAMPLED 1-s2.0-S1381116916304812-sc2.jpg https://s3-eu-west-1.amazonaws.com/prod-ucs-content-store-eu-west/content/pii:S1381116916304812/sc2/DOWNSAMPLED/image/jpeg/b6f2d65ad09f68cbce70373bcdde40a0/sc2.jpg https://s3.amazonaws.com/prod-ucs-content-store-us-east/content/pii:S1381116916304812/sc2/DOWNSAMPLED/image/jpeg/b6f2d65ad09f68cbce70373bcdde40a0/sc2.jpg sc2 sc2.jpg jpg 40271 384 678 IMAGE-DOWNSAMPLED 1-s2.0-S1381116916304812-sc3.jpg https://s3-eu-west-1.amazonaws.com/prod-ucs-content-store-eu-west/content/pii:S1381116916304812/sc3/DOWNSAMPLED/image/jpeg/26a6b6e4f66f47801978f9f6c25ee49d/sc3.jpg https://s3.amazonaws.com/prod-ucs-content-store-us-east/content/pii:S1381116916304812/sc3/DOWNSAMPLED/image/jpeg/26a6b6e4f66f47801978f9f6c25ee49d/sc3.jpg sc3 sc3.jpg jpg 20261 221 565 IMAGE-DOWNSAMPLED 1-s2.0-S1381116916304812-sc4.jpg https://s3-eu-west-1.amazonaws.com/prod-ucs-content-store-eu-west/content/pii:S1381116916304812/sc4/DOWNSAMPLED/image/jpeg/a013473e8947ba7ace120b9f2a964804/sc4.jpg https://s3.amazonaws.com/prod-ucs-content-store-us-east/content/pii:S1381116916304812/sc4/DOWNSAMPLED/image/jpeg/a013473e8947ba7ace120b9f2a964804/sc4.jpg sc4 sc4.jpg jpg 21456 173 565 IMAGE-DOWNSAMPLED 1-s2.0-S1381116916304812-sc5.jpg https://s3-eu-west-1.amazonaws.com/prod-ucs-content-store-eu-west/content/pii:S1381116916304812/sc5/DOWNSAMPLED/image/jpeg/ed67f24801c7e160ba48f30db3a9d62d/sc5.jpg https://s3.amazonaws.com/prod-ucs-content-store-us-east/content/pii:S1381116916304812/sc5/DOWNSAMPLED/image/jpeg/ed67f24801c7e160ba48f30db3a9d62d/sc5.jpg sc5 sc5.jpg jpg 11739 100 565 IMAGE-DOWNSAMPLED 1-s2.0-S1381116916304812-sc6.jpg https://s3-eu-west-1.amazonaws.com/prod-ucs-content-store-eu-west/content/pii:S1381116916304812/sc6/DOWNSAMPLED/image/jpeg/ed642569a45633fd88e94eeefc941732/sc6.jpg https://s3.amazonaws.com/prod-ucs-content-store-us-east/content/pii:S1381116916304812/sc6/DOWNSAMPLED/image/jpeg/ed642569a45633fd88e94eeefc941732/sc6.jpg sc6 sc6.jpg jpg 33287 346 489 IMAGE-DOWNSAMPLED 1-s2.0-S1381116916304812-sc7.jpg https://s3-eu-west-1.amazonaws.com/prod-ucs-content-store-eu-west/content/pii:S1381116916304812/sc7/DOWNSAMPLED/image/jpeg/a707bfcaebd5432e4cde6cea6f11643d/sc7.jpg https://s3.amazonaws.com/prod-ucs-content-store-us-east/content/pii:S1381116916304812/sc7/DOWNSAMPLED/image/jpeg/a707bfcaebd5432e4cde6cea6f11643d/sc7.jpg sc7 sc7.jpg jpg 13492 99 565 IMAGE-DOWNSAMPLED 1-s2.0-S1381116916304812-fx1_lrg.jpg https://s3-eu-west-1.amazonaws.com/prod-ucs-content-store-eu-west/content/pii:S1381116916304812/fx1/HIGHRES/image/jpeg/dcbe154f00b21a04a820865154883d52/fx1_lrg.jpg https://s3.amazonaws.com/prod-ucs-content-store-us-east/content/pii:S1381116916304812/fx1/HIGHRES/image/jpeg/dcbe154f00b21a04a820865154883d52/fx1_lrg.jpg fx1 true fx1_lrg.jpg jpg 134260 886 2213 IMAGE-HIGH-RES 1-s2.0-S1381116916304812-fx2_lrg.jpg https://s3-eu-west-1.amazonaws.com/prod-ucs-content-store-eu-west/content/pii:S1381116916304812/fx2/HIGHRES/image/jpeg/49fbdb8048d4cafa69ce113203d4191a/fx2_lrg.jpg https://s3.amazonaws.com/prod-ucs-content-store-us-east/content/pii:S1381116916304812/fx2/HIGHRES/image/jpeg/49fbdb8048d4cafa69ce113203d4191a/fx2_lrg.jpg fx2 fx2_lrg.jpg jpg 74291 886 2213 IMAGE-HIGH-RES 1-s2.0-S1381116916304812-fx3_lrg.jpg https://s3-eu-west-1.amazonaws.com/prod-ucs-content-store-eu-west/content/pii:S1381116916304812/fx3/HIGHRES/image/jpeg/85c795de679d710ca7d40d5760c0ef70/fx3_lrg.jpg https://s3.amazonaws.com/prod-ucs-content-store-us-east/content/pii:S1381116916304812/fx3/HIGHRES/image/jpeg/85c795de679d710ca7d40d5760c0ef70/fx3_lrg.jpg fx3 fx3_lrg.jpg jpg 39859 886 2213 IMAGE-HIGH-RES 1-s2.0-S1381116916304812-fx4_lrg.jpg https://s3-eu-west-1.amazonaws.com/prod-ucs-content-store-eu-west/content/pii:S1381116916304812/fx4/HIGHRES/image/jpeg/0ce23d73893d51c4352d04c6fd901c6e/fx4_lrg.jpg https://s3.amazonaws.com/prod-ucs-content-store-us-east/content/pii:S1381116916304812/fx4/HIGHRES/image/jpeg/0ce23d73893d51c4352d04c6fd901c6e/fx4_lrg.jpg fx4 fx4_lrg.jpg jpg 137348 886 2213 IMAGE-HIGH-RES 1-s2.0-S1381116916304812-fx5_lrg.jpg https://s3-eu-west-1.amazonaws.com/prod-ucs-content-store-eu-west/content/pii:S1381116916304812/fx5/HIGHRES/image/jpeg/7241763f79133d86ec4aace0a2825111/fx5_lrg.jpg https://s3.amazonaws.com/prod-ucs-content-store-us-east/content/pii:S1381116916304812/fx5/HIGHRES/image/jpeg/7241763f79133d86ec4aace0a2825111/fx5_lrg.jpg fx5 fx5_lrg.jpg jpg 41637 886 2213 IMAGE-HIGH-RES 1-s2.0-S1381116916304812-fx6_lrg.jpg https://s3-eu-west-1.amazonaws.com/prod-ucs-content-store-eu-west/content/pii:S1381116916304812/fx6/HIGHRES/image/jpeg/d986854ca99b5a3c5971f04b9a941eed/fx6_lrg.jpg https://s3.amazonaws.com/prod-ucs-content-store-us-east/content/pii:S1381116916304812/fx6/HIGHRES/image/jpeg/d986854ca99b5a3c5971f04b9a941eed/fx6_lrg.jpg fx6 fx6_lrg.jpg jpg 148582 886 2213 IMAGE-HIGH-RES 1-s2.0-S1381116916304812-fx7_lrg.jpg https://s3-eu-west-1.amazonaws.com/prod-ucs-content-store-eu-west/content/pii:S1381116916304812/fx7/HIGHRES/image/jpeg/e7f444d8cebe9954c42c338ce3bbfc0d/fx7_lrg.jpg https://s3.amazonaws.com/prod-ucs-content-store-us-east/content/pii:S1381116916304812/fx7/HIGHRES/image/jpeg/e7f444d8cebe9954c42c338ce3bbfc0d/fx7_lrg.jpg fx7 fx7_lrg.jpg jpg 151924 886 2213 IMAGE-HIGH-RES 1-s2.0-S1381116916304812-fx8_lrg.jpg https://s3-eu-west-1.amazonaws.com/prod-ucs-content-store-eu-west/content/pii:S1381116916304812/fx8/HIGHRES/image/jpeg/9f4a29dc119987fa1337b941919da80b/fx8_lrg.jpg https://s3.amazonaws.com/prod-ucs-content-store-us-east/content/pii:S1381116916304812/fx8/HIGHRES/image/jpeg/9f4a29dc119987fa1337b941919da80b/fx8_lrg.jpg fx8 fx8_lrg.jpg jpg 28080 886 2213 IMAGE-HIGH-RES 1-s2.0-S1381116916304812-fx9_lrg.jpg https://s3-eu-west-1.amazonaws.com/prod-ucs-content-store-eu-west/content/pii:S1381116916304812/fx9/HIGHRES/image/jpeg/5f83d85b1219639894ee7a6da881aa04/fx9_lrg.jpg https://s3.amazonaws.com/prod-ucs-content-store-us-east/content/pii:S1381116916304812/fx9/HIGHRES/image/jpeg/5f83d85b1219639894ee7a6da881aa04/fx9_lrg.jpg fx9 fx9_lrg.jpg jpg 39964 886 2213 IMAGE-HIGH-RES 1-s2.0-S1381116916304812-gr1_lrg.jpg https://s3-eu-west-1.amazonaws.com/prod-ucs-content-store-eu-west/content/pii:S1381116916304812/gr1/HIGHRES/image/jpeg/baa28e6c35e2dcaa02be97692f4594d3/gr1_lrg.jpg https://s3.amazonaws.com/prod-ucs-content-store-us-east/content/pii:S1381116916304812/gr1/HIGHRES/image/jpeg/baa28e6c35e2dcaa02be97692f4594d3/gr1_lrg.jpg gr1 gr1_lrg.jpg jpg 501853 2021 3333 IMAGE-HIGH-RES 1-s2.0-S1381116916304812-gr2_lrg.jpg https://s3-eu-west-1.amazonaws.com/prod-ucs-content-store-eu-west/content/pii:S1381116916304812/gr2/HIGHRES/image/jpeg/e68e5f4bd11f3ede2539600449b5dbd9/gr2_lrg.jpg https://s3.amazonaws.com/prod-ucs-content-store-us-east/content/pii:S1381116916304812/gr2/HIGHRES/image/jpeg/e68e5f4bd11f3ede2539600449b5dbd9/gr2_lrg.jpg gr2 gr2_lrg.jpg jpg 226422 951 3000 IMAGE-HIGH-RES 1-s2.0-S1381116916304812-gr3_lrg.jpg https://s3-eu-west-1.amazonaws.com/prod-ucs-content-store-eu-west/content/pii:S1381116916304812/gr3/HIGHRES/image/jpeg/5bfaacef0ca75edc77dc43211840b205/gr3_lrg.jpg https://s3.amazonaws.com/prod-ucs-content-store-us-east/content/pii:S1381116916304812/gr3/HIGHRES/image/jpeg/5bfaacef0ca75edc77dc43211840b205/gr3_lrg.jpg gr3 gr3_lrg.jpg jpg 324910 1208 3014 IMAGE-HIGH-RES 1-s2.0-S1381116916304812-gr4_lrg.jpg https://s3-eu-west-1.amazonaws.com/prod-ucs-content-store-eu-west/content/pii:S1381116916304812/gr4/HIGHRES/image/jpeg/b41c898734d064810d9a4f1a57977e8d/gr4_lrg.jpg https://s3.amazonaws.com/prod-ucs-content-store-us-east/content/pii:S1381116916304812/gr4/HIGHRES/image/jpeg/b41c898734d064810d9a4f1a57977e8d/gr4_lrg.jpg gr4 gr4_lrg.jpg jpg 132562 1403 2514 IMAGE-HIGH-RES 1-s2.0-S1381116916304812-gr5_lrg.jpg https://s3-eu-west-1.amazonaws.com/prod-ucs-content-store-eu-west/content/pii:S1381116916304812/gr5/HIGHRES/image/jpeg/f5ba8f9302c1d355102cdfc134b96a37/gr5_lrg.jpg https://s3.amazonaws.com/prod-ucs-content-store-us-east/content/pii:S1381116916304812/gr5/HIGHRES/image/jpeg/f5ba8f9302c1d355102cdfc134b96a37/gr5_lrg.jpg gr5 gr5_lrg.jpg jpg 208485 1681 2167 IMAGE-HIGH-RES 1-s2.0-S1381116916304812-gr6_lrg.jpg https://s3-eu-west-1.amazonaws.com/prod-ucs-content-store-eu-west/content/pii:S1381116916304812/gr6/HIGHRES/image/jpeg/01413be8901f3a5f010a6f589154a8fc/gr6_lrg.jpg https://s3.amazonaws.com/prod-ucs-content-store-us-east/content/pii:S1381116916304812/gr6/HIGHRES/image/jpeg/01413be8901f3a5f010a6f589154a8fc/gr6_lrg.jpg gr6 gr6_lrg.jpg jpg 614845 903 2500 IMAGE-HIGH-RES 1-s2.0-S1381116916304812-gr7_lrg.jpg https://s3-eu-west-1.amazonaws.com/prod-ucs-content-store-eu-west/content/pii:S1381116916304812/gr7/HIGHRES/image/jpeg/a8c857c54560c097a3f8a8583a9b2589/gr7_lrg.jpg https://s3.amazonaws.com/prod-ucs-content-store-us-east/content/pii:S1381116916304812/gr7/HIGHRES/image/jpeg/a8c857c54560c097a3f8a8583a9b2589/gr7_lrg.jpg gr7 gr7_lrg.jpg jpg 210655 1167 2500 IMAGE-HIGH-RES 1-s2.0-S1381116916304812-sc1_lrg.jpg https://s3-eu-west-1.amazonaws.com/prod-ucs-content-store-eu-west/content/pii:S1381116916304812/sc1/HIGHRES/image/jpeg/c6c5f2e74a297a5c6b24146d6fb0a775/sc1_lrg.jpg https://s3.amazonaws.com/prod-ucs-content-store-us-east/content/pii:S1381116916304812/sc1/HIGHRES/image/jpeg/c6c5f2e74a297a5c6b24146d6fb0a775/sc1_lrg.jpg sc1 sc1_lrg.jpg jpg 75369 375 1333 IMAGE-HIGH-RES 1-s2.0-S1381116916304812-sc2_lrg.jpg https://s3-eu-west-1.amazonaws.com/prod-ucs-content-store-eu-west/content/pii:S1381116916304812/sc2/HIGHRES/image/jpeg/30836c3f78c4dd76624e844880d36428/sc2_lrg.jpg https://s3.amazonaws.com/prod-ucs-content-store-us-east/content/pii:S1381116916304812/sc2/HIGHRES/image/jpeg/30836c3f78c4dd76624e844880d36428/sc2_lrg.jpg sc2 sc2_lrg.jpg jpg 324421 1701 3000 IMAGE-HIGH-RES 1-s2.0-S1381116916304812-sc3_lrg.jpg https://s3-eu-west-1.amazonaws.com/prod-ucs-content-store-eu-west/content/pii:S1381116916304812/sc3/HIGHRES/image/jpeg/210d097eabb2b775c99a38e9aff7f177/sc3_lrg.jpg https://s3.amazonaws.com/prod-ucs-content-store-us-east/content/pii:S1381116916304812/sc3/HIGHRES/image/jpeg/210d097eabb2b775c99a38e9aff7f177/sc3_lrg.jpg sc3 sc3_lrg.jpg jpg 142798 979 2500 IMAGE-HIGH-RES 1-s2.0-S1381116916304812-sc4_lrg.jpg https://s3-eu-west-1.amazonaws.com/prod-ucs-content-store-eu-west/content/pii:S1381116916304812/sc4/HIGHRES/image/jpeg/da223ccf205c9a00287244409b6f4b25/sc4_lrg.jpg https://s3.amazonaws.com/prod-ucs-content-store-us-east/content/pii:S1381116916304812/sc4/HIGHRES/image/jpeg/da223ccf205c9a00287244409b6f4b25/sc4_lrg.jpg sc4 sc4_lrg.jpg jpg 180921 764 2500 IMAGE-HIGH-RES 1-s2.0-S1381116916304812-sc5_lrg.jpg https://s3-eu-west-1.amazonaws.com/prod-ucs-content-store-eu-west/content/pii:S1381116916304812/sc5/HIGHRES/image/jpeg/20ee9e689d62e614145c8210d1280e60/sc5_lrg.jpg https://s3.amazonaws.com/prod-ucs-content-store-us-east/content/pii:S1381116916304812/sc5/HIGHRES/image/jpeg/20ee9e689d62e614145c8210d1280e60/sc5_lrg.jpg sc5 sc5_lrg.jpg jpg 93146 444 2500 IMAGE-HIGH-RES 1-s2.0-S1381116916304812-sc6_lrg.jpg https://s3-eu-west-1.amazonaws.com/prod-ucs-content-store-eu-west/content/pii:S1381116916304812/sc6/HIGHRES/image/jpeg/0259b1497531010f49af79493ef8cfd1/sc6_lrg.jpg https://s3.amazonaws.com/prod-ucs-content-store-us-east/content/pii:S1381116916304812/sc6/HIGHRES/image/jpeg/0259b1497531010f49af79493ef8cfd1/sc6_lrg.jpg sc6 sc6_lrg.jpg jpg 258124 1535 2167 IMAGE-HIGH-RES 1-s2.0-S1381116916304812-sc7_lrg.jpg https://s3-eu-west-1.amazonaws.com/prod-ucs-content-store-eu-west/content/pii:S1381116916304812/sc7/HIGHRES/image/jpeg/e406d310053978b04e0658fcb101f696/sc7_lrg.jpg https://s3.amazonaws.com/prod-ucs-content-store-us-east/content/pii:S1381116916304812/sc7/HIGHRES/image/jpeg/e406d310053978b04e0658fcb101f696/sc7_lrg.jpg sc7 sc7_lrg.jpg jpg 106037 438 2500 IMAGE-HIGH-RES 1-s2.0-S1381116916304812-mmc1.docx https://s3-eu-west-1.amazonaws.com/prod-ucs-content-store-eu-west/content/pii:S1381116916304812/mmc1/MAIN/application/msword/967aedddf56a8bf2f25d0311d30e5bac/mmc1.docx https://s3.amazonaws.com/prod-ucs-content-store-us-east/content/pii:S1381116916304812/mmc1/MAIN/application/msword/967aedddf56a8bf2f25d0311d30e5bac/mmc1.docx mmc1 mmc1.docx docx 5342329 APPLICATION MOLCAA 10104 S1381-1169(16)30481-2 10.1016/j.molcata.2016.11.007 Elsevier B.V. Scheme 1 General structure for pincer metal complexes. Scheme 1 Scheme 2 Synthetic procedure of MNP@NNN-pincer/Cu. Scheme 2 Scheme 3 Preparation of MNP@TCT via immobilization of 1 on MNP. Scheme 3 Scheme 4 The scope of alkyl acetylenecarboxylates (propiolates) in the oxidative homocoupling reaction using MNP@NNN-pimcer/Cu. Scheme 4 Scheme 5 Synthesis of 1-benzyl-1,2,3-triazole-4-alkylcarboxylates with MNP@NNN-pincer/Cu. Scheme 5 Scheme 6 Synthesis of amino acid functionalized-1,2,3-triazoles with MNP@NNN-pincer/Cu. Scheme 6 Scheme 7 Investigation on the highest activity of catalyst obtainable with 0.004 mol% catalyst. Scheme 7 Fig. 1 FT-IR spectra of MNP (a), MNP@APTS (b), MNP@TCT (c), MNP@TCT/Amp (d) and MNP@NNN-pincer/Cu (e); (I): normal range 400–4000cm−1, (II): magnified region 1200–1900cm−1. Fig. 1 Fig. 2 (I) TGA curves of bare MNP (a), MNP@APTS (b), MNP@TCT (c), MNP@TCT/Amp (d); (II) DTG curve of MNP@TCT/Amp. Fig. 2 Fig. 3 XRD (a) and RDP (b) patterns of the MNP@NNN-pincer/Cu. Fig. 3 Fig. 4 The EDX analysis of MNP@NNN-pincer/Cu. Fig. 4 Fig. 5 VSM curves for Fe3O4 (a), MNP (b) and MNP@NNN-pincer/Cu (c). Fig. 5 Fig. 6 TEM image of Fe3O4 (a) and catalyst MNP@NNN-pincer/Cu (b). Fig. 6 Fig. 7 Results of recyclability and leaching experiment of MNP@NNN-pincer/Cu in the click reaction. Fig. 7 Table 1 The results for elemental analysis of catalyst. Table 1 Entry Sample %C a %H a %N a %Other element b Loading(mmol/g) 1. MNP@APTS 2.62 1.47 0.76 – 0.54 2. MNP@TCT 4.10 1.69 2.81 Cl: 3.45 0.50 3. MNP@TCT-Amp 8.83 2.52 4.58 Cl: 0.15 0.41 4. MNP@NNN-pincer/Cu 8.22 1.93 4.45 Cu: 2.27I: 4.69 0.36 a Calculated by CHN analyzer. b Obtained from XRF analysis. Table 2 Optimization of various reagents and conditions for aerobic oxidative homocoupling of phenylacetylene using MNP@NNN-pincer/Cu a . Table 2 Optimization Entry Cat. (mol%) Solvent Base T (°C) Time (h) Yield 3a % b Solvent 1 1.5 H2O Et3N r.t. 11 63 2 1.5 CH2Cl2 Et3N r.t 8 57 3 1.5 MeCN Et3N r.t 3 81 c 4 1.5 – Et3N r.t 3 85 5 1.5 Toluene Et3N r.t 15 42 Base 6 1.5 – DIPEA r.t 7 77 7 1.5 – K2CO3 r.t 17 trace 8 1.5 – morpholine r.t. 1 >99 9 1.5 – – r.t. 7, 18, 24 85, 39, 0 d 10 1.5 DABCO r.t. 4 80 Catalyst loading 11 – – morpholine 80 24 – 12 MNP@TCT-Amp (40mg) – morpholine 80 24 – 13 1 – morpholine r.t. 1 >99 14 0.9 – morpholine r.t. 1 >99 15 0.8 – morpholine r.t. 2 >99 16 0.6 – morpholine r.t. 2.5 >99 1717 0.38 – morpholine r.t. 2.5 >99 (81 e ) 18 0.38 (A:CuI, 1:1) MeCN morpholine r.t. 3 >99 f 19 0.2 – morpholine r.t 7 92 Temperature 20 0.2 – morpholine 50 5 94 21 0.2 – morpholine 80 5 95 a Reaction condition: phenylacetylene (1mmol), base (1.2mmol), solvent (2mL for entries 1–3, 5). b GC yield. c Leaching is high. d Yields are for three successive runs starting with 40mg catalyst. e Isolated yield. f Reaction condition: phenylacetylene (1mmol), morpholine (1.2mmol), MeCN (2mL), ligand A (0.38 mol%), CuI (0.38 mol%). Table 3 Synthesis of 1,3-diynes using MNP@NNN-pincer/Cua,b. Table 3 aGC Yields; isolated yields are in parentheses. bReaction conditions, A: terminal alkyne (1mmol), morpholine (1.2mmol), MNP@NNN-pincer/Cu (0.38 mol%), r.t, solvent-free; B: terminal alkyne (1mmol), morpholine (1.2mmol), MNP@NNN-pincer/Cu (0.76 mol%), 60°C, solvent free. Table 4 Optimization of reaction conditions for the click reaction using MNP@NNN-pincer/Cu a . Table 4 Yield(%) b NaN3 (eq) Time (h) T (°C) Cat. (mol%) Solvent Entry 20 1 12 r.t 0.38 – 1 41 1 8 r.t 0.38 DMF 2 15 1 12 r.t 0.38 CH3CN 3 trace 1 9 r.t 0.38 CH2Cl2 4 45 1 7 r.t 0.38 MeOH 5 81 (92) 1 1.5 r.t 0.38 H2O 6 55 1 5 r.t 0.38 MeOH:H2O (1:1) 7 75 c 1 24 reflux – H2O 8 78 (88) 1 2.5 r.t 0.2 H2O 9 85 1 2.5 r.t 0.12 H2O 10 76 (90) 1 4 r.t 0.12 H2O 11 81 (91) 1 5 r.t 0.04 H2O 12 82 (95) 1 2 50 0.04 H2O 13 90 (97) 1.3 2 50 0.04 H2O 1414 81 1.3 1.5 70 0.04 H2O 15 88 d 1.3 1.5 50 0.04 (A/CuI, 1:1) H2O 16 82 d 1.3 2 r.t. 0.04 (A/CuI, 1:1) H2O 17 a Reaction conditions: benzyl bromide (1mmol), phenylacetylene (1mmol), solvent (2mL). b Yields are based on isolated products; yields in parentheses are based on GC analysis. c Mixture of regioisomers. d Reaction conditions: benzyl bromide (1mmol), phenyl acetylene (1mmol), H2O (2mL), ligand A (0.04 mol%), CuI (0.04 mol%). Table 5 Synthesis of 4-phenyl-1,2,3-triazle derivatives using MNP@NNN-pincer/Cua,b. Table 5 aReaction Condition: phenylacetylene (1mmol), NaN3 (1.3mmol), halide (1mmol), catalyst (1mg, 0.04 mol%), H2O (2mL), 50°C. bYields are based on GC analysis; values in parentheses are isolated yields. cNaN3 (3mmol), 80°C. Table 6 Synthesis of 4-alkyl-1,2,3-triazole derivatives using MNP@NNN-pincer/Cua,b. Table 6 aReaction Condition: terminal alkyne (1mmol), NaN3 (1.3mmol), halide (1mmol), catalyst (5mg, 0.19 mol%), H2O (2mL), 80°C. bYields are based on GC analysis; values in parentheses are isolated yields.cNaN3 (3mmol). Table 7 Comparing catalytic activity of MNP@NNN-pincer/Cu with homogeneous and heterogeneous copper catalysts in the aerobic oxidative homocoupling of terminal alkynes. Table 7 Homogeneous catalysts Cu(CF3CO2)2·H2O (20 mol%), [BMIm][Br] (0.6 eq.), H2O, 50°C, 24h, unrecoverable60 CuI (2 mol%), PdCl2 (0.1 mol%), P(Ph)2CH2CH2CO2H (0.2 mol%), r.t., Et3N, DMF, 24h, unrecoverable54 CuCl (5 mol%), DBU (250 mol%), ScCO2 (8MPa), O2 (1MPa), unrecoverable55 CuI (0.5 mol%), benzylamine (5 mol%), solvent-free, r.t., O2, unrecoverable53 Heterogeneous catalysts Meso Cu/MnOx (6 mol%), air, toluene, 105°C, recoverable (filtration), reusable (8 runs) [56] PS-TEDETA-CuSO4 (10 mol%), piperidine (1 eq.), toluene, air, 60°C, 24h, recoverable (filtration), reusable (9 runs) [57] PANFTA.CuI (2 mol%), n-BuNH2 (0.5 eq.), AcOEt, air, r.t. 12h, recoverable (tweezers), reusable (16 runs) [58] Cu(II)-TD@nSiO2 (0.6 mol%), DBU (20 mol%), MeCN, r.t., air, 1–3h, recoverable (filtration), reusable (8 runs) [59] This work: MNP@NNN-pincer/Cu (0.38-0.76 mol%), morpholine (1 eq.), r.t.–60°C, solvent free, 2.5–15h, recoverable (external magnet), reusable (6 runs). Table 8 Comparing catalytic activity of MNP@NNN-pincer/Cu with homogeneous and heterogeneous copper catalysts in the click reaction. Table 8 Homogeneous catalysts PNP-pincer/Cu complex (1 mol%), 60°C, super dry Et2O, 16h, unrecoverable67 NNN-pincer/Cu complex (0.1 mol%), CH2Cl2, r.t., N2, 0.5h, unrecoverable [68] NNC-pincer/Cu complex (2 mol%), DMF, N2, 80°C, 5h, unrecoverable [66] [Cu2(bpoh)(PPh3)4]·(0.1 mol%), MeCN, r.t., 3h, unrecoverable64 Heterogeneous catalysts PEG-tristrz-CuI (20ppm), H2O, N2, 35°C, 20h, recoverable (filtration), reusable (6 runs)[69] PMMA-supported Schiff base/Cu(II) (2 mol%), Na-ascorbate (20 mol%), EtOH, N2, r.t., 24h, recoverable (filtration), reusable (4 runs)[70] POSS-SAL-Cu (II) (2.6 mol%), H2O, 70°C, recoverable (filtration), reusable (4 runs)[63] P[imCu/IL][Cl] (0.1 mol%), H2O/ t BuOH, 55°C, 2h, recoverable (filtration), reusable (12 runs)[71] This work: MNP@NNN-pincer/Cu (0.38-0.76 mol%), r.t.–60°C, solvent free, 2.5–15h, recoverable (external magnet), reusable (8 runs). NNN-pincer-copper complex immobilized on magnetic nanoparticles as a powerful hybrid catalyst for aerobic oxidative coupling and cycloaddition reactions in water Dedicated to Dr. Seyed Hassan Hosseini, my friend, my love, my co-worker, and my husband on the occasion of his 31st birthday. Nasrin Zohreh ⁎ Mahboobeh Jahani Department of Chemistry, Faculty of Science, University of Qom, P. O. Box: 37185-359, Qom, Iran Department of Chemistry Faculty of Science University of Qom P. O. Box: 37185-359 Qom Iran ⁎ Corresponding author. Graphical abstract A simple and reliable methodology is described for preparing the first heterogeneous NNN-pincer-copper hybrid catalyst with a high control over surface composition. The strategy relies on the covalently bonding of 2-aminopyridine to cyanuric chloride-functionalized magnetic nanoparticles followed by complexation with CuI. These claims are confirmed by different characterization methods such as SEM, TEM, FT-IR, TGA, ICP, XRD, and elemental analysis. The finely engineered supported catalyst is employed in the aerobic oxidative coupling of terminal alkynes and click reaction using only 0.38 and 0.04 mol% catalyst, respectively. All reactions perform under solvent-free condition or green solvent H2O. Also, the catalyst is readily recovered and reused for up to 8 and 6 subsequent runs in click and homocoupling reactions without significant loss of activity or leaching. Keywords NNN-Pincer catalyst Copper catalyst Heterogeneous catalyst Cyanuric chloride Terminal alkyne homocoupling Click reaction 1 Introduction Pincer ligands are extensively used in many diverse areas of chemistry primarily as a means to direct and modulate the properties of a metal center to which it is bonded (Scheme 1 ) [1–4] Prof. Shaw, together with Dr. C.J. Moulton, [5] were the first ones to report examples of pincer compounds. However, the term “pincer” was first coined by van Koten in 1989 because of its similarity to a wretch or spanner. [6] An important characteristic of the pincer platforms is the fact that its three ligating sites are well organized by the backbone of the ligand which leads to the possible formation of five- or six-membered chelate rings in which the central metal-heteroatom bond is in common (Scheme 1). Up to now, a multifaceted combination of donor sets has been explored that includes combinations of, e.g., neutral, anionic, Lewis basic and acidic, arene, heteroaromatic, and carbine donors. [7–11] Moreover, in some cases, the pincer platform itself acts as a non-innocent ligand (NIL) or provides, with its pincer-metal manifold, a system that is suitable for executing metal-ligand cooperative (MLC) behavior in, e.g., catalytic processes. [12,13] At present, considering the wide range of metals, the number of possibilities seems to have no limit; most excitingly, many of these novel pincer ligand/metal combinations lead to the discovery of new catalysts for various bond formation processes in organic synthesis, [14–16] new polymerization technologies, [17] the chemical conversion of CO2, [18] and the activation of bonds that so far were considered as primarily unreactive. [19,20] Among numerous metal-EZE’ pincer catalysts, catalysts with pincer ligands of the type NNN (symmetric or unsymmetric, neutral or anionic) have been more considered because of the powerful chelating property of most metals. [21–25] In addition, designing a wide range of chiral moiety bonded to each nitrogen atom makes metal-NNN-pincer complexes very applicable in asymmetric synthesis. [25–27] After the introduction of heterogenization concept in the realm of catalysis science, thousand types of homogeneous catalysts have been immobilized on solid supports and applied in chemical reactions or industrial processes. [28] Recently, having considered the advantages of heterogeneous catalyst on the one hand, and unique and effective properties of pincer catalyst on the other hand, heterogenization of pincer catalysts has attracted much attention that could be interesting for modifying many chemical processes. The use of MOF, [29,30] mesoporous silica, [31,32] resins, [33] MNP, [34,35] CNT, [36] and SiO2 [37] as solid supports for immobilization of pincer catalysts, are some examples. According to literature, there are a few reports on heterogeneous NNN-pincer catalyst. [34,38] Given these considerations and continuing our previous works, [39–41] we have investigated the immobilization of 2,4,6-trichloro-1,3,5-triazine (cyanuric chloride, TCT)-derived copper pincer complex onto the large surface area of highly dispersed magnetic nanoparticles. The catalytic activity of the resulting magnetic NNN-pincer copper catalyst is studied in both of terminal alkyne homocoupling and click reactions. To the best of our knowledge, there is no report on heterogeneous NNN-pincer copper catalyst. 2 Experimental 2.1 Materials and methods Ferric chloride hexahydrate (FeCl3·6H2O), ferrous chloride tetrahydrate (FeCl2·4H2O), ammonia (25%), tetraethyl orthosilicate (TEOS), (3-aminopropyl)trimethoxysilane (APTS), and 2,4,6-trichloro-1,3,5-triazine (TCT) were obtained from Sigma-Aldrich without further purification. N,N-Diisopropylethylamine (DIEA) was purchased from Merck and distilled before use. Na2WO4. 4H2O and 2-aminopyridine were purchased from Merck. Various commonly used organic solvents (Merck) were dried with several different drying agents. FT-IR spectra of samples were taken using an ABB Bomen MB-100 FT-IR spectrometer. Thermogravimetric analysis (TGA) was acquired under a nitrogen atmosphere with a TGA Q 50 thermogravimetric analyzer. Transmission electron microscopy (TEM) images were taken with a Philips CM30 electron microscope. Magnetization of catalyst was measured by vibrating sample magnetometer (Meghnatis Daghigh Kavir Co., Kashan, Iran). The X-ray diffraction (XRD) pattern was recorded on Rigaku D/Max-3c X-ray diffractometer. X-Ray fluorescence (XRF) was taken using Phillips 1404 XRF instrument. Atomic absorption spectrometry (AAS, Shimadzu 680A) or inductively coupled plasma-optical emission spectrometry (ICP-AES, Perkin-Elmer DV 4300) were used for elemental measurements. CHN Elemental analyses were performed using a Heraeus Elemental Analyzer CHN (Elementar-Analysesysteme). Conversions and yields were measured using a 6890 gas chromatograph (GC) with an Agilent Technologies HP-Innowax. 2.2 Preparation of amine functionalized magnetic nanoparticles (MNP@APTS) Silica coated Fe3O4 nanoparticles (MNPs) were synthesized based on our previously reported method. [42] Prepared MNPs (1.0g) were ultrasonically dispersed in 50mL ethanol/water (4/1) mixture. Then, APTS (5mL) was added and the mixture was stirred at 80°C for 24h. The APTS coated magnetic nanoparticles (MNP@APTS, 1.0g) were magnetically separated and washed several times with methanol (4×30mL) and dried under vacuum at 50°C. 2.3 Synthesis of APTS-functionalized TCT (compound 1) To a 50mL flask containing TCT (1mmol), DIPEA (1mmol), and super dry THF (3mL) in ice bath (–5°C), APTS (1mmol) was added dropwise. The reactants were vigorously stirred for 2h. Then, the solvent was evaporated under vacuum at 50°C. The crude product 1 was analyzed using [1]H NMR spectrum. 2.4 Preparation of pincer ligand TCT/Amp-functionalized magnetic nanoparticles (MNP@TCT/Amp) In a round bottom flask, MNP@APTS (1.0g) was ultrasonically dispersed in dry THF (15mL) and the flask was put in an ice bath. Then, TCT (5mmol, 1.0g) and DIEA (7mmol, 1.2mL) were added. The mixture was stirred for 2h under N2 atmosphere. The product (MNP@TCT) was magnetically separated and washed with THF (5×10mL) and dried under vacuum at room temperature. In a three necked round bottom flask, MNP@TCT (0.98g) was dispersed in dry CH3CN (25mL) and 2-aminopyridine (4.5mmol, 0.42 gr) was added to flask. The flask was equipped with a condenser and the mixture was refluxed for 12h to produce MNP@TCT/Amp ligand. The heterogeneous ligand was separated using a magnet and washed with methanol (5×10mL) and dried under vacuum at 50 °C (0.95g). 2.5 Preparation of NNN-pincer type nanomagnetic copper catalyst (MNP@NNN-Pincer/Cu) For complexation of MNP@TCT/Amp ligand with CuI, MNP@TCT/Amp (0.95g) was dispersed in CH3CN (10mL) and CuI (2mmol, 0.38g) was added to the mixture. The mixture was stirred for 12h at room temperature. The final catalyst (MNP@ NNN-Pincer/Cu) was magnetically separated and washed with CH3CN (2×10mL), water (3×10mL) and methanol (2×10mL) and dried under vacuum at 50 °C (0.95g). 2.6 Synthesis of 2,4,6-tri(aminopyridinyl)-1,3,5-triazine ligand (ligand A) To a 50mL flask containing TCT (5mmol), DIPEA (25mmol), and MeOH (8mL) in ice bath (–5°C), 2-aminopyridine (15mmol) was added dropwise. The reactants were vigorously stirred for 2h. Then, the temperature of the reaction was raised to 70°C and the reaction refluxed for additional 12h. Then, solvent was evaporated and the product A was washed with EtOH, CHCl3, and Et2O and dried under vacuum. 2.7 General procedure for aerobic oxidative homocoupling reaction of terminal alkyne Terminal alkyne (1mmol), morpholine (1.2mmol), and catalyst MNP@NNN-Pincer/Cu were loaded in a 25mL round bottom flask. The reactants were vigorously stirred at room temperature (or 60°C) for a defined time (the amount of catalyst loading and temperature were selected according to Table 3 ). Completion of the reaction was monitored by TLC until the initial alkyne consumed and no further product (comparing with the related known product by TLC) was formed. After completion of the reaction, methanol was added and the catalyst was magnetically separated, washed with methanol (3×10mL) and dried for another run. The product mixtures were analyzed by gas chromatography (GC). The isolated yields of products were determined after purification of product using column chromatography (hexane/ethyl acetate as eluent). 2.8 General procedure for azide/alkyne cycloaddition reaction (click reaction) Terminal alkyne (1mmol), halide (1mmol), NaN3, H2O (2mL), and catalyst MNP@ NNN-Pincer/Cu were loaded in a 25mL round bottom flask. The reactants were vigorously stirred at 50 or 80°C for the defined time (the amount of azide and catalyst loading were selected according to Tables 5 and 6 ). Completion of the reaction was monitored by TLC until the initial alkyl halide and alkyne were consumed and no further product was formed (comparing with the related known product). Consuming of alkyl halide is not the only evidence for the completion of the reaction because the consumption of alkyl halide may be due to the formation of alkyl azide. Having completed the reaction, methanol (2mL) was added and the catalyst was magnetically separated, washed with methanol (3×10mL) and dried for another run. The product mixtures analyzed by gas chromatography (GC). In order to obtain isolated yield of products after completion of the reaction, the catalyst was magnetically separated and the reaction mixture was extracted with ethyl acetate. Solvent was evaporated and the product was recrystallized from ethyl acetate or purified using column chromatography (hexane/ethyl acetate as eluent). 2.9 Reusability test of catalyst MNP@NNN-pincer/Cu in click reaction Phenylacetylene (5mmol), alkyl halide (5mmol), NaN3 (6.5mmol), H2O (2mL), and catalyst MNP@ NNN-Pincer/Cu (0.04 mol%, 5mg) were loaded in a test tube. The reactants were vigorously stirred at 50°C for a defined time. After completion of the reaction, catalyst was carefully collected at the bottom of test tube using an external magnet and reaction mixture decanted in another pot. The catalyst was washed with MeOH (10mL) and utilized directly in the next run without separation from test tube. 3 Result and discussion 3.1 Synthesis and characterization of catalyst Continuing our previous works on magnetic catalysts, here, we report a robust, simple and general methodology to easily get access to magnetic NNN-pincer copper catalyst. Initially, we supposed that 1,3,5-triazinetrichloride (cyanuric chloride, TCT) could serve as a core with three reactive sites that can bind to heterogeneous supports through substitution of one chloride and functionalize further through substitution of the other clorides. [43–45] We further took advantage of 2-aminopyridine as a powerful ligand [46,47] while bonding to TCT. Accordingly, we designed the magnetic NNN-pincer copper catalyst MNP@NNN-pincer/Cu easily via a few steps as visualized in Scheme 2 . First, magnetic Fe3O4 nanoparticles were synthesized by a co-precipitation method [48,49] in the basic condition and covered by a silica layer to protect Fe3O4 from oxidative and acidic mediums. Then the surface of MNP was modified with APTS to provide amine group for further functionalization. Afterward, MNP@APTS was conducted to react with TCT via substitution of one Cl with amine group in the basic condition. Due to the high reactivity of TCT, this step was performed in ice bath using dry solvent to avoid further substitution of TCT. To ensure successful substitution of one Cl, the reaction of TCT with APTS was also carried out under similar condition according to Scheme 3 and the structure of product 1 was confirmed by NMR spectrum. On the other hand, compound 1 was immobilized on the surface of MNP to confirm successful preparation of MNP@TCT (Scheme 1S and Fig. 2 S). In the next step, MNP@TCT was subjected to react with 2-aminopyridine. This is the key step and both chlorides must be replaced with 2-aminopyridine to obtain pincer platform MNP@TCT/Amp. Therefore the reaction was performed under reflux condition for complete substitution. The final catalyst MNP@NNN-pincer/Cu was achieved via complexation of CuI with pincer platform in acetonitrile as solvent at room temperature. To verify the successful incorporation of the organic components and the maintenance of the Si-C bonds during the catalyst preparation, FT-IR spectrum was used in each step. Fig. 1 -(I) shows the FT-IR spectra of MNP (a), MNP@APTS (b), MNP@TCT (c), MNP@TCT/Amp (d) and MNP@NNN-pincer/Cu (e). Two absorbance bands at 630 and 1090cm−1 in Fig. 1a-e(I) show stretching frequency of Fe-O and Si-O bonds of MNP that confirmed successful preparation of silica coated Fe3O4 without changing during all modifications. Region through 1200–1900cm−1 is magnified to clarify the effect of all functionalization steps (Fig. 1-II). Functionalization of MNP with APTS (Fig. 1b-II), was confirmed by the appearance of characteristic bands at 1410 and 1466cm−1 which is related to stretching vibrations of CN bonds. The FT-IR spectrum of MNP@TCT (Fig. 1c-II) showed strong absorption bands at 1610, 1560, and 1509cm−1 corresponding to CN of TCT. Stretching absorption of unreacted CCl is completely obscured by the bending vibration of the Si-O-Si bond. In the IR spectrum of MNP@TCT/Amp (Fig. 1d-II), comparing to MNP@TCT (Fig. 1c-II), the CN absorption bands shifted to 1656, 1619, and 1542cm−1. This is strong evidence for the presence of several CN bonds which is the result of the replacement of both of Cl by 2-aminopyridine. Coordination of CuI to the pincer ligand has no effect on the IR spectrum of MNP@NNN-pincer/Cu (Fig. 1e-II comparing to its precursor). Thermogravimetric analysis (TGA) was performed on bare MNP, MNP@APTS, MNP@TCT, and MNP@TCT/Amp (Fig. 2I, a-d) to investigate the organic content of each intermediate and final catalyst. The weight losses through 100–150°C were attributed to the loss of absorbed water molecules on the surface of all samples. The TGA curve of MNP@APTS (Fig. 2Ib) showed a weight loss at 260 °C, which is attributed to the degradation of amino propyl groups. From this weight loss (3.3wt%), the loading amount of APTS on the surface of MNP was calculated to be 0.56mmolg−1. Increasing the weight loss in the TGA curve of MNP@TCT to 10.6wt% (Fig. 2Ic) showed successful incorporation of TCT to amine-functionalized MNP. The Loading amount was also calculated to be 0.48mmolg−1 for APTS/TCT segment on MNP. The weight loss increased again when MNP@TCT reacted with 2-aminopyridine (13.7wt%) (Fig. 2I-d). From this weight loss, the loading of NNN-pincer ligand on the surface of MNP was calculated to be 0.42mmolg−1. After complexation of CuI by pincer ligand, no significant change was observed in the TGA carve of MNP@NNN-pincer/Cu because of inorganic identity of CuI. From Fig. 2I-d, it was found that magnetic pincer ligand is thermally stable up to 270°C. The DTG analysis of the ligand also showed three peaks at 100, 260 and 340°C which were attributed to loss of water molecules and organic compartments (Fig. 2II). The XRD pattern of MNP@NNN-pincer/Cu is completely matched with the XRD pattern of the Fe3O4 standard sample (JCPDS file No. 19-0629), confirming the presence of Fe3O4 which indicated that all modifications did not change the crystalline phase of Fe3O4 (Fig. 3 a). The broad peak at 2θ=20-30 is attributed to the amorphous silica phase in the catalyst structure. The electron ring diffraction pattern (RDP) of the catalyst showed the crystallinity of Fe3O4 nanoparticles support (Fig. 3b). Energy-dispersive X-ray analysis (EDX) of MNP@NNN-pincer/Cu indicated the presence of C, O, N, Si, Fe, and impotantly Cu elements in the catalyst structure (Fig. 4 ). From this analysis, it was found that the amount of Cl is very low in comparison with other element indicated displacment of Cl with aminopyridine in high percentage (third step of catalyst preparation). This analysis also confirms the successful immobilization of the Cu(I) on the surface of MNP by a pincer ligand. Magnetization property of catalyst was examined using VSM analysis. VSM curves of Fe3O4, Fe3O4@SiO2 (MNP) and catalyst MNP@NNN-pincer/Cu are shown in Fig. 5 a-c, respectively. Reasonable decrease in magnetization intensity of Fe3O4@SiO2 compared to Fe3O4 is due to SiO2 layer on Fe3O4. Magnetic saturation (MS) values 54.5emug−1 of catalyst showed 15.2emug−1 diminution compared to MNP which is another claim for functionalization of MNP with organic components. However, the magnetization of catalyst is still enough to respond to an external magnetic field (Fig. 5). The morphology, particle size, and crystallinity of Fe3O4 support and MNP@NNN-pincer/Cu nanocatalyst were determined by high resolution TEM. Fig. 6 a shows the Fe3O4 dark particles which have an average size of 7nm. The TEM image of the MNP@NNN-pincer/Cu (Fig. 6b) shows gray layer of SiO2 accompanied with organic components around Fe3O4 particles with an average particle diameter of 17nm. The content of Cu(I) in MNP@NNN-pincer/Cu was examined by atomic absorption spectroscopy (AAS) using standard samples. It was found that the loading amount of Cu(I) ion in the catalyst structure is 0.38mmolg−1. The XRF analysis of MNP@ NNN-pincer/Cu obtained 2.27 and 4.69wt% for Cu and I which are corresponded to 0.36 and 0.37mmolg−1 consisting the result of AAS for loading of Cu(I). Also, the XRF analysis showed that no significant amount of Cl (0.15wt%) remained in MNP@ NNN-pincer/Cu. These results are in agreement with EDS analysis. Table 1 shows the elemental analysis of the catalyst MNP@TCT-Amp/Cu. CHN analysis showed that after the reaction of TCT with MNP@APTS, the weight percent of carbon and nitrogen increased, demonstrating the successful attachment of TCT to MNP@APTS. From N content of MNP@APTS (0.76wt%), the loading of APTS was calculated to be 0.54mmolg−1 which is along with TGA data. The presence of 3.45wt% of Cl obtained from the XRF analysis of MNP@TCT proved that only one chloride of TCT was reacted in this step. This also gave the loading 0.50mmolg−1 for MNP@TCT. The weight percent of N in MNP@TCT/Amp rose again after the reaction of MNP@TCT with 2-aminopyridine (Entry 3). In addition, the weight percent of Cl dramatically decreased, to 0.15wt% confirming the complete substitution of two Cl with 2-aminopyridine. On complexation of CuI to pincer ligand, no significant change was observed in the%CHN of catalyst compared to its ligand. 3.2 Reactions and scopes Elegant recent studies on metal-catalyzed oxidative coupling reactions involving terminal alkynes, [50–60] provided useful starting points for our investigations on the efficiency of MNP@NNN-pincer/Cu. Thus, oxidative homocoupling reaction of phenylacetylene was chosen as a model system for optimization studies (Table 2). Initially, the effect of solvent was screened using 1.5 mol% MNP@NNN-pincer/Cu in the presence of Et3N as base (entries 1–5). The reaction exhibited the high activity and 85% yield of product 3a under solvent free condition. Performing the reaction in MeCN obtained high yield of product while the leaching of Cu(I) was also high. Evaluation of base effect on the reaction under solvent free condition (entries 6–10) revealed that morpholine is a good base for production of more than 99% yield of product. Since the catalyst has many nitrogen atoms on its surface, we guessed that the catalyst could be also served as a basic catalyst and therefore the reaction could be preceded without any external base. In effect, this claim was true and the reaction obtained relatively good yield of product in the presence of MNP@NNN-pincer/Cu without any base, but the catalyst activity decreased in second and third successive runs (entry 9). In the final step, the amount of catalyst loading was explored. It was found that decreasing the catalyst loading to 0.38 mol%, did not effect on the yield of product 3a (entries 13–17). However, using less than 0.38 mol% loading of catalyst, even with increasing the temperature, the yield of 3a was diminished (entries 19–21). Thus, condition of entry 17 was chosen as optimized condition. In order to comparison of catalytic activity of the MNP@NNN-pincer/Cu to that of the free complex in solution, ligand A [61] was prepared and applied in the reaction. The results showed that the use of 0.38 mol% homogeneous catalytic system A/CuI gave comparable results with heterogeneous system (entry 18). Apparently, immobilization of pincer catalyst onto the solid support allows easy separation of catalyst from the reaction mixture and importantly several reuse of heterogeneous systems without loss of activity; the factors are not obtained using the homogeneous catalytic systems. Terminal alkyne scope and product diversity were examined using various types of terminal alkynes under optimized conditions (Table 3). As shown in Table 3, aromatic alkynes gave 92–99% yield of 1,3-diynes (3a-e) at room temperature using 0.38 mol% of MNP@NNN-pincer/Cu. Aliphatic alkynes also smoothly underwent the reaction to produce 83–92% of 3f-j, however temperature and catalyst loading must be increased to 60°C and 0.76 mol%, due to the less reactivity of aliphatic terminal alkynes. In the next experiments, alkyl propiolates were also subjected to the homocoupling reaction under optimized condition. Unfortunately, any attempt failed to produce homocoupling product 3k. In the presence of morpholine as base, enaminone 4 formed. Examination of tertiary bases resulted in mixture of products (Scheme 4 ). Catalytic efficacy of the MNP@NNN-pincer/Cu was also examined in the copper catalyzed heterogeneous three-component cycloaddition reaction of alkyl halide, azide, and alkyne, Cu-AAC, known as click reaction. [62–71] The model reaction of benzyl bromide, sodium azide, and phenylacetylene was chosen for optimization of the reaction conditions (Table 4). Different parameters such as solvent, catalyst loading, temperature, and sodium azide amount were tested. As it’s evident from Table 4 (entries 1–7), solvent has a major effect on the reaction time and product yield. Under solvent-free condition, reaction did not produce acceptable yield after 12h. In aprotic solvent, even polar ones, low yield of product was obtained via a long reaction time. Instead, the reaction effectively proceeded in protic solvent, especially H2O. This effect could be attributed to high solubility of NaN3 or ionic intermediates in polar protic solvents. In addition, heterogeneous catalyst MNP@NNN-pincer/Cu is highly dispersible in H2O. Water is also a green and cheap solvent. Thus, H2O was chosen as solvent for further optimization. Optimization of catalyst loading was then examined starting from catalyst-free conditions. Mixture of 1,4- and 1,5-diphenyl-1,2,3-triazoles (3:1, 75%) were obtained after 24h under reflux condition (entry 8), showing the effect of copper catalyst on selectivity and affectivity of the click reaction. From Table 4, entries 9–15, it was found that catalyst loading, time, and temperature simultaneously affect on the yield of 5a. Increasing the time and temperature to 2h and 50°C has compensated diminishing of catalyst loading from 0.38 to 0.04 mol% with almost equal yields (Compare entry 6 with 13, Table 4). It was also observed that increasing the amount of NaN3 enhanced the yield of product up to 97%, while increasing the temperature to 80°C results in a mixture of 1,5- and 1,4-isomers (1:2.7, 81%, entry 15). Consecutively, the most suitable result was obtained for the reaction in the presence of 0.04 mol% MNP@NNN-pincer/Cu and 1.3 eq. NaN3 in H2O at 50°C (Table 4, entry 14). Application of homogeneous copper catalytic system A/CuI was also examined and its activity was compared with MNP@NNN-pincer/Cu (entries 16–17). However, the homogeneous catalytic system was as effective as heterogeneous; it suffers from unrecyclability and unreusability. After finding the optimal reaction conditions, the generality and scope of the click cycloaddition with MNP@NNN-pincer/Cu were further explored with diverse alkyl halides and terminal alkynes. With phenylacetylene as substrate (Table 5), 81–98% of product yields were acquired using a variety of benzyl halides (5a–f), allyl halide (5 g), and alkyl halides (5h–n). However, benzyl halides with electron donating group exhibited better reaction conditions in time and yield. It is notable that to perform the reaction with non-benzylic halides, NaN3 and temperature were increased to make substitution of azide and halide easier in H2O (5k–n). Catalyst MNP@NNN-Pincer/Cu also showed excellent activity in cycloaddition of aliphatic alkynes (Table 6) with sodium azide and various halides. Because of less reactivity of aliphatic alkynes compared to phenylacetylene, the click reaction with aliphatic proceeded with 0.19 mol% catalyst and 80°C (Table 6). Again, in the cases of aliphatic halides (Table 6, 6f–g, k), the amount of NaN3 must be increased to obtain good yields of product. Catalytic efficacy of MNP@NNN-pincer/Cu was also evaluated using electron-deficient terminal alkynes, which are normally difficult substrates for copper catalyzed click reaction. Good yields of 1-benzyl-1,2,3-triazole-4-alkylcarboxylate 7a-b were obtained with 0.04 mol% Cu-catalyst at 50°C via 10–12h (Scheme 5 ). This product is very interesting from synthetic point of view. [72–76] Click cycloaddition of amino acid-functionalized alkynes 8a-b with benzyl bromide and NaN3 was also tested in the presence of pincer catalyst. As depicted in Scheme 6 , good yields of amino acid-functionalized 1,2,3-triazoles 9a-b were obtained under the optimized condition. To investigate the highest activity of catalyst obtainable for the copper-catalyzed click reaction, another experiment was developed considering Scheme 7 . The large scale (10mmol) reaction of sodium azide, phenylacetylene and benzyl bromide was performed in the presence of 1mg MNP@PDMA-Cu (0.004 mol%). Surprisingly, excellent yield of 96% was obtained for 5a after 20h (Scheme 7). However, the time for completion of the reaction is relatively high, but calculation of the TON=25263 and TOF=1263h−1 shows that the catalyst is truly active and effective. To the best of our knowledge, these values of TOF and TOF for a un-polymeric heterogeneous catalyst have been rarely reported in the click reaction. [77] Ensuring recyclability of the heterogeneous catalysts while maintaining the catalytic efficiency is a prominent concern in the field of catalysis. Thus, the recyclability of MNP@NNN-pincer/Cu was explored and evaluated in the Cu-AAC reaction of benzyl bromide, NaN3, and phenylacetylene under the optimized condition (Fig. 7 a). The recyclability and reusability of the MNP@NNN-pincer/Cu were verified in eight consecutive cycles; with slightly decrease in the reactivity observed in the 7th and 8th cycles. All reactions were carried out in a test tube without separation of catalyst. After each run, the catalyst was carefully collected at the bottom of the test tube by applying an external magnetic field, reaction solution was decanted, and catalyst was washed with MeOH, and utilized directly in the next cycle. Reusability of the catalyst also examined in the aerobic oxidative homocoupling reaction of phenylacetylene (Fig. 1s). The catalyst was recovered and reused up to 6 successive runs without significant loss of activity. In order to gain insight into the heterogeneous nature of catalyst, the hot leaching test was carried out. The model reaction was performed under optimized conditions and catalyst was quickly collected from the hot solution after 1h. According to GC analysis of the reaction mixture at different times, as indicated in Fig. 7b, after ignition of the MNP@NNN-pincer/Cu no further reaction took place without catalyst. After 3h from removal of catalyst, the reaction mixture was also analyzed using ICP to determine the content of probable leached Cu(I) in the solution. As expected, because of high power of NNN-pincer ligand, no significant amount of Cu(I) was found in the solution demonstrating that MNP@NNN-pincer/Cu exhibits a typical heterogeneous catalyst nature. These results are also along with recyclability test (Fig. 7). 4 Conclusion In summary, MNP have been easily functionalized with a NNN-pincer ligand from TCT/Amp through simple and straightforward convergent protocols. The MNP@TCT-Amp was used as a powerful platform for the construction of nanomagnetic NNN-pincer catalyst in combination with Cu(I) that have been immobilized in situ. The characterization of the nanocatalyst proved that it was uniformly decorated with mean diameters of 17nm, exhibiting 0.38mmolg−1 loading of Cu(I). Investigations on the catalytic activity of MNP@NNN-pincer/Cu toward aerobic oxidative homocoupling of terminal alkyne and click reactions showed that catalyst was the best performer to catalyze various types of substrates. In both homocoupling and click processes, routine substrate scope have been carried out with just 0.38 and 0.04 mol% loading, respectively, but click reaction with only 0.004 mol% of catalyst was also possible through larger reaction time, allowing to obtain TON of up to 25,000. This value is higher than those reported with Cu(I) heterogeneous systems, indicating a kind of synergism among the components of the support. Importantly, the nanocatalyst resulted to be recyclable at least 8 times in the click reaction without remarkable loss of activity or significant leaching on Cu(I) according to AAS analysis. Table 7 demonstrates activity and reusability of the present catalyst in comparison with the most recent homogeneous and heterogeneous Cu catalysts in homocoupling reaction. In Table 8 , activity and reusability of MNP@NNN-pincer/Cu have been compared with recently reported homogeneous pincer and heterogeneous copper catalysts in the click reaction. Appendix A Supplementary data Supplementary data associated with this article can be found, in the online version, at http://dx.doi.org/10.1016/j.molcata.2016.11.007. Appendix A Supplementary data The following is Supplementary data to this article: References [1] M. Albrecht G. van Koten Angew. Chem. Int. Ed. Engl. 40 2001 3750 3781 [2] M. Asay D. Morales-Morales J. Chem. Soc. Dalton Trans. 44 2015 17432 17447 [3] H. Li B. Zheng K.-W. Huang Coord. Chem. Rev. 293 2015 116 138 [4] K.J. Szabó J. Mol. Catal. A: Chem. 324 2010 56 63 [5] C.J. Moulton B.L. Shaw J. Chem. Soc. Dalton Trans. 1976 1020 1024 10.1039/DT9760001020 [6] G. van Koten Pure Appl. Chem. 61 1989 1681 1694 [7] S. Murugesan K. Kirchner J. Chem. Soc. Dalton Trans. 45 2016 416 439 [8] H.A. Younus W. Su N. Ahmad S. Chen F. Verpoort Adv. Syn. Catal. 357 2015 283 330 [9] D. Yang Y. Tang H. Song B. Wang Organometallics 35 2016 1392 1398 [10] H. Zhang Y.-Q. Li P. Wang Y. Lu X.-L. Zhao Y. Liu J. Mol. Catal. A: Chem. 411 2016 337 343 [11] X. Lefèvre G. Durieux S. Lesturgez D. Zargarian J. Mol. Catal. A: Chem. 335 2011 1 7 [12] C. Gunanathan D. Milstein Chem. Rev. 114 2014 12024 12087 [13] S. Schneider J. Meiners B. Askevold Eur. J. Inorg. Chem. 2012 2012 412 429 [14] S. Werkmeister J. Neumann K. Junge M. Beller Chem. Eur. J. 21 2015 12226 12250 [15] G.E. Tyson K. Tokmic C.S. Oian D. Rabinovich H.U. Valle T.K. Hollis J.T. Kelly K.A. Cuellar L.E. McNamara N.I. Hammer J. Chem. Soc. Dalton Trans. 44 2015 14475 14482 [16] V. Arumugam W. Kaminsky D. Nallasamy Green Chem. 18 2016 3295 3301 [17] D.E. Bellone J. Bours E.H. Menke F.R. Fischer J. Am. Chem. Soc. 137 2015 850 856 [18] G.A. Filonenko R. van Putten E.N. Schulpen E.J. Hensen E.A. Pidko ChemCatChem 6 2014 1526 1530 [19] S. Murugesan B. Stöger E. Pittenauer G. Allmaier L.F. Veiros K. Kirchner Angew. Chem. 128 2016 3097 3100 [20] T. Simler P. Braunstein A.A. Danopoulos Chem. Commun. 52 2016 2717 2720 [21] P.M.P. Garcia P. Ren R. Scopelliti X. Hu ACS Catal. 5 2015 1164 1171 [22] S.Y. Hong J. Kwak S. Chang Chem. Commun. 52 2016 3159 3162 [23] J. Shi B. Hu D. Gong S. Shang G. Hou D. Chen J. Chem. Soc. Dalton Trans. 45 2016 4828 4834 [24] M.J. Moure R. SanMartin E. Domínguez Adv. Syn. Catal. 356 2014 2070 2080 [25] K. Herasymchuk J. Huynh A.J. Lough L. Roces Fernández R.A. Gossage Synthesis 48 2016 2121 2129 [26] B.K. Langlotz H. Wadepohl L.H. Gade Angew. Chem. 120 2008 4748 4752 [27] Q.H. Deng C. Rettenmeier H. Wadepohl L.H. Gade Chem. Eur. J. 20 2014 93 97 [28] M.B. Gawande P.S. Branco R.S. Varma Chem. Soc. Rev. 42 2013 3371 3393 [29] S.A. Burgess A. Kassie S.A. Baranowski K.J. Fritzsching K. Schmidt-Rohr C.M. Brown C.R. Wade J. Am. Chem. Soc. 138 2016 1780 1783 [30] A.M. Rasero‐Almansa A. Corma M. Iglesias F. Sánchez ChemCatChem 5 2013 3092 3100 [31] M. Rimoldi D. Fodor J. van Bokhoven A. Mezzetti Catal. Sci. Technol. 5 2015 4575 4586 [32] C. del Pozo A. Corma M. Iglesias F. Sanchez Green Chem. 13 2011 2471 2481 [33] B. Tamami M.M. Nezhad S. Ghasemi F. Farjadian J. Organomet. Chem. 743 2013 10 16 [34] S. Sobhani Z. Vahidi Z. Zeraatkar S. Khodadadi RSC. Adv. 5 2015 36552 36559 [35] M. Ghotbinejad A.R. Khosropour I. Mohammadpoor-Baltork M. Moghadam S. Tangestaninejad V. Mirkhani RSC. Adv. 4 2014 8590 8596 [36] P. Kang S. Zhang T.J. Meyer M. Brookhart Angew. Chem. Int. Ed. Engl. 53 2014 8709 8713 [37] M. Ghotbinejad A.R. Khosropour I. Mohammadpoor-Baltork M. Moghadam S. Tangestaninejad V. Mirkhani J. Mol. Catal. A: Chem. 385 2014 78 84 [38] Y. Zhang X. Sun H. Zhang J. Zhao Appl. Organomet. Chem. 30 2016 645 652 [39] N. Zohreh S.H. Hosseini A. Pourjavadi C. Bennett Appl. Organomet. Chem. 30 2016 73 80 [40] A. Pourjavadi S.H. Hosseini N. Zohreh C. Bennett RSC. Adv. 4 2014 46418 46426 [41] N. Zohreh S.H. Hosseini A. Pourjavadi C. Bennett RSC. Adv. 4 2014 50047 50055 [42] A. Pourjavadi N. Safaie S.H. Hosseini C. Bennett New J. Chem. 40 2016 1729 1736 [43] H. Veisi D. Kordestani S. Hemmati A.R. Faraji H. Veisi Tetrahedron Lett. 55 2014 5311 5314 [44] M. Nasr-Esfahani I. Mohammadpoor-Baltork A.R. Khosropour M. Moghadam V. Mirkhani S. Tangestaninejad H. Amiri Rudbari J. Org. Chem. 79 2014 1437 1443 [45] N. Gupta T. Roy D. Ghosh S.H.R. Abdi R.I. Kureshy N.-u. H. Khan H.C. Bajaj RSC. Adv. 5 2015 17843 17850 [46] D. Gong W. Liu T. Chen Z.-R. Chen K.-W. Huang J. Mol. Catal. A: Chem. 395 2014 100 107 [47] Y. Gartia A. Biswas M. Stadler U.B. Nasini A. Ghosh J. Mol. Catal. A: Chem. 363 -364 2012 322 327 [48] N. Zohreh S.H. Hosseini A. Pourjavadi J. Ind. Eng. Chem. 39 2016 203 209 [49] A. Pourjavadi S.H. Hosseini F. Matloubi Moghaddam B. Koushki Foroushani C. Bennett Green Chem. 15 2013 2913 2919 [50] N. Barot S.B. Patel H. Kaur J. Mol. Catal. A: Chem. 423 2016 77 84 [51] L. Al-Hmoud S. Bali S. Mahamulkar J. Culligan C.W. Jones J. Mol. Catal. A: Chem. 395 2014 514 522 [52] B. Maaten J. Moussa C. Desmarets P. Gredin P. Beaunier T. Kanger K. Tõnsuaadu D. Villemin M. Gruselle J. Mol. Catal. A: Chem. 393 2014 112 116 [53] G. Cheng H. Zhang X. Cui RSC. Adv. 4 2014 1849 1852 [54] Y. Liu N. Gu P. Liu J. Xie X. Ma Y. Liu B. Dai Appl. Organomet. Chem. 29 2015 736 738 [55] F.-W. Li Q.-L. Suo H.-L. Hong N. Zhu Y.-Q. Wang L.-L. Guo L.-M. Han J. Supercrit. Fluids 92 2014 70 74 [56] S. Biswas K. Mullick S.-Y. Chen D.A. Kriz M. Shakil C.-H. Kuo A.M. Angeles-Boza A.R. Rossi S.L. Suib ACS Catal. 6 2016 5069 5080 [57] S. Yan S. Pan T. Osako Y. Uozumi Synlett 27 2016 1232 1236 [58] X.-L. Shi Q. Hu F. Wang W. Zhang P. Duan J. Catal. 337 2016 233 239 [59] M. Nasr-Esfahani I. Mohammadpoor-Baltork A.R. Khosropour M. Moghadam V. Mirkhani S. Tangestaninejad V. Agabekov H.A. Rudbari RSC. Adv. 4 2014 14291 14296 [60] S. Li X. Chen J. Chen H. Gong Bull. Chem. Soc. Jpn. 89 2016 794 797 [61] S. Mandal G. Bérubé É. Asselin I. Mohammad V.J. Richardson A. Gupta S.K. Pramanik A.L. Williams S.K. Mandal Bioorg. Med. Chem. Lett. 17 2007 4955 4960 [62] B. Gröll P. Schaaf M.D. Mihovilovic M. Schnürch J. Mol. Catal. A: Chem. 2016 10.1016/j.molcata.2016.07.013 [63] A. Akbari N. Arsalani M. Amini E. Jabbari J. Mol. Catal. A: Chem. 414 2016 47 54 [64] D.P. Singh B.K. Allam K.N. Singh V.P. Singh J. Mol. Catal. A: Chem. 398 2015 158 163 [65] I. Jlalia F. Gallier N. Brodie-Linder J. Uziel J. Augé N. Lubin-Germain J. Mol. Catal. A: Chem. 393 2014 56 61 [66] S. Gu D. Xu W. Chen J. Chem. Soc Dalton Trans. 40 2011 1576 1583 [67] S.Y. de Boer Y. Gloaguen M. Lutz J.I. van der Vlugt Inorg. Chim. Acta 380 2012 336 342 [68] T. Cheisson A. Auffrant J. Chem. Soc Dalton Trans. 43 2014 13399 13409 [69] C. Wang D. Wang S. Yu T. Cornilleau J. Ruiz L. Salmon D. Astruc ACS Catal. 6 2016 5424 5431 [70] X. Liu N. Novoa C. Manzur D. Carrillo J.-R. Hamon New J. Chem. 40 2016 3308 3313 [71] A. Pourjavadi S.H. Hosseini F. Matloubi Moghaddam S.E. Ayati RSC. Adv. 5 2015 29609 29617 [72] H. Duan D. Arora Y. Li H. Setiadi D. Xu H.-Y. Lim W. Wang Bioorg. Med. Chem. 24 2016 2621 2630 [73] J. Zeidler D. Baraniak T. Ostrowski Eur. J. Med. Chem. 97 2015 409 418 [74] H. Cheng J. Wan M.-I. Lin Y. Liu X. Lu J. Liu Y. Xu J. Chen Z. Tu Y.-S.E. Cheng J. Med. Chem. 55 2012 2144 2153 [75] C.W. Tornøe S.J. Sanderson J.C. Mottram G.H. Coombs M. Meldal J. Comb. Chem. 6 2004 312 324 [76] F. d. C. da Silva M.C.B.V. de Souza I.I.P. Frugulhetti H.C. Castro S. L. d. O. Souza T.M.L. de Souza D.Q. Rodrigues A.M.T. Souza P.A. Abreu F. Passamani C.R. Rodrigues V.F. Ferreira Eur. J. Med. Chem. 44 2009 373 383 [77] Y.M.A. Yamada S.M. Sarkar Y. Uozumi J. Am. Chem. Soc. 134 2012 9285 9290",
      "scopus-id": "84999268288",
      "coredata": {
        "eid": "1-s2.0-S1381116916304812",
        "dc:description": "A simple and reliable methodology is described for preparing the first heterogeneous NNN-pincer-copper hybrid catalyst with a high control over surface composition. The strategy relies on the covalently bonding of 2-aminopyridine to cyanuric chloride-functionalized magnetic nanoparticles followed by complexation with CuI. These claims are confirmed by different characterization methods such as SEM, TEM, FT-IR, TGA, ICP, XRD, and elemental analysis. The finely engineered supported catalyst is employed in the aerobic oxidative coupling of terminal alkynes and click reaction using only 0.38 and 0.04 mol% catalyst, respectively. All reactions perform under solvent-free condition or green solvent H2O. Also, the catalyst is readily recovered and reused for up to 8 and 6 subsequent runs in click and homocoupling reactions without significant loss of activity or leaching.",
        "openArchiveArticle": "false",
        "prism:coverDate": "2017-01-31",
        "openaccessUserLicense": null,
        "prism:aggregationType": "Journal",
        "prism:url": "https://api.elsevier.com/content/article/pii/S1381116916304812",
        "dc:creator": [
          {
            "@_fa": "true",
            "$": "Zohreh, Nasrin"
          },
          {
            "@_fa": "true",
            "$": "Jahani, Mahboobeh"
          }
        ],
        "link": [
          {
            "@_fa": "true",
            "@rel": "self",
            "@href": "https://api.elsevier.com/content/article/pii/S1381116916304812"
          },
          {
            "@_fa": "true",
            "@rel": "scidir",
            "@href": "https://www.sciencedirect.com/science/article/pii/S1381116916304812"
          }
        ],
        "dc:format": "application/json",
        "openaccessType": null,
        "pii": "S1381-1169(16)30481-2",
        "prism:volume": "426",
        "prism:publisher": "Elsevier B.V.",
        "dc:title": "NNN-pincer-copper complex immobilized on magnetic nanoparticles as a powerful hybrid catalyst for aerobic oxidative coupling and cycloaddition reactions in water",
        "prism:copyright": "© 2016 Elsevier B.V. All rights reserved.",
        "openaccess": "0",
        "prism:issn": "13811169",
        "dcterms:subject": [
          {
            "@_fa": "true",
            "$": "NNN-Pincer catalyst"
          },
          {
            "@_fa": "true",
            "$": "Copper catalyst"
          },
          {
            "@_fa": "true",
            "$": "Heterogeneous catalyst"
          },
          {
            "@_fa": "true",
            "$": "Cyanuric chloride"
          },
          {
            "@_fa": "true",
            "$": "Terminal alkyne homocoupling"
          },
          {
            "@_fa": "true",
            "$": "Click reaction"
          }
        ],
        "openaccessArticle": "false",
        "prism:publicationName": "Journal of Molecular Catalysis A: Chemical",
        "openaccessSponsorType": null,
        "prism:pageRange": "117-129",
        "prism:endingPage": "129",
        "pubType": "fla",
        "prism:coverDisplayDate": "January 2017",
        "prism:doi": "10.1016/j.molcata.2016.11.007",
        "prism:startingPage": "117",
        "dc:identifier": "doi:10.1016/j.molcata.2016.11.007",
        "openaccessSponsorName": null
      },
      "objects": {
        "object": [
          {
            "@category": "thumbnail",
            "@height": "88",
            "@width": "219",
            "@_fa": "true",
            "$": "https://api.elsevier.com/content/object/eid/1-s2.0-S1381116916304812-fx1.sml?httpAccept=%2A%2F%2A",
            "@multimediatype": "GIF image file",
            "@type": "IMAGE-THUMBNAIL",
            "@size": "5077",
            "@ref": "fx1",
            "@mimetype": "image/gif"
          },
          {
            "@category": "thumbnail",
            "@height": "88",
            "@width": "219",
            "@_fa": "true",
            "$": "https://api.elsevier.com/content/object/eid/1-s2.0-S1381116916304812-fx2.sml?httpAccept=%2A%2F%2A",
            "@multimediatype": "GIF image file",
            "@type": "IMAGE-THUMBNAIL",
            "@size": "2985",
            "@ref": "fx2",
            "@mimetype": "image/gif"
          },
          {
            "@category": "thumbnail",
            "@height": "88",
            "@width": "219",
            "@_fa": "true",
            "$": "https://api.elsevier.com/content/object/eid/1-s2.0-S1381116916304812-fx3.sml?httpAccept=%2A%2F%2A",
            "@multimediatype": "GIF image file",
            "@type": "IMAGE-THUMBNAIL",
            "@size": "1807",
            "@ref": "fx3",
            "@mimetype": "image/gif"
          },
          {
            "@category": "thumbnail",
            "@height": "88",
            "@width": "219",
            "@_fa": "true",
            "$": "https://api.elsevier.com/content/object/eid/1-s2.0-S1381116916304812-fx4.sml?httpAccept=%2A%2F%2A",
            "@multimediatype": "GIF image file",
            "@type": "IMAGE-THUMBNAIL",
            "@size": "3565",
            "@ref": "fx4",
            "@mimetype": "image/gif"
          },
          {
            "@category": "thumbnail",
            "@height": "88",
            "@width": "219",
            "@_fa": "true",
            "$": "https://api.elsevier.com/content/object/eid/1-s2.0-S1381116916304812-fx5.sml?httpAccept=%2A%2F%2A",
            "@multimediatype": "GIF image file",
            "@type": "IMAGE-THUMBNAIL",
            "@size": "1949",
            "@ref": "fx5",
            "@mimetype": "image/gif"
          },
          {
            "@category": "thumbnail",
            "@height": "88",
            "@width": "219",
            "@_fa": "true",
            "$": "https://api.elsevier.com/content/object/eid/1-s2.0-S1381116916304812-fx6.sml?httpAccept=%2A%2F%2A",
            "@multimediatype": "GIF image file",
            "@type": "IMAGE-THUMBNAIL",
            "@size": "2744",
            "@ref": "fx6",
            "@mimetype": "image/gif"
          },
          {
            "@category": "thumbnail",
            "@height": "88",
            "@width": "219",
            "@_fa": "true",
            "$": "https://api.elsevier.com/content/object/eid/1-s2.0-S1381116916304812-fx7.sml?httpAccept=%2A%2F%2A",
            "@multimediatype": "GIF image file",
            "@type": "IMAGE-THUMBNAIL",
            "@size": "3512",
            "@ref": "fx7",
            "@mimetype": "image/gif"
          },
          {
            "@category": "thumbnail",
            "@height": "88",
            "@width": "219",
            "@_fa": "true",
            "$": "https://api.elsevier.com/content/object/eid/1-s2.0-S1381116916304812-fx8.sml?httpAccept=%2A%2F%2A",
            "@multimediatype": "GIF image file",
            "@type": "IMAGE-THUMBNAIL",
            "@size": "1545",
            "@ref": "fx8",
            "@mimetype": "image/gif"
          },
          {
            "@category": "thumbnail",
            "@height": "88",
            "@width": "219",
            "@_fa": "true",
            "$": "https://api.elsevier.com/content/object/eid/1-s2.0-S1381116916304812-fx9.sml?httpAccept=%2A%2F%2A",
            "@multimediatype": "GIF image file",
            "@type": "IMAGE-THUMBNAIL",
            "@size": "1969",
            "@ref": "fx9",
            "@mimetype": "image/gif"
          },
          {
            "@category": "thumbnail",
            "@height": "133",
            "@width": "219",
            "@_fa": "true",
            "$": "https://api.elsevier.com/content/object/eid/1-s2.0-S1381116916304812-gr1.sml?httpAccept=%2A%2F%2A",
            "@multimediatype": "GIF image file",
            "@type": "IMAGE-THUMBNAIL",
            "@size": "8609",
            "@ref": "gr1",
            "@mimetype": "image/gif"
          },
          {
            "@category": "thumbnail",
            "@height": "69",
            "@width": "219",
            "@_fa": "true",
            "$": "https://api.elsevier.com/content/object/eid/1-s2.0-S1381116916304812-gr2.sml?httpAccept=%2A%2F%2A",
            "@multimediatype": "GIF image file",
            "@type": "IMAGE-THUMBNAIL",
            "@size": "4053",
            "@ref": "gr2",
            "@mimetype": "image/gif"
          },
          {
            "@category": "thumbnail",
            "@height": "88",
            "@width": "219",
            "@_fa": "true",
            "$": "https://api.elsevier.com/content/object/eid/1-s2.0-S1381116916304812-gr3.sml?httpAccept=%2A%2F%2A",
            "@multimediatype": "GIF image file",
            "@type": "IMAGE-THUMBNAIL",
            "@size": "5394",
            "@ref": "gr3",
            "@mimetype": "image/gif"
          },
          {
            "@category": "thumbnail",
            "@height": "122",
            "@width": "219",
            "@_fa": "true",
            "$": "https://api.elsevier.com/content/object/eid/1-s2.0-S1381116916304812-gr4.sml?httpAccept=%2A%2F%2A",
            "@multimediatype": "GIF image file",
            "@type": "IMAGE-THUMBNAIL",
            "@size": "3794",
            "@ref": "gr4",
            "@mimetype": "image/gif"
          },
          {
            "@category": "thumbnail",
            "@height": "164",
            "@width": "211",
            "@_fa": "true",
            "$": "https://api.elsevier.com/content/object/eid/1-s2.0-S1381116916304812-gr5.sml?httpAccept=%2A%2F%2A",
            "@multimediatype": "GIF image file",
            "@type": "IMAGE-THUMBNAIL",
            "@size": "5913",
            "@ref": "gr5",
            "@mimetype": "image/gif"
          },
          {
            "@category": "thumbnail",
            "@height": "79",
            "@width": "219",
            "@_fa": "true",
            "$": "https://api.elsevier.com/content/object/eid/1-s2.0-S1381116916304812-gr6.sml?httpAccept=%2A%2F%2A",
            "@multimediatype": "GIF image file",
            "@type": "IMAGE-THUMBNAIL",
            "@size": "9768",
            "@ref": "gr6",
            "@mimetype": "image/gif"
          },
          {
            "@category": "thumbnail",
            "@height": "102",
            "@width": "219",
            "@_fa": "true",
            "$": "https://api.elsevier.com/content/object/eid/1-s2.0-S1381116916304812-gr7.sml?httpAccept=%2A%2F%2A",
            "@multimediatype": "GIF image file",
            "@type": "IMAGE-THUMBNAIL",
            "@size": "5638",
            "@ref": "gr7",
            "@mimetype": "image/gif"
          },
          {
            "@category": "thumbnail",
            "@height": "62",
            "@width": "219",
            "@_fa": "true",
            "$": "https://api.elsevier.com/content/object/eid/1-s2.0-S1381116916304812-sc1.sml?httpAccept=%2A%2F%2A",
            "@multimediatype": "GIF image file",
            "@type": "IMAGE-THUMBNAIL",
            "@size": "4632",
            "@ref": "sc1",
            "@mimetype": "image/gif"
          },
          {
            "@category": "thumbnail",
            "@height": "124",
            "@width": "219",
            "@_fa": "true",
            "$": "https://api.elsevier.com/content/object/eid/1-s2.0-S1381116916304812-sc2.sml?httpAccept=%2A%2F%2A",
            "@multimediatype": "GIF image file",
            "@type": "IMAGE-THUMBNAIL",
            "@size": "5050",
            "@ref": "sc2",
            "@mimetype": "image/gif"
          },
          {
            "@category": "thumbnail",
            "@height": "86",
            "@width": "219",
            "@_fa": "true",
            "$": "https://api.elsevier.com/content/object/eid/1-s2.0-S1381116916304812-sc3.sml?httpAccept=%2A%2F%2A",
            "@multimediatype": "GIF image file",
            "@type": "IMAGE-THUMBNAIL",
            "@size": "3815",
            "@ref": "sc3",
            "@mimetype": "image/gif"
          },
          {
            "@category": "thumbnail",
            "@height": "67",
            "@width": "219",
            "@_fa": "true",
            "$": "https://api.elsevier.com/content/object/eid/1-s2.0-S1381116916304812-sc4.sml?httpAccept=%2A%2F%2A",
            "@multimediatype": "GIF image file",
            "@type": "IMAGE-THUMBNAIL",
            "@size": "3699",
            "@ref": "sc4",
            "@mimetype": "image/gif"
          },
          {
            "@category": "thumbnail",
            "@height": "39",
            "@width": "219",
            "@_fa": "true",
            "$": "https://api.elsevier.com/content/object/eid/1-s2.0-S1381116916304812-sc5.sml?httpAccept=%2A%2F%2A",
            "@multimediatype": "GIF image file",
            "@type": "IMAGE-THUMBNAIL",
            "@size": "2550",
            "@ref": "sc5",
            "@mimetype": "image/gif"
          },
          {
            "@category": "thumbnail",
            "@height": "155",
            "@width": "219",
            "@_fa": "true",
            "$": "https://api.elsevier.com/content/object/eid/1-s2.0-S1381116916304812-sc6.sml?httpAccept=%2A%2F%2A",
            "@multimediatype": "GIF image file",
            "@type": "IMAGE-THUMBNAIL",
            "@size": "6564",
            "@ref": "sc6",
            "@mimetype": "image/gif"
          },
          {
            "@category": "thumbnail",
            "@height": "38",
            "@width": "219",
            "@_fa": "true",
            "$": "https://api.elsevier.com/content/object/eid/1-s2.0-S1381116916304812-sc7.sml?httpAccept=%2A%2F%2A",
            "@multimediatype": "GIF image file",
            "@type": "IMAGE-THUMBNAIL",
            "@size": "2586",
            "@ref": "sc7",
            "@mimetype": "image/gif"
          },
          {
            "@category": "standard",
            "@height": "200",
            "@width": "500",
            "@_fa": "true",
            "$": "https://api.elsevier.com/content/object/eid/1-s2.0-S1381116916304812-fx1.jpg?httpAccept=%2A%2F%2A",
            "@multimediatype": "JPEG image file",
            "@type": "IMAGE-DOWNSAMPLED",
            "@size": "17682",
            "@ref": "fx1",
            "@mimetype": "image/jpeg"
          },
          {
            "@category": "standard",
            "@height": "200",
            "@width": "500",
            "@_fa": "true",
            "$": "https://api.elsevier.com/content/object/eid/1-s2.0-S1381116916304812-fx2.jpg?httpAccept=%2A%2F%2A",
            "@multimediatype": "JPEG image file",
            "@type": "IMAGE-DOWNSAMPLED",
            "@size": "11396",
            "@ref": "fx2",
            "@mimetype": "image/jpeg"
          },
          {
            "@category": "standard",
            "@height": "200",
            "@width": "500",
            "@_fa": "true",
            "$": "https://api.elsevier.com/content/object/eid/1-s2.0-S1381116916304812-fx3.jpg?httpAccept=%2A%2F%2A",
            "@multimediatype": "JPEG image file",
            "@type": "IMAGE-DOWNSAMPLED",
            "@size": "5968",
            "@ref": "fx3",
            "@mimetype": "image/jpeg"
          },
          {
            "@category": "standard",
            "@height": "200",
            "@width": "500",
            "@_fa": "true",
            "$": "https://api.elsevier.com/content/object/eid/1-s2.0-S1381116916304812-fx4.jpg?httpAccept=%2A%2F%2A",
            "@multimediatype": "JPEG image file",
            "@type": "IMAGE-DOWNSAMPLED",
            "@size": "19912",
            "@ref": "fx4",
            "@mimetype": "image/jpeg"
          },
          {
            "@category": "standard",
            "@height": "200",
            "@width": "500",
            "@_fa": "true",
            "$": "https://api.elsevier.com/content/object/eid/1-s2.0-S1381116916304812-fx5.jpg?httpAccept=%2A%2F%2A",
            "@multimediatype": "JPEG image file",
            "@type": "IMAGE-DOWNSAMPLED",
            "@size": "6307",
            "@ref": "fx5",
            "@mimetype": "image/jpeg"
          },
          {
            "@category": "standard",
            "@height": "200",
            "@width": "500",
            "@_fa": "true",
            "$": "https://api.elsevier.com/content/object/eid/1-s2.0-S1381116916304812-fx6.jpg?httpAccept=%2A%2F%2A",
            "@multimediatype": "JPEG image file",
            "@type": "IMAGE-DOWNSAMPLED",
            "@size": "15778",
            "@ref": "fx6",
            "@mimetype": "image/jpeg"
          },
          {
            "@category": "standard",
            "@height": "200",
            "@width": "500",
            "@_fa": "true",
            "$": "https://api.elsevier.com/content/object/eid/1-s2.0-S1381116916304812-fx7.jpg?httpAccept=%2A%2F%2A",
            "@multimediatype": "JPEG image file",
            "@type": "IMAGE-DOWNSAMPLED",
            "@size": "19827",
            "@ref": "fx7",
            "@mimetype": "image/jpeg"
          },
          {
            "@category": "standard",
            "@height": "200",
            "@width": "500",
            "@_fa": "true",
            "$": "https://api.elsevier.com/content/object/eid/1-s2.0-S1381116916304812-fx8.jpg?httpAccept=%2A%2F%2A",
            "@multimediatype": "JPEG image file",
            "@type": "IMAGE-DOWNSAMPLED",
            "@size": "4166",
            "@ref": "fx8",
            "@mimetype": "image/jpeg"
          },
          {
            "@category": "standard",
            "@height": "200",
            "@width": "500",
            "@_fa": "true",
            "$": "https://api.elsevier.com/content/object/eid/1-s2.0-S1381116916304812-fx9.jpg?httpAccept=%2A%2F%2A",
            "@multimediatype": "JPEG image file",
            "@type": "IMAGE-DOWNSAMPLED",
            "@size": "6222",
            "@ref": "fx9",
            "@mimetype": "image/jpeg"
          },
          {
            "@category": "standard",
            "@height": "457",
            "@width": "753",
            "@_fa": "true",
            "$": "https://api.elsevier.com/content/object/eid/1-s2.0-S1381116916304812-gr1.jpg?httpAccept=%2A%2F%2A",
            "@multimediatype": "JPEG image file",
            "@type": "IMAGE-DOWNSAMPLED",
            "@size": "70549",
            "@ref": "gr1",
            "@mimetype": "image/jpeg"
          },
          {
            "@category": "standard",
            "@height": "215",
            "@width": "678",
            "@_fa": "true",
            "$": "https://api.elsevier.com/content/object/eid/1-s2.0-S1381116916304812-gr2.jpg?httpAccept=%2A%2F%2A",
            "@multimediatype": "JPEG image file",
            "@type": "IMAGE-DOWNSAMPLED",
            "@size": "29587",
            "@ref": "gr2",
            "@mimetype": "image/jpeg"
          },
          {
            "@category": "standard",
            "@height": "273",
            "@width": "681",
            "@_fa": "true",
            "$": "https://api.elsevier.com/content/object/eid/1-s2.0-S1381116916304812-gr3.jpg?httpAccept=%2A%2F%2A",
            "@multimediatype": "JPEG image file",
            "@type": "IMAGE-DOWNSAMPLED",
            "@size": "33971",
            "@ref": "gr3",
            "@mimetype": "image/jpeg"
          },
          {
            "@category": "standard",
            "@height": "317",
            "@width": "568",
            "@_fa": "true",
            "$": "https://api.elsevier.com/content/object/eid/1-s2.0-S1381116916304812-gr4.jpg?httpAccept=%2A%2F%2A",
            "@multimediatype": "JPEG image file",
            "@type": "IMAGE-DOWNSAMPLED",
            "@size": "19054",
            "@ref": "gr4",
            "@mimetype": "image/jpeg"
          },
          {
            "@category": "standard",
            "@height": "379",
            "@width": "489",
            "@_fa": "true",
            "$": "https://api.elsevier.com/content/object/eid/1-s2.0-S1381116916304812-gr5.jpg?httpAccept=%2A%2F%2A",
            "@multimediatype": "JPEG image file",
            "@type": "IMAGE-DOWNSAMPLED",
            "@size": "28581",
            "@ref": "gr5",
            "@mimetype": "image/jpeg"
          },
          {
            "@category": "standard",
            "@height": "204",
            "@width": "565",
            "@_fa": "true",
            "$": "https://api.elsevier.com/content/object/eid/1-s2.0-S1381116916304812-gr6.jpg?httpAccept=%2A%2F%2A",
            "@multimediatype": "JPEG image file",
            "@type": "IMAGE-DOWNSAMPLED",
            "@size": "40972",
            "@ref": "gr6",
            "@mimetype": "image/jpeg"
          },
          {
            "@category": "standard",
            "@height": "264",
            "@width": "565",
            "@_fa": "true",
            "$": "https://api.elsevier.com/content/object/eid/1-s2.0-S1381116916304812-gr7.jpg?httpAccept=%2A%2F%2A",
            "@multimediatype": "JPEG image file",
            "@type": "IMAGE-DOWNSAMPLED",
            "@size": "31567",
            "@ref": "gr7",
            "@mimetype": "image/jpeg"
          },
          {
            "@category": "standard",
            "@height": "85",
            "@width": "301",
            "@_fa": "true",
            "$": "https://api.elsevier.com/content/object/eid/1-s2.0-S1381116916304812-sc1.jpg?httpAccept=%2A%2F%2A",
            "@multimediatype": "JPEG image file",
            "@type": "IMAGE-DOWNSAMPLED",
            "@size": "10158",
            "@ref": "sc1",
            "@mimetype": "image/jpeg"
          },
          {
            "@category": "standard",
            "@height": "384",
            "@width": "678",
            "@_fa": "true",
            "$": "https://api.elsevier.com/content/object/eid/1-s2.0-S1381116916304812-sc2.jpg?httpAccept=%2A%2F%2A",
            "@multimediatype": "JPEG image file",
            "@type": "IMAGE-DOWNSAMPLED",
            "@size": "40271",
            "@ref": "sc2",
            "@mimetype": "image/jpeg"
          },
          {
            "@category": "standard",
            "@height": "221",
            "@width": "565",
            "@_fa": "true",
            "$": "https://api.elsevier.com/content/object/eid/1-s2.0-S1381116916304812-sc3.jpg?httpAccept=%2A%2F%2A",
            "@multimediatype": "JPEG image file",
            "@type": "IMAGE-DOWNSAMPLED",
            "@size": "20261",
            "@ref": "sc3",
            "@mimetype": "image/jpeg"
          },
          {
            "@category": "standard",
            "@height": "173",
            "@width": "565",
            "@_fa": "true",
            "$": "https://api.elsevier.com/content/object/eid/1-s2.0-S1381116916304812-sc4.jpg?httpAccept=%2A%2F%2A",
            "@multimediatype": "JPEG image file",
            "@type": "IMAGE-DOWNSAMPLED",
            "@size": "21456",
            "@ref": "sc4",
            "@mimetype": "image/jpeg"
          },
          {
            "@category": "standard",
            "@height": "100",
            "@width": "565",
            "@_fa": "true",
            "$": "https://api.elsevier.com/content/object/eid/1-s2.0-S1381116916304812-sc5.jpg?httpAccept=%2A%2F%2A",
            "@multimediatype": "JPEG image file",
            "@type": "IMAGE-DOWNSAMPLED",
            "@size": "11739",
            "@ref": "sc5",
            "@mimetype": "image/jpeg"
          },
          {
            "@category": "standard",
            "@height": "346",
            "@width": "489",
            "@_fa": "true",
            "$": "https://api.elsevier.com/content/object/eid/1-s2.0-S1381116916304812-sc6.jpg?httpAccept=%2A%2F%2A",
            "@multimediatype": "JPEG image file",
            "@type": "IMAGE-DOWNSAMPLED",
            "@size": "33287",
            "@ref": "sc6",
            "@mimetype": "image/jpeg"
          },
          {
            "@category": "standard",
            "@height": "99",
            "@width": "565",
            "@_fa": "true",
            "$": "https://api.elsevier.com/content/object/eid/1-s2.0-S1381116916304812-sc7.jpg?httpAccept=%2A%2F%2A",
            "@multimediatype": "JPEG image file",
            "@type": "IMAGE-DOWNSAMPLED",
            "@size": "13492",
            "@ref": "sc7",
            "@mimetype": "image/jpeg"
          },
          {
            "@category": "high",
            "@height": "886",
            "@width": "2213",
            "@_fa": "true",
            "$": "https://api.elsevier.com/content/object/eid/1-s2.0-S1381116916304812-fx1_lrg.jpg?httpAccept=%2A%2F%2A",
            "@multimediatype": "JPEG image file",
            "@type": "IMAGE-HIGH-RES",
            "@size": "134260",
            "@ref": "fx1",
            "@mimetype": "image/jpeg"
          },
          {
            "@category": "high",
            "@height": "886",
            "@width": "2213",
            "@_fa": "true",
            "$": "https://api.elsevier.com/content/object/eid/1-s2.0-S1381116916304812-fx2_lrg.jpg?httpAccept=%2A%2F%2A",
            "@multimediatype": "JPEG image file",
            "@type": "IMAGE-HIGH-RES",
            "@size": "74291",
            "@ref": "fx2",
            "@mimetype": "image/jpeg"
          },
          {
            "@category": "high",
            "@height": "886",
            "@width": "2213",
            "@_fa": "true",
            "$": "https://api.elsevier.com/content/object/eid/1-s2.0-S1381116916304812-fx3_lrg.jpg?httpAccept=%2A%2F%2A",
            "@multimediatype": "JPEG image file",
            "@type": "IMAGE-HIGH-RES",
            "@size": "39859",
            "@ref": "fx3",
            "@mimetype": "image/jpeg"
          },
          {
            "@category": "high",
            "@height": "886",
            "@width": "2213",
            "@_fa": "true",
            "$": "https://api.elsevier.com/content/object/eid/1-s2.0-S1381116916304812-fx4_lrg.jpg?httpAccept=%2A%2F%2A",
            "@multimediatype": "JPEG image file",
            "@type": "IMAGE-HIGH-RES",
            "@size": "137348",
            "@ref": "fx4",
            "@mimetype": "image/jpeg"
          },
          {
            "@category": "high",
            "@height": "886",
            "@width": "2213",
            "@_fa": "true",
            "$": "https://api.elsevier.com/content/object/eid/1-s2.0-S1381116916304812-fx5_lrg.jpg?httpAccept=%2A%2F%2A",
            "@multimediatype": "JPEG image file",
            "@type": "IMAGE-HIGH-RES",
            "@size": "41637",
            "@ref": "fx5",
            "@mimetype": "image/jpeg"
          },
          {
            "@category": "high",
            "@height": "886",
            "@width": "2213",
            "@_fa": "true",
            "$": "https://api.elsevier.com/content/object/eid/1-s2.0-S1381116916304812-fx6_lrg.jpg?httpAccept=%2A%2F%2A",
            "@multimediatype": "JPEG image file",
            "@type": "IMAGE-HIGH-RES",
            "@size": "148582",
            "@ref": "fx6",
            "@mimetype": "image/jpeg"
          },
          {
            "@category": "high",
            "@height": "886",
            "@width": "2213",
            "@_fa": "true",
            "$": "https://api.elsevier.com/content/object/eid/1-s2.0-S1381116916304812-fx7_lrg.jpg?httpAccept=%2A%2F%2A",
            "@multimediatype": "JPEG image file",
            "@type": "IMAGE-HIGH-RES",
            "@size": "151924",
            "@ref": "fx7",
            "@mimetype": "image/jpeg"
          },
          {
            "@category": "high",
            "@height": "886",
            "@width": "2213",
            "@_fa": "true",
            "$": "https://api.elsevier.com/content/object/eid/1-s2.0-S1381116916304812-fx8_lrg.jpg?httpAccept=%2A%2F%2A",
            "@multimediatype": "JPEG image file",
            "@type": "IMAGE-HIGH-RES",
            "@size": "28080",
            "@ref": "fx8",
            "@mimetype": "image/jpeg"
          },
          {
            "@category": "high",
            "@height": "886",
            "@width": "2213",
            "@_fa": "true",
            "$": "https://api.elsevier.com/content/object/eid/1-s2.0-S1381116916304812-fx9_lrg.jpg?httpAccept=%2A%2F%2A",
            "@multimediatype": "JPEG image file",
            "@type": "IMAGE-HIGH-RES",
            "@size": "39964",
            "@ref": "fx9",
            "@mimetype": "image/jpeg"
          },
          {
            "@category": "high",
            "@height": "2021",
            "@width": "3333",
            "@_fa": "true",
            "$": "https://api.elsevier.com/content/object/eid/1-s2.0-S1381116916304812-gr1_lrg.jpg?httpAccept=%2A%2F%2A",
            "@multimediatype": "JPEG image file",
            "@type": "IMAGE-HIGH-RES",
            "@size": "501853",
            "@ref": "gr1",
            "@mimetype": "image/jpeg"
          },
          {
            "@category": "high",
            "@height": "951",
            "@width": "3000",
            "@_fa": "true",
            "$": "https://api.elsevier.com/content/object/eid/1-s2.0-S1381116916304812-gr2_lrg.jpg?httpAccept=%2A%2F%2A",
            "@multimediatype": "JPEG image file",
            "@type": "IMAGE-HIGH-RES",
            "@size": "226422",
            "@ref": "gr2",
            "@mimetype": "image/jpeg"
          },
          {
            "@category": "high",
            "@height": "1208",
            "@width": "3014",
            "@_fa": "true",
            "$": "https://api.elsevier.com/content/object/eid/1-s2.0-S1381116916304812-gr3_lrg.jpg?httpAccept=%2A%2F%2A",
            "@multimediatype": "JPEG image file",
            "@type": "IMAGE-HIGH-RES",
            "@size": "324910",
            "@ref": "gr3",
            "@mimetype": "image/jpeg"
          },
          {
            "@category": "high",
            "@height": "1403",
            "@width": "2514",
            "@_fa": "true",
            "$": "https://api.elsevier.com/content/object/eid/1-s2.0-S1381116916304812-gr4_lrg.jpg?httpAccept=%2A%2F%2A",
            "@multimediatype": "JPEG image file",
            "@type": "IMAGE-HIGH-RES",
            "@size": "132562",
            "@ref": "gr4",
            "@mimetype": "image/jpeg"
          },
          {
            "@category": "high",
            "@height": "1681",
            "@width": "2167",
            "@_fa": "true",
            "$": "https://api.elsevier.com/content/object/eid/1-s2.0-S1381116916304812-gr5_lrg.jpg?httpAccept=%2A%2F%2A",
            "@multimediatype": "JPEG image file",
            "@type": "IMAGE-HIGH-RES",
            "@size": "208485",
            "@ref": "gr5",
            "@mimetype": "image/jpeg"
          },
          {
            "@category": "high",
            "@height": "903",
            "@width": "2500",
            "@_fa": "true",
            "$": "https://api.elsevier.com/content/object/eid/1-s2.0-S1381116916304812-gr6_lrg.jpg?httpAccept=%2A%2F%2A",
            "@multimediatype": "JPEG image file",
            "@type": "IMAGE-HIGH-RES",
            "@size": "614845",
            "@ref": "gr6",
            "@mimetype": "image/jpeg"
          },
          {
            "@category": "high",
            "@height": "1167",
            "@width": "2500",
            "@_fa": "true",
            "$": "https://api.elsevier.com/content/object/eid/1-s2.0-S1381116916304812-gr7_lrg.jpg?httpAccept=%2A%2F%2A",
            "@multimediatype": "JPEG image file",
            "@type": "IMAGE-HIGH-RES",
            "@size": "210655",
            "@ref": "gr7",
            "@mimetype": "image/jpeg"
          },
          {
            "@category": "high",
            "@height": "375",
            "@width": "1333",
            "@_fa": "true",
            "$": "https://api.elsevier.com/content/object/eid/1-s2.0-S1381116916304812-sc1_lrg.jpg?httpAccept=%2A%2F%2A",
            "@multimediatype": "JPEG image file",
            "@type": "IMAGE-HIGH-RES",
            "@size": "75369",
            "@ref": "sc1",
            "@mimetype": "image/jpeg"
          },
          {
            "@category": "high",
            "@height": "1701",
            "@width": "3000",
            "@_fa": "true",
            "$": "https://api.elsevier.com/content/object/eid/1-s2.0-S1381116916304812-sc2_lrg.jpg?httpAccept=%2A%2F%2A",
            "@multimediatype": "JPEG image file",
            "@type": "IMAGE-HIGH-RES",
            "@size": "324421",
            "@ref": "sc2",
            "@mimetype": "image/jpeg"
          },
          {
            "@category": "high",
            "@height": "979",
            "@width": "2500",
            "@_fa": "true",
            "$": "https://api.elsevier.com/content/object/eid/1-s2.0-S1381116916304812-sc3_lrg.jpg?httpAccept=%2A%2F%2A",
            "@multimediatype": "JPEG image file",
            "@type": "IMAGE-HIGH-RES",
            "@size": "142798",
            "@ref": "sc3",
            "@mimetype": "image/jpeg"
          },
          {
            "@category": "high",
            "@height": "764",
            "@width": "2500",
            "@_fa": "true",
            "$": "https://api.elsevier.com/content/object/eid/1-s2.0-S1381116916304812-sc4_lrg.jpg?httpAccept=%2A%2F%2A",
            "@multimediatype": "JPEG image file",
            "@type": "IMAGE-HIGH-RES",
            "@size": "180921",
            "@ref": "sc4",
            "@mimetype": "image/jpeg"
          },
          {
            "@category": "high",
            "@height": "444",
            "@width": "2500",
            "@_fa": "true",
            "$": "https://api.elsevier.com/content/object/eid/1-s2.0-S1381116916304812-sc5_lrg.jpg?httpAccept=%2A%2F%2A",
            "@multimediatype": "JPEG image file",
            "@type": "IMAGE-HIGH-RES",
            "@size": "93146",
            "@ref": "sc5",
            "@mimetype": "image/jpeg"
          },
          {
            "@category": "high",
            "@height": "1535",
            "@width": "2167",
            "@_fa": "true",
            "$": "https://api.elsevier.com/content/object/eid/1-s2.0-S1381116916304812-sc6_lrg.jpg?httpAccept=%2A%2F%2A",
            "@multimediatype": "JPEG image file",
            "@type": "IMAGE-HIGH-RES",
            "@size": "258124",
            "@ref": "sc6",
            "@mimetype": "image/jpeg"
          },
          {
            "@category": "high",
            "@height": "438",
            "@width": "2500",
            "@_fa": "true",
            "$": "https://api.elsevier.com/content/object/eid/1-s2.0-S1381116916304812-sc7_lrg.jpg?httpAccept=%2A%2F%2A",
            "@multimediatype": "JPEG image file",
            "@type": "IMAGE-HIGH-RES",
            "@size": "106037",
            "@ref": "sc7",
            "@mimetype": "image/jpeg"
          },
          {
            "@category": "standard",
            "@_fa": "true",
            "$": "https://api.elsevier.com/content/object/eid/1-s2.0-S1381116916304812-mmc1.docx?httpAccept=%2A%2F%2A",
            "@multimediatype": "Microsoft Word file",
            "@type": "APPLICATION",
            "@size": "5342329",
            "@ref": "mmc1",
            "@mimetype": "application/word"
          }
        ]
      },
      "link": {
        "@rel": "abstract",
        "@href": "https://api.elsevier.com/content/abstract/scopus_id/84999268288"
      }
    }
  }
}