{
  "metadata": {
    "title": "Heterogeneous catalytic ozonation of phenacetin in water using magnetic spinel ferrite as catalyst: Comparison of surface property and efficiency",
    "authors": "; ; ",
    "journal": "Journal of Molecular Catalysis A: Chemical",
    "date": "2015-01-31",
    "doi": "10.1016/j.molcata.2014.10.001",
    "abstract": "",
    "uri": "https://api.elsevier.com/content/article/pii/S1381116914004440",
    "pii": "S1381116914004440"
  },
  "fulltext": {
    "full-text-retrieval-response": {
      "scopus-eid": "2-s2.0-84908406170",
      "originalText": "serial JL 271358 291210 291744 291790 291809 31 Journal of Molecular Catalysis A: Chemical JOURNALMOLECULARCATALYSISACHEMICAL 2014-10-13 2014-10-13 2018-04-30T23:04:29 1-s2.0-S1381116914004440 S1381-1169(14)00444-0 S1381116914004440 10.1016/j.molcata.2014.10.001 S300 S300.3 FULL-TEXT 1-s2.0-S1381116914X00129 2018-04-30T22:45:09.373158Z 0 0 20150101 20150131 2015 2014-10-13T16:50:37.303635Z absattachment articleinfo articletitlenorm authfirstinitialnorm authfirstsurnamenorm cid cids contenttype copyright crossmark dateloaded dateloadedtxt datesearch datesort dateupdated dco docsubtype doctype doi eid ewtransactionid hubeid indexeddate issn issnnorm itemstage itemtransactionid itemweight openaccess openarchive pg pgfirst pglast pii piinorm pubdateend pubdatestart pubdatetxt pubyr sectiontitle sortorder srctitle srctitlenorm srctype ssids alllist content subj subheadings suppl tomb volfirst volissue volumelist webpdf webpdfpagecount yearnav figure table body mmlmath acknowledge affil articletitle auth authfirstini authfull authkeywords authlast grantnumber grantsponsor grantsponsorid highlightsabst primabst ref specialabst 1381-1169 13811169 true 396 396 C Volume 396 24 164 173 164 173 201501 January 2015 2015-01-01 2015-01-31 2015 Regular Papers article fla Copyright © 2014 Elsevier B.V. All rights reserved. HETEROGENEOUSCATALYTICOZONATIONPHENACETININWATERUSINGMAGNETICSPINELFERRITECATALYSTCOMPARISONSURFACEPROPERTYEFFICIENCY QI F 1 Introduction 2 Materials and methods 2.1 Chemicals 2.2 Catalyst synthesis and characterization 2.3 Catalytic ozonation reactions 2.4 Analytical method 3 Results and discussion 3.1 Structural characteristics of the catalyst 3.2 Performance and mineralization of PNT in catalytic ozonation 3.3 Metal leaching in different catalytic reactions 3.4 Ozone concentration in different processes 3.5 Hydroxyl radical generation yields in PNT degradation and mineralization 3.6 Peroxide generation or decomposition in different processes 3.7 Intermediates adsorption/degradation over catalyst surface 4 Conclusion Acknowledgements References GLOVER 2013 5500 5507 T WANG 2013 92 95 C PAZIK 2013 12230 12243 R ZHANG 2013 2784 2791 T GLOVER 2012 5695 5702 T SHAO 2012 16 24 L WANG 2012 72 79 L HOU 2013 80 88 Y SOLTANI 2013 197 203 T MAHMOODI 2013 4255 4260 N REN 2012 90 96 Y ZHAO 2013 295 302 H LIU 2013 129 135 X SUI 2010 94 100 M YANG 2010 340 346 L ZHANG 2008 3651 3658 T LV 2012 246 252 A YANG 2013 451 456 Z ANANDAN 2012 46 52 S CHEN 2012 185 189 H SHIBATA 1995 160 167 M JAVIERBENITEZ 2009 53 59 F BENITEZ 2009 1186 1195 F BENITEZ 2011 1149 1156 F TAO 2000 172 176 S BADER 1981 449 456 H OSULLIVAN 2007 457 461 D QI 2009 246 252 F GUO 2013 8997 9003 P NIU 2013 347 352 P ZHAO 2009 4157 4163 L ZHAO 2009 2047 2053 L KRUSE 2011 367 376 N MCCAFFERTY 1999 92 100 E VEITH 2008 269 280 G YAMASHITA 2008 2441 2449 T KUMBHAR 2012 39 43 V SALAVATINIASARI 2012 1003 1010 M SIVAKUMAR 2012 203 207 P DODD 2010 5940 5948 M PEREZESTRADA 2011 7431 7437 L GONCALVES 2012 167 174 A ASSALIN 2006 24 27 M FADZIL 2012 11993 12003 N FARRE 2005 1127 1133 M KHAN 2008 690 696 M WU 2008 748 755 C YILDIRIM 2011 795 805 A NAWROCKI 2010 27 42 J QI 2009 405 410 F ELOVITZ 1999 239 260 M VONGUNTEN 2003 1443 1467 U ANDREOZZI 2003 993 1004 R PI 2005 83 88 Y IKHLAQ 2013 437 449 A LUO 2010 1786 1791 W MERENYI 2010 3505 3507 G POCOSTALES 2010 8248 8253 J XU 2012 10145 10153 L QIX2015X164 QIX2015X164X173 QIX2015X164XF QIX2015X164X173XF item S1381-1169(14)00444-0 S1381116914004440 1-s2.0-S1381116914004440 10.1016/j.molcata.2014.10.001 271358 2018-04-30T22:45:09.373158Z 2015-01-01 2015-01-31 1-s2.0-S1381116914004440-main.pdf https://s3-eu-west-1.amazonaws.com/prod-ucs-content-store-eu-west/content/pii:S1381116914004440/MAIN/application/pdf/61ee8088924ea2a65c7a8886ef03d729/main.pdf https://s3.amazonaws.com/prod-ucs-content-store-us-east/content/pii:S1381116914004440/MAIN/application/pdf/61ee8088924ea2a65c7a8886ef03d729/main.pdf main.pdf pdf true 1123289 MAIN 10 1-s2.0-S1381116914004440-main_1.png https://s3-eu-west-1.amazonaws.com/prod-ucs-content-store-eu-west/content/pii:S1381116914004440/PREVIEW/image/png/6973327b6ef41e2dce91651437d597fd/main_1.png https://s3.amazonaws.com/prod-ucs-content-store-us-east/content/pii:S1381116914004440/PREVIEW/image/png/6973327b6ef41e2dce91651437d597fd/main_1.png main_1.png png 57300 849 656 IMAGE-WEB-PDF 1 1-s2.0-S1381116914004440-fx1.sml https://s3-eu-west-1.amazonaws.com/prod-ucs-content-store-eu-west/content/pii:S1381116914004440/fx1/THUMBNAIL/image/gif/65c02064d05f517060916422f2d3b4f9/fx1.sml https://s3.amazonaws.com/prod-ucs-content-store-us-east/content/pii:S1381116914004440/fx1/THUMBNAIL/image/gif/65c02064d05f517060916422f2d3b4f9/fx1.sml fx1 true fx1.sml sml 8576 132 219 IMAGE-THUMBNAIL 1-s2.0-S1381116914004440-gr1.sml https://s3-eu-west-1.amazonaws.com/prod-ucs-content-store-eu-west/content/pii:S1381116914004440/gr1/THUMBNAIL/image/gif/3846e2c2fb3a177b52eb55ecaa5febc7/gr1.sml https://s3.amazonaws.com/prod-ucs-content-store-us-east/content/pii:S1381116914004440/gr1/THUMBNAIL/image/gif/3846e2c2fb3a177b52eb55ecaa5febc7/gr1.sml gr1 gr1.sml sml 5404 164 107 IMAGE-THUMBNAIL 1-s2.0-S1381116914004440-gr10.sml https://s3-eu-west-1.amazonaws.com/prod-ucs-content-store-eu-west/content/pii:S1381116914004440/gr10/THUMBNAIL/image/gif/4991c157da112d0ddd96c4b031f9f08b/gr10.sml https://s3.amazonaws.com/prod-ucs-content-store-us-east/content/pii:S1381116914004440/gr10/THUMBNAIL/image/gif/4991c157da112d0ddd96c4b031f9f08b/gr10.sml gr10 gr10.sml sml 9868 161 219 IMAGE-THUMBNAIL 1-s2.0-S1381116914004440-gr11.sml https://s3-eu-west-1.amazonaws.com/prod-ucs-content-store-eu-west/content/pii:S1381116914004440/gr11/THUMBNAIL/image/gif/cc864b645e47a2297ab2aa6e729002f3/gr11.sml https://s3.amazonaws.com/prod-ucs-content-store-us-east/content/pii:S1381116914004440/gr11/THUMBNAIL/image/gif/cc864b645e47a2297ab2aa6e729002f3/gr11.sml gr11 gr11.sml sml 6785 164 199 IMAGE-THUMBNAIL 1-s2.0-S1381116914004440-gr12.sml https://s3-eu-west-1.amazonaws.com/prod-ucs-content-store-eu-west/content/pii:S1381116914004440/gr12/THUMBNAIL/image/gif/b4d095ee089ea01be1916224c9fc81f3/gr12.sml https://s3.amazonaws.com/prod-ucs-content-store-us-east/content/pii:S1381116914004440/gr12/THUMBNAIL/image/gif/b4d095ee089ea01be1916224c9fc81f3/gr12.sml gr12 gr12.sml sml 8581 164 217 IMAGE-THUMBNAIL 1-s2.0-S1381116914004440-gr13.sml https://s3-eu-west-1.amazonaws.com/prod-ucs-content-store-eu-west/content/pii:S1381116914004440/gr13/THUMBNAIL/image/gif/da51abfd59a89eba8d5dfca920786657/gr13.sml https://s3.amazonaws.com/prod-ucs-content-store-us-east/content/pii:S1381116914004440/gr13/THUMBNAIL/image/gif/da51abfd59a89eba8d5dfca920786657/gr13.sml gr13 gr13.sml sml 5886 164 212 IMAGE-THUMBNAIL 1-s2.0-S1381116914004440-gr2.sml https://s3-eu-west-1.amazonaws.com/prod-ucs-content-store-eu-west/content/pii:S1381116914004440/gr2/THUMBNAIL/image/gif/7ad7bee4fac84cc346eb3d80de1e5112/gr2.sml https://s3.amazonaws.com/prod-ucs-content-store-us-east/content/pii:S1381116914004440/gr2/THUMBNAIL/image/gif/7ad7bee4fac84cc346eb3d80de1e5112/gr2.sml gr2 gr2.sml sml 5199 163 100 IMAGE-THUMBNAIL 1-s2.0-S1381116914004440-gr3.sml https://s3-eu-west-1.amazonaws.com/prod-ucs-content-store-eu-west/content/pii:S1381116914004440/gr3/THUMBNAIL/image/gif/cec17208d9cac6b99f2d6bd8c4189e91/gr3.sml https://s3.amazonaws.com/prod-ucs-content-store-us-east/content/pii:S1381116914004440/gr3/THUMBNAIL/image/gif/cec17208d9cac6b99f2d6bd8c4189e91/gr3.sml gr3 gr3.sml sml 9286 149 219 IMAGE-THUMBNAIL 1-s2.0-S1381116914004440-gr4.sml https://s3-eu-west-1.amazonaws.com/prod-ucs-content-store-eu-west/content/pii:S1381116914004440/gr4/THUMBNAIL/image/gif/95b11d8627cb3f2cfc7b3ffedd6d6514/gr4.sml https://s3.amazonaws.com/prod-ucs-content-store-us-east/content/pii:S1381116914004440/gr4/THUMBNAIL/image/gif/95b11d8627cb3f2cfc7b3ffedd6d6514/gr4.sml gr4 gr4.sml sml 5226 163 108 IMAGE-THUMBNAIL 1-s2.0-S1381116914004440-gr5.sml https://s3-eu-west-1.amazonaws.com/prod-ucs-content-store-eu-west/content/pii:S1381116914004440/gr5/THUMBNAIL/image/gif/0d4265e99b2e2c5f047b9453f37ffcfa/gr5.sml https://s3.amazonaws.com/prod-ucs-content-store-us-east/content/pii:S1381116914004440/gr5/THUMBNAIL/image/gif/0d4265e99b2e2c5f047b9453f37ffcfa/gr5.sml gr5 gr5.sml sml 6524 158 219 IMAGE-THUMBNAIL 1-s2.0-S1381116914004440-gr6.sml https://s3-eu-west-1.amazonaws.com/prod-ucs-content-store-eu-west/content/pii:S1381116914004440/gr6/THUMBNAIL/image/gif/6df876d2e9e895772f89bd982e48ef10/gr6.sml https://s3.amazonaws.com/prod-ucs-content-store-us-east/content/pii:S1381116914004440/gr6/THUMBNAIL/image/gif/6df876d2e9e895772f89bd982e48ef10/gr6.sml gr6 gr6.sml sml 5082 163 114 IMAGE-THUMBNAIL 1-s2.0-S1381116914004440-gr7.sml https://s3-eu-west-1.amazonaws.com/prod-ucs-content-store-eu-west/content/pii:S1381116914004440/gr7/THUMBNAIL/image/gif/d1778a533a9d62ee642ead6beddfd2d1/gr7.sml https://s3.amazonaws.com/prod-ucs-content-store-us-east/content/pii:S1381116914004440/gr7/THUMBNAIL/image/gif/d1778a533a9d62ee642ead6beddfd2d1/gr7.sml gr7 gr7.sml sml 8056 164 199 IMAGE-THUMBNAIL 1-s2.0-S1381116914004440-gr8.sml https://s3-eu-west-1.amazonaws.com/prod-ucs-content-store-eu-west/content/pii:S1381116914004440/gr8/THUMBNAIL/image/gif/dda1b77395ee84d92aa80462aa0dec6b/gr8.sml https://s3.amazonaws.com/prod-ucs-content-store-us-east/content/pii:S1381116914004440/gr8/THUMBNAIL/image/gif/dda1b77395ee84d92aa80462aa0dec6b/gr8.sml gr8 gr8.sml sml 5922 164 214 IMAGE-THUMBNAIL 1-s2.0-S1381116914004440-gr9.sml https://s3-eu-west-1.amazonaws.com/prod-ucs-content-store-eu-west/content/pii:S1381116914004440/gr9/THUMBNAIL/image/gif/21d70271c50ccc454f3d656365365643/gr9.sml https://s3.amazonaws.com/prod-ucs-content-store-us-east/content/pii:S1381116914004440/gr9/THUMBNAIL/image/gif/21d70271c50ccc454f3d656365365643/gr9.sml gr9 gr9.sml sml 4078 163 102 IMAGE-THUMBNAIL 1-s2.0-S1381116914004440-fx1.jpg https://s3-eu-west-1.amazonaws.com/prod-ucs-content-store-eu-west/content/pii:S1381116914004440/fx1/DOWNSAMPLED/image/jpeg/82e41ddf3dacbf8af5dc42fe3fc17564/fx1.jpg https://s3.amazonaws.com/prod-ucs-content-store-us-east/content/pii:S1381116914004440/fx1/DOWNSAMPLED/image/jpeg/82e41ddf3dacbf8af5dc42fe3fc17564/fx1.jpg fx1 true fx1.jpg jpg 19544 200 331 IMAGE-DOWNSAMPLED 1-s2.0-S1381116914004440-gr1.jpg https://s3-eu-west-1.amazonaws.com/prod-ucs-content-store-eu-west/content/pii:S1381116914004440/gr1/DOWNSAMPLED/image/jpeg/5ef81225b3eb7a4edc8168adbd80f817/gr1.jpg https://s3.amazonaws.com/prod-ucs-content-store-us-east/content/pii:S1381116914004440/gr1/DOWNSAMPLED/image/jpeg/5ef81225b3eb7a4edc8168adbd80f817/gr1.jpg gr1 gr1.jpg jpg 48188 575 376 IMAGE-DOWNSAMPLED 1-s2.0-S1381116914004440-gr10.jpg https://s3-eu-west-1.amazonaws.com/prod-ucs-content-store-eu-west/content/pii:S1381116914004440/gr10/DOWNSAMPLED/image/jpeg/2424847a54ef905cdd74fb9161608dcd/gr10.jpg https://s3.amazonaws.com/prod-ucs-content-store-us-east/content/pii:S1381116914004440/gr10/DOWNSAMPLED/image/jpeg/2424847a54ef905cdd74fb9161608dcd/gr10.jpg gr10 gr10.jpg jpg 31893 274 374 IMAGE-DOWNSAMPLED 1-s2.0-S1381116914004440-gr11.jpg https://s3-eu-west-1.amazonaws.com/prod-ucs-content-store-eu-west/content/pii:S1381116914004440/gr11/DOWNSAMPLED/image/jpeg/deaed29ff2aa24d401f4d1b43112b46d/gr11.jpg https://s3.amazonaws.com/prod-ucs-content-store-us-east/content/pii:S1381116914004440/gr11/DOWNSAMPLED/image/jpeg/deaed29ff2aa24d401f4d1b43112b46d/gr11.jpg gr11 gr11.jpg jpg 26183 322 391 IMAGE-DOWNSAMPLED 1-s2.0-S1381116914004440-gr12.jpg https://s3-eu-west-1.amazonaws.com/prod-ucs-content-store-eu-west/content/pii:S1381116914004440/gr12/DOWNSAMPLED/image/jpeg/485ab27bf3ee418ee478790041ea77db/gr12.jpg https://s3.amazonaws.com/prod-ucs-content-store-us-east/content/pii:S1381116914004440/gr12/DOWNSAMPLED/image/jpeg/485ab27bf3ee418ee478790041ea77db/gr12.jpg gr12 gr12.jpg jpg 31511 298 394 IMAGE-DOWNSAMPLED 1-s2.0-S1381116914004440-gr13.jpg https://s3-eu-west-1.amazonaws.com/prod-ucs-content-store-eu-west/content/pii:S1381116914004440/gr13/DOWNSAMPLED/image/jpeg/a92612c58b938278da71205a2bbb26bd/gr13.jpg https://s3.amazonaws.com/prod-ucs-content-store-us-east/content/pii:S1381116914004440/gr13/DOWNSAMPLED/image/jpeg/a92612c58b938278da71205a2bbb26bd/gr13.jpg gr13 gr13.jpg jpg 28362 341 441 IMAGE-DOWNSAMPLED 1-s2.0-S1381116914004440-gr2.jpg https://s3-eu-west-1.amazonaws.com/prod-ucs-content-store-eu-west/content/pii:S1381116914004440/gr2/DOWNSAMPLED/image/jpeg/8c05d923573fc5376615e4a240002f8e/gr2.jpg https://s3.amazonaws.com/prod-ucs-content-store-us-east/content/pii:S1381116914004440/gr2/DOWNSAMPLED/image/jpeg/8c05d923573fc5376615e4a240002f8e/gr2.jpg gr2 gr2.jpg jpg 54231 644 395 IMAGE-DOWNSAMPLED 1-s2.0-S1381116914004440-gr3.jpg https://s3-eu-west-1.amazonaws.com/prod-ucs-content-store-eu-west/content/pii:S1381116914004440/gr3/DOWNSAMPLED/image/jpeg/7720ead963c11134839472193ce1d51c/gr3.jpg https://s3.amazonaws.com/prod-ucs-content-store-us-east/content/pii:S1381116914004440/gr3/DOWNSAMPLED/image/jpeg/7720ead963c11134839472193ce1d51c/gr3.jpg gr3 gr3.jpg jpg 58841 419 616 IMAGE-DOWNSAMPLED 1-s2.0-S1381116914004440-gr4.jpg https://s3-eu-west-1.amazonaws.com/prod-ucs-content-store-eu-west/content/pii:S1381116914004440/gr4/DOWNSAMPLED/image/jpeg/c36383275ed542d2dab5e3ddc3b9fa74/gr4.jpg https://s3.amazonaws.com/prod-ucs-content-store-us-east/content/pii:S1381116914004440/gr4/DOWNSAMPLED/image/jpeg/c36383275ed542d2dab5e3ddc3b9fa74/gr4.jpg gr4 gr4.jpg jpg 41156 490 324 IMAGE-DOWNSAMPLED 1-s2.0-S1381116914004440-gr5.jpg https://s3-eu-west-1.amazonaws.com/prod-ucs-content-store-eu-west/content/pii:S1381116914004440/gr5/DOWNSAMPLED/image/jpeg/1664717f12a1522d1ff5df72bd4fd47f/gr5.jpg https://s3.amazonaws.com/prod-ucs-content-store-us-east/content/pii:S1381116914004440/gr5/DOWNSAMPLED/image/jpeg/1664717f12a1522d1ff5df72bd4fd47f/gr5.jpg gr5 gr5.jpg jpg 32052 356 493 IMAGE-DOWNSAMPLED 1-s2.0-S1381116914004440-gr6.jpg https://s3-eu-west-1.amazonaws.com/prod-ucs-content-store-eu-west/content/pii:S1381116914004440/gr6/DOWNSAMPLED/image/jpeg/cf9543951865587ec7fcadeb2146e23a/gr6.jpg https://s3.amazonaws.com/prod-ucs-content-store-us-east/content/pii:S1381116914004440/gr6/DOWNSAMPLED/image/jpeg/cf9543951865587ec7fcadeb2146e23a/gr6.jpg gr6 gr6.jpg jpg 43107 537 376 IMAGE-DOWNSAMPLED 1-s2.0-S1381116914004440-gr7.jpg https://s3-eu-west-1.amazonaws.com/prod-ucs-content-store-eu-west/content/pii:S1381116914004440/gr7/DOWNSAMPLED/image/jpeg/17d7d0768ae52e0348133b1f32e0169a/gr7.jpg https://s3.amazonaws.com/prod-ucs-content-store-us-east/content/pii:S1381116914004440/gr7/DOWNSAMPLED/image/jpeg/17d7d0768ae52e0348133b1f32e0169a/gr7.jpg gr7 gr7.jpg jpg 29670 309 376 IMAGE-DOWNSAMPLED 1-s2.0-S1381116914004440-gr8.jpg https://s3-eu-west-1.amazonaws.com/prod-ucs-content-store-eu-west/content/pii:S1381116914004440/gr8/DOWNSAMPLED/image/jpeg/a6f3b254011d387ea8ddfc52eb17e232/gr8.jpg https://s3.amazonaws.com/prod-ucs-content-store-us-east/content/pii:S1381116914004440/gr8/DOWNSAMPLED/image/jpeg/a6f3b254011d387ea8ddfc52eb17e232/gr8.jpg gr8 gr8.jpg jpg 20323 289 377 IMAGE-DOWNSAMPLED 1-s2.0-S1381116914004440-gr9.jpg https://s3-eu-west-1.amazonaws.com/prod-ucs-content-store-eu-west/content/pii:S1381116914004440/gr9/DOWNSAMPLED/image/jpeg/16728b9d2a8330e685b6ab7e889d2237/gr9.jpg https://s3.amazonaws.com/prod-ucs-content-store-us-east/content/pii:S1381116914004440/gr9/DOWNSAMPLED/image/jpeg/16728b9d2a8330e685b6ab7e889d2237/gr9.jpg gr9 gr9.jpg jpg 38557 600 376 IMAGE-DOWNSAMPLED 1-s2.0-S1381116914004440-fx1_lrg.jpg https://s3-eu-west-1.amazonaws.com/prod-ucs-content-store-eu-west/content/pii:S1381116914004440/fx1/HIGHRES/image/jpeg/e9db356df8c58414e70d07df2d74e5f2/fx1_lrg.jpg https://s3.amazonaws.com/prod-ucs-content-store-us-east/content/pii:S1381116914004440/fx1/HIGHRES/image/jpeg/e9db356df8c58414e70d07df2d74e5f2/fx1_lrg.jpg fx1 true fx1_lrg.jpg jpg 158070 886 1467 IMAGE-HIGH-RES 1-s2.0-S1381116914004440-gr1_lrg.jpg https://s3-eu-west-1.amazonaws.com/prod-ucs-content-store-eu-west/content/pii:S1381116914004440/gr1/HIGHRES/image/jpeg/bf17283b3743285a04df5a8a89b63816/gr1_lrg.jpg https://s3.amazonaws.com/prod-ucs-content-store-us-east/content/pii:S1381116914004440/gr1/HIGHRES/image/jpeg/bf17283b3743285a04df5a8a89b63816/gr1_lrg.jpg gr1 gr1_lrg.jpg jpg 400792 2553 1668 IMAGE-HIGH-RES 1-s2.0-S1381116914004440-gr10_lrg.jpg https://s3-eu-west-1.amazonaws.com/prod-ucs-content-store-eu-west/content/pii:S1381116914004440/gr10/HIGHRES/image/jpeg/4d63b2b7fac4690728124245d5a6f4a0/gr10_lrg.jpg https://s3.amazonaws.com/prod-ucs-content-store-us-east/content/pii:S1381116914004440/gr10/HIGHRES/image/jpeg/4d63b2b7fac4690728124245d5a6f4a0/gr10_lrg.jpg gr10 gr10_lrg.jpg jpg 247233 1216 1659 IMAGE-HIGH-RES 1-s2.0-S1381116914004440-gr11_lrg.jpg https://s3-eu-west-1.amazonaws.com/prod-ucs-content-store-eu-west/content/pii:S1381116914004440/gr11/HIGHRES/image/jpeg/da673b1fb865371e711db7889e37d2f3/gr11_lrg.jpg https://s3.amazonaws.com/prod-ucs-content-store-us-east/content/pii:S1381116914004440/gr11/HIGHRES/image/jpeg/da673b1fb865371e711db7889e37d2f3/gr11_lrg.jpg gr11 gr11_lrg.jpg jpg 185163 1429 1734 IMAGE-HIGH-RES 1-s2.0-S1381116914004440-gr12_lrg.jpg https://s3-eu-west-1.amazonaws.com/prod-ucs-content-store-eu-west/content/pii:S1381116914004440/gr12/HIGHRES/image/jpeg/fa3d90b58da0341b5ecaa8833b03ee47/gr12_lrg.jpg https://s3.amazonaws.com/prod-ucs-content-store-us-east/content/pii:S1381116914004440/gr12/HIGHRES/image/jpeg/fa3d90b58da0341b5ecaa8833b03ee47/gr12_lrg.jpg gr12 gr12_lrg.jpg jpg 233833 1321 1746 IMAGE-HIGH-RES 1-s2.0-S1381116914004440-gr13_lrg.jpg https://s3-eu-west-1.amazonaws.com/prod-ucs-content-store-eu-west/content/pii:S1381116914004440/gr13/HIGHRES/image/jpeg/d7b9aea7b2e6b17a22de62b37c5a1cd5/gr13_lrg.jpg https://s3.amazonaws.com/prod-ucs-content-store-us-east/content/pii:S1381116914004440/gr13/HIGHRES/image/jpeg/d7b9aea7b2e6b17a22de62b37c5a1cd5/gr13_lrg.jpg gr13 gr13_lrg.jpg jpg 214844 1511 1952 IMAGE-HIGH-RES 1-s2.0-S1381116914004440-gr2_lrg.jpg https://s3-eu-west-1.amazonaws.com/prod-ucs-content-store-eu-west/content/pii:S1381116914004440/gr2/HIGHRES/image/jpeg/3cd09978e6588fcbaad177d878ba8025/gr2_lrg.jpg https://s3.amazonaws.com/prod-ucs-content-store-us-east/content/pii:S1381116914004440/gr2/HIGHRES/image/jpeg/3cd09978e6588fcbaad177d878ba8025/gr2_lrg.jpg gr2 gr2_lrg.jpg jpg 422917 2854 1750 IMAGE-HIGH-RES 1-s2.0-S1381116914004440-gr3_lrg.jpg https://s3-eu-west-1.amazonaws.com/prod-ucs-content-store-eu-west/content/pii:S1381116914004440/gr3/HIGHRES/image/jpeg/3e04047c946e4bc6dc6b4a2a878ca263/gr3_lrg.jpg https://s3.amazonaws.com/prod-ucs-content-store-us-east/content/pii:S1381116914004440/gr3/HIGHRES/image/jpeg/3e04047c946e4bc6dc6b4a2a878ca263/gr3_lrg.jpg gr3 gr3_lrg.jpg jpg 450696 1852 2726 IMAGE-HIGH-RES 1-s2.0-S1381116914004440-gr4_lrg.jpg https://s3-eu-west-1.amazonaws.com/prod-ucs-content-store-eu-west/content/pii:S1381116914004440/gr4/HIGHRES/image/jpeg/cf1c5b3cf5302a3bbf9159bad6ae8d7a/gr4_lrg.jpg https://s3.amazonaws.com/prod-ucs-content-store-us-east/content/pii:S1381116914004440/gr4/HIGHRES/image/jpeg/cf1c5b3cf5302a3bbf9159bad6ae8d7a/gr4_lrg.jpg gr4 gr4_lrg.jpg jpg 281172 2171 1436 IMAGE-HIGH-RES 1-s2.0-S1381116914004440-gr5_lrg.jpg https://s3-eu-west-1.amazonaws.com/prod-ucs-content-store-eu-west/content/pii:S1381116914004440/gr5/HIGHRES/image/jpeg/d2b654b2e725cca758d97e6a4ed0d58e/gr5_lrg.jpg https://s3.amazonaws.com/prod-ucs-content-store-us-east/content/pii:S1381116914004440/gr5/HIGHRES/image/jpeg/d2b654b2e725cca758d97e6a4ed0d58e/gr5_lrg.jpg gr5 gr5_lrg.jpg jpg 251001 1576 2185 IMAGE-HIGH-RES 1-s2.0-S1381116914004440-gr6_lrg.jpg https://s3-eu-west-1.amazonaws.com/prod-ucs-content-store-eu-west/content/pii:S1381116914004440/gr6/HIGHRES/image/jpeg/2cf7336252c99b513d2ecc6c9dee116d/gr6_lrg.jpg https://s3.amazonaws.com/prod-ucs-content-store-us-east/content/pii:S1381116914004440/gr6/HIGHRES/image/jpeg/2cf7336252c99b513d2ecc6c9dee116d/gr6_lrg.jpg gr6 gr6_lrg.jpg jpg 337775 2382 1667 IMAGE-HIGH-RES 1-s2.0-S1381116914004440-gr7_lrg.jpg https://s3-eu-west-1.amazonaws.com/prod-ucs-content-store-eu-west/content/pii:S1381116914004440/gr7/HIGHRES/image/jpeg/e142eb905303f235e665ed5cd2fcf74e/gr7_lrg.jpg https://s3.amazonaws.com/prod-ucs-content-store-us-east/content/pii:S1381116914004440/gr7/HIGHRES/image/jpeg/e142eb905303f235e665ed5cd2fcf74e/gr7_lrg.jpg gr7 gr7_lrg.jpg jpg 227411 1370 1667 IMAGE-HIGH-RES 1-s2.0-S1381116914004440-gr8_lrg.jpg https://s3-eu-west-1.amazonaws.com/prod-ucs-content-store-eu-west/content/pii:S1381116914004440/gr8/HIGHRES/image/jpeg/928e2baee9e24359444d8f7e35a3c293/gr8_lrg.jpg https://s3.amazonaws.com/prod-ucs-content-store-us-east/content/pii:S1381116914004440/gr8/HIGHRES/image/jpeg/928e2baee9e24359444d8f7e35a3c293/gr8_lrg.jpg gr8 gr8_lrg.jpg jpg 145463 1279 1669 IMAGE-HIGH-RES 1-s2.0-S1381116914004440-gr9_lrg.jpg https://s3-eu-west-1.amazonaws.com/prod-ucs-content-store-eu-west/content/pii:S1381116914004440/gr9/HIGHRES/image/jpeg/5bb2d85b3c27684ea16339981bf1e710/gr9_lrg.jpg https://s3.amazonaws.com/prod-ucs-content-store-us-east/content/pii:S1381116914004440/gr9/HIGHRES/image/jpeg/5bb2d85b3c27684ea16339981bf1e710/gr9_lrg.jpg gr9 gr9_lrg.jpg jpg 291242 2661 1667 IMAGE-HIGH-RES 1-s2.0-S1381116914004440-si1.gif https://s3-eu-west-1.amazonaws.com/prod-ucs-content-store-eu-west/content/pii:S1381116914004440/STRIPIN/image/gif/febe4fb3ca18eb04c6d21d4679e23857/si1.gif https://s3.amazonaws.com/prod-ucs-content-store-us-east/content/pii:S1381116914004440/STRIPIN/image/gif/febe4fb3ca18eb04c6d21d4679e23857/si1.gif si1 si1.gif gif 1876 59 353 ALTIMG 1-s2.0-S1381116914004440-si10.gif https://s3-eu-west-1.amazonaws.com/prod-ucs-content-store-eu-west/content/pii:S1381116914004440/STRIPIN/image/gif/9061520a894b0c9290cafa562135e4f4/si10.gif https://s3.amazonaws.com/prod-ucs-content-store-us-east/content/pii:S1381116914004440/STRIPIN/image/gif/9061520a894b0c9290cafa562135e4f4/si10.gif si10 si10.gif gif 1369 32 353 ALTIMG 1-s2.0-S1381116914004440-si11.gif https://s3-eu-west-1.amazonaws.com/prod-ucs-content-store-eu-west/content/pii:S1381116914004440/STRIPIN/image/gif/b51b6c922bf5e984bb8ea8fdd919deff/si11.gif https://s3.amazonaws.com/prod-ucs-content-store-us-east/content/pii:S1381116914004440/STRIPIN/image/gif/b51b6c922bf5e984bb8ea8fdd919deff/si11.gif si11 si11.gif gif 580 35 104 ALTIMG 1-s2.0-S1381116914004440-si12.gif https://s3-eu-west-1.amazonaws.com/prod-ucs-content-store-eu-west/content/pii:S1381116914004440/STRIPIN/image/gif/eaba1064c21eed553a21804dba4bbf97/si12.gif https://s3.amazonaws.com/prod-ucs-content-store-us-east/content/pii:S1381116914004440/STRIPIN/image/gif/eaba1064c21eed553a21804dba4bbf97/si12.gif si12 si12.gif gif 2437 87 360 ALTIMG 1-s2.0-S1381116914004440-si13.gif https://s3-eu-west-1.amazonaws.com/prod-ucs-content-store-eu-west/content/pii:S1381116914004440/STRIPIN/image/gif/3315dd8ea0909b5eb37f29c0dd39e776/si13.gif https://s3.amazonaws.com/prod-ucs-content-store-us-east/content/pii:S1381116914004440/STRIPIN/image/gif/3315dd8ea0909b5eb37f29c0dd39e776/si13.gif si13 si13.gif gif 255 16 44 ALTIMG 1-s2.0-S1381116914004440-si14.gif https://s3-eu-west-1.amazonaws.com/prod-ucs-content-store-eu-west/content/pii:S1381116914004440/STRIPIN/image/gif/a939c6b635fa4c4ce358b1f6f50ad58c/si14.gif https://s3.amazonaws.com/prod-ucs-content-store-us-east/content/pii:S1381116914004440/STRIPIN/image/gif/a939c6b635fa4c4ce358b1f6f50ad58c/si14.gif si14 si14.gif gif 1031 30 239 ALTIMG 1-s2.0-S1381116914004440-si2.gif https://s3-eu-west-1.amazonaws.com/prod-ucs-content-store-eu-west/content/pii:S1381116914004440/STRIPIN/image/gif/8fe0201bb278db7965203200b90f988b/si2.gif https://s3.amazonaws.com/prod-ucs-content-store-us-east/content/pii:S1381116914004440/STRIPIN/image/gif/8fe0201bb278db7965203200b90f988b/si2.gif si2 si2.gif gif 169 16 21 ALTIMG 1-s2.0-S1381116914004440-si3.gif https://s3-eu-west-1.amazonaws.com/prod-ucs-content-store-eu-west/content/pii:S1381116914004440/STRIPIN/image/gif/0db17b1992bee126a9a40ee428a05ae2/si3.gif https://s3.amazonaws.com/prod-ucs-content-store-us-east/content/pii:S1381116914004440/STRIPIN/image/gif/0db17b1992bee126a9a40ee428a05ae2/si3.gif si3 si3.gif gif 205 14 29 ALTIMG 1-s2.0-S1381116914004440-si4.gif https://s3-eu-west-1.amazonaws.com/prod-ucs-content-store-eu-west/content/pii:S1381116914004440/STRIPIN/image/gif/a1c222e3084f9d3578541de106fc2b6e/si4.gif https://s3.amazonaws.com/prod-ucs-content-store-us-east/content/pii:S1381116914004440/STRIPIN/image/gif/a1c222e3084f9d3578541de106fc2b6e/si4.gif si4 si4.gif gif 527 35 103 ALTIMG 1-s2.0-S1381116914004440-si5.gif https://s3-eu-west-1.amazonaws.com/prod-ucs-content-store-eu-west/content/pii:S1381116914004440/STRIPIN/image/gif/183d1d14bd136d904062462f82682eb1/si5.gif https://s3.amazonaws.com/prod-ucs-content-store-us-east/content/pii:S1381116914004440/STRIPIN/image/gif/183d1d14bd136d904062462f82682eb1/si5.gif si5 si5.gif gif 2468 87 364 ALTIMG 1-s2.0-S1381116914004440-si6.gif https://s3-eu-west-1.amazonaws.com/prod-ucs-content-store-eu-west/content/pii:S1381116914004440/STRIPIN/image/gif/c0e31c1d891da4d639f5502bee65c206/si6.gif https://s3.amazonaws.com/prod-ucs-content-store-us-east/content/pii:S1381116914004440/STRIPIN/image/gif/c0e31c1d891da4d639f5502bee65c206/si6.gif si6 si6.gif gif 261 16 46 ALTIMG 1-s2.0-S1381116914004440-si7.gif https://s3-eu-west-1.amazonaws.com/prod-ucs-content-store-eu-west/content/pii:S1381116914004440/STRIPIN/image/gif/9553ffeec5bacdb79f2beedc228b150c/si7.gif https://s3.amazonaws.com/prod-ucs-content-store-us-east/content/pii:S1381116914004440/STRIPIN/image/gif/9553ffeec5bacdb79f2beedc228b150c/si7.gif si7 si7.gif gif 244 16 44 ALTIMG 1-s2.0-S1381116914004440-si9.gif https://s3-eu-west-1.amazonaws.com/prod-ucs-content-store-eu-west/content/pii:S1381116914004440/STRIPIN/image/gif/c393b6617f96051a53cfa110241cc9b7/si9.gif https://s3.amazonaws.com/prod-ucs-content-store-us-east/content/pii:S1381116914004440/STRIPIN/image/gif/c393b6617f96051a53cfa110241cc9b7/si9.gif si9 si9.gif gif 524 32 111 ALTIMG MOLCAA 9302 S1381-1169(14)00444-0 10.1016/j.molcata.2014.10.001 Elsevier B.V. Fig. 1 (A)—Nitrogen adsorption–desorption isotherm of catalyst; (B)—The BJH pore size distribution curve of catalysts. Fig. 2 Surface acidity (A) or alkalinity (B) characterization of the catalysts by TPD. Fig. 3 XPS spectra of catalysts, (A) Ni2p; (B) Mn2p; (C) O2p; (D) Fe2p in NFO or NFOH; (E) Fe2p in MFO or MFOH. Fig. 4 FT-IR spectra of catalysts. Fig. 5 MH hysteresis loops of catalysts. Fig. 6 Performance and mineralization of phenacetin by catalytic ozonation. Reaction condition: [PNT]=0.2mM, [catalyst]=2.0g/L, all ozone generated at gas flow rate: 1.0L/min, water pH was adjusted by H2SO4 and NaOH (0.1M). Fig. 7 Metal leaching in different reaction. Reaction condition: [PNT]=0.2mM, [O3]=0.36mg/L, [catalyst]=2.0g/L, all ozone generated at gas flow rate: 1.0L/min, water pH was adjusted by H2SO4 and NaOH (0.1M). Fig. 8 Ozone concentration variation in catalytic ozonation in absence of PNT. Reaction condition: [PNT]0 =0.2mM, [O3]=3.85mg/L, [catalyst]=2.0g/L, all ozone generated at gas flow rate: 1.0L/min, water pH was adjusted by H2SO4 and NaOH (0.1M). Fig. 9 Comparison of R ct in different catalyst in degradation PNT. Reaction condition: [PNT]=0.2mM, [O3]=0.36mg/L, [catalyst]=2.0g/L, all ozone generated at gas flow rate: 1.0L/min, water pH was adjusted by H2SO4 and NaOH (0.1M). Fig. 10 TOC as a function of the integral ozone exposure for catalytic ozonation. Reaction condition: [PNT]=0.2mM, [O3]=3.85mg/L, [catalyst]=2.0g/L, all ozone generated at gas flow rate: 1.0L/min, water pH was adjusted by H2SO4 and NaOH (0.1M) Fig. 11 Profiles of H2O2 generation in different process. Reaction condition: [PNT]=0.2mM, [O3]=0.36mg/L, [catalyst]=2.0g/L, all ozone generated at gas flow rate: 1.0L/min, water pH was 7.72. Fig. 12 Decomposition of H2O2 in different processes without PNT. Reaction condition: [O3]=0.36mg/L, [catalyst]=2.0g/L, [H2O2]=1.0mM, all ozone generated at gas flow rate: 1.0L/min, water pH was 7.72. Fig. 13 Evolution of TOC during sequential experiments, starting from SOP, and then intermediates adsorption, finalizing at intermediates degradation by catalytic ozonation. Reaction condition: [PNT]=0.2mM, gas (O3 or O2) flow rate: 1.0L/min, water pH was 7.72. The first stage is SOP with [O3]=0.36mg/L; the second one is intermediates adsorption by catalyst with oxygen purge, [catalyst]=2.0g/L; the third one is degradation of intermediates by catalytic ozonation, [O3]=0.36mg/L, [catalyst]=2.0g/L. Table 1 Surface texture property of catalyst. Catalyst type A BET (m2/g) V total (cm3/g) Pore diameter (nm) pHpzc MFO 42.51±0.10 0.1136 10.68 9.15±0.02 MFOH 107.29±0.44 0.1395 5.20 8.91±0.02 NFO 68.94±0.20 0.1740 10.09 9.03±0.02 NFOH 215.73±0.55 0.1640 3.04 8.31±0.02 Catalyst type Acidity site density (μmol/g) Alkalinity site density (μmol/g) Weak Strong Total Weak Strong Total MFO 0.24 2.71 2.95 0.31 0.69 0.99 MFOH 13.15 4.01 17.16 6.97 1.33 8.30 NFO 10.90 16.00 26.9 5.23 7.67 12.91 NFOH 4.15 17.33 21.48 2.38 8.29 10.68 Table 2 Calculating parameters of R ct. Reaction types SlopePNT (Ms)−1 R ct,PNT (×10−9) k overall,PNT (min−1) SlopeTOC,1 ×10−5 (Ms)−1 SlopeTOC,2 ×10−7 (Ms)−1 SOP 72.83±4.11 0.00 0.0728±0.0015 4.73 5.56±2.16 NFO 127.91±12.88 5.61±2.51 0.0800±0.0031 17.32 272.80±50.66 NFOH 164.33±27.61 19.91±7.48 0.0870±0.0034 21.84 174.70±16.13 MFO 18.46±1.83 0.00 0.0729±0.0058 3.97 34.41±5.57 MFOH 18.25±1.64 0.00 0.0738±0.0041 3.34 43.41±4.48 Heterogeneous catalytic ozonation of phenacetin in water using magnetic spinel ferrite as catalyst: Comparison of surface property and efficiency Fei Qi a c ⁎ Bingbing Xu b Wei Chu c ⁎ a Beijing Key Lab for Source Control Technology of Water Pollution, College of Environmental Science and Engineering, Beijing Forestry University, Beijing, 100083, PR China Beijing Key Lab for Source Control Technology of Water Pollution, College of Environmental Science and Engineering, Beijing Forestry University Beijing 100083 PR China b State Key Laboratory of Environmental Criteria and Risk Assessment, Chinese Research Academy of Environmental Sciences, Beijing, 100012, PR China State Key Laboratory of Environmental Criteria and Risk Assessment, Chinese Research Academy of Environmental Sciences Beijing 100012 PR China c Department of Civil and Environmental Engineering, The Hong Kong Polytechnic University, Hung Hom, Kowloon, Hong Kong Department of Civil and Environmental Engineering, The Hong Kong Polytechnic University, Hung Hom Kowloon Hong Kong ⁎ Corresponding authors at: Beijing Forestry University, College of Environmental Science and Engineering, Beijing 100083, China. Tel.: +86 10 623 6596/+852 2766 6075; fax: +86 10 623 6596/+852 2334 6389. Graphical abstract In this study, a systematic investigation on the degradation of phenacetin (PNT) by magnetic spinel ferrite (including MnFe2O4 and NiFe2O4) via catalytic ozonation was carried out. The structural and surface property of the catalyst, the performance and mineralization during PNT degradation, and •OH/H2O2 identification were studied. The precursors of the catalyst, i.e. MnFe2(OH)8 and NiFe2(OH)8, showed certain magnetic properties and a superior catalytic activity for ozonation enhancement than spinel ferrites. Spinel ferrites containing manganese initiate an ozone mass transfer into the solution, where the critical intermediate (H2O2) is generated. The manganese ferrite spinel triggers H2O2 decomposition in the presence of ozone and generates •OH for the mineralization of PNT and its intermediates. Spinel ferrites involved nickel catalyzed ozone decomposition and generate H2O2 and •OH. All catalysts showed a weak heavy metal leaching, which suggests that the heterogeneous reaction dominates the catalytic reaction and the resultant effluent is safe for the aqueous environment. The magnetic variation of catalysts involving nickel is insignificant, suggesting that the catalyst can be reused many times. The fate of the intermediates on spinel oxides surface influenced for the catalytic ozonation process differently. Keywords Hydroxyl radical Magnetic nano-particles Ozonation Peroxide Phenacetin 1 Introduction Magnetic spinel ferrites, with a general formula of MeFe2O4 (Me denotes a divalent metal such as Fe(II), Mn(II), Ni(II), Zn(II), Co(II), and so on), are chemically and thermally stable magnetic materials that have been used in many applications [1–4], such as adsorbents [5–7] and photo-catalysts [8,9] for the removal of toxic substances in water. The high density of surface hydroxyl group (OH) and active elements make spinel ferrites good catalyst in enhancing ozonation process [10–13]. Magnetic particles can be separated from solution using a simple magnetic process, which make it superior to other iron oxides (such as FeOOH [14–16], and Fe3O4 [17,18]). CuFe2O4 [13], NiFe2O4 [11,12] and Bi2CuO4 [19] have been used in catalytic ozonation for the degradation of refractory organic pollutants. The investigated spinel ferrite oxides have been synthesized by co-precipitation/combustion [13,20], sol–gel/hydrothermal [11,12] and sonochemical [19] methods. Despite promising results in catalytic ozonation using spinel ferrite as the catalyst, the development of one efficient catalyst or novelty synthesis method is still a major research aim. However, the release of metal ions during the reaction and accumulation of organic intermediates on the catalyst surface may affect catalyst stability/activity and create a major obstacle for its application. Especially, the understanding of the role of the spinel ferrite surface properties in catalytic reactions and the magnetism variation after recycling still remain unclear. In this study, MnFe2O4 (MFO) and NiFe2O4 (NFO) were used in catalytic ozonation for the degradation of phenacetin (PNT, N-(4-ethoxyphenyl) acetamide), and a non-opioid analgesic and antipyretic agent, that is found frequently in water [21]. Recently, many studies have focused on the removal efficiency of PNT from water by several advanced oxidation processes (AOPs) [22–24]. It is interesting to find that the precursors for synthesizing the catalysts (i.e. MnFe2(OH)8 (MFOH) and NiFe2(OH)8 (NFOH)) also exhibit magnetic properties and display catalytic potential in this study. Therefore, four different catalysts were investigated in detail by comparing their surface properties, magnetic properties and catalytic activities in this study. The magnetism variation after repeated usages and the active metal ions leaching, the role of spinel ferrite surface properties in catalytic ozonation, and the effect of intermediates on the catalytic activity were studied as well. 2 Materials and methods 2.1 Chemicals All chemicals and solvents were of analytic reagent grade and high performance liquid chromatography (HPLC) grade, respectively, and were used as received without any further purification. Model compound, PNT (>99% purity), was purchased from International Laboratory (USA). Distilled-deionized water (DDW) was generated from a Banstead NANO pure water treatment system (Thermo Fisher Scientific Inc., USA). The resistivity of DDW was 18.2MΩ·cm and was used to prepare all the solutions in this study. Nickel nitrate, manganous nitrate, ferric nitrate and sodium hydroxide were purchased from Sigma-Aldrich Inc. (USA) for the preparation of magnetic nanoparticles. 2.2 Catalyst synthesis and characterization MeFe2O4 was prepared by co-precipitation- calcination method revised from the previous work [25]. The details for the preparation methods and characterization process were provided in Text S1 of Supplementary material (SM). MeFe2(OH)8 was synthesized by co-precipitation method without the calcination. 2.3 Catalytic ozonation reactions The setup of the tested ozonation system consisted of a glass column equipped with gas inlet and outlet. The solution temperature was controlled by the water jacket. Ozone was produced from pure oxygen using the OZAT ozone generator (CFS-1A from Ozonia Ltd.) and bubbled into the bottom of the column with a diffuser at a rate of 1.0mL/min continuously. In this study, all experiments were carried out under a semi-batch mode to simulate the wastewater treatment plant, and the reported concentration was the initial dissolved ozone concentration. The ozone yield was adjusted by changing the voltage of the ozone generator. In general, 100mL pure water was pre-ozonated for 5min (to reach a saturation condition). The catalytic ozonation process was initiated by adding 1mL of PNT stock solution (20.0mM) and catalyst (200mg) simultaneously into the pre-ozonated solution with stirring (400rpm) under ambient temperature that was controlled by the water jacket. The samples were withdrawn at a predetermined time and the reaction was quenched. For PNT/total organic carbon (TOC) determination, the reaction was quenched by sodium thiosulfate (0.1M) and the solution was filtered through a 0.45μm PTFE membrane to ensure the solution was free from catalysts prior to quantification (PNT adsorption by PTFE membrane was found to be insignificant); while for quantification of dissolved ozone concentration, the solution was quenched by indigo and centrifuged to remove the catalyst. The same condition was used for the sole ozonation process (SOP, without catalyst) and PNT adsorption on the catalyst (purging with oxygen only, without ozone). After the tests, the spent catalysts were recovered from the mixture by magnetic field and they were then used directly in the following test without any treatment. All experiments were conducted three times; the average data and error bars are shown in the figures. Solution pH was adjusted by HNO3 and NaOH in all reactions when required. 2.4 Analytical method The concentration of PNT was analyzed using a high performance liquid chromatography (HPLC, Waters Instrument, USA) with a UV detector at the wavelength of 240nm with a Restek pinnacle octylamine column (5μm, 0.46×25cm). The mobile phase was 60% CH3CN and 40% phosphoric acid solution (0.08%). The LC analysis standard deviation (SD) was less than 6.00% and the detection limitation was 0.5μM. TOC was determined by a TOC Analyzer (TOC-5000A, Shimadzu), with a SD of less than 5.40% and a detection limitation of 0.5mg/L. The dissolved ozone concentration was measured colorimetrically by the indigo method [26] and the gas type ozone was measured by the iodometric method. The concentration of H2O2 was determined by measuring the absorbance of the titanium peroxide (TiO2 2+) complex formed from the reaction of TiOSO4 with H2O2 using a Biochrom Libra S12 spectrophotometer at 405nm [27] with SD of less than 4.33% and a detection limitation of 0.01mM. The dissolution of ions during the reaction was analyzed by inductively coupled plasma-atomic emission spectrometry (ICP-AES) with a SD of less than 5.10%. 3 Results and discussion 3.1 Structural characteristics of the catalyst The surface texture parameters and N2 adsorption–desorption curve/pore distribution of the tested catalysts are shown in Table 1 and Fig. 1 , respectively. From Fig. 1(A), the specific BET surface area could be obtained. NFOH had the largest surface area (215.73m2/g), while MFO had the lowest surface area (42.51m2/g). In general, the specific surface area of the hydroxides (NFOH and MFOH) was higher than that of the calcined oxides (NFO and MFO); and the oxides containing nickel was larger surface area than that of manganese. The N2 adsorption–desorption curves of four catalysts correspond mainly to the type IV isotherm, indicating that both micro and mesopores exist in the catalysts [28]. A hysteresis loop was visible for NFOH and NFO, but was not for MFOH and MFO. The hysteresis loop suggested the presence of a non-cylindrical-shaped pore in the crude wall [29,30]. The pore distribution of catalysts was shown in Fig. 1(B). The pore type of NFOH/NFO was apparently different from that of MFOH/MFO, and the pore volume of the former was higher than the latter. The hydroxides showed two focused peaks of pore diameter at 3.0–5.0nm and 15.0–90.0nm. After the calcination, the pore diameter distribution transferred to one focused peak at 3.0–15.0nm. The pore diameter in NFO or MFO was wider than that in NFOH or MFOH, and the mesopores in NFO and MFO became more significant. The surface acidity and alkalinity were determined by the temperature-programmed desorption of ammonia (NH3-TPD, Fig. 2(A)) and carbon dioxide (CO2-TPD, Fig. 2(B)), respectively. Two NH3 desorption peaks were detected in the tested temperature range (from 400 to 1000K), which illuminates the presence of two different acid sites owing to different NH3 absorption energies on the samples. The weak and strong acid sites were estimated from the desorption peak in the temperature range 500–720K and 870–1000K, respectively. The calculated results of the acidity sites intensity were shown in Table 1. The intensity order of acidity sites for catalysts was MFOH>NFO>NFOH>MFO for weak site and NFOH>NFO>MFOH>MFO for strong site. There was no significant rule for the weak acidity site, however, the nickel iron spinel and its hydroxyl oxides showed a higher intensity for the strong site. Importantly, the hydroxyl oxides of the iron spinel exhibited higher intensity than the calcined ones. The total intensity order of acidity sites for catalysts was NFOH>NFO>MFOH>MFO. Similarly, the emerging peaks in Fig. 2(B) represent for the basic sites. Both weakly and strongly adsorbed CO2 peaks were detected over a wide temperature range (from 400 to 1000K). The weak and strong basic sites in the temperature ranged in 350–620K and 850–1000K as derived from the CO2-TPD curves were also calculated and summarized in Table 1. The intensity order of basic sites for catalysts was MFOH>NFO>NFOH>MFO for weak site and NFOH>NFO>MFOH>MFO for strong site. The total intensity of basic sites was NFO>NFOH>MFOH>MFO, which was consistent with the concentration of the major acidity site. In this study, the point of zero charges (pHpzc) of the catalyst were also determined and shown in Table 1. The value of pHpzc reflects the surface acidity of the OH bond in metal oxides [31,32]. However, its order was not consistent with the results of TPD, indicating that the MeO bond of catalyst showed another role in the surface acid/basic site, except the OH bond. To further study the surface nature of the catalysts, samples were characterized by X-ray photoelectron spectroscopy (XPS) in Fig. 3 and Fourier transform-infrared spectroscopy (FT-IR) in Fig. 4 . The survey of XPS spectrums of all catalysts (Fig. S1) confirmed that catalysts contain Fe, O and C. Also, the element of Mn or Ni was detected in the corresponding catalysts. The presence of C in catalyst may be due to the absorbed CO2 that came from air on their surface. The surface charge was corrected by referencing the spectra to the CC state of the C 1s peak at a binding energy at 284.6eV. The peaks at 856.9 and 863.7eV in Fig. 3(A) could be assigned to the binding energies of Ni 2p3/2 and Ni 2p1/2, respectively, which were closed to the standard data for Ni2+ in both NFO and NFOH. Also, the presence of Mn 2p1/2 and Mn 2p3/2 were confirmed by the peaks of 653.9eV and 642.1eV in MFO or MFOH samples (Fig. 3(B)). The intensity of Ni or Mn in hydroxides was much lower than that in calcined oxides, because of the relative content of Ni or Mn is lower in the hydroxides. Generally, the O 1s region is fitted with peaks corresponding to O−2 from the MeO lattice (530.3±0.2eV), OH (531.5±0.2eV), and adsorbed H2O on the surface of oxides (533.7±0.2eV) [33–35]. From Fig. 3(C), no peak of adsorbed H2O was observed, suggesting a reliable storage under vacuum. The peaks of O−2 and OH were observed for all catalysts. But the intensities of them were significantly different. For hydroxides, the intensity of OH was higher than that of calcined oxides, especially for MFOH and MFO. The XPS spectrum of Fe 2p in Fig. 3(D) showed two distinct peaks at binding energies of 724.1eV as Fe 2p1/2 and 710.7eV as the Fe 2p3/2, which are the characteristic of Fe3+. Moreover, there was a satellite peak (718.6eV) existed for Fe 2p3/2 [36]. The FT-IR also showed surface functional groups of catalyst. The absorption peak with a wave number near 1633cm−1 was generally attributed to the bending vibration of OH (δOH), which was observed for all catalysts. This result of FT-IR was consistent with the deconvolution analysis of key species in XPS spectrum. The intensity of OH in hydroxides was higher than that in calcined oxides. FT-IR spectrum showing an adsorption band around 590cm−1 was observed for all samples, corresponded to the stretching vibration of the tetrahedral and octahedral sites of Fe3+ O, an evidence of spinal ferrite formation [37–39]. In MFOH and NFOH, the same peak exited but it exhibited a lower intensity than MFO and NFO, with the relative content of Fe being lower in hydroxides. Furthermore, the chemical shift of MnO and NiO stretching vibration in samples existed from 450 to 475cm−1 and 890–900cm−1, respectively. For the used samples, no significant change was observed for those key peaks, indicating the reutilization of catalysts will not deteriorate the surface functional groups, and the catalysts have good potentials to be recycled and reused in the catalytic ozonation process. Fig. 5 shows the field-dependent magnetization of the synthesized magnetic catalyst measured at 300K (±10kOe), where the magnetism was good for NFO and MFOH. The magnetism of MFO or NFOH was much lower than that of MFOH and NFO and therefore requires a larger magnetic field for their recycling. Based on this result, it was concluded that the degree of crystallization and particle size were not the limiting factors for the magnetism property. The interactions of MeFe and the types of metal elements might be the important factors [11,12]. The coercivities (H c) of NFO and NFOH were lower than those of MFO and MFOH, indicating the separation of NFO and NFOH from water by the magnetic fields was not limited by the direction of magnetic field. This was more significant for NFOH, a super-paramagnetic hydroxide, suggesting a good potential of NFOH in water treatment. After the catalysts were used in the catalytic ozonation process, the magnetization of MFO or MFOH changed significantly. This observation has never been reported before. The magnetization of MFO was increased after being used in catalytic ozonation. The opposite experimental phenomenon was observed for MFOH, because of the oxidation of Mn(II) to strengthen the interactions of MnFe. NFO and NFOH showed less change on the magnetization, indicating that they are suitable for used in applications that require catalyst recycling. 3.2 Performance and mineralization of PNT in catalytic ozonation The removal efficiency of PNT in catalytic ozonation using different catalysts was tested at an ozone dosage of 0.36mg/L, as shown in Fig. 6(A). The sole ozonation process (SOP) showed a pretty fast PNT decay, and over 95% of PNT was removed in 30min. This is because the ozone selectively attacked the activated aromatic rings of PNT. Also, the amino group (NH2) is an electron-donating group that activates the aromatic ring by increasing its electronic density [40–42], and this allows PNT to be oxidized easily. PNT has a higher trend for delocalizing electrons and exhibits an enhanced reactivity toward ozone. In terms of its reactivity to molecular ozone, the introduction of a catalyst developed the degradation performance slightly. Nevertheless, the involvement of four catalysts resulted in an additional rate of improvement of PNT decay at the descending order of NFOH, NFO, MFOH, and MFO. To evaluate the possible adsorption of PNT by the catalyst and the purging effect of the system, the ozone was replaced by oxygen and no PNT removal was observed. This suggested that the adsorption and purging of PNT was insignificant, and the additional PNT removal efficiency arose solely from catalytic oxidation. The mineralization in the SOP or in catalytic ozonation was also examined (Fig. 6(B)). The SOP mineralization efficiency was only 29.36% in 3h. In the presence of a catalyst, the mineralization increased to 60%, regardless of the catalyst selection. Most TOC removal was accomplished in 30min, which suggests that the degradation of PNT and its daughter compounds occurred mainly in the first 30min in either the SOP or in catalytic ozonation. The degradation of PNT and its mineralization probably occurs because of three mechanisms: (1) catalysts could increase the generation of reactive oxygen species (ROS) and these species can then react with PNT to form oxidized products or intermediates; (2) ozone is adsorbed by the catalyst and undergoes a surface reaction; and (3) the intermediates are adsorbed on the catalyst surface and undergo a subsurface reaction. This will be explained later. 3.3 Metal leaching in different catalytic reactions Metal leaching from the catalyst during oxidation was examined by ICP-AES with an acidification digestion pretreatment as shown in Fig. 7 , in which metal ion leaching is expressed as a percentage of the total metal in the catalyst. The maximum concentration of Fe, Mn and Ni leached was 0.034%, 0.0018% and 0.018%, respectively. Compared with the catalyst, the leaching of metal ions was insignificant. Two additional conclusions can be drawn from Fig. 7: (1) the concentration of dissolved metal would not cause any noticeable toxicity to human or aquatic animals/plants in the effluent after catalysis; and (2) the low level of metal in the homogeneous phase does not enhance the SOP efficiently as reported previously [43–48]. Therefore, the heterogeneous reaction dominated the catalytic ozonation process in this study. In addition, the metal leaching profiles also depend on the catalyst type. Catalysts that contained nickel showed a higher leaching concentration of Fe and Ni, and the leaching concentrations of Fe and Ni from NFO were higher than those from NFOH. For Fe, leaching emerged mainly in the early reaction stage, and then decreased because of adsorption by the catalyst or chemical precipitation. For Ni, the leaching concentration increased as the reaction proceeded. Catalysts that included manganese showed a lower leaching of metals. 3.4 Ozone concentration in different processes Since there was no adsorption of PNT on the catalysts, the interaction between the catalyst and ozone was likely the effective way responsible for the degradation and mineralization of PNT [49]. To test this hypothesis, dissolved ozone profiles in the aqueous phase ([O3]aq) without PNT were examined for different processes and these are shown in Fig. 8 . For sole ozone purging, after pre-ozonation, the dissolved ozone was generally maintained at a steady concentration, which was a balance of gas transfer process. When NFO or NFOH was added, the dissolved ozone concentration dropped significantly initially and then increased and returned to a steady concentration in 20min. This period of gas transfer balance was shorter than that in the process without catalyst. This phenomenon demonstrates that NFO or NFOH accelerated ozone decomposition in water at a similar rate. The catalytic ozone decomposition ability between NFO and NFOH were much closer. The addition of MFO or MFOH surprisingly resulted in a linear increase in dissolved ozone concentration in the first 10min, to reach a final [O3]aq at 10.08mg/L (MFO) or 11.80mg/L (MFOH). Apparently, the presence of MFO or MFOH accelerated the ozone transfer from gaseous to aqueous phase, instead of catalyzing ozone decomposition. This experimental phenomenon confirmed that the MFOH exhibited a stronger ability for the development of ozone mass transfer. Ozone shows properties of Brønsted basicity and may react with acidic metal oxide sites at the catalyst surface. [50]. The different reactions observed between ozone and catalysts in the above tests occur because of the different surface properties of nickel or manganese ferrite spinel. By cross checking the above observation and the surface acidity intensity (from the TPD test), it was found that the stronger surface acidity was good for catalytic ozone decomposition (in nickel ferrite spinel) and manganese ferrite spinel favored ozone gas transfer. 3.5 Hydroxyl radical generation yields in PNT degradation and mineralization Through identification of oxidant species, as discussed above, it was apparent that a heterogeneous catalyst surface is able to transfer ozone gas into the solution or produce •OH efficiently for different catalyst types, whereas no adsorption between the PNT and catalyst surface was observed. Therefore, in general, the PNT decomposition rate in the ozonation process can be modeled by a combination of two bimolecular reactions: direct ozonation and indirect catalytic oxidation by •OH as expressed by: (1) − d PNT d t = k O 3 ,PNT PNT O 3 + k • OH,PNT PNT • OH = k overall,PNT PNT where k O 3 and k • OH are the PNT reaction rate constants with molecular ozone and •OH, respectively. They can be calculated from the competitive kinetics as shown in Text S2, Table S1, and Fig. S2. Because of the lack of direct measurement methods for solution [•OH], the approach proposed by Elovitz and von Gunten [51] was used to determine the [•OH] during ozonation in batch and continuous experiments. The kinetics of PNT removal by ozonation/catalytic ozonation was investigated by assuming the ratio of [•OH] to [O3], R ct. This ratio is a constant during steady state ozonation, as given by Eq. (2), in which a higher R ct implies that a higher fraction of ozone is being converted to •OH (2) R ct,PNT = • OH O 3 By incorporating R ct into Eq. (1) and with integration, the removal of PNT can be formulated as: (3) ln [ PNT ] [ PNT ] 0 = − k O 3 ,PNT + k • OH,PNT R ct,PNT ∫ O 3 d t = − slope PNT ∫ O 3 d t Therefore, for a specific ozonation process R ct,PNT can be predicted from the [PNT] decay and the two rate constants k O 3 , PNT and k •OH,PNT. From Fig. 9 , the slopePNT and R ct,PNT in different processes were calculated as shown in Table 2 . An interesting observation is that slopePNT in MFO and MFOH catalytic ozonation is smaller than the k O 3 ,PNT , which indicates that the contribution of •OH for PNT degradation was insignificant in MFO or MFOH catalytic ozonation. The results are consistent with Fig. 8, in which no ozone decomposition (except enhanced ozone mass transfer) was observed in MFO or MFOH catalytic ozonation. The smaller slopePNT of MFOH than MFO also verifies the improved ability of the former in enhancing ozone mass transfer. The introduction of MFO or MFOH developed the ozone mass transfer, and indicated that molecular ozone rather than •OH oxidation dominated the degradation of PNT. The higher slopePNT for the NFO or NFOH processes over sole ozonation (and numerically larger value than for k O 3 ,PNT ), suggesting the presence of •OH oxidation in the sole ozonation, NFO and NFOH processes. The R ct,PNT in Table 2 confirm that NFOH is able to catalyze ozone decomposition more strongly than NFO. In the processes involving nickel ferrite (hydroxyl) oxide, •OH oxidation play a certain role in PNT degradation, because of the accelerated ozone decomposition by nickel ferrite (hydroxyl) oxide. In catalytic ozonation, the mineralization was examined by TOC decay, where the model compound profiles and their intermediates can be expressed by the following equation: (4) − r TOC = d TOC d t (5) − d TOC d t = k O 3 ,TOC TOC O 3 + k • OH,TOC TOC • OH Similar to R ct,PNT, R ct,TOC was defined in terms of TOC decay (6) R ct,TOC = • OH O 3 Eq. (5) can be transferred and rewritten as: (7) ln TOC TOC 0 = − k O 3 ,TOC + k • OH , TOC R ct,TOC ∫ O 3 d t = − slope TOC ∫ O 3 d t . The k O 3 ,TOC or k •OH,TOC are the TOC decay rate constants by molecular ozone or •OH, respectively. The determination of these decay constants is difficult; therefore, the variation of slopeTOC was used to examine the mineralization process. Higher slopeTOC resulted in a higher •OH contribution. From Fig. 10 , it can be seen that the reaction is divided into two stages. In general, nearly all PNT and the majority part of TOC were degraded in 30min in all the processes tested. In this stage, the •OH yields of mineralization by nickel ferrite catalysts were higher than those in SOP and manganese ferrite catalysts, which agreed with the observation in •OH yields of PNT degradation. Nickel ferrite catalysts catalyzed ozone to form •OH that oxidized PNT and its intermediates. Because the reaction constant between the intermediates and molecular ozone is lower than that of PNT [52], the contribution of •OH for mineralization was more apparent than that of the molecular ozone. No significant difference was observed between the hydroxyl and calcined oxides, which suggests that they showed a similar intermediate degradation performance. However, diversities in •OH mineralization yields were observed after 30min (i.e. stage 2), in which NFO showed a better •OH mineralization yield than NFOH. This was different from the PNT degradation. The •OH yields in the manganese ferrite catalytic system were higher than those in the SOP, which suggests that •OH contributed to intermediate degradation despite the fact that molecular ozone mass transfer development was achieved by manganese ferrite catalyst. The •OH did not arise from ozone decomposition, which will be shown later. Different reaction mechanisms exist for catalysts that involve nickel, and the catalyst with manganese exhibited a lower contribution of •OH in the degradation of intermediates. 3.6 Peroxide generation or decomposition in different processes H2O2 is a byproduct of the reaction of O3/•OH with olefinic products resulting from the breaking of the aromatic moiety of the initial substrate [53,54]; and it is also a ROS in catalytic ozonation [55]. From Fig. 11 , H2O2 was identified in all PNT degradation processes. In general, the [H2O2] increased first to a peak and then decreased because of consumption/degradation. The evolutions depended on the presence and type of catalyst. In SOP, the maximum yield of H2O2 that was generated from the degradation of PNT, was 0.066mM at 45min. This yield was the lowest of all reactions. The enhanced generation of H2O2 in the catalytic ozonation provides evidence for the development of PNT degradation. H2O2 yields in nickel ferrite catalytic ozonation were higher than those in the manganese ferrite reaction process. In addition, the yield of H2O2 in NFOH catalytic ozonation was higher than that in NFO; the yields of H2O2 in MFOH and MFO were at the same level. The maximum [H2O2] descended according to NFOH>NFO>MFOH>MFO>SOP, which is consistent with •OH generation in PNT degradation. The H2O2 decomposition in NFOH-driven catalytic ozonation (1.32×10−3 mM/min) was slightly slower than that in NFO (1.76×10−3 mM/min); while the rate in MFO (7.79×10−4 mM/min) was three times faster than in MFO (2.49×10−4 mM/min). PNT decay induces H2O2 formation, which is likely not self-decayed [56], but is decomposable by O3 [57,58] or a catalyst [59]. This H2O2 decomposition was confirmed from the results of Fig. 12 by dosing an initial [H2O2] of 1.0mM to each process without PNT. All processes followed pseudo first-order kinetics. Therefore, the evolution of H2O2 in catalytic ozonation of PNT can be expressed as: (8) PNT ⟶ ozone+catalyst k 1 H 2 O 2 ⟶ ozone+catalyst k 2 • OH From Fig. 12, it can be seen that manganese ferrite was better able to decompose H2O2 than nickel ferrite. Manganese ferrite has faster ozone mass transfer and H2O2 decomposition rates (i.e. higher k 2 in Eq. (8)), but did not lead to a better mineralization than NFO or NFOH. This is because the lower yield of H2O2 in the process (i.e. lower k 1 in Eq. (8)) limits the generation of •OH, and results in a lower PNT mineralization (Fig. 10). It is interesting to note that NFO has the lowest k2 but the highest TOC removal rate. This is likely because the slower (or well controlled) generation of •OH from H2O2 decomposition can reduce the reaction between •OH and H2O2 (which generate the much weaker •OOH radical). Therefore, the capability of NFO to maintain a low [•OH] in solution effectively improves the overall TOC removal compared with other catalysts. 3.7 Intermediates adsorption/degradation over catalyst surface A sequential test was performed to understand the role of catalyst in degradation PNT and its daughter compounds. First, a solution of PNT was ozonized for 1h to generate intermediates; then oxygen was bubbled into the solution for 10min to remove the remaining dissolved ozone. The catalyst was then introduced to the solution and mixed for 1h to evaluate the adsorption of intermediates by the catalysts. Finally, the performance of catalyst in the removal of intermediates was examined by resuming the supply of ozone for 1h. Results were shown in Fig. 13 , which was different from results in Fig. 6(B) in a continuous mode. Based on the above discussion, the reaction system was divided into: (1) the •OH dominating reaction involved in nickel ferrite system; (2) molecule ozone dominating reaction involved in manganese ferrite system. From Fig. 13, the final TOC removal efficiency in NFOH catalytic ozonation was higher than that in NFO, which was opposite to the result of Fig. 6. The higher intermediate adsorption capacity on the NFOH surface was good effective for degradation by •OH, for no desorption was observed for this kind catalyst. This was not observed in the manganese ferrite catalytic ozonation reaction. Manganese ferrite showed adsorption/desorption of the intermediate; while no desorption was observed for the nickel ferrite. Therefore, the possible desorption of PNT/intermediates out of the manganese ferrite surface is another reason for their lower mineralization performance. 4 Conclusion Catalysts MnFe2O4 and NiFe2O4 were synthesized by co-precipitation- combustion as a simple and affordable method, and used for catalytic ozonation in water treatment. It was found that their precursors, MnFe2(OH)8 (MFOH) and NiFe2(OH)8 (NFOH), showed certain magnetic properties and gave excellent catalytic activity to enhance ozonation. A heterogeneous reaction dominated the catalytic processes, and all catalysts showed low metal leaching, so the effluent is safe for disposal. The variation of catalyst magnetization after repeated usages was generally insignificant, suggesting a long catalyst life-cycle. The structure and surface of catalyst, performance and mineralization on PNT degradation, and reactive oxygen species (ROS) identification were investigated systematically. Furthermore, the fate of the intermediates on the surface of spinel oxides showed a different influence from the catalytic ozonation process. In general, two distinct reaction mechanisms were observed. One was the improvement of ozone transfer into the solution, and the other was the formation of a critical intermediate (H2O2) that was generated in the presence of ozone and PNT. Therefore the hydroxyl radical (•OH) was generated catalytically by the decomposition of H2O2, which makes the mineralization of PNT and its intermediates possible. Acknowledgements This work was carried out with the support of Research Funds for the Central University (No. YX2014-06), Hong Kong Scholars Program, a funding from the Hong Kong Polytechnic University (G-YZ09), the National Natural Science Foundation of China (No. 51378063, 51108030 and 41273137), Beijing Natural Science Foundation (No. 8132033), and China Post Doctoral Science Foundation (No. 201104060 and 2012M520006). References [1] T.G. Glover J.B. DeCoste D. Sabo Z.J. Zhang Langmuir 29 2013 5500 5507 [2] C.Y. Wang L.Y. Zhu C. Chang Y. Fu X.L. Chu Catal. Commun. 37 2013 92 95 [3] R. Pazik E. Piasecka M. Malecka V.G. Kessler B. Idzikowski Z. Sniadecki R.J. Wiglusz RSC Adv. 3 2013 12230 12243 [4] T. Zhang H.B. Zhu J.P. Croue Environ. Sci. Technol. 47 2013 2784 2791 [5] T.G. Glover D. Sabo L.A. Vaughan J.A. Rossin Z.J. Zhang Langmuir 28 2012 5695 5702 [6] L.N. Shao Z.M. Ren G.S. Zhang L.L. Chen Mater. Chem. Phys. 135 2012 16 24 [7] L.X. Wang J.C. Li Y.Q. Wang L.J. Zhao Q. Jiang Chem. Eng. J. 181 2012 72 79 [8] Y. Hou X.Y. Li Q.D. Zhao G.H. Chen Appl. Catal., B: Environ. 142 2013 80 88 [9] T. Soltani M.H. Entezari J. Mol. Catal. A—Chem. 377 2013 197 203 [10] N.M. Mahmoodi Mater. Res. Bull. 48 2013 4255 4260 [11] Y.M. Ren Q. Dong J. Feng J. Ma Q. Wen M.L. Zhang J. Colloid Interface Sci. 382 2012 90 96 [12] H. Zhao Y.M. Dong G.L. Wang P.P. Jiang J.J. Zhang L.N. Wu K. Li Chem. Eng. J. 219 2013 295 302 [13] X.Y. Liu Z.M. Zhou G.H. Jing J.H. Fang Sep. Purif. Technol. 115 2013 129 135 [14] M.H. Sui L. Sheng K.X. Lu F. Tian Appl. Catal., B: Environ. 96 2010 94 100 [15] L. Yang C. Hu Y.L. Nie J.H. Qu Appl. Catal., B: Environ. 97 2010 340 346 [16] T. Zhang W.P. Chen J. Ma Z.M. Qiang Water Res. 42 2008 3651 3658 [17] A.H. Lv C. Hu Y.L. Nie J.H. Qu Appl. Catal., B: Environ. 117 2012 246 252 [18] Z.D. Yang A.H. Lv Y.L. Nie C. Hu Front. Environ. Sci. Eng. 7 2013 451 456 [19] S. Anandan G.J. Lee C.K. Yang M. Ashokkumar J.J. Wu Chem. Eng. J. 183 2012 46 52 [20] H.Z. Chen S.G. Yang J. Chang K. Yu D.F. Li C. Sun A.M. Li Chemosphere 89 2012 185 189 [21] M.A. Shibata M. Sano A. Hagiwara R. Hasegawa T. Shirai Jpn. J. Cancer Res. 86 1995 160 167 [22] F. Javier Benitez J.L. Acero F.J. Real G. Roldán Chemosphere 77 2009 53 59 [23] F.J. Benitez F.J. Real J.L. Acero G. Roldan J. Chem. Technol. Biotechnol. 84 2009 1186 1195 [24] F.J. Benitez J.L. Acero F.J. Real G. Roldan F. Casas Chem. Eng. J. 168 2011 1149 1156 [25] S.W. Tao F. Gao X.Q. Liu O.T. Sorensen Mater. Sci. Eng. B: Solid 77 2000 172 176 [26] H. Bader J. Hoigne Water Res. 15 1981 449 456 [27] D.W. O'Sullivan M. Tyree Int. J. Chem. Kinet. 39 2007 457 461 [28] F. Qi B.B. Xu Z.L. Chen J. Ma D.Z. Sun L.Q. Zhang F.C. Wu J. Hazard. Mater. 168 2009 246 252 [29] P.Z. Guo L.J. Cui Y.Q. Wang M. Lv B.Y. Wang X.S. Zhao Langmuir 29 2013 8997 9003 [30] P.L. Niu P. Wang H. Zeng R.H. Yu Mater. Technol. 28 2013 347 352 [31] L. Zhao Z. Sun J. Ma Environ. Sci. Technol. 43 2009 4157 4163 [32] L. Zhao Z. Sun J. Ma H. Liu Environ. Sci. Technol. 43 2009 2047 2053 [33] N. Kruse S. Chenakin Appl. Catal., A: Gen. 391 2011 367 376 [34] E. McCafferty J.P. Wightman Appl. Surf. Sci. 143 1999 92 100 [35] G.M. Veith A.R. Lupini N.J. Dudney J. Phys. Chem. C 113 2008 269 280 [36] T. Yamashita P. Hayes Appl. Surf. Sci. 254 2008 2441 2449 [37] V.S. Kumbhar A.D. Jagadale N.M. Shinde C.D. Lokhande Appl. Surf. Sci. 259 2012 39 43 [38] M. Salavati-Niasari T. Mahmoudi M. Sabet S.M. Hosseinpour-Mashkani F. Soofivand F. Tavakoli J. Cluster Sci. 23 2012 1003 1010 [39] P. Sivakumar R. Ramesh A. Ramanand S. Ponnusamy C. Muthamizhchelvan J. Alloys Compd. 537 2012 203 207 [40] M.C. Dodd D. Rentsch H.P. Singer H.P.E. Kohler U. von Gunten Environ. Sci. Technol. 44 2010 5940 5948 [41] L.A. Perez-Estrada X.M. Han P. Drzewicz M.G. El-Din P.M. Fedorak J.W. Martin Environ. Sci. Technol. 45 2011 7431 7437 [42] A.G. Goncalves J.J.M. Orfao M.F.R. Pereira J. Hazard. Mater. 239 2012 167 174 [43] M.R. Assalin P.L. da Silva N. Duran Quim. Nova 29 2006 24 27 [44] N.A.M. Fadzil Z. Zainal A.H. Abdullah Int. J. Electrochem. Sci. 7 2012 11993 12003 [45] M.J. Farre M.I. Franch S. Malato J.A. Ayllon J. Peral X. Domenech Chemosphere 58 2005 1127 1133 [46] M.H. Khan J.Y. Jung Chemosphere 72 2008 690 696 [47] C.H. Wu C.Y. Kuo C.L. Chang J. Hazard. Mater. 154 2008 748 755 [48] A.O. Yildirim S. Gul O. Eren E. Kusvuran Clean-Soil Air Water 39 2011 795 805 [49] J. Nawrocki B. Kasprzyk-Hordern Appl. Catal., B: Environ. 99 2010 27 42 [50] F. Qi B. Xu Z. Chen J. Ma D. Sun L. Zhang Sep. Purif. Technol. 66 2009 405 410 [51] M.S. Elovitz U. von Gunten Ozone Sci. Eng. 21 1999 239 260 [52] U. von Gunten Water Res. 37 2003 1443 1467 [53] R. Andreozzi V. Caprio R. Marotta D. Vogna Water Res. 37 2003 993 1004 [54] Y.Z. Pi J. Schumacher M. Jekel Water Res. 39 2005 83 88 [55] A. Ikhlaq D.R. Brown B. Kasprzyk-Hordern Appl. Catal., B: Environ. 129 2013 437 449 [56] W. Luo L.H. Zhu N. Wang H.Q. Tang M.J. Cao Y.B. She Environ. Sci. Technol. 44 2010 1786 1791 [57] G. Merenyi J. Lind S. Naumov C. von Sonntag Environ. Sci. Technol. 44 2010 3505 3507 [58] J.P. Pocostales M.M. Sein W. Knolle C. von Sonntag T.C. Schmidt Environ. Sci. Technol. 44 2010 8248 8253 [59] L.J. Xu J.L. Wang Environ. Sci. Technol. 46 2012 10145 10153",
      "scopus-id": "84908406170",
      "coredata": {
        "eid": "1-s2.0-S1381116914004440",
        "dc:description": "In this study, a systematic investigation on the degradation of phenacetin (PNT) by magnetic spinel ferrite (including MnFe2O4 and NiFe2O4) via catalytic ozonation was carried out. The structural and surface property of the catalyst, the performance and mineralization during PNT degradation, and •OH/H2O2 identification were studied. The precursors of the catalyst, i.e. MnFe2(OH)8 and NiFe2(OH)8, showed certain magnetic properties and a superior catalytic activity for ozonation enhancement than spinel ferrites. Spinel ferrites containing manganese initiate an ozone mass transfer into the solution, where the critical intermediate (H2O2) is generated. The manganese ferrite spinel triggers H2O2 decomposition in the presence of ozone and generates •OH for the mineralization of PNT and its intermediates. Spinel ferrites involved nickel catalyzed ozone decomposition and generate H2O2 and •OH. All catalysts showed a weak heavy metal leaching, which suggests that the heterogeneous reaction dominates the catalytic reaction and the resultant effluent is safe for the aqueous environment. The magnetic variation of catalysts involving nickel is insignificant, suggesting that the catalyst can be reused many times. The fate of the intermediates on spinel oxides surface influenced for the catalytic ozonation process differently.",
        "openArchiveArticle": "false",
        "prism:coverDate": "2015-01-31",
        "openaccessUserLicense": null,
        "prism:aggregationType": "Journal",
        "prism:url": "https://api.elsevier.com/content/article/pii/S1381116914004440",
        "dc:creator": [
          {
            "@_fa": "true",
            "$": "Qi, Fei"
          },
          {
            "@_fa": "true",
            "$": "Xu, Bingbing"
          },
          {
            "@_fa": "true",
            "$": "Chu, Wei"
          }
        ],
        "link": [
          {
            "@_fa": "true",
            "@rel": "self",
            "@href": "https://api.elsevier.com/content/article/pii/S1381116914004440"
          },
          {
            "@_fa": "true",
            "@rel": "scidir",
            "@href": "https://www.sciencedirect.com/science/article/pii/S1381116914004440"
          }
        ],
        "dc:format": "application/json",
        "openaccessType": null,
        "pii": "S1381-1169(14)00444-0",
        "prism:volume": "396",
        "prism:publisher": "Elsevier B.V.",
        "dc:title": "Heterogeneous catalytic ozonation of phenacetin in water using magnetic spinel ferrite as catalyst: Comparison of surface property and efficiency",
        "prism:copyright": "Copyright © 2014 Elsevier B.V. All rights reserved.",
        "openaccess": "0",
        "prism:issn": "13811169",
        "dcterms:subject": [
          {
            "@_fa": "true",
            "$": "Hydroxyl radical"
          },
          {
            "@_fa": "true",
            "$": "Magnetic nano-particles"
          },
          {
            "@_fa": "true",
            "$": "Ozonation"
          },
          {
            "@_fa": "true",
            "$": "Peroxide"
          },
          {
            "@_fa": "true",
            "$": "Phenacetin"
          }
        ],
        "openaccessArticle": "false",
        "prism:publicationName": "Journal of Molecular Catalysis A: Chemical",
        "openaccessSponsorType": null,
        "prism:pageRange": "164-173",
        "prism:endingPage": "173",
        "pubType": "fla",
        "prism:coverDisplayDate": "January 2015",
        "prism:doi": "10.1016/j.molcata.2014.10.001",
        "prism:startingPage": "164",
        "dc:identifier": "doi:10.1016/j.molcata.2014.10.001",
        "openaccessSponsorName": null
      },
      "objects": {
        "object": [
          {
            "@category": "thumbnail",
            "@height": "132",
            "@width": "219",
            "@_fa": "true",
            "$": "https://api.elsevier.com/content/object/eid/1-s2.0-S1381116914004440-fx1.sml?httpAccept=%2A%2F%2A",
            "@multimediatype": "GIF image file",
            "@type": "IMAGE-THUMBNAIL",
            "@size": "8576",
            "@ref": "fx1",
            "@mimetype": "image/gif"
          },
          {
            "@category": "thumbnail",
            "@height": "164",
            "@width": "107",
            "@_fa": "true",
            "$": "https://api.elsevier.com/content/object/eid/1-s2.0-S1381116914004440-gr1.sml?httpAccept=%2A%2F%2A",
            "@multimediatype": "GIF image file",
            "@type": "IMAGE-THUMBNAIL",
            "@size": "5404",
            "@ref": "gr1",
            "@mimetype": "image/gif"
          },
          {
            "@category": "thumbnail",
            "@height": "161",
            "@width": "219",
            "@_fa": "true",
            "$": "https://api.elsevier.com/content/object/eid/1-s2.0-S1381116914004440-gr10.sml?httpAccept=%2A%2F%2A",
            "@multimediatype": "GIF image file",
            "@type": "IMAGE-THUMBNAIL",
            "@size": "9868",
            "@ref": "gr10",
            "@mimetype": "image/gif"
          },
          {
            "@category": "thumbnail",
            "@height": "164",
            "@width": "199",
            "@_fa": "true",
            "$": "https://api.elsevier.com/content/object/eid/1-s2.0-S1381116914004440-gr11.sml?httpAccept=%2A%2F%2A",
            "@multimediatype": "GIF image file",
            "@type": "IMAGE-THUMBNAIL",
            "@size": "6785",
            "@ref": "gr11",
            "@mimetype": "image/gif"
          },
          {
            "@category": "thumbnail",
            "@height": "164",
            "@width": "217",
            "@_fa": "true",
            "$": "https://api.elsevier.com/content/object/eid/1-s2.0-S1381116914004440-gr12.sml?httpAccept=%2A%2F%2A",
            "@multimediatype": "GIF image file",
            "@type": "IMAGE-THUMBNAIL",
            "@size": "8581",
            "@ref": "gr12",
            "@mimetype": "image/gif"
          },
          {
            "@category": "thumbnail",
            "@height": "164",
            "@width": "212",
            "@_fa": "true",
            "$": "https://api.elsevier.com/content/object/eid/1-s2.0-S1381116914004440-gr13.sml?httpAccept=%2A%2F%2A",
            "@multimediatype": "GIF image file",
            "@type": "IMAGE-THUMBNAIL",
            "@size": "5886",
            "@ref": "gr13",
            "@mimetype": "image/gif"
          },
          {
            "@category": "thumbnail",
            "@height": "163",
            "@width": "100",
            "@_fa": "true",
            "$": "https://api.elsevier.com/content/object/eid/1-s2.0-S1381116914004440-gr2.sml?httpAccept=%2A%2F%2A",
            "@multimediatype": "GIF image file",
            "@type": "IMAGE-THUMBNAIL",
            "@size": "5199",
            "@ref": "gr2",
            "@mimetype": "image/gif"
          },
          {
            "@category": "thumbnail",
            "@height": "149",
            "@width": "219",
            "@_fa": "true",
            "$": "https://api.elsevier.com/content/object/eid/1-s2.0-S1381116914004440-gr3.sml?httpAccept=%2A%2F%2A",
            "@multimediatype": "GIF image file",
            "@type": "IMAGE-THUMBNAIL",
            "@size": "9286",
            "@ref": "gr3",
            "@mimetype": "image/gif"
          },
          {
            "@category": "thumbnail",
            "@height": "163",
            "@width": "108",
            "@_fa": "true",
            "$": "https://api.elsevier.com/content/object/eid/1-s2.0-S1381116914004440-gr4.sml?httpAccept=%2A%2F%2A",
            "@multimediatype": "GIF image file",
            "@type": "IMAGE-THUMBNAIL",
            "@size": "5226",
            "@ref": "gr4",
            "@mimetype": "image/gif"
          },
          {
            "@category": "thumbnail",
            "@height": "158",
            "@width": "219",
            "@_fa": "true",
            "$": "https://api.elsevier.com/content/object/eid/1-s2.0-S1381116914004440-gr5.sml?httpAccept=%2A%2F%2A",
            "@multimediatype": "GIF image file",
            "@type": "IMAGE-THUMBNAIL",
            "@size": "6524",
            "@ref": "gr5",
            "@mimetype": "image/gif"
          },
          {
            "@category": "thumbnail",
            "@height": "163",
            "@width": "114",
            "@_fa": "true",
            "$": "https://api.elsevier.com/content/object/eid/1-s2.0-S1381116914004440-gr6.sml?httpAccept=%2A%2F%2A",
            "@multimediatype": "GIF image file",
            "@type": "IMAGE-THUMBNAIL",
            "@size": "5082",
            "@ref": "gr6",
            "@mimetype": "image/gif"
          },
          {
            "@category": "thumbnail",
            "@height": "164",
            "@width": "199",
            "@_fa": "true",
            "$": "https://api.elsevier.com/content/object/eid/1-s2.0-S1381116914004440-gr7.sml?httpAccept=%2A%2F%2A",
            "@multimediatype": "GIF image file",
            "@type": "IMAGE-THUMBNAIL",
            "@size": "8056",
            "@ref": "gr7",
            "@mimetype": "image/gif"
          },
          {
            "@category": "thumbnail",
            "@height": "164",
            "@width": "214",
            "@_fa": "true",
            "$": "https://api.elsevier.com/content/object/eid/1-s2.0-S1381116914004440-gr8.sml?httpAccept=%2A%2F%2A",
            "@multimediatype": "GIF image file",
            "@type": "IMAGE-THUMBNAIL",
            "@size": "5922",
            "@ref": "gr8",
            "@mimetype": "image/gif"
          },
          {
            "@category": "thumbnail",
            "@height": "163",
            "@width": "102",
            "@_fa": "true",
            "$": "https://api.elsevier.com/content/object/eid/1-s2.0-S1381116914004440-gr9.sml?httpAccept=%2A%2F%2A",
            "@multimediatype": "GIF image file",
            "@type": "IMAGE-THUMBNAIL",
            "@size": "4078",
            "@ref": "gr9",
            "@mimetype": "image/gif"
          },
          {
            "@category": "standard",
            "@height": "200",
            "@width": "331",
            "@_fa": "true",
            "$": "https://api.elsevier.com/content/object/eid/1-s2.0-S1381116914004440-fx1.jpg?httpAccept=%2A%2F%2A",
            "@multimediatype": "JPEG image file",
            "@type": "IMAGE-DOWNSAMPLED",
            "@size": "19544",
            "@ref": "fx1",
            "@mimetype": "image/jpeg"
          },
          {
            "@category": "standard",
            "@height": "575",
            "@width": "376",
            "@_fa": "true",
            "$": "https://api.elsevier.com/content/object/eid/1-s2.0-S1381116914004440-gr1.jpg?httpAccept=%2A%2F%2A",
            "@multimediatype": "JPEG image file",
            "@type": "IMAGE-DOWNSAMPLED",
            "@size": "48188",
            "@ref": "gr1",
            "@mimetype": "image/jpeg"
          },
          {
            "@category": "standard",
            "@height": "274",
            "@width": "374",
            "@_fa": "true",
            "$": "https://api.elsevier.com/content/object/eid/1-s2.0-S1381116914004440-gr10.jpg?httpAccept=%2A%2F%2A",
            "@multimediatype": "JPEG image file",
            "@type": "IMAGE-DOWNSAMPLED",
            "@size": "31893",
            "@ref": "gr10",
            "@mimetype": "image/jpeg"
          },
          {
            "@category": "standard",
            "@height": "322",
            "@width": "391",
            "@_fa": "true",
            "$": "https://api.elsevier.com/content/object/eid/1-s2.0-S1381116914004440-gr11.jpg?httpAccept=%2A%2F%2A",
            "@multimediatype": "JPEG image file",
            "@type": "IMAGE-DOWNSAMPLED",
            "@size": "26183",
            "@ref": "gr11",
            "@mimetype": "image/jpeg"
          },
          {
            "@category": "standard",
            "@height": "298",
            "@width": "394",
            "@_fa": "true",
            "$": "https://api.elsevier.com/content/object/eid/1-s2.0-S1381116914004440-gr12.jpg?httpAccept=%2A%2F%2A",
            "@multimediatype": "JPEG image file",
            "@type": "IMAGE-DOWNSAMPLED",
            "@size": "31511",
            "@ref": "gr12",
            "@mimetype": "image/jpeg"
          },
          {
            "@category": "standard",
            "@height": "341",
            "@width": "441",
            "@_fa": "true",
            "$": "https://api.elsevier.com/content/object/eid/1-s2.0-S1381116914004440-gr13.jpg?httpAccept=%2A%2F%2A",
            "@multimediatype": "JPEG image file",
            "@type": "IMAGE-DOWNSAMPLED",
            "@size": "28362",
            "@ref": "gr13",
            "@mimetype": "image/jpeg"
          },
          {
            "@category": "standard",
            "@height": "644",
            "@width": "395",
            "@_fa": "true",
            "$": "https://api.elsevier.com/content/object/eid/1-s2.0-S1381116914004440-gr2.jpg?httpAccept=%2A%2F%2A",
            "@multimediatype": "JPEG image file",
            "@type": "IMAGE-DOWNSAMPLED",
            "@size": "54231",
            "@ref": "gr2",
            "@mimetype": "image/jpeg"
          },
          {
            "@category": "standard",
            "@height": "419",
            "@width": "616",
            "@_fa": "true",
            "$": "https://api.elsevier.com/content/object/eid/1-s2.0-S1381116914004440-gr3.jpg?httpAccept=%2A%2F%2A",
            "@multimediatype": "JPEG image file",
            "@type": "IMAGE-DOWNSAMPLED",
            "@size": "58841",
            "@ref": "gr3",
            "@mimetype": "image/jpeg"
          },
          {
            "@category": "standard",
            "@height": "490",
            "@width": "324",
            "@_fa": "true",
            "$": "https://api.elsevier.com/content/object/eid/1-s2.0-S1381116914004440-gr4.jpg?httpAccept=%2A%2F%2A",
            "@multimediatype": "JPEG image file",
            "@type": "IMAGE-DOWNSAMPLED",
            "@size": "41156",
            "@ref": "gr4",
            "@mimetype": "image/jpeg"
          },
          {
            "@category": "standard",
            "@height": "356",
            "@width": "493",
            "@_fa": "true",
            "$": "https://api.elsevier.com/content/object/eid/1-s2.0-S1381116914004440-gr5.jpg?httpAccept=%2A%2F%2A",
            "@multimediatype": "JPEG image file",
            "@type": "IMAGE-DOWNSAMPLED",
            "@size": "32052",
            "@ref": "gr5",
            "@mimetype": "image/jpeg"
          },
          {
            "@category": "standard",
            "@height": "537",
            "@width": "376",
            "@_fa": "true",
            "$": "https://api.elsevier.com/content/object/eid/1-s2.0-S1381116914004440-gr6.jpg?httpAccept=%2A%2F%2A",
            "@multimediatype": "JPEG image file",
            "@type": "IMAGE-DOWNSAMPLED",
            "@size": "43107",
            "@ref": "gr6",
            "@mimetype": "image/jpeg"
          },
          {
            "@category": "standard",
            "@height": "309",
            "@width": "376",
            "@_fa": "true",
            "$": "https://api.elsevier.com/content/object/eid/1-s2.0-S1381116914004440-gr7.jpg?httpAccept=%2A%2F%2A",
            "@multimediatype": "JPEG image file",
            "@type": "IMAGE-DOWNSAMPLED",
            "@size": "29670",
            "@ref": "gr7",
            "@mimetype": "image/jpeg"
          },
          {
            "@category": "standard",
            "@height": "289",
            "@width": "377",
            "@_fa": "true",
            "$": "https://api.elsevier.com/content/object/eid/1-s2.0-S1381116914004440-gr8.jpg?httpAccept=%2A%2F%2A",
            "@multimediatype": "JPEG image file",
            "@type": "IMAGE-DOWNSAMPLED",
            "@size": "20323",
            "@ref": "gr8",
            "@mimetype": "image/jpeg"
          },
          {
            "@category": "standard",
            "@height": "600",
            "@width": "376",
            "@_fa": "true",
            "$": "https://api.elsevier.com/content/object/eid/1-s2.0-S1381116914004440-gr9.jpg?httpAccept=%2A%2F%2A",
            "@multimediatype": "JPEG image file",
            "@type": "IMAGE-DOWNSAMPLED",
            "@size": "38557",
            "@ref": "gr9",
            "@mimetype": "image/jpeg"
          },
          {
            "@category": "high",
            "@height": "886",
            "@width": "1467",
            "@_fa": "true",
            "$": "https://api.elsevier.com/content/object/eid/1-s2.0-S1381116914004440-fx1_lrg.jpg?httpAccept=%2A%2F%2A",
            "@multimediatype": "JPEG image file",
            "@type": "IMAGE-HIGH-RES",
            "@size": "158070",
            "@ref": "fx1",
            "@mimetype": "image/jpeg"
          },
          {
            "@category": "high",
            "@height": "2553",
            "@width": "1668",
            "@_fa": "true",
            "$": "https://api.elsevier.com/content/object/eid/1-s2.0-S1381116914004440-gr1_lrg.jpg?httpAccept=%2A%2F%2A",
            "@multimediatype": "JPEG image file",
            "@type": "IMAGE-HIGH-RES",
            "@size": "400792",
            "@ref": "gr1",
            "@mimetype": "image/jpeg"
          },
          {
            "@category": "high",
            "@height": "1216",
            "@width": "1659",
            "@_fa": "true",
            "$": "https://api.elsevier.com/content/object/eid/1-s2.0-S1381116914004440-gr10_lrg.jpg?httpAccept=%2A%2F%2A",
            "@multimediatype": "JPEG image file",
            "@type": "IMAGE-HIGH-RES",
            "@size": "247233",
            "@ref": "gr10",
            "@mimetype": "image/jpeg"
          },
          {
            "@category": "high",
            "@height": "1429",
            "@width": "1734",
            "@_fa": "true",
            "$": "https://api.elsevier.com/content/object/eid/1-s2.0-S1381116914004440-gr11_lrg.jpg?httpAccept=%2A%2F%2A",
            "@multimediatype": "JPEG image file",
            "@type": "IMAGE-HIGH-RES",
            "@size": "185163",
            "@ref": "gr11",
            "@mimetype": "image/jpeg"
          },
          {
            "@category": "high",
            "@height": "1321",
            "@width": "1746",
            "@_fa": "true",
            "$": "https://api.elsevier.com/content/object/eid/1-s2.0-S1381116914004440-gr12_lrg.jpg?httpAccept=%2A%2F%2A",
            "@multimediatype": "JPEG image file",
            "@type": "IMAGE-HIGH-RES",
            "@size": "233833",
            "@ref": "gr12",
            "@mimetype": "image/jpeg"
          },
          {
            "@category": "high",
            "@height": "1511",
            "@width": "1952",
            "@_fa": "true",
            "$": "https://api.elsevier.com/content/object/eid/1-s2.0-S1381116914004440-gr13_lrg.jpg?httpAccept=%2A%2F%2A",
            "@multimediatype": "JPEG image file",
            "@type": "IMAGE-HIGH-RES",
            "@size": "214844",
            "@ref": "gr13",
            "@mimetype": "image/jpeg"
          },
          {
            "@category": "high",
            "@height": "2854",
            "@width": "1750",
            "@_fa": "true",
            "$": "https://api.elsevier.com/content/object/eid/1-s2.0-S1381116914004440-gr2_lrg.jpg?httpAccept=%2A%2F%2A",
            "@multimediatype": "JPEG image file",
            "@type": "IMAGE-HIGH-RES",
            "@size": "422917",
            "@ref": "gr2",
            "@mimetype": "image/jpeg"
          },
          {
            "@category": "high",
            "@height": "1852",
            "@width": "2726",
            "@_fa": "true",
            "$": "https://api.elsevier.com/content/object/eid/1-s2.0-S1381116914004440-gr3_lrg.jpg?httpAccept=%2A%2F%2A",
            "@multimediatype": "JPEG image file",
            "@type": "IMAGE-HIGH-RES",
            "@size": "450696",
            "@ref": "gr3",
            "@mimetype": "image/jpeg"
          },
          {
            "@category": "high",
            "@height": "2171",
            "@width": "1436",
            "@_fa": "true",
            "$": "https://api.elsevier.com/content/object/eid/1-s2.0-S1381116914004440-gr4_lrg.jpg?httpAccept=%2A%2F%2A",
            "@multimediatype": "JPEG image file",
            "@type": "IMAGE-HIGH-RES",
            "@size": "281172",
            "@ref": "gr4",
            "@mimetype": "image/jpeg"
          },
          {
            "@category": "high",
            "@height": "1576",
            "@width": "2185",
            "@_fa": "true",
            "$": "https://api.elsevier.com/content/object/eid/1-s2.0-S1381116914004440-gr5_lrg.jpg?httpAccept=%2A%2F%2A",
            "@multimediatype": "JPEG image file",
            "@type": "IMAGE-HIGH-RES",
            "@size": "251001",
            "@ref": "gr5",
            "@mimetype": "image/jpeg"
          },
          {
            "@category": "high",
            "@height": "2382",
            "@width": "1667",
            "@_fa": "true",
            "$": "https://api.elsevier.com/content/object/eid/1-s2.0-S1381116914004440-gr6_lrg.jpg?httpAccept=%2A%2F%2A",
            "@multimediatype": "JPEG image file",
            "@type": "IMAGE-HIGH-RES",
            "@size": "337775",
            "@ref": "gr6",
            "@mimetype": "image/jpeg"
          },
          {
            "@category": "high",
            "@height": "1370",
            "@width": "1667",
            "@_fa": "true",
            "$": "https://api.elsevier.com/content/object/eid/1-s2.0-S1381116914004440-gr7_lrg.jpg?httpAccept=%2A%2F%2A",
            "@multimediatype": "JPEG image file",
            "@type": "IMAGE-HIGH-RES",
            "@size": "227411",
            "@ref": "gr7",
            "@mimetype": "image/jpeg"
          },
          {
            "@category": "high",
            "@height": "1279",
            "@width": "1669",
            "@_fa": "true",
            "$": "https://api.elsevier.com/content/object/eid/1-s2.0-S1381116914004440-gr8_lrg.jpg?httpAccept=%2A%2F%2A",
            "@multimediatype": "JPEG image file",
            "@type": "IMAGE-HIGH-RES",
            "@size": "145463",
            "@ref": "gr8",
            "@mimetype": "image/jpeg"
          },
          {
            "@category": "high",
            "@height": "2661",
            "@width": "1667",
            "@_fa": "true",
            "$": "https://api.elsevier.com/content/object/eid/1-s2.0-S1381116914004440-gr9_lrg.jpg?httpAccept=%2A%2F%2A",
            "@multimediatype": "JPEG image file",
            "@type": "IMAGE-HIGH-RES",
            "@size": "291242",
            "@ref": "gr9",
            "@mimetype": "image/jpeg"
          },
          {
            "@category": "thumbnail",
            "@height": "59",
            "@width": "353",
            "@_fa": "true",
            "$": "https://api.elsevier.com/content/object/eid/1-s2.0-S1381116914004440-si1.gif?httpAccept=%2A%2F%2A",
            "@multimediatype": "GIF image file",
            "@type": "ALTIMG",
            "@size": "1876",
            "@ref": "si1",
            "@mimetype": "image/gif"
          },
          {
            "@category": "thumbnail",
            "@height": "32",
            "@width": "353",
            "@_fa": "true",
            "$": "https://api.elsevier.com/content/object/eid/1-s2.0-S1381116914004440-si10.gif?httpAccept=%2A%2F%2A",
            "@multimediatype": "GIF image file",
            "@type": "ALTIMG",
            "@size": "1369",
            "@ref": "si10",
            "@mimetype": "image/gif"
          },
          {
            "@category": "thumbnail",
            "@height": "35",
            "@width": "104",
            "@_fa": "true",
            "$": "https://api.elsevier.com/content/object/eid/1-s2.0-S1381116914004440-si11.gif?httpAccept=%2A%2F%2A",
            "@multimediatype": "GIF image file",
            "@type": "ALTIMG",
            "@size": "580",
            "@ref": "si11",
            "@mimetype": "image/gif"
          },
          {
            "@category": "thumbnail",
            "@height": "87",
            "@width": "360",
            "@_fa": "true",
            "$": "https://api.elsevier.com/content/object/eid/1-s2.0-S1381116914004440-si12.gif?httpAccept=%2A%2F%2A",
            "@multimediatype": "GIF image file",
            "@type": "ALTIMG",
            "@size": "2437",
            "@ref": "si12",
            "@mimetype": "image/gif"
          },
          {
            "@category": "thumbnail",
            "@height": "16",
            "@width": "44",
            "@_fa": "true",
            "$": "https://api.elsevier.com/content/object/eid/1-s2.0-S1381116914004440-si13.gif?httpAccept=%2A%2F%2A",
            "@multimediatype": "GIF image file",
            "@type": "ALTIMG",
            "@size": "255",
            "@ref": "si13",
            "@mimetype": "image/gif"
          },
          {
            "@category": "thumbnail",
            "@height": "30",
            "@width": "239",
            "@_fa": "true",
            "$": "https://api.elsevier.com/content/object/eid/1-s2.0-S1381116914004440-si14.gif?httpAccept=%2A%2F%2A",
            "@multimediatype": "GIF image file",
            "@type": "ALTIMG",
            "@size": "1031",
            "@ref": "si14",
            "@mimetype": "image/gif"
          },
          {
            "@category": "thumbnail",
            "@height": "16",
            "@width": "21",
            "@_fa": "true",
            "$": "https://api.elsevier.com/content/object/eid/1-s2.0-S1381116914004440-si2.gif?httpAccept=%2A%2F%2A",
            "@multimediatype": "GIF image file",
            "@type": "ALTIMG",
            "@size": "169",
            "@ref": "si2",
            "@mimetype": "image/gif"
          },
          {
            "@category": "thumbnail",
            "@height": "14",
            "@width": "29",
            "@_fa": "true",
            "$": "https://api.elsevier.com/content/object/eid/1-s2.0-S1381116914004440-si3.gif?httpAccept=%2A%2F%2A",
            "@multimediatype": "GIF image file",
            "@type": "ALTIMG",
            "@size": "205",
            "@ref": "si3",
            "@mimetype": "image/gif"
          },
          {
            "@category": "thumbnail",
            "@height": "35",
            "@width": "103",
            "@_fa": "true",
            "$": "https://api.elsevier.com/content/object/eid/1-s2.0-S1381116914004440-si4.gif?httpAccept=%2A%2F%2A",
            "@multimediatype": "GIF image file",
            "@type": "ALTIMG",
            "@size": "527",
            "@ref": "si4",
            "@mimetype": "image/gif"
          },
          {
            "@category": "thumbnail",
            "@height": "87",
            "@width": "364",
            "@_fa": "true",
            "$": "https://api.elsevier.com/content/object/eid/1-s2.0-S1381116914004440-si5.gif?httpAccept=%2A%2F%2A",
            "@multimediatype": "GIF image file",
            "@type": "ALTIMG",
            "@size": "2468",
            "@ref": "si5",
            "@mimetype": "image/gif"
          },
          {
            "@category": "thumbnail",
            "@height": "16",
            "@width": "46",
            "@_fa": "true",
            "$": "https://api.elsevier.com/content/object/eid/1-s2.0-S1381116914004440-si6.gif?httpAccept=%2A%2F%2A",
            "@multimediatype": "GIF image file",
            "@type": "ALTIMG",
            "@size": "261",
            "@ref": "si6",
            "@mimetype": "image/gif"
          },
          {
            "@category": "thumbnail",
            "@height": "16",
            "@width": "44",
            "@_fa": "true",
            "$": "https://api.elsevier.com/content/object/eid/1-s2.0-S1381116914004440-si7.gif?httpAccept=%2A%2F%2A",
            "@multimediatype": "GIF image file",
            "@type": "ALTIMG",
            "@size": "244",
            "@ref": "si7",
            "@mimetype": "image/gif"
          },
          {
            "@category": "thumbnail",
            "@height": "32",
            "@width": "111",
            "@_fa": "true",
            "$": "https://api.elsevier.com/content/object/eid/1-s2.0-S1381116914004440-si9.gif?httpAccept=%2A%2F%2A",
            "@multimediatype": "GIF image file",
            "@type": "ALTIMG",
            "@size": "524",
            "@ref": "si9",
            "@mimetype": "image/gif"
          }
        ]
      },
      "link": {
        "@rel": "abstract",
        "@href": "https://api.elsevier.com/content/abstract/scopus_id/84908406170"
      }
    }
  }
}