{
  "metadata": {
    "title": "Reduction of N<ce:inf loc=post>2</ce:inf> by H<ce:inf loc=post>2</ce:inf> to NH<ce:inf loc=post>3</ce:inf> and N<ce:inf loc=post>2</ce:inf>H<ce:inf loc=post>4</ce:inf> using [MoL] (L<ce:hsp sp=0.25></ce:hsp>=<ce:hsp sp=0.25></ce:hsp>triamidoamine) and organic co-catalysts: A theoretical approach",
    "authors": "; ",
    "journal": "Journal of Molecular Catalysis A: Chemical",
    "date": "2013-04-30",
    "doi": "10.1016/j.molcata.2012.12.012",
    "abstract": "",
    "uri": "https://api.elsevier.com/content/article/pii/S1381116912004189",
    "pii": "S1381116912004189"
  },
  "fulltext": {
    "full-text-retrieval-response": {
      "scopus-eid": "2-s2.0-84875137482",
      "originalText": "serial JL 271358 291210 291744 291790 291809 31 Journal of Molecular Catalysis A: Chemical JOURNALMOLECULARCATALYSISACHEMICAL 2013-01-16 2013-01-16 2013-02-26T13:37:50 1-s2.0-S1381116912004189 S1381-1169(12)00418-9 S1381116912004189 10.1016/j.molcata.2012.12.012 S300 S300.1 FULL-TEXT 1-s2.0-S1381116913X00020 2015-05-15T05:56:33.607047-04:00 0 0 20130401 20130430 2013 2013-01-16T00:00:00Z articleinfo crossmark dco dateupdated tomb dateloaded datesearch indexeddate volumelist yearnav absattachment articletitlenorm authfirstinitialnorm authfirstsurnamenorm cid cids contenttype copyright dateloadedtxt docsubtype doctype doi eid ewtransactionid hubeid issn issnnorm itemstage itemtransactionid itemweight openaccess openarchive pg pgfirst pglast pii piinorm pubdateend pubdatestart pubdatetxt pubyr sortorder srctitle srctitlenorm srctype subheadings suppl volfirst volissue webpdf webpdfpagecount figure table e-component body mmlmath acknowledge affil appendices articletitle auth authfirstini authfull authkeywords authlast primabst ref specialabst alllist content subj ssids 1381-1169 13811169 false 370 370 C Volume 370 22 140 144 140 144 201304 April 2013 2013-04-01 2013-04-30 2013 article fla Copyright © 2013 Elsevier B.V. All rights reserved. REDUCTIONN2BYH2NH3N2H4USINGMOLLTRIAMIDOAMINEORGANICCOCATALYSTSATHEORETICALAPPROACH BASKARAN S 1 Introduction 2 Theoretical methods 3 Results and discussion 4 Conclusions Acknowledgements Appendix A Supplementary data References MACKAY 2004 385 402 B HIDAI 1999 99 108 M BAZHENOVA 1995 69 145 T PICKETT 1985 652 653 C KOZAK 2004 1186 1189 C CHATT 1978 589 625 J HIDAI 1995 1115 1133 M LEIGH 1992 177 181 G HENDERSON 1983 197 292 R SCHLOGL 2003 2004 2008 R SMIL 2001 V ENRICHINGEARTH BIELAWA 1999 1061 1063 H NISHIBAYASHI 1998 540 542 Y FRYZUK 1997 1445 1447 M POOL 2004 527 530 J HCLSCHER 2007 6636 6643 M YANDULOV 2003 76 78 D YANDULOV 2002 6252 6253 D YANDULOV 2003 796 813 D YANDULOV 2005 1103 1117 D RITLENG 2004 6150 6163 V WEARE 2006 9185 9196 W WEARE 2006 17099 17106 W SCHROCK 2005 955 962 R SCHROCK 2003 2389 2391 R ARASHIBA 2011 120 125 K STUDT 2005 5639 5642 F REIHER 2005 9640 9642 M KHOROSHUN 2002 523 532 D SCHENK 2008 3634 3650 S MAGISTRATO 2007 1708 1720 A STUDT 2006 1278 1291 F GUENNIC 2005 7448 7460 B CAO 2005 344 353 Z HETTERSCHEID 2009 8569 8577 D HOLSCHER 2006 4407 4417 M BALU 2012 562 565 P BALU 2012 676 681 P BECKE 1988 3098 3100 A BECKE 1993 1372 1377 A BECKE 1993 5648 5652 A DUNNING 1976 T MODERNTHEORETICALCHEMISTRY HAY 1985 270 283 P HAY 1985 299 310 P WADT 1985 284 298 W DITCHFIELD 1971 724 728 R HEHRE 1972 2257 2261 W HARIHARAN 1974 209 214 P GORDON 1980 163 168 M HARIHARAN 1973 213 222 P CUI 1995 12366 12367 Q GUHA 2011 8823 8826 A STEPHAN 2008 644 652 G SIVASANKAR 2005 5393 5406 C CANCES 1997 3032 3041 M COSSI 1998 253 260 M MENNUCCI 1997 5151 5158 B FRISCH 2004 M GAUSSIAN03REVISIONC01 GEIER 2009 3476 3477 S BASKARANX2013X140 BASKARANX2013X140X144 BASKARANX2013X140XS BASKARANX2013X140X144XS item S1381-1169(12)00418-9 S1381116912004189 1-s2.0-S1381116912004189 10.1016/j.molcata.2012.12.012 271358 2013-02-26T09:39:39.882055-05:00 2013-04-01 2013-04-30 1-s2.0-S1381116912004189-main.pdf https://s3.amazonaws.com/prod-ucs-content-store-us-east/content/pii:S1381116912004189/MAIN/application/pdf/8f220add5ee18812e19ae350707d4f74/main.pdf https://s3-eu-west-1.amazonaws.com/prod-ucs-content-store-eu-west/content/pii:S1381116912004189/MAIN/application/pdf/8f220add5ee18812e19ae350707d4f74/main.pdf main.pdf pdf true 609571 MAIN 5 1-s2.0-S1381116912004189-main_1.png https://s3-eu-west-1.amazonaws.com/prod-ucs-content-store-eu-west/content/pii:S1381116912004189/PREVIEW/image/png/16c95064468e5be53601942efa2768cd/main_1.png https://s3.amazonaws.com/prod-ucs-content-store-us-east/content/pii:S1381116912004189/PREVIEW/image/png/16c95064468e5be53601942efa2768cd/main_1.png main_1.png png 43237 849 656 IMAGE-WEB-PDF 1 1-s2.0-S1381116912004189-si3.gif https://s3-eu-west-1.amazonaws.com/prod-ucs-content-store-eu-west/content/pii:S1381116912004189/STRIPIN/image/gif/5f9f5c98171cf6312297bb3d89a8c1de/si3.gif https://s3.amazonaws.com/prod-ucs-content-store-us-east/content/pii:S1381116912004189/STRIPIN/image/gif/5f9f5c98171cf6312297bb3d89a8c1de/si3.gif si3 si3.gif gif 2263 63 334 ALTIMG 1-s2.0-S1381116912004189-si2.gif https://s3-eu-west-1.amazonaws.com/prod-ucs-content-store-eu-west/content/pii:S1381116912004189/STRIPIN/image/gif/9ac88478eaf6499fe87b624672dc7c35/si2.gif https://s3.amazonaws.com/prod-ucs-content-store-us-east/content/pii:S1381116912004189/STRIPIN/image/gif/9ac88478eaf6499fe87b624672dc7c35/si2.gif si2 si2.gif gif 2179 37 481 ALTIMG 1-s2.0-S1381116912004189-si1.gif https://s3-eu-west-1.amazonaws.com/prod-ucs-content-store-eu-west/content/pii:S1381116912004189/STRIPIN/image/gif/96e66669159862d1f8e20f88797572fc/si1.gif https://s3.amazonaws.com/prod-ucs-content-store-us-east/content/pii:S1381116912004189/STRIPIN/image/gif/96e66669159862d1f8e20f88797572fc/si1.gif si1 si1.gif gif 1748 30 455 ALTIMG 1-s2.0-S1381116912004189-gr3_lrg.jpg https://s3.amazonaws.com/prod-ucs-content-store-us-east/content/pii:S1381116912004189/gr3/HIGHRES/image/jpeg/09301f084ceb2ef487cdb049d1e19eda/gr3_lrg.jpg https://s3-eu-west-1.amazonaws.com/prod-ucs-content-store-eu-west/content/pii:S1381116912004189/gr3/HIGHRES/image/jpeg/09301f084ceb2ef487cdb049d1e19eda/gr3_lrg.jpg gr3 gr3_lrg.jpg jpg 308859 1530 2160 IMAGE-HIGH-RES 1-s2.0-S1381116912004189-gr2_lrg.jpg https://s3.amazonaws.com/prod-ucs-content-store-us-east/content/pii:S1381116912004189/gr2/HIGHRES/image/jpeg/b79ac4c93dac88a3b211f57401de1b27/gr2_lrg.jpg https://s3-eu-west-1.amazonaws.com/prod-ucs-content-store-eu-west/content/pii:S1381116912004189/gr2/HIGHRES/image/jpeg/b79ac4c93dac88a3b211f57401de1b27/gr2_lrg.jpg gr2 gr2_lrg.jpg jpg 221404 906 2083 IMAGE-HIGH-RES 1-s2.0-S1381116912004189-gr1_lrg.jpg https://s3.amazonaws.com/prod-ucs-content-store-us-east/content/pii:S1381116912004189/gr1/HIGHRES/image/jpeg/2694e3eb9a60fc3c65778b266b60473e/gr1_lrg.jpg https://s3-eu-west-1.amazonaws.com/prod-ucs-content-store-eu-west/content/pii:S1381116912004189/gr1/HIGHRES/image/jpeg/2694e3eb9a60fc3c65778b266b60473e/gr1_lrg.jpg gr1 gr1_lrg.jpg jpg 310130 1369 2160 IMAGE-HIGH-RES 1-s2.0-S1381116912004189-fx3_lrg.jpg https://s3.amazonaws.com/prod-ucs-content-store-us-east/content/pii:S1381116912004189/fx3/HIGHRES/image/jpeg/6d7e7ed0620fb71e4c6cde7ab55366d7/fx3_lrg.jpg https://s3-eu-west-1.amazonaws.com/prod-ucs-content-store-eu-west/content/pii:S1381116912004189/fx3/HIGHRES/image/jpeg/6d7e7ed0620fb71e4c6cde7ab55366d7/fx3_lrg.jpg fx3 fx3_lrg.jpg jpg 87880 598 1641 IMAGE-HIGH-RES 1-s2.0-S1381116912004189-fx2_lrg.jpg https://s3.amazonaws.com/prod-ucs-content-store-us-east/content/pii:S1381116912004189/fx2/HIGHRES/image/jpeg/98837fad529e9539bd8fdae157f14429/fx2_lrg.jpg https://s3-eu-west-1.amazonaws.com/prod-ucs-content-store-eu-west/content/pii:S1381116912004189/fx2/HIGHRES/image/jpeg/98837fad529e9539bd8fdae157f14429/fx2_lrg.jpg fx2 fx2_lrg.jpg jpg 81969 259 2070 IMAGE-HIGH-RES 1-s2.0-S1381116912004189-fx1_lrg.jpg https://s3.amazonaws.com/prod-ucs-content-store-us-east/content/pii:S1381116912004189/fx1/HIGHRES/image/jpeg/06b62dbf4f25bb990b8de4ae8a71efe4/fx1_lrg.jpg https://s3-eu-west-1.amazonaws.com/prod-ucs-content-store-eu-west/content/pii:S1381116912004189/fx1/HIGHRES/image/jpeg/06b62dbf4f25bb990b8de4ae8a71efe4/fx1_lrg.jpg fx1 true fx1_lrg.jpg jpg 140675 886 2073 IMAGE-HIGH-RES 1-s2.0-S1381116912004189-sc1_lrg.jpg https://s3.amazonaws.com/prod-ucs-content-store-us-east/content/pii:S1381116912004189/sc1/HIGHRES/image/jpeg/67ee61d010295091e14af7981e8cb6af/sc1_lrg.jpg https://s3-eu-west-1.amazonaws.com/prod-ucs-content-store-eu-west/content/pii:S1381116912004189/sc1/HIGHRES/image/jpeg/67ee61d010295091e14af7981e8cb6af/sc1_lrg.jpg sc1 sc1_lrg.jpg jpg 70230 657 1583 IMAGE-HIGH-RES 1-s2.0-S1381116912004189-gr3.jpg https://s3.amazonaws.com/prod-ucs-content-store-us-east/content/pii:S1381116912004189/gr3/DOWNSAMPLED/image/jpeg/c95f09a4e2662e5ef249542c995fabc3/gr3.jpg https://s3-eu-west-1.amazonaws.com/prod-ucs-content-store-eu-west/content/pii:S1381116912004189/gr3/DOWNSAMPLED/image/jpeg/c95f09a4e2662e5ef249542c995fabc3/gr3.jpg gr3 gr3.jpg jpg 44180 346 488 IMAGE-DOWNSAMPLED 1-s2.0-S1381116912004189-gr2.jpg https://s3.amazonaws.com/prod-ucs-content-store-us-east/content/pii:S1381116912004189/gr2/DOWNSAMPLED/image/jpeg/c88c1f207fe810bdada349c4fa8303e4/gr2.jpg https://s3-eu-west-1.amazonaws.com/prod-ucs-content-store-eu-west/content/pii:S1381116912004189/gr2/DOWNSAMPLED/image/jpeg/c88c1f207fe810bdada349c4fa8303e4/gr2.jpg gr2 gr2.jpg jpg 32014 204 470 IMAGE-DOWNSAMPLED 1-s2.0-S1381116912004189-gr1.jpg https://s3.amazonaws.com/prod-ucs-content-store-us-east/content/pii:S1381116912004189/gr1/DOWNSAMPLED/image/jpeg/b123d42481d75a50792b455c4faffc24/gr1.jpg https://s3-eu-west-1.amazonaws.com/prod-ucs-content-store-eu-west/content/pii:S1381116912004189/gr1/DOWNSAMPLED/image/jpeg/b123d42481d75a50792b455c4faffc24/gr1.jpg gr1 gr1.jpg jpg 45885 309 488 IMAGE-DOWNSAMPLED 1-s2.0-S1381116912004189-fx3.jpg https://s3.amazonaws.com/prod-ucs-content-store-us-east/content/pii:S1381116912004189/fx3/DOWNSAMPLED/image/jpeg/ace72059d3da63f253f483e787799734/fx3.jpg https://s3-eu-west-1.amazonaws.com/prod-ucs-content-store-eu-west/content/pii:S1381116912004189/fx3/DOWNSAMPLED/image/jpeg/ace72059d3da63f253f483e787799734/fx3.jpg fx3 fx3.jpg jpg 10580 135 370 IMAGE-DOWNSAMPLED 1-s2.0-S1381116912004189-fx2.jpg https://s3.amazonaws.com/prod-ucs-content-store-us-east/content/pii:S1381116912004189/fx2/DOWNSAMPLED/image/jpeg/a5281250ef34f0a71664bbed92787ac3/fx2.jpg https://s3-eu-west-1.amazonaws.com/prod-ucs-content-store-eu-west/content/pii:S1381116912004189/fx2/DOWNSAMPLED/image/jpeg/a5281250ef34f0a71664bbed92787ac3/fx2.jpg fx2 fx2.jpg jpg 8961 58 467 IMAGE-DOWNSAMPLED 1-s2.0-S1381116912004189-fx1.jpg https://s3.amazonaws.com/prod-ucs-content-store-us-east/content/pii:S1381116912004189/fx1/DOWNSAMPLED/image/jpeg/fc233a1bec5ba6a97ff2bfc3f44dfcc5/fx1.jpg https://s3-eu-west-1.amazonaws.com/prod-ucs-content-store-eu-west/content/pii:S1381116912004189/fx1/DOWNSAMPLED/image/jpeg/fc233a1bec5ba6a97ff2bfc3f44dfcc5/fx1.jpg fx1 true fx1.jpg jpg 17516 200 468 IMAGE-DOWNSAMPLED 1-s2.0-S1381116912004189-sc1.jpg https://s3.amazonaws.com/prod-ucs-content-store-us-east/content/pii:S1381116912004189/sc1/DOWNSAMPLED/image/jpeg/fcddca584dd60a1a2022431f8f704480/sc1.jpg https://s3-eu-west-1.amazonaws.com/prod-ucs-content-store-eu-west/content/pii:S1381116912004189/sc1/DOWNSAMPLED/image/jpeg/fcddca584dd60a1a2022431f8f704480/sc1.jpg sc1 sc1.jpg jpg 8412 148 357 IMAGE-DOWNSAMPLED 1-s2.0-S1381116912004189-gr3.sml https://s3.amazonaws.com/prod-ucs-content-store-us-east/content/pii:S1381116912004189/gr3/THUMBNAIL/image/gif/73adcd8a0285fbcd59f6dc2e7db74cf1/gr3.sml https://s3-eu-west-1.amazonaws.com/prod-ucs-content-store-eu-west/content/pii:S1381116912004189/gr3/THUMBNAIL/image/gif/73adcd8a0285fbcd59f6dc2e7db74cf1/gr3.sml gr3 gr3.sml sml 6132 155 219 IMAGE-THUMBNAIL 1-s2.0-S1381116912004189-gr2.sml https://s3.amazonaws.com/prod-ucs-content-store-us-east/content/pii:S1381116912004189/gr2/THUMBNAIL/image/gif/f92f7f825390ceac8b128b925addd804/gr2.sml https://s3-eu-west-1.amazonaws.com/prod-ucs-content-store-eu-west/content/pii:S1381116912004189/gr2/THUMBNAIL/image/gif/f92f7f825390ceac8b128b925addd804/gr2.sml gr2 gr2.sml sml 5316 95 219 IMAGE-THUMBNAIL 1-s2.0-S1381116912004189-gr1.sml https://s3.amazonaws.com/prod-ucs-content-store-us-east/content/pii:S1381116912004189/gr1/THUMBNAIL/image/gif/b43e41d936ea50f02201977d840931ec/gr1.sml https://s3-eu-west-1.amazonaws.com/prod-ucs-content-store-eu-west/content/pii:S1381116912004189/gr1/THUMBNAIL/image/gif/b43e41d936ea50f02201977d840931ec/gr1.sml gr1 gr1.sml sml 6091 139 219 IMAGE-THUMBNAIL 1-s2.0-S1381116912004189-fx3.sml https://s3.amazonaws.com/prod-ucs-content-store-us-east/content/pii:S1381116912004189/fx3/THUMBNAIL/image/gif/75ead5757a219aaa2ca6a27867a40483/fx3.sml https://s3-eu-west-1.amazonaws.com/prod-ucs-content-store-eu-west/content/pii:S1381116912004189/fx3/THUMBNAIL/image/gif/75ead5757a219aaa2ca6a27867a40483/fx3.sml fx3 fx3.sml sml 2977 80 219 IMAGE-THUMBNAIL 1-s2.0-S1381116912004189-fx2.sml https://s3.amazonaws.com/prod-ucs-content-store-us-east/content/pii:S1381116912004189/fx2/THUMBNAIL/image/gif/7fcb57e0107e461c92b14ce092d97538/fx2.sml https://s3-eu-west-1.amazonaws.com/prod-ucs-content-store-eu-west/content/pii:S1381116912004189/fx2/THUMBNAIL/image/gif/7fcb57e0107e461c92b14ce092d97538/fx2.sml fx2 fx2.sml sml 2002 27 219 IMAGE-THUMBNAIL 1-s2.0-S1381116912004189-fx1.sml https://s3.amazonaws.com/prod-ucs-content-store-us-east/content/pii:S1381116912004189/fx1/THUMBNAIL/image/gif/b97914a874c92762521443f369298a73/fx1.sml https://s3-eu-west-1.amazonaws.com/prod-ucs-content-store-eu-west/content/pii:S1381116912004189/fx1/THUMBNAIL/image/gif/b97914a874c92762521443f369298a73/fx1.sml fx1 true fx1.sml sml 3513 94 219 IMAGE-THUMBNAIL 1-s2.0-S1381116912004189-sc1.sml https://s3.amazonaws.com/prod-ucs-content-store-us-east/content/pii:S1381116912004189/sc1/THUMBNAIL/image/gif/347743a34b04d079e920d849f4b78990/sc1.sml https://s3-eu-west-1.amazonaws.com/prod-ucs-content-store-eu-west/content/pii:S1381116912004189/sc1/THUMBNAIL/image/gif/347743a34b04d079e920d849f4b78990/sc1.sml sc1 sc1.sml sml 2681 91 219 IMAGE-THUMBNAIL 1-s2.0-S1381116912004189-mmc1.doc https://s3.amazonaws.com/prod-ucs-content-store-us-east/content/pii:S1381116912004189/mmc1/MAIN/application/msword/c4208fdd3423d53a8ed7ef0202c7e63d/mmc1.doc https://s3-eu-west-1.amazonaws.com/prod-ucs-content-store-eu-west/content/pii:S1381116912004189/mmc1/MAIN/application/msword/c4208fdd3423d53a8ed7ef0202c7e63d/mmc1.doc mmc1 mmc1.doc doc 24935936 APPLICATION MOLCAA 8619 S1381-1169(12)00418-9 10.1016/j.molcata.2012.12.012 Elsevier B.V. Fig. 1 The proposed catalytic cycle (top right) and energy profile for the production of N2 to NH3 in the Mo(N3N). Fig. 2 Optimized structures of hydride complexes 4, 7 and 10. Fig. 3 The proposed catalytic cycle (down left) and free energy profile for the production of N2 to N2H4 in the Mo(N3N). Scheme 1 Proposed catalytic cycle for the functionaliztion of N2 using H2 (Lut=2, 6-Me2C5H3N, [Mo]=N3N). Table 1 Comparison of energetic with previous reported results. Research groups Method used N2 binding NH3 removal Tuczek et al. [27] B3LYP/LANL2DZ −14.2 +8.8 Present work B3LYP/6-31G*/LANL2DZ −15.97 +8.15 Phukan et al. [52] PBE1PBE/SDD −28.2 +6.6 Table 2 Optimized bond lengths and bond angles of complexes 1–11, 4a–7a, TSI-III, TS-Ia and TS-IIa. S. No. Systems Bond lengths (Å) Bond angles (°) Vibrational frequencies (cm−1) MoNα Nα Nβ MoH MoNα Nβ υNα Nβ υMoNα υMoH 1 [Mo] (1) – – – – – – – 2 [Mo]-N2 (2) 2.018 1.134 – 178.75 2136 395 – 3 [Mo]-NNH+ (3) 1.866 1.216 – 168.95 1626 572 – 4 H-[Mo]-NNH (4) 1.834 1.237 1.755 175.89 1593 549 1659 5 H-[Mo]-NNH (TS-I) 1.922 1.294 1.888 108.78 1189 518 −1232 6 [Mo]-NNH2 (5) 1.848 1.344 – 136.94 1215 623 – 7 [Mo]-NNH3 + (6) 1.861 1.475 – 117.98 842 654 – 8 H-[Mo]-N (7) 1.670 – 1.862 – – 1096 1314 9 H-[Mo]-N (TS-II) 1.700 – 1.961 – – 1085 −726 10 [Mo]-NH (8) 1.802 – – – – 872 – 11 [Mo]-NH2 + (9) 1.942 – – – – 701 – 12 H-[Mo]-NH2 (10) 2.023 – 1.699 – – 642 1832 13 H-[Mo]-NH2 (TS-III) 2.197 – 1.748 – – 395 −1137 14 [Mo]-NH3 (11) 2.322 – – – – 356 – 15 H-[Mo]-NNH (TS-Ia) 1.880 1.243 1.880 167.31 1633 687 −998 16 [Mo]-NHNH (4a) 2.024 1.305 – 134.02 1302 510 – 17 [Mo]-NHNH2 + (5a) 1.957 1.383 – 129.61 1197 583 – 18 H-[Mo]-NHNH2 (6a) 2.023 1.438 1.703 133.30 989 497 1825 19 H-[Mo]-NHNH2 (TS-IIa) 2.173 1.431 1.741 136.72 957 257 −1142 20 [Mo]-NH2NH2 (7a) 2.255 1.494 – 118.69 870 371 – Reduction of N2 by H2 to NH3 and N2H4 using [MoL] (L=triamidoamine) and organic co-catalysts: A theoretical approach Sambath Baskaran Chinnappan Sivasankar ⁎ Department of Chemistry, Pondicherry University (Central University), R. V. Nagar, Puducherry 605 014, India ⁎ Corresponding author. Tel.: +91 413 2654709; fax: +91 413 2655987. Graphical abstract A new strategy has been proposed and tested by DFT calculations for the reduction of N2 to NH3 and N2H4 by H2 under normal experimental condition using [N2-Mo{(NHCH2CH2)3N}] catalyst. The calculated reaction Gibbs free energy profile indicates that the proposed methodology is viable. The direct contact of H2 with Schrock catalyst can be avoided by using organic co-catalysts to prevent the competition in binding between N2 and H2. Highlights ► A new strategy has been proposed for the reduction of N2 to NH3 and N2H4 by H2. ► The calculated free energies show that the formation NH3 is more viable than the N2H4. ► Formation of six coordinate [Mo]-H intermediates have also been predicted. ► The direct contact of H2 with [N2-Mo{(NHCH2CH2)3N}] catalyst can be avoided. A new methodology is proposed and tested by Density Functional Theory (DFT) calculations to reduce N2 to NH3 and N2H4 using H2 in the presence of [Mo{(NHCH2CH2)3N}] and organic co-catalysts under mild experimental conditions. The calculated Gibbs free energies of the fundamental reactions to form various intermediates and transition state molecules suggest that the proposed catalytic cycle is viable to produce NH3 and N2H4, however NH3 formation is more feasible than N2H4. Formation of six coordinate [Mo]-H intermediates have also been predicted. The direct contact of H2 with [N2-Mo{(NHCH2CH2)3N}] catalyst can be avoided by using organic co-catalysts to prevent the competition in binding between N2 and H2 with [Mo{(NHCH2CH2)3N}] catalyst. Keywords Nitrogen fixation Reaction mechanism Homogeneous catalysis Density functional calculations Molybdenum 1 Introduction Formation of NH bond to yield ammonia from N2 and H2 at low temperature and normal pressure is a long time challenging mission for chemists [1–9]. Although Haber-Bosch technology produces more than 100 million tons of ammonia annually for various applications [10,11], this process requires high energy input and drastic experimental conditions which are great issues as per the consternation of energy saving [12]. Due to this reason, there is an urgency to discover a new viable homogeneous catalyst which can operate under mild experimental condition to produce ammonia from N2 and H2. In this regard, Hidai et al. reported a reaction of Chatt complex (cis-[W(N2)2(PMe2Ph)4]) with trans-[RuCl(η2-H2)-(dppp)2]X (X=PF6, BF4, OTf, BPh4) to generate ammonia and uncharacterized tungsten species under normal (1) (2) { [ P 2 N 2 ] Zr } 2 ( μ - η 2 - N 2 ) ⟶ Toluene H 2 { [ P 2 N 2 ] Zr } 2 ( μ - η 2 - N 2 H ) ( μ - H ) (3) [ ( η 5 - C 5 Me 4 H ) 2 Zr ] 2 ( μ 2 , η 2 , η 2 - N 2 ) ⟶ 85 ° C H 2 ( η 5 - C 5 Me 4 H ) 2 ZrH 2 + NH 3 ( 10 − 15 % ) (4) (5) ( [ Mo ( N 2 ) 2 ( PNP ) ] 2 ( μ − N 2 ) ) + 6 CoCp 2 + 6 LutH + ⟶ rt , 20 h Toluene 2 NH 3 ( 49 % ) + H 2 ( 37 % ) experimental conditions (Eq. (1)), in this reaction, Hidai and co-workers could utilize only H+ from H2 [13]. Fryzuk et al. reported a room temperature reaction of [[P2N2][Zr]2(μ-η2-N2)] (P2N2 =PhP(CH2SiMe2NSiMe2CH2)2PPh) with dihydrogen to form [[P2N2][Zr]2(μ-η2-N2H)(μ-H)] over the period of one week (Eq. (2)) [14]. Although there is no ammonia production in Fryzuk et al. report, this reaction is an important one due to the formation of new N-H bond by the direct addition of H2. Chirik et al. reported a direct reaction of [[(η5-C5Me4H)2Zr]2(μ2,η2,η2-N2)] with dihydrogen to produce ammonia (yield 10–15% with respect to the concentration of dinitrogen complex) at 85°C (Eq. (3)) [15]. Leitner et al. attempted theoretically to use H2 to reduce the N2 to yield ammonia using [M(H)2(H2)(PXP)] (MFe, Ru, Os; XN, O, S) and found more thermodynamic barriers for most of the fundamental steps in their proposed catalytic cycle [16]. However, no reports available till date for the catalytic generation of ammonia from the reaction of N2 with H2 under mild experimental conditions using homogeneous catalyst. On the other hand, Schrock et al. (Eq. (4)) [17–25] and Nishibayashi et al. (Eq. (5)) [26] have reported Mo complexes to produce ammonia catalytically (TON=4) by the addition of proton and electron source under mild experimental condition. Several theoretical calculations have been reported concerning the preeminence of [N2-Mo{(N(HIPT)CH2CH2)3N}] (HIPT=hexaisopropylterphenyl-triamidoamine) catalyst [27–34]. Nevertheless, the catalytic efficiency of [N2-Mo{(N(HIPT)CH2CH2)3N}] catalyst was observed to be lowered by the addition of H2 directly to the reaction medium [35]. Leitner et al. theoretically attempted to use H2 directly to reduce the coordinated N2 in Schrock model complex and found more barriers for their approach [36]. Herein we report our new strategy to utilize the dihydrogen along with [N2-Mo{(NHCH2CH2)3N}] catalyst to produce ammonia and hydrazine under normal experimental conditions. Already we have tested this methodology for Chatt type complexes [37,38]. Furthermore this new methodology requires less energy input than calculated in the previous report [27]. 2 Theoretical methods The model systems 1–11, 4a-7a, TS-I, TS-II, TS-III, TS-Ia, TS-IIa, Lut, LutH+, [B(C6F5)3], [HB(C6F5)3]−, N2, N2H4 and NH3, have been fully optimized using the B3LYP method [39–41]. The valence orbital and ECP of molybdenum were described using the LANL2DZ basis set [42–45], nonmetal centers were described using the 6-31G* basis set [46–50]. As reported previously, the B3LYP combination with LANL2DZ basis set can be used to describe transition metals and nonmetal centers to produce more reliable results [51]. However, we also tested this method by computing previously reported data by Tuczek et al. for the similar type of calculations and found similar barriers (Table 1 ). We have modeled the [N2-Mo{(N(HIPT)CH2CH2)3N}] catalyst by hydrogens in the place of bulky HIPT (hexaisopropylterphenyl-triamidoamine) substituent in order to reduce the computational time. It has been observed previously that the replacement of bulky HIPT substituent by hydrogen does not change the reaction pattern and also observed similar results for the Chatt type complexes when phenyl rings were replaced with hydrogens [27,52–54]. Vibrational frequency calculations were performed on these optimized structures to confirm minimum energy geometries by observing all positive frequencies, except for the transition state structures (TS) and obtained the zero point energy (ZPE), and thermal correction. A solvent correction (for heptane) was performed using the polarized continuum model (PCM) [55–57]. We have optimized all the model systems with two different spin states (doublet and quartet), however we found that thermodynamically systems with doublet spin state is more stable than the quartet except model system 1 (Tables S1 and S2). We have constructed energy profiles based on the energies obtained from the fully optimized geometries only (using B3LYP/6-31G*/LANL2DZ) and not done any single point energy calculation. We have also constructed energy profiles using the energy of quartet spin state of model system 1 and the overall barriers are found to be comparable with the energy profiles constructed using the energy of model system 1 with doublet spin state (compare Figs. 1 and 2 with Figs. S1 and S2). All these computations were carried out using the Gaussian 03 program [58]. 3 Results and discussion Our proposed catalytic design and computed energy level diagram are given in the Scheme 1 and Fig. 1 respectively. DFT calculations have been carried out on complexes 1–11, 4a–7a (energies and selected geometrical parameters are given in Tables 2 and S1 see Supporting Info.) and transition state structures (TS-I, TS-II, TS-III, TS-Ia and TS-IIa). Reaction of B(C6F5)3 and Lut (Lut=2,6-Me2C5H3N) with H2 at room temperature and normal pressure is known to yield [(C6F5)3BH]− and [LutH]+ as a complex in toluene [59]. In our proposed catalytic design, we used [(C6F5)3BH]− and [LutH]+ to donate protons and hydrides to the [N2-Mo{(NHCH2CH2)3N}] catalyst to produce ammonia and hydrazine. Reaction of complex 1 ([Mo] ([Mo]=[Mo(N3N)])) with dinitrogen to yield complex 2 ([Mo]-N2]) is calculated to be exergonic by 15.97kcalmol−1, which indicates that the complex 2 ([Mo]-N2) is thermally stable toward the loss of N2. Addition of [LutH]+ to the complex 2 ([Mo]-N2]) to yield complex 3 ([[Mo]-NNH]+) is slightly endergonic by 9.95kcalmol−1 and this can be attributed to the moderate activation of coordinated N2. Addition of [(C6F5)3BH]− to the complex 3 ([[Mo]-NNH]+) to produce six coordinate complex 4 ([H-[Mo]-NNH]) is calculated to be endergonic by 1.64kcalmol−1 in which new [Mo]-H bond is formed (Fig. 2). The formation of TS-I from complex 4 ([H-[Mo]-NNH]) for the hydrogen migration from Mo center to Nβ is endergonic by 21.58kcalmol−1 and this can be achieved under normal experimental conditions. However, the overall barrier to reach TS-1 from complex 3 ([[Mo]-NNH]+) is endergonic by 23.6kcalmol−1 and this would be a rate determining step for the overall processes. Since the overall barrier is also less than 25kcalmol−1, TS-1 can be reached thermodynamically. The formation of complex 5 ([[Mo]-NNH2]) from TS-I is calculated to be highly exergonic by 45.94kcalmol−1 due to the strong affinity of Nβ toward proton (Fig. 1). Addition of [LutH]+ to complex 5 ([[Mo]-NNH2]) to yield complex 6 ([[Mo]-NNH3]+) is calculated to be endergonic by 4.17kcalmol−1. In complex 6 ([[Mo]-NNH3]+), although the Nβ is converted to NH3, the NN bond cleavage is not observed (Fig. 1). Reaction of [(C6F5)3BH]− with complex 6 ([Mo]-NNH3]+) to yield molybdenum–hydride complex 7 ([H-[Mo]-N]) (Fig. 2) and one equivalent of NH3 via N-N bond cleavage is calculated to be strongly exergonic by 40.59kcalmol−1 (Fig. 1). The hydrogen migration from Mo center to the nitride in complex 7 ([H-[Mo]-N]) to form TS-II is endergonic by 4.41kcalmol−1 only (Fig. 1). And the formation of complex 8 ([[Mo]-NH]) from TS-II is calculated to be exergonic by 29.80kcalmol−1 because of the formation of N-H bond of the electron rich nitride. Protonation of complex 8 ([[Mo]-NH]) by the addition of [LutH]+ to yield complex 9 ([[Mo]-NH2]+) is further found to be exergonic by 26.59kcalmol−1. Reaction of complex 9 ([[Mo]-NH2]+) with [(C6F5)3BH]− to generate molybdenum–hydride complex 10 ([H-[Mo]-NH2]) (Fig. 2) is thermodynamically feasible (exergonic) by 6.71kcalmol−1 and the formation of TS-III for the migration of hydrogen from Mo center to the NH2 is endergonic by 15.61kcalmol−1 (Fig. 1). The complete hydrogen transfer from TS-III to form complex 11 ([[Mo]-NH3]) is calculated to be exergonic by 16.01kcalmol−1. Finally, the loss of ammonia from complex 11 ([[Mo]-NH3]) to regenerate complex 1 ([Mo]) to complete one turnover is calculated to be slightly endergonic by 8.15kcalmol−1, which is similar to the previously reported barrier by Tuczek et al. for the same reaction [27]. In order to understand the preference of binding of N2 over H2 and H− with proposed Mo catalyst the following reactions have been computed (Eqs. (6)–(10)). The dinitrogen binding is relatively more exergonic than H2 binding with Mo center (Eqs. (6)–(8)); however H2 binding may interfere in the reaction and this can be minimized by keeping H2 in the form of salt as we described in Scheme 1. The hydride binding with Mo center is found to be more endergonic (Eq. (9) and (10)) and therefore hydride binding may not be feasible when compared to dinitrogen binding. (6) [Mo]+N2 →[Mo]-N2, ΔG o =−15.97kcalmol−1 (7) [Mo]+H2 →[Mo]-H2, ΔG o =−9.30kcalmol−1 (8) [Mo]-N2 +H2 →[Mo]-H2 +N2, ΔG o =6.68kcalmol−1 (9) [Mo]+BH− →[Mo]-H− +B, ΔG o =31.39kcalmol−1 (10) [Mo]-N2 +BH− →[Mo]-H− +N2 +B, ΔG o =47.37kcalmol−1 [Mo]=[Mo{(NHCH2CH2)3N}], BH− =[BH(C6F5)3]−, B=[B(C6F5)3] We also have examined the formation of hydrazine (Fig. 3 ). The formation of TS-Ia (Fig. 3) from complex 4 ([H-[Mo]-NNH]) for the hydrogen migration from Mo center to Nα is endergonic by 8.67kcalmol−1. The formation of complex 4a ([[Mo]-NHNH]) from TS-Ia is calculated to be highly exergonic by 22.55kcalmol−1. Protonation of complex 4a ([[Mo]-NHNH]) on Nβ by [LutH]+ to yield complex 5a ([[Mo]-NHNH2]+) is highly exergonic by 38.42kcalmol−1. Addition of [(C6F5)3BH]− to the complex 5a ([[Mo]-NHNH2]+) to generate molybdenum hydride complex 6a ([H-[Mo]-NHNH2]) (Fig. 3) is calculated to be endergonic by 14.30kcalmol−1. The formation TS-IIa (Fig. 3) from complex 6 ([H-[Mo]-NHNH2]) by migration of hydrogen from Mo center to the Nα is endergonic by 15.34kcalmol−1. The complete hydrogen transfer from TS-IIa to form molybdenum–hydrazine complex 7a ([[Mo]-NH2NH2]) is calculated to be exergonic by 15.29kcalmol−1. Finally, the loss of hydrazine from complex 7a ([[Mo]-NH2NH2]) to regenerate complex 1 ([Mo]) is calculated to be endergonic by 9.59kcalmol−1. 4 Conclusions In summary, with the help of DFT calculations, a new methodology has been applied to reduce the dinitrogen using H2 in the presence of [N2-Mo{(NHCH2CH2)3N}] and organic co-catalysts under normal experimental conditions to produce ammonia and hydrazine. The calculated energies of the fundamental reactions to form various intermediates and transition state molecules (TS-I, TS-II, TS-III, TS-Ia and TS-IIa) suggest that the proposed catalytic cycle is thermodynamically feasible to produce ammonia and hydrazine. We also have observed the formation of six coordinate molybdenum–hydride complexes (4, 7, 10 and 6a) in the new proposed catalytic scenario, which is not known in the previously reported catalytic cycle for the [N2-Mo{(NHCH2CH2)3N}] catalyst. The direct contact of H2 with [N2-Mo{(NHCH2CH2)3N}] catalyst can be avoided by using organic co-catalysts to prevent the competition in binding between N2 and H2 with [N2-Mo{(NHCH2CH2)3N}] catalyst. Since our calculation shows the feasibility of generating ammonia from N2 and H2, the [N2-Mo{(NHCH2CH2)3N}] catalyst can be an alternate for the Haber-Bosch technology once if this methodology is proved experimentally and observed more TON. Acknowledgements Dr. C. S. thank the Department of Science and Technology (DST) New Delhi, India for the financial support (No. SR/FT/CS-055/2008). S. B. gratefully acknowledges the Council of Scientific & Industrial Research (CSIR) for a Senior Research Fellowship (SRF). Appendix A Supplementary data Supplementary data associated with this article can be found, in the online version, at http://dx.doi.org/10.1016/j.molcata.2012.12.012. Appendix A Supplementary data The following are supplementary data to this article: References [1] B.A. MacKay M.D. Fryzuk Chem. Rev. 104 2004 385 402 [2] M. Hidai Coord. Chem. Rev. 185-186 1999 99 108 [3] T.A. Bazhenova A.E. Shilov Coord. Chem. Rev. 144 1995 69 145 [4] C.J. Pickett J. Talarmin Nature 317 1985 652 653 [5] C.M. Kozak P. Mountford Angew. Chem. Int. Ed. Engl. 43 2004 1186 1189 [6] J. Chatt J.R. Dilworth R.L. Richards Chem. Rev. 78 1978 589 625 [7] M. Hidai Y. Mizobe Chem. Rev. 95 1995 1115 1133 [8] G.J. Leigh Acc. Chem. Res. 25 1992 177 181 [9] R.A. Henderson G.J. Leigh C. Pickett Adv. Inorg. Chem. Radiochem. 27 1983 197 292 [10] R. Schlogl Angew. Chem. Int. Ed. Engl. 42 2003 2004 2008 [11] V. Smil Enriching the Earth 2001 MIT Press Cambridge, MA [12] H. Bielawa O. Hinrichsen A. Birkner M. Muhler Angew. Chem. Int. Ed. Engl. 40 1999 1061 1063 [13] Y. Nishibayashi S. Iwai M. Hidai Science 279 1998 540 542 [14] M.D. Fryzuk J.B. Love S.J. Rettig V.G. Young Science 275 1997 1445 1447 [15] J.A. Pool E. Lobkovsky P.J. Chirik Nature 427 2004 527 530 [16] M. Hçlscher M.H.G. Prechtl W. Leitner Chem. Eur. J. 13 2007 6636 6643 [17] D.V. Yandulov R.R. Schrock Science 301 2003 76 78 [18] D.V. Yandulov R.R. Schrock J. Am. Chem. Soc. 124 2002 6252 6253 [19] D.V. Yandulov R.R. Schrock A.L. Rheingold C. Ceccarelli W.M. Davis Inorg. Chem. 42 2003 796 813 [20] D. Yandulov R.R. Schrock Inorg. Chem. 44 2005 1103 1117 [21] V. Ritleng D.V. Yandulov W.W. Weare R.R. Schrock A.R. Hock W.M. Davis J. Am. Chem. Soc. 126 2004 6150 6163 [22] W.W. Weare R.R. Schrock A.S. Hock P. Muller Inorg. Chem. 45 2006 9185 9196 [23] W.W. Weare C. Dai M.J. Byrnes J. Chin R.R. Schrock Proc. Natl. Acad. Sci. U.S.A. 103 2006 17099 17106 [24] R.R. Schrock Acc. Chem. Res. 38 2005 955 962 [25] R.R. Schrock Chem. Commun. 2003 2389 2391 [26] K. Arashiba Y. Miyake Y. Nishibayashi Nature Chem. 3 2011 120 125 [27] F. Studt F. Tuczek Angew. Chem. Int. Ed. Engl. 44 2005 5639 5642 [28] M. Reiher B.L. Guennic B. Kirchner Inorg. Chem. 44 2005 9640 9642 [29] D.V. Khoroshun D.G. Musaev K. Morokuma Mol. Phys. 100 2002 523 532 [30] S. Schenk B.L. Guennic B. Kirchner M. Reiher Inorg. Chem. 47 2008 3634 3650 [31] A. Magistrato A. Robertazzi P. Carloni J. Chem. Theory Comput. 3 2007 1708 1720 [32] F. Studt F. Tuczek J. Comput. Chem. 27 2006 1278 1291 [33] B.L. Guennic B. Kirchner M. Reiher Chem. Eur. J. 11 2005 7448 7460 [34] Z. Cao A. Zhou H.L. Wan Q. Zhang Int. J. Quantum Chem. 103 2005 344 353 [35] D.G.H. Hetterscheid B.S. Hanna R.R. Schrock Inorg. Chem. 48 2009 8569 8577 [36] M. Hölscher W. Leitner Eur. J. Inorg. Chem. 2006 4407 4417 [37] P. Balu S. Baskaran V. Kannappan C. Sivasankar New J. Chem. 36 2012 562 565 [38] P. Balu S. Baskaran V. Kannappan C. Sivasankar Polyhedron 31 2012 676 681 [39] A.D. Becke Phys. Rev. A 38 1988 3098 3100 [40] A.D. Becke J. Chem. Phys. 98 1993 1372 1377 [41] A.D. Becke J. Chem. Phys. 98 1993 5648 5652 [42] T.H. Dunning Jr. P.J. Hay H.F. Schaefer III. Modern Theoretical Chemistry 1976 Plenum New York [43] P.J. Hay W.R. Wadt J. Chem. Phys. 82 1985 270 283 [44] P.J. Hay W.R. Wadt J. Chem. Phys. 82 1985 299 310 [45] W.R. Wadt P.J. Hay J. Chem. Phys. 82 1985 284 298 [46] R. Ditchfield W.J. Hehre J.A. Pople J. Chem. Phys. 54 1971 724 728 [47] W.J. Hehre R. Ditchfield J.A. Pople J. Chem. Phys. 56 1972 2257 2261 [48] P.C. Hariharan J.A. Pople Mol. Phys. 27 1974 209 214 [49] M.S. Gordon Chem. Phys. Lett. 76 1980 163 168 [50] P.C. Hariharan J.A. Pople Theor. Chim. Acta. 28 1973 213 222 [51] Q. Cui D.G. Musaev M. Svensson S. Sieber K. Morokuma J. Am. Chem. Soc. 117 1995 12366 12367 [52] A.K. Guha A.S. Phukan Inorg. Chem. 50 2011 8823 8826 [53] G.C. Stephan C. Sivasankar F. Studt F. Tuczek Chem. Eur. J. 14 2008 644 652 [54] C. Sivasankar N. Bores G. Peters C.M. Habeck F. Studt F. Tuczek Organometallics 24 2005 5393 5406 [55] M.T. Cancès B. Mennucci J. Tomasi J. Chem. Phys. 107 1997 3032 3041 [56] M. Cossi V. Barone B. Mennucci J. Tomasi Chem. Phys. Lett. 286 1998 253 260 [57] B. Mennucci J. Tomasi J. Chem. Phys. 106 1997 5151 5158 [58] M.J. Frisch G.W. Trucks H.B. Schlegel G.E. Scuseria M.A. Robb J.R. Cheeseman J.A. Montgomery Jr. T. Vreven K.N. Kudin J.C. Burant J.M. Millam S.S. Iyengar J. Tomasi V. Barone B. Mennucci M. Cossi G. Scalmani N. Rega G.A. Petersson H. Nakatsuji M. Hada M. Ehara K. Toyota R. Fukuda J. Hasegawa M. Ishida T. Nakajima Y. Honda O. Kitao H. Nakai M. Klene X. Li J.E. Knox H.P. Hratchian J.B. Cross V. Bakken C. Adamo J. Jaramillo R. Gomperts R.E. Stratmann O. Yazyev A.J. Austin R. Cammi C. Pomelli J.W. Ochterski P.Y. Ayala K. Morokuma G.A. Voth P. Salvador J.J. Dannenberg V.G. Zakrzewski S. Dapprich A.D. Daniels M.C. Strain O. Farkas D.K. Malick A.D. Rabuck K. Raghavachari J.B. Foresman J.V. Ortiz Q. Cui A.G. Baboul S. Clifford J. Cioslowski B.B. Stefanov G. Liu A. Liashenko P. Piskorz I. Komaromi R.L. Martin D.J. Fox T. Keith M.A. Al-Laham C.Y. Peng A. Nanayakkara M. Challacombe P.M.W. Gill B. Johnson W. Chen M.W. Wong C. Gonzalez J.A. Pople Gaussian 03, Revision C. 01 2004 Gaussian, Inc. Wallingford CT [59] S.J. Geier D.W. Stephan J. Am. Chem. Soc. 131 2009 3476 3477",
      "scopus-id": "84875137482",
      "coredata": {
        "eid": "1-s2.0-S1381116912004189",
        "dc:description": "A new methodology is proposed and tested by Density Functional Theory (DFT) calculations to reduce N2 to NH3 and N2H4 using H2 in the presence of [Mo{(NHCH2CH2)3N}] and organic co-catalysts under mild experimental conditions. The calculated Gibbs free energies of the fundamental reactions to form various intermediates and transition state molecules suggest that the proposed catalytic cycle is viable to produce NH3 and N2H4, however NH3 formation is more feasible than N2H4. Formation of six coordinate [Mo]-H intermediates have also been predicted. The direct contact of H2 with [N2-Mo{(NHCH2CH2)3N}] catalyst can be avoided by using organic co-catalysts to prevent the competition in binding between N2 and H2 with [Mo{(NHCH2CH2)3N}] catalyst.",
        "openArchiveArticle": "false",
        "prism:coverDate": "2013-04-30",
        "openaccessUserLicense": null,
        "prism:aggregationType": "Journal",
        "prism:url": "https://api.elsevier.com/content/article/pii/S1381116912004189",
        "dc:creator": [
          {
            "@_fa": "true",
            "$": "Baskaran, Sambath"
          },
          {
            "@_fa": "true",
            "$": "Sivasankar, Chinnappan"
          }
        ],
        "link": [
          {
            "@_fa": "true",
            "@rel": "self",
            "@href": "https://api.elsevier.com/content/article/pii/S1381116912004189"
          },
          {
            "@_fa": "true",
            "@rel": "scidir",
            "@href": "https://www.sciencedirect.com/science/article/pii/S1381116912004189"
          }
        ],
        "dc:format": "application/json",
        "openaccessType": null,
        "pii": "S1381-1169(12)00418-9",
        "prism:volume": "370",
        "prism:publisher": "Elsevier B.V.",
        "dc:title": "Reduction of N2 by H2 to NH3 and N2H4 using [MoL] (L=triamidoamine) and organic co-catalysts: A theoretical approach",
        "prism:copyright": "Copyright © 2013 Elsevier B.V. All rights reserved.",
        "openaccess": "0",
        "prism:issn": "13811169",
        "dcterms:subject": [
          {
            "@_fa": "true",
            "$": "Nitrogen fixation"
          },
          {
            "@_fa": "true",
            "$": "Reaction mechanism"
          },
          {
            "@_fa": "true",
            "$": "Homogeneous catalysis"
          },
          {
            "@_fa": "true",
            "$": "Density functional calculations"
          },
          {
            "@_fa": "true",
            "$": "Molybdenum"
          }
        ],
        "openaccessArticle": "false",
        "prism:publicationName": "Journal of Molecular Catalysis A: Chemical",
        "openaccessSponsorType": null,
        "prism:pageRange": "140-144",
        "prism:endingPage": "144",
        "pubType": "fla",
        "prism:coverDisplayDate": "April 2013",
        "prism:doi": "10.1016/j.molcata.2012.12.012",
        "prism:startingPage": "140",
        "dc:identifier": "doi:10.1016/j.molcata.2012.12.012",
        "openaccessSponsorName": null
      },
      "objects": {
        "object": [
          {
            "@category": "thumbnail",
            "@height": "63",
            "@width": "334",
            "@_fa": "true",
            "$": "https://api.elsevier.com/content/object/eid/1-s2.0-S1381116912004189-si3.gif?httpAccept=%2A%2F%2A",
            "@multimediatype": "GIF image file",
            "@type": "ALTIMG",
            "@size": "2263",
            "@ref": "si3",
            "@mimetype": "image/gif"
          },
          {
            "@category": "thumbnail",
            "@height": "37",
            "@width": "481",
            "@_fa": "true",
            "$": "https://api.elsevier.com/content/object/eid/1-s2.0-S1381116912004189-si2.gif?httpAccept=%2A%2F%2A",
            "@multimediatype": "GIF image file",
            "@type": "ALTIMG",
            "@size": "2179",
            "@ref": "si2",
            "@mimetype": "image/gif"
          },
          {
            "@category": "thumbnail",
            "@height": "30",
            "@width": "455",
            "@_fa": "true",
            "$": "https://api.elsevier.com/content/object/eid/1-s2.0-S1381116912004189-si1.gif?httpAccept=%2A%2F%2A",
            "@multimediatype": "GIF image file",
            "@type": "ALTIMG",
            "@size": "1748",
            "@ref": "si1",
            "@mimetype": "image/gif"
          },
          {
            "@category": "high",
            "@height": "1530",
            "@width": "2160",
            "@_fa": "true",
            "$": "https://api.elsevier.com/content/object/eid/1-s2.0-S1381116912004189-gr3_lrg.jpg?httpAccept=%2A%2F%2A",
            "@multimediatype": "JPEG image file",
            "@type": "IMAGE-HIGH-RES",
            "@size": "308859",
            "@ref": "gr3",
            "@mimetype": "image/jpeg"
          },
          {
            "@category": "high",
            "@height": "906",
            "@width": "2083",
            "@_fa": "true",
            "$": "https://api.elsevier.com/content/object/eid/1-s2.0-S1381116912004189-gr2_lrg.jpg?httpAccept=%2A%2F%2A",
            "@multimediatype": "JPEG image file",
            "@type": "IMAGE-HIGH-RES",
            "@size": "221404",
            "@ref": "gr2",
            "@mimetype": "image/jpeg"
          },
          {
            "@category": "high",
            "@height": "1369",
            "@width": "2160",
            "@_fa": "true",
            "$": "https://api.elsevier.com/content/object/eid/1-s2.0-S1381116912004189-gr1_lrg.jpg?httpAccept=%2A%2F%2A",
            "@multimediatype": "JPEG image file",
            "@type": "IMAGE-HIGH-RES",
            "@size": "310130",
            "@ref": "gr1",
            "@mimetype": "image/jpeg"
          },
          {
            "@category": "high",
            "@height": "598",
            "@width": "1641",
            "@_fa": "true",
            "$": "https://api.elsevier.com/content/object/eid/1-s2.0-S1381116912004189-fx3_lrg.jpg?httpAccept=%2A%2F%2A",
            "@multimediatype": "JPEG image file",
            "@type": "IMAGE-HIGH-RES",
            "@size": "87880",
            "@ref": "fx3",
            "@mimetype": "image/jpeg"
          },
          {
            "@category": "high",
            "@height": "259",
            "@width": "2070",
            "@_fa": "true",
            "$": "https://api.elsevier.com/content/object/eid/1-s2.0-S1381116912004189-fx2_lrg.jpg?httpAccept=%2A%2F%2A",
            "@multimediatype": "JPEG image file",
            "@type": "IMAGE-HIGH-RES",
            "@size": "81969",
            "@ref": "fx2",
            "@mimetype": "image/jpeg"
          },
          {
            "@category": "high",
            "@height": "886",
            "@width": "2073",
            "@_fa": "true",
            "$": "https://api.elsevier.com/content/object/eid/1-s2.0-S1381116912004189-fx1_lrg.jpg?httpAccept=%2A%2F%2A",
            "@multimediatype": "JPEG image file",
            "@type": "IMAGE-HIGH-RES",
            "@size": "140675",
            "@ref": "fx1",
            "@mimetype": "image/jpeg"
          },
          {
            "@category": "high",
            "@height": "657",
            "@width": "1583",
            "@_fa": "true",
            "$": "https://api.elsevier.com/content/object/eid/1-s2.0-S1381116912004189-sc1_lrg.jpg?httpAccept=%2A%2F%2A",
            "@multimediatype": "JPEG image file",
            "@type": "IMAGE-HIGH-RES",
            "@size": "70230",
            "@ref": "sc1",
            "@mimetype": "image/jpeg"
          },
          {
            "@category": "standard",
            "@height": "346",
            "@width": "488",
            "@_fa": "true",
            "$": "https://api.elsevier.com/content/object/eid/1-s2.0-S1381116912004189-gr3.jpg?httpAccept=%2A%2F%2A",
            "@multimediatype": "JPEG image file",
            "@type": "IMAGE-DOWNSAMPLED",
            "@size": "44180",
            "@ref": "gr3",
            "@mimetype": "image/jpeg"
          },
          {
            "@category": "standard",
            "@height": "204",
            "@width": "470",
            "@_fa": "true",
            "$": "https://api.elsevier.com/content/object/eid/1-s2.0-S1381116912004189-gr2.jpg?httpAccept=%2A%2F%2A",
            "@multimediatype": "JPEG image file",
            "@type": "IMAGE-DOWNSAMPLED",
            "@size": "32014",
            "@ref": "gr2",
            "@mimetype": "image/jpeg"
          },
          {
            "@category": "standard",
            "@height": "309",
            "@width": "488",
            "@_fa": "true",
            "$": "https://api.elsevier.com/content/object/eid/1-s2.0-S1381116912004189-gr1.jpg?httpAccept=%2A%2F%2A",
            "@multimediatype": "JPEG image file",
            "@type": "IMAGE-DOWNSAMPLED",
            "@size": "45885",
            "@ref": "gr1",
            "@mimetype": "image/jpeg"
          },
          {
            "@category": "standard",
            "@height": "135",
            "@width": "370",
            "@_fa": "true",
            "$": "https://api.elsevier.com/content/object/eid/1-s2.0-S1381116912004189-fx3.jpg?httpAccept=%2A%2F%2A",
            "@multimediatype": "JPEG image file",
            "@type": "IMAGE-DOWNSAMPLED",
            "@size": "10580",
            "@ref": "fx3",
            "@mimetype": "image/jpeg"
          },
          {
            "@category": "standard",
            "@height": "58",
            "@width": "467",
            "@_fa": "true",
            "$": "https://api.elsevier.com/content/object/eid/1-s2.0-S1381116912004189-fx2.jpg?httpAccept=%2A%2F%2A",
            "@multimediatype": "JPEG image file",
            "@type": "IMAGE-DOWNSAMPLED",
            "@size": "8961",
            "@ref": "fx2",
            "@mimetype": "image/jpeg"
          },
          {
            "@category": "standard",
            "@height": "200",
            "@width": "468",
            "@_fa": "true",
            "$": "https://api.elsevier.com/content/object/eid/1-s2.0-S1381116912004189-fx1.jpg?httpAccept=%2A%2F%2A",
            "@multimediatype": "JPEG image file",
            "@type": "IMAGE-DOWNSAMPLED",
            "@size": "17516",
            "@ref": "fx1",
            "@mimetype": "image/jpeg"
          },
          {
            "@category": "standard",
            "@height": "148",
            "@width": "357",
            "@_fa": "true",
            "$": "https://api.elsevier.com/content/object/eid/1-s2.0-S1381116912004189-sc1.jpg?httpAccept=%2A%2F%2A",
            "@multimediatype": "JPEG image file",
            "@type": "IMAGE-DOWNSAMPLED",
            "@size": "8412",
            "@ref": "sc1",
            "@mimetype": "image/jpeg"
          },
          {
            "@category": "thumbnail",
            "@height": "155",
            "@width": "219",
            "@_fa": "true",
            "$": "https://api.elsevier.com/content/object/eid/1-s2.0-S1381116912004189-gr3.sml?httpAccept=%2A%2F%2A",
            "@multimediatype": "GIF image file",
            "@type": "IMAGE-THUMBNAIL",
            "@size": "6132",
            "@ref": "gr3",
            "@mimetype": "image/gif"
          },
          {
            "@category": "thumbnail",
            "@height": "95",
            "@width": "219",
            "@_fa": "true",
            "$": "https://api.elsevier.com/content/object/eid/1-s2.0-S1381116912004189-gr2.sml?httpAccept=%2A%2F%2A",
            "@multimediatype": "GIF image file",
            "@type": "IMAGE-THUMBNAIL",
            "@size": "5316",
            "@ref": "gr2",
            "@mimetype": "image/gif"
          },
          {
            "@category": "thumbnail",
            "@height": "139",
            "@width": "219",
            "@_fa": "true",
            "$": "https://api.elsevier.com/content/object/eid/1-s2.0-S1381116912004189-gr1.sml?httpAccept=%2A%2F%2A",
            "@multimediatype": "GIF image file",
            "@type": "IMAGE-THUMBNAIL",
            "@size": "6091",
            "@ref": "gr1",
            "@mimetype": "image/gif"
          },
          {
            "@category": "thumbnail",
            "@height": "80",
            "@width": "219",
            "@_fa": "true",
            "$": "https://api.elsevier.com/content/object/eid/1-s2.0-S1381116912004189-fx3.sml?httpAccept=%2A%2F%2A",
            "@multimediatype": "GIF image file",
            "@type": "IMAGE-THUMBNAIL",
            "@size": "2977",
            "@ref": "fx3",
            "@mimetype": "image/gif"
          },
          {
            "@category": "thumbnail",
            "@height": "27",
            "@width": "219",
            "@_fa": "true",
            "$": "https://api.elsevier.com/content/object/eid/1-s2.0-S1381116912004189-fx2.sml?httpAccept=%2A%2F%2A",
            "@multimediatype": "GIF image file",
            "@type": "IMAGE-THUMBNAIL",
            "@size": "2002",
            "@ref": "fx2",
            "@mimetype": "image/gif"
          },
          {
            "@category": "thumbnail",
            "@height": "94",
            "@width": "219",
            "@_fa": "true",
            "$": "https://api.elsevier.com/content/object/eid/1-s2.0-S1381116912004189-fx1.sml?httpAccept=%2A%2F%2A",
            "@multimediatype": "GIF image file",
            "@type": "IMAGE-THUMBNAIL",
            "@size": "3513",
            "@ref": "fx1",
            "@mimetype": "image/gif"
          },
          {
            "@category": "thumbnail",
            "@height": "91",
            "@width": "219",
            "@_fa": "true",
            "$": "https://api.elsevier.com/content/object/eid/1-s2.0-S1381116912004189-sc1.sml?httpAccept=%2A%2F%2A",
            "@multimediatype": "GIF image file",
            "@type": "IMAGE-THUMBNAIL",
            "@size": "2681",
            "@ref": "sc1",
            "@mimetype": "image/gif"
          },
          {
            "@category": "standard",
            "@_fa": "true",
            "$": "https://api.elsevier.com/content/object/eid/1-s2.0-S1381116912004189-mmc1.doc?httpAccept=%2A%2F%2A",
            "@multimediatype": "Microsoft Word file",
            "@type": "APPLICATION",
            "@size": "24935936",
            "@ref": "mmc1",
            "@mimetype": "application/word"
          }
        ]
      },
      "link": {
        "@rel": "abstract",
        "@href": "https://api.elsevier.com/content/abstract/scopus_id/84875137482"
      }
    }
  }
}