{
  "metadata": {
    "title": "Thiolation of dimethyl sulfide to methanethiol over WO<ce:inf loc=post>3</ce:inf>/ZrO<ce:inf loc=post>2</ce:inf> catalysts",
    "authors": "; ; ",
    "journal": "Journal of Molecular Catalysis A: Chemical",
    "date": "2012-12-31",
    "doi": "10.1016/j.molcata.2012.08.009",
    "abstract": "",
    "uri": "https://api.elsevier.com/content/article/pii/S1381116912002543",
    "pii": "S1381116912002543"
  },
  "fulltext": {
    "full-text-retrieval-response": {
      "scopus-eid": "2-s2.0-84867472090",
      "originalText": "serial JL 271358 291210 291744 291790 291809 31 Journal of Molecular Catalysis A: Chemical JOURNALMOLECULARCATALYSISACHEMICAL 2012-08-20 2012-08-20 2012-10-06T17:47:50 1-s2.0-S1381116912002543 S1381-1169(12)00254-3 S1381116912002543 10.1016/j.molcata.2012.08.009 S300 S300.1 FULL-TEXT 1-s2.0-S1381116912X00098 2015-05-15T05:56:33.607047-04:00 0 0 20121201 20121231 2012 2012-08-20T00:00:00Z articleinfo crossmark dco dateupdated tomb dateloaded datesearch indexeddate volumelist yearnav absattachment articletitlenorm authfirstinitialnorm authfirstsurnamenorm cid cids contenttype copyright dateloadedtxt docsubtype doctype doi eid ewtransactionid hubeid issn issnnorm itemstage itemtransactionid itemweight openaccess openarchive pg pgfirst pglast pii piinorm pubdateend pubdatestart pubdatetxt pubyr sectiontitle sortorder srctitle srctitlenorm srctype subheadings suppl volfirst volissue webpdf webpdfpagecount figure table body mmlmath acknowledge affil articletitle auth authfirstini authfull authkeywords authlast primabst ref specialabst alllist content subj ssids 1381-1169 13811169 false 365 365 C Volume 365 11 60 65 60 65 201212 December 2012 2012-12-01 2012-12-31 2012 Regular papers article fla Copyright © 2012 Elsevier B.V. All rights reserved. THIOLATIONDIMETHYLSULFIDEMETHANETHIOLOVERWO3ZRO2CATALYSTS CHEN S 1 Introduction 2 Experimental 2.1 Catalyst preparation 2.1.1 Preparation of the ZrO2 support 2.1.2 Preparation of the WO3/ZrO2 catalysts 2.2 Reaction conditions 2.3 Catalyst characterization 3 Results and discussion 3.1 Structural properties 3.2 Surface acid–base properties 3.3 Performance of pure WO3 and ZrO2 3.4 Catalytic activity of WO3/ZrO2 3.5 Effect of water content on the thiolation of DMS to MT over 5W/ZrO2973 and 10W/ZrO2973 3.6 Effect of reaction time on the thiolation of DMS to MT 4 Conclusions Acknowledgement References YANG 2000 175 180 Y CHEN 2008 69 76 A LEUCHTENBERGER 2005 1 8 W GUTIERREZ 2011 264 273 O PLAISANCE 2009 449 458 C YANG 2001 221 225 Y MASHKINA 2009 441 447 A CHEN 2012 151 S MUL 2003 327 337 G HAO 2009 486 492 Y NISHIGUCHI 2006 66 74 T ROSSMEDGAARDEN 2008 108 125 E CHU 2004 199 205 W BAERTSCH 2002 44 57 C HINO 1988 1259 1260 M BAERTSCH 2001 1320 1330 C LI 1999 4913 4918 L NAITO 1999 7206 7213 N OCCHIUZZI 2004 169 177 M MONGKOLBOVORNKIJ 2010 1510 1516 P IGLESIA 1993 238 253 E KOMERS 2001 359 362 J MASHKINA 1991 361 365 A YANG 1998 65 68 Y KOSHELEV 1985 387 391 S KOSHELEV 1987 367 372 C GREGORIO 2004 45 55 F GREGORIO 2008 159 171 F BIGEY 1999 406 420 C KIM 2006 139 143 S CHENX2012X60 CHENX2012X60X65 CHENX2012X60XS CHENX2012X60X65XS item S1381-1169(12)00254-3 S1381116912002543 1-s2.0-S1381116912002543 10.1016/j.molcata.2012.08.009 271358 2012-10-06T14:18:29.160643-04:00 2012-12-01 2012-12-31 1-s2.0-S1381116912002543-main.pdf https://s3.amazonaws.com/prod-ucs-content-store-us-east/content/pii:S1381116912002543/MAIN/application/pdf/7201b8cfb16f9bb9b22d3227bebbb7a2/main.pdf https://s3-eu-west-1.amazonaws.com/prod-ucs-content-store-eu-west/content/pii:S1381116912002543/MAIN/application/pdf/7201b8cfb16f9bb9b22d3227bebbb7a2/main.pdf main.pdf pdf true 946924 MAIN 6 1-s2.0-S1381116912002543-main_1.png https://s3-eu-west-1.amazonaws.com/prod-ucs-content-store-eu-west/content/pii:S1381116912002543/PREVIEW/image/png/a5f7311277b12f186bebb16c816029e3/main_1.png https://s3.amazonaws.com/prod-ucs-content-store-us-east/content/pii:S1381116912002543/PREVIEW/image/png/a5f7311277b12f186bebb16c816029e3/main_1.png main_1.png png 57246 849 656 IMAGE-WEB-PDF 1 1-s2.0-S1381116912002543-si2.gif https://s3.amazonaws.com/prod-ucs-content-store-us-east/content/pii:S1381116912002543/STRIPIN/image/gif/e23286236499f0a63485931cc3a2a564/si2.gif https://s3-eu-west-1.amazonaws.com/prod-ucs-content-store-eu-west/content/pii:S1381116912002543/STRIPIN/image/gif/e23286236499f0a63485931cc3a2a564/si2.gif si2 si2.gif gif 285 15 51 ALTIMG 1-s2.0-S1381116912002543-si1.gif https://s3.amazonaws.com/prod-ucs-content-store-us-east/content/pii:S1381116912002543/STRIPIN/image/gif/13cc8161d0e65b385544ee6312ec1347/si1.gif https://s3-eu-west-1.amazonaws.com/prod-ucs-content-store-eu-west/content/pii:S1381116912002543/STRIPIN/image/gif/13cc8161d0e65b385544ee6312ec1347/si1.gif si1 si1.gif gif 1240 43 254 ALTIMG 1-s2.0-S1381116912002543-gr1.jpg https://s3.amazonaws.com/prod-ucs-content-store-us-east/content/pii:S1381116912002543/gr1/DOWNSAMPLED/image/jpeg/94fb574968fae9d47a335b64d1fbc37a/gr1.jpg https://s3-eu-west-1.amazonaws.com/prod-ucs-content-store-eu-west/content/pii:S1381116912002543/gr1/DOWNSAMPLED/image/jpeg/94fb574968fae9d47a335b64d1fbc37a/gr1.jpg gr1 gr1.jpg jpg 49672 294 636 IMAGE-DOWNSAMPLED 1-s2.0-S1381116912002543-gr1.sml https://s3.amazonaws.com/prod-ucs-content-store-us-east/content/pii:S1381116912002543/gr1/THUMBNAIL/image/gif/28ffdce648af7372faaef9462d3b2324/gr1.sml https://s3-eu-west-1.amazonaws.com/prod-ucs-content-store-eu-west/content/pii:S1381116912002543/gr1/THUMBNAIL/image/gif/28ffdce648af7372faaef9462d3b2324/gr1.sml gr1 gr1.sml sml 3467 101 219 IMAGE-THUMBNAIL 1-s2.0-S1381116912002543-gr1_lrg.jpg https://s3.amazonaws.com/prod-ucs-content-store-us-east/content/pii:S1381116912002543/gr1/HIGHRES/image/jpeg/efec5402a8e42c2c132314d95db53ecb/gr1_lrg.jpg https://s3-eu-west-1.amazonaws.com/prod-ucs-content-store-eu-west/content/pii:S1381116912002543/gr1/HIGHRES/image/jpeg/efec5402a8e42c2c132314d95db53ecb/gr1_lrg.jpg gr1 gr1_lrg.jpg jpg 344971 1300 2817 IMAGE-HIGH-RES 1-s2.0-S1381116912002543-gr2.jpg https://s3.amazonaws.com/prod-ucs-content-store-us-east/content/pii:S1381116912002543/gr2/DOWNSAMPLED/image/jpeg/e72c2916f1962c254d5cbbbd632f71aa/gr2.jpg https://s3-eu-west-1.amazonaws.com/prod-ucs-content-store-eu-west/content/pii:S1381116912002543/gr2/DOWNSAMPLED/image/jpeg/e72c2916f1962c254d5cbbbd632f71aa/gr2.jpg gr2 gr2.jpg jpg 66584 207 640 IMAGE-DOWNSAMPLED 1-s2.0-S1381116912002543-gr2.sml https://s3.amazonaws.com/prod-ucs-content-store-us-east/content/pii:S1381116912002543/gr2/THUMBNAIL/image/gif/09acacd761ba90ec1500f789209efbe1/gr2.sml https://s3-eu-west-1.amazonaws.com/prod-ucs-content-store-eu-west/content/pii:S1381116912002543/gr2/THUMBNAIL/image/gif/09acacd761ba90ec1500f789209efbe1/gr2.sml gr2 gr2.sml sml 7044 71 219 IMAGE-THUMBNAIL 1-s2.0-S1381116912002543-gr2_lrg.jpg https://s3.amazonaws.com/prod-ucs-content-store-us-east/content/pii:S1381116912002543/gr2/HIGHRES/image/jpeg/0aced274ffe4b3f16c84c634a2aa65f5/gr2_lrg.jpg https://s3-eu-west-1.amazonaws.com/prod-ucs-content-store-eu-west/content/pii:S1381116912002543/gr2/HIGHRES/image/jpeg/0aced274ffe4b3f16c84c634a2aa65f5/gr2_lrg.jpg gr2 gr2_lrg.jpg jpg 761248 917 2833 IMAGE-HIGH-RES 1-s2.0-S1381116912002543-gr3.jpg https://s3.amazonaws.com/prod-ucs-content-store-us-east/content/pii:S1381116912002543/gr3/DOWNSAMPLED/image/jpeg/106901c29c9a723d1ef2f7443af0aa08/gr3.jpg https://s3-eu-west-1.amazonaws.com/prod-ucs-content-store-eu-west/content/pii:S1381116912002543/gr3/DOWNSAMPLED/image/jpeg/106901c29c9a723d1ef2f7443af0aa08/gr3.jpg gr3 gr3.jpg jpg 47960 317 656 IMAGE-DOWNSAMPLED 1-s2.0-S1381116912002543-gr3.sml https://s3.amazonaws.com/prod-ucs-content-store-us-east/content/pii:S1381116912002543/gr3/THUMBNAIL/image/gif/04420277801f0e6957b3e8fc341df0b3/gr3.sml https://s3-eu-west-1.amazonaws.com/prod-ucs-content-store-eu-west/content/pii:S1381116912002543/gr3/THUMBNAIL/image/gif/04420277801f0e6957b3e8fc341df0b3/gr3.sml gr3 gr3.sml sml 2800 106 219 IMAGE-THUMBNAIL 1-s2.0-S1381116912002543-gr3_lrg.jpg https://s3.amazonaws.com/prod-ucs-content-store-us-east/content/pii:S1381116912002543/gr3/HIGHRES/image/jpeg/e3a043196f8ae51ec28412e9d4915839/gr3_lrg.jpg https://s3-eu-west-1.amazonaws.com/prod-ucs-content-store-eu-west/content/pii:S1381116912002543/gr3/HIGHRES/image/jpeg/e3a043196f8ae51ec28412e9d4915839/gr3_lrg.jpg gr3 gr3_lrg.jpg jpg 295121 1403 2904 IMAGE-HIGH-RES 1-s2.0-S1381116912002543-gr4.jpg https://s3.amazonaws.com/prod-ucs-content-store-us-east/content/pii:S1381116912002543/gr4/DOWNSAMPLED/image/jpeg/815e2612adfc5545e71e376a2c9823a8/gr4.jpg https://s3-eu-west-1.amazonaws.com/prod-ucs-content-store-eu-west/content/pii:S1381116912002543/gr4/DOWNSAMPLED/image/jpeg/815e2612adfc5545e71e376a2c9823a8/gr4.jpg gr4 gr4.jpg jpg 25721 288 395 IMAGE-DOWNSAMPLED 1-s2.0-S1381116912002543-gr4.sml https://s3.amazonaws.com/prod-ucs-content-store-us-east/content/pii:S1381116912002543/gr4/THUMBNAIL/image/gif/75adb1105e04d8ae03a1258400f524c6/gr4.sml https://s3-eu-west-1.amazonaws.com/prod-ucs-content-store-eu-west/content/pii:S1381116912002543/gr4/THUMBNAIL/image/gif/75adb1105e04d8ae03a1258400f524c6/gr4.sml gr4 gr4.sml sml 4202 160 219 IMAGE-THUMBNAIL 1-s2.0-S1381116912002543-gr4_lrg.jpg https://s3.amazonaws.com/prod-ucs-content-store-us-east/content/pii:S1381116912002543/gr4/HIGHRES/image/jpeg/2040f438508ca9873acb395e92482623/gr4_lrg.jpg https://s3-eu-west-1.amazonaws.com/prod-ucs-content-store-eu-west/content/pii:S1381116912002543/gr4/HIGHRES/image/jpeg/2040f438508ca9873acb395e92482623/gr4_lrg.jpg gr4 gr4_lrg.jpg jpg 118154 1275 1749 IMAGE-HIGH-RES 1-s2.0-S1381116912002543-gr5.jpg https://s3.amazonaws.com/prod-ucs-content-store-us-east/content/pii:S1381116912002543/gr5/DOWNSAMPLED/image/jpeg/338544ba65f89c6849f1b6cdf18fa3a7/gr5.jpg https://s3-eu-west-1.amazonaws.com/prod-ucs-content-store-eu-west/content/pii:S1381116912002543/gr5/DOWNSAMPLED/image/jpeg/338544ba65f89c6849f1b6cdf18fa3a7/gr5.jpg gr5 gr5.jpg jpg 40751 304 395 IMAGE-DOWNSAMPLED 1-s2.0-S1381116912002543-gr5.sml https://s3.amazonaws.com/prod-ucs-content-store-us-east/content/pii:S1381116912002543/gr5/THUMBNAIL/image/gif/cb69cecc198b02cd0f6c7831ef847148/gr5.sml https://s3-eu-west-1.amazonaws.com/prod-ucs-content-store-eu-west/content/pii:S1381116912002543/gr5/THUMBNAIL/image/gif/cb69cecc198b02cd0f6c7831ef847148/gr5.sml gr5 gr5.sml sml 4858 164 213 IMAGE-THUMBNAIL 1-s2.0-S1381116912002543-gr5_lrg.jpg https://s3.amazonaws.com/prod-ucs-content-store-us-east/content/pii:S1381116912002543/gr5/HIGHRES/image/jpeg/453e8a15646f49cc4365a94c42c24adb/gr5_lrg.jpg https://s3-eu-west-1.amazonaws.com/prod-ucs-content-store-eu-west/content/pii:S1381116912002543/gr5/HIGHRES/image/jpeg/453e8a15646f49cc4365a94c42c24adb/gr5_lrg.jpg gr5 gr5_lrg.jpg jpg 307154 1344 1749 IMAGE-HIGH-RES 1-s2.0-S1381116912002543-gr6.jpg https://s3.amazonaws.com/prod-ucs-content-store-us-east/content/pii:S1381116912002543/gr6/DOWNSAMPLED/image/jpeg/cfb541521ec04083951578bfd77a7afe/gr6.jpg https://s3-eu-west-1.amazonaws.com/prod-ucs-content-store-eu-west/content/pii:S1381116912002543/gr6/DOWNSAMPLED/image/jpeg/cfb541521ec04083951578bfd77a7afe/gr6.jpg gr6 gr6.jpg jpg 50930 403 641 IMAGE-DOWNSAMPLED 1-s2.0-S1381116912002543-gr6.sml https://s3.amazonaws.com/prod-ucs-content-store-us-east/content/pii:S1381116912002543/gr6/THUMBNAIL/image/gif/08b51d66af9c351eb777ff0a8331ebbb/gr6.sml https://s3-eu-west-1.amazonaws.com/prod-ucs-content-store-eu-west/content/pii:S1381116912002543/gr6/THUMBNAIL/image/gif/08b51d66af9c351eb777ff0a8331ebbb/gr6.sml gr6 gr6.sml sml 3744 138 219 IMAGE-THUMBNAIL 1-s2.0-S1381116912002543-gr6_lrg.jpg https://s3.amazonaws.com/prod-ucs-content-store-us-east/content/pii:S1381116912002543/gr6/HIGHRES/image/jpeg/c357328fde8f3fc2f4cab984d793dc2d/gr6_lrg.jpg https://s3-eu-west-1.amazonaws.com/prod-ucs-content-store-eu-west/content/pii:S1381116912002543/gr6/HIGHRES/image/jpeg/c357328fde8f3fc2f4cab984d793dc2d/gr6_lrg.jpg gr6 gr6_lrg.jpg jpg 341176 1785 2840 IMAGE-HIGH-RES 1-s2.0-S1381116912002543-gr7.jpg https://s3.amazonaws.com/prod-ucs-content-store-us-east/content/pii:S1381116912002543/gr7/DOWNSAMPLED/image/jpeg/8e74971316a3c6940fd94292fbfcfbfc/gr7.jpg https://s3-eu-west-1.amazonaws.com/prod-ucs-content-store-eu-west/content/pii:S1381116912002543/gr7/DOWNSAMPLED/image/jpeg/8e74971316a3c6940fd94292fbfcfbfc/gr7.jpg gr7 gr7.jpg jpg 19998 296 387 IMAGE-DOWNSAMPLED 1-s2.0-S1381116912002543-gr7.sml https://s3.amazonaws.com/prod-ucs-content-store-us-east/content/pii:S1381116912002543/gr7/THUMBNAIL/image/gif/5015131aed9f8ea59524bf4aa3248d5b/gr7.sml https://s3-eu-west-1.amazonaws.com/prod-ucs-content-store-eu-west/content/pii:S1381116912002543/gr7/THUMBNAIL/image/gif/5015131aed9f8ea59524bf4aa3248d5b/gr7.sml gr7 gr7.sml sml 2042 164 214 IMAGE-THUMBNAIL 1-s2.0-S1381116912002543-gr7_lrg.jpg https://s3.amazonaws.com/prod-ucs-content-store-us-east/content/pii:S1381116912002543/gr7/HIGHRES/image/jpeg/e9eeb7ebc366ebdef5c1183c972bb689/gr7_lrg.jpg https://s3-eu-west-1.amazonaws.com/prod-ucs-content-store-eu-west/content/pii:S1381116912002543/gr7/HIGHRES/image/jpeg/e9eeb7ebc366ebdef5c1183c972bb689/gr7_lrg.jpg gr7 gr7_lrg.jpg jpg 85662 1313 1715 IMAGE-HIGH-RES 1-s2.0-S1381116912002543-gr8.jpg https://s3.amazonaws.com/prod-ucs-content-store-us-east/content/pii:S1381116912002543/gr8/DOWNSAMPLED/image/jpeg/4a7c66021e67fb0380cfb2518d169c01/gr8.jpg https://s3-eu-west-1.amazonaws.com/prod-ucs-content-store-eu-west/content/pii:S1381116912002543/gr8/DOWNSAMPLED/image/jpeg/4a7c66021e67fb0380cfb2518d169c01/gr8.jpg gr8 gr8.jpg jpg 21058 275 390 IMAGE-DOWNSAMPLED 1-s2.0-S1381116912002543-gr8.sml https://s3.amazonaws.com/prod-ucs-content-store-us-east/content/pii:S1381116912002543/gr8/THUMBNAIL/image/gif/156f348b73f52cdb817b99c5d95c16a5/gr8.sml https://s3-eu-west-1.amazonaws.com/prod-ucs-content-store-eu-west/content/pii:S1381116912002543/gr8/THUMBNAIL/image/gif/156f348b73f52cdb817b99c5d95c16a5/gr8.sml gr8 gr8.sml sml 2291 154 219 IMAGE-THUMBNAIL 1-s2.0-S1381116912002543-gr8_lrg.jpg https://s3.amazonaws.com/prod-ucs-content-store-us-east/content/pii:S1381116912002543/gr8/HIGHRES/image/jpeg/52b7af322b0bdfa1c1a5fb63d91ccb42/gr8_lrg.jpg https://s3-eu-west-1.amazonaws.com/prod-ucs-content-store-eu-west/content/pii:S1381116912002543/gr8/HIGHRES/image/jpeg/52b7af322b0bdfa1c1a5fb63d91ccb42/gr8_lrg.jpg gr8 gr8_lrg.jpg jpg 98527 1218 1729 IMAGE-HIGH-RES 1-s2.0-S1381116912002543-fx1.jpg https://s3.amazonaws.com/prod-ucs-content-store-us-east/content/pii:S1381116912002543/fx1/DOWNSAMPLED/image/jpeg/eb52a267585e17da1af608c39ec99809/fx1.jpg https://s3-eu-west-1.amazonaws.com/prod-ucs-content-store-eu-west/content/pii:S1381116912002543/fx1/DOWNSAMPLED/image/jpeg/eb52a267585e17da1af608c39ec99809/fx1.jpg fx1 true fx1.jpg jpg 16580 200 259 IMAGE-DOWNSAMPLED 1-s2.0-S1381116912002543-fx1.sml https://s3.amazonaws.com/prod-ucs-content-store-us-east/content/pii:S1381116912002543/fx1/THUMBNAIL/image/gif/b5cfc78617086d28edae17fef637f327/fx1.sml https://s3-eu-west-1.amazonaws.com/prod-ucs-content-store-eu-west/content/pii:S1381116912002543/fx1/THUMBNAIL/image/gif/b5cfc78617086d28edae17fef637f327/fx1.sml fx1 true fx1.sml sml 5384 164 212 IMAGE-THUMBNAIL 1-s2.0-S1381116912002543-fx1_lrg.jpg https://s3.amazonaws.com/prod-ucs-content-store-us-east/content/pii:S1381116912002543/fx1/HIGHRES/image/jpeg/5e0a15d3da81fed1d9c113ebaee7e881/fx1_lrg.jpg https://s3-eu-west-1.amazonaws.com/prod-ucs-content-store-eu-west/content/pii:S1381116912002543/fx1/HIGHRES/image/jpeg/5e0a15d3da81fed1d9c113ebaee7e881/fx1_lrg.jpg fx1 fx1_lrg.jpg jpg 149903 886 1147 IMAGE-HIGH-RES MOLCAA 8503 S1381-1169(12)00254-3 10.1016/j.molcata.2012.08.009 Elsevier B.V. Fig. 1 XRD patterns due to the ZrO2 (A) and WO3/ZrO2 catalysts (B). Fig. 2 SEM images of the catalysts. (a) ZrO2973, (b) 2.5W/ZrO2973, and (c) 10W/ZrO2973. Fig. 3 TPD spectra of WO3/ZrO2 catalysts. (a) NH3-TPD and (b) CO2-TPD. Fig. 4 Activity at 593K over pure WO3 and ZrO2 catalysts. Reaction conditions: GHSV=1000−1, P =0.5MPa, H2S/DMS=4.0, and catalyst: 2mL. Fig. 5 Catalytic performance of the WO3/ZrO2 catalysts for the thiolation of DMS with H2S to MT. Reaction conditions: GHSV=1000−1, P =0.5MPa, H2S/DMS=4.0, and catalyst: 2mL. Fig. 6 XPS spectra of Zr 4p and W 4f region for 5W/ZrO2973. (a) Fresh 5W/ZrO2973, (b) after reaction at 593K for 3h, (c) after reaction at 593K for 3h, then calcined at 973K in air for 3h. Fig. 7 Effect of water content on the MT yield. (■) 5W/ZrO2973, (●) 10W/ZrO2973. Reaction conditions: reaction temperature=593K, GHSV=1000−1, P =0.5MPa, H2S/DMS=4.0, and catalyst: 2mL. Fig. 8 Catalytic performance for the 5W/ZrO2973 catalyst as a function of time on stream. Reaction conditions: reaction temperature=633K, GHSV=1000−1, P =0.5MPa, H2S/DMS=4.0, and catalyst: 2mL. Table 1 Physicochemical properties of tungsten–zirconium mixed oxides. Catalysts WO3 content (wt.%) Surface area (m2 g−1) Pore volume (cm3 g−1) Pore diameter (nm) W-surface density (w-atomnm−2) ZrO2773 – 68.2 0.17 3.7 – ZrO2873 – 39.5 0.17 6.4 – ZrO2973 – 20.6 0.14 11.9 – ZrO21073 – 12.9 0.07 12.9 – ZrO21173 – 10.4 0.10 20.8 – 2.5W/ZrO2973 2.17 29.7 0.18 9.8 1.90 5W/ZrO2973 4.19 32.9 0.15 8.0 3.31 7.5W/ZrO2973 5.75 38.9 0.17 8.1 3.84 10W/ZrO2973 7.15 43.1 0.18 7.5 4.31 15W/ZrO2973 9.49 53.0 0.17 8.9 4.65 20W/ZrO2973 13.95 76.5 0.21 8.7 4.74 Thiolation of dimethyl sulfide to methanethiol over WO3/ZrO2 catalysts Shiping Chen a Weiming Wang a Yuanhua Zhang a Yucai Wei b Weiping Fang a Yiquan Yang b ⁎ a Department of Chemical and Biochemical Engineering, College of Chemistry and Chemical Engineering, Xiamen University, Xiamen 361005, PR China b Department of Chemistry, College of Chemistry and Chemical Engineering, and National Engineering Laboratory for Green Chemical Productions of Alcohols, Ethers and Esters, Xiamen University, Xiamen 361005, PR China ⁎ Corresponding author. Tel.: +86 592 2180361; fax: +86 592 2180361. Graphical abstract Highlights ► The DMS and H2S were used to synthesize MT, an important chemical intermediate. ► The WO3/ZrO2 catalyst was first applied to the thiolation of DMS. ► The effect of water on the thiolation of DMS to MT was studied. The thiolation of dimethyl sulfide with H2S over a variety of tungsten–zirconia (WO3/ZrO2) catalysts with different contents of WO3 was studied. The maximum yield of methanethiol was obtained at the reaction temperature of 633K in the presence of 10wt.%WO3/ZrO2 catalyst. XRD, BET and TPD characterization results reveal that supporting WO3 species on ZrO2 gives rise to the improvement of both in structure stability and surface acidity. The MT yield increased first and then decreased with the increase of reaction temperature for all of the catalysts due to the decomposition of methanethiol and dimethyl sulfide. The optimum loading of WO3 was found to be 5–10wt.% (with a surface density of 3.5–4.5w-atomnm−2). Furthermore, the WO3/ZrO2 catalyst exhibits high resistance to water. Keywords Dimethyl sulfide Methanethiol Thiolation WO3/ZrO2 1 Introduction Methanethiol (CH3SH, MT) is an important chemical intermedium widely used in the production of pesticides, pharmaceuticals, petrochemicals, and especial for methionine synthesis [1,2]. During the last few years, with increasing stringently in the demand for methionine, there is a growing demand for methanethiol in order to meet the requirements [3,4]. The synthesis of methanethiol has received global attention, by now; several routes for its generation have been explored [5–12]. Industrially, methanethiol is mainly synthesized by thiolation of methanol with H2S, accompanying with the formation of dimethyl sulfide (CH3SCH3, DMS), a major byproduct [5]. However, dimethyl sulfide was incinerated as a wastegas generally. Beach [7] proposed first to recover dimethyl sulfide and used it as a feed for methanethiol synthesis, which performs in an independent by-pass reactor, during the synthesis of CH3SH from CH3OH and H2S, in such a way that the byproduct DMS can be converted to more valuable product MT. This is economically as well as environmentally attractive for better carbon management. The catalysts for this reaction were solid acid catalysts like γ-Al2O3 and P promoted Al2O3 [8,9]. The γ-Al2O3 catalyst is active; nevertheless, the major limitation for the usage of γ-Al2O3 is the existence of water in the recovered dimethyl sulfide, in which the content of water can achieve 5%, thereby loses its activity because of its hydrophilic nature. (1) CH3SCH3 +H2S→2CH3SH WO3/ZrO2 catalysts have received much attention in the recent catalysis field [13–16]. Hino and Arata [17] found that tungsten oxide-supported zirconia possesses appropriate superacid sites and smaller pore volume in comparison with other acid catalysts such as alumina or zeolite, and its application leads to effective downsizing of the reaction unit. Furthermore, the catalysts are extremely stable at high temperature in H2, O2 or H2O atmospheres [18,19]. Therefore, it is promising one to be used as a novel catalyst for the reaction of DMS with H2S. In the present work, we aimed to study the thiolation of DMS in the presence of pure ZrO2 and WO3/ZrO2 catalysts. The effect of catalyst preparation conditions, i.e. calcination temperature and tungsten loading on the catalyst performance was intensively studied. In addition, the effect of water content in the system on the reaction performance of the catalysts was explored as well. 2 Experimental 2.1 Catalyst preparation 2.1.1 Preparation of the ZrO2 support ZrO2 was prepared by the reverse precipitation method. Appropriate amount of 0.1M aqueous solution of zirconyl chloride (ZrOCl2·8H2O, Sinopharm Chemical Reagent Co., Ltd.) was added dropwise to ammonium hydroxide solution (NH4OH, 25%, Sinopharm Chemical Reagent Co., Ltd.) at room temperature under well-stirring. The pH of the solution was controlled at 9, when a buoyant white powder immediately produced. After stirring for 6h at room temperature, the precipitate was evaporated in oil bath at 373K, and then washed with deionized water five times, following by drying overnight at 383K to generate a sample Zirconium hydroxide Zr(OH)4. Finally, the sample was devised into several parts and calcined respectively at different temperatures (773, 873, 973, 1073 and 1173K) for 3h to get ZrO2 samples. The samples are designated as ZrO2773, ZrO2873, ZrO2973, ZrO21073 and ZrO21173. 2.1.2 Preparation of the WO3/ZrO2 catalysts The WO3/ZrO2 catalysts with various weight percentages (2.5, 5.0, 7.5 and 10%) were prepared by the incipient wetness impregnation in ammonium metatungstate solution (precursor (NH4)10W12O41·5H2O, 98% purity). The Zirconium hydroxide Zr(OH)4 sample was impregnated in the aqueous solution of calculated ammonium metatungstate. Then, the sample was dried overnight at 383K and calcined at 973K for 3h. The catalyst with x wt.% of WO3 was designated as xW/ZrO2; for example, 10wt.%WO3 supported on ZrO2973 is expressed as 10W/ZrO2973. 2.2 Reaction conditions DMS conversion reaction was conducted in a glass tubular fixed bed reactor with an internal diameter of 10mm typically, 2.0mL of the catalyst with 20–40 mesh was filled into the reactor, with a thin layer of glass fiber and a layer of quartz powder (20–40 mesh) covered on the catalyst. Before experiment, the catalyst was sulfurized with H2S for 1h at 673K for activating; the H2S flow rate was maintained by mass flow controller (Beijing Seven star, D08-1F). Then the sulfurized catalyst was tested at different temperatures (553, 573, 593, 613, 633, 653, 673 and 693K) in turn, and the system pressure was held at 0.5MPa with the aid of a back-pressure regulator. The DMS solution was injected into the catalyst bed by a precision metering pump (Beijing Satellite Manufactory, 2ZB-1L10). The outlet stream temperature was kept at 400K with heater band, and the effluent was analyzed by an on-line gas-chromatograph equipped with a Porapak Q (Ф2m×3mm) column connected to a thermal conductivity detector (TCD). To study the effect of H2O on the activity of the catalyst for the reaction, DMS with different contents of water, which was incorporated into DMS in advance by using a precision metering pump (Beijing Satellite Manufactory, 2ZB-1L10), was used as feedstock. 2.3 Catalyst characterization XRD measurements were performed on a Panalytical X’pert PRO X-ray diffractometer utilizing monochromatic Cu Kα radiation (λ =0.15418nm, tube voltage: 40kV, tube current: 30mA) in the 2θ range from 10° to 70°. The morphology of the catalyst was observed on field emission scanning electron microscopy (FE-SEM, LEO1530). X-ray photoelectron spectroscopy (XPS) was performed on a Phi Quantera spectrometer equipped with an aluminum anode (AlKα=1486.6eV) operated at 25W (15kV, 1.67mA). The surface areas of the catalysts were measured using nitrogen adsorption at 77K with a Micromeritics Tristar 3000 surface area and pore analyzer. Prior to N2 physisorption measurement, all samples were degassed at 393K for 1h and then evacuated at 573K for 3h to remove physically adsorbed impurities. The actual content of tungsten oxide in xW/ZrO2 samples were determined by a Bruker S8 TIGER X-ray fluorescence (XRF) spectrometer. NH3 and CO2 temperature-programmed desorption (TPD) were performed in a quartz tube reactor filled with 80mg catalyst. For NH3-TPD experiment, the catalyst was pretreated in Ar at 673K for 1h, then cooled to 323K, at which ammonia was adsorbed for about 0.5h in an ammonia stream of 30mLmin−1. Loosely bound NH3 was removed by Ar sweeping at 323K, and then the temperature was increased to 973K at a heating rate of 10Kmin−1. The desorbed NH3 was monitored with a MS signal of m/e =16 and 17 in multiple ion detection (MID) mode. So did the CO2-TPD experiment as NH3-TPD with CO2 substituting for NH3. The CO2-TPD experiment was conducted from 323 to 873K. Desorbed CO2 component was monitored with a MS signal of m/e =44 in MID mode. 3 Results and discussion 3.1 Structural properties The main physicochemical properties of the tungsten–zirconium mixed oxides are presented in Table 1 . The surface density of W species (w-atomnm−2) was calculated from Eq. (2) [15,20]. Increasing the calcination temperature of WO3-free zirconia led to a continuous decrease in the surface area owing to the sintering and crystallizing of amorphous zirconia support and significant pore collapse [14,16]; however, the surface area increased as increasing the WO3 loading at 973K, which can be attributed to the decrease of ZrO2 sintering rate caused by WO3 adding, meanwhile, the high resistance against ZrO2 sintering tends to getting finer pores. (2) S W = WC × ( 6.02 × 10 23 ) 100 × FW WO 3 × ( S BET × 10 18 ) where S W: W surface density (w-atomnm−2), WC: WO3 content (wt.%), FW WO 3 : formula weight of WO3 (231.8gmol−1), S BET: surface area (m2 g−1). The XRD patterns arising from ZrO2 catalysts calcined at the temperatures from 773 to 1173K and the WO3/ZrO2 catalysts with different WO3 concentrations are shown in Fig. 1(A) and (B). It can be seen that the crystallinity of ZrO2 in monoclinic phase increased with increasing the support calcination temperature. When WO3 was loaded onto ZrO2, the ratio of monoclinic phase to tetragonal phase decreased with increasing WO3 loading at 973K, providing further evidence of the stabilizing effect of surface WO3. These changes in the phase-transformation observed according to support calcination temperature and tungsten oxide loading are consistent with those reported in the literature [21–24]. No crystalline WO3 phase (2θ =23.2°, 23.7°, and 24.3°) can be detected even if the WO3 content being as high as 10wt.%, indicating that tungsten oxide was present in a highly dispersed manner. The SEM micrographs (Fig. 2 ) for ZrO2 and WO3/ZrO2 catalysts show similar quasi spherical morphological feature and the WO3/ZrO2 catalysts exhibit better uniformity, suggesting that tungsten species over throughout zirconia were well dispersed and could not crystallize separately. 3.2 Surface acid–base properties The intensities and quantities of acidic and basic sites on the catalysts were measured by NH3-TPD and CO2-TPD techniques, respectively; the experiment results obtained are presented in Fig. 3 . In contrast with pure ZrO2, the four WO3/ZrO2 catalysts mainly exhibit two peaks on the NH3-TPD curves. The low-temperature peak is assigned to ammonia desorbed from the weaker acid sites centered at around 400K, and the shoulder peak is due to ammonia desorbed from the stronger acid sites between 500 and 650K. The NH3-TPD spectra revealed that as the WO3 content increased, the areas of the TPD spectra increased, suggesting that the doping amount of tungsten oxide in the range of 2.5–10wt.% was responsible for the acidity and determined the quantities of surface acidic sites. On the other hand, the CO2 desorption occurred at the relatively low temperatures ranging from 330 to 390K, which can be assigned to weak basic sites for all of the catalysts. Notably, the area below the curves decreased as the WO3 content increased, which indicates that the surface basicity decreased due to the loading of tungsten oxide, the decrease trend is particularly significant for the 10W/ZrO2973. 3.3 Performance of pure WO3 and ZrO2 The reaction of H2S and DMS was carried out at 593K over pure WO3 and ZrO2 calcined at different temperatures. The initial activities and the activities after 3h reaction are summarized in Fig. 4 . The initial activity of pure WO3 was found to be maximal among these catalysts, but remarkable deactivation occurred in 3h time on stream. Calcining at lower temperatures (773–973K) made all of the ZrO2 catalysts showed a moderate conversion of DMS at about 15%; however, the conversion of DMS decreases for the catalysts calcined at higher temperatures (1073–1173K), this phenomenon can be due to the decrease in the catalyst surface area. Fortunately, the deactivation did not occur on the ZrO2 series in 3h time on stream. The formation of coke was confirmed to be the reason for the deactivation, the observation on the quick deactivation of pure WO3 may be attributed to coke deposition which cannot be removed immediately from the surface [25,26]. According to above results, a series of tungsten oxide catalysts with different tungsten contents loaded on ZrO2973 were investigated hereafter in detail. 3.4 Catalytic activity of WO3/ZrO2 Fig. 5 shows the effect of W contents on the performance of WO3/ZrO2 catalysts. The 10W/ZrO2973 catalyst exhibits the highest conversion of DMS, while the MT yield increased first and then decreased for all of the catalysts. The thiolation of DMS to MT is a simple reaction at relative low temperature with unique product MT [8,9,27,28], further increasing in reaction temperature is expected to aggravate the decomposition of DMS and MT themselves, generating a series of low hydrocarbon compounds (CH4, C2H6), element sulfur and carbon, as a result, lowering the MT yield. The tungsten oxide-supported ZrO2 catalysts exhibit higher conversion of DMS and yield of MT at relative lower reaction temperature in comparison with pure ZrO2973 sample, but when the reaction temperature rose up to 653K, the MT yield decreased fast for the strong decrease of the selectivity toward MT. This suggests that the catalysts with high content of WO3 own more acid sites, which contributed to violent decomposition of dimethyl sulfide and methanethiol, and decreased MT yield rapidly. We tested the 15W/ZrO2973 and 20W/ZrO2973 samples at 633K, and found that they got a DMS conversion close to 10W/ZrO2973, but the MT selectivity of these two catalysts were 88% and 84%, respectively. So, the optimum loading of WO3 was confirmed to be 5–10wt.%(with a surface density of 3.5–4.5w-atomnm−2). Fig. 6 shows XPS spectra due to the WO3/ZrO2 catalyst. Based on the XPS studies, most tungsten oxidation states in WO3/ZrO2 were found to be W6+, W5+and W4+ [29–31]. After reaction, the W6+ and W5+ cations totally transformed into W4+ cation, suggesting that the W4+ species participated in thiolation of DMS. Compared the curve (c) with (a), We found that after recalcined in air, the amount of W6+ cation seems to increase in contrast to the sample before reaction, meanwhile, the peak area of Zr4+ increases, suggesting that the recalcination may weaken the interaction between ZrO2 and WO3. However, the activity did not change, so we use the recalcined sample in the next water-adding test. 3.5 Effect of water content on the thiolation of DMS to MT over 5W/ZrO2973 and 10W/ZrO2973 It is well established that water present in feedstock exerts negative effect on the acid-catalyzed reactions [22,32]. In the γ-Al2O3 system, the presence of water during the thiolation reaction results in hydrolysis reaction, which eventually reduces the MT yield and speeds up the deactivation. Hence, in this study, the effect of water content (0–10%) added on the thiolation of DMS to MT was investigated at 593K. The results are shown in Fig. 7 . Fig. 7 indicates that the presence of water indeed lowered the yield of MT, especially when the water content is more than 5%, although the decreasing proportion is acceptable. Chu et al. [15] have demonstrated that WO3/ZrO2 have excellent surface hydrophobicity (the reciprocal of the density of water adsorbed). According to the reaction of H2S and DMS, the hydrophobic nature of the WO3/ZrO2 catalyst may reasonably guarantee the access of dimethyl sulfide to active sites and suppress the poisoning effect of water. 3.6 Effect of reaction time on the thiolation of DMS to MT Fig. 8 shows the effect of reaction time on the DMS conversion and MT selectivity catalyzed by 5W/ZrO2973 sample at 633K. It can be seen from the plot that a plateau of DMS conversion is attained in a short time of reaction (1h); the DMS conversion does not increase much with further increase in the reaction time even up to 12h. On the other hand, the MT selectivity maintained at a high and stable level for the whole 12h. 4 Conclusions Supporting WO3 species on ZrO2 gives rise to the improvements of both in structure stability and surface acidity. The activity of the series of WO3/ZrO2 catalysts increased remarkably depending upon the content of WO3 doped, The MT yield increased first and then decreased with the increase of reaction temperature especially for 10W/ZrO2973, the optimum loading of WO3 was found to be 5–10wt.% (with a surface density of 3.5–4.5w-atomnm−2). Furthermore, the WO3/ZrO2 catalyst exhibits high resistance to water, consequently, kept considerable yield of MT in the presence of water. Acknowledgement The authors acknowledge Chongqing Unisplendour Chemical Co., Ltd. for financial support. References [1] Y.Q. Yang S.J. Dai Y.Z. Yuan R.C. Lin D.L. Tang H.B. Zhang Appl. Catal. A 192 2000 175 180 [2] A.P. Chen Q. Wang Q.L. Li Y.J. Hao W.P. Fang J. Mol. Catal. A 283 2008 69 76 [3] W. Leuchtenberger K. Huthmacher K. Drauz Appl. Microbiol. Biotechnol. 69 2005 1 8 [4] O. Gutiérrez C. Kaufmann A. Hrabar Y. Zhu J. Lercher J. Catal. 280 2011 264 273 [5] C.P. Plaisance K.M. Dooley Catal. Lett. 128 2009 449 458 [6] Y.Q. Yang H. Yang Q. Wang L.J. Yu C. Wang S.J. Dai Y.Z. Yuan Catal. Lett. 74 2001 221 225 [7] L.K. Beach, US. Patent No. 2667515 (1954). [8] A.V. Mashkina Petrol. Chem. 49 2009 441 447 [9] S.P. Chen Y.H. Zhang M. Wu W.P. Fang Y.Q. Yang Appl. Catal. A: Gen. 431–432 2012 151 [10] G. Mul I.E. Wachs A.S. Hirschon Catal. Today 78 2003 327 337 [11] Y.J. Hao A.P. Chen Y.H. Zhang W.P. Fang Y.Q. Yang Catal. Lett. 129 2009 486 492 [12] Jan-Olaf Barth, US. Patent NO. 7576243 (2009). [13] T. Nishiguchi K. Oka T. Matsumoto H. Kanai K. Utani S. Imamura Appl. Catal. A 301 2006 66 74 [14] E.I. Ross-Medgaarden W.V. Knowles T. Kima M.S. Wong W. Zhou C.J. Kiely I.E. Wachs J. Catal. 256 2008 108 125 [15] W.L. Chu T. Echizen Y. Kamiy T. Okuhara Appl. Catal. A 259 2004 199 205 [16] C.D. Baertsch K.T. Komala Y. Chua E. Iglesia J. Catal. 205 2002 44 57 [17] M. Hino K. Arata J. Chem. Soc. Chem. Commun. 1988 1259 1260 [18] C.D. Baertsch S.L. Soled E. Iglesia J. Phys. Chem. B 105 2001 1320 1330 [19] L. Li Y. Yoshinaga T. Okuhara Phys. Chem. Chem. Phys. 1 1999 4913 4918 [20] N. Naito N. Katada M. Niwa J. Phys. Chem. B 103 1999 7206 7213 [21] M. Occhiuzzi D. Cordischi D. Gazzoli M. Valigi P.C. Heydorn Appl. Catal. A 269 2004 169 177 [22] P. Mongkolbovornkij V. Champreda W. Sutthisripok N. Laosiripojana Fuel Process. Technol. 91 2010 1510 1516 [23] E. Iglesia S.L. Soled G.M. Kramer J. Catal. 144 1993 238 253 [24] J.M. Komers R. Stloukal Eur. J. Lipid Sci. Technol. 103 2001 359 362 [25] A.V. Mashkina V.R. Gruncald B.P. Borodin V.I. Nasteka V.N. Yakovleva L.N. Khairulina React. Kinet. Catal. Lett. 43 1991 361 365 [26] Y.Q. Yang Y.Z. Yuan S.J. Dai B. Wang H.B. Zhang Catal. Lett. 54 1998 65 68 [27] S.N. Koshelev E.A. Paukshtis R.S. Sagitullin A.V. Bezrukov A.V. Mashkina React. Kinet. Catal. Lett. 27 1985 387 391 [28] C.N. Koshelev A.V. Mashkina N.G. Kalinina React. Kinet. Catal. Lett. 39 1987 367 372 [29] F.D. Gregorio V. Keller J. Catal. 225 2004 45 55 [30] F.D. Gregorio N. Keller V. Keller J. Catal. 256 2008 159 171 [31] C. Bigey L. Hilaire G. Maire J. Catal. 184 1999 406 420 [32] S.D. Kim S.C. Baek Y.J. Lee K.W. Jun M.J. Kim I.S. Yoo Appl. Catal. A 309 2006 139 143",
      "scopus-id": "84867472090",
      "coredata": {
        "eid": "1-s2.0-S1381116912002543",
        "dc:description": "The thiolation of dimethyl sulfide with H2S over a variety of tungsten–zirconia (WO3/ZrO2) catalysts with different contents of WO3 was studied. The maximum yield of methanethiol was obtained at the reaction temperature of 633K in the presence of 10wt.%WO3/ZrO2 catalyst. XRD, BET and TPD characterization results reveal that supporting WO3 species on ZrO2 gives rise to the improvement of both in structure stability and surface acidity. The MT yield increased first and then decreased with the increase of reaction temperature for all of the catalysts due to the decomposition of methanethiol and dimethyl sulfide. The optimum loading of WO3 was found to be 5–10wt.% (with a surface density of 3.5–4.5w-atomnm−2). Furthermore, the WO3/ZrO2 catalyst exhibits high resistance to water.",
        "openArchiveArticle": "false",
        "prism:coverDate": "2012-12-31",
        "openaccessUserLicense": null,
        "prism:aggregationType": "Journal",
        "prism:url": "https://api.elsevier.com/content/article/pii/S1381116912002543",
        "dc:creator": [
          {
            "@_fa": "true",
            "$": "Chen, Shiping"
          },
          {
            "@_fa": "true",
            "$": "Wang, Weiming"
          },
          {
            "@_fa": "true",
            "$": "Zhang, Yuanhua"
          },
          {
            "@_fa": "true",
            "$": "Wei, Yucai"
          },
          {
            "@_fa": "true",
            "$": "Fang, Weiping"
          },
          {
            "@_fa": "true",
            "$": "Yang, Yiquan"
          }
        ],
        "link": [
          {
            "@_fa": "true",
            "@rel": "self",
            "@href": "https://api.elsevier.com/content/article/pii/S1381116912002543"
          },
          {
            "@_fa": "true",
            "@rel": "scidir",
            "@href": "https://www.sciencedirect.com/science/article/pii/S1381116912002543"
          }
        ],
        "dc:format": "application/json",
        "openaccessType": null,
        "pii": "S1381-1169(12)00254-3",
        "prism:volume": "365",
        "prism:publisher": "Elsevier B.V.",
        "dc:title": "Thiolation of dimethyl sulfide to methanethiol over WO3/ZrO2 catalysts",
        "prism:copyright": "Copyright © 2012 Elsevier B.V. All rights reserved.",
        "openaccess": "0",
        "prism:issn": "13811169",
        "dcterms:subject": [
          {
            "@_fa": "true",
            "$": "Dimethyl sulfide"
          },
          {
            "@_fa": "true",
            "$": "Methanethiol"
          },
          {
            "@_fa": "true",
            "$": "Thiolation"
          },
          {
            "@_fa": "true",
            "$": "WO3/ZrO2"
          }
        ],
        "openaccessArticle": "false",
        "prism:publicationName": "Journal of Molecular Catalysis A: Chemical",
        "openaccessSponsorType": null,
        "prism:pageRange": "60-65",
        "prism:endingPage": "65",
        "pubType": "fla",
        "prism:coverDisplayDate": "December 2012",
        "prism:doi": "10.1016/j.molcata.2012.08.009",
        "prism:startingPage": "60",
        "dc:identifier": "doi:10.1016/j.molcata.2012.08.009",
        "openaccessSponsorName": null
      },
      "objects": {
        "object": [
          {
            "@category": "thumbnail",
            "@height": "15",
            "@width": "51",
            "@_fa": "true",
            "$": "https://api.elsevier.com/content/object/eid/1-s2.0-S1381116912002543-si2.gif?httpAccept=%2A%2F%2A",
            "@multimediatype": "GIF image file",
            "@type": "ALTIMG",
            "@size": "285",
            "@ref": "si2",
            "@mimetype": "image/gif"
          },
          {
            "@category": "thumbnail",
            "@height": "43",
            "@width": "254",
            "@_fa": "true",
            "$": "https://api.elsevier.com/content/object/eid/1-s2.0-S1381116912002543-si1.gif?httpAccept=%2A%2F%2A",
            "@multimediatype": "GIF image file",
            "@type": "ALTIMG",
            "@size": "1240",
            "@ref": "si1",
            "@mimetype": "image/gif"
          },
          {
            "@category": "standard",
            "@height": "294",
            "@width": "636",
            "@_fa": "true",
            "$": "https://api.elsevier.com/content/object/eid/1-s2.0-S1381116912002543-gr1.jpg?httpAccept=%2A%2F%2A",
            "@multimediatype": "JPEG image file",
            "@type": "IMAGE-DOWNSAMPLED",
            "@size": "49672",
            "@ref": "gr1",
            "@mimetype": "image/jpeg"
          },
          {
            "@category": "thumbnail",
            "@height": "101",
            "@width": "219",
            "@_fa": "true",
            "$": "https://api.elsevier.com/content/object/eid/1-s2.0-S1381116912002543-gr1.sml?httpAccept=%2A%2F%2A",
            "@multimediatype": "GIF image file",
            "@type": "IMAGE-THUMBNAIL",
            "@size": "3467",
            "@ref": "gr1",
            "@mimetype": "image/gif"
          },
          {
            "@category": "high",
            "@height": "1300",
            "@width": "2817",
            "@_fa": "true",
            "$": "https://api.elsevier.com/content/object/eid/1-s2.0-S1381116912002543-gr1_lrg.jpg?httpAccept=%2A%2F%2A",
            "@multimediatype": "JPEG image file",
            "@type": "IMAGE-HIGH-RES",
            "@size": "344971",
            "@ref": "gr1",
            "@mimetype": "image/jpeg"
          },
          {
            "@category": "standard",
            "@height": "207",
            "@width": "640",
            "@_fa": "true",
            "$": "https://api.elsevier.com/content/object/eid/1-s2.0-S1381116912002543-gr2.jpg?httpAccept=%2A%2F%2A",
            "@multimediatype": "JPEG image file",
            "@type": "IMAGE-DOWNSAMPLED",
            "@size": "66584",
            "@ref": "gr2",
            "@mimetype": "image/jpeg"
          },
          {
            "@category": "thumbnail",
            "@height": "71",
            "@width": "219",
            "@_fa": "true",
            "$": "https://api.elsevier.com/content/object/eid/1-s2.0-S1381116912002543-gr2.sml?httpAccept=%2A%2F%2A",
            "@multimediatype": "GIF image file",
            "@type": "IMAGE-THUMBNAIL",
            "@size": "7044",
            "@ref": "gr2",
            "@mimetype": "image/gif"
          },
          {
            "@category": "high",
            "@height": "917",
            "@width": "2833",
            "@_fa": "true",
            "$": "https://api.elsevier.com/content/object/eid/1-s2.0-S1381116912002543-gr2_lrg.jpg?httpAccept=%2A%2F%2A",
            "@multimediatype": "JPEG image file",
            "@type": "IMAGE-HIGH-RES",
            "@size": "761248",
            "@ref": "gr2",
            "@mimetype": "image/jpeg"
          },
          {
            "@category": "standard",
            "@height": "317",
            "@width": "656",
            "@_fa": "true",
            "$": "https://api.elsevier.com/content/object/eid/1-s2.0-S1381116912002543-gr3.jpg?httpAccept=%2A%2F%2A",
            "@multimediatype": "JPEG image file",
            "@type": "IMAGE-DOWNSAMPLED",
            "@size": "47960",
            "@ref": "gr3",
            "@mimetype": "image/jpeg"
          },
          {
            "@category": "thumbnail",
            "@height": "106",
            "@width": "219",
            "@_fa": "true",
            "$": "https://api.elsevier.com/content/object/eid/1-s2.0-S1381116912002543-gr3.sml?httpAccept=%2A%2F%2A",
            "@multimediatype": "GIF image file",
            "@type": "IMAGE-THUMBNAIL",
            "@size": "2800",
            "@ref": "gr3",
            "@mimetype": "image/gif"
          },
          {
            "@category": "high",
            "@height": "1403",
            "@width": "2904",
            "@_fa": "true",
            "$": "https://api.elsevier.com/content/object/eid/1-s2.0-S1381116912002543-gr3_lrg.jpg?httpAccept=%2A%2F%2A",
            "@multimediatype": "JPEG image file",
            "@type": "IMAGE-HIGH-RES",
            "@size": "295121",
            "@ref": "gr3",
            "@mimetype": "image/jpeg"
          },
          {
            "@category": "standard",
            "@height": "288",
            "@width": "395",
            "@_fa": "true",
            "$": "https://api.elsevier.com/content/object/eid/1-s2.0-S1381116912002543-gr4.jpg?httpAccept=%2A%2F%2A",
            "@multimediatype": "JPEG image file",
            "@type": "IMAGE-DOWNSAMPLED",
            "@size": "25721",
            "@ref": "gr4",
            "@mimetype": "image/jpeg"
          },
          {
            "@category": "thumbnail",
            "@height": "160",
            "@width": "219",
            "@_fa": "true",
            "$": "https://api.elsevier.com/content/object/eid/1-s2.0-S1381116912002543-gr4.sml?httpAccept=%2A%2F%2A",
            "@multimediatype": "GIF image file",
            "@type": "IMAGE-THUMBNAIL",
            "@size": "4202",
            "@ref": "gr4",
            "@mimetype": "image/gif"
          },
          {
            "@category": "high",
            "@height": "1275",
            "@width": "1749",
            "@_fa": "true",
            "$": "https://api.elsevier.com/content/object/eid/1-s2.0-S1381116912002543-gr4_lrg.jpg?httpAccept=%2A%2F%2A",
            "@multimediatype": "JPEG image file",
            "@type": "IMAGE-HIGH-RES",
            "@size": "118154",
            "@ref": "gr4",
            "@mimetype": "image/jpeg"
          },
          {
            "@category": "standard",
            "@height": "304",
            "@width": "395",
            "@_fa": "true",
            "$": "https://api.elsevier.com/content/object/eid/1-s2.0-S1381116912002543-gr5.jpg?httpAccept=%2A%2F%2A",
            "@multimediatype": "JPEG image file",
            "@type": "IMAGE-DOWNSAMPLED",
            "@size": "40751",
            "@ref": "gr5",
            "@mimetype": "image/jpeg"
          },
          {
            "@category": "thumbnail",
            "@height": "164",
            "@width": "213",
            "@_fa": "true",
            "$": "https://api.elsevier.com/content/object/eid/1-s2.0-S1381116912002543-gr5.sml?httpAccept=%2A%2F%2A",
            "@multimediatype": "GIF image file",
            "@type": "IMAGE-THUMBNAIL",
            "@size": "4858",
            "@ref": "gr5",
            "@mimetype": "image/gif"
          },
          {
            "@category": "high",
            "@height": "1344",
            "@width": "1749",
            "@_fa": "true",
            "$": "https://api.elsevier.com/content/object/eid/1-s2.0-S1381116912002543-gr5_lrg.jpg?httpAccept=%2A%2F%2A",
            "@multimediatype": "JPEG image file",
            "@type": "IMAGE-HIGH-RES",
            "@size": "307154",
            "@ref": "gr5",
            "@mimetype": "image/jpeg"
          },
          {
            "@category": "standard",
            "@height": "403",
            "@width": "641",
            "@_fa": "true",
            "$": "https://api.elsevier.com/content/object/eid/1-s2.0-S1381116912002543-gr6.jpg?httpAccept=%2A%2F%2A",
            "@multimediatype": "JPEG image file",
            "@type": "IMAGE-DOWNSAMPLED",
            "@size": "50930",
            "@ref": "gr6",
            "@mimetype": "image/jpeg"
          },
          {
            "@category": "thumbnail",
            "@height": "138",
            "@width": "219",
            "@_fa": "true",
            "$": "https://api.elsevier.com/content/object/eid/1-s2.0-S1381116912002543-gr6.sml?httpAccept=%2A%2F%2A",
            "@multimediatype": "GIF image file",
            "@type": "IMAGE-THUMBNAIL",
            "@size": "3744",
            "@ref": "gr6",
            "@mimetype": "image/gif"
          },
          {
            "@category": "high",
            "@height": "1785",
            "@width": "2840",
            "@_fa": "true",
            "$": "https://api.elsevier.com/content/object/eid/1-s2.0-S1381116912002543-gr6_lrg.jpg?httpAccept=%2A%2F%2A",
            "@multimediatype": "JPEG image file",
            "@type": "IMAGE-HIGH-RES",
            "@size": "341176",
            "@ref": "gr6",
            "@mimetype": "image/jpeg"
          },
          {
            "@category": "standard",
            "@height": "296",
            "@width": "387",
            "@_fa": "true",
            "$": "https://api.elsevier.com/content/object/eid/1-s2.0-S1381116912002543-gr7.jpg?httpAccept=%2A%2F%2A",
            "@multimediatype": "JPEG image file",
            "@type": "IMAGE-DOWNSAMPLED",
            "@size": "19998",
            "@ref": "gr7",
            "@mimetype": "image/jpeg"
          },
          {
            "@category": "thumbnail",
            "@height": "164",
            "@width": "214",
            "@_fa": "true",
            "$": "https://api.elsevier.com/content/object/eid/1-s2.0-S1381116912002543-gr7.sml?httpAccept=%2A%2F%2A",
            "@multimediatype": "GIF image file",
            "@type": "IMAGE-THUMBNAIL",
            "@size": "2042",
            "@ref": "gr7",
            "@mimetype": "image/gif"
          },
          {
            "@category": "high",
            "@height": "1313",
            "@width": "1715",
            "@_fa": "true",
            "$": "https://api.elsevier.com/content/object/eid/1-s2.0-S1381116912002543-gr7_lrg.jpg?httpAccept=%2A%2F%2A",
            "@multimediatype": "JPEG image file",
            "@type": "IMAGE-HIGH-RES",
            "@size": "85662",
            "@ref": "gr7",
            "@mimetype": "image/jpeg"
          },
          {
            "@category": "standard",
            "@height": "275",
            "@width": "390",
            "@_fa": "true",
            "$": "https://api.elsevier.com/content/object/eid/1-s2.0-S1381116912002543-gr8.jpg?httpAccept=%2A%2F%2A",
            "@multimediatype": "JPEG image file",
            "@type": "IMAGE-DOWNSAMPLED",
            "@size": "21058",
            "@ref": "gr8",
            "@mimetype": "image/jpeg"
          },
          {
            "@category": "thumbnail",
            "@height": "154",
            "@width": "219",
            "@_fa": "true",
            "$": "https://api.elsevier.com/content/object/eid/1-s2.0-S1381116912002543-gr8.sml?httpAccept=%2A%2F%2A",
            "@multimediatype": "GIF image file",
            "@type": "IMAGE-THUMBNAIL",
            "@size": "2291",
            "@ref": "gr8",
            "@mimetype": "image/gif"
          },
          {
            "@category": "high",
            "@height": "1218",
            "@width": "1729",
            "@_fa": "true",
            "$": "https://api.elsevier.com/content/object/eid/1-s2.0-S1381116912002543-gr8_lrg.jpg?httpAccept=%2A%2F%2A",
            "@multimediatype": "JPEG image file",
            "@type": "IMAGE-HIGH-RES",
            "@size": "98527",
            "@ref": "gr8",
            "@mimetype": "image/jpeg"
          },
          {
            "@category": "standard",
            "@height": "200",
            "@width": "259",
            "@_fa": "true",
            "$": "https://api.elsevier.com/content/object/eid/1-s2.0-S1381116912002543-fx1.jpg?httpAccept=%2A%2F%2A",
            "@multimediatype": "JPEG image file",
            "@type": "IMAGE-DOWNSAMPLED",
            "@size": "16580",
            "@ref": "fx1",
            "@mimetype": "image/jpeg"
          },
          {
            "@category": "thumbnail",
            "@height": "164",
            "@width": "212",
            "@_fa": "true",
            "$": "https://api.elsevier.com/content/object/eid/1-s2.0-S1381116912002543-fx1.sml?httpAccept=%2A%2F%2A",
            "@multimediatype": "GIF image file",
            "@type": "IMAGE-THUMBNAIL",
            "@size": "5384",
            "@ref": "fx1",
            "@mimetype": "image/gif"
          },
          {
            "@category": "high",
            "@height": "886",
            "@width": "1147",
            "@_fa": "true",
            "$": "https://api.elsevier.com/content/object/eid/1-s2.0-S1381116912002543-fx1_lrg.jpg?httpAccept=%2A%2F%2A",
            "@multimediatype": "JPEG image file",
            "@type": "IMAGE-HIGH-RES",
            "@size": "149903",
            "@ref": "fx1",
            "@mimetype": "image/jpeg"
          }
        ]
      },
      "link": {
        "@rel": "abstract",
        "@href": "https://api.elsevier.com/content/abstract/scopus_id/84867472090"
      }
    }
  }
}