{
  "metadata": {
    "title": "Partial hydrogenation of benzene over the metallic Zn modified Ru-based catalyst",
    "authors": "; ; ",
    "journal": "Journal of Molecular Catalysis A: Chemical",
    "date": "2009-08-18",
    "doi": "10.1016/j.molcata.2009.05.006",
    "abstract": "",
    "uri": "https://api.elsevier.com/content/article/pii/S1381116909002386",
    "pii": "S1381116909002386"
  },
  "fulltext": {
    "full-text-retrieval-response": {
      "scopus-eid": "2-s2.0-67651091536",
      "originalText": "serial JL 271358 291210 291744 291790 291809 31 Journal of Molecular Catalysis A: Chemical JOURNALMOLECULARCATALYSISACHEMICAL 2009-05-15 2009-05-15 2010-04-16T17:45:36 1-s2.0-S1381116909002386 S1381-1169(09)00238-6 S1381116909002386 10.1016/j.molcata.2009.05.006 S300 S300.1 FULL-TEXT 1-s2.0-S1381116909X00117 2015-05-15T05:56:33.307883-04:00 0 0 20090818 2009 2009-05-15T00:00:00Z articleinfo crossmark dco dateupdated tomb dateloaded datesearch indexeddate issuelist volumelist yearnav absattachment articletitlenorm authfirstinitialnorm authfirstsurnamenorm cid cids contenttype copyright dateloadedtxt docsubtype doctype doi eid ewtransactionid hubeid issfirst issn issnnorm itemstage itemtransactionid itemweight openaccess openarchive pg pgfirst pglast pii piinorm pubdatestart pubdatetxt pubyr sectiontitle sortorder srctitle srctitlenorm srctype subheadings volfirst volissue webpdf webpdfpagecount figure table body mmlmath affil articletitle auth authfirstini authfull authkeywords authlast primabst ref specialabst alllist content subj ssids 1381-1169 13811169 309 309 1 2 1 2 Volume 309, Issues 1–2 19 124 130 124 130 20090818 18 August 2009 2009-08-18 2009 Regular papers article fla Copyright © 2009 Elsevier B.V. All rights reserved. PARTIALHYDROGENATIONBENZENEOVERMETALLICZNMODIFIEDRUBASEDCATALYST YUAN P 1 Introduction 2 Theoretical and experimental methods 2.1 Experimental procedures 2.1.1 Preparation and evaluation of the Ru-Zn/ZrO2 catalyst 2.1.1.1 Preparation of the precursor 2.1.1.2 Reduction of the precursor 2.1.1.3 Evaluation of the catalyst 2.1.2 Characterization of the catalyst 2.2 Theoretical background 3 Results and discussion 3.1 Characterization of the prepared catalyst 3.2 Partial hydrogenation of benzene over Ru-Zn/ZrO2 catalyst 3.3 Adsorption of benzene and cyclohexene on the Ru(0001) surface 3.4 Adsorption of benzene and cyclohexene on the Ru-Zn/Ru(0001) surface 3.5 Effect of metallic Zn on the hydrogenation behavior 4 Conclusions References NAGAHARA 1997 448 451 H KLUSON 1995 13 31 P ANDERSON 1957 409 415 HOANGVAN 1984 210 214 C STAITI 1984 111 116 P HARRISON 1967 161 169 D RONCHIN 2001 363 369 L HU 2001 6099 6104 S SPINACE 2003 91 96 E FAN 2008 1394 1397 G LIU 2006 319 326 S LIU 2008 157 164 S WANG 2004 29 36 J BU 2008 2612 2615 J LIU 2009 282 287 J YUAN 2009 140 145 P NEFEDOV 1982 29 47 V GAARENSTROOM 1977 3500 3506 S LEY 1973 2392 2402 L SAEYS 2006 3121 3134 M DELBECQ 2008 555 566 F YUANX2009X124 YUANX2009X124X130 YUANX2009X124XP YUANX2009X124X130XP item S1381-1169(09)00238-6 S1381116909002386 1-s2.0-S1381116909002386 10.1016/j.molcata.2009.05.006 271358 2010-09-21T22:46:57.145862-04:00 2009-08-18 1-s2.0-S1381116909002386-main.pdf https://s3.amazonaws.com/prod-ucs-content-store-us-east/content/pii:S1381116909002386/MAIN/application/pdf/b9cacff96f9fdaa644b0d0077c32918a/main.pdf https://s3-eu-west-1.amazonaws.com/prod-ucs-content-store-eu-west/content/pii:S1381116909002386/MAIN/application/pdf/b9cacff96f9fdaa644b0d0077c32918a/main.pdf main.pdf pdf true 979173 MAIN 7 1-s2.0-S1381116909002386-main_1.png https://s3.amazonaws.com/prod-ucs-content-store-us-east/content/pii:S1381116909002386/PREVIEW/image/png/9af488e75d1480962f1e86e4eb117b32/main_1.png https://s3-eu-west-1.amazonaws.com/prod-ucs-content-store-eu-west/content/pii:S1381116909002386/PREVIEW/image/png/9af488e75d1480962f1e86e4eb117b32/main_1.png main_1.png png 60662 849 656 IMAGE-WEB-PDF 1 1-s2.0-S1381116909002386-si4.gif https://s3.amazonaws.com/prod-ucs-content-store-us-east/content/pii:S1381116909002386/STRIPIN/image/gif/6f6746b7a547439339226e6e76060878/si4.gif https://s3-eu-west-1.amazonaws.com/prod-ucs-content-store-eu-west/content/pii:S1381116909002386/STRIPIN/image/gif/6f6746b7a547439339226e6e76060878/si4.gif si4 si4.gif gif 604 16 170 ALTIMG 1-s2.0-S1381116909002386-si3.gif https://s3.amazonaws.com/prod-ucs-content-store-us-east/content/pii:S1381116909002386/STRIPIN/image/gif/a9389b88bc1155be1d05d2cbf8442c9e/si3.gif https://s3-eu-west-1.amazonaws.com/prod-ucs-content-store-eu-west/content/pii:S1381116909002386/STRIPIN/image/gif/a9389b88bc1155be1d05d2cbf8442c9e/si3.gif si3 si3.gif gif 708 16 249 ALTIMG 1-s2.0-S1381116909002386-si2.gif https://s3.amazonaws.com/prod-ucs-content-store-us-east/content/pii:S1381116909002386/STRIPIN/image/gif/782e37ee154cb834d1e971683a0e43f8/si2.gif https://s3-eu-west-1.amazonaws.com/prod-ucs-content-store-eu-west/content/pii:S1381116909002386/STRIPIN/image/gif/782e37ee154cb834d1e971683a0e43f8/si2.gif si2 si2.gif gif 168 15 24 ALTIMG 1-s2.0-S1381116909002386-si1.gif https://s3.amazonaws.com/prod-ucs-content-store-us-east/content/pii:S1381116909002386/STRIPIN/image/gif/782e37ee154cb834d1e971683a0e43f8/si2.gif https://s3-eu-west-1.amazonaws.com/prod-ucs-content-store-eu-west/content/pii:S1381116909002386/STRIPIN/image/gif/782e37ee154cb834d1e971683a0e43f8/si2.gif si1 si1.gif gif 168 15 24 ALTIMG 1-s2.0-S1381116909002386-gr1.jpg https://s3.amazonaws.com/prod-ucs-content-store-us-east/content/pii:S1381116909002386/gr1/DOWNSAMPLED/image/jpeg/8c881f379bac0e45171ad714f3fe1909/gr1.jpg https://s3-eu-west-1.amazonaws.com/prod-ucs-content-store-eu-west/content/pii:S1381116909002386/gr1/DOWNSAMPLED/image/jpeg/8c881f379bac0e45171ad714f3fe1909/gr1.jpg gr1 gr1.jpg jpg 53117 302 376 IMAGE-DOWNSAMPLED 1-s2.0-S1381116909002386-gr1.sml https://s3.amazonaws.com/prod-ucs-content-store-us-east/content/pii:S1381116909002386/gr1/THUMBNAIL/image/gif/a9731abadbebd2ac910480df3bceaf84/gr1.sml https://s3-eu-west-1.amazonaws.com/prod-ucs-content-store-eu-west/content/pii:S1381116909002386/gr1/THUMBNAIL/image/gif/a9731abadbebd2ac910480df3bceaf84/gr1.sml gr1 gr1.sml sml 11815 164 204 IMAGE-THUMBNAIL 1-s2.0-S1381116909002386-gr2.jpg https://s3.amazonaws.com/prod-ucs-content-store-us-east/content/pii:S1381116909002386/gr2/DOWNSAMPLED/image/jpeg/daed9ab88a0afdb6b937ad949a4b9dcf/gr2.jpg https://s3-eu-west-1.amazonaws.com/prod-ucs-content-store-eu-west/content/pii:S1381116909002386/gr2/DOWNSAMPLED/image/jpeg/daed9ab88a0afdb6b937ad949a4b9dcf/gr2.jpg gr2 gr2.jpg jpg 13487 263 381 IMAGE-DOWNSAMPLED 1-s2.0-S1381116909002386-gr2.sml https://s3.amazonaws.com/prod-ucs-content-store-us-east/content/pii:S1381116909002386/gr2/THUMBNAIL/image/gif/c67b59866f09af156a7c6b9279e590ed/gr2.sml https://s3-eu-west-1.amazonaws.com/prod-ucs-content-store-eu-west/content/pii:S1381116909002386/gr2/THUMBNAIL/image/gif/c67b59866f09af156a7c6b9279e590ed/gr2.sml gr2 gr2.sml sml 2501 151 219 IMAGE-THUMBNAIL 1-s2.0-S1381116909002386-gr3.jpg https://s3.amazonaws.com/prod-ucs-content-store-us-east/content/pii:S1381116909002386/gr3/DOWNSAMPLED/image/jpeg/7d512a3d172e4992b61187b911b4bd8b/gr3.jpg https://s3-eu-west-1.amazonaws.com/prod-ucs-content-store-eu-west/content/pii:S1381116909002386/gr3/DOWNSAMPLED/image/jpeg/7d512a3d172e4992b61187b911b4bd8b/gr3.jpg gr3 gr3.jpg jpg 22891 279 378 IMAGE-DOWNSAMPLED 1-s2.0-S1381116909002386-gr3.sml https://s3.amazonaws.com/prod-ucs-content-store-us-east/content/pii:S1381116909002386/gr3/THUMBNAIL/image/gif/afc11738d1dd0a8e79e4b7ecf9bcb11a/gr3.sml https://s3-eu-west-1.amazonaws.com/prod-ucs-content-store-eu-west/content/pii:S1381116909002386/gr3/THUMBNAIL/image/gif/afc11738d1dd0a8e79e4b7ecf9bcb11a/gr3.sml gr3 gr3.sml sml 4946 162 219 IMAGE-THUMBNAIL 1-s2.0-S1381116909002386-gr4.jpg https://s3.amazonaws.com/prod-ucs-content-store-us-east/content/pii:S1381116909002386/gr4/DOWNSAMPLED/image/jpeg/a5080c13bc3e1da9ebc26a94e21947fe/gr4.jpg https://s3-eu-west-1.amazonaws.com/prod-ucs-content-store-eu-west/content/pii:S1381116909002386/gr4/DOWNSAMPLED/image/jpeg/a5080c13bc3e1da9ebc26a94e21947fe/gr4.jpg gr4 gr4.jpg jpg 17519 266 394 IMAGE-DOWNSAMPLED 1-s2.0-S1381116909002386-gr4.sml https://s3.amazonaws.com/prod-ucs-content-store-us-east/content/pii:S1381116909002386/gr4/THUMBNAIL/image/gif/d8e79d60535fe3206f375a42b3071825/gr4.sml https://s3-eu-west-1.amazonaws.com/prod-ucs-content-store-eu-west/content/pii:S1381116909002386/gr4/THUMBNAIL/image/gif/d8e79d60535fe3206f375a42b3071825/gr4.sml gr4 gr4.sml sml 2925 148 219 IMAGE-THUMBNAIL 1-s2.0-S1381116909002386-gr5.jpg https://s3.amazonaws.com/prod-ucs-content-store-us-east/content/pii:S1381116909002386/gr5/DOWNSAMPLED/image/jpeg/7ee134d0d2a63f6214e305422167439e/gr5.jpg https://s3-eu-west-1.amazonaws.com/prod-ucs-content-store-eu-west/content/pii:S1381116909002386/gr5/DOWNSAMPLED/image/jpeg/7ee134d0d2a63f6214e305422167439e/gr5.jpg gr5 gr5.jpg jpg 19879 265 384 IMAGE-DOWNSAMPLED 1-s2.0-S1381116909002386-gr5.sml https://s3.amazonaws.com/prod-ucs-content-store-us-east/content/pii:S1381116909002386/gr5/THUMBNAIL/image/gif/e8eb388224e671040e9a1433977bfc04/gr5.sml https://s3-eu-west-1.amazonaws.com/prod-ucs-content-store-eu-west/content/pii:S1381116909002386/gr5/THUMBNAIL/image/gif/e8eb388224e671040e9a1433977bfc04/gr5.sml gr5 gr5.sml sml 3321 151 219 IMAGE-THUMBNAIL 1-s2.0-S1381116909002386-gr6.jpg https://s3.amazonaws.com/prod-ucs-content-store-us-east/content/pii:S1381116909002386/gr6/DOWNSAMPLED/image/jpeg/ed2856a19be9908d07370a5a38a69979/gr6.jpg https://s3-eu-west-1.amazonaws.com/prod-ucs-content-store-eu-west/content/pii:S1381116909002386/gr6/DOWNSAMPLED/image/jpeg/ed2856a19be9908d07370a5a38a69979/gr6.jpg gr6 gr6.jpg jpg 41694 215 446 IMAGE-DOWNSAMPLED 1-s2.0-S1381116909002386-gr6.sml https://s3.amazonaws.com/prod-ucs-content-store-us-east/content/pii:S1381116909002386/gr6/THUMBNAIL/image/gif/85a9a91d46fa67021fcf9693b28a0b1c/gr6.sml https://s3-eu-west-1.amazonaws.com/prod-ucs-content-store-eu-west/content/pii:S1381116909002386/gr6/THUMBNAIL/image/gif/85a9a91d46fa67021fcf9693b28a0b1c/gr6.sml gr6 gr6.sml sml 6158 105 219 IMAGE-THUMBNAIL 1-s2.0-S1381116909002386-gr7.jpg https://s3.amazonaws.com/prod-ucs-content-store-us-east/content/pii:S1381116909002386/gr7/DOWNSAMPLED/image/jpeg/e1d35098a413ffa091e90c477dd454f8/gr7.jpg https://s3-eu-west-1.amazonaws.com/prod-ucs-content-store-eu-west/content/pii:S1381116909002386/gr7/DOWNSAMPLED/image/jpeg/e1d35098a413ffa091e90c477dd454f8/gr7.jpg gr7 gr7.jpg jpg 42582 182 536 IMAGE-DOWNSAMPLED 1-s2.0-S1381116909002386-gr7.sml https://s3.amazonaws.com/prod-ucs-content-store-us-east/content/pii:S1381116909002386/gr7/THUMBNAIL/image/gif/c39439dd9591114e2e94f6a2e7708704/gr7.sml https://s3-eu-west-1.amazonaws.com/prod-ucs-content-store-eu-west/content/pii:S1381116909002386/gr7/THUMBNAIL/image/gif/c39439dd9591114e2e94f6a2e7708704/gr7.sml gr7 gr7.sml sml 5022 74 219 IMAGE-THUMBNAIL 1-s2.0-S1381116909002386-gr8.jpg https://s3.amazonaws.com/prod-ucs-content-store-us-east/content/pii:S1381116909002386/gr8/DOWNSAMPLED/image/jpeg/fe893f7e2dbe1a58b059b5e32f363509/gr8.jpg https://s3-eu-west-1.amazonaws.com/prod-ucs-content-store-eu-west/content/pii:S1381116909002386/gr8/DOWNSAMPLED/image/jpeg/fe893f7e2dbe1a58b059b5e32f363509/gr8.jpg gr8 gr8.jpg jpg 49136 246 498 IMAGE-DOWNSAMPLED 1-s2.0-S1381116909002386-gr8.sml https://s3.amazonaws.com/prod-ucs-content-store-us-east/content/pii:S1381116909002386/gr8/THUMBNAIL/image/gif/02970ccc3ecee6e4221b077bc272d9da/gr8.sml https://s3-eu-west-1.amazonaws.com/prod-ucs-content-store-eu-west/content/pii:S1381116909002386/gr8/THUMBNAIL/image/gif/02970ccc3ecee6e4221b077bc272d9da/gr8.sml gr8 gr8.sml sml 9522 108 219 IMAGE-THUMBNAIL 1-s2.0-S1381116909002386-gr9.jpg https://s3.amazonaws.com/prod-ucs-content-store-us-east/content/pii:S1381116909002386/gr9/DOWNSAMPLED/image/jpeg/1443aac046cf01c39b555471f0239990/gr9.jpg https://s3-eu-west-1.amazonaws.com/prod-ucs-content-store-eu-west/content/pii:S1381116909002386/gr9/DOWNSAMPLED/image/jpeg/1443aac046cf01c39b555471f0239990/gr9.jpg gr9 gr9.jpg jpg 50303 221 614 IMAGE-DOWNSAMPLED 1-s2.0-S1381116909002386-gr9.sml https://s3.amazonaws.com/prod-ucs-content-store-us-east/content/pii:S1381116909002386/gr9/THUMBNAIL/image/gif/75a8cbc26be0ad85293b6cdd9bdee2de/gr9.sml https://s3-eu-west-1.amazonaws.com/prod-ucs-content-store-eu-west/content/pii:S1381116909002386/gr9/THUMBNAIL/image/gif/75a8cbc26be0ad85293b6cdd9bdee2de/gr9.sml gr9 gr9.sml sml 5124 79 219 IMAGE-THUMBNAIL 1-s2.0-S1381116909002386-fx1.jpg https://s3.amazonaws.com/prod-ucs-content-store-us-east/content/pii:S1381116909002386/fx1/DOWNSAMPLED/image/jpeg/a83e207ab2b61ae2f74e724a6bd5fc53/fx1.jpg https://s3-eu-west-1.amazonaws.com/prod-ucs-content-store-eu-west/content/pii:S1381116909002386/fx1/DOWNSAMPLED/image/jpeg/a83e207ab2b61ae2f74e724a6bd5fc53/fx1.jpg fx1 true fx1.jpg jpg 25670 155 192 IMAGE-DOWNSAMPLED 1-s2.0-S1381116909002386-fx1.sml https://s3.amazonaws.com/prod-ucs-content-store-us-east/content/pii:S1381116909002386/fx1/THUMBNAIL/image/gif/d10578b2b7b28320ff177e7fba92f4c9/fx1.sml https://s3-eu-west-1.amazonaws.com/prod-ucs-content-store-eu-west/content/pii:S1381116909002386/fx1/THUMBNAIL/image/gif/d10578b2b7b28320ff177e7fba92f4c9/fx1.sml fx1 true fx1.sml sml 11816 164 203 IMAGE-THUMBNAIL MOLCAA 7544 S1381-1169(09)00238-6 10.1016/j.molcata.2009.05.006 Elsevier B.V. Fig. 1 Schematic of a benzene molecule adsorbed on a 4×4 four-layer Ru-Zn/Ru(0001) slab; surface concentration of Zn atoms: 1/16; green balls represent Ru atoms and the yellow one Zn atom. (For interpretation of the references to color in this figure legend, the reader is referred to the web version of the article.) Fig. 2 XPS spectrum of Ru-Zn/ZrO2 catalyst reduced in the water phase containing ZnSO4 of 0.55M. Fig. 3 Effect of Zn2+ concentration in the water phase on the crystal pattern of the prepared Ru-Zn/ZrO2 catalyst; Zn2+ concentration: (A) 0.00M, (B) 0.35M, and (C) 0.55M. Fig. 4 Effect of Zn content in the Ru-Zn/ZrO2 catalyst on the partial hydrogenation of benzene; Zn2+ concentration in the water phase: 0.45M; Zn content in the catalyst: (A) 2.42wt.% and (B) 2.72wt.%. Fig. 5 Effect of Zn content in the Ru-Zn/ZrO2 catalyst on the partial hydrogenation of benzene; Zn2+ concentration in the water phase: 0.55M; Zn content in the catalyst: (A) 2.42wt.% and (B) 2.72wt.%,C 2.95wt.%. Fig. 6 Adsorbed benzene and cyclohexene molecules on the Ru(0001) surface with the lowest energy; the red line marks the cross-section for the charge density analysis; (1) benzene/hcp site, (2) benzene/fcc site, and (3) cyclohexene/atop site. (For interpretation of the references to color in this figure legend, the reader is referred to the web version of the article.) Fig. 7 Initial guess to the adsorption configuration of benzene and cyclohexene molecules on the Ru-Zn/Ru(0001) surface in the case of the adsorption site involving a Zn atom; The yellow ball represents a Zn atom; the red line marks the cross-section for the charge density analysis; benzene: (1) hcp/c1 site, (2) hcp/c2 site; cyclohexene: (3) atop site, (4) Ru-Zn bridge site. (For interpretation of the references to color in this figure legend, the reader is referred to the web version of the article.) Fig. 8 Charge density on the cross-section of the benzene molecule adsorbed Ru(0001) surface and Ru-Zn/Ru(0001) surface; (1) based on Fig. 6-1, (2) based on Fig. 7-1. Fig. 9 Adsorbed benzene and cyclohexene molecules on the Ru-Zn/Ru(0001) surface whose adsorption site leaves away from the Zn atom; the yellow ball represents a Zn atom; benzene: (1) and (2) hcp/c2 site; cyclohexene: (3) and (4) atop site. (For interpretation of the references to color in this figure legend, the reader is referred to the web version of the article.) Table 1 Effect of Zn2+ concentration in the water phase on the Zn content of the prepared Ru-Zn/ZrO2 catalyst. Zn2+ concentration (M) 0.35 0.45 0.55 Zn content of the catalyst (wt.%) 2.42 2.72 2.95 Table 2 Adsorption parameters corresponding to the adsorbed benzene and cyclohexene molecules with the lowest energy. Adsorption configuration Benzene Cyclohexene hcp fcc atop ΔH (kJ/mol) −139.51 −139.92 −57.47 a CC bond length (Å) 1.44 1.44 1.42 b ΔΦ (eV) −1.05 −0.99 −0.19 a Bond length of the CC conjugate bond of a benzene molecule and a cyclohexene molecule in the vacuum is 1.40Å and 1.34Å, respectively. b Work function of the Ru(0001) surface: 5.17eV. Table 3 Adsorption parameters of the adsorbed benzene and cyclohexene molecules on the Ru-Zn/Ru(0001) surface in the case of adsorption sites involving a Zn atom. Benzene Cyclohexene Initial position hcp/c1 hcp/c1 atop Bridge Zn-Ru Final position hcp/c1 hcp/c1 atop Bridge Ru-Ru ΔH (kJ/mol) −47.51 −50.92 <10 −15.29 Table 4 Adsorption parameters of the adsorbed benzene and cyclohexene molecules on the Ru-Zn/Ru(0001) surface in the case of adsorption sites in varied distance from the Zn atom. Benzene Cyclohexene Adsorption configuration Fig. 9-1 Fig. 9-2 Fig. 9-3 Fig. 9-4 ΔH (kJ/mol) −142.53 −142.44 −32.76 −34.95 Table 5 Red shift of CC stretching frequency of a cyclohexene molecule adsorbed on the Ru(0001) surface and Ru-Zn/Ru(0001) surface alloy. Ru(0001) Ru-Zn/Ru(0001) Adsorption configuration Fig. 6-3 Fig. 9-3 Fig. 9-4 a Δν (cm−1) −171.81 −149.4 −152.2 a ν CC stretching of a cyclohexene molecule in the vacuum: 1614.39cm−1. Partial hydrogenation of benzene over the metallic Zn modified Ru-based catalyst Pei-Qing Yuan a ⁎ Bing-Qiang Wang b Yue-Ming Ma a Hui-Min He a Zhen-Min Cheng a Wei-Kang Yuan a a State Key Laboratory of Chemical Engineering, East China University of Science and Technology, 130 Meilong Road, Shanghai 200237, PR China b Shanghai Supercomputer Center, Shanghai 201203, PR China ⁎ Corresponding author. Tel.: +86 21 64253529; fax: +86 21 64253528. Graphical abstract From the adsorption point of view, partial hydrogenation of benzene over metallic Zn modified Ru-based catalyst was investigated. Theoretical calculation suggests that chemisorption of benzene and cyclohexene on the modified catalyst is both restrained, and the latter is much more serious than the former. A reduced catalytic activity but improved selectivity to cyclohexene therefore is experimentally observed. From the adsorption point of view, partial hydrogenation of benzene to cyclohexene over the metallic Zn modified Ru-based catalyst was experimentally and theoretically investigated. A decreased hydrogenation activity but increased selectivity to cyclohexene over the prepared Ru-Zn/ZrO2 catalyst was observed in the partial hydrogenation of benzene. Theoretical calculations suggest that the above phenomena are mainly resulted from the depression of the chemisorption of benzene and cyclohexene on the modified catalyst, especially for the latter. Undesired deep hydrogenation from cyclohexene to cyclohexane in the middle and late reaction stage therefore is effectively retarded, by which an improved cyclohexene yield is guaranteed. An optimal Zn content of 2.72wt.% in the Ru-based catalyst was proposed by both the experiment and calculation for the partial hydrogenation of benzene, and a cyclohexene yield up to 44% was obtained over Ru-Zn/ZrO2 catalyst. Keywords Partial hydrogenation Benzene Alloy catalyst DFT Metallic Zn 1 Introduction Partial hydrogenation of benzene, which is first industrialized by Asahi Chemical Industry Co. in 1989, is of vital importance to the environmentally benign production of caprolactam. Compared with the traditional hydrogenation processes, Asahi technology features some unique characteristics as follows: the hydrogenation is applied in a tetra-phase reaction system; the hydrophilic Ru-based catalyst is suspended in a water phase containing a large amount of ZnSO4 [1–4]. The presence of the water phase effectively blocks the re-adsorption of cyclohexene from the organic phase onto the catalyst surface since the solubility of cyclohexene in the water phase is only 1/17 that of benzene at the reaction temperature of 418K. ZnSO4 dissolved in the water phase is considered to serve a dual purpose. First, direct hydrogenation from benzene to cyclohexane is prohibited because of the adsorption of Zn2+ at the most active sites. Second, the hydrophilicity of the catalyst surface is improved in the presence of Zn2+, which is unfavorable for the adsorption of cyclohexene [5]. Numerous efforts were devoted to the development of novel catalysts for this system, and now researchers have come to some agreements in this field. • The active component of the catalysts is limited to the Ru metal. Extremely poor cyclohexene yield once was reported over the Ni membrane and nylon supported Pt, which means the adsorption behavior or surface reaction mechanism of the involved species over the Ru metal should be widely different from that over other group VIII metals [6–9]. • Non-porous supports, e.g. ZrO2, TiO2 and SiO2, are preferentially adopted to avoid deep hydrogenation of cyclohexene during the pore diffusion [10,11]. • Measures to improve the hydrophilicity of the catalyst, such as the adsorption of organic additives, are advantageous to the selectivity to cyclohexene [12,13]. The latest work focused on the surface modification of the Ru-based catalysts. Liu et al. developed amorphous alloy catalysts Ru-M-B/ZrO2 (M=La, Fe) and a cyclohexene yield as high as 53.2% was observed over Ru-La-B/ZrO2 [14,15]. La3+ or in metallic state was supposed to stabilize the amorphous alloy structure and improve the activity and selectivity of the catalysts. By reducing the precursor in the ZnSO4 contained water phase, Fan et al. introduced metallic Zn into the Ru-based catalyst and obtained a 43% cyclohexene yield over the prepared Ru-Zn/ZrO2 [16]. Detailed roles of metallic Zn in the catalytic system were not explicitly explained. Recently, Qiao et al. prepared Ru-M/SBA-15 catalysts (M=Sn, Fe, Ba, Ce) by a “two solvents” impregnation method [17,18]. A satisfied cyclohexene yield up to 53.8% was reported over Ru-Ce/SBA-15. The beneficial effect of the Ce promoter on the selectivity to cyclohexene was ascribed to the enhancement of the hydrophilicity of the catalyst and to the electron transfer between the Ce(III) species and metallic Ru. By the reported cyclohexene yield, Ru-Zn/ZrO2 surely is not the most distinguished one among the above mentioned catalysts. However, investigation on its performance concerns a common problem in the partial hydrogenation of benzene; that is, the adsorbed Zn2+ ions can be reduced since the reaction between the Zn2+ ion and the adsorbed H atom has a negative reaction enthalpy [16]. In other words, the presence of metallic Zn in the bulk phase or on the surface of the Ru-based catalyst is just a general phenomenon no matter it is introduced during the reduction treatment of the precursor or during the partial hydrogenation of benzene. Considering the reaction pathway of heterogeneous catalysis, the authors propose that the chemisorption of benzene and cyclohexene as well as their sequential hydrogenation kinetics should be affected by the presence of metallic Zn in the Ru-based catalyst. On the basis of the authors’ previous work, chemisorption and hydrogenation kinetics of cyclohexene on the metallic Zn modified Ru-based catalyst are both seriously depressed [19]. In order to present a comprehensive understanding to the roles of metallic Zn in the Ru-based catalysts, in this work partial hydrogenation of benzene over Ru-Zn/ZrO2 was further studied from the adsorption point of view with the combination of the surface characterization, hydrogenation experiment and theoretical calculation. 2 Theoretical and experimental methods 2.1 Experimental procedures 2.1.1 Preparation and evaluation of the Ru-Zn/ZrO2 catalyst 2.1.1.1 Preparation of the precursor The catalyst was prepared by the coprecipitation method. At ambient temperature and under vigorous agitation, 60ml ZrOCl2 solution of 0.2M was added dropwise into a three-neck flask containing 100ml KOH solution of 0.2M within 2min. The suspension was then heated and thermostated at 353K. After that, 150ml RuCl3 solution of 0.025M was added into the suspension at a flow rate of 3ml/min. The obtained precipitation was aged at ambient temperature overnight, followed by centrifugal wash with deionized water till no chlorine ions were detected. 2.1.1.2 Reduction of the precursor The precursor, a certain amount of ZnSO4, 150ml deionized water and 80ml benzene were loaded into an autoclave with a capacity of 500ml. This autoclave also was used in the subsequent hydrogenation. After sealing and purging with low pressure H2 several times, the reduction was carried out at a temperature of 453K and P H 2 of 5.0MPa for 8h to ensure a thorough reduction of active components. 2.1.1.3 Evaluation of the catalyst In each run, a certain amount of ZnSO4, 2.0g catalyst, 80ml benzene and 150ml deionized water were loaded into the autoclave. Then, the hydrogenation was carried out at 418K and P H 2 of 5.0MPa, the fluctuation of the reaction temperature and pressure being controlled within ±0.5K and ±0.1MPa, respectively. A stirring rate of 1500rpm was adopted to eliminate the effect of external diffusion on the hydrogenation kinetics. Organic phase was sampled at a fixed time interval of 10min, the obtained samples being analyzed on a HP6890 gas chromatograph equipped with a PEG 20,000 capillary column. 2.1.2 Characterization of the catalyst Before characterization, the Ru-Zn/ZrO2 catalyst was treated by centrifugal wash with deionized water in order to remove the adsorbed Zn2+. Valence state of the elements on the catalyst surface was analyzed on a Kratos Axis Ultra DLD X-ray photoelectron spectrograph. Powder X-ray diffraction patterns of the catalysts were detected on a Bruker D8 advance X-ray diffractometer using Ni-filtered Cu Kα radiation. The tube voltage was 40kV and the current was 40mA. The composition analysis of the catalysts was performed on an IRIS Intrepid inductively coupled plasma instrument. 2.2 Theoretical background The ruthenium metal has a hexagonal crystal structure. In this work, it was found that metallic Zn in the Ru-Zn/ZrO2 catalyst exists mainly on the surface of the Ru microcrystal to form a Ru-Zn alloy. Therefore, theoretical calculations on the adsorption of benzene and cyclohexene were based on the closest packing plane of the Ru metal, i.e. (0001) surface, and on the Ru-Zn/Ru(0001) surface alloy to simulation the adsorption occurred on the traditional Ru-based and Ru-Zn alloy catalyst, respectively. The Ru-Zn/Ru(0001) surface alloy was constructed by replacing the Ru atom with the Zn atom on the upmost layer of the Ru(0001) surface. The calculations were performed with the Vienna ab initio Simulation Package (VASP). This program performs periodic calculations based on the density functional theory (DFT) with a plane-wave basis set. The projector-augmented wave (PAW) method and the generalized gradient approximation (GGA) level with the functional of PW91 were used. A cutoff of 400eV was applied to the plane-wave basis set, which allowed convergence to 0.01eV in the total energy. All structures were optimized until the forces on all unconstrained atoms were less than 0.01eV/Å. The Ru(0001) surface and Ru-Zn/Ru(0001) surface alloy were modeled by a periodic 4×4 four-layer slab, the latter containing a single Zn atom on its first layer, refer to Fig. 1 . The top two layers of the four substrate layers were allowed to relax, together with the adsorbate layer. The bottom two layers were kept fixed in bulk positions to represent the semi-infinite bulk crystal beneath the surface. A vacuum space of 15Å was applied to separate the central slab and its periodic images. The Brillouin-zone integrations were performed on a 3-3-1 Monkhorst-Pack grid in accordance with the size of the slab. In the preliminary calculations, smearing values of 0.1 and 0.2eV were simultaneously attempted to improve the SCF convergence. No obvious difference in the optimized geometries was found, and the difference in the calculated heats of adsorption was less than 4%. A smearing width of 0.2eV thereby was adopted in the subsequent calculations. The heat of adsorption (ΔH) is given by (1) Δ H = E Adsorption − E Slab − E Molecule where E Slab and E Molecule are the total energies of the relaxed bare slab and of the free adsorbate molecule, respectively, while E Adsorption represents the total energy of the relaxed surface/adsorbate adsorption system. The variation of work function (ΔΦ) of the catalyst surface due to the adsorbate adsorption is defined as (2) Δ Φ = Φ Adsorption − Φ Slab where Φ Adsorption and Φ Slab are the work function of the relaxed surface/adsorbate adsorption system and of the relaxed bare slab, respectively. 3 Results and discussion 3.1 Characterization of the prepared catalyst First, XPS characterization was applied to the prepared Ru-Zn/ZrO2 catalysts. A 2p3/2 peak of Zn element appears on the observed spectra at the binding energy of 1021.8eV; refer to Fig. 2 . It is confirmed that Zn element presented in the Ru-Zn/ZrO2 catalysts is in the metallic state by reason that the corresponding binding energies of 2p3/2 orbital of Zn2+, ZnO and Zn are located at 1023.1, 1022.5 and 1021.8eV, respectively [20–22]. Subsequent ICP analysis showed that Zn content in the Ru-Zn/ZrO2 could be adjusted by changing Zn2+ concentration in the water phase during the reduction treatment of the precursor. As the data listed in Table 1 suggest, Zn content in the catalyst increases from 2.42 to 2.95wt.% along with the elevation of Zn2+ concentration from 0.35 to 0.55M. A saturated Zn content surely exists since further elevation of Zn2+ in the water phase has little influence on the metallic Zn content in the prepared catalyst. XRD characterization detected diffraction peaks of the support ZrO2 at 2θ values of 30.2°, 50.2° and 59.7°; refer to Fig. 3 . According to Scherrer equation, the average size of ZrO2 particles is all smaller than 5nm, which means the catalysts are in the nano-scale. Besides, diffraction peaks of hexagonal Ru with broadened tendency were also found at 2θ values of 38.7°, 43.9° and 69.3°, indicating that the Ru metal supported on ZrO2 is in the form of microcrystal. Although the previous XPS analysis confirmed the existence of metallic Zn in the catalyst, no corresponding diffraction peaks of the Zn metal were detected. In other words, metallic Zn should be highly dispersed in the catalyst. By the considerations that Zn2+ can only be reduced by the H atoms adsorbed on the Ru crystal and no evident bias of diffraction pattern of hexagonal Ru occurs along with the elevation of the Zn content in the alloy catalyst, metallic Zn should mainly exist on the surface of Ru microcrystal rather than entering its bulk phase. A Ru-Zn/Ru(0001) surface alloy, which was supposed to be a reasonable approximation to the supported Ru-Zn alloy catalyst, thus was adopted in the subsequent theoretical calculations. 3.2 Partial hydrogenation of benzene over Ru-Zn/ZrO2 catalyst On the basis of the reaction pathway of heterogeneous catalysis, it is deduced that the presence of metallic Zn as well as its surface concentration in the Ru-based catalyst should exert influence on the adsorption of benzene and cyclohexene. Eventually, the hydrogenation behavior of the involved species over the modified catalyst would be affected. By adjusting Zn content in the catalyst, the above deduction was experimentally verified in the partial hydrogenation of benzene over Ru-Zn/ZrO2 at two levels of Zn2+ concentration in the water phase, i.e. 0.45 and 0.55M, with the results presented in Figs. 4 and 5 . The experimental data indicate a complicated synergetic effect between metallic Zn and the adsorbed Zn2+ ions on the partial hydrogenation behavior of benzene. In the absence of Zn2+ in the water phase, a sole usage of the modified catalyst only leads to an extremely poor cyclohexene yield. At the same time, the reaction is out of control because of too high hydrogenation rate. Nevertheless, two tendencies are clearly presented as follows: at a fixed concentration of Zn2+ in the water phase, an increase in the Zn content in the modified catalyst results in a monotonously decreased catalytic activity but an improved selectivity to cyclohexene. As the experimental data presented in Figs. 4 and 5 suggest, variation of Zn content in the alloy catalyst has a totally different influence on the catalytic activity and on the selectivity to cyclohexene. Seeing that the yield of cyclohexene is determined simultaneously by the conversion of benzene and by the selectivity to cyclohexene, an optimal Zn content in the Ru-Zn/ZrO2 catalyst therefore should exist. At the Zn2+ concentration of 0.55M, a satisfied cyclohexene yield of 44% was observed over Ru-Zn/ZrO2 with the Zn content of 2.72wt.%. Further elevation of Zn content to 2.95wt.% resulted in a sharp decrease in the catalytic activity, while the residence time to obtain the highest cyclohexene yield was excessively extended. 3.3 Adsorption of benzene and cyclohexene on the Ru(0001) surface The hydrogenation experiments show that the presence of metallic Zn in the Ru-based catalyst has a delicate influence on the partial hydrogenation behavior of benzene. In the literature, it is commonly acknowledged that to prevent the re-adsorption of cyclohexene onto the catalyst surface in the middle and late reaction stage is critical to the cyclohexene yield. Along these lines, the adsorption of benzene and cyclohexene on the Ru(0001) surface and Ru-Zn/Ru(0001) surface alloy was studied, respectively. Adsorption configurations of benzene on the Ru(0001) surface can be distinguished by the position of its ring center, i.e. hcp sites or fcc sites, and by the relative position between the C atom and the surface Ru atom. Accordingly, adsorption configurations of cyclohexene can be mainly distinguished by the situation whether its CC double bond is located at the Ru-Ru bridge site or at the atop site of the Ru atom. After configuration optimization, the most stable adsorption configurations of benzene and cyclohexene on the Ru(0001) surface are shown in Fig. 6 , with their adsorption parameters listed in Table 2 . Although Fig. 6-1 and -2 illustrates the adsorbed benzene molecules with the lowest potential energy, actually the difference in heat of adsorption between them and other adsorption configurations is only within 5–10kJ/mol, suggesting that benzene can be adsorbed on the Ru metal with multiple choices. As for cyclohexene, the heat of adsorption of configurations at the atop site is much higher than that at the bridge site by 35–40kJ/mol. That is to say, cyclohexene is predominantly adsorbed at the atop site of the surface Ru atom. By the magnitude of the calculated heat of adsorption, it is proposed that both the adsorbed benzene and cyclohexene molecules shown in Fig. 6 are in the state of chemisorption. In addition, interaction between the Ru surface and benzene should be much stronger than that between the surface and cyclohexene. Usually the adsorption of species with the conjugated double bond on the transition metal follows the σ-donation and π-back donation scheme. A decrease in the work function of the Ru(0001) surface ranging from −0.19 to −1.05eV was found after the chemisorption of benzene and cyclohexene, indicating that part of the electrons are transferred from the HOMO of the adsorbates to the valence orbitals of the surface Ru atoms. Basically, variation of the work function listed in Table 2 is in accordance with the calculated heat of adsorption. It is noteworthy that cyclohexene is preferentially adsorbed at the bridge site on the closest packing plane (111) of the commonly used group VIII metals with the face-centered cubic lattice [23,24]. The unexpected adsorption behavior of cyclohexene on the Ru metal cannot be explained by the spatial matching between the distance of surface atoms and the HOMO of the cyclohexene molecule, which means it may be resulted from the unique valence structure of the Ru atoms. 3.4 Adsorption of benzene and cyclohexene on the Ru-Zn/Ru(0001) surface On introducing metallic Zn onto the Ru(0001) surface, adsorption of adsorbates on the surface alloy is much more complicated than that on the Ru(0001) surface since the adsorption site may be directly related to or in a certain distance from the Zn atom. Furthermore, surface concentration of the Zn atom will surely affect the adsorption configuration. In this paper, the simplest situation in which only a singular Zn atom is involved in the supercell is considered. At that time, surface concentration of the Zn atom is 1/16. First consider the cases in which the adsorption sites of benzene and cyclohexene are directly related to the Zn atom. Fig. 7-1 and -2 illustrates the initial guess to the adsorbed benzene molecules whose ring center is located at the hcp site. Their C atoms or CC double bonds might be at the atop site of the Zn atom, respectively. Fig. 7-3 and -4 illustrates the initial guess to the adsorbed cyclohexene molecules whose CC double bond is placed at the atop site of the Zn atom or at the Ru-Zn bridge site. Then, optimization was performed on the basis of the above mentioned configurations. For benzene adsorbed on the Zn atom involved sites, the heat of adsorption of the optimized configurations decreases dramatically by about 65% compared with that of the similar configurations on the Ru(0001) surface; refer to Table 3 . Actually, benzene molecules lean on the surface alloy at an angle of 10° with a slightly distorted ring structure. One might deduce that such a sloping configuration is resulted from the repulsion from the Zn atom to the benzene ring, and it was confirmed by the subsequent charge density analysis of the adsorbed benzene molecule on the Ru(0001) surface and on the Ru-Zn/Ru(0001) surface alloy. The analysis is based on the cross-section marked in Figs. 6-1 and 7-1, with the results presented in Fig. 8 . On the Ru(0001) surface, a relatively dense charge density between the surface and benzene ring is observed, which means a strong bonding between them. As for the situation on the surface alloy, no charge is observed between the Zn atom and the C atom above it. At the same time, charge density between the other C atoms of the benzene ring and the surface Ru atom is also lower than the corresponding value on the Ru(0001) surface. Nevertheless, benzene still can be steadily adsorbed at the Zn atom involved sites in spite of the decreased overlap between the valence orbitals of the surface Ru atom and the HOMO of the benzene molecule. Apparently, the repulsion from the surface Zn atom to the benzene ring may also occur in the case of cyclohexene adsorption. After configuration optimization, it is found that the heat of adsorption of the adsorbed cyclohexene molecule with the CC double bond located at the atop site of the Zn atom is only less than 10kJ/mol, suggesting that it is in the state of physisorption. Furthermore, for the cyclohexene molecule initially placed at the Ru-Zn bridge site as shown in Fig. 7-4, without exception the olefinic C atom originally above the Zn atom migrates to the atop site of the neighboring Ru atom and forms a Ru-Ru bridge configuration. In other words, the presence of metallic Zn in the Ru-based catalyst leads to a direct decrease in the sites for the chemisorption of cyclohexene. The following calculations consider the situations in which no Zn atom is directly involved in the adsorption site of benzene and cyclohexene. Fig. 9-1 and -2 illustrates the adsorbed benzene molecules in varied distance from the Zn atom, while Fig. 9-3 and -4 shows the similar cases of the adsorbed cyclohexene molecules. According to the calculated heat of adsorption listed in Table 4 , adsorption of benzene on the alloy catalyst recovers rapidly once its adsorption site leaves away from the Zn atom. On the contrary, the adsorption of cyclohexene fails to recover although its adsorption site is already in a certain distance from the Zn atom, which means the whole alloy catalyst considered in this study is partly passivated for cyclohexene adsorption. Such a passivation is also clearly embodied in the red shift of CC stretching frequency of the adsorbed cyclohexene molecule on the Ru(0001) surface and Ru-Zn/Ru(0001) surface alloy; refer to Table 5 . On the whole, red shift of the CC stretching frequency of an adsorbed cyclohexene molecule is in accordance with the interaction strength between the surface and the cyclohexene molecule. A decreased red shift on the alloy catalyst indicates that chemisorption of cyclohexene on the whole alloy catalyst is depressed. The above discussion shows that chemisorption of benzene and cyclohexene on the metallic Zn modified Ru-based catalyst should be both restrained. However, essential differences can be found as follows. • Benzene still can be chemisorbed at the site involving a Zn atom; besides, the presence of metallic Zn virtually has no influence on the adsorption of benzene at the neighboring site. • Apart from a direct reduction in chemisorption sites, the whole modified catalyst is partly passivated for the adsorption of cyclohexene. It can be reasonably proposed that, with the further elevation of surface concentration of metallic Zn, not only the chemisorption of cyclohexene but also that of benzene will be eventually prohibited on the modified catalyst. It should be noticed that partial hydrogenation of benzene occurs on the surface of Ru-based catalyst suspended in the water phase. The above calculations are all based on the adsorption in the vacuum; therefore, it is necessary to verify whether the same conclusion can be drawn in the presence of co-adsorption of water molecules. Subsequent calculation shows that on the Ru(0001) surface water molecules are adsorbed at the atop site of the surface Ru atom with the oxygen atom pointing to the surface. The corresponding heat of adsorption is only slightly lower than that of cyclohexene, suggesting that the Ru metal is highly hydrophilic. Re-adsorption of cyclohexene thus can be effectively restrained due to the hydrophilic nature of the Ru-based catalyst. As for the Ru-Zn alloy, the calculated heat of adsorption of water molecules at the atop site of Zn atoms is less than 10kJ/mol, indicating that no chemisorption can be formed on the Zn atom. That is to say, to introduce metallic Zn into the Ru-based catalyst results in a local depression to the hydrophilicity of the catalyst surface. Fortunately, such a depression has no promotion to the chemisorption of cyclohexene since it cannot be chemisorbed on the Zn atom related sites either. It is therefore confirmed that, whether there is competitive adsorption of water molecules or not, the conclusion about the adsorption behavior of benzene and cyclohexene on the metallic Zn modified Ru-based catalyst is just the same. 3.5 Effect of metallic Zn on the hydrogenation behavior Consider first the partial hydrogenation of benzene over the traditional Ru-based catalyst. In the initial stage of reaction, only benzene exists in the organic phase and it is adsorbed on the catalyst surface with absolute priority. However, elevation of cyclohexene concentration in the organic phase will lead to an inevitable increase in its surface concentration on the catalyst surface regardless of the fact that the heat of adsorption of benzene is much higher than that of cyclohexene. In the middle stage of reaction, one may observe that the yield of by-product cyclohexane increases continuously and the yield of cyclohexene nearly keeps unchanged. At that moment, restriction to the undesired side reaction from cyclohexene to cyclohexane depends mainly on the presence of the water phase and on the adsorption of Zn2+ at the most active hydrogenation sites. When the partial hydrogenation of benzene is conducted over the metallic Zn modified Ru-based catalyst, the situation is quite different. In the initial reaction stage, benzene is also preferentially adsorbed on the catalyst surface and is hydrogenated to cyclohexene. Because of the depression to the benzene adsorption on the alloy catalyst, a decreased conversion rate of benzene should be experimentally observed. In the middle stage of reaction, the adsorption of benzene and cyclohexene on the catalyst surface is both restrained, but the latter is much more serious than the former. As a result, re-adsorption of cyclohexene from the organic phase to the catalyst surface is prevented not only by the water phase but also by the presence of metallic Zn on the catalyst surface. The side reaction from cyclohexene to cyclohexane therefore is effectively retarded, and now there is good chance to obtain a satisfied cyclohexene yield. Essentially, the improvement of cyclohexene yield over the metallic Zn modified Ru-based catalyst is realized by sacrificing part of the catalytic activity. With the elevation of Zn content in the catalyst, both the side reaction from cyclohexene to cyclohexane and the partial hydrogenation from benzene to cyclohexene will be suppressed gradually. In addition, the residence time to achieve the highest cyclohexene yield will be excessively prolonged, which makes the whole process uneconomic. An optimal Zn content in the modified catalyst therefore should be experimentally determined. 4 Conclusions By introducing metallic Zn into the Ru-based catalyst in the partial hydrogenation of benzene, an improved cyclohexene yield of 44% is obtained. Surface characterizations confirm the presence of metallic Zn in the prepared Ru-Zn/ZrO2 catalyst. Theoretical calculations propose that chemisorption of benzene and cyclohexene on the Ru-Zn alloy catalyst is both restrained, the latter being much more serious than the former. The above proposal is valid no matter in the presence of or in the absence of the competitive adsorption of water molecules. In the middle and late stage of hydrogenation, re-adsorption of cyclohexene on the modified catalyst is depressed simultaneously by the presence of metallic Zn on the catalyst surface and by the presence of the water phase, which is unfavorable for the undesired side reaction from cyclohexene to cyclohexane. A reduced catalytic activity but improved selectivity to cyclohexene therefore is experimentally observed. Due to the different influence of metallic Zn on the benzene conversion rate and on the selectivity to cyclohexene, a satisfied cyclohexene yield can only be obtained over the modified catalyst with the optimal Zn content. References [1] W.C. Drinkard Jr., NL Patent 7,205,832 (1972) to E.I. DU PONT DE NEMOURS and COMPANY. [2] O. Mitsui, Y. Fukuoka, US Patent 4,678,861 (1987) to Asahi Chemical Company. [3] H. Nagahara, M. Konishi, US Patent 4,734,536 (1988) to Asahi Kasei Kogyo Kabushiki Kaisha. [4] H. Nagahara M. Ono M. Konishi Y. Fukuok Appl. Surf. Sci. 121 1997 448 451 [5] P. Kluson L. Cerveny Appl. Catal. A 128 1995 13 31 [6] Anderson Jr. C. Kemball Aust. J. Chem. 10 1957 409 415 [7] C. Hoang-Van G. Tournier S.J. Teichner J. Catal. 86 1984 210 214 [8] P. Staiti S. Galvagno P. Antonueci A. Rositani P. Vitarelli React. Kinet. Catal. Lett. 26 1984 111 116 [9] D.P. Harrison H.F. Rase Ind. Eng. Chem. Fundam. 6 1967 161 169 [10] L. Ronchin L. Toniolo Catal. Today 66 2001 363 369 [11] Sung-Cheng Hu Yu-Wen Chen Ind. Eng. Chem. Res. 40 2001 6099 6104 [12] E.V. Spinacé J.M. Vaz Catal. Commun. 4 2003 91 96 [13] G.Y. Fan R.X. Li X.J. Li H. Chen Catal. Commun. 9 2008 1394 1397 [14] S.C. Liu Z.Y. Liu S.H. Zhao Y.M. Wu Z. Wang P. Yuan J. Nat. Gas Chem. 15 2006 319 326 [15] S.C. Liu Z.Y. Liu Z. Wang Y.M. Wu P. Yuan Chem. Eng. J. 139 2008 157 164 [16] J.Q. Wang Y.Z. Wang S.H. Xie M.H. Qiao H.X. Li K.N. Fan Appl. Catal. A 272 2004 29 36 [17] J. Bu J.L. Liu X.Y. Chen J.H. Zhuang S.R. Yan M.H. Qiao H.Y. He K.N. Fan Catal. Commun. 9 2008 2612 2615 [18] J.L. Liu L.J. Zhu Y. Pei J.H. Zhuang H. Li H.X. Li M.H. Qiao K.N. Fan Appl. Catal. A 353 2009 282 287 [19] P.Q. Yuan B.Q. Wang Y.M. Ma H.M. He Z.M. Cheng W.K. Yuan J. Mol. Catal. A: Chem. 301 2009 140 145 [20] V.I. Nefedov J. Electron. Spectrosc. Relat. Phenom. 25 1982 29 47 [21] S.W. Gaarenstroom N. Winograd J. Chem. Phys. 67 1977 3500 3506 [22] L. Ley S.P. Kowalczyk F.R. McFeely R.A. Pollak D.A. Shirley Phys. Rev. B 8 1973 2392 2402 [23] M. Saeys M.F. Reyniers M. Neurock G.B. Marin Surf. Sci. 600 2006 3121 3134 [24] F. Delbecq F.V. Maeder C. Becker J. Breitbach K. Wandelt J. Phys. Chem. C 112 2008 555 566",
      "scopus-id": "67651091536",
      "coredata": {
        "eid": "1-s2.0-S1381116909002386",
        "dc:description": "From the adsorption point of view, partial hydrogenation of benzene to cyclohexene over the metallic Zn modified Ru-based catalyst was experimentally and theoretically investigated. A decreased hydrogenation activity but increased selectivity to cyclohexene over the prepared Ru-Zn/ZrO2 catalyst was observed in the partial hydrogenation of benzene. Theoretical calculations suggest that the above phenomena are mainly resulted from the depression of the chemisorption of benzene and cyclohexene on the modified catalyst, especially for the latter. Undesired deep hydrogenation from cyclohexene to cyclohexane in the middle and late reaction stage therefore is effectively retarded, by which an improved cyclohexene yield is guaranteed. An optimal Zn content of 2.72wt.% in the Ru-based catalyst was proposed by both the experiment and calculation for the partial hydrogenation of benzene, and a cyclohexene yield up to 44% was obtained over Ru-Zn/ZrO2 catalyst.",
        "openArchiveArticle": "false",
        "prism:coverDate": "2009-08-18",
        "openaccessUserLicense": null,
        "prism:aggregationType": "Journal",
        "prism:url": "https://api.elsevier.com/content/article/pii/S1381116909002386",
        "dc:creator": [
          {
            "@_fa": "true",
            "$": "Yuan, Pei-Qing"
          },
          {
            "@_fa": "true",
            "$": "Wang, Bing-Qiang"
          },
          {
            "@_fa": "true",
            "$": "Ma, Yue-Ming"
          },
          {
            "@_fa": "true",
            "$": "He, Hui-Min"
          },
          {
            "@_fa": "true",
            "$": "Cheng, Zhen-Min"
          },
          {
            "@_fa": "true",
            "$": "Yuan, Wei-Kang"
          }
        ],
        "link": [
          {
            "@_fa": "true",
            "@rel": "self",
            "@href": "https://api.elsevier.com/content/article/pii/S1381116909002386"
          },
          {
            "@_fa": "true",
            "@rel": "scidir",
            "@href": "https://www.sciencedirect.com/science/article/pii/S1381116909002386"
          }
        ],
        "dc:format": "application/json",
        "openaccessType": null,
        "pii": "S1381-1169(09)00238-6",
        "prism:volume": "309",
        "prism:publisher": "Elsevier B.V.",
        "dc:title": "Partial hydrogenation of benzene over the metallic Zn modified Ru-based catalyst",
        "prism:copyright": "Copyright © 2009 Elsevier B.V. All rights reserved.",
        "openaccess": "0",
        "prism:issn": "13811169",
        "prism:issueIdentifier": "1-2",
        "dcterms:subject": [
          {
            "@_fa": "true",
            "$": "Partial hydrogenation"
          },
          {
            "@_fa": "true",
            "$": "Benzene"
          },
          {
            "@_fa": "true",
            "$": "Alloy catalyst"
          },
          {
            "@_fa": "true",
            "$": "DFT"
          },
          {
            "@_fa": "true",
            "$": "Metallic Zn"
          }
        ],
        "openaccessArticle": "false",
        "prism:publicationName": "Journal of Molecular Catalysis A: Chemical",
        "prism:number": "1-2",
        "openaccessSponsorType": null,
        "prism:pageRange": "124-130",
        "prism:endingPage": "130",
        "pubType": "fla",
        "prism:coverDisplayDate": "18 August 2009",
        "prism:doi": "10.1016/j.molcata.2009.05.006",
        "prism:startingPage": "124",
        "dc:identifier": "doi:10.1016/j.molcata.2009.05.006",
        "openaccessSponsorName": null
      },
      "objects": {
        "object": [
          {
            "@category": "thumbnail",
            "@height": "16",
            "@width": "170",
            "@_fa": "true",
            "$": "https://api.elsevier.com/content/object/eid/1-s2.0-S1381116909002386-si4.gif?httpAccept=%2A%2F%2A",
            "@multimediatype": "GIF image file",
            "@type": "ALTIMG",
            "@size": "604",
            "@ref": "si4",
            "@mimetype": "image/gif"
          },
          {
            "@category": "thumbnail",
            "@height": "16",
            "@width": "249",
            "@_fa": "true",
            "$": "https://api.elsevier.com/content/object/eid/1-s2.0-S1381116909002386-si3.gif?httpAccept=%2A%2F%2A",
            "@multimediatype": "GIF image file",
            "@type": "ALTIMG",
            "@size": "708",
            "@ref": "si3",
            "@mimetype": "image/gif"
          },
          {
            "@category": "thumbnail",
            "@height": "15",
            "@width": "24",
            "@_fa": "true",
            "$": "https://api.elsevier.com/content/object/eid/1-s2.0-S1381116909002386-si2.gif?httpAccept=%2A%2F%2A",
            "@multimediatype": "GIF image file",
            "@type": "ALTIMG",
            "@size": "168",
            "@ref": "si2",
            "@mimetype": "image/gif"
          },
          {
            "@category": "thumbnail",
            "@height": "15",
            "@width": "24",
            "@_fa": "true",
            "$": "https://api.elsevier.com/content/object/eid/1-s2.0-S1381116909002386-si1.gif?httpAccept=%2A%2F%2A",
            "@multimediatype": "GIF image file",
            "@type": "ALTIMG",
            "@size": "168",
            "@ref": "si1",
            "@mimetype": "image/gif"
          },
          {
            "@category": "standard",
            "@height": "302",
            "@width": "376",
            "@_fa": "true",
            "$": "https://api.elsevier.com/content/object/eid/1-s2.0-S1381116909002386-gr1.jpg?httpAccept=%2A%2F%2A",
            "@multimediatype": "JPEG image file",
            "@type": "IMAGE-DOWNSAMPLED",
            "@size": "53117",
            "@ref": "gr1",
            "@mimetype": "image/jpeg"
          },
          {
            "@category": "thumbnail",
            "@height": "164",
            "@width": "204",
            "@_fa": "true",
            "$": "https://api.elsevier.com/content/object/eid/1-s2.0-S1381116909002386-gr1.sml?httpAccept=%2A%2F%2A",
            "@multimediatype": "GIF image file",
            "@type": "IMAGE-THUMBNAIL",
            "@size": "11815",
            "@ref": "gr1",
            "@mimetype": "image/gif"
          },
          {
            "@category": "standard",
            "@height": "263",
            "@width": "381",
            "@_fa": "true",
            "$": "https://api.elsevier.com/content/object/eid/1-s2.0-S1381116909002386-gr2.jpg?httpAccept=%2A%2F%2A",
            "@multimediatype": "JPEG image file",
            "@type": "IMAGE-DOWNSAMPLED",
            "@size": "13487",
            "@ref": "gr2",
            "@mimetype": "image/jpeg"
          },
          {
            "@category": "thumbnail",
            "@height": "151",
            "@width": "219",
            "@_fa": "true",
            "$": "https://api.elsevier.com/content/object/eid/1-s2.0-S1381116909002386-gr2.sml?httpAccept=%2A%2F%2A",
            "@multimediatype": "GIF image file",
            "@type": "IMAGE-THUMBNAIL",
            "@size": "2501",
            "@ref": "gr2",
            "@mimetype": "image/gif"
          },
          {
            "@category": "standard",
            "@height": "279",
            "@width": "378",
            "@_fa": "true",
            "$": "https://api.elsevier.com/content/object/eid/1-s2.0-S1381116909002386-gr3.jpg?httpAccept=%2A%2F%2A",
            "@multimediatype": "JPEG image file",
            "@type": "IMAGE-DOWNSAMPLED",
            "@size": "22891",
            "@ref": "gr3",
            "@mimetype": "image/jpeg"
          },
          {
            "@category": "thumbnail",
            "@height": "162",
            "@width": "219",
            "@_fa": "true",
            "$": "https://api.elsevier.com/content/object/eid/1-s2.0-S1381116909002386-gr3.sml?httpAccept=%2A%2F%2A",
            "@multimediatype": "GIF image file",
            "@type": "IMAGE-THUMBNAIL",
            "@size": "4946",
            "@ref": "gr3",
            "@mimetype": "image/gif"
          },
          {
            "@category": "standard",
            "@height": "266",
            "@width": "394",
            "@_fa": "true",
            "$": "https://api.elsevier.com/content/object/eid/1-s2.0-S1381116909002386-gr4.jpg?httpAccept=%2A%2F%2A",
            "@multimediatype": "JPEG image file",
            "@type": "IMAGE-DOWNSAMPLED",
            "@size": "17519",
            "@ref": "gr4",
            "@mimetype": "image/jpeg"
          },
          {
            "@category": "thumbnail",
            "@height": "148",
            "@width": "219",
            "@_fa": "true",
            "$": "https://api.elsevier.com/content/object/eid/1-s2.0-S1381116909002386-gr4.sml?httpAccept=%2A%2F%2A",
            "@multimediatype": "GIF image file",
            "@type": "IMAGE-THUMBNAIL",
            "@size": "2925",
            "@ref": "gr4",
            "@mimetype": "image/gif"
          },
          {
            "@category": "standard",
            "@height": "265",
            "@width": "384",
            "@_fa": "true",
            "$": "https://api.elsevier.com/content/object/eid/1-s2.0-S1381116909002386-gr5.jpg?httpAccept=%2A%2F%2A",
            "@multimediatype": "JPEG image file",
            "@type": "IMAGE-DOWNSAMPLED",
            "@size": "19879",
            "@ref": "gr5",
            "@mimetype": "image/jpeg"
          },
          {
            "@category": "thumbnail",
            "@height": "151",
            "@width": "219",
            "@_fa": "true",
            "$": "https://api.elsevier.com/content/object/eid/1-s2.0-S1381116909002386-gr5.sml?httpAccept=%2A%2F%2A",
            "@multimediatype": "GIF image file",
            "@type": "IMAGE-THUMBNAIL",
            "@size": "3321",
            "@ref": "gr5",
            "@mimetype": "image/gif"
          },
          {
            "@category": "standard",
            "@height": "215",
            "@width": "446",
            "@_fa": "true",
            "$": "https://api.elsevier.com/content/object/eid/1-s2.0-S1381116909002386-gr6.jpg?httpAccept=%2A%2F%2A",
            "@multimediatype": "JPEG image file",
            "@type": "IMAGE-DOWNSAMPLED",
            "@size": "41694",
            "@ref": "gr6",
            "@mimetype": "image/jpeg"
          },
          {
            "@category": "thumbnail",
            "@height": "105",
            "@width": "219",
            "@_fa": "true",
            "$": "https://api.elsevier.com/content/object/eid/1-s2.0-S1381116909002386-gr6.sml?httpAccept=%2A%2F%2A",
            "@multimediatype": "GIF image file",
            "@type": "IMAGE-THUMBNAIL",
            "@size": "6158",
            "@ref": "gr6",
            "@mimetype": "image/gif"
          },
          {
            "@category": "standard",
            "@height": "182",
            "@width": "536",
            "@_fa": "true",
            "$": "https://api.elsevier.com/content/object/eid/1-s2.0-S1381116909002386-gr7.jpg?httpAccept=%2A%2F%2A",
            "@multimediatype": "JPEG image file",
            "@type": "IMAGE-DOWNSAMPLED",
            "@size": "42582",
            "@ref": "gr7",
            "@mimetype": "image/jpeg"
          },
          {
            "@category": "thumbnail",
            "@height": "74",
            "@width": "219",
            "@_fa": "true",
            "$": "https://api.elsevier.com/content/object/eid/1-s2.0-S1381116909002386-gr7.sml?httpAccept=%2A%2F%2A",
            "@multimediatype": "GIF image file",
            "@type": "IMAGE-THUMBNAIL",
            "@size": "5022",
            "@ref": "gr7",
            "@mimetype": "image/gif"
          },
          {
            "@category": "standard",
            "@height": "246",
            "@width": "498",
            "@_fa": "true",
            "$": "https://api.elsevier.com/content/object/eid/1-s2.0-S1381116909002386-gr8.jpg?httpAccept=%2A%2F%2A",
            "@multimediatype": "JPEG image file",
            "@type": "IMAGE-DOWNSAMPLED",
            "@size": "49136",
            "@ref": "gr8",
            "@mimetype": "image/jpeg"
          },
          {
            "@category": "thumbnail",
            "@height": "108",
            "@width": "219",
            "@_fa": "true",
            "$": "https://api.elsevier.com/content/object/eid/1-s2.0-S1381116909002386-gr8.sml?httpAccept=%2A%2F%2A",
            "@multimediatype": "GIF image file",
            "@type": "IMAGE-THUMBNAIL",
            "@size": "9522",
            "@ref": "gr8",
            "@mimetype": "image/gif"
          },
          {
            "@category": "standard",
            "@height": "221",
            "@width": "614",
            "@_fa": "true",
            "$": "https://api.elsevier.com/content/object/eid/1-s2.0-S1381116909002386-gr9.jpg?httpAccept=%2A%2F%2A",
            "@multimediatype": "JPEG image file",
            "@type": "IMAGE-DOWNSAMPLED",
            "@size": "50303",
            "@ref": "gr9",
            "@mimetype": "image/jpeg"
          },
          {
            "@category": "thumbnail",
            "@height": "79",
            "@width": "219",
            "@_fa": "true",
            "$": "https://api.elsevier.com/content/object/eid/1-s2.0-S1381116909002386-gr9.sml?httpAccept=%2A%2F%2A",
            "@multimediatype": "GIF image file",
            "@type": "IMAGE-THUMBNAIL",
            "@size": "5124",
            "@ref": "gr9",
            "@mimetype": "image/gif"
          },
          {
            "@category": "standard",
            "@height": "155",
            "@width": "192",
            "@_fa": "true",
            "$": "https://api.elsevier.com/content/object/eid/1-s2.0-S1381116909002386-fx1.jpg?httpAccept=%2A%2F%2A",
            "@multimediatype": "JPEG image file",
            "@type": "IMAGE-DOWNSAMPLED",
            "@size": "25670",
            "@ref": "fx1",
            "@mimetype": "image/jpeg"
          },
          {
            "@category": "thumbnail",
            "@height": "164",
            "@width": "203",
            "@_fa": "true",
            "$": "https://api.elsevier.com/content/object/eid/1-s2.0-S1381116909002386-fx1.sml?httpAccept=%2A%2F%2A",
            "@multimediatype": "GIF image file",
            "@type": "IMAGE-THUMBNAIL",
            "@size": "11816",
            "@ref": "fx1",
            "@mimetype": "image/gif"
          }
        ]
      },
      "link": {
        "@rel": "abstract",
        "@href": "https://api.elsevier.com/content/abstract/scopus_id/67651091536"
      }
    }
  }
}