{
  "metadata": {
    "title": "Organic–inorganic polyoxometalate based salts as thermoregulated phase-separable catalysts for selective oxidation of thioethers and thiophenes and deep desulfurization of model fuels",
    "authors": "; ",
    "journal": "Journal of Molecular Catalysis A: Chemical",
    "date": "2013-12-31",
    "doi": "10.1016/j.molcata.2013.09.009",
    "abstract": "",
    "uri": "https://api.elsevier.com/content/article/pii/S1381116913003348",
    "pii": "S1381116913003348"
  },
  "fulltext": {
    "full-text-retrieval-response": {
      "scopus-eid": "2-s2.0-84885014575",
      "originalText": "serial JL 271358 291210 291744 291790 291809 31 Journal of Molecular Catalysis A: Chemical JOURNALMOLECULARCATALYSISACHEMICAL 2013-09-18 2013-09-18 2013-11-05T20:45:09 1-s2.0-S1381116913003348 S1381-1169(13)00334-8 S1381116913003348 10.1016/j.molcata.2013.09.009 S300 S300.1 FULL-TEXT 1-s2.0-S1381116913X00111 2015-05-15T05:56:33.63776-04:00 0 0 20131201 20131231 2013 2013-09-18T00:00:00Z articleinfo crossmark dco dateupdated tomb dateloaded datesearch indexeddate volumelist yearnav absattachment articletitlenorm authfirstinitialnorm authfirstsurnamenorm cid cids contenttype copyright dateloadedtxt docsubtype doctype doi eid ewtransactionid hubeid issn issnnorm itemstage itemtransactionid itemweight openaccess openarchive pg pgfirst pglast pii piinorm pubdateend pubdatestart pubdatetxt pubyr sortorder srctitle srctitlenorm srctype subheadings suppl volfirst volissue webpdf webpdfpagecount figure table e-component body mmlmath acknowledge affil appendices articletitle auth authfirstini authfull authkeywords authlast highlightsabst primabst ref specialabst alllist content subj ssids 1381-1169 13811169 true 380 380 C Volume 380 5 18 27 18 27 201312 December 2013 2013-12-01 2013-12-31 2013 article fla Copyright © 2013 Elsevier B.V. All rights reserved. ORGANICINORGANICPOLYOXOMETALATEBASEDSALTSTHERMOREGULATEDPHASESEPARABLECATALYSTSFORSELECTIVEOXIDATIONTHIOETHERSTHIOPHENESDEEPDESULFURIZATIONMODELFUELS RAFIEE E 1 Introduction 2 Experimental 2.1 General 2.2 Catalysts preparation 2.3 Solubility measurement of the POM-ILs in water 2.4 Voltammetry experiments 2.5 Catalytic reactions 2.5.1 Reaction progress monitoring 2.5.2 Oxidation of liquid sulfides (Table 1, entries 1–7) 2.5.3 Oxidation of solid sulfur compounds (Table 1, entries 7–10) 2.5.4 Oxidative desulfurization of model oil 3 Results and discussion 4 Conclusion Acknowledgement Appendix A Supplementary data References MIZUNO 1998 199 218 N ZHANG 2009 182 189 Y HILL 1995 407 455 C GRIGOROPOULOU 2003 1 7 G MIZUNO 2005 1944 1956 N SATO 2001 2469 2476 K ROMANELLI 2011 726 730 G SACHDEVA 2010 1133 1138 T TUNDO 2010 1181 1184 P WANG 2010 37 41 R RENWICK 1989 133 140 A SULFURCONTAININGDRUGSRELATEDORGANICCOMPOUNDS CUN 2011 689 693 Z ZHUA 2011 8 14 W JIANG 2008 79 84 X AMMAMN 2011 818 824 M RAJKUMAR 2008 587 594 T RICKERT 2007 4685 4692 P BORDOLOI 2008 232 239 A LENG 2009 168 171 Y DING 2011 45 51 Y CARRARO 2006 3671 3674 M DING 2011 1210 1216 Y QIU 2009 1538 1542 J JIANG 2011 343 349 C ZHU 2011 1842 1848 W ZHANG 2011 269 275 J SHI 2008 142 147 X SHI 2011 57 62 X QI 2010 1068 1078 W DUPONT 2002 3667 3692 J ISHII 1987 1868 1870 Y POPE 1983 M HETEROPOLYISOPOLYOXOMETALATES VENTURELLO 1985 107 110 C VENTURELLO 1988 1553 1557 C MATOBA 1984 865 873 Y ISHII 1988 3587 3593 Y RODRIGUEZGATTORNO 2009 1 8 G KUMAR 2007 913 916 A KUZNETSOV 2009 1871 1878 A MIZUNO 2010 876 893 N SANTOS 2008 166 173 I SADAKANE 1998 219 237 M PRASANTH 2007 45 49 K BACIOCCHI 2004 3586 3589 E GREGORI 2008 124 127 F OLIVIERBOURBIGOU 2010 1 56 H SATHICQ 2008 1441 1444 A YAMAURA 2013 76 80 T YAN 2009 52 57 X RAFIEEX2013X18 RAFIEEX2013X18X27 RAFIEEX2013X18XE RAFIEEX2013X18X27XE item S1381-1169(13)00334-8 S1381116913003348 1-s2.0-S1381116913003348 10.1016/j.molcata.2013.09.009 271358 2013-11-05T17:45:29.388512-05:00 2013-12-01 2013-12-31 1-s2.0-S1381116913003348-main.pdf https://s3.amazonaws.com/prod-ucs-content-store-us-east/content/pii:S1381116913003348/MAIN/application/pdf/36d34dca4faefcb26abfb35b1f22a0bf/main.pdf https://s3-eu-west-1.amazonaws.com/prod-ucs-content-store-eu-west/content/pii:S1381116913003348/MAIN/application/pdf/36d34dca4faefcb26abfb35b1f22a0bf/main.pdf main.pdf pdf true 1756408 MAIN 10 1-s2.0-S1381116913003348-main_1.png https://s3-eu-west-1.amazonaws.com/prod-ucs-content-store-eu-west/content/pii:S1381116913003348/PREVIEW/image/png/63cf52f47e3b50b3782dc5230155df50/main_1.png https://s3.amazonaws.com/prod-ucs-content-store-us-east/content/pii:S1381116913003348/PREVIEW/image/png/63cf52f47e3b50b3782dc5230155df50/main_1.png main_1.png png 62148 849 656 IMAGE-WEB-PDF 1 1-s2.0-S1381116913003348-si2.gif https://s3.amazonaws.com/prod-ucs-content-store-us-east/content/pii:S1381116913003348/STRIPIN/image/gif/e764ca040fa76545dcdd77c5031da06a/si2.gif https://s3-eu-west-1.amazonaws.com/prod-ucs-content-store-eu-west/content/pii:S1381116913003348/STRIPIN/image/gif/e764ca040fa76545dcdd77c5031da06a/si2.gif si2 si2.gif gif 538 18 116 ALTIMG 1-s2.0-S1381116913003348-si1.gif https://s3.amazonaws.com/prod-ucs-content-store-us-east/content/pii:S1381116913003348/STRIPIN/image/gif/9baacb21b9fc1a9ffdd0b70c296ae8b6/si1.gif https://s3-eu-west-1.amazonaws.com/prod-ucs-content-store-eu-west/content/pii:S1381116913003348/STRIPIN/image/gif/9baacb21b9fc1a9ffdd0b70c296ae8b6/si1.gif si1 si1.gif gif 534 18 116 ALTIMG 1-s2.0-S1381116913003348-mmc1.docx https://s3.amazonaws.com/prod-ucs-content-store-us-east/content/pii:S1381116913003348/mmc1/MAIN/application/msword/d8b3ba91e7c83f6d612253709e0b71a1/mmc1.docx https://s3-eu-west-1.amazonaws.com/prod-ucs-content-store-eu-west/content/pii:S1381116913003348/mmc1/MAIN/application/msword/d8b3ba91e7c83f6d612253709e0b71a1/mmc1.docx mmc1 mmc1.docx docx 272766 APPLICATION 1-s2.0-S1381116913003348-mmc2.mol https://s3.amazonaws.com/prod-ucs-content-store-us-east/content/pii:S1381116913003348/mmc2/MAIN/chemical/x-mdl-molfile/fb9a04e2e1f57068a178ca6774f2d242/mmc2.mol https://s3-eu-west-1.amazonaws.com/prod-ucs-content-store-eu-west/content/pii:S1381116913003348/mmc2/MAIN/chemical/x-mdl-molfile/fb9a04e2e1f57068a178ca6774f2d242/mmc2.mol mmc2 mmc2.mol mol 35631 APPLICATION 1-s2.0-S1381116913003348-sc2_lrg.jpg https://s3.amazonaws.com/prod-ucs-content-store-us-east/content/pii:S1381116913003348/sc2/HIGHRES/image/jpeg/6c1eb5968ab29ff06ff9167b77c56641/sc2_lrg.jpg https://s3-eu-west-1.amazonaws.com/prod-ucs-content-store-eu-west/content/pii:S1381116913003348/sc2/HIGHRES/image/jpeg/6c1eb5968ab29ff06ff9167b77c56641/sc2_lrg.jpg sc2 sc2_lrg.jpg jpg 255792 1383 3167 IMAGE-HIGH-RES 1-s2.0-S1381116913003348-sc1_lrg.jpg https://s3.amazonaws.com/prod-ucs-content-store-us-east/content/pii:S1381116913003348/sc1/HIGHRES/image/jpeg/44b156dcc3e677c6daf35e1eb11503e6/sc1_lrg.jpg https://s3-eu-west-1.amazonaws.com/prod-ucs-content-store-eu-west/content/pii:S1381116913003348/sc1/HIGHRES/image/jpeg/44b156dcc3e677c6daf35e1eb11503e6/sc1_lrg.jpg sc1 sc1_lrg.jpg jpg 244921 1590 2404 IMAGE-HIGH-RES 1-s2.0-S1381116913003348-gr8_lrg.jpg https://s3.amazonaws.com/prod-ucs-content-store-us-east/content/pii:S1381116913003348/gr8/HIGHRES/image/jpeg/e976278b3a794c641a5c6e439e437fac/gr8_lrg.jpg https://s3-eu-west-1.amazonaws.com/prod-ucs-content-store-eu-west/content/pii:S1381116913003348/gr8/HIGHRES/image/jpeg/e976278b3a794c641a5c6e439e437fac/gr8_lrg.jpg gr8 gr8_lrg.jpg jpg 212276 1407 2500 IMAGE-HIGH-RES 1-s2.0-S1381116913003348-gr7_lrg.jpg https://s3.amazonaws.com/prod-ucs-content-store-us-east/content/pii:S1381116913003348/gr7/HIGHRES/image/jpeg/7bfad392998b479423f6136734557909/gr7_lrg.jpg https://s3-eu-west-1.amazonaws.com/prod-ucs-content-store-eu-west/content/pii:S1381116913003348/gr7/HIGHRES/image/jpeg/7bfad392998b479423f6136734557909/gr7_lrg.jpg gr7 gr7_lrg.jpg jpg 553863 2119 3590 IMAGE-HIGH-RES 1-s2.0-S1381116913003348-gr6_lrg.jpg https://s3.amazonaws.com/prod-ucs-content-store-us-east/content/pii:S1381116913003348/gr6/HIGHRES/image/jpeg/0e5c89fc120614daf288fc56a375dd60/gr6_lrg.jpg https://s3-eu-west-1.amazonaws.com/prod-ucs-content-store-eu-west/content/pii:S1381116913003348/gr6/HIGHRES/image/jpeg/0e5c89fc120614daf288fc56a375dd60/gr6_lrg.jpg gr6 gr6_lrg.jpg jpg 698984 4417 2485 IMAGE-HIGH-RES 1-s2.0-S1381116913003348-gr4_lrg.jpg https://s3.amazonaws.com/prod-ucs-content-store-us-east/content/pii:S1381116913003348/gr4/HIGHRES/image/jpeg/a1854435a95333e3cc20335d69024de9/gr4_lrg.jpg https://s3-eu-west-1.amazonaws.com/prod-ucs-content-store-eu-west/content/pii:S1381116913003348/gr4/HIGHRES/image/jpeg/a1854435a95333e3cc20335d69024de9/gr4_lrg.jpg gr4 gr4_lrg.jpg jpg 154255 1640 1072 IMAGE-HIGH-RES 1-s2.0-S1381116913003348-gr3_lrg.jpg https://s3.amazonaws.com/prod-ucs-content-store-us-east/content/pii:S1381116913003348/gr3/HIGHRES/image/jpeg/9beef764962fa681e4596328aefec2e1/gr3_lrg.jpg https://s3-eu-west-1.amazonaws.com/prod-ucs-content-store-eu-west/content/pii:S1381116913003348/gr3/HIGHRES/image/jpeg/9beef764962fa681e4596328aefec2e1/gr3_lrg.jpg gr3 gr3_lrg.jpg jpg 381193 1959 1525 IMAGE-HIGH-RES 1-s2.0-S1381116913003348-gr2_lrg.jpg https://s3.amazonaws.com/prod-ucs-content-store-us-east/content/pii:S1381116913003348/gr2/HIGHRES/image/jpeg/b522db6349e388173858deb8b6764164/gr2_lrg.jpg https://s3-eu-west-1.amazonaws.com/prod-ucs-content-store-eu-west/content/pii:S1381116913003348/gr2/HIGHRES/image/jpeg/b522db6349e388173858deb8b6764164/gr2_lrg.jpg gr2 gr2_lrg.jpg jpg 425959 1849 2501 IMAGE-HIGH-RES 1-s2.0-S1381116913003348-fx9_lrg.jpg https://s3.amazonaws.com/prod-ucs-content-store-us-east/content/pii:S1381116913003348/fx9/HIGHRES/image/jpeg/f33333c6525c04ed59c5ad190ce15189/fx9_lrg.jpg https://s3-eu-west-1.amazonaws.com/prod-ucs-content-store-eu-west/content/pii:S1381116913003348/fx9/HIGHRES/image/jpeg/f33333c6525c04ed59c5ad190ce15189/fx9_lrg.jpg fx9 fx9_lrg.jpg jpg 81537 886 1482 IMAGE-HIGH-RES 1-s2.0-S1381116913003348-fx8_lrg.jpg https://s3.amazonaws.com/prod-ucs-content-store-us-east/content/pii:S1381116913003348/fx8/HIGHRES/image/jpeg/b4b64fa88d7ec5692257deaa09158569/fx8_lrg.jpg https://s3-eu-west-1.amazonaws.com/prod-ucs-content-store-eu-west/content/pii:S1381116913003348/fx8/HIGHRES/image/jpeg/b4b64fa88d7ec5692257deaa09158569/fx8_lrg.jpg fx8 fx8_lrg.jpg jpg 48241 886 748 IMAGE-HIGH-RES 1-s2.0-S1381116913003348-fx7_lrg.jpg https://s3.amazonaws.com/prod-ucs-content-store-us-east/content/pii:S1381116913003348/fx7/HIGHRES/image/jpeg/f2258b6dc795af5338942be22d12e09f/fx7_lrg.jpg https://s3-eu-west-1.amazonaws.com/prod-ucs-content-store-eu-west/content/pii:S1381116913003348/fx7/HIGHRES/image/jpeg/f2258b6dc795af5338942be22d12e09f/fx7_lrg.jpg fx7 fx7_lrg.jpg jpg 50891 418 2213 IMAGE-HIGH-RES 1-s2.0-S1381116913003348-fx6_lrg.jpg https://s3.amazonaws.com/prod-ucs-content-store-us-east/content/pii:S1381116913003348/fx6/HIGHRES/image/jpeg/131d8d46c1bc295ddf1b925b094a4302/fx6_lrg.jpg https://s3-eu-west-1.amazonaws.com/prod-ucs-content-store-eu-west/content/pii:S1381116913003348/fx6/HIGHRES/image/jpeg/131d8d46c1bc295ddf1b925b094a4302/fx6_lrg.jpg fx6 fx6_lrg.jpg jpg 58918 667 2213 IMAGE-HIGH-RES 1-s2.0-S1381116913003348-fx5_lrg.jpg https://s3.amazonaws.com/prod-ucs-content-store-us-east/content/pii:S1381116913003348/fx5/HIGHRES/image/jpeg/05a69b67b209689683c54c0951578e45/fx5_lrg.jpg https://s3-eu-west-1.amazonaws.com/prod-ucs-content-store-eu-west/content/pii:S1381116913003348/fx5/HIGHRES/image/jpeg/05a69b67b209689683c54c0951578e45/fx5_lrg.jpg fx5 fx5_lrg.jpg jpg 71635 531 2213 IMAGE-HIGH-RES 1-s2.0-S1381116913003348-fx4_lrg.jpg https://s3.amazonaws.com/prod-ucs-content-store-us-east/content/pii:S1381116913003348/fx4/HIGHRES/image/jpeg/f05a46a038558511ce1616c9d69b7704/fx4_lrg.jpg https://s3-eu-west-1.amazonaws.com/prod-ucs-content-store-eu-west/content/pii:S1381116913003348/fx4/HIGHRES/image/jpeg/f05a46a038558511ce1616c9d69b7704/fx4_lrg.jpg fx4 fx4_lrg.jpg jpg 64091 886 1947 IMAGE-HIGH-RES 1-s2.0-S1381116913003348-fx3_lrg.jpg https://s3.amazonaws.com/prod-ucs-content-store-us-east/content/pii:S1381116913003348/fx3/HIGHRES/image/jpeg/2397f855fb04e8f95ff31ab8caec808c/fx3_lrg.jpg https://s3-eu-west-1.amazonaws.com/prod-ucs-content-store-eu-west/content/pii:S1381116913003348/fx3/HIGHRES/image/jpeg/2397f855fb04e8f95ff31ab8caec808c/fx3_lrg.jpg fx3 fx3_lrg.jpg jpg 69646 876 2213 IMAGE-HIGH-RES 1-s2.0-S1381116913003348-fx2_lrg.jpg https://s3.amazonaws.com/prod-ucs-content-store-us-east/content/pii:S1381116913003348/fx2/HIGHRES/image/jpeg/db7913db1b84362317c4c9091ab4d1c9/fx2_lrg.jpg https://s3-eu-west-1.amazonaws.com/prod-ucs-content-store-eu-west/content/pii:S1381116913003348/fx2/HIGHRES/image/jpeg/db7913db1b84362317c4c9091ab4d1c9/fx2_lrg.jpg fx2 fx2_lrg.jpg jpg 49624 886 1417 IMAGE-HIGH-RES 1-s2.0-S1381116913003348-fx11_lrg.jpg https://s3.amazonaws.com/prod-ucs-content-store-us-east/content/pii:S1381116913003348/fx11/HIGHRES/image/jpeg/7b24dfb61685e6d3ba08882867d31c31/fx11_lrg.jpg https://s3-eu-west-1.amazonaws.com/prod-ucs-content-store-eu-west/content/pii:S1381116913003348/fx11/HIGHRES/image/jpeg/7b24dfb61685e6d3ba08882867d31c31/fx11_lrg.jpg fx11 fx11_lrg.jpg jpg 68687 790 2213 IMAGE-HIGH-RES 1-s2.0-S1381116913003348-fx10_lrg.jpg https://s3.amazonaws.com/prod-ucs-content-store-us-east/content/pii:S1381116913003348/fx10/HIGHRES/image/jpeg/b0ce9990694e8883ef803579d8e2ab42/fx10_lrg.jpg https://s3-eu-west-1.amazonaws.com/prod-ucs-content-store-eu-west/content/pii:S1381116913003348/fx10/HIGHRES/image/jpeg/b0ce9990694e8883ef803579d8e2ab42/fx10_lrg.jpg fx10 fx10_lrg.jpg jpg 57535 491 2213 IMAGE-HIGH-RES 1-s2.0-S1381116913003348-fx1_lrg.jpg https://s3.amazonaws.com/prod-ucs-content-store-us-east/content/pii:S1381116913003348/fx1/HIGHRES/image/jpeg/f42b5a2e495af680e978ffe443a16aec/fx1_lrg.jpg https://s3-eu-west-1.amazonaws.com/prod-ucs-content-store-eu-west/content/pii:S1381116913003348/fx1/HIGHRES/image/jpeg/f42b5a2e495af680e978ffe443a16aec/fx1_lrg.jpg fx1 true fx1_lrg.jpg jpg 205376 886 2209 IMAGE-HIGH-RES 1-s2.0-S1381116913003348-gr5_lrg.gif https://s3.amazonaws.com/prod-ucs-content-store-us-east/content/pii:S1381116913003348/gr5/HIGHRES/image/gif/99112442bd16d03530b445cb7f16385a/gr5_lrg.gif https://s3-eu-west-1.amazonaws.com/prod-ucs-content-store-eu-west/content/pii:S1381116913003348/gr5/HIGHRES/image/gif/99112442bd16d03530b445cb7f16385a/gr5_lrg.gif gr5 gr5_lrg.gif gif 230295 7597 4333 IMAGE-HIGH-RES 1-s2.0-S1381116913003348-gr1_lrg.gif https://s3.amazonaws.com/prod-ucs-content-store-us-east/content/pii:S1381116913003348/gr1/HIGHRES/image/gif/7b9d6f3cb17e496fb354ba58beeccfec/gr1_lrg.gif https://s3-eu-west-1.amazonaws.com/prod-ucs-content-store-eu-west/content/pii:S1381116913003348/gr1/HIGHRES/image/gif/7b9d6f3cb17e496fb354ba58beeccfec/gr1_lrg.gif gr1 gr1_lrg.gif gif 210159 6012 3357 IMAGE-HIGH-RES 1-s2.0-S1381116913003348-sc2.jpg https://s3.amazonaws.com/prod-ucs-content-store-us-east/content/pii:S1381116913003348/sc2/DOWNSAMPLED/image/jpeg/227d6e556f18c096e2fa219bce4b32da/sc2.jpg https://s3-eu-west-1.amazonaws.com/prod-ucs-content-store-eu-west/content/pii:S1381116913003348/sc2/DOWNSAMPLED/image/jpeg/227d6e556f18c096e2fa219bce4b32da/sc2.jpg sc2 sc2.jpg jpg 31448 312 715 IMAGE-DOWNSAMPLED 1-s2.0-S1381116913003348-sc1.jpg https://s3.amazonaws.com/prod-ucs-content-store-us-east/content/pii:S1381116913003348/sc1/DOWNSAMPLED/image/jpeg/42d976223895e131fd7ecbb31b8346f7/sc1.jpg https://s3-eu-west-1.amazonaws.com/prod-ucs-content-store-eu-west/content/pii:S1381116913003348/sc1/DOWNSAMPLED/image/jpeg/42d976223895e131fd7ecbb31b8346f7/sc1.jpg sc1 sc1.jpg jpg 28921 359 543 IMAGE-DOWNSAMPLED 1-s2.0-S1381116913003348-gr8.jpg https://s3.amazonaws.com/prod-ucs-content-store-us-east/content/pii:S1381116913003348/gr8/DOWNSAMPLED/image/jpeg/158f4bd5a24d751a571b3a9a745a374d/gr8.jpg https://s3-eu-west-1.amazonaws.com/prod-ucs-content-store-eu-west/content/pii:S1381116913003348/gr8/DOWNSAMPLED/image/jpeg/158f4bd5a24d751a571b3a9a745a374d/gr8.jpg gr8 gr8.jpg jpg 28498 318 565 IMAGE-DOWNSAMPLED 1-s2.0-S1381116913003348-gr7.jpg https://s3.amazonaws.com/prod-ucs-content-store-us-east/content/pii:S1381116913003348/gr7/DOWNSAMPLED/image/jpeg/5c15ef218a9252a35f51dc02ed9694ca/gr7.jpg https://s3-eu-west-1.amazonaws.com/prod-ucs-content-store-eu-west/content/pii:S1381116913003348/gr7/DOWNSAMPLED/image/jpeg/5c15ef218a9252a35f51dc02ed9694ca/gr7.jpg gr7 gr7.jpg jpg 84003 479 811 IMAGE-DOWNSAMPLED 1-s2.0-S1381116913003348-gr6.jpg https://s3.amazonaws.com/prod-ucs-content-store-us-east/content/pii:S1381116913003348/gr6/DOWNSAMPLED/image/jpeg/9bf543ba05dbe18cf466aecfc3d2ba39/gr6.jpg https://s3-eu-west-1.amazonaws.com/prod-ucs-content-store-eu-west/content/pii:S1381116913003348/gr6/DOWNSAMPLED/image/jpeg/9bf543ba05dbe18cf466aecfc3d2ba39/gr6.jpg gr6 gr6.jpg jpg 87867 997 561 IMAGE-DOWNSAMPLED 1-s2.0-S1381116913003348-gr4.jpg https://s3.amazonaws.com/prod-ucs-content-store-us-east/content/pii:S1381116913003348/gr4/DOWNSAMPLED/image/jpeg/5a425cb0fded49800de6a85ab18692b1/gr4.jpg https://s3-eu-west-1.amazonaws.com/prod-ucs-content-store-eu-west/content/pii:S1381116913003348/gr4/DOWNSAMPLED/image/jpeg/5a425cb0fded49800de6a85ab18692b1/gr4.jpg gr4 gr4.jpg jpg 17184 370 242 IMAGE-DOWNSAMPLED 1-s2.0-S1381116913003348-gr3.jpg https://s3.amazonaws.com/prod-ucs-content-store-us-east/content/pii:S1381116913003348/gr3/DOWNSAMPLED/image/jpeg/4c24990aeb0f6b03fa11e18e46c387a2/gr3.jpg https://s3-eu-west-1.amazonaws.com/prod-ucs-content-store-eu-west/content/pii:S1381116913003348/gr3/DOWNSAMPLED/image/jpeg/4c24990aeb0f6b03fa11e18e46c387a2/gr3.jpg gr3 gr3.jpg jpg 52681 442 344 IMAGE-DOWNSAMPLED 1-s2.0-S1381116913003348-gr2.jpg https://s3.amazonaws.com/prod-ucs-content-store-us-east/content/pii:S1381116913003348/gr2/DOWNSAMPLED/image/jpeg/3ec325a7fd684d98d7ab7f7ef3b21f69/gr2.jpg https://s3-eu-west-1.amazonaws.com/prod-ucs-content-store-eu-west/content/pii:S1381116913003348/gr2/DOWNSAMPLED/image/jpeg/3ec325a7fd684d98d7ab7f7ef3b21f69/gr2.jpg gr2 gr2.jpg jpg 46549 418 565 IMAGE-DOWNSAMPLED 1-s2.0-S1381116913003348-fx9.jpg https://s3.amazonaws.com/prod-ucs-content-store-us-east/content/pii:S1381116913003348/fx9/DOWNSAMPLED/image/jpeg/dab25c4287c407db9b68a2b1ae176ebb/fx9.jpg https://s3-eu-west-1.amazonaws.com/prod-ucs-content-store-eu-west/content/pii:S1381116913003348/fx9/DOWNSAMPLED/image/jpeg/dab25c4287c407db9b68a2b1ae176ebb/fx9.jpg fx9 fx9.jpg jpg 10730 200 334 IMAGE-DOWNSAMPLED 1-s2.0-S1381116913003348-fx8.jpg https://s3.amazonaws.com/prod-ucs-content-store-us-east/content/pii:S1381116913003348/fx8/DOWNSAMPLED/image/jpeg/fdb89eb3089170adeb7991524ebf7c86/fx8.jpg https://s3-eu-west-1.amazonaws.com/prod-ucs-content-store-eu-west/content/pii:S1381116913003348/fx8/DOWNSAMPLED/image/jpeg/fdb89eb3089170adeb7991524ebf7c86/fx8.jpg fx8 fx8.jpg jpg 6690 200 169 IMAGE-DOWNSAMPLED 1-s2.0-S1381116913003348-fx7.jpg https://s3.amazonaws.com/prod-ucs-content-store-us-east/content/pii:S1381116913003348/fx7/DOWNSAMPLED/image/jpeg/6bd5d86b027faf386be683c94cfcaed1/fx7.jpg https://s3-eu-west-1.amazonaws.com/prod-ucs-content-store-eu-west/content/pii:S1381116913003348/fx7/DOWNSAMPLED/image/jpeg/6bd5d86b027faf386be683c94cfcaed1/fx7.jpg fx7 fx7.jpg jpg 6892 94 500 IMAGE-DOWNSAMPLED 1-s2.0-S1381116913003348-fx6.jpg https://s3.amazonaws.com/prod-ucs-content-store-us-east/content/pii:S1381116913003348/fx6/DOWNSAMPLED/image/jpeg/dcd133381a1df485c5f607af836715b1/fx6.jpg https://s3-eu-west-1.amazonaws.com/prod-ucs-content-store-eu-west/content/pii:S1381116913003348/fx6/DOWNSAMPLED/image/jpeg/dcd133381a1df485c5f607af836715b1/fx6.jpg fx6 fx6.jpg jpg 7711 151 500 IMAGE-DOWNSAMPLED 1-s2.0-S1381116913003348-fx5.jpg https://s3.amazonaws.com/prod-ucs-content-store-us-east/content/pii:S1381116913003348/fx5/DOWNSAMPLED/image/jpeg/70c80c703d106be8a59991c4da5b07be/fx5.jpg https://s3-eu-west-1.amazonaws.com/prod-ucs-content-store-eu-west/content/pii:S1381116913003348/fx5/DOWNSAMPLED/image/jpeg/70c80c703d106be8a59991c4da5b07be/fx5.jpg fx5 fx5.jpg jpg 10033 120 500 IMAGE-DOWNSAMPLED 1-s2.0-S1381116913003348-fx4.jpg https://s3.amazonaws.com/prod-ucs-content-store-us-east/content/pii:S1381116913003348/fx4/DOWNSAMPLED/image/jpeg/cbe7a2e03869f5c4367e078f0f3f9a96/fx4.jpg https://s3-eu-west-1.amazonaws.com/prod-ucs-content-store-eu-west/content/pii:S1381116913003348/fx4/DOWNSAMPLED/image/jpeg/cbe7a2e03869f5c4367e078f0f3f9a96/fx4.jpg fx4 fx4.jpg jpg 8175 200 440 IMAGE-DOWNSAMPLED 1-s2.0-S1381116913003348-fx3.jpg https://s3.amazonaws.com/prod-ucs-content-store-us-east/content/pii:S1381116913003348/fx3/DOWNSAMPLED/image/jpeg/e22db972cd47b8a71d027201f2810f62/fx3.jpg https://s3-eu-west-1.amazonaws.com/prod-ucs-content-store-eu-west/content/pii:S1381116913003348/fx3/DOWNSAMPLED/image/jpeg/e22db972cd47b8a71d027201f2810f62/fx3.jpg fx3 fx3.jpg jpg 8550 198 500 IMAGE-DOWNSAMPLED 1-s2.0-S1381116913003348-fx2.jpg https://s3.amazonaws.com/prod-ucs-content-store-us-east/content/pii:S1381116913003348/fx2/DOWNSAMPLED/image/jpeg/c84f9e5391c32165774b29ec51093ca0/fx2.jpg https://s3-eu-west-1.amazonaws.com/prod-ucs-content-store-eu-west/content/pii:S1381116913003348/fx2/DOWNSAMPLED/image/jpeg/c84f9e5391c32165774b29ec51093ca0/fx2.jpg fx2 fx2.jpg jpg 6583 200 320 IMAGE-DOWNSAMPLED 1-s2.0-S1381116913003348-fx11.jpg https://s3.amazonaws.com/prod-ucs-content-store-us-east/content/pii:S1381116913003348/fx11/DOWNSAMPLED/image/jpeg/26910218c9fcb57f05901365cec8b1f6/fx11.jpg https://s3-eu-west-1.amazonaws.com/prod-ucs-content-store-eu-west/content/pii:S1381116913003348/fx11/DOWNSAMPLED/image/jpeg/26910218c9fcb57f05901365cec8b1f6/fx11.jpg fx11 fx11.jpg jpg 9066 178 500 IMAGE-DOWNSAMPLED 1-s2.0-S1381116913003348-fx10.jpg https://s3.amazonaws.com/prod-ucs-content-store-us-east/content/pii:S1381116913003348/fx10/DOWNSAMPLED/image/jpeg/231444ec1a95e8a0b2fbdca16fe9a809/fx10.jpg https://s3-eu-west-1.amazonaws.com/prod-ucs-content-store-eu-west/content/pii:S1381116913003348/fx10/DOWNSAMPLED/image/jpeg/231444ec1a95e8a0b2fbdca16fe9a809/fx10.jpg fx10 fx10.jpg jpg 7553 111 500 IMAGE-DOWNSAMPLED 1-s2.0-S1381116913003348-fx1.jpg https://s3.amazonaws.com/prod-ucs-content-store-us-east/content/pii:S1381116913003348/fx1/DOWNSAMPLED/image/jpeg/dfa147d4adb407b0b024fdf9efc594a8/fx1.jpg https://s3-eu-west-1.amazonaws.com/prod-ucs-content-store-eu-west/content/pii:S1381116913003348/fx1/DOWNSAMPLED/image/jpeg/dfa147d4adb407b0b024fdf9efc594a8/fx1.jpg fx1 true fx1.jpg jpg 27217 200 499 IMAGE-DOWNSAMPLED 1-s2.0-S1381116913003348-gr5.gif https://s3.amazonaws.com/prod-ucs-content-store-us-east/content/pii:S1381116913003348/gr5/DOWNSAMPLED/image/gif/3a110e5482d080dfaf35eb0cabc336b9/gr5.gif https://s3-eu-west-1.amazonaws.com/prod-ucs-content-store-eu-west/content/pii:S1381116913003348/gr5/DOWNSAMPLED/image/gif/3a110e5482d080dfaf35eb0cabc336b9/gr5.gif gr5 gr5.gif gif 25980 857 489 IMAGE-DOWNSAMPLED 1-s2.0-S1381116913003348-gr1.gif https://s3.amazonaws.com/prod-ucs-content-store-us-east/content/pii:S1381116913003348/gr1/DOWNSAMPLED/image/gif/ffec855a53089c2ef0b0d0b580bed5c0/gr1.gif https://s3-eu-west-1.amazonaws.com/prod-ucs-content-store-eu-west/content/pii:S1381116913003348/gr1/DOWNSAMPLED/image/gif/ffec855a53089c2ef0b0d0b580bed5c0/gr1.gif gr1 gr1.gif gif 22464 679 379 IMAGE-DOWNSAMPLED 1-s2.0-S1381116913003348-gr5.sml https://s3.amazonaws.com/prod-ucs-content-store-us-east/content/pii:S1381116913003348/gr5/THUMBNAIL/image/gif/999a46dc0956133ba641d7560be8b0f5/gr5.sml https://s3-eu-west-1.amazonaws.com/prod-ucs-content-store-eu-west/content/pii:S1381116913003348/gr5/THUMBNAIL/image/gif/999a46dc0956133ba641d7560be8b0f5/gr5.sml gr5 gr5.sml sml 2469 163 93 IMAGE-THUMBNAIL 1-s2.0-S1381116913003348-gr1.sml https://s3.amazonaws.com/prod-ucs-content-store-us-east/content/pii:S1381116913003348/gr1/THUMBNAIL/image/gif/652a48eea6b150d417cfada536f17230/gr1.sml https://s3-eu-west-1.amazonaws.com/prod-ucs-content-store-eu-west/content/pii:S1381116913003348/gr1/THUMBNAIL/image/gif/652a48eea6b150d417cfada536f17230/gr1.sml gr1 gr1.sml sml 2648 163 91 IMAGE-THUMBNAIL 1-s2.0-S1381116913003348-sc2.sml https://s3.amazonaws.com/prod-ucs-content-store-us-east/content/pii:S1381116913003348/sc2/THUMBNAIL/image/gif/441fb1cda3fdc45b5d64c7c59cdbf612/sc2.sml https://s3-eu-west-1.amazonaws.com/prod-ucs-content-store-eu-west/content/pii:S1381116913003348/sc2/THUMBNAIL/image/gif/441fb1cda3fdc45b5d64c7c59cdbf612/sc2.sml sc2 sc2.sml sml 3067 96 219 IMAGE-THUMBNAIL 1-s2.0-S1381116913003348-sc1.sml https://s3.amazonaws.com/prod-ucs-content-store-us-east/content/pii:S1381116913003348/sc1/THUMBNAIL/image/gif/3ca544214f10a2f2495415a5f37149d3/sc1.sml https://s3-eu-west-1.amazonaws.com/prod-ucs-content-store-eu-west/content/pii:S1381116913003348/sc1/THUMBNAIL/image/gif/3ca544214f10a2f2495415a5f37149d3/sc1.sml sc1 sc1.sml sml 4368 145 219 IMAGE-THUMBNAIL 1-s2.0-S1381116913003348-gr8.sml https://s3.amazonaws.com/prod-ucs-content-store-us-east/content/pii:S1381116913003348/gr8/THUMBNAIL/image/gif/3173041d3d25c17358e2db151e0f056a/gr8.sml https://s3-eu-west-1.amazonaws.com/prod-ucs-content-store-eu-west/content/pii:S1381116913003348/gr8/THUMBNAIL/image/gif/3173041d3d25c17358e2db151e0f056a/gr8.sml gr8 gr8.sml sml 6154 123 219 IMAGE-THUMBNAIL 1-s2.0-S1381116913003348-gr7.sml https://s3.amazonaws.com/prod-ucs-content-store-us-east/content/pii:S1381116913003348/gr7/THUMBNAIL/image/gif/4a712a80a9ec73bd492f2e52a293e18c/gr7.sml https://s3-eu-west-1.amazonaws.com/prod-ucs-content-store-eu-west/content/pii:S1381116913003348/gr7/THUMBNAIL/image/gif/4a712a80a9ec73bd492f2e52a293e18c/gr7.sml gr7 gr7.sml sml 5255 129 219 IMAGE-THUMBNAIL 1-s2.0-S1381116913003348-gr6.sml https://s3.amazonaws.com/prod-ucs-content-store-us-east/content/pii:S1381116913003348/gr6/THUMBNAIL/image/gif/8d9f3ee407188fe78b287a485b2d840b/gr6.sml https://s3-eu-west-1.amazonaws.com/prod-ucs-content-store-eu-west/content/pii:S1381116913003348/gr6/THUMBNAIL/image/gif/8d9f3ee407188fe78b287a485b2d840b/gr6.sml gr6 gr6.sml sml 4657 164 92 IMAGE-THUMBNAIL 1-s2.0-S1381116913003348-gr4.sml https://s3.amazonaws.com/prod-ucs-content-store-us-east/content/pii:S1381116913003348/gr4/THUMBNAIL/image/gif/d6c9a34b4f14b62acf8c03c440d0492a/gr4.sml https://s3-eu-west-1.amazonaws.com/prod-ucs-content-store-eu-west/content/pii:S1381116913003348/gr4/THUMBNAIL/image/gif/d6c9a34b4f14b62acf8c03c440d0492a/gr4.sml gr4 gr4.sml sml 3561 164 107 IMAGE-THUMBNAIL 1-s2.0-S1381116913003348-gr3.sml https://s3.amazonaws.com/prod-ucs-content-store-us-east/content/pii:S1381116913003348/gr3/THUMBNAIL/image/gif/f4f9c2828e07df52cf0ec5c642cd3d5a/gr3.sml https://s3-eu-west-1.amazonaws.com/prod-ucs-content-store-eu-west/content/pii:S1381116913003348/gr3/THUMBNAIL/image/gif/f4f9c2828e07df52cf0ec5c642cd3d5a/gr3.sml gr3 gr3.sml sml 4475 163 127 IMAGE-THUMBNAIL 1-s2.0-S1381116913003348-gr2.sml https://s3.amazonaws.com/prod-ucs-content-store-us-east/content/pii:S1381116913003348/gr2/THUMBNAIL/image/gif/4c0b1c44cf7c8595655c9c3a91d7f18a/gr2.sml https://s3-eu-west-1.amazonaws.com/prod-ucs-content-store-eu-west/content/pii:S1381116913003348/gr2/THUMBNAIL/image/gif/4c0b1c44cf7c8595655c9c3a91d7f18a/gr2.sml gr2 gr2.sml sml 6490 162 219 IMAGE-THUMBNAIL 1-s2.0-S1381116913003348-fx9.sml https://s3.amazonaws.com/prod-ucs-content-store-us-east/content/pii:S1381116913003348/fx9/THUMBNAIL/image/gif/04c654baf5b3557f135176c38a926ee8/fx9.sml https://s3-eu-west-1.amazonaws.com/prod-ucs-content-store-eu-west/content/pii:S1381116913003348/fx9/THUMBNAIL/image/gif/04c654baf5b3557f135176c38a926ee8/fx9.sml fx9 fx9.sml sml 4087 131 219 IMAGE-THUMBNAIL 1-s2.0-S1381116913003348-fx8.sml https://s3.amazonaws.com/prod-ucs-content-store-us-east/content/pii:S1381116913003348/fx8/THUMBNAIL/image/gif/d55719937f21213b1a3e0b2dfb9a4c72/fx8.sml https://s3-eu-west-1.amazonaws.com/prod-ucs-content-store-eu-west/content/pii:S1381116913003348/fx8/THUMBNAIL/image/gif/d55719937f21213b1a3e0b2dfb9a4c72/fx8.sml fx8 fx8.sml sml 4271 163 138 IMAGE-THUMBNAIL 1-s2.0-S1381116913003348-fx7.sml https://s3.amazonaws.com/prod-ucs-content-store-us-east/content/pii:S1381116913003348/fx7/THUMBNAIL/image/gif/c6f454d59b0bf1c04cea28dc7dd5d9d7/fx7.sml https://s3-eu-west-1.amazonaws.com/prod-ucs-content-store-eu-west/content/pii:S1381116913003348/fx7/THUMBNAIL/image/gif/c6f454d59b0bf1c04cea28dc7dd5d9d7/fx7.sml fx7 fx7.sml sml 1941 41 219 IMAGE-THUMBNAIL 1-s2.0-S1381116913003348-fx6.sml https://s3.amazonaws.com/prod-ucs-content-store-us-east/content/pii:S1381116913003348/fx6/THUMBNAIL/image/gif/0942d835c2c0a2326a846fb8b4b751cb/fx6.sml https://s3-eu-west-1.amazonaws.com/prod-ucs-content-store-eu-west/content/pii:S1381116913003348/fx6/THUMBNAIL/image/gif/0942d835c2c0a2326a846fb8b4b751cb/fx6.sml fx6 fx6.sml sml 2230 66 219 IMAGE-THUMBNAIL 1-s2.0-S1381116913003348-fx5.sml https://s3.amazonaws.com/prod-ucs-content-store-us-east/content/pii:S1381116913003348/fx5/THUMBNAIL/image/gif/706c06dbde6a8d8cf7dff481b4cfbc9c/fx5.sml https://s3-eu-west-1.amazonaws.com/prod-ucs-content-store-eu-west/content/pii:S1381116913003348/fx5/THUMBNAIL/image/gif/706c06dbde6a8d8cf7dff481b4cfbc9c/fx5.sml fx5 fx5.sml sml 2552 53 219 IMAGE-THUMBNAIL 1-s2.0-S1381116913003348-fx4.sml https://s3.amazonaws.com/prod-ucs-content-store-us-east/content/pii:S1381116913003348/fx4/THUMBNAIL/image/gif/31378ce8c367f51bb782cb917d855e08/fx4.sml https://s3-eu-west-1.amazonaws.com/prod-ucs-content-store-eu-west/content/pii:S1381116913003348/fx4/THUMBNAIL/image/gif/31378ce8c367f51bb782cb917d855e08/fx4.sml fx4 fx4.sml sml 3206 100 219 IMAGE-THUMBNAIL 1-s2.0-S1381116913003348-fx3.sml https://s3.amazonaws.com/prod-ucs-content-store-us-east/content/pii:S1381116913003348/fx3/THUMBNAIL/image/gif/3cdef20ba0e74cc1321f629ed6b6f254/fx3.sml https://s3-eu-west-1.amazonaws.com/prod-ucs-content-store-eu-west/content/pii:S1381116913003348/fx3/THUMBNAIL/image/gif/3cdef20ba0e74cc1321f629ed6b6f254/fx3.sml fx3 fx3.sml sml 2657 87 219 IMAGE-THUMBNAIL 1-s2.0-S1381116913003348-fx2.sml https://s3.amazonaws.com/prod-ucs-content-store-us-east/content/pii:S1381116913003348/fx2/THUMBNAIL/image/gif/28a2a7470fb94ba173b3041d59989db2/fx2.sml https://s3-eu-west-1.amazonaws.com/prod-ucs-content-store-eu-west/content/pii:S1381116913003348/fx2/THUMBNAIL/image/gif/28a2a7470fb94ba173b3041d59989db2/fx2.sml fx2 fx2.sml sml 3759 137 219 IMAGE-THUMBNAIL 1-s2.0-S1381116913003348-fx11.sml https://s3.amazonaws.com/prod-ucs-content-store-us-east/content/pii:S1381116913003348/fx11/THUMBNAIL/image/gif/5d7e6ed3c922fc4b76fd28d056c63243/fx11.sml https://s3-eu-west-1.amazonaws.com/prod-ucs-content-store-eu-west/content/pii:S1381116913003348/fx11/THUMBNAIL/image/gif/5d7e6ed3c922fc4b76fd28d056c63243/fx11.sml fx11 fx11.sml sml 2675 78 219 IMAGE-THUMBNAIL 1-s2.0-S1381116913003348-fx10.sml https://s3.amazonaws.com/prod-ucs-content-store-us-east/content/pii:S1381116913003348/fx10/THUMBNAIL/image/gif/f1619c3d50e72c18e20cdba5950cac38/fx10.sml https://s3-eu-west-1.amazonaws.com/prod-ucs-content-store-eu-west/content/pii:S1381116913003348/fx10/THUMBNAIL/image/gif/f1619c3d50e72c18e20cdba5950cac38/fx10.sml fx10 fx10.sml sml 2356 49 219 IMAGE-THUMBNAIL 1-s2.0-S1381116913003348-fx1.sml https://s3.amazonaws.com/prod-ucs-content-store-us-east/content/pii:S1381116913003348/fx1/THUMBNAIL/image/gif/603912017b7d719beff31b6b1bb53fa3/fx1.sml https://s3-eu-west-1.amazonaws.com/prod-ucs-content-store-eu-west/content/pii:S1381116913003348/fx1/THUMBNAIL/image/gif/603912017b7d719beff31b6b1bb53fa3/fx1.sml fx1 true fx1.sml sml 6034 88 219 IMAGE-THUMBNAIL MOLCAA 8863 S1381-1169(13)00334-8 10.1016/j.molcata.2013.09.009 Elsevier B.V. Scheme 1 POM-ILs structures. Scheme 2 Synthesis of POM-IL catalysts. Fig. 1 IR spectra of (a) PW, (b) [PyPS]PW, (c) [BuPyPS]PW, (d) [PhPyPS]PW, (e) [BzPyPS]PW and (f) reused [PhPyPS]PW. Fig. 2 (a) Monitoring of the decrease in MPS absorbance with increasing the reaction time; (b) Comparison of the oxidation rates of the catalysts, monitored by UV–vis spectroscopy at 250nm (MPS: 5mmol, H2O2: 10mmol, and catalyst: 0.5mol%, in H2O at room temperature). Fig. 3 Solubility-temperature diagrams of the POM-ILs in water. Fig. 4 UV–vis spectra of [PhPyPS]PW catalyst in water before and during the oxidation reaction with H2O2 (Catalyst: 10−5 M; H2O2: 5×10−2 M; MPS: 10−2 M). Fig. 5 Cyclic voltammograms for PW (5×10−4 M) and the POM-ILs (5×10−4 M) in phosphate buffer (0.1M), pH=1, scan rate: 0.1V/s, ambient temperature (20±5°C). Fig. 6 Effect of (a) MPS: H2O2 molar ratio (catalyst loading: 0.5mol%; MPS: 5mmol), (b) catalyst loading (MPS: 5mmol; H2O2: 5mmol) and (c) catalyst loading (MPS: 5mmol; H2O2: 20mmol) in the selective oxidation of MPS in the presence of [PhPyPS]PW catalyst in H2O at room temperature. Fig. 7 (a) Monitoring of the decrease in DBT absorbance with increasing the reaction time (DBT: 5mmol, H2O2: 20mmol, and catalyst: 0.5mol%, in H2O: EtOH (7:3 v/v, 10mL) at 60°C); Effect of (b) DBT: H2O2 molar ratio (catalyst loading: 0.5mol%, DBT: 5mmol), (c) catalyst loading (DBT: 5mmol, H2O2: 10mmol), and (d) catalyst loading (DBT: 5mmol, H2O2: 30mmol) in the selective oxidation of DBT in the presence of [PhPyPS]PW catalyst in H2O: EtOH (7:3 v/v, 10mL) at 60°C. Fig. 8 Reusability of [PhPyPS]PW catalyst in (a) oxidation of MPS (MPS: 5mmol, H2O2: 5mmol, and catalyst: 0.25mol% in H2O at room temperature) and (b) oxidative desulfurization of model oil (DBT: 100ppm in n-decane, H2O2: 2.5mmol, and catalyst: 1.0mol% in H2O: EtOH (7:3 v/v, 5mL) at 60°C for 2h). Table 1 Selective oxidation of sulfides to sulfoxides and sulfones with 30% aq. H2O2 using [PhPyPS]PW as catalyst. Entry Substrate Yield a (selectivity) (%) Sulfoxide b Sulfone c 1 98 (100) 98 (100) 2 98 (100) 98 (100) 3 85 (100) 90 (94) 4 98 (100) 98 (100) 5 90 (100) 95 (100) 6 90 (100) 95 (100) 7 75 (100) 80 (94) 8 95 (95) d 95 (100) e 9 98 (100) d 98 (100) e 10 95 (95) d 90 (100) e a Isolated yield. b Method (a). c Method (b). d Method (c). e Method (d). Table 2 Comparison of the reaction data with other reported methods. Substrate Catalyst Reaction conditions Yield (%) MPS [PhPyPS]PW H2O2, H2O, r.t., 20min 98 MPS [47] CinH3PMo12O40, (Cin=cinchonine) H2O2/urea, EtOH, r.t., 2h 95 MPS [7] PyH3PMo11VO40 H2O2, CH3CN, r.t., 3h 100 MPS [48] [γ-PW10O38V2(μ-OH)2]3− H2O2/HClO4, CH3CN/tert-BuOH, r.t., 2h 99 DBT(1000ppm) [PhPyPS]PW H2O2, H2O/EtOH, 60°C, 2h 93.6 DBT(1000ppm) [PhPyPS]PW H2O2, H2O/EtOH, 60°C, 2h 99.2 DBT (500ppm) [49] H3PW12O40/TiO2 H2O2, CH3CN, 60°C, 2h 95.2 DBT (500ppm) [26] [Bmim]3PMo12O40/SiO2 H2O2, 60°C, 2h 100 DBT (500ppm) [25] [MIMPS]3PW12O40 2H2O H2O2, [Omim]PF6, r.t., 1h 99.5 Organic–inorganic polyoxometalate based salts as thermoregulated phase-separable catalysts for selective oxidation of thioethers and thiophenes and deep desulfurization of model fuels Ezzat Rafiee ⁎ Sara Eavani Faculty of Chemistry, Razi University, Kermanshah 67149, Iran Faculty of Chemistry, Razi University Kermanshah 67149 Iran ⁎ Corresponding author. Tel.: +98 831 427 4559; fax: +98 831 427 4559. Graphical abstract Synthesis of various organic–inorganic polyoxometalate based salts composed of sulfonated pyridinum cations and the Keggin tungstophosphate anion (PW12O40 3−) and their subsequent application in the oxidation of methyl phenyl sulfide with hydrogen peroxide in aqueous media was reported. Special attention was paid to the temperature-dependent solubility of the salts as a function of the organic cation in water. Cyclic voltammetry was further used for the investigation of the redox behavior of these catalysts. Based on these properties, a novel thermoregulated phase-separable catalyst was introduced and successfully used for the selective oxidation of thioethers and thiophenes to the corresponding sulfoxides or sulfones. Catalytic oxidation of the sulfur-containing model oil (methyl phenyl sulfide, dibenzothiophene and thiophene) was also studied under optimized conditions. In both cases, excellent conversion and selectivity were obtained in relatively short reaction times. This novel catalyst showed the characteristic of homogeneous reaction at ambient temperatures and phase-separation at lower temperatures. By simple decantation, the catalyst could be easily separated from the products upon cooling of the reaction mixture and could be reused several times with high recycling efficiency. Keywords Polyoxometalates Thermoregulated catalyst Deep desulfurization Sulfur Oxidation 1 Introduction The research and application of “Green Chemistry” principles have led to the development of cleaner processes. In this sense, polyoxometalates (POMs) are widely-used as green catalysts especially in H2O2-based oxidation reactions [1–6], whereas no corrosive species are involved in the reaction system. Much attention has currently been focused on the use of the POMs as catalysts in the selective oxidation of organic sulfur compounds [7–10], not only for the syntheses of sulfoxides and sulfones as synthetic intermediates in pharmaceutical field [11] but also in the oxidative desulfurization (ODS) process as an effective method to remove of sulfur compounds from fuels and industrial effluents, in order to satisfy the new environmental legislations [12–14]. The homogeneous POMs are remarkably efficient, but they share a common drawback: separation and reuse of the catalyst is extremely difficult. For this reason, future practical applications of POMs will also require methods for “catalyst engineering” to aid in catalyst recovery and recycling. Recently, many improvements were developed for the synthesis of new organic–inorganic salts through the different combinations of various organic cations with POM anions [15–17]. Obviously, these new hybrids have emerged as one of the most potentially significant fields of investigation in catalysis [18–21]. Until now, a few reports have been published on ODS catalyzed with organic–inorganic POM-based salts [22–29]. Recent examples can be classified into two groups. One of them includes amphiphilic catalysts that have been synthesized by combining quaternary ammonium cations and POMs anions [22–24]. These compounds have ability to form emulsion droplets, which perform as homogeneous catalysts in the interface of two immiscible liquids to achieve high activities during the oxidative process. However, the de-emulsification for catalyst recovery is often challenging in a large-scale unit. Catalyst recovery in an active form suitable for recycling is generally not feasible and the products may be contaminated with catalyst residues. This situation often leads to the expensive purification procedures which disagree with the development of more sustainable processes. Recent advances in ionic liquids (ILs) research provide another route for achieving organic–inorganic POM-based salts which have been constructed by creation of electrostatic interactions between the organic IL cation and the POM anion (POM-IL salts) [15–17]. To our knowledge there are few papers about the use of POM-based salts in the selective oxidation of organic sulfur compounds and applications in the elimination of sulfur content in diesel are quite limited. [MIMPS]PW/[Omim]PF6 and [PyPS]PW/[Omim]PF6 catalytic systems (Scheme 1 ) have been used to deep desulfurization of fuels [25,26]. However, the disadvantages of these strategies are also obvious. While used as the reaction media, the [Omim]PF6 is consumed in large amounts. Bearing in mind that [Omim]PF6 is fairly expensive and easily yields white fumes of HF or hydrate precipitates. Furthermore, the selectivity for sulfoxides and sulfones present in diesel oil is imperfect and problems associated with catalyst recycling remains a major challenge. Therefore designing a POM-IL system, which can combine the advantages of homogeneous and heterogeneous catalysts, is an attractive field in the chemical research area. One has to take into consideration the fact that physical and chemical properties of the POM-ILs can be tuned by the change in the structure, functional group, or size of the ions [30]. With this fact in mind, we have designed and synthesized a series of novel POM-IL catalysts with the structure close to [PyPS]PW, including [BuPyPS]PW, [PhPyPS]PW, and [BzPyPS]PW (Scheme 1), and investigated the catalytic activities and temperature-dependent solubilities of these compounds in water. According to experimental findings, a novel thermoregulated phase-separable catalyst was introduced for selective oxidation of organic sulfur compounds in aqueous media. The desulfurization of model oil was also investigated under optimized reaction conditions. This novel POM-IL catalyst can be easily separated from products upon cooling of the reaction solution. Thus, the problem associated with the separation and reuse of the catalyst can be well resolved. As to the knowledge of the authors, open literature does not show publications related with these new POM-ILs, therefore no information is available about their activities or temperature-dependent solubilities until now. 2 Experimental 2.1 General All reagents and solvents used in this work were obtained from Fluka, Aldrich or Merck and were used without further purification. H3PW12O40 (PW) from Aldrich was used. UV–vis spectra were obtained with an Agilent (8453) UV–vis diode-array spectrometer using quartz cells of 1cm optical path. NMR spectra were recorded on a Bruker Avance 200MHz NMR spectrometer with D2O as the solvent and TMS as the internal standard. IR spectra were recorded as KBr pellets using a Shimadzu 470 spectrophotometer. Elemental analyses were performed using CHN Herause rapid model. Melting points were determined using a digital Gallenkamp apparatus and uncorrected. Electrochemical experiments were performed using a computer controlled μ-Autolab modular electrochemical system (Eco Chemie, Utrecht, the Netherlands) driven with GPES software (EcoChemie). The products were analyzed using gas chromatographic–mass spectroscopy (GC–MS) Agilent Technologies 6890N Instrument, equipped with a capillary column 19019J-413 HP-5, and a flame ionization detector. 2.2 Catalysts preparation The POM-IL catalysts were synthesized following the procedure in Scheme 2 . Typically, for the synthesis of [PyPS]3PW catalyst, pyridine (0.11mol) and 1,3-propanesultone (0.10mol) were dissolved in toluene (30mL) and stirred at 40°C for 24h under nitrogen atmosphere. A white precipitate (PyPS) was formed. It was filtered, washed with diethyl ether three times and dried in a vacuum. The resulting PyPS (0.06mol) was added to an aqueous solution of PW (0.02mol PW in 40mL H2O), and then the mixture was stirred at room temperature for 24h. Water was removed in a vacuum to give the final product as a solid. Other catalysts were prepared accordingly. Elemental analyses for the POM-ILs are as follows: Calc. for [PyPS]PW: C, 8.27; H, 1.03; N, 1.20; S, 2.47. Found: C, 8.22; H, 1.05; N, 1.23; S, 2.70. Calc. for [BuPyPS]PW: C, 11.83; H, 1.65; N, 1.15; S, 2.63. Found: C, 11.85; H, 1.68; N, 1.16; S, 2.64. Calc. for [PhPyPS]PW: C, 13.57; H, 1.30; N, 1.13; S, 2.58. Found: C, 13.60; H, 1.32; N, 1.10; S, 2.59. Calc. for [BzPyPS]PW: C, 14.38; H, 1.45; N, 1.11; S, 2.56. Found: C, 14.41; H, 1.46; N, 1.12; S, 2.59. Based on the elemental analyses data, it seems that the POM-IL salts basically consist of [PyPS]3PW, [BuPyPS]3PW, [PhPyPS]3PW and [BzPyPS]3PW respectively. Melting points, IR and 1H NMR data of the organic cations and the POM-ILs are given in the supplementary information. 2.3 Solubility measurement of the POM-ILs in water Solubilities of the POM-ILs in water were measured by means of UV–vis spectroscopy according to the procedures previously reported in literature [31]. The quantitative determination of the amount of dissolved catalysts in water is based on the fact that the POM-ILs have charge transfer bands at 256 ([PyPS]PW), 251 ([BuPyPS]PW), 285 ([PhPyPS]PW) and 250nm ([BzPyPS]PW) (see Fig. 1 in supplementary information). The calibration curve for each POM-ILs was prepared based on standards provided by our laboratory for absorbance values varying from 0 to 2. In this region the calibration curves were almost linear (see supplementary information). To measure the solubility of catalysts, excess amounts of the POM-ILs were added in water (5mL) and vigorously stirred for 6h at different temperatures. An aliquot was separated (from insoluble POM-ILs) by centrifugation and diluted by a factor of 5–20 times. Then the absorption value of these dilution solutions were measured, and the amount of dissolved POM-IL can be calculated using calibration curves, considering the diluted factor. 2.4 Voltammetry experiments The electrochemical reduction of the POM-ILs (5×10−4 M) was studied in phosphate buffer (0.1M), pH=1. A glassy carbon electrode was used as the working electrode and Ag/AgCl as the reference electrode. Cyclic voltammograms (v, 0.1Vs−1) were obtained at ambient temperature (20±5°C). 2.5 Catalytic reactions 2.5.1 Reaction progress monitoring Progress of model reactions was monitored by UV–vis spectroscopy which measured the decrease in the absorbance of methyl phenyl sulfide (MPS) or dibenzothiophene (DBT) during the reaction. Samples (100μL) were taken out from the reaction mixture at different reaction times and immediately treated with 1mL of distilled water and shaken for few minutes. Later, 1mL of n-hexane was added, and this mixture was again shaken and agitated to develop two phases: the non-polar phase containing MPS or DBT and the polar phase containing catalyst, H2O2 and corresponding sulfoxide and/or sulfone. The organic phase was separated and analyzed by UV–vis spectroscopy and the product was extracted using Et2O from aqueous phase and analyzed after catalyst separation. The solution absorbance was measured at 250nm for MPS and 230nm for DBT. All the measurements were repeated at least three times and the reported values are averages of the individual runs. 2.5.2 Oxidation of liquid sulfides (Table 1, entries 1–7) To a stirred mixture of the sulfide (5mmol), and catalyst (0.05g, 0.25mol%) in water (10mL), 30% aq. H2O2 (0.56mL, 5mmol) was added in one portion. The slurry was stirred at room temperature for 20min. The reaction mixture was cooled to 10°C, and the catalyst was separated by filtration. The corresponding sulfoxide product was extracted with Et2O from the reaction mixture. Evaporation of the solvent afforded the crude product. The crude product was purified by column chromatography on silica gel using EtOAc/hexane as eluent (method (a)). Table 1 . Similar method was utilized to produce sulfones. In this case 2.2mL of 30% aq. H2O2 (20mmol) and 0.15g of catalyst (0.75mol%) were utilized (method (b)). 2.5.3 Oxidation of solid sulfur compounds (Table 1, entries 7–10) To a stirred suspension of the substrate (5mmol), catalyst (0.2g, 1.0mol%) in H2O: EtOH (7:3v/v, 10mL), 30% aq. H2O2 (1.1mL, 10mmol) was added in one portion. The slurry was stirred at 60°C for 45min. The reaction mixture was cooled to 10°C, and the catalyst was separated by filtration. The corresponding sulfoxide product was extracted with Et2O from the reaction mixture. Evaporation of the solvent afforded the crude product. The crude product was purified by column chromatography on silica gel using EtOAc/hexane as eluent (method (c)). Similar method was utilized to produce sulfones. In this case 3.4mL of 30% aq. H2O2 (30mmol) was used for 60min (method (d)). 2.5.4 Oxidative desulfurization of model oil Two model oils were used: (1) Model fuel containing DBT (500ppm means 500mg of DBT per 1L of n-decane), MPS (250ppm) and thiophene (250ppm) in 5mL of n-decane with the corresponding total sulfur concentration 1000ppm and (2) Model fuel containing DBT in 5mL of n-decane with the sulfur concentration 100ppm. The oxidation reaction was carried out using 4.0μmol catalyst (1.0mol%), 2.5mmol H2O2, 5mL model oil in H2O: EtOH (7:3v/v, 5mL) at 60°C for 2h. The oil phase was withdrawn and analyzed by gas chromatography (GC) for concentration of sulfur compounds. After the reaction, the reaction mixture was cooled to 10°C, and the catalyst was recovered by centrifugation. The products were extracted using Et2O from the solvent phase and analyzed by GC–MS. 3 Results and discussion The POM-IL catalysts were synthesized by two-step atom economic reaction (Scheme 2). The zwitterionic-type precursors were prepared through a one-step direct sulfonation reaction of pyridine derivatives and 1,3-propanesultone. The supernatant liquid was analyzed by GC-MS. Based on GC-MS results no by-product was produced in the zwitterions synthesis procedure. The zwitterions acidification was accomplished by mixing of zwitterions with PW, which led to the formation of organic–inorganic salt. The IR spectra are quite useful to find structural and bonding changes in the Keggin unit present in the POM-ILs. The PW Keggin ion structure is well known and consists of a PO4 tetrahedron surrounded by four W3O13 groups formed by edge-sharing octahedra. These groups are connected to each other by corner-sharing oxygens [32]. Accordingly, PW shows typical bands for absorptions at 1080 (PO), 984 (WO), 896 and 814 (WOW) cm−1. The IR spectra of the POM-ILs showed that the basic structure and geometry of the Keggin anion are preserved (Fig. 1). Catalytic activities of the POM-ILs were investigated in the oxidation of MPS as a model substrate using aqueous H2O2 at ambient temperature in water. The oxidation progress with [PyPS]PW/H2O2 was monitored by UV–vis spectroscopy (more details were described in experimental section). It can be seen that the absorption band at 250nm for MPS (in n-hexane) decreases significantly with increasing the reaction time (Fig. 2(a)). The decrease in the absorption maximum at 250nm (ln(A 0/A t)) as a function of reaction time for the organic cations, PW and the POM-ILs are shown in Fig. 2(b). A blank experiment performed in the absence of catalyst showed very low conversion. The counterpart cations showed remarkably poor activities while the conversion is better for the POM-ILs. The course of the oxidation reaction was strongly influenced by the nature of the organic cation in the POM-ILs and decreased in the following order: [PyPS]PW>[PhPyPS]PW>PW>[BuPyPS]PW>[BzPyPS]PW. Solubility of the POM-ILs is the major factor that should be considered in their catalytic applications in view of catalyst recycling. The most used term to describe solvent–solute behavior is “polarity”. The commonly held molecular view of polarity clearly is not appropriate to the POM-ILs. Until recently there was no systematic examination of the complicated nature of POM-ILs/solvent interactions. It seems that the polarity and subsequently solubility or hydrophobic/hydrophilic properties of these compounds as an organic–inorganic POM-based salts is affected by factors including intermolecular interactions such as van der Waals bonds, hydrogen-bonds and electrostatic interactions, the interaction of solvent with pi- and non-bonding electrons, hydrogen bond acidity and basicity and the dispersion force interactions. Each of above factors could be varied by changing the temperature and features which have a significant, temperature-dependent impact on the solubility of these POM-ILs. Solubility-temperature curves of the catalysts in water are shown in Fig. 3 . [PyPS]PW shows high solubility in water even at low temperatures, so it is not suitable choice in the view of catalyst recycling. [BuPyPS]PW, [PhPyPS]PW and [BzPyPS]PW catalysts show relatively good thermoregulated solubility in water. But, [BuPyPS]PW and [BzPyPS]PW exhibit low catalytic activities (Fig. 2(b)). As a result, [PhPyPS]PW was selected as the best catalyst in terms of catalytic activity and solubility. It was insoluble below 15°C and the solubility increases markedly when the temperature rises over 25°C. In addition, the reversibility of solubility is also observed. When the temperature decreases below 15°C, the catalyst dissolved in water precipitates again. Therefore, it may be separated from the reaction mixture, with high recycling efficiency. It has been reported that various peroxo complexes are formed during the reaction, in aqueous solutions of H2O2 with Keggin-type PW and they constitute the basis of what is called the Venturello–Ishii catalytic system [33–36]. These peroxo species actually catalyze the oxidation of organic compounds. The generation of active species was qualitatively studied using UV–vis spectroscopy of the [PhPyPS]PW catalyst under different conditions (Fig. 4 ). The UV–vis spectrum of the catalyst on addition of hydrogen peroxide showed appearance of a new broad band at about 370–400nm and the shoulder peak at 275nm disappeared. Further, with addition of MPS to a solution of the catalyst and H2O2, the intensity of peak in region 370–400nm was significantly decreased and the shoulder peak at 275nm was observed. Based on these results, it is concluded that the reaction of [PhPyPS]PW with hydrogen peroxide leads to the reversible formation of the active species that catalyzes the oxidation of sulfides. However, there is still not a unanimous viewpoint for the mechanisms of oxidations by POM-IL catalysts and hence, the nature of active species remains unclear and it is under investigation in our laboratory. Several studies showed that the presence of a large counter cation, structure and position of the counter cation around the Keggin cage and interaction between the counter cation and the POM anion influence the surface acid-basic properties of POM, kinds of active species, reaction pathway, and subsequently mechanism of oxidation [37–40,5,41]. Cavaleiro and co-workers [41] reported a radical mechanism for the oxidation of cyclooctane. They explained three step mechanisms: 1. Coordination of H2O2 to the W atoms of the tetrahexylammonium (THA) salt to form peroxo complex [W2O3(O2)4]2−. 2. Formation of one-electron reduced tungsten. 3. Activation of H2O2 at the tungsten atoms, by means of the generation of HO• and HOO• radicals. In order to test for an electron-transfer mechanism, the model reaction was carried out in the presence of acrylonitrile (2mmol) as a well-known radical scavenger. The product yield was decreased from 90% to 68% under these conditions which showed that radical mechanism is at least one of the pathways in this oxidation reaction. The redox properties of the catalyst play an important role in the occurrence of the radical process. The cyclic voltammograms of the POM-ILs are shown in Fig. 5 . As a comparison, the cyclic voltammogram of the pure PW is also presented. PW shows three couples of sharp and well-defined redox waves correspond to reversible two-electron reduction/oxidation processes of the POMs [42]. The peak potentials of [PyPS]PW and [PhPyPS]PW catalysts lie almost at the same values as the parent PW and the redox activity of the anion is indeed preserved in these salts. But, as displayed in Fig. 5, the cyclic voltammograms of [BuPyPS]PW and [BzPyPS]PW catalysts show obvious differences. The initial reduction process (I/I′) is irreversible and shifted to negative potentials. The other two reduction peaks (II/II′ and III/III′) are reversible but the reduction peak potentials shift toward negative values and the shift is more pronounced for [BzPyPS]PW compared with [BuPyPS]PW. Because of the poor catalytic activities of these catalysts (Fig. 2(b)), it can be suggested that the initial reduction process of PW plays an important role in model reaction. The onset reduction potential for H2O2 was measured in the presence of PW, [PyPS]PW and [PhPyPS]PW. The direct reduction of H2O2 required a large over potential at most electrode surfaces and no obvious response was observed at the glassy carbon electrode under our experimental conditions. On the basis of the voltammetric results, the reduction of H2O2 in the presence of the PW anion occurred at a potential about −137mV. It is more negative than the reduction potential in the presence of [PyPS]PW ( E Red Onset = 197 mV ) and [PhPyPS]PW ( E Red Onset = 185 mV ). Therefore, these POM-ILs can effectively activate the H2O2 molecule and showed higher catalytic activity compared with PW (Fig. 2(b)). However, the present results do not allow more detailed description of the reaction mechanism. More investigations are inprogress in our laboratory, and will be reported in due course. The influence of different reaction parameters on the selectivity and efficiency of oxidation process was evaluated in the model reaction using [PhPyPS]PW as the best catalyst (Fig. 6 ). At different MPS/H2O2 ratios, we observed different relative amounts of methyl phenyl sulfoxide (MPSO) and methyl phenyl sulfone (MPSO2) (Fig. 6(a)). The optimized conditions for selective production of each of the two compounds were determined. With equal molar amounts of H2O2 and MPS, MPSO was produced with 94% selectivity. Using 0.25mol% of the catalyst to MPS in the same conditions produced MPSO as the sole reaction product (Fig. 6(b)). On the other hand, with excess amounts of H2O2 (1:4) (Fig. 6(a)) and catalyst (0.75mol% to MPS) (Fig. 6(c)), MPSO2 appeared as the sole oxidation product at room temperature. With these optimized results in hand, a series of sulfides was subjected to oxidation under the specific conditions required for sulfoxide or sulfone production (Table 1). Various types of sulfides were oxidized to the corresponding sulfoxide or sulfone with excellent selectivity (Table 1, entries 1–7). Because solid sulfur compounds (Table 1, entries 8–10) are insoluble in aqueous medium, it was necessary to use a co-solvent that solubilizes these compounds in water. Based on literature survey, in polar organic solvents such as acetonitrile, methanol, ethyl acetate and acetone, the oxidation reaction proceeded rather fast, and gave mixture of sulfoxides and sulfones with good conversion [43–45]. Among them, methanol was consequently the solvent of choice. In this study, EtOH was used as the co-solvent since it is derived agricultural products and is renewable, biologically less objectionable in the environment and less toxic compared with methanol. In order to optimize the reaction conditions, DBT, one of the major sulfur-containing compounds present in fuels, was selected as model substrate. It showed absorption band at λ max =230nm (Fig. 7(a)). We selected 7:3v/v H2O:EtOH ratio as the solvent composition, since higher amount of water resulted in precipitation of the DBT. The H2O2-oxidation of DBT was not performed at room temperature. Whereas by increasing the temperature up to 60°C, the catalytic activity was significantly improved and DBT absorption band decreased significantly (Fig. 7(a)). Therefore, the oxidation reaction was performed using different concentrations of H2O2 and different amounts of the catalyst in 60°C (Fig. 7(b)–(d)). The corresponding sulfoxide could be obtained in excellent yield in the presence of 1mol% of catalyst to DBT and 1:2 DBT/H2O2 ratio with trace over-oxidation product (Fig. 7(c)). With increasing the amounts of oxidant to 1:6 DBT/H2O2 ratio, the corresponding sulfone was obtained with 100% selectivity (Fig. 7(d)). The obtained results showed that the solid substrates were completely oxidized to the corresponding sulfoxide and sulfone under these optimized conditions (Table 1, entries 8–10). Based on the above results, the catalytic system was used to ODS of model oil containing DBT (500ppm), MPS (250ppm) and thiophene (250ppm) in 5mL of n-decane with the total sulfur concentration 1000ppm. At the end of the reaction, the upper phase was withdrawn and analyzed by GC. The sulfur in diesel fuel was reduced from 1000ppm to 64ppm (93.6%). In order to investigate the deep desulfurization efficiency of the catalyst, the catalytic system was used to ODS of model oil with low concentration of DBT (100ppm level) in n-decane. The sulfur level was lowered from 100 to 0.8ppm after ODS process. The remaining hydrogen peroxide was determined by CeVI(SO4)2 (0.1M) titration [46] and the efficiency of H2O2 utilization was calculated according to the following formula: [(2×mol (DBT))/(mol (H2O2) consumed)]×100. The direct decomposition of hydrogen peroxide was observed during the oxidation process, but the efficiency of H2O2 was higher than 90% for desulfurization of this model oil (DBT=100ppm). Easy recyclability and the prolonged retention of catalytic activity are very important features for practical applications of catalytic processes. [PhPyPS]PW catalyst has combined the advantages of a one-phase homogeneous catalysis with an easy way of catalyst separation. It was used in four 20min catalytic cycles of MPS oxidation with H2O2 (Fig. 8 (a)). After the reaction, the mixture was cooled to 15°C and the catalyst was separated by filtration after each cycle, washed with ether and dried at 50°C. Five consecutive preparation of MPSO showed no significant loss in yield. After five cycles, the catalyst was recovered and weighed. The loss of 12.5% was found, which is agree with the calculated amount according to Fig. 3 (the solubility of ionic liquids, 0.113mg/mL at 15°C) and the used solvents amount (2mL) in each cycle. If the temperature is reduced to 10°C after the each reaction cycle, the loss of the catalyst can reduced to 9.3% accordingly. When the equivalent amount of lost catalyst is added, the yield can be restored to 98%. Reusability of [PhPyPS]PW catalyst was also investigated in model oil. After the reaction, model oil was transferred from the reaction vessel by separator funnel and the aqueous phase was cooled to 10°C. The catalyst was separated by filtration, washed, dried and used in the next ODS reaction. The oil phase was analyzed by GC for concentration of sulfur compounds. The products were extracted by Et2O from the solvent phase and analyzed by GC-MS. Corresponding sulfones have been obtained with excellent selectivities in all runs. The results indicate that the catalyst can be recycled five times with a slight decrease in desulfurization (Fig. 8(b)). The IR spectrum of reused catalyst confirmed the existence of Keggin structure after five cycles (Fig. 1(f)). Table 2 shows the comparison of catalytic activity of [PhPyPS]PW catalyst with some reported POMs catalyzed H2O2-based sulfoxidation reactions. As can be seen, [PhPyPS]PW catalyst shows considerable activity with unique thermoregulated phase-separable behavior in comparison with the others. 4 Conclusion In agreement with the ever increasing environmental awareness, we developed a new reusable catalytic system for sulfoxidation reaction based on temperature-dependent solubility of the POM-ILs. This catalyst has been successfully applied for selective oxidation of thioethers and thiophenes to the corresponding sulfoxides and sulfones with dilute H2O2, in water or EtOH: water biphasic system. The results showed that the catalyst has exhibited not only excellent redox property of POMs but also good recycling efficiency. Catalyst/product separation was very simple and the catalyst was recovered upon cooling of the reaction mixture and reused several times without obvious loss of catalytic activity. This catalyst also showed excellent activity for the removal of sulfur contents in model oil. So, it has a high potential as an effective catalyst for deep desulfurization of real diesel. We hope that the knowledge gained in this work will lead to the use of thermoregulated phase-separable POM-IL catalysts in a wide variety of organic reactions in aqueous media. Acknowledgement The authors thank the Razi University Research Council for support of this work. Appendix A Supplementary data Supplementary data associated with this article can be found, in the online version, at http://dx.doi.org/10.1016/j.molcata.2013.09.009. Appendix A Supplementary data References [1] N. Mizuno M. Misono Chem. Rev. 98 1998 199 218 [2] Y. Zhang D.L. Li Y. Chen X.H. Wang S.T. Wang Appl. Catal. B: Environ. 86 2009 182 189 [3] C.L. Hill C.M. Prosser-McCartha Coord. Chem. Rev. 143 1995 407 455 [4] G. Grigoropoulou J.H. Clark J.A. Elings Green Chem. 5 2003 1 7 [5] N. Mizuno K. Yamaguchi K. Kamata Coord. Chem. Rev. 249 2005 1944 1956 [6] K. Sato M. Hyodo M. Aoki X.Q. Zheng R. Noyori Tetrahedron 57 2001 2469 2476 [7] G.P. Romanelli P.I. Villabrille C.V. Cáceres P.G. Vázquez P. Tundo Catal. Commun. 12 2011 726 730 [8] T.O. Sachdeva K.K. Pant Fuel Process. Technol. 91 2010 1133 1138 [9] P. Tundo G.P. Romanelli P.G. Vázquez Catal. Commun. 11 2010 1181 1184 [10] R. Wang F. Yu G. Zhang H. Zhao Catal. Today 150 2010 37 41 [11] A.G. Renwick L.A. Damani Sulfur-containing Drugs and Related Organic Compounds 1989 Horwood Chichester 133 140 [12] Z. Cun W. Feng P. Xiao-Yu L. Xiao-Qin J. Fuel Chem. Technol. 39 2011 689 693 [13] W. Zhua G. Zhu H. Li Y. Chao Y. Chang G. Chen C. Han J. Mol. Catal. A: Chem. 347 2011 8 14 [14] X. Jiang Y. Nie C. Li Z. Wang Fuel 87 2008 79 84 [15] M. Ammamn J. Fransaer J. Solid State Chem. 184 2011 818 824 [16] T. Rajkumar G.R. Rao J. Chem. Sci. 120 2008 587 594 [17] P.G. Rickert M.R. Antonio M.A. Firestone K.A. Kubatko T. Szreder J.F. Wishart M.L. Dietz J. Phys. Chem. B 111 2007 4685 4692 [18] A. Bordoloi S. Sahoo F. Lefebvre S.B. Halligudi J. Catal. 259 2008 232 239 [19] Y. Leng J. Wang D. Zhu X. Ren H. Ge L. Shen Angew. Chem. Int. Ed. 48 2009 168 171 [20] Y. Ding W. Zhao J. Mol. Catal. A: Chem. 337 2011 45 51 [21] M. Carraro L. Sandei A. Sartorel G. Scorrano M. Bonchio Org. Lett. 8 2006 3671 3674 [22] Y. Ding W. Zhu H. Li W. Jiang M. Zhang Y. Duan Y. Chang Green Chem. 13 2011 1210 1216 [23] J. Qiu G. Wang D. Zeng Y. Tang M. Wang Y. Li Fuel Process. Technol. 90 2009 1538 1542 [24] C. Jiang J. Wang S. Wang M. Huo, Appl. Catal. B: Environ. 106 2011 343 349 [25] W. Zhu W. Huang H. Li M. Zhang W. Jiang G. Chen C. Han Fuel Process. Technol. 92 2011 1842 1848 [26] J. Zhang A. Wang X. Li X. Ma J. Catal. 279 2011 269 275 [27] X.-Y. Shi J.-F. Wei J. Mol. Catal. A: Chem. 280 2008 142 147 [28] X. Shi X. Han W. Ma J. Wei J. Li Q. Zhang Z. Chen J. Mol. Catal. A: Chem. 341 2011 57 62 [29] W. Qi Y. Wang W. Li L. Wu Chem. Eur. J. 16 2010 1068 1078 [30] J. Dupont R.F. de Souza A.Z. Suarez Chem. Rev. 102 2002 3667 3692 [31] Y. Ishii K. Yamawaki T. Yoshida T. Ura M. Ogawa J. Org. Chem. 52 1987 1868 1870 [32] M.T. Pope Heteropoly and Isopoly Oxometalates 1983 Springer-Verlag Berlin [33] C.O. Venturello R. D’Aloisio J.C.J. Bart M. Ricci J. Mol. Catal. 32 1985 107 110 [34] C. Venturello R.D. Aloisio J. Org. Chem. 53 1988 1553 1557 [35] Y. Matoba H. Inoue J. Akagi T. Okabayashi Y. Ishii M. Ogawa Synth. Commun. 14 1984 865 873 [36] Y. Ishii K. Yamawaki T. Ura H. Yamada T. Yoshida M. Ogawa J. Org. Chem. 53 1988 3587 3593 [37] G. Rodriguez-Gattorno A. Galano E. Torres-Garca Appl. Catal. B: Environ. 92 2009 1 8 [38] A. Kumar Catal. Commun. 8 2007 913 916 [39] A.E. Kuznetsov Y.V. Geletii C.L. Hill K. Morokuma D.G. Musaev Inorg. Chem. 48 2009 1871 1878 [40] N. Mizuno K. Kamata K. Yamaguchi Top. Catal. 53 2010 876 893 [41] I.C.M.S. Santos F.A.A. Paz M.M.Q. Simões M. Grac¸ P.M.S. Neves J.A.S. Cavaleiro J. Klinowski A.M.V. Cavaleiro Appl. Catal. A: Gen. 351 2008 166 173 [42] M. Sadakane E. Steckhan Chem. Rev. 98 1998 219 237 [43] K.L. Prasanth H. Maheswaran J. Mol. Catal. A: Chem. 268 2007 45 49 [44] E. Baciocchi M.F. Gerini A. Lapi J. Org. Chem. 69 2004 3586 3589 [45] F. Gregori I. Nobili F. Bigi R. Maggi G. Predieri G. Sartori J. Mol. Catal. A: Chem. 286 2008 124 127 [46] H. Olivier-Bourbigou L. Magna D. Morvan Appl. Catal. A: Gen. 373 2010 1 56 [47] A.G. Sathicq G.P. Romanelli V. Palermo P.G. Vázquez H.J. Thomas Tetrahedron Lett. 49 2008 1441 1444 [48] T. Yamaura K. Kamata K. Yamaguchi N. Mizuno Catal. Today 203 2013 76 80 [49] X.M. Yan P. Mei J. Lei Y. Mi L. Xiong L. Guo J. Mol. Catal. A: Chem. 304 2009 52 57",
      "scopus-id": "84885014575",
      "coredata": {
        "eid": "1-s2.0-S1381116913003348",
        "dc:description": "Synthesis of various organic–inorganic polyoxometalate based salts composed of sulfonated pyridinum cations and the Keggin tungstophosphate anion (PW12O40 3−) and their subsequent application in the oxidation of methyl phenyl sulfide with hydrogen peroxide in aqueous media was reported. Special attention was paid to the temperature-dependent solubility of the salts as a function of the organic cation in water. Cyclic voltammetry was further used for the investigation of the redox behavior of these catalysts. Based on these properties, a novel thermoregulated phase-separable catalyst was introduced and successfully used for the selective oxidation of thioethers and thiophenes to the corresponding sulfoxides or sulfones. Catalytic oxidation of the sulfur-containing model oil (methyl phenyl sulfide, dibenzothiophene and thiophene) was also studied under optimized conditions. In both cases, excellent conversion and selectivity were obtained in relatively short reaction times. This novel catalyst showed the characteristic of homogeneous reaction at ambient temperatures and phase-separation at lower temperatures. By simple decantation, the catalyst could be easily separated from the products upon cooling of the reaction mixture and could be reused several times with high recycling efficiency.",
        "openArchiveArticle": "false",
        "prism:coverDate": "2013-12-31",
        "openaccessUserLicense": null,
        "prism:aggregationType": "Journal",
        "prism:url": "https://api.elsevier.com/content/article/pii/S1381116913003348",
        "dc:creator": [
          {
            "@_fa": "true",
            "$": "Rafiee, Ezzat"
          },
          {
            "@_fa": "true",
            "$": "Eavani, Sara"
          }
        ],
        "link": [
          {
            "@_fa": "true",
            "@rel": "self",
            "@href": "https://api.elsevier.com/content/article/pii/S1381116913003348"
          },
          {
            "@_fa": "true",
            "@rel": "scidir",
            "@href": "https://www.sciencedirect.com/science/article/pii/S1381116913003348"
          }
        ],
        "dc:format": "application/json",
        "openaccessType": null,
        "pii": "S1381-1169(13)00334-8",
        "prism:volume": "380",
        "prism:publisher": "Elsevier B.V.",
        "dc:title": "Organic–inorganic polyoxometalate based salts as thermoregulated phase-separable catalysts for selective oxidation of thioethers and thiophenes and deep desulfurization of model fuels",
        "prism:copyright": "Copyright © 2013 Elsevier B.V. All rights reserved.",
        "openaccess": "0",
        "prism:issn": "13811169",
        "dcterms:subject": [
          {
            "@_fa": "true",
            "$": "Polyoxometalates"
          },
          {
            "@_fa": "true",
            "$": "Thermoregulated catalyst"
          },
          {
            "@_fa": "true",
            "$": "Deep desulfurization"
          },
          {
            "@_fa": "true",
            "$": "Sulfur"
          },
          {
            "@_fa": "true",
            "$": "Oxidation"
          }
        ],
        "openaccessArticle": "false",
        "prism:publicationName": "Journal of Molecular Catalysis A: Chemical",
        "openaccessSponsorType": null,
        "prism:pageRange": "18-27",
        "prism:endingPage": "27",
        "pubType": "fla",
        "prism:coverDisplayDate": "December 2013",
        "prism:doi": "10.1016/j.molcata.2013.09.009",
        "prism:startingPage": "18",
        "dc:identifier": "doi:10.1016/j.molcata.2013.09.009",
        "openaccessSponsorName": null
      },
      "objects": {
        "object": [
          {
            "@category": "thumbnail",
            "@height": "18",
            "@width": "116",
            "@_fa": "true",
            "$": "https://api.elsevier.com/content/object/eid/1-s2.0-S1381116913003348-si2.gif?httpAccept=%2A%2F%2A",
            "@multimediatype": "GIF image file",
            "@type": "ALTIMG",
            "@size": "538",
            "@ref": "si2",
            "@mimetype": "image/gif"
          },
          {
            "@category": "thumbnail",
            "@height": "18",
            "@width": "116",
            "@_fa": "true",
            "$": "https://api.elsevier.com/content/object/eid/1-s2.0-S1381116913003348-si1.gif?httpAccept=%2A%2F%2A",
            "@multimediatype": "GIF image file",
            "@type": "ALTIMG",
            "@size": "534",
            "@ref": "si1",
            "@mimetype": "image/gif"
          },
          {
            "@category": "standard",
            "@_fa": "true",
            "$": "https://api.elsevier.com/content/object/eid/1-s2.0-S1381116913003348-mmc1.docx?httpAccept=%2A%2F%2A",
            "@multimediatype": "Microsoft Word file",
            "@type": "APPLICATION",
            "@size": "272766",
            "@ref": "mmc1",
            "@mimetype": "application/word"
          },
          {
            "@category": "standard",
            "@_fa": "true",
            "$": "https://api.elsevier.com/content/object/eid/1-s2.0-S1381116913003348-mmc2.mol?httpAccept=%2A%2F%2A",
            "@multimediatype": "mol",
            "@type": "APPLICATION",
            "@size": "35631",
            "@ref": "mmc2",
            "@mimetype": "application/octet-stream"
          },
          {
            "@category": "high",
            "@height": "1383",
            "@width": "3167",
            "@_fa": "true",
            "$": "https://api.elsevier.com/content/object/eid/1-s2.0-S1381116913003348-sc2_lrg.jpg?httpAccept=%2A%2F%2A",
            "@multimediatype": "JPEG image file",
            "@type": "IMAGE-HIGH-RES",
            "@size": "255792",
            "@ref": "sc2",
            "@mimetype": "image/jpeg"
          },
          {
            "@category": "high",
            "@height": "1590",
            "@width": "2404",
            "@_fa": "true",
            "$": "https://api.elsevier.com/content/object/eid/1-s2.0-S1381116913003348-sc1_lrg.jpg?httpAccept=%2A%2F%2A",
            "@multimediatype": "JPEG image file",
            "@type": "IMAGE-HIGH-RES",
            "@size": "244921",
            "@ref": "sc1",
            "@mimetype": "image/jpeg"
          },
          {
            "@category": "high",
            "@height": "1407",
            "@width": "2500",
            "@_fa": "true",
            "$": "https://api.elsevier.com/content/object/eid/1-s2.0-S1381116913003348-gr8_lrg.jpg?httpAccept=%2A%2F%2A",
            "@multimediatype": "JPEG image file",
            "@type": "IMAGE-HIGH-RES",
            "@size": "212276",
            "@ref": "gr8",
            "@mimetype": "image/jpeg"
          },
          {
            "@category": "high",
            "@height": "2119",
            "@width": "3590",
            "@_fa": "true",
            "$": "https://api.elsevier.com/content/object/eid/1-s2.0-S1381116913003348-gr7_lrg.jpg?httpAccept=%2A%2F%2A",
            "@multimediatype": "JPEG image file",
            "@type": "IMAGE-HIGH-RES",
            "@size": "553863",
            "@ref": "gr7",
            "@mimetype": "image/jpeg"
          },
          {
            "@category": "high",
            "@height": "4417",
            "@width": "2485",
            "@_fa": "true",
            "$": "https://api.elsevier.com/content/object/eid/1-s2.0-S1381116913003348-gr6_lrg.jpg?httpAccept=%2A%2F%2A",
            "@multimediatype": "JPEG image file",
            "@type": "IMAGE-HIGH-RES",
            "@size": "698984",
            "@ref": "gr6",
            "@mimetype": "image/jpeg"
          },
          {
            "@category": "high",
            "@height": "1640",
            "@width": "1072",
            "@_fa": "true",
            "$": "https://api.elsevier.com/content/object/eid/1-s2.0-S1381116913003348-gr4_lrg.jpg?httpAccept=%2A%2F%2A",
            "@multimediatype": "JPEG image file",
            "@type": "IMAGE-HIGH-RES",
            "@size": "154255",
            "@ref": "gr4",
            "@mimetype": "image/jpeg"
          },
          {
            "@category": "high",
            "@height": "1959",
            "@width": "1525",
            "@_fa": "true",
            "$": "https://api.elsevier.com/content/object/eid/1-s2.0-S1381116913003348-gr3_lrg.jpg?httpAccept=%2A%2F%2A",
            "@multimediatype": "JPEG image file",
            "@type": "IMAGE-HIGH-RES",
            "@size": "381193",
            "@ref": "gr3",
            "@mimetype": "image/jpeg"
          },
          {
            "@category": "high",
            "@height": "1849",
            "@width": "2501",
            "@_fa": "true",
            "$": "https://api.elsevier.com/content/object/eid/1-s2.0-S1381116913003348-gr2_lrg.jpg?httpAccept=%2A%2F%2A",
            "@multimediatype": "JPEG image file",
            "@type": "IMAGE-HIGH-RES",
            "@size": "425959",
            "@ref": "gr2",
            "@mimetype": "image/jpeg"
          },
          {
            "@category": "high",
            "@height": "886",
            "@width": "1482",
            "@_fa": "true",
            "$": "https://api.elsevier.com/content/object/eid/1-s2.0-S1381116913003348-fx9_lrg.jpg?httpAccept=%2A%2F%2A",
            "@multimediatype": "JPEG image file",
            "@type": "IMAGE-HIGH-RES",
            "@size": "81537",
            "@ref": "fx9",
            "@mimetype": "image/jpeg"
          },
          {
            "@category": "high",
            "@height": "886",
            "@width": "748",
            "@_fa": "true",
            "$": "https://api.elsevier.com/content/object/eid/1-s2.0-S1381116913003348-fx8_lrg.jpg?httpAccept=%2A%2F%2A",
            "@multimediatype": "JPEG image file",
            "@type": "IMAGE-HIGH-RES",
            "@size": "48241",
            "@ref": "fx8",
            "@mimetype": "image/jpeg"
          },
          {
            "@category": "high",
            "@height": "418",
            "@width": "2213",
            "@_fa": "true",
            "$": "https://api.elsevier.com/content/object/eid/1-s2.0-S1381116913003348-fx7_lrg.jpg?httpAccept=%2A%2F%2A",
            "@multimediatype": "JPEG image file",
            "@type": "IMAGE-HIGH-RES",
            "@size": "50891",
            "@ref": "fx7",
            "@mimetype": "image/jpeg"
          },
          {
            "@category": "high",
            "@height": "667",
            "@width": "2213",
            "@_fa": "true",
            "$": "https://api.elsevier.com/content/object/eid/1-s2.0-S1381116913003348-fx6_lrg.jpg?httpAccept=%2A%2F%2A",
            "@multimediatype": "JPEG image file",
            "@type": "IMAGE-HIGH-RES",
            "@size": "58918",
            "@ref": "fx6",
            "@mimetype": "image/jpeg"
          },
          {
            "@category": "high",
            "@height": "531",
            "@width": "2213",
            "@_fa": "true",
            "$": "https://api.elsevier.com/content/object/eid/1-s2.0-S1381116913003348-fx5_lrg.jpg?httpAccept=%2A%2F%2A",
            "@multimediatype": "JPEG image file",
            "@type": "IMAGE-HIGH-RES",
            "@size": "71635",
            "@ref": "fx5",
            "@mimetype": "image/jpeg"
          },
          {
            "@category": "high",
            "@height": "886",
            "@width": "1947",
            "@_fa": "true",
            "$": "https://api.elsevier.com/content/object/eid/1-s2.0-S1381116913003348-fx4_lrg.jpg?httpAccept=%2A%2F%2A",
            "@multimediatype": "JPEG image file",
            "@type": "IMAGE-HIGH-RES",
            "@size": "64091",
            "@ref": "fx4",
            "@mimetype": "image/jpeg"
          },
          {
            "@category": "high",
            "@height": "876",
            "@width": "2213",
            "@_fa": "true",
            "$": "https://api.elsevier.com/content/object/eid/1-s2.0-S1381116913003348-fx3_lrg.jpg?httpAccept=%2A%2F%2A",
            "@multimediatype": "JPEG image file",
            "@type": "IMAGE-HIGH-RES",
            "@size": "69646",
            "@ref": "fx3",
            "@mimetype": "image/jpeg"
          },
          {
            "@category": "high",
            "@height": "886",
            "@width": "1417",
            "@_fa": "true",
            "$": "https://api.elsevier.com/content/object/eid/1-s2.0-S1381116913003348-fx2_lrg.jpg?httpAccept=%2A%2F%2A",
            "@multimediatype": "JPEG image file",
            "@type": "IMAGE-HIGH-RES",
            "@size": "49624",
            "@ref": "fx2",
            "@mimetype": "image/jpeg"
          },
          {
            "@category": "high",
            "@height": "790",
            "@width": "2213",
            "@_fa": "true",
            "$": "https://api.elsevier.com/content/object/eid/1-s2.0-S1381116913003348-fx11_lrg.jpg?httpAccept=%2A%2F%2A",
            "@multimediatype": "JPEG image file",
            "@type": "IMAGE-HIGH-RES",
            "@size": "68687",
            "@ref": "fx11",
            "@mimetype": "image/jpeg"
          },
          {
            "@category": "high",
            "@height": "491",
            "@width": "2213",
            "@_fa": "true",
            "$": "https://api.elsevier.com/content/object/eid/1-s2.0-S1381116913003348-fx10_lrg.jpg?httpAccept=%2A%2F%2A",
            "@multimediatype": "JPEG image file",
            "@type": "IMAGE-HIGH-RES",
            "@size": "57535",
            "@ref": "fx10",
            "@mimetype": "image/jpeg"
          },
          {
            "@category": "high",
            "@height": "886",
            "@width": "2209",
            "@_fa": "true",
            "$": "https://api.elsevier.com/content/object/eid/1-s2.0-S1381116913003348-fx1_lrg.jpg?httpAccept=%2A%2F%2A",
            "@multimediatype": "JPEG image file",
            "@type": "IMAGE-HIGH-RES",
            "@size": "205376",
            "@ref": "fx1",
            "@mimetype": "image/jpeg"
          },
          {
            "@category": "high",
            "@height": "7597",
            "@width": "4333",
            "@_fa": "true",
            "$": "https://api.elsevier.com/content/object/eid/1-s2.0-S1381116913003348-gr5_lrg.gif?httpAccept=%2A%2F%2A",
            "@multimediatype": "GIF image file",
            "@type": "IMAGE-HIGH-RES",
            "@size": "230295",
            "@ref": "gr5",
            "@mimetype": "image/gif"
          },
          {
            "@category": "high",
            "@height": "6012",
            "@width": "3357",
            "@_fa": "true",
            "$": "https://api.elsevier.com/content/object/eid/1-s2.0-S1381116913003348-gr1_lrg.gif?httpAccept=%2A%2F%2A",
            "@multimediatype": "GIF image file",
            "@type": "IMAGE-HIGH-RES",
            "@size": "210159",
            "@ref": "gr1",
            "@mimetype": "image/gif"
          },
          {
            "@category": "standard",
            "@height": "312",
            "@width": "715",
            "@_fa": "true",
            "$": "https://api.elsevier.com/content/object/eid/1-s2.0-S1381116913003348-sc2.jpg?httpAccept=%2A%2F%2A",
            "@multimediatype": "JPEG image file",
            "@type": "IMAGE-DOWNSAMPLED",
            "@size": "31448",
            "@ref": "sc2",
            "@mimetype": "image/jpeg"
          },
          {
            "@category": "standard",
            "@height": "359",
            "@width": "543",
            "@_fa": "true",
            "$": "https://api.elsevier.com/content/object/eid/1-s2.0-S1381116913003348-sc1.jpg?httpAccept=%2A%2F%2A",
            "@multimediatype": "JPEG image file",
            "@type": "IMAGE-DOWNSAMPLED",
            "@size": "28921",
            "@ref": "sc1",
            "@mimetype": "image/jpeg"
          },
          {
            "@category": "standard",
            "@height": "318",
            "@width": "565",
            "@_fa": "true",
            "$": "https://api.elsevier.com/content/object/eid/1-s2.0-S1381116913003348-gr8.jpg?httpAccept=%2A%2F%2A",
            "@multimediatype": "JPEG image file",
            "@type": "IMAGE-DOWNSAMPLED",
            "@size": "28498",
            "@ref": "gr8",
            "@mimetype": "image/jpeg"
          },
          {
            "@category": "standard",
            "@height": "479",
            "@width": "811",
            "@_fa": "true",
            "$": "https://api.elsevier.com/content/object/eid/1-s2.0-S1381116913003348-gr7.jpg?httpAccept=%2A%2F%2A",
            "@multimediatype": "JPEG image file",
            "@type": "IMAGE-DOWNSAMPLED",
            "@size": "84003",
            "@ref": "gr7",
            "@mimetype": "image/jpeg"
          },
          {
            "@category": "standard",
            "@height": "997",
            "@width": "561",
            "@_fa": "true",
            "$": "https://api.elsevier.com/content/object/eid/1-s2.0-S1381116913003348-gr6.jpg?httpAccept=%2A%2F%2A",
            "@multimediatype": "JPEG image file",
            "@type": "IMAGE-DOWNSAMPLED",
            "@size": "87867",
            "@ref": "gr6",
            "@mimetype": "image/jpeg"
          },
          {
            "@category": "standard",
            "@height": "370",
            "@width": "242",
            "@_fa": "true",
            "$": "https://api.elsevier.com/content/object/eid/1-s2.0-S1381116913003348-gr4.jpg?httpAccept=%2A%2F%2A",
            "@multimediatype": "JPEG image file",
            "@type": "IMAGE-DOWNSAMPLED",
            "@size": "17184",
            "@ref": "gr4",
            "@mimetype": "image/jpeg"
          },
          {
            "@category": "standard",
            "@height": "442",
            "@width": "344",
            "@_fa": "true",
            "$": "https://api.elsevier.com/content/object/eid/1-s2.0-S1381116913003348-gr3.jpg?httpAccept=%2A%2F%2A",
            "@multimediatype": "JPEG image file",
            "@type": "IMAGE-DOWNSAMPLED",
            "@size": "52681",
            "@ref": "gr3",
            "@mimetype": "image/jpeg"
          },
          {
            "@category": "standard",
            "@height": "418",
            "@width": "565",
            "@_fa": "true",
            "$": "https://api.elsevier.com/content/object/eid/1-s2.0-S1381116913003348-gr2.jpg?httpAccept=%2A%2F%2A",
            "@multimediatype": "JPEG image file",
            "@type": "IMAGE-DOWNSAMPLED",
            "@size": "46549",
            "@ref": "gr2",
            "@mimetype": "image/jpeg"
          },
          {
            "@category": "standard",
            "@height": "200",
            "@width": "334",
            "@_fa": "true",
            "$": "https://api.elsevier.com/content/object/eid/1-s2.0-S1381116913003348-fx9.jpg?httpAccept=%2A%2F%2A",
            "@multimediatype": "JPEG image file",
            "@type": "IMAGE-DOWNSAMPLED",
            "@size": "10730",
            "@ref": "fx9",
            "@mimetype": "image/jpeg"
          },
          {
            "@category": "standard",
            "@height": "200",
            "@width": "169",
            "@_fa": "true",
            "$": "https://api.elsevier.com/content/object/eid/1-s2.0-S1381116913003348-fx8.jpg?httpAccept=%2A%2F%2A",
            "@multimediatype": "JPEG image file",
            "@type": "IMAGE-DOWNSAMPLED",
            "@size": "6690",
            "@ref": "fx8",
            "@mimetype": "image/jpeg"
          },
          {
            "@category": "standard",
            "@height": "94",
            "@width": "500",
            "@_fa": "true",
            "$": "https://api.elsevier.com/content/object/eid/1-s2.0-S1381116913003348-fx7.jpg?httpAccept=%2A%2F%2A",
            "@multimediatype": "JPEG image file",
            "@type": "IMAGE-DOWNSAMPLED",
            "@size": "6892",
            "@ref": "fx7",
            "@mimetype": "image/jpeg"
          },
          {
            "@category": "standard",
            "@height": "151",
            "@width": "500",
            "@_fa": "true",
            "$": "https://api.elsevier.com/content/object/eid/1-s2.0-S1381116913003348-fx6.jpg?httpAccept=%2A%2F%2A",
            "@multimediatype": "JPEG image file",
            "@type": "IMAGE-DOWNSAMPLED",
            "@size": "7711",
            "@ref": "fx6",
            "@mimetype": "image/jpeg"
          },
          {
            "@category": "standard",
            "@height": "120",
            "@width": "500",
            "@_fa": "true",
            "$": "https://api.elsevier.com/content/object/eid/1-s2.0-S1381116913003348-fx5.jpg?httpAccept=%2A%2F%2A",
            "@multimediatype": "JPEG image file",
            "@type": "IMAGE-DOWNSAMPLED",
            "@size": "10033",
            "@ref": "fx5",
            "@mimetype": "image/jpeg"
          },
          {
            "@category": "standard",
            "@height": "200",
            "@width": "440",
            "@_fa": "true",
            "$": "https://api.elsevier.com/content/object/eid/1-s2.0-S1381116913003348-fx4.jpg?httpAccept=%2A%2F%2A",
            "@multimediatype": "JPEG image file",
            "@type": "IMAGE-DOWNSAMPLED",
            "@size": "8175",
            "@ref": "fx4",
            "@mimetype": "image/jpeg"
          },
          {
            "@category": "standard",
            "@height": "198",
            "@width": "500",
            "@_fa": "true",
            "$": "https://api.elsevier.com/content/object/eid/1-s2.0-S1381116913003348-fx3.jpg?httpAccept=%2A%2F%2A",
            "@multimediatype": "JPEG image file",
            "@type": "IMAGE-DOWNSAMPLED",
            "@size": "8550",
            "@ref": "fx3",
            "@mimetype": "image/jpeg"
          },
          {
            "@category": "standard",
            "@height": "200",
            "@width": "320",
            "@_fa": "true",
            "$": "https://api.elsevier.com/content/object/eid/1-s2.0-S1381116913003348-fx2.jpg?httpAccept=%2A%2F%2A",
            "@multimediatype": "JPEG image file",
            "@type": "IMAGE-DOWNSAMPLED",
            "@size": "6583",
            "@ref": "fx2",
            "@mimetype": "image/jpeg"
          },
          {
            "@category": "standard",
            "@height": "178",
            "@width": "500",
            "@_fa": "true",
            "$": "https://api.elsevier.com/content/object/eid/1-s2.0-S1381116913003348-fx11.jpg?httpAccept=%2A%2F%2A",
            "@multimediatype": "JPEG image file",
            "@type": "IMAGE-DOWNSAMPLED",
            "@size": "9066",
            "@ref": "fx11",
            "@mimetype": "image/jpeg"
          },
          {
            "@category": "standard",
            "@height": "111",
            "@width": "500",
            "@_fa": "true",
            "$": "https://api.elsevier.com/content/object/eid/1-s2.0-S1381116913003348-fx10.jpg?httpAccept=%2A%2F%2A",
            "@multimediatype": "JPEG image file",
            "@type": "IMAGE-DOWNSAMPLED",
            "@size": "7553",
            "@ref": "fx10",
            "@mimetype": "image/jpeg"
          },
          {
            "@category": "standard",
            "@height": "200",
            "@width": "499",
            "@_fa": "true",
            "$": "https://api.elsevier.com/content/object/eid/1-s2.0-S1381116913003348-fx1.jpg?httpAccept=%2A%2F%2A",
            "@multimediatype": "JPEG image file",
            "@type": "IMAGE-DOWNSAMPLED",
            "@size": "27217",
            "@ref": "fx1",
            "@mimetype": "image/jpeg"
          },
          {
            "@category": "standard",
            "@height": "857",
            "@width": "489",
            "@_fa": "true",
            "$": "https://api.elsevier.com/content/object/eid/1-s2.0-S1381116913003348-gr5.gif?httpAccept=%2A%2F%2A",
            "@multimediatype": "GIF image file",
            "@type": "IMAGE-DOWNSAMPLED",
            "@size": "25980",
            "@ref": "gr5",
            "@mimetype": "image/gif"
          },
          {
            "@category": "standard",
            "@height": "679",
            "@width": "379",
            "@_fa": "true",
            "$": "https://api.elsevier.com/content/object/eid/1-s2.0-S1381116913003348-gr1.gif?httpAccept=%2A%2F%2A",
            "@multimediatype": "GIF image file",
            "@type": "IMAGE-DOWNSAMPLED",
            "@size": "22464",
            "@ref": "gr1",
            "@mimetype": "image/gif"
          },
          {
            "@category": "thumbnail",
            "@height": "163",
            "@width": "93",
            "@_fa": "true",
            "$": "https://api.elsevier.com/content/object/eid/1-s2.0-S1381116913003348-gr5.sml?httpAccept=%2A%2F%2A",
            "@multimediatype": "GIF image file",
            "@type": "IMAGE-THUMBNAIL",
            "@size": "2469",
            "@ref": "gr5",
            "@mimetype": "image/gif"
          },
          {
            "@category": "thumbnail",
            "@height": "163",
            "@width": "91",
            "@_fa": "true",
            "$": "https://api.elsevier.com/content/object/eid/1-s2.0-S1381116913003348-gr1.sml?httpAccept=%2A%2F%2A",
            "@multimediatype": "GIF image file",
            "@type": "IMAGE-THUMBNAIL",
            "@size": "2648",
            "@ref": "gr1",
            "@mimetype": "image/gif"
          },
          {
            "@category": "thumbnail",
            "@height": "96",
            "@width": "219",
            "@_fa": "true",
            "$": "https://api.elsevier.com/content/object/eid/1-s2.0-S1381116913003348-sc2.sml?httpAccept=%2A%2F%2A",
            "@multimediatype": "GIF image file",
            "@type": "IMAGE-THUMBNAIL",
            "@size": "3067",
            "@ref": "sc2",
            "@mimetype": "image/gif"
          },
          {
            "@category": "thumbnail",
            "@height": "145",
            "@width": "219",
            "@_fa": "true",
            "$": "https://api.elsevier.com/content/object/eid/1-s2.0-S1381116913003348-sc1.sml?httpAccept=%2A%2F%2A",
            "@multimediatype": "GIF image file",
            "@type": "IMAGE-THUMBNAIL",
            "@size": "4368",
            "@ref": "sc1",
            "@mimetype": "image/gif"
          },
          {
            "@category": "thumbnail",
            "@height": "123",
            "@width": "219",
            "@_fa": "true",
            "$": "https://api.elsevier.com/content/object/eid/1-s2.0-S1381116913003348-gr8.sml?httpAccept=%2A%2F%2A",
            "@multimediatype": "GIF image file",
            "@type": "IMAGE-THUMBNAIL",
            "@size": "6154",
            "@ref": "gr8",
            "@mimetype": "image/gif"
          },
          {
            "@category": "thumbnail",
            "@height": "129",
            "@width": "219",
            "@_fa": "true",
            "$": "https://api.elsevier.com/content/object/eid/1-s2.0-S1381116913003348-gr7.sml?httpAccept=%2A%2F%2A",
            "@multimediatype": "GIF image file",
            "@type": "IMAGE-THUMBNAIL",
            "@size": "5255",
            "@ref": "gr7",
            "@mimetype": "image/gif"
          },
          {
            "@category": "thumbnail",
            "@height": "164",
            "@width": "92",
            "@_fa": "true",
            "$": "https://api.elsevier.com/content/object/eid/1-s2.0-S1381116913003348-gr6.sml?httpAccept=%2A%2F%2A",
            "@multimediatype": "GIF image file",
            "@type": "IMAGE-THUMBNAIL",
            "@size": "4657",
            "@ref": "gr6",
            "@mimetype": "image/gif"
          },
          {
            "@category": "thumbnail",
            "@height": "164",
            "@width": "107",
            "@_fa": "true",
            "$": "https://api.elsevier.com/content/object/eid/1-s2.0-S1381116913003348-gr4.sml?httpAccept=%2A%2F%2A",
            "@multimediatype": "GIF image file",
            "@type": "IMAGE-THUMBNAIL",
            "@size": "3561",
            "@ref": "gr4",
            "@mimetype": "image/gif"
          },
          {
            "@category": "thumbnail",
            "@height": "163",
            "@width": "127",
            "@_fa": "true",
            "$": "https://api.elsevier.com/content/object/eid/1-s2.0-S1381116913003348-gr3.sml?httpAccept=%2A%2F%2A",
            "@multimediatype": "GIF image file",
            "@type": "IMAGE-THUMBNAIL",
            "@size": "4475",
            "@ref": "gr3",
            "@mimetype": "image/gif"
          },
          {
            "@category": "thumbnail",
            "@height": "162",
            "@width": "219",
            "@_fa": "true",
            "$": "https://api.elsevier.com/content/object/eid/1-s2.0-S1381116913003348-gr2.sml?httpAccept=%2A%2F%2A",
            "@multimediatype": "GIF image file",
            "@type": "IMAGE-THUMBNAIL",
            "@size": "6490",
            "@ref": "gr2",
            "@mimetype": "image/gif"
          },
          {
            "@category": "thumbnail",
            "@height": "131",
            "@width": "219",
            "@_fa": "true",
            "$": "https://api.elsevier.com/content/object/eid/1-s2.0-S1381116913003348-fx9.sml?httpAccept=%2A%2F%2A",
            "@multimediatype": "GIF image file",
            "@type": "IMAGE-THUMBNAIL",
            "@size": "4087",
            "@ref": "fx9",
            "@mimetype": "image/gif"
          },
          {
            "@category": "thumbnail",
            "@height": "163",
            "@width": "138",
            "@_fa": "true",
            "$": "https://api.elsevier.com/content/object/eid/1-s2.0-S1381116913003348-fx8.sml?httpAccept=%2A%2F%2A",
            "@multimediatype": "GIF image file",
            "@type": "IMAGE-THUMBNAIL",
            "@size": "4271",
            "@ref": "fx8",
            "@mimetype": "image/gif"
          },
          {
            "@category": "thumbnail",
            "@height": "41",
            "@width": "219",
            "@_fa": "true",
            "$": "https://api.elsevier.com/content/object/eid/1-s2.0-S1381116913003348-fx7.sml?httpAccept=%2A%2F%2A",
            "@multimediatype": "GIF image file",
            "@type": "IMAGE-THUMBNAIL",
            "@size": "1941",
            "@ref": "fx7",
            "@mimetype": "image/gif"
          },
          {
            "@category": "thumbnail",
            "@height": "66",
            "@width": "219",
            "@_fa": "true",
            "$": "https://api.elsevier.com/content/object/eid/1-s2.0-S1381116913003348-fx6.sml?httpAccept=%2A%2F%2A",
            "@multimediatype": "GIF image file",
            "@type": "IMAGE-THUMBNAIL",
            "@size": "2230",
            "@ref": "fx6",
            "@mimetype": "image/gif"
          },
          {
            "@category": "thumbnail",
            "@height": "53",
            "@width": "219",
            "@_fa": "true",
            "$": "https://api.elsevier.com/content/object/eid/1-s2.0-S1381116913003348-fx5.sml?httpAccept=%2A%2F%2A",
            "@multimediatype": "GIF image file",
            "@type": "IMAGE-THUMBNAIL",
            "@size": "2552",
            "@ref": "fx5",
            "@mimetype": "image/gif"
          },
          {
            "@category": "thumbnail",
            "@height": "100",
            "@width": "219",
            "@_fa": "true",
            "$": "https://api.elsevier.com/content/object/eid/1-s2.0-S1381116913003348-fx4.sml?httpAccept=%2A%2F%2A",
            "@multimediatype": "GIF image file",
            "@type": "IMAGE-THUMBNAIL",
            "@size": "3206",
            "@ref": "fx4",
            "@mimetype": "image/gif"
          },
          {
            "@category": "thumbnail",
            "@height": "87",
            "@width": "219",
            "@_fa": "true",
            "$": "https://api.elsevier.com/content/object/eid/1-s2.0-S1381116913003348-fx3.sml?httpAccept=%2A%2F%2A",
            "@multimediatype": "GIF image file",
            "@type": "IMAGE-THUMBNAIL",
            "@size": "2657",
            "@ref": "fx3",
            "@mimetype": "image/gif"
          },
          {
            "@category": "thumbnail",
            "@height": "137",
            "@width": "219",
            "@_fa": "true",
            "$": "https://api.elsevier.com/content/object/eid/1-s2.0-S1381116913003348-fx2.sml?httpAccept=%2A%2F%2A",
            "@multimediatype": "GIF image file",
            "@type": "IMAGE-THUMBNAIL",
            "@size": "3759",
            "@ref": "fx2",
            "@mimetype": "image/gif"
          },
          {
            "@category": "thumbnail",
            "@height": "78",
            "@width": "219",
            "@_fa": "true",
            "$": "https://api.elsevier.com/content/object/eid/1-s2.0-S1381116913003348-fx11.sml?httpAccept=%2A%2F%2A",
            "@multimediatype": "GIF image file",
            "@type": "IMAGE-THUMBNAIL",
            "@size": "2675",
            "@ref": "fx11",
            "@mimetype": "image/gif"
          },
          {
            "@category": "thumbnail",
            "@height": "49",
            "@width": "219",
            "@_fa": "true",
            "$": "https://api.elsevier.com/content/object/eid/1-s2.0-S1381116913003348-fx10.sml?httpAccept=%2A%2F%2A",
            "@multimediatype": "GIF image file",
            "@type": "IMAGE-THUMBNAIL",
            "@size": "2356",
            "@ref": "fx10",
            "@mimetype": "image/gif"
          },
          {
            "@category": "thumbnail",
            "@height": "88",
            "@width": "219",
            "@_fa": "true",
            "$": "https://api.elsevier.com/content/object/eid/1-s2.0-S1381116913003348-fx1.sml?httpAccept=%2A%2F%2A",
            "@multimediatype": "GIF image file",
            "@type": "IMAGE-THUMBNAIL",
            "@size": "6034",
            "@ref": "fx1",
            "@mimetype": "image/gif"
          }
        ]
      },
      "link": {
        "@rel": "abstract",
        "@href": "https://api.elsevier.com/content/abstract/scopus_id/84885014575"
      }
    }
  }
}