{
  "metadata": {
    "title": "Effect of preparation condition on performance of Ag–MoO<ce:inf loc=post>3</ce:inf>/ZrO<ce:inf loc=post>2</ce:inf> catalyst for direct epoxidation of propylene by molecular oxygen",
    "authors": "; ; ",
    "journal": "Journal of Molecular Catalysis A: Chemical",
    "date": "2005-05-03",
    "doi": "10.1016/j.molcata.2005.01.040",
    "abstract": "",
    "uri": "https://api.elsevier.com/content/article/pii/S1381116905000841",
    "pii": "S1381116905000841"
  },
  "fulltext": {
    "full-text-retrieval-response": {
      "scopus-eid": "2-s2.0-15244362369",
      "originalText": "serial JL 271358 291210 291744 291790 291809 31 Journal of Molecular Catalysis A: Chemical JOURNALMOLECULARCATALYSISACHEMICAL 2005-03-02 2005-03-02 2010-04-19T04:56:56 1-s2.0-S1381116905000841 S1381-1169(05)00084-1 S1381116905000841 10.1016/j.molcata.2005.01.040 S300 S300.1 FULL-TEXT 1-s2.0-S1381116905X01303 2022-06-21T07:08:31.538902Z 0 0 20050503 2005 2005-03-02T00:00:00Z articleinfo crossmark dco dateupdated tomb dateloaded datesearch indexeddate issuelist volumelist yearnav absattachment articletitlenorm authfirstinitialnorm authfirstsurnamenorm cid cids contenttype copyright dateloadedtxt docsubtype doctype doi eid ewtransactionid hubeid issfirst issn issnnorm itemstage itemtransactionid itemweight openaccess openarchive pg pgfirst pglast pii piinorm pubdatestart pubdatetxt pubyr sortorder srctitle srctitlenorm srctype subheadings volfirst volissue webpdf webpdfpagecount figure table body acknowledge affil articletitle auth authfirstini authfull authkeywords authlast primabst ref specialabst alllist content subj ssids 1381-1169 13811169 232 232 1 2 1 2 Volume 232, Issues 1–2 26 165 172 165 172 20050503 3 May 2005 2005-05-03 2005 article fla Copyright © 2005 Elsevier B.V. All rights reserved. EFFECTPREPARATIONCONDITIONPERFORMANCEAGMOO3ZRO2CATALYSTFORDIRECTEPOXIDATIONPROPYLENEBYMOLECULAROXYGEN JIN G 1 Introduction 2 Experimental 2.1 Preparation of catalyst 2.1.1 Method A 2.1.2 Method B 2.2 Characterization of catalyst 2.3 Activity testing of catalyst 3 Results and discussion 3.1 Characterization of catalyst 3.1.1 BET surface area 3.1.2 Pore diameter distribution 3.1.3 X-ray diffraction (XRD) 3.1.4 NH3-TPD and CO2-TPD 3.2 Epoxidation of propylene 3.3 Discussion 3.3.1 Relationship between the surface area, pore size, crystalline form and acidity–basicity 3.3.2 Relationship between the epoxidation performance and physicochemical properties of catalyst 4 Conclusions Acknowledgements References ROTH 1991 357 J NIJHUIS 2000 217 T HAYASHI 1998 566 T JENZER 2001 125 G MEIERS 1998 376 R LU 1999 67 G LU 2002 11 J NAKATSUJI 1997 1 H HU 1998 371 Z ROBERTS 1993 300 J DAI 1980 184 P LU 2002 552 J MURATA 2001 1356 K MURATA 2001 57 K JIN 2002 405 G JIN 2003 249 G JIN 2004 171 G YAMAGUCHI 1994 199 T CHANG 1994 27 C XU 1988 1663 B NAKANO 1979 1 Y YORI 1999 5 J YORI 2000 205 J GONCHAROVA 1995 67 S MINAHAN 1997 393 D JINX2005X165 JINX2005X165X172 JINX2005X165XG JINX2005X165X172XG 2022-06-10T17:02:42.388Z http://vtw.elsevier.com/data/voc/AddOnTypes/50.7/aggregated-refined Ministry of Education of China 20010251006 MOE Ministry of Education of the People&apos;s Republic of China http://data.elsevier.com/vocabulary/SciValFunders/501100002338 http://sws.geonames.org/1814991/ Commission of Science and Technology of Shanghai Municipality 02DJ14028 03DJ14006 STCSM Science and Technology Commission of Shanghai Municipality http://data.elsevier.com/vocabulary/SciValFunders/501100003399 http://sws.geonames.org/1814991/ National Natural Science Foundation of China 20173015 NSFC National Natural Science Foundation of China http://data.elsevier.com/vocabulary/SciValFunders/501100001809 http://sws.geonames.org/1814991/ This study was financially supported by National Natural Science Foundation of China (No. 20173015), Commission of Science and Technology of Shanghai Municipality (No. 02DJ14028, No. 03DJ14006) and Ph.D. Program Specific Foundation by Ministry of Education of China (No. 20010251006). item S1381-1169(05)00084-1 S1381116905000841 1-s2.0-S1381116905000841 10.1016/j.molcata.2005.01.040 271358 2010-10-10T21:02:30.997241-04:00 2005-05-03 1-s2.0-S1381116905000841-main.pdf https://s3.amazonaws.com/prod-ucs-content-store-us-east/content/pii:S1381116905000841/MAIN/application/pdf/82cfa44ecdfaeddb59cf61dacbbaa1e9/main.pdf https://s3-eu-west-1.amazonaws.com/prod-ucs-content-store-eu-west/content/pii:S1381116905000841/MAIN/application/pdf/82cfa44ecdfaeddb59cf61dacbbaa1e9/main.pdf main.pdf pdf true 322466 MAIN 8 1-s2.0-S1381116905000841-main_1.png https://s3.amazonaws.com/prod-ucs-content-store-us-east/content/pii:S1381116905000841/PREVIEW/image/png/a830e84e88c16f38ec6c7a3e0cc85cb2/main_1.png https://s3-eu-west-1.amazonaws.com/prod-ucs-content-store-eu-west/content/pii:S1381116905000841/PREVIEW/image/png/a830e84e88c16f38ec6c7a3e0cc85cb2/main_1.png main_1.png png 65080 849 656 IMAGE-WEB-PDF 1 1-s2.0-S1381116905000841-gr9.jpg https://s3.amazonaws.com/prod-ucs-content-store-us-east/content/pii:S1381116905000841/gr9/DOWNSAMPLED/image/jpeg/f3a8f8f7bfbc0aef07683c816c6c11c4/gr9.jpg https://s3-eu-west-1.amazonaws.com/prod-ucs-content-store-eu-west/content/pii:S1381116905000841/gr9/DOWNSAMPLED/image/jpeg/f3a8f8f7bfbc0aef07683c816c6c11c4/gr9.jpg gr9 gr9.jpg jpg 14949 280 271 IMAGE-DOWNSAMPLED 1-s2.0-S1381116905000841-gr9.sml https://s3.amazonaws.com/prod-ucs-content-store-us-east/content/pii:S1381116905000841/gr9/THUMBNAIL/image/gif/db0b1e642394edcc2f5e36a16c5780e8/gr9.sml https://s3-eu-west-1.amazonaws.com/prod-ucs-content-store-eu-west/content/pii:S1381116905000841/gr9/THUMBNAIL/image/gif/db0b1e642394edcc2f5e36a16c5780e8/gr9.sml gr9 gr9.sml sml 1858 93 90 IMAGE-THUMBNAIL 1-s2.0-S1381116905000841-gr5.jpg https://s3.amazonaws.com/prod-ucs-content-store-us-east/content/pii:S1381116905000841/gr5/DOWNSAMPLED/image/jpeg/7ada7cc36a9c47e934457b36d1d31db1/gr5.jpg https://s3-eu-west-1.amazonaws.com/prod-ucs-content-store-eu-west/content/pii:S1381116905000841/gr5/DOWNSAMPLED/image/jpeg/7ada7cc36a9c47e934457b36d1d31db1/gr5.jpg gr5 gr5.jpg jpg 19040 286 273 IMAGE-DOWNSAMPLED 1-s2.0-S1381116905000841-gr5.sml https://s3.amazonaws.com/prod-ucs-content-store-us-east/content/pii:S1381116905000841/gr5/THUMBNAIL/image/gif/4b5a06d82c589763444e30964de9d995/gr5.sml https://s3-eu-west-1.amazonaws.com/prod-ucs-content-store-eu-west/content/pii:S1381116905000841/gr5/THUMBNAIL/image/gif/4b5a06d82c589763444e30964de9d995/gr5.sml gr5 gr5.sml sml 2029 93 89 IMAGE-THUMBNAIL 1-s2.0-S1381116905000841-gr3.jpg https://s3.amazonaws.com/prod-ucs-content-store-us-east/content/pii:S1381116905000841/gr3/DOWNSAMPLED/image/jpeg/ef6cb670cbbb46669e68ff7a8e982104/gr3.jpg https://s3-eu-west-1.amazonaws.com/prod-ucs-content-store-eu-west/content/pii:S1381116905000841/gr3/DOWNSAMPLED/image/jpeg/ef6cb670cbbb46669e68ff7a8e982104/gr3.jpg gr3 gr3.jpg jpg 20982 288 274 IMAGE-DOWNSAMPLED 1-s2.0-S1381116905000841-gr3.sml https://s3.amazonaws.com/prod-ucs-content-store-us-east/content/pii:S1381116905000841/gr3/THUMBNAIL/image/gif/92a59bcdf825a4478d021befe1f693fd/gr3.sml https://s3-eu-west-1.amazonaws.com/prod-ucs-content-store-eu-west/content/pii:S1381116905000841/gr3/THUMBNAIL/image/gif/92a59bcdf825a4478d021befe1f693fd/gr3.sml gr3 gr3.sml sml 2131 94 89 IMAGE-THUMBNAIL 1-s2.0-S1381116905000841-gr7.jpg https://s3.amazonaws.com/prod-ucs-content-store-us-east/content/pii:S1381116905000841/gr7/DOWNSAMPLED/image/jpeg/703b0365372a3242e7bdece79685b48c/gr7.jpg https://s3-eu-west-1.amazonaws.com/prod-ucs-content-store-eu-west/content/pii:S1381116905000841/gr7/DOWNSAMPLED/image/jpeg/703b0365372a3242e7bdece79685b48c/gr7.jpg gr7 gr7.jpg jpg 15850 265 274 IMAGE-DOWNSAMPLED 1-s2.0-S1381116905000841-gr7.sml https://s3.amazonaws.com/prod-ucs-content-store-us-east/content/pii:S1381116905000841/gr7/THUMBNAIL/image/gif/7dce1902118d2f661d64b776faac185b/gr7.sml https://s3-eu-west-1.amazonaws.com/prod-ucs-content-store-eu-west/content/pii:S1381116905000841/gr7/THUMBNAIL/image/gif/7dce1902118d2f661d64b776faac185b/gr7.sml gr7 gr7.sml sml 1919 93 96 IMAGE-THUMBNAIL 1-s2.0-S1381116905000841-gr6.jpg https://s3.amazonaws.com/prod-ucs-content-store-us-east/content/pii:S1381116905000841/gr6/DOWNSAMPLED/image/jpeg/cb841e45fc3baef48cf9f4963c175bac/gr6.jpg https://s3-eu-west-1.amazonaws.com/prod-ucs-content-store-eu-west/content/pii:S1381116905000841/gr6/DOWNSAMPLED/image/jpeg/cb841e45fc3baef48cf9f4963c175bac/gr6.jpg gr6 gr6.jpg jpg 15471 267 276 IMAGE-DOWNSAMPLED 1-s2.0-S1381116905000841-gr6.sml https://s3.amazonaws.com/prod-ucs-content-store-us-east/content/pii:S1381116905000841/gr6/THUMBNAIL/image/gif/a1c6f5e88f909fa6e04d013d5f4ece21/gr6.sml https://s3-eu-west-1.amazonaws.com/prod-ucs-content-store-eu-west/content/pii:S1381116905000841/gr6/THUMBNAIL/image/gif/a1c6f5e88f909fa6e04d013d5f4ece21/gr6.sml gr6 gr6.sml sml 1910 93 96 IMAGE-THUMBNAIL 1-s2.0-S1381116905000841-gr1.jpg https://s3.amazonaws.com/prod-ucs-content-store-us-east/content/pii:S1381116905000841/gr1/DOWNSAMPLED/image/jpeg/5391030bc68319a71c07f41fd40febfe/gr1.jpg https://s3-eu-west-1.amazonaws.com/prod-ucs-content-store-eu-west/content/pii:S1381116905000841/gr1/DOWNSAMPLED/image/jpeg/5391030bc68319a71c07f41fd40febfe/gr1.jpg gr1 gr1.jpg jpg 12368 244 265 IMAGE-DOWNSAMPLED 1-s2.0-S1381116905000841-gr1.sml https://s3.amazonaws.com/prod-ucs-content-store-us-east/content/pii:S1381116905000841/gr1/THUMBNAIL/image/gif/5190f7904581b7f906780b1ffb88b919/gr1.sml https://s3-eu-west-1.amazonaws.com/prod-ucs-content-store-eu-west/content/pii:S1381116905000841/gr1/THUMBNAIL/image/gif/5190f7904581b7f906780b1ffb88b919/gr1.sml gr1 gr1.sml sml 1994 93 101 IMAGE-THUMBNAIL 1-s2.0-S1381116905000841-gr8.jpg https://s3.amazonaws.com/prod-ucs-content-store-us-east/content/pii:S1381116905000841/gr8/DOWNSAMPLED/image/jpeg/07676589d1c524be1be45a0cc173171f/gr8.jpg https://s3-eu-west-1.amazonaws.com/prod-ucs-content-store-eu-west/content/pii:S1381116905000841/gr8/DOWNSAMPLED/image/jpeg/07676589d1c524be1be45a0cc173171f/gr8.jpg gr8 gr8.jpg jpg 14752 278 271 IMAGE-DOWNSAMPLED 1-s2.0-S1381116905000841-gr8.sml https://s3.amazonaws.com/prod-ucs-content-store-us-east/content/pii:S1381116905000841/gr8/THUMBNAIL/image/gif/bb9d1d27eac828ec647d56d09b9da7e9/gr8.sml https://s3-eu-west-1.amazonaws.com/prod-ucs-content-store-eu-west/content/pii:S1381116905000841/gr8/THUMBNAIL/image/gif/bb9d1d27eac828ec647d56d09b9da7e9/gr8.sml gr8 gr8.sml sml 1832 93 91 IMAGE-THUMBNAIL 1-s2.0-S1381116905000841-gr4.jpg https://s3.amazonaws.com/prod-ucs-content-store-us-east/content/pii:S1381116905000841/gr4/DOWNSAMPLED/image/jpeg/60905652c50227a6beace239d15dcfd7/gr4.jpg https://s3-eu-west-1.amazonaws.com/prod-ucs-content-store-eu-west/content/pii:S1381116905000841/gr4/DOWNSAMPLED/image/jpeg/60905652c50227a6beace239d15dcfd7/gr4.jpg gr4 gr4.jpg jpg 18795 287 272 IMAGE-DOWNSAMPLED 1-s2.0-S1381116905000841-gr4.sml https://s3.amazonaws.com/prod-ucs-content-store-us-east/content/pii:S1381116905000841/gr4/THUMBNAIL/image/gif/8bfdedb3457ff02747d72f82c6ad178a/gr4.sml https://s3-eu-west-1.amazonaws.com/prod-ucs-content-store-eu-west/content/pii:S1381116905000841/gr4/THUMBNAIL/image/gif/8bfdedb3457ff02747d72f82c6ad178a/gr4.sml gr4 gr4.sml sml 2041 93 88 IMAGE-THUMBNAIL 1-s2.0-S1381116905000841-gr11.jpg https://s3.amazonaws.com/prod-ucs-content-store-us-east/content/pii:S1381116905000841/gr11/DOWNSAMPLED/image/jpeg/d4eef98656134715b23982cbb9fcfb96/gr11.jpg https://s3-eu-west-1.amazonaws.com/prod-ucs-content-store-eu-west/content/pii:S1381116905000841/gr11/DOWNSAMPLED/image/jpeg/d4eef98656134715b23982cbb9fcfb96/gr11.jpg gr11 gr11.jpg jpg 13529 280 273 IMAGE-DOWNSAMPLED 1-s2.0-S1381116905000841-gr11.sml https://s3.amazonaws.com/prod-ucs-content-store-us-east/content/pii:S1381116905000841/gr11/THUMBNAIL/image/gif/eced8dee1bde2519c09080487504821d/gr11.sml https://s3-eu-west-1.amazonaws.com/prod-ucs-content-store-eu-west/content/pii:S1381116905000841/gr11/THUMBNAIL/image/gif/eced8dee1bde2519c09080487504821d/gr11.sml gr11 gr11.sml sml 1660 93 91 IMAGE-THUMBNAIL 1-s2.0-S1381116905000841-gr2.jpg https://s3.amazonaws.com/prod-ucs-content-store-us-east/content/pii:S1381116905000841/gr2/DOWNSAMPLED/image/jpeg/8d7ca8731ac7cfdbc8241709f2f5e391/gr2.jpg https://s3-eu-west-1.amazonaws.com/prod-ucs-content-store-eu-west/content/pii:S1381116905000841/gr2/DOWNSAMPLED/image/jpeg/8d7ca8731ac7cfdbc8241709f2f5e391/gr2.jpg gr2 gr2.jpg jpg 13072 243 266 IMAGE-DOWNSAMPLED 1-s2.0-S1381116905000841-gr2.sml https://s3.amazonaws.com/prod-ucs-content-store-us-east/content/pii:S1381116905000841/gr2/THUMBNAIL/image/gif/441e02885d05828ab3b9d46383c1adbc/gr2.sml https://s3-eu-west-1.amazonaws.com/prod-ucs-content-store-eu-west/content/pii:S1381116905000841/gr2/THUMBNAIL/image/gif/441e02885d05828ab3b9d46383c1adbc/gr2.sml gr2 gr2.sml sml 2071 93 102 IMAGE-THUMBNAIL 1-s2.0-S1381116905000841-gr10.jpg https://s3.amazonaws.com/prod-ucs-content-store-us-east/content/pii:S1381116905000841/gr10/DOWNSAMPLED/image/jpeg/734ae334b4eec82eb2ccf7e4bb07b083/gr10.jpg https://s3-eu-west-1.amazonaws.com/prod-ucs-content-store-eu-west/content/pii:S1381116905000841/gr10/DOWNSAMPLED/image/jpeg/734ae334b4eec82eb2ccf7e4bb07b083/gr10.jpg gr10 gr10.jpg jpg 13821 283 272 IMAGE-DOWNSAMPLED 1-s2.0-S1381116905000841-gr10.sml https://s3.amazonaws.com/prod-ucs-content-store-us-east/content/pii:S1381116905000841/gr10/THUMBNAIL/image/gif/0002b49c916736c4a0fe54cafe7951cc/gr10.sml https://s3-eu-west-1.amazonaws.com/prod-ucs-content-store-eu-west/content/pii:S1381116905000841/gr10/THUMBNAIL/image/gif/0002b49c916736c4a0fe54cafe7951cc/gr10.sml gr10 gr10.sml sml 1770 94 90 IMAGE-THUMBNAIL 1-s2.0-S1381116905000841-fx1.gif https://s3.amazonaws.com/prod-ucs-content-store-us-east/content/pii:S1381116905000841/fx1/DOWNSAMPLED/image/gif/303b4ee48f55bd1c2c48ac129b476f05/fx1.gif https://s3-eu-west-1.amazonaws.com/prod-ucs-content-store-eu-west/content/pii:S1381116905000841/fx1/DOWNSAMPLED/image/gif/303b4ee48f55bd1c2c48ac129b476f05/fx1.gif fx1 true fx1.gif gif 4093 231 223 IMAGE-DOWNSAMPLED 1-s2.0-S1381116905000841-fx1.sml https://s3.amazonaws.com/prod-ucs-content-store-us-east/content/pii:S1381116905000841/fx1/THUMBNAIL/image/gif/8d21d5b9234283936fa2a0cdf9ebffc2/fx1.sml https://s3-eu-west-1.amazonaws.com/prod-ucs-content-store-eu-west/content/pii:S1381116905000841/fx1/THUMBNAIL/image/gif/8d21d5b9234283936fa2a0cdf9ebffc2/fx1.sml fx1 true fx1.sml sml 1107 93 90 IMAGE-THUMBNAIL MOLCAA 5123 S1381-1169(05)00084-1 10.1016/j.molcata.2005.01.040 Elsevier B.V. Fig. 1 Pore diameter distribution of AM/Z*(500). Fig. 2 Pore diameter distribution of AM/Z*(850). Fig. 3 XRD patterns of the AM/Z* catalysts (500–950°C is the calcination temperature of Z*; M, monoclinic ZrO2; T, tetragonal ZrO2; *, MoO3; ○, Ag). Fig. 4 XRD patterns of the AM/Z catalysts (500–850°C is the calcination temperature of Z; M, monoclinic ZrO2; T, tetragonal ZrO2; *, MoO3; ○, Ag). Fig. 5 XRD patterns of the M/AZ catalysts (500–850°C is the calcination temperature of AZ; M, monoclinic ZrO2; T, tetragonal ZrO2; *, MoO3; ○, Ag). Fig. 6 NH3-TPD profiles of the AM/Z* catalysts (500–950°C is the calcination temperature of Z*). Fig. 7 CO2-TPD profiles of the AM/Z* catalysts (500–950°C is the calcination temperature of Z*). Fig. 8 NH3-TPD profiles of the AM/Z catalysts (500–850°C is the calcination temperature of Z). Fig. 9 CO2-TPD profiles of the AM/Z catalysts (500–850°C is the calcination temperature of Z). Fig. 10 NH3-TPD profiles of the M/AZ catalysts (500–850°C is the calcination temperature of AZ). Fig. 11 CO2-TPD profiles of the M/AZ catalysts (500–850°C is the calcination temperature of AZ). Table 1 Performances of the catalysts for epoxidation of propylene a Catalyst b S (m2/g) c Conversion (%) Selectivity (%) O2 C3H6 PO AC ACR HC CO2 AM/Z*(500 d ) 128 100 9.3 1.8 0 0 3.2 95.0 AM/Z*(600) 117 97.9 9.1 2.1 0 0 3.4 94.5 AM/Z*(700) 105 43.6 4.5 7.8 0 0 7.1 85.1 AM/Z*(850) 21.7 7.3 1.0 40.3 0 0 2.2 57.5 AM/Z*(950) 3.6 15.7 1.9 20.8 0 0 7.9 71.3 AM/Z(500) 44.0 15.3 1.8 20.6 0 0 5.5 73.9 AM/Z(600) 26.4 6.8 1.0 39.3 0 0 4.5 56.2 AM/Z(700) 24.1 6.4 0.9 41.5 0 0 3.4 55.1 AM/Z(850) 17.1 3.5 0.6 57.9 0 0 0 42.1 M/AZ(500) 59.9 67.2 6.3 2.8 0 0 3.8 93.4 M/AZ(600) 39.7 54.0 5.3 5.4 0 0 5.6 89.0 M/AZ(700) 24.9 14.3 1.7 25.9 0 0 4.3 69.8 M/AZ(850) 18.2 2.9 0.5 53.8 0 0 2.6 43.6 PO: propylene oxide, AC: acetone, ACR: acrolein, HC: hydrocarbons of C1 +C2 +C3 +C4 +C5 +C6. a Reaction condition: 350°C, 0.1MPa and 7500h−1 of space velocity. b AM/Z* and AM/Z 20%Ag–4%MoO3/ZrO2; M/AZ: 4%MoO3/20%Ag–ZrO2. c S: BET surface areas. d Calcination temperature (°C). Effect of preparation condition on performance of Ag–MoO3/ZrO2 catalyst for direct epoxidation of propylene by molecular oxygen Guojie Jin Guanzhong Lu * Yanglong Guo Yun Guo Junsong Wang Weiying Kong Xiaohui Liu Lab for Advanced Materials, Research Institute of Industrial Catalysis, East China University of Science and Technology, 130 Meilong Road, Shanghai 200237, PR China * Corresponding author. Tel.: +86 21 64253703; fax: +86 21 64253703. The Ag–MoO3/ZrO2 catalyst for an epoxidation of propylene by molecular oxygen was prepared by the precipitation/impregnation method, and characterized by N2 adsorption at low temperature, XRD, NH3-TPD and CO2-TPD. The effects of preparation condition of ZrO2 support on its physicochemical properties and catalytic performance were studied. The results show that suitably low surface area, big pore size, and modest and weak surface acidity–basicity for the Ag–MoO3/ZrO2 catalyst are in favor of the selective formation of propylene oxide. High surface area, abundant micro-pore structure and strong acidity–basicity or acidity-free are liable to the deep oxidation of propylene to CO2 and H2O. As the support of the Ag–MoO3 catalyst for an epoxidation of propylene, the monoclinic phase of ZrO2 is preferable to tetragonal one. Suitably larger particles of Ag and highly dispersed MoO3 on the Ag–MoO3/ZrO2 catalyst are beneficial to improve the selectivity to propylene oxide. Graphical abstract The Ag–MoO3/ZrO2 catalyst for an epoxidation of propylene by molecular oxygen was prepared and characterized by N2 adsorption, XRD, NH3-TPD and CO2-TPD. For the Ag–MoO3/ZrO2 catalyst, the lower surface area, larger pore size, modest and weaker surface acidity–basicity and suitably larger particle size of Ag are in favor of the formation of propylene oxide, which can be controlled by optimizing the preparation conditions of the ZrO2 support and catalyst. Keywords Propylene Epoxidation Silver–molybdenum catalyst Zirconia support Preparation condition 1 Introduction Propylene oxide (PO) is an important intermediate for the organic chemistry industry and there is an increasing demand for it in marketplace. Currently, PO is commercially produced by two conventional processes of chlorohydrin and hydroperoxide. Chlorohydrin method has the disadvantages of producing stoichiometric amount of waste salts and some chlorinated byproducts; the disadvantage of hydroperoxide method is that the co-product (styrene or tert-butylalcocol) is produced in a fixed amount. The direct synthesis of PO from propylene and oxygen has long been desired and considered as one of the most important and challenging chemical reactions to remain unsolved by catalysis [1]. The molten-salt method can directly epoxidize propylene by oxygen [2], but high energy consumption makes it not be commercialized up to date. For the catalytic epoxidation of propylene by O2/H2 over Au/TiO2 or Pd–Pt/TS-1, the selectivity to PO is higher than 90%, but the conversion of propylene is 1–2% only [3–5], in which large quantities of H2 is consumed to react with O2 to H2O and a careful handling is strictly required for the explosive mixture of H2–O2. Therefore, in view of economic and green chemistry, the direct epoxidation of propylene by molecular oxygen over a solid catalyst is a most ideal technique of producing PO. Attempts to directly epoxidize propylene, similar to what is done in the epoxidation of ethylene over the silver catalyst, have been tried and some good results have been obtained. Using silver supported on CaCO3, the PO selectivity of 64.0% was attained with the propylene conversion of 1.5% when NO, EtCl and CO2 additives were added in the feedstock [6]. Lu and Zuo prepared the unsupported silver catalyst containing NaCl as the promoter, over which 54.0% C3H6 conversion and 26.3% selectivity to PO were achieved for the epoxidation of propylene by air [7]. The epoxidation of propylene with air over the similar NaCl-modified silver catalyst was also recently reported [8]. The mechanism for an oxidation of propylene by molecular oxygen over the silver catalyst has been studied in detail over the past years; it is thought that the routes leading to PO and CO2 coexist on the surface of silver catalyst [9–11]. It was reported that alkenes was oxidized to epoxide by molecular oxygen over the heterogeneous molybdenum catalyst [12]. Recently, NaCl-modified VCe x Cu1−x mixed oxide [13], Ti-modified high silica zeolite [14] and Ti-modified sulfated zirconia [15] were reported to be effective for direct epoxidation of propylene with molecular oxygen. We have reported the supported Ag–Mo catalyst for direct epoxidation of propylene by molecular oxygen [16–18], and found that the promoter and support have a very important influence on the performance of catalyst, MoO3 in catalyst plays the roles of electric- and structure-type bifunctional promoter, and ZrO2 is an excellent support. In this paper, by changing preparation condition of ZrO2 support, the Ag–MoO3/ZrO2 catalysts with different physicochemical properties were prepared. Based on correlating the epoxidation performance with the physicochemical properties of catalyst, the effect of preparation condition or physicochemical properties of ZrO2 on the epoxidation performance of the Ag–MoO3/ZrO2 catalyst is discussed. 2 Experimental 2.1 Preparation of catalyst 2.1.1 Method A Zr(NO3)4 aqueous solution was slowly added in 10M NaOH aqueous solution under stirring and at room temperature, and its pH value was about 12. After aged at room temperature for 12h (or at 100°C for 160h), the precipitate was filtered and washed repeatedly with distilled water until the pH value of filtrate was about 7, and then dried at 110°C for 24h and calcined at 500°C for 4h to obtain ZrO2. ZrO2 was impregnated by a stoichiometric aqueous solution of AgNO3 (Ag:ZrO2 =20:76%, w/w) under ultrasonic stirring and at room temperature, and then dried at 110°C for 4h, calcined at 450°C for 4h. After that it was impregnated with an equal-volume aqueous solution of (NH4)6Mo7O24 (Ag:ZrO2:MoO3 =20:76:4%, w/w/w), dried at 110°C for 4h and calcined at 300°C for 4h to obtain the 20%Ag–4%MoO3/ZrO2 catalyst named as AM/Z(500) (or AM/Z*(500)). Z and Z* represents ZrO2, the former is aged at room temperature for 12h and the latter marked star is aged at 100°C for 160h, and 500 within bracket is the calcination temperature (°C) of ZrO2. 2.1.2 Method B A mixed aqueous solution of AgNO3 and Zr(NO3)4 (Ag:ZrO2 =20:76%, w/w) was slowly added in 10M NaOH aqueous solution under stirring and at room temperature, and its pH value was about 12. The precipitate was aged at room temperature for 12h, filtered and washed repeatedly with distilled water until the pH value of filtrate was about 7, and then dried at 110°C for 24h and calcined at 500°C for 4h to obtain the Ag–ZrO2 precursor. This precursor was crushed and impregnated by an equal-volume aqueous solution of (NH4)6Mo7O24 (Ag:ZrO2:MoO3 =20:76:4%, w/w/w), and then it was dried at 110°C for 4h and calcined at 300°C for 4h to obtain the 4%MoO3/20%Ag–ZrO2 catalyst named as M/AZ(500). AZ represents Ag–ZrO2 and 500 within bracket is the calcination temperature (°C) of Ag–ZrO2. 2.2 Characterization of catalyst The BET surface area and pore size distribution of catalyst were measured with ST-03A Instrument of Surface Area and Pore Size Distribution (Beijing Analytic Instrument Plant) at liquid-N2 temperature. The crystalline structure of catalyst was identified by XRD with Rigaku D/max/2550/PC, Cu Kα radiation. The NH3-TPD and CO2-TPD experiments were conducted in the conventional flow apparatus equipped with a thermal conductivity detector (TCD). The sample (300mg) was pretreated under helium stream (30ml/min) at 500°C for 2h, and then with the mixture of NH3–He (or CO2–He) at 50°C for 1h and with helium stream at 50°C for 1h to remove physisorbed NH3 (or CO2). TPD of adsorbed NH3 (or CO2) was measured from 50 to 450°C at the heating rate of 8°C/min. 2.3 Activity testing of catalyst The catalytic epoxidation of propylene by molecular oxygen was performed in the micro-reactor-GC system. The stainless steel reactor in the fixed-bed is Ø5mm×300mm and 0.5ml catalyst (20–40mesh) was filled. The reaction condition is 0.1MPa and 7500h−1 of space velocity at 350°C. The feedstock gas consisted of 22.7%C3H6, 9.0%O2 and balance N2, without any additive such as nitrogen oxide, alkyl halide, carbon dioxide or hydrogen. The composition of feedstock and effluent gas was analyzed by two on-line gas chromatographs with three packed columns (407 porous polymer, silica gel and 5Å zeolite), in which TCD was used. The method of carbon balance was used to verify the consumption of propylene during the reaction. As O2 was insufficient in comparison with C3H6 in feedstock, the activity of catalyst was expressed by the conversion of O2 rather than that of C3H6 hereinafter. 3 Results and discussion 3.1 Characterization of catalyst 3.1.1 BET surface area The BET surface areas of the catalysts prepared are listed in Table 1 . The results show that the preparation condition of ZrO2 has an obvious influence on the surface area of the catalyst. With an increase of the calcination temperature of Z, Z* or AZ, the surface areas of the AM/Z, AM/Z* and M/AZ catalysts decrease continuously. For the AM/Z* catalysts, when the calcination temperature of Z* increased from 500 to 700°C, the surface area of AM/Z* decreased slowly from 128 to 105m2/g; after Z* was calcined at 850°C (or 950°C), the surface area of AM/Z* decreased sharply to 21.7 (or 3.6m2/g). As the calcination temperature of Z and AZ increased from 500 to 850°C, the surface area of AM/Z decreased from 44.0 to 17.1m2/g, and that of M/AZ decreased from 59.9 to 18.2m2/g. The difference between Z* and Z is that their precursor's (Zr(OH)4 precipitate) aging condition is different. The precursor of Z* was aged for longer time (160h) at higher temperature (100°C), made AM/Z* have higher surface area; that of Z was aged for shorter time (12h) at lower temperature (25°C), made AM/Z have smaller surface area. Such as, the surface area of AM/Z*(500) is 128m2/g and that of AM/Z(500) is 44m2/g. The surface area of M/AZ(500) is 60m2/g. With a rise of the calcination temperature of Z*, Z and AZ, the difference of surface area between AM/Z*(850), AM/Z(850) and M/AZ(850) is reduced gradually. When Z*, Z and AZ was calcined at 850°C, AM/Z*(850), AM/Z(850) and M/AZ(850) have the near surface areas, 21.7, 17.1 and 18.2m2/g, respectively. 3.1.2 Pore diameter distribution The pore diameter distributions of AM/Z*(500) and AM/Z*(850) are shown in Figs. 1 and 2 , respectively. As can be seen, the pore diameter of AM/Z*(500) is 2–10nm and its most probable pore diameter is 5.23nm, and that of AM/Z*(850) is 2–50 and 14.9nm, respectively. With increasing calcination temperature of Z*, the pore diameter of AM/Z* increases and its surface area decreases. The results above show that the sample with abundant micropores (such as AM/Z*(500)) possesses a large surface area, and the sample with larger pores (such as the AM/Z*(850)) possesses a smaller surface area. For the AM/Z and M/AZ samples, their smaller surface areas are corresponding to their larger pores. 3.1.3 X-ray diffraction (XRD) The XRD patterns of AM/Z*, AM/Z and M/AZ are shown in Figs. 3–5 , respectively. There are four diffraction peaks for all the catalysts at 2θ =38.1°, 44.3°, 64.4° and 77.4°, that are corresponding to the crystal faces of Ag (111), (200), (220) and (311), respectively. The very poor diffraction peaks at 2θ =27.0° and 33.3° are attributed to the MoO3 crystal. The diffraction peaks at 2θ =28.2° and 31.4° are assigned to monoclinic ZrO2, and the diffraction peak of tetragonal ZrO2 is at 2θ =30.2°. The XRD patterns of AM/Z* in Fig. 3 show that, with the calcination temperature of ZrO2 increasing from 500 to 700°C, the crystalline structure of Z* in AM/Z* that they hold does not obviously change and consists of main tetragonal phase and minor monoclinic phase. After ZrO2 is calcined at 850–950°C, its diffraction peaks obviously narrow, that is to say, the particle (or of crystal) dimension of ZrO2 has increased. But the diffraction peaks of Ag and MoO3 are hardly affected by the calcination temperature of ZrO2. Comparing with the very poor diffraction peaks of MoO3, the diffraction peaks of Ag are strong and narrow, which suggests that Ag distributes on the surface of ZrO2 with larger particles, and MoO3 is highly dispersed on ZrO2. The results in Fig. 4 show that, ZrO2 in the AM/Z catalyst consists of the monoclinic and metastable tetragonal phases. With increasing calcination temperature of ZrO2 from 500 to 850°C, the metastable tetragonal phase reduces and the monoclinic phase gradually increases. After calcined at 850°C, the tetragonal ZrO2 has transformed to the monoclinic phase for the most part. The diffraction peaks of Ag and MoO3 change hardly with the calcination temperature of ZrO2, and Ag has strong diffraction peaks and that of MoO3 is hardly observed, which is similar to the situation of the AM/Z* catalysts. For the M/AZ catalysts, ZrO2 in M/AZ(500) exists mainly in the metastable tetragonal phase and very weak monoclinic phase (Fig. 5). The diffraction peaks of monoclinic ZrO2 strengthen and that of tetragonal ZrO2 weaken with an increase of the calcination temperature, but there is still appreciable proportion of tetragonal ZrO2 in the M/AZ(850) catalyst, unlike the AM/Z(850) catalyst in that the tetragonal phase of ZrO2 has nearly entirely transformed to the monoclinic phase. With an increase of the calcination temperature of Ag–ZrO2, the diffraction peaks of Ag strengthen and the very poor peaks of MoO3 hardly change. It was reported that the initial temperature of phase transformation from the metastable tetragonal phase to the monoclinic phase for pure ZrO2 is about 600°C, and this transformation can end at 650–700°C. Moreover, this transformation is affected sensitively by the impurities or additives, which can stabilize usually the metastable tetragonal form to higher temperature [19,20]. In the AM/Z* catalyst, the crystalline structure and phase transformation of ZrO2 are thoroughly different from the results reported [19,20], this is probably because of preparing ZrO2 with different procedure. ZrO2 in AM/Z* is a stable tetragonal phase, unlike ZrO2 in AM/Z (or M/AZ) that is a metastable tetragonal phase, its crystalline phase transformation with the calcination temperature is similar to that reported [19,20] and does not finish until about 850°C. The fact that there are still some metastable tetragonal ZrO2 in the M/AZ(850) catalyst suggests that the presence of the active Ag particles can retard the transformation of crystalline phase of ZrO2 from the metastable tetragonal phase to the stable monoclinic phase. 3.1.4 NH3-TPD and CO2-TPD The acid–base properties of catalyst were investigated by NH3-TPD and CO2-TPD. The NH3-TPD and CO2-TPD profiles of AM/Z*, AM/Z and M/AZ are shown in Figs. 6–11 . The results show that the acidic and basic sites co-exist on the surface of all the catalysts except for AM/Z*(950). For AM/Z* (Figs. 6 and 7), with increasing the calcination temperature of Z* (ZrO2), the strength of acidity and basicity (top temperature of NH3 and CO2 desorption peak) on the surface of catalyst decreases, and the concentration (peak area) of acidic and basic sites decreases quite slowly for the AM/Z*(500–700) samples and the peak area sharply decreases for AM/Z*(850). It suggests that there are abundant and stronger acidic and basic sites on the surface of AM/Z*(500–700), and some acidic and basic sites on the surface of AM/Z*(850). There are few acidic and basic sites on AM/Z*(950). There are two peaks of NH3-desorption at 50–180°C in the NH3-TPD curves of AM/Z (Fig. 8), which corresponds to two kinds of acidic sites. Their peak areas of NH3 desorption decrease with a rise of the calcination temperature of Z. In the CO2-TPD curve (Fig. 9) of AM/Z(500), there is one peak of CO2 desorption (one kind of basic site). With increasing calcination temperature of Z, this peak (one kind of basic site) divides into two peaks (two kinds of basic sites) and their peak areas of CO2 desorption decrease. The NH3-TPD and CO2-TPD profiles of M/AZ shown in Figs. 10 and 11 do not resemble those of AM/Z* and AM/Z, in which the concentration of basic sites is far smaller than that of acidic sites. In the NH3-TPD profiles of M/AZ (Fig. 10), there are two peaks at ∼150°C (α peak) and 290–340°C (β peak), and α peak shifts to low temperature and β peak disappears gradually with an increase of the calcination temperature of AZ (Ag–ZrO2). In the CO2-TPD profiles of M/AZ(500) (Fig. 11), two peaks (two kinds of basic sites) are observed, and both peaks incorporate to one peak and then disappear with increasing the calcination temperature of AZ from 500 to 850°C. 3.2 Epoxidation of propylene The evaluation results of the catalysts for propylene epoxidation at 350°C, 0.1MPa and the space velocity of 7500h−1, are presented in Table 1. The byproducts are mainly hydrocarbons (C1–C6) and CO2. Over the AM/Z*(500–700) catalysts, with increasing calcination temperature of Z*(ZrO2), the selectivity to PO increases from 1.8 to 7.8% and the O2 conversion decreases from 100 to 43.6%. Over the AM/Z*(850) catalyst, the selectivity to PO sharply increases to 40.3% and the O2 conversion decreases to 7.3%. Using Z* calcined at 950°C as the support of AM/Z*(950), the selectivity to PO decreases to 20.8%. Using the AM/Z catalysts, with the calcination temperature of ZrO2 increasing from 500 to 850°C, the selectivity to PO increases from 20.6 to 57.9% and the O2 conversion decreases from 15.3 to 3.5%. Using the M/AZ catalysts, with the calcination temperature of AZ (Ag–ZrO2) increasing from 500 to 850°C, the selectivity to PO increases from 2.8 to 53.8% and the conversion of O2 decreases from 67.2 to 2.9%. The above results show that the preparation condition of ZrO2 support has a great influence on the physicochemical characteristics of the Ag–MoO3/ZrO2 catalyst and its surface, consequently, their epoxidation performance is affected markedly by different preparation condition of ZrO2. 3.3 Discussion 3.3.1 Relationship between the surface area, pore size, crystalline form and acidity–basicity The above results show that, increasing calcination temperature of ZrO2 or Ag–ZrO2 makes the pore size of catalyst increase, the surface area and acidity–basicity of catalyst decrease, and the crystalline form of ZrO2 support transform. At higher temperature, the phase transformation and grain growth of ZrO2 is a main reason of leading the surface area of catalyst to decrease [19,20]. For the AM/Z* catalyst, the decrease of its surface area mainly results from the grain growth of ZrO2; for the AM/Z and M/AZ catalysts, the decrease of their surface area mainly results from the crystalline phase transformation. Correlating the pore size, surface area and acidity–basicity of the Ag–MoO3–ZrO2 catalysts, it can be found that the catalyst having abundant micro-pores and high surface area possesses abundant acidic and basic sites on its surface and vice versa. The studies of the acid–base properties of ZrO2 by the adsorption of CO2 and NH3/pyridine showed that there are Lewis acid sites and no Brönsted acid sites on the surface of ZrO2 [21,22]. On the Ag–MoO3–ZrO2 catalyst, the acidic and basic sites co-exist independently, and this situation is similar to that of ZrO2 reported in Ref. [19]. But the preparation condition of catalyst has a great influence on the acidic and basic properties on the surface of the Ag–MoO3–ZrO2 catalyst. 3.3.2 Relationship between the epoxidation performance and physicochemical properties of catalyst Correlating the epoxidation performance with the surface area of catalyst, we can see that the selectivity to PO increases and the O2 conversion decreases with the decrease of the surface area of the Ag–MoO3–ZrO2 catalysts, except for AM/Z*(950) having no any acidic and basic properties on its surface. For the M/AZ catalyst, with its surface area decreasing slowly (from 59.9 to 18.2m2/g), the selectivity to PO increases sharply (from 2.8 to 53.8%); for the AM/Z* catalyst, when its surface area decreases from 127.8 to 21.7m2/g, the selectivity to PO increases and the O2 conversion decreases; when its surface area decrease further to 3.6m2/g, on the contrary, the selectivity to PO obviously decreases and the O2 conversion increases. So there is no parallel relationship between the epoxidation performance and the surface area of catalyst. But the suitably low surface area and large pores is in favor of a diffusion of PO out of the catalyst, to avoid PO to be deeply oxidized to CO2 and H2O and to improve the selectivity to PO. For the AM/Z and M/AZ catalysts, the weak acidity and basicity on its surface makes the selectivity to PO increase. Using the AM/Z*(500–700) catalyst with the abundant acidic and basic sites, the PO selectivity is quite low; using the AM/Z*(850) catalyst containing a small quantity of weaker acidic sites and basic sites, the high selectivity to PO can be obtained; for the AM/Z*(950) catalyst without the acidic and basic sites, its epoxidation performance is very poor. The above phenomena show that, the acidity and basicity on the surface of catalyst has an obvious influence on its epoxidation performance, the modest and weaker acidity and basicity is beneficial to form PO selectively. If there are stronger acidity and basicity or acidity-free on the surface of catalyst, the deep oxidation of propylene or PO to CO2 and H2O will occur advantageously. When there are modest Lewis acidic sites on the Ag–MoO3/ZrO2 catalyst, those acidic sites can acquire electrons from the oxygen adsorbed (Oad) on the Ag sites to make Oad possess stronger electrophilic character, which is beneficial to the olefinic carbons of propylene react with Oad to produce PO, and inhibits the acid–base reaction between allylic H (H+ properties) and Oad to a certain extent [11]. If the acidity on the catalyst is excessively strong, the action between propylene and Oad is too strong to crack propylene to form CO2 and H2O. If there are many strong basic sites on the catalyst, the acid–base reaction (or dehydrogenation) between allylic H and basic sites can occur, thus propylene is also completely oxidized to CO2 and H2O, as a result, the conversion of O2 increases and the selectivity to PO decreases. For the AM/Z*(850), AM/Z(850) and M/AZ(850) catalysts calcined at 850°C, they have the near surface areas (21.7, 17.1 and 18.2m2/g, respectively) and similar surface acidity and basicity (such as AM/Z*(850) and AM/Z(850)), but their crystalline structure of ZrO2 and epoxidation performance are obviously different. Relating the crystalline structure of ZrO2 with the epoxidation performance of catalyst shows that the Ag–MoO3 catalyst supported on monoclinic ZrO2 has higher selectivity to PO than the catalyst supported tetragonal ZrO2. It is possible that the monoclinic ZrO2 can make Ag keep the metallic properties to reduce its electron loss, which leads the Oad on Ag to have the stronger electrophilic properties. This situation is similar to the Pt catalyst supported on ZrO2 promoted by tungstate, i.e., the crystalline structure of ZrO2 has an obvious effect on the metallic properties of the Pt catalyst [23,24]. The XRD results show that the particle size of Ag on AM/Z* and AM/Z does not vary obviously with the calcination temperature of ZrO2 support. But with an increase of calcination temperature of Ag–ZrO2, the Ag particles on M/AZ increase sharply and its surface area and surface acidity–basicity decrease slowly, meanwhile the epoxidation performance of catalyst is improved sharply. Based on the above facts, it can be inferred that the particle size of Ag on catalyst is also a more important factor of affecting the selectivity to PO, and the catalyst having the Ag particles with properly larger size behaves a higher performance for the epoxidation of propylene. In the epoxidation of ethylene, it has been found that the large Ag particles are more effective than small Ag crystallites [25,26]. This size effects result from a change of the surface Ag structure, the small Ag particles have higher surface energy and more surface defects, on which the adsorbed oxygen behaves stronger activity to result in the deep oxidation of propylene to CO2 and H2O. On the basis of above discussion, it can be found that the epoxidation performance of the catalyst is affected by many factors that should include the particle size of the active silver, the crystalline form of ZrO2 support, and the surface acidity–basicity, the surface area and pore size of catalyst, which can be put into practice by optimizing the preparation conditions of the ZrO2 support and catalyst. 4 Conclusions The physicochemical properties of the Ag–MoO3/ZrO2 catalyst are significantly affected by the preparation conditions of the ZrO2 support. When ZrO2 is prepared by the precipitation method, a long aging time at higher temperature is liable to form the tetragonal phase, and a shorter aging time at room temperature is liable to form the monoclinic phase. With the increase of the calcination temperature of ZrO2 or Ag–ZrO2, the pore sizes of the catalyst enlarge, the surface area and acidity and basicity of the catalyst decrease, and the crystalline phase of ZrO2 will transform. The suitably low surface area and big pore diameter, modest and weaker acidity and basicity on the surface of catalyst are beneficial to form PO selectively; the high surface area and abundant micropore structure, strong acidity and basicity or acidity-free are liable to the deep oxidation of propylene to CO2 and H2O. The monoclinic ZrO2 is an excellent support of the Ag–MoO3 catalyst for an epoxidation of propylene. The properly larger particle size of Ag should be kept for improving the epoxidation performance of the catalyst. The suitable preparation conditions of ZrO2 are that the Zr(OH)4 precipitate is aged at room temperature for 12h, dried at 110°C for 24h and calcined at 850°C. Acknowledgements This study was financially supported by National Natural Science Foundation of China (No. 20173015), Commission of Science and Technology of Shanghai Municipality (No. 02DJ14028, No. 03DJ14006) and Ph.D. Program Specific Foundation by Ministry of Education of China (No. 20010251006). References [1] J.F. Roth Chemtech 1991 357 [2] T.A. Nijhuis S. Musch M. Makkee J.A. Moulijn Appl. Catal. A 196 2000 217 [3] T. Hayashi K. Tanaka M. Haruta J. Catal. 178 1998 566 [4] G. Jenzer T. Mallat M. Maciejewski F. Eigenmann A. Baiker Appl. Catal. A 208 2001 125 [5] R. Meiers U. Dingerdissen W.F. Hölderich J. Catal. 176 1998 376 [6] B. Cooker, A.M. Gaffney, J.D. Jewson, W.H. Onimus, US Patent 5,965,480 (1999). [7] G. Lu X. Zuo Catal. Lett. 58 1999 67 [8] J. Lu M. Luo H. Lei C. Li Appl. Catal. A 237 2002 11 [9] H. Nakatsuji Progr. Surf. Sci. 54 1997 1 [10] Z. Hu H. Nakai H. Nakatsuji Surf. Sci. 401 1998 371 [11] J.T. Roberts R.J. Madix W.W. Crew J. Catal. 141 1993 300 [12] P.S.E. Dai J.H. Lunsford J. Catal. 64 1980 184 [13] J. Lu M. Luo H. Lei X. Bao C. Li J. Catal. 211 2002 552 [14] K. Murata Y. Kiyozumi Chem. Commun. 2001 1356 [15] K. Murata K.E. Bere T. Hayakawa S. Hamakawa K. Suzuki K. Matano React. Kinet. Catal. Lett. 72 2001 57 [16] G. Jin G. Lu X. Wang Chin. J. Catal. 23 2002 405 [17] G. Jin G. Lu Y. Guo Y. Guo J. Wang X. Liu Catal. Lett. 87 2003 249 [18] G. Jin G. Lu Y. Guo Y. Guo J. Wang X. Liu Catal. Today 93/95 2004 171 [19] T. Yamaguchi Catal. Today 20 1994 199 [20] C. Chang R. Gopalan Y. Lin J. Membr. Sci. 91 1994 27 [21] B. Xu T. Yamaguchi K. Tanabe Chem. Lett. 1988 1663 [22] Y. Nakano T. Iizuka H. Hattori K. Tanabe J. Catal. 57 1979 1 [23] J. Yori C. Pieck J. Parera Appl. Catal. A. 181 1999 5 [24] J. Yori J. Parera Catal. Lett. 65 2000 205 [25] S. Goncharova E. Paukshtis B. Bal’zhinimaev Appl. Catal. A. 126 1995 67 [26] D. Minahan G. Hoflund W. Epling D. Schoenfeld J. Catal. 168 1997 393",
      "scopus-id": "15244362369",
      "coredata": {
        "eid": "1-s2.0-S1381116905000841",
        "dc:description": "The Ag–MoO3/ZrO2 catalyst for an epoxidation of propylene by molecular oxygen was prepared by the precipitation/impregnation method, and characterized by N2 adsorption at low temperature, XRD, NH3-TPD and CO2-TPD. The effects of preparation condition of ZrO2 support on its physicochemical properties and catalytic performance were studied. The results show that suitably low surface area, big pore size, and modest and weak surface acidity–basicity for the Ag–MoO3/ZrO2 catalyst are in favor of the selective formation of propylene oxide. High surface area, abundant micro-pore structure and strong acidity–basicity or acidity-free are liable to the deep oxidation of propylene to CO2 and H2O. As the support of the Ag–MoO3 catalyst for an epoxidation of propylene, the monoclinic phase of ZrO2 is preferable to tetragonal one. Suitably larger particles of Ag and highly dispersed MoO3 on the Ag–MoO3/ZrO2 catalyst are beneficial to improve the selectivity to propylene oxide.",
        "openArchiveArticle": "false",
        "prism:coverDate": "2005-05-03",
        "openaccessUserLicense": null,
        "prism:aggregationType": "Journal",
        "prism:url": "https://api.elsevier.com/content/article/pii/S1381116905000841",
        "dc:creator": [
          {
            "@_fa": "true",
            "$": "Jin, Guojie"
          },
          {
            "@_fa": "true",
            "$": "Lu, Guanzhong"
          },
          {
            "@_fa": "true",
            "$": "Guo, Yanglong"
          },
          {
            "@_fa": "true",
            "$": "Guo, Yun"
          },
          {
            "@_fa": "true",
            "$": "Wang, Junsong"
          },
          {
            "@_fa": "true",
            "$": "Kong, Weiying"
          },
          {
            "@_fa": "true",
            "$": "Liu, Xiaohui"
          }
        ],
        "link": [
          {
            "@_fa": "true",
            "@rel": "self",
            "@href": "https://api.elsevier.com/content/article/pii/S1381116905000841"
          },
          {
            "@_fa": "true",
            "@rel": "scidir",
            "@href": "https://www.sciencedirect.com/science/article/pii/S1381116905000841"
          }
        ],
        "dc:format": "application/json",
        "openaccessType": null,
        "pii": "S1381-1169(05)00084-1",
        "prism:volume": "232",
        "prism:publisher": "Elsevier B.V.",
        "dc:title": "Effect of preparation condition on performance of Ag–MoO3/ZrO2 catalyst for direct epoxidation of propylene by molecular oxygen",
        "prism:copyright": "Copyright © 2005 Elsevier B.V. All rights reserved.",
        "openaccess": "0",
        "prism:issn": "13811169",
        "prism:issueIdentifier": "1-2",
        "dcterms:subject": [
          {
            "@_fa": "true",
            "$": "Propylene"
          },
          {
            "@_fa": "true",
            "$": "Epoxidation"
          },
          {
            "@_fa": "true",
            "$": "Silver–molybdenum catalyst"
          },
          {
            "@_fa": "true",
            "$": "Zirconia support"
          },
          {
            "@_fa": "true",
            "$": "Preparation condition"
          }
        ],
        "openaccessArticle": "false",
        "prism:publicationName": "Journal of Molecular Catalysis A: Chemical",
        "prism:number": "1-2",
        "openaccessSponsorType": null,
        "prism:pageRange": "165-172",
        "prism:endingPage": "172",
        "pubType": "fla",
        "prism:coverDisplayDate": "3 May 2005",
        "prism:doi": "10.1016/j.molcata.2005.01.040",
        "prism:startingPage": "165",
        "dc:identifier": "doi:10.1016/j.molcata.2005.01.040",
        "openaccessSponsorName": null
      },
      "objects": {
        "object": [
          {
            "@category": "standard",
            "@height": "280",
            "@width": "271",
            "@_fa": "true",
            "$": "https://api.elsevier.com/content/object/eid/1-s2.0-S1381116905000841-gr9.jpg?httpAccept=%2A%2F%2A",
            "@multimediatype": "JPEG image file",
            "@type": "IMAGE-DOWNSAMPLED",
            "@size": "14949",
            "@ref": "gr9",
            "@mimetype": "image/jpeg"
          },
          {
            "@category": "thumbnail",
            "@height": "93",
            "@width": "90",
            "@_fa": "true",
            "$": "https://api.elsevier.com/content/object/eid/1-s2.0-S1381116905000841-gr9.sml?httpAccept=%2A%2F%2A",
            "@multimediatype": "GIF image file",
            "@type": "IMAGE-THUMBNAIL",
            "@size": "1858",
            "@ref": "gr9",
            "@mimetype": "image/gif"
          },
          {
            "@category": "standard",
            "@height": "286",
            "@width": "273",
            "@_fa": "true",
            "$": "https://api.elsevier.com/content/object/eid/1-s2.0-S1381116905000841-gr5.jpg?httpAccept=%2A%2F%2A",
            "@multimediatype": "JPEG image file",
            "@type": "IMAGE-DOWNSAMPLED",
            "@size": "19040",
            "@ref": "gr5",
            "@mimetype": "image/jpeg"
          },
          {
            "@category": "thumbnail",
            "@height": "93",
            "@width": "89",
            "@_fa": "true",
            "$": "https://api.elsevier.com/content/object/eid/1-s2.0-S1381116905000841-gr5.sml?httpAccept=%2A%2F%2A",
            "@multimediatype": "GIF image file",
            "@type": "IMAGE-THUMBNAIL",
            "@size": "2029",
            "@ref": "gr5",
            "@mimetype": "image/gif"
          },
          {
            "@category": "standard",
            "@height": "288",
            "@width": "274",
            "@_fa": "true",
            "$": "https://api.elsevier.com/content/object/eid/1-s2.0-S1381116905000841-gr3.jpg?httpAccept=%2A%2F%2A",
            "@multimediatype": "JPEG image file",
            "@type": "IMAGE-DOWNSAMPLED",
            "@size": "20982",
            "@ref": "gr3",
            "@mimetype": "image/jpeg"
          },
          {
            "@category": "thumbnail",
            "@height": "94",
            "@width": "89",
            "@_fa": "true",
            "$": "https://api.elsevier.com/content/object/eid/1-s2.0-S1381116905000841-gr3.sml?httpAccept=%2A%2F%2A",
            "@multimediatype": "GIF image file",
            "@type": "IMAGE-THUMBNAIL",
            "@size": "2131",
            "@ref": "gr3",
            "@mimetype": "image/gif"
          },
          {
            "@category": "standard",
            "@height": "265",
            "@width": "274",
            "@_fa": "true",
            "$": "https://api.elsevier.com/content/object/eid/1-s2.0-S1381116905000841-gr7.jpg?httpAccept=%2A%2F%2A",
            "@multimediatype": "JPEG image file",
            "@type": "IMAGE-DOWNSAMPLED",
            "@size": "15850",
            "@ref": "gr7",
            "@mimetype": "image/jpeg"
          },
          {
            "@category": "thumbnail",
            "@height": "93",
            "@width": "96",
            "@_fa": "true",
            "$": "https://api.elsevier.com/content/object/eid/1-s2.0-S1381116905000841-gr7.sml?httpAccept=%2A%2F%2A",
            "@multimediatype": "GIF image file",
            "@type": "IMAGE-THUMBNAIL",
            "@size": "1919",
            "@ref": "gr7",
            "@mimetype": "image/gif"
          },
          {
            "@category": "standard",
            "@height": "267",
            "@width": "276",
            "@_fa": "true",
            "$": "https://api.elsevier.com/content/object/eid/1-s2.0-S1381116905000841-gr6.jpg?httpAccept=%2A%2F%2A",
            "@multimediatype": "JPEG image file",
            "@type": "IMAGE-DOWNSAMPLED",
            "@size": "15471",
            "@ref": "gr6",
            "@mimetype": "image/jpeg"
          },
          {
            "@category": "thumbnail",
            "@height": "93",
            "@width": "96",
            "@_fa": "true",
            "$": "https://api.elsevier.com/content/object/eid/1-s2.0-S1381116905000841-gr6.sml?httpAccept=%2A%2F%2A",
            "@multimediatype": "GIF image file",
            "@type": "IMAGE-THUMBNAIL",
            "@size": "1910",
            "@ref": "gr6",
            "@mimetype": "image/gif"
          },
          {
            "@category": "standard",
            "@height": "244",
            "@width": "265",
            "@_fa": "true",
            "$": "https://api.elsevier.com/content/object/eid/1-s2.0-S1381116905000841-gr1.jpg?httpAccept=%2A%2F%2A",
            "@multimediatype": "JPEG image file",
            "@type": "IMAGE-DOWNSAMPLED",
            "@size": "12368",
            "@ref": "gr1",
            "@mimetype": "image/jpeg"
          },
          {
            "@category": "thumbnail",
            "@height": "93",
            "@width": "101",
            "@_fa": "true",
            "$": "https://api.elsevier.com/content/object/eid/1-s2.0-S1381116905000841-gr1.sml?httpAccept=%2A%2F%2A",
            "@multimediatype": "GIF image file",
            "@type": "IMAGE-THUMBNAIL",
            "@size": "1994",
            "@ref": "gr1",
            "@mimetype": "image/gif"
          },
          {
            "@category": "standard",
            "@height": "278",
            "@width": "271",
            "@_fa": "true",
            "$": "https://api.elsevier.com/content/object/eid/1-s2.0-S1381116905000841-gr8.jpg?httpAccept=%2A%2F%2A",
            "@multimediatype": "JPEG image file",
            "@type": "IMAGE-DOWNSAMPLED",
            "@size": "14752",
            "@ref": "gr8",
            "@mimetype": "image/jpeg"
          },
          {
            "@category": "thumbnail",
            "@height": "93",
            "@width": "91",
            "@_fa": "true",
            "$": "https://api.elsevier.com/content/object/eid/1-s2.0-S1381116905000841-gr8.sml?httpAccept=%2A%2F%2A",
            "@multimediatype": "GIF image file",
            "@type": "IMAGE-THUMBNAIL",
            "@size": "1832",
            "@ref": "gr8",
            "@mimetype": "image/gif"
          },
          {
            "@category": "standard",
            "@height": "287",
            "@width": "272",
            "@_fa": "true",
            "$": "https://api.elsevier.com/content/object/eid/1-s2.0-S1381116905000841-gr4.jpg?httpAccept=%2A%2F%2A",
            "@multimediatype": "JPEG image file",
            "@type": "IMAGE-DOWNSAMPLED",
            "@size": "18795",
            "@ref": "gr4",
            "@mimetype": "image/jpeg"
          },
          {
            "@category": "thumbnail",
            "@height": "93",
            "@width": "88",
            "@_fa": "true",
            "$": "https://api.elsevier.com/content/object/eid/1-s2.0-S1381116905000841-gr4.sml?httpAccept=%2A%2F%2A",
            "@multimediatype": "GIF image file",
            "@type": "IMAGE-THUMBNAIL",
            "@size": "2041",
            "@ref": "gr4",
            "@mimetype": "image/gif"
          },
          {
            "@category": "standard",
            "@height": "280",
            "@width": "273",
            "@_fa": "true",
            "$": "https://api.elsevier.com/content/object/eid/1-s2.0-S1381116905000841-gr11.jpg?httpAccept=%2A%2F%2A",
            "@multimediatype": "JPEG image file",
            "@type": "IMAGE-DOWNSAMPLED",
            "@size": "13529",
            "@ref": "gr11",
            "@mimetype": "image/jpeg"
          },
          {
            "@category": "thumbnail",
            "@height": "93",
            "@width": "91",
            "@_fa": "true",
            "$": "https://api.elsevier.com/content/object/eid/1-s2.0-S1381116905000841-gr11.sml?httpAccept=%2A%2F%2A",
            "@multimediatype": "GIF image file",
            "@type": "IMAGE-THUMBNAIL",
            "@size": "1660",
            "@ref": "gr11",
            "@mimetype": "image/gif"
          },
          {
            "@category": "standard",
            "@height": "243",
            "@width": "266",
            "@_fa": "true",
            "$": "https://api.elsevier.com/content/object/eid/1-s2.0-S1381116905000841-gr2.jpg?httpAccept=%2A%2F%2A",
            "@multimediatype": "JPEG image file",
            "@type": "IMAGE-DOWNSAMPLED",
            "@size": "13072",
            "@ref": "gr2",
            "@mimetype": "image/jpeg"
          },
          {
            "@category": "thumbnail",
            "@height": "93",
            "@width": "102",
            "@_fa": "true",
            "$": "https://api.elsevier.com/content/object/eid/1-s2.0-S1381116905000841-gr2.sml?httpAccept=%2A%2F%2A",
            "@multimediatype": "GIF image file",
            "@type": "IMAGE-THUMBNAIL",
            "@size": "2071",
            "@ref": "gr2",
            "@mimetype": "image/gif"
          },
          {
            "@category": "standard",
            "@height": "283",
            "@width": "272",
            "@_fa": "true",
            "$": "https://api.elsevier.com/content/object/eid/1-s2.0-S1381116905000841-gr10.jpg?httpAccept=%2A%2F%2A",
            "@multimediatype": "JPEG image file",
            "@type": "IMAGE-DOWNSAMPLED",
            "@size": "13821",
            "@ref": "gr10",
            "@mimetype": "image/jpeg"
          },
          {
            "@category": "thumbnail",
            "@height": "94",
            "@width": "90",
            "@_fa": "true",
            "$": "https://api.elsevier.com/content/object/eid/1-s2.0-S1381116905000841-gr10.sml?httpAccept=%2A%2F%2A",
            "@multimediatype": "GIF image file",
            "@type": "IMAGE-THUMBNAIL",
            "@size": "1770",
            "@ref": "gr10",
            "@mimetype": "image/gif"
          },
          {
            "@category": "standard",
            "@height": "231",
            "@width": "223",
            "@_fa": "true",
            "$": "https://api.elsevier.com/content/object/eid/1-s2.0-S1381116905000841-fx1.gif?httpAccept=%2A%2F%2A",
            "@multimediatype": "GIF image file",
            "@type": "IMAGE-DOWNSAMPLED",
            "@size": "4093",
            "@ref": "fx1",
            "@mimetype": "image/gif"
          },
          {
            "@category": "thumbnail",
            "@height": "93",
            "@width": "90",
            "@_fa": "true",
            "$": "https://api.elsevier.com/content/object/eid/1-s2.0-S1381116905000841-fx1.sml?httpAccept=%2A%2F%2A",
            "@multimediatype": "GIF image file",
            "@type": "IMAGE-THUMBNAIL",
            "@size": "1107",
            "@ref": "fx1",
            "@mimetype": "image/gif"
          }
        ]
      },
      "link": {
        "@rel": "abstract",
        "@href": "https://api.elsevier.com/content/abstract/scopus_id/15244362369"
      }
    }
  }
}