{
  "metadata": {
    "title": "Unsupported versus alumina-supported Ni nanoparticles as catalysts for steam/ethanol conversion and CO<ce:inf loc=post>2</ce:inf> methanation",
    "authors": "; ; ",
    "journal": "Journal of Molecular Catalysis A: Chemical",
    "date": "2014-03-31",
    "doi": "10.1016/j.molcata.2013.11.006",
    "abstract": "",
    "uri": "https://api.elsevier.com/content/article/pii/S1381116913004184",
    "pii": "S1381116913004184"
  },
  "fulltext": {
    "full-text-retrieval-response": {
      "scopus-eid": "2-s2.0-84889035344",
      "originalText": "serial JL 271358 291210 291744 291790 291809 31 Journal of Molecular Catalysis A: Chemical JOURNALMOLECULARCATALYSISACHEMICAL 2013-11-20 2013-11-20 2014-02-18T00:46:35 1-s2.0-S1381116913004184 S1381-1169(13)00418-4 S1381116913004184 10.1016/j.molcata.2013.11.006 S300 S300.1 FULL-TEXT 1-s2.0-S1381116913X00147 2015-05-15T05:56:33.63776-04:00 0 0 20140301 20140331 2014 2013-11-20T00:00:00Z articleinfo crossmark dco dateupdated tomb dateloaded datesearch indexeddate volumelist yearnav absattachment articletitlenorm authfirstinitialnorm authfirstsurnamenorm cid cids contenttype copyright dateloadedtxt docsubtype doctype doi eid ewtransactionid hubeid issn issnnorm itemstage itemtransactionid itemweight openaccess openarchive pg pgfirst pglast pii piinorm pubdateend pubdatestart pubdatetxt pubyr sortorder srctitle srctitlenorm srctype subheadings suppl volfirst volissue webpdf webpdfpagecount figure table body mmlmath affil articletitle auth authfirstini authfull authkeywords authlast highlightsabst primabst ref specialabst alllist content subj ssids 1381-1169 13811169 true 383 384 383 384 C Volumes 383–384 4 10 16 10 16 201403 March 2014 2014-03-01 2014-03-31 2014 article fla Copyright © 2013 Elsevier B.V. All rights reserved. UNSUPPORTEDVERSUSALUMINASUPPORTEDNINANOPARTICLESCATALYSTSFORSTEAMETHANOLCONVERSIONCO2METHANATION RIANI P 1 Introduction 2 Experimental 2.1 Materials preparation 2.2 Materials characterization 2.3 Catalytic tests 3 Results and discussion 3.1 Sample A Ni NPs 3.2 Sample B Ni NPs 3.3 Characterization of alumina supported catalysts 3.4 Catalytic activity in the conversion of ethanol in the presence of steam 3.5 Catalytic activity in CO2 methanation 3.6 Characterization of spent catalysts 4 Discussion 5 Conclusions References HARYANTO 2005 2098 2106 A VAIDYA 2006 39 49 P NI 2007 3238 3247 M FRUSTERI 2007 200 209 F RAMIREZDELAPISCINA 2008 2459 2467 P BSHISH 2011 251 266 A NAHAR 2012 167 191 G BION 2012 76 84 N MATTOS 2012 4094 4123 L CIAMBELLI 2010 18 27 P PANAGIOTOPOULOU 2012 16333 16345 P DELAPENAOSHEA 2008 3601 3606 V BAYRAM 2011 77 89 B BUSCA 2010 5356 5366 G GARBARINO 2013 82 91 G ESPINAL 2012 59 67 R FONSECA 2002 104406 P HOU 2003 1510 1512 Y OHANDLEY 2000 R MODERNMAGNETICMATERIALSPRINCIPLESAPPLICATIONS 1980 1 70 FERROMAGNETICMATERIALS GARBARINO 2013 460 472 G HOMS 2006 361 366 N GATES 1986 111 134 S RESINI 2009 83 93 C BARATTINI 2009 43 49 L BUSCA 2010 5356 5366 G MAS 2008 602 607 V LARRUBIAVARGAS 2007 188 197 M SANCHEZESCRIBANO 2007 68 74 V RIANIX2014X10 RIANIX2014X10X16 RIANIX2014X10XP RIANIX2014X10X16XP item S1381-1169(13)00418-4 S1381116913004184 1-s2.0-S1381116913004184 10.1016/j.molcata.2013.11.006 271358 2014-02-18T01:15:07.746618-05:00 2014-03-01 2014-03-31 1-s2.0-S1381116913004184-main.pdf https://s3.amazonaws.com/prod-ucs-content-store-us-east/content/pii:S1381116913004184/MAIN/application/pdf/8e1210594828d4fc96aea6d78258725f/main.pdf https://s3-eu-west-1.amazonaws.com/prod-ucs-content-store-eu-west/content/pii:S1381116913004184/MAIN/application/pdf/8e1210594828d4fc96aea6d78258725f/main.pdf main.pdf pdf true 2919944 MAIN 7 1-s2.0-S1381116913004184-main_1.png https://s3-eu-west-1.amazonaws.com/prod-ucs-content-store-eu-west/content/pii:S1381116913004184/PREVIEW/image/png/ab3adfcc8f9f3a14b084dfcd8ba2aed6/main_1.png https://s3.amazonaws.com/prod-ucs-content-store-us-east/content/pii:S1381116913004184/PREVIEW/image/png/ab3adfcc8f9f3a14b084dfcd8ba2aed6/main_1.png main_1.png png 59888 849 656 IMAGE-WEB-PDF 1 1-s2.0-S1381116913004184-si8.gif https://s3.amazonaws.com/prod-ucs-content-store-us-east/content/pii:S1381116913004184/STRIPIN/image/gif/856d4a003dea89a4d005b9778c876d64/si8.gif https://s3-eu-west-1.amazonaws.com/prod-ucs-content-store-eu-west/content/pii:S1381116913004184/STRIPIN/image/gif/856d4a003dea89a4d005b9778c876d64/si8.gif si8 si8.gif gif 524 13 154 ALTIMG 1-s2.0-S1381116913004184-si7.gif https://s3.amazonaws.com/prod-ucs-content-store-us-east/content/pii:S1381116913004184/STRIPIN/image/gif/bf798c143887f4f4f64b4c9fe9167b43/si7.gif https://s3-eu-west-1.amazonaws.com/prod-ucs-content-store-eu-west/content/pii:S1381116913004184/STRIPIN/image/gif/bf798c143887f4f4f64b4c9fe9167b43/si7.gif si7 si7.gif gif 532 13 178 ALTIMG 1-s2.0-S1381116913004184-si6.gif https://s3.amazonaws.com/prod-ucs-content-store-us-east/content/pii:S1381116913004184/STRIPIN/image/gif/fd5da21112bda66a64abdea57f87c1f6/si6.gif https://s3-eu-west-1.amazonaws.com/prod-ucs-content-store-eu-west/content/pii:S1381116913004184/STRIPIN/image/gif/fd5da21112bda66a64abdea57f87c1f6/si6.gif si6 si6.gif gif 552 13 163 ALTIMG 1-s2.0-S1381116913004184-si5.gif https://s3.amazonaws.com/prod-ucs-content-store-us-east/content/pii:S1381116913004184/STRIPIN/image/gif/9057fb1f0a4beaec91a2a335ccedb5ff/si5.gif https://s3-eu-west-1.amazonaws.com/prod-ucs-content-store-eu-west/content/pii:S1381116913004184/STRIPIN/image/gif/9057fb1f0a4beaec91a2a335ccedb5ff/si5.gif si5 si5.gif gif 655 13 220 ALTIMG 1-s2.0-S1381116913004184-si4.gif https://s3.amazonaws.com/prod-ucs-content-store-us-east/content/pii:S1381116913004184/STRIPIN/image/gif/4f647da6a4d2d391da4d14d13890354f/si4.gif https://s3-eu-west-1.amazonaws.com/prod-ucs-content-store-eu-west/content/pii:S1381116913004184/STRIPIN/image/gif/4f647da6a4d2d391da4d14d13890354f/si4.gif si4 si4.gif gif 646 13 183 ALTIMG 1-s2.0-S1381116913004184-si3.gif https://s3.amazonaws.com/prod-ucs-content-store-us-east/content/pii:S1381116913004184/STRIPIN/image/gif/a278ba0ccb4b6f26bb15a85089b7b4f0/si3.gif https://s3-eu-west-1.amazonaws.com/prod-ucs-content-store-eu-west/content/pii:S1381116913004184/STRIPIN/image/gif/a278ba0ccb4b6f26bb15a85089b7b4f0/si3.gif si3 si3.gif gif 1138 50 260 ALTIMG 1-s2.0-S1381116913004184-si2.gif https://s3.amazonaws.com/prod-ucs-content-store-us-east/content/pii:S1381116913004184/STRIPIN/image/gif/870613a9d0f89983a5958c6ed1add19c/si2.gif https://s3-eu-west-1.amazonaws.com/prod-ucs-content-store-eu-west/content/pii:S1381116913004184/STRIPIN/image/gif/870613a9d0f89983a5958c6ed1add19c/si2.gif si2 si2.gif gif 2957 109 343 ALTIMG 1-s2.0-S1381116913004184-si1.gif https://s3.amazonaws.com/prod-ucs-content-store-us-east/content/pii:S1381116913004184/STRIPIN/image/gif/f805e5e0ec9b35fc2e662b7c58d042d3/si1.gif https://s3-eu-west-1.amazonaws.com/prod-ucs-content-store-eu-west/content/pii:S1381116913004184/STRIPIN/image/gif/f805e5e0ec9b35fc2e662b7c58d042d3/si1.gif si1 si1.gif gif 631 49 108 ALTIMG 1-s2.0-S1381116913004184-gr9_lrg.jpg https://s3.amazonaws.com/prod-ucs-content-store-us-east/content/pii:S1381116913004184/gr9/HIGHRES/image/jpeg/e5ad65106a975dae661bfa7da72d24c5/gr9_lrg.jpg https://s3-eu-west-1.amazonaws.com/prod-ucs-content-store-eu-west/content/pii:S1381116913004184/gr9/HIGHRES/image/jpeg/e5ad65106a975dae661bfa7da72d24c5/gr9_lrg.jpg gr9 gr9_lrg.jpg jpg 382368 1350 1500 IMAGE-HIGH-RES 1-s2.0-S1381116913004184-gr8_lrg.jpg https://s3.amazonaws.com/prod-ucs-content-store-us-east/content/pii:S1381116913004184/gr8/HIGHRES/image/jpeg/e2a876395dea51c89cf90335f6057532/gr8_lrg.jpg https://s3-eu-west-1.amazonaws.com/prod-ucs-content-store-eu-west/content/pii:S1381116913004184/gr8/HIGHRES/image/jpeg/e2a876395dea51c89cf90335f6057532/gr8_lrg.jpg gr8 gr8_lrg.jpg jpg 389672 1169 1500 IMAGE-HIGH-RES 1-s2.0-S1381116913004184-gr7_lrg.jpg https://s3.amazonaws.com/prod-ucs-content-store-us-east/content/pii:S1381116913004184/gr7/HIGHRES/image/jpeg/62e98ba14d831819ea388ed9e6ad2ca9/gr7_lrg.jpg https://s3-eu-west-1.amazonaws.com/prod-ucs-content-store-eu-west/content/pii:S1381116913004184/gr7/HIGHRES/image/jpeg/62e98ba14d831819ea388ed9e6ad2ca9/gr7_lrg.jpg gr7 gr7_lrg.jpg jpg 196746 1075 1667 IMAGE-HIGH-RES 1-s2.0-S1381116913004184-gr5_lrg.jpg https://s3.amazonaws.com/prod-ucs-content-store-us-east/content/pii:S1381116913004184/gr5/HIGHRES/image/jpeg/3159968171ab889d8532c60cc6e90abd/gr5_lrg.jpg https://s3-eu-west-1.amazonaws.com/prod-ucs-content-store-eu-west/content/pii:S1381116913004184/gr5/HIGHRES/image/jpeg/3159968171ab889d8532c60cc6e90abd/gr5_lrg.jpg gr5 gr5_lrg.jpg jpg 303103 1260 1417 IMAGE-HIGH-RES 1-s2.0-S1381116913004184-gr3_lrg.jpg https://s3.amazonaws.com/prod-ucs-content-store-us-east/content/pii:S1381116913004184/gr3/HIGHRES/image/jpeg/bf2a19f8e1c7011fc1cd4c68a0aa855d/gr3_lrg.jpg https://s3-eu-west-1.amazonaws.com/prod-ucs-content-store-eu-west/content/pii:S1381116913004184/gr3/HIGHRES/image/jpeg/bf2a19f8e1c7011fc1cd4c68a0aa855d/gr3_lrg.jpg gr3 gr3_lrg.jpg jpg 105127 1113 1667 IMAGE-HIGH-RES 1-s2.0-S1381116913004184-gr10_lrg.jpg https://s3.amazonaws.com/prod-ucs-content-store-us-east/content/pii:S1381116913004184/gr10/HIGHRES/image/jpeg/a9c8161fb6e422de9cc8738d4466d842/gr10_lrg.jpg https://s3-eu-west-1.amazonaws.com/prod-ucs-content-store-eu-west/content/pii:S1381116913004184/gr10/HIGHRES/image/jpeg/a9c8161fb6e422de9cc8738d4466d842/gr10_lrg.jpg gr10 gr10_lrg.jpg jpg 273150 1017 1500 IMAGE-HIGH-RES 1-s2.0-S1381116913004184-gr1_lrg.jpg https://s3.amazonaws.com/prod-ucs-content-store-us-east/content/pii:S1381116913004184/gr1/HIGHRES/image/jpeg/e0f79eea2724e14cbd4cc08985508bfc/gr1_lrg.jpg https://s3-eu-west-1.amazonaws.com/prod-ucs-content-store-eu-west/content/pii:S1381116913004184/gr1/HIGHRES/image/jpeg/e0f79eea2724e14cbd4cc08985508bfc/gr1_lrg.jpg gr1 gr1_lrg.jpg jpg 246705 1228 1500 IMAGE-HIGH-RES 1-s2.0-S1381116913004184-fx1_lrg.jpg https://s3.amazonaws.com/prod-ucs-content-store-us-east/content/pii:S1381116913004184/fx1/HIGHRES/image/jpeg/a4c6a9accd18870acef7f32bcb4cbdf7/fx1_lrg.jpg https://s3-eu-west-1.amazonaws.com/prod-ucs-content-store-eu-west/content/pii:S1381116913004184/fx1/HIGHRES/image/jpeg/a4c6a9accd18870acef7f32bcb4cbdf7/fx1_lrg.jpg fx1 true fx1_lrg.jpg jpg 115943 886 2213 IMAGE-HIGH-RES 1-s2.0-S1381116913004184-gr6_lrg.gif https://s3.amazonaws.com/prod-ucs-content-store-us-east/content/pii:S1381116913004184/gr6/HIGHRES/image/gif/835079ffb9a9453528bc0b8cf842205e/gr6_lrg.gif https://s3-eu-west-1.amazonaws.com/prod-ucs-content-store-eu-west/content/pii:S1381116913004184/gr6/HIGHRES/image/gif/835079ffb9a9453528bc0b8cf842205e/gr6_lrg.gif gr6 gr6_lrg.gif gif 84159 2513 3333 IMAGE-HIGH-RES 1-s2.0-S1381116913004184-gr4_lrg.gif https://s3.amazonaws.com/prod-ucs-content-store-us-east/content/pii:S1381116913004184/gr4/HIGHRES/image/gif/07513e8d8446fb6a725847e17605c9bb/gr4_lrg.gif https://s3-eu-west-1.amazonaws.com/prod-ucs-content-store-eu-west/content/pii:S1381116913004184/gr4/HIGHRES/image/gif/07513e8d8446fb6a725847e17605c9bb/gr4_lrg.gif gr4 gr4_lrg.gif gif 53483 2232 3000 IMAGE-HIGH-RES 1-s2.0-S1381116913004184-gr2_lrg.gif https://s3.amazonaws.com/prod-ucs-content-store-us-east/content/pii:S1381116913004184/gr2/HIGHRES/image/gif/db3f3676dbf089e143b6161909eddfbc/gr2_lrg.gif https://s3-eu-west-1.amazonaws.com/prod-ucs-content-store-eu-west/content/pii:S1381116913004184/gr2/HIGHRES/image/gif/db3f3676dbf089e143b6161909eddfbc/gr2_lrg.gif gr2 gr2_lrg.gif gif 88319 2555 3333 IMAGE-HIGH-RES 1-s2.0-S1381116913004184-gr9.jpg https://s3.amazonaws.com/prod-ucs-content-store-us-east/content/pii:S1381116913004184/gr9/DOWNSAMPLED/image/jpeg/d8ea0f6fadc075bc52cb2906d0db9434/gr9.jpg https://s3-eu-west-1.amazonaws.com/prod-ucs-content-store-eu-west/content/pii:S1381116913004184/gr9/DOWNSAMPLED/image/jpeg/d8ea0f6fadc075bc52cb2906d0db9434/gr9.jpg gr9 gr9.jpg jpg 32299 305 339 IMAGE-DOWNSAMPLED 1-s2.0-S1381116913004184-gr8.jpg https://s3.amazonaws.com/prod-ucs-content-store-us-east/content/pii:S1381116913004184/gr8/DOWNSAMPLED/image/jpeg/76a692c00c771b7c97c630f06b02c601/gr8.jpg https://s3-eu-west-1.amazonaws.com/prod-ucs-content-store-eu-west/content/pii:S1381116913004184/gr8/DOWNSAMPLED/image/jpeg/76a692c00c771b7c97c630f06b02c601/gr8.jpg gr8 gr8.jpg jpg 34620 264 339 IMAGE-DOWNSAMPLED 1-s2.0-S1381116913004184-gr7.jpg https://s3.amazonaws.com/prod-ucs-content-store-us-east/content/pii:S1381116913004184/gr7/DOWNSAMPLED/image/jpeg/685995ff1baae27948c5effd739143ee/gr7.jpg https://s3-eu-west-1.amazonaws.com/prod-ucs-content-store-eu-west/content/pii:S1381116913004184/gr7/DOWNSAMPLED/image/jpeg/685995ff1baae27948c5effd739143ee/gr7.jpg gr7 gr7.jpg jpg 29143 242 376 IMAGE-DOWNSAMPLED 1-s2.0-S1381116913004184-gr5.jpg https://s3.amazonaws.com/prod-ucs-content-store-us-east/content/pii:S1381116913004184/gr5/DOWNSAMPLED/image/jpeg/31e6b256e1996356f24b240eac5a6cdb/gr5.jpg https://s3-eu-west-1.amazonaws.com/prod-ucs-content-store-eu-west/content/pii:S1381116913004184/gr5/DOWNSAMPLED/image/jpeg/31e6b256e1996356f24b240eac5a6cdb/gr5.jpg gr5 gr5.jpg jpg 30500 285 320 IMAGE-DOWNSAMPLED 1-s2.0-S1381116913004184-gr3.jpg https://s3.amazonaws.com/prod-ucs-content-store-us-east/content/pii:S1381116913004184/gr3/DOWNSAMPLED/image/jpeg/0d85d44c3e37042f716af879479cb41c/gr3.jpg https://s3-eu-west-1.amazonaws.com/prod-ucs-content-store-eu-west/content/pii:S1381116913004184/gr3/DOWNSAMPLED/image/jpeg/0d85d44c3e37042f716af879479cb41c/gr3.jpg gr3 gr3.jpg jpg 19984 251 376 IMAGE-DOWNSAMPLED 1-s2.0-S1381116913004184-gr10.jpg https://s3.amazonaws.com/prod-ucs-content-store-us-east/content/pii:S1381116913004184/gr10/DOWNSAMPLED/image/jpeg/572f7c9b55bd2e6a05b43377844b3d78/gr10.jpg https://s3-eu-west-1.amazonaws.com/prod-ucs-content-store-eu-west/content/pii:S1381116913004184/gr10/DOWNSAMPLED/image/jpeg/572f7c9b55bd2e6a05b43377844b3d78/gr10.jpg gr10 gr10.jpg jpg 34367 230 339 IMAGE-DOWNSAMPLED 1-s2.0-S1381116913004184-gr1.jpg https://s3.amazonaws.com/prod-ucs-content-store-us-east/content/pii:S1381116913004184/gr1/DOWNSAMPLED/image/jpeg/22766dbe000c6cfb747068dc20aa0b73/gr1.jpg https://s3-eu-west-1.amazonaws.com/prod-ucs-content-store-eu-west/content/pii:S1381116913004184/gr1/DOWNSAMPLED/image/jpeg/22766dbe000c6cfb747068dc20aa0b73/gr1.jpg gr1 gr1.jpg jpg 26579 278 339 IMAGE-DOWNSAMPLED 1-s2.0-S1381116913004184-fx1.jpg https://s3.amazonaws.com/prod-ucs-content-store-us-east/content/pii:S1381116913004184/fx1/DOWNSAMPLED/image/jpeg/f151c536b290bfa004db81a41d2f7a1c/fx1.jpg https://s3-eu-west-1.amazonaws.com/prod-ucs-content-store-eu-west/content/pii:S1381116913004184/fx1/DOWNSAMPLED/image/jpeg/f151c536b290bfa004db81a41d2f7a1c/fx1.jpg fx1 true fx1.jpg jpg 14345 200 500 IMAGE-DOWNSAMPLED 1-s2.0-S1381116913004184-gr6.gif https://s3.amazonaws.com/prod-ucs-content-store-us-east/content/pii:S1381116913004184/gr6/DOWNSAMPLED/image/gif/e236b6e486a1acb224535e517fd1bd28/gr6.gif https://s3-eu-west-1.amazonaws.com/prod-ucs-content-store-eu-west/content/pii:S1381116913004184/gr6/DOWNSAMPLED/image/gif/e236b6e486a1acb224535e517fd1bd28/gr6.gif gr6 gr6.gif gif 9184 283 376 IMAGE-DOWNSAMPLED 1-s2.0-S1381116913004184-gr4.gif https://s3.amazonaws.com/prod-ucs-content-store-us-east/content/pii:S1381116913004184/gr4/DOWNSAMPLED/image/gif/66d776691b84a00af1e93eaebd682f23/gr4.gif https://s3-eu-west-1.amazonaws.com/prod-ucs-content-store-eu-west/content/pii:S1381116913004184/gr4/DOWNSAMPLED/image/gif/66d776691b84a00af1e93eaebd682f23/gr4.gif gr4 gr4.gif gif 5493 252 339 IMAGE-DOWNSAMPLED 1-s2.0-S1381116913004184-gr2.gif https://s3.amazonaws.com/prod-ucs-content-store-us-east/content/pii:S1381116913004184/gr2/DOWNSAMPLED/image/gif/1e014bb1384fd897d2f126b297d352b9/gr2.gif https://s3-eu-west-1.amazonaws.com/prod-ucs-content-store-eu-west/content/pii:S1381116913004184/gr2/DOWNSAMPLED/image/gif/1e014bb1384fd897d2f126b297d352b9/gr2.gif gr2 gr2.gif gif 9386 288 376 IMAGE-DOWNSAMPLED 1-s2.0-S1381116913004184-gr6.sml https://s3.amazonaws.com/prod-ucs-content-store-us-east/content/pii:S1381116913004184/gr6/THUMBNAIL/image/gif/3a7006863be0b1872ce280ef35f05d54/gr6.sml https://s3-eu-west-1.amazonaws.com/prod-ucs-content-store-eu-west/content/pii:S1381116913004184/gr6/THUMBNAIL/image/gif/3a7006863be0b1872ce280ef35f05d54/gr6.sml gr6 gr6.sml sml 4003 164 217 IMAGE-THUMBNAIL 1-s2.0-S1381116913004184-gr4.sml https://s3.amazonaws.com/prod-ucs-content-store-us-east/content/pii:S1381116913004184/gr4/THUMBNAIL/image/gif/9e73d0794d7dfa6d5db53e96677ae11c/gr4.sml https://s3-eu-west-1.amazonaws.com/prod-ucs-content-store-eu-west/content/pii:S1381116913004184/gr4/THUMBNAIL/image/gif/9e73d0794d7dfa6d5db53e96677ae11c/gr4.sml gr4 gr4.sml sml 2898 163 219 IMAGE-THUMBNAIL 1-s2.0-S1381116913004184-gr2.sml https://s3.amazonaws.com/prod-ucs-content-store-us-east/content/pii:S1381116913004184/gr2/THUMBNAIL/image/gif/a4d105f65018a9e026de866a919c816f/gr2.sml https://s3-eu-west-1.amazonaws.com/prod-ucs-content-store-eu-west/content/pii:S1381116913004184/gr2/THUMBNAIL/image/gif/a4d105f65018a9e026de866a919c816f/gr2.sml gr2 gr2.sml sml 4065 164 214 IMAGE-THUMBNAIL 1-s2.0-S1381116913004184-gr9.sml https://s3.amazonaws.com/prod-ucs-content-store-us-east/content/pii:S1381116913004184/gr9/THUMBNAIL/image/gif/bd53a59e6fa7b7cf624ec0997ccc1adf/gr9.sml https://s3-eu-west-1.amazonaws.com/prod-ucs-content-store-eu-west/content/pii:S1381116913004184/gr9/THUMBNAIL/image/gif/bd53a59e6fa7b7cf624ec0997ccc1adf/gr9.sml gr9 gr9.sml sml 12883 164 182 IMAGE-THUMBNAIL 1-s2.0-S1381116913004184-gr8.sml https://s3.amazonaws.com/prod-ucs-content-store-us-east/content/pii:S1381116913004184/gr8/THUMBNAIL/image/gif/4613d9e2813a0d8a54d80465bfa3ded2/gr8.sml https://s3-eu-west-1.amazonaws.com/prod-ucs-content-store-eu-west/content/pii:S1381116913004184/gr8/THUMBNAIL/image/gif/4613d9e2813a0d8a54d80465bfa3ded2/gr8.sml gr8 gr8.sml sml 15107 164 210 IMAGE-THUMBNAIL 1-s2.0-S1381116913004184-gr7.sml https://s3.amazonaws.com/prod-ucs-content-store-us-east/content/pii:S1381116913004184/gr7/THUMBNAIL/image/gif/8c3ea6877e31af54f6de99cfcb6a96b1/gr7.sml https://s3-eu-west-1.amazonaws.com/prod-ucs-content-store-eu-west/content/pii:S1381116913004184/gr7/THUMBNAIL/image/gif/8c3ea6877e31af54f6de99cfcb6a96b1/gr7.sml gr7 gr7.sml sml 5215 141 219 IMAGE-THUMBNAIL 1-s2.0-S1381116913004184-gr5.sml https://s3.amazonaws.com/prod-ucs-content-store-us-east/content/pii:S1381116913004184/gr5/THUMBNAIL/image/gif/8ec659f4b2b03192e0eaed6138710df6/gr5.sml https://s3-eu-west-1.amazonaws.com/prod-ucs-content-store-eu-west/content/pii:S1381116913004184/gr5/THUMBNAIL/image/gif/8ec659f4b2b03192e0eaed6138710df6/gr5.sml gr5 gr5.sml sml 12434 164 184 IMAGE-THUMBNAIL 1-s2.0-S1381116913004184-gr3.sml https://s3.amazonaws.com/prod-ucs-content-store-us-east/content/pii:S1381116913004184/gr3/THUMBNAIL/image/gif/4c981b6249666c0b7526d0de8243ff71/gr3.sml https://s3-eu-west-1.amazonaws.com/prod-ucs-content-store-eu-west/content/pii:S1381116913004184/gr3/THUMBNAIL/image/gif/4c981b6249666c0b7526d0de8243ff71/gr3.sml gr3 gr3.sml sml 3596 146 219 IMAGE-THUMBNAIL 1-s2.0-S1381116913004184-gr10.sml https://s3.amazonaws.com/prod-ucs-content-store-us-east/content/pii:S1381116913004184/gr10/THUMBNAIL/image/gif/05acdb37e950cff59710b20c5d95e656/gr10.sml https://s3-eu-west-1.amazonaws.com/prod-ucs-content-store-eu-west/content/pii:S1381116913004184/gr10/THUMBNAIL/image/gif/05acdb37e950cff59710b20c5d95e656/gr10.sml gr10 gr10.sml sml 16282 148 219 IMAGE-THUMBNAIL 1-s2.0-S1381116913004184-gr1.sml https://s3.amazonaws.com/prod-ucs-content-store-us-east/content/pii:S1381116913004184/gr1/THUMBNAIL/image/gif/4522f361514b3c37ae2c0f4c998ff8d9/gr1.sml https://s3-eu-west-1.amazonaws.com/prod-ucs-content-store-eu-west/content/pii:S1381116913004184/gr1/THUMBNAIL/image/gif/4522f361514b3c37ae2c0f4c998ff8d9/gr1.sml gr1 gr1.sml sml 11291 164 200 IMAGE-THUMBNAIL 1-s2.0-S1381116913004184-fx1.sml https://s3.amazonaws.com/prod-ucs-content-store-us-east/content/pii:S1381116913004184/fx1/THUMBNAIL/image/gif/295db3c685c69ad9174f1b92256a5bd0/fx1.sml https://s3-eu-west-1.amazonaws.com/prod-ucs-content-store-eu-west/content/pii:S1381116913004184/fx1/THUMBNAIL/image/gif/295db3c685c69ad9174f1b92256a5bd0/fx1.sml fx1 true fx1.sml sml 3765 88 219 IMAGE-THUMBNAIL MOLCAA 8928 S1381-1169(13)00418-4 10.1016/j.molcata.2013.11.006 Elsevier B.V. Fig. 1 FE-SEM image of as prepared Ni nanoparticles obtained from a dilute solution (10−4 M, sample A). The NPs diameters range from 40 to 80nm, but it is noteworthy that on the upper right corner of this figure there is an enlarged nanoparticle that seems to be formed by smaller NPs. Fig. 2 ZFC–FC curves (5–300K temperature range, μ 0 H =0.01T) of the as prepared A sample. In the inset the room temperature magnetic hysteresis cycle is shown. Fig. 3 X-ray diffractograms of (a) Ni NPs annealed sample A (marked peaks are of cubic Ni phase) and (b) fresh Ni125%/Al2O3 (marked peaks are of NiO). Fig. 4 Room temperature magnetic hysteresis of the sample A after annealing at 773K for 6h. Fig. 5 FE-SEM image of as prepared Ni nanoparticles obtained from a concentrated solution (10−2 M, sample B). Fig. 6 5–300K ZFC–FC curves (μ 0 H =0.01T) of the B sample. In the inset the room temperature magnetic hysteresis cycle is sketched. Fig. 7 X-ray diffractograms of spent catalytic materials: (a) Ni125%/Al2O3 after ethanol+steam conversion cycle (marked peaks * are residual NiO precursor; h=hexagonal Ni), (b) Ni NPs after ethanol+steam conversion cycle (marked peaks h=hexagonal Ni), (c) Ni125%/Al2O3 after CO2 methanation (marked peaks c=cubic Ni) and (d) Ni NPs after CO2 methanation (marked peaks c=cubic Ni). Fig. 8 FE-SEM image of spent NiNPs after ethanol conversion in the presence of steam. It is possible to observe the appearance of carbon nanotubes. Fig. 9 FE-SEM image of NiNPs after CO2 methanation. Fig. 10 FE-SEM image of Ni125/alumina after CO2 methanation. Table 1 Ethanol and water conversions, C-product selectivities and hydrogen yields on Nickel NPs. T Furnace Ni NP (K) X, C2H6O X, H2O S, CH4 S, CO S, CO2 S, CH2CH2 S, CH3CHO S, CH3COCH3 Y, H2 523 0.92 0.01 0.40 0.42 0.01 0.01 0.13 0.03 0.17 573 0.97 0.04 0.44 0.41 0.10 0.01 0.03 0.00 0.22 673 1.00 0.22 0.41 0.03 0.56 0.00 0.00 0.00 0.44 773 0.94 0.28 0.26 0.07 0.67 0.00 0.00 0.00 0.59 673 1.00 0.26 0.33 0.04 0.63 0.01 0.00 0.00 0.54 573 0.17 0.02 0.42 0.40 0.18 0.00 0.00 0.00 0.05 523 0.19 0.02 0.40 0.33 0.26 0.00 0.00 0.00 0.07 Table 2 Ethanol and water conversions, C-product selectivities and hydrogen yields on 125% Ni/Al2O3. T Furnace Ni 125 (K) X, C2H6O X, H2O S, CH4 S, CO S, CO2 S, CH2CH2 S, CH3CHO S, C4H10O S, C4H8O2 Y, H2 523 0.01 0.00 0.00 0.00 0.00 0.00 1.00 0.00 0.00 0.00 573 0.05 0.00 0.00 0.00 0.02 0.06 0.47 0.40 0.04 0.01 673 0.46 −0.04 0.00 0.00 0.00 0.36 0.27 0.36 0.00 0.02 773 1.00 0.34 0.21 0.08 0.72 0.00 0.00 0.00 0.00 0.70 673 1.00 0.19 0.46 0.02 0.52 0.00 0.00 0.00 0.00 0.38 573 0.31 0.00 0.08 0.09 0.04 0.02 0.64 0.11 0.01 0.06 523 0.10 0.00 0.04 0.05 0.02 0.00 0.83 0.06 0.00 0.02 Table 3 CO2 conversion and C-product selectivities on 125% Ni/Al2O3 and on Ni NPs. T Furnace Ni 125% Ni NPs (K) X, CO2 S, CO S, CH4 X, CO2 S, CO S, CH4 523 0.00 0.00 0.00 0.00 0.00 0.00 573 0.07 0.18 0.82 0.00 0.00 0.00 673 0.42 0.19 0.81 0.03 0.50 0.50 773 0.71 0.14 0.86 0.06 0.50 0.50 673 0.40 0.24 0.76 0.004 0.51 0.49 573 0.04 0.25 0.75 0.00 0.00 0.00 523 0.01 0.00 1.00 0.00 0.00 0.00 Unsupported versus alumina-supported Ni nanoparticles as catalysts for steam/ethanol conversion and CO2 methanation Paola Riani a Gabriella Garbarino b Mattia Alberto Lucchini a Fabio Canepa c Guido Busca b ⁎ a Università degli Studi di Genova, Dipartimento di Chimica e Chimica Industriale (DCCI), Via Dodecaneso, 31 16146 Genova, Italy Università degli Studi di Genova, Dipartimento di Chimica e Chimica Industriale (DCCI) Via Dodecaneso Genova 31 16146 Italy b Università degli Studi di Genova, Dipartimento di Ingegneria Civile, Chimica e Ambientale (DICCA), Laboratorio di chimica delle superfici e catalisi, P.zzale Kennedy, 1 16129 Genova, Italy Università degli Studi di Genova, Dipartimento di Ingegneria Civile, Chimica e Ambientale (DICCA), Laboratorio di chimica delle superfici e catalisi P.zzale Kennedy Genova 1 16129 Italy c IMEM-CNR Unità di Genova and Università degli Studi di Genova, Dipartimento di Chimica e Chimica Industriale (DCCI), Via Dodecaneso, 31 16146 Genova, Italy IMEM-CNR Unità di Genova and Università degli Studi di Genova, Dipartimento di Chimica e Chimica Industriale (DCCI) Via Dodecaneso Genova 31 16146 Italy ⁎ Corresponding author at: University of Genoa, Department of Civil, Chemical and Environmental Engineering, University of Genova, DICCA, Fiera del Mare, I-16129 Genoa, GE, Italy. Tel.: +390103536024; fax: +390103536028. Graphical abstract Nickel nanoparticles (NPs, particle radius <8nm) were prepared via reduction method in aqueous solution and were structurally and morphologically characterized by X-ray diffraction (XRD) and scanning electron microscopy (SEM). A DC-SQUID magnetometer was also used to determine the particle size. As a reference, a high loading (125% Ni wtNi/wtsupport) Ni/Al2O3, prepared through wet impregnation technique, was also studied. The results of the catalytic tests in ethanol conversion in the presence of steam on unsupported Ni NPs at 523K show already an ethanol conversion higher than 90% together with high yields in methane, CO and H2. These NPs actually behave as very active ethanol decomposition catalysts, in these conditions. Increasing the reaction temperature (673K) they convert into good steam reforming catalysts. On the other hand, the conventional alumina-supported Ni catalyst is poorly active in dehydrogenation to acetaldehyde below 673K, but behaves as a good steam reforming catalyst at this temperature. In CO2 methanation at 773K the best catalytic activity was obtained on 125% Ni/Al2O3, while Ni NPs result poorly active in catalysing this reaction. The characterization of the exhaust materials shows: (i) hexagonal Ni particles on both catalysts after ethanol conversion in the presence of steam, (ii) cubic nickel particles on both samples after methanation of CO2. Mechanistic implications of these results are discussed. Keywords Nickel nanoparticles Ethanol conversion Steam reforming Methanation, Nickel catalysts 1 Introduction The steam reforming of (bio)ethanol (ESR) represents a possible way to produce biosyngas and biohydrogen, as a step in the production of renewable fuels [1–9]. At least three families of catalysts are under study to perform efficiently this reaction. Nickel-based catalysts are quite efficient in catalysing ESR giving rise to hydrogen yield only at quite high temperature. In these conditions, CO is produced in relevant amounts, thus the syngas cannot be directly fed to low temperature fuel cells. At low temperature, the thermodynamics allows very small amount of CO, but ethanol conversion may be slower and methane may be present in huge quantity in the resulting syngas. This is what really occurs with noble metal catalysts as well as with Ni ones in the low temperature ESR reaction [10,11]. Cobalt catalysts appear more promising than Ni based ones [12–15], in relation to the lower production of carbon species that finally cause catalyst deactivation [16], a very relevant problem for ESR. In fact, unsupported cobalt nanoparticles (NPs) behave as excellent catalysts for ESR at low temperature with poor methane production [15], with performances even better than highly loaded Co/Al2O3 catalysts. The presence of methane in the gas deriving from ESR reduces the achieved hydrogen concentration and, in case, the fuel cell performances. Two different ways may be responsible for the formation of methane during ESR: one is the methanation reaction, favoured thermodynamically more, lower is the reaction temperature. The other is the decomposition of ethanol itself or of its conversion products, like acetaldehyde and acetic acid. The reason why some catalysts (mainly Co-based) seem to be more selective to steam reforming products while others (Ni-based and noble metal based) produce more methane it is still under discussion. Another point still debated in the literature concerns the best metal oxidation state for ESR, metallic or partly unreduced. As a further step in our studies, we wanted to investigate the behaviour of unsupported Ni NPs in the same reaction, to compare their behaviour with that of unsupported Co NPs and of Ni/Al2O3 conventional catalysts. Additionally, we became interested to the CO2 methanation reaction, an interesting possible way to convert this greenhouse gas to useful products. This reaction can also give information on the methane production step upon ESR. For these reasons we tested our Ni based materials also for this reaction. In this paper we will present our attempts to prepare unsupported Ni metal NPs, their structural and morphological characterization obtained coupling XRD and FE-SEM to magnetic measurements, in order to achieve a precise particle size measurement, and their behaviour in the cited catalytic reactions. 2 Experimental 2.1 Materials preparation NiCl2 6H2O 99.5wt.% and NaBH4 99.5wt.% were purchased from Sigma Aldrich and used without other purifications. The Ni NPs were prepared by a reduction method in aqueous solution. Two different Ni ions concentrations were used, namely 10−4 M (A) and 10−2 M (B) of NiCl2 6H2O. To each Ni2+ solution, in a three neck flask at room temperature under mechanical stirring in an argon flux, a controlled NaBH4 excess was added as reducing agent. The sudden appearance of a black fine suspension confirmed the reduction of the Ni2+ ions to metallic nickel. The solution is maintained under vigorous stirring for 15min, then Nickel NPs were collected using a permanent magnet, washed in deionised water at least four times and, finally, dried in open air. In order to compare the catalytic activity of nickel NPs to that of conventionally prepared catalysts, a heavily loaded Ni/Al2O3 catalyst has been prepared by conventional wet impregnation of Siralox 5/170 support (alumina with 5% (w/w) SiO2 from Sasol, 170m2/g) using Ni(NO3)2 6H2O water solution as precursor. After impregnation, drying at 363K for 24h and calcination at 973K for 5h were performed. The composition of this catalyst, 125% Ni/Al2O3 (wtNi/wtsupport), has been chosen in order to allow the formation of a significant amount of Ni metal upon conditioning. 2.2 Materials characterization Microscopic analyses on all the samples were performed by the SEM ZEISS SUPRA 40 VP, with a field emission gun. This instrument is equipped with a high sensitivity “InLens” secondary electrons detector and with an EDX microanalysis OXFORD “INCA Energie 450×3″. Samples for SEM analysis were suspended in ethanol and exposed to ultrasonic vibrations to decrease the aggregation. A drop of the resultant mixture was finally deposed on a Lacey Carbon copper grid. X-ray diffraction patterns of both samples were obtained using a vertical powder diffractometer X’Pert with Cu Kα radiation (λ =0.15406nm). The patterns were collected in the 25–100° 2θ range with a step of 0.03° and a counting time for each step of 12s. Powder patterns were indexed by comparing experimental results to the data reported in the Pearson's Crystal data database [17]. DC magnetization was performed in a dc-Superconducting Quantum Interference Device (SQUID) magnetometer (MPMS—Magnetic Properties Measurement System, Quantum Design) with resolution better than 10−6 emu. The room temperature (RT) magnetic hysteresis cycle was obtained in the 0–5Tesla (T) μ 0 H magnetic field range. The thermal dependence of the magnetisation (5–300K range) was obtained following the zero field cooling (ZFC)—field cooling (FC) procedure. In a ZFC process the sample is cooled to the lowest temperature in absence of a magnetic field. At that temperature the field is switched on and the magnetization is recorded as a function of temperature. In a FC procedure the same magnetic field of the ZFC is applied before the cooling down of the sample from RT down to 5K; then, with the magnetic field already switched on, the magnetization is measured as a function of temperature. 2.3 Catalytic tests All the catalytic experiments were carried out in a fixed-bed tubular silica glass flow reactor, operating isothermally, loaded with 44mg of catalyst mixed with 440mg of silica glass particles (60–70 mesh sieved). For the experiments concerning either ethanol for ethanol/ steam conversion or 500mg for methanation conversion in the presence of steam the feed was constituted by a mixture of ethanol and water with a molar ratio (water to ethanol) equal to 6 in He (41.6% v/v) added as carrier gas. The gas hourly space velocity was GHSV=51,700h−1. Moreover hydrogen yield was defined as molH2out/(6molethanol in). Instead, in the case of CO2 hydrogenation we fed a gaseous mixture of CO2 and H2 in the molar ratio 1 to 5 within any dilution in a carrier gas. In this case the GHSV was equal to 52,300h−1. In both cases products analysis was performed with a gas-chromatograph Agilent 4890 equipped with a Varian capillary column “Molsieve 5A/Porabond Q Tandem” and TCD and FID detectors in series. Between them a nickel catalyst tube was employed to reduce CO and CO2 to CH4. Products analysis in the first case was also performed with a GC/MS (ThermoFisher), in order to have a precise identification of the involved compounds. One of the considered parameters was temperature, that was varied step by step in-between 523 and 773K waiting for each point the steady state; moreover, in order to understand something about catalyst conditioning we have done the experiments first raising the temperature and after decreasing it. 3 Results and discussion 3.1 Sample A Ni NPs Fig. 1 reports a SEM image of as prepared Ni NPs obtained from the dilute solution (10−4 M). The apparent diameters of the observed particles range from 40 to 80nm, but, as it is possible to see from the image of a single particle reported in the upper right corner of the same figure, these are actually aggregates of even smaller NPs. The X-ray analysis carried out on the as cast sample showed a diffraction pattern, characteristic of an “amorphous” state. In Fig. 2 the magnetic data relative to these NPs obtained from SQUID measurements are presented. It displays the ZFC–FC curves obtained in the 5–300K temperature range with an applied magnetic field μ 0 H of 0.01T, while in the inset of the same figure the room temperature (RT) magnetic hysteresis cycle is reported. The ZFC–FC curve displays a very sharp maximum centred at 16K, the typical feature of the blocking temperature (T B) of superparamagnetic NPs, followed by an abrupt decrease of the magnetisation to very low values above 50K. The good agreement between T B and the bifurcation of the ZFC–FC curves (18.5K) means that these NPs are in a very narrow dimensional range. A preliminary estimate of the real dimensions of our Ni NPs can be obtained from T B since this temperature is related to the size of the nanoparticle by the equation: (1) T B = K an. V k B ln τ m τ 0 where K an. is the anisotropy constant, V is the average volume of the NP, k B is the Boltzmann constant, τ m is the measurement time and τ 0 is a constant called attempt time (10−9–10−10 s). A typical value for the logarithm is 25. Since the anisotropy constant for bulk Ni is strongly temperature dependent and the blocking temperature is very low (T B =16K), in agreement with [18,19] we decided to use the anisotropy constant value at 4.2K in order to calculate the average volume of our NPs from T B. So, taking K an. =12×105 erg/cm3 [20], we obtain an average radius around 2nm. The RT hysteresis cycle, obtained in the −5 to 5T magnetic field range, confirms the very low dimensions of the Ni NPs: the behaviour, completely anhysteretic without any evidence of coercivity, is completely linear in the whole magnetic field range investigated and does not show any trend to reach the saturation. The absence of any curvature in the low field magnetisation curve is a fingerprint of the lack of ferromagnetic NPs. Numerical simulations, based on the Langevin model for superparamagnetism fix as an upper limit for the average radius of these NPs the value of 1nm, in agreement with the amorphous structure detected by XRD. The amorphous nature of these nanostructures suggested the study of the structural and magnetic properties of these NPs after an annealing procedure, in order to know if they crystallize and also to have a rough indication on their sintering behaviour. Thus the NPs were annealed at 773K for 6h. After this procedure, they were analysed again by X-ray diffraction and magnetic measurements. The X-ray diffraction pattern of the annealed NPs, presented in Fig. 3 (a line), displays the cubic crystal structure of nickel. The RT magnetic hysteresis, shown in Fig. 4 , confirms the diffraction data, giving evidence of a typical Langevin behaviour with a saturation value (∼52Am2/kg) comparable with that of bulk Ni [21] (M sat. =58.6Am2/kg). Under the hypothesis of a distribution of dimensions and, consequently, a distribution of NP magnetic moments present in the real nanosystems, we can fit the experimental magnetisation data with the following Langevin equation (2): (2) M H , r = ∫ a b coth V NP r × 0.62 × μ B × H V Ni × k B × T − V Ni × k B × T V NP r × 0.62 × μ B × H × f r × d r Where r is the radius of the NP, V NP(r) is the volume of the nanoparticle, 0.62μ B is the magnetic moment (in Bohr magnetons) per Ni atom, V Ni is the volume of the Ni atom, k B is again the Boltzmann constant, H is the magnetic field, T the temperature, a and b are the integral limits (in our fit a =0.1nm and b =30nm), f(r) is the log normal distribution of radii, currently adopted in this kind of analysis, given by (3): (3) f r = 1 r × σ × 2 π × exp ln r r m 2 2 × σ 2 Here r m is the average (mean) radius and σ the distribution width. The fit, reported as continuous line in the same figure, gives as results r m =4nm and σ =0.5. The annealing process had the effect to increase the NPs radius (from ∼1nm to a mean value of 4nm) changing thus the microstructure from amorphous to crystalline. 3.2 Sample B Ni NPs In Fig. 5 , a FE-SEM image of a sample of Ni NPs obtained from a more concentrated synthesis, is presented. Very large NPs aggregates are formed; the apparent diameters of the observed particles range from 10 to 30nm, but, also in this case, these are actually aggregates of even smaller NPs. The X-ray diffraction pattern of the Ni NPs prepared with a more concentrated Ni salt solution (1B) displays the nickel cubic crystal structure, isostructural to Cu, as the previous sample A annealed at 773K for 6h. This diffraction pattern has been omitted in Fig. 3 for simplicity. Fig. 6 reports the RT ZFC–FC magnetisation curves with an applied magnetic field of 0.01T obtained from the same sample. In the inset, the RT hysteresis cycle is also displayed. The ZFC curve presents a maximum, corresponding to the blocking temperature, around 40K. The two curves diverge at higher temperature (T bif. ∼160K). The relatively broad maximum observed is the manifest indication of a broad distribution of NPs dimensions and, consequently, of different blocking temperatures (T B's), ranging from 30 to 45K. On the basis of the above maximum limits taking the mean Ni anisotropy constant in this temperature span (K an. =10×105 erg/cm3), we obtain a radii distribution between 2.9 and 3.5nm. Furthemore, also the bifurcation at high temperature could be representative of a set of NPs with larger dimensions and, consequently, higher T B's. Under this hypothesis, a reasonable upper limit of the radius of this set of Ni NPs could be 7nm. 3.3 Characterization of alumina supported catalysts In Fig. 3 (line b) the diffraction pattern of the 125% Ni/Al2O3 catalyst is shown. The 125% Ni/Al2O3 catalyst pattern shows the characteristic peaks of the NiO phase (rock salt or periclase structure, cF8 NaCl type), together with those, very weak and not well detectable from the background, given by the support, that is a transition alumina with a tetragonal structure such as δ-Al2O3 or γ′-Al2O3 [22]. The analysis of the crystal size of the nickel oxide phase, carried out using the Scherrer equation gives rise to values of about 36nm for the most intense peak (200) of the NiO phase. 3.4 Catalytic activity in the conversion of ethanol in the presence of steam The experiment were performed in a tubular fixed bed reactor so, in order to prevent the risk of NPs losses we decided to use the B type sample that presents bigger agglomerates than A type sample. In Table 1 the catalytic behaviour of the sample B of Ni NPs in the conversion of ethanol in the presence of steam is summarized. The catalytic data indicate that this material is very active (conversion >90%) already at very low temperature (523 and 573K) in converting ethanol in the presence of steam. The obtained C-products are methane and CO (selectivity in the range 40–45% for both, with a selectivity towards this reaction up to 85%) together with acetaldehyde. Thus, it catalyzes, at least formally, mainly the decomposition of ethanol: CH 3 CH 2 OH → CH 4 CO + H 2 with very small conversion of water, small production of CO2, and consequently, a low hydrogen yield. This behaviour could result either from a high steam reforming activity towards ethanol: CH 3 CH 2 OH + H 2 O → 2 CO + 4 H 2 coupled with a very efficient methanation: CO + 3 H 2 → CH 4 + H 2 O or from a direct ethanol decomposition step. At 523 and 573K in the increasing and in the decreasing temperature experiments, a CH4 to CO product ratio very near to 1 is observed: this trend seems to be more consistent with a direct ethanol decomposition step. At 673K methane selectivity is still high but lower, selectivity to CO falls in favour of that to CO2 (56%), water conversion also becoming more significant. The CH4/CO+CO2 ratio is well below 1. This means that either steam reforming or water gas shift activities appeared. A further increase of the temperature up to 773K and the successive reduction to 673K does not change very much the behaviour observed, with predominant steam reforming activity: this trend leads to hydrogen yields in the 50–60% range, mainly limited by the still significant methane selectivity (around 30%). Thermodynamic calculations show that the composition of the product gas at 773K is near that forecast if steam reforming of ethanol, methanation/steam methane reforming and water gas shift approach equilibrium. Interestingly, in the decreasing temperature experiments at 573 and 523K Ni NPs lost their high activity, thus becoming poorly active. This behaviour is remarkably different from that of the 125% Ni/Al2O3 catalyst, summarized in Table 2 . This catalyst has low activity in the conversion of ethanol in the same conditions at 523K and 573K, producing acetaldehyde as the major product. At 673K it is active in converting ethanol also to ethylene and diethylether, the products of ethanol dehydration, together with acetaldehyde. The 125% Ni/Al2O3 catalyst only at 773K allows the full conversion of ethanol with steam mainly to CO and hydrogen, i.e. gives rise to steam reforming even if selectivity to methane is still quite high, >20%. However, in the decreasing temperature experiment it still is very active at 673K producing CH4, CO, CO2 and H2, without any ethylene nor acetaldehyde. This shows a “conditioning” effect, after which steam reforming activity remains also at 673K. We can remark that this catalyst is loaded in an oxide form, without any reduction pretreatment. Thus, such a “conditioning” effect may be associated to the reduction to Ni metal. Interestingly the ratio CH4/CO+CO2 observed at 673K in the lowering reaction temperature experiment is only slightly lower than 1. This product ratio suggests that ethanol decomposition may also occur as the main reaction, possibly followed by water gas shift reaction. However, even after conditioning, the catalyst loses activity at lower temperature give rise again mainly to dehydration to acetaldehyde at 573 and 523K. Thus in the decreasing reaction temperature experiments at 573 and 523K, when it is supposed to be “conditioned”, the catalyst recover a behaviour similar to that of the fresh catalyst (supposed to be still oxidized). 3.5 Catalytic activity in CO2 methanation In Table 3 the data on CO2 hydrogenation experiments are reported. At the lowest reaction temperature (523K) no conversion of CO2 is observed on both catalysts. At 573K we have a little conversion of CO2 on Ni-alumina catalyst producing mainly methane, and CO as a byproduct CO 2 + 4 H 2 → CH 4 + 2 H 2 O CO 2 + H 2 → CO + H 2 O while Ni NPs are still inactive. At 673K CO2 conversion increases to 42% on Ni-alumina while is very low on Ni NPs sample, with a different product distribution; on Ni/Al2O3 the main product remains CH4 with 84% selectivity, while on Ni NPs the ratio between selectivity to CO and CH4 is almost 1. At 773K CO2 conversion on Ni/Al2O3 reaches the value of 71% with 86% selectivity to methane and 14% to CO. The same behaviour is observed at each temperature in the increasing and the decreasing temperature experiments. Instead, Ni NPs remain almost inactive (6% conversion) also at 773K again producing 50% CO and 50% CH4. 3.6 Characterization of spent catalysts The data concerning the characterization of the spent catalysts after ethanol conversion in the presence of steam are reported in Figs. 7–10 . XRD patterns of both spent catalytic materials (Fig. 7 bottom, lines a and b) present the peaks of the metastable hexagonal Nickel polymorph (hP2-Mg type), usually assumed to be stabilized by carbon, while the XRD pattern of the spent 125% Ni/Al2O3 catalyst (indicated as a in the Fig. 7) shows additionally the peaks of the alumina support and residual peaks of the NiO precursor. The FE-SEM micrograph of the spent catalytic Ni NPs shows (see Fig. 8) aggregation phenomena of the single Ni NPs, partially coalesced to each other. Moreover, it is possible to observe the appearance of carbon nanotubes. As it is well known, these carbonaceous materials contribute to the increase of pressure losses upon time on stream and may also cause a decrease the catalytic activity. The formation of carbon nanotubes is also evident on the FE-SEM pictures of 125% Ni/Al2O3 (not reported here). XRD patterns of both spent catalytic materials after methanation experiments are reported in Fig. 7. Both the spent catalytic materials Ni125%/alumina (indicated as c in the figure) and spent NiNPs (indicated as d) show the peaks of the cubic nickel crystal structure, isostructural to Cu. The FE-SEM image of the spent NiNPs, reported in Fig. 9) shows an important agglomeration of the particles and also the absence of carbon nanotubes after reaction. In Fig. 10 the FE-SEM micrograph of spent Ni-alumina catalyst is reported: also in this case the absence of carbon nanotubes is evident. 4 Discussion The experiments reported here provided some data which can give some contribution to a better understanding the mechanism of ethanol steam reforming on Ni catalysts. Unsupported Ni NPs are very active in catalysing low temperature ethanol decomposition, even in the presence of steam at very low temperature (523, 573K). They convert into good steam reforming catalysts at high temperature (673, 773K) although still with high methane coproduction. By decreasing back reaction temperature, they lose their high low-temperature activity. They actually change their crystal structure from cubic to hexagonal nickel. It can be supposed that cubic Ni is more active in ethanol decomposition while hexagonal Ni is more active in steam reforming (at 673K). A different behaviour is found for Ni/Al2O3: when fresh (and unreduced) they are moderately active in ethanol dehydrogenation and dehydration at low temperature, likely with the contribution of the uncovered support surface, as shown in previous experiments [22], becoming active in steam reforming at 773, and 673K when “conditioned”. However, the high CH4/CO+CO2 ratio obtained at 673K may indicate that they may also produce ethanol decomposition. This catalyst recovers the initial low activity for dehydrogenation (but not in dehydration) in the lowering reaction temperature experiments, at the end of our cycle. Also this catalyst contains hexagonal Ni when spent, but also some NiO. The ability of Ni catalysts to catalyse ethanol decomposition has already been reported in the literature. As for example, Homs et al. [23] cited ethanol decomposition propensity of Ni/ZnO catalysts while, several years before, Gates et al. [24] provided evidence of ethanol decomposition on Ni 111 monocrystal surface. The data we report here suggest that ethanol decomposition likely goes through a first dehydrogenation step to formaldehyde, thus being actually due to decomposition of acetaldehyde. In fact, on both Ni NPs and on “conditioned” Ni/Al2O3 (in the decreasing temperature experiment), we find production of acetaldehyde at lower temperature, and high selectivity to methane and CO at higher temperature. We previously found on different Ni-MgO-Al2O3 and Ni-ZnO-Al2O3 catalysts methane selectivity higher than that forecasted by thermodynamics by ESR on Ni catalysts [25], suggesting that methane indeed comes from some decomposition step more that from methanation. However, we attributed methane formation to surface acetate decomposition: this was based on experiments of acetic acid steam reforming, that produced high methane selectivity on Ni catalysts [26] and on IR spectroscopic experiments [25,26], as well on the evidence that the higher the water amount in the feed, the lower the acetaldehyde selectivity. We supposed that at higher water concentrations the catalyst is more oxidized and oxidizing, thus favouring acetaldehyde conversion to acetic acid or surface acetate species, that can more easily decarboxylate [27]. The data might be rationalized supposing that two mechanism can concur in producing methane: the ethanol decomposition via acetaldehyde on the metal particles, as reported by several authors [2,28], and the acetate decomposition on the support or over an incompletely reduced phase. These mechanisms occur to a much lower extent on Cobalt catalysts that show very low methane selectivities also at low temperature, which is supposed to be due to the higher activity of cobalt to oxidize acetate surface intermediates [15]. At 773K the activity toward steam reforming reaction giving CO2 as main product is higher on Cobalt NPs than Ni ones. A characterization of the spent materials underlined that all of them produce carbonaceous species that could cause deactivation in more extended experiments. It seems quite interesting too that 125% Ni/Al2O3 is also a very active catalyst for CO2 methanation, while Ni NPs are not, both actually containing cubic Ni. A possible explanation is that the support (alumina or ionic Ni dispersed on alumina) may actually act in this reaction, possibly participating to the carbon dioxide adsorption step. The lack of formation carbon nanotubes as well as of C-stabilized hexagonal nickel during these experiments may support the idea that the CO2 methanation reaction may in large part occur on the support, the metal being mostly associated to the activation of hydrogen. A similar hypothesis was proposed previously for conversion of CO2 into CO and methanol on Cu/ZnO-Al2O3 catalysts [29]. Additionally, it has previously been found on Ni/Al2O3 the possibility of a CO methanation path occurring through oxygenate intermediates such as formate and methoxy groups, that convert into gas-phase methane through hydrogenation [30]. A mechanism through oxygenates (carbonates, formates, and methoxydes) adsorbed on the support with activation of hydrogen on the metal would avoid a contact between carbon atoms and the metal, thus avoiding growth of nanotubes and conversion into the hexagonal form, notoriously stabilized by carbon. Maybe, in actual conditions (higher pressures) this mechanism may occur together with a carbide-like mechanism occurring on the metal. 5 Conclusions The catalytic behaviour of Ni NPs in the conversion of ethanol in the presence of steam and in the methanation of CO2 has been studied and compared with that of heavily charged Ni/Al2O3. These studies provided evidence of the role of Nickel metal particles in decomposing ethanol through a previous acetaldehyde production step as a first step in ethanol steam reforming. This behaviour differentiates Ni catalysts from Co catalysts. Additionally, a role of the support in the ESR over supported catalysts is envisaged. A support effect is also evident in the methanation of CO2 on Ni/Al2O3, supposed to justify the high activity of this catalyst and the very low activity of Ni NP in this reaction. This CO2 methanation mechanism occurring in part on the support may also justify the permanence of Ni in the cubic crystal structure in the case of CO2 methanation on 125% Ni/Al2O3, in contrast to what happens upon ethanol steam reforming where both unsupported and supported spent catalysts contain hexagonal nickel. References [1] A. Haryanto S. Fernando N. Murali S. Adhikari Energ. Fuel 19 2005 2098 2106 [2] P.D. Vaidya A.E. Rodrigues Chem. Eng. J. 117 2006 39 49 [3] M. Ni D.Y.C. Leung M.K.H. Leung Int. J. Hydrogen Energy 32 2007 3238 3247 [4] F. Frusteri S. Freni J. Power Sources 173 2007 200 209 [5] P. Ramirez de la Piscina N. Homs Chem. Soc. Rev. 37 2008 2459 2467 [6] A. Bshish Z. Yaako N. Narayanan R. Ramakrishnan A. Ebshish Chem. Pap. 65 2011 251 266 [7] G. Nahar V. Dupont Biofuels 3 2012 167 191 [8] N. Bion D. Duprez F. Epron ChemSusChem 5 2012 76 84 [9] L.V. Mattos G. Jacobs B.H. Davis F.B. Noronha Chem. Rev. 112 2012 4094 4123 [10] P. Ciambelli V. Palma A. Ruggiero Appl. Catal. B: Environ. 96 2010 18 27 [11] P. Panagiotopoulou X.E. Verykios Int. J. Hydrogen Energy 37 2012 16333 16345 [12] V.A. de la Peña O'Shea R. Nafria P. Ramírez de la Piscina N. Homs Int. J. Hydrogen Energy 33 2008 3601 3606 [13] B. Bayram I. Ilgaz Soykal D. von Deak J.T. Miller U.S. Ozkan J. Catal. 284 2011 77 89 [14] G. Busca U. Costantino T. Montanari G. Ramis C. Resini M. Sisan Int. J. Hydrogen Energy 35 2010 5356 5366 [15] G. Garbarino P. Riani M.A. Lucchini F. Canepa S. Kawale G. Busca Int. J. Hydrogen Energy 38 2013 82 91 [16] R. Espinal E. Taboada F. Molins R.J. Chimentao F. Medina J. Llorca Appl. Catal. B: Environ. 127 2012 59 67 [17] Pearson Crystal Data: Crystal structure database for inorganic compounds, Release 2009/2012, ASM International, The Material Information Society. [18] P.C. Fonseca G.F. Goya R.F. Jardim R. Muccillo N.L.V. Carreno E. Longo E.R. Leite Phys. Rev. B 66 2002 104406 [19] Y. Hou S. Gao J. Mater. Chem. 13 2003 1510 1512 [20] R. O’Handley Modern Magnetic Materials: Principles and Applications 2000 John Wiley & Sons New York [21] E.P. Wolhfarth Ferromagnetic Materials 1 1980 North Holland Publishing Company Amsterdam 1 70 [22] G. Garbarino A. Lagazzo P. Riani G. Busca Appl. Catal. B: Environ. 129 2013 460 472 [23] N. Homs J. Llorca P. Ramírez de la Piscina Catal. Today 116 2006 361 366 [24] S.M. Gates J.N. Russell Jr. J.T. Yates Jr. Surf. Sci. 171 1986 111 134 [25] C. Resini T. Montanari L. Barattini G. Ramis G. Busca S. Presto P. Riani R. Marazza M. Sisani F. Marmottini U. Costantino Appl. Catal. A: Gen. 355 2009 83 93 [26] L. Barattini G. Ramis C. Resini G. Busca M. Sisani U. Costantino Chem. Eng. J. 153 2009 43 49 [27] G. Busca U. Costantino T. Montanari G. Ramis C. Resini M. Sisani Intern. J. Hydrogen Energy 35 2010 5356 5366 [28] V. Mas G. Baronetti N. Amadeo M. Laborde Chem. Eng. J. 138 2008 602 607 [29] M.A. Larrubia Vargas G. Busca U. Costantino F. Marmottini T. Montanari P. Patrono F. Pinzari G. Ramis J. Mol. Catal. A: Chem. 266 2007 188 197 [30] V. Sanchez-Escribano M.A. Larrubia Vargas E. Finocchio G. Busca Appl. Catal. A: Gen. 316 2007 68 74",
      "scopus-id": "84889035344",
      "coredata": {
        "eid": "1-s2.0-S1381116913004184",
        "dc:description": "Nickel nanoparticles (NPs, particle radius <8nm) were prepared via reduction method in aqueous solution and were structurally and morphologically characterized by X-ray diffraction (XRD) and scanning electron microscopy (SEM). A DC-SQUID magnetometer was also used to determine the particle size. As a reference, a high loading (125% Ni wtNi/wtsupport) Ni/Al2O3, prepared through wet impregnation technique, was also studied. The results of the catalytic tests in ethanol conversion in the presence of steam on unsupported Ni NPs at 523K show already an ethanol conversion higher than 90% together with high yields in methane, CO and H2. These NPs actually behave as very active ethanol decomposition catalysts, in these conditions. Increasing the reaction temperature (673K) they convert into good steam reforming catalysts. On the other hand, the conventional alumina-supported Ni catalyst is poorly active in dehydrogenation to acetaldehyde below 673K, but behaves as a good steam reforming catalyst at this temperature. In CO2 methanation at 773K the best catalytic activity was obtained on 125% Ni/Al2O3, while Ni NPs result poorly active in catalysing this reaction. The characterization of the exhaust materials shows: (i) hexagonal Ni particles on both catalysts after ethanol conversion in the presence of steam, (ii) cubic nickel particles on both samples after methanation of CO2. Mechanistic implications of these results are discussed.",
        "openArchiveArticle": "false",
        "prism:coverDate": "2014-03-31",
        "openaccessUserLicense": null,
        "prism:aggregationType": "Journal",
        "prism:url": "https://api.elsevier.com/content/article/pii/S1381116913004184",
        "dc:creator": [
          {
            "@_fa": "true",
            "$": "Riani, Paola"
          },
          {
            "@_fa": "true",
            "$": "Garbarino, Gabriella"
          },
          {
            "@_fa": "true",
            "$": "Lucchini, Mattia Alberto"
          },
          {
            "@_fa": "true",
            "$": "Canepa, Fabio"
          },
          {
            "@_fa": "true",
            "$": "Busca, Guido"
          }
        ],
        "link": [
          {
            "@_fa": "true",
            "@rel": "self",
            "@href": "https://api.elsevier.com/content/article/pii/S1381116913004184"
          },
          {
            "@_fa": "true",
            "@rel": "scidir",
            "@href": "https://www.sciencedirect.com/science/article/pii/S1381116913004184"
          }
        ],
        "dc:format": "application/json",
        "openaccessType": null,
        "pii": "S1381-1169(13)00418-4",
        "prism:volume": "383",
        "prism:publisher": "Elsevier B.V.",
        "dc:title": "Unsupported versus alumina-supported Ni nanoparticles as catalysts for steam/ethanol conversion and CO2 methanation",
        "prism:copyright": "Copyright © 2013 Elsevier B.V. All rights reserved.",
        "openaccess": "0",
        "prism:issn": "13811169",
        "dcterms:subject": [
          {
            "@_fa": "true",
            "$": "Nickel nanoparticles"
          },
          {
            "@_fa": "true",
            "$": "Ethanol conversion"
          },
          {
            "@_fa": "true",
            "$": "Steam reforming"
          },
          {
            "@_fa": "true",
            "$": "Methanation, Nickel catalysts"
          }
        ],
        "openaccessArticle": "false",
        "prism:publicationName": "Journal of Molecular Catalysis A: Chemical",
        "openaccessSponsorType": null,
        "prism:pageRange": "10-16",
        "prism:endingPage": "16",
        "pubType": "fla",
        "prism:coverDisplayDate": "March 2014",
        "prism:doi": "10.1016/j.molcata.2013.11.006",
        "prism:startingPage": "10",
        "dc:identifier": "doi:10.1016/j.molcata.2013.11.006",
        "openaccessSponsorName": null
      },
      "objects": {
        "object": [
          {
            "@category": "thumbnail",
            "@height": "13",
            "@width": "154",
            "@_fa": "true",
            "$": "https://api.elsevier.com/content/object/eid/1-s2.0-S1381116913004184-si8.gif?httpAccept=%2A%2F%2A",
            "@multimediatype": "GIF image file",
            "@type": "ALTIMG",
            "@size": "524",
            "@ref": "si8",
            "@mimetype": "image/gif"
          },
          {
            "@category": "thumbnail",
            "@height": "13",
            "@width": "178",
            "@_fa": "true",
            "$": "https://api.elsevier.com/content/object/eid/1-s2.0-S1381116913004184-si7.gif?httpAccept=%2A%2F%2A",
            "@multimediatype": "GIF image file",
            "@type": "ALTIMG",
            "@size": "532",
            "@ref": "si7",
            "@mimetype": "image/gif"
          },
          {
            "@category": "thumbnail",
            "@height": "13",
            "@width": "163",
            "@_fa": "true",
            "$": "https://api.elsevier.com/content/object/eid/1-s2.0-S1381116913004184-si6.gif?httpAccept=%2A%2F%2A",
            "@multimediatype": "GIF image file",
            "@type": "ALTIMG",
            "@size": "552",
            "@ref": "si6",
            "@mimetype": "image/gif"
          },
          {
            "@category": "thumbnail",
            "@height": "13",
            "@width": "220",
            "@_fa": "true",
            "$": "https://api.elsevier.com/content/object/eid/1-s2.0-S1381116913004184-si5.gif?httpAccept=%2A%2F%2A",
            "@multimediatype": "GIF image file",
            "@type": "ALTIMG",
            "@size": "655",
            "@ref": "si5",
            "@mimetype": "image/gif"
          },
          {
            "@category": "thumbnail",
            "@height": "13",
            "@width": "183",
            "@_fa": "true",
            "$": "https://api.elsevier.com/content/object/eid/1-s2.0-S1381116913004184-si4.gif?httpAccept=%2A%2F%2A",
            "@multimediatype": "GIF image file",
            "@type": "ALTIMG",
            "@size": "646",
            "@ref": "si4",
            "@mimetype": "image/gif"
          },
          {
            "@category": "thumbnail",
            "@height": "50",
            "@width": "260",
            "@_fa": "true",
            "$": "https://api.elsevier.com/content/object/eid/1-s2.0-S1381116913004184-si3.gif?httpAccept=%2A%2F%2A",
            "@multimediatype": "GIF image file",
            "@type": "ALTIMG",
            "@size": "1138",
            "@ref": "si3",
            "@mimetype": "image/gif"
          },
          {
            "@category": "thumbnail",
            "@height": "109",
            "@width": "343",
            "@_fa": "true",
            "$": "https://api.elsevier.com/content/object/eid/1-s2.0-S1381116913004184-si2.gif?httpAccept=%2A%2F%2A",
            "@multimediatype": "GIF image file",
            "@type": "ALTIMG",
            "@size": "2957",
            "@ref": "si2",
            "@mimetype": "image/gif"
          },
          {
            "@category": "thumbnail",
            "@height": "49",
            "@width": "108",
            "@_fa": "true",
            "$": "https://api.elsevier.com/content/object/eid/1-s2.0-S1381116913004184-si1.gif?httpAccept=%2A%2F%2A",
            "@multimediatype": "GIF image file",
            "@type": "ALTIMG",
            "@size": "631",
            "@ref": "si1",
            "@mimetype": "image/gif"
          },
          {
            "@category": "high",
            "@height": "1350",
            "@width": "1500",
            "@_fa": "true",
            "$": "https://api.elsevier.com/content/object/eid/1-s2.0-S1381116913004184-gr9_lrg.jpg?httpAccept=%2A%2F%2A",
            "@multimediatype": "JPEG image file",
            "@type": "IMAGE-HIGH-RES",
            "@size": "382368",
            "@ref": "gr9",
            "@mimetype": "image/jpeg"
          },
          {
            "@category": "high",
            "@height": "1169",
            "@width": "1500",
            "@_fa": "true",
            "$": "https://api.elsevier.com/content/object/eid/1-s2.0-S1381116913004184-gr8_lrg.jpg?httpAccept=%2A%2F%2A",
            "@multimediatype": "JPEG image file",
            "@type": "IMAGE-HIGH-RES",
            "@size": "389672",
            "@ref": "gr8",
            "@mimetype": "image/jpeg"
          },
          {
            "@category": "high",
            "@height": "1075",
            "@width": "1667",
            "@_fa": "true",
            "$": "https://api.elsevier.com/content/object/eid/1-s2.0-S1381116913004184-gr7_lrg.jpg?httpAccept=%2A%2F%2A",
            "@multimediatype": "JPEG image file",
            "@type": "IMAGE-HIGH-RES",
            "@size": "196746",
            "@ref": "gr7",
            "@mimetype": "image/jpeg"
          },
          {
            "@category": "high",
            "@height": "1260",
            "@width": "1417",
            "@_fa": "true",
            "$": "https://api.elsevier.com/content/object/eid/1-s2.0-S1381116913004184-gr5_lrg.jpg?httpAccept=%2A%2F%2A",
            "@multimediatype": "JPEG image file",
            "@type": "IMAGE-HIGH-RES",
            "@size": "303103",
            "@ref": "gr5",
            "@mimetype": "image/jpeg"
          },
          {
            "@category": "high",
            "@height": "1113",
            "@width": "1667",
            "@_fa": "true",
            "$": "https://api.elsevier.com/content/object/eid/1-s2.0-S1381116913004184-gr3_lrg.jpg?httpAccept=%2A%2F%2A",
            "@multimediatype": "JPEG image file",
            "@type": "IMAGE-HIGH-RES",
            "@size": "105127",
            "@ref": "gr3",
            "@mimetype": "image/jpeg"
          },
          {
            "@category": "high",
            "@height": "1017",
            "@width": "1500",
            "@_fa": "true",
            "$": "https://api.elsevier.com/content/object/eid/1-s2.0-S1381116913004184-gr10_lrg.jpg?httpAccept=%2A%2F%2A",
            "@multimediatype": "JPEG image file",
            "@type": "IMAGE-HIGH-RES",
            "@size": "273150",
            "@ref": "gr10",
            "@mimetype": "image/jpeg"
          },
          {
            "@category": "high",
            "@height": "1228",
            "@width": "1500",
            "@_fa": "true",
            "$": "https://api.elsevier.com/content/object/eid/1-s2.0-S1381116913004184-gr1_lrg.jpg?httpAccept=%2A%2F%2A",
            "@multimediatype": "JPEG image file",
            "@type": "IMAGE-HIGH-RES",
            "@size": "246705",
            "@ref": "gr1",
            "@mimetype": "image/jpeg"
          },
          {
            "@category": "high",
            "@height": "886",
            "@width": "2213",
            "@_fa": "true",
            "$": "https://api.elsevier.com/content/object/eid/1-s2.0-S1381116913004184-fx1_lrg.jpg?httpAccept=%2A%2F%2A",
            "@multimediatype": "JPEG image file",
            "@type": "IMAGE-HIGH-RES",
            "@size": "115943",
            "@ref": "fx1",
            "@mimetype": "image/jpeg"
          },
          {
            "@category": "high",
            "@height": "2513",
            "@width": "3333",
            "@_fa": "true",
            "$": "https://api.elsevier.com/content/object/eid/1-s2.0-S1381116913004184-gr6_lrg.gif?httpAccept=%2A%2F%2A",
            "@multimediatype": "GIF image file",
            "@type": "IMAGE-HIGH-RES",
            "@size": "84159",
            "@ref": "gr6",
            "@mimetype": "image/gif"
          },
          {
            "@category": "high",
            "@height": "2232",
            "@width": "3000",
            "@_fa": "true",
            "$": "https://api.elsevier.com/content/object/eid/1-s2.0-S1381116913004184-gr4_lrg.gif?httpAccept=%2A%2F%2A",
            "@multimediatype": "GIF image file",
            "@type": "IMAGE-HIGH-RES",
            "@size": "53483",
            "@ref": "gr4",
            "@mimetype": "image/gif"
          },
          {
            "@category": "high",
            "@height": "2555",
            "@width": "3333",
            "@_fa": "true",
            "$": "https://api.elsevier.com/content/object/eid/1-s2.0-S1381116913004184-gr2_lrg.gif?httpAccept=%2A%2F%2A",
            "@multimediatype": "GIF image file",
            "@type": "IMAGE-HIGH-RES",
            "@size": "88319",
            "@ref": "gr2",
            "@mimetype": "image/gif"
          },
          {
            "@category": "standard",
            "@height": "305",
            "@width": "339",
            "@_fa": "true",
            "$": "https://api.elsevier.com/content/object/eid/1-s2.0-S1381116913004184-gr9.jpg?httpAccept=%2A%2F%2A",
            "@multimediatype": "JPEG image file",
            "@type": "IMAGE-DOWNSAMPLED",
            "@size": "32299",
            "@ref": "gr9",
            "@mimetype": "image/jpeg"
          },
          {
            "@category": "standard",
            "@height": "264",
            "@width": "339",
            "@_fa": "true",
            "$": "https://api.elsevier.com/content/object/eid/1-s2.0-S1381116913004184-gr8.jpg?httpAccept=%2A%2F%2A",
            "@multimediatype": "JPEG image file",
            "@type": "IMAGE-DOWNSAMPLED",
            "@size": "34620",
            "@ref": "gr8",
            "@mimetype": "image/jpeg"
          },
          {
            "@category": "standard",
            "@height": "242",
            "@width": "376",
            "@_fa": "true",
            "$": "https://api.elsevier.com/content/object/eid/1-s2.0-S1381116913004184-gr7.jpg?httpAccept=%2A%2F%2A",
            "@multimediatype": "JPEG image file",
            "@type": "IMAGE-DOWNSAMPLED",
            "@size": "29143",
            "@ref": "gr7",
            "@mimetype": "image/jpeg"
          },
          {
            "@category": "standard",
            "@height": "285",
            "@width": "320",
            "@_fa": "true",
            "$": "https://api.elsevier.com/content/object/eid/1-s2.0-S1381116913004184-gr5.jpg?httpAccept=%2A%2F%2A",
            "@multimediatype": "JPEG image file",
            "@type": "IMAGE-DOWNSAMPLED",
            "@size": "30500",
            "@ref": "gr5",
            "@mimetype": "image/jpeg"
          },
          {
            "@category": "standard",
            "@height": "251",
            "@width": "376",
            "@_fa": "true",
            "$": "https://api.elsevier.com/content/object/eid/1-s2.0-S1381116913004184-gr3.jpg?httpAccept=%2A%2F%2A",
            "@multimediatype": "JPEG image file",
            "@type": "IMAGE-DOWNSAMPLED",
            "@size": "19984",
            "@ref": "gr3",
            "@mimetype": "image/jpeg"
          },
          {
            "@category": "standard",
            "@height": "230",
            "@width": "339",
            "@_fa": "true",
            "$": "https://api.elsevier.com/content/object/eid/1-s2.0-S1381116913004184-gr10.jpg?httpAccept=%2A%2F%2A",
            "@multimediatype": "JPEG image file",
            "@type": "IMAGE-DOWNSAMPLED",
            "@size": "34367",
            "@ref": "gr10",
            "@mimetype": "image/jpeg"
          },
          {
            "@category": "standard",
            "@height": "278",
            "@width": "339",
            "@_fa": "true",
            "$": "https://api.elsevier.com/content/object/eid/1-s2.0-S1381116913004184-gr1.jpg?httpAccept=%2A%2F%2A",
            "@multimediatype": "JPEG image file",
            "@type": "IMAGE-DOWNSAMPLED",
            "@size": "26579",
            "@ref": "gr1",
            "@mimetype": "image/jpeg"
          },
          {
            "@category": "standard",
            "@height": "200",
            "@width": "500",
            "@_fa": "true",
            "$": "https://api.elsevier.com/content/object/eid/1-s2.0-S1381116913004184-fx1.jpg?httpAccept=%2A%2F%2A",
            "@multimediatype": "JPEG image file",
            "@type": "IMAGE-DOWNSAMPLED",
            "@size": "14345",
            "@ref": "fx1",
            "@mimetype": "image/jpeg"
          },
          {
            "@category": "standard",
            "@height": "283",
            "@width": "376",
            "@_fa": "true",
            "$": "https://api.elsevier.com/content/object/eid/1-s2.0-S1381116913004184-gr6.gif?httpAccept=%2A%2F%2A",
            "@multimediatype": "GIF image file",
            "@type": "IMAGE-DOWNSAMPLED",
            "@size": "9184",
            "@ref": "gr6",
            "@mimetype": "image/gif"
          },
          {
            "@category": "standard",
            "@height": "252",
            "@width": "339",
            "@_fa": "true",
            "$": "https://api.elsevier.com/content/object/eid/1-s2.0-S1381116913004184-gr4.gif?httpAccept=%2A%2F%2A",
            "@multimediatype": "GIF image file",
            "@type": "IMAGE-DOWNSAMPLED",
            "@size": "5493",
            "@ref": "gr4",
            "@mimetype": "image/gif"
          },
          {
            "@category": "standard",
            "@height": "288",
            "@width": "376",
            "@_fa": "true",
            "$": "https://api.elsevier.com/content/object/eid/1-s2.0-S1381116913004184-gr2.gif?httpAccept=%2A%2F%2A",
            "@multimediatype": "GIF image file",
            "@type": "IMAGE-DOWNSAMPLED",
            "@size": "9386",
            "@ref": "gr2",
            "@mimetype": "image/gif"
          },
          {
            "@category": "thumbnail",
            "@height": "164",
            "@width": "217",
            "@_fa": "true",
            "$": "https://api.elsevier.com/content/object/eid/1-s2.0-S1381116913004184-gr6.sml?httpAccept=%2A%2F%2A",
            "@multimediatype": "GIF image file",
            "@type": "IMAGE-THUMBNAIL",
            "@size": "4003",
            "@ref": "gr6",
            "@mimetype": "image/gif"
          },
          {
            "@category": "thumbnail",
            "@height": "163",
            "@width": "219",
            "@_fa": "true",
            "$": "https://api.elsevier.com/content/object/eid/1-s2.0-S1381116913004184-gr4.sml?httpAccept=%2A%2F%2A",
            "@multimediatype": "GIF image file",
            "@type": "IMAGE-THUMBNAIL",
            "@size": "2898",
            "@ref": "gr4",
            "@mimetype": "image/gif"
          },
          {
            "@category": "thumbnail",
            "@height": "164",
            "@width": "214",
            "@_fa": "true",
            "$": "https://api.elsevier.com/content/object/eid/1-s2.0-S1381116913004184-gr2.sml?httpAccept=%2A%2F%2A",
            "@multimediatype": "GIF image file",
            "@type": "IMAGE-THUMBNAIL",
            "@size": "4065",
            "@ref": "gr2",
            "@mimetype": "image/gif"
          },
          {
            "@category": "thumbnail",
            "@height": "164",
            "@width": "182",
            "@_fa": "true",
            "$": "https://api.elsevier.com/content/object/eid/1-s2.0-S1381116913004184-gr9.sml?httpAccept=%2A%2F%2A",
            "@multimediatype": "GIF image file",
            "@type": "IMAGE-THUMBNAIL",
            "@size": "12883",
            "@ref": "gr9",
            "@mimetype": "image/gif"
          },
          {
            "@category": "thumbnail",
            "@height": "164",
            "@width": "210",
            "@_fa": "true",
            "$": "https://api.elsevier.com/content/object/eid/1-s2.0-S1381116913004184-gr8.sml?httpAccept=%2A%2F%2A",
            "@multimediatype": "GIF image file",
            "@type": "IMAGE-THUMBNAIL",
            "@size": "15107",
            "@ref": "gr8",
            "@mimetype": "image/gif"
          },
          {
            "@category": "thumbnail",
            "@height": "141",
            "@width": "219",
            "@_fa": "true",
            "$": "https://api.elsevier.com/content/object/eid/1-s2.0-S1381116913004184-gr7.sml?httpAccept=%2A%2F%2A",
            "@multimediatype": "GIF image file",
            "@type": "IMAGE-THUMBNAIL",
            "@size": "5215",
            "@ref": "gr7",
            "@mimetype": "image/gif"
          },
          {
            "@category": "thumbnail",
            "@height": "164",
            "@width": "184",
            "@_fa": "true",
            "$": "https://api.elsevier.com/content/object/eid/1-s2.0-S1381116913004184-gr5.sml?httpAccept=%2A%2F%2A",
            "@multimediatype": "GIF image file",
            "@type": "IMAGE-THUMBNAIL",
            "@size": "12434",
            "@ref": "gr5",
            "@mimetype": "image/gif"
          },
          {
            "@category": "thumbnail",
            "@height": "146",
            "@width": "219",
            "@_fa": "true",
            "$": "https://api.elsevier.com/content/object/eid/1-s2.0-S1381116913004184-gr3.sml?httpAccept=%2A%2F%2A",
            "@multimediatype": "GIF image file",
            "@type": "IMAGE-THUMBNAIL",
            "@size": "3596",
            "@ref": "gr3",
            "@mimetype": "image/gif"
          },
          {
            "@category": "thumbnail",
            "@height": "148",
            "@width": "219",
            "@_fa": "true",
            "$": "https://api.elsevier.com/content/object/eid/1-s2.0-S1381116913004184-gr10.sml?httpAccept=%2A%2F%2A",
            "@multimediatype": "GIF image file",
            "@type": "IMAGE-THUMBNAIL",
            "@size": "16282",
            "@ref": "gr10",
            "@mimetype": "image/gif"
          },
          {
            "@category": "thumbnail",
            "@height": "164",
            "@width": "200",
            "@_fa": "true",
            "$": "https://api.elsevier.com/content/object/eid/1-s2.0-S1381116913004184-gr1.sml?httpAccept=%2A%2F%2A",
            "@multimediatype": "GIF image file",
            "@type": "IMAGE-THUMBNAIL",
            "@size": "11291",
            "@ref": "gr1",
            "@mimetype": "image/gif"
          },
          {
            "@category": "thumbnail",
            "@height": "88",
            "@width": "219",
            "@_fa": "true",
            "$": "https://api.elsevier.com/content/object/eid/1-s2.0-S1381116913004184-fx1.sml?httpAccept=%2A%2F%2A",
            "@multimediatype": "GIF image file",
            "@type": "IMAGE-THUMBNAIL",
            "@size": "3765",
            "@ref": "fx1",
            "@mimetype": "image/gif"
          }
        ]
      },
      "link": {
        "@rel": "abstract",
        "@href": "https://api.elsevier.com/content/abstract/scopus_id/84889035344"
      }
    }
  }
}