{
  "metadata": {
    "title": "Polymerisation with soluble metallocene chiral catalysts: a bridge between inorganic and macromolecular stereochemistry",
    "authors": "; ; ",
    "journal": "Journal of Molecular Catalysis A: Chemical",
    "date": "2003-09-15",
    "doi": "10.1016/S1381-1169(03)00313-3",
    "abstract": "",
    "uri": "https://api.elsevier.com/content/article/pii/S1381116903003133",
    "pii": "S1381116903003133"
  },
  "fulltext": {
    "full-text-retrieval-response": {
      "scopus-eid": "2-s2.0-18544410375",
      "originalText": "serial JL 271358 291210 291744 291790 291809 31 Journal of Molecular Catalysis A: Chemical JOURNALMOLECULARCATALYSISACHEMICAL 2003-06-11 2003-06-11 2010-04-18T22:33:40 1-s2.0-S1381116903003133 S1381-1169(03)00313-3 S1381116903003133 10.1016/S1381-1169(03)00313-3 S300 S300.1 FULL-TEXT 1-s2.0-S1381116900X01744 2015-05-15T05:56:32.920819-04:00 0 0 20030915 2003 2003-06-11T00:00:00Z articleinfo crossmark dco dateupdated tomb dateloaded datesearch indexeddate volumelist yearnav absattachment articletitlenorm authfirstinitialnorm authfirstsurnamenorm cid cids confeditor contenttype copyright dateloadedtxt docsubtype doctype doi eid ewtransactionid hubeid issn issnnorm itemstage itemtransactionid itemweight openaccess openarchive pg pgfirst pglast pii piinorm pubdatestart pubdatetxt pubyr sortorder srctitle srctitlenorm srctype subheadings suppl vol volfirst volissue webpdf webpdfpagecount figure table body acknowledge affil articletitle auth authfirstini authfull authkeywords authlast dedication primabst ref specialabst alllist content subj ssids 1381-1169 13811169 204 205 204 205 C Volumes 204–205 33 315 324 315 324 20030915 15 September 2003 2003-09-15 2003 In honour of Prof. R. Ugo on the occasion of his 65th. Birthday D. Roberto and R. Psaro converted-article fla Copyright © 2003 Elsevier Science B.V. All rights reserved. POLYMERISATIONSOLUBLEMETALLOCENECHIRALCATALYSTSABRIDGEBETWEENINORGANICMACROMOLECULARSTEREOCHEMISTRY DISILVESTRO G 1 Introduction 2 Synthesis of metallocene complexes with chiral ligands and defined symmetry 2.1 Class I 2.2 Class II 2.3 Class III 2.4 Class IV 2.5 Class V 3 Application of classification to fluxional metallocene complexes with chiral substituents 4 Results and discussion 5 Final remarks Acknowledgements References GLADYSZ 2000 1167 J FARINA 1995 353 M FARINA 1969 237 M FARINA 1974 1819 M EWEN 1984 6355 J DISILVESTRO 1985 928 G FARINA 1981 51 M ERKER 1993 4590 G DISILVESTROX2003X315 DISILVESTROX2003X315X324 DISILVESTROX2003X315XG DISILVESTROX2003X315X324XG item S1381-1169(03)00313-3 S1381116903003133 1-s2.0-S1381116903003133 10.1016/S1381-1169(03)00313-3 271358 2010-10-04T20:44:30.809731-04:00 2003-09-15 1-s2.0-S1381116903003133-main.pdf https://s3.amazonaws.com/prod-ucs-content-store-us-east/content/pii:S1381116903003133/MAIN/application/pdf/2bda2f4843111b081263a4e0f6ef22c5/main.pdf https://s3-eu-west-1.amazonaws.com/prod-ucs-content-store-eu-west/content/pii:S1381116903003133/MAIN/application/pdf/2bda2f4843111b081263a4e0f6ef22c5/main.pdf main.pdf pdf true 140485 MAIN 10 1-s2.0-S1381116903003133-main_1.png https://s3-eu-west-1.amazonaws.com/prod-ucs-content-store-eu-west/content/pii:S1381116903003133/PREVIEW/image/png/0ff970b043c85c21b9a25d042b684777/main_1.png https://s3.amazonaws.com/prod-ucs-content-store-us-east/content/pii:S1381116903003133/PREVIEW/image/png/0ff970b043c85c21b9a25d042b684777/main_1.png main_1.png png 57272 849 656 IMAGE-WEB-PDF 1 1-s2.0-S1381116903003133-fx1.sml https://s3.amazonaws.com/prod-ucs-content-store-us-east/content/pii:S1381116903003133/fx1/THUMBNAIL/image/gif/54400bdbabe375660392306ce9c2d80f/fx1.sml https://s3-eu-west-1.amazonaws.com/prod-ucs-content-store-eu-west/content/pii:S1381116903003133/fx1/THUMBNAIL/image/gif/54400bdbabe375660392306ce9c2d80f/fx1.sml fx1 true fx1.sml sml 1913 91 125 IMAGE-THUMBNAIL 1-s2.0-S1381116903003133-fx1.gif https://s3.amazonaws.com/prod-ucs-content-store-us-east/content/pii:S1381116903003133/fx1/DOWNSAMPLED/image/gif/348d8536b7e92722a469437c8ab33edd/fx1.gif https://s3-eu-west-1.amazonaws.com/prod-ucs-content-store-eu-west/content/pii:S1381116903003133/fx1/DOWNSAMPLED/image/gif/348d8536b7e92722a469437c8ab33edd/fx1.gif fx1 true fx1.gif gif 4307 164 225 IMAGE-DOWNSAMPLED 1-s2.0-S1381116903003133-gr1.sml https://s3.amazonaws.com/prod-ucs-content-store-us-east/content/pii:S1381116903003133/gr1/THUMBNAIL/image/gif/381a7336124d87a30f7bb83ce92ee026/gr1.sml https://s3-eu-west-1.amazonaws.com/prod-ucs-content-store-eu-west/content/pii:S1381116903003133/gr1/THUMBNAIL/image/gif/381a7336124d87a30f7bb83ce92ee026/gr1.sml gr1 gr1.sml sml 1165 93 122 IMAGE-THUMBNAIL 1-s2.0-S1381116903003133-gr1.gif https://s3.amazonaws.com/prod-ucs-content-store-us-east/content/pii:S1381116903003133/gr1/DOWNSAMPLED/image/gif/f4891939d2ae3c2af0d88f1c53b9e0a5/gr1.gif https://s3-eu-west-1.amazonaws.com/prod-ucs-content-store-eu-west/content/pii:S1381116903003133/gr1/DOWNSAMPLED/image/gif/f4891939d2ae3c2af0d88f1c53b9e0a5/gr1.gif gr1 gr1.gif gif 4059 238 312 IMAGE-DOWNSAMPLED 1-s2.0-S1381116903003133-fx2.sml https://s3.amazonaws.com/prod-ucs-content-store-us-east/content/pii:S1381116903003133/fx2/THUMBNAIL/image/gif/12dd7e0e98f0f2617658440b3749a5e7/fx2.sml https://s3-eu-west-1.amazonaws.com/prod-ucs-content-store-eu-west/content/pii:S1381116903003133/fx2/THUMBNAIL/image/gif/12dd7e0e98f0f2617658440b3749a5e7/fx2.sml fx2 fx2.sml sml 888 68 125 IMAGE-THUMBNAIL 1-s2.0-S1381116903003133-fx2.gif https://s3.amazonaws.com/prod-ucs-content-store-us-east/content/pii:S1381116903003133/fx2/DOWNSAMPLED/image/gif/4960e38d4699f703a3d41164aff07081/fx2.gif https://s3-eu-west-1.amazonaws.com/prod-ucs-content-store-eu-west/content/pii:S1381116903003133/fx2/DOWNSAMPLED/image/gif/4960e38d4699f703a3d41164aff07081/fx2.gif fx2 fx2.gif gif 1927 132 243 IMAGE-DOWNSAMPLED 1-s2.0-S1381116903003133-gr2.sml https://s3.amazonaws.com/prod-ucs-content-store-us-east/content/pii:S1381116903003133/gr2/THUMBNAIL/image/gif/91aad7b3bdf2423ff617e0a36ece62dc/gr2.sml https://s3-eu-west-1.amazonaws.com/prod-ucs-content-store-eu-west/content/pii:S1381116903003133/gr2/THUMBNAIL/image/gif/91aad7b3bdf2423ff617e0a36ece62dc/gr2.sml gr2 gr2.sml sml 1452 79 125 IMAGE-THUMBNAIL 1-s2.0-S1381116903003133-gr2.gif https://s3.amazonaws.com/prod-ucs-content-store-us-east/content/pii:S1381116903003133/gr2/DOWNSAMPLED/image/gif/3801adf734a5f6641f34cce27ea8bf56/gr2.gif https://s3-eu-west-1.amazonaws.com/prod-ucs-content-store-eu-west/content/pii:S1381116903003133/gr2/DOWNSAMPLED/image/gif/3801adf734a5f6641f34cce27ea8bf56/gr2.gif gr2 gr2.gif gif 6728 213 339 IMAGE-DOWNSAMPLED 1-s2.0-S1381116903003133-gr3.sml https://s3.amazonaws.com/prod-ucs-content-store-us-east/content/pii:S1381116903003133/gr3/THUMBNAIL/image/gif/285b689c3f1f1386c1711ad70ef6af85/gr3.sml https://s3-eu-west-1.amazonaws.com/prod-ucs-content-store-eu-west/content/pii:S1381116903003133/gr3/THUMBNAIL/image/gif/285b689c3f1f1386c1711ad70ef6af85/gr3.sml gr3 gr3.sml sml 492 37 125 IMAGE-THUMBNAIL 1-s2.0-S1381116903003133-gr3.gif https://s3.amazonaws.com/prod-ucs-content-store-us-east/content/pii:S1381116903003133/gr3/DOWNSAMPLED/image/gif/09281c49e3a7204045b45e3b0dc6e342/gr3.gif https://s3-eu-west-1.amazonaws.com/prod-ucs-content-store-eu-west/content/pii:S1381116903003133/gr3/DOWNSAMPLED/image/gif/09281c49e3a7204045b45e3b0dc6e342/gr3.gif gr3 gr3.gif gif 863 69 232 IMAGE-DOWNSAMPLED 1-s2.0-S1381116903003133-fx3.sml https://s3.amazonaws.com/prod-ucs-content-store-us-east/content/pii:S1381116903003133/fx3/THUMBNAIL/image/gif/74c7ee3ccd24264e952f87ceef41d5d0/fx3.sml https://s3-eu-west-1.amazonaws.com/prod-ucs-content-store-eu-west/content/pii:S1381116903003133/fx3/THUMBNAIL/image/gif/74c7ee3ccd24264e952f87ceef41d5d0/fx3.sml fx3 fx3.sml sml 615 46 125 IMAGE-THUMBNAIL 1-s2.0-S1381116903003133-fx3.gif https://s3.amazonaws.com/prod-ucs-content-store-us-east/content/pii:S1381116903003133/fx3/DOWNSAMPLED/image/gif/8b3c1d8b45520a42e598a479e95aa5c3/fx3.gif https://s3-eu-west-1.amazonaws.com/prod-ucs-content-store-eu-west/content/pii:S1381116903003133/fx3/DOWNSAMPLED/image/gif/8b3c1d8b45520a42e598a479e95aa5c3/fx3.gif fx3 fx3.gif gif 977 73 197 IMAGE-DOWNSAMPLED 1-s2.0-S1381116903003133-fx4.sml https://s3.amazonaws.com/prod-ucs-content-store-us-east/content/pii:S1381116903003133/fx4/THUMBNAIL/image/gif/9fd8beeb10abe463b5529b01e570f8cb/fx4.sml https://s3-eu-west-1.amazonaws.com/prod-ucs-content-store-eu-west/content/pii:S1381116903003133/fx4/THUMBNAIL/image/gif/9fd8beeb10abe463b5529b01e570f8cb/fx4.sml fx4 fx4.sml sml 539 28 125 IMAGE-THUMBNAIL 1-s2.0-S1381116903003133-fx4.gif https://s3.amazonaws.com/prod-ucs-content-store-us-east/content/pii:S1381116903003133/fx4/DOWNSAMPLED/image/gif/890b600cfb9a39653e4cbda6fc7284df/fx4.gif https://s3-eu-west-1.amazonaws.com/prod-ucs-content-store-eu-west/content/pii:S1381116903003133/fx4/DOWNSAMPLED/image/gif/890b600cfb9a39653e4cbda6fc7284df/fx4.gif fx4 fx4.gif gif 561 36 160 IMAGE-DOWNSAMPLED 1-s2.0-S1381116903003133-fx5.sml https://s3.amazonaws.com/prod-ucs-content-store-us-east/content/pii:S1381116903003133/fx5/THUMBNAIL/image/gif/78928ff407da6761c41089c04e831b85/fx5.sml https://s3-eu-west-1.amazonaws.com/prod-ucs-content-store-eu-west/content/pii:S1381116903003133/fx5/THUMBNAIL/image/gif/78928ff407da6761c41089c04e831b85/fx5.sml fx5 fx5.sml sml 553 32 125 IMAGE-THUMBNAIL 1-s2.0-S1381116903003133-fx5.gif https://s3.amazonaws.com/prod-ucs-content-store-us-east/content/pii:S1381116903003133/fx5/DOWNSAMPLED/image/gif/392c5863c15be4a1c869fdf63a7b58b1/fx5.gif https://s3-eu-west-1.amazonaws.com/prod-ucs-content-store-eu-west/content/pii:S1381116903003133/fx5/DOWNSAMPLED/image/gif/392c5863c15be4a1c869fdf63a7b58b1/fx5.gif fx5 fx5.gif gif 1856 105 414 IMAGE-DOWNSAMPLED 1-s2.0-S1381116903003133-fx6.sml https://s3.amazonaws.com/prod-ucs-content-store-us-east/content/pii:S1381116903003133/fx6/THUMBNAIL/image/gif/f7fc8dd57794a1f5deda4547823b64f5/fx6.sml https://s3-eu-west-1.amazonaws.com/prod-ucs-content-store-eu-west/content/pii:S1381116903003133/fx6/THUMBNAIL/image/gif/f7fc8dd57794a1f5deda4547823b64f5/fx6.sml fx6 fx6.sml sml 621 40 125 IMAGE-THUMBNAIL 1-s2.0-S1381116903003133-fx6.gif https://s3.amazonaws.com/prod-ucs-content-store-us-east/content/pii:S1381116903003133/fx6/DOWNSAMPLED/image/gif/87ce1dd69d57fe35d69c2c4404892bdc/fx6.gif https://s3-eu-west-1.amazonaws.com/prod-ucs-content-store-eu-west/content/pii:S1381116903003133/fx6/DOWNSAMPLED/image/gif/87ce1dd69d57fe35d69c2c4404892bdc/fx6.gif fx6 fx6.gif gif 2134 137 426 IMAGE-DOWNSAMPLED 1-s2.0-S1381116903003133-fx7.sml https://s3.amazonaws.com/prod-ucs-content-store-us-east/content/pii:S1381116903003133/fx7/THUMBNAIL/image/gif/24a01f95f650c516015281467efb3f2f/fx7.sml https://s3-eu-west-1.amazonaws.com/prod-ucs-content-store-eu-west/content/pii:S1381116903003133/fx7/THUMBNAIL/image/gif/24a01f95f650c516015281467efb3f2f/fx7.sml fx7 fx7.sml sml 518 30 125 IMAGE-THUMBNAIL 1-s2.0-S1381116903003133-fx7.gif https://s3.amazonaws.com/prod-ucs-content-store-us-east/content/pii:S1381116903003133/fx7/DOWNSAMPLED/image/gif/df300571b2bd4168927198d2a54af151/fx7.gif https://s3-eu-west-1.amazonaws.com/prod-ucs-content-store-eu-west/content/pii:S1381116903003133/fx7/DOWNSAMPLED/image/gif/df300571b2bd4168927198d2a54af151/fx7.gif fx7 fx7.gif gif 1724 107 441 IMAGE-DOWNSAMPLED 1-s2.0-S1381116903003133-gr4.sml https://s3.amazonaws.com/prod-ucs-content-store-us-east/content/pii:S1381116903003133/gr4/THUMBNAIL/image/gif/8aa650a7d0702d2045eee796e5b2a05c/gr4.sml https://s3-eu-west-1.amazonaws.com/prod-ucs-content-store-eu-west/content/pii:S1381116903003133/gr4/THUMBNAIL/image/gif/8aa650a7d0702d2045eee796e5b2a05c/gr4.sml gr4 gr4.sml sml 1445 93 117 IMAGE-THUMBNAIL 1-s2.0-S1381116903003133-gr4.gif https://s3.amazonaws.com/prod-ucs-content-store-us-east/content/pii:S1381116903003133/gr4/DOWNSAMPLED/image/gif/92ea9cbec51984fac3df4e106cb1923f/gr4.gif https://s3-eu-west-1.amazonaws.com/prod-ucs-content-store-eu-west/content/pii:S1381116903003133/gr4/DOWNSAMPLED/image/gif/92ea9cbec51984fac3df4e106cb1923f/gr4.gif gr4 gr4.gif gif 10181 390 489 IMAGE-DOWNSAMPLED 1-s2.0-S1381116903003133-gr5.sml https://s3.amazonaws.com/prod-ucs-content-store-us-east/content/pii:S1381116903003133/gr5/THUMBNAIL/image/gif/28dc4d3409adc8b354b4ca9ff5bbe480/gr5.sml https://s3-eu-west-1.amazonaws.com/prod-ucs-content-store-eu-west/content/pii:S1381116903003133/gr5/THUMBNAIL/image/gif/28dc4d3409adc8b354b4ca9ff5bbe480/gr5.sml gr5 gr5.sml sml 1125 78 125 IMAGE-THUMBNAIL 1-s2.0-S1381116903003133-gr5.gif https://s3.amazonaws.com/prod-ucs-content-store-us-east/content/pii:S1381116903003133/gr5/DOWNSAMPLED/image/gif/3cd8ce32bb18e5e6844c8759a6f972f1/gr5.gif https://s3-eu-west-1.amazonaws.com/prod-ucs-content-store-eu-west/content/pii:S1381116903003133/gr5/DOWNSAMPLED/image/gif/3cd8ce32bb18e5e6844c8759a6f972f1/gr5.gif gr5 gr5.gif gif 7533 302 481 IMAGE-DOWNSAMPLED 1-s2.0-S1381116903003133-gr6.sml https://s3.amazonaws.com/prod-ucs-content-store-us-east/content/pii:S1381116903003133/gr6/THUMBNAIL/image/gif/3a8a44dd56b87bd9deb39ef693428b91/gr6.sml https://s3-eu-west-1.amazonaws.com/prod-ucs-content-store-eu-west/content/pii:S1381116903003133/gr6/THUMBNAIL/image/gif/3a8a44dd56b87bd9deb39ef693428b91/gr6.sml gr6 gr6.sml sml 1831 89 125 IMAGE-THUMBNAIL 1-s2.0-S1381116903003133-gr6.gif https://s3.amazonaws.com/prod-ucs-content-store-us-east/content/pii:S1381116903003133/gr6/DOWNSAMPLED/image/gif/43ce311c33bf2667390d104b7852ed3a/gr6.gif https://s3-eu-west-1.amazonaws.com/prod-ucs-content-store-eu-west/content/pii:S1381116903003133/gr6/DOWNSAMPLED/image/gif/43ce311c33bf2667390d104b7852ed3a/gr6.gif gr6 gr6.gif gif 19772 485 681 IMAGE-DOWNSAMPLED MOLCAA 4101 S1381-1169(03)00313-3 10.1016/S1381-1169(03)00313-3 Elsevier Science B.V. Fig. 1 Cossee scheme valid for the Ziegler–Natta polymerisation with soluble metallocene catalysts. Successive steps of chain growth are represented by A–F. The equilibrium A⇔D results in a skipped insertion. Fig. 2 Symmetry elements of the five classes of metallocene catalysts. Fig. 3 Examples of pentad representation as m (meso) and r (racemic) successions. Fig. 4 NMR spectrum of sample number 3 in Table 3. Fig. 5 Dynamo-mechanic curves of polypropene obtained with catalyst I at −30°C in pure monomer (sample 3 in Table 3). Fig. 6 Dynamo-mechanic curves of polypropene obtained with catalyst I at −30°C in pure monomer (sample 3 in Table 3). Table 1 Symmetry relations in achiral rigid metallocene catalysts Catalyst I II III IV V Symmetry of the L2MtX2 complex C2v Cs C2 Cs C1 Chirotopicity of atoms X in L2MtX2 No No Yes Yes Yes Relationship between atoms X in L2MtX2 Equal Different Homotopic Enantiotopic Diastereotopic Chirotopicity of atom Mt in (L2MtMP)+ No No Yes Yes Yes Stereogenicity of atom Mt in (L2MtMP)+ No Yes No Yes Yes Polymer structure predicted for catalyst control and alternating mechanism Atactic Atactic Isotactic Syndiotactic Not determined Table 2 Experimental conditions used with catalyst Item Temperature (°C) Solvent (g) Monomer (g) Polymerisation time (h) Catalyst (mg) 1 −50 Toluene (105) 41.5 6 14 2 −50 CH2Cl2 (151) 32 5 25.3 3 −30 – Neat (81) 3 14.9 4 −30 Toluene (105) 35.9 3 12 5 −30 CH2Cl2 (151) 32 5 34 6 −5 Toluene Ref. 13 – – Table 3 Pentad concentration of polypropenes obtained with catalyst I Item mmmm mmmr rmmr mmrr xmrx rmrm rrrr mrrr mrrm 1 27.90 16.11 5.01 15.20 13.44 4.41 3.69 7.54 4.69 2 39.08 16.26 3.03 14.28 9.83 4.56 2.48 4.70 5.78 3 26.80 17.12 3.74 4.90 14.91 6.72 3.38 7.02 6.14 4 26.10 15.90 5.27 14.90 14.29 7.09 4.04 7.10 5.30 5 45.18 16.31 1.99 13.09 9.59 3.98 1.00 3.80 5.07 6 33 17 4 13 17 6 1 7 3 Table 4 Experimental conditions used in the synthesis with catalyst II Item Temperature (°C) Solvent (ml) Monomer (g or Pa* 10−5) Polymerisation time (h) Catalyst (mg) 1 −50 Toluene (125) 34 4 41.7 2 −50 CH2Cl2 (155) 31.5 5 30.3 3 −30 – Neat (92) 3 55.7 4 −30 Toluene (125) 34 4 31.6 5 −30 CH2Cl2 (152) 31.6 5 33.7 6 −5 Toluene Ref. 13 – – 7 20 Toluene (100) 1.01 2 30 8 20 Toluene (100) 3.04 2 34 9 20 Toluene (135) 6.08 2 37.8 Table 5 Pentad concentration of polypropene obtained with catalyst II Item mmmm mmmr rmmr mmrr xmrx rmrm rrrr mrrr mrrm 1 85.80 6.46 0.00 5.52 0.00 0.00 0.00 0.00 2.21 2 77.87 8.58 0.12 7.11 2.25 0.37 0.21 0.42 3.07 3 60.38 14.19 1.00 11.82 4.42 2.00 0.00 1.01 5.17 4 75.26 10.04 1.11 6.48 3.07 1.35 0.00 0.00 2.69 5 65.88 10.21 2.57 9.20 4.98 2.88 0.43 0.94 2.91 6 77 10 0 7 3 0 0 0 2 7 63.22 15.41 0.34 13.00 2.53 1.02 0.00 0.00 5.48 8 55.74 15.06 1.28 11.86 6.13 2.38 0.52 0.92 6.07 9 53.48 14.54 2.81 13.03 6.03 3.16 0.40 11.43 5.11 Polymerisation with soluble metallocene chiral catalysts: a bridge between inorganic and macromolecular stereochemistry Dedicated to Professor Renato Ugo on the occasion of his 65th birthday. Giuseppe Di Silvestro a ∗ Alessandro Galbiati a Yuan Cui Ming a Nicola Caronzolo a Edoardo Cesarotti b a Università di Milano, Dipartimento di Chimica Organica e Industriale, via Venezian 21, I-20133 Milano, Italy b Università di Milano, Dipartimento di Chimica Inorganica, Metallorganica ed Analitica, via Venezian 21, I-20133 Milano, Italy * Corresponding author. Tel.: +39-02-50314130; fax: +39-02-50314133. Criteria for an approach to the synthesis of metallocene complexes with chiral substituents and possessing proper symmetry are presented. Stereochemical results of propene polymerisation using two fluxional catalysts, different solvents and temperatures, are interpreted. Elastomeric polypropene is obtained with one catalyst. Syndiotactic polypropene was obtained with a rigid catalyst diphenylmethyl(cyclopentadienyl)(1-neomenthylindenyl)ZrCl2. General criteria for a rational approach to the synthesis of metallocene complexes with chiral substituents and possessing a proper symmetry are presented. The symmetry of the complex is defined according to Farina’s classification based on the local chirality of the catalytic site (the chirotopicity). Stereochemical results of propene polymerisation performed in the presence of bis(1-neomenthylindenyl)ZrCl2 (I) and bis(1-neoisomenthylindenyl)ZrCl2 (II) in different solvents and different temperatures are interpreted accordingly. Methylalumoxane (MAO) was used as activator. Elastomeric polypropene is obtained with catalyst I. A syndiotactic polypropene was obtained with the new rigid catalyst diphenylmethy(cyclopentadienyl)(1-neomenthylindenyl)ZrCl2 (III). Keywords Polymerisation Metallocene complexes Catalysis 1 Introduction The advent of Ziegler–Natta polymerisation made necessary a relationship between organic stereochemistry and the area of stereoregular polymers, the metallic component of the insoluble catalyst being only in part reactive. Farina’s idea that a cyclic model can be used for a rational description of stereoregular polymers represented, at that time, a bridge between organic and macromolecular stereochemistry; as an example, the cis- and trans-1,3-dimethylcyclobutane are, respectively, the model of isotactic and syndiotactic polypropene and can also be used for a first level study of polypropene NMR spectra. In soluble metallocene catalysts, all the metal atoms are centres for the chain growth. The stereocontrol is exerted by each metal atom and can be modulated by a proper structure of the ligand. Therefore, a better control of the macromolecular structure is obtained [1,2]. In order to rationalise the stereochemical results of propene polymerisation in the presence of rigid ansa metallocene complexes, Farina and Di Silvestro proposed a classification according to the symmetry relationships existing between the two catalytic sites [3]. This idea comes observing that if symmetry exists between catalytic sites, the same relationship must be present between the energy levels accessible in the chain growth determining step and, as a consequence, in the microstructure of resulting polymer [4]. From a different point of view, the same idea is present in the conformational model presented by Corradini et al. [5]. When fluxional catalysts are used, classification must be applied to their instantaneous conformations [3]. The description of the chain growth process according to a chemical or stereochemical scheme is a common procedure in macromolecular science [6]; in the case of stereospecific polymerisation, the model proposed must be able to predict the microstructure of the resulting polymer. Farina and Di Silvestro [3] proposed a model for propene polymerisation in the presence of rigid metallocene soluble catalysts based on a stereochemical analysis of the catalyst used and according to the Cossee scheme (Fig. 1 ) [7]. A more detailed description was discussed in a recent review [7]. Out of clarity, we report here only the general criteria used for the stereochemical analysis of metallocene complexes. The general formula L2MtX2 can be used, where Mt is a 4th group transition metal (Ti, Zr, Hf), L2 represents a bidentate or two monodentate cyclopentadienyl ligands (η5 (or η3) bonded to the metal) and X represents halogen atoms or organic groups like methyl or phenyl. The two ligands may have either the same or different structures or they can constitute the two moieties of the bidentate ligand. The substitutions in the part of the catalyst outside the reactive catalytic sites are considered unimportant for the stereochemical classification due to the distance from the reactive centre. The activation reaction of the complex with methylalumoxane (MAO) or other electrophile reagents in the presence of the monomer produces the cationic species represented as (L2MtMP)+, where the monomer (M) is η2 co-ordinated to the metal atom and the growing chain end (P) is σ-bonded. During the polymerisation, the original position of the halogen (X) represents each of the two polymerisation sites of the catalyst. If we assume a tetrahedral coordination for the metal atom in the original complex and in the active centre, the corresponding Fisher projections (Formulas 1 and 2) can be drawn. According to Farina’s analysis, catalysts can be divided in five classes (and no more than five). This number was obtained by considering all the possible chirotopicities (the local chiralities) of the catalytic sites X. If they are not chirotopic (e.g. they are bisected by a mirror plane) the two sites are equal or different. If, on the contrary, they are chirotopic, three possible chirotopicities exist: the two catalytic sites are homotopic (equal), enantiotopic (mirror image of each other) or diastereotopic (different). The symmetry relationships between the X atoms and the local symmetry of the metal atom can be deduced from the actual structure of the catalyst or from the naive representation given in Fig. 2 where the shaded areas represent the shape requirement of the ligand respect to the L1–Mt–L2 plane. The five symmetry classes for all stereorigid catalysts and the corresponding symmetry relationships are reported in Table 1 . The last line of the table shows the expected tacticity of the polymer according to the Cossee scheme and under the hypothesis that the stereocontrol is due only to the catalytic site and not to the chain-end chirality [3]. In the first two classes the X atoms are achirotopic: in class I, they are related by two orthogonal symmetry planes and the two sites are identical. In class II, the X atoms lie on the plane of symmetry and the two sites are different. The difference between classes I and II can be better understood if we use the asymmetric submolecular unit concept [9]: in class I, the X groups occupy a generic position and are related by a symmetry operation while in class II they are in a special position since they lie on the symmetry operator. No stereocontrol is predicted for the polymerisation process and atactic polymers are expected and obtained. In classes III, IV and V the two sites are chirotopic: in class III, a two-fold rotation axis relates the two sites so that they are homotopic. In class IV, the two X atoms occupy the two specular positions respect to the vertical mirror plane of symmetry so that they are enantiotopic. In class V, no elements of symmetry exist, the two sites are diastereotopic. As reported in Table 1, stereoregular polymers are obtained only in the presence of chirotopicity in the X atoms. Two important observations derive from the comparison of cyclic models for stereoregular polymers and of the relationships between X atoms in metallocene complexes. Polymer microstructure does not reproduce the local chirality of each site, as in an equivalent organic reaction, but reproduces relationships between the two sites. As a matter of fact, the same isotactic and achiral polypropene is obtained by using one or both enantiomers of the racemic mixture of a class III complex. In the catalyst, in the isotactic polymer and in its cyclic model the two methyls are in a homotopic relationship. The same principle holds for the syndiotactic polymer. The local chirality inverts in the two adjacent tertiary atoms of the polymer as well as in the complex: chirotopicities of the two sites are in an enantiotopic situation like those of methyls in the trans-dimethylcyclobutane. To clear up the concept, we can observe the Cossee scheme (Fig. 1). If we start from A, we see that the growing chain experiences the local chirality of the two sites during insertion processes (C and F) by moving through B–F. We also note that the equilibrium between A and D points is equivalent to an epimerisation of the catalyst and a skipped insertion in the chain growth results [10]. Using the concept that the macromolecular chain is a static representation of relationships between successive reaction acts is very common in macromolecular science and, for example, NMR spectra interpretation is based on it. As a further example, in propene polymerisation, 13C NMR spectra are interpreted at pentad level as a succession of five reaction steps represented as a succession of four relationships (m or r symbols) (Fig. 3 ); however heptads, nonads, undecads and some tridecads were recognised in the methyl portion of 13C NMR spectrum of a polypropene [11]. The most used kinetic or statistic models of stereochemical chain growth use pentad concentration as experimental data. Also the γ-ray induced radical polymerisation of diene monomers included in the crystalline adducts of perhydrotriphenylene (PHTP) can be interpreted by using the same concept. In this case, the stereochemical control is exerted at each reaction step and the channel looks like a mono-dimensional space possessing an elicoidal symmetry where all reaction points are homotopic. Pure 1,4-trans-isotactic polypentadiene is obtained by inclusion polymerisation in PHTP adducts and it reflects the homotopicity of all points of the elicoidal symmetry of the channel [12]. In a different field, also the duplication process of DNA can be interpreted in the same way as a succession of base sequences. In this paper, we present a rational approach to the synthesis of metallocene catalysts containing chiral substituents and possessing a defined symmetry together with some polymerisation results using catalysts like the one synthesised by Erker [13]. Some aspects of this work were reported in a recent review [8]. 2 Synthesis of metallocene complexes with chiral ligands and defined symmetry When ligands with chiral groups are used, the catalytic sites of the complex can be either represented with their Fisher projection or as a plane with four sectors (A–D). The axes of this last representation are centred on the metal atom and are perpendicular to each other. In this case, the symmetry relationships between the sectors determine the class of symmetry of the catalyst. Using the sector representation, the symmetries of catalysts having 1–4 substituents R (where (+) and (−) will represent the absolute configuration of stereocentres) will be presented. As explained before and from literature experimental data, only symmetrically substituted catalysts posses C1 symmetry (class V according to Farina’s classification) and it is impossible to predict the final stereochemistry of the polymer. The stereochemical analysis presented here can be used for the synthesis of 3,4-cyclopentadienyl, indenyl or 5,6-fluorenyl derivatives. It is evident that non symmetric substitution produces only C1 symmetry molecules (class V). The classification is more general and can be applied to other kinds of molecular structures; the possible ways to obtain catalysts with chiral ligands and the same group chirality reported in scheme 2 for achiral ligand will be now discussed. In the further discussion, we present the possible ways to obtain the catalyst with chiral ligands with the same group of symmetry as reported in scheme 2 for the correct achiral ligands. 2.1 Class I Catalysts with this symmetry (C2v) can be obtained by introducing four equal substituents. In A and C sectors, R must have the same configuration; the same holds true for B and D, but R configurations are opposite to A and C, respectively. Only two structures possessing the high symmetry of this class are possible: Different substitutions generate products with lower symmetry. Three structures of class II, three structures of class III, three structures of class IV and 15 structures of class V can be obtained. No stereocontrol can be expected in the presence of this kind of catalysts. 2.2 Class II In this case either two or four substituents can be used: with opposite configuration in the A and D sectors and/or with opposite configuration in B and C sectors. The eight possible structures with Cs symmetry are depicted: Also in this case, different substitutions produce 36 structures all belonging to class V and no stereocontrol can be predicted in the presence of class II catalysts. 2.3 Class III Either two or four equal substituents can be used: configurations in A and C sectors are the same and/or configurations in B and D sectors are equals. This kind of catalysts is used in the synthesys of isotactic polymers. In this case, eight chiral structures with C2 symmetry are possible. Only one enantiomer for each structure is shown: Different substitutions generate 36 structures belonging to class V. 2.4 Class IV Syndiotactic polymers are expected in propene polymerisation with class IV catalysts. In the case of achiral ligands, class IV catalysts represented an excellent test for the validity of the alternating scheme of the chain growth process. The control related to the catalyst’s chirotopicity and to the chain end was easily recognised and measured. The eight possible structures with Cs symmetry belonging to this class are reported in the figure. Different substitutions give 36 structures of class V symmetry. 2.5 Class V No symmetry operators are present in this case. As shown in the previous discussion, catalysts belonging to this class are very common and no prediction on the stereocontrol of the resulting polymer can be done. The symmetry of this class cannot be modified by different substitutions. 3 Application of classification to fluxional metallocene complexes with chiral substituents In the previous paragraph, we analysed the case of chiral substituents connected to a rigid framework. When chiral substituents are used in the synthesis of fluxional metallocene catalysts, the previous classification must be applied to each instantaneous conformation. The final polymer microstructure will reflect the effect of the stereocontrol of each conformer and of its lifetime. The propagation rate of each conformer can be different and, under the hypothesis of a living polymerisation, a multiblock structure can be expected. It is worth to note that the multiblock structure of the polymer is not related to the chiral nature of the substituents but only to the presence, in the catalyst, of different reactive conformers; achiral substituents can give the same result. 4 Results and discussion Polymerisations were carried out in different solvents and temperatures, in the presence of bis(1-neomenthylindenyl)ZrCl2 (I), bis(1-neoisomenthylindenyl)ZrCl2 (II) and diphenylmethy(cyclopentadienyl)(1-neomenthylindenyl)ZrCl2 (III) activated by MAO; a Al/Zr ratio equal to 2000 was used. Catalyst III was used in toluene at room temperature. Crystal structures, solution behaviour and some polymerisation data were published by Erker [13]. Catalyst I at room temperature is present as a single species possessing C2 symmetry as a result of free rotation of different conformers. At lower temperature three different conformers are present; at least one of these possesses a C1 symmetry. Catalyst II presents C1 symmetry in the crystal; in solution its symmetry is different and is due to a rapid disrotatory movements of the ligands. A C2 symmetry was thus observed in the temperature range 190–300K. Catalyst III is a new rigid ansa metallocene complex. One example of 13C NMR spectrum of polypropene is reported in Fig. 4 . The figure shows the methyl portion of the original spectrum and refers to the polymer obtained at −30°C in liquid monomer in the presence of the catalyst I. Tables 2, 4 and 3, 5 report experimental conditions and pentad concentrations as measured in 13C NMR spectra run at 105°C in CD2Cl2. Standard procedure for quantitative 13C NMR spectra were used. The pentad concentrations reported in the tables show the lowest error respect to the stoichiometric relationships according to the procedure used in the review [7]. Literature data show a higher error (item 6 in Table 3). By using pentad concentration, the probability parameters of the stereocontrol process during the chain growth can be estimated according to Farina’s model. This model applied to a class V complex in the presence of stereocontrol due to the catalyst and to chain end and needs for eight independent probability parameters if the skipped insertion is also present [3]. The number of probability parameters is lower for complexes with higher symmetry. In the present case, an independent set of probability parameters should be used for each conformer; it is evident that the pentad data alone cannot support an estimation of such a high number of independent parameters. In these cases, simpler microstructure parameters can be evaluated; we will use one the average length of stereoregular block (the isotactic block) and will relate it to the melting temperature of the polymers. As a general feature, polymers synthesised with the catalyst II are more isotactic (see the mmmm value) because of the presence, in solution, of conformers possessing C2 symmetry. The effect of the presence of conformers with C1 symmetry is higher in the catalyst I. The length of isotactic block (N iso), is equal to 34 in the polymer with mmmm=0.8577. In the corresponding polymer obtained with catalyst I, the N iso value is 3.8. The higher length of the isotactic block is confirmed by DSC experiment (T melting=130°C and a ΔH=75J/g). No melting peak is observed in the more irregular polymer and its glass transition temperature is very near to the one observed in an atactic polypropene. The N iso value is affected also by the solvent and the polymerisation temperature. The more polar solvent reduces the N iso value to 18.8 units when catalyst I is used in equivalent polymerisation conditions. A deeper analysis of NMR data shows the effect of the symmetry of the catalyst and of polymerisation conditions but this kind of analysis is out of the scope of this paper. We prefer, here, to discuss two examples of the use of symmetry criteria in propene polymerisation with metallocene complexes. As reported in Table 1, when the two catalytic sites are diastereotopics no prediction can be made and the polymer microstructure is determined by the shape demanding property of each catalytic site in polymerisation conditions. In the presence of class V catalysts isotactic, hemiisotactic or, in the present case, syndiotactic polypropenes are obtained. According to the Cossee scheme, isotactic polymer is obtained if the catalyst possesses a very bulky substituent; in this case only one catalytic site works while the second site gives the skipped insertion. The hemiisotactic polymer was obtained in the presence of a small substituent and, as a consequence, one catalytic site gives a complete stereocontrol while the second site allows the insertion but without stereocontrol. In the present case, an apparent plane of symmetry works in the activation energies of the two sites and the neomenthylindenyl portion of the catalyst is equivalent to the more symmetric fluorenyl group. Figs. 5, 6 present the residual strain and dynamo-mechanic curves of polypropene obtained with catalyst I at −30°C in pure monomer. Polymer behaves as an elastomeric material because of the presence of microcrystalline phase. This behaviour cannot be predicted from the 13C NMR spectrum; as a matter of fact, in the spectrum we see only the average microstructure. In this case, the propagation rate/life-time ratio of conformers with C2 symmetry generates micro-isotactic blocks while the C1 symmetric conformer produces the atactic portion of the macromolecular chain; the elastomeric behaviour is due to the balance between the ordered and disordered segments. 5 Final remarks We have discussed the classification of soluble metallocene complexes possessing chiral substituents. This classification allows a rational approach to the synthesis of rigid catalysts with well defined symmetry and a correct use of the effect of symmetry on the differences between the activation energies of chain growth steps both in rigid and in fluxional complexes. Acknowledgements The theoretical part of this work is the last contribution of Professor Mario Farina to the macromolecular stereochemistry; unfortunately Prof. Farina cannot see any experimental application. Authors are indebted to him. Many thanks to doctor Alberto Terragni who was the tutor of one of the authors. References [1] J. Scheirs, W. Kaminsky (Eds.), AA.V.V., Mechanistic Aspects of Metallocene Catalysis, Part I, Wiley, Chichester, 2000. [2] J.A. Gladysz Chem. Rev. 100 4 2000 1167 [3] M. Farina G. Di Silvestro A. Terragni Macromol. Chem. Phys. 196 1995 353 [4] M. Farina Makromolekulare Chemie 122 1969 237 [5] P. Corradini, L. Cavallo, G. Guerra, Metallocene-Based Polyolefines, vol. II, Wiley, New York, p. 3. [6] J.A. Ewen, M.J. Elder, R.L. Jones, S. Curtis, H.N. Cheng, in: T. Keii, K. Soga (Eds.), Catalytic Olefin Polymerization, Elsevier, New York, 1980, p. 439. [7] P. Cossee, in: A.D. Ketley (Ed.), Stereochemistry of Macromolecules, vol. 1, Dekker, New York, 1967 (Chapter 3). [8] G. Di Silvestro, Metallocene-Based Polyolefines, vol. II, Wiley, New York, p. 37. [9] M. Farina C. Morandi Tetrahedron 30 1974 1819 [10] J.A. Ewen J. Am. Chem. Soc. 106 1984 6355 [11] G. Di Silvestro P. Sozzani B. Savarè M. Farina Macromolecules 18 1985 928 [12] M. Farina G. Di Silvestro P. Sozzani Macromol. Chem. Rapid Commun. 2 1981 51 [13] G. Erker J. Am. Chem. Soc. 115 1993 4590",
      "scopus-id": "18544410375",
      "coredata": {
        "eid": "1-s2.0-S1381116903003133",
        "dc:description": "General criteria for a rational approach to the synthesis of metallocene complexes with chiral substituents and possessing a proper symmetry are presented. The symmetry of the complex is defined according to Farina’s classification based on the local chirality of the catalytic site (the chirotopicity). Stereochemical results of propene polymerisation performed in the presence of bis(1-neomenthylindenyl)ZrCl2 (I) and bis(1-neoisomenthylindenyl)ZrCl2 (II) in different solvents and different temperatures are interpreted accordingly. Methylalumoxane (MAO) was used as activator. Elastomeric polypropene is obtained with catalyst I. A syndiotactic polypropene was obtained with the new rigid catalyst diphenylmethy(cyclopentadienyl)(1-neomenthylindenyl)ZrCl2 (III).",
        "openArchiveArticle": "false",
        "prism:coverDate": "2003-09-15",
        "openaccessUserLicense": null,
        "prism:aggregationType": "Journal",
        "prism:url": "https://api.elsevier.com/content/article/pii/S1381116903003133",
        "dc:creator": [
          {
            "@_fa": "true",
            "$": "Di Silvestro, Giuseppe"
          },
          {
            "@_fa": "true",
            "$": "Galbiati, Alessandro"
          },
          {
            "@_fa": "true",
            "$": "Ming, Yuan Cui"
          },
          {
            "@_fa": "true",
            "$": "Caronzolo, Nicola"
          },
          {
            "@_fa": "true",
            "$": "Cesarotti, Edoardo"
          }
        ],
        "link": [
          {
            "@_fa": "true",
            "@rel": "self",
            "@href": "https://api.elsevier.com/content/article/pii/S1381116903003133"
          },
          {
            "@_fa": "true",
            "@rel": "scidir",
            "@href": "https://www.sciencedirect.com/science/article/pii/S1381116903003133"
          }
        ],
        "dc:format": "application/json",
        "openaccessType": null,
        "pii": "S1381-1169(03)00313-3",
        "prism:volume": "204",
        "prism:publisher": "Elsevier Science B.V.",
        "dc:title": "Polymerisation with soluble metallocene chiral catalysts: a bridge between inorganic and macromolecular stereochemistry",
        "prism:copyright": "Copyright © 2003 Elsevier Science B.V. All rights reserved.",
        "prism:issueName": "In honour of Prof. R. Ugo on the occasion of his 65th. Birthday",
        "openaccess": "0",
        "prism:issn": "13811169",
        "dcterms:subject": [
          {
            "@_fa": "true",
            "$": "Polymerisation"
          },
          {
            "@_fa": "true",
            "$": "Metallocene complexes"
          },
          {
            "@_fa": "true",
            "$": "Catalysis"
          }
        ],
        "openaccessArticle": "false",
        "prism:publicationName": "Journal of Molecular Catalysis A: Chemical",
        "openaccessSponsorType": null,
        "prism:pageRange": "315-324",
        "prism:endingPage": "324",
        "pubType": "fla",
        "prism:coverDisplayDate": "15 September 2003",
        "prism:doi": "10.1016/S1381-1169(03)00313-3",
        "prism:startingPage": "315",
        "dc:identifier": "doi:10.1016/S1381-1169(03)00313-3",
        "openaccessSponsorName": null
      },
      "objects": {
        "object": [
          {
            "@category": "thumbnail",
            "@height": "91",
            "@width": "125",
            "@_fa": "true",
            "$": "https://api.elsevier.com/content/object/eid/1-s2.0-S1381116903003133-fx1.sml?httpAccept=%2A%2F%2A",
            "@multimediatype": "GIF image file",
            "@type": "IMAGE-THUMBNAIL",
            "@size": "1913",
            "@ref": "fx1",
            "@mimetype": "image/gif"
          },
          {
            "@category": "standard",
            "@height": "164",
            "@width": "225",
            "@_fa": "true",
            "$": "https://api.elsevier.com/content/object/eid/1-s2.0-S1381116903003133-fx1.gif?httpAccept=%2A%2F%2A",
            "@multimediatype": "GIF image file",
            "@type": "IMAGE-DOWNSAMPLED",
            "@size": "4307",
            "@ref": "fx1",
            "@mimetype": "image/gif"
          },
          {
            "@category": "thumbnail",
            "@height": "93",
            "@width": "122",
            "@_fa": "true",
            "$": "https://api.elsevier.com/content/object/eid/1-s2.0-S1381116903003133-gr1.sml?httpAccept=%2A%2F%2A",
            "@multimediatype": "GIF image file",
            "@type": "IMAGE-THUMBNAIL",
            "@size": "1165",
            "@ref": "gr1",
            "@mimetype": "image/gif"
          },
          {
            "@category": "standard",
            "@height": "238",
            "@width": "312",
            "@_fa": "true",
            "$": "https://api.elsevier.com/content/object/eid/1-s2.0-S1381116903003133-gr1.gif?httpAccept=%2A%2F%2A",
            "@multimediatype": "GIF image file",
            "@type": "IMAGE-DOWNSAMPLED",
            "@size": "4059",
            "@ref": "gr1",
            "@mimetype": "image/gif"
          },
          {
            "@category": "thumbnail",
            "@height": "68",
            "@width": "125",
            "@_fa": "true",
            "$": "https://api.elsevier.com/content/object/eid/1-s2.0-S1381116903003133-fx2.sml?httpAccept=%2A%2F%2A",
            "@multimediatype": "GIF image file",
            "@type": "IMAGE-THUMBNAIL",
            "@size": "888",
            "@ref": "fx2",
            "@mimetype": "image/gif"
          },
          {
            "@category": "standard",
            "@height": "132",
            "@width": "243",
            "@_fa": "true",
            "$": "https://api.elsevier.com/content/object/eid/1-s2.0-S1381116903003133-fx2.gif?httpAccept=%2A%2F%2A",
            "@multimediatype": "GIF image file",
            "@type": "IMAGE-DOWNSAMPLED",
            "@size": "1927",
            "@ref": "fx2",
            "@mimetype": "image/gif"
          },
          {
            "@category": "thumbnail",
            "@height": "79",
            "@width": "125",
            "@_fa": "true",
            "$": "https://api.elsevier.com/content/object/eid/1-s2.0-S1381116903003133-gr2.sml?httpAccept=%2A%2F%2A",
            "@multimediatype": "GIF image file",
            "@type": "IMAGE-THUMBNAIL",
            "@size": "1452",
            "@ref": "gr2",
            "@mimetype": "image/gif"
          },
          {
            "@category": "standard",
            "@height": "213",
            "@width": "339",
            "@_fa": "true",
            "$": "https://api.elsevier.com/content/object/eid/1-s2.0-S1381116903003133-gr2.gif?httpAccept=%2A%2F%2A",
            "@multimediatype": "GIF image file",
            "@type": "IMAGE-DOWNSAMPLED",
            "@size": "6728",
            "@ref": "gr2",
            "@mimetype": "image/gif"
          },
          {
            "@category": "thumbnail",
            "@height": "37",
            "@width": "125",
            "@_fa": "true",
            "$": "https://api.elsevier.com/content/object/eid/1-s2.0-S1381116903003133-gr3.sml?httpAccept=%2A%2F%2A",
            "@multimediatype": "GIF image file",
            "@type": "IMAGE-THUMBNAIL",
            "@size": "492",
            "@ref": "gr3",
            "@mimetype": "image/gif"
          },
          {
            "@category": "standard",
            "@height": "69",
            "@width": "232",
            "@_fa": "true",
            "$": "https://api.elsevier.com/content/object/eid/1-s2.0-S1381116903003133-gr3.gif?httpAccept=%2A%2F%2A",
            "@multimediatype": "GIF image file",
            "@type": "IMAGE-DOWNSAMPLED",
            "@size": "863",
            "@ref": "gr3",
            "@mimetype": "image/gif"
          },
          {
            "@category": "thumbnail",
            "@height": "46",
            "@width": "125",
            "@_fa": "true",
            "$": "https://api.elsevier.com/content/object/eid/1-s2.0-S1381116903003133-fx3.sml?httpAccept=%2A%2F%2A",
            "@multimediatype": "GIF image file",
            "@type": "IMAGE-THUMBNAIL",
            "@size": "615",
            "@ref": "fx3",
            "@mimetype": "image/gif"
          },
          {
            "@category": "standard",
            "@height": "73",
            "@width": "197",
            "@_fa": "true",
            "$": "https://api.elsevier.com/content/object/eid/1-s2.0-S1381116903003133-fx3.gif?httpAccept=%2A%2F%2A",
            "@multimediatype": "GIF image file",
            "@type": "IMAGE-DOWNSAMPLED",
            "@size": "977",
            "@ref": "fx3",
            "@mimetype": "image/gif"
          },
          {
            "@category": "thumbnail",
            "@height": "28",
            "@width": "125",
            "@_fa": "true",
            "$": "https://api.elsevier.com/content/object/eid/1-s2.0-S1381116903003133-fx4.sml?httpAccept=%2A%2F%2A",
            "@multimediatype": "GIF image file",
            "@type": "IMAGE-THUMBNAIL",
            "@size": "539",
            "@ref": "fx4",
            "@mimetype": "image/gif"
          },
          {
            "@category": "standard",
            "@height": "36",
            "@width": "160",
            "@_fa": "true",
            "$": "https://api.elsevier.com/content/object/eid/1-s2.0-S1381116903003133-fx4.gif?httpAccept=%2A%2F%2A",
            "@multimediatype": "GIF image file",
            "@type": "IMAGE-DOWNSAMPLED",
            "@size": "561",
            "@ref": "fx4",
            "@mimetype": "image/gif"
          },
          {
            "@category": "thumbnail",
            "@height": "32",
            "@width": "125",
            "@_fa": "true",
            "$": "https://api.elsevier.com/content/object/eid/1-s2.0-S1381116903003133-fx5.sml?httpAccept=%2A%2F%2A",
            "@multimediatype": "GIF image file",
            "@type": "IMAGE-THUMBNAIL",
            "@size": "553",
            "@ref": "fx5",
            "@mimetype": "image/gif"
          },
          {
            "@category": "standard",
            "@height": "105",
            "@width": "414",
            "@_fa": "true",
            "$": "https://api.elsevier.com/content/object/eid/1-s2.0-S1381116903003133-fx5.gif?httpAccept=%2A%2F%2A",
            "@multimediatype": "GIF image file",
            "@type": "IMAGE-DOWNSAMPLED",
            "@size": "1856",
            "@ref": "fx5",
            "@mimetype": "image/gif"
          },
          {
            "@category": "thumbnail",
            "@height": "40",
            "@width": "125",
            "@_fa": "true",
            "$": "https://api.elsevier.com/content/object/eid/1-s2.0-S1381116903003133-fx6.sml?httpAccept=%2A%2F%2A",
            "@multimediatype": "GIF image file",
            "@type": "IMAGE-THUMBNAIL",
            "@size": "621",
            "@ref": "fx6",
            "@mimetype": "image/gif"
          },
          {
            "@category": "standard",
            "@height": "137",
            "@width": "426",
            "@_fa": "true",
            "$": "https://api.elsevier.com/content/object/eid/1-s2.0-S1381116903003133-fx6.gif?httpAccept=%2A%2F%2A",
            "@multimediatype": "GIF image file",
            "@type": "IMAGE-DOWNSAMPLED",
            "@size": "2134",
            "@ref": "fx6",
            "@mimetype": "image/gif"
          },
          {
            "@category": "thumbnail",
            "@height": "30",
            "@width": "125",
            "@_fa": "true",
            "$": "https://api.elsevier.com/content/object/eid/1-s2.0-S1381116903003133-fx7.sml?httpAccept=%2A%2F%2A",
            "@multimediatype": "GIF image file",
            "@type": "IMAGE-THUMBNAIL",
            "@size": "518",
            "@ref": "fx7",
            "@mimetype": "image/gif"
          },
          {
            "@category": "standard",
            "@height": "107",
            "@width": "441",
            "@_fa": "true",
            "$": "https://api.elsevier.com/content/object/eid/1-s2.0-S1381116903003133-fx7.gif?httpAccept=%2A%2F%2A",
            "@multimediatype": "GIF image file",
            "@type": "IMAGE-DOWNSAMPLED",
            "@size": "1724",
            "@ref": "fx7",
            "@mimetype": "image/gif"
          },
          {
            "@category": "thumbnail",
            "@height": "93",
            "@width": "117",
            "@_fa": "true",
            "$": "https://api.elsevier.com/content/object/eid/1-s2.0-S1381116903003133-gr4.sml?httpAccept=%2A%2F%2A",
            "@multimediatype": "GIF image file",
            "@type": "IMAGE-THUMBNAIL",
            "@size": "1445",
            "@ref": "gr4",
            "@mimetype": "image/gif"
          },
          {
            "@category": "standard",
            "@height": "390",
            "@width": "489",
            "@_fa": "true",
            "$": "https://api.elsevier.com/content/object/eid/1-s2.0-S1381116903003133-gr4.gif?httpAccept=%2A%2F%2A",
            "@multimediatype": "GIF image file",
            "@type": "IMAGE-DOWNSAMPLED",
            "@size": "10181",
            "@ref": "gr4",
            "@mimetype": "image/gif"
          },
          {
            "@category": "thumbnail",
            "@height": "78",
            "@width": "125",
            "@_fa": "true",
            "$": "https://api.elsevier.com/content/object/eid/1-s2.0-S1381116903003133-gr5.sml?httpAccept=%2A%2F%2A",
            "@multimediatype": "GIF image file",
            "@type": "IMAGE-THUMBNAIL",
            "@size": "1125",
            "@ref": "gr5",
            "@mimetype": "image/gif"
          },
          {
            "@category": "standard",
            "@height": "302",
            "@width": "481",
            "@_fa": "true",
            "$": "https://api.elsevier.com/content/object/eid/1-s2.0-S1381116903003133-gr5.gif?httpAccept=%2A%2F%2A",
            "@multimediatype": "GIF image file",
            "@type": "IMAGE-DOWNSAMPLED",
            "@size": "7533",
            "@ref": "gr5",
            "@mimetype": "image/gif"
          },
          {
            "@category": "thumbnail",
            "@height": "89",
            "@width": "125",
            "@_fa": "true",
            "$": "https://api.elsevier.com/content/object/eid/1-s2.0-S1381116903003133-gr6.sml?httpAccept=%2A%2F%2A",
            "@multimediatype": "GIF image file",
            "@type": "IMAGE-THUMBNAIL",
            "@size": "1831",
            "@ref": "gr6",
            "@mimetype": "image/gif"
          },
          {
            "@category": "standard",
            "@height": "485",
            "@width": "681",
            "@_fa": "true",
            "$": "https://api.elsevier.com/content/object/eid/1-s2.0-S1381116903003133-gr6.gif?httpAccept=%2A%2F%2A",
            "@multimediatype": "GIF image file",
            "@type": "IMAGE-DOWNSAMPLED",
            "@size": "19772",
            "@ref": "gr6",
            "@mimetype": "image/gif"
          }
        ]
      },
      "link": {
        "@rel": "abstract",
        "@href": "https://api.elsevier.com/content/abstract/scopus_id/18544410375"
      }
    }
  }
}