{
  "metadata": {
    "title": "Direct synthesis of hydrogen peroxide from hydrogen and oxygen over palladium catalyst supported on H<ce:inf loc=post>3</ce:inf>PW<ce:inf loc=post>12</ce:inf>O<ce:inf loc=post>40</ce:inf>-incorporated MCF silica",
    "authors": "; ; ",
    "journal": "Journal of Molecular Catalysis A: Chemical",
    "date": "2011-02-14",
    "doi": "10.1016/j.molcata.2010.12.012",
    "abstract": "",
    "uri": "https://api.elsevier.com/content/article/pii/S1381116911000033",
    "pii": "S1381116911000033"
  },
  "fulltext": {
    "full-text-retrieval-response": {
      "scopus-eid": "2-s2.0-79951682263",
      "originalText": "serial JL 271358 291210 291744 291790 291809 31 Journal of Molecular Catalysis A: Chemical JOURNALMOLECULARCATALYSISACHEMICAL 2011-01-12 2011-01-12 2013-05-15T11:30:47 1-s2.0-S1381116911000033 S1381-1169(11)00003-3 S1381116911000033 10.1016/j.molcata.2010.12.012 S300 S300.1 FULL-TEXT 1-s2.0-S1381116911X0002X 2015-05-15T05:56:33.607047-04:00 0 0 20110214 2011 2011-01-12T00:00:00Z articleinfo crossmark dco dateupdated tomb dateloaded datesearch indexeddate issuelist volumelist yearnav absattachment articletitlenorm authfirstinitialnorm authfirstsurnamenorm cid cids contenttype copyright dateloadedtxt docsubtype doctype doi eid ewtransactionid hubeid issfirst issn issnnorm itemstage itemtransactionid itemweight openaccess openarchive pg pgfirst pglast pii piinorm pubdatestart pubdatetxt pubyr sortorder srctitle srctitlenorm srctype subheadings volfirst volissue webpdf webpdfpagecount figure table body mmlmath acknowledge affil articletitle auth authfirstini authfull authkeywords authlast primabst ref specialabst alllist content subj ssids 1381-1169 13811169 false 336 336 1 2 1 2 Volume 336, Issues 1–2 13 78 86 78 86 20110214 14 February 2011 2011-02-14 2011 article fla Copyright © 2011 Elsevier B.V. All rights reserved. DIRECTSYNTHESISHYDROGENPEROXIDEHYDROGENOXYGENOVERPALLADIUMCATALYSTSUPPORTEDH3PW12O40INCORPORATEDMCFSILICA PARK S 1 Introduction 2 Experimental 2.1 Catalyst preparation 2.2 Catalyst characterization 2.3 Direct synthesis of hydrogen peroxide 2.4 Hydrogenation of hydrogen peroxide 2.5 Decomposition of hydrogen peroxide 3 Results and discussion 3.1 Catalyst characterization 3.2 Catalytic performance in the direct synthesis of hydrogen peroxide 3.3 Effect of acid additive on the catalytic performance 3.4 Catalytic performance in the hydrogenation of hydrogen peroxide and the decomposition of hydrogen peroxide 3.5 Acidity of Pd/H3PW12O40-MCF catalysts 3.6 Effect of acidity on the catalytic performance 4 Conclusions Acknowledgements References CAMPOSMARTIN 2006 6962 6984 J SAMANTA 2008 133 149 C BORDIGA 2005 37 68 S PARK 2008 2485 2488 S LUNSFORD 2003 455 460 J CHINTA 2004 249 255 S BURCH 2003 203 211 R CHOUDHARY 2006 128 133 V HAN 2005 313 316 Y CHOUDHARY 2002 81 87 V CHOUDHARY 2006 28 38 V SAMANTA 2007 73 79 C CHOUDHARY 2009 35 42 V EDWARDS 2005 69 79 J EDWARDS 2008 388 394 J EDWARDS 2009 1037 1041 J LIU 2008 130 136 Q MENEGAZZO 2008 369 381 F PARK 2010 98 107 S PARK 2009 391 394 S PARK 2010 76 83 S KOZHEVNIKOV 1998 171 198 I HILL 1995 407 455 C SONG 2002 567 573 I YOUN 2007 51 54 M OKUHARA 1996 113 252 T MISONO 2001 1141 1152 M ZHANG 2006 130 137 F GAO 2009 61 65 R THOMMES 2002 239 249 M SCHMIDTWINKEL 2000 686 696 P KIM 2007 2132 2142 H KANNAN 2009 34 40 K HANSON 1986 1922 1925 R DAMYANOVA 2003 183 197 S GHANBARISIAHKALI 2000 57 69 A GAGEA 2009 99 108 B PARKX2011X78 PARKX2011X78X86 PARKX2011X78XS PARKX2011X78X86XS item S1381-1169(11)00003-3 S1381116911000033 1-s2.0-S1381116911000033 10.1016/j.molcata.2010.12.012 271358 2013-05-15T09:25:37.502934-04:00 2011-02-14 1-s2.0-S1381116911000033-main.pdf https://s3.amazonaws.com/prod-ucs-content-store-us-east/content/pii:S1381116911000033/MAIN/application/pdf/a379045be94f4e6e45f5df2c6896bf8a/main.pdf https://s3-eu-west-1.amazonaws.com/prod-ucs-content-store-eu-west/content/pii:S1381116911000033/MAIN/application/pdf/a379045be94f4e6e45f5df2c6896bf8a/main.pdf main.pdf pdf true 1426608 MAIN 9 1-s2.0-S1381116911000033-main_1.png https://s3-eu-west-1.amazonaws.com/prod-ucs-content-store-eu-west/content/pii:S1381116911000033/PREVIEW/image/png/ae8ceaa0dbbcb51597de5f76d0edf2b8/main_1.png https://s3.amazonaws.com/prod-ucs-content-store-us-east/content/pii:S1381116911000033/PREVIEW/image/png/ae8ceaa0dbbcb51597de5f76d0edf2b8/main_1.png main_1.png png 59920 849 656 IMAGE-WEB-PDF 1 1-s2.0-S1381116911000033-si4.gif https://s3.amazonaws.com/prod-ucs-content-store-us-east/content/pii:S1381116911000033/STRIPIN/image/gif/7fef93772a6f18b5005f5750d627811e/si4.gif https://s3-eu-west-1.amazonaws.com/prod-ucs-content-store-eu-west/content/pii:S1381116911000033/STRIPIN/image/gif/7fef93772a6f18b5005f5750d627811e/si4.gif si4 si4.gif gif 3031 64 309 ALTIMG 1-s2.0-S1381116911000033-si3.gif https://s3.amazonaws.com/prod-ucs-content-store-us-east/content/pii:S1381116911000033/STRIPIN/image/gif/bf3d120864a7b8be1a7fb48ea8175e66/si3.gif https://s3-eu-west-1.amazonaws.com/prod-ucs-content-store-eu-west/content/pii:S1381116911000033/STRIPIN/image/gif/bf3d120864a7b8be1a7fb48ea8175e66/si3.gif si3 si3.gif gif 2883 64 315 ALTIMG 1-s2.0-S1381116911000033-si2.gif https://s3.amazonaws.com/prod-ucs-content-store-us-east/content/pii:S1381116911000033/STRIPIN/image/gif/47a05ccf7aed77a22d69ffb4718fae75/si2.gif https://s3-eu-west-1.amazonaws.com/prod-ucs-content-store-eu-west/content/pii:S1381116911000033/STRIPIN/image/gif/47a05ccf7aed77a22d69ffb4718fae75/si2.gif si2 si2.gif gif 2418 63 270 ALTIMG 1-s2.0-S1381116911000033-si1.gif https://s3.amazonaws.com/prod-ucs-content-store-us-east/content/pii:S1381116911000033/STRIPIN/image/gif/ea403512e461c7c39560546b04bd4cb8/si1.gif https://s3-eu-west-1.amazonaws.com/prod-ucs-content-store-eu-west/content/pii:S1381116911000033/STRIPIN/image/gif/ea403512e461c7c39560546b04bd4cb8/si1.gif si1 si1.gif gif 1761 63 217 ALTIMG 1-s2.0-S1381116911000033-gr9_lrg.jpg https://s3.amazonaws.com/prod-ucs-content-store-us-east/content/pii:S1381116911000033/gr9/HIGHRES/image/jpeg/8adec36625d572958da05f3419eb521e/gr9_lrg.jpg https://s3-eu-west-1.amazonaws.com/prod-ucs-content-store-eu-west/content/pii:S1381116911000033/gr9/HIGHRES/image/jpeg/8adec36625d572958da05f3419eb521e/gr9_lrg.jpg gr9 gr9_lrg.jpg jpg 241126 952 2497 IMAGE-HIGH-RES 1-s2.0-S1381116911000033-gr8_lrg.jpg https://s3.amazonaws.com/prod-ucs-content-store-us-east/content/pii:S1381116911000033/gr8/HIGHRES/image/jpeg/5c12464901935214a96b5fd37309bc42/gr8_lrg.jpg https://s3-eu-west-1.amazonaws.com/prod-ucs-content-store-eu-west/content/pii:S1381116911000033/gr8/HIGHRES/image/jpeg/5c12464901935214a96b5fd37309bc42/gr8_lrg.jpg gr8 gr8_lrg.jpg jpg 190007 888 2505 IMAGE-HIGH-RES 1-s2.0-S1381116911000033-gr7_lrg.jpg https://s3.amazonaws.com/prod-ucs-content-store-us-east/content/pii:S1381116911000033/gr7/HIGHRES/image/jpeg/a03ad3bcbeed19c1aa4880c609d8f15f/gr7_lrg.jpg https://s3-eu-west-1.amazonaws.com/prod-ucs-content-store-eu-west/content/pii:S1381116911000033/gr7/HIGHRES/image/jpeg/a03ad3bcbeed19c1aa4880c609d8f15f/gr7_lrg.jpg gr7 gr7_lrg.jpg jpg 214768 955 2488 IMAGE-HIGH-RES 1-s2.0-S1381116911000033-gr6_lrg.jpg https://s3.amazonaws.com/prod-ucs-content-store-us-east/content/pii:S1381116911000033/gr6/HIGHRES/image/jpeg/5e7f5471a2b703d93146dbfe7b238e09/gr6_lrg.jpg https://s3-eu-west-1.amazonaws.com/prod-ucs-content-store-eu-west/content/pii:S1381116911000033/gr6/HIGHRES/image/jpeg/5e7f5471a2b703d93146dbfe7b238e09/gr6_lrg.jpg gr6 gr6_lrg.jpg jpg 106106 1048 1610 IMAGE-HIGH-RES 1-s2.0-S1381116911000033-gr5_lrg.jpg https://s3.amazonaws.com/prod-ucs-content-store-us-east/content/pii:S1381116911000033/gr5/HIGHRES/image/jpeg/e5ff6a8538dcbc8dc8cc73757faa53ee/gr5_lrg.jpg https://s3-eu-west-1.amazonaws.com/prod-ucs-content-store-eu-west/content/pii:S1381116911000033/gr5/HIGHRES/image/jpeg/e5ff6a8538dcbc8dc8cc73757faa53ee/gr5_lrg.jpg gr5 gr5_lrg.jpg jpg 332495 2012 1483 IMAGE-HIGH-RES 1-s2.0-S1381116911000033-gr4_lrg.jpg https://s3.amazonaws.com/prod-ucs-content-store-us-east/content/pii:S1381116911000033/gr4/HIGHRES/image/jpeg/e58291db1bcde88931d18caeb4a24e10/gr4_lrg.jpg https://s3-eu-west-1.amazonaws.com/prod-ucs-content-store-eu-west/content/pii:S1381116911000033/gr4/HIGHRES/image/jpeg/e58291db1bcde88931d18caeb4a24e10/gr4_lrg.jpg gr4 gr4_lrg.jpg jpg 365747 2194 1607 IMAGE-HIGH-RES 1-s2.0-S1381116911000033-gr3_lrg.jpg https://s3.amazonaws.com/prod-ucs-content-store-us-east/content/pii:S1381116911000033/gr3/HIGHRES/image/jpeg/d4b69507fd2f9115ab59b510f5428f7c/gr3_lrg.jpg https://s3-eu-west-1.amazonaws.com/prod-ucs-content-store-eu-west/content/pii:S1381116911000033/gr3/HIGHRES/image/jpeg/d4b69507fd2f9115ab59b510f5428f7c/gr3_lrg.jpg gr3 gr3_lrg.jpg jpg 221572 1190 1661 IMAGE-HIGH-RES 1-s2.0-S1381116911000033-gr2_lrg.jpg https://s3.amazonaws.com/prod-ucs-content-store-us-east/content/pii:S1381116911000033/gr2/HIGHRES/image/jpeg/18a19bb077f6127f457862475e631565/gr2_lrg.jpg https://s3-eu-west-1.amazonaws.com/prod-ucs-content-store-eu-west/content/pii:S1381116911000033/gr2/HIGHRES/image/jpeg/18a19bb077f6127f457862475e631565/gr2_lrg.jpg gr2 gr2_lrg.jpg jpg 1728366 1382 3500 IMAGE-HIGH-RES 1-s2.0-S1381116911000033-gr13_lrg.jpg https://s3.amazonaws.com/prod-ucs-content-store-us-east/content/pii:S1381116911000033/gr13/HIGHRES/image/jpeg/6be13da44bddbbd2c055f54d15721c22/gr13_lrg.jpg https://s3-eu-west-1.amazonaws.com/prod-ucs-content-store-eu-west/content/pii:S1381116911000033/gr13/HIGHRES/image/jpeg/6be13da44bddbbd2c055f54d15721c22/gr13_lrg.jpg gr13 gr13_lrg.jpg jpg 133268 1062 1391 IMAGE-HIGH-RES 1-s2.0-S1381116911000033-gr12_lrg.jpg https://s3.amazonaws.com/prod-ucs-content-store-us-east/content/pii:S1381116911000033/gr12/HIGHRES/image/jpeg/7e64be1a679a705ef7fd2a799860e25f/gr12_lrg.jpg https://s3-eu-west-1.amazonaws.com/prod-ucs-content-store-eu-west/content/pii:S1381116911000033/gr12/HIGHRES/image/jpeg/7e64be1a679a705ef7fd2a799860e25f/gr12_lrg.jpg gr12 gr12_lrg.jpg jpg 268955 2083 1538 IMAGE-HIGH-RES 1-s2.0-S1381116911000033-gr11_lrg.jpg https://s3.amazonaws.com/prod-ucs-content-store-us-east/content/pii:S1381116911000033/gr11/HIGHRES/image/jpeg/e0afac81c3de64c46ccf04c175856ad6/gr11_lrg.jpg https://s3-eu-west-1.amazonaws.com/prod-ucs-content-store-eu-west/content/pii:S1381116911000033/gr11/HIGHRES/image/jpeg/e0afac81c3de64c46ccf04c175856ad6/gr11_lrg.jpg gr11 gr11_lrg.jpg jpg 149219 924 2517 IMAGE-HIGH-RES 1-s2.0-S1381116911000033-gr10_lrg.jpg https://s3.amazonaws.com/prod-ucs-content-store-us-east/content/pii:S1381116911000033/gr10/HIGHRES/image/jpeg/740cbadd7fed1a582c2d796ed675938e/gr10_lrg.jpg https://s3-eu-west-1.amazonaws.com/prod-ucs-content-store-eu-west/content/pii:S1381116911000033/gr10/HIGHRES/image/jpeg/740cbadd7fed1a582c2d796ed675938e/gr10_lrg.jpg gr10 gr10_lrg.jpg jpg 170596 939 2504 IMAGE-HIGH-RES 1-s2.0-S1381116911000033-gr1_lrg.jpg https://s3.amazonaws.com/prod-ucs-content-store-us-east/content/pii:S1381116911000033/gr1/HIGHRES/image/jpeg/cfab00a7e7eb01f0f22c91d68341de0c/gr1_lrg.jpg https://s3-eu-west-1.amazonaws.com/prod-ucs-content-store-eu-west/content/pii:S1381116911000033/gr1/HIGHRES/image/jpeg/cfab00a7e7eb01f0f22c91d68341de0c/gr1_lrg.jpg gr1 gr1_lrg.jpg jpg 1595124 1382 3494 IMAGE-HIGH-RES 1-s2.0-S1381116911000033-fx1_lrg.jpg https://s3.amazonaws.com/prod-ucs-content-store-us-east/content/pii:S1381116911000033/fx1/HIGHRES/image/jpeg/9689a01807b664913140180e3796c019/fx1_lrg.jpg https://s3-eu-west-1.amazonaws.com/prod-ucs-content-store-eu-west/content/pii:S1381116911000033/fx1/HIGHRES/image/jpeg/9689a01807b664913140180e3796c019/fx1_lrg.jpg fx1 true fx1_lrg.jpg jpg 126803 886 2213 IMAGE-HIGH-RES 1-s2.0-S1381116911000033-gr9.jpg https://s3.amazonaws.com/prod-ucs-content-store-us-east/content/pii:S1381116911000033/gr9/DOWNSAMPLED/image/jpeg/3dea2f8afb7e46ce171ff75765e08d16/gr9.jpg https://s3-eu-west-1.amazonaws.com/prod-ucs-content-store-eu-west/content/pii:S1381116911000033/gr9/DOWNSAMPLED/image/jpeg/3dea2f8afb7e46ce171ff75765e08d16/gr9.jpg gr9 gr9.jpg jpg 35759 215 564 IMAGE-DOWNSAMPLED 1-s2.0-S1381116911000033-gr8.jpg https://s3.amazonaws.com/prod-ucs-content-store-us-east/content/pii:S1381116911000033/gr8/DOWNSAMPLED/image/jpeg/c68548731c3b6f86c23ae76c253c6a84/gr8.jpg https://s3-eu-west-1.amazonaws.com/prod-ucs-content-store-eu-west/content/pii:S1381116911000033/gr8/DOWNSAMPLED/image/jpeg/c68548731c3b6f86c23ae76c253c6a84/gr8.jpg gr8 gr8.jpg jpg 33147 201 566 IMAGE-DOWNSAMPLED 1-s2.0-S1381116911000033-gr7.jpg https://s3.amazonaws.com/prod-ucs-content-store-us-east/content/pii:S1381116911000033/gr7/DOWNSAMPLED/image/jpeg/7b58a23e8b30335510ea2f10c153767c/gr7.jpg https://s3-eu-west-1.amazonaws.com/prod-ucs-content-store-eu-west/content/pii:S1381116911000033/gr7/DOWNSAMPLED/image/jpeg/7b58a23e8b30335510ea2f10c153767c/gr7.jpg gr7 gr7.jpg jpg 27996 216 562 IMAGE-DOWNSAMPLED 1-s2.0-S1381116911000033-gr6.jpg https://s3.amazonaws.com/prod-ucs-content-store-us-east/content/pii:S1381116911000033/gr6/DOWNSAMPLED/image/jpeg/1707c6611698b4048c63ff3c6dd4d9ad/gr6.jpg https://s3-eu-west-1.amazonaws.com/prod-ucs-content-store-eu-west/content/pii:S1381116911000033/gr6/DOWNSAMPLED/image/jpeg/1707c6611698b4048c63ff3c6dd4d9ad/gr6.jpg gr6 gr6.jpg jpg 13694 236 363 IMAGE-DOWNSAMPLED 1-s2.0-S1381116911000033-gr5.jpg https://s3.amazonaws.com/prod-ucs-content-store-us-east/content/pii:S1381116911000033/gr5/DOWNSAMPLED/image/jpeg/a25b23fc7ebc9d295187ac5cf5f5b337/gr5.jpg https://s3-eu-west-1.amazonaws.com/prod-ucs-content-store-eu-west/content/pii:S1381116911000033/gr5/DOWNSAMPLED/image/jpeg/a25b23fc7ebc9d295187ac5cf5f5b337/gr5.jpg gr5 gr5.jpg jpg 34877 454 335 IMAGE-DOWNSAMPLED 1-s2.0-S1381116911000033-gr4.jpg https://s3.amazonaws.com/prod-ucs-content-store-us-east/content/pii:S1381116911000033/gr4/DOWNSAMPLED/image/jpeg/fa792ccf13a2517b540fa6018a69b865/gr4.jpg https://s3-eu-west-1.amazonaws.com/prod-ucs-content-store-eu-west/content/pii:S1381116911000033/gr4/DOWNSAMPLED/image/jpeg/fa792ccf13a2517b540fa6018a69b865/gr4.jpg gr4 gr4.jpg jpg 38683 496 363 IMAGE-DOWNSAMPLED 1-s2.0-S1381116911000033-gr3.jpg https://s3.amazonaws.com/prod-ucs-content-store-us-east/content/pii:S1381116911000033/gr3/DOWNSAMPLED/image/jpeg/0a56f47dd5f31ec815699b830bff3ced/gr3.jpg https://s3-eu-west-1.amazonaws.com/prod-ucs-content-store-eu-west/content/pii:S1381116911000033/gr3/DOWNSAMPLED/image/jpeg/0a56f47dd5f31ec815699b830bff3ced/gr3.jpg gr3 gr3.jpg jpg 30389 269 375 IMAGE-DOWNSAMPLED 1-s2.0-S1381116911000033-gr2.jpg https://s3.amazonaws.com/prod-ucs-content-store-us-east/content/pii:S1381116911000033/gr2/DOWNSAMPLED/image/jpeg/4d7d0872c708514b93656becd1a10453/gr2.jpg https://s3-eu-west-1.amazonaws.com/prod-ucs-content-store-eu-west/content/pii:S1381116911000033/gr2/DOWNSAMPLED/image/jpeg/4d7d0872c708514b93656becd1a10453/gr2.jpg gr2 gr2.jpg jpg 123452 312 791 IMAGE-DOWNSAMPLED 1-s2.0-S1381116911000033-gr13.jpg https://s3.amazonaws.com/prod-ucs-content-store-us-east/content/pii:S1381116911000033/gr13/DOWNSAMPLED/image/jpeg/c2329ccec175b5edaccdd0758d49e128/gr13.jpg https://s3-eu-west-1.amazonaws.com/prod-ucs-content-store-eu-west/content/pii:S1381116911000033/gr13/DOWNSAMPLED/image/jpeg/c2329ccec175b5edaccdd0758d49e128/gr13.jpg gr13 gr13.jpg jpg 16891 240 314 IMAGE-DOWNSAMPLED 1-s2.0-S1381116911000033-gr12.jpg https://s3.amazonaws.com/prod-ucs-content-store-us-east/content/pii:S1381116911000033/gr12/DOWNSAMPLED/image/jpeg/35d73dc08a045a643be8670284b4cfbf/gr12.jpg https://s3-eu-west-1.amazonaws.com/prod-ucs-content-store-eu-west/content/pii:S1381116911000033/gr12/DOWNSAMPLED/image/jpeg/35d73dc08a045a643be8670284b4cfbf/gr12.jpg gr12 gr12.jpg jpg 32507 470 347 IMAGE-DOWNSAMPLED 1-s2.0-S1381116911000033-gr11.jpg https://s3.amazonaws.com/prod-ucs-content-store-us-east/content/pii:S1381116911000033/gr11/DOWNSAMPLED/image/jpeg/635848fee91064734db637c7d339183b/gr11.jpg https://s3-eu-west-1.amazonaws.com/prod-ucs-content-store-eu-west/content/pii:S1381116911000033/gr11/DOWNSAMPLED/image/jpeg/635848fee91064734db637c7d339183b/gr11.jpg gr11 gr11.jpg jpg 19475 209 568 IMAGE-DOWNSAMPLED 1-s2.0-S1381116911000033-gr10.jpg https://s3.amazonaws.com/prod-ucs-content-store-us-east/content/pii:S1381116911000033/gr10/DOWNSAMPLED/image/jpeg/2df628b1db4308a09018fbdaa1bf34c1/gr10.jpg https://s3-eu-west-1.amazonaws.com/prod-ucs-content-store-eu-west/content/pii:S1381116911000033/gr10/DOWNSAMPLED/image/jpeg/2df628b1db4308a09018fbdaa1bf34c1/gr10.jpg gr10 gr10.jpg jpg 32960 212 565 IMAGE-DOWNSAMPLED 1-s2.0-S1381116911000033-gr1.jpg https://s3.amazonaws.com/prod-ucs-content-store-us-east/content/pii:S1381116911000033/gr1/DOWNSAMPLED/image/jpeg/842b7ee0999eec3d82804fc2cc1b1f80/gr1.jpg https://s3-eu-west-1.amazonaws.com/prod-ucs-content-store-eu-west/content/pii:S1381116911000033/gr1/DOWNSAMPLED/image/jpeg/842b7ee0999eec3d82804fc2cc1b1f80/gr1.jpg gr1 gr1.jpg jpg 117200 312 789 IMAGE-DOWNSAMPLED 1-s2.0-S1381116911000033-fx1.jpg https://s3.amazonaws.com/prod-ucs-content-store-us-east/content/pii:S1381116911000033/fx1/DOWNSAMPLED/image/jpeg/9cf17f99d0727133af54cb57dd310390/fx1.jpg https://s3-eu-west-1.amazonaws.com/prod-ucs-content-store-eu-west/content/pii:S1381116911000033/fx1/DOWNSAMPLED/image/jpeg/9cf17f99d0727133af54cb57dd310390/fx1.jpg fx1 true fx1.jpg jpg 14848 200 500 IMAGE-DOWNSAMPLED 1-s2.0-S1381116911000033-gr9.sml https://s3.amazonaws.com/prod-ucs-content-store-us-east/content/pii:S1381116911000033/gr9/THUMBNAIL/image/gif/eb4fee56d143ed14d2ac3f815e9105a0/gr9.sml https://s3-eu-west-1.amazonaws.com/prod-ucs-content-store-eu-west/content/pii:S1381116911000033/gr9/THUMBNAIL/image/gif/eb4fee56d143ed14d2ac3f815e9105a0/gr9.sml gr9 gr9.sml sml 3237 83 219 IMAGE-THUMBNAIL 1-s2.0-S1381116911000033-gr8.sml https://s3.amazonaws.com/prod-ucs-content-store-us-east/content/pii:S1381116911000033/gr8/THUMBNAIL/image/gif/3b1f63a6cfc8813a3a36c2e2e3a3ae5f/gr8.sml https://s3-eu-west-1.amazonaws.com/prod-ucs-content-store-eu-west/content/pii:S1381116911000033/gr8/THUMBNAIL/image/gif/3b1f63a6cfc8813a3a36c2e2e3a3ae5f/gr8.sml gr8 gr8.sml sml 2592 78 219 IMAGE-THUMBNAIL 1-s2.0-S1381116911000033-gr7.sml https://s3.amazonaws.com/prod-ucs-content-store-us-east/content/pii:S1381116911000033/gr7/THUMBNAIL/image/gif/b6450ed11ba03b69c66fb2a7561a48af/gr7.sml https://s3-eu-west-1.amazonaws.com/prod-ucs-content-store-eu-west/content/pii:S1381116911000033/gr7/THUMBNAIL/image/gif/b6450ed11ba03b69c66fb2a7561a48af/gr7.sml gr7 gr7.sml sml 3934 84 219 IMAGE-THUMBNAIL 1-s2.0-S1381116911000033-gr6.sml https://s3.amazonaws.com/prod-ucs-content-store-us-east/content/pii:S1381116911000033/gr6/THUMBNAIL/image/gif/bf5c21fa344a5fb56f990aaff5d33a2b/gr6.sml https://s3-eu-west-1.amazonaws.com/prod-ucs-content-store-eu-west/content/pii:S1381116911000033/gr6/THUMBNAIL/image/gif/bf5c21fa344a5fb56f990aaff5d33a2b/gr6.sml gr6 gr6.sml sml 3732 143 219 IMAGE-THUMBNAIL 1-s2.0-S1381116911000033-gr5.sml https://s3.amazonaws.com/prod-ucs-content-store-us-east/content/pii:S1381116911000033/gr5/THUMBNAIL/image/gif/77571884e9465d91986ee37d777598b7/gr5.sml https://s3-eu-west-1.amazonaws.com/prod-ucs-content-store-eu-west/content/pii:S1381116911000033/gr5/THUMBNAIL/image/gif/77571884e9465d91986ee37d777598b7/gr5.sml gr5 gr5.sml sml 3802 164 121 IMAGE-THUMBNAIL 1-s2.0-S1381116911000033-gr4.sml https://s3.amazonaws.com/prod-ucs-content-store-us-east/content/pii:S1381116911000033/gr4/THUMBNAIL/image/gif/65f3fdde782f8321cdd4880f52b19d65/gr4.sml https://s3-eu-west-1.amazonaws.com/prod-ucs-content-store-eu-west/content/pii:S1381116911000033/gr4/THUMBNAIL/image/gif/65f3fdde782f8321cdd4880f52b19d65/gr4.sml gr4 gr4.sml sml 4001 164 120 IMAGE-THUMBNAIL 1-s2.0-S1381116911000033-gr3.sml https://s3.amazonaws.com/prod-ucs-content-store-us-east/content/pii:S1381116911000033/gr3/THUMBNAIL/image/gif/3a59006234ba2aee8bfcf890ffc2f0f5/gr3.sml https://s3-eu-west-1.amazonaws.com/prod-ucs-content-store-eu-west/content/pii:S1381116911000033/gr3/THUMBNAIL/image/gif/3a59006234ba2aee8bfcf890ffc2f0f5/gr3.sml gr3 gr3.sml sml 7250 157 219 IMAGE-THUMBNAIL 1-s2.0-S1381116911000033-gr2.sml https://s3.amazonaws.com/prod-ucs-content-store-us-east/content/pii:S1381116911000033/gr2/THUMBNAIL/image/gif/184c5477055d694ed5ef10fc7293f995/gr2.sml https://s3-eu-west-1.amazonaws.com/prod-ucs-content-store-eu-west/content/pii:S1381116911000033/gr2/THUMBNAIL/image/gif/184c5477055d694ed5ef10fc7293f995/gr2.sml gr2 gr2.sml sml 6545 86 219 IMAGE-THUMBNAIL 1-s2.0-S1381116911000033-gr13.sml https://s3.amazonaws.com/prod-ucs-content-store-us-east/content/pii:S1381116911000033/gr13/THUMBNAIL/image/gif/f45ef7ec8d18fb3492137c77d811a465/gr13.sml https://s3-eu-west-1.amazonaws.com/prod-ucs-content-store-eu-west/content/pii:S1381116911000033/gr13/THUMBNAIL/image/gif/f45ef7ec8d18fb3492137c77d811a465/gr13.sml gr13 gr13.sml sml 5155 164 215 IMAGE-THUMBNAIL 1-s2.0-S1381116911000033-gr12.sml https://s3.amazonaws.com/prod-ucs-content-store-us-east/content/pii:S1381116911000033/gr12/THUMBNAIL/image/gif/7a27f254e6caaa3b401296b1acf4c1e0/gr12.sml https://s3-eu-west-1.amazonaws.com/prod-ucs-content-store-eu-west/content/pii:S1381116911000033/gr12/THUMBNAIL/image/gif/7a27f254e6caaa3b401296b1acf4c1e0/gr12.sml gr12 gr12.sml sml 3721 164 121 IMAGE-THUMBNAIL 1-s2.0-S1381116911000033-gr11.sml https://s3.amazonaws.com/prod-ucs-content-store-us-east/content/pii:S1381116911000033/gr11/THUMBNAIL/image/gif/23360dbdebf6f0a5c868e259345cffa1/gr11.sml https://s3-eu-west-1.amazonaws.com/prod-ucs-content-store-eu-west/content/pii:S1381116911000033/gr11/THUMBNAIL/image/gif/23360dbdebf6f0a5c868e259345cffa1/gr11.sml gr11 gr11.sml sml 4272 80 219 IMAGE-THUMBNAIL 1-s2.0-S1381116911000033-gr10.sml https://s3.amazonaws.com/prod-ucs-content-store-us-east/content/pii:S1381116911000033/gr10/THUMBNAIL/image/gif/e6a8a19142f25dde58a9fdfe07e63f66/gr10.sml https://s3-eu-west-1.amazonaws.com/prod-ucs-content-store-eu-west/content/pii:S1381116911000033/gr10/THUMBNAIL/image/gif/e6a8a19142f25dde58a9fdfe07e63f66/gr10.sml gr10 gr10.sml sml 2416 82 219 IMAGE-THUMBNAIL 1-s2.0-S1381116911000033-gr1.sml https://s3.amazonaws.com/prod-ucs-content-store-us-east/content/pii:S1381116911000033/gr1/THUMBNAIL/image/gif/62798feb4a3fc53afba101628b1cdf9b/gr1.sml https://s3-eu-west-1.amazonaws.com/prod-ucs-content-store-eu-west/content/pii:S1381116911000033/gr1/THUMBNAIL/image/gif/62798feb4a3fc53afba101628b1cdf9b/gr1.sml gr1 gr1.sml sml 6431 87 219 IMAGE-THUMBNAIL 1-s2.0-S1381116911000033-fx1.sml https://s3.amazonaws.com/prod-ucs-content-store-us-east/content/pii:S1381116911000033/fx1/THUMBNAIL/image/gif/25380d33864052e0a7fd4e4363dba541/fx1.sml https://s3-eu-west-1.amazonaws.com/prod-ucs-content-store-eu-west/content/pii:S1381116911000033/fx1/THUMBNAIL/image/gif/25380d33864052e0a7fd4e4363dba541/fx1.sml fx1 true fx1.sml sml 2892 88 219 IMAGE-THUMBNAIL MOLCAA 8029 S1381-1169(11)00003-3 10.1016/j.molcata.2010.12.012 Elsevier B.V. Fig. 1 TEM images of MCF silica and HPW-MCF-X (X =1.0, 4.8, 9.1, 13.0, 16.7, 20.0, 23.1, and 25.9) supports. Fig. 2 TEM images of Pd/MCF and Pd/HPW-MCF-X (X =1.0, 4.8, 9.1, 13.0, 16.7, 20.0, 23.1, and 25.9) catalysts. Fig. 3 N2 adsorption–desorption isotherms and pore size distributions of Pd/MCF, Pd/HPW-MCF-9.1, and Pd/HPW-MCF-20.0. Fig. 4 XRD patterns of Pd/MCF, H3PW12O40 (HPW), and Pd/HPW-MCF-X (X =1.0, 4.8, 9.1, 13.0, 16.7, 20.0, 23.1, and 25.9) catalysts. Fig. 5 31P MAS NMR spectra of H3PW12O40 (HPW) and Pd/HPW-MCF-X (X =1.0, 4.8, 9.1, 13.0, 16.7, 20.0, 23.1, and 25.9) catalysts. Fig. 6 Catalytic performance of Pd/HPW-MCF-20.0 catalyst in the direct synthesis of hydrogen peroxide from hydrogen and oxygen with time on stream. Fig. 7 Catalytic performance of Pd/HPW-MCF-X (X =1.0, 4.8, 9.1, 13.0, 16.7, 20.0, 23.1, and 25.9) catalysts in the direct synthesis of hydrogen peroxide from hydrogen and oxygen after a 6h-reaction. Fig. 8 Catalytic performance of Pd/MCF and Pd/HPW-MCF-20.0 in the direct synthesis of hydrogen peroxide from hydrogen and oxygen after a 6h-reaction. Fig. 9 Catalytic performance of Pd/HPW-MCF-20.0 catalyst in the direct synthesis of hydrogen peroxide from hydrogen and oxygen after a 6h-reaction at different concentration of H3PO4. Fig. 10 Catalytic performance of Pd/MCF in the direct synthesis of hydrogen peroxide from hydrogen and oxygen after a 6h-reaction at different concentration of H3PO4. Fig. 11 Catalytic performance in the hydrogenation of hydrogen peroxide and the decomposition of hydrogen peroxide over Pd/MCF and Pd/HPW-MCF-20.0. Fig. 12 NH3-TPD profiles of Pd/MCF and Pd/HPW-MCF-X (X =1.0, 4.8, 9.1, 13.0, 16.7, 20.0, 23.1, and 25.9) catalysts. Fig. 13 A correlation between yield for hydrogen peroxide over Pd/HPW-MCF-X (X =1.0, 4.8, 9.1, 13.0, 16.7, 20.0, 23.1, and 25.9) catalysts and acidity of the catalysts. Table 1 HPW content, surface area, pore volume, average pore size, and acidity of Pd/MCF and Pd/HPW-MCF-X catalysts. Catalyst HPW content (wt.%) Surface area (m2/g) a Pore volume (cm3/g) b Average pore size (nm) c Acidity (mmol-NH3/g) Before reaction After reaction Pd/MCF – – 561.8 1.6 8.0 26.4 Pd/HPW-MCF-1.0 0.7 0.7 538.1 1.6 8.3 106.3 Pd/HPW-MCF-4.8 4.8 4.4 524.1 1.4 7.1 130.0 Pd/HPW-MCF-9.1 7.5 6.5 468.0 1.4 8.0 131.7 Pd/HPW-MCF-13.0 10.0 8.7 403.0 1.5 8.8 156.6 Pd/HPW-MCF-16.7 12.1 10.1 365.4 1.5 8.9 161.8 Pd/HPW-MCF-20.0 17.2 14.4 358.1 1.4 9.8 170.9 Pd/HPW-MCF-23.1 17.5 15.8 348.2 1.1 9.6 167.7 Pd/HPW-MCF-25.9 22.8 17.9 347.7 1.1 9.2 127.2 a Calculated by the BET (Brunauer–Emmett–Teller) equation. b BJH (Barret–Joyner–Hallender) desorption pore volume. c BJH (Barret–Joyner–Hallender) desorption average pore diameter. Direct synthesis of hydrogen peroxide from hydrogen and oxygen over palladium catalyst supported on H3PW12O40-incorporated MCF silica Sunyoung Park a Dong Ryul Park a Jung Ho Choi a Tae Jin Kim b Young-Min Chung b Seung-Hoon Oh b In Kyu Song a ⁎ a School of Chemical and Biological Engineering, Institute of Chemical Processes, Seoul National University, Shinlim-dong, Kwanak-ku, Seoul 151-744, South Korea b SK Energy Corporation, Yuseong-ku, Daejeon 305-712, South Korea ⁎ Corresponding author. Tel.: +82 2 880 9227; fax: +82 2 889 7415. Graphical abstract In the direct synthesis of hydrogen peroxide from hydrogen and oxygen over palladium catalyst supported on H3PW12O40-incorporated MCF silica, yield for hydrogen peroxide increased with increasing acidity of the catalyst. Research highlights ▶ Direct synthesis of hydrogen peroxide from hydrogen and oxygen was conducted. ▶ Palladium catalyst supported on H3PW12O40-incorporated MCF silica was used. ▶ Acidity of Pd/H3PW12O40-MCF catalyst played an important role. ▶ Yield for hydrogen peroxide increased with increasing acidity of the catalyst. Palladium catalysts supported on H3PW12O40 heteropolyacid incorporated into MCF silica (Pd/HPW-MCF-X (X =1.0, 4.8, 9.1, 13.0, 16.7, 20.0, 23.1, and 25.9)) were prepared with a variation of H3PW12O40 content (X, wt.%). The prepared catalysts were then applied to the direct synthesis of hydrogen peroxide from hydrogen and oxygen. Conversion of hydrogen over Pd/HPW-MCF-X catalysts showed no great difference, while selectivity for hydrogen peroxide and yield for hydrogen peroxide over the catalysts showed volcano-shaped curves with respect to H3PW12O40 content. Acidity of Pd/HPW-MCF-X catalysts also showed a volcano-shaped trend with respect to H3PW12O40 content. It was observed that yield for hydrogen peroxide increased with increasing acidity of Pd/HPW-MCF-X catalyst. Thus, acidity of Pd/HPW-MCF-X catalyst played an important role in determining the catalytic performance in the direct synthesis of hydrogen peroxide. HPW-MCF-X support efficiently served as an alternate acid source in the direct synthesis of hydrogen peroxide. Keywords Hydrogen peroxide Palladium Heteropolyacid MCF silica 1 Introduction Hydrogen peroxide (H2O2) has been widely used as a clean and strong oxidant in pulp industry, textile industry, and green chemical synthesis such as epoxidation of olefins and hydroxylation of benzene [1–4]. Hydrogen peroxide currently available in the industrial market is mostly produced through the anthraquinone auto-oxidation process [1,2]. However, this process uses toxic compounds and requires many energy intensive steps for separation and purification of hydrogen peroxide [1,2]. Therefore, direct synthesis of hydrogen peroxide from hydrogen and oxygen has attracted much attention as an economical and environmentally benign process [5–21]. In the direct synthesis of hydrogen peroxide from hydrogen and oxygen, several undesired reactions occur simultaneously together with selective oxidation of hydrogen to hydrogen peroxide (H2 +O2 →H2O2, ΔH ° 298K =−135.8kJ/mol, ΔG ° 298K =−120.4kJ/mol) [2]. These undesired reactions include formation of water (H2 +0.5O2 →H2O, ΔH ° 298K =−241.6kJ/mol, ΔG ° 298K =−237.2kJ/mol), hydrogenation of hydrogen peroxide (H2O2 +H2 →2H2O, ΔH ° 298K =−211.5kJ/mol, ΔG ° 298K =−354.0kJ/mol), and decomposition of hydrogen peroxide (H2O2 →H2O+0.5O2, ΔH ° 298K =−105.8kJ/mol, ΔG ° 298K =−116.8kJ/mol) [2]. All these reactions are thermodynamically favorable and highly exothermic. In particular, formation of water and hydrogenation of hydrogen peroxide are thermodynamically more favorable than selective oxidation of hydrogen to hydrogen peroxide. Consequently, selectivity for hydrogen peroxide in the direct synthesis of hydrogen peroxide is limited by these undesired reactions. Therefore, many attempts have been made to increase the selectivity for hydrogen peroxide in the direct synthesis of hydrogen peroxide [9–13]. Various noble metals such as palladium [5–13], palladium–gold [14–16], and palladium–platinum [17] are known to be efficient catalysts in the direct synthesis of hydrogen peroxide from hydrogen and oxygen. These noble metals have been supported on various materials such as silica, alumina, titania, zirconia, and carbon for effective dispersion of active metal component [8–17]. Acids and halides have been used as additives to enhance the selectivity for hydrogen peroxide in the direct synthesis of hydrogen peroxide from hydrogen and oxygen [1,2,9–13]. It has been reported that acids prevent the decomposition of hydrogen peroxide and halides inhibit the formation of water [1,2,9–13]. However, acid additives cause the corrosion of reactor as well as the dissolution of active metal component from the supported catalyst. Therefore, solid acid supports have been investigated in the direct synthesis of hydrogen peroxide as an alternate acid source [18–21]. Heteropolyacids (HPAs) are inorganic acids. It has been reported that acid strength of HPAs is stronger than that of conventional solid acids [22–27]. Therefore, HPAs have been utilized as solid acid catalysts in several acid-catalyzed reactions [22,23]. However, HPAs are highly soluble in polar solvents and have low surface area (<10m2/g) [22]. In order to solve these problems, insoluble HPAs have been prepared by exchanging protons with certain cations [26,27]. It has been reported that HPA salts with large cations such as NH4 +, K+, Rb+, and Cs+ are insoluble, and have high surface area (>100m2/g) and porous structure by forming a tertiary structure [26,27]. In our previous work [20], palladium-exchanged insoluble HPA catalysts showed high catalytic performance in the direct synthesis of hydrogen peroxide from hydrogen and oxygen. However, it was difficult to separate palladium-exchanged insoluble HPA catalyst from reaction medium because insoluble HPA was composed of very fine particles with an average size of ca. 10nm [26,27]. To overcome this problem, insoluble HPAs have been supported on porous materials such as zeolites and mesoporous silicas [21,28,29]. Mesoporous silicas have uniform pore size, high surface area, and large pore volume. Therefore, they have been used in many areas of science and engineering such as catalysis, adsorption, and separation [30–33]. Especially, it has been reported that mesostructured cellular foam (MCF) silica exhibits a 3-dimensional pore structure with large pores in the range of 10–50nm [31–33]. Due to its unique pore characteristics, MCF silica has been used as an efficient support for immobilization of large molecules such as enzymes [33]. In our previous work [21], it was observed that insoluble Cs2.5H0.5PW12O40 heteropolyacid supported on Pd/MCF catalyst showed high catalytic performance in the direct synthesis of hydrogen peroxide from hydrogen and oxygen. However, insoluble Cs2.5H0.5PW12O40 heteropolyacid supported on Pd/MCF catalyst required many preparation steps. In this work, a series of H3PW12O40 heteropolyacid incorporated into MCF silica (H3PW12O40-MCF) were prepared with a variation of H3PW12O40 content for use as a solid acid support. Palladium catalysts supported on H3PW12O40 heteropolyacid incorporated into MCF silica (Pd/H3PW12O40-MCF) were then applied to the direct synthesis of hydrogen peroxide from hydrogen and oxygen. The effect of H3PW12O40 content on the catalytic performance of Pd/H3PW12O40-MCF catalysts in the direct synthesis of hydrogen peroxide was examined. A correlation between acidity and catalytic performance of Pd/H3PW12O40-MCF catalysts was then established. 2 Experimental 2.1 Catalyst preparation A series of H3PW12O40 heteropolyacid incorporated into MCF silica (H3PW12O40-MCF) were prepared with a variation of H3PW12O40 content. Palladium catalysts supported on H3PW12O40 heteropolyacid incorporated into MCF silica (Pd/H3PW12O40-MCF) were then prepared by an incipient wetness impregnation method. Typical procedures for the preparation of Pd/H3PW12O40-MCF catalyst are as follows. 10g of PEO-PPO-PEO triblock copolymer (Pluronic P123, BASF), an organic template, was dissolved in 350ml of 1.6M HCl aqueous solution at 40°C. 25ml of H3PW12O40 (HPW) (Sigma–Aldrich) aqueous solution was added dropwise into the solution under vigorous stirring, and the mixed solution was stirred for 6h. 4.6ml of 1,3,5-trimethylbenzene (Mesitylene, Sigma–Aldrich), a swelling agent, was then added into the mixed solution. After stirring the solution at 40°C for 1h, 24.1ml of tetraethyl orthosilicate (TEOS, Sigma–Aldrich), a silica source, was added into the solution. The resulting mixture was stirred at 40°C for 20h, and it was maintained at 130°C for 20h under static condition. After filtering and washing a solid product with distilled water, the solid was dried at room temperature. The solid product was then calcined in air at 500°C for 5h to yield H3PW12O40-MCF support. Palladium nitrate (Pd(NO3)2, Sigma–Aldrich) was supported onto H3PW12O40-MCF. The impregnated solid was dried overnight at 80°C, and calcined at 500°C for 3h. The palladium loading was fixed at 0.5wt.%. The calcined catalyst was charged into a tubular quartz reactor, and then it was reduced with a mixed stream of H2 (5ml/min) and N2 (20ml/min) at 200°C for 2h to yield Pd/H3PW12O40-MCF catalyst. H3PW12O40 content in the Pd/H3PW12O40-MCF catalysts was adjusted to be 1.0, 4.8, 9.1, 13.0, 16.7, 20.0, 23.1, and 25.9wt.%. Pd/H3PW12O40-MCF catalysts were denoted as Pd/HPW-MCF-X (X =1.0, 4.8, 9.1, 13.0, 16.7, 20.0, 23.1, and 25.9), where X represented weight percentage of H3PW12O40 incorporated into MCF silica. For comparison, palladium catalyst supported on MCF silica (Pd/MCF) was prepared by an incipient wetness method. MCF silica was synthesized according to the reported method [31]. The preparation procedures for Pd/MCF were almost identical to those for Pd/H3PW12O40-MCF, except that H3PW12O40 was not employed for the preparation of Pd/MCF. The palladium loading was also fixed at 0.5wt.%. 2.2 Catalyst characterization H3PW12O40 content in the catalyst was measured by ICP-AES analysis (Shimadzu, ICPS-7500). Pore structure, pore size, and palladium dispersion of the catalyst were examined by TEM analysis (Jeol, JEM-3000F). N2 adsorption–desorption isotherm of the catalyst was obtained with an ASAP-2010 instrument (Micromeritics), and pore size distribution was determined by the BJH (Barret–Joyner–Hallender) method applied to the desorption branch of the isotherm. X-ray diffraction (XRD) pattern of the catalyst was confirmed by XRD measurement (Rigaku, D-Max2500-PC) using CuKα radiation operated at 50kV and 100mA. Chemical state of H3PW12O40 heteropolyacid incorporated into MCF silica was examined by 31P MAS NMR analysis (Bruker, AVANCE 400 WB). NH3-TPD (temperature-programmed desorption) experiment was carried out in order to measure the acidity of the catalyst. 0.05g of each catalyst charged into the TPD apparatus was pretreated at 200°C for 1h with a stream of helium (20ml/min). After cooling the catalyst to room temperature, 20ml of NH3 was pulsed into the reactor every minute under a flow of helium (5ml/min) until the acid sites were saturated with NH3. Physisorbed NH3 was removed by evacuating the catalyst sample at 100°C for 1h. Furnace temperature was then increased from room temperature to 900°C at a heating rate of 5°C/min under a flow of helium (10ml/min). Desorbed NH3 was detected using a GC-MSD (Agilent, MSD-6890N GC). 2.3 Direct synthesis of hydrogen peroxide Direct synthesis of hydrogen peroxide from hydrogen and oxygen was carried out in an autoclave reactor in the absence of acid additive. 80ml of methanol and 6.32mg of sodium bromide were charged into the reactor. 1g of each catalyst was then added into the reactor. H2/N2 (25mol% H2) and O2/N2 (50 mol% O2) were bubbled through the reaction medium under vigorous stirring (1000rpm). H2/O2 ratio in the feed stream was fixed at 0.4, and total feed rate was maintained at 44ml/min. Catalytic reaction was carried out at 28°C and 10atm for 6h. In the catalytic reaction, mixed gases diluted with an inert gas (H2/N2 (25mol% H2) and O2/N2 (50mol% O2)) and an autoclave reactor equipped with a flashback arrestor as well as a safety valve were used in order to solve the safety problem. Unreacted hydrogen was analyzed using a gas chromatograph (Younglin, ACME 6000) equipped with a TCD. Concentration of hydrogen peroxide was determined by an iodometric titration method [34]. Conversion of hydrogen and selectivity for hydrogen peroxide were calculated according to the following equations. Yield for hydrogen peroxide was calculated by multiplying conversion of hydrogen and selectivity for hydrogen peroxide. Conversion of hydrogen = moles of hydrogen reacted moles of hydrogen supplied Selectivity for hydrogen peroxide = moles of hydrogen peroxide formed moles of hydrogen reacted 2.4 Hydrogenation of hydrogen peroxide 80ml of methanol, 6.32mg of sodium bromide, and 1g of Pd/HPW-MCF-20.0 catalyst were charged into the reactor. 3ml of 30wt.% hydrogen peroxide was then added. H2/N2 (25 mol% H2) and N2 were bubbled through the reaction medium under vigorous stirring (1000rpm). H2/N2 ratio in the feed stream was fixed at 0.1, and total feed rate was maintained at 44ml/min. The reaction was carried out at 28°C and 10atm for 6h. Concentration of hydrogen peroxide was determined by an iodometric titration method [34]. Degree of hydrogenation of hydrogen peroxide was calculated according to the following equation. For comparison, hydrogenation of hydrogen peroxide was also carried out using 1g of Pd/MCF under the same reaction conditions. Degree of hydrogenation of H 2 O 2 = moles of hydrogen peroxide hydrogenated moles of hydrogen peroxide supplied 2.5 Decomposition of hydrogen peroxide 80ml of methanol, 6.32mg of sodium bromide, and 1g of Pd/HPW-MCF-20.0 catalyst were charged into the reactor. 3ml of 30wt.% hydrogen peroxide was then added. N2 (44ml/min) was bubbled through the reaction medium under vigorous stirring (1000rpm). The reaction was carried out at 28°C and 10atm for 6h. Concentration of hydrogen peroxide was determined by an iodometric titration method [34]. Degree of decomposition of hydrogen peroxide was calculated according to the following equation. For comparison, decomposition of hydrogen peroxide was also carried out using 1g of Pd/MCF under the same reaction conditions. Degree of decomposition of H 2 O 2 = moles of hydrogen peroxide decomposed moles of hydrogen peroxide supplied 3 Results and discussion 3.1 Catalyst characterization H3PW12O40 (HPW) content in the Pd/HPW-MCF-X (X =1.0, 4.8, 9.1, 13.0, 16.7, 20.0, 23.1, and 25.9) catalysts determined by ICP-AES analyses is listed in Table 1 . H3PW12O40 content in the Pd/HPW-MCF-X catalysts increased with increasing designed value. This indicates that Pd/HPW-MCF-X catalysts were successfully prepared as attempted in this work. Fig. 1 shows the TEM images of MCF and HPW-MCF-X (X =1.0, 4.8, 9.1, 13.0, 16.7, 20.0, 23.1, and 25.9) supports. Pore structure and pore size of HPW-MCF-X were almost identical to those of MCF silica. HPW-MCF-X exhibited a disordered pore structure with large pores in the range of 8–10nm. This indicates that HPW-MCF-X supports were successfully prepared and pore structure of MCF silica was still maintained even after the incorporation of H3PW12O40. Fig. 2 shows the TEM images of Pd/MCF and Pd/HPW-MCF-X (X =1.0, 4.8, 9.1, 13.0, 16.7, 20.0, 23.1, and 25.9) catalysts. Pd/HPW-MCF-X catalysts exhibited almost the same pore structure and pore size as HPW-MCF-X supports, indicating that pore structure of the supports was still maintained even after the palladium loading. Furthermore, small palladium particles with a size of 10–40nm were observed in the TEM images of the catalysts. Palladium dispersion determined by hydrogen chemisorption was in the range of 2.7–7.9%. Fig. 3 shows the N2 adsorption–desorption isotherms and pore size distributions of Pd/MCF, Pd/HPW-MCF-9.1, and Pd/HPW-MCF-20.0. N2 adsorption–desorption isotherm and pore size distribution of Pd/HPW-MCF-X catalysts were similar to those of Pd/MCF. Pd/HPW-MCF-X catalysts showed IV-type isotherms with H1-type hysteresis loops, as reported in the literature [31]. This result also supports that pore structure of MCF silica was still maintained even after the incorporation of H3PW12O40 and the loading of palladium, as also evidenced by TEM images. Detailed textural properties of Pd/HPW-MCF-X catalysts are summarized in Table 1. Surface area of Pd/HPW-MCF-X catalysts decreased with increasing H3PW12O40 content. This is attributed to the increased incorporation of H3PW12O40 into MCF silica. Pore volume of Pd/HPW-MCF-X catalysts also decreased with increasing H3PW12O40 content. Furthermore, it was observed that average pore size of Pd/HPW-MCF-X catalysts slightly increased with increasing H3PW12O40 content. However, all the Pd/HPW-MCF-X catalysts still exhibited the unique pore characteristics of MCF silica. Fig. 4 shows the XRD patterns of Pd/MCF, H3PW12O40 (HPW), and Pd/HPW-MCF-X (X =1.0, 4.8, 9.1, 13.0, 16.7, 20.0, 23.1, and 25.9) catalysts. Pd/MCF showed no diffraction peaks due to an amorphous nature of MCF silica [32]. No diffraction peaks for H3PW12O40 were also observed in the Pd/HPW-MCF-X (X =1.0, 4.8, 9.1, 13.0, 16.7, and 20.0) catalysts. This indicates that H3PW12O40 was not in a crystal state but in an amorphous-like state, demonstrating that H3PW12O40 was finely and molecularly incorporated into MCF silica. However, Pd/HPW-MCF-23.1 and Pd/HPW-MCF-25.9 catalysts exhibited weak diffraction peaks for H3PW12O40. This implies that H3PW12O40 was aggregated by the excessive incorporation of H3PW12O40 into MCF silica. Fig. 5 shows the 31P MAS NMR spectra of H3PW12O40 (HPW) and Pd/HPW-MCF-X (X =1.0, 4.8, 9.1, 13.0, 16.7, 20.0, 23.1, and 25.9) catalysts. It has been reported that H3PW12O40 exhibited a resonance peak at around −15 or −16ppm [35–37]. It is known that small difference in chemical shift was attributed to the difference in the degree of hydration [35,36]. All the Pd/HPW-MCF-X catalysts showed a resonance peak in the range from −15.6 to −16.3ppm. This chemical shift was similar to that of H3PW12O40 (−16.0ppm), indicating that the chemical interaction between H3PW12O40 and MCF silica in Pd/HPW-MCF-X catalysts was negligible. Therefore, it is expected that H3PW12O40 was incorporated into MCF silica by being embedded in the silica framework. Furthermore, any peaks were not detected at −30ppm. This implies that no phosphorous oxide was formed under our preparation conditions [37]. This result indicates that the primary structure of H3PW12O40 was still maintained even after the incorporation into MCF silica. 3.2 Catalytic performance in the direct synthesis of hydrogen peroxide Fig. 6 shows the catalytic performance of Pd/HPW-MCF-20.0 catalyst in the direct synthesis of hydrogen peroxide from hydrogen and oxygen with time on stream. Conversion of hydrogen was almost constant during a 6h-reaction, while concentration of hydrogen peroxide continuously increased with increasing reaction time. This indicates that the catalyst deactivation did not occur during the reaction extending over 6h. Furthermore, it is expected that decomposition of hydrogen peroxide during the reaction was negligible. Fig. 7 shows the catalytic performance of Pd/HPW-MCF-X (X =1.0, 4.8, 9.1, 13.0, 16.7, 20.0, 23.1, and 25.9) catalysts in the direct synthesis of hydrogen peroxide from hydrogen and oxygen after a 6-h reaction, plotted as a function of H3PW12O40 content. Conversion of hydrogen over the catalysts showed no great difference, while selectivity for hydrogen peroxide exhibited a volcano-shaped curve with respect to H3PW12O40 content. As a consequence, yield for hydrogen peroxide showed a volcano-shaped curve with respect to H3PW12O40 content. Final concentration of hydrogen peroxide after a 6h-reaction also showed a volcano-shaped curve with respect to H3PW12O40 content. Among the catalysts tested, Pd/HPW-MCF-20.0 catalyst showed the best catalytic performance in terms of selectivity for hydrogen peroxide, yield for hydrogen peroxide, and final concentration of hydrogen peroxide. It is noteworthy that no significant dissolution of H3PW12O40 was observed in the Pd/HPW-MCF-X (X =1.0, 4.8, 9.1, 13.0, 16.7, 20.0, 23.1, and 25.9) catalysts before and after the direct synthesis of hydrogen peroxide from hydrogen and oxygen, as listed in Table 1. This indicates that H3PW12O40 was well incorporated into the pores of MCF silica, as attempted in this work. Direct comparison of catalytic performance of Pd/HPW-MCF-20.0 with that of Pd0.15Cs2.5H0.2PW12O40 (the optimum palladium-exchanged insoluble HPA catalyst in the literature [20]) revealed that yield for hydrogen peroxide over Pd/HPW-MCF-20.0 catalyst (51.6%) was higher than that over Pd0.15Cs2.5H0.2PW12O40 catalyst (40.3%). Final concentration of hydrogen peroxide after a 6h-reaction over Pd/HPW-MCF-20.0 catalyst (2.29wt.%) was also higher than that over Pd0.15Cs2.5H0.2PW12O40 catalyst (1.77wt.%). For comparison, Pd/MCF was applied to the direct synthesis of hydrogen peroxide from hydrogen and oxygen. Fig. 8 shows the catalytic performance of Pd/MCF and Pd/HPW-MCF-20.0 in the direct synthesis of hydrogen peroxide. Conversion of hydrogen over Pd/HPW-MCF-20.0 catalyst was almost identical to that over Pd/MCF, while selectivity for hydrogen peroxide over Pd/HPW-MCF-20.0 catalyst was much higher than that over Pd/MCF. Consequently, yield for hydrogen peroxide over Pd/HPW-MCF-20.0 catalyst was much higher than that over Pd/MCF. Final concentration of hydrogen peroxide after a 6h-reaction over Pd/HPW-MCF-20.0 catalyst was also much higher than that over Pd/MCF. It has been reported that acid additives increase the selectivity for hydrogen peroxide by preventing the decomposition of hydrogen peroxide, because acid additives inhibited the dissociation of hydrogen peroxide (H2O2 ⇔HO2 − +H+) by surrounding hydrogen peroxide with protons [2]. Therefore, it can be inferred that the improved selectivity for hydrogen peroxide over Pd/HPW-MCF-X (X =1.0, 4.8, 9.1, 13.0, 16.7, 20.0, 23.1, and 25.9) catalysts was attributed to the enhanced acid property of Pd/HPW-MCF-X catalysts. 3.3 Effect of acid additive on the catalytic performance Fig. 9 shows the catalytic performance of Pd/HPW-MCF-20.0 catalyst in the direct synthesis of hydrogen peroxide from hydrogen and oxygen at different concentration of H3PO4. 0.645ml of 1M H3PO4 solution was added to the reaction medium in order to make the concentration of H3PO4 become 1000ppm. Conversion of hydrogen and selectivity for hydrogen peroxide in the presence of H3PO4 were almost identical to those in the absence of H3PO4. Consequently, yield for hydrogen peroxide in the presence of H3PO4 was similar to that in the absence of H3PO4. Final concentration of hydrogen peroxide in the presence of H3PO4 after a 6h-reaction was also almost identical to that in the absence of H3PO4. This indicates that H3PO4 additive had no effect on the catalytic performance of Pd/HPW-MCF-20.0 catalyst. Fig. 10 shows the catalytic performance of Pd/MCF in the direct synthesis of hydrogen peroxide from hydrogen and oxygen at different concentration of H3PO4. Conversion of hydrogen in the presence of H3PO4 was similar to that in the absence of H3PO4, while selectivity for hydrogen peroxide in the presence of H3PO4 was much higher than that in the absence of H3PO4. Consequently, yield for hydrogen peroxide in the presence of H3PO4 was considerably higher than that in the absence of H3PO4. Final concentration of hydrogen peroxide in the presence of H3PO4 after a 6h-reaction was also much higher than that in the absence of H3PO4. This is in good agreement with the fact that acid additives enhanced the selectivity for hydrogen peroxide by preventing the decomposition of hydrogen peroxide [2]. Direct comparison of Figs. 9 and 10 revealed that the catalytic performance of Pd/MCF was more sensitive to the amount of H3PO4 additive than that of Pd/HPW-MCF-20.0 catalyst. Furthermore, the catalytic performance of Pd/HPW-MCF-20.0 catalyst even in the absence of H3PO4 was much higher than that of Pd/MCF in the presence of H3PO4. This result implies that H3PW12O40-incorporated MCF silica served as an efficient alternate acid source in the direct synthesis of hydrogen peroxide from hydrogen and oxygen. 3.4 Catalytic performance in the hydrogenation of hydrogen peroxide and the decomposition of hydrogen peroxide Fig. 11 shows the catalytic performance in the hydrogenation of hydrogen peroxide and the decomposition of hydrogen peroxide over Pd/MCF and Pd/HPW-MCF-20.0. Both Pd/MCF and Pd/HPW-MCF-20.0 showed high activity for hydrogenation of hydrogen peroxide. This indicates that the enhanced acid property of Pd/HPW-MCF-20.0 catalyst showed no significant effect on the prevention of hydrogenation of hydrogen peroxide. However, activity for decomposition of hydrogen peroxide over Pd/HPW-MCF-20.0 catalyst was much lower than that over Pd/MCF. This implies that the enhanced acid property of Pd/HPW-MCF-20.0 catalyst inhibited the decomposition of hydrogen peroxide. Therefore, it can be said that Pd/HPW-MCF-X (X =1.0, 4.8, 9.1, 13.0, 16.7, 20.0, 23.1, and 25.9) catalysts increased the selectivity for hydrogen peroxide by preventing the decomposition of hydrogen peroxide. 3.5 Acidity of Pd/H3PW12O40-MCF catalysts Fig. 12 shows the NH3-TPD profiles of Pd/MCF and Pd/HPW-MCF-X (X =1.0, 4.8, 9.1, 13.0, 16.7, 20.0, 23.1, and 25.9) catalysts. Acidity of Pd/HPW-MCF-X catalysts measured from the peak area is summarized in Table 1. Acidity of the catalysts showed a volcano-shaped trend with respect to H3PW12O40 content. Among the Pd/HPW-MCF-X-X catalysts, Pd/HPW-MCF-20.0 showed the largest acidity. It has been reported that acidity of H3PW12O40-SBA-15 did not increase in proportion to H3PW12O40 content, because H3PW12O40 was covered with SBA-15 silica walls [37]. In this work, the aggregation of H3PW12O40 was observed, when a large amount of H3PW12O40 was added into MCF silica during the preparation step. Therefore, it can be inferred that the amount of H3PW12O40 exposed on the surface of H3PW12O40-incorporated MCF silica decreased because H3PW12O40 agglomerates were caged in the silica framework, when a large amount of H3PW12O40 was incorporated into MCF silica. This result indicates that acidity of Pd/HPW-MCF-X decreased due to the restriction of effective exposure of H3PW12O40, when an excess amount of H3PW12O40 more than 20.0wt.% was employed for incorporation. 3.6 Effect of acidity on the catalytic performance Fig. 13 shows the correlation between yield for hydrogen peroxide and acidity of Pd/HPW-MCF-X (X =1.0, 4.8, 9.1, 13.0, 16.7, 20.0, 23.1, and 25.9) catalysts. The correlation clearly shows that yield for hydrogen peroxide over Pd/HPW-MCF-X catalysts was closely related to the acidity of the catalysts. Yield for hydrogen peroxide increased with increasing acidity of Pd/HPW-MCF-X catalyst. Among the catalysts tested, Pd/HPW-MCF-20.0 catalyst with the largest acidity showed the highest yield for hydrogen peroxide. It has been reported that acidity on the surface of the catalyst is an important factor determining the catalytic performance in the direct synthesis of hydrogen peroxide from hydrogen and oxygen [19–21]. Therefore, it is concluded that the improved yield for hydrogen peroxide over Pd/HPW-MCF-X catalysts was attributed to the enhanced acidity of the catalysts. Thus, Pd/HPW-MCF-X efficiently served as an alternate acid source and as an active metal catalyst in the direct synthesis of hydrogen peroxide. 4 Conclusions A series of H3PW12O40 heteropolyacid incorporated into MCF silica (HPW-MCF-X (X =1.0, 4.8, 9.1, 13.0, 16.7, 20.0, 23.1, and 25.9)) were prepared with a variation of H3PW12O40 content (X, wt.%). Palladium catalysts supported on H3PW12O40-incorporated MCF silica (Pd/HPW-MCF-X (X =1.0, 4.8, 9.1, 13.0, 16.7, 20.0, 23.1, and 25.9)) were then prepared for use in the direct synthesis of hydrogen peroxide from hydrogen and oxygen. High catalytic performance of Pd/HPW-MCF-X catalysts compared to Pd/MCF was attributed to the enhanced acid property of Pd/HPW-MCF-X catalysts. Conversion of hydrogen over Pd/HPW-MCF-X catalysts showed no great difference, while selectivity for hydrogen peroxide, yield for hydrogen peroxide, and final concentration of hydrogen peroxide over the catalysts showed volcano-shaped curves with respect to H3PW12O40 content. Acidity of the catalysts also showed a volcano-shaped trend with respect to H3PW12O40 content. It was revealed that yield for hydrogen peroxide increased with increasing acidity of Pd/HPW-MCF-X catalyst. Among the catalysts tested, Pd/HPW-MCF-20.0 catalyst with the largest acidity showed the highest yield for hydrogen peroxide. It is concluded that acidity of Pd/HPW-MCF-X catalyst played a crucial role in determining the catalytic performance in the direct synthesis of hydrogen peroxide. Acknowledgements This work was financially supported by the grant from the Industrial Source Technology Development Programs (10033093) of the Ministry of Knowledge Economy (MKE) of Korea. References [1] J.M. Campos-Martin G. Blanco-Brieva J.L.G. Fierro Angew. Chem. Int. Ed. 45 2006 6962 6984 [2] C. Samanta Appl. Catal. A 350 2008 133 149 [3] S. Bordiga A. Damin F. Bonino C. Lamberti Top Organomet. Chem. 16 2005 37 68 [4] S. Park K.M. Cho M.H. Youn J.G. Seo J.C. Jung S.-H. Baeck T.J. Kim Y.-M. Chung S.-H. Oh I.K. Song Catal. Commun. 9 2008 2485 2488 [5] J.H. Lunsford J. Catal. 216 2003 455 460 [6] S. Chinta J.H. Lunsford J. Catal. 225 2004 249 255 [7] R. Burch P.R. Ellis Appl. Catal. B 42 2003 203 211 [8] V.R. Choudhary C. Samanta T.V. Choudhary Appl. Catal. A 308 2006 128 133 [9] Y.-F. Han J.H. Lunsford J. Catal. 230 2005 313 316 [10] V.R. Choudhary S.D. Sansare A.G. Gaikwad Catal. Lett. 84 2002 81 87 [11] V.R. Choudhary C. Samanta J. Catal. 238 2006 28 38 [12] C. Samanta V.R. Choudhary Catal. Commun. 8 2007 73 79 [13] V.R. Choudhary P. Jana Appl. Catal. A 352 2009 35 42 [14] J.K. Edwards B.E. Solsona P. Landon A.F. Carley A. Herzing C.J. Kiely G.J. Hutchings J. Catal. 236 2005 69 79 [15] J.K. Edwards A. Thomas A.F. Carley A.A. Herzing C.J. Kiely G.J. Hutchings Green Chem. 10 2008 388 394 [16] J.K. Edwards B. Solsona E. Ntainjua A.F. Carley A.A. Herzing C.J. Kiely G.J. Hutchings Science 323 2009 1037 1041 [17] Q. Liu J.C. Bauer R.E. Schaak J.H. Lunsford Appl. Catal. A 339 2008 130 136 [18] F. Menegazzo P. Burti M. Signoretto M. Manzoli S. Vankova F. Boccuzzi F. Pinna G. Strukul J. Catal. 257 2008 369 381 [19] S. Park S.-H. Baeck T.J. Kim Y.-M. Chung S.-H. Oh I.K. Song J. Mol. Catal. A 319 2010 98 107 [20] S. Park S.H. Lee S.H. Song D.R. Park S.-H. Baeck T.J. Kim Y.-M. Chung S.-H. Oh I.K. Song Catal. Commun. 10 2009 391 394 [21] S. Park D.R. Park J.H. Choi T.J. Kim Y.-M. Chung S.-H. Oh I.K. Song J. Mol. Catal. A 332 2010 76 83 [22] I.V. Kozhevnikov Chem. Rev. 98 1998 171 198 [23] C.L. Hill C.M. Prosser-McCartha Coord. Chem. Rev. 143 1995 407 455 [24] I.K. Song M.A. Barteau Korean J. Chem. Eng. 19 2002 567 573 [25] M.H. Youn D.R. Park J.C. Jung H. Kim M.A. Barteau I.K. Song Korean J. Chem. Eng. 24 2007 51 54 [26] T. Okuhara N. Mizuno M. Misono Adv. Catal. 41 1996 113 252 [27] M. Misono Chem. Commun. 2001 1141 1152 [28] F. Zhang C. Yuan J. Wang Y. Kong H. Zhu C. Wang J. Mol. Catal. A 247 2006 130 137 [29] R. Gao H. Chen Y. Le W.-L. Dai K. Fan Appl. Catal. A 352 2009 61 65 [30] M. Thommes R. Köhn M. Fröba Appl. Surf. Sci. 196 2002 239 249 [31] P. Schmidt-Winkel W.W. Lukens Jr. P. Yang D.I. Margolese J.S. Lettow J.Y. Ying G.D. Stucky Chem. Mater. 12 2000 686 696 [32] H. Kim J.C. Jung S.H. Yeom K.-Y. Lee J. Yi I.K. Song Mater. Res. Bull. 42 2007 2132 2142 [33] K. Kannan R.V. Jasra J. Mol. Catal. B 56 2009 34 40 [34] R.M. Hanson K.B. Sharpless J. Org. Chem. 51 1986 1922 1925 [35] S. Damyanova L. Dimitrov R. Mariscal J.L.G. Fierro L. Petrov I. Sobrados Appl. Catal. A 256 2003 183 197 [36] A. Ghanbari-Siahkali A. Philippou J. Dwyer M.W. Anderson Appl. Catal. A 192 2000 57 69 [37] B.C. Gagea Y. Lorgouilloux Y. Altintas P.A. Jacobs J.A. Martens J. Catal. 265 2009 99 108",
      "scopus-id": "79951682263",
      "coredata": {
        "eid": "1-s2.0-S1381116911000033",
        "dc:description": "Palladium catalysts supported on H3PW12O40 heteropolyacid incorporated into MCF silica (Pd/HPW-MCF-X (X =1.0, 4.8, 9.1, 13.0, 16.7, 20.0, 23.1, and 25.9)) were prepared with a variation of H3PW12O40 content (X, wt.%). The prepared catalysts were then applied to the direct synthesis of hydrogen peroxide from hydrogen and oxygen. Conversion of hydrogen over Pd/HPW-MCF-X catalysts showed no great difference, while selectivity for hydrogen peroxide and yield for hydrogen peroxide over the catalysts showed volcano-shaped curves with respect to H3PW12O40 content. Acidity of Pd/HPW-MCF-X catalysts also showed a volcano-shaped trend with respect to H3PW12O40 content. It was observed that yield for hydrogen peroxide increased with increasing acidity of Pd/HPW-MCF-X catalyst. Thus, acidity of Pd/HPW-MCF-X catalyst played an important role in determining the catalytic performance in the direct synthesis of hydrogen peroxide. HPW-MCF-X support efficiently served as an alternate acid source in the direct synthesis of hydrogen peroxide.",
        "openArchiveArticle": "false",
        "prism:coverDate": "2011-02-14",
        "openaccessUserLicense": null,
        "prism:aggregationType": "Journal",
        "prism:url": "https://api.elsevier.com/content/article/pii/S1381116911000033",
        "dc:creator": [
          {
            "@_fa": "true",
            "$": "Park, Sunyoung"
          },
          {
            "@_fa": "true",
            "$": "Park, Dong Ryul"
          },
          {
            "@_fa": "true",
            "$": "Choi, Jung Ho"
          },
          {
            "@_fa": "true",
            "$": "Kim, Tae Jin"
          },
          {
            "@_fa": "true",
            "$": "Chung, Young-Min"
          },
          {
            "@_fa": "true",
            "$": "Oh, Seung-Hoon"
          },
          {
            "@_fa": "true",
            "$": "Song, In Kyu"
          }
        ],
        "link": [
          {
            "@_fa": "true",
            "@rel": "self",
            "@href": "https://api.elsevier.com/content/article/pii/S1381116911000033"
          },
          {
            "@_fa": "true",
            "@rel": "scidir",
            "@href": "https://www.sciencedirect.com/science/article/pii/S1381116911000033"
          }
        ],
        "dc:format": "application/json",
        "openaccessType": null,
        "pii": "S1381-1169(11)00003-3",
        "prism:volume": "336",
        "prism:publisher": "Elsevier B.V.",
        "dc:title": "Direct synthesis of hydrogen peroxide from hydrogen and oxygen over palladium catalyst supported on H3PW12O40-incorporated MCF silica",
        "prism:copyright": "Copyright © 2011 Elsevier B.V. All rights reserved.",
        "openaccess": "0",
        "prism:issn": "13811169",
        "prism:issueIdentifier": "1-2",
        "dcterms:subject": [
          {
            "@_fa": "true",
            "$": "Hydrogen peroxide"
          },
          {
            "@_fa": "true",
            "$": "Palladium"
          },
          {
            "@_fa": "true",
            "$": "Heteropolyacid"
          },
          {
            "@_fa": "true",
            "$": "MCF silica"
          }
        ],
        "openaccessArticle": "false",
        "prism:publicationName": "Journal of Molecular Catalysis A: Chemical",
        "prism:number": "1-2",
        "openaccessSponsorType": null,
        "prism:pageRange": "78-86",
        "prism:endingPage": "86",
        "pubType": "fla",
        "prism:coverDisplayDate": "14 February 2011",
        "prism:doi": "10.1016/j.molcata.2010.12.012",
        "prism:startingPage": "78",
        "dc:identifier": "doi:10.1016/j.molcata.2010.12.012",
        "openaccessSponsorName": null
      },
      "objects": {
        "object": [
          {
            "@category": "thumbnail",
            "@height": "64",
            "@width": "309",
            "@_fa": "true",
            "$": "https://api.elsevier.com/content/object/eid/1-s2.0-S1381116911000033-si4.gif?httpAccept=%2A%2F%2A",
            "@multimediatype": "GIF image file",
            "@type": "ALTIMG",
            "@size": "3031",
            "@ref": "si4",
            "@mimetype": "image/gif"
          },
          {
            "@category": "thumbnail",
            "@height": "64",
            "@width": "315",
            "@_fa": "true",
            "$": "https://api.elsevier.com/content/object/eid/1-s2.0-S1381116911000033-si3.gif?httpAccept=%2A%2F%2A",
            "@multimediatype": "GIF image file",
            "@type": "ALTIMG",
            "@size": "2883",
            "@ref": "si3",
            "@mimetype": "image/gif"
          },
          {
            "@category": "thumbnail",
            "@height": "63",
            "@width": "270",
            "@_fa": "true",
            "$": "https://api.elsevier.com/content/object/eid/1-s2.0-S1381116911000033-si2.gif?httpAccept=%2A%2F%2A",
            "@multimediatype": "GIF image file",
            "@type": "ALTIMG",
            "@size": "2418",
            "@ref": "si2",
            "@mimetype": "image/gif"
          },
          {
            "@category": "thumbnail",
            "@height": "63",
            "@width": "217",
            "@_fa": "true",
            "$": "https://api.elsevier.com/content/object/eid/1-s2.0-S1381116911000033-si1.gif?httpAccept=%2A%2F%2A",
            "@multimediatype": "GIF image file",
            "@type": "ALTIMG",
            "@size": "1761",
            "@ref": "si1",
            "@mimetype": "image/gif"
          },
          {
            "@category": "high",
            "@height": "952",
            "@width": "2497",
            "@_fa": "true",
            "$": "https://api.elsevier.com/content/object/eid/1-s2.0-S1381116911000033-gr9_lrg.jpg?httpAccept=%2A%2F%2A",
            "@multimediatype": "JPEG image file",
            "@type": "IMAGE-HIGH-RES",
            "@size": "241126",
            "@ref": "gr9",
            "@mimetype": "image/jpeg"
          },
          {
            "@category": "high",
            "@height": "888",
            "@width": "2505",
            "@_fa": "true",
            "$": "https://api.elsevier.com/content/object/eid/1-s2.0-S1381116911000033-gr8_lrg.jpg?httpAccept=%2A%2F%2A",
            "@multimediatype": "JPEG image file",
            "@type": "IMAGE-HIGH-RES",
            "@size": "190007",
            "@ref": "gr8",
            "@mimetype": "image/jpeg"
          },
          {
            "@category": "high",
            "@height": "955",
            "@width": "2488",
            "@_fa": "true",
            "$": "https://api.elsevier.com/content/object/eid/1-s2.0-S1381116911000033-gr7_lrg.jpg?httpAccept=%2A%2F%2A",
            "@multimediatype": "JPEG image file",
            "@type": "IMAGE-HIGH-RES",
            "@size": "214768",
            "@ref": "gr7",
            "@mimetype": "image/jpeg"
          },
          {
            "@category": "high",
            "@height": "1048",
            "@width": "1610",
            "@_fa": "true",
            "$": "https://api.elsevier.com/content/object/eid/1-s2.0-S1381116911000033-gr6_lrg.jpg?httpAccept=%2A%2F%2A",
            "@multimediatype": "JPEG image file",
            "@type": "IMAGE-HIGH-RES",
            "@size": "106106",
            "@ref": "gr6",
            "@mimetype": "image/jpeg"
          },
          {
            "@category": "high",
            "@height": "2012",
            "@width": "1483",
            "@_fa": "true",
            "$": "https://api.elsevier.com/content/object/eid/1-s2.0-S1381116911000033-gr5_lrg.jpg?httpAccept=%2A%2F%2A",
            "@multimediatype": "JPEG image file",
            "@type": "IMAGE-HIGH-RES",
            "@size": "332495",
            "@ref": "gr5",
            "@mimetype": "image/jpeg"
          },
          {
            "@category": "high",
            "@height": "2194",
            "@width": "1607",
            "@_fa": "true",
            "$": "https://api.elsevier.com/content/object/eid/1-s2.0-S1381116911000033-gr4_lrg.jpg?httpAccept=%2A%2F%2A",
            "@multimediatype": "JPEG image file",
            "@type": "IMAGE-HIGH-RES",
            "@size": "365747",
            "@ref": "gr4",
            "@mimetype": "image/jpeg"
          },
          {
            "@category": "high",
            "@height": "1190",
            "@width": "1661",
            "@_fa": "true",
            "$": "https://api.elsevier.com/content/object/eid/1-s2.0-S1381116911000033-gr3_lrg.jpg?httpAccept=%2A%2F%2A",
            "@multimediatype": "JPEG image file",
            "@type": "IMAGE-HIGH-RES",
            "@size": "221572",
            "@ref": "gr3",
            "@mimetype": "image/jpeg"
          },
          {
            "@category": "high",
            "@height": "1382",
            "@width": "3500",
            "@_fa": "true",
            "$": "https://api.elsevier.com/content/object/eid/1-s2.0-S1381116911000033-gr2_lrg.jpg?httpAccept=%2A%2F%2A",
            "@multimediatype": "JPEG image file",
            "@type": "IMAGE-HIGH-RES",
            "@size": "1728366",
            "@ref": "gr2",
            "@mimetype": "image/jpeg"
          },
          {
            "@category": "high",
            "@height": "1062",
            "@width": "1391",
            "@_fa": "true",
            "$": "https://api.elsevier.com/content/object/eid/1-s2.0-S1381116911000033-gr13_lrg.jpg?httpAccept=%2A%2F%2A",
            "@multimediatype": "JPEG image file",
            "@type": "IMAGE-HIGH-RES",
            "@size": "133268",
            "@ref": "gr13",
            "@mimetype": "image/jpeg"
          },
          {
            "@category": "high",
            "@height": "2083",
            "@width": "1538",
            "@_fa": "true",
            "$": "https://api.elsevier.com/content/object/eid/1-s2.0-S1381116911000033-gr12_lrg.jpg?httpAccept=%2A%2F%2A",
            "@multimediatype": "JPEG image file",
            "@type": "IMAGE-HIGH-RES",
            "@size": "268955",
            "@ref": "gr12",
            "@mimetype": "image/jpeg"
          },
          {
            "@category": "high",
            "@height": "924",
            "@width": "2517",
            "@_fa": "true",
            "$": "https://api.elsevier.com/content/object/eid/1-s2.0-S1381116911000033-gr11_lrg.jpg?httpAccept=%2A%2F%2A",
            "@multimediatype": "JPEG image file",
            "@type": "IMAGE-HIGH-RES",
            "@size": "149219",
            "@ref": "gr11",
            "@mimetype": "image/jpeg"
          },
          {
            "@category": "high",
            "@height": "939",
            "@width": "2504",
            "@_fa": "true",
            "$": "https://api.elsevier.com/content/object/eid/1-s2.0-S1381116911000033-gr10_lrg.jpg?httpAccept=%2A%2F%2A",
            "@multimediatype": "JPEG image file",
            "@type": "IMAGE-HIGH-RES",
            "@size": "170596",
            "@ref": "gr10",
            "@mimetype": "image/jpeg"
          },
          {
            "@category": "high",
            "@height": "1382",
            "@width": "3494",
            "@_fa": "true",
            "$": "https://api.elsevier.com/content/object/eid/1-s2.0-S1381116911000033-gr1_lrg.jpg?httpAccept=%2A%2F%2A",
            "@multimediatype": "JPEG image file",
            "@type": "IMAGE-HIGH-RES",
            "@size": "1595124",
            "@ref": "gr1",
            "@mimetype": "image/jpeg"
          },
          {
            "@category": "high",
            "@height": "886",
            "@width": "2213",
            "@_fa": "true",
            "$": "https://api.elsevier.com/content/object/eid/1-s2.0-S1381116911000033-fx1_lrg.jpg?httpAccept=%2A%2F%2A",
            "@multimediatype": "JPEG image file",
            "@type": "IMAGE-HIGH-RES",
            "@size": "126803",
            "@ref": "fx1",
            "@mimetype": "image/jpeg"
          },
          {
            "@category": "standard",
            "@height": "215",
            "@width": "564",
            "@_fa": "true",
            "$": "https://api.elsevier.com/content/object/eid/1-s2.0-S1381116911000033-gr9.jpg?httpAccept=%2A%2F%2A",
            "@multimediatype": "JPEG image file",
            "@type": "IMAGE-DOWNSAMPLED",
            "@size": "35759",
            "@ref": "gr9",
            "@mimetype": "image/jpeg"
          },
          {
            "@category": "standard",
            "@height": "201",
            "@width": "566",
            "@_fa": "true",
            "$": "https://api.elsevier.com/content/object/eid/1-s2.0-S1381116911000033-gr8.jpg?httpAccept=%2A%2F%2A",
            "@multimediatype": "JPEG image file",
            "@type": "IMAGE-DOWNSAMPLED",
            "@size": "33147",
            "@ref": "gr8",
            "@mimetype": "image/jpeg"
          },
          {
            "@category": "standard",
            "@height": "216",
            "@width": "562",
            "@_fa": "true",
            "$": "https://api.elsevier.com/content/object/eid/1-s2.0-S1381116911000033-gr7.jpg?httpAccept=%2A%2F%2A",
            "@multimediatype": "JPEG image file",
            "@type": "IMAGE-DOWNSAMPLED",
            "@size": "27996",
            "@ref": "gr7",
            "@mimetype": "image/jpeg"
          },
          {
            "@category": "standard",
            "@height": "236",
            "@width": "363",
            "@_fa": "true",
            "$": "https://api.elsevier.com/content/object/eid/1-s2.0-S1381116911000033-gr6.jpg?httpAccept=%2A%2F%2A",
            "@multimediatype": "JPEG image file",
            "@type": "IMAGE-DOWNSAMPLED",
            "@size": "13694",
            "@ref": "gr6",
            "@mimetype": "image/jpeg"
          },
          {
            "@category": "standard",
            "@height": "454",
            "@width": "335",
            "@_fa": "true",
            "$": "https://api.elsevier.com/content/object/eid/1-s2.0-S1381116911000033-gr5.jpg?httpAccept=%2A%2F%2A",
            "@multimediatype": "JPEG image file",
            "@type": "IMAGE-DOWNSAMPLED",
            "@size": "34877",
            "@ref": "gr5",
            "@mimetype": "image/jpeg"
          },
          {
            "@category": "standard",
            "@height": "496",
            "@width": "363",
            "@_fa": "true",
            "$": "https://api.elsevier.com/content/object/eid/1-s2.0-S1381116911000033-gr4.jpg?httpAccept=%2A%2F%2A",
            "@multimediatype": "JPEG image file",
            "@type": "IMAGE-DOWNSAMPLED",
            "@size": "38683",
            "@ref": "gr4",
            "@mimetype": "image/jpeg"
          },
          {
            "@category": "standard",
            "@height": "269",
            "@width": "375",
            "@_fa": "true",
            "$": "https://api.elsevier.com/content/object/eid/1-s2.0-S1381116911000033-gr3.jpg?httpAccept=%2A%2F%2A",
            "@multimediatype": "JPEG image file",
            "@type": "IMAGE-DOWNSAMPLED",
            "@size": "30389",
            "@ref": "gr3",
            "@mimetype": "image/jpeg"
          },
          {
            "@category": "standard",
            "@height": "312",
            "@width": "791",
            "@_fa": "true",
            "$": "https://api.elsevier.com/content/object/eid/1-s2.0-S1381116911000033-gr2.jpg?httpAccept=%2A%2F%2A",
            "@multimediatype": "JPEG image file",
            "@type": "IMAGE-DOWNSAMPLED",
            "@size": "123452",
            "@ref": "gr2",
            "@mimetype": "image/jpeg"
          },
          {
            "@category": "standard",
            "@height": "240",
            "@width": "314",
            "@_fa": "true",
            "$": "https://api.elsevier.com/content/object/eid/1-s2.0-S1381116911000033-gr13.jpg?httpAccept=%2A%2F%2A",
            "@multimediatype": "JPEG image file",
            "@type": "IMAGE-DOWNSAMPLED",
            "@size": "16891",
            "@ref": "gr13",
            "@mimetype": "image/jpeg"
          },
          {
            "@category": "standard",
            "@height": "470",
            "@width": "347",
            "@_fa": "true",
            "$": "https://api.elsevier.com/content/object/eid/1-s2.0-S1381116911000033-gr12.jpg?httpAccept=%2A%2F%2A",
            "@multimediatype": "JPEG image file",
            "@type": "IMAGE-DOWNSAMPLED",
            "@size": "32507",
            "@ref": "gr12",
            "@mimetype": "image/jpeg"
          },
          {
            "@category": "standard",
            "@height": "209",
            "@width": "568",
            "@_fa": "true",
            "$": "https://api.elsevier.com/content/object/eid/1-s2.0-S1381116911000033-gr11.jpg?httpAccept=%2A%2F%2A",
            "@multimediatype": "JPEG image file",
            "@type": "IMAGE-DOWNSAMPLED",
            "@size": "19475",
            "@ref": "gr11",
            "@mimetype": "image/jpeg"
          },
          {
            "@category": "standard",
            "@height": "212",
            "@width": "565",
            "@_fa": "true",
            "$": "https://api.elsevier.com/content/object/eid/1-s2.0-S1381116911000033-gr10.jpg?httpAccept=%2A%2F%2A",
            "@multimediatype": "JPEG image file",
            "@type": "IMAGE-DOWNSAMPLED",
            "@size": "32960",
            "@ref": "gr10",
            "@mimetype": "image/jpeg"
          },
          {
            "@category": "standard",
            "@height": "312",
            "@width": "789",
            "@_fa": "true",
            "$": "https://api.elsevier.com/content/object/eid/1-s2.0-S1381116911000033-gr1.jpg?httpAccept=%2A%2F%2A",
            "@multimediatype": "JPEG image file",
            "@type": "IMAGE-DOWNSAMPLED",
            "@size": "117200",
            "@ref": "gr1",
            "@mimetype": "image/jpeg"
          },
          {
            "@category": "standard",
            "@height": "200",
            "@width": "500",
            "@_fa": "true",
            "$": "https://api.elsevier.com/content/object/eid/1-s2.0-S1381116911000033-fx1.jpg?httpAccept=%2A%2F%2A",
            "@multimediatype": "JPEG image file",
            "@type": "IMAGE-DOWNSAMPLED",
            "@size": "14848",
            "@ref": "fx1",
            "@mimetype": "image/jpeg"
          },
          {
            "@category": "thumbnail",
            "@height": "83",
            "@width": "219",
            "@_fa": "true",
            "$": "https://api.elsevier.com/content/object/eid/1-s2.0-S1381116911000033-gr9.sml?httpAccept=%2A%2F%2A",
            "@multimediatype": "GIF image file",
            "@type": "IMAGE-THUMBNAIL",
            "@size": "3237",
            "@ref": "gr9",
            "@mimetype": "image/gif"
          },
          {
            "@category": "thumbnail",
            "@height": "78",
            "@width": "219",
            "@_fa": "true",
            "$": "https://api.elsevier.com/content/object/eid/1-s2.0-S1381116911000033-gr8.sml?httpAccept=%2A%2F%2A",
            "@multimediatype": "GIF image file",
            "@type": "IMAGE-THUMBNAIL",
            "@size": "2592",
            "@ref": "gr8",
            "@mimetype": "image/gif"
          },
          {
            "@category": "thumbnail",
            "@height": "84",
            "@width": "219",
            "@_fa": "true",
            "$": "https://api.elsevier.com/content/object/eid/1-s2.0-S1381116911000033-gr7.sml?httpAccept=%2A%2F%2A",
            "@multimediatype": "GIF image file",
            "@type": "IMAGE-THUMBNAIL",
            "@size": "3934",
            "@ref": "gr7",
            "@mimetype": "image/gif"
          },
          {
            "@category": "thumbnail",
            "@height": "143",
            "@width": "219",
            "@_fa": "true",
            "$": "https://api.elsevier.com/content/object/eid/1-s2.0-S1381116911000033-gr6.sml?httpAccept=%2A%2F%2A",
            "@multimediatype": "GIF image file",
            "@type": "IMAGE-THUMBNAIL",
            "@size": "3732",
            "@ref": "gr6",
            "@mimetype": "image/gif"
          },
          {
            "@category": "thumbnail",
            "@height": "164",
            "@width": "121",
            "@_fa": "true",
            "$": "https://api.elsevier.com/content/object/eid/1-s2.0-S1381116911000033-gr5.sml?httpAccept=%2A%2F%2A",
            "@multimediatype": "GIF image file",
            "@type": "IMAGE-THUMBNAIL",
            "@size": "3802",
            "@ref": "gr5",
            "@mimetype": "image/gif"
          },
          {
            "@category": "thumbnail",
            "@height": "164",
            "@width": "120",
            "@_fa": "true",
            "$": "https://api.elsevier.com/content/object/eid/1-s2.0-S1381116911000033-gr4.sml?httpAccept=%2A%2F%2A",
            "@multimediatype": "GIF image file",
            "@type": "IMAGE-THUMBNAIL",
            "@size": "4001",
            "@ref": "gr4",
            "@mimetype": "image/gif"
          },
          {
            "@category": "thumbnail",
            "@height": "157",
            "@width": "219",
            "@_fa": "true",
            "$": "https://api.elsevier.com/content/object/eid/1-s2.0-S1381116911000033-gr3.sml?httpAccept=%2A%2F%2A",
            "@multimediatype": "GIF image file",
            "@type": "IMAGE-THUMBNAIL",
            "@size": "7250",
            "@ref": "gr3",
            "@mimetype": "image/gif"
          },
          {
            "@category": "thumbnail",
            "@height": "86",
            "@width": "219",
            "@_fa": "true",
            "$": "https://api.elsevier.com/content/object/eid/1-s2.0-S1381116911000033-gr2.sml?httpAccept=%2A%2F%2A",
            "@multimediatype": "GIF image file",
            "@type": "IMAGE-THUMBNAIL",
            "@size": "6545",
            "@ref": "gr2",
            "@mimetype": "image/gif"
          },
          {
            "@category": "thumbnail",
            "@height": "164",
            "@width": "215",
            "@_fa": "true",
            "$": "https://api.elsevier.com/content/object/eid/1-s2.0-S1381116911000033-gr13.sml?httpAccept=%2A%2F%2A",
            "@multimediatype": "GIF image file",
            "@type": "IMAGE-THUMBNAIL",
            "@size": "5155",
            "@ref": "gr13",
            "@mimetype": "image/gif"
          },
          {
            "@category": "thumbnail",
            "@height": "164",
            "@width": "121",
            "@_fa": "true",
            "$": "https://api.elsevier.com/content/object/eid/1-s2.0-S1381116911000033-gr12.sml?httpAccept=%2A%2F%2A",
            "@multimediatype": "GIF image file",
            "@type": "IMAGE-THUMBNAIL",
            "@size": "3721",
            "@ref": "gr12",
            "@mimetype": "image/gif"
          },
          {
            "@category": "thumbnail",
            "@height": "80",
            "@width": "219",
            "@_fa": "true",
            "$": "https://api.elsevier.com/content/object/eid/1-s2.0-S1381116911000033-gr11.sml?httpAccept=%2A%2F%2A",
            "@multimediatype": "GIF image file",
            "@type": "IMAGE-THUMBNAIL",
            "@size": "4272",
            "@ref": "gr11",
            "@mimetype": "image/gif"
          },
          {
            "@category": "thumbnail",
            "@height": "82",
            "@width": "219",
            "@_fa": "true",
            "$": "https://api.elsevier.com/content/object/eid/1-s2.0-S1381116911000033-gr10.sml?httpAccept=%2A%2F%2A",
            "@multimediatype": "GIF image file",
            "@type": "IMAGE-THUMBNAIL",
            "@size": "2416",
            "@ref": "gr10",
            "@mimetype": "image/gif"
          },
          {
            "@category": "thumbnail",
            "@height": "87",
            "@width": "219",
            "@_fa": "true",
            "$": "https://api.elsevier.com/content/object/eid/1-s2.0-S1381116911000033-gr1.sml?httpAccept=%2A%2F%2A",
            "@multimediatype": "GIF image file",
            "@type": "IMAGE-THUMBNAIL",
            "@size": "6431",
            "@ref": "gr1",
            "@mimetype": "image/gif"
          },
          {
            "@category": "thumbnail",
            "@height": "88",
            "@width": "219",
            "@_fa": "true",
            "$": "https://api.elsevier.com/content/object/eid/1-s2.0-S1381116911000033-fx1.sml?httpAccept=%2A%2F%2A",
            "@multimediatype": "GIF image file",
            "@type": "IMAGE-THUMBNAIL",
            "@size": "2892",
            "@ref": "fx1",
            "@mimetype": "image/gif"
          }
        ]
      },
      "link": {
        "@rel": "abstract",
        "@href": "https://api.elsevier.com/content/abstract/scopus_id/79951682263"
      }
    }
  }
}