{
  "metadata": {
    "title": "Sulfonated organic heteropolyacid salts: Recyclable green solid catalysts for esterifications",
    "authors": "; ; ",
    "journal": "Journal of Molecular Catalysis A: Chemical",
    "date": "2009-11-02",
    "doi": "10.1016/j.molcata.2009.08.011",
    "abstract": "",
    "uri": "https://api.elsevier.com/content/article/pii/S1381116909003744",
    "pii": "S1381116909003744"
  },
  "fulltext": {
    "full-text-retrieval-response": {
      "scopus-eid": "2-s2.0-70349156347",
      "originalText": "serial JL 271358 291210 291744 291790 291809 31 Journal of Molecular Catalysis A: Chemical JOURNALMOLECULARCATALYSISACHEMICAL 2009-08-22 2009-08-22 2010-04-16T17:45:36 1-s2.0-S1381116909003744 S1381-1169(09)00374-4 S1381116909003744 10.1016/j.molcata.2009.08.011 S300 S300.1 FULL-TEXT 1-s2.0-S1381116909X00154 2015-05-15T05:56:33.307883-04:00 0 0 20091102 2009 2009-08-22T00:00:00Z articleinfo crossmark dco dateupdated tomb dateloaded datesearch indexeddate issuelist volumelist yearnav absattachment articletitlenorm authfirstinitialnorm authfirstsurnamenorm cid cids contenttype copyright dateloadedtxt docsubtype doctype doi eid ewtransactionid hubeid issfirst issn issnnorm itemstage itemtransactionid itemweight openaccess openarchive pg pgfirst pglast pii piinorm pubdatestart pubdatetxt pubyr sectiontitle sortorder srctitle srctitlenorm srctype subheadings volfirst volissue webpdf webpdfpagecount figure table body acknowledge affil articletitle auth authfirstini authfull authkeywords authlast primabst pubtype ref specialabst alllist content subj ssids 1381-1169 13811169 313 313 1 2 1 2 Volume 313, Issues 1–2 3 1 6 1 6 20091102 2 November 2009 2009-11-02 2009 Editor's choice article fla Copyright © 2009 Elsevier B.V. All rights reserved. SULFONATEDORGANICHETEROPOLYACIDSALTSRECYCLABLEGREENSOLIDCATALYSTSFORESTERIFICATIONS LENG Y 1 Introduction 2 Experimental 2.1 Materials and methods 2.2 Syntheses of organic HPA salt catalysts 2.3 Procedure for esterification reactions 3 Results and discussion 3.1 Characterization of PS functionalized organic-phosphotungstate hybrids by FT-IR 3.2 Effect of reaction conditions 3.3 Effect of organic cations in catalysts on esterification of acetic acid with n-butanol 3.4 Effect of heteropolyanions in catalysts on esterification of acetic acid with n-butanol 3.5 Catalytic performance of 1 in various esterification reactions 3.6 Catalyst recoverability and reusability 4 Conclusion Acknowledgement References KOZHEVNIKOV 1996 287 298 I LIU 2004 51 60 Q MUKAI 2001 779 804 S BORDOLOI 2007 166 175 A WEI 2009 58 63 R KLEMPERER 1998 297 306 W ZHANG 2005 3 4 F WANG 2005 266 275 X MARGOLESE 2000 2448 2459 D LONG 2009 817 847 Y WELTON 2004 2459 2477 T RICKERT 2007 529 531 P MATSUMOTO 2008 239 243 T LENG 2008 335 339 Y LENG 2009 168 171 Y XIAO 2007 4669 4677 D GOZZO 2004 6187 6193 F CONSORTI 2005 4341 4349 C DAS 2007 248 254 J ZHANG 2007 1208 1211 H FANG 2006 7982 7984 D XING 2005 4147 4150 H GU 2004 71 75 Y COLE 2002 5962 5963 A KOZHEVNIKOV 1983 135 150 I TSIGDINOS 1978 1 64 G FURUTA 1979 31 34 M MISONO 1987 269 321 M MISONO 1988 339 340 M OKUHARA 1996 113 252 T MISONO 2001 1141 1152 M IZUMI 1992 Y ZEOLITE MISONO 1992 63 72 M MIZUNO 1998 199 218 N SASAKI 2005 2506 2508 T MEHNERT 2002 12932 12933 C GU 2006 7217 7220 Y DENG 2001 33 36 Y SAWANT 2007 150 157 D LENGX2009X1 LENGX2009X1X6 LENGX2009X1XY LENGX2009X1X6XY item S1381-1169(09)00374-4 S1381116909003744 1-s2.0-S1381116909003744 10.1016/j.molcata.2009.08.011 271358 2010-09-21T22:48:09.491967-04:00 2009-11-02 1-s2.0-S1381116909003744-main.pdf https://s3.amazonaws.com/prod-ucs-content-store-us-east/content/pii:S1381116909003744/MAIN/application/pdf/48241a55d5cf2ea208b20fe7bf55fd14/main.pdf https://s3-eu-west-1.amazonaws.com/prod-ucs-content-store-eu-west/content/pii:S1381116909003744/MAIN/application/pdf/48241a55d5cf2ea208b20fe7bf55fd14/main.pdf main.pdf pdf true 584845 MAIN 6 1-s2.0-S1381116909003744-main_1.png https://s3-eu-west-1.amazonaws.com/prod-ucs-content-store-eu-west/content/pii:S1381116909003744/PREVIEW/image/png/5a5f34c15d3ad24ddc01783dd1d69128/main_1.png https://s3.amazonaws.com/prod-ucs-content-store-us-east/content/pii:S1381116909003744/PREVIEW/image/png/5a5f34c15d3ad24ddc01783dd1d69128/main_1.png main_1.png png 60411 849 656 IMAGE-WEB-PDF 1 1-s2.0-S1381116909003744-sc1.jpg https://s3.amazonaws.com/prod-ucs-content-store-us-east/content/pii:S1381116909003744/sc1/DOWNSAMPLED/image/jpeg/d4d3ca3136bf5a702ead964dc30de2b0/sc1.jpg https://s3-eu-west-1.amazonaws.com/prod-ucs-content-store-eu-west/content/pii:S1381116909003744/sc1/DOWNSAMPLED/image/jpeg/d4d3ca3136bf5a702ead964dc30de2b0/sc1.jpg sc1 sc1.jpg jpg 26141 215 659 IMAGE-DOWNSAMPLED 1-s2.0-S1381116909003744-sc1.sml https://s3.amazonaws.com/prod-ucs-content-store-us-east/content/pii:S1381116909003744/sc1/THUMBNAIL/image/gif/62e2fc0887311b7742d88b2b66106f79/sc1.sml https://s3-eu-west-1.amazonaws.com/prod-ucs-content-store-eu-west/content/pii:S1381116909003744/sc1/THUMBNAIL/image/gif/62e2fc0887311b7742d88b2b66106f79/sc1.sml sc1 sc1.sml sml 1946 71 219 IMAGE-THUMBNAIL 1-s2.0-S1381116909003744-sc2.jpg https://s3.amazonaws.com/prod-ucs-content-store-us-east/content/pii:S1381116909003744/sc2/DOWNSAMPLED/image/jpeg/2d2523e824478b0060d81eea850a98de/sc2.jpg https://s3-eu-west-1.amazonaws.com/prod-ucs-content-store-eu-west/content/pii:S1381116909003744/sc2/DOWNSAMPLED/image/jpeg/2d2523e824478b0060d81eea850a98de/sc2.jpg sc2 sc2.jpg jpg 3933 31 327 IMAGE-DOWNSAMPLED 1-s2.0-S1381116909003744-sc2.sml https://s3.amazonaws.com/prod-ucs-content-store-us-east/content/pii:S1381116909003744/sc2/THUMBNAIL/image/gif/18f304c6758ebcd9b1402b2c78067601/sc2.sml https://s3-eu-west-1.amazonaws.com/prod-ucs-content-store-eu-west/content/pii:S1381116909003744/sc2/THUMBNAIL/image/gif/18f304c6758ebcd9b1402b2c78067601/sc2.sml sc2 sc2.sml sml 929 21 219 IMAGE-THUMBNAIL 1-s2.0-S1381116909003744-gr1.jpg https://s3.amazonaws.com/prod-ucs-content-store-us-east/content/pii:S1381116909003744/gr1/DOWNSAMPLED/image/jpeg/03df421f5eecb453cf745bbe4135d4cb/gr1.jpg https://s3-eu-west-1.amazonaws.com/prod-ucs-content-store-eu-west/content/pii:S1381116909003744/gr1/DOWNSAMPLED/image/jpeg/03df421f5eecb453cf745bbe4135d4cb/gr1.jpg gr1 gr1.jpg jpg 25856 309 371 IMAGE-DOWNSAMPLED 1-s2.0-S1381116909003744-gr1.sml https://s3.amazonaws.com/prod-ucs-content-store-us-east/content/pii:S1381116909003744/gr1/THUMBNAIL/image/gif/a31919ab7e7d94f9d149cdda3a05a829/gr1.sml https://s3-eu-west-1.amazonaws.com/prod-ucs-content-store-eu-west/content/pii:S1381116909003744/gr1/THUMBNAIL/image/gif/a31919ab7e7d94f9d149cdda3a05a829/gr1.sml gr1 gr1.sml sml 4027 163 196 IMAGE-THUMBNAIL 1-s2.0-S1381116909003744-gr2.jpg https://s3.amazonaws.com/prod-ucs-content-store-us-east/content/pii:S1381116909003744/gr2/DOWNSAMPLED/image/jpeg/4ae2e2dee867b61e0678e1188fe20de9/gr2.jpg https://s3-eu-west-1.amazonaws.com/prod-ucs-content-store-eu-west/content/pii:S1381116909003744/gr2/DOWNSAMPLED/image/jpeg/4ae2e2dee867b61e0678e1188fe20de9/gr2.jpg gr2 gr2.jpg jpg 8546 274 372 IMAGE-DOWNSAMPLED 1-s2.0-S1381116909003744-gr2.sml https://s3.amazonaws.com/prod-ucs-content-store-us-east/content/pii:S1381116909003744/gr2/THUMBNAIL/image/gif/6fec88948b7f407cbc48a9aec4d08c4b/gr2.sml https://s3-eu-west-1.amazonaws.com/prod-ucs-content-store-eu-west/content/pii:S1381116909003744/gr2/THUMBNAIL/image/gif/6fec88948b7f407cbc48a9aec4d08c4b/gr2.sml gr2 gr2.sml sml 1702 161 219 IMAGE-THUMBNAIL 1-s2.0-S1381116909003744-gr3.jpg https://s3.amazonaws.com/prod-ucs-content-store-us-east/content/pii:S1381116909003744/gr3/DOWNSAMPLED/image/jpeg/223d1b7cef7834536918a198e18d4f15/gr3.jpg https://s3-eu-west-1.amazonaws.com/prod-ucs-content-store-eu-west/content/pii:S1381116909003744/gr3/DOWNSAMPLED/image/jpeg/223d1b7cef7834536918a198e18d4f15/gr3.jpg gr3 gr3.jpg jpg 10538 280 369 IMAGE-DOWNSAMPLED 1-s2.0-S1381116909003744-gr3.sml https://s3.amazonaws.com/prod-ucs-content-store-us-east/content/pii:S1381116909003744/gr3/THUMBNAIL/image/gif/6ba956bfbaa0b92f7d01f0ab30b96e10/gr3.sml https://s3-eu-west-1.amazonaws.com/prod-ucs-content-store-eu-west/content/pii:S1381116909003744/gr3/THUMBNAIL/image/gif/6ba956bfbaa0b92f7d01f0ab30b96e10/gr3.sml gr3 gr3.sml sml 2063 164 216 IMAGE-THUMBNAIL 1-s2.0-S1381116909003744-gr4.jpg https://s3.amazonaws.com/prod-ucs-content-store-us-east/content/pii:S1381116909003744/gr4/DOWNSAMPLED/image/jpeg/a69f077c96299b3fb2f1b5233a9a2266/gr4.jpg https://s3-eu-west-1.amazonaws.com/prod-ucs-content-store-eu-west/content/pii:S1381116909003744/gr4/DOWNSAMPLED/image/jpeg/a69f077c96299b3fb2f1b5233a9a2266/gr4.jpg gr4 gr4.jpg jpg 9774 283 367 IMAGE-DOWNSAMPLED 1-s2.0-S1381116909003744-gr4.sml https://s3.amazonaws.com/prod-ucs-content-store-us-east/content/pii:S1381116909003744/gr4/THUMBNAIL/image/gif/d3781acb5101bd3cbda971f864944d1c/gr4.sml https://s3-eu-west-1.amazonaws.com/prod-ucs-content-store-eu-west/content/pii:S1381116909003744/gr4/THUMBNAIL/image/gif/d3781acb5101bd3cbda971f864944d1c/gr4.sml gr4 gr4.sml sml 1932 164 213 IMAGE-THUMBNAIL 1-s2.0-S1381116909003744-gr5.jpg https://s3.amazonaws.com/prod-ucs-content-store-us-east/content/pii:S1381116909003744/gr5/DOWNSAMPLED/image/jpeg/db0874fa25e29a10c5e3f01be3b6cb6d/gr5.jpg https://s3-eu-west-1.amazonaws.com/prod-ucs-content-store-eu-west/content/pii:S1381116909003744/gr5/DOWNSAMPLED/image/jpeg/db0874fa25e29a10c5e3f01be3b6cb6d/gr5.jpg gr5 gr5.jpg jpg 11485 282 371 IMAGE-DOWNSAMPLED 1-s2.0-S1381116909003744-gr5.sml https://s3.amazonaws.com/prod-ucs-content-store-us-east/content/pii:S1381116909003744/gr5/THUMBNAIL/image/gif/85dc62904d4d3a8c9cc4b2a57f77fad2/gr5.sml https://s3-eu-west-1.amazonaws.com/prod-ucs-content-store-eu-west/content/pii:S1381116909003744/gr5/THUMBNAIL/image/gif/85dc62904d4d3a8c9cc4b2a57f77fad2/gr5.sml gr5 gr5.sml sml 2203 164 215 IMAGE-THUMBNAIL 1-s2.0-S1381116909003744-gr6.jpg https://s3.amazonaws.com/prod-ucs-content-store-us-east/content/pii:S1381116909003744/gr6/DOWNSAMPLED/image/jpeg/ea59eb63818a230060c7a39808b05c12/gr6.jpg https://s3-eu-west-1.amazonaws.com/prod-ucs-content-store-eu-west/content/pii:S1381116909003744/gr6/DOWNSAMPLED/image/jpeg/ea59eb63818a230060c7a39808b05c12/gr6.jpg gr6 gr6.jpg jpg 42377 215 336 IMAGE-DOWNSAMPLED 1-s2.0-S1381116909003744-gr6.sml https://s3.amazonaws.com/prod-ucs-content-store-us-east/content/pii:S1381116909003744/gr6/THUMBNAIL/image/gif/8ea9b72db45638477c9bcadfd2ed8218/gr6.sml https://s3-eu-west-1.amazonaws.com/prod-ucs-content-store-eu-west/content/pii:S1381116909003744/gr6/THUMBNAIL/image/gif/8ea9b72db45638477c9bcadfd2ed8218/gr6.sml gr6 gr6.sml sml 7627 140 219 IMAGE-THUMBNAIL 1-s2.0-S1381116909003744-gr7.jpg https://s3.amazonaws.com/prod-ucs-content-store-us-east/content/pii:S1381116909003744/gr7/DOWNSAMPLED/image/jpeg/964b8ca03393d8996d7ac849fe3dd884/gr7.jpg https://s3-eu-west-1.amazonaws.com/prod-ucs-content-store-eu-west/content/pii:S1381116909003744/gr7/DOWNSAMPLED/image/jpeg/964b8ca03393d8996d7ac849fe3dd884/gr7.jpg gr7 gr7.jpg jpg 9837 281 366 IMAGE-DOWNSAMPLED 1-s2.0-S1381116909003744-gr7.sml https://s3.amazonaws.com/prod-ucs-content-store-us-east/content/pii:S1381116909003744/gr7/THUMBNAIL/image/gif/b4d8a00232050d19ef1581bc09d3fc67/gr7.sml https://s3-eu-west-1.amazonaws.com/prod-ucs-content-store-eu-west/content/pii:S1381116909003744/gr7/THUMBNAIL/image/gif/b4d8a00232050d19ef1581bc09d3fc67/gr7.sml gr7 gr7.sml sml 1869 164 213 IMAGE-THUMBNAIL 1-s2.0-S1381116909003744-gr8.jpg https://s3.amazonaws.com/prod-ucs-content-store-us-east/content/pii:S1381116909003744/gr8/DOWNSAMPLED/image/jpeg/ebe25146e8040593439413d36e5ee74c/gr8.jpg https://s3-eu-west-1.amazonaws.com/prod-ucs-content-store-eu-west/content/pii:S1381116909003744/gr8/DOWNSAMPLED/image/jpeg/ebe25146e8040593439413d36e5ee74c/gr8.jpg gr8 gr8.jpg jpg 18635 365 320 IMAGE-DOWNSAMPLED 1-s2.0-S1381116909003744-gr8.sml https://s3.amazonaws.com/prod-ucs-content-store-us-east/content/pii:S1381116909003744/gr8/THUMBNAIL/image/gif/b5f7f6da01d145531fd0356facf1f372/gr8.sml https://s3-eu-west-1.amazonaws.com/prod-ucs-content-store-eu-west/content/pii:S1381116909003744/gr8/THUMBNAIL/image/gif/b5f7f6da01d145531fd0356facf1f372/gr8.sml gr8 gr8.sml sml 2738 163 143 IMAGE-THUMBNAIL 1-s2.0-S1381116909003744-fx1.jpg https://s3.amazonaws.com/prod-ucs-content-store-us-east/content/pii:S1381116909003744/fx1/DOWNSAMPLED/image/jpeg/a96660247ccd243debd97dabd2eb8ca0/fx1.jpg https://s3-eu-west-1.amazonaws.com/prod-ucs-content-store-eu-west/content/pii:S1381116909003744/fx1/DOWNSAMPLED/image/jpeg/a96660247ccd243debd97dabd2eb8ca0/fx1.jpg fx1 true fx1.jpg jpg 45609 187 594 IMAGE-DOWNSAMPLED 1-s2.0-S1381116909003744-fx1.sml https://s3.amazonaws.com/prod-ucs-content-store-us-east/content/pii:S1381116909003744/fx1/THUMBNAIL/image/gif/eb90715ea6d6fe87e9ad2d69914e5c44/fx1.sml https://s3-eu-west-1.amazonaws.com/prod-ucs-content-store-eu-west/content/pii:S1381116909003744/fx1/THUMBNAIL/image/gif/eb90715ea6d6fe87e9ad2d69914e5c44/fx1.sml fx1 true fx1.sml sml 3901 69 219 IMAGE-THUMBNAIL MOLCAA 7624 S1381-1169(09)00374-4 10.1016/j.molcata.2009.08.011 Elsevier B.V. Scheme 1 Syntheses of catalysts. Scheme 2 Esterification of monocarboxylic acid with monohydric alcohol. Fig. 1 FT-IR spectra for hybrid catalysts and pure phosphotungstic acid, (a) 3, (b) 2, (c) 1 and (d) H3PW12O40. Fig. 2 Effect of molar ratio of alcohol to acid on the yield of butyl acetate in the esterification over 1. Fig. 3 Effect of reaction temperature on the yield of butyl acetate in the esterification over 1. Fig. 4 Effect of reaction time on the yield of butyl acetate in the esterification over 1. Fig. 5 Effect of catalyst amount on the yield of butyl acetate in the esterification over 1. Fig. 6 Schematic diagram of the esterification of acetic acid with n-butanol over the organic HPA salt catalyst. Fig. 7 Catalytic reusability of 1 for the esterificaion of acetic acid with n-butanol. Fig. 8 The FT-IR spectra of (a) fresh 1 catalyst, (b) recovered 1 catalyst after the seventh run. Table 1 Esterification of acetic acid with n-butanol over various catalysts with different organic cations a . Entry Catalyst Reaction phenomenon Yield (%) b 1 Without catalyst Homogeneous 37.7 2 H3PW12O40 Homogeneous 88.2 3 [MIM]3PW12O40 Heterogeneous (liquid–solid) 38.8 4 [TEA]3PW12O40 Heterogeneous (liquid–solid) 41.9 5 [Py]3PW12O40 Heterogeneous (liquid–solid) 39.0 6 [MIMPS]3PW12O40 Heterogeneous (liquid–liquid) 94.5 7 [TEAPS]3PW12O40 Heterogeneous (liquid–liquid) 95.2 8 [PyPS]3PW12O40 Heterogeneous (liquid–liquid) 94.3 a Reaction conditions: catalyst (0.06mmol), acetic acid (30mmol), n alcohol:n acid (1.2:1), 110°C, 1.5h, with water segregator. b Yield of butyl acetate based on acetic acid. Table 2 Esterification of acetic acid with n-butanol over various catalysts with different inorganic anions a . Entry Catalyst Reaction phenomenon Yield (%) b 1 H3PW12O40 Homogeneous 88.2 2 H4SiW12O40 Homogeneous 79.4 3 H3PMo12O40 Homogeneous 87.0 4 [MIMPS]3PW12O40 Heterogeneous (liquid–liquid) 94.5 5 [MIMPS]3PMo12O40 Heterogeneous (liquid–liquid) 96.1 6 [MIMPS]4SiW12O40 Heterogeneous (liquid–liquid) 90.2 7 c [MIMPS]HSO4 Homogeneous 65.6 a Reaction conditions: catalyst (0.06mmol), acetic acid (30mmol), n alcohol:n acid (1.2:1), 110°C, 1.5h, with water segregator. b Yield of butyl acetate based on acetic acid. c Catalyst amount 0.33mmol. Table 3 Results of different esterifications of monocarboxylic acids with monohydric alcohols over 1 a . Entry Carboxylic acid (A) Alcohol (B) Temperature (°C) Time (h) n B:n A Yield (%) b Selectivity (%) c 1 Acetic acid Benzyl alcohol 110 3 1:1.2 69.2 100 2 Acetic acid Dodecanol 110 2 1:1.4 94.6 100 3 Acetic acid Ethanol 90 1.5 1.2:1 83.6 100 4 Acetic acid n-Octanol 110 2 1.2:1 93.2 100 5 Acetic acid n-Butanol 110 1.5 1.2:1 94.5 100 6 Lauric acid n-Butanol 120 2 1.2:1 91.4 100 7 Palmitic acid n-Butanol 120 3 1.2:1 87.5 100 8 Benzoic acid n-Butanol 130 4 3:1 82.1 100 9 Lactic acid n-Butanol 110 2 3:1 85.5 100 10 Mandelic acid n-Butanol 120 3 4:1 95.2 100 a Reaction conditions: catalyst 1 (0.06mmol), carboxylic acid (30mmol), entries 1 and 2 alcohol (30mmol), with water segregator; other conditions such as temperature, time and molar ratio of the two reactants were optimal ones for the individual reaction. b Yield for the ester based on carboxylic acid, entries 1 and 2 based on alcohol. c Selectivity for ester. Editor's choice paper Sulfonated organic heteropolyacid salts: Recyclable green solid catalysts for esterifications Yan Leng Jun Wang ⁎ Dunru Zhu Yajing Wu Pingping Zhao State Key Laboratory of Materials-Oriented Chemical Engineering, College of Chemistry and Chemical Engineering, Nanjing University of Technology, Nanjing 210009, PR China ⁎ Corresponding author. Tel.: +86 25 83172264; fax: +86 25 83172261. Graphical abstract In the esterification of monocarboxylic acid with monohydric alcohol, propane sulfonate functionalized organic heteropolyacid (HPA) salts act as heterogeneous catalysts presenting high activity, easy recover and well reuse. The green process is mostly due to the solid nature and pseudoliquid behaviour of HPA salts, making the functional acidic species in the bulk of salts to fully act as active centers for the reactions. A family of solid organic heteropolyacid (HPA) salts were prepared by combining Keggin heteropolyanions with ionic liquid (IL)-forming cations functionalized by propane sulfonate (PS). Their catalytic activities were evaluated in esterifications, including the testing of the influence of organic cations, function of heteropolyanions, scope of reactions, optimization of reaction conditions, and catalytic reusability. The obtained catalysts caused a liquid–liquid biphasic esterification system, presenting high yield and selectivity for target esters, and after reaction, they appeared in solid state again, which could be easily recovered and quite steadily reused demonstrated by a seven-run recycling test. The highly efficient and environmentally benign performance of this family of catalysts is due to the pseudoliquid behavior of HPA salts that allows PS acidic species in the bulk of the heteropoly compound acting fully as active centers for esterification, as well as the stabilization function of heteropolyanion on carbonium ion intermediates created at acid sites. Keywords Esterification Heteropolyacid salt Ionic liquids Organic–inorganic hybrids 1 Introduction Heteropolyacids (HPAs) can be used as catalysts for numerous organic reactions because of their unique acidic and redox properties, nevertheless, the low surface areas (<10m2/g) as solid catalysts and high solubility in polar reaction media largely hinder their practical utilizations [1]. To overcome these disadvantages, HPAs have been impregnated onto or encapsulated into porous carriers with high surface areas, such as silica, active carbon, zeolite, and so on [2–5]; however, these systems suffer from the high mass transfer resistance, the leaching of HPA active phase, or the tendency to deactivation. Another solution is to prepare water-tolerant HPA salts with considerable high surface areas (>100m2/g) by partially exchanging protons of the parent HPA with large inorganic cations like Cs+, K+, Rb+ and NH4 [6], which still suffers from operation difficulties due to their small particle sizes [7]. Therefore, new modifications for HPA catalysts rather than the above mentioned routine approaches are greatly desired to broaden its catalytic applications. Organic–inorganic hybrid materials have been a great deal of research interest in the field of nanoelectronics, sensing, adsorption and catalysis due to the flexible tailorability of both organic and inorganic groups. Among them, organic-functionalized silica and ionic liquids (ILs) are good examples [8–13]. It is known that ILs are formed by combining organic cations with inorganic anions through ionic linkage, with the inorganic anions always being univalent. On the other hand, the combination of organic species with HPAs can cause the formation of HPAs-based hybrid materials that are emerging to be very important in catalysis [14]. These previous findings stimulate us to make the combination of propane sulfonate (PS) functionalized organic cations with Keggin heteropolyanions with high valence, and the preliminary results have been recently reported as a communication [15]. We find that thus produced organic–inorganic hybrid materials are a family of new HPA salts with three IL-forming cations bonded ionically to an inorganic heteropolyanion. Nevertheless, they are not conventional ILs because their melting points are above 100°C. When the solid hybrids were used as catalysts for the esterification with one of reactants being a polycarboxylic acid or polyol, they acted as “reaction induced self-separation catalysts” due to their good solubility in reactants and nonmiscibility with ester product. However, one may want to know what would happen when they are used as catalysts in esterifications of monocarboxylic acids with monohydric alcohols. In this study, we report in detail the catalytic behavior of the PS functionalized organic-heteropolyanion hybrid materials in many of such common esterifications, mostly taking the esterification of acetic acid with n-butanol as a model reaction. The hybrids are revealed to be highly efficient green catalysts that can be easily recovered and quite steadily reused, with the catalyst's structure substantially unchanged. 2 Experimental 2.1 Materials and methods All chemicals were of analytical grade and used as received. FT-IR spectra for samples in KBr discs were recorded on a Nicolet 360 FT-IR instrument in 4000–400cm−1 region. The concentration of reactants and product was directly measured by the gas chromatography (GC SP-6890, Lunan Ruihong of China). 2.2 Syntheses of organic HPA salt catalysts 1–3: The organic HPA salts were synthesized following the procedure in Scheme 1 according to our previous work [15]. For 1, methylimidazole (9.02g, 0.11mol) and 1,3-propanesultone (12.21g, 0.10mol) were dissolved in toluene (100mL) and stirred at 50°C for 24h under nitrogen atmosphere. A white precipitate (MIMPS) formed; it was filtered and washed with ether for three times, then dried in a vacuum. The resulting MIMPS (1.23g, 0.006mol) was added to the aqueous solution of H3PW12O40 (5.76g, 0.002mol), followed by the stirring of the mixture at room temperature for 24h. Water was removed in vacuum to give the final product as solid. [PyPS]3PW12O40 (2), [TEAPS]3PW12O40 (3), [MIMPS]4SiW12O40, [MIMPS]3PMo12O40, [TEA]3PW12O40, [MIM]3PW12O40, and [Py]3PW12O40 were prepared based on the same method. 2.3 Procedure for esterification reactions Taking the esterification of acetic acid with n-butanol as an example, the typical procedure for esterification reactions is as follows (see Scheme 2 ): acetic acid (1.80g, 30mmol), n-butanol (2.67g, 36mmol), and catalyst 1 (0.20g, 0.06mmol) were added to a round-bottomed flask with a water segregator (for a control test, the water segregator was not used). The resulting solution was refluxed at 110°C for 1.5h with vigorous stirring. The reaction mixture was cooled to room temperature. The top liquid layer was analyzed using the gas chromatography. Reaction conditions were changed to optimize the yield of ester. For other esterification reactions, the test was carried out accordingly. Exceptionally, for esterifications of acetic acid with benzyl alcohol, acetic acid with dodecanol and acetic acid with n-octanol, toluene was added as the water-carrying agent, and for esterification of acetic acid with ethanol, cyclohexane was added as the water-carrying agent. 3 Results and discussion 3.1 Characterization of PS functionalized organic-phosphotungstate hybrids by FT-IR Spectra of 1H NMR, 13C NMR and ESI-MS for the PS functionalized organic-phosphotungstate hybrids, [MIMPS]3PW12O40 (1), [PyPS]3PW12O40 (2) and [TEAPS]3PW12O40 (3), were shown in the supporting information of our previous report [15], which demonstrated that the hybrid materials are HPA salts formed by the ionic bonding of three conventional IL-forming cations with an inorganic heteropolyanion. In this work, their FT-IR spectra are illustrated in Fig. 1 , comparing with that of the neat H3PW12O40. It can be seen that in wavenumber region of 800–1100cm−1, H3PW12O40 gave four featured peaks (1080 (P–Oa), 984 (W=Od), 889 (W–Ob–W) (corner-sharing), and 806cm−1 (W–Oc–W) (edge-sharing)) assigned to the Keggin structure. For all the hybrid samples, in spite of the decrease of peak intensities and slight shift of peak positions, the four peaks appeared distinctively, which indicates that the Keggin structure of heteropolyanion was well reserved after the protons in the HPA were substituted by the organic cations. On the other hand, SO stretching vibrations at 1230 and 1170cm−1 were detected to verify the presence of sulfonic groups in catalysts. Furthermore, the hybrids exhibited the featured bands for organic groups, respectively; for example, 1 showed a band at 619cm−1 that is attributed to the bending vibration of the C–H bond in imidazole fragment, 2 gave a peak at 679cm−1 due to the bending vibration of the C–H bond in pyridine, and 3 displayed two bands at 1485 and 1400cm−1 because of the stretching vibration of the C–C bond and bending vibration of the C–H bond, respectively. These observations again confirm that the combination of PS functionalized organic cations with heteropolyanions via ionic linkage produces a new family of organic HPA salts, the composition of which is very similar to that of ILs. The nature of ILs depends on the three-dimensional network of anions and cations by weak interaction between them, such as hydrogen bonds, van der Waals and Coulombic forces [16–18]. Looking into Fig. 1, we can see that the broad and asymmetric featured peak at 3417cm−1 for pure H3PW12O40 due to O–H vibrations clearly shifted to 3430cm−1 when organic cations were combined with the heteropolyanion for 1–3 hybrids, which can be indicative of the existence of extended hydrogen bonding network between heteropolyanions and organic cations. It is suggested that the hydrogen bonding network also accounts for the slight shifts of the three featured peaks for the Keggin structure of H3PW12O40 to 982cm−1 (W=Od), 897cm−1 (W–Ob–W) (corner-sharing), and 808cm−1 (W–Oc–W) (edge-sharing) for hybrid materials, respectively. It is the network of hydrogen bonding, together with the large volume and high valence of the heteropolyanion that endow these hybrids with solid nature (m.p. above 100°C). Unlike conventional ILs, the solid acidic organic HPA salts can be readily used as solid catalysts. 3.2 Effect of reaction conditions As a control experiment, esterification of acetic acid (30mmol) with n-butanol (36mmol) over 1 was carried out at 110°C for 1.5h, without using a segregator to remove the produced water. Before starting the reaction at the room reaction temperature, a solid–liquid biphase system was observed due to the insolubility of the catalyst in monocarboxylic acid and/or monohydric alcohol. However, the catalyst became liquid when the reaction mixture was heated to 110°C with stirring, and the liquid was insoluble in reactants but dissolvable with produced water. In this case, the reaction was a liquid–liquid biphasic system, giving 82.5% yield of butyl acetate with 100% selectivity. After the mixture being cooled to room temperature, the catalyst dissolved in the produced water precipitated at the bottom layer as a gelatineous solid, and the produced ester with unconverted reactants was at the upper liquid layer. Esterification is known as a reversible reaction; therefore, in order to achieve a higher yield, it is necessary to remove the produced water as complete as possible to drive the reaction equilibrium forward. Actually, it was found to be true for the new hybrid catalyst 1 when we carried out the experiment to investigate the effect of molar ratio of alcohol to acid on the yield of ester with the produced water being removed in time by a water segregator, as shown in Fig. 2 . When the molar ratio of alcohol to acid increased up to 1.2 without using any extra solvents, the maximum yield 94.5% was achieved, which is much higher than 82.5% obtained without removing the produced water. With further enhancing the ratio beyond 1.2, the yield decreased slightly due to the dilution of acetic acid by the excess n-butanol. 1.2 is selected as the suitable molar ratio of n-butanol to acetic acid, which is consistent with the practical situation in industry, where the excess amount of alcohol is often employed over acid. Fig. 3 plots the effect of reaction temperature on the yield of the ester over catalyst 1. It can be seen that the increase of reaction temperature from 90 to 130°C led to the enhancement of the yield of butyl acetate, and above 110°C, the escape of the non-reacted acetic acid and n-butanol by evaporation also became noticeable, which results in the decrease of the yield. The maximum yield 94.5% was observed at 110°C that should be the suitable reaction temperature. Influence of reaction time on the yield of butyl acetate over catalyst 1 is displayed in Fig. 4 . It can be seen that the remarkable increase in yield along with the prolongation of reaction time stopped at 1.5h, beyond which the constant yield around 95% was observed. As compared with the reaction time (2–6h) in previous reports concerning the conventional PS functionalized IL catalysts/solvents for esterification [19,20], the new catalyst 1 gives rise to a rather high yield of the ester within a shorter reaction time. Fig. 5 represents the effect of catalyst amount on the yield of the ester in esterification of acetic acid with n-butanol over catalyst 1. When the catalyst amount changed from 0 to 0.30g, the yield of butyl acetate increased smoothly from 37.7% to 94.5% and thereafter remained almost constant. Nowadays, the conventional ILs functionalized by sulfonic acid have been investigated widely as acidic catalysts in esterification. Nevertheless, they are used as both solvent and catalyst, so a large amount (concentration) of ILs (usually 20–300mol%) were required in reaction media [21–24]. For example, alkane sulfonic acid functional group was first introduced into ILs by Davis and his co-workers [24], and they used them as dual solvent/catalyst for esterification observing the phenomenon of temperature-controlled liquid–solid separation. In contrast, Fig. 5 gives an optimal catalyst amount of 0.2g, corresponding to a very low molar ratio 1:500 of the catalyst to acetic acid (catalyst 0.06mmol to the acetic acid 30mmol), which indicates that the organic–HPA hybrid synthesized in this work acts indeed as a solid catalyst. 3.3 Effect of organic cations in catalysts on esterification of acetic acid with n-butanol Table 1 lists the results of esterification of acetic acid with n-butanol over the synthesized HPA salts with different organic cations. As the strongest acid among HPAs due to the three protons in the cation position [25–27], pure H3PW12O40 presented a yield of ester 88.2% (entry 2). Nevertheless, the reaction proceeded in a homogeneous system, which makes catalyst recovery very difficult. When the protons were totally substituted by the non-PS functionalized cations, the obtained organic HPA salts caused liquid–solid biphasic media due to their very high insolubility, but only gave low yields of ester, somewhat very similar to the non-catalyst system (entries 1 and 3–5), which implies that the PS-free samples have lost their acidity. Contrarily, the PS functionalized catalysts (entries 6–8) exhibited very high yields of ester (more than 94%), which are even higher than that of pure H3PW12O40. This verifies explicitly a very high activity of the acid site provided by PS in organic cations of HPA salts. For the three PS functionalized solids, which are insoluble in reactant and product, the liquid–liquid biphasic heterogeneous reaction systems were observed at the reaction temperature 110°C that is lower than the melting points of catalysts. The liquid phase of the catalysts is thus considered to relate with the small amount of water that could not be removed completely by the segregator. 3.4 Effect of heteropolyanions in catalysts on esterification of acetic acid with n-butanol To explore the effect of inorganic anions, catalytic activities of PS functionalized imidazole (MIMPS) salts of PW12O40 3−, PMo12O40 3−, SiW12O40 4−, and the conventional IL-forming anion HSO4 − in the esterifictaion of acetic acid with n-butanol are compared in Table 2 . It can be seen that PS functionalized imidazole (MIMPS) salts of PMo12O40 3− and SiW12O40 4− anions (entries 5 and 6) showed the same phenomenon and very comparable activities to that of PW12O40 3−, and their activities were clearly higher than those of pure H4SiW12O40 and H3PMo12O40 (entries 2 and 3). The conventional acidic IL catalyst [MIMPS]HSO4 exhibited a low yield of 65.6% (entry 7) even in a homogeneous system with the amount of [MIMPS]HSO4 being 0.33mmol, which was much higher than 0.06mmol for the other catalysts in Table 2. Although the PS acid sites in organic cations work as the active centers for esterification, Keggin heteropolyanions are still considered to play very significant roles in achieving such high activities. On the one hand, the heteropolyanions make the IL-like hybrid materials solid acids, and on the other hand, the presence of hierarchical structures of HPA catalysts can lead to surface-type and pseudoliquid (bulk-type (I) and bulk-type (II)) catalysis modes [28–31]. In this work, both reactants (acid and alcohol) were polar and thin molecules, so the pseudoliquid behaviour in the catalysis of esterification can be workable for the newly synthesised organic HPA salts. Therefore, although suppositively, we proposed a possible reaction diagram for the esterification with [MIMPS]PW12O40 as the catalyst in Fig. 6 . Despite of the biphasic reaction system, reactant molecules could penetrate into the second structure of heteropolyanions to contact easily with acid active sites of PS in organic cations, where the reaction intermediate (carbonium ion) and final product (ester) are generated. Thus, the esterification mostly takes place inside the HPA salt phase, which allows the PS species giving full play as active centres, just as what would happen in a homogeneous system. Another important role of heteropolyanions is the stabilization function on carbonium ion intermediates created at acid sites in the bulk of the organic HPA salts [32–34], which is able to facilitate the creation of ester. This proposal may account for the higher yields on heteropolyacid salts (entries 4–6 of Table 2) than that on the conventional IL salt (entry 7 of Table 2); however, more direct evidences are need to verify it. On the other hand, in view of economical and environmental concerns, it is very desirable to immobilize conventional ILs onto porous carriers and to use them as solid catalysts [33–37]. In this work, IL-forming cations are combined with heteropolyanions to make solid acids, which, in our opinion, may be a new strategy to create solid catalysts with IL-like composition. 3.5 Catalytic performance of 1 in various esterification reactions Esterification is important process to manufacture a variety of intermediates and end-products, such as fragrances, monomers, solvents, plasticizers, etc [20]. For esterifications with one of reactants being a polycarboxylic acid or polyol, our previous report [15] have demonstrated high activities of the organic HPA salts accompanying with a green process of “reaction-induced self-separation catalysts”. In this work, various esterifications of monocarboxylic acids with monohydric alcohols are investigated on 1, as shown in Table 3 . For reactions in entries 9 and 10, owing to the high polarity of lactic acid or mandelic acid that involves two strong polar sites in the molecule, reaction-induced phase-transfer reaction systems (switching from a homogeneous to liquid–solid biphasic heterogeneous system) were clearly observed, which is very similar to the phenomenon described in our early findings [15]. The other entries were liquid–liquid biphasic heterogeneous systems. It can be seen from Table 3 that good to excellent yields with perfect selectivity for corresponding esters (100%) were obtained in all cases (except entry 1). The prolonged carbon chains in reactants almost did not obstruct the high yields for esters (entries 2, 4, 6 and 7). Reactants with benzyl group more or less lowered the yields (entries 1 and 8), especially for the esterification of acetic acid with benzyl alcohol. It is noteworthy that the later is rather difficult reaction that could not give a high yield of carbobezyloxy acetate as well over other catalysts, such as 12-silicotungstic acid supported on zirconia-embedded SBA-15, and 1-butylpyridinium chloride–aluminium(III) chloride [38,39]. 3.6 Catalyst recoverability and reusability For esterifications in entries 1–8, Table 3, the synthesized PS functionalized hybrid catalysts resulted in a similar liquid–liquid biphasic reaction system at their reaction temperatures. An interesting phenomenon was that upon the cooling of the reacted mixture to room temperature, the catalyst turned to be a transparent solid appeared at the bottom of the reactor, with the produced ester with unconverted reactants remained as liquid at the upper layer. For entries 9 and 10, at the end of reaction, the catalyst also appeared as a solid. Thus, in all cases, the solid catalyst could be conveniently recovered simply by decantation (or filtration) and easily recycled into the next run. A seven-run recycling performance of 1 was investigated in the esterification of acetic acid with n-butanol, and the results are shown in Fig. 7 . It is obvious that the yield of ester 94.5% for the first run only marginally decreased down to 87% for the third run, and after that, it was rather stable during the repeated usage up to seven times. At the seventh reaction run, 82.3wt% of the catalyst (compared to the amount of fresh one used in the first run) was recovered and 84.4% yield was obtained. One can see from Fig. 5 that, if using the same amount of fresh catalyst (0.2×82.3%=0.165g) for the seventh run of reaction, the yield should be approximately 91.3% that is still higher than that of the recovered catalyst (84.4%). This indicates the still very slow deactivation for the catalyst, mostly happening during the first three runs (see Fig. 7), even taking into account of the weight loss in the operation for recovering the catalyst. As illustrated in Fig. 8 , the profile of IR spectra for the recovered catalyst after the seventh run was well consistent with that of the fresh one, demonstrating a quite stable structure after the repeated use of the catalyst. However, the intensities of IR bands decreased to some extent, which might be indicative of the slight deactivation of the recovered catalyst. Another observation from Fig. 8 is that not any bands assigned to the reactants and the ester in the recovered catalyst were detected, which strongly suggests that the dissolution of the liquids in the esterification medium into the solid organic HPA salt at the finish of reaction is negligible. 4 Conclusion This work synthesizes a family of solid organic–inorganic hybrid materials by combining PS functionalized IL-forming organic cations with Keggin-structured heteropolyanions. In spite of the IL-like composition, they are organic heteropolyacid salts with melting points above 100°C due to the high valence of heteropolyanions and the formation of hydrogen bonding network between cations and anions. It is noteworthy that when the obtained hybrid materials were used as catalysts for esterifications, they acted as heterogeneous catalysts in liquid–liquid biphasic reaction media at the reaction temperature, and upon cooling down of the reacted mixture, catalysts resumed their solid state that can be easily recovered and reused without substantially changing the original structure, demonstrated by a seven-run test. This study provides a new strategy to get a family of novel green solid acid catalysts. We consider that the protocol can be very useful to design new HPA-type (maybe also IL-type) catalysts due to the high tailorability in both organic cations and heteropolyanions. Acknowledgement The authors thank the National Natural Science Foundation of China (Nos. 20476046, 20776069 and 20771059), Key Natural Science Foundation for Universities of Jiangsu Province (06KJA53012) and Program for Changjiang Scholars and Innovative Research Team in University (PCSIRT 0732). References [1] I.V. Kozhevnikov K.R. Kloetstra A. Sinnema H.W. Zandbergen H. Bekkum J. Mol. Catal. A 114 1996 287 298 [2] Q.Y. Liu W.L. Wu J. Wang X.Q. Ren Y.R. Wang Microporous Mesoporous Mater. 76 2004 51 60 [3] S.R. Mukai L. Lin T. Masuda K. Hashimoto Chem. Eng. Sci. 56 2001 779 804 [4] A. Bordoloi F. Lefebvre S.B. Halligudi J. Catal. 247 2007 166 175 [5] R.P. Wei M.P. Guo J. Wang Chin. J. Chem. Eng. 17 2009 58 63 [6] W.G. Klemperer C.G. Wall Chem. Rev. 98 1998 297 306 [7] F.M. Zhang J. Wang C.S. Yuan X.Q. Ren Catal. Lett. 102 2005 3 4 [8] X. Wang Y.H. Tseng J.C.C. Chan S. Cheng J. Catal. 233 2005 266 275 [9] D. Margolese J.A. Melero S.C. Christiansen B.F. Chmelka G.D. Stucky Chem. Mater. 12 2000 2448 2459 [10] Y. Long G. Li Adv. Synth. Catal. 351 2009 817 847 [11] T. Welton Coord. Chem. Rev. 248 2004 2459 2477 [12] P.G. Rickert M.R. Antonio M.A. Firestone K.A. Kubatko T. Szreder J.F. Wishart M.L. Dietz Dalton. Trans. 2007 529 531 [13] T. Matsumoto M. Ueno N. Wang S. Kobayashi Chem. Asian J. 3 2008 239 243 [14] Y. Leng H. Ge C. Zhou J. Wang Chem. Eng. J. 145 2008 335 339 [15] Y. Leng J. Wang D. Zhu X. Ren H. Ge L. Shen Angew. Chem. Int. Ed. 48 2009 168 171 [16] D. Xiao J.R. Rajian A. Cady S. Li R.A. Bartsch E.L. Quitevis J. Phys. Chem. B 111 2007 4669 4677 [17] F.C. Gozzo L.S. Santos R. Augusti C.S. Consorti J. Dupont M.N. Eberlin Chem. Eur. J. 10 2004 6187 6193 [18] C.S. Consorti P.A.Z. Suarez R.F. de Souza R.A. Burrow D.H. Farrar A.J. Lough W. Loh L.H.M. da Silva J. Dupont J. Phys. Chem. B 109 2005 4341 4349 [19] J. Das K.M. Parida J. Mol. Catal. A 264 2007 248 254 [20] H. Zhang F. Xu X. Zhou G. Zhang C. Wang Green Chem. 9 2007 1208 1211 [21] D. Fang X.L. Zhou Z.W. Ye Z.L. Liu Ind. Eng. Chem. Res. 45 2006 7982 7984 [22] H. Xing T. Wang Z. Zhou Y. Dai Ind. Eng. Chem. Res. 44 2005 4147 4150 [23] Y. Gu F. Shi Y. Deng J. Mol. Catal. A 212 2004 71 75 [24] A.C. Cole J.L. Jensen I. Ntai K.L.T. Tran K.J. Weaver D.C. Forbes J.H. Davis Jr. J. Am. Chem. Soc. 124 2002 5962 5963 [25] I.V. Kozhevnikov K.I. Matveev Appl. Catal. 5 1983 135 150 [26] G.A. Tsigdinos Top. Curr. Chem. 76 1978 1 64 [27] M. Furuta K. Sakata M. Misono Y. Yoneda Chem. Lett. 8 1979 31 34 [28] M. Misono Catal. Rev. Sci. Eng. 29 1987 269 321 [29] M. Misono Catal. Rev. Sci. Eng. 30 1988 339 340 [30] T. Okuhara N. Mizuno M. Misono Adv. Catal. 41 1996 113 252 [31] M. Misono Chem. Commun. 2001 1141 1152 [32] Y. Izumi K. Urabe M. Onaka Zeolite 1992 KodanshdVCH Tokyo p. 99 [33] M. Misono Catal. Lett. 12 1992 63 72 [34] N. Mizuno M. Misono Chem. Rev. 98 1998 199 218 [35] T. Sasaki C. Zhong M. Tada Y. Iwasawa Chem. Commun. 2005 2506 2508 [36] C.P. Mehnert R.A. Cook N.C. Dispenziere M. Afeworki J. Am. Chem. Soc. 124 2002 12932 12933 [37] Y. Gu C. Ogawa J. Kobayashi Y. Mori S. Kobayashi Angew. Chem. Int. Ed. 45 2006 7217 7220 [38] Y. Deng F. Shi J. Beng K. Qiao J. Mol. Catal. A 165 2001 33 36 [39] D.P. Sawant A. Vinu J. Justus P. Srinivasu S.B. Halligudi J. Mol. Catal. A 276 2007 150 157",
      "scopus-id": "70349156347",
      "coredata": {
        "eid": "1-s2.0-S1381116909003744",
        "dc:description": "A family of solid organic heteropolyacid (HPA) salts were prepared by combining Keggin heteropolyanions with ionic liquid (IL)-forming cations functionalized by propane sulfonate (PS). Their catalytic activities were evaluated in esterifications, including the testing of the influence of organic cations, function of heteropolyanions, scope of reactions, optimization of reaction conditions, and catalytic reusability. The obtained catalysts caused a liquid–liquid biphasic esterification system, presenting high yield and selectivity for target esters, and after reaction, they appeared in solid state again, which could be easily recovered and quite steadily reused demonstrated by a seven-run recycling test. The highly efficient and environmentally benign performance of this family of catalysts is due to the pseudoliquid behavior of HPA salts that allows PS acidic species in the bulk of the heteropoly compound acting fully as active centers for esterification, as well as the stabilization function of heteropolyanion on carbonium ion intermediates created at acid sites.",
        "openArchiveArticle": "false",
        "prism:coverDate": "2009-11-02",
        "openaccessUserLicense": null,
        "prism:aggregationType": "Journal",
        "prism:url": "https://api.elsevier.com/content/article/pii/S1381116909003744",
        "dc:creator": [
          {
            "@_fa": "true",
            "$": "Leng, Yan"
          },
          {
            "@_fa": "true",
            "$": "Wang, Jun"
          },
          {
            "@_fa": "true",
            "$": "Zhu, Dunru"
          },
          {
            "@_fa": "true",
            "$": "Wu, Yajing"
          },
          {
            "@_fa": "true",
            "$": "Zhao, Pingping"
          }
        ],
        "link": [
          {
            "@_fa": "true",
            "@rel": "self",
            "@href": "https://api.elsevier.com/content/article/pii/S1381116909003744"
          },
          {
            "@_fa": "true",
            "@rel": "scidir",
            "@href": "https://www.sciencedirect.com/science/article/pii/S1381116909003744"
          }
        ],
        "dc:format": "application/json",
        "openaccessType": null,
        "pii": "S1381-1169(09)00374-4",
        "prism:volume": "313",
        "prism:publisher": "Elsevier B.V.",
        "dc:title": "Sulfonated organic heteropolyacid salts: Recyclable green solid catalysts for esterifications",
        "prism:copyright": "Copyright © 2009 Elsevier B.V. All rights reserved.",
        "openaccess": "0",
        "prism:issn": "13811169",
        "prism:issueIdentifier": "1-2",
        "dcterms:subject": [
          {
            "@_fa": "true",
            "$": "Esterification"
          },
          {
            "@_fa": "true",
            "$": "Heteropolyacid salt"
          },
          {
            "@_fa": "true",
            "$": "Ionic liquids"
          },
          {
            "@_fa": "true",
            "$": "Organic–inorganic hybrids"
          }
        ],
        "openaccessArticle": "false",
        "prism:publicationName": "Journal of Molecular Catalysis A: Chemical",
        "prism:number": "1-2",
        "openaccessSponsorType": null,
        "prism:pageRange": "1-6",
        "prism:endingPage": "6",
        "pubType": "fla",
        "prism:coverDisplayDate": "2 November 2009",
        "prism:doi": "10.1016/j.molcata.2009.08.011",
        "prism:startingPage": "1",
        "dc:identifier": "doi:10.1016/j.molcata.2009.08.011",
        "openaccessSponsorName": null
      },
      "objects": {
        "object": [
          {
            "@category": "standard",
            "@height": "215",
            "@width": "659",
            "@_fa": "true",
            "$": "https://api.elsevier.com/content/object/eid/1-s2.0-S1381116909003744-sc1.jpg?httpAccept=%2A%2F%2A",
            "@multimediatype": "JPEG image file",
            "@type": "IMAGE-DOWNSAMPLED",
            "@size": "26141",
            "@ref": "sc1",
            "@mimetype": "image/jpeg"
          },
          {
            "@category": "thumbnail",
            "@height": "71",
            "@width": "219",
            "@_fa": "true",
            "$": "https://api.elsevier.com/content/object/eid/1-s2.0-S1381116909003744-sc1.sml?httpAccept=%2A%2F%2A",
            "@multimediatype": "GIF image file",
            "@type": "IMAGE-THUMBNAIL",
            "@size": "1946",
            "@ref": "sc1",
            "@mimetype": "image/gif"
          },
          {
            "@category": "standard",
            "@height": "31",
            "@width": "327",
            "@_fa": "true",
            "$": "https://api.elsevier.com/content/object/eid/1-s2.0-S1381116909003744-sc2.jpg?httpAccept=%2A%2F%2A",
            "@multimediatype": "JPEG image file",
            "@type": "IMAGE-DOWNSAMPLED",
            "@size": "3933",
            "@ref": "sc2",
            "@mimetype": "image/jpeg"
          },
          {
            "@category": "thumbnail",
            "@height": "21",
            "@width": "219",
            "@_fa": "true",
            "$": "https://api.elsevier.com/content/object/eid/1-s2.0-S1381116909003744-sc2.sml?httpAccept=%2A%2F%2A",
            "@multimediatype": "GIF image file",
            "@type": "IMAGE-THUMBNAIL",
            "@size": "929",
            "@ref": "sc2",
            "@mimetype": "image/gif"
          },
          {
            "@category": "standard",
            "@height": "309",
            "@width": "371",
            "@_fa": "true",
            "$": "https://api.elsevier.com/content/object/eid/1-s2.0-S1381116909003744-gr1.jpg?httpAccept=%2A%2F%2A",
            "@multimediatype": "JPEG image file",
            "@type": "IMAGE-DOWNSAMPLED",
            "@size": "25856",
            "@ref": "gr1",
            "@mimetype": "image/jpeg"
          },
          {
            "@category": "thumbnail",
            "@height": "163",
            "@width": "196",
            "@_fa": "true",
            "$": "https://api.elsevier.com/content/object/eid/1-s2.0-S1381116909003744-gr1.sml?httpAccept=%2A%2F%2A",
            "@multimediatype": "GIF image file",
            "@type": "IMAGE-THUMBNAIL",
            "@size": "4027",
            "@ref": "gr1",
            "@mimetype": "image/gif"
          },
          {
            "@category": "standard",
            "@height": "274",
            "@width": "372",
            "@_fa": "true",
            "$": "https://api.elsevier.com/content/object/eid/1-s2.0-S1381116909003744-gr2.jpg?httpAccept=%2A%2F%2A",
            "@multimediatype": "JPEG image file",
            "@type": "IMAGE-DOWNSAMPLED",
            "@size": "8546",
            "@ref": "gr2",
            "@mimetype": "image/jpeg"
          },
          {
            "@category": "thumbnail",
            "@height": "161",
            "@width": "219",
            "@_fa": "true",
            "$": "https://api.elsevier.com/content/object/eid/1-s2.0-S1381116909003744-gr2.sml?httpAccept=%2A%2F%2A",
            "@multimediatype": "GIF image file",
            "@type": "IMAGE-THUMBNAIL",
            "@size": "1702",
            "@ref": "gr2",
            "@mimetype": "image/gif"
          },
          {
            "@category": "standard",
            "@height": "280",
            "@width": "369",
            "@_fa": "true",
            "$": "https://api.elsevier.com/content/object/eid/1-s2.0-S1381116909003744-gr3.jpg?httpAccept=%2A%2F%2A",
            "@multimediatype": "JPEG image file",
            "@type": "IMAGE-DOWNSAMPLED",
            "@size": "10538",
            "@ref": "gr3",
            "@mimetype": "image/jpeg"
          },
          {
            "@category": "thumbnail",
            "@height": "164",
            "@width": "216",
            "@_fa": "true",
            "$": "https://api.elsevier.com/content/object/eid/1-s2.0-S1381116909003744-gr3.sml?httpAccept=%2A%2F%2A",
            "@multimediatype": "GIF image file",
            "@type": "IMAGE-THUMBNAIL",
            "@size": "2063",
            "@ref": "gr3",
            "@mimetype": "image/gif"
          },
          {
            "@category": "standard",
            "@height": "283",
            "@width": "367",
            "@_fa": "true",
            "$": "https://api.elsevier.com/content/object/eid/1-s2.0-S1381116909003744-gr4.jpg?httpAccept=%2A%2F%2A",
            "@multimediatype": "JPEG image file",
            "@type": "IMAGE-DOWNSAMPLED",
            "@size": "9774",
            "@ref": "gr4",
            "@mimetype": "image/jpeg"
          },
          {
            "@category": "thumbnail",
            "@height": "164",
            "@width": "213",
            "@_fa": "true",
            "$": "https://api.elsevier.com/content/object/eid/1-s2.0-S1381116909003744-gr4.sml?httpAccept=%2A%2F%2A",
            "@multimediatype": "GIF image file",
            "@type": "IMAGE-THUMBNAIL",
            "@size": "1932",
            "@ref": "gr4",
            "@mimetype": "image/gif"
          },
          {
            "@category": "standard",
            "@height": "282",
            "@width": "371",
            "@_fa": "true",
            "$": "https://api.elsevier.com/content/object/eid/1-s2.0-S1381116909003744-gr5.jpg?httpAccept=%2A%2F%2A",
            "@multimediatype": "JPEG image file",
            "@type": "IMAGE-DOWNSAMPLED",
            "@size": "11485",
            "@ref": "gr5",
            "@mimetype": "image/jpeg"
          },
          {
            "@category": "thumbnail",
            "@height": "164",
            "@width": "215",
            "@_fa": "true",
            "$": "https://api.elsevier.com/content/object/eid/1-s2.0-S1381116909003744-gr5.sml?httpAccept=%2A%2F%2A",
            "@multimediatype": "GIF image file",
            "@type": "IMAGE-THUMBNAIL",
            "@size": "2203",
            "@ref": "gr5",
            "@mimetype": "image/gif"
          },
          {
            "@category": "standard",
            "@height": "215",
            "@width": "336",
            "@_fa": "true",
            "$": "https://api.elsevier.com/content/object/eid/1-s2.0-S1381116909003744-gr6.jpg?httpAccept=%2A%2F%2A",
            "@multimediatype": "JPEG image file",
            "@type": "IMAGE-DOWNSAMPLED",
            "@size": "42377",
            "@ref": "gr6",
            "@mimetype": "image/jpeg"
          },
          {
            "@category": "thumbnail",
            "@height": "140",
            "@width": "219",
            "@_fa": "true",
            "$": "https://api.elsevier.com/content/object/eid/1-s2.0-S1381116909003744-gr6.sml?httpAccept=%2A%2F%2A",
            "@multimediatype": "GIF image file",
            "@type": "IMAGE-THUMBNAIL",
            "@size": "7627",
            "@ref": "gr6",
            "@mimetype": "image/gif"
          },
          {
            "@category": "standard",
            "@height": "281",
            "@width": "366",
            "@_fa": "true",
            "$": "https://api.elsevier.com/content/object/eid/1-s2.0-S1381116909003744-gr7.jpg?httpAccept=%2A%2F%2A",
            "@multimediatype": "JPEG image file",
            "@type": "IMAGE-DOWNSAMPLED",
            "@size": "9837",
            "@ref": "gr7",
            "@mimetype": "image/jpeg"
          },
          {
            "@category": "thumbnail",
            "@height": "164",
            "@width": "213",
            "@_fa": "true",
            "$": "https://api.elsevier.com/content/object/eid/1-s2.0-S1381116909003744-gr7.sml?httpAccept=%2A%2F%2A",
            "@multimediatype": "GIF image file",
            "@type": "IMAGE-THUMBNAIL",
            "@size": "1869",
            "@ref": "gr7",
            "@mimetype": "image/gif"
          },
          {
            "@category": "standard",
            "@height": "365",
            "@width": "320",
            "@_fa": "true",
            "$": "https://api.elsevier.com/content/object/eid/1-s2.0-S1381116909003744-gr8.jpg?httpAccept=%2A%2F%2A",
            "@multimediatype": "JPEG image file",
            "@type": "IMAGE-DOWNSAMPLED",
            "@size": "18635",
            "@ref": "gr8",
            "@mimetype": "image/jpeg"
          },
          {
            "@category": "thumbnail",
            "@height": "163",
            "@width": "143",
            "@_fa": "true",
            "$": "https://api.elsevier.com/content/object/eid/1-s2.0-S1381116909003744-gr8.sml?httpAccept=%2A%2F%2A",
            "@multimediatype": "GIF image file",
            "@type": "IMAGE-THUMBNAIL",
            "@size": "2738",
            "@ref": "gr8",
            "@mimetype": "image/gif"
          },
          {
            "@category": "standard",
            "@height": "187",
            "@width": "594",
            "@_fa": "true",
            "$": "https://api.elsevier.com/content/object/eid/1-s2.0-S1381116909003744-fx1.jpg?httpAccept=%2A%2F%2A",
            "@multimediatype": "JPEG image file",
            "@type": "IMAGE-DOWNSAMPLED",
            "@size": "45609",
            "@ref": "fx1",
            "@mimetype": "image/jpeg"
          },
          {
            "@category": "thumbnail",
            "@height": "69",
            "@width": "219",
            "@_fa": "true",
            "$": "https://api.elsevier.com/content/object/eid/1-s2.0-S1381116909003744-fx1.sml?httpAccept=%2A%2F%2A",
            "@multimediatype": "GIF image file",
            "@type": "IMAGE-THUMBNAIL",
            "@size": "3901",
            "@ref": "fx1",
            "@mimetype": "image/gif"
          }
        ]
      },
      "link": {
        "@rel": "abstract",
        "@href": "https://api.elsevier.com/content/abstract/scopus_id/70349156347"
      }
    }
  }
}