{
  "metadata": {
    "title": "Immobilized palladium nanoparticles on potassium zirconium phosphate as an efficient recoverable heterogeneous catalyst for a clean Heck reaction in flow",
    "authors": "; ; ",
    "journal": "Journal of Molecular Catalysis A: Chemical",
    "date": "2015-05-15",
    "doi": "10.1016/j.molcata.2015.02.012",
    "abstract": "",
    "uri": "https://api.elsevier.com/content/article/pii/S1381116915000606",
    "pii": "S1381116915000606"
  },
  "fulltext": {
    "full-text-retrieval-response": {
      "scopus-eid": "2-s2.0-84923929589",
      "originalText": "serial JL 271358 291210 291744 291790 291809 31 Journal of Molecular Catalysis A: Chemical JOURNALMOLECULARCATALYSISACHEMICAL 2015-02-17 2015-02-17 2015-03-25T12:26:29 1-s2.0-S1381116915000606 S1381-1169(15)00060-6 S1381116915000606 10.1016/j.molcata.2015.02.012 S300 S300.1 FULL-TEXT 1-s2.0-S1381116915X00045 2015-05-15T05:56:33.63776-04:00 0 0 20150515 2015 2015-02-17T07:52:44.11745Z absattachment articleinfo articletitlenorm authfirstinitialnorm authfirstsurnamenorm cid cids contenttype copyright crossmark dateloaded dateloadedtxt datesearch datesort dateupdated dco docsubtype doctype doi eid ewtransactionid hubeid indexeddate issn issnnorm itemstage itemtransactionid itemweight openaccess openarchive pg pgfirst pglast pii piinorm pubdatestart pubdatetxt pubyr sectiontitle sortorder srctitle srctitlenorm srctype ssids alllist content subj subheadings suppl tomb volfirst volissue volumelist webpdf webpdfpagecount yearnav figure table body acknowledge affil articletitle auth authfirstini authfull authkeywords authlast grantsponsor highlightsabst orcid primabst ref specialabst 1381-1169 13811169 true 401 401 C Volume 401 6 27 34 27 34 20150515 15 May 2015 2015-05-15 2015 Regular Papers article fla Copyright © 2015 Elsevier B.V. All rights reserved. IMMOBILIZEDPALLADIUMNANOPARTICLESPOTASSIUMZIRCONIUMPHOSPHATEEFFICIENTRECOVERABLEHETEROGENEOUSCATALYSTFORACLEANHECKREACTIONINFLOW PETRUCCI C 1 Introduction 2 Experimental 2.1 General remarks 2.2 Preparation of α-Zr(KPO4)2, (α-ZrPK) 2.3 Preparation of PdNP/α-ZrPK 2.3.1 E-factor calculations for the preparation of PdNP/α-ZrPK 2.3.2 Determination of Pd content 2.4 General procedure for the Heck reaction under batch conditions 2.4.1 Representative E-factor calculations for batch reaction with TEA 2.5 General procedure for recovery and reuse of PdNP/α-ZrPK in the Heck reaction under batch conditions 2.6 General procedure for the Heck reaction in presence of PS-TEA under batch conditions 2.6.1 Representative E-factor calculations for the batch reaction with PS-TEA 2.7 Heck reaction of iodobenzene (1a) and methyl acrylate (2) under flow conditions 2.7.1 Representative E-factor calculations for the reaction in flow at 120°C 3 Results and discussion 3.1 Catalyst preparation and characterization 3.2 Catalytic activity 4 Conclusion Acnowledgements References BELETSKAYA 2000 3009 3066 I YIN 2007 133 173 L ASTRUCT 2007 1884 1894 D TIETZE 2001 368 373 L PENG 1997 4622 4632 Z BABUDRI 2004 11 34 F LIM 2011 1375 1382 Y TORBORG 2009 3027 3043 C MIZUTANI 2002 4874 4876 T DEVRIES 2001 1086 1092 J TORBOG 2009 3027 3043 C COUDARY 2002 14127 14136 B HABERLI 2001 489 492 A CORMA 2007 39 47 A COLEHAMILTON 2003 1702 1706 D GARRET 2004 889 900 C LAMBLIN 2010 33 79 M KIRSCHNIG 2001 650 679 A POLIAKKOFF 2002 807 810 M FARINA 2004 1553 1582 V PHAN 2006 609 679 N MATEOS 2014 3701 3705 C CAMPELO 2009 18 45 J KHALAFINEZHAD 2011 2408 2415 A BURTON 2011 145 149 P DERAEDT 2013 8169 8171 C ZHANG 2013 235 243 Q BALANTA 2011 4973 4985 A KHALAFINEZHAD 2014 1177 1186 A MARTINEZ 2014 21 28 A RAFIEE 2014 302 309 E ISFAHANI 2013 957 972 A IONI 2013 392 394 Y SONG 2002 3495 3524 C CLEARFIELF 1996 A COMPREHENSIVESUPRAMOLECULARCHEMISTRY ALBERTI 1996 291 303 G VIVANI 2008 58 70 R CURINI 2004 591 606 M CLEARFIELD 2002 2937 2947 A CLEARFIELD 2008 6089 6102 A BENVENUTI 2000 147 153 F WANG 2003 10375 10383 Z COSTANTINO 2007 100 105 U COSTANTINO 2009 1214 1220 U CIPICIANI 2010 61 65 A LANARI 2011 80 87 D CALOGERO 2011 112 119 S ANGELONI 2014 1716 1726 M KUMADA 2008 2206 2212 N JUNG 2007 49 55 J FENG 2007 3258 3261 Y CHENG 1985 455 467 S ALONZI 2014 260 267 M BALLERINI 2013 2394 2400 E ANGELINI 2013 5042 5046 T PAVIA 2013 2007 2018 C STRAPPAVECCIA 2013 199 204 G HENDERSON 2011 854 862 R ALFONSI 2008 31 36 K VACCARO 2014 3680 3704 L PAVIA 2014 57 62 C POTIER 2014 1 8 J PARKER 2014 1739 1742 H RAFIEE 2014 302 309 E KEESARA 2014 31 38 S JIANG 2014 14 18 Z ALBERTI 1975 1779 1796 G CULLITY 2001 B ELEMENTSXRAYDIFFRACTION GRUTTADAURIA 2013 2608 2618 M KOHLER 2007 1876 1883 K WEBB 2007 97 109 J MACQUARRIE 2008 3279 3282 S RICHARDSON 2007 80 93 J BURGUETE 2010 150 160 M ZHAO 2000 843 848 F HORNIAKOVA 2004 73 80 J ZHAOA 2002 211 219 F DAMS 2002 225 236 M KOHLER 2002 622 631 K CABRI 1995 2 7 W SHELDON 1997 12 15 R SHELDON 2007 1273 1283 R MANDAL 2004 3714 3724 S MURUGAN 2012 211 222 E ZHANG 2011 1238 1243 F GUIN 2007 1419 1421 D PETRUCCIX2015X27 PETRUCCIX2015X27X34 PETRUCCIX2015X27XC PETRUCCIX2015X27X34XC item S1381-1169(15)00060-6 S1381116915000606 1-s2.0-S1381116915000606 10.1016/j.molcata.2015.02.012 271358 2015-03-25T11:02:30.135087-04:00 2015-05-15 1-s2.0-S1381116915000606-main.pdf https://s3.amazonaws.com/prod-ucs-content-store-us-east/content/pii:S1381116915000606/MAIN/application/pdf/76f6ad85b88d5f8a6746098183f74dfd/main.pdf https://s3-eu-west-1.amazonaws.com/prod-ucs-content-store-eu-west/content/pii:S1381116915000606/MAIN/application/pdf/76f6ad85b88d5f8a6746098183f74dfd/main.pdf main.pdf pdf true 850916 MAIN 8 1-s2.0-S1381116915000606-main_1.png https://s3-eu-west-1.amazonaws.com/prod-ucs-content-store-eu-west/content/pii:S1381116915000606/PREVIEW/image/png/1f3ff1d58819a0e2220b927d1bf6fa1b/main_1.png https://s3.amazonaws.com/prod-ucs-content-store-us-east/content/pii:S1381116915000606/PREVIEW/image/png/1f3ff1d58819a0e2220b927d1bf6fa1b/main_1.png main_1.png png 56092 849 656 IMAGE-WEB-PDF 1 1-s2.0-S1381116915000606-sc1_lrg.jpg https://s3.amazonaws.com/prod-ucs-content-store-us-east/content/pii:S1381116915000606/sc1/HIGHRES/image/jpeg/f540279239b6a8b05fb1377d59363f8b/sc1_lrg.jpg https://s3-eu-west-1.amazonaws.com/prod-ucs-content-store-eu-west/content/pii:S1381116915000606/sc1/HIGHRES/image/jpeg/f540279239b6a8b05fb1377d59363f8b/sc1_lrg.jpg sc1 sc1_lrg.jpg jpg 176552 1333 1500 IMAGE-HIGH-RES 1-s2.0-S1381116915000606-gr3_lrg.jpg https://s3.amazonaws.com/prod-ucs-content-store-us-east/content/pii:S1381116915000606/gr3/HIGHRES/image/jpeg/ea550f055fe67a94646077a7b34b0efe/gr3_lrg.jpg https://s3-eu-west-1.amazonaws.com/prod-ucs-content-store-eu-west/content/pii:S1381116915000606/gr3/HIGHRES/image/jpeg/ea550f055fe67a94646077a7b34b0efe/gr3_lrg.jpg gr3 gr3_lrg.jpg jpg 204667 1008 2490 IMAGE-HIGH-RES 1-s2.0-S1381116915000606-gr2_lrg.jpg https://s3.amazonaws.com/prod-ucs-content-store-us-east/content/pii:S1381116915000606/gr2/HIGHRES/image/jpeg/fcb5b2c90aadb744bbc3a52722d6b895/gr2_lrg.jpg https://s3-eu-west-1.amazonaws.com/prod-ucs-content-store-eu-west/content/pii:S1381116915000606/gr2/HIGHRES/image/jpeg/fcb5b2c90aadb744bbc3a52722d6b895/gr2_lrg.jpg gr2 gr2_lrg.jpg jpg 175615 1423 1706 IMAGE-HIGH-RES 1-s2.0-S1381116915000606-gr1_lrg.jpg https://s3.amazonaws.com/prod-ucs-content-store-us-east/content/pii:S1381116915000606/gr1/HIGHRES/image/jpeg/64c0b9ee2db5afbe27a830fb08242aa0/gr1_lrg.jpg https://s3-eu-west-1.amazonaws.com/prod-ucs-content-store-eu-west/content/pii:S1381116915000606/gr1/HIGHRES/image/jpeg/64c0b9ee2db5afbe27a830fb08242aa0/gr1_lrg.jpg gr1 gr1_lrg.jpg jpg 314230 925 2500 IMAGE-HIGH-RES 1-s2.0-S1381116915000606-fx7_lrg.jpg https://s3.amazonaws.com/prod-ucs-content-store-us-east/content/pii:S1381116915000606/fx7/HIGHRES/image/jpeg/75ad7c6fd2a8a98b8914f7e6179def80/fx7_lrg.jpg https://s3-eu-west-1.amazonaws.com/prod-ucs-content-store-eu-west/content/pii:S1381116915000606/fx7/HIGHRES/image/jpeg/75ad7c6fd2a8a98b8914f7e6179def80/fx7_lrg.jpg fx7 fx7_lrg.jpg jpg 5405 132 168 IMAGE-HIGH-RES 1-s2.0-S1381116915000606-fx6_lrg.jpg https://s3.amazonaws.com/prod-ucs-content-store-us-east/content/pii:S1381116915000606/fx6/HIGHRES/image/jpeg/fc89c2671933fc3fe4f803f291d15926/fx6_lrg.jpg https://s3-eu-west-1.amazonaws.com/prod-ucs-content-store-eu-west/content/pii:S1381116915000606/fx6/HIGHRES/image/jpeg/fc89c2671933fc3fe4f803f291d15926/fx6_lrg.jpg fx6 fx6_lrg.jpg jpg 121031 495 2747 IMAGE-HIGH-RES 1-s2.0-S1381116915000606-fx5_lrg.jpg https://s3.amazonaws.com/prod-ucs-content-store-us-east/content/pii:S1381116915000606/fx5/HIGHRES/image/jpeg/75ad7c6fd2a8a98b8914f7e6179def80/fx5_lrg.jpg https://s3-eu-west-1.amazonaws.com/prod-ucs-content-store-eu-west/content/pii:S1381116915000606/fx5/HIGHRES/image/jpeg/75ad7c6fd2a8a98b8914f7e6179def80/fx5_lrg.jpg fx5 fx5_lrg.jpg jpg 5405 132 168 IMAGE-HIGH-RES 1-s2.0-S1381116915000606-fx4_lrg.jpg https://s3.amazonaws.com/prod-ucs-content-store-us-east/content/pii:S1381116915000606/fx4/HIGHRES/image/jpeg/a07b9e881f7a2c9d64ece7eb7d7c0ee5/fx4_lrg.jpg https://s3-eu-west-1.amazonaws.com/prod-ucs-content-store-eu-west/content/pii:S1381116915000606/fx4/HIGHRES/image/jpeg/a07b9e881f7a2c9d64ece7eb7d7c0ee5/fx4_lrg.jpg fx4 fx4_lrg.jpg jpg 98270 373 2338 IMAGE-HIGH-RES 1-s2.0-S1381116915000606-fx3_lrg.jpg https://s3.amazonaws.com/prod-ucs-content-store-us-east/content/pii:S1381116915000606/fx3/HIGHRES/image/jpeg/c0c5a6b5a6c8220526e165d5d798117b/fx3_lrg.jpg https://s3-eu-west-1.amazonaws.com/prod-ucs-content-store-eu-west/content/pii:S1381116915000606/fx3/HIGHRES/image/jpeg/c0c5a6b5a6c8220526e165d5d798117b/fx3_lrg.jpg fx3 fx3_lrg.jpg jpg 67570 352 1602 IMAGE-HIGH-RES 1-s2.0-S1381116915000606-fx2_lrg.jpg https://s3.amazonaws.com/prod-ucs-content-store-us-east/content/pii:S1381116915000606/fx2/HIGHRES/image/jpeg/16d68fb9a58c913ea330de37abba6406/fx2_lrg.jpg https://s3-eu-west-1.amazonaws.com/prod-ucs-content-store-eu-west/content/pii:S1381116915000606/fx2/HIGHRES/image/jpeg/16d68fb9a58c913ea330de37abba6406/fx2_lrg.jpg fx2 fx2_lrg.jpg jpg 67168 333 1633 IMAGE-HIGH-RES 1-s2.0-S1381116915000606-fx1_lrg.jpg https://s3.amazonaws.com/prod-ucs-content-store-us-east/content/pii:S1381116915000606/fx1/HIGHRES/image/jpeg/0e7b0986a010bf7b77a05fc387454f1c/fx1_lrg.jpg https://s3-eu-west-1.amazonaws.com/prod-ucs-content-store-eu-west/content/pii:S1381116915000606/fx1/HIGHRES/image/jpeg/0e7b0986a010bf7b77a05fc387454f1c/fx1_lrg.jpg fx1 true fx1_lrg.jpg jpg 164668 886 2213 IMAGE-HIGH-RES 1-s2.0-S1381116915000606-sc1.jpg https://s3.amazonaws.com/prod-ucs-content-store-us-east/content/pii:S1381116915000606/sc1/DOWNSAMPLED/image/jpeg/66a6ee66f86ba27a2facbf5809ed3972/sc1.jpg https://s3-eu-west-1.amazonaws.com/prod-ucs-content-store-eu-west/content/pii:S1381116915000606/sc1/DOWNSAMPLED/image/jpeg/66a6ee66f86ba27a2facbf5809ed3972/sc1.jpg sc1 sc1.jpg jpg 19387 301 339 IMAGE-DOWNSAMPLED 1-s2.0-S1381116915000606-gr3.jpg https://s3.amazonaws.com/prod-ucs-content-store-us-east/content/pii:S1381116915000606/gr3/DOWNSAMPLED/image/jpeg/76fe9e5aedc88f5f6e1fa70404e9ebc8/gr3.jpg https://s3-eu-west-1.amazonaws.com/prod-ucs-content-store-eu-west/content/pii:S1381116915000606/gr3/DOWNSAMPLED/image/jpeg/76fe9e5aedc88f5f6e1fa70404e9ebc8/gr3.jpg gr3 gr3.jpg jpg 17043 228 562 IMAGE-DOWNSAMPLED 1-s2.0-S1381116915000606-gr2.jpg https://s3.amazonaws.com/prod-ucs-content-store-us-east/content/pii:S1381116915000606/gr2/DOWNSAMPLED/image/jpeg/e5227b4933306c2310940f2c752f042a/gr2.jpg https://s3-eu-west-1.amazonaws.com/prod-ucs-content-store-eu-west/content/pii:S1381116915000606/gr2/DOWNSAMPLED/image/jpeg/e5227b4933306c2310940f2c752f042a/gr2.jpg gr2 gr2.jpg jpg 19782 321 385 IMAGE-DOWNSAMPLED 1-s2.0-S1381116915000606-gr1.jpg https://s3.amazonaws.com/prod-ucs-content-store-us-east/content/pii:S1381116915000606/gr1/DOWNSAMPLED/image/jpeg/328310c8a7396648500b3e98c0e4a7d2/gr1.jpg https://s3-eu-west-1.amazonaws.com/prod-ucs-content-store-eu-west/content/pii:S1381116915000606/gr1/DOWNSAMPLED/image/jpeg/328310c8a7396648500b3e98c0e4a7d2/gr1.jpg gr1 gr1.jpg jpg 22154 209 565 IMAGE-DOWNSAMPLED 1-s2.0-S1381116915000606-fx7.jpg https://s3.amazonaws.com/prod-ucs-content-store-us-east/content/pii:S1381116915000606/fx7/DOWNSAMPLED/image/jpeg/e048597a1ce114543fcccc4a7c0b020e/fx7.jpg https://s3-eu-west-1.amazonaws.com/prod-ucs-content-store-eu-west/content/pii:S1381116915000606/fx7/DOWNSAMPLED/image/jpeg/e048597a1ce114543fcccc4a7c0b020e/fx7.jpg fx7 fx7.jpg jpg 887 29 37 IMAGE-DOWNSAMPLED 1-s2.0-S1381116915000606-fx6.jpg https://s3.amazonaws.com/prod-ucs-content-store-us-east/content/pii:S1381116915000606/fx6/DOWNSAMPLED/image/jpeg/f1dcb14430a082cf2c2cefe8828d9288/fx6.jpg https://s3-eu-west-1.amazonaws.com/prod-ucs-content-store-eu-west/content/pii:S1381116915000606/fx6/DOWNSAMPLED/image/jpeg/f1dcb14430a082cf2c2cefe8828d9288/fx6.jpg fx6 fx6.jpg jpg 13068 112 620 IMAGE-DOWNSAMPLED 1-s2.0-S1381116915000606-fx5.jpg https://s3.amazonaws.com/prod-ucs-content-store-us-east/content/pii:S1381116915000606/fx5/DOWNSAMPLED/image/jpeg/e048597a1ce114543fcccc4a7c0b020e/fx5.jpg https://s3-eu-west-1.amazonaws.com/prod-ucs-content-store-eu-west/content/pii:S1381116915000606/fx5/DOWNSAMPLED/image/jpeg/e048597a1ce114543fcccc4a7c0b020e/fx5.jpg fx5 fx5.jpg jpg 887 29 37 IMAGE-DOWNSAMPLED 1-s2.0-S1381116915000606-fx4.jpg https://s3.amazonaws.com/prod-ucs-content-store-us-east/content/pii:S1381116915000606/fx4/DOWNSAMPLED/image/jpeg/ef015732052f353a07dc2a3939465f6c/fx4.jpg https://s3-eu-west-1.amazonaws.com/prod-ucs-content-store-eu-west/content/pii:S1381116915000606/fx4/DOWNSAMPLED/image/jpeg/ef015732052f353a07dc2a3939465f6c/fx4.jpg fx4 fx4.jpg jpg 11466 84 528 IMAGE-DOWNSAMPLED 1-s2.0-S1381116915000606-fx3.jpg https://s3.amazonaws.com/prod-ucs-content-store-us-east/content/pii:S1381116915000606/fx3/DOWNSAMPLED/image/jpeg/30ff7ef065e37353e1f469621285b9cf/fx3.jpg https://s3-eu-west-1.amazonaws.com/prod-ucs-content-store-eu-west/content/pii:S1381116915000606/fx3/DOWNSAMPLED/image/jpeg/30ff7ef065e37353e1f469621285b9cf/fx3.jpg fx3 fx3.jpg jpg 7856 80 362 IMAGE-DOWNSAMPLED 1-s2.0-S1381116915000606-fx2.jpg https://s3.amazonaws.com/prod-ucs-content-store-us-east/content/pii:S1381116915000606/fx2/DOWNSAMPLED/image/jpeg/18cf65abc3a9a03d908d95ea1040f2f2/fx2.jpg https://s3-eu-west-1.amazonaws.com/prod-ucs-content-store-eu-west/content/pii:S1381116915000606/fx2/DOWNSAMPLED/image/jpeg/18cf65abc3a9a03d908d95ea1040f2f2/fx2.jpg fx2 fx2.jpg jpg 7751 75 369 IMAGE-DOWNSAMPLED 1-s2.0-S1381116915000606-fx1.jpg https://s3.amazonaws.com/prod-ucs-content-store-us-east/content/pii:S1381116915000606/fx1/DOWNSAMPLED/image/jpeg/4597307ba537ad2cfa5413e8ec46a4ea/fx1.jpg https://s3-eu-west-1.amazonaws.com/prod-ucs-content-store-eu-west/content/pii:S1381116915000606/fx1/DOWNSAMPLED/image/jpeg/4597307ba537ad2cfa5413e8ec46a4ea/fx1.jpg fx1 true fx1.jpg jpg 18021 200 500 IMAGE-DOWNSAMPLED 1-s2.0-S1381116915000606-sc1.sml https://s3.amazonaws.com/prod-ucs-content-store-us-east/content/pii:S1381116915000606/sc1/THUMBNAIL/image/gif/2396e700f4f58b6bb9031527535617d9/sc1.sml https://s3-eu-west-1.amazonaws.com/prod-ucs-content-store-eu-west/content/pii:S1381116915000606/sc1/THUMBNAIL/image/gif/2396e700f4f58b6bb9031527535617d9/sc1.sml sc1 sc1.sml sml 4807 164 184 IMAGE-THUMBNAIL 1-s2.0-S1381116915000606-gr3.sml https://s3.amazonaws.com/prod-ucs-content-store-us-east/content/pii:S1381116915000606/gr3/THUMBNAIL/image/gif/31108ff974616829d04be6a65172e8ed/gr3.sml https://s3-eu-west-1.amazonaws.com/prod-ucs-content-store-eu-west/content/pii:S1381116915000606/gr3/THUMBNAIL/image/gif/31108ff974616829d04be6a65172e8ed/gr3.sml gr3 gr3.sml sml 6185 89 219 IMAGE-THUMBNAIL 1-s2.0-S1381116915000606-gr2.sml https://s3.amazonaws.com/prod-ucs-content-store-us-east/content/pii:S1381116915000606/gr2/THUMBNAIL/image/gif/313414ece146ade700078bdd31937224/gr2.sml https://s3-eu-west-1.amazonaws.com/prod-ucs-content-store-eu-west/content/pii:S1381116915000606/gr2/THUMBNAIL/image/gif/313414ece146ade700078bdd31937224/gr2.sml gr2 gr2.sml sml 4669 163 196 IMAGE-THUMBNAIL 1-s2.0-S1381116915000606-gr1.sml https://s3.amazonaws.com/prod-ucs-content-store-us-east/content/pii:S1381116915000606/gr1/THUMBNAIL/image/gif/e7034ca94cb48896c51d31c2fb7be104/gr1.sml https://s3-eu-west-1.amazonaws.com/prod-ucs-content-store-eu-west/content/pii:S1381116915000606/gr1/THUMBNAIL/image/gif/e7034ca94cb48896c51d31c2fb7be104/gr1.sml gr1 gr1.sml sml 8670 81 219 IMAGE-THUMBNAIL 1-s2.0-S1381116915000606-fx7.sml https://s3.amazonaws.com/prod-ucs-content-store-us-east/content/pii:S1381116915000606/fx7/THUMBNAIL/image/gif/3b8d455f5dd072d41f7b9a18a69da5aa/fx7.sml https://s3-eu-west-1.amazonaws.com/prod-ucs-content-store-eu-west/content/pii:S1381116915000606/fx7/THUMBNAIL/image/gif/3b8d455f5dd072d41f7b9a18a69da5aa/fx7.sml fx7 fx7.sml sml 1828 132 168 IMAGE-THUMBNAIL 1-s2.0-S1381116915000606-fx6.sml https://s3.amazonaws.com/prod-ucs-content-store-us-east/content/pii:S1381116915000606/fx6/THUMBNAIL/image/gif/6f326338ad5b889bb246ce56425cff80/fx6.sml https://s3-eu-west-1.amazonaws.com/prod-ucs-content-store-eu-west/content/pii:S1381116915000606/fx6/THUMBNAIL/image/gif/6f326338ad5b889bb246ce56425cff80/fx6.sml fx6 fx6.sml sml 2051 39 219 IMAGE-THUMBNAIL 1-s2.0-S1381116915000606-fx5.sml https://s3.amazonaws.com/prod-ucs-content-store-us-east/content/pii:S1381116915000606/fx5/THUMBNAIL/image/gif/3b8d455f5dd072d41f7b9a18a69da5aa/fx5.sml https://s3-eu-west-1.amazonaws.com/prod-ucs-content-store-eu-west/content/pii:S1381116915000606/fx5/THUMBNAIL/image/gif/3b8d455f5dd072d41f7b9a18a69da5aa/fx5.sml fx5 fx5.sml sml 1828 132 168 IMAGE-THUMBNAIL 1-s2.0-S1381116915000606-fx4.sml https://s3.amazonaws.com/prod-ucs-content-store-us-east/content/pii:S1381116915000606/fx4/THUMBNAIL/image/gif/39263c7e49d162898e481a2496362084/fx4.sml https://s3-eu-west-1.amazonaws.com/prod-ucs-content-store-eu-west/content/pii:S1381116915000606/fx4/THUMBNAIL/image/gif/39263c7e49d162898e481a2496362084/fx4.sml fx4 fx4.sml sml 2149 35 219 IMAGE-THUMBNAIL 1-s2.0-S1381116915000606-fx3.sml https://s3.amazonaws.com/prod-ucs-content-store-us-east/content/pii:S1381116915000606/fx3/THUMBNAIL/image/gif/ec6db7a543f475d4083949e95f56ed1e/fx3.sml https://s3-eu-west-1.amazonaws.com/prod-ucs-content-store-eu-west/content/pii:S1381116915000606/fx3/THUMBNAIL/image/gif/ec6db7a543f475d4083949e95f56ed1e/fx3.sml fx3 fx3.sml sml 2530 48 219 IMAGE-THUMBNAIL 1-s2.0-S1381116915000606-fx2.sml https://s3.amazonaws.com/prod-ucs-content-store-us-east/content/pii:S1381116915000606/fx2/THUMBNAIL/image/gif/96d0ec33b19c52d45a19514659316b64/fx2.sml https://s3-eu-west-1.amazonaws.com/prod-ucs-content-store-eu-west/content/pii:S1381116915000606/fx2/THUMBNAIL/image/gif/96d0ec33b19c52d45a19514659316b64/fx2.sml fx2 fx2.sml sml 2398 45 219 IMAGE-THUMBNAIL 1-s2.0-S1381116915000606-fx1.sml https://s3.amazonaws.com/prod-ucs-content-store-us-east/content/pii:S1381116915000606/fx1/THUMBNAIL/image/gif/df14212a0f0dd69697a32e08cffdfa2a/fx1.sml https://s3-eu-west-1.amazonaws.com/prod-ucs-content-store-eu-west/content/pii:S1381116915000606/fx1/THUMBNAIL/image/gif/df14212a0f0dd69697a32e08cffdfa2a/fx1.sml fx1 true fx1.sml sml 4423 88 219 IMAGE-THUMBNAIL MOLCAA 9428 S1381-1169(15)00060-6 10.1016/j.molcata.2015.02.012 Elsevier B.V. Scheme 1 Schematic flow reactor for the representative preparation of 3a. Fig. 1 TEM micrographs of PdNP/α-ZrPK catalyst. Fig. 2 XRPD pattern of PdNP/α-ZrPK catalyst. Fig. 3 TEM micrographs of PdNP/α-ZrPK after six cycles at different magnification. Table 1 Optimization of reaction conditions in the Heck coupling of iodobenzene (1a) and methyl acrylate (2). Entry a Base T (°C) t (h) Conv % b Pd (ppm) c 1 TEA 70 24 66 n.d 2 TEA 90 24 >99 24 3 TEA 120 3 >99 d 34 4 PS-TEA 90 24 >99 8 5 PS-TEA 120 3 >99 6 a Reaction conditions: 1a (1.0mmol), 2 (1.2mmol), base (1.2mmol), catalyst (0.1mol%), CH3CN/H2O az. (84%, 1M, 1mL). b Conversion of 1a to 3a is measured by GLC analyses, the remaining material is unreacted 1a. c Determined by ICP-OES analysis of crude reaction product. d In presence of 0.01, 0.05 and 0.08mol% of Pd the conversion of 1a to 3a, after 3h at 120 °C, was 32, 86 and 98%, respectively. Table 2 Recycling test of PdNP/α-ZrPK in the Heck reaction between iodobenzene (1a) and methyl acrylate (2) in CH3CN/H2O az. Run a Conv % b Yield (%) c Pd (ppm) d 1 >99 96 34 2 >99 98 25 3 >99 97 11 4 >99 98 14 5 >99 97 15 6 >99 96 16 a First cycle: 1a (6.0mmol), 2 (7.2mmol), TEA (7.2mmol), catalyst (0.1mol%), CH3CN/H2O az. (84%, 1M, 6mL), 120°C, 3h. Successive cycles: the reagents and medium quantities were calculated on the basis of the amount of recovered catalyst. b Conversion of 1a to 3a is measured by GLC analyses, the remaining material is unreacted 1a. c Yield of isolated product 3a. d Determined by ICP-OES analysis of crude reaction product. Table 3 Heck reaction between aryl iodide 1a–h and methyl acrylate (2). Entry a Product R Conv (%) b 3/4 Yield (%) c 1 3a H >99 100 98 2 3b 4-NO2 >99 95:5 92 d 3 3c 4-COCH3 99 100 99 4 3d 4-CH3 >99 100 96 5 3e 4-OCH3 >99 100 99 6 3f 2-COCH3 99 93:7 90 d 7 3g 2-CH3 94 100 89 d 8 3h >99 84:16 71 d a Reaction conditions: aryl iodide 1a–h (1.0mmol), 2 (1.2mmol), TEA (1.2mmol), catalyst (0.1mol%), CH3CN/H2O az. (84%, 1M, 1mL), 120°C, 3h. b Conversion of 1 to 3 and 3/4 ratio are measured by GLC and 1H NMR analyses, the remaining material is unreacted 1. c Yield of isolated products 3. d After column chromatography purification. Table 4 Heck reaction between aryl iodides 1a–h and styrene (5). Entry a Product R Conv (%) b 6/7/4 b Yield (%) c 1 d 6a H 98 88:12:0 91 2 6a H >99 86:14:0 92 3 6b 4-NO2 96 95:5:0 95 4 6c 4-COCH3 98 94:6:0 97 5 6d 4-CH3 95 86:14:0 94 6 6e 4-OCH3 90 84:16:0 88 7 6f 2-COCH3 94 74:7:19 73 8 6g 2-CH3 70 89:11:0 67 9 6h 99 85:10:5 92 a Reaction conditions: aryl iodide 1a–h (1.0mmol), 5 (1.2mmol), TEA (1.2mmol), catalyst (0.1mol%), CH3CN/H2O az. (84%, 1M, 1mL), 120°C, 4h. b Conversion of 1 to 6 and 6/7/4 ratio are measured by GLC and 1H NMR analyses, the remaining material is unreacted 1. c Yield of isolated products (6 + 7). d Reaction time 3h. Immobilized palladium nanoparticles on potassium zirconium phosphate as an efficient recoverable heterogeneous catalyst for a clean Heck reaction in flow Chiara Petrucci a Matteo Cappelletti a Oriana Piermatti a ⁎ Morena Nocchetti b Monica Pica b Ferdinando Pizzo a Luigi Vaccaro a ⁎ a Laboratory of Green Synthetic Organic Chemistry, CEMIN – Dipartimento di Chimica, Biologiae Biotecnologie, Università di Perugia, Via Elce di Sotto, 8; Perugia, Italy Laboratory of Green Synthetic Organic Chemistry CEMIN – Dipartimento di Chimica, Biologiae Biotecnologie Università di Perugia Via Elce di Sotto, 8 Perugia Italy b Dipartimento di Scienze Farmaceutiche, Università di Perugia, Via Fabretti; Perugia, Italy Dipartimento di Scienze Farmaceutiche Università di Perugia Via Fabretti; Perugia Italy ⁎ Corresponding authors. Tel.: +39 755855559; fax: +39 755855560. Graphical abstract Palladium nanoparticles on layered potassium α-zirconium phosphate (PdNP/α-ZrPK) with high palladium loading (10.6wt%) have been prepared and used as catalyst in low amount (0.1mol% of Pd) in the Heck reaction of methyl acrylate and styrene with a series of aryl iodides in CH3CN/H2O azeotrope as a green medium. The procedure has been optimized under flow conditions obtaining an extremely low waste production (E-factor) and allowing to isolate the final product with very low residual palladium content without any purification step. Keywords Heck reaction Heterogeneous catalysis Palladium nanoparticles Recoverable reaction media Flow chemistry 1 Introduction Heck reaction is one of the most powerful and widely used methods to couple alkenes with aryl halides [1–3]. The resulting products have found extensive applications as intermediates in the preparation of materials [4–8], natural products and bioactive compounds [9–14]. Problems associated with separation and recovery of homogeneous palladium catalysts represent major limit in the industrial and synthetic applications of Heck reaction. This latter aspect, together with the high cost of metal catalysts and their known toxic effects, have led to an increased interest in immobilizing metal catalysts onto solid supports [2,15–17]. In fact, recoverable and reusable heterogeneous catalysts may significantly help to minimize waste production contributing to the development of sustainable chemical processes [18–21]. A variety of organic and inorganic supports have been explored to develop efficient heterogenous palladium sources [2,3,17,22]. Recently, supported metal palladium nanoparticles (PdNPs) with a high surface to volume ratio have attracted a great deal of attention as stable and recoverable ligand-free catalysts. [23–28]. It has been recently reported that palladium nanoparticles immobilized on various supports have been employed in the Heck reaction [29–33]. However the stability and reactivity of these catalytic systems are highly dependent on the support used for the immobilization. Therefore, the search for new efficient supports for catalytically active palladium nanoparticles is a wide ongoing area of research. Tetravalent metal phosphates and phosphonates featuring a layered structure are attracting supports for metal nanoparticles because of their chemical and thermal stability [34] and high versatility [35–42]. In addition, since they are insoluble in water and organic solvents, they can be easily recovered by simple filtration or centrifugation and efficiently reused [35–51]. Layered zirconium hydrogen phosphate with an α-type structure (α-Zr(HPO4)2·H2O) is a well known material, consisting of layers made of planes of zirconium atoms bonded to monohydrogen phosphate groups, on both sides of each plane. Several monovalent and divalent cations are able to exchange the α-ZrP protons, thus providing a variety of ionic groups on the layer surface. It was found that the presence of cations, such as Na+ and K+, in the ion exchange sites of the support, improves the catalytic properties for metallic silver particles [52]. As a matter of fact, these cations turned out to stabilize the silver catalyst, by blocking the exchange sites for the Ag+ ions, thus hindering their back diffusion [52]. Therefore, layered potassium α-zirconium phosphate α-Zr(KPO4)2 (hereafter α-ZrPK) is a promising support for the immobilization and stabilization of palladium nanoparticles. Recently, we have been involved in the development of novel solid catalysts to be used in benign reaction media for the definition of environmentally-efficient processes [43–48,53–57]. In this contribution we report the preparation of PdNPs supported on layered potassium α-zirconium phosphate as catalyst for the Heck cross-coupling reaction. The main goal of this study is the preparation of highly-performing heterogeneous Pd catalysts able to be used efficiently in sustainable reaction media, in order to develop an environmentally friendly method for the Heck reaction. As a matter of fact, Heck reaction is usually carried out in aprotic polar solvent such us N,N’-dimethylformamide (DMF) and N-methylpyrrolidone (NMP), which are among the most undesirable media, because of their toxicity and difficult disposal [58,59]. In this contribution we have investigated the use of the prepared catalytic material in the azeotropic mixture CH3CN/H2O 84% as a safer and easily recoverable reaction medium, alternative to conventional dipolar aprotic media. In fact, in coupling processes such as Heck reaction, the need of combined organic/aqueous media is common to reach highest efficiency. We are investigating, at this purpose, the use of aqueous azeotropes which is truly interesting because, while they combine the properties of organic and aqueous media, they also have the potential of being recovered at the end of the reaction and reused without increasing the amount of waste. Moreover, in this case acetonitrile is an acceptable solvent, recommended as alternative to DMF or NMP [58,59]. To the best of our knowledge, this is the first example of the use of layered α-ZrPK as palladium support in acetonitrile/water azeotrope. The base has a fundamental role in the Heck reaction mechanism, since it regenerates the active Pd species in the last step of the catalytic cycle. Although, homogeneous bases such as triethylamine (TEA) are generally used, thus work up procedures are needed to isolate the pure products. In view of waste minimization, we were able to avoid wasteful work up procedures using a polystyrene-supported base (PS-TEA), removable by simple filtration. In addition, the use of flow technology may offer several advantages as compared to traditional batch reactor. Flow reactors have proved to be efficient tools to optimize the recovery and reuse of the catalyst, minimize waste and in particular the amount of organic solvent needed to isolate the final products [60]. After optimization of the reaction in batch conditions, we applied the flow technology for the development of sustainable protocol for Heck reaction. 2 Experimental 2.1 General remarks All chemicals were purchased and used without any further purification. 1H NMR, and 13C NMR spectra were recorded at 400MHz and 100.6MHz, respectively, on a Bruker DRX-ADVANCE 400MHz in CDCl3 using TMS as the internal standard. Zr and Pd analyses were performed on a ICP Varian Liberty inductively coupled plasma-optical emission spectrometry (ICP-OES) with axial injection. C, H, N elemental analyses (EA) were performed on a Fisons EA1108CHN. X-ray diffraction patterns (XRPD) of powders were collected with a Philips X’Pert PRO MPD diffractometer operating at 40kV and 40mA, with a step size 0.03341 and step scan 40s, using Cu Kα radiation and an X’Celerator detector. Transmission electron microscopy (TEM) analysis was carried out by a Philips 208 transmission electron microscope, operating at an accelerating voltage of 100kV. Powders were rapidly diluted in ethanol, then supported on copper grids (200 mesh) precoated with Formvar carbon films, and quickly dried. GLC analyses were performed by using Hewlett-Packard HP 5890 A equipped with a capillary column DB-35MS (30m, 0.53mm), a FID detector and hydrogen as gas carrier. GC-EIMS analyses were carried out by using a Hewlett-Packard HP 6890N Network GC system/5975 Mass Selective Detector equipped with an electron impact ionizer at 70eV. Thin layer chromatography analyses were performed with silica gel on aluminum plates (silica gel 60 F254, Fluka). Column chromatography purification was performed with silica gel (230–400 mesh) eluting with hexane or mixture hexane/ethyl acetate (98:2–70:30). Melting points are uncorrected and were measured on a Büchi 510. Flow procedures were performed using a Jasco PU-2080HPLC pump, a Omnifit glass column as reservoir and a Supelco HPLC column blank as the base/catalyst column. All the equipment was connected using 1/16′ OD PTFE tubing and stainless steel 1/16 ODx0.02 ID capillary tubing and Hamilton HPV Plug Valves. The system was placed in a ventilated Plexiglas box equipped with a electrical resistance heating. Diethylaminomethyl-polystyrene (PS-TEA) was prepared by reacting Merrifield resin (200–400 mesh, 4.4mmol/g Cl loading, 2% cross-linked with divinylbenzene) with diethylamine (2.5 equiv) in toluene at 100°C for 24h. The resin was then washed with a 0.5M solution of diethylamine in toluene, then toluene, dichloromethane, water and acetone to remove the excess amine, then dried under vacuum. The loading of amine is calculated by C, H, N elemental analysis (EA) on the element nitrogen, which is not contained in the purified and fully dried polimeric support. Solid NMR analyze also confirm the absence of free amine. Compounds 3a [61], 3b [61], 3c [61], 3d [62], 3e [61], 3f [63], 3g [62], 3h [61], 6a [61], 6b [64], 6c [61], 6d [65], 6e [61], 6f [66], 6g [65], 6h [66] are known. 2.2 Preparation of α-Zr(KPO4)2, (α-ZrPK) α-ZrPK was obtained by titration with KOH 0.1M in KCl 0.1M of α-Zr(HPO4)2·H2O, prepared according to Alberti and Costantino method [67]. To a suspension of α-Zr(HPO4)2·H2O (2g, 6.64mmol) in KCl 0.1M (300mL), KOH 0.1M (133mL) was added slowly, under stirring, keeping the pH below 9. The titration is complete in about three days (the complete potassium exchange is verified by XRPD analysis). The obtained α-ZrPK was separated from aqueous medium by centrifugation, washed with water (3×100mL) and finally dried at 80°C for 24h (2.2g). 2.3 Preparation of PdNP/α-ZrPK To a suspension of α-ZrPK (0.5g) in ethanol (25mL), palladium acetate (0.112g, 0.5mmol) was added and the mixture stirred at 50°C for 20h. Then, the obtained dark solid material was separated by centrifugation, washed with ethanol (2×10mL) and dried at 50°C for 24h (0.46g). The PdNP/α-ZrPK catalyst was characterized by using ICP-OES, XRPD and TEM techniques. 2.3.1 E-factor calculations for the preparation of PdNP/α-ZrPK E-factor=[0.5g (α-ZrPK)+19.72g (ethanol)+0.112g (Pd(OAc)2)+15.78g (ethanol wash)−0.460g (PdNP/α-ZrPK)]/0.460g (PdNP/α-ZrPK)=77.5. 2.3.2 Determination of Pd content A weighed amount of the PdNP/α-ZrPK catalyst was first treated with concentrated HF in order to dissolve α-ZrPK, then with aqua regia to digest the Pd species, and the obtained solution was diluted with deionized water and analyzed by ICP-OES. The Pd content was determined to be 1mmol/g, which is equal to 10.6wt% Pd loading. 2.4 General procedure for the Heck reaction under batch conditions To a solution of the aryl iodide 1a–h (1mmol) and the alkene 2 or 5 (1.2mmol) in CH3CN/H2O az. (1M, 1mL), triethylamine (TEA, 1.2mmol) and catalyst PdNP/α-ZrPK (0.1mol%, 1mg) were added. The reaction mixture was stirred at 120°C for 3h with methyl acrylate (2) and for 4h with styrene (5); the conversion of the aryl iodide 1a–h was monitored by GLC analyses. The reaction mixture was diluted with water (2mL) and extracted with ethyl acetate (3×3mL). The combined organic layers were dried with sodium sulfate and evaporated under reduced pressure to give the products 3a–h and 6a–h. 2.4.1 Representative E-factor calculations for batch reaction with TEA E-factor for Heck reaction of iodobenzene (1a) (1mmol) and methyl acrylate (2) (1.2mmol) (98% isolated yield): E-factor=[0.204g (iodobenzene (1a))+0.103g (methyl acrylate (2))+0.121g (TEA)+0.818g (1mL CH3CN/H2O 84:16)+2g (water)+8.1g (ethyl acetate)−0.159g (methyl cinnamate (3a))]/0.159 g (methyl cinnamate (3a))=70.4. (catalyst was not considered due to its recovery and recycle) 2.5 General procedure for recovery and reuse of PdNP/α-ZrPK in the Heck reaction under batch conditions To a solution of iodobenzene (1a, 6mmol) and methyl acrylate (2, 7.2mmol) in CH3CN/H2O az. (1M, 6mL), triethylamine (7.2mmol) and catalyst PdNP/α-ZrPK (0.1mol%, 6mg) were added. The reaction mixture was stirred at 120°C for 3h; the conversion of the iodobenzene (1a) was monitored by GLC analyses. The solid catalyst was separated by centrifugation and then washed with CH3CN/H2O az. (2×1mL), dried at 50°C for 3h and reused in a successive cycle. The product 3a was isolated after extraction with ethyl acetate. 2.6 General procedure for the Heck reaction in presence of PS-TEA under batch conditions To a solution of iodobenzene (1a, 1mmol) and methyl acrylate (2, 1.2mmol) in CH3CN/H2O az. (1M, 1mL), diethylaminomethyl-polystyrene (PS-TEA, 3.84mmol/g, 1.2 equiv, 0.312g) and catalyst PdNP/α-ZrPK (0.1mol%, 1mg) were added. The reaction mixture was stirred at 120°C for 3h; the conversion of the iodobenzene (1a) was monitored by GLC analyses. The heterogeneous base and catalyst were separated by filtration and the product 3a isolated by distillation of the azeotrope. 2.6.1 Representative E-factor calculations for the batch reaction with PS-TEA E-factor for Heck reaction of iodobenzene (1a) (1mmol) and methyl acrylate (2) (1.2mmol) (96% isolated yield): E-factor=[0.204g (iodobenzene (1a))+0.103g (methyl acrylate (2))+0.312g (PS-TEA)+0.001g (PdNP/α-ZrPK)+0.818g (1mL CH3CN/H2O 84:16)−0.155g (methyl cinnamate (3a))]/0.155g (methyl cinnamate (3a))=8.3. 2.7 Heck reaction of iodobenzene (1a) and methyl acrylate (2) under flow conditions A pre-mixed mixture of iodobenzene (1a) (50mmol, 5.60mL) and methyl acrylate (2) (60mmol, 5.40mL) in CH3CN/H2O az. (50mL) was charged into a glass column functioning as a reservoir. Diethylaminomethyl-polystyrene (3.84mmol/g, 75mmol, 19.5g) and the catalyst PdNP/α-ZrPK (0.1mol%, 50mg) were mixed and dispersed in 1mm diameter solid glass beads and charged in a stainless steel HPLC column; the equipment was connected, by using the appropriate valves, to a pump and installed into a thermostated box. The reaction mixture was continuously pumped (flow rate 2.0mL/min) through the base - catalyst column at 130°C until complete conversion of reactants to methyl cinnamate (3a) was achieved (the reaction was monitored by GLC). At this stage, the pump was left to run in order to recover the reaction mixture into the reservoir. To completely recover the product and clean the reactor, CH3CN/H2O azeotrope (3×25mL at a 2mL/min) was cyclically pumped through the base - catalyst column for 15min (each fraction) and then collected into the reservoir to isolate the product in 89 % yield, after removal and recovery of the azeotrope (95% of which was recovered) via distillation. 2.7.1 Representative E-factor calculations for the reaction in flow at 120°C E-factor for Heck reaction of iodobenzene (1a) (50mmol) and methyl acrylate (2) (60mmol) (89% isolated yield): E-factor=[10.20g (iodobenzene (1a))+5.40g (methyl acrylate (2))+102.25g (medium)+19.5g (PS-TEA)+0.050g (catalyst)−7.20g (methyl cinnamate (3a))−97.15g (95% recovered medium)]/7.20g (methyl cinnamate (3a))=4.6. 3 Results and discussion 3.1 Catalyst preparation and characterization The layered potassium α-zirconium phosphate (α-ZrPK), has been easily prepared by titration with 2 equiv. of KOH of a suspension of α-zirconium hydrogen phosphate, α-Zr(HPO4)2·H2O, in a 1M solution of KCl [67]. The solid was separated by centrifugation, washed with water and dried at 80°C for 24h. We decided to prepare the heterogeneous palladium catalyst by the immobilization of palladium nanoparticles (PdNPs) on α-ZrPK using the method of alcohol reduction of palladium acetate [24,29]. To a suspension of α-ZrPK in EtOH, palladium acetate (1mmol for 1g of support) was added and the mixture stirred at 50°C for 20h. The PdNP/α-ZrPK was separated by centrifugation, washed with ethanol and dried at 50°C for 24h. The PdNP/α-ZrPK was characterized by using ICP-OES, XPRD and TEM techniques. Fig. 1 shows two representative TEM micrographs of PdNP/α-ZrPK before the catalytic tests. The surface of the α-ZrPK platelets is decorated with the PdNPs, which show an almost spherical morphology, and a relatively good monodispersity. The PdNPs size range from 5 to 20nm. The XRPD of the catalyst (Fig. 2 ) shows the typical (002) reflection of anhydrous α-ZrPK (2θ =10°), suggesting that the interlayer region did not undergo significant modifications during the preparation of the catalyst. Additional reflections in the range 35–70° 2θ were assigned to the (111), (200) and (220) crystalline planes of the typical cubic phase of metallic palladium (JCPDS #05-06-81). The average size of the palladium crystalline domains was determined by using the Debye–Scherrer formula [68], from the (111) X-ray line broadening, corrected for the instrumental broadening, by using LaB6 as an external peak profile standard. The average crystalline domain size of the PdNPs on α-ZrPK is estimated to be about 9nm, in good agreement with the data obtained from TEM analysis. A Pd content of 1mmol/g (10.6wt%) was determined by ICP-OES analysis. It should be noticed that this high palladium loading value is very useful in view of larger scale protocols, allowing the use of minimal quantities of catalytic material. 3.2 Catalytic activity We started our investigation testing the catalytic activity of PdNP/α-ZrPK in the Heck reaction between iodobenzene (1a) e methyl acrylate (2) in CH3CN/H2O azeotrope (Table 1 ). In the presence of triethylamine (TEA) as the base, at 70°C the conversion after 24h is only 66% (Table 1, entry 1). Increasing the reaction temperature up to 90°C the reaction was complete after 24h (Table 1, entry 2). The time required to reach complete conversion of 1a decreased to 3h when the reaction was performed at 120°C (Table 1, entry 3). Decreasing the amount of Pd from 0.1 to 0.01mol%, the conversion of 1a to 3a, after 3h at 120°C, strongly decreased to 32% (Table 1, entry 3). The ICP-OES analyses of crude products, obtained by standard work-up procedure (filtration, extraction with ethyl acetate, evaporation of solvent under reduced pressure), revealed the presence of palladium. It is known that Heck reaction may proceed through a “release and catch” mechanism [21,61,69–75] and that common dipolar aprotic media and some organic bases strongly bind the soluble palladium species, facilitating its dissolution from the support and consequently the leaching into the products [76–78]. On this regard, it should be considered that, although the palladium amount exceeded the allowed upper limit value [79], the percentage of Pd leaching was less than 4.5%, with respect to the initial amount in the PdNP/α-ZrPK catalyst. It should be noticed that, besides the Pd leaching is often limited at higher temperatures [74,80], in this case an increase in the reaction temperature from 90 to 120°C had a minimal influence on the palladium contamination of the products (Table 1, entry 3 vs 2). This may be due to the complexing ability of the homogenous TEA [76–78]. In order to simplify the work-up procedure, but also reduce the leaching, we investigated the use of a heterogeneous base, namely diethylaminomethyl-polystyrene (PS-TEA) which can be removed by simple filtration of the reaction mixture, therefore making possible the isolation of the final product after the distillation of the azeotropic reaction medium. As aforementioned, a homogeneous tertiary amine is generally used for its fundamental role in regenerating the active palladium species [81], with the consequent formation of the corresponding ammonium salt. Therefore, purification steps such as extraction or column chromatography are normally needed to remove the salt, leading to the production of a great amount of waste. Indeed, the resulting environmental factor (E-factor) values (kg of waste/kg of isolated desired product) in academic literature protocols are generally very high [82,83]. As shown in Table 1, when the reaction was performed in the presence of PS-TEA, the catalytic activity was unchanged while the Pd leaching greatly decreased (Table 1, entries 4 and 5). Indeed, at 120°C (Table 1, entry 5) the Pd content in the product is only 6ppm, very close to the allowed limit value [79]. It is reasonable to suppose that the polystyrene-bonded amino groups can act as capping agents for the PdNPs, as a result the Pd leaching is noticeably reduced [84–87]. At this point, in order to evaluate the robustness of the prepared catalyst and thus its recovery and reuse, recycle tests were performed in batch, for the reaction with homogeneous TEA. In fact, when PS-TEA is used in batch, it is not possible to separate the catalytic material from the heterogeneous base at the end of the reaction. For each cycle, the catalyst is recovered by centrifugation, washed with CH3CN azeotrope and reused in the next cycle (Table 2 ). The solid catalyst was used six times without loss of activity achieving a TON of ca. 6000 and a TOF of ca. 333h−1. Conversion after 1h of reaction time was also evaluated and a consistent conversion of 1a to 3a of ca. 36% was observed in all the cycles. The ICP-OES analyses of crude products confirmed that the palladium leaching was relatively high in the first cycle, but it decreased in the successive cycle suggesting a stabilization of the PdNP/α-ZrPK catalyst. In Fig. 3 the TEM images of PdNP/α-ZrPK after six cycles are shown. The PdNPs still have a spherical morphology with a good monodispersity, but the particles size range increased from 5–20nm of the starting material (Fig. 1) to 15–60nm after six cycles. The little increase of particles size doesn’t affect the catalytic activity but gives an increased stability to the immobilized palladium nanoparticles. To confirm the efficiency of PdNP/α-ZrPK in the Heck reaction, we extended the coupling to several aryl iodides (1a–h) with methyl acrylate (2) (Table 3 ) and styrene (5) (Table 4 ). The reactions of the aryl iodides (1a–h) with methyl acrylate (2) (Table 3) were carried at 120°C for 3h, in presence of 0.1mol% of PdNP/α-ZrPK, obtaining from high to quantitative conversions of 1 and excellent yields of isolated products 3a–h. For 4-nitro-iodobenzene (1b), 2’-iodoacetophenone (1f) and 2-iodothiophene (1h) we observed the formation of the corresponding homocoupling products: the biphenyls 4b, 4f and 4h and therefore the products 3b, 3f and 3h were purified by column chromatography (Table 3, entries 2, 6 and 8). When styrene (5) was used with iodobenzene (1a), longer reaction time was needed to achieve quantitative conversion (Table 4, entries 1–2). Therefore, a reaction time of 4h was adopted in the reactions between the aryl iodides 1a–h and styrene (5) (Table 4, entries 2–9). In all cases we observed the formation of the gem-products 7a–h and for 2’-iodoacetophenone (1f) and 2-iodothiophene (1h) we observed also the formation of the corresponding homocoupling products, namely the biphenyls 4f and 4h (Table 4, entries 7 and 9). According to our project, we have also defined a flow procedure to optimize the efficiency of the process and simplify the isolation of the pure products, while minimizing the waste production. In order to study the catalytic behavior of the prepared catalyst, PdNP/α-ZrPK, under flow conditions, the Heck reaction between iodobenzene (1a) and methyl acrylate (2) was selected as representative model process using CH3CN/H2O azeotrope as medium and the heterogeneous PS-TEA as base. We realized the flow protocol by charging a mixture of the catalyst PdNP/α-ZrPK and the supported base PS-TEA (1.5 equiv) in a stainless-steel HPLC column, while the reactants solution was charged in another glass column, acting as the reservoir (Scheme 1 ). All the equipment was connected, by using the appropriate valves, to a pump and installed into a thermostated box (not shown in Scheme 1 for clarity). After setting the temperature at 120°C, the reaction mixture was cyclically pumped through the columns at a 2.0mL/min flow rate for the time required to obtain quantitative conversion of 1a to 3a (8h, monitored by GLC). The column containing the PS-TEA and catalyst was then cyclically washed with acetonitrile/water azeotrope (0.5mL/mmol, 3 times at 2mL/min) to clean all the equipment and completely recover the product 3a. Finally, the product was isolated in high purity after distillation of the medium at ambient pressure, without any further purification step, in 89% yield. The ICP analyses revealed a Pd content of ca. 6ppm. The CH3CN aqueous azeotrope distilled off after reaction complexion, was recovered with a high purity (GLC analysis), totally comparable to the starting azeotropic mixture, thus being reusable without affecting the reaction yield. To evaluate the waste minimization we calculated the E-Factor value for both the batch and the flow protocol. The reaction performed in batch using TEA as the base featured an E-Factor value of 70.4, mainly affected by the need of extraction work-up. Using PS-TEA under flow conditions on a larger scale (50mmol) we were able to reduce this value to 4.6, since no purification steps were required and the reaction medium was recovered. Performing the reaction in cyclic flow conditions we were able to exploit the aforementioned “release and catch” mechanism [21,61,69–75], in which the supported palladium nanoparticles serve as reservoir for active Pd species that are dissolved from the solid catalyst and can move through the flow apparatus. The soluble Pd species are then effectively scavenged by the support after reaction completion, as proved by the low level of residual Pd in the products. Alternatively, direct flow conditions furnished unreacted product with increased palladium content. 4 Conclusion In this contribution we reported the preparation of an efficient and recyclable catalyst for the Heck cross-coupling reaction, based on palladium nanoparticles supported on layered potassium α-zirconium phosphate. The catalytic material features a high palladium loading (1mmol/g), allowing its use in minimal quantity, moreover it proved to be recoverable and recyclable. We successfully used a promising recoverable medium, i.e. the acetonitrile/water azeotrope, which can be an effective alternative to highly toxic dipolar aprotic solvent, such as DMF, commonly used in Heck cross-coupling reaction. A great reduction of the waste produced was given by the combined use of a recoverable medium and a heterogeneous base, which was removed from the reaction mixture by simple filtration, avoiding wasteful work up procedures. Finally, the flow technology has proved to be an alternative efficient stirring method, able to preserve the physical integrity and activity of the heterogeneous catalyst and contribute to waste minimization. Indeed with the flow approach we were able to noticeably simplify the experimental procedures and to achieve an E-Factor reduction from 70.4 to 4.6. Acnowledgements We gratefully acknowledge the Università degli Studi di Perugia, and the Ministero dell’Istruzione, dell’Università e della Ricerca (MIUR) for the financial support. References [1] I.P. Beletskaya A.V. Cheprakov Chem. Rev. 100 2000 3009 3066 [2] L. Yin J. Liebscher Chem. Rev. 107 2007 133 173 [3] D. Astruct Inorg. Chem. 46 2007 1884 1894 [4] L.F. Tietze G. Kettschau U. Heuschert G. Nordmann Chem. Eur. J. 7 2001 368 373 [5] Z. Peng A.R. Gharari I. Yu J. Am. Chem. Soc. 119 1997 4622 4632 [6] F. Babudri G.M. Farinola F. Naso J. Mater. Chem. 14 2004 11 34 [7] Y. Lim Y.-S. Park Y. Kang D.Y. Jang J.H. Kim J.-J. Kim A. Sellinger D.Y. Yoon J. Am. Chem. Soc. 133 2011 1375 1382 [8] C. Torborg M. Beller Adv. Synth. Catal. 351 2009 3027 3043 [9] T. Mizutani S. Honzawa S.-Y. Tozaki M. Shibasaki Angew. Chem. 114 2002 4874 4876 [10] J.G. de Vries Can. J. Chem. 79 2001 1086 1092 [11] C. Torbog M. Beller Adv. Synth. Catal. 351 2009 3027 3043 [12] B.M. Coudary S. Madhi N.S. Chowdari M.L. Kantam B. Sreedhar J. Am. Chem. Soc. 124 2002 14127 14136 [13] A. Häberli C.J. Leumann Org. Lett. 3 2001 489 492 [14] A. Corma P. Concepción I. Domínguez V. Forné M.J. Sabater J. Catal. 251 2007 39 47 [15] D.J. Cole-Hamilton Science 299 2003 1702 1706 [16] C.E. Garret K. Prasad Adv. Synth. Catal. 346 2004 889 900 [17] M. Lamblin L. Nassar-Hardy J.-C. Hierso E. Fouquet F.-X. Felpin Adv. Synth. Catal. 352 2010 33 79 [18] A. Kirschnig H. Monenschein R. Wittenberg Angew. Chem. Int. Ed. 40 2001 650 679 [19] M. Poliakkoff J.M. Fitzpatrick T.R. Farren P.T. Anastas Science 279 2002 807 810 [20] V. Farina Adv. Synth. Catal. 346 2004 1553 1582 [21] N.T.S. Phan M. Van Der Sluys C.W. Jones Adv. Synth. Catal. 348 2006 609 679 [22] C. Mateos J.A. Rincón B. Martín-Hidalgo J. Villanueva Tetrahedron Lett. 55 2014 3701 3705 [23] J.M. Campelo D. Luna R. Luque J.M. Marinas A.A. Romero ChemSusChem 2 2009 18 45 [24] A. Khalafi-Nezhad F. Panahi Green Chem. 13 2011 2408 2415 [25] P.D. Burton T.J. Boyle A.K. Datye J. Catal. 28 2011 145 149 [26] C. Deraedt L. Salmon L. Etienne J. Ruiz D. Astruc Chem. Commun. 49 2013 8169 8171 [27] Q. Zhang H. Su J. Luo Y. Wei Catal. Sci. Technol. 3 2013 235 243 [28] A. Balanta C. Godard C. Claver Chem. Soc. Rev. 40 2011 4973 4985 [29] A. Khalafi-Nezhad F. Panahi ACS Sustain. Chem. Eng. 2 2014 1177 1186 [30] A.V. Martinez J.A. Myoral J.I. Garcia Appl. Catal. A: Gen. 472 2014 21 28 [31] E. Rafiee A. Ataei S. Nadri M. Joshaghani S. Eavani Inorg. Chim. Acta. 409 2014 302 309 [32] A.L. Isfahani I. Mohammadpoor-Balfork V. Mirkhani A.R. Khosropour M. Moghadam S. Tangestaninejad Adv. Synth. Catal. 355 2013 957 972 [33] Y.V. Ioni S.E. Lyubinov V.A. Davankov S.P. Gubin Russ. J. Inorg. Chem. 58 2013 392 394 [34] C.E. Song S.-G. Lee Chem. Rev. 102 2002 3495 3524 [35] A. Clearfielf U. Costantino G. Alberti T. Bein Comprehensive Supramolecular Chemistry Vol. 7 1996 Pergamon Press Oxford p.107. [36] G. Alberti M. Casciola U. Costantino R. Vivani Adv. Mater. 8 1996 291 303 [37] R. Vivani G. Alberti F. Costantino M. Nocchetti Micropor. Mesopor. Mater. 107 2008 58 70 [38] M. Curini O. Rosati U. Costantino Curr. Org. Chem. 8 2004 591 606 [39] A. Clearfield Z. Wang J. Chem. Soc. Dalton Trans. 2002 2937 2947 [40] A. Clearfield Dalton Trans. 2008 6089 6102 [41] F. Benvenuti C. Carlini P. Patrono A.M. Raspolli Galletti G. Sbrana M.A. Massucci P. Galli Appl. Catal. A: Gen. 193 2000 147 153 [42] Z. Wang J.M. Heising A. Clearfield J. Am. Chem. Soc. 125 2003 10375 10383 [43] U. Costantino F. Fringuelli M. Nocchetti O. Piermatti App. Catal. A: Gen. 326 2007 100 105 [44] U. Costantino F. Fringuelli M. Orrù M. Nocchetti O. Piermatti F. Pizzo Eur. J. Org. Chem. 2009 1214 1220 [45] A. Cipiciani U. Costantino F. Bellezza F. Fringuelli M. Orrù O. Piermatti F. Pizzo Catal. Today 152 2010 61 65 [46] D. Lanari F. Montanari F. Marmottini O. Piermatti M. Orrù L. Vaccaro J. Catal. 277 2011 80 87 [47] S. Calogero D. Lanari M. Orrù O. Piermatti F. Pizzo L. Vaccaro J. Catal. 282 2011 112 119 [48] M. Angeloni O. Piermatti F. Pizzo L. Vaccaro Eur. J. Org. Chem. 2014 1716 1726 [49] N. Kumada T. Nakatani Y. Yonesaki T. Takei N. Kinomura J. Mat. Sci. 43 2008 2206 2212 [50] J.-H. Jung H.-J. Sohn Micropor. Mesopor. Mater. 106 2007 49 55 [51] Y. Feng W. He X. Zhang X. Jia H. Zhao Mater. Lett. 61 2007 3258 3261 [52] S. Cheng A. Clearfield J. Catal. 94 1985 455 467 [53] M. Alonzi M.P. Bracciale A. Broggi D. Lanari A. Marrocchi M.L. Santarelli L. Vaccaro J. Catal. 309 2014 260 267 [54] E. Ballerini P. Crotti I. Frau D. Lanari F. Pizzo L. Vaccaro Green Chem. 15 2013 2394 2400 [55] T. Angelini S. Bonollo D. Lanari F. Pizzo L. Vaccaro Org. Biomol. Chem. 11 2013 5042 5046 [56] C. Pavia E. Ballerini L.A. Bivona F. Giacalone C. Aprile L. Vaccaro M. Gruttadauria Adv. Synth. Catal. 355 2013 2007 2018 [57] G. Strappaveccia D. Lanari D. Gelman F. Pizzo O. Rosati M. Curini L. Vaccaro Green Chem. 15 2013 199 204 [58] R.K. Henderson C. Jiménez-González D.J.C. Constable S.R. Alston G.G.A. Inglis G. Fisher J. Sherwood S.P. Binks A.D. Curzons Green Chem. 13 2011 854 862 [59] K. Alfonsi J. Colberg P.J. Dunn T. Fevig S. Jennings T.A. Johnson H.P. Kleine C. Knight M.A. Nagy D.A. Perry M. Stefaniak Green Chem. 10 2008 31 36 [60] L. Vaccaro D. Lanari A. Marrocchi G. Strappaveccia Green Chem. 16 2014 3680 3704 [61] C. Pavia F. Giacalone L.A. Binova A.M.P. Salvo C. Petrucci G. Strappaveccia L. Vaccaro C. Aprile M. Gruttadauria J. Mol. Catal. A: Chem. 378 2014 57 62 [62] J. Potier S. Menuel J. Rousseau S. Tumkevicius F. Hapiot E. Monflier Appl. Catal A: Gen. 479 2014 1 8 [63] H.L. Parker J. Sherwood A.J. Hunt J.H. Clark ACS Sustainable Chem. Eng. 2 2014 1739 1742 [64] E. Rafiee A. Ataei S. Nadri M. Joshaghani S. Eavani Inorg. Chim. Acta 409 2014 302 309 [65] S. Keesara S. Parvathanemi G. Dussa M.R. Mandapati J. Organomet. Chem. 756 2014 31 38 [66] Z.-J. Jiang W. Wang R. Zhou L. Zhang H.-Y. Fu X.-L. Zheng H. Chen R.-X. Li Catal. Commun. 57 2014 14 18 [67] G. Alberti U. Costantino J. Inorg. Nucl. Chem. 37 1975 1779 1796 [68] B.D. Cullity S.R. Stock Elements of X-ray Diffraction 3rd ed 2001 Prentice-Hall Inc. [69] M. Gruttadauria F. Giacalone R. Noto Green Chem. 15 2013 2608 2618 [70] K. Köhler W. Kleist S.S. Pröckl Inorg. Chem. 46 2007 1876 1883 [71] J.D. Webb S. MacQuarrie K. McEleney C.M. Crudden J. Catal. 252 2007 97 109 [72] S. MacQuarrie J.H. Horton J. Barnes K. McEleney H.P. Loock C.M. Crudden Angew. Chem. Int. Ed. 47 2008 3279 3282 [73] J.M. Richardson C.W. Jones J. Catal. 251 2007 80 93 [74] M.I. Burguete E. Garcia-Verdugo I. Garcia-Villar F. Gelat P. Licence S.V. Luis V. Sans J. Catal. 269 2010 150 160 [75] F. Zhao B.M. Bhanage M. Shirai M. Arai Chem. Eur. J. 6 2000 843 848 [76] J. Horniakova T. Raja Y. Kubota Y. Sugi J. Mol. Cat. A: Chem. 217 2004 73 80 [77] F. Zhaoa M. Shirai Y. Ikushima M. Arai J. Mol. Cat. A: Chem. 180 2002 211 219 [78] M. Dams L. Drijkoningen B. Pauwels G. Van Tendeloo D.E. De Vos P.A. Jacobs J. Catal. 209 2002 225 236 [79] The amount of Pd allowed is 5 ppm: Note for guidance on specification limits for residues of metal catalysts. The European Agency for the evaluation of medicinal products – London (UK), (2002) 17 December. [80] K. Köhler R.G. Heidenreich J.G.E. Krauter J. Pietsch Chem. Eur. J. 8 2002 622 631 [81] W. Cabri I. Candiani Acc. Chem. Res. 28 1995 2 7 [82] R.A. Sheldon Chem. Ind. 1997 12 15 London, U.K. [83] R.A. Sheldon Green Chem. 9 2007 1273 1283 [84] S. Mandal D. Roy R.V. Chaudhari M. Sastry Chem. Mater. 16 2004 3714 3724 [85] E. Murugan J.N. Jebaranjitham A. Usha Appl. Nanosci. 2 2012 211 222 [86] F. Zhang J. Jin X. Zhong S. Li J. Niu R. Li J. Ma Green Chem. 13 2011 1238 1243 [87] D. Guin B. Baruwati S.V. Manorama Org. Lett. 9 2007 1419 1421",
      "scopus-id": "84923929589",
      "coredata": {
        "eid": "1-s2.0-S1381116915000606",
        "dc:description": "Palladium nanoparticles on layered potassium α-zirconium phosphate (PdNP/α-ZrPK) with high palladium loading (10.6wt%) have been prepared and used as catalyst in low amount (0.1mol% of Pd) in the Heck reaction of methyl acrylate and styrene with a series of aryl iodides in CH3CN/H2O azeotrope as a green medium. The procedure has been optimized under flow conditions obtaining an extremely low waste production (E-factor) and allowing to isolate the final product with very low residual palladium content without any purification step.",
        "openArchiveArticle": "false",
        "prism:coverDate": "2015-05-15",
        "openaccessUserLicense": null,
        "prism:aggregationType": "Journal",
        "prism:url": "https://api.elsevier.com/content/article/pii/S1381116915000606",
        "dc:creator": [
          {
            "@_fa": "true",
            "$": "Petrucci, Chiara"
          },
          {
            "@_fa": "true",
            "$": "Cappelletti, Matteo"
          },
          {
            "@_fa": "true",
            "$": "Piermatti, Oriana"
          },
          {
            "@_fa": "true",
            "$": "Nocchetti, Morena"
          },
          {
            "@_fa": "true",
            "$": "Pica, Monica"
          },
          {
            "@_fa": "true",
            "$": "Pizzo, Ferdinando"
          },
          {
            "@_fa": "true",
            "$": "Vaccaro, Luigi"
          }
        ],
        "link": [
          {
            "@_fa": "true",
            "@rel": "self",
            "@href": "https://api.elsevier.com/content/article/pii/S1381116915000606"
          },
          {
            "@_fa": "true",
            "@rel": "scidir",
            "@href": "https://www.sciencedirect.com/science/article/pii/S1381116915000606"
          }
        ],
        "dc:format": "application/json",
        "openaccessType": null,
        "pii": "S1381-1169(15)00060-6",
        "prism:volume": "401",
        "prism:publisher": "Elsevier B.V.",
        "dc:title": "Immobilized palladium nanoparticles on potassium zirconium phosphate as an efficient recoverable heterogeneous catalyst for a clean Heck reaction in flow",
        "prism:copyright": "Copyright © 2015 Elsevier B.V. All rights reserved.",
        "openaccess": "0",
        "prism:issn": "13811169",
        "dcterms:subject": [
          {
            "@_fa": "true",
            "$": "Heck reaction"
          },
          {
            "@_fa": "true",
            "$": "Heterogeneous catalysis"
          },
          {
            "@_fa": "true",
            "$": "Palladium nanoparticles"
          },
          {
            "@_fa": "true",
            "$": "Recoverable reaction media"
          },
          {
            "@_fa": "true",
            "$": "Flow chemistry"
          }
        ],
        "openaccessArticle": "false",
        "prism:publicationName": "Journal of Molecular Catalysis A: Chemical",
        "openaccessSponsorType": null,
        "prism:pageRange": "27-34",
        "prism:endingPage": "34",
        "pubType": "fla",
        "prism:coverDisplayDate": "15 May 2015",
        "prism:doi": "10.1016/j.molcata.2015.02.012",
        "prism:startingPage": "27",
        "dc:identifier": "doi:10.1016/j.molcata.2015.02.012",
        "openaccessSponsorName": null
      },
      "objects": {
        "object": [
          {
            "@category": "high",
            "@height": "1333",
            "@width": "1500",
            "@_fa": "true",
            "$": "https://api.elsevier.com/content/object/eid/1-s2.0-S1381116915000606-sc1_lrg.jpg?httpAccept=%2A%2F%2A",
            "@multimediatype": "JPEG image file",
            "@type": "IMAGE-HIGH-RES",
            "@size": "176552",
            "@ref": "sc1",
            "@mimetype": "image/jpeg"
          },
          {
            "@category": "high",
            "@height": "1008",
            "@width": "2490",
            "@_fa": "true",
            "$": "https://api.elsevier.com/content/object/eid/1-s2.0-S1381116915000606-gr3_lrg.jpg?httpAccept=%2A%2F%2A",
            "@multimediatype": "JPEG image file",
            "@type": "IMAGE-HIGH-RES",
            "@size": "204667",
            "@ref": "gr3",
            "@mimetype": "image/jpeg"
          },
          {
            "@category": "high",
            "@height": "1423",
            "@width": "1706",
            "@_fa": "true",
            "$": "https://api.elsevier.com/content/object/eid/1-s2.0-S1381116915000606-gr2_lrg.jpg?httpAccept=%2A%2F%2A",
            "@multimediatype": "JPEG image file",
            "@type": "IMAGE-HIGH-RES",
            "@size": "175615",
            "@ref": "gr2",
            "@mimetype": "image/jpeg"
          },
          {
            "@category": "high",
            "@height": "925",
            "@width": "2500",
            "@_fa": "true",
            "$": "https://api.elsevier.com/content/object/eid/1-s2.0-S1381116915000606-gr1_lrg.jpg?httpAccept=%2A%2F%2A",
            "@multimediatype": "JPEG image file",
            "@type": "IMAGE-HIGH-RES",
            "@size": "314230",
            "@ref": "gr1",
            "@mimetype": "image/jpeg"
          },
          {
            "@category": "high",
            "@height": "132",
            "@width": "168",
            "@_fa": "true",
            "$": "https://api.elsevier.com/content/object/eid/1-s2.0-S1381116915000606-fx7_lrg.jpg?httpAccept=%2A%2F%2A",
            "@multimediatype": "JPEG image file",
            "@type": "IMAGE-HIGH-RES",
            "@size": "5405",
            "@ref": "fx7",
            "@mimetype": "image/jpeg"
          },
          {
            "@category": "high",
            "@height": "495",
            "@width": "2747",
            "@_fa": "true",
            "$": "https://api.elsevier.com/content/object/eid/1-s2.0-S1381116915000606-fx6_lrg.jpg?httpAccept=%2A%2F%2A",
            "@multimediatype": "JPEG image file",
            "@type": "IMAGE-HIGH-RES",
            "@size": "121031",
            "@ref": "fx6",
            "@mimetype": "image/jpeg"
          },
          {
            "@category": "high",
            "@height": "132",
            "@width": "168",
            "@_fa": "true",
            "$": "https://api.elsevier.com/content/object/eid/1-s2.0-S1381116915000606-fx5_lrg.jpg?httpAccept=%2A%2F%2A",
            "@multimediatype": "JPEG image file",
            "@type": "IMAGE-HIGH-RES",
            "@size": "5405",
            "@ref": "fx5",
            "@mimetype": "image/jpeg"
          },
          {
            "@category": "high",
            "@height": "373",
            "@width": "2338",
            "@_fa": "true",
            "$": "https://api.elsevier.com/content/object/eid/1-s2.0-S1381116915000606-fx4_lrg.jpg?httpAccept=%2A%2F%2A",
            "@multimediatype": "JPEG image file",
            "@type": "IMAGE-HIGH-RES",
            "@size": "98270",
            "@ref": "fx4",
            "@mimetype": "image/jpeg"
          },
          {
            "@category": "high",
            "@height": "352",
            "@width": "1602",
            "@_fa": "true",
            "$": "https://api.elsevier.com/content/object/eid/1-s2.0-S1381116915000606-fx3_lrg.jpg?httpAccept=%2A%2F%2A",
            "@multimediatype": "JPEG image file",
            "@type": "IMAGE-HIGH-RES",
            "@size": "67570",
            "@ref": "fx3",
            "@mimetype": "image/jpeg"
          },
          {
            "@category": "high",
            "@height": "333",
            "@width": "1633",
            "@_fa": "true",
            "$": "https://api.elsevier.com/content/object/eid/1-s2.0-S1381116915000606-fx2_lrg.jpg?httpAccept=%2A%2F%2A",
            "@multimediatype": "JPEG image file",
            "@type": "IMAGE-HIGH-RES",
            "@size": "67168",
            "@ref": "fx2",
            "@mimetype": "image/jpeg"
          },
          {
            "@category": "high",
            "@height": "886",
            "@width": "2213",
            "@_fa": "true",
            "$": "https://api.elsevier.com/content/object/eid/1-s2.0-S1381116915000606-fx1_lrg.jpg?httpAccept=%2A%2F%2A",
            "@multimediatype": "JPEG image file",
            "@type": "IMAGE-HIGH-RES",
            "@size": "164668",
            "@ref": "fx1",
            "@mimetype": "image/jpeg"
          },
          {
            "@category": "standard",
            "@height": "301",
            "@width": "339",
            "@_fa": "true",
            "$": "https://api.elsevier.com/content/object/eid/1-s2.0-S1381116915000606-sc1.jpg?httpAccept=%2A%2F%2A",
            "@multimediatype": "JPEG image file",
            "@type": "IMAGE-DOWNSAMPLED",
            "@size": "19387",
            "@ref": "sc1",
            "@mimetype": "image/jpeg"
          },
          {
            "@category": "standard",
            "@height": "228",
            "@width": "562",
            "@_fa": "true",
            "$": "https://api.elsevier.com/content/object/eid/1-s2.0-S1381116915000606-gr3.jpg?httpAccept=%2A%2F%2A",
            "@multimediatype": "JPEG image file",
            "@type": "IMAGE-DOWNSAMPLED",
            "@size": "17043",
            "@ref": "gr3",
            "@mimetype": "image/jpeg"
          },
          {
            "@category": "standard",
            "@height": "321",
            "@width": "385",
            "@_fa": "true",
            "$": "https://api.elsevier.com/content/object/eid/1-s2.0-S1381116915000606-gr2.jpg?httpAccept=%2A%2F%2A",
            "@multimediatype": "JPEG image file",
            "@type": "IMAGE-DOWNSAMPLED",
            "@size": "19782",
            "@ref": "gr2",
            "@mimetype": "image/jpeg"
          },
          {
            "@category": "standard",
            "@height": "209",
            "@width": "565",
            "@_fa": "true",
            "$": "https://api.elsevier.com/content/object/eid/1-s2.0-S1381116915000606-gr1.jpg?httpAccept=%2A%2F%2A",
            "@multimediatype": "JPEG image file",
            "@type": "IMAGE-DOWNSAMPLED",
            "@size": "22154",
            "@ref": "gr1",
            "@mimetype": "image/jpeg"
          },
          {
            "@category": "standard",
            "@height": "29",
            "@width": "37",
            "@_fa": "true",
            "$": "https://api.elsevier.com/content/object/eid/1-s2.0-S1381116915000606-fx7.jpg?httpAccept=%2A%2F%2A",
            "@multimediatype": "JPEG image file",
            "@type": "IMAGE-DOWNSAMPLED",
            "@size": "887",
            "@ref": "fx7",
            "@mimetype": "image/jpeg"
          },
          {
            "@category": "standard",
            "@height": "112",
            "@width": "620",
            "@_fa": "true",
            "$": "https://api.elsevier.com/content/object/eid/1-s2.0-S1381116915000606-fx6.jpg?httpAccept=%2A%2F%2A",
            "@multimediatype": "JPEG image file",
            "@type": "IMAGE-DOWNSAMPLED",
            "@size": "13068",
            "@ref": "fx6",
            "@mimetype": "image/jpeg"
          },
          {
            "@category": "standard",
            "@height": "29",
            "@width": "37",
            "@_fa": "true",
            "$": "https://api.elsevier.com/content/object/eid/1-s2.0-S1381116915000606-fx5.jpg?httpAccept=%2A%2F%2A",
            "@multimediatype": "JPEG image file",
            "@type": "IMAGE-DOWNSAMPLED",
            "@size": "887",
            "@ref": "fx5",
            "@mimetype": "image/jpeg"
          },
          {
            "@category": "standard",
            "@height": "84",
            "@width": "528",
            "@_fa": "true",
            "$": "https://api.elsevier.com/content/object/eid/1-s2.0-S1381116915000606-fx4.jpg?httpAccept=%2A%2F%2A",
            "@multimediatype": "JPEG image file",
            "@type": "IMAGE-DOWNSAMPLED",
            "@size": "11466",
            "@ref": "fx4",
            "@mimetype": "image/jpeg"
          },
          {
            "@category": "standard",
            "@height": "80",
            "@width": "362",
            "@_fa": "true",
            "$": "https://api.elsevier.com/content/object/eid/1-s2.0-S1381116915000606-fx3.jpg?httpAccept=%2A%2F%2A",
            "@multimediatype": "JPEG image file",
            "@type": "IMAGE-DOWNSAMPLED",
            "@size": "7856",
            "@ref": "fx3",
            "@mimetype": "image/jpeg"
          },
          {
            "@category": "standard",
            "@height": "75",
            "@width": "369",
            "@_fa": "true",
            "$": "https://api.elsevier.com/content/object/eid/1-s2.0-S1381116915000606-fx2.jpg?httpAccept=%2A%2F%2A",
            "@multimediatype": "JPEG image file",
            "@type": "IMAGE-DOWNSAMPLED",
            "@size": "7751",
            "@ref": "fx2",
            "@mimetype": "image/jpeg"
          },
          {
            "@category": "standard",
            "@height": "200",
            "@width": "500",
            "@_fa": "true",
            "$": "https://api.elsevier.com/content/object/eid/1-s2.0-S1381116915000606-fx1.jpg?httpAccept=%2A%2F%2A",
            "@multimediatype": "JPEG image file",
            "@type": "IMAGE-DOWNSAMPLED",
            "@size": "18021",
            "@ref": "fx1",
            "@mimetype": "image/jpeg"
          },
          {
            "@category": "thumbnail",
            "@height": "164",
            "@width": "184",
            "@_fa": "true",
            "$": "https://api.elsevier.com/content/object/eid/1-s2.0-S1381116915000606-sc1.sml?httpAccept=%2A%2F%2A",
            "@multimediatype": "GIF image file",
            "@type": "IMAGE-THUMBNAIL",
            "@size": "4807",
            "@ref": "sc1",
            "@mimetype": "image/gif"
          },
          {
            "@category": "thumbnail",
            "@height": "89",
            "@width": "219",
            "@_fa": "true",
            "$": "https://api.elsevier.com/content/object/eid/1-s2.0-S1381116915000606-gr3.sml?httpAccept=%2A%2F%2A",
            "@multimediatype": "GIF image file",
            "@type": "IMAGE-THUMBNAIL",
            "@size": "6185",
            "@ref": "gr3",
            "@mimetype": "image/gif"
          },
          {
            "@category": "thumbnail",
            "@height": "163",
            "@width": "196",
            "@_fa": "true",
            "$": "https://api.elsevier.com/content/object/eid/1-s2.0-S1381116915000606-gr2.sml?httpAccept=%2A%2F%2A",
            "@multimediatype": "GIF image file",
            "@type": "IMAGE-THUMBNAIL",
            "@size": "4669",
            "@ref": "gr2",
            "@mimetype": "image/gif"
          },
          {
            "@category": "thumbnail",
            "@height": "81",
            "@width": "219",
            "@_fa": "true",
            "$": "https://api.elsevier.com/content/object/eid/1-s2.0-S1381116915000606-gr1.sml?httpAccept=%2A%2F%2A",
            "@multimediatype": "GIF image file",
            "@type": "IMAGE-THUMBNAIL",
            "@size": "8670",
            "@ref": "gr1",
            "@mimetype": "image/gif"
          },
          {
            "@category": "thumbnail",
            "@height": "132",
            "@width": "168",
            "@_fa": "true",
            "$": "https://api.elsevier.com/content/object/eid/1-s2.0-S1381116915000606-fx7.sml?httpAccept=%2A%2F%2A",
            "@multimediatype": "GIF image file",
            "@type": "IMAGE-THUMBNAIL",
            "@size": "1828",
            "@ref": "fx7",
            "@mimetype": "image/gif"
          },
          {
            "@category": "thumbnail",
            "@height": "39",
            "@width": "219",
            "@_fa": "true",
            "$": "https://api.elsevier.com/content/object/eid/1-s2.0-S1381116915000606-fx6.sml?httpAccept=%2A%2F%2A",
            "@multimediatype": "GIF image file",
            "@type": "IMAGE-THUMBNAIL",
            "@size": "2051",
            "@ref": "fx6",
            "@mimetype": "image/gif"
          },
          {
            "@category": "thumbnail",
            "@height": "132",
            "@width": "168",
            "@_fa": "true",
            "$": "https://api.elsevier.com/content/object/eid/1-s2.0-S1381116915000606-fx5.sml?httpAccept=%2A%2F%2A",
            "@multimediatype": "GIF image file",
            "@type": "IMAGE-THUMBNAIL",
            "@size": "1828",
            "@ref": "fx5",
            "@mimetype": "image/gif"
          },
          {
            "@category": "thumbnail",
            "@height": "35",
            "@width": "219",
            "@_fa": "true",
            "$": "https://api.elsevier.com/content/object/eid/1-s2.0-S1381116915000606-fx4.sml?httpAccept=%2A%2F%2A",
            "@multimediatype": "GIF image file",
            "@type": "IMAGE-THUMBNAIL",
            "@size": "2149",
            "@ref": "fx4",
            "@mimetype": "image/gif"
          },
          {
            "@category": "thumbnail",
            "@height": "48",
            "@width": "219",
            "@_fa": "true",
            "$": "https://api.elsevier.com/content/object/eid/1-s2.0-S1381116915000606-fx3.sml?httpAccept=%2A%2F%2A",
            "@multimediatype": "GIF image file",
            "@type": "IMAGE-THUMBNAIL",
            "@size": "2530",
            "@ref": "fx3",
            "@mimetype": "image/gif"
          },
          {
            "@category": "thumbnail",
            "@height": "45",
            "@width": "219",
            "@_fa": "true",
            "$": "https://api.elsevier.com/content/object/eid/1-s2.0-S1381116915000606-fx2.sml?httpAccept=%2A%2F%2A",
            "@multimediatype": "GIF image file",
            "@type": "IMAGE-THUMBNAIL",
            "@size": "2398",
            "@ref": "fx2",
            "@mimetype": "image/gif"
          },
          {
            "@category": "thumbnail",
            "@height": "88",
            "@width": "219",
            "@_fa": "true",
            "$": "https://api.elsevier.com/content/object/eid/1-s2.0-S1381116915000606-fx1.sml?httpAccept=%2A%2F%2A",
            "@multimediatype": "GIF image file",
            "@type": "IMAGE-THUMBNAIL",
            "@size": "4423",
            "@ref": "fx1",
            "@mimetype": "image/gif"
          }
        ]
      },
      "link": {
        "@rel": "abstract",
        "@href": "https://api.elsevier.com/content/abstract/scopus_id/84923929589"
      }
    }
  }
}