{
  "metadata": {
    "title": "DFT-ONIOM study of Au/ZSM-5 catalyst: Active sites, thermodynamic and vibrational frequencies",
    "authors": "; ; ",
    "journal": "Journal of Molecular Catalysis A: Chemical",
    "date": "2009-03-18",
    "doi": "10.1016/j.molcata.2008.11.008",
    "abstract": "",
    "uri": "https://api.elsevier.com/content/article/pii/S1381116908005281",
    "pii": "S1381116908005281"
  },
  "fulltext": {
    "full-text-retrieval-response": {
      "scopus-eid": "2-s2.0-61549109273",
      "originalText": "serial JL 271358 291210 291744 291790 291809 31 Journal of Molecular Catalysis A: Chemical JOURNALMOLECULARCATALYSISACHEMICAL 2008-11-14 2008-11-14 2010-04-16T17:45:36 1-s2.0-S1381116908005281 S1381-1169(08)00528-1 S1381116908005281 10.1016/j.molcata.2008.11.008 S300 S300.1 FULL-TEXT 1-s2.0-S1381116909X00026 2015-05-15T05:56:33.307883-04:00 0 0 20090318 2009 2008-11-14T00:00:00Z articleinfo crossmark dco dateupdated tomb dateloaded datesearch indexeddate issuelist volumelist yearnav absattachment articletitlenorm authfirstinitialnorm authfirstsurnamenorm cid cids contenttype copyright dateloadedtxt docsubtype doctype doi eid ewtransactionid hubeid issfirst issn issnnorm itemstage itemtransactionid itemweight openaccess openarchive pg pgfirst pglast pii piinorm pubdatestart pubdatetxt pubyr sectiontitle sortorder srctitle srctitlenorm srctype subheadings volfirst volissue webpdf webpdfpagecount figure table body mmlmath acknowledge affil articletitle auth authfirstini authfull authkeywords authlast primabst ref specialabst alllist content subj ssids 1381-1169 13811169 301 301 1 2 1 2 Volume 301, Issues 1–2 11 61 66 61 66 20090318 18 March 2009 2009-03-18 2009 Regular papers article fla Copyright © 2008 Elsevier B.V. All rights reserved. DFTONIOMSTUDYAUZSM5CATALYSTACTIVESITESTHERMODYNAMICVIBRATIONALFREQUENCIES SIERRAALTA A 1 Introduction 2 Computational details and models 3 Results and discussions 3.1 Interaction with CO 3.2 Interactions with soft and hard bases 3.3 Interaction with NO, NO2, and SO2 4 Conclusions Acknowledgment References SHELEF 1995 209 M YAHIRO 2001 163 H GOMEZ 2000 157 S SCHIDDER 2005 314 M DEVADES 2006 187 M CHUPIN 2006 103 C LOBREE 1999 189 L SHIBATA 2004 137 J SHIBATA 2004 367 J HARUTA 1997 153 M FIERROGONZALEZ 2007 103 J SIMAKOV 2007 121 A GAO 2001 1 Z BOND 1999 319 G SALAMA 1997 105 T MOHAMED 2000 366 371 M QIU 1994 S FRISCH 2004 M GAUSSIAN03REVISIOND02 SIERRAALTA 2008 A LIANG 2000 9156 B SIERRAALTA 2006 17912 A SIERRAALTA 2002 6851 A RUTH 2000 L133 K KIM 2006 52 M RODRIGUEZ 2002 5242 J SIERRAALTAX2009X61 SIERRAALTAX2009X61X66 SIERRAALTAX2009X61XA SIERRAALTAX2009X61X66XA item S1381-1169(08)00528-1 S1381116908005281 1-s2.0-S1381116908005281 10.1016/j.molcata.2008.11.008 271358 2010-09-21T22:43:42.240759-04:00 2009-03-18 1-s2.0-S1381116908005281-main.pdf https://s3.amazonaws.com/prod-ucs-content-store-us-east/content/pii:S1381116908005281/MAIN/application/pdf/dad81403c3a421ba39205f319d0fb379/main.pdf https://s3-eu-west-1.amazonaws.com/prod-ucs-content-store-eu-west/content/pii:S1381116908005281/MAIN/application/pdf/dad81403c3a421ba39205f319d0fb379/main.pdf main.pdf pdf true 771761 MAIN 6 1-s2.0-S1381116908005281-main_1.png https://s3.amazonaws.com/prod-ucs-content-store-us-east/content/pii:S1381116908005281/PREVIEW/image/png/ed5b449c2c5f87f3f887877e399a2e12/main_1.png https://s3-eu-west-1.amazonaws.com/prod-ucs-content-store-eu-west/content/pii:S1381116908005281/PREVIEW/image/png/ed5b449c2c5f87f3f887877e399a2e12/main_1.png main_1.png png 55481 849 656 IMAGE-WEB-PDF 1 1-s2.0-S1381116908005281-si5.gif https://s3.amazonaws.com/prod-ucs-content-store-us-east/content/pii:S1381116908005281/STRIPIN/image/gif/a357f85181ec178c8d516256a7937cd3/si5.gif https://s3-eu-west-1.amazonaws.com/prod-ucs-content-store-eu-west/content/pii:S1381116908005281/STRIPIN/image/gif/a357f85181ec178c8d516256a7937cd3/si5.gif si5 si5.gif gif 477 16 120 ALTIMG 1-s2.0-S1381116908005281-si4.gif https://s3.amazonaws.com/prod-ucs-content-store-us-east/content/pii:S1381116908005281/STRIPIN/image/gif/ef690baa4d784bf941d64ed24162cd27/si4.gif https://s3-eu-west-1.amazonaws.com/prod-ucs-content-store-eu-west/content/pii:S1381116908005281/STRIPIN/image/gif/ef690baa4d784bf941d64ed24162cd27/si4.gif si4 si4.gif gif 470 16 120 ALTIMG 1-s2.0-S1381116908005281-si3.gif https://s3.amazonaws.com/prod-ucs-content-store-us-east/content/pii:S1381116908005281/STRIPIN/image/gif/d8cca4a508f5a4b843da191124d3f385/si3.gif https://s3-eu-west-1.amazonaws.com/prod-ucs-content-store-eu-west/content/pii:S1381116908005281/STRIPIN/image/gif/d8cca4a508f5a4b843da191124d3f385/si3.gif si3 si3.gif gif 698 13 207 ALTIMG 1-s2.0-S1381116908005281-si2.gif https://s3.amazonaws.com/prod-ucs-content-store-us-east/content/pii:S1381116908005281/STRIPIN/image/gif/fc681017e30ef8a7b40f2477b082110d/si2.gif https://s3-eu-west-1.amazonaws.com/prod-ucs-content-store-eu-west/content/pii:S1381116908005281/STRIPIN/image/gif/fc681017e30ef8a7b40f2477b082110d/si2.gif si2 si2.gif gif 713 14 202 ALTIMG 1-s2.0-S1381116908005281-si1.gif https://s3.amazonaws.com/prod-ucs-content-store-us-east/content/pii:S1381116908005281/STRIPIN/image/gif/a8069d7a9f8fc0fee293de6450d689aa/si1.gif https://s3-eu-west-1.amazonaws.com/prod-ucs-content-store-eu-west/content/pii:S1381116908005281/STRIPIN/image/gif/a8069d7a9f8fc0fee293de6450d689aa/si1.gif si1 si1.gif gif 920 14 286 ALTIMG 1-s2.0-S1381116908005281-gr1.jpg https://s3.amazonaws.com/prod-ucs-content-store-us-east/content/pii:S1381116908005281/gr1/DOWNSAMPLED/image/jpeg/45a88fbf301eb6947125526ea3f6b9f0/gr1.jpg https://s3-eu-west-1.amazonaws.com/prod-ucs-content-store-eu-west/content/pii:S1381116908005281/gr1/DOWNSAMPLED/image/jpeg/45a88fbf301eb6947125526ea3f6b9f0/gr1.jpg gr1 gr1.jpg jpg 40660 358 336 IMAGE-DOWNSAMPLED 1-s2.0-S1381116908005281-gr1.sml https://s3.amazonaws.com/prod-ucs-content-store-us-east/content/pii:S1381116908005281/gr1/THUMBNAIL/image/gif/f7eb3b8075dd6a82c6d8152946741073/gr1.sml https://s3-eu-west-1.amazonaws.com/prod-ucs-content-store-eu-west/content/pii:S1381116908005281/gr1/THUMBNAIL/image/gif/f7eb3b8075dd6a82c6d8152946741073/gr1.sml gr1 gr1.sml sml 4809 164 154 IMAGE-THUMBNAIL 1-s2.0-S1381116908005281-gr2.jpg https://s3.amazonaws.com/prod-ucs-content-store-us-east/content/pii:S1381116908005281/gr2/DOWNSAMPLED/image/jpeg/0268081cfa92814894df9818097cf306/gr2.jpg https://s3-eu-west-1.amazonaws.com/prod-ucs-content-store-eu-west/content/pii:S1381116908005281/gr2/DOWNSAMPLED/image/jpeg/0268081cfa92814894df9818097cf306/gr2.jpg gr2 gr2.jpg jpg 37359 292 374 IMAGE-DOWNSAMPLED 1-s2.0-S1381116908005281-gr2.sml https://s3.amazonaws.com/prod-ucs-content-store-us-east/content/pii:S1381116908005281/gr2/THUMBNAIL/image/gif/276fe5448f5a9ddaf96d30780561423c/gr2.sml https://s3-eu-west-1.amazonaws.com/prod-ucs-content-store-eu-west/content/pii:S1381116908005281/gr2/THUMBNAIL/image/gif/276fe5448f5a9ddaf96d30780561423c/gr2.sml gr2 gr2.sml sml 6204 164 210 IMAGE-THUMBNAIL 1-s2.0-S1381116908005281-gr3.jpg https://s3.amazonaws.com/prod-ucs-content-store-us-east/content/pii:S1381116908005281/gr3/DOWNSAMPLED/image/jpeg/75ed10abd502e29cbd3962ad62669433/gr3.jpg https://s3-eu-west-1.amazonaws.com/prod-ucs-content-store-eu-west/content/pii:S1381116908005281/gr3/DOWNSAMPLED/image/jpeg/75ed10abd502e29cbd3962ad62669433/gr3.jpg gr3 gr3.jpg jpg 42648 315 376 IMAGE-DOWNSAMPLED 1-s2.0-S1381116908005281-gr3.sml https://s3.amazonaws.com/prod-ucs-content-store-us-east/content/pii:S1381116908005281/gr3/THUMBNAIL/image/gif/0a2f6ffad551e3f88682aef0867797da/gr3.sml https://s3-eu-west-1.amazonaws.com/prod-ucs-content-store-eu-west/content/pii:S1381116908005281/gr3/THUMBNAIL/image/gif/0a2f6ffad551e3f88682aef0867797da/gr3.sml gr3 gr3.sml sml 6015 164 196 IMAGE-THUMBNAIL 1-s2.0-S1381116908005281-gr4.jpg https://s3.amazonaws.com/prod-ucs-content-store-us-east/content/pii:S1381116908005281/gr4/DOWNSAMPLED/image/jpeg/5432b0c90b3fb5136f0980179d24d1c9/gr4.jpg https://s3-eu-west-1.amazonaws.com/prod-ucs-content-store-eu-west/content/pii:S1381116908005281/gr4/DOWNSAMPLED/image/jpeg/5432b0c90b3fb5136f0980179d24d1c9/gr4.jpg gr4 gr4.jpg jpg 37090 297 376 IMAGE-DOWNSAMPLED 1-s2.0-S1381116908005281-gr4.sml https://s3.amazonaws.com/prod-ucs-content-store-us-east/content/pii:S1381116908005281/gr4/THUMBNAIL/image/gif/f0453bb01534bd81f5364db26cc5f100/gr4.sml https://s3-eu-west-1.amazonaws.com/prod-ucs-content-store-eu-west/content/pii:S1381116908005281/gr4/THUMBNAIL/image/gif/f0453bb01534bd81f5364db26cc5f100/gr4.sml gr4 gr4.sml sml 5771 164 208 IMAGE-THUMBNAIL 1-s2.0-S1381116908005281-gr5.jpg https://s3.amazonaws.com/prod-ucs-content-store-us-east/content/pii:S1381116908005281/gr5/DOWNSAMPLED/image/jpeg/4fa3945b239229b56679023fe349b908/gr5.jpg https://s3-eu-west-1.amazonaws.com/prod-ucs-content-store-eu-west/content/pii:S1381116908005281/gr5/DOWNSAMPLED/image/jpeg/4fa3945b239229b56679023fe349b908/gr5.jpg gr5 gr5.jpg jpg 41203 334 370 IMAGE-DOWNSAMPLED 1-s2.0-S1381116908005281-gr5.sml https://s3.amazonaws.com/prod-ucs-content-store-us-east/content/pii:S1381116908005281/gr5/THUMBNAIL/image/gif/f7d160e7c6bf22b6387f2497371ab13b/gr5.sml https://s3-eu-west-1.amazonaws.com/prod-ucs-content-store-eu-west/content/pii:S1381116908005281/gr5/THUMBNAIL/image/gif/f7d160e7c6bf22b6387f2497371ab13b/gr5.sml gr5 gr5.sml sml 7023 164 182 IMAGE-THUMBNAIL 1-s2.0-S1381116908005281-gr6.jpg https://s3.amazonaws.com/prod-ucs-content-store-us-east/content/pii:S1381116908005281/gr6/DOWNSAMPLED/image/jpeg/a591cb7b05a23d432464d54332e3b2e9/gr6.jpg https://s3-eu-west-1.amazonaws.com/prod-ucs-content-store-eu-west/content/pii:S1381116908005281/gr6/DOWNSAMPLED/image/jpeg/a591cb7b05a23d432464d54332e3b2e9/gr6.jpg gr6 gr6.jpg jpg 47851 594 376 IMAGE-DOWNSAMPLED 1-s2.0-S1381116908005281-gr6.sml https://s3.amazonaws.com/prod-ucs-content-store-us-east/content/pii:S1381116908005281/gr6/THUMBNAIL/image/gif/30549651e8551eb294b8873eb9b6a4e4/gr6.sml https://s3-eu-west-1.amazonaws.com/prod-ucs-content-store-eu-west/content/pii:S1381116908005281/gr6/THUMBNAIL/image/gif/30549651e8551eb294b8873eb9b6a4e4/gr6.sml gr6 gr6.sml sml 3745 163 103 IMAGE-THUMBNAIL 1-s2.0-S1381116908005281-fx1.jpg https://s3.amazonaws.com/prod-ucs-content-store-us-east/content/pii:S1381116908005281/fx1/DOWNSAMPLED/image/jpeg/6d8264b3d5385e068e4ae203879adc70/fx1.jpg https://s3-eu-west-1.amazonaws.com/prod-ucs-content-store-eu-west/content/pii:S1381116908005281/fx1/DOWNSAMPLED/image/jpeg/6d8264b3d5385e068e4ae203879adc70/fx1.jpg fx1 true fx1.jpg jpg 6904 122 454 IMAGE-DOWNSAMPLED 1-s2.0-S1381116908005281-fx1.sml https://s3.amazonaws.com/prod-ucs-content-store-us-east/content/pii:S1381116908005281/fx1/THUMBNAIL/image/gif/2b6242ae2ffcca8046f2f2a236fcdd45/fx1.sml https://s3-eu-west-1.amazonaws.com/prod-ucs-content-store-eu-west/content/pii:S1381116908005281/fx1/THUMBNAIL/image/gif/2b6242ae2ffcca8046f2f2a236fcdd45/fx1.sml fx1 true fx1.sml sml 982 59 219 IMAGE-THUMBNAIL MOLCAA 7344 S1381-1169(08)00528-1 10.1016/j.molcata.2008.11.008 Elsevier B.V. Fig. 1 Au-T8 site. High level: ball and stick. Low level: wireframe. Dark spheres: O atoms. Light grey spheres: Si atoms. Fig. 2 Au-T11 site. High level: ball and stick. Low level: wireframe. Dark spheres: O atoms. Light grey spheres: Si atoms. Fig. 3 Au-T7 site. High level: ball and stick. Low level: wireframe. Dark spheres: O atoms. Light grey spheres: Si atoms. Fig. 4 Au-T12 site. High level: ball and stick. Low level: wireframe. Dark spheres: O atoms. Light grey spheres: Si atoms. Fig. 5 Au-T11-large site. The high level region includes a complete ring structure. (see Fig. 2) High level: ball and stick. Low level: wireframe. Dark spheres: O atoms. Light grey spheres: Si atoms. Fig. 6 High level: ball and stick. Low level: wireframe. Dark spheres: O atoms. Light grey spheres: Si atoms. (a) Au-T2 site and (b) Au-T2 site-large. The high level region includes a complete ring structure. Table 1 CO vibrational frequencies ν CO, angles Au–C–O, net charges on CO (Q CO) and AuCO moiety (Q [AuCO]), and Au+ binding energy (BE). Site ν CO, cm−1 Au–C–O, ° QCO, a.u. Q[AuCO], a.u. BE, kcal/mol COAu-T8 2194 175.1 +0.142 +0.842 −154.1 COAu-T11 2170 176.6 +0.108 +0.822 −161.8 COAu-T2 2169 162.5 +0.066 +0.814 −189.5 COAu-T5 2164 178.6 +0.099 +0.807 −176.0 COAu-T6 2163 160.8 +0.057 +0.818 −186.9 COAu-T7 2162 176.6 +0.092 +0.812 −177.0 COAu-T4 2157 177.8 +0.081 +0.800 −155.2 COAu-T1 2148 178.7 +0.068 +0.809 −179.0 COAu-T3 2148 179.8 +0.067 +0.802 −177.0 COAu-T12 2133 174.0 -0.006 +0.806 −180.7 COAu-T10 2123 179.1 -0.008 +0.794 −168.5 COAu-T9 2119 179.7 -0.010 +0.804 −182.2 Free ν CO exp.=2143cm−1; free ν CO cal.=2141cm−1. Table 2 ΔG and ΔH at 298.15K for H2O displacement by CO on different T sites. Reaction site ΔG, kcal/mol ΔH, kcal/mol H2OAu-T8+CO→COAu-T8+H2O −3.0 −1.9 H2OAu-T11+CO→COAu-T11+H2O −9.5 −7.3 H2OAu-T2+CO→COAu-T2+H2O −0.3 −5.4 H2OAu-T7+CO→COAu-T7+H2O −2.1 −2.6 H2OAu-T12+CO→COAu-T12+H2O −19.0 −18.0 Table 3 Adsorption ΔG and ΔH at 298.15K for H2O and CO en different T sites. Reaction ΔG, kcal/mol ΔH, kcal/mol H2OAu-T8→Au-T8+H2O 32.2 42.2 H2OAu-T11→Au-T11+H2O 13.7 26.4 H2OAu-T2→Au-T2+H2O 17.1 27.5 H2OAu-T7→Au-T7+H2O 32.5 42.4 H2OAu-T12→Au-T12+H2O 18.4 29.7 Au-T8+CO→COAu-T8 −35.2 −44.1 Au-T11+CO→COAu-T11 −23.2 −33.7 Au-T2+CO→COAu-T2 −17.4 −32.9 Au-T7+CO→COAu-T7 −34.6 −45.0 Au-T12+CO→COAu-T12 −37.4 −47.7 Table 4 Adsorption ΔG and ΔH at 298.15K for some hard and soft selected bases. Reaction ΔG, kcal/mol ΔH, kcal/mol CH3OCH3 +Au-T8→(CH3)2OAu-T8 −9.5 −21.0 CH3OCH3 +Au-T11→(CH3)2OAu-T11 −0.3 −13.6 CH3OCH3 +Au-T2→(CH3)2OAu-T2 0.6 −14.7 CH3OCH3 +Au-T7→(CH3)2OAu-T7 −4.4 −18.7 CH3OCH3 +Au-T12→(CH3)2OAu-T12 4.6 −13.4 CH3SCH3 +Au-T8→(CH3)2SAu-T8 −17.1 −31.2 CH3SCH3 +Au-T11→(CH3)2SAu-T11 −17.4 −29.9 CH3SCH3 +Au-T2→(CH3)2SAu-T2 −18.5 −32.8 CH3SCH3 +Au-T7→(CH3)2SAu-T7 −23.7 −34.0 CH3SCH3 +Au-T12→(CH3)2SAu-T12 −12.1 −27.2 NH3 +Au-T8→H3NAu-T8 −45.7 −54.5 NH3 +Au-T11→H3NAu-T11 −27.9 −38.1 NH3 +Au-T2→H3NAu-T2 −17.3 −26.9 NH3 +Au-T7→H3NAu-T7 −44.2 −53.0 NH3 +Au-T12→H3NAu-T12 −31.5 −45.6 Table 5 NO vibrational frequency (ν NO) and adsorption ΔG and ΔH at 298.15K on different T sites. NO adsorption a ν NO (cm−1) ΔG, kcal/mol ΔH, kcal/mol Au-T8+NO→ONAu-T8 1873 −15.2 −23.0 Au-T11+NO→ONAu-T11 1856 −1.8 −13.1 Au-T2+NO→ONAu-T2 1824 −1.7 −14.9 Au-T7+NO→ONAu-T7 1828 −13.8 −23.2 Au-T12+NO→ONAu-T12 1780 −17.7 −27.5 aCalculated νNO were scaled by 0.9632. The standard uncertainty is 40cm−1. Table 6 NO2 and SO2 adsorption ΔG and ΔH at 298.15K on different T sites. Reaction ΔG, kcal/mol ΔH, kcal/mol NO2 +Au-T8→η1-N O2NAu-T8 −0.2 −13.2 NO2 +Au-T11→η1-N O2NAu-T11 2.0 −8.8 NO2 +Au-T2→η1-N O2NAu-T2 2.5 −9.6 NO2 +Au-T7→η1-N O2NAu-T7 −9.0 −19.8 NO2 +Au-T12→η1-N O2NAu-T12 −11.0 −21.9 NO2 +Au-T8→η2-O NO2Au-T8 6.1 −5.1 NO2 +Au-T11→η2-O NO2Au-T11 7.7 −6.5 NO2 +Au-T2→η2-O NO2Au-T2 9.2 −1.5 NO2 +Au-T7→η2-O NO2Au-T7 −8.8 −18.6 NO2 +Au-T12→η2-O NO2Au-T12 −9.2 −24.0 SO2 +Au-T8→η1-S O2SAu-T8 −6.2 −18.4 SO2 +Au-T11→η1-S O2SAu-T11 5.3 −7.6 SO2 +Au-T2→η1-S O2SAu-T2 4.6 −6.1 SO2 +Au-T7→η1-S O2SAu-T7 −7.4 −18.1 SO2 +Au-T12→η1-S O2SAu-T12 −7.5 −19.7 SO2 +Au-T8→η2-O SO2Au-T8 −14.2 −25.5 SO2 +Au-T11→η2-O SO2Au-T11 5.3 −6.2 SO2 +Au-T2→η2-O SO2Au-T2 7.1 −2.5 SO2 +Au-T7→η2-O SO2Au-T7 −2.3 −16.4 SO2 +Au-T12→η2-O SO2Au-T12 −7.5 −19.7 DFT-ONIOM study of Au/ZSM-5 catalyst: Active sites, thermodynamic and vibrational frequencies Anibal Sierraalta a ⁎ Paola Alejos a Elena Ehrmann b Leonardo J. Rodriguez c Yetziree Ferrer c a Laboratorio de Química Computacional, Centro de Química, Instituto Venezolano de Investigaciones Científicas, Apartado 21827, Caracas 1020-A, Venezuela b Departamento de Procesos y Sistemas, Universidad Simón Bolívar, Valle de Sartenejas, Baruta-Edo Miranda, Venezuela c Laboratorio de Química Teórica y Computacional, Departamento de Química, Facultad Experimental de Ciencias, Apartado 526, Maracaibo, Venezuela ⁎ Corresponding author. Density functional and ONIOM calculations were carried out to investigate the possible active sites of Au(I) ion-exchanged ZSM-5 catalysts. Adsorption energies and vibrational frequencies of CO, NO, NO2, SO2, H2O, NH3, CH3NH2 and CH3SH molecules were analyzed. For first time the existence of two active sites in Au/ZSM-5 is shown; one of them is responsible for the high and the other for the low CO and NO adsorption frequencies. The analysis of adsorption ΔG shows that Au(I) behaves like a soft acid; therefore, there will be a preferential adsorption of soft bases over hard bases. The interaction with NH3 is thermodynamically very favored, mainly due to the hydrogen bond formation between the NH3 hydrogen atoms and the oxygen atoms of the zeolitic framework. Graphical abstract Keywords ONIOM ZSM-5 CO NO Gold Au Zeolite DFT FTIR 1 Introduction One of the main targets in environmental catalysis is the elimination of nitrogen oxides emissions, a dangerous mixture of NO and NO2. These nitrogen oxides or NO x are produced by mobile and stationary sources and are pollutants that severely damage air quality due to photochemical smog formation. A main goal is to find catalysts capable of facilitating the direct decomposition of NO x to N2 and O2. These catalysts must be environmentally friendly and easy to handle. Among the many types of catalysts developed to eliminate the NO x , DeNO x catalyst are the metal-exchanged zeolites. Many metal–zeolite combinations have been studied in the search for better catalysts, as for example Cu/ZMS-5 [1–3], Fe, Co and Pd over ZSM-5 [4–7], Ag over MOR, MFI or BEA [8,9], etc. Gold has long been regarded as a poor catalyst, but recent results show that supported gold has good potential as heterogeneous catalyst. For instance, the discovery of unique activity of gold nanoparticles in CO oxidation at low temperature [10–12] has stimulated the research on gold catalysts. Sachtler et al., showed that Au/MFI catalyzes the decomposition of N2O to N2 even in the presence of O2 [13]. Bond and Thompson [14] and Haruta [10] reported that highly dispersed gold catalyzes reactions such as CO oxidation and NO reduction. Ichikawa et al. [15] showed that the Au/ZSM-5 catalysts reduce the NO to N2 in the presence of oxygen. To explain the catalytic activity of Au over zeolites, different species with different oxidation states and structures have been proposed in the literature. Ichikawa et al. [16,17], used CO adsorption measured with FTIR, to study Au/NaY, Au/Na-MOR, and Au/Na-ZSM-5, and concluded that Au(I) is the dominant active site on which the reactions takes place. Sachtler et al. [13] used FTIR, XRD, and CO-TPR to analyze the Au/MFI system and concluded that gold is present mainly as both, Au(I) and Au(III). Despite experimental studies, many key questions remain unanswered: Where are the Au(I) ions located inside the zeolite framework? Which species are bound to Au(I) during the reaction, and how stable are these species? How easy is the interconversion of these species? How are the N–N and the O–O bonds formed? What particular steps in the reaction pathway affect catalytic activity and what steps hinder it? In the present work we analyze, from the quantum chemistry point of view, the physical–chemical properties and reactivity of Au(I) supported on ZSM-5 zeolite. The aim of the present work is to aid in the understanding of the nature of the Au/ZSM-5 active sites. 2 Computational details and models All geometry optimizations, energy and frequency calculations were performed using Gaussian-03 program [18]. The lower energy structures were obtained using the two-layer ONIOM2 methodology. Universal force field approach (UFF) was employed for the low level calculations with no charge assigned to atoms while for the high level, the calculations were performed using the DFT approach (B3LYP) with the LANL2DZ basis set with its corresponding pseudopotentials for H, Si, Al, and O atoms belonging to the zeolite model ZSM–5. The relativistic Stevens effective core potential (CEP-121) with its corresponding basis set was employed for Au; and the full-electron 6-31+G* basis set for, NO, NO2, SO2, H2O, NH3, CH3NH2 and CH3SH molecules. For the CO molecule, the full-electron 6-31+G with α d(C)=0.335884 and α d(O)=0.535903 basis set was used. This basis set reproduces the experimental metallic carbonyls frequencies with a standard deviation of ±6cm−1 [19]. Thermodynamic property calculations; that is, ΔG and ΔH value calculations, were performed at 298.15K using only the high level model. Inside the ZSM-5 unit cell there are twelve Si types or T sites. A model for each T sites was generated substituting the Si by one Al atom. Due to the heterogeneity of the T sites, the 12 models corresponding to the 12 T sites contain different number of tetrahedrons in the high level model. Thus, there are 11 tetrahedrons for the T3, T4, T8 and T11 site models, 9 tetrahedrons for the T2, T6, T9 and T10 site models, and 8 tetrahedrons for the T1, T5, T7, and T12 site models. To model the Au/ZMS5 catalyst's active sites, one Au atom was placed on each T site. This generates a total of 12 Au–Tn structures to be studied. Figs. 1–4 show some of the models used in this work. A cluster model with a total number of 593 atoms was used to model the ZSM-5 zeolite. The cluster edges were terminated with H atoms to satisfy the edge atom valences. Similarly, for the high-level calculations, H atoms were used to satisfy the terminal atom valences. 3 Results and discussions 3.1 Interaction with CO When modeling the catalyst's possible active sites, it is necessary to compare calculated values with the experimental results to validate the model. Among available experimental data, the C–O stretching frequency has long been used as a monitor of structure and bonding in transition metal carbonyl complexes, as well as to determine and characterize the active sites of the catalysts. The CO stretching frequency is sensitive to the molecular environment of the bound CO because the extent of backbonding or π-backdonation is significantly altered by the surroundings. Therefore, to choose reasonable active site models for the highly dispersed Au/ZSM-5 catalyst, Quantum Chemistry calculations for CO adsorbed on Au in the different T sites were performed. According to the reported experimental results, after exposing Au/ZSM-5 to CO at room temperature two intense FTIR bands appear; one reported at 2190 [13] and 2192 [16] cm−1, and the other one reported at 2176 [13] and 2170cm−1 [17]. Additionally, a weak shoulder at 2160cm−1 has been reported [17] and attributed to the CO chemisorption on the Au(I) generated on the external surface of ZSM-5. Table 1 presents the calculated vibrational frequencies for carbonyl adsorbed on Au, on the twelve T sites of Au/ZSM-5. To test if the size of the high level region has important effects on the vibrational frequencies reported in Table 1, calculations with an increased high level region that includes a complete ring structure (see Figs. 5 and 6 ), were performed on the Au-T11 and the Au-T2 models. The results show that the difference between the new CO vibrational frequencies obtained with the larger models, ν CO(COAu-T11-large)=2164cm−1 and ν CO(COAu-T2-large)=2166cm−1, and those reported on Table 1 are within the range of the calculation error (±6cm−1) Consequently, this suggests that the models with medium size high-level regions are adequate for the studies reported on this work. The results reported on Table 1 show that only COAu-T8 is able to reproduce the vibrational frequency of 2192cm−1; hence, Au-T8 is a good candidate to represent one of the possible Au/ZSM-5's active sites. COAu-T11 and COAu-T12 reproduce the experimental value of 2170cm−1 whereas COAu-T4, COAu-T5, COAu-T6 and COAu-T7 sites can be associated with the shoulder at 2160cm−1. Table 1 shows that, in general, for all COAu–Tn sites, [AuCO] has a net charge of about +1. This is reasonable since the gold atom substitutes the H+ proton that corresponds to the Brønsted acid site. The calculated ν CO value for the free AuCO+ species, 2237cm−1, is very different from those reported in Table 1 however; it is in good agreement with the experimental value of 2236.8cm−1 obtained with Laser ablation techniques [20]. Consequently, this suggests that there is an important effect of the zeolite structure on the ν CO of the [AuCO]+ moiety. It is well known that CO donates electrons to the metal via σ bond. This fills an Au d-orbital and increases the electron density at Au. To relieve the added electron density, the filled Au d-orbital interacts with the empty π* orbital on the carbonyl ligand. As the π-backdonation becomes stronger, a decrease in the carbonyl stretching frequency in the IR is observed. According to Table 1, the lowest ν CO corresponds to the COAu-T9 model which suggests that the π-backdonation is stronger for this site and consequently, the negative net charge on CO is the highest for this model. As the π-backdonation diminishes the negative net charge on the CO decreases, and the ν CO increases. Thus, according to Table 1, the COAu-T8 exhibits the lowest degree of π-backdonation. The former results show that each T site can be considered as a ligand with a different ability to accept back-donation. At sites with low back-accepting capability, such as the T9, T10, T12 models, the CO must accept more dπ electrons from the Au atom and therefore the ν CO will be low. At high back-accepting capability sites, only a small or negligible π-backdonation from the Au to the CO and a high σ donation from the CO to the Au will occur. Therefore, the ν CO will be high for T8, T11, T5 site models. Q CO values for the COAu-T2 and COAu-T6 are low; this obeys to the fact that the C-O-Au angle is far from 180°; consequently, no backdonation is possible. According to the former discussion regarding ν CO values, the best candidates to accurately represent the Au/ZSM active sites are the T8, T11, T2, T5, T6 and T7 sites. In this work we choose T8, T11, T2, T7 and T12 sites to mimic the Au/ZSM-5 catalyst active sites. Although the calculated frequency for the COAu-T12 model site (2133cm−1) is far from the experimental value, it was included for comparison with previous studies [21,22]. To test the sites stability, Au+ binding energy (BE) calculations were performed. The Au+ binding energy is the energy necessary to separate the gold cation from its binding site. The analysis of the data reported in Table 1, indicate that the most stable sites i.e.; the sites with the highest BE are T2, T6, T9 and T2; while T4 and T8 are the least stables ones. No correlation was found between the BE and the ν CO values. According to Sachtler et al. [13], CO slowly displaces water adsorbed on the Au/ZSM-5 catalyst at room temperature. To test if the T8, T11, T2 T7 and T12 model sites are able to reproduce this experimental fact, thermodynamic calculation for displacement reaction (1) were carry out. Results are presented in Table 2 . (1) H 2 OAu − Tn + CO ⇄ COAu − Tn + H 2 O According to Table 2, the displacement of adsorbed H2O by CO is thermodynamically favored (ΔG <0) on all sites. The correlation between the ΔG or ΔH values with the sites seems to be complex. For example, for the T2 site, ΔG =−0.3kcal/mol while for T12 it is −19.0kcal/mol. To understand this behaviour, reaction (1) was divided into two steps: first, H2O desorption, (reaction (2)) and next, CO adsorption (reaction (3)). The results are reported in Table 3 . (2) H 2 OAu − Tn ⇄ AuTn + H 2 O (3) Au − Tn + CO ⇄ COAu − Tn Table 3 shows that the H2O adsorption energy, measured through ΔH, is greater for the T7 and T8 than for the T2, T11 and T12 sites. This could result from hydrogen bond formation. The molecular electronic density analysis shows that for H2OAu-T8 and H2OAu-T7, there are two hydrogen bonds between the water's H and the zeolite's oxygen, whereas for H2OAu-T11, H2OAu-T2 and H2OAu-T12 there is only one. In consequence, the H2O interaction energy is greater for H2OAu-T8 and H2OAu-T7 than for the other three sites. On the other hand, the interaction of CO with Au(I) is stronger for T8, T7 and T12 than for T11 and T2, and in general, stronger than the corresponding interactions with H2O (see Table 3) The balance between the CO adsorption and the H2O desorption energies, including the hydrogen bond energies, produces the final values reported in Table 2 for ΔG and ΔH. 3.2 Interactions with soft and hard bases It is well known that the Hard Soft Acid Base (HSAB) principle is an empirical principle that allows to predict the results of a given reaction and is very useful to understand and explain some experimental results, as well as to plan new chemical reactions. In order to classify the Au/ZSM-5 active sites as soft or hard acids, according to Pearson's rule or the HSAB, it is necessary to measure in some way the degree of the interaction between these active sites and soft and hard bases. Binding preference of the active site to hard bases indicates that Au/ZSM-5 behaves as a hard acid; whereas, binding preference to soft bases points towards a soft acid. Thus, adsorption ΔGs and ΔHs for CH3SCH3 (soft base) and CH3OCH3 (hard base) on Au/ZSM-5 were determined through Quantum Chemical calculations. Table 4 shows that, in general, the magnitude of the adsorption ΔH is larger and the reaction ΔG is more negative for CH3SCH3 than for CH3OCH3. Therefore, as long as ΔH and ΔG are relevant parameters to describe acid–base interactions, our results indicate that the Au/ZSM-5 active site behaves as a soft acid. Consequently, the Au/ZSM-5 will rather react with C2H4, R2P, R3As, R2S, RNC, etc., than with R2O, ROH, H2O, etc. The experimental observation that CO displaces H2O adsorbed on Au/ZSM-5 [13], can now be easily explained. Water is a hard base while CO is a soft one; therefore, the active site, which is a soft acid, will preferentially bind to CO than to H2O. Table 4 shows the ΔG and ΔH values for the adsorption of the hard base NH3. Noteworthy, unlike for the CH3OCH3 adsorption, NH3 adsorption energies on Au/ZSM-5 sites are higher than the corresponding ones for the soft base CH3SCH3. The electronic density analysis showed that the NH3 forms hydrogen bonds with the zeolite framework's oxygen atoms. Therefore, the total NH3 adsorption energy, measured as adsorption ΔH, corresponds to the N–Au interaction plus the hydrogen bonds. This combination strongly stabilizes the NH3 on the Au/ZSM-5, yielding high ΔH and ΔG values. 3.3 Interaction with NO, NO2, and SO2 Ichikawa et al. [17] showed that the Au(I)/ZSM-5 catalyst, when exposed to NO at 300K in an IR cell, exhibits bands at 1820 and 1900cm−1. Table 5 shows the NO vibrational frequencies, ν NO, for the selected T8, T11, T2, T7 and T12 sites. According to the results, ONAu-T2 and ONAu-T7 reproduce quite well the experimental ν NO of 1820cm−1. The closest value to 1900cm−1 was obtained for ONAu-T8, while ONAu-T11 presented an intermediate value between 1820 and 1900cm−1. These results, together with the adsorbed CO frequency results, Table 1, suggest that the Au/ZSM-5 catalyst possesses at least two different active sites. One of them, the Au-T8 site is responsible for the high ν CO and ν NO values. The other site, responsible for the low ν CO and ν NO values, can be represented by Au-T2, Au-T7 and Au-T11 models. The Au-T12 site does not reproduce the NO nor the CO frequencies. Comparison between the results for the CO adsorption (Table 3) and for NO adsorption (Table 5) evidences the interaction with CO is thermodynamically more favored than the NO interaction. Therefore, CO can displace NO from the adsorption site. Up to our knowledge, experimental studies of SO2 and NO2 adsorptions on Au/zeolites catalysts have not been reported in the literature until now. Some authors have reported a strong de-activation of the CO oxidation activity by SO2 [23,24] and an extraordinary ability of Au/TiO2 catalyst to adsorb and dissociate SO2 [25] Regarding NO2, Ichikawa et al. [15,17] proposed this molecule as an intermediate in the catalytic cycle of the NO reduction by Au/ZSM-5. Therefore, it is worthwhile to investigate the adsorption of SO2 and NO2 on Au/ZSM-5 catalysts. Table 6 shows that, in general, the NO2 adsorption is not thermodynamically favored, except for the Au-T7 and Au-T12 sites. This last site should not be considered since it does not reproduce the experimental ν CO or the ν NO values. For the Au-T7 site, ΔG <0 but for the Au-T2 site ΔG >0. This seems to indicate that not all possible sites responsible for the low CO and NO frequencies are actually good sites for NO2 adsorption. Contrary to the NO2 case, the SO2 adsorption is thermodynamically favored at the Au-T8 site, which is responsible for the high ν CO and ν NO. The reason for this behavior seems to be related to the Au atom's oxidation degree and in the T site's capacity to withdraw or to donate charge from or to Au. In general, there is a charge transfer from the SO2 to Au and from Au to NO2. At the T8 site, the Au is more oxidized (Q Au =+0.96e) than at the T7 site (Q Au =+0.83e). Therefore, it is more difficult for the Au atom to transfer charge to NO2 when at the T8 than at the T7 site. Consequently, the interaction is favored at the Au-T7 site over the Au-T8 site. On the other hand, the Au oxidation states at T2 and T7 are equal with (Q Au =+0.83e) and without (Q Au =+1.17e) the interaction with NO2. However, there is a greater charge transfer from Au-T7 to NO2 ( Q N O 2 = − 0.45 e ) than from Au-T2 ( Q N O 2 = − 0.36 e ) to NO2. This reveals that the charge donation from the T Brønsted site to Au is greater at T7 than at T2. The electrons are less tight at T7 than at T2; therefore, T7 can donate more easily electrons to Au than T2. This charge supply from the T site stabilizes the oxidation state of the Au atom, allowing a greater net charge transfer to the NO2 molecule and favoring the interaction. In consequence, the NO2 adsorption ΔH magnitude is greater for Au-T7 than for Au-T2. 4 Conclusions The most relevant features found in this work can be summarized as follows. (a) The CO and NO vibrational frequencies indicate that the Au/ZSM-5 catalyst has at least two different active sites. One of them is responsible for the high frequencies, ν CO =2192cm−1 and ν NO =1900cm−1 and can be represented by the Au-T8 site (ν CO =2194cm−1 and ν NO =1873cm−1). The other one is responsible for the low frequencies, ν CO =2170cm−1 and ν NO =1820cm−1. The theoretical results show that the responsible site for the low vibrational frequencies can be modeled by different sites such as: Au-T2 (ν CO =2169cm−1 and ν NO =1824cm−1), Au-T7 (νCO =2162cm−1 and νNO =1828cm−1), and Au-T11 (ν CO =2170cm−1 and ν NO =1856cm−1). Therefore, it is not possible to know if the low CO and NO frequencies are consequence of a Au+ localization on a single specific site such as for example T11, or the result of a distribution of the gold cations on two or three different sites, for example: T5 and T6 or T2, T7, and T11, that yield similar frequencies. More studies are needed to reach a conclusion. (b) The Au on ZSM-5 behaves likes a soft acid; therefore, soft bases such as CO, C2H4, R2P, R2S will bind to it preferentially over hard bases such as H2O, R2O, ROH. (c) The interaction with hard bases similar to NH3 are thermodynamically very favored, mainly due, to the formation of hydrogen bonds between the NH3 hydrogen atoms an the zeolitic framework oxygen atoms. (d) Each T sites has a different electron-donating capacity and back-accepting ability. This limits the amount of electrons that can be transferred to the adsorbate and to the Au atoms. At soft sites, Au can transfer more electrons than at hard sites. Acknowledgment The authors acknowledge the financial support given by FONACIT G-2005000426 project. References [1] M. Shelef Chem. Rev. 95 1995 209 [2] H. Yahiro M. Iwamoto Appl. Catal. A 222 2001 163 [3] S.A. Gomez A. Campero A. Martínez-Hernández G.A. Fuentes Appl. Catal. A 197 2000 157 [4] M. Schidder M.S. Kumar K. Klementiev M.M. Pohl A. Brückner W. Grünert J. Catal. 231 2005 314 [5] M. Devades O. Kröcher M. Elsener A. Wokiaun N. Söges M. Pfeifer Y. Demel L. Mussmann Appl. Catal. B Environ. 67 2006 187 [6] C. Chupin A.C. van Veen M. Konduru J. Despres C. Mirodals J. Catal. 241 2006 103 [7] L.J. Lobree A.W. Aylor J.A. Reimer A.T. Bell J. Catal. 181 1999 189 [8] J. Shibata Y. Takada A. Shichi S. Satokawa A. Satsuma T. Hattori Appl. Catal. B Environ. 54 2004 137 [9] J. Shibata K. Shimizu Y. Takada A. Shichi H. Yoshida S. Satokawa A. Satsuma T. Hattori J. Catal. 227 2004 367 [10] M. Haruta Catal. Today 36 1997 153 [11] J.C. Fierro-Gonzalez J. Guzman B.C. Gates Topics Catal. 44 2007 103 [12] A. Simakov I. Tuzovskaya A. Pestryakov N. Bogdanchikova V. Gurin M. Avalos M.H. Farıas Appl. Catal. A: Gen. 331 2007 121 [13] Z. Gao Q. Sun H. Chen X. Wang W.M.H. Sachtler Catal. Lett. 72 2001 1 [14] G.C. Bond D.T. Thompson Catal. Rev. 41 1999 319 [15] T.M. Salama R. Ohnishi M. Ichikawa Chem. Commun. 1 1997 105 [16] M.M. Mohamed T.M. Salama M. Ichikawa J. Colloid Interface Sci. 224 2000 366 371 [17] S. Qiu R. Ohnishi M. Ichikawa J. Phys. Chem. 98 1994 2719 [18] M.J. Frisch G.W. Trucks H.B. Schlegel G.E. Scuseria M.A. Robb J.R. Cheeseman J.A. Montgomery Jr. T. Vreven K.N. Kudin J.C. Burant J.M. Millam S.S. Iyengar J. Tomasi V. Barone B. Mennucci M. Cossi G. Scalmani N. Rega G.A. Petersson H. Nakatsuji M. Hada M. Ehara K. Toyota R. Fukuda J. Hasegawa M. Ishida T. Nakajima Y. Honda O. Kitao H. Nakai M. Klene X. Li J.E. Knox H.P. Hratchian J.B. Cross V. Bakken C. Adamo J. Jaramillo R. Gomperts R.E. Stratmann O. Yazyev A.J. Austin R. Cammi C. Pomelli J.W. Ochterski P.Y. Ayala K. Morokuma G.A. Voth P. Salvador J.J. Dannenberg V.G. Zakrzewski S. Dapprich A.D. Daniels M.C. Strain O. Farkas D.K. Malick A.D. Rabuck K. Raghavachari J.B. Foresman J.V. Ortiz Q. Cui A.G. Baboul S. Clifford J. Cioslowski B.B. Stefanov G. Liu A. Liashenko P. Piskorz I. Komaromi R.L. Martin D.J. Fox T. Keith M.A. Al-Laham C.Y. Peng A. Nanayakkara M. Challacombe P.M.W. Gill B. Johnson W. Chen M.W. Wong C. González J.A. Pople Gaussian 03, Revision D. 02 2004 Gaussian, Inc. Wallingford, CT [19] A. Sierraalta G. Martorell E. Ehrmann R. Añez Int. J. Quantum Chem. 108 2008 1036 [20] B. Liang L. Andrews J. Phys. Chem. A 104 2000 9156 [21] A. Sierraalta R. Hernández-Andara E. Ehrmann J. Phys. Chem. B 110 2006 17912 [22] A. Sierraalta R. Añez M. Rosa-Brussin J. Phys. Chem. A 106 2002 6851 [23] K. Ruth M. Hayes R. Burch S. Tsubota M. Haruta Appl. Catal. B: Environ. 24 2000 L133 [24] M.R. Kim S.I. Woo Appl. Catal. A: Gen. 299 2006 52 [25] J.A. Rodriguez G. Liu T. Jirsak J. Hrbek Z. Chang J. Dvorak A. Maiti J. Am. Chem. Soc. 124 2002 5242",
      "scopus-id": "61549109273",
      "coredata": {
        "eid": "1-s2.0-S1381116908005281",
        "dc:description": "Density functional and ONIOM calculations were carried out to investigate the possible active sites of Au(I) ion-exchanged ZSM-5 catalysts. Adsorption energies and vibrational frequencies of CO, NO, NO2, SO2, H2O, NH3, CH3NH2 and CH3SH molecules were analyzed. For first time the existence of two active sites in Au/ZSM-5 is shown; one of them is responsible for the high and the other for the low CO and NO adsorption frequencies. The analysis of adsorption ΔG shows that Au(I) behaves like a soft acid; therefore, there will be a preferential adsorption of soft bases over hard bases. The interaction with NH3 is thermodynamically very favored, mainly due to the hydrogen bond formation between the NH3 hydrogen atoms and the oxygen atoms of the zeolitic framework.",
        "openArchiveArticle": "false",
        "prism:coverDate": "2009-03-18",
        "openaccessUserLicense": null,
        "prism:aggregationType": "Journal",
        "prism:url": "https://api.elsevier.com/content/article/pii/S1381116908005281",
        "dc:creator": [
          {
            "@_fa": "true",
            "$": "Sierraalta, Anibal"
          },
          {
            "@_fa": "true",
            "$": "Alejos, Paola"
          },
          {
            "@_fa": "true",
            "$": "Ehrmann, Elena"
          },
          {
            "@_fa": "true",
            "$": "Rodriguez, Leonardo J."
          },
          {
            "@_fa": "true",
            "$": "Ferrer, Yetziree"
          }
        ],
        "link": [
          {
            "@_fa": "true",
            "@rel": "self",
            "@href": "https://api.elsevier.com/content/article/pii/S1381116908005281"
          },
          {
            "@_fa": "true",
            "@rel": "scidir",
            "@href": "https://www.sciencedirect.com/science/article/pii/S1381116908005281"
          }
        ],
        "dc:format": "application/json",
        "openaccessType": null,
        "pii": "S1381-1169(08)00528-1",
        "prism:volume": "301",
        "prism:publisher": "Elsevier B.V.",
        "dc:title": "DFT-ONIOM study of Au/ZSM-5 catalyst: Active sites, thermodynamic and vibrational frequencies",
        "prism:copyright": "Copyright © 2008 Elsevier B.V. All rights reserved.",
        "openaccess": "0",
        "prism:issn": "13811169",
        "prism:issueIdentifier": "1-2",
        "dcterms:subject": [
          {
            "@_fa": "true",
            "$": "ONIOM"
          },
          {
            "@_fa": "true",
            "$": "ZSM-5"
          },
          {
            "@_fa": "true",
            "$": "CO"
          },
          {
            "@_fa": "true",
            "$": "NO"
          },
          {
            "@_fa": "true",
            "$": "Gold"
          },
          {
            "@_fa": "true",
            "$": "Au"
          },
          {
            "@_fa": "true",
            "$": "Zeolite"
          },
          {
            "@_fa": "true",
            "$": "DFT"
          },
          {
            "@_fa": "true",
            "$": "FTIR"
          }
        ],
        "openaccessArticle": "false",
        "prism:publicationName": "Journal of Molecular Catalysis A: Chemical",
        "prism:number": "1-2",
        "openaccessSponsorType": null,
        "prism:pageRange": "61-66",
        "prism:endingPage": "66",
        "pubType": "fla",
        "prism:coverDisplayDate": "18 March 2009",
        "prism:doi": "10.1016/j.molcata.2008.11.008",
        "prism:startingPage": "61",
        "dc:identifier": "doi:10.1016/j.molcata.2008.11.008",
        "openaccessSponsorName": null
      },
      "objects": {
        "object": [
          {
            "@category": "thumbnail",
            "@height": "16",
            "@width": "120",
            "@_fa": "true",
            "$": "https://api.elsevier.com/content/object/eid/1-s2.0-S1381116908005281-si5.gif?httpAccept=%2A%2F%2A",
            "@multimediatype": "GIF image file",
            "@type": "ALTIMG",
            "@size": "477",
            "@ref": "si5",
            "@mimetype": "image/gif"
          },
          {
            "@category": "thumbnail",
            "@height": "16",
            "@width": "120",
            "@_fa": "true",
            "$": "https://api.elsevier.com/content/object/eid/1-s2.0-S1381116908005281-si4.gif?httpAccept=%2A%2F%2A",
            "@multimediatype": "GIF image file",
            "@type": "ALTIMG",
            "@size": "470",
            "@ref": "si4",
            "@mimetype": "image/gif"
          },
          {
            "@category": "thumbnail",
            "@height": "13",
            "@width": "207",
            "@_fa": "true",
            "$": "https://api.elsevier.com/content/object/eid/1-s2.0-S1381116908005281-si3.gif?httpAccept=%2A%2F%2A",
            "@multimediatype": "GIF image file",
            "@type": "ALTIMG",
            "@size": "698",
            "@ref": "si3",
            "@mimetype": "image/gif"
          },
          {
            "@category": "thumbnail",
            "@height": "14",
            "@width": "202",
            "@_fa": "true",
            "$": "https://api.elsevier.com/content/object/eid/1-s2.0-S1381116908005281-si2.gif?httpAccept=%2A%2F%2A",
            "@multimediatype": "GIF image file",
            "@type": "ALTIMG",
            "@size": "713",
            "@ref": "si2",
            "@mimetype": "image/gif"
          },
          {
            "@category": "thumbnail",
            "@height": "14",
            "@width": "286",
            "@_fa": "true",
            "$": "https://api.elsevier.com/content/object/eid/1-s2.0-S1381116908005281-si1.gif?httpAccept=%2A%2F%2A",
            "@multimediatype": "GIF image file",
            "@type": "ALTIMG",
            "@size": "920",
            "@ref": "si1",
            "@mimetype": "image/gif"
          },
          {
            "@category": "standard",
            "@height": "358",
            "@width": "336",
            "@_fa": "true",
            "$": "https://api.elsevier.com/content/object/eid/1-s2.0-S1381116908005281-gr1.jpg?httpAccept=%2A%2F%2A",
            "@multimediatype": "JPEG image file",
            "@type": "IMAGE-DOWNSAMPLED",
            "@size": "40660",
            "@ref": "gr1",
            "@mimetype": "image/jpeg"
          },
          {
            "@category": "thumbnail",
            "@height": "164",
            "@width": "154",
            "@_fa": "true",
            "$": "https://api.elsevier.com/content/object/eid/1-s2.0-S1381116908005281-gr1.sml?httpAccept=%2A%2F%2A",
            "@multimediatype": "GIF image file",
            "@type": "IMAGE-THUMBNAIL",
            "@size": "4809",
            "@ref": "gr1",
            "@mimetype": "image/gif"
          },
          {
            "@category": "standard",
            "@height": "292",
            "@width": "374",
            "@_fa": "true",
            "$": "https://api.elsevier.com/content/object/eid/1-s2.0-S1381116908005281-gr2.jpg?httpAccept=%2A%2F%2A",
            "@multimediatype": "JPEG image file",
            "@type": "IMAGE-DOWNSAMPLED",
            "@size": "37359",
            "@ref": "gr2",
            "@mimetype": "image/jpeg"
          },
          {
            "@category": "thumbnail",
            "@height": "164",
            "@width": "210",
            "@_fa": "true",
            "$": "https://api.elsevier.com/content/object/eid/1-s2.0-S1381116908005281-gr2.sml?httpAccept=%2A%2F%2A",
            "@multimediatype": "GIF image file",
            "@type": "IMAGE-THUMBNAIL",
            "@size": "6204",
            "@ref": "gr2",
            "@mimetype": "image/gif"
          },
          {
            "@category": "standard",
            "@height": "315",
            "@width": "376",
            "@_fa": "true",
            "$": "https://api.elsevier.com/content/object/eid/1-s2.0-S1381116908005281-gr3.jpg?httpAccept=%2A%2F%2A",
            "@multimediatype": "JPEG image file",
            "@type": "IMAGE-DOWNSAMPLED",
            "@size": "42648",
            "@ref": "gr3",
            "@mimetype": "image/jpeg"
          },
          {
            "@category": "thumbnail",
            "@height": "164",
            "@width": "196",
            "@_fa": "true",
            "$": "https://api.elsevier.com/content/object/eid/1-s2.0-S1381116908005281-gr3.sml?httpAccept=%2A%2F%2A",
            "@multimediatype": "GIF image file",
            "@type": "IMAGE-THUMBNAIL",
            "@size": "6015",
            "@ref": "gr3",
            "@mimetype": "image/gif"
          },
          {
            "@category": "standard",
            "@height": "297",
            "@width": "376",
            "@_fa": "true",
            "$": "https://api.elsevier.com/content/object/eid/1-s2.0-S1381116908005281-gr4.jpg?httpAccept=%2A%2F%2A",
            "@multimediatype": "JPEG image file",
            "@type": "IMAGE-DOWNSAMPLED",
            "@size": "37090",
            "@ref": "gr4",
            "@mimetype": "image/jpeg"
          },
          {
            "@category": "thumbnail",
            "@height": "164",
            "@width": "208",
            "@_fa": "true",
            "$": "https://api.elsevier.com/content/object/eid/1-s2.0-S1381116908005281-gr4.sml?httpAccept=%2A%2F%2A",
            "@multimediatype": "GIF image file",
            "@type": "IMAGE-THUMBNAIL",
            "@size": "5771",
            "@ref": "gr4",
            "@mimetype": "image/gif"
          },
          {
            "@category": "standard",
            "@height": "334",
            "@width": "370",
            "@_fa": "true",
            "$": "https://api.elsevier.com/content/object/eid/1-s2.0-S1381116908005281-gr5.jpg?httpAccept=%2A%2F%2A",
            "@multimediatype": "JPEG image file",
            "@type": "IMAGE-DOWNSAMPLED",
            "@size": "41203",
            "@ref": "gr5",
            "@mimetype": "image/jpeg"
          },
          {
            "@category": "thumbnail",
            "@height": "164",
            "@width": "182",
            "@_fa": "true",
            "$": "https://api.elsevier.com/content/object/eid/1-s2.0-S1381116908005281-gr5.sml?httpAccept=%2A%2F%2A",
            "@multimediatype": "GIF image file",
            "@type": "IMAGE-THUMBNAIL",
            "@size": "7023",
            "@ref": "gr5",
            "@mimetype": "image/gif"
          },
          {
            "@category": "standard",
            "@height": "594",
            "@width": "376",
            "@_fa": "true",
            "$": "https://api.elsevier.com/content/object/eid/1-s2.0-S1381116908005281-gr6.jpg?httpAccept=%2A%2F%2A",
            "@multimediatype": "JPEG image file",
            "@type": "IMAGE-DOWNSAMPLED",
            "@size": "47851",
            "@ref": "gr6",
            "@mimetype": "image/jpeg"
          },
          {
            "@category": "thumbnail",
            "@height": "163",
            "@width": "103",
            "@_fa": "true",
            "$": "https://api.elsevier.com/content/object/eid/1-s2.0-S1381116908005281-gr6.sml?httpAccept=%2A%2F%2A",
            "@multimediatype": "GIF image file",
            "@type": "IMAGE-THUMBNAIL",
            "@size": "3745",
            "@ref": "gr6",
            "@mimetype": "image/gif"
          },
          {
            "@category": "standard",
            "@height": "122",
            "@width": "454",
            "@_fa": "true",
            "$": "https://api.elsevier.com/content/object/eid/1-s2.0-S1381116908005281-fx1.jpg?httpAccept=%2A%2F%2A",
            "@multimediatype": "JPEG image file",
            "@type": "IMAGE-DOWNSAMPLED",
            "@size": "6904",
            "@ref": "fx1",
            "@mimetype": "image/jpeg"
          },
          {
            "@category": "thumbnail",
            "@height": "59",
            "@width": "219",
            "@_fa": "true",
            "$": "https://api.elsevier.com/content/object/eid/1-s2.0-S1381116908005281-fx1.sml?httpAccept=%2A%2F%2A",
            "@multimediatype": "GIF image file",
            "@type": "IMAGE-THUMBNAIL",
            "@size": "982",
            "@ref": "fx1",
            "@mimetype": "image/gif"
          }
        ]
      },
      "link": {
        "@rel": "abstract",
        "@href": "https://api.elsevier.com/content/abstract/scopus_id/61549109273"
      }
    }
  }
}