{
  "metadata": {
    "title": "The influence of interaction between palladium and indium on the activity of Pd–In/Al<ce:inf loc=post>2</ce:inf>O<ce:inf loc=post>3</ce:inf> catalysts in reduction of nitrates and nitrites",
    "authors": "; ; ",
    "journal": "Journal of Molecular Catalysis A: Chemical",
    "date": "2008-05-15",
    "doi": "10.1016/j.molcata.2008.01.044",
    "abstract": "",
    "uri": "https://api.elsevier.com/content/article/pii/S1381116908000800",
    "pii": "S1381116908000800"
  },
  "fulltext": {
    "full-text-retrieval-response": {
      "scopus-eid": "2-s2.0-43549090145",
      "originalText": "serial JL 271358 291210 291744 291790 291809 31 Journal of Molecular Catalysis A: Chemical JOURNALMOLECULARCATALYSISACHEMICAL 2008-02-09 2008-02-09 2010-03-29T10:57:16 1-s2.0-S1381116908000800 S1381-1169(08)00080-0 S1381116908000800 10.1016/j.molcata.2008.01.044 S300 S300.1 FULL-TEXT 1-s2.0-S1381116908X00068 2015-05-15T05:56:33.307883-04:00 0 0 20080515 2008 2008-02-09T00:00:00Z articleinfo crossmark dco dateupdated tomb dateloaded datesearch indexeddate issuelist volumelist yearnav absattachment articletitlenorm authfirstinitialnorm authfirstsurnamenorm cid cids contenttype copyright dateloadedtxt docsubtype doctype doi eid ewtransactionid hubeid issfirst issn issnnorm itemstage itemtransactionid itemweight openaccess openarchive pg pgfirst pglast pii piinorm pubdatestart pubdatetxt pubyr sortorder srctitle srctitlenorm srctype subheadings volfirst volissue webpdf webpdfpagecount figure table body mmlmath affil articletitle auth authfirstini authfull authkeywords authlast primabst ref specialabst alllist content subj ssids 1381-1169 13811169 287 287 1 2 1 2 Volume 287, Issues 1–2 16 87 94 87 94 20080515 15 May 2008 2008-05-15 2008 article fla Copyright © 2008 Elsevier B.V. All rights reserved. INFLUENCEINTERACTIONBETWEENPALLADIUMINDIUMACTIVITYPDINAL2O3CATALYSTSINREDUCTIONNITRATESNITRITES WITONSKA I 1 Introduction 2 Experimental 2.1 Catalyst preparation 2.2 Catalytic measurements 2.2.1 Reduction of nitrates and nitrites 2.2.2 Powder X-ray diffraction 2.2.3 Temperature-programmed reduction and temperature programmed desorption of H2 ( TP D H 2 ) measurements 2.2.4 Time of flight secondary mass spectrometry 3 Results and discussion 4 Conclusions References LINDLAR 1952 446 H ADURIZ 1991 47 H CHOI 2000 176 S SALES 2000 96 E BACHIR 1997 313 R NORONHA 1999 20 F GUCZI 1999 456 L NOSOVA 1994 131 L FUJIKAWA 1999 27 T SCHLAM 1999 138 M FERNANDEZGARCIA 2000 378 M ELHAMDAOUI 1994 47 A OHNISHI 1994 29 R BATISTA 1997 79 J DEGANELLO 2000 256 F DEVOOYS 2000 203 A KARSKI 2006 123 S WITONSKA 2007 107 I GAUTHARD 2003 182 F GARRON 2005 57 A GARRON 2005 3073 A STRATZ 1984 335 A CATALYSISORGANICREACTIONS COQ 2001 117 B KARSKI 2003 87 S KARSKI 2004 256 S KARSKI 2006 225 S KARSKI 2006 147 S YAMAMATSU 2001 549 S MIYAKE 2000 243 T LEMAINGNEN 2002 43 L AMBONGUILAT 2006 675 S PRUSSE 2000 79 U PRUSSE 2001 313 U PARYJCZAK 1980 254 T HOROLD 1993 931 S EPRON 2001 309 F WITONSKAX2008X87 WITONSKAX2008X87X94 WITONSKAX2008X87XI WITONSKAX2008X87X94XI item S1381-1169(08)00080-0 S1381116908000800 1-s2.0-S1381116908000800 10.1016/j.molcata.2008.01.044 271358 2010-10-11T07:03:45.864483-04:00 2008-05-15 1-s2.0-S1381116908000800-main.pdf https://s3.amazonaws.com/prod-ucs-content-store-us-east/content/pii:S1381116908000800/MAIN/application/pdf/5d181dfbc26ed4defb6f1b179a3d744a/main.pdf https://s3-eu-west-1.amazonaws.com/prod-ucs-content-store-eu-west/content/pii:S1381116908000800/MAIN/application/pdf/5d181dfbc26ed4defb6f1b179a3d744a/main.pdf main.pdf pdf true 1213599 MAIN 8 1-s2.0-S1381116908000800-main_1.png https://s3.amazonaws.com/prod-ucs-content-store-us-east/content/pii:S1381116908000800/PREVIEW/image/png/8f0d60349fd5503b718e4d4f1ba2a45c/main_1.png https://s3-eu-west-1.amazonaws.com/prod-ucs-content-store-eu-west/content/pii:S1381116908000800/PREVIEW/image/png/8f0d60349fd5503b718e4d4f1ba2a45c/main_1.png main_1.png png 72603 849 656 IMAGE-WEB-PDF 1 1-s2.0-S1381116908000800-si8.gif https://s3.amazonaws.com/prod-ucs-content-store-us-east/content/pii:S1381116908000800/STRIPIN/image/gif/12d7017758d5303844b4fa73d575fa3a/si4.gif https://s3-eu-west-1.amazonaws.com/prod-ucs-content-store-eu-west/content/pii:S1381116908000800/STRIPIN/image/gif/12d7017758d5303844b4fa73d575fa3a/si4.gif si8 si8.gif gif 328 16 58 ALTIMG 1-s2.0-S1381116908000800-si7.gif https://s3.amazonaws.com/prod-ucs-content-store-us-east/content/pii:S1381116908000800/STRIPIN/image/gif/037ba3fe750822dc4737d59238db5ba0/si7.gif https://s3-eu-west-1.amazonaws.com/prod-ucs-content-store-eu-west/content/pii:S1381116908000800/STRIPIN/image/gif/037ba3fe750822dc4737d59238db5ba0/si7.gif si7 si7.gif gif 681 21 223 ALTIMG 1-s2.0-S1381116908000800-si6.gif https://s3.amazonaws.com/prod-ucs-content-store-us-east/content/pii:S1381116908000800/STRIPIN/image/gif/4fb19874e8625eeb12660a44e6b62dab/si6.gif https://s3-eu-west-1.amazonaws.com/prod-ucs-content-store-eu-west/content/pii:S1381116908000800/STRIPIN/image/gif/4fb19874e8625eeb12660a44e6b62dab/si6.gif si6 si6.gif gif 1415 40 208 ALTIMG 1-s2.0-S1381116908000800-si5.gif https://s3.amazonaws.com/prod-ucs-content-store-us-east/content/pii:S1381116908000800/STRIPIN/image/gif/450a4e732d960b6b01a55449c513c389/si5.gif https://s3-eu-west-1.amazonaws.com/prod-ucs-content-store-eu-west/content/pii:S1381116908000800/STRIPIN/image/gif/450a4e732d960b6b01a55449c513c389/si5.gif si5 si5.gif gif 241 15 46 ALTIMG 1-s2.0-S1381116908000800-si4.gif https://s3.amazonaws.com/prod-ucs-content-store-us-east/content/pii:S1381116908000800/STRIPIN/image/gif/12d7017758d5303844b4fa73d575fa3a/si4.gif https://s3-eu-west-1.amazonaws.com/prod-ucs-content-store-eu-west/content/pii:S1381116908000800/STRIPIN/image/gif/12d7017758d5303844b4fa73d575fa3a/si4.gif si4 si4.gif gif 328 16 58 ALTIMG 1-s2.0-S1381116908000800-si3.gif https://s3.amazonaws.com/prod-ucs-content-store-us-east/content/pii:S1381116908000800/STRIPIN/image/gif/13dbfb715cc8420d0aeabf2b50fe1e22/si3.gif https://s3-eu-west-1.amazonaws.com/prod-ucs-content-store-eu-west/content/pii:S1381116908000800/STRIPIN/image/gif/13dbfb715cc8420d0aeabf2b50fe1e22/si3.gif si3 si3.gif gif 257 20 36 ALTIMG 1-s2.0-S1381116908000800-si2.gif https://s3.amazonaws.com/prod-ucs-content-store-us-east/content/pii:S1381116908000800/STRIPIN/image/gif/0eba0f3b494b186ccb125a784f9a1873/si2.gif https://s3-eu-west-1.amazonaws.com/prod-ucs-content-store-eu-west/content/pii:S1381116908000800/STRIPIN/image/gif/0eba0f3b494b186ccb125a784f9a1873/si2.gif si2 si2.gif gif 364 30 51 ALTIMG 1-s2.0-S1381116908000800-si1.gif https://s3.amazonaws.com/prod-ucs-content-store-us-east/content/pii:S1381116908000800/STRIPIN/image/gif/be7f6167a3c3c7e730999115156ad623/si1.gif https://s3-eu-west-1.amazonaws.com/prod-ucs-content-store-eu-west/content/pii:S1381116908000800/STRIPIN/image/gif/be7f6167a3c3c7e730999115156ad623/si1.gif si1 si1.gif gif 352 30 51 ALTIMG 1-s2.0-S1381116908000800-gr1.jpg https://s3.amazonaws.com/prod-ucs-content-store-us-east/content/pii:S1381116908000800/gr1/DOWNSAMPLED/image/jpeg/96cc67cc96317a96c3ca076fe17971c1/gr1.jpg https://s3-eu-west-1.amazonaws.com/prod-ucs-content-store-eu-west/content/pii:S1381116908000800/gr1/DOWNSAMPLED/image/jpeg/96cc67cc96317a96c3ca076fe17971c1/gr1.jpg gr1 gr1.jpg jpg 44391 684 357 IMAGE-DOWNSAMPLED 1-s2.0-S1381116908000800-gr1.sml https://s3.amazonaws.com/prod-ucs-content-store-us-east/content/pii:S1381116908000800/gr1/THUMBNAIL/image/gif/61de14bea38a3d134d7ad9c28a726868/gr1.sml https://s3-eu-west-1.amazonaws.com/prod-ucs-content-store-eu-west/content/pii:S1381116908000800/gr1/THUMBNAIL/image/gif/61de14bea38a3d134d7ad9c28a726868/gr1.sml gr1 gr1.sml sml 1009 92 48 IMAGE-THUMBNAIL 1-s2.0-S1381116908000800-gr2.jpg https://s3.amazonaws.com/prod-ucs-content-store-us-east/content/pii:S1381116908000800/gr2/DOWNSAMPLED/image/jpeg/f190d145d2b5e8299765a70c3b4097a7/gr2.jpg https://s3-eu-west-1.amazonaws.com/prod-ucs-content-store-eu-west/content/pii:S1381116908000800/gr2/DOWNSAMPLED/image/jpeg/f190d145d2b5e8299765a70c3b4097a7/gr2.jpg gr2 gr2.jpg jpg 14965 212 373 IMAGE-DOWNSAMPLED 1-s2.0-S1381116908000800-gr2.sml https://s3.amazonaws.com/prod-ucs-content-store-us-east/content/pii:S1381116908000800/gr2/THUMBNAIL/image/gif/011e00d2c5899e89eabea53cad2b4ca5/gr2.sml https://s3-eu-west-1.amazonaws.com/prod-ucs-content-store-eu-west/content/pii:S1381116908000800/gr2/THUMBNAIL/image/gif/011e00d2c5899e89eabea53cad2b4ca5/gr2.sml gr2 gr2.sml sml 1364 71 125 IMAGE-THUMBNAIL 1-s2.0-S1381116908000800-gr3.jpg https://s3.amazonaws.com/prod-ucs-content-store-us-east/content/pii:S1381116908000800/gr3/DOWNSAMPLED/image/jpeg/0f7e46d4d762741751a5efd13bfe5923/gr3.jpg https://s3-eu-west-1.amazonaws.com/prod-ucs-content-store-eu-west/content/pii:S1381116908000800/gr3/DOWNSAMPLED/image/jpeg/0f7e46d4d762741751a5efd13bfe5923/gr3.jpg gr3 gr3.jpg jpg 49730 596 369 IMAGE-DOWNSAMPLED 1-s2.0-S1381116908000800-gr3.sml https://s3.amazonaws.com/prod-ucs-content-store-us-east/content/pii:S1381116908000800/gr3/THUMBNAIL/image/gif/e97e1e145088fce2fd51192b59c481ca/gr3.sml https://s3-eu-west-1.amazonaws.com/prod-ucs-content-store-eu-west/content/pii:S1381116908000800/gr3/THUMBNAIL/image/gif/e97e1e145088fce2fd51192b59c481ca/gr3.sml gr3 gr3.sml sml 1519 94 58 IMAGE-THUMBNAIL 1-s2.0-S1381116908000800-gr4.jpg https://s3.amazonaws.com/prod-ucs-content-store-us-east/content/pii:S1381116908000800/gr4/DOWNSAMPLED/image/jpeg/f589beb13102ec878c97f93d242846f8/gr4.jpg https://s3-eu-west-1.amazonaws.com/prod-ucs-content-store-eu-west/content/pii:S1381116908000800/gr4/DOWNSAMPLED/image/jpeg/f589beb13102ec878c97f93d242846f8/gr4.jpg gr4 gr4.jpg jpg 125529 460 539 IMAGE-DOWNSAMPLED 1-s2.0-S1381116908000800-gr4.sml https://s3.amazonaws.com/prod-ucs-content-store-us-east/content/pii:S1381116908000800/gr4/THUMBNAIL/image/gif/c821e1b89a07b08d7d3d242930328342/gr4.sml https://s3-eu-west-1.amazonaws.com/prod-ucs-content-store-eu-west/content/pii:S1381116908000800/gr4/THUMBNAIL/image/gif/c821e1b89a07b08d7d3d242930328342/gr4.sml gr4 gr4.sml sml 4313 93 109 IMAGE-THUMBNAIL 1-s2.0-S1381116908000800-gr5.jpg https://s3.amazonaws.com/prod-ucs-content-store-us-east/content/pii:S1381116908000800/gr5/DOWNSAMPLED/image/jpeg/e350998202ddaacf33ed9186573ae5b1/gr5.jpg https://s3-eu-west-1.amazonaws.com/prod-ucs-content-store-eu-west/content/pii:S1381116908000800/gr5/DOWNSAMPLED/image/jpeg/e350998202ddaacf33ed9186573ae5b1/gr5.jpg gr5 gr5.jpg jpg 75321 943 602 IMAGE-DOWNSAMPLED 1-s2.0-S1381116908000800-gr5.sml https://s3.amazonaws.com/prod-ucs-content-store-us-east/content/pii:S1381116908000800/gr5/THUMBNAIL/image/gif/5509c49744138f34d3cb43b5cdda1886/gr5.sml https://s3-eu-west-1.amazonaws.com/prod-ucs-content-store-eu-west/content/pii:S1381116908000800/gr5/THUMBNAIL/image/gif/5509c49744138f34d3cb43b5cdda1886/gr5.sml gr5 gr5.sml sml 1007 92 59 IMAGE-THUMBNAIL 1-s2.0-S1381116908000800-gr6.jpg https://s3.amazonaws.com/prod-ucs-content-store-us-east/content/pii:S1381116908000800/gr6/DOWNSAMPLED/image/jpeg/6bf0b5c81d83d63d3d7ecd0f4d37294b/gr6.jpg https://s3-eu-west-1.amazonaws.com/prod-ucs-content-store-eu-west/content/pii:S1381116908000800/gr6/DOWNSAMPLED/image/jpeg/6bf0b5c81d83d63d3d7ecd0f4d37294b/gr6.jpg gr6 gr6.jpg jpg 25155 508 334 IMAGE-DOWNSAMPLED 1-s2.0-S1381116908000800-gr6.sml https://s3.amazonaws.com/prod-ucs-content-store-us-east/content/pii:S1381116908000800/gr6/THUMBNAIL/image/gif/5db59b4a334cebe2655f0b0894646776/gr6.sml https://s3-eu-west-1.amazonaws.com/prod-ucs-content-store-eu-west/content/pii:S1381116908000800/gr6/THUMBNAIL/image/gif/5db59b4a334cebe2655f0b0894646776/gr6.sml gr6 gr6.sml sml 812 93 61 IMAGE-THUMBNAIL 1-s2.0-S1381116908000800-gr7.jpg https://s3.amazonaws.com/prod-ucs-content-store-us-east/content/pii:S1381116908000800/gr7/DOWNSAMPLED/image/jpeg/675463405ad602daaf20953da3e5105c/gr7.jpg https://s3-eu-west-1.amazonaws.com/prod-ucs-content-store-eu-west/content/pii:S1381116908000800/gr7/DOWNSAMPLED/image/jpeg/675463405ad602daaf20953da3e5105c/gr7.jpg gr7 gr7.jpg jpg 25402 339 334 IMAGE-DOWNSAMPLED 1-s2.0-S1381116908000800-gr7.sml https://s3.amazonaws.com/prod-ucs-content-store-us-east/content/pii:S1381116908000800/gr7/THUMBNAIL/image/gif/a18620e4da516a2cbcfb73dc9e567a64/gr7.sml https://s3-eu-west-1.amazonaws.com/prod-ucs-content-store-eu-west/content/pii:S1381116908000800/gr7/THUMBNAIL/image/gif/a18620e4da516a2cbcfb73dc9e567a64/gr7.sml gr7 gr7.sml sml 1163 93 92 IMAGE-THUMBNAIL 1-s2.0-S1381116908000800-fx1.jpg https://s3.amazonaws.com/prod-ucs-content-store-us-east/content/pii:S1381116908000800/fx1/DOWNSAMPLED/image/jpeg/d742f779e97b2276044d650e34561c59/fx1.jpg https://s3-eu-west-1.amazonaws.com/prod-ucs-content-store-eu-west/content/pii:S1381116908000800/fx1/DOWNSAMPLED/image/jpeg/d742f779e97b2276044d650e34561c59/fx1.jpg fx1 true fx1.jpg jpg 53580 153 429 IMAGE-DOWNSAMPLED 1-s2.0-S1381116908000800-fx1.sml https://s3.amazonaws.com/prod-ucs-content-store-us-east/content/pii:S1381116908000800/fx1/THUMBNAIL/image/gif/f61e267c49659405d3dd689821e6cc21/fx1.sml https://s3-eu-west-1.amazonaws.com/prod-ucs-content-store-eu-west/content/pii:S1381116908000800/fx1/THUMBNAIL/image/gif/f61e267c49659405d3dd689821e6cc21/fx1.sml fx1 true fx1.sml sml 3817 45 125 IMAGE-THUMBNAIL 1-s2.0-S1381116908000800-fx2.gif https://s3.amazonaws.com/prod-ucs-content-store-us-east/content/pii:S1381116908000800/fx2/DOWNSAMPLED/image/gif/193c7dd5a14687dd5e9fd12e95e3700d/fx2.gif https://s3-eu-west-1.amazonaws.com/prod-ucs-content-store-eu-west/content/pii:S1381116908000800/fx2/DOWNSAMPLED/image/gif/193c7dd5a14687dd5e9fd12e95e3700d/fx2.gif fx2 fx2.gif gif 112 10 9 IMAGE-DOWNSAMPLED 1-s2.0-S1381116908000800-fx2.sml https://s3.amazonaws.com/prod-ucs-content-store-us-east/content/pii:S1381116908000800/fx2/THUMBNAIL/image/gif/bcc3b7b50e4e5668ab1a10e74e57dfd9/fx2.sml https://s3-eu-west-1.amazonaws.com/prod-ucs-content-store-eu-west/content/pii:S1381116908000800/fx2/THUMBNAIL/image/gif/bcc3b7b50e4e5668ab1a10e74e57dfd9/fx2.sml fx2 fx2.sml sml 491 94 85 IMAGE-THUMBNAIL MOLCAA 7092 S1381-1169(08)00080-0 10.1016/j.molcata.2008.01.044 Elsevier B.V. Fig. 1 Conversion of nitrates (X) and selectivities to nitrites S N O 2 − , ammonia S N H 4 + and nitrogen S N 2 in the presence of catalysts: 5%Pd/Al2O3 (○); 5%In/Al2O3 ( ); 5%Pd–0.5%In/Al2O3 (♦); 5%Pd–1%In/Al2O3 (■); 5%Pd–2%In/Al2O3 (▴); 5%Pd–5%In/Al2O3 (●) as a function of time. Fig. 2 Conversion of nitrites (X) in the presence of catalysts: 5%Pd/Al2O3 (○); 5%In/Al2O3 ( ); 5%Pd–0.5%In/Al2O3 (♦); 5%Pd–1%In/Al2O3 (■); 5%Pd–2%In/Al2O3 (▴); 5%Pd–5%In/Al2O3 (●) as a function of time. Fig. 3 Diffractograms of: (1) 5%Pd/Al2O3; (2) 5%Pd–0.5%In/Al2O3; (3) 5%Pd–1%In/Al2O3; (4) 5%Pd–2%In/Al2O3; (5) 5%Pd–5%In/Al2O3 catalysts. Crystalline phases were identified by references to the ASTM data file. Fig. 4 Positive secondary ions ToF-SIMS images of the Pd–In/Al2O3 catalysts surfaces after a single oxidation–reduction cycle; the analyzed area of the surface 500μm×500μm; burst alignment working mode of primary Ga+ gun; spatial resolution of images was set to 128×128 pixels. Fig. 5 The ToF-SIMS (+) spectra of Pd–In/Al2O3 catalysts after oxidation at 500°C in air atmosphere reduction at 300°C. Fig. 6 Temperature-programmed desorption of H2 from the surfaces of the systems: (1) 5%Pd/Al2O3; (2) 5%Pd–0.5%In/Al2O3; (3) 5%Pd–1%In/Al2O3; (4) 5%Pd–5%In/Al2O3 after adsorption of H2 at room temperature. Adsorption of H2 was conducted in a continuous method (0.5h, flow rate of H2 40cm3/min, rate of heating 20°C/min). In all measurements the same amount of catalyst 0.5g was used. Fig. 7 TPR of (1) 5%Pd/Al2O3; (2) 5%Pd–1%In/Al2O3; (3) 5%Pd–2%In/Al2O3; (4) 5%Pd–5%In/Al2O3; (5) 5%In/Al2O3 catalysts after their oxidation in oxygen atmosphere at 500°C for 2h. Table 1 Metal particle size of the Pd–In/Al2O3 catalysts calculated according to the Scherrer equation Pd content (%) In content (%) Crystallites size (nm) 5 0 6.6 5 0.5 6.9 5 1 7.2 5 2 7.2 5 5 6.5 Table 2 ToF-SIMS peak intensity for the analyzed samples of Pd–In/Al2O3 catalysts Catalysts Peaks intensity (the number of counts) Relative intensity of peaks In+ 106Pd+ PdIn+ PdIn+/Pd+ In+/Pd+ 5%Pd–0.5%In/Al2O3 83,309 15,430 326 0.021 5.399 5%Pd–2%In/Al2O3 183,940 8,185 386 0.047 22.473 5%Pd–5%In/Al2O3 441,403 7,316 453 0.062 60.334 The analyzed area of the surface 500μm×500μm; burst alignment working mode of primary Ga+ gun; spatial resolution of images was set to 128×128 pixels. The influence of interaction between palladium and indium on the activity of Pd–In/Al2O3 catalysts in reduction of nitrates and nitrites I. Witońska S. Karski ⁎ J. Rogowski N. Krawczyk Institute of General and Ecological Chemistry, Technical University of Lodz, ul. Żeromskiego 116, 90-924 Lodz, Poland ⁎ Corresponding author. Tel.: +48 42 631 30 94. The influence of indium addition on the catalytic properties of palladium catalysts supported on Al2O3 in the reaction of nitrates reduction to nitrogen was studied. It was found that indium did not show any activity by itself, but acted as a “promoter” for the catalytic activity of monometallic Pd/Al2O3 catalysts. The X-ray diffraction (XRD) and Time-of-flight secondary ion mass spectrometry (ToF-SIMS) studies proved the existence of intermetallic interactions between Pd and In, which probably modified activity and selectivity of bimetallic catalysts in this reaction. The ToF-SIMS technique showed the presence of intermetallic compounds in all the studied bimetallic systems, which could not be proved by XRD measurements in the case of the systems with a small amount of indium. Graphical abstract Bimetallic Pd–In/Al2O3 catalysts are characterized by high activity in the reduction of nitrates and nitrites. However, systems containing the largest amount of indium (5%Pd–5%In/Al2O3) show poorer activity in the studied reactions. On the basis of our investigations, we can say that there are two effects which can influence activity of Pd–In/Al2O3 catalysts in the reduction of nitrates and nitrites: the formation of intermetallic phase and/or the increase in indium surface concentrations in those bimetallic systems. Keywords Pd–In catalysts Catalytic reduction of nitrates ToF-SIMS study of catalysts 1 Introduction Supported palladium catalysts have been widely used in chemical and petrochemical industry as well as in the environment protection. One of the general problems taking place during catalytical processes in industry is the inevitable deactivation of the catalysts. In order to minimalize the problem of deactivation of catalysts and improvement of their selectivity, the modification of catalysts was made through the introduction of various metallic promotors. Monometallic catalysts are more often replaced by multicomponents systems. Bimetallic palladium systems (Pd–M) are a large and important group of heterogenic catalysts which have been used in many reactions of reduction and oxidation. One of the examples of promoting Pd by an addition of a second metal deals with the Lindlar catalyst PdPb/CaCO3 for the selective hydrogenation of alkynes [1]. In those reactions high selectivity was also observed upon alloying Pd with Sn [2,3], Ag [4], Fe [5], Co [6] and Cu [7,8]. The bimetallic Pt–Pd system on acidic supports shows higher activity in hydrodearomatisation than the monometallic Pd and Pt catalysts [9]. The addition of Mo [10], Cu [11] or Cr [12] to Pd catalysts increases activity and selectivity to N2 in the reaction between NO and CO, which is important for three way catalysts used in cars. It was shown that the addition of Bi and Tl to Pd/SiO2 increased the selective hydrodechlorination of CCl2FCHF2 to CH2FCF2Cl and CH2FCHF2 [13]. The hydrogenation of nitrates to N2 in contaminated drinking water is promoted by the addition of Cu [14–16], Ag [17-19] and Sn [20,21] to Pd catalysts. The industrial catalyst for hydrogenation of nitrobenzene is a trimetallic catalyst PtPdFe/C [22]. A lot of interesting information about the effect of co-metals on the performance of Pd in bimetallic catalysts is presented in the paper of Coq and Figueras [23]. The catalytic properties of Pd are discussed in the frame of electronic and geometric effects. This review is restricted to Pd–M catalysts operating in a reductive atmosphere. In the past few years various bimetallic palladium based catalysts have been used in commercial oxidation processes. One of the well-known catalysts in the oxidative esterification reaction is Pd–Te catalyst [24]. Palladium catalysts promoted with bismuth and thallium are characterized by high selectivity in the reaction of oxidation of glucose to gluconic acid and lactose to lactobionic acid [25–28]. In recent years Pd–Pb catalysts have been used in the direct production of methyl methacrylate from methacrolein, methanol and oxygen [29]. A great interest has also been paid to the Pd–Bi systems for the direct production of benzylacetate [30]. The examples listed above prove a great theoretical as well as practical importance of Pd-based catalysts. Even though various promotors have been used for different reduction and oxidation reactions, their precise role is still not known. Most of the interpretations on the role of promotors are rather hypothetical. This is probably due to the lack of information about the exact surface structure. Supported Pd–In catalysts were not widely investigated in the chemical processes, but there is some information in literature about their activity and selectivity in the reduction of nitrates [31–34]. However, the reason for the promoting effect of indium in bimetallic Pd–In/support systems is still not explained. In this paper, we would like to present an influence of indium addition on the activity and selectivity of palladium catalysts in the reduction of nitrates to nitrogen in water. The catalysts were characterized by X-ray diffraction (XRD), Time-of-Flight Secondary Ion Mass Spectrometry (ToF-SIMS), temperature-programmed desorption of H2 (TPDH2) and temperature-programmed reduction (TPR). 2 Experimental 2.1 Catalyst preparation Bimetallic Pd–In/Al2O3catalysts containing 5wt.% Pd and 0.5, 1, 2 and 5wt.% In were obtained through coimpregnation of support (Al2O3, Fluka 506 C, 143m2/g) with water solution of In(NO3)3 (99.9%, Aldrich) and Pd(NO3)2 (the MLS-1200 Mega Microwave Digestion System (Milestone) was used for complete digestion of metallic Pd in HNO3 (POCh Gliwice)). The water was evaporated at an increased temperature under vacuum. The catalysts were dried in air at 110°C for 6h, calcined at 500°C for 4h in air atmosphere and then reduced in hydrogen atmosphere for 2h at 300°C, directly before the measurements. 2.2 Catalytic measurements 2.2.1 Reduction of nitrates and nitrites The hydrogenation of nitrate or nitrite solutions was performed in a thermostated glass reactor equipped with a stirrer, a hydrogen supply system, a burette and a pH electrode. The ammonia formed during the reduction was neutralized by the addition of aqueous solution of HCl (50mmol/dm3) to pH 5.5 in the reaction medium. The reaction was conducted at 20°C. The mixture was stirred at 300rpm, and hydrogen was bubbled through at 0.2dm3/min. No rise in temperature due to the heat of the reaction was observed in any of the runs since the reactor was operated with low concentration of nitrate (1.6mmol/dm3) or nitrite (2.1mmol/dm3). No pressure control was required as the total operating pressure in the system was equal to atmospheric pressure. Because three phases were present in the reactor, the system used is treated as a slurry reactor. Samples of the reaction medium were taken every 5, 10, 20, 30, 45 and 60min, filtered and analyzed using a liquid chromatograph LaChrom (Merck Hitachi) coupled with a variable wavelength UV detector LaChrom L-7400 (Merck Hitachi). The analytical wavelength was 210nm. In our investigation, Merck C18 LiChrospher RP-18 (5-μm) column (250mm×4.0mm i.d.) was used. The water solution of octyloamine phosphorate (5mmol/dm3, pH 6.3) was used as a mobile phase. The flow rate of octyloamine phosphorate was 1.0cm3/min. For the samples, concentrations of NH4 + ions were analyzed spectrophotometrically with the use of ammonia-test (2.6–193mg NH4 +/dm3, Merck). 2.2.2 Powder X-ray diffraction Powder X-ray diffraction patterns were obtained with a Simens D5000 diffractometer using Cu Kα radiation (λ =154.18pm). Crystalline phases were identified by references to the ASTM data files. 2.2.3 Temperature-programmed reduction and temperature programmed desorption of H2 ( TP D H 2 ) measurements TPR and TPD measurements were carried out in a flow apparatus described in Ref. [35]. The catalyst samples (0.1g), prior to the TPR measurements were calcined at 500°C for 2h in oxygen and then flushed with helium at the same temperature for 0.5h. After cooling to room temperature in helium atmosphere, temperature programmed reduction measurements were carried out. TPR runs were performed in the temperature range 25–500°C, using a mixture of hydrogen-argon (10vol.% of H2) and a linear temperature growth of 10°C/min. The flow rate of gases was 30cm3/min. For TP D H 2 measurements samples of catalysts weighing 0.5g were used. Before sorption measurements, samples of mono- and bimetallic catalysts were reduced with hydrogen at 300°C for about 1h and then flushed with argon at the same temperature and for the same amount of time. After cooling to room temperature and sorption of hydrogen (0.5h), TPD measurements were carried out. Argon was used as a carrier gas. The flow rate of gas was 40cm3/min. Catalyst samples were heated at the rate of 20°C/min. 2.2.4 Time of flight secondary mass spectrometry Secondary ions mass spectra and images were recorded with a ToF-SIMS IV mass spectrometer manufactured by ION-TOF GmbH, Muenster, Germany. The instrument is equipped with liquid metal 69Ga+ primary ion gun and a high mass resolution time of flight mass analyzer. Two different working modes of primary Ga+ gun were used during the measurements. A high current bunched mode characterized by high mass resolution was applied for spectra acquisition. Images were recorded in a burst alignment mode which provide high lateral resolution. Secondary ion mass spectra were recorded from an approximately 100μm×100μm area of the sample surface. During the measurement the analyzed area was irradiated with the pulses of 25keV ions at 10kHz repetition rate and average ion current 2.5pA. The analysis time was 50s giving an ion dose below static limit of 1×1013 ions/cm2. Secondary ions emitted from the bombarded surface are mass separated and counted in the time of flight (ToF) analyzer. For each catalyst mass spectra were recorded from at least three places at the sample surface. A low energy electron flood gun was used for charge compensation. Prior to the image acquisition secondary ion mass spectra of the sample surface were recorded and then appropriate ion peaks were chosen for the imaging. Images of the surface show emission intensities of the corresponding secondary ions from a selected number of surface points obtained by rastering the primary ion beam over the analyzed area. The catalyst samples for ToF-SIMS analysis were prepared by pressing pellets. 3 Results and discussion Catalytic results are expressed as conversion (X, %) and selectivity (S, %). Those parameters were defined as X ( % ) = [ 1 − ( C / C 0 ) ] × 100 S ( % ) = [ C A / ( C 0 − C ) ] × 100 where C 0 was a molar concentration of nitrates or nitrites at the beginning of the reduction process, C a molar concentration of nitrates or nitrites after time t, and C A was a molar concentration of products (nitrites or ammonia) after time t. The selectivity to N2 was defined as S N 2 ( % ) = 100 − S N O 2 − − S N H 4 + . Fig. 1 shows the conversion degree of nitrate and selectivities towards NO2 −, NH4 + and N2 for chosen monometallic systems containing 5%Pd/Al2O3 and 5%In/Al2O3 as well as for palladium catalysts supported on alumina and modified with indium. The presented picture shows that the conversion of palladium catalysts modified with indium is considerably higher than in the case of monometallic systems. It is noteworthy that activity was enhanced by the addition of only 0.5wt.% In (In/Pd=9.3at.%) and the maximum activity was observed at 2wt.% In (In/Pd=37.1at.%). However, the addition of greater amounts of indium (for 5wt.% In, the metal promoter proportion in bimetallic phase reached 92.7at.%) caused the decrease in activity of bimetallic Pd–In/Al2O3 systems in the reaction of nitrate reduction in water. The same phenomenon was observed for the supported palladium systems promoted with copper and silver [19,36,37]. Those publications showed that for both types of palladium-based catalysts the activity for nitrate reduction appears to go through a maximum for a promoter content between 33 and 50at.%, depending on the catalyst. The presented results obtained for the Pd–In/Al2O3 catalysts in the reduction of nitrates are in good agreement with the results proclaimed in literature. For the catalyst 5%Pd–5%In/Al2O3, which is characterized by the lowest activity, the highest concentrations of nitrites in the reaction mixture were observed. The relatively high concentration of NO2 − ions is noticed even at the end of the reaction (Fig. 1). It is worth emphasizing that we did not observe the formation of ammonia, which is a by-product of the reduction of nitrates. However, the NH4 + ions were detected in the reaction mixture for bimetallic catalysts containing smaller amounts of indium (0.5–2wt.%). Taking into consideration the formation of undesirable products (nitrites and ammonia) and high activity in the nitrate reduction, the system containing 5%Pd–2%In/Al2O3 seems to be an optimal catalyst for this process. This catalyst is characterized by a conversion degree (about 95%) after a relatively short time of reaction (20min) and good selectivity towards N2 (about 95%). The behaviour of bimetallic Pd–In/Al2O3 catalysts in the reduction of nitrites is quite similar to the one in the reduction of nitrates. In the case of this reaction, the catalyst 5%Pd-5%In/Al2O3 also shows the lowest conversion degree (Fig. 2 ). The different behaviour of bimetallic Pd–In/Al2O3 catalysts with a higher amount of indium (5wt.% In) in comparison with catalysts containing 0.5–2wt.% In could be connected with various surface structures of those catalysts. In order to investigate the surface structure of palladium catalysts promoted with indium the XRD study was used. In Fig. 3 the X-ray diffractograms related to the monometallic system (5%Pd/Al2O3) and to the bimetallic systems (5%Pd–0.5%In/Al2O3, 5%Pd–1%In/Al2O3, 5%Pd–2%In/Al2O3, 5%Pd–5%In/Al2O3) are reported. From the obtained diffractograms we can see the presence of metallic palladium phase in all supported bimetallic systems. On the other hand, the presence of metallic indium was not observed in Pd–In/Al2O3 catalysts. However, in the case of the diffractogram obtained for 5%Pd–5%In/Al2O3 catalyst, which is characterized by the lowest activity in nitrates reduction, the new maxima were observed. The positions of the new maxima indicated the appearance of a new intermetallic phase In0.52–Pd0.48 in this bimetallic system. According to the Scherrer equation, the metal particle size of monometallic and bimetallic catalysts was calculated (Table 1 ). The dispersion of the metallic phase was quite good. The metallic particle size in monometallic 5%Pd/Al2O3 catalyst was 6.6nm and after the introduction of In (0.5–5wt.%) it almost remains the same. Therefore, the unique changes in the conversion practically resulted from the strong metals interactions on the surface rather than from the changes in the metal particle size. To get a better understanding of the nature of the interactions between palladium and indium on the surface of alumina, the samples of chosen bimetallic catalysts were characterized by ToF-SIMS. This technique made it possible to observe the changes of catalyst surface which are invisible for XRD. Fig. 4 shows a secondary ion image of palladium catalyst supported on alumina and modified with indium after oxidation in air atmosphere for 4h at 500°C and reduction in hydrogen atmosphere for 2h at 300°C. The brightness of particular places in the images corresponds to the intensity of secondary ions emission. The obtained images of bimetallic catalysts show that increased concentrations of In and Pd were observed on the same areas, which demonstrated strong interactions between those metals on the surface of alumina. ToF-SIMS peak intensity ratios PdIn+/Pd+ (Table 2 ) were taken as the measure of surface concentration of PdIn phase. On the basis of the obtained results it was found that the participation of PdIn phase on the surface rises together with the increase in percentage content of indium in bimetallic catalysts (Fig. 5 ). The measured ToF-SIMS peak intensities of ions In+ and Pd+ emitted from the studied surfaces of bimetallic catalysts stay in good agreement with our expectations. Moreover, the ToF-SIMS study of 5%Pd–5%In/Al2O3 catalyst reveals the high surface concentration of indium in comparison with palladium, which could also be the reason for decrease in activity of this system in nitrates reduction. The increased surface concentration of indium can also be the reason for the observed high nitrites concentration in the reaction mixture (Fig. 1). The samples of bimetallic catalysts were also characterized by temperature programmed desorption of H2 and temperature programmed reduction. Fig. 6 shows the results of temperature-programmed desorption of hydrogen ( TP D H 2 ) for the monometallic system 5%Pd/Al2O3 and for bimetallic systems 5%Pd–0.5%In/Al2O3, 5%Pd–1%In/Al2O3 and 5%Pd–5%In/Al2O3 in the temperature range 25–500°C. A wide desorption peak can be observed for catalyst 5%Pd/Al2O3 at the temperature ranging from 25 to 315°C and the peak with the maximum rate of desorption at the temperature of about 450°C. The presence of these peaks in the thermogram indicates that several adsorption states exist, which is the result of occurrence of different adsorption centres with specific bond strength of hydrogen. The high temperature (about 450°C) of the maximum rate of hydrogen desorption indicates that strongly bound hydrogen exists on the surface of 5%Pd/Al2O3 catalyst. The hydrogen which is too strongly bound on the surface of palladium can be the reason for low activity of monometallic palladium catalyst in the reduction of nitrates (Fig. 1). The introduction of even a small amount of indium contributes to the decrease in the size of desorption peaks, which means that the amount of strongly sorbed hydrogen on Pd–In/Al2O3 systems decreases in comparison with monometallic systems, which can have an influence on the activity. Fig. 7 presents TPR spectra obtained for 5%Pd/Al2O3, 5%In/Al2O3 and for bimetallic systems 5%Pd–1%In/Al2O3, 5%Pd–2%In/Al2O3, 5%Pd–5%In/Al2O3 after calcination in O2 at 500°C for 2h. In the case of catalysts 5%Pd/Al2O3 and 5%Pd–1%In/Al2O3 instead of hydrogen adsorption peaks only desorption peaks were observed. It leads to a conclusion that the total reduction of all oxide forms took place at room temperature. Moreover, Pd has the ability to form hydride phases under normal conditions. The desorption peaks observed for 5%Pd/Al2O3 and for bimetallic systems with a small amount of indium in the TPR process at a temperature around 80°C probably correspond to β-PdH decomposition. An addition of greater amounts of indium (2–5wt.% In) results in the disappearance of the desorption peak suggesting that the β-PdH formation was inhibited. For those bimetallic catalysts the adsorption peaks connected probably with the reduction of mixed palladium–indium oxides were observed. The appearance of the reduction peak at the temperature about 150°C for the 5%Pd–2%In/Al2O3 and 5%Pd–5%In/Al2O3 catalysts might indicate the formation of a certain mixed oxide form strongly bonded with the support. The existence of this form could lead to the formation of intermetallic compounds in reduction atmosphere. For those systems the formation of In0.52Pd0.48 phase was indicated by XRD measurements and confirmed by ToF-SIMS study. 4 Conclusions Bimetallic 5%Pd–0.5%In/Al2O3, 5%Pd–1%In/Al2O3 and 5%Pd–2%In/Al2O3 catalysts are characterized by high activity in the reduction of nitrates and nitrites. System containing a higher amount of indium (5%Pd–5%In/Al2O3) show poorer activity in the studied reactions. The ToF-SIMS measurements showed the presence of intermetallic compounds in all studied bimetallic catalysts. This technique is a very sensitive method for the examination of the surface structure. On the basis of the ToF-SIMS results an increase in the surface concentration of intermetallic compounds with an increase in indium content in bimetallic systems were observed. As a measure of the concentration of those compounds, the ratio of PdIn+ ion emission intensity to Pd+ was assumed. For the catalyst with composition 5%Pd–5%In/Al2O3, the intermetallic phase In0.52–Pd0.48 was also detected by XRD. This method enables the detection of only relatively high concentrations of intermetallic compounds in the bimetallic catalysts. Because of this, the lowest activity of 5%Pd–5%In/Al2O3 in the reduction of nitrates and nitrites may be connected with an appropriately large amount of this compound on the surface. On the other hand, the ToF-SIMS study reveals the increased concentration of indium in comparison with palladium on the surface of bimetallic systems. This fact could also have an influence on the observed changes in activities. Summing up, on the basis of our investigations we can say that there are two effects which can influence activity of Pd–In/Al2O3 catalysts in the reduction of nitrates and nitrites: the formation of intermetallic phase and/or the increase in indium surface concentrations in those bimetallic systems. References [1] H. Lindlar Helv. Chem. Acta 35 1952 446 [2] H.R. Aduriz P. Bondariuk B. Coq F. Figueras J. Catal. 129 1991 47 [3] S.H. Choi J.S. Lee J. Catal. 193 2000 176 [4] E.A. Sales M.J. Mendes F. Bozon-Verduraz J. Catal. 195 2000 96 [5] R. Bachir P. Marécot B. Didillon J. Barbier Appl. Catal. A 164 1997 313 [6] F.B. Noronha M. Schlam R. Fréty G. Bergeret B. Moraweck J. Catal. 186 1999 20 [7] L. Guczi Z. Schay Gy. Stefler L.F. Liotta G. Deganello A.M. Venezia J. Catal. 182 1999 456 [8] L.V. Nosova V.I. Zaikovskii Yu.A. Rondin React. Kinet. Catal. Lett. 53 1994 131 [9] T. Fujikawa K. Tsuji H. Mizuguchi H. Godo K. Idei K. Usui Catal. Lett. 63 1999 27 [10] M. Schlam M.A.S. Baldanza M.A. Vannice J. Catal. 185 1999 138 [11] M. Fernández-Garcia M. Martinem-Arias C. Belver J.A. Anderson J.C. Conesa J. Soria J. Catal. 190 2000 378 [12] A. El Hamdaoui G. Bergeret J. Massardier M. Primet A. Renouprez J. Catal. 148 1994 47 [13] R. Ohnishi W.L. Wang M. Ichikawa Appl. Catal. A 113 1994 29 [14] J. Batista A. Pintar M. Ceh Catal. Lett. 43 1997 79 [15] F. Deganello L.F. Liotta A. Macaluso A.M. Venezia G. Deganello Appl. Catal. B 24 2000 256 [16] A.C.A. De Vooys R.A. Van Santen J.A.R. van Seen J. Mol. Catal. A 154 2000 203 [17] S. Karski Chem. Environ. Res. 15 1/2 2006 123 [18] I. Witońska S. Karski J. Gołuchowska React. Kinet. Catal. Lett. 90 1 2007 107 [19] F. Gauthard F. Epron J. Barbier J. Catal. 220 2003 182 [20] A. Garron K. Lázár F. Epron Appl. Catal. B 59 2005 57 [21] A. Garron F. Epron Water Res. 39 2005 3073 [22] A.M. Strätz J.R. Kosak Catalysis of Organic Reactions 1984 Marcel Dekker New York 335 [23] B. Coq F. Figuueras J. Mol. Catal. A 173 2001 117 [24] Mitsubishi Chemical Industries, US Patent 3,922,300 (1975). [25] S. Karski I. Witońska J. Mol. Catal. A 191 2003 87 [26] S. Karski I. Witońska Kinet. Catal. 45 2 2004 256 [27] S. Karski I. Witońska J. Mol. Catal. A 245 2006 225 [28] S. Karski J. Mol. Catal. A 253 2006 147 [29] S. Yamamatsu Shokubai 43 7 2001 549 [30] T. Miyake A. Hattori M. Hanaya S. Tokumaru H. Hamaji T. Okada Top. Catal. 13 2000 243 [31] L. Lemaingnen C. Tong V. Begon R. Burch D. Chadwick Catal. Today 75 2002 43 [32] S. Ambonguilat H. Gallard A. Garron F. Epron J.P. Croué Water Res. 40 2006 675 [33] U. Prüsse M. Hähnlein J. Daum K.D. Vorlop Catal. Today 55 2000 79 [34] U. Prüsse K.D. Vorlop J. Mol. Catal. A 173 2001 313 [35] T. Paryjczak J. Rynkowski S. Karski J. Chromatogr. 188 1980 254 [36] S. Hörold T. Tacke K.D. Vorlop Environ. Technol. 14 1993 931 [37] F. Epron F. Gauthard C. Pinèda J. Barbier J. Catal. 198 2001 309",
      "scopus-id": "43549090145",
      "coredata": {
        "eid": "1-s2.0-S1381116908000800",
        "dc:description": "The influence of indium addition on the catalytic properties of palladium catalysts supported on Al2O3 in the reaction of nitrates reduction to nitrogen was studied. It was found that indium did not show any activity by itself, but acted as a “promoter” for the catalytic activity of monometallic Pd/Al2O3 catalysts. The X-ray diffraction (XRD) and Time-of-flight secondary ion mass spectrometry (ToF-SIMS) studies proved the existence of intermetallic interactions between Pd and In, which probably modified activity and selectivity of bimetallic catalysts in this reaction. The ToF-SIMS technique showed the presence of intermetallic compounds in all the studied bimetallic systems, which could not be proved by XRD measurements in the case of the systems with a small amount of indium.",
        "openArchiveArticle": "false",
        "prism:coverDate": "2008-05-15",
        "openaccessUserLicense": null,
        "prism:aggregationType": "Journal",
        "prism:url": "https://api.elsevier.com/content/article/pii/S1381116908000800",
        "dc:creator": [
          {
            "@_fa": "true",
            "$": "Witońska, I."
          },
          {
            "@_fa": "true",
            "$": "Karski, S."
          },
          {
            "@_fa": "true",
            "$": "Rogowski, J."
          },
          {
            "@_fa": "true",
            "$": "Krawczyk, N."
          }
        ],
        "link": [
          {
            "@_fa": "true",
            "@rel": "self",
            "@href": "https://api.elsevier.com/content/article/pii/S1381116908000800"
          },
          {
            "@_fa": "true",
            "@rel": "scidir",
            "@href": "https://www.sciencedirect.com/science/article/pii/S1381116908000800"
          }
        ],
        "dc:format": "application/json",
        "openaccessType": null,
        "pii": "S1381-1169(08)00080-0",
        "prism:volume": "287",
        "prism:publisher": "Elsevier B.V.",
        "dc:title": "The influence of interaction between palladium and indium on the activity of Pd–In/Al2O3 catalysts in reduction of nitrates and nitrites",
        "prism:copyright": "Copyright © 2008 Elsevier B.V. All rights reserved.",
        "openaccess": "0",
        "prism:issn": "13811169",
        "prism:issueIdentifier": "1-2",
        "dcterms:subject": [
          {
            "@_fa": "true",
            "$": "Pd–In catalysts"
          },
          {
            "@_fa": "true",
            "$": "Catalytic reduction of nitrates"
          },
          {
            "@_fa": "true",
            "$": "ToF-SIMS study of catalysts"
          }
        ],
        "openaccessArticle": "false",
        "prism:publicationName": "Journal of Molecular Catalysis A: Chemical",
        "prism:number": "1-2",
        "openaccessSponsorType": null,
        "prism:pageRange": "87-94",
        "prism:endingPage": "94",
        "pubType": "fla",
        "prism:coverDisplayDate": "15 May 2008",
        "prism:doi": "10.1016/j.molcata.2008.01.044",
        "prism:startingPage": "87",
        "dc:identifier": "doi:10.1016/j.molcata.2008.01.044",
        "openaccessSponsorName": null
      },
      "objects": {
        "object": [
          {
            "@category": "thumbnail",
            "@height": "16",
            "@width": "58",
            "@_fa": "true",
            "$": "https://api.elsevier.com/content/object/eid/1-s2.0-S1381116908000800-si8.gif?httpAccept=%2A%2F%2A",
            "@multimediatype": "GIF image file",
            "@type": "ALTIMG",
            "@size": "328",
            "@ref": "si8",
            "@mimetype": "image/gif"
          },
          {
            "@category": "thumbnail",
            "@height": "21",
            "@width": "223",
            "@_fa": "true",
            "$": "https://api.elsevier.com/content/object/eid/1-s2.0-S1381116908000800-si7.gif?httpAccept=%2A%2F%2A",
            "@multimediatype": "GIF image file",
            "@type": "ALTIMG",
            "@size": "681",
            "@ref": "si7",
            "@mimetype": "image/gif"
          },
          {
            "@category": "thumbnail",
            "@height": "40",
            "@width": "208",
            "@_fa": "true",
            "$": "https://api.elsevier.com/content/object/eid/1-s2.0-S1381116908000800-si6.gif?httpAccept=%2A%2F%2A",
            "@multimediatype": "GIF image file",
            "@type": "ALTIMG",
            "@size": "1415",
            "@ref": "si6",
            "@mimetype": "image/gif"
          },
          {
            "@category": "thumbnail",
            "@height": "15",
            "@width": "46",
            "@_fa": "true",
            "$": "https://api.elsevier.com/content/object/eid/1-s2.0-S1381116908000800-si5.gif?httpAccept=%2A%2F%2A",
            "@multimediatype": "GIF image file",
            "@type": "ALTIMG",
            "@size": "241",
            "@ref": "si5",
            "@mimetype": "image/gif"
          },
          {
            "@category": "thumbnail",
            "@height": "16",
            "@width": "58",
            "@_fa": "true",
            "$": "https://api.elsevier.com/content/object/eid/1-s2.0-S1381116908000800-si4.gif?httpAccept=%2A%2F%2A",
            "@multimediatype": "GIF image file",
            "@type": "ALTIMG",
            "@size": "328",
            "@ref": "si4",
            "@mimetype": "image/gif"
          },
          {
            "@category": "thumbnail",
            "@height": "20",
            "@width": "36",
            "@_fa": "true",
            "$": "https://api.elsevier.com/content/object/eid/1-s2.0-S1381116908000800-si3.gif?httpAccept=%2A%2F%2A",
            "@multimediatype": "GIF image file",
            "@type": "ALTIMG",
            "@size": "257",
            "@ref": "si3",
            "@mimetype": "image/gif"
          },
          {
            "@category": "thumbnail",
            "@height": "30",
            "@width": "51",
            "@_fa": "true",
            "$": "https://api.elsevier.com/content/object/eid/1-s2.0-S1381116908000800-si2.gif?httpAccept=%2A%2F%2A",
            "@multimediatype": "GIF image file",
            "@type": "ALTIMG",
            "@size": "364",
            "@ref": "si2",
            "@mimetype": "image/gif"
          },
          {
            "@category": "thumbnail",
            "@height": "30",
            "@width": "51",
            "@_fa": "true",
            "$": "https://api.elsevier.com/content/object/eid/1-s2.0-S1381116908000800-si1.gif?httpAccept=%2A%2F%2A",
            "@multimediatype": "GIF image file",
            "@type": "ALTIMG",
            "@size": "352",
            "@ref": "si1",
            "@mimetype": "image/gif"
          },
          {
            "@category": "standard",
            "@height": "684",
            "@width": "357",
            "@_fa": "true",
            "$": "https://api.elsevier.com/content/object/eid/1-s2.0-S1381116908000800-gr1.jpg?httpAccept=%2A%2F%2A",
            "@multimediatype": "JPEG image file",
            "@type": "IMAGE-DOWNSAMPLED",
            "@size": "44391",
            "@ref": "gr1",
            "@mimetype": "image/jpeg"
          },
          {
            "@category": "thumbnail",
            "@height": "92",
            "@width": "48",
            "@_fa": "true",
            "$": "https://api.elsevier.com/content/object/eid/1-s2.0-S1381116908000800-gr1.sml?httpAccept=%2A%2F%2A",
            "@multimediatype": "GIF image file",
            "@type": "IMAGE-THUMBNAIL",
            "@size": "1009",
            "@ref": "gr1",
            "@mimetype": "image/gif"
          },
          {
            "@category": "standard",
            "@height": "212",
            "@width": "373",
            "@_fa": "true",
            "$": "https://api.elsevier.com/content/object/eid/1-s2.0-S1381116908000800-gr2.jpg?httpAccept=%2A%2F%2A",
            "@multimediatype": "JPEG image file",
            "@type": "IMAGE-DOWNSAMPLED",
            "@size": "14965",
            "@ref": "gr2",
            "@mimetype": "image/jpeg"
          },
          {
            "@category": "thumbnail",
            "@height": "71",
            "@width": "125",
            "@_fa": "true",
            "$": "https://api.elsevier.com/content/object/eid/1-s2.0-S1381116908000800-gr2.sml?httpAccept=%2A%2F%2A",
            "@multimediatype": "GIF image file",
            "@type": "IMAGE-THUMBNAIL",
            "@size": "1364",
            "@ref": "gr2",
            "@mimetype": "image/gif"
          },
          {
            "@category": "standard",
            "@height": "596",
            "@width": "369",
            "@_fa": "true",
            "$": "https://api.elsevier.com/content/object/eid/1-s2.0-S1381116908000800-gr3.jpg?httpAccept=%2A%2F%2A",
            "@multimediatype": "JPEG image file",
            "@type": "IMAGE-DOWNSAMPLED",
            "@size": "49730",
            "@ref": "gr3",
            "@mimetype": "image/jpeg"
          },
          {
            "@category": "thumbnail",
            "@height": "94",
            "@width": "58",
            "@_fa": "true",
            "$": "https://api.elsevier.com/content/object/eid/1-s2.0-S1381116908000800-gr3.sml?httpAccept=%2A%2F%2A",
            "@multimediatype": "GIF image file",
            "@type": "IMAGE-THUMBNAIL",
            "@size": "1519",
            "@ref": "gr3",
            "@mimetype": "image/gif"
          },
          {
            "@category": "standard",
            "@height": "460",
            "@width": "539",
            "@_fa": "true",
            "$": "https://api.elsevier.com/content/object/eid/1-s2.0-S1381116908000800-gr4.jpg?httpAccept=%2A%2F%2A",
            "@multimediatype": "JPEG image file",
            "@type": "IMAGE-DOWNSAMPLED",
            "@size": "125529",
            "@ref": "gr4",
            "@mimetype": "image/jpeg"
          },
          {
            "@category": "thumbnail",
            "@height": "93",
            "@width": "109",
            "@_fa": "true",
            "$": "https://api.elsevier.com/content/object/eid/1-s2.0-S1381116908000800-gr4.sml?httpAccept=%2A%2F%2A",
            "@multimediatype": "GIF image file",
            "@type": "IMAGE-THUMBNAIL",
            "@size": "4313",
            "@ref": "gr4",
            "@mimetype": "image/gif"
          },
          {
            "@category": "standard",
            "@height": "943",
            "@width": "602",
            "@_fa": "true",
            "$": "https://api.elsevier.com/content/object/eid/1-s2.0-S1381116908000800-gr5.jpg?httpAccept=%2A%2F%2A",
            "@multimediatype": "JPEG image file",
            "@type": "IMAGE-DOWNSAMPLED",
            "@size": "75321",
            "@ref": "gr5",
            "@mimetype": "image/jpeg"
          },
          {
            "@category": "thumbnail",
            "@height": "92",
            "@width": "59",
            "@_fa": "true",
            "$": "https://api.elsevier.com/content/object/eid/1-s2.0-S1381116908000800-gr5.sml?httpAccept=%2A%2F%2A",
            "@multimediatype": "GIF image file",
            "@type": "IMAGE-THUMBNAIL",
            "@size": "1007",
            "@ref": "gr5",
            "@mimetype": "image/gif"
          },
          {
            "@category": "standard",
            "@height": "508",
            "@width": "334",
            "@_fa": "true",
            "$": "https://api.elsevier.com/content/object/eid/1-s2.0-S1381116908000800-gr6.jpg?httpAccept=%2A%2F%2A",
            "@multimediatype": "JPEG image file",
            "@type": "IMAGE-DOWNSAMPLED",
            "@size": "25155",
            "@ref": "gr6",
            "@mimetype": "image/jpeg"
          },
          {
            "@category": "thumbnail",
            "@height": "93",
            "@width": "61",
            "@_fa": "true",
            "$": "https://api.elsevier.com/content/object/eid/1-s2.0-S1381116908000800-gr6.sml?httpAccept=%2A%2F%2A",
            "@multimediatype": "GIF image file",
            "@type": "IMAGE-THUMBNAIL",
            "@size": "812",
            "@ref": "gr6",
            "@mimetype": "image/gif"
          },
          {
            "@category": "standard",
            "@height": "339",
            "@width": "334",
            "@_fa": "true",
            "$": "https://api.elsevier.com/content/object/eid/1-s2.0-S1381116908000800-gr7.jpg?httpAccept=%2A%2F%2A",
            "@multimediatype": "JPEG image file",
            "@type": "IMAGE-DOWNSAMPLED",
            "@size": "25402",
            "@ref": "gr7",
            "@mimetype": "image/jpeg"
          },
          {
            "@category": "thumbnail",
            "@height": "93",
            "@width": "92",
            "@_fa": "true",
            "$": "https://api.elsevier.com/content/object/eid/1-s2.0-S1381116908000800-gr7.sml?httpAccept=%2A%2F%2A",
            "@multimediatype": "GIF image file",
            "@type": "IMAGE-THUMBNAIL",
            "@size": "1163",
            "@ref": "gr7",
            "@mimetype": "image/gif"
          },
          {
            "@category": "standard",
            "@height": "153",
            "@width": "429",
            "@_fa": "true",
            "$": "https://api.elsevier.com/content/object/eid/1-s2.0-S1381116908000800-fx1.jpg?httpAccept=%2A%2F%2A",
            "@multimediatype": "JPEG image file",
            "@type": "IMAGE-DOWNSAMPLED",
            "@size": "53580",
            "@ref": "fx1",
            "@mimetype": "image/jpeg"
          },
          {
            "@category": "thumbnail",
            "@height": "45",
            "@width": "125",
            "@_fa": "true",
            "$": "https://api.elsevier.com/content/object/eid/1-s2.0-S1381116908000800-fx1.sml?httpAccept=%2A%2F%2A",
            "@multimediatype": "GIF image file",
            "@type": "IMAGE-THUMBNAIL",
            "@size": "3817",
            "@ref": "fx1",
            "@mimetype": "image/gif"
          },
          {
            "@category": "standard",
            "@height": "10",
            "@width": "9",
            "@_fa": "true",
            "$": "https://api.elsevier.com/content/object/eid/1-s2.0-S1381116908000800-fx2.gif?httpAccept=%2A%2F%2A",
            "@multimediatype": "GIF image file",
            "@type": "IMAGE-DOWNSAMPLED",
            "@size": "112",
            "@ref": "fx2",
            "@mimetype": "image/gif"
          },
          {
            "@category": "thumbnail",
            "@height": "94",
            "@width": "85",
            "@_fa": "true",
            "$": "https://api.elsevier.com/content/object/eid/1-s2.0-S1381116908000800-fx2.sml?httpAccept=%2A%2F%2A",
            "@multimediatype": "GIF image file",
            "@type": "IMAGE-THUMBNAIL",
            "@size": "491",
            "@ref": "fx2",
            "@mimetype": "image/gif"
          }
        ]
      },
      "link": {
        "@rel": "abstract",
        "@href": "https://api.elsevier.com/content/abstract/scopus_id/43549090145"
      }
    }
  }
}