{
  "metadata": {
    "title": "A combined theoretical and experimental study of the effects of residual chlorine on the behavior of Pd/γ-Al<ce:inf loc=post>2</ce:inf>O<ce:inf loc=post>3</ce:inf> catalysts for methane oxidation",
    "authors": "; ; ",
    "journal": "Journal of Molecular Catalysis A: Chemical",
    "date": "2001-06-12",
    "doi": "10.1016/S1381-1169(01)00078-4",
    "abstract": "",
    "uri": "https://api.elsevier.com/content/article/pii/S1381116901000784",
    "pii": "S1381116901000784"
  },
  "fulltext": {
    "full-text-retrieval-response": {
      "scopus-eid": "2-s2.0-0035849445",
      "originalText": "serial JL 271358 291210 291744 291790 291809 31 Journal of Molecular Catalysis A: Chemical JOURNALMOLECULARCATALYSISACHEMICAL 2001-05-31 2001-05-31 2010-04-18T18:49:19 1-s2.0-S1381116901000784 S1381-1169(01)00078-4 S1381116901000784 10.1016/S1381-1169(01)00078-4 S300 S300.1 FULL-TEXT 1-s2.0-S1381116900X01379 2015-05-15T05:55:31.049811-04:00 0 0 20010612 2001 2001-05-31T00:00:00Z articleinfo crossmark dco dateupdated tomb dateloaded datesearch indexeddate issuelist volumelist yearnav articletitlenorm authfirstinitialnorm authfirstsurnamenorm cid cids contenttype copyright dateloadedtxt docsubtype doctype doi eid ewtransactionid hubeid issfirst issn issnnorm itemstage itemtransactionid itemweight openaccess openarchive pg pgfirst pglast pii piinorm pubdatestart pubdatetxt pubyr sortorder srctitle srctitlenorm srctype subheadings volfirst volissue webpdf webpdfpagecount figure table body acknowledge affil articletitle auth authfirstini authfull authkeywords authlast primabst ref alllist content subj ssids 1381-1169 13811169 171 171 1 2 1 2 Volume 171, Issues 1–2 14 123 141 123 141 20010612 12 June 2001 2001-06-12 2001 converted-article fla Copyright © 2001 Elsevier Science B.V. All rights reserved. ACOMBINEDTHEORETICALEXPERIMENTALSTUDYEFFECTSRESIDUALCHLORINEBEHAVIORPDAL2O3CATALYSTSFORMETHANEOXIDATION TONETTO G 1 Introduction 2 Experimental 2.1 Catalysts preparation 2.2 H2 chemisorption 2.3 TPR experiments 2.4 Catalytic activity measurements 2.5 IR studies 3 Theoretical model 4 Modeling of surface palladium structures 4.1 The surface of Pd (2 0 0) 4.2 The surface of Pd (2 0 0) partially oxidized 4.3 The surface of PdO (0 0 1) 4.4 The surface of Pd (2 0 0) partially oxidized containing chlorine 4.5 The surface of PdO (0 0 1) containing chlorine 4.6 Oxygen adsorption and dissociation 4.7 Methane adsorption and dissociation 4.8 Chlorine loss 4.9 Water adsorption 4.10 Carbon dioxide adsorption 4.11 Steps of products desorption — reactive adsorption/dissociation 5 Results and discussion 5.1 Catalysts preparation 5.2 H2 chemisorption 5.3 TPR experiments 5.4 Catalytic activity measurements 5.5 IR studies 5.6 Theoretical calculations 5.6.1 Oxygen adsorption and dissociation 5.6.2 Methane adsorption and dissociation 5.6.3 Chlorine loss 5.6.4 Water adsorption 5.6.5 Carbon dioxide adsorption 5.6.6 Steps of product desorption — reactive adsorption–dissociation on two possible reaction mechanisms 6 Discussion and conclusions Acknowledgements References HICKS 1990 295 R KONOPNY 1998 115 L SIMONE 1991 87 D SHEN 1989 47 Y MARECOT 1994 283 P CANT 1998 93 N CULLIS 1984 187 C LIESKE 1983 8 H BARBIER 1991 327 J MARCEAU 1996 415 E PERI 1995 410 S ROBERTSON 1975 424 S DAMIANI 1986 162 D HOFFMANN 1963 1397 R SUMERVILLE 1976 23 R HAY 1975 4884 P CHAMBER 1989 5366 I ANDERSON 1974 4271 A LOTZ 1970 206 W VELA 1985 5366 A CHAMBER 1989 5366 I FERREIRA 1997 25 M FERREIRA 1998 357 M HICKS 1990 280 R BRIOT 1991 301 P GARBOWSKY 1994 277 E RIBEIRO 1994 277 F CULLIS 1983 267 C WARD 1993 7691 T AU 1999 12 C LEVAN 1976 253 M KLISSRSKI 1974 149 D UENO 1977 225 A LESAGEROSENBERG 1986 21 E LOMOT 1997 977 D LOMOT 1997 2015 D PECCHI 1998 309 G BOND 1986 379 G JUAN 1992 77 A GOETZ 1995 86 J HOOST 1992 39 T KOOPMAN 1981 172 P NORONHA 1999 270 F RAKAI 1992 86 A GEREI 1973 341 S NYBERG 1983 163 C HERAS 1988 281 J STUVE 1984 179 E NYBERG 1984 3463 C GEREI 1973 341 S HERTI 1973 352 W ROSYNEK 1977 417 M KONIG 1994 329 D MOUADDIB 1992 129 N CULLIS 1983 267 C YAZAWA 1999 15 Y MUTO 1996 203 K LYUBOVSKY 1998 107 M HAACK 1995 31 L MULLER 1999 245 C OH 1991 287 S CARSTENS 1998 136 J CULLIS 1972 1406 C RIBEIRO 1994 537 F BURCH 1996 243 R TONETTOX2001X123 TONETTOX2001X123X141 TONETTOX2001X123XG TONETTOX2001X123X141XG item S1381-1169(01)00078-4 S1381116901000784 1-s2.0-S1381116901000784 10.1016/S1381-1169(01)00078-4 271358 2010-10-03T05:03:39.343576-04:00 2001-06-12 1-s2.0-S1381116901000784-main.pdf https://s3.amazonaws.com/prod-ucs-content-store-us-east/content/pii:S1381116901000784/MAIN/application/pdf/80b4fd255d07f69b1197031b9eab95a9/main.pdf https://s3-eu-west-1.amazonaws.com/prod-ucs-content-store-eu-west/content/pii:S1381116901000784/MAIN/application/pdf/80b4fd255d07f69b1197031b9eab95a9/main.pdf main.pdf pdf true 430699 MAIN 19 1-s2.0-S1381116901000784-main_1.png https://s3.amazonaws.com/prod-ucs-content-store-us-east/content/pii:S1381116901000784/PREVIEW/image/png/af809d93782c9b1b73648b148509094e/main_1.png https://s3-eu-west-1.amazonaws.com/prod-ucs-content-store-eu-west/content/pii:S1381116901000784/PREVIEW/image/png/af809d93782c9b1b73648b148509094e/main_1.png main_1.png png 54149 849 656 IMAGE-WEB-PDF 1 1-s2.0-S1381116901000784-si4.gif https://s3.amazonaws.com/prod-ucs-content-store-us-east/content/pii:S1381116901000784/STRIPIN/image/gif/7f214643044bc0f6c89213cf3c8fc6d4/si4.gif https://s3-eu-west-1.amazonaws.com/prod-ucs-content-store-eu-west/content/pii:S1381116901000784/STRIPIN/image/gif/7f214643044bc0f6c89213cf3c8fc6d4/si4.gif si4 si4.gif gif 1239 46 228 ALTIMG 1-s2.0-S1381116901000784-si3.gif https://s3.amazonaws.com/prod-ucs-content-store-us-east/content/pii:S1381116901000784/STRIPIN/image/gif/f3c4a6ac9bcbe994c139cb7b48810138/si3.gif https://s3-eu-west-1.amazonaws.com/prod-ucs-content-store-eu-west/content/pii:S1381116901000784/STRIPIN/image/gif/f3c4a6ac9bcbe994c139cb7b48810138/si3.gif si3 si3.gif gif 260 12 54 ALTIMG 1-s2.0-S1381116901000784-si2.gif https://s3.amazonaws.com/prod-ucs-content-store-us-east/content/pii:S1381116901000784/STRIPIN/image/gif/087f9614e368f0f63ea1542f3b1348c6/si2.gif https://s3-eu-west-1.amazonaws.com/prod-ucs-content-store-eu-west/content/pii:S1381116901000784/STRIPIN/image/gif/087f9614e368f0f63ea1542f3b1348c6/si2.gif si2 si2.gif gif 252 12 53 ALTIMG 1-s2.0-S1381116901000784-si1.gif https://s3.amazonaws.com/prod-ucs-content-store-us-east/content/pii:S1381116901000784/STRIPIN/image/gif/f3c4a6ac9bcbe994c139cb7b48810138/si3.gif https://s3-eu-west-1.amazonaws.com/prod-ucs-content-store-eu-west/content/pii:S1381116901000784/STRIPIN/image/gif/f3c4a6ac9bcbe994c139cb7b48810138/si3.gif si1 si1.gif gif 260 12 54 ALTIMG 1-s2.0-S1381116901000784-gr1.sml https://s3.amazonaws.com/prod-ucs-content-store-us-east/content/pii:S1381116901000784/gr1/THUMBNAIL/image/gif/3db13698277dc60116d60d0b54ea8f6e/gr1.sml https://s3-eu-west-1.amazonaws.com/prod-ucs-content-store-eu-west/content/pii:S1381116901000784/gr1/THUMBNAIL/image/gif/3db13698277dc60116d60d0b54ea8f6e/gr1.sml gr1 gr1.sml sml 2040 65 125 IMAGE-THUMBNAIL 1-s2.0-S1381116901000784-gr1.jpg https://s3.amazonaws.com/prod-ucs-content-store-us-east/content/pii:S1381116901000784/gr1/DOWNSAMPLED/image/jpeg/4a20b9ce72917ebe03fb606817fdf5a6/gr1.jpg https://s3-eu-west-1.amazonaws.com/prod-ucs-content-store-eu-west/content/pii:S1381116901000784/gr1/DOWNSAMPLED/image/jpeg/4a20b9ce72917ebe03fb606817fdf5a6/gr1.jpg gr1 gr1.jpg jpg 34244 215 415 IMAGE-DOWNSAMPLED 1-s2.0-S1381116901000784-gr2.sml https://s3.amazonaws.com/prod-ucs-content-store-us-east/content/pii:S1381116901000784/gr2/THUMBNAIL/image/gif/d4a98840f1f2e71b18f8a60417d5bc4a/gr2.sml https://s3-eu-west-1.amazonaws.com/prod-ucs-content-store-eu-west/content/pii:S1381116901000784/gr2/THUMBNAIL/image/gif/d4a98840f1f2e71b18f8a60417d5bc4a/gr2.sml gr2 gr2.sml sml 1908 71 125 IMAGE-THUMBNAIL 1-s2.0-S1381116901000784-gr2.jpg https://s3.amazonaws.com/prod-ucs-content-store-us-east/content/pii:S1381116901000784/gr2/DOWNSAMPLED/image/jpeg/9c2d6b529399a3a0c4ed222ed1d77e6c/gr2.jpg https://s3-eu-west-1.amazonaws.com/prod-ucs-content-store-eu-west/content/pii:S1381116901000784/gr2/DOWNSAMPLED/image/jpeg/9c2d6b529399a3a0c4ed222ed1d77e6c/gr2.jpg gr2 gr2.jpg jpg 28539 238 417 IMAGE-DOWNSAMPLED 1-s2.0-S1381116901000784-gr3.sml https://s3.amazonaws.com/prod-ucs-content-store-us-east/content/pii:S1381116901000784/gr3/THUMBNAIL/image/gif/e4102024670a2ed4fafbb415a9fd7bfa/gr3.sml https://s3-eu-west-1.amazonaws.com/prod-ucs-content-store-eu-west/content/pii:S1381116901000784/gr3/THUMBNAIL/image/gif/e4102024670a2ed4fafbb415a9fd7bfa/gr3.sml gr3 gr3.sml sml 1981 71 125 IMAGE-THUMBNAIL 1-s2.0-S1381116901000784-gr3.jpg https://s3.amazonaws.com/prod-ucs-content-store-us-east/content/pii:S1381116901000784/gr3/DOWNSAMPLED/image/jpeg/9059dbcba5442794d21905cea89c5f6e/gr3.jpg https://s3-eu-west-1.amazonaws.com/prod-ucs-content-store-eu-west/content/pii:S1381116901000784/gr3/DOWNSAMPLED/image/jpeg/9059dbcba5442794d21905cea89c5f6e/gr3.jpg gr3 gr3.jpg jpg 27957 238 418 IMAGE-DOWNSAMPLED 1-s2.0-S1381116901000784-gr4.sml https://s3.amazonaws.com/prod-ucs-content-store-us-east/content/pii:S1381116901000784/gr4/THUMBNAIL/image/gif/fd0d085f547827871d13093a5fdbca5d/gr4.sml https://s3-eu-west-1.amazonaws.com/prod-ucs-content-store-eu-west/content/pii:S1381116901000784/gr4/THUMBNAIL/image/gif/fd0d085f547827871d13093a5fdbca5d/gr4.sml gr4 gr4.sml sml 1974 65 125 IMAGE-THUMBNAIL 1-s2.0-S1381116901000784-gr4.jpg https://s3.amazonaws.com/prod-ucs-content-store-us-east/content/pii:S1381116901000784/gr4/DOWNSAMPLED/image/jpeg/797fbb13e3d8ffa520d9d5dfbccb293b/gr4.jpg https://s3-eu-west-1.amazonaws.com/prod-ucs-content-store-eu-west/content/pii:S1381116901000784/gr4/DOWNSAMPLED/image/jpeg/797fbb13e3d8ffa520d9d5dfbccb293b/gr4.jpg gr4 gr4.jpg jpg 29645 216 416 IMAGE-DOWNSAMPLED 1-s2.0-S1381116901000784-gr5.sml https://s3.amazonaws.com/prod-ucs-content-store-us-east/content/pii:S1381116901000784/gr5/THUMBNAIL/image/gif/c69c780c3240451ea343afa5bf99e41f/gr5.sml https://s3-eu-west-1.amazonaws.com/prod-ucs-content-store-eu-west/content/pii:S1381116901000784/gr5/THUMBNAIL/image/gif/c69c780c3240451ea343afa5bf99e41f/gr5.sml gr5 gr5.sml sml 2056 71 125 IMAGE-THUMBNAIL 1-s2.0-S1381116901000784-gr5.jpg https://s3.amazonaws.com/prod-ucs-content-store-us-east/content/pii:S1381116901000784/gr5/DOWNSAMPLED/image/jpeg/55b429134f205a5d5cecff47452f68cc/gr5.jpg https://s3-eu-west-1.amazonaws.com/prod-ucs-content-store-eu-west/content/pii:S1381116901000784/gr5/DOWNSAMPLED/image/jpeg/55b429134f205a5d5cecff47452f68cc/gr5.jpg gr5 gr5.jpg jpg 28326 238 418 IMAGE-DOWNSAMPLED 1-s2.0-S1381116901000784-sc1.sml https://s3.amazonaws.com/prod-ucs-content-store-us-east/content/pii:S1381116901000784/sc1/THUMBNAIL/image/gif/15a5c815a9132b23a0eb85374ecfefeb/sc1.sml https://s3-eu-west-1.amazonaws.com/prod-ucs-content-store-eu-west/content/pii:S1381116901000784/sc1/THUMBNAIL/image/gif/15a5c815a9132b23a0eb85374ecfefeb/sc1.sml sc1 sc1.sml sml 942 65 125 IMAGE-THUMBNAIL 1-s2.0-S1381116901000784-sc1.gif https://s3.amazonaws.com/prod-ucs-content-store-us-east/content/pii:S1381116901000784/sc1/DOWNSAMPLED/image/gif/8e00e4826a6a63f8790a2f2ec7e1bae9/sc1.gif https://s3-eu-west-1.amazonaws.com/prod-ucs-content-store-eu-west/content/pii:S1381116901000784/sc1/DOWNSAMPLED/image/gif/8e00e4826a6a63f8790a2f2ec7e1bae9/sc1.gif sc1 sc1.gif gif 1068 78 150 IMAGE-DOWNSAMPLED 1-s2.0-S1381116901000784-sc2.sml https://s3.amazonaws.com/prod-ucs-content-store-us-east/content/pii:S1381116901000784/sc2/THUMBNAIL/image/gif/0fc731009a1f475b5546955ba501ca5b/sc2.sml https://s3-eu-west-1.amazonaws.com/prod-ucs-content-store-eu-west/content/pii:S1381116901000784/sc2/THUMBNAIL/image/gif/0fc731009a1f475b5546955ba501ca5b/sc2.sml sc2 sc2.sml sml 1001 93 90 IMAGE-THUMBNAIL 1-s2.0-S1381116901000784-sc2.gif https://s3.amazonaws.com/prod-ucs-content-store-us-east/content/pii:S1381116901000784/sc2/DOWNSAMPLED/image/gif/c41d2b2f3380b8062b0e667ac068a926/sc2.gif https://s3-eu-west-1.amazonaws.com/prod-ucs-content-store-eu-west/content/pii:S1381116901000784/sc2/DOWNSAMPLED/image/gif/c41d2b2f3380b8062b0e667ac068a926/sc2.gif sc2 sc2.gif gif 2858 217 209 IMAGE-DOWNSAMPLED 1-s2.0-S1381116901000784-sc3.sml https://s3.amazonaws.com/prod-ucs-content-store-us-east/content/pii:S1381116901000784/sc3/THUMBNAIL/image/gif/e4d86340c64a998387d6ee0ca9076f17/sc3.sml https://s3-eu-west-1.amazonaws.com/prod-ucs-content-store-eu-west/content/pii:S1381116901000784/sc3/THUMBNAIL/image/gif/e4d86340c64a998387d6ee0ca9076f17/sc3.sml sc3 sc3.sml sml 1026 78 125 IMAGE-THUMBNAIL 1-s2.0-S1381116901000784-sc3.gif https://s3.amazonaws.com/prod-ucs-content-store-us-east/content/pii:S1381116901000784/sc3/DOWNSAMPLED/image/gif/820c698722b7c9b5b60ad3bca4056688/sc3.gif https://s3-eu-west-1.amazonaws.com/prod-ucs-content-store-eu-west/content/pii:S1381116901000784/sc3/DOWNSAMPLED/image/gif/820c698722b7c9b5b60ad3bca4056688/sc3.gif sc3 sc3.gif gif 3577 204 326 IMAGE-DOWNSAMPLED 1-s2.0-S1381116901000784-sc4.sml https://s3.amazonaws.com/prod-ucs-content-store-us-east/content/pii:S1381116901000784/sc4/THUMBNAIL/image/gif/2d1ca04b44b6d194d6ad4402e8be2aff/sc4.sml https://s3-eu-west-1.amazonaws.com/prod-ucs-content-store-eu-west/content/pii:S1381116901000784/sc4/THUMBNAIL/image/gif/2d1ca04b44b6d194d6ad4402e8be2aff/sc4.sml sc4 sc4.sml sml 899 64 125 IMAGE-THUMBNAIL 1-s2.0-S1381116901000784-sc4.gif https://s3.amazonaws.com/prod-ucs-content-store-us-east/content/pii:S1381116901000784/sc4/DOWNSAMPLED/image/gif/c2204b0f22da3279348720a252f703c0/sc4.gif https://s3-eu-west-1.amazonaws.com/prod-ucs-content-store-eu-west/content/pii:S1381116901000784/sc4/DOWNSAMPLED/image/gif/c2204b0f22da3279348720a252f703c0/sc4.gif sc4 sc4.gif gif 3342 174 339 IMAGE-DOWNSAMPLED 1-s2.0-S1381116901000784-sc5.sml https://s3.amazonaws.com/prod-ucs-content-store-us-east/content/pii:S1381116901000784/sc5/THUMBNAIL/image/gif/b683939fb1028c9f3f7749f4697c4753/sc5.sml https://s3-eu-west-1.amazonaws.com/prod-ucs-content-store-eu-west/content/pii:S1381116901000784/sc5/THUMBNAIL/image/gif/b683939fb1028c9f3f7749f4697c4753/sc5.sml sc5 sc5.sml sml 755 63 125 IMAGE-THUMBNAIL 1-s2.0-S1381116901000784-sc5.gif https://s3.amazonaws.com/prod-ucs-content-store-us-east/content/pii:S1381116901000784/sc5/DOWNSAMPLED/image/gif/1abdd7b5f2c4bd9228a8b4bf3bcda6e3/sc5.gif https://s3-eu-west-1.amazonaws.com/prod-ucs-content-store-eu-west/content/pii:S1381116901000784/sc5/DOWNSAMPLED/image/gif/1abdd7b5f2c4bd9228a8b4bf3bcda6e3/sc5.gif sc5 sc5.gif gif 2520 162 322 IMAGE-DOWNSAMPLED 1-s2.0-S1381116901000784-sc6.sml https://s3.amazonaws.com/prod-ucs-content-store-us-east/content/pii:S1381116901000784/sc6/THUMBNAIL/image/gif/181e5244860cec89512de7772bb98915/sc6.sml https://s3-eu-west-1.amazonaws.com/prod-ucs-content-store-eu-west/content/pii:S1381116901000784/sc6/THUMBNAIL/image/gif/181e5244860cec89512de7772bb98915/sc6.sml sc6 sc6.sml sml 706 30 125 IMAGE-THUMBNAIL 1-s2.0-S1381116901000784-sc6.gif https://s3.amazonaws.com/prod-ucs-content-store-us-east/content/pii:S1381116901000784/sc6/DOWNSAMPLED/image/gif/2fa25027714b0034b924848e6fad7206/sc6.gif https://s3-eu-west-1.amazonaws.com/prod-ucs-content-store-eu-west/content/pii:S1381116901000784/sc6/DOWNSAMPLED/image/gif/2fa25027714b0034b924848e6fad7206/sc6.gif sc6 sc6.gif gif 5047 119 498 IMAGE-DOWNSAMPLED 1-s2.0-S1381116901000784-gr6.sml https://s3.amazonaws.com/prod-ucs-content-store-us-east/content/pii:S1381116901000784/gr6/THUMBNAIL/image/gif/6ccde08a1cbceae034a3a36541d3a316/gr6.sml https://s3-eu-west-1.amazonaws.com/prod-ucs-content-store-eu-west/content/pii:S1381116901000784/gr6/THUMBNAIL/image/gif/6ccde08a1cbceae034a3a36541d3a316/gr6.sml gr6 gr6.sml sml 1207 94 120 IMAGE-THUMBNAIL 1-s2.0-S1381116901000784-gr6.gif https://s3.amazonaws.com/prod-ucs-content-store-us-east/content/pii:S1381116901000784/gr6/DOWNSAMPLED/image/gif/044d4bd1cc1d7523ae558a705cf0e07d/gr6.gif https://s3-eu-west-1.amazonaws.com/prod-ucs-content-store-eu-west/content/pii:S1381116901000784/gr6/DOWNSAMPLED/image/gif/044d4bd1cc1d7523ae558a705cf0e07d/gr6.gif gr6 gr6.gif gif 8284 372 477 IMAGE-DOWNSAMPLED 1-s2.0-S1381116901000784-gr7.sml https://s3.amazonaws.com/prod-ucs-content-store-us-east/content/pii:S1381116901000784/gr7/THUMBNAIL/image/gif/19b12a845b0a4693c60e1c9492660c39/gr7.sml https://s3-eu-west-1.amazonaws.com/prod-ucs-content-store-eu-west/content/pii:S1381116901000784/gr7/THUMBNAIL/image/gif/19b12a845b0a4693c60e1c9492660c39/gr7.sml gr7 gr7.sml sml 1089 81 125 IMAGE-THUMBNAIL 1-s2.0-S1381116901000784-gr7.gif https://s3.amazonaws.com/prod-ucs-content-store-us-east/content/pii:S1381116901000784/gr7/DOWNSAMPLED/image/gif/380267556cdc7f7eefea043228d60da9/gr7.gif https://s3-eu-west-1.amazonaws.com/prod-ucs-content-store-eu-west/content/pii:S1381116901000784/gr7/DOWNSAMPLED/image/gif/380267556cdc7f7eefea043228d60da9/gr7.gif gr7 gr7.gif gif 6072 292 450 IMAGE-DOWNSAMPLED 1-s2.0-S1381116901000784-gr8.sml https://s3.amazonaws.com/prod-ucs-content-store-us-east/content/pii:S1381116901000784/gr8/THUMBNAIL/image/gif/36adc710ff5e7ed3dd8ef1648b2e22e3/gr8.sml https://s3-eu-west-1.amazonaws.com/prod-ucs-content-store-eu-west/content/pii:S1381116901000784/gr8/THUMBNAIL/image/gif/36adc710ff5e7ed3dd8ef1648b2e22e3/gr8.sml gr8 gr8.sml sml 1380 75 125 IMAGE-THUMBNAIL 1-s2.0-S1381116901000784-gr8.gif https://s3.amazonaws.com/prod-ucs-content-store-us-east/content/pii:S1381116901000784/gr8/DOWNSAMPLED/image/gif/26e0fa534f111c3e8f765ca5eb3f9994/gr8.gif https://s3-eu-west-1.amazonaws.com/prod-ucs-content-store-eu-west/content/pii:S1381116901000784/gr8/DOWNSAMPLED/image/gif/26e0fa534f111c3e8f765ca5eb3f9994/gr8.gif gr8 gr8.gif gif 18381 271 450 IMAGE-DOWNSAMPLED 1-s2.0-S1381116901000784-gr9.sml https://s3.amazonaws.com/prod-ucs-content-store-us-east/content/pii:S1381116901000784/gr9/THUMBNAIL/image/gif/1d1b6bd6ae5e33c137a4ef709815afad/gr9.sml https://s3-eu-west-1.amazonaws.com/prod-ucs-content-store-eu-west/content/pii:S1381116901000784/gr9/THUMBNAIL/image/gif/1d1b6bd6ae5e33c137a4ef709815afad/gr9.sml gr9 gr9.sml sml 843 93 74 IMAGE-THUMBNAIL 1-s2.0-S1381116901000784-gr9.gif https://s3.amazonaws.com/prod-ucs-content-store-us-east/content/pii:S1381116901000784/gr9/DOWNSAMPLED/image/gif/b8e4ea5a4112f63b2c6f564dd1528957/gr9.gif https://s3-eu-west-1.amazonaws.com/prod-ucs-content-store-eu-west/content/pii:S1381116901000784/gr9/DOWNSAMPLED/image/gif/b8e4ea5a4112f63b2c6f564dd1528957/gr9.gif gr9 gr9.gif gif 15960 748 597 IMAGE-DOWNSAMPLED 1-s2.0-S1381116901000784-sc7.sml https://s3.amazonaws.com/prod-ucs-content-store-us-east/content/pii:S1381116901000784/sc7/THUMBNAIL/image/gif/9291b291bd984eb00f8b30ddf78c26ee/sc7.sml https://s3-eu-west-1.amazonaws.com/prod-ucs-content-store-eu-west/content/pii:S1381116901000784/sc7/THUMBNAIL/image/gif/9291b291bd984eb00f8b30ddf78c26ee/sc7.sml sc7 sc7.sml sml 821 37 125 IMAGE-THUMBNAIL 1-s2.0-S1381116901000784-sc7.gif https://s3.amazonaws.com/prod-ucs-content-store-us-east/content/pii:S1381116901000784/sc7/DOWNSAMPLED/image/gif/343fc3ba7fd113ceface0556f5e02b8a/sc7.gif https://s3-eu-west-1.amazonaws.com/prod-ucs-content-store-eu-west/content/pii:S1381116901000784/sc7/DOWNSAMPLED/image/gif/343fc3ba7fd113ceface0556f5e02b8a/sc7.gif sc7 sc7.gif gif 1114 51 172 IMAGE-DOWNSAMPLED MOLCAA 3104 S1381-1169(01)00078-4 10.1016/S1381-1169(01)00078-4 Elsevier Science B.V. Fig. 1 Pd(0) model: (a) top view; (b) lateral view. Fig. 2 PdO(cluster)/Pd(0) model: (a) top view; (b) lateral view. Fig. 3 PdO(film)/Pd(0) model: (a) top view; (b) lateral view. Fig. 4 PdO(cluster)-Cl/Pd(0) model: (a) top view; (b) lateral view. Fig. 5 PdO(film)-Cl/Pd(0) model: (a) top view; (b) lateral view. Scheme 1 Model of O2 adsorption. Scheme 2 Model of CH4 adsorption. Scheme 3 Model of CH4 dissociation. Scheme 4 Removal of chlorine from the catalyst surface during methane combustion. Scheme 5 Model of CO2 adsorption. Scheme 6 Products desorption — reactive adsorption. Fig. 6 TPR profiles for p1 and p2 samples. Oxidation temperature: (a) 300°C; (b) 500°C. Fig. 7 Methane conversion as a function of reaction temperature. Fig. 8 Methane oxidation rates at 350°C. Fig. 9 IR spectra. Scheme 7 Model of O2 dissociation. Table 1 Atomic parameters used for EHMO calculation Atom Orbital Ionization potential (eV) Orbital exponents Pd 5s −7.24 2.19 5p −3.68 2.15 4d −11.90 5.98, 2.61, 0.55, 0.67 O 2s −31.60 2.163 2p −16.78 2.750 H 1s −13.60 1.00 C 2s −15.59 1.5536 2p −10.26 1.4508 Cl 35 −26.03 2.356 3p −14.20 2.039 Table 2 Characterization of Pd/γ-Al2O3 catalysts Catalyst Pd loading (wt.%) H/Pd (298K) d (nm) a p1 0.82 0.36 3.1 p2 1.06 0.15 7.5 a Calculated from H2 chemisorption data. Table 3 Results for oxygen adsorption Model O2 horizontal O2 perpendicular Adsorption energy (eV) Distance OPd (Å) Adsorption energy (eV) Distance OPd (Å) Pd(0) −12.74 2.3 −12.63 3 PdO(cluster)/Pd(0) −12.67 2.7 −12.62 3.1 PdO(film)/Pd(0) −12.67 1.9 −12.57 3.1 Pd0(cluster)-Cl/pd(0) −12.67 3.1 −12.67 3.6 PdO(film)-Cl/Pd(0) −12.57 3.2 −12.56 3.6 Table 4 Results for oxygen dissociation on top site Model Dissociation energy (eV) Distance OPd (Å) Pd(0) −16.67 2.3 PdO(cluster)/Pd(0) −17.44 2.7 PdO(film)/Pd(0) −15.86 1.9 PdO(cluster)-Cl/Pd(0) −17.7 3.8 PdO(film)-Cl/Pd(0) −17.9 3.1 Table 5 Calculated adsorption energies (eV) for CH4 adsorbed on different models Model Adsorption energy (eV) a a b c d Pd(0) −0.94 −0.39 – – PdO(cluster)/Pd(0) −0.86 −0.37 −0.64 −0.24 PdO(film)/Pd(0) −0.97 −0.4 −1.26 −0.59 PdO(cluster)-Cl/Pd(0) −0.44 – −0.56 – PdO(film)-Cl/Pd(0) −0.49 – −0.88 – a Adsorption form according to Scheme 2. Table 6 Calculated CX (X: Pd or O) distances (in Å) for CH4 adsorption Model Distance CX (X: O or Pd) (Å) a a b c d Pd(0) 2.6 2 – – PdO(cluster)/Pd(0) 2.6 2.1 2.5 2 PdO(film)/Pd(0) 2.6 2 2.4 1.8 PdO(cluster)-Cl/Pd(0) 3 – 2.6 – PdO(film)-Cl/Pd(0) 2.9 – 2.6 – a Adsorption form according to Scheme 2. Table 7 Calculated dissociation energies (eV) for CH4 on different models (see Scheme 3) Model Dissociation energy (eV) C → Pd, H → X (X: Pd, O or Cl) C → O, H → X (X: Pd, O or Cl) Pd a O Cl Pd O Cl Pd(0) −3.48 – – – – – PdO(cluster)/Pd(0) −2.8 – – −2.6 – – PdO(film)/Pd(0) −2.98 – – −2.54 – – PdO(cluster)-Cl/Pd(0) −1.3 −1.2 −1.3 −1.58 −1.58 −1.59 PdO(film)-Cl/Pd(0) −1.85 −1.76 −1.81 −1.82 −1.8 −1.8 a Site of H adsorption. Table 8 Calculated HX distances (X: Pd, O or Cl) (in Å) after CH4 dissociation (see Scheme 3) Model Distance HX (X: O, Pd or Cl) (Å) C → Pd, H → X (X: Pd, O or Cl) C → Pd, H → X (X: Pd, O or Cl) Pd a O Cl Pd O Cl Pd(0) 1.3 – – – – – PdO(cluster)/Pd(0) 1.3 – – 1.3 – – PdO(film)/Pd(0) 1.3 – – 1.3 – – PdO(cluster)-Cl/Pd(0) 4.2 5 4.6 6 36 3.9 PdO(film)-Cl/Pd(0) 5 5 4.3 3.4 3.4 3.9 a H site of adsorption. Table 9 Calculated energies (eV) for removal of chlorine from the catalyst surface during methane combustion Model Relative energy (eV) a a b PdO(cluster)-Cl/Pd(0) −0.49 0.11 PdO(film)-Cl/Pd(0) −0.5 −0.03 a Reaction according to Scheme 4, distance HCl = 1.2746Å. Table 10 Calculated adsorption energies (eV) and OPd heights (in Å) for H2O on different models Model Adsorption energy (eV) Distance OPd (Å) PdO(cluster)/Pd(0) −0.65 2.6 PdO(film)/Pd(0) −0.63 2.6 PdO(cluster)-Cl/Pd(0) −0.62 2.7 PdO(film)-Cl/Pd(0) −0.61 2.8 Table 11 Calculated adsorption energies (eV) for CO2 on different models Model Adsorption energy (eV) a a b c d e PdO(cluster)/Pd(0) −13.97 −11.4 −0.09 −2.55 −0.66 PdO(film)/Pd(0) −14.78 −11.29 −0.09 −2.00 −1.23 PdO(cluster)-Cl/Pd(0) −10.35 −11.10 −0.06 −0.76 −0.23 PdO(film)-Cl/Pd(0) −10.4 −12.2 −0.04 −0.43 −0.41 a Adsorption form according to Scheme 5. Table 12 Calculated heights (in Å) for CO2 adsorption on different models Model Distance C (O or Pd) (Å) a a b c d e PdO(cluster)/Pd(0) 1.6 3.5 2.6 2.1 2.2 PdO(film)/Pd(0) 1.7 3.5 2.6 2.1 2.2 PdO(cluster)-Cl/Pd(0) 1.8 4 2.8 2.6 2.7 PdO(film)-Cl/Pd(0) 4 3.5 2.9 2.8 2.7 a Adsorption form according to Scheme 5. Table 13 Relative energies (eV) for steps of products desorption — reactive adsorption in surface reaction (Langmuir–Hinshelwood) Model C → Pd, H → X (X: Pd or Cl) a C → O, H → X (X: Pd or Cl) b Pd Cl Pd Cl PdO(cluster)/Pd(0) −47.69 – −49.67 – PdO(film)/Pd(0) −44.91 – −34.67 – PdO(cluster)-Cl/Pd(0) −48.74 −48.64 −37.37 −31.93 PdO(film)-Cl/Pd(0) −35.34 −35.24 −33.62 −32.81 a According to Scheme 6(2). b According to Scheme 6(1). Table 14 Relative energies (eV) for steps of products desorption — reactive adsorption in surface reaction (Mars and van Krevelen) Model C → Pd, H → X (X: Pd or Cl) a C → O, H → X (X: Pd or Cl) b Pd Cl Pd Cl PdO(cluster)/Pd(0) −39.91 – −43.11 – PdO(film)/Pd(0) −34.99 – −30.54 – PdO(cluster)-Cl/Pd(0) −37.06 −37.14 −33.91 −37.74 PdO(film)-Cl/Pd(0) −32.62 −32.59 −32.81 −25.51 a According to Scheme 6(2). b According to Scheme 6(1). A combined theoretical and experimental study of the effects of residual chlorine on the behavior of Pd/γ-Al2O3 catalysts for methane oxidation G Tonetto * M.L Ferreira D.E Damiani PLAPIQUI-(UNS-CONICET), Camino La Carrindanga Km, 7-CC 717, 8000 Bahı́a Blanca-R, Argentina * Corresponding author. Studies of the methane oxidation on Pd/γ-Al2O3 catalysts with and without chloride were made. The reaction was investigated at temperatures in the range 20–500°C using stoichiometric reactant mixture. Dissociation of methane and oxygen and desorption of carbon dioxide and water on Pd catalysts have been investigated using a Molecular Orbital approach of the Extended Hückel type, including repulsion terms. Keywords Extended Hückel molecular orbital (EHMO) method Pd supported catalyst 1 Introduction The catalytic combustion of hydrocarbons is becoming of increasing importance both in the production of energy and in gaseous emission control. Catalysts able to perform the combustion reaction are alumina-supported noble metals. In the case of complete oxidation of methane, palladium is the most attractive metal because of its high activity and relatively low cost. Some papers on methane oxidation reported that chlorine containing precursor salts produce catalysts inferior in performance to others made without chloride [1,2]. Simone et al. [3] suggested that the reversible poisoning may be occurring by the following means: (a) blocking of PdO actives sites by chloride thereby decreasing accessibility of reactant gas to the catalytic site, and/or (b) chemical interaction of chloride with the catalytically active PdO species resulting in Pd x O y Cl z complexes, which are less active. Shen et al. [4] reported a bridged structure of chlorine containing palladium catalysts. Marecot et al. [5] investigated the oxidation of propane and propene on palladium and platinum supported catalysts. They found that catalysts prepared from chlorine containing precursor salts, are poisoned by chlorine whatever the particle size and this poisoning effect is more detrimental under oxidizing conditions. After successive reaction cycles, this poisoning effect disappears as consequence of the removal of chlorine from the catalyst surface by water produced during propane and propene combustion. Poisoning effects of chloride are explained by a decreased active surface under consideration consequence of the chemical interaction of the halogen with the catalyst surface. Similar results are presented by Cant et al. [6] for the oxidation of hydrocarbons. Cullis and Willatt [7] suggest that the halogen would be adsorbed on the sites normally necessary for the adsorption and activation of oxygen. Lieske et al. [8] and Barbier et al. [9] consider the formation of metal oxide-chloride species which are more stable and less reactive than oxygen species. There is agreement about the idea that chlorine is removed more easily under reducing condition whereas oxidative treatments are ineffective [1,3,5,6,10]. Peri and Lund [11] reported that Pd catalysts generally show an induction period followed by an activation period. The first one is associated to the presence of chlorine. The higher the content of chlorine, the longer the induction period. The activation period is probably not related to the presence of chlorine residues. It is important also the place where chlorine resides. Rodrı́guez Cárdenas and Damiani [12] observed a distortion of the TPR peak belonging to the Pd hydride that was associated to the presence of chlorine nearby the metal or in contact with it. XPS studies on supported Pt catalysts indicate two kinds of chlorine, one is associated with the metal and can be easily removed, while the other is associated with the support and it is difficult to remove [13]. A distinction between chlorine associated with metal and with the support has also been noted for supported Ru [14]. The objective of this work is to examine the effects of chlorine from the precursor salts on the activity of catalysts. In order to gain a better understanding of the reaction, dissociation of methane and oxygen and desorption of carbon dioxide and water on Pd catalysts with and without chlorine have been investigated using Molecular Orbital approach of the Extended Hückel type. Experimental results about methane total oxidation reaction and catalysts characterization are presented and discussed. 2 Experimental 2.1 Catalysts preparation The Pd/Al2O3 catalyst prepared from Pd(C5H7O2)2 is referred to as p1 and the catalyst derived from Pd(NH3)4Cl2·H2O is called p2. The p1 sample was prepared by impregnation of the support with a solution of Pd(C5H7O2)2 (Alfa) in toluene (Merck). The support material was γ-Al2O3 (Condea, Puralox, 148m2/g). After impregnation the catalyst was dried in Ar at 150°C for 2h and then calcined in chromatographic air at 500°C during 2h. The p2 catalyst was prepared by impregnation of the support with Pd(NH3)4Cl2·H2O (Spex) using the incipient-wetness method. The support used was γ-Al2O3 (Rhone-Poulenc) with BET area of 120m2/g and pore volume of 1cm3/g. The isoelectric point of the support is 7.5. The pH of precursor solution was 11. It was fixed to 11 with 20% HNO3 solution. After impregnation the catalyst was dried in Ar at 423K for 2h and then calcined in chromatographic air at 500°C during 2h. In both catalysts, prior to impregnation the support was dried under N2 at 150°C for 2h. The palladium content was determined by Atomic Absorption Spectroscopy. 2.2 H2 chemisorption Hydrogen chemisorption experiments were conducted in a conventional pulse apparatus at atmospheric pressure and room temperature. The samples were oxidized in air at 500°C during 1h and exposed to a temperature-programmed reduction (TPR) experiment in a gas mixture containing 5%H2–95%Ar in the temperature interval 25–500°C. After cooling to 25°C temperature in Ar, H2 pulse were admitted until the sample was saturated. The fraction of exposed palladium was calculated assuming that one hydrogen atom is adsorbed per surface palladium atom. The average crystallite size based on chemisorption measurements was estimated from the equation d(nm)=112/(percentage of metal exposed). This expression assumes spherical particles and a surface atom density of 1.27×1019 atoms/m2 [15]. 2.3 TPR experiments TPR experiments were carried out in an apparatus similar to that described by Robertson et al. [16] to which some changes were introduced [17]. The reducing gas was a mixture (5%H2–95%Ar) first circulated through an empty 6mm o.d. Pyrex tube positioned in the furnace (the reference), then it passed through a Molecular Sieve 3A cold trap and, after passing through the reference branch of a thermal conductivity detector (TCD), it went to a 6mm o.d. Pyrex tube containing the catalyst. After leaving the sample the reducing mixture was passed through a Molecular Sieve 3A cold trap and the measuring branch of the TCD. The TCD was a flow-through type, microvolume, hot wire Gow Mac cell. Standard methods of gas purification were used. The reference and the sample were held in an oven that could be heated at linear rate of 10°C/min between 0 and 500°C. The temperature of the catalyst bed was measured with a 1/16ft o.d. stainless steel shield chromel–alumel thermocouple placed in contact with the top of the catalyst bed. The flow rate of the reducing gas was 20cm3 min−1. Fresh samples of catalysts (40mg) were oxidized in flowing chromatographic air at 300°C for 1h and purged and cooled in Ar to −50°C, followed by TPR. The cycle was repeated with samples oxidized at 500°C in the same conditions. 2.4 Catalytic activity measurements The catalysts were tested in a horizontal glass-made packed bed reactor (6mm o.d.) placed in an electrically heated oven. A temperature controller was used to control the reaction temperature (Omega CN3800), which was measured by means of a shielded J type Omega thermocouple placed in the furnace at the same position that the catalyst bed outside the reactor. The reaction mixture composition was 1% CH4, 2% O2 and 97% He. The reaction products were analyzed in a Varian 3700 gas chromatography operating in TCD mode. A silica gel (2 m×1/8in)-Molecular Sieve 5A (1 m×1/8in) and Porapak N (2 m×1/8in) columns operated isothermally at 308K with He at 20cm3 min−1 as carrier gas was used for separation. Chromatographic peaks were integrated by means of a Hewlett-Packard 3390Å integrator. Catalytic tests were done on catalyst samples that were exposed to calcination step only. The tests were done in two ways: (1) the catalyst sample is heated in the reaction mixture from 293 to 773K. Samples of the reaction products are taken at different reaction temperatures or (2) the catalyst sample is heated to 773K in He flow. Once the final temperature is reached the catalyst is contacted with the reaction mixture during 2h. After that the catalyst temperature is lowered to 623K under a He flow. When the new reaction temperature is reached the catalyst is contacted again with the reaction mixture during 2h. Samples of reaction products are taken regularly. Catalyst weight was adjusted in order to keep constant the weight of Pd in the different experiments. The reaction mixture flow rate was maintained at 20cm3 min−1. 2.5 IR studies Infrared spectra of samples were recorded after reaction. The infrared spectra were recorded on a FTIR 520 Nicolet spectrometer with 4cm−1 resolution and 10 scans. The cell was under air flow and the spectra were recorded at room temperature. 3 Theoretical model The theoretical studies applied to catalysis may be classified in semi-empirical and ab initio methods. Amongst the formers, an extended Hückel molecular orbital (EHMO) method was selected to perform the quantum mechanical study of the Pd/γ-Al2O3 catalytic system. The EHMO was widely used by Hoffman and coworkers [18–20] to study electronic structure of transition metal complexes and adsorbed molecules, it provides useful qualitative trends in large model system. The electronic structure and derived properties are established from electron equations for the molecular orbitals, approximated by experimental data. In this formalism, the non-diagonal elements of Hamiltonian of the system are proportional to the overlap matrix elements. More recently, in order to improve the traditional Extended Hückel Hamiltonian some corrections were introduced by Chamber et al. [21] and Anderson and Hoffman [22]. The total energy of a selected adsorbed molecule on a palladium cluster is a sumatory of an attractive and a repulsive term and may be represented by the following equation: (1) E t = ∑ i niEi+ 1 2 ∑ i ∑ i≠j E rep (i,j) The attractive energy is related to the electrons in the valence level i with an occupancy ni . The repulsion energy is originated between all the possible pairs nucleus i-fixed atom j. Experimental parameters are necessary for calculations, being the EHMO a semi-empirical method. We have used reported ionization potential obtained from spectroscopic data [23]. Since for the level 4p only theoretical data are available in literature, we have taken the data of Hartree–Fock–Slater [24]. Parameters used in this work for palladium, oxygen, hydrogen, chloride and carbon are presented in Table 1 . The program used to calculate the energy of the different adsorbed species was the ICONC, originally developed by Chamber et al. [25], which take into account repulsive terms that are not originally in the EHMO. In the present work, calculations were carried out with a modified version of ICONC. This version has been tested in previous work dealing with the adsorption of metallocenes and Ziegler–Natta catalysts [26,27]. The total energy of adsorbed species was calculated as the difference between the electronic energy of the system when the adsorbed molecule is at a finite distance from the surface and when the molecule is far away from the cluster surface. The geometry optimization was done at 0.1Å step and due to the approximate nature of extended Hückel like methods the convergence criterion to the energy was set to 0.01eV. The dissociation energies shown in Tables are defined as the total energy of dissociated species minus the total energies of adsorbed species. It could be considered as a dissociation energy of adsorbed reactives. The semi-empirical MO calculations have been performed in the framework of the cluster approximation, that is the adsorption site and its neighborhood was modeled by a portion of the otherwise infinite solid. 4 Modeling of surface palladium structures The dependence of catalytic activity on the chemical state of palladium gave conflicting results [28–32]. Some active forms of palladium that have been proposed for methane oxidation are highly dispersed palladium oxide particles, chemisorbed oxygen on Pd, a layer of oxide on Pd crystallites and surface reconstruction of palladium oxide under reaction condition. Taking account of the particles size, we decided to model the metal cluster without considering the support. Our Pd catalysts are light brown when they are oxidized and dark gray when they are reduced. The p1 sample changes its color to dark gray after reaction, showing that reduction takes place (at least partially). The p2 sample was light brown before and after reaction. Because this experimental fact we modeled metallic clusters with different oxidized fractions (film and cluster). 4.1 The surface of Pd (2 0 0) Since the structure of the surface catalysts is unknown, we used the Pd (200) plane according to Garbowsky et al. [30]. A cluster with 117 atoms were used to represent the (200) face: 85 Pd and 32 H (Fig. 1 ). Hydrogen atoms were used to complete the internal palladium coordination and to avoid the undesirable effect called dangling bonds. The Pd atoms were distributed in three layers of 41, 40 and 4 atoms. The geometry of the bulk fcc crystals was used with cell parameter 3.8Å and interlayer separation of 2.20Å based on the theoretical work of Ward et al. [33]. Taking into account previous results [34] we have used unrelaxed surface for all the calculations. This model was identified as Pd(0). 4.2 The surface of Pd (2 0 0) partially oxidized In consideration of the catalyst color after reaction, we decided to model the surface of Pd (200) partially oxidized. One hundred and twenty-two atoms were used in the model, 5 O, 32 H and 85 Pd placed in three layers like Fig. 2 shows. This structure was chosen because previous work [30] showed that palladium particles exposing the (200) planes to the reactants easily form PdO (001), since both have similar parameters. This model was identified as PdO(cluster)/Pd(0). 4.3 The surface of PdO (0 0 1) The model of surface PdO (001) was constructed with 124 atoms: 32 O, 28 H and 64 Pd, disposed in two layers (Fig. 3 ). Dangling bonds were satured with hydrogen atoms. This model was identified as PdO(film)/Pd(0). 4.4 The surface of Pd (2 0 0) partially oxidized containing chlorine A cluster with 124 atoms: 3 Cl, 4 O, 32 H and 85 Pd placed in three layers showed in Fig. 4 was used to model the chlorine containing catalyst. Bridged chlorine structure was introduced in the first layer in order to represent the residual chlorine. Following literature data [35], Pd–Cl distance was set at 2.1Å. This model was identified as PdO(cluster)-Cl/Pd(0). 4.5 The surface of PdO (0 0 1) containing chlorine In the same way, Fig. 5 shows the surface of PdO (001) containing chlorine. 8 Cl, 28 H, 24 O and 64 Pd were used to model the cluster. This model was identified as PdO(film)-Cl/Pd(0). 4.6 Oxygen adsorption and dissociation Different positions for O2 adsorption were evaluated: • parallel to the surface plane, each O atom in an “on top” position (Scheme 1 a); • perpendicular to the surface plane, in an “on top” position (Scheme 1b). Our calculations considered two kinds of adsorbed oxygen species placed at on-top (Ot) and hollow (Oh) sites, which represent the weakly and strongly adsorbed oxygen, respectively. 4.7 Methane adsorption and dissociation Scheme 2 shows different configurations for methane adsorbed on the clusters: • one of the tetrahedral axes through the C oriented perpendicularly to the cluster surface, with the C atom closer the Pd or Oh atom; • one of the tetrahedral axes through the C oriented perpendicularly to the cluster surface, with the H atom closer the Pd or Oh atom. For the dissociation of CH4, the CH3 group maintained the same geometry (HCH angle=109.5° and CH distance=1.32Å) as in the free methane molecule and the abstracted H was positioned on a Pd, O or Cl atom (Scheme 3 ). The methyl group bonded to Pd or O atom was placed at the distance reported in Table 5. The OhH bond was found to be perpendicular to the surfaces [36]. 4.8 Chlorine loss Scheme 4 represents removal of chlorine from the catalyst surface during reaction. H–Cl distance used was 1.2746Å in all calculations. 4.9 Water adsorption We consider the H2O molecule bonded to the Pd atom by the oxygen end and the molecular plane was assumed to be perpendicular to the surface [37]. It maintained the same geometry (HOH angle=104.5° and OH distance=0.9575Å) as in the free water molecule. Water desorption and oxygen vacancy formation also was considered. 4.10 Carbon dioxide adsorption The used geometries in the calculation are shown in Scheme 5 . CO distance was 1.27 and 1.31Å in the carboxylate and carbonate complexes, respectively. In both species we consider C sp2 (OCO angle=120°). For the other structures presented in Scheme 5 the same geometry was maintained (OCO angle=180° and OC distance 1.16Å) as in the free carbon dioxide molecule. Numerous investigations of CO2 adsorbed over metal oxides ([38,39] and references therein) have established the formation of complexes of different types like bicarbonate, monodentate and bidentate carbonate. We choose monodentate species because formation of such bidentate structure would suggest the existence and accessibility of appropriate anion vacancies on the oxide surface. 4.11 Steps of products desorption — reactive adsorption/dissociation We compared steps of adsorption–dissociation of reactives and products desorption in two possible reaction mechanisms: (a) surface reaction of the Langmuir–Hinshelwood type and (b) a redox mechanism (Mars and van Krevelen), involving the reaction of methane with lattice oxygen of PdO and subsequent reoxidation of palladium formed. The methyl group was bonded to Pd or O atoms. In models containing chlorine, we considered that the abstracted H lies on a Pd or Cl atom as Scheme 6 shows. 5 Results and discussion 5.1 Catalysts preparation Table 2 presents the catalysts Pd content. As it was mentioned in the Section 2, p1 sample was prepared from Pd(Acac)2 and finally calcined in air. After this treatment, PdO particles are present [40]. Krishnankutty et al. reported that the Pd(Acac)2 precursor is a likely source of carbon which can contaminate the Pd particles. However, calcination and reduction pretreatment (at 300°C) completely cleaned the 0.8wt.% Pd/SiO2 catalyst. Lomot et al. [41,42] showed that palladium acetylacetonate binds more strongly to Al2O3 than to SiO2. The organic part of the Pd(Acac)2/Al2O3 precursor is subjected to considerable splitting before being stripped off from the support during calcination. An oxidative pretreatment at temperatures higher than 350°C is essential for removing all the carbon from the catalysts surface. Similarly, XPS results [43] reported small amounts of carbonaceous compounds in Pd/SiO2 catalysts which correspond to residues of the organometallic precursor. In order to know about what amount of chlorine remains on the catalysts, p2 sample was exposed to chlorine-free water at boiling temperature for several hours. After it, the solid was filtrated and Cl− in the remaining liquid titrated with AgNO3. The result indicates that after the pretreatment the catalyst retains at least 30% of the initial chlorine [2]. Similar results were obtained for Ru and RuMo catalysts [44,45]. 5.2 H2 chemisorption Table 2 summarizes the hydrogen chemisorption measurements results. Low chemisorption values in the p2 sample are probably due to the presence of residual chlorine which remains in the catalysts after the treatments. By the way, preparation of catalysts by an organometallic route leads to a rather strong interaction between the metallic phase and the support in the case of low loaded Pd catalysts, this interaction induces structural and/or electronic changes of small palladium crystallites as demonstrated by XPS study [46]. 5.3 TPR experiments TPR profiles of p1 and p2 catalysts are given in Fig. 6 , where the hydrogen consumption is plotted against temperature. TPR profiles show a positive peak assigned to the reduction of Pd oxide. The p1 sample showed a peak at 20°C when it was oxidized at 300 and 23°C when it was oxidized at 500°C. On the other hand, the TPR profiles of the p2 catalyst evidence peaks at 35°C for both pretreatments. For p1 catalysts oxidized at 300°C, the H2 consumption is almost 90% higher than expected. Characteristic negative peak attributed to palladium hydride decomposition is observed. The small peak correlates well with the average particle size showed by the sample, since the hydride formation is a volumetric phenomena. The extra gas uptake may be attributable to the presence of precursor residues, but this is difficult because the severe calcination treatment during the preparation step and the reported data in the open literature (see Section 5.1). It has been reported [47] that samples with low metal content are able to form oxygen-rich, highly dispersed species, during oxidizing treatments. Hoost and Otto [48] reported that on Pd/alumina catalysts with low metal concentrations (<1wt.% Pd), the oxygen consumed during temperature-programmed oxidation (TPO) was significantly in excess of that expected from O/Pd ratio of one, which suggests the formation of a highly dispersed, oxygen-rich Pd-alumina species. This fact could explain the higher hydrogen consumption in the first TPR. After the exposure to a reductive atmosphere at high temperature (up to 500°C during the TPR) and a new oxidation step at 500°C these small particles could suffer a restructuration or sintering that avoids the oxygen rich species formation. TPR profiles of p2 sample are brader than profiles of p1. This fact might be associated to the presence of several particle sizes. Negative peak is not observed. Rodrı́guez Cárdenas [49] reported a double peak of desorption in supported Pd catalysts when the precursor was PdCl2. The author pointed out that the chlorine presence affects the hydride decomposition because it increases the hydride desorption energy, and therefore it requires higher temperature to evolve. The author found that the negative peak corresponding to the Pd normal hydride changes its placement with the particle size. In other words, the hydride decomposes at higher temperature for catalysts with higher dispersion. However, this negative peak assigned to the chlorine effect does not vary with the dispersion. Koopman et al. [50] reported that chlorine stabilizes small Ru particles when Ru catalysts are prepared using RuCl3 hydrated as precursor. Although it is known that small particles do not form hydride, chlorine could extend the hydride formation to smaller particles. Therefore, the final effect would be the combination between the particle size and the hydride stabilization due to the presence of chlorine. Noronha et al. [51] reported that the TPR profile of Pd/Al2O3 (Cl) showed a peak at 147°C and a broad desorption peak between 327 and 527°C. On the other hand, the TPR profile of Pd/Al2O3 (N) was different. A hydrogen consumption at room temperature was observed, followed by a negative peak around 64°C assigned to the desorption of weakly adsorbed hydrogen from the palladium surface and the decomposition of palladium hydride. They concluded that the Pd oxychloride species are more strongly linked to the support than the PdO species, which explains the reduction at higher temperatures. Thus, the peak at 147°C was assigned to the reduction of PdO x Cl y whereas the hydrogen consumption at room temperature corresponded to the reduction of PdO. Our results are in qualitative agreement with those of Nyberg and Tengstal [54]. The chlorinated catalysts do not present Pd hydride. Taking into account that catalytic activity measurements indicate a strong interaction metal–halogen, we consider that the negative peak is not observed in sample p2 because it would be overlapped by the consumption peak. Rakai et al. [52] studied the diffuse reflectance spectra of bulk PdO with those of alumina-supported Pd samples prepared from chloride. They reported the presence of chloride ions in the coordination sphere of Pd2+ ions which suggests the formation of oxychloride species during calcination in air. 5.4 Catalytic activity measurements Fig. 7 shows the methane conversion as a function of the temperature of reaction. Since the same metal mass was used in reaction, relative performances can be discussed. For the p1 sample the reaction began at a temperature close to 250°C and the 100% conversion level was attained at 450°C. The p2 sample did not attain the 100% conversion level whatever the temperature. Carbon monoxide formation was never detected in the temperature range studied. The results of the activity test are shown in Fig. 8 . Aged p1 presents a moderate decrease in the activity. This fact might be originated by carbon formation on the active sites when the catalyst was exposed to reaction. The carbon formation may be responsible of the color change of the catalysts after reaction. Aged p2 manifests a better behavior. The activation appears to be associated with chlorine removal. It was reported [3,5–8] that chlorine is a reversible poison and the catalyst activity improves during repeated runs and reductive treatments. 5.5 IR studies The infrared spectra of p1 and p2 after reaction are given in Fig. 9 . Those corresponding to the alumina are also given. In p1 spectrum, two absorption bands were observed, at 2850 and 2950, which are assigned to CH x species following Gerei et al. [53]. The presence of carbon could be one of the reasons of the color change and the deactivation showed by the aged sample. Pecchi et al. [43] found that carbon deposition occurs upon catalytic reaction on 0.5wt.% Pd/SiO2 surface using a reactant mixture containing 1%CH4–2%O2 in He. 5.6 Theoretical calculations 5.6.1 Oxygen adsorption and dissociation Analyzing the different situations we found that both positions of O2 adsorption were possible. Results are summarized in Table 3 . The data in Table 3 may only provide a rough qualitative idea of the charge distribution. The minimum O2-surface distances is obtained in PdO(film)/Pd(0) at 1.9Å and the longest is for the PdO(film)-Cl/Pd(0) (3.2Å), in the horizontal position. Oxygen dissociation on top site (Scheme 7 ) was favorable in all the considered models (Table 4 ). The large adsorption energies of O imply that O can be strongly trapped on the surface. This result is in agreement with the experimental observations since dissociative adsorption has been reported even at very low temperature on Pd(100) [54]. The dissociation energy is the most favorable for PdO(film)-Cl/Pd(0) and the least is for PdO(film)/Pd(0). In this case, the distance Pd–Ot is 1.9 for PdO(film)/Pd(0) and very much longer when Cl is present (see Table 4) near 3.1Å. Cl does not affect dissociation energies in PdO cluster/Pd(O), but the O–Pd distance is very much longer (almost 1.1–1.2Å). 5.6.2 Methane adsorption and dissociation The results are collected in Tables 5 and 6 . The energies involved in the adsorption of C are lower than those for O2. The on-top sites are more favorable [36]. Form ‘a’ (Scheme 2) is preferred on models where Pd atoms were not impeded: Pd(0) and PdO(cluster)/Pd(0). Form ‘c’ is preferred on PdO(film)/Pd(0) and when Cl is present. Form ‘b’ or ‘d’ is not so probable. From Table 6 can be concluded that the preferred distance C–Pd or C–Oh is 2.4–2.6Å for CH4 adsorption. For the dissociation of CH4, H was positioned on a Pd, O or Cl atom (Scheme 3). The values in Tables 7 and 8 were obtained optimizing H-surface distance. When CH3 was bonded to a Pd atom, H was found to prefer a Pd atom on clusters without chlorine. On the other hand, when chlorine was present, dissociation energies were similar in the three options, but smaller (Scheme 3a). When methyl group was positioned on Oh atom, H preferred to adsorb on top of a Pd atom on Cl-free clusters. In models containing chlorine, Pd atoms were impeded, therefore, adsorption on O or Cl atoms was favorable, both with similar energies. The main difference between the surfaces with and without chlorine in CH4 dissociation is the distance H–X found (all longer than 3.4Å) whereas when the surface is Cl-free, the distances reach values of 1.3–2.0Å (see Table 8). 5.6.3 Chlorine loss Scheme 4 represents removal of chlorine from the catalyst surface. Table 9 summarizes results in terms of relative energy. Form ‘b’ (Scheme 4) is possible although the energy involved is lower than for ‘a’. From our results it can be concluded that if H is adsorbed on Cl near to Pd–CH3 is easier to remove it than if it is near CH3–Oh. 5.6.4 Water adsorption The results of EHMO calculations on this topic are given in Table 10 . Our results seem to indicate that there is no difference between the different surfaces in terms of water adsorption. Water desorption from Oh surface and oxygen vacancy formation was energetically favorable (−0.4eV) for PdO(film)/Pd(O), where it is more probable the water formation. LEED patterns suggest that on fcc (111) and hcp (0001) surfaces, O atoms are adsorbed in the three-fold hollow sites, while for H2O, theoretical calculations indicate the top adsorption on the metal atoms as the most stable (see in [55]). There are data about the behavior of water on oxygen-precovered surfaces; the presence of O atoms on Pd (100) causes high-temperature H2O desorption [56,57]. 5.6.5 Carbon dioxide adsorption Adsorption energies are collected in Tables 11 and 12 . Adsorption of carboxylate form was more favorable in all models. It agrees with literature data about interaction of CO2 with several oxides like Co3O4 [38], NiO [39], CuO and Cu2O [58], CuOCuCr2O4 [59], La2O3 and La(OH)3 [60]. In those cases, where the CO2 species took place on the Cl-containing surfaces, the total energy of adsorbed species is smaller. The adsorption energy of CO2 is higher for PdO(film)/Pd(0) (form ‘a’) whereas is lower for PdO(cluster)/Pd(0). When chlorine is present, form ‘b’ on PdO(film)/Pd(0) is preferred. Forms ‘a’ and ‘b’ are preferred. It can be seen again that the chlorine makes the distances COh or Pd much longer (1.6–1.7Å versus 3.5–4.0Å). 5.6.6 Steps of product desorption — reactive adsorption–dissociation on two possible reaction mechanisms The Scheme 6 shows the evaluated situations for both mechanisms. Tables 13 and 14 collected the results. Both mechanisms are probable but normal surface reaction (LH) is preferred. On PdO(cluster)/Pd(0), the reaction is favored if CH3 is placed on O atom, but on PdO(film)/Pd(0) it must be on Pd. It is evident that Cl affects the reaction when is present in the film (almost +10eV in energy). For Mars and van Krevelen mechanism, again chlorine affect it, but in lesser extension (near +3eV in energy). 6 Discussion and conclusions This general discussion must take into account different aspects of the published literature when we want to compare it with our results: 1. The wide range of composition of the reactive mixture [61,62]. Generally an excess of O2 is used. 2. The different preparation methods, precursors and supports [63–65] used. 3. The pretreatments used in the preactivation step [66]. The catalyst prepared without chlorine had the greatest activity. Early experiments showed that free-Cl catalysts produced notably better activity than catalysts with chlorine. Simone et al. [3] found a correlation between enhanced activity and low chlorine concentration. In a sample with chlorine, the activity improves during reaction. This result agrees with these from Cant et al. [6]. Aged p1 presents a slight decrease in the activity. This fact might be originated by carbon formation on the active sites when the catalyst was exposed to methane oxidation reaction. It is confirmed from IR results and color change after reaction. Carbonaceous compounds were reported when stoichiometric reactant mixture is used [43]. Generally carbon is not observed because oxidant mixtures are used. Haack and Otto [67] reported structure-sensitivity in supported Pd catalysts suggested by a change in carbon deposition derived from incomplete methane oxidation. Normalized to Pd, the intensity of the carbon deposit decreases with increasing Pd particle sizes. Carbon deposits are substantial for highly dispersed Pd on alumina for all supported samples with substoichiometric and stoichiometric reactant mixture. Our TPR and chemisorption measurements results indicate that different precursors and/or preparation methods generate different metallic particles. Our results of EHMO calculations show that increasing the amount of O on the catalyst, the methane oxidation reaction is not so favored. The key points seem to be the methane dissociation, CO2 adsorption energy and the step of desorption of products, adsorption–dissociation of reactives. Tables 13 and 14 show how the energy increases when the surface is partially covered with oxygen. The PdO distances found when O2 is adsorbed and dissociated (Table 4) when no Cl is present (1.9Å) could be assigned to PdO. This possibility would be ruled out when O2 is dissociated near a ClPd bond (PdO distance 3.1Å). This fact could be related to the C formation when no chlorine is present because the PdO bond is stronger. These results agree with part of literature. Cullis and Willatt [63] reported that Pd/γ-Al2O3 pretreated in a hydrogen–helium mixture were most readily activated but those pretreated with oxygen had a very low activity. Similar results were found for Müller et al. [68] and Pecchi et al. [43]. Oh et al. [69] suggested that oxygen inhibits the methane oxidation because oxygen migrates into the bulk of the palladium, forming unreactive bulk palladium oxide. They conclude that oxygen blocks the methane oxidation by excluding the adsorption of methane at active sites. Carstens et al. [70] observed that methane combustion activity of PdO can be enhanced by producing a small amount of metallic Pd on the surface of PdO. The metallic Pd is more effective than PdO for the dissociative adsorption of methane. Contradictory information exits about CO2 effects in methane oxidation. Cullis et al. [71] found little inhibition whereas Ribeiro et al. [72] found a strong inhibition above 0.5% volume CO2. Müller et al. [68] reported that adsorption of CO2 occurs to a much larger extent than the adsorption of O2 and H2O on Pd/Zr with stoichiometric mixture. Our results agree with the last work (see Table 11). The adsorption energies for CH4 are only slightly more negative than for H2O. In this sense water is an inhibitor of the CH4 adsorption and the possibility of Pd(OH) x formation cannot be ruled out. Water is well known to inhibit methane oxidation over palladium catalysts [31,63,71,73]. Our results of EHMO calculations would indicate Langmuir–Hinshelwood and Mars and van Krevelen mechanisms are probable, with similar energies. It agrees with Müller et al. [68], who found that in methane combustion at least 20% of CO2 is formed from a redox reaction, whereas the remaining amount may be produced via normal surface reaction between adsorbed carbon containing species and oxygen. The carbon formation is a proposed explanation for the decrease of activity. The possibility of stronger dehydrogenat ion cannot be ruled out in Pd, especially if O2 is at low concentrations. If O2 is not adsorbed in the neighborhood of CH4, the CH3Pd form can be further dehydrated. In this sense the result of dissociation of CH4 on Pd is very useful (see Table 6). This situation occurs when an stoichiometric amount of O is used. Probably with excess oxygen this effect is not acting (see Fig. 8). When chlorine was present, energies of CH4 dissociation are smaller and when chlorine is loosing (as HCl), anion vacancies are formed on the surface and they favor oxygen adsorption. Both situations lead to prevent carbon formation and it coincides with IR spectra and the change of color in p1 before and after the reaction. Several explanations could be applied to the color change in p1. An alternative one to the presented above would be the possibility of the occurrence of Mars and van Krevelen mechanism, especially because we used stoichoimetric mixture with low O content (2%). In this case, the water loss because reaction between H from methane dissociation and O from oxidized surface is a possibility. Results of EHMO calculation demonstrate that this reaction path is possible (E=−0.4eV). Therefore, a combined effect could be the cause of the color change: carbon formation and partial Pd reduction because Mars and van Krevelen mechanism. The profiles showed in Fig. 7 are easy to understand seeing the energies for chlorine loss (near −0.5eV). Higher temperatures are needed to avoid the undesirable effect of chlorine (blocking of adsorption sites for O2 and CH4 adsorption and dissociation). Residual amounts of chlorine do not affect the adsorption of water but the desorption energy of CO2 is not negative. Adsorption and dissociation of CH4 are difficulted by Cl, but desorption of CO2 is favored when Cl is present because lower adsorption energies of it (see Table 11). The net effect would be the increasing of conversion with temperature at temperatures higher than 400°C, when chlorine is lost. The chlorine loss would have two effects: amounts of carbon formed initially because CH4 dissociation and later oxidation of this C with O2 from the mixture. The strongly bonded chlorine would be responsible of the lower conversion in this catalyst. After ageing, the combined effects of chlorine loss and surface oxidation would increase the conversion as we can see in Fig. 8. Acknowledgements We are grateful to Professor Alfredo Juan of Universidad Nacional del Sur, Departamento de Fı́sica, for providing the modified version of ICONC and for he1pful advice. We thank the Universidad Nacional del Sur (UNS) and the Consejo Nacional de investigaciones Cientificas y Técnicas (CONICET) for their financial support. References [1] R. Hicks H. Qi M. Young R. Lee J. Catal. 122 1990 295 [2] L. Konopny A. Juan D. Damiani Appl. Catal. B 15 1998 115 [3] D. Simone T. Kenneily N. Brungard R. Farrauto Appl. Catal. 70 1991 87 [4] Y. Shen L. Cai J. Li S. Wang K. Huang Catal. Today 6 1989 47 [5] P. Marecot A. Fakche B. Kellali G. Mabilon M. Prigent J. Barbier Appl. Catal. B 3 1994 283 [6] N. Cant D. Angove M. Patterson Catal. Today 44 1998 93 [7] C. Cullis B. Willatt J. Catal. 86 1984 187 [8] H. Lieske G. Lietz H. Spendler J. Volter J. Catal. 81 1983 8 [9] J. Barbier D. Bahloul P, Marecot J. Catal. Lett. 8 1991 327 [10] E. Marceau M. Che J. Saint-Just J. Tatibouet Catal. Today 29 1996 415 [11] S. Peri C. Lund J. Catal. 152 1995 410 [12] H. Rodrı́guez Cárdenas, D. Damiani, in: C.H. Bartholomew, J.B. Butt (Eds.), Catalyst Deactivation, Elsevier, Amsterdam, 1991, p. 667. [13] J. Stencel, G. Goodman, B. Davis, in: M.J. Phillips, M. Ternan (Eds.), Proceedings of the 9th International Congress on Catalysis, Vol. 3, Calgary, 1988, Chemical Institute of Canada, Ottawa, p. 1291. [14] H. Miur, H. Hondou, K. Sugiyama, T. Matsuda, L. Gonzalez, in: M.J. Phillips, M. Ternan (Eds.), Proceedings of the 9th International Congress on Catalysis, Vol. 3, Calgary, 1988, Chemical Institute of Canada, Ottawa, p. 1291. [15] J. Anderson, Structure of Metallic Catalysts, Academic Press, New York, 1975, p. 296. [16] S. Robertson B. Mc Nicol J. de Baas S. Kloet J. Jenkins J. Catal. 37 1975 424 [17] D. Damiani E. Pérz Millán A. Rouco J. Catal. 101 1986 162 [18] R. Hoffmann J. Chem. Phys. 39 6 1963 1397 [19] R. Sumerville R. Hoffmann J. Am. Chem. Soc. 98 1976 23 [20] P. Hay J. Thibeault R. Hoffmann J. Am. Chem. Soc. 97 1975 4884 [21] I. Chamber L. Forrs G. Calzaferri J. Phys. Chem. 93 1989 5366 [22] A. Anderson R. Hoffmann J. Chem. Phys. 60 1974 4271 [23] W. Lotz J. Opt. Soc. Am. 60 1970 206 [24] A. Vela L. Gázquez J. Phys. Chem. 92 1985 5366 [25] I. Chamber L. Forrs G. Calzaferri J. Phys. Chem. 93 1989 5366 [26] M. Ferreira N. Castellani D. Damiani A. Juan J. Mol. Catal. A: Chem. 122 1997 25 [27] M. Ferreira D. Damiani A. Juan Comput. Mater. Sci. 9 1998 357 [28] R. Hicks H. Qi M. Young R. Lee J. Catal. 122 1990 280 [29] P. Briot M. Primet Appl. Catal. 68 1991 301 [30] E. Garbowsky C. Feumi-Jantou N. Mouaddib M. Primet Appl. Catal. A 109 1994 277 [31] F. Ribeiro M. Chow R. Dalla Betta J. Catal. 146 1994 277 [32] C. Cullis B. Willat J. Catal. 83 1983 267 [33] T. Ward P. Alemany R. Hoffmann J. Phys. Chem. 97 29 1993 7691 [34] A. Rochefort, J. Andzelm, N. Russo, D. Salahub, J. Am. Chem. Soc. 112 (23) 1990. [35] A.F. Wells, Structural Inorganic Chemistry, 5th Edition, Oxford Science Publications, Oxford, 1986. [36] C.-T. Au C.-F. Ng M.-S. Liao J. Catal. 185 1999 12 [37] M. Levan A. Hubbard J. Electroanal. Chem. 74 1976 253 [38] D. Klissrski J. Catal. 33 1974 149 [39] A. Ueno J. Hochmuth C. Bennett J. Catal. 49 1977 225 [40] E. Lesage-Rosenberg G. Vlaic H. Dexpert P. Legarde E. Freund Appl. Catal. 22 1986 21 [41] D. Lomot W. Juszcyk Z. Karpinsid F. Bozon-Verduraz New J. Chem. 21 1997 977 [42] D. Lomot W. Juszcyk Z. Karpinski F. Bozon-Verduraz J. Chem. Soc., Faraday Trans. 93 10 1997 2015 [43] G. Pecchi P. Reyes I. Concha J. Fierro J. Catal. 179 1998 309 [44] G.C. Bond R.R. Rajaram R. Burch Appl. Catal. 27 1986 379 [45] A. Juan D. Damiani J. Catal. 137 1992 77 [46] J. Goetz M. Volpe A. Sica C. Gigola R. Touroude J. Catal. 153 1995 86 [47] A. Pisanu, Thesis, U.N.S, 1998. [48] T. Hoost K. Otto Appl. Catal. A 92 1992 39 [49] H. Rodriguez Cárdenas, Thesis, U.N.S., 1987. [50] P. Koopman A. Kieboom H. Van Bekkum J. Catal. 69 1981 172 [51] F. Noronha M. Baldanza M. Schmal J. Catal. 188 1999 270 [52] A. Rakai D. Tessier F. Bozon-Verduraz New J. Chem. 16 1992 86 [53] S. Gerei E. Rozhkova Y. Gorokhovatsky J. Catal. 28 1973 341 [54] C. Nyberg C. Tengstal Surf. Sci. 126 1983 163 [55] J. Heras L. Viscido Catal. Rev. Sci. Eng. 30 2 1988 281 [56] E. Stuve S. Jorgensen R. Madix Surf. Sci. 146 1984 179 [57] C. Nyberg C. Tengstal J. Chem. Phys. 80 1984 3463 [58] S. Gerei E. Rozhkova Y. Gorokhovatsky J. Catal. 28 1973 341 [59] W. Herti R. Farrauto J. Catal. 29 1973 352 [60] M. Rosynek D. Magnuson J. Catal. 48 1977 417 [61] D. Konig W. Weber D. Poindexter J. McBride G. Graham K. Otto Catal. Lett. 29 1994 329 [62] N. Mouaddib C. Feumi-Jantou E. Garbowski M. Primet Appl. Catal. A 87 1992 129 [63] C. Cullis B. Willatt J. Catal. 83 1983 267 [64] Y. Yazawa H. Yoshida N. Takagi S. Komai A. Satsuma T. Hattori J. Catal. 187 1999 15 [65] K. Muto N. Katada M. Niwa Appl. Catal. A 134 1996 203 [66] M. Lyubovsky L. Pferfferle Appl. Catal. A 173 1998 107 [67] L. Haack K. Otto Catal. Lett. 34 1995 31 [68] C. Müller M. Maciejewski R. Koeppel A. Baiker Catal. Today 47 1999 245 [69] S. Oh P. Mitchell R. Siewert J. Catal. 132 1991 287 [70] J. Carstens S. Su A. Bell J. Catal. 176 1998 136 [71] C. Cullis T. Nevell D. Trimm J. Chem. Soc., Faraday Trans. 1 68 1972 1406 [72] F. Ribeiro M. Chow A. Dalla Betta J. Catal. 146 1994 537 [73] R. Burch P. Loader F. Urbano Catal. Today 27 1996 243",
      "scopus-id": "0035849445",
      "coredata": {
        "eid": "1-s2.0-S1381116901000784",
        "dc:description": "Studies of the methane oxidation on Pd/γ-Al2O3 catalysts with and without chloride were made. The reaction was investigated at temperatures in the range 20–500°C using stoichiometric reactant mixture. Dissociation of methane and oxygen and desorption of carbon dioxide and water on Pd catalysts have been investigated using a Molecular Orbital approach of the Extended Hückel type, including repulsion terms.",
        "openArchiveArticle": "false",
        "prism:coverDate": "2001-06-12",
        "openaccessUserLicense": null,
        "prism:aggregationType": "Journal",
        "prism:url": "https://api.elsevier.com/content/article/pii/S1381116901000784",
        "dc:creator": [
          {
            "@_fa": "true",
            "$": "Tonetto, G"
          },
          {
            "@_fa": "true",
            "$": "Ferreira, M.L"
          },
          {
            "@_fa": "true",
            "$": "Damiani, D.E"
          }
        ],
        "link": [
          {
            "@_fa": "true",
            "@rel": "self",
            "@href": "https://api.elsevier.com/content/article/pii/S1381116901000784"
          },
          {
            "@_fa": "true",
            "@rel": "scidir",
            "@href": "https://www.sciencedirect.com/science/article/pii/S1381116901000784"
          }
        ],
        "dc:format": "application/json",
        "openaccessType": null,
        "pii": "S1381-1169(01)00078-4",
        "prism:volume": "171",
        "prism:publisher": "Elsevier Science B.V.",
        "dc:title": "A combined theoretical and experimental study of the effects of residual chlorine on the behavior of Pd/γ-Al2O3 catalysts for methane oxidation",
        "prism:copyright": "Copyright © 2001 Elsevier Science B.V. All rights reserved.",
        "openaccess": "0",
        "prism:issn": "13811169",
        "prism:issueIdentifier": "1-2",
        "dcterms:subject": [
          {
            "@_fa": "true",
            "$": "Extended Hückel molecular orbital (EHMO) method"
          },
          {
            "@_fa": "true",
            "$": "Pd supported catalyst"
          }
        ],
        "openaccessArticle": "false",
        "prism:publicationName": "Journal of Molecular Catalysis A: Chemical",
        "prism:number": "1-2",
        "openaccessSponsorType": null,
        "prism:pageRange": "123-141",
        "prism:endingPage": "141",
        "pubType": "fla",
        "prism:coverDisplayDate": "12 June 2001",
        "prism:doi": "10.1016/S1381-1169(01)00078-4",
        "prism:startingPage": "123",
        "dc:identifier": "doi:10.1016/S1381-1169(01)00078-4",
        "openaccessSponsorName": null
      },
      "objects": {
        "object": [
          {
            "@category": "thumbnail",
            "@height": "46",
            "@width": "228",
            "@_fa": "true",
            "$": "https://api.elsevier.com/content/object/eid/1-s2.0-S1381116901000784-si4.gif?httpAccept=%2A%2F%2A",
            "@multimediatype": "GIF image file",
            "@type": "ALTIMG",
            "@size": "1239",
            "@ref": "si4",
            "@mimetype": "image/gif"
          },
          {
            "@category": "thumbnail",
            "@height": "12",
            "@width": "54",
            "@_fa": "true",
            "$": "https://api.elsevier.com/content/object/eid/1-s2.0-S1381116901000784-si3.gif?httpAccept=%2A%2F%2A",
            "@multimediatype": "GIF image file",
            "@type": "ALTIMG",
            "@size": "260",
            "@ref": "si3",
            "@mimetype": "image/gif"
          },
          {
            "@category": "thumbnail",
            "@height": "12",
            "@width": "53",
            "@_fa": "true",
            "$": "https://api.elsevier.com/content/object/eid/1-s2.0-S1381116901000784-si2.gif?httpAccept=%2A%2F%2A",
            "@multimediatype": "GIF image file",
            "@type": "ALTIMG",
            "@size": "252",
            "@ref": "si2",
            "@mimetype": "image/gif"
          },
          {
            "@category": "thumbnail",
            "@height": "12",
            "@width": "54",
            "@_fa": "true",
            "$": "https://api.elsevier.com/content/object/eid/1-s2.0-S1381116901000784-si1.gif?httpAccept=%2A%2F%2A",
            "@multimediatype": "GIF image file",
            "@type": "ALTIMG",
            "@size": "260",
            "@ref": "si1",
            "@mimetype": "image/gif"
          },
          {
            "@category": "thumbnail",
            "@height": "65",
            "@width": "125",
            "@_fa": "true",
            "$": "https://api.elsevier.com/content/object/eid/1-s2.0-S1381116901000784-gr1.sml?httpAccept=%2A%2F%2A",
            "@multimediatype": "GIF image file",
            "@type": "IMAGE-THUMBNAIL",
            "@size": "2040",
            "@ref": "gr1",
            "@mimetype": "image/gif"
          },
          {
            "@category": "standard",
            "@height": "215",
            "@width": "415",
            "@_fa": "true",
            "$": "https://api.elsevier.com/content/object/eid/1-s2.0-S1381116901000784-gr1.jpg?httpAccept=%2A%2F%2A",
            "@multimediatype": "JPEG image file",
            "@type": "IMAGE-DOWNSAMPLED",
            "@size": "34244",
            "@ref": "gr1",
            "@mimetype": "image/jpeg"
          },
          {
            "@category": "thumbnail",
            "@height": "71",
            "@width": "125",
            "@_fa": "true",
            "$": "https://api.elsevier.com/content/object/eid/1-s2.0-S1381116901000784-gr2.sml?httpAccept=%2A%2F%2A",
            "@multimediatype": "GIF image file",
            "@type": "IMAGE-THUMBNAIL",
            "@size": "1908",
            "@ref": "gr2",
            "@mimetype": "image/gif"
          },
          {
            "@category": "standard",
            "@height": "238",
            "@width": "417",
            "@_fa": "true",
            "$": "https://api.elsevier.com/content/object/eid/1-s2.0-S1381116901000784-gr2.jpg?httpAccept=%2A%2F%2A",
            "@multimediatype": "JPEG image file",
            "@type": "IMAGE-DOWNSAMPLED",
            "@size": "28539",
            "@ref": "gr2",
            "@mimetype": "image/jpeg"
          },
          {
            "@category": "thumbnail",
            "@height": "71",
            "@width": "125",
            "@_fa": "true",
            "$": "https://api.elsevier.com/content/object/eid/1-s2.0-S1381116901000784-gr3.sml?httpAccept=%2A%2F%2A",
            "@multimediatype": "GIF image file",
            "@type": "IMAGE-THUMBNAIL",
            "@size": "1981",
            "@ref": "gr3",
            "@mimetype": "image/gif"
          },
          {
            "@category": "standard",
            "@height": "238",
            "@width": "418",
            "@_fa": "true",
            "$": "https://api.elsevier.com/content/object/eid/1-s2.0-S1381116901000784-gr3.jpg?httpAccept=%2A%2F%2A",
            "@multimediatype": "JPEG image file",
            "@type": "IMAGE-DOWNSAMPLED",
            "@size": "27957",
            "@ref": "gr3",
            "@mimetype": "image/jpeg"
          },
          {
            "@category": "thumbnail",
            "@height": "65",
            "@width": "125",
            "@_fa": "true",
            "$": "https://api.elsevier.com/content/object/eid/1-s2.0-S1381116901000784-gr4.sml?httpAccept=%2A%2F%2A",
            "@multimediatype": "GIF image file",
            "@type": "IMAGE-THUMBNAIL",
            "@size": "1974",
            "@ref": "gr4",
            "@mimetype": "image/gif"
          },
          {
            "@category": "standard",
            "@height": "216",
            "@width": "416",
            "@_fa": "true",
            "$": "https://api.elsevier.com/content/object/eid/1-s2.0-S1381116901000784-gr4.jpg?httpAccept=%2A%2F%2A",
            "@multimediatype": "JPEG image file",
            "@type": "IMAGE-DOWNSAMPLED",
            "@size": "29645",
            "@ref": "gr4",
            "@mimetype": "image/jpeg"
          },
          {
            "@category": "thumbnail",
            "@height": "71",
            "@width": "125",
            "@_fa": "true",
            "$": "https://api.elsevier.com/content/object/eid/1-s2.0-S1381116901000784-gr5.sml?httpAccept=%2A%2F%2A",
            "@multimediatype": "GIF image file",
            "@type": "IMAGE-THUMBNAIL",
            "@size": "2056",
            "@ref": "gr5",
            "@mimetype": "image/gif"
          },
          {
            "@category": "standard",
            "@height": "238",
            "@width": "418",
            "@_fa": "true",
            "$": "https://api.elsevier.com/content/object/eid/1-s2.0-S1381116901000784-gr5.jpg?httpAccept=%2A%2F%2A",
            "@multimediatype": "JPEG image file",
            "@type": "IMAGE-DOWNSAMPLED",
            "@size": "28326",
            "@ref": "gr5",
            "@mimetype": "image/jpeg"
          },
          {
            "@category": "thumbnail",
            "@height": "65",
            "@width": "125",
            "@_fa": "true",
            "$": "https://api.elsevier.com/content/object/eid/1-s2.0-S1381116901000784-sc1.sml?httpAccept=%2A%2F%2A",
            "@multimediatype": "GIF image file",
            "@type": "IMAGE-THUMBNAIL",
            "@size": "942",
            "@ref": "sc1",
            "@mimetype": "image/gif"
          },
          {
            "@category": "standard",
            "@height": "78",
            "@width": "150",
            "@_fa": "true",
            "$": "https://api.elsevier.com/content/object/eid/1-s2.0-S1381116901000784-sc1.gif?httpAccept=%2A%2F%2A",
            "@multimediatype": "GIF image file",
            "@type": "IMAGE-DOWNSAMPLED",
            "@size": "1068",
            "@ref": "sc1",
            "@mimetype": "image/gif"
          },
          {
            "@category": "thumbnail",
            "@height": "93",
            "@width": "90",
            "@_fa": "true",
            "$": "https://api.elsevier.com/content/object/eid/1-s2.0-S1381116901000784-sc2.sml?httpAccept=%2A%2F%2A",
            "@multimediatype": "GIF image file",
            "@type": "IMAGE-THUMBNAIL",
            "@size": "1001",
            "@ref": "sc2",
            "@mimetype": "image/gif"
          },
          {
            "@category": "standard",
            "@height": "217",
            "@width": "209",
            "@_fa": "true",
            "$": "https://api.elsevier.com/content/object/eid/1-s2.0-S1381116901000784-sc2.gif?httpAccept=%2A%2F%2A",
            "@multimediatype": "GIF image file",
            "@type": "IMAGE-DOWNSAMPLED",
            "@size": "2858",
            "@ref": "sc2",
            "@mimetype": "image/gif"
          },
          {
            "@category": "thumbnail",
            "@height": "78",
            "@width": "125",
            "@_fa": "true",
            "$": "https://api.elsevier.com/content/object/eid/1-s2.0-S1381116901000784-sc3.sml?httpAccept=%2A%2F%2A",
            "@multimediatype": "GIF image file",
            "@type": "IMAGE-THUMBNAIL",
            "@size": "1026",
            "@ref": "sc3",
            "@mimetype": "image/gif"
          },
          {
            "@category": "standard",
            "@height": "204",
            "@width": "326",
            "@_fa": "true",
            "$": "https://api.elsevier.com/content/object/eid/1-s2.0-S1381116901000784-sc3.gif?httpAccept=%2A%2F%2A",
            "@multimediatype": "GIF image file",
            "@type": "IMAGE-DOWNSAMPLED",
            "@size": "3577",
            "@ref": "sc3",
            "@mimetype": "image/gif"
          },
          {
            "@category": "thumbnail",
            "@height": "64",
            "@width": "125",
            "@_fa": "true",
            "$": "https://api.elsevier.com/content/object/eid/1-s2.0-S1381116901000784-sc4.sml?httpAccept=%2A%2F%2A",
            "@multimediatype": "GIF image file",
            "@type": "IMAGE-THUMBNAIL",
            "@size": "899",
            "@ref": "sc4",
            "@mimetype": "image/gif"
          },
          {
            "@category": "standard",
            "@height": "174",
            "@width": "339",
            "@_fa": "true",
            "$": "https://api.elsevier.com/content/object/eid/1-s2.0-S1381116901000784-sc4.gif?httpAccept=%2A%2F%2A",
            "@multimediatype": "GIF image file",
            "@type": "IMAGE-DOWNSAMPLED",
            "@size": "3342",
            "@ref": "sc4",
            "@mimetype": "image/gif"
          },
          {
            "@category": "thumbnail",
            "@height": "63",
            "@width": "125",
            "@_fa": "true",
            "$": "https://api.elsevier.com/content/object/eid/1-s2.0-S1381116901000784-sc5.sml?httpAccept=%2A%2F%2A",
            "@multimediatype": "GIF image file",
            "@type": "IMAGE-THUMBNAIL",
            "@size": "755",
            "@ref": "sc5",
            "@mimetype": "image/gif"
          },
          {
            "@category": "standard",
            "@height": "162",
            "@width": "322",
            "@_fa": "true",
            "$": "https://api.elsevier.com/content/object/eid/1-s2.0-S1381116901000784-sc5.gif?httpAccept=%2A%2F%2A",
            "@multimediatype": "GIF image file",
            "@type": "IMAGE-DOWNSAMPLED",
            "@size": "2520",
            "@ref": "sc5",
            "@mimetype": "image/gif"
          },
          {
            "@category": "thumbnail",
            "@height": "30",
            "@width": "125",
            "@_fa": "true",
            "$": "https://api.elsevier.com/content/object/eid/1-s2.0-S1381116901000784-sc6.sml?httpAccept=%2A%2F%2A",
            "@multimediatype": "GIF image file",
            "@type": "IMAGE-THUMBNAIL",
            "@size": "706",
            "@ref": "sc6",
            "@mimetype": "image/gif"
          },
          {
            "@category": "standard",
            "@height": "119",
            "@width": "498",
            "@_fa": "true",
            "$": "https://api.elsevier.com/content/object/eid/1-s2.0-S1381116901000784-sc6.gif?httpAccept=%2A%2F%2A",
            "@multimediatype": "GIF image file",
            "@type": "IMAGE-DOWNSAMPLED",
            "@size": "5047",
            "@ref": "sc6",
            "@mimetype": "image/gif"
          },
          {
            "@category": "thumbnail",
            "@height": "94",
            "@width": "120",
            "@_fa": "true",
            "$": "https://api.elsevier.com/content/object/eid/1-s2.0-S1381116901000784-gr6.sml?httpAccept=%2A%2F%2A",
            "@multimediatype": "GIF image file",
            "@type": "IMAGE-THUMBNAIL",
            "@size": "1207",
            "@ref": "gr6",
            "@mimetype": "image/gif"
          },
          {
            "@category": "standard",
            "@height": "372",
            "@width": "477",
            "@_fa": "true",
            "$": "https://api.elsevier.com/content/object/eid/1-s2.0-S1381116901000784-gr6.gif?httpAccept=%2A%2F%2A",
            "@multimediatype": "GIF image file",
            "@type": "IMAGE-DOWNSAMPLED",
            "@size": "8284",
            "@ref": "gr6",
            "@mimetype": "image/gif"
          },
          {
            "@category": "thumbnail",
            "@height": "81",
            "@width": "125",
            "@_fa": "true",
            "$": "https://api.elsevier.com/content/object/eid/1-s2.0-S1381116901000784-gr7.sml?httpAccept=%2A%2F%2A",
            "@multimediatype": "GIF image file",
            "@type": "IMAGE-THUMBNAIL",
            "@size": "1089",
            "@ref": "gr7",
            "@mimetype": "image/gif"
          },
          {
            "@category": "standard",
            "@height": "292",
            "@width": "450",
            "@_fa": "true",
            "$": "https://api.elsevier.com/content/object/eid/1-s2.0-S1381116901000784-gr7.gif?httpAccept=%2A%2F%2A",
            "@multimediatype": "GIF image file",
            "@type": "IMAGE-DOWNSAMPLED",
            "@size": "6072",
            "@ref": "gr7",
            "@mimetype": "image/gif"
          },
          {
            "@category": "thumbnail",
            "@height": "75",
            "@width": "125",
            "@_fa": "true",
            "$": "https://api.elsevier.com/content/object/eid/1-s2.0-S1381116901000784-gr8.sml?httpAccept=%2A%2F%2A",
            "@multimediatype": "GIF image file",
            "@type": "IMAGE-THUMBNAIL",
            "@size": "1380",
            "@ref": "gr8",
            "@mimetype": "image/gif"
          },
          {
            "@category": "standard",
            "@height": "271",
            "@width": "450",
            "@_fa": "true",
            "$": "https://api.elsevier.com/content/object/eid/1-s2.0-S1381116901000784-gr8.gif?httpAccept=%2A%2F%2A",
            "@multimediatype": "GIF image file",
            "@type": "IMAGE-DOWNSAMPLED",
            "@size": "18381",
            "@ref": "gr8",
            "@mimetype": "image/gif"
          },
          {
            "@category": "thumbnail",
            "@height": "93",
            "@width": "74",
            "@_fa": "true",
            "$": "https://api.elsevier.com/content/object/eid/1-s2.0-S1381116901000784-gr9.sml?httpAccept=%2A%2F%2A",
            "@multimediatype": "GIF image file",
            "@type": "IMAGE-THUMBNAIL",
            "@size": "843",
            "@ref": "gr9",
            "@mimetype": "image/gif"
          },
          {
            "@category": "standard",
            "@height": "748",
            "@width": "597",
            "@_fa": "true",
            "$": "https://api.elsevier.com/content/object/eid/1-s2.0-S1381116901000784-gr9.gif?httpAccept=%2A%2F%2A",
            "@multimediatype": "GIF image file",
            "@type": "IMAGE-DOWNSAMPLED",
            "@size": "15960",
            "@ref": "gr9",
            "@mimetype": "image/gif"
          },
          {
            "@category": "thumbnail",
            "@height": "37",
            "@width": "125",
            "@_fa": "true",
            "$": "https://api.elsevier.com/content/object/eid/1-s2.0-S1381116901000784-sc7.sml?httpAccept=%2A%2F%2A",
            "@multimediatype": "GIF image file",
            "@type": "IMAGE-THUMBNAIL",
            "@size": "821",
            "@ref": "sc7",
            "@mimetype": "image/gif"
          },
          {
            "@category": "standard",
            "@height": "51",
            "@width": "172",
            "@_fa": "true",
            "$": "https://api.elsevier.com/content/object/eid/1-s2.0-S1381116901000784-sc7.gif?httpAccept=%2A%2F%2A",
            "@multimediatype": "GIF image file",
            "@type": "IMAGE-DOWNSAMPLED",
            "@size": "1114",
            "@ref": "sc7",
            "@mimetype": "image/gif"
          }
        ]
      },
      "link": {
        "@rel": "abstract",
        "@href": "https://api.elsevier.com/content/abstract/scopus_id/0035849445"
      }
    }
  }
}