{
  "metadata": {
    "title": "Synthesis of cyclic carbonates from carbon dioxide and epoxides over betaine-based catalysts",
    "authors": "; ; ",
    "journal": "Journal of Molecular Catalysis A: Chemical",
    "date": "2008-04-02",
    "doi": "10.1016/j.molcata.2008.01.010",
    "abstract": "",
    "uri": "https://api.elsevier.com/content/article/pii/S1381116908000095",
    "pii": "S1381116908000095"
  },
  "fulltext": {
    "full-text-retrieval-response": {
      "scopus-eid": "2-s2.0-40849092329",
      "originalText": "serial JL 271358 291210 291744 291790 291809 31 Journal of Molecular Catalysis A: Chemical JOURNALMOLECULARCATALYSISACHEMICAL 2008-01-16 2008-01-16 2010-03-29T10:57:16 1-s2.0-S1381116908000095 S1381-1169(08)00009-5 S1381116908000095 10.1016/j.molcata.2008.01.010 S300 S300.1 FULL-TEXT 1-s2.0-S1381116908X00032 2015-05-15T05:56:33.307883-04:00 0 0 20080402 2008 2008-01-16T00:00:00Z articleinfo crossmark dco dateupdated tomb dateloaded datesearch indexeddate issuelist volumelist yearnav absattachment articletitlenorm authfirstinitialnorm authfirstsurnamenorm cid cids contenttype copyright dateloadedtxt docsubtype doctype doi eid ewtransactionid hubeid issfirst issn issnnorm itemstage itemtransactionid itemweight openaccess openarchive pg pgfirst pglast pii piinorm pubdatestart pubdatetxt pubyr sortorder srctitle srctitlenorm srctype subheadings volfirst volissue webpdf webpdfpagecount figure table body acknowledge affil articletitle auth authfirstini authfull authkeywords authlast primabst ref specialabst alllist content subj ssids 1381-1169 13811169 284 284 1 2 1 2 Volume 284, Issues 1–2 10 52 57 52 57 20080402 2 April 2008 2008-04-02 2008 article fla Copyright © 2008 Elsevier B.V. All rights reserved. SYNTHESISCYCLICCARBONATESCARBONDIOXIDEEPOXIDESOVERBETAINEBASEDCATALYSTS ZHOU Y 1 Introduction 2 Experimental 2.1 Materials and instruments 2.2 Preparation of betaine-based salts 2.3 Typical cycloaddition procedure 3 Results and discussion 3.1 Synthesis of propylene carbonate (2a) from CO2 and propylene oxide (1a) 3.2 Synthesis of cyclic carbonates from CO2 and other epoxides 3.3 Proposed mechanism of coupling reaction 4 Conclusion Acknowledgements References GILBSON 1996 2063 D ARAKAWA 2001 953 H ANASTAS 2003 G29 P SONG 2006 2 C SHAIKH 1996 951 A CLEMENTS 2003 663 J PARRISH 2000 8207 J BAYARDON 2007 5971 J KIHARE 1993 6198 M HUANG 2003 6705 J ZHAO 1999 3047 T YANO 1997 1129 T YAMAGUCHI 1999 4526 K TU 2001 85 M BHANAGE 2001 259 B CALO 2002 2561 V WANG 2006 143 J YASUDA 2005 119 H AIDA 1983 1304 T SHEN 2004 3080 Y SIT 2005 8583 W JIANG 2005 381 J KIM 2003 678 H ALLEN 2002 14284 S DU 2005 518 Y PENG 2001 639 J KAWANAMI 2003 896 H YANG 2002 274 H XIE 2006 30 H XIE 2005 1199 H ZHU 2007 169 A NOCKEMANN 2007 5254 P LU 2004 73 X IWASAKI 2000 713 T ZHOUX2008X52 ZHOUX2008X52X57 ZHOUX2008X52XY ZHOUX2008X52X57XY item S1381-1169(08)00009-5 S1381116908000095 1-s2.0-S1381116908000095 10.1016/j.molcata.2008.01.010 271358 2010-10-11T07:02:40.044762-04:00 2008-04-02 1-s2.0-S1381116908000095-main.pdf https://s3.amazonaws.com/prod-ucs-content-store-us-east/content/pii:S1381116908000095/MAIN/application/pdf/0cacba7fa57f216a3012d8be9c065011/main.pdf https://s3-eu-west-1.amazonaws.com/prod-ucs-content-store-eu-west/content/pii:S1381116908000095/MAIN/application/pdf/0cacba7fa57f216a3012d8be9c065011/main.pdf main.pdf pdf true 448715 MAIN 6 1-s2.0-S1381116908000095-main_1.png https://s3.amazonaws.com/prod-ucs-content-store-us-east/content/pii:S1381116908000095/PREVIEW/image/png/af5173a35f73d996b1ffae10368f303d/main_1.png https://s3-eu-west-1.amazonaws.com/prod-ucs-content-store-eu-west/content/pii:S1381116908000095/PREVIEW/image/png/af5173a35f73d996b1ffae10368f303d/main_1.png main_1.png png 71252 849 656 IMAGE-WEB-PDF 1 1-s2.0-S1381116908000095-sc1.jpg https://s3.amazonaws.com/prod-ucs-content-store-us-east/content/pii:S1381116908000095/sc1/DOWNSAMPLED/image/jpeg/2ce50e2ba6bca20e6fcc3c80da8e2259/sc1.jpg https://s3-eu-west-1.amazonaws.com/prod-ucs-content-store-eu-west/content/pii:S1381116908000095/sc1/DOWNSAMPLED/image/jpeg/2ce50e2ba6bca20e6fcc3c80da8e2259/sc1.jpg sc1 sc1.jpg jpg 5568 90 301 IMAGE-DOWNSAMPLED 1-s2.0-S1381116908000095-sc1.sml https://s3.amazonaws.com/prod-ucs-content-store-us-east/content/pii:S1381116908000095/sc1/THUMBNAIL/image/gif/14367268e721f5709a01f0963a25bc82/sc1.sml https://s3-eu-west-1.amazonaws.com/prod-ucs-content-store-eu-west/content/pii:S1381116908000095/sc1/THUMBNAIL/image/gif/14367268e721f5709a01f0963a25bc82/sc1.sml sc1 sc1.sml sml 660 37 125 IMAGE-THUMBNAIL 1-s2.0-S1381116908000095-sc2.jpg https://s3.amazonaws.com/prod-ucs-content-store-us-east/content/pii:S1381116908000095/sc2/DOWNSAMPLED/image/jpeg/939ee8484e8ad8890d4e620538b74b9e/sc2.jpg https://s3-eu-west-1.amazonaws.com/prod-ucs-content-store-eu-west/content/pii:S1381116908000095/sc2/DOWNSAMPLED/image/jpeg/939ee8484e8ad8890d4e620538b74b9e/sc2.jpg sc2 sc2.jpg jpg 8452 99 334 IMAGE-DOWNSAMPLED 1-s2.0-S1381116908000095-sc2.sml https://s3.amazonaws.com/prod-ucs-content-store-us-east/content/pii:S1381116908000095/sc2/THUMBNAIL/image/gif/4c0968879f4eed139cbd7a510f58e08c/sc2.sml https://s3-eu-west-1.amazonaws.com/prod-ucs-content-store-eu-west/content/pii:S1381116908000095/sc2/THUMBNAIL/image/gif/4c0968879f4eed139cbd7a510f58e08c/sc2.sml sc2 sc2.sml sml 785 37 125 IMAGE-THUMBNAIL 1-s2.0-S1381116908000095-sc3.jpg https://s3.amazonaws.com/prod-ucs-content-store-us-east/content/pii:S1381116908000095/sc3/DOWNSAMPLED/image/jpeg/7e55b9874c846946e6219b9174ca1ff1/sc3.jpg https://s3-eu-west-1.amazonaws.com/prod-ucs-content-store-eu-west/content/pii:S1381116908000095/sc3/DOWNSAMPLED/image/jpeg/7e55b9874c846946e6219b9174ca1ff1/sc3.jpg sc3 sc3.jpg jpg 7370 115 317 IMAGE-DOWNSAMPLED 1-s2.0-S1381116908000095-sc3.sml https://s3.amazonaws.com/prod-ucs-content-store-us-east/content/pii:S1381116908000095/sc3/THUMBNAIL/image/gif/27a14128404b41f22b5c011caf9a0f0c/sc3.sml https://s3-eu-west-1.amazonaws.com/prod-ucs-content-store-eu-west/content/pii:S1381116908000095/sc3/THUMBNAIL/image/gif/27a14128404b41f22b5c011caf9a0f0c/sc3.sml sc3 sc3.sml sml 791 45 125 IMAGE-THUMBNAIL 1-s2.0-S1381116908000095-sc4.jpg https://s3.amazonaws.com/prod-ucs-content-store-us-east/content/pii:S1381116908000095/sc4/DOWNSAMPLED/image/jpeg/4a72210d4905d98505cd9f752c7bf654/sc4.jpg https://s3-eu-west-1.amazonaws.com/prod-ucs-content-store-eu-west/content/pii:S1381116908000095/sc4/DOWNSAMPLED/image/jpeg/4a72210d4905d98505cd9f752c7bf654/sc4.jpg sc4 sc4.jpg jpg 16960 352 384 IMAGE-DOWNSAMPLED 1-s2.0-S1381116908000095-sc4.sml https://s3.amazonaws.com/prod-ucs-content-store-us-east/content/pii:S1381116908000095/sc4/THUMBNAIL/image/gif/dad2c2ecf70b82cf8d024c5c6256b28b/sc4.sml https://s3-eu-west-1.amazonaws.com/prod-ucs-content-store-eu-west/content/pii:S1381116908000095/sc4/THUMBNAIL/image/gif/dad2c2ecf70b82cf8d024c5c6256b28b/sc4.sml sc4 sc4.sml sml 1061 93 102 IMAGE-THUMBNAIL 1-s2.0-S1381116908000095-gr1.jpg https://s3.amazonaws.com/prod-ucs-content-store-us-east/content/pii:S1381116908000095/gr1/DOWNSAMPLED/image/jpeg/a3d01e7837fdc933e541b4c44e684355/gr1.jpg https://s3-eu-west-1.amazonaws.com/prod-ucs-content-store-eu-west/content/pii:S1381116908000095/gr1/DOWNSAMPLED/image/jpeg/a3d01e7837fdc933e541b4c44e684355/gr1.jpg gr1 gr1.jpg jpg 31860 291 339 IMAGE-DOWNSAMPLED 1-s2.0-S1381116908000095-gr1.sml https://s3.amazonaws.com/prod-ucs-content-store-us-east/content/pii:S1381116908000095/gr1/THUMBNAIL/image/gif/35889b7fd54cafd2220f254d7e7870ab/gr1.sml https://s3-eu-west-1.amazonaws.com/prod-ucs-content-store-eu-west/content/pii:S1381116908000095/gr1/THUMBNAIL/image/gif/35889b7fd54cafd2220f254d7e7870ab/gr1.sml gr1 gr1.sml sml 4687 93 109 IMAGE-THUMBNAIL 1-s2.0-S1381116908000095-gr2.jpg https://s3.amazonaws.com/prod-ucs-content-store-us-east/content/pii:S1381116908000095/gr2/DOWNSAMPLED/image/jpeg/1d1aef66421d8110f1ebd51606ca025d/gr2.jpg https://s3-eu-west-1.amazonaws.com/prod-ucs-content-store-eu-west/content/pii:S1381116908000095/gr2/DOWNSAMPLED/image/jpeg/1d1aef66421d8110f1ebd51606ca025d/gr2.jpg gr2 gr2.jpg jpg 51300 555 633 IMAGE-DOWNSAMPLED 1-s2.0-S1381116908000095-gr2.sml https://s3.amazonaws.com/prod-ucs-content-store-us-east/content/pii:S1381116908000095/gr2/THUMBNAIL/image/gif/db1e5aee8ac3028a4551b48f5cbb2282/gr2.sml https://s3-eu-west-1.amazonaws.com/prod-ucs-content-store-eu-west/content/pii:S1381116908000095/gr2/THUMBNAIL/image/gif/db1e5aee8ac3028a4551b48f5cbb2282/gr2.sml gr2 gr2.sml sml 1283 93 106 IMAGE-THUMBNAIL 1-s2.0-S1381116908000095-fx1.jpg https://s3.amazonaws.com/prod-ucs-content-store-us-east/content/pii:S1381116908000095/fx1/DOWNSAMPLED/image/jpeg/f7264aadd01613e5751e25372d7b5ae8/fx1.jpg https://s3-eu-west-1.amazonaws.com/prod-ucs-content-store-eu-west/content/pii:S1381116908000095/fx1/DOWNSAMPLED/image/jpeg/f7264aadd01613e5751e25372d7b5ae8/fx1.jpg fx1 true fx1.jpg jpg 4441 72 269 IMAGE-DOWNSAMPLED 1-s2.0-S1381116908000095-fx1.sml https://s3.amazonaws.com/prod-ucs-content-store-us-east/content/pii:S1381116908000095/fx1/THUMBNAIL/image/gif/9d899d1aa2f3166d3c7b66b6da109033/fx1.sml https://s3-eu-west-1.amazonaws.com/prod-ucs-content-store-eu-west/content/pii:S1381116908000095/fx1/THUMBNAIL/image/gif/9d899d1aa2f3166d3c7b66b6da109033/fx1.sml fx1 true fx1.sml sml 638 33 125 IMAGE-THUMBNAIL 1-s2.0-S1381116908000095-fx2.gif https://s3.amazonaws.com/prod-ucs-content-store-us-east/content/pii:S1381116908000095/fx2/DOWNSAMPLED/image/gif/d8a21babedd758bedcab175af8e3f482/fx2.gif https://s3-eu-west-1.amazonaws.com/prod-ucs-content-store-eu-west/content/pii:S1381116908000095/fx2/DOWNSAMPLED/image/gif/d8a21babedd758bedcab175af8e3f482/fx2.gif fx2 fx2.gif gif 374 37 53 IMAGE-DOWNSAMPLED 1-s2.0-S1381116908000095-fx2.sml https://s3.amazonaws.com/prod-ucs-content-store-us-east/content/pii:S1381116908000095/fx2/THUMBNAIL/image/gif/06c3bc4c893c8e6d3f0a021cd2b96f90/fx2.sml https://s3-eu-west-1.amazonaws.com/prod-ucs-content-store-eu-west/content/pii:S1381116908000095/fx2/THUMBNAIL/image/gif/06c3bc4c893c8e6d3f0a021cd2b96f90/fx2.sml fx2 fx2.sml sml 961 87 125 IMAGE-THUMBNAIL 1-s2.0-S1381116908000095-fx3.gif https://s3.amazonaws.com/prod-ucs-content-store-us-east/content/pii:S1381116908000095/fx3/DOWNSAMPLED/image/gif/4a33ea76bd69e53e64bcad922fb59385/fx3.gif https://s3-eu-west-1.amazonaws.com/prod-ucs-content-store-eu-west/content/pii:S1381116908000095/fx3/DOWNSAMPLED/image/gif/4a33ea76bd69e53e64bcad922fb59385/fx3.gif fx3 fx3.gif gif 613 75 58 IMAGE-DOWNSAMPLED 1-s2.0-S1381116908000095-fx3.sml https://s3.amazonaws.com/prod-ucs-content-store-us-east/content/pii:S1381116908000095/fx3/THUMBNAIL/image/gif/9b39f80bad35e66f74019a311215e027/fx3.sml https://s3-eu-west-1.amazonaws.com/prod-ucs-content-store-eu-west/content/pii:S1381116908000095/fx3/THUMBNAIL/image/gif/9b39f80bad35e66f74019a311215e027/fx3.sml fx3 fx3.sml sml 792 93 72 IMAGE-THUMBNAIL 1-s2.0-S1381116908000095-fx4.gif https://s3.amazonaws.com/prod-ucs-content-store-us-east/content/pii:S1381116908000095/fx4/DOWNSAMPLED/image/gif/0f6a6face37036b67c9d94d1e34237a8/fx4.gif https://s3-eu-west-1.amazonaws.com/prod-ucs-content-store-eu-west/content/pii:S1381116908000095/fx4/DOWNSAMPLED/image/gif/0f6a6face37036b67c9d94d1e34237a8/fx4.gif fx4 fx4.gif gif 401 38 53 IMAGE-DOWNSAMPLED 1-s2.0-S1381116908000095-fx4.sml https://s3.amazonaws.com/prod-ucs-content-store-us-east/content/pii:S1381116908000095/fx4/THUMBNAIL/image/gif/8d7c320eafe2b6c6e245f758c2cc3545/fx4.sml https://s3-eu-west-1.amazonaws.com/prod-ucs-content-store-eu-west/content/pii:S1381116908000095/fx4/THUMBNAIL/image/gif/8d7c320eafe2b6c6e245f758c2cc3545/fx4.sml fx4 fx4.sml sml 1048 89 125 IMAGE-THUMBNAIL 1-s2.0-S1381116908000095-fx5.gif https://s3.amazonaws.com/prod-ucs-content-store-us-east/content/pii:S1381116908000095/fx5/DOWNSAMPLED/image/gif/6a19b6986a4d7e1d14fa66aaa9c1d1c4/fx5.gif https://s3-eu-west-1.amazonaws.com/prod-ucs-content-store-eu-west/content/pii:S1381116908000095/fx5/DOWNSAMPLED/image/gif/6a19b6986a4d7e1d14fa66aaa9c1d1c4/fx5.gif fx5 fx5.gif gif 650 41 88 IMAGE-DOWNSAMPLED 1-s2.0-S1381116908000095-fx5.sml https://s3.amazonaws.com/prod-ucs-content-store-us-east/content/pii:S1381116908000095/fx5/THUMBNAIL/image/gif/314b140ee0ccbf12eb837d86ec048f69/fx5.sml https://s3-eu-west-1.amazonaws.com/prod-ucs-content-store-eu-west/content/pii:S1381116908000095/fx5/THUMBNAIL/image/gif/314b140ee0ccbf12eb837d86ec048f69/fx5.sml fx5 fx5.sml sml 1009 58 125 IMAGE-THUMBNAIL 1-s2.0-S1381116908000095-fx6.gif https://s3.amazonaws.com/prod-ucs-content-store-us-east/content/pii:S1381116908000095/fx6/DOWNSAMPLED/image/gif/8bbce467c4c700676ce9082a3a5c6bda/fx6.gif https://s3-eu-west-1.amazonaws.com/prod-ucs-content-store-eu-west/content/pii:S1381116908000095/fx6/DOWNSAMPLED/image/gif/8bbce467c4c700676ce9082a3a5c6bda/fx6.gif fx6 fx6.gif gif 568 58 68 IMAGE-DOWNSAMPLED 1-s2.0-S1381116908000095-fx6.sml https://s3.amazonaws.com/prod-ucs-content-store-us-east/content/pii:S1381116908000095/fx6/THUMBNAIL/image/gif/8faafa2ff7ef068a3bc46fa36418ce33/fx6.sml https://s3-eu-west-1.amazonaws.com/prod-ucs-content-store-eu-west/content/pii:S1381116908000095/fx6/THUMBNAIL/image/gif/8faafa2ff7ef068a3bc46fa36418ce33/fx6.sml fx6 fx6.sml sml 1013 93 110 IMAGE-THUMBNAIL 1-s2.0-S1381116908000095-fx7.gif https://s3.amazonaws.com/prod-ucs-content-store-us-east/content/pii:S1381116908000095/fx7/DOWNSAMPLED/image/gif/c7beab96cb0d4481330b7d3b882f2226/fx7.gif https://s3-eu-west-1.amazonaws.com/prod-ucs-content-store-eu-west/content/pii:S1381116908000095/fx7/DOWNSAMPLED/image/gif/c7beab96cb0d4481330b7d3b882f2226/fx7.gif fx7 fx7.gif gif 815 87 80 IMAGE-DOWNSAMPLED 1-s2.0-S1381116908000095-fx7.sml https://s3.amazonaws.com/prod-ucs-content-store-us-east/content/pii:S1381116908000095/fx7/THUMBNAIL/image/gif/8207c9cdba395bf06827140499d00893/fx7.sml https://s3-eu-west-1.amazonaws.com/prod-ucs-content-store-eu-west/content/pii:S1381116908000095/fx7/THUMBNAIL/image/gif/8207c9cdba395bf06827140499d00893/fx7.sml fx7 fx7.sml sml 896 94 86 IMAGE-THUMBNAIL 1-s2.0-S1381116908000095-fx8.gif https://s3.amazonaws.com/prod-ucs-content-store-us-east/content/pii:S1381116908000095/fx8/DOWNSAMPLED/image/gif/2328ac8ed6552280577a7446f90ddb68/fx8.gif https://s3-eu-west-1.amazonaws.com/prod-ucs-content-store-eu-west/content/pii:S1381116908000095/fx8/DOWNSAMPLED/image/gif/2328ac8ed6552280577a7446f90ddb68/fx8.gif fx8 fx8.gif gif 636 54 91 IMAGE-DOWNSAMPLED 1-s2.0-S1381116908000095-fx8.sml https://s3.amazonaws.com/prod-ucs-content-store-us-east/content/pii:S1381116908000095/fx8/THUMBNAIL/image/gif/4e6af2fb82f65e8d90117c43d7eaa984/fx8.sml https://s3-eu-west-1.amazonaws.com/prod-ucs-content-store-eu-west/content/pii:S1381116908000095/fx8/THUMBNAIL/image/gif/4e6af2fb82f65e8d90117c43d7eaa984/fx8.sml fx8 fx8.sml sml 957 74 125 IMAGE-THUMBNAIL 1-s2.0-S1381116908000095-fx9.gif https://s3.amazonaws.com/prod-ucs-content-store-us-east/content/pii:S1381116908000095/fx9/DOWNSAMPLED/image/gif/87eb3d7418f7d25163409ab8cbd1086a/fx9.gif https://s3-eu-west-1.amazonaws.com/prod-ucs-content-store-eu-west/content/pii:S1381116908000095/fx9/DOWNSAMPLED/image/gif/87eb3d7418f7d25163409ab8cbd1086a/fx9.gif fx9 fx9.gif gif 863 82 101 IMAGE-DOWNSAMPLED 1-s2.0-S1381116908000095-fx9.sml https://s3.amazonaws.com/prod-ucs-content-store-us-east/content/pii:S1381116908000095/fx9/THUMBNAIL/image/gif/5d58fb953e4f8c2163076326ad049347/fx9.sml https://s3-eu-west-1.amazonaws.com/prod-ucs-content-store-eu-west/content/pii:S1381116908000095/fx9/THUMBNAIL/image/gif/5d58fb953e4f8c2163076326ad049347/fx9.sml fx9 fx9.sml sml 1001 93 114 IMAGE-THUMBNAIL MOLCAA 7052 S1381-1169(08)00009-5 10.1016/j.molcata.2008.01.010 Elsevier B.V. Fig. 1 The photographs of the reaction mixtures after the cycloadditions of PO with CO2 catalyzed by betaine-based salts. Fig. 2 The effects of different parameters on the yields of PC catalyzed by HBetI. (a) The influence of temperature. Other conditions: HBetI (2.5mol%), CO2 8MPa, 8h. (b) The influence of pressure of CO2. Other conditions: HBetI (2.5mol%), 140°C, 8h. (c) The influence of the amount of catalyst. (d) The influence of reaction time. Other conditions: CO2 8MPa, 140°C, 8h. Other conditions: HBetI (2.5mol%), CO2 8MPa, 140°C. Scheme 1 The structures of betaine and choline cation. Scheme 2 Preparation of betaine-based salts (protonation): Bet (1.172g, 10mmol), HX (12mmol), anhydrous ethanol, room temperature, 2h. Scheme 3 Coupling of epoxides and CO2. Scheme 4 The assumed reaction mechanism for the cycloaddition of epoxide with CO2 catalyzed by HBetX. Table 1 Coupling of CO2 and propylene oxide catalyzed by different catalysts a Entry Catalysts Yield (%) 1 None 0 2 Bet 0 3 HBetCl 94 4 HBetBr 76 5 HBetI 98 6 HBetBF4 74 7 HBetPF6 20 8 ChoCl 83 9 N(Bu)4Br 88 10 N(Me)4Cl 2 11 b N(Bu)4Br+CH3COOH 91 12 c HBetI 99 13 d HBetI 96 a Typical reaction conditions: a stainless steel autoclave of 6mL; 10mmol of PO with 2.5mol% catalyst; temperature, 140°C; pressure, 8MPa; time, 8h. b 2.5mol% CH3COOH. c The 2nd use of the catalyst in Entry 5. d The 3rd use of the catalyst in Entry 5. Table 2 Reactions of different epoxides with CO2 in the presence of HBetI a Entry Epoxides Products Time (h) Yield (%) 1 1a 2a 8 98 2 1b 2b 8 34 24 85 3 1c 2c 8 96 4 1d 2d 8 99 a Reaction conditions: epoxide, 10mmol; catalyst/epoxide, 2.5mol%; temperature, 140°C, pressure, 8MPa; time, 8h. Synthesis of cyclic carbonates from carbon dioxide and epoxides over betaine-based catalysts Yinxi Zhou Suqin Hu Xiumin Ma Shuguang Liang Tao Jiang ⁎ Buxing Han ⁎ Beijing National Laboratory for Molecular Sciences (BNLMS), Centre for Molecular Science, Institute of Chemistry, Chinese Academy of Sciences, Beijing 100080, China ⁎ Corresponding authors. Tel.: +86 10 62562821; fax: +86 10 62562821. Graphical abstract A series of betaine-based salts were synthesized by direct protonation of anhydrous betaine. The catalytic activity of these salts for coupling of CO2 and epoxides was studied. It was demonstrated that the carboxylic acid group in the catalyst had synergetic effect with halide anion, and high yield and excellent selectivity could be achieved at optimized condition. A series of betaine-based salts containing quaternary ammonium ion and carboxylic acid group were synthesized by direct protonation of anhydrous betaine using different Brønsted acids. The catalytic activity of these salts for the synthesis of cyclic carbonates via cycloaddition reaction of CO2 with epoxides was studied. The effects of anions of the salts, reaction temperature, pressure, reaction time, and the amount of catalyst used on the reaction were studied. It was demonstrated that the carboxylic acid group in the catalyst had synergetic effect with halide anion, and high yield of cyclic carbonates and excellent selectivity could be achieved at optimized condition. Keywords Betaine-based salts Carbon dioxide Cyclic carbonates Epoxides Cycloaddition 1 Introduction CO2 is a renewable carbon resource, which is cheap, safe, abundant, and non-toxic. As an important C1 building block, its chemical conversion into useful organic compounds has attracted intense attention [1–4]. Synthesis of cyclic carbonates via the cycloaddition of CO2 with epoxides is one of the most attractive routes. Cyclic carbonates have been widely used not only as polar aprotic solvents in organic and polymeric synthesis, but also as ingredients for pharmaceutical/fine chemicals in biomedical synthesis [5–8]. Various homogeneous and heterogeneous catalysts have been developed to catalyze the reaction, including alkali metal salts [9–11], metal oxides [12–15], quaternary ammonium salts [16–18], Schiff base [19–20], transition metal complex [21–24], ion-exchange resins [25]. Ionic liquids (ILs) have also been used as the catalysts [26–30], and it has been demonstrated that [C8-mim]+[BF4]− was very active and selective for the reaction [27]. The processes to employ homogeneous catalysts, such as quaternary ammonium salts (e.g., NEt4Br) or alkali halides (e.g., NaI or KI) that are dissolved in cyclic carbonate-rich phase, are undesirable in industry because separation of the catalysts from the reaction mixtures is complex, energy consumable and may result in the decomposition of the catalysts. Although several heterogeneous catalysts have been reported, the development of more efficient catalysts for the synthesis of cyclic carbonates under mild conditions is still an interesting topic. In many previous researches, quaternary ammonium salts or alkali metal halides are typically used as the homogeneous catalysts for cyclic carbonate synthesis [18,31,32]. Shi et al. found that phenol could act as a Brønsted acid to accelerate the ring-opening reaction of epoxides through hydrogen bonding in the presence of NaI/PPh3/phenol without using any organic solvents [10]. In our previous work, we found that choline chloride/urea could be utilized to catalyze the cycloaddition of epoxides and CO2, and the hydroxyl group in choline chloride could activate the epoxides through hydrogen bonding [33]. Betaine (Bet, Scheme 1 ) or trimethylglycine is one of the quaternary ammonium alkaloids that have a zwitterionic structure, and it is an inner salt. Its chemical name is 1-carboxy-N,N,N-trimethylmethanaminium inner salt. Betaine has a sweet taste and is soluble in water. It exists widely in plants and animals. Betaine is a metabolite of choline and a substrate in the recycling routes that convert homocysteine to l-methionine. Betaine-based salts, which are formed through the reaction of the zwitterionic betaine with Brønsted acids, contain several functional groups, such as the quaternary ammonium cation, nucleophilic anion and carboxylic acid. The chemical name of betaine hydrochloride is 1-carboxy-N,N,N-trimethylmethanaminium chloride. Both betaine and betaine hydrochloride are available as dietary supplements. Betaine is a biodegrade, harmless and cheap raw material. The hydroxyl group in choline cation is replaced by a carboxylic acid group in betaine (Scheme 1). Compared with hydroxyl group, the carboxylic acid group is undoubtedly a stronger Brønsted acid and hydrogen bonding donor. In this paper, we report several efficient betaine-based catalysts for the cycloaddition of CO2 with epoxides. These catalysts are composed of betaine cation and Cl−, Br−, I−, BF4 −, or PF6 −, which can be prepared simply by protonation of anhydrous betaine. The effects of anions and reaction parameters on the yields and selectivity were studied. The results demonstrated that the carboxylic acid group of the catalysts could accelerate the ring opening of epoxides and showed a co-operative effect with halide anions. 2 Experimental 2.1 Materials and instruments CO2 was purchased from Beijing Analytical Instrument Factory with a purity of 99.995%. Propylene oxide, hydrochloric acid, hydrobromic acid, hydroiodic acid, tetrafluoroboric acid and hexafluorophosphate acid were A.R. grade and produced by Beijing Chemical Reagents Company. Other epoxides were purchased from ACROS ORGANICS. Anhydrous betaine was purified by recrystallization with anhydrous ethanol. Styrene oxide was purified by distillation under reduced pressure. Other chemicals were used without further purification. 1H NMR spectra were recorded on a Bruker 400MHz NMR spectrometer with TMS as the internal standard. Decomposition temperature (T dec) was determined by NETZSCH STA 409 PC/PG thermogravimetric analysis (TGA) system in N2 atmosphere with a heating rate of 10°C/min. FTIR spectra were determined using a Bruker Tensor 27 spectrometer. The samples were prepared by KBr pellet method. The products were analyzed by a gas chromatography (GC, Agilent 4890D) equipped with a flame-ionized detector. 2.2 Preparation of betaine-based salts The betaine-based salts were prepared by protonation of anhydrous betaine [34]. We only describe the procedures to synthesize betaine hydroiodide (HBetI) because those to prepare other betaine-based salts are similar. The main difference was that corresponding acids were used when preparing other salts. In a typical experiment, 15mL of anhydrous ethanol and 1.172g of anhydrous betaine (10mmol) were loaded into a 50-mL flask at room temperature. Then, 12mmol of HI dissolved in 5mL of ethanol was added slowly into the flask under vigorous stirring. The reaction lasted for 2h. The reaction mixture was evaporated under reduced pressure. The remaining solid was washed with ethyl acetate until the color became white, then the product was dried under vacuum for 6h at 30°C. The total yield of HBetI was 93.1%. TGA study showed that the decomposition temperature (T dec) of HBetI was 245°C. Other characterizations of HBetI were provided as follows: IR, 1641, 1738, 2835, 2968, and 3438cm−1. 1H NMR (400MHz, D2O); δ (ppm), 4.16–4.18 (m, 2H), 3.41 (s, 9H). 2.3 Typical cycloaddition procedure All cycloadditions were conducted in a 6-mL stainless steel autoclave equipped with a magnetic stirrer. The desired amount of catalyst and epoxide were added into the autoclave. After being sealed, the reactor was put into a constant temperature air bath. CO2 was then introduced into the reactor using a high-pressure pump until desired pressure was reached, and the stirrer was started. After the reaction was completed, the reactor was cooled to 0°C quickly in ice water and depressurized by releasing the gas slowly through an absorbing tube (also put in ice water) containing N,N-dimethyl formamide (DMF) to capture the reactants and products entrained by CO2. After depressurization, the catalyst was separated from the reaction mixture by centrifugation. Then DMF in the absorbing tube was mixed with the reaction mixture. The mixture was analyzed by GC using n-butyl alcohol as the internal standard. The purity and structure of the product obtained at some typical experimental conditions were also checked by 1H NMR and GC–MS. The solid products of other epoxides were analyzed at room temperature on a Bruker 400MHz NMR spectrometer using CDCl3 as the solvent. In the experiments to test the reusability of the catalyst, the catalyst was recovered by distillation at reduced pressure, and was used for the next run. Spectral characterizations of the products (cyclic carbonates 2b–d) were provided as follows: Hexahydro-benzo[1,3]-dioxolan-2-one (2b): 1H NMR (CDCl3, 400MHz); δ (ppm): 1.38–1.46 (m, 2H), 1.58–1.63 (m, 2H), 1.88–1.92 (m, 4H), 4.66–4.71 (m, 2H); 4-Phenyl-1,3-dioxolan-2-one (2c): 1H NMR (CDCl3, 400MHz); δ (ppm): 4.35 (t, J =8.2Hz, 1H), 4.80 (t, J =8.3Hz, 1H), 5.68 (t, J =8.0Hz, 1H), 7.35–7.38 (m, 2H), 7.43–7.48 (m, 3H); 4-Phenyloxymethyl-1,3-dioxolan-2-one (2d): 1H NMR (CDCl3, 400MHz); δ(ppm): 4.15 (dd, J =3.6/10.5Hz, 1H), 4.24 (dd, J =4.3/10.6Hz, 1H), 4.72 (dd, J =5.9/8.5Hz, 1H), 4.61 (t, J =8.5Hz, 1H), 5.00–5.05 (m, 1H), 6.91 (d, J =8.7Hz, 2H), 7.02 (t, J =7.4Hz, 1H), 7.30 (t, J =8.0Hz, 1H). 3 Results and discussion 3.1 Synthesis of propylene carbonate (2a) from CO2 and propylene oxide (1a) The betaine-based solid catalysts were facilely prepared via the reactions of anhydrous betaine with several Brønsted acids (Scheme 2 ). The as-prepared salts were first used to catalyze the cycloaddition reaction of CO2 with propylene oxide (PO) at 140°C for 8h to produce propylene carbonate (PC) (Scheme 3 ). The results were summarized in Table 1 . Product was not detected without catalyst or as anhydrous betaine (Bet) was used as the catalyst (Table 1, Entries 1 and 2). When betaine-based salts were used to catalyze the cycloaddition, in which the anions were Cl−, Br−, I−, BF4 −, and PF6 −, moderate to good yields were achieved, especially when the Cl− or I− were anions (Table 1, Entries 3 and 5). In the meantime, the catalysts had high selectivity, and no by-product was detected by GC–MS. The yields of PC decreased in the order of Cl− >BF4 − >PF6 − (Table 1, Entries 3, 6, and 7), which is consistent with the order of the nucleophilicity of the anions. Interestingly, the order of activity of the catalysts containing halide elements was found to be HBetI>HBetCl>HBetBr (Table 1, Entries 3–5), which is different from the order of nucleophilicity of halide anions. Better nucleophilic anion will attack the epoxide ring more effectively to form reactive intermediate shown in Scheme 4 . The higher activity of HBetCl than HBetBr can be explained partially by the difference in miscibility of the catalysts with the reaction mixtures. After the reaction being completed, the catalyst precipitated from the product when HBetI or HBetBr was used, while the catalyst did not precipitate when HBetCl was used even the reaction mixture was centrifuged at high speed (Fig. 1 ). In this case, the system was homogenous, which was favorable to the reaction (Table 1, Entry 3). Another important factor is the leaving ability of the anions, and the activity increases with the leaving ability. The leaving ability of the anions is in the order I−1 >Br−1 >Cl−1, which is consistent with the nucleophilicity of these anions. In order to compare the catalytic activity of the betaine-based salts with those of the conventional catalysts, the catalytic activity of n-tetrabutyl ammonium bromide (Table 1, Entry 9) was also examined. The result indicated that HBetI had higher catalytic activity than n-tetrabutyl ammonium bromide; Choline chloride (ChoCl) is also a quaternary ammonium alkaloid and was tested for the same reaction (Table 1, Entry 8). The results indicated that HBetCl had higher catalytic activity than ChoCl. The difference between choline and betaine-based salts is that the hydroxyl group in choline cation is replaced by a carboxylic acid group in betaine-based salts. It can be deduced that carboxylic acid group is more beneficial to activate the ring of epoxide than hydroxyl group. Based on the above results, HBetI was selected as the catalyst to investigate the effects of reaction parameters on the coupling of CO2 with PO. Fig. 2 showed the effect of CO2 pressure, reaction temperature, reaction time and the amount of HBetI on the yield of PC. The yield increased with the reaction temperature up to 140°C (Fig. 2(a)). However, further increase in temperature caused a decrease in the yield, which was possibly due to the side reactions because all PO was converted and usually higher temperature results in side reaction. Fig. 2(b) demonstrated that the yield increased with pressure up to 8MPa. The main reason may be that too much CO2 in the reaction mixture might decrease the interaction between the epoxide and the catalyst [35], and resulted in a low concentration of epoxide in the vicinity of the catalyst. The amount of catalyst also influenced the yield (Fig. 2(c)). When the molar ratio of HBetI to PO was increased from 1.5mol% to 2.5mol%, the yield of PC increased from 84% to 98%. However, slight reduction in the yield was observed as the amount of the catalyst was increased further. The influence of reaction time on the yield was given in Fig. 2(d). The results indicated that a reaction time of 8h was necessary for the complete conversion of propylene oxide under the selected conditions. Longer reaction time may result in side reactions and decreased the yield. Therefore, the optimized conditions of the reaction are 140°C, 8MPa, 2.5mol% HBetI, and 8h. In addition, a series of catalytic cycles were run to investigate the reusability of the catalyst HBetI, and the results were also given in Table 1 (Entries 10 and 11). The catalyst can be reused for at least two times without considerable loss of catalytic activity. After the reaction mixture was centrifugated, the up layer appeared brown which indicated some I− was dissolved in the reaction mixture. But the product obtained from distillation under reduced pressure was colorless, which showed that there was no I− in the product. Due to catalyst partly dissolved in reaction mixture, it is difficult to recycle the catalyst by simple filtration. Therefore, the catalyst was recovered by distillation under reduced pressure. 3.2 Synthesis of cyclic carbonates from CO2 and other epoxides The above results indicated that HBetI was an effective catalyst for the cycloaddition of PO with CO2 in solvent-free conditions. In order to survey the applicability of the catalyst to other epoxides, we also examined the reactions of other epoxides with CO2 and the results were summarized in Table 2 . HBetI was found to be applicable to a variety of epoxides to produce corresponding cyclic carbonates in high yields with almost 100% selectivity. When cyclohexene oxide (1b) was reacted with CO2, a yield of 85% was obtained in 24h due to the higher steric hindrance of the reactant. The stereochemical structure of 2b cis-hexahydro-benzo[1,3]-dioxolan-2-one can be deduced from the mechanism and 1H NMR analysis, which was also demonstrated by other authors [36]. When other epoxides were used, the yields were in the range of 96–99% in 8h. 3.3 Proposed mechanism of coupling reaction It has been suggested by Huang and Shi [10] that Brønsted acid can accelerate the ring-opening reaction of epoxides through forming hydrogen bonding. In our experiments, ChoCl and HBetCl had better catalytic activities than N(Me)4Cl (Table 1, Entries 3, 8 and 10). It can be concluded that hydroxyl group and carboxylic acid group can promote the reaction. Furthermore, when the simple mixture of acetic acid and N(Bu)4Br was used in the experiment (Table 1, Entry 11), PC yield is 91% which is higher than the one obtained by only N(Bu)4Br (88%). It further proved the positive effect of the carboxylic acid group. The proposed mechanism is shown in Scheme 4: the X anion (Lewis base) of catalyst opened the epoxy ring, which was activated by the betaine cation through hydrogen bonding with carboxylic acid group and electronic interaction with quaterammonium cation to give the intermediate. Then the intermediate further reacted with CO2 to form the corresponding cyclic carbonate and regenerated the catalyst. So in our catalysis systems, the co-existence of hydrogen bonding donors (–COOH), quaterammonium cation and halide anion exhibited a synergetic effect to promote the reaction. And the synergistic effect was perhaps the main reason of the high catalytic activity and selectivity. 4 Conclusion Betaine-based salts are effective catalysts for the synthesis of cyclic carbonates via the cycloaddition of epoxides with CO2. High yields with excellent selectivity can be achieved at optimized conditions. The carboxylate acid group in betaine cation can greatly accelerate the reactions and showed a synergetic effect with halide anions. Acknowledgements We sincerely acknowledge the supports from National Natural Science Foundation of China (No. 20773144) and National Key Basic Research Project of China (2006CB202504). References [1] D.H. Gilbson Chem. Rev. 96 1996 2063 [2] H. Arakawa M. Aresta J.N. Armor M.A. Barteau E.J. Beckman A.T. Bell J.E. Bercaw C. Creutz E. Dinjus D.A. Dixon K. Domen D.L. DuBois J. Eckert E. Fujita D.H. Gibson W.A. Goddard D.W. Goodman J. Keller G.J. Kubas H.H. Kung J.E. Lyons L.E. Manzer T.J. Marks K. Morokuma K.M. Nicholas R. Periana L. Que J. Rostrup-Nielson W.M.H. Sachtler L.D. Schmidt A. Sen G.A. Somorjai P.C. Stair B.R. Stults W. Tumas Chem. Rev. 101 2001 953 [3] P.T. Anastas Green Chem. 5 2003 G29 [4] C.S. Song Catal. Today 115 2006 2 [5] A.-A.G. Shaikh S. Sivaram Chem. Rev. 96 1996 951 [6] J.H. Clements Ind. Eng. Chem. Res. 42 2003 663 [7] J.P. Parrish R.N. Salvatore K.W. Jung Tetrahedron 56 2000 8207 [8] J. Bayardon J. Holz B. Schäffner V. Andrushko S. Verevkin A. Preetz A. Börner Angew. Chem. Int. Ed. 46 2007 5971 [9] M. Kihare N. hara T. Endo J. Org. Chem. 58 1993 6198 [10] J.W. Huang M. Shi J. Org. Chem. 68 2003 6705 [11] T. Zhao Y. Han Y. Sun Phys. Chem. Chem. Phys. 12 1999 3047 [12] T. Yano H. Yasuda T. Koike H. Ishiguro H. Fujihara M. Yoshihara T. Maeshima Chem. Commun. 1997 1129 [13] K. Yamaguchi K. Ebitani T. Yoshida H. Yoshida K. Kaneda J. Am. Chem. Soc. 121 1999 4526 [14] M. Tu R.J. Davis J. Catal. 199 2001 85 [15] B.M. Bhanage S. Fujita Y. Ikushima M. Arai Appl. Catal. A 219 2001 259 [16] V. Caló A. Nacci A. Monopoli A. Fanizzi Org. Lett. 4 2002 2561 [17] J.Q. Wang D.L. Kong J.Y. Chen F. Cai L.N. He J. Mol. Catal. A: Chem. 249 2006 143 [18] H. Yasuda L.N. He T. Sakakura C.W. Hu J. Catal. 233 2005 119 [19] T. Aida S. Inoue J. Am. Chem. Soc. 105 1983 1304 [20] Y.M. Shen W.L. Duan M. Shi Eur. J. Org. Chem. 14 2004 3080 [21] W.N. Sit S.M. Ng K.Y. Kwong C.P. Lau J. Org. Chem. 70 2005 8583 [22] J.L. Jiang F. Gao R. Hua X. Qiu J. Org. Chem. 70 2005 381 [23] H.S. Kim J.J. Kim S.D. Lee M.S. Lah D. Moon H.G. Jang Chem. Eur. J. 9 2003 678 [24] S.D. Allen D.R. Moore E.B. Lobkovsky G.W. Coates J. Am. Chem. Soc. 124 2002 14284 [25] Y. Du F. Cai D.L. Kong L.N. He Green Chem. 7 2005 518 [26] J.J. Peng Y.Q. Deng New J. Chem. 25 2001 639 [27] H. Kawanami A. Sasaki K. Matsui Y. Ikushima Chem. Commun. 7 2003 896 [28] H.Z. Yang Y.L. Gu Y.Q. Deng F. Shi Chem. Commun. 3 2002 274 [29] H.B. Xie S.H. Li S.B. Zhang J. Mol. Catal. A: Chem. 250 2006 30 [30] H.B. Xie H.F. Duan S.H. Li S.B. Zhang New J. Chem. 29 2005 1199 [31] C.H. McMullen, J.R. Nelson, B.C. Ream, J.A. Sims, Jr., US Patent No. 4,314,945 (1982) (to Union Carbide Corporation). [32] B.C. Ream, US Patent No. 4,877,886 (1989) (to Union Carbide Chemicals and Plastics Company Inc.). [33] A.L. Zhu T. Jiang B.X. Han J.C. Zhang Y. Xie X.M. Ma Green Chem. 9 2007 169 [34] P. Nockemann B. Thijs K. Driesen C.R. Janssen K.V. Hecke L.V. Meervelt S. Kossmann B. Kirchner K. Binnemans J. Phys. Chem. B. 111 2007 5254 [35] X.B. Lu J.H. Xiu R. He K. Jin L.M. Luo X.J. Feng Appl. Catal. A: Gen. 275 2004 73 [36] T. Iwasaki N. Kihara T. Endo Bull. Chem. Soc. Jpn. 73 2000 713",
      "scopus-id": "40849092329",
      "coredata": {
        "eid": "1-s2.0-S1381116908000095",
        "dc:description": "A series of betaine-based salts containing quaternary ammonium ion and carboxylic acid group were synthesized by direct protonation of anhydrous betaine using different Brønsted acids. The catalytic activity of these salts for the synthesis of cyclic carbonates via cycloaddition reaction of CO2 with epoxides was studied. The effects of anions of the salts, reaction temperature, pressure, reaction time, and the amount of catalyst used on the reaction were studied. It was demonstrated that the carboxylic acid group in the catalyst had synergetic effect with halide anion, and high yield of cyclic carbonates and excellent selectivity could be achieved at optimized condition.",
        "openArchiveArticle": "false",
        "prism:coverDate": "2008-04-02",
        "openaccessUserLicense": null,
        "prism:aggregationType": "Journal",
        "prism:url": "https://api.elsevier.com/content/article/pii/S1381116908000095",
        "dc:creator": [
          {
            "@_fa": "true",
            "$": "Zhou, Yinxi"
          },
          {
            "@_fa": "true",
            "$": "Hu, Suqin"
          },
          {
            "@_fa": "true",
            "$": "Ma, Xiumin"
          },
          {
            "@_fa": "true",
            "$": "Liang, Shuguang"
          },
          {
            "@_fa": "true",
            "$": "Jiang, Tao"
          },
          {
            "@_fa": "true",
            "$": "Han, Buxing"
          }
        ],
        "link": [
          {
            "@_fa": "true",
            "@rel": "self",
            "@href": "https://api.elsevier.com/content/article/pii/S1381116908000095"
          },
          {
            "@_fa": "true",
            "@rel": "scidir",
            "@href": "https://www.sciencedirect.com/science/article/pii/S1381116908000095"
          }
        ],
        "dc:format": "application/json",
        "openaccessType": null,
        "pii": "S1381-1169(08)00009-5",
        "prism:volume": "284",
        "prism:publisher": "Elsevier B.V.",
        "dc:title": "Synthesis of cyclic carbonates from carbon dioxide and epoxides over betaine-based catalysts",
        "prism:copyright": "Copyright © 2008 Elsevier B.V. All rights reserved.",
        "openaccess": "0",
        "prism:issn": "13811169",
        "prism:issueIdentifier": "1-2",
        "dcterms:subject": [
          {
            "@_fa": "true",
            "$": "Betaine-based salts"
          },
          {
            "@_fa": "true",
            "$": "Carbon dioxide"
          },
          {
            "@_fa": "true",
            "$": "Cyclic carbonates"
          },
          {
            "@_fa": "true",
            "$": "Epoxides"
          },
          {
            "@_fa": "true",
            "$": "Cycloaddition"
          }
        ],
        "openaccessArticle": "false",
        "prism:publicationName": "Journal of Molecular Catalysis A: Chemical",
        "prism:number": "1-2",
        "openaccessSponsorType": null,
        "prism:pageRange": "52-57",
        "prism:endingPage": "57",
        "pubType": "fla",
        "prism:coverDisplayDate": "2 April 2008",
        "prism:doi": "10.1016/j.molcata.2008.01.010",
        "prism:startingPage": "52",
        "dc:identifier": "doi:10.1016/j.molcata.2008.01.010",
        "openaccessSponsorName": null
      },
      "objects": {
        "object": [
          {
            "@category": "standard",
            "@height": "90",
            "@width": "301",
            "@_fa": "true",
            "$": "https://api.elsevier.com/content/object/eid/1-s2.0-S1381116908000095-sc1.jpg?httpAccept=%2A%2F%2A",
            "@multimediatype": "JPEG image file",
            "@type": "IMAGE-DOWNSAMPLED",
            "@size": "5568",
            "@ref": "sc1",
            "@mimetype": "image/jpeg"
          },
          {
            "@category": "thumbnail",
            "@height": "37",
            "@width": "125",
            "@_fa": "true",
            "$": "https://api.elsevier.com/content/object/eid/1-s2.0-S1381116908000095-sc1.sml?httpAccept=%2A%2F%2A",
            "@multimediatype": "GIF image file",
            "@type": "IMAGE-THUMBNAIL",
            "@size": "660",
            "@ref": "sc1",
            "@mimetype": "image/gif"
          },
          {
            "@category": "standard",
            "@height": "99",
            "@width": "334",
            "@_fa": "true",
            "$": "https://api.elsevier.com/content/object/eid/1-s2.0-S1381116908000095-sc2.jpg?httpAccept=%2A%2F%2A",
            "@multimediatype": "JPEG image file",
            "@type": "IMAGE-DOWNSAMPLED",
            "@size": "8452",
            "@ref": "sc2",
            "@mimetype": "image/jpeg"
          },
          {
            "@category": "thumbnail",
            "@height": "37",
            "@width": "125",
            "@_fa": "true",
            "$": "https://api.elsevier.com/content/object/eid/1-s2.0-S1381116908000095-sc2.sml?httpAccept=%2A%2F%2A",
            "@multimediatype": "GIF image file",
            "@type": "IMAGE-THUMBNAIL",
            "@size": "785",
            "@ref": "sc2",
            "@mimetype": "image/gif"
          },
          {
            "@category": "standard",
            "@height": "115",
            "@width": "317",
            "@_fa": "true",
            "$": "https://api.elsevier.com/content/object/eid/1-s2.0-S1381116908000095-sc3.jpg?httpAccept=%2A%2F%2A",
            "@multimediatype": "JPEG image file",
            "@type": "IMAGE-DOWNSAMPLED",
            "@size": "7370",
            "@ref": "sc3",
            "@mimetype": "image/jpeg"
          },
          {
            "@category": "thumbnail",
            "@height": "45",
            "@width": "125",
            "@_fa": "true",
            "$": "https://api.elsevier.com/content/object/eid/1-s2.0-S1381116908000095-sc3.sml?httpAccept=%2A%2F%2A",
            "@multimediatype": "GIF image file",
            "@type": "IMAGE-THUMBNAIL",
            "@size": "791",
            "@ref": "sc3",
            "@mimetype": "image/gif"
          },
          {
            "@category": "standard",
            "@height": "352",
            "@width": "384",
            "@_fa": "true",
            "$": "https://api.elsevier.com/content/object/eid/1-s2.0-S1381116908000095-sc4.jpg?httpAccept=%2A%2F%2A",
            "@multimediatype": "JPEG image file",
            "@type": "IMAGE-DOWNSAMPLED",
            "@size": "16960",
            "@ref": "sc4",
            "@mimetype": "image/jpeg"
          },
          {
            "@category": "thumbnail",
            "@height": "93",
            "@width": "102",
            "@_fa": "true",
            "$": "https://api.elsevier.com/content/object/eid/1-s2.0-S1381116908000095-sc4.sml?httpAccept=%2A%2F%2A",
            "@multimediatype": "GIF image file",
            "@type": "IMAGE-THUMBNAIL",
            "@size": "1061",
            "@ref": "sc4",
            "@mimetype": "image/gif"
          },
          {
            "@category": "standard",
            "@height": "291",
            "@width": "339",
            "@_fa": "true",
            "$": "https://api.elsevier.com/content/object/eid/1-s2.0-S1381116908000095-gr1.jpg?httpAccept=%2A%2F%2A",
            "@multimediatype": "JPEG image file",
            "@type": "IMAGE-DOWNSAMPLED",
            "@size": "31860",
            "@ref": "gr1",
            "@mimetype": "image/jpeg"
          },
          {
            "@category": "thumbnail",
            "@height": "93",
            "@width": "109",
            "@_fa": "true",
            "$": "https://api.elsevier.com/content/object/eid/1-s2.0-S1381116908000095-gr1.sml?httpAccept=%2A%2F%2A",
            "@multimediatype": "GIF image file",
            "@type": "IMAGE-THUMBNAIL",
            "@size": "4687",
            "@ref": "gr1",
            "@mimetype": "image/gif"
          },
          {
            "@category": "standard",
            "@height": "555",
            "@width": "633",
            "@_fa": "true",
            "$": "https://api.elsevier.com/content/object/eid/1-s2.0-S1381116908000095-gr2.jpg?httpAccept=%2A%2F%2A",
            "@multimediatype": "JPEG image file",
            "@type": "IMAGE-DOWNSAMPLED",
            "@size": "51300",
            "@ref": "gr2",
            "@mimetype": "image/jpeg"
          },
          {
            "@category": "thumbnail",
            "@height": "93",
            "@width": "106",
            "@_fa": "true",
            "$": "https://api.elsevier.com/content/object/eid/1-s2.0-S1381116908000095-gr2.sml?httpAccept=%2A%2F%2A",
            "@multimediatype": "GIF image file",
            "@type": "IMAGE-THUMBNAIL",
            "@size": "1283",
            "@ref": "gr2",
            "@mimetype": "image/gif"
          },
          {
            "@category": "standard",
            "@height": "72",
            "@width": "269",
            "@_fa": "true",
            "$": "https://api.elsevier.com/content/object/eid/1-s2.0-S1381116908000095-fx1.jpg?httpAccept=%2A%2F%2A",
            "@multimediatype": "JPEG image file",
            "@type": "IMAGE-DOWNSAMPLED",
            "@size": "4441",
            "@ref": "fx1",
            "@mimetype": "image/jpeg"
          },
          {
            "@category": "thumbnail",
            "@height": "33",
            "@width": "125",
            "@_fa": "true",
            "$": "https://api.elsevier.com/content/object/eid/1-s2.0-S1381116908000095-fx1.sml?httpAccept=%2A%2F%2A",
            "@multimediatype": "GIF image file",
            "@type": "IMAGE-THUMBNAIL",
            "@size": "638",
            "@ref": "fx1",
            "@mimetype": "image/gif"
          },
          {
            "@category": "standard",
            "@height": "37",
            "@width": "53",
            "@_fa": "true",
            "$": "https://api.elsevier.com/content/object/eid/1-s2.0-S1381116908000095-fx2.gif?httpAccept=%2A%2F%2A",
            "@multimediatype": "GIF image file",
            "@type": "IMAGE-DOWNSAMPLED",
            "@size": "374",
            "@ref": "fx2",
            "@mimetype": "image/gif"
          },
          {
            "@category": "thumbnail",
            "@height": "87",
            "@width": "125",
            "@_fa": "true",
            "$": "https://api.elsevier.com/content/object/eid/1-s2.0-S1381116908000095-fx2.sml?httpAccept=%2A%2F%2A",
            "@multimediatype": "GIF image file",
            "@type": "IMAGE-THUMBNAIL",
            "@size": "961",
            "@ref": "fx2",
            "@mimetype": "image/gif"
          },
          {
            "@category": "standard",
            "@height": "75",
            "@width": "58",
            "@_fa": "true",
            "$": "https://api.elsevier.com/content/object/eid/1-s2.0-S1381116908000095-fx3.gif?httpAccept=%2A%2F%2A",
            "@multimediatype": "GIF image file",
            "@type": "IMAGE-DOWNSAMPLED",
            "@size": "613",
            "@ref": "fx3",
            "@mimetype": "image/gif"
          },
          {
            "@category": "thumbnail",
            "@height": "93",
            "@width": "72",
            "@_fa": "true",
            "$": "https://api.elsevier.com/content/object/eid/1-s2.0-S1381116908000095-fx3.sml?httpAccept=%2A%2F%2A",
            "@multimediatype": "GIF image file",
            "@type": "IMAGE-THUMBNAIL",
            "@size": "792",
            "@ref": "fx3",
            "@mimetype": "image/gif"
          },
          {
            "@category": "standard",
            "@height": "38",
            "@width": "53",
            "@_fa": "true",
            "$": "https://api.elsevier.com/content/object/eid/1-s2.0-S1381116908000095-fx4.gif?httpAccept=%2A%2F%2A",
            "@multimediatype": "GIF image file",
            "@type": "IMAGE-DOWNSAMPLED",
            "@size": "401",
            "@ref": "fx4",
            "@mimetype": "image/gif"
          },
          {
            "@category": "thumbnail",
            "@height": "89",
            "@width": "125",
            "@_fa": "true",
            "$": "https://api.elsevier.com/content/object/eid/1-s2.0-S1381116908000095-fx4.sml?httpAccept=%2A%2F%2A",
            "@multimediatype": "GIF image file",
            "@type": "IMAGE-THUMBNAIL",
            "@size": "1048",
            "@ref": "fx4",
            "@mimetype": "image/gif"
          },
          {
            "@category": "standard",
            "@height": "41",
            "@width": "88",
            "@_fa": "true",
            "$": "https://api.elsevier.com/content/object/eid/1-s2.0-S1381116908000095-fx5.gif?httpAccept=%2A%2F%2A",
            "@multimediatype": "GIF image file",
            "@type": "IMAGE-DOWNSAMPLED",
            "@size": "650",
            "@ref": "fx5",
            "@mimetype": "image/gif"
          },
          {
            "@category": "thumbnail",
            "@height": "58",
            "@width": "125",
            "@_fa": "true",
            "$": "https://api.elsevier.com/content/object/eid/1-s2.0-S1381116908000095-fx5.sml?httpAccept=%2A%2F%2A",
            "@multimediatype": "GIF image file",
            "@type": "IMAGE-THUMBNAIL",
            "@size": "1009",
            "@ref": "fx5",
            "@mimetype": "image/gif"
          },
          {
            "@category": "standard",
            "@height": "58",
            "@width": "68",
            "@_fa": "true",
            "$": "https://api.elsevier.com/content/object/eid/1-s2.0-S1381116908000095-fx6.gif?httpAccept=%2A%2F%2A",
            "@multimediatype": "GIF image file",
            "@type": "IMAGE-DOWNSAMPLED",
            "@size": "568",
            "@ref": "fx6",
            "@mimetype": "image/gif"
          },
          {
            "@category": "thumbnail",
            "@height": "93",
            "@width": "110",
            "@_fa": "true",
            "$": "https://api.elsevier.com/content/object/eid/1-s2.0-S1381116908000095-fx6.sml?httpAccept=%2A%2F%2A",
            "@multimediatype": "GIF image file",
            "@type": "IMAGE-THUMBNAIL",
            "@size": "1013",
            "@ref": "fx6",
            "@mimetype": "image/gif"
          },
          {
            "@category": "standard",
            "@height": "87",
            "@width": "80",
            "@_fa": "true",
            "$": "https://api.elsevier.com/content/object/eid/1-s2.0-S1381116908000095-fx7.gif?httpAccept=%2A%2F%2A",
            "@multimediatype": "GIF image file",
            "@type": "IMAGE-DOWNSAMPLED",
            "@size": "815",
            "@ref": "fx7",
            "@mimetype": "image/gif"
          },
          {
            "@category": "thumbnail",
            "@height": "94",
            "@width": "86",
            "@_fa": "true",
            "$": "https://api.elsevier.com/content/object/eid/1-s2.0-S1381116908000095-fx7.sml?httpAccept=%2A%2F%2A",
            "@multimediatype": "GIF image file",
            "@type": "IMAGE-THUMBNAIL",
            "@size": "896",
            "@ref": "fx7",
            "@mimetype": "image/gif"
          },
          {
            "@category": "standard",
            "@height": "54",
            "@width": "91",
            "@_fa": "true",
            "$": "https://api.elsevier.com/content/object/eid/1-s2.0-S1381116908000095-fx8.gif?httpAccept=%2A%2F%2A",
            "@multimediatype": "GIF image file",
            "@type": "IMAGE-DOWNSAMPLED",
            "@size": "636",
            "@ref": "fx8",
            "@mimetype": "image/gif"
          },
          {
            "@category": "thumbnail",
            "@height": "74",
            "@width": "125",
            "@_fa": "true",
            "$": "https://api.elsevier.com/content/object/eid/1-s2.0-S1381116908000095-fx8.sml?httpAccept=%2A%2F%2A",
            "@multimediatype": "GIF image file",
            "@type": "IMAGE-THUMBNAIL",
            "@size": "957",
            "@ref": "fx8",
            "@mimetype": "image/gif"
          },
          {
            "@category": "standard",
            "@height": "82",
            "@width": "101",
            "@_fa": "true",
            "$": "https://api.elsevier.com/content/object/eid/1-s2.0-S1381116908000095-fx9.gif?httpAccept=%2A%2F%2A",
            "@multimediatype": "GIF image file",
            "@type": "IMAGE-DOWNSAMPLED",
            "@size": "863",
            "@ref": "fx9",
            "@mimetype": "image/gif"
          },
          {
            "@category": "thumbnail",
            "@height": "93",
            "@width": "114",
            "@_fa": "true",
            "$": "https://api.elsevier.com/content/object/eid/1-s2.0-S1381116908000095-fx9.sml?httpAccept=%2A%2F%2A",
            "@multimediatype": "GIF image file",
            "@type": "IMAGE-THUMBNAIL",
            "@size": "1001",
            "@ref": "fx9",
            "@mimetype": "image/gif"
          }
        ]
      },
      "link": {
        "@rel": "abstract",
        "@href": "https://api.elsevier.com/content/abstract/scopus_id/40849092329"
      }
    }
  }
}