{
  "metadata": {
    "title": "Nanogold mesoporous iron promoted ceria catalysts for total and preferential CO oxidation reactions",
    "authors": "; ; ",
    "journal": "Journal of Molecular Catalysis A: Chemical",
    "date": "2016-04-30",
    "doi": "10.1016/j.molcata.2016.01.003",
    "abstract": "",
    "uri": "https://api.elsevier.com/content/article/pii/S1381116916300024",
    "pii": "S1381116916300024"
  },
  "fulltext": {
    "full-text-retrieval-response": {
      "scopus-eid": "2-s2.0-84954288392",
      "originalText": "serial JL 271358 291210 291744 291790 291809 31 Journal of Molecular Catalysis A: Chemical JOURNALMOLECULARCATALYSISACHEMICAL 2016-01-07 2016-01-07 2016-01-13 2016-01-13 2017-02-28T14:49:59 1-s2.0-S1381116916300024 S1381-1169(16)30002-4 S1381116916300024 10.1016/j.molcata.2016.01.003 S300 S300.3 FULL-TEXT 1-s2.0-S1381116915X00161 2017-02-28T09:59:36.626376-05:00 0 0 20160401 20160430 2016 2016-01-07T16:41:31.936669Z absattachment articleinfo articletitlenorm authfirstinitialnorm authfirstsurnamenorm cid cids contenttype copyright crossmark dateloaded dateloadedtxt datesearch datesort dateupdated dco docsubtype doctype doi eid ewtransactionid hubeid indexeddate issn issnnorm itemstage itemtransactionid itemweight openaccess openarchive pg pgfirst pglast pii piinorm pubdateend pubdatestart pubdatetxt pubyr sectiontitle sortorder srctitle srctitlenorm srctype ssids alllist content subj subheadings suppl tomb volfirst volissue volumelist webpdf webpdfpagecount yearnav figure table body mmlmath acknowledge affil articletitle auth authfirstini authfull authkeywords authlast grantnumber grantsponsor highlightsabst primabst ref specialabst 1381-1169 13811169 true 414 414 C Volume 414 10 62 71 62 71 201604 April 2016 2016-04-01 2016-04-30 2016 Regular Papers article fla Copyright © 2016 Elsevier B.V. All rights reserved. NANOGOLDMESOPOROUSIRONPROMOTEDCERIACATALYSTSFORTOTALPREFERENTIALCOOXIDATIONREACTIONS REINA T 1 Introduction 2 Experimental 2.1 Catalysts preparation 2.2 Catalyst characterization 2.3 Catalytic activity and selectivity 2.3.1 CO oxidation 2.3.1 Preferential CO oxidation (PrOx) 3 Results and discussion 3.1 N2 adsorption isotherms 3.2 XRD 3.3 Raman spectroscopy 3.4 UV–vis 3.5 Total CO oxidation 3.6 Preferential CO oxidation (CO–PrOx) 4 Conclusions Acknowledgements References FARRAUTO 2007 141 196 R HICKNER 2004 4487 4612 M JOENSEN 2002 195 201 F ROYER 2011 24 65 S PETALLIDOU 2013 333 347 K BION 2008 76 88 N MARINO 2008 1345 1353 F AVGOUROPOULOS 2008 237 247 G BURCH 2006 5483 5500 R HAMMER 1995 238 240 B SANDOVAL 2015 287 294 A CARABINEIRO 2010 150 160 S CARABINEIRO 2010 21 30 S CARABINEIRO 2010 293 302 S TRIMM 2005 1 11 D DU 2008 3710 3718 X AVGOUROPOULOS 2008 1656 1660 G CARABINEIRO 2012 2957 2965 S SORIA 2014 45 55 M CORMA 2008 2096 2126 A TABAKOVA 2003 385 397 T YUAN 2008 203 210 Z PASTORPEREZ 2014 17589 17599 L POJANAVARAPHAN 2014 99 108 C SCHUBERT 2001 143 150 M DENG 2005 126 135 W KO 2006 377 383 E HERNANDEZ 2010 10857 10865 W REINA 2012 58 66 T CAO 2008 120 128 J TABAKOVA 2004 73 81 T DOMINGUEZ 2006 96 103 M KONYA 2003 1242 1248 Z MOREAU 2006 110 117 F PARKS 1965 177 198 G PUSHKAREV 2004 5341 5348 V WU 2010 16595 16606 Z LONG 1997 29 32 R SHIM 2001 318 326 S PETROVSKY 2001 V SCHWIDDER 2005 314 330 M REDDY 2010 60 67 A PESTRYAKOV 2007 3792 3795 N SCHUBERT 2001 113 122 M HAN 2007 3163 3170 Y KUNG 2007 11767 11775 M GAMARRA 2009 189 195 D HARUTA 1989 301 309 M LUENGNARUEMITCHAI 2004 429 435 A REINA 2014 554 563 T LEE 2008 109 116 H REINA 2015 161 171 T REINAX2016X62 REINAX2016X62X71 REINAX2016X62XT REINAX2016X62X71XT 2018-01-13T00:00:00Z UnderEmbargo http://creativecommons.org/licenses/by-nc-nd/4.0/ item S1381-1169(16)30002-4 S1381116916300024 1-s2.0-S1381116916300024 10.1016/j.molcata.2016.01.003 271358 2017-02-28T09:59:36.626376-05:00 2016-04-01 2016-04-30 1-s2.0-S1381116916300024-main.pdf https://s3-eu-west-1.amazonaws.com/prod-ucs-content-store-eu-west/content/pii:S1381116916300024/MAIN/application/pdf/6f794064da73374edbc24cc3daad927f/main.pdf https://s3.amazonaws.com/prod-ucs-content-store-us-east/content/pii:S1381116916300024/MAIN/application/pdf/6f794064da73374edbc24cc3daad927f/main.pdf main.pdf pdf true 1965092 MAIN 10 1-s2.0-S1381116916300024-main_1.png https://s3-eu-west-1.amazonaws.com/prod-ucs-content-store-eu-west/content/pii:S1381116916300024/PREVIEW/image/png/a3ef9e1e7181fb8ba171ac9b2bb970a0/main_1.png https://s3.amazonaws.com/prod-ucs-content-store-us-east/content/pii:S1381116916300024/PREVIEW/image/png/a3ef9e1e7181fb8ba171ac9b2bb970a0/main_1.png main_1.png png 53802 849 656 IMAGE-WEB-PDF 1 1-s2.0-S1381116916300024-fx1.sml https://s3-eu-west-1.amazonaws.com/prod-ucs-content-store-eu-west/content/pii:S1381116916300024/fx1/THUMBNAIL/image/gif/44bf746c02168f9e58258f234127c86f/fx1.sml https://s3.amazonaws.com/prod-ucs-content-store-us-east/content/pii:S1381116916300024/fx1/THUMBNAIL/image/gif/44bf746c02168f9e58258f234127c86f/fx1.sml fx1 true fx1.sml sml 7838 88 219 IMAGE-THUMBNAIL 1-s2.0-S1381116916300024-gr1.sml https://s3-eu-west-1.amazonaws.com/prod-ucs-content-store-eu-west/content/pii:S1381116916300024/gr1/THUMBNAIL/image/gif/eff4f6ec8ec6bdae24768bb122d61083/gr1.sml https://s3.amazonaws.com/prod-ucs-content-store-us-east/content/pii:S1381116916300024/gr1/THUMBNAIL/image/gif/eff4f6ec8ec6bdae24768bb122d61083/gr1.sml gr1 gr1.sml sml 11849 164 212 IMAGE-THUMBNAIL 1-s2.0-S1381116916300024-gr2.sml https://s3-eu-west-1.amazonaws.com/prod-ucs-content-store-eu-west/content/pii:S1381116916300024/gr2/THUMBNAIL/image/gif/a8bc191b6a7085398b4486db5510f421/gr2.sml https://s3.amazonaws.com/prod-ucs-content-store-us-east/content/pii:S1381116916300024/gr2/THUMBNAIL/image/gif/a8bc191b6a7085398b4486db5510f421/gr2.sml gr2 gr2.sml sml 2229 88 219 IMAGE-THUMBNAIL 1-s2.0-S1381116916300024-gr3.sml https://s3-eu-west-1.amazonaws.com/prod-ucs-content-store-eu-west/content/pii:S1381116916300024/gr3/THUMBNAIL/image/gif/7a27e849035be9ad6a1ec8e7829a0e5e/gr3.sml https://s3.amazonaws.com/prod-ucs-content-store-us-east/content/pii:S1381116916300024/gr3/THUMBNAIL/image/gif/7a27e849035be9ad6a1ec8e7829a0e5e/gr3.sml gr3 gr3.sml sml 9477 164 213 IMAGE-THUMBNAIL 1-s2.0-S1381116916300024-gr4.sml https://s3-eu-west-1.amazonaws.com/prod-ucs-content-store-eu-west/content/pii:S1381116916300024/gr4/THUMBNAIL/image/gif/dd3e835adc3e819cea94352bde2bcf9d/gr4.sml https://s3.amazonaws.com/prod-ucs-content-store-us-east/content/pii:S1381116916300024/gr4/THUMBNAIL/image/gif/dd3e835adc3e819cea94352bde2bcf9d/gr4.sml gr4 gr4.sml sml 7304 142 219 IMAGE-THUMBNAIL 1-s2.0-S1381116916300024-gr5.sml https://s3-eu-west-1.amazonaws.com/prod-ucs-content-store-eu-west/content/pii:S1381116916300024/gr5/THUMBNAIL/image/gif/1996a11efbc2bc00285986fa7545d427/gr5.sml https://s3.amazonaws.com/prod-ucs-content-store-us-east/content/pii:S1381116916300024/gr5/THUMBNAIL/image/gif/1996a11efbc2bc00285986fa7545d427/gr5.sml gr5 gr5.sml sml 8988 164 211 IMAGE-THUMBNAIL 1-s2.0-S1381116916300024-gr6.sml https://s3-eu-west-1.amazonaws.com/prod-ucs-content-store-eu-west/content/pii:S1381116916300024/gr6/THUMBNAIL/image/gif/97dff7a659b2df0577d594bdb8bbf2b8/gr6.sml https://s3.amazonaws.com/prod-ucs-content-store-us-east/content/pii:S1381116916300024/gr6/THUMBNAIL/image/gif/97dff7a659b2df0577d594bdb8bbf2b8/gr6.sml gr6 gr6.sml sml 5879 83 219 IMAGE-THUMBNAIL 1-s2.0-S1381116916300024-gr7.sml https://s3-eu-west-1.amazonaws.com/prod-ucs-content-store-eu-west/content/pii:S1381116916300024/gr7/THUMBNAIL/image/gif/d84b1d896bd8a116a4d0c85095840dec/gr7.sml https://s3.amazonaws.com/prod-ucs-content-store-us-east/content/pii:S1381116916300024/gr7/THUMBNAIL/image/gif/d84b1d896bd8a116a4d0c85095840dec/gr7.sml gr7 gr7.sml sml 4262 163 101 IMAGE-THUMBNAIL 1-s2.0-S1381116916300024-fx1.jpg https://s3-eu-west-1.amazonaws.com/prod-ucs-content-store-eu-west/content/pii:S1381116916300024/fx1/DOWNSAMPLED/image/jpeg/0198905dae7a05c7ee0407f489797062/fx1.jpg https://s3.amazonaws.com/prod-ucs-content-store-us-east/content/pii:S1381116916300024/fx1/DOWNSAMPLED/image/jpeg/0198905dae7a05c7ee0407f489797062/fx1.jpg fx1 true fx1.jpg jpg 30090 200 500 IMAGE-DOWNSAMPLED 1-s2.0-S1381116916300024-gr1.jpg https://s3-eu-west-1.amazonaws.com/prod-ucs-content-store-eu-west/content/pii:S1381116916300024/gr1/DOWNSAMPLED/image/jpeg/93321ed204ec1a6abbf2b18d1dbab400/gr1.jpg https://s3.amazonaws.com/prod-ucs-content-store-us-east/content/pii:S1381116916300024/gr1/DOWNSAMPLED/image/jpeg/93321ed204ec1a6abbf2b18d1dbab400/gr1.jpg gr1 gr1.jpg jpg 114331 591 763 IMAGE-DOWNSAMPLED 1-s2.0-S1381116916300024-gr2.jpg https://s3-eu-west-1.amazonaws.com/prod-ucs-content-store-eu-west/content/pii:S1381116916300024/gr2/DOWNSAMPLED/image/jpeg/d5c9fe14f213ee9865fa1c4e91026eb2/gr2.jpg https://s3.amazonaws.com/prod-ucs-content-store-us-east/content/pii:S1381116916300024/gr2/DOWNSAMPLED/image/jpeg/d5c9fe14f213ee9865fa1c4e91026eb2/gr2.jpg gr2 gr2.jpg jpg 21006 304 753 IMAGE-DOWNSAMPLED 1-s2.0-S1381116916300024-gr3.jpg https://s3-eu-west-1.amazonaws.com/prod-ucs-content-store-eu-west/content/pii:S1381116916300024/gr3/DOWNSAMPLED/image/jpeg/58a44ae68874ea6a5d57912c9a153a26/gr3.jpg https://s3.amazonaws.com/prod-ucs-content-store-us-east/content/pii:S1381116916300024/gr3/DOWNSAMPLED/image/jpeg/58a44ae68874ea6a5d57912c9a153a26/gr3.jpg gr3 gr3.jpg jpg 96573 580 753 IMAGE-DOWNSAMPLED 1-s2.0-S1381116916300024-gr4.jpg https://s3-eu-west-1.amazonaws.com/prod-ucs-content-store-eu-west/content/pii:S1381116916300024/gr4/DOWNSAMPLED/image/jpeg/6a010e97bc86330f6cfad7bd7c4be3f9/gr4.jpg https://s3.amazonaws.com/prod-ucs-content-store-us-east/content/pii:S1381116916300024/gr4/DOWNSAMPLED/image/jpeg/6a010e97bc86330f6cfad7bd7c4be3f9/gr4.jpg gr4 gr4.jpg jpg 68217 488 753 IMAGE-DOWNSAMPLED 1-s2.0-S1381116916300024-gr5.jpg https://s3-eu-west-1.amazonaws.com/prod-ucs-content-store-eu-west/content/pii:S1381116916300024/gr5/DOWNSAMPLED/image/jpeg/52c75b6b8e74c134e345990aaa3c0bbf/gr5.jpg https://s3.amazonaws.com/prod-ucs-content-store-us-east/content/pii:S1381116916300024/gr5/DOWNSAMPLED/image/jpeg/52c75b6b8e74c134e345990aaa3c0bbf/gr5.jpg gr5 gr5.jpg jpg 81870 584 753 IMAGE-DOWNSAMPLED 1-s2.0-S1381116916300024-gr6.jpg https://s3-eu-west-1.amazonaws.com/prod-ucs-content-store-eu-west/content/pii:S1381116916300024/gr6/DOWNSAMPLED/image/jpeg/7675e9fb6b7c17d192b965a70ebf4892/gr6.jpg https://s3.amazonaws.com/prod-ucs-content-store-us-east/content/pii:S1381116916300024/gr6/DOWNSAMPLED/image/jpeg/7675e9fb6b7c17d192b965a70ebf4892/gr6.jpg gr6 gr6.jpg jpg 51036 286 753 IMAGE-DOWNSAMPLED 1-s2.0-S1381116916300024-gr7.jpg https://s3-eu-west-1.amazonaws.com/prod-ucs-content-store-eu-west/content/pii:S1381116916300024/gr7/DOWNSAMPLED/image/jpeg/60193337ce4f6f68b5210d47f814efab/gr7.jpg https://s3.amazonaws.com/prod-ucs-content-store-us-east/content/pii:S1381116916300024/gr7/DOWNSAMPLED/image/jpeg/60193337ce4f6f68b5210d47f814efab/gr7.jpg gr7 gr7.jpg jpg 67512 854 528 IMAGE-DOWNSAMPLED 1-s2.0-S1381116916300024-fx1_lrg.jpg https://s3-eu-west-1.amazonaws.com/prod-ucs-content-store-eu-west/content/pii:S1381116916300024/fx1/HIGHRES/image/jpeg/472e9f7ee400cedc12e3db295905d1c3/fx1_lrg.jpg https://s3.amazonaws.com/prod-ucs-content-store-us-east/content/pii:S1381116916300024/fx1/HIGHRES/image/jpeg/472e9f7ee400cedc12e3db295905d1c3/fx1_lrg.jpg fx1 true fx1_lrg.jpg jpg 211760 886 2213 IMAGE-HIGH-RES 1-s2.0-S1381116916300024-gr1_lrg.jpg https://s3-eu-west-1.amazonaws.com/prod-ucs-content-store-eu-west/content/pii:S1381116916300024/gr1/HIGHRES/image/jpeg/b291d19fe64904d5fa7b9c5ffac699b9/gr1_lrg.jpg https://s3.amazonaws.com/prod-ucs-content-store-us-east/content/pii:S1381116916300024/gr1/HIGHRES/image/jpeg/b291d19fe64904d5fa7b9c5ffac699b9/gr1_lrg.jpg gr1 gr1_lrg.jpg jpg 874691 2616 3377 IMAGE-HIGH-RES 1-s2.0-S1381116916300024-gr2_lrg.jpg https://s3-eu-west-1.amazonaws.com/prod-ucs-content-store-eu-west/content/pii:S1381116916300024/gr2/HIGHRES/image/jpeg/77c275933e2043076c4938468425c76d/gr2_lrg.jpg https://s3.amazonaws.com/prod-ucs-content-store-us-east/content/pii:S1381116916300024/gr2/HIGHRES/image/jpeg/77c275933e2043076c4938468425c76d/gr2_lrg.jpg gr2 gr2_lrg.jpg jpg 153951 1345 3333 IMAGE-HIGH-RES 1-s2.0-S1381116916300024-gr3_lrg.jpg https://s3-eu-west-1.amazonaws.com/prod-ucs-content-store-eu-west/content/pii:S1381116916300024/gr3/HIGHRES/image/jpeg/e12af83925fd4e0f89cc443a7f2b353d/gr3_lrg.jpg https://s3.amazonaws.com/prod-ucs-content-store-us-east/content/pii:S1381116916300024/gr3/HIGHRES/image/jpeg/e12af83925fd4e0f89cc443a7f2b353d/gr3_lrg.jpg gr3 gr3_lrg.jpg jpg 746020 2569 3333 IMAGE-HIGH-RES 1-s2.0-S1381116916300024-gr4_lrg.jpg https://s3-eu-west-1.amazonaws.com/prod-ucs-content-store-eu-west/content/pii:S1381116916300024/gr4/HIGHRES/image/jpeg/0c75ff655fcd7e6322b5a3e57213bee6/gr4_lrg.jpg https://s3.amazonaws.com/prod-ucs-content-store-us-east/content/pii:S1381116916300024/gr4/HIGHRES/image/jpeg/0c75ff655fcd7e6322b5a3e57213bee6/gr4_lrg.jpg gr4 gr4_lrg.jpg jpg 552059 2158 3333 IMAGE-HIGH-RES 1-s2.0-S1381116916300024-gr5_lrg.jpg https://s3-eu-west-1.amazonaws.com/prod-ucs-content-store-eu-west/content/pii:S1381116916300024/gr5/HIGHRES/image/jpeg/a20cf8c4cc1e693a595c434cab7b3da6/gr5_lrg.jpg https://s3.amazonaws.com/prod-ucs-content-store-us-east/content/pii:S1381116916300024/gr5/HIGHRES/image/jpeg/a20cf8c4cc1e693a595c434cab7b3da6/gr5_lrg.jpg gr5 gr5_lrg.jpg jpg 684169 2583 3333 IMAGE-HIGH-RES 1-s2.0-S1381116916300024-gr6_lrg.jpg https://s3-eu-west-1.amazonaws.com/prod-ucs-content-store-eu-west/content/pii:S1381116916300024/gr6/HIGHRES/image/jpeg/2420a8759deed3ec161167e27bb36098/gr6_lrg.jpg https://s3.amazonaws.com/prod-ucs-content-store-us-east/content/pii:S1381116916300024/gr6/HIGHRES/image/jpeg/2420a8759deed3ec161167e27bb36098/gr6_lrg.jpg gr6 gr6_lrg.jpg jpg 410441 1266 3333 IMAGE-HIGH-RES 1-s2.0-S1381116916300024-gr7_lrg.jpg https://s3-eu-west-1.amazonaws.com/prod-ucs-content-store-eu-west/content/pii:S1381116916300024/gr7/HIGHRES/image/jpeg/6f1940c45a4fcf90e2b7102a2c722228/gr7_lrg.jpg https://s3.amazonaws.com/prod-ucs-content-store-us-east/content/pii:S1381116916300024/gr7/HIGHRES/image/jpeg/6f1940c45a4fcf90e2b7102a2c722228/gr7_lrg.jpg gr7 gr7_lrg.jpg jpg 520646 3781 2339 IMAGE-HIGH-RES 1-s2.0-S1381116916300024-si1.gif https://s3-eu-west-1.amazonaws.com/prod-ucs-content-store-eu-west/content/pii:S1381116916300024/STRIPIN/image/gif/d86b61c0999dd31003e36bfa6cf14a14/si1.gif https://s3.amazonaws.com/prod-ucs-content-store-us-east/content/pii:S1381116916300024/STRIPIN/image/gif/d86b61c0999dd31003e36bfa6cf14a14/si1.gif si1 si1.gif gif 1211 34 281 ALTIMG 1-s2.0-S1381116916300024-si2.gif https://s3-eu-west-1.amazonaws.com/prod-ucs-content-store-eu-west/content/pii:S1381116916300024/STRIPIN/image/gif/169555a0b2250d2c58723285a13c4f34/si2.gif https://s3.amazonaws.com/prod-ucs-content-store-us-east/content/pii:S1381116916300024/STRIPIN/image/gif/169555a0b2250d2c58723285a13c4f34/si2.gif si2 si2.gif gif 1356 34 289 ALTIMG MOLCAA 9735 S1381-1169(16)30002-4 10.1016/j.molcata.2016.01.003 Elsevier B.V. Fig. 1 N2 adsorption–desorption isotherms and pore volume distribution of the prepared materials; (A and B) supports; (C and D) gold based catalysts. (For interpretation of the references to color in this figure legend, the reader is referred to the web version of this article.) Fig. 2 (A) specific surface area as a function of Fe loading; (B) gold uptake as a function of Fe content. Fig. 3 X-ray diffraction patterns of the studied samples. (A) supports; (B) gold based catalysts; (C) Au (111) region. Fig. 4 Raman spectra of the Ce–Fe mixed supports. (A) All the supports together; (B) detailed spectra of the Fe10Ce0 sample; (C) detailed spectra of the Fe0Ce010 support. Fig. 5 UV–vis study (A) supports spectra; (B) subtracted spectra: FeXCe (10-X)—Fe0Ce10; (C) gold based catalysts spectra. Fig. 6 Catalytic activity in the total CO oxidation. (A) Typical light-off run from room temperature to 400°C; (B) low temperature CO oxidation activity. Fig. 7 Catalytic screening in the preferential CO oxidation (PrOx) (A) CO conversion; (B) selectivity toward CO2. Table 1 Comparison of textural properties of Fe(10-x)Ce x and Au/Fe(10-x)Ce x catalysts. Catalysts Au content a (wt.%) Surface area (m2/g) Pore volume (cm3/g) Average pore size (nm) d 111 Au b (nm) α 220 CeO2 c (nm) Fe0Ce10 – 86 0.105 2.3 – 0.5412 Fe2Ce8 – 118 0.281 9.2 – – Fe4Ce6 – 104 0.340 12.6 – – Fe6Ce4 – 73 0.371 20.1 – – Fe8Ce2 – 68 0.351 19.8 – – Fe10Ce0 – 46 0.157 8.1 – – Au/Fe0Ce10 2.95 69 0.104 4.7 6 0.5422 Au/Fe2Ce8 3.23 109 0.254 8.0 5.5 0.5370 Au/Fe4Ce6 3.68 93 0.315 9.9 5.8 0.5363 Au/Fe6Ce4 3.35 60 0.295 18.6 6.2 0.5367 Au/Fe8Ce2 3.20 51 0.264 24.1 6.2 0.5392 Au/Fe10Ce0 2.45 39 0.151 9.2 n.d d – a Analyzed by atomic absorption method. b Average particles size, calculated from Scherrer's equation and (111) crystallographic plane. c Unit cell parameter, calculated from the (220) crystallographic plane and Bragg's equation. d Not detected (<5nm). Table 2 Low Temperature CO oxidation reaction rates in molCOmolAu−1 s−1 and TOFs values for the gold catalysts at a) 0°C and b) 25°C. Solid a) Reaction rate (x102) b) Reaction rate (x102) a) TOF (s−1) b) TOF (s−1) Au particle size (nm) Au dispersion (%) Au/Fe0Ce10 1.09 2.16 0.05 0.08 6 22 Au/Fe2Ce8 5.83 8.13 0.24 0.34 5.5 24 Au/Fe4Ce6 4.38 7.12 0.19 0.31 5.8 23 Au/Fe6Ce4 1.38 3.56 0.07 0.15 6.2 21 Au/Fe8Ce2 1.29 3.70 0.06 0.14 6.2 21 Au/Fe10Ce0 0.21 0.38 0.01 0.02 5 a 26 a For this sample Au diffraction peaks were not observed so that 5nm was assumed as average gold particle size. This assumption is made based on the detection limit of the XRD and aiming to avoid a possible overestimation of the TOF. Nanogold mesoporous iron promoted ceria catalysts for total and preferential CO oxidation reactions Tomás Ramírez Reina a ⁎ Svetlana Ivanova a Vasko Idakiev b Tatyana Tabakova b Miguel Angel Centeno a Qing-Fang Deng c Zhong-Yong Yuan c José Antonio Odriozola a a Departamento de Química Inorgánica e Instituto de Ciencias de Materiales de Sevilla Centro mixto Universidad de Sevilla-CSIC, Avda. Américo Vespucio 49, 41092 Seville, Spain Departamento de Química Inorgánica e Instituto de Ciencias de Materiales de Sevilla Centro mixto Universidad de Sevilla-CSIC Avda. Américo Vespucio 49 Seville 41092 Spain b Institute of Catalysis, Bulgarian Academy of Sciences, Acad. G. Bonchev Str., bl. 11, Sofia 1113, Bulgaria Institute of Catalysis Bulgarian Academy of Sciences Acad. G. Bonchev Str., bl. 11 Sofia 1113 Bulgaria c Key Laboratory of Advanced Energy Materials Chemistry (Ministry of Education), College of Chemistry, Nankai University, Tianjin, China Key Laboratory of Advanced Energy Materials Chemistry (Ministry of Education) College of Chemistry Nankai University Tianjin China ⁎ Corresponding author at: Department of Chemical Engineering, Imperial College London. London SW7 2AZ, UK. Graphical abstract Herein, a series of highly efficient gold based catalysts supported on mesoporous CeO2–Fe2O3 mixed oxides for CO elimination reactions have been developed. The materials have been fully characterized by means of XRD, Raman and UV–vis spectroscopies among other techniques. We identify the Ce–Fe synergism as a fundamental factor controlling the catalytic performance. Our data clearly reveal that the CO oxidation activity is maximized when the electronic and structural properties of the support are carefully controlled. In this situation, fairly good catalysts for environmental applications as for example H2 streams purification for fuel cell goals or CO abatement at room temperature can be designed. Keywords Gold catalysts Mesoporous cerium oxide Low temperature CO oxidation PrOx H2 purification 1 Introduction Fuel cells have the potential to become an important energy conversion technology. The most successful fuel cells are powered by hydrogen [1]. Recently, research efforts directed toward the widespread and commercialization of fuel cells have accelerated the interest to develop a hydrogen-based economy to reduce oil use and decrease pollution [2]. However, hydrogen is difficult to store in a vehicle and to distribute from a centralized production facility. As a result, many efforts have been focused on the conversion of more readily available fuels to hydrogen, either on board a vehicle or for stationary applications. Currently hydrocarbons are employed to obtain hydrogen. The conversion of hydrocarbons to hydrogen is effected mainly by reforming [3]. However reforming processes produce carbon monoxide in association with hydrogen and carbon monoxide leads to a deactivation of the electrodes used in the fuel cell [1,3]. Therefore, CO abatement reactions such as CO oxidation [4], water gas shift (WGS) [5] and preferential CO oxidation (PrOx) [6] are of crucial relevance for the fuel cells and hydrogen economy development. The WGS (CO+H2O⇄CO2 +H2) not only reduces CO concentration but also produces hydrogen. Nevertheless, the WGS is an equilibrium-limited reaction making mandatory further clean-up processes for achieving the desirable levels of carbon monoxide in the gases feeding fuel cells (<10ppm). In this sense, the preferential oxidation with air of the pre-cleaned reformate (PrOx) represents a rather cheap and effective solution to abate the ultimate CO traces [7]. As CO and H2 oxidation may take place simultaneously, selectivity toward CO oxidation is one of the key aspects that should be targeted when facing the PrOx process. In addition, since the PrOx reactor will be feed with the pre-cleaned reformate gas, a suitable PrOx catalyst must tolerate high amounts of CO2 and H2O present in the reforming stream [8]. Gold catalysts have been broadly employed in such oxidation processes due to their high activity especially at low temperatures [9–14]. The activity of gold based catalysts at low temperature is an added value feature since normally their activity window matches the operation temperature of the fuel cell avoiding the conventional heating exchange steps. On the other hand, the performance of gold-based catalysts is known to be sensitive to the preparation method, the nature of the supports, the size of the gold particles and the interactions between the gold and the support. It is the later effect the one attracting most recent interest [15]. The presence of structural defects in the support surface as for example, oxygen vacancies, plays a determinant role in improving gold metallic dispersion influencing positively the CO oxidation activity [16–19]. In addition, an adequate support should be able to avoid gold particles agglomeration, as well as to participate actively in the reaction mechanism by redox cycling of the support metal ions [20]. For all above, ceria-based materials are very attractive for supporting gold particles due to its ability for undergoing fast reduction/oxidation cycles since its intrinsic redox behavior (Ce4+/Ce3+). This ability results in the formation of oxygen vacancies whose concentration is directly related to the catalytic activity [21]. In addition the number of oxygen vacancies available for oxidation reaction could be improved, either by specific surface area increase, e.g. the use of mesoporous ceria [22], by ceria deposition on the high surface supports to increase the surface/volume relation [23] or by doping ceria with different oxides [24]. Earlier studies found that Au/ceria catalysts are very promising for the PrOx reaction [25–29]. We have recently reported that ZnO, ZrO2, Fe2O3 and Eu2O3 are efficient dopants of Au/ceria system enhancing oxygen mobility, ceria reducibility, and in the end the catalytic performance in the PrOx process [28,29]. Considering the above mentioned ways to increase the oxygen vacancies population, a detailed study of a series of gold based mesoporous mixed oxide catalysts (Au/CeO2–Fe2O3) is proposed. The samples are tested in the direct and preferential CO oxidation reactions in the present work, with main efforts focussed on achieving a further insight of the Ce–Fe interaction and its manifested relevance on the catalytic behavior. 2 Experimental 2.1 Catalysts preparation Mesoporous Ce–Fe composite oxides were prepared by surfactant-assisted method previously reported [30]. At room temperature, 6mmol of cetyltrimethylammonium bromide (CTAB) was dissolved into 200mL distilled water, then calculated amount of Ce(NO3)3·6H2O and Fe(NO3)3·9H2O were added under vigorous stirring. After stirring for 0.5h, 0.2mol/L sodium hydroxide solutions were gradually added into the above solution until the pH value of the mixed solution was 10, and then further stirred for about 12h. The final suspended solution was aged at 90°C for 3h, washed with hot water several times, dried in the oven at 110°C for 6h, then calcined at 400°C for 4h. The as prepared series contains 6 samples where the Ce/Fe molar ratio varies between 0–1. More precisely the supports corresponding to the following formulas are considered: Ce1Fe0O2, Ce0.8Fe0.2O2, Ce0.6Fe0.4O2, Ce0.4Fe0.6O2, Ce0.2Fe0.8O2, Ce0Fe1O2, which for briefness will be labeled for example Fe0Ce10, Fe2Ce8, etc. Gold catalysts were prepared by deposition-precipitation method in a “Contalab” (Contraves AG, Switzerland) reactor under full control of all parameters of preparation (pH, temperature, stirring speed, reactant feed flow rates, etc.) as reported elsewhere [31]. Briefly, gold was deposited as Au(OH)3 onto mixed oxides thoroughly suspended in water via chemical interaction between HAuCl4·3H2O and K2CO3, under vigorous stirring, while keeping constant pH 7. After filtering and careful washing, the precursors were dried under vacuum and calcined in air at 400°C for 2h. The nominal gold amount was 3wt.% Au. 2.2 Catalyst characterization The actual gold loading was measured using atomic absorption spectroscopy (Varian Vista MPX). X-ray diffraction (XRD) analysis was carried out on a X’Pert Pro PANalytical instrument. Diffraction patterns were recorded using Cu Kα radiation (40mA, 45kV) in a scanning range of 3–80° (2θ) using step size of 0.05° and step time of 240s. The diffraction peaks of the crystalline phase were compared to those of standard compounds reported in the JCPDS Date Base. The average crystallite size was calculated from the peaks width using Scherrer's equation. N2 adsorption–desorption isotherms were collected at liquid nitrogen temperature using a Quantachrome NOVA 2000e sorption analyzer. The specific surface areas of the samples were calculated following the multi-point Brunauer–Emmett–Teller (BET) procedure. The pore-size distributions were determined from the adsorption branch of the isotherms using the Barett–Joyner–Halenda (BJH) method. Before carrying out the measurement, each sample was degassed at 200°C for more than 6h. The UV–vis spectra were recorded on an Avantes spectrometer model AvaLight-DH-S-BAL and using BaSO4 as reference. All the spectra were collected in a diffuse reflectance mode and transformed to a magnitude proportional to the extinction coefficient through the Kubelka–Munk function F(α). The Raman spectra were recorded in a dispersive HorivaJobinYvonLabRam HR800 Microscope, with a He–Ne green laser (532.14nm) working at 5mW, and with a 600gmm−1 grating. The microscope used a 50× objective and a confocal pinhole of 1000μm. The Raman spectrometer was calibrated using a silicon wafer. 2.3 Catalytic activity and selectivity 2.3.1 CO oxidation The oxidation of CO was carried out in U-shape glass flow reactor at atmospheric pressure. The catalysts were pre-treated in a 30mLmin−1 activation flow of 21% O2 balanced in He (from room temperature to 400°C, 5°Cmin−1). After the activation a reactive flow (3.4% CO and 21% O2, balanced in helium) was passed through the reactor at room temperature. The total gas flow was fixed to 42mLmin−1 and the quantitative analysis was carried out with Blazers OmnistarBentchop mass spectrometer calibrated using certified gas mixtures of CO and CO2 in helium. The weight hourly space velocity of the catalytic test was 31.5Lg(cat)−1 h−1. The catalysts were tested in the reaction flow at room temperature until the steady state was reached. Then, the systems were heated to 400°C at 5°Cmin−1. To study in details the catalysts behavior as a function of Fe-content the same reaction was carried out at temperatures below 0°C. The reactor, loaded with fresh and activated sample, was immersed into cooling bath composed by liquid N2 and acetone. Once the temperature stabilized, the reactive flow was flushed through the reactor. The temperature was increased slowly to the room temperature and the quantitative analysis of the reactants and products was carried out on a Blazers OmnistarBentchop mass spectrometer. For the low temperature CO oxidation, all the samples were studied in the temperature range −80–170°C. 2.3.1 Preferential CO oxidation (PrOx) PrOx reaction was carried out at atmospheric pressure on a cylindrical fixed bed reactor of steel stainless 9mm inner diameter, with 100mLmin−1 of reaction feed composed by 1% CO, 1.5% O2, 10% CO2, 10%H2O, 50% H2 and He as balance. For each test 100mg of catalyst sieved between 100–200μm was load. Prior to the catalytic measurements, the samples were treated in 100mLmin−1 flow of 21% O2 in He, at 300°C for 1h. Water vapor was added in the dry gas stream via syringe pump Gilson 307. Products and reactants were separated and quantified by on-line gas chromatography (Agilent 6890) equipped with HP PLOT Q and HP-5 columns and TCD detector. The CO conversion was calculated according to Eq. (1) where COin is the amount of the CO in the inlet and COout that of the outlet. (1) C O C o n v e r s i o n ( % ) = C O i n − C O o u t C O i n × 100 The selectivity toward CO2 formation was calculated with Eq. (2). O2in corresponds to oxygen in the inlet and O2out to that in the outlet. (2) S e l e c t i v i t y ( % ) = C O i n − C O o u t 2 × C O 2 i n − C O 2 o u t × 100 3 Results and discussion 3.1 N2 adsorption isotherms The isotherms of all Ce–Fe composite oxides and catalysts (Fig. 1 A and C) present the characteristic profile of typical mesoporous materials. An increase in N2 adsorption volume, located in the p/p o range of 0.7–1.0 is observed. The pore volume of all Ce–Fe mixed oxides is higher than that of pure CeO2 and Fe2O3 (Table 1 ). The gold addition provokes slight decrease of the pore volume, suggesting that the material kept its mesoporous structure after the gold deposition. The pore size distribution (Fig. 1B and D) follows the same trend. The pore size of the solids appears to be affected by the sample composition. Gold deposition causes insignificant decrease of the pore size for Au/Fe2Ce8 and Au/Fe4Ce6, whilst a slight increase is observed for the other catalysts. This increase in the pore size was previously observed and ascribed to the nucleation of gold nanopartilces inside the pores of the support expanding the mesopore spacing [32,33]. The catalyst’s specific surface area is also influenced by the support composition (Table 1). The increase of the nominal Fe concentration causes a gradual decrease of S BET whereas gold deposition affects unimportantly the specific surface area. Indeed as shown in Fig. 2 A, the specific surface area reaches a maximum for both gold catalysts and supports at Fe2Ce8 composition. Rather similar trend was found for the catalysts gold uptake (Fig. 2B). The intermediate formulations Fe2Ce8, Fe4Ce6 and Fe6Ce4 allow higher capacity for gold incorporation. As indicated by Moreau et al. gold uptake strongly depends on the point of zero charge (PZC) of the support where gold is anchored, always considering the pH of the media during the synthesis procedure [34]. For basic pH values, taking into account the adsorption of the anionic species, lower the PZC of the support lower the uptake, an effect confirmed by the lower gold loading for pure hematite sample in comparison to ceria (5–6 vs. 6–7) [35]. For all the mixed samples, however, the gold uptake is always superior to the hematite and ceria pure supports. It could be due either to the increase of the specific surface of the oxides or to a second reason which might explain the gold enrichment observed for those samples. As commented in the introduction part, the use of appropriate dopants usually leads to the formation of oxygen vacancies on the ceria structure. These vacancies are viewed as electron rich sites where gold particles tend to nucleate [28]. Therefore, the enhanced gold uptake observed for the doped ceria samples could suggest higher concentration of oxygen vacancies on these mixed systems compared to the monometallic compositions. 3.2 XRD The XRD patterns are presented in Fig. 3 A and B, for the supports and gold catalysts, respectively. For the supports, all the diffractions could be assigned either to face-centered cubic fluorite structure of ceria with cell parameter a =0.541nm (# JCPDS File 034-0394) or to hematite, α-Fe2O3, (# JCPDS File 033-0664). The progressive addition of Fe2O3 to ceria causes broadening and shifts of the ceria diffractions toward higher 2theta angles, the later suggesting a solid solution like formation, proof being the Fe2Ce8 sample, for which the absence of the hematite phase is accompanied by the ceria lattice parameter decrease. The decrease of the lattice parameter originates the contraction of the unit cell due to the possible substitution of Ce4+ (0.97Å) by Fe3+ with quite lower ionic radius (0.64Å) and reveals formation of a cubic CeO2-like solid solution for this sample. Starting from Fe4Ce6 sample, weak diffractions related to hematite, appeared in the XRD pattern. For this sample the coexistence of Ce–Fe solid solution and Fe2O3 oxide could be imagined. A further increase of iron oxide concentration leads to an increase of the relative contribution of this phase, and consequently decreases that of ceria. For the ceria containing gold catalysts, weak and broad diffraction at 2θ =38.2° are registered and correspond to an average gold particles size of 6±0.5nm, calculated from Scherrer's equation on the (111) crystallographic plane (Table 1). 3.3 Raman spectroscopy Fig. 4 A shows the Raman spectra of the prepared supports. For pure CeO2 (Fe0Ce10) sample the spectrum is dominated by the band centred at 460cm−1 assigned to the F 2g Raman active mode of CeO2 fluorite structure, which can be described as symmetric breathing mode of the oxygen atoms around Ce4+ ions. The bands at 257, 602, and 1044cm−1 arise from the mixing of A 1g, Eg, and F 2g vibrational modes of the ceria lattice, due to second-order transverse acoustic mode, defect-induced mode, and second-order longitudinal optical mode, respectively [36,37]. The band at 602cm−1 is generally associated with the presence of ceria lattice defects, e.g. oxygen vacancies, preferentially placed within the cubic structure [36]. Detailed analysis (Fig. 4C) reveals the presence of weak bands situated at around 834, 852, 1171, 1322, 1620cm−1.The band at 1171cm−1 is due to OO stretching of adsorbed superoxide species (O2 −) while the bands at 852, and 834cm−1 can be assigned to OO stretching of peroxide adsorbed species (O2 2−) with different degrees of defect aggregation [37]. The band at 1620cm−1 suggests molecular oxygen adsorption and that above 1300cm−1 could be assigned to O2 δ− (0< δ <1) adspecies [38]. The presence of all those bands suggests that the adsorption equilibrium O2(g) ↔O2(a) ↔O2 δ− ↔O2 − ↔O2 2− exists on the ceria surface. In general as an approach for comparing the defect population concentration between the samples the relation between the intensity of the bands at 602cm−1 and 462 could be used. However, for the mixed CeFe oxide this approach is not fully accurate due to the presence of one visible band (Eg mode) of hematite structure (605cm−1). In any case, the apparent increase of the I 602/I 462 relation for the Fe2Ce8 sample, suggesting a structural oxygen vacancies formation could be clearly discerned by the absence of all other expected hematite modes for this sample (Fig. 4B). The later indicates high vacancies population for this sample, confirmed by the solid solution detection and absence of other iron containing phases observed by XRD and backing up the correlation between with the enhanced gold uptake of the mixed samples and the presence of oxygen vacancies. Further increase of iron results in the progressive mixing of the ceria and hematite Raman modes till the pure hematite sample where all predicted Raman modes by the group theory for iron oxide are observed (Fig. 4B) [39]. The addition of gold does not change the Raman spectra of the samples (Figure not shown) only resulting in slight fluorescence of the sample caused by the gold presence. 3.4 UV–vis Further information concerning the electronic properties of the materials was obtained through UV–vis spectroscopy. The diffuse reflectance spectra of the prepared supports are presented in Fig. 5 A. All the ceria containing samples present a broad absorption band centred at 291nm ascribed to the charge transfer from 2p valence band of O2− to 4f band of Ce4+ [40]. This band is slightly shifted and widened when small amounts of Fe are included in the catalyst evidencing the Ce–Fe interaction that results in sensitive modifications of the ceria electronic properties. For larger amount of Fe this band disappears and the spectra get closer to that of the pure Fe2O3. Indeed typical absorption bands of iron oxide sequentially appear in the spectra when the Fe loading increases. For example, the absorptions between 300 and 400nm were previously assigned to oligomeric Fe x O y clusters [41]. In the visible region (>450nm), several adsorption bands (475 and 530nm) characteristic of d–d 6 A 1g → 4 T 1g and 6 A 1g → 4 T 2g transitions in α-Fe2O3 are also detected [40]. Moreover, in order to evaluate the influence of iron oxide in ceria electronic structure, the spectra of all the Fe containing samples were deducted respect to the Fe0Ce10 sample allowing a better imaging of the Fe contribution (Fig. 5B). The subtracted spectra are also factorized to compensate the differences in the Fe loading. In this situation, some new bands related to pure hematite (Fe2O3) in the UV region (<300nm) showed up. In particular, the bands at 300 and 270nm attributed to O–Fe3+ charge transfer transitions of isolated Fe ions in tetrahedral and octahedral coordination [42]. This transfer occurs from the highest lying O 2p orbitals to the half occupied Fe 3d levels (t 2g → e g O h symetry and t 2 → e T d symetry). Very interestingly, among the mixed systems the Fe2Ce8 system seems to be the solid with the most notoroius iron influence since the iron oxide bands after substaction are rather prominents. Previous study with comparable systems also indicates that the strongest Ce–Fe interaction is attained for this iron loading resulting in a satisfactory modification of the electronic properties of the catalysts [40]. As for the gold based catalysts Fig. 5C presents the UV–vis spectra. A new absorption band is found showing a maximum in the range 550–600nm for some of the samples. This contribution is assigned to the well-known plasmon resonance of the gold nanoparticles [43]. In our case, such a feature was only detectable for the low iron loadings (Fe0Ce10 and Fe2Ce8). When the iron amount increases, the gold contribution is masked by the extended absorption of iron oxide in the visible region due to d–d transitions commented above. 3.5 Total CO oxidation Fig. 6 A shows the CO oxidation activity of the prepared samples. All the catalysts reached total CO conversion in the studied temperature range, however we can clearly distinguish between the Au–Ce based systems and the Au–Fe one. All the Ce-contained solids totally abated CO before 120°C whereas the Au/Fe solid reached full conversion at 205°C. The later evidences the role played by the support. Despite both CeO2 and Fe2O3 are considered as an active supports according to Schubert et al. [44] it seems that ceria presence in the catalyst formulation leads to superior CO oxidation activity. As all the ceria-based catalysts presented comparable results in a typical light-off experiment, a low temperature CO oxidation test was carried out in order to establish some differences among the samples (Fig. 6B). As a general tendency, the CO conversion curves shifted to lower temperatures when the reaction takes places under sub-ambient temperatures irrespectively of support composition. In other words, apparently the catalysts presented a major capacity for CO oxidation when they are tested at low temperatures, either due to facilitated CO adsorption or to gold particles re-dispersion. Recently, similar results for Au/FeO x /CeO2–Al2O3 catalysts were reported [29]. A remarkable decrease of the gold particle size when the reaction was carried out at sub-ambient temperature was found in such paper, the occurring gold re-dispersion at this temperature provides more active sites for the oxidation and as a consequence enhances the catalytic activity. The same phenomena could explain the activity in this series of catalysts at low temperature where the Au/Fe2Ce8 system is the most active and the Au/Fe system remains the less active sample. In addition, as indicated above the Au/Fe2Ce8 is the system with the largest S BET thus proving higher surface for gold re-dispersion and improving the overall performance. In order to compare quantitatively the activity of our systems with similar catalysts proposed by other authors, the specific reaction rates at 0°C and 25°C and turnover frequencies (TOF), using the dispersion of Au atom exposure to reactants flow, are calculated and presented in Table 2 . The dispersion of the gold nanoparticles considered as the active sites in the reaction is evaluated on the basis of the model of semihemispheric ball [45] and is presented together with the gold particle size in Table 2. From Table we can deduce that all the Ce–Fe mixed systems exhibit higher CO oxidation activities compared to the Au/Ce and the Au/Fe samples. The later underlines the impact on the Ce–Fe interaction which has been demonstrated by the characterization data. Again, TOF and reaction rates values confirm that Au/Fe2Ce8 is the best system within the series. Its reaction rate at 0°C expressed as molCOmolAu−1 s−1 (5.83×10−2) is superior to that reported by Kung et al. [46]. for a Au/CeO2 sample and to those of Au/Fe2O3/Al2O3 and Au/0.5Fe2O3/CeO2–Al2O3 catalysts reported in ref. [29] at 25°C. According to XRD, Raman and UV–vis data this system presents the strongest Ce–Fe contact thus favoring the creation of higher amounts of oxygen vacancies in the ceria lattice that are responsible for the activity enhancement. In any case, the nanogold catalysts supported on Ce–Fe mixed oxides presented rather good ability for CO oxidation even at sub-ambient temperatures indicating the suitability of these catalysts for environmental applications as for example, CO depletion in contaminated atmospheres. 3.6 Preferential CO oxidation (CO–PrOx) The catalytic activity of the prepared gold based catalyst in the CO–PrOx reaction is presented in Fig. 7 A. It should be pointed out that the PrOx study was carried out using a surrogate reforming gas mixture including CO2 and H2O. In principle, both CO2 and H2O may damage the catalytic performance for several reasons. For example, the presence of CO2 frequently leads to the formation of carbonaceous species in the catalyst surface acting as reactants sites blockers [47]. On the other hand, the presence of steam tend to slow down the CO oxidation rate of the gold based catalysts as previously demonstrated by Haruta et al. [48]. Besides, both CO2 and H2O could physically obstruct the arrival of CO to the catalyst́s active sites due to the unavoidable competitive adsorption. Despite all the drawbacks introduced by these molecules, our catalysts resulted very efficient in the preferential CO oxidation. Again, as observed for the direct CO oxidation, the systems with an optimal Ce–Fe contact are especially active. For instance, AuFe2Ce8, AuFe4Ce6 and AuFe6Ce4 reached very high CO conversion at low temperature. This observation highlights one of the main ideas of this paper: the catalytic skills of nanogold based catalysts can be boosted by modulating the physicochemical properties of the support. In particular for mesoporous ceria based solids the creation of oxygen vacancies and the modification of the electronic density due to the formation of mixed oxides with Fe benefits in a great extent the activity in oxidation reactions. The superiority of the mixed systems is evidenced in view of the relatively poor activity presented by Au/Fe0Ce10 and Au/Fe10Ce0 especially at low temperature (under 120°C). In fact, Au/Fe0Ce10 showed good activity in the high temperature range indicating that the positive effect obtained from the Ce–Fe interaction is more relevant at low temperature in good agreement with the results obtained in the total CO oxidation. Regarding the selectivity, Fig. 7B shows the selectivity curves obtained during the PrOx test. All the catalysts presented a similar trend, the selectivity toward CO oxidation decreases when the temperature increases. The latter is in line with the most of the literature data involving gold based catalysts for the CO–PrOx and could be explained in terms of the competitive H2/CO oxidation processes [49–51]. Carbon monoxide oxidation is favored at low temperature and gold based catalysts are very promising systems in this regard allowing high CO oxidation rates no matter the gas stream (direct or preferential CO oxidation environments). Nevertheless, when the temperature increases, H2 combustion becomes energetically more favorable and starts to control the selectivity of the overall process. In a recent publication we analysed in details the CO/H2 competition via pulses experiments reaching the conclusion that at low temperature CO is able to displace H2 from the surface and reach the actives sites of the catalyst and subsequently react. However, this ability of CO to remove hydrogen from the catalyst surface decreases with the temperature and therefore the CO oxidation diminishes in favor of the hydrogen oxidation marking the selectivity of the preferential CO oxidation [52]. However, the selectivity of this type of materials could be notably improved by adjusting some reaction parameters as for example O2/CO ratio and/or the space velocity [50]. Overall, the catalysts developed in this study can be categorized as rather efficient solids for the preferential CO oxidation in H2 rich streams and in the presence of CO2 and H2O. Very importantly the best CO oxidation activity is reached at low temperature (100–120°C) which represents a temperature window that matches pretty well with the working temperature of the PEM-FCs. 4 Conclusions A series of nanogold based catalysts rather useful for environmental applications have been designed in this work. The prepared catalysts exhibit fairly good activity in the total and preferential CO oxidation reactions. The activity of these materials is guided by the support composition which is the key parameter in the catalytic design. Our data indicate that mesoporous CeO2–Fe2O3 mixed oxides are ideal supports for gold nanoparticles. In particular ceria-rich compositions like Ce0.8Fe0.2 O2 seems to be optimum to achieve the best activity. From the Ce–Fe intimate contact some relevant features of the material, as for example the population of oxygen vacancies and the d-band structure, are altered affecting positively to the catalysts performance. As an additional advantage, the catalysts developed in this study are very effective in the CO–PrOx reaction under realistic post-reforming streams. Moreover, their activity is maximized at low temperatures matching rather well with the typical operation temperatures of the polymer electrolyte fuel cells converting our systems in an interesting alternative to be further explored in the field of hydrogen economy. Acknowledgements Financial support for this work has been obtained from Junta de Andalucía (TEP-8196) and from the Spanish Ministerio de Economía y Competitividad (ENE2012-374301-C03-01 and ENE2013-47880-C3-2-R) co-financed by FEDER funds from the European Union. The Bulgarian team gratefully acknowledge the financial support by the Bulgarian National Science Fund (Projects DFNI E-01/7-2012 and E-02/2-2014). References [1] R.J. Farrauto Y. Liu W. Ruettinger O. Ilinich L. Shore T. Giroux Catal. Rev. 49 2007 141 196 [2] M.A. Hickner H. Ghassemi Y.S. Kim B.R. Einsla J.E. McGrath Chem. Rev. 104 2004 4487 4612 [3] F. Joensen J.R. Rostrup-Niesen J. Power Sources 105 2002 195 201 [4] S. Royer D. Duprez ChemCatChem 3 2011 24 65 [5] K.C. Petallidou A.M. Efstathiou Appl. Catal. B 140–141 2013 333 347 [6] N. Bion F. Epron M. Moreno F. Mariño D. Duprez Top. Catal. 51 2008 76 88 [7] F. Mariño G. Baronetti M. Laborde N. Bion A. Le Valant F. Epron D. Duprez Int. J. Hydrogen Energy 33 2008 1345 1353 [8] G. Avgouropoulos M. Manzoli F. Boccuzzi T. Tabakova J. Papavasiliou T. Ioannides V. Idakiev J. Catal. 256 2008 237 247 [9] R. Burch Phys. Chem. Chem. Phys. 8 2006 5483 5500 [10] B. Hammer J.K. Nørskov Nature 376 1995 238 240 [11] A. Sandoval L. Delannoy C. Méthivier C. Louis R. Zanella Appl.Catal. A 504 2015 287 294 [12] S.A.C. Carabineiro S.S.T. Bastos J.J.M. Órfão M.F.R. Pereira J.J. Delgado J.L. Figueiredo Appl. Catal. A 381 2010 150 160 [13] S.A.C. Carabineiro A.M.T. Silva G. Dražić P.B. Tavares J.L. Figueiredo Catal. Today 154 2010 21 30 [14] S.A.C. Carabineiro A.M.T. Silva G. Dražić P.B. Tavares J.L. Figueiredo Catal. Today 154 2010 293 302 [15] D.L. Trimm Appl. Catal. A 296 2005 1 11 [16] X. Du D. Gao Z. Yuan N. Liu C. Zhang S. Wang Int. J. Hydrogen Energy 33 2008 3710 3718 [17] G. Avgouropoulos J. Papavasiliou T. Ioannides Catal. Commun. 9 2008 1656 1660 [18] S.A.C. Carabineiro N. Bogdanchikova P.B. Tavaresc J.L. Figueiredo RSC Adv. 2 2012 2957 2965 [19] M.A. Soria P. Pérez S.A.C. Carabineiro F.J. Maldonado-Hódar A. Mendes Luis M. Madeira Appl. Catal. A 470 2014 45 55 [20] A. Corma H. García Chem. Soc. Rev. 37 2008 2096 2126 [21] T. Tabakova F. Boccuzzi M. Manzoli D. Andreeva Appl. Catal. A 252 2003 385 397 [22] Z.Y. Yuan V. Idakiev A. Vantomme T. Tabakova T.-Z. Ren B.-L. Su Catal. Today 131 2008 203 210 [23] L. Pastor-Perez R. Buitrago-Sierra A. Sepulveda-Escribano Int. J. Hydrogen Energy 39 2014 17589 17599 [24] C. Pojanavaraphan W. Nakaranuwattana A. Luengnaruemitchai E. Gulari Chem. Eng. J. 240 2014 99 108 [25] M.M. Schubert V. Plzak J. Garche R.J. Behm Catal. Lett. 76 2001 143 150 [26] W. Deng J. De Jesus H. Saltsburg M. Flytzani-Stephanopoulos Appl. Catal. A 291 2005 126 135 [27] E. Ko E.D. Park K.W. Seo H.C. Lee D. Lee S. Kim Catal. Today 116 2006 377 383 [28] W.Y. Hernández M.A. Centeno F. Romero-Sarria J.A. Odriozola J. Phys. Chem. C 114 2010 10857 10865 [29] T.R. Reina S. Ivanova M.I. Domínguez M.A. Centeno J.A. Odriozola Appl. Catal. A 419–420 2012 58 66 [30] J.-L. Cao Y. Wang T.-Y. Zhang S.-H. Wu Z.-Y. Yuan Appl. Catal. B 78 2008 120 128 [31] T. Tabakova F. Boccuzzi M. Manzoli J.W. Sobczak V. Idakiev D. Andreeva Appl. Catal. B 49 2004 73 81 [32] M.I. Domínguez M. Sánchez M.A. Centeno M. Montes J.A. Odriozola Appl. Catal. A 302 2006 96 103 [33] Z. Konya V.F. Puntes I. Kiricsi J. Zhu J.W. Ager M.K. Ko H. Frei P. Alivisatos G.A. Somorjai Chem. Mater. 15 2003 1242 1248 [34] F. Moreau G.C. Bond Appl. Catal. A 302 2006 110 117 [35] G.A. Parks Chem. Rev. 65 1965 177 198 [36] V.V. Pushkarev V.I. Kovalchuk J.L. d'Itri J. Phys. Chem. B 108 2004 5341 5348 [37] Z. Wu M. Li J. Howe H.M. Meyer III S.H. Overbury Langmuir 26 21 2010 16595 16606 [38] R.Q. Long Y.P. Huang H.L. Wan J. Raman Spectrosc. 28 1997 29 32 [39] S.H. Shim T.S. Duffy Am. Mineral. 87 2001 318 326 [40] V. Petrovsky B.P. Gorman H.U. Anderson T. Petrovsky J. Appl. Phys. 90 2001 2517-252 [41] M. Schwidder M.S. Kumar K. Klementiev M.M. Pohl A. Bruckner W. Grunert J. Catal. 231 2005 314 330 [42] A.S. Reddy C.Y. Chen C.C. Chen S.H. Chen C.J. Lin K.H. Lin C.L. Chen S.C. Chang J. Mol. Catal. A: Chem. 318 2010 60 67 [43] N. Pestryakov N. Bogdanchikova A. Simakov I. Tuzovskaya F. Jentoft M. Farias A. Díaz Surf. Sci. 601 2007 3792 3795 [44] M.M. Schubert S. Hackenberg A.C. van Veen M. Muhler V. Plzak R.J. Behm J. Catal. 197 2001 113 122 [45] Y.-F. Han Z. Zhong K. Ramesh F. Chen L. Chen J. Phys. Chem. C 111 2007 3163 3170 [46] M.C. Kung R. Davis H.H. Kung J. Phys. Chem. C 111 2007 11767 11775 [47] D. Gamarra A. Martínez-Arias J. Catal. 263 2009 189 195 [48] M. Haruta N. Yamada T. Kobayashi S. Iijima J. Catal. 115 1989 301 309 [49] A. Luengnaruemitchai S. Osuwan E. Gulari Int. J. Hydrogen Energy 29 2004 429 435 [50] T.R. Reina E. Papadopoulou S. Palma S. Ivanova M.A. Centeno T. Ioannides J.A. Odriozola Appl. Catal. B 150–151 2014 554 563 [51] H.C. Lee D.H. Kim Catal. Today 132 2008 109 116 [52] T.R. Reina C. Megias-Sayago A. Perez S. Ivanova M.A. Centeno J.A. Odriozola J. Catal. 326 2015 161 171",
      "scopus-id": "84954288392",
      "coredata": {
        "eid": "1-s2.0-S1381116916300024",
        "dc:description": "Herein, a series of highly efficient gold based catalysts supported on mesoporous CeO2–Fe2O3 mixed oxides for CO elimination reactions have been developed. The materials have been fully characterized by means of XRD, Raman and UV–vis spectroscopies among other techniques. We identify the Ce–Fe synergism as a fundamental factor controlling the catalytic performance. Our data clearly reveal that the CO oxidation activity is maximized when the electronic and structural properties of the support are carefully controlled. In this situation, fairly good catalysts for environmental applications as for example H2 streams purification for fuel cell goals or CO abatement at room temperature can be designed.",
        "openArchiveArticle": "false",
        "prism:coverDate": "2016-04-30",
        "openaccessUserLicense": null,
        "prism:aggregationType": "Journal",
        "prism:url": "https://api.elsevier.com/content/article/pii/S1381116916300024",
        "dc:creator": [
          {
            "@_fa": "true",
            "$": "Reina, Tomás Ramírez"
          },
          {
            "@_fa": "true",
            "$": "Ivanova, Svetlana"
          },
          {
            "@_fa": "true",
            "$": "Idakiev, Vasko"
          },
          {
            "@_fa": "true",
            "$": "Tabakova, Tatyana"
          },
          {
            "@_fa": "true",
            "$": "Centeno, Miguel Angel"
          },
          {
            "@_fa": "true",
            "$": "Deng, Qing-Fang"
          },
          {
            "@_fa": "true",
            "$": "Yuan, Zhong-Yong"
          },
          {
            "@_fa": "true",
            "$": "Odriozola, José Antonio"
          }
        ],
        "link": [
          {
            "@_fa": "true",
            "@rel": "self",
            "@href": "https://api.elsevier.com/content/article/pii/S1381116916300024"
          },
          {
            "@_fa": "true",
            "@rel": "scidir",
            "@href": "https://www.sciencedirect.com/science/article/pii/S1381116916300024"
          }
        ],
        "dc:format": "application/json",
        "openaccessType": null,
        "pii": "S1381-1169(16)30002-4",
        "prism:volume": "414",
        "prism:publisher": "Elsevier B.V.",
        "dc:title": "Nanogold mesoporous iron promoted ceria catalysts for total and preferential CO oxidation reactions",
        "prism:copyright": "Copyright © 2016 Elsevier B.V. All rights reserved.",
        "openaccess": "0",
        "prism:issn": "13811169",
        "dcterms:subject": [
          {
            "@_fa": "true",
            "$": "Gold catalysts"
          },
          {
            "@_fa": "true",
            "$": "Mesoporous cerium oxide"
          },
          {
            "@_fa": "true",
            "$": "Low temperature CO oxidation"
          },
          {
            "@_fa": "true",
            "$": "PrOx"
          },
          {
            "@_fa": "true",
            "$": "H2 purification"
          }
        ],
        "openaccessArticle": "false",
        "prism:publicationName": "Journal of Molecular Catalysis A: Chemical",
        "openaccessSponsorType": null,
        "prism:pageRange": "62-71",
        "prism:endingPage": "71",
        "pubType": "fla",
        "prism:coverDisplayDate": "April 2016",
        "prism:doi": "10.1016/j.molcata.2016.01.003",
        "prism:startingPage": "62",
        "dc:identifier": "doi:10.1016/j.molcata.2016.01.003",
        "openaccessSponsorName": null
      },
      "objects": {
        "object": [
          {
            "@category": "thumbnail",
            "@height": "88",
            "@width": "219",
            "@_fa": "true",
            "$": "https://api.elsevier.com/content/object/eid/1-s2.0-S1381116916300024-fx1.sml?httpAccept=%2A%2F%2A",
            "@multimediatype": "GIF image file",
            "@type": "IMAGE-THUMBNAIL",
            "@size": "7838",
            "@ref": "fx1",
            "@mimetype": "image/gif"
          },
          {
            "@category": "thumbnail",
            "@height": "164",
            "@width": "212",
            "@_fa": "true",
            "$": "https://api.elsevier.com/content/object/eid/1-s2.0-S1381116916300024-gr1.sml?httpAccept=%2A%2F%2A",
            "@multimediatype": "GIF image file",
            "@type": "IMAGE-THUMBNAIL",
            "@size": "11849",
            "@ref": "gr1",
            "@mimetype": "image/gif"
          },
          {
            "@category": "thumbnail",
            "@height": "88",
            "@width": "219",
            "@_fa": "true",
            "$": "https://api.elsevier.com/content/object/eid/1-s2.0-S1381116916300024-gr2.sml?httpAccept=%2A%2F%2A",
            "@multimediatype": "GIF image file",
            "@type": "IMAGE-THUMBNAIL",
            "@size": "2229",
            "@ref": "gr2",
            "@mimetype": "image/gif"
          },
          {
            "@category": "thumbnail",
            "@height": "164",
            "@width": "213",
            "@_fa": "true",
            "$": "https://api.elsevier.com/content/object/eid/1-s2.0-S1381116916300024-gr3.sml?httpAccept=%2A%2F%2A",
            "@multimediatype": "GIF image file",
            "@type": "IMAGE-THUMBNAIL",
            "@size": "9477",
            "@ref": "gr3",
            "@mimetype": "image/gif"
          },
          {
            "@category": "thumbnail",
            "@height": "142",
            "@width": "219",
            "@_fa": "true",
            "$": "https://api.elsevier.com/content/object/eid/1-s2.0-S1381116916300024-gr4.sml?httpAccept=%2A%2F%2A",
            "@multimediatype": "GIF image file",
            "@type": "IMAGE-THUMBNAIL",
            "@size": "7304",
            "@ref": "gr4",
            "@mimetype": "image/gif"
          },
          {
            "@category": "thumbnail",
            "@height": "164",
            "@width": "211",
            "@_fa": "true",
            "$": "https://api.elsevier.com/content/object/eid/1-s2.0-S1381116916300024-gr5.sml?httpAccept=%2A%2F%2A",
            "@multimediatype": "GIF image file",
            "@type": "IMAGE-THUMBNAIL",
            "@size": "8988",
            "@ref": "gr5",
            "@mimetype": "image/gif"
          },
          {
            "@category": "thumbnail",
            "@height": "83",
            "@width": "219",
            "@_fa": "true",
            "$": "https://api.elsevier.com/content/object/eid/1-s2.0-S1381116916300024-gr6.sml?httpAccept=%2A%2F%2A",
            "@multimediatype": "GIF image file",
            "@type": "IMAGE-THUMBNAIL",
            "@size": "5879",
            "@ref": "gr6",
            "@mimetype": "image/gif"
          },
          {
            "@category": "thumbnail",
            "@height": "163",
            "@width": "101",
            "@_fa": "true",
            "$": "https://api.elsevier.com/content/object/eid/1-s2.0-S1381116916300024-gr7.sml?httpAccept=%2A%2F%2A",
            "@multimediatype": "GIF image file",
            "@type": "IMAGE-THUMBNAIL",
            "@size": "4262",
            "@ref": "gr7",
            "@mimetype": "image/gif"
          },
          {
            "@category": "standard",
            "@height": "200",
            "@width": "500",
            "@_fa": "true",
            "$": "https://api.elsevier.com/content/object/eid/1-s2.0-S1381116916300024-fx1.jpg?httpAccept=%2A%2F%2A",
            "@multimediatype": "JPEG image file",
            "@type": "IMAGE-DOWNSAMPLED",
            "@size": "30090",
            "@ref": "fx1",
            "@mimetype": "image/jpeg"
          },
          {
            "@category": "standard",
            "@height": "591",
            "@width": "763",
            "@_fa": "true",
            "$": "https://api.elsevier.com/content/object/eid/1-s2.0-S1381116916300024-gr1.jpg?httpAccept=%2A%2F%2A",
            "@multimediatype": "JPEG image file",
            "@type": "IMAGE-DOWNSAMPLED",
            "@size": "114331",
            "@ref": "gr1",
            "@mimetype": "image/jpeg"
          },
          {
            "@category": "standard",
            "@height": "304",
            "@width": "753",
            "@_fa": "true",
            "$": "https://api.elsevier.com/content/object/eid/1-s2.0-S1381116916300024-gr2.jpg?httpAccept=%2A%2F%2A",
            "@multimediatype": "JPEG image file",
            "@type": "IMAGE-DOWNSAMPLED",
            "@size": "21006",
            "@ref": "gr2",
            "@mimetype": "image/jpeg"
          },
          {
            "@category": "standard",
            "@height": "580",
            "@width": "753",
            "@_fa": "true",
            "$": "https://api.elsevier.com/content/object/eid/1-s2.0-S1381116916300024-gr3.jpg?httpAccept=%2A%2F%2A",
            "@multimediatype": "JPEG image file",
            "@type": "IMAGE-DOWNSAMPLED",
            "@size": "96573",
            "@ref": "gr3",
            "@mimetype": "image/jpeg"
          },
          {
            "@category": "standard",
            "@height": "488",
            "@width": "753",
            "@_fa": "true",
            "$": "https://api.elsevier.com/content/object/eid/1-s2.0-S1381116916300024-gr4.jpg?httpAccept=%2A%2F%2A",
            "@multimediatype": "JPEG image file",
            "@type": "IMAGE-DOWNSAMPLED",
            "@size": "68217",
            "@ref": "gr4",
            "@mimetype": "image/jpeg"
          },
          {
            "@category": "standard",
            "@height": "584",
            "@width": "753",
            "@_fa": "true",
            "$": "https://api.elsevier.com/content/object/eid/1-s2.0-S1381116916300024-gr5.jpg?httpAccept=%2A%2F%2A",
            "@multimediatype": "JPEG image file",
            "@type": "IMAGE-DOWNSAMPLED",
            "@size": "81870",
            "@ref": "gr5",
            "@mimetype": "image/jpeg"
          },
          {
            "@category": "standard",
            "@height": "286",
            "@width": "753",
            "@_fa": "true",
            "$": "https://api.elsevier.com/content/object/eid/1-s2.0-S1381116916300024-gr6.jpg?httpAccept=%2A%2F%2A",
            "@multimediatype": "JPEG image file",
            "@type": "IMAGE-DOWNSAMPLED",
            "@size": "51036",
            "@ref": "gr6",
            "@mimetype": "image/jpeg"
          },
          {
            "@category": "standard",
            "@height": "854",
            "@width": "528",
            "@_fa": "true",
            "$": "https://api.elsevier.com/content/object/eid/1-s2.0-S1381116916300024-gr7.jpg?httpAccept=%2A%2F%2A",
            "@multimediatype": "JPEG image file",
            "@type": "IMAGE-DOWNSAMPLED",
            "@size": "67512",
            "@ref": "gr7",
            "@mimetype": "image/jpeg"
          },
          {
            "@category": "high",
            "@height": "886",
            "@width": "2213",
            "@_fa": "true",
            "$": "https://api.elsevier.com/content/object/eid/1-s2.0-S1381116916300024-fx1_lrg.jpg?httpAccept=%2A%2F%2A",
            "@multimediatype": "JPEG image file",
            "@type": "IMAGE-HIGH-RES",
            "@size": "211760",
            "@ref": "fx1",
            "@mimetype": "image/jpeg"
          },
          {
            "@category": "high",
            "@height": "2616",
            "@width": "3377",
            "@_fa": "true",
            "$": "https://api.elsevier.com/content/object/eid/1-s2.0-S1381116916300024-gr1_lrg.jpg?httpAccept=%2A%2F%2A",
            "@multimediatype": "JPEG image file",
            "@type": "IMAGE-HIGH-RES",
            "@size": "874691",
            "@ref": "gr1",
            "@mimetype": "image/jpeg"
          },
          {
            "@category": "high",
            "@height": "1345",
            "@width": "3333",
            "@_fa": "true",
            "$": "https://api.elsevier.com/content/object/eid/1-s2.0-S1381116916300024-gr2_lrg.jpg?httpAccept=%2A%2F%2A",
            "@multimediatype": "JPEG image file",
            "@type": "IMAGE-HIGH-RES",
            "@size": "153951",
            "@ref": "gr2",
            "@mimetype": "image/jpeg"
          },
          {
            "@category": "high",
            "@height": "2569",
            "@width": "3333",
            "@_fa": "true",
            "$": "https://api.elsevier.com/content/object/eid/1-s2.0-S1381116916300024-gr3_lrg.jpg?httpAccept=%2A%2F%2A",
            "@multimediatype": "JPEG image file",
            "@type": "IMAGE-HIGH-RES",
            "@size": "746020",
            "@ref": "gr3",
            "@mimetype": "image/jpeg"
          },
          {
            "@category": "high",
            "@height": "2158",
            "@width": "3333",
            "@_fa": "true",
            "$": "https://api.elsevier.com/content/object/eid/1-s2.0-S1381116916300024-gr4_lrg.jpg?httpAccept=%2A%2F%2A",
            "@multimediatype": "JPEG image file",
            "@type": "IMAGE-HIGH-RES",
            "@size": "552059",
            "@ref": "gr4",
            "@mimetype": "image/jpeg"
          },
          {
            "@category": "high",
            "@height": "2583",
            "@width": "3333",
            "@_fa": "true",
            "$": "https://api.elsevier.com/content/object/eid/1-s2.0-S1381116916300024-gr5_lrg.jpg?httpAccept=%2A%2F%2A",
            "@multimediatype": "JPEG image file",
            "@type": "IMAGE-HIGH-RES",
            "@size": "684169",
            "@ref": "gr5",
            "@mimetype": "image/jpeg"
          },
          {
            "@category": "high",
            "@height": "1266",
            "@width": "3333",
            "@_fa": "true",
            "$": "https://api.elsevier.com/content/object/eid/1-s2.0-S1381116916300024-gr6_lrg.jpg?httpAccept=%2A%2F%2A",
            "@multimediatype": "JPEG image file",
            "@type": "IMAGE-HIGH-RES",
            "@size": "410441",
            "@ref": "gr6",
            "@mimetype": "image/jpeg"
          },
          {
            "@category": "high",
            "@height": "3781",
            "@width": "2339",
            "@_fa": "true",
            "$": "https://api.elsevier.com/content/object/eid/1-s2.0-S1381116916300024-gr7_lrg.jpg?httpAccept=%2A%2F%2A",
            "@multimediatype": "JPEG image file",
            "@type": "IMAGE-HIGH-RES",
            "@size": "520646",
            "@ref": "gr7",
            "@mimetype": "image/jpeg"
          },
          {
            "@category": "thumbnail",
            "@height": "34",
            "@width": "281",
            "@_fa": "true",
            "$": "https://api.elsevier.com/content/object/eid/1-s2.0-S1381116916300024-si1.gif?httpAccept=%2A%2F%2A",
            "@multimediatype": "GIF image file",
            "@type": "ALTIMG",
            "@size": "1211",
            "@ref": "si1",
            "@mimetype": "image/gif"
          },
          {
            "@category": "thumbnail",
            "@height": "34",
            "@width": "289",
            "@_fa": "true",
            "$": "https://api.elsevier.com/content/object/eid/1-s2.0-S1381116916300024-si2.gif?httpAccept=%2A%2F%2A",
            "@multimediatype": "GIF image file",
            "@type": "ALTIMG",
            "@size": "1356",
            "@ref": "si2",
            "@mimetype": "image/gif"
          }
        ]
      },
      "link": {
        "@rel": "abstract",
        "@href": "https://api.elsevier.com/content/abstract/scopus_id/84954288392"
      }
    }
  }
}