{
  "metadata": {
    "title": "Reaction kinetics and mechanism of benzene combustion over the NiMnO<ce:inf loc=post>3</ce:inf>/CeO<ce:inf loc=post>2</ce:inf>/Cordierite catalyst",
    "authors": "; ; ",
    "journal": "Journal of Molecular Catalysis A: Chemical",
    "date": "2016-05-01",
    "doi": "10.1016/j.molcata.2016.01.023",
    "abstract": "",
    "uri": "https://api.elsevier.com/content/article/pii/S1381116916300231",
    "pii": "S1381116916300231"
  },
  "fulltext": {
    "full-text-retrieval-response": {
      "scopus-eid": "2-s2.0-84958956329",
      "originalText": "serial JL 271358 291210 291744 291790 291809 31 Journal of Molecular Catalysis A: Chemical JOURNALMOLECULARCATALYSISACHEMICAL 2016-01-22 2016-01-22 2016-02-22 2016-02-22 2018-03-14T19:05:17 1-s2.0-S1381116916300231 S1381-1169(16)30023-1 S1381116916300231 10.1016/j.molcata.2016.01.023 S300 S300.4 FULL-TEXT 1-s2.0-S1381116916X00027 2025-07-16T16:48:29.225658Z 0 0 20160501 2016 2016-01-22T16:04:39.339033Z absattachment articleinfo articletitlenorm authfirstinitialnorm authfirstsurnamenorm cid cids contenttype copyright crossmark dateloaded dateloadedtxt datesearch datesort dateupdated dco docsubtype doctype doi eid ewtransactionid hubeid indexeddate issn issnnorm itemstage itemtransactionid itemweight openaccess openarchive pg pgfirst pglast pii piinorm pubdatestart pubdatetxt pubyr sectiontitle sortorder srctitle srctitlenorm srctype ssids alllist content subj subheadings suppl tomb volfirst volissue volumelist webpdf webpdfpagecount yearnav figure table e-component body mmlmath acknowledge affil articletitle auth authfirstini authfull authkeywords authlast grantnumber grantsponsor primabst ref specialabst 1381-1169 13811169 true 415 415 C Volume 415 20 160 167 160 167 20160501 1 May 2016 2016-05-01 2016 Regular Papers article fla Copyright © 2016 Elsevier B.V. All rights reserved. REACTIONKINETICSMECHANISMBENZENECOMBUSTIONOVERNIMNO3CEO2CORDIERITECATALYST LI B 1 Introduction 2 Materials and methods 2.1 Catalyst preparation 2.2 Catalyst characterization 2.3 Experimental setup 2.4 Effect of mass transfer limitations 2.4.1 External mass transfer limitations 2.4.2 Internal mass transfer limitations 3 Results and discussion 3.1 Effect of mass transfer limitations 3.1.1 External mass transfer limitations 3.1.2 Internal mass transfer limitations 3.2 Catalytic combustion performance 3.3 The kinetic models of the reaction 3.3.1 Power-Law model 3.3.2 Mars–Van Krevelen Model 3.4 Reaction mechanism 4 Conclusions Acknowledgments References PECCHI 2011 1067 1073 G REZLESCU 2015 4430 4437 N ZHOU 2015 932 941 G DELIMARIS 2009 295 302 D WU 2010 569 576 D PIUMETTI 2015 277 287 M GARCIA 2005 1 11 T MU 2008 1874 1877 Z WU 2014 1559 1564 D ZHANG 2012 1109 1114 X DENG 2009 60 67 J YANG 2015 361 369 P LI 2014 2359 2363 B BEDIA 2010 8 18 J CHOUDHARY 2005 54 63 V BENARD 2013 63 66 S HAN 2008 261 268 Y MEYER 2011 903 908 C ABDULLAH 2003 6059 6067 A PEI 2015 134 141 J HU 2011 1185 1192 C HURTADO 2004 229 238 P MANTA 2012 2147 2154 C LI 2013 686 691 H CHEN 2015 620 630 H ZHANG 2013 310 315 C CHOUDARY 2005 1575 1581 V ARZAMENDI 2007 9037 9044 G LEONTIOU 2003 143 154 A RIDA 2006 963 968 K LIX2016X160 LIX2016X160X167 LIX2016X160XB LIX2016X160X167XB 2018-02-22T00:00:00Z http://creativecommons.org/licenses/by-nc-nd/4.0/ item S1381-1169(16)30023-1 S1381116916300231 1-s2.0-S1381116916300231 10.1016/j.molcata.2016.01.023 271358 2018-03-14T22:15:09.284905Z 2016-05-01 1-s2.0-S1381116916300231-main.pdf https://s3-eu-west-1.amazonaws.com/prod-ucs-content-store-eu-west/content/pii:S1381116916300231/MAIN/application/pdf/85b274675009087a26beedeaa7e83c64/main.pdf https://s3.amazonaws.com/prod-ucs-content-store-us-east/content/pii:S1381116916300231/MAIN/application/pdf/85b274675009087a26beedeaa7e83c64/main.pdf main.pdf pdf true 1602787 MAIN 8 1-s2.0-S1381116916300231-main_1.png https://s3-eu-west-1.amazonaws.com/prod-ucs-content-store-eu-west/content/pii:S1381116916300231/PREVIEW/image/png/6031c97949fbf321aaab4813d886d9d3/main_1.png https://s3.amazonaws.com/prod-ucs-content-store-us-east/content/pii:S1381116916300231/PREVIEW/image/png/6031c97949fbf321aaab4813d886d9d3/main_1.png main_1.png png 55691 849 656 IMAGE-WEB-PDF 1 1-s2.0-S1381116916300231-fx1.sml https://s3-eu-west-1.amazonaws.com/prod-ucs-content-store-eu-west/content/pii:S1381116916300231/fx1/THUMBNAIL/image/gif/c0972c10305c90213ada4b3736b166b8/fx1.sml https://s3.amazonaws.com/prod-ucs-content-store-us-east/content/pii:S1381116916300231/fx1/THUMBNAIL/image/gif/c0972c10305c90213ada4b3736b166b8/fx1.sml fx1 true fx1.sml sml 4966 88 219 IMAGE-THUMBNAIL 1-s2.0-S1381116916300231-gr1.sml https://s3-eu-west-1.amazonaws.com/prod-ucs-content-store-eu-west/content/pii:S1381116916300231/gr1/THUMBNAIL/image/gif/2879bc0746852ed4e39f3d97d41a84a2/gr1.sml https://s3.amazonaws.com/prod-ucs-content-store-us-east/content/pii:S1381116916300231/gr1/THUMBNAIL/image/gif/2879bc0746852ed4e39f3d97d41a84a2/gr1.sml gr1 gr1.sml sml 3601 164 214 IMAGE-THUMBNAIL 1-s2.0-S1381116916300231-gr10.sml https://s3-eu-west-1.amazonaws.com/prod-ucs-content-store-eu-west/content/pii:S1381116916300231/gr10/THUMBNAIL/image/gif/efac83ab8773fbc5c125fae3d4a7bca1/gr10.sml https://s3.amazonaws.com/prod-ucs-content-store-us-east/content/pii:S1381116916300231/gr10/THUMBNAIL/image/gif/efac83ab8773fbc5c125fae3d4a7bca1/gr10.sml gr10 gr10.sml sml 3732 164 101 IMAGE-THUMBNAIL 1-s2.0-S1381116916300231-gr2.sml https://s3-eu-west-1.amazonaws.com/prod-ucs-content-store-eu-west/content/pii:S1381116916300231/gr2/THUMBNAIL/image/gif/144e4e1d16cb418c605130f145bbe8fd/gr2.sml https://s3.amazonaws.com/prod-ucs-content-store-us-east/content/pii:S1381116916300231/gr2/THUMBNAIL/image/gif/144e4e1d16cb418c605130f145bbe8fd/gr2.sml gr2 gr2.sml sml 3036 164 212 IMAGE-THUMBNAIL 1-s2.0-S1381116916300231-gr3.sml https://s3-eu-west-1.amazonaws.com/prod-ucs-content-store-eu-west/content/pii:S1381116916300231/gr3/THUMBNAIL/image/gif/e532fe27894e32a17cc2d39a3fec04b6/gr3.sml https://s3.amazonaws.com/prod-ucs-content-store-us-east/content/pii:S1381116916300231/gr3/THUMBNAIL/image/gif/e532fe27894e32a17cc2d39a3fec04b6/gr3.sml gr3 gr3.sml sml 6865 163 219 IMAGE-THUMBNAIL 1-s2.0-S1381116916300231-gr4.sml https://s3-eu-west-1.amazonaws.com/prod-ucs-content-store-eu-west/content/pii:S1381116916300231/gr4/THUMBNAIL/image/gif/a9985373165d0419f1211b3433121bec/gr4.sml https://s3.amazonaws.com/prod-ucs-content-store-us-east/content/pii:S1381116916300231/gr4/THUMBNAIL/image/gif/a9985373165d0419f1211b3433121bec/gr4.sml gr4 gr4.sml sml 4942 161 219 IMAGE-THUMBNAIL 1-s2.0-S1381116916300231-gr5.sml https://s3-eu-west-1.amazonaws.com/prod-ucs-content-store-eu-west/content/pii:S1381116916300231/gr5/THUMBNAIL/image/gif/0dc6a1999d21d01c861a35a12ff63ceb/gr5.sml https://s3.amazonaws.com/prod-ucs-content-store-us-east/content/pii:S1381116916300231/gr5/THUMBNAIL/image/gif/0dc6a1999d21d01c861a35a12ff63ceb/gr5.sml gr5 gr5.sml sml 6932 164 216 IMAGE-THUMBNAIL 1-s2.0-S1381116916300231-gr6.sml https://s3-eu-west-1.amazonaws.com/prod-ucs-content-store-eu-west/content/pii:S1381116916300231/gr6/THUMBNAIL/image/gif/27a1f3372b11a541118fe5b1e631e783/gr6.sml https://s3.amazonaws.com/prod-ucs-content-store-us-east/content/pii:S1381116916300231/gr6/THUMBNAIL/image/gif/27a1f3372b11a541118fe5b1e631e783/gr6.sml gr6 gr6.sml sml 5640 164 218 IMAGE-THUMBNAIL 1-s2.0-S1381116916300231-gr7.sml https://s3-eu-west-1.amazonaws.com/prod-ucs-content-store-eu-west/content/pii:S1381116916300231/gr7/THUMBNAIL/image/gif/fa09ef739cb32c621c97e9cc2dd78778/gr7.sml https://s3.amazonaws.com/prod-ucs-content-store-us-east/content/pii:S1381116916300231/gr7/THUMBNAIL/image/gif/fa09ef739cb32c621c97e9cc2dd78778/gr7.sml gr7 gr7.sml sml 3813 164 209 IMAGE-THUMBNAIL 1-s2.0-S1381116916300231-gr8.sml https://s3-eu-west-1.amazonaws.com/prod-ucs-content-store-eu-west/content/pii:S1381116916300231/gr8/THUMBNAIL/image/gif/6d442b247bcb58ce5f20952291e76445/gr8.sml https://s3.amazonaws.com/prod-ucs-content-store-us-east/content/pii:S1381116916300231/gr8/THUMBNAIL/image/gif/6d442b247bcb58ce5f20952291e76445/gr8.sml gr8 gr8.sml sml 5189 164 209 IMAGE-THUMBNAIL 1-s2.0-S1381116916300231-gr9.sml https://s3-eu-west-1.amazonaws.com/prod-ucs-content-store-eu-west/content/pii:S1381116916300231/gr9/THUMBNAIL/image/gif/f9e9c01e9912b0131d24986b0a87edf6/gr9.sml https://s3.amazonaws.com/prod-ucs-content-store-us-east/content/pii:S1381116916300231/gr9/THUMBNAIL/image/gif/f9e9c01e9912b0131d24986b0a87edf6/gr9.sml gr9 gr9.sml sml 11851 149 219 IMAGE-THUMBNAIL 1-s2.0-S1381116916300231-fx1.jpg https://s3-eu-west-1.amazonaws.com/prod-ucs-content-store-eu-west/content/pii:S1381116916300231/fx1/DOWNSAMPLED/image/jpeg/0060b90d1173c0f8ea396e111596cba5/fx1.jpg https://s3.amazonaws.com/prod-ucs-content-store-us-east/content/pii:S1381116916300231/fx1/DOWNSAMPLED/image/jpeg/0060b90d1173c0f8ea396e111596cba5/fx1.jpg fx1 true fx1.jpg jpg 20338 200 500 IMAGE-DOWNSAMPLED 1-s2.0-S1381116916300231-gr1.jpg https://s3-eu-west-1.amazonaws.com/prod-ucs-content-store-eu-west/content/pii:S1381116916300231/gr1/DOWNSAMPLED/image/jpeg/4510836099bcd8c3ef6d2843f384aa6b/gr1.jpg https://s3.amazonaws.com/prod-ucs-content-store-us-east/content/pii:S1381116916300231/gr1/DOWNSAMPLED/image/jpeg/4510836099bcd8c3ef6d2843f384aa6b/gr1.jpg gr1 gr1.jpg jpg 11008 288 377 IMAGE-DOWNSAMPLED 1-s2.0-S1381116916300231-gr10.jpg https://s3-eu-west-1.amazonaws.com/prod-ucs-content-store-eu-west/content/pii:S1381116916300231/gr10/DOWNSAMPLED/image/jpeg/316c9935e7fa7235fc34986c16af499e/gr10.jpg https://s3.amazonaws.com/prod-ucs-content-store-us-east/content/pii:S1381116916300231/gr10/DOWNSAMPLED/image/jpeg/316c9935e7fa7235fc34986c16af499e/gr10.jpg gr10 gr10.jpg jpg 38355 635 392 IMAGE-DOWNSAMPLED 1-s2.0-S1381116916300231-gr2.jpg https://s3-eu-west-1.amazonaws.com/prod-ucs-content-store-eu-west/content/pii:S1381116916300231/gr2/DOWNSAMPLED/image/jpeg/10822eddda9c2da1332d7d07784ea327/gr2.jpg https://s3.amazonaws.com/prod-ucs-content-store-us-east/content/pii:S1381116916300231/gr2/DOWNSAMPLED/image/jpeg/10822eddda9c2da1332d7d07784ea327/gr2.jpg gr2 gr2.jpg jpg 10271 291 377 IMAGE-DOWNSAMPLED 1-s2.0-S1381116916300231-gr3.jpg https://s3-eu-west-1.amazonaws.com/prod-ucs-content-store-eu-west/content/pii:S1381116916300231/gr3/DOWNSAMPLED/image/jpeg/18a0039e3b1d5240ce3be26c45cd1e84/gr3.jpg https://s3.amazonaws.com/prod-ucs-content-store-us-east/content/pii:S1381116916300231/gr3/DOWNSAMPLED/image/jpeg/18a0039e3b1d5240ce3be26c45cd1e84/gr3.jpg gr3 gr3.jpg jpg 27079 293 393 IMAGE-DOWNSAMPLED 1-s2.0-S1381116916300231-gr4.jpg https://s3-eu-west-1.amazonaws.com/prod-ucs-content-store-eu-west/content/pii:S1381116916300231/gr4/DOWNSAMPLED/image/jpeg/604359e6445801d71c064838831a6cf1/gr4.jpg https://s3.amazonaws.com/prod-ucs-content-store-us-east/content/pii:S1381116916300231/gr4/DOWNSAMPLED/image/jpeg/604359e6445801d71c064838831a6cf1/gr4.jpg gr4 gr4.jpg jpg 17202 288 393 IMAGE-DOWNSAMPLED 1-s2.0-S1381116916300231-gr5.jpg https://s3-eu-west-1.amazonaws.com/prod-ucs-content-store-eu-west/content/pii:S1381116916300231/gr5/DOWNSAMPLED/image/jpeg/ae18d546383e75ec814e866a0cc33dca/gr5.jpg https://s3.amazonaws.com/prod-ucs-content-store-us-east/content/pii:S1381116916300231/gr5/DOWNSAMPLED/image/jpeg/ae18d546383e75ec814e866a0cc33dca/gr5.jpg gr5 gr5.jpg jpg 26073 293 386 IMAGE-DOWNSAMPLED 1-s2.0-S1381116916300231-gr6.jpg https://s3-eu-west-1.amazonaws.com/prod-ucs-content-store-eu-west/content/pii:S1381116916300231/gr6/DOWNSAMPLED/image/jpeg/e42e3ea2a9d87572e2c9842740fed664/gr6.jpg https://s3.amazonaws.com/prod-ucs-content-store-us-east/content/pii:S1381116916300231/gr6/DOWNSAMPLED/image/jpeg/e42e3ea2a9d87572e2c9842740fed664/gr6.jpg gr6 gr6.jpg jpg 21028 296 393 IMAGE-DOWNSAMPLED 1-s2.0-S1381116916300231-gr7.jpg https://s3-eu-west-1.amazonaws.com/prod-ucs-content-store-eu-west/content/pii:S1381116916300231/gr7/DOWNSAMPLED/image/jpeg/b13709d0e21de8525c6f64a0543c1a1e/gr7.jpg https://s3.amazonaws.com/prod-ucs-content-store-us-east/content/pii:S1381116916300231/gr7/DOWNSAMPLED/image/jpeg/b13709d0e21de8525c6f64a0543c1a1e/gr7.jpg gr7 gr7.jpg jpg 12414 306 389 IMAGE-DOWNSAMPLED 1-s2.0-S1381116916300231-gr8.jpg https://s3-eu-west-1.amazonaws.com/prod-ucs-content-store-eu-west/content/pii:S1381116916300231/gr8/DOWNSAMPLED/image/jpeg/0e8d167ec54489a5ac801cc693239178/gr8.jpg https://s3.amazonaws.com/prod-ucs-content-store-us-east/content/pii:S1381116916300231/gr8/DOWNSAMPLED/image/jpeg/0e8d167ec54489a5ac801cc693239178/gr8.jpg gr8 gr8.jpg jpg 16714 295 376 IMAGE-DOWNSAMPLED 1-s2.0-S1381116916300231-gr9.jpg https://s3-eu-west-1.amazonaws.com/prod-ucs-content-store-eu-west/content/pii:S1381116916300231/gr9/DOWNSAMPLED/image/jpeg/454569e76d81bda81016f87a57f7f349/gr9.jpg https://s3.amazonaws.com/prod-ucs-content-store-us-east/content/pii:S1381116916300231/gr9/DOWNSAMPLED/image/jpeg/454569e76d81bda81016f87a57f7f349/gr9.jpg gr9 gr9.jpg jpg 43677 358 527 IMAGE-DOWNSAMPLED 1-s2.0-S1381116916300231-fx1_lrg.jpg https://s3-eu-west-1.amazonaws.com/prod-ucs-content-store-eu-west/content/pii:S1381116916300231/fx1/HIGHRES/image/jpeg/9f6660e19d035891dc6ab9999a5019e2/fx1_lrg.jpg https://s3.amazonaws.com/prod-ucs-content-store-us-east/content/pii:S1381116916300231/fx1/HIGHRES/image/jpeg/9f6660e19d035891dc6ab9999a5019e2/fx1_lrg.jpg fx1 true fx1_lrg.jpg jpg 150378 886 2213 IMAGE-HIGH-RES 1-s2.0-S1381116916300231-gr1_lrg.jpg https://s3-eu-west-1.amazonaws.com/prod-ucs-content-store-eu-west/content/pii:S1381116916300231/gr1/HIGHRES/image/jpeg/5ab23f046eef50ea2478eaef2a02c417/gr1_lrg.jpg https://s3.amazonaws.com/prod-ucs-content-store-us-east/content/pii:S1381116916300231/gr1/HIGHRES/image/jpeg/5ab23f046eef50ea2478eaef2a02c417/gr1_lrg.jpg gr1 gr1_lrg.jpg jpg 86603 1277 1669 IMAGE-HIGH-RES 1-s2.0-S1381116916300231-gr10_lrg.jpg https://s3-eu-west-1.amazonaws.com/prod-ucs-content-store-eu-west/content/pii:S1381116916300231/gr10/HIGHRES/image/jpeg/9c7f2642a88d9c20ef9bf4cf4c650eef/gr10_lrg.jpg https://s3.amazonaws.com/prod-ucs-content-store-us-east/content/pii:S1381116916300231/gr10/HIGHRES/image/jpeg/9c7f2642a88d9c20ef9bf4cf4c650eef/gr10_lrg.jpg gr10 gr10_lrg.jpg jpg 311594 2813 1736 IMAGE-HIGH-RES 1-s2.0-S1381116916300231-gr2_lrg.jpg https://s3-eu-west-1.amazonaws.com/prod-ucs-content-store-eu-west/content/pii:S1381116916300231/gr2/HIGHRES/image/jpeg/fc98c613b5f7a75c257b2b127614e4ef/gr2_lrg.jpg https://s3.amazonaws.com/prod-ucs-content-store-us-east/content/pii:S1381116916300231/gr2/HIGHRES/image/jpeg/fc98c613b5f7a75c257b2b127614e4ef/gr2_lrg.jpg gr2 gr2_lrg.jpg jpg 81288 1289 1669 IMAGE-HIGH-RES 1-s2.0-S1381116916300231-gr3_lrg.jpg https://s3-eu-west-1.amazonaws.com/prod-ucs-content-store-eu-west/content/pii:S1381116916300231/gr3/HIGHRES/image/jpeg/535bd9565d7640ddf1f7bd5fb7699eb7/gr3_lrg.jpg https://s3.amazonaws.com/prod-ucs-content-store-us-east/content/pii:S1381116916300231/gr3/HIGHRES/image/jpeg/535bd9565d7640ddf1f7bd5fb7699eb7/gr3_lrg.jpg gr3 gr3_lrg.jpg jpg 191115 1299 1743 IMAGE-HIGH-RES 1-s2.0-S1381116916300231-gr4_lrg.jpg https://s3-eu-west-1.amazonaws.com/prod-ucs-content-store-eu-west/content/pii:S1381116916300231/gr4/HIGHRES/image/jpeg/1b9a381eff9c647c2bfb9d7d50ac4129/gr4_lrg.jpg https://s3.amazonaws.com/prod-ucs-content-store-us-east/content/pii:S1381116916300231/gr4/HIGHRES/image/jpeg/1b9a381eff9c647c2bfb9d7d50ac4129/gr4_lrg.jpg gr4 gr4_lrg.jpg jpg 135253 1278 1743 IMAGE-HIGH-RES 1-s2.0-S1381116916300231-gr5_lrg.jpg https://s3-eu-west-1.amazonaws.com/prod-ucs-content-store-eu-west/content/pii:S1381116916300231/gr5/HIGHRES/image/jpeg/e52c6435950319cf32e8aa71bb7477ba/gr5_lrg.jpg https://s3.amazonaws.com/prod-ucs-content-store-us-east/content/pii:S1381116916300231/gr5/HIGHRES/image/jpeg/e52c6435950319cf32e8aa71bb7477ba/gr5_lrg.jpg gr5 gr5_lrg.jpg jpg 208250 1297 1708 IMAGE-HIGH-RES 1-s2.0-S1381116916300231-gr6_lrg.jpg https://s3-eu-west-1.amazonaws.com/prod-ucs-content-store-eu-west/content/pii:S1381116916300231/gr6/HIGHRES/image/jpeg/253ec1513040143652cf42ba734f02b4/gr6_lrg.jpg https://s3.amazonaws.com/prod-ucs-content-store-us-east/content/pii:S1381116916300231/gr6/HIGHRES/image/jpeg/253ec1513040143652cf42ba734f02b4/gr6_lrg.jpg gr6 gr6_lrg.jpg jpg 162543 1313 1743 IMAGE-HIGH-RES 1-s2.0-S1381116916300231-gr7_lrg.jpg https://s3-eu-west-1.amazonaws.com/prod-ucs-content-store-eu-west/content/pii:S1381116916300231/gr7/HIGHRES/image/jpeg/33a3394250d75468b169d36cae692feb/gr7_lrg.jpg https://s3.amazonaws.com/prod-ucs-content-store-us-east/content/pii:S1381116916300231/gr7/HIGHRES/image/jpeg/33a3394250d75468b169d36cae692feb/gr7_lrg.jpg gr7 gr7_lrg.jpg jpg 100562 1355 1725 IMAGE-HIGH-RES 1-s2.0-S1381116916300231-gr8_lrg.jpg https://s3-eu-west-1.amazonaws.com/prod-ucs-content-store-eu-west/content/pii:S1381116916300231/gr8/HIGHRES/image/jpeg/0b3cfc32b14b8437266b5843e8b3d1a3/gr8_lrg.jpg https://s3.amazonaws.com/prod-ucs-content-store-us-east/content/pii:S1381116916300231/gr8/HIGHRES/image/jpeg/0b3cfc32b14b8437266b5843e8b3d1a3/gr8_lrg.jpg gr8 gr8_lrg.jpg jpg 134468 1306 1667 IMAGE-HIGH-RES 1-s2.0-S1381116916300231-gr9_lrg.jpg https://s3-eu-west-1.amazonaws.com/prod-ucs-content-store-eu-west/content/pii:S1381116916300231/gr9/HIGHRES/image/jpeg/b295ad0c5fd4e1319313b75696576ebc/gr9_lrg.jpg https://s3.amazonaws.com/prod-ucs-content-store-us-east/content/pii:S1381116916300231/gr9/HIGHRES/image/jpeg/b295ad0c5fd4e1319313b75696576ebc/gr9_lrg.jpg gr9 gr9_lrg.jpg jpg 387952 1583 2333 IMAGE-HIGH-RES 1-s2.0-S1381116916300231-mmc1.doc https://s3-eu-west-1.amazonaws.com/prod-ucs-content-store-eu-west/content/pii:S1381116916300231/mmc1/MAIN/application/msword/97de4f5448a074c9ab46822c235c6c84/mmc1.doc https://s3.amazonaws.com/prod-ucs-content-store-us-east/content/pii:S1381116916300231/mmc1/MAIN/application/msword/97de4f5448a074c9ab46822c235c6c84/mmc1.doc mmc1 mmc1.doc doc 115712 APPLICATION 1-s2.0-S1381116916300231-si1.gif https://s3-eu-west-1.amazonaws.com/prod-ucs-content-store-eu-west/content/pii:S1381116916300231/STRIPIN/image/gif/0fb5178cbfa2b0aaa36eab3232a34781/si1.gif https://s3.amazonaws.com/prod-ucs-content-store-us-east/content/pii:S1381116916300231/STRIPIN/image/gif/0fb5178cbfa2b0aaa36eab3232a34781/si1.gif si1 si1.gif gif 910 22 268 ALTIMG 1-s2.0-S1381116916300231-si10.gif https://s3-eu-west-1.amazonaws.com/prod-ucs-content-store-eu-west/content/pii:S1381116916300231/STRIPIN/image/gif/1bcaa1e0e67c205a23a5bb77fbf2399d/si10.gif https://s3.amazonaws.com/prod-ucs-content-store-us-east/content/pii:S1381116916300231/STRIPIN/image/gif/1bcaa1e0e67c205a23a5bb77fbf2399d/si10.gif si10 si10.gif gif 176 16 22 ALTIMG 1-s2.0-S1381116916300231-si11.gif https://s3-eu-west-1.amazonaws.com/prod-ucs-content-store-eu-west/content/pii:S1381116916300231/STRIPIN/image/gif/b2ce7a95ae50f4dca1d3c63600878144/si11.gif https://s3.amazonaws.com/prod-ucs-content-store-us-east/content/pii:S1381116916300231/STRIPIN/image/gif/b2ce7a95ae50f4dca1d3c63600878144/si11.gif si11 si11.gif gif 758 40 124 ALTIMG 1-s2.0-S1381116916300231-si12.gif https://s3-eu-west-1.amazonaws.com/prod-ucs-content-store-eu-west/content/pii:S1381116916300231/STRIPIN/image/gif/532236f1e1d0f123dc8de5038ac0a4b5/si12.gif https://s3.amazonaws.com/prod-ucs-content-store-us-east/content/pii:S1381116916300231/STRIPIN/image/gif/532236f1e1d0f123dc8de5038ac0a4b5/si12.gif si12 si12.gif gif 1277 37 248 ALTIMG 1-s2.0-S1381116916300231-si13.gif https://s3-eu-west-1.amazonaws.com/prod-ucs-content-store-eu-west/content/pii:S1381116916300231/STRIPIN/image/gif/a6b45ab71cd55a4f8a4297491e7e3309/si13.gif https://s3.amazonaws.com/prod-ucs-content-store-us-east/content/pii:S1381116916300231/STRIPIN/image/gif/a6b45ab71cd55a4f8a4297491e7e3309/si13.gif si13 si13.gif gif 969 36 251 ALTIMG 1-s2.0-S1381116916300231-si14.gif https://s3-eu-west-1.amazonaws.com/prod-ucs-content-store-eu-west/content/pii:S1381116916300231/STRIPIN/image/gif/276da6c6acc3528c582d6d25b05edbd7/si14.gif https://s3.amazonaws.com/prod-ucs-content-store-us-east/content/pii:S1381116916300231/STRIPIN/image/gif/276da6c6acc3528c582d6d25b05edbd7/si14.gif si14 si14.gif gif 833 34 207 ALTIMG 1-s2.0-S1381116916300231-si2.gif https://s3-eu-west-1.amazonaws.com/prod-ucs-content-store-eu-west/content/pii:S1381116916300231/STRIPIN/image/gif/d3c2cfcd4414a8452127186d331236e6/si2.gif https://s3.amazonaws.com/prod-ucs-content-store-us-east/content/pii:S1381116916300231/STRIPIN/image/gif/d3c2cfcd4414a8452127186d331236e6/si2.gif si2 si2.gif gif 543 21 111 ALTIMG 1-s2.0-S1381116916300231-si3.gif https://s3-eu-west-1.amazonaws.com/prod-ucs-content-store-eu-west/content/pii:S1381116916300231/STRIPIN/image/gif/9e92a395a17a57bafc56e959c870f5c2/si3.gif https://s3.amazonaws.com/prod-ucs-content-store-us-east/content/pii:S1381116916300231/STRIPIN/image/gif/9e92a395a17a57bafc56e959c870f5c2/si3.gif si3 si3.gif gif 1788 72 369 ALTIMG 1-s2.0-S1381116916300231-si4.gif https://s3-eu-west-1.amazonaws.com/prod-ucs-content-store-eu-west/content/pii:S1381116916300231/STRIPIN/image/gif/8d12b62241960ff9232d3e714db54591/si4.gif https://s3.amazonaws.com/prod-ucs-content-store-us-east/content/pii:S1381116916300231/STRIPIN/image/gif/8d12b62241960ff9232d3e714db54591/si4.gif si4 si4.gif gif 668 21 147 ALTIMG 1-s2.0-S1381116916300231-si5.gif https://s3-eu-west-1.amazonaws.com/prod-ucs-content-store-eu-west/content/pii:S1381116916300231/STRIPIN/image/gif/c829865a38332410a72113dbf6d0973c/si5.gif https://s3.amazonaws.com/prod-ucs-content-store-us-east/content/pii:S1381116916300231/STRIPIN/image/gif/c829865a38332410a72113dbf6d0973c/si5.gif si5 si5.gif gif 668 30 125 ALTIMG 1-s2.0-S1381116916300231-si6.gif https://s3-eu-west-1.amazonaws.com/prod-ucs-content-store-eu-west/content/pii:S1381116916300231/STRIPIN/image/gif/23a371f05b269bea2e5475ab13c27736/si6.gif https://s3.amazonaws.com/prod-ucs-content-store-us-east/content/pii:S1381116916300231/STRIPIN/image/gif/23a371f05b269bea2e5475ab13c27736/si6.gif si6 si6.gif gif 1074 35 267 ALTIMG 1-s2.0-S1381116916300231-si7.gif https://s3-eu-west-1.amazonaws.com/prod-ucs-content-store-eu-west/content/pii:S1381116916300231/STRIPIN/image/gif/677f241ad1ffedbdc6abef61bd05cef5/si7.gif https://s3.amazonaws.com/prod-ucs-content-store-us-east/content/pii:S1381116916300231/STRIPIN/image/gif/677f241ad1ffedbdc6abef61bd05cef5/si7.gif si7 si7.gif gif 895 33 175 ALTIMG 1-s2.0-S1381116916300231-si8.gif https://s3-eu-west-1.amazonaws.com/prod-ucs-content-store-eu-west/content/pii:S1381116916300231/STRIPIN/image/gif/18ddde9bf8264479a436ce2f34fef182/si8.gif https://s3.amazonaws.com/prod-ucs-content-store-us-east/content/pii:S1381116916300231/STRIPIN/image/gif/18ddde9bf8264479a436ce2f34fef182/si8.gif si8 si8.gif gif 981 35 238 ALTIMG 1-s2.0-S1381116916300231-si9.gif https://s3-eu-west-1.amazonaws.com/prod-ucs-content-store-eu-west/content/pii:S1381116916300231/STRIPIN/image/gif/24bb9b3568b2a467e39e273c58b3903b/si9.gif https://s3.amazonaws.com/prod-ucs-content-store-us-east/content/pii:S1381116916300231/STRIPIN/image/gif/24bb9b3568b2a467e39e273c58b3903b/si9.gif si9 si9.gif gif 882 35 216 ALTIMG MOLCAA 9755 S1381-1169(16)30023-1 10.1016/j.molcata.2016.01.023 Elsevier B.V. Fig. 1 Effect of external diffusion on conversion. Fig. 1 Fig. 2 Effect of internal diffusion on conversion. Fig. 2 Fig. 3 Linear fitting for catalytic benzene combustion based on the Power-Law model. Fig. 3 Fig. 4 Reaction activation energy for catalytic benzene combustion based on the Power-Law model (calculated from the Arrhenius equation using linear regression). Fig. 4 Fig. 5 Linear fitting for catalytic benzene combustion based on the MVK model. Fig. 5 Fig. 6 Reaction activation energy for catalytic benzene combustion based on the MVK model (calculated from the Arrhenius equation using linear regression). Fig. 6 Fig. 7 Comparison between experimental and calculated conversions using the MVK model. Fig. 7 Fig. 8 The O 1s XPS spectra of the NiMnO3/CeO2/Cordierite catalyst. Fig. 8 Fig. 9 The catalytic combustion mechanism of benzene over the NiMnO3/CeO2/Cordierite catalyst. Fig. 9 Fig. 10 Different catalysts (1 and 2) may cause the same reduction in the activation energy for two different reasons (A) no change in the reaction pathway; (B) change in the reaction pathway. Fig. 10 Table 1 Effect of concentration on the conversion of catalytic benzene oxidation. Table 1 Inlet benzeneconcentration(10−8 mol/cm3) Benzene conversion (x benzene) (%) 200°C 215°C 230°C 245°C 1.595 2.82 4.55 7.11 9.34 3.19 1.90 3.18 4.64 5.94 4.785 1.50 2.39 3.45 4.15 6.38 1.19 1.88 2.96 3.35 Table 2 Effect of concentration on the reaction rate of catalytic benzene oxidation. Table 2 Inlet benzeneconcentration(10−8 mol/cm3) Benzene reaction rate (x benzene) (10−7 mol×cm3 ×s−1) 200°C 215°C 230°C 245°C 1.595 0.187 0.302 0.473 0.620 3.19 0.253 0.423 0.617 0.790 4.785 0.299 0.476 0.687 0.827 6.38 0.316 0.500 0.787 0.891 Table 3 Kinetic parameters of catalytic benzene combustion based on the Power-Law model. Table 3 Power-Law model : - r benzene = k C benzene n Temperature 200°C 215°C 230°C 245°C Power (n) 0.2067 0.207 0.2083 0.231 K ×105 (s−1) 0.389 0.570 0.918 2.016 R 2 0.910 0.977 0.992 0.992 Arrhenius equation k = k 0 exp ( − E A R T ) k o =6.274×106 s−1, E A =115.6kJ/mol, R 2 =0.964 Table 4 Kinetic parameters of catalytic benzene combustion based on theMVK model. Table 4 M a r s − Van Krevelen model : 1 - r benzene = γ k O 2 C O 2 + 1 k benzene C benzene Temperature 200 °C 215 °C 230 °C 245 °C Ki (s−1) 2.132 3.534 5.464 9.9 kO2 (s−1) 2.729 3.529 13.316 25.204 R2 0.996 0.995 0.975 0.987 Arrhenius equation k benzene = k 0 exp ( − E A R T ) k O 2 = k 0 ′ exp ( − E A ′ R T ) ko = 7.84×1011 s−1, E A =69.79kJ/mol, R 2 =0.995 k′o = 1.04×109 s−1, E A′=103.9kJ/mol, R 2 =0.996 Reaction kinetics and mechanism of benzene combustion over the NiMnO3/CeO2/Cordierite catalyst Bing Li a b Yingwen Chen a b ⁎ Lin Li a b Jiawei Kan a b Shuo He a b Bo Yang a c Shubao Shen a b Shemin Zhu a c a State Key Laboratory of Materials-Oriented Chemical Engineering, Nanjing Tech University, Nanjing 210009, China State Key Laboratory of Materials-Oriented Chemical Engineering Nanjing Tech University Nanjing 210009 China b College of Life Science and Pharmaceutical Engineering, Nanjing Tech University, Nanjing 210009, China College of Life Science and Pharmaceutical Engineering Nanjing Tech University Nanjing 210009 China c College of Materials Science and Engineering, Nanjing Tech University, Nanjing 210009, China College of Materials Science and Engineering Nanjing Tech University Nanjing 210009 China ⁎ Corresponding author at: State Key Laboratory of Materials-Oriented Chemical Engineering, College of Life Science and Pharmaceutical Engineering, Nanjing Tech University, No.5 Xinmofan Road, Nanjing 210009, China. Fax: +86 25 83587326. Graphical abstract The kinetics of the catalytic combustion of benzene at different concentrations over the NiMnO3/CeO2/Cordierite catalyst were investigated to gain more insight into the catalytic reaction mechanism. A kinetic study was performed in a packed-bed tubular reactor under different conditions. The catalytic combustion kinetics were modeled using a Power-Law model and the Mars–Van Krevelen model. The results showed that the Mars–Van Krevelen kinetic model provided a significantly better fit to explain the catalytic combustion kinetics of benzene over the NiMnO3/CeO2/Cordierite catalyst. The results showed that the reduction reaction occurred more easily than did the oxidation reaction on the surface of the catalyst. Moreover, the values of the pre-exponential factor for the reduction steps (7.84×1011 s−1) is higher than those of the oxidation steps (1.04×109 s−1), indicating that the more is the effective collision times between the activated molecules, and the easier for chemical reaction to occur, and the degree and speed are more intense and rapid. Therefore, it can be concluded that the catalyzed surface oxidation reaction is the control step of catalytic benzene combustion. Based on this analysis of the experimental results and the assumptions of the Mars–Van Krevelen model, it was determined that the catalytic combustion of benzene over the NiMnO3/CeO2/Cordierite catalyst obeys the Mars–Van Krevelen mechanism. The catalytic combustion reaction occurred by the interaction between the benzene molecules and the active sites of the NiMnO3/CeO2/Cordierite catalyst. The catalytic oxidation of benzene involves a catalytic redox cycle of adsorption, deoxidation, desorption, oxygen supply and regeneration. Keywords Kinetic study Catalyst mechanism NiMnO3/CeO2/Cordierite catalyst 1 Introduction Volatile organic compounds (VOCs) emitted from many industrial processes are an important class of air pollutants [1,2]. These pollutants can cause many environmental problems such as toxic emissions, precursors of ozone and photochemical smog formation [3,4]. Reducing VOC emissions is a very important environmental issue for human health. VOCs are usually eliminated by thermal oxidation, catalytic oxidation, adsorption and absorption. Among these removal methods, catalytic combustion has been recognized as one of the most promising techniques for VOC removal due to its practical applications in pollutant abatement, and this technology has been determined to be more environmentally friendly than conventional flame combustion because it is more versatile and economical in handling organic emissions. Moreover, catalytic incineration, which operates at relatively low temperatures and under controlled conditions, does not emit undesirable by-products, such as dioxins and NO x [5–7]. In general, there are two major types of efficient catalysts for total VOC oxidation, supported noble metals and transition metal oxides. Although the former are highly active at relatively low temperatures, their application is limited due to the high price of precious metals and problems related to sintering and volatility [8,9]. In recent years, research efforts in this field have been focused on developing new catalytic materials with low manufacturing costs that are capable of high activity at moderate temperatures [10–12]. We investigated the catalytic performance of Ni–Mn/CeO2/Cordierite catalysts for benzene combustion in a previous work, which demonstrated that Ni–Mn mixed oxide demonstrates higher activity than the pure oxides. When the Ni/Mn molar ratio was 1:1, the temperature required for the complete conversion of benzene over the catalyst was even lower than that of a supported Pt catalyst [13]. The X-ray diffraction (XRD) and H2-temperature programmed reduction (H2-TPR) results supported our findings, revealing that the catalyst with the highest activity had a perovskite crystal structure and higher redox activity than the other tested catalysts. Apart from the catalyst composition, another aspect that must be considered for catalytic combustion is the kinetic model, which represents a key element in predicting the reaction rate of VOC combustion over the catalyst [14–16]. Based on these results, a reaction mechanism is proposed that can be used as the theoretical basis for the design of high activity catalysts, providing more insight into the behavior of the catalysts. The catalytic combustion kinetics of VOCs as single oxides or simple mixed oxides over various catalysts were presented in the literature [17–19]. However, studies of kinetic models devoted to obtaining perovskite composite oxides are scarce. Therefore, the search for a suitable kinetic model that offers greater insight into the catalytic combustion reaction mechanism of VOCs over the NiMnO3/CeO2/Cordierite catalyst is a worthwhile effort. Based on previous research, a kinetic study was performed in a packed-bed tubular reactor under differential conditions. The catalytic combustion kinetics were investigated by using the Power-Law and Mars–Van Krevelen models. The aim of this work is to investigate the catalytic combustion reaction kinetics and the mechanism of benzene over the NiMnO3/CeO2/Cordierite catalysts. Emphasis was placed on deriving kinetic expressions describing the rate of this reaction. To the best of our knowledge, this article is the first report on the kinetics and mechanism of the complete oxidation of benzene over the perovskite-type NiMnO3/CeO2/Cordierite catalyst. 2 Materials and methods 2.1 Catalyst preparation The details of the preparation of the NiMnO3/CeO2 catalysts, as well as the structural characteristics, have been described in a previous work [13]. Namely, the CeO2/Cordierite supports were prepared using a wet impregnation method with an aqueous Ce(NO3)3·6H2O solution to obtain a 20wt% CeO2 loading. Subsequently, the material was dried overnight at 100°C and calcined at 500°C for 5h. The NiMnO3/CeO2/Cordierite catalysts were prepared using a sol–gel method. An aqueous solution containing Ni(NO3)2·6H2O, Mn(NO3)2 and citric acid (n(citric acid):n(Ni):n(Mn)=1:2.5:2.5) was gradually heated to 80°C and stirred at this temperature for 4h to form the sol. The CeO2/Cordierite supports were immersed in the sol for 2h. The samples were subsequently dried overnight at 105°C and calcined for 7h at 500°C. 2.2 Catalyst characterization The H2-temperature programmed reduction (H2-TPR) experiments were performed using 20mg of catalyst under a mixture of hydrogen (5%) and nitrogen (95%) flowing at 30mL/min. The temperature of the catalysts was increased at 10°C/min. A thermal conductivity detector was used to monitor the consumption of hydrogen during the H2-TPR experiment. The X-ray photoelectron spectroscopy (XPS) experiments were performed using an RBD upgraded PHI-5000C ESCA system (PerkinElmer) with Mg Ka radiation (hv =1253.6eV) or Al Ka radiation (hv =1486.6eV). In general, the X-ray anode was operated at 250W and the high voltage was maintained at 14.0kV with a detection angle at 54°. The pass energy was fixed at 23.5, 46.95 or 93.90eV to ensure sufficient resolution and sensitivity. The base pressure of the analyzer chamber was approximately 5×10−8 Pa. The sample was directly pressed into a self-supported disk (10×10mm), mounted on a sample holder, and then transferred into the analysis chamber. The O core level binding energies were determined, referenced to the binding energy of adventitious C (284.6eV), which gives an accuracy of 0.1eV. The data analysis was performed using the RBD Auger Scan 3.21 software provided by RBD Enterprises and the XPS Peak 4.1 program provided by Raymund W.M. Kwok (Chinese University of Hong Kong, China). Astandard Shirley background and Gaussian (Y %)–Lorentzian (X %) were used for each component. 2.3 Experimental setup The experimental runs for the kinetic study were performed in a quartz tubular fixed bed reactor (Φ=8mm) operated at atmospheric pressure. The reactive mixture was composed of nitrogen, oxygen and liquid benzene. The molar fraction of oxygen was maintained at 21% to simulate the gas concentration. The benzene was fed using a syringe pump, which allowed for variable reactant flows, thus enabling variable benzene concentration. The reactor wall and quartz particles had no catalytic effect on the benzene combustion. For the catalyst activity test, the catalyst was crushed into different meshes, and 200mg of catalyst was diluted with quartz particles and loaded into the fixed-bed reactor. Under these conditions, the benzene conversion into CO2 was below 10%, which allowed a differential analysis of the kinetic data. The benzene concentration in the gas stream was determined by an on-line gas chromatograph (GC-2014, Shimadzu Corp.) equipped with FID (Restek Rtx-1), while the CO2 was analyzed by a GC with a TCD (SP-3420). The GC signal was calibrated based on mixtures of known composition. For benzene combustion over the catalyst, no byproduct was detected by either of the GCs’ detectors. Furthermore, the repeat ability of the experimental data was verified in several experiments with the same benzene conversion under the same experimental conditions. The benzene conversion (x benzene) and the reaction rate (r benzene) for the differential reactors were calculated as follows (1) x benzene = C benzene, in − C benzene, out C benzene, in × 100 (2) - r benzene = x benzene W cat / F benzene, in where Cbenzene,in and Cbenzene, out is the inlet and outlet concentration of benzene, respectively; F benzene,in is the inlet molar flow rate of the benzene, and W cat is the weight of the catalyst used in the reactor. 2.4 Effect of mass transfer limitations 2.4.1 External mass transfer limitations If the mass transfer rate between the gas and the catalyst’s outer surface is slower than that of other reaction processes, then the external diffusion is the rate-controlling step of the entire reaction. Therefore, eliminating the influence of external diffusion by increasing the speed of air flow is necessary to accelerate the external diffusion. As the air flow velocity increases, the retention layer on the two-phase interface becomes thinner, thus the diffusion resistance decreases and the diffusion coefficient increases, thereby increasing the external diffusion rate. To eliminate the influence of external diffusion, the conventional approach is to set the appropriate gas hourly space velocity (GHSV). For this approach, the external mass transfer effect is studied by carrying out catalytic combustion experiments on benzene at six different GHSVs (12,000h−1, 13,000h−1, 14,000h−1, 15,000h−1, 16,000h−1, 17,000h−1) over a catalytic reactor based on a structured catalyst with a bed height of 1cm. 2.4.2 Internal mass transfer limitations When the diffusion velocity in the microscopic voids between particles is slower than that of other processes, the internal diffusion is the rate-controlling step of the entire reaction. To eliminate the influence of internal diffusion, it is necessary to minimize the catalyst particle size to fully expose the inner surface of the catalyst so that the concentration of the reactants inside the material is similar to that on the outer surface; therefore, internal diffusion resistance can be ignored. To estimate the internal diffusion effect, catalytic combustion experiments were performed on benzene in air over catalysts with different mean particle sizes (20–100mesh:150–840μm). The particle size of the catalyst is controlled using sieves that allow the selection of a particle size range. Four different ranges were selected: 20–40mesh (420–840μm), 40–60mesh (250–420μm), 60–80mesh (178–250μm) and 80–100mesh (150–178μm). In the gas–solid heterogeneous reaction, the catalytic oxidization removal process includes external mass transfer through the external film of the catalyst, internal mass transfer, and surface reaction. To study the intrinsic reaction kinetics, external and internal mass transfer effects should be eliminated to ensure that the surface reaction is the rate-determining step. Mass transfer limitations were tested by conducting catalytic combustion experiments on the reaction. 3 Results and discussion 3.1 Effect of mass transfer limitations 3.1.1 External mass transfer limitations Fig. 1 shows that the external diffusion limitations were evaluated by performing several experiments with six different GHSVs ranging from 12,000 to 17,000h−1. As observed in Fig. 1, the profiles of the benzene conversions in this range are essentially identical, indicating that the catalytic system was operated in the absence of an external diffusional limitation. A possible explanation is that the catalyst has an entirely open macroscopic structure offering a large void volume. Therefore, the GHSV was then set to 15,000h−1 for the catalytic combustion kinetics experiments to avoid any external mass transfer limitations. 3.1.2 Internal mass transfer limitations Fig. 2 shows that the internal diffusion effect was estimated over the catalyst with different mean particle size (20–40mesh, 40–60mesh, 60–80mesh and 80–100mesh). As shown in Fig. 2, when the particle size of the catalyst was 60–80 and 80–100mesh, the conversion rate of benzene was generally the same, which indicated that the internal diffusion effect was eliminated when the catalyst particles were 60–100mesh. In theory, the chemical regime requires a minimal Thiele modulus and requiring a smaller particle size. Thus, only catalysts with particle sizes between 80–100mesh were used for the remainder of the kinetic study to limit the internal mass transfer. 3.2 Catalytic combustion performance The performance of catalytic benzene combustion over the catalytic structured reactor based on the NiMnO3/CeO2/Cord catalyst was also investigated using different inlet concentrations of benzene (1.595–6.38×10−8 mol/cm3) at a constant GHSV of 15,000h−1. Table 1 shows that some differences in conversion can be observed under different inlet concentrations of benzene. The table also indicates that the conversion rate of benzene increased at higher reaction temperatures. This is mainly because when the temperature increases, the benzene molecules move faster, thereby increasing the number of collisions per unit time. Furthermore, increasing temperature can also increase the energy of the single benzene molecules, thereby increasing the percentage of activated benzene molecules. Table 1 also shows that the conversion of benzene decreases as the inlet concentration of benzene increases, which is because, when the concentration of benzene increases, the number of benzene molecules per unit volume increases. The active site of benzene per unit catalyst is maintained constant, which increases the load per unit catalyst, resulting in a decrease in the catalytic activity of benzene. Using the data in Table 1 and in Eq. (2), the reaction rates for the catalytic oxidation of benzene were obtained, and the results are listed in Table 2 . Table 2 reveals that increasing the reaction temperature can raise the benzene reaction rate. From the above analysis, it is known that the increase of the number of molecules will increase with the increase of temperature, the more is the effective collision between the activated molecules, the faster is the reaction rate. Meanwhile, we can also see from Table 2 increasing the inlet concentration can also raise the benzene reaction rate. The main reason is that the number of molecules per unit volume will increase with the increase of the inlet concentration, which will make the distance between the molecules smaller, increasing the number of collisions between molecules, which increase opportunities for reaction rate becomes faster, according to the collision theory. 3.3 The kinetic models of the reaction Modeling the kinetics of the catalytic reaction involves multiple variables. In addition to reactant concentration, the reaction temperature should also be included if considering different operating conditions. Several possible mechanisms are proposed considering the different reaction paths. In the current study, the experimental data were fitted to the available single variable kinetic models to evaluate the mechanism of the reaction. Next, the reaction process and mechanism considering multiple variables was deduced, and a multivariable kinetic model considering the benzene concentration and temperature was developed [20]. 3.3.1 Power-Law model The simplest kinetic equation is the Power-law model, which describes the rate as a function of a rate constant and the reactant concentration. This model is very useful for a quick comparison of the kinetic behavior of different catalysts [21]. (3) − r benzene = d C benzene d t = k C benzene n C O 2 n For the catalytic combustion of benzene in gas, the oxygen concentration (9.375×10−6 mol/cm3) in the gas stream is always much larger than that of inlet concentrations of benzene (1.595–6.38×10−8 mol/cm3), therefore, the above expression is simplified to: (4) − r benzene = d C benzene d t = k C benzene n where (−r benzene) is the benzene oxidation rate; Cbenzene and C O 2 are the benzene and oxygen concentration in the gas stream, respectively; k is the surface reaction rate constant according to the Power-Law model, and n and m are the kinetic orders with respect to benzene and oxygen, respectively. The apparent surface reaction rate constant (k) follows the Arrhenius equation and thus relating the reaction temperature to the reaction rate [22]. The Arrhenius equation can be expressed as: (5) k = k 0 exp ( − E A R T ) where E A is the activation energy (kJ/mol); R is the gas constant (8.314×10−3 kJ/molK); k 0 is the pre-exponential factor, and T is the reaction temperature (K). The plot of ln−rbenzene versus lnCbenzene for benzene combustion over the NiMnO3/CeO2 catalyst is shown in Fig. 3 . According to Eq. (4), both the slope and intercepts of those lines relate to the reaction order n and the reaction rate constant k, as shown in Fig. 3. The linear regression correlation coefficient R 2 is relatively high, with R 2 values above 0.95, except when the temperature is 245°C. The reaction rate constant increases with higher reaction temperatures, in accordance with the Arrhenius equation. Fig. 4 shows the Arrhenius equation fitting of the reaction rate constants for the Power-Law model, calculated with the kinetic data from Fig. 3. The Power-Law model provided a good fit for the kinetic data with a relatively high R 2 value (0.964). Table 3 shows the factor k 0 =1.436×107 s−1 and the activation energy E A =115.79kJ/mol, which were calculated using Eqs. (4) and (5), respectively. Table 3 also shows that the values of kinetic order n increase with higher temperatures but not at a constant rate; therefore, the Power-Law model cannot explain the variation of the apparent kinetic order n simply with the reaction temperature. Therefore, a more elaborate model derived from mechanistic considerations is required to account for the observed behavior of the catalyst for benzene combustion. To construct an exact kinetic model, an understanding of the reactions at the molecular level is necessary. However, the full elucidation of the reaction mechanism for heterogeneous reactions is always difficult. Thus, calculating the rate equation may require an empirical method. Although the exact reaction mechanism is not well understood, it has been suggested that benzene oxidation may involve lattice oxygen or surface-adsorbed oxygen for metal oxide catalysts [21]. Based on reasonable assumptions, several kinetic equations derived from mechanistic considerations have been developed, such as the Mars–Van Krevelen model. 3.3.2 Mars–Van Krevelen Model The Mars–Van Krevelen Model (MVK) is a two-step redox reaction model that has been used to explain oxidation reaction rates for heterogeneous oxide catalysts. The model assumes that the reaction occurs when a reactant molecule interacts with an oxygen-rich portion of the catalyst. The oxygen in the catalyst can be either chemisorbed or lattice oxygen. A particular portion of the catalyst surface is alternately reduced and oxidized [19]. The equation representing the MVK model has been used by several authors [23–25],suggesting a general equation for the oxidation of hydrocarbons in this case, benzene (Eq. (6)). (6) − r benzene = k O 2 k benzene C benzene C O 2 k O 2 C O 2 + γ k benzene C benzene Or equivalently, (7) 1 − r benzene = γ k O 2 C O 2 + 1 k benzene C benzene where (−rb enzene) is the benzene oxidation rate; k benzene is the rate constant of benzene oxidation; k O2 is the rate constant of catalyst re-oxidation; Cbenzene is the benzene concentration in the gas stream; C O 2 is the O2 concentration in the gas stream; and γ is the stoichiometric coefficient of oxygen in the oxidation of benzene (C6H6 +7.5O2 →6CO2 +3H2O), which is equal to 7.5. For the catalytic combustion of benzene in the gas stream, the oxygen concentration is always much larger than that of the benzene (same as Eq. (4)), Thus the γ/k O2 C O 2 term can be assumed as constant A. Therefore, Eq. (7) expression can be simplified to the following equation: (8) 1 − r benzene = A + 1 k benzene C benzene The plot of 1/−r benzene as a function of 1/Cbenzene for benzene combustion over the NiMnO3/CeO2 catalyst is shown in Fig. 5 . According to Eq. (8), both the slope and intercepts of those lines related to the rate constant of benzene oxidation (k benzene) and rate constant of the re-oxidation of the catalyst (k O2) were calculated from these data, as shown in Table 4 . It is clear from Table 4 that the values of k benzene and k O2 increase regularly as the reaction temperature increases, indicating that the variation of the reaction rate constants k benzene and k O2 with different reaction temperatures obey an empirical Arrhenius equation. The results of fitting the MVK model reaction rate constants to the Arrhenius equation are shown in Fig. 6 and Table 3, revealing that the reaction activation energies for the reduction and oxidation step is 69.79 and 103.9kJ/mol, respectively. Because of its lower activation energy, the reduction reaction occurred more easily than the oxidation reaction on the surface of the catalyst. It is well known that not all molecular collision will react, and only the activated molecular collision is effective collision and causes a chemical reaction. The larger is the numerical value of the pre-exponential factor, the more is the effective collision times between the activated molecules, and the easier for chemical reaction to occur, and the degree and speed are more intense and rapid. Moreover, The value of the pre-exponential factor for the reduction (7.84×1011 s−1) is higher than the factor for the oxidation (1.04×109 s−1). Thus it can be concluded that the catalyst surface oxidation reaction was the rate-controlling step of catalytic combustion of benzene. Furthermore, the correlation coefficient R 2 for the rate constant fittings is relatively high (0.995 and 0.996). The comparison between the experimental and modeled data are presented in Fig. 7 , where the experimental values of conversion (x exp) are plotted as a function of the calculated conversion by the MVK model (x calcMVK). The results presented in Fig. 7 demonstrate the good agreement between the calculated and experimental results. It is clear that the predicted reaction rates agree well with the experimental values, giving a relatively high correlation coefficient R 2 (0.998). In the literature, if a correlation coefficient R 2 is greater than 0.9, then the model can be considered appropriate. Therefore, the above results clearly demonstrate that the Mars–Van Krevelen kinetic model can be used to describe the catalytic combustion kinetics of benzene. 3.4 Reaction mechanism In the model equations tested, the MVK model shows the best fit to the intrinsic kinetic experimental data, indicating that the reaction mechanism can be predicted accurately by this model. In our previous work [13], the H2-TPR profiles of NiMnO3 perovskite in Fig. S1 shows that these peaks appear at a lower temperature than those associated with the reduction of pure NiO and MnO x , primarily because the reduction of NiMnO3 perovskite proceeds in two main steps. During the first step, most of the manganese cations are reduced to Mn2+, generating a solid solution of NiO in MnO. Subsequently, the Ni2+cations are reduced in the MnO matrix. The next step generates the final product: a mixture of MnO and metallic nickel or Ni+. Simultaneously the CeO2 catalyst coating can rely on redox states (Ce3+–Ce4+) and high oxygen storage capacity to provide lattice oxygen for Mn2+ and Ni+, thus promoting oxygen mobility. Fig. 8 shows the O 1s XPS spectra of the NiMnO3/CeO2/Cordierite catalyst. In Fig. 8, the O 1s spectra was deconvoluted into three peaks at 529.4, 531.0and 532.3eV, indicating the surface lattice oxygen (denoted as O III), surface adsorbed oxygen and some oxygen-containing groups such as OH− (denoted as O II), and oxygen in surface adsorbed water molecules (denoted as O I), respectively. The ratio of the surface-adsorbed oxygen to the lattice oxygen (O II/ O III) can be used to describe the proportion of different oxygen species [26]; a lower O II/O III value implies the presence of more active vacant oxygen species on the catalyst lattice, meaning that it can be the richest source of active lattice oxygen species for the oxidation reaction. If the lattice oxygen participates in hydrocarbon combustion, then a Mars–Van Krevelen mechanism can be claimed [27,28,21], that is, by the involvement of lattice oxygen, whereby the created oxygen vacancy is subsequently replenished by oxygen from the gas phase. Thus, based on the above analysis of the experimental results and the assumptions of the Mars–Van Krevelen model, the catalytic combustion of benzene over the NiMnO3/CeO2/Cordierite catalyst was considered to obey the Mars–Van Krevelen mechanism, as shown in Fig. 9 . Supplementary material related to this article found, in the online version, at http://dx.doi.org/10.1016/j.molcata.2016.01.023. H2-TPR proﬁles of NiO/CeO2/Cordierite, MnOx/CeO2/Cordierite and Ni-Mn/CeO2/Cordierite mixed oxide. Fig. 9 shows that the catalytic oxidation reaction is divided into two steps: (1) the benzene molecules are adsorbed on the oxidized active sites of the NiMnO3 perovskite composite oxide, and the dehydrogenation oxidation of benzene molecules forms intermediate reactive oxygen species; meanwhile, the active oxygen species in CeO2 migrate to the NiMnO3 perovskite composite oxide to complement its consumption of reactive oxygen species and form oxygen vacancies. The intermediate reactive oxygen species are further oxidized to CO2 and H2O, and the active sites of the catalyst are reduced, forming reduced active sites. (2) O2 molecules are adsorbed on the surface of CeO2, filling the oxygen vacancies, and the reduced active sites are re-oxidized to form oxidized active sites, thereby forming a cycle of active oxygen consumption and supply. The catalytic oxidation of benzene molecules thus completes a catalytic redox cycle of adsorption, deoxidation, desorption, oxygen supply and regeneration. Through the reaction kinetics and mechanistic analysis, the catalytic oxidation of benzene molecules under the action of the catalyst is shown to complete a redox catalytic cycle to reduce the activation energy of the reaction; this changes the original chemical reaction pathway and facilitates the oxidation of benzene. According to the Arrhenius equation, decreasing the activation energy and increasing the pre-exponential factor can improve the reaction rate of benzene combustion, which can be used as the theoretical basis for the design of a high activity catalyst. The surface of the gas–solid reaction catalyst is not uniform; therefore, under the reaction conditions, only some special sites have adsorption, deoxidation, desorption, oxygen supply and regeneration abilities, which causes a catalytic effect. It is well known that the structure of the catalytic activity center determines the ability of the activated reactant. Changing the active component can alter the electronic properties of the catalyst, thus changing the structure of the active site, which can improve the activity of the active center. The increase in the reaction rate is due to the further reduction of the reaction’s activation energy. At this point, the following two situations may decrease the activation energy: (1) there is no change in the reaction pathway but a decrease in the activation energy of the rate-controlling step decreases the total activation energy, as shown in Fig. 10 (A). This situation applies when the activated structure of the catalyst is close to the central structure (for example, the active component is the same as the transition element); (2) there is a change in the reaction pathway that reduces the apparent activation energy of the reaction, as shown in Fig. 10(B). This situation applies when the structure of the active center of the catalyst is large. The pre-exponential factor can be improved to accelerate the rate of the catalytic reaction. By increasing the surface area of the catalyst or the density of the active centers on the catalyst surface, we can increase the number of active centers per mass unit of catalyst to achieve the above purpose. The above analysis provides good theoretical support for further improving the design of the catalyst as a increase to improve its performance. In future studies, we will again modify the NiMnO3 perovskite; the A-site (Ni2+) and/or B-site (Mn4+) cations can be substituted by other cations without changing the structure.Therefore, the oxidation states of the B cation and/or the amounts of non-stoichiometric oxygen can be modified, thus generating associated structural defects. These defects (typically oxygen vacancies) can be beneficial from a catalytic perspective because their presence could favor the chemisorption of reactants or other relevant catalytic steps (oxygen transport, electron transfer processes, etc.) [29,30]. Meanwhile, the preparation method of the CeO2 coating will be optimized so that the crystalline CeO2 can be distributed more evenly and dispersed on the surface of the cordierite carrier, thus increasing the surface area of the cordierite carrier. We will also add electronic-type catalysts (such as Zr, Ti) to the CeO2 crystal to form a Ce–Zr–O2/Ce–Ti–O2 solid solution structure, which can inhibit the sintering of the catalyst. (Catalyst sintering will lead to a rapid decrease in the surface area, thereby reducing the number of active centers.) Thus, the pre-exponential factor can be maintained constant in the process of using the catalyst. Using the above method, the rate coefficient of the reaction can be further improved in the future. 4 Conclusions The kinetics of the catalytic combustion of benzene over the NiMnO3/CeO2/Cordierite catalyst was studied using the Power-Law kinetic model and the Mars–Van Krevelen kinetic model. The Power-Law model cannot explain the change of the apparent reactant order n with the reaction temperature. The Mars–Van Krevelen kinetic model gave a better fit to explain the catalytic combustion kinetics. This showed that the reduction reaction occurred more easily than did the oxidation reaction on the surface of the catalyst. Moreover, the value of the pre-exponential factor for the reduction steps (7.84×1011 s−1) is higher than that for the oxidation steps (1.04×109 s−1), indicating that the more is the effective collision times between the activated molecules, and the easier for chemical reaction to occur, and the degree and speed are more intense and rapid. Thus, it can be concluded that the catalyst surface oxidation reaction was the rate-controlling step for the catalytic combustion of benzene. Meanwhile, the R 2 correlation coefficients for the rate constant fitting are relatively high (0.995 and 0.996), and the predicted reaction rates agree well with the experimental values (R 2 =0.998). Based on the experimental results and the assumptions of the Mars–Van Krevelen model, it was concluded that the catalytic combustion of benzene over the NiMnO3/CeO2/Cordierite catalyst obeys the Mars–Van Krevelen mechanism. The reaction kinetics and mechanistic analysis showed that the catalytic oxidation of benzene molecules under the action of the catalyst completes a catalytic redox cycle to reduce the activation energy of the reaction, which changes the original chemical reaction path way to facilitate the oxidation of benzene. The reduction in the activation energy and the increase in the pre-exponential factor in the Arrhenius equation can improve the reaction rate of benzene, and these principles can be used as a theoretical basis for the design of high activity catalysts. Acknowledgments This work was financially supported by the Natural Science Foundation of China (Nos. 51172107 and 51272105), the National Key Technology R&D Program of China (No. 2012BAE01B03-3), and the Natural Science Foundation of the Jiangsu Higher Education Institutions of China (No. 14KJB430014). References [1] G. Pecchi M.G. Jiliberto E.J. Delgado Effect of B-site cation on the catalytic activity of La1−xCaxBO3 (B=Fe, Ni) perovskite-typeoxides for toluene combustion J. Chem. Technol. Biotechnol. 86 2011 1067 1073 [2] N. Rezlescu E. Rezlescu P.D. Popa Some nanograined ferrites and perovskites for catalytic combustion of acetone at low temperature Ceram. Int. 41 2015 4430 4437 [3] G.l. Zhou X.L. He S. Liu Phenyl VOCs catalytic combustion on supported CoMn/AC oxide J. Ind. Eng. Chem. 21 2015 932 941 [4] D. Delimaris T. Ioannides VOC oxidation over CuO–CeO2 catalysts prepared by a combustion method Appl. Catal. B: Environ. 89 2009 295 302 [5] D.F. Wu W. Jiang J.C. Zhou Effect of drying and calcination on the toluene combustion activity of a monolithic CuMnAg/γ-Al2O3/cordierite catalyst J Chem Technol Biot 85 2010 569 576 [6] M. Piumetti D. Fino N. Russo Volatile organic compound (VOC) emissions from soil and litter samples Appl. Catal. B 163 2015 277 287 [7] T. Garcia B. Solsona D.M. Murph Deep oxidation of light alkanes over titania-supported palladium/vanadium catalysts J. Catal. 229 2005 1 11 [8] Z. Mu J.J. Li M.H. Duan Catalytic combustion of benzene on Co/CeO2/SBA-15 and Co/SBA-15 catalysts Catal. Commun. 9 2008 1874 1877 [9] D.F. Wu W.B. Li R. Gao Comparison of the methods for preparing a cordierite monolith-supported Cu–Mn mixed-oxide catalyst J. Chem. Technol. Biotechnol. 89 2014 1559 1564 [10] X.J. Zhang H.J. Li Y. Li Structural properties and catalytic activity of Sr-substituted LaFeO3 perovskite Chin. J. Catal. 33 2012 1109 1114 [11] J.G. Deng L. Zhang H.X. Dai Hydrothermally fabricated single-crystalline strontium-substituted lanthanum manganite microcubes for the catalytic combustion of toluene J. Mol. Catal. A: Chem. 299 2009 60 67 [12] P. Yang Z.N. Shi S.S. Yang High catalytic performances of CeO2–CrOx catalysts for chlorinated VOCs elimination Chem. Eng. Sci. 126 2015 361 369 [13] B. Li Q. Huang X.K. Yan Low-temperature catalytic combustion of benzene over Ni–Mn/CeO2/cordierite catalysts J. Ind. Eng. Chem. 20 2014 2359 2363 [14] J. Bedia J.M. Rosas J. Rodríguez-Mirasol Pd supported on meso-porous activated carbons with high oxidation resistance as catalysts for toluene oxidation Appl. Catal. B.: Environ. 94 2010 8 18 [15] V.R. Choudhary G.M. Deshmukh D.P. Mishra Kinetics of the complete com-bustion of dilute propane and toluene over Iron-doped ZrO2 catalyst Energy Fuels 19 2005 54 63 [16] S. Benard A. Baylet P. Vernoux Kinetics of the propene oxidation over a Pt/alumina catalyst Catal. Commun. 36 2013 63 66 [17] Y.F. Han L.W. Chen K. Ramesh Kinetic and spectroscopic study of methane combustion over α-Mn2O3 nanocrystal catalysts J. Catal. 253 2008 261 268 [18] C.I. Meyer A. Borgna A. Monzón Kinetic study of trichloroethylene combustion on exchanged zeolites catalysts J. Hazard. Mater. 190 2011 903 908 [19] A.Z. Abdullah M.Z.A. Bakar S. Bhatia A kinetic study of catalytic combustion of ethyl acetate and benzene in air stream over Cr-ZSM-5 catalyst Ind. Eng. Chem. Res. 42 2003 6059 6067 [20] J.J. Pei X. Han Y. Lu Performance and kinetics of catalytic oxidation of formaldehyde over copper manganese oxide catalyst Build. Environ. 84 2015 134 141 [21] C.Q. Hu Catalytic combustion kinetics of acetone and toluene over Cu0.13Ce0.87Oy catalyst Chem. Eng. J. 168 2011 1185 1192 [22] P. Hurtado S. Ordonez H. Sastre Development of a kinetic model for the oxidation of methane over Pd/Al2O3 at dry and wet conditions Appl. Catal. Environ. 51 2004 229 238 [23] C.M. Manta G. Bozga G. Bercaru Kinetics of o-xylene combustion over a Pt/alumina catalyst Chem. Eng. Technol. 35 2012 2147 2154 [24] H. Li H. Chen M.F. Yao Reaction kinetics of ethylene combustion in a carbon dioxide stream over a Cu–Mn–O hopcalite catalyst in low temperature range Ind. Eng. Chem. Res. 52 2013 686 691 [25] H.B. Chen Y. Yan Y. Shao Catalytic combustion kinetics of isopropanol over novel porous microfibrous-structured ZSM-5Coating/PSSF Catalyst AIChE J. 61 2015 620 630 [26] C.H. Zhang W.C. Hua C. Wang The effect of A-site substitution by Sr Mg and Ce on the catalytic performance of LaMnO3 catalysts for the oxidation of vinyl chloride emission Appl. Catal. B.: Environ. 134–135 2013 310 315 [27] V.R. Choudary G.M. Deshmukh Kinetics of the complete combustion of dilute propane and methyl ethyl ketone over Cr-doped ZrO2 catalyst Chem. Eng. Sci. 60 2005 1575 1581 [28] G. Arzamendi R. Ferrero A.R. Pierna Kinetics of methyl ethyl ketone combustion in air at low concentrations over a commercial Pt/Al2O3 catalyst Ind. Eng. Chem. Res. 46 2007 9037 9044 [29] A.A. Leontiou A.K. Ladavos T.V. Bakas Reverse uptake of oxygen from La1− x Sr x (Fe3+/Fe4+)O3±δ perovskite-type mixed oxides (x =0.00 0.15, 0.30, 0.40, 0.60, 0.70, 0.80, 0.90) Appl. Catal. A 241 2003 143 154 [30] K. Rida A. Benabbas F. Bouremmad Surface properties and catalytic performance of La1−xSrxCrO3 perovskite-type oxides for CO and C3H6 combustion Catal. Commun. 7 2006 963 968",
      "scopus-id": "84958956329",
      "coredata": {
        "eid": "1-s2.0-S1381116916300231",
        "dc:description": "The kinetics of the catalytic combustion of benzene at different concentrations over the NiMnO3/CeO2/Cordierite catalyst were investigated to gain more insight into the catalytic reaction mechanism. A kinetic study was performed in a packed-bed tubular reactor under different conditions. The catalytic combustion kinetics were modeled using a Power-Law model and the Mars–Van Krevelen model. The results showed that the Mars–Van Krevelen kinetic model provided a significantly better fit to explain the catalytic combustion kinetics of benzene over the NiMnO3/CeO2/Cordierite catalyst. The results showed that the reduction reaction occurred more easily than did the oxidation reaction on the surface of the catalyst. Moreover, the values of the pre-exponential factor for the reduction steps (7.84×1011 s−1) is higher than those of the oxidation steps (1.04×109 s−1), indicating that the more is the effective collision times between the activated molecules, and the easier for chemical reaction to occur, and the degree and speed are more intense and rapid. Therefore, it can be concluded that the catalyzed surface oxidation reaction is the control step of catalytic benzene combustion. Based on this analysis of the experimental results and the assumptions of the Mars–Van Krevelen model, it was determined that the catalytic combustion of benzene over the NiMnO3/CeO2/Cordierite catalyst obeys the Mars–Van Krevelen mechanism. The catalytic combustion reaction occurred by the interaction between the benzene molecules and the active sites of the NiMnO3/CeO2/Cordierite catalyst. The catalytic oxidation of benzene involves a catalytic redox cycle of adsorption, deoxidation, desorption, oxygen supply and regeneration.",
        "openArchiveArticle": "false",
        "prism:coverDate": "2016-05-01",
        "openaccessUserLicense": null,
        "prism:aggregationType": "Journal",
        "prism:url": "https://api.elsevier.com/content/article/pii/S1381116916300231",
        "dc:creator": [
          {
            "@_fa": "true",
            "$": "Li, Bing"
          },
          {
            "@_fa": "true",
            "$": "Chen, Yingwen"
          },
          {
            "@_fa": "true",
            "$": "Li, Lin"
          },
          {
            "@_fa": "true",
            "$": "Kan, Jiawei"
          },
          {
            "@_fa": "true",
            "$": "He, Shuo"
          },
          {
            "@_fa": "true",
            "$": "Yang, Bo"
          },
          {
            "@_fa": "true",
            "$": "Shen, Shubao"
          },
          {
            "@_fa": "true",
            "$": "Zhu, Shemin"
          }
        ],
        "link": [
          {
            "@_fa": "true",
            "@rel": "self",
            "@href": "https://api.elsevier.com/content/article/pii/S1381116916300231"
          },
          {
            "@_fa": "true",
            "@rel": "scidir",
            "@href": "https://www.sciencedirect.com/science/article/pii/S1381116916300231"
          }
        ],
        "dc:format": "application/json",
        "openaccessType": null,
        "pii": "S1381-1169(16)30023-1",
        "prism:volume": "415",
        "prism:publisher": "Elsevier B.V.",
        "dc:title": "Reaction kinetics and mechanism of benzene combustion over the NiMnO3/CeO2/Cordierite catalyst",
        "prism:copyright": "Copyright © 2016 Elsevier B.V. All rights reserved.",
        "openaccess": "0",
        "prism:issn": "13811169",
        "dcterms:subject": [
          {
            "@_fa": "true",
            "$": "Kinetic study"
          },
          {
            "@_fa": "true",
            "$": "Catalyst mechanism"
          },
          {
            "@_fa": "true",
            "$": "NiMnO3/CeO2/Cordierite catalyst"
          }
        ],
        "openaccessArticle": "false",
        "prism:publicationName": "Journal of Molecular Catalysis A: Chemical",
        "openaccessSponsorType": null,
        "prism:pageRange": "160-167",
        "prism:endingPage": "167",
        "pubType": "fla",
        "prism:coverDisplayDate": "1 May 2016",
        "prism:doi": "10.1016/j.molcata.2016.01.023",
        "prism:startingPage": "160",
        "dc:identifier": "doi:10.1016/j.molcata.2016.01.023",
        "openaccessSponsorName": null
      },
      "objects": {
        "object": [
          {
            "@category": "thumbnail",
            "@height": "88",
            "@width": "219",
            "@_fa": "true",
            "$": "https://api.elsevier.com/content/object/eid/1-s2.0-S1381116916300231-fx1.sml?httpAccept=%2A%2F%2A",
            "@multimediatype": "GIF image file",
            "@type": "IMAGE-THUMBNAIL",
            "@size": "4966",
            "@ref": "fx1",
            "@mimetype": "image/gif"
          },
          {
            "@category": "thumbnail",
            "@height": "164",
            "@width": "214",
            "@_fa": "true",
            "$": "https://api.elsevier.com/content/object/eid/1-s2.0-S1381116916300231-gr1.sml?httpAccept=%2A%2F%2A",
            "@multimediatype": "GIF image file",
            "@type": "IMAGE-THUMBNAIL",
            "@size": "3601",
            "@ref": "gr1",
            "@mimetype": "image/gif"
          },
          {
            "@category": "thumbnail",
            "@height": "164",
            "@width": "101",
            "@_fa": "true",
            "$": "https://api.elsevier.com/content/object/eid/1-s2.0-S1381116916300231-gr10.sml?httpAccept=%2A%2F%2A",
            "@multimediatype": "GIF image file",
            "@type": "IMAGE-THUMBNAIL",
            "@size": "3732",
            "@ref": "gr10",
            "@mimetype": "image/gif"
          },
          {
            "@category": "thumbnail",
            "@height": "164",
            "@width": "212",
            "@_fa": "true",
            "$": "https://api.elsevier.com/content/object/eid/1-s2.0-S1381116916300231-gr2.sml?httpAccept=%2A%2F%2A",
            "@multimediatype": "GIF image file",
            "@type": "IMAGE-THUMBNAIL",
            "@size": "3036",
            "@ref": "gr2",
            "@mimetype": "image/gif"
          },
          {
            "@category": "thumbnail",
            "@height": "163",
            "@width": "219",
            "@_fa": "true",
            "$": "https://api.elsevier.com/content/object/eid/1-s2.0-S1381116916300231-gr3.sml?httpAccept=%2A%2F%2A",
            "@multimediatype": "GIF image file",
            "@type": "IMAGE-THUMBNAIL",
            "@size": "6865",
            "@ref": "gr3",
            "@mimetype": "image/gif"
          },
          {
            "@category": "thumbnail",
            "@height": "161",
            "@width": "219",
            "@_fa": "true",
            "$": "https://api.elsevier.com/content/object/eid/1-s2.0-S1381116916300231-gr4.sml?httpAccept=%2A%2F%2A",
            "@multimediatype": "GIF image file",
            "@type": "IMAGE-THUMBNAIL",
            "@size": "4942",
            "@ref": "gr4",
            "@mimetype": "image/gif"
          },
          {
            "@category": "thumbnail",
            "@height": "164",
            "@width": "216",
            "@_fa": "true",
            "$": "https://api.elsevier.com/content/object/eid/1-s2.0-S1381116916300231-gr5.sml?httpAccept=%2A%2F%2A",
            "@multimediatype": "GIF image file",
            "@type": "IMAGE-THUMBNAIL",
            "@size": "6932",
            "@ref": "gr5",
            "@mimetype": "image/gif"
          },
          {
            "@category": "thumbnail",
            "@height": "164",
            "@width": "218",
            "@_fa": "true",
            "$": "https://api.elsevier.com/content/object/eid/1-s2.0-S1381116916300231-gr6.sml?httpAccept=%2A%2F%2A",
            "@multimediatype": "GIF image file",
            "@type": "IMAGE-THUMBNAIL",
            "@size": "5640",
            "@ref": "gr6",
            "@mimetype": "image/gif"
          },
          {
            "@category": "thumbnail",
            "@height": "164",
            "@width": "209",
            "@_fa": "true",
            "$": "https://api.elsevier.com/content/object/eid/1-s2.0-S1381116916300231-gr7.sml?httpAccept=%2A%2F%2A",
            "@multimediatype": "GIF image file",
            "@type": "IMAGE-THUMBNAIL",
            "@size": "3813",
            "@ref": "gr7",
            "@mimetype": "image/gif"
          },
          {
            "@category": "thumbnail",
            "@height": "164",
            "@width": "209",
            "@_fa": "true",
            "$": "https://api.elsevier.com/content/object/eid/1-s2.0-S1381116916300231-gr8.sml?httpAccept=%2A%2F%2A",
            "@multimediatype": "GIF image file",
            "@type": "IMAGE-THUMBNAIL",
            "@size": "5189",
            "@ref": "gr8",
            "@mimetype": "image/gif"
          },
          {
            "@category": "thumbnail",
            "@height": "149",
            "@width": "219",
            "@_fa": "true",
            "$": "https://api.elsevier.com/content/object/eid/1-s2.0-S1381116916300231-gr9.sml?httpAccept=%2A%2F%2A",
            "@multimediatype": "GIF image file",
            "@type": "IMAGE-THUMBNAIL",
            "@size": "11851",
            "@ref": "gr9",
            "@mimetype": "image/gif"
          },
          {
            "@category": "standard",
            "@height": "200",
            "@width": "500",
            "@_fa": "true",
            "$": "https://api.elsevier.com/content/object/eid/1-s2.0-S1381116916300231-fx1.jpg?httpAccept=%2A%2F%2A",
            "@multimediatype": "JPEG image file",
            "@type": "IMAGE-DOWNSAMPLED",
            "@size": "20338",
            "@ref": "fx1",
            "@mimetype": "image/jpeg"
          },
          {
            "@category": "standard",
            "@height": "288",
            "@width": "377",
            "@_fa": "true",
            "$": "https://api.elsevier.com/content/object/eid/1-s2.0-S1381116916300231-gr1.jpg?httpAccept=%2A%2F%2A",
            "@multimediatype": "JPEG image file",
            "@type": "IMAGE-DOWNSAMPLED",
            "@size": "11008",
            "@ref": "gr1",
            "@mimetype": "image/jpeg"
          },
          {
            "@category": "standard",
            "@height": "635",
            "@width": "392",
            "@_fa": "true",
            "$": "https://api.elsevier.com/content/object/eid/1-s2.0-S1381116916300231-gr10.jpg?httpAccept=%2A%2F%2A",
            "@multimediatype": "JPEG image file",
            "@type": "IMAGE-DOWNSAMPLED",
            "@size": "38355",
            "@ref": "gr10",
            "@mimetype": "image/jpeg"
          },
          {
            "@category": "standard",
            "@height": "291",
            "@width": "377",
            "@_fa": "true",
            "$": "https://api.elsevier.com/content/object/eid/1-s2.0-S1381116916300231-gr2.jpg?httpAccept=%2A%2F%2A",
            "@multimediatype": "JPEG image file",
            "@type": "IMAGE-DOWNSAMPLED",
            "@size": "10271",
            "@ref": "gr2",
            "@mimetype": "image/jpeg"
          },
          {
            "@category": "standard",
            "@height": "293",
            "@width": "393",
            "@_fa": "true",
            "$": "https://api.elsevier.com/content/object/eid/1-s2.0-S1381116916300231-gr3.jpg?httpAccept=%2A%2F%2A",
            "@multimediatype": "JPEG image file",
            "@type": "IMAGE-DOWNSAMPLED",
            "@size": "27079",
            "@ref": "gr3",
            "@mimetype": "image/jpeg"
          },
          {
            "@category": "standard",
            "@height": "288",
            "@width": "393",
            "@_fa": "true",
            "$": "https://api.elsevier.com/content/object/eid/1-s2.0-S1381116916300231-gr4.jpg?httpAccept=%2A%2F%2A",
            "@multimediatype": "JPEG image file",
            "@type": "IMAGE-DOWNSAMPLED",
            "@size": "17202",
            "@ref": "gr4",
            "@mimetype": "image/jpeg"
          },
          {
            "@category": "standard",
            "@height": "293",
            "@width": "386",
            "@_fa": "true",
            "$": "https://api.elsevier.com/content/object/eid/1-s2.0-S1381116916300231-gr5.jpg?httpAccept=%2A%2F%2A",
            "@multimediatype": "JPEG image file",
            "@type": "IMAGE-DOWNSAMPLED",
            "@size": "26073",
            "@ref": "gr5",
            "@mimetype": "image/jpeg"
          },
          {
            "@category": "standard",
            "@height": "296",
            "@width": "393",
            "@_fa": "true",
            "$": "https://api.elsevier.com/content/object/eid/1-s2.0-S1381116916300231-gr6.jpg?httpAccept=%2A%2F%2A",
            "@multimediatype": "JPEG image file",
            "@type": "IMAGE-DOWNSAMPLED",
            "@size": "21028",
            "@ref": "gr6",
            "@mimetype": "image/jpeg"
          },
          {
            "@category": "standard",
            "@height": "306",
            "@width": "389",
            "@_fa": "true",
            "$": "https://api.elsevier.com/content/object/eid/1-s2.0-S1381116916300231-gr7.jpg?httpAccept=%2A%2F%2A",
            "@multimediatype": "JPEG image file",
            "@type": "IMAGE-DOWNSAMPLED",
            "@size": "12414",
            "@ref": "gr7",
            "@mimetype": "image/jpeg"
          },
          {
            "@category": "standard",
            "@height": "295",
            "@width": "376",
            "@_fa": "true",
            "$": "https://api.elsevier.com/content/object/eid/1-s2.0-S1381116916300231-gr8.jpg?httpAccept=%2A%2F%2A",
            "@multimediatype": "JPEG image file",
            "@type": "IMAGE-DOWNSAMPLED",
            "@size": "16714",
            "@ref": "gr8",
            "@mimetype": "image/jpeg"
          },
          {
            "@category": "standard",
            "@height": "358",
            "@width": "527",
            "@_fa": "true",
            "$": "https://api.elsevier.com/content/object/eid/1-s2.0-S1381116916300231-gr9.jpg?httpAccept=%2A%2F%2A",
            "@multimediatype": "JPEG image file",
            "@type": "IMAGE-DOWNSAMPLED",
            "@size": "43677",
            "@ref": "gr9",
            "@mimetype": "image/jpeg"
          },
          {
            "@category": "high",
            "@height": "886",
            "@width": "2213",
            "@_fa": "true",
            "$": "https://api.elsevier.com/content/object/eid/1-s2.0-S1381116916300231-fx1_lrg.jpg?httpAccept=%2A%2F%2A",
            "@multimediatype": "JPEG image file",
            "@type": "IMAGE-HIGH-RES",
            "@size": "150378",
            "@ref": "fx1",
            "@mimetype": "image/jpeg"
          },
          {
            "@category": "high",
            "@height": "1277",
            "@width": "1669",
            "@_fa": "true",
            "$": "https://api.elsevier.com/content/object/eid/1-s2.0-S1381116916300231-gr1_lrg.jpg?httpAccept=%2A%2F%2A",
            "@multimediatype": "JPEG image file",
            "@type": "IMAGE-HIGH-RES",
            "@size": "86603",
            "@ref": "gr1",
            "@mimetype": "image/jpeg"
          },
          {
            "@category": "high",
            "@height": "2813",
            "@width": "1736",
            "@_fa": "true",
            "$": "https://api.elsevier.com/content/object/eid/1-s2.0-S1381116916300231-gr10_lrg.jpg?httpAccept=%2A%2F%2A",
            "@multimediatype": "JPEG image file",
            "@type": "IMAGE-HIGH-RES",
            "@size": "311594",
            "@ref": "gr10",
            "@mimetype": "image/jpeg"
          },
          {
            "@category": "high",
            "@height": "1289",
            "@width": "1669",
            "@_fa": "true",
            "$": "https://api.elsevier.com/content/object/eid/1-s2.0-S1381116916300231-gr2_lrg.jpg?httpAccept=%2A%2F%2A",
            "@multimediatype": "JPEG image file",
            "@type": "IMAGE-HIGH-RES",
            "@size": "81288",
            "@ref": "gr2",
            "@mimetype": "image/jpeg"
          },
          {
            "@category": "high",
            "@height": "1299",
            "@width": "1743",
            "@_fa": "true",
            "$": "https://api.elsevier.com/content/object/eid/1-s2.0-S1381116916300231-gr3_lrg.jpg?httpAccept=%2A%2F%2A",
            "@multimediatype": "JPEG image file",
            "@type": "IMAGE-HIGH-RES",
            "@size": "191115",
            "@ref": "gr3",
            "@mimetype": "image/jpeg"
          },
          {
            "@category": "high",
            "@height": "1278",
            "@width": "1743",
            "@_fa": "true",
            "$": "https://api.elsevier.com/content/object/eid/1-s2.0-S1381116916300231-gr4_lrg.jpg?httpAccept=%2A%2F%2A",
            "@multimediatype": "JPEG image file",
            "@type": "IMAGE-HIGH-RES",
            "@size": "135253",
            "@ref": "gr4",
            "@mimetype": "image/jpeg"
          },
          {
            "@category": "high",
            "@height": "1297",
            "@width": "1708",
            "@_fa": "true",
            "$": "https://api.elsevier.com/content/object/eid/1-s2.0-S1381116916300231-gr5_lrg.jpg?httpAccept=%2A%2F%2A",
            "@multimediatype": "JPEG image file",
            "@type": "IMAGE-HIGH-RES",
            "@size": "208250",
            "@ref": "gr5",
            "@mimetype": "image/jpeg"
          },
          {
            "@category": "high",
            "@height": "1313",
            "@width": "1743",
            "@_fa": "true",
            "$": "https://api.elsevier.com/content/object/eid/1-s2.0-S1381116916300231-gr6_lrg.jpg?httpAccept=%2A%2F%2A",
            "@multimediatype": "JPEG image file",
            "@type": "IMAGE-HIGH-RES",
            "@size": "162543",
            "@ref": "gr6",
            "@mimetype": "image/jpeg"
          },
          {
            "@category": "high",
            "@height": "1355",
            "@width": "1725",
            "@_fa": "true",
            "$": "https://api.elsevier.com/content/object/eid/1-s2.0-S1381116916300231-gr7_lrg.jpg?httpAccept=%2A%2F%2A",
            "@multimediatype": "JPEG image file",
            "@type": "IMAGE-HIGH-RES",
            "@size": "100562",
            "@ref": "gr7",
            "@mimetype": "image/jpeg"
          },
          {
            "@category": "high",
            "@height": "1306",
            "@width": "1667",
            "@_fa": "true",
            "$": "https://api.elsevier.com/content/object/eid/1-s2.0-S1381116916300231-gr8_lrg.jpg?httpAccept=%2A%2F%2A",
            "@multimediatype": "JPEG image file",
            "@type": "IMAGE-HIGH-RES",
            "@size": "134468",
            "@ref": "gr8",
            "@mimetype": "image/jpeg"
          },
          {
            "@category": "high",
            "@height": "1583",
            "@width": "2333",
            "@_fa": "true",
            "$": "https://api.elsevier.com/content/object/eid/1-s2.0-S1381116916300231-gr9_lrg.jpg?httpAccept=%2A%2F%2A",
            "@multimediatype": "JPEG image file",
            "@type": "IMAGE-HIGH-RES",
            "@size": "387952",
            "@ref": "gr9",
            "@mimetype": "image/jpeg"
          },
          {
            "@category": "standard",
            "@_fa": "true",
            "$": "https://api.elsevier.com/content/object/eid/1-s2.0-S1381116916300231-mmc1.doc?httpAccept=%2A%2F%2A",
            "@multimediatype": "Microsoft Word file",
            "@type": "APPLICATION",
            "@size": "115712",
            "@ref": "mmc1",
            "@mimetype": "application/word"
          },
          {
            "@category": "thumbnail",
            "@height": "22",
            "@width": "268",
            "@_fa": "true",
            "$": "https://api.elsevier.com/content/object/eid/1-s2.0-S1381116916300231-si1.gif?httpAccept=%2A%2F%2A",
            "@multimediatype": "GIF image file",
            "@type": "ALTIMG",
            "@size": "910",
            "@ref": "si1",
            "@mimetype": "image/gif"
          },
          {
            "@category": "thumbnail",
            "@height": "16",
            "@width": "22",
            "@_fa": "true",
            "$": "https://api.elsevier.com/content/object/eid/1-s2.0-S1381116916300231-si10.gif?httpAccept=%2A%2F%2A",
            "@multimediatype": "GIF image file",
            "@type": "ALTIMG",
            "@size": "176",
            "@ref": "si10",
            "@mimetype": "image/gif"
          },
          {
            "@category": "thumbnail",
            "@height": "40",
            "@width": "124",
            "@_fa": "true",
            "$": "https://api.elsevier.com/content/object/eid/1-s2.0-S1381116916300231-si11.gif?httpAccept=%2A%2F%2A",
            "@multimediatype": "GIF image file",
            "@type": "ALTIMG",
            "@size": "758",
            "@ref": "si11",
            "@mimetype": "image/gif"
          },
          {
            "@category": "thumbnail",
            "@height": "37",
            "@width": "248",
            "@_fa": "true",
            "$": "https://api.elsevier.com/content/object/eid/1-s2.0-S1381116916300231-si12.gif?httpAccept=%2A%2F%2A",
            "@multimediatype": "GIF image file",
            "@type": "ALTIMG",
            "@size": "1277",
            "@ref": "si12",
            "@mimetype": "image/gif"
          },
          {
            "@category": "thumbnail",
            "@height": "36",
            "@width": "251",
            "@_fa": "true",
            "$": "https://api.elsevier.com/content/object/eid/1-s2.0-S1381116916300231-si13.gif?httpAccept=%2A%2F%2A",
            "@multimediatype": "GIF image file",
            "@type": "ALTIMG",
            "@size": "969",
            "@ref": "si13",
            "@mimetype": "image/gif"
          },
          {
            "@category": "thumbnail",
            "@height": "34",
            "@width": "207",
            "@_fa": "true",
            "$": "https://api.elsevier.com/content/object/eid/1-s2.0-S1381116916300231-si14.gif?httpAccept=%2A%2F%2A",
            "@multimediatype": "GIF image file",
            "@type": "ALTIMG",
            "@size": "833",
            "@ref": "si14",
            "@mimetype": "image/gif"
          },
          {
            "@category": "thumbnail",
            "@height": "21",
            "@width": "111",
            "@_fa": "true",
            "$": "https://api.elsevier.com/content/object/eid/1-s2.0-S1381116916300231-si2.gif?httpAccept=%2A%2F%2A",
            "@multimediatype": "GIF image file",
            "@type": "ALTIMG",
            "@size": "543",
            "@ref": "si2",
            "@mimetype": "image/gif"
          },
          {
            "@category": "thumbnail",
            "@height": "72",
            "@width": "369",
            "@_fa": "true",
            "$": "https://api.elsevier.com/content/object/eid/1-s2.0-S1381116916300231-si3.gif?httpAccept=%2A%2F%2A",
            "@multimediatype": "GIF image file",
            "@type": "ALTIMG",
            "@size": "1788",
            "@ref": "si3",
            "@mimetype": "image/gif"
          },
          {
            "@category": "thumbnail",
            "@height": "21",
            "@width": "147",
            "@_fa": "true",
            "$": "https://api.elsevier.com/content/object/eid/1-s2.0-S1381116916300231-si4.gif?httpAccept=%2A%2F%2A",
            "@multimediatype": "GIF image file",
            "@type": "ALTIMG",
            "@size": "668",
            "@ref": "si4",
            "@mimetype": "image/gif"
          },
          {
            "@category": "thumbnail",
            "@height": "30",
            "@width": "125",
            "@_fa": "true",
            "$": "https://api.elsevier.com/content/object/eid/1-s2.0-S1381116916300231-si5.gif?httpAccept=%2A%2F%2A",
            "@multimediatype": "GIF image file",
            "@type": "ALTIMG",
            "@size": "668",
            "@ref": "si5",
            "@mimetype": "image/gif"
          },
          {
            "@category": "thumbnail",
            "@height": "35",
            "@width": "267",
            "@_fa": "true",
            "$": "https://api.elsevier.com/content/object/eid/1-s2.0-S1381116916300231-si6.gif?httpAccept=%2A%2F%2A",
            "@multimediatype": "GIF image file",
            "@type": "ALTIMG",
            "@size": "1074",
            "@ref": "si6",
            "@mimetype": "image/gif"
          },
          {
            "@category": "thumbnail",
            "@height": "33",
            "@width": "175",
            "@_fa": "true",
            "$": "https://api.elsevier.com/content/object/eid/1-s2.0-S1381116916300231-si7.gif?httpAccept=%2A%2F%2A",
            "@multimediatype": "GIF image file",
            "@type": "ALTIMG",
            "@size": "895",
            "@ref": "si7",
            "@mimetype": "image/gif"
          },
          {
            "@category": "thumbnail",
            "@height": "35",
            "@width": "238",
            "@_fa": "true",
            "$": "https://api.elsevier.com/content/object/eid/1-s2.0-S1381116916300231-si8.gif?httpAccept=%2A%2F%2A",
            "@multimediatype": "GIF image file",
            "@type": "ALTIMG",
            "@size": "981",
            "@ref": "si8",
            "@mimetype": "image/gif"
          },
          {
            "@category": "thumbnail",
            "@height": "35",
            "@width": "216",
            "@_fa": "true",
            "$": "https://api.elsevier.com/content/object/eid/1-s2.0-S1381116916300231-si9.gif?httpAccept=%2A%2F%2A",
            "@multimediatype": "GIF image file",
            "@type": "ALTIMG",
            "@size": "882",
            "@ref": "si9",
            "@mimetype": "image/gif"
          }
        ]
      },
      "link": {
        "@rel": "abstract",
        "@href": "https://api.elsevier.com/content/abstract/scopus_id/84958956329"
      }
    }
  }
}