{
  "metadata": {
    "title": "Synthesis and characterization of recyclable and recoverable MMT-clay exchanged ammonium tagged carbapalladacycle catalyst for Mizoroki–Heck and Sonogashira reactions in ionic liquid media",
    "authors": "; ; ",
    "journal": "Journal of Molecular Catalysis A: Chemical",
    "date": "2011-01-04",
    "doi": "10.1016/j.molcata.2010.10.015",
    "abstract": "",
    "uri": "https://api.elsevier.com/content/article/pii/S1381116910004279",
    "pii": "S1381116910004279"
  },
  "fulltext": {
    "full-text-retrieval-response": {
      "scopus-eid": "2-s2.0-78650516037",
      "originalText": "serial JL 271358 291210 291744 291790 291809 31 Journal of Molecular Catalysis A: Chemical JOURNALMOLECULARCATALYSISACHEMICAL 2010-11-05 2010-11-05 2014-09-30T11:46:43 1-s2.0-S1381116910004279 S1381-1169(10)00427-9 S1381116910004279 10.1016/j.molcata.2010.10.015 S300 S300.2 FULL-TEXT 1-s2.0-S1381116910X00176 2015-05-15T05:56:33.607047-04:00 0 0 20110104 2011 2010-11-05T00:00:00Z absattachment articleinfo articletitlenorm authfirstinitialnorm authfirstsurnamenorm cid cids contenttype copyright crossmark dateloaded dateloadedtxt datesearch datesort dateupdated dco docsubtype doctype doi eid ewtransactionid hubeid indexeddate issfirst issn issnnorm issuelist itemstage itemtransactionid itemweight openaccess openarchive pg pgfirst pglast pii piinorm pubdatestart pubdatetxt pubyr sectiontitle sortorder srctitle srctitlenorm srctype ssids alllist content subj subheadings tomb volfirst volissue volumelist webpdf webpdfpagecount yearnav figure table body acknowledge affil articletitle auth authfirstini authfull authkeywords authlast grantsponsor primabst ref specialabst 1381-1169 13811169 false 334 334 1 2 1 2 Volume 334, Issues 1–2 5 13 19 13 19 20110104 4 January 2011 2011-01-04 2011 Regular papers article fla Copyright © 2010 Elsevier B.V. All rights reserved. SYNTHESISCHARACTERIZATIONRECYCLABLERECOVERABLEMMTCLAYEXCHANGEDAMMONIUMTAGGEDCARBAPALLADACYCLECATALYSTFORMIZOROKIHECKSONOGASHIRAREACTIONSINIONICLIQUIDMEDIA SINGH V 1 Introduction 2 Experimental 2.1 Synthesis of ammonium tagged carbapalladacycle catalyst 5 2.2 Preparation of clay nanocomposite catalyst 6 2.3 Catalyst characterization 2.4 Methods and materials 2.5 Typical experimental procedure for Mizoroki–Heck reaction with catalysts 5 and 6 2.5.1 (E)-tert-Butyl-cinnamate 2.6 Typical experimental procedure for Sonogashira reaction with catalyst 5 and 6 2.6.1 1,2-Diphenyl ethyne 2.7 Leaching tests 2.8 Recovery and reuse of catalyst 6 3 Results and discussion 4 Conclusion Acknowledgements References GLADYSZ 2001 1319 1324 J SONG 2002 3495 3524 C DICKERSON 2002 3325 3344 T WILES 2008 1655 1671 C HUTCHINGS 2009 1222 1235 G CORMA 2008 8 31 A POLSHETTIWAR 2007 6949 6976 V WIGHT 2002 3589 3614 A DESAI 2004 177 208 B CHEN 2009 5094 5115 X TSUJI 2004 J PALLADIUMREAGENTSCATALYSTS DUPONT 2005 2527 2572 J ALACID 2006 117 132 E ALACID 2008 2315 2322 E ALACID 2008 3102 3106 E BALEIZAO 2003 606 607 C LUO 2005 6040 6045 F BALEIZAO 2004 439 446 C CORMA 2005 322 331 A CORMA 2004 8553 8560 A ALACID 2009 1658 1665 E AUDIC 2003 9248 9249 N SEBESTA 2008 484 496 R VARMA 2002 1235 1255 R SCHOONHEYDT 2002 411 420 R KIM 2006 29 35 N CASTILLO 2007 287 291 M TAO 2009 96 101 R SINGH 2004 119 124 V SINGH 2005 57 60 V RATTI 2010 503 507 R TIYAPIBOONCHAIYA 2002 1906 1911 C MARZA 2003 6595 6599 E ALONSO 2003 1146 1158 D SINGHX2011X13 SINGHX2011X13X19 SINGHX2011X13XV SINGHX2011X13X19XV item S1381-1169(10)00427-9 S1381116910004279 1-s2.0-S1381116910004279 10.1016/j.molcata.2010.10.015 271358 2014-10-01T16:44:25.758228-04:00 2011-01-04 1-s2.0-S1381116910004279-main.pdf https://s3.amazonaws.com/prod-ucs-content-store-us-east/content/pii:S1381116910004279/MAIN/application/pdf/38476425e44e2ac5b41c4e82f885ab92/main.pdf https://s3-eu-west-1.amazonaws.com/prod-ucs-content-store-eu-west/content/pii:S1381116910004279/MAIN/application/pdf/38476425e44e2ac5b41c4e82f885ab92/main.pdf main.pdf pdf true 629104 MAIN 7 1-s2.0-S1381116910004279-main_1.png https://s3-eu-west-1.amazonaws.com/prod-ucs-content-store-eu-west/content/pii:S1381116910004279/PREVIEW/image/png/5e84f4e2a92f9f612744c00b85c1cfa3/main_1.png https://s3.amazonaws.com/prod-ucs-content-store-us-east/content/pii:S1381116910004279/PREVIEW/image/png/5e84f4e2a92f9f612744c00b85c1cfa3/main_1.png main_1.png png 59511 849 656 IMAGE-WEB-PDF 1 1-s2.0-S1381116910004279-sc3_lrg.jpg https://s3.amazonaws.com/prod-ucs-content-store-us-east/content/pii:S1381116910004279/sc3/HIGHRES/image/jpeg/32c7c123203d8ee29d49efb44d6d7fd9/sc3_lrg.jpg https://s3-eu-west-1.amazonaws.com/prod-ucs-content-store-eu-west/content/pii:S1381116910004279/sc3/HIGHRES/image/jpeg/32c7c123203d8ee29d49efb44d6d7fd9/sc3_lrg.jpg sc3 sc3_lrg.jpg jpg 94607 560 2332 IMAGE-HIGH-RES 1-s2.0-S1381116910004279-sc2_lrg.jpg https://s3.amazonaws.com/prod-ucs-content-store-us-east/content/pii:S1381116910004279/sc2/HIGHRES/image/jpeg/0977d6c9e59374cbc15ed14b39ae2d2e/sc2_lrg.jpg https://s3-eu-west-1.amazonaws.com/prod-ucs-content-store-eu-west/content/pii:S1381116910004279/sc2/HIGHRES/image/jpeg/0977d6c9e59374cbc15ed14b39ae2d2e/sc2_lrg.jpg sc2 sc2_lrg.jpg jpg 94275 637 2165 IMAGE-HIGH-RES 1-s2.0-S1381116910004279-sc1_lrg.jpg https://s3.amazonaws.com/prod-ucs-content-store-us-east/content/pii:S1381116910004279/sc1/HIGHRES/image/jpeg/5431143e56049544235df879860cbf5d/sc1_lrg.jpg https://s3-eu-west-1.amazonaws.com/prod-ucs-content-store-eu-west/content/pii:S1381116910004279/sc1/HIGHRES/image/jpeg/5431143e56049544235df879860cbf5d/sc1_lrg.jpg sc1 sc1_lrg.jpg jpg 198214 1065 2975 IMAGE-HIGH-RES 1-s2.0-S1381116910004279-gr8_lrg.jpg https://s3.amazonaws.com/prod-ucs-content-store-us-east/content/pii:S1381116910004279/gr8/HIGHRES/image/jpeg/ce0ec89ac62c725cd0e31c68dd0af6c2/gr8_lrg.jpg https://s3-eu-west-1.amazonaws.com/prod-ucs-content-store-eu-west/content/pii:S1381116910004279/gr8/HIGHRES/image/jpeg/ce0ec89ac62c725cd0e31c68dd0af6c2/gr8_lrg.jpg gr8 gr8_lrg.jpg jpg 108101 938 1164 IMAGE-HIGH-RES 1-s2.0-S1381116910004279-gr7_lrg.jpg https://s3.amazonaws.com/prod-ucs-content-store-us-east/content/pii:S1381116910004279/gr7/HIGHRES/image/jpeg/b5610d2bb9bd3c68ad7081d9c51e3155/gr7_lrg.jpg https://s3-eu-west-1.amazonaws.com/prod-ucs-content-store-eu-west/content/pii:S1381116910004279/gr7/HIGHRES/image/jpeg/b5610d2bb9bd3c68ad7081d9c51e3155/gr7_lrg.jpg gr7 gr7_lrg.jpg jpg 96210 972 1177 IMAGE-HIGH-RES 1-s2.0-S1381116910004279-gr6_lrg.jpg https://s3.amazonaws.com/prod-ucs-content-store-us-east/content/pii:S1381116910004279/gr6/HIGHRES/image/jpeg/b4a74209024bd9d908468bc8f3a7952c/gr6_lrg.jpg https://s3-eu-west-1.amazonaws.com/prod-ucs-content-store-eu-west/content/pii:S1381116910004279/gr6/HIGHRES/image/jpeg/b4a74209024bd9d908468bc8f3a7952c/gr6_lrg.jpg gr6 gr6_lrg.jpg jpg 118639 895 1445 IMAGE-HIGH-RES 1-s2.0-S1381116910004279-gr5_lrg.jpg https://s3.amazonaws.com/prod-ucs-content-store-us-east/content/pii:S1381116910004279/gr5/HIGHRES/image/jpeg/d1005eaae8528c16d399abb05aad8696/gr5_lrg.jpg https://s3-eu-west-1.amazonaws.com/prod-ucs-content-store-eu-west/content/pii:S1381116910004279/gr5/HIGHRES/image/jpeg/d1005eaae8528c16d399abb05aad8696/gr5_lrg.jpg gr5 gr5_lrg.jpg jpg 110647 806 1181 IMAGE-HIGH-RES 1-s2.0-S1381116910004279-gr4_lrg.jpg https://s3.amazonaws.com/prod-ucs-content-store-us-east/content/pii:S1381116910004279/gr4/HIGHRES/image/jpeg/fb5e2b9b3abead55686f32c28621288d/gr4_lrg.jpg https://s3-eu-west-1.amazonaws.com/prod-ucs-content-store-eu-west/content/pii:S1381116910004279/gr4/HIGHRES/image/jpeg/fb5e2b9b3abead55686f32c28621288d/gr4_lrg.jpg gr4 gr4_lrg.jpg jpg 199402 1188 2179 IMAGE-HIGH-RES 1-s2.0-S1381116910004279-gr3_lrg.jpg https://s3.amazonaws.com/prod-ucs-content-store-us-east/content/pii:S1381116910004279/gr3/HIGHRES/image/jpeg/e1c733ebba25f56e8d1cd3c1f38d0ab0/gr3_lrg.jpg https://s3-eu-west-1.amazonaws.com/prod-ucs-content-store-eu-west/content/pii:S1381116910004279/gr3/HIGHRES/image/jpeg/e1c733ebba25f56e8d1cd3c1f38d0ab0/gr3_lrg.jpg gr3 gr3_lrg.jpg jpg 191922 1244 2200 IMAGE-HIGH-RES 1-s2.0-S1381116910004279-gr2_lrg.jpg https://s3.amazonaws.com/prod-ucs-content-store-us-east/content/pii:S1381116910004279/gr2/HIGHRES/image/jpeg/8bc25b33b53d464cd88db314cfcec4ad/gr2_lrg.jpg https://s3-eu-west-1.amazonaws.com/prod-ucs-content-store-eu-west/content/pii:S1381116910004279/gr2/HIGHRES/image/jpeg/8bc25b33b53d464cd88db314cfcec4ad/gr2_lrg.jpg gr2 gr2_lrg.jpg jpg 90744 1017 1508 IMAGE-HIGH-RES 1-s2.0-S1381116910004279-gr1_lrg.jpg https://s3.amazonaws.com/prod-ucs-content-store-us-east/content/pii:S1381116910004279/gr1/HIGHRES/image/jpeg/e588d6ad64ff37555774aead45219015/gr1_lrg.jpg https://s3-eu-west-1.amazonaws.com/prod-ucs-content-store-eu-west/content/pii:S1381116910004279/gr1/HIGHRES/image/jpeg/e588d6ad64ff37555774aead45219015/gr1_lrg.jpg gr1 gr1_lrg.jpg jpg 405854 1087 2437 IMAGE-HIGH-RES 1-s2.0-S1381116910004279-fx1_lrg.jpg https://s3.amazonaws.com/prod-ucs-content-store-us-east/content/pii:S1381116910004279/fx1/HIGHRES/image/jpeg/3c3628121444364e55aeba8b8f55c81b/fx1_lrg.jpg https://s3-eu-west-1.amazonaws.com/prod-ucs-content-store-eu-west/content/pii:S1381116910004279/fx1/HIGHRES/image/jpeg/3c3628121444364e55aeba8b8f55c81b/fx1_lrg.jpg fx1 true fx1_lrg.jpg jpg 131700 438 984 IMAGE-HIGH-RES 1-s2.0-S1381116910004279-sc3.jpg https://s3.amazonaws.com/prod-ucs-content-store-us-east/content/pii:S1381116910004279/sc3/DOWNSAMPLED/image/jpeg/5eec71e1f4c7a885190163420b1bba3d/sc3.jpg https://s3-eu-west-1.amazonaws.com/prod-ucs-content-store-eu-west/content/pii:S1381116910004279/sc3/DOWNSAMPLED/image/jpeg/5eec71e1f4c7a885190163420b1bba3d/sc3.jpg sc3 sc3.jpg jpg 9926 127 527 IMAGE-DOWNSAMPLED 1-s2.0-S1381116910004279-sc2.jpg https://s3.amazonaws.com/prod-ucs-content-store-us-east/content/pii:S1381116910004279/sc2/DOWNSAMPLED/image/jpeg/542efbf80155429581d18e94fad30b33/sc2.jpg https://s3-eu-west-1.amazonaws.com/prod-ucs-content-store-eu-west/content/pii:S1381116910004279/sc2/DOWNSAMPLED/image/jpeg/542efbf80155429581d18e94fad30b33/sc2.jpg sc2 sc2.jpg jpg 10096 144 489 IMAGE-DOWNSAMPLED 1-s2.0-S1381116910004279-sc1.jpg https://s3.amazonaws.com/prod-ucs-content-store-us-east/content/pii:S1381116910004279/sc1/DOWNSAMPLED/image/jpeg/6c3dd79880f5e2d91160bcff971df389/sc1.jpg https://s3-eu-west-1.amazonaws.com/prod-ucs-content-store-eu-west/content/pii:S1381116910004279/sc1/DOWNSAMPLED/image/jpeg/6c3dd79880f5e2d91160bcff971df389/sc1.jpg sc1 sc1.jpg jpg 22197 241 672 IMAGE-DOWNSAMPLED 1-s2.0-S1381116910004279-gr8.jpg https://s3.amazonaws.com/prod-ucs-content-store-us-east/content/pii:S1381116910004279/gr8/DOWNSAMPLED/image/jpeg/a1df03b431190b966c9d327250912304/gr8.jpg https://s3-eu-west-1.amazonaws.com/prod-ucs-content-store-eu-west/content/pii:S1381116910004279/gr8/DOWNSAMPLED/image/jpeg/a1df03b431190b966c9d327250912304/gr8.jpg gr8 gr8.jpg jpg 13744 212 263 IMAGE-DOWNSAMPLED 1-s2.0-S1381116910004279-gr7.jpg https://s3.amazonaws.com/prod-ucs-content-store-us-east/content/pii:S1381116910004279/gr7/DOWNSAMPLED/image/jpeg/2b664e66601c111dbf43a0aadc507a66/gr7.jpg https://s3-eu-west-1.amazonaws.com/prod-ucs-content-store-eu-west/content/pii:S1381116910004279/gr7/DOWNSAMPLED/image/jpeg/2b664e66601c111dbf43a0aadc507a66/gr7.jpg gr7 gr7.jpg jpg 12278 220 266 IMAGE-DOWNSAMPLED 1-s2.0-S1381116910004279-gr6.jpg https://s3.amazonaws.com/prod-ucs-content-store-us-east/content/pii:S1381116910004279/gr6/DOWNSAMPLED/image/jpeg/1a62cd5cc014eb633988df300b9eb16b/gr6.jpg https://s3-eu-west-1.amazonaws.com/prod-ucs-content-store-eu-west/content/pii:S1381116910004279/gr6/DOWNSAMPLED/image/jpeg/1a62cd5cc014eb633988df300b9eb16b/gr6.jpg gr6 gr6.jpg jpg 15628 202 326 IMAGE-DOWNSAMPLED 1-s2.0-S1381116910004279-gr5.jpg https://s3.amazonaws.com/prod-ucs-content-store-us-east/content/pii:S1381116910004279/gr5/DOWNSAMPLED/image/jpeg/a470e139f7829bacf9bb24797a71a382/gr5.jpg https://s3-eu-west-1.amazonaws.com/prod-ucs-content-store-eu-west/content/pii:S1381116910004279/gr5/DOWNSAMPLED/image/jpeg/a470e139f7829bacf9bb24797a71a382/gr5.jpg gr5 gr5.jpg jpg 13698 182 266 IMAGE-DOWNSAMPLED 1-s2.0-S1381116910004279-gr4.jpg https://s3.amazonaws.com/prod-ucs-content-store-us-east/content/pii:S1381116910004279/gr4/DOWNSAMPLED/image/jpeg/769f3d44f48154f9fa5841f428440f1c/gr4.jpg https://s3-eu-west-1.amazonaws.com/prod-ucs-content-store-eu-west/content/pii:S1381116910004279/gr4/DOWNSAMPLED/image/jpeg/769f3d44f48154f9fa5841f428440f1c/gr4.jpg gr4 gr4.jpg jpg 38142 268 492 IMAGE-DOWNSAMPLED 1-s2.0-S1381116910004279-gr3.jpg https://s3.amazonaws.com/prod-ucs-content-store-us-east/content/pii:S1381116910004279/gr3/DOWNSAMPLED/image/jpeg/6843310f196b221762a78061c0e673a1/gr3.jpg https://s3-eu-west-1.amazonaws.com/prod-ucs-content-store-eu-west/content/pii:S1381116910004279/gr3/DOWNSAMPLED/image/jpeg/6843310f196b221762a78061c0e673a1/gr3.jpg gr3 gr3.jpg jpg 38186 281 497 IMAGE-DOWNSAMPLED 1-s2.0-S1381116910004279-gr2.jpg https://s3.amazonaws.com/prod-ucs-content-store-us-east/content/pii:S1381116910004279/gr2/DOWNSAMPLED/image/jpeg/a445624743d7c741a111377d73b7e913/gr2.jpg https://s3-eu-west-1.amazonaws.com/prod-ucs-content-store-eu-west/content/pii:S1381116910004279/gr2/DOWNSAMPLED/image/jpeg/a445624743d7c741a111377d73b7e913/gr2.jpg gr2 gr2.jpg jpg 25102 229 340 IMAGE-DOWNSAMPLED 1-s2.0-S1381116910004279-gr1.jpg https://s3.amazonaws.com/prod-ucs-content-store-us-east/content/pii:S1381116910004279/gr1/DOWNSAMPLED/image/jpeg/770abd67be450801781a313c652f8b81/gr1.jpg https://s3-eu-west-1.amazonaws.com/prod-ucs-content-store-eu-west/content/pii:S1381116910004279/gr1/DOWNSAMPLED/image/jpeg/770abd67be450801781a313c652f8b81/gr1.jpg gr1 gr1.jpg jpg 58812 245 550 IMAGE-DOWNSAMPLED 1-s2.0-S1381116910004279-fx1.jpg https://s3.amazonaws.com/prod-ucs-content-store-us-east/content/pii:S1381116910004279/fx1/DOWNSAMPLED/image/jpeg/a2cfaa11b0512de9457f24c463f8427b/fx1.jpg https://s3-eu-west-1.amazonaws.com/prod-ucs-content-store-eu-west/content/pii:S1381116910004279/fx1/DOWNSAMPLED/image/jpeg/a2cfaa11b0512de9457f24c463f8427b/fx1.jpg fx1 true fx1.jpg jpg 25501 99 222 IMAGE-DOWNSAMPLED 1-s2.0-S1381116910004279-sc3.sml https://s3.amazonaws.com/prod-ucs-content-store-us-east/content/pii:S1381116910004279/sc3/THUMBNAIL/image/gif/25353fae27764e1bfd64d7818928bb29/sc3.sml https://s3-eu-west-1.amazonaws.com/prod-ucs-content-store-eu-west/content/pii:S1381116910004279/sc3/THUMBNAIL/image/gif/25353fae27764e1bfd64d7818928bb29/sc3.sml sc3 sc3.sml sml 2045 53 219 IMAGE-THUMBNAIL 1-s2.0-S1381116910004279-sc2.sml https://s3.amazonaws.com/prod-ucs-content-store-us-east/content/pii:S1381116910004279/sc2/THUMBNAIL/image/gif/7c7a089e27684d56395ca4edc5055f71/sc2.sml https://s3-eu-west-1.amazonaws.com/prod-ucs-content-store-eu-west/content/pii:S1381116910004279/sc2/THUMBNAIL/image/gif/7c7a089e27684d56395ca4edc5055f71/sc2.sml sc2 sc2.sml sml 2189 64 219 IMAGE-THUMBNAIL 1-s2.0-S1381116910004279-sc1.sml https://s3.amazonaws.com/prod-ucs-content-store-us-east/content/pii:S1381116910004279/sc1/THUMBNAIL/image/gif/1dec1eaea8688071d87d65315362694e/sc1.sml https://s3-eu-west-1.amazonaws.com/prod-ucs-content-store-eu-west/content/pii:S1381116910004279/sc1/THUMBNAIL/image/gif/1dec1eaea8688071d87d65315362694e/sc1.sml sc1 sc1.sml sml 2556 78 219 IMAGE-THUMBNAIL 1-s2.0-S1381116910004279-gr8.sml https://s3.amazonaws.com/prod-ucs-content-store-us-east/content/pii:S1381116910004279/gr8/THUMBNAIL/image/gif/72c264bcaa4734e40d3ca7c766109367/gr8.sml https://s3-eu-west-1.amazonaws.com/prod-ucs-content-store-eu-west/content/pii:S1381116910004279/gr8/THUMBNAIL/image/gif/72c264bcaa4734e40d3ca7c766109367/gr8.sml gr8 gr8.sml sml 4542 164 203 IMAGE-THUMBNAIL 1-s2.0-S1381116910004279-gr7.sml https://s3.amazonaws.com/prod-ucs-content-store-us-east/content/pii:S1381116910004279/gr7/THUMBNAIL/image/gif/adbbbe689fbd57ebf5e5e2b75b07403c/gr7.sml https://s3-eu-west-1.amazonaws.com/prod-ucs-content-store-eu-west/content/pii:S1381116910004279/gr7/THUMBNAIL/image/gif/adbbbe689fbd57ebf5e5e2b75b07403c/gr7.sml gr7 gr7.sml sml 4134 164 198 IMAGE-THUMBNAIL 1-s2.0-S1381116910004279-gr6.sml https://s3.amazonaws.com/prod-ucs-content-store-us-east/content/pii:S1381116910004279/gr6/THUMBNAIL/image/gif/b11216e0cb56805da39eddb3fcbb33f8/gr6.sml https://s3-eu-west-1.amazonaws.com/prod-ucs-content-store-eu-west/content/pii:S1381116910004279/gr6/THUMBNAIL/image/gif/b11216e0cb56805da39eddb3fcbb33f8/gr6.sml gr6 gr6.sml sml 7756 136 219 IMAGE-THUMBNAIL 1-s2.0-S1381116910004279-gr5.sml https://s3.amazonaws.com/prod-ucs-content-store-us-east/content/pii:S1381116910004279/gr5/THUMBNAIL/image/gif/4079d3718b56ee98cfa3b9dfe99f68ab/gr5.sml https://s3-eu-west-1.amazonaws.com/prod-ucs-content-store-eu-west/content/pii:S1381116910004279/gr5/THUMBNAIL/image/gif/4079d3718b56ee98cfa3b9dfe99f68ab/gr5.sml gr5 gr5.sml sml 8518 149 219 IMAGE-THUMBNAIL 1-s2.0-S1381116910004279-gr4.sml https://s3.amazonaws.com/prod-ucs-content-store-us-east/content/pii:S1381116910004279/gr4/THUMBNAIL/image/gif/5d0f1d69f581eaf445a3505d53269cbd/gr4.sml https://s3-eu-west-1.amazonaws.com/prod-ucs-content-store-eu-west/content/pii:S1381116910004279/gr4/THUMBNAIL/image/gif/5d0f1d69f581eaf445a3505d53269cbd/gr4.sml gr4 gr4.sml sml 3416 119 219 IMAGE-THUMBNAIL 1-s2.0-S1381116910004279-gr3.sml https://s3.amazonaws.com/prod-ucs-content-store-us-east/content/pii:S1381116910004279/gr3/THUMBNAIL/image/gif/651d377067310cd1d15a57eb3569e22c/gr3.sml https://s3-eu-west-1.amazonaws.com/prod-ucs-content-store-eu-west/content/pii:S1381116910004279/gr3/THUMBNAIL/image/gif/651d377067310cd1d15a57eb3569e22c/gr3.sml gr3 gr3.sml sml 3903 124 219 IMAGE-THUMBNAIL 1-s2.0-S1381116910004279-gr2.sml https://s3.amazonaws.com/prod-ucs-content-store-us-east/content/pii:S1381116910004279/gr2/THUMBNAIL/image/gif/41ed2469aa4b7e4b53920dabb2513848/gr2.sml https://s3-eu-west-1.amazonaws.com/prod-ucs-content-store-eu-west/content/pii:S1381116910004279/gr2/THUMBNAIL/image/gif/41ed2469aa4b7e4b53920dabb2513848/gr2.sml gr2 gr2.sml sml 2469 148 219 IMAGE-THUMBNAIL 1-s2.0-S1381116910004279-gr1.sml https://s3.amazonaws.com/prod-ucs-content-store-us-east/content/pii:S1381116910004279/gr1/THUMBNAIL/image/gif/eeabf4e457e084ea029c74e6d3027236/gr1.sml https://s3-eu-west-1.amazonaws.com/prod-ucs-content-store-eu-west/content/pii:S1381116910004279/gr1/THUMBNAIL/image/gif/eeabf4e457e084ea029c74e6d3027236/gr1.sml gr1 gr1.sml sml 7316 98 219 IMAGE-THUMBNAIL 1-s2.0-S1381116910004279-fx1.sml https://s3.amazonaws.com/prod-ucs-content-store-us-east/content/pii:S1381116910004279/fx1/THUMBNAIL/image/gif/9ad6aa08a05743c11d2a41613e3de0a3/fx1.sml https://s3-eu-west-1.amazonaws.com/prod-ucs-content-store-eu-west/content/pii:S1381116910004279/fx1/THUMBNAIL/image/gif/9ad6aa08a05743c11d2a41613e3de0a3/fx1.sml fx1 true fx1.sml sml 7241 97 219 IMAGE-THUMBNAIL MOLCAA 7964 S1381-1169(10)00427-9 10.1016/j.molcata.2010.10.015 Elsevier B.V. Fig. 1 Preparation of clay nanocomposite catalyst 6. Fig. 2 XRD patterns of (a) Na+–MMT clay, (b) catalyst 6. Fig. 3 IR spectrum of catalyst 5. Fig. 4 IR spectrum of catalyst 6. Fig. 5 Recycling studies for Mizoroki–Heck reaction of iodobenzene and t-butyl acrylate. Fig. 6 Recycling studies for Sonogashira reaction of 4-iodoacetophenone and 3-ethynylbenzene. Fig. 7 Kinetic curves of Mizoroki–Heck reaction of iodobenzene and t-butyl acrylate. Fig. 8 Kinetic curves of Sonogashira reaction of 4-iodoacetophenone and 3-ethynylbenzene. Scheme 1 Synthetic route for the preparation of ammonium tagged oxime carbapalladacycle 5. Scheme 2 Mizoroki–Heck reaction using catalysts 5 and 6. Scheme 3 Sonogashira reaction using catalysts 5 and 6. Table 1 Physico-chemical characterization of Na+-MMT clay and clay nanocomposite 6. Sample Basal spacing (Å) Multipoint BET surface area (m2/g) Pore volume (cm3/g) Elemental analysis (AAS) Na+-MMT clay 11.86 11.89 0.0253 – Catalyst 6 12.49 19.83 0.0566 Pd: 1.178mmol/g Table 2 Optimized results of Mizoroki–Heck reaction of variously substituted iodobenzenes with t-butyl acrylate at 80°C using catalyst 5 and 6 in [TMBA] NTf2. S.No. Haloarene Catalyst Time (h) Yield a (%) TON TOF (h−1) 1 Iodobenzene 5 3 94 18,800 6,266 6 3 95 19,000 6,333 2 4-Iodoanisole 5 12 92 18,400 1,533 6 12 92 18,400 1,533 3 4-Iodotoluene 5 12 87 17,400 1,450 6 12 89 17,800 1,483 4 1-Iodo-3-nitrobenzene 5 3 96 19,200 6,400 6 3 96 19,200 6,400 5 4-Iodo-acetophenone 5 3 97 19,400 6,466 6 3 98 19,600 6,533 a Isolated yield. Table 3 Optimized results for Sonogashira of various haloarenes with aryl acetylenes at 80°C using catalyst 5 and 6 in [TMBA] NTf2. S.No. Haloarene Substituted acetylenes Catalyst Time (h) Yield a (%) TON TOF (h−1) 1 Iodobenzene 1-Phenylacetylene 5 12 90 1914 159 6 12 92 1957 163 2 Iodobenzene 3-Ethynylaniline 5 12 94 2000 166 6 12 95 2021 168 3 4-Iodo-acetophenone 1-Phenylacetylene 5 12 94 2000 166 6 12 94 2000 166 4 4-Iodo-acetophenone 3-Ethynylaniline 5 12 96 2042 170 6 12 97 2063 171 5 4-Iodotoluene 3-Ethynylaniline 5 15 88 1872 124 6 15 90 1914 127 6 4-Iodoanisole 3-Ethynylaniline 5 15 90 1914 127 6 15 90 1914 127 7 1-Iodo-3-nitrobenzene 3-Ethynylaniline 5 12 97 2063 171 6 12 99 2106 175 8 1-Iodo-3-nitrobenzene 3-Chloro-1-ethynylbenzene 5 12 90 1914 159 6 12 93 1978 164 9 1-Bromo-4-nitrobenzene 3-Ethynylaniline 5 24 80 1702 70 6 24 82 1744 72 a Isolated yield. Synthesis and characterization of recyclable and recoverable MMT-clay exchanged ammonium tagged carbapalladacycle catalyst for Mizoroki–Heck and Sonogashira reactions in ionic liquid media Vasundhara Singh ⁎ Rajni Ratti Sukhbir Kaur Department of Applied Sciences, PEC University of Technology, Chandigarh 160012, India ⁎ Corresponding author. Tel.: +91 172 2753263. Graphical abstract Research highlights ▶ An ammonium tagged carbapalladacycle has been synthesized in good overall yield and is well characterized. ▶ An organic–inorganic hybrid system has been synthesized by intercalating the synthesized carbapalladacycle in between the layers of Na+-MMT clay. ▶ The ammonium tag facilitates the intercalation of carbapalladacycle by increasing organophilicity of clay. ▶ The prepared carbapalladacycle and its clay-nanocomposite have been efficiently used as recyclable catalytic system in ionic liquid media for carrying out Mizoroki–Heck and Sonogashira reactions with high TONs/TOFs. ▶ The catalytically inert ammonium tag does not interfere in the reaction, instead being ionophilic it enhances the immobilization of carbapalladacycle in ionic liquid medium. An efficient synthesis of an ammonium tagged carbapalladacycle 5, in modest yield, has been achieved. Further, the clay-nanocomposite 6 was prepared by ion exchange of 5 into clay interlayers as a new organic–inorganic hybrid catalytic system. The ionic tag of the ammonium supported carbapalladacycle 5 assists in the pillaring process and enhances the organophilicity of catalyst 6 in the interlayers of clay. The catalytic activity in ammonium based ionic liquid [TMBA] NTf2 of both the homogeneous and heterogeneous recyclable catalysts 5 and 6 respectively in micromolar concentration of palladium has been tested for Mizoroki–Heck and Sonogashira reactions in good yields with high TON/TOF and negligible metal leaching. Effect of solvent and temperature on the catalytic activity has also been examined. Keywords Carbapalladacycle MMT-clay Organic–inorganic hybrid materials Mizoroki–Heck Sonogashira 1 Introduction Development of recoverable and recyclable catalysts for industrial applications has become important from both environmental and economical point of view and has been well reviewed in literature [1]. To achieve this objective several catalysts are anchored or immobilized onto polymeric and inorganic supports [2,3]. Despite the advantages and the progress, homogeneous catalysis has a share of less than 20% in industrial processes because of the issues related to recoverability and recyclability of expensive metal catalysts. In contrast, heterogeneous catalysis exhibits the advantage of easy separation of the catalyst from the products and can be easily adapted to continuous flow processes [4,5]. However, heterogeneous catalysis lacks complete characterization, mechanistic details regarding factors affecting activity and selectivity. Hence, there is a need to synthesize homogeneous–heterogeneous catalysts to overcome the drawbacks of each system and to combine the advantages of both [6]. Successful methods include immobilizing or supporting the active homogeneous catalysts onto various inorganic supports such as zeolites, mesoporous materials, alumina, silica, clays and high surface carbons [7–9] which assists in controlling reactivity, selectivity besides the advantage of easy workability. Palladium catalyzed C–C and C–heteroatom bond forming reactions are firmly positioned as one of the most important tools in organic synthesis [10]. During the last decade very active systems have been developed in order to improve the stability and efficiency of palladium based catalysts [11]. Carbometallated PdII complexes, particularly palladacycles have emerged as promising catalysts for various cross-coupling reactions [12]. Of these the potential of oxime derived palladacycles as catalyst precursors for important carbon–carbon coupling reactions has been well explored [13]. The highlighting features of these palladacycles are their extraordinary thermal stability, insensitivity to air or moisture, ready and economic synthetic access and modulation of electronic and steric properties by simple variations in structure. Several dimeric chloro-bridged palladacycles derived from a wide variety of aromatic and aliphatic oximes from benzaldehyde, acetophenone and benzophenone, pinacolone and acetylferrocene have been reported and their catalytic activity checked in different cross-coupling processes [14,15]. Previously, numbers of attempts have been made to immobilize the active oxime carbapalladacycle onto to various supports like silica [16], polystyrene [17], MCM-41, polystyrene–divinylbenzene [18], periodic mesoporous organosilica (PMO) [19], alumina [20] and recently Kaiser resin [21] in an effort to develop supported Pd–ligand complexes thereby enhancing the recyclability of ligand and reducing the metal leaching considerably. Lately, reports of the use of ionic supported catalysts immobilized in ionic liquids as efficient recyclable catalysts have appeared in literature [22]. The ionic support enhances the interaction and immobilization of the tagged moiety in the ionic media resulting in high turn over numbers, frequencies with negligible metal leaching and has been recently reviewed in literature [23]. Montmorillonite clay having a layered 2:1 structure, high cation exchange capacity can be chemically modified by immobilization involving a simple ion exchange of organic and inorganic moieties which can be fine tuned as per industrial requirements and are being considered as potentially cost effective and environmentally benign nano-materials for the future [24,25], especially with amines or quaternary ammonium salts which provides a simple method for the preparation of organic–inorganic hybrid materials. Recently, Kim et al. have reported the preparation of cationic nanoclays by immobilizing ionic liquids as a modifier in the interlayers of clays [26]. A supported ionic-liquid film (SILF) of nanometric thickness containing bis (oxazoline)–copper complexes in clay has been used as recoverable catalysts for enantioselective cyclopropanation reaction [27]. Tao et al. prepared palladium-sepiolite catalysts by immobilizing Pd2+ on sepiolite using ionic liquid and used them as efficient catalysts for hydrogenation of alkenes and Heck reaction [28]. Previously, oxime carbapalladacycle with an ionophilic imidazolium tag and its heterogenisation with Al/MCM-41 was described by Corma et al. [20] which showed unsatisfactory results for both Mizoroki–Heck and Suzuki couplings due to the specific nature of the imidazolium tag. In continuation to our program involving development of robust recyclable and recoverable catalysts [29–31], we hereby present our work which involves designing the Najera's oxime carbapalladacycle by the introduction of an inert ammonium tag to the main structure, making its immobilization into the ammonium based ionic liquid-phase facile thus creating a homogeneous supported catalytic system. Further, for the heterogenization of active catalytic species, the ammonium tagged carbapalladacycle 5 has also been supported on to inexpensive and readily available Na+-MMT clay by ion-exchange method to create an organic–inorganic hybrid catalytic system 6. The catalytic activities of both in homogenous and heterogeneous phase have been studied for Mizoroki–Heck and Sonogashira reactions. 2 Experimental 2.1 Synthesis of ammonium tagged carbapalladacycle catalyst 5 The synthetic route adopted to prepare ammonium tagged carbapalladacycle is as shown in Scheme 1 . 4-Hydroxyacetophenone was treated with hydroxylamine hydrochloride to obtain the corresponding oxime 2 as a white solid which on reaction with 1,5-dibromopentane gave compound 3. Carbapalladation of compound 3 with sodium tetrachloropalladate at room temperature gave 4 as a green solid. The NMR, IR, mass spectroscopic data of compound 4 is in agreement with that reported in literature [20]. The ammonium pendant was then appended to compound 4 using five fold excess of trimethylamine in THF at 50°C for 36h, resulting in the formation of compound 5 as a greenish powder (overall yield 20%). IR (KBr, cm−1): 3443.2, 3183.7, 3023.8, 2939.3, 2862.4, 1635.0, 1578.8, 1559.5, 1456.3, 1376.3, 1334.0, 1263.0, 1206.8, 1097.8, 1034.7, 963.0, 907.8, 804.0, 737.9, 638.0, 603.2, 522.8. 1H NMR (400MHz, DMSO): δ ppm: 7.19 (m, 1H), 7.07 (d, 1H, J =7.76Hz), 6.55 (d, 1H, J =6.48Hz), 3.95 (t, 2H), 3.34 (s, 2H), 3.05 (s, 9H), 2.15 (s, 3H), 1.75 (4H, s),1.42 (s, 2H); 13C NMR (400Mz, DMSO): δ ppm: 162.9, 157.0, 153.6, 137.7, 129.0, 120.3, 109.5, 63.4, 53.5, 31.0, 28.4, 22.9, 22.4, 11.3. MS ESI+: Isotopic distribution for M+-C16H38N2 compatible with 2 Pd and 2 Cl (%): m/z 587.2 (0.453), 587.7 (0.997), 588.2 (1.722), 588.7 (3.241), 589.2 (4.827), 589.7 (6.27), 590.2 (7.728), 590.7 (8.612), 591.2 (8.97), 591.7 (7.88), 592.2 (8.27), 592.7 (5.417), 593.2 (5.66), 593.7 (3.059), 594.2 (2.629), 594.7 (1.337), 595.2 (1.110), 595.7 (0.725). 2.2 Preparation of clay nanocomposite catalyst 6 The complex 5 is intercalated into the clay interlayers to obtain a heterogeneous catalyst as shown in Fig. 1 . To the suspension of the complex 5 (100.8mg, 0.12mmol) in CH2Cl2 (15ml) was added Na+-MMT clay (100mg) in small portions with vigorous stirring at room temperature and continued for 48h. The resulting suspension was filtered and the solid was exhaustively soxhlet-extracted with dichloromethane (4×10ml) to remove excess complex. The resulting product was dried under vacuum to get the clay nanocomposite 6, as a free flowing powder. 2.3 Catalyst characterization Palladium content of 5 as determined by AAS was found to be 2.39mmol/g. The carbon, nitrogen and hydrogen content determined by elemental analysis is 32.78, 4.329 and 4.404% respectively. The unmodified Na+–MMT clay and catalyst 6 were characterized by using XRD, IR, BET and TGA analysis to determine the structure, surface area and thermal stability respectively. The powder XRD patterns of Na+–MMT clay and catalyst 6 are presented in Fig. 2 . The characteristic peak at 7.44° corresponds to d 001 spacing of 11.86Å in case of Na+–MMT clay. Similarly, the peak at 7.07° corresponds to a d 001 spacing of 12.49Å in case of catalyst 6 indicating expansion of the interlayers due to exchange of smaller Na+ ions with the bulkier carbapalladacycle cation. The IR spectra of oxime 2 shows a characteristic CN stretching vibration of 1675cm−1 and the corresponding CN vibration in 4 was shifted to 1635cm−1 indicating N–Pd coordination (Fig. 3 ). Further, the presence of a band at 1636.5cm−1 in the IR spectrum of catalyst 6, as shown in Fig. 4 , confirms the successful intercalation of catalyst 5 in the clay interlayers. The nitrogen adsorption–desorption isotherms of MMT and catalyst 6 at 77K were evaluated using an adsorption analyzer. The BET surface area and micropore volume increased from 11.89 to 14.37m2/g and 0.0253 to 0.0566cm3/g for MMT clay and catalyst 6 respectively as given in Table 1 , which further supports the intercalation process. TGA analysis of catalyst 5 and 6 showed that catalyst 5 was thermally stable up to 450°C after which it degraded rapidly while catalyst 6 showed thermal stability up to 700°C which is probably because the ionic liquid is sandwiched in the layers of MMT clay in catalyst 6. In each case, the specimens were heated from 50 to 750°C at the rate of 10°C/min under nitrogen flow. 2.4 Methods and materials 1H NMR was recorded in CDCl3 on a 400MHz Bruker instrument using TMS as the internal standard. IR spectra were recorded on a Bio-Rad-Win-IR spectrometer. Na+-montmorillonite clay (Na+–MMT) with cation exchange capacity of 120meq/100g clay, was provided by Kunimine Co. Ltd., Japan. XRD analysis was done using Rigaku D-Max IIIC using Ni-filtered Cu-Ka radiation. BET surface area and pore volume were determined using micromeritics autosorb automated gas sorption system. TGA analysis was carried out using TGA Mettler Toledo system. AAS was determined by GBC Avanta instrument. Elemental analysis was carried out using Analytischer Funktiontest vario EL II. GC–MS had been recorded on a Fisons “GC 8000” with integrated MS “MD 800” [TMBA] NTf2 [(trimethylbutylammonium bis(trifluoromethylsulfonyl)imide] was prepared by quaternization of trimethylamine with butyl chloride followed by anion exchange with LiNTf2 [32]. 2.5 Typical experimental procedure for Mizoroki–Heck reaction with catalysts 5 and 6 Catalyst 5 (0.1mg, 0.005mol% Pd)/catalyst 6 (0.2mg, 0.005mol% Pd) was dissolved in [TMBA] NTf2 (0.5ml) taken in a 25ml round bottom flask. To this were added iodobenzene (816mg, 4.0 mmol), t-butyl acrylate (512mg, 4.0mmol), triethylamine (606mg, 6.0mmol). The mixture was magnetically stirred in a pre-heated oil bath at 80°C for 3h. The solution was allowed to cool, extracted with diethyl ether (5×5ml) and the ethereal phase was concentrated, purified by column chromatography and analyzed by GC–MS and 1H NMR. The catalyst was recycled seven times with negligible loss of activity. 2.5.1 (E)-tert-Butyl-cinnamate 1H NMR (400MHz, CDCl3): δ ppm: 7.56–7.60 (d, 1H, J =15.9Hz), 7.49–7.52 (m, 2H), 7.36–7.38 (m, 3H), 6.35–6.39 (d, 1H, J =15.9Hz), 1.55 (s, 9H). 2.6 Typical experimental procedure for Sonogashira reaction with catalyst 5 and 6 Catalyst 5 (0.1mg, 0.047mol% Pd)/catalyst 6 (0.2mg, 0.047mol% Pd) was dissolved in [TMBA] NTf2 (0.5ml) taken in a 10ml round bottom flask and 4-iodoacetophenone (123mg, 0.5mmol), 3-ethynylbenzene (58mg, 0.5mmol), triethylamine (75mg, 0.742mmol) were added. The mixture was magnetically stirred in a pre-heated oil bath at 80°C for 12h. The solution was allowed to cool, extracted with diethyl ether (5×5ml) and the ethereal phase was dried over Na2SO4, filtered, concentrated and purified by chromatography using hexane–ethyl acetate (8:2) to elute the desired coupling product which was analyzed by GC–MS and 1H NMR. The catalyst was recycled seven times without any loss of activity. 2.6.1 1,2-Diphenyl ethyne 1H NMR (400MHz, CDCl3): δ ppm: 7.48–7.42 (m, 4H), 7.34–7.27 (m, 6H). 2.7 Leaching tests Leaching of catalytically active species was tested by allowing the reaction to proceeded to less than 50% conversion. The product was extracted with diethyl ether and this extracted product was allowed to react for addition 48h which was then analyzed by NMR spectroscopy for any further progress of reaction. 2.8 Recovery and reuse of catalyst 6 The recovery and reuse of catalyst was done on running a bigger batch using 4.0–8.0mmol of the reactants in a typical reaction procedure and vacuum filtered while hot. The remaining solid catalyst 6 was washed with dichloromethane (30ml per 10mg of the solid) and was dried for 1h under reduced pressure. The dry solid was weighed and reused in next run by adding proportional amounts of reactants. 3 Results and discussion The synthetic route followed as shown in Scheme 1 resulted in moderate yield of the catalyst 5. The formation of palladium–carbon bond in compound 4 has been confirmed by change in number and pattern of aromatic protons from A2B2 to ABM. Moreover, the shift in position of band at 1675cm−1 in case of 3 assigned for CN stretching to 1635cm−1 further confirmed the formation of the palladacycle. The simplest carbapalladacycle has been reported to be a dimeric species because of the tendency of palladium to form tetra coordinated complexes. In our case also the molecular ion clusters arising from natural isotopic distribution of palladium and chlorine suggests the formation of a dimeric species as inferred from the mass spectrum. On quarternization of trimethylamine with compound 4 gave the ammonium tagged carbapalladacycle 5 wherein the presence of the ammonium tag was confirmed by NMR (δ ppm: 3.05, s, 9H; 3.95, t, 2H) and mass spectral analysis. The mass spectral analysis of 5 showed a molecular ion clusters in consistence with the presence of dimeric species which is contrary to the monomeric oxime carbapalladacycle with an ionophilic imidazolium tag as described by Corma et al. [20]. The intercalation of complex 5 into clay interlayers by ion exchange resulted in the formation of heterogeneous catalyst 6. As expected, on intercalation the d 001 interlayer spacing showed an increase from 11.86Å to 12.49Å and the BET surface area increased from 11.89m2/g to 19.83m2/g as shown in Table 1. The IR spectra of catalyst 6 showed the peaks characteristic of palladacycle thus confirming the exchange of cationic catalyst 5. The extent of exchange of 5 in clay was determined by the palladium content as determined by AAS and found to be 1.0meq/1g of clay. TGA analysis showed the thermal stability of 5 and 6 up to a temperature of 450°C and 750°C respectively. Complex 5 in homogenous phase and 6 in homogenous–heterogeneous phase were checked for their catalytic activity in Heck and Sonogashira couplings using [TMBA] NTf2 as solvent. The immobilization of catalyst 5 and 6 in [TMBA] NTf2 ionic liquid was confirmed by repeated extraction using diethyl ether with negligible presence of both the catalysts in the ethereal phase. Mizoroki–Heck and Sonogashira reaction, as shown in Schemes 2 and 3 , were carried out under optimized conditions in ionic liquid media resulting in excellent yield and conversion with high TON and TOF of the desired products as confirmed by NMR and GC–MS analysis. The optimization of reaction conditions was done by varying the reaction temperature and catalyst loading. The reaction proceeds at micromolar concentration of palladium at lower temperature of 80°C. Significantly, the Sonogashira reaction gave good results without the use of copper (I) salts as co-catalyst as compared to previous reports [33]. Alonso et al. carried out Sonogashira reaction catalyzed by untagged oxime carbapalladacycle using 0.1–0.5mol% of catalyst at a higher temperature of 110 οC with no recyclability reports of catalyst [34]. Contrary to this, the ammonium tagged carbapalladacycle 5 and 6 are recyclable and required in a comparatively smaller amount of 0.047mol% giving good conversions at 80°C. GC–MS analysis indicated the absence of Glaser type homocoupling products. Further both reactions were studied on various substrates containing electron releasing and electron withdrawing groups to examine the versatility of the catalyst 5 and 6. The results are summarized in Tables 2 and 3 . The analysis of the results in Tables 2 and 3 showed that the coupling of deactivated electron-rich haloarenes took longer hours while the reactions with activated electron poor iodoarenes were accomplished in lesser time duration. High yields and excellent TONs and TOFs were achieved in all the cases. For recycling studies, the typical reactions as discussed in Sections 2.5 and 2.6, were carried out under optimized conditions. After every cycle the catalytic system remains as a clear solution though there is an increase in viscosity due to the formation of a quaternary ammonium salt by reaction of triethylamine and the haloarene. Negligible loss of activity of catalysts 5 and 6 was noticed even after seven cycles for both Mizoroki–Heck and Sonogashira reaction. The results for the recycling studies are as shown in Figs. 5 and 6 . No precipitation of palladium black was observed in both reactions indicating the stability of the catalyst 5 in ionic liquid media and catalyst 6 due to immobilization in the interlayers of clays and in ionic liquid media. Recoverability of the heterogeneous catalytic system 6 has been measured by the “Quantitative” catalyst recovered after each cycle. Kinetics of both the reactions was also studied using catalyst 5 and 6 under optimized conditions. The results are as shown in Figs. 7 and 8 . The hot filtration test performed to ensure that the activity is actually because of the heterogenized palladacycle or due to the soluble palladium leached out from the supported catalyst suggested that there is negligible leaching of catalytically active species which indicates a heterogeneous catalysis operational in case of catalyst 6 as the filtered solution did not exhibit any further reactivity. Good results were obtained for Sonogashira at room temperature also though longer reaction time of 24h is required for complete conversion. Typical Mizoroki–Heck and Sonogashira reaction were also carried in toluene and water as reaction media which gave products in satisfactory yield, however, there were problems related to recoverability and formation of palladium black in toluene. 4 Conclusion In summary, catalyst 5 with enhanced ionophilicity has been synthesized by anchoring it to a catalytically inert ammonium tag which assists in improving the solubility of carbapalladacycle in ionic liquid media and reduces the palladium leaching. The ammonium tag facilitates the heterogenisation of catalyst 5 into the layers of montmorillonite clay resulting in the formation of an organic-inorganic hybrid catalyst 6. Micromolar concentrations of recyclable 5 and recyclable and recoverable catalyst 6 efficiently promote the Mizoroki–Heck and Sonogashira couplings both in homogeneous as well as heterogeneous forms. In particular, Sonogashira reaction was performed under copper free condition with no cross coupling side products. Acknowledgements The authors (RR and SK) are thankful to IFCPAR (3405-2), New Delhi for fellowship and financial support, RIL (R&D), Vadodara and RSIC, Chandigarh for the analytical data. References [1] J.A. Gladysz Pure Appl. Chem. 73 2001 1319 1324 [2] C.E. Song S.G. Lee Chem. Rev. 102 2002 3495 3524 [3] T.J. Dickerson N.N. Reed K.D. Janda Chem. Rev. 102 2002 3325 3344 [4] C. Wiles P. Watts Eur. J. Org. Chem. 2008 1655 1671 [5] G.J. Hutchings J. Mater. Chem. 19 2009 1222 1235 [6] A. Corma H. Garcia Top. Catal. 48 2008 8 31 [7] V. Polshettiwar A. Molnar Tetrahedron 63 2007 6949 6976 [8] A.P. Wight M.E. Davis Chem. Rev. 102 2002 3589 3614 [9] B. Desai C.O. Kappe Top. Curr. Chem. 241 2004 177 208 [10] X. Chen K.M. Engle D-Hui Wang J-Quan Yu Angew. Chemie. Int. Ed. 48 2009 5094 5115 [11] J. Tsuji Palladium Reagents and Catalysts 2004 Wiley Chichester [12] J. Dupont C.S. Consorti J. Spencer Chem. Rev. 105 2005 2527 2572 [13] E. Alacid D.A. Alonso L. Botella C. Najera M.C. Pacheco Chem. Rec. 6 2006 117 132 [14] E. Alacid C. Nájera J. Org. Chem. 73 2008 2315 2322 [15] E. Alacid C. Nájera Eur. J. Org. Chem. 2008 3102 3106 [16] C. Baleizao A. Corma H. Garcia A. Leyva Chem. Commun. 2003 606 607 [17] F.T. Luo C. Xue S.L. Ko Y.D. Shao C.J. Wu Y.M. Kuo Tetrahedron 61 2005 6040 6045 [18] C. Baleizao A. Corma H. Garcia A. Leyva J. Org. Chem. 69 2004 439 446 [19] A. Corma D. Das H. Garcia A. Leyva J. Catal. 229 2005 322 331 [20] A. Corma H. Garcia A. Leyva Tetrahedron 60 2004 8553 8560 [21] E. Alacid C. Najera J. Organomet. Chem. 694 2009 1658 1665 [22] N. Audic H. Clavier M. Maudit J.C. Guillemin J. Am. Chem. Soc. 125 2003 9248 9249 [23] R. Šebesta I. Kmentova S. Toma Green Chem. 10 2008 484 496 [24] R.S. Varma Tetrahedron 58 2002 1235 1255 [25] R.A. Schoonheydt Clay Clay Miner. 50 2002 411 420 [26] N.H. Kim S.V. Malhotra M. Xanthos Micropor. Mesopor. Mat. 96 2006 29 35 [27] M.R. Castillo L. Fousse J.M. Fraile J.I. García J.A. Mayoral Chem. Eur. J. 13 2007 287 291 [28] R. Tao S. Miao Z. Liu Y. Xie B. Han G. An K. Ding Green Chem. 11 2009 96 101 [29] V. Singh V. Sapehiyia G.L. Kad J. Mol. Catal. A: Chem. 210 2004 119 124 [30] V. Singh S. Kaur V. Sapehiyia J. Singh G.L. Kad Catal. Commun. 6 2005 57 60 [31] R. Ratti S. Kaur M. Vaultier V. Singh Catal. Commun. 11 2010 503 507 [32] C. Tiyapiboonchaiya D.R. Mac Farlane D.R. Sung M. Foreyth Macromol. Chem. Phys. 203 2002 1906 1911 [33] E.M. Marza A.M. Segarra C. Claver E. Peris E. Fernandez Tetrahedron Lett. 44 2003 6595 6599 [34] D.A. Alonso C. Najera M.C. Pacheco Adv. Synth. Catal. 345 2003 1146 1158",
      "scopus-id": "78650516037",
      "coredata": {
        "eid": "1-s2.0-S1381116910004279",
        "dc:description": "An efficient synthesis of an ammonium tagged carbapalladacycle 5, in modest yield, has been achieved. Further, the clay-nanocomposite 6 was prepared by ion exchange of 5 into clay interlayers as a new organic–inorganic hybrid catalytic system. The ionic tag of the ammonium supported carbapalladacycle 5 assists in the pillaring process and enhances the organophilicity of catalyst 6 in the interlayers of clay. The catalytic activity in ammonium based ionic liquid [TMBA] NTf2 of both the homogeneous and heterogeneous recyclable catalysts 5 and 6 respectively in micromolar concentration of palladium has been tested for Mizoroki–Heck and Sonogashira reactions in good yields with high TON/TOF and negligible metal leaching. Effect of solvent and temperature on the catalytic activity has also been examined.",
        "openArchiveArticle": "false",
        "prism:coverDate": "2011-01-04",
        "openaccessUserLicense": null,
        "prism:aggregationType": "Journal",
        "prism:url": "https://api.elsevier.com/content/article/pii/S1381116910004279",
        "dc:creator": [
          {
            "@_fa": "true",
            "$": "Singh, Vasundhara"
          },
          {
            "@_fa": "true",
            "$": "Ratti, Rajni"
          },
          {
            "@_fa": "true",
            "$": "Kaur, Sukhbir"
          }
        ],
        "link": [
          {
            "@_fa": "true",
            "@rel": "self",
            "@href": "https://api.elsevier.com/content/article/pii/S1381116910004279"
          },
          {
            "@_fa": "true",
            "@rel": "scidir",
            "@href": "https://www.sciencedirect.com/science/article/pii/S1381116910004279"
          }
        ],
        "dc:format": "application/json",
        "openaccessType": null,
        "pii": "S1381-1169(10)00427-9",
        "prism:volume": "334",
        "prism:publisher": "Elsevier B.V.",
        "dc:title": "Synthesis and characterization of recyclable and recoverable MMT-clay exchanged ammonium tagged carbapalladacycle catalyst for Mizoroki–Heck and Sonogashira reactions in ionic liquid media",
        "prism:copyright": "Copyright © 2010 Elsevier B.V. All rights reserved.",
        "openaccess": "0",
        "prism:issn": "13811169",
        "prism:issueIdentifier": "1-2",
        "dcterms:subject": [
          {
            "@_fa": "true",
            "$": "Carbapalladacycle"
          },
          {
            "@_fa": "true",
            "$": "MMT-clay"
          },
          {
            "@_fa": "true",
            "$": "Organic–inorganic hybrid materials"
          },
          {
            "@_fa": "true",
            "$": "Mizoroki–Heck"
          },
          {
            "@_fa": "true",
            "$": "Sonogashira"
          }
        ],
        "openaccessArticle": "false",
        "prism:publicationName": "Journal of Molecular Catalysis A: Chemical",
        "prism:number": "1-2",
        "openaccessSponsorType": null,
        "prism:pageRange": "13-19",
        "prism:endingPage": "19",
        "pubType": "fla",
        "prism:coverDisplayDate": "4 January 2011",
        "prism:doi": "10.1016/j.molcata.2010.10.015",
        "prism:startingPage": "13",
        "dc:identifier": "doi:10.1016/j.molcata.2010.10.015",
        "openaccessSponsorName": null
      },
      "objects": {
        "object": [
          {
            "@category": "high",
            "@height": "560",
            "@width": "2332",
            "@_fa": "true",
            "$": "https://api.elsevier.com/content/object/eid/1-s2.0-S1381116910004279-sc3_lrg.jpg?httpAccept=%2A%2F%2A",
            "@multimediatype": "JPEG image file",
            "@type": "IMAGE-HIGH-RES",
            "@size": "94607",
            "@ref": "sc3",
            "@mimetype": "image/jpeg"
          },
          {
            "@category": "high",
            "@height": "637",
            "@width": "2165",
            "@_fa": "true",
            "$": "https://api.elsevier.com/content/object/eid/1-s2.0-S1381116910004279-sc2_lrg.jpg?httpAccept=%2A%2F%2A",
            "@multimediatype": "JPEG image file",
            "@type": "IMAGE-HIGH-RES",
            "@size": "94275",
            "@ref": "sc2",
            "@mimetype": "image/jpeg"
          },
          {
            "@category": "high",
            "@height": "1065",
            "@width": "2975",
            "@_fa": "true",
            "$": "https://api.elsevier.com/content/object/eid/1-s2.0-S1381116910004279-sc1_lrg.jpg?httpAccept=%2A%2F%2A",
            "@multimediatype": "JPEG image file",
            "@type": "IMAGE-HIGH-RES",
            "@size": "198214",
            "@ref": "sc1",
            "@mimetype": "image/jpeg"
          },
          {
            "@category": "high",
            "@height": "938",
            "@width": "1164",
            "@_fa": "true",
            "$": "https://api.elsevier.com/content/object/eid/1-s2.0-S1381116910004279-gr8_lrg.jpg?httpAccept=%2A%2F%2A",
            "@multimediatype": "JPEG image file",
            "@type": "IMAGE-HIGH-RES",
            "@size": "108101",
            "@ref": "gr8",
            "@mimetype": "image/jpeg"
          },
          {
            "@category": "high",
            "@height": "972",
            "@width": "1177",
            "@_fa": "true",
            "$": "https://api.elsevier.com/content/object/eid/1-s2.0-S1381116910004279-gr7_lrg.jpg?httpAccept=%2A%2F%2A",
            "@multimediatype": "JPEG image file",
            "@type": "IMAGE-HIGH-RES",
            "@size": "96210",
            "@ref": "gr7",
            "@mimetype": "image/jpeg"
          },
          {
            "@category": "high",
            "@height": "895",
            "@width": "1445",
            "@_fa": "true",
            "$": "https://api.elsevier.com/content/object/eid/1-s2.0-S1381116910004279-gr6_lrg.jpg?httpAccept=%2A%2F%2A",
            "@multimediatype": "JPEG image file",
            "@type": "IMAGE-HIGH-RES",
            "@size": "118639",
            "@ref": "gr6",
            "@mimetype": "image/jpeg"
          },
          {
            "@category": "high",
            "@height": "806",
            "@width": "1181",
            "@_fa": "true",
            "$": "https://api.elsevier.com/content/object/eid/1-s2.0-S1381116910004279-gr5_lrg.jpg?httpAccept=%2A%2F%2A",
            "@multimediatype": "JPEG image file",
            "@type": "IMAGE-HIGH-RES",
            "@size": "110647",
            "@ref": "gr5",
            "@mimetype": "image/jpeg"
          },
          {
            "@category": "high",
            "@height": "1188",
            "@width": "2179",
            "@_fa": "true",
            "$": "https://api.elsevier.com/content/object/eid/1-s2.0-S1381116910004279-gr4_lrg.jpg?httpAccept=%2A%2F%2A",
            "@multimediatype": "JPEG image file",
            "@type": "IMAGE-HIGH-RES",
            "@size": "199402",
            "@ref": "gr4",
            "@mimetype": "image/jpeg"
          },
          {
            "@category": "high",
            "@height": "1244",
            "@width": "2200",
            "@_fa": "true",
            "$": "https://api.elsevier.com/content/object/eid/1-s2.0-S1381116910004279-gr3_lrg.jpg?httpAccept=%2A%2F%2A",
            "@multimediatype": "JPEG image file",
            "@type": "IMAGE-HIGH-RES",
            "@size": "191922",
            "@ref": "gr3",
            "@mimetype": "image/jpeg"
          },
          {
            "@category": "high",
            "@height": "1017",
            "@width": "1508",
            "@_fa": "true",
            "$": "https://api.elsevier.com/content/object/eid/1-s2.0-S1381116910004279-gr2_lrg.jpg?httpAccept=%2A%2F%2A",
            "@multimediatype": "JPEG image file",
            "@type": "IMAGE-HIGH-RES",
            "@size": "90744",
            "@ref": "gr2",
            "@mimetype": "image/jpeg"
          },
          {
            "@category": "high",
            "@height": "1087",
            "@width": "2437",
            "@_fa": "true",
            "$": "https://api.elsevier.com/content/object/eid/1-s2.0-S1381116910004279-gr1_lrg.jpg?httpAccept=%2A%2F%2A",
            "@multimediatype": "JPEG image file",
            "@type": "IMAGE-HIGH-RES",
            "@size": "405854",
            "@ref": "gr1",
            "@mimetype": "image/jpeg"
          },
          {
            "@category": "high",
            "@height": "438",
            "@width": "984",
            "@_fa": "true",
            "$": "https://api.elsevier.com/content/object/eid/1-s2.0-S1381116910004279-fx1_lrg.jpg?httpAccept=%2A%2F%2A",
            "@multimediatype": "JPEG image file",
            "@type": "IMAGE-HIGH-RES",
            "@size": "131700",
            "@ref": "fx1",
            "@mimetype": "image/jpeg"
          },
          {
            "@category": "standard",
            "@height": "127",
            "@width": "527",
            "@_fa": "true",
            "$": "https://api.elsevier.com/content/object/eid/1-s2.0-S1381116910004279-sc3.jpg?httpAccept=%2A%2F%2A",
            "@multimediatype": "JPEG image file",
            "@type": "IMAGE-DOWNSAMPLED",
            "@size": "9926",
            "@ref": "sc3",
            "@mimetype": "image/jpeg"
          },
          {
            "@category": "standard",
            "@height": "144",
            "@width": "489",
            "@_fa": "true",
            "$": "https://api.elsevier.com/content/object/eid/1-s2.0-S1381116910004279-sc2.jpg?httpAccept=%2A%2F%2A",
            "@multimediatype": "JPEG image file",
            "@type": "IMAGE-DOWNSAMPLED",
            "@size": "10096",
            "@ref": "sc2",
            "@mimetype": "image/jpeg"
          },
          {
            "@category": "standard",
            "@height": "241",
            "@width": "672",
            "@_fa": "true",
            "$": "https://api.elsevier.com/content/object/eid/1-s2.0-S1381116910004279-sc1.jpg?httpAccept=%2A%2F%2A",
            "@multimediatype": "JPEG image file",
            "@type": "IMAGE-DOWNSAMPLED",
            "@size": "22197",
            "@ref": "sc1",
            "@mimetype": "image/jpeg"
          },
          {
            "@category": "standard",
            "@height": "212",
            "@width": "263",
            "@_fa": "true",
            "$": "https://api.elsevier.com/content/object/eid/1-s2.0-S1381116910004279-gr8.jpg?httpAccept=%2A%2F%2A",
            "@multimediatype": "JPEG image file",
            "@type": "IMAGE-DOWNSAMPLED",
            "@size": "13744",
            "@ref": "gr8",
            "@mimetype": "image/jpeg"
          },
          {
            "@category": "standard",
            "@height": "220",
            "@width": "266",
            "@_fa": "true",
            "$": "https://api.elsevier.com/content/object/eid/1-s2.0-S1381116910004279-gr7.jpg?httpAccept=%2A%2F%2A",
            "@multimediatype": "JPEG image file",
            "@type": "IMAGE-DOWNSAMPLED",
            "@size": "12278",
            "@ref": "gr7",
            "@mimetype": "image/jpeg"
          },
          {
            "@category": "standard",
            "@height": "202",
            "@width": "326",
            "@_fa": "true",
            "$": "https://api.elsevier.com/content/object/eid/1-s2.0-S1381116910004279-gr6.jpg?httpAccept=%2A%2F%2A",
            "@multimediatype": "JPEG image file",
            "@type": "IMAGE-DOWNSAMPLED",
            "@size": "15628",
            "@ref": "gr6",
            "@mimetype": "image/jpeg"
          },
          {
            "@category": "standard",
            "@height": "182",
            "@width": "266",
            "@_fa": "true",
            "$": "https://api.elsevier.com/content/object/eid/1-s2.0-S1381116910004279-gr5.jpg?httpAccept=%2A%2F%2A",
            "@multimediatype": "JPEG image file",
            "@type": "IMAGE-DOWNSAMPLED",
            "@size": "13698",
            "@ref": "gr5",
            "@mimetype": "image/jpeg"
          },
          {
            "@category": "standard",
            "@height": "268",
            "@width": "492",
            "@_fa": "true",
            "$": "https://api.elsevier.com/content/object/eid/1-s2.0-S1381116910004279-gr4.jpg?httpAccept=%2A%2F%2A",
            "@multimediatype": "JPEG image file",
            "@type": "IMAGE-DOWNSAMPLED",
            "@size": "38142",
            "@ref": "gr4",
            "@mimetype": "image/jpeg"
          },
          {
            "@category": "standard",
            "@height": "281",
            "@width": "497",
            "@_fa": "true",
            "$": "https://api.elsevier.com/content/object/eid/1-s2.0-S1381116910004279-gr3.jpg?httpAccept=%2A%2F%2A",
            "@multimediatype": "JPEG image file",
            "@type": "IMAGE-DOWNSAMPLED",
            "@size": "38186",
            "@ref": "gr3",
            "@mimetype": "image/jpeg"
          },
          {
            "@category": "standard",
            "@height": "229",
            "@width": "340",
            "@_fa": "true",
            "$": "https://api.elsevier.com/content/object/eid/1-s2.0-S1381116910004279-gr2.jpg?httpAccept=%2A%2F%2A",
            "@multimediatype": "JPEG image file",
            "@type": "IMAGE-DOWNSAMPLED",
            "@size": "25102",
            "@ref": "gr2",
            "@mimetype": "image/jpeg"
          },
          {
            "@category": "standard",
            "@height": "245",
            "@width": "550",
            "@_fa": "true",
            "$": "https://api.elsevier.com/content/object/eid/1-s2.0-S1381116910004279-gr1.jpg?httpAccept=%2A%2F%2A",
            "@multimediatype": "JPEG image file",
            "@type": "IMAGE-DOWNSAMPLED",
            "@size": "58812",
            "@ref": "gr1",
            "@mimetype": "image/jpeg"
          },
          {
            "@category": "standard",
            "@height": "99",
            "@width": "222",
            "@_fa": "true",
            "$": "https://api.elsevier.com/content/object/eid/1-s2.0-S1381116910004279-fx1.jpg?httpAccept=%2A%2F%2A",
            "@multimediatype": "JPEG image file",
            "@type": "IMAGE-DOWNSAMPLED",
            "@size": "25501",
            "@ref": "fx1",
            "@mimetype": "image/jpeg"
          },
          {
            "@category": "thumbnail",
            "@height": "53",
            "@width": "219",
            "@_fa": "true",
            "$": "https://api.elsevier.com/content/object/eid/1-s2.0-S1381116910004279-sc3.sml?httpAccept=%2A%2F%2A",
            "@multimediatype": "GIF image file",
            "@type": "IMAGE-THUMBNAIL",
            "@size": "2045",
            "@ref": "sc3",
            "@mimetype": "image/gif"
          },
          {
            "@category": "thumbnail",
            "@height": "64",
            "@width": "219",
            "@_fa": "true",
            "$": "https://api.elsevier.com/content/object/eid/1-s2.0-S1381116910004279-sc2.sml?httpAccept=%2A%2F%2A",
            "@multimediatype": "GIF image file",
            "@type": "IMAGE-THUMBNAIL",
            "@size": "2189",
            "@ref": "sc2",
            "@mimetype": "image/gif"
          },
          {
            "@category": "thumbnail",
            "@height": "78",
            "@width": "219",
            "@_fa": "true",
            "$": "https://api.elsevier.com/content/object/eid/1-s2.0-S1381116910004279-sc1.sml?httpAccept=%2A%2F%2A",
            "@multimediatype": "GIF image file",
            "@type": "IMAGE-THUMBNAIL",
            "@size": "2556",
            "@ref": "sc1",
            "@mimetype": "image/gif"
          },
          {
            "@category": "thumbnail",
            "@height": "164",
            "@width": "203",
            "@_fa": "true",
            "$": "https://api.elsevier.com/content/object/eid/1-s2.0-S1381116910004279-gr8.sml?httpAccept=%2A%2F%2A",
            "@multimediatype": "GIF image file",
            "@type": "IMAGE-THUMBNAIL",
            "@size": "4542",
            "@ref": "gr8",
            "@mimetype": "image/gif"
          },
          {
            "@category": "thumbnail",
            "@height": "164",
            "@width": "198",
            "@_fa": "true",
            "$": "https://api.elsevier.com/content/object/eid/1-s2.0-S1381116910004279-gr7.sml?httpAccept=%2A%2F%2A",
            "@multimediatype": "GIF image file",
            "@type": "IMAGE-THUMBNAIL",
            "@size": "4134",
            "@ref": "gr7",
            "@mimetype": "image/gif"
          },
          {
            "@category": "thumbnail",
            "@height": "136",
            "@width": "219",
            "@_fa": "true",
            "$": "https://api.elsevier.com/content/object/eid/1-s2.0-S1381116910004279-gr6.sml?httpAccept=%2A%2F%2A",
            "@multimediatype": "GIF image file",
            "@type": "IMAGE-THUMBNAIL",
            "@size": "7756",
            "@ref": "gr6",
            "@mimetype": "image/gif"
          },
          {
            "@category": "thumbnail",
            "@height": "149",
            "@width": "219",
            "@_fa": "true",
            "$": "https://api.elsevier.com/content/object/eid/1-s2.0-S1381116910004279-gr5.sml?httpAccept=%2A%2F%2A",
            "@multimediatype": "GIF image file",
            "@type": "IMAGE-THUMBNAIL",
            "@size": "8518",
            "@ref": "gr5",
            "@mimetype": "image/gif"
          },
          {
            "@category": "thumbnail",
            "@height": "119",
            "@width": "219",
            "@_fa": "true",
            "$": "https://api.elsevier.com/content/object/eid/1-s2.0-S1381116910004279-gr4.sml?httpAccept=%2A%2F%2A",
            "@multimediatype": "GIF image file",
            "@type": "IMAGE-THUMBNAIL",
            "@size": "3416",
            "@ref": "gr4",
            "@mimetype": "image/gif"
          },
          {
            "@category": "thumbnail",
            "@height": "124",
            "@width": "219",
            "@_fa": "true",
            "$": "https://api.elsevier.com/content/object/eid/1-s2.0-S1381116910004279-gr3.sml?httpAccept=%2A%2F%2A",
            "@multimediatype": "GIF image file",
            "@type": "IMAGE-THUMBNAIL",
            "@size": "3903",
            "@ref": "gr3",
            "@mimetype": "image/gif"
          },
          {
            "@category": "thumbnail",
            "@height": "148",
            "@width": "219",
            "@_fa": "true",
            "$": "https://api.elsevier.com/content/object/eid/1-s2.0-S1381116910004279-gr2.sml?httpAccept=%2A%2F%2A",
            "@multimediatype": "GIF image file",
            "@type": "IMAGE-THUMBNAIL",
            "@size": "2469",
            "@ref": "gr2",
            "@mimetype": "image/gif"
          },
          {
            "@category": "thumbnail",
            "@height": "98",
            "@width": "219",
            "@_fa": "true",
            "$": "https://api.elsevier.com/content/object/eid/1-s2.0-S1381116910004279-gr1.sml?httpAccept=%2A%2F%2A",
            "@multimediatype": "GIF image file",
            "@type": "IMAGE-THUMBNAIL",
            "@size": "7316",
            "@ref": "gr1",
            "@mimetype": "image/gif"
          },
          {
            "@category": "thumbnail",
            "@height": "97",
            "@width": "219",
            "@_fa": "true",
            "$": "https://api.elsevier.com/content/object/eid/1-s2.0-S1381116910004279-fx1.sml?httpAccept=%2A%2F%2A",
            "@multimediatype": "GIF image file",
            "@type": "IMAGE-THUMBNAIL",
            "@size": "7241",
            "@ref": "fx1",
            "@mimetype": "image/gif"
          }
        ]
      },
      "link": {
        "@rel": "abstract",
        "@href": "https://api.elsevier.com/content/abstract/scopus_id/78650516037"
      }
    }
  }
}