{
  "metadata": {
    "title": "Synthesis and ring-opening metathesis polymerization of eight-membered unsaturated lactams and related monomers",
    "authors": "; ; ",
    "journal": "Journal of Molecular Catalysis A: Chemical",
    "date": "2002-12-02",
    "doi": "10.1016/S1381-1169(02)00222-4",
    "abstract": "",
    "uri": "https://api.elsevier.com/content/article/pii/S1381116902002224",
    "pii": "S1381116902002224"
  },
  "fulltext": {
    "full-text-retrieval-response": {
      "scopus-eid": "2-s2.0-0037010853",
      "originalText": "serial JL 271358 291210 291744 291790 291809 31 Journal of Molecular Catalysis A: Chemical JOURNALMOLECULARCATALYSISACHEMICAL 2002-06-07 2002-06-07 2010-04-18T17:18:08 1-s2.0-S1381116902002224 S1381-1169(02)00222-4 S1381116902002224 10.1016/S1381-1169(02)00222-4 S300 S300.1 FULL-TEXT 1-s2.0-S1381116900X01586 2015-05-15T05:56:33.301439-04:00 0 0 20021202 2002 2002-06-07T00:00:00Z articleinfo crossmark dco dateupdated tomb dateloaded datesearch indexeddate issuelist volumelist yearnav absattachment articletitlenorm authfirstinitialnorm authfirstsurnamenorm cid cids confeditor contenttype copyright dateloadedtxt docsubtype doctype doi eid ewtransactionid hubeid issfirst issn issnnorm itemstage itemtransactionid itemweight openaccess openarchive pg pgfirst pglast pii piinorm pubdatestart pubdatetxt pubyr sortorder srctitle srctitlenorm srctype subheadings vol volfirst volissue webpdf webpdfpagecount figure table body acknowledge affil articletitle auth authfirstini authfull authkeywords authlast footnotes primabst ref specialabst alllist content subj ssids 1381-1169 13811169 190 190 1 2 1 2 Volume 190, Issues 1–2 12 109 116 109 116 20021202 2 December 2002 2002-12-02 2002 15th. International Symposium on Olefin Metathesis and Related Chemistry J.-M. Basset converted-article fla Copyright © 2002 Elsevier Science B.V. All rights reserved. SYNTHESISRINGOPENINGMETATHESISPOLYMERIZATIONEIGHTMEMBEREDUNSATURATEDLACTAMSRELATEDMONOMERS BARAN J 1 Introduction 2 Experimental 2.1 Materials and methods 2.2 Synthesis of monomers 2.2.1 4-Cycloheptenone (4) 2.2.2 4-Cycloheptenone oxime (5) 2.2.3 4-Cycloheptenone oxime tosylate (6) 2.2.4 1-Aza-2-ketocyclooct-5-ene (7a) 2.2.5 1-Methyl-l-aza-2-ketocyclooct-5-ene (7b) 2.2.6 1-Ethyl-l-aza-2-ketocyclooct-5-ene (7c) 2.2.7 1-tert-Butoxycarbonyl-1-aza-2-ketocyclooct-5-ene (7d) 2.2.8 1-Trimethylsilyl-l-aza-2-ketocyclooct-5-ene (7e) 2.2.9 1-Benzyl-l-aza-2-ketocyclooct-5-ene (7f) 2.2.10 1-Benzyl-1-aza-4-cyclooctene (8) 2.3 Typical polymerization procedure 3 Results and discussion 3.1 Synthesis of monomers 3.2 Polymerization reactions 3.2.1 Reaction of 1-aza-2-ketocyclooct-5-ene (7a) 3.2.2 Reaction of N-protected amides and amines 3.3 Deprotection of the unsaturated polyamide derived from 7f 4 Summary Acknowledgements References SCHUSTER 1997 2036 2056 M FURSTNER 2000 3012 3043 A DEMONCEAU 1997 3127 3136 A DELAUDE 1999 2091 2103 L WESKAMP 1999 2416 2419 T BIELAWSKI 2000 2903 2906 C KANAOKA 1995 4707 4713 S FRASER 1995 7248 7255 C ROBSON 1999 6371 6373 D LYNN 2000 6601 6609 D PLETCHER 1980 643 660 T MORGAN 1977 1381 1390 P BERGER 1985 11 14 J DIAKOUMAKOS 1995 387 392 C SPILIOPOULOS 1996 2799 2807 I SCHWAB 1996 100 110 P SCHOLL 1999 953 956 M JAN 2000 55 64 D HERRMANN 1996 1627 1636 W JAFARPOUR 1999 3760 3763 L WILSON 1980 339 343 S MARSHALL 1982 693 698 J WILSON 1979 287 291 S CASIRAGHI 1992 3760 3763 G SMITH 1992 8008 8022 A ITO 1989 5767 5790 Y BARANX2002X109 BARANX2002X109X116 BARANX2002X109XJ BARANX2002X109X116XJ item S1381-1169(02)00222-4 S1381116902002224 1-s2.0-S1381116902002224 10.1016/S1381-1169(02)00222-4 271358 2010-10-03T19:47:00.746648-04:00 2002-12-02 1-s2.0-S1381116902002224-main.pdf https://s3.amazonaws.com/prod-ucs-content-store-us-east/content/pii:S1381116902002224/MAIN/application/pdf/1f62939ed21e2c6187375c9ec1f313fd/main.pdf https://s3-eu-west-1.amazonaws.com/prod-ucs-content-store-eu-west/content/pii:S1381116902002224/MAIN/application/pdf/1f62939ed21e2c6187375c9ec1f313fd/main.pdf main.pdf pdf true 112068 MAIN 8 1-s2.0-S1381116902002224-main_1.png https://s3.amazonaws.com/prod-ucs-content-store-us-east/content/pii:S1381116902002224/PREVIEW/image/png/ab0f5a6fb17c959e3283a5c0d558c5bc/main_1.png https://s3-eu-west-1.amazonaws.com/prod-ucs-content-store-eu-west/content/pii:S1381116902002224/PREVIEW/image/png/ab0f5a6fb17c959e3283a5c0d558c5bc/main_1.png main_1.png png 59877 849 656 IMAGE-WEB-PDF 1 1-s2.0-S1381116902002224-si9.gif https://s3.amazonaws.com/prod-ucs-content-store-us-east/content/pii:S1381116902002224/STRIPIN/image/gif/f5e3af9466b3a6889be4a563a36dff45/si6.gif https://s3-eu-west-1.amazonaws.com/prod-ucs-content-store-eu-west/content/pii:S1381116902002224/STRIPIN/image/gif/f5e3af9466b3a6889be4a563a36dff45/si6.gif si9 si9.gif gif 192 14 25 ALTIMG 1-s2.0-S1381116902002224-si8.gif https://s3.amazonaws.com/prod-ucs-content-store-us-east/content/pii:S1381116902002224/STRIPIN/image/gif/30a6913e1cd16c33450125f5f316712b/si16.gif https://s3-eu-west-1.amazonaws.com/prod-ucs-content-store-eu-west/content/pii:S1381116902002224/STRIPIN/image/gif/30a6913e1cd16c33450125f5f316712b/si16.gif si8 si8.gif gif 149 14 20 ALTIMG 1-s2.0-S1381116902002224-si7.gif https://s3.amazonaws.com/prod-ucs-content-store-us-east/content/pii:S1381116902002224/STRIPIN/image/gif/a1a0a721e85b2d7a4722f127bf8b7f0b/si7.gif https://s3-eu-west-1.amazonaws.com/prod-ucs-content-store-eu-west/content/pii:S1381116902002224/STRIPIN/image/gif/a1a0a721e85b2d7a4722f127bf8b7f0b/si7.gif si7 si7.gif gif 344 12 68 ALTIMG 1-s2.0-S1381116902002224-si6.gif https://s3.amazonaws.com/prod-ucs-content-store-us-east/content/pii:S1381116902002224/STRIPIN/image/gif/f5e3af9466b3a6889be4a563a36dff45/si6.gif https://s3-eu-west-1.amazonaws.com/prod-ucs-content-store-eu-west/content/pii:S1381116902002224/STRIPIN/image/gif/f5e3af9466b3a6889be4a563a36dff45/si6.gif si6 si6.gif gif 192 14 25 ALTIMG 1-s2.0-S1381116902002224-si5.gif https://s3.amazonaws.com/prod-ucs-content-store-us-east/content/pii:S1381116902002224/STRIPIN/image/gif/f5e3af9466b3a6889be4a563a36dff45/si6.gif https://s3-eu-west-1.amazonaws.com/prod-ucs-content-store-eu-west/content/pii:S1381116902002224/STRIPIN/image/gif/f5e3af9466b3a6889be4a563a36dff45/si6.gif si5 si5.gif gif 192 14 25 ALTIMG 1-s2.0-S1381116902002224-si4.gif https://s3.amazonaws.com/prod-ucs-content-store-us-east/content/pii:S1381116902002224/STRIPIN/image/gif/f5e3af9466b3a6889be4a563a36dff45/si6.gif https://s3-eu-west-1.amazonaws.com/prod-ucs-content-store-eu-west/content/pii:S1381116902002224/STRIPIN/image/gif/f5e3af9466b3a6889be4a563a36dff45/si6.gif si4 si4.gif gif 192 14 25 ALTIMG 1-s2.0-S1381116902002224-si3.gif https://s3.amazonaws.com/prod-ucs-content-store-us-east/content/pii:S1381116902002224/STRIPIN/image/gif/f5e3af9466b3a6889be4a563a36dff45/si6.gif https://s3-eu-west-1.amazonaws.com/prod-ucs-content-store-eu-west/content/pii:S1381116902002224/STRIPIN/image/gif/f5e3af9466b3a6889be4a563a36dff45/si6.gif si3 si3.gif gif 192 14 25 ALTIMG 1-s2.0-S1381116902002224-si23.gif https://s3.amazonaws.com/prod-ucs-content-store-us-east/content/pii:S1381116902002224/STRIPIN/image/gif/f5e3af9466b3a6889be4a563a36dff45/si6.gif https://s3-eu-west-1.amazonaws.com/prod-ucs-content-store-eu-west/content/pii:S1381116902002224/STRIPIN/image/gif/f5e3af9466b3a6889be4a563a36dff45/si6.gif si23 si23.gif gif 192 14 25 ALTIMG 1-s2.0-S1381116902002224-si22.gif https://s3.amazonaws.com/prod-ucs-content-store-us-east/content/pii:S1381116902002224/STRIPIN/image/gif/30a6913e1cd16c33450125f5f316712b/si16.gif https://s3-eu-west-1.amazonaws.com/prod-ucs-content-store-eu-west/content/pii:S1381116902002224/STRIPIN/image/gif/30a6913e1cd16c33450125f5f316712b/si16.gif si22 si22.gif gif 149 14 20 ALTIMG 1-s2.0-S1381116902002224-si21.gif https://s3.amazonaws.com/prod-ucs-content-store-us-east/content/pii:S1381116902002224/STRIPIN/image/gif/3308fc73ffabf4de0936fc138d407712/si21.gif https://s3-eu-west-1.amazonaws.com/prod-ucs-content-store-eu-west/content/pii:S1381116902002224/STRIPIN/image/gif/3308fc73ffabf4de0936fc138d407712/si21.gif si21 si21.gif gif 476 13 89 ALTIMG 1-s2.0-S1381116902002224-si20.gif https://s3.amazonaws.com/prod-ucs-content-store-us-east/content/pii:S1381116902002224/STRIPIN/image/gif/f5e3af9466b3a6889be4a563a36dff45/si6.gif https://s3-eu-west-1.amazonaws.com/prod-ucs-content-store-eu-west/content/pii:S1381116902002224/STRIPIN/image/gif/f5e3af9466b3a6889be4a563a36dff45/si6.gif si20 si20.gif gif 192 14 25 ALTIMG 1-s2.0-S1381116902002224-si2.gif https://s3.amazonaws.com/prod-ucs-content-store-us-east/content/pii:S1381116902002224/STRIPIN/image/gif/f5e3af9466b3a6889be4a563a36dff45/si6.gif https://s3-eu-west-1.amazonaws.com/prod-ucs-content-store-eu-west/content/pii:S1381116902002224/STRIPIN/image/gif/f5e3af9466b3a6889be4a563a36dff45/si6.gif si2 si2.gif gif 192 14 25 ALTIMG 1-s2.0-S1381116902002224-si19.gif https://s3.amazonaws.com/prod-ucs-content-store-us-east/content/pii:S1381116902002224/STRIPIN/image/gif/f5e3af9466b3a6889be4a563a36dff45/si6.gif https://s3-eu-west-1.amazonaws.com/prod-ucs-content-store-eu-west/content/pii:S1381116902002224/STRIPIN/image/gif/f5e3af9466b3a6889be4a563a36dff45/si6.gif si19 si19.gif gif 192 14 25 ALTIMG 1-s2.0-S1381116902002224-si18.gif https://s3.amazonaws.com/prod-ucs-content-store-us-east/content/pii:S1381116902002224/STRIPIN/image/gif/30a6913e1cd16c33450125f5f316712b/si16.gif https://s3-eu-west-1.amazonaws.com/prod-ucs-content-store-eu-west/content/pii:S1381116902002224/STRIPIN/image/gif/30a6913e1cd16c33450125f5f316712b/si16.gif si18 si18.gif gif 149 14 20 ALTIMG 1-s2.0-S1381116902002224-si17.gif https://s3.amazonaws.com/prod-ucs-content-store-us-east/content/pii:S1381116902002224/STRIPIN/image/gif/f5e3af9466b3a6889be4a563a36dff45/si6.gif https://s3-eu-west-1.amazonaws.com/prod-ucs-content-store-eu-west/content/pii:S1381116902002224/STRIPIN/image/gif/f5e3af9466b3a6889be4a563a36dff45/si6.gif si17 si17.gif gif 192 14 25 ALTIMG 1-s2.0-S1381116902002224-si16.gif https://s3.amazonaws.com/prod-ucs-content-store-us-east/content/pii:S1381116902002224/STRIPIN/image/gif/30a6913e1cd16c33450125f5f316712b/si16.gif https://s3-eu-west-1.amazonaws.com/prod-ucs-content-store-eu-west/content/pii:S1381116902002224/STRIPIN/image/gif/30a6913e1cd16c33450125f5f316712b/si16.gif si16 si16.gif gif 149 14 20 ALTIMG 1-s2.0-S1381116902002224-si15.gif https://s3.amazonaws.com/prod-ucs-content-store-us-east/content/pii:S1381116902002224/STRIPIN/image/gif/f5e3af9466b3a6889be4a563a36dff45/si6.gif https://s3-eu-west-1.amazonaws.com/prod-ucs-content-store-eu-west/content/pii:S1381116902002224/STRIPIN/image/gif/f5e3af9466b3a6889be4a563a36dff45/si6.gif si15 si15.gif gif 192 14 25 ALTIMG 1-s2.0-S1381116902002224-si14.gif https://s3.amazonaws.com/prod-ucs-content-store-us-east/content/pii:S1381116902002224/STRIPIN/image/gif/30a6913e1cd16c33450125f5f316712b/si16.gif https://s3-eu-west-1.amazonaws.com/prod-ucs-content-store-eu-west/content/pii:S1381116902002224/STRIPIN/image/gif/30a6913e1cd16c33450125f5f316712b/si16.gif si14 si14.gif gif 149 14 20 ALTIMG 1-s2.0-S1381116902002224-si13.gif https://s3.amazonaws.com/prod-ucs-content-store-us-east/content/pii:S1381116902002224/STRIPIN/image/gif/f5e3af9466b3a6889be4a563a36dff45/si6.gif https://s3-eu-west-1.amazonaws.com/prod-ucs-content-store-eu-west/content/pii:S1381116902002224/STRIPIN/image/gif/f5e3af9466b3a6889be4a563a36dff45/si6.gif si13 si13.gif gif 192 14 25 ALTIMG 1-s2.0-S1381116902002224-si12.gif https://s3.amazonaws.com/prod-ucs-content-store-us-east/content/pii:S1381116902002224/STRIPIN/image/gif/30a6913e1cd16c33450125f5f316712b/si16.gif https://s3-eu-west-1.amazonaws.com/prod-ucs-content-store-eu-west/content/pii:S1381116902002224/STRIPIN/image/gif/30a6913e1cd16c33450125f5f316712b/si16.gif si12 si12.gif gif 149 14 20 ALTIMG 1-s2.0-S1381116902002224-si11.gif https://s3.amazonaws.com/prod-ucs-content-store-us-east/content/pii:S1381116902002224/STRIPIN/image/gif/f5e3af9466b3a6889be4a563a36dff45/si6.gif https://s3-eu-west-1.amazonaws.com/prod-ucs-content-store-eu-west/content/pii:S1381116902002224/STRIPIN/image/gif/f5e3af9466b3a6889be4a563a36dff45/si6.gif si11 si11.gif gif 192 14 25 ALTIMG 1-s2.0-S1381116902002224-si10.gif https://s3.amazonaws.com/prod-ucs-content-store-us-east/content/pii:S1381116902002224/STRIPIN/image/gif/30a6913e1cd16c33450125f5f316712b/si16.gif https://s3-eu-west-1.amazonaws.com/prod-ucs-content-store-eu-west/content/pii:S1381116902002224/STRIPIN/image/gif/30a6913e1cd16c33450125f5f316712b/si16.gif si10 si10.gif gif 149 14 20 ALTIMG 1-s2.0-S1381116902002224-si1.gif https://s3.amazonaws.com/prod-ucs-content-store-us-east/content/pii:S1381116902002224/STRIPIN/image/gif/30a6913e1cd16c33450125f5f316712b/si16.gif https://s3-eu-west-1.amazonaws.com/prod-ucs-content-store-eu-west/content/pii:S1381116902002224/STRIPIN/image/gif/30a6913e1cd16c33450125f5f316712b/si16.gif si1 si1.gif gif 149 14 20 ALTIMG 1-s2.0-S1381116902002224-fx1.sml https://s3.amazonaws.com/prod-ucs-content-store-us-east/content/pii:S1381116902002224/fx1/THUMBNAIL/image/gif/3376a5ad931d3c6f3a8b3ea9709ee5a8/fx1.sml https://s3-eu-west-1.amazonaws.com/prod-ucs-content-store-eu-west/content/pii:S1381116902002224/fx1/THUMBNAIL/image/gif/3376a5ad931d3c6f3a8b3ea9709ee5a8/fx1.sml fx1 true fx1.sml sml 817 43 125 IMAGE-THUMBNAIL 1-s2.0-S1381116902002224-fx1.gif https://s3.amazonaws.com/prod-ucs-content-store-us-east/content/pii:S1381116902002224/fx1/DOWNSAMPLED/image/gif/37b05a892e761eb7b613a680bc37ca2b/fx1.gif https://s3-eu-west-1.amazonaws.com/prod-ucs-content-store-eu-west/content/pii:S1381116902002224/fx1/DOWNSAMPLED/image/gif/37b05a892e761eb7b613a680bc37ca2b/fx1.gif fx1 true fx1.gif gif 5758 170 497 IMAGE-DOWNSAMPLED 1-s2.0-S1381116902002224-fx2.sml https://s3.amazonaws.com/prod-ucs-content-store-us-east/content/pii:S1381116902002224/fx2/THUMBNAIL/image/gif/db9f3ddd014f5c7afaec19837d12e9d6/fx2.sml https://s3-eu-west-1.amazonaws.com/prod-ucs-content-store-eu-west/content/pii:S1381116902002224/fx2/THUMBNAIL/image/gif/db9f3ddd014f5c7afaec19837d12e9d6/fx2.sml fx2 fx2.sml sml 948 51 125 IMAGE-THUMBNAIL 1-s2.0-S1381116902002224-fx2.gif https://s3.amazonaws.com/prod-ucs-content-store-us-east/content/pii:S1381116902002224/fx2/DOWNSAMPLED/image/gif/b8214c6143d5377ed9ae9a7cfb2263c1/fx2.gif https://s3-eu-west-1.amazonaws.com/prod-ucs-content-store-eu-west/content/pii:S1381116902002224/fx2/DOWNSAMPLED/image/gif/b8214c6143d5377ed9ae9a7cfb2263c1/fx2.gif fx2 fx2.gif gif 3397 138 339 IMAGE-DOWNSAMPLED 1-s2.0-S1381116902002224-fx3.sml https://s3.amazonaws.com/prod-ucs-content-store-us-east/content/pii:S1381116902002224/fx3/THUMBNAIL/image/gif/c086aebadb761230f71fe9acd2f66242/fx3.sml https://s3-eu-west-1.amazonaws.com/prod-ucs-content-store-eu-west/content/pii:S1381116902002224/fx3/THUMBNAIL/image/gif/c086aebadb761230f71fe9acd2f66242/fx3.sml fx3 fx3.sml sml 1556 94 95 IMAGE-THUMBNAIL 1-s2.0-S1381116902002224-fx3.gif https://s3.amazonaws.com/prod-ucs-content-store-us-east/content/pii:S1381116902002224/fx3/DOWNSAMPLED/image/gif/35e577e67e7a65eac6270f2e557c2668/fx3.gif https://s3-eu-west-1.amazonaws.com/prod-ucs-content-store-eu-west/content/pii:S1381116902002224/fx3/DOWNSAMPLED/image/gif/35e577e67e7a65eac6270f2e557c2668/fx3.gif fx3 fx3.gif gif 2127 130 132 IMAGE-DOWNSAMPLED 1-s2.0-S1381116902002224-fx4.sml https://s3.amazonaws.com/prod-ucs-content-store-us-east/content/pii:S1381116902002224/fx4/THUMBNAIL/image/gif/3fcc587c53e0e6ef1e678e5c1aafc555/fx4.sml https://s3-eu-west-1.amazonaws.com/prod-ucs-content-store-eu-west/content/pii:S1381116902002224/fx4/THUMBNAIL/image/gif/3fcc587c53e0e6ef1e678e5c1aafc555/fx4.sml fx4 fx4.sml sml 901 63 125 IMAGE-THUMBNAIL 1-s2.0-S1381116902002224-fx4.gif https://s3.amazonaws.com/prod-ucs-content-store-us-east/content/pii:S1381116902002224/fx4/DOWNSAMPLED/image/gif/088d27fbafcd9e0fdeee9623b3fa1bbf/fx4.gif https://s3-eu-west-1.amazonaws.com/prod-ucs-content-store-eu-west/content/pii:S1381116902002224/fx4/DOWNSAMPLED/image/gif/088d27fbafcd9e0fdeee9623b3fa1bbf/fx4.gif fx4 fx4.gif gif 3750 172 339 IMAGE-DOWNSAMPLED 1-s2.0-S1381116902002224-sc1.sml https://s3.amazonaws.com/prod-ucs-content-store-us-east/content/pii:S1381116902002224/sc1/THUMBNAIL/image/gif/0cf2611dfe1fff0567b0bd6040e24949/sc1.sml https://s3-eu-west-1.amazonaws.com/prod-ucs-content-store-eu-west/content/pii:S1381116902002224/sc1/THUMBNAIL/image/gif/0cf2611dfe1fff0567b0bd6040e24949/sc1.sml sc1 sc1.sml sml 503 21 125 IMAGE-THUMBNAIL 1-s2.0-S1381116902002224-sc1.gif https://s3.amazonaws.com/prod-ucs-content-store-us-east/content/pii:S1381116902002224/sc1/DOWNSAMPLED/image/gif/65407b97b6e2c556d6e2db4ea8c365d6/sc1.gif https://s3-eu-west-1.amazonaws.com/prod-ucs-content-store-eu-west/content/pii:S1381116902002224/sc1/DOWNSAMPLED/image/gif/65407b97b6e2c556d6e2db4ea8c365d6/sc1.gif sc1 sc1.gif gif 4526 101 602 IMAGE-DOWNSAMPLED 1-s2.0-S1381116902002224-fx5.sml https://s3.amazonaws.com/prod-ucs-content-store-us-east/content/pii:S1381116902002224/fx5/THUMBNAIL/image/gif/cbf41d1aac647215f9c152ca29cfe2d0/fx5.sml https://s3-eu-west-1.amazonaws.com/prod-ucs-content-store-eu-west/content/pii:S1381116902002224/fx5/THUMBNAIL/image/gif/cbf41d1aac647215f9c152ca29cfe2d0/fx5.sml fx5 fx5.sml sml 957 36 125 IMAGE-THUMBNAIL 1-s2.0-S1381116902002224-fx5.gif https://s3.amazonaws.com/prod-ucs-content-store-us-east/content/pii:S1381116902002224/fx5/DOWNSAMPLED/image/gif/64f40aa221e5aebdb403ba4f2bfeb21f/fx5.gif https://s3-eu-west-1.amazonaws.com/prod-ucs-content-store-eu-west/content/pii:S1381116902002224/fx5/DOWNSAMPLED/image/gif/64f40aa221e5aebdb403ba4f2bfeb21f/fx5.gif fx5 fx5.gif gif 2798 83 288 IMAGE-DOWNSAMPLED 1-s2.0-S1381116902002224-fx6.sml https://s3.amazonaws.com/prod-ucs-content-store-us-east/content/pii:S1381116902002224/fx6/THUMBNAIL/image/gif/052868a87940d15ceaecd4871add0c9f/fx6.sml https://s3-eu-west-1.amazonaws.com/prod-ucs-content-store-eu-west/content/pii:S1381116902002224/fx6/THUMBNAIL/image/gif/052868a87940d15ceaecd4871add0c9f/fx6.sml fx6 fx6.sml sml 947 60 125 IMAGE-THUMBNAIL 1-s2.0-S1381116902002224-fx6.gif https://s3.amazonaws.com/prod-ucs-content-store-us-east/content/pii:S1381116902002224/fx6/DOWNSAMPLED/image/gif/046c962d5e8608e9dc18e328b738eccd/fx6.gif https://s3-eu-west-1.amazonaws.com/prod-ucs-content-store-eu-west/content/pii:S1381116902002224/fx6/DOWNSAMPLED/image/gif/046c962d5e8608e9dc18e328b738eccd/fx6.gif fx6 fx6.gif gif 862 50 104 IMAGE-DOWNSAMPLED 1-s2.0-S1381116902002224-sc2.sml https://s3.amazonaws.com/prod-ucs-content-store-us-east/content/pii:S1381116902002224/sc2/THUMBNAIL/image/gif/9baa540c138adca5b47bd00f393fbf02/sc2.sml https://s3-eu-west-1.amazonaws.com/prod-ucs-content-store-eu-west/content/pii:S1381116902002224/sc2/THUMBNAIL/image/gif/9baa540c138adca5b47bd00f393fbf02/sc2.sml sc2 sc2.sml sml 566 32 125 IMAGE-THUMBNAIL 1-s2.0-S1381116902002224-sc2.gif https://s3.amazonaws.com/prod-ucs-content-store-us-east/content/pii:S1381116902002224/sc2/DOWNSAMPLED/image/gif/501567e7c1b0669a3eb945a03308edcc/sc2.gif https://s3-eu-west-1.amazonaws.com/prod-ucs-content-store-eu-west/content/pii:S1381116902002224/sc2/DOWNSAMPLED/image/gif/501567e7c1b0669a3eb945a03308edcc/sc2.gif sc2 sc2.gif gif 2149 86 339 IMAGE-DOWNSAMPLED 1-s2.0-S1381116902002224-sc3.sml https://s3.amazonaws.com/prod-ucs-content-store-us-east/content/pii:S1381116902002224/sc3/THUMBNAIL/image/gif/63955a8086eb17181bbcf6b25dfd10f5/sc3.sml https://s3-eu-west-1.amazonaws.com/prod-ucs-content-store-eu-west/content/pii:S1381116902002224/sc3/THUMBNAIL/image/gif/63955a8086eb17181bbcf6b25dfd10f5/sc3.sml sc3 sc3.sml sml 626 27 125 IMAGE-THUMBNAIL 1-s2.0-S1381116902002224-sc3.gif https://s3.amazonaws.com/prod-ucs-content-store-us-east/content/pii:S1381116902002224/sc3/DOWNSAMPLED/image/gif/a9ecdb8d08f54cf16d0070e43418e80f/sc3.gif https://s3-eu-west-1.amazonaws.com/prod-ucs-content-store-eu-west/content/pii:S1381116902002224/sc3/DOWNSAMPLED/image/gif/a9ecdb8d08f54cf16d0070e43418e80f/sc3.gif sc3 sc3.gif gif 2981 84 395 IMAGE-DOWNSAMPLED MOLCAA 3659 S1381-1169(02)00222-4 10.1016/S1381-1169(02)00222-4 Elsevier Science B.V. Scheme 1 Scheme 2 Scheme 3 Table 1 ROMP of the N-benzyl lactam 7d using various ruthenium-based catalytic systems a Catalyst precursor Isolated polymer (%) b Isomerization products (%) c 1a 13 22 1b 90 0 2a d 26 7 2b d 0 10 3a e 5 41 3b e 0 4 a Reaction conditions: lactam 7f (1mmol), catalyst precursor (10−2mmol), PhCl (1ml), 60°C, 24h. b Precipitated from n-heptane. c Determined by GC using tetradecane as an internal standard. d Catalyst prepared in situ from [RuCl2(p-cymene)]2 (5×10−3mmol) and PCy3 (2×10−2mmol). TMSD (3×10−2mol) was added to the reaction medium. e Reaction carried out under intense visible light irradiation. Synthesis and ring-opening metathesis polymerization of eight-membered unsaturated lactams and related monomers Janusz Baran a Irena Bogdanska a Dominique Jan b 1 Lionel Delaude b Albert Demonceau b Alfred F Noels b ∗ a Institute of Fundamental Chemistry, Technical University of Szczecin, Al. Piastów 42, PL-70065 Szczecin, Poland b Center for Education and Research on Macromolecules (CERM), Institut de Chimie (B6a), Université de Liège, Sart-Tilman par, B-4000 Liege, Belgium * Corresponding author. Tel.: +32-4-366-3463; fax: +32-4-366-3497. 1 Present address: BP Solvay Polyethylene, Rue de Ransbeek 310, B-1120 Bruxelles, Belgium. Graphic Novel eight-membered ring unsaturated lactams were synthesized and tested as monomers for the ruthenium-catalyzed ring-opening metathesis polymerization (ROMP). The reaction of a N-protected cyclic alkeneamine was also investigated. The Grubbs’ benzylidene complexes RuCl2(=CHPh)(PCy3)2 or RuCl2(=CHPh)(PCy3)(IMesH2) and selected ruthenium–arene species bearing either phosphine or stable Arduengo-type N-heterocyclic carbene ligands served as catalyst precursors. In most cases, isomerization of the starting materials took place and only 1-benzyl-1-aza-2-ketocyclooct-5-ene afforded a polymeric product. This polyamide was characterized by numerous analytical techniques. Keywords Ruthenium Nylon Carbene 1 Introduction Over the past few years olefin metathesis polymerization has made an increasingly significant impact on the material arena. The ring-opening metathesis polymerization (ROMP) of cycloolefins, in particular, has emerged as a powerful tool for macromolecular engineering, because it often allows a high degree of control over the molecular weight and polydispersity of the polymer chains. The living nature of ROMP also permits the addition of a second monomer at the end of a growing chain, thus leading to block copolymers of known stoichiometries. These developments may largely be attributed to the discovery of well-defined ROMP initiators in which the active site is incorporated within a relatively robust transition-metal complex and is shielded from outside interactions by a protective array of ancillary ligands. These new, well-behaved, single-component catalysts can be fine-tuned through ligand modification in order to react in predictable and controlled ways [1–3]. More importantly, the advent of low oxophilicity catalyst precursors based on ruthenium has extended the application field of ROMP to a large set of monomers that encompasses a variety of organic functionalities, resulting in (co)polymers with novel properties [4–7]. Surprisingly, the ROMP of unsaturated cyclic amides (lactams) has received only little attention so far, although various reports describe the successful polymerization of norbornene-5-amides or norbornene-5,6-dicarboximides and their N-substituted derivatives [8–11], thereby, confirming the tolerance of ruthenium-based catalysts toward amide and imide functional groups. Polymers containing both olefinic bonds and amido groups in their backbones have been used as membranes [12], fibers [13,14], and resins [12]. They can be crosslinked through their olefinic bonds to afford heat-resistant resins. However, the synthesis of unsaturated polyamide chains remains a relatively unploughed field, and the rare examples described in the literature usually consist in polycondensation reactions, involving either unsaturated dicarboxylic acids or unsaturated diamines [15–17]. To the best of our knowledge, no unsaturated polyamide has ever been prepared by the ROMP of a lactam monomer. To investigate whether late transition-metal catalysts could offer a new entry to unsaturated polyamide materials, we have undertaken a study of the ROM polymerization of unsaturated lactams and of related monomers in the presence of various ruthenium-based initiators. In this article, we report on the synthesis and on the ROMP of new eight-membered ring unsaturated lactams. Results obtained with a N-protected cyclic alkeneamine are also discussed. The catalyst precursors are the first and second generation Grubbs’ benzylidene complexes (1) [18,19] and selected ruthenium–arene complexes associated either with phosphine ligands (2) [4,20] or with stable Arduengo-type N-heterocyclic carbene ligands (3) [21,22], respectively. 2 Experimental 2.1 Materials and methods Solvents (Et2O, THF, pentane) were freshly distilled over LiAlH4, acetonitrile was stored over molecular sieve 4A and was freshly distilled prior to use. Potassium tert-butoxide and LiAlH4 of 95% purity were used without any further purification. All other chemicals were reagent grade and used as received from commercial suppliers. Polymerizations were carried out under inert atmosphere using standard Schlenk techniques. Gel permeation chromatographic (GPC) analyses of the polymers were performed in THF on a Hewlett-Packard HP 1090 instrument equipped with a HP 1037A refractive index detector and a battery of 4 PL gel columns fitted in series (particle size: 5μm; pore sizes: 100000, 10000, 1000, and 100Å). The molecular weights (not corrected) are reported versus monodisperse polystyrene standards used to calibrate the instrument. 1 H and 13 C NMR spectra (400 and 100MHz, respectively) were recorded on a Bruker DPX 400 spectrometer in CDCl3 with TMS as internal standard. GC/MS analyses were performed on a HP 6890 chromatograph equipped with a fused silica capillary column (30m, i.d. 0.25mm, 0.25μm thickness, 5% Ph Me siloxane) coupled to a HP 5973 mass selective detector. Elemental analyses were carried out on a EuroVector EA3000 instrument at the Institute of Industrial Chemistry, Technical University of Szczecin. Melting and boiling points are uncorrected. 2.2 Synthesis of monomers 2.2.1 4-Cycloheptenone (4) This unsaturated ketone was prepared according to the literature [23–25], bp 40–43°C/2.5Torr (lit. bp 60°C/12Torr [25]). 13 C NMR (δ ppm): 24.10, 42.46, 129.51, 213.72. MS (70eV): m/z (%) 110 (M+, 74), 92 (16), 82 (24), 81 (25), 68 (59), 67 (100), 54 (27), 53 (29), 41 (19), 39 (28). 2.2.2 4-Cycloheptenone oxime (5) The procedure of Wilson and Sawicki was followed [26], mp 56–59°C (lit. mp 56–58°C [26]). 13 C NMR (δ ppm): 23.03, 27.92, 28.66, 31.35, 129.09, 129.77, 163.21. 2.2.3 4-Cycloheptenone oxime tosylate (6) The procedure of Wilson and Sawicki was followed [26], mp 80–82°C (lit. mp 83–84°C [26]). 13 C NMR (δ ppm): 21.70, 22.74, 27.89, 29.48, 31.07, 127.05, 128.68, 128.72, 129.41, 129.53, 130.24, 172.06. 2.2.4 1-Aza-2-ketocyclooct-5-ene (7a) The procedure of Wilson and Sawicki was followed [26], mp 89–91°C (lit. mp 88–89°C [26]). 13 C NMR (δ ppm): 24.62, 30.28, 34.53, 40.52, 126.91, 129.24, 176.90. 2.2.5 1-Methyl-l-aza-2-ketocyclooct-5-ene (7b) Lactam 7a (1.3g, 10.4mmol), potassium tert-butoxide (2.66g, 22.5mmol), and crown ether 18C6 (96mg) were stirred in THF (30ml) for 15min at room temperature. Methyl iodide (5.8g, 40.9mmol) in THF (3ml) was added dropwise within 2h and the resulting mixture was further stirred overnight. GC/MS showed the total conversion of 7a. The reaction mixture was then diluted with Et2O (20ml), water (2ml) was added, and the mixture was acidified with 5% aqueous HCl. The organic layer was separated and the aqueous phase was extracted with Et2O (3 ml×20 ml). The combined extracts were dried over MgSO4 and the solvents were removed under reduced pressure (water pump). A vacuum distillation afforded 7b as a colorless liquid. Yield 0.79g (84%); bp 73–75°C/1.5Torr. 1 H NMR (δ ppm): 2.41–2.48 (m, 4H), 2.76 (t, J=7.5Hz, 2H), 2.88 (s, 3H), 3.61 (t, J=6.5Hz, 2H), 5.47–5.52 (m, 1H), 5.72–5.79 (m, 1H). 13 C NMR (δ ppm): 26.43, 28.81, 35.40, 36.52, 49.86, 127.69, 131.02, 175.31. MS (70eV): m/z (%) 139 (M+, 60), 110 (47), 84 (18), 83 (12), 82 (17), 81 (8), 68 (36), 67 (23), 54 (59), 44 (100), 42 (31), 39 (20). Anal. Calc. for C8H13NO (139.20): C, 69.03; H, 9.41; N, 10.06. Found: C, 68.94; H, 9.40; N, 9.93%. 2.2.6 1-Ethyl-l-aza-2-ketocyclooct-5-ene (7c) Lactam 7a (1.0g, 7.99mmol), potassium tert-butoxide (2.08g, 17.6mmol), and crown ether 18C6 (116mg) were stirred in THF (20ml) for 15min at room temperature. Ethyl iodide (2.50g, 16.0mmol) in THF (3ml) was added dropwise within 2h and the resulting mixture was further stirred overnight. GC/MS indicated a ca. 60% conversion of 7a. A second portion of potassium tert-butoxide (2.18g, 18.5mmol) was added to the flask before ethyl iodide (2.62g, 16.8mmol) in THF (3ml) was added dropwise, then stirred overnight as described immediately above. Conversion of 7a reached ca. 90% at this stage, as evidenced by GC/MS. To reach 100% conversion, the addition-stirring step was repeated once more with 2.20g of potassium tert-butoxide (18.6mmol) and 3.05g of ethyl iodide (19.6mmol). The reaction mixture was then diluted with Et2O (20ml), water (2ml) was added, and the mixture was acidified with 5% aqueous HCl. The organic layer was separated and the aqueous phase was extracted with Et2O (3×20ml). The combined extracts were dried over MgSO4 and the solvents were removed under reduced pressure (water pump). A vacuum distillation afforded 7c as a colorless liquid. Yield 0.91g (74%); bp 80–82°C/1Torr. 1 H NMR (δ ppm): 1.12 (t, J=7.2Hz, 3H), 2.25–2.52 (m, 4H), 2.78 (t, J=7.5Hz, 2H), 3.36 (q, J=7.2Hz, 2H), 3.59 (t, J=6.6Hz, 2H), 5.47–5.53 (m, 1H), 5.74–5.80 (m, 1H). 13 C NMR (δ ppm): 13.00, 25.11, 27.95, 34.67, 41.61, 46.17, 126.42, 129.45, 173.68. MS (70eV): m/z (%) 153 (M+, 51), 138 (26), 125 (9), 124 (16), 96 (9), 71 (8), 68 (26), 67 (16), 58 (100), 54 (36), 53 (9), 42 (21), 39 (13). Anal. Calc. for C9H15NO (153.22): C, 70.55; H, 9.87; N, 9.14. Found: C, 70.50; H, 9.64; N, 9.27%. 2.2.7 1-tert-Butoxycarbonyl-1-aza-2-ketocyclooct-5-ene (7d) Lactam 7a (1.25g, 10.0mmol), di-tert-butyldicarbonate (3.45g, 15.8mmol), and 150mg of 4-dimethylaminopyridine (DMAP) in acetonitrile (3ml) were stirred for 24h at room temperature (GC/MS analysis showed the presence of unreacted starting material after 3h). The solvent was then removed under reduced pressure. Flash chromatography of the residue (SiO2, Et2O) afforded an oil which slowly solidified. Crystallization from pentane afforded colorless crystals of 7d. Yield 1.32g (59%); mp 60–61°C. Concentration of the mother liquor afforded a further crop of less pure material (0.27g, 12%). 1 H NMR (δ ppm): 1.52 (s, 9H), 2.25–2.36 (m, 4H), 2.94–2.97 (m, 2H), 3.52–3.55 (m, 2H), 5.72–5.83 (m, 2H). 13 C NMR (δ ppm): 24.89, 26.50, 28.22, 41.55, 44.18, 82.02, 129.74, 131.03, 153.06, 182.46. MS (70eV): m/z (%) 225 (M+, 0.1), 170 (22), 125 (37), 124 (11), 109 (9), 96 (19), 69 (13), 68 (14), 67 (9), 57 (100), 56 (12), 54 (13), 41 (25), 39 (12). Anal. Calc. for C12H19O3N (225.29): C, 63.98; H, 8.50; N, 6.22. Found: C, 64.13; H, 8.48; N, 6.04%. 2.2.8 1-Trimethylsilyl-l-aza-2-ketocyclooct-5-ene (7e) To lactam 7a (0.50g, 4.0mmol) dissolved in THF (5ml), 2M lithium diisopropylamide in heptane/THF/ethylbenzene (2ml, 4.0mmol) was added with a syringe, and the resulting suspension was stirred for 30min. Solvents and diisopropylamine were removed under vacuum and the flask was pressurized with argon before THF (5ml) and chlorotrimethylsilane (1.5ml, 11.8mmol) were added. The reaction mixture was stirred for 2h at room temperature. Solvents and other volatile components were then removed under vacuum and the residue was extracted with pentane (2×10ml). Evaporation of the solvent yielded 0.50g of an oily product (63%). 1 H NMR (δ ppm): 0.18 (s, 9H), 2.27–2.42 (m, 4H), 2.66–2.72 (m, 2H), 3.44 (t, J=6.5Hz, 2H), 5.42–5.49 (m, 1H), 5.70–5.80 (m, 1H). 13 C NMR (δ ppm): 0.03, 24.46, 30.41, 36.21, 42.68, 126.68, 129.21, 180.98. Due to its high reactivity toward water, no satisfactory microanalysis could be obtained for 7e, but its purity was checked by GC analysis. 2.2.9 1-Benzyl-l-aza-2-ketocyclooct-5-ene (7f) Lactam 7a (1.4g, 11.19mmol), potassium tert-butoxide (3.4g, 28.8mmol), and crown ether 18C6 (100mg) were stirred in THF (12ml) for 15min at room temperature. Benzyl chloride (2.05g, 16.2mmol) in THF (2ml) was added dropwise within 2h and the resulting mixture was stirred overnight. GC/MS showed the total conversion of 7a. The reaction mixture was then diluted with Et2O (10ml), water (2ml) was added, and the mixture was acidified with 5% aqueous HCl. The organic layer was separated and the aqueous phase was extracted with Et2O (3×20ml). The combined extracts were dried over MgSO4 and the solvents were removed under reduced pressure (water pump). The residue was crystallized from Et2O-pentane, affording colorless crystals of 7f. Yield 1.85g (77%); mp 56–58°C. Chromatography of the concentrated mother liquors (SiO2, acetone) afforded an additional 0.34g (14%) of product. 1 H NMR (δ ppm): 2.32–2.50 (m, 4H), 2.82 (t, J=7.1Hz, 2H), 3.52 (t, J=7.1Hz, 2H), 4.54 (s, 2H), 5.39–5.45 (m, 1H), 5.74–5.81 (m, 1H), 7.24–7.32 (m, 5H). 13 C NMR (δ ppm): 25.02, 27.33, 34.89, 45.39, 49.02, 126.63, 127.33, 128.25, 128.41, 128.48, 129.37, 173.98. MS (70eV): m/z (%) 215 (M+, 64), 132 (8), 124 (7), 120 (48), 118 (7), 91 (100), 68 (8), 65 (11), 54 (10). Anal. Calc. for C14H17NO (215.30): C, 78.10; H, 7.96; N, 6.51. Found: C, 78.10; H, 7.96; N, 6.51%. 2.2.10 1-Benzyl-1-aza-4-cyclooctene (8) Lactam 7f (1.0g, 4.64mmol) dissolved in THF (10ml) was added dropwise to LiAlH4 (0.35g, 8.76mmol) in THF (10ml) under nitrogen. The reaction mixture was then refluxed for 6h. After cooling to room temperature, water (10ml) was added dropwise and the resulting mixture was extracted with Et2O (3×50ml). The combined extracts were washed with 10% aqueous HCl (2×20ml). They were stirred with charcoal and filtered. A concentrated potassium hydroxide solution (from 5g of KOH in 5ml of water) was added to the filtrate and the resulting mixture was extracted with Et2O (3×50ml). The ether solution was dried over KOH pellets and the solvent was removed under vacuum. A bulb-to-bulb distillation afforded 8 as a colorless oil. Yield 0.79g (84%); bp 125–130°C (bath temp.)/1Torr. 1 H NMR (δ ppm): 1.44 (br s, 2H), 2.24 (br s, 4H), 2.66 (br s, 4H), 3.77 (s, 2H), 5.63–5.78 (m, 2H), 7.21–7.38 (m, 5H). 13 C NMR (δ ppm): 24.39, 27.93, 29.01, 52.20, 56.07, 61.96, 126.78, 128.11, 128.75, 129.55, 130.18, 132.66. MS (70 eV): m/z (%) 201 (M+, 24), 200 (39), 173 (10), 172 (21), 146 (15), 134 (6), 110 (18), 91 (100), 81 (7), 65 (12), 42 (8), 41 (6). Anal. Calc. for C14H19N (201.31): C, 83.53; H, 9.51; N 6.96. Found: C, 83.40; H, 9.40; N, 6.82%. 2.3 Typical polymerization procedure Complex 2a (0.0059g, 10−2 mmol) and a lactam monomer (1mmol) were placed in a flask under argon before dry chlorobenzene (1ml) and tetradecane (0.0080g, GC internal standard) were added. The mixture was stirred for 5min at 60°C, then 0.3ml of trimethylsilyldiazomethane (TMSD, 0.1M in chlorobenzene, 3×10−5 mmol) were added via a syringe. The solution was stirred for 24h at 60°C and conversion was monitored by gas chromatography. After cooling to room temperature, the reaction mixture was poured in a large volume of n-heptane. The precipitated polymer was dried overnight under vacuum and analyzed by GPC and NMR spectroscopy. 3 Results and discussion 3.1 Synthesis of monomers Lactam 7a was synthesized from 4-cycloheptenone (4) according to the literature [26] (Scheme 1 ). The key step was the facile Beckmann rearrangement of the tosyl oxime 6, leading to a 62% overall yield. The starting unsaturated ketone 4 was obtained from ethyl acetoacetate and cis-1,4-dichlorobutene according to the indications of Descotes and co-workers [23], further modified by Wilson and Wiesler [24], and by Marshall and Royce [25]. The 13 C NMR spectral data for compounds 4–7a are listed in the experimental part of this report (Section 2.2), since they were not previously published. The new N-protected lactams 7b–f were obtained from 7a. The methyl, ethyl, and benzyl derivatives (7b, 7c, and 7f, respectively) were prepared by alkylation of lactam 7a with a suitable halogeno compound in the presence of potassium tert-butoxide and crown ether 18C6 (Section 2.2). The trimethylsilylated lactam 7e was synthesized from the lithium salt of 7a and chlorotrimethylsilane, whereas the tert-butoxycarbonyl substituted lactam 7d was obtained by reaction of 7a with di-tert-butyldicarbonate in the presence of 4-DMAP [27]. Reduction of 7f with lithium aluminum hydride afforded the N-benzylated cycloalkeneamine 8. All of these products were characterized by NMR spectroscopy and by GC/MS. The reaction yields were not optimized. 3.2 Polymerization reactions To assess the reactivity of monomers 7a–f, exploratory polymerization experiments were performed with two of the most active ruthenium-based ROMP initiators currently available, viz. the Grubbs’ benzylidene complex 1a (system A) [18] and the [RuCl2(p-cymene)]2/PCy3/TMSD catalytic system developed in Liège (system B) [4] (Scheme 2 ). In both cases, the reactions were carried out in chlorobenzene at 60°C with a 100:1 monomer-to-ruthenium ratio. The recourse to a mixture of the [RuCl2(p-cymene)]2 dimer with 2 (or more) eq. of tricyclohexylphosphine offers a convenient synthetic alternative to performed complex 2a. Previous work from our group has shown indeed that the 1:2 combination of [RuCl2(p-cymene)]2 and PCy3 was equivalent to 2a in the polymerization of cyclooctene [4]. A major difference between the two systems is that complex 1a contains a vinylidene carbene moiety and can promote ROMP per se, whereas the 18-electron precursor 2a needs to be further activated in situ by TMSD to generate a highly reactive coordinatively unsaturated ruthenium–carbene species that triggers the catalytic process. 3.2.1 Reaction of 1-aza-2-ketocyclooct-5-ene (7a) The [RuCl2(p-cymene)]2/PCy3/TMSD catalytic system A was poorly active for the polymerization of this monomer. Experimental observation showed that a brown solid precipitated right from the very beginning of the reaction. This phenomenon could be easily explained either by the insolubility of polyamides in organic media or by the formation of new poorly soluble ruthenium species. The polymer yield remained very low (<0.5%), and the polymerization process was progressively supplanted by an isomerization process (ca. 10% of isomeric products after 5h at 60°C and 40% after 18h at 90°C, as determined by GC). These results prompted us to consider the protection of the amide function in order to circumvent the solubility limitations. 3.2.2 Reaction of N-protected amides and amines Various eight-membered ring lactams bearing N-protecting groups have been tested as ROMP monomers using the catalytic systems A and B, respectively. Under the experimental conditions adopted the N-benzyl lactam 7f was, however, the only functionalized cycloolefin that effectively underwent a polymerization (Table 1 ). A competing isomerization reaction also took place, as evidenced by the progressive emergence of two additional peaks in the GC chromatograms, whose retention times were close to that of 7f. The isomeric nature of these new products was confirmed by GC/MS analysis (m/z=215). The two isomers showed different fragmentation patterns that are consistent with the structures proposed in Scheme 3 but were not further characterized nor isolated. Monomers 7b–e also went through a limited isomerization process when exposed to ruthenium complexes 1a and 2a, but none of them afforded any polymeric material. In the case of the N-benzyl amine 8, no reaction occurred with either catalytic system A or B, and the monomer remained unchanged after 24h at 60°C. This result did not come as a surprise. It is notoriously difficult to polymerize basic amines, even with ruthenium-based catalysts, because of substantial catalyst poisoning [1]. The absence of any isomer peak in the GC chromatograms is more revealing and tends to prove that the formation of conjugated double bonds is the driving force of the lactam isomerization process. Other ruthenium complexes were tested for the polymerization of the N-benzyl lactam 7f. In a variation on system B, the tricyclohexylphosphine ligand in complex 2a was substituted with another strongly basic, sterically hindered phosphine that had led to highly active catalyst precursors for the ROMP of cyclooctene [20]. Thus, performed complex 2b containing the triisopropylphosphine ligand was used as catalyst precursor for the ROMP of lactam 7f in the presence of TMSD. The conversion remained, however, very low (10%) and led essentially to isomers. Two ruthenium–arene complexes bearing respectively an aryl- and an alkyl-substituted imidazol-2-ylidene ligand were also tested as catalyst precursors for the ROMP of monomer 7f. Complex 3a, which was an active catalyst precursor for the ROMP of cyclooctene in the presence of visible light [28], did not afford any significant yield of polyamide, but promoted rather efficiently the isomerization of the N-benzyl lactam. Complex 3b, which was mainly inactive toward cyclooctene, did not afford any better results with the functionalized monomer. No polymer was isolated and isomeric products did not represent more than 4% of the starting material. Success eventually came from the recourse to the second generation Grubbs’ catalyst RuCl2(=CHPh)(PCy3)(IMesH2) (1b) [19]. This ruthenium–benzylidene complex bearing a mesityl-substituted N-heterocyclic carbene with a saturated backbone is a much more active ROMP catalyst than its diphosphine analogue 1a [7]. It very efficiently promoted the polymerization of monomer 7f into the corresponding polyamide within the 24h imparted to the reaction. GC analysis indicated that the starting material completely disappeared without concomitant isomerization, resulting in an almost quantitative yield of isolated polymer. GPC analysis in THF showed that the sticky gum formed had a relatively low molecular weight and a rather broad molecular weight distribution (M n =30000, M w/M n=1.47 versus monodisperse polystyrene standards). NMR elucidation of the microstructure of the unsaturated polyamide poly-7f was complicated by the possible head-to-tail, head-to-head, or tail-to-tail relative orientations of the amido groups, in addition to the cis/trans splitting of the olefinic double bonds. The detailed interpretation of NMR spectra is beyond the scope of this study. It can nevertheless be pointed out that 1 H -NMR spectroscopy confirmed the formation of the expected polymer. Comparison of the integrals for the olefinic protons (broad signal), the backbone methylene units, and the benzyl groups indicated that the amide functional groups were still fully protected. 13 C -NMR spectroscopy allowed to distinguish between the various types of carbon atoms, each of them giving rise to multiple peaks poorly resolved at 100MHz. The FT–IR spectrum exhibited a strong absorption at 1634cm−1, typical of the amide carbonyl group. A thermogravimetric analysis (TGA) showed that poly-7d had a very high thermal stability until at least 250°C and that a 10% weight loss occurred at ca. 340°C. Differential scanning calorimetry (DSC) revealed a well-defined glass transition at 21°C. No other endothermal peak was observed within the temperature range scanned (−100 to +200°C), suggesting that the polymer does not melt before decomposition. 3.3 Deprotection of the unsaturated polyamide derived from 7f We have tried to deprotect the poly(N-benzyl lactam) derived from 7f in order to obtain and to characterize an unsaturated polyamide chain with no substituents on the nitrogen atoms. The selective cleavage of a N-benzyl amide constitutes, however, a much more difficult task than the deprotection of the corresponding amine [29]. Three different methods described in the literature have been investigated but did not lead to any conclusive results. The use of pure trifluoroacetic acid at 20°C [30] did not afford any reaction after 18h and the starting polymer was recovered unchanged. Recourse to cerium ammonium nitrate (NH4)2Ce(NO3)2 in a THF/H2O mixture for 3h at 20°C [31] led to a partial decomposition of poly-7f, but the benzyl groups were still present, as evidenced by NMR spectroscopy. Under basic conditions, bubbling dry air to introduce oxygen into a DMSO/THF solution of poly-7f and potassium tert-butoxide [32] for 3h at 20°C also proved unsatisfactory, as only a minute amount of N-protected polymer was recovered after work-up. 4 Summary 1-Aza-2-ketocyclooct-5-ene (7a) together with five of its N-protected derivatives (7b–f) were synthesized and submitted to ROMP conditions along with a related cyclic alkeneamine (8) in the presence of various ruthenium-based catalyst precursors. These reactions led mainly to the isomerization of the starting materials and only the N-benzyl unsaturated lactam 7f afforded a polymeric product. This polyamide was characterized by numerous analytical techniques. Attempts to selectively cleave the benzyl groups of poly-7f failed. Acknowledgements The financial support of the EU, through Grant TMR-HPRN CT 2000–10 “Polycat”, is gratefully acknowledged. References [1] M. Schuster S. Blechert Angew. Chem. Int. Ed. Engl. 36 1997 2036 2056 [2] R.H. Grubbs, E. Khosravi, Ring-opening metathesis polymerization (ROMP) and related processes, in: A.D. Schlüter (Ed.), Material Science and Technology, VCH, Weinheim, 1999, pp. 64–104. [3] A. Fürstner Angew. Chem. Int. Ed. Engl. 39 2000 3012 3043 [4] A. Demonceau A.W. Stumpf E. Saive A.F. Noels Macromolecules 30 1997 3127 3136 [5] L. Delaude A. Demonceau A.F. Noels Macromolecules 32 1999 2091 2103 [6] T. Weskamp F.J. Kohl W. Hieringer D. Gleich W.A. Herrmann Angew. Chem. Int. Ed. Engl. 38 1999 2416 2419 [7] C.W. Bielawski R.H. Grubbs Angew. Chem. Int. Ed. Engl. 39 2000 2903 2906 [8] S. Kanaoka R.H. Grubbs Macromolecules 28 1995 4707 4713 [9] C. Fraser R.H. Grubbs Macromolecules 28 1995 7248 7255 [10] D.A. Robson V.C. Gibson R.G. Davies M. North Macromolecules 32 1999 6371 6373 [11] D.M. Lynn B. Mohr R.H. Grubbs L.W. Henling M.W. Day J. Am. Chem. Soc. 122 2000 6601 6609 [12] K. Nakao, M. Mito, Japanese Patent 75160343, 1975 to Osaka Prefecture, Chem. Abstr. 84 (1976) 136872. [13] T.C. Pletcher P.W. Morgan J. Polym. Sci. Polym. Chem. Ed. 18 1980 643 660 [14] P.W. Morgan Macromolecules 10 1977 1381 1390 [15] J. Berger Polym. Commun. 26 1985 11 14 [16] C.D. Diakoumakos J.A. Mikroyannidis Polymer 36 1995 387 392 [17] I.K. Spiliopoulos J.A. Mikroyannidis J. Polym. Sci. Polym. Chem. Ed. 34 1996 2799 2807 [18] P. Schwab R.H. Grubbs J.W. Ziller J. Am. Chem. Soc. 118 1996 100 110 [19] M. Scholl S. Ding C.W. Lee R.H. Grubbs Org. Lett. 1 1999 953 956 [20] D. Jan L. Delaude F. Simal A. Demonceau A.F. Noels J. Organomet. Chem. 606 2000 55 64 [21] W.A. Herrmann C. Köcher L.J. Gossen G.R.J. Artus Chem. Eur. J. 2 1996 1627 1636 [22] L. Jafarpour J. Huang E.D. Stevens S.P. Nolan Organometallics 18 1999 3760 3763 [23] Y. Bahurel, F. Collonges, A. Menet, A. Poncet, G. Descottes, Bull Soc. Chim. Fr. (1971) 2203–2208. [24] S.R. Wilson D.P. Wiesler Synth. Commun. 10 1980 339 343 [25] J.A. Marshall R.D. Royce Jr. J. Org. Chem. 47 1982 693 698 [26] S.R. Wilson R.A. Sawicki J. Org. Chem. 44 1979 287 291 [27] G. Casiraghi G. Rassu P. Spanu L. Pinna J. Org. Chem. 57 1992 3760 3763 [28] L. Delaude, A. Demonceau, A.F. Noels, J. Chem. Soc., Chem. Commun. (2001) 986–987. [29] P.J. Kocienski, Protecting groups, Thieme, Stuttgart, 1994. [30] A.B. Smith T.A. Rano N. Chida G.A. Sulikowski J.L. Wood J. Am. Chem. Soc. 114 1992 8008 8022 [31] Y. Ito Y. Kobayashi T. Kawabata M. Takase S. Terashima Tetrahedron 45 1989 5767 5790 [32] R. Gigg, R. Conant, J. Chem. Soc., Chem. Commun. (1983) 465–466.",
      "scopus-id": "0037010853",
      "coredata": {
        "eid": "1-s2.0-S1381116902002224",
        "dc:description": "Novel eight-membered ring unsaturated lactams were synthesized and tested as monomers for the ruthenium-catalyzed ring-opening metathesis polymerization (ROMP). The reaction of a N-protected cyclic alkeneamine was also investigated. The Grubbs’ benzylidene complexes RuCl2(=CHPh)(PCy3)2 or RuCl2(=CHPh)(PCy3)(IMesH2) and selected ruthenium–arene species bearing either phosphine or stable Arduengo-type N-heterocyclic carbene ligands served as catalyst precursors. In most cases, isomerization of the starting materials took place and only 1-benzyl-1-aza-2-ketocyclooct-5-ene afforded a polymeric product. This polyamide was characterized by numerous analytical techniques.",
        "openArchiveArticle": "false",
        "prism:coverDate": "2002-12-02",
        "openaccessUserLicense": null,
        "prism:aggregationType": "Journal",
        "prism:url": "https://api.elsevier.com/content/article/pii/S1381116902002224",
        "dc:creator": [
          {
            "@_fa": "true",
            "$": "Baran, Janusz"
          },
          {
            "@_fa": "true",
            "$": "Bogdanska, Irena"
          },
          {
            "@_fa": "true",
            "$": "Jan, Dominique"
          },
          {
            "@_fa": "true",
            "$": "Delaude, Lionel"
          },
          {
            "@_fa": "true",
            "$": "Demonceau, Albert"
          },
          {
            "@_fa": "true",
            "$": "Noels, Alfred F"
          }
        ],
        "link": [
          {
            "@_fa": "true",
            "@rel": "self",
            "@href": "https://api.elsevier.com/content/article/pii/S1381116902002224"
          },
          {
            "@_fa": "true",
            "@rel": "scidir",
            "@href": "https://www.sciencedirect.com/science/article/pii/S1381116902002224"
          }
        ],
        "dc:format": "application/json",
        "openaccessType": null,
        "pii": "S1381-1169(02)00222-4",
        "prism:volume": "190",
        "prism:publisher": "Elsevier Science B.V.",
        "dc:title": "Synthesis and ring-opening metathesis polymerization of eight-membered unsaturated lactams and related monomers",
        "prism:copyright": "Copyright © 2002 Elsevier Science B.V. All rights reserved.",
        "prism:issueName": "15th. International Symposium on Olefin Metathesis and Related Chemistry",
        "openaccess": "0",
        "prism:issn": "13811169",
        "prism:issueIdentifier": "1-2",
        "dcterms:subject": [
          {
            "@_fa": "true",
            "$": "Ruthenium"
          },
          {
            "@_fa": "true",
            "$": "Nylon"
          },
          {
            "@_fa": "true",
            "$": "Carbene"
          }
        ],
        "openaccessArticle": "false",
        "prism:publicationName": "Journal of Molecular Catalysis A: Chemical",
        "prism:number": "1-2",
        "openaccessSponsorType": null,
        "prism:pageRange": "109-116",
        "prism:endingPage": "116",
        "pubType": "fla",
        "prism:coverDisplayDate": "2 December 2002",
        "prism:doi": "10.1016/S1381-1169(02)00222-4",
        "prism:startingPage": "109",
        "dc:identifier": "doi:10.1016/S1381-1169(02)00222-4",
        "openaccessSponsorName": null
      },
      "objects": {
        "object": [
          {
            "@category": "thumbnail",
            "@height": "14",
            "@width": "25",
            "@_fa": "true",
            "$": "https://api.elsevier.com/content/object/eid/1-s2.0-S1381116902002224-si9.gif?httpAccept=%2A%2F%2A",
            "@multimediatype": "GIF image file",
            "@type": "ALTIMG",
            "@size": "192",
            "@ref": "si9",
            "@mimetype": "image/gif"
          },
          {
            "@category": "thumbnail",
            "@height": "14",
            "@width": "20",
            "@_fa": "true",
            "$": "https://api.elsevier.com/content/object/eid/1-s2.0-S1381116902002224-si8.gif?httpAccept=%2A%2F%2A",
            "@multimediatype": "GIF image file",
            "@type": "ALTIMG",
            "@size": "149",
            "@ref": "si8",
            "@mimetype": "image/gif"
          },
          {
            "@category": "thumbnail",
            "@height": "12",
            "@width": "68",
            "@_fa": "true",
            "$": "https://api.elsevier.com/content/object/eid/1-s2.0-S1381116902002224-si7.gif?httpAccept=%2A%2F%2A",
            "@multimediatype": "GIF image file",
            "@type": "ALTIMG",
            "@size": "344",
            "@ref": "si7",
            "@mimetype": "image/gif"
          },
          {
            "@category": "thumbnail",
            "@height": "14",
            "@width": "25",
            "@_fa": "true",
            "$": "https://api.elsevier.com/content/object/eid/1-s2.0-S1381116902002224-si6.gif?httpAccept=%2A%2F%2A",
            "@multimediatype": "GIF image file",
            "@type": "ALTIMG",
            "@size": "192",
            "@ref": "si6",
            "@mimetype": "image/gif"
          },
          {
            "@category": "thumbnail",
            "@height": "14",
            "@width": "25",
            "@_fa": "true",
            "$": "https://api.elsevier.com/content/object/eid/1-s2.0-S1381116902002224-si5.gif?httpAccept=%2A%2F%2A",
            "@multimediatype": "GIF image file",
            "@type": "ALTIMG",
            "@size": "192",
            "@ref": "si5",
            "@mimetype": "image/gif"
          },
          {
            "@category": "thumbnail",
            "@height": "14",
            "@width": "25",
            "@_fa": "true",
            "$": "https://api.elsevier.com/content/object/eid/1-s2.0-S1381116902002224-si4.gif?httpAccept=%2A%2F%2A",
            "@multimediatype": "GIF image file",
            "@type": "ALTIMG",
            "@size": "192",
            "@ref": "si4",
            "@mimetype": "image/gif"
          },
          {
            "@category": "thumbnail",
            "@height": "14",
            "@width": "25",
            "@_fa": "true",
            "$": "https://api.elsevier.com/content/object/eid/1-s2.0-S1381116902002224-si3.gif?httpAccept=%2A%2F%2A",
            "@multimediatype": "GIF image file",
            "@type": "ALTIMG",
            "@size": "192",
            "@ref": "si3",
            "@mimetype": "image/gif"
          },
          {
            "@category": "thumbnail",
            "@height": "14",
            "@width": "25",
            "@_fa": "true",
            "$": "https://api.elsevier.com/content/object/eid/1-s2.0-S1381116902002224-si23.gif?httpAccept=%2A%2F%2A",
            "@multimediatype": "GIF image file",
            "@type": "ALTIMG",
            "@size": "192",
            "@ref": "si23",
            "@mimetype": "image/gif"
          },
          {
            "@category": "thumbnail",
            "@height": "14",
            "@width": "20",
            "@_fa": "true",
            "$": "https://api.elsevier.com/content/object/eid/1-s2.0-S1381116902002224-si22.gif?httpAccept=%2A%2F%2A",
            "@multimediatype": "GIF image file",
            "@type": "ALTIMG",
            "@size": "149",
            "@ref": "si22",
            "@mimetype": "image/gif"
          },
          {
            "@category": "thumbnail",
            "@height": "13",
            "@width": "89",
            "@_fa": "true",
            "$": "https://api.elsevier.com/content/object/eid/1-s2.0-S1381116902002224-si21.gif?httpAccept=%2A%2F%2A",
            "@multimediatype": "GIF image file",
            "@type": "ALTIMG",
            "@size": "476",
            "@ref": "si21",
            "@mimetype": "image/gif"
          },
          {
            "@category": "thumbnail",
            "@height": "14",
            "@width": "25",
            "@_fa": "true",
            "$": "https://api.elsevier.com/content/object/eid/1-s2.0-S1381116902002224-si20.gif?httpAccept=%2A%2F%2A",
            "@multimediatype": "GIF image file",
            "@type": "ALTIMG",
            "@size": "192",
            "@ref": "si20",
            "@mimetype": "image/gif"
          },
          {
            "@category": "thumbnail",
            "@height": "14",
            "@width": "25",
            "@_fa": "true",
            "$": "https://api.elsevier.com/content/object/eid/1-s2.0-S1381116902002224-si2.gif?httpAccept=%2A%2F%2A",
            "@multimediatype": "GIF image file",
            "@type": "ALTIMG",
            "@size": "192",
            "@ref": "si2",
            "@mimetype": "image/gif"
          },
          {
            "@category": "thumbnail",
            "@height": "14",
            "@width": "25",
            "@_fa": "true",
            "$": "https://api.elsevier.com/content/object/eid/1-s2.0-S1381116902002224-si19.gif?httpAccept=%2A%2F%2A",
            "@multimediatype": "GIF image file",
            "@type": "ALTIMG",
            "@size": "192",
            "@ref": "si19",
            "@mimetype": "image/gif"
          },
          {
            "@category": "thumbnail",
            "@height": "14",
            "@width": "20",
            "@_fa": "true",
            "$": "https://api.elsevier.com/content/object/eid/1-s2.0-S1381116902002224-si18.gif?httpAccept=%2A%2F%2A",
            "@multimediatype": "GIF image file",
            "@type": "ALTIMG",
            "@size": "149",
            "@ref": "si18",
            "@mimetype": "image/gif"
          },
          {
            "@category": "thumbnail",
            "@height": "14",
            "@width": "25",
            "@_fa": "true",
            "$": "https://api.elsevier.com/content/object/eid/1-s2.0-S1381116902002224-si17.gif?httpAccept=%2A%2F%2A",
            "@multimediatype": "GIF image file",
            "@type": "ALTIMG",
            "@size": "192",
            "@ref": "si17",
            "@mimetype": "image/gif"
          },
          {
            "@category": "thumbnail",
            "@height": "14",
            "@width": "20",
            "@_fa": "true",
            "$": "https://api.elsevier.com/content/object/eid/1-s2.0-S1381116902002224-si16.gif?httpAccept=%2A%2F%2A",
            "@multimediatype": "GIF image file",
            "@type": "ALTIMG",
            "@size": "149",
            "@ref": "si16",
            "@mimetype": "image/gif"
          },
          {
            "@category": "thumbnail",
            "@height": "14",
            "@width": "25",
            "@_fa": "true",
            "$": "https://api.elsevier.com/content/object/eid/1-s2.0-S1381116902002224-si15.gif?httpAccept=%2A%2F%2A",
            "@multimediatype": "GIF image file",
            "@type": "ALTIMG",
            "@size": "192",
            "@ref": "si15",
            "@mimetype": "image/gif"
          },
          {
            "@category": "thumbnail",
            "@height": "14",
            "@width": "20",
            "@_fa": "true",
            "$": "https://api.elsevier.com/content/object/eid/1-s2.0-S1381116902002224-si14.gif?httpAccept=%2A%2F%2A",
            "@multimediatype": "GIF image file",
            "@type": "ALTIMG",
            "@size": "149",
            "@ref": "si14",
            "@mimetype": "image/gif"
          },
          {
            "@category": "thumbnail",
            "@height": "14",
            "@width": "25",
            "@_fa": "true",
            "$": "https://api.elsevier.com/content/object/eid/1-s2.0-S1381116902002224-si13.gif?httpAccept=%2A%2F%2A",
            "@multimediatype": "GIF image file",
            "@type": "ALTIMG",
            "@size": "192",
            "@ref": "si13",
            "@mimetype": "image/gif"
          },
          {
            "@category": "thumbnail",
            "@height": "14",
            "@width": "20",
            "@_fa": "true",
            "$": "https://api.elsevier.com/content/object/eid/1-s2.0-S1381116902002224-si12.gif?httpAccept=%2A%2F%2A",
            "@multimediatype": "GIF image file",
            "@type": "ALTIMG",
            "@size": "149",
            "@ref": "si12",
            "@mimetype": "image/gif"
          },
          {
            "@category": "thumbnail",
            "@height": "14",
            "@width": "25",
            "@_fa": "true",
            "$": "https://api.elsevier.com/content/object/eid/1-s2.0-S1381116902002224-si11.gif?httpAccept=%2A%2F%2A",
            "@multimediatype": "GIF image file",
            "@type": "ALTIMG",
            "@size": "192",
            "@ref": "si11",
            "@mimetype": "image/gif"
          },
          {
            "@category": "thumbnail",
            "@height": "14",
            "@width": "20",
            "@_fa": "true",
            "$": "https://api.elsevier.com/content/object/eid/1-s2.0-S1381116902002224-si10.gif?httpAccept=%2A%2F%2A",
            "@multimediatype": "GIF image file",
            "@type": "ALTIMG",
            "@size": "149",
            "@ref": "si10",
            "@mimetype": "image/gif"
          },
          {
            "@category": "thumbnail",
            "@height": "14",
            "@width": "20",
            "@_fa": "true",
            "$": "https://api.elsevier.com/content/object/eid/1-s2.0-S1381116902002224-si1.gif?httpAccept=%2A%2F%2A",
            "@multimediatype": "GIF image file",
            "@type": "ALTIMG",
            "@size": "149",
            "@ref": "si1",
            "@mimetype": "image/gif"
          },
          {
            "@category": "thumbnail",
            "@height": "43",
            "@width": "125",
            "@_fa": "true",
            "$": "https://api.elsevier.com/content/object/eid/1-s2.0-S1381116902002224-fx1.sml?httpAccept=%2A%2F%2A",
            "@multimediatype": "GIF image file",
            "@type": "IMAGE-THUMBNAIL",
            "@size": "817",
            "@ref": "fx1",
            "@mimetype": "image/gif"
          },
          {
            "@category": "standard",
            "@height": "170",
            "@width": "497",
            "@_fa": "true",
            "$": "https://api.elsevier.com/content/object/eid/1-s2.0-S1381116902002224-fx1.gif?httpAccept=%2A%2F%2A",
            "@multimediatype": "GIF image file",
            "@type": "IMAGE-DOWNSAMPLED",
            "@size": "5758",
            "@ref": "fx1",
            "@mimetype": "image/gif"
          },
          {
            "@category": "thumbnail",
            "@height": "51",
            "@width": "125",
            "@_fa": "true",
            "$": "https://api.elsevier.com/content/object/eid/1-s2.0-S1381116902002224-fx2.sml?httpAccept=%2A%2F%2A",
            "@multimediatype": "GIF image file",
            "@type": "IMAGE-THUMBNAIL",
            "@size": "948",
            "@ref": "fx2",
            "@mimetype": "image/gif"
          },
          {
            "@category": "standard",
            "@height": "138",
            "@width": "339",
            "@_fa": "true",
            "$": "https://api.elsevier.com/content/object/eid/1-s2.0-S1381116902002224-fx2.gif?httpAccept=%2A%2F%2A",
            "@multimediatype": "GIF image file",
            "@type": "IMAGE-DOWNSAMPLED",
            "@size": "3397",
            "@ref": "fx2",
            "@mimetype": "image/gif"
          },
          {
            "@category": "thumbnail",
            "@height": "94",
            "@width": "95",
            "@_fa": "true",
            "$": "https://api.elsevier.com/content/object/eid/1-s2.0-S1381116902002224-fx3.sml?httpAccept=%2A%2F%2A",
            "@multimediatype": "GIF image file",
            "@type": "IMAGE-THUMBNAIL",
            "@size": "1556",
            "@ref": "fx3",
            "@mimetype": "image/gif"
          },
          {
            "@category": "standard",
            "@height": "130",
            "@width": "132",
            "@_fa": "true",
            "$": "https://api.elsevier.com/content/object/eid/1-s2.0-S1381116902002224-fx3.gif?httpAccept=%2A%2F%2A",
            "@multimediatype": "GIF image file",
            "@type": "IMAGE-DOWNSAMPLED",
            "@size": "2127",
            "@ref": "fx3",
            "@mimetype": "image/gif"
          },
          {
            "@category": "thumbnail",
            "@height": "63",
            "@width": "125",
            "@_fa": "true",
            "$": "https://api.elsevier.com/content/object/eid/1-s2.0-S1381116902002224-fx4.sml?httpAccept=%2A%2F%2A",
            "@multimediatype": "GIF image file",
            "@type": "IMAGE-THUMBNAIL",
            "@size": "901",
            "@ref": "fx4",
            "@mimetype": "image/gif"
          },
          {
            "@category": "standard",
            "@height": "172",
            "@width": "339",
            "@_fa": "true",
            "$": "https://api.elsevier.com/content/object/eid/1-s2.0-S1381116902002224-fx4.gif?httpAccept=%2A%2F%2A",
            "@multimediatype": "GIF image file",
            "@type": "IMAGE-DOWNSAMPLED",
            "@size": "3750",
            "@ref": "fx4",
            "@mimetype": "image/gif"
          },
          {
            "@category": "thumbnail",
            "@height": "21",
            "@width": "125",
            "@_fa": "true",
            "$": "https://api.elsevier.com/content/object/eid/1-s2.0-S1381116902002224-sc1.sml?httpAccept=%2A%2F%2A",
            "@multimediatype": "GIF image file",
            "@type": "IMAGE-THUMBNAIL",
            "@size": "503",
            "@ref": "sc1",
            "@mimetype": "image/gif"
          },
          {
            "@category": "standard",
            "@height": "101",
            "@width": "602",
            "@_fa": "true",
            "$": "https://api.elsevier.com/content/object/eid/1-s2.0-S1381116902002224-sc1.gif?httpAccept=%2A%2F%2A",
            "@multimediatype": "GIF image file",
            "@type": "IMAGE-DOWNSAMPLED",
            "@size": "4526",
            "@ref": "sc1",
            "@mimetype": "image/gif"
          },
          {
            "@category": "thumbnail",
            "@height": "36",
            "@width": "125",
            "@_fa": "true",
            "$": "https://api.elsevier.com/content/object/eid/1-s2.0-S1381116902002224-fx5.sml?httpAccept=%2A%2F%2A",
            "@multimediatype": "GIF image file",
            "@type": "IMAGE-THUMBNAIL",
            "@size": "957",
            "@ref": "fx5",
            "@mimetype": "image/gif"
          },
          {
            "@category": "standard",
            "@height": "83",
            "@width": "288",
            "@_fa": "true",
            "$": "https://api.elsevier.com/content/object/eid/1-s2.0-S1381116902002224-fx5.gif?httpAccept=%2A%2F%2A",
            "@multimediatype": "GIF image file",
            "@type": "IMAGE-DOWNSAMPLED",
            "@size": "2798",
            "@ref": "fx5",
            "@mimetype": "image/gif"
          },
          {
            "@category": "thumbnail",
            "@height": "60",
            "@width": "125",
            "@_fa": "true",
            "$": "https://api.elsevier.com/content/object/eid/1-s2.0-S1381116902002224-fx6.sml?httpAccept=%2A%2F%2A",
            "@multimediatype": "GIF image file",
            "@type": "IMAGE-THUMBNAIL",
            "@size": "947",
            "@ref": "fx6",
            "@mimetype": "image/gif"
          },
          {
            "@category": "standard",
            "@height": "50",
            "@width": "104",
            "@_fa": "true",
            "$": "https://api.elsevier.com/content/object/eid/1-s2.0-S1381116902002224-fx6.gif?httpAccept=%2A%2F%2A",
            "@multimediatype": "GIF image file",
            "@type": "IMAGE-DOWNSAMPLED",
            "@size": "862",
            "@ref": "fx6",
            "@mimetype": "image/gif"
          },
          {
            "@category": "thumbnail",
            "@height": "32",
            "@width": "125",
            "@_fa": "true",
            "$": "https://api.elsevier.com/content/object/eid/1-s2.0-S1381116902002224-sc2.sml?httpAccept=%2A%2F%2A",
            "@multimediatype": "GIF image file",
            "@type": "IMAGE-THUMBNAIL",
            "@size": "566",
            "@ref": "sc2",
            "@mimetype": "image/gif"
          },
          {
            "@category": "standard",
            "@height": "86",
            "@width": "339",
            "@_fa": "true",
            "$": "https://api.elsevier.com/content/object/eid/1-s2.0-S1381116902002224-sc2.gif?httpAccept=%2A%2F%2A",
            "@multimediatype": "GIF image file",
            "@type": "IMAGE-DOWNSAMPLED",
            "@size": "2149",
            "@ref": "sc2",
            "@mimetype": "image/gif"
          },
          {
            "@category": "thumbnail",
            "@height": "27",
            "@width": "125",
            "@_fa": "true",
            "$": "https://api.elsevier.com/content/object/eid/1-s2.0-S1381116902002224-sc3.sml?httpAccept=%2A%2F%2A",
            "@multimediatype": "GIF image file",
            "@type": "IMAGE-THUMBNAIL",
            "@size": "626",
            "@ref": "sc3",
            "@mimetype": "image/gif"
          },
          {
            "@category": "standard",
            "@height": "84",
            "@width": "395",
            "@_fa": "true",
            "$": "https://api.elsevier.com/content/object/eid/1-s2.0-S1381116902002224-sc3.gif?httpAccept=%2A%2F%2A",
            "@multimediatype": "GIF image file",
            "@type": "IMAGE-DOWNSAMPLED",
            "@size": "2981",
            "@ref": "sc3",
            "@mimetype": "image/gif"
          }
        ]
      },
      "link": {
        "@rel": "abstract",
        "@href": "https://api.elsevier.com/content/abstract/scopus_id/0037010853"
      }
    }
  }
}