{
  "metadata": {
    "title": "2,4,6-Trimethylphenol oxidation with ferrous chloride catalyst: Effect of acetoxime addition",
    "authors": "; ",
    "journal": "Journal of Molecular Catalysis A: Chemical",
    "date": "2005-11-01",
    "doi": "10.1016/j.molcata.2005.06.062",
    "abstract": "",
    "uri": "https://api.elsevier.com/content/article/pii/S1381116905004644",
    "pii": "S1381116905004644"
  },
  "fulltext": {
    "full-text-retrieval-response": {
      "scopus-eid": "2-s2.0-25844443428",
      "originalText": "serial JL 271358 291210 291744 291790 291809 31 Journal of Molecular Catalysis A: Chemical JOURNALMOLECULARCATALYSISACHEMICAL 2005-08-10 2005-08-10 2010-04-19T04:56:56 1-s2.0-S1381116905004644 S1381-1169(05)00464-4 S1381116905004644 10.1016/j.molcata.2005.06.062 S300 S300.1 FULL-TEXT 1-s2.0-S1381116905X02217 2015-05-15T05:56:33.000448-04:00 0 0 20051101 2005 2005-08-10T00:00:00Z articleinfo crossmark dco dateupdated tomb dateloaded datesearch indexeddate issuelist volumelist yearnav absattachment articletitlenorm authfirstinitialnorm authfirstsurnamenorm cid cids contenttype copyright dateloadedtxt docsubtype doctype doi eid ewtransactionid hubeid issfirst issn issnnorm itemstage itemtransactionid itemweight openaccess openarchive pg pgfirst pglast pii piinorm pubdatestart pubdatetxt pubyr sortorder srctitle srctitlenorm srctype subheadings volfirst volissue webpdf webpdfpagecount figure body mmlmath acknowledge affil articletitle auth authfirstini authfull authkeywords authlast primabst ref specialabst alllist content subj ssids 1381-1169 13811169 241 241 1 2 1 2 Volume 241, Issues 1–2 12 72 78 72 78 20051101 1 November 2005 2005-11-01 2005 article fla Copyright © 2005 Elsevier B.V. All rights reserved. 246TRIMETHYLPHENOLOXIDATIONFERROUSCHLORIDECATALYSTEFFECTACETOXIMEADDITION LI K 1 Introduction 2 Experimental 3 Results and discussion 4 Conclusions Acknowledgement References AYCOCK 1989 1 30 D ENCYCLOPEDIAPOLYMERENGINEERINGSCIENCE HAY 1962 581 A LI 1994 1107 K LI 1995 419 K LI 1996 3213 K LI 1993 1007 K TAKEHIRA 1990 2607 K SHIMIZU 1993 251 M TAKAKI 2002 311 K LI 2004 167 K WULFSBERG 2000 G INORGANICCHEMISTRY TYSON 1972 939 C SIMANDI 1998 3275 L SIMANDI 1999 4529 T HENDRIKS 1978 256 C GIRERD 2000 J METALOXOMETALPEROXOSPECIESINCATALYTICOXIDATIONS KOCHI 1991 849 889 J COMPREHENSIVEORGANICSYNTHESIS KUKUSHKIN 1996 333 V KAMINSKAIA 2001 1083 N SHELDON 1988 243 256 R ROLEOXYGENINCHEMISTRYBIOCHEMISTRY DEAN 1973 J LANGESHANDBOOKCHEMISTRY HANAI 2000 363 T LIX2005X72 LIX2005X72X78 LIX2005X72XK LIX2005X72X78XK item S1381-1169(05)00464-4 S1381116905004644 1-s2.0-S1381116905004644 10.1016/j.molcata.2005.06.062 271358 2010-10-10T21:05:11.937311-04:00 2005-11-01 1-s2.0-S1381116905004644-main.pdf https://s3.amazonaws.com/prod-ucs-content-store-us-east/content/pii:S1381116905004644/MAIN/application/pdf/f8a64152098f356a6e08080467919f13/main.pdf https://s3-eu-west-1.amazonaws.com/prod-ucs-content-store-eu-west/content/pii:S1381116905004644/MAIN/application/pdf/f8a64152098f356a6e08080467919f13/main.pdf main.pdf pdf true 323368 MAIN 7 1-s2.0-S1381116905004644-main_1.png https://s3.amazonaws.com/prod-ucs-content-store-us-east/content/pii:S1381116905004644/PREVIEW/image/png/32208d399ab9822d75e2bc9d9720bbb8/main_1.png https://s3-eu-west-1.amazonaws.com/prod-ucs-content-store-eu-west/content/pii:S1381116905004644/PREVIEW/image/png/32208d399ab9822d75e2bc9d9720bbb8/main_1.png main_1.png png 62527 849 656 IMAGE-WEB-PDF 1 1-s2.0-S1381116905004644-si20.gif https://s3.amazonaws.com/prod-ucs-content-store-us-east/content/pii:S1381116905004644/STRIPIN/image/gif/0a07e1d485788dc14337f9299d60b1f0/si20.gif https://s3-eu-west-1.amazonaws.com/prod-ucs-content-store-eu-west/content/pii:S1381116905004644/STRIPIN/image/gif/0a07e1d485788dc14337f9299d60b1f0/si20.gif si20 si20.gif gif 1104 29 292 ALTIMG 1-s2.0-S1381116905004644-si19.gif https://s3.amazonaws.com/prod-ucs-content-store-us-east/content/pii:S1381116905004644/STRIPIN/image/gif/dda14f70f91ed26364ba180b7bedb3d1/si19.gif https://s3-eu-west-1.amazonaws.com/prod-ucs-content-store-eu-west/content/pii:S1381116905004644/STRIPIN/image/gif/dda14f70f91ed26364ba180b7bedb3d1/si19.gif si19 si19.gif gif 1542 60 327 ALTIMG 1-s2.0-S1381116905004644-si18.gif https://s3.amazonaws.com/prod-ucs-content-store-us-east/content/pii:S1381116905004644/STRIPIN/image/gif/b9bb8474df8ecec40f5a5f94a79c4201/si18.gif https://s3-eu-west-1.amazonaws.com/prod-ucs-content-store-eu-west/content/pii:S1381116905004644/STRIPIN/image/gif/b9bb8474df8ecec40f5a5f94a79c4201/si18.gif si18 si18.gif gif 969 28 235 ALTIMG 1-s2.0-S1381116905004644-si17.gif https://s3.amazonaws.com/prod-ucs-content-store-us-east/content/pii:S1381116905004644/STRIPIN/image/gif/b616637530e41505b2a7ac956a9453fe/si17.gif https://s3-eu-west-1.amazonaws.com/prod-ucs-content-store-eu-west/content/pii:S1381116905004644/STRIPIN/image/gif/b616637530e41505b2a7ac956a9453fe/si17.gif si17 si17.gif gif 588 13 165 ALTIMG 1-s2.0-S1381116905004644-si16.gif https://s3.amazonaws.com/prod-ucs-content-store-us-east/content/pii:S1381116905004644/STRIPIN/image/gif/234c9ea91abb2f7e1f60a51d1cf67ae4/si16.gif https://s3-eu-west-1.amazonaws.com/prod-ucs-content-store-eu-west/content/pii:S1381116905004644/STRIPIN/image/gif/234c9ea91abb2f7e1f60a51d1cf67ae4/si16.gif si16 si16.gif gif 867 17 253 ALTIMG 1-s2.0-S1381116905004644-si15.gif https://s3.amazonaws.com/prod-ucs-content-store-us-east/content/pii:S1381116905004644/STRIPIN/image/gif/4107b964db6cc2d5b7a13698c5ebf421/si15.gif https://s3-eu-west-1.amazonaws.com/prod-ucs-content-store-eu-west/content/pii:S1381116905004644/STRIPIN/image/gif/4107b964db6cc2d5b7a13698c5ebf421/si15.gif si15 si15.gif gif 704 17 205 ALTIMG 1-s2.0-S1381116905004644-si14.gif https://s3.amazonaws.com/prod-ucs-content-store-us-east/content/pii:S1381116905004644/STRIPIN/image/gif/125734d0c756f1b3698e2bbd37c29e85/si14.gif https://s3-eu-west-1.amazonaws.com/prod-ucs-content-store-eu-west/content/pii:S1381116905004644/STRIPIN/image/gif/125734d0c756f1b3698e2bbd37c29e85/si14.gif si14 si14.gif gif 449 15 95 ALTIMG 1-s2.0-S1381116905004644-si13.gif https://s3.amazonaws.com/prod-ucs-content-store-us-east/content/pii:S1381116905004644/STRIPIN/image/gif/1a44048f1e04b7f59156e8c5f4c48830/si13.gif https://s3-eu-west-1.amazonaws.com/prod-ucs-content-store-eu-west/content/pii:S1381116905004644/STRIPIN/image/gif/1a44048f1e04b7f59156e8c5f4c48830/si13.gif si13 si13.gif gif 1108 38 168 ALTIMG 1-s2.0-S1381116905004644-si12.gif https://s3.amazonaws.com/prod-ucs-content-store-us-east/content/pii:S1381116905004644/STRIPIN/image/gif/54dbcf3827cfd553eff3e6e313809dcd/si12.gif https://s3-eu-west-1.amazonaws.com/prod-ucs-content-store-eu-west/content/pii:S1381116905004644/STRIPIN/image/gif/54dbcf3827cfd553eff3e6e313809dcd/si12.gif si12 si12.gif gif 575 20 170 ALTIMG 1-s2.0-S1381116905004644-si11.gif https://s3.amazonaws.com/prod-ucs-content-store-us-east/content/pii:S1381116905004644/STRIPIN/image/gif/ef966b7924f1b253e8f87ccb8b377ddc/si11.gif https://s3-eu-west-1.amazonaws.com/prod-ucs-content-store-eu-west/content/pii:S1381116905004644/STRIPIN/image/gif/ef966b7924f1b253e8f87ccb8b377ddc/si11.gif si11 si11.gif gif 1081 38 159 ALTIMG 1-s2.0-S1381116905004644-si10.gif https://s3.amazonaws.com/prod-ucs-content-store-us-east/content/pii:S1381116905004644/STRIPIN/image/gif/a01f7f23c0df0aef69d799aee4b83694/si10.gif https://s3-eu-west-1.amazonaws.com/prod-ucs-content-store-eu-west/content/pii:S1381116905004644/STRIPIN/image/gif/a01f7f23c0df0aef69d799aee4b83694/si10.gif si10 si10.gif gif 815 19 201 ALTIMG 1-s2.0-S1381116905004644-si9.gif https://s3.amazonaws.com/prod-ucs-content-store-us-east/content/pii:S1381116905004644/STRIPIN/image/gif/82972016b5ff055de251684fc8cd979f/si9.gif https://s3-eu-west-1.amazonaws.com/prod-ucs-content-store-eu-west/content/pii:S1381116905004644/STRIPIN/image/gif/82972016b5ff055de251684fc8cd979f/si9.gif si9 si9.gif gif 363 13 91 ALTIMG 1-s2.0-S1381116905004644-si8.gif https://s3.amazonaws.com/prod-ucs-content-store-us-east/content/pii:S1381116905004644/STRIPIN/image/gif/0cfd52962df35af9f660c4b830ec9282/si8.gif https://s3-eu-west-1.amazonaws.com/prod-ucs-content-store-eu-west/content/pii:S1381116905004644/STRIPIN/image/gif/0cfd52962df35af9f660c4b830ec9282/si8.gif si8 si8.gif gif 531 17 168 ALTIMG 1-s2.0-S1381116905004644-si7.gif https://s3.amazonaws.com/prod-ucs-content-store-us-east/content/pii:S1381116905004644/STRIPIN/image/gif/c4ce785e9ab2746ff05b86bf05fbc099/si7.gif https://s3-eu-west-1.amazonaws.com/prod-ucs-content-store-eu-west/content/pii:S1381116905004644/STRIPIN/image/gif/c4ce785e9ab2746ff05b86bf05fbc099/si7.gif si7 si7.gif gif 1202 29 299 ALTIMG 1-s2.0-S1381116905004644-si6.gif https://s3.amazonaws.com/prod-ucs-content-store-us-east/content/pii:S1381116905004644/STRIPIN/image/gif/5c34bebbcdef3f9e8bdc995135cc78c6/si6.gif https://s3-eu-west-1.amazonaws.com/prod-ucs-content-store-eu-west/content/pii:S1381116905004644/STRIPIN/image/gif/5c34bebbcdef3f9e8bdc995135cc78c6/si6.gif si6 si6.gif gif 1559 35 318 ALTIMG 1-s2.0-S1381116905004644-si5.gif https://s3.amazonaws.com/prod-ucs-content-store-us-east/content/pii:S1381116905004644/STRIPIN/image/gif/e4995c25c732447c2a149b4dcbe1460e/si5.gif https://s3-eu-west-1.amazonaws.com/prod-ucs-content-store-eu-west/content/pii:S1381116905004644/STRIPIN/image/gif/e4995c25c732447c2a149b4dcbe1460e/si5.gif si5 si5.gif gif 1631 51 308 ALTIMG 1-s2.0-S1381116905004644-si4.gif https://s3.amazonaws.com/prod-ucs-content-store-us-east/content/pii:S1381116905004644/STRIPIN/image/gif/026bb8939b82315eb4359c6b517f5fc2/si4.gif https://s3-eu-west-1.amazonaws.com/prod-ucs-content-store-eu-west/content/pii:S1381116905004644/STRIPIN/image/gif/026bb8939b82315eb4359c6b517f5fc2/si4.gif si4 si4.gif gif 1555 71 326 ALTIMG 1-s2.0-S1381116905004644-si3.gif https://s3.amazonaws.com/prod-ucs-content-store-us-east/content/pii:S1381116905004644/STRIPIN/image/gif/326ebb9daa151e60b2490cf8c93b0972/si3.gif https://s3-eu-west-1.amazonaws.com/prod-ucs-content-store-eu-west/content/pii:S1381116905004644/STRIPIN/image/gif/326ebb9daa151e60b2490cf8c93b0972/si3.gif si3 si3.gif gif 1953 69 314 ALTIMG 1-s2.0-S1381116905004644-si2.gif https://s3.amazonaws.com/prod-ucs-content-store-us-east/content/pii:S1381116905004644/STRIPIN/image/gif/13b2706f22f5ed58a5caf959f028a4b9/si2.gif https://s3-eu-west-1.amazonaws.com/prod-ucs-content-store-eu-west/content/pii:S1381116905004644/STRIPIN/image/gif/13b2706f22f5ed58a5caf959f028a4b9/si2.gif si2 si2.gif gif 243 11 55 ALTIMG 1-s2.0-S1381116905004644-si1.gif https://s3.amazonaws.com/prod-ucs-content-store-us-east/content/pii:S1381116905004644/STRIPIN/image/gif/a8afc5c57b37e434216f5da9f78e028e/si1.gif https://s3-eu-west-1.amazonaws.com/prod-ucs-content-store-eu-west/content/pii:S1381116905004644/STRIPIN/image/gif/a8afc5c57b37e434216f5da9f78e028e/si1.gif si1 si1.gif gif 689 37 121 ALTIMG 1-s2.0-S1381116905004644-gr2.jpg https://s3.amazonaws.com/prod-ucs-content-store-us-east/content/pii:S1381116905004644/gr2/DOWNSAMPLED/image/jpeg/38f80d85e759c255602527b5855116a2/gr2.jpg https://s3-eu-west-1.amazonaws.com/prod-ucs-content-store-eu-west/content/pii:S1381116905004644/gr2/DOWNSAMPLED/image/jpeg/38f80d85e759c255602527b5855116a2/gr2.jpg gr2 gr2.jpg jpg 15790 242 329 IMAGE-DOWNSAMPLED 1-s2.0-S1381116905004644-gr2.sml https://s3.amazonaws.com/prod-ucs-content-store-us-east/content/pii:S1381116905004644/gr2/THUMBNAIL/image/gif/ae278a8b8b67c3068815a4256723df80/gr2.sml https://s3-eu-west-1.amazonaws.com/prod-ucs-content-store-eu-west/content/pii:S1381116905004644/gr2/THUMBNAIL/image/gif/ae278a8b8b67c3068815a4256723df80/gr2.sml gr2 gr2.sml sml 2363 92 125 IMAGE-THUMBNAIL 1-s2.0-S1381116905004644-gr9.jpg https://s3.amazonaws.com/prod-ucs-content-store-us-east/content/pii:S1381116905004644/gr9/DOWNSAMPLED/image/jpeg/9f4ac8ff6303cc0ebcaab322845cf0b8/gr9.jpg https://s3-eu-west-1.amazonaws.com/prod-ucs-content-store-eu-west/content/pii:S1381116905004644/gr9/DOWNSAMPLED/image/jpeg/9f4ac8ff6303cc0ebcaab322845cf0b8/gr9.jpg gr9 gr9.jpg jpg 15479 199 336 IMAGE-DOWNSAMPLED 1-s2.0-S1381116905004644-gr9.sml https://s3.amazonaws.com/prod-ucs-content-store-us-east/content/pii:S1381116905004644/gr9/THUMBNAIL/image/gif/050be286be530cfcecced1f39e939316/gr9.sml https://s3-eu-west-1.amazonaws.com/prod-ucs-content-store-eu-west/content/pii:S1381116905004644/gr9/THUMBNAIL/image/gif/050be286be530cfcecced1f39e939316/gr9.sml gr9 gr9.sml sml 2378 74 125 IMAGE-THUMBNAIL 1-s2.0-S1381116905004644-gr6.jpg https://s3.amazonaws.com/prod-ucs-content-store-us-east/content/pii:S1381116905004644/gr6/DOWNSAMPLED/image/jpeg/0f54541a6641ac02f3c43c5ca4be7a30/gr6.jpg https://s3-eu-west-1.amazonaws.com/prod-ucs-content-store-eu-west/content/pii:S1381116905004644/gr6/DOWNSAMPLED/image/jpeg/0f54541a6641ac02f3c43c5ca4be7a30/gr6.jpg gr6 gr6.jpg jpg 22633 238 322 IMAGE-DOWNSAMPLED 1-s2.0-S1381116905004644-gr6.sml https://s3.amazonaws.com/prod-ucs-content-store-us-east/content/pii:S1381116905004644/gr6/THUMBNAIL/image/gif/d542266e5b3d19a49c2aaed5b8e1cd09/gr6.sml https://s3-eu-west-1.amazonaws.com/prod-ucs-content-store-eu-west/content/pii:S1381116905004644/gr6/THUMBNAIL/image/gif/d542266e5b3d19a49c2aaed5b8e1cd09/gr6.sml gr6 gr6.sml sml 2306 92 125 IMAGE-THUMBNAIL 1-s2.0-S1381116905004644-fx2.gif https://s3.amazonaws.com/prod-ucs-content-store-us-east/content/pii:S1381116905004644/fx2/DOWNSAMPLED/image/gif/516460ec11a5c1991eddf5613ed64c35/fx2.gif https://s3-eu-west-1.amazonaws.com/prod-ucs-content-store-eu-west/content/pii:S1381116905004644/fx2/DOWNSAMPLED/image/gif/516460ec11a5c1991eddf5613ed64c35/fx2.gif fx2 fx2.gif gif 3819 136 376 IMAGE-DOWNSAMPLED 1-s2.0-S1381116905004644-fx2.sml https://s3.amazonaws.com/prod-ucs-content-store-us-east/content/pii:S1381116905004644/fx2/THUMBNAIL/image/gif/5db3030077067962c958f1daf4e87c4b/fx2.sml https://s3-eu-west-1.amazonaws.com/prod-ucs-content-store-eu-west/content/pii:S1381116905004644/fx2/THUMBNAIL/image/gif/5db3030077067962c958f1daf4e87c4b/fx2.sml fx2 fx2.sml sml 800 45 125 IMAGE-THUMBNAIL 1-s2.0-S1381116905004644-gr3.jpg https://s3.amazonaws.com/prod-ucs-content-store-us-east/content/pii:S1381116905004644/gr3/DOWNSAMPLED/image/jpeg/28a0e64dc1259b2d24106fc7517da07b/gr3.jpg https://s3-eu-west-1.amazonaws.com/prod-ucs-content-store-eu-west/content/pii:S1381116905004644/gr3/DOWNSAMPLED/image/jpeg/28a0e64dc1259b2d24106fc7517da07b/gr3.jpg gr3 gr3.jpg jpg 14652 239 324 IMAGE-DOWNSAMPLED 1-s2.0-S1381116905004644-gr3.sml https://s3.amazonaws.com/prod-ucs-content-store-us-east/content/pii:S1381116905004644/gr3/THUMBNAIL/image/gif/45f2a190ca2db985e4353079105b9112/gr3.sml https://s3-eu-west-1.amazonaws.com/prod-ucs-content-store-eu-west/content/pii:S1381116905004644/gr3/THUMBNAIL/image/gif/45f2a190ca2db985e4353079105b9112/gr3.sml gr3 gr3.sml sml 2272 92 125 IMAGE-THUMBNAIL 1-s2.0-S1381116905004644-gr4.jpg https://s3.amazonaws.com/prod-ucs-content-store-us-east/content/pii:S1381116905004644/gr4/DOWNSAMPLED/image/jpeg/d6ce10024576f5102f3ab0cd9fc27907/gr4.jpg https://s3-eu-west-1.amazonaws.com/prod-ucs-content-store-eu-west/content/pii:S1381116905004644/gr4/DOWNSAMPLED/image/jpeg/d6ce10024576f5102f3ab0cd9fc27907/gr4.jpg gr4 gr4.jpg jpg 16963 241 327 IMAGE-DOWNSAMPLED 1-s2.0-S1381116905004644-gr4.sml https://s3.amazonaws.com/prod-ucs-content-store-us-east/content/pii:S1381116905004644/gr4/THUMBNAIL/image/gif/a6f4b3e526f1eaf295754c2a746838bd/gr4.sml https://s3-eu-west-1.amazonaws.com/prod-ucs-content-store-eu-west/content/pii:S1381116905004644/gr4/THUMBNAIL/image/gif/a6f4b3e526f1eaf295754c2a746838bd/gr4.sml gr4 gr4.sml sml 2407 92 125 IMAGE-THUMBNAIL 1-s2.0-S1381116905004644-gr8.jpg https://s3.amazonaws.com/prod-ucs-content-store-us-east/content/pii:S1381116905004644/gr8/DOWNSAMPLED/image/jpeg/3bd69769d2eaa22ae4b827b3a7e562f0/gr8.jpg https://s3-eu-west-1.amazonaws.com/prod-ucs-content-store-eu-west/content/pii:S1381116905004644/gr8/DOWNSAMPLED/image/jpeg/3bd69769d2eaa22ae4b827b3a7e562f0/gr8.jpg gr8 gr8.jpg jpg 12672 241 332 IMAGE-DOWNSAMPLED 1-s2.0-S1381116905004644-gr8.sml https://s3.amazonaws.com/prod-ucs-content-store-us-east/content/pii:S1381116905004644/gr8/THUMBNAIL/image/gif/7131ae21172a4543fd0c45e3045759e3/gr8.sml https://s3-eu-west-1.amazonaws.com/prod-ucs-content-store-eu-west/content/pii:S1381116905004644/gr8/THUMBNAIL/image/gif/7131ae21172a4543fd0c45e3045759e3/gr8.sml gr8 gr8.sml sml 2023 91 125 IMAGE-THUMBNAIL 1-s2.0-S1381116905004644-gr7.jpg https://s3.amazonaws.com/prod-ucs-content-store-us-east/content/pii:S1381116905004644/gr7/DOWNSAMPLED/image/jpeg/e9b32464355831fcb977212cdb60a7a2/gr7.jpg https://s3-eu-west-1.amazonaws.com/prod-ucs-content-store-eu-west/content/pii:S1381116905004644/gr7/DOWNSAMPLED/image/jpeg/e9b32464355831fcb977212cdb60a7a2/gr7.jpg gr7 gr7.jpg jpg 15885 240 326 IMAGE-DOWNSAMPLED 1-s2.0-S1381116905004644-gr7.sml https://s3.amazonaws.com/prod-ucs-content-store-us-east/content/pii:S1381116905004644/gr7/THUMBNAIL/image/gif/0b25cc0da9dbd9e0a6961ed708ff7311/gr7.sml https://s3-eu-west-1.amazonaws.com/prod-ucs-content-store-eu-west/content/pii:S1381116905004644/gr7/THUMBNAIL/image/gif/0b25cc0da9dbd9e0a6961ed708ff7311/gr7.sml gr7 gr7.sml sml 2336 92 125 IMAGE-THUMBNAIL 1-s2.0-S1381116905004644-fx1.gif https://s3.amazonaws.com/prod-ucs-content-store-us-east/content/pii:S1381116905004644/fx1/DOWNSAMPLED/image/gif/0eaa60da6f8fb7754af1ef1fba73a64e/fx1.gif https://s3-eu-west-1.amazonaws.com/prod-ucs-content-store-eu-west/content/pii:S1381116905004644/fx1/DOWNSAMPLED/image/gif/0eaa60da6f8fb7754af1ef1fba73a64e/fx1.gif fx1 true fx1.gif gif 3550 102 444 IMAGE-DOWNSAMPLED 1-s2.0-S1381116905004644-fx1.sml https://s3.amazonaws.com/prod-ucs-content-store-us-east/content/pii:S1381116905004644/fx1/THUMBNAIL/image/gif/c23fda1b90496d0f90c92e17bb04897c/fx1.sml https://s3-eu-west-1.amazonaws.com/prod-ucs-content-store-eu-west/content/pii:S1381116905004644/fx1/THUMBNAIL/image/gif/c23fda1b90496d0f90c92e17bb04897c/fx1.sml fx1 true fx1.sml sml 613 29 125 IMAGE-THUMBNAIL 1-s2.0-S1381116905004644-fx4.gif https://s3.amazonaws.com/prod-ucs-content-store-us-east/content/pii:S1381116905004644/fx4/DOWNSAMPLED/image/gif/b6391016a595a53cc7862a0d25e895ba/fx4.gif https://s3-eu-west-1.amazonaws.com/prod-ucs-content-store-eu-west/content/pii:S1381116905004644/fx4/DOWNSAMPLED/image/gif/b6391016a595a53cc7862a0d25e895ba/fx4.gif fx4 fx4.gif gif 633 42 81 IMAGE-DOWNSAMPLED 1-s2.0-S1381116905004644-fx4.sml https://s3.amazonaws.com/prod-ucs-content-store-us-east/content/pii:S1381116905004644/fx4/THUMBNAIL/image/gif/dc22eb7db7f0bf5f5617d3d998bae784/fx4.sml https://s3-eu-west-1.amazonaws.com/prod-ucs-content-store-eu-west/content/pii:S1381116905004644/fx4/THUMBNAIL/image/gif/dc22eb7db7f0bf5f5617d3d998bae784/fx4.sml fx4 fx4.sml sml 1082 65 125 IMAGE-THUMBNAIL 1-s2.0-S1381116905004644-gr5.jpg https://s3.amazonaws.com/prod-ucs-content-store-us-east/content/pii:S1381116905004644/gr5/DOWNSAMPLED/image/jpeg/d1a4f10ac5b8a6016d778f8946e2c327/gr5.jpg https://s3-eu-west-1.amazonaws.com/prod-ucs-content-store-eu-west/content/pii:S1381116905004644/gr5/DOWNSAMPLED/image/jpeg/d1a4f10ac5b8a6016d778f8946e2c327/gr5.jpg gr5 gr5.jpg jpg 17182 245 326 IMAGE-DOWNSAMPLED 1-s2.0-S1381116905004644-gr5.sml https://s3.amazonaws.com/prod-ucs-content-store-us-east/content/pii:S1381116905004644/gr5/THUMBNAIL/image/gif/a0930e8d650694f993aa6e0316db8623/gr5.sml https://s3-eu-west-1.amazonaws.com/prod-ucs-content-store-eu-west/content/pii:S1381116905004644/gr5/THUMBNAIL/image/gif/a0930e8d650694f993aa6e0316db8623/gr5.sml gr5 gr5.sml sml 2259 93 124 IMAGE-THUMBNAIL 1-s2.0-S1381116905004644-fx3.gif https://s3.amazonaws.com/prod-ucs-content-store-us-east/content/pii:S1381116905004644/fx3/DOWNSAMPLED/image/gif/29321fd7dce6cb213c93e9739e5aa47a/fx3.gif https://s3-eu-west-1.amazonaws.com/prod-ucs-content-store-eu-west/content/pii:S1381116905004644/fx3/DOWNSAMPLED/image/gif/29321fd7dce6cb213c93e9739e5aa47a/fx3.gif fx3 fx3.gif gif 2312 126 301 IMAGE-DOWNSAMPLED 1-s2.0-S1381116905004644-fx3.sml https://s3.amazonaws.com/prod-ucs-content-store-us-east/content/pii:S1381116905004644/fx3/THUMBNAIL/image/gif/0a82e996ee8ea6e738eb596160be2326/fx3.sml https://s3-eu-west-1.amazonaws.com/prod-ucs-content-store-eu-west/content/pii:S1381116905004644/fx3/THUMBNAIL/image/gif/0a82e996ee8ea6e738eb596160be2326/fx3.sml fx3 fx3.sml sml 708 52 125 IMAGE-THUMBNAIL 1-s2.0-S1381116905004644-gr1.jpg https://s3.amazonaws.com/prod-ucs-content-store-us-east/content/pii:S1381116905004644/gr1/DOWNSAMPLED/image/jpeg/e06a0a137f3ac0be47d39b347a2f0954/gr1.jpg https://s3-eu-west-1.amazonaws.com/prod-ucs-content-store-eu-west/content/pii:S1381116905004644/gr1/DOWNSAMPLED/image/jpeg/e06a0a137f3ac0be47d39b347a2f0954/gr1.jpg gr1 gr1.jpg jpg 20821 239 333 IMAGE-DOWNSAMPLED 1-s2.0-S1381116905004644-gr1.sml https://s3.amazonaws.com/prod-ucs-content-store-us-east/content/pii:S1381116905004644/gr1/THUMBNAIL/image/gif/c28b649612a19b76a7f03e9f84aabe2e/gr1.sml https://s3-eu-west-1.amazonaws.com/prod-ucs-content-store-eu-west/content/pii:S1381116905004644/gr1/THUMBNAIL/image/gif/c28b649612a19b76a7f03e9f84aabe2e/gr1.sml gr1 gr1.sml sml 2786 90 125 IMAGE-THUMBNAIL MOLCAA 5395 S1381-1169(05)00464-4 10.1016/j.molcata.2005.06.062 Elsevier B.V. Fig. 1 Product concentration as a function of reaction time for FeCl2-acetoxime catalyst. Reaction conditions: catalyst, 3mmol; 2,4,6-TMP, 60mmol; methanol, 60ml; P, 10atm; T, 90°C. Fig. 2 Variation of DMHB yield as a function of 2,4,6-TMP conversion for FeCl2-acetoxime catalyst at three reaction temperatures (50, 70 and 90°C). Fig. 3 Variation of DMBQ yield as a function of 2,4,6-TMP conversion for FeCl2-acetoxime catalyst at two reaction temperatures (70 and 90°C). Fig. 4 Variation of DMMMP yield as a function of 2,4,6-TMP conversion for FeCl2-acetoxime catalyst at three reaction temperatures (50, 70 and 90°C). Fig. 5 Comparisons of the reaction time needed to achieve a specific 2,4,6-TMP conversion for (a) FeCl2 catalyst with acetoxime and (b) FeCl2 catalyst alone when the reaction temperature was 70°C. Fig. 6 Comparisons of the reaction time needed to achieve a specific 2,4,6-TMP conversion for (a) FeCl2 catalyst with acetoxime and (b) FeCl2 catalyst alone when the reaction temperature was 90°C. Fig. 7 Comparisons of the 2,4,6-TMP oxidation rate for (a) FeCl2 catalyst with acetoxime and (b) FeCl2 catalyst alone when the reaction temperature was 50°C. Fig. 8 Test of zero-order kinetic model for 2,4,6-TMP oxidation at 70°C. Fig. 9 Effect of reaction temperature on the ratio of (the initial rate obtained with FeCl2 +acetoxime)/(the initial rate obtained with FeCl2 alone). 2,4,6-Trimethylphenol oxidation with ferrous chloride catalyst: Effect of acetoxime addition Kuo-Tseng Li * Pang-Yih Liu Department of Chemical Engineering, Tunghai University, Taichung, Taiwan, ROC * Corresponding author. Tel.: +886 4 23590262; fax: +886 4 23590009. Graphical abstract Selective oxidation of 2,4,6-trimethylphenol to 3,5-dimethyl-4-hydroxybenzaldehyde with a FeCl2-acetoxime catalyst system is reported. The addition of acetoxime significantly increased the activity and selectivity. A reaction mechanism was employed successfully to explain the experimental results obtained. The activity improvement with the addition of acetoxime was ascribed to its better electron-donating ability, which enhanced the dissociation rate of the intermediate complex. The promoting effect of acetoxime ((CH3)2CNOH) addition on the catalytic performances of FeCl2 catalyst for catalyzing the selective oxidation of 2,4,6-trimethylphenol (2,4,6-TMP) to 3,5-dimethyl-4-hydroxybenzaldehyde (DMHB) was studied with a high-pressure batch reactor in the temperature range of 50–90°C. A marked increase of the reaction rate upon the addition of acetoxime was observed. The extent of activity improvement increased with the reaction temperature and reached a six-fold increase of the reaction rate at 90°C. The maximum DMHB yield obtained with the FeCl2-acetoxime catalyst was 80%, which was higher than that (75%) obtained with FeCl2 alone. The rate of 2,4,6-TMP disappearance was found to exhibit zero-order dependence of the TMP concentration up to 76% conversion. A reaction mechanism, similar to that proposed previously for the oxidation of substituted toluene by cobalt(III) acetate in acetic acid solution, was employed successfully to explain the experimental results obtained. The activity improvement with the addition of acetoxime was ascribed to its better electron-donating ability, which enhanced the dissociation rate of the intermediate complex. Keywords 2,4,6-Trimethyphenol oxidation catalyst 3,5-Dimethyl-4-hydroxybenzaldehyde FeCl2 Acetoxime Electron transfer Oxidation catalyst Trimethylphenol 1 Introduction 2,6-Dimethylphenol (2,6-DMP) is used as the starting material for the manufacture of an important engineering polymer—poly(2,6-dimethyl-1,4-phenylene oxide), abbreviated as PPO [1–5]. The blends of PPO/polystyrene, PPO/polyamide and PPO/PBT have considerable commercial significance, are widely used in automotive, business machines and computer, house or office appliances, electronic or electrical equipments [1]. The industrial method employed for the synthesis of 2,6-DMP is based on the reaction between phenol and methanol in the presence of a metal oxide catalyst [6]. The following multiple reactions occur during the synthesis of 2,6-DMP: (1) phenol+methanol→ o-cresol+H2O (2) o-cresol+methanol→2,6-DMP+H2O (3) 2,6-DMP+methanol→2,4,6-trimethylphenol+H2O Reaction (3) is a side reaction, which produces an undesired by-product 2,4,6-trimethylphenol (2,4,6-TMP). It is desirable to convert 2,4,6-TMP into 2,6-DMP to improve the process economic benefit because 2,4,6-TMP has little practical use. A known method for converting 2,4,6-TMP back to 2,6-DMP includes the following two steps: (1) selective oxidation of 2,4,6-trimethylphenol to 3,5-dimethyl-4-hydroxybenzaldehyde (DMHB) in the presence of a copper-based catalyst and (2) deformylation of the resulting DMHB to 2,6-dimethylphenol in the presence of a palladium catalyst [7]. In previous papers, Cu(II)-oxime and Cu(II)-amine catalysts have been employed for catalyzing the oxidation of 2,4,6-TMP to 3,5,-dimethyl-4-hydroxybenzaldehyde and 2,6-dimethyl-p-benzoquinone (DMBQ) [8–10]. Following are the reactions for the oxidation of 2,4,6-TMP in alcohol solution to form DMHB and DMBQ [9]: (4) (5) In Eq. (4), 2,6-dimethyl-4-(alkoxymethyl)phenol (DMAMP) is an intermediate in the oxidation of 2,4,6-TMP in alcohol solution (ROH), which further reacts to form DMHB. Therefore, there are three major products in the oxidation of 2,4,6-TMP: DMHB, DMBQ and DMAMP. The relative amounts of these three products depend on the catalyst formulation, and also the reaction conditions, such as 2,4,6-TMP conversion, solvent and reaction temperature. Recently, we found that FeCl2 catalyst was capable of catalyzing the oxidation of 2,4,6-TMP to DMHB effectively [11]. These iron-based catalysts have an ecological advantage over the copper-based catalysts because iron ion is more environmentally friendly than the copper ion, which can cause serious water pollution. However, the activity of FeCl2 catalyst alone is not satisfactory because it required relatively long reaction time (10h) to achieve high 2,4,6-TMP conversion. This paper reports the use of FeCl2-acetoxime complex as the catalyst for catalyzing the oxidation of 2,4,6-TMP to DMHB. We found that the addition of acetoxime significantly improved the activity of FeCl2 catalyst. 2 Experimental A 300-ml high-pressure autoclave reactor made of titanium (supplied by Parr Instruments Co.) equipped with an impeller and a temperature control unit was employed for carrying out the catalytic oxidation. The autoclave was heated by a thermoregulated oven and a thermocouple was used to monitor the reaction temperature (the temperature was set at 50,70, or 90°C). In a typical run, 60mmol of 2,4,6-TMP (98% purity, Lancaster Synthesis Co., Morecame, UK), 3mmol of FeCl2·4H2O (99% purity, Showa Chemicals, Tokyo, Japan), 3mmol of acetoxime (98% purity, Acros Organics, Belgium) and 60ml of methanol (HPLC grade, TEDIA, Fairfield, OH, USA) were placed in the reactor. After reaching the desired temperature, the reactor was pressurized with oxygen to 10atm. The reaction was continued for 100min at the reaction temperature of 70 or 90°C, and was continued for 10h at the reaction temperature of 50°C. At the end of the reaction, the reactor content was filtered and EDTA aqueous solution was added to remove iron ions. The composition of product solution was determined by a gas chromatograph equipped with a 15-m long RTX-1 column and a flame ionization detector. The 2,4,6-TMP conversion was defined as the moles of 2,4,6-TMP reacted per mol of 2,4,6-TMP fed to the reactor. The yield of a particular product (DMHB, DMBQ and 2,6-dimethyl-4-(methoxymethyl)phenol, abbreviated as DMMMP) was defined as the moles of the product per mol of 2,4,6-TMP fed to the reactor. The selectivity of a particular product was defined as the yield of the product divided by the 2,4,6-TMP conversion. 3 Results and discussion The oxidation of 2,4,6-trimethylphenol was carried out at three reaction temperatures: 50, 70 and 90°C. Fig. 1 presents the dimensionless concentrations in the product solution as a function of reaction time at the reaction temperature of 90°C. The figure shows that DMHB is the dominant product from 2,4,6-TMP. It can be seen from the figure that the maximum DMHB yield was 80%, which was attained at the reaction time of 100min with a 96% TMP conversion. This maximum yield (80%) is higher than that (75%) obtain with FeCl2 catalyst alone [11], which was also obtained at 90°C, but with a much longer reaction time (10h) and a slightly lower TMP conversion (93%). Fig. 2 shows the variation of DMHB yield as a function of TMP conversion for the FeCl2-acetoxime catalyst at three different reaction temperatures (50, 70 and 90°C). It can be seen that the yield of DMHB increases monotonically with TMP conversion and reaches a maximum value of 80% at the maximum conversion of 96%. This is different from the performance of FeCl2 catalyst alone; in this case, DMHB yield decreased rapidly after TMP conversion exceeded 93%. All data points in Fig. 2 can be represented by a single curve, which suggest that the DMHB yield can be treated as a function of TMP conversion only. Fig. 3 shows the effect of reaction temperature on the yield of the by-product DMBQ. At the same 2,4,6-TMP conversion, the yield of DMBQ obtained at the reaction temperature of 90°C was much greater than that obtained at the reaction temperature of 70°C. For example, at the conversion of 76%, the yields of DMBQ obtained at 70 and at 90°C were 0.5 and 8.7%, respectively. The results indicate that the DMBQ yield was very sensitive to the reaction temperature and the side reaction for DMBQ formation became relatively important at high temperature. Therefore, the oxidation of 2,4,6-TMP should not be carried out at a high reaction temperature in order to avoid the production of the undesired product DMBQ and to improve the yield of the desired product DMHB. Fig. 3 also indicates that the DMBQ yield increased much rapidly in the range of high TMP conversion (i.e., in the range of low TMP concentration), which suggests that most of the DMBQ should be formed from the desired product DMHB, not by the direct oxidation of 2,4,6-TMP. Fig. 4 shows the variation of the yield of the intermediate, 2,6-dimethyl-4-(methoxymethyl)phenol, as a function of the TMP conversion for the FeCl2-acetoxime catalyst. The yield of DMMMP passed through a maximum (at around 18%) at the TMP conversion of about 50%. At the higher TMP conversion, there was a decline in the DMMMP yield, which should be due to the conversion of DMMMP to DMHB. The maximum DMMMP yield obtained for FeCl2 catalyst alone was around 30% at the TMP conversion of about 55% [11]. That is, the addition of acetoxime decreased the amount of DMMMP yield obtained. The reaction mechanism that will be proposed later (Eqs. (8)–(13)) suggests that DMHB can also be formed without going through the intermediate DMMMP (i.e., Eq. (13)). The results shown in Fig. 4 suggest that more DMHB was formed via Eq. (13) when FeCl2-acetone oxime was used as the catalyst for 2,4,6-TMP oxidation. Fig. 5 compares the reaction time needed to achieve a specific 2,4,6-TMP conversion for (a) FeCl2 catalyst with acetoxime and (b) FeCl2 catalyst alone when the reaction temperature was 70°C. Similar comparisons for the reaction temperature of 90°C are presented in Fig. 6 . At 70°C, the reaction time required to achieve 88% conversion was 1.6 and 8h for FeCl2-acetoxime and for FeCl2 alone, respectively. At 90°C, the reaction time required to achieve 93% conversion was 0.77 and 10h for FeCl2-acetoxime and for FeCl2 alone, respectively. Therefore, the time required to achieve a specific 2,4,6-TMP conversion was shortened dramatically with the addition of acetoxime. Fig. 7 compares the reaction rate of 2,4,6-TMP oxidation obtained at the reaction temperature of 50°C for (a) FeCl2 catalyst with acetoxime and (b) FeCl2 catalyst alone. The reaction rate with the FeCl2-acetoxime system (curve a) was maintained at an approximately constant value, while the reaction rate with FeCl2 catalyst alone (curve b) decreased rapidly with the reaction time. The decrease in the reaction rate in curve b might be due to the product adsorption. The products (DMHB and H2O) are often preferentially coordinated to the metal center because of their better donor properties than the reactant (2,4,6-TMP). The addition of acetoxime might reduce the effect of product adsorption on the active site, resulting in a nearly constant reaction rate. It is known that better electron-donating ligands (such as acetoxime) can be expected to enhance the rates of dissociative reactions (i.e., product desorption) since they donate more electrons to compensate for the reduction in the total number of ligands [12]. The curve a in Fig. 7 exhibits zero-order behavior because the reaction rate was almost independent of the reactant concentration. In addition, the reaction data at 70°C also follow zero-order behavior for 2,4,6-TMP conversion up to 76%, as shown in Fig. 8 . The results in Fig. 8 and in curve a of Fig. 7 suggest that the reaction rate law for 2,4,6-TMP oxidation might be in the form similar to the Langmuir–Hinshelood model used in the heterogeneous catalysis: (6) rate = k K A C A 1 + K A C A where C A is the concentration of reactant A (2,4,6-TMP), K A the equilibrium constant for the adsorption of reactant A on the catalytically active center and k is the reaction rate constant of the rate determining step. When K A C A ≫1 (i.e., A is strongly adsorbed or the concentration of A is large), Eq. (6) reduces to (7) rate = k Eq. (7) is zero-order with respect to the concentration of 2,4,6-TMP, which is consistent with the experimental results. The observed zero-order kinetics suggests that the catalyst is strongly bonding to 2,4,6-TMP (i.e., the value of K A is large). Rate equations similar to Eq. (6) were proposed before [13–15] for the oxidation of catechols by O2 catalyzed by Mn(II), Co(II) and Fe(II) complexes, based on a mechanism involving an anion radical intermediate. Figs. 5–7 clearly indicates that the addition of acetoxime significantly improved the activity. Fig. 9 shows the effect of reaction temperature on the initial rate ratio, which is defined as the initial rate obtained with FeCl2-acetoxime catalyst divided the initial rate obtained with FeCl2 catalyst alone. The figure clearly indicates that the promoting effect of acetoxime addition became more profound with the increase in reaction temperature. At 90°C, a six-fold increase in the reaction rate was observed. The proposed mechanism for Fe(III) catalyzed oxidation of 2,4,6-TMP (denoted by ArCH3) to DMHB in methanol solution is expressed as Eqs. (8)–(13), in which a radical cation ArCH3 + is formed via the direct electrophilic attack of the iron(III) species on the electron-rich substrate (2,4,6-TMP). The mechanism is analogous to that proposed by Hendriks et al. [16] for the oxidation of substituted toluenes by cobalt(III) acetate in acetic acid solution. (8) F e III + ArC H 3 ⇄ k 1 ( – C H 3 OH ) k 1 ( + C H 3 OH ) [ ( ArC H 3 + ) ( C H 3 O − ) ] + F e II + H + (9) F e III + [ ( ArC H 3 + ) ( C H 3 O − ) ] ⇄ k − 2 k 2 F e III [ ( ArC H 3 + ) ( C H 3 O − ) ] (10) F e III [ ( ArC H 3 + ) ( C H 3 O − ) ] ⟶ k 3 F e III + ArC H 2 + C H 3 OH (11) F e III + ArC H 2 ⟶ C H 3 OH F e II + ArC H 2 OC H 3 ( DMMMP ) + H + (12) ArCH2 +O2 →ArCH2O2 (13) ArC H 2 O 2 + F e II → ArCHO ( DMHB ) + F e III + O H − The intermediate, 2,6-dimethyl-4-(methoxymethyl)phenol (denoted by ArCH2OCH3) formed in Eq. (11), can be converted to the desired product (DMHB) non-catalytically [9]. The iron(III) species can be regenerated by the reaction of FeII with ArCH2O2 according to Eq. (13), which leads to the formation of the desired product 3,5-dimethyl-4-hydroxybenzaldehyde (denoted by ArCHO) [11]. The catalyst originally added into the reaction mixture was FeCl2·4H2O. The FeIII in Eq. (8) is formed by the oxidation of FeII. It is known that iron-peroxo species (FeIII–O–O−) can be obtained by the electron transfer from FeII ion to oxygen [17]: (14) F e II + O 2 ⇄ F e III – O – O − The (CH3O−) in Eq. (8) might be generated by deprotonation of the coordinated CH3OH molecules [12]. Assuming Eq. (10) is the rate determining step [16], the reaction rate of 2,4,6-TMP oxidation is taken to be proportional to the concentration of FeIII[(ArCH3 +)(CH3O−)] complex (denoted by C AX). Then, (15) rate = k 3 C AX The value of C AX is given in Eq. (16) in term of the equilibrium constants (K 1, K 2) of Eqs. (8) and (9) and the appropriate concentrations. (16) C AX = K 1 K 2 [ArCH3][FeIII]2[FeII]−1 where K 1 = k 1/k −1, K 2 = k 2/k −2.The mass balance for iron species is given by Eq. (17). (17) [ Fe ] 0 = [ F e III ] + [ F e II ] + C AX where [Fe]0 is the total concentration of iron species in the reaction mixture, which is a constant value. For the oxidation of substituted toluene by cobalt(III) acetate under the condition of 0.7atm O2, Hendriks et al. [16] found that the concentration ratio of CoIII/CoII was kept constant over a wide range of hydrocarbon conversion (2–95%). Therefore, a constant concentration ratio of FeIII/FeII should be maintained under the condition of large excess oxygen (10atm) used in this study. That is, (18) FeII =(K 4)−1FeIII where K 4 is related to the equilibrium constant of Eq. (14).Combining Eqs. (16)–(18) gives (19) C AX = K [ ArC H 3 ] [ Fe ] 0 1 + K [ ArC H 3 ] where K = K 1 K 2 K 4 / ( 1 + K 4 − 1 ) . The value of K 4 is large due to the large excess of oxygen. Therefore, K ≈ K 1 K 2 K 4. Eq. (19) is similar to the Langmuir equation used in heterogeneous catalysis.Substituting Eq. (19) into Eq. (15) gives (20) rate = k 3 K [ ArC H 3 ] [ Fe ] 0 1 + K [ ArC H 3 ] Under the condition of K[ArCH3]≫1, Eq. (20) becomes (21) rate = k 3 [ Fe ] 0 Eq. (21) is zero-order with respect to the concentration of 2,4,6-TMP, which is consistent with the experimental data observed in the curve a of Figs. 7 and 8. The consistence suggests that the proposed mechanism agrees with the observed kinetics. The rate equation in Eq. (21) suggested that the rate increase due to acetoxime addition should be due to the increase in k 3 (rate constant of Eq. (10)). The rate constant k 3 of Eq. (10) is related to the kinetic lability (or cage escape ability) of the iron intermediate complex FeIII[(ArCH3 +)(CH3O−)], which was constrained by the solvent (methanol) cage [18]. It is known that the better electron-donating ligands (such as acetoxime) can enhance the rates of dissociative reactions (such as Eq. (10)), since they donate more electron density to compensate for the reduction in the total number of ligands. This is called electron-donor effects [12]. They are several possible modes for the coordination of oxime (RR′CNOH) ligand to a metal [19]. The most probable mode for the binding of acetoxime ((CH3)2CNOH) ligand to the iron ion is , in which oximato group binds through nitrogen only and the oxygen atom is involved in hydrogen bonds. The coordination of acetoxime to iron thus increased the rate of Eq. (10), which resulted in the increased reaction rate for the oxidation of 2,4,6-TMP, as shown in Figs. 5–7 and 9. It has been demonstrated in the literature that the rate of direct hydrolysis (in the absence of protonic acid) of acetoxime to acetone and NH2OH was very low [20]. In addition, the methanol used in our experiments was HPLC grade which contained very little (0.05%) water. Therefore, the amount of acetoxime hydrolysis was negligible under our experimental conditions, and the active catalytic promoter should be acetoxime itself. In alkaline solutions, the phenolic OH group in 2,4,6-TMP is easily dissociated to form phenoxyl radical and proton. Sheldon and de Heij [21] studied the cobalt-based catalytic oxidation of p-cresol to p-hydroxy benzaldehyde in alkaline (with NaOH addition) methanolic solution, and proposed a reaction pathway involving a phenolate anion (formed due to the basic nature of the reaction medium), a phenoxy radical (oxidation product of phenolate anion) and an anion benzyl radical (formed via the reaction of phenoxy radical). Based on the Sheldon's mechanism, the possible reaction pathway for the Fe(III) catalyzed 2,4,6-TMP oxidation in alkaline methanolic solution can be represented by the following steps: (22) HOArC H 3 ⇄ OArC − H 3 + H + (23) OArC − H 3 + F e III ⇄ OArC H 3 + F e II (24) OArC H 3 ⇄ OArC − H 2 (25) OArC − H 2 ⇄ F e II , O 2 OArC − H 2 OOF e III (26) OArC − H 2 OOF e III + C H 3 OH ⇄ OArC − H 2 OC H 3 ( DMMMP ) + F e III OOH (27) OArC − H 2 OOF e III ⇄ OArCHO − ( DMHB ) + F e III OH In our study, no NaOH was added during the oxidation of 2,4,6-TMP. Therefore, the mechanism involving phenoxy radical (Eqs. (22)–(27)) is hardly likely to occur (compared to the reaction mechanism proposed in Eqs. (8)–(13)) because of the very low acid dissociation constant of 2,4,6-TMP in methanol (K a <10−14) [22,23]. 4 Conclusions In the present study, the effect of acetoxime addition on the performance of FeCl2 catalyst for the selective oxidation of 2,4,6-trimethylphenol to 3,5-dimethyl-4-hydroxybenzaldehyde was investigated in the temperature range of 50–90°C with methanol as the solvent. The addition of acetoxime significantly increased the reaction rate (up to six times) and also improved the yield of the desired product—3,5-dimethyl-4-hydroxybenzaldehyde. Zero-order rate equation was found to satisfactorily describe the rate of 2,4,6-trimethylphenol disappearance. By analogy to the oxidation of substituted toluene catalyzed with Co(III) acetate, a reaction mechanism involving a radical cation was proposed for the Fe-acetoxime complex catalyzed 2,4,6-trimethylphenol oxidation system. Based on the mechanism, the activity increase with the acetoxime addition might be due to the increase in the dissociation rate of FeIII[(ArCH3 +)(CH3O−)] complex. Acknowledgement We gratefully acknowledge the National Science Council of the Republic of China for financial support (Grant No. NSC-89-2214-E-029-005). References [1] D. Aycock V. Abolins D.M. White J.I. Kroschwitz Encyclopedia of Polymer Engineering and Science vol. 13 1989 Wiley New York 1 30 [2] A.S. Hay J. Polym. Sci. 58 1962 581 [3] K.T. Li D.C. Shieh Ind. Eng. Chem. Res. 33 1994 1107 [4] K.T. Li Polym. Bull. 34 1995 419 [5] K.T. Li I.T. Tsai J. Polym. Sci. A: Polym. Chem. 34 1996 3213 [6] K.T. Li I. Wang K.R. Chang Ind. Eng. Chem. Res. 32 1993 1007 [7] A.J. Caruso, J.L. Lee, U.S. Patent 5 475 156 (1995) (to General Electric Corporation). [8] K. Takehira M. Shimizu Y. Watanabe H. Orita T. Hayakawa Tetrahedron Lett. 31 1990 2607 [9] M. Shimizu Y. Watanabe H. Orita T. Hayakawa K. Takehira Bull. Chem. Soc. Jpn. 66 1993 251 [10] K. Takaki Y. Shimasaki T. Shishido K. Takehira Bull. Chem. Soc. Jpn. 75 2002 311 [11] K.T. Li P.Y. Liu Appl. Catal. A: Gen. 272 2004 167 [12] G. Wulfsberg Inorganic Chemistry 2000 University Science Books Sausalito, CA [13] C.A. Tyson J. Martell J. Am. Chem. Soc. 94 1972 939 [14] L.I. Simandi T.L. Simandi J. Chem. Soc. Dalton Trans. 1998 3275 [15] T.L. Simandi L.I. Simandi J. Chem. Soc. Dalton Trans. 1999 4529 [16] C.F. Hendriks H.C.A. van Beek P.M. Heertjes Ind. Eng. Chem. Prod. Res. Dev. 17 1978 256 [17] J.J. Girerd F. Banse A.J. Simaan B. Meunier Metal-Oxo and Metal-Peroxo Species in Catalytic Oxidations 2000 Springer Berlin [18] J.K. Kochi B.M. Trost Comprehensive Organic Synthesis vol. 7 1991 Pergamon Oxford 849 889 [19] V.Y. Kukushkin D. Tudela A.J.L. Pomberio Coord. Chem. Rev. 156 1996 333 [20] N.V. Kaminskaia N.M. Kostic J. Chem. Soc. Dalton Trans. 2001 1083 [21] R.A. Sheldon N. de Heij W. Ando Y. Moro-Oka Role of Oxygen in Chemistry and Biochemistry 1988 Elsevier Amsterdam 243 256 [22] J.A. Dean Lange's Handbook of Chemistry 1973 McGraw-Hill NY pp. 5–43 [23] T. Hanai K. Koizumi T. Kinoshita J. Liq. Chromatogr. Relat. Technol. 23 2000 363",
      "scopus-id": "25844443428",
      "coredata": {
        "eid": "1-s2.0-S1381116905004644",
        "dc:description": "The promoting effect of acetoxime ((CH3)2CNOH) addition on the catalytic performances of FeCl2 catalyst for catalyzing the selective oxidation of 2,4,6-trimethylphenol (2,4,6-TMP) to 3,5-dimethyl-4-hydroxybenzaldehyde (DMHB) was studied with a high-pressure batch reactor in the temperature range of 50–90°C. A marked increase of the reaction rate upon the addition of acetoxime was observed. The extent of activity improvement increased with the reaction temperature and reached a six-fold increase of the reaction rate at 90°C. The maximum DMHB yield obtained with the FeCl2-acetoxime catalyst was 80%, which was higher than that (75%) obtained with FeCl2 alone. The rate of 2,4,6-TMP disappearance was found to exhibit zero-order dependence of the TMP concentration up to 76% conversion. A reaction mechanism, similar to that proposed previously for the oxidation of substituted toluene by cobalt(III) acetate in acetic acid solution, was employed successfully to explain the experimental results obtained. The activity improvement with the addition of acetoxime was ascribed to its better electron-donating ability, which enhanced the dissociation rate of the intermediate complex.",
        "openArchiveArticle": "false",
        "prism:coverDate": "2005-11-01",
        "openaccessUserLicense": null,
        "prism:aggregationType": "Journal",
        "prism:url": "https://api.elsevier.com/content/article/pii/S1381116905004644",
        "dc:creator": [
          {
            "@_fa": "true",
            "$": "Li, Kuo-Tseng"
          },
          {
            "@_fa": "true",
            "$": "Liu, Pang-Yih"
          }
        ],
        "link": [
          {
            "@_fa": "true",
            "@rel": "self",
            "@href": "https://api.elsevier.com/content/article/pii/S1381116905004644"
          },
          {
            "@_fa": "true",
            "@rel": "scidir",
            "@href": "https://www.sciencedirect.com/science/article/pii/S1381116905004644"
          }
        ],
        "dc:format": "application/json",
        "openaccessType": null,
        "pii": "S1381-1169(05)00464-4",
        "prism:volume": "241",
        "prism:publisher": "Elsevier B.V.",
        "dc:title": "2,4,6-Trimethylphenol oxidation with ferrous chloride catalyst: Effect of acetoxime addition",
        "prism:copyright": "Copyright © 2005 Elsevier B.V. All rights reserved.",
        "openaccess": "0",
        "prism:issn": "13811169",
        "prism:issueIdentifier": "1-2",
        "dcterms:subject": [
          {
            "@_fa": "true",
            "$": "2,4,6-Trimethyphenol oxidation catalyst"
          },
          {
            "@_fa": "true",
            "$": "3,5-Dimethyl-4-hydroxybenzaldehyde"
          },
          {
            "@_fa": "true",
            "$": "FeCl2"
          },
          {
            "@_fa": "true",
            "$": "Acetoxime"
          },
          {
            "@_fa": "true",
            "$": "Electron transfer"
          },
          {
            "@_fa": "true",
            "$": "Oxidation catalyst"
          },
          {
            "@_fa": "true",
            "$": "Trimethylphenol"
          }
        ],
        "openaccessArticle": "false",
        "prism:publicationName": "Journal of Molecular Catalysis A: Chemical",
        "prism:number": "1-2",
        "openaccessSponsorType": null,
        "prism:pageRange": "72-78",
        "prism:endingPage": "78",
        "pubType": "fla",
        "prism:coverDisplayDate": "1 November 2005",
        "prism:doi": "10.1016/j.molcata.2005.06.062",
        "prism:startingPage": "72",
        "dc:identifier": "doi:10.1016/j.molcata.2005.06.062",
        "openaccessSponsorName": null
      },
      "objects": {
        "object": [
          {
            "@category": "thumbnail",
            "@height": "29",
            "@width": "292",
            "@_fa": "true",
            "$": "https://api.elsevier.com/content/object/eid/1-s2.0-S1381116905004644-si20.gif?httpAccept=%2A%2F%2A",
            "@multimediatype": "GIF image file",
            "@type": "ALTIMG",
            "@size": "1104",
            "@ref": "si20",
            "@mimetype": "image/gif"
          },
          {
            "@category": "thumbnail",
            "@height": "60",
            "@width": "327",
            "@_fa": "true",
            "$": "https://api.elsevier.com/content/object/eid/1-s2.0-S1381116905004644-si19.gif?httpAccept=%2A%2F%2A",
            "@multimediatype": "GIF image file",
            "@type": "ALTIMG",
            "@size": "1542",
            "@ref": "si19",
            "@mimetype": "image/gif"
          },
          {
            "@category": "thumbnail",
            "@height": "28",
            "@width": "235",
            "@_fa": "true",
            "$": "https://api.elsevier.com/content/object/eid/1-s2.0-S1381116905004644-si18.gif?httpAccept=%2A%2F%2A",
            "@multimediatype": "GIF image file",
            "@type": "ALTIMG",
            "@size": "969",
            "@ref": "si18",
            "@mimetype": "image/gif"
          },
          {
            "@category": "thumbnail",
            "@height": "13",
            "@width": "165",
            "@_fa": "true",
            "$": "https://api.elsevier.com/content/object/eid/1-s2.0-S1381116905004644-si17.gif?httpAccept=%2A%2F%2A",
            "@multimediatype": "GIF image file",
            "@type": "ALTIMG",
            "@size": "588",
            "@ref": "si17",
            "@mimetype": "image/gif"
          },
          {
            "@category": "thumbnail",
            "@height": "17",
            "@width": "253",
            "@_fa": "true",
            "$": "https://api.elsevier.com/content/object/eid/1-s2.0-S1381116905004644-si16.gif?httpAccept=%2A%2F%2A",
            "@multimediatype": "GIF image file",
            "@type": "ALTIMG",
            "@size": "867",
            "@ref": "si16",
            "@mimetype": "image/gif"
          },
          {
            "@category": "thumbnail",
            "@height": "17",
            "@width": "205",
            "@_fa": "true",
            "$": "https://api.elsevier.com/content/object/eid/1-s2.0-S1381116905004644-si15.gif?httpAccept=%2A%2F%2A",
            "@multimediatype": "GIF image file",
            "@type": "ALTIMG",
            "@size": "704",
            "@ref": "si15",
            "@mimetype": "image/gif"
          },
          {
            "@category": "thumbnail",
            "@height": "15",
            "@width": "95",
            "@_fa": "true",
            "$": "https://api.elsevier.com/content/object/eid/1-s2.0-S1381116905004644-si14.gif?httpAccept=%2A%2F%2A",
            "@multimediatype": "GIF image file",
            "@type": "ALTIMG",
            "@size": "449",
            "@ref": "si14",
            "@mimetype": "image/gif"
          },
          {
            "@category": "thumbnail",
            "@height": "38",
            "@width": "168",
            "@_fa": "true",
            "$": "https://api.elsevier.com/content/object/eid/1-s2.0-S1381116905004644-si13.gif?httpAccept=%2A%2F%2A",
            "@multimediatype": "GIF image file",
            "@type": "ALTIMG",
            "@size": "1108",
            "@ref": "si13",
            "@mimetype": "image/gif"
          },
          {
            "@category": "thumbnail",
            "@height": "20",
            "@width": "170",
            "@_fa": "true",
            "$": "https://api.elsevier.com/content/object/eid/1-s2.0-S1381116905004644-si12.gif?httpAccept=%2A%2F%2A",
            "@multimediatype": "GIF image file",
            "@type": "ALTIMG",
            "@size": "575",
            "@ref": "si12",
            "@mimetype": "image/gif"
          },
          {
            "@category": "thumbnail",
            "@height": "38",
            "@width": "159",
            "@_fa": "true",
            "$": "https://api.elsevier.com/content/object/eid/1-s2.0-S1381116905004644-si11.gif?httpAccept=%2A%2F%2A",
            "@multimediatype": "GIF image file",
            "@type": "ALTIMG",
            "@size": "1081",
            "@ref": "si11",
            "@mimetype": "image/gif"
          },
          {
            "@category": "thumbnail",
            "@height": "19",
            "@width": "201",
            "@_fa": "true",
            "$": "https://api.elsevier.com/content/object/eid/1-s2.0-S1381116905004644-si10.gif?httpAccept=%2A%2F%2A",
            "@multimediatype": "GIF image file",
            "@type": "ALTIMG",
            "@size": "815",
            "@ref": "si10",
            "@mimetype": "image/gif"
          },
          {
            "@category": "thumbnail",
            "@height": "13",
            "@width": "91",
            "@_fa": "true",
            "$": "https://api.elsevier.com/content/object/eid/1-s2.0-S1381116905004644-si9.gif?httpAccept=%2A%2F%2A",
            "@multimediatype": "GIF image file",
            "@type": "ALTIMG",
            "@size": "363",
            "@ref": "si9",
            "@mimetype": "image/gif"
          },
          {
            "@category": "thumbnail",
            "@height": "17",
            "@width": "168",
            "@_fa": "true",
            "$": "https://api.elsevier.com/content/object/eid/1-s2.0-S1381116905004644-si8.gif?httpAccept=%2A%2F%2A",
            "@multimediatype": "GIF image file",
            "@type": "ALTIMG",
            "@size": "531",
            "@ref": "si8",
            "@mimetype": "image/gif"
          },
          {
            "@category": "thumbnail",
            "@height": "29",
            "@width": "299",
            "@_fa": "true",
            "$": "https://api.elsevier.com/content/object/eid/1-s2.0-S1381116905004644-si7.gif?httpAccept=%2A%2F%2A",
            "@multimediatype": "GIF image file",
            "@type": "ALTIMG",
            "@size": "1202",
            "@ref": "si7",
            "@mimetype": "image/gif"
          },
          {
            "@category": "thumbnail",
            "@height": "35",
            "@width": "318",
            "@_fa": "true",
            "$": "https://api.elsevier.com/content/object/eid/1-s2.0-S1381116905004644-si6.gif?httpAccept=%2A%2F%2A",
            "@multimediatype": "GIF image file",
            "@type": "ALTIMG",
            "@size": "1559",
            "@ref": "si6",
            "@mimetype": "image/gif"
          },
          {
            "@category": "thumbnail",
            "@height": "51",
            "@width": "308",
            "@_fa": "true",
            "$": "https://api.elsevier.com/content/object/eid/1-s2.0-S1381116905004644-si5.gif?httpAccept=%2A%2F%2A",
            "@multimediatype": "GIF image file",
            "@type": "ALTIMG",
            "@size": "1631",
            "@ref": "si5",
            "@mimetype": "image/gif"
          },
          {
            "@category": "thumbnail",
            "@height": "71",
            "@width": "326",
            "@_fa": "true",
            "$": "https://api.elsevier.com/content/object/eid/1-s2.0-S1381116905004644-si4.gif?httpAccept=%2A%2F%2A",
            "@multimediatype": "GIF image file",
            "@type": "ALTIMG",
            "@size": "1555",
            "@ref": "si4",
            "@mimetype": "image/gif"
          },
          {
            "@category": "thumbnail",
            "@height": "69",
            "@width": "314",
            "@_fa": "true",
            "$": "https://api.elsevier.com/content/object/eid/1-s2.0-S1381116905004644-si3.gif?httpAccept=%2A%2F%2A",
            "@multimediatype": "GIF image file",
            "@type": "ALTIMG",
            "@size": "1953",
            "@ref": "si3",
            "@mimetype": "image/gif"
          },
          {
            "@category": "thumbnail",
            "@height": "11",
            "@width": "55",
            "@_fa": "true",
            "$": "https://api.elsevier.com/content/object/eid/1-s2.0-S1381116905004644-si2.gif?httpAccept=%2A%2F%2A",
            "@multimediatype": "GIF image file",
            "@type": "ALTIMG",
            "@size": "243",
            "@ref": "si2",
            "@mimetype": "image/gif"
          },
          {
            "@category": "thumbnail",
            "@height": "37",
            "@width": "121",
            "@_fa": "true",
            "$": "https://api.elsevier.com/content/object/eid/1-s2.0-S1381116905004644-si1.gif?httpAccept=%2A%2F%2A",
            "@multimediatype": "GIF image file",
            "@type": "ALTIMG",
            "@size": "689",
            "@ref": "si1",
            "@mimetype": "image/gif"
          },
          {
            "@category": "standard",
            "@height": "242",
            "@width": "329",
            "@_fa": "true",
            "$": "https://api.elsevier.com/content/object/eid/1-s2.0-S1381116905004644-gr2.jpg?httpAccept=%2A%2F%2A",
            "@multimediatype": "JPEG image file",
            "@type": "IMAGE-DOWNSAMPLED",
            "@size": "15790",
            "@ref": "gr2",
            "@mimetype": "image/jpeg"
          },
          {
            "@category": "thumbnail",
            "@height": "92",
            "@width": "125",
            "@_fa": "true",
            "$": "https://api.elsevier.com/content/object/eid/1-s2.0-S1381116905004644-gr2.sml?httpAccept=%2A%2F%2A",
            "@multimediatype": "GIF image file",
            "@type": "IMAGE-THUMBNAIL",
            "@size": "2363",
            "@ref": "gr2",
            "@mimetype": "image/gif"
          },
          {
            "@category": "standard",
            "@height": "199",
            "@width": "336",
            "@_fa": "true",
            "$": "https://api.elsevier.com/content/object/eid/1-s2.0-S1381116905004644-gr9.jpg?httpAccept=%2A%2F%2A",
            "@multimediatype": "JPEG image file",
            "@type": "IMAGE-DOWNSAMPLED",
            "@size": "15479",
            "@ref": "gr9",
            "@mimetype": "image/jpeg"
          },
          {
            "@category": "thumbnail",
            "@height": "74",
            "@width": "125",
            "@_fa": "true",
            "$": "https://api.elsevier.com/content/object/eid/1-s2.0-S1381116905004644-gr9.sml?httpAccept=%2A%2F%2A",
            "@multimediatype": "GIF image file",
            "@type": "IMAGE-THUMBNAIL",
            "@size": "2378",
            "@ref": "gr9",
            "@mimetype": "image/gif"
          },
          {
            "@category": "standard",
            "@height": "238",
            "@width": "322",
            "@_fa": "true",
            "$": "https://api.elsevier.com/content/object/eid/1-s2.0-S1381116905004644-gr6.jpg?httpAccept=%2A%2F%2A",
            "@multimediatype": "JPEG image file",
            "@type": "IMAGE-DOWNSAMPLED",
            "@size": "22633",
            "@ref": "gr6",
            "@mimetype": "image/jpeg"
          },
          {
            "@category": "thumbnail",
            "@height": "92",
            "@width": "125",
            "@_fa": "true",
            "$": "https://api.elsevier.com/content/object/eid/1-s2.0-S1381116905004644-gr6.sml?httpAccept=%2A%2F%2A",
            "@multimediatype": "GIF image file",
            "@type": "IMAGE-THUMBNAIL",
            "@size": "2306",
            "@ref": "gr6",
            "@mimetype": "image/gif"
          },
          {
            "@category": "standard",
            "@height": "136",
            "@width": "376",
            "@_fa": "true",
            "$": "https://api.elsevier.com/content/object/eid/1-s2.0-S1381116905004644-fx2.gif?httpAccept=%2A%2F%2A",
            "@multimediatype": "GIF image file",
            "@type": "IMAGE-DOWNSAMPLED",
            "@size": "3819",
            "@ref": "fx2",
            "@mimetype": "image/gif"
          },
          {
            "@category": "thumbnail",
            "@height": "45",
            "@width": "125",
            "@_fa": "true",
            "$": "https://api.elsevier.com/content/object/eid/1-s2.0-S1381116905004644-fx2.sml?httpAccept=%2A%2F%2A",
            "@multimediatype": "GIF image file",
            "@type": "IMAGE-THUMBNAIL",
            "@size": "800",
            "@ref": "fx2",
            "@mimetype": "image/gif"
          },
          {
            "@category": "standard",
            "@height": "239",
            "@width": "324",
            "@_fa": "true",
            "$": "https://api.elsevier.com/content/object/eid/1-s2.0-S1381116905004644-gr3.jpg?httpAccept=%2A%2F%2A",
            "@multimediatype": "JPEG image file",
            "@type": "IMAGE-DOWNSAMPLED",
            "@size": "14652",
            "@ref": "gr3",
            "@mimetype": "image/jpeg"
          },
          {
            "@category": "thumbnail",
            "@height": "92",
            "@width": "125",
            "@_fa": "true",
            "$": "https://api.elsevier.com/content/object/eid/1-s2.0-S1381116905004644-gr3.sml?httpAccept=%2A%2F%2A",
            "@multimediatype": "GIF image file",
            "@type": "IMAGE-THUMBNAIL",
            "@size": "2272",
            "@ref": "gr3",
            "@mimetype": "image/gif"
          },
          {
            "@category": "standard",
            "@height": "241",
            "@width": "327",
            "@_fa": "true",
            "$": "https://api.elsevier.com/content/object/eid/1-s2.0-S1381116905004644-gr4.jpg?httpAccept=%2A%2F%2A",
            "@multimediatype": "JPEG image file",
            "@type": "IMAGE-DOWNSAMPLED",
            "@size": "16963",
            "@ref": "gr4",
            "@mimetype": "image/jpeg"
          },
          {
            "@category": "thumbnail",
            "@height": "92",
            "@width": "125",
            "@_fa": "true",
            "$": "https://api.elsevier.com/content/object/eid/1-s2.0-S1381116905004644-gr4.sml?httpAccept=%2A%2F%2A",
            "@multimediatype": "GIF image file",
            "@type": "IMAGE-THUMBNAIL",
            "@size": "2407",
            "@ref": "gr4",
            "@mimetype": "image/gif"
          },
          {
            "@category": "standard",
            "@height": "241",
            "@width": "332",
            "@_fa": "true",
            "$": "https://api.elsevier.com/content/object/eid/1-s2.0-S1381116905004644-gr8.jpg?httpAccept=%2A%2F%2A",
            "@multimediatype": "JPEG image file",
            "@type": "IMAGE-DOWNSAMPLED",
            "@size": "12672",
            "@ref": "gr8",
            "@mimetype": "image/jpeg"
          },
          {
            "@category": "thumbnail",
            "@height": "91",
            "@width": "125",
            "@_fa": "true",
            "$": "https://api.elsevier.com/content/object/eid/1-s2.0-S1381116905004644-gr8.sml?httpAccept=%2A%2F%2A",
            "@multimediatype": "GIF image file",
            "@type": "IMAGE-THUMBNAIL",
            "@size": "2023",
            "@ref": "gr8",
            "@mimetype": "image/gif"
          },
          {
            "@category": "standard",
            "@height": "240",
            "@width": "326",
            "@_fa": "true",
            "$": "https://api.elsevier.com/content/object/eid/1-s2.0-S1381116905004644-gr7.jpg?httpAccept=%2A%2F%2A",
            "@multimediatype": "JPEG image file",
            "@type": "IMAGE-DOWNSAMPLED",
            "@size": "15885",
            "@ref": "gr7",
            "@mimetype": "image/jpeg"
          },
          {
            "@category": "thumbnail",
            "@height": "92",
            "@width": "125",
            "@_fa": "true",
            "$": "https://api.elsevier.com/content/object/eid/1-s2.0-S1381116905004644-gr7.sml?httpAccept=%2A%2F%2A",
            "@multimediatype": "GIF image file",
            "@type": "IMAGE-THUMBNAIL",
            "@size": "2336",
            "@ref": "gr7",
            "@mimetype": "image/gif"
          },
          {
            "@category": "standard",
            "@height": "102",
            "@width": "444",
            "@_fa": "true",
            "$": "https://api.elsevier.com/content/object/eid/1-s2.0-S1381116905004644-fx1.gif?httpAccept=%2A%2F%2A",
            "@multimediatype": "GIF image file",
            "@type": "IMAGE-DOWNSAMPLED",
            "@size": "3550",
            "@ref": "fx1",
            "@mimetype": "image/gif"
          },
          {
            "@category": "thumbnail",
            "@height": "29",
            "@width": "125",
            "@_fa": "true",
            "$": "https://api.elsevier.com/content/object/eid/1-s2.0-S1381116905004644-fx1.sml?httpAccept=%2A%2F%2A",
            "@multimediatype": "GIF image file",
            "@type": "IMAGE-THUMBNAIL",
            "@size": "613",
            "@ref": "fx1",
            "@mimetype": "image/gif"
          },
          {
            "@category": "standard",
            "@height": "42",
            "@width": "81",
            "@_fa": "true",
            "$": "https://api.elsevier.com/content/object/eid/1-s2.0-S1381116905004644-fx4.gif?httpAccept=%2A%2F%2A",
            "@multimediatype": "GIF image file",
            "@type": "IMAGE-DOWNSAMPLED",
            "@size": "633",
            "@ref": "fx4",
            "@mimetype": "image/gif"
          },
          {
            "@category": "thumbnail",
            "@height": "65",
            "@width": "125",
            "@_fa": "true",
            "$": "https://api.elsevier.com/content/object/eid/1-s2.0-S1381116905004644-fx4.sml?httpAccept=%2A%2F%2A",
            "@multimediatype": "GIF image file",
            "@type": "IMAGE-THUMBNAIL",
            "@size": "1082",
            "@ref": "fx4",
            "@mimetype": "image/gif"
          },
          {
            "@category": "standard",
            "@height": "245",
            "@width": "326",
            "@_fa": "true",
            "$": "https://api.elsevier.com/content/object/eid/1-s2.0-S1381116905004644-gr5.jpg?httpAccept=%2A%2F%2A",
            "@multimediatype": "JPEG image file",
            "@type": "IMAGE-DOWNSAMPLED",
            "@size": "17182",
            "@ref": "gr5",
            "@mimetype": "image/jpeg"
          },
          {
            "@category": "thumbnail",
            "@height": "93",
            "@width": "124",
            "@_fa": "true",
            "$": "https://api.elsevier.com/content/object/eid/1-s2.0-S1381116905004644-gr5.sml?httpAccept=%2A%2F%2A",
            "@multimediatype": "GIF image file",
            "@type": "IMAGE-THUMBNAIL",
            "@size": "2259",
            "@ref": "gr5",
            "@mimetype": "image/gif"
          },
          {
            "@category": "standard",
            "@height": "126",
            "@width": "301",
            "@_fa": "true",
            "$": "https://api.elsevier.com/content/object/eid/1-s2.0-S1381116905004644-fx3.gif?httpAccept=%2A%2F%2A",
            "@multimediatype": "GIF image file",
            "@type": "IMAGE-DOWNSAMPLED",
            "@size": "2312",
            "@ref": "fx3",
            "@mimetype": "image/gif"
          },
          {
            "@category": "thumbnail",
            "@height": "52",
            "@width": "125",
            "@_fa": "true",
            "$": "https://api.elsevier.com/content/object/eid/1-s2.0-S1381116905004644-fx3.sml?httpAccept=%2A%2F%2A",
            "@multimediatype": "GIF image file",
            "@type": "IMAGE-THUMBNAIL",
            "@size": "708",
            "@ref": "fx3",
            "@mimetype": "image/gif"
          },
          {
            "@category": "standard",
            "@height": "239",
            "@width": "333",
            "@_fa": "true",
            "$": "https://api.elsevier.com/content/object/eid/1-s2.0-S1381116905004644-gr1.jpg?httpAccept=%2A%2F%2A",
            "@multimediatype": "JPEG image file",
            "@type": "IMAGE-DOWNSAMPLED",
            "@size": "20821",
            "@ref": "gr1",
            "@mimetype": "image/jpeg"
          },
          {
            "@category": "thumbnail",
            "@height": "90",
            "@width": "125",
            "@_fa": "true",
            "$": "https://api.elsevier.com/content/object/eid/1-s2.0-S1381116905004644-gr1.sml?httpAccept=%2A%2F%2A",
            "@multimediatype": "GIF image file",
            "@type": "IMAGE-THUMBNAIL",
            "@size": "2786",
            "@ref": "gr1",
            "@mimetype": "image/gif"
          }
        ]
      },
      "link": {
        "@rel": "abstract",
        "@href": "https://api.elsevier.com/content/abstract/scopus_id/25844443428"
      }
    }
  }
}