{
  "metadata": {
    "title": "Catalysts, mechanisms and industrial processes for the dimethylcarbonate synthesis",
    "authors": "; ; ",
    "journal": "Journal of Molecular Catalysis A: Chemical",
    "date": "2010-02-15",
    "doi": "10.1016/j.molcata.2009.10.027",
    "abstract": "",
    "uri": "https://api.elsevier.com/content/article/pii/S1381116909005123",
    "pii": "S1381116909005123"
  },
  "fulltext": {
    "full-text-retrieval-response": {
      "scopus-eid": "2-s2.0-72149113314",
      "originalText": "serial JL 271358 291210 291744 291790 291809 31 Journal of Molecular Catalysis A: Chemical JOURNALMOLECULARCATALYSISACHEMICAL 2009-10-31 2009-10-31 2010-10-31T15:48:11 1-s2.0-S1381116909005123 S1381-1169(09)00512-3 S1381116909005123 10.1016/j.molcata.2009.10.027 S300 S300.1 FULL-TEXT 1-s2.0-S1381116909X00208 2015-05-15T05:56:33.307883-04:00 0 0 20100215 2010 2009-10-31T00:00:00Z articleinfo crossmark dco dateupdated tomb dateloaded datesearch indexeddate issuelist volumelist yearnav absattachment articletitlenorm authfirstinitialnorm authfirstsurnamenorm cid cids contenttype copyright dateloadedtxt docsubtype doctype doi eid ewtransactionid hubeid issfirst issn issnnorm itemstage itemtransactionid itemweight openaccess openarchive pg pgfirst pglast pii piinorm pubdatestart pubdatetxt pubyr sectiontitle sortorder srctitle srctitlenorm srctype subheadings volfirst volissue webpdf webpdfpagecount figure table body mmlmath acknowledge affil appendices articletitle auth authfirstini authfull authkeywords authlast primabst pubtype ref specialabst alllist content subj ssids 1381-1169 13811169 317 317 1 2 1 2 Volume 317, Issues 1–2 3 1 18 1 18 20100215 15 February 2010 2010-02-15 2010 Review article rev Copyright © 2009 Elsevier B.V. All rights reserved. CATALYSTSMECHANISMSINDUSTRIALPROCESSESFORDIMETHYLCARBONATESYNTHESIS KELLER N 1 Dimethylcarbonate (DMC) 2 Dimethylcarbonate applications 2.1 Fuel additive 2.2 Alternative to phosgene for aromatic polycarbonate and isocyanate syntheses 2.2.1 Aromatic polycarbonate synthesis 2.2.2 Isocyanate synthesis 2.3 Methylation agent 2.4 Solvent 3 Industrial synthesis processes 3.1 Phosgenation 3.2 The Enichem process by liquid phase methanol oxycarbonylation 3.2.1 Process 3.2.2 Mechanism and catalysts 3.3 The UBE process by methylnitrite carbonylation 4 Other synthesis processes 4.1 Direct synthesis from CO2 4.2 Transesterification of ethylene carbonate and urea 5 Vapour phase methanol oxycarbonylation 5.1 The vapour phase methanol oxycarbonylation reaction 5.2 Active carbon supported chloride-containing catalysts 5.2.1 With copper (II) chloride 5.2.1.1 Reaction mechanism 5.2.1.2 Catalyst deactivation and regeneration 5.2.1.3 Counter-ions and active phase nature effects 5.2.2 With CuCl2–PdCl2 bimetallic chlorides 5.2.2.1 Reaction mechanisms 5.2.2.2 Promoter effects 5.2.2.3 Solvent effects 5.2.3 With Cu2(OH)3Cl and bimetallic Cu2(OH)3Cl–PdCl2 chloride catalysts 5.3 Chlorine-free zeolite-based catalysts 5.3.1 Liquid phase copper exchange 5.3.2 Solid exchange by high-temperature anhydrous reaction (HAR) 5.3.3 Vapour phase exchange 6 Conclusion Acknowledgements Appendix A Calculation appendix References TUNDO 2002 706 P DELLEDONNE 2001 241 D PACHECO 1997 2 M RIVETTI 2000 497 F ONO 1997 15 Y FU 1994 399 Z ONO 1997 133 Y FU 1994 166 Z BERHIL 1995 205 M NAEJUS 1998 275 R BABAB 1973 75 H MATZNER 1964 645 M ARESTA 1999 181 M SHAIKH 1996 951 A ROMANO 1980 396 U MATSUZAKI 1997 77 T MANADA 1994 984 N NISHIHIRA 1997 3721 K HOFFMAN 1982 5209 W SAKAKURA 2009 1312 T KIZLINK 1993 1399 J KIZLINK 1995 687 J FANG 1996 L1 S TOMISHIGE 1999 225 K JUNG 2002 97 K JIANG 2003 203 C ARESTA 2008 125 M WANG 2007 92 X WU 2006 93 X BIAN 2009 50 J BIAN 2009 7188 J JUNG 2001 339 347 K SAKAKURA 1998 7095 T BHANAGE 2001 259 266 B TATSUMI 1996 2281 T BHANAGE 2003 71 B WATANABE 1998 399 Y DEFILLIPIS 2006 17 P JEONG 2005 241 E WEI 2003 343 T JU 2007 3 H STOICA 2009 252 G CURNUTT 1988 G OXYGENCOMPLEXESOXYGENACTIVATIONBYTRANSITIONMETALS HAN 2003 76 M TOMISHIGE 1999 95 K YAMAMOTO 1996 577 Y KRIVENTSOV 2000 318 V HAN 2001 225 M PUNNOOSE 2002 182 A FANG 2000 237 D ITOH 2003 558 H FLEET 1975 183 M DUNN 2002 177 B YANG 2003 1 P MA 2001 179 X MA 1996 201 X HAN 2003 137 M ROUCO 1995 380 A PARK 2000 5586 E CHOI 1991 465 K CAO 2004 15 Y JIANG 2002 1 R ROH 2003 27 N YANJI 1998 255 W JIANG 2002 1 R ZHANG 2004 141 Z PARK 2000 5 E IWAMOTO 1991 57 M TORREABREU 1997 251 C HERNANDEZMALDONADO 2004 992 A TAKAHASHI 2001 8405 A KING 1996 530 S GEDEON 1995 201 A IWAMOTO 1991 3727 M VALYON 1993 7054 J RABO 1976 332 J LARSEN 1994 11533 S HERNANDEZMALDONADO 2005 111 A KING 1997 173 S ANDERSON 2004 247 S ANDERSON 2003 396 S ANDERSON 2005 117 S REBMANN 2007 207 G KELLERX2010X1 KELLERX2010X1X18 KELLERX2010X1XN KELLERX2010X1X18XN item S1381-1169(09)00512-3 S1381116909005123 1-s2.0-S1381116909005123 10.1016/j.molcata.2009.10.027 271358 2010-12-01T15:25:00.334353-05:00 2010-02-15 1-s2.0-S1381116909005123-main.pdf https://s3.amazonaws.com/prod-ucs-content-store-us-east/content/pii:S1381116909005123/MAIN/application/pdf/e781988a34bee706a3d16cf20ac086ad/main.pdf https://s3-eu-west-1.amazonaws.com/prod-ucs-content-store-eu-west/content/pii:S1381116909005123/MAIN/application/pdf/e781988a34bee706a3d16cf20ac086ad/main.pdf main.pdf pdf true 1048603 MAIN 18 1-s2.0-S1381116909005123-main_1.png https://s3.amazonaws.com/prod-ucs-content-store-us-east/content/pii:S1381116909005123/PREVIEW/image/png/3583bf80cd9865b03481df1284a0159c/main_1.png https://s3-eu-west-1.amazonaws.com/prod-ucs-content-store-eu-west/content/pii:S1381116909005123/PREVIEW/image/png/3583bf80cd9865b03481df1284a0159c/main_1.png main_1.png png 40463 849 656 IMAGE-WEB-PDF 1 1-s2.0-S1381116909005123-si9.gif https://s3.amazonaws.com/prod-ucs-content-store-us-east/content/pii:S1381116909005123/STRIPIN/image/gif/b3ee47a4e2b4b392552fab27a1ca49d0/si9.gif https://s3-eu-west-1.amazonaws.com/prod-ucs-content-store-eu-west/content/pii:S1381116909005123/STRIPIN/image/gif/b3ee47a4e2b4b392552fab27a1ca49d0/si9.gif si9 si9.gif gif 1432 35 399 ALTIMG 1-s2.0-S1381116909005123-si8.gif https://s3.amazonaws.com/prod-ucs-content-store-us-east/content/pii:S1381116909005123/STRIPIN/image/gif/5939ab377b7f694b86302b56f8e5623a/si8.gif https://s3-eu-west-1.amazonaws.com/prod-ucs-content-store-eu-west/content/pii:S1381116909005123/STRIPIN/image/gif/5939ab377b7f694b86302b56f8e5623a/si8.gif si8 si8.gif gif 3007 38 565 ALTIMG 1-s2.0-S1381116909005123-si7.gif https://s3.amazonaws.com/prod-ucs-content-store-us-east/content/pii:S1381116909005123/STRIPIN/image/gif/260c906c8c649154645d5556a2f7d6dc/si7.gif https://s3-eu-west-1.amazonaws.com/prod-ucs-content-store-eu-west/content/pii:S1381116909005123/STRIPIN/image/gif/260c906c8c649154645d5556a2f7d6dc/si7.gif si7 si7.gif gif 1015 16 269 ALTIMG 1-s2.0-S1381116909005123-si6.gif https://s3.amazonaws.com/prod-ucs-content-store-us-east/content/pii:S1381116909005123/STRIPIN/image/gif/952937076339ffc09296b97af0457c03/si6.gif https://s3-eu-west-1.amazonaws.com/prod-ucs-content-store-eu-west/content/pii:S1381116909005123/STRIPIN/image/gif/952937076339ffc09296b97af0457c03/si6.gif si6 si6.gif gif 1373 25 364 ALTIMG 1-s2.0-S1381116909005123-si5.gif https://s3.amazonaws.com/prod-ucs-content-store-us-east/content/pii:S1381116909005123/STRIPIN/image/gif/08983b68bf04bd849875c1a858012e5b/si5.gif https://s3-eu-west-1.amazonaws.com/prod-ucs-content-store-eu-west/content/pii:S1381116909005123/STRIPIN/image/gif/08983b68bf04bd849875c1a858012e5b/si5.gif si5 si5.gif gif 919 23 277 ALTIMG 1-s2.0-S1381116909005123-si4.gif https://s3.amazonaws.com/prod-ucs-content-store-us-east/content/pii:S1381116909005123/STRIPIN/image/gif/33c0605f841421e0b948315a501af4f2/si4.gif https://s3-eu-west-1.amazonaws.com/prod-ucs-content-store-eu-west/content/pii:S1381116909005123/STRIPIN/image/gif/33c0605f841421e0b948315a501af4f2/si4.gif si4 si4.gif gif 1047 14 322 ALTIMG 1-s2.0-S1381116909005123-si3.gif https://s3.amazonaws.com/prod-ucs-content-store-us-east/content/pii:S1381116909005123/STRIPIN/image/gif/ef1509ca5330c89b9a0553331b2c1aec/si3.gif https://s3-eu-west-1.amazonaws.com/prod-ucs-content-store-eu-west/content/pii:S1381116909005123/STRIPIN/image/gif/ef1509ca5330c89b9a0553331b2c1aec/si3.gif si3 si3.gif gif 1120 23 279 ALTIMG 1-s2.0-S1381116909005123-si2.gif https://s3.amazonaws.com/prod-ucs-content-store-us-east/content/pii:S1381116909005123/STRIPIN/image/gif/a3695a4ffbcd33e93c7a4fc9bd7778e4/si2.gif https://s3-eu-west-1.amazonaws.com/prod-ucs-content-store-eu-west/content/pii:S1381116909005123/STRIPIN/image/gif/a3695a4ffbcd33e93c7a4fc9bd7778e4/si2.gif si2 si2.gif gif 1337 23 317 ALTIMG 1-s2.0-S1381116909005123-si13.gif https://s3.amazonaws.com/prod-ucs-content-store-us-east/content/pii:S1381116909005123/STRIPIN/image/gif/9efcfc67f68a2a1af11e9ca0845f3df3/si13.gif https://s3-eu-west-1.amazonaws.com/prod-ucs-content-store-eu-west/content/pii:S1381116909005123/STRIPIN/image/gif/9efcfc67f68a2a1af11e9ca0845f3df3/si13.gif si13 si13.gif gif 341 15 66 ALTIMG 1-s2.0-S1381116909005123-si12.gif https://s3.amazonaws.com/prod-ucs-content-store-us-east/content/pii:S1381116909005123/STRIPIN/image/gif/b1bf0b4c1d26f9d555b1c22a1b453742/si12.gif https://s3-eu-west-1.amazonaws.com/prod-ucs-content-store-eu-west/content/pii:S1381116909005123/STRIPIN/image/gif/b1bf0b4c1d26f9d555b1c22a1b453742/si12.gif si12 si12.gif gif 1691 36 288 ALTIMG 1-s2.0-S1381116909005123-si11.gif https://s3.amazonaws.com/prod-ucs-content-store-us-east/content/pii:S1381116909005123/STRIPIN/image/gif/ac65cd502de02bfdb3ee3620a2022406/si11.gif https://s3-eu-west-1.amazonaws.com/prod-ucs-content-store-eu-west/content/pii:S1381116909005123/STRIPIN/image/gif/ac65cd502de02bfdb3ee3620a2022406/si11.gif si11 si11.gif gif 900 15 261 ALTIMG 1-s2.0-S1381116909005123-si10.gif https://s3.amazonaws.com/prod-ucs-content-store-us-east/content/pii:S1381116909005123/STRIPIN/image/gif/56e67e2f669cb8ad528897a843542eb8/si10.gif https://s3-eu-west-1.amazonaws.com/prod-ucs-content-store-eu-west/content/pii:S1381116909005123/STRIPIN/image/gif/56e67e2f669cb8ad528897a843542eb8/si10.gif si10 si10.gif gif 1998 35 557 ALTIMG 1-s2.0-S1381116909005123-si1.gif https://s3.amazonaws.com/prod-ucs-content-store-us-east/content/pii:S1381116909005123/STRIPIN/image/gif/cbe2b1f3c93276ed95d4614c2436abb1/si1.gif https://s3-eu-west-1.amazonaws.com/prod-ucs-content-store-eu-west/content/pii:S1381116909005123/STRIPIN/image/gif/cbe2b1f3c93276ed95d4614c2436abb1/si1.gif si1 si1.gif gif 1536 23 366 ALTIMG 1-s2.0-S1381116909005123-gr1.jpg https://s3.amazonaws.com/prod-ucs-content-store-us-east/content/pii:S1381116909005123/gr1/DOWNSAMPLED/image/jpeg/d33feecf9f86b3fad3536dcd2d85fa5b/gr1.jpg https://s3-eu-west-1.amazonaws.com/prod-ucs-content-store-eu-west/content/pii:S1381116909005123/gr1/DOWNSAMPLED/image/jpeg/d33feecf9f86b3fad3536dcd2d85fa5b/gr1.jpg gr1 gr1.jpg jpg 30984 244 393 IMAGE-DOWNSAMPLED 1-s2.0-S1381116909005123-gr1.sml https://s3.amazonaws.com/prod-ucs-content-store-us-east/content/pii:S1381116909005123/gr1/THUMBNAIL/image/gif/456026dc7732da231f2f8cc486e78c3d/gr1.sml https://s3-eu-west-1.amazonaws.com/prod-ucs-content-store-eu-west/content/pii:S1381116909005123/gr1/THUMBNAIL/image/gif/456026dc7732da231f2f8cc486e78c3d/gr1.sml gr1 gr1.sml sml 3413 136 219 IMAGE-THUMBNAIL 1-s2.0-S1381116909005123-gr1_lrg.jpg https://s3.amazonaws.com/prod-ucs-content-store-us-east/content/pii:S1381116909005123/gr1/HIGHRES/image/jpeg/5718151385f35fd0a1fab53872051bce/gr1_lrg.jpg https://s3-eu-west-1.amazonaws.com/prod-ucs-content-store-eu-west/content/pii:S1381116909005123/gr1/HIGHRES/image/jpeg/5718151385f35fd0a1fab53872051bce/gr1_lrg.jpg gr1 gr1_lrg.jpg jpg 150870 1082 1742 IMAGE-HIGH-RES 1-s2.0-S1381116909005123-gr2.jpg https://s3.amazonaws.com/prod-ucs-content-store-us-east/content/pii:S1381116909005123/gr2/DOWNSAMPLED/image/jpeg/b40338e724edec302d2d8214cb0561a7/gr2.jpg https://s3-eu-west-1.amazonaws.com/prod-ucs-content-store-eu-west/content/pii:S1381116909005123/gr2/DOWNSAMPLED/image/jpeg/b40338e724edec302d2d8214cb0561a7/gr2.jpg gr2 gr2.jpg jpg 30797 276 386 IMAGE-DOWNSAMPLED 1-s2.0-S1381116909005123-gr2.sml https://s3.amazonaws.com/prod-ucs-content-store-us-east/content/pii:S1381116909005123/gr2/THUMBNAIL/image/gif/42aec2d7f38ed1b03926c3eb972b2e57/gr2.sml https://s3-eu-west-1.amazonaws.com/prod-ucs-content-store-eu-west/content/pii:S1381116909005123/gr2/THUMBNAIL/image/gif/42aec2d7f38ed1b03926c3eb972b2e57/gr2.sml gr2 gr2.sml sml 3169 156 219 IMAGE-THUMBNAIL 1-s2.0-S1381116909005123-gr2_lrg.jpg https://s3.amazonaws.com/prod-ucs-content-store-us-east/content/pii:S1381116909005123/gr2/HIGHRES/image/jpeg/946fc8f4111ad61814fe8eb80e51f3ed/gr2_lrg.jpg https://s3-eu-west-1.amazonaws.com/prod-ucs-content-store-eu-west/content/pii:S1381116909005123/gr2/HIGHRES/image/jpeg/946fc8f4111ad61814fe8eb80e51f3ed/gr2_lrg.jpg gr2 gr2_lrg.jpg jpg 154900 1220 1708 IMAGE-HIGH-RES 1-s2.0-S1381116909005123-gr3.jpg https://s3.amazonaws.com/prod-ucs-content-store-us-east/content/pii:S1381116909005123/gr3/DOWNSAMPLED/image/jpeg/19170aab0da32be694c0a5564692e07c/gr3.jpg https://s3-eu-west-1.amazonaws.com/prod-ucs-content-store-eu-west/content/pii:S1381116909005123/gr3/DOWNSAMPLED/image/jpeg/19170aab0da32be694c0a5564692e07c/gr3.jpg gr3 gr3.jpg jpg 32016 259 372 IMAGE-DOWNSAMPLED 1-s2.0-S1381116909005123-gr3.sml https://s3.amazonaws.com/prod-ucs-content-store-us-east/content/pii:S1381116909005123/gr3/THUMBNAIL/image/gif/8d5d6813551dbc61dab1f98b9cbb1f4a/gr3.sml https://s3-eu-west-1.amazonaws.com/prod-ucs-content-store-eu-west/content/pii:S1381116909005123/gr3/THUMBNAIL/image/gif/8d5d6813551dbc61dab1f98b9cbb1f4a/gr3.sml gr3 gr3.sml sml 3538 153 219 IMAGE-THUMBNAIL 1-s2.0-S1381116909005123-gr3_lrg.jpg https://s3.amazonaws.com/prod-ucs-content-store-us-east/content/pii:S1381116909005123/gr3/HIGHRES/image/jpeg/2bea0aff6f15771296f377214076d35b/gr3_lrg.jpg https://s3-eu-west-1.amazonaws.com/prod-ucs-content-store-eu-west/content/pii:S1381116909005123/gr3/HIGHRES/image/jpeg/2bea0aff6f15771296f377214076d35b/gr3_lrg.jpg gr3 gr3_lrg.jpg jpg 146649 1150 1649 IMAGE-HIGH-RES 1-s2.0-S1381116909005123-gr4.jpg https://s3.amazonaws.com/prod-ucs-content-store-us-east/content/pii:S1381116909005123/gr4/DOWNSAMPLED/image/jpeg/d30a463ac048a4bd1b15511c5763115e/gr4.jpg https://s3-eu-west-1.amazonaws.com/prod-ucs-content-store-eu-west/content/pii:S1381116909005123/gr4/DOWNSAMPLED/image/jpeg/d30a463ac048a4bd1b15511c5763115e/gr4.jpg gr4 gr4.jpg jpg 11525 184 378 IMAGE-DOWNSAMPLED 1-s2.0-S1381116909005123-gr4.sml https://s3.amazonaws.com/prod-ucs-content-store-us-east/content/pii:S1381116909005123/gr4/THUMBNAIL/image/gif/90c6154ebd6e2eee2b32a2ac145388b9/gr4.sml https://s3-eu-west-1.amazonaws.com/prod-ucs-content-store-eu-west/content/pii:S1381116909005123/gr4/THUMBNAIL/image/gif/90c6154ebd6e2eee2b32a2ac145388b9/gr4.sml gr4 gr4.sml sml 2163 107 219 IMAGE-THUMBNAIL 1-s2.0-S1381116909005123-gr4_lrg.jpg https://s3.amazonaws.com/prod-ucs-content-store-us-east/content/pii:S1381116909005123/gr4/HIGHRES/image/jpeg/80f7d423e0a23809da013e0d56fe407b/gr4_lrg.jpg https://s3-eu-west-1.amazonaws.com/prod-ucs-content-store-eu-west/content/pii:S1381116909005123/gr4/HIGHRES/image/jpeg/80f7d423e0a23809da013e0d56fe407b/gr4_lrg.jpg gr4 gr4_lrg.jpg jpg 87469 816 1676 IMAGE-HIGH-RES 1-s2.0-S1381116909005123-gr5.jpg https://s3.amazonaws.com/prod-ucs-content-store-us-east/content/pii:S1381116909005123/gr5/DOWNSAMPLED/image/jpeg/a7716f3c133c02f1bec20ed3157f0982/gr5.jpg https://s3-eu-west-1.amazonaws.com/prod-ucs-content-store-eu-west/content/pii:S1381116909005123/gr5/DOWNSAMPLED/image/jpeg/a7716f3c133c02f1bec20ed3157f0982/gr5.jpg gr5 gr5.jpg jpg 23892 232 376 IMAGE-DOWNSAMPLED 1-s2.0-S1381116909005123-gr5.sml https://s3.amazonaws.com/prod-ucs-content-store-us-east/content/pii:S1381116909005123/gr5/THUMBNAIL/image/gif/2ae23165d72fc9761ee9b8d880340401/gr5.sml https://s3-eu-west-1.amazonaws.com/prod-ucs-content-store-eu-west/content/pii:S1381116909005123/gr5/THUMBNAIL/image/gif/2ae23165d72fc9761ee9b8d880340401/gr5.sml gr5 gr5.sml sml 2036 135 219 IMAGE-THUMBNAIL 1-s2.0-S1381116909005123-gr5_lrg.jpg https://s3.amazonaws.com/prod-ucs-content-store-us-east/content/pii:S1381116909005123/gr5/HIGHRES/image/jpeg/2854854e5b192a242e8d61b8cc611b0e/gr5_lrg.jpg https://s3-eu-west-1.amazonaws.com/prod-ucs-content-store-eu-west/content/pii:S1381116909005123/gr5/HIGHRES/image/jpeg/2854854e5b192a242e8d61b8cc611b0e/gr5_lrg.jpg gr5 gr5_lrg.jpg jpg 106652 1030 1666 IMAGE-HIGH-RES 1-s2.0-S1381116909005123-gr6.jpg https://s3.amazonaws.com/prod-ucs-content-store-us-east/content/pii:S1381116909005123/gr6/DOWNSAMPLED/image/jpeg/c9608fa772ccd9e7ad61aef1e6cf8f25/gr6.jpg https://s3-eu-west-1.amazonaws.com/prod-ucs-content-store-eu-west/content/pii:S1381116909005123/gr6/DOWNSAMPLED/image/jpeg/c9608fa772ccd9e7ad61aef1e6cf8f25/gr6.jpg gr6 gr6.jpg jpg 14188 223 384 IMAGE-DOWNSAMPLED 1-s2.0-S1381116909005123-gr6.sml https://s3.amazonaws.com/prod-ucs-content-store-us-east/content/pii:S1381116909005123/gr6/THUMBNAIL/image/gif/5922912150f08356d7adadf44af3a82c/gr6.sml https://s3-eu-west-1.amazonaws.com/prod-ucs-content-store-eu-west/content/pii:S1381116909005123/gr6/THUMBNAIL/image/gif/5922912150f08356d7adadf44af3a82c/gr6.sml gr6 gr6.sml sml 2425 127 219 IMAGE-THUMBNAIL 1-s2.0-S1381116909005123-gr6_lrg.jpg https://s3.amazonaws.com/prod-ucs-content-store-us-east/content/pii:S1381116909005123/gr6/HIGHRES/image/jpeg/fbf1d2cef41433ea7a011482a9321f73/gr6_lrg.jpg https://s3-eu-west-1.amazonaws.com/prod-ucs-content-store-eu-west/content/pii:S1381116909005123/gr6/HIGHRES/image/jpeg/fbf1d2cef41433ea7a011482a9321f73/gr6_lrg.jpg gr6 gr6_lrg.jpg jpg 102455 987 1703 IMAGE-HIGH-RES 1-s2.0-S1381116909005123-gr7.jpg https://s3.amazonaws.com/prod-ucs-content-store-us-east/content/pii:S1381116909005123/gr7/DOWNSAMPLED/image/jpeg/53d50da01f433118628be7e493a1652f/gr7.jpg https://s3-eu-west-1.amazonaws.com/prod-ucs-content-store-eu-west/content/pii:S1381116909005123/gr7/DOWNSAMPLED/image/jpeg/53d50da01f433118628be7e493a1652f/gr7.jpg gr7 gr7.jpg jpg 51680 215 373 IMAGE-DOWNSAMPLED 1-s2.0-S1381116909005123-gr7.sml https://s3.amazonaws.com/prod-ucs-content-store-us-east/content/pii:S1381116909005123/gr7/THUMBNAIL/image/gif/0d56fef715afaaec1cb0fbf3a9910e32/gr7.sml https://s3-eu-west-1.amazonaws.com/prod-ucs-content-store-eu-west/content/pii:S1381116909005123/gr7/THUMBNAIL/image/gif/0d56fef715afaaec1cb0fbf3a9910e32/gr7.sml gr7 gr7.sml sml 6522 127 219 IMAGE-THUMBNAIL 1-s2.0-S1381116909005123-gr7_lrg.jpg https://s3.amazonaws.com/prod-ucs-content-store-us-east/content/pii:S1381116909005123/gr7/HIGHRES/image/jpeg/3cb832a5dab6bff73465b1d0cf14ef8d/gr7_lrg.jpg https://s3-eu-west-1.amazonaws.com/prod-ucs-content-store-eu-west/content/pii:S1381116909005123/gr7/HIGHRES/image/jpeg/3cb832a5dab6bff73465b1d0cf14ef8d/gr7_lrg.jpg gr7 gr7_lrg.jpg jpg 310917 955 1653 IMAGE-HIGH-RES 1-s2.0-S1381116909005123-gr8.jpg https://s3.amazonaws.com/prod-ucs-content-store-us-east/content/pii:S1381116909005123/gr8/DOWNSAMPLED/image/jpeg/8eeef78c365744ca3453d38dc9bcd9dd/gr8.jpg https://s3-eu-west-1.amazonaws.com/prod-ucs-content-store-eu-west/content/pii:S1381116909005123/gr8/DOWNSAMPLED/image/jpeg/8eeef78c365744ca3453d38dc9bcd9dd/gr8.jpg gr8 gr8.jpg jpg 11277 287 371 IMAGE-DOWNSAMPLED 1-s2.0-S1381116909005123-gr8.sml https://s3.amazonaws.com/prod-ucs-content-store-us-east/content/pii:S1381116909005123/gr8/THUMBNAIL/image/gif/b25308d4708640457cc2cdb32224fa6f/gr8.sml https://s3-eu-west-1.amazonaws.com/prod-ucs-content-store-eu-west/content/pii:S1381116909005123/gr8/THUMBNAIL/image/gif/b25308d4708640457cc2cdb32224fa6f/gr8.sml gr8 gr8.sml sml 2801 164 212 IMAGE-THUMBNAIL 1-s2.0-S1381116909005123-gr8_lrg.jpg https://s3.amazonaws.com/prod-ucs-content-store-us-east/content/pii:S1381116909005123/gr8/HIGHRES/image/jpeg/a071ee87e82ef8c165b058c23c99daba/gr8_lrg.jpg https://s3-eu-west-1.amazonaws.com/prod-ucs-content-store-eu-west/content/pii:S1381116909005123/gr8/HIGHRES/image/jpeg/a071ee87e82ef8c165b058c23c99daba/gr8_lrg.jpg gr8 gr8_lrg.jpg jpg 79226 1273 1646 IMAGE-HIGH-RES 1-s2.0-S1381116909005123-gr9.jpg https://s3.amazonaws.com/prod-ucs-content-store-us-east/content/pii:S1381116909005123/gr9/DOWNSAMPLED/image/jpeg/ff5ed6b6e738e623da2c8289c3321042/gr9.jpg https://s3-eu-west-1.amazonaws.com/prod-ucs-content-store-eu-west/content/pii:S1381116909005123/gr9/DOWNSAMPLED/image/jpeg/ff5ed6b6e738e623da2c8289c3321042/gr9.jpg gr9 gr9.jpg jpg 18866 290 364 IMAGE-DOWNSAMPLED 1-s2.0-S1381116909005123-gr9.sml https://s3.amazonaws.com/prod-ucs-content-store-us-east/content/pii:S1381116909005123/gr9/THUMBNAIL/image/gif/3e9e6f70c333f6d68b8a529c88a95968/gr9.sml https://s3-eu-west-1.amazonaws.com/prod-ucs-content-store-eu-west/content/pii:S1381116909005123/gr9/THUMBNAIL/image/gif/3e9e6f70c333f6d68b8a529c88a95968/gr9.sml gr9 gr9.sml sml 3930 163 205 IMAGE-THUMBNAIL 1-s2.0-S1381116909005123-gr9_lrg.jpg https://s3.amazonaws.com/prod-ucs-content-store-us-east/content/pii:S1381116909005123/gr9/HIGHRES/image/jpeg/0c827cfa0f20d02ba7a98c9a83f42eef/gr9_lrg.jpg https://s3-eu-west-1.amazonaws.com/prod-ucs-content-store-eu-west/content/pii:S1381116909005123/gr9/HIGHRES/image/jpeg/0c827cfa0f20d02ba7a98c9a83f42eef/gr9_lrg.jpg gr9 gr9_lrg.jpg jpg 182367 1288 1615 IMAGE-HIGH-RES 1-s2.0-S1381116909005123-gr10.jpg https://s3.amazonaws.com/prod-ucs-content-store-us-east/content/pii:S1381116909005123/gr10/DOWNSAMPLED/image/jpeg/97d5e6bd345b29228b0fe671eec182e5/gr10.jpg https://s3-eu-west-1.amazonaws.com/prod-ucs-content-store-eu-west/content/pii:S1381116909005123/gr10/DOWNSAMPLED/image/jpeg/97d5e6bd345b29228b0fe671eec182e5/gr10.jpg gr10 gr10.jpg jpg 16097 218 499 IMAGE-DOWNSAMPLED 1-s2.0-S1381116909005123-gr10.sml https://s3.amazonaws.com/prod-ucs-content-store-us-east/content/pii:S1381116909005123/gr10/THUMBNAIL/image/gif/6ffc18bbac07b51c5f69ea0454800128/gr10.sml https://s3-eu-west-1.amazonaws.com/prod-ucs-content-store-eu-west/content/pii:S1381116909005123/gr10/THUMBNAIL/image/gif/6ffc18bbac07b51c5f69ea0454800128/gr10.sml gr10 gr10.sml sml 1920 96 219 IMAGE-THUMBNAIL 1-s2.0-S1381116909005123-gr10_lrg.jpg https://s3.amazonaws.com/prod-ucs-content-store-us-east/content/pii:S1381116909005123/gr10/HIGHRES/image/jpeg/30a96686fd22b3c1e100c2b81a969d82/gr10_lrg.jpg https://s3-eu-west-1.amazonaws.com/prod-ucs-content-store-eu-west/content/pii:S1381116909005123/gr10/HIGHRES/image/jpeg/30a96686fd22b3c1e100c2b81a969d82/gr10_lrg.jpg gr10 gr10_lrg.jpg jpg 115538 964 2210 IMAGE-HIGH-RES 1-s2.0-S1381116909005123-gr11.jpg https://s3.amazonaws.com/prod-ucs-content-store-us-east/content/pii:S1381116909005123/gr11/DOWNSAMPLED/image/jpeg/2cc781537d88767d008144320b8a4fa4/gr11.jpg https://s3-eu-west-1.amazonaws.com/prod-ucs-content-store-eu-west/content/pii:S1381116909005123/gr11/DOWNSAMPLED/image/jpeg/2cc781537d88767d008144320b8a4fa4/gr11.jpg gr11 gr11.jpg jpg 16623 218 508 IMAGE-DOWNSAMPLED 1-s2.0-S1381116909005123-gr11.sml https://s3.amazonaws.com/prod-ucs-content-store-us-east/content/pii:S1381116909005123/gr11/THUMBNAIL/image/gif/51df6744e619697253e146bf79b0a895/gr11.sml https://s3-eu-west-1.amazonaws.com/prod-ucs-content-store-eu-west/content/pii:S1381116909005123/gr11/THUMBNAIL/image/gif/51df6744e619697253e146bf79b0a895/gr11.sml gr11 gr11.sml sml 1982 94 219 IMAGE-THUMBNAIL 1-s2.0-S1381116909005123-gr11_lrg.jpg https://s3.amazonaws.com/prod-ucs-content-store-us-east/content/pii:S1381116909005123/gr11/HIGHRES/image/jpeg/53603a2350f70d2a1bc8dd41104d95ef/gr11_lrg.jpg https://s3-eu-west-1.amazonaws.com/prod-ucs-content-store-eu-west/content/pii:S1381116909005123/gr11/HIGHRES/image/jpeg/53603a2350f70d2a1bc8dd41104d95ef/gr11_lrg.jpg gr11 gr11_lrg.jpg jpg 121835 964 2248 IMAGE-HIGH-RES 1-s2.0-S1381116909005123-gr12.jpg https://s3.amazonaws.com/prod-ucs-content-store-us-east/content/pii:S1381116909005123/gr12/DOWNSAMPLED/image/jpeg/01143ead068990cabb2fad7a4e3c04ab/gr12.jpg https://s3-eu-west-1.amazonaws.com/prod-ucs-content-store-eu-west/content/pii:S1381116909005123/gr12/DOWNSAMPLED/image/jpeg/01143ead068990cabb2fad7a4e3c04ab/gr12.jpg gr12 gr12.jpg jpg 22341 140 385 IMAGE-DOWNSAMPLED 1-s2.0-S1381116909005123-gr12.sml https://s3.amazonaws.com/prod-ucs-content-store-us-east/content/pii:S1381116909005123/gr12/THUMBNAIL/image/gif/b2ada33d62dbcda90c16fdf3e921a3fc/gr12.sml https://s3-eu-west-1.amazonaws.com/prod-ucs-content-store-eu-west/content/pii:S1381116909005123/gr12/THUMBNAIL/image/gif/b2ada33d62dbcda90c16fdf3e921a3fc/gr12.sml gr12 gr12.sml sml 1996 80 219 IMAGE-THUMBNAIL 1-s2.0-S1381116909005123-gr12_lrg.jpg https://s3.amazonaws.com/prod-ucs-content-store-us-east/content/pii:S1381116909005123/gr12/HIGHRES/image/jpeg/5e60954255b3f0f5c8ebe830e5ce9651/gr12_lrg.jpg https://s3-eu-west-1.amazonaws.com/prod-ucs-content-store-eu-west/content/pii:S1381116909005123/gr12/HIGHRES/image/jpeg/5e60954255b3f0f5c8ebe830e5ce9651/gr12_lrg.jpg gr12 gr12_lrg.jpg jpg 99536 620 1705 IMAGE-HIGH-RES 1-s2.0-S1381116909005123-fx2.jpg https://s3.amazonaws.com/prod-ucs-content-store-us-east/content/pii:S1381116909005123/fx2/DOWNSAMPLED/image/jpeg/6927c51cdaf88e12a33bf24e11d63c32/fx2.jpg https://s3-eu-west-1.amazonaws.com/prod-ucs-content-store-eu-west/content/pii:S1381116909005123/fx2/DOWNSAMPLED/image/jpeg/6927c51cdaf88e12a33bf24e11d63c32/fx2.jpg fx2 fx2.jpg jpg 9117 91 567 IMAGE-DOWNSAMPLED 1-s2.0-S1381116909005123-fx2.sml https://s3.amazonaws.com/prod-ucs-content-store-us-east/content/pii:S1381116909005123/fx2/THUMBNAIL/image/gif/3dc80d4d9d6de09e1d1322b373319482/fx2.sml https://s3-eu-west-1.amazonaws.com/prod-ucs-content-store-eu-west/content/pii:S1381116909005123/fx2/THUMBNAIL/image/gif/3dc80d4d9d6de09e1d1322b373319482/fx2.sml fx2 fx2.sml sml 926 35 219 IMAGE-THUMBNAIL 1-s2.0-S1381116909005123-fx2_lrg.jpg https://s3.amazonaws.com/prod-ucs-content-store-us-east/content/pii:S1381116909005123/fx2/HIGHRES/image/jpeg/251ce6387257b0e01867712132ebb623/fx2_lrg.jpg https://s3-eu-west-1.amazonaws.com/prod-ucs-content-store-eu-west/content/pii:S1381116909005123/fx2/HIGHRES/image/jpeg/251ce6387257b0e01867712132ebb623/fx2_lrg.jpg fx2 fx2_lrg.jpg jpg 70518 401 2511 IMAGE-HIGH-RES 1-s2.0-S1381116909005123-fx3.jpg https://s3.amazonaws.com/prod-ucs-content-store-us-east/content/pii:S1381116909005123/fx3/DOWNSAMPLED/image/jpeg/49f215dda7933924000064e56b313f28/fx3.jpg https://s3-eu-west-1.amazonaws.com/prod-ucs-content-store-eu-west/content/pii:S1381116909005123/fx3/DOWNSAMPLED/image/jpeg/49f215dda7933924000064e56b313f28/fx3.jpg fx3 fx3.jpg jpg 17365 203 452 IMAGE-DOWNSAMPLED 1-s2.0-S1381116909005123-fx3.sml https://s3.amazonaws.com/prod-ucs-content-store-us-east/content/pii:S1381116909005123/fx3/THUMBNAIL/image/gif/e5f3a5714e45d53f5faaf36f5d4b7ef6/fx3.sml https://s3-eu-west-1.amazonaws.com/prod-ucs-content-store-eu-west/content/pii:S1381116909005123/fx3/THUMBNAIL/image/gif/e5f3a5714e45d53f5faaf36f5d4b7ef6/fx3.sml fx3 fx3.sml sml 1963 98 219 IMAGE-THUMBNAIL 1-s2.0-S1381116909005123-fx3_lrg.jpg https://s3.amazonaws.com/prod-ucs-content-store-us-east/content/pii:S1381116909005123/fx3/HIGHRES/image/jpeg/faae7c9664ed90e06f7f567b95028f7d/fx3_lrg.jpg https://s3-eu-west-1.amazonaws.com/prod-ucs-content-store-eu-west/content/pii:S1381116909005123/fx3/HIGHRES/image/jpeg/faae7c9664ed90e06f7f567b95028f7d/fx3_lrg.jpg fx3 fx3_lrg.jpg jpg 103663 898 2004 IMAGE-HIGH-RES 1-s2.0-S1381116909005123-fx4.jpg https://s3.amazonaws.com/prod-ucs-content-store-us-east/content/pii:S1381116909005123/fx4/DOWNSAMPLED/image/jpeg/883278d23340592b25030816cd21b56a/fx4.jpg https://s3-eu-west-1.amazonaws.com/prod-ucs-content-store-eu-west/content/pii:S1381116909005123/fx4/DOWNSAMPLED/image/jpeg/883278d23340592b25030816cd21b56a/fx4.jpg fx4 fx4.jpg jpg 5754 63 486 IMAGE-DOWNSAMPLED 1-s2.0-S1381116909005123-fx4.sml https://s3.amazonaws.com/prod-ucs-content-store-us-east/content/pii:S1381116909005123/fx4/THUMBNAIL/image/gif/e46df8af88f5ecfcff38b1679cef8fe6/fx4.sml https://s3-eu-west-1.amazonaws.com/prod-ucs-content-store-eu-west/content/pii:S1381116909005123/fx4/THUMBNAIL/image/gif/e46df8af88f5ecfcff38b1679cef8fe6/fx4.sml fx4 fx4.sml sml 818 28 219 IMAGE-THUMBNAIL 1-s2.0-S1381116909005123-fx4_lrg.jpg https://s3.amazonaws.com/prod-ucs-content-store-us-east/content/pii:S1381116909005123/fx4/HIGHRES/image/jpeg/238c014f27826b8c010c21c9eabac545/fx4_lrg.jpg https://s3-eu-west-1.amazonaws.com/prod-ucs-content-store-eu-west/content/pii:S1381116909005123/fx4/HIGHRES/image/jpeg/238c014f27826b8c010c21c9eabac545/fx4_lrg.jpg fx4 fx4_lrg.jpg jpg 44926 278 2153 IMAGE-HIGH-RES 1-s2.0-S1381116909005123-fx5.jpg https://s3.amazonaws.com/prod-ucs-content-store-us-east/content/pii:S1381116909005123/fx5/DOWNSAMPLED/image/jpeg/9b28c0bfed01d3d7d037b359215ef196/fx5.jpg https://s3-eu-west-1.amazonaws.com/prod-ucs-content-store-eu-west/content/pii:S1381116909005123/fx5/DOWNSAMPLED/image/jpeg/9b28c0bfed01d3d7d037b359215ef196/fx5.jpg fx5 fx5.jpg jpg 4452 52 483 IMAGE-DOWNSAMPLED 1-s2.0-S1381116909005123-fx5.sml https://s3.amazonaws.com/prod-ucs-content-store-us-east/content/pii:S1381116909005123/fx5/THUMBNAIL/image/gif/d9b528b0bc7bc8ca17c5919ff9ce7aec/fx5.sml https://s3-eu-west-1.amazonaws.com/prod-ucs-content-store-eu-west/content/pii:S1381116909005123/fx5/THUMBNAIL/image/gif/d9b528b0bc7bc8ca17c5919ff9ce7aec/fx5.sml fx5 fx5.sml sml 636 24 219 IMAGE-THUMBNAIL 1-s2.0-S1381116909005123-fx5_lrg.jpg https://s3.amazonaws.com/prod-ucs-content-store-us-east/content/pii:S1381116909005123/fx5/HIGHRES/image/jpeg/d376a468e6cc501a068b556ca3b9de7e/fx5_lrg.jpg https://s3-eu-west-1.amazonaws.com/prod-ucs-content-store-eu-west/content/pii:S1381116909005123/fx5/HIGHRES/image/jpeg/d376a468e6cc501a068b556ca3b9de7e/fx5_lrg.jpg fx5 fx5_lrg.jpg jpg 32682 231 2138 IMAGE-HIGH-RES 1-s2.0-S1381116909005123-fx6.jpg https://s3.amazonaws.com/prod-ucs-content-store-us-east/content/pii:S1381116909005123/fx6/DOWNSAMPLED/image/jpeg/b78f9821dbd97e3245711a3c91e259ef/fx6.jpg https://s3-eu-west-1.amazonaws.com/prod-ucs-content-store-eu-west/content/pii:S1381116909005123/fx6/DOWNSAMPLED/image/jpeg/b78f9821dbd97e3245711a3c91e259ef/fx6.jpg fx6 fx6.jpg jpg 6270 70 523 IMAGE-DOWNSAMPLED 1-s2.0-S1381116909005123-fx6.sml https://s3.amazonaws.com/prod-ucs-content-store-us-east/content/pii:S1381116909005123/fx6/THUMBNAIL/image/gif/e7441215c26603819acd10e90d91f5ed/fx6.sml https://s3-eu-west-1.amazonaws.com/prod-ucs-content-store-eu-west/content/pii:S1381116909005123/fx6/THUMBNAIL/image/gif/e7441215c26603819acd10e90d91f5ed/fx6.sml fx6 fx6.sml sml 775 29 219 IMAGE-THUMBNAIL 1-s2.0-S1381116909005123-fx6_lrg.jpg https://s3.amazonaws.com/prod-ucs-content-store-us-east/content/pii:S1381116909005123/fx6/HIGHRES/image/jpeg/966356cd9e8c8489e5b94b2bfafbebd1/fx6_lrg.jpg https://s3-eu-west-1.amazonaws.com/prod-ucs-content-store-eu-west/content/pii:S1381116909005123/fx6/HIGHRES/image/jpeg/966356cd9e8c8489e5b94b2bfafbebd1/fx6_lrg.jpg fx6 fx6_lrg.jpg jpg 49212 312 2318 IMAGE-HIGH-RES 1-s2.0-S1381116909005123-fx7.jpg https://s3.amazonaws.com/prod-ucs-content-store-us-east/content/pii:S1381116909005123/fx7/DOWNSAMPLED/image/jpeg/a8ea177c35a8074e64998891d8180c7e/fx7.jpg https://s3-eu-west-1.amazonaws.com/prod-ucs-content-store-eu-west/content/pii:S1381116909005123/fx7/DOWNSAMPLED/image/jpeg/a8ea177c35a8074e64998891d8180c7e/fx7.jpg fx7 fx7.jpg jpg 6739 92 463 IMAGE-DOWNSAMPLED 1-s2.0-S1381116909005123-fx7.sml https://s3.amazonaws.com/prod-ucs-content-store-us-east/content/pii:S1381116909005123/fx7/THUMBNAIL/image/gif/ebf4930e0636dcccf65a606f6f45adda/fx7.sml https://s3-eu-west-1.amazonaws.com/prod-ucs-content-store-eu-west/content/pii:S1381116909005123/fx7/THUMBNAIL/image/gif/ebf4930e0636dcccf65a606f6f45adda/fx7.sml fx7 fx7.sml sml 1019 44 219 IMAGE-THUMBNAIL 1-s2.0-S1381116909005123-fx7_lrg.jpg https://s3.amazonaws.com/prod-ucs-content-store-us-east/content/pii:S1381116909005123/fx7/HIGHRES/image/jpeg/537981cc4349e09c0baefca384dea557/fx7_lrg.jpg https://s3-eu-west-1.amazonaws.com/prod-ucs-content-store-eu-west/content/pii:S1381116909005123/fx7/HIGHRES/image/jpeg/537981cc4349e09c0baefca384dea557/fx7_lrg.jpg fx7 fx7_lrg.jpg jpg 45672 409 2052 IMAGE-HIGH-RES 1-s2.0-S1381116909005123-fx8.jpg https://s3.amazonaws.com/prod-ucs-content-store-us-east/content/pii:S1381116909005123/fx8/DOWNSAMPLED/image/jpeg/1b2fb1d062c957893aa5969ff8749dd2/fx8.jpg https://s3-eu-west-1.amazonaws.com/prod-ucs-content-store-eu-west/content/pii:S1381116909005123/fx8/DOWNSAMPLED/image/jpeg/1b2fb1d062c957893aa5969ff8749dd2/fx8.jpg fx8 fx8.jpg jpg 7781 137 432 IMAGE-DOWNSAMPLED 1-s2.0-S1381116909005123-fx8.sml https://s3.amazonaws.com/prod-ucs-content-store-us-east/content/pii:S1381116909005123/fx8/THUMBNAIL/image/gif/3f1d9af5dea175d74dfe4c9bcce80c5f/fx8.sml https://s3-eu-west-1.amazonaws.com/prod-ucs-content-store-eu-west/content/pii:S1381116909005123/fx8/THUMBNAIL/image/gif/3f1d9af5dea175d74dfe4c9bcce80c5f/fx8.sml fx8 fx8.sml sml 1308 70 219 IMAGE-THUMBNAIL 1-s2.0-S1381116909005123-fx8_lrg.jpg https://s3.amazonaws.com/prod-ucs-content-store-us-east/content/pii:S1381116909005123/fx8/HIGHRES/image/jpeg/5857ce8d62913b2f5b6961e3be5321c0/fx8_lrg.jpg https://s3-eu-west-1.amazonaws.com/prod-ucs-content-store-eu-west/content/pii:S1381116909005123/fx8/HIGHRES/image/jpeg/5857ce8d62913b2f5b6961e3be5321c0/fx8_lrg.jpg fx8 fx8_lrg.jpg jpg 56967 607 1912 IMAGE-HIGH-RES 1-s2.0-S1381116909005123-fx9.jpg https://s3.amazonaws.com/prod-ucs-content-store-us-east/content/pii:S1381116909005123/fx9/DOWNSAMPLED/image/jpeg/0c3e1485f65c79642c5585a89d69392d/fx9.jpg https://s3-eu-west-1.amazonaws.com/prod-ucs-content-store-eu-west/content/pii:S1381116909005123/fx9/DOWNSAMPLED/image/jpeg/0c3e1485f65c79642c5585a89d69392d/fx9.jpg fx9 fx9.jpg jpg 6972 118 469 IMAGE-DOWNSAMPLED 1-s2.0-S1381116909005123-fx9.sml https://s3.amazonaws.com/prod-ucs-content-store-us-east/content/pii:S1381116909005123/fx9/THUMBNAIL/image/gif/91dd4eae64eab46f007cb68c1c467c8c/fx9.sml https://s3-eu-west-1.amazonaws.com/prod-ucs-content-store-eu-west/content/pii:S1381116909005123/fx9/THUMBNAIL/image/gif/91dd4eae64eab46f007cb68c1c467c8c/fx9.sml fx9 fx9.sml sml 1026 55 219 IMAGE-THUMBNAIL 1-s2.0-S1381116909005123-fx9_lrg.jpg https://s3.amazonaws.com/prod-ucs-content-store-us-east/content/pii:S1381116909005123/fx9/HIGHRES/image/jpeg/ade6cc7c7aee445161f2df751616085e/fx9_lrg.jpg https://s3-eu-west-1.amazonaws.com/prod-ucs-content-store-eu-west/content/pii:S1381116909005123/fx9/HIGHRES/image/jpeg/ade6cc7c7aee445161f2df751616085e/fx9_lrg.jpg fx9 fx9_lrg.jpg jpg 51878 521 2077 IMAGE-HIGH-RES 1-s2.0-S1381116909005123-fx11.jpg https://s3.amazonaws.com/prod-ucs-content-store-us-east/content/pii:S1381116909005123/fx11/DOWNSAMPLED/image/jpeg/9130b9cf3b50e24519d868a9f686a721/fx11.jpg https://s3-eu-west-1.amazonaws.com/prod-ucs-content-store-eu-west/content/pii:S1381116909005123/fx11/DOWNSAMPLED/image/jpeg/9130b9cf3b50e24519d868a9f686a721/fx11.jpg fx11 fx11.jpg jpg 2148 114 94 IMAGE-DOWNSAMPLED 1-s2.0-S1381116909005123-fx11.sml https://s3.amazonaws.com/prod-ucs-content-store-us-east/content/pii:S1381116909005123/fx11/THUMBNAIL/image/gif/6038aa5af1bf9233c4a85fbaefce16da/fx11.sml https://s3-eu-west-1.amazonaws.com/prod-ucs-content-store-eu-west/content/pii:S1381116909005123/fx11/THUMBNAIL/image/gif/6038aa5af1bf9233c4a85fbaefce16da/fx11.sml fx11 fx11.sml sml 3487 163 135 IMAGE-THUMBNAIL 1-s2.0-S1381116909005123-fx11_lrg.jpg https://s3.amazonaws.com/prod-ucs-content-store-us-east/content/pii:S1381116909005123/fx11/HIGHRES/image/jpeg/992a6a67b06ff37ded28a2bcad04e4ee/fx11_lrg.jpg https://s3-eu-west-1.amazonaws.com/prod-ucs-content-store-eu-west/content/pii:S1381116909005123/fx11/HIGHRES/image/jpeg/992a6a67b06ff37ded28a2bcad04e4ee/fx11_lrg.jpg fx11 fx11_lrg.jpg jpg 12848 505 417 IMAGE-HIGH-RES 1-s2.0-S1381116909005123-fx10.gif https://s3.amazonaws.com/prod-ucs-content-store-us-east/content/pii:S1381116909005123/fx10/DOWNSAMPLED/image/gif/3bcaa3397b0688c5cd1f21f942897159/fx10.gif https://s3-eu-west-1.amazonaws.com/prod-ucs-content-store-eu-west/content/pii:S1381116909005123/fx10/DOWNSAMPLED/image/gif/3bcaa3397b0688c5cd1f21f942897159/fx10.gif fx10 fx10.gif gif 1915 71 353 IMAGE-DOWNSAMPLED 1-s2.0-S1381116909005123-fx10.sml https://s3.amazonaws.com/prod-ucs-content-store-us-east/content/pii:S1381116909005123/fx10/THUMBNAIL/image/gif/87421fc2c0156191f91eda689a2b38b2/fx10.sml https://s3-eu-west-1.amazonaws.com/prod-ucs-content-store-eu-west/content/pii:S1381116909005123/fx10/THUMBNAIL/image/gif/87421fc2c0156191f91eda689a2b38b2/fx10.sml fx10 fx10.sml sml 996 44 219 IMAGE-THUMBNAIL 1-s2.0-S1381116909005123-fx10_lrg.gif https://s3.amazonaws.com/prod-ucs-content-store-us-east/content/pii:S1381116909005123/fx10/HIGHRES/image/gif/44e0344dbeda3a7266e86fe2db6799be/fx10_lrg.gif https://s3-eu-west-1.amazonaws.com/prod-ucs-content-store-eu-west/content/pii:S1381116909005123/fx10/HIGHRES/image/gif/44e0344dbeda3a7266e86fe2db6799be/fx10_lrg.gif fx10 fx10_lrg.gif gif 13690 628 3124 IMAGE-HIGH-RES 1-s2.0-S1381116909005123-fx1.jpg https://s3.amazonaws.com/prod-ucs-content-store-us-east/content/pii:S1381116909005123/fx1/DOWNSAMPLED/image/jpeg/a9a7993dd6f76c068ad6cbb23661f75d/fx1.jpg https://s3-eu-west-1.amazonaws.com/prod-ucs-content-store-eu-west/content/pii:S1381116909005123/fx1/DOWNSAMPLED/image/jpeg/a9a7993dd6f76c068ad6cbb23661f75d/fx1.jpg fx1 true fx1.jpg jpg 32022 178 222 IMAGE-DOWNSAMPLED 1-s2.0-S1381116909005123-fx1.sml https://s3.amazonaws.com/prod-ucs-content-store-us-east/content/pii:S1381116909005123/fx1/THUMBNAIL/image/gif/cb8c209faf69be690dfbdf18df82580f/fx1.sml https://s3-eu-west-1.amazonaws.com/prod-ucs-content-store-eu-west/content/pii:S1381116909005123/fx1/THUMBNAIL/image/gif/cb8c209faf69be690dfbdf18df82580f/fx1.sml fx1 true fx1.sml sml 13252 164 204 IMAGE-THUMBNAIL 1-s2.0-S1381116909005123-fx1_lrg.jpg https://s3.amazonaws.com/prod-ucs-content-store-us-east/content/pii:S1381116909005123/fx1/HIGHRES/image/jpeg/42f5d6c1e984cfb2fbf3a668ec2c8c22/fx1_lrg.jpg https://s3-eu-west-1.amazonaws.com/prod-ucs-content-store-eu-west/content/pii:S1381116909005123/fx1/HIGHRES/image/jpeg/42f5d6c1e984cfb2fbf3a668ec2c8c22/fx1_lrg.jpg fx1 fx1_lrg.jpg jpg 154907 790 984 IMAGE-HIGH-RES MOLCAA 7691 S1381-1169(09)00512-3 10.1016/j.molcata.2009.10.027 Elsevier B.V. Fig. 1 Schematic view of the Enichem slurry process. Adapted from Rivetti [8,21]. Fig. 2 Catalytic cycle of copper proposed by Delledonne et al. in the DMC synthesis by methanol oxycarbonylation. Reproduced from Delledonne et al. [2]. Fig. 3 Evolution of the DMC selectivity (left) and the DMC production (right) as a function of the Cl/Cu molar ratio at 90°C and 50bar. MC: chloromethan; DME: dimethylether. Reproduced from Romano et al. [22]. Fig. 4 Schematic view of the UBE process. Adapted from Pacheco and Marshall [3]. Fig. 5 Catalytic cycle during the DMC synthesis by methylnitrite carbonylation. Reproduced from Delledonne et al. [2]. Fig. 6 Influence of the support nature on the DMC synthesis. Conditions: T =100°C, P =20.68bar, impregnation with C5H5NCu(OCH3)Cl (2wt.% Cu), GHSV=1800h−1. The selectivity was calculated relatively to the carbon monoxide, taking into account DMC and CO2 as reaction products. Adapted from Curnutt and Harley [64]. Fig. 7 Influence of time on stream and of regenerative treatments on the catalytic performances. Conditions: 5mol.% HCl/N2, T =140°C, P =9.4bar, CH3OH/CO/O2 reactant ratios=1/3/0.06. Reproduced from Itoh et al. [72]. Fig. 8 Influence of the counter-cation on the catalytic activity in the DEC synthesis. Conditions in close vessel: 0.5g of catalyst, 3.6g of ethanol, T =170°C, CO/O2/N2 =1/1.5/2.5. Adapted from Dunn et al. [74]. Fig. 9 X-ray diffraction pattern of activated charcoal supported Cu2(OH)3Cl catalysts for 5 and 10wt.% of copper. Beside the broad peaks attributed to carbon, peaks indexed by (1) and (2) were assigned to the paracatamite and atacamite Cu2(OH)3Cl phases, respectively. Fig. 10 Mechanism for the carbon monoxide oxidation proposed by Park et al. over Cu2(OH)3Cl–PdCl2/AC catalysts. Adapted from Park et al. [81]. Fig. 11 Mechanism adapted for the DMC formation, derived from that proposed by Zhang et al. over Cu2(OH)3Cl–PdCl2/AC catalysts for the diethylcarbonate (DEC) production [88]. Fig. 12 Schematic view of the vapour phase copper exchange process. Table 1 Physico-chemical properties of DMC [1] and its developed formula . Melting temperature (°C) 4.6 Vaporization temperature (°C) 90.3 Density 1.07 Flash point (°C) 21.7 Azeotrop Water, alcohols ΔH vap (kcal/kg) 88.2 Water solubility (g/100g) 13.9 Dielectric constant (ɛ) 3.087 Dipolar moment (μ, D) 0.91 Table 2 Comparison of toxicologic data between DMC and phosgene [1]. Properties DMC Phosgene Toxicity through oral take (rats) LD50 13.8g/kg Toxicity through inhalation (rats) LC50 140mg/l (4h) LC50 140mg/m3 (75min) Mutagen property Without Irritability property Without Corrosive Biodegradability >90% (28days) Rapid hydrolysis into CO2 and HCl Table 3 Octane number of fuels containing different alkylcarbonates (3–5vol.%) [5]. Dimethylcarbonate Diethylcarbonate Dipropylcarbonate Dibutylcarbonate Octane number 116 105 106 88 Table 4 Performances obtained for the DMC synthesis following the UBE process. Reaction conditions: Pd=1wt.% and Cu=1.2wt.% impregnated on activated charcoal, T =120°C, P =3kgcm−2, gas hourly space velocity=4000h−1, CO=20vol.%, methylnitrite=10vol.% and balance N2 =70vol.%, DMO=dimethyloxalate. Adapted from Matsuzaki and Nakamura [23]. Catalyst DMC production (mol/lcat/h) DMO production (mol/lcat/h) Hourly DMC yield (g/lcat/h) Pd (0) 0.31 1.37 28 Pd–Cl 2.03 0.1 183 Cu–Cl 0.04 0 4 Pd–Cu–Cl 6.14 0.25 553 Pd–Cu–Br 5.81 0.33 523 Pd–Cu–AcO 0.58 1.88 52 Pd–Cu–NO3 0.78 2.18 70 Table 5 DMC synthesis by direct synthesis from CO2 (dehydrative condensation of CO2), reproduced from Sakakura and Kohno [35]. Catalyst Dehydrating agent Conditions DMC yield or TON Bu2Sn(OMe)2 None (self cat.) 100°C, 30bar TON 0.10 Bu2Sn(OMe)2 None (self cat.) 100°C, 50bar TON 0.98 Bu2Sn(OMe)2 None (self cat.) 150°C, 66bar TON 0.32 Bu2Sn(OMe)2 DCC 150°C, 25bar TON 1.2 Bu2Sn(OBu)2 Molecular sieves 150°C, 25bar TON 3.2 Bu2Sn(OMe)2 +Bu4PI Orthoester 180°C, 300bar 70% based on orthoester Bu2Sn(OMe)2 Acetal(2,2-dimethoxypropane) a 180°C, 300bar 6% based on MeOH, TON 30, (57% based on acetal) ZrO2 None 100°C, MeOH:CO2 =1:3 1% based on MeOH Ni(OAc)2 None (self cat.) 140°C, 74bar 2.1% based on MeOH Bu2Sn(OMe)2 None (self cat.) 145°C, 50h, MeOH:CO2 =0.8:1 TON 1 ZrO2 +H3PO4 None (self cat.) 130°C, MeOH:CO2 =0.99:1 0.62% based on MeOH ZrO2 +CeO2 None (self cat.) 110°C, MeOH:CO2 =0.2:1 1.6% based on MeOH Bu2Sn(OMe)2 MS3A a 180°C, 72h, 300bar 45% based on MeOH (equilibrium yield) ZrO2 +CeO2 Acetal a 130°C, 140h, MeOH:CO2 =0.99:1 4.3% based on MeOH (41% based on acetal) Nb(OR)5 None (self cat.) 137°C, 30h, 55bar 2% based on MeOH Bu2Sn(OMe)2 Si(OMe)4 150°C, 12h, 200bar TON 3.0 H3PO4 +V2O5 None (self cat.) 140°C, MeOH:CO2 =1:0.5 1.8% based on MeOH CuCl+MeOC(O)ONa DCC 65°C, 24h, 50bar 0.8% based on MeOH (83% based on DCC) Cu–Ni+VSO None (self cat.) 180°C, MeOH:CO2 =1:0.5 2.6% based on MeOH Cu1.5PMo12O40 (hetero-polyacid) None (self cat.) 50°C, 1.2bar 1.6% based on MeOH H3PW12O40 +Ce–Ti–O None (self cat.) 170°C, 12h, 50bar 5% based on MeOH None Mitsunobu reagents 100°C, 8h, 1bar Unsymmetrical carbonate synthesis from CO2 Cu–Ni/VSO photoirradiation None (self cat.) 120°C, UV irradiation 4% based on MeOH Bu2Sn(OMe)2 +acid Acetal a 180°C, 24h, 300bar 40% based on MeOH (equilibrium yield) Ti(OMe)4 +acid Acetal a 180°C, 24h, 300bar 24% based on MeOH Ti(OMe)4 +polyether Acetal a 180°C, 24, 300bar 55% based on MeOH (equilibrium yield) Sn/SBA-15 (immob. cat.) None (self cat.) 183°C, 10h, 200bar TON 1.1 Mg None (self cat.) 180°C, 12h, 150bar 1% based on MeOH a Recyclable – TON: turn over number. Table 6 Effect of adding hydroxyde to CuCl2/CA catalysts. Conditions: T =110°C, P =7bar, GHSV=1346h−1, 3wt.% Cu, Cu/OH=1. Adapted from Ma et al. [76]. Catalysts Hydroxydes MeOH conversion (%) DMC selectivity (%) CuCl2/CA – 2.4 43.4 CuCl2/hydroxyde/CA NaOH 5.6 79.5 CuCl2/hydroxyde/CA KOH 5.4 78.4 CuCl2/hydroxyde/CA LiOH 5.6 78.1 Review Catalysts, mechanisms and industrial processes for the dimethylcarbonate synthesis Nicolas Keller ⁎ Guillaume Rebmann Valérie Keller Laboratoire des Matériaux, Surfaces et Procédés pour la Catalyse (LMSPC), European Laboratory for Catalysis and Surface Sciences (ELCASS), CNRS, Strasbourg University, 25 rue Becquerel, 67087 Strasbourg Cedex, France ⁎ Corresponding author. Tel.: +33 (0)368852811; fax: +33 (0)368852761. Graphical abstract This review deals with the chemical uses and synthesis ways of dimethylcarbonate (DMC) with special focus on the vapour phase oxycarbonylation of methanol by carbon monoxide, and highlights both chlore-containing and chlore-free active catalysts, their reaction mechanisms as well as the industrial processes and the reactions for producing DMC. This review reports on the synthesis of dimethylcarbonate (DMC) and deals with the catalysts, the mechanisms as well as the industrial processes and the reactions for producing DMC, within the policy of developing clean and eco-friendly processes. DMC is considered as an environmentally benign chemical due to a negligible ecotoxicity, a low bioaccumulation and a low persistence, so that the production and chemical use of DMC have attracted much attention in the view of the so-called ‘sustainable society’ and ‘green chemistry’, mainly for replacing dimethylsulfate and methylhalides in methylation reactions and for replacing the harmful phosgene in polycarbonate and isocyanate syntheses. Special focus is made on the vapour phase oxycarbonylation of methanol by carbon monoxide in substitution to the old phosgenation process abandoned with years, and as an alternative process to both liquid phase methanol oxycarbonylation and methylnitrite carbonylation processes. The catalytic materials consist in high surface area active carbon supported copper chloride-based catalysts and chloride-free zeolite catalysts, both investigated in terms of catalyst preparation, active phase nature, performances and catalytic mechanisms. Keywords Dimethylcarbonate Oxycarbonylation Carbonylation Phosgene Copper chloride Active carbon Zeolite Catalytic mechanisms 1 Dimethylcarbonate (DMC) Over the last decades, environmental aspects such as the impact of chemical substances over human health have been put forward as major public concern. This more and more important public health and environmental protection pressure resulted in ever stricter legislation requirements related to both use and production of chemicals, carried in the form of bills or resolutions by national or international executives. This led industrials to be involved in developing clean and eco-friendly synthesis processes meeting such environmental restrictions, in adequation with the Green Chemistry approach. The production and chemical use of dimethylcarbonate (DMC, Table 1 ) are directly concerned by this policy frame. The 2500 recent reference citations listed by the Chemical Abstract database highlight the growing interest devoted to this research area since few years [2]: the search for more performing catalysts and processes in order to meet the ever increasing standards in the eco-technology field has created a strong incentive, stimulating and driving research in this area. DMC is considered as an environmentally benign chemical, so that its production and its chemical use have attracted much attention in the view of the so-called ‘sustainable society’ and ‘green chemistry’ approaches. This increasing focus is thus mainly due to its biodegradability, with a low bioaccumulation and a low persistence, as well as its low toxicity, DMC being about 1000 times less toxic than phosgene (Table 2 ). In addition, the great reactivity of DMC towards nucleophilic molecules such as phenols or primary amines renders it a valuable reactant for organic syntheses, mainly for acting as a carbonylation agent for replacing the harmful phosgene in polycarbonate and isocyanate syntheses, as well as for replacing dimethylsulfate and methylhalides in methylation reactions. This review thus reports first the main industrial applications of DMC as fuel additive, alternative to phosgene for polycarbonate and isocyanate syntheses, methylation agent and solvent (Section 2), before it describes the industrial synthesis processes, including the old phosgenation process as well as both Enichem liquid phase methanol oxycarbonylation and UBE methylnitrite carbonylation processes (Section 3). The direct synthesis from CO2 and methanol and the transesterification of ethylene carbonate through urea or methanol are briefly reported in Section 4 as alternative synthesis processes. Finally, Section 5 focuses on the vapour phase oxycarbonylation of methanol, with catalytic materials consisting in high surface area active carbon supported copper chloride-based catalysts and chloride-free zeolite catalysts, investigated in terms of catalyst preparation, active phase nature, performances and catalytic mechanisms. 2 Dimethylcarbonate applications The industrial applications of dimethylcarbonate cover several fields, and the main applications are detailed in this section, such as the use of DMC as fuel additive, alternative substitute for phosgene, methylation agent and solvent. 2.1 Fuel additive The use of dimethylcarbonate, and more generally of alkylcarbonates, as fuel additive was put forward in numerous patents [3], the first occurrence being the apanage of the Standard Oil Development Co. in 1943 [4], which reported that adding 3wt.% of diethylcarbonate and butylcarbonate in gazoles allowed both injection and vaporization of gazoles to be improved, by reducing their surface tension. Although butylcarbonate was preferred, dimethylcarbonate was also mentioned. Another determining factor in the fuel formulation is the octane number, which is representative of the capacity of fuel to resist to the self-ignition caused by the compression inside the combustion chamber. Table 3 evidences that adding DMC to fuels significantly increased the octane number compared to other alkylcarbonates, with a high octane number of 116 resulting from the high oxygen content of DMC. More recently, Union Oil Co. has patented the reduction of the diesel soot particle release for DMC-containing gazole [6,7]. A 10–30% decrease in the soot particle release was observed for DMC contents around 5wt.% inside gazole. In addition, DMC displayed a more valuable efficiency than the usually methyl tert-butyl ether (MTBE) for reducing the exhaust level of carbon monoxide, formaldehyde and unburned hydrocarbons. This was explained by the high oxygen content (53.3wt.%) of DMC when compared to MTBE (18.2wt.%), which significantly improved the fuel oxygenation. 2.2 Alternative to phosgene for aromatic polycarbonate and isocyanate syntheses Phosgene (COCl2) is widely used in many applications and processes. Its use during WW I as gaseous warfare agent is representative for its high toxicity (Table 2). Ingesting phosgene results in hydrochloric acid formation, which attacks the organism, leading to pulmonary oedema and finally to death. Nowadays, replacing phosgene by low toxicity compounds such as DMC remains thus of immense interest and is therefore highly requested. 2.2.1 Aromatic polycarbonate synthesis Polycarbonate resins are widely used in the manufacturing of thermoplastic materials, due to suitable mechanical and optical properties, with an industrial synthesis based on the reaction between phosgene and a A-biphenol salt (Eq. (1)). (1) In addition to the use of phosgene, this process suffers from several drawbacks: its design requires the use of large amounts of methylene chloride as solvent that strongly contaminates the washing water. Furthermore, the formation of chloride sodium requires an additional restricting separation step during the process. The search for phosgene-free synthesis routes led thus to propose an alternative process consisting in the transesterification of diphenylcarbonate (DPC) with A-biphenol [8]. (2) In order to fully avoid the use of phosgene, unfortunately also generally involved in the diphenylcarbonate synthesis, the Enichem company developed a liquid phase transesterification–disproportionation process, based on the reaction between DMC and phenol in the presence of titanium alkoxide (Eqs. (3) and (4)) [9]. It can be noted that the use of titanium alkoxide allowed a selectivity to diphenylcarbonate of 99.5% to be achieved, whereas other catalysts based on lead or molybdenum are also efficient. (3) PhOH + ( C H 3 O ) 2 CO ⟶ Ti ( OPh ) 4 PhO ( CO ) OC H 3 + C H 3 OH (4) 2 PhO ( CO ) OC H 3 ⟶ Ti ( OPh ) 4 C ( PhO ) 2 CO + ( C H 3 O ) 2 2.2.2 Isocyanate synthesis The reaction of phosgene on a primary or secondary amine led to the formation of the corresponding isocyanate molecule. In this case, like for aromatic polycarbonates, performing the reaction with DMC allowed the use of phosgene to be avoided, by a two-step process passing through the carbamate intermediate [10]. The carbamates are first synthesized by the catalytic reaction between DMC and an amine, as shown by Eq. (5) in the case of the methyl N-phenyl carbamate, using aniline as starting amine reactant. Subsequently, the corresponding isocyanate is obtained by the thermal decomposition of the carbamate (Eq. (6)). (5) (6) Fu and Ono reported that lead oxide is a very efficient catalyst for the synthesis of the carbamate intermediate, with a selectivity towards methyl N-phenyl carbamate of 99% being obtained at an aniline conversion of 98% after 1h reaction at 60°C in a closed vessel [11]. Catalysts such as zinc acetate, mercury salts and aluminium chloride are also reported. 2.3 Methylation agent DMC is also reported to act as an excellent methylation agent for carbon, nitrogen, oxygen and sulfur centres [12], and can thus be an alternative compound to dimethylsulfate or methyliodide, generally used for this reaction, although displaying a toxic and corrosive nature. In the case of a monomethylation, such as that of phenylacetonitrile in the gas phase (Eq. (7)), using DMC was very efficient, and a phenylacetonitrile conversion of 98% was achieved with a catalytic bed containing potassium carbonate. Yields to monomethyl products of about 70% were obtained at a temperature of 250°C. Very good performances for the monomethylation of phenols and arylacetonitriles were also reported by Fu and Ono with other basic catalysts such as NaY faujasite zeolites [13]. (7) 2.4 Solvent DMC is also considered as a promising alternative to the use of ketones and ester acetates in the field of paints and adhesives, due to a strong solvation power. However, this characteristic of DMC is mainly used only for lithium ion battery applications [14,15]. The electrolytes for such batteries are usually obtained by dissolution of a lithium salt in an organic solvent such as propylene or ethylene carbonates. Such compounds allowed a good dissolution of lithium salts to be achieved, but their strong viscosity remains a very restrictive drawback, by limiting the efficiency of the lithium electrochemical cycle. Adding DMC to the electrolyte significantly increased the conductivity of the electrolyte, due to its great solvation force towards lithium ions and its low viscosity, and the electrolyte resistance is thus consequently diminished. 3 Industrial synthesis processes In 1997, the world production of DMC amounted 1000bbl/day, corresponding to about 170t/day. We can estimate that achieving an oxygen content of 1wt.% in fuel would be required for each Major a DMC production of at least 8000bbl/day (1360t/day), that largely overshoots the actual world production [3]. This example highlights the need for better DMC production processes. Up to now, only three processes have been transferred to the industrial scale. The old phosgenation process has been totally abandoned with years and the world production remains mainly achieved following two processes developed by the Enichem and the UBE companies, based on the methanol oxycarbonylation and the methylnitrite carbonylation, respectively. 3.1 Phosgenation Up to the beginning of the 1980s, DMC and more generally dialkylcarbonates, were mainly manufactured by the Bayer company (Germany) and the Société Nationale des Poudres et Explosifs (SNPE, France), through the reaction of methanol on phosgene [16,17]. This reaction was performed following a two-step process, passing through the methylchloroformate intermediate (Eqs. (8) and (9)). (8) COCl2 +CH3OH→ClCOOCH3 +HCl (9) ClCOOCH3 +CH3OH→(CH3O)2CO+HCl Interesting DMC yields of 82% and 85% were achieved calculated from both methanol and phosgene reactants, respectively [18]. The reaction was usually occurring at 0°C in an anhydrous solvent such as toluene or dichloromethane, in the presence of pyridine excess, or in excess of an inorganic base (NaOH), both acting as a hydrochloric acid trap, in order to shift the reaction equilibrium towards DMC formation [19]. Without using such bases, the reaction temperature had to be strongly increased up to 50–150°C. This process displayed the advantages to reach high yields to DMC. However the use of the unwanted phosgene reactant, together with the need to neutralize large amounts of pyridine and to remove NaCl salts, both requiring strongly restrictive and expensive post-synthesis purification processes, led industry to target and look for less restrictive synthesis processes. 3.2 The Enichem process by liquid phase methanol oxycarbonylation 3.2.1 Process The oxycarbonylation of methanol (as a contraction of oxidative carbonylation) is a catalytic synthesis way, based on the reaction between oxygen, carbon monoxide and liquid methanol, according to Eq. (10) (10) 2CH3OH+CO+0.5O2 →(CH3O)2CO+H2O ΔH r(500°C) =−318kJ/mol In 1983, the Enichem company (Italy) industrialized the process in the slurry mode, by exploiting the catalytic properties of copper chloride (I) (CuCl) for the reaction [20]. As shown in Fig. 1 , the liquid phase oxycarbonylation of methanol to DMC is performed in a single step inside a slurry reactor, consisting in two columns continuously down-fed with carbon monoxide, oxygen and methanol. The density difference between the up-stream gas inside the column in which the reactants were introduced, and the second column which only contains the liquid phase, causes the transfer of the products between the columns (evidenced by arrows in Fig. 1) [21]. The vaporization of the products formed is assisted by the strong exothermicity of the reaction (ΔH r(500°C) =−318kJ/mol), and thus allows the products to be removed from the reactor, as wells as the excess of unreacted reactants. The sole by-products formed are CO2 and water. CO2 is recycled as carbonaceous source for the carbon monoxide synthesis, whereas methanol is back-fed to the reactor after separation of the DMC/H2O and DMC/MeOH azeotrops. The content of the different condensable products in the reactor outlet stream is around 50–70% for methanol, 30–40% for DMC and 2–5% for water. The Enichem process is working at a temperature ranging from 120 to 140°C and under a total pressure between 20 and 40bar. For instance, at 24bar and 130°C, a DMC production of 130g(l−1 cat)h−1 is achieved. During the course of the process, oxygen remains the limiting reactant due to the explosive risk, which could occur if the oxygen content exceeds 4mol.% in zones where carbon monoxide is the main component [3]. 3.2.2 Mechanism and catalysts It is usually admitted that the oxycarbonylation of methanol follows a two-step oxydo-reduction mechanism, through a copper methoxychloride intermediate [22]. The first step consists in the oxidation of copper chloride by oxygen into copper methoxychloride, reaction reported to be of zero order relative to methanol, and of first order relative to oxygen (Eq. (11)): (11) 2CuCl+2CH3OH+0.5O2 →2Cu(OCH3)Cl+H2O The copper methoxychloride is further reduced by carbon monoxide, allowing thus the copper chloride phase to be regenerated, and a new catalytic cycle to be initiated (Eq. (12)). The reaction is of first order relative to carbon monoxide up to 25bar, whereas the reaction order decreases down to zero for higher pressures. It can be noted that the reaction rate remains non-depending on the Cu(OCH3)Cl amount, because the reaction is performed at the Cu(OCH3)Cl solubility equilibrium. (12) 2Cu(OCH3)Cl+CO→(CH3O)2CO+2CuCl Although this mechanism is well admitted, it seems in total contradiction with that reported in several studies. Delledonne et al. claimed that the reduction of copper methoxychloride by carbon monoxide in an anhydrous media remains difficult, but is favoured by the addition of water and of small amounts of CuCl2 [2]. The authors observed the formation of diethylcarbonate when Cu(OCH3)Cl reacts with carbon monoxide in ethanol. According to that, they advanced that copper methoxychloride cannot be considered as the intermediate by-product such as proposed in Eqs. (11) and (12). Although the mechanism remains uncertain, they put forward a complete catalytic cycle rather than a two-step oxydo-reduction pathway (Fig. 2 ). In this mechanism, the attack of methanol on the carbon monoxide molecule coordinated with CuCl2 formed the carbomethoxy part of DMC. Further, the nucleophilic attack of a second methanol molecule completed the formation of DMC together with that of the copper (I) chloride. The oxidation of the copper (I) chloride by oxygen and methanol resulted in the formation of copper methoxychloride, which acted simultaneously as copper (II) source and as buffer for removing the hydrochloric acid produced during the insertion of methanol inside the carbon monoxide coordinated with CuCl2. The influence of water played a great role on the DMC production. Indeed, the reaction needs to be performed in excess of methanol, because the water produced by the reaction favoured the formation of CuCl x OH y , nH2O-like phases, which are less reactive for DMC production [3]. Water allowed the reduction of copper (I) chloride into metallic copper to be achieved in the presence of carbon monoxide. This caused the deactivation of the catalyst and the loss of chlorine as hydrochloric acid (Eq. (13)) [23]. (13) 2CuCl+CO+H2O→2Cu+CO2 +2HCl The existence of an optimum in the DMC production for a water content of 3wt.%, corresponding to a H2O/Cu molar ratio of 0.8, was established by Pacheco and Marshall [3], following previous works by Romano [22,24]. Below such a level, the DMC production strongly increased with increasing the water content. By contrast, the amount of DMC formed decreased drastically above this limit, e.g. being divided by a factor 4 relatively to the optimum for a water concentration of 12wt.%. As a consequence, the amount of water and its extraction rate from the reactor play a major role in the DMC production and in the design of Enichem reactors. Fig. 3 shows the evolution of both selectivity and production to DMC as a function of the Cl/Cu ratio, this ratio being depending on the presence (with suitable amounts) of CuCl2, Cu(OH)2 and CuCO3. The selectivity pattern displayed a maximum for the Cl/Cu ratio of 1. The behaviour strongly differed for the DMC production, the amount of DMC produced being almost constant for Cl/Cu ratios lower than 1, whereas it decreased for greater ratios. Taking into account both selectivity and production aspects, the optimum in the Cl/Cu ratio is set at 1. Enichem has also patented the use of copper (I) chloride as optimal catalyst for the reaction [25]. The Cl/Cu ratio can be maintained at a constant level during the course of the reaction by adding hydrochloric acid in order to thwart the catalyst deactivation caused by water [26]. However, the presence of HCl can strongly affect the reaction selectivity by leading to the detrimental formation of chloromethane (CH3Cl) or of dimethylether (CH3OCH3). 3.3 The UBE process by methylnitrite carbonylation Based on its large experience in the dimethyloxalate (DMO) synthesis from nitrogen monoxide, a similar process was developed by the UBE society for synthesizing dimethylcarbonate in the gas phase [27,28]. A production unit was recently erected with a production capacity of 6000t/year. Fig. 4 shows a simplified schematic view of the UBE process, according to a two-step DMC synthesis. The first step consists in the methylnitrite (CH3ONO) synthesis starting from nitrogen monoxide, methanol and oxygen inside Reactor 1 (Eq. (14)). (14) 2CH3OH+2NO+0.5O2 →2CH3ONO+H2O This reaction is generally performed in the liquid phase at 60°C without any catalyst and with usual contact times ranging from 0.5 to 2s. It can be decomposed into two consecutive oxidative reactions, such as that of nitrogen monoxide by oxygen into N2O3 (Eq. (15)) and that of methanol by N2O3 into the final methylnitrite product (Eq. (16)). (15) 2NO+0.5O2 →N2O3 (16) 2CH3OH+N2O3 →2CH3ONO+H2O At this stage, it is necessary to remove the water formed from the reaction media in order to perform the DMC synthesis in a fully anhydrous media, so that the activity of the catalyst could be maintained with time on stream. The second step consists in the vapour phase catalytic reaction between methylnitrite and carbon monoxide (both reactants with contents around 5–30vol.%) over an activated charcoal supported palladium chloride (PdIICl2) catalyst in a fixed-bed reactor. The reaction is performed in the presence of small amounts of chloride compounds diluted in an inert gas. The catalytic reaction between methylnitrite and carbon monoxide at 100–120°C and at 0.5–1MPa formed DMC according to Eq. (17). The DMC production was ranging from 200 and 600kg[m3 cat]h−1 for a contact time within the 0.5–5s range. The operational life-time of the catalyst was around one year, taking into account regeneration processes. (17) CO + 2 C H 3 ONO ⟶ PdC l 2 CO ( OC H 3 ) 2 + 2 NO The outlet stream of reactor 2 containing DMC and the dimethyloxalate (CH3OOC–COOCH3), methylformate and methylal by-products is consecutively separated into non-condensable (methylnitrite, nitrogen monoxide) and condensable products over an adsorption column. The nitrogen monoxide and the remaining methylnitrite are further injected back to reactor 1. This process exhibited the great advantage to avoid the restricting contact between water, methanol and DMC molecules, which generally results in separation problems due to the azeotrop equilibrium formed between the three products. A large variety of catalysts has been evaluated for the DMC production according to the UBE process, as shown in Table 4 . It should be noted that dimethyloxalate remained the sole by-product obtained during the UBE process, with a formation favoured by the presence of metallic palladium. It can be put forward that the copper chloride-based catalysts used in the Enichem process showed very poor performances for the UBE synthesis, although coupling palladium and copper with chlorine as ligand allowed an increase in performances to be obtained. This trend was explained by the great slow down, due to the presence of copper, of the reduction of palladium (II) into metallic palladium, known to be inactive for the DMC synthesis. The ligand nature was also essential, since chloride bimetallic catalysts exhibited a DMC productivity 10 times lower than that obtained with the similar catalysts containing acetate ligands. A mechanistic reaction pathway has been established taking into account and integrating the necessary presence of chlorine [2] (Fig. 5 ). The Pd(COOCH3)(NO)Cl2 reaction intermediate is produced starting from palladium chloride (PdCl2) by successive reactions with methylnitrite and carbon monoxide. During a third step, this intermediate reacts with methylnitrite again to form DMC and nitrogen monoxide. Formation of small amounts of methylchloroformate (ClCOOCH3) was observed by Manada et al. [29], and attributed to the decomposition of the Pd(COOCH3)(NO)Cl2 intermediate into methylchloroformate, nitrogen monoxide and metallic palladium. The resulting metallic palladium aggregates are the cause of the catalyst deactivation. However, the catalyst activity can be restored by adding small amounts of methylchloroformate (Eq. (18)) or HCl (Eq. (19)) during the reaction. (18) Pd0 +2ClCOOCH3 +2CH3ONO→PdCl2 +2CO(OCH3)2 +2NO (19) Pd0 +2HCl+2CH3ONO→PdCl2 +2CH3OH+2NO The previous reaction equations evidenced the double role played by the methylnitrite. It acts (i) as a reactant for synthesising DMC, and (ii) as an oxidizing agent for keeping the palladium under the PdCl2 form and thus for limiting the catalyst deactivation by metallic palladium formation. Numerous other material supports for CuCl2–PdCl2 bimetallic catalysts, such as zeolites, silica or γ-alumina, have been tested for the synthesis of DMC [30,31]. Their catalytic efficiencies can be ranked as: Active carbon > γ -alumina > Y zeolite > silica Active carbon exhibits the best performances nowadays, although no explanation has been proposed up to now, except that both the specific surface area and the porous nature of the support should influence the performances of the catalyst. The acido-basic characteristics of a support are also reported to play a great role in the UBE synthesis. Indeed, it has been observed that methylnitrite can be decomposed to methylformate (Eq. (20)) and methylal (Eq. (21)) over acid supports. Also, basic supports favour the formation of dimethyloxalate. (20) 2 C H 3 ONO ⟶ H + HCOOC H 3 + N 2 O + H 2 O (21) 2 C H 3 ONO + C H 3 OH ⟶ H + C H 2 ( OC H 3 ) 2 + 2 NO + H 2 O Using zeolites is very interesting, even if the selectivity to DMC remains lower than that observed on activated carbon (85% vs. >95%). Zeolites exchanged with palladium (II) by ionic exchange show the great advantage to be active for synthesizing DMC starting from methylnitrite in the absence of ligands such as chlorine [32,33]. In addition, the metallic palladium formed during the reaction can be re-oxidized through the methylnitrite and the zeolitic proton (formed after the palladium reduction) (Eq. (22)). (22) Pd0 +2CH3ONO+2H+-Z− →Pd2+(-Z−)2 +2CH3OH+2NO 4 Other synthesis processes Amongst the synthesis ways having been reported up to now for producing dimethylcarbonate, very few of them can be considered for industrial development. Two synthesis processes remain promising and are studied since few years: the direct synthesis of DMC from carbon dioxide and the reactions of transesterification of both urea and ethylene carbonate. 4.1 Direct synthesis from CO2 This direct synthesis enters in the strategy of using CO2 as carbon resource targeting simultaneously the environment protection and an efficient synthesis chemistry, usually labelled also as CO2 valorisation. The possibility to convert CO2 into environmentally friendly chemicals could not only limit the greenhouse environmental damages resulting from the continuous release of CO2 into the atmosphere and thus the consequent stratospheric ozone depletion, but could also lead to consider CO2 as a carbon source alternative to petroleum, natural gas and coal. In addition, the large scale availability and the low cost of CO2 are great advantages for using CO2 as precursor for synthesizing useful chemical products. The direct synthesis of DMC by reaction between CO2 and methanol is studied since the 1980s [34] (Eq. (23)) (23) 2 C H 3 OH + C O 2 ↔ CO ( OC H 3 ) 2 + H 2 O However, both activation and use remain still highly challenging due to the thermodynamical stability and the kinetic inertness of the CO2 molecule, and to the detrimental decomposition of the catalysts and hydrolysis of the carbonate. As a resulting of this ‘sustainable society’ Graal, this research area could contribute by itself to a self-sufficient review. We recommend the recent and detailed review of Sakakura and Kohno on the synthesis of organic carbonates from carbon dioxide [35], from which Table 5 has been extracted for summarising and compiling catalysts, dehydrating agents, reaction conditions and performances reported in the literature. Solving the thermodynamic restrictions mentioned above could be performed by shifting the equilibrium by pressurizing the CO2 and determining effective dehydrating agents, and by accelerating the reaction by pressurizing CO2 and developing effective catalysts. Since the yield to DMC remains very low (lower than 2% based on MeOH) when no dehydrating agents are used, two kinds of dehydrating agents are investigated: (i) non-recyclable agents like orthoesters (orthoacetate, Si(OMe)4), Mitsunobu's reagent and dicyclohexylcarbodiimide (DCC) and (ii) recyclable agents like acetals or molecular sieves. Briefly, in the case of orthoester dehydrating agents, with a reaction catalysed by metal alkoxides and onium salts, Bu2Sn(OMe)2 is a more efficient catalyst than Bu3SnOMe, and requires CO2 pressures over the critical pressure. The main drawbacks remain the use of high-cost orthoesters as dehydrating agent, which in addition is difficult to regenerate from alcohols and esters. The same problems limit the use of other dehydrating agents like DCC, Si(OMe)4 or Mitsunobu's reagent. Therefore, within the research trend to target more recyclable and available organic dehydrating agents, the use of acetals is studied, mainly due to an easy regeneration of acetals from ketones. Typical catalysts are dialkyltin dialkoxides, trialkyltin alkoxides being again poor catalysts as when using the orthoester agent, although the toxic nature of tin-based compounds remains a critical driving force for targeting catalysts based on less toxic metals, like zirconium or titanium. Molecular sieves have been also used as inorganic dehydrating agent with up to now no spectacular results. It should also be mentioned that adding a small amount of an acidic catalysts (like Sc(OTf)3 or Ph2NH2OTf) significantly accelerates the reaction of DMC formation when using acetals as dehydrating agent in the presence of a weakly basic tin-based catalyst (like Bu2Sn(OMe)2 or Bu2SnO). Moreover, adding acid catalysts to tin-free oxide catalytic systems was also reported to strongly enhance the performances in terms of yields to DMC, regardless to the use of acetals. A very large variety of catalysts and systems have been investigated up to now, including, e.g. organometallic compounds [36], metal tetra-alkoxides [37], potassium carbonate [38], ZrO2 [39,40], H3PW12O4–ZrO2 [41], CeO2 [42], SiO2 and VSO supported Cu–(Ni,V,O) and Cu–Ni systems [43,44] as well as bimetallic Cu–Ni active phases supported on carbon nanotubes and thermally expanded graphite [45,46]. Detailing all the catalytic systems and associated reaction conditions investigated for valorising CO2 into DMC could therefore, as previously introduced, consist in a separate review, since topic remains highly challenging for the worldwide community, which considers that this synthetic route – if it could be successfully managed first at the laboratory scale and further at the industrial one – is believed to be the most economic one. Let us here only focus on basic catalytic systems and on zirconia. Fang and Fujimato evidenced the efficiency of the reaction on a basic catalyst in the presence of methyliodide, acting as a promoter [38]. The reaction was performed in a closed vessel at a temperature of 100°C and under 50atm. Amongst the different basic catalysts evaluated for the reaction, the K2CO3 carbonate potassium appeared to be the most interesting candidate, dimethylether (CH3OCH3) being the sole by-product obtained together with DMC. Decreasing the reaction temperature down to 80°C allowed a DMC selectivity of 97% to be reached compared to only 67% at 100°C. The mechanism reaction pathway proposed passes through a methanol deprotonation step (Eq. (24)) followed by the insertion of CO2 (Eq. (25)), the HI species formed at the end of the catalytic cycle course (Eq. (26)) reacting with methanol to recover the CH3I promoter (Eq. (27)). (24) CH3OH+Base→CH3O− +H+⋯Base (25) CH3O− +H+⋯Base+CO2 →CH3OC(O)O− +H+⋯Base (26) CH3OC(O)O− +H+⋯Base+CH3I→CO(OCH3)2 +HI+Base (27) CH3OH+HI→CH3I+H2O Zirconia was also reported to be an excellent catalyst for the overall reaction (Eq. (23)), with a total selectivity towards DMC (calculated from methanol) being obtained around 140–190°C and under 50MPa, without the addition of any promoters [40]. Based on an in situ Infra Red study, Jung and Bell have proposed a reaction mechanism, during which the adsorption of methanol occurred first on the oxygen atoms of Zr+ cations. The dissociation of the adsorbed methanol molecule led to the formation of a methoxy (CH3O−) functional group and of a proton, this latter reacting with a hydroxyl surface group of zirconia to give a water molecule (Eq. (28)). (28) The insertion of CO2 is achieved at the level of the Zr–O binding, assisted by the interactions between carbon and the oxygen atoms of the Zr–O groups. This led to the formation of a methylcarbonate group intermediate (Eq. (29)). (29) Subsequently, the insertion of a second molecule of methanol on the methylcarbonate functional group follows a similar pathway than that of CO2, resulting to the dimethylcarbonate formation (Eq. (30)). It is interesting to note that monoclinic zirconia led to higher performances when compared to tetragonal zirconia, due to a greater force of the Zr4+–O2− centres, which allowed to improve the insertion kinetic for methanol and CO2 [47]. (30) However, the DMC production obtained through this alternative one-step synthesis way remains still limited due to the equilibrium nature of the reaction Eq. (23), being unfortunately in favour of the reactants, to the difficulty in activating CO2 and to the catalyst deactivation by in situ produced water. It should be mentioned that Sakakura proposed the use of dehydrated derivates of methanol such as trimethylorthoacetate over Bu2Sn(OMe)2 catalysts for (i) overcoming the equilibrium constraint and (ii) avoiding the catalyst deactivation [48] (Eq. (31)). (31) C(OCH3)4 +2CO2 →2CO(OCH3)2 +CH3C(O)OCH3 4.2 Transesterification of ethylene carbonate and urea This synthesis way is based on a transesterification reaction, consisting in the reaction of methanol either on ethylene carbonate or on urea. Concerning the ethylene carbonate, this led to the catalytic formation of DMC and ethylene glycol (Eq. (32)). It should be mentioned that this transesterification process suffers from the expensive cost of the ethylene carbonate raw reactant, but is however industrialized by companies such as Texaco, Shell and others in China. (32) This reaction is usually occurring in a batch mode at temperatures ranging from 100 to 150°C under an 80bar pressure. The interesting study of Kniton reported the efficiency of numerous homogeneous catalysts based on zirconium complexes, such as for instance ZrCl4 or zirconium acetylacetonate, or based on titanium such as titanium acetylacetonate [49]. Selectivities towards methanol around 98% (calculated from the methanol conversion) can be achieved. Bhanage et al. showed that basic oxides and magnesium oxide especially, were excellent catalysts for this reaction, with total selectivity towards DMC [50]. However, the reaction equilibrium, strongly in favour of the reactants, remains a restricting drawback for DMC production, and leads to separation problems for the resulting product/reactant mixture. In order to overcome this major drawback, the equilibrium can be shifted towards the products by removing them by distillating the methanol/DMC azeotrop [51]. The Bayer company patented in 1993 a similar derivative process, in which a catalytic bed-based column was maintained at a temperature greater than the boiling temperature of both methanol and DMC, but lower than that of both ethylene glycol and ethylene carbonate [52]. In this process, ethylene carbonate is introduced at the top of the column whereas methanol is counter-injected in the gas phase at the bottom of the column. The reactor temperature being set as intermediate between the boiling temperatures of the different compounds involved, ethylene glycol is separated at the bottom of the column together with ethylene carbonate, whereas both DMC and methanol are released in the gas phase at the top of the column. During the course of the process, the ethylene glycol formed can be recycled by its reaction with urea to get ethylene carbonate, which can be fed back to the transesterification process. Although this relatively unexplored reaction compared other ways of synthesizing DMC, like, e.g. directly from CO2 could be considered as an environmentally friendly alternative for the replacement of harmful and undesirable compounds and could be an interesting path for the production of a great number of chemical intermediates, only few solids have been investigated for being used as catalysts under mild conditions (atmospheric pressure and low temperature). One can mention alkalimetals [53], zeolite [50], smectites [54], hydrotalcites [55], basic salts such as Na3PO4 and Na2CO3 [56], quaternary ammonium salts [57], composites [58], ionic liquids [59] or basic Na-containing aluminates derived from heat-treated NaAlCO3(OH)2 dawsonites [60]. The main advantage of the transesterification route remains the co-production of monoethylene glycol exclusively and the absence of diethylene glycol and polyethylene glycols as in the conventional route of ethylene glycol production by hydration of ethylene oxide. The considerable commercial interest of ethylene glycol in the manufacture of polyester fibre and films, associated to the fact that ethylene carbonate can be obtained by reaction of ethylene oxide with CO2 or via bio-ethylene obtained by dehydration of biomass-fermented alcohol, could open a new ‘renewable’ route for producing DMC and ethylene glycol. DMC synthesis by transesterification can be also performed via urea. In contrary to the ethylene carbonate way, the process benefits from the abundant resource and the low cost of the raw reactants. However, like for the ethylene carbonate transesterification, the very high free enthalpy of the reaction (ΔG 100°C =13.8kJ/mol) transferred the reaction equilibrium in favour of the reactants (Eq. (33)). (33) NH2CONH2 +2CH3OH→(CH3O)2CO+2NH3 Since no water is formed, the reaction mixture (in the overhead product) does not form any methanol–water–DMC ternary azeotrop, and the subsequent separation and purification of DMC is easy. This synthesis is performed in two steps via a methylcarbamate intermediate. The first step consists in the reaction between methanol and urea to get methylcarbamate at a temperature close to 100°C (Eq. (34)). Further, the methylcarbamate reacts with methanol to form DMC between 180 and 190°C (Eq. (35)). (34) NH2CONH2 +CH3OH→NH2COOCH3 +NH3 (35) NH2COOCH3 +CH3OH→(CH3O)2CO+NH3 Both Eqs. (34)/(35) reactions are catalyzed by an equimolar mixture of a Lewis acid like Al(iBu)2H and of a Lewis base like PPh3, and are performed consecutively. 5 Vapour phase methanol oxycarbonylation 5.1 The vapour phase methanol oxycarbonylation reaction The processes for synthesizing DMC at the industrial scale suffer from several drawbacks. In the Enichem process, the presence of large amounts of copper (I) chloride causes the formation of hydrochloric acid. This implies that the conception and the design of the reactor should take into account phenomena of plant-corrosion under the simultaneous action of water and of hydrochloric acid. A vapour phase process like the UBE process seems more economical than a batch process. But, although the methylnitrite carbonylation could avoid the formation of large amounts of CO2 from CO and could lead to a higher productivity to DMC, the UBE process suffers from safety problems, with risks of explosion related to the use of the Pd/NO/O2 mixture, and also due to the strong toxicity of the methylnitrite reactant. Indeed, concentrations greater than 50ppm cause nausea and loss of consciousness, so that methylnitrite is considered as more toxic than carbon monoxide [61]. In order to overcome all those drawbacks, the Dow Chemical company studied since the end of the 1980s a vapour phase process of oxycarbonylation of methanol [62,63]. This process, directly derived from the liquid phase Enichem process, is based on the same reaction (Eq. (36)). (36) 2CH3OH(g) +CO(g) +0.5O2(g) →(CH3O)2CO(g) +H2O(g) The hydrocarboned by-products are dimethylether (DME), methylformate (MF), dimethoxymethane (DMM) and methylacetate (MA), obtained according to Eqs. (37)–(40), respectively. (37) DME: 2CH3OH(g) →CH3-O-CH3(g) +H2O(g) (38) MF: 2CH3OH(g) +O2(g) →HCOOCH3(g) +2H2O(g) (39) DMM: 3CH3OH(g) +0.5O2(g) →(CH3O)2CH2(g) +2H2O(g) (40) MA: 3CH3OH(g) +O2(g) →CH3COOCH3(g) +3H2O(g) Methanol is generally injected into a vaporization chamber through a pump, before to be fed into a fixed-bed catalytic reactor with carbon monoxide and oxygen. The reaction is usually performed at temperatures ranging from 100 to 130°C under middle pressures (10–30bar). The temperature remains limited to about 130°C, since non-catalytic oxidation of carbon monoxide cannot be considered as negligible for higher temperatures [64]. This process is in keeping with the general pattern of the transfer of the methanol oxycarbonylation from the liquid to the gas phase, in order to replace the Enichem process. The catalytic materials located inside the reactor are generally composed of a support (activated charcoal, zeolite, etc.) on which is deposited or grafted an active phase based on copper. Many supports and active phases have been investigated and patented for this reaction. The most valuable ones are reported in the following section. 5.2 Active carbon supported chloride-containing catalysts Activated charcoal remains the most widely used catalyst support in the case of chloride catalysts in the vapour phase methanol oxycarbonylation. Although it leads to the best initial performances, its stability/deactivation behaviour as a function of time on stream is an important and critical parameter to review. 5.2.1 With copper (II) chloride Curnutt and Harley can be considered as pioneers in the development of vapour phase DMC synthesis processes for the Dow Chemical company. They studied catalysts prepared by impregnating on activated charcoal CuCl2 copper chloride with ethanol, or a copper methoxychloride-based pyridine complex [C5H5NCu(OCH3)Cl] with pyridine [64]. They have investigated many supports, and amongst them, activated charcoal exhibited the most interesting performances (Fig. 6 ), assigned to: • The unstability of the active phase by the surface oxygen atoms (or the surface hydroxyl groups) in the case of inorganic oxides [3]. • A better stabilisation of the active phase on the activated charcoal due to its electrical conductivity (although weak compared to other forms of carboned supports), which would help the transfer of the electrons involved in the oxydo-reduction mechanism of the DMC synthesis. However, no experimental proof could evidence such a hypothesis. The X-ray diffraction pattern of activated charcoal impregnated with copper chloride (CuCl2) shows the total absence of any diffraction peaks assigned to copper chloride for concentrations lower than 10wt.%. In the case of higher concentrations, the diffraction peaks observed and corresponding to copper chloride allowed its crystallite size to be derived. This latter increased with the copper content, being calculated at 30 and 37.4nm, for loadings of 12.3 and 19.7wt.%, respectively [65]. The absence of any diffraction peaks at low loading was as usually attributed to the good dispersion of copper at the activated charcoal surface. The Cl/Cu molar ratio was generally reported to be lower than the theoretical value of 2 after the catalyst impregnation and the drying procedure, although it can near this value for increasing copper loadings [66,67]. Indeed, Tomigishe et al. observed a Cl/Cu molar ratio of 1.2 and 1.8 for 2.5 and 7.5wt.% of Cu, respectively [64]. A possible explanation of this chloride loss after the catalyst drying resulted from the EXAFS study conducted by Kriventsov et al. and was related to the interaction between the copper (II) chloride and the oxygenated surface groups of activated charcoal (AC-COOH and AC-OH), which caused a loss in hydrochloric acid molecules (Eqs. (41) and (42)) [68]. (41) AC-COOH+CuCl2 →AC-COOCuCl+HCl (42) AC-OH+CuCl2 →AC-OCuCl+HCl For a copper content lower that 5wt.%, copper would be mainly linked to the oxygenated surface groups of activated charcoal (corresponding to a CuCl stoichiometry), while a multilayer coverage would be formed for higher copper contents, built on a CuCl2 stoichiometry. Yamamoto et al. evidenced by EXAFS and XANES the presence of copper (I) coordinated by three atoms of chlorine at the surface of catalysts containing 1.2wt.% of Cu, and they considered both carboxylic and hydroxyls groups at the carbon surface as reducing centres, promoting the CuIICl2 to CuICl reduction and leading to the observed loss of chlorine [67]. From a catalytic activity point of view, the optimum in copper content is ranging from 5 to 10wt.% depending on the authors. Han et al. obtained a methanol conversion of 21% at a DMC selectivity of 80%, calculated from the methanol conversion, whatever the copper loading in the case of copper contents greater than 5wt.% [69]. By contrast, at lower amounts, Punnoose et al. reported that the activity was increasing with the copper content [70]. They observed that the carbon monoxide desorption curve becomes non-sensitive to the copper content after this 5wt.% level, due to a constant number of available active sites. They considered that the copper deposit turned from a monolayer to a multilayer coverage system, thus explaining the stagnation of the activity at high copper loadings. 5.2.1.1 Reaction mechanism Curnutt et al. have proposed a three-step mechanism, in which the methanol reacted first with the copper chloride catalyst to form a copper methoxychloride [64] following the reaction Eq. (43). (43) CuCl2 +2CH3OH→Cu(OCH3)Cl+CH3Cl+H2O The methoxychloride intermediate further incorporated a carbon monoxide molecule (Eq. (44)) before finally reacting with a second methoxychloride molecule to obtain the DMC (Eq. (45)). The insertion of the carbon monoxide molecule follows a similar reaction pathway than that reported in the Enichem process. (44) Cu(OCH3)Cl+CO→Cu(COOCH3)Cl (45) Cu(COOCH3)Cl+Cu(OCH3)Cl→CO(OCH3)2 +2CuCl The initial copper (II) state is recovered by oxidizing the copper (I) chloride by oxygen into copper (II) methoxychloride together with water formation (Eq. (46)). (46) 2CuCl+0.5O2 +2CH3OH→2Cu(OCH3)Cl+H2O Kinetic studies reported that the reaction of DMC formation was of zero order relative to oxygen [64,71], whereas the reaction orders relative to carbon monoxide and methanol were ranging from 0.8 to 1, and 1 to 1.4, respectively. The oxidation of copper (I) by oxygen seems to be more rapid than the formation of copper methoxychloride and than the insertion of carbon monoxide. The optimal formation of DMC thus occurred with a reactant feed containing methanol and carbon monoxide in large excess relatively to oxygen. This was confirmed by investigating the influence of the reactant ratios within the reaction feed, with an optimal yield to DMC being achieved for CO/MeOH and O2/MeOH molar ratios greater than 4 and set at 0.1, respectively [72] 5.2.1.2 Catalyst deactivation and regeneration The literature reports that activated charcoal supported CuCl2 catalysts suffer from the deactivation of the catalyst as a function of time on stream, although it remains scarcely studied and quantified. Itoh et al. showed that the DMC yield decreased from 50% after 50h of reaction on stream [72]. Numerous authors, including Curnutt and Harley [64] especially, claimed that the catalyst deactivation resulted from a particle sintering and an aggregation process, forming 0.2–1μm size particles, and from a massive chlorine loss. Indeed, the Cl/Cu weight ratio for a catalyst containing 10.3wt.% of CuCl2, decreased from the initial theoretical ratio of 1.12 down to 0.24 after 90h of time on stream. This decrease in the Cl/Cu weight ratio was accompanied by the formation of two new crystallized phases, i.e. the Cu2(OH)3Cl paracatamite and Cu(OH)Cl. Within the structure of both phases, the copper atoms were only linked to oxygen atoms [73], so that substitution of chlorine atoms by hydroxyl groups occurred. Some authors revealed the presence of trace amounts of copper (II) oxide. This chlorine loss could result either from the direct reaction of methanol with copper (II) chloride to form paracatamite and chloromethane (Eq. (47)), or from the hydrolysis of chlorine into hydrochloric acid with formation of chloromethane by further reacting with methanol. The formation of chloromethane was thus related to the catalyst deactivation. (47) CuCl2 +3CH3OH→Cu2Cl(OH)3 +3CH3Cl A regenerative treatment of the catalyst with HCl diluted in nitrogen or with other chloride molecules (CH3Cl, etc.) was reported to be efficient for recovering almost the initial methanol conversion, and also for improving the catalyst stability, even after several successive regenerations (Fig. 7 ). According to Itoh et al., the loss of chlorine during the impregnation step would be overcome during successive regenerations, so that the catalyst stability could be even improved compared to that shown by freshly prepared catalysts [72]. According to Curnutt and Harley, another way for limiting the deactivation of the catalyst consisted in promoting the CuCl2/AC catalyst with MgCl2 or KCl (about 5wt.%) [64]. The reaction between the promoter and the copper chloride favoured the formation of chlorocuprates such as KCuCl3 or MgCuCl4·6H2O. Such chlorocuprates displayed a higher Cl/Cu ratio than copper chloride, and would be less sensitive to chlorine extraction, and thus would limit the catalyst deactivation. 5.2.1.3 Counter-ions and active phase nature effects As reported before, the presence of chlorine seems essential for designing a catalyst with a high activity. This essential role of chlorine seems in agreement with the study of the role of counter-ions performed by Dunn et al., using different copper salts impregnated on activated charcoal for the synthesis of diethylcarbonate (DEC) in autoclave conditions (Fig. 8 ) [74]. Replacing copper (II) chloride by copper acetate or nitrate led to form 4 times less of DEC, and around only half when copper (I) chloride was used. According to Curnutt and Harley, the presence of the γ-Cu2Cl(OH)3 paracatamite phase on the catalyst could be responsible for the deactivation of the catalyst [64], although the literature remained very controversial on this point, since numerous authors [69,75,76] have reported that a second impregnation of CuCl2/AC by a hydroxide solution promoted the formation of Cu2Cl(OH)3 after drying and resulted in catalysts with higher performances than in the case of the CuCl2/AC reference, as reported by Ma et al. (Table 6 [76]). The nature of the counter-cation (K+, Na+, Li+, etc.) used during the impregnation of the hydroxide did not significantly influence the conversion and the selectivity to DMC. By contrast, the Cu/OH molar ratio appeared to be a crucial parameter to control, being directly related to the DMC production. Several studies showed that a value of 1 led to the best catalytic performances [76,77]. In parallel, Han et al. have reported that the crystallographic structure of the Cu2Cl(OH)3 was depending on the Cu/OH molar ratio, Cu2Cl(OH)3 existing with two different crystallographic structures: the α-Cu2Cl(OH)3 atacamite and the γ-Cu2Cl(OH)3 paratacamite, with orthorhombic and rhombohedric structures, respectively [78]. X-ray diffraction and Spectroscopy X studies evidenced that atacamite was the main phase for a Cu/OH ratio of 2, whereas this was reversed for a Cu/OH ratio of 1. This was in agreement with the work of Punnoose et al., who explained that the amount of DEC formed (similar synthesis than for DMC, by substituting methanol by ethanol) was directly linked to the intensity of the X-ray diffraction peak assigned to the paratacamite phase, with a maximum for a Cu/OH ratio of 1 [70]. Two non-exclusive hypotheses have been proposed for explaining this behaviour. The greater activity shown by the paratacamite relatively to the atacamite and the copper (II) chloride would result from: (i) a more important adsorption of carbon monoxide on the paratacamite surface, according to the temperature-programmed desorption study performed by Han et al. [78], (ii) a more easy reduction of the copper (II) into copper (I) within the paratacamite structure [79]. Cu/OH ratios greater than 1 resulted in a lower amount of paratacamite phase together with larger amounts of salt crystals (NaCl, KCl, etc.) blocking the access of the reactants to the active centers. From an industrial point of view, the impact on the catalytic activity of the feed contamination by-products or impurities has to be taken into account [72]. Nitrogen, hydrogen and carbon dioxide have no effect on the catalytic process. By contrast, adding water to the feed has a detrimental effect, by decreasing the methanol conversion, a water content of 5.5wt.% in the methanol feed resulting in a drastic drop of the methanol conversion from a half. According to Itoh et al., this could be attributed to the hydrolysis of DMC (Eq. (48) [72]). (48) CO(OCH3)2 +H2O→2CH3OH+CO2 The catalytic performances are thus strongly limited by the amount of water in the reactor and its removal outside of the catalytic bed is an important process parameter, like for the Enichem process. 5.2.2 With CuCl2–PdCl2 bimetallic chlorides CuCl2–PdCl2 bimetallic catalysts, usually labelled as Wacker-type catalysts, are often used for the low temperature oxidation of carbon monoxide [80,81]. The use for the DMC synthesis by vapour phase oxycarbonylation of methanol, of such catalysts supported on high surface area activated charcoal (CuCl2–PdCl2/AC), obtained by co-impregnation with copper (II) and palladium (II) chlorides, led generally to an increase in the DMC production when compared to that obtained on the corresponding CuCl2/AC and PdCl2/AC single systems. Dunn et al. have observed that the weight percentage of DMC was increasing from 3% to 9,5% on CuCl2 and CuCl2–PdCl2, respectively [74]. However, this remained controversial in the literature, other authors observing the reverse phenomena. The selectivity to DMC calculated from carbon monoxide also decreased, due to the larger amounts of carbon dioxide formed [69]. 5.2.2.1 Reaction mechanisms The reaction mechanisms proposed to explain the high reactivity of Wacker-type catalysts and the synergy effect between palladium and copper, are similar to those established for the oxidation of carbon monoxide (Eqs. (49)–(52)). The insertion of carbon monoxide occurs on the palladium chloride to form the Pd(CO)Cl2 intermediate [82] that can further react with methanol to form DMC and metallic palladium, subsequently re-oxidized by the copper (II) chloride with the formation of copper (I) chloride. This later reacts with oxygen to form copper (II) chloride. The temperature-programmed reduction study performed by Cao et al. also evidenced the greater reducibility of copper (II) into copper (I) in the bimetallic system compared to that in the CuCl2/AC single system [83]. By X-ray diffraction analysis, the absence of any diffraction peaks assigned to copper or palladium species confirmed the good dispersion of the phases at the support surface (49) PdCl2 +CO→Pd(CO)Cl2 (50) Pd(CO)Cl2 +2CH3OH→(CH3)2CO+Pd0 +2HCl (51) Pd0 +2CuCl2 →PdCl2 +2CuCl (52) 2CuCl+2HCl+0.5O2 →2CuCl2 +H2O Jiang et al. explained the great reactivity of bimetallic catalysts by the occurrence of two distinct mechanisms [84]. DMC would be produced following the mechanism reported above, and by a mechanism close to that proposed by Curnutt et al., and only involving copper (Eqs. (53)–(55)). The copper (I) chloride phase, which initiates this second mechanism, would result from the oxidation of palladium by the copper (II) chloride (Eq. (51)). (53) 2CuCl+2CH3OH+0.5O2 →2Cu(OCH3)Cl+H2O (54) 2Cu(OCH3)Cl+CO→(CH3O)2CO+2CuCl (55) 2CuCl+2HCl+0.5O2 →2CuCl2 +H2O XPS studies performed by Jiang et al. over different CuCl2/AC, PdCl2/AC and CuCl2–PdCl2/AC systems evidenced the presence of the Cu(I)/Cu(II) and Pd(0)/Pd(II) couples in the CuCl2/AC and PdCl2/AC catalysts, respectively. The reduction process leading to the reduction of Pd(II) to metallic palladium were similar to that already reported in the case of the copper reduction on activated charcoal. By contrast, all the previously cited species were observed in the CuCl2–PdCl2/AC mixed system, except metallic palladium. This was explained by a preferential reduction of copper (II) on the activated charcoal sites, relatively to that of palladium (II), due to a strongly weaker redox potential for the Cu2+/Cu+ (0.15V vs. Ag+/AgCl) when compared to that of the Pd2+/Pd0 couple (0.82V) [84]. 5.2.2.2 Promoter effects Numerous promoters such as sodium hydroxide, potassium chloride or different acetates have been used with bimetallic systems [64,85–87]. Impregnation with a soda solution allowed also the paratacamite phase to be obtained, like in the case of CuCl2/AC catalysts, whereas a subsequent addition of potassium chloride increased also the catalytic performances. Indeed, the yield into diethylcarbonate (DEC) increased from 17wt.% to more than 31wt.% for a NaOH–CuCl2–PdCl2/AC catalyst with addition of potassium chloride. Adding KCl initiates the transformation of a part of the Cu2(OH)3Cl paratacamite into the Cu(OH)Cl phase, which, due to its suitable structure, allowed a very rapid electron transfer between copper and palladium (with a short length Cu–Cl binding) [88]. Consequently, both oxidation and reduction processes, for palladium and copper, respectively, were thus more rapid. In the case of a single promoter (i.e. in the absence of sodium hydroxide), potassium acetate appeared to be a better promoter than potassium chloride, according to Jiang et al. [87], the DMC production reaching more than 200gl−1 h−1 with potassium acetate, when it amounted only 70gl−1 h−1 with potassium chloride. However, differences within the acetate family were evidenced, the influence of acetates on the DMC synthesis being ranked following the basicity order: CH3COOLi<CH3COONa<CH3COOK The beneficial effect of acetates was attributed to the combination of several phenomena. The loss of chloride during the impregnation step could be limited by the reaction between acetate and both copper and palladium chlorides (Eq. (56)), allowing simultaneously the formation of intermediate phases, reactive for the DMC synthesis. (56) PdCl2 +CuCl2 +CH3COOK→Pd(CO)Cl2 +Cu(OCH3)Cl+KCl However, even if the loss of chloride during the impregnation step remained limited, the catalyst deactivation on stream due to the loss of chloride was not inhibited during the reaction. In parallel, according to Cao et al., the potassium acetate would promote the formation of paratacamite by neutralizing acidic groups located at the activated charcoal surface, reported to inhibit the paratacamite formation. Indeed, activated charcoal supports treated with water, potassium hydroxide or by reduction with hydrogen contained numerous basic surface groups, contrarily to supports treated with nitric acid or oxidized under air, for which the main surface groups are acidic carboxylic functional groups. The X-ray diffraction study performed by Yang et al. evidenced the relationship between the chemical groups at the support surface and the active phase formed during the impregnation process [75]. Indeed, supports with many basic surface groups favoured the formation of paratacamite, while supports with many acidic surface groups were paratacamite-free. This was in agreement with the catalytic testing, which highlighted that the activity of the catalysts was increasing with increasing the amounts of paratacamite. 5.2.2.3 Solvent effects The nature of the solvent used for impregnating the support seemed also to play an important role. The catalysts impregnated with an ethanolic solution displayed a greater activity than those prepared with a pure aqueous solution. The order in the different impregnation steps, including the promoter (CH3COOK, etc.), the copper and the palladium precursors, also influenced the dispersion of the active phase, and consequently the catalytic activity of the systems [83]. However, such studies remained very scarcely reported. 5.2.3 With Cu2(OH)3Cl and bimetallic Cu2(OH)3Cl–PdCl2 chloride catalysts The Cu2(OH)3Cl phase was usually obtained by adding Cu(NO3)3 copper nitrate to the CuCl2 copper chloride onto the active carbon support material as described by Park et al. [81]. After the co-impregnation of both copper salts and a first drying at room temperature, the Cu2(OH)3Cl phase was obtained after helium treatment at 150°C for 2h. Fig. 9 shows the X-ray diffraction patterns of activated charcoal supported Cu2(OH)3Cl catalysts for 5 and 10wt.% of copper as examples. Beside the broad peaks attributed to high surface area activated carbon, they evidenced the main Cu2(OH)3Cl crystallographic phases usually observed, i.e. the paracatamite and the atacamite phases. Over activated carbon-based catalysts, adding palladium chloride, mainly using the palladium tetraamine chloride as precursor, allowed an increase in the DMC production to be obtained when compared to the palladium chloride-free catalyst, with a significative increase both in the methanol conversion and in the selectivity to DMC calculated from methanol. Indeed, a gain in STY of almost a half was usually observed. The results reported led to establish a ranking as follows in terms of DMC production (Eq. (57)): (57) PdCl2–CuCl2–Cu(NO3)2/AC>CuCl2–Cu(NO3)2/AC>CuCl2/AC However, adding palladium caused a drastic decrease in the selectivity to DMC calculated from CO, as a result of the strong increase in the oxygen conversion with massive production of CO2, due to the good performances shown by such catalytic systems for the low temperature CO oxidation, for which Park et al. have proposed a reaction mechanism reported in Fig. 10 [81]. This model proposed that the palladium chloride could interact with the Cu2(OH)3Cl phase through a chlorine atom and a hydroxyl group. The attack of palladium chloride by carbon monoxide led to substituting chlorine atoms by a carbon monoxide molecule and a hydroxyl group together with the production of hydrochloride acid. It has been shown that water favoured the oxidation of carbon monoxide [89], and in the present case, water could directly result from the synthesis of DMC or from secondary reactions. Then CO2 produced from carbonyl and hydroxyl ligands induced the reduction of palladium (II) into metallic palladium, subsequently easily reoxydized through the copper (II) of the Cu2(OH)3Cl phase (Cu2+ +Pd0 →Cu+ +Pd2+ oxydo-reduction reactions). The last step consisted in the reoxydation of copper (I) of the Cu2(OH)3Cl structure by oxygen. Unfortunately, oxygen from the reaction feed was used mainly for producing CO2, and strongly limited the formation of DMC, even if a moderate increase in the DMC production was observed. This remained the main drawback of bimetallic Cu–Pd catalytic systems applied to the vapour phase oxycarbonylation of methanol, i.e. the competition between the direct oxidation of carbon monoxide and the synthesis of DMC. This competition was strongly marked by the fact that both reactions occurred through a similar mechanism, thus limiting the number of active sites available for synthesizing DMC. Fig. 11 described the mechanism proposed by Zhang et al. for the synthesis of diethylcarbonate, here adapted to the synthesis of DMC [88], and similar to that proposed by Park et al. for the direct oxidation of carbon monoxide, by substituting water by methanol. In addition, one should not forget that the large increase in the exothermic carbon monoxide oxidation reaction resulted in a strong increase in the temperature of the catalyst bed, especially when high surface activated charcoal with low thermoconductivity was used, leading to a possible temperature boom till no oxygen remained available in the feed at the catalyst level. 5.3 Chlorine-free zeolite-based catalysts Zeolitic materials are aluminosilicates made by AlO2− and SiO2 tetrahedra, following a M x/n n+ (Al x Si y O2(x+y)) x− zH2O overall formula, in which M represents an exchangeable cation (alkaline, alkaline-earth, transition metal, proton, etc.). This cationic exchange characteristic directly results in the use of zeolite in catalysis. Copper-exchanged zeolites have been used as catalysts notably for the selective reduction of nitrogen oxide [90,91], gazole desulfuration [92] or as adsorbent [93]. However, very few works have been reported on the use of copper-exchanged zeolites for synthesizing DMC. In 1996, King was the first author to show that the acidic form of the Y zeolite (labelled as H-Y) exchanged with copper was an active catalyst for synthesizing DMC by the vapour phase methanol oxycarbonylation at 130°C [94]. Three main copper exchange procedures are reported: liquid phase, HAR high-temperature anhydrous reaction and vapour phase exchanges. 5.3.1 Liquid phase copper exchange This exchange mode remains the main process described by the literature, and is usually performed with copper (II) nitrates as copper source dissolved into water, followed by a drying around 100°C. Without any post-treatments, no activity for synthesizing DMC around 130°C could be observed. This inactivity is attributed by King to the stability of the Cu2+ ion, that cannot be reduced into the Cu+ cupric ions. This inhibited the Cu+/Cu2+ catalytic cycle, that could not lead to DMC through the (CH3O-Cu)+Y− intermediate [95]. The inactivity of liquid phase copper-exchanged zeolites for the DMC synthesis rendered necessary the use of post-synthesis activation treatments. ESR studies by Takahashi et al. [93] and Gédéon et al. [96] showed that a part of CuII could be self-reduced in CuI at 450°C under helium, with 50% and 75% of reduction efficiency for 1 and 12h treatments, respectively. The self-reduction mechanism generally admitted is as follows [97,98]: (58) 2[Cu2+OH−]+ ↔[CuOCu]2+ +H2O (59) [CuOCu]2+ ↔2Cu+ +0.5O2 Numerous authors used carbon monoxide as reduction agent [99,100]. Larsen et al. showed that a CO/He (4mol.%) treatment at 45°C over a Cu-ZSM5 zeolite obtained by liquid phase exchange with nitrates led to 75% reduction efficiency into CuI [101]. However, the performances for the DMC synthesis remained limited by the relatively low amount of copper exchanged following the liquid phase procedure. The dissolution of copper salts in water caused the formation of hydrolyzed species such as Cu(OH)+, Cu(OH)3 − or Cu(OH)4 2−, hindering the suitable exchange with the zeolite because of steric limitations [102]. Performing the exchange at acidic pH (lower than pH 6 especially) led to limit the presence of the hydrolyzed species, whereas increasing the solution exchange temperature allowed an increase in the amount of exchanged copper. However, this temperature increase can result in the detrimental destroy of the zeolitic structure. The search for more suitable exchange procedures is therefore of high interest. 5.3.2 Solid exchange by high-temperature anhydrous reaction (HAR) This exchange method consists in a high-temperature treatment (650°C) under an inert atmosphere of a mechanical mixture of the zeolite and of a solid copper source (Cu2 IO, CuICl, CuIIO, and CuIICl2), so that the migration of copper atoms and their exchange with the proton of the zeolitic Y− framework can occur. The oxidation degree of copper within the zeolite is directly related to the copper solid source used for the exchange. According to the works of King, only the Cu(I)-Y zeolites prepared by HAR are active for producing DMC [95,103], eliminating the use of CuIIO and CuIICl2 for directly preparing a Cu(I)-based catalyst. It remains also impossible to get a pure Cu(II)-Y zeolite by the HAR treatment, due to the self-reduction of Cu(II) into Cu(I) at high temperature [93]. HAR treatments can suffer from separation problems, due to the use of a mechanical mixture, and therefore performing the exchange in the vapour phase is an efficient alternative. 5.3.3 Vapour phase exchange This exchange mode is the direct transposition of the HAR exchange method to the vapour phase, and is based on the reaction at 650°C through the whole Y zeolite material with gaseous CuCl fed with helium, previously obtained by vaporizing solid CuCl as Cu(I) solid source at the same temperature (Eq. (60) and Fig. 12 ). (60) CuCl+H+-Y− →Cu+-Y− +HCl This method displays several advantages: (i) it allows to avoid a direct contact between the host zeolite and the copper solid source; (ii) the gaseous copper source after vaporization is directly passing through the whole zeolite material; (iii) the low exchange temperature (650°C) compared to the vaporization temperature of CuCl (1490°C) led to a progressive and thus controllable vaporization inside the reactor; (iv) the low fusion temperature of CuCl compared to that of Cu-based impurities (such as Cu2O or CuO) led to create of pure CuClg/He flow. The main interest of using copper-exchanged zeolites for the DMC synthesis results from the absence of chlorine when compared to catalysts based on activated charcoal. Indeed, the chlorine element is playing an essential role in catalysts based on activated charcoal, while Cu(I)-Y catalysts prepared using Cu2O as copper source, also exhibited an activity for synthesizing DMC. It has been advanced that the Y zeolite framework, negatively charged, played the same role than the chlorine element in the CuCl2/AC catalysts [94,103]. A mechanistic study by in situ Infra Red revealed the presence of the (CH3-O-Cu)+ methoxide group, already evidenced in the mechanism proposed by Romano et al. for the Enichem process. Those observations were recently confirmed by Anderson and Root [104]. During the first step, methanol adsorbed on the zeolite could react with oxygen to form the methoxide intermediate (Eq. (61)). (61) 2CH3OH+0.5O2 +2Cu+-Y− →2(CH3O-Cu)+Y− +H2O The second step could consist in the insertion of the carbon monoxide at the methoxide level to form the carbomethoxyde (Eq. (62)), which react further with the methoxide to form DMC (Eq. (63)). The insertion of carbon monoxide would be the rate limiting step for the DMC formation. Kinetic studies performed by Anderson and Root showed that competition occurred between the direct adsorption of carbon monoxide on the Cu+-Y− sites of the zeolite (which would not take part to the DMC formation) and the reaction of carbomethoxyde by insertion of carbon monoxide [104]. This competition led to a decrease in the DMC production, especially for high pressure carbon monoxide. (62) (CH3O-Cu)+Y− +CO→(CH3O-COCu)+Y− (63) (CH3O-COCu)+Y− +(CH3O-Cu)+Y− →(CH3O)2CO+2Cu+-Y− The presence of water is a limiting factor in the DMC synthesis. Indeed, at too high vapour pressure, water molecules adsorb on the catalytic sites of the zeolite, leading to diminish the methoxide coverage rate at the catalyst surface, thus decreasing the methanol adsorption. Very few different zeolites have been studied for this reaction, the most stable and efficient catalysts having been prepared by HAR exchange with copper (I) chloride and faujasite structure zeolites. Increasing activity was observed with decreasing the Si/Al atomic ratio (for Y and X-like zeolites), this behaviour being explained by a more important number of Cu(I)-Y sites. Beside to the absence of any chloride atoms within the catalyst, the great advantage of such systems is that no deactivation was observed for 80h on stream. King claimed that such a catalytic performance could be similar to that shown by CuCl2/AC (5wt.% of Cu), the carbon dioxide formation resulting from the direct oxidation of carbon monoxide. Selectivities, calculated from methanol, achieved 80% towards DMC and 20% towards (CH3O)2CH2 dimethoxymethane, respectively, whereas trace amounts of CHOOCH3 methylformate were only detected. The formation of formaldehyde on the Cu(I) sites of the zeolites could consist in the first step of the formation of secondary by-products (Eq. (64)) (64) 2CH3OCu+Y− +0.5O2 →CH2O+2Cu+-Y− +2H2O According to Anderson and Root [105], formaldehyde reacts with methanol on the (H+-Y−) acidic sites of the zeolite to get dimethoxymethane (Eq. (65)). Its hypothesis for the methylformate synthesis is based on reaction between the formic acid, resulting from formaldehyde following Eq. (66), and methanol on copper (0) sites (Eq. (67)). (65) CH2O+2CH3OH→(CH3O)2CH2 +H2O (66) CH2O+0.5O2 →HCOOH (67) HCOOH+CH3OH→CHOOCH3 +H2O The works of Anderson evidenced that it would be necessary to perform the reaction at a temperature higher than 130°C to improve the reaction yield. However, it has recently been shown that the decomposition of dimethylcarbonate occurred above 130°C, leading to a decrease in the reaction yield [106], methanol and formaldehyde being formed during the DMC decomposition. In addition, reacting DMC with oxygen to form carbon dioxide and water is also thermodynamically favoured under such conditions. The decomposition reaction is directly proportional to the DMC partial pressure and takes place on the residual Brönsted sites resulting from the incomplete exchange of the zeolite. Unfortunately neutralizing the remaining unexchanged sites by adsorbing pyridine or trimethylphosphine did not allowed the DMC production to be improved. By contrast, a complementary exchange of those sites by the lithium (I) ion diminishes the DMC decomposition rate of about 30%, without being detrimental to the activity level obtained on Cu+-Y−. In the case of vapour phase exchanged zeolite catalysts, a close relationship was established between the amount of DMC produced and the copper exchange rate, so that zeolites with large amounts of cationic sites such as the Y zeolite especially, displayed a higher DMC production than other zeolites such as ZSM-5 or mordenites. In addition to that, the presence of residual acid sites as a result from a partial exchange of the cationic sites of the zeolite, was responsible for the formation of secondary by-products such as DME and DMM. The great advantage of vapour phase CuCl exchanged Y zeolite catalysts was that stable performances could be obtained on-stream, with no deactivation being observed as it was usually observed for all carbon supported copper-based catalysts. The absence of any chlorine atoms in the catalyst was also very positive, since this resulted in the absence of any on-stream corrosion phenomena inside the micropilot, which remained very detrimental in terms of chemical processes over carbon-based catalysts. One should note that supporting a copper-exchanged Y zeolite on medium surface area (10m2/g) silicon carbide material was recently performed [107]. First, this aimed at the improvement of the catalyst shaping. Further, the thermoconductive nature of the medium surface area β silicon carbide support helped in the control of the temperature of the catalyst bed, so that the usual increase in temperature observed on bulk zeolites could be avoided. This resulted in a decrease in the formation of unwanted by-products such as DME and CO2, even at high temperature. Relatively to the real amount of zeolite anchored on the silicon carbide support, very interesting space time yields to DMC were obtained – higher that for the similar unsupported copper-exchanged Y zeolite. However, since only low amounts of zeolite crystals could be deposited and strongly anchored onto the medium surface area silicon carbide support (about 8wt.%), the DMC production and therefore the overall space time yields to DMC per gram of catalyst (active phase+support material) remained largely in favour of the bulk zeolite material. If the amount of Y zeolite deposited at the surface of the silicon carbide material could be strongly enhanced in the future, then it could be possible to obtain a significative increase in terms of DMC production and of space time yields to DMC per gram of overall catalyst, up to getting a higher productivity than that shown by the bulk zeolites. 6 Conclusion The synthesis of DMC was reviewed with focus on the catalysts, the mechanisms as well as the industrial processes and the reactions involved. The negligible ecotoxicity of DMC with low bioaccumulation and low persistence, led to consider DMC as an environmentally benign chemical, that could enter into the policy of developing clean and eco-friendly processes, so that an increasing interest was devoted to the chemical use and the production ways of DMC. Replacement of dimethylsulfate and methylhalides in methylation reactions, and of the harmful phosgene in polycarbonate and isocyanate syntheses by acting as carbonylation agent, could be considered as the main targeted uses. For producing DMC by other ways than through the old phosgenation process, abandoned with years, we highlighted the interest of developing the vapour phase oxycarbonylation of methanol by carbon monoxide as an alternative to liquid phase methanol oxycarbonylation and methylnitrite carbonylation processes. The catalytic systems could be classified into two main classes, depending on their chloride contents. The chloride-containing catalytic materials consisted of high surface are active carbon supported copper-based catalysts, with either CuCl2 or Cu2(OH)3Cl supported copper-based phases. Palladium as PdCl2 could be added and coupled to both catalytic systems for very significantly increasing the DMC production level, although competition in terms of active sites then occurred between the oxidation of carbon monoxide and the formation of DMC, since very similar reaction mechanisms are involved on such mixed catalytic systems. It should be stressed that the chloride-containing catalytic systems displayed a very high activity at the beginning of their life-time, but irreversibly suffered from a rapid on-stream loss of chloride, that resulted in corrosion problems inside pilots, and in a drastic on-stream drop of performances. Temporary alternatives could be found, by modifying the supported copper-based active phase, but the different stratagems that could be used remained only time-delaying and more or less pronounced deactivation of the catalysts could not be avoided. The chloride-free catalysts remained a promising alternative, which consisted in copper-exchanged zeolitic systems. The more interesting system was that obtained with Y zeolite and through the vapour phase exchange with solid Cu(I)Cl precursor. The main advantage of such systems remained the very good on-stream stability of the catalytic performances, and the absence of any chlorine loss and of any corrosion problem inside the pilots, although the DMC production was unfortunately still low when compared to chlorine-containing activated charcoal-based catalysts. Acknowledgements The authors are sincerely grateful to the Lürgi AG Company, and to Dr. Walter Boll and Dr. Henning Buchold especially, for supporting the study. Appendix A Calculation appendix The methanol conversion was usually defined taking into account the different products formed (DMC, DME, DMM, MF, MA, and CH3Cl) and the respective stoichiometric coefficients of their formation reactions (Section 5.1): C C H 3 OH = x C H 3 Cl + 2 × x DME + 2 × x MF + 3 × x DMM + 3 × x MA + 2 × x DMC ( x C H 3 Cl + 2 × x DME + 2 × x MF + 3 × x DMM + 3 × x MA + 2 × x DMC ) + x C H 3 OH The selectivity S j , of the reaction to the j product could thus be calculated from the CO or from the methanol reactants, giving S j/CO and S j/MeOH, respectively: S j /CO = x j x C O 2 + x DMC × 100 % with j = C O 2 or DMC S j /MeOH = ν j × x j x C H 3 Cl + 2 × x DME + 2 × x MF + 3 × x DMM + 3 × x MA + 2 × x DMC × 100 % with j =CH3Cl, DME, MA, MF, DMM, and DMC. ν j the number of methanol molecules necessary for forming the j product. The reaction yield to DMC was thus usually expressed as: R DMC = C MeOH × S DMC/MeOH × 100 % The hourly weight yield to dimethylcarbonate (STY – space time yield) was usually industrially defined as the weight amount of DMC produced by 1l of catalyst per hour, which corresponds to the catalyst productivity towards DMC S T Y ( g/h/l ) = W F MeOH × M W DMC × Y DMC M W MeOH × 2 × V cat with W F C H 3 OH : weight flow of methanol (g/h); MW DMC and MW MeOH: molar weights of DMC and methanol, respectively; Y DMC: reaction yield to DMC; V cat: volume of the catalyst (l). References [1] P. Tundo M. Selva Accounts of Chemical Research 35 2002 706 [2] D. Delledonne F. Rivetti U. Romano Applied Catalysis A: General 221 2001 241 [3] M.A. Pacheco C.L. Marshall Energy & Fuels 11 1997 2 [4] P.J. Gaylor, Standard Oil Development Co., US Patent 2,331,336 (1943). [5] G.D. Short, ICI, EP Patent 98,691 (1983). [6] D.M. Kane, R.Y. Iwamoto, Union Oil, US Patent 4,904,279 (1990). [7] D.M. Dillon, R.Y. Iwamoto, Unocal, US Patent 4,891,049 (1990). [8] F. Rivetti Compte rendu de l’académie des Sciences 3 2000 497 [9] F. Rivetti, Enichem, US Patent 5,705,673 (1998). [10] Y. Ono Catalysis Today 35 1997 15 [11] Z.H. Fu Y. Ono Journal of Molecular Catalysis 91 1994 399 [12] Y. Ono Applied Catalysis A: General 155 1997 133 [13] Z.H. Fu Y. Ono Journal of Catalysis 145 1994 166 [14] M. Berhil N. Lebrun A. Tranchant Journal of Power Sources 55 1995 205 [15] R. Naejus R. Coudert P. Willmann Electrochimica Acta 43 1998 275 [16] H. Babab A.G. Zeiler Chemical Reviews 73 1973 75 [17] M. Matzner R.P. Kurkjy R.J. Cotter Chemical Reviews 64 1964 645 [18] M. Aresta M. Galatola Journal of Cleaner Production 7 1999 181 [19] A.-A. Shaikh Chemical reviews 96 1996 951 [20] U. Romano, R. Tesel, G. Cipriani, L. Micucci, US Patent 4,218,391 (1980). [21] G. Paret, G. Donati, M. Ghirardini, pour Enichem, EP 460,735 (1991). [22] U. Romano R. Tesel M.M. Mauri Industrial & Engineering Chemistry Research and Development 19 1980 396 [23] T. Matsuzaki A. Nakamura Catalysis Survey of Japan 1 1997 77 [24] U. Romano, pour Enichem, EP Patent 365,083 (1989). [25] U. Romano, R. Tesel, G. Ciprianni, L. Micucci, Enichem, US Patent 4,218,391 (1980). [26] F. Rivetti, U. Romano, pour Enichem S.p.A, EP 534,545 (1992). [27] H. Miyazaki, Y. Shiomi, S. Fujitsu, K. Masunaga, pour UBE Industries, US Patent 4,384,133 (1983). [28] K. Nishimura, K. Fujii, K. Nishihira, S. Uchiumi, pour UBE, US Patent 4,229,589 (1980). [29] N. Manada M. Murakami Y. Yamamoto T. Kurafuji Nippon Kagaku Kaishi 1994 984 [30] T. Matsuzaki, T. Shimamura, S. Satoru, Y. Toriyahara, pour UBE Industries, US Patent 5,292,916 (1994). [31] T. Matsuzaki, T. Shimamura, S. Fujitsu, Y. Toriyahara, pour UBE Industries, US Patent 5,214,184 (1993). [32] K. Nishihira, S. Tanaka, Y. Nishida, T. Matsuzaki, K. Abe, pour UBE industries, EP 559,212 (1993). [33] K. Nishihira Y. Yamamoto S. Tanaka Y. Nishida T. Matsuzaki K. Ohdan A. Nakamura Journal of Chemical Society 93 1997 3721 [34] W.A. Hoffman Journal of Organic Chemistry 47 1982 5209 [35] T. Sakakura K. Kohno Chemical Communications 2009 1312 [36] J. Kizlink Collection of Czechoslovak Chemical Communications 53 1993 1399 [37] J. Kizlink I. Pastucha Collection of Czechoslovak Chemical Communications 60 1995 687 [38] S. Fang K. Fujimoto Applied Catalysis A: General 142 1996 L1 [39] K. Tomishige T. Sakaihiro Y. Ikeda K. Fujimoto Catalysis Letters 58 1999 225 [40] K.T. Jung A.T. Bell Topics in Catalysis 20 2002 97 [41] C.J. Jiang Y.H. Guo C.G. Wang C.W. Hu Y. Wu E.B. Wang Applied Catalysis A: General 256 2003 203 [42] M. Aresta A. Dibenedetto C. Pastore C. Cuocci B. Aresta S. Cometa E. De Giglio Catalysis Today 137 2008 125 [43] X.J. Wang M. Xiao S.J. Wang X.Y. Lu Y.Z. Meng Journal of Molecular Catalysis A: Chemical 278 2007 92 [44] X.L. Wu Y.Z. Meng M. Xiao X.Y. Lu Journal of Molecular Catalysis A: Chemical 249 2006 93 [45] J. Bian M. Xiao S.J. Wang Y.X. Lu Y.Z. Meng Journal of Colloid and Interface Science 334 2009 50 [46] J. Bian M. Xiao S.J. Wang Y.X. Lu Y.Z. Meng Applied Surface Science 255 2009 7188 [47] K.T. Jung A.T. Bell Journal of Catalysis 204 2001 339 347 [48] T. Sakakura Y. Saito M. Okano J.C. Choi T. Sako Journal of Organic Chemistry 63 1998 7095 [49] J.F. Knifton, Texaco Inc., US Patent 4,661,609 (1987). [50] B.M. Bhanage S.-I. Fujita Y. Ikushima M. Arai Applied Catalysis A: General 219 2001 259 266 [51] U. Romano, U. Melis, Anic S.p.a, US Patent 4,062,884 (1977). [52] H.J. Buysch, A. Klausener, R. Langer, F.J. Mais, Bayer, US Patent 5,231,212 (1993). [53] T. Tatsumi Y. Watanabe K.A. Koyano Chemical Communications 1996 2281 [54] B.M. Bhanage S.-I. Fujita Y. Ikushima K. Torii M. Arai Green Chemistry 5 2003 71 [55] Y. Watanabe T. Tatsumi Microporous Mesoporous Materials 22 1998 399 [56] P. de Fillipis M. Scarsella C. Borgianni F. Pochetti Energy Fuels 20 2006 17 [57] E.S. Jeong K.H. Kim D.W. Park S.W. Park J.W. Lee Reaction Kinetics and Catalysis Letters 86 2005 241 [58] T. Wei M. Wang W. Wei Y. Sun B. Zhong Green Chemistry 5 2003 343 [59] H.-Y. Ju M.D. Manju D.W. Park Y. Choe S.W. Park Reaction Kinetics and Catalysis Letters 90 2007 3 [60] G. Stoica S. Abello J. Perez-Ramırez Applied Catalysis A: General 365 2009 252 [61] INRS, fiche toxicologique No. 47, 1996. [62] G.L. Curnutt, The Dow Chemical Company, US Patent 4,625,044 (1986). [63] G.L. Curnutt, The Dow Chemical Company, US Patent 5,004,827 (1991). [64] G.L. Curnutt D.L. Harley Oxygen Complexes and Oxygen Activation by Transition Metals 1988 Plenum Publishing Co. New York p. 215 [65] M.S. Han B.G. Lee B.S. Ahn D.J. Moon S.I. Hong Applied Surface Science 211 2003 76 [66] K. Tomishige T. Sakaihori S. Sakai K. Fujimoto Applied Catalysis A: General 181 1999 95 [67] Y. Yamamoto T. Matsuzaki K. Ohdan Y. Okamoto Journal of Catalysis 161 1996 577 [68] V.V. Kriventsov O.V. Klimov O.V. Kikhtyanin K.G. Ione D.I. Kochubey Nuclear Instruments and Methods in Physics Research A 448 2000 318 [69] M.S. Han B.G. Lee I. Suh H.S. Kim B.S. Ahn S.I. Hong Journal of Molecular Catalysis A: Chemical 170 2001 225 [70] A. Punnoose M.S. Seehra B.C. Dunn E.M. Eyring Energy & Fuels 16 2002 182 [71] D. Fang F. Cao Chemical Engineering Journal 78 2000 237 [72] H. Itoh Y. Watanabe K. Mori H. Umino Green Chemistry 5 2003 558 [73] M.A. Fleet Acta Cristallographica Section B 31 1975 183 [74] B.C. Dunn C. Guenneau S.A. Hilton J. Pahnke E.M. Eyring J. Dworzanski H.L.C. Meuzelaar J.Z. Hu M.S. Solum R.J. Pugmire Energy & Fuels 16 2002 177 [75] P. Yang Y. Cao W.L. Dai J.F. Deng K.N. Fan Applied Catalysis A: General 6434 2003 1 [76] X. Ma Z. Li B. Wang G. Xu Reaction Kinetics and Catalysis Letters 76 2001 179 [77] X. Ma R. Zhao G. Xu F. He H. Chen Catalysis Today 30 1996 201 [78] M.S. Han B.G. Lee B.S. Ahn H.S. Kim D.J. Moon S.I. Hong Journal of Molecular Catalysis A: Chemical 203 2003 137 [79] A.J. Rouco Journal of Catalysis 157 1995 380 [80] W.G. Lloyd, D.R. Rowe, US Patent 3,790,662 (1974). [81] E.D. Park S.H. Choi J.S. Lee Journal of Physical Chemistry B 104 2000 5586 [82] K.I. Choi M.A. Vannice Journal of Catalysis 127 1991 465 [83] Y. Cao P. Yang C.H. Yao N. Yi W.L. Feng W.L. Dai K.N. Fan Applied Catalysis A: General 272 2004 15 [84] R. Jiang Y. Wang X. Zhao S. Wang C. Jin Journal of Molecular Catalysis A: Chemical 3513 2002 1 [85] N.S. Roh B.C. Dunn E.M. Eyring R.J. Pugmire H.L.C. Meuzelaar Fuel Processing Technology 83 2003 27 [86] W. Yanji Z. Xinqiang Y. Baoguo Z. Bingchang C. Jinsheng Applied Catalysis A: General 171 1998 255 [87] R. Jiang S. Wang X. Zhao Y. Wang C. Zhang Applied Catalysis A: General 6183 2002 1 [88] Z. Zhang X. Ma J. Zhang F. He S. Wang Journal of Molecular Catalysis A: Chemical 227 2004 141 [89] E.D. Park J.S. Lee Journal of Catalysis 193 2000 5 [90] M. Iwamoto H. Hamada Catalysis Today 10 1991 57 [91] C. Torre-Abreu M.F. Ribeiro C. Henriques F.R. Ribeiro Applied Catalysis B: Environmental 13 1997 251 [92] A.J. Hernandez-Maldonado R.T. Yang Journal of the American Chemical Society 126 2004 992 [93] A. Takahashi R.T. Yang C.L. Munson D. Chinn Langmuir 17 2001 8405 [94] S.T. King Journal of Catalysis 161 1996 530 [95] S.T. King, M.E. Jones, M.M. Olken, The Dow Chemical Company, US Patent 5,391,803 (1995). [96] A. Gédéon J.L. Bonardet C. Lepetit J. Fraissard Solid State Nuclear Magnetic Resonance 5 1995 201 [97] M. Iwamoto H. Yahiro H. Tanda N. Mizuno Y. Mine Kagawa Journal of Physical Chemistry 95 1991 3727 [98] J. Valyon W.K. Hall Journal of Physical Chemistry 97 1993 7054 [99] J.A. Rabo American Chemical Society 171 1976 332 [100] G.K. Pearce, US Patent 4,717,398 (1988). [101] S.C. Larsen A. Aylor A.T. Bell J.A. Reimer Journal of Physical Chemistry 98 1994 11533 [102] A.J. Hernandez-Maldonado F.H. Yang G. Qi R.T. Yang Applied Catalysis B: Environmental 56 2005 111 [103] S.T. King Catalysis Today 33 1997 173 [104] S.A. Anderson T.W. Root Journal of Molecular Catalysis A: Chemical 220 2004 247 [105] S.A. Anderson T.W. Root Journal of Catalysis 217 2003 396 [106] S.A. Anderson S. Manthata T.W. Root Applied Catalysis A: General 280 2005 117 [107] G. Rebmann V. Keller M.J. Ledoux N. Keller Green Chemistry 10 2007 207",
      "scopus-id": "72149113314",
      "coredata": {
        "eid": "1-s2.0-S1381116909005123",
        "dc:description": "This review reports on the synthesis of dimethylcarbonate (DMC) and deals with the catalysts, the mechanisms as well as the industrial processes and the reactions for producing DMC, within the policy of developing clean and eco-friendly processes. DMC is considered as an environmentally benign chemical due to a negligible ecotoxicity, a low bioaccumulation and a low persistence, so that the production and chemical use of DMC have attracted much attention in the view of the so-called ‘sustainable society’ and ‘green chemistry’, mainly for replacing dimethylsulfate and methylhalides in methylation reactions and for replacing the harmful phosgene in polycarbonate and isocyanate syntheses. Special focus is made on the vapour phase oxycarbonylation of methanol by carbon monoxide in substitution to the old phosgenation process abandoned with years, and as an alternative process to both liquid phase methanol oxycarbonylation and methylnitrite carbonylation processes. The catalytic materials consist in high surface area active carbon supported copper chloride-based catalysts and chloride-free zeolite catalysts, both investigated in terms of catalyst preparation, active phase nature, performances and catalytic mechanisms.",
        "openArchiveArticle": "false",
        "prism:coverDate": "2010-02-15",
        "openaccessUserLicense": null,
        "prism:aggregationType": "Journal",
        "prism:url": "https://api.elsevier.com/content/article/pii/S1381116909005123",
        "dc:creator": [
          {
            "@_fa": "true",
            "$": "Keller, Nicolas"
          },
          {
            "@_fa": "true",
            "$": "Rebmann, Guillaume"
          },
          {
            "@_fa": "true",
            "$": "Keller, Valérie"
          }
        ],
        "link": [
          {
            "@_fa": "true",
            "@rel": "self",
            "@href": "https://api.elsevier.com/content/article/pii/S1381116909005123"
          },
          {
            "@_fa": "true",
            "@rel": "scidir",
            "@href": "https://www.sciencedirect.com/science/article/pii/S1381116909005123"
          }
        ],
        "dc:format": "application/json",
        "openaccessType": null,
        "pii": "S1381-1169(09)00512-3",
        "prism:volume": "317",
        "prism:publisher": "Elsevier B.V.",
        "dc:title": "Catalysts, mechanisms and industrial processes for the dimethylcarbonate synthesis",
        "prism:copyright": "Copyright © 2009 Elsevier B.V. All rights reserved.",
        "openaccess": "0",
        "prism:issn": "13811169",
        "prism:issueIdentifier": "1-2",
        "dcterms:subject": [
          {
            "@_fa": "true",
            "$": "Dimethylcarbonate"
          },
          {
            "@_fa": "true",
            "$": "Oxycarbonylation"
          },
          {
            "@_fa": "true",
            "$": "Carbonylation"
          },
          {
            "@_fa": "true",
            "$": "Phosgene"
          },
          {
            "@_fa": "true",
            "$": "Copper chloride"
          },
          {
            "@_fa": "true",
            "$": "Active carbon"
          },
          {
            "@_fa": "true",
            "$": "Zeolite"
          },
          {
            "@_fa": "true",
            "$": "Catalytic mechanisms"
          }
        ],
        "openaccessArticle": "false",
        "prism:publicationName": "Journal of Molecular Catalysis A: Chemical",
        "prism:number": "1-2",
        "openaccessSponsorType": null,
        "prism:pageRange": "1-18",
        "prism:endingPage": "18",
        "pubType": "rev",
        "prism:coverDisplayDate": "15 February 2010",
        "prism:doi": "10.1016/j.molcata.2009.10.027",
        "prism:startingPage": "1",
        "dc:identifier": "doi:10.1016/j.molcata.2009.10.027",
        "openaccessSponsorName": null
      },
      "objects": {
        "object": [
          {
            "@category": "thumbnail",
            "@height": "35",
            "@width": "399",
            "@_fa": "true",
            "$": "https://api.elsevier.com/content/object/eid/1-s2.0-S1381116909005123-si9.gif?httpAccept=%2A%2F%2A",
            "@multimediatype": "GIF image file",
            "@type": "ALTIMG",
            "@size": "1432",
            "@ref": "si9",
            "@mimetype": "image/gif"
          },
          {
            "@category": "thumbnail",
            "@height": "38",
            "@width": "565",
            "@_fa": "true",
            "$": "https://api.elsevier.com/content/object/eid/1-s2.0-S1381116909005123-si8.gif?httpAccept=%2A%2F%2A",
            "@multimediatype": "GIF image file",
            "@type": "ALTIMG",
            "@size": "3007",
            "@ref": "si8",
            "@mimetype": "image/gif"
          },
          {
            "@category": "thumbnail",
            "@height": "16",
            "@width": "269",
            "@_fa": "true",
            "$": "https://api.elsevier.com/content/object/eid/1-s2.0-S1381116909005123-si7.gif?httpAccept=%2A%2F%2A",
            "@multimediatype": "GIF image file",
            "@type": "ALTIMG",
            "@size": "1015",
            "@ref": "si7",
            "@mimetype": "image/gif"
          },
          {
            "@category": "thumbnail",
            "@height": "25",
            "@width": "364",
            "@_fa": "true",
            "$": "https://api.elsevier.com/content/object/eid/1-s2.0-S1381116909005123-si6.gif?httpAccept=%2A%2F%2A",
            "@multimediatype": "GIF image file",
            "@type": "ALTIMG",
            "@size": "1373",
            "@ref": "si6",
            "@mimetype": "image/gif"
          },
          {
            "@category": "thumbnail",
            "@height": "23",
            "@width": "277",
            "@_fa": "true",
            "$": "https://api.elsevier.com/content/object/eid/1-s2.0-S1381116909005123-si5.gif?httpAccept=%2A%2F%2A",
            "@multimediatype": "GIF image file",
            "@type": "ALTIMG",
            "@size": "919",
            "@ref": "si5",
            "@mimetype": "image/gif"
          },
          {
            "@category": "thumbnail",
            "@height": "14",
            "@width": "322",
            "@_fa": "true",
            "$": "https://api.elsevier.com/content/object/eid/1-s2.0-S1381116909005123-si4.gif?httpAccept=%2A%2F%2A",
            "@multimediatype": "GIF image file",
            "@type": "ALTIMG",
            "@size": "1047",
            "@ref": "si4",
            "@mimetype": "image/gif"
          },
          {
            "@category": "thumbnail",
            "@height": "23",
            "@width": "279",
            "@_fa": "true",
            "$": "https://api.elsevier.com/content/object/eid/1-s2.0-S1381116909005123-si3.gif?httpAccept=%2A%2F%2A",
            "@multimediatype": "GIF image file",
            "@type": "ALTIMG",
            "@size": "1120",
            "@ref": "si3",
            "@mimetype": "image/gif"
          },
          {
            "@category": "thumbnail",
            "@height": "23",
            "@width": "317",
            "@_fa": "true",
            "$": "https://api.elsevier.com/content/object/eid/1-s2.0-S1381116909005123-si2.gif?httpAccept=%2A%2F%2A",
            "@multimediatype": "GIF image file",
            "@type": "ALTIMG",
            "@size": "1337",
            "@ref": "si2",
            "@mimetype": "image/gif"
          },
          {
            "@category": "thumbnail",
            "@height": "15",
            "@width": "66",
            "@_fa": "true",
            "$": "https://api.elsevier.com/content/object/eid/1-s2.0-S1381116909005123-si13.gif?httpAccept=%2A%2F%2A",
            "@multimediatype": "GIF image file",
            "@type": "ALTIMG",
            "@size": "341",
            "@ref": "si13",
            "@mimetype": "image/gif"
          },
          {
            "@category": "thumbnail",
            "@height": "36",
            "@width": "288",
            "@_fa": "true",
            "$": "https://api.elsevier.com/content/object/eid/1-s2.0-S1381116909005123-si12.gif?httpAccept=%2A%2F%2A",
            "@multimediatype": "GIF image file",
            "@type": "ALTIMG",
            "@size": "1691",
            "@ref": "si12",
            "@mimetype": "image/gif"
          },
          {
            "@category": "thumbnail",
            "@height": "15",
            "@width": "261",
            "@_fa": "true",
            "$": "https://api.elsevier.com/content/object/eid/1-s2.0-S1381116909005123-si11.gif?httpAccept=%2A%2F%2A",
            "@multimediatype": "GIF image file",
            "@type": "ALTIMG",
            "@size": "900",
            "@ref": "si11",
            "@mimetype": "image/gif"
          },
          {
            "@category": "thumbnail",
            "@height": "35",
            "@width": "557",
            "@_fa": "true",
            "$": "https://api.elsevier.com/content/object/eid/1-s2.0-S1381116909005123-si10.gif?httpAccept=%2A%2F%2A",
            "@multimediatype": "GIF image file",
            "@type": "ALTIMG",
            "@size": "1998",
            "@ref": "si10",
            "@mimetype": "image/gif"
          },
          {
            "@category": "thumbnail",
            "@height": "23",
            "@width": "366",
            "@_fa": "true",
            "$": "https://api.elsevier.com/content/object/eid/1-s2.0-S1381116909005123-si1.gif?httpAccept=%2A%2F%2A",
            "@multimediatype": "GIF image file",
            "@type": "ALTIMG",
            "@size": "1536",
            "@ref": "si1",
            "@mimetype": "image/gif"
          },
          {
            "@category": "standard",
            "@height": "244",
            "@width": "393",
            "@_fa": "true",
            "$": "https://api.elsevier.com/content/object/eid/1-s2.0-S1381116909005123-gr1.jpg?httpAccept=%2A%2F%2A",
            "@multimediatype": "JPEG image file",
            "@type": "IMAGE-DOWNSAMPLED",
            "@size": "30984",
            "@ref": "gr1",
            "@mimetype": "image/jpeg"
          },
          {
            "@category": "thumbnail",
            "@height": "136",
            "@width": "219",
            "@_fa": "true",
            "$": "https://api.elsevier.com/content/object/eid/1-s2.0-S1381116909005123-gr1.sml?httpAccept=%2A%2F%2A",
            "@multimediatype": "GIF image file",
            "@type": "IMAGE-THUMBNAIL",
            "@size": "3413",
            "@ref": "gr1",
            "@mimetype": "image/gif"
          },
          {
            "@category": "high",
            "@height": "1082",
            "@width": "1742",
            "@_fa": "true",
            "$": "https://api.elsevier.com/content/object/eid/1-s2.0-S1381116909005123-gr1_lrg.jpg?httpAccept=%2A%2F%2A",
            "@multimediatype": "JPEG image file",
            "@type": "IMAGE-HIGH-RES",
            "@size": "150870",
            "@ref": "gr1",
            "@mimetype": "image/jpeg"
          },
          {
            "@category": "standard",
            "@height": "276",
            "@width": "386",
            "@_fa": "true",
            "$": "https://api.elsevier.com/content/object/eid/1-s2.0-S1381116909005123-gr2.jpg?httpAccept=%2A%2F%2A",
            "@multimediatype": "JPEG image file",
            "@type": "IMAGE-DOWNSAMPLED",
            "@size": "30797",
            "@ref": "gr2",
            "@mimetype": "image/jpeg"
          },
          {
            "@category": "thumbnail",
            "@height": "156",
            "@width": "219",
            "@_fa": "true",
            "$": "https://api.elsevier.com/content/object/eid/1-s2.0-S1381116909005123-gr2.sml?httpAccept=%2A%2F%2A",
            "@multimediatype": "GIF image file",
            "@type": "IMAGE-THUMBNAIL",
            "@size": "3169",
            "@ref": "gr2",
            "@mimetype": "image/gif"
          },
          {
            "@category": "high",
            "@height": "1220",
            "@width": "1708",
            "@_fa": "true",
            "$": "https://api.elsevier.com/content/object/eid/1-s2.0-S1381116909005123-gr2_lrg.jpg?httpAccept=%2A%2F%2A",
            "@multimediatype": "JPEG image file",
            "@type": "IMAGE-HIGH-RES",
            "@size": "154900",
            "@ref": "gr2",
            "@mimetype": "image/jpeg"
          },
          {
            "@category": "standard",
            "@height": "259",
            "@width": "372",
            "@_fa": "true",
            "$": "https://api.elsevier.com/content/object/eid/1-s2.0-S1381116909005123-gr3.jpg?httpAccept=%2A%2F%2A",
            "@multimediatype": "JPEG image file",
            "@type": "IMAGE-DOWNSAMPLED",
            "@size": "32016",
            "@ref": "gr3",
            "@mimetype": "image/jpeg"
          },
          {
            "@category": "thumbnail",
            "@height": "153",
            "@width": "219",
            "@_fa": "true",
            "$": "https://api.elsevier.com/content/object/eid/1-s2.0-S1381116909005123-gr3.sml?httpAccept=%2A%2F%2A",
            "@multimediatype": "GIF image file",
            "@type": "IMAGE-THUMBNAIL",
            "@size": "3538",
            "@ref": "gr3",
            "@mimetype": "image/gif"
          },
          {
            "@category": "high",
            "@height": "1150",
            "@width": "1649",
            "@_fa": "true",
            "$": "https://api.elsevier.com/content/object/eid/1-s2.0-S1381116909005123-gr3_lrg.jpg?httpAccept=%2A%2F%2A",
            "@multimediatype": "JPEG image file",
            "@type": "IMAGE-HIGH-RES",
            "@size": "146649",
            "@ref": "gr3",
            "@mimetype": "image/jpeg"
          },
          {
            "@category": "standard",
            "@height": "184",
            "@width": "378",
            "@_fa": "true",
            "$": "https://api.elsevier.com/content/object/eid/1-s2.0-S1381116909005123-gr4.jpg?httpAccept=%2A%2F%2A",
            "@multimediatype": "JPEG image file",
            "@type": "IMAGE-DOWNSAMPLED",
            "@size": "11525",
            "@ref": "gr4",
            "@mimetype": "image/jpeg"
          },
          {
            "@category": "thumbnail",
            "@height": "107",
            "@width": "219",
            "@_fa": "true",
            "$": "https://api.elsevier.com/content/object/eid/1-s2.0-S1381116909005123-gr4.sml?httpAccept=%2A%2F%2A",
            "@multimediatype": "GIF image file",
            "@type": "IMAGE-THUMBNAIL",
            "@size": "2163",
            "@ref": "gr4",
            "@mimetype": "image/gif"
          },
          {
            "@category": "high",
            "@height": "816",
            "@width": "1676",
            "@_fa": "true",
            "$": "https://api.elsevier.com/content/object/eid/1-s2.0-S1381116909005123-gr4_lrg.jpg?httpAccept=%2A%2F%2A",
            "@multimediatype": "JPEG image file",
            "@type": "IMAGE-HIGH-RES",
            "@size": "87469",
            "@ref": "gr4",
            "@mimetype": "image/jpeg"
          },
          {
            "@category": "standard",
            "@height": "232",
            "@width": "376",
            "@_fa": "true",
            "$": "https://api.elsevier.com/content/object/eid/1-s2.0-S1381116909005123-gr5.jpg?httpAccept=%2A%2F%2A",
            "@multimediatype": "JPEG image file",
            "@type": "IMAGE-DOWNSAMPLED",
            "@size": "23892",
            "@ref": "gr5",
            "@mimetype": "image/jpeg"
          },
          {
            "@category": "thumbnail",
            "@height": "135",
            "@width": "219",
            "@_fa": "true",
            "$": "https://api.elsevier.com/content/object/eid/1-s2.0-S1381116909005123-gr5.sml?httpAccept=%2A%2F%2A",
            "@multimediatype": "GIF image file",
            "@type": "IMAGE-THUMBNAIL",
            "@size": "2036",
            "@ref": "gr5",
            "@mimetype": "image/gif"
          },
          {
            "@category": "high",
            "@height": "1030",
            "@width": "1666",
            "@_fa": "true",
            "$": "https://api.elsevier.com/content/object/eid/1-s2.0-S1381116909005123-gr5_lrg.jpg?httpAccept=%2A%2F%2A",
            "@multimediatype": "JPEG image file",
            "@type": "IMAGE-HIGH-RES",
            "@size": "106652",
            "@ref": "gr5",
            "@mimetype": "image/jpeg"
          },
          {
            "@category": "standard",
            "@height": "223",
            "@width": "384",
            "@_fa": "true",
            "$": "https://api.elsevier.com/content/object/eid/1-s2.0-S1381116909005123-gr6.jpg?httpAccept=%2A%2F%2A",
            "@multimediatype": "JPEG image file",
            "@type": "IMAGE-DOWNSAMPLED",
            "@size": "14188",
            "@ref": "gr6",
            "@mimetype": "image/jpeg"
          },
          {
            "@category": "thumbnail",
            "@height": "127",
            "@width": "219",
            "@_fa": "true",
            "$": "https://api.elsevier.com/content/object/eid/1-s2.0-S1381116909005123-gr6.sml?httpAccept=%2A%2F%2A",
            "@multimediatype": "GIF image file",
            "@type": "IMAGE-THUMBNAIL",
            "@size": "2425",
            "@ref": "gr6",
            "@mimetype": "image/gif"
          },
          {
            "@category": "high",
            "@height": "987",
            "@width": "1703",
            "@_fa": "true",
            "$": "https://api.elsevier.com/content/object/eid/1-s2.0-S1381116909005123-gr6_lrg.jpg?httpAccept=%2A%2F%2A",
            "@multimediatype": "JPEG image file",
            "@type": "IMAGE-HIGH-RES",
            "@size": "102455",
            "@ref": "gr6",
            "@mimetype": "image/jpeg"
          },
          {
            "@category": "standard",
            "@height": "215",
            "@width": "373",
            "@_fa": "true",
            "$": "https://api.elsevier.com/content/object/eid/1-s2.0-S1381116909005123-gr7.jpg?httpAccept=%2A%2F%2A",
            "@multimediatype": "JPEG image file",
            "@type": "IMAGE-DOWNSAMPLED",
            "@size": "51680",
            "@ref": "gr7",
            "@mimetype": "image/jpeg"
          },
          {
            "@category": "thumbnail",
            "@height": "127",
            "@width": "219",
            "@_fa": "true",
            "$": "https://api.elsevier.com/content/object/eid/1-s2.0-S1381116909005123-gr7.sml?httpAccept=%2A%2F%2A",
            "@multimediatype": "GIF image file",
            "@type": "IMAGE-THUMBNAIL",
            "@size": "6522",
            "@ref": "gr7",
            "@mimetype": "image/gif"
          },
          {
            "@category": "high",
            "@height": "955",
            "@width": "1653",
            "@_fa": "true",
            "$": "https://api.elsevier.com/content/object/eid/1-s2.0-S1381116909005123-gr7_lrg.jpg?httpAccept=%2A%2F%2A",
            "@multimediatype": "JPEG image file",
            "@type": "IMAGE-HIGH-RES",
            "@size": "310917",
            "@ref": "gr7",
            "@mimetype": "image/jpeg"
          },
          {
            "@category": "standard",
            "@height": "287",
            "@width": "371",
            "@_fa": "true",
            "$": "https://api.elsevier.com/content/object/eid/1-s2.0-S1381116909005123-gr8.jpg?httpAccept=%2A%2F%2A",
            "@multimediatype": "JPEG image file",
            "@type": "IMAGE-DOWNSAMPLED",
            "@size": "11277",
            "@ref": "gr8",
            "@mimetype": "image/jpeg"
          },
          {
            "@category": "thumbnail",
            "@height": "164",
            "@width": "212",
            "@_fa": "true",
            "$": "https://api.elsevier.com/content/object/eid/1-s2.0-S1381116909005123-gr8.sml?httpAccept=%2A%2F%2A",
            "@multimediatype": "GIF image file",
            "@type": "IMAGE-THUMBNAIL",
            "@size": "2801",
            "@ref": "gr8",
            "@mimetype": "image/gif"
          },
          {
            "@category": "high",
            "@height": "1273",
            "@width": "1646",
            "@_fa": "true",
            "$": "https://api.elsevier.com/content/object/eid/1-s2.0-S1381116909005123-gr8_lrg.jpg?httpAccept=%2A%2F%2A",
            "@multimediatype": "JPEG image file",
            "@type": "IMAGE-HIGH-RES",
            "@size": "79226",
            "@ref": "gr8",
            "@mimetype": "image/jpeg"
          },
          {
            "@category": "standard",
            "@height": "290",
            "@width": "364",
            "@_fa": "true",
            "$": "https://api.elsevier.com/content/object/eid/1-s2.0-S1381116909005123-gr9.jpg?httpAccept=%2A%2F%2A",
            "@multimediatype": "JPEG image file",
            "@type": "IMAGE-DOWNSAMPLED",
            "@size": "18866",
            "@ref": "gr9",
            "@mimetype": "image/jpeg"
          },
          {
            "@category": "thumbnail",
            "@height": "163",
            "@width": "205",
            "@_fa": "true",
            "$": "https://api.elsevier.com/content/object/eid/1-s2.0-S1381116909005123-gr9.sml?httpAccept=%2A%2F%2A",
            "@multimediatype": "GIF image file",
            "@type": "IMAGE-THUMBNAIL",
            "@size": "3930",
            "@ref": "gr9",
            "@mimetype": "image/gif"
          },
          {
            "@category": "high",
            "@height": "1288",
            "@width": "1615",
            "@_fa": "true",
            "$": "https://api.elsevier.com/content/object/eid/1-s2.0-S1381116909005123-gr9_lrg.jpg?httpAccept=%2A%2F%2A",
            "@multimediatype": "JPEG image file",
            "@type": "IMAGE-HIGH-RES",
            "@size": "182367",
            "@ref": "gr9",
            "@mimetype": "image/jpeg"
          },
          {
            "@category": "standard",
            "@height": "218",
            "@width": "499",
            "@_fa": "true",
            "$": "https://api.elsevier.com/content/object/eid/1-s2.0-S1381116909005123-gr10.jpg?httpAccept=%2A%2F%2A",
            "@multimediatype": "JPEG image file",
            "@type": "IMAGE-DOWNSAMPLED",
            "@size": "16097",
            "@ref": "gr10",
            "@mimetype": "image/jpeg"
          },
          {
            "@category": "thumbnail",
            "@height": "96",
            "@width": "219",
            "@_fa": "true",
            "$": "https://api.elsevier.com/content/object/eid/1-s2.0-S1381116909005123-gr10.sml?httpAccept=%2A%2F%2A",
            "@multimediatype": "GIF image file",
            "@type": "IMAGE-THUMBNAIL",
            "@size": "1920",
            "@ref": "gr10",
            "@mimetype": "image/gif"
          },
          {
            "@category": "high",
            "@height": "964",
            "@width": "2210",
            "@_fa": "true",
            "$": "https://api.elsevier.com/content/object/eid/1-s2.0-S1381116909005123-gr10_lrg.jpg?httpAccept=%2A%2F%2A",
            "@multimediatype": "JPEG image file",
            "@type": "IMAGE-HIGH-RES",
            "@size": "115538",
            "@ref": "gr10",
            "@mimetype": "image/jpeg"
          },
          {
            "@category": "standard",
            "@height": "218",
            "@width": "508",
            "@_fa": "true",
            "$": "https://api.elsevier.com/content/object/eid/1-s2.0-S1381116909005123-gr11.jpg?httpAccept=%2A%2F%2A",
            "@multimediatype": "JPEG image file",
            "@type": "IMAGE-DOWNSAMPLED",
            "@size": "16623",
            "@ref": "gr11",
            "@mimetype": "image/jpeg"
          },
          {
            "@category": "thumbnail",
            "@height": "94",
            "@width": "219",
            "@_fa": "true",
            "$": "https://api.elsevier.com/content/object/eid/1-s2.0-S1381116909005123-gr11.sml?httpAccept=%2A%2F%2A",
            "@multimediatype": "GIF image file",
            "@type": "IMAGE-THUMBNAIL",
            "@size": "1982",
            "@ref": "gr11",
            "@mimetype": "image/gif"
          },
          {
            "@category": "high",
            "@height": "964",
            "@width": "2248",
            "@_fa": "true",
            "$": "https://api.elsevier.com/content/object/eid/1-s2.0-S1381116909005123-gr11_lrg.jpg?httpAccept=%2A%2F%2A",
            "@multimediatype": "JPEG image file",
            "@type": "IMAGE-HIGH-RES",
            "@size": "121835",
            "@ref": "gr11",
            "@mimetype": "image/jpeg"
          },
          {
            "@category": "standard",
            "@height": "140",
            "@width": "385",
            "@_fa": "true",
            "$": "https://api.elsevier.com/content/object/eid/1-s2.0-S1381116909005123-gr12.jpg?httpAccept=%2A%2F%2A",
            "@multimediatype": "JPEG image file",
            "@type": "IMAGE-DOWNSAMPLED",
            "@size": "22341",
            "@ref": "gr12",
            "@mimetype": "image/jpeg"
          },
          {
            "@category": "thumbnail",
            "@height": "80",
            "@width": "219",
            "@_fa": "true",
            "$": "https://api.elsevier.com/content/object/eid/1-s2.0-S1381116909005123-gr12.sml?httpAccept=%2A%2F%2A",
            "@multimediatype": "GIF image file",
            "@type": "IMAGE-THUMBNAIL",
            "@size": "1996",
            "@ref": "gr12",
            "@mimetype": "image/gif"
          },
          {
            "@category": "high",
            "@height": "620",
            "@width": "1705",
            "@_fa": "true",
            "$": "https://api.elsevier.com/content/object/eid/1-s2.0-S1381116909005123-gr12_lrg.jpg?httpAccept=%2A%2F%2A",
            "@multimediatype": "JPEG image file",
            "@type": "IMAGE-HIGH-RES",
            "@size": "99536",
            "@ref": "gr12",
            "@mimetype": "image/jpeg"
          },
          {
            "@category": "standard",
            "@height": "91",
            "@width": "567",
            "@_fa": "true",
            "$": "https://api.elsevier.com/content/object/eid/1-s2.0-S1381116909005123-fx2.jpg?httpAccept=%2A%2F%2A",
            "@multimediatype": "JPEG image file",
            "@type": "IMAGE-DOWNSAMPLED",
            "@size": "9117",
            "@ref": "fx2",
            "@mimetype": "image/jpeg"
          },
          {
            "@category": "thumbnail",
            "@height": "35",
            "@width": "219",
            "@_fa": "true",
            "$": "https://api.elsevier.com/content/object/eid/1-s2.0-S1381116909005123-fx2.sml?httpAccept=%2A%2F%2A",
            "@multimediatype": "GIF image file",
            "@type": "IMAGE-THUMBNAIL",
            "@size": "926",
            "@ref": "fx2",
            "@mimetype": "image/gif"
          },
          {
            "@category": "high",
            "@height": "401",
            "@width": "2511",
            "@_fa": "true",
            "$": "https://api.elsevier.com/content/object/eid/1-s2.0-S1381116909005123-fx2_lrg.jpg?httpAccept=%2A%2F%2A",
            "@multimediatype": "JPEG image file",
            "@type": "IMAGE-HIGH-RES",
            "@size": "70518",
            "@ref": "fx2",
            "@mimetype": "image/jpeg"
          },
          {
            "@category": "standard",
            "@height": "203",
            "@width": "452",
            "@_fa": "true",
            "$": "https://api.elsevier.com/content/object/eid/1-s2.0-S1381116909005123-fx3.jpg?httpAccept=%2A%2F%2A",
            "@multimediatype": "JPEG image file",
            "@type": "IMAGE-DOWNSAMPLED",
            "@size": "17365",
            "@ref": "fx3",
            "@mimetype": "image/jpeg"
          },
          {
            "@category": "thumbnail",
            "@height": "98",
            "@width": "219",
            "@_fa": "true",
            "$": "https://api.elsevier.com/content/object/eid/1-s2.0-S1381116909005123-fx3.sml?httpAccept=%2A%2F%2A",
            "@multimediatype": "GIF image file",
            "@type": "IMAGE-THUMBNAIL",
            "@size": "1963",
            "@ref": "fx3",
            "@mimetype": "image/gif"
          },
          {
            "@category": "high",
            "@height": "898",
            "@width": "2004",
            "@_fa": "true",
            "$": "https://api.elsevier.com/content/object/eid/1-s2.0-S1381116909005123-fx3_lrg.jpg?httpAccept=%2A%2F%2A",
            "@multimediatype": "JPEG image file",
            "@type": "IMAGE-HIGH-RES",
            "@size": "103663",
            "@ref": "fx3",
            "@mimetype": "image/jpeg"
          },
          {
            "@category": "standard",
            "@height": "63",
            "@width": "486",
            "@_fa": "true",
            "$": "https://api.elsevier.com/content/object/eid/1-s2.0-S1381116909005123-fx4.jpg?httpAccept=%2A%2F%2A",
            "@multimediatype": "JPEG image file",
            "@type": "IMAGE-DOWNSAMPLED",
            "@size": "5754",
            "@ref": "fx4",
            "@mimetype": "image/jpeg"
          },
          {
            "@category": "thumbnail",
            "@height": "28",
            "@width": "219",
            "@_fa": "true",
            "$": "https://api.elsevier.com/content/object/eid/1-s2.0-S1381116909005123-fx4.sml?httpAccept=%2A%2F%2A",
            "@multimediatype": "GIF image file",
            "@type": "IMAGE-THUMBNAIL",
            "@size": "818",
            "@ref": "fx4",
            "@mimetype": "image/gif"
          },
          {
            "@category": "high",
            "@height": "278",
            "@width": "2153",
            "@_fa": "true",
            "$": "https://api.elsevier.com/content/object/eid/1-s2.0-S1381116909005123-fx4_lrg.jpg?httpAccept=%2A%2F%2A",
            "@multimediatype": "JPEG image file",
            "@type": "IMAGE-HIGH-RES",
            "@size": "44926",
            "@ref": "fx4",
            "@mimetype": "image/jpeg"
          },
          {
            "@category": "standard",
            "@height": "52",
            "@width": "483",
            "@_fa": "true",
            "$": "https://api.elsevier.com/content/object/eid/1-s2.0-S1381116909005123-fx5.jpg?httpAccept=%2A%2F%2A",
            "@multimediatype": "JPEG image file",
            "@type": "IMAGE-DOWNSAMPLED",
            "@size": "4452",
            "@ref": "fx5",
            "@mimetype": "image/jpeg"
          },
          {
            "@category": "thumbnail",
            "@height": "24",
            "@width": "219",
            "@_fa": "true",
            "$": "https://api.elsevier.com/content/object/eid/1-s2.0-S1381116909005123-fx5.sml?httpAccept=%2A%2F%2A",
            "@multimediatype": "GIF image file",
            "@type": "IMAGE-THUMBNAIL",
            "@size": "636",
            "@ref": "fx5",
            "@mimetype": "image/gif"
          },
          {
            "@category": "high",
            "@height": "231",
            "@width": "2138",
            "@_fa": "true",
            "$": "https://api.elsevier.com/content/object/eid/1-s2.0-S1381116909005123-fx5_lrg.jpg?httpAccept=%2A%2F%2A",
            "@multimediatype": "JPEG image file",
            "@type": "IMAGE-HIGH-RES",
            "@size": "32682",
            "@ref": "fx5",
            "@mimetype": "image/jpeg"
          },
          {
            "@category": "standard",
            "@height": "70",
            "@width": "523",
            "@_fa": "true",
            "$": "https://api.elsevier.com/content/object/eid/1-s2.0-S1381116909005123-fx6.jpg?httpAccept=%2A%2F%2A",
            "@multimediatype": "JPEG image file",
            "@type": "IMAGE-DOWNSAMPLED",
            "@size": "6270",
            "@ref": "fx6",
            "@mimetype": "image/jpeg"
          },
          {
            "@category": "thumbnail",
            "@height": "29",
            "@width": "219",
            "@_fa": "true",
            "$": "https://api.elsevier.com/content/object/eid/1-s2.0-S1381116909005123-fx6.sml?httpAccept=%2A%2F%2A",
            "@multimediatype": "GIF image file",
            "@type": "IMAGE-THUMBNAIL",
            "@size": "775",
            "@ref": "fx6",
            "@mimetype": "image/gif"
          },
          {
            "@category": "high",
            "@height": "312",
            "@width": "2318",
            "@_fa": "true",
            "$": "https://api.elsevier.com/content/object/eid/1-s2.0-S1381116909005123-fx6_lrg.jpg?httpAccept=%2A%2F%2A",
            "@multimediatype": "JPEG image file",
            "@type": "IMAGE-HIGH-RES",
            "@size": "49212",
            "@ref": "fx6",
            "@mimetype": "image/jpeg"
          },
          {
            "@category": "standard",
            "@height": "92",
            "@width": "463",
            "@_fa": "true",
            "$": "https://api.elsevier.com/content/object/eid/1-s2.0-S1381116909005123-fx7.jpg?httpAccept=%2A%2F%2A",
            "@multimediatype": "JPEG image file",
            "@type": "IMAGE-DOWNSAMPLED",
            "@size": "6739",
            "@ref": "fx7",
            "@mimetype": "image/jpeg"
          },
          {
            "@category": "thumbnail",
            "@height": "44",
            "@width": "219",
            "@_fa": "true",
            "$": "https://api.elsevier.com/content/object/eid/1-s2.0-S1381116909005123-fx7.sml?httpAccept=%2A%2F%2A",
            "@multimediatype": "GIF image file",
            "@type": "IMAGE-THUMBNAIL",
            "@size": "1019",
            "@ref": "fx7",
            "@mimetype": "image/gif"
          },
          {
            "@category": "high",
            "@height": "409",
            "@width": "2052",
            "@_fa": "true",
            "$": "https://api.elsevier.com/content/object/eid/1-s2.0-S1381116909005123-fx7_lrg.jpg?httpAccept=%2A%2F%2A",
            "@multimediatype": "JPEG image file",
            "@type": "IMAGE-HIGH-RES",
            "@size": "45672",
            "@ref": "fx7",
            "@mimetype": "image/jpeg"
          },
          {
            "@category": "standard",
            "@height": "137",
            "@width": "432",
            "@_fa": "true",
            "$": "https://api.elsevier.com/content/object/eid/1-s2.0-S1381116909005123-fx8.jpg?httpAccept=%2A%2F%2A",
            "@multimediatype": "JPEG image file",
            "@type": "IMAGE-DOWNSAMPLED",
            "@size": "7781",
            "@ref": "fx8",
            "@mimetype": "image/jpeg"
          },
          {
            "@category": "thumbnail",
            "@height": "70",
            "@width": "219",
            "@_fa": "true",
            "$": "https://api.elsevier.com/content/object/eid/1-s2.0-S1381116909005123-fx8.sml?httpAccept=%2A%2F%2A",
            "@multimediatype": "GIF image file",
            "@type": "IMAGE-THUMBNAIL",
            "@size": "1308",
            "@ref": "fx8",
            "@mimetype": "image/gif"
          },
          {
            "@category": "high",
            "@height": "607",
            "@width": "1912",
            "@_fa": "true",
            "$": "https://api.elsevier.com/content/object/eid/1-s2.0-S1381116909005123-fx8_lrg.jpg?httpAccept=%2A%2F%2A",
            "@multimediatype": "JPEG image file",
            "@type": "IMAGE-HIGH-RES",
            "@size": "56967",
            "@ref": "fx8",
            "@mimetype": "image/jpeg"
          },
          {
            "@category": "standard",
            "@height": "118",
            "@width": "469",
            "@_fa": "true",
            "$": "https://api.elsevier.com/content/object/eid/1-s2.0-S1381116909005123-fx9.jpg?httpAccept=%2A%2F%2A",
            "@multimediatype": "JPEG image file",
            "@type": "IMAGE-DOWNSAMPLED",
            "@size": "6972",
            "@ref": "fx9",
            "@mimetype": "image/jpeg"
          },
          {
            "@category": "thumbnail",
            "@height": "55",
            "@width": "219",
            "@_fa": "true",
            "$": "https://api.elsevier.com/content/object/eid/1-s2.0-S1381116909005123-fx9.sml?httpAccept=%2A%2F%2A",
            "@multimediatype": "GIF image file",
            "@type": "IMAGE-THUMBNAIL",
            "@size": "1026",
            "@ref": "fx9",
            "@mimetype": "image/gif"
          },
          {
            "@category": "high",
            "@height": "521",
            "@width": "2077",
            "@_fa": "true",
            "$": "https://api.elsevier.com/content/object/eid/1-s2.0-S1381116909005123-fx9_lrg.jpg?httpAccept=%2A%2F%2A",
            "@multimediatype": "JPEG image file",
            "@type": "IMAGE-HIGH-RES",
            "@size": "51878",
            "@ref": "fx9",
            "@mimetype": "image/jpeg"
          },
          {
            "@category": "standard",
            "@height": "114",
            "@width": "94",
            "@_fa": "true",
            "$": "https://api.elsevier.com/content/object/eid/1-s2.0-S1381116909005123-fx11.jpg?httpAccept=%2A%2F%2A",
            "@multimediatype": "JPEG image file",
            "@type": "IMAGE-DOWNSAMPLED",
            "@size": "2148",
            "@ref": "fx11",
            "@mimetype": "image/jpeg"
          },
          {
            "@category": "thumbnail",
            "@height": "163",
            "@width": "135",
            "@_fa": "true",
            "$": "https://api.elsevier.com/content/object/eid/1-s2.0-S1381116909005123-fx11.sml?httpAccept=%2A%2F%2A",
            "@multimediatype": "GIF image file",
            "@type": "IMAGE-THUMBNAIL",
            "@size": "3487",
            "@ref": "fx11",
            "@mimetype": "image/gif"
          },
          {
            "@category": "high",
            "@height": "505",
            "@width": "417",
            "@_fa": "true",
            "$": "https://api.elsevier.com/content/object/eid/1-s2.0-S1381116909005123-fx11_lrg.jpg?httpAccept=%2A%2F%2A",
            "@multimediatype": "JPEG image file",
            "@type": "IMAGE-HIGH-RES",
            "@size": "12848",
            "@ref": "fx11",
            "@mimetype": "image/jpeg"
          },
          {
            "@category": "standard",
            "@height": "71",
            "@width": "353",
            "@_fa": "true",
            "$": "https://api.elsevier.com/content/object/eid/1-s2.0-S1381116909005123-fx10.gif?httpAccept=%2A%2F%2A",
            "@multimediatype": "GIF image file",
            "@type": "IMAGE-DOWNSAMPLED",
            "@size": "1915",
            "@ref": "fx10",
            "@mimetype": "image/gif"
          },
          {
            "@category": "thumbnail",
            "@height": "44",
            "@width": "219",
            "@_fa": "true",
            "$": "https://api.elsevier.com/content/object/eid/1-s2.0-S1381116909005123-fx10.sml?httpAccept=%2A%2F%2A",
            "@multimediatype": "GIF image file",
            "@type": "IMAGE-THUMBNAIL",
            "@size": "996",
            "@ref": "fx10",
            "@mimetype": "image/gif"
          },
          {
            "@category": "high",
            "@height": "628",
            "@width": "3124",
            "@_fa": "true",
            "$": "https://api.elsevier.com/content/object/eid/1-s2.0-S1381116909005123-fx10_lrg.gif?httpAccept=%2A%2F%2A",
            "@multimediatype": "GIF image file",
            "@type": "IMAGE-HIGH-RES",
            "@size": "13690",
            "@ref": "fx10",
            "@mimetype": "image/gif"
          },
          {
            "@category": "standard",
            "@height": "178",
            "@width": "222",
            "@_fa": "true",
            "$": "https://api.elsevier.com/content/object/eid/1-s2.0-S1381116909005123-fx1.jpg?httpAccept=%2A%2F%2A",
            "@multimediatype": "JPEG image file",
            "@type": "IMAGE-DOWNSAMPLED",
            "@size": "32022",
            "@ref": "fx1",
            "@mimetype": "image/jpeg"
          },
          {
            "@category": "thumbnail",
            "@height": "164",
            "@width": "204",
            "@_fa": "true",
            "$": "https://api.elsevier.com/content/object/eid/1-s2.0-S1381116909005123-fx1.sml?httpAccept=%2A%2F%2A",
            "@multimediatype": "GIF image file",
            "@type": "IMAGE-THUMBNAIL",
            "@size": "13252",
            "@ref": "fx1",
            "@mimetype": "image/gif"
          },
          {
            "@category": "high",
            "@height": "790",
            "@width": "984",
            "@_fa": "true",
            "$": "https://api.elsevier.com/content/object/eid/1-s2.0-S1381116909005123-fx1_lrg.jpg?httpAccept=%2A%2F%2A",
            "@multimediatype": "JPEG image file",
            "@type": "IMAGE-HIGH-RES",
            "@size": "154907",
            "@ref": "fx1",
            "@mimetype": "image/jpeg"
          }
        ]
      },
      "link": {
        "@rel": "abstract",
        "@href": "https://api.elsevier.com/content/abstract/scopus_id/72149113314"
      }
    }
  }
}