{
  "metadata": {
    "title": "Preparation and use of novel molybdenum-containing organic complexes as catalysts in the epoxidation of cyclohexene: II. Synthesis and applicability of molybdenum complexes based on squaric acid, 1-phenyl-1-ethanamine and 1,3-diamino-2-propanol",
    "authors": "; ; ",
    "journal": "Journal of Molecular Catalysis A: Chemical",
    "date": "2004-01-02",
    "doi": "10.1016/S1381-1169(03)00466-7",
    "abstract": "",
    "uri": "https://api.elsevier.com/content/article/pii/S1381116903004667",
    "pii": "S1381116903004667"
  },
  "fulltext": {
    "full-text-retrieval-response": {
      "scopus-eid": "2-s2.0-0346270724",
      "originalText": "serial JL 271358 291210 291744 291790 291809 31 Journal of Molecular Catalysis A: Chemical JOURNALMOLECULARCATALYSISACHEMICAL 2003-08-08 2003-08-08 2010-03-28T13:36:59 1-s2.0-S1381116903004667 S1381-1169(03)00466-7 S1381116903004667 10.1016/S1381-1169(03)00466-7 S300 S300.1 FULL-TEXT 1-s2.0-S1381116900X0177X 2015-05-15T05:56:32.920819-04:00 0 0 20040102 2004 2003-08-08T00:00:00Z articleinfo crossmark dco dateupdated tomb dateloaded datesearch indexeddate issuelist volumelist yearnav absattachment articletitlenorm authfirstinitialnorm authfirstsurnamenorm cid cids contenttype copyright dateloadedtxt docsubtype doctype doi eid ewtransactionid hubeid issfirst issn issnnorm itemstage itemtransactionid itemweight openaccess openarchive pg pgfirst pglast pii piinorm pubdatestart pubdatetxt pubyr sortorder srctitle srctitlenorm srctype subheadings volfirst volissue webpdf webpdfpagecount figure table body affil articletitle auth authfirstini authfull authkeywords authlast primabst ref specialabst alllist content subj ssids 1381-1169 13811169 207 207 1 1 Volume 207, Issue 1 3 5 13 5 13 20040102 2 January 2004 2004-01-02 2004 converted-article fla Copyright © 2003 Elsevier B.V. All rights reserved. PREPARATIONUSENOVELMOLYBDENUMCONTAININGORGANICCOMPLEXESCATALYSTSINEPOXIDATIONCYCLOHEXENE KOTOV S 1 Introduction 2 Experimental 2.1 Starting material 2.2 Syntheses of the molybdenum-containing complexes 2.2.1 Synthesis of the complex D 2.2.1.1 Preparation of 1-phenyl-1-ethanamonium squarate (H2Sq·2PhEA) 2.2.1.2 Synthesis of the molybdenum-containing complex (complex D) 2.2.2 Synthesis of the complex E 2.2.2.1 Preparation of 2-propanol-1,3-diamonium squarate (H2Sq·DAP) 2.2.2.2 Synthesis of the molybdenum-containing complex (complex E) 2.3 Catalytic epoxidations 2.4 Instrumentation and analyses 3 Results and discussion 3.1 Preparation and characterization of the squaric acid salts and molybdenum-containing complexes 3.1.1 H2Sq·2PhEA and complex D 3.1.2 H2Sq·DAP and complex E 3.2 Catalytic epoxidations 4 Conclusions References SHELDON 1980 107 R SUMEGI 1983 25 L TRIFIRO 1974 319 F SOBSZAK 1976 15 J YAMAZAKI 1983 3523 M JORGENSEN 1989 431 K THIEL 1994 2373 W THIEL 1997 449 W THIEL 1997 696 W SHERRINGTON 1991 115 D MILLER 1995 368 M OLASON 1998 127 G THORSTAD 1989 773 W KARLE 1996 7128 I KOTOV 2003 83 S JAY 1964 667 R RAJAN 1981 663 O ITO 1963 2580 M TORRI 1995 15 H REINPRECHT 1980 27 J HILBERS 1996 57 M CHEN 1989 5944 Q CHEN 1989 115 Q ADAMS 1968 2310 D KOTOVX2004X5 KOTOVX2004X5X13 KOTOVX2004X5XS KOTOVX2004X5X13XS item S1381-1169(03)00466-7 S1381116903004667 1-s2.0-S1381116903004667 10.1016/S1381-1169(03)00466-7 271358 2010-10-15T16:12:58.726249-04:00 2004-01-02 1-s2.0-S1381116903004667-main.pdf https://s3.amazonaws.com/prod-ucs-content-store-us-east/content/pii:S1381116903004667/MAIN/application/pdf/e7c4a412d5fceaf2fe03f361094f2479/main.pdf https://s3-eu-west-1.amazonaws.com/prod-ucs-content-store-eu-west/content/pii:S1381116903004667/MAIN/application/pdf/e7c4a412d5fceaf2fe03f361094f2479/main.pdf main.pdf pdf true 152970 MAIN 9 1-s2.0-S1381116903004667-main_1.png https://s3.amazonaws.com/prod-ucs-content-store-us-east/content/pii:S1381116903004667/PREVIEW/image/png/8d359fe09a9eeb28f57c8d0da1fb7794/main_1.png https://s3-eu-west-1.amazonaws.com/prod-ucs-content-store-eu-west/content/pii:S1381116903004667/PREVIEW/image/png/8d359fe09a9eeb28f57c8d0da1fb7794/main_1.png main_1.png png 66554 849 656 IMAGE-WEB-PDF 1 1-s2.0-S1381116903004667-si1.gif https://s3.amazonaws.com/prod-ucs-content-store-us-east/content/pii:S1381116903004667/STRIPIN/image/gif/4d7c25a815ffced0809c608439ab8bad/si1.gif https://s3-eu-west-1.amazonaws.com/prod-ucs-content-store-eu-west/content/pii:S1381116903004667/STRIPIN/image/gif/4d7c25a815ffced0809c608439ab8bad/si1.gif si1 si1.gif gif 427 12 85 ALTIMG 1-s2.0-S1381116903004667-fx1.sml https://s3.amazonaws.com/prod-ucs-content-store-us-east/content/pii:S1381116903004667/fx1/THUMBNAIL/image/gif/04a04f468bd98902421b40657142f2d2/fx1.sml https://s3-eu-west-1.amazonaws.com/prod-ucs-content-store-eu-west/content/pii:S1381116903004667/fx1/THUMBNAIL/image/gif/04a04f468bd98902421b40657142f2d2/fx1.sml fx1 true fx1.sml sml 1193 50 125 IMAGE-THUMBNAIL 1-s2.0-S1381116903004667-fx1.gif https://s3.amazonaws.com/prod-ucs-content-store-us-east/content/pii:S1381116903004667/fx1/DOWNSAMPLED/image/gif/8ab2421822e70bb9f2261cafc193222a/fx1.gif https://s3-eu-west-1.amazonaws.com/prod-ucs-content-store-eu-west/content/pii:S1381116903004667/fx1/DOWNSAMPLED/image/gif/8ab2421822e70bb9f2261cafc193222a/fx1.gif fx1 true fx1.gif gif 10080 208 517 IMAGE-DOWNSAMPLED 1-s2.0-S1381116903004667-fx4.sml https://s3.amazonaws.com/prod-ucs-content-store-us-east/content/pii:S1381116903004667/fx4/THUMBNAIL/image/gif/edd89faa535c879e7a1dceef68236439/fx4.sml https://s3-eu-west-1.amazonaws.com/prod-ucs-content-store-eu-west/content/pii:S1381116903004667/fx4/THUMBNAIL/image/gif/edd89faa535c879e7a1dceef68236439/fx4.sml fx4 fx4.sml sml 1375 93 93 IMAGE-THUMBNAIL 1-s2.0-S1381116903004667-fx4.gif https://s3.amazonaws.com/prod-ucs-content-store-us-east/content/pii:S1381116903004667/fx4/DOWNSAMPLED/image/gif/3bc2a46936bc638ab8406e3802884dbd/fx4.gif https://s3-eu-west-1.amazonaws.com/prod-ucs-content-store-eu-west/content/pii:S1381116903004667/fx4/DOWNSAMPLED/image/gif/3bc2a46936bc638ab8406e3802884dbd/fx4.gif fx4 fx4.gif gif 3669 397 396 IMAGE-DOWNSAMPLED 1-s2.0-S1381116903004667-fx5.sml https://s3.amazonaws.com/prod-ucs-content-store-us-east/content/pii:S1381116903004667/fx5/THUMBNAIL/image/gif/d6508e5fd1df579a5436a97d9fd6ccc5/fx5.sml https://s3-eu-west-1.amazonaws.com/prod-ucs-content-store-eu-west/content/pii:S1381116903004667/fx5/THUMBNAIL/image/gif/d6508e5fd1df579a5436a97d9fd6ccc5/fx5.sml fx5 fx5.sml sml 1420 93 105 IMAGE-THUMBNAIL 1-s2.0-S1381116903004667-fx5.gif https://s3.amazonaws.com/prod-ucs-content-store-us-east/content/pii:S1381116903004667/fx5/DOWNSAMPLED/image/gif/9eb73f2c5392dfdfbeb129fde01a0ffd/fx5.gif https://s3-eu-west-1.amazonaws.com/prod-ucs-content-store-eu-west/content/pii:S1381116903004667/fx5/DOWNSAMPLED/image/gif/9eb73f2c5392dfdfbeb129fde01a0ffd/fx5.gif fx5 fx5.gif gif 6193 585 660 IMAGE-DOWNSAMPLED 1-s2.0-S1381116903004667-fx6.sml https://s3.amazonaws.com/prod-ucs-content-store-us-east/content/pii:S1381116903004667/fx6/THUMBNAIL/image/gif/20994228a6d3ff865d43033549ae0f42/fx6.sml https://s3-eu-west-1.amazonaws.com/prod-ucs-content-store-eu-west/content/pii:S1381116903004667/fx6/THUMBNAIL/image/gif/20994228a6d3ff865d43033549ae0f42/fx6.sml fx6 fx6.sml sml 1511 55 125 IMAGE-THUMBNAIL 1-s2.0-S1381116903004667-fx6.gif https://s3.amazonaws.com/prod-ucs-content-store-us-east/content/pii:S1381116903004667/fx6/DOWNSAMPLED/image/gif/1df2ee68e1267f98aff8327b51097613/fx6.gif https://s3-eu-west-1.amazonaws.com/prod-ucs-content-store-eu-west/content/pii:S1381116903004667/fx6/DOWNSAMPLED/image/gif/1df2ee68e1267f98aff8327b51097613/fx6.gif fx6 fx6.gif gif 1681 52 119 IMAGE-DOWNSAMPLED 1-s2.0-S1381116903004667-fx7.sml https://s3.amazonaws.com/prod-ucs-content-store-us-east/content/pii:S1381116903004667/fx7/THUMBNAIL/image/gif/34500982e340209610adaa360c83598d/fx7.sml https://s3-eu-west-1.amazonaws.com/prod-ucs-content-store-eu-west/content/pii:S1381116903004667/fx7/THUMBNAIL/image/gif/34500982e340209610adaa360c83598d/fx7.sml fx7 fx7.sml sml 1183 59 125 IMAGE-THUMBNAIL 1-s2.0-S1381116903004667-fx7.gif https://s3.amazonaws.com/prod-ucs-content-store-us-east/content/pii:S1381116903004667/fx7/DOWNSAMPLED/image/gif/8f6e345e67f12aa5fc78f272faebad6e/fx7.gif https://s3-eu-west-1.amazonaws.com/prod-ucs-content-store-eu-west/content/pii:S1381116903004667/fx7/DOWNSAMPLED/image/gif/8f6e345e67f12aa5fc78f272faebad6e/fx7.gif fx7 fx7.gif gif 1079 50 105 IMAGE-DOWNSAMPLED 1-s2.0-S1381116903004667-fx8.sml https://s3.amazonaws.com/prod-ucs-content-store-us-east/content/pii:S1381116903004667/fx8/THUMBNAIL/image/gif/65a31a354518618626b75d464895a58e/fx8.sml https://s3-eu-west-1.amazonaws.com/prod-ucs-content-store-eu-west/content/pii:S1381116903004667/fx8/THUMBNAIL/image/gif/65a31a354518618626b75d464895a58e/fx8.sml fx8 fx8.sml sml 1585 55 125 IMAGE-THUMBNAIL 1-s2.0-S1381116903004667-fx8.gif https://s3.amazonaws.com/prod-ucs-content-store-us-east/content/pii:S1381116903004667/fx8/DOWNSAMPLED/image/gif/ad18447d8cb809f54d51a96e66a516f4/fx8.gif https://s3-eu-west-1.amazonaws.com/prod-ucs-content-store-eu-west/content/pii:S1381116903004667/fx8/DOWNSAMPLED/image/gif/ad18447d8cb809f54d51a96e66a516f4/fx8.gif fx8 fx8.gif gif 1787 53 120 IMAGE-DOWNSAMPLED 1-s2.0-S1381116903004667-fx9.sml https://s3.amazonaws.com/prod-ucs-content-store-us-east/content/pii:S1381116903004667/fx9/THUMBNAIL/image/gif/64f4d8c249be2480f965a5ed30c22f5d/fx9.sml https://s3-eu-west-1.amazonaws.com/prod-ucs-content-store-eu-west/content/pii:S1381116903004667/fx9/THUMBNAIL/image/gif/64f4d8c249be2480f965a5ed30c22f5d/fx9.sml fx9 fx9.sml sml 1492 93 94 IMAGE-THUMBNAIL 1-s2.0-S1381116903004667-fx9.gif https://s3.amazonaws.com/prod-ucs-content-store-us-east/content/pii:S1381116903004667/fx9/DOWNSAMPLED/image/gif/69357dc99884389796d604d1cc11ec57/fx9.gif https://s3-eu-west-1.amazonaws.com/prod-ucs-content-store-eu-west/content/pii:S1381116903004667/fx9/DOWNSAMPLED/image/gif/69357dc99884389796d604d1cc11ec57/fx9.gif fx9 fx9.gif gif 4116 411 415 IMAGE-DOWNSAMPLED 1-s2.0-S1381116903004667-fx10.sml https://s3.amazonaws.com/prod-ucs-content-store-us-east/content/pii:S1381116903004667/fx10/THUMBNAIL/image/gif/021434108dac609dbce159ec3ab5c3ad/fx10.sml https://s3-eu-west-1.amazonaws.com/prod-ucs-content-store-eu-west/content/pii:S1381116903004667/fx10/THUMBNAIL/image/gif/021434108dac609dbce159ec3ab5c3ad/fx10.sml fx10 fx10.sml sml 1316 60 125 IMAGE-THUMBNAIL 1-s2.0-S1381116903004667-fx10.gif https://s3.amazonaws.com/prod-ucs-content-store-us-east/content/pii:S1381116903004667/fx10/DOWNSAMPLED/image/gif/2963128266e5f1d9176631f98791a111/fx10.gif https://s3-eu-west-1.amazonaws.com/prod-ucs-content-store-eu-west/content/pii:S1381116903004667/fx10/DOWNSAMPLED/image/gif/2963128266e5f1d9176631f98791a111/fx10.gif fx10 fx10.gif gif 1274 51 107 IMAGE-DOWNSAMPLED 1-s2.0-S1381116903004667-fx11.sml https://s3.amazonaws.com/prod-ucs-content-store-us-east/content/pii:S1381116903004667/fx11/THUMBNAIL/image/gif/220ff7ae557e888b4344a8548b423a18/fx11.sml https://s3-eu-west-1.amazonaws.com/prod-ucs-content-store-eu-west/content/pii:S1381116903004667/fx11/THUMBNAIL/image/gif/220ff7ae557e888b4344a8548b423a18/fx11.sml fx11 fx11.sml sml 1577 93 105 IMAGE-THUMBNAIL 1-s2.0-S1381116903004667-fx11.gif https://s3.amazonaws.com/prod-ucs-content-store-us-east/content/pii:S1381116903004667/fx11/DOWNSAMPLED/image/gif/773d151761a7f7a59df8b8d681fb528e/fx11.gif https://s3-eu-west-1.amazonaws.com/prod-ucs-content-store-eu-west/content/pii:S1381116903004667/fx11/DOWNSAMPLED/image/gif/773d151761a7f7a59df8b8d681fb528e/fx11.gif fx11 fx11.gif gif 6925 591 667 IMAGE-DOWNSAMPLED 1-s2.0-S1381116903004667-fx2.sml https://s3.amazonaws.com/prod-ucs-content-store-us-east/content/pii:S1381116903004667/fx2/THUMBNAIL/image/gif/db2dcb304de96058fc21a9afd03afef9/fx2.sml https://s3-eu-west-1.amazonaws.com/prod-ucs-content-store-eu-west/content/pii:S1381116903004667/fx2/THUMBNAIL/image/gif/db2dcb304de96058fc21a9afd03afef9/fx2.sml fx2 fx2.sml sml 1031 42 125 IMAGE-THUMBNAIL 1-s2.0-S1381116903004667-fx2.gif https://s3.amazonaws.com/prod-ucs-content-store-us-east/content/pii:S1381116903004667/fx2/DOWNSAMPLED/image/gif/d90a0912a20982caa2c3feab82aa5994/fx2.gif https://s3-eu-west-1.amazonaws.com/prod-ucs-content-store-eu-west/content/pii:S1381116903004667/fx2/DOWNSAMPLED/image/gif/d90a0912a20982caa2c3feab82aa5994/fx2.gif fx2 fx2.gif gif 7424 160 481 IMAGE-DOWNSAMPLED 1-s2.0-S1381116903004667-fx3.sml https://s3.amazonaws.com/prod-ucs-content-store-us-east/content/pii:S1381116903004667/fx3/THUMBNAIL/image/gif/2dd7f1e32509c3eeb30af9c3a3012de2/fx3.sml https://s3-eu-west-1.amazonaws.com/prod-ucs-content-store-eu-west/content/pii:S1381116903004667/fx3/THUMBNAIL/image/gif/2dd7f1e32509c3eeb30af9c3a3012de2/fx3.sml fx3 fx3.sml sml 1780 93 93 IMAGE-THUMBNAIL 1-s2.0-S1381116903004667-fx3.gif https://s3.amazonaws.com/prod-ucs-content-store-us-east/content/pii:S1381116903004667/fx3/DOWNSAMPLED/image/gif/7e869f491d7b9d1b8792995e419b8500/fx3.gif https://s3-eu-west-1.amazonaws.com/prod-ucs-content-store-eu-west/content/pii:S1381116903004667/fx3/DOWNSAMPLED/image/gif/7e869f491d7b9d1b8792995e419b8500/fx3.gif fx3 fx3.gif gif 10025 304 304 IMAGE-DOWNSAMPLED 1-s2.0-S1381116903004667-gr1.sml https://s3.amazonaws.com/prod-ucs-content-store-us-east/content/pii:S1381116903004667/gr1/THUMBNAIL/image/gif/625b8d157132145178e6b2362c8454a2/gr1.sml https://s3-eu-west-1.amazonaws.com/prod-ucs-content-store-eu-west/content/pii:S1381116903004667/gr1/THUMBNAIL/image/gif/625b8d157132145178e6b2362c8454a2/gr1.sml gr1 gr1.sml sml 1053 90 125 IMAGE-THUMBNAIL 1-s2.0-S1381116903004667-gr1.gif https://s3.amazonaws.com/prod-ucs-content-store-us-east/content/pii:S1381116903004667/gr1/DOWNSAMPLED/image/gif/e323400b51f67599d686a097501c8669/gr1.gif https://s3-eu-west-1.amazonaws.com/prod-ucs-content-store-eu-west/content/pii:S1381116903004667/gr1/DOWNSAMPLED/image/gif/e323400b51f67599d686a097501c8669/gr1.gif gr1 gr1.gif gif 6244 338 469 IMAGE-DOWNSAMPLED 1-s2.0-S1381116903004667-gr2.sml https://s3.amazonaws.com/prod-ucs-content-store-us-east/content/pii:S1381116903004667/gr2/THUMBNAIL/image/gif/6fad468799e63908670ea380cb720505/gr2.sml https://s3-eu-west-1.amazonaws.com/prod-ucs-content-store-eu-west/content/pii:S1381116903004667/gr2/THUMBNAIL/image/gif/6fad468799e63908670ea380cb720505/gr2.sml gr2 gr2.sml sml 1072 90 125 IMAGE-THUMBNAIL 1-s2.0-S1381116903004667-gr2.gif https://s3.amazonaws.com/prod-ucs-content-store-us-east/content/pii:S1381116903004667/gr2/DOWNSAMPLED/image/gif/3e92f777b0c1d1d8b8bda522b788c9ce/gr2.gif https://s3-eu-west-1.amazonaws.com/prod-ucs-content-store-eu-west/content/pii:S1381116903004667/gr2/DOWNSAMPLED/image/gif/3e92f777b0c1d1d8b8bda522b788c9ce/gr2.gif gr2 gr2.gif gif 5809 330 458 IMAGE-DOWNSAMPLED MOLCAA 4234 S1381-1169(03)00466-7 10.1016/S1381-1169(03)00466-7 Elsevier B.V. Fig. 1 Kinetic curves for the TBHP consumption for the epoxidation of cyclohexene in the presence of molybdenum-squarate complexes as catalysts: (1) Complex D and (2) complex E. Reaction conditions were as described in Section 2. Fig. 2 Kinetic curves for the cyclohexene oxide accumulation for the epoxidation of cyclohexene in the presence of molybdenum-squarate complexes as catalysts: (1) Complex D and (2) complex E. Reaction conditions were as described in Section 2. Table 1 Effect of the structure of amines used as ligands on the yield of the molybdenum-squarate complexes Molybdenum-squarate complex Structure of the organic amine involved Conjugate acid pK a Yield of the complex (%) C a 13.6 53.6 E b 9.7 52.8 A a H2NCH2CH2OH 9.5 50.7 B a 7.9 44.5 D b No data 17.1 a Complexes prepared previously [18]. b Newly prepared complexes. Table 2 Selected vibrational data (cm−1) and their assignment for H2Sq·2PhEA and complex D H2Sq·2PhEA Complex D Wavenumbers Assignment Wavenumbers Assignment 3029–3007 ν(ArH), ν(NH3)+ 3033 ν(ArH), ν(NH3)+ 2971, 2931–2857 ν(CH3) 2979, 2927 ν(CH3) 2766–2544 ν(NH)+, associated, salt “bridges”, NH+⋯O−, etc. – – 1631, 1607 δ(NH3)+; vibrational motions for the salt (benzene ring, type 8a and 8b [25,26]) 1633 δ(NH3)+; vibrational motions for the salt (benzene ring, type 8a and 8b [25,26]) 1531 ν(CO) + ν(CC) (SQ2−) 1544, 1507 ν(CO) + ν(CC) (SQ2−) 1497, 1475, 1443 ν(CC) for benzene ring (19a, 19b and 14 type vibrations) 1477, 1387–1290 ν(CC) for benzene ring (19a, 19b and 14 type vibrations) 1381–1316 δ(CH3) + δ(CH) (C6H5CH(CH3) moiety), δ(CH) (type 3 vibrations) for benzene ring [25,26] 1387–1290 δ(CH3) + δ(CH) (C6H5CH(CH3) moiety), δ(CH) (type 3 vibrations) for benzene ring 1293, 1236 ν(C6H5CH) 1291–1233 ν(C6H5CH) 1187–1152 δ(CH) for benzene ring; ρ(NH3 +), planar 1161 δ(CH) for benzene ring; ρ(NH3 +), planar 1094–1071 SQ2−, ν(CN) 1090–1062 SQ2−, ν(CN) 983–780 γ(CH) for benzene ring 942, 907 cis-MoO2 (ν(MoO t )) 700 Type 4 vibrations for monosubstituted benzene ring [25,26] 699 Type 4 vibrations for monosubstituted benzene ring [25,26] 650–400 Non-identified 599, 539 (sh), 509 (sh) MoO bonds with O-containing organic ligand (H2Sq) Table 3 Selected vibrational data (cm−1) and their assignment for H2Sq·DAP and complex E H2Sq·2PhEA Complex D Wavenumbers Assignment Wavenumbers Assignment 3190 ν(OH), strong H-bonds 3190–3000 (massive) ν(OH), strong H-bonds 2996, 2924, 2852 ν(CH2)+, ν(CH) 2927 ν(CH2) + ν(CH) 2776, 2717, 2685, 2591 ν(NH)+, associated, salt “bridges”, NH+⋯O−, etc. – – 1640, 1604 δ(NH3)+ 1633 (NH3)+ 1541, 1526, 1492 ν(CO) + ν(CC) (SQ2−) 1551, 1522 ν(CO) + ν(CC) (SQ2−) 1452, 1436 δ(CH2N), δ(CH2), δ(OH) 1478 δ(CH2N), δ(CH2), δ(OH) 1357, 1313 δ(OH), ω(CH2), ω(CHOH) 1343, 1282 δ(OH), ω(CH2), ω(CHOH) 1193, 1157, 1139 ν(CO), ν(CN) 1180, 1114 ν(CO), ν(CN) 1088 SQ2−, ν(CN), ν(CO), ρ(NH3)+ 1092 SQ2−, ν(CN), ν(CO), ρ(NH3)+ 1055–980 ν(CC)/ρ(NH3)+ 1053–1006 ν(CC)/ρ(NH3)+ – – 940, 915 (sh), 897 (sh) cis-MoO2 (ν(MoO t )) 869–642 ρ(CH2), ρ(CHOH) 796, 713, 670 ρ(CH2), ρ(CHOH) 548–427 CCO (skeletal) 544, 600 (sh) MoO bonds with O-containing organic ligand(s) Table 4 Characteristic vibrational data (cm−1) associated with the involvement of Mo in the formation of the squaric acid/amine-based complexes Molybdenum-squarate complex Structure of the organic amine involved Assignment cis-MoO2 (ν(MoO t )) Assignment MoO bonds with organic ligand A a H2NCH2CH2OH 945 (s), 918 (s) 549 (vs) B a 946 (m), 917 (s), 901 (m) 607 (s), 546 (s), 529 (s) C a 933 (s), 902 (s) 546 (vs) D b 942 (s), 907 (s) 599 (s), 539 (w), 509 (w) E b 940 (s), 915 (sh) 544 (vs) a Complexes prepared previously [18]. b Newly prepared complexes. Table 5 Selected thermal analysis data for the organic salts and the corresponding molybdenum containing complexes based on squaric acid Compound Initial temperature interval (loss of water) (°C) Temperature region for the onset of decomposition (°C) Temperature region for the complete decomposition of organic matter (°C) H2Sq – 260–270 450–500 H2Sq·2Gua·2H2O a 75–160 (crystallohydrate) 225–230 – Complex C a 40–160 (hygroscopic) 215–220 350–450 H2Sq·2PhEA – 160–170 – Complex D – 235–245 470–480 H2Sq·DAP – 200–210 – Complex E 40–150 (hygroscopic) 160–200 400–500 a Prepared previously [18]. Table 6 Comparative evaluation of the activities and selectivities for some of the epoxidation catalysts a prepared from H2Sq, organic amines and MoO2C12 Type of catalyst (organic amine employed for its synthesis) TBHP conversion (%) (reaction time, min) Cyclohexene oxide finald yield (%) Turnover frequency (mol TBHP/mol Mo/min) Complex A b (monoethanolamine) 97.2 (60) 96.1 23.2 Complex C b (guanidinium carbonate) 96.3 (60) 89.9 22.7 Complex D c (1-phenyl-1-ethanamine) 95.2 (60) 97.6 20.2 Complex E c (1,3-diamino-2-propanol) 96.5 (60) 98.3 20.0 a Reaction conditions as described in Section 2. b Prepared previously [18]. c Newly prepared. Preparation and use of novel molybdenum-containing organic complexes as catalysts in the epoxidation of cyclohexene II. Synthesis and applicability of molybdenum complexes based on squaric acid, 1-phenyl-1-ethanamine and 1,3-diamino-2-propanol Stefan V Kotov a ∗ Mariana G Georgieva a Tsonko M Kolev b a University “Prof. Dr. As. Zlatarov”, Inorganic Technology Building, 1 Prof. Yakimov St., 8010 Bourgas, Bulgaria b Institute of Organic Chemistry, Bulgarian Academy of Sciences, Sofia 1113, Bulgaria * Corresponding author. Graphic Two novel molybdenum-containing organic complexes based on 3,4-dihydroxy-3-cyclobutene-1,2-dione (“squaric acid”), 1-phenyl-1-ethanamine and 1,3-diamino-2-propanol (DAP), respectively, have been synthesized in aqueous medium and characterized by infrared (FT-IR) spectroscopy, thermogravimetric (TGA) and elemental analyses. The catalytic activities and selectivities of these complexes in the epoxidation of cyclohexene with t-butylhydroperoxide (TBHP) were, approximately, the same as those of similar complexes prepared previously in the same manner. Keywords Molybdenum-containing complexes Squaric acid Epoxidation Catalyst 1 Introduction Molybdenum-containing complexes have long been known as useful catalysts for the epoxidation of alkenes by organic hydroperoxides. The industrial implementation of this reaction was first achieved in the Halcon process, which utilized a soluble Mo complex, and in the Arco process, which made use of a heterogeneous Ti-SiO2 catalyst to effect the epoxidation of propylene to the synthetically useful propylene oxide precursor [1,2]. Since then, a number of soluble molybdenum organic complexes with carboxylic acids, ketones, alcohols, glycols, amines, etc. have been synthesized and employed as homogeneous catalysts for the epoxidation of various alkenes [3–7]. An excellent review covering this vast research area has also appeared [8]. It is also worth mentioning the publications on the epoxidation of alkenes in the presence of various molybdenum peroxocomplexes as catalysts, and the discussions concerning both the structural and mechanistic aspects of this important catalytic reaction [9–12]. The preparation of polymer-supported catalysts for the epoxidation of alkenes has also received scientific attention since the late 1970s. Recently, a number of chelating functional molybdenum-containing copolymers have been prepared and used as catalysts for the epoxidation of alkenes, mostly, cyclohexene [13–15]. Compared to the vast number of organic ligands employed so far for the preparation of molybdenum complexes and catalysts for the alkene epoxidation, 3,4-dihydroxy-3-cyclobutene-1,2-dione (squaric acid) holds specific position. The squarate dianion possesses a square-planar structure (D4h symmetry) and has been suggested as a member of an aromatic series of cyclic oxocarbon anions that are stabilized by delocalization of π-electrons around the ring [16,17]. Therefore, it appears particularly attractive as a template for generating self-assemblies from polarizable cations in general and organic bases in particular. Such complexes are expected to serve as efficient catalysts for various organic reactions. In our recent work [18], we reported on the synthesis of three novel molybdenum organic complexes by one-pot procedure of interaction of squaric acid, molybdenum dioxydichloride and several polyfunctional organic amines [monoethanolamine (MEA), triethanolamine (TEA) and guanidinium carbonate (as a source of guanidine (Gua))], respectively. These complexes were used as homogeneous catalysts for the epoxidation of cyclohexene with t-butylhydroperoxide (TBHP) and showed activities and selectivities close to those of the well known commercial molybdenyl acetylacetonate. The aim of the present work was to prepare two more novel molybdenum complexes, containing squarate moiety and other, structurally different, organic amines as ligands by employing similar procedures, and to compare the results concerning their syntheses, characterization and applicability as epoxidation catalysts with those obtained by us previously. 2 Experimental 2.1 Starting material 3,4-Dihydroxy-3-cyclobutene-1,2-dione (squaric acid, H2Sq, 98%) was obtained from Hulls-Marl (Germany) and was recrystallized before use. S-(-)-1-Phenyl-1-ethanamine (PhEA) (Fluka AG), l,3-diamino-2-propanol (DAP) (Riedel de Haen) and molybdenum (VI) dioxodichloride (molybdenyl chloride, MoO2Cl2, Aldrich) were employed without further purification. Cyclohexene (Merck-Schuchardt, 99%) and t-butylhydroperoxide (Fluka AG) were also used as received. 2.2 Syntheses of the molybdenum-containing complexes 2.2.1 Synthesis of the complex D 2.2.1.1 Preparation of 1-phenyl-1-ethanamonium squarate (H2Sq·2PhEA) 0.342g (3mmol) squaric acid (H2Sq) was placed into a small 50ml beaker and then 6ml distilled water were added. The suspension was slowly heated, with stirring, to 60–80°C until the squaric acid was completely dissolved. Then 0.727g (6mmol) S-(-)-1-phenyl-1-ethanamine, dissolved in 3ml 96% ethanol were gradually added to the hot solution and the stirring was continued for 0.5h at room temperature. Slow evaporation for several days produced colorless needles, which were thoroughly filtered under vacuum and left to dry out in air for 24h. Yield: 0.702g. Anal. Calc. for C20H24N2O4: C, 67.41; H, 6.74; N, 7.86. Found: C, 67.31; H, 6.55; N, 7.88. The following infrared absorptions were obtained in the 4000–400cm−1 region (mid IR spectra, KBr pellets, cm−1): 3029 (sh), 3007 (sh), 2971 (m), 2931 (m), 2857 (m), 2766 (m), 2718 (m), 2684 (m), 2629 (m), 2544 (w), 1631 (m), 1607 (w), 1531 (m), 1497 (vs), 1475 (vs), 1443 (vs), 1381 (m), 1375 (m), 1316 (w), 1293 (w), 1236 (w), 1187 (w), 1161 (w), 1094 (m), 1083 (m), 1070 (m), 1030 (w), 1014 (w), 1002 (w), 983 (w), 920 (w), 888 (vw), 849 (vw), 780 (w), 770 (m), 763 (m), 700 (m), 620 (w), 558 (w), 481 (w). 2.2.1.2 Synthesis of the molybdenum-containing complex (complex D) 0.233g (2.04mmol) H2Sq were placed into a small 50ml beaker and 10ml distilled water were added. The suspension was slowly heated, with stirring, between 60–80°C until the squaric acid was completely dissolved. 0.489g (4.04mmol) PhEA, dissolved in 3ml 96% ethanol were added to the hot solution and the stirring was continued for 0.5h at room temperature. This was followed by a gradual addition of 0.800g (ca. 4mmol) MoO2Cl2, which produced a green suspension. The stirring was continued for another 0.5h at room temperature. Then, the suspension was filtered under vacuum and washed thoroughly with 70–80ml distilled water, which resulted in its dissolution and almost no solid residue remained on the filter. The light green solution was left to evaporate slowly, the solid obtained was dissolved in 20ml acetone and the mixture was subjected to a second evaporation at room temperature. The final solid obtained was filtered under vacuum, washed with ether and dried at room temperature in air. Yield: 0.260g. Anal. Calc. for C20H28N2M03O15: C, 29.13; H, 3.40; N, 3.40; Mo, 34.95. Found: C, 29.47; H, 2.85; N, 3.64; Mo, 36.00. IR: 3033 (m), 2979 (m), 2927 (m), 1806 (w), 1633 (s), 1544 (s), 1507 (vs), 1477 (vs), 1387 (w), 1315 (w), 1291–1100 (w), 1090 (m), 1062 (w), 1029 (w), 942 (s), 907 (vs), 798–699 (m), 669 (s), 599 (s), 539–509 (w). 2.2.2 Synthesis of the complex E 2.2.2.1 Preparation of 2-propanol-1,3-diamonium squarate (H2Sq·DAP) 0.458g (4.02mmol) H2Sq were placed into a small 50ml beaker and 20ml distilled water were added. The suspension was slowly heated, with stirring, to 60–80°C until the squaric acid was completely dissolved. 0.363g (4.03mmol) 1,3-diamino-2-propanol (DAP) were then added to the hot solution and the stirring was continued for 1h at room temperature. Slow evaporation for several days produced colorless to white crystalline product which was filtered under vacuum and left to dry out in air for 24h. Yield: 0. Anal. Calc. for C7H12N205: C, 41.18; H, 5.88; N, 13.73. Found: C, 40.87; H, 5.64; N, 14.46. IR: 3189–2591 (m), 1640 (m), 1604 (m), 1544 (s), 1526 (s), 1492 (vs), 1452 (m), 1436 (m), 1357 (m), 1313 (m), 1193 (m), 1139 (w), 1088 (m), 1055 (m), 1015 (m), 980 (m), 869 (w), 816 (w), 717 (w), 655 (w), 642 (w), 548 (w), 499 (w), 427 (w). 2.2.2.2 Synthesis of the molybdenum-containing complex (complex E) 0.458g (4.02mmol) H2Sq were placed into a small 50ml beaker and then 10ml distilled water were added. The suspension was slowly heated, with stirring, to between 60 and 70°C until the squaric acid was completely dissolved. 0.363g (4.03mmol) DAP were then added to the hot solution, followed by 0.800g (ca. 4mmol) MoO2C12 which produced almost immediately green suspension. The stirring was continued for 2h. The resulting suspension was filtered under vacuum, washed consecutively and thoroughly with distilled water, acetone and ether and dried at room temperature in air. Yield: 0.856g. Anal. Calc. for C7H16N2Mo3O16: C, 12.50; H, 2.38; N, 4.17; Mo, 42.86. Found: C, 11.82; H, 1.29; N, 3.69; Mo, 43.30. IR: 3250–3000 (wide massive; no pronounced bands observed), 1806 (w), 1631 (m), 1555 (vs), 1521 (vs), 1478 (s), 1343 (w), 1228 (w), 1180 (w), 1114 (w), 1092 (w), 1006 (w), 940 (s), 915 (sh), 897 (s), 796 (w), 713 (m), 670 (sh), 600 (sh), 544 (vs), 422 (w). 2.3 Catalytic epoxidations For a typical experimental procedure, an amount of the catalyst, equivalent to 0.033mmol Mo and 6.6ml (0.065mol) cyclohexene were placed into a three-necked 12cm3 thermostated glass reactor fitted with a reflux condenser, thermometer and a septum cap. The mixture was stirred for 5min at 79°C and then 1ml (ca. 0.010mol) anhydrous t-butylhydroperoxide was added. No solvent was used in the epoxidation reaction; an excess of cyclohexene reactant was placed in the reaction mixture instead. The reaction was monitored at certain time intervals to determine the concentrations of TBHP and 1,2-epoxycyclohexane (cyclohexene oxide) and was left to proceed until near complete conversion of the TBHP. At this point, a sample for the GLC determination of the reaction products was collected. 2.4 Instrumentation and analyses Gas–liquid chromatographic (GLC) analyses of the products obtained from the epoxidation reaction were performed on a SIGMA 2000 instrument (Perkin-Elmer, Norwalk, CT, USA) equipped with a flame ionization detector. Data handling was provided by Chromatographics 2 Data System (Perkin-Elmer). The chromatograph was fitted with Permaphase DMS (polydimethylsiloxane) fused-silica capillary column (50 m×0.25 mm). The oven temperature was 70°C and nitrogen (30psi) was the carrier gas. GLC analysis was combined with both the titrimetric determination of alkene oxide in non-aqueous medium [19] and standard hydroperoxide iodometric method. The molybdenum content in the complexes synthesized was evaluated by thermal gravimetric analysis (TGA) using an OD-102 instrument (MOM, Hungary) by burning the sample to MoO3 at 650–700°C with the complete loss of organic matter [20]. The IR spectrum of the inorganic residue was identical to that of commercial MoO3. The results from the TGA were found to correspond to those obtained from the colorimetric method for molybdenum analysis, based on the formation of colored complexes with thiocyanate [21]. Generally, the thermal analyses (TGA/DTA) were conducted on the same instrument at a heating rate of 10°C/min over the temperature range 20–750°C in air. The elemental microanalyses were performed on the Carlo Erba instrument (Italy). The FT-IR spectra of the samples were run on Bruker IFS-113 spectrometer as KBr pellets in the 4000–400cm−1 regions. 3 Results and discussion 3.1 Preparation and characterization of the squaric acid salts and molybdenum-containing complexes In the course of our previous studies [18], it was found that introducing H2Sq, the organic amine and MoO2Cl2 consecutively into the reaction in one single step (one-pot procedure) favored the formation of the corresponding complexes. However, the preparation of the squaric acid salts with the organic bases was also conducted separately in order to prove their formation and to compare their spectral characteristics with those of the corresponding molybdenum complexes. The salts of H2Sq with the organic bases were found to be crystalline compounds. No melting phenomena were, however, detected. The molybdenum-containing complexes D and E, on the other hand, did not have pronounced crystalline structures. This, again, prevented us from obtaining samples for X-ray diffraction analysis in order to conduct their full structural characterization, as mentioned also in our previous publication [18]. Moreover, the molybdenum complex D was found to be nearly soluble in both the water and acetone, in contrast to the insolubility of complex E and complexes A–C prepared and studied previously [18]. This was probably due to the monofunctional nature of S-(-)-1-phenyl-1-ethanamine employed, which, therefore, did not act as a multidentate ligand in the complex D formation. Due to the generally unknown stoichiometry of their formation, the “yields” of the molybdenum-containing complexes were, approximately, calculated on the mass basis, i.e., the amount of the product was related to the sum of the amounts of reactants (H2Sq, organic amine and MoO2Cl2) introduced. The comparison of the yields of the newly prepared complexes D and E with those (A–C) studied by us previously [18] showed some dependence on the type of organic amine used for their synthesis (Table 1 ). For example, guanidine, as the strongest organic base employed, acted as multidentate ligand of highly-symmetrical structure and the corresponding complex C [18] was obtained with the highest yield. On the other hand, the use of 1,3-diamino-2-propanol (for the preparation of complex E), MEA (complex A [18]) and TEA (complex B [18]) was associated with gradual reduction in the yields of the corresponding molybdenum complexes as the basicity of these amines decreased. Again, the structurally more symmetrical DAP as multifunctional amine and ligand took precedence in terms of the yield of the complex formed. As for S-(-)-1-phenyl-1-ethanamine of unknown basicity, the lowest yield of the complex D could be explained by the fact that the only functional (amino) group present was completely engaged in the formation of the squarate salt. This made the interaction with MoO2Cl2 and Mo coordination difficult indeed. The FT-IR spectra of the organic salts and the corresponding molybdenum-containing complexes D and E, prepared in aqueous solution showed the characteristic fundamental vibrations near 1530 and 1090cm−1 (Tables 2 and 3 ). These vibrations have been established for the squarate anion (SQ2−) of high (D4h) symmetry in the IR spectra of potassium, sodium and lithium squarates [22,23]. For example, complexes in which the squarate is coordinated through all four oxygen atoms exhibit a strong band near 1500cm−1, assigned to a mixture of CC and CO stretching vibrations [24]. The elemental analysis proved the stoichiometry in the formation of the organic salts. The quantitative determination of nitrogen showed that the amines as additional ligands were definitely present in the structures of the molybdenum complexes. The latter did not contain chlorine, as proved by the Schoeniger method and the TG analyses showed high molybdenum content. 3.1.1 H2Sq·2PhEA and complex D The corresponding wavenumbers (cm−1) of the observed characteristic bands in the IR spectra and their assignments [25] for H2Sq·2PhEA and complex D are listed in Table 2. The series of bands at 2766, 2718, 2684, 2629 and 2544cm−1 and the lack of pronounced absorptions within 3500–3100cm−1 are typical for the ammonium (NH3 +-type) salts such as H2Sq·2PhEA (Table 2). No bands at 1790–1820cm−1, usually assigned to the localized CO bonds (free non-coordinated carbonyl) in the squaric acid and at 1630–1690cm−1 (ν(CC) in H2Sq) [27] were detected. This, together with the fundamental vibrations at 1531–1497cm−1 also proved the presence of squarate anion (SQ2−) moiety in the organic salt. The sequence of several absorptions between 1443 and 1316cm−1 for the salt resulted from the considerable split of the typical bands for the CH3 and CH-groups caused by the C6H5CH(CH3)NH3 + moiety. The interaction with MoO2Cl2 resulted in some essential changes in the spectrum of complex D with respect to the one of H2Sq·2PhEA. The bands between 2766 and 2544cm−1 disappeared, which is likely to indicate some involvement of the adjacent salt-forming fragments (e.g., O− of the squarate anion) in the formation of the molybdenum-containing complex. The fundamental bands for SQ2− at 1531 and 1497cm−1 for the ammonium salt were shifted towards 1544 and 1507cm−1, respectively, due to the decrease in the typical D4h symmetry for the squarate as a result of its coordination to the oxomolybdenum fragment. The new strong bands at 942 and 907cm−1 detected for the molybdenum-containing complex only can be definitely assigned to the cis-MoO2 fragment with terminal (t) oxygens derived from MoO2Cl2 (ν(MoO t )), as reported in a number of publications [20,27–29]. The new strong absorption at 599cm−1 with shoulders at 539 and 509cm−1 can be attributed to the formation of polar MoO bonds with organic ligand functional groups [20]. 3.1.2 H2Sq·DAP and complex E The corresponding wavenumbers (cm−1) of the observed characteristic bands in the IR spectra and their assignments [25] for H2Sq·DAP and complex E are listed in Table 3. The medium to strong band at 3189cm−1 in the spectrum of H2Sq·DAP can be assigned to OH-stretching vibrations (ν(OH)) for the DAP fragment with formation of strong hydrogen bonds. The bands at 2776, 2717, 2685, 2591 and 2500cm−1 (sh) are attributed to the two protonated amino groups (ν(NH), ammonium (NH3 +-type) salt), forming also strong hydrogen bonds with SQ2−. The bands at 1640 and 1604cm−1 of medium intensity could be assigned to mixed stretching and bending vibrations of NH3 + groups, affected by the interaction with SQ2− (ν(NH3 +) + δ(NH3 +)). Again, the fundamental vibrations for SQ2− are represented by the strong and very strong bands observed at 1541, 1526 and 1492cm−1. The formation of the molybdenum-containing complex E was proved by some significant changes in the corresponding spectrum, compared to that of the ammonium salt. For example, the band at 3189cm−1 (ν(OH)) was replaced by massive of bands around 3120cm−1 and this might be an indication for the engagement of the OH group of DAP in the formation of the molybdenum complex. The bands at 2776–2500cm−1 for the ammonium salt almost disappeared, which, as mentioned above, indirectly proves the formation of the molybdenum-containing complex involving SQ2−. The strongest band observed at 1492cm−1 for the salt was considerably shifted towards 1522cm−1 in the complex and this might be caused by an electronic influence of the MoO2 2+ fragment on the fundamental vibration of SQ2−. As stated above, the new strong bands at 947 and 915cm−1 (shoulder), detected for the molybdenum-containing complex only are assigned to the cis-MoO2 fragment (ν(MoO t )). Again, the new very strong band at 544cm−1 (shoulder at 600cm−1) can be attributed to the formation of polar MoO bonds with organic ligand functional groups. In the cases discussed above and concerning complexes D and E as well as those (A–C) prepared previously [18], the characteristic doublets (sometimes with shoulders) observed in both the 900–950 and 500–600cm−1 regions and attributed to the cis-MoO2 fragment and the coordination of MoO2 towards the organic ligand(s) respectively were of a high analytical value. The positions and the intensities of the corresponding bands depended strongly on the kind of organic amine involved in the complex formation (Table 4 ). For example, the squarate complexes (A–C and E) based on polyfunctional amines such as monoethanolamine, triethanolamine, guanidine and l,3-diamino-2-propanol, generally believed to be stronger organic ligands than 1-phenyl-1-ethanamine (complex D), indicated strong absorptions within a rather narrow interval (544–549cm−1). Complex B, containing TEA with three hydroxyl functional groups, even showed three strong absorptions at 607, 546 and 529cm−1, respectively; similar phenomenon was observed with the characteristic bands for the cis-MoO2 fragment (946, 917, 901 cm−1). On the other hand, the specific structure of guanidine caused some shift of the bands assigned to the cis-MoO2 fragment in complex C outside the common 940–946 and 915–918cm−1 intervals. Some thermal analysis data for the salts and the corresponding molybdenum-containing complexes, dried in air for 24–48h after their preparation are given in Table 5 . Again, as discussed in our previous publication [18], the temperatures, associated with the onset of decomposition for the newly synthesized squarate salts and the corresponding complexes were essentially lower than those of the pure squaric acid (H2Sq). This indirectly proves the formation of ammonium-type salts from the organic reactants. The temperature region of 400–500°C was, again, associated with the complete decomposition of squarate and this was clearly observed with both the complexes D and E. The comparison of some thermal analysis data for the molybdenum complex C prepared from H2Sq and guanidine previously [18] with those of the newly synthesized complex E showed some interesting similarities. Both complexes were found to be somehow hygroscopic, with ca. 4% loss of water within nearly the same temperature interval (40–150°C). One possible explanation of this might be the more pronounced properties of guanidine and l,3-diamino-2-propanol, participating in the formation of the corresponding complexes as stronger organic bases (Table 1). Guanidinium squarate and the complex C, however, showed higher thermal stability, estimated by the temperature region for the onset of decomposition. This was probably due to the fact that guanidine is still significantly stronger organic base than DAP (Table 1). Based on the studies conducted so far, the following schemes for the preparation of the squarate salts can be postulated: The results from the FT-IR spectroscopy studies, combined with elemental analysis data and information on the behavior of MoO2Cl2 in solutions [30,31] allowed some suggestions on the possible structures of the molybdenum complexes prepared from H2Sq, the amines and MoO2Cl2 in aqueous medium. Similar to our previous studies [18], relevant X-ray diffraction and mass spectrometry data were not obtained due to the poorly pronounced crystalline structure and the high metal content of the complexes respectively. This also caused some inconsistencies in the comparison of the “calculated” elemental analyses data with the experimental ones. Therefore, the proposed structures are speculative. The further studies will involve attempts to synthesize molybdenum complexes based on squaric acid and selected organic amines among those studied so far in non-aqueous medium in order to obtain appropriate crystalline products. 3.2 Catalytic epoxidations Both the yields and selectivities in the epoxidation reactions were calculated as previously [18]. The catalytic activity was, again, evaluated by the turnover frequency, i.e. the maximum reaction rate observed with respect to TBHP per minute per active site of the catalyst and was, accordingly, expressed in appropriate units (e.g. mol TBHP reacted mol−1 Momin−1). The molybdenum complexes became soluble in the reaction medium under the experimental conditions and, therefore, acted as homogeneous catalysts. The kinetic curves of TBHP consumption and cyclohexene oxide accumulation in the presence of the molybdenum complexes D and E as catalysts are shown in Figs. 1 and 2 , respectively. Again, these molybdenum complexes indicated activities and selectivities, very close to some of those studied previously (Table 6 ) (the only exception in this respect was the molybdenum complex derived from H2Sq and triethanolamine; the possible reasons for this have been discussed in our previous work [18]). GLC analyses showed cyclohexene oxide as the principal reaction product, together with an unreacted excess of cyclohexene, tert-butylalcohol (TBA) and 1–5% side (non-identified) products under the conditions of nearly complete TBHP conversion. The combination of highly mobile delocalized π-electron system and polarizable ions, derived from the involvement of the various ammonium squarate moieties and MoO2 2+ species in the complex structures probably contributed to the high catalytic activities observed. The catalytic activities and selectivities did not essentially depend on the structure of the amines employed. This fact and, also, the solubility of the catalysts under the reaction conditions suggest an intermediate coordination of the reactants and complete ligand exchange which occurred at the very beginning of the catalytic reaction. 4 Conclusions Two novel molybdenum-containing complexes based on squaric acid, some organic amines of completely different structure and molybdenum dioxydichloride were synthesized by employing one-pot procedure in aqueous medium. The yields of the newly prepared molybdenum complexes were compared to those obtained, according to our previous publication and were found to depend on both the structure and properties of amines as organic bases. The applicability of these complexes as homogeneous catalysts for epoxidation of cyclohexene with organic hydroperoxides was proved. The newly prepared molybdenum-containing complexes showed almost the same catalytic activities and selectivities as those studied previously. Therefore, the structure of the amine, participating in the formation of the molybdenum-squarate complex does not significantly affect the catalytic properties. This is believed to result from a complete ligand exchange, occurring at the onset of the epoxidation reaction. References [1] R. Landau, G.A. Sullivan, D. Brown, Chem. Tech. 602 (1979). [2] H.P. Wulff, British Patent 1249079, 1971; US Patent 3923843, 1975 to Shell Oil. [3] R. Sheldon J. Mol. Catal. 7 1980 107 [4] L. Sumegi A. Gerda D. Gal Oxid. Commun. 5 1983 25 [5] F. Trifiro P. Forzatti S. Preite J. Less-Common Met. 36 1974 319 [6] J. Sobszak J. Ziolkowski Inorg. Chem. Acta 19 1976 15 [7] M. Yamazaki H. Endo M. Tokoyama Bull. Chem. Soc. Jpn. 56 1983 3523 [8] K.A. Jorgensen Chem. Rev. 89 3 1989 431 [9] W.R. Thiel M. Angst T. Priermeier Chem. Ber. 127 1994 2373 [10] W. Thiel J. Mol. Catal. A: Chem. 117 1997 449 [11] W. Thiel J. Eppinger Chem. Eur. J. 3 5 1997 696 [12] A. Hroch, G. Gemmecker, W.R. Thiel, Eur. J. Inorg. Chem. (2000) 1107. [13] D.C. Sherrington S. Simpson J. Catal. 131 1991 115 [14] M.M. Miller D.C. Sherrington J. Catal. 152 1995 368 [15] G. Olason D.C. Sherrington Macromol. Symp. 131 1998 127 [16] W.T. Thorstad N.S. Mills D.Q. Buckelew L.S. Govea J. Org. Chem. 54 1989 773 [17] I.L. Karle D. Ranganathan V. Haridas J. Am. Chem. Soc. 118 1996 7128 [18] St.V. Kotov Ts.M. Kolev M.G. Georgieva J. Mol. Catal. A: Chem. 195 2003 83 [19] R.R. Jay Anal. Chem. 36 1964 667 [20] O.A. Rajan A. Chakravorty Inorg. Chem. 20 1981 663 [21] A.A. Babko, A.T. Pilipenko, Colorimetric Analysis, Goskhimizdat, Moscow, 1951 (Russ.). [22] M. Ito R. West J. Am. Chem. Soc. 85 1963 2580 [23] H. Torri H.M. Tasumi J. Mol. Struct. (Theochem.) 334 1995 15 [24] J.T. Reinprecht J.G. Miller G.C. Vogel M.S. Haddad D.N. Hendrickson Inorg. Chem. 19 1980 27 [25] N.P.G. Roeges, Guide to the Complete Interpretation of Infrared Spectra of Organic Structures, Wiley, Chichester, New York, 1994. [26] G. Varshani, Assignment for Vibrational Spectra of Benzene Derivatives, London, 1974. [27] M. Hilbers M. Meiwald R. Mattes Z. Naturforsch. 51b 1996 57 [28] Q. Chen L. Ma Sh. Liu J. Zubieta J. Am. Chem. Soc. 111 1989 5944 [29] Q. Chen Sh. Liu J. Zubieta Inorg. Chim. Acta 164 1989 115 [30] D.M. Adams R.G. Churchill J. Chem. Soc. (A) 10 1968 2310 [31] M.A. Porai-Koshitz, L.O. Atovmian, Crystallochemistry and Stereochemistry of Molybdenum Coordination Compounds, Science, Moscow, 1974 (Russ.).",
      "scopus-id": "0346270724",
      "coredata": {
        "eid": "1-s2.0-S1381116903004667",
        "dc:description": "Two novel molybdenum-containing organic complexes based on 3,4-dihydroxy-3-cyclobutene-1,2-dione (“squaric acid”), 1-phenyl-1-ethanamine and 1,3-diamino-2-propanol (DAP), respectively, have been synthesized in aqueous medium and characterized by infrared (FT-IR) spectroscopy, thermogravimetric (TGA) and elemental analyses. The catalytic activities and selectivities of these complexes in the epoxidation of cyclohexene with t-butylhydroperoxide (TBHP) were, approximately, the same as those of similar complexes prepared previously in the same manner.",
        "openArchiveArticle": "false",
        "prism:coverDate": "2004-01-02",
        "openaccessUserLicense": null,
        "prism:aggregationType": "Journal",
        "prism:url": "https://api.elsevier.com/content/article/pii/S1381116903004667",
        "dc:creator": [
          {
            "@_fa": "true",
            "$": "Kotov, Stefan V"
          },
          {
            "@_fa": "true",
            "$": "Georgieva, Mariana G"
          },
          {
            "@_fa": "true",
            "$": "Kolev, Tsonko M"
          }
        ],
        "link": [
          {
            "@_fa": "true",
            "@rel": "self",
            "@href": "https://api.elsevier.com/content/article/pii/S1381116903004667"
          },
          {
            "@_fa": "true",
            "@rel": "scidir",
            "@href": "https://www.sciencedirect.com/science/article/pii/S1381116903004667"
          }
        ],
        "dc:format": "application/json",
        "openaccessType": null,
        "pii": "S1381-1169(03)00466-7",
        "prism:volume": "207",
        "prism:publisher": "Elsevier B.V.",
        "dc:title": "Preparation and use of novel molybdenum-containing organic complexes as catalysts in the epoxidation of cyclohexene II. Synthesis and applicability of molybdenum complexes based on squaric acid, 1-phenyl-1-ethanamine and 1,3-diamino-2-propanol",
        "prism:copyright": "Copyright © 2003 Elsevier B.V. All rights reserved.",
        "openaccess": "0",
        "prism:issn": "13811169",
        "prism:issueIdentifier": "1",
        "dcterms:subject": [
          {
            "@_fa": "true",
            "$": "Molybdenum-containing complexes"
          },
          {
            "@_fa": "true",
            "$": "Squaric acid"
          },
          {
            "@_fa": "true",
            "$": "Epoxidation"
          },
          {
            "@_fa": "true",
            "$": "Catalyst"
          }
        ],
        "openaccessArticle": "false",
        "prism:publicationName": "Journal of Molecular Catalysis A: Chemical",
        "prism:number": "1",
        "openaccessSponsorType": null,
        "prism:pageRange": "5-13",
        "prism:endingPage": "13",
        "pubType": "fla",
        "prism:coverDisplayDate": "2 January 2004",
        "prism:doi": "10.1016/S1381-1169(03)00466-7",
        "prism:startingPage": "5",
        "dc:identifier": "doi:10.1016/S1381-1169(03)00466-7",
        "openaccessSponsorName": null
      },
      "objects": {
        "object": [
          {
            "@category": "thumbnail",
            "@height": "12",
            "@width": "85",
            "@_fa": "true",
            "$": "https://api.elsevier.com/content/object/eid/1-s2.0-S1381116903004667-si1.gif?httpAccept=%2A%2F%2A",
            "@multimediatype": "GIF image file",
            "@type": "ALTIMG",
            "@size": "427",
            "@ref": "si1",
            "@mimetype": "image/gif"
          },
          {
            "@category": "thumbnail",
            "@height": "50",
            "@width": "125",
            "@_fa": "true",
            "$": "https://api.elsevier.com/content/object/eid/1-s2.0-S1381116903004667-fx1.sml?httpAccept=%2A%2F%2A",
            "@multimediatype": "GIF image file",
            "@type": "IMAGE-THUMBNAIL",
            "@size": "1193",
            "@ref": "fx1",
            "@mimetype": "image/gif"
          },
          {
            "@category": "standard",
            "@height": "208",
            "@width": "517",
            "@_fa": "true",
            "$": "https://api.elsevier.com/content/object/eid/1-s2.0-S1381116903004667-fx1.gif?httpAccept=%2A%2F%2A",
            "@multimediatype": "GIF image file",
            "@type": "IMAGE-DOWNSAMPLED",
            "@size": "10080",
            "@ref": "fx1",
            "@mimetype": "image/gif"
          },
          {
            "@category": "thumbnail",
            "@height": "93",
            "@width": "93",
            "@_fa": "true",
            "$": "https://api.elsevier.com/content/object/eid/1-s2.0-S1381116903004667-fx4.sml?httpAccept=%2A%2F%2A",
            "@multimediatype": "GIF image file",
            "@type": "IMAGE-THUMBNAIL",
            "@size": "1375",
            "@ref": "fx4",
            "@mimetype": "image/gif"
          },
          {
            "@category": "standard",
            "@height": "397",
            "@width": "396",
            "@_fa": "true",
            "$": "https://api.elsevier.com/content/object/eid/1-s2.0-S1381116903004667-fx4.gif?httpAccept=%2A%2F%2A",
            "@multimediatype": "GIF image file",
            "@type": "IMAGE-DOWNSAMPLED",
            "@size": "3669",
            "@ref": "fx4",
            "@mimetype": "image/gif"
          },
          {
            "@category": "thumbnail",
            "@height": "93",
            "@width": "105",
            "@_fa": "true",
            "$": "https://api.elsevier.com/content/object/eid/1-s2.0-S1381116903004667-fx5.sml?httpAccept=%2A%2F%2A",
            "@multimediatype": "GIF image file",
            "@type": "IMAGE-THUMBNAIL",
            "@size": "1420",
            "@ref": "fx5",
            "@mimetype": "image/gif"
          },
          {
            "@category": "standard",
            "@height": "585",
            "@width": "660",
            "@_fa": "true",
            "$": "https://api.elsevier.com/content/object/eid/1-s2.0-S1381116903004667-fx5.gif?httpAccept=%2A%2F%2A",
            "@multimediatype": "GIF image file",
            "@type": "IMAGE-DOWNSAMPLED",
            "@size": "6193",
            "@ref": "fx5",
            "@mimetype": "image/gif"
          },
          {
            "@category": "thumbnail",
            "@height": "55",
            "@width": "125",
            "@_fa": "true",
            "$": "https://api.elsevier.com/content/object/eid/1-s2.0-S1381116903004667-fx6.sml?httpAccept=%2A%2F%2A",
            "@multimediatype": "GIF image file",
            "@type": "IMAGE-THUMBNAIL",
            "@size": "1511",
            "@ref": "fx6",
            "@mimetype": "image/gif"
          },
          {
            "@category": "standard",
            "@height": "52",
            "@width": "119",
            "@_fa": "true",
            "$": "https://api.elsevier.com/content/object/eid/1-s2.0-S1381116903004667-fx6.gif?httpAccept=%2A%2F%2A",
            "@multimediatype": "GIF image file",
            "@type": "IMAGE-DOWNSAMPLED",
            "@size": "1681",
            "@ref": "fx6",
            "@mimetype": "image/gif"
          },
          {
            "@category": "thumbnail",
            "@height": "59",
            "@width": "125",
            "@_fa": "true",
            "$": "https://api.elsevier.com/content/object/eid/1-s2.0-S1381116903004667-fx7.sml?httpAccept=%2A%2F%2A",
            "@multimediatype": "GIF image file",
            "@type": "IMAGE-THUMBNAIL",
            "@size": "1183",
            "@ref": "fx7",
            "@mimetype": "image/gif"
          },
          {
            "@category": "standard",
            "@height": "50",
            "@width": "105",
            "@_fa": "true",
            "$": "https://api.elsevier.com/content/object/eid/1-s2.0-S1381116903004667-fx7.gif?httpAccept=%2A%2F%2A",
            "@multimediatype": "GIF image file",
            "@type": "IMAGE-DOWNSAMPLED",
            "@size": "1079",
            "@ref": "fx7",
            "@mimetype": "image/gif"
          },
          {
            "@category": "thumbnail",
            "@height": "55",
            "@width": "125",
            "@_fa": "true",
            "$": "https://api.elsevier.com/content/object/eid/1-s2.0-S1381116903004667-fx8.sml?httpAccept=%2A%2F%2A",
            "@multimediatype": "GIF image file",
            "@type": "IMAGE-THUMBNAIL",
            "@size": "1585",
            "@ref": "fx8",
            "@mimetype": "image/gif"
          },
          {
            "@category": "standard",
            "@height": "53",
            "@width": "120",
            "@_fa": "true",
            "$": "https://api.elsevier.com/content/object/eid/1-s2.0-S1381116903004667-fx8.gif?httpAccept=%2A%2F%2A",
            "@multimediatype": "GIF image file",
            "@type": "IMAGE-DOWNSAMPLED",
            "@size": "1787",
            "@ref": "fx8",
            "@mimetype": "image/gif"
          },
          {
            "@category": "thumbnail",
            "@height": "93",
            "@width": "94",
            "@_fa": "true",
            "$": "https://api.elsevier.com/content/object/eid/1-s2.0-S1381116903004667-fx9.sml?httpAccept=%2A%2F%2A",
            "@multimediatype": "GIF image file",
            "@type": "IMAGE-THUMBNAIL",
            "@size": "1492",
            "@ref": "fx9",
            "@mimetype": "image/gif"
          },
          {
            "@category": "standard",
            "@height": "411",
            "@width": "415",
            "@_fa": "true",
            "$": "https://api.elsevier.com/content/object/eid/1-s2.0-S1381116903004667-fx9.gif?httpAccept=%2A%2F%2A",
            "@multimediatype": "GIF image file",
            "@type": "IMAGE-DOWNSAMPLED",
            "@size": "4116",
            "@ref": "fx9",
            "@mimetype": "image/gif"
          },
          {
            "@category": "thumbnail",
            "@height": "60",
            "@width": "125",
            "@_fa": "true",
            "$": "https://api.elsevier.com/content/object/eid/1-s2.0-S1381116903004667-fx10.sml?httpAccept=%2A%2F%2A",
            "@multimediatype": "GIF image file",
            "@type": "IMAGE-THUMBNAIL",
            "@size": "1316",
            "@ref": "fx10",
            "@mimetype": "image/gif"
          },
          {
            "@category": "standard",
            "@height": "51",
            "@width": "107",
            "@_fa": "true",
            "$": "https://api.elsevier.com/content/object/eid/1-s2.0-S1381116903004667-fx10.gif?httpAccept=%2A%2F%2A",
            "@multimediatype": "GIF image file",
            "@type": "IMAGE-DOWNSAMPLED",
            "@size": "1274",
            "@ref": "fx10",
            "@mimetype": "image/gif"
          },
          {
            "@category": "thumbnail",
            "@height": "93",
            "@width": "105",
            "@_fa": "true",
            "$": "https://api.elsevier.com/content/object/eid/1-s2.0-S1381116903004667-fx11.sml?httpAccept=%2A%2F%2A",
            "@multimediatype": "GIF image file",
            "@type": "IMAGE-THUMBNAIL",
            "@size": "1577",
            "@ref": "fx11",
            "@mimetype": "image/gif"
          },
          {
            "@category": "standard",
            "@height": "591",
            "@width": "667",
            "@_fa": "true",
            "$": "https://api.elsevier.com/content/object/eid/1-s2.0-S1381116903004667-fx11.gif?httpAccept=%2A%2F%2A",
            "@multimediatype": "GIF image file",
            "@type": "IMAGE-DOWNSAMPLED",
            "@size": "6925",
            "@ref": "fx11",
            "@mimetype": "image/gif"
          },
          {
            "@category": "thumbnail",
            "@height": "42",
            "@width": "125",
            "@_fa": "true",
            "$": "https://api.elsevier.com/content/object/eid/1-s2.0-S1381116903004667-fx2.sml?httpAccept=%2A%2F%2A",
            "@multimediatype": "GIF image file",
            "@type": "IMAGE-THUMBNAIL",
            "@size": "1031",
            "@ref": "fx2",
            "@mimetype": "image/gif"
          },
          {
            "@category": "standard",
            "@height": "160",
            "@width": "481",
            "@_fa": "true",
            "$": "https://api.elsevier.com/content/object/eid/1-s2.0-S1381116903004667-fx2.gif?httpAccept=%2A%2F%2A",
            "@multimediatype": "GIF image file",
            "@type": "IMAGE-DOWNSAMPLED",
            "@size": "7424",
            "@ref": "fx2",
            "@mimetype": "image/gif"
          },
          {
            "@category": "thumbnail",
            "@height": "93",
            "@width": "93",
            "@_fa": "true",
            "$": "https://api.elsevier.com/content/object/eid/1-s2.0-S1381116903004667-fx3.sml?httpAccept=%2A%2F%2A",
            "@multimediatype": "GIF image file",
            "@type": "IMAGE-THUMBNAIL",
            "@size": "1780",
            "@ref": "fx3",
            "@mimetype": "image/gif"
          },
          {
            "@category": "standard",
            "@height": "304",
            "@width": "304",
            "@_fa": "true",
            "$": "https://api.elsevier.com/content/object/eid/1-s2.0-S1381116903004667-fx3.gif?httpAccept=%2A%2F%2A",
            "@multimediatype": "GIF image file",
            "@type": "IMAGE-DOWNSAMPLED",
            "@size": "10025",
            "@ref": "fx3",
            "@mimetype": "image/gif"
          },
          {
            "@category": "thumbnail",
            "@height": "90",
            "@width": "125",
            "@_fa": "true",
            "$": "https://api.elsevier.com/content/object/eid/1-s2.0-S1381116903004667-gr1.sml?httpAccept=%2A%2F%2A",
            "@multimediatype": "GIF image file",
            "@type": "IMAGE-THUMBNAIL",
            "@size": "1053",
            "@ref": "gr1",
            "@mimetype": "image/gif"
          },
          {
            "@category": "standard",
            "@height": "338",
            "@width": "469",
            "@_fa": "true",
            "$": "https://api.elsevier.com/content/object/eid/1-s2.0-S1381116903004667-gr1.gif?httpAccept=%2A%2F%2A",
            "@multimediatype": "GIF image file",
            "@type": "IMAGE-DOWNSAMPLED",
            "@size": "6244",
            "@ref": "gr1",
            "@mimetype": "image/gif"
          },
          {
            "@category": "thumbnail",
            "@height": "90",
            "@width": "125",
            "@_fa": "true",
            "$": "https://api.elsevier.com/content/object/eid/1-s2.0-S1381116903004667-gr2.sml?httpAccept=%2A%2F%2A",
            "@multimediatype": "GIF image file",
            "@type": "IMAGE-THUMBNAIL",
            "@size": "1072",
            "@ref": "gr2",
            "@mimetype": "image/gif"
          },
          {
            "@category": "standard",
            "@height": "330",
            "@width": "458",
            "@_fa": "true",
            "$": "https://api.elsevier.com/content/object/eid/1-s2.0-S1381116903004667-gr2.gif?httpAccept=%2A%2F%2A",
            "@multimediatype": "GIF image file",
            "@type": "IMAGE-DOWNSAMPLED",
            "@size": "5809",
            "@ref": "gr2",
            "@mimetype": "image/gif"
          }
        ]
      },
      "link": {
        "@rel": "abstract",
        "@href": "https://api.elsevier.com/content/abstract/scopus_id/0346270724"
      }
    }
  }
}