{
  "metadata": {
    "title": "The arylation of aldehydes with arylboronic acids using metal-organic framework Ni(HBTC)BPY as an efficient heterogeneous catalyst",
    "authors": "; ; ",
    "journal": "Journal of Molecular Catalysis A: Chemical",
    "date": "2012-12-31",
    "doi": "10.1016/j.molcata.2012.08.015",
    "abstract": "",
    "uri": "https://api.elsevier.com/content/article/pii/S1381116912002609",
    "pii": "S1381116912002609"
  },
  "fulltext": {
    "full-text-retrieval-response": {
      "scopus-eid": "2-s2.0-84867577118",
      "originalText": "serial JL 271358 291210 291744 291790 291809 31 Journal of Molecular Catalysis A: Chemical JOURNALMOLECULARCATALYSISACHEMICAL 2012-08-24 2012-08-24 2012-10-06T17:47:50 1-s2.0-S1381116912002609 S1381-1169(12)00260-9 S1381116912002609 10.1016/j.molcata.2012.08.015 S300 S300.1 FULL-TEXT 1-s2.0-S1381116912X00098 2015-05-15T05:56:33.607047-04:00 0 0 20121201 20121231 2012 2012-08-24T00:00:00Z articleinfo crossmark dco dateupdated tomb dateloaded datesearch indexeddate volumelist yearnav absattachment articletitlenorm authfirstinitialnorm authfirstsurnamenorm cid cids contenttype copyright dateloadedtxt docsubtype doctype doi eid ewtransactionid hubeid issn issnnorm itemstage itemtransactionid itemweight openaccess openarchive pg pgfirst pglast pii piinorm pubdateend pubdatestart pubdatetxt pubyr sectiontitle sortorder srctitle srctitlenorm srctype subheadings suppl volfirst volissue webpdf webpdfpagecount figure body acknowledge affil articletitle auth authfirstini authfull authkeywords authlast primabst ref specialabst alllist content subj ssids 1381-1169 13811169 false 365 365 C Volume 365 16 95 102 95 102 201212 December 2012 2012-12-01 2012-12-31 2012 Regular papers article fla Copyright © 2012 Elsevier B.V. All rights reserved. ARYLATIONALDEHYDESARYLBORONICACIDSUSINGMETALORGANICFRAMEWORKNIHBTCBPYEFFICIENTHETEROGENEOUSCATALYST PHAN N 1 Introduction 2 Experimental 2.1 Materials and instrumentation 2.2 Synthesis of the metal-organic framework Ni(HBTC)BPY 2.3 Catalytic studies 3 Results and discussion 3.1 Catalyst synthesis and characterization 3.2 Catalytic studies 4 Conclusions Acknowledgements References ZHENG 2009 943 945 H ZHOU 2009 406 408 L CHEN 2011 1677 1679 W SUZUKI 1999 147 168 A SAKAI 1998 3279 3281 M QIN 2007 4102 4107 C YAMAMOTO 2005 4153 4155 T LIN 2007 9757 9760 S KURIYAMA 2008 1579 1600 M YU 2008 5405 5407 A BOUFFARD 2009 4410 4413 J TAKAHASHI 2005 1459 1461 G ZOU 2009 453 456 T TRINDADE 2008 4076 4086 A RAHMATPOUR 2011 85 90 A NORONHA 2009 1407 1410 R KANTAM 2009 4467 4469 M MANTRI 2005 168 175 K LEADBEATER 2002 3217 3274 N CHAE 2004 523 527 H TRANCHEMONTAGNE 2008 5136 5147 D KAYE 2007 14176 14177 S FURUKAWA 2010 424 428 H HORCAJADA 2010 172 178 P KUPPLER 2009 3042 3066 R ZHOU 2012 673 674 H CUI 2012 1126 1162 Y LI 2012 869 932 J LI 1999 276 279 H ROWSELL 2004 3 14 J LI 2009 78 80 Z DHAKSHINAMOORTHY 2011 6344 6360 A HARDING 2012 3330 3333 J TAN 2012 480 485 X SHI 2011 2928 2930 L ROBERTS 2012 3334 3337 J PHAN 2010 246 253 N RAVON 2010 319 329 U NGUYEN 2011 28 35 L DHAKSHINAMOORTHY 2011 48 53 A XAMENA 2008 220 227 F LIU 2010 13362 13369 H KLEIST 2010 71 78 W DHAKSHINAMOORTHY 2009 1 4 A WANG 2011 875 879 W SONG 2010 15390 15398 F CHO 2006 2563 2565 S BROWN 2009 1422 1427 K SONG 2009 1031 1036 J SCHLICHTE 2004 81 88 K GUSTAFSSON 2010 3316 3322 M OPELT 2008 1286 1290 S XAMENA 2007 294 298 F HUANG 2011 27 31 Y GAO 2010 196 201 S ZHOU 2009 68 75 Y NEOGI 2009 1 4 S GASCON 2009 75 87 J OXFORD 2011 89 97 G DEWA 2001 502 503 T VERMOORTELE 2011 1511 1523 F SAVONNET 2009 1729 1732 M LUZ 2010 134 140 I DHAKSHINAMOORTHY 2010 19 25 A TANAKA 2008 820 822 K TANABE 2010 6766 6774 K CORMA 2010 4606 4655 A SONG 2011 8256 8258 F TANAKA 2010 2389 2391 K SONG 2011 10468 10473 P SHI 2011 2196 2203 F LI 2008 10372 10377 Y SPECHT 2001 5444 5449 C PAPAGEORGIOU 2010 469 473 S ZHENG 2011 1726 1729 X YAMAMOTO 2009 4414 4416 Y LANGHENDRIES 1997 453 463 G PHAN 2006 123 131 N SUZUKI 2006 5789 5792 K HE 2008 5283 5288 P YAMAMOTO 2009 1325 1332 T HUANG 2005 4484 4486 R ARAO 2007 4115 4117 T UEDA 2000 4450 4452 M GOIS 2007 5750 5753 P PHANX2012X95 PHANX2012X95X102 PHANX2012X95XN PHANX2012X95X102XN item S1381-1169(12)00260-9 S1381116912002609 1-s2.0-S1381116912002609 10.1016/j.molcata.2012.08.015 271358 2012-10-06T14:18:29.186604-04:00 2012-12-01 2012-12-31 1-s2.0-S1381116912002609-main.pdf https://s3.amazonaws.com/prod-ucs-content-store-us-east/content/pii:S1381116912002609/MAIN/application/pdf/0cafc118dada4d7242d02c6bf3cb4855/main.pdf https://s3-eu-west-1.amazonaws.com/prod-ucs-content-store-eu-west/content/pii:S1381116912002609/MAIN/application/pdf/0cafc118dada4d7242d02c6bf3cb4855/main.pdf main.pdf pdf true 1131133 MAIN 8 1-s2.0-S1381116912002609-main_1.png https://s3-eu-west-1.amazonaws.com/prod-ucs-content-store-eu-west/content/pii:S1381116912002609/PREVIEW/image/png/ad6f07d356d3136e64665d19fb6245c6/main_1.png https://s3.amazonaws.com/prod-ucs-content-store-us-east/content/pii:S1381116912002609/PREVIEW/image/png/ad6f07d356d3136e64665d19fb6245c6/main_1.png main_1.png png 64042 849 656 IMAGE-WEB-PDF 1 1-s2.0-S1381116912002609-sc1.jpg https://s3.amazonaws.com/prod-ucs-content-store-us-east/content/pii:S1381116912002609/sc1/DOWNSAMPLED/image/jpeg/7a4bb7322048408b30e5456b957b522c/sc1.jpg https://s3-eu-west-1.amazonaws.com/prod-ucs-content-store-eu-west/content/pii:S1381116912002609/sc1/DOWNSAMPLED/image/jpeg/7a4bb7322048408b30e5456b957b522c/sc1.jpg sc1 sc1.jpg jpg 6469 63 392 IMAGE-DOWNSAMPLED 1-s2.0-S1381116912002609-sc1.sml https://s3.amazonaws.com/prod-ucs-content-store-us-east/content/pii:S1381116912002609/sc1/THUMBNAIL/image/gif/a9edb911a5b37b534458137abe44ca40/sc1.sml https://s3-eu-west-1.amazonaws.com/prod-ucs-content-store-eu-west/content/pii:S1381116912002609/sc1/THUMBNAIL/image/gif/a9edb911a5b37b534458137abe44ca40/sc1.sml sc1 sc1.sml sml 2062 35 219 IMAGE-THUMBNAIL 1-s2.0-S1381116912002609-sc1_lrg.jpg https://s3.amazonaws.com/prod-ucs-content-store-us-east/content/pii:S1381116912002609/sc1/HIGHRES/image/jpeg/818b701fd1a98a2604b7374b893528f3/sc1_lrg.jpg https://s3-eu-west-1.amazonaws.com/prod-ucs-content-store-eu-west/content/pii:S1381116912002609/sc1/HIGHRES/image/jpeg/818b701fd1a98a2604b7374b893528f3/sc1_lrg.jpg sc1 sc1_lrg.jpg jpg 53885 277 1737 IMAGE-HIGH-RES 1-s2.0-S1381116912002609-gr5.jpg https://s3.amazonaws.com/prod-ucs-content-store-us-east/content/pii:S1381116912002609/gr5/DOWNSAMPLED/image/jpeg/36f38ad1a32bcfe1e1e67012abe88d26/gr5.jpg https://s3-eu-west-1.amazonaws.com/prod-ucs-content-store-eu-west/content/pii:S1381116912002609/gr5/DOWNSAMPLED/image/jpeg/36f38ad1a32bcfe1e1e67012abe88d26/gr5.jpg gr5 gr5.jpg jpg 13674 268 391 IMAGE-DOWNSAMPLED 1-s2.0-S1381116912002609-gr5.sml https://s3.amazonaws.com/prod-ucs-content-store-us-east/content/pii:S1381116912002609/gr5/THUMBNAIL/image/gif/d5833cce4df82d645263f0c14c41061f/gr5.sml https://s3-eu-west-1.amazonaws.com/prod-ucs-content-store-eu-west/content/pii:S1381116912002609/gr5/THUMBNAIL/image/gif/d5833cce4df82d645263f0c14c41061f/gr5.sml gr5 gr5.sml sml 3747 150 219 IMAGE-THUMBNAIL 1-s2.0-S1381116912002609-gr5_lrg.jpg https://s3.amazonaws.com/prod-ucs-content-store-us-east/content/pii:S1381116912002609/gr5/HIGHRES/image/jpeg/a30ce863dda812ce1b827683a928afd6/gr5_lrg.jpg https://s3-eu-west-1.amazonaws.com/prod-ucs-content-store-eu-west/content/pii:S1381116912002609/gr5/HIGHRES/image/jpeg/a30ce863dda812ce1b827683a928afd6/gr5_lrg.jpg gr5 gr5_lrg.jpg jpg 121772 1187 1733 IMAGE-HIGH-RES 1-s2.0-S1381116912002609-gr8.jpg https://s3.amazonaws.com/prod-ucs-content-store-us-east/content/pii:S1381116912002609/gr8/DOWNSAMPLED/image/jpeg/d83491b3b2feb8827e14fbd1b15c62c4/gr8.jpg https://s3-eu-west-1.amazonaws.com/prod-ucs-content-store-eu-west/content/pii:S1381116912002609/gr8/DOWNSAMPLED/image/jpeg/d83491b3b2feb8827e14fbd1b15c62c4/gr8.jpg gr8 gr8.jpg jpg 14063 268 327 IMAGE-DOWNSAMPLED 1-s2.0-S1381116912002609-gr8.sml https://s3.amazonaws.com/prod-ucs-content-store-us-east/content/pii:S1381116912002609/gr8/THUMBNAIL/image/gif/722230791a335e7d03da126fbca75fa7/gr8.sml https://s3-eu-west-1.amazonaws.com/prod-ucs-content-store-eu-west/content/pii:S1381116912002609/gr8/THUMBNAIL/image/gif/722230791a335e7d03da126fbca75fa7/gr8.sml gr8 gr8.sml sml 3892 164 200 IMAGE-THUMBNAIL 1-s2.0-S1381116912002609-gr8_lrg.jpg https://s3.amazonaws.com/prod-ucs-content-store-us-east/content/pii:S1381116912002609/gr8/HIGHRES/image/jpeg/e083db3cbe3faca11547dc77cbad1c04/gr8_lrg.jpg https://s3-eu-west-1.amazonaws.com/prod-ucs-content-store-eu-west/content/pii:S1381116912002609/gr8/HIGHRES/image/jpeg/e083db3cbe3faca11547dc77cbad1c04/gr8_lrg.jpg gr8 gr8_lrg.jpg jpg 107596 1187 1448 IMAGE-HIGH-RES 1-s2.0-S1381116912002609-gr9.jpg https://s3.amazonaws.com/prod-ucs-content-store-us-east/content/pii:S1381116912002609/gr9/DOWNSAMPLED/image/jpeg/5e64440c4afb74a1791101418cd74c8b/gr9.jpg https://s3-eu-west-1.amazonaws.com/prod-ucs-content-store-eu-west/content/pii:S1381116912002609/gr9/DOWNSAMPLED/image/jpeg/5e64440c4afb74a1791101418cd74c8b/gr9.jpg gr9 gr9.jpg jpg 16185 266 321 IMAGE-DOWNSAMPLED 1-s2.0-S1381116912002609-gr9.sml https://s3.amazonaws.com/prod-ucs-content-store-us-east/content/pii:S1381116912002609/gr9/THUMBNAIL/image/gif/73b6b44382bf83f5555460dc6b426523/gr9.sml https://s3-eu-west-1.amazonaws.com/prod-ucs-content-store-eu-west/content/pii:S1381116912002609/gr9/THUMBNAIL/image/gif/73b6b44382bf83f5555460dc6b426523/gr9.sml gr9 gr9.sml sml 4154 164 198 IMAGE-THUMBNAIL 1-s2.0-S1381116912002609-gr9_lrg.jpg https://s3.amazonaws.com/prod-ucs-content-store-us-east/content/pii:S1381116912002609/gr9/HIGHRES/image/jpeg/bc5091b2cc909766d6bbf54020466e93/gr9_lrg.jpg https://s3-eu-west-1.amazonaws.com/prod-ucs-content-store-eu-west/content/pii:S1381116912002609/gr9/HIGHRES/image/jpeg/bc5091b2cc909766d6bbf54020466e93/gr9_lrg.jpg gr9 gr9_lrg.jpg jpg 123188 1181 1424 IMAGE-HIGH-RES 1-s2.0-S1381116912002609-gr10.jpg https://s3.amazonaws.com/prod-ucs-content-store-us-east/content/pii:S1381116912002609/gr10/DOWNSAMPLED/image/jpeg/1ca2716e1352217ddd2e274d5743e9ea/gr10.jpg https://s3-eu-west-1.amazonaws.com/prod-ucs-content-store-eu-west/content/pii:S1381116912002609/gr10/DOWNSAMPLED/image/jpeg/1ca2716e1352217ddd2e274d5743e9ea/gr10.jpg gr10 gr10.jpg jpg 16037 269 318 IMAGE-DOWNSAMPLED 1-s2.0-S1381116912002609-gr10.sml https://s3.amazonaws.com/prod-ucs-content-store-us-east/content/pii:S1381116912002609/gr10/THUMBNAIL/image/gif/897b6ae0d81616e1c920f2692659314e/gr10.sml https://s3-eu-west-1.amazonaws.com/prod-ucs-content-store-eu-west/content/pii:S1381116912002609/gr10/THUMBNAIL/image/gif/897b6ae0d81616e1c920f2692659314e/gr10.sml gr10 gr10.sml sml 4112 164 194 IMAGE-THUMBNAIL 1-s2.0-S1381116912002609-gr10_lrg.jpg https://s3.amazonaws.com/prod-ucs-content-store-us-east/content/pii:S1381116912002609/gr10/HIGHRES/image/jpeg/cdc6e81fbc25d5cf1633e8826ed8eef9/gr10_lrg.jpg https://s3-eu-west-1.amazonaws.com/prod-ucs-content-store-eu-west/content/pii:S1381116912002609/gr10/HIGHRES/image/jpeg/cdc6e81fbc25d5cf1633e8826ed8eef9/gr10_lrg.jpg gr10 gr10_lrg.jpg jpg 124003 1190 1408 IMAGE-HIGH-RES 1-s2.0-S1381116912002609-gr11.jpg https://s3.amazonaws.com/prod-ucs-content-store-us-east/content/pii:S1381116912002609/gr11/DOWNSAMPLED/image/jpeg/3b5823a10bb3dc593cf0e455666b3db4/gr11.jpg https://s3-eu-west-1.amazonaws.com/prod-ucs-content-store-eu-west/content/pii:S1381116912002609/gr11/DOWNSAMPLED/image/jpeg/3b5823a10bb3dc593cf0e455666b3db4/gr11.jpg gr11 gr11.jpg jpg 16974 269 319 IMAGE-DOWNSAMPLED 1-s2.0-S1381116912002609-gr11.sml https://s3.amazonaws.com/prod-ucs-content-store-us-east/content/pii:S1381116912002609/gr11/THUMBNAIL/image/gif/584e95f969c1ea7ea027e9d4a539ed1e/gr11.sml https://s3-eu-west-1.amazonaws.com/prod-ucs-content-store-eu-west/content/pii:S1381116912002609/gr11/THUMBNAIL/image/gif/584e95f969c1ea7ea027e9d4a539ed1e/gr11.sml gr11 gr11.sml sml 4326 164 194 IMAGE-THUMBNAIL 1-s2.0-S1381116912002609-gr11_lrg.jpg https://s3.amazonaws.com/prod-ucs-content-store-us-east/content/pii:S1381116912002609/gr11/HIGHRES/image/jpeg/b3e5b40a9f3331626025f67a1b423636/gr11_lrg.jpg https://s3-eu-west-1.amazonaws.com/prod-ucs-content-store-eu-west/content/pii:S1381116912002609/gr11/HIGHRES/image/jpeg/b3e5b40a9f3331626025f67a1b423636/gr11_lrg.jpg gr11 gr11_lrg.jpg jpg 128686 1193 1414 IMAGE-HIGH-RES 1-s2.0-S1381116912002609-gr12.jpg https://s3.amazonaws.com/prod-ucs-content-store-us-east/content/pii:S1381116912002609/gr12/DOWNSAMPLED/image/jpeg/adca99cf3787f1e333592510cf10f307/gr12.jpg https://s3-eu-west-1.amazonaws.com/prod-ucs-content-store-eu-west/content/pii:S1381116912002609/gr12/DOWNSAMPLED/image/jpeg/adca99cf3787f1e333592510cf10f307/gr12.jpg gr12 gr12.jpg jpg 12975 267 319 IMAGE-DOWNSAMPLED 1-s2.0-S1381116912002609-gr12.sml https://s3.amazonaws.com/prod-ucs-content-store-us-east/content/pii:S1381116912002609/gr12/THUMBNAIL/image/gif/70308c502667c9b0caeb19b31bfdeecf/gr12.sml https://s3-eu-west-1.amazonaws.com/prod-ucs-content-store-eu-west/content/pii:S1381116912002609/gr12/THUMBNAIL/image/gif/70308c502667c9b0caeb19b31bfdeecf/gr12.sml gr12 gr12.sml sml 3619 164 196 IMAGE-THUMBNAIL 1-s2.0-S1381116912002609-gr12_lrg.jpg https://s3.amazonaws.com/prod-ucs-content-store-us-east/content/pii:S1381116912002609/gr12/HIGHRES/image/jpeg/0bd4ef3e190c370c12d39fb031a178a4/gr12_lrg.jpg https://s3-eu-west-1.amazonaws.com/prod-ucs-content-store-eu-west/content/pii:S1381116912002609/gr12/HIGHRES/image/jpeg/0bd4ef3e190c370c12d39fb031a178a4/gr12_lrg.jpg gr12 gr12_lrg.jpg jpg 96246 1184 1414 IMAGE-HIGH-RES 1-s2.0-S1381116912002609-gr13.jpg https://s3.amazonaws.com/prod-ucs-content-store-us-east/content/pii:S1381116912002609/gr13/DOWNSAMPLED/image/jpeg/e1b1e5318dc7ace055c9b4c6a6c6ad64/gr13.jpg https://s3-eu-west-1.amazonaws.com/prod-ucs-content-store-eu-west/content/pii:S1381116912002609/gr13/DOWNSAMPLED/image/jpeg/e1b1e5318dc7ace055c9b4c6a6c6ad64/gr13.jpg gr13 gr13.jpg jpg 17558 267 319 IMAGE-DOWNSAMPLED 1-s2.0-S1381116912002609-gr13.sml https://s3.amazonaws.com/prod-ucs-content-store-us-east/content/pii:S1381116912002609/gr13/THUMBNAIL/image/gif/64aee20d0751579d7a0e821dc6f23266/gr13.sml https://s3-eu-west-1.amazonaws.com/prod-ucs-content-store-eu-west/content/pii:S1381116912002609/gr13/THUMBNAIL/image/gif/64aee20d0751579d7a0e821dc6f23266/gr13.sml gr13 gr13.sml sml 4369 164 196 IMAGE-THUMBNAIL 1-s2.0-S1381116912002609-gr13_lrg.jpg https://s3.amazonaws.com/prod-ucs-content-store-us-east/content/pii:S1381116912002609/gr13/HIGHRES/image/jpeg/7bb8dec01434865e9fdf6223f10c5b45/gr13_lrg.jpg https://s3-eu-west-1.amazonaws.com/prod-ucs-content-store-eu-west/content/pii:S1381116912002609/gr13/HIGHRES/image/jpeg/7bb8dec01434865e9fdf6223f10c5b45/gr13_lrg.jpg gr13 gr13_lrg.jpg jpg 131361 1184 1414 IMAGE-HIGH-RES 1-s2.0-S1381116912002609-gr14.jpg https://s3.amazonaws.com/prod-ucs-content-store-us-east/content/pii:S1381116912002609/gr14/DOWNSAMPLED/image/jpeg/6b4874cebbf6efb8ec98de3036ebb64d/gr14.jpg https://s3-eu-west-1.amazonaws.com/prod-ucs-content-store-eu-west/content/pii:S1381116912002609/gr14/DOWNSAMPLED/image/jpeg/6b4874cebbf6efb8ec98de3036ebb64d/gr14.jpg gr14 gr14.jpg jpg 28732 327 343 IMAGE-DOWNSAMPLED 1-s2.0-S1381116912002609-gr14.sml https://s3.amazonaws.com/prod-ucs-content-store-us-east/content/pii:S1381116912002609/gr14/THUMBNAIL/image/gif/98f0246ff11f3724cb5510c56b68a213/gr14.sml https://s3-eu-west-1.amazonaws.com/prod-ucs-content-store-eu-west/content/pii:S1381116912002609/gr14/THUMBNAIL/image/gif/98f0246ff11f3724cb5510c56b68a213/gr14.sml gr14 gr14.sml sml 5070 164 172 IMAGE-THUMBNAIL 1-s2.0-S1381116912002609-gr14_lrg.jpg https://s3.amazonaws.com/prod-ucs-content-store-us-east/content/pii:S1381116912002609/gr14/HIGHRES/image/jpeg/81638c112322fb98d9176cca87da83c6/gr14_lrg.jpg https://s3-eu-west-1.amazonaws.com/prod-ucs-content-store-eu-west/content/pii:S1381116912002609/gr14/HIGHRES/image/jpeg/81638c112322fb98d9176cca87da83c6/gr14_lrg.jpg gr14 gr14_lrg.jpg jpg 247959 1450 1519 IMAGE-HIGH-RES 1-s2.0-S1381116912002609-gr15.jpg https://s3.amazonaws.com/prod-ucs-content-store-us-east/content/pii:S1381116912002609/gr15/DOWNSAMPLED/image/jpeg/ba4a38d7330f74ccb5498a482f8657e5/gr15.jpg https://s3-eu-west-1.amazonaws.com/prod-ucs-content-store-eu-west/content/pii:S1381116912002609/gr15/DOWNSAMPLED/image/jpeg/ba4a38d7330f74ccb5498a482f8657e5/gr15.jpg gr15 gr15.jpg jpg 22114 335 318 IMAGE-DOWNSAMPLED 1-s2.0-S1381116912002609-gr15.sml https://s3.amazonaws.com/prod-ucs-content-store-us-east/content/pii:S1381116912002609/gr15/THUMBNAIL/image/gif/df1a1b7d98a393cfd3046f0638f4fcc2/gr15.sml https://s3-eu-west-1.amazonaws.com/prod-ucs-content-store-eu-west/content/pii:S1381116912002609/gr15/THUMBNAIL/image/gif/df1a1b7d98a393cfd3046f0638f4fcc2/gr15.sml gr15 gr15.sml sml 4196 163 155 IMAGE-THUMBNAIL 1-s2.0-S1381116912002609-gr15_lrg.jpg https://s3.amazonaws.com/prod-ucs-content-store-us-east/content/pii:S1381116912002609/gr15/HIGHRES/image/jpeg/fface6b43d22e08aaa44dc62c72c19dc/gr15_lrg.jpg https://s3-eu-west-1.amazonaws.com/prod-ucs-content-store-eu-west/content/pii:S1381116912002609/gr15/HIGHRES/image/jpeg/fface6b43d22e08aaa44dc62c72c19dc/gr15_lrg.jpg gr15 gr15_lrg.jpg jpg 185561 1487 1411 IMAGE-HIGH-RES 1-s2.0-S1381116912002609-gr16.jpg https://s3.amazonaws.com/prod-ucs-content-store-us-east/content/pii:S1381116912002609/gr16/DOWNSAMPLED/image/jpeg/07c4750a847cfa77d72c6ff871962a3a/gr16.jpg https://s3-eu-west-1.amazonaws.com/prod-ucs-content-store-eu-west/content/pii:S1381116912002609/gr16/DOWNSAMPLED/image/jpeg/07c4750a847cfa77d72c6ff871962a3a/gr16.jpg gr16 gr16.jpg jpg 10428 267 313 IMAGE-DOWNSAMPLED 1-s2.0-S1381116912002609-gr16.sml https://s3.amazonaws.com/prod-ucs-content-store-us-east/content/pii:S1381116912002609/gr16/THUMBNAIL/image/gif/e4977b189c318a9af856d2f59c8e5b22/gr16.sml https://s3-eu-west-1.amazonaws.com/prod-ucs-content-store-eu-west/content/pii:S1381116912002609/gr16/THUMBNAIL/image/gif/e4977b189c318a9af856d2f59c8e5b22/gr16.sml gr16 gr16.sml sml 5699 164 192 IMAGE-THUMBNAIL 1-s2.0-S1381116912002609-gr16_lrg.jpg https://s3.amazonaws.com/prod-ucs-content-store-us-east/content/pii:S1381116912002609/gr16/HIGHRES/image/jpeg/c859eb872f06d80fc6a8839009403d41/gr16_lrg.jpg https://s3-eu-west-1.amazonaws.com/prod-ucs-content-store-eu-west/content/pii:S1381116912002609/gr16/HIGHRES/image/jpeg/c859eb872f06d80fc6a8839009403d41/gr16_lrg.jpg gr16 gr16_lrg.jpg jpg 64247 1181 1386 IMAGE-HIGH-RES 1-s2.0-S1381116912002609-gr1.jpg https://s3.amazonaws.com/prod-ucs-content-store-us-east/content/pii:S1381116912002609/gr1/DOWNSAMPLED/image/jpeg/464444958c0c19553825aa97eae47eea/gr1.jpg https://s3-eu-west-1.amazonaws.com/prod-ucs-content-store-eu-west/content/pii:S1381116912002609/gr1/DOWNSAMPLED/image/jpeg/464444958c0c19553825aa97eae47eea/gr1.jpg gr1 gr1.jpg jpg 16476 227 339 IMAGE-DOWNSAMPLED 1-s2.0-S1381116912002609-gr1.sml https://s3.amazonaws.com/prod-ucs-content-store-us-east/content/pii:S1381116912002609/gr1/THUMBNAIL/image/gif/d349933b339f53956dca6621d54999ec/gr1.sml https://s3-eu-west-1.amazonaws.com/prod-ucs-content-store-eu-west/content/pii:S1381116912002609/gr1/THUMBNAIL/image/gif/d349933b339f53956dca6621d54999ec/gr1.sml gr1 gr1.sml sml 3072 147 219 IMAGE-THUMBNAIL 1-s2.0-S1381116912002609-gr1_lrg.jpg https://s3.amazonaws.com/prod-ucs-content-store-us-east/content/pii:S1381116912002609/gr1/HIGHRES/image/jpeg/e30b0e2f940f48350319a6dbae016c9d/gr1_lrg.jpg https://s3-eu-west-1.amazonaws.com/prod-ucs-content-store-eu-west/content/pii:S1381116912002609/gr1/HIGHRES/image/jpeg/e30b0e2f940f48350319a6dbae016c9d/gr1_lrg.jpg gr1 gr1_lrg.jpg jpg 81852 1004 1500 IMAGE-HIGH-RES 1-s2.0-S1381116912002609-gr2.jpg https://s3.amazonaws.com/prod-ucs-content-store-us-east/content/pii:S1381116912002609/gr2/DOWNSAMPLED/image/jpeg/5fa53546494763e5cc82f0017eaa6757/gr2.jpg https://s3-eu-west-1.amazonaws.com/prod-ucs-content-store-eu-west/content/pii:S1381116912002609/gr2/DOWNSAMPLED/image/jpeg/5fa53546494763e5cc82f0017eaa6757/gr2.jpg gr2 gr2.jpg jpg 31501 271 339 IMAGE-DOWNSAMPLED 1-s2.0-S1381116912002609-gr2.sml https://s3.amazonaws.com/prod-ucs-content-store-us-east/content/pii:S1381116912002609/gr2/THUMBNAIL/image/gif/7802fc85d68b3ca3f2c972ab308a3a50/gr2.sml https://s3-eu-west-1.amazonaws.com/prod-ucs-content-store-eu-west/content/pii:S1381116912002609/gr2/THUMBNAIL/image/gif/7802fc85d68b3ca3f2c972ab308a3a50/gr2.sml gr2 gr2.sml sml 8681 164 205 IMAGE-THUMBNAIL 1-s2.0-S1381116912002609-gr2_lrg.jpg https://s3.amazonaws.com/prod-ucs-content-store-us-east/content/pii:S1381116912002609/gr2/HIGHRES/image/jpeg/0a9927e2d480b5a88bc573d32ef4c95e/gr2_lrg.jpg https://s3-eu-west-1.amazonaws.com/prod-ucs-content-store-eu-west/content/pii:S1381116912002609/gr2/HIGHRES/image/jpeg/0a9927e2d480b5a88bc573d32ef4c95e/gr2_lrg.jpg gr2 gr2_lrg.jpg jpg 318799 1197 1500 IMAGE-HIGH-RES 1-s2.0-S1381116912002609-gr3.jpg https://s3.amazonaws.com/prod-ucs-content-store-us-east/content/pii:S1381116912002609/gr3/DOWNSAMPLED/image/jpeg/d6e522ef8061f3aa88010e016883b94d/gr3.jpg https://s3-eu-west-1.amazonaws.com/prod-ucs-content-store-eu-west/content/pii:S1381116912002609/gr3/DOWNSAMPLED/image/jpeg/d6e522ef8061f3aa88010e016883b94d/gr3.jpg gr3 gr3.jpg jpg 46733 354 339 IMAGE-DOWNSAMPLED 1-s2.0-S1381116912002609-gr3.sml https://s3.amazonaws.com/prod-ucs-content-store-us-east/content/pii:S1381116912002609/gr3/THUMBNAIL/image/gif/774e2b0e6a3fa61541d3c80240540dac/gr3.sml https://s3-eu-west-1.amazonaws.com/prod-ucs-content-store-eu-west/content/pii:S1381116912002609/gr3/THUMBNAIL/image/gif/774e2b0e6a3fa61541d3c80240540dac/gr3.sml gr3 gr3.sml sml 8047 164 157 IMAGE-THUMBNAIL 1-s2.0-S1381116912002609-gr3_lrg.jpg https://s3.amazonaws.com/prod-ucs-content-store-us-east/content/pii:S1381116912002609/gr3/HIGHRES/image/jpeg/6441bccc3f072a92438a61434db73639/gr3_lrg.jpg https://s3-eu-west-1.amazonaws.com/prod-ucs-content-store-eu-west/content/pii:S1381116912002609/gr3/HIGHRES/image/jpeg/6441bccc3f072a92438a61434db73639/gr3_lrg.jpg gr3 gr3_lrg.jpg jpg 417292 1565 1500 IMAGE-HIGH-RES 1-s2.0-S1381116912002609-gr4.jpg https://s3.amazonaws.com/prod-ucs-content-store-us-east/content/pii:S1381116912002609/gr4/DOWNSAMPLED/image/jpeg/61022d526f8f7b5729478520e9ce0fe2/gr4.jpg https://s3-eu-west-1.amazonaws.com/prod-ucs-content-store-eu-west/content/pii:S1381116912002609/gr4/DOWNSAMPLED/image/jpeg/61022d526f8f7b5729478520e9ce0fe2/gr4.jpg gr4 gr4.jpg jpg 22632 239 339 IMAGE-DOWNSAMPLED 1-s2.0-S1381116912002609-gr4.sml https://s3.amazonaws.com/prod-ucs-content-store-us-east/content/pii:S1381116912002609/gr4/THUMBNAIL/image/gif/0e5f71e9394d51bb3c3c3d38c3658473/gr4.sml https://s3-eu-west-1.amazonaws.com/prod-ucs-content-store-eu-west/content/pii:S1381116912002609/gr4/THUMBNAIL/image/gif/0e5f71e9394d51bb3c3c3d38c3658473/gr4.sml gr4 gr4.sml sml 5751 154 219 IMAGE-THUMBNAIL 1-s2.0-S1381116912002609-gr4_lrg.jpg https://s3.amazonaws.com/prod-ucs-content-store-us-east/content/pii:S1381116912002609/gr4/HIGHRES/image/jpeg/0b4536acb7e1c09133ad9d6f9deddaea/gr4_lrg.jpg https://s3-eu-west-1.amazonaws.com/prod-ucs-content-store-eu-west/content/pii:S1381116912002609/gr4/HIGHRES/image/jpeg/0b4536acb7e1c09133ad9d6f9deddaea/gr4_lrg.jpg gr4 gr4_lrg.jpg jpg 194464 1056 1500 IMAGE-HIGH-RES 1-s2.0-S1381116912002609-gr6.jpg https://s3.amazonaws.com/prod-ucs-content-store-us-east/content/pii:S1381116912002609/gr6/DOWNSAMPLED/image/jpeg/bd5ea7d604f360b6156ff637641e31cb/gr6.jpg https://s3-eu-west-1.amazonaws.com/prod-ucs-content-store-eu-west/content/pii:S1381116912002609/gr6/DOWNSAMPLED/image/jpeg/bd5ea7d604f360b6156ff637641e31cb/gr6.jpg gr6 gr6.jpg jpg 35526 239 393 IMAGE-DOWNSAMPLED 1-s2.0-S1381116912002609-gr6.sml https://s3.amazonaws.com/prod-ucs-content-store-us-east/content/pii:S1381116912002609/gr6/THUMBNAIL/image/gif/7b4923fde1989aa78f4086b86a66b273/gr6.sml https://s3-eu-west-1.amazonaws.com/prod-ucs-content-store-eu-west/content/pii:S1381116912002609/gr6/THUMBNAIL/image/gif/7b4923fde1989aa78f4086b86a66b273/gr6.sml gr6 gr6.sml sml 4461 133 219 IMAGE-THUMBNAIL 1-s2.0-S1381116912002609-gr6_lrg.jpg https://s3.amazonaws.com/prod-ucs-content-store-us-east/content/pii:S1381116912002609/gr6/HIGHRES/image/jpeg/9dd4594a6048d3d03551af7bcafe37e4/gr6_lrg.jpg https://s3-eu-west-1.amazonaws.com/prod-ucs-content-store-eu-west/content/pii:S1381116912002609/gr6/HIGHRES/image/jpeg/9dd4594a6048d3d03551af7bcafe37e4/gr6_lrg.jpg gr6 gr6_lrg.jpg jpg 211182 1061 1742 IMAGE-HIGH-RES 1-s2.0-S1381116912002609-gr7.jpg https://s3.amazonaws.com/prod-ucs-content-store-us-east/content/pii:S1381116912002609/gr7/DOWNSAMPLED/image/jpeg/7bd6c3da4c509f93685a27b07cee0e3d/gr7.jpg https://s3-eu-west-1.amazonaws.com/prod-ucs-content-store-eu-west/content/pii:S1381116912002609/gr7/DOWNSAMPLED/image/jpeg/7bd6c3da4c509f93685a27b07cee0e3d/gr7.jpg gr7 gr7.jpg jpg 40333 292 391 IMAGE-DOWNSAMPLED 1-s2.0-S1381116912002609-gr7.sml https://s3.amazonaws.com/prod-ucs-content-store-us-east/content/pii:S1381116912002609/gr7/THUMBNAIL/image/gif/34646d6f51fbaf52b86a819df588e49d/gr7.sml https://s3-eu-west-1.amazonaws.com/prod-ucs-content-store-eu-west/content/pii:S1381116912002609/gr7/THUMBNAIL/image/gif/34646d6f51fbaf52b86a819df588e49d/gr7.sml gr7 gr7.sml sml 7161 164 219 IMAGE-THUMBNAIL 1-s2.0-S1381116912002609-gr7_lrg.jpg https://s3.amazonaws.com/prod-ucs-content-store-us-east/content/pii:S1381116912002609/gr7/HIGHRES/image/jpeg/373d09d262939e1fdbce9a58103659c0/gr7_lrg.jpg https://s3-eu-west-1.amazonaws.com/prod-ucs-content-store-eu-west/content/pii:S1381116912002609/gr7/HIGHRES/image/jpeg/373d09d262939e1fdbce9a58103659c0/gr7_lrg.jpg gr7 gr7_lrg.jpg jpg 256752 1296 1733 IMAGE-HIGH-RES 1-s2.0-S1381116912002609-gr17.jpg https://s3.amazonaws.com/prod-ucs-content-store-us-east/content/pii:S1381116912002609/gr17/DOWNSAMPLED/image/jpeg/9eda02093b01bc288f7637aca8454c23/gr17.jpg https://s3-eu-west-1.amazonaws.com/prod-ucs-content-store-eu-west/content/pii:S1381116912002609/gr17/DOWNSAMPLED/image/jpeg/9eda02093b01bc288f7637aca8454c23/gr17.jpg gr17 gr17.jpg jpg 19827 264 393 IMAGE-DOWNSAMPLED 1-s2.0-S1381116912002609-gr17.sml https://s3.amazonaws.com/prod-ucs-content-store-us-east/content/pii:S1381116912002609/gr17/THUMBNAIL/image/gif/2246c5610e33c5684e1b5697fc9cf1f7/gr17.sml https://s3-eu-west-1.amazonaws.com/prod-ucs-content-store-eu-west/content/pii:S1381116912002609/gr17/THUMBNAIL/image/gif/2246c5610e33c5684e1b5697fc9cf1f7/gr17.sml gr17 gr17.sml sml 3636 147 219 IMAGE-THUMBNAIL 1-s2.0-S1381116912002609-gr17_lrg.jpg https://s3.amazonaws.com/prod-ucs-content-store-us-east/content/pii:S1381116912002609/gr17/HIGHRES/image/jpeg/ab620c5735752b6ac3419bbcd3c70406/gr17_lrg.jpg https://s3-eu-west-1.amazonaws.com/prod-ucs-content-store-eu-west/content/pii:S1381116912002609/gr17/HIGHRES/image/jpeg/ab620c5735752b6ac3419bbcd3c70406/gr17_lrg.jpg gr17 gr17_lrg.jpg jpg 139410 1171 1742 IMAGE-HIGH-RES 1-s2.0-S1381116912002609-gr18.jpg https://s3.amazonaws.com/prod-ucs-content-store-us-east/content/pii:S1381116912002609/gr18/DOWNSAMPLED/image/jpeg/675f7397c3fc28ceefbc6ffe07a0ee6c/gr18.jpg https://s3-eu-west-1.amazonaws.com/prod-ucs-content-store-eu-west/content/pii:S1381116912002609/gr18/DOWNSAMPLED/image/jpeg/675f7397c3fc28ceefbc6ffe07a0ee6c/gr18.jpg gr18 gr18.jpg jpg 27643 245 393 IMAGE-DOWNSAMPLED 1-s2.0-S1381116912002609-gr18.sml https://s3.amazonaws.com/prod-ucs-content-store-us-east/content/pii:S1381116912002609/gr18/THUMBNAIL/image/gif/6328881456b0b6e72da9120366427d43/gr18.sml https://s3-eu-west-1.amazonaws.com/prod-ucs-content-store-eu-west/content/pii:S1381116912002609/gr18/THUMBNAIL/image/gif/6328881456b0b6e72da9120366427d43/gr18.sml gr18 gr18.sml sml 4697 136 219 IMAGE-THUMBNAIL 1-s2.0-S1381116912002609-gr18_lrg.jpg https://s3.amazonaws.com/prod-ucs-content-store-us-east/content/pii:S1381116912002609/gr18/HIGHRES/image/jpeg/acd5937c551111231fa5d145cce65009/gr18_lrg.jpg https://s3-eu-west-1.amazonaws.com/prod-ucs-content-store-eu-west/content/pii:S1381116912002609/gr18/HIGHRES/image/jpeg/acd5937c551111231fa5d145cce65009/gr18_lrg.jpg gr18 gr18_lrg.jpg jpg 168138 1084 1742 IMAGE-HIGH-RES 1-s2.0-S1381116912002609-fx1.jpg https://s3.amazonaws.com/prod-ucs-content-store-us-east/content/pii:S1381116912002609/fx1/DOWNSAMPLED/image/jpeg/99231a2f8878d35ee2badd95961f481a/fx1.jpg https://s3-eu-west-1.amazonaws.com/prod-ucs-content-store-eu-west/content/pii:S1381116912002609/fx1/DOWNSAMPLED/image/jpeg/99231a2f8878d35ee2badd95961f481a/fx1.jpg fx1 true fx1.jpg jpg 13349 200 386 IMAGE-DOWNSAMPLED 1-s2.0-S1381116912002609-fx1.sml https://s3.amazonaws.com/prod-ucs-content-store-us-east/content/pii:S1381116912002609/fx1/THUMBNAIL/image/gif/2ba6fe612b9e77543b00b382fb5b31ce/fx1.sml https://s3-eu-west-1.amazonaws.com/prod-ucs-content-store-eu-west/content/pii:S1381116912002609/fx1/THUMBNAIL/image/gif/2ba6fe612b9e77543b00b382fb5b31ce/fx1.sml fx1 true fx1.sml sml 3530 113 219 IMAGE-THUMBNAIL 1-s2.0-S1381116912002609-fx1_lrg.jpg https://s3.amazonaws.com/prod-ucs-content-store-us-east/content/pii:S1381116912002609/fx1/HIGHRES/image/jpeg/2fe5b36c835cde8cc7f39141ac39eb9c/fx1_lrg.jpg https://s3-eu-west-1.amazonaws.com/prod-ucs-content-store-eu-west/content/pii:S1381116912002609/fx1/HIGHRES/image/jpeg/2fe5b36c835cde8cc7f39141ac39eb9c/fx1_lrg.jpg fx1 fx1_lrg.jpg jpg 113785 886 1710 IMAGE-HIGH-RES MOLCAA 8509 S1381-1169(12)00260-9 10.1016/j.molcata.2012.08.015 Elsevier B.V. Scheme 1 The addition reaction of phenylboronic acid to benzaldehyde using the Ni(HBTC)BPY catalyst. Fig. 1 X-ray powder diffractogram of the Ni(HBTC)BPY. Fig. 2 SEM micrograph of the Ni(HBTC)BPY. Fig. 3 TEM micrograph of the Ni(HBTC)BPY. Fig. 4 Pore size distribution of the Ni(HBTC)BPY. Fig. 5 Nitrogen adsorption/desorption isotherm of the Ni(HBTC)BPY. Fig. 6 TGA of the Ni(HBTC)BPY. Fig. 7 FT-IR spectra of 4,4′-bipyridine (a), 1,3,5-benzenetricarboxylic acid (b), and the Ni(HBTC)BPY (c). Fig. 8 Effect of temperature on reaction conversion. Fig. 9 Effect of base on reaction conversion. Fig. 10 Effect of solvent on reaction conversion. Fig. 11 Effect of catalyst concentration on reaction conversion. Fig. 12 Leaching test indicated no contribution from homogeneous catalysis of active species leaching into reaction solution. Fig. 13 Effect of different catalysts on reaction conversion. Fig. 14 Effect of different aldehydes on reaction conversion. Fig. 15 Effect of different arylboronic acids on reaction conversion. Fig. 16 Catalyst recycling studies. Fig. 17 X-ray powder diffractogram of the fresh (a) and reused (b) Ni(HBTC)BPY. Fig. 18 FT-IR spectra of the reused (a) and fresh (b) Ni(HBTC)BPY. The arylation of aldehydes with arylboronic acids using metal-organic framework Ni(HBTC)BPY as an efficient heterogeneous catalyst Nam T.S. Phan ⁎ Tung T. Nguyen Anh H. Ta Department of Chemical Engineering, HCMC University of Technology, VNU-HCM, 268 Ly Thuong Kiet, District 10, Ho Chi Minh City, Viet Nam ⁎ Corresponding author. Tel.: +84 8 38647256x5681; fax: +84 8 38637504. Graphical abstract Highlights ► Ni(HBTC)BPY was synthesized and characterized. ► Ni(HBTC)BPY was used as catalyst for the arylation of aldehydes with arylboronic acids. ► High conversions were achieved. ► The catalyst could be reused. A highly crystalline porous Ni(HBTC)BPY was synthesized from the reaction of 1,3,5-benzenetricarboxylic acid, nickel nitrate hexahydrate, and 4,4′-bipyridine by a solvothermal method. Physical characterizations of the solid catalyst were achieved by using several techniques, including X-ray powder diffraction (XRD), scanning electron microscope (SEM), transmission electron microscopy (TEM), thermogravimetric analysis (TGA), Fourier transform infrared (FT-IR), atomic absorption spectrophotometry (AAS), and nitrogen physisorption measurements. The Ni(HBTC)BPY exhibited high catalytic activity in the arylation of aldehydes with arylboronic acids to form diarylmethanols. The catalyst could be separated from the reaction mixture by simple filtration or centrifugation, and could be reused without a significant degradation in catalytic activity. No contribution from homogeneous catalysis of active species leaching into the liquid phase was detected. Keywords Metal-organic framework Arylation Nickel catalyst Heterogeneous Ni(HBTC)BPY 1 Introduction Diarylmethanols have attracted significant attention as versatile intermediates in the synthesis of several biologically important natural products as well as material science target molecules [1–3]. Traditionally, these structures could be achieved by performing the reduction of ketones or the addition of aldehydes with organometallic reagents such as organolithium, organomagnesium, and organozinc compounds [1,2]. Compared with these reagents, organoboron compounds exhibit several advantages, including the significantly higher stability towards moisture and air, the ease of handling and removal of boron-containing by-products, the tolerance of various functional groups, and the diversity of organoboron derivatives that are environmentally safer than other organometallic reagents [4]. Miyaura and co-workers previously demonstrated the first example of a rhodium-catalyzed addition reaction of arylboronic acids to aldehydes [5], leading to several reports on this organic transformation using other transitional metal catalysts, such as palladium [6–10], nickel [2,11,12], copper [1], iron [13], and dirhodium [14] complexes. However, employing these homogeneous catalysts still suffers a number of serious drawbacks, such as generation of a large amount of wastes, tedious workup and difficult product purification [15,16]. From the view of green chemistry, using heterogeneous catalysts would offer several advantages, such as the ease of handling, simple workup, recyclability and reusability [17]. At the same time, the catalyst recovery also minimizes the contamination of the desired products with hazardous or harmful metals [18,19]. To the best of our knowledge, the arylation of aldehydes with arylboronic acids using solid catalyst was not previously reported in the literature. Metal-organic frameworks (MOFs) have been considered as promising materials for their potential applications in several fields, such as gas separation and storage, sensors, nonlinear optics, drug storage and delivery, biomedical imaging, and catalysis [20–28]. Combining some special properties of both organic and inorganic porous materials, MOFs possess various advantages such as high surface areas, well-defined structures, ability to tune pore size, adjustable internal surface properties, the ease of processability, and structural diversity [20–25,29–31]. Although catalysis is the youngest application of MOFs, several MOFs have been employed as solid catalysts or catalyst supports for a variety of organic transformations [32], including the catalytic production of nitric oxide [33], ketalization reaction [34], Henry reaction [35], Friedel–Crafts reaction between pyrroles and nitroalkenes [36], Friedel–Crafts alkylation and acylation [37–39], oxidation [40–45], alkene epoxidation [46–48], cycloaddition of CO2 with epoxides [49], cyanosilylation [50,51], hydrogenation [52], Suzuki cross-coupling [53,54], Sonogashira reaction [55], transesterification reaction [56], Knoevenagel condensation [57–59], aldol condensation [60,61], aza-Michael condensation [62], 1,3-dipolar cycloaddition reactions [63], N-methylation of aromatic primary amines [64], epoxide ring-opening reaction [65–67], sequential alkene epoxidation/epoxide ring-opening reactions [68], methanolytic kinetic resolution of styrene oxide [69], hydrolysis of ammonia borane [70], and cyclopropanation of alkene [71]. In this work, we wish to report the utilization of a highly porous metal-organic framework {Ni(HBTC)BPY} as an efficient heterogeneous catalyst for the addition reaction of arylboronic acids to aldehydes. The MOF catalyst could be easily isolated from the reaction mixture by simple filtration, and could be reused without significant degradation in activity. 2 Experimental 2.1 Materials and instrumentation All reagents and starting materials were obtained commercially from Sigma–Aldrich and Merck, and were used as received without any further purification unless otherwise noted. Nitrogen physisorption measurements were conducted using a Quantachrome 2200e system. Samples were pretreated by heating under vacuum at 150°C for 3h. A Netzsch Thermoanalyzer STA 409 was used for thermogravimetric analysis (TGA) with a heating rate of 10°C/min under a nitrogen atmosphere. X-ray powder diffraction (XRD) patterns were recorded using a Cu Kα radiation source on a D8 Advance Bruker powder diffractometer. Scanning electron microscopy studies were conducted on a JSM 740 scanning electron microscope (SEM). Transmission electron microscopy studies were performed using a JEOL JEM 1400 transmission electron microscope (TEM) at 100kV. The Ni(HBTC)BPY samples were dispersed on holey carbon grids for TEM observation. Elemental analysis with atomic absorption spectrophotometry (AAS) was performed on an AA-6800 Shimadzu. Fourier transform infrared (FT-IR) spectra were obtained on a Bruker TENSOR37 instrument, with samples being dispersed on potassium bromide pallets. Gas chromatographic (GC) analyses were performed using a Shimadzu GC 17-A equipped with a flame ionization detector (FID) and a DB-5 column (length=30m, inner diameter=0.25mm, and film thickness=0.25μm). The temperature program for GC analysis heated samples from 100 to 200°C at 25°C/min and held them at 200°C for 1min; then heated them from 200 to 250°C at 50°C/min; and held them at 250°C for 1min. Inlet and detector temperatures were set constant at 300°C. n-Hexadecane was used as an internal standard to calculate reaction conversions. GC–MS analyses were performed using a Hewlett Packard GC-MS 5972 with an RTX-5MS column (length=30m, inner diameter=0.25mm, and film thickness=0.5μm). The temperature program for GC–MS analysis heated samples from 60 to 280°C at 10°C/min and held them at 280°C for 2min. Inlet temperature was set constant at 280°C. MS spectra were compared with the spectra gathered in the NIST library. 2.2 Synthesis of the metal-organic framework Ni(HBTC)BPY In a typical preparation, a mixture of H3BTC (H3BTC=1,3,5-benzenetricarboxylic acid; 0.42g, 2mmol), 4,4′-bipy (4,4′-bipy=4,4′-bipyridine; 0.47g, 3mmol), and Ni(NO3)2·6H2O (1.16g, 4mmol) was dissolved in DMF (DMF= N,N′-dimethylformamide; 40ml) in a two 20ml vials. The vial was heated at 100°C in an isothermal oven for 24h. After cooling the vial to room temperature, the solid product was removed by decanting with mother liquor and washed with DMF (3× 10ml). Solvent exchange was then carried out with DCM (3× 10ml) at room temperature. The product was then dried at 140°C for 6h under vacuum, yielding 0.80g of the metal-organic framework Ni(HBTC)BPY as green crystals (94% based on 1,3,5-benzenetricarboxylic acid). Elemental analysis indicated a nickel loading of 13.34% (Ni(HBTC)BPY requires 13.95%) and a nitrogen loading of 6.00% (Ni(HBTC)BPY requires 6.60%). 2.3 Catalytic studies A mixture of benzaldehyde (0.1ml, 1mmol), and n-hexadecane (0.1ml, 0.88mmol) as an internal standard in n-butanol (4ml) was added into a 25ml flask containing the Ni(HBTC)BPY catalyst (0.04g, 10mol%) and K3PO4 (0.78g, 3mmol) as a base. The catalyst concentration was calculated with respect to the nickel/benzaldehyde molar ratio. The reaction mixture was stirred for 15min to disperse the Ni(HBTC)BPY catalyst in the liquid phase. Phenylboronic acid (0.18g, 1.5mmol) was then added, and the resulting mixture was stirred at 100°C for 6h. Reaction conversion was monitored by withdrawing aliquots from the reaction mixture at different time intervals, quenching with aqueous Na2CO3 solution (1% (w/w), 1ml). The organic components were then extracted into diethyl ether (2ml), dried over anhydrous Na2SO4, analyzed by GC with reference to n-hexadecane. The product identity was further confirmed by GC–MS. The Ni(HBTC)BPY catalyst was separated from the reaction mixture by simple centrifugation, washed with copious amounts of n-butanol, dried under vacuum at room temperature for 1h, and reused if necessary. For the leaching test, a catalytic reaction was stopped after 1h, analyzed by GC, and centrifuged to remove the solid catalyst. The reaction solution was then stirred for a further 5h. Reaction progress, if any, was monitored by GC as previously described. 3 Results and discussion 3.1 Catalyst synthesis and characterization In this work, the Ni(HBTC)BPY was synthesized by a solvothermal method, using the reaction of 1,3,5-benzenetricarboxylic acid, nickel nitrate hexahydrate, and 4,4′-bipyridine, according to a literature procedure [72]. The occluded DMF in the as-synthesized Ni(HBTC)BPY sample was then exchanged with DCM so that the excess solvent would be easily removed under vacuum. It was found that the Ni(HBTC)BPY was produced in the form of green crystals with a yield of 94% (based on 1,3,5-benzenetricarboxylic acid). The Ni(HBTC)BPY was then characterized using a variety of different techniques. A nickel loading of 2.27mmol/g was achieved for the material, as indicated by elemental analysis with AAS. The XRD diffractogram of the Ni(HBTC)BPY exhibited the presence of a very sharp peak below 10° (with 2θ of 7.5°), indicating that a highly crystalline material was produced (Fig. 1 ). The SEM micrograph showed that a crystalline material was obtained (Fig. 2 ). The TEM micrograph (Fig. 3 ) and nitrogen physisorption measurements (Fig. 4 ) indicated that there existed a porous structure, though the pore of the Ni(HBTC)BPY appeared to be complex and different from that of conventional microporous and mesoporous materials. Nitrogen adsorption/desorption isotherm data (Fig. 5 ) revealed a Langmuir surface areas of 1848m2/g and a BET surface areas of 1427m2/g. TGA result of the Ni(HBTC)BPY indicated that the DMF was completely replaced with the DCM, and that the material was stable up to over 300°C (Fig. 6 ). FT-IR spectra of the Ni(HBTC)BPY exhibited a significant difference as compared to those of the 1,3,5-benzenetricarboxylic acid and the 4,4′-bipyridine linkers (Fig. 7 ). In the spectra of the 1,3,5-benzenetricarboxylic acid, there was a strong peak at 1721cm−1, which was assigned for the CO stretching vibration in free carboxylic acids (1760–1690cm−1). The intensity of this peak in the spectra of the Ni(HBTC)BPY was found to be significantly lower than the case of the free acid linker. Moreover, the spectra of the Ni(HBTC)BPY exhibited the presence of a strong peak at 1610cm−1, indicating the deprotonation of COOH groups in the 1,3,5-benzenetricarboxylic acid upon the reaction with nickel ions [73,74]. The CN stretching vibration in the 4,4′-bipyridine was observed at 1596cm−1. It was found that this value was decreased to 1539cm−1 in the spectra of the Ni(HBTC)BPY, confirming the coordination of the nitrogen with metal ions. 3.2 Catalytic studies The Ni(HBTC)BPY was assessed for its catalytic activity in the addition reaction of phenylboronic acid to benzaldehyde to form diphenylmethanol as the principal product (Scheme 1 ). Initial studies addressed the effect of temperature on the reaction conversion, having carried out the addition reaction at 10mol% catalyst, using 1.5equiv. of phenylboronic acid in toluene at 80°C, 90°C, and 100°C, respectively, and in the presence of 3equiv. of K3PO4 as a base. It was found that the reaction occurred slowly at 80°C, with only 14% conversion being observed after 6h. As expected, increasing the temperature led to a significant enhancement in the reaction rate. The reaction carried out at 90°C and 100°C afforded 47% and 63% conversions after 6h, respectively (Fig. 8 ). The temperature range from 80°C to 110°C has been the most commonly used for the addition reaction of arylboronic acids to aldehydes using different types of catalysts. For example, the reaction was previously carried out at 80°C with nickel catalyst [2,11], 90°C with ion catalyst [13], 100°C with rhodium catalyst [75], and 110°C with copper catalyst [1]. Indeed, the reaction temperature would strongly depend on the nature of the catalyst used for the reaction. The effective temperature range for the addition reaction using the Ni(HBTC)BPY catalyst was therefore comparable with that previously mentioned in the literature. As for most transition metal-catalyzed reactions of organoboronic acids, the presence of at least 1equiv. of a base should be required to accelerate the transmetalation step in the catalytic cycle of the reaction [76]. It was previously reported that the addition reaction of arylboronic acids to aldehydes could proceed readily in the presence of a variety of bases, such as K2CO3 [3,6], Cs2CO3 [75], CsF [9], KOH [14], NaOAc [1], K3PO4 [2], and KO t Bu [14]. We therefore decided to investigate the effect of different bases on the reaction conversion. The Ni(HBTC)BPY-catalyzed addition reaction was carried out in toluene at 100°C for 6h, using 1.5equiv. of phenylboronic acid and 3equiv. of K2CO3, Na2CO3, K3PO4, and triethylamine, respectively. It was found that K3PO4 was superior to other bases, with 63% conversion being achieved after 6h. The reaction using K2CO3 afforded 52% conversion after 6h, while only 30% conversion was observed for the case of Na2CO3. Triethylamine was also found to be unsuitable for the reaction using the Ni(HBTC)BPY catalyst, with only 23% conversion being obtained after 6h (Fig. 9 ). It was therefore decided to use K3PO4 as the base for the reaction in further experiments. For an organic transformation using a solid catalyst, the effect of different solvents on the rate of the reaction could normally be of extreme importance, depending on the nature of the catalyst material [77,78]. Moreover, the reaction using a homogeneous catalyst might also be significantly influenced by the polarity of the solvent. Su and co-workers previously carried out the addition reaction of arylboronic acids to aromatic aldehydes using a copper catalyst in several solvents, and demonstrated that toluene was the best choice for the reaction among other common solvents such as CH3CH2NO2, DMF, DMSO, dioxane, DCE, THF, and t-butanol [1]. Trindade and co-workers used a dirhodium catalyst for the addition reaction in several solvents, and pointed out that t-amyl alcohol and methanol should be used for the reaction instead of DME, toluene/H2O, DME/H2O, DME/t-butanol, and CH3CN [14]. Zhou et al. also investigated the effect of solvent on the addition reaction using a nickel catalyst, and showed that a mixture of toluene/isopropanol was superior to isopropanol, toluene, dioxane, ethanol, DME, and CH3CN [2]. We therefore decided to investigate the effect of different solvents on the reaction conversion, having carried out the reaction in different solvents at 100°C, using 1.5equiv. of phenylboronic acid and 3equiv. of K3PO4, in the presence of 10mol% Ni(HBTC)BPY catalyst. It was observed that the solvent had a profound effect on the addition reaction of phenylboronic acid to benzaldehyde using the Ni(HBTC)BPY catalyst. Experimental results showed that xylene and DMF should not be used for the reaction, as less than 30% conversion was obtained after 6h. The reaction carried out in toluene afforded 63% conversion, while the n-butanol exhibited better performance with 80% conversion being achieved after 6h (Fig. 10 ). It was therefore decided to employ n-butanol as the solvent for the reaction in further studies. With these results in mind, we then investigated the effect of catalyst concentration on the reaction conversion. The reaction was carried out in n-butanol at 100°C, using 1.5equiv. of phenylboronic acid and 3equiv. of K3PO4, in the presence of 5mol%, 7.5mol%, 10mol% Ni(HBTC)BPY catalyst, respectively. As expected, decreasing the catalyst concentration from 10% to 5mol% resulted in a significant drop in the reaction rate, with 80% and 67% conversions being observed after 6h for the former and the latter case, respectively. It was also observed that the reaction using 7.5mol% catalyst afforded 74% conversion after 6h (Fig. 11 ). It should be noted that approximately 5% conversion was observed in the absence of the catalyst, probably due to the metal residue present in the base used for the reaction. Indeed, elemental analysis with AAS indicated that the K3PO4 contained 3ppm copper and 6ppm nickel. The catalyst concentrations used in this study were comparable to those of several previous reports covering different aspects of the addition reaction of arylboronic acids to aromatic aldehydes, where the catalyst concentrations varied from less than 5mol% to more than 10mol%, depending on the nature of the catalysts as well as the substrates. Indeed, the catalyst concentration of 5mol% was previously employed for the reaction in several reports [2,6,79–81], though lower or higher catalyst concentrations were also used in other cases. Huang and co-worker carried out the reaction in the presence of 1mol% RhCl3·3H2O and 1mol% t-Bu-Amphos ligand [82]. Trindade also employed 3mol% Rh2(OAc)4 in the presence of 3mol% N-heterocyclic carbene ligand as catalyst for the reaction [14]. However, higher catalyst concentrations were previously used for the reaction in other works, for example, 10% FeCl3 and 10% 2-(di-tert-butylphosphino)biphenyl ligand [13], 10mol% Cu(OAc)2 and 15mol% dppf ligand [1], and 20% nickel phosphine complexes [83]. For a liquid-phase organic transformation using a solid catalyst, the possibility that some of active sites could dissolve into the reaction solution during the course of the reaction should be taken into account as these leached species could contribute significantly to the total conversion of the reaction. In this case, although a solid catalyst is employed, the reaction would not proceed under real heterogeneous catalysis conditions [78]. In order to confirm if active nickel species leached from the solid Ni(HBTC)BPY catalyst could play a significant role in the catalytic activity for the addition reaction of phenylboronic acid to benzaldehyde, an experiment was carried out using a simple centrifugation during the course of the reaction. After the solid catalyst was removed from the reaction mixture, if further conversion was still observed for the solution phase, this would indicate that the active species were from the solution rather than from the solid Ni(HBTC)BPY catalyst. The Ni(HBTC)BPY-catalyzed addition reaction was carried out in n-butanol at 100°C for 6h, using 1.5equiv. of phenylboronic acid and 3equiv. of K3PO4, and in the presence of 10mol% catalyst. The organic phase was separated from the solid catalyst after 1h reaction time by simple centrifugation. The solution was then transferred to a new reactor vessel containing 3equiv. of K3PO4, and stirred for an additional 5h at 100°C with aliquots being sampled at different time intervals, and analyzed by GC. The reaction conversion calculated from GC determinations would show quantitative information about residual, catalytically active species being soluble in the solution during the course of the reaction. Experimental result showed that no further conversion was detected for the addition reaction in the liquid phase after the solid Ni(HBTC)BPY catalyst was separated from the reaction mixture (Fig. 12 ). These results indicated that the Ni(HBTC)BPY-catalyzed addition reaction of phenylboronic acid to benzaldehyde could only proceed in the presence of the solid catalyst, and there was no contribution from leached active nickel species in the liquid phase. To confirm the necessity of using the solid Ni(HBTC)BPY as a heterogeneous catalyst for the addition reaction of phenylboronic acid to benzaldehyde, three nickel salts including Ni(NO3)2, NiCl2, and NiSO4 were also used as homogeneous catalysts for the reaction. The reaction was carried out in n-butanol at 100°C, using 1.5equiv. of phenylboronic acid and 3equiv. of K3PO4, in the presence of 10mol% nickel catalyst. Interestingly, it was found that the Ni(HBTC)BPY-catalyzed addition reaction offered higher rate than that of the reaction using the homogeneous nickel catalyst. NiSO4 was found to be unsuitable for the reaction, as a conversion of only 16% was observed after 6h. Ni(NO3)2, one component of the Ni(HBTC)BPY, also exhibited significantly lower activity for the reaction than the solid catalyst, with a conversion of 48% being obtained after 6h. It should be noted that the reaction using 10mol% the organic linker of the Ni(HBTC)BPY (i.e. 1,3,5-benzenetricarboxylic acid) gave approximately 5% conversion, probably due to the nickel residue present in the base used for the reaction. It was also observed that NiCl2 exhibited lower activity than the Ni(HBTC)BPY, though the reaction still afforded 78% conversion after 6h (Fig. 13 ). Indeed, nickel homogeneous catalyst in the form of nickel phosphine complexes exhibited high activity in the addition reaction of arylboronic acids to aromatic aldehydes [83]. It was also reported that the reaction using nickel salts as catalyst such as NiCl2, Ni(OAc)2, and Ni(ClO4)2 offered reasonable conversions [2]. The higher activity of the Ni(HBTC)BPY catalyst than that of homogeneous nickel catalysts still remains to be investigated in further studies. However, a clear advantage of using the Ni(HBTC)BPY as catalyst over conventional nickel salts would be the reusability of the MOF-based material. The study was then extended to the addition reaction of phenylboronic acid to several aldehydes in the presence of the Ni(HBTC)BPY catalyst, including benzaldehyde, 4-chlorobenzaldehyde, 4-nitrobenzaldehyde, 2-methylbenzaldehyde, 3-methylbenzaldehyde, 4-methylbenzaldehyde, and 4-methoxybenzaldehyde. The reaction was carried out in n-butanol at 100°C for 6h, using 1.5equiv. of phenylboronic acid and 3equiv. of K3PO4, in the presence of 10mol% Ni(HBTC)BPY catalyst. It was found that the Ni(HBTC)BPY-catalyzed addition reaction of phenylboronic acid to aromatic aldehydes was highly sensitive to electronic effects of substituents present in the aldehyde structure. The reaction of phenylboronic acid and 4-chlorobenzaldehyde afforded up to 95% conversion after 6h, higher than the case of benzaldehyde (i.e. 82% conversion). However, nitro group, a strongly electron-withdrawing substituent, significantly deactivated the aldehyde, with only 9% conversion being observed after 6h. This observation was similar to that previously reported by Trindade [14], Zhou [2], and Chen et al. [3], where dramatically low yields were observed for aromatic aldehydes containing strongly electron-withdrawing substituents like nitro group. In contrast, Ueda and co-worker previously reported that tri(tert-butyl)phosphine rhodium complex could quantitatively catalyze the reaction of 4-nitrobenzaldehyde with phenylboronic acid [84]. The addition reaction of 4-methoxybenzaldehyde proceeded with difficulty, affording 49% conversion after 6h. The reaction of three isomers of methylbenzaldehyde also occurred with slower rate than that of benzaldehyde, with 61%, 74%, and 82% conversions being obtained for the case of 3-, 2-, and 4-methylbenzaldehyde, respectively (Fig. 14 ). This result was similar to that previously reported by Zhou et al., where electron-rich aldehydes such as 4-methylbenzaldehyde and 4-methoxybenzaldehyde were less reactive than benzaldehyde [2]. However, it should be noted that Trindade [14] and Gois et al. [85] previously reported that electron-donating groups activated the addition reaction of aromatic aldehydes with phenylboronic acids using dirhodium complex catalysts. The effect of different arylboronic acids on the Ni(HBTC)BPY-catalyzed addition reaction with aromatic aldehydes was also investigated, having performed the reaction between 4-chlorobenzaldehyde with phenylboronic acid, 4-formyl-, 4-methyl-, 4-fluoro-, and 4-chlorophenylboronic acid, respectively. The reaction was carried out in n-butanol at 100°C for 6h, using 1.5equiv. of arylboronic acids and 3equiv. of K3PO4, in the presence of 10mol% Ni(HBTC)BPY catalyst. It was found that the addition reaction of 4-formylphenylboronic acid proceeded to 4-chlorobenzaldehyde with significantly slower rate than that of other boronic acids, with only 56% conversion being observed after 6h. The reaction of 4-chlorophenylboronic acid occurred more readily than that of 4-formylphenylboronic acid, affording 87% conversion after 6h. As expected, 4-fluorophenylboronic acid was found to be more reactive than 4-chlorophenylboronic acid, improving the reaction conversion to 93%. The reaction of 4-methylphenylboronic acid and phenylboronic acid proceeded readily, though 4-methylboronic acid was slightly more reactive (Fig. 15 ). This observation was similar to that previously reported by Qin [6] and Yamamoto et al. [7,81], where electron-deficient arylboronic acids are less reactive towards the palladium-catalyzed addition reaction to aromatic aldehydes. Indeed, it was previously reported that arylboronic acids containing electron-withdrawing groups transmetalated more slowly than electronneutral analogues [6], thus slowing down the reaction with aromatic aldehydes. However, Zhou et al. used the nickel catalyst for the reaction and demonstrated that higher yields were obtained from the reactions of electron-deficient arylboronic acids [2]. In the view of green chemistry, issues that should be seriously considered when performing organic reactions using solid catalysts are the ease of separation as well as the deactivation and reusability of the catalysts. In the best case the solid catalyst can be separated from the reaction mixture, recovered and reused several times before it eventually deactivates completely. The Ni(HBTC)BPY catalyst was therefore investigated for recoverability and reusability in the addition reaction between 4-chlorobenzaldehyde and phenylboronic acid over five successive runs, by repeatedly separating the Ni(HBTC)BPY from the reaction mixture, washing it and then reusing it. The reaction was carried out in n-butanol at 100°C for 6h, using 1.5equiv. of phenylboronic acid and 3equiv. of K3PO4, in the presence of 10mol% Ni(HBTC)BPY catalyst. After the reaction was complete, the Ni(HBTC)BPY catalyst was separated by simple centrifugation, washed with copious amounts of n-butanol to remove any physisorbed reagents, dried under vacuum at room temperature for 1h. The recovered Ni(HBTC)BPY catalyst was then reused in further reaction under identical conditions to those of the first run. Experimental results showed that the activity of the Ni(HBTC)BPY catalyst decreased slightly after each run. However, the catalyst could be reused without a significant degradation in catalytic activity. Indeed, a conversion of 82% was still achieved in the 5th run (Fig. 16 ). XRD result of the reused catalyst after the first run indicated that the crystallinity of the Ni(HBTC)BPY catalyst remained almost unchanged during the course of the reaction (Fig. 17 ). As compared to the FT-IR spectra of the fresh Ni(HBTC)BPY, only a slight difference was observed on that of the reused Ni(HBTC)BPY after the 1st run (Fig. 18 ). Further investigations would be needed to clarify the reason of the catalyst deactivation in the addition reaction of arylboronic acids to aromatic aldehydes using the Ni(HBTC)BPY catalyst. 4 Conclusions In summary, highly crystalline porous Ni(HBTC)BPY was obtained from the reaction of 1,3,5-benzenetricarboxylic acid, nickel nitrate hexahydrate, and 4,4′-bipyridine by a solvothermal method in DMF. The Ni(HBTC)BPY was characterized using a variety of different techniques, including XRD, TEM, SEM, FT-IR, TGA, AAS, and nitrogen physisorption measurements. The Ni(HBTC)BPY catalyst exhibited high activity in the arylation of aldehydes with arylboronic acids to form diarylmethanols. The Ni(HBTC)BPY catalyst could be separated from the reaction mixture by simple filtration or centrifugation, and could be reused without a significant degradation in catalytic activity. To the best of our knowledge, the addition reaction of arylboronic acids to aromatic aldehydes in the presence of solid catalysts was not previously reported in the literature. Our results indicate that the Ni(HBTC)BPY could be used as an efficient recyclable catalyst for the reaction, thus offering a route to green chemistry for the synthesis of diarylmethanols. This achievement would contribute to the applications of metal-organic frameworks in the field of catalysis, which would be interested to the chemical industry. Acknowledgements The Viet Nam National Foundation for Science and Technology Development – NAFOSTED is acknowledged for financial support through project code 104.99-2012.25. References [1] H. Zheng Q. Zhang J. Chen M. Liu S. Cheng J. Ding H. Wu W. Su J. Org. Chem. 74 2009 943 945 [2] L. Zhou X. Du R. He Z. Ci M. Bao Tetrahedron Lett. 50 2009 406 408 [3] W. Chen M. Baghbanzadeh C.O. Kappe Tetrahedron Lett. 52 2011 1677 1679 [4] A. Suzuki J. Organomet. Chem. 576 1999 147 168 [5] M. Sakai M. Ueda N. Miyaura Angew. Chem. Int. Ed. 37 1998 3279 3281 [6] C. Qin H. Wu J. Cheng X.a. Chen M. Liu W. Zhang W. Su J. Ding J. Org. Chem. 72 2007 4102 4107 [7] T. Yamamoto T. Ohta Y. Ito Org. Lett. 7 2005 4153 4155 [8] S. Lin X. Lu J. Org. Chem 72 2007 9757 9760 [9] M. Kuriyama R. Shimazawa R. Shirai J. Org. Chem 73 2008 1579 1600 [10] A. Yu B. Cheng Y. Wu J. Li K. Wei Tetrahedron Lett. 49 2008 5405 5407 [11] J. Bouffard K. Itami Org. Lett. 11 2009 4410 4413 [12] G. Takahashi E. Shirakawa T. Tsuchimoto Y. Kawakami Chem. Commun. 2005 1459 1461 [13] T. Zou S.-S. Pi J.-H. Li Org. Lett. 11 2009 453 456 [14] A.F. Trindade P.M.P. Gois L.s.F. Veiros V.n. André M.T. Duarte C.A.M. Afonso S. Caddick F.G.N. Cloke J. Org. Chem. 73 2008 4076 4086 [15] A. Rahmatpour J. Aalaie Heteroatom Chem. 22 2011 85 90 [16] R.G.d. Noronha A.C. Fernandes C.C. Romão Tetrahedron Lett. 50 2009 1407 1410 [17] M.L. Kantam S. Laha J. Yadav S. Jha Tetrahedron Lett. 50 2009 4467 4469 [18] K. Mantri K. Komura Y. Kubota Y. Sugi J. Mol. Catal. A 236 2005 168 175 [19] N.E. Leadbeater M. Marco Chem. Rev. 102 2002 3217 3274 [20] H.K. Chae D.Y. Siberio-Perez J. Kim Y. Go M. Eddaoudi A.J. Matzger M. O’Keeffe O.M. Yaghi Nature 427 2004 523 527 [21] D.J. Tranchemontagne Z. Ni M. O’Keeffe O.M. Yaghi Angew. Chem. Int. Ed. 47 2008 5136 5147 [22] S.S. Kaye A. Dailly O.M. Yaghi J.R. Long J. Am. Chem. Soc. 129 2007 14176 14177 [23] H. Furukawa N. Ko Y.B. Go N. Aratani S.B. Choi E. Choi A.O. Yazaydin R.Q. Snurr M. O’Keeffe J. Kim O.M. Yaghi Science 239 2010 424 428 [24] P. Horcajada T. Chalati C. Serre B. Gillet C. Sebrie T. Baati J.F. Eubank D. Heurtaux P. Clayette C. Kreuz J.S. Chang Y.K. Hwang V. Marsaud P.N. Bories L. Cynober S. Gil G. Férey P. Couvreur R. Gref Nat. Mater. 9 2010 172 178 [25] R.J. Kuppler D.J. Timmons Q.-R. Fang J.-R. Li T.A. Makal M.D. Young D. Yuan D. Zhao W. Zhuang H.-C. Zhou Coord. Chem. Rev. 253 2009 3042 3066 [26] H.-C. Zhou J.R. Long O.M. Yaghi Chem. Rev. 112 2012 673 674 [27] Y. Cui Y. Yue G. Qian B. Chen Chem. Rev. 112 2012 1126 1162 [28] J.-R. Li J. Sculley H.-C. Zhou Chem. Rev. 112 2012 869 932 [29] H. Li M. Eddaoudi M. O’Keeffe O.M. Yaghi Nature 402 1999 276 279 [30] J.L.C. Rowsell O.M. Yaghi Microporous Mesoporous Mater. 73 2004 3 14 [31] Z.-Q. Li L.-G. Qiu T. Xu Y. Wu W. Wang Z.-Y. Wu X. Jiang Mater. Lett. 63 2009 78 80 [32] A. Dhakshinamoorthy M. Alvaro A. Corma H. Garcia Dalton Trans. 40 2011 6344 6360 [33] J.L. Harding M.M. Reynolds J. Am. Chem. Soc. 134 2012 3330 3333 [34] X. Tan L. Li J. Zhang X. Han L. Jiang F. Li C.-Y. Su Chem. Mater. 24 2012 480 485 [35] L.-X. Shi C.-D. Wu Chem. Commun. 47 2011 2928 2930 [36] J.M. Roberts B.M. Fini A.A. Sarjeant O.K. Farha J.T. Hupp K.A. Scheidt J. Am. Chem. Soc. 134 2012 3334 3337 [37] N.T.S. Phan K.K.A. Le T.D. Phan Appl. Catal. A: Gen. 382 2010 246 253 [38] U. Ravon M. Savonnet S. Aguado M.E. Domine E. Janneau D. Farrusseng Microporous Mesoporous Mater. 129 2010 319 329 [39] L.T.L. Nguyen C.V. Nguyen G.H. Dang K.K.A. Le N.T.S. Phan J. Mol. Catal. A: Chem. 349 2011 28 35 [40] A. Dhakshinamoorthy M. Alvaro H. Garcia ACS Catal. 1 2011 48 53 [41] F.X.L.i. Xamena O. Casanova R.G. Tailleur A.C.H. Garcia J. Catal. 255 2008 220 227 [42] H. Liu Y. Liu Y. Li Z. Tang H. Jiang J. Phys. Chem. C 114 2010 13362 13369 [43] W. Kleist M. Maciejewski A. Baiker Thermochim. Acta 499 2010 71 78 [44] A. Dhakshinamoorthy M. Alvaro H. Garcia J. Catal. 267 2009 1 4 [45] W. Wang Y. Li R. Zhang D. He H. Liu S. Liao Catal. Commun. 12 2011 875 879 [46] F. Song C. Wang J.M. Falkowski L. Ma W. Lin J. Am. Chem. Soc. 132 2010 15390 15398 [47] S.-H. Cho B. Ma S.T. Nguyen J.T. Hupp T.E. Albrecht-Schmitt Chem. Commun. 2006 2563 2565 [48] K. Brown S. Zolezzi P. Aguirre D. Venegas-Yazigi V. Paredes-García R. Baggio M.A. Novak E. Spodine Dalton Trans. 2009 1422 1427 [49] J. Song Z. Zhang S. Hu T. Wu T. Jiang B. Han Green Chem. 11 2009 1031 1036 [50] K. Schlichte T. Kratzke S. Kaskel Microporous Mesoporous Mater. 73 2004 81 88 [51] M. Gustafsson A. Bartoszewicz B. Martn-Matute J. Sun J. Grins T. Zhao Z. Li G. Zhu X. Zou Chem. Mater. 22 2010 3316 3322 [52] S. Opelt S. Turk E. Dietzsch A. Henschel S. Kaskel E. Klemm Catal. Commun. 9 2008 1286 1290 [53] F.X.L.i. Xamena A. Abad A. Corma H. Garcia J. Catal. 250 2007 294 298 [54] Y. Huang Z. Zheng T. Liu J. Lü Z. Lin H. Li R. Cao Catal. Commun. 14 2011 27 31 [55] S. Gao N. Zhao M. Shu S. Che Appl. Catal. A: Gen. 388 2010 196 201 [56] Y. Zhou J. Song S. Liang S. Hu H. Liu T. Jiang B. Han J. Mol. Catal. A 308 2009 68 75 [57] S. Neogi M.K. Sharma P.K. Bharadwaj J. Mol. Catal. A 299 2009 1 4 [58] J. Gascon U. Aktay M.D. Hernandez-Alonso G.P.M.v. Klink F. Kapteijn J. Catal. 261 2009 75 87 [59] G.A.E. Oxford D. Dubbeldam L.J. Broadbelt R.Q. Snurr J. Mol. Catal. A: Chem. 334 2011 89 97 [60] T. Dewa T. Saiki Y. Aoyama J. Am. Chem. Soc. 123 2001 502 503 [61] F. Vermoortele R. Ameloot A. Vimont C. Serre D.D. Vos Chem. Commun. 47 2011 1511 1523 [62] M. Savonnet S. Aguado U. Ravon D. Bazer-Bachi V. Lecocq N. Bats C. Pinel D. Farrusseng Green Chem. 11 2009 1729 1732 [63] I. Luz F.X.L.i. Xamena A. Corma J. Catal. 276 2010 134 140 [64] A. Dhakshinamoorthy M. Alvaro H. Garcia Appl. Catal. A: Gen. 378 2010 19 25 [65] K. Tanaka S. Oda M. Shiro Chem. Commun. 2008 820 822 [66] K.K. Tanabe S.M. Cohen Inorg. Chem. 49 2010 6766 6774 [67] A. Corma H. Garcı́a F.X.L.s.i. Xamena Chem. Rev. 110 2010 4606 4655 [68] F. Song C. Wang W. Lin Chem. Commun. 47 2011 8256 8258 [69] K. Tanaka K.-i. Otani New J. Chem. 34 2010 2389 2391 [70] P. Song Y. Li W. Li B. He J. Yang X. Li Int. J. Hydrogen Energy 36 2011 10468 10473 [71] F.-N. Shi A.R. Silva J. Rocha J. Solid State Chem. 184 2011 2196 2203 [72] Y. Li L. Xie Y. Liu R. Yang X. Li Inorg. Chem. 47 2008 10372 10377 [73] C.H. Specht F.H. Frimmel Phys. Chem. Chem. Phys. 3 2001 5444 5449 [74] S.K. Papageorgiou E.P. Kouvelos E.P. Favvas A.A. Sapalidis G.E. Romanos F.K. Katsaros Carbohyd. Res. 345 2010 469 473 [75] X. Zheng J. Ding J. Chen W. Gao M. Liu H. Wu Org. Lett. 13 2011 1726 1729 [76] Y. Yamamoto K. Kurihara N. Miyaura Angew. Chem. Int. Ed. 48 2009 4414 4416 [77] G. Langhendries D.E.D. Vos G.V. Baron P.A. Jacobs J. Catal. 187 1997 453 463 [78] N.T.S. Phan C.W. Jones J. Mol. Catal. A: Chem. 253 2006 123 131 [79] K. Suzuki T. Arao S. Ishii Y. Maeda K. Kondo T. Aoyama Tetrahedron Lett. 47 2006 5789 5792 [80] P. He Y. Lu Q.-S. Hu Tetrahedron Lett. 48 2008 5283 5288 [81] T. Yamamoto M. Iizuka H. Takenaka T. Ohta Y. Ito J. Organomet. Chem. 694 2009 1325 1332 [82] R. Huang K.H. Shaughnessy Chem. Commun. 2005 4484 4486 [83] T. Arao K. Kondo T. Aoyama Tetrahedron Lett. 48 2007 4115 4117 [84] M. Ueda N. Miyaura J. Org. Chem. 65 2000 4450 4452 [85] P.M.P. Gois A.F. Trindade L.F. Veiros V. Andre M.T. Duarte C.A.M. Afonso S. Caddick F.G.N. Cloke Angew. Chem. Int. Ed. 46 2007 5750 5753",
      "scopus-id": "84867577118",
      "coredata": {
        "eid": "1-s2.0-S1381116912002609",
        "dc:description": "A highly crystalline porous Ni(HBTC)BPY was synthesized from the reaction of 1,3,5-benzenetricarboxylic acid, nickel nitrate hexahydrate, and 4,4′-bipyridine by a solvothermal method. Physical characterizations of the solid catalyst were achieved by using several techniques, including X-ray powder diffraction (XRD), scanning electron microscope (SEM), transmission electron microscopy (TEM), thermogravimetric analysis (TGA), Fourier transform infrared (FT-IR), atomic absorption spectrophotometry (AAS), and nitrogen physisorption measurements. The Ni(HBTC)BPY exhibited high catalytic activity in the arylation of aldehydes with arylboronic acids to form diarylmethanols. The catalyst could be separated from the reaction mixture by simple filtration or centrifugation, and could be reused without a significant degradation in catalytic activity. No contribution from homogeneous catalysis of active species leaching into the liquid phase was detected.",
        "openArchiveArticle": "false",
        "prism:coverDate": "2012-12-31",
        "openaccessUserLicense": null,
        "prism:aggregationType": "Journal",
        "prism:url": "https://api.elsevier.com/content/article/pii/S1381116912002609",
        "dc:creator": [
          {
            "@_fa": "true",
            "$": "Phan, Nam T.S."
          },
          {
            "@_fa": "true",
            "$": "Nguyen, Tung T."
          },
          {
            "@_fa": "true",
            "$": "Ta, Anh H."
          }
        ],
        "link": [
          {
            "@_fa": "true",
            "@rel": "self",
            "@href": "https://api.elsevier.com/content/article/pii/S1381116912002609"
          },
          {
            "@_fa": "true",
            "@rel": "scidir",
            "@href": "https://www.sciencedirect.com/science/article/pii/S1381116912002609"
          }
        ],
        "dc:format": "application/json",
        "openaccessType": null,
        "pii": "S1381-1169(12)00260-9",
        "prism:volume": "365",
        "prism:publisher": "Elsevier B.V.",
        "dc:title": "The arylation of aldehydes with arylboronic acids using metal-organic framework Ni(HBTC)BPY as an efficient heterogeneous catalyst",
        "prism:copyright": "Copyright © 2012 Elsevier B.V. All rights reserved.",
        "openaccess": "0",
        "prism:issn": "13811169",
        "dcterms:subject": [
          {
            "@_fa": "true",
            "$": "Metal-organic framework"
          },
          {
            "@_fa": "true",
            "$": "Arylation"
          },
          {
            "@_fa": "true",
            "$": "Nickel catalyst"
          },
          {
            "@_fa": "true",
            "$": "Heterogeneous"
          },
          {
            "@_fa": "true",
            "$": "Ni(HBTC)BPY"
          }
        ],
        "openaccessArticle": "false",
        "prism:publicationName": "Journal of Molecular Catalysis A: Chemical",
        "openaccessSponsorType": null,
        "prism:pageRange": "95-102",
        "prism:endingPage": "102",
        "pubType": "fla",
        "prism:coverDisplayDate": "December 2012",
        "prism:doi": "10.1016/j.molcata.2012.08.015",
        "prism:startingPage": "95",
        "dc:identifier": "doi:10.1016/j.molcata.2012.08.015",
        "openaccessSponsorName": null
      },
      "objects": {
        "object": [
          {
            "@category": "standard",
            "@height": "63",
            "@width": "392",
            "@_fa": "true",
            "$": "https://api.elsevier.com/content/object/eid/1-s2.0-S1381116912002609-sc1.jpg?httpAccept=%2A%2F%2A",
            "@multimediatype": "JPEG image file",
            "@type": "IMAGE-DOWNSAMPLED",
            "@size": "6469",
            "@ref": "sc1",
            "@mimetype": "image/jpeg"
          },
          {
            "@category": "thumbnail",
            "@height": "35",
            "@width": "219",
            "@_fa": "true",
            "$": "https://api.elsevier.com/content/object/eid/1-s2.0-S1381116912002609-sc1.sml?httpAccept=%2A%2F%2A",
            "@multimediatype": "GIF image file",
            "@type": "IMAGE-THUMBNAIL",
            "@size": "2062",
            "@ref": "sc1",
            "@mimetype": "image/gif"
          },
          {
            "@category": "high",
            "@height": "277",
            "@width": "1737",
            "@_fa": "true",
            "$": "https://api.elsevier.com/content/object/eid/1-s2.0-S1381116912002609-sc1_lrg.jpg?httpAccept=%2A%2F%2A",
            "@multimediatype": "JPEG image file",
            "@type": "IMAGE-HIGH-RES",
            "@size": "53885",
            "@ref": "sc1",
            "@mimetype": "image/jpeg"
          },
          {
            "@category": "standard",
            "@height": "268",
            "@width": "391",
            "@_fa": "true",
            "$": "https://api.elsevier.com/content/object/eid/1-s2.0-S1381116912002609-gr5.jpg?httpAccept=%2A%2F%2A",
            "@multimediatype": "JPEG image file",
            "@type": "IMAGE-DOWNSAMPLED",
            "@size": "13674",
            "@ref": "gr5",
            "@mimetype": "image/jpeg"
          },
          {
            "@category": "thumbnail",
            "@height": "150",
            "@width": "219",
            "@_fa": "true",
            "$": "https://api.elsevier.com/content/object/eid/1-s2.0-S1381116912002609-gr5.sml?httpAccept=%2A%2F%2A",
            "@multimediatype": "GIF image file",
            "@type": "IMAGE-THUMBNAIL",
            "@size": "3747",
            "@ref": "gr5",
            "@mimetype": "image/gif"
          },
          {
            "@category": "high",
            "@height": "1187",
            "@width": "1733",
            "@_fa": "true",
            "$": "https://api.elsevier.com/content/object/eid/1-s2.0-S1381116912002609-gr5_lrg.jpg?httpAccept=%2A%2F%2A",
            "@multimediatype": "JPEG image file",
            "@type": "IMAGE-HIGH-RES",
            "@size": "121772",
            "@ref": "gr5",
            "@mimetype": "image/jpeg"
          },
          {
            "@category": "standard",
            "@height": "268",
            "@width": "327",
            "@_fa": "true",
            "$": "https://api.elsevier.com/content/object/eid/1-s2.0-S1381116912002609-gr8.jpg?httpAccept=%2A%2F%2A",
            "@multimediatype": "JPEG image file",
            "@type": "IMAGE-DOWNSAMPLED",
            "@size": "14063",
            "@ref": "gr8",
            "@mimetype": "image/jpeg"
          },
          {
            "@category": "thumbnail",
            "@height": "164",
            "@width": "200",
            "@_fa": "true",
            "$": "https://api.elsevier.com/content/object/eid/1-s2.0-S1381116912002609-gr8.sml?httpAccept=%2A%2F%2A",
            "@multimediatype": "GIF image file",
            "@type": "IMAGE-THUMBNAIL",
            "@size": "3892",
            "@ref": "gr8",
            "@mimetype": "image/gif"
          },
          {
            "@category": "high",
            "@height": "1187",
            "@width": "1448",
            "@_fa": "true",
            "$": "https://api.elsevier.com/content/object/eid/1-s2.0-S1381116912002609-gr8_lrg.jpg?httpAccept=%2A%2F%2A",
            "@multimediatype": "JPEG image file",
            "@type": "IMAGE-HIGH-RES",
            "@size": "107596",
            "@ref": "gr8",
            "@mimetype": "image/jpeg"
          },
          {
            "@category": "standard",
            "@height": "266",
            "@width": "321",
            "@_fa": "true",
            "$": "https://api.elsevier.com/content/object/eid/1-s2.0-S1381116912002609-gr9.jpg?httpAccept=%2A%2F%2A",
            "@multimediatype": "JPEG image file",
            "@type": "IMAGE-DOWNSAMPLED",
            "@size": "16185",
            "@ref": "gr9",
            "@mimetype": "image/jpeg"
          },
          {
            "@category": "thumbnail",
            "@height": "164",
            "@width": "198",
            "@_fa": "true",
            "$": "https://api.elsevier.com/content/object/eid/1-s2.0-S1381116912002609-gr9.sml?httpAccept=%2A%2F%2A",
            "@multimediatype": "GIF image file",
            "@type": "IMAGE-THUMBNAIL",
            "@size": "4154",
            "@ref": "gr9",
            "@mimetype": "image/gif"
          },
          {
            "@category": "high",
            "@height": "1181",
            "@width": "1424",
            "@_fa": "true",
            "$": "https://api.elsevier.com/content/object/eid/1-s2.0-S1381116912002609-gr9_lrg.jpg?httpAccept=%2A%2F%2A",
            "@multimediatype": "JPEG image file",
            "@type": "IMAGE-HIGH-RES",
            "@size": "123188",
            "@ref": "gr9",
            "@mimetype": "image/jpeg"
          },
          {
            "@category": "standard",
            "@height": "269",
            "@width": "318",
            "@_fa": "true",
            "$": "https://api.elsevier.com/content/object/eid/1-s2.0-S1381116912002609-gr10.jpg?httpAccept=%2A%2F%2A",
            "@multimediatype": "JPEG image file",
            "@type": "IMAGE-DOWNSAMPLED",
            "@size": "16037",
            "@ref": "gr10",
            "@mimetype": "image/jpeg"
          },
          {
            "@category": "thumbnail",
            "@height": "164",
            "@width": "194",
            "@_fa": "true",
            "$": "https://api.elsevier.com/content/object/eid/1-s2.0-S1381116912002609-gr10.sml?httpAccept=%2A%2F%2A",
            "@multimediatype": "GIF image file",
            "@type": "IMAGE-THUMBNAIL",
            "@size": "4112",
            "@ref": "gr10",
            "@mimetype": "image/gif"
          },
          {
            "@category": "high",
            "@height": "1190",
            "@width": "1408",
            "@_fa": "true",
            "$": "https://api.elsevier.com/content/object/eid/1-s2.0-S1381116912002609-gr10_lrg.jpg?httpAccept=%2A%2F%2A",
            "@multimediatype": "JPEG image file",
            "@type": "IMAGE-HIGH-RES",
            "@size": "124003",
            "@ref": "gr10",
            "@mimetype": "image/jpeg"
          },
          {
            "@category": "standard",
            "@height": "269",
            "@width": "319",
            "@_fa": "true",
            "$": "https://api.elsevier.com/content/object/eid/1-s2.0-S1381116912002609-gr11.jpg?httpAccept=%2A%2F%2A",
            "@multimediatype": "JPEG image file",
            "@type": "IMAGE-DOWNSAMPLED",
            "@size": "16974",
            "@ref": "gr11",
            "@mimetype": "image/jpeg"
          },
          {
            "@category": "thumbnail",
            "@height": "164",
            "@width": "194",
            "@_fa": "true",
            "$": "https://api.elsevier.com/content/object/eid/1-s2.0-S1381116912002609-gr11.sml?httpAccept=%2A%2F%2A",
            "@multimediatype": "GIF image file",
            "@type": "IMAGE-THUMBNAIL",
            "@size": "4326",
            "@ref": "gr11",
            "@mimetype": "image/gif"
          },
          {
            "@category": "high",
            "@height": "1193",
            "@width": "1414",
            "@_fa": "true",
            "$": "https://api.elsevier.com/content/object/eid/1-s2.0-S1381116912002609-gr11_lrg.jpg?httpAccept=%2A%2F%2A",
            "@multimediatype": "JPEG image file",
            "@type": "IMAGE-HIGH-RES",
            "@size": "128686",
            "@ref": "gr11",
            "@mimetype": "image/jpeg"
          },
          {
            "@category": "standard",
            "@height": "267",
            "@width": "319",
            "@_fa": "true",
            "$": "https://api.elsevier.com/content/object/eid/1-s2.0-S1381116912002609-gr12.jpg?httpAccept=%2A%2F%2A",
            "@multimediatype": "JPEG image file",
            "@type": "IMAGE-DOWNSAMPLED",
            "@size": "12975",
            "@ref": "gr12",
            "@mimetype": "image/jpeg"
          },
          {
            "@category": "thumbnail",
            "@height": "164",
            "@width": "196",
            "@_fa": "true",
            "$": "https://api.elsevier.com/content/object/eid/1-s2.0-S1381116912002609-gr12.sml?httpAccept=%2A%2F%2A",
            "@multimediatype": "GIF image file",
            "@type": "IMAGE-THUMBNAIL",
            "@size": "3619",
            "@ref": "gr12",
            "@mimetype": "image/gif"
          },
          {
            "@category": "high",
            "@height": "1184",
            "@width": "1414",
            "@_fa": "true",
            "$": "https://api.elsevier.com/content/object/eid/1-s2.0-S1381116912002609-gr12_lrg.jpg?httpAccept=%2A%2F%2A",
            "@multimediatype": "JPEG image file",
            "@type": "IMAGE-HIGH-RES",
            "@size": "96246",
            "@ref": "gr12",
            "@mimetype": "image/jpeg"
          },
          {
            "@category": "standard",
            "@height": "267",
            "@width": "319",
            "@_fa": "true",
            "$": "https://api.elsevier.com/content/object/eid/1-s2.0-S1381116912002609-gr13.jpg?httpAccept=%2A%2F%2A",
            "@multimediatype": "JPEG image file",
            "@type": "IMAGE-DOWNSAMPLED",
            "@size": "17558",
            "@ref": "gr13",
            "@mimetype": "image/jpeg"
          },
          {
            "@category": "thumbnail",
            "@height": "164",
            "@width": "196",
            "@_fa": "true",
            "$": "https://api.elsevier.com/content/object/eid/1-s2.0-S1381116912002609-gr13.sml?httpAccept=%2A%2F%2A",
            "@multimediatype": "GIF image file",
            "@type": "IMAGE-THUMBNAIL",
            "@size": "4369",
            "@ref": "gr13",
            "@mimetype": "image/gif"
          },
          {
            "@category": "high",
            "@height": "1184",
            "@width": "1414",
            "@_fa": "true",
            "$": "https://api.elsevier.com/content/object/eid/1-s2.0-S1381116912002609-gr13_lrg.jpg?httpAccept=%2A%2F%2A",
            "@multimediatype": "JPEG image file",
            "@type": "IMAGE-HIGH-RES",
            "@size": "131361",
            "@ref": "gr13",
            "@mimetype": "image/jpeg"
          },
          {
            "@category": "standard",
            "@height": "327",
            "@width": "343",
            "@_fa": "true",
            "$": "https://api.elsevier.com/content/object/eid/1-s2.0-S1381116912002609-gr14.jpg?httpAccept=%2A%2F%2A",
            "@multimediatype": "JPEG image file",
            "@type": "IMAGE-DOWNSAMPLED",
            "@size": "28732",
            "@ref": "gr14",
            "@mimetype": "image/jpeg"
          },
          {
            "@category": "thumbnail",
            "@height": "164",
            "@width": "172",
            "@_fa": "true",
            "$": "https://api.elsevier.com/content/object/eid/1-s2.0-S1381116912002609-gr14.sml?httpAccept=%2A%2F%2A",
            "@multimediatype": "GIF image file",
            "@type": "IMAGE-THUMBNAIL",
            "@size": "5070",
            "@ref": "gr14",
            "@mimetype": "image/gif"
          },
          {
            "@category": "high",
            "@height": "1450",
            "@width": "1519",
            "@_fa": "true",
            "$": "https://api.elsevier.com/content/object/eid/1-s2.0-S1381116912002609-gr14_lrg.jpg?httpAccept=%2A%2F%2A",
            "@multimediatype": "JPEG image file",
            "@type": "IMAGE-HIGH-RES",
            "@size": "247959",
            "@ref": "gr14",
            "@mimetype": "image/jpeg"
          },
          {
            "@category": "standard",
            "@height": "335",
            "@width": "318",
            "@_fa": "true",
            "$": "https://api.elsevier.com/content/object/eid/1-s2.0-S1381116912002609-gr15.jpg?httpAccept=%2A%2F%2A",
            "@multimediatype": "JPEG image file",
            "@type": "IMAGE-DOWNSAMPLED",
            "@size": "22114",
            "@ref": "gr15",
            "@mimetype": "image/jpeg"
          },
          {
            "@category": "thumbnail",
            "@height": "163",
            "@width": "155",
            "@_fa": "true",
            "$": "https://api.elsevier.com/content/object/eid/1-s2.0-S1381116912002609-gr15.sml?httpAccept=%2A%2F%2A",
            "@multimediatype": "GIF image file",
            "@type": "IMAGE-THUMBNAIL",
            "@size": "4196",
            "@ref": "gr15",
            "@mimetype": "image/gif"
          },
          {
            "@category": "high",
            "@height": "1487",
            "@width": "1411",
            "@_fa": "true",
            "$": "https://api.elsevier.com/content/object/eid/1-s2.0-S1381116912002609-gr15_lrg.jpg?httpAccept=%2A%2F%2A",
            "@multimediatype": "JPEG image file",
            "@type": "IMAGE-HIGH-RES",
            "@size": "185561",
            "@ref": "gr15",
            "@mimetype": "image/jpeg"
          },
          {
            "@category": "standard",
            "@height": "267",
            "@width": "313",
            "@_fa": "true",
            "$": "https://api.elsevier.com/content/object/eid/1-s2.0-S1381116912002609-gr16.jpg?httpAccept=%2A%2F%2A",
            "@multimediatype": "JPEG image file",
            "@type": "IMAGE-DOWNSAMPLED",
            "@size": "10428",
            "@ref": "gr16",
            "@mimetype": "image/jpeg"
          },
          {
            "@category": "thumbnail",
            "@height": "164",
            "@width": "192",
            "@_fa": "true",
            "$": "https://api.elsevier.com/content/object/eid/1-s2.0-S1381116912002609-gr16.sml?httpAccept=%2A%2F%2A",
            "@multimediatype": "GIF image file",
            "@type": "IMAGE-THUMBNAIL",
            "@size": "5699",
            "@ref": "gr16",
            "@mimetype": "image/gif"
          },
          {
            "@category": "high",
            "@height": "1181",
            "@width": "1386",
            "@_fa": "true",
            "$": "https://api.elsevier.com/content/object/eid/1-s2.0-S1381116912002609-gr16_lrg.jpg?httpAccept=%2A%2F%2A",
            "@multimediatype": "JPEG image file",
            "@type": "IMAGE-HIGH-RES",
            "@size": "64247",
            "@ref": "gr16",
            "@mimetype": "image/jpeg"
          },
          {
            "@category": "standard",
            "@height": "227",
            "@width": "339",
            "@_fa": "true",
            "$": "https://api.elsevier.com/content/object/eid/1-s2.0-S1381116912002609-gr1.jpg?httpAccept=%2A%2F%2A",
            "@multimediatype": "JPEG image file",
            "@type": "IMAGE-DOWNSAMPLED",
            "@size": "16476",
            "@ref": "gr1",
            "@mimetype": "image/jpeg"
          },
          {
            "@category": "thumbnail",
            "@height": "147",
            "@width": "219",
            "@_fa": "true",
            "$": "https://api.elsevier.com/content/object/eid/1-s2.0-S1381116912002609-gr1.sml?httpAccept=%2A%2F%2A",
            "@multimediatype": "GIF image file",
            "@type": "IMAGE-THUMBNAIL",
            "@size": "3072",
            "@ref": "gr1",
            "@mimetype": "image/gif"
          },
          {
            "@category": "high",
            "@height": "1004",
            "@width": "1500",
            "@_fa": "true",
            "$": "https://api.elsevier.com/content/object/eid/1-s2.0-S1381116912002609-gr1_lrg.jpg?httpAccept=%2A%2F%2A",
            "@multimediatype": "JPEG image file",
            "@type": "IMAGE-HIGH-RES",
            "@size": "81852",
            "@ref": "gr1",
            "@mimetype": "image/jpeg"
          },
          {
            "@category": "standard",
            "@height": "271",
            "@width": "339",
            "@_fa": "true",
            "$": "https://api.elsevier.com/content/object/eid/1-s2.0-S1381116912002609-gr2.jpg?httpAccept=%2A%2F%2A",
            "@multimediatype": "JPEG image file",
            "@type": "IMAGE-DOWNSAMPLED",
            "@size": "31501",
            "@ref": "gr2",
            "@mimetype": "image/jpeg"
          },
          {
            "@category": "thumbnail",
            "@height": "164",
            "@width": "205",
            "@_fa": "true",
            "$": "https://api.elsevier.com/content/object/eid/1-s2.0-S1381116912002609-gr2.sml?httpAccept=%2A%2F%2A",
            "@multimediatype": "GIF image file",
            "@type": "IMAGE-THUMBNAIL",
            "@size": "8681",
            "@ref": "gr2",
            "@mimetype": "image/gif"
          },
          {
            "@category": "high",
            "@height": "1197",
            "@width": "1500",
            "@_fa": "true",
            "$": "https://api.elsevier.com/content/object/eid/1-s2.0-S1381116912002609-gr2_lrg.jpg?httpAccept=%2A%2F%2A",
            "@multimediatype": "JPEG image file",
            "@type": "IMAGE-HIGH-RES",
            "@size": "318799",
            "@ref": "gr2",
            "@mimetype": "image/jpeg"
          },
          {
            "@category": "standard",
            "@height": "354",
            "@width": "339",
            "@_fa": "true",
            "$": "https://api.elsevier.com/content/object/eid/1-s2.0-S1381116912002609-gr3.jpg?httpAccept=%2A%2F%2A",
            "@multimediatype": "JPEG image file",
            "@type": "IMAGE-DOWNSAMPLED",
            "@size": "46733",
            "@ref": "gr3",
            "@mimetype": "image/jpeg"
          },
          {
            "@category": "thumbnail",
            "@height": "164",
            "@width": "157",
            "@_fa": "true",
            "$": "https://api.elsevier.com/content/object/eid/1-s2.0-S1381116912002609-gr3.sml?httpAccept=%2A%2F%2A",
            "@multimediatype": "GIF image file",
            "@type": "IMAGE-THUMBNAIL",
            "@size": "8047",
            "@ref": "gr3",
            "@mimetype": "image/gif"
          },
          {
            "@category": "high",
            "@height": "1565",
            "@width": "1500",
            "@_fa": "true",
            "$": "https://api.elsevier.com/content/object/eid/1-s2.0-S1381116912002609-gr3_lrg.jpg?httpAccept=%2A%2F%2A",
            "@multimediatype": "JPEG image file",
            "@type": "IMAGE-HIGH-RES",
            "@size": "417292",
            "@ref": "gr3",
            "@mimetype": "image/jpeg"
          },
          {
            "@category": "standard",
            "@height": "239",
            "@width": "339",
            "@_fa": "true",
            "$": "https://api.elsevier.com/content/object/eid/1-s2.0-S1381116912002609-gr4.jpg?httpAccept=%2A%2F%2A",
            "@multimediatype": "JPEG image file",
            "@type": "IMAGE-DOWNSAMPLED",
            "@size": "22632",
            "@ref": "gr4",
            "@mimetype": "image/jpeg"
          },
          {
            "@category": "thumbnail",
            "@height": "154",
            "@width": "219",
            "@_fa": "true",
            "$": "https://api.elsevier.com/content/object/eid/1-s2.0-S1381116912002609-gr4.sml?httpAccept=%2A%2F%2A",
            "@multimediatype": "GIF image file",
            "@type": "IMAGE-THUMBNAIL",
            "@size": "5751",
            "@ref": "gr4",
            "@mimetype": "image/gif"
          },
          {
            "@category": "high",
            "@height": "1056",
            "@width": "1500",
            "@_fa": "true",
            "$": "https://api.elsevier.com/content/object/eid/1-s2.0-S1381116912002609-gr4_lrg.jpg?httpAccept=%2A%2F%2A",
            "@multimediatype": "JPEG image file",
            "@type": "IMAGE-HIGH-RES",
            "@size": "194464",
            "@ref": "gr4",
            "@mimetype": "image/jpeg"
          },
          {
            "@category": "standard",
            "@height": "239",
            "@width": "393",
            "@_fa": "true",
            "$": "https://api.elsevier.com/content/object/eid/1-s2.0-S1381116912002609-gr6.jpg?httpAccept=%2A%2F%2A",
            "@multimediatype": "JPEG image file",
            "@type": "IMAGE-DOWNSAMPLED",
            "@size": "35526",
            "@ref": "gr6",
            "@mimetype": "image/jpeg"
          },
          {
            "@category": "thumbnail",
            "@height": "133",
            "@width": "219",
            "@_fa": "true",
            "$": "https://api.elsevier.com/content/object/eid/1-s2.0-S1381116912002609-gr6.sml?httpAccept=%2A%2F%2A",
            "@multimediatype": "GIF image file",
            "@type": "IMAGE-THUMBNAIL",
            "@size": "4461",
            "@ref": "gr6",
            "@mimetype": "image/gif"
          },
          {
            "@category": "high",
            "@height": "1061",
            "@width": "1742",
            "@_fa": "true",
            "$": "https://api.elsevier.com/content/object/eid/1-s2.0-S1381116912002609-gr6_lrg.jpg?httpAccept=%2A%2F%2A",
            "@multimediatype": "JPEG image file",
            "@type": "IMAGE-HIGH-RES",
            "@size": "211182",
            "@ref": "gr6",
            "@mimetype": "image/jpeg"
          },
          {
            "@category": "standard",
            "@height": "292",
            "@width": "391",
            "@_fa": "true",
            "$": "https://api.elsevier.com/content/object/eid/1-s2.0-S1381116912002609-gr7.jpg?httpAccept=%2A%2F%2A",
            "@multimediatype": "JPEG image file",
            "@type": "IMAGE-DOWNSAMPLED",
            "@size": "40333",
            "@ref": "gr7",
            "@mimetype": "image/jpeg"
          },
          {
            "@category": "thumbnail",
            "@height": "164",
            "@width": "219",
            "@_fa": "true",
            "$": "https://api.elsevier.com/content/object/eid/1-s2.0-S1381116912002609-gr7.sml?httpAccept=%2A%2F%2A",
            "@multimediatype": "GIF image file",
            "@type": "IMAGE-THUMBNAIL",
            "@size": "7161",
            "@ref": "gr7",
            "@mimetype": "image/gif"
          },
          {
            "@category": "high",
            "@height": "1296",
            "@width": "1733",
            "@_fa": "true",
            "$": "https://api.elsevier.com/content/object/eid/1-s2.0-S1381116912002609-gr7_lrg.jpg?httpAccept=%2A%2F%2A",
            "@multimediatype": "JPEG image file",
            "@type": "IMAGE-HIGH-RES",
            "@size": "256752",
            "@ref": "gr7",
            "@mimetype": "image/jpeg"
          },
          {
            "@category": "standard",
            "@height": "264",
            "@width": "393",
            "@_fa": "true",
            "$": "https://api.elsevier.com/content/object/eid/1-s2.0-S1381116912002609-gr17.jpg?httpAccept=%2A%2F%2A",
            "@multimediatype": "JPEG image file",
            "@type": "IMAGE-DOWNSAMPLED",
            "@size": "19827",
            "@ref": "gr17",
            "@mimetype": "image/jpeg"
          },
          {
            "@category": "thumbnail",
            "@height": "147",
            "@width": "219",
            "@_fa": "true",
            "$": "https://api.elsevier.com/content/object/eid/1-s2.0-S1381116912002609-gr17.sml?httpAccept=%2A%2F%2A",
            "@multimediatype": "GIF image file",
            "@type": "IMAGE-THUMBNAIL",
            "@size": "3636",
            "@ref": "gr17",
            "@mimetype": "image/gif"
          },
          {
            "@category": "high",
            "@height": "1171",
            "@width": "1742",
            "@_fa": "true",
            "$": "https://api.elsevier.com/content/object/eid/1-s2.0-S1381116912002609-gr17_lrg.jpg?httpAccept=%2A%2F%2A",
            "@multimediatype": "JPEG image file",
            "@type": "IMAGE-HIGH-RES",
            "@size": "139410",
            "@ref": "gr17",
            "@mimetype": "image/jpeg"
          },
          {
            "@category": "standard",
            "@height": "245",
            "@width": "393",
            "@_fa": "true",
            "$": "https://api.elsevier.com/content/object/eid/1-s2.0-S1381116912002609-gr18.jpg?httpAccept=%2A%2F%2A",
            "@multimediatype": "JPEG image file",
            "@type": "IMAGE-DOWNSAMPLED",
            "@size": "27643",
            "@ref": "gr18",
            "@mimetype": "image/jpeg"
          },
          {
            "@category": "thumbnail",
            "@height": "136",
            "@width": "219",
            "@_fa": "true",
            "$": "https://api.elsevier.com/content/object/eid/1-s2.0-S1381116912002609-gr18.sml?httpAccept=%2A%2F%2A",
            "@multimediatype": "GIF image file",
            "@type": "IMAGE-THUMBNAIL",
            "@size": "4697",
            "@ref": "gr18",
            "@mimetype": "image/gif"
          },
          {
            "@category": "high",
            "@height": "1084",
            "@width": "1742",
            "@_fa": "true",
            "$": "https://api.elsevier.com/content/object/eid/1-s2.0-S1381116912002609-gr18_lrg.jpg?httpAccept=%2A%2F%2A",
            "@multimediatype": "JPEG image file",
            "@type": "IMAGE-HIGH-RES",
            "@size": "168138",
            "@ref": "gr18",
            "@mimetype": "image/jpeg"
          },
          {
            "@category": "standard",
            "@height": "200",
            "@width": "386",
            "@_fa": "true",
            "$": "https://api.elsevier.com/content/object/eid/1-s2.0-S1381116912002609-fx1.jpg?httpAccept=%2A%2F%2A",
            "@multimediatype": "JPEG image file",
            "@type": "IMAGE-DOWNSAMPLED",
            "@size": "13349",
            "@ref": "fx1",
            "@mimetype": "image/jpeg"
          },
          {
            "@category": "thumbnail",
            "@height": "113",
            "@width": "219",
            "@_fa": "true",
            "$": "https://api.elsevier.com/content/object/eid/1-s2.0-S1381116912002609-fx1.sml?httpAccept=%2A%2F%2A",
            "@multimediatype": "GIF image file",
            "@type": "IMAGE-THUMBNAIL",
            "@size": "3530",
            "@ref": "fx1",
            "@mimetype": "image/gif"
          },
          {
            "@category": "high",
            "@height": "886",
            "@width": "1710",
            "@_fa": "true",
            "$": "https://api.elsevier.com/content/object/eid/1-s2.0-S1381116912002609-fx1_lrg.jpg?httpAccept=%2A%2F%2A",
            "@multimediatype": "JPEG image file",
            "@type": "IMAGE-HIGH-RES",
            "@size": "113785",
            "@ref": "fx1",
            "@mimetype": "image/jpeg"
          }
        ]
      },
      "link": {
        "@rel": "abstract",
        "@href": "https://api.elsevier.com/content/abstract/scopus_id/84867577118"
      }
    }
  }
}