{
  "metadata": {
    "title": "Steady-state kinetics and mechanism of methane reforming with steam and carbon dioxide over Ni catalyst",
    "authors": "; ; ",
    "journal": "Journal of Molecular Catalysis A: Chemical",
    "date": "2010-01-15",
    "doi": "10.1016/j.molcata.2009.06.013",
    "abstract": "",
    "uri": "https://api.elsevier.com/content/article/pii/S1381116909002866",
    "pii": "S1381116909002866"
  },
  "fulltext": {
    "full-text-retrieval-response": {
      "scopus-eid": "2-s2.0-71649103299",
      "originalText": "serial JL 271358 291210 291744 291790 291809 31 Journal of Molecular Catalysis A: Chemical JOURNALMOLECULARCATALYSISACHEMICAL 2009-06-21 2009-06-21 2010-10-31T15:48:11 1-s2.0-S1381116909002866 S1381-1169(09)00286-6 S1381116909002866 10.1016/j.molcata.2009.06.013 S300 S300.1 FULL-TEXT 1-s2.0-S1381116909X0018X 2015-05-15T05:56:33.307883-04:00 0 0 20100115 2010 2009-06-21T00:00:00Z articleinfo crossmark dco dateupdated tomb dateloaded datesearch indexeddate issuelist volumelist yearnav absattachment articletitlenorm authfirstinitialnorm authfirstsurnamenorm cid cids confeditor contenttype copyright dateloadedtxt docsubtype doctype doi eid ewtransactionid hubeid issfirst issn issnnorm itemstage itemtransactionid itemweight openaccess openarchive pg pgfirst pglast pii piinorm pubdatestart pubdatetxt pubyr sectiontitle sortorder srctitle srctitlenorm srctype subheadings vol volfirst volissue webpdf webpdfpagecount figure table body mmlmath affil articletitle auth authfirstini authfull authkeywords authlast footnotes nomenclature primabst ref specialabst alllist content subj ssids 1381-1169 13811169 315 315 2 2 Volume 315, Issue 2 7 155 162 155 162 20100115 15 January 2010 2010-01-15 2010 In memory of M.I. Temkin Dmitry Yu. Murzin Special Issue section article fla Copyright © 2009 Elsevier B.V. All rights reserved. STEADYSTATEKINETICSMECHANISMMETHANEREFORMINGSTEAMCARBONDIOXIDEOVERNICATALYST AVETISOV A Nomenclature 1 Introduction 1.1 Temkin et al. model 1.2 Froment and Xu model 1.3 Aparicio model 2 Experimental 2.1 Methods of kinetic experiments 2.2 Model parameter fitting 3 Results and discussion 3.1 Results of experiments 3.2 Modified microkinetic model of methane steam and dry reforming 3.3 Analysis of pre-exponential factors 4 Conclusion References TEMKIN 1979 173 291 M TEMKIN 1950 763 766 M KHOMENKO 1971 423 431 A BODROV 1967 821 829 I AKRES 1955 471 482 W WEI 2004 370 383 J XU 1989 88 96 J APARICIO 1997 262 274 L ROSTRUPNIELSEN 1993 38 49 J ZYSKIN 2007 1 8 A TEMKIN 1938 141 161 M DUMESIC 1993 J MICROKINETICSHETEROGENEOUSCATALYSISACSPROFESSIONALREFERENCEBOOK TEMKIN 1934 36 52 M AVETISOVX2010X155 AVETISOVX2010X155X162 AVETISOVX2010X155XA AVETISOVX2010X155X162XA item S1381-1169(09)00286-6 S1381116909002866 1-s2.0-S1381116909002866 10.1016/j.molcata.2009.06.013 271358 2010-12-01T15:24:32.638193-05:00 2010-01-15 1-s2.0-S1381116909002866-main.pdf https://s3.amazonaws.com/prod-ucs-content-store-us-east/content/pii:S1381116909002866/MAIN/application/pdf/40590a6091da0f232bb14d3a836b374a/main.pdf https://s3-eu-west-1.amazonaws.com/prod-ucs-content-store-eu-west/content/pii:S1381116909002866/MAIN/application/pdf/40590a6091da0f232bb14d3a836b374a/main.pdf main.pdf pdf true 370285 MAIN 8 1-s2.0-S1381116909002866-main_1.png https://s3.amazonaws.com/prod-ucs-content-store-us-east/content/pii:S1381116909002866/PREVIEW/image/png/5155b5ad9bbb07d4ffcd416fb07eca64/main_1.png https://s3-eu-west-1.amazonaws.com/prod-ucs-content-store-eu-west/content/pii:S1381116909002866/PREVIEW/image/png/5155b5ad9bbb07d4ffcd416fb07eca64/main_1.png main_1.png png 80376 849 656 IMAGE-WEB-PDF 1 1-s2.0-S1381116909002866-si9.gif https://s3.amazonaws.com/prod-ucs-content-store-us-east/content/pii:S1381116909002866/STRIPIN/image/gif/de5b2a1c878a9ebde40782c472ee42d5/si9.gif https://s3-eu-west-1.amazonaws.com/prod-ucs-content-store-eu-west/content/pii:S1381116909002866/STRIPIN/image/gif/de5b2a1c878a9ebde40782c472ee42d5/si9.gif si9 si9.gif gif 830 16 231 ALTIMG 1-s2.0-S1381116909002866-si8.gif https://s3.amazonaws.com/prod-ucs-content-store-us-east/content/pii:S1381116909002866/STRIPIN/image/gif/ff28acdac29269a48b54e3c6c354aa40/si8.gif https://s3-eu-west-1.amazonaws.com/prod-ucs-content-store-eu-west/content/pii:S1381116909002866/STRIPIN/image/gif/ff28acdac29269a48b54e3c6c354aa40/si8.gif si8 si8.gif gif 703 16 185 ALTIMG 1-s2.0-S1381116909002866-si79.gif https://s3.amazonaws.com/prod-ucs-content-store-us-east/content/pii:S1381116909002866/STRIPIN/image/gif/87903267d3d81dfd41e2b799283c3eb9/si79.gif https://s3-eu-west-1.amazonaws.com/prod-ucs-content-store-eu-west/content/pii:S1381116909002866/STRIPIN/image/gif/87903267d3d81dfd41e2b799283c3eb9/si79.gif si79 si79.gif gif 304 15 66 ALTIMG 1-s2.0-S1381116909002866-si78.gif https://s3.amazonaws.com/prod-ucs-content-store-us-east/content/pii:S1381116909002866/STRIPIN/image/gif/a2be35ed3dc3fbb16173299695e4a6aa/si78.gif https://s3-eu-west-1.amazonaws.com/prod-ucs-content-store-eu-west/content/pii:S1381116909002866/STRIPIN/image/gif/a2be35ed3dc3fbb16173299695e4a6aa/si78.gif si78 si78.gif gif 446 23 97 ALTIMG 1-s2.0-S1381116909002866-si77.gif https://s3.amazonaws.com/prod-ucs-content-store-us-east/content/pii:S1381116909002866/STRIPIN/image/gif/88ed5185f8b25b00409f02d955a84264/si77.gif https://s3-eu-west-1.amazonaws.com/prod-ucs-content-store-eu-west/content/pii:S1381116909002866/STRIPIN/image/gif/88ed5185f8b25b00409f02d955a84264/si77.gif si77 si77.gif gif 459 22 99 ALTIMG 1-s2.0-S1381116909002866-si76.gif https://s3.amazonaws.com/prod-ucs-content-store-us-east/content/pii:S1381116909002866/STRIPIN/image/gif/0bb975dcb13f0c161c96de2bdc583952/si43.gif https://s3-eu-west-1.amazonaws.com/prod-ucs-content-store-eu-west/content/pii:S1381116909002866/STRIPIN/image/gif/0bb975dcb13f0c161c96de2bdc583952/si43.gif si76 si76.gif gif 216 16 31 ALTIMG 1-s2.0-S1381116909002866-si75.gif https://s3.amazonaws.com/prod-ucs-content-store-us-east/content/pii:S1381116909002866/STRIPIN/image/gif/1ada9d9b5323370f6189857115874922/si42.gif https://s3-eu-west-1.amazonaws.com/prod-ucs-content-store-eu-west/content/pii:S1381116909002866/STRIPIN/image/gif/1ada9d9b5323370f6189857115874922/si42.gif si75 si75.gif gif 231 20 31 ALTIMG 1-s2.0-S1381116909002866-si74.gif https://s3.amazonaws.com/prod-ucs-content-store-us-east/content/pii:S1381116909002866/STRIPIN/image/gif/996b641bd087c05613f22e9dc0e5a0c5/si74.gif https://s3-eu-west-1.amazonaws.com/prod-ucs-content-store-eu-west/content/pii:S1381116909002866/STRIPIN/image/gif/996b641bd087c05613f22e9dc0e5a0c5/si74.gif si74 si74.gif gif 520 20 134 ALTIMG 1-s2.0-S1381116909002866-si73.gif https://s3.amazonaws.com/prod-ucs-content-store-us-east/content/pii:S1381116909002866/STRIPIN/image/gif/91612737f04e6b9b03e5a48e3a635b15/si73.gif https://s3-eu-west-1.amazonaws.com/prod-ucs-content-store-eu-west/content/pii:S1381116909002866/STRIPIN/image/gif/91612737f04e6b9b03e5a48e3a635b15/si73.gif si73 si73.gif gif 1699 22 542 ALTIMG 1-s2.0-S1381116909002866-si72.gif https://s3.amazonaws.com/prod-ucs-content-store-us-east/content/pii:S1381116909002866/STRIPIN/image/gif/4a003c5bf21af59502797814a123a663/si72.gif https://s3-eu-west-1.amazonaws.com/prod-ucs-content-store-eu-west/content/pii:S1381116909002866/STRIPIN/image/gif/4a003c5bf21af59502797814a123a663/si72.gif si72 si72.gif gif 349 20 66 ALTIMG 1-s2.0-S1381116909002866-si71.gif https://s3.amazonaws.com/prod-ucs-content-store-us-east/content/pii:S1381116909002866/STRIPIN/image/gif/3216741157099142501cc67cf0b3e023/si71.gif https://s3-eu-west-1.amazonaws.com/prod-ucs-content-store-eu-west/content/pii:S1381116909002866/STRIPIN/image/gif/3216741157099142501cc67cf0b3e023/si71.gif si71 si71.gif gif 910 20 294 ALTIMG 1-s2.0-S1381116909002866-si70.gif https://s3.amazonaws.com/prod-ucs-content-store-us-east/content/pii:S1381116909002866/STRIPIN/image/gif/c2911aff0c18fabf7b038b7f4d9e9eb1/si70.gif https://s3-eu-west-1.amazonaws.com/prod-ucs-content-store-eu-west/content/pii:S1381116909002866/STRIPIN/image/gif/c2911aff0c18fabf7b038b7f4d9e9eb1/si70.gif si70 si70.gif gif 206 20 20 ALTIMG 1-s2.0-S1381116909002866-si7.gif https://s3.amazonaws.com/prod-ucs-content-store-us-east/content/pii:S1381116909002866/STRIPIN/image/gif/15ea92452170511e6256a6d5af48ceb6/si7.gif https://s3-eu-west-1.amazonaws.com/prod-ucs-content-store-eu-west/content/pii:S1381116909002866/STRIPIN/image/gif/15ea92452170511e6256a6d5af48ceb6/si7.gif si7 si7.gif gif 124 11 17 ALTIMG 1-s2.0-S1381116909002866-si69.gif https://s3.amazonaws.com/prod-ucs-content-store-us-east/content/pii:S1381116909002866/STRIPIN/image/gif/4d91f3592a649e03e14940a6f7ec5fd4/si69.gif https://s3-eu-west-1.amazonaws.com/prod-ucs-content-store-eu-west/content/pii:S1381116909002866/STRIPIN/image/gif/4d91f3592a649e03e14940a6f7ec5fd4/si69.gif si69 si69.gif gif 891 20 277 ALTIMG 1-s2.0-S1381116909002866-si68.gif https://s3.amazonaws.com/prod-ucs-content-store-us-east/content/pii:S1381116909002866/STRIPIN/image/gif/efaa23de63f7b080f56e27140670a564/si68.gif https://s3-eu-west-1.amazonaws.com/prod-ucs-content-store-eu-west/content/pii:S1381116909002866/STRIPIN/image/gif/efaa23de63f7b080f56e27140670a564/si68.gif si68 si68.gif gif 539 20 142 ALTIMG 1-s2.0-S1381116909002866-si67.gif https://s3.amazonaws.com/prod-ucs-content-store-us-east/content/pii:S1381116909002866/STRIPIN/image/gif/5cb635034e0202735ca0ffff5b8ba968/si67.gif https://s3-eu-west-1.amazonaws.com/prod-ucs-content-store-eu-west/content/pii:S1381116909002866/STRIPIN/image/gif/5cb635034e0202735ca0ffff5b8ba968/si67.gif si67 si67.gif gif 343 20 67 ALTIMG 1-s2.0-S1381116909002866-si66.gif https://s3.amazonaws.com/prod-ucs-content-store-us-east/content/pii:S1381116909002866/STRIPIN/image/gif/1ef45d15d82913e18b72eb72e4f11ac3/si66.gif https://s3-eu-west-1.amazonaws.com/prod-ucs-content-store-eu-west/content/pii:S1381116909002866/STRIPIN/image/gif/1ef45d15d82913e18b72eb72e4f11ac3/si66.gif si66 si66.gif gif 389 20 86 ALTIMG 1-s2.0-S1381116909002866-si65.gif https://s3.amazonaws.com/prod-ucs-content-store-us-east/content/pii:S1381116909002866/STRIPIN/image/gif/e6a6841772ccccaff2f52a41d80cdef6/si65.gif https://s3-eu-west-1.amazonaws.com/prod-ucs-content-store-eu-west/content/pii:S1381116909002866/STRIPIN/image/gif/e6a6841772ccccaff2f52a41d80cdef6/si65.gif si65 si65.gif gif 624 22 164 ALTIMG 1-s2.0-S1381116909002866-si64.gif https://s3.amazonaws.com/prod-ucs-content-store-us-east/content/pii:S1381116909002866/STRIPIN/image/gif/ee8fcb678964d1a6be1a444907270ae9/si64.gif https://s3-eu-west-1.amazonaws.com/prod-ucs-content-store-eu-west/content/pii:S1381116909002866/STRIPIN/image/gif/ee8fcb678964d1a6be1a444907270ae9/si64.gif si64 si64.gif gif 504 20 135 ALTIMG 1-s2.0-S1381116909002866-si63.gif https://s3.amazonaws.com/prod-ucs-content-store-us-east/content/pii:S1381116909002866/STRIPIN/image/gif/e302f7041b7e8b4bf9fdd3afe385bcff/si63.gif https://s3-eu-west-1.amazonaws.com/prod-ucs-content-store-eu-west/content/pii:S1381116909002866/STRIPIN/image/gif/e302f7041b7e8b4bf9fdd3afe385bcff/si63.gif si63 si63.gif gif 550 20 151 ALTIMG 1-s2.0-S1381116909002866-si62.gif https://s3.amazonaws.com/prod-ucs-content-store-us-east/content/pii:S1381116909002866/STRIPIN/image/gif/9577b0d6ca35707e85459baa4c996aa0/si62.gif https://s3-eu-west-1.amazonaws.com/prod-ucs-content-store-eu-west/content/pii:S1381116909002866/STRIPIN/image/gif/9577b0d6ca35707e85459baa4c996aa0/si62.gif si62 si62.gif gif 630 22 164 ALTIMG 1-s2.0-S1381116909002866-si61.gif https://s3.amazonaws.com/prod-ucs-content-store-us-east/content/pii:S1381116909002866/STRIPIN/image/gif/b136795f929faa45d9e593c73a832acb/si61.gif https://s3-eu-west-1.amazonaws.com/prod-ucs-content-store-eu-west/content/pii:S1381116909002866/STRIPIN/image/gif/b136795f929faa45d9e593c73a832acb/si61.gif si61 si61.gif gif 203 20 20 ALTIMG 1-s2.0-S1381116909002866-si60.gif https://s3.amazonaws.com/prod-ucs-content-store-us-east/content/pii:S1381116909002866/STRIPIN/image/gif/03162e8d3d04d897266970729edcedd1/si60.gif https://s3-eu-west-1.amazonaws.com/prod-ucs-content-store-eu-west/content/pii:S1381116909002866/STRIPIN/image/gif/03162e8d3d04d897266970729edcedd1/si60.gif si60 si60.gif gif 219 20 35 ALTIMG 1-s2.0-S1381116909002866-si6.gif https://s3.amazonaws.com/prod-ucs-content-store-us-east/content/pii:S1381116909002866/STRIPIN/image/gif/a3427ee0f97ced07f302b79a8bcfe742/si6.gif https://s3-eu-west-1.amazonaws.com/prod-ucs-content-store-eu-west/content/pii:S1381116909002866/STRIPIN/image/gif/a3427ee0f97ced07f302b79a8bcfe742/si6.gif si6 si6.gif gif 364 20 80 ALTIMG 1-s2.0-S1381116909002866-si59.gif https://s3.amazonaws.com/prod-ucs-content-store-us-east/content/pii:S1381116909002866/STRIPIN/image/gif/595543f3c882c91f2c532b85cd1be325/si59.gif https://s3-eu-west-1.amazonaws.com/prod-ucs-content-store-eu-west/content/pii:S1381116909002866/STRIPIN/image/gif/595543f3c882c91f2c532b85cd1be325/si59.gif si59 si59.gif gif 269 22 36 ALTIMG 1-s2.0-S1381116909002866-si58.gif https://s3.amazonaws.com/prod-ucs-content-store-us-east/content/pii:S1381116909002866/STRIPIN/image/gif/66c6a157166154c5a50205891bc6c55f/si58.gif https://s3-eu-west-1.amazonaws.com/prod-ucs-content-store-eu-west/content/pii:S1381116909002866/STRIPIN/image/gif/66c6a157166154c5a50205891bc6c55f/si58.gif si58 si58.gif gif 249 20 31 ALTIMG 1-s2.0-S1381116909002866-si57.gif https://s3.amazonaws.com/prod-ucs-content-store-us-east/content/pii:S1381116909002866/STRIPIN/image/gif/fcc92e1c73ea007e497cd41642307594/si57.gif https://s3-eu-west-1.amazonaws.com/prod-ucs-content-store-eu-west/content/pii:S1381116909002866/STRIPIN/image/gif/fcc92e1c73ea007e497cd41642307594/si57.gif si57 si57.gif gif 521 20 134 ALTIMG 1-s2.0-S1381116909002866-si56.gif https://s3.amazonaws.com/prod-ucs-content-store-us-east/content/pii:S1381116909002866/STRIPIN/image/gif/be7cefaa13835c5214ca5f47278f5eba/si56.gif https://s3-eu-west-1.amazonaws.com/prod-ucs-content-store-eu-west/content/pii:S1381116909002866/STRIPIN/image/gif/be7cefaa13835c5214ca5f47278f5eba/si56.gif si56 si56.gif gif 542 35 116 ALTIMG 1-s2.0-S1381116909002866-si55.gif https://s3.amazonaws.com/prod-ucs-content-store-us-east/content/pii:S1381116909002866/STRIPIN/image/gif/c577afa2af9d1f1eb588e9e0ba1778b2/si55.gif https://s3-eu-west-1.amazonaws.com/prod-ucs-content-store-eu-west/content/pii:S1381116909002866/STRIPIN/image/gif/c577afa2af9d1f1eb588e9e0ba1778b2/si55.gif si55 si55.gif gif 324 20 58 ALTIMG 1-s2.0-S1381116909002866-si54.gif https://s3.amazonaws.com/prod-ucs-content-store-us-east/content/pii:S1381116909002866/STRIPIN/image/gif/4eb5364b406ed00eb5d0c0c4cb68e0ca/si54.gif https://s3-eu-west-1.amazonaws.com/prod-ucs-content-store-eu-west/content/pii:S1381116909002866/STRIPIN/image/gif/4eb5364b406ed00eb5d0c0c4cb68e0ca/si54.gif si54 si54.gif gif 337 20 67 ALTIMG 1-s2.0-S1381116909002866-si53.gif https://s3.amazonaws.com/prod-ucs-content-store-us-east/content/pii:S1381116909002866/STRIPIN/image/gif/a938f2ce2b59aa5c80c0d489360b5114/si53.gif https://s3-eu-west-1.amazonaws.com/prod-ucs-content-store-eu-west/content/pii:S1381116909002866/STRIPIN/image/gif/a938f2ce2b59aa5c80c0d489360b5114/si53.gif si53 si53.gif gif 1718 19 686 ALTIMG 1-s2.0-S1381116909002866-si52.gif https://s3.amazonaws.com/prod-ucs-content-store-us-east/content/pii:S1381116909002866/STRIPIN/image/gif/e6a15a5f6630fbaf7002fd847f018709/si52.gif https://s3-eu-west-1.amazonaws.com/prod-ucs-content-store-eu-west/content/pii:S1381116909002866/STRIPIN/image/gif/e6a15a5f6630fbaf7002fd847f018709/si52.gif si52 si52.gif gif 644 37 163 ALTIMG 1-s2.0-S1381116909002866-si51.gif https://s3.amazonaws.com/prod-ucs-content-store-us-east/content/pii:S1381116909002866/STRIPIN/image/gif/dd22bf02038ad57b91945085832bbde8/si47.gif https://s3-eu-west-1.amazonaws.com/prod-ucs-content-store-eu-west/content/pii:S1381116909002866/STRIPIN/image/gif/dd22bf02038ad57b91945085832bbde8/si47.gif si51 si51.gif gif 218 15 36 ALTIMG 1-s2.0-S1381116909002866-si50.gif https://s3.amazonaws.com/prod-ucs-content-store-us-east/content/pii:S1381116909002866/STRIPIN/image/gif/eafc00f425df48cecda546573de27d3a/si50.gif https://s3-eu-west-1.amazonaws.com/prod-ucs-content-store-eu-west/content/pii:S1381116909002866/STRIPIN/image/gif/eafc00f425df48cecda546573de27d3a/si50.gif si50 si50.gif gif 383 20 71 ALTIMG 1-s2.0-S1381116909002866-si5.gif https://s3.amazonaws.com/prod-ucs-content-store-us-east/content/pii:S1381116909002866/STRIPIN/image/gif/e073bcfbe36b4d00a5e1affcea0ade7c/si2.gif https://s3-eu-west-1.amazonaws.com/prod-ucs-content-store-eu-west/content/pii:S1381116909002866/STRIPIN/image/gif/e073bcfbe36b4d00a5e1affcea0ade7c/si2.gif si5 si5.gif gif 287 16 58 ALTIMG 1-s2.0-S1381116909002866-si49.gif https://s3.amazonaws.com/prod-ucs-content-store-us-east/content/pii:S1381116909002866/STRIPIN/image/gif/b69dbbf82de1cc8fd13f779f52e76fb3/si49.gif https://s3-eu-west-1.amazonaws.com/prod-ucs-content-store-eu-west/content/pii:S1381116909002866/STRIPIN/image/gif/b69dbbf82de1cc8fd13f779f52e76fb3/si49.gif si49 si49.gif gif 719 16 206 ALTIMG 1-s2.0-S1381116909002866-si48.gif https://s3.amazonaws.com/prod-ucs-content-store-us-east/content/pii:S1381116909002866/STRIPIN/image/gif/dd22bf02038ad57b91945085832bbde8/si47.gif https://s3-eu-west-1.amazonaws.com/prod-ucs-content-store-eu-west/content/pii:S1381116909002866/STRIPIN/image/gif/dd22bf02038ad57b91945085832bbde8/si47.gif si48 si48.gif gif 218 15 36 ALTIMG 1-s2.0-S1381116909002866-si47.gif https://s3.amazonaws.com/prod-ucs-content-store-us-east/content/pii:S1381116909002866/STRIPIN/image/gif/dd22bf02038ad57b91945085832bbde8/si47.gif https://s3-eu-west-1.amazonaws.com/prod-ucs-content-store-eu-west/content/pii:S1381116909002866/STRIPIN/image/gif/dd22bf02038ad57b91945085832bbde8/si47.gif si47 si47.gif gif 218 15 36 ALTIMG 1-s2.0-S1381116909002866-si46.gif https://s3.amazonaws.com/prod-ucs-content-store-us-east/content/pii:S1381116909002866/STRIPIN/image/gif/e822557d3751eb4aa7ead270107c502b/si46.gif https://s3-eu-west-1.amazonaws.com/prod-ucs-content-store-eu-west/content/pii:S1381116909002866/STRIPIN/image/gif/e822557d3751eb4aa7ead270107c502b/si46.gif si46 si46.gif gif 400 20 76 ALTIMG 1-s2.0-S1381116909002866-si45.gif https://s3.amazonaws.com/prod-ucs-content-store-us-east/content/pii:S1381116909002866/STRIPIN/image/gif/fcaadad23e6f06b129a1b302b97c4cd2/si45.gif https://s3-eu-west-1.amazonaws.com/prod-ucs-content-store-eu-west/content/pii:S1381116909002866/STRIPIN/image/gif/fcaadad23e6f06b129a1b302b97c4cd2/si45.gif si45 si45.gif gif 605 24 119 ALTIMG 1-s2.0-S1381116909002866-si44.gif https://s3.amazonaws.com/prod-ucs-content-store-us-east/content/pii:S1381116909002866/STRIPIN/image/gif/4b275f6c22aa9dc4e1fd0d0b8743fba7/si44.gif https://s3-eu-west-1.amazonaws.com/prod-ucs-content-store-eu-west/content/pii:S1381116909002866/STRIPIN/image/gif/4b275f6c22aa9dc4e1fd0d0b8743fba7/si44.gif si44 si44.gif gif 489 24 84 ALTIMG 1-s2.0-S1381116909002866-si43.gif https://s3.amazonaws.com/prod-ucs-content-store-us-east/content/pii:S1381116909002866/STRIPIN/image/gif/0bb975dcb13f0c161c96de2bdc583952/si43.gif https://s3-eu-west-1.amazonaws.com/prod-ucs-content-store-eu-west/content/pii:S1381116909002866/STRIPIN/image/gif/0bb975dcb13f0c161c96de2bdc583952/si43.gif si43 si43.gif gif 216 16 31 ALTIMG 1-s2.0-S1381116909002866-si42.gif https://s3.amazonaws.com/prod-ucs-content-store-us-east/content/pii:S1381116909002866/STRIPIN/image/gif/1ada9d9b5323370f6189857115874922/si42.gif https://s3-eu-west-1.amazonaws.com/prod-ucs-content-store-eu-west/content/pii:S1381116909002866/STRIPIN/image/gif/1ada9d9b5323370f6189857115874922/si42.gif si42 si42.gif gif 231 20 31 ALTIMG 1-s2.0-S1381116909002866-si41.gif https://s3.amazonaws.com/prod-ucs-content-store-us-east/content/pii:S1381116909002866/STRIPIN/image/gif/c3442ae2d180de3a9b0310e63a861549/si41.gif https://s3-eu-west-1.amazonaws.com/prod-ucs-content-store-eu-west/content/pii:S1381116909002866/STRIPIN/image/gif/c3442ae2d180de3a9b0310e63a861549/si41.gif si41 si41.gif gif 601 16 152 ALTIMG 1-s2.0-S1381116909002866-si40.gif https://s3.amazonaws.com/prod-ucs-content-store-us-east/content/pii:S1381116909002866/STRIPIN/image/gif/f02a58f5897fbf5db87bc292c4614b9c/si40.gif https://s3-eu-west-1.amazonaws.com/prod-ucs-content-store-eu-west/content/pii:S1381116909002866/STRIPIN/image/gif/f02a58f5897fbf5db87bc292c4614b9c/si40.gif si40 si40.gif gif 669 20 161 ALTIMG 1-s2.0-S1381116909002866-si4.gif https://s3.amazonaws.com/prod-ucs-content-store-us-east/content/pii:S1381116909002866/STRIPIN/image/gif/e073bcfbe36b4d00a5e1affcea0ade7c/si2.gif https://s3-eu-west-1.amazonaws.com/prod-ucs-content-store-eu-west/content/pii:S1381116909002866/STRIPIN/image/gif/e073bcfbe36b4d00a5e1affcea0ade7c/si2.gif si4 si4.gif gif 287 16 58 ALTIMG 1-s2.0-S1381116909002866-si39.gif https://s3.amazonaws.com/prod-ucs-content-store-us-east/content/pii:S1381116909002866/STRIPIN/image/gif/3e72512a60b362c8ac23efa3b73f57bc/si39.gif https://s3-eu-west-1.amazonaws.com/prod-ucs-content-store-eu-west/content/pii:S1381116909002866/STRIPIN/image/gif/3e72512a60b362c8ac23efa3b73f57bc/si39.gif si39 si39.gif gif 424 16 100 ALTIMG 1-s2.0-S1381116909002866-si38.gif https://s3.amazonaws.com/prod-ucs-content-store-us-east/content/pii:S1381116909002866/STRIPIN/image/gif/55a0758d876b9163b4f6598d244d3791/si38.gif https://s3-eu-west-1.amazonaws.com/prod-ucs-content-store-eu-west/content/pii:S1381116909002866/STRIPIN/image/gif/55a0758d876b9163b4f6598d244d3791/si38.gif si38 si38.gif gif 3570 103 407 ALTIMG 1-s2.0-S1381116909002866-si37.gif https://s3.amazonaws.com/prod-ucs-content-store-us-east/content/pii:S1381116909002866/STRIPIN/image/gif/c39c0ffb8faf70556b303e99d86b44f6/si37.gif https://s3-eu-west-1.amazonaws.com/prod-ucs-content-store-eu-west/content/pii:S1381116909002866/STRIPIN/image/gif/c39c0ffb8faf70556b303e99d86b44f6/si37.gif si37 si37.gif gif 3643 91 483 ALTIMG 1-s2.0-S1381116909002866-si36.gif https://s3.amazonaws.com/prod-ucs-content-store-us-east/content/pii:S1381116909002866/STRIPIN/image/gif/9c890cf31a77f0a30b95608f58052e8b/si36.gif https://s3-eu-west-1.amazonaws.com/prod-ucs-content-store-eu-west/content/pii:S1381116909002866/STRIPIN/image/gif/9c890cf31a77f0a30b95608f58052e8b/si36.gif si36 si36.gif gif 3330 50 488 ALTIMG 1-s2.0-S1381116909002866-si35.gif https://s3.amazonaws.com/prod-ucs-content-store-us-east/content/pii:S1381116909002866/STRIPIN/image/gif/172ba0551e457e0a33cadab638718446/si35.gif https://s3-eu-west-1.amazonaws.com/prod-ucs-content-store-eu-west/content/pii:S1381116909002866/STRIPIN/image/gif/172ba0551e457e0a33cadab638718446/si35.gif si35 si35.gif gif 1476 44 418 ALTIMG 1-s2.0-S1381116909002866-si34.gif https://s3.amazonaws.com/prod-ucs-content-store-us-east/content/pii:S1381116909002866/STRIPIN/image/gif/9913fd06f724434c2720024c809f9ad7/si34.gif https://s3-eu-west-1.amazonaws.com/prod-ucs-content-store-eu-west/content/pii:S1381116909002866/STRIPIN/image/gif/9913fd06f724434c2720024c809f9ad7/si34.gif si34 si34.gif gif 2857 103 300 ALTIMG 1-s2.0-S1381116909002866-si33.gif https://s3.amazonaws.com/prod-ucs-content-store-us-east/content/pii:S1381116909002866/STRIPIN/image/gif/c601aab1e463cb8cc76e72cebc0d1970/si33.gif https://s3-eu-west-1.amazonaws.com/prod-ucs-content-store-eu-west/content/pii:S1381116909002866/STRIPIN/image/gif/c601aab1e463cb8cc76e72cebc0d1970/si33.gif si33 si33.gif gif 2278 44 371 ALTIMG 1-s2.0-S1381116909002866-si32.gif https://s3.amazonaws.com/prod-ucs-content-store-us-east/content/pii:S1381116909002866/STRIPIN/image/gif/e3f66c8c52c1c665a435767578b5648e/si32.gif https://s3-eu-west-1.amazonaws.com/prod-ucs-content-store-eu-west/content/pii:S1381116909002866/STRIPIN/image/gif/e3f66c8c52c1c665a435767578b5648e/si32.gif si32 si32.gif gif 2743 88 437 ALTIMG 1-s2.0-S1381116909002866-si31.gif https://s3.amazonaws.com/prod-ucs-content-store-us-east/content/pii:S1381116909002866/STRIPIN/image/gif/4dc21bc238acafd77e1b56b002a7060e/si31.gif https://s3-eu-west-1.amazonaws.com/prod-ucs-content-store-eu-west/content/pii:S1381116909002866/STRIPIN/image/gif/4dc21bc238acafd77e1b56b002a7060e/si31.gif si31 si31.gif gif 2583 102 372 ALTIMG 1-s2.0-S1381116909002866-si30.gif https://s3.amazonaws.com/prod-ucs-content-store-us-east/content/pii:S1381116909002866/STRIPIN/image/gif/66b022d6d44063f9d5fc43eae5f74cbd/si30.gif https://s3-eu-west-1.amazonaws.com/prod-ucs-content-store-eu-west/content/pii:S1381116909002866/STRIPIN/image/gif/66b022d6d44063f9d5fc43eae5f74cbd/si30.gif si30 si30.gif gif 2006 40 475 ALTIMG 1-s2.0-S1381116909002866-si3.gif https://s3.amazonaws.com/prod-ucs-content-store-us-east/content/pii:S1381116909002866/STRIPIN/image/gif/e073bcfbe36b4d00a5e1affcea0ade7c/si2.gif https://s3-eu-west-1.amazonaws.com/prod-ucs-content-store-eu-west/content/pii:S1381116909002866/STRIPIN/image/gif/e073bcfbe36b4d00a5e1affcea0ade7c/si2.gif si3 si3.gif gif 287 16 58 ALTIMG 1-s2.0-S1381116909002866-si29.gif https://s3.amazonaws.com/prod-ucs-content-store-us-east/content/pii:S1381116909002866/STRIPIN/image/gif/be34fc356ee5d19d463b222526e51f09/si29.gif https://s3-eu-west-1.amazonaws.com/prod-ucs-content-store-eu-west/content/pii:S1381116909002866/STRIPIN/image/gif/be34fc356ee5d19d463b222526e51f09/si29.gif si29 si29.gif gif 1501 39 324 ALTIMG 1-s2.0-S1381116909002866-si28.gif https://s3.amazonaws.com/prod-ucs-content-store-us-east/content/pii:S1381116909002866/STRIPIN/image/gif/cfaffc34c56d13d52c413c68209868e8/si28.gif https://s3-eu-west-1.amazonaws.com/prod-ucs-content-store-eu-west/content/pii:S1381116909002866/STRIPIN/image/gif/cfaffc34c56d13d52c413c68209868e8/si28.gif si28 si28.gif gif 992 37 281 ALTIMG 1-s2.0-S1381116909002866-si27.gif https://s3.amazonaws.com/prod-ucs-content-store-us-east/content/pii:S1381116909002866/STRIPIN/image/gif/18f21717344d585f3f19293b36a683e2/si26.gif https://s3-eu-west-1.amazonaws.com/prod-ucs-content-store-eu-west/content/pii:S1381116909002866/STRIPIN/image/gif/18f21717344d585f3f19293b36a683e2/si26.gif si27 si27.gif gif 217 15 36 ALTIMG 1-s2.0-S1381116909002866-si26.gif https://s3.amazonaws.com/prod-ucs-content-store-us-east/content/pii:S1381116909002866/STRIPIN/image/gif/18f21717344d585f3f19293b36a683e2/si26.gif https://s3-eu-west-1.amazonaws.com/prod-ucs-content-store-eu-west/content/pii:S1381116909002866/STRIPIN/image/gif/18f21717344d585f3f19293b36a683e2/si26.gif si26 si26.gif gif 217 15 36 ALTIMG 1-s2.0-S1381116909002866-si25.gif https://s3.amazonaws.com/prod-ucs-content-store-us-east/content/pii:S1381116909002866/STRIPIN/image/gif/6d3f00d46a083440bdb103297e5c3e60/si25.gif https://s3-eu-west-1.amazonaws.com/prod-ucs-content-store-eu-west/content/pii:S1381116909002866/STRIPIN/image/gif/6d3f00d46a083440bdb103297e5c3e60/si25.gif si25 si25.gif gif 265 22 37 ALTIMG 1-s2.0-S1381116909002866-si24.gif https://s3.amazonaws.com/prod-ucs-content-store-us-east/content/pii:S1381116909002866/STRIPIN/image/gif/60e7fd6349c434be4b8c4b0a9e26bef6/si24.gif https://s3-eu-west-1.amazonaws.com/prod-ucs-content-store-eu-west/content/pii:S1381116909002866/STRIPIN/image/gif/60e7fd6349c434be4b8c4b0a9e26bef6/si24.gif si24 si24.gif gif 1577 38 432 ALTIMG 1-s2.0-S1381116909002866-si23.gif https://s3.amazonaws.com/prod-ucs-content-store-us-east/content/pii:S1381116909002866/STRIPIN/image/gif/b25568a9d3ba9706b44f2539b9d92dfb/si23.gif https://s3-eu-west-1.amazonaws.com/prod-ucs-content-store-eu-west/content/pii:S1381116909002866/STRIPIN/image/gif/b25568a9d3ba9706b44f2539b9d92dfb/si23.gif si23 si23.gif gif 399 20 127 ALTIMG 1-s2.0-S1381116909002866-si22.gif https://s3.amazonaws.com/prod-ucs-content-store-us-east/content/pii:S1381116909002866/STRIPIN/image/gif/623e262f67dc8b3ea8eefb700dfb0359/si22.gif https://s3-eu-west-1.amazonaws.com/prod-ucs-content-store-eu-west/content/pii:S1381116909002866/STRIPIN/image/gif/623e262f67dc8b3ea8eefb700dfb0359/si22.gif si22 si22.gif gif 869 21 244 ALTIMG 1-s2.0-S1381116909002866-si21.gif https://s3.amazonaws.com/prod-ucs-content-store-us-east/content/pii:S1381116909002866/STRIPIN/image/gif/cadaaa3c379b474b7266cb3cfdcd8388/si21.gif https://s3-eu-west-1.amazonaws.com/prod-ucs-content-store-eu-west/content/pii:S1381116909002866/STRIPIN/image/gif/cadaaa3c379b474b7266cb3cfdcd8388/si21.gif si21 si21.gif gif 1255 50 227 ALTIMG 1-s2.0-S1381116909002866-si20.gif https://s3.amazonaws.com/prod-ucs-content-store-us-east/content/pii:S1381116909002866/STRIPIN/image/gif/58ad0d380706faf0948f346ac0dc7b39/si20.gif https://s3-eu-west-1.amazonaws.com/prod-ucs-content-store-eu-west/content/pii:S1381116909002866/STRIPIN/image/gif/58ad0d380706faf0948f346ac0dc7b39/si20.gif si20 si20.gif gif 1086 42 221 ALTIMG 1-s2.0-S1381116909002866-si2.gif https://s3.amazonaws.com/prod-ucs-content-store-us-east/content/pii:S1381116909002866/STRIPIN/image/gif/e073bcfbe36b4d00a5e1affcea0ade7c/si2.gif https://s3-eu-west-1.amazonaws.com/prod-ucs-content-store-eu-west/content/pii:S1381116909002866/STRIPIN/image/gif/e073bcfbe36b4d00a5e1affcea0ade7c/si2.gif si2 si2.gif gif 287 16 58 ALTIMG 1-s2.0-S1381116909002866-si19.gif https://s3.amazonaws.com/prod-ucs-content-store-us-east/content/pii:S1381116909002866/STRIPIN/image/gif/82cca8ac350bd8ee46414ba0df728e77/si19.gif https://s3-eu-west-1.amazonaws.com/prod-ucs-content-store-eu-west/content/pii:S1381116909002866/STRIPIN/image/gif/82cca8ac350bd8ee46414ba0df728e77/si19.gif si19 si19.gif gif 1201 48 227 ALTIMG 1-s2.0-S1381116909002866-si18.gif https://s3.amazonaws.com/prod-ucs-content-store-us-east/content/pii:S1381116909002866/STRIPIN/image/gif/bcf560c4f10576fca0b7f545cac83bfd/si18.gif https://s3-eu-west-1.amazonaws.com/prod-ucs-content-store-eu-west/content/pii:S1381116909002866/STRIPIN/image/gif/bcf560c4f10576fca0b7f545cac83bfd/si18.gif si18 si18.gif gif 833 21 210 ALTIMG 1-s2.0-S1381116909002866-si17.gif https://s3.amazonaws.com/prod-ucs-content-store-us-east/content/pii:S1381116909002866/STRIPIN/image/gif/b7857d2ee60769dc10789d881388d289/si17.gif https://s3-eu-west-1.amazonaws.com/prod-ucs-content-store-eu-west/content/pii:S1381116909002866/STRIPIN/image/gif/b7857d2ee60769dc10789d881388d289/si17.gif si17 si17.gif gif 541 17 148 ALTIMG 1-s2.0-S1381116909002866-si16.gif https://s3.amazonaws.com/prod-ucs-content-store-us-east/content/pii:S1381116909002866/STRIPIN/image/gif/43339fa4e628800f60dc77c727cc16d9/si16.gif https://s3-eu-west-1.amazonaws.com/prod-ucs-content-store-eu-west/content/pii:S1381116909002866/STRIPIN/image/gif/43339fa4e628800f60dc77c727cc16d9/si16.gif si16 si16.gif gif 405 15 87 ALTIMG 1-s2.0-S1381116909002866-si15.gif https://s3.amazonaws.com/prod-ucs-content-store-us-east/content/pii:S1381116909002866/STRIPIN/image/gif/b4ab16a857e6e6a47916c60303909c7c/si15.gif https://s3-eu-west-1.amazonaws.com/prod-ucs-content-store-eu-west/content/pii:S1381116909002866/STRIPIN/image/gif/b4ab16a857e6e6a47916c60303909c7c/si15.gif si15 si15.gif gif 274 16 46 ALTIMG 1-s2.0-S1381116909002866-si14.gif https://s3.amazonaws.com/prod-ucs-content-store-us-east/content/pii:S1381116909002866/STRIPIN/image/gif/07d539045cbaefcf8f56e2cdc9938d04/si14.gif https://s3-eu-west-1.amazonaws.com/prod-ucs-content-store-eu-west/content/pii:S1381116909002866/STRIPIN/image/gif/07d539045cbaefcf8f56e2cdc9938d04/si14.gif si14 si14.gif gif 2320 43 474 ALTIMG 1-s2.0-S1381116909002866-si13.gif https://s3.amazonaws.com/prod-ucs-content-store-us-east/content/pii:S1381116909002866/STRIPIN/image/gif/76cfa3271bdfe72f899dc5d3cd5e5ca1/si13.gif https://s3-eu-west-1.amazonaws.com/prod-ucs-content-store-eu-west/content/pii:S1381116909002866/STRIPIN/image/gif/76cfa3271bdfe72f899dc5d3cd5e5ca1/si13.gif si13 si13.gif gif 623 16 167 ALTIMG 1-s2.0-S1381116909002866-si12.gif https://s3.amazonaws.com/prod-ucs-content-store-us-east/content/pii:S1381116909002866/STRIPIN/image/gif/aa87e1b77d976de99e512f49ec57a1d8/si12.gif https://s3-eu-west-1.amazonaws.com/prod-ucs-content-store-eu-west/content/pii:S1381116909002866/STRIPIN/image/gif/aa87e1b77d976de99e512f49ec57a1d8/si12.gif si12 si12.gif gif 619 16 164 ALTIMG 1-s2.0-S1381116909002866-si11.gif https://s3.amazonaws.com/prod-ucs-content-store-us-east/content/pii:S1381116909002866/STRIPIN/image/gif/beb91a29bdb2f4f4c3e51d299e3660cf/si11.gif https://s3-eu-west-1.amazonaws.com/prod-ucs-content-store-eu-west/content/pii:S1381116909002866/STRIPIN/image/gif/beb91a29bdb2f4f4c3e51d299e3660cf/si11.gif si11 si11.gif gif 526 16 132 ALTIMG 1-s2.0-S1381116909002866-si10.gif https://s3.amazonaws.com/prod-ucs-content-store-us-east/content/pii:S1381116909002866/STRIPIN/image/gif/bae9f0382b4706d9081c2a64244bb748/si10.gif https://s3-eu-west-1.amazonaws.com/prod-ucs-content-store-eu-west/content/pii:S1381116909002866/STRIPIN/image/gif/bae9f0382b4706d9081c2a64244bb748/si10.gif si10 si10.gif gif 675 16 174 ALTIMG 1-s2.0-S1381116909002866-si1.gif https://s3.amazonaws.com/prod-ucs-content-store-us-east/content/pii:S1381116909002866/STRIPIN/image/gif/e073bcfbe36b4d00a5e1affcea0ade7c/si2.gif https://s3-eu-west-1.amazonaws.com/prod-ucs-content-store-eu-west/content/pii:S1381116909002866/STRIPIN/image/gif/e073bcfbe36b4d00a5e1affcea0ade7c/si2.gif si1 si1.gif gif 287 16 58 ALTIMG 1-s2.0-S1381116909002866-gr1.jpg https://s3.amazonaws.com/prod-ucs-content-store-us-east/content/pii:S1381116909002866/gr1/DOWNSAMPLED/image/jpeg/33eaf51d7acca8afcc92794d41d423cd/gr1.jpg https://s3-eu-west-1.amazonaws.com/prod-ucs-content-store-eu-west/content/pii:S1381116909002866/gr1/DOWNSAMPLED/image/jpeg/33eaf51d7acca8afcc92794d41d423cd/gr1.jpg gr1 gr1.jpg jpg 18239 251 376 IMAGE-DOWNSAMPLED 1-s2.0-S1381116909002866-gr1.sml https://s3.amazonaws.com/prod-ucs-content-store-us-east/content/pii:S1381116909002866/gr1/THUMBNAIL/image/gif/9124026b23519ef835b751571fb677ba/gr1.sml https://s3-eu-west-1.amazonaws.com/prod-ucs-content-store-eu-west/content/pii:S1381116909002866/gr1/THUMBNAIL/image/gif/9124026b23519ef835b751571fb677ba/gr1.sml gr1 gr1.sml sml 3273 146 219 IMAGE-THUMBNAIL 1-s2.0-S1381116909002866-gr2.jpg https://s3.amazonaws.com/prod-ucs-content-store-us-east/content/pii:S1381116909002866/gr2/DOWNSAMPLED/image/jpeg/2ff5b883a5fe2e662399862e8c2002a4/gr2.jpg https://s3-eu-west-1.amazonaws.com/prod-ucs-content-store-eu-west/content/pii:S1381116909002866/gr2/DOWNSAMPLED/image/jpeg/2ff5b883a5fe2e662399862e8c2002a4/gr2.jpg gr2 gr2.jpg jpg 15886 286 376 IMAGE-DOWNSAMPLED 1-s2.0-S1381116909002866-gr2.sml https://s3.amazonaws.com/prod-ucs-content-store-us-east/content/pii:S1381116909002866/gr2/THUMBNAIL/image/gif/d5476e988d8a7209b7b3a5db70c8e768/gr2.sml https://s3-eu-west-1.amazonaws.com/prod-ucs-content-store-eu-west/content/pii:S1381116909002866/gr2/THUMBNAIL/image/gif/d5476e988d8a7209b7b3a5db70c8e768/gr2.sml gr2 gr2.sml sml 2746 164 216 IMAGE-THUMBNAIL 1-s2.0-S1381116909002866-gr3.jpg https://s3.amazonaws.com/prod-ucs-content-store-us-east/content/pii:S1381116909002866/gr3/DOWNSAMPLED/image/jpeg/5f21b13309c15c0e743ba11a54a77f4f/gr3.jpg https://s3-eu-west-1.amazonaws.com/prod-ucs-content-store-eu-west/content/pii:S1381116909002866/gr3/DOWNSAMPLED/image/jpeg/5f21b13309c15c0e743ba11a54a77f4f/gr3.jpg gr3 gr3.jpg jpg 11823 288 376 IMAGE-DOWNSAMPLED 1-s2.0-S1381116909002866-gr3.sml https://s3.amazonaws.com/prod-ucs-content-store-us-east/content/pii:S1381116909002866/gr3/THUMBNAIL/image/gif/939dccd357bd55e2bbf43d395edeaffe/gr3.sml https://s3-eu-west-1.amazonaws.com/prod-ucs-content-store-eu-west/content/pii:S1381116909002866/gr3/THUMBNAIL/image/gif/939dccd357bd55e2bbf43d395edeaffe/gr3.sml gr3 gr3.sml sml 2145 164 214 IMAGE-THUMBNAIL 1-s2.0-S1381116909002866-gr4.jpg https://s3.amazonaws.com/prod-ucs-content-store-us-east/content/pii:S1381116909002866/gr4/DOWNSAMPLED/image/jpeg/096930c72d57ed62a2bfef0c9409e2e4/gr4.jpg https://s3-eu-west-1.amazonaws.com/prod-ucs-content-store-eu-west/content/pii:S1381116909002866/gr4/DOWNSAMPLED/image/jpeg/096930c72d57ed62a2bfef0c9409e2e4/gr4.jpg gr4 gr4.jpg jpg 15465 312 373 IMAGE-DOWNSAMPLED 1-s2.0-S1381116909002866-gr4.sml https://s3.amazonaws.com/prod-ucs-content-store-us-east/content/pii:S1381116909002866/gr4/THUMBNAIL/image/gif/1db7bce4d9499053a5ffdef1f9184bdb/gr4.sml https://s3-eu-west-1.amazonaws.com/prod-ucs-content-store-eu-west/content/pii:S1381116909002866/gr4/THUMBNAIL/image/gif/1db7bce4d9499053a5ffdef1f9184bdb/gr4.sml gr4 gr4.sml sml 2495 164 196 IMAGE-THUMBNAIL 1-s2.0-S1381116909002866-fx1.jpg https://s3.amazonaws.com/prod-ucs-content-store-us-east/content/pii:S1381116909002866/fx1/DOWNSAMPLED/image/jpeg/9f937189dc25a6e23e9e3feeffde8796/fx1.jpg https://s3-eu-west-1.amazonaws.com/prod-ucs-content-store-eu-west/content/pii:S1381116909002866/fx1/DOWNSAMPLED/image/jpeg/9f937189dc25a6e23e9e3feeffde8796/fx1.jpg fx1 true fx1.jpg jpg 12961 187 287 IMAGE-DOWNSAMPLED 1-s2.0-S1381116909002866-fx1.sml https://s3.amazonaws.com/prod-ucs-content-store-us-east/content/pii:S1381116909002866/fx1/THUMBNAIL/image/gif/a3f2699eeebd0b7e34660c8c243767fd/fx1.sml https://s3-eu-west-1.amazonaws.com/prod-ucs-content-store-eu-west/content/pii:S1381116909002866/fx1/THUMBNAIL/image/gif/a3f2699eeebd0b7e34660c8c243767fd/fx1.sml fx1 true fx1.sml sml 3449 143 219 IMAGE-THUMBNAIL MOLCAA 7576 S1381-1169(09)00286-6 10.1016/j.molcata.2009.06.013 Elsevier B.V. Fig. 1 Experimental (points) and calculated (lines) CH4 conversions in steam and carbon dioxide methane reforming on Ni-1 (according to the present model and model in [9]). Fig. 2 Agreement between experimental and calculated (the present model) data on steam and carbon dioxide methane reforming on Ni-2 catalyst. Fig. 3 Dependence of methane reforming rate on the ratio partial pressures of hydrogen and steam. Fig. 4 Dependence of k 1 on 1/T extracted from the experiments in the circulation flow unit (a is the activity coefficient of the catalyst, the water gas shift reaction is in equilibrium). Table 1 Methane conversion with steam and carbon dioxide and PCO at the reactor outlet on Ni-1 and Ni-2. 650°C 600°C 550°C 500°C Ni-1 CH4 +H2O+H2 X C H 4 , % 13.0 8.1 3.65 1.53 P CO, bar 0.0040 0.0014 0.0002 0 CH4 +CO2 +H2 X C H 4 , % 10.5 5.8 2.8 0.84 P CO, bar 0.085 0.061 0.035 0.025 Ni-2 CH4 +H2O+H2 X C H 4 , % 50.2 36.5 23.4 10.6 P CO, bar 0.020 0.010 0.004 0.0009 CH4 +CO2 +H2 X C H 4 , % 38.0 24.3 15.5 6.8 P CO, bar 0.220 0.160 0.120 0.062 Table 2 Influence of hydrogen on dry methane reforming on Ni-1. X C H 4 , % P CO exit, bars CH4 +CO2 3.38 0.023 CH4 +CO2 +H2 1.90 0.053 Steady-state kinetics and mechanism of methane reforming with steam and carbon dioxide over Ni catalyst A.K. Avetisov a ⁎ J.R. Rostrup-Nielsen b V.L. Kuchaev a ✠ J.-H. Bak Hansen b A.G. Zyskin a E.N. Shapatina a a Karpov Institute of Physical Chemistry, 105064 Vorontsovo Pole 10, Moscow, Russia b Haldor Topsøe A/S, Nymøllevej 55, DK-2800 Lyngby, Denmark ⁎ Corresponding author. Tel.: +7 495 916 60 25; fax: +7 495 916 60 25. ✠ Deceased author. Graphical abstract Based on new own and known published experimental data a microkinetic model of steam and dry methane reforming on Ni-catalyst is proposed and proved. The model eliminates drawbacks of the known previous models. The kinetic equations are derived. A critical analysis of known kinetic models of methane reforming on Ni-catalyst is performed. Based on new own and known published experimental data a microkinetic model of steam and dry methane reforming on Ni-catalyst is proposed and proved. The model eliminates drawbacks of the known previous models. The kinetic equations are derived. Kinetic parameters of the model are adjusted by means of mathematical modeling with the use of own and published data. Pore-diffusion resistance was taken into account during calculations. The obtained values of kinetic parameters agree with the estimated ones obtained according to the transition state theory. Keywords Ni catalyst Microkinetic model Pore diffusions resistance Nomenclature k +i , k −i rate constant of elementary reactions of step i in forward and reveres direction K i equilibrium constant of step i k + i 0 , k − i 0 , K i 0 pre-exponential factors P i partial pressure of the i-th reactant (bar) r (i) rate of route i (moleg(cat)−1 h−1) r i rate of species i (moleg(cat)−1 h−1) T temperature (K) Z free adsorption site on nickel surface ZA chemisorbed A species [ZA] surface coverage by A species ≡ symbol of quasi equilibrium step ⇄ symbol of reversible step Greek symbol η(A) efficiency for species A 1 Introduction A significant part of Mikhail Temkin's scientific activity was devoted, along with thermodynamics and electrochemistry, to the study of kinetics and mechanisms of heterogeneous catalytic reactions [1] under stationary conditions. Most of these investigations have been performed by Temkin et al. in Karpov Institute of Physical Chemistry, where he was the head of the laboratory of chemical kinetics for about 50 years. Of special importance are kinetic models for stationary complex reactions because catalytic reactors normally operate under steady state conditions. The study of mechanisms of catalytic reactions was based on comprehensive kinetic investigations. Temkin was one of the first who began to use circulation flow units [2]. This gives the possibility to derive one-parametric dependences of the reaction rates on partial pressures of the reaction mixture components. This makes the experimental justification of the proposed kinetic equations more reliable. The kinetic models suggested by Temkin could be somewhat simplified ones. Thus, his kinetic models often include collision steps, that is, the interaction of a molecule from the gas phase with an adsorbed particle (linear mechanisms). This simplifies the derivation of explicit kinetic equations and makes easier the fitting parameters entering these equations. The latter was very important taking into account the absence of any computing facilities at the beginning of Temkin's activity or the absence of high-speed computers later. 1.1 Temkin et al. model One of industrial-scale reactions which have been studied by Temkin and co-workers is steam reforming of methane (1) CH4 +H2O=CO+3H2 (2) CO+H2O=CO2 +H2 (3) CH4 +2H2O=CO2 +4H2 Based on new experimental data, in the present work we propose and validate the mechanism of steam and dry reforming of methane over nickel catalysts. This mechanism is an advancement of the mechanism proposed by Temkin in [3]. Kinetic equations are derived and kinetic parameters are obtained. As was pointed by Temkin and co-workers [4], in methane steam reforming at temperatures 700–900°C commonly used in practice, it is difficult to avoid diffusion restrictions of the reaction, even for fine catalyst grains of commercial supported catalysts. To be sure that the reaction proceeds in the kinetic region, nickel foil was used as a catalyst. Steam reforming of methane as well as the reverse reaction of carbon monoxide hydrogenation was studied under gradientless conditions using a glass circulation flow unit [3]. In most detail, the kinetics of methane reforming has been studied at catalyst temperatures 470, 500, 600 and 700°C and atmospheric pressure. Experimental data were described based on the following two-route (N(1), N(2)) reaction scheme N(1) N(2) ( 1 ) C H 4 + Z ⇄ ZC H 2 + H 2 1 0 ( 2 ) ZC H 2 + H 2 O ⇄ ZCHOH + H 2 1 0 ( 3 ) ZCHOH ⇄ ZCO + H 2 1 0 (A) ( 4 ) ZCO ⇄ Z + CO 1 0 ( 5 ) Z + H 2 O ≡ ZO + H 2 0 1 ( 6 ) ZO + CO ≡ Z + C O 2 0 1 N(1): CH4 +H2O=CO+3H2. N(2): CO+H2O=CO2 +H2. Here Z means a free adsorption site on nickel surface, Z preceding chemical formula means the corresponding chemisorbed particle, and symbol≡means a quasi equilibrium reaction. On the right side of elementary steps stoichiometric numbers for these steps are given. Such numbers could be negative, positive or equal to zero [1]. Under the assumption that the surface coverage by CH2, CHOH, and CO species is much lower than unity, the kinetic equation for methane consumption rate via route N(1) has the form (4) r = k 1 P C H 4 ( 1 − x ( 1 ) ) ( 1 + l P H 2 O 1 + l 2 ( P H 2 2 / P H 2 O ) + l 3 ( P H 2 3 / P H 2 O ) ) ( 1 + K 5 ( P H 2 O / P H 2 ) ) where k 1, k 2, k 3, k 4, k −1, k −2, k −3, k −4 are the rate constants of corresponding elementary steps; l 1 = k −1/k 2, l 2 = k −1·k −2/k 1 ·k 2, l 3 = k −1·k −2·k −3/k 2 k 3 k 4, and K 5 is the equilibrium constant of step 5. Eq. (4) was successful in the description of experimental data through data fitting with the use of theoretical expressions for pre-exponential factors of rate and equilibrium constants. The term l 1 P H 2 O appeared to be much smaller than unity and might be neglected for conditions of experiments in [3]. Similarly, the term K 5 P H 2 O / P H 2 is also negligible. Let us discuss in more detail some features of mechanism (A). The reaction proceeds via dissociative adsorption of methane on nickel accompanied with the liberation of hydrogen molecules in the gas phase. At sufficiently low partial pressures of hydrogen surface species ZCH2 react faster with water molecules; thus methane adsorption becomes essentially irreversible and the reaction rate of methane consumption is described by the equation (5) r = k 1 P C H 4 ( 1 − X ( 1 ) ) , where X ( 1 ) = ( P CO P H 2 3 / K 1 P C H 4 P H 2 O ) reflects how close the reaction (1) is to equilibrium, K 1 is the equilibrium constant of reaction (1). The values of l 2 and l 3 in Eq. (4) decrease with temperature in such a way that within the studied range of partial pressures of the reaction participants the retarding action of hydrogen and the accelerating action of water becomes insignificant at 600°C and completely disappears at 700°C. At temperatures lower than 600°C it is necessary to use Eq. (4), although it should be mentioned that for these temperatures a region of transition to Eq. (5) was observed. The validity of Eq. (5) for the rate of methane reforming was shown also in [5,6]. According to mechanism (A), the reasons of deviations from Eq. (5) are related with the fact that at increasing hydrogen partial pressure, the step 1 becomes fast enough in the reverse direction, the methane adsorption becomes reversible, and a reaction retardation by hydrogen is observed according to Eq. (4). In this case, the increase in the steam partial pressure results in the decrease in surface coverage with ZCH2 species and in the decrease in the methane desorption rate. Therefore, at high partial pressures of hydrogen the acceleration of reaction with steam is observed. It should be noted that since the reaction was performed on nickel foil in a gradientless circulation flow system, its kinetics cannot be affected by pore-diffusion resistance or by heat and mass transfer resistance. Note also that the second term in the denominator of Eq. (4) appears due to surface coverage with oxygen atoms, in accordance with the equilibrium step 5. While fitting experimental data of [3] the value of this second multiplier was found to be close to unity, and hence, the surface coverage with oxygen may be neglected. Thus, according to the mechanism by Temkin and co-workers [3], under conditions of their experiments on steam reforming of methane, the surface coverage with all adsorbed species is much smaller than one. Mechanism (A) is extremely simplified; however, it correctly conveys the physical meaning of the dependence of reaction rates on partial pressure of the reaction mixture components. 1.2 Froment and Xu model More resent publications [7–9] containing new experimental data show that the mechanism above needs more detailed elaboration. For instance, it is reasonable to accept that the formation of carbon dioxide may proceed via the interaction between an oxygen atom adsorbed on the nickel surface and an adsorbed CO molecule rather than via collision of CO molecule from the gas phase. Additionally, it is probable that adsorbed H atoms also participate in the reaction steps. Furthermore, a modification of the mechanism is necessary in order to describe kinetic data at elevated pressures. The modified mechanism of methane reforming with water steam and carbon dioxide will be explained later, after the analysis of these publications. Methane steam reforming was studied [7,8] in plug-flow systems mainly at 550°C as well as at 500 and 525°C, and the total reaction mixture pressure from 3 to 15bars. The ratio of partial pressures of hydrogen to methane at the reactor inlet was 1.25, and that of water to methane was 3 or 5. The contact time was varied by changing the feed rate of the reaction mixture over a wide range. The catalyst had the form of grains of the size 0.18–0.25 or 0.3–0.4mm. The experiments have shown that, in a similar manner to the results of Temkin and co-workers [3], the rate of methane consumption decreased with increasing hydrogen partial pressure and increased with increasing steam partial pressure. The order of the methane consumption rate with respect to methane was significantly lower than unity. The experimental data were described on the basis of the following mechanism: N(1) N(2) N(3) (1) H2O+Z≡ZO+H2 1 1 2 (2) CH4 +Z≡ZCH4 1 0 1 (3) ZCH4 +Z≡ZCH3 +ZH 1 0 1 (4) ZCH3 +Z≡ZCH2 +ZH 1 0 1 (5) ZCH2 +ZO≡ZCH2O+Z 1 0 1 (6) ZCH2O+Z≡ZCHO+ZH 1 0 1 (B) (7) ZCHO+Z⇄ZCO+ZH 1 0 0 (8) ZCO+ZO⇄ZCO2 +Z 0 1 0 (9) ZCHO+ZO⇄ZCO2 +ZH 0 0 1 (10) ZCO≡CO+Z 0 1 0 (11) ZCO2 ≡CO2 +Z 0 1 1 (12) 2ZH≡ZH2 +Z 2 0 2 (13) ZH2 ≡H2 +Z 2 0 2 N(1): CH4 +H2O=CO+3H2. N(2): CO+H2O=CO2 +H2. N(3): CH4 +2H2O=CO2 +4H2. Mechanism (B) consists of 3 routes N(1), N(2), and N(3), each route comprising a single slow step and other steps are quasi equilibria. Under assumption of surface uniformity, the following expressions were derived for the rate of each route: (6) r ( 1 ) = k 1 P C H 4 P H 2 O [ Z ] 2 P H 2 5 / 2 ( 1 − X ( 1 ) ) (7) r ( 2 ) = k 2 P CO P H 2 O [ Z ] 2 P H 2 ( 1 − X ( 2 ) ) (8) r ( 3 ) = k 1 P C H 4 P H 2 O 2 [ Z ] 2 P H 2 7 / 2 ( 1 − X ( 3 ) ) where X ( 1 ) = ( 1 / K ( 1 ) ) ( P CO P H 2 3 / P C H 4 P H 2 O ) shows the degree of approach to equilibrium of the reaction according to route N(1), X (2) and X (3) have the similar sense. The methane consumption rate is (9) − r C H 4 = r ( 1 ) + r ( 3 ) It is assumed that surface is covered mostly with adsorbed oxygen atoms and molecules of CO, H2, and CH4. Then, (10) Z = 1 1 + K H 2 O ( P H 2 O / P H 2 ) + K CO P CO + K H 2 P H 2 + K C H 4 P C H 4 The kinetic model of [7,8] with fitted rate constants succeeded in the description of experimental data on the dependence of methane consumption rate and the rate of carbon dioxide formation on contact time, but failed to describe the rate of carbon monoxide formation. This result was caused by the procedure used by the authors while fitting the rate constants, since as experimental observations methane conversion and carbon dioxide yield were chosen which are very close to each other. We refined the kinetic parameters on the basis of data on methane conversion and carbon monoxide, but not carbon dioxide yield, and thus the drawback of the procedure in [7,8] was overcame. However, some suppositions of model [B] provoke objections. The theoretical value of the pre-exponential factor K H 2 O 0 , which is derived from the absolute reaction rate theory (0.162·T −1/2) is 8 orders of magnitude higher than that obtained in [3] from the fit of experimental data. This means that the experimental dependence of the reaction rate on the steam partial pressure cannot be explained by a high surface coverage of oxygen atoms. In the models of [7,8] the surface coverage of absorbed methane molecules is also considerable. It seems improbable that methane molecules may firmly bind with the nickel surface without dissociation. 1.3 Aparicio model An investigation aimed to elucidate several elementary surface reactions in methane conversion on nickel catalyst has been made by Aparicio [9] using the isotope exchange method. Certain data on elementary steps of methane adsorption were obtained by studying the kinetics of isotope exchange between CD4 and H2. It was found that the adsorption of methane molecule is accompanied with the dissociation to an adsorbed species CH3 and an adsorbed H atom. Furthermore, additional hydrogen atoms on the surface detach from methane fragments with the desorption of molecular hydrogen. The mentioned reactions are reversible; hence CD4 exchanges deuterium with H2 which results in the formation of molecules containing CD4−x H x , 0< x <4. Activation energies and pre-exponential factors for some elementary steps of hydrogen atom detachment from methane and its fragments have been obtained in [9]. The methane adsorption rate on nickel will be discussed later. Isotope exchange between H2O and D2 molecules was also studied. The exchange proceeds at a high rate at 100–200°C. Already at these temperatures a reversible dissociative adsorption of water takes place on the surface with the formation of surface H, O and OH. A microkinetic model of methane conversion was proposed which includes a step of OH interaction with C atoms on the surface. However, due to the complexity of the mechanism it was impossible to obtain the kinetic equation in an explicit form. Nevertheless, calculations could describe experimental data [9]. The presently suggested mechanism of methane reforming contains several steps of mechanism [9]. 2 Experimental 2.1 Methods of kinetic experiments Several tests aimed to study the relationship between mechanisms of steam and dry reforming of methane were performed in a plug-flow reactor at atmospheric pressure. The experimental procedure was described in detail in [10]. Two supported nickel catalyst were used: Ni-1 nickel supported on MgO, nickel content 1.4wt.%, active nickel surface 1.1m2/g; Ni-2 nickel supported on magnesium spinel MgAl2O4, nickel content 16.0wt.%, active nickel surface 5.3m2/g. The rates of steam and dry methane reforming were compared at catalyst charge 25mg Ni-1 or Ni-2 (Table 1 ). In the case of steam methane reforming the reactor was supplied with 4.0 NL/h CH4, 16.0 NL/h H2O, and 1.6 NL/h H2; whereas for dry reforming with 4.0 NL/h CH4; 16.0 NL/h CO2, and 1.6 NL/h H2. These tests were performed at 650, 600, 550, and 500°C. The effect of hydrogen on the rate of dry methane reforming was studied at 500°C in the reactor charged with 50mg Ni-1. The methane conversion was compared for tests with and without hydrogen input into the reactor (Table 2 ). The effect of partial pressure of steam on the methane conversion on Ni-1 was studied at 500°C. For this end, the feed rate of steam into the reactor was decreased, the steam being replaced with nitrogen which is inactive in the reactions. The study of methane reforming at atmospheric pressure was performed also under gradientless conditions using a circulation flow glass unit. The circulation of gaseous reaction mixture was induced with an electromagnetic circulation pump with a valve unit. The reactor vessel was made of fused silica. Since the reaction occurs at a considerable steam partial pressure, in order to avoid water condensation on the unit walls, the circulation unit was placed in a heated oven which is maintained at 120–140°C. Special valves with Teflon gaskets were used without lubricant. For heating gas mixture entering the reactor, the latter was provided with a coil. The reactor was heated with a furnace with fluidized corundum bed to enhance heat transfer to the coil and the reaction vessel. The flows of the reaction mixture components (pure H2, CO2, CH4, as well as Ar after additional purifications) to the reactor were controlled with a gas flow-meter (Brooks Instrument Model 5850 E). The water flow was set by a liquid flow-meter, and afterwards the water entered the evaporator and the water steam was mixed with other gaseous components of the feed mixture. Before entering the flow circuit, the gas mixture passes an additional pre-reactor made of fused silica and heated to the predetermined temperature (from 300 up to 600°C), in which an excess amount (ca. 150cm3) of steam methane reforming catalyst was placed. On the one hand, the pre-reactor takes up poison traces of supplied gas mixture. On the other hand, by varying the pre-reactor temperature it is possible to set the desirable composition of the supplied mixture. The study of methane reforming at elevated pressures (up to 30 bars) was performed in a plug-flow mode. Here the reactor made of copper was used which had the form of a rectangular 2mm×12mm in order to increase heat transfer with the furnace with fluidized corundum bed. It was checked in separate experiments in the absence of the catalyst that the conversion on the reactor sidewalls is negligible. The analysis of the reaction gas mixture was performed using gas chromatography. As internal standard, argon was used which was fed at a fixed rate together with the reaction mixture. Two gas chromatographs were used separately (Tsvet 530). One sample was injected in GC1 with three sequential columns arranged in the following way: column 1→TCD→adsorber for removing water vapor (molecular sieve 50nm, 1=0.1m)→empty stainless steel tube with diameter 3mm and length 12m and thereafter columns 2+columns 3 followed by TCD. Column 1 of 3m length packed with Polysorb 1 (an analogue of Porapak Q) was used for analysis of H2O at 150°C. It allowed separation of water from the sum of H2 +Ar+CO+CH4 +CO2. Columns 2 (molecular sieve 13X, 1.5m, room temperature) and 3 (special carbon material PAU-2, 2m, temperature is (0–(−7))°C) with stainless steel material of tubing were used for analysis of CH4 and CO. These columns were able to separate H2, Ar, CO and CH4. The carrier gas in GC1 was helium. Another sample was injected in the chromatograph 2 with four columns with stainless steel material of tubing arranged as follows: columns 1 (Porapak Q, 1m) and 2 (Polysorb 1, 1m)→TCD→empty stainless steel tube of diameter 3mm and length 9m→columns 3 (molecular sieve 5A, 3m) and 4 (PAU-2, 2m→TCD]. The carrier gas was nitrogen. In GC2 columns 1 and 2 were applied for analysis of CO2 at the room temperature. These columns separated the peak of sum (H2 +Ar), the peak of CH4 and the peak of CO2. Columns 3 and 4 operating also at room temperature were utilized for analysis of H2 and separated H2, Ar and CH4. The information from both GC were processed using the software “ChromProcessor”. The samples of gas for chromatographic analysis may be taken from the flow circuit inlet and outlet. The difference between flows of each reaction participant divided to the weight of catalyst and time gave the average reaction rate with respect to this component. 2.2 Model parameter fitting The modeling according to the derived kinetic equations was realized as follows. The inverse kinetic problems to evaluate kinetic parameters were solved by minimizing sums of squares of relative deviations of experimental and calculated values of methane conversion and carbon oxides yields (for experiments in plug-flow reactors) and the rates of formation or consumption of key substances, i.e. methane and carbon dioxide (for experiments in a circulation flow reactor). The Fick's model was used in the calculations of reaction rates on catalyst grains of known size in order to take into account the diffusion inside pores. The apparent diffusion coefficient was calculated on the basis of known pore volume distribution in pore radius and from experimental values of diffusion permeability. The detail of mathematical model and calculation methods are given in [11]. 3 Results and discussion 3.1 Results of experiments Table 1 presents methane conversion, X C H 4 , and carbon monoxide partial pressure, P CO, at the plug-flow reactor outlet for steam and dry reforming. As can be seen from Table 1 in the case of dry reforming on Ni-2, P CO at the reactor outlet is significantly higher than P CO at the reactor outlet for dry reforming on Ni-1 and P CO at the reactor outlet for steam reforming on both catalysts. The data given in Table 1 gives the possibility to assume that the decrease in X C H 4 in dry reforming over Ni-2 is due to a significant Ni-2 surface coverage with carbon monoxide. Additionally some experiments on methane reforming at 500°C on Ni-1catalyst were performed in order to check the effect of hydrogen addition to the CH4 +CO2 mixture. The results are given in Table 2. 3.2 Modified microkinetic model of methane steam and dry reforming As was indicated above, the experiments by Froment and Xu [7,8] have shown, that kinetic features of methane conversion at pressures up to 15 bars are similar to the features obtained in [3]. Namely, the reaction is accelerated by steam and decelerated by hydrogen. It is natural to accept that the reason of these effects is the same as proposed in [3]. A new peculiarity observed in experiments of [7,8] was the decrease in the reaction order with respect to methane: it is lower than unity. This may be explained by the fact that at elevated methane pressures its adsorbed fragments occupy a significant part of the surface. According to [9], methane adsorbs on the nickel surface with the dissociation into an adsorbed hydrogen atom and an adsorbed methane fragment, CH3. Then CH3 species dissociates on the surface, etc. Such a mechanism of adsorption may be taken into account in the kinetic model of methane reforming. Similarly, the result of [9] may be included in the model; namely that water molecules also adsorb with the dissociation into adsorbed OH, O, and H, which are in equilibrium with water and hydrogen from the gas phase. The step of the interaction of adsorbed carbon monoxide and adsorbed oxygen atom resulted in the formation of carbon dioxide should also be included in the model. With all this taken into account, the following kinetic model of methane reforming is proposed. N(1) N(3) (1) CH4 +2Z⇄ZCH3 +ZH 1 1 (2) ZCH3 +Z⇄ZCH2 +ZH 1 1 (3) ZCH2 +Z⇄ZCH+ZH 1 1 (4) ZCH+Z⇄ZC+ZH 1 1 (5) ZC+ZOH⇄ZCOH+Z 1 1 (6) ZCOH+Z⇄ZCO+ZH 1 1 (C) (7) ZCO≡Z+CO 1 0 (8) ZCO+ZO⇄2Z+CO2 0 1 (9) H2O+2Z≡ZOH+ZH 1 2 10) ZOH+Z≡ZO+ZH 0 1 11) 2ZH≡2Z+H2 3 4 N(1): CH4 +H2O=CO+3H2. N(3): CH4 +2H2O=CO2 +4H2. It is assumed that each adsorbed species requires a single adsorption site. It is supposed also that surface concentrations of all species except for ZCH3 and ZCO are low. The, mechanism (C) results in the following equations for the reaction rates for the key components, i.e. methane and carbon dioxide: (11) − r C H 4 = r ( 1 ) + r ( 3 ) = k 1 P C H 4 ( 1 − X ) [ Z ] 2 D E N (12) r C O 2 = r ( 3 ) = N U M 1 + ( k − 8 / k − 7 ) K ( 2 ) ( P H 2 O / P H 2 ) [ Z ] where N U M = − r C H 4 k − 8 k − 7 K ( 2 ) P H 2 O P H 2 [ Z ] − k − 8 P C O 2 − K ( 2 ) P CO P H 2 O P H 2 [ Z ] 2 , (13) D E N = 1 + A 1 P H 2 1 / 2 + A 2 P H 2 + A 3 P H 2 3 / 2 + A 4 P H 2 5 / 2 P H 2 O + A 5 P H 2 3 [ Z ] P H 2 O ( 1 + ( k − 8 / k − 7 ) K ( 2 ) ( P H 2 O / P H 2 ) [ Z ] ) . A 1 = k − 1 k 2 K − 11 1 / 2 , A 2 = k − 1 k − 2 k 2 k 3 K − 11 , A 3 = k − 1 k − 2 k − 3 k 2 k 3 k 4 K − 11 3 / 2 , A 4 = k − 1 k − 2 k − 3 k − 4 k 2 k 3 k 4 K 9 1 + k − 5 k 6 K − 11 5 / 2 , A 5 = k 1 K ( I ) k − 7 , X = 1 K ( 1 ) P H 2 3 P CO P H 2 O P C H 4 1 + ( k − 8 / k − 7 ) ( P C O 2 / P CO ) [ Z ] 1 + ( k − 8 / k − 7 ) K ( 2 ) ( P H 2 O / P H 2 ) [ Z ] . Equating expression (11) to the rate of the first step, one obtains (14) Z C H 3 = k 1 P C H 4 k − 1 K − 11 1 / 2 P H 2 1 / 2 Z 1 − ( 1 − X ) D E N = K C H 3 P C H 4 P H 2 1 / 2 Z 1 − ( 1 − X ) D E N . Taking into account equilibrium of step 7, we obtain the expression for the fraction of non-occupied surface [Z]: (15) [ Z ] = 1 1 + K C H 3 ( P C H 4 / P H 2 1 / 2 ) ( 1 − ( ( 1 − X ) / D E N ) ) + K CO P CO where K CO = k −7/k 7 If the adsorption rates of carbon monoxide and carbon dioxide are much higher than the methane adsorption rate (and this follows from the data given in [9]), the term with A 5 in DEN may be neglected. Let us assume also that A 1, A 2 and A 3 are much lower than unity. Then, the Eq. (11) converts into (16) r C H 4 = − k 1 P C H 4 ( 1 − ( 1 / K ( 1 ) ) ( P H 2 3 P CO / P H 2 P C H 4 ) ( 1 + ( k − 8 / k − 7 ) ( P C O 2 / P CO ) [ Z ] / 1 + ( k − 8 / k − 7 ) K ( 2 ) ( P H 2 O / P H 2 ) [ Z ] ) ) ( 1 + A 4 ( P H 2 5 / 2 / P H 2 O ) ) [ 1 + K C H 3 ( P C H 4 / P H 2 1 / 2 ) ( 1 − ( ( 1 − X ) / 1 + A 4 ( P H 2 5 / 2 / P H 2 O ) ) ) + K CO P CO ] 2 , where K CO = k −7/k 7. When the water gas-shift reaction (reaction (2) is in equilibrium, X = X (1). This condition is valid in almost all analyzed kinetic experiments on steam methane reforming, therefore Eq. (16) is sufficient for their description. For the same reason it is impossible to extract k −7 and k −8 from these experiments because they enter Eq. (16) as ratio. In the experiments on dry methane reforming the equilibrium of reaction (2) was not reached. Since the partial pressure of carbon dioxide is much higher under these conditions than the partial pressure of steam, it may be assumed that CO2 adsorption is at quasi-equilibrium whereas either step leading to the H2O absorption (i.e. step 9 or 10) becomes non-equilibrium. For such a case the following relationships were obtained (17) − r C O 2 = k − 9 K − 8 K − 10 K − 11 K − 7 P H 2 P C O 2 P CO [ Z ] 2 1 − K ( 2 ) P H 2 O P CO P C O 2 P H 2 − r C H 4 = k ′ C O 2 P H 2 P C O 2 P CO [ Z ] 2 1 − K ( 2 ) P H 2 O P CO P C O 2 P H 2 − r C H 4 (18) − r C O 2 = k − 10 K − 8 K − 11 1 / 2 K − 7 P H 2 1 / 2 P C O 2 P CO [ Z ] 2 1 − K ( 2 ) P H 2 O P CO P C O 2 P H 2 = k C O 2 P H 2 1 / 2 P C O 2 P CO [ Z ] 2 1 − K ( 2 ) P H 2 O P CO P C O 2 P H 2 Modeling of the data obtained in a plug-flow reactor at atmospheric pressure was performed as follows. First, from the experiments on steam methane reforming on Ni-1 pre-exponential factors and activation energy of the rate constant, k 1, were estimated considering that [Z]=1, DEN =1 in Eq. (11), and r C H 4 = k 1 P C H 4 (the dimension of reaction rates is mole/(g(cat)·h), and partial pressures are expressed in bars). Next, from the ratio of specific nickel surfaces of Ni-2 and Ni-1, the pre-exponential factor of k 1 was increased five fold and the validity of the obtained kinetic parameters was examined in the experiments on steam methane reforming on Ni-2. The following dependence was found for this catalyst sample: ln k 1 =17.4−12,000/T. Then, the experiments on steam and dry methane reforming on Ni-2 were treated together by assuming that [Z]=1/(1+ K CO P CO) and DEN =1 in Eq. (11). The following expressions ln k ′ C O 2 = 10,0 - 6000 / T , ln k C O 2 = 9,5 - 6000 / T k −8/k −7 ≈1, and lnK CO =−13,4+11,400/T were obtained. Thereafter the found values of the pre-exponential factors of k ′ C O 2 and k C O 2 were decreased according to the ratio of specific surfaces on Ni-2 and Ni-1 (i.e. by 5 times) and the parameters thus obtained were checked in the experiments on dry methane reforming on Ni-1. The results of modeling are shown in Figs. 1 and 2 . As can be seen, the proposed model is in much better agreement with the data obtained in the flow reactor, than the model [9]. Our calculations show that the experiments both on Ni-2 and Ni-1 proceeded in the region of pore-diffusion resistance. Thus, on Ni-2 the efficiency for dry reforming was varied from η(CH4)=0.341 and η(CO)=0.196 at T =650°C to η(CH4)=0.664 and η(CO)=0.258 at T =500°C, and on Ni-1 from η(CH4)=0.708 and η(CO)=0.398 at T =650°C to η(CH4)=0.797 and η(CO)=0.380 at T =500°C. For the estimation of parameter A 4 in Eq. (16), a set of data (see Fig. 3 ) obtained in a circulation flow unit was used wherein the ratio ( P H 2 5 / 2 / P H 2 O ) was varied within a broad range. The fitting with the use of K CO obtained above shows that K CO P CO ≪1 in these experiments. Furthermore, taking into account that the rate is of the first-order in methane at ambient pressure, so that K C H 3 ( P C H 4 / P H 2 1 / 2 ) is also negligible in comparison with unity and [Z]≈1. In this case, Eq. (16) may be linearized as shown in Fig. 3 in corresponding coordinates. Fig. 3 demonstrates the dependence of methane reforming rate on the ratio of hydrogen and water partial pressures. Fitting k 1, k ′ C O 2 , k C O 2 , and K CO for the whole set of experimental data gives the following value for A 4 =exp(−8.53+8000/T). The results shown in Fig. 4 illustrate that the k 1 temperature dependence is valid for the experiments performed both in circulation flow unit and plug-flow reactors at atmospheric pressure. For the estimation of K C H 3 , the data of [7] specified in [8] were used. As an objective function, the sum of squares of relative deviations between experimental and calculated values for methane conversion and carbon monoxide yield were used. All parameters entering Eq. (16) were fixed except for K C H 3 . In total, 195 experimental data points for methane conversion and carbon monoxide yield were used, the latter being calculated as the difference between methane conversion and carbon dioxide yield indicated in [8]. It was obtained that K C H 3 = exp ( − 5.72 − 4820 / T ) 3.3 Analysis of pre-exponential factors Thus, modeling kinetics of methane steam and dry reforming according to Eqs. (16)–(18) enables us to evaluate the rate constants k 1, k ′ C O 2 , k C O 2 , the ratio k −8/k −7 and parameters A 4, K C H 3 , and K CO. Let us analyze the correspondence of the obtained preexponential factors (i.e. experimental values) to the absolute reaction rate theory which for heterogeneous processes was developed for the first time by Temkin [12] (for more recent account of the theory see [13]). It is usually believed that the differences between these quantities within the limits of one order of magnitude are admissible and confirming the assumptions made at a formulation of kinetic model. A good estimation for the pre-exponents of the rate constants of adsorption is the number of collisions of molecules with the catalyst surface [13]: (19) ν = 2.635 × 10 25 P M T , where M is the molar mass, P is the pressure (in bar), T is the absolute temperature; the dimension of ν being molecules cm−2 s−1. Substituting in (19) P =1 bar, corresponding molecular weighs and T =873K, one obtains ν C H 4 = 2.2 × 10 23 , ν C O 2 = 1.32 × 10 23 , ν H 2 = 6.2 × 10 23 , ν H 2 O = 2.07 × 10 23 , and ν CO = 1.66 × 10 23 moleculescm−2 s−1 bar−1. The estimated experimental value k 1 0 = 10 23 moleculescm−2 s−1 bar−1 agrees well with the estimate above (for the specific nickel surface 5.3m2 g(cat) −1 and the number of active sites per cm2 Ni equal to 2×1015, the recalculation coefficient γ for the transition from moleg(cat) −1 h−1 bar−1 to moleculescm−2 s−1 bar−1 is 1015.2, and that for the transition to moleculessite−1 s−1 bar−1, γ’ is 1.5). It should be mentioned that close values 1022.8 and 1022.5 molecules cm−2 s−1 bar−1 have been obtained in [9] and [6], respectively (in recalculation the number of sites per cm2 Ni was also taken equal to 2×1015). As follows from the estimations according to Eq. (19), the ratio k −8/k −7 ≈1 at all temperatures. This is why k − 8 0 / k − 7 0 is close to unity irrespective of the adsorption type (dissociative or not), which agrees well with the results of modeling. For the evaluation of pre-exponential factors of absorption coefficients, let us first use the Temkin's equation [14]: (20) K j 0 = 1 T 1.75 ⋅ 10 i , where i is equal to 3 for molecular adsorption and 1.5 for atomic adsorption. The presently obtained value K CO 0 = 10 − 5.8 ba r − 1 may be considered as only fairly agreeing with the value 10−8.15 estimated by Eq. (20) (T =873K was used as an average temperature within the studied region). For the case of localized adsorption, the value of K CO 0 was calculated from the data of [9] as the ratio of pre-exponential factors of the rate constants of CO adsorption and desorption, the value 10−4.7 bar−1 was obtained which is much closer to the experimental value. To compare theoretical and experimental values of K C H 3 0 , the estimates of K − 11 0 and K 1 0 are necessary. The calculation of these parameters according to expression (20) for dissociative absorption of methane and hydrogen gives for the both parameters the same value 10−6.64. From here follows that K C H 3 0 = 10 − 3.32 ba r − 1 / 2 , which is approximately one order of magnitude higher than the value 10−2.5 bar−1/2 resulting from modeling. For non-localized adsorption, K − 11 0 = 10 − 4.53 ba r − 1 and K 1 0 = 10 − 3.21 ba r − 1 . From here follows that K C H 3 0 = 10 − 0.94 ba r − 1 / 2 which is somewhat closer to the experimental value. For further estimations of pre-exponential factors let us suppose, according to [9]: k − 1 0 = 10 10.4 , k 6 0 = 10 13 , k − 9 0 = k − 10 0 = ⋅ 10 11.5 (all in moleculessite−1 s−1) K 2 0 = K 3 0 = K 4 0 = 5 , K − 5 0 = 0.2 , K 10 0 = 5 (the values of the last two were considered by analogy to dissociation steps on the surface, for example, analogously to K 2 0 ), K 9 0 = 10 − 10.2 ba r − 1 , K − 11 0 = 10 − 4.53 ba r − 1 . The ratio K − 8 0 / K − 7 0 was taken as 101.5 according to (20). The expression for A 4 is rather complicated. In the general case, it cannot be represented as Arrhenius equation. However, if the ratio of rate constants of k −5 and k 6 is much higher or, to the contrary, much less than unity this expression is simlified and may be represented as Arrhenius equation. Taking into account that in scheme (C) step 5 in the reverse direction and step 6 in the right direction are of similar character, it may be assumed that the ratio of their pre-exponential factors is close to unity. Then, the relationship between these constants is defined by the difference of activation energies of these steps. Let us note that both species in the left-hand side of step 5 behave like radicals and their binding energies with the surface are higher than for the species in the right-hand side of step 6. Then, according to the Evans-Polanyi correlation [12], one may expect that E −5 < E 6 and k −5/k 6 >1. Hence, A 4 ≅ ( k − 1 k − 2 k − 3 k − 4 / k 2 k 3 k 4 k 5 K 9 ) ( k − 5 / k 6 ) K − 11 5 / 2 ≅ k − 1 ( K − 11 5 / 2 / k 6 K 2 K 3 K 4 K 5 K 9 ) . From this it follows that A 4 0 = 10 − 4.72 ba r 1.5 , which substantially coincides with the experimental value (10−3.7 bar1.5). For the correct choice between Eqs. (17) and (18), both describing the rate of carbon dioxide formation for methane dry reforming let us evaluate the pre-exponential factors of k ′ C O 2 and k C O 2 under conditions when water gas-shift reaction is far from equilibrium. The calculations using the values above give k C O 2 0 = 10 10.75 molecules site−1 s−1 bar−0.5, or 1010.58 moleg(cat) −1 h−1 bar−0.5, and k ′ C O 2 0 = 10 7.76 molecules site−1 s−1 bar−1, or 107.60 moleg(cat) −1 h−1 bar−1. As can be seen, the second value is more closer to the parameter extracted from the kinetic values (104.34 moleg(cat) −1 h−1 bar−1), which makes the assumptions made while deriving Eq. (18) more plausible. Thus, the analysis of “experimental” values of pre-exponential factors of the constants entering into the kinetic equations shows that they will correspond well enough with the estimations made on the basis of the transition-state theory. It, in turn, proves the assumptions made at a formulation of the mechanism (C) and at a derivation of the kinetic Eqs. (16)–(18). Finally we want to make some general comments about applicability of microkinetic analysis to heterogeneous catalytic kinetics of complex multi-step reactions. Kinetics of methane steam reforming under certain conditions can be described by the first order in methane, which within the framework of the mechanisms discussed above, corresponds to the dissociative adsorption of methane as the rate-limiting step. Hereinafter activation energies are indicated in terms of E/R. In Ref. [6] for the conditions of the first order in methane the value of E/R is equal to 12,300–12,600K. In the present study, for a supported nickel catalyst this value is 12,000K. It is interesting to note that the activation energy for methane dissociation indicated in [9] for a supported nickel catalyst is 6500K. This value was obtained from isotope exchange between D2 and CH4 between 350 and 450°C in the absence of any reactants containing oxygen, in particular H2O and CO2. Pre-exponential factors in all these three studies are close to each other, it means in fact the rate constant in [9] is substantially higher than in the other works. According to the model of Aparicio [9] there is a large difference between dry and steam reforming of methane, which is most probably connected with an overestimated value [9] of heat of CO chemisorption. This indicates an apparent danger of direct application of microkinetic methodology to the determination of rate constants from experimental data generated under conditions (temperature, gas composition, pressure, materials) far from the catalytic ones. On the other hand such data greatly helps to formulate the plausible multi-step reaction mechanism under conditions of real catalysis. 4 Conclusion The microkinetic model of steam and dry reforming of methane is proposed. In the advanced model the intermediate ZCH3, of surface coverage which can be significant, is not in equilibrium with components of gas phase CH4 and H2. Its inclusion in kinetic model allows describing change of the order of methane rate with varying total pressure. Influence of water and hydrogen on the rate of methane reforming in a forward direction is caused by their influence on reversibility of a step. Under some conditions (sufficiently large ratio P H 2 O / P H 2 ) the rate of methane reforming is described by the equation of the first order on methane. The same result has been reported in [3,6]. At dry methane reforming there can be significant surface coverage of carbon monoxide. This result explains the reason for the rate of dry methane reforming being less than the rate of steam methane reforming. In our model the surface coverage of the catalyst with the adsorbed atoms of oxygen, unlike in the model of Xu and Froment, is neglectably small. Kinetic parameters of the model are adjusted by means of mathematical modeling with the use of own and published [7,8] experimental data. Pore-diffusion resistance was taken into account during calculations. The obtained values of kinetic parameters agree with the estimates obtained according to the transition-state theory. To summarize, it may be stated that the proposed microkinetic model fairly well describes both published and own experimental data obtained in gradientless and plug-flog systems. References [1] M.I. Temkin Advances in Catalysis 28 1979 173 291 [2] M.I. Temkin S.L. Kiperman Doklady AN USSR 74 1950 763 766 (in Russian) [3] A.A. Khomenko L.O. Apelbaum F.S. Shub Yu.S. Snagovsky M.I. Temkin Kinetika i Kataliz 12 1971 423 431 (in Russian) [4] I.M. Bodrov L.O. Apelbaum M.I. Temkin Kinetika i Kataliz 8 1967 821 829 (in Russian) [5] W.W. Akres D.P. Camp AIChE Journal 1 1955 471 482 [6] J. Wei E. Iglesia Journal of Catalysis 224 2004 370 383 [7] J. Xu G.F. Froment AIChE Journal 35 1989 88 96 [8] J. Xu, Ph.D. Thesis, University of Gent, Belgium, 1989. [9] L.M. Aparicio Journal of Catalysis 165 1997 262 274 [10] J.R. Rostrup-Nielsen J.-H. Bak-Hansen Journal of Catalysis 144 1993 38 49 [11] A.G. Zyskin A.K. Avetisov V.L. Kuchaev E.N. Shapatina L. Christiansen Kinetika i Kataliz 48 2007 1 8 (in Russian) [12] M. Temkin Acta Physicochimica USSR 8 1938 141 161 [13] J.A. Dumesic D.F. Rudd L.M. Aparicio J.E. Rekoske A.A. Treviño The Microkinetics of Heterogeneous Catalysis, ACS Professional Reference Book 1993 American Chemical Society Washington [14] M. Temkin Acta Physicochimica USSR 1 1934 36 52",
      "scopus-id": "71649103299",
      "coredata": {
        "eid": "1-s2.0-S1381116909002866",
        "dc:description": "A critical analysis of known kinetic models of methane reforming on Ni-catalyst is performed. Based on new own and known published experimental data a microkinetic model of steam and dry methane reforming on Ni-catalyst is proposed and proved. The model eliminates drawbacks of the known previous models. The kinetic equations are derived. Kinetic parameters of the model are adjusted by means of mathematical modeling with the use of own and published data. Pore-diffusion resistance was taken into account during calculations. The obtained values of kinetic parameters agree with the estimated ones obtained according to the transition state theory.",
        "openArchiveArticle": "false",
        "prism:coverDate": "2010-01-15",
        "openaccessUserLicense": null,
        "prism:aggregationType": "Journal",
        "prism:url": "https://api.elsevier.com/content/article/pii/S1381116909002866",
        "dc:creator": [
          {
            "@_fa": "true",
            "$": "Avetisov, A.K."
          },
          {
            "@_fa": "true",
            "$": "Rostrup-Nielsen, J.R."
          },
          {
            "@_fa": "true",
            "$": "Kuchaev, V.L."
          },
          {
            "@_fa": "true",
            "$": "Bak Hansen, J.-H."
          },
          {
            "@_fa": "true",
            "$": "Zyskin, A.G."
          },
          {
            "@_fa": "true",
            "$": "Shapatina, E.N."
          }
        ],
        "link": [
          {
            "@_fa": "true",
            "@rel": "self",
            "@href": "https://api.elsevier.com/content/article/pii/S1381116909002866"
          },
          {
            "@_fa": "true",
            "@rel": "scidir",
            "@href": "https://www.sciencedirect.com/science/article/pii/S1381116909002866"
          }
        ],
        "dc:format": "application/json",
        "openaccessType": null,
        "pii": "S1381-1169(09)00286-6",
        "prism:volume": "315",
        "prism:publisher": "Elsevier B.V.",
        "dc:title": "Steady-state kinetics and mechanism of methane reforming with steam and carbon dioxide over Ni catalyst",
        "prism:copyright": "Copyright © 2009 Elsevier B.V. All rights reserved.",
        "prism:issueName": "In memory of M.I. Temkin",
        "openaccess": "0",
        "prism:issn": "13811169",
        "prism:issueIdentifier": "2",
        "dcterms:subject": [
          {
            "@_fa": "true",
            "$": "Ni catalyst"
          },
          {
            "@_fa": "true",
            "$": "Microkinetic model"
          },
          {
            "@_fa": "true",
            "$": "Pore diffusions resistance"
          }
        ],
        "openaccessArticle": "false",
        "prism:publicationName": "Journal of Molecular Catalysis A: Chemical",
        "prism:number": "2",
        "openaccessSponsorType": null,
        "prism:pageRange": "155-162",
        "prism:endingPage": "162",
        "pubType": "fla",
        "prism:coverDisplayDate": "15 January 2010",
        "prism:doi": "10.1016/j.molcata.2009.06.013",
        "prism:startingPage": "155",
        "dc:identifier": "doi:10.1016/j.molcata.2009.06.013",
        "openaccessSponsorName": null
      },
      "objects": {
        "object": [
          {
            "@category": "thumbnail",
            "@height": "16",
            "@width": "231",
            "@_fa": "true",
            "$": "https://api.elsevier.com/content/object/eid/1-s2.0-S1381116909002866-si9.gif?httpAccept=%2A%2F%2A",
            "@multimediatype": "GIF image file",
            "@type": "ALTIMG",
            "@size": "830",
            "@ref": "si9",
            "@mimetype": "image/gif"
          },
          {
            "@category": "thumbnail",
            "@height": "16",
            "@width": "185",
            "@_fa": "true",
            "$": "https://api.elsevier.com/content/object/eid/1-s2.0-S1381116909002866-si8.gif?httpAccept=%2A%2F%2A",
            "@multimediatype": "GIF image file",
            "@type": "ALTIMG",
            "@size": "703",
            "@ref": "si8",
            "@mimetype": "image/gif"
          },
          {
            "@category": "thumbnail",
            "@height": "15",
            "@width": "66",
            "@_fa": "true",
            "$": "https://api.elsevier.com/content/object/eid/1-s2.0-S1381116909002866-si79.gif?httpAccept=%2A%2F%2A",
            "@multimediatype": "GIF image file",
            "@type": "ALTIMG",
            "@size": "304",
            "@ref": "si79",
            "@mimetype": "image/gif"
          },
          {
            "@category": "thumbnail",
            "@height": "23",
            "@width": "97",
            "@_fa": "true",
            "$": "https://api.elsevier.com/content/object/eid/1-s2.0-S1381116909002866-si78.gif?httpAccept=%2A%2F%2A",
            "@multimediatype": "GIF image file",
            "@type": "ALTIMG",
            "@size": "446",
            "@ref": "si78",
            "@mimetype": "image/gif"
          },
          {
            "@category": "thumbnail",
            "@height": "22",
            "@width": "99",
            "@_fa": "true",
            "$": "https://api.elsevier.com/content/object/eid/1-s2.0-S1381116909002866-si77.gif?httpAccept=%2A%2F%2A",
            "@multimediatype": "GIF image file",
            "@type": "ALTIMG",
            "@size": "459",
            "@ref": "si77",
            "@mimetype": "image/gif"
          },
          {
            "@category": "thumbnail",
            "@height": "16",
            "@width": "31",
            "@_fa": "true",
            "$": "https://api.elsevier.com/content/object/eid/1-s2.0-S1381116909002866-si76.gif?httpAccept=%2A%2F%2A",
            "@multimediatype": "GIF image file",
            "@type": "ALTIMG",
            "@size": "216",
            "@ref": "si76",
            "@mimetype": "image/gif"
          },
          {
            "@category": "thumbnail",
            "@height": "20",
            "@width": "31",
            "@_fa": "true",
            "$": "https://api.elsevier.com/content/object/eid/1-s2.0-S1381116909002866-si75.gif?httpAccept=%2A%2F%2A",
            "@multimediatype": "GIF image file",
            "@type": "ALTIMG",
            "@size": "231",
            "@ref": "si75",
            "@mimetype": "image/gif"
          },
          {
            "@category": "thumbnail",
            "@height": "20",
            "@width": "134",
            "@_fa": "true",
            "$": "https://api.elsevier.com/content/object/eid/1-s2.0-S1381116909002866-si74.gif?httpAccept=%2A%2F%2A",
            "@multimediatype": "GIF image file",
            "@type": "ALTIMG",
            "@size": "520",
            "@ref": "si74",
            "@mimetype": "image/gif"
          },
          {
            "@category": "thumbnail",
            "@height": "22",
            "@width": "542",
            "@_fa": "true",
            "$": "https://api.elsevier.com/content/object/eid/1-s2.0-S1381116909002866-si73.gif?httpAccept=%2A%2F%2A",
            "@multimediatype": "GIF image file",
            "@type": "ALTIMG",
            "@size": "1699",
            "@ref": "si73",
            "@mimetype": "image/gif"
          },
          {
            "@category": "thumbnail",
            "@height": "20",
            "@width": "66",
            "@_fa": "true",
            "$": "https://api.elsevier.com/content/object/eid/1-s2.0-S1381116909002866-si72.gif?httpAccept=%2A%2F%2A",
            "@multimediatype": "GIF image file",
            "@type": "ALTIMG",
            "@size": "349",
            "@ref": "si72",
            "@mimetype": "image/gif"
          },
          {
            "@category": "thumbnail",
            "@height": "20",
            "@width": "294",
            "@_fa": "true",
            "$": "https://api.elsevier.com/content/object/eid/1-s2.0-S1381116909002866-si71.gif?httpAccept=%2A%2F%2A",
            "@multimediatype": "GIF image file",
            "@type": "ALTIMG",
            "@size": "910",
            "@ref": "si71",
            "@mimetype": "image/gif"
          },
          {
            "@category": "thumbnail",
            "@height": "20",
            "@width": "20",
            "@_fa": "true",
            "$": "https://api.elsevier.com/content/object/eid/1-s2.0-S1381116909002866-si70.gif?httpAccept=%2A%2F%2A",
            "@multimediatype": "GIF image file",
            "@type": "ALTIMG",
            "@size": "206",
            "@ref": "si70",
            "@mimetype": "image/gif"
          },
          {
            "@category": "thumbnail",
            "@height": "11",
            "@width": "17",
            "@_fa": "true",
            "$": "https://api.elsevier.com/content/object/eid/1-s2.0-S1381116909002866-si7.gif?httpAccept=%2A%2F%2A",
            "@multimediatype": "GIF image file",
            "@type": "ALTIMG",
            "@size": "124",
            "@ref": "si7",
            "@mimetype": "image/gif"
          },
          {
            "@category": "thumbnail",
            "@height": "20",
            "@width": "277",
            "@_fa": "true",
            "$": "https://api.elsevier.com/content/object/eid/1-s2.0-S1381116909002866-si69.gif?httpAccept=%2A%2F%2A",
            "@multimediatype": "GIF image file",
            "@type": "ALTIMG",
            "@size": "891",
            "@ref": "si69",
            "@mimetype": "image/gif"
          },
          {
            "@category": "thumbnail",
            "@height": "20",
            "@width": "142",
            "@_fa": "true",
            "$": "https://api.elsevier.com/content/object/eid/1-s2.0-S1381116909002866-si68.gif?httpAccept=%2A%2F%2A",
            "@multimediatype": "GIF image file",
            "@type": "ALTIMG",
            "@size": "539",
            "@ref": "si68",
            "@mimetype": "image/gif"
          },
          {
            "@category": "thumbnail",
            "@height": "20",
            "@width": "67",
            "@_fa": "true",
            "$": "https://api.elsevier.com/content/object/eid/1-s2.0-S1381116909002866-si67.gif?httpAccept=%2A%2F%2A",
            "@multimediatype": "GIF image file",
            "@type": "ALTIMG",
            "@size": "343",
            "@ref": "si67",
            "@mimetype": "image/gif"
          },
          {
            "@category": "thumbnail",
            "@height": "20",
            "@width": "86",
            "@_fa": "true",
            "$": "https://api.elsevier.com/content/object/eid/1-s2.0-S1381116909002866-si66.gif?httpAccept=%2A%2F%2A",
            "@multimediatype": "GIF image file",
            "@type": "ALTIMG",
            "@size": "389",
            "@ref": "si66",
            "@mimetype": "image/gif"
          },
          {
            "@category": "thumbnail",
            "@height": "22",
            "@width": "164",
            "@_fa": "true",
            "$": "https://api.elsevier.com/content/object/eid/1-s2.0-S1381116909002866-si65.gif?httpAccept=%2A%2F%2A",
            "@multimediatype": "GIF image file",
            "@type": "ALTIMG",
            "@size": "624",
            "@ref": "si65",
            "@mimetype": "image/gif"
          },
          {
            "@category": "thumbnail",
            "@height": "20",
            "@width": "135",
            "@_fa": "true",
            "$": "https://api.elsevier.com/content/object/eid/1-s2.0-S1381116909002866-si64.gif?httpAccept=%2A%2F%2A",
            "@multimediatype": "GIF image file",
            "@type": "ALTIMG",
            "@size": "504",
            "@ref": "si64",
            "@mimetype": "image/gif"
          },
          {
            "@category": "thumbnail",
            "@height": "20",
            "@width": "151",
            "@_fa": "true",
            "$": "https://api.elsevier.com/content/object/eid/1-s2.0-S1381116909002866-si63.gif?httpAccept=%2A%2F%2A",
            "@multimediatype": "GIF image file",
            "@type": "ALTIMG",
            "@size": "550",
            "@ref": "si63",
            "@mimetype": "image/gif"
          },
          {
            "@category": "thumbnail",
            "@height": "22",
            "@width": "164",
            "@_fa": "true",
            "$": "https://api.elsevier.com/content/object/eid/1-s2.0-S1381116909002866-si62.gif?httpAccept=%2A%2F%2A",
            "@multimediatype": "GIF image file",
            "@type": "ALTIMG",
            "@size": "630",
            "@ref": "si62",
            "@mimetype": "image/gif"
          },
          {
            "@category": "thumbnail",
            "@height": "20",
            "@width": "20",
            "@_fa": "true",
            "$": "https://api.elsevier.com/content/object/eid/1-s2.0-S1381116909002866-si61.gif?httpAccept=%2A%2F%2A",
            "@multimediatype": "GIF image file",
            "@type": "ALTIMG",
            "@size": "203",
            "@ref": "si61",
            "@mimetype": "image/gif"
          },
          {
            "@category": "thumbnail",
            "@height": "20",
            "@width": "35",
            "@_fa": "true",
            "$": "https://api.elsevier.com/content/object/eid/1-s2.0-S1381116909002866-si60.gif?httpAccept=%2A%2F%2A",
            "@multimediatype": "GIF image file",
            "@type": "ALTIMG",
            "@size": "219",
            "@ref": "si60",
            "@mimetype": "image/gif"
          },
          {
            "@category": "thumbnail",
            "@height": "20",
            "@width": "80",
            "@_fa": "true",
            "$": "https://api.elsevier.com/content/object/eid/1-s2.0-S1381116909002866-si6.gif?httpAccept=%2A%2F%2A",
            "@multimediatype": "GIF image file",
            "@type": "ALTIMG",
            "@size": "364",
            "@ref": "si6",
            "@mimetype": "image/gif"
          },
          {
            "@category": "thumbnail",
            "@height": "22",
            "@width": "36",
            "@_fa": "true",
            "$": "https://api.elsevier.com/content/object/eid/1-s2.0-S1381116909002866-si59.gif?httpAccept=%2A%2F%2A",
            "@multimediatype": "GIF image file",
            "@type": "ALTIMG",
            "@size": "269",
            "@ref": "si59",
            "@mimetype": "image/gif"
          },
          {
            "@category": "thumbnail",
            "@height": "20",
            "@width": "31",
            "@_fa": "true",
            "$": "https://api.elsevier.com/content/object/eid/1-s2.0-S1381116909002866-si58.gif?httpAccept=%2A%2F%2A",
            "@multimediatype": "GIF image file",
            "@type": "ALTIMG",
            "@size": "249",
            "@ref": "si58",
            "@mimetype": "image/gif"
          },
          {
            "@category": "thumbnail",
            "@height": "20",
            "@width": "134",
            "@_fa": "true",
            "$": "https://api.elsevier.com/content/object/eid/1-s2.0-S1381116909002866-si57.gif?httpAccept=%2A%2F%2A",
            "@multimediatype": "GIF image file",
            "@type": "ALTIMG",
            "@size": "521",
            "@ref": "si57",
            "@mimetype": "image/gif"
          },
          {
            "@category": "thumbnail",
            "@height": "35",
            "@width": "116",
            "@_fa": "true",
            "$": "https://api.elsevier.com/content/object/eid/1-s2.0-S1381116909002866-si56.gif?httpAccept=%2A%2F%2A",
            "@multimediatype": "GIF image file",
            "@type": "ALTIMG",
            "@size": "542",
            "@ref": "si56",
            "@mimetype": "image/gif"
          },
          {
            "@category": "thumbnail",
            "@height": "20",
            "@width": "58",
            "@_fa": "true",
            "$": "https://api.elsevier.com/content/object/eid/1-s2.0-S1381116909002866-si55.gif?httpAccept=%2A%2F%2A",
            "@multimediatype": "GIF image file",
            "@type": "ALTIMG",
            "@size": "324",
            "@ref": "si55",
            "@mimetype": "image/gif"
          },
          {
            "@category": "thumbnail",
            "@height": "20",
            "@width": "67",
            "@_fa": "true",
            "$": "https://api.elsevier.com/content/object/eid/1-s2.0-S1381116909002866-si54.gif?httpAccept=%2A%2F%2A",
            "@multimediatype": "GIF image file",
            "@type": "ALTIMG",
            "@size": "337",
            "@ref": "si54",
            "@mimetype": "image/gif"
          },
          {
            "@category": "thumbnail",
            "@height": "19",
            "@width": "686",
            "@_fa": "true",
            "$": "https://api.elsevier.com/content/object/eid/1-s2.0-S1381116909002866-si53.gif?httpAccept=%2A%2F%2A",
            "@multimediatype": "GIF image file",
            "@type": "ALTIMG",
            "@size": "1718",
            "@ref": "si53",
            "@mimetype": "image/gif"
          },
          {
            "@category": "thumbnail",
            "@height": "37",
            "@width": "163",
            "@_fa": "true",
            "$": "https://api.elsevier.com/content/object/eid/1-s2.0-S1381116909002866-si52.gif?httpAccept=%2A%2F%2A",
            "@multimediatype": "GIF image file",
            "@type": "ALTIMG",
            "@size": "644",
            "@ref": "si52",
            "@mimetype": "image/gif"
          },
          {
            "@category": "thumbnail",
            "@height": "15",
            "@width": "36",
            "@_fa": "true",
            "$": "https://api.elsevier.com/content/object/eid/1-s2.0-S1381116909002866-si51.gif?httpAccept=%2A%2F%2A",
            "@multimediatype": "GIF image file",
            "@type": "ALTIMG",
            "@size": "218",
            "@ref": "si51",
            "@mimetype": "image/gif"
          },
          {
            "@category": "thumbnail",
            "@height": "20",
            "@width": "71",
            "@_fa": "true",
            "$": "https://api.elsevier.com/content/object/eid/1-s2.0-S1381116909002866-si50.gif?httpAccept=%2A%2F%2A",
            "@multimediatype": "GIF image file",
            "@type": "ALTIMG",
            "@size": "383",
            "@ref": "si50",
            "@mimetype": "image/gif"
          },
          {
            "@category": "thumbnail",
            "@height": "16",
            "@width": "58",
            "@_fa": "true",
            "$": "https://api.elsevier.com/content/object/eid/1-s2.0-S1381116909002866-si5.gif?httpAccept=%2A%2F%2A",
            "@multimediatype": "GIF image file",
            "@type": "ALTIMG",
            "@size": "287",
            "@ref": "si5",
            "@mimetype": "image/gif"
          },
          {
            "@category": "thumbnail",
            "@height": "16",
            "@width": "206",
            "@_fa": "true",
            "$": "https://api.elsevier.com/content/object/eid/1-s2.0-S1381116909002866-si49.gif?httpAccept=%2A%2F%2A",
            "@multimediatype": "GIF image file",
            "@type": "ALTIMG",
            "@size": "719",
            "@ref": "si49",
            "@mimetype": "image/gif"
          },
          {
            "@category": "thumbnail",
            "@height": "15",
            "@width": "36",
            "@_fa": "true",
            "$": "https://api.elsevier.com/content/object/eid/1-s2.0-S1381116909002866-si48.gif?httpAccept=%2A%2F%2A",
            "@multimediatype": "GIF image file",
            "@type": "ALTIMG",
            "@size": "218",
            "@ref": "si48",
            "@mimetype": "image/gif"
          },
          {
            "@category": "thumbnail",
            "@height": "15",
            "@width": "36",
            "@_fa": "true",
            "$": "https://api.elsevier.com/content/object/eid/1-s2.0-S1381116909002866-si47.gif?httpAccept=%2A%2F%2A",
            "@multimediatype": "GIF image file",
            "@type": "ALTIMG",
            "@size": "218",
            "@ref": "si47",
            "@mimetype": "image/gif"
          },
          {
            "@category": "thumbnail",
            "@height": "20",
            "@width": "76",
            "@_fa": "true",
            "$": "https://api.elsevier.com/content/object/eid/1-s2.0-S1381116909002866-si46.gif?httpAccept=%2A%2F%2A",
            "@multimediatype": "GIF image file",
            "@type": "ALTIMG",
            "@size": "400",
            "@ref": "si46",
            "@mimetype": "image/gif"
          },
          {
            "@category": "thumbnail",
            "@height": "24",
            "@width": "119",
            "@_fa": "true",
            "$": "https://api.elsevier.com/content/object/eid/1-s2.0-S1381116909002866-si45.gif?httpAccept=%2A%2F%2A",
            "@multimediatype": "GIF image file",
            "@type": "ALTIMG",
            "@size": "605",
            "@ref": "si45",
            "@mimetype": "image/gif"
          },
          {
            "@category": "thumbnail",
            "@height": "24",
            "@width": "84",
            "@_fa": "true",
            "$": "https://api.elsevier.com/content/object/eid/1-s2.0-S1381116909002866-si44.gif?httpAccept=%2A%2F%2A",
            "@multimediatype": "GIF image file",
            "@type": "ALTIMG",
            "@size": "489",
            "@ref": "si44",
            "@mimetype": "image/gif"
          },
          {
            "@category": "thumbnail",
            "@height": "16",
            "@width": "31",
            "@_fa": "true",
            "$": "https://api.elsevier.com/content/object/eid/1-s2.0-S1381116909002866-si43.gif?httpAccept=%2A%2F%2A",
            "@multimediatype": "GIF image file",
            "@type": "ALTIMG",
            "@size": "216",
            "@ref": "si43",
            "@mimetype": "image/gif"
          },
          {
            "@category": "thumbnail",
            "@height": "20",
            "@width": "31",
            "@_fa": "true",
            "$": "https://api.elsevier.com/content/object/eid/1-s2.0-S1381116909002866-si42.gif?httpAccept=%2A%2F%2A",
            "@multimediatype": "GIF image file",
            "@type": "ALTIMG",
            "@size": "231",
            "@ref": "si42",
            "@mimetype": "image/gif"
          },
          {
            "@category": "thumbnail",
            "@height": "16",
            "@width": "152",
            "@_fa": "true",
            "$": "https://api.elsevier.com/content/object/eid/1-s2.0-S1381116909002866-si41.gif?httpAccept=%2A%2F%2A",
            "@multimediatype": "GIF image file",
            "@type": "ALTIMG",
            "@size": "601",
            "@ref": "si41",
            "@mimetype": "image/gif"
          },
          {
            "@category": "thumbnail",
            "@height": "20",
            "@width": "161",
            "@_fa": "true",
            "$": "https://api.elsevier.com/content/object/eid/1-s2.0-S1381116909002866-si40.gif?httpAccept=%2A%2F%2A",
            "@multimediatype": "GIF image file",
            "@type": "ALTIMG",
            "@size": "669",
            "@ref": "si40",
            "@mimetype": "image/gif"
          },
          {
            "@category": "thumbnail",
            "@height": "16",
            "@width": "58",
            "@_fa": "true",
            "$": "https://api.elsevier.com/content/object/eid/1-s2.0-S1381116909002866-si4.gif?httpAccept=%2A%2F%2A",
            "@multimediatype": "GIF image file",
            "@type": "ALTIMG",
            "@size": "287",
            "@ref": "si4",
            "@mimetype": "image/gif"
          },
          {
            "@category": "thumbnail",
            "@height": "16",
            "@width": "100",
            "@_fa": "true",
            "$": "https://api.elsevier.com/content/object/eid/1-s2.0-S1381116909002866-si39.gif?httpAccept=%2A%2F%2A",
            "@multimediatype": "GIF image file",
            "@type": "ALTIMG",
            "@size": "424",
            "@ref": "si39",
            "@mimetype": "image/gif"
          },
          {
            "@category": "thumbnail",
            "@height": "103",
            "@width": "407",
            "@_fa": "true",
            "$": "https://api.elsevier.com/content/object/eid/1-s2.0-S1381116909002866-si38.gif?httpAccept=%2A%2F%2A",
            "@multimediatype": "GIF image file",
            "@type": "ALTIMG",
            "@size": "3570",
            "@ref": "si38",
            "@mimetype": "image/gif"
          },
          {
            "@category": "thumbnail",
            "@height": "91",
            "@width": "483",
            "@_fa": "true",
            "$": "https://api.elsevier.com/content/object/eid/1-s2.0-S1381116909002866-si37.gif?httpAccept=%2A%2F%2A",
            "@multimediatype": "GIF image file",
            "@type": "ALTIMG",
            "@size": "3643",
            "@ref": "si37",
            "@mimetype": "image/gif"
          },
          {
            "@category": "thumbnail",
            "@height": "50",
            "@width": "488",
            "@_fa": "true",
            "$": "https://api.elsevier.com/content/object/eid/1-s2.0-S1381116909002866-si36.gif?httpAccept=%2A%2F%2A",
            "@multimediatype": "GIF image file",
            "@type": "ALTIMG",
            "@size": "3330",
            "@ref": "si36",
            "@mimetype": "image/gif"
          },
          {
            "@category": "thumbnail",
            "@height": "44",
            "@width": "418",
            "@_fa": "true",
            "$": "https://api.elsevier.com/content/object/eid/1-s2.0-S1381116909002866-si35.gif?httpAccept=%2A%2F%2A",
            "@multimediatype": "GIF image file",
            "@type": "ALTIMG",
            "@size": "1476",
            "@ref": "si35",
            "@mimetype": "image/gif"
          },
          {
            "@category": "thumbnail",
            "@height": "103",
            "@width": "300",
            "@_fa": "true",
            "$": "https://api.elsevier.com/content/object/eid/1-s2.0-S1381116909002866-si34.gif?httpAccept=%2A%2F%2A",
            "@multimediatype": "GIF image file",
            "@type": "ALTIMG",
            "@size": "2857",
            "@ref": "si34",
            "@mimetype": "image/gif"
          },
          {
            "@category": "thumbnail",
            "@height": "44",
            "@width": "371",
            "@_fa": "true",
            "$": "https://api.elsevier.com/content/object/eid/1-s2.0-S1381116909002866-si33.gif?httpAccept=%2A%2F%2A",
            "@multimediatype": "GIF image file",
            "@type": "ALTIMG",
            "@size": "2278",
            "@ref": "si33",
            "@mimetype": "image/gif"
          },
          {
            "@category": "thumbnail",
            "@height": "88",
            "@width": "437",
            "@_fa": "true",
            "$": "https://api.elsevier.com/content/object/eid/1-s2.0-S1381116909002866-si32.gif?httpAccept=%2A%2F%2A",
            "@multimediatype": "GIF image file",
            "@type": "ALTIMG",
            "@size": "2743",
            "@ref": "si32",
            "@mimetype": "image/gif"
          },
          {
            "@category": "thumbnail",
            "@height": "102",
            "@width": "372",
            "@_fa": "true",
            "$": "https://api.elsevier.com/content/object/eid/1-s2.0-S1381116909002866-si31.gif?httpAccept=%2A%2F%2A",
            "@multimediatype": "GIF image file",
            "@type": "ALTIMG",
            "@size": "2583",
            "@ref": "si31",
            "@mimetype": "image/gif"
          },
          {
            "@category": "thumbnail",
            "@height": "40",
            "@width": "475",
            "@_fa": "true",
            "$": "https://api.elsevier.com/content/object/eid/1-s2.0-S1381116909002866-si30.gif?httpAccept=%2A%2F%2A",
            "@multimediatype": "GIF image file",
            "@type": "ALTIMG",
            "@size": "2006",
            "@ref": "si30",
            "@mimetype": "image/gif"
          },
          {
            "@category": "thumbnail",
            "@height": "16",
            "@width": "58",
            "@_fa": "true",
            "$": "https://api.elsevier.com/content/object/eid/1-s2.0-S1381116909002866-si3.gif?httpAccept=%2A%2F%2A",
            "@multimediatype": "GIF image file",
            "@type": "ALTIMG",
            "@size": "287",
            "@ref": "si3",
            "@mimetype": "image/gif"
          },
          {
            "@category": "thumbnail",
            "@height": "39",
            "@width": "324",
            "@_fa": "true",
            "$": "https://api.elsevier.com/content/object/eid/1-s2.0-S1381116909002866-si29.gif?httpAccept=%2A%2F%2A",
            "@multimediatype": "GIF image file",
            "@type": "ALTIMG",
            "@size": "1501",
            "@ref": "si29",
            "@mimetype": "image/gif"
          },
          {
            "@category": "thumbnail",
            "@height": "37",
            "@width": "281",
            "@_fa": "true",
            "$": "https://api.elsevier.com/content/object/eid/1-s2.0-S1381116909002866-si28.gif?httpAccept=%2A%2F%2A",
            "@multimediatype": "GIF image file",
            "@type": "ALTIMG",
            "@size": "992",
            "@ref": "si28",
            "@mimetype": "image/gif"
          },
          {
            "@category": "thumbnail",
            "@height": "15",
            "@width": "36",
            "@_fa": "true",
            "$": "https://api.elsevier.com/content/object/eid/1-s2.0-S1381116909002866-si27.gif?httpAccept=%2A%2F%2A",
            "@multimediatype": "GIF image file",
            "@type": "ALTIMG",
            "@size": "217",
            "@ref": "si27",
            "@mimetype": "image/gif"
          },
          {
            "@category": "thumbnail",
            "@height": "15",
            "@width": "36",
            "@_fa": "true",
            "$": "https://api.elsevier.com/content/object/eid/1-s2.0-S1381116909002866-si26.gif?httpAccept=%2A%2F%2A",
            "@multimediatype": "GIF image file",
            "@type": "ALTIMG",
            "@size": "217",
            "@ref": "si26",
            "@mimetype": "image/gif"
          },
          {
            "@category": "thumbnail",
            "@height": "22",
            "@width": "37",
            "@_fa": "true",
            "$": "https://api.elsevier.com/content/object/eid/1-s2.0-S1381116909002866-si25.gif?httpAccept=%2A%2F%2A",
            "@multimediatype": "GIF image file",
            "@type": "ALTIMG",
            "@size": "265",
            "@ref": "si25",
            "@mimetype": "image/gif"
          },
          {
            "@category": "thumbnail",
            "@height": "38",
            "@width": "432",
            "@_fa": "true",
            "$": "https://api.elsevier.com/content/object/eid/1-s2.0-S1381116909002866-si24.gif?httpAccept=%2A%2F%2A",
            "@multimediatype": "GIF image file",
            "@type": "ALTIMG",
            "@size": "1577",
            "@ref": "si24",
            "@mimetype": "image/gif"
          },
          {
            "@category": "thumbnail",
            "@height": "20",
            "@width": "127",
            "@_fa": "true",
            "$": "https://api.elsevier.com/content/object/eid/1-s2.0-S1381116909002866-si23.gif?httpAccept=%2A%2F%2A",
            "@multimediatype": "GIF image file",
            "@type": "ALTIMG",
            "@size": "399",
            "@ref": "si23",
            "@mimetype": "image/gif"
          },
          {
            "@category": "thumbnail",
            "@height": "21",
            "@width": "244",
            "@_fa": "true",
            "$": "https://api.elsevier.com/content/object/eid/1-s2.0-S1381116909002866-si22.gif?httpAccept=%2A%2F%2A",
            "@multimediatype": "GIF image file",
            "@type": "ALTIMG",
            "@size": "869",
            "@ref": "si22",
            "@mimetype": "image/gif"
          },
          {
            "@category": "thumbnail",
            "@height": "50",
            "@width": "227",
            "@_fa": "true",
            "$": "https://api.elsevier.com/content/object/eid/1-s2.0-S1381116909002866-si21.gif?httpAccept=%2A%2F%2A",
            "@multimediatype": "GIF image file",
            "@type": "ALTIMG",
            "@size": "1255",
            "@ref": "si21",
            "@mimetype": "image/gif"
          },
          {
            "@category": "thumbnail",
            "@height": "42",
            "@width": "221",
            "@_fa": "true",
            "$": "https://api.elsevier.com/content/object/eid/1-s2.0-S1381116909002866-si20.gif?httpAccept=%2A%2F%2A",
            "@multimediatype": "GIF image file",
            "@type": "ALTIMG",
            "@size": "1086",
            "@ref": "si20",
            "@mimetype": "image/gif"
          },
          {
            "@category": "thumbnail",
            "@height": "16",
            "@width": "58",
            "@_fa": "true",
            "$": "https://api.elsevier.com/content/object/eid/1-s2.0-S1381116909002866-si2.gif?httpAccept=%2A%2F%2A",
            "@multimediatype": "GIF image file",
            "@type": "ALTIMG",
            "@size": "287",
            "@ref": "si2",
            "@mimetype": "image/gif"
          },
          {
            "@category": "thumbnail",
            "@height": "48",
            "@width": "227",
            "@_fa": "true",
            "$": "https://api.elsevier.com/content/object/eid/1-s2.0-S1381116909002866-si19.gif?httpAccept=%2A%2F%2A",
            "@multimediatype": "GIF image file",
            "@type": "ALTIMG",
            "@size": "1201",
            "@ref": "si19",
            "@mimetype": "image/gif"
          },
          {
            "@category": "thumbnail",
            "@height": "21",
            "@width": "210",
            "@_fa": "true",
            "$": "https://api.elsevier.com/content/object/eid/1-s2.0-S1381116909002866-si18.gif?httpAccept=%2A%2F%2A",
            "@multimediatype": "GIF image file",
            "@type": "ALTIMG",
            "@size": "833",
            "@ref": "si18",
            "@mimetype": "image/gif"
          },
          {
            "@category": "thumbnail",
            "@height": "17",
            "@width": "148",
            "@_fa": "true",
            "$": "https://api.elsevier.com/content/object/eid/1-s2.0-S1381116909002866-si17.gif?httpAccept=%2A%2F%2A",
            "@multimediatype": "GIF image file",
            "@type": "ALTIMG",
            "@size": "541",
            "@ref": "si17",
            "@mimetype": "image/gif"
          },
          {
            "@category": "thumbnail",
            "@height": "15",
            "@width": "87",
            "@_fa": "true",
            "$": "https://api.elsevier.com/content/object/eid/1-s2.0-S1381116909002866-si16.gif?httpAccept=%2A%2F%2A",
            "@multimediatype": "GIF image file",
            "@type": "ALTIMG",
            "@size": "405",
            "@ref": "si16",
            "@mimetype": "image/gif"
          },
          {
            "@category": "thumbnail",
            "@height": "16",
            "@width": "46",
            "@_fa": "true",
            "$": "https://api.elsevier.com/content/object/eid/1-s2.0-S1381116909002866-si15.gif?httpAccept=%2A%2F%2A",
            "@multimediatype": "GIF image file",
            "@type": "ALTIMG",
            "@size": "274",
            "@ref": "si15",
            "@mimetype": "image/gif"
          },
          {
            "@category": "thumbnail",
            "@height": "43",
            "@width": "474",
            "@_fa": "true",
            "$": "https://api.elsevier.com/content/object/eid/1-s2.0-S1381116909002866-si14.gif?httpAccept=%2A%2F%2A",
            "@multimediatype": "GIF image file",
            "@type": "ALTIMG",
            "@size": "2320",
            "@ref": "si14",
            "@mimetype": "image/gif"
          },
          {
            "@category": "thumbnail",
            "@height": "16",
            "@width": "167",
            "@_fa": "true",
            "$": "https://api.elsevier.com/content/object/eid/1-s2.0-S1381116909002866-si13.gif?httpAccept=%2A%2F%2A",
            "@multimediatype": "GIF image file",
            "@type": "ALTIMG",
            "@size": "623",
            "@ref": "si13",
            "@mimetype": "image/gif"
          },
          {
            "@category": "thumbnail",
            "@height": "16",
            "@width": "164",
            "@_fa": "true",
            "$": "https://api.elsevier.com/content/object/eid/1-s2.0-S1381116909002866-si12.gif?httpAccept=%2A%2F%2A",
            "@multimediatype": "GIF image file",
            "@type": "ALTIMG",
            "@size": "619",
            "@ref": "si12",
            "@mimetype": "image/gif"
          },
          {
            "@category": "thumbnail",
            "@height": "16",
            "@width": "132",
            "@_fa": "true",
            "$": "https://api.elsevier.com/content/object/eid/1-s2.0-S1381116909002866-si11.gif?httpAccept=%2A%2F%2A",
            "@multimediatype": "GIF image file",
            "@type": "ALTIMG",
            "@size": "526",
            "@ref": "si11",
            "@mimetype": "image/gif"
          },
          {
            "@category": "thumbnail",
            "@height": "16",
            "@width": "174",
            "@_fa": "true",
            "$": "https://api.elsevier.com/content/object/eid/1-s2.0-S1381116909002866-si10.gif?httpAccept=%2A%2F%2A",
            "@multimediatype": "GIF image file",
            "@type": "ALTIMG",
            "@size": "675",
            "@ref": "si10",
            "@mimetype": "image/gif"
          },
          {
            "@category": "thumbnail",
            "@height": "16",
            "@width": "58",
            "@_fa": "true",
            "$": "https://api.elsevier.com/content/object/eid/1-s2.0-S1381116909002866-si1.gif?httpAccept=%2A%2F%2A",
            "@multimediatype": "GIF image file",
            "@type": "ALTIMG",
            "@size": "287",
            "@ref": "si1",
            "@mimetype": "image/gif"
          },
          {
            "@category": "standard",
            "@height": "251",
            "@width": "376",
            "@_fa": "true",
            "$": "https://api.elsevier.com/content/object/eid/1-s2.0-S1381116909002866-gr1.jpg?httpAccept=%2A%2F%2A",
            "@multimediatype": "JPEG image file",
            "@type": "IMAGE-DOWNSAMPLED",
            "@size": "18239",
            "@ref": "gr1",
            "@mimetype": "image/jpeg"
          },
          {
            "@category": "thumbnail",
            "@height": "146",
            "@width": "219",
            "@_fa": "true",
            "$": "https://api.elsevier.com/content/object/eid/1-s2.0-S1381116909002866-gr1.sml?httpAccept=%2A%2F%2A",
            "@multimediatype": "GIF image file",
            "@type": "IMAGE-THUMBNAIL",
            "@size": "3273",
            "@ref": "gr1",
            "@mimetype": "image/gif"
          },
          {
            "@category": "standard",
            "@height": "286",
            "@width": "376",
            "@_fa": "true",
            "$": "https://api.elsevier.com/content/object/eid/1-s2.0-S1381116909002866-gr2.jpg?httpAccept=%2A%2F%2A",
            "@multimediatype": "JPEG image file",
            "@type": "IMAGE-DOWNSAMPLED",
            "@size": "15886",
            "@ref": "gr2",
            "@mimetype": "image/jpeg"
          },
          {
            "@category": "thumbnail",
            "@height": "164",
            "@width": "216",
            "@_fa": "true",
            "$": "https://api.elsevier.com/content/object/eid/1-s2.0-S1381116909002866-gr2.sml?httpAccept=%2A%2F%2A",
            "@multimediatype": "GIF image file",
            "@type": "IMAGE-THUMBNAIL",
            "@size": "2746",
            "@ref": "gr2",
            "@mimetype": "image/gif"
          },
          {
            "@category": "standard",
            "@height": "288",
            "@width": "376",
            "@_fa": "true",
            "$": "https://api.elsevier.com/content/object/eid/1-s2.0-S1381116909002866-gr3.jpg?httpAccept=%2A%2F%2A",
            "@multimediatype": "JPEG image file",
            "@type": "IMAGE-DOWNSAMPLED",
            "@size": "11823",
            "@ref": "gr3",
            "@mimetype": "image/jpeg"
          },
          {
            "@category": "thumbnail",
            "@height": "164",
            "@width": "214",
            "@_fa": "true",
            "$": "https://api.elsevier.com/content/object/eid/1-s2.0-S1381116909002866-gr3.sml?httpAccept=%2A%2F%2A",
            "@multimediatype": "GIF image file",
            "@type": "IMAGE-THUMBNAIL",
            "@size": "2145",
            "@ref": "gr3",
            "@mimetype": "image/gif"
          },
          {
            "@category": "standard",
            "@height": "312",
            "@width": "373",
            "@_fa": "true",
            "$": "https://api.elsevier.com/content/object/eid/1-s2.0-S1381116909002866-gr4.jpg?httpAccept=%2A%2F%2A",
            "@multimediatype": "JPEG image file",
            "@type": "IMAGE-DOWNSAMPLED",
            "@size": "15465",
            "@ref": "gr4",
            "@mimetype": "image/jpeg"
          },
          {
            "@category": "thumbnail",
            "@height": "164",
            "@width": "196",
            "@_fa": "true",
            "$": "https://api.elsevier.com/content/object/eid/1-s2.0-S1381116909002866-gr4.sml?httpAccept=%2A%2F%2A",
            "@multimediatype": "GIF image file",
            "@type": "IMAGE-THUMBNAIL",
            "@size": "2495",
            "@ref": "gr4",
            "@mimetype": "image/gif"
          },
          {
            "@category": "standard",
            "@height": "187",
            "@width": "287",
            "@_fa": "true",
            "$": "https://api.elsevier.com/content/object/eid/1-s2.0-S1381116909002866-fx1.jpg?httpAccept=%2A%2F%2A",
            "@multimediatype": "JPEG image file",
            "@type": "IMAGE-DOWNSAMPLED",
            "@size": "12961",
            "@ref": "fx1",
            "@mimetype": "image/jpeg"
          },
          {
            "@category": "thumbnail",
            "@height": "143",
            "@width": "219",
            "@_fa": "true",
            "$": "https://api.elsevier.com/content/object/eid/1-s2.0-S1381116909002866-fx1.sml?httpAccept=%2A%2F%2A",
            "@multimediatype": "GIF image file",
            "@type": "IMAGE-THUMBNAIL",
            "@size": "3449",
            "@ref": "fx1",
            "@mimetype": "image/gif"
          }
        ]
      },
      "link": {
        "@rel": "abstract",
        "@href": "https://api.elsevier.com/content/abstract/scopus_id/71649103299"
      }
    }
  }
}