{
  "metadata": {
    "title": "Liquid-phase alkylation of phenol with long-chain olefins over WO<ce:inf loc=post><ce:italic>x</ce:italic></ce:inf>/ZrO<ce:inf loc=post>2</ce:inf> solid acid catalysts",
    "authors": "; ; ",
    "journal": "Journal of Molecular Catalysis A: Chemical",
    "date": "2005-10-03",
    "doi": "10.1016/j.molcata.2005.06.046",
    "abstract": "",
    "uri": "https://api.elsevier.com/content/article/pii/S1381116905004565",
    "pii": "S1381116905004565"
  },
  "fulltext": {
    "full-text-retrieval-response": {
      "scopus-eid": "2-s2.0-24144496448",
      "originalText": "serial JL 271358 291210 291744 291790 291809 31 Journal of Molecular Catalysis A: Chemical JOURNALMOLECULARCATALYSISACHEMICAL 2005-08-02 2005-08-02 2010-04-19T04:56:56 1-s2.0-S1381116905004565 S1381-1169(05)00456-5 S1381116905004565 10.1016/j.molcata.2005.06.046 S300 S300.1 FULL-TEXT 1-s2.0-S1381116905X02205 2015-05-15T05:56:33.000448-04:00 0 0 20051003 2005 2005-08-02T00:00:00Z articleinfo crossmark dco dateupdated tomb dateloaded datesearch indexeddate issuelist volumelist yearnav absattachment articletitlenorm authfirstinitialnorm authfirstsurnamenorm cid cids contenttype copyright dateloadedtxt docsubtype doctype doi eid ewtransactionid hubeid issfirst issn issnnorm itemstage itemtransactionid itemweight openaccess openarchive pg pgfirst pglast pii piinorm pubdatestart pubdatetxt pubyr sortorder srctitle srctitlenorm srctype subheadings volfirst volissue webpdf webpdfpagecount figure table body mmlmath acknowledge affil articletitle auth authfirstini authfull authkeywords authlast primabst ref specialabst alllist content subj ssids 1381-1169 13811169 240 240 1 2 1 2 Volume 240, Issues 1–2 21 123 131 123 131 20051003 3 October 2005 2005-10-03 2005 article fla Copyright © 2005 Elsevier B.V. All rights reserved. LIQUIDPHASEALKYLATIONPHENOLLONGCHAINOLEFINSOVERWOXZRO2SOLIDACIDCATALYSTS SARISH S 1 Introduction 2 Experimental 2.1 Chemicals 2.2 Catalyst preparation 2.3 Characterization 2.4 Catalytic activity 3 Results and discussion 3.1 Characterization of the catalysts 3.1.1 Surface area 3.1.2 X-ray diffraction 3.1.3 FTIR spectroscopy 3.2 Catalytic activity 3.2.1 Effect of WO3 loading 3.2.2 Effect of calcination temperature 3.2.3 Effect of reaction temperature 3.2.4 Effect of molar ratio 3.2.5 Effect of catalyst weight 3.2.6 Catalyst recycling 3.2.7 Comparison with zeolite Hβ and sulfated zirconia 4 Conclusions Acknowledgements References VOGES 1991 328 H ULLMANNSENCYCLOPEDIAINDUSTRIALCHEMISTRY PATINKIN 1964 75 S FRIEDELCRAFTSRELATEDREACTIONSPART1 ROBERTS 1984 R FRIEDELCRAFTSALKYLATIONCHEMISTRY REED 1978 72 H KIRKOTHMERENCYCLOPEDIACHEMICALTECHNOLOGY REED 1978 65 H KIRKOTHMERENCYCLOPEDIACHEMICALTECHNOLOGY HARMER 2001 45 M RAJADHYAKSHA 1988 1379 R CAMPBELL 1990 3665 C DECASTRO 2000 86 C YADAV 1999 1 G SREENIVASAN 1995 123 R HINO 1988 1259 M KUBA 2003 353 S TORAYA 1984 C119 H IGLESIA 1993 238 E SCHEITHAUER 1998 3019 M BOYSE 1997 191 R BAERTSCH 2001 1320 C YAMAGUSHI 1986 67 T SHON 1998 6140 J MACHT 2004 470 J SARISHX2005X123 SARISHX2005X123X131 SARISHX2005X123XS SARISHX2005X123X131XS item S1381-1169(05)00456-5 S1381116905004565 1-s2.0-S1381116905004565 10.1016/j.molcata.2005.06.046 271358 2010-10-10T21:04:40.407169-04:00 2005-10-03 1-s2.0-S1381116905004565-main.pdf https://s3.amazonaws.com/prod-ucs-content-store-us-east/content/pii:S1381116905004565/MAIN/application/pdf/c765651910862346126fa9c0b0a96d50/main.pdf https://s3-eu-west-1.amazonaws.com/prod-ucs-content-store-eu-west/content/pii:S1381116905004565/MAIN/application/pdf/c765651910862346126fa9c0b0a96d50/main.pdf main.pdf pdf true 689154 MAIN 9 1-s2.0-S1381116905004565-main_1.png https://s3.amazonaws.com/prod-ucs-content-store-us-east/content/pii:S1381116905004565/PREVIEW/image/png/e33e1cf9407afff652725c3673c29e2b/main_1.png https://s3-eu-west-1.amazonaws.com/prod-ucs-content-store-eu-west/content/pii:S1381116905004565/PREVIEW/image/png/e33e1cf9407afff652725c3673c29e2b/main_1.png main_1.png png 65794 849 656 IMAGE-WEB-PDF 1 1-s2.0-S1381116905004565-si2.gif https://s3.amazonaws.com/prod-ucs-content-store-us-east/content/pii:S1381116905004565/STRIPIN/image/gif/d7778a584392ebe434a4bc9e767732bc/si2.gif https://s3-eu-west-1.amazonaws.com/prod-ucs-content-store-eu-west/content/pii:S1381116905004565/STRIPIN/image/gif/d7778a584392ebe434a4bc9e767732bc/si2.gif si2 si2.gif gif 1165 38 246 ALTIMG 1-s2.0-S1381116905004565-si1.gif https://s3.amazonaws.com/prod-ucs-content-store-us-east/content/pii:S1381116905004565/STRIPIN/image/gif/9552be46d75190668fca2cf979244f1c/si1.gif https://s3-eu-west-1.amazonaws.com/prod-ucs-content-store-eu-west/content/pii:S1381116905004565/STRIPIN/image/gif/9552be46d75190668fca2cf979244f1c/si1.gif si1 si1.gif gif 1250 40 294 ALTIMG 1-s2.0-S1381116905004565-gr4.jpg https://s3.amazonaws.com/prod-ucs-content-store-us-east/content/pii:S1381116905004565/gr4/DOWNSAMPLED/image/jpeg/4cd7d423017f4303ddb86fbe09f1d4db/gr4.jpg https://s3-eu-west-1.amazonaws.com/prod-ucs-content-store-eu-west/content/pii:S1381116905004565/gr4/DOWNSAMPLED/image/jpeg/4cd7d423017f4303ddb86fbe09f1d4db/gr4.jpg gr4 gr4.jpg jpg 43943 355 489 IMAGE-DOWNSAMPLED 1-s2.0-S1381116905004565-gr4.sml https://s3.amazonaws.com/prod-ucs-content-store-us-east/content/pii:S1381116905004565/gr4/THUMBNAIL/image/gif/2ea53cb017e6d8a878603c5cec67edcf/gr4.sml https://s3-eu-west-1.amazonaws.com/prod-ucs-content-store-eu-west/content/pii:S1381116905004565/gr4/THUMBNAIL/image/gif/2ea53cb017e6d8a878603c5cec67edcf/gr4.sml gr4 gr4.sml sml 3316 91 125 IMAGE-THUMBNAIL 1-s2.0-S1381116905004565-gr7.jpg https://s3.amazonaws.com/prod-ucs-content-store-us-east/content/pii:S1381116905004565/gr7/DOWNSAMPLED/image/jpeg/0f0dddbbffe6ec15b6b0cc6b8ef9189d/gr7.jpg https://s3-eu-west-1.amazonaws.com/prod-ucs-content-store-eu-west/content/pii:S1381116905004565/gr7/DOWNSAMPLED/image/jpeg/0f0dddbbffe6ec15b6b0cc6b8ef9189d/gr7.jpg gr7 gr7.jpg jpg 54748 396 496 IMAGE-DOWNSAMPLED 1-s2.0-S1381116905004565-gr7.sml https://s3.amazonaws.com/prod-ucs-content-store-us-east/content/pii:S1381116905004565/gr7/THUMBNAIL/image/gif/56831c8e5b7709fd3aabdb3c04fb2da4/gr7.sml https://s3-eu-west-1.amazonaws.com/prod-ucs-content-store-eu-west/content/pii:S1381116905004565/gr7/THUMBNAIL/image/gif/56831c8e5b7709fd3aabdb3c04fb2da4/gr7.sml gr7 gr7.sml sml 3619 93 117 IMAGE-THUMBNAIL 1-s2.0-S1381116905004565-gr3.jpg https://s3.amazonaws.com/prod-ucs-content-store-us-east/content/pii:S1381116905004565/gr3/DOWNSAMPLED/image/jpeg/27b2b391cc0dbff4bbb22693aefe7f62/gr3.jpg https://s3-eu-west-1.amazonaws.com/prod-ucs-content-store-eu-west/content/pii:S1381116905004565/gr3/DOWNSAMPLED/image/jpeg/27b2b391cc0dbff4bbb22693aefe7f62/gr3.jpg gr3 gr3.jpg jpg 15020 286 341 IMAGE-DOWNSAMPLED 1-s2.0-S1381116905004565-gr3.sml https://s3.amazonaws.com/prod-ucs-content-store-us-east/content/pii:S1381116905004565/gr3/THUMBNAIL/image/gif/b6d66ca67d3b4c7a6d2071cc781464c8/gr3.sml https://s3-eu-west-1.amazonaws.com/prod-ucs-content-store-eu-west/content/pii:S1381116905004565/gr3/THUMBNAIL/image/gif/b6d66ca67d3b4c7a6d2071cc781464c8/gr3.sml gr3 gr3.sml sml 2041 93 111 IMAGE-THUMBNAIL 1-s2.0-S1381116905004565-gr1.jpg https://s3.amazonaws.com/prod-ucs-content-store-us-east/content/pii:S1381116905004565/gr1/DOWNSAMPLED/image/jpeg/f7ea8af712efe2b44da856cfc3b8e296/gr1.jpg https://s3-eu-west-1.amazonaws.com/prod-ucs-content-store-eu-west/content/pii:S1381116905004565/gr1/DOWNSAMPLED/image/jpeg/f7ea8af712efe2b44da856cfc3b8e296/gr1.jpg gr1 gr1.jpg jpg 53485 359 496 IMAGE-DOWNSAMPLED 1-s2.0-S1381116905004565-gr1.sml https://s3.amazonaws.com/prod-ucs-content-store-us-east/content/pii:S1381116905004565/gr1/THUMBNAIL/image/gif/e7067869bdfb1519f34b8b1cb48da764/gr1.sml https://s3-eu-west-1.amazonaws.com/prod-ucs-content-store-eu-west/content/pii:S1381116905004565/gr1/THUMBNAIL/image/gif/e7067869bdfb1519f34b8b1cb48da764/gr1.sml gr1 gr1.sml sml 3699 90 125 IMAGE-THUMBNAIL 1-s2.0-S1381116905004565-gr11.jpg https://s3.amazonaws.com/prod-ucs-content-store-us-east/content/pii:S1381116905004565/gr11/DOWNSAMPLED/image/jpeg/975a67f6e4bef314639822a3a8e3eeb7/gr11.jpg https://s3-eu-west-1.amazonaws.com/prod-ucs-content-store-eu-west/content/pii:S1381116905004565/gr11/DOWNSAMPLED/image/jpeg/975a67f6e4bef314639822a3a8e3eeb7/gr11.jpg gr11 gr11.jpg jpg 39936 381 494 IMAGE-DOWNSAMPLED 1-s2.0-S1381116905004565-gr11.sml https://s3.amazonaws.com/prod-ucs-content-store-us-east/content/pii:S1381116905004565/gr11/THUMBNAIL/image/gif/cb40ed7236d16c3a2ebe608859faf2be/gr11.sml https://s3-eu-west-1.amazonaws.com/prod-ucs-content-store-eu-west/content/pii:S1381116905004565/gr11/THUMBNAIL/image/gif/cb40ed7236d16c3a2ebe608859faf2be/gr11.sml gr11 gr11.sml sml 2947 93 121 IMAGE-THUMBNAIL 1-s2.0-S1381116905004565-gr5.jpg https://s3.amazonaws.com/prod-ucs-content-store-us-east/content/pii:S1381116905004565/gr5/DOWNSAMPLED/image/jpeg/469bd4ca650a4ff2d90f43fa000f7dd6/gr5.jpg https://s3-eu-west-1.amazonaws.com/prod-ucs-content-store-eu-west/content/pii:S1381116905004565/gr5/DOWNSAMPLED/image/jpeg/469bd4ca650a4ff2d90f43fa000f7dd6/gr5.jpg gr5 gr5.jpg jpg 43230 395 497 IMAGE-DOWNSAMPLED 1-s2.0-S1381116905004565-gr5.sml https://s3.amazonaws.com/prod-ucs-content-store-us-east/content/pii:S1381116905004565/gr5/THUMBNAIL/image/gif/85e13e4ed39c6b196e14bc077b0ac22d/gr5.sml https://s3-eu-west-1.amazonaws.com/prod-ucs-content-store-eu-west/content/pii:S1381116905004565/gr5/THUMBNAIL/image/gif/85e13e4ed39c6b196e14bc077b0ac22d/gr5.sml gr5 gr5.sml sml 3034 94 118 IMAGE-THUMBNAIL 1-s2.0-S1381116905004565-gr2.jpg https://s3.amazonaws.com/prod-ucs-content-store-us-east/content/pii:S1381116905004565/gr2/DOWNSAMPLED/image/jpeg/8f53693def807fc83cd5f5ae4c81de89/gr2.jpg https://s3-eu-west-1.amazonaws.com/prod-ucs-content-store-eu-west/content/pii:S1381116905004565/gr2/DOWNSAMPLED/image/jpeg/8f53693def807fc83cd5f5ae4c81de89/gr2.jpg gr2 gr2.jpg jpg 54564 376 466 IMAGE-DOWNSAMPLED 1-s2.0-S1381116905004565-gr2.sml https://s3.amazonaws.com/prod-ucs-content-store-us-east/content/pii:S1381116905004565/gr2/THUMBNAIL/image/gif/53558c54b11d428100272e70b1280c05/gr2.sml https://s3-eu-west-1.amazonaws.com/prod-ucs-content-store-eu-west/content/pii:S1381116905004565/gr2/THUMBNAIL/image/gif/53558c54b11d428100272e70b1280c05/gr2.sml gr2 gr2.sml sml 3045 94 116 IMAGE-THUMBNAIL 1-s2.0-S1381116905004565-gr8.jpg https://s3.amazonaws.com/prod-ucs-content-store-us-east/content/pii:S1381116905004565/gr8/DOWNSAMPLED/image/jpeg/a138607b2c1abd4682b026523983c3d9/gr8.jpg https://s3-eu-west-1.amazonaws.com/prod-ucs-content-store-eu-west/content/pii:S1381116905004565/gr8/DOWNSAMPLED/image/jpeg/a138607b2c1abd4682b026523983c3d9/gr8.jpg gr8 gr8.jpg jpg 41625 392 497 IMAGE-DOWNSAMPLED 1-s2.0-S1381116905004565-gr8.sml https://s3.amazonaws.com/prod-ucs-content-store-us-east/content/pii:S1381116905004565/gr8/THUMBNAIL/image/gif/9adcf154d6c0bab6b1ec1ec8dd4f40de/gr8.sml https://s3-eu-west-1.amazonaws.com/prod-ucs-content-store-eu-west/content/pii:S1381116905004565/gr8/THUMBNAIL/image/gif/9adcf154d6c0bab6b1ec1ec8dd4f40de/gr8.sml gr8 gr8.sml sml 2979 94 119 IMAGE-THUMBNAIL 1-s2.0-S1381116905004565-gr10.jpg https://s3.amazonaws.com/prod-ucs-content-store-us-east/content/pii:S1381116905004565/gr10/DOWNSAMPLED/image/jpeg/ac539ff5b1f7945ecec120f5cd84782c/gr10.jpg https://s3-eu-west-1.amazonaws.com/prod-ucs-content-store-eu-west/content/pii:S1381116905004565/gr10/DOWNSAMPLED/image/jpeg/ac539ff5b1f7945ecec120f5cd84782c/gr10.jpg gr10 gr10.jpg jpg 46778 381 482 IMAGE-DOWNSAMPLED 1-s2.0-S1381116905004565-gr10.sml https://s3.amazonaws.com/prod-ucs-content-store-us-east/content/pii:S1381116905004565/gr10/THUMBNAIL/image/gif/dac1b0320da9730bf0478ed035274354/gr10.sml https://s3-eu-west-1.amazonaws.com/prod-ucs-content-store-eu-west/content/pii:S1381116905004565/gr10/THUMBNAIL/image/gif/dac1b0320da9730bf0478ed035274354/gr10.sml gr10 gr10.sml sml 3366 93 118 IMAGE-THUMBNAIL 1-s2.0-S1381116905004565-gr9.jpg https://s3.amazonaws.com/prod-ucs-content-store-us-east/content/pii:S1381116905004565/gr9/DOWNSAMPLED/image/jpeg/2036377db053c58e19c15eca529fba36/gr9.jpg https://s3-eu-west-1.amazonaws.com/prod-ucs-content-store-eu-west/content/pii:S1381116905004565/gr9/DOWNSAMPLED/image/jpeg/2036377db053c58e19c15eca529fba36/gr9.jpg gr9 gr9.jpg jpg 47259 397 493 IMAGE-DOWNSAMPLED 1-s2.0-S1381116905004565-gr9.sml https://s3.amazonaws.com/prod-ucs-content-store-us-east/content/pii:S1381116905004565/gr9/THUMBNAIL/image/gif/eb11b88c14f0583a1b15b885ff184d58/gr9.sml https://s3-eu-west-1.amazonaws.com/prod-ucs-content-store-eu-west/content/pii:S1381116905004565/gr9/THUMBNAIL/image/gif/eb11b88c14f0583a1b15b885ff184d58/gr9.sml gr9 gr9.sml sml 3145 93 116 IMAGE-THUMBNAIL 1-s2.0-S1381116905004565-gr6.jpg https://s3.amazonaws.com/prod-ucs-content-store-us-east/content/pii:S1381116905004565/gr6/DOWNSAMPLED/image/jpeg/83edaa8944d54f14937bea7fa514116f/gr6.jpg https://s3-eu-west-1.amazonaws.com/prod-ucs-content-store-eu-west/content/pii:S1381116905004565/gr6/DOWNSAMPLED/image/jpeg/83edaa8944d54f14937bea7fa514116f/gr6.jpg gr6 gr6.jpg jpg 17160 281 340 IMAGE-DOWNSAMPLED 1-s2.0-S1381116905004565-gr6.sml https://s3.amazonaws.com/prod-ucs-content-store-us-east/content/pii:S1381116905004565/gr6/THUMBNAIL/image/gif/cde695a38bc8cc05e1a64c1df3e2b663/gr6.sml https://s3-eu-west-1.amazonaws.com/prod-ucs-content-store-eu-west/content/pii:S1381116905004565/gr6/THUMBNAIL/image/gif/cde695a38bc8cc05e1a64c1df3e2b663/gr6.sml gr6 gr6.sml sml 2156 93 113 IMAGE-THUMBNAIL 1-s2.0-S1381116905004565-fx1.gif https://s3.amazonaws.com/prod-ucs-content-store-us-east/content/pii:S1381116905004565/fx1/DOWNSAMPLED/image/gif/11163db2315b98f5261a9a015fe60924/fx1.gif https://s3-eu-west-1.amazonaws.com/prod-ucs-content-store-eu-west/content/pii:S1381116905004565/fx1/DOWNSAMPLED/image/gif/11163db2315b98f5261a9a015fe60924/fx1.gif fx1 true fx1.gif gif 4393 124 437 IMAGE-DOWNSAMPLED 1-s2.0-S1381116905004565-fx1.sml https://s3.amazonaws.com/prod-ucs-content-store-us-east/content/pii:S1381116905004565/fx1/THUMBNAIL/image/gif/c36622132c66bb6d947df6644aaf5f91/fx1.sml https://s3-eu-west-1.amazonaws.com/prod-ucs-content-store-eu-west/content/pii:S1381116905004565/fx1/THUMBNAIL/image/gif/c36622132c66bb6d947df6644aaf5f91/fx1.sml fx1 true fx1.sml sml 717 36 125 IMAGE-THUMBNAIL MOLCAA 5387 S1381-1169(05)00456-5 10.1016/j.molcata.2005.06.046 Elsevier B.V. Fig. 1 XRD patterns of (A) (a) ZrO2, (b) 5, (c) 10, (d) 15, (e) 20, (f) 25, and (g) 30 WZ-800 catalysts and (B) 15 WZ calcined at (a) 700°C, (b) 750°C, (c) 800°C, and (d) 850°C. Fig. 2 FTIR spectra of (A) (a) 5, (b) 10, (c) 15, (d) 20, (e) 25, and (f) 30 WZ-800 catalysts and (B) 15 WZ catalyst calcined at (a) 700°C, (b) 750°C, (c) 800°C, and (d) 850°C. Fig. 3 1R spectra of phenol/1-dodecene reaction product mixture. Fig. 4 Effect of WO3 loading on dodecene conversion and product selectivity. Conditions: temperature=70°C, total weight=10g, phenol/1-dodecene molar ratio=2, catalyst weight=3wt.%. Fig. 5 Effect of calcination temperature on dodecene conversion and product selectivity. Conditions: temperature=70°C, total weight=10g, phenol/1-dodecene molar ratio=2, catalyst weight=3wt.%. Fig. 6 TOF vs. surface density of catalysts with different WO3 loading calcined at 800°C and 15 WZ calcined at different temperatures. Fig. 7 Effect of reaction temperature on dodecene conversion and product selectivity. Conditions: total weight=10g, phenol/1-dodecene molar ratio=2, catalyst weight=3wt.%. Fig. 8 Effect of phenol/1-dodecene molar ratio on dodecene conversion and product selectivity. Conditions: temperature=70°C, total weight=10g, catalyst weight=3wt.%. Fig. 9 Effect of catalyst weight on dodecene conversion and product selectivity. Conditions: temperature=70°C, total weight=10g, phenol/1-dodecene molar ratio=2. Fig. 10 Recycling of the catalyst 15 WZ-800 in alkylation of phenol with 1-dodecene. Conditions: temperature=120°C, total weight=10g, phenol/1-dodecene molar ratio=2, catalyst weight=3wt.%. Fig. 11 Comparison of the catalytic activity of 15 WZ-800 with SZ-500 and Hβ zeolite. Conditions: temperature=70°C, total weight=10g, phenol/1-dodecene molar ratio=2, catalyst weight=3wt.%. Table 1 Surface area, surface density and phase composition of various catalysts Sample Surface area (m2 g−1) Surface density (Wnm−2) vol.% t-ZrO2 Z-800 12 0 6 5 WZ-800 38 3.9 9 10 WZ-800 54 5.5 66 15 WZ-800 61 7.3 93 20 WZ-800 55 10.9 89 25 WZ-800 50 14.9 96 30 WZ-800 48 18.7 95 15 WZ-700 84 5.3 100 15 WZ-750 70 6.4 95 15 WZ-850 44 10 19 Table 2 Alkylation of phenol with different 1-olefins catalyzed by 15 WZ-800 Alkene Conversion (wt.%) Selectivity (%) Monoalkyl phenol Dialkyl phenol Heavy products 1-Octene >99 79 21 0 1-Decene >99 93 0 7 1-Dodecene >99 90 0 10 Conditions: temperature=120°C, total weight=10g, phenol/1-olefin molar ratio=2, catalyst weight=3wt.%. Liquid-phase alkylation of phenol with long-chain olefins over WO x /ZrO2 solid acid catalysts S. Sarish a Biju M. Devassy b Walter Böhringer c Jack Fletcher c S.B. Halligudi b * a Cochin University of Science and Technology, Kochi 682022, India b Inorganic Chemistry and Catalysis Division, National Chemical Laboratory, Pune 411008, India c Department of Chemical Engineering, University of Cape Town, Rondebosch 7701, South Africa * Corresponding author. Tel.: +91 20 25893300x2000; fax: +91 20 25893761. Graphical abstract The liquid-phase alkylation of phenol with 1-dodecene was carried out over WO x /ZrO2 solid acid catalysts. The catalyst with 15% WO3/ZrO2 calcined at 800°C, under the optimized reaction conditions of 120°C, phenol/1-dodecene molar ratio 2 and time 2h, gave >99% dodecene conversion with 90% selectivity to dodecylphenol. This catalyst also found to be an efficient catalyst for alkylation of phenol with other long-chain olefins like 1-octene and 1-decene. The liquid-phase alkylation of phenol with 1-dodecene was carried out over WO x /ZrO2 solid acid catalysts. The catalysts were prepared by wet impregnation method using zirconium oxyhydroxide and ammonium metatungstate. Catalysts with different WO3 loading (5–30wt.%) were prepared and calcined at 800°C and catalyst with 15% WO3 was calcined from 700–850°C. All the catalysts were characterized by surface area, XRD, and FTIR. The catalyst with 15% WO3 calcined at 800°C (15 WZ-800) was found to be the most active in the reaction. The effect of temperature, molar ratio and catalyst weight on dodecene conversion and products selectivity was studied in detail. Under the optimized reaction conditions of 120°C, phenol/1-dodecene molar ratio 2 and time 2h, the catalyst 15 WZ-800 gave >99% dodecene conversion with 90% dodecylphenol selectivity. Comparison of the catalytic activity of 15 WZ-800 with sulfated zirconia calcined at 500°C (SZ-500) and Hβ zeolite showed that activity of SZ-500 was lower than that of 15 WZ-800, while Hβ zeolite showed negligible activity. It is observed that the presence of water in the reaction mixture was detrimental to the catalytic activity of WO x /ZrO2. The catalyst 15 WZ-800 also found to be an efficient catalyst for alkylation of phenol with long-chain olefins like 1-octene and 1-decene. Keywords Zirconia Tungsten oxide Alkylation Phenol Long-chain olefins 1 Introduction The alkylation of phenol with alcohols and olefins are industrially important as it is used for the production of a variety of products [1] and the reaction is studied under a variety of catalysts and conditions [2–5]. Alkylation of phenol with 1-dodecene is important as it is used for the production of dodecylphenol, a dense viscous, light yellow liquid with the characteristic smell. Dodecylphenol is used as raw material for manufacturing lubricant additives, anionic detergents, antioxidants, and in phenol resins, adhesives, paints and accelerator for curing epoxy resins. Most of the information in connection with this reaction is available in the form of patent literature. Conventionally this reaction is carried out by the reaction of phenol with 1-dodecene in presence of cation-exchange resin. Though, cation-exchange resin catalysts are environmentally friendly, they have the disadvantage of low stability at high temperatures [6]. Therefore, considerable efforts have been made for the development of suitable heterogeneous catalysts. The catalysts reported for this reaction includes sulfated zirconia, zeolites, and immobilized ionic liquids [7–9]. Zirconia based solid acids are attracting much attention in recent years. For instance, sulfated zirconia proved to be a highly active solid acid catalyst for various organic transformations [10]. But, its poor stability and tendency to form volatile sulfur compounds during catalysis and regeneration limit its applicability [11]. However, zirconia-supported tungsten oxide, WO x /ZrO2 is shown to be an alternative to sulfated zirconia, which is stable at high temperature and in presence of both oxidizing and reducing atmosphere [12,13]. The present work deals with the alkylation of phenol with 1-dodecene using WO x /ZrO2 as the catalyst. The reaction was carried out with an aim to maximize olefin conversion together with the selectivity to alkylphenol. The influence of WO3 loading and catalyst calcination temperature on dodecene conversion and product selectivity were studied. The catalyst with highest activity was used to study various reaction parameters such as temperature, molar ratio and catalyst weight. The study further extended to the comparison of 15 WZ-800 with SZ-500 and Hβ zeolite in phenol alkylation with 1-dodecene, Alkylation of phenol with olefins like 1-octene and 1-decene were also studied using 15 WZ-800 catalyst. 2 Experimental 2.1 Chemicals Zirconium oxychloride (ZrOCl2·8H2O) and ammonia (25%) were procured from S.D. Fine Chemicals Ltd., Mumbai. Phenol was obtained from Merck (India) Ltd., Mumbai. Ammonium metatungstate hydrate ((NH4)6H2W12O40·xH2O), 1-dodecene, 1-decene, and 1-octene were purchased from Aldrich. Sulfated zirconia was obtained from MEL Chemicals and zeolite Hβ (Si/Al=40) was procured from PQ Corporation. All the chemicals were research grade and used as received, without further purification. 2.2 Catalyst preparation The catalysts were prepared by wet impregnation method using zirconium oxyhydroxide as the support and ammonium metatungstate as tungsten precursor. The support was prepared by the hydrolysis of an aqueous solution of zirconium oxychloride with aqueous NH3. The precipitate obtained was washed till free from chloride and dried at 120°C. To an aqueous solution of ammonium metatungstate, zirconium oxyhydroxide powder was added and the mixture was stirred for 8–10h. The excess of water was evaporated to dryness and the product obtained was dried at 120°C and calcined in air at different temperatures. A series of catalysts with different WO3 loading (5–30wt.% of zirconium oxyhydroxide) were prepared and calcined at 800°C. In order to study the influence of calcination temperature on catalytic activity, the 15% WO3/ZrO2 catalyst was calcined from 700–850°C. The catalysts are represented by x WZ-T where, x represents wt.%, W represents WO3, Z represents ZrO2 and T denotes calcination temperature in °C. 2.3 Characterization The specific surface area of the catalysts were measured by N2 physisorption at liquid nitrogen temperature using a Quantachrome Nova-1200 surface area analyzer and standard multi point BET analysis methods. Samples were dried at 300°C in N2 flow for 2h before N2 physisorption measurements. X-ray diffraction (XRD) measurements of the catalyst powder were recorded using a Rigaku Geigerflex diffractometer equipped with Ni filtered Cu Kα radiation (λ =1.5418Å). The volume percentage (vol.%) of the tetragonal phase (V t) of the catalyst samples were estimated using the formula proposed by Toraya et al. [14], X m = I m ( 1 1 − 1 ) + I m ( 1 1 1 ) [ I m ( 1 1 − 1 ) + I m ( 1 1 1 ) + I t ( 1 1 1 ) ] V m = 1.311 X m 1 + 0.31 X m and V t = 1 − V m where I m (h k l) is the integral intensity of the (h k l) reflections of the monoclinic phase and I t (111) the intensity of the (111) reflection of the tetragonal phase. The FTIR spectra of the samples were recorded on a Shimadzu (Model-820 PC) spectrophotometer under DRIFT (diffuse reflectance infrared Fourier transform) mode. 2.4 Catalytic activity The liquid-phase alkylation of phenol with 1-dodecene was carried out under atmospheric pressure in 50ml glass batch reactor fitted with reflux condenser and CaCl2 guard tube. The temperature was controlled by means of a thermostatic oil bath in which the glass reactor was immersed. The catalyst was activated at 500°C for 2h in flow of dry air and cooled to the reaction temperature prior to its use in the reaction. In a typical run, 10g of the reaction mixture was taken in the batch reactor and the required quantity of the catalyst was added and the reaction mixture was heated under constant stirring. The clear solution of the reaction mixture was withdrawn periodically, centrifuged and analyzed by Shimadzu 14B gas chromatograph, equipped with a FID detector using HP-5 capillary column (cross linked 5% ME silicone, 30m×0.53μm×1.5μm film thickness). The products were confirmed by GC–MS and IR spectroscopy. 3 Results and discussion 3.1 Characterization of the catalysts 3.1.1 Surface area Pure ZrO2 calcined at 800°C has low surface area, 10m2 g−1 (Table 1 ) and its surface area increased with WO3 loading and reached maximum at 15% WO3 (61m2 g−1). This can be explained as the added WO3 forms a surface over layer that reduces the surface diffusion of zirconia and inhibits sintering and stabilizes the tetragonal phase of zirconia, which leads to an increase in surface area [15]. Above 15% WO3 loading, the formation of crystalline WO3 (see Section 3.1.2) probably narrows or plugs pores of the samples, thus leading to the decrease in the specific surface area [16]. The nominal WO3 loading corresponding to each loading and calcination temperature was determined to calculate the tungsten (W) surface density using the measured surface area. The tungsten surface densities, expressed as the number of W atoms per nanometer square area (Watomsnm−2), were calculated using the equation, surface density of W={[WO3 loading (wt.%)/100]×6.023×1023}/{[231.8 (formula weight of WO3)×BET surface area (m2 g−1)×1018]} and are given in Table 1. The values indicate that W surface density increased with WO3 loading and calcination temperature and the increase in surface density with calcination temperature is due to the concominant decrease in the ZrO2 surface area (Table 1). 3.1.2 X-ray diffraction Pure ZrO2 calcined at 800°C exist mainly in monoclinic form and as the WO3 loading increased, ZrO2 crystallized progressively into tetragonal form and at 15% WO3 loading ZrO2 exist mainly in the tetragonal form (Fig. 1 ). The tetragonal content of zirconia at a fixed loading depends on the calcination temperature and for 15% catalyst, zirconia exists mainly in the tetragonal form up to 800°C and decreases with further increase in calcination temperature (Table 1). At high calcination temperature, WO x species agglomerate into monoclinic WO3 crystallites and becomes less effective sintering inhibitors. It can also be seen that up to a 10% WO3 loading for catalysts calcined at 800°C and for 15% catalyst, up to 750°C calcination, no XRD peaks corresponding to crystalline WO3 were observed, indicating WO3 is highly dispersed on the support surface. However, when WO3 loading was higher than 10%, or when the calcination temperature exceeds 750°C for 15% loading, new peaks appeared in the 2θ region of 23–25°, characteristic of monoclinic WO3 [17]. Thus, when the W surface density exceeds the theoretical monolayer capacity of ZrO2 (7Wnm−2) i.e., WO3 loading exceeds monolayer coverage, XRD spectra showed the presence of bulk crystalline WO3. 3.1.3 FTIR spectroscopy The catalyst with different WO3 loading and calcination temperature were characterized by FTIR spectroscopy (Fig. 2 ). The catalyst 20 WZ-800 showed three distinct bands centered at about 791, 992, 1110cm−1. The band at 791cm−1 was assigned to a W–O vibration possibly comes from both crystalline and non-crystalline species [18]. The band at 1110cm−1 is due to the presence of monoclinic WO3 phase, and the band at 992cm−1 is due to a polytungstate structure with tungsten in octahedral coordination [19]. This band appeared at lower wave number than those reported in the literature [20,21]. 3.2 Catalytic activity Dodecene undergoes double bond shift isomerization and phenol alkylation in presence of catalyst. The different isomers of dodecene react with phenol to form isomeric mixture of phenyldodecyl ether and dodecylphenol. Analysis of the products by IR spectroscopy showed bands at 752 and 829cm−1 corresponding to the formation of ortho- and para-dodecylphenol (Fig. 3 ) [8]. The formation of heavy products (unidentified) was also indicated at high temperature. The conversion was expressed as the percentage of alkene converted into products. 3.2.1 Effect of WO3 loading In order to investigate the effect of WO3 loading, on dodecene conversion 5–30 WZ-800 catalysts were used in alkylation of phenol at 70°C for 2h (Fig. 4 ). Pure ZrO2 and 5 WZ-800 showed no activity. Among the catalysts with different WO3 loading, 10 WZ-800 showed the lowest dodecene conversion (9%), and the conversion increased to 67% with 15 WZ-800 catalyst. The catalysts 20 WZ-800 and 25 WZ-800 gave similar conversions as that of 15 WZ-800. Further increase in WO3 loading decreased the dodecene conversion, as for the catalyst 30 WZ-800, the conversion was about 56% after 2h. The selectivity to different products depended on WO3 loading. The catalyst 10 WZ-800 showed relatively higher selectivity to phenyldodecyl ether and hence lower selectivity to dodecylphenol. 3.2.2 Effect of calcination temperature The catalyst 15 WZ calcined from 700–850°C has been used to study the effect of calcination temperature on the catalytic activity. From the results shown Fig. 5 , it is clear shows that calcination temperature has a profound effect on the catalytic activity. The catalyst calcined at 700°C gave 16% dodecene conversion, which increases to 67% with catalyst calcined at 800°C. The catalyst 15 WZ-700 showed high phenyldodecyl ether selectivity and low alkyl phenol selectivity. Fig. 6 shows TOF (molmol−1 Ws−1) of the catalysts 10–30 WZ-800 and 15 WZ calcined from 700–850°C as a function of W surface density (Wnm−2). The catalyst with surface density 7.3Wnm−2 has the highest TOF, which is slightly higher than the monolayer coverage of WO3 on zirconia. Iglesia and co-workers from in situ acidity measurements showed that Brönsted acidity of WZ catalysts increases up to monolayer coverage of WO3 on zirconia [22]. At high W surface densities, XRD showed the presence of bulk crystalline WO3 and hence the active sites were inaccessible to the reactants, which decreased the TOF. The highest catalytic activity at surface density of 7.3Wnm−2 clearly indicated that irrespective of WO3 loading and calcination temperature, catalytic activity depended on WO3 coverage and the catalyst with WO3 loading slightly higher than that required for monolayer coverage had the highest catalytic activity. Since phenol is hydrophilic in nature, it can be contaminated with water. In order to check the role of water on catalytic activity, reaction was studied by the addition of water (0.5wt.% of total weight of the reaction mixture) to the reaction mixture. In presence of water, no reaction was observed and it could be due to the strong adsorption of water on the catalyst surface, which prevents the accessibility of the reactants to the active sites of the catalyst and thereby inhibits the reaction. 3.2.3 Effect of reaction temperature The reaction was studied in the range of temperatures from 70 to 120°C using the most active catalyst 15 WZ-800 (Fig. 7 ). At 70°C, dodecene conversion was 67% (2h) and increased to >99% at 120°C. The product selectivity varied drastically with reaction temperature. The selectivity to phenyldodecyl ether was high at low reaction temperature (51% at 70°C) and decreased with an increase in temperature and disappeared at 120°C. The decrease in phenyldodecyl ether selectivity with temperature was due to its rearrangement to dodecylphenol in presence of catalyst. Formation of heavy products was also observed at temperature >70°C and its selectivity increased with temperature and reached 10% at 120°C, in 2h. 3.2.4 Effect of molar ratio The effect of molar ratio on dodecene conversion and product selectivity was studied at 70°C with phenol/dodecene molar ratio 2, 4, and 6 (Fig. 8 ). As the phenol/1-dodecene molar ratio increased from 2 to 4, dodecene conversion increased (67–79%) and further increase in molar ratio to 6 had no appreciable effect. The selectivity to phenyldodecyl ether was high at phenol/1-dodecene molar ratio of 6 and at lower molar ratios selectivity to different products was similar. 3.2.5 Effect of catalyst weight The effect of catalyst weight was studied at 70°C using phenol/1-dodecene molar ratio of 2 (Fig. 9 ). The conversion of dodecene was 47% with 1wt.% catalyst (total weight of the reaction mixture), which increased to 67% with 3wt.% catalyst. Further, increase in catalyst weight had no appreciable effect on conversion. Phenyldodecyl ether selectivity was high with 1wt.% catalyst and alkylphenol selectivity was low. Additionally alkylation of phenol with other olefins like 1-decene and 1-octene was also carried out (Table 2 ). All olefins gave >99% olefin conversion and with 1-octene, formation of dialkylated product was observed. 3.2.6 Catalyst recycling In order to study the recyclability of the catalyst, the reaction was studied at 120°C with 3wt.% catalyst using phenol/dodecene molar ratio 2 for 2h (Fig. 10 ). Fresh catalyst showed >99% dodecene conversion in 2h with 90% alkylphenol and 10% heavy products. For recycling, after first use, catalyst was separated by filtration, washed with methanol and dried at 100°C for 5h and rerun with fresh reaction mixture. The methanol washed catalyst showed 75% dodecene conversion with selectivity to phenyldodecyl ether 15%, dodecylphenol 81%, and heavy products 4% (2h). However, after regeneration of the catalyst by calcination, dodecene conversion was found to be 88%, but selectivity to different products was similar to that of methanol washed catalyst. The activity loss observed with the regenerated catalyst could be due to partial loss of acid sites of the catalyst during reaction/regeneration. 3.2.7 Comparison with zeolite Hβ and sulfated zirconia The alkylation of phenol with 1-dodecene was studied using zeolite Hβ and sulfated zirconia (Fig. 11 ). The zeolite Hβ showed negligible activity, while activity of sulfated zirconia was lower (21%) than that of 15 WZ-800 (67%). Sulfated zirconia initially gave only phenyldodecyl ether and with an increase in time its selectivity decreased and alkylphenol selectivity increased. The negligible activity of Hβ could be due to its pore structure, which prevents the diffusion of products, while the lower activity of sulfated zirconia and its higher selectivity to phenyl dodecyl ether could be due its lower acidity. 4 Conclusions The liquid-phase alkylation of phenol with 1-dodecene has been studied in detail using WO x /ZrO2 catalysts and the catalytic activity has been compared with sulfated zirconia and Hβ zeolite. The catalyst 15 WZ-800 was found to be the most active and under the optimized reaction conditions of 120°C, phenol/1-dodecene molar ratio 2 and time 2h, dodecene conversion was >99% with 90% dodecylphenol selectivity. The activity of SZ-500 was lower than that of 15 WZ-800 and zeolite Hβ showed negligible activity. The catalyst 15 WZ-800 is also an efficient catalyst for alkylation of phenol with other long-chain olefins. Acknowledgements This work was carried under DST-SERC and Indo-South African Inter-Governmental joint project. S.S. thanks Director, NCL for permission to do M. Tech project. B.M.D. acknowledges CSIR, New Delhi (India) for the award of Research Associateship. References [1] H.-W. Voges B. Elvers S. Hawkins G. Schulz Ullmann's Encyclopedia of Industrial Chemistry A19 1991 VHC, Weinheim Germany 328 [2] S.H. Patinkin B.S. Friedman G.A. Olah Friedel-Crafts and Related Reactions. Part 1 vol. 2 1964 Interscience Publishers New York 75 [3] R.M. Roberts A.A. Khalaf Friedel-Crafts Alkylation Chemistry 1984 Marcel Dekker New York p. 701 [4] H.W.B. Reed third ed. M. Grayson Kirk Othmer Encyclopedia of Chemical Technology vol. 2 1978 Wiley New York 72 [5] H.W.B. Reed third ed. M. Grayson Kirk Othmer Encyclopedia of Chemical Technology vol. 2 1978 Wiley New York 65 [6] M.A. Harmer Q. Sen Appl. Catal. A 221 2001 45 [7] R.A. Rajadhyaksha D.D. Chaudhari Bull. Chem. Soc. Jpn. 61 1988 1379 [8] C.B. Campbell A. Onopchenko D. Santilli Bull. Chem. Soc. Jpn. 63 1990 3665 [9] C. DeCastro E. Sauvage M.H. Valkenberg W.F. Hölderich J. Catal. 196 2000 86 [10] G.D. Yadav J.J. Nair Microporous Mesoporous Mater. 33 1999 1 and references there in [11] R. Sreenivasan R.A. Keogh D.R. Milburn B.H. Davis J. Catal. 153 1995 123 [12] M. Hino K. Arata J. Chem. Soc. Chem. Commun. 1988 1259 [13] S. Kuba P. Lukinskas R.K. Grasselli B.C. Gates H. Knözinger J. Catal. 216 2003 353 and references there in [14] H. Toraya M. Yoshimura S. Somiya J. Am. Ceram. Soc. 67 1984 C119 [15] E. Iglesia S.L. Soled G.M. Kramer J. Catal. 144 1993 238 [16] M. Scheithauer R.K. Grasselli H. Knözinger Langmuir 14 1998 3019 [17] JCPDS, International Center for Diffraction Data, 1990. Card 43-1035. [18] R.A. Boyse E.I. Ko J. Catal. 171 1997 191 [19] C.D. Baertsch S.L. Soled E. Iglesia J. Phys. Chem. B 105 2001 1320 [20] T. Yamagushi K. Tanabe Mater. Chem. Phys. 16 1986 67 [21] J.R. Shon M.Y. Park Langmuir 14 1998 6140 [22] J. Macht C.D. Baertsch M. May-Lozano S.L. Soled Y. Wang E. Iglesia J. Catal. 227 2004 470",
      "scopus-id": "24144496448",
      "coredata": {
        "eid": "1-s2.0-S1381116905004565",
        "dc:description": "The liquid-phase alkylation of phenol with 1-dodecene was carried out over WO x /ZrO2 solid acid catalysts. The catalysts were prepared by wet impregnation method using zirconium oxyhydroxide and ammonium metatungstate. Catalysts with different WO3 loading (5–30wt.%) were prepared and calcined at 800°C and catalyst with 15% WO3 was calcined from 700–850°C. All the catalysts were characterized by surface area, XRD, and FTIR. The catalyst with 15% WO3 calcined at 800°C (15 WZ-800) was found to be the most active in the reaction. The effect of temperature, molar ratio and catalyst weight on dodecene conversion and products selectivity was studied in detail. Under the optimized reaction conditions of 120°C, phenol/1-dodecene molar ratio 2 and time 2h, the catalyst 15 WZ-800 gave >99% dodecene conversion with 90% dodecylphenol selectivity. Comparison of the catalytic activity of 15 WZ-800 with sulfated zirconia calcined at 500°C (SZ-500) and Hβ zeolite showed that activity of SZ-500 was lower than that of 15 WZ-800, while Hβ zeolite showed negligible activity. It is observed that the presence of water in the reaction mixture was detrimental to the catalytic activity of WO x /ZrO2. The catalyst 15 WZ-800 also found to be an efficient catalyst for alkylation of phenol with long-chain olefins like 1-octene and 1-decene.",
        "openArchiveArticle": "false",
        "prism:coverDate": "2005-10-03",
        "openaccessUserLicense": null,
        "prism:aggregationType": "Journal",
        "prism:url": "https://api.elsevier.com/content/article/pii/S1381116905004565",
        "dc:creator": [
          {
            "@_fa": "true",
            "$": "Sarish, S."
          },
          {
            "@_fa": "true",
            "$": "Devassy, Biju M."
          },
          {
            "@_fa": "true",
            "$": "Böhringer, Walter"
          },
          {
            "@_fa": "true",
            "$": "Fletcher, Jack"
          },
          {
            "@_fa": "true",
            "$": "Halligudi, S.B."
          }
        ],
        "link": [
          {
            "@_fa": "true",
            "@rel": "self",
            "@href": "https://api.elsevier.com/content/article/pii/S1381116905004565"
          },
          {
            "@_fa": "true",
            "@rel": "scidir",
            "@href": "https://www.sciencedirect.com/science/article/pii/S1381116905004565"
          }
        ],
        "dc:format": "application/json",
        "openaccessType": null,
        "pii": "S1381-1169(05)00456-5",
        "prism:volume": "240",
        "prism:publisher": "Elsevier B.V.",
        "dc:title": "Liquid-phase alkylation of phenol with long-chain olefins over WO x /ZrO2 solid acid catalysts",
        "prism:copyright": "Copyright © 2005 Elsevier B.V. All rights reserved.",
        "openaccess": "0",
        "prism:issn": "13811169",
        "prism:issueIdentifier": "1-2",
        "dcterms:subject": [
          {
            "@_fa": "true",
            "$": "Zirconia"
          },
          {
            "@_fa": "true",
            "$": "Tungsten oxide"
          },
          {
            "@_fa": "true",
            "$": "Alkylation"
          },
          {
            "@_fa": "true",
            "$": "Phenol"
          },
          {
            "@_fa": "true",
            "$": "Long-chain olefins"
          }
        ],
        "openaccessArticle": "false",
        "prism:publicationName": "Journal of Molecular Catalysis A: Chemical",
        "prism:number": "1-2",
        "openaccessSponsorType": null,
        "prism:pageRange": "123-131",
        "prism:endingPage": "131",
        "pubType": "fla",
        "prism:coverDisplayDate": "3 October 2005",
        "prism:doi": "10.1016/j.molcata.2005.06.046",
        "prism:startingPage": "123",
        "dc:identifier": "doi:10.1016/j.molcata.2005.06.046",
        "openaccessSponsorName": null
      },
      "objects": {
        "object": [
          {
            "@category": "thumbnail",
            "@height": "38",
            "@width": "246",
            "@_fa": "true",
            "$": "https://api.elsevier.com/content/object/eid/1-s2.0-S1381116905004565-si2.gif?httpAccept=%2A%2F%2A",
            "@multimediatype": "GIF image file",
            "@type": "ALTIMG",
            "@size": "1165",
            "@ref": "si2",
            "@mimetype": "image/gif"
          },
          {
            "@category": "thumbnail",
            "@height": "40",
            "@width": "294",
            "@_fa": "true",
            "$": "https://api.elsevier.com/content/object/eid/1-s2.0-S1381116905004565-si1.gif?httpAccept=%2A%2F%2A",
            "@multimediatype": "GIF image file",
            "@type": "ALTIMG",
            "@size": "1250",
            "@ref": "si1",
            "@mimetype": "image/gif"
          },
          {
            "@category": "standard",
            "@height": "355",
            "@width": "489",
            "@_fa": "true",
            "$": "https://api.elsevier.com/content/object/eid/1-s2.0-S1381116905004565-gr4.jpg?httpAccept=%2A%2F%2A",
            "@multimediatype": "JPEG image file",
            "@type": "IMAGE-DOWNSAMPLED",
            "@size": "43943",
            "@ref": "gr4",
            "@mimetype": "image/jpeg"
          },
          {
            "@category": "thumbnail",
            "@height": "91",
            "@width": "125",
            "@_fa": "true",
            "$": "https://api.elsevier.com/content/object/eid/1-s2.0-S1381116905004565-gr4.sml?httpAccept=%2A%2F%2A",
            "@multimediatype": "GIF image file",
            "@type": "IMAGE-THUMBNAIL",
            "@size": "3316",
            "@ref": "gr4",
            "@mimetype": "image/gif"
          },
          {
            "@category": "standard",
            "@height": "396",
            "@width": "496",
            "@_fa": "true",
            "$": "https://api.elsevier.com/content/object/eid/1-s2.0-S1381116905004565-gr7.jpg?httpAccept=%2A%2F%2A",
            "@multimediatype": "JPEG image file",
            "@type": "IMAGE-DOWNSAMPLED",
            "@size": "54748",
            "@ref": "gr7",
            "@mimetype": "image/jpeg"
          },
          {
            "@category": "thumbnail",
            "@height": "93",
            "@width": "117",
            "@_fa": "true",
            "$": "https://api.elsevier.com/content/object/eid/1-s2.0-S1381116905004565-gr7.sml?httpAccept=%2A%2F%2A",
            "@multimediatype": "GIF image file",
            "@type": "IMAGE-THUMBNAIL",
            "@size": "3619",
            "@ref": "gr7",
            "@mimetype": "image/gif"
          },
          {
            "@category": "standard",
            "@height": "286",
            "@width": "341",
            "@_fa": "true",
            "$": "https://api.elsevier.com/content/object/eid/1-s2.0-S1381116905004565-gr3.jpg?httpAccept=%2A%2F%2A",
            "@multimediatype": "JPEG image file",
            "@type": "IMAGE-DOWNSAMPLED",
            "@size": "15020",
            "@ref": "gr3",
            "@mimetype": "image/jpeg"
          },
          {
            "@category": "thumbnail",
            "@height": "93",
            "@width": "111",
            "@_fa": "true",
            "$": "https://api.elsevier.com/content/object/eid/1-s2.0-S1381116905004565-gr3.sml?httpAccept=%2A%2F%2A",
            "@multimediatype": "GIF image file",
            "@type": "IMAGE-THUMBNAIL",
            "@size": "2041",
            "@ref": "gr3",
            "@mimetype": "image/gif"
          },
          {
            "@category": "standard",
            "@height": "359",
            "@width": "496",
            "@_fa": "true",
            "$": "https://api.elsevier.com/content/object/eid/1-s2.0-S1381116905004565-gr1.jpg?httpAccept=%2A%2F%2A",
            "@multimediatype": "JPEG image file",
            "@type": "IMAGE-DOWNSAMPLED",
            "@size": "53485",
            "@ref": "gr1",
            "@mimetype": "image/jpeg"
          },
          {
            "@category": "thumbnail",
            "@height": "90",
            "@width": "125",
            "@_fa": "true",
            "$": "https://api.elsevier.com/content/object/eid/1-s2.0-S1381116905004565-gr1.sml?httpAccept=%2A%2F%2A",
            "@multimediatype": "GIF image file",
            "@type": "IMAGE-THUMBNAIL",
            "@size": "3699",
            "@ref": "gr1",
            "@mimetype": "image/gif"
          },
          {
            "@category": "standard",
            "@height": "381",
            "@width": "494",
            "@_fa": "true",
            "$": "https://api.elsevier.com/content/object/eid/1-s2.0-S1381116905004565-gr11.jpg?httpAccept=%2A%2F%2A",
            "@multimediatype": "JPEG image file",
            "@type": "IMAGE-DOWNSAMPLED",
            "@size": "39936",
            "@ref": "gr11",
            "@mimetype": "image/jpeg"
          },
          {
            "@category": "thumbnail",
            "@height": "93",
            "@width": "121",
            "@_fa": "true",
            "$": "https://api.elsevier.com/content/object/eid/1-s2.0-S1381116905004565-gr11.sml?httpAccept=%2A%2F%2A",
            "@multimediatype": "GIF image file",
            "@type": "IMAGE-THUMBNAIL",
            "@size": "2947",
            "@ref": "gr11",
            "@mimetype": "image/gif"
          },
          {
            "@category": "standard",
            "@height": "395",
            "@width": "497",
            "@_fa": "true",
            "$": "https://api.elsevier.com/content/object/eid/1-s2.0-S1381116905004565-gr5.jpg?httpAccept=%2A%2F%2A",
            "@multimediatype": "JPEG image file",
            "@type": "IMAGE-DOWNSAMPLED",
            "@size": "43230",
            "@ref": "gr5",
            "@mimetype": "image/jpeg"
          },
          {
            "@category": "thumbnail",
            "@height": "94",
            "@width": "118",
            "@_fa": "true",
            "$": "https://api.elsevier.com/content/object/eid/1-s2.0-S1381116905004565-gr5.sml?httpAccept=%2A%2F%2A",
            "@multimediatype": "GIF image file",
            "@type": "IMAGE-THUMBNAIL",
            "@size": "3034",
            "@ref": "gr5",
            "@mimetype": "image/gif"
          },
          {
            "@category": "standard",
            "@height": "376",
            "@width": "466",
            "@_fa": "true",
            "$": "https://api.elsevier.com/content/object/eid/1-s2.0-S1381116905004565-gr2.jpg?httpAccept=%2A%2F%2A",
            "@multimediatype": "JPEG image file",
            "@type": "IMAGE-DOWNSAMPLED",
            "@size": "54564",
            "@ref": "gr2",
            "@mimetype": "image/jpeg"
          },
          {
            "@category": "thumbnail",
            "@height": "94",
            "@width": "116",
            "@_fa": "true",
            "$": "https://api.elsevier.com/content/object/eid/1-s2.0-S1381116905004565-gr2.sml?httpAccept=%2A%2F%2A",
            "@multimediatype": "GIF image file",
            "@type": "IMAGE-THUMBNAIL",
            "@size": "3045",
            "@ref": "gr2",
            "@mimetype": "image/gif"
          },
          {
            "@category": "standard",
            "@height": "392",
            "@width": "497",
            "@_fa": "true",
            "$": "https://api.elsevier.com/content/object/eid/1-s2.0-S1381116905004565-gr8.jpg?httpAccept=%2A%2F%2A",
            "@multimediatype": "JPEG image file",
            "@type": "IMAGE-DOWNSAMPLED",
            "@size": "41625",
            "@ref": "gr8",
            "@mimetype": "image/jpeg"
          },
          {
            "@category": "thumbnail",
            "@height": "94",
            "@width": "119",
            "@_fa": "true",
            "$": "https://api.elsevier.com/content/object/eid/1-s2.0-S1381116905004565-gr8.sml?httpAccept=%2A%2F%2A",
            "@multimediatype": "GIF image file",
            "@type": "IMAGE-THUMBNAIL",
            "@size": "2979",
            "@ref": "gr8",
            "@mimetype": "image/gif"
          },
          {
            "@category": "standard",
            "@height": "381",
            "@width": "482",
            "@_fa": "true",
            "$": "https://api.elsevier.com/content/object/eid/1-s2.0-S1381116905004565-gr10.jpg?httpAccept=%2A%2F%2A",
            "@multimediatype": "JPEG image file",
            "@type": "IMAGE-DOWNSAMPLED",
            "@size": "46778",
            "@ref": "gr10",
            "@mimetype": "image/jpeg"
          },
          {
            "@category": "thumbnail",
            "@height": "93",
            "@width": "118",
            "@_fa": "true",
            "$": "https://api.elsevier.com/content/object/eid/1-s2.0-S1381116905004565-gr10.sml?httpAccept=%2A%2F%2A",
            "@multimediatype": "GIF image file",
            "@type": "IMAGE-THUMBNAIL",
            "@size": "3366",
            "@ref": "gr10",
            "@mimetype": "image/gif"
          },
          {
            "@category": "standard",
            "@height": "397",
            "@width": "493",
            "@_fa": "true",
            "$": "https://api.elsevier.com/content/object/eid/1-s2.0-S1381116905004565-gr9.jpg?httpAccept=%2A%2F%2A",
            "@multimediatype": "JPEG image file",
            "@type": "IMAGE-DOWNSAMPLED",
            "@size": "47259",
            "@ref": "gr9",
            "@mimetype": "image/jpeg"
          },
          {
            "@category": "thumbnail",
            "@height": "93",
            "@width": "116",
            "@_fa": "true",
            "$": "https://api.elsevier.com/content/object/eid/1-s2.0-S1381116905004565-gr9.sml?httpAccept=%2A%2F%2A",
            "@multimediatype": "GIF image file",
            "@type": "IMAGE-THUMBNAIL",
            "@size": "3145",
            "@ref": "gr9",
            "@mimetype": "image/gif"
          },
          {
            "@category": "standard",
            "@height": "281",
            "@width": "340",
            "@_fa": "true",
            "$": "https://api.elsevier.com/content/object/eid/1-s2.0-S1381116905004565-gr6.jpg?httpAccept=%2A%2F%2A",
            "@multimediatype": "JPEG image file",
            "@type": "IMAGE-DOWNSAMPLED",
            "@size": "17160",
            "@ref": "gr6",
            "@mimetype": "image/jpeg"
          },
          {
            "@category": "thumbnail",
            "@height": "93",
            "@width": "113",
            "@_fa": "true",
            "$": "https://api.elsevier.com/content/object/eid/1-s2.0-S1381116905004565-gr6.sml?httpAccept=%2A%2F%2A",
            "@multimediatype": "GIF image file",
            "@type": "IMAGE-THUMBNAIL",
            "@size": "2156",
            "@ref": "gr6",
            "@mimetype": "image/gif"
          },
          {
            "@category": "standard",
            "@height": "124",
            "@width": "437",
            "@_fa": "true",
            "$": "https://api.elsevier.com/content/object/eid/1-s2.0-S1381116905004565-fx1.gif?httpAccept=%2A%2F%2A",
            "@multimediatype": "GIF image file",
            "@type": "IMAGE-DOWNSAMPLED",
            "@size": "4393",
            "@ref": "fx1",
            "@mimetype": "image/gif"
          },
          {
            "@category": "thumbnail",
            "@height": "36",
            "@width": "125",
            "@_fa": "true",
            "$": "https://api.elsevier.com/content/object/eid/1-s2.0-S1381116905004565-fx1.sml?httpAccept=%2A%2F%2A",
            "@multimediatype": "GIF image file",
            "@type": "IMAGE-THUMBNAIL",
            "@size": "717",
            "@ref": "fx1",
            "@mimetype": "image/gif"
          }
        ]
      },
      "link": {
        "@rel": "abstract",
        "@href": "https://api.elsevier.com/content/abstract/scopus_id/24144496448"
      }
    }
  }
}