{
  "metadata": {
    "title": "Enhanced soot combustion over partially substituted hydrotalcite-drived mixed oxide catalysts CoMgAlLaO",
    "authors": "; ; ",
    "journal": "Journal of Molecular Catalysis A: Chemical",
    "date": "2014-11-01",
    "doi": "10.1016/j.molcata.2014.05.031",
    "abstract": "",
    "uri": "https://api.elsevier.com/content/article/pii/S1381116914002416",
    "pii": "S1381116914002416"
  },
  "fulltext": {
    "full-text-retrieval-response": {
      "scopus-eid": "2-s2.0-84903649679",
      "originalText": "serial JL 271358 291210 291744 291790 291809 31 Journal of Molecular Catalysis A: Chemical JOURNALMOLECULARCATALYSISACHEMICAL 2014-06-14 2014-06-14 2014-08-07T01:20:07 1-s2.0-S1381116914002416 S1381-1169(14)00241-6 S1381116914002416 10.1016/j.molcata.2014.05.031 S300 S300.1 FULL-TEXT 1-s2.0-S1381116914X00099 2015-05-15T05:56:33.63776-04:00 0 0 20141101 2014 2014-06-14T00:00:00Z absattachment articleinfo articletitlenorm authfirstinitialnorm authfirstsurnamenorm cid cids contenttype copyright crossmark dateloaded dateloadedtxt datesearch datesort dateupdated dco docsubtype doctype doi eid ewtransactionid hubeid indexeddate issn issnnorm itemstage itemtransactionid itemweight openaccess openarchive pg pgfirst pglast pii piinorm pubdatestart pubdatetxt pubyr sectiontitle sortorder srctitle srctitlenorm srctype subheadings suppl tomb volfirst volissue volumelist webpdf webpdfpagecount yearnav figure table body mmlmath acknowledge affil articletitle auth authfirstini authfull authkeywords authlast highlightsabst primabst ref specialabst alllist content subj ssids 1381-1169 13811169 true 393 393 C Volume 393 12 68 74 68 74 20141101 1 November 2014 2014-11-01 2014 Regular Papers article fla Copyright © 2014 Elsevier B.V. All rights reserved. ENHANCEDSOOTCOMBUSTIONOVERPARTIALLYSUBSTITUTEDHYDROTALCITEDRIVEDMIXEDOXIDECATALYSTSCOMGALLAO DAI F 1 Introduction 2 Experimental 2.1 Catalyst preparation 2.2 Catalyst characterization 2.3 Activity measurement 3 Results and discussion 3.1 Characterization of the catalysts 3.1.1 XRD and EXAFS 3.1.2 H2-TPR and O2-TPD 3.2 Soot combustion over CMALa x catalysts 3.3 NO x storage over the catalysts 4 Conclusions Acknowledgments References NEEFT 1996 1 69 J JELLES 1999 623 630 S PERALTA 2011 90 98 M MATARRESE 2012 271 278 R SANCHEZ 2009 166 175 B SANCHEZ 2011 158 165 B KUSTOV 2009 263 271 A ZHANG 2010 16 23 Z RUSSO 2008 85 95 N GROSS 2012 86 94 M LIU 2012 25 35 S LI 2010 98 105 Z XU 2011 1 12 J GENNEQUIN 2009 482 491 C AGUILERA 2011 144 150 D VACCARI 1998 53 71 A KANNAN 2006 117 137 S YU 2006 4291 4300 J LI 2009 366 372 Q DAI 2012 43 49 F JIANG 2010 97 102 Z OZAWA 1970 301 324 T BAYRAM 2011 77 89 B MORALES 2006 8626 8639 F ARNOLDY 1985 38 54 P DERIVAS 2011 88 97 B LUO 2008 310 324 J YANG 2012 45 58 W XUE 2007 167 174 L SEDLMAIR 2003 308 316 C TOOPS 2005 245 254 T CASTOLDI 2010 335 350 L NOVA 2004 377 388 I ITO 2007 2176 2180 K MILT 2003 424 432 V SETIABUDI 2004 185 194 A DAIX2014X68 DAIX2014X68X74 DAIX2014X68XF DAIX2014X68X74XF item S1381-1169(14)00241-6 S1381116914002416 1-s2.0-S1381116914002416 10.1016/j.molcata.2014.05.031 271358 2014-08-07T00:20:30.785589-04:00 2014-11-01 1-s2.0-S1381116914002416-main.pdf https://s3.amazonaws.com/prod-ucs-content-store-us-east/content/pii:S1381116914002416/MAIN/application/pdf/31b3475e5b1d823430de8c8d166c5eac/main.pdf https://s3-eu-west-1.amazonaws.com/prod-ucs-content-store-eu-west/content/pii:S1381116914002416/MAIN/application/pdf/31b3475e5b1d823430de8c8d166c5eac/main.pdf main.pdf pdf true 1173674 MAIN 7 1-s2.0-S1381116914002416-main_1.png https://s3-eu-west-1.amazonaws.com/prod-ucs-content-store-eu-west/content/pii:S1381116914002416/PREVIEW/image/png/2b781a31924ee77c0e5673c31bd9ff3d/main_1.png https://s3.amazonaws.com/prod-ucs-content-store-us-east/content/pii:S1381116914002416/PREVIEW/image/png/2b781a31924ee77c0e5673c31bd9ff3d/main_1.png main_1.png png 58039 849 656 IMAGE-WEB-PDF 1 1-s2.0-S1381116914002416-si1.gif https://s3.amazonaws.com/prod-ucs-content-store-us-east/content/pii:S1381116914002416/STRIPIN/image/gif/01b0532dd1c19df741d034374e2e55d3/si1.gif https://s3-eu-west-1.amazonaws.com/prod-ucs-content-store-eu-west/content/pii:S1381116914002416/STRIPIN/image/gif/01b0532dd1c19df741d034374e2e55d3/si1.gif si1 si1.gif gif 626 32 166 ALTIMG 1-s2.0-S1381116914002416-gr9_lrg.jpg https://s3.amazonaws.com/prod-ucs-content-store-us-east/content/pii:S1381116914002416/gr9/HIGHRES/image/jpeg/16bcbed8be3a608064f51ecab5e3aa8a/gr9_lrg.jpg https://s3-eu-west-1.amazonaws.com/prod-ucs-content-store-eu-west/content/pii:S1381116914002416/gr9/HIGHRES/image/jpeg/16bcbed8be3a608064f51ecab5e3aa8a/gr9_lrg.jpg gr9 gr9_lrg.jpg jpg 281211 1535 1667 IMAGE-HIGH-RES 1-s2.0-S1381116914002416-gr8_lrg.jpg https://s3.amazonaws.com/prod-ucs-content-store-us-east/content/pii:S1381116914002416/gr8/HIGHRES/image/jpeg/4d952137251d05809dcf9f2b48e886d2/gr8_lrg.jpg https://s3-eu-west-1.amazonaws.com/prod-ucs-content-store-eu-west/content/pii:S1381116914002416/gr8/HIGHRES/image/jpeg/4d952137251d05809dcf9f2b48e886d2/gr8_lrg.jpg gr8 gr8_lrg.jpg jpg 164404 1340 1452 IMAGE-HIGH-RES 1-s2.0-S1381116914002416-gr7_lrg.jpg https://s3.amazonaws.com/prod-ucs-content-store-us-east/content/pii:S1381116914002416/gr7/HIGHRES/image/jpeg/25fb79ea7c2ca092e70769e2fa4caaa8/gr7_lrg.jpg https://s3-eu-west-1.amazonaws.com/prod-ucs-content-store-eu-west/content/pii:S1381116914002416/gr7/HIGHRES/image/jpeg/25fb79ea7c2ca092e70769e2fa4caaa8/gr7_lrg.jpg gr7 gr7_lrg.jpg jpg 201936 1473 1479 IMAGE-HIGH-RES 1-s2.0-S1381116914002416-gr6_lrg.jpg https://s3.amazonaws.com/prod-ucs-content-store-us-east/content/pii:S1381116914002416/gr6/HIGHRES/image/jpeg/1f9f96cef6dfe449b590464d7ac6ad34/gr6_lrg.jpg https://s3-eu-west-1.amazonaws.com/prod-ucs-content-store-eu-west/content/pii:S1381116914002416/gr6/HIGHRES/image/jpeg/1f9f96cef6dfe449b590464d7ac6ad34/gr6_lrg.jpg gr6 gr6_lrg.jpg jpg 219486 1452 1479 IMAGE-HIGH-RES 1-s2.0-S1381116914002416-gr5_lrg.jpg https://s3.amazonaws.com/prod-ucs-content-store-us-east/content/pii:S1381116914002416/gr5/HIGHRES/image/jpeg/30d314888f291e7a860b3c1a26a08e52/gr5_lrg.jpg https://s3-eu-west-1.amazonaws.com/prod-ucs-content-store-eu-west/content/pii:S1381116914002416/gr5/HIGHRES/image/jpeg/30d314888f291e7a860b3c1a26a08e52/gr5_lrg.jpg gr5 gr5_lrg.jpg jpg 225133 1458 1417 IMAGE-HIGH-RES 1-s2.0-S1381116914002416-gr4_lrg.jpg https://s3.amazonaws.com/prod-ucs-content-store-us-east/content/pii:S1381116914002416/gr4/HIGHRES/image/jpeg/5121959f134edb5c4008bccc11b4af31/gr4_lrg.jpg https://s3-eu-west-1.amazonaws.com/prod-ucs-content-store-eu-west/content/pii:S1381116914002416/gr4/HIGHRES/image/jpeg/5121959f134edb5c4008bccc11b4af31/gr4_lrg.jpg gr4 gr4_lrg.jpg jpg 285918 1497 1619 IMAGE-HIGH-RES 1-s2.0-S1381116914002416-gr3_lrg.jpg https://s3.amazonaws.com/prod-ucs-content-store-us-east/content/pii:S1381116914002416/gr3/HIGHRES/image/jpeg/2cc307a2d314471b3fc4ec09de23350f/gr3_lrg.jpg https://s3-eu-west-1.amazonaws.com/prod-ucs-content-store-eu-west/content/pii:S1381116914002416/gr3/HIGHRES/image/jpeg/2cc307a2d314471b3fc4ec09de23350f/gr3_lrg.jpg gr3 gr3_lrg.jpg jpg 305895 1361 1437 IMAGE-HIGH-RES 1-s2.0-S1381116914002416-gr2_lrg.jpg https://s3.amazonaws.com/prod-ucs-content-store-us-east/content/pii:S1381116914002416/gr2/HIGHRES/image/jpeg/19af5d6f15fbdb86d5b6fc56509923e4/gr2_lrg.jpg https://s3-eu-west-1.amazonaws.com/prod-ucs-content-store-eu-west/content/pii:S1381116914002416/gr2/HIGHRES/image/jpeg/19af5d6f15fbdb86d5b6fc56509923e4/gr2_lrg.jpg gr2 gr2_lrg.jpg jpg 292667 1423 1444 IMAGE-HIGH-RES 1-s2.0-S1381116914002416-gr11_lrg.jpg https://s3.amazonaws.com/prod-ucs-content-store-us-east/content/pii:S1381116914002416/gr11/HIGHRES/image/jpeg/6e22aa91563ead97ce58cc862289e8b4/gr11_lrg.jpg https://s3-eu-west-1.amazonaws.com/prod-ucs-content-store-eu-west/content/pii:S1381116914002416/gr11/HIGHRES/image/jpeg/6e22aa91563ead97ce58cc862289e8b4/gr11_lrg.jpg gr11 gr11_lrg.jpg jpg 194747 1228 1250 IMAGE-HIGH-RES 1-s2.0-S1381116914002416-gr10_lrg.jpg https://s3.amazonaws.com/prod-ucs-content-store-us-east/content/pii:S1381116914002416/gr10/HIGHRES/image/jpeg/39f70590d2dece8c71968a097cc0befa/gr10_lrg.jpg https://s3-eu-west-1.amazonaws.com/prod-ucs-content-store-eu-west/content/pii:S1381116914002416/gr10/HIGHRES/image/jpeg/39f70590d2dece8c71968a097cc0befa/gr10_lrg.jpg gr10 gr10_lrg.jpg jpg 217945 1569 1444 IMAGE-HIGH-RES 1-s2.0-S1381116914002416-gr1_lrg.jpg https://s3.amazonaws.com/prod-ucs-content-store-us-east/content/pii:S1381116914002416/gr1/HIGHRES/image/jpeg/2f224697d939ec4feb15b34b1682dfc8/gr1_lrg.jpg https://s3-eu-west-1.amazonaws.com/prod-ucs-content-store-eu-west/content/pii:S1381116914002416/gr1/HIGHRES/image/jpeg/2f224697d939ec4feb15b34b1682dfc8/gr1_lrg.jpg gr1 gr1_lrg.jpg jpg 236130 1423 1444 IMAGE-HIGH-RES 1-s2.0-S1381116914002416-fx1_lrg.jpg https://s3.amazonaws.com/prod-ucs-content-store-us-east/content/pii:S1381116914002416/fx1/HIGHRES/image/jpeg/1efd720cece1b8170ed92176f8ceb472/fx1_lrg.jpg https://s3-eu-west-1.amazonaws.com/prod-ucs-content-store-eu-west/content/pii:S1381116914002416/fx1/HIGHRES/image/jpeg/1efd720cece1b8170ed92176f8ceb472/fx1_lrg.jpg fx1 true fx1_lrg.jpg jpg 127668 886 2213 IMAGE-HIGH-RES 1-s2.0-S1381116914002416-gr9.jpg https://s3.amazonaws.com/prod-ucs-content-store-us-east/content/pii:S1381116914002416/gr9/DOWNSAMPLED/image/jpeg/e565e5250f1097c6a37b33670eae89f3/gr9.jpg https://s3-eu-west-1.amazonaws.com/prod-ucs-content-store-eu-west/content/pii:S1381116914002416/gr9/DOWNSAMPLED/image/jpeg/e565e5250f1097c6a37b33670eae89f3/gr9.jpg gr9 gr9.jpg jpg 38879 346 376 IMAGE-DOWNSAMPLED 1-s2.0-S1381116914002416-gr8.jpg https://s3.amazonaws.com/prod-ucs-content-store-us-east/content/pii:S1381116914002416/gr8/DOWNSAMPLED/image/jpeg/f678cf44b50a51ba598fbd85c10e2ca4/gr8.jpg https://s3-eu-west-1.amazonaws.com/prod-ucs-content-store-eu-west/content/pii:S1381116914002416/gr8/DOWNSAMPLED/image/jpeg/f678cf44b50a51ba598fbd85c10e2ca4/gr8.jpg gr8 gr8.jpg jpg 27894 303 328 IMAGE-DOWNSAMPLED 1-s2.0-S1381116914002416-gr7.jpg https://s3.amazonaws.com/prod-ucs-content-store-us-east/content/pii:S1381116914002416/gr7/DOWNSAMPLED/image/jpeg/f6d234883ddbd7caaa2c3f895e09cbb5/gr7.jpg https://s3-eu-west-1.amazonaws.com/prod-ucs-content-store-eu-west/content/pii:S1381116914002416/gr7/DOWNSAMPLED/image/jpeg/f6d234883ddbd7caaa2c3f895e09cbb5/gr7.jpg gr7 gr7.jpg jpg 33150 333 334 IMAGE-DOWNSAMPLED 1-s2.0-S1381116914002416-gr6.jpg https://s3.amazonaws.com/prod-ucs-content-store-us-east/content/pii:S1381116914002416/gr6/DOWNSAMPLED/image/jpeg/e2c9545face43e168ce448f5d8bc158d/gr6.jpg https://s3-eu-west-1.amazonaws.com/prod-ucs-content-store-eu-west/content/pii:S1381116914002416/gr6/DOWNSAMPLED/image/jpeg/e2c9545face43e168ce448f5d8bc158d/gr6.jpg gr6 gr6.jpg jpg 37671 328 334 IMAGE-DOWNSAMPLED 1-s2.0-S1381116914002416-gr5.jpg https://s3.amazonaws.com/prod-ucs-content-store-us-east/content/pii:S1381116914002416/gr5/DOWNSAMPLED/image/jpeg/656b5c3890ca20591e447785a1a7e961/gr5.jpg https://s3-eu-west-1.amazonaws.com/prod-ucs-content-store-eu-west/content/pii:S1381116914002416/gr5/DOWNSAMPLED/image/jpeg/656b5c3890ca20591e447785a1a7e961/gr5.jpg gr5 gr5.jpg jpg 37824 329 320 IMAGE-DOWNSAMPLED 1-s2.0-S1381116914002416-gr4.jpg https://s3.amazonaws.com/prod-ucs-content-store-us-east/content/pii:S1381116914002416/gr4/DOWNSAMPLED/image/jpeg/a5107e71b77dc014c64c4a91a5a155a8/gr4.jpg https://s3-eu-west-1.amazonaws.com/prod-ucs-content-store-eu-west/content/pii:S1381116914002416/gr4/DOWNSAMPLED/image/jpeg/a5107e71b77dc014c64c4a91a5a155a8/gr4.jpg gr4 gr4.jpg jpg 42482 337 365 IMAGE-DOWNSAMPLED 1-s2.0-S1381116914002416-gr3.jpg https://s3.amazonaws.com/prod-ucs-content-store-us-east/content/pii:S1381116914002416/gr3/DOWNSAMPLED/image/jpeg/651bb563ea85ae21e3a50b4611e93848/gr3.jpg https://s3-eu-west-1.amazonaws.com/prod-ucs-content-store-eu-west/content/pii:S1381116914002416/gr3/DOWNSAMPLED/image/jpeg/651bb563ea85ae21e3a50b4611e93848/gr3.jpg gr3 gr3.jpg jpg 47194 307 324 IMAGE-DOWNSAMPLED 1-s2.0-S1381116914002416-gr2.jpg https://s3.amazonaws.com/prod-ucs-content-store-us-east/content/pii:S1381116914002416/gr2/DOWNSAMPLED/image/jpeg/0bfd4e220891847382d74a1b1dbe2d0e/gr2.jpg https://s3-eu-west-1.amazonaws.com/prod-ucs-content-store-eu-west/content/pii:S1381116914002416/gr2/DOWNSAMPLED/image/jpeg/0bfd4e220891847382d74a1b1dbe2d0e/gr2.jpg gr2 gr2.jpg jpg 46093 321 326 IMAGE-DOWNSAMPLED 1-s2.0-S1381116914002416-gr11.jpg https://s3.amazonaws.com/prod-ucs-content-store-us-east/content/pii:S1381116914002416/gr11/DOWNSAMPLED/image/jpeg/53a5b989d8c083e3b8c6995369de8c45/gr11.jpg https://s3-eu-west-1.amazonaws.com/prod-ucs-content-store-eu-west/content/pii:S1381116914002416/gr11/DOWNSAMPLED/image/jpeg/53a5b989d8c083e3b8c6995369de8c45/gr11.jpg gr11 gr11.jpg jpg 29533 277 282 IMAGE-DOWNSAMPLED 1-s2.0-S1381116914002416-gr10.jpg https://s3.amazonaws.com/prod-ucs-content-store-us-east/content/pii:S1381116914002416/gr10/DOWNSAMPLED/image/jpeg/0106c4b2cfa3d35fd1f61c22d707af4f/gr10.jpg https://s3-eu-west-1.amazonaws.com/prod-ucs-content-store-eu-west/content/pii:S1381116914002416/gr10/DOWNSAMPLED/image/jpeg/0106c4b2cfa3d35fd1f61c22d707af4f/gr10.jpg gr10 gr10.jpg jpg 33958 354 326 IMAGE-DOWNSAMPLED 1-s2.0-S1381116914002416-gr1.jpg https://s3.amazonaws.com/prod-ucs-content-store-us-east/content/pii:S1381116914002416/gr1/DOWNSAMPLED/image/jpeg/cdba016cf6db5d07df26e52ec76b4c9c/gr1.jpg https://s3-eu-west-1.amazonaws.com/prod-ucs-content-store-eu-west/content/pii:S1381116914002416/gr1/DOWNSAMPLED/image/jpeg/cdba016cf6db5d07df26e52ec76b4c9c/gr1.jpg gr1 gr1.jpg jpg 39246 321 326 IMAGE-DOWNSAMPLED 1-s2.0-S1381116914002416-fx1.jpg https://s3.amazonaws.com/prod-ucs-content-store-us-east/content/pii:S1381116914002416/fx1/DOWNSAMPLED/image/jpeg/de3b513093ec3178a1cb3a65addb0c58/fx1.jpg https://s3-eu-west-1.amazonaws.com/prod-ucs-content-store-eu-west/content/pii:S1381116914002416/fx1/DOWNSAMPLED/image/jpeg/de3b513093ec3178a1cb3a65addb0c58/fx1.jpg fx1 true fx1.jpg jpg 16478 200 500 IMAGE-DOWNSAMPLED 1-s2.0-S1381116914002416-gr9.sml https://s3.amazonaws.com/prod-ucs-content-store-us-east/content/pii:S1381116914002416/gr9/THUMBNAIL/image/gif/416f38e08ce5d2cbc0a6432962a9d287/gr9.sml https://s3-eu-west-1.amazonaws.com/prod-ucs-content-store-eu-west/content/pii:S1381116914002416/gr9/THUMBNAIL/image/gif/416f38e08ce5d2cbc0a6432962a9d287/gr9.sml gr9 gr9.sml sml 4634 164 178 IMAGE-THUMBNAIL 1-s2.0-S1381116914002416-gr8.sml https://s3.amazonaws.com/prod-ucs-content-store-us-east/content/pii:S1381116914002416/gr8/THUMBNAIL/image/gif/00c6afe2e3ce4e61a6ce17d5e0084217/gr8.sml https://s3-eu-west-1.amazonaws.com/prod-ucs-content-store-eu-west/content/pii:S1381116914002416/gr8/THUMBNAIL/image/gif/00c6afe2e3ce4e61a6ce17d5e0084217/gr8.sml gr8 gr8.sml sml 4280 163 177 IMAGE-THUMBNAIL 1-s2.0-S1381116914002416-gr7.sml https://s3.amazonaws.com/prod-ucs-content-store-us-east/content/pii:S1381116914002416/gr7/THUMBNAIL/image/gif/80aafe3a075fa989b9ed5c4dd131da83/gr7.sml https://s3-eu-west-1.amazonaws.com/prod-ucs-content-store-eu-west/content/pii:S1381116914002416/gr7/THUMBNAIL/image/gif/80aafe3a075fa989b9ed5c4dd131da83/gr7.sml gr7 gr7.sml sml 4093 163 164 IMAGE-THUMBNAIL 1-s2.0-S1381116914002416-gr6.sml https://s3.amazonaws.com/prod-ucs-content-store-us-east/content/pii:S1381116914002416/gr6/THUMBNAIL/image/gif/aed02773cfb8aad1beb19dcc1f8f2915/gr6.sml https://s3-eu-west-1.amazonaws.com/prod-ucs-content-store-eu-west/content/pii:S1381116914002416/gr6/THUMBNAIL/image/gif/aed02773cfb8aad1beb19dcc1f8f2915/gr6.sml gr6 gr6.sml sml 4639 164 167 IMAGE-THUMBNAIL 1-s2.0-S1381116914002416-gr5.sml https://s3.amazonaws.com/prod-ucs-content-store-us-east/content/pii:S1381116914002416/gr5/THUMBNAIL/image/gif/502105b2142f731b91c9649a796295d6/gr5.sml https://s3-eu-west-1.amazonaws.com/prod-ucs-content-store-eu-west/content/pii:S1381116914002416/gr5/THUMBNAIL/image/gif/502105b2142f731b91c9649a796295d6/gr5.sml gr5 gr5.sml sml 4705 164 159 IMAGE-THUMBNAIL 1-s2.0-S1381116914002416-gr4.sml https://s3.amazonaws.com/prod-ucs-content-store-us-east/content/pii:S1381116914002416/gr4/THUMBNAIL/image/gif/2c63467ebc68ed61130074d0aedc4e6a/gr4.sml https://s3-eu-west-1.amazonaws.com/prod-ucs-content-store-eu-west/content/pii:S1381116914002416/gr4/THUMBNAIL/image/gif/2c63467ebc68ed61130074d0aedc4e6a/gr4.sml gr4 gr4.sml sml 4735 164 177 IMAGE-THUMBNAIL 1-s2.0-S1381116914002416-gr3.sml https://s3.amazonaws.com/prod-ucs-content-store-us-east/content/pii:S1381116914002416/gr3/THUMBNAIL/image/gif/048e8f1317f904adc08075ea2aa05170/gr3.sml https://s3-eu-west-1.amazonaws.com/prod-ucs-content-store-eu-west/content/pii:S1381116914002416/gr3/THUMBNAIL/image/gif/048e8f1317f904adc08075ea2aa05170/gr3.sml gr3 gr3.sml sml 6283 164 173 IMAGE-THUMBNAIL 1-s2.0-S1381116914002416-gr2.sml https://s3.amazonaws.com/prod-ucs-content-store-us-east/content/pii:S1381116914002416/gr2/THUMBNAIL/image/gif/a5234423dd4ac084df3af94e99b35286/gr2.sml https://s3-eu-west-1.amazonaws.com/prod-ucs-content-store-eu-west/content/pii:S1381116914002416/gr2/THUMBNAIL/image/gif/a5234423dd4ac084df3af94e99b35286/gr2.sml gr2 gr2.sml sml 6380 164 166 IMAGE-THUMBNAIL 1-s2.0-S1381116914002416-gr11.sml https://s3.amazonaws.com/prod-ucs-content-store-us-east/content/pii:S1381116914002416/gr11/THUMBNAIL/image/gif/bef142637ba914a2afe5c70fd042ba33/gr11.sml https://s3-eu-west-1.amazonaws.com/prod-ucs-content-store-eu-west/content/pii:S1381116914002416/gr11/THUMBNAIL/image/gif/bef142637ba914a2afe5c70fd042ba33/gr11.sml gr11 gr11.sml sml 6953 164 167 IMAGE-THUMBNAIL 1-s2.0-S1381116914002416-gr10.sml https://s3.amazonaws.com/prod-ucs-content-store-us-east/content/pii:S1381116914002416/gr10/THUMBNAIL/image/gif/611a4a9530369f3fed16263cc7a7b0ea/gr10.sml https://s3-eu-west-1.amazonaws.com/prod-ucs-content-store-eu-west/content/pii:S1381116914002416/gr10/THUMBNAIL/image/gif/611a4a9530369f3fed16263cc7a7b0ea/gr10.sml gr10 gr10.sml sml 4395 164 151 IMAGE-THUMBNAIL 1-s2.0-S1381116914002416-gr1.sml https://s3.amazonaws.com/prod-ucs-content-store-us-east/content/pii:S1381116914002416/gr1/THUMBNAIL/image/gif/d1c4f055e310073273e5d9468e3da38f/gr1.sml https://s3-eu-west-1.amazonaws.com/prod-ucs-content-store-eu-west/content/pii:S1381116914002416/gr1/THUMBNAIL/image/gif/d1c4f055e310073273e5d9468e3da38f/gr1.sml gr1 gr1.sml sml 5224 164 166 IMAGE-THUMBNAIL 1-s2.0-S1381116914002416-fx1.sml https://s3.amazonaws.com/prod-ucs-content-store-us-east/content/pii:S1381116914002416/fx1/THUMBNAIL/image/gif/e3c6b5ccaea339de7a3de26aa836d88c/fx1.sml https://s3-eu-west-1.amazonaws.com/prod-ucs-content-store-eu-west/content/pii:S1381116914002416/fx1/THUMBNAIL/image/gif/e3c6b5ccaea339de7a3de26aa836d88c/fx1.sml fx1 true fx1.sml sml 3606 88 219 IMAGE-THUMBNAIL MOLCAA 9131 S1381-1169(14)00241-6 10.1016/j.molcata.2014.05.031 Elsevier B.V. Fig. 1 XRD patterns of CMALa x hydrotalcite precursors. Fig. 2 XRD patterns of the CMALa x catalysts. Fig. 3 Co K-edge radial structure functions of CMALa x catalysts and reference compounds. Fig. 4 H2-TPR profiles of CMALa x catalysts. Fig. 5 O2-TPD profiles of CMALa x catalysts. Fig. 6 DTG profiles during soot combustion over CMALa x catalysts in the atmosphere of 600ppm NO+10vol.% O2 +N2. Fig. 7 DTG profiles of soot combustion over CMALa x catalysts in synthetic air. Fig. 8 In-situ DRIFT spectra of NO x sorption on CMALa10 at different temperatures in the atmosphere of 500ppm NO+5vol.% O2 +N2. Fig. 9 Outlet NO x concentration during temperature-programmed heating on CMALa x catalysts in the atmosphere of 600ppm NO+10vol.% O2 +N2. Fig. 10 (a) DTG profiles of soot combustion over CMALa10 in synthetic air (dash line) or in 600ppm NO+10vol.% O2 +N2 (solid line); (b) NO2 concentration (thin solid line) and NO x concentration (thick solid line) during temperature-programmed heating on soot/CMALa x mixture in 600ppm NO+10vol.% O2 +N2, and the NO x concentration (dash line) for CMALa10 treated in the same condition. Fig. 11 Mechanism scheme of soot combustion over CMALa10 in the presence of NO x . Table 1 BET specific surface area (SSA), crystallite size of Co3O4, H2-TPR peak area ratio, apparent activation energy (Ea) and NO x storage capacity (NSC) of different catalysts. Sample SSA (m2/g) Crystallite size (nm) a Peak area ratio b Ea (kJ/mol) NSC (μmol/g) CMALa0 81 11.0 0.35 99.98 198 CMALa5 81 8.9 0.35 95.89 200 CMALa8 92 8.3 0.33 96.98 244 CMALa10 93 7.6 0.32 92.75 300 CMALa15 82 8.9 0.35 111.36 248 a Calculated based upon the diffraction line broadening of (311) crystal plane of Co3O4. b The peak area ratio is the ratio of the first peak to the second one in the H2-TPR profiles. Enhanced soot combustion over partially substituted hydrotalcite-drived mixed oxide catalysts CoMgAlLaO Fangfang Dai a Yuxia Zhang a Ming Meng a ⁎ Jing Zhang b Lirong Zheng b Tiandou Hu b a Collaborative Innovation Center for Chemical Science and Engineering (Tianjin), Tianjin Key Laboratory of Applied Catalysis Science and Engineering, School of Chemical Engineering and Technology, Tianjin University, Tianjin 300072, PR China Collaborative Innovation Center for Chemical Science and Engineering (Tianjin), Tianjin Key Laboratory of Applied Catalysis Science and Engineering, School of Chemical Engineering and Technology, Tianjin University Tianjin 300072 PR China b Institute of High Energy Physics, Chinese Academy of Sciences, Beijing 100049, PR China Institute of High Energy Physics, Chinese Academy of Sciences Beijing 100049 PR China ⁎ Corresponding author. Tel.: +86 022 2789 2275; fax: +86 022 2789 2275. Graphical abstract A series of hydrotalcite-derived multicomponent oxide catalysts Co2.5Mg0.5Al1–x%La x%O (denoted as CMALa x , x =0, 5, 8, 10 or 15) with different La contents were synthesized by co-precipitation, and employed for catalytic soot combustion and NO x storage at lean condition. It is found that the La-substituted catalysts are more active than the one without La for soot combustion and NO x storage. Among all the catalysts CMALa x , CMALa10 (x =10) exhibits the highest catalytic performance, showing the largest NO x storage capacity (300μmol/g) and the lowest temperature for the maximal soot oxidation rate (T m =388°C). The results of H2-TPR and O2-TPD indicate that the La-substitution can enhance the redox properties and increase the amount of surface lattice oxygen species of the catalysts. The results of soot combustion kinetics show that the apparent activation energy of CMALa10 is the lowest (92.75kJ/mol). Based upon the catalytic performance and in situ DRIFTS characterization, a nitrate and/or NO2 enhanced soot combustion mechanism over CMALa10 was proposed. It is revealed that at low temperature the stored nitrate can directly promote soot ignition, while at high temperature the NO2 species arising from NO oxidation or nitrate decomposition act as the main active species for soot combustion. Keywords Hydrotalcite Lanthanum Soot combustion Nitrate Mechanism 1 Introduction It is well known that diesel engines possess higher fuel efficiency, larger output power and better durability than traditional gasoline engines. So, many kinds of vehicles including light and heavy trucks, ships and cars have been equipped with diesel engines. However, the main pollutants in diesel exhausts namely nitrogen oxides (NO x ) and soot particulates materials (PM) are very harmful or poisonous to human and environment. Therefore, novel after-treatment technologies for diesel exhaust elimination are highly desired. The inner purification techniques based upon the modification of diesel engine structures can only decrease the amounts of these pollutants to a very limited extent, so, the outer after-treatment purification techniques such as filtration trapping, catalytic soot combustion and NO x reduction are still required. Nowadays, diesel particulate filters (DPFs) have been widely used for soot removal, which can trap most soot particulates efficiently [1,2]. However, after used for some time the pressure drop before and after the DPFs will dramatically increase, so it is necessary to periodically regenerate the DPFs by burning the trapped soot. When highly active oxidation catalysts are coated on the DPFs, the trapped soot can be in situ removed through a continuous catalytic combustion process, which is more economic and more convenient [3]. Meanwhile, the oxidation catalysts can also oxidize the NO to NO2, enhancing the simultaneous removal of NO x and soot. In addition, it is reported that the NO2 can be further oxidized and stored as nitrate species in the catalysts, participating the soot oxidation [4]. Although the decomposition of nitrates often requires high temperature, they can react with soot at much lower temperature [5–7]. Therefore, the formation of nitrate species should be favorable to soot combustion. So far, many kinds of metal oxide catalysts have been investigated and employed for soot combustion [8–11]. Among them, Co-based oxide catalysts such as perovskites and hydrotalcite-derived oxides have exhibited excellent catalytic oxidation performance [12–15], especially the hydrotalcite-derived Co oxide catalysts which possess high specific surface area and high dispersion of active phases [16–18]. Nevertheless, the thermal stability of hydrotalcite-derived Co oxide catalysts is much lower than that of others such as Co-based perovskites. It is known that soot combustion is a strong exothermic reaction, possibly making the catalysts sintered. So, the improvement of the thermal stability of hydrotalcite-derived Co oxide catalysts is still necessary. It has been reported that the hydrotalcite-derived CoMgAlO catalysts are rather efficient for soot combustion and NO x storage since the mixed oxides derived from hydrotalcites often exhibit large specific surface area, strong basicity and good reducibility [19,20]. To further increase both the catalytic performance and the thermal stability of them, in present work, lanthanum known as an effective thermal stabilizer is selected and doped into the hydrotalcite-based CoMgAlO catalyst to replace some of the aluminum. By using co-precipitation method, a series of hydrotalcite-derived catalysts Co2.5Mg0.5Al1–x%La x%O with different La contents were synthesized. According to the results of catalytic performance and many kinds of characterizations, the content of La was optimized; meanwhile, the enhancement effect of La substitution on the CoMgAlO catalyst was also investigated from the views of bulk/surface/coordination structures, redox properties, oxygen activation capability and NO x adsorption/storage capacity. By using in-situ DRIFTS technique the NO x storage pathway and the nitrate-assisted soot combustion mechanism were revealed. 2 Experimental 2.1 Catalyst preparation A series of Co2.5Mg0.5Al1–x%La x% hydrotalcite-like compounds (HTlc) were prepared using co-precipitation method at constant pH (10±0.5) under vigorous mechanical stirring [21]. The molar ratio of Co:Mg:Al:La is 2.5:0.5:(1–x%):x%, and x was set at 0, 5, 8, 10 or 15. Briefly, the metal nitrates (50mL) consisting of Co(NO3)2·6H2O, Mg(NO3)2·6H2O, Al(NO3)3·9H2O and La(NO3)3·6H2O were dissolved into distilled water to form a mixed solution. Meanwhile, another mixed basic solution (50mL) containing NaOH and Na2CO3 was also prepared with [OH−]=2.0M and [CO3 2−]=1.0M. The obtained precipitates were kept in suspension at 70°C for 12h, then filtered and thoroughly washed with distilled water. After dried at 120°C overnight, the precursors of HTlc were obtained and then calcined at 600°C for 4h to get the desired catalysts Co2.5Mg0.5Al1–x%La x% which are denoted as CMALa x . 2.2 Catalyst characterization The crystal structures for the precursors and calcined catalysts were recorded on a Rigaku D/Max-2500 X-Ray diffractometer operating at 200mA and 40kV using Cu Kα1 as radiation source (λ =0.15406nm). The scanning range of 2θ is from 6 to 80° with a step size of 0.02°. Specific surface area was measured by nitrogen adsorption/desorption at 77K using a Quantachrome Quadrasorb SI instrument. The samples were degassed at 300°C for 3h prior to the adsorption experiments. The specific surface area (SSA) was determined by BET method in 0–0.3 partial pressure range. Temperature-programmed reduction (H2-TPR) measurements were performed on the TP-5079 TPDRO setup (Tianjin Xianquan Instrument Company) equipped with a thermal conductivity detector (TCD). Before detection by the TCD, the gas was purified by a trap containing CaO+NaOH materials in order to remove H2O and CO2. A heating rate of 10°C/min and a gas (8% H2 in N2) flow rate of 30mL/min were used. Temperature-programmed desorption (O2-TPD) measurements were conducted on a TPDRO 1100 apparatus supplied by Thermo-Finnigan Company. During the test, 100mg of each sample were pre-heated in pure O2 from room temperature to 500°C and held for 30min. After cooling to room temperature, the sample was heated from room temperature to 900°C at a heating rate of 10°C/min in pure helium. Extended X-ray absorption fine structure (EXAFS) measurements were carried out on the XAFS station of 1W1B beamline of Beijing Synchrotron Radiation Facility (SSRF) operating at about 150mA and 3.5GeV. The absorption spectra of Co K-edge of the samples and the reference compounds were recorded at room temperature in transmission mode. A Si (111) double crystal monochromator was used to reduce the harmonic content of the monochrome beam. The back-subtracted EXAFS function was converted into k space and weighted by k 3 in order to compensate for the diminishing amplitude due to the decay of the photoelectron wave. The Fourier transforming of the k 3-weighted EXAFS data was performed in the range of k =3 to 13Å−1 using a Hanning window function. In-situ DRIFTS experiments were performed on a Nicolet Nexus spectrometer supplied by Thermo Nicolet Company, which was equipped with a MCT detector and a heating chamber allowing the temperature increased to 600°C. The DRIFT spectra were recorded against a background spectrum of the sample purified just prior to introducing NO x . In each run, about 20mg powder sample was first pretreated under 20vol.% O2/N2 (30mL/min) at 200°C for 30min and then exposed to a flow of 500ppm NO+5vol.% O2 balanced by N2 (30mL/min). All spectra were collected on 16 scans at a resolution of 4cm−1. 2.3 Activity measurement For soot combustion, the catalytic activity of the prepared samples was evaluated by a Perkin-Elmer Diamond TG/DTA instrument using Degussa Printex-U as the model soot. The soot was mixed with the catalyst in a mortar for about 5min to obtain a tight contact with a weight ratio of 1:9. Then, the mixture (about 8mg) was loaded to the sample chamber and heated from room temperature to 600°C at a rate of 10°C/min in different atmospheres: (i) 600ppm NO+10vol.% O2 balanced by N2 and (ii) synthetic air (20vol.% O2 +80vol.% N2). The characteristic temperatures corresponding to the maximal soot combustion rate (denoted as T m ) in the DTG profiles were used to evaluate the performance of different catalysts. The activation energy (Ea) for soot combustion over the catalysts was measured by using the reported Ozawa method [22]. According to this method, the activation energy can be calculated by the following equation: ln B = − 0.4567 E a R 1 T + C here C is a constant and B is the heating rate. In this work, soot combustion tests were carried out at three different heating rates (B 1 =5°C/min, B 2 =10°C/min, B 3 =15°C/min). Then each pair of ln B and 1/T of these data was used for plotting. From the equation, Ea could be calculated by the slope of the plotted line. For NO x storage, experiments were carried out in a continuous fixed-bed reactor under atmospheric pressure, using the gas mixture of 600ppm NO, 10vol.% O2 and balanced N2 as adsorbates. The granular catalyst (40–60mesh, 0.3mL) was fixed in a quartz tube (i.d.=8mm) by packing quartz wool at the end of the bed, and heated from 100 to 600°C at a rate of 10°C/min. The mixture gas passed through the catalyst bed at a flow rate of 150mL/min. An on-line chemiluminescence NO–NO2–NO x analyzer (Model 42i-HL, Thermo Scientific) was used to measure the concentrations of NO, NO2 and NO x in the outlet gas. 3 Results and discussion 3.1 Characterization of the catalysts 3.1.1 XRD and EXAFS The XRD patterns of the catalyst precursors are displayed in Fig. 1 , which indicates that the hydrotalcite (JPCDS 51-0045) structures were successfully synthesized and no other phases were detected. The partial substitution of Al3+ by La3+ did not destroy the layer structures of the hydrotalcite. However, the diffraction peaks of hydrotalcites become weaker after La substitution, especially for the samples containing relatively high contents of La (x ≥10), which suggests the decrease in crystallization degree of hydrotalcite phases. Fig. 2 shows the XRD patterns of the catalysts calcined at 600°C. It is found that the peaks for hydrotalcite phases have totally disappeared after calcination, forming new phases such as cubic spinels and trace LaCoO3 perovskite based upon the observed diffraction peaks. Since many diffraction peaks for the spinels of Co3O4 (JPCDS 43-1003) and Co2AlO4 (JPCDS 38-0814) are very close or overlapped with each other, it is very hard to distinguish these phases just by XRD method. However, after careful comparison, the intensity of the three strongest lines of XRD patterns of the catalysts is more similar to that of Co3O4 spinel. Meanwhile, EXAFS characterization was performed to make a further determination of Co phases. The radial structure functions (RSFs) of Co K-edge of the catalysts and the reference compounds are displayed in Fig. 3 . It is easily found that the RSFs of the catalysts are similar to those of pure Co3O4 and Co2AlO4. The similarity of the RSFs for Co2AlO4 and Co3O4 is due to their similar coordination structures. In the crystal structure of Co3O4 Co atoms exist in heterogeneous coordination environments; one Co atom is in tetrahedral coordination environment, while the other two are in octahedral coordination environment. For Co2AlO4, there are only two Co atoms in the molecule, one is in tetrahedral coordination environment, and the other is in octahedral coordination environment [23]. Combined with the XRD analysis, it can be concluded that the Co in the catalysts mainly exists as Co3O4. Averagely, in spinel Co3O4 each Co atom coordinates with 5.3 O at 1.91Å (first shell), with 4 Co at 2.85Å (second shell) and with 8 Co at 3.36Å (third shell), respectively [24]. In the RSFs of the catalysts (Fig. 3) the first three peaks appearing at 1.44Å, 2.42Å and 2.95Å (not corrected by phase scattering shift) can be attributed to the above three coordination shells, respectively. Based upon the line broadening of (311) plane (2θ =36.9°) in Fig. 2, the sizes of Co3O4 crystallites in different catalysts are calculated by using Scherrer equation, as listed in Table 1 . It can be seen that the size of Co3O4 crystallites decreases after La substitution. The sample containing 10% La possesses the smallest Co3O4 crystallite size (∼7.6nm). The altering tendency of BET surface area and Co3O4 crystallite size for the catalysts with different La contents is totally the same, as seen in Table 1. In a summary, the presence of appropriate amounts of La in CoMgAlO hydrotalcite-derived catalysts can efficiently inhibit the sintering of catalysts during calcination process. 3.1.2 H2-TPR and O2-TPD H2-TPR technique can be employed to characterize the reducibility and mobility of oxygen species in the catalysts [14]. As shown in Fig. 4 , the H2-TPR profiles of all the catalysts are similar to each other, showing two main reduction peaks, which may correspond to a two-step reduction process (Co3+ →Co2+ →Co0) of Co3O4; the reduction peaks centered around 377°C are associated with the reduction of Co3+ to Co2+, while the high-temperature peaks above 700°C are attributed to the reduction of Co2+ to Co0 [19,25]. Such assignment is strongly supported by the appropriate area ratio of 1/3 for the first peak to the second one [26], as listed in Table 1. In addition, the analysis of H2-TPR results is also in good agreement with EXAFS results. In Fig. 4, the trace shoulder peaks appearing in the region of 130–260°C could be assigned to the reduction of surface adsorbed oxygen species [27]. By comparing the reduction profiles of different catalysts, it can still be found that the first reduction peaks (357°C) for CMALa8 and CMALa10 appear at a little lower temperature, suggesting the better reducibility and higher oxygen mobility of these two catalysts. Temperature-programmed desorption of oxygen (O2-TPD) measurement was also carried out to investigate the mobility and amounts of oxygen species in the catalysts, especially the surface oxygen species, the results of which are shown in Fig. 5 . Three oxygen desorption peaks (α, β and γ) were clearly observed for each catalyst. The peak α appearing at low temperature region (around 200°C) corresponds to the desorption of surface chemisorbed oxygen species. The peak β appearing in the middle temperature region between 400 and 650°C is attributed to the desorption of surface lattice oxygen [27–29]. By careful observation, it is seen that the peak β for all samples starts from almost the same temperature (∼410°C), but ends at different temperatures, indicating the different amounts of surface oxygen species over CMALa x catalysts. The sample CMALa10 with the largest peak β should possess the largest amount of surface oxygen species. As to the peak γ which appears at very high temperature region (around 820°C), it should be resulted from the thermal decomposition of bulk Co3O4 to CoO [27]. Taking into account that the soot combustion over these catalysts mainly takes place at middle temperature region (330–500°C, see next section), it is deduced that the peak β-related surface oxygen species should be the main active oxygen species which may play a crucial role for soot oxidation because the bulk lattice oxygen corresponding to peak γ is too stable, and the very small amounts of surface chemisorbed oxygen species corresponding to peak α have already desorbed at reaction temperatures. In a summary, the La-substitution can increase the amount of surface oxygen species in CMALa x catalysts, especially for the catalyst CMALa10. 3.2 Soot combustion over CMALa x catalysts Fig. 6 shows the results of soot combustion activity of the catalysts in the atmosphere containing NO. It is seen that the introduction of La remarkably enhances the soot combustion over these catalysts, evidenced by the obvious decrease of the characteristic temperature T m corresponding to the maximal soot combustion rate. According to T m , the activity of these catalysts is arranged in the order of CMALa10 >CMALa8 ≈CMALa15 >CMALa5 >CMALa0. The catalyst CMALa10 shows the lowest T m (388°C), which is ∼56°C lower than that for CMALa0. For comparison, the soot combustion activity of these catalysts in air was also evaluated, the results of which are shown in Fig. 7 . The activity order is identical to that in the NO x -containing atmosphere. However, over the same catalyst the T m is much higher than that in NO x -containing atmosphere, suggesting that the presence of NO does enhance the soot combustion. The best catalytic performance of CMALa10 could be elucidated from the following three aspects: (1) this catalyst has the largest specific surface area and smallest crystallite size of Co3O4; (2) this catalyst possesses the best reducibility; (3) this catalyst has the largest amount of surface lattice oxygen, which is the main active oxygen species for soot combustion. In a word, the La substitution is really efficient for the improvement of the catalytic performance for soot combustion of the hydrotalcite-derived CMALa x catalysts; the optimal substitution amount of La is x =10%. In order to better understand the promotional effect of La in the substituted catalysts CMALa x , a series of kinetic experiments were performed and the apparent activation energy for soot oxidation was calculated, as listed in Table 1. It is obvious that the apparent activation energy of catalytic soot combustion is much lower than that of non-catalytic soot combustion (Ea =139.7kJ/mol). After addition of La, the activation energy further decreases to some extent. The catalyst CMALa10 with the highest soot combustion activity possesses the lowest activation energy (Ea =92.75kJ/mol). 3.3 NO x storage over the catalysts To characterize the function of NO existing in the atmosphere during soot combustion, in-situ DRIFTS technique was employed to identify the NO x -stored species over CMALa10 under NO x /O2 atmosphere. As shown in Fig. 8 , in low-temperature region (≤200°C), only one small absorption band at 1220cm−1 was identified, which is attributed to bridged bidentate nitrite species [30]. With the temperature increasing to 300°C, the band at 1220cm−1 disappeared but a new band at ∼1293cm−1 corresponding to chelating bidentate nitrate species [30,31] appeared, suggesting that nitrite species have transformed to nitrate species. Fig. 9 presents the profiles of temperature-programmed NO x adsorption/storage and desorption over different samples. The points below and above the dot line (NO concentration in feed stream) mean the occurrence of NO x adsorption/storage and NO x desorption, respectively. Based on Fig. 9, the NO x storage capacities (NSCs) of different catalysts were calculated and listed in Table 1. It is found that the La-substituted catalysts exhibit much larger NO x storage capacities than the La-free sample, especially the sample CMALa10 which shows the maximal NSC of 300μmol/g. Generally, nitrites and nitrates are arising from the oxidation of NO or NO2 by surface oxygen species [32,33]. The sample CMALa10 has the largest BET surface area, the best reducibility and the largest amount of surface lattice oxygen, which determine its highest NO x storage capacity and best oxidation performance for soot combustion. Fig. 10(a) and (b) present the DTG profiles of soot combustion over CMALa10 in the presence or absence of NO x as well as the NO x concentration curves during temperature-programmed heating on CMALa10 or CMALa10/soot in NO x -containing atmosphere, respectively. By comparing the DTG profiles in Fig. 10(a), it is found that the presence of NO x has greatly enhanced the soot combustion, as indicated by the obvious decrease of T m . Meanwhile, the ignition temperature (Ti) of soot combustion in NO x -containing atmosphere is also remarkably decreased from ∼340°C to 300°C. At this temperature (Ti), the NO x concentration from reactor outlet is much lower than that at reactor inlet (dash line) as seen in Fig. 10(b), which suggests that most of the NO x is still being stored as nitrates on the catalyst, as confirmed by in situ DRIFTS results (Fig. 8). So, it is natural to assume that in the NO x -containing atmosphere the soot combustion over CMALa10 may be enhanced by the as-formed nitrate species. On one hand, at relatively low temperature (300–340°C), the stored nitrate species are thermo-stable, which have not decomposed into nitrogen oxides, making the NO x concentration at reactor outlet lower than that at reactor inlet; the enhanced ignition of soot combustion may be resulted from the direct reaction between nitrate species and soot; similar phenomena were also observed in other catalytic systems [34,35]. On the other hand, at relatively high temperature (340–385°C), the detected NO x concentration at reactor outlet is obviously higher than that at reactor inlet, suggesting the decomposition of nitrate species; at this stage, the enhanced soot combustion should be simultaneously contributed by nitrates species and the NO2 species (the maximum: 797ppm) derived from the decomposition of nitrates. The NO2 as a stronger oxidizer than O2 can enhance soot combustion [36]. Actually, the exothermic soot combustion can reversely accelerate nitrate decomposition. From Fig. 10(b), it can be seen that as the soot co-exists with the catalyst the NO x release temperature is much lower and the detected maximal NO x concentration is much higher as compared with those measured in the absence of soot. This result further confirms that the nitrate decomposition facilitates the soot combustion and vise versa. Based upon all the results and analysis, a potential soot combustion mechanism with nitrate and NO2 as reaction intermediates is proposed for the CMALa10 in NO x -containing atmosphere, as shown in Fig. 11 . There are three kinetic pathways for soot combustion: (1) surface lattice oxygen species of the catalyst oxidize adjacent soot to produce CO2; (2) nitrate species stored on catalyst surface oxidize the soot, giving N2 and CO2; (3) soot is oxidized by the NO2 species derived from NO oxidation or nitrates decomposition. 4 Conclusions La-substituted hydrotalcite-derived Co2.5Mg0.5Al1–x%La x%O multiple-component oxide catalysts are highly active for soot combustion. The optimal substitution amount of La is x =10. This optimized catalyst CMALa10 possesses the largest specific surface area, the best reducibility and the highest NO x storage capacity. Finely dispersed Co3O4 is identified as the main active phase for soot combustion. La-substitution not only improves the reducibility of the catalysts but also increases the amount of surface lattice oxygen species. Above 200°C, NO x is mainly stored as chelating bidentate nitrate species, which can directly react with soot, remarkably decreasing the ignition temperature of soot combustion. The NO2 species derived from NO oxidation and nitrates decomposition can also enhance soot oxidation, remarkably decreasing the temperature T m corresponding to the maximal soot combustion rate. Acknowledgments This work is financially supported by the National Natural Science Foundation of China (21276184, U1332102), the Specialized Research Fund for the Doctoral Program of Higher Education of China (20120032110014), the Program of New Century Excellent Talents in University of China (no. NCET-07-0599) and the Program of Introducing Talents of Discipline to University of China (no. B06006). References [1] J.P.A. Neeft M. Makkee J.A. Moulijn Fuel Process. Technol. 47 1996 1 69 [2] S.J. Jelles R.R. Krul M. Makkee J.A. Moulijn Catal. Today 53 1999 623 630 [3] M.A. Peralta M.S. Zanuttini C.A. Querini Appl. Catal., B: Environ. 110 2011 90 98 [4] R. Matarrese N. Artioli L. Castoldi L. Lietti P. Forzatti Catal. Today 184 2012 271 278 [5] B.S. Sanchez C.A. Querini E.E. Miró Appl. Catal., A: Gen. 366 2009 166 175 [6] B.S. Sanchez C.A. Querini E.E. Miró Appl. Catal., A: Gen. 392 2011 158 165 [7] A.L. Kustov M. Makkee Appl. Catal., B: Environ. 88 2009 263 271 [8] Z.L. Zhang D. Han S.J. Wei Y.X. Zhang J. Catal. 276 2010 16 23 [9] N. Russo S. Furfori D. Fino G. Saracco V. Specchia Appl. Catal., B: Environ. 83 2008 85 95 [10] M.S. Gross M.A. Ulla C.A. Querini J. Mol. Catal. A: Chem. 352 2012 86 94 [11] S. Liu X.D. Wu D. Weng M. Li H.R. Lee Chem. Eng. J. 203 2012 25 35 [12] Z.Q. Li M. Meng Q. Li Y.N. Xie T.D. Hu J. Zhang Chem. Eng. J. 164 2010 98 105 [13] J.F. Xu J. Liu Z. Zhao C.M. Xu J.X. Zheng A.J. Duan G.Y. Jiang J. Catal. 282 2011 1 12 [14] C. Gennequin S. Siffert R. Cousin A. Aboukaïs Top. Catal. 52 2009 482 491 [15] D.A. Aguilera A. Perez R. Molina S. Moreno Appl. Catal., B: Environ. 104 2011 144 150 [16] A. Vaccari Catal. Today 41 1998 53 71 [17] S. Kannan Catal. Surv. Asia 10 2006 117 137 [18] J.J. Yu Z. Jiang L. Zhu Z.P. Hao Z.P. Xu J. Phys. Chem. B 110 2006 4291 4300 [19] Q. Li M. Meng Z.Q. Zou X.G. Li Y.Q. Zha J. Hazard. Mater. 161 2009 366 372 [20] F.F. Dai M. Meng Y.Q. Zha Z.Q. Li T.D. Hu Y.N. Xie J. Zhang Fuel Process. Technol. 104 2012 43 49 [21] Z. Jiang J.J. Yu J. Cheng T.C. Xiao M.O. Jones Z.P. Hao P.P. Edwards Fuel Process. Technol. 91 2010 97 102 [22] T. Ozawa J. Therm. Anal. 2 1970 301 324 [23] B. Bayram I.I. Soykala D. von Deak J.T. Miller U.S. Ozkan J. Catal. 284 2011 77 89 [24] F. Morales D. Grandjean A. Mens F.M.F. de Groot B.M. Weckhuysen J. Phys. Chem. B 110 2006 8626 8639 [25] P. Arnoldy J.A. Moulijn J. Catal. 93 1985 38 54 [26] B. de Rivas R. López-Fonseca C. Jiménez-González J.I. Gutiérrez-Ortiz J. Catal. 281 2011 88 97 [27] J.Y. Luo M. Meng X. Li X.G. Li Y.Q. Zha T.D. Hu Y.N. Xie J. Zhang J. Catal. 254 2008 310 324 [28] W. Yang R.D. Zhang B.H. Chen N. Bion D. Duprez S. Royer J. Catal. 295 2012 45 58 [29] L. Xue C.B. Zhang H. He Y. Teraoka Appl. Catal., B: Environ. 75 2007 167 174 [30] C. Sedlmair K. Seshan A. Jentys J.A. Lercher J. Catal. 214 2003 308 316 [31] T.J. Toops D.B. Smith W.P. Partridge Appl. Catal., B: Environ. 2005 245 254 [32] L. Castoldi L. Lietti P. Forzatti S. Morandi G. Ghiotti F. Vindigni J. Catal. 276 2010 335 350 [33] I. Nova L. Castoldi L. Lietti E. Tronconi P. Forzatti F. Prinetto G. Ghiotti J. Catal. 222 2004 377 388 [34] K. Ito K. Kishikawa A. Watajima K. Ikeue M. Machida Catal. Commun. 8 2007 2176 2180 [35] V.G. Milt C.A. Querini E.E. Miró M.A. Ulla J. Catal. 220 2003 424 432 [36] A. Setiabudi M. Makkee J.A. Moulijn Appl. Catal., B: Environ. 50 2004 185 194",
      "scopus-id": "84903649679",
      "coredata": {
        "eid": "1-s2.0-S1381116914002416",
        "dc:description": "A series of hydrotalcite-derived multicomponent oxide catalysts Co2.5Mg0.5Al1–x%La x%O (denoted as CMALa x , x =0, 5, 8, 10 or 15) with different La contents were synthesized by co-precipitation, and employed for catalytic soot combustion and NO x storage at lean condition. It is found that the La-substituted catalysts are more active than the one without La for soot combustion and NO x storage. Among all the catalysts CMALa x , CMALa10 (x =10) exhibits the highest catalytic performance, showing the largest NO x storage capacity (300μmol/g) and the lowest temperature for the maximal soot oxidation rate (T m =388°C). The results of H2-TPR and O2-TPD indicate that the La-substitution can enhance the redox properties and increase the amount of surface lattice oxygen species of the catalysts. The results of soot combustion kinetics show that the apparent activation energy of CMALa10 is the lowest (92.75kJ/mol). Based upon the catalytic performance and in situ DRIFTS characterization, a nitrate and/or NO2 enhanced soot combustion mechanism over CMALa10 was proposed. It is revealed that at low temperature the stored nitrate can directly promote soot ignition, while at high temperature the NO2 species arising from NO oxidation or nitrate decomposition act as the main active species for soot combustion.",
        "openArchiveArticle": "false",
        "prism:coverDate": "2014-11-01",
        "openaccessUserLicense": null,
        "prism:aggregationType": "Journal",
        "prism:url": "https://api.elsevier.com/content/article/pii/S1381116914002416",
        "dc:creator": [
          {
            "@_fa": "true",
            "$": "Dai, Fangfang"
          },
          {
            "@_fa": "true",
            "$": "Zhang, Yuxia"
          },
          {
            "@_fa": "true",
            "$": "Meng, Ming"
          },
          {
            "@_fa": "true",
            "$": "Zhang, Jing"
          },
          {
            "@_fa": "true",
            "$": "Zheng, Lirong"
          },
          {
            "@_fa": "true",
            "$": "Hu, Tiandou"
          }
        ],
        "link": [
          {
            "@_fa": "true",
            "@rel": "self",
            "@href": "https://api.elsevier.com/content/article/pii/S1381116914002416"
          },
          {
            "@_fa": "true",
            "@rel": "scidir",
            "@href": "https://www.sciencedirect.com/science/article/pii/S1381116914002416"
          }
        ],
        "dc:format": "application/json",
        "openaccessType": null,
        "pii": "S1381-1169(14)00241-6",
        "prism:volume": "393",
        "prism:publisher": "Elsevier B.V.",
        "dc:title": "Enhanced soot combustion over partially substituted hydrotalcite-drived mixed oxide catalysts CoMgAlLaO",
        "prism:copyright": "Copyright © 2014 Elsevier B.V. All rights reserved.",
        "openaccess": "0",
        "prism:issn": "13811169",
        "dcterms:subject": [
          {
            "@_fa": "true",
            "$": "Hydrotalcite"
          },
          {
            "@_fa": "true",
            "$": "Lanthanum"
          },
          {
            "@_fa": "true",
            "$": "Soot combustion"
          },
          {
            "@_fa": "true",
            "$": "Nitrate"
          },
          {
            "@_fa": "true",
            "$": "Mechanism"
          }
        ],
        "openaccessArticle": "false",
        "prism:publicationName": "Journal of Molecular Catalysis A: Chemical",
        "openaccessSponsorType": null,
        "prism:pageRange": "68-74",
        "prism:endingPage": "74",
        "pubType": "fla",
        "prism:coverDisplayDate": "1 November 2014",
        "prism:doi": "10.1016/j.molcata.2014.05.031",
        "prism:startingPage": "68",
        "dc:identifier": "doi:10.1016/j.molcata.2014.05.031",
        "openaccessSponsorName": null
      },
      "objects": {
        "object": [
          {
            "@category": "thumbnail",
            "@height": "32",
            "@width": "166",
            "@_fa": "true",
            "$": "https://api.elsevier.com/content/object/eid/1-s2.0-S1381116914002416-si1.gif?httpAccept=%2A%2F%2A",
            "@multimediatype": "GIF image file",
            "@type": "ALTIMG",
            "@size": "626",
            "@ref": "si1",
            "@mimetype": "image/gif"
          },
          {
            "@category": "high",
            "@height": "1535",
            "@width": "1667",
            "@_fa": "true",
            "$": "https://api.elsevier.com/content/object/eid/1-s2.0-S1381116914002416-gr9_lrg.jpg?httpAccept=%2A%2F%2A",
            "@multimediatype": "JPEG image file",
            "@type": "IMAGE-HIGH-RES",
            "@size": "281211",
            "@ref": "gr9",
            "@mimetype": "image/jpeg"
          },
          {
            "@category": "high",
            "@height": "1340",
            "@width": "1452",
            "@_fa": "true",
            "$": "https://api.elsevier.com/content/object/eid/1-s2.0-S1381116914002416-gr8_lrg.jpg?httpAccept=%2A%2F%2A",
            "@multimediatype": "JPEG image file",
            "@type": "IMAGE-HIGH-RES",
            "@size": "164404",
            "@ref": "gr8",
            "@mimetype": "image/jpeg"
          },
          {
            "@category": "high",
            "@height": "1473",
            "@width": "1479",
            "@_fa": "true",
            "$": "https://api.elsevier.com/content/object/eid/1-s2.0-S1381116914002416-gr7_lrg.jpg?httpAccept=%2A%2F%2A",
            "@multimediatype": "JPEG image file",
            "@type": "IMAGE-HIGH-RES",
            "@size": "201936",
            "@ref": "gr7",
            "@mimetype": "image/jpeg"
          },
          {
            "@category": "high",
            "@height": "1452",
            "@width": "1479",
            "@_fa": "true",
            "$": "https://api.elsevier.com/content/object/eid/1-s2.0-S1381116914002416-gr6_lrg.jpg?httpAccept=%2A%2F%2A",
            "@multimediatype": "JPEG image file",
            "@type": "IMAGE-HIGH-RES",
            "@size": "219486",
            "@ref": "gr6",
            "@mimetype": "image/jpeg"
          },
          {
            "@category": "high",
            "@height": "1458",
            "@width": "1417",
            "@_fa": "true",
            "$": "https://api.elsevier.com/content/object/eid/1-s2.0-S1381116914002416-gr5_lrg.jpg?httpAccept=%2A%2F%2A",
            "@multimediatype": "JPEG image file",
            "@type": "IMAGE-HIGH-RES",
            "@size": "225133",
            "@ref": "gr5",
            "@mimetype": "image/jpeg"
          },
          {
            "@category": "high",
            "@height": "1497",
            "@width": "1619",
            "@_fa": "true",
            "$": "https://api.elsevier.com/content/object/eid/1-s2.0-S1381116914002416-gr4_lrg.jpg?httpAccept=%2A%2F%2A",
            "@multimediatype": "JPEG image file",
            "@type": "IMAGE-HIGH-RES",
            "@size": "285918",
            "@ref": "gr4",
            "@mimetype": "image/jpeg"
          },
          {
            "@category": "high",
            "@height": "1361",
            "@width": "1437",
            "@_fa": "true",
            "$": "https://api.elsevier.com/content/object/eid/1-s2.0-S1381116914002416-gr3_lrg.jpg?httpAccept=%2A%2F%2A",
            "@multimediatype": "JPEG image file",
            "@type": "IMAGE-HIGH-RES",
            "@size": "305895",
            "@ref": "gr3",
            "@mimetype": "image/jpeg"
          },
          {
            "@category": "high",
            "@height": "1423",
            "@width": "1444",
            "@_fa": "true",
            "$": "https://api.elsevier.com/content/object/eid/1-s2.0-S1381116914002416-gr2_lrg.jpg?httpAccept=%2A%2F%2A",
            "@multimediatype": "JPEG image file",
            "@type": "IMAGE-HIGH-RES",
            "@size": "292667",
            "@ref": "gr2",
            "@mimetype": "image/jpeg"
          },
          {
            "@category": "high",
            "@height": "1228",
            "@width": "1250",
            "@_fa": "true",
            "$": "https://api.elsevier.com/content/object/eid/1-s2.0-S1381116914002416-gr11_lrg.jpg?httpAccept=%2A%2F%2A",
            "@multimediatype": "JPEG image file",
            "@type": "IMAGE-HIGH-RES",
            "@size": "194747",
            "@ref": "gr11",
            "@mimetype": "image/jpeg"
          },
          {
            "@category": "high",
            "@height": "1569",
            "@width": "1444",
            "@_fa": "true",
            "$": "https://api.elsevier.com/content/object/eid/1-s2.0-S1381116914002416-gr10_lrg.jpg?httpAccept=%2A%2F%2A",
            "@multimediatype": "JPEG image file",
            "@type": "IMAGE-HIGH-RES",
            "@size": "217945",
            "@ref": "gr10",
            "@mimetype": "image/jpeg"
          },
          {
            "@category": "high",
            "@height": "1423",
            "@width": "1444",
            "@_fa": "true",
            "$": "https://api.elsevier.com/content/object/eid/1-s2.0-S1381116914002416-gr1_lrg.jpg?httpAccept=%2A%2F%2A",
            "@multimediatype": "JPEG image file",
            "@type": "IMAGE-HIGH-RES",
            "@size": "236130",
            "@ref": "gr1",
            "@mimetype": "image/jpeg"
          },
          {
            "@category": "high",
            "@height": "886",
            "@width": "2213",
            "@_fa": "true",
            "$": "https://api.elsevier.com/content/object/eid/1-s2.0-S1381116914002416-fx1_lrg.jpg?httpAccept=%2A%2F%2A",
            "@multimediatype": "JPEG image file",
            "@type": "IMAGE-HIGH-RES",
            "@size": "127668",
            "@ref": "fx1",
            "@mimetype": "image/jpeg"
          },
          {
            "@category": "standard",
            "@height": "346",
            "@width": "376",
            "@_fa": "true",
            "$": "https://api.elsevier.com/content/object/eid/1-s2.0-S1381116914002416-gr9.jpg?httpAccept=%2A%2F%2A",
            "@multimediatype": "JPEG image file",
            "@type": "IMAGE-DOWNSAMPLED",
            "@size": "38879",
            "@ref": "gr9",
            "@mimetype": "image/jpeg"
          },
          {
            "@category": "standard",
            "@height": "303",
            "@width": "328",
            "@_fa": "true",
            "$": "https://api.elsevier.com/content/object/eid/1-s2.0-S1381116914002416-gr8.jpg?httpAccept=%2A%2F%2A",
            "@multimediatype": "JPEG image file",
            "@type": "IMAGE-DOWNSAMPLED",
            "@size": "27894",
            "@ref": "gr8",
            "@mimetype": "image/jpeg"
          },
          {
            "@category": "standard",
            "@height": "333",
            "@width": "334",
            "@_fa": "true",
            "$": "https://api.elsevier.com/content/object/eid/1-s2.0-S1381116914002416-gr7.jpg?httpAccept=%2A%2F%2A",
            "@multimediatype": "JPEG image file",
            "@type": "IMAGE-DOWNSAMPLED",
            "@size": "33150",
            "@ref": "gr7",
            "@mimetype": "image/jpeg"
          },
          {
            "@category": "standard",
            "@height": "328",
            "@width": "334",
            "@_fa": "true",
            "$": "https://api.elsevier.com/content/object/eid/1-s2.0-S1381116914002416-gr6.jpg?httpAccept=%2A%2F%2A",
            "@multimediatype": "JPEG image file",
            "@type": "IMAGE-DOWNSAMPLED",
            "@size": "37671",
            "@ref": "gr6",
            "@mimetype": "image/jpeg"
          },
          {
            "@category": "standard",
            "@height": "329",
            "@width": "320",
            "@_fa": "true",
            "$": "https://api.elsevier.com/content/object/eid/1-s2.0-S1381116914002416-gr5.jpg?httpAccept=%2A%2F%2A",
            "@multimediatype": "JPEG image file",
            "@type": "IMAGE-DOWNSAMPLED",
            "@size": "37824",
            "@ref": "gr5",
            "@mimetype": "image/jpeg"
          },
          {
            "@category": "standard",
            "@height": "337",
            "@width": "365",
            "@_fa": "true",
            "$": "https://api.elsevier.com/content/object/eid/1-s2.0-S1381116914002416-gr4.jpg?httpAccept=%2A%2F%2A",
            "@multimediatype": "JPEG image file",
            "@type": "IMAGE-DOWNSAMPLED",
            "@size": "42482",
            "@ref": "gr4",
            "@mimetype": "image/jpeg"
          },
          {
            "@category": "standard",
            "@height": "307",
            "@width": "324",
            "@_fa": "true",
            "$": "https://api.elsevier.com/content/object/eid/1-s2.0-S1381116914002416-gr3.jpg?httpAccept=%2A%2F%2A",
            "@multimediatype": "JPEG image file",
            "@type": "IMAGE-DOWNSAMPLED",
            "@size": "47194",
            "@ref": "gr3",
            "@mimetype": "image/jpeg"
          },
          {
            "@category": "standard",
            "@height": "321",
            "@width": "326",
            "@_fa": "true",
            "$": "https://api.elsevier.com/content/object/eid/1-s2.0-S1381116914002416-gr2.jpg?httpAccept=%2A%2F%2A",
            "@multimediatype": "JPEG image file",
            "@type": "IMAGE-DOWNSAMPLED",
            "@size": "46093",
            "@ref": "gr2",
            "@mimetype": "image/jpeg"
          },
          {
            "@category": "standard",
            "@height": "277",
            "@width": "282",
            "@_fa": "true",
            "$": "https://api.elsevier.com/content/object/eid/1-s2.0-S1381116914002416-gr11.jpg?httpAccept=%2A%2F%2A",
            "@multimediatype": "JPEG image file",
            "@type": "IMAGE-DOWNSAMPLED",
            "@size": "29533",
            "@ref": "gr11",
            "@mimetype": "image/jpeg"
          },
          {
            "@category": "standard",
            "@height": "354",
            "@width": "326",
            "@_fa": "true",
            "$": "https://api.elsevier.com/content/object/eid/1-s2.0-S1381116914002416-gr10.jpg?httpAccept=%2A%2F%2A",
            "@multimediatype": "JPEG image file",
            "@type": "IMAGE-DOWNSAMPLED",
            "@size": "33958",
            "@ref": "gr10",
            "@mimetype": "image/jpeg"
          },
          {
            "@category": "standard",
            "@height": "321",
            "@width": "326",
            "@_fa": "true",
            "$": "https://api.elsevier.com/content/object/eid/1-s2.0-S1381116914002416-gr1.jpg?httpAccept=%2A%2F%2A",
            "@multimediatype": "JPEG image file",
            "@type": "IMAGE-DOWNSAMPLED",
            "@size": "39246",
            "@ref": "gr1",
            "@mimetype": "image/jpeg"
          },
          {
            "@category": "standard",
            "@height": "200",
            "@width": "500",
            "@_fa": "true",
            "$": "https://api.elsevier.com/content/object/eid/1-s2.0-S1381116914002416-fx1.jpg?httpAccept=%2A%2F%2A",
            "@multimediatype": "JPEG image file",
            "@type": "IMAGE-DOWNSAMPLED",
            "@size": "16478",
            "@ref": "fx1",
            "@mimetype": "image/jpeg"
          },
          {
            "@category": "thumbnail",
            "@height": "164",
            "@width": "178",
            "@_fa": "true",
            "$": "https://api.elsevier.com/content/object/eid/1-s2.0-S1381116914002416-gr9.sml?httpAccept=%2A%2F%2A",
            "@multimediatype": "GIF image file",
            "@type": "IMAGE-THUMBNAIL",
            "@size": "4634",
            "@ref": "gr9",
            "@mimetype": "image/gif"
          },
          {
            "@category": "thumbnail",
            "@height": "163",
            "@width": "177",
            "@_fa": "true",
            "$": "https://api.elsevier.com/content/object/eid/1-s2.0-S1381116914002416-gr8.sml?httpAccept=%2A%2F%2A",
            "@multimediatype": "GIF image file",
            "@type": "IMAGE-THUMBNAIL",
            "@size": "4280",
            "@ref": "gr8",
            "@mimetype": "image/gif"
          },
          {
            "@category": "thumbnail",
            "@height": "163",
            "@width": "164",
            "@_fa": "true",
            "$": "https://api.elsevier.com/content/object/eid/1-s2.0-S1381116914002416-gr7.sml?httpAccept=%2A%2F%2A",
            "@multimediatype": "GIF image file",
            "@type": "IMAGE-THUMBNAIL",
            "@size": "4093",
            "@ref": "gr7",
            "@mimetype": "image/gif"
          },
          {
            "@category": "thumbnail",
            "@height": "164",
            "@width": "167",
            "@_fa": "true",
            "$": "https://api.elsevier.com/content/object/eid/1-s2.0-S1381116914002416-gr6.sml?httpAccept=%2A%2F%2A",
            "@multimediatype": "GIF image file",
            "@type": "IMAGE-THUMBNAIL",
            "@size": "4639",
            "@ref": "gr6",
            "@mimetype": "image/gif"
          },
          {
            "@category": "thumbnail",
            "@height": "164",
            "@width": "159",
            "@_fa": "true",
            "$": "https://api.elsevier.com/content/object/eid/1-s2.0-S1381116914002416-gr5.sml?httpAccept=%2A%2F%2A",
            "@multimediatype": "GIF image file",
            "@type": "IMAGE-THUMBNAIL",
            "@size": "4705",
            "@ref": "gr5",
            "@mimetype": "image/gif"
          },
          {
            "@category": "thumbnail",
            "@height": "164",
            "@width": "177",
            "@_fa": "true",
            "$": "https://api.elsevier.com/content/object/eid/1-s2.0-S1381116914002416-gr4.sml?httpAccept=%2A%2F%2A",
            "@multimediatype": "GIF image file",
            "@type": "IMAGE-THUMBNAIL",
            "@size": "4735",
            "@ref": "gr4",
            "@mimetype": "image/gif"
          },
          {
            "@category": "thumbnail",
            "@height": "164",
            "@width": "173",
            "@_fa": "true",
            "$": "https://api.elsevier.com/content/object/eid/1-s2.0-S1381116914002416-gr3.sml?httpAccept=%2A%2F%2A",
            "@multimediatype": "GIF image file",
            "@type": "IMAGE-THUMBNAIL",
            "@size": "6283",
            "@ref": "gr3",
            "@mimetype": "image/gif"
          },
          {
            "@category": "thumbnail",
            "@height": "164",
            "@width": "166",
            "@_fa": "true",
            "$": "https://api.elsevier.com/content/object/eid/1-s2.0-S1381116914002416-gr2.sml?httpAccept=%2A%2F%2A",
            "@multimediatype": "GIF image file",
            "@type": "IMAGE-THUMBNAIL",
            "@size": "6380",
            "@ref": "gr2",
            "@mimetype": "image/gif"
          },
          {
            "@category": "thumbnail",
            "@height": "164",
            "@width": "167",
            "@_fa": "true",
            "$": "https://api.elsevier.com/content/object/eid/1-s2.0-S1381116914002416-gr11.sml?httpAccept=%2A%2F%2A",
            "@multimediatype": "GIF image file",
            "@type": "IMAGE-THUMBNAIL",
            "@size": "6953",
            "@ref": "gr11",
            "@mimetype": "image/gif"
          },
          {
            "@category": "thumbnail",
            "@height": "164",
            "@width": "151",
            "@_fa": "true",
            "$": "https://api.elsevier.com/content/object/eid/1-s2.0-S1381116914002416-gr10.sml?httpAccept=%2A%2F%2A",
            "@multimediatype": "GIF image file",
            "@type": "IMAGE-THUMBNAIL",
            "@size": "4395",
            "@ref": "gr10",
            "@mimetype": "image/gif"
          },
          {
            "@category": "thumbnail",
            "@height": "164",
            "@width": "166",
            "@_fa": "true",
            "$": "https://api.elsevier.com/content/object/eid/1-s2.0-S1381116914002416-gr1.sml?httpAccept=%2A%2F%2A",
            "@multimediatype": "GIF image file",
            "@type": "IMAGE-THUMBNAIL",
            "@size": "5224",
            "@ref": "gr1",
            "@mimetype": "image/gif"
          },
          {
            "@category": "thumbnail",
            "@height": "88",
            "@width": "219",
            "@_fa": "true",
            "$": "https://api.elsevier.com/content/object/eid/1-s2.0-S1381116914002416-fx1.sml?httpAccept=%2A%2F%2A",
            "@multimediatype": "GIF image file",
            "@type": "IMAGE-THUMBNAIL",
            "@size": "3606",
            "@ref": "fx1",
            "@mimetype": "image/gif"
          }
        ]
      },
      "link": {
        "@rel": "abstract",
        "@href": "https://api.elsevier.com/content/abstract/scopus_id/84903649679"
      }
    }
  }
}