{
  "metadata": {
    "title": "Microwave radiation in the modification of iron Fischer–Tropsch catalysts",
    "authors": "; ; ",
    "journal": "Journal of Molecular Catalysis A: Chemical",
    "date": "2015-12-01",
    "doi": "10.1016/j.molcata.2015.06.014",
    "abstract": "",
    "uri": "https://api.elsevier.com/content/article/pii/S1381116915002265",
    "pii": "S1381116915002265"
  },
  "fulltext": {
    "full-text-retrieval-response": {
      "scopus-eid": "2-s2.0-84939813586",
      "originalText": "serial JL 271358 291210 291744 291790 291809 31 Journal of Molecular Catalysis A: Chemical JOURNALMOLECULARCATALYSISACHEMICAL 2015-07-21 2015-07-21 2015-08-21 2015-08-21 2016-01-22T07:01:00 1-s2.0-S1381116915002265 S1381-1169(15)00226-5 S1381116915002265 10.1016/j.molcata.2015.06.014 S300 S300.1 FULL-TEXT 1-s2.0-S1381116915X00112 2016-09-03T13:31:27.429615-04:00 0 0 20151201 2015 2015-07-21T16:38:46.946329Z absattachment articleinfo articletitlenorm authfirstinitialnorm authfirstsurnamenorm cid cids contenttype copyright crossmark dateloaded dateloadedtxt datesearch datesort dateupdated dco docsubtype doctype doi eid ewtransactionid hubeid indexeddate issn issnnorm itemstage itemtransactionid itemweight openaccess openarchive pg pgfirst pglast pii piinorm pubdatestart pubdatetxt pubyr sectiontitle sortorder srctitle srctitlenorm srctype ssids alllist content subj subheadings suppl tomb volfirst volissue volumelist webpdf webpdfpagecount yearnav figure table e-component body acknowledge affil appendices articletitle auth authfirstini authfull authkeywords authlast grantsponsor grantsponsorid highlightsabst primabst ref specialabst 1381-1169 13811169 true 409 409 C Volume 409 5 19 25 19 25 20151201 1 December 2015 2015-12-01 2015 Regular Papers article fla Copyright © 2015 Elsevier B.V. All rights reserved. MICROWAVERADIATIONINMODIFICATIONIRONFISCHERTROPSCHCATALYSTS DLAMINI W 1 Introduction 2 Experimental 3 Results and discussion 4 Conclusions Acknowledgments Appendix A Supplementary data References HORIKOSHI 2010 1441 S DRESSELHAUS 2001 M TOPICSINAPPLIEDPHYSICS BOND 1993 427 G ROUSSY 1995 G FOUNDATIONSINDUSTRIALAPPLICATIONSMICROWAVERADIOFREQUENCYFIELDS ROUSSY 1997 261 G ZHANG 2003 151 X ZAMAN 1995 159 J GETOFF 1990 407 N REUBROYCHAROEN 2007 375 P LIU 1999 147 Y ELIASON 1997 517 S STUDIESINSURFACESCIENCECATALYSIS XU 2005 2392 J NASSIR 1994 115 M MOON 1985 215 D RANKIN 1986 533 J MOON 1985 4363 D GRAF 2011 3701 B BENZIGER 1980 119 J LUND 1982 130 C DLAMINIX2015X19 DLAMINIX2015X19X25 DLAMINIX2015X19XW DLAMINIX2015X19X25XW UnderEmbargo 2017-08-21T00:00:00Z http://creativecommons.org/licenses/by-nc-nd/4.0/ item S1381-1169(15)00226-5 S1381116915002265 1-s2.0-S1381116915002265 10.1016/j.molcata.2015.06.014 271358 2016-01-22T02:43:56.334176-05:00 2015-12-01 1-s2.0-S1381116915002265-main.pdf https://s3-eu-west-1.amazonaws.com/prod-ucs-content-store-eu-west/content/pii:S1381116915002265/MAIN/application/pdf/6d55d4226821f0de643c929c0e7bb206/main.pdf https://s3.amazonaws.com/prod-ucs-content-store-us-east/content/pii:S1381116915002265/MAIN/application/pdf/6d55d4226821f0de643c929c0e7bb206/main.pdf main.pdf pdf true 1409538 MAIN 7 1-s2.0-S1381116915002265-main_1.png https://s3-eu-west-1.amazonaws.com/prod-ucs-content-store-eu-west/content/pii:S1381116915002265/PREVIEW/image/png/a26f4b8a8908b7ab8ad33f39eaf73ee9/main_1.png https://s3.amazonaws.com/prod-ucs-content-store-us-east/content/pii:S1381116915002265/PREVIEW/image/png/a26f4b8a8908b7ab8ad33f39eaf73ee9/main_1.png main_1.png png 56597 849 656 IMAGE-WEB-PDF 1 1-s2.0-S1381116915002265-fx1.sml https://s3-eu-west-1.amazonaws.com/prod-ucs-content-store-eu-west/content/pii:S1381116915002265/fx1/THUMBNAIL/image/gif/0b55db8cd294c5f0ab6d0ee684a4fd26/fx1.sml https://s3.amazonaws.com/prod-ucs-content-store-us-east/content/pii:S1381116915002265/fx1/THUMBNAIL/image/gif/0b55db8cd294c5f0ab6d0ee684a4fd26/fx1.sml fx1 true fx1.sml sml 3014 88 219 IMAGE-THUMBNAIL 1-s2.0-S1381116915002265-gr1.sml https://s3-eu-west-1.amazonaws.com/prod-ucs-content-store-eu-west/content/pii:S1381116915002265/gr1/THUMBNAIL/image/gif/7ccd15464825572f610bbfb9dd70a2c2/gr1.sml https://s3.amazonaws.com/prod-ucs-content-store-us-east/content/pii:S1381116915002265/gr1/THUMBNAIL/image/gif/7ccd15464825572f610bbfb9dd70a2c2/gr1.sml gr1 gr1.sml sml 15339 164 123 IMAGE-THUMBNAIL 1-s2.0-S1381116915002265-gr2.sml https://s3-eu-west-1.amazonaws.com/prod-ucs-content-store-eu-west/content/pii:S1381116915002265/gr2/THUMBNAIL/image/gif/d4bb2720eb27cc2da174c127ddd418fb/gr2.sml https://s3.amazonaws.com/prod-ucs-content-store-us-east/content/pii:S1381116915002265/gr2/THUMBNAIL/image/gif/d4bb2720eb27cc2da174c127ddd418fb/gr2.sml gr2 gr2.sml sml 16045 164 196 IMAGE-THUMBNAIL 1-s2.0-S1381116915002265-gr3.sml https://s3-eu-west-1.amazonaws.com/prod-ucs-content-store-eu-west/content/pii:S1381116915002265/gr3/THUMBNAIL/image/gif/b43a1882bc902d50312eacde7d1d9823/gr3.sml https://s3.amazonaws.com/prod-ucs-content-store-us-east/content/pii:S1381116915002265/gr3/THUMBNAIL/image/gif/b43a1882bc902d50312eacde7d1d9823/gr3.sml gr3 gr3.sml sml 13259 149 219 IMAGE-THUMBNAIL 1-s2.0-S1381116915002265-gr4.sml https://s3-eu-west-1.amazonaws.com/prod-ucs-content-store-eu-west/content/pii:S1381116915002265/gr4/THUMBNAIL/image/gif/e3855cf8c0147a84930e3d5702116d84/gr4.sml https://s3.amazonaws.com/prod-ucs-content-store-us-east/content/pii:S1381116915002265/gr4/THUMBNAIL/image/gif/e3855cf8c0147a84930e3d5702116d84/gr4.sml gr4 gr4.sml sml 12399 161 219 IMAGE-THUMBNAIL 1-s2.0-S1381116915002265-gr5.sml https://s3-eu-west-1.amazonaws.com/prod-ucs-content-store-eu-west/content/pii:S1381116915002265/gr5/THUMBNAIL/image/gif/6021a44f8bc92e3b1694c14ba291d3d3/gr5.sml https://s3.amazonaws.com/prod-ucs-content-store-us-east/content/pii:S1381116915002265/gr5/THUMBNAIL/image/gif/6021a44f8bc92e3b1694c14ba291d3d3/gr5.sml gr5 gr5.sml sml 15119 164 124 IMAGE-THUMBNAIL 1-s2.0-S1381116915002265-gr6.sml https://s3-eu-west-1.amazonaws.com/prod-ucs-content-store-eu-west/content/pii:S1381116915002265/gr6/THUMBNAIL/image/gif/38f80a8dd440f4e79137a3709418059f/gr6.sml https://s3.amazonaws.com/prod-ucs-content-store-us-east/content/pii:S1381116915002265/gr6/THUMBNAIL/image/gif/38f80a8dd440f4e79137a3709418059f/gr6.sml gr6 gr6.sml sml 16198 164 192 IMAGE-THUMBNAIL 1-s2.0-S1381116915002265-gr7.sml https://s3-eu-west-1.amazonaws.com/prod-ucs-content-store-eu-west/content/pii:S1381116915002265/gr7/THUMBNAIL/image/gif/ea743b5f944a372e9bb1af9c524059f2/gr7.sml https://s3.amazonaws.com/prod-ucs-content-store-us-east/content/pii:S1381116915002265/gr7/THUMBNAIL/image/gif/ea743b5f944a372e9bb1af9c524059f2/gr7.sml gr7 gr7.sml sml 16817 164 124 IMAGE-THUMBNAIL 1-s2.0-S1381116915002265-gr8.sml https://s3-eu-west-1.amazonaws.com/prod-ucs-content-store-eu-west/content/pii:S1381116915002265/gr8/THUMBNAIL/image/gif/6639dc1b1f7038e4e50f4fb70c62b083/gr8.sml https://s3.amazonaws.com/prod-ucs-content-store-us-east/content/pii:S1381116915002265/gr8/THUMBNAIL/image/gif/6639dc1b1f7038e4e50f4fb70c62b083/gr8.sml gr8 gr8.sml sml 14692 164 115 IMAGE-THUMBNAIL 1-s2.0-S1381116915002265-fx1.jpg https://s3-eu-west-1.amazonaws.com/prod-ucs-content-store-eu-west/content/pii:S1381116915002265/fx1/DOWNSAMPLED/image/jpeg/ac1729f6d42270115fb5a262e781a991/fx1.jpg https://s3.amazonaws.com/prod-ucs-content-store-us-east/content/pii:S1381116915002265/fx1/DOWNSAMPLED/image/jpeg/ac1729f6d42270115fb5a262e781a991/fx1.jpg fx1 true fx1.jpg jpg 9412 200 500 IMAGE-DOWNSAMPLED 1-s2.0-S1381116915002265-gr1.jpg https://s3-eu-west-1.amazonaws.com/prod-ucs-content-store-eu-west/content/pii:S1381116915002265/gr1/DOWNSAMPLED/image/jpeg/1f3cc3eb00b646fb4c991056063b88a1/gr1.jpg https://s3.amazonaws.com/prod-ucs-content-store-us-east/content/pii:S1381116915002265/gr1/DOWNSAMPLED/image/jpeg/1f3cc3eb00b646fb4c991056063b88a1/gr1.jpg gr1 gr1.jpg jpg 51824 449 337 IMAGE-DOWNSAMPLED 1-s2.0-S1381116915002265-gr2.jpg https://s3-eu-west-1.amazonaws.com/prod-ucs-content-store-eu-west/content/pii:S1381116915002265/gr2/DOWNSAMPLED/image/jpeg/987c1e6e80ff713643b0642c14caaf67/gr2.jpg https://s3.amazonaws.com/prod-ucs-content-store-us-east/content/pii:S1381116915002265/gr2/DOWNSAMPLED/image/jpeg/987c1e6e80ff713643b0642c14caaf67/gr2.jpg gr2 gr2.jpg jpg 55753 325 389 IMAGE-DOWNSAMPLED 1-s2.0-S1381116915002265-gr3.jpg https://s3-eu-west-1.amazonaws.com/prod-ucs-content-store-eu-west/content/pii:S1381116915002265/gr3/DOWNSAMPLED/image/jpeg/b6afddad0f825fce2edd130745f6d86a/gr3.jpg https://s3.amazonaws.com/prod-ucs-content-store-us-east/content/pii:S1381116915002265/gr3/DOWNSAMPLED/image/jpeg/b6afddad0f825fce2edd130745f6d86a/gr3.jpg gr3 gr3.jpg jpg 32403 262 385 IMAGE-DOWNSAMPLED 1-s2.0-S1381116915002265-gr4.jpg https://s3-eu-west-1.amazonaws.com/prod-ucs-content-store-eu-west/content/pii:S1381116915002265/gr4/DOWNSAMPLED/image/jpeg/5ce11fd0054dfaeff36f8602d284827e/gr4.jpg https://s3.amazonaws.com/prod-ucs-content-store-us-east/content/pii:S1381116915002265/gr4/DOWNSAMPLED/image/jpeg/5ce11fd0054dfaeff36f8602d284827e/gr4.jpg gr4 gr4.jpg jpg 30174 288 391 IMAGE-DOWNSAMPLED 1-s2.0-S1381116915002265-gr5.jpg https://s3-eu-west-1.amazonaws.com/prod-ucs-content-store-eu-west/content/pii:S1381116915002265/gr5/DOWNSAMPLED/image/jpeg/9479b9fea0ff67a5f725a6f78b0e19c7/gr5.jpg https://s3.amazonaws.com/prod-ucs-content-store-us-east/content/pii:S1381116915002265/gr5/DOWNSAMPLED/image/jpeg/9479b9fea0ff67a5f725a6f78b0e19c7/gr5.jpg gr5 gr5.jpg jpg 54812 495 374 IMAGE-DOWNSAMPLED 1-s2.0-S1381116915002265-gr6.jpg https://s3-eu-west-1.amazonaws.com/prod-ucs-content-store-eu-west/content/pii:S1381116915002265/gr6/DOWNSAMPLED/image/jpeg/d94328e2f84a0be669cede2b03ace59d/gr6.jpg https://s3.amazonaws.com/prod-ucs-content-store-us-east/content/pii:S1381116915002265/gr6/DOWNSAMPLED/image/jpeg/d94328e2f84a0be669cede2b03ace59d/gr6.jpg gr6 gr6.jpg jpg 56596 327 383 IMAGE-DOWNSAMPLED 1-s2.0-S1381116915002265-gr7.jpg https://s3-eu-west-1.amazonaws.com/prod-ucs-content-store-eu-west/content/pii:S1381116915002265/gr7/DOWNSAMPLED/image/jpeg/5863a3c1902697ce8304385c8bc8cefa/gr7.jpg https://s3.amazonaws.com/prod-ucs-content-store-us-east/content/pii:S1381116915002265/gr7/DOWNSAMPLED/image/jpeg/5863a3c1902697ce8304385c8bc8cefa/gr7.jpg gr7 gr7.jpg jpg 81598 506 383 IMAGE-DOWNSAMPLED 1-s2.0-S1381116915002265-gr8.jpg https://s3-eu-west-1.amazonaws.com/prod-ucs-content-store-eu-west/content/pii:S1381116915002265/gr8/DOWNSAMPLED/image/jpeg/d4f8471a3c0ff37624b9445692eaa72c/gr8.jpg https://s3.amazonaws.com/prod-ucs-content-store-us-east/content/pii:S1381116915002265/gr8/DOWNSAMPLED/image/jpeg/d4f8471a3c0ff37624b9445692eaa72c/gr8.jpg gr8 gr8.jpg jpg 79154 551 386 IMAGE-DOWNSAMPLED 1-s2.0-S1381116915002265-fx1_lrg.jpg https://s3-eu-west-1.amazonaws.com/prod-ucs-content-store-eu-west/content/pii:S1381116915002265/fx1/HIGHRES/image/jpeg/f0bed54142333ffc9aa57d17e6f13bcf/fx1_lrg.jpg https://s3.amazonaws.com/prod-ucs-content-store-us-east/content/pii:S1381116915002265/fx1/HIGHRES/image/jpeg/f0bed54142333ffc9aa57d17e6f13bcf/fx1_lrg.jpg fx1 true fx1_lrg.jpg jpg 70476 886 2213 IMAGE-HIGH-RES 1-s2.0-S1381116915002265-gr1_lrg.jpg https://s3-eu-west-1.amazonaws.com/prod-ucs-content-store-eu-west/content/pii:S1381116915002265/gr1/HIGHRES/image/jpeg/1f663d41432ca942557ba7e9d7531031/gr1_lrg.jpg https://s3.amazonaws.com/prod-ucs-content-store-us-east/content/pii:S1381116915002265/gr1/HIGHRES/image/jpeg/1f663d41432ca942557ba7e9d7531031/gr1_lrg.jpg gr1 gr1_lrg.jpg jpg 232553 1991 1493 IMAGE-HIGH-RES 1-s2.0-S1381116915002265-gr2_lrg.jpg https://s3-eu-west-1.amazonaws.com/prod-ucs-content-store-eu-west/content/pii:S1381116915002265/gr2/HIGHRES/image/jpeg/942cb103826e44d993c913a9a6907367/gr2_lrg.jpg https://s3.amazonaws.com/prod-ucs-content-store-us-east/content/pii:S1381116915002265/gr2/HIGHRES/image/jpeg/942cb103826e44d993c913a9a6907367/gr2_lrg.jpg gr2 gr2_lrg.jpg jpg 230712 1439 1724 IMAGE-HIGH-RES 1-s2.0-S1381116915002265-gr3_lrg.jpg https://s3-eu-west-1.amazonaws.com/prod-ucs-content-store-eu-west/content/pii:S1381116915002265/gr3/HIGHRES/image/jpeg/44c5f7b6375d4e6b2bb63902509f5857/gr3_lrg.jpg https://s3.amazonaws.com/prod-ucs-content-store-us-east/content/pii:S1381116915002265/gr3/HIGHRES/image/jpeg/44c5f7b6375d4e6b2bb63902509f5857/gr3_lrg.jpg gr3 gr3_lrg.jpg jpg 140052 1162 1706 IMAGE-HIGH-RES 1-s2.0-S1381116915002265-gr4_lrg.jpg https://s3-eu-west-1.amazonaws.com/prod-ucs-content-store-eu-west/content/pii:S1381116915002265/gr4/HIGHRES/image/jpeg/408b816c2574d19723acfcbe64684baf/gr4_lrg.jpg https://s3.amazonaws.com/prod-ucs-content-store-us-east/content/pii:S1381116915002265/gr4/HIGHRES/image/jpeg/408b816c2574d19723acfcbe64684baf/gr4_lrg.jpg gr4 gr4_lrg.jpg jpg 132710 1277 1733 IMAGE-HIGH-RES 1-s2.0-S1381116915002265-gr5_lrg.jpg https://s3-eu-west-1.amazonaws.com/prod-ucs-content-store-eu-west/content/pii:S1381116915002265/gr5/HIGHRES/image/jpeg/855fea8c5a6ab792585862d21648aa00/gr5_lrg.jpg https://s3.amazonaws.com/prod-ucs-content-store-us-east/content/pii:S1381116915002265/gr5/HIGHRES/image/jpeg/855fea8c5a6ab792585862d21648aa00/gr5_lrg.jpg gr5 gr5_lrg.jpg jpg 258685 2195 1659 IMAGE-HIGH-RES 1-s2.0-S1381116915002265-gr6_lrg.jpg https://s3-eu-west-1.amazonaws.com/prod-ucs-content-store-eu-west/content/pii:S1381116915002265/gr6/HIGHRES/image/jpeg/5d3850eeaee9295d5f8b8b906f317eaf/gr6_lrg.jpg https://s3.amazonaws.com/prod-ucs-content-store-us-east/content/pii:S1381116915002265/gr6/HIGHRES/image/jpeg/5d3850eeaee9295d5f8b8b906f317eaf/gr6_lrg.jpg gr6 gr6_lrg.jpg jpg 252132 1449 1699 IMAGE-HIGH-RES 1-s2.0-S1381116915002265-gr7_lrg.jpg https://s3-eu-west-1.amazonaws.com/prod-ucs-content-store-eu-west/content/pii:S1381116915002265/gr7/HIGHRES/image/jpeg/3d4a1277f212f9ecea4fa596b65b4979/gr7_lrg.jpg https://s3.amazonaws.com/prod-ucs-content-store-us-east/content/pii:S1381116915002265/gr7/HIGHRES/image/jpeg/3d4a1277f212f9ecea4fa596b65b4979/gr7_lrg.jpg gr7 gr7_lrg.jpg jpg 433593 2242 1697 IMAGE-HIGH-RES 1-s2.0-S1381116915002265-gr8_lrg.jpg https://s3-eu-west-1.amazonaws.com/prod-ucs-content-store-eu-west/content/pii:S1381116915002265/gr8/HIGHRES/image/jpeg/ddc3fa30f617092d16cafa25d7db91f4/gr8_lrg.jpg https://s3.amazonaws.com/prod-ucs-content-store-us-east/content/pii:S1381116915002265/gr8/HIGHRES/image/jpeg/ddc3fa30f617092d16cafa25d7db91f4/gr8_lrg.jpg gr8 gr8_lrg.jpg jpg 401116 2437 1708 IMAGE-HIGH-RES 1-s2.0-S1381116915002265-mmc1.doc https://s3-eu-west-1.amazonaws.com/prod-ucs-content-store-eu-west/content/pii:S1381116915002265/mmc1/MAIN/application/msword/fbaa3efbbfd45d2dc518cda5141a9a16/mmc1.doc https://s3.amazonaws.com/prod-ucs-content-store-us-east/content/pii:S1381116915002265/mmc1/MAIN/application/msword/fbaa3efbbfd45d2dc518cda5141a9a16/mmc1.doc mmc1 mmc1.doc doc 755712 APPLICATION MOLCAA 9528 S1381-1169(15)00226-5 10.1016/j.molcata.2015.06.014 Elsevier B.V. Fig. 1 Effluent fractions of selected components formed during the TPSR run using 1.4K/Fe catalyst. Fig. 2 TPSR profiles of (a) 0.5K/Fe and 0.5K/Fe-MW showing contributions for the individual carbon species. Fig. 3 Percentage increases in methane evolution induced by microwave pretreatment for the various loadings of potassium. Fig. 4 Total methane evolution in TPSR for the 0.7K/Fe-MW catalysts as a function of radiation duration. Fig. 5 Effluent mole fractions of the components CH4, H2O (m/z =17), H2O (m/z =18), CO and CO2 formed during the TPSR experiment using the 1.5K/Fe catalyst. Fig. 6 Methane profiles recorded during the TPSR experiment using (a) an FID detector and (b) a QMS spectrometer for the 1.5K/Fe catalyst before microwave treatment. Fig. 7 TPSR profiles for CH4 evolution for 0K/Fe. 0.2K/Fe, 0.5K/Fe, 0.7K/Fe, 1.0K/Fe and 1.5K/Fe catalysts. The profiles were recorded before microwave treatment. The fitted Gaussian curves are shown as dotted lines. Fig. 8 TPSR profiles for CH4 evolution for 0K/Fe. 0.2K/Fe, 0.5K/Fe, 0.7K/Fe, 1.0K/Fe and 1.5K/Fe catalysts. Microwave pretreatment conditions: 450W, 10s. The fitted Gaussian curves are shown as green lines. (For interpretation of the references to color in this figure legend, the reader is referred to the web version of this article.) Table 1 A comparison of the relative % composition of surface C types before and after microwave radiation (450W, 10s) for all catalysts examined by TPSR. Catalyst Fe loading (wt%) K loading (wt%) Calculated Actual Calculated Actual 0K/10Fe/SiO2 0.0 10.1 0.0 0.01 0.2K/10Fe/SiO2 10.0 10.4 0.2 0.24 0.5K/10Fe/SiO2 10.0 10.4 0.5 0.54 0.7K/10Fe/SiO2 10.0 10.4 0.7 0.79 1.0K/10Fe/SiO2 10.0 10.2 1.0 1.09 1.5K/10Fe/SiO2 10.0 10.0 1.5 1.59 0K/10Fe/SiO2 a 10.0 10.1 0.0 0.01 a This analysis was a repeat to check instrument precision. Table 2 Reduction temperatures for 2 peaks in the TPR runs, before and after (450W, 10s) microwave treatment. Sample Untreated (°C) Microwave treated (°C) Peak 1 Peak 2 Peak 1 Peak 2 0K/Fe 380 594 376 589 0.2K/Fe 387 632 385 631 0.5K/Fe 402 636 407 657 0.7K/Fe 421 646 420 661 1.0K/Fe 431 646 431 647 1.5K/Fe 452 646 448 643 Microwave radiation in the modification of iron Fischer–Tropsch catalysts W.M. Dlamini a N.J. Coville a M.S. Scurrell b ⁎ a Molecular Sciences Institute, School of Chemistry, University of the Witwatersrand, Johannesburg, South Africa Molecular Sciences Institute, School of Chemistry, University of the Witwatersrand Johannesburg South Africa b Department of Civil and Chemical Engineering, University of South Africa, Florida, Johannesburg, South Africa Department of Civil and Chemical Engineering, University of South Africa, Florida Johannesburg South Africa ⁎ Corresponding author. Graphical abstract Potassium-promoted unsupported iron Fischer–Tropsch catalysts have been subjected to microwave radiation treatment as part of the catalyst preparation process. The treatment is applied after the catalysts have been dried and calcined. Solid-state modifications occur which result in changes in the manner and quantity of carbon monoxide adsorbed on the surface as detected by temperature programmed surface reaction (TPSR) with hydrogen. Methane is the essential product of the TPSR runs. The response to microwave treatment is an increase in the methane production at all potassium levels, but the magnitude of the increase is potassium-loading dependent and peaks at a potassium loading of 0.7wt%. Microwave-induced changes in TPSR characteristics appear to result from selective heating occurring almost immediately on exposure of the catalysts to radiation. Longer duration of microwave exposure does not appear to result in further changes. Keywords Iron Fischer–Tropsch synthesis Microwave radiation Potassium TPSR Carbon monoxide adsorption 1 Introduction Industrial and domestic microwave operate at 915MHz or 2.45GHz (wavelength 32.8 or 12.2cm, respectively) to avoid interfering with radar or telecommunication frequencies. Within this region of electromagnetic energy, only molecular rotations of molecules are affected by the radiation. Microwave energy consists of two components: an electric field and a magnetic field, though only the electric field transfers energy to heat a substance. The energy in microwave photons (9.65×10−4–9.65×10−2 kJ/mol) is very low relative to the typical energy required to cleave molecular bonds (335–500kJ/mol) and therefore microwaves do not directly affect molecular structure. However, local heating effects and, in particular temperature gradients may be set up when exposing suitable solids to microwave radiation [1]. The physics of the effects are such that nanosized domains are expected to be more responsive to microwave-induced effects and so catalytic solids are likely to exhibit interesting characteristics. Tremendous efforts are being made toward controlling the particle size, particle size distribution, shape, dispersion and structure of nanomaterials using the effective heating provided by microwave irradiation. Horikoshi et al. [2] have shown that microwave heating leads to a 5.7-fold enhancement of the heating rate relative to oil-bath heating when synthesizing silver nanoparticles. This was after they observed that heating an aqueous solution of carboxymethylcellulose/diaminesilver(I) solution at continuous 64W microwave irradiation gave a 0.51°Cs−1 heating rate, whereas for the oil-bath heating method a rate of 0.09°Cs−1 was obtained at a power consumption of 400W. Consequently, smaller particles with a fairly narrow particle size distribution (1.8–3.6nm; average size ∼3nm) were achieved under microwave heating, while conventional heating produced a broader particle size distribution of 1–5nm. Another recent application of microwave heating is in the purification of carbon nanotubes (CNTs), with several researchers reporting improved results of purification by microwave assisted acid digestion. It has been shown theoretically and experimentally that a “perfect” CNT is a ballistic conductor, that is, with quantized resistance, independent of length due to its unique 1D structure [3]. Therefore microwave energy is not transferred into the CNT structure but to any impurities that may be present, for example, the metal particles from which CNTs are grown. As the catalysts metal particles are exposed to radiation, localized heating is observed thus promoting their removal from the CNT. In contrast, laboratory prepared CNTs have structural imperfections. Research in catalysis is motivated in part by the possibility of designing nanostructured catalysts that possess novel catalytic properties such as low-temperature activity, selectivity, stability, resistance to poisoning and degradation effects. Since the energy of microwave quanta is not sufficient to achieve direct electronic excitation of reagents or the breaking of chemical bonds, microwave heating is considered to be a probable way for activating solid catalysts. Natural gas, which is between 70 and 90% methane, is an environmentally friendly and abundant resource that has been studied extensively. Methods have been explored to provide to provide an economically viable process for the production of higher hydrocarbons, methanol and synthesis gas from methane. Since 1982, the oxidative coupling of methane (OCM) to produce ethylene and higher hydrocarbons has received world-wide attention as a potentially interesting process for upgrading natural gas. In the OCM process, methane and oxygen are fed over a metal or metal oxide catalyst at moderate temperatures (500–800°C) to give higher hydrocarbons. However, this selective transformation of methane into Cn-hydrocarbons (n ≥2) encounters many challenges because it requires high temperatures, high pressures, the necessity for special catalysts, etc. As an alternative to conventional heating, applying the microwave heating technology to the OCM process offers a potential solution to these problems. A comprehensive study comparing conventional and microwave heating in the oxidative coupling of methane has been done by Bond et al. [4] using various basic oxides. In this study it was found that the use of microwave radiation resulted in C2 formation occurring at much lower temperatures, and an increase in selectivity was also reported. Roussy et al. [5] also revealed an enhancement in C2+ selectivity with microwave irradiation of (SmLiO2)0.8(CaO−MgO)0.2 catalysts, which they attributed to the gas being colder than the catalyst bed under microwave radiation. This indicates the formation of “hot spots” with temperatures very much in excess of the bulk catalyst that stimulate the reaction. Other researchers who obtained similar results with BaBiO3-x and Li/MgO catalysts suggested that the electromagnetic field decreased the concentration of oxygen species at the catalytic surface and gas quenching at the outlet of the catalytic bed [6]. Zhang et al. [7] have studied methane conversion and C2 yields as a function of temperature under both heating methods in the absence of oxygen. In their findings they noted that the production of ethane using microwave heating occurred at temperatures some 250°C below the temperature at which ethane was first detected under conventional heating. The catalytic conversion of hydrogen sulfide into hydrogen and sulfur is commercially important for the coal and petrochemical industry. Hydrogen sulfide is a by-product from the sweetening of sour natural gas, the hydrodesulphurization of light hydrocarbons, and from the upgrading of heavy oils, bitumens and coal. On its own, H2S has restricted industrial applications and it causes damage to the environment since it is a strong acid pollutant. However, it has a potentially high economic value if both the sulfur and hydrogen gas can be recovered. Hydrogen finds many applications in industry, for example, in hydrocracking and in hydrotreating to produce fuels, in the synthesis of ammonia and methanol, and in fuel cells. H2S splitting is highly endothermic and it is associated with relatively low conversion efficiencies even if the reaction is performed at high temperatures. Numerous procedures are being developed to enhance this decomposition process [8,9] and microwave-assisted decomposition of hydrogen sulfide is one possible solution. On molybdenum sulfide/γ-alumina (impregnated or mechanically mixed) catalysts, using an optical fiber thermometer to monitor the temperature, experiments have revealed higher temperatures in some catalyst bed sites compared to the average temperature measured. This is evidence for the presence of “hot spots” and is associated with high reaction rates. In Fischer–Tropsch synthesis (FTS) catalysis, Reubroycharoen et al. [10] have applied the advantages offered by microwave heating to the synthesis of highly active Co-based Fischer–Tropsch catalysts. Instead of calcining their catalysts conventionally, the authors calcined them using microwave radiation. As a result, monodispersed catalysts were obtained and the agglomeration associated with conventional calcination was not seen. The catalysts that were calcined using microwave irradiation also displayed much higher catalytic activities in Fischer–Tropsch synthesis when compared to their conventionally calcined counterparts. A CO conversion of 69% and a chain-growth probability α value of 0.85 was obtained under conventional drying, while 14min of microwave drying gave a CO conversion of about 82% and a chain-growth probability of 0.88. The differences in the catalyst properties were attributed to the volumetric heating nature of microwaves, which gives uniform heating. Liu et al. [11] reported similar microwave effects on V2O5/SiO2 catalysts that are used in the oxidation of o-xylene to phthalic anhydride. Recently, studies reported by Linganiso et al. [1] in our laboratories showed that microwave pretreatment of Fischer–Tropsch catalysts in the solid-state improved the catalytic properties. Using Secondary Ion Mass Spectrometry (SIMS) it was shown that the surface Fe:K ratio changed from 0.055 to 0.095 after microwave pretreatment. This change in surface composition is believed to be caused by the migration of potassium ions to the iron surface during microwave irradiation. These results form the starting point for the work done in this study. In reviewing the earlier work the most significant changes in the catalysts were the surface composition as revealed by SIMS and the surface reactivity of carbon (probably as CO) when CO was preadsorbed and subsequently reacted with dihydrogen in TPSR experiments. TPSR profiles were influenced by microwave radiation and the detailed structure proved to be a function of the radiation power level. The overall catalytic effects in separate flow reactor studies were (1) a slight increase in activity of FTS and WGS reactions, (2) a substantial decrease in methane selectivity, and (3) other changes in hydrocarbon product selectivity. We felt that the furthering of our understanding for these effects would best be served by a focus on the surface properties as monitored by TPSR of preadsorbed CO. According this paper investigates this aspect is some depth. We have confined our catalysts to unsupported iron. Unsupported (but fused) iron catalysts are used in the high productivity FTS installations operated in South Africa by SASOL. We have studied catalysts promoted with potassium at various levels since potassium was implicated in the earlier work as a probably vehicle for the influence of microwave radiation on the surface and catalytic behavior observed [1]. 2 Experimental Unsupported and silica supported iron catalysts were prepared in this study. The methodology used for each type of catalyst preparation is discussed below. The K/Fe catalysts used in this study were prepared using the pH-controlled continuous precipitation procedure as described by Kölbel and Raleek. A 4M solution of Fe(NO3)3·9H2O was precipitated by the drop-wise addition of 12M NH4OH to a pH of 7.2 with continuous stirring. The resultant slurry was stirred for an additional 15min and the final pH was recorded. A centrifuge was used to separate the precipitate from the liquid. The centrifuge speed used was 5000rpm and this was done for 15min. The precipitate was then dried at room temperature for 12h. Subsequently, the precipitate was kept at 120°C for 12h to remove water that was incorporated within the precipitate. Calcination was performed at 350°C for 6.5h using a heating rate of 10°C/min. For the promoted catalysts, appropriate amounts of K2CO3 solutions were added to the calcined precursor via the incipient wetness pore-filling procedure. The mixture was then re-dried at 120°C for 12h and calcined at 350°C for 6.5h. The prepared samples had potassium loadings of 0.2, 0.5, 0.7, 1.0 and 1.5 weight percent. For brevity, these catalysts were referred to as xK/Fe, where x is the weight percent of the K loading. About 0.5g catalyst mass was evenly distributed in a microwave-transparent Petri dish. A Defy (900W, 2.45GHz) domestic microwave was used to pretreat the already prepared catalysts. All microwave pretreatment experiments were done in the solid state. Microwave pretreatment was done for 10s at a power level of 450W. The effect of the microwave irradiation time has also been studied. The pretreatment time was increased from 10s to 20, 30, 40, 60, 300 and 600s. The power level was maintained at 450W for all experiments. Nitrogen adsorption studies were conducted done using the BET method to measure specific surface area, pore volume and pore size distribution of a sample with a Micromeritics TRISTAR 3000 analyzer and adsorption–desorption curves were used to provide a pore size distributions using the standard BJH treatment. Elemental composition of the samples was confirmed using XRF (Panalytical PW12404 wavelength dispersive XRF spectrometer). X-rays were generated using a Rh tube with K α =24.9 and K β =22 and samples were first mixed with 2% Mowiol binder (polyvinyl glue) before being pressed to pellets using 10MPa pressure. Thin samples for TEM analysis were prepared by crushing the K/Fe catalysts with a mortar and pestle followed by dispersion in methanol using an ultrasonic bath. An appropriate amount of the sample was then placed onto a carbon coated copper grid, dried and then introduced into the microscope. The samples were studied using a TECHNAI G2 SPIRIT transmission electron microscope operating at an accelerating voltage of 120keV. EDS was used to identify the elemental composition of the catalysts. Thermoanalytical techniques are amongst the most important and widely used methods for the characterization of solid materials. Temperature programmed reduction (TPR) is a convenient technique for rapidly assessing the reducibility of samples and runs were performed using a Micromeritics AutoChem II 2920 unit fitted with a TCD detector. PXRD measurements in this work were performed using a D8 Bruker X-ray diffractometer utilizing Ni filtered copper Kα radiation at 40kV and 40mA. The diffraction patterns were recorded in the scan range of 10°<2θ <90°. From the recorded patterns, the phases present were identified by comparing the patterns with those reported in the Diffracplus evaluation package using EVA (V11.0) software package. Mean crystallites sizes were evaluated using the Scherrer line-broadening equation. The FTS reaction produces a wide spectrum of hydrocarbon chains, and this process starts from the dissociation of CO and H2 on transient metal surfaces and follows with the hydrogenation and polymerization of surface carbon species. Since the dissociation of CO is one of the key steps in FTS, it is important to investigate the kinetics and the thermodynamics of CO adsorption and its subsequent dissociation on iron catalysts. Using temperature-programmed techniques surface active carbons have been found to be key intermediates in CO hydrogenation, and they have important influences on the activity, selectivity and stability of a catalyst. TPSR is a surface sensitive technique that was used to assess the effect of potassium on the catalytic sites of microwaved samples. A purpose designed TPSR assembly was used and comprised a gas manifold, a reactor heating unit, a gas chromatograph and a mass spectrometer. This set-up is identical to that used by Lingansio et al. [1]. Catalyst (70mg) was held in a quartz tube using a plug of quartz wool. Reduction of the catalyst was carried out for 6h with pure H2 at 350°C and 0.2MPa. The flow rate of H2 was kept at 45ml/min. Once reduction was complete, the reactor was cooled down to 25°C in Ar and then held at 25°C for 30min to ensure the removal of gaseous H2. The reduced catalyst was then exposed to CO at this temperature and 0.3MPa for 1h using a flow of 5% CO balanced in Ar. The gas flow rate was maintained at 30ml/min during CO adsorption. Physisorbed CO was subsequently flushed out of the reactor using Ar for 30min, ensuring that the TCD baseline stabilized. H2 was then reintroduced into the reactor to couple with the adsorbed carbon species, using a flow rate of 20ml/min. The temperature of the reactor was ramped from 25 to 800°C, at a rate of 10°C/min. Desorbed hydrocarbons and other gases were monitored using a gas chromatography instrument equipped with a flame ionization detector (FID) and a methanator. The FID was kept at 220°C and the GC oven temperature was maintained at 250°C. The methanator comprised a nickel catalyst, and it was held at 300°C. The methanator was normally bypassed during analysis. A Baltzers Prisma quadrupole mass spectrometer (QMS) was also connected to the system to confirm the identity of the products obtained. Profiles of the effluent mole fractions for the components CH4, H2O, CO2 and CO were recorded independently on the QMS when performing these experiments. Preliminary data recorded during the TPSR-MS experiments showed that higher hydrocarbons (C2, C3, etc.) were not detected during the TPSR-MS experiments. Deconvolution of the TPSR profiles was achieved by using the Origin 8 software. The deconvoluted data was used to provide information on the contributions of various forms carbon to the total methane produced. Deconvolution of the profiles was done by fitting multiple Gaussian peaks to the profiles. Correlation co-efficient values (R2) between the actual data and the fitted data that were greater than 0.95 were taken to be adequate. Methane calibration was carried out to quantify the hydrocarbons that were produced during TPSR experiments. From preliminary runs it was established that the FID determinations were in excellent agreement with the MS measurements and so FID analyses were routinely used for the rest of the work. All gases used in this study were supplied by AFROX (African Oxygen) Ltd. The gases used for catalyst characterization and catalyst reduction were Ultra High Purity (UHP) grade gases (99.997% purity 3 Results and discussion Catalyst particles were nanosized and largely spherical as shown in the TEM images (Figs. S1 and S2). The mean particle sizes, estimated by measuring the dimensions of at least 300 individual particles were typically in the range 18–28nm in diameter, and were essentially unaffected by microwave treatment. The mean sizes did however increase slightly with increasing K content. TPR runs confirmed a two-step reduction that is ascribed to the reduction of Fe2O3 to Fe3O4 (peak 1) and Fe3O4 to FeO and Fe (peak 2). Peaks moved to significantly higher temperature (especially the peak 1) as the K content of the catalysts was increased (Figs. S3–S5). The profiles were, however, essentially unchanged after microwave radiation (Fig. S5). Even though reduction will commence at the outer surface of the iron oxide particles, TPR characteristics reflect the bulk properties of unsupported catalysts and microwave effects appear to be largely confined to surface properties. The TPSR experiments do however demonstrate clearly the effect that microwave radiation exerts of surface (and hence catalytic) properties. From the profiles shown in Fig. 1 (see also Figs. S6–S9). It can be appreciated that CH4 formation starts at 251°C and stops at 763°C when the 1.5K/Fe catalyst is used. Within this temperature range, the simultaneous evolution of H2O, CO2 and CO is noted as the adsorbed CO is hydrogenated. According to our experiments, which were performed in order to investigate the adsorption characteristics of CO on iron, most of the CO was adsorbed dissociatively, with only a small fraction was adsorbed in the molecular state. The CO profile Fig. 1 reveals the presence of two signals, a small but broad peak at 180°C and a large peak with a maximum at 731°C. The CO signal at 180°C is due to the desorption of molecularly adsorbed CO, while the signal observed at 731°C is due to CO desorption after recombination of dissociatively adsorbed CO fragments leading to CO and CO2 formation. This is confirmed by an analysis of the CO2 profile which is displayed in the same figure. Recombination of dissociatively adsorbed CO on Fe(100) is known to occur in the temperature range from 427 to 627°C [13–15]. The CO2 signal at 280°C is due reaction of CO with H2O via the water gas shift (WGS) reaction. Methane evolution (due to reaction of adsorbed carbon monoxide or carbon with H2) as recorded using both an FID detector and a quadrupole mass spectrometer (QMS) during the TPSR experiment is displayed in Fig. 2a and b, respectively. The recorded signals are broad, indicating that several overlapping peaks coexist. Differences in the signals recorded using the FID and the QMS are mainly due to the overlapping of peaks. To quantitatively analyze the overlapping peaks, the TPSR profiles were fitted with Gaussian curves to yield several peaks. From the deconvoluted spectra, five CH4 peaks are observed, signifying that there were five types of carbon species deposited on the catalyst surface before it was hydrogenated to form methane. These five kinds of carbon species are assigned to α1, α2, β, γ and δ (Table 1 ) and the information obtained from these peaks is discussed in subsequent sections. Eliason and Bartholomew [16] also used a similar method when performing a quantitative analysis of their overlapping peaks for unpromoted and K-promoted Fe FT catalysts from TPSR. The mass spectrometry experiment was performed simultaneously to verify the identity of the species evolved in the TPSR experiment. Most of the experiments in this work were then performed using a flame ionization detector (FID) since it was observed that the results recorded using the FID were comparable to those obtained using a quadrupole mass spectrometer. TPSR profiles for methane evolution from the catalysts with varying loadings of potassium are compared in Fig. S6. It can be seen that CH4 peaks from the 0K/Fe catalyst lie in the temperature range of 300–700°C, while the peaks from the 1.5K/Fe catalyst lie in the temperature range of 300–785°C. It is evident that the CH4 peaks shift to higher temperatures as the loading of potassium is increased. The peaks are quite broad, indicating that several overlapping peaks coexist. As before, these overlapping peaks were analyzed by fitting Gaussian curves that yielded several peaks. The five CH4 signals observed from the deconvoluted spectra signify that there were five kinds of carbon species deposited on the catalyst surface before hydrogenation to form methane. The five peaks are assigned as the α1, α2, β, γ, and δ species, corresponding to: two forms of adsorbed atomic carbon, amorphous surface methylene chains or films, bulk iron carbide, or graphitic carbon. Peak temperatures increase in that same order, i.e., in the order of decreasing reactivity with H2. The peak assignments of these species are based on previous literature reports [17]. This assessment was done to establish if a correlation exists between the active surface carbon species formed on the catalyst and the amount of potassium loaded in the catalyst. The adsorption of CO on iron single crystals has been reported in the literature by quite a few researchers [13–15,18]. Usually, when temperature programmed desorption (TPD) experiments are carried out with CO on a Fe(100) surface four desorption peaks are reported. The three peaks at low temperatures were identified to be due to the desorption of CO from the molecularly adsorbed state, whereas the high temperature peak was due to a recombination of dissociatively adsorbed CO fragments [14]. From the data in Fig. 3 and Table 1 it is evident that the overall amount of CH4 evolved increases with the content of the potassium promoter in the catalyst. This observation is rather unusual since certain catalytically active sites are expected to be blocked as the loading of potassium increases, as reported elsewhere [12]. However, the respective peak areas indicate that this increase in CH4 is largely due to the γ- and δ-species which are favored at high potassium loadings. The highest percentage of methane formed from α carbon is seen when K=0.2wt%, and thereafter the percentage of CH4 decreases steadily with an increase in potassium content. In contrast, the amount of methane formed from both carbide carbon and graphitic carbon increases as the loading of potassium is increased. The exact positions for Peak 1 and Peak 2 for the different catalysts are listed in Table 2 . The first reduction peak shifts significantly to higher temperatures as the loading of potassium is increased, indicating that the reduction of the catalyst is inhibited by the addition of potassium. This may be the result of the strong interaction between potassium oxide and iron oxide. The strong interaction of potassium oxide with iron oxide could suppress the adsorption of hydrogen on the catalyst surface and therefore restrain the reduction of iron oxide underlying and/or neighboring the potassium promoter [18,19]. The increase in particle size of the crystallites seen in TEM could also lead to a decrease in the surface area exposed to the H2 reductant; this could also lead to the reduction behavior displayed in Fig. 4 . Studies done by Li using temperature programmed and isothermal reduction at 573K also showed that potassium retarded the reduction of iron when H2 was used as the reductant [20]. Unlike Peak 1, the shift to high temperatures for Peak 2 is not as pronounced in the various samples. Fig. 5 shows typical profiles of the effluent mole fractions for the components CH4, H2O, CO2 and CO as obtained from a quadrupole mass spectrometer (QMS) during a TPSR experiment. For water analysis, mass-to-charge ratios (m/z) of 17 and 18 were monitored as shown. In the TPSR experiment, CO was adsorbed for an hour on a prereduced 1.5K/Fe catalyst. The adsorbed CO was then hydrogenated as a function of temperature and the evolved species were monitored using a QMS and a gas chromatograph fitted with an FID. It is known that CO adsorption can occur either molecularly (Eq. (4.1)) or dissociatively (Eq. (4.2)), while the desorption of CO occurs directly from the molecularly adsorbed state (Eq. (4.3)) or after the recombination of adsorbed atomic carbon and oxygen (Eq. (4.4)). The recombination of adsorbed carbon and oxygen leads to the formation of CO as well as CO2 (Eqs. (4.4) and (4.5)) [21]. CO2 formation can also occur via the oxidation of CO (Eq. (4.6)) (4.1) CO(g)+*→COads (4.2) CO(g)+2*→Cads+Oads (4.3) COads→CO(g)+* (4.4) Cads+Oads→COads+*→CO(g)+2* (4.5) Cads+2Oads→COads+Oads+*→CO2,ads+2*→CO2 (g)+3* (4.6) COads+Oads→CO2(g) The methane evolution rate (due to reaction of carbon with H2) as recorded using both an FID detector and a quadrupole mass spectrometer (QMS) during the TPSR experiment is displayed in Fig. 6a and b, respectively. The recorded signals are broad, indicating that several overlapping peaks coexist. Differences in the signals recorded using the FID and the QMS are mainly due to the overlapping of peaks. To quantitatively analyze the overlapping peaks, the TPSR profiles were fitted with Gaussian curves to yield several peaks. In theory, the determination of water should give an indication of how much CO as opposed to C reacts with H2during the TPSR runs, but quantitative water analysis is deemed unreliable on this level. Changes in CH4 production due to modification of the catalysts in the solid-state were also seen at potassium loadings of 0.7 and 1.0wt%. An increase of 35% was seen for the former while a 14% rise was recorded at the latter K loading. These increases were computed from CH4 signals corresponding to 68 and 50μmolg−1 evolved from 0.7K/Fe-MW and 0.7K/Fe catalysts and 71 and 62μmolg−1 CH4 for 1.0K/Fe-MW and 1.0K/Fe catalysts. Figs. 7 and 8 show that at these potassium loadings microwave pretreatment favors CH4 formation from surface methylene chains and bulk iron carbides. CH4 formation from α- and δ-carbon species declines in the modified samples. The CH4 peak produced from the microwaved samples favored γ-carbon species and appears at 652 and 656°C for the 0.7K/Fe-MW and the 1.0K/Fe-MW catalysts, respectively. Microwave pretreatment of the 1.5K/Fe catalyst inhibits the formation of the α1-carbon species. This could be due to the high levels of potassium then present. Fig. 3 summarizes the percentage increases in the total CH4 evolved that were induced purely by microwave pretreatment of the different catalysts. This graph was achieved by expressing the difference in the total CH4 produced before and after microwave pretreatment as a percentage and then plotting the data as a function of the loading of potassium. As shown in the figure, microwave pretreatment increases the total CH4 evolved at all loadings of potassium. A 6% increase at 0.2wt% of potassium is followed by a 25% increase at 0.5wt% loading of potassium. The highest percentage increase was found at a loading of 0.7wt% potassium – a change of 35%. Higher loadings of 1.0 and 1.5wt% K produced less methane, but still gave increases of 14%. It is clear that the microwave pretreatment effect is dependent on the loading of potassium in precipitated catalysts, with 0.7wt% K proving to be the optimum loading for the experiments performed in this work. The effect of the pretreatment time has also been studied using TPSR to see if it affected the total CH content evolved. The microwave irradiation time was increased from 10s to 20s, 40s, 2, 5 and finally 10min (see Fig. 4). The microwave power level was maintained at 450W. This study was conducted using the 0.7K/Fe catalyst as it showed the highest microwave pretreatment effect in the earlier studies (Fig. 3). Radiation caused an initial 35% increase in the total CH4 evolved (after 10s), but increasing the microwave exposure time up to 600s (10min) generally did not improve the methanation rate. This data suggests that the unsupported K/Fe catalysts studied in this work are not influenced by the irradiation time; the microwave effect is observed immediately. The various results from TPSR runs are depicted in Figs. 5–8. It is noted that the FID data are very similar to the data recorded using the quadrupole mass spectrometer and so normally the FID results are used for comparing the surface chemistry of the various samples. The upper limit of 7.0μmol CH4 gcat −1 suggests that this quantity of CO can be adsorbed. For iron oxide initially as Fe2O3, 1gcat would present about 10,000μmol Fe in total, or about 400μmol surface Fe for particles sizes of those observed here. This suggests a CO coverage of up to about 18%. Some final remarks are in order. First, we believe that the architecture of the iron and the iron-potassium entities present on the surface are modified by microwave treatment, almost certainly via the setting up of hot spots which lead to thermally induced changes. These changes take place fairly swiftly on exposing the solids to microwave radiation and result in metastable higher activity sites. In general, long duration of radiation and the use of higher power settings are likely to result in damaged catalytic surfaces. Controlled exposure is therefore the key to such pretreatment. We believe that the changes seen are reasonably irreversible on the time scales of catalytic runs in that catalytic behavior (activity and the various selectivities seen with the FTS reaction) are virtually constant for times on stream of 1000min or so [1]. 4 Conclusions Potassium-promoted unsupported iron Fischer–Tropsch catalysts have been subjected to microwave radiation treatment as part of the catalyst preparation process. The treatment is applied after the catalysts have been dried and calcined. Solid-state modifications occur which result in changes in the manner and quantity of carbon monoxide adsorbed on the surface as detected by temperature programmed surface reaction (TPSR) with hydrogen. Methane is the essential product of the TPSR runs. The response to microwave treatment is an increase in the methane production at all potassium levels, but the magnitude of the increase is potassium-loading dependent and peaks at a potassium loading of 0.7wt%. Microwave-induced changes in TPSR characteristics appear to result from selective heating occurring almost immediately on exposure of the catalysts to radiation. Longer duration of microwave exposure does not appear to result in further changes. Acknowledgments The authors express their gratitude to c* change, the Centre of Excellence in Catalysis, launched by the Department of Science and Technology and the National Research Foundation for the financial support of this work. Appendix A Supplementary data Supplementary data associated with this article can be found, in the online version, at http://dx.doi.org/10.1016/j.molcata.2015.06.014. Appendix A Supplementary data The following are the supplementary data to this article: References [1] L.Z. Linganiso, M.S. Scurrell. Curr. Microwave Chem. (CMIC Bentham), (2015) [2] S. Horikoshi H. Abe K. Torigoe M. Abe N. Serpone Nanoscale 2 2010 1441 [3] M.S. Dresselhaus G. Dresselhaus P.P. Avouris Topics in Applied Physics 2001 Springer-Verlag Berlin [4] G. Bond R.B. Moyes D.A. Whan Catal. Today 17 1993 427 [5] G. Roussy J.A. Pearce Foundations and Industrial Applications of Microwave and Radio Frequency Fields 1995 Wiley New York [6] G. Roussy E. Marchal J.M. Thiebaut A. Kiennemann G.G. Maire Fuel Process. Technol. 50 1997 261 [7] X. Zhang C.S.M. Lee D.M.P. Mingos D.O. Hayward Appl. Catal. A: Gen. 249 2003 151 [8] J. Zaman Fuel Process. Technol. 41 1995 159 [9] N. Getoff Int. J. Hydrogen Energy 15 1990 407 [10] P. Reubroycharoen T. Vitidsant Y. Liu G. Yang N. Tsubaki Catal. Commun. 8 2007 375 [11] Y. Liu Y. Lu S. Liu Y.Y. Yin Catal. Today 151 1999 147 [12] S.A. Eliason C.H. Bartholomew C.H. Bartholomew G.A. Fuentes Studies in Surface Science and Catalysis vol. 111 1997 Elsevier Amsterdam 517 [13] J. Xu C.H. Bartholomew J. Phys. Chem. B 109 109 2005 2392 [14] M.H. Nassir B. Fruhberger D.J. Dwyer Surf. Sci. 312 1994 115 [15] D.W. Moon D.J. Dwyer S.L. Bernasek Surf. Sci. 163 1985 215 [16] J.L. Rankin C.H. Bartholomew J. Catal. 100 1986 533 [17] D.W. Moon S.L. Bernasek D.J. Dwyer J.L.J.L. Gland J. Am. Chem. Soc. 107 1985 4363 [18] B. Graf M. Muhler Phys. Chem. Chem. Phys. 13 2011 3701 [19] J. Benziger R.J. Madix Surf. Sci. 94 1980 119 [20] C.R.F. Lund J.A. Dumesic J. Phys. Chem. 87 1982 130 [21] C. Li, Ph.D. dissertation, Texas A&M University, 1988.",
      "scopus-id": "84939813586",
      "coredata": {
        "eid": "1-s2.0-S1381116915002265",
        "dc:description": "Potassium-promoted unsupported iron Fischer–Tropsch catalysts have been subjected to microwave radiation treatment as part of the catalyst preparation process. The treatment is applied after the catalysts have been dried and calcined. Solid-state modifications occur which result in changes in the manner and quantity of carbon monoxide adsorbed on the surface as detected by temperature programmed surface reaction (TPSR) with hydrogen. Methane is the essential product of the TPSR runs. The response to microwave treatment is an increase in the methane production at all potassium levels, but the magnitude of the increase is potassium-loading dependent and peaks at a potassium loading of 0.7wt%. Microwave-induced changes in TPSR characteristics appear to result from selective heating occurring almost immediately on exposure of the catalysts to radiation. Longer duration of microwave exposure does not appear to result in further changes.",
        "openArchiveArticle": "false",
        "prism:coverDate": "2015-12-01",
        "openaccessUserLicense": null,
        "prism:aggregationType": "Journal",
        "prism:url": "https://api.elsevier.com/content/article/pii/S1381116915002265",
        "dc:creator": [
          {
            "@_fa": "true",
            "$": "Dlamini, W.M."
          },
          {
            "@_fa": "true",
            "$": "Coville, N.J."
          },
          {
            "@_fa": "true",
            "$": "Scurrell, M.S."
          }
        ],
        "link": [
          {
            "@_fa": "true",
            "@rel": "self",
            "@href": "https://api.elsevier.com/content/article/pii/S1381116915002265"
          },
          {
            "@_fa": "true",
            "@rel": "scidir",
            "@href": "https://www.sciencedirect.com/science/article/pii/S1381116915002265"
          }
        ],
        "dc:format": "application/json",
        "openaccessType": null,
        "pii": "S1381-1169(15)00226-5",
        "prism:volume": "409",
        "prism:publisher": "Elsevier B.V.",
        "dc:title": "Microwave radiation in the modification of iron Fischer–Tropsch catalysts",
        "prism:copyright": "Copyright © 2015 Elsevier B.V. All rights reserved.",
        "openaccess": "0",
        "prism:issn": "13811169",
        "dcterms:subject": [
          {
            "@_fa": "true",
            "$": "Iron"
          },
          {
            "@_fa": "true",
            "$": "Fischer–Tropsch synthesis"
          },
          {
            "@_fa": "true",
            "$": "Microwave radiation"
          },
          {
            "@_fa": "true",
            "$": "Potassium"
          },
          {
            "@_fa": "true",
            "$": "TPSR"
          },
          {
            "@_fa": "true",
            "$": "Carbon monoxide adsorption"
          }
        ],
        "openaccessArticle": "false",
        "prism:publicationName": "Journal of Molecular Catalysis A: Chemical",
        "openaccessSponsorType": null,
        "prism:pageRange": "19-25",
        "prism:endingPage": "25",
        "pubType": "fla",
        "prism:coverDisplayDate": "1 December 2015",
        "prism:doi": "10.1016/j.molcata.2015.06.014",
        "prism:startingPage": "19",
        "dc:identifier": "doi:10.1016/j.molcata.2015.06.014",
        "openaccessSponsorName": null
      },
      "objects": {
        "object": [
          {
            "@category": "thumbnail",
            "@height": "88",
            "@width": "219",
            "@_fa": "true",
            "$": "https://api.elsevier.com/content/object/eid/1-s2.0-S1381116915002265-fx1.sml?httpAccept=%2A%2F%2A",
            "@multimediatype": "GIF image file",
            "@type": "IMAGE-THUMBNAIL",
            "@size": "3014",
            "@ref": "fx1",
            "@mimetype": "image/gif"
          },
          {
            "@category": "thumbnail",
            "@height": "164",
            "@width": "123",
            "@_fa": "true",
            "$": "https://api.elsevier.com/content/object/eid/1-s2.0-S1381116915002265-gr1.sml?httpAccept=%2A%2F%2A",
            "@multimediatype": "GIF image file",
            "@type": "IMAGE-THUMBNAIL",
            "@size": "15339",
            "@ref": "gr1",
            "@mimetype": "image/gif"
          },
          {
            "@category": "thumbnail",
            "@height": "164",
            "@width": "196",
            "@_fa": "true",
            "$": "https://api.elsevier.com/content/object/eid/1-s2.0-S1381116915002265-gr2.sml?httpAccept=%2A%2F%2A",
            "@multimediatype": "GIF image file",
            "@type": "IMAGE-THUMBNAIL",
            "@size": "16045",
            "@ref": "gr2",
            "@mimetype": "image/gif"
          },
          {
            "@category": "thumbnail",
            "@height": "149",
            "@width": "219",
            "@_fa": "true",
            "$": "https://api.elsevier.com/content/object/eid/1-s2.0-S1381116915002265-gr3.sml?httpAccept=%2A%2F%2A",
            "@multimediatype": "GIF image file",
            "@type": "IMAGE-THUMBNAIL",
            "@size": "13259",
            "@ref": "gr3",
            "@mimetype": "image/gif"
          },
          {
            "@category": "thumbnail",
            "@height": "161",
            "@width": "219",
            "@_fa": "true",
            "$": "https://api.elsevier.com/content/object/eid/1-s2.0-S1381116915002265-gr4.sml?httpAccept=%2A%2F%2A",
            "@multimediatype": "GIF image file",
            "@type": "IMAGE-THUMBNAIL",
            "@size": "12399",
            "@ref": "gr4",
            "@mimetype": "image/gif"
          },
          {
            "@category": "thumbnail",
            "@height": "164",
            "@width": "124",
            "@_fa": "true",
            "$": "https://api.elsevier.com/content/object/eid/1-s2.0-S1381116915002265-gr5.sml?httpAccept=%2A%2F%2A",
            "@multimediatype": "GIF image file",
            "@type": "IMAGE-THUMBNAIL",
            "@size": "15119",
            "@ref": "gr5",
            "@mimetype": "image/gif"
          },
          {
            "@category": "thumbnail",
            "@height": "164",
            "@width": "192",
            "@_fa": "true",
            "$": "https://api.elsevier.com/content/object/eid/1-s2.0-S1381116915002265-gr6.sml?httpAccept=%2A%2F%2A",
            "@multimediatype": "GIF image file",
            "@type": "IMAGE-THUMBNAIL",
            "@size": "16198",
            "@ref": "gr6",
            "@mimetype": "image/gif"
          },
          {
            "@category": "thumbnail",
            "@height": "164",
            "@width": "124",
            "@_fa": "true",
            "$": "https://api.elsevier.com/content/object/eid/1-s2.0-S1381116915002265-gr7.sml?httpAccept=%2A%2F%2A",
            "@multimediatype": "GIF image file",
            "@type": "IMAGE-THUMBNAIL",
            "@size": "16817",
            "@ref": "gr7",
            "@mimetype": "image/gif"
          },
          {
            "@category": "thumbnail",
            "@height": "164",
            "@width": "115",
            "@_fa": "true",
            "$": "https://api.elsevier.com/content/object/eid/1-s2.0-S1381116915002265-gr8.sml?httpAccept=%2A%2F%2A",
            "@multimediatype": "GIF image file",
            "@type": "IMAGE-THUMBNAIL",
            "@size": "14692",
            "@ref": "gr8",
            "@mimetype": "image/gif"
          },
          {
            "@category": "standard",
            "@height": "200",
            "@width": "500",
            "@_fa": "true",
            "$": "https://api.elsevier.com/content/object/eid/1-s2.0-S1381116915002265-fx1.jpg?httpAccept=%2A%2F%2A",
            "@multimediatype": "JPEG image file",
            "@type": "IMAGE-DOWNSAMPLED",
            "@size": "9412",
            "@ref": "fx1",
            "@mimetype": "image/jpeg"
          },
          {
            "@category": "standard",
            "@height": "449",
            "@width": "337",
            "@_fa": "true",
            "$": "https://api.elsevier.com/content/object/eid/1-s2.0-S1381116915002265-gr1.jpg?httpAccept=%2A%2F%2A",
            "@multimediatype": "JPEG image file",
            "@type": "IMAGE-DOWNSAMPLED",
            "@size": "51824",
            "@ref": "gr1",
            "@mimetype": "image/jpeg"
          },
          {
            "@category": "standard",
            "@height": "325",
            "@width": "389",
            "@_fa": "true",
            "$": "https://api.elsevier.com/content/object/eid/1-s2.0-S1381116915002265-gr2.jpg?httpAccept=%2A%2F%2A",
            "@multimediatype": "JPEG image file",
            "@type": "IMAGE-DOWNSAMPLED",
            "@size": "55753",
            "@ref": "gr2",
            "@mimetype": "image/jpeg"
          },
          {
            "@category": "standard",
            "@height": "262",
            "@width": "385",
            "@_fa": "true",
            "$": "https://api.elsevier.com/content/object/eid/1-s2.0-S1381116915002265-gr3.jpg?httpAccept=%2A%2F%2A",
            "@multimediatype": "JPEG image file",
            "@type": "IMAGE-DOWNSAMPLED",
            "@size": "32403",
            "@ref": "gr3",
            "@mimetype": "image/jpeg"
          },
          {
            "@category": "standard",
            "@height": "288",
            "@width": "391",
            "@_fa": "true",
            "$": "https://api.elsevier.com/content/object/eid/1-s2.0-S1381116915002265-gr4.jpg?httpAccept=%2A%2F%2A",
            "@multimediatype": "JPEG image file",
            "@type": "IMAGE-DOWNSAMPLED",
            "@size": "30174",
            "@ref": "gr4",
            "@mimetype": "image/jpeg"
          },
          {
            "@category": "standard",
            "@height": "495",
            "@width": "374",
            "@_fa": "true",
            "$": "https://api.elsevier.com/content/object/eid/1-s2.0-S1381116915002265-gr5.jpg?httpAccept=%2A%2F%2A",
            "@multimediatype": "JPEG image file",
            "@type": "IMAGE-DOWNSAMPLED",
            "@size": "54812",
            "@ref": "gr5",
            "@mimetype": "image/jpeg"
          },
          {
            "@category": "standard",
            "@height": "327",
            "@width": "383",
            "@_fa": "true",
            "$": "https://api.elsevier.com/content/object/eid/1-s2.0-S1381116915002265-gr6.jpg?httpAccept=%2A%2F%2A",
            "@multimediatype": "JPEG image file",
            "@type": "IMAGE-DOWNSAMPLED",
            "@size": "56596",
            "@ref": "gr6",
            "@mimetype": "image/jpeg"
          },
          {
            "@category": "standard",
            "@height": "506",
            "@width": "383",
            "@_fa": "true",
            "$": "https://api.elsevier.com/content/object/eid/1-s2.0-S1381116915002265-gr7.jpg?httpAccept=%2A%2F%2A",
            "@multimediatype": "JPEG image file",
            "@type": "IMAGE-DOWNSAMPLED",
            "@size": "81598",
            "@ref": "gr7",
            "@mimetype": "image/jpeg"
          },
          {
            "@category": "standard",
            "@height": "551",
            "@width": "386",
            "@_fa": "true",
            "$": "https://api.elsevier.com/content/object/eid/1-s2.0-S1381116915002265-gr8.jpg?httpAccept=%2A%2F%2A",
            "@multimediatype": "JPEG image file",
            "@type": "IMAGE-DOWNSAMPLED",
            "@size": "79154",
            "@ref": "gr8",
            "@mimetype": "image/jpeg"
          },
          {
            "@category": "high",
            "@height": "886",
            "@width": "2213",
            "@_fa": "true",
            "$": "https://api.elsevier.com/content/object/eid/1-s2.0-S1381116915002265-fx1_lrg.jpg?httpAccept=%2A%2F%2A",
            "@multimediatype": "JPEG image file",
            "@type": "IMAGE-HIGH-RES",
            "@size": "70476",
            "@ref": "fx1",
            "@mimetype": "image/jpeg"
          },
          {
            "@category": "high",
            "@height": "1991",
            "@width": "1493",
            "@_fa": "true",
            "$": "https://api.elsevier.com/content/object/eid/1-s2.0-S1381116915002265-gr1_lrg.jpg?httpAccept=%2A%2F%2A",
            "@multimediatype": "JPEG image file",
            "@type": "IMAGE-HIGH-RES",
            "@size": "232553",
            "@ref": "gr1",
            "@mimetype": "image/jpeg"
          },
          {
            "@category": "high",
            "@height": "1439",
            "@width": "1724",
            "@_fa": "true",
            "$": "https://api.elsevier.com/content/object/eid/1-s2.0-S1381116915002265-gr2_lrg.jpg?httpAccept=%2A%2F%2A",
            "@multimediatype": "JPEG image file",
            "@type": "IMAGE-HIGH-RES",
            "@size": "230712",
            "@ref": "gr2",
            "@mimetype": "image/jpeg"
          },
          {
            "@category": "high",
            "@height": "1162",
            "@width": "1706",
            "@_fa": "true",
            "$": "https://api.elsevier.com/content/object/eid/1-s2.0-S1381116915002265-gr3_lrg.jpg?httpAccept=%2A%2F%2A",
            "@multimediatype": "JPEG image file",
            "@type": "IMAGE-HIGH-RES",
            "@size": "140052",
            "@ref": "gr3",
            "@mimetype": "image/jpeg"
          },
          {
            "@category": "high",
            "@height": "1277",
            "@width": "1733",
            "@_fa": "true",
            "$": "https://api.elsevier.com/content/object/eid/1-s2.0-S1381116915002265-gr4_lrg.jpg?httpAccept=%2A%2F%2A",
            "@multimediatype": "JPEG image file",
            "@type": "IMAGE-HIGH-RES",
            "@size": "132710",
            "@ref": "gr4",
            "@mimetype": "image/jpeg"
          },
          {
            "@category": "high",
            "@height": "2195",
            "@width": "1659",
            "@_fa": "true",
            "$": "https://api.elsevier.com/content/object/eid/1-s2.0-S1381116915002265-gr5_lrg.jpg?httpAccept=%2A%2F%2A",
            "@multimediatype": "JPEG image file",
            "@type": "IMAGE-HIGH-RES",
            "@size": "258685",
            "@ref": "gr5",
            "@mimetype": "image/jpeg"
          },
          {
            "@category": "high",
            "@height": "1449",
            "@width": "1699",
            "@_fa": "true",
            "$": "https://api.elsevier.com/content/object/eid/1-s2.0-S1381116915002265-gr6_lrg.jpg?httpAccept=%2A%2F%2A",
            "@multimediatype": "JPEG image file",
            "@type": "IMAGE-HIGH-RES",
            "@size": "252132",
            "@ref": "gr6",
            "@mimetype": "image/jpeg"
          },
          {
            "@category": "high",
            "@height": "2242",
            "@width": "1697",
            "@_fa": "true",
            "$": "https://api.elsevier.com/content/object/eid/1-s2.0-S1381116915002265-gr7_lrg.jpg?httpAccept=%2A%2F%2A",
            "@multimediatype": "JPEG image file",
            "@type": "IMAGE-HIGH-RES",
            "@size": "433593",
            "@ref": "gr7",
            "@mimetype": "image/jpeg"
          },
          {
            "@category": "high",
            "@height": "2437",
            "@width": "1708",
            "@_fa": "true",
            "$": "https://api.elsevier.com/content/object/eid/1-s2.0-S1381116915002265-gr8_lrg.jpg?httpAccept=%2A%2F%2A",
            "@multimediatype": "JPEG image file",
            "@type": "IMAGE-HIGH-RES",
            "@size": "401116",
            "@ref": "gr8",
            "@mimetype": "image/jpeg"
          },
          {
            "@category": "standard",
            "@_fa": "true",
            "$": "https://api.elsevier.com/content/object/eid/1-s2.0-S1381116915002265-mmc1.doc?httpAccept=%2A%2F%2A",
            "@multimediatype": "Microsoft Word file",
            "@type": "APPLICATION",
            "@size": "755712",
            "@ref": "mmc1",
            "@mimetype": "application/word"
          }
        ]
      },
      "link": {
        "@rel": "abstract",
        "@href": "https://api.elsevier.com/content/abstract/scopus_id/84939813586"
      }
    }
  }
}