{
  "metadata": {
    "title": "Promising nanostructured gold/metal oxide catalysts for oxidative coupling of benzylamines under eco-friendly conditions",
    "authors": "; ; ",
    "journal": "Journal of Molecular Catalysis A: Chemical",
    "date": "2016-02-29",
    "doi": "10.1016/j.molcata.2015.11.019",
    "abstract": "",
    "uri": "https://api.elsevier.com/content/article/pii/S1381116915301618",
    "pii": "S1381116915301618"
  },
  "fulltext": {
    "full-text-retrieval-response": {
      "scopus-eid": "2-s2.0-84949591359",
      "originalText": "serial JL 271358 291210 291744 291790 291809 31 Journal of Molecular Catalysis A: Chemical JOURNALMOLECULARCATALYSISACHEMICAL 2015-12-01 2015-12-01 2015-12-11 2015-12-11 2015-12-31T08:52:32 1-s2.0-S1381116915301618 S1381-1169(15)30161-8 S1381116915301618 10.1016/j.molcata.2015.11.019 S300 S300.1 FULL-TEXT 1-s2.0-S1381116915X00148 2025-07-16T16:48:29.225658Z 0 0 20160201 20160229 2016 2015-12-01T07:24:53.53394Z absattachment articleinfo articletitlenorm authfirstinitialnorm authfirstsurnamenorm cid cids contenttype copyright crossmark dateloaded dateloadedtxt datesearch datesort dateupdated dco docsubtype doctype doi eid ewtransactionid hubeid indexeddate issn issnnorm itemstage itemtransactionid itemweight openaccess openarchive pg pgfirst pglast pii piinorm pubdateend pubdatestart pubdatetxt pubyr sectiontitle sortorder srctitle srctitlenorm srctype ssids alllist content subj subheadings suppl tomb volfirst volissue volumelist webpdf webpdfpagecount yearnav figure table e-component body mmlmath acknowledge affil appendices articletitle auth authfirstini authfull authkeywords authlast highlightsabst primabst ref specialabst 1381-1169 13811169 true 412 412 C Volume 412 9 47 55 47 55 201602 February 2016 2016-02-01 2016-02-29 2016 Regular Papers article fla Copyright © 2015 Elsevier B.V. All rights reserved. PROMISINGNANOSTRUCTUREDGOLDMETALOXIDECATALYSTSFOROXIDATIVECOUPLINGBENZYLAMINESUNDERECOFRIENDLYCONDITIONS SUDARSANAM P 1 Introduction 2 Experimental 2.1 Materials and methods 2.2 Catalyst characterization 2.3 Catalytic activity measurements 3 Results and discussions 3.1 Catalyst characterization studies 3.2 Catalytic activity studies 4 Conclusions Acknowledgements Appendix A Supplementary data References JARDIM 2014 119 129 E YU 2014 16985 16991 J HUTCHINGS 2008 5523 5536 G HARUTA 1989 301 309 M CORMA 2008 2096 2126 A FENG 2013 14498 14508 J SUDARSANAM 2014 43460 43469 P LAKSHMANAN 2013 2918 2925 P EDWARDS 2008 9192 9198 J BRETT 2011 10136 10139 G HAMMOND 2011 3927 3937 C LIU 2014 2226 2230 S WAN 2014 2175 2185 X CASANOVA 2009 1138 1144 O FANG 2014 16 21 Y OPRIS 2014 4340 4355 C GRIRRANE 2009 138 144 A SUDARSANAM 2014 46378 46382 P DAI 2015 343 352 J GOVINDARAO 2015 1436 1445 B GUO 2011 1260 1264 H FURUKAWA 2011 1150 1153 S ZHU 2008 1 6 B CUI 2013 551 562 W NEELI 2014 14128 14135 C SASIREKHA 2014 15226 15233 N ROMEROSARRIA 2014 13145 13152 F SANTOS 2014 58 65 V JIMENEZLAM 2011 23519 23526 S VENEZIA 2005 2821 2827 A SUDARSANAM 2014 900 908 P CASANOVA 2009 109 116 O WANG 2014 292 294 M CARRETTIN 2004 2538 2540 S SUDARSANAM 2014 5991 6001 P SANTRA 2013 360 370 C POJANAVARAPHAN 2013 135 143 C ILIEVA 2009 6505 6515 L LONGO 2012 2960 2966 A VINODKUMAR 2015 57 64 T KATTA 2010 101 108 L HAI 2014 5279 5286 Z CHEN 2008 790 796 Z SUDARSANAM 2014 3115 3121 P KATTA 2012 995 1004 L KUNTAIAH 2013 7953 7962 K YAO 2013 688 698 X LAKSHMANAN 2013 260 268 P LEE 2015 48 52 J XU 2014 9702 9708 Q MALLESHAM 2013 478 489 B JIANG 2014 188 193 X FAN 2008 38 48 J BHARALI 2012 931 933 P WANG 2009 10229 10232 H PUTLA 2015 16525 16535 S SHANG 2015 18 24 D SUDARSANAM 2015 3496 3500 P TANIGUCHI 2010 1426 1428 T YAO 2013 688 698 X HUANG 2009 224 232 X LIU 2014 5975 5985 Y WEI 2013 2958 2970 Y LEA 2014 34 41 M CHEN 2015 5851 5876 B SCHUMPERLI 2012 1108 1117 M LANDGE 2007 5161 5164 S KIM 2005 1600 1602 S ABAD 2005 4066 4069 A ZHAO 2014 8926 8931 S SUDARSANAMX2016X47 SUDARSANAMX2016X47X55 SUDARSANAMX2016X47XP SUDARSANAMX2016X47X55XP 2017-12-11T00:00:00Z http://creativecommons.org/licenses/by-nc-nd/4.0/ item S1381-1169(15)30161-8 S1381116915301618 1-s2.0-S1381116915301618 10.1016/j.molcata.2015.11.019 271358 2015-12-31T04:09:24.276242-05:00 2016-02-01 2016-02-29 1-s2.0-S1381116915301618-main.pdf https://s3-eu-west-1.amazonaws.com/prod-ucs-content-store-eu-west/content/pii:S1381116915301618/MAIN/application/pdf/900fe019cde8e3c76d507591f46aa355/main.pdf https://s3.amazonaws.com/prod-ucs-content-store-us-east/content/pii:S1381116915301618/MAIN/application/pdf/900fe019cde8e3c76d507591f46aa355/main.pdf main.pdf pdf true 2747255 MAIN 9 1-s2.0-S1381116915301618-main_1.png https://s3-eu-west-1.amazonaws.com/prod-ucs-content-store-eu-west/content/pii:S1381116915301618/PREVIEW/image/png/df78ad2746f3386af6aecbbee493b9c2/main_1.png https://s3.amazonaws.com/prod-ucs-content-store-us-east/content/pii:S1381116915301618/PREVIEW/image/png/df78ad2746f3386af6aecbbee493b9c2/main_1.png main_1.png png 57859 849 656 IMAGE-WEB-PDF 1 1-s2.0-S1381116915301618-fx1.sml https://s3-eu-west-1.amazonaws.com/prod-ucs-content-store-eu-west/content/pii:S1381116915301618/fx1/THUMBNAIL/image/gif/d2a70c635c7f556d6c1bf1bc1c18de14/fx1.sml https://s3.amazonaws.com/prod-ucs-content-store-us-east/content/pii:S1381116915301618/fx1/THUMBNAIL/image/gif/d2a70c635c7f556d6c1bf1bc1c18de14/fx1.sml fx1 true fx1.sml sml 5325 88 219 IMAGE-THUMBNAIL 1-s2.0-S1381116915301618-fx10.sml https://s3-eu-west-1.amazonaws.com/prod-ucs-content-store-eu-west/content/pii:S1381116915301618/fx10/THUMBNAIL/image/gif/2b83e7cb0d40221d4965c83b5b799794/fx10.sml https://s3.amazonaws.com/prod-ucs-content-store-us-east/content/pii:S1381116915301618/fx10/THUMBNAIL/image/gif/2b83e7cb0d40221d4965c83b5b799794/fx10.sml fx10 fx10.sml sml 2550 88 219 IMAGE-THUMBNAIL 1-s2.0-S1381116915301618-fx11.sml https://s3-eu-west-1.amazonaws.com/prod-ucs-content-store-eu-west/content/pii:S1381116915301618/fx11/THUMBNAIL/image/gif/88b991db6150d53bc9d1f4e8f3bf36ba/fx11.sml https://s3.amazonaws.com/prod-ucs-content-store-us-east/content/pii:S1381116915301618/fx11/THUMBNAIL/image/gif/88b991db6150d53bc9d1f4e8f3bf36ba/fx11.sml fx11 fx11.sml sml 2606 88 219 IMAGE-THUMBNAIL 1-s2.0-S1381116915301618-fx12.sml https://s3-eu-west-1.amazonaws.com/prod-ucs-content-store-eu-west/content/pii:S1381116915301618/fx12/THUMBNAIL/image/gif/cfec2b84d960688bb0adbdc01b54d27e/fx12.sml https://s3.amazonaws.com/prod-ucs-content-store-us-east/content/pii:S1381116915301618/fx12/THUMBNAIL/image/gif/cfec2b84d960688bb0adbdc01b54d27e/fx12.sml fx12 fx12.sml sml 2712 88 219 IMAGE-THUMBNAIL 1-s2.0-S1381116915301618-fx2.sml https://s3-eu-west-1.amazonaws.com/prod-ucs-content-store-eu-west/content/pii:S1381116915301618/fx2/THUMBNAIL/image/gif/b4387bf7c63c4da0af4619e9aeac2ab2/fx2.sml https://s3.amazonaws.com/prod-ucs-content-store-us-east/content/pii:S1381116915301618/fx2/THUMBNAIL/image/gif/b4387bf7c63c4da0af4619e9aeac2ab2/fx2.sml fx2 fx2.sml sml 2820 88 219 IMAGE-THUMBNAIL 1-s2.0-S1381116915301618-fx3.sml https://s3-eu-west-1.amazonaws.com/prod-ucs-content-store-eu-west/content/pii:S1381116915301618/fx3/THUMBNAIL/image/gif/9b86b4231c2a166a132b49d541c98716/fx3.sml https://s3.amazonaws.com/prod-ucs-content-store-us-east/content/pii:S1381116915301618/fx3/THUMBNAIL/image/gif/9b86b4231c2a166a132b49d541c98716/fx3.sml fx3 fx3.sml sml 3276 88 219 IMAGE-THUMBNAIL 1-s2.0-S1381116915301618-fx4.sml https://s3-eu-west-1.amazonaws.com/prod-ucs-content-store-eu-west/content/pii:S1381116915301618/fx4/THUMBNAIL/image/gif/8571baf9fd1ac18040268fe4a06fd258/fx4.sml https://s3.amazonaws.com/prod-ucs-content-store-us-east/content/pii:S1381116915301618/fx4/THUMBNAIL/image/gif/8571baf9fd1ac18040268fe4a06fd258/fx4.sml fx4 fx4.sml sml 3276 88 219 IMAGE-THUMBNAIL 1-s2.0-S1381116915301618-fx5.sml https://s3-eu-west-1.amazonaws.com/prod-ucs-content-store-eu-west/content/pii:S1381116915301618/fx5/THUMBNAIL/image/gif/2624fb9fa0527ef155d52a4e1b0b54cb/fx5.sml https://s3.amazonaws.com/prod-ucs-content-store-us-east/content/pii:S1381116915301618/fx5/THUMBNAIL/image/gif/2624fb9fa0527ef155d52a4e1b0b54cb/fx5.sml fx5 fx5.sml sml 3077 88 219 IMAGE-THUMBNAIL 1-s2.0-S1381116915301618-fx6.sml https://s3-eu-west-1.amazonaws.com/prod-ucs-content-store-eu-west/content/pii:S1381116915301618/fx6/THUMBNAIL/image/gif/fe0ceffcdeaed61560dccdacd6b09382/fx6.sml https://s3.amazonaws.com/prod-ucs-content-store-us-east/content/pii:S1381116915301618/fx6/THUMBNAIL/image/gif/fe0ceffcdeaed61560dccdacd6b09382/fx6.sml fx6 fx6.sml sml 3410 88 219 IMAGE-THUMBNAIL 1-s2.0-S1381116915301618-fx7.sml https://s3-eu-west-1.amazonaws.com/prod-ucs-content-store-eu-west/content/pii:S1381116915301618/fx7/THUMBNAIL/image/gif/f6574a8c5491ba871ccfca1db1072938/fx7.sml https://s3.amazonaws.com/prod-ucs-content-store-us-east/content/pii:S1381116915301618/fx7/THUMBNAIL/image/gif/f6574a8c5491ba871ccfca1db1072938/fx7.sml fx7 fx7.sml sml 3310 88 219 IMAGE-THUMBNAIL 1-s2.0-S1381116915301618-fx8.sml https://s3-eu-west-1.amazonaws.com/prod-ucs-content-store-eu-west/content/pii:S1381116915301618/fx8/THUMBNAIL/image/gif/f6df4de59c15c671564291a8df9804e9/fx8.sml https://s3.amazonaws.com/prod-ucs-content-store-us-east/content/pii:S1381116915301618/fx8/THUMBNAIL/image/gif/f6df4de59c15c671564291a8df9804e9/fx8.sml fx8 fx8.sml sml 3241 88 219 IMAGE-THUMBNAIL 1-s2.0-S1381116915301618-fx9.sml https://s3-eu-west-1.amazonaws.com/prod-ucs-content-store-eu-west/content/pii:S1381116915301618/fx9/THUMBNAIL/image/gif/8f09123c4449a5053df2baaf4a679bfd/fx9.sml https://s3.amazonaws.com/prod-ucs-content-store-us-east/content/pii:S1381116915301618/fx9/THUMBNAIL/image/gif/8f09123c4449a5053df2baaf4a679bfd/fx9.sml fx9 fx9.sml sml 3500 88 219 IMAGE-THUMBNAIL 1-s2.0-S1381116915301618-gr1.sml https://s3-eu-west-1.amazonaws.com/prod-ucs-content-store-eu-west/content/pii:S1381116915301618/gr1/THUMBNAIL/image/gif/111279c23ba790c68f1e9f6cec21c486/gr1.sml https://s3.amazonaws.com/prod-ucs-content-store-us-east/content/pii:S1381116915301618/gr1/THUMBNAIL/image/gif/111279c23ba790c68f1e9f6cec21c486/gr1.sml gr1 gr1.sml sml 22508 163 107 IMAGE-THUMBNAIL 1-s2.0-S1381116915301618-gr10.sml https://s3-eu-west-1.amazonaws.com/prod-ucs-content-store-eu-west/content/pii:S1381116915301618/gr10/THUMBNAIL/image/gif/79782be934dd94c99de78762a21f697d/gr10.sml https://s3.amazonaws.com/prod-ucs-content-store-us-east/content/pii:S1381116915301618/gr10/THUMBNAIL/image/gif/79782be934dd94c99de78762a21f697d/gr10.sml gr10 gr10.sml sml 20434 159 219 IMAGE-THUMBNAIL 1-s2.0-S1381116915301618-gr2.sml https://s3-eu-west-1.amazonaws.com/prod-ucs-content-store-eu-west/content/pii:S1381116915301618/gr2/THUMBNAIL/image/gif/c4cad9980deb0eca99a0d0bb90f8dd91/gr2.sml https://s3.amazonaws.com/prod-ucs-content-store-us-east/content/pii:S1381116915301618/gr2/THUMBNAIL/image/gif/c4cad9980deb0eca99a0d0bb90f8dd91/gr2.sml gr2 gr2.sml sml 23922 163 100 IMAGE-THUMBNAIL 1-s2.0-S1381116915301618-gr3.sml https://s3-eu-west-1.amazonaws.com/prod-ucs-content-store-eu-west/content/pii:S1381116915301618/gr3/THUMBNAIL/image/gif/29f6db8244f89031dc8033919558c96c/gr3.sml https://s3.amazonaws.com/prod-ucs-content-store-us-east/content/pii:S1381116915301618/gr3/THUMBNAIL/image/gif/29f6db8244f89031dc8033919558c96c/gr3.sml gr3 gr3.sml sml 19220 164 216 IMAGE-THUMBNAIL 1-s2.0-S1381116915301618-gr4.sml https://s3-eu-west-1.amazonaws.com/prod-ucs-content-store-eu-west/content/pii:S1381116915301618/gr4/THUMBNAIL/image/gif/0a91dc64c56ed940d1921fa9e06bf577/gr4.sml https://s3.amazonaws.com/prod-ucs-content-store-us-east/content/pii:S1381116915301618/gr4/THUMBNAIL/image/gif/0a91dc64c56ed940d1921fa9e06bf577/gr4.sml gr4 gr4.sml sml 7118 164 166 IMAGE-THUMBNAIL 1-s2.0-S1381116915301618-gr5.sml https://s3-eu-west-1.amazonaws.com/prod-ucs-content-store-eu-west/content/pii:S1381116915301618/gr5/THUMBNAIL/image/gif/a542dda2c17914a1b7d62b78c0d08933/gr5.sml https://s3.amazonaws.com/prod-ucs-content-store-us-east/content/pii:S1381116915301618/gr5/THUMBNAIL/image/gif/a542dda2c17914a1b7d62b78c0d08933/gr5.sml gr5 gr5.sml sml 16452 163 128 IMAGE-THUMBNAIL 1-s2.0-S1381116915301618-gr6.sml https://s3-eu-west-1.amazonaws.com/prod-ucs-content-store-eu-west/content/pii:S1381116915301618/gr6/THUMBNAIL/image/gif/e03a27be29898b98d6fc2373071f4c68/gr6.sml https://s3.amazonaws.com/prod-ucs-content-store-us-east/content/pii:S1381116915301618/gr6/THUMBNAIL/image/gif/e03a27be29898b98d6fc2373071f4c68/gr6.sml gr6 gr6.sml sml 6737 163 184 IMAGE-THUMBNAIL 1-s2.0-S1381116915301618-gr7.sml https://s3-eu-west-1.amazonaws.com/prod-ucs-content-store-eu-west/content/pii:S1381116915301618/gr7/THUMBNAIL/image/gif/112bb0303ba170b599fb204d7ff79e94/gr7.sml https://s3.amazonaws.com/prod-ucs-content-store-us-east/content/pii:S1381116915301618/gr7/THUMBNAIL/image/gif/112bb0303ba170b599fb204d7ff79e94/gr7.sml gr7 gr7.sml sml 9635 164 180 IMAGE-THUMBNAIL 1-s2.0-S1381116915301618-gr8.sml https://s3-eu-west-1.amazonaws.com/prod-ucs-content-store-eu-west/content/pii:S1381116915301618/gr8/THUMBNAIL/image/gif/d0c1353b43ec69962f845c40aec60009/gr8.sml https://s3.amazonaws.com/prod-ucs-content-store-us-east/content/pii:S1381116915301618/gr8/THUMBNAIL/image/gif/d0c1353b43ec69962f845c40aec60009/gr8.sml gr8 gr8.sml sml 16303 164 186 IMAGE-THUMBNAIL 1-s2.0-S1381116915301618-gr9.sml https://s3-eu-west-1.amazonaws.com/prod-ucs-content-store-eu-west/content/pii:S1381116915301618/gr9/THUMBNAIL/image/gif/1fc996516bb71b4440bd82b7ca3cf4f2/gr9.sml https://s3.amazonaws.com/prod-ucs-content-store-us-east/content/pii:S1381116915301618/gr9/THUMBNAIL/image/gif/1fc996516bb71b4440bd82b7ca3cf4f2/gr9.sml gr9 gr9.sml sml 21660 164 214 IMAGE-THUMBNAIL 1-s2.0-S1381116915301618-sc1.sml https://s3-eu-west-1.amazonaws.com/prod-ucs-content-store-eu-west/content/pii:S1381116915301618/sc1/THUMBNAIL/image/gif/fed5320e5f82c7dba66d663deb66278b/sc1.sml https://s3.amazonaws.com/prod-ucs-content-store-us-east/content/pii:S1381116915301618/sc1/THUMBNAIL/image/gif/fed5320e5f82c7dba66d663deb66278b/sc1.sml sc1 sc1.sml sml 13287 121 219 IMAGE-THUMBNAIL 1-s2.0-S1381116915301618-fx1.jpg https://s3-eu-west-1.amazonaws.com/prod-ucs-content-store-eu-west/content/pii:S1381116915301618/fx1/DOWNSAMPLED/image/jpeg/ba1a3cfe9645c2dd14f6ca6a73f9ce5d/fx1.jpg https://s3.amazonaws.com/prod-ucs-content-store-us-east/content/pii:S1381116915301618/fx1/DOWNSAMPLED/image/jpeg/ba1a3cfe9645c2dd14f6ca6a73f9ce5d/fx1.jpg fx1 true fx1.jpg jpg 20222 200 500 IMAGE-DOWNSAMPLED 1-s2.0-S1381116915301618-fx10.jpg https://s3-eu-west-1.amazonaws.com/prod-ucs-content-store-eu-west/content/pii:S1381116915301618/fx10/DOWNSAMPLED/image/jpeg/43190a48932d00e617671728e02fbebd/fx10.jpg https://s3.amazonaws.com/prod-ucs-content-store-us-east/content/pii:S1381116915301618/fx10/DOWNSAMPLED/image/jpeg/43190a48932d00e617671728e02fbebd/fx10.jpg fx10 fx10.jpg jpg 7236 200 500 IMAGE-DOWNSAMPLED 1-s2.0-S1381116915301618-fx11.jpg https://s3-eu-west-1.amazonaws.com/prod-ucs-content-store-eu-west/content/pii:S1381116915301618/fx11/DOWNSAMPLED/image/jpeg/d72c62726c17afa0c880d0de72da84aa/fx11.jpg https://s3.amazonaws.com/prod-ucs-content-store-us-east/content/pii:S1381116915301618/fx11/DOWNSAMPLED/image/jpeg/d72c62726c17afa0c880d0de72da84aa/fx11.jpg fx11 fx11.jpg jpg 7298 200 500 IMAGE-DOWNSAMPLED 1-s2.0-S1381116915301618-fx12.jpg https://s3-eu-west-1.amazonaws.com/prod-ucs-content-store-eu-west/content/pii:S1381116915301618/fx12/DOWNSAMPLED/image/jpeg/fd1e7753f7f481ca176a1a915aec4bb3/fx12.jpg https://s3.amazonaws.com/prod-ucs-content-store-us-east/content/pii:S1381116915301618/fx12/DOWNSAMPLED/image/jpeg/fd1e7753f7f481ca176a1a915aec4bb3/fx12.jpg fx12 fx12.jpg jpg 13058 200 500 IMAGE-DOWNSAMPLED 1-s2.0-S1381116915301618-fx2.jpg https://s3-eu-west-1.amazonaws.com/prod-ucs-content-store-eu-west/content/pii:S1381116915301618/fx2/DOWNSAMPLED/image/jpeg/c4a79fcad6209b093757236464807753/fx2.jpg https://s3.amazonaws.com/prod-ucs-content-store-us-east/content/pii:S1381116915301618/fx2/DOWNSAMPLED/image/jpeg/c4a79fcad6209b093757236464807753/fx2.jpg fx2 fx2.jpg jpg 11360 200 500 IMAGE-DOWNSAMPLED 1-s2.0-S1381116915301618-fx3.jpg https://s3-eu-west-1.amazonaws.com/prod-ucs-content-store-eu-west/content/pii:S1381116915301618/fx3/DOWNSAMPLED/image/jpeg/d860349848e38db1ccdd272a9054dabe/fx3.jpg https://s3.amazonaws.com/prod-ucs-content-store-us-east/content/pii:S1381116915301618/fx3/DOWNSAMPLED/image/jpeg/d860349848e38db1ccdd272a9054dabe/fx3.jpg fx3 fx3.jpg jpg 8885 200 500 IMAGE-DOWNSAMPLED 1-s2.0-S1381116915301618-fx4.jpg https://s3-eu-west-1.amazonaws.com/prod-ucs-content-store-eu-west/content/pii:S1381116915301618/fx4/DOWNSAMPLED/image/jpeg/0a0b495ea0bb1633db3d31660f7e95f9/fx4.jpg https://s3.amazonaws.com/prod-ucs-content-store-us-east/content/pii:S1381116915301618/fx4/DOWNSAMPLED/image/jpeg/0a0b495ea0bb1633db3d31660f7e95f9/fx4.jpg fx4 fx4.jpg jpg 9239 200 500 IMAGE-DOWNSAMPLED 1-s2.0-S1381116915301618-fx5.jpg https://s3-eu-west-1.amazonaws.com/prod-ucs-content-store-eu-west/content/pii:S1381116915301618/fx5/DOWNSAMPLED/image/jpeg/f610a8de7cd279badfdd7a6352e07135/fx5.jpg https://s3.amazonaws.com/prod-ucs-content-store-us-east/content/pii:S1381116915301618/fx5/DOWNSAMPLED/image/jpeg/f610a8de7cd279badfdd7a6352e07135/fx5.jpg fx5 fx5.jpg jpg 8700 200 500 IMAGE-DOWNSAMPLED 1-s2.0-S1381116915301618-fx6.jpg https://s3-eu-west-1.amazonaws.com/prod-ucs-content-store-eu-west/content/pii:S1381116915301618/fx6/DOWNSAMPLED/image/jpeg/a7aacba0d84b2802db96b9838eeb0dfa/fx6.jpg https://s3.amazonaws.com/prod-ucs-content-store-us-east/content/pii:S1381116915301618/fx6/DOWNSAMPLED/image/jpeg/a7aacba0d84b2802db96b9838eeb0dfa/fx6.jpg fx6 fx6.jpg jpg 9611 200 500 IMAGE-DOWNSAMPLED 1-s2.0-S1381116915301618-fx7.jpg https://s3-eu-west-1.amazonaws.com/prod-ucs-content-store-eu-west/content/pii:S1381116915301618/fx7/DOWNSAMPLED/image/jpeg/730f47cc5754b845db3689b313472d2c/fx7.jpg https://s3.amazonaws.com/prod-ucs-content-store-us-east/content/pii:S1381116915301618/fx7/DOWNSAMPLED/image/jpeg/730f47cc5754b845db3689b313472d2c/fx7.jpg fx7 fx7.jpg jpg 9378 200 500 IMAGE-DOWNSAMPLED 1-s2.0-S1381116915301618-fx8.jpg https://s3-eu-west-1.amazonaws.com/prod-ucs-content-store-eu-west/content/pii:S1381116915301618/fx8/DOWNSAMPLED/image/jpeg/dac28b65762f3ca31b04746cd5cee170/fx8.jpg https://s3.amazonaws.com/prod-ucs-content-store-us-east/content/pii:S1381116915301618/fx8/DOWNSAMPLED/image/jpeg/dac28b65762f3ca31b04746cd5cee170/fx8.jpg fx8 fx8.jpg jpg 9519 200 500 IMAGE-DOWNSAMPLED 1-s2.0-S1381116915301618-fx9.jpg https://s3-eu-west-1.amazonaws.com/prod-ucs-content-store-eu-west/content/pii:S1381116915301618/fx9/DOWNSAMPLED/image/jpeg/c3766d9397e06f42d51760da2546a461/fx9.jpg https://s3.amazonaws.com/prod-ucs-content-store-us-east/content/pii:S1381116915301618/fx9/DOWNSAMPLED/image/jpeg/c3766d9397e06f42d51760da2546a461/fx9.jpg fx9 fx9.jpg jpg 10080 200 500 IMAGE-DOWNSAMPLED 1-s2.0-S1381116915301618-gr1.jpg https://s3-eu-west-1.amazonaws.com/prod-ucs-content-store-eu-west/content/pii:S1381116915301618/gr1/DOWNSAMPLED/image/jpeg/7d59f6ae14d206841bca92d084fe7288/gr1.jpg https://s3.amazonaws.com/prod-ucs-content-store-us-east/content/pii:S1381116915301618/gr1/DOWNSAMPLED/image/jpeg/7d59f6ae14d206841bca92d084fe7288/gr1.jpg gr1 gr1.jpg jpg 120352 574 376 IMAGE-DOWNSAMPLED 1-s2.0-S1381116915301618-gr10.jpg https://s3-eu-west-1.amazonaws.com/prod-ucs-content-store-eu-west/content/pii:S1381116915301618/gr10/DOWNSAMPLED/image/jpeg/01694f833d1522f9f3e2346673aea3d8/gr10.jpg https://s3.amazonaws.com/prod-ucs-content-store-us-east/content/pii:S1381116915301618/gr10/DOWNSAMPLED/image/jpeg/01694f833d1522f9f3e2346673aea3d8/gr10.jpg gr10 gr10.jpg jpg 45604 218 301 IMAGE-DOWNSAMPLED 1-s2.0-S1381116915301618-gr2.jpg https://s3-eu-west-1.amazonaws.com/prod-ucs-content-store-eu-west/content/pii:S1381116915301618/gr2/DOWNSAMPLED/image/jpeg/7fd7235221498f268198b7ec3dc1a844/gr2.jpg https://s3.amazonaws.com/prod-ucs-content-store-us-east/content/pii:S1381116915301618/gr2/DOWNSAMPLED/image/jpeg/7fd7235221498f268198b7ec3dc1a844/gr2.jpg gr2 gr2.jpg jpg 138255 612 376 IMAGE-DOWNSAMPLED 1-s2.0-S1381116915301618-gr3.jpg https://s3-eu-west-1.amazonaws.com/prod-ucs-content-store-eu-west/content/pii:S1381116915301618/gr3/DOWNSAMPLED/image/jpeg/d59fb4d1bb3f9d1a78dbf7de07ec772e/gr3.jpg https://s3.amazonaws.com/prod-ucs-content-store-us-east/content/pii:S1381116915301618/gr3/DOWNSAMPLED/image/jpeg/d59fb4d1bb3f9d1a78dbf7de07ec772e/gr3.jpg gr3 gr3.jpg jpg 44525 199 263 IMAGE-DOWNSAMPLED 1-s2.0-S1381116915301618-gr4.jpg https://s3-eu-west-1.amazonaws.com/prod-ucs-content-store-eu-west/content/pii:S1381116915301618/gr4/DOWNSAMPLED/image/jpeg/a8ecccd46df1894ca40034b34abc4c33/gr4.jpg https://s3.amazonaws.com/prod-ucs-content-store-us-east/content/pii:S1381116915301618/gr4/DOWNSAMPLED/image/jpeg/a8ecccd46df1894ca40034b34abc4c33/gr4.jpg gr4 gr4.jpg jpg 26085 297 301 IMAGE-DOWNSAMPLED 1-s2.0-S1381116915301618-gr5.jpg https://s3-eu-west-1.amazonaws.com/prod-ucs-content-store-eu-west/content/pii:S1381116915301618/gr5/DOWNSAMPLED/image/jpeg/2b3ff8545f80fdd4275be450b2657299/gr5.jpg https://s3.amazonaws.com/prod-ucs-content-store-us-east/content/pii:S1381116915301618/gr5/DOWNSAMPLED/image/jpeg/2b3ff8545f80fdd4275be450b2657299/gr5.jpg gr5 gr5.jpg jpg 70444 432 339 IMAGE-DOWNSAMPLED 1-s2.0-S1381116915301618-gr6.jpg https://s3-eu-west-1.amazonaws.com/prod-ucs-content-store-eu-west/content/pii:S1381116915301618/gr6/DOWNSAMPLED/image/jpeg/0c53ae4686e1fd7e6baef228ced98c23/gr6.jpg https://s3.amazonaws.com/prod-ucs-content-store-us-east/content/pii:S1381116915301618/gr6/DOWNSAMPLED/image/jpeg/0c53ae4686e1fd7e6baef228ced98c23/gr6.jpg gr6 gr6.jpg jpg 13985 201 226 IMAGE-DOWNSAMPLED 1-s2.0-S1381116915301618-gr7.jpg https://s3-eu-west-1.amazonaws.com/prod-ucs-content-store-eu-west/content/pii:S1381116915301618/gr7/DOWNSAMPLED/image/jpeg/cc177b25df6d7b924d88483f3503116c/gr7.jpg https://s3.amazonaws.com/prod-ucs-content-store-us-east/content/pii:S1381116915301618/gr7/DOWNSAMPLED/image/jpeg/cc177b25df6d7b924d88483f3503116c/gr7.jpg gr7 gr7.jpg jpg 32547 308 339 IMAGE-DOWNSAMPLED 1-s2.0-S1381116915301618-gr8.jpg https://s3-eu-west-1.amazonaws.com/prod-ucs-content-store-eu-west/content/pii:S1381116915301618/gr8/DOWNSAMPLED/image/jpeg/42f27898efea531d7a81e72b8ae862c9/gr8.jpg https://s3.amazonaws.com/prod-ucs-content-store-us-east/content/pii:S1381116915301618/gr8/DOWNSAMPLED/image/jpeg/42f27898efea531d7a81e72b8ae862c9/gr8.jpg gr8 gr8.jpg jpg 36664 215 244 IMAGE-DOWNSAMPLED 1-s2.0-S1381116915301618-gr9.jpg https://s3-eu-west-1.amazonaws.com/prod-ucs-content-store-eu-west/content/pii:S1381116915301618/gr9/DOWNSAMPLED/image/jpeg/8b3fcee4b75479afc964a5dd5b7ef05e/gr9.jpg https://s3.amazonaws.com/prod-ucs-content-store-us-east/content/pii:S1381116915301618/gr9/DOWNSAMPLED/image/jpeg/8b3fcee4b75479afc964a5dd5b7ef05e/gr9.jpg gr9 gr9.jpg jpg 48521 231 301 IMAGE-DOWNSAMPLED 1-s2.0-S1381116915301618-sc1.jpg https://s3-eu-west-1.amazonaws.com/prod-ucs-content-store-eu-west/content/pii:S1381116915301618/sc1/DOWNSAMPLED/image/jpeg/e483d21516d704e10d4c47a40204d571/sc1.jpg https://s3.amazonaws.com/prod-ucs-content-store-us-east/content/pii:S1381116915301618/sc1/DOWNSAMPLED/image/jpeg/e483d21516d704e10d4c47a40204d571/sc1.jpg sc1 sc1.jpg jpg 46920 259 470 IMAGE-DOWNSAMPLED 1-s2.0-S1381116915301618-fx1_lrg.jpg https://s3-eu-west-1.amazonaws.com/prod-ucs-content-store-eu-west/content/pii:S1381116915301618/fx1/HIGHRES/image/jpeg/6425037ecbe3cbeb0477a2abfe66977f/fx1_lrg.jpg https://s3.amazonaws.com/prod-ucs-content-store-us-east/content/pii:S1381116915301618/fx1/HIGHRES/image/jpeg/6425037ecbe3cbeb0477a2abfe66977f/fx1_lrg.jpg fx1 true fx1_lrg.jpg jpg 145381 886 2213 IMAGE-HIGH-RES 1-s2.0-S1381116915301618-fx10_lrg.jpg https://s3-eu-west-1.amazonaws.com/prod-ucs-content-store-eu-west/content/pii:S1381116915301618/fx10/HIGHRES/image/jpeg/e5fb1ea11d4b098493370c43c685af51/fx10_lrg.jpg https://s3.amazonaws.com/prod-ucs-content-store-us-east/content/pii:S1381116915301618/fx10/HIGHRES/image/jpeg/e5fb1ea11d4b098493370c43c685af51/fx10_lrg.jpg fx10 fx10_lrg.jpg jpg 59226 886 2213 IMAGE-HIGH-RES 1-s2.0-S1381116915301618-fx11_lrg.jpg https://s3-eu-west-1.amazonaws.com/prod-ucs-content-store-eu-west/content/pii:S1381116915301618/fx11/HIGHRES/image/jpeg/b54a7e5c621b129d34e63874640858db/fx11_lrg.jpg https://s3.amazonaws.com/prod-ucs-content-store-us-east/content/pii:S1381116915301618/fx11/HIGHRES/image/jpeg/b54a7e5c621b129d34e63874640858db/fx11_lrg.jpg fx11 fx11_lrg.jpg jpg 60659 886 2213 IMAGE-HIGH-RES 1-s2.0-S1381116915301618-fx12_lrg.jpg https://s3-eu-west-1.amazonaws.com/prod-ucs-content-store-eu-west/content/pii:S1381116915301618/fx12/HIGHRES/image/jpeg/234f33e49fa90cc9f0e3fa444def27cc/fx12_lrg.jpg https://s3.amazonaws.com/prod-ucs-content-store-us-east/content/pii:S1381116915301618/fx12/HIGHRES/image/jpeg/234f33e49fa90cc9f0e3fa444def27cc/fx12_lrg.jpg fx12 fx12_lrg.jpg jpg 97208 886 2213 IMAGE-HIGH-RES 1-s2.0-S1381116915301618-fx2_lrg.jpg https://s3-eu-west-1.amazonaws.com/prod-ucs-content-store-eu-west/content/pii:S1381116915301618/fx2/HIGHRES/image/jpeg/221ae84d48ba3f2fbb1dc6d38730036b/fx2_lrg.jpg https://s3.amazonaws.com/prod-ucs-content-store-us-east/content/pii:S1381116915301618/fx2/HIGHRES/image/jpeg/221ae84d48ba3f2fbb1dc6d38730036b/fx2_lrg.jpg fx2 fx2_lrg.jpg jpg 80323 886 2213 IMAGE-HIGH-RES 1-s2.0-S1381116915301618-fx3_lrg.jpg https://s3-eu-west-1.amazonaws.com/prod-ucs-content-store-eu-west/content/pii:S1381116915301618/fx3/HIGHRES/image/jpeg/408e93f4d159630dca3a48ade58578e9/fx3_lrg.jpg https://s3.amazonaws.com/prod-ucs-content-store-us-east/content/pii:S1381116915301618/fx3/HIGHRES/image/jpeg/408e93f4d159630dca3a48ade58578e9/fx3_lrg.jpg fx3 fx3_lrg.jpg jpg 74313 886 2213 IMAGE-HIGH-RES 1-s2.0-S1381116915301618-fx4_lrg.jpg https://s3-eu-west-1.amazonaws.com/prod-ucs-content-store-eu-west/content/pii:S1381116915301618/fx4/HIGHRES/image/jpeg/ac5748f7c6fff7268843e9bfc4ec42aa/fx4_lrg.jpg https://s3.amazonaws.com/prod-ucs-content-store-us-east/content/pii:S1381116915301618/fx4/HIGHRES/image/jpeg/ac5748f7c6fff7268843e9bfc4ec42aa/fx4_lrg.jpg fx4 fx4_lrg.jpg jpg 74260 886 2213 IMAGE-HIGH-RES 1-s2.0-S1381116915301618-fx5_lrg.jpg https://s3-eu-west-1.amazonaws.com/prod-ucs-content-store-eu-west/content/pii:S1381116915301618/fx5/HIGHRES/image/jpeg/d792ff5aa3b6bad852b5afdb5de1b671/fx5_lrg.jpg https://s3.amazonaws.com/prod-ucs-content-store-us-east/content/pii:S1381116915301618/fx5/HIGHRES/image/jpeg/d792ff5aa3b6bad852b5afdb5de1b671/fx5_lrg.jpg fx5 fx5_lrg.jpg jpg 71181 886 2213 IMAGE-HIGH-RES 1-s2.0-S1381116915301618-fx6_lrg.jpg https://s3-eu-west-1.amazonaws.com/prod-ucs-content-store-eu-west/content/pii:S1381116915301618/fx6/HIGHRES/image/jpeg/7eee9ea6925d13589e23a1471f3d7f34/fx6_lrg.jpg https://s3.amazonaws.com/prod-ucs-content-store-us-east/content/pii:S1381116915301618/fx6/HIGHRES/image/jpeg/7eee9ea6925d13589e23a1471f3d7f34/fx6_lrg.jpg fx6 fx6_lrg.jpg jpg 78314 886 2213 IMAGE-HIGH-RES 1-s2.0-S1381116915301618-fx7_lrg.jpg https://s3-eu-west-1.amazonaws.com/prod-ucs-content-store-eu-west/content/pii:S1381116915301618/fx7/HIGHRES/image/jpeg/20cdbba12fae2000670f128ebe79da6a/fx7_lrg.jpg https://s3.amazonaws.com/prod-ucs-content-store-us-east/content/pii:S1381116915301618/fx7/HIGHRES/image/jpeg/20cdbba12fae2000670f128ebe79da6a/fx7_lrg.jpg fx7 fx7_lrg.jpg jpg 73969 886 2213 IMAGE-HIGH-RES 1-s2.0-S1381116915301618-fx8_lrg.jpg https://s3-eu-west-1.amazonaws.com/prod-ucs-content-store-eu-west/content/pii:S1381116915301618/fx8/HIGHRES/image/jpeg/a17f0d01ba80fb3025e67e9e5007d4a3/fx8_lrg.jpg https://s3.amazonaws.com/prod-ucs-content-store-us-east/content/pii:S1381116915301618/fx8/HIGHRES/image/jpeg/a17f0d01ba80fb3025e67e9e5007d4a3/fx8_lrg.jpg fx8 fx8_lrg.jpg jpg 74583 886 2213 IMAGE-HIGH-RES 1-s2.0-S1381116915301618-fx9_lrg.jpg https://s3-eu-west-1.amazonaws.com/prod-ucs-content-store-eu-west/content/pii:S1381116915301618/fx9/HIGHRES/image/jpeg/2ed3be81f90129503b777a8100ad080a/fx9_lrg.jpg https://s3.amazonaws.com/prod-ucs-content-store-us-east/content/pii:S1381116915301618/fx9/HIGHRES/image/jpeg/2ed3be81f90129503b777a8100ad080a/fx9_lrg.jpg fx9 fx9_lrg.jpg jpg 79215 886 2213 IMAGE-HIGH-RES 1-s2.0-S1381116915301618-gr1_lrg.jpg https://s3-eu-west-1.amazonaws.com/prod-ucs-content-store-eu-west/content/pii:S1381116915301618/gr1/HIGHRES/image/jpeg/d52657e28d8bd87bc232cdeb614d38e7/gr1_lrg.jpg https://s3.amazonaws.com/prod-ucs-content-store-us-east/content/pii:S1381116915301618/gr1/HIGHRES/image/jpeg/d52657e28d8bd87bc232cdeb614d38e7/gr1_lrg.jpg gr1 gr1_lrg.jpg jpg 503471 1526 1000 IMAGE-HIGH-RES 1-s2.0-S1381116915301618-gr10_lrg.jpg https://s3-eu-west-1.amazonaws.com/prod-ucs-content-store-eu-west/content/pii:S1381116915301618/gr10/HIGHRES/image/jpeg/65086f5fc8e88cefb0809305009bb3ad/gr10_lrg.jpg https://s3.amazonaws.com/prod-ucs-content-store-us-east/content/pii:S1381116915301618/gr10/HIGHRES/image/jpeg/65086f5fc8e88cefb0809305009bb3ad/gr10_lrg.jpg gr10 gr10_lrg.jpg jpg 207469 965 1333 IMAGE-HIGH-RES 1-s2.0-S1381116915301618-gr2_lrg.jpg https://s3-eu-west-1.amazonaws.com/prod-ucs-content-store-eu-west/content/pii:S1381116915301618/gr2/HIGHRES/image/jpeg/fd4fc74bdbe5255124126f6b06cc5a28/gr2_lrg.jpg https://s3.amazonaws.com/prod-ucs-content-store-us-east/content/pii:S1381116915301618/gr2/HIGHRES/image/jpeg/fd4fc74bdbe5255124126f6b06cc5a28/gr2_lrg.jpg gr2 gr2_lrg.jpg jpg 584796 1628 1000 IMAGE-HIGH-RES 1-s2.0-S1381116915301618-gr3_lrg.jpg https://s3-eu-west-1.amazonaws.com/prod-ucs-content-store-eu-west/content/pii:S1381116915301618/gr3/HIGHRES/image/jpeg/250e82fc68791b70414104cae61b8648/gr3_lrg.jpg https://s3.amazonaws.com/prod-ucs-content-store-us-east/content/pii:S1381116915301618/gr3/HIGHRES/image/jpeg/250e82fc68791b70414104cae61b8648/gr3_lrg.jpg gr3 gr3_lrg.jpg jpg 193851 884 1167 IMAGE-HIGH-RES 1-s2.0-S1381116915301618-gr4_lrg.jpg https://s3-eu-west-1.amazonaws.com/prod-ucs-content-store-eu-west/content/pii:S1381116915301618/gr4/HIGHRES/image/jpeg/57761a58fd27a3e35b14dd8ba9c61574/gr4_lrg.jpg https://s3.amazonaws.com/prod-ucs-content-store-us-east/content/pii:S1381116915301618/gr4/HIGHRES/image/jpeg/57761a58fd27a3e35b14dd8ba9c61574/gr4_lrg.jpg gr4 gr4_lrg.jpg jpg 185009 1314 1333 IMAGE-HIGH-RES 1-s2.0-S1381116915301618-gr5_lrg.jpg https://s3-eu-west-1.amazonaws.com/prod-ucs-content-store-eu-west/content/pii:S1381116915301618/gr5/HIGHRES/image/jpeg/4cad41bcdeea9681ad0a3aac97611a76/gr5_lrg.jpg https://s3.amazonaws.com/prod-ucs-content-store-us-east/content/pii:S1381116915301618/gr5/HIGHRES/image/jpeg/4cad41bcdeea9681ad0a3aac97611a76/gr5_lrg.jpg gr5 gr5_lrg.jpg jpg 337796 1910 1500 IMAGE-HIGH-RES 1-s2.0-S1381116915301618-gr6_lrg.jpg https://s3-eu-west-1.amazonaws.com/prod-ucs-content-store-eu-west/content/pii:S1381116915301618/gr6/HIGHRES/image/jpeg/60bcc4a4f4bb4d53fe7d4c1bd434a8a9/gr6_lrg.jpg https://s3.amazonaws.com/prod-ucs-content-store-us-east/content/pii:S1381116915301618/gr6/HIGHRES/image/jpeg/60bcc4a4f4bb4d53fe7d4c1bd434a8a9/gr6_lrg.jpg gr6 gr6_lrg.jpg jpg 100361 888 1000 IMAGE-HIGH-RES 1-s2.0-S1381116915301618-gr7_lrg.jpg https://s3-eu-west-1.amazonaws.com/prod-ucs-content-store-eu-west/content/pii:S1381116915301618/gr7/HIGHRES/image/jpeg/879eb5fc1c12b3df4aa56f6fbe9b36f1/gr7_lrg.jpg https://s3.amazonaws.com/prod-ucs-content-store-us-east/content/pii:S1381116915301618/gr7/HIGHRES/image/jpeg/879eb5fc1c12b3df4aa56f6fbe9b36f1/gr7_lrg.jpg gr7 gr7_lrg.jpg jpg 271585 1365 1501 IMAGE-HIGH-RES 1-s2.0-S1381116915301618-gr8_lrg.jpg https://s3-eu-west-1.amazonaws.com/prod-ucs-content-store-eu-west/content/pii:S1381116915301618/gr8/HIGHRES/image/jpeg/100efb6eb4beeee0fca7c45280226f41/gr8_lrg.jpg https://s3.amazonaws.com/prod-ucs-content-store-us-east/content/pii:S1381116915301618/gr8/HIGHRES/image/jpeg/100efb6eb4beeee0fca7c45280226f41/gr8_lrg.jpg gr8 gr8_lrg.jpg jpg 142099 953 1083 IMAGE-HIGH-RES 1-s2.0-S1381116915301618-gr9_lrg.jpg https://s3-eu-west-1.amazonaws.com/prod-ucs-content-store-eu-west/content/pii:S1381116915301618/gr9/HIGHRES/image/jpeg/1eb911f72ec60bf3108be474276af3d7/gr9_lrg.jpg https://s3.amazonaws.com/prod-ucs-content-store-us-east/content/pii:S1381116915301618/gr9/HIGHRES/image/jpeg/1eb911f72ec60bf3108be474276af3d7/gr9_lrg.jpg gr9 gr9_lrg.jpg jpg 219504 1023 1333 IMAGE-HIGH-RES 1-s2.0-S1381116915301618-sc1_lrg.jpg https://s3-eu-west-1.amazonaws.com/prod-ucs-content-store-eu-west/content/pii:S1381116915301618/sc1/HIGHRES/image/jpeg/13108b9ca4e21058a29c22536839cfcb/sc1_lrg.jpg https://s3.amazonaws.com/prod-ucs-content-store-us-east/content/pii:S1381116915301618/sc1/HIGHRES/image/jpeg/13108b9ca4e21058a29c22536839cfcb/sc1_lrg.jpg sc1 sc1_lrg.jpg jpg 274993 1148 2083 IMAGE-HIGH-RES 1-s2.0-S1381116915301618-mmc1.doc https://s3-eu-west-1.amazonaws.com/prod-ucs-content-store-eu-west/content/pii:S1381116915301618/mmc1/MAIN/application/msword/3d372c1fa7912b47aa0d8f589a9ae86d/mmc1.doc https://s3.amazonaws.com/prod-ucs-content-store-us-east/content/pii:S1381116915301618/mmc1/MAIN/application/msword/3d372c1fa7912b47aa0d8f589a9ae86d/mmc1.doc mmc1 mmc1.doc doc 1843200 APPLICATION 1-s2.0-S1381116915301618-si1.gif https://s3-eu-west-1.amazonaws.com/prod-ucs-content-store-eu-west/content/pii:S1381116915301618/STRIPIN/image/gif/8b0624e4a982342c9993d405fec4f06b/si1.gif https://s3.amazonaws.com/prod-ucs-content-store-us-east/content/pii:S1381116915301618/STRIPIN/image/gif/8b0624e4a982342c9993d405fec4f06b/si1.gif si1 si1.gif gif 1774 46 367 ALTIMG MOLCAA 9699 S1381-1169(15)30161-8 10.1016/j.molcata.2015.11.019 Elsevier B.V. Scheme 1 Probable reaction pathway for the aerobic oxidative coupling of benzylamine into N-benzylbenzaldimine over Au catalyst. Fig. 1 HRTEM images of nanoscale CeO2 and CeO2-ZrO2 supports. Fig. 2 HRTEM images of Au/CeO2 and Au/CeO2-ZrO2 catalysts. Fig. 3 Powder XRD patterns of nanoscale CeO2 (Ce), CeO2-ZrO2 (CeZr), Au/CeO2 (AuCe), and Au/CeO2-ZrO2 (AuCeZr) catalysts. Fig. 4 N2 adsorption–desorption isotherms of nanoscale CeO2 (Ce), CeO2-ZrO2 (CeZr), Au/CeO2 (AuCe), and Au/CeO2-ZrO2 (AuCeZr) catalysts. Fig. 5 Raman spectra of nanoscale CeO2 and CeO2-ZrO2 supports. Fig. 6 Au 4f XPS spectra of nanoscale Au/CeO2 (AuCe) and Au/CeO2-ZrO2 (AuCeZr) catalysts. Fig. 7 Ce 3d XPS spectra of nanoscale CeO2, CeO2-ZrO2, Au/CeO2, and Au/CeO2-ZrO2 catalysts. Fig. 8 Concentration of Ce3+ in CeO2, CeO2-ZrO2, Au/CeO2, and Au/CeO2-ZrO2 catalysts. Fig. 9 Effect of temperature on the oxidation of benzylamine over Au/CeO2-ZrO2 catalyst. Reaction conditions: time (6h), benzylamine (0.2mmol), catalyst amount (0.1g), and O2 bubbling rate (20mL/min). Fig. 10 Effect of reaction time on the oxidation of benzylamine over Au/CeO2-ZrO2 catalyst. Reaction conditions: temperature (413K), benzylamine (0.2mmol), catalyst amount (0.1g), and O2 bubbling rate (20mL/min). Table 1 Ceria lattice parameter (LP), ceria crystallite size (D), BET surface area (S BET), pore size, pore volume, Au loading, and Au particle size of CeO2 (Ce), CeO2-ZrO2 (CeZr), Au/CeO2 (AuCe) and Au/CeO2-ZrO2 (AuCeZr) catalysts. Catalyst LP (nm) a D (nm) a S BET (m2/g) b Pore size (nm) b Pore volume (cm3 g−1) b Au loading (wt.%) c Au particle size (nm) d Ce 0.5411±0.05 8.7±1 42±2 9.818±1 0.113±0.01 – – AuCe 0.5399±0.05 8.6±1 39±2 3.479±0.5 0.066±0.01 0.87±0.05 3.7±0.5 CeZr 0.5352±0.05 4.6±0.5 82±3 6.734±1 0.434±0.05 – – AuCeZr 0.5353±0.05 4.8±0.5 84±3 5.989±1 0.396±0.05 0.95±0.05 2.1±0.5 a Estimated from XRD patterns. b Obtained from N2-adsorption desorption studies. c Determined from AAS analysis. d Obtained from TEM images. Table 2 Aerobic oxidative coupling of benzylamine over CeO2 (Ce), CeO2-ZrO2 (CeZr), Au/CeO2 (AuCe) and Au/CeO2-ZrO2 (AuCeZr) catalysts under solvent- and base-free conditions. Standard deviations from GC analysis of benzylamine conversion and selectivity of N-benzylbenzaldimine (benzonitrile) are ±3 and ±3 (0.05), respectively. Catalyst Benzylamineconversion (%) Selectivity (%) TOF (10−2) N-benzylbenzaldimine Benzonitrile Ce 39 99.1 0.9 2.3 CeZr 51 99.6 0.4 2.8 AuCe 78 99.7 0.3 4.5 AuCeZr 95 99.8 0.2 10.2 Reaction conditions: time (6h), temperature (403K), benzylamine (0.2mmol), catalyst (0.1g) and O2 bubbling rate (20mL/min). TOF=moles of benzylamine converted per mol of catalyst per hour. Table 3 Aerobic oxidative coupling of various substituted benzylamines over Au/CeO2-ZrO2 catalyst under solvent- and base-free conditions. Standard deviations from GC analysis of benzylamine conversion and selectivity of imine (nitrile) are ±3 and ± (0.05), respectively. Amine Time (h) Conversion (%) Selectivity (%) Imine Nitrile 6 95 99.8 0.2 6 99 99.8 0.2 6 96 99.7 0.3 6 98 99.7 0.3 6 86 99.9 0.1 7 97 99.8 0.2 6 99 99.6 0.4 6 87 99.7 0.3 7 93 99.8 0.2 Reaction conditions: temperature (403K), amine (0.2mmol), catalyst amount (0.1g) and O2 bubbling rate (20mL/min). Table 4 Aerobic oxidative coupling of various secondary benzylamines over Au/CeO2-ZrO2 catalyst under solvent- and base-free conditions. Standard deviation from GC analysis of amine conversion is ±3. Reaction conditions: temperature (403K), time (6h), amine (0.2mmol) catalyst amount (0.1g) and O2 bubbling rate (20mL/min). Promising nanostructured gold/metal oxide catalysts for oxidative coupling of benzylamines under eco-friendly conditions Putla Sudarsanam a b Baithy Mallesham a Agolu Rangaswamy a Bolla Govinda Rao a Suresh K. Bhargava b Benjaram M. Reddy a ⁎ a Inorganic and Physical Chemistry Division, CSIR—Indian Institute of Chemical Technology, Uppal Road, Hyderabad 500 007, India Inorganic and Physical Chemistry Division CSIR—Indian Institute of Chemical Technology Uppal Road Hyderabad 500 007 India b Centre for Advanced Materials and Industrial Chemistry (CAMIC), School of Applied Sciences, RMIT University, Melbourne, VIC 3001, Australia Centre for Advanced Materials and Industrial Chemistry (CAMIC) School of Applied Sciences RMIT University Melbourne VIC 3001 Australia ⁎ Corresponding author. Fax: +91 40 2716 0921. Graphical abstract Nano-Au dispersed on nanocrystalline CeO2-ZrO2 support exhibits a higher catalytic efficiency in the solvent-free oxidative coupling of benzylamine, which is attributed to catalytically favorable properties of nano-Au and the CeO2-ZrO2 support. Designing Au nanocatalysts supported on nanosized metal oxides has drawn much attention due to remarkable nanoscale influenced metal-support interactions and their favorable role in heterogeneous catalysis. This work reports development of Au nanocatalysts dispersed on nanosized CeO2 and CeO2-ZrO2 supports for solvent- and base-free oxidative coupling of benzylamines into N-benzylbenzaldimines using O2 as a green oxidant. The physicochemical characterization of nanocatalysts has been undertaken using HRTEM, UV–vis DRS, XRD, Raman, BET, TG-DTA, AAS, and XPS techniques. HRTEM images reveal the formation of nanosized CeO2 and CeO2-ZrO2 supports with an average diameter of ∼10 and 7nm, respectively. HRTEM images also indicated that Au/CeO2-ZrO2 catalyst has smaller Au nanoparticles (∼2.1nm) compared with that of Au/CeO2 catalyst (∼3.7nm). Raman and XPS studies showed that the addition of ZrO2 to CeO2 leads to abundant oxygen vacancies and higher concentration of Ce3+, respectively. The Au/CeO2-ZrO2 catalyst exhibited a higher efficiency in benzylamine conversion (∼95%) followed by Au/CeO2 (∼78%), CeO2-ZrO2 (∼51%), and CeO2 (∼39%). The Au/CeO2-ZrO2 catalyst was also found to effective for oxidative coupling of various benzylamines, and moderate to good product yields were obtained. The presence of smaller Au particles (2.1nm) and improved surface-defect properties of nanoscale CeO2-ZrO2 support are found to be key factors for high performance of Au/CeO2-ZrO2 catalyst. Additionally, the reaction temperature is one of the important factors for the performance of catalysts. Remarkably, ∼99.6–99.9% selectivity for N-benzylbenzaldimines was found in the amine oxidation, which highlights the significance of present work in the selective oxidation catalysis. Keywords Nano-gold Nanoscale ceria Zirconium Characterization Eco-friendly benzylamine oxidation 1 Introduction Catalysis using supported gold nanoparticles (Au NPs) is currently one of the most attractive research areas due to its wide significance in the chemical industry [1,2]. Indeed, bulk gold had long been considered as catalytically ‘inactive’ metal [3]. However, the pioneering discoveries of Haruta and Hutchings have been demonstrated that smaller sized gold nanoparticles dispersed on suitable metal oxides exhibit a remarkable catalytic performance in the oxidation of carbon monoxide and hydrochlorination of ethyne, respectively [3,4]. Consequently, the Au nanocatalysts have been widely used in many reactions of both environmental and industrial importance, such as CO oxidation, oxidation of alcohols, chemoselective hydrogenation, CC and CN coupling reactions, H2O2 production, water–gas-shift reaction, combustion of volatile organic compounds and oxidation of olefins [5–15]. In particular, the oxidative coupling of benzylamines into N-benzylbenzaldimines using nano-Au catalysts has received tremendous attention due to the many useful applications of imines [16–18]. For example, N-benzylbenzaldimines are important building blocks for the synthesis of dyes, polymers, agrochemicals, fine chemicals, anti-inflammatory and anti-cancer agents [19,20]. Owing to the CN double bond, N-benzylbenzaldimines can also be used in a number of transformations, such as hydrogenation, cycloaddition, and nucleophilic addition reactions. Stoichiometric amounts of chromate, permanganate, 2-iodoxybenzoic acid, and N-tert-butylphenylsulfinimidoyl-chloride are typically used oxidants for the oxidation of organic compounds [21,22]. However, the use of stoichiometric (hazardous) oxidants is unfavorable from the perspective of sustainable chemical industry. On the other hand, the catalytic efficiency of several Au catalysts has been tested for the oxidation of benzylamines using molecular oxygen (O2) as the oxidant [17,23–25]. O2 is an abundant and eco-friendly oxidant that generates only water as the by-product in the benzylamine oxidation, hence O2 is an efficient alternative to stoichiometric (hazardous) oxidants [18]. However, the major limitations in the above Au-catalyzed benzylamine oxidation reactions is the use of harmful organic solvents and bases, which generates large amounts of toxic chemical waste and requires a tedious workup procedure for separating the Au catalysts from the reaction mixture as well as for analyzing the reaction products. Therefore, developing greener and more efficient methodologies that can be performed under solvent- and base-free conditions using O2 as the oxidant are highly desirable toward a sustainable organic chemistry. It is now a well-known fact that the nature of metal oxide supports plays a pivotal role in modifying the structure-activity properties of nano-Au catalysts [26]. The metal oxides can be classified into reducible or active supports, such as TiO2, CeO2, Fe2O3, and MnO2, and inert supports, such as SiO2, MgO, and Al2O3. It has been reported that Au nanoparticles supported on reducible metal oxides exhibit a higher catalytic performance compared with that of Au nanoparticles supported on inert metal oxides [27,28]. The reason is that reducible metal oxides provide active sites for the adsorption of oxygen, generating active oxygen species for the oxidation reactions [29–31]. Cerium oxide (CeO2) is one of the widely used active supports for the Au nanoparticle-catalyzed reactions [27,31–34]. This significance has been aroused due to unique properties of CeO2, such as abundant oxygen vacancies and remarkable redox properties (Ce3+ ↔Ce4+). In addition, the particle size of CeO2 plays a key role in enhancing the efficiency of Au catalysts. It has been shown that nano-CeO2 supported Au catalyst exhibits better activity compared with that of bulk CeO2 supported Au catalyst in the oxidation of carbon monoxide and oxidation of alcohols [32,34]. It is therefore believed that by enhancing the textural (e.g., surface area) and redox properties of ceria, the catalytic efficiency of Au catalysts can be improved. The doping of metal ions (e.g., Zr4+) into the CeO2 is one of the promising ways to modify its physicochemical properties [7,35–37]. Doped ceria materials exhibit smaller particle size, higher specific surface area, and more number of oxygen vacancies compared with bare ceria, which is attributed to the co-operation effect of the cerium and dopant. Particularly, oxygen vacancies play a favorable role in the adsorption and activation of gaseous phase oxygen in order to interact with the reactant molecules in the oxidation reactions [38,39]. The present study has been undertaken against the above background. Nanoscale CeO2 and CeO2-ZrO2 (Ce/Zr=1/1) supports were synthesized using a modified co-precipitation method. Au nanoparticles are dispersed onto the nanoscale CeO2 and CeO2-ZrO2 supports using a deposition–precipitation method. The physicochemical properties of the nanocatalysts were systematically analyzed using X-ray diffraction (XRD), thermogravimetric-differential thermal analysis (TG-DTA), BET surface area, atomic absorption spectroscopy (AAS), X-ray photoelectron spectroscopy (XPS), Raman spectroscopy, UV–vis diffuse reflectance spectroscopy (UV–vis DRS), and high resolution transmission electron microscopy (HRTEM) techniques. The catalytic efficiency of the nanocatalysts was studied for the oxidative coupling of various benzylamines. The catalytic experiments have been conducted under solvent- and base-free conditions using O2, a greener and more efficient methodology toward a sustainable chemistry. To the best of our knowledge, this is first report on the catalytic performance of Au/CeO2 and Au/CeO2-ZrO2 catalysts for the solvent- and base-free oxidative coupling of benyzlamines using molecular oxygen. Great efforts have been made to correlate the catalytic activity results with the characterization studies. 2 Experimental 2.1 Materials and methods Nanoscale 50% Zr-doped CeO2 was synthesized using a modified co-precipitation method from ultra-high dilute aqueous solutions, which is crucial for synthesizing nanoscale CeO2-based metal oxides [40,41]. The employed precursors are NH4Ce(NO3)4·6H2O (Aldrich, AR grade), ZrO(NO3)2·xH2O (Fluka, AR grade). Extremely dilute aq. NH3 solution (2.5 v/v%) was used as the precipitating agent. In a typical procedure, the required amounts of metal precursors are dissolved in Milli-Q water under mild stirring conditions. The precipitant was added slowly to the above mixture solution over a period of 1h until the pH of the solution reached to ∼8.5. The obtained precipitates were decanted, filtered off, washed with Milli-Q water, and oven dried at 393K for 12h. The sample was then calcined at 773K for 5h in air at a heating rate of 5K/min. Nanoscale CeO2 support was also synthesized using the same preparation method. Homogeneous deposition precipitation method was used to synthesize 1wt.% Au catalysts. In brief, to prepare the Au/CeO2-ZrO2 catalyst the adequate amounts of HAuCl4·4H2O (Alfa Aesar, 99.9%) and urea (urea:Au=100 mole ratio) are dissolved in Milli-Q water and the solution was then heated to 343K. The required amount of CeO2-ZrO2 support was added to the Au solution and the stirring was continued for 12h at the same temperature. The solution was then cooled to room temperature, filtered off, and washed with Milli-Q water until no traces of chloride ions were detected by AgNO3 test. Finally, the sample was oven dried at 373K for 12h and calcined in air at 573K for 4h (1K/min). The Au/CeO2 catalyst was also synthesized by adopting the same method. 2.2 Catalyst characterization Powder XRD analysis was performed using a Rigaku diffractometer with Cu Kα radiation (0.15418nm) and a scintillation counter detector. Scherrer equation and standard cubic indexation method were used to determine the average crystallite size of CeO2 and its lattice parameter in the synthesized catalysts, respectively. The TG-DTA analysis was carried out on a Mettler Toledo TG-SDTA instrument. The samples were heated from ambient temperature to 1073K with a heating rate of 5K min−1 under the flow of N2. HRTEM studies were made on a JEOL JEM-2100F instrument equipped with a slow-scan CCD camera and an accelerating voltage of the electron beam 80kV. The preparation of samples involves sonication in acetone for 10min, followed by deposition of a drop on the copper grid supporting a perforated carbon film and allowed to dry. The Au content of the catalysts was estimated using the AAS technique. For this, Spectra AA-220 spectrophotometer at a wavelength of 242.8nm was used. The UV–vis DRS measurements were performed over the wavelength range of λ =200–750nm using a GBS–Cintra 10e UV–vis NIR spectrophotometer with an integration sphere diffuse reflectance attachment. Sample was diluted in a KBr matrix by pelletization. N2-adsorption/desorption isotherms of the catalysts were obtained on a Micromeritics ASAP 2010 instrument at liquid N2 temperature (77.25K). Prior to analysis, the samples were degassed at 423K for 16h. XPS studies were conducted using a Thermo K-5 Alpha XPS instrument with Al Kα radiation (photon energy=1486.6eV) at a pass energy of 50eV. The core level binding energies (BEs) were charge corrected with respect to carbon (C 1s) peak at 284.8eV. Raman analysis was performed using PerkinElmer-Raman Station 400F (785nm laser, spot size of 100mm) spectrometer equipped with a liquid N2 cooled charge coupled device detector and a confocal microscope. The samples were excited with 350mW near infrared 785nm laser with the diameter of the analyzed spot being ∼1μm. 2.3 Catalytic activity measurements The oxidation of benzylamines was performed using O2 as the oxidant under solvent-free conditions. Typically, 0.1g of catalyst and 2mmol of benzylamine were taken into a 10mL round bottom flask. The reaction mixture was then heated to the required temperature. O2 was bubbled at a rate of 20mL/min under 800rpm stirring conditions. After the reaction, the liquid products and the catalyst were separated by centrifugation. The products were confirmed by GC–MS equipped with a DB-5 capillary column. All the reaction samples were analysed by GC equipped with a BP-20 (wax) capillary column fitted with a FID detector. 3 Results and discussions 3.1 Catalyst characterization studies The HRTEM studies have been carried out to get an overview on the nature of the CeO2, CeO2-ZrO2 and Au particles, as well to estimate their particle size. Fig. 1 shows HRTEM images of CeO2 and CeO2-ZrO2 supports. As can be noted from Fig. 1, the supports are highly crystalline materials in the nanoscale range. The lattice fringes for both supports are clearly visible with an estimated d-spacing of 0.31nm, which is attributed to (111) plane of the cerium oxide [18]. It was found that the CeO2-ZrO2 support exhibits smaller sized particles (∼7±2nm) compared with that of CeO2 (∼10±2nm). This observation indicates the beneficial role of Zr-dopant in the reduction of particle size of cerium oxide. Fig. 2 shows HRTEM images of Au/CeO2 and Au/CeO2-ZrO2 samples. A careful observation of Fig. 2 reveals that Au/CeO2 sample contains different sized Au particles with an average diameter of 3.7±0.5nm. On the other hand, smaller sized Au particles (∼2.1±0.5nm) were found for Au/CeO2-ZrO2 catalyst, which is due to the existence of strong interaction between the Au and CeO2-ZrO2 support (Fig. 2 and Fig. S1 of the Supplementary material). Lattice fringes with a d-spacing of 0.31nm corresponding to CeO2 (111) plane can also be clearly observed in all gold catalysts. UV–vis DRS analysis has been performed to elucidate the presence of Au in the synthesized catalysts (Fig. S2 of the Supplementary material). It was found that both Au/CeO2 and Au/CeO2-ZrO2 catalysts display a broad surface plasmon resonance (SPR) band centred at ∼580nm. This band is the characteristic of Au nanoparticles, indicating the presence of nano-Au in the synthesized catalysts, in line with the HRTEM studies (Fig. 2) [42]. The appearance of SPR band is dependent on various parameters, which includes Au particle size, its shape, Au amount, and dielectric function of the surrounding environment [31,43,44]. It is interesting to note that Au/CeO2-ZrO2 catalyst exhibits a higher intensity SPR band compared with that of Au/CeO2 catalyst. This observation indicates the presence of higher amount of Au onto the CeO2-ZrO2 support, in line with the AAS analysis (Table 1 ). The powder XRD patterns of nanoscale CeO2, CeO2-ZrO2, Au/CeO2, and Au/CeO2-ZrO2 samples are shown in Fig. 3 . All the catalysts exhibit characteristic fluorite cubic structured CeO2 patterns at 2 theta values of 28.65, 33.03, 47.46, 56.31, 59.06, 69.41, 76.66, and 79.03° [45–49]. Interestingly, the XRD peaks related to ZrO2 phases are not found for CeO2-ZrO2 and Au/CeO2-ZrO2 catalysts. On the other hand, the XRD peaks of pristine CeO2 are shifted considerably toward higher angles after the addition of Zr dopant. The estimated lower lattice parameter of CeO2-ZrO2 (0.5320nm) compared with that of CeO2 (0.5411nm) also evidenced this observation (Table 1). The ionic radius of Zr4+ dopant (0.084nm) is much smaller compared with that of Ce4+ (0.097nm), hence, a peak shifting and decrease in the lattice parameter of ceria can be observed after doping the Zr into the CeO2 lattice (Fig. 3 and Table 1). The average crystallite size of the samples was estimated using Scherrer equation (Table 1). The crystallite size of the supports was found to be in the nanoscale range: Zr-doped CeO2 has smaller crystallite size (∼4.6nm) compared with that of bare CeO2 (∼8.7). The specific surface area of CeO2 was significantly increased from 42 to 82m2/g after the addition of Zr (Table 1). This observation indicates the existence of strong interaction between the Zr-dopant and Ce in the Ce1-x Zr x O2, which ultimately leads to strong resistance ability against higher thermal treatments in line with the crystallite size of the samples (Table 1). Interestingly, no considerable variation in the crystallite size and surface area of the supports was observed after the addition of Au (Table 1). In this study, no Au XRD peaks were noticed for Au/CeO2 and Au/CeO2-ZrO2 catalysts (Fig. 3). This observation is most probably due to low Au loading and/or due to high dispersion of Au onto the surface of supports [50]. The N2 adsorption–desorption isotherms of the samples are shown in Fig. 4 . Except Au/CeO2, all samples exhibit type IV isotherm with H1-type hysteresis, which indicates mesoporosity of the material [51]. In contrast, the Au/CeO2 catalyst showed H2-type isotherm, in which the distribution of pore size and shape is not well defined. The pore size of CeO2, Au/CeO2, CeO2-ZrO2, and Au/CeO2-ZrO2 samples was found to be ∼9.818, 3.479, 6.734, and 5.989nm, respectively. As well, the obtained pore volumes are ∼0.113, 0.066, 0.434, and 0.396cm3 g−1 for CeO2, Au/CeO2, CeO2-ZrO2, and Au/CeO2-ZrO2 samples, respectively. The TG-DTA analysis of Au/CeO2 and Au/CeO2-ZrO2 samples shows a major weight loss peak in the range of 373–423K, which reveals desorption of hydroxyl species from the catalyst surface (Fig. S3 of the Supplementary material). In addition, a sharp weight loss peak was found for Au/CeO2 sample at around 823–923K, which is attributed to desorption of carbonate species from the catalyst surface. The appearance of second weight loss peak is almost negligible for Au/CeO2-ZrO2 catalyst. The estimated Au amounts from the AAS analysis were found to be ∼0.87 and 0.95% for Au/CeO2 and Au/CeO2-ZrO2 samples, respectively (Table 1). Raman spectroscopy is an efficient technique to understand the structural features and surface-defects of CeO2 based materials. Fig. 5 shows Raman spectra of nanoscale CeO2 and CeO2-ZrO2 supports. A prominent Raman peak was found at around 464–470cm−1 for both supports, which indicates F2g vibration model of octahedral local symmetry around CeO2 lattice [32,52]. Appearance of this band confirms the fluorite cubic structured ceria, in line with the XRD studies (Fig. 3). In addition, the CeO2-ZrO2 support exhibits a Raman band at around 307cm−1, which is attributed to the displacement of oxygen atoms from their ideal fluorite lattice positions [53]. Another broad Raman band was observed at ∼600cm−1 for CeO2-ZrO2 support, which reveals the presence of oxygen vacancies (Ov) [54,55]. Owing to difference in the ionic radii of Ce4+-host and Zr4+-dopant, a distortion in the oxygen sublattice of ceria may be possible after the addition of Zr, leading to displacement of oxygen atoms form their positions, hence formation of oxygen vacancies in the CeO2-ZrO2 support. XPS analysis has been performed to understand the electronic properties of the elements present in the synthesized catalysts. Fig. 6 shows Au 4f XPS spectra of Au/CeO2 and Au/CeO2-ZrO2 catalysts. Both catalysts exhibit two major peaks at around ∼83.8 and 87.5eV, corresponding to Au 4f7/2 and Au 4f5/2 transitions, respectively [7]. Appearance of these peaks indicates the presence of metallic Au in the synthesized Au catalysts. Fig. 7 shows Ce 3d XPS spectra of CeO2, CeO2-ZrO2, Au/CeO2, and Au/CeO2-ZrO2 catalysts. As shown in Fig. 7, the Ce 3d spectra can be labeled as u and v, corresponding to the 3d3/2 and 3d5/2 contributions, respectively [56–58]. Peaks denoted by u/ and v/ indicate the Ce3+ ions, while those marked by v, u, v//, u//, v/// and u/// reveal the presence of Ce4+ ions in the synthesized samples. It is therefore clear that all samples contain both Ce4+ and Ce3+ ions, indicating the redox nature of the samples. The concentration of Ce3+ in the samples was estimated from the ratio of integrated Ce3+ peaks (u/ and v/) to the total Ce as follows Concentration of Ce 3+ ( % ) = [ I ( Ce 3+ ) ] [ I ( Ce 3+ ) +I ( Ce 4+ ) ] × 100 The obtained results are shown in Fig. 8 . It was found that CeO2-ZrO2 sample exhibits large amounts of Ce3+ ions compared to CeO2. The XRD studies revealed that the incorporation of Zr into the CeO2 lattice leads to a lattice contraction due to the smaller size of guest Zr4+ (0.084nm) compared with that of Ce4+ (0.097nm) (Fig. 3 and Table 1). As a result, the transformation of Ce4+ (0.097nm) to Ce3+ (0.114nm) occurs to compensate the lattice contraction, hence higher concentration of Ce3+ ions in the CeO2-ZrO2 sample [59,60]. Interestingly, the addition of gold to CeO2 supports leads to an enhancement in the concentration of Ce3+ ions. This observation indicates that the Au addition has a favorable effect on the redox properties of CeO2 supports. Among those, the Au/CeO2-ZrO2 sample exhibits more number of Ce3+ ions, indicating the existence of strong interactions between the Au and the CeO2-ZrO2 support [61–63]. The O 1s spectra of the catalysts show two bands, which reveal the existence of different oxygen species in the synthesized samples (Fig. S4 of the Supplementary material). The observed band at around 529–530eV indicates the lattice oxygen, whereas the peak in the region of 531–533eV reveals the adsorbed hydroxyl and carbonate species [64]. The obtained Zr 3d XPS spectra show two major bands at around 184.8 (3d3/2) and 181.9eV (3d5/2), which indicate the presence of Zr4+ ions in the synthesised catalysts (Fig. S5 of the Supplementary material). 3.2 Catalytic activity studies The catalytic performance of Au/CeO2 and Au/CeO2-ZrO2 nanocatalysts, along with nanoscale CeO2 and CeO2-ZrO2 supports was investigated for oxidative coupling of benzylamine and the results are presented in Table 2 . The reaction was performed at 403K for 6h with O2 as a green oxidant under solvent- and base-free conditions. It was found that the nanoscale CeO2 and CeO2-ZrO2 supports exhibit reasonable catalytic efficiency in the benzylamine oxidation with ∼39 and 51% amine conversions, respectively. This observation indicates that the addition of Zr to CeO2 has shown a significant effect in improving the benzylamine conversion. Remarkably, higher conversions of benzylamine were found for the Au catalysts (Table 2), which indicate the catalytic role of Au nanoparticles in the oxidation of benzylamine. The achieved benzylamine conversions for Au/CeO2 and Au/CeO2-ZrO2 nanocatalysts were ∼78 and 95%, respectively. It was clear that Au/CeO2-ZrO2 nanocatalyst exhibits a higher efficiency in the oxidation of benzylamine compared with that of Au/CeO2 nanocatalyst. The estimated TOF values also evidence higher catalytic performance of Au/CeO2-ZrO2 catalyst compared to all tested catalysts (Table 2). Interestingly, almost ∼99.5% selectivity toward N-benzylbenzaldimine product was found for all catalysts (Table 2). This result highlights the significance of present work in the selective oxidation reactions. As shown in Scheme 1 , the Au catalyst initiates the oxidation of benzylamine through the formation of coordination with the non-bonded electron pair of nitrogen of amine, leading to the formation of imine intermediate [65–68]. The further oxidative dehydrogenation of imine intermediate yields the benzonitrile product. In contrast, the condensation between the imine intermediate and benzylamine gives the N-benzylbenzaldimine product. It is therefore obvious from Table 2 that nanoscale ceria based supports and corresponding Au nanocatalysts selectively favor the formation of N-benzylbenzaldimine product in the aerobic oxidation of benzylamine under solvent-free conditions. The performance of Au nanocatalysts can be attributed to several factors, such as the properties of support, the size of Au particles, and the interaction between the Au and support [7,17,32]. It has been shown that nanosized ceria plays a beneficial role in the Au-catalyzed oxidation reactions, such as CO oxidation and oxidation of alcohols compared with the bulk ceria [34,69]. This is due to the combined catalytically favorable properties of Au nanoparticles and nanosized ceria supports, which can ultimately lead to enhanced catalytic efficiency of nanoscale Au/CeO2 catalysts. In the present study, both CeO2 and CeO2-ZrO2 supports are found to be in nanoscale range (Fig. 1 and Table 1). As a result, reasonable amine conversions were found for these supports (Table 2). Among those, the CeO2-ZrO2 support shows much enhanced properties, such as smaller particle size, higher BET surface area, large amounts of oxygen vacancies and higher numbers of Ce3+ ions compared with that of pure CeO2 (Table 1, Figs. 1, 5 and 8). Hence, a strong interaction between the Au and CeO2-ZrO2 support can be expected, which could lead to improved catalytic performance of nanostructured Au/CeO2-ZrO2 catalyst. As expected, the Au/CeO2-ZrO2 catalyst exhibits smaller Au nanoparticles, higher Au amount, and large amounts of Ce3+ ions compared with that of Au/CeO2 catalyst (Table 1 and Fig. 8). Therefore, the Au/CeO2-ZrO2 catalyst showed a higher catalytic performance in the benzylamine oxidation (Table 2). In order to understand the effect of temperature on benzylamine conversion and product selectivity, the reaction was performed at different temperature intervals in the range of 353–413K using Au/CeO2-ZrO2 catalyst (Fig. 9 ). The conversion of benzylamine was found to be 11% at 353K. Afterwards, the conversion of benzylamine increases with increasing the temperature: approximately 23, 47, 65, 82, 95, and 99% of benzylamine conversions were achieved at 363, 373, 383, 393, 403, and 413K of reaction temperatures, respectively. In contrast, the benzylamine conversion was found to be very low (∼3%) at room temperature. This observation indicates that the reaction temperature plays a pivotal role on the performance of the catalysts for the oxidation of benzylamine. Interestingly, there was no significant variation in the products selectivity with the temperature. The selectivity of N-benzylbenzaldimine and benzonitrile products was found to ∼99.6–99.9 and 0.4–0.1%, respectively, at all reaction temperatures. Subsequently, time-dependent experiments were carried out for the oxidation of benzylamine using Au/CeO2-ZrO2 catalyst at 413K (Fig. 10 ). As can be noted from Fig. 10, the conversion of benzylamine was considerably increased with increasing the reaction time. The achieved benzylamine conversions are ∼36, 51, 63, 77, 87, 99, and 99% for 1, 2, 3, 4, 5, 6, and 7h of reaction times, respectively. This observation suggests that 6h is the optimum reaction time for achieving maximum benzylamine conversion when using Au/CeO2-ZrO2 catalyst. On the other hand, no considerable variation in the N-benzylbenzaldimine product selectivity (∼99.6–99.9%) was found with the reaction time. The obtained results clearly indicate that the selectivity of N-benzylbenzaldimine product in the benzylamine oxidation is independent of the reaction temperature and time when using Au/CeO2-ZrO2 catalyst. The applicability of Au/CeO2-ZrO2 catalyst was also studied for the solvent-free oxidation of various substituted benzylamines using molecular oxygen. The obtained results are presented in Table 3 . It was found that the Au/CeO2-ZrO2 catalyst exhibits a significant catalytic efficiency in converting the substituted benzylamines into the corresponding N-benzylbenzaldimines as well. Nearly 96–99% of conversions were found for all substituted benzylamines with the Au/CeO2-ZrO2 catalyst. This observation indicated that the efficiency of Au/CeO2-ZrO2 catalyst is independent on the nature of the substituents present on the phenyl ring of benzylamine [70]. On the other hand, the position of the substituents shows a huge effect in the amine conversion. For example, low amine conversion was found for ortho-methyl substituted benzylamine (86%) compared with para-methyl substituted benzylamine (98%) for 6h of reaction time. Similar results are also found in the case of meta- and para-methoxy substituted benzylamines. These results indicate that the reaction is sensitive toward the steric hindrance of the substituents. Despite the nature of the substituent and its position on the benzylamine, almost 99.6–99.8% selectivity toward the imine product was achieved with the Au/CeO2-ZrO2 catalyst. The oxidation of secondary benzylamines was also performed using the Au/CeO2-ZrO2 catalyst with O2 as the oxidant under solvent- and base-free conditions (Table 4 ). It was obvious that the oxidation of secondary amine to yield the desired imine product only involves a single step (Fig. S6 of the Supplementary material). As can be noted from Table 4, the conversion of amine was found to be dependent on the group attached to N atom of the benzylamine. For example, low amine conversion was observed for N-phenylbenzylamine (78%), followed by 1,2,3,4-tetrahydroisoquinoline (89%) and dibenzylamine (95%). On the other hand, almost 100% imine selectivity was found, which is attributed to lack of hydrogen atom attached to N atom of the benzylamine to give the nitrile product. It is therefore suggested that Au/CeO2-ZrO2 catalyst can be efficiently used for the oxidation of substituted benzylamines and secondary benzylamines under eco-friendly conditions. 4 Conclusions In summary, nanoscale CeO2 and CeO2-ZrO2 oxides are employed as efficient supports for developing promising Au nanocatalysts. The catalytic efficiency of these nanoscale supports and nano-Au catalysts are studied for oxidative coupling of benzylamines under eco-friendly reaction conditions. It was found that Au/CeO2-ZrO2 catalyst exhibits a higher catalytic performance in oxidative coupling of benzylamine (∼95%) compared to Au/CeO2 (∼78%), CeO2-ZrO2 (∼51%), and CeO2 (∼39%) samples. The Au/CeO2-ZrO2 catalyst can be also efficiently used for the oxidative coupling of various substituted benzylamines and secondary benzylamines, and moderate to good product yields are obtained. The high catalytic performance of Au/CeO2-ZrO2 catalyst is attributed to the presence of smaller Au particles (2.1nm) and improved surface-defect properties of nanoscale CeO2-ZrO2 support. In addition the reaction temperature has been found to show a significant effect on the performance of Au/CeO2-ZrO2 catalyst for the benzylamine oxidation. Almost 99.6–99.9% selectivity toward N-benzylbenzaldimines was found irrespective of the catalysts used and the reaction conditions employed. We strongly believe that the significance of this novel work, along with eco-friendly reaction conditions would provide tremendous opportunities for the advancement of the selective oxidation catalysis. Acknowledgements P.S. thanks Australian Government, Department of Education for an Endeavor Research Award. B.M., A.R., and B.G. thank the Council of Scientific and Industrial Research (CSIR), New Delhi for research fellowships. Appendix A Supplementary data Supplementary data associated with this article can be found, in the online version, at http://dx.doi.org/10.1016/j.molcata.2015.11.019. Appendix A Supplementary data The following are Supplementary data to this article: References [1] E.O. Jardim S. Rico-Francés F. Coloma E.V. Ramos-Fernandez J. Silvestre-Albero A.S. Escribano Appl. Catal. A: Gen. 487 2014 119 129 [2] J. Yu G. Wu G. Lu D. Mao Y. Guo RSC Adv. 4 2014 16985 16991 [3] G.J. Hutchings Dalton Trans. 41 2008 5523 5536 [4] M. Haruta N. Yamada T. Kobayashi S. Iijima J. Catal. 115 1989 301 309 [5] A. Corma H. Garcia Chem. Soc. Rev. 37 2008 2096 2126 [6] J. Feng C. Ma P.J. Miedziak J.K. Edwards G.L. Brett D. Li Y. Du D.J. Morgan G.J. Hutchings Dalton Trans. 42 2013 14498 14508 [7] P. Sudarsanam P.R. Selvakannan S.K. Soni S.K. Bhargava B.M. Reddy RSC Adv. 4 2014 43460 43469 [8] P. Lakshmanan L. Delannoy C. Louis N. Biona J.M. Tatibouet Catal. Sci. Technol. 3 2013 2918 2925 [9] J.K. Edwards G.J. Hutchings Angew. Chem. Int. Ed. 47 2008 9192 9198 [10] G.L. Brett Q. He C. Hammond P.J. Miedziak N. Dimitratos M. Sankar A.A. Herzing M. Conte J.A. Lopez-Sanchez C.J. Kiely D.W. Knight S.H. Taylor G.J. Hutchings Angew. Chem. Int. Ed. 50 2011 10136 10139 [11] C. Hammond J.A. Lopez-Sanchez M.H. Ab Rahim N. Dimitratos R.L. Jenkins A.F. Carley Q. He C.J. Kiely D.W. Knight G.J. Hutchings Dalton Trans. 40 2011 3927 3937 [12] S.S. Liu K.Q. Sun B.Q. Xu ACS Catal. 4 2014 2226 2230 [13] X. Wan C. Zhou J. Chen W. Deng Q. Zhang Y. Yang Y. Wang ACS Catal. 4 2014 2175 2185 [14] O. Casanova S. Iborra A. Corma ChemSusChem 2 2009 1138 1144 [15] Y. Fang Y. Chen X. Li X. Zhou J. Li W. Tang J. Huang J. Jin J. Ma J. Mol. Catal. A: Chem. 392 2014 16 21 [16] C.M. Opriş O.D. Pavel A. Moragues J. El Haskourib D. Beltran P. Amoros M.D. Marcos L.E. Stoflea V.I. Parvulescu Catal. Sci. Technol. 4 2014 4340 4355 [17] A. Grirrane A. Corma H. Garcia J. Catal. 264 2009 138 144 [18] P. Sudarsanam A. Rangaswamy B.M. Reddy RSC Adv. 4 2014 46378 46382 [19] J. Dai J. Yang X. Wang L. Zhang Y. Li Appl. Surf. Sci. 349 2015 343 352 [20] B. Govinda Rao P. Sudarsanam A. Rangaswamy B.M. Reddy Catal. Lett. 145 2015 1436 1445 [21] H. Guo M. Kemell A.A. Hunaiti S. Rautiainen M. Leskela T. Repo Catal. Commun. 12 2011 1260 1264 [22] S. Furukawa Y. Ohno T. Shishido K. Teramura T. Tanaka ACS Catal. 1 2011 1150 1153 [23] B. Zhu M. Lazar B.G. Trewyna R.J. Angelici J. Catal. 260 2008 1 6 [24] W. Cui H. Zhu M. Jia W. Ao Y. Zhang B. Zhaorigetu React. Kinet. Mech. Catal. 109 2013 551 562 [25] C.K.P. Neeli S. Ganji V.S.P. Ganjala S.R.R. Kamaraju D.R. Burri RSC Adv. 4 2014 14128 14135 [26] N. Sasirekha P. Sangeetha Y.-W. Chen J. Phys. Chem. C 118 2014 15226 15233 [27] F. Romero-Sarria J.J. Plata O.H. Laguna A.M. Marquez M.A. Centeno J. FdezSanz J.A. Odriozola RSC Adv. 4 2014 13145 13152 [28] V.P. Santos S.A.C. Carabineiro J.J.W. Bakker O.S.G.P. Soares X. Chen M.F.R. Pereira J.J.M. Orfao J.L. Figueiredo J. Gascon F. Kapteijn J. Catal. 309 2014 58 65 [29] S.A. Jimenez-Lam M.G. Cardenas-Galindo B.E. Handy S.A. Gomez G.A. Fuentes J.C. Fierro-Gonzalez J. Phys. Chem. C 115 2011 23519 23526 [30] A.M. Venezia G. Pantaleo A. Longo G. Di Carlo M.P. Casaletto F.L. Liotta G. Deganello J. Phys. Chem. B 109 2005 2821 2827 [31] P. Sudarsanam B. Mallesham P.S. Reddy D. Großmann W. Grünert B.M. Reddy Appl. Catal. B: Environ. 144 2014 900 908 [32] O. Casanova S. Iborra A. Corma J. Catal. 265 2009 109 116 [33] M. Wang F. Wang J. Ma M. Li Z. Zhang Y. Wang X. Zhang J. Xu Chem. Commun. 50 2014 292 294 [34] S. Carrettin P. Concepcin A. Corma J.M.L. Nieto V.F. Puntes Angew. Chem. Int. Ed. 43 2004 2538 2540 [35] P. Sudarsanam K. Kuntaiah B.M. Reddy New J. Chem. 38 2014 5991 6001 [36] C. Santra S. Rahman S. Bojja O.O. James D. Sen S. Maity A.K. Mohanty S. Mazumderd B. Chowdhury Catal. Sci. Technol. 3 2013 360 370 [37] C. Pojanavaraphan A. Luengnaruemitchai E. Gulari Appl. Catal. A: Gen. 456 2013 135 143 [38] L. Ilieva G. Pantaleo I. Ivanov R. Zanella A.M. Venezia D. Andreeva Int. J. Hydrog. Energy 34 2009 6505 6515 [39] A. Longo L.F. Liotta G. Pantaleo F. Giannici A.M. Venezia A. Martorana J. Phys. Chem. C 116 2012 2960 2966 [40] T. Vinodkumar B.G. Rao B.M. Reddy Catal. Today 253 2015 57 64 [41] L. Katta P. Sudarsanam G. Thrimurthulu B.M. Reddy Appl. Catal. B: Environ. 101 2010 101 108 [42] Z. Hai N.E.L. Kolli J. Chen H. Remita New J. Chem. 38 2014 5279 5286 [43] Z. Chen Q. Gao Appl. Catal. B: Environ. 84 2008 790 796 [44] P. Sudarsanam B. Mallesham D.N. Durgasri B.M. Reddy J. Ind. Eng. Chem. 20 2014 3115 3121 [45] L. Katta P. Sudarsanam B. Mallesham B.M. Reddy Catal. Sci. Technol. 2 2012 995 1004 [46] K. Kuntaiah P. Sudarsanam B.M. Reddy A. Vinu RSC Adv. 3 2013 7953 7962 [47] X. Yao C. Tang Z. Ji Y. Dai Y. Cao F. Gao L. Dong Y. Chen Catal. Sci. Technol. 3 2013 688 698 [48] P. Lakshmanan P.P. Upare N.-T. Le Y.K. Hwang D.W. Hwang U.-H. Lee H.R. Kim J.-S. Chang Appl. Catal. A: Gen. 468 2013 260 268 [49] J. Lee Y.G. Hur M.-S. Kima K.-Y. Lee J. Mol. Catal. A: Chem. 399 2015 48 52 [50] Q. Xu W. Lei X. Li X. Qi J. Yu G. Liu J. Wang P. Zhang Environ. Sci. Technol. 48 2014 9702 9708 [51] B. Mallesham P. Sudarsanam G. Raju B.M. Reddy Green Chem. 15 2013 478 489 [52] X. Jiang J. Hua H. Deng Z. Wu J. Mol. Catal. A: Chem. 383–384 2014 188 193 [53] J. Fan X. Wu X. Wu Q. Liang R. Ran D. Weng Appl. Catal. B: Environ. 81 2008 38 48 [54] P. Bharali P. Saikia B.M. Reddy Catal. Sci. Technol. 2 2012 931 933 [55] H.F. Wang X.Q. Gong Y.L. Guo Y. Guo G.Z. Lu P. Hu J. Phys. Chem. C 113 2009 10229 10232 [56] S. Putla M.H. Amin B.M. Reddy A. Nafady K.A. Al Farhan S.K. Bhargava ACS Appl. Mater. Interfaces 7 2015 16525 16535 [57] D. Shang Q. Zhong W. Cai J. Mol. Catal. A: Chem. 399 2015 18 24 [58] P. Sudarsanam B. Hillary D.K. Deepa M.H. Amin B. Mallesham B.M. Reddy S.K. Bhargava Catal. Sci. Technol. 5 2015 3496 3500 [59] T. Taniguchi T. Watanebe S. Ichinohe M. Yoshimura K. Katsumata K. Okada N. Matsushita Nanoscale 2 2010 1426 1428 [60] X. Yao C. Tang Z. Ji Y. Dai Y. Cao F. Gao L. Dong Y. Chen Catal. Sci. Technol. 3 2013 688 698 [61] X.-S. Huang H. Sun L.-C. Wang Y.-M. Liu K.-N. Fan Y. Cao Appl. Catal. B: Environ. 90 2009 224 232 [62] Y. Liu B. Liu Q. Wang Y. Liu C. Li W. Hu P. Jing W. Zhao J. Zhang RSC Adv. 4 2014 5975 5985 [63] Y. Wei Z. Zhao X. Yu B. Jin J. Liu C. Xu A. Duan G. Jianga S. Ma Catal. Sci. Technol. 3 2013 2958 2970 [64] M.T. Lea T.T. Nguyen P.T.M. Phamb E. Bruneel I.V. Driessche Appl. Catal. A: Gen. 480 2014 34 41 [65] B. Chen L. Wang S. Gao ACS Catal. 5 2015 5851 5876 [66] M.T. Schümperli C. Hammond I. Hermans ACS Catal. 2 2012 1108 1117 [67] S.M. Landge V. Atanassova M. Thimmaiah B. Torok Tetrahedron Lett. 48 2007 5161 5164 [68] S.S. Kim S.S. Thakur Bull. Korean Chem. Soc. 26 2005 1600 1602 [69] A. Abad P. Concepcin A. Corma H. Garca Angew. Chem. Int. Ed. 44 2005 4066 4069 [70] S. Zhao C. Liu Y. Guo J.C. Xiao Q.Y. Chen J. Org. Chem. 79 2014 8926 8931",
      "scopus-id": "84949591359",
      "coredata": {
        "eid": "1-s2.0-S1381116915301618",
        "dc:description": "Designing Au nanocatalysts supported on nanosized metal oxides has drawn much attention due to remarkable nanoscale influenced metal-support interactions and their favorable role in heterogeneous catalysis. This work reports development of Au nanocatalysts dispersed on nanosized CeO2 and CeO2-ZrO2 supports for solvent- and base-free oxidative coupling of benzylamines into N-benzylbenzaldimines using O2 as a green oxidant. The physicochemical characterization of nanocatalysts has been undertaken using HRTEM, UV–vis DRS, XRD, Raman, BET, TG-DTA, AAS, and XPS techniques. HRTEM images reveal the formation of nanosized CeO2 and CeO2-ZrO2 supports with an average diameter of ∼10 and 7nm, respectively. HRTEM images also indicated that Au/CeO2-ZrO2 catalyst has smaller Au nanoparticles (∼2.1nm) compared with that of Au/CeO2 catalyst (∼3.7nm). Raman and XPS studies showed that the addition of ZrO2 to CeO2 leads to abundant oxygen vacancies and higher concentration of Ce3+, respectively. The Au/CeO2-ZrO2 catalyst exhibited a higher efficiency in benzylamine conversion (∼95%) followed by Au/CeO2 (∼78%), CeO2-ZrO2 (∼51%), and CeO2 (∼39%). The Au/CeO2-ZrO2 catalyst was also found to effective for oxidative coupling of various benzylamines, and moderate to good product yields were obtained. The presence of smaller Au particles (2.1nm) and improved surface-defect properties of nanoscale CeO2-ZrO2 support are found to be key factors for high performance of Au/CeO2-ZrO2 catalyst. Additionally, the reaction temperature is one of the important factors for the performance of catalysts. Remarkably, ∼99.6–99.9% selectivity for N-benzylbenzaldimines was found in the amine oxidation, which highlights the significance of present work in the selective oxidation catalysis.",
        "openArchiveArticle": "false",
        "prism:coverDate": "2016-02-29",
        "openaccessUserLicense": null,
        "prism:aggregationType": "Journal",
        "prism:url": "https://api.elsevier.com/content/article/pii/S1381116915301618",
        "dc:creator": [
          {
            "@_fa": "true",
            "$": "Sudarsanam, Putla"
          },
          {
            "@_fa": "true",
            "$": "Mallesham, Baithy"
          },
          {
            "@_fa": "true",
            "$": "Rangaswamy, Agolu"
          },
          {
            "@_fa": "true",
            "$": "Rao, Bolla Govinda"
          },
          {
            "@_fa": "true",
            "$": "Bhargava, Suresh K."
          },
          {
            "@_fa": "true",
            "$": "Reddy, Benjaram M."
          }
        ],
        "link": [
          {
            "@_fa": "true",
            "@rel": "self",
            "@href": "https://api.elsevier.com/content/article/pii/S1381116915301618"
          },
          {
            "@_fa": "true",
            "@rel": "scidir",
            "@href": "https://www.sciencedirect.com/science/article/pii/S1381116915301618"
          }
        ],
        "dc:format": "application/json",
        "openaccessType": null,
        "pii": "S1381-1169(15)30161-8",
        "prism:volume": "412",
        "prism:publisher": "Elsevier B.V.",
        "dc:title": "Promising nanostructured gold/metal oxide catalysts for oxidative coupling of benzylamines under eco-friendly conditions",
        "prism:copyright": "Copyright © 2015 Elsevier B.V. All rights reserved.",
        "openaccess": "0",
        "prism:issn": "13811169",
        "dcterms:subject": [
          {
            "@_fa": "true",
            "$": "Nano-gold"
          },
          {
            "@_fa": "true",
            "$": "Nanoscale ceria"
          },
          {
            "@_fa": "true",
            "$": "Zirconium"
          },
          {
            "@_fa": "true",
            "$": "Characterization"
          },
          {
            "@_fa": "true",
            "$": "Eco-friendly benzylamine oxidation"
          }
        ],
        "openaccessArticle": "false",
        "prism:publicationName": "Journal of Molecular Catalysis A: Chemical",
        "openaccessSponsorType": null,
        "prism:pageRange": "47-55",
        "prism:endingPage": "55",
        "pubType": "fla",
        "prism:coverDisplayDate": "February 2016",
        "prism:doi": "10.1016/j.molcata.2015.11.019",
        "prism:startingPage": "47",
        "dc:identifier": "doi:10.1016/j.molcata.2015.11.019",
        "openaccessSponsorName": null
      },
      "objects": {
        "object": [
          {
            "@category": "thumbnail",
            "@height": "88",
            "@width": "219",
            "@_fa": "true",
            "$": "https://api.elsevier.com/content/object/eid/1-s2.0-S1381116915301618-fx1.sml?httpAccept=%2A%2F%2A",
            "@multimediatype": "GIF image file",
            "@type": "IMAGE-THUMBNAIL",
            "@size": "5325",
            "@ref": "fx1",
            "@mimetype": "image/gif"
          },
          {
            "@category": "thumbnail",
            "@height": "88",
            "@width": "219",
            "@_fa": "true",
            "$": "https://api.elsevier.com/content/object/eid/1-s2.0-S1381116915301618-fx10.sml?httpAccept=%2A%2F%2A",
            "@multimediatype": "GIF image file",
            "@type": "IMAGE-THUMBNAIL",
            "@size": "2550",
            "@ref": "fx10",
            "@mimetype": "image/gif"
          },
          {
            "@category": "thumbnail",
            "@height": "88",
            "@width": "219",
            "@_fa": "true",
            "$": "https://api.elsevier.com/content/object/eid/1-s2.0-S1381116915301618-fx11.sml?httpAccept=%2A%2F%2A",
            "@multimediatype": "GIF image file",
            "@type": "IMAGE-THUMBNAIL",
            "@size": "2606",
            "@ref": "fx11",
            "@mimetype": "image/gif"
          },
          {
            "@category": "thumbnail",
            "@height": "88",
            "@width": "219",
            "@_fa": "true",
            "$": "https://api.elsevier.com/content/object/eid/1-s2.0-S1381116915301618-fx12.sml?httpAccept=%2A%2F%2A",
            "@multimediatype": "GIF image file",
            "@type": "IMAGE-THUMBNAIL",
            "@size": "2712",
            "@ref": "fx12",
            "@mimetype": "image/gif"
          },
          {
            "@category": "thumbnail",
            "@height": "88",
            "@width": "219",
            "@_fa": "true",
            "$": "https://api.elsevier.com/content/object/eid/1-s2.0-S1381116915301618-fx2.sml?httpAccept=%2A%2F%2A",
            "@multimediatype": "GIF image file",
            "@type": "IMAGE-THUMBNAIL",
            "@size": "2820",
            "@ref": "fx2",
            "@mimetype": "image/gif"
          },
          {
            "@category": "thumbnail",
            "@height": "88",
            "@width": "219",
            "@_fa": "true",
            "$": "https://api.elsevier.com/content/object/eid/1-s2.0-S1381116915301618-fx3.sml?httpAccept=%2A%2F%2A",
            "@multimediatype": "GIF image file",
            "@type": "IMAGE-THUMBNAIL",
            "@size": "3276",
            "@ref": "fx3",
            "@mimetype": "image/gif"
          },
          {
            "@category": "thumbnail",
            "@height": "88",
            "@width": "219",
            "@_fa": "true",
            "$": "https://api.elsevier.com/content/object/eid/1-s2.0-S1381116915301618-fx4.sml?httpAccept=%2A%2F%2A",
            "@multimediatype": "GIF image file",
            "@type": "IMAGE-THUMBNAIL",
            "@size": "3276",
            "@ref": "fx4",
            "@mimetype": "image/gif"
          },
          {
            "@category": "thumbnail",
            "@height": "88",
            "@width": "219",
            "@_fa": "true",
            "$": "https://api.elsevier.com/content/object/eid/1-s2.0-S1381116915301618-fx5.sml?httpAccept=%2A%2F%2A",
            "@multimediatype": "GIF image file",
            "@type": "IMAGE-THUMBNAIL",
            "@size": "3077",
            "@ref": "fx5",
            "@mimetype": "image/gif"
          },
          {
            "@category": "thumbnail",
            "@height": "88",
            "@width": "219",
            "@_fa": "true",
            "$": "https://api.elsevier.com/content/object/eid/1-s2.0-S1381116915301618-fx6.sml?httpAccept=%2A%2F%2A",
            "@multimediatype": "GIF image file",
            "@type": "IMAGE-THUMBNAIL",
            "@size": "3410",
            "@ref": "fx6",
            "@mimetype": "image/gif"
          },
          {
            "@category": "thumbnail",
            "@height": "88",
            "@width": "219",
            "@_fa": "true",
            "$": "https://api.elsevier.com/content/object/eid/1-s2.0-S1381116915301618-fx7.sml?httpAccept=%2A%2F%2A",
            "@multimediatype": "GIF image file",
            "@type": "IMAGE-THUMBNAIL",
            "@size": "3310",
            "@ref": "fx7",
            "@mimetype": "image/gif"
          },
          {
            "@category": "thumbnail",
            "@height": "88",
            "@width": "219",
            "@_fa": "true",
            "$": "https://api.elsevier.com/content/object/eid/1-s2.0-S1381116915301618-fx8.sml?httpAccept=%2A%2F%2A",
            "@multimediatype": "GIF image file",
            "@type": "IMAGE-THUMBNAIL",
            "@size": "3241",
            "@ref": "fx8",
            "@mimetype": "image/gif"
          },
          {
            "@category": "thumbnail",
            "@height": "88",
            "@width": "219",
            "@_fa": "true",
            "$": "https://api.elsevier.com/content/object/eid/1-s2.0-S1381116915301618-fx9.sml?httpAccept=%2A%2F%2A",
            "@multimediatype": "GIF image file",
            "@type": "IMAGE-THUMBNAIL",
            "@size": "3500",
            "@ref": "fx9",
            "@mimetype": "image/gif"
          },
          {
            "@category": "thumbnail",
            "@height": "163",
            "@width": "107",
            "@_fa": "true",
            "$": "https://api.elsevier.com/content/object/eid/1-s2.0-S1381116915301618-gr1.sml?httpAccept=%2A%2F%2A",
            "@multimediatype": "GIF image file",
            "@type": "IMAGE-THUMBNAIL",
            "@size": "22508",
            "@ref": "gr1",
            "@mimetype": "image/gif"
          },
          {
            "@category": "thumbnail",
            "@height": "159",
            "@width": "219",
            "@_fa": "true",
            "$": "https://api.elsevier.com/content/object/eid/1-s2.0-S1381116915301618-gr10.sml?httpAccept=%2A%2F%2A",
            "@multimediatype": "GIF image file",
            "@type": "IMAGE-THUMBNAIL",
            "@size": "20434",
            "@ref": "gr10",
            "@mimetype": "image/gif"
          },
          {
            "@category": "thumbnail",
            "@height": "163",
            "@width": "100",
            "@_fa": "true",
            "$": "https://api.elsevier.com/content/object/eid/1-s2.0-S1381116915301618-gr2.sml?httpAccept=%2A%2F%2A",
            "@multimediatype": "GIF image file",
            "@type": "IMAGE-THUMBNAIL",
            "@size": "23922",
            "@ref": "gr2",
            "@mimetype": "image/gif"
          },
          {
            "@category": "thumbnail",
            "@height": "164",
            "@width": "216",
            "@_fa": "true",
            "$": "https://api.elsevier.com/content/object/eid/1-s2.0-S1381116915301618-gr3.sml?httpAccept=%2A%2F%2A",
            "@multimediatype": "GIF image file",
            "@type": "IMAGE-THUMBNAIL",
            "@size": "19220",
            "@ref": "gr3",
            "@mimetype": "image/gif"
          },
          {
            "@category": "thumbnail",
            "@height": "164",
            "@width": "166",
            "@_fa": "true",
            "$": "https://api.elsevier.com/content/object/eid/1-s2.0-S1381116915301618-gr4.sml?httpAccept=%2A%2F%2A",
            "@multimediatype": "GIF image file",
            "@type": "IMAGE-THUMBNAIL",
            "@size": "7118",
            "@ref": "gr4",
            "@mimetype": "image/gif"
          },
          {
            "@category": "thumbnail",
            "@height": "163",
            "@width": "128",
            "@_fa": "true",
            "$": "https://api.elsevier.com/content/object/eid/1-s2.0-S1381116915301618-gr5.sml?httpAccept=%2A%2F%2A",
            "@multimediatype": "GIF image file",
            "@type": "IMAGE-THUMBNAIL",
            "@size": "16452",
            "@ref": "gr5",
            "@mimetype": "image/gif"
          },
          {
            "@category": "thumbnail",
            "@height": "163",
            "@width": "184",
            "@_fa": "true",
            "$": "https://api.elsevier.com/content/object/eid/1-s2.0-S1381116915301618-gr6.sml?httpAccept=%2A%2F%2A",
            "@multimediatype": "GIF image file",
            "@type": "IMAGE-THUMBNAIL",
            "@size": "6737",
            "@ref": "gr6",
            "@mimetype": "image/gif"
          },
          {
            "@category": "thumbnail",
            "@height": "164",
            "@width": "180",
            "@_fa": "true",
            "$": "https://api.elsevier.com/content/object/eid/1-s2.0-S1381116915301618-gr7.sml?httpAccept=%2A%2F%2A",
            "@multimediatype": "GIF image file",
            "@type": "IMAGE-THUMBNAIL",
            "@size": "9635",
            "@ref": "gr7",
            "@mimetype": "image/gif"
          },
          {
            "@category": "thumbnail",
            "@height": "164",
            "@width": "186",
            "@_fa": "true",
            "$": "https://api.elsevier.com/content/object/eid/1-s2.0-S1381116915301618-gr8.sml?httpAccept=%2A%2F%2A",
            "@multimediatype": "GIF image file",
            "@type": "IMAGE-THUMBNAIL",
            "@size": "16303",
            "@ref": "gr8",
            "@mimetype": "image/gif"
          },
          {
            "@category": "thumbnail",
            "@height": "164",
            "@width": "214",
            "@_fa": "true",
            "$": "https://api.elsevier.com/content/object/eid/1-s2.0-S1381116915301618-gr9.sml?httpAccept=%2A%2F%2A",
            "@multimediatype": "GIF image file",
            "@type": "IMAGE-THUMBNAIL",
            "@size": "21660",
            "@ref": "gr9",
            "@mimetype": "image/gif"
          },
          {
            "@category": "thumbnail",
            "@height": "121",
            "@width": "219",
            "@_fa": "true",
            "$": "https://api.elsevier.com/content/object/eid/1-s2.0-S1381116915301618-sc1.sml?httpAccept=%2A%2F%2A",
            "@multimediatype": "GIF image file",
            "@type": "IMAGE-THUMBNAIL",
            "@size": "13287",
            "@ref": "sc1",
            "@mimetype": "image/gif"
          },
          {
            "@category": "standard",
            "@height": "200",
            "@width": "500",
            "@_fa": "true",
            "$": "https://api.elsevier.com/content/object/eid/1-s2.0-S1381116915301618-fx1.jpg?httpAccept=%2A%2F%2A",
            "@multimediatype": "JPEG image file",
            "@type": "IMAGE-DOWNSAMPLED",
            "@size": "20222",
            "@ref": "fx1",
            "@mimetype": "image/jpeg"
          },
          {
            "@category": "standard",
            "@height": "200",
            "@width": "500",
            "@_fa": "true",
            "$": "https://api.elsevier.com/content/object/eid/1-s2.0-S1381116915301618-fx10.jpg?httpAccept=%2A%2F%2A",
            "@multimediatype": "JPEG image file",
            "@type": "IMAGE-DOWNSAMPLED",
            "@size": "7236",
            "@ref": "fx10",
            "@mimetype": "image/jpeg"
          },
          {
            "@category": "standard",
            "@height": "200",
            "@width": "500",
            "@_fa": "true",
            "$": "https://api.elsevier.com/content/object/eid/1-s2.0-S1381116915301618-fx11.jpg?httpAccept=%2A%2F%2A",
            "@multimediatype": "JPEG image file",
            "@type": "IMAGE-DOWNSAMPLED",
            "@size": "7298",
            "@ref": "fx11",
            "@mimetype": "image/jpeg"
          },
          {
            "@category": "standard",
            "@height": "200",
            "@width": "500",
            "@_fa": "true",
            "$": "https://api.elsevier.com/content/object/eid/1-s2.0-S1381116915301618-fx12.jpg?httpAccept=%2A%2F%2A",
            "@multimediatype": "JPEG image file",
            "@type": "IMAGE-DOWNSAMPLED",
            "@size": "13058",
            "@ref": "fx12",
            "@mimetype": "image/jpeg"
          },
          {
            "@category": "standard",
            "@height": "200",
            "@width": "500",
            "@_fa": "true",
            "$": "https://api.elsevier.com/content/object/eid/1-s2.0-S1381116915301618-fx2.jpg?httpAccept=%2A%2F%2A",
            "@multimediatype": "JPEG image file",
            "@type": "IMAGE-DOWNSAMPLED",
            "@size": "11360",
            "@ref": "fx2",
            "@mimetype": "image/jpeg"
          },
          {
            "@category": "standard",
            "@height": "200",
            "@width": "500",
            "@_fa": "true",
            "$": "https://api.elsevier.com/content/object/eid/1-s2.0-S1381116915301618-fx3.jpg?httpAccept=%2A%2F%2A",
            "@multimediatype": "JPEG image file",
            "@type": "IMAGE-DOWNSAMPLED",
            "@size": "8885",
            "@ref": "fx3",
            "@mimetype": "image/jpeg"
          },
          {
            "@category": "standard",
            "@height": "200",
            "@width": "500",
            "@_fa": "true",
            "$": "https://api.elsevier.com/content/object/eid/1-s2.0-S1381116915301618-fx4.jpg?httpAccept=%2A%2F%2A",
            "@multimediatype": "JPEG image file",
            "@type": "IMAGE-DOWNSAMPLED",
            "@size": "9239",
            "@ref": "fx4",
            "@mimetype": "image/jpeg"
          },
          {
            "@category": "standard",
            "@height": "200",
            "@width": "500",
            "@_fa": "true",
            "$": "https://api.elsevier.com/content/object/eid/1-s2.0-S1381116915301618-fx5.jpg?httpAccept=%2A%2F%2A",
            "@multimediatype": "JPEG image file",
            "@type": "IMAGE-DOWNSAMPLED",
            "@size": "8700",
            "@ref": "fx5",
            "@mimetype": "image/jpeg"
          },
          {
            "@category": "standard",
            "@height": "200",
            "@width": "500",
            "@_fa": "true",
            "$": "https://api.elsevier.com/content/object/eid/1-s2.0-S1381116915301618-fx6.jpg?httpAccept=%2A%2F%2A",
            "@multimediatype": "JPEG image file",
            "@type": "IMAGE-DOWNSAMPLED",
            "@size": "9611",
            "@ref": "fx6",
            "@mimetype": "image/jpeg"
          },
          {
            "@category": "standard",
            "@height": "200",
            "@width": "500",
            "@_fa": "true",
            "$": "https://api.elsevier.com/content/object/eid/1-s2.0-S1381116915301618-fx7.jpg?httpAccept=%2A%2F%2A",
            "@multimediatype": "JPEG image file",
            "@type": "IMAGE-DOWNSAMPLED",
            "@size": "9378",
            "@ref": "fx7",
            "@mimetype": "image/jpeg"
          },
          {
            "@category": "standard",
            "@height": "200",
            "@width": "500",
            "@_fa": "true",
            "$": "https://api.elsevier.com/content/object/eid/1-s2.0-S1381116915301618-fx8.jpg?httpAccept=%2A%2F%2A",
            "@multimediatype": "JPEG image file",
            "@type": "IMAGE-DOWNSAMPLED",
            "@size": "9519",
            "@ref": "fx8",
            "@mimetype": "image/jpeg"
          },
          {
            "@category": "standard",
            "@height": "200",
            "@width": "500",
            "@_fa": "true",
            "$": "https://api.elsevier.com/content/object/eid/1-s2.0-S1381116915301618-fx9.jpg?httpAccept=%2A%2F%2A",
            "@multimediatype": "JPEG image file",
            "@type": "IMAGE-DOWNSAMPLED",
            "@size": "10080",
            "@ref": "fx9",
            "@mimetype": "image/jpeg"
          },
          {
            "@category": "standard",
            "@height": "574",
            "@width": "376",
            "@_fa": "true",
            "$": "https://api.elsevier.com/content/object/eid/1-s2.0-S1381116915301618-gr1.jpg?httpAccept=%2A%2F%2A",
            "@multimediatype": "JPEG image file",
            "@type": "IMAGE-DOWNSAMPLED",
            "@size": "120352",
            "@ref": "gr1",
            "@mimetype": "image/jpeg"
          },
          {
            "@category": "standard",
            "@height": "218",
            "@width": "301",
            "@_fa": "true",
            "$": "https://api.elsevier.com/content/object/eid/1-s2.0-S1381116915301618-gr10.jpg?httpAccept=%2A%2F%2A",
            "@multimediatype": "JPEG image file",
            "@type": "IMAGE-DOWNSAMPLED",
            "@size": "45604",
            "@ref": "gr10",
            "@mimetype": "image/jpeg"
          },
          {
            "@category": "standard",
            "@height": "612",
            "@width": "376",
            "@_fa": "true",
            "$": "https://api.elsevier.com/content/object/eid/1-s2.0-S1381116915301618-gr2.jpg?httpAccept=%2A%2F%2A",
            "@multimediatype": "JPEG image file",
            "@type": "IMAGE-DOWNSAMPLED",
            "@size": "138255",
            "@ref": "gr2",
            "@mimetype": "image/jpeg"
          },
          {
            "@category": "standard",
            "@height": "199",
            "@width": "263",
            "@_fa": "true",
            "$": "https://api.elsevier.com/content/object/eid/1-s2.0-S1381116915301618-gr3.jpg?httpAccept=%2A%2F%2A",
            "@multimediatype": "JPEG image file",
            "@type": "IMAGE-DOWNSAMPLED",
            "@size": "44525",
            "@ref": "gr3",
            "@mimetype": "image/jpeg"
          },
          {
            "@category": "standard",
            "@height": "297",
            "@width": "301",
            "@_fa": "true",
            "$": "https://api.elsevier.com/content/object/eid/1-s2.0-S1381116915301618-gr4.jpg?httpAccept=%2A%2F%2A",
            "@multimediatype": "JPEG image file",
            "@type": "IMAGE-DOWNSAMPLED",
            "@size": "26085",
            "@ref": "gr4",
            "@mimetype": "image/jpeg"
          },
          {
            "@category": "standard",
            "@height": "432",
            "@width": "339",
            "@_fa": "true",
            "$": "https://api.elsevier.com/content/object/eid/1-s2.0-S1381116915301618-gr5.jpg?httpAccept=%2A%2F%2A",
            "@multimediatype": "JPEG image file",
            "@type": "IMAGE-DOWNSAMPLED",
            "@size": "70444",
            "@ref": "gr5",
            "@mimetype": "image/jpeg"
          },
          {
            "@category": "standard",
            "@height": "201",
            "@width": "226",
            "@_fa": "true",
            "$": "https://api.elsevier.com/content/object/eid/1-s2.0-S1381116915301618-gr6.jpg?httpAccept=%2A%2F%2A",
            "@multimediatype": "JPEG image file",
            "@type": "IMAGE-DOWNSAMPLED",
            "@size": "13985",
            "@ref": "gr6",
            "@mimetype": "image/jpeg"
          },
          {
            "@category": "standard",
            "@height": "308",
            "@width": "339",
            "@_fa": "true",
            "$": "https://api.elsevier.com/content/object/eid/1-s2.0-S1381116915301618-gr7.jpg?httpAccept=%2A%2F%2A",
            "@multimediatype": "JPEG image file",
            "@type": "IMAGE-DOWNSAMPLED",
            "@size": "32547",
            "@ref": "gr7",
            "@mimetype": "image/jpeg"
          },
          {
            "@category": "standard",
            "@height": "215",
            "@width": "244",
            "@_fa": "true",
            "$": "https://api.elsevier.com/content/object/eid/1-s2.0-S1381116915301618-gr8.jpg?httpAccept=%2A%2F%2A",
            "@multimediatype": "JPEG image file",
            "@type": "IMAGE-DOWNSAMPLED",
            "@size": "36664",
            "@ref": "gr8",
            "@mimetype": "image/jpeg"
          },
          {
            "@category": "standard",
            "@height": "231",
            "@width": "301",
            "@_fa": "true",
            "$": "https://api.elsevier.com/content/object/eid/1-s2.0-S1381116915301618-gr9.jpg?httpAccept=%2A%2F%2A",
            "@multimediatype": "JPEG image file",
            "@type": "IMAGE-DOWNSAMPLED",
            "@size": "48521",
            "@ref": "gr9",
            "@mimetype": "image/jpeg"
          },
          {
            "@category": "standard",
            "@height": "259",
            "@width": "470",
            "@_fa": "true",
            "$": "https://api.elsevier.com/content/object/eid/1-s2.0-S1381116915301618-sc1.jpg?httpAccept=%2A%2F%2A",
            "@multimediatype": "JPEG image file",
            "@type": "IMAGE-DOWNSAMPLED",
            "@size": "46920",
            "@ref": "sc1",
            "@mimetype": "image/jpeg"
          },
          {
            "@category": "high",
            "@height": "886",
            "@width": "2213",
            "@_fa": "true",
            "$": "https://api.elsevier.com/content/object/eid/1-s2.0-S1381116915301618-fx1_lrg.jpg?httpAccept=%2A%2F%2A",
            "@multimediatype": "JPEG image file",
            "@type": "IMAGE-HIGH-RES",
            "@size": "145381",
            "@ref": "fx1",
            "@mimetype": "image/jpeg"
          },
          {
            "@category": "high",
            "@height": "886",
            "@width": "2213",
            "@_fa": "true",
            "$": "https://api.elsevier.com/content/object/eid/1-s2.0-S1381116915301618-fx10_lrg.jpg?httpAccept=%2A%2F%2A",
            "@multimediatype": "JPEG image file",
            "@type": "IMAGE-HIGH-RES",
            "@size": "59226",
            "@ref": "fx10",
            "@mimetype": "image/jpeg"
          },
          {
            "@category": "high",
            "@height": "886",
            "@width": "2213",
            "@_fa": "true",
            "$": "https://api.elsevier.com/content/object/eid/1-s2.0-S1381116915301618-fx11_lrg.jpg?httpAccept=%2A%2F%2A",
            "@multimediatype": "JPEG image file",
            "@type": "IMAGE-HIGH-RES",
            "@size": "60659",
            "@ref": "fx11",
            "@mimetype": "image/jpeg"
          },
          {
            "@category": "high",
            "@height": "886",
            "@width": "2213",
            "@_fa": "true",
            "$": "https://api.elsevier.com/content/object/eid/1-s2.0-S1381116915301618-fx12_lrg.jpg?httpAccept=%2A%2F%2A",
            "@multimediatype": "JPEG image file",
            "@type": "IMAGE-HIGH-RES",
            "@size": "97208",
            "@ref": "fx12",
            "@mimetype": "image/jpeg"
          },
          {
            "@category": "high",
            "@height": "886",
            "@width": "2213",
            "@_fa": "true",
            "$": "https://api.elsevier.com/content/object/eid/1-s2.0-S1381116915301618-fx2_lrg.jpg?httpAccept=%2A%2F%2A",
            "@multimediatype": "JPEG image file",
            "@type": "IMAGE-HIGH-RES",
            "@size": "80323",
            "@ref": "fx2",
            "@mimetype": "image/jpeg"
          },
          {
            "@category": "high",
            "@height": "886",
            "@width": "2213",
            "@_fa": "true",
            "$": "https://api.elsevier.com/content/object/eid/1-s2.0-S1381116915301618-fx3_lrg.jpg?httpAccept=%2A%2F%2A",
            "@multimediatype": "JPEG image file",
            "@type": "IMAGE-HIGH-RES",
            "@size": "74313",
            "@ref": "fx3",
            "@mimetype": "image/jpeg"
          },
          {
            "@category": "high",
            "@height": "886",
            "@width": "2213",
            "@_fa": "true",
            "$": "https://api.elsevier.com/content/object/eid/1-s2.0-S1381116915301618-fx4_lrg.jpg?httpAccept=%2A%2F%2A",
            "@multimediatype": "JPEG image file",
            "@type": "IMAGE-HIGH-RES",
            "@size": "74260",
            "@ref": "fx4",
            "@mimetype": "image/jpeg"
          },
          {
            "@category": "high",
            "@height": "886",
            "@width": "2213",
            "@_fa": "true",
            "$": "https://api.elsevier.com/content/object/eid/1-s2.0-S1381116915301618-fx5_lrg.jpg?httpAccept=%2A%2F%2A",
            "@multimediatype": "JPEG image file",
            "@type": "IMAGE-HIGH-RES",
            "@size": "71181",
            "@ref": "fx5",
            "@mimetype": "image/jpeg"
          },
          {
            "@category": "high",
            "@height": "886",
            "@width": "2213",
            "@_fa": "true",
            "$": "https://api.elsevier.com/content/object/eid/1-s2.0-S1381116915301618-fx6_lrg.jpg?httpAccept=%2A%2F%2A",
            "@multimediatype": "JPEG image file",
            "@type": "IMAGE-HIGH-RES",
            "@size": "78314",
            "@ref": "fx6",
            "@mimetype": "image/jpeg"
          },
          {
            "@category": "high",
            "@height": "886",
            "@width": "2213",
            "@_fa": "true",
            "$": "https://api.elsevier.com/content/object/eid/1-s2.0-S1381116915301618-fx7_lrg.jpg?httpAccept=%2A%2F%2A",
            "@multimediatype": "JPEG image file",
            "@type": "IMAGE-HIGH-RES",
            "@size": "73969",
            "@ref": "fx7",
            "@mimetype": "image/jpeg"
          },
          {
            "@category": "high",
            "@height": "886",
            "@width": "2213",
            "@_fa": "true",
            "$": "https://api.elsevier.com/content/object/eid/1-s2.0-S1381116915301618-fx8_lrg.jpg?httpAccept=%2A%2F%2A",
            "@multimediatype": "JPEG image file",
            "@type": "IMAGE-HIGH-RES",
            "@size": "74583",
            "@ref": "fx8",
            "@mimetype": "image/jpeg"
          },
          {
            "@category": "high",
            "@height": "886",
            "@width": "2213",
            "@_fa": "true",
            "$": "https://api.elsevier.com/content/object/eid/1-s2.0-S1381116915301618-fx9_lrg.jpg?httpAccept=%2A%2F%2A",
            "@multimediatype": "JPEG image file",
            "@type": "IMAGE-HIGH-RES",
            "@size": "79215",
            "@ref": "fx9",
            "@mimetype": "image/jpeg"
          },
          {
            "@category": "high",
            "@height": "1526",
            "@width": "1000",
            "@_fa": "true",
            "$": "https://api.elsevier.com/content/object/eid/1-s2.0-S1381116915301618-gr1_lrg.jpg?httpAccept=%2A%2F%2A",
            "@multimediatype": "JPEG image file",
            "@type": "IMAGE-HIGH-RES",
            "@size": "503471",
            "@ref": "gr1",
            "@mimetype": "image/jpeg"
          },
          {
            "@category": "high",
            "@height": "965",
            "@width": "1333",
            "@_fa": "true",
            "$": "https://api.elsevier.com/content/object/eid/1-s2.0-S1381116915301618-gr10_lrg.jpg?httpAccept=%2A%2F%2A",
            "@multimediatype": "JPEG image file",
            "@type": "IMAGE-HIGH-RES",
            "@size": "207469",
            "@ref": "gr10",
            "@mimetype": "image/jpeg"
          },
          {
            "@category": "high",
            "@height": "1628",
            "@width": "1000",
            "@_fa": "true",
            "$": "https://api.elsevier.com/content/object/eid/1-s2.0-S1381116915301618-gr2_lrg.jpg?httpAccept=%2A%2F%2A",
            "@multimediatype": "JPEG image file",
            "@type": "IMAGE-HIGH-RES",
            "@size": "584796",
            "@ref": "gr2",
            "@mimetype": "image/jpeg"
          },
          {
            "@category": "high",
            "@height": "884",
            "@width": "1167",
            "@_fa": "true",
            "$": "https://api.elsevier.com/content/object/eid/1-s2.0-S1381116915301618-gr3_lrg.jpg?httpAccept=%2A%2F%2A",
            "@multimediatype": "JPEG image file",
            "@type": "IMAGE-HIGH-RES",
            "@size": "193851",
            "@ref": "gr3",
            "@mimetype": "image/jpeg"
          },
          {
            "@category": "high",
            "@height": "1314",
            "@width": "1333",
            "@_fa": "true",
            "$": "https://api.elsevier.com/content/object/eid/1-s2.0-S1381116915301618-gr4_lrg.jpg?httpAccept=%2A%2F%2A",
            "@multimediatype": "JPEG image file",
            "@type": "IMAGE-HIGH-RES",
            "@size": "185009",
            "@ref": "gr4",
            "@mimetype": "image/jpeg"
          },
          {
            "@category": "high",
            "@height": "1910",
            "@width": "1500",
            "@_fa": "true",
            "$": "https://api.elsevier.com/content/object/eid/1-s2.0-S1381116915301618-gr5_lrg.jpg?httpAccept=%2A%2F%2A",
            "@multimediatype": "JPEG image file",
            "@type": "IMAGE-HIGH-RES",
            "@size": "337796",
            "@ref": "gr5",
            "@mimetype": "image/jpeg"
          },
          {
            "@category": "high",
            "@height": "888",
            "@width": "1000",
            "@_fa": "true",
            "$": "https://api.elsevier.com/content/object/eid/1-s2.0-S1381116915301618-gr6_lrg.jpg?httpAccept=%2A%2F%2A",
            "@multimediatype": "JPEG image file",
            "@type": "IMAGE-HIGH-RES",
            "@size": "100361",
            "@ref": "gr6",
            "@mimetype": "image/jpeg"
          },
          {
            "@category": "high",
            "@height": "1365",
            "@width": "1501",
            "@_fa": "true",
            "$": "https://api.elsevier.com/content/object/eid/1-s2.0-S1381116915301618-gr7_lrg.jpg?httpAccept=%2A%2F%2A",
            "@multimediatype": "JPEG image file",
            "@type": "IMAGE-HIGH-RES",
            "@size": "271585",
            "@ref": "gr7",
            "@mimetype": "image/jpeg"
          },
          {
            "@category": "high",
            "@height": "953",
            "@width": "1083",
            "@_fa": "true",
            "$": "https://api.elsevier.com/content/object/eid/1-s2.0-S1381116915301618-gr8_lrg.jpg?httpAccept=%2A%2F%2A",
            "@multimediatype": "JPEG image file",
            "@type": "IMAGE-HIGH-RES",
            "@size": "142099",
            "@ref": "gr8",
            "@mimetype": "image/jpeg"
          },
          {
            "@category": "high",
            "@height": "1023",
            "@width": "1333",
            "@_fa": "true",
            "$": "https://api.elsevier.com/content/object/eid/1-s2.0-S1381116915301618-gr9_lrg.jpg?httpAccept=%2A%2F%2A",
            "@multimediatype": "JPEG image file",
            "@type": "IMAGE-HIGH-RES",
            "@size": "219504",
            "@ref": "gr9",
            "@mimetype": "image/jpeg"
          },
          {
            "@category": "high",
            "@height": "1148",
            "@width": "2083",
            "@_fa": "true",
            "$": "https://api.elsevier.com/content/object/eid/1-s2.0-S1381116915301618-sc1_lrg.jpg?httpAccept=%2A%2F%2A",
            "@multimediatype": "JPEG image file",
            "@type": "IMAGE-HIGH-RES",
            "@size": "274993",
            "@ref": "sc1",
            "@mimetype": "image/jpeg"
          },
          {
            "@category": "standard",
            "@_fa": "true",
            "$": "https://api.elsevier.com/content/object/eid/1-s2.0-S1381116915301618-mmc1.doc?httpAccept=%2A%2F%2A",
            "@multimediatype": "Microsoft Word file",
            "@type": "APPLICATION",
            "@size": "1843200",
            "@ref": "mmc1",
            "@mimetype": "application/word"
          },
          {
            "@category": "thumbnail",
            "@height": "46",
            "@width": "367",
            "@_fa": "true",
            "$": "https://api.elsevier.com/content/object/eid/1-s2.0-S1381116915301618-si1.gif?httpAccept=%2A%2F%2A",
            "@multimediatype": "GIF image file",
            "@type": "ALTIMG",
            "@size": "1774",
            "@ref": "si1",
            "@mimetype": "image/gif"
          }
        ]
      },
      "link": {
        "@rel": "abstract",
        "@href": "https://api.elsevier.com/content/abstract/scopus_id/84949591359"
      }
    }
  }
}