{
  "metadata": {
    "title": "In situ DRIFTS study on the methanol oxidation by lattice oxygen over Cu/ZnO catalyst",
    "authors": "; ; ",
    "journal": "Journal of Molecular Catalysis A: Chemical",
    "date": "2011-06-01",
    "doi": "10.1016/j.molcata.2011.04.007",
    "abstract": "",
    "uri": "https://api.elsevier.com/content/article/pii/S138111691100149X",
    "pii": "S138111691100149X"
  },
  "fulltext": {
    "full-text-retrieval-response": {
      "scopus-eid": "2-s2.0-79957992444",
      "originalText": "serial JL 271358 291210 291744 291790 291809 31 Journal of Molecular Catalysis A: Chemical JOURNALMOLECULARCATALYSISACHEMICAL 2011-04-16 2011-04-16 2011-06-02T05:40:39 1-s2.0-S138111691100149X S1381-1169(11)00149-X S138111691100149X 10.1016/j.molcata.2011.04.007 S300 S300.1 FULL-TEXT 1-s2.0-S1381116911X00080 2015-05-15T05:56:33.607047-04:00 0 0 20110601 2011 2011-04-16T00:00:00Z articleinfo crossmark dco dateupdated tomb dateloaded datesearch indexeddate volumelist yearnav absattachment articletitlenorm authfirstinitialnorm authfirstsurnamenorm cid cids contenttype copyright dateloadedtxt docsubtype doctype doi eid ewtransactionid hubeid issn issnnorm itemstage itemtransactionid itemweight openaccess openarchive pg pgfirst pglast pii piinorm pubdatestart pubdatetxt pubyr sectiontitle sortorder srctitle srctitlenorm srctype subheadings suppl volfirst volissue webpdf webpdfpagecount figure table body acknowledge affil articletitle auth authfirstini authfull authkeywords authlast primabst ref specialabst alllist content subj ssids 1381-1169 13811169 342 343 342 343 C Volumes 342–343 9 35 40 35 40 20110601 1 June 2011 2011-06-01 2011 Regular papers article fla Copyright © 2011 Elsevier B.V. All rights reserved. INSITUDRIFTSSTUDYMETHANOLOXIDATIONBYLATTICEOXYGENOVERCUZNOCATALYST LIN S 1 Introduction 2 Experimental 2.1 Sample preparation 2.2 In situ DRIFTS study 2.3 Temperature-programmed reduction (TPR) 3 Results 3.1 Methanol adsorption on Cu, Cu2O, CuO, and ZnO 3.2 Effect of pretreatment on the MeOH adsorption over Cu/ZnO 3.3 The MeOH sTPD over Cu/ZnO 3.4 Effect of methanol adsorption temperature 3.5 Degree of reduction of differently pretreated Cu/ZnO 4 Discussion 5 Conclusions Acknowledgment References GINES 1995 283 296 M SHISHIDO 2006 62 71 T PAN 1988 440 446 W WAUGH 1992 51 75 K LEE 1993 414 424 J FUJITA 1995 403 413 S NAKAMURA 2003 277 285 J NUNAN 1989 195 221 J BOZ 1994 2021 2128 I HILMEN 1998 355 372 A FU 1992 4542 4549 S CHENG 1995 13 30 W XI 2002 77 86 J ROZOVSKIIL 2003 137 150 A TWIGG 2003 191 203 M AGRELL 2001 239 250 J NAVARRO 2002 112 118 R ESPINOSA 2003 245 251 L GUNTER 2001 133 149 M CHOI 2002 259 269 Y PURNAMA 2004 83 94 H PEPPLEY 1999 21 29 B PEPPLEY 1999 31 49 B KOBAYASHI 1981 487 494 H REITZ 2001 193 201 T ALEJO 1997 281 297 L HSIAO 2007 137 144 T LIN 2009 226 231 S MILLAR 1991 1467 1472 G MILLAR 1992 2257 2261 G MUDALIGE 2002 208 214 K UENO 1971 3585 3589 A ROBERTS 1985 617 620 D CAMPLIN 1996 229 241 J BRAINARD 1989 396 406 R MILLAR 1991 2785 2793 G FISHER 1998 153 173 I BUSCA 2009 2 8 G MILLAR 1992 3497 3503 G MILLAR 1992 1033 1039 G ELLIS 1994 4083 4088 T WEIGEL 1996 5319 5329 J LI 2008 357 365 L BUSCA 1987 5197 5202 G MEI 2009 4522 4537 D SINGNURKAR 2008 14034 14040 P CHEN 1995 17 23 A BO 2009 444 448 J AKHTER 1985 1958 1964 S CHENG 1983 341 350 W LINX2011X35 LINX2011X35X40 LINX2011X35XS LINX2011X35X40XS item S1381-1169(11)00149-X S138111691100149X 1-s2.0-S138111691100149X 10.1016/j.molcata.2011.04.007 271358 2011-06-07T17:27:52.0205-04:00 2011-06-01 1-s2.0-S138111691100149X-main.pdf https://s3.amazonaws.com/prod-ucs-content-store-us-east/content/pii:S138111691100149X/MAIN/application/pdf/84a775fd89c6fda385501834a720210f/main.pdf https://s3-eu-west-1.amazonaws.com/prod-ucs-content-store-eu-west/content/pii:S138111691100149X/MAIN/application/pdf/84a775fd89c6fda385501834a720210f/main.pdf main.pdf pdf true 633722 MAIN 6 1-s2.0-S138111691100149X-main_1.png https://s3.amazonaws.com/prod-ucs-content-store-us-east/content/pii:S138111691100149X/PREVIEW/image/png/38434f42082eb60f7dc81e46d5a8cdee/main_1.png https://s3-eu-west-1.amazonaws.com/prod-ucs-content-store-eu-west/content/pii:S138111691100149X/PREVIEW/image/png/38434f42082eb60f7dc81e46d5a8cdee/main_1.png main_1.png png 60986 849 656 IMAGE-WEB-PDF 1 1-s2.0-S138111691100149X-gr1.jpg https://s3.amazonaws.com/prod-ucs-content-store-us-east/content/pii:S138111691100149X/gr1/DOWNSAMPLED/image/jpeg/6722e0826aeb992fd167513ff655c9da/gr1.jpg https://s3-eu-west-1.amazonaws.com/prod-ucs-content-store-eu-west/content/pii:S138111691100149X/gr1/DOWNSAMPLED/image/jpeg/6722e0826aeb992fd167513ff655c9da/gr1.jpg gr1 gr1.jpg jpg 37747 311 370 IMAGE-DOWNSAMPLED 1-s2.0-S138111691100149X-gr1.sml https://s3.amazonaws.com/prod-ucs-content-store-us-east/content/pii:S138111691100149X/gr1/THUMBNAIL/image/gif/995fb6fcc21ef7c9ab6b4d7be91e6abd/gr1.sml https://s3-eu-west-1.amazonaws.com/prod-ucs-content-store-eu-west/content/pii:S138111691100149X/gr1/THUMBNAIL/image/gif/995fb6fcc21ef7c9ab6b4d7be91e6abd/gr1.sml gr1 gr1.sml sml 7152 164 195 IMAGE-THUMBNAIL 1-s2.0-S138111691100149X-gr1_lrg.jpg https://s3.amazonaws.com/prod-ucs-content-store-us-east/content/pii:S138111691100149X/gr1/HIGHRES/image/jpeg/a85ef058e9d61db6787cec93c9af326b/gr1_lrg.jpg https://s3-eu-west-1.amazonaws.com/prod-ucs-content-store-eu-west/content/pii:S138111691100149X/gr1/HIGHRES/image/jpeg/a85ef058e9d61db6787cec93c9af326b/gr1_lrg.jpg gr1 gr1_lrg.jpg jpg 327698 1378 1640 IMAGE-HIGH-RES 1-s2.0-S138111691100149X-gr2.jpg https://s3.amazonaws.com/prod-ucs-content-store-us-east/content/pii:S138111691100149X/gr2/DOWNSAMPLED/image/jpeg/937dbebdc8580088cd088b8fc746a298/gr2.jpg https://s3-eu-west-1.amazonaws.com/prod-ucs-content-store-eu-west/content/pii:S138111691100149X/gr2/DOWNSAMPLED/image/jpeg/937dbebdc8580088cd088b8fc746a298/gr2.jpg gr2 gr2.jpg jpg 35260 280 355 IMAGE-DOWNSAMPLED 1-s2.0-S138111691100149X-gr2.sml https://s3.amazonaws.com/prod-ucs-content-store-us-east/content/pii:S138111691100149X/gr2/THUMBNAIL/image/gif/8cc0586ca90bc1959176f6ba6789bb88/gr2.sml https://s3-eu-west-1.amazonaws.com/prod-ucs-content-store-eu-west/content/pii:S138111691100149X/gr2/THUMBNAIL/image/gif/8cc0586ca90bc1959176f6ba6789bb88/gr2.sml gr2 gr2.sml sml 7795 164 208 IMAGE-THUMBNAIL 1-s2.0-S138111691100149X-gr2_lrg.jpg https://s3.amazonaws.com/prod-ucs-content-store-us-east/content/pii:S138111691100149X/gr2/HIGHRES/image/jpeg/a299356cdc7e426c73c00afe9de34c2f/gr2_lrg.jpg https://s3-eu-west-1.amazonaws.com/prod-ucs-content-store-eu-west/content/pii:S138111691100149X/gr2/HIGHRES/image/jpeg/a299356cdc7e426c73c00afe9de34c2f/gr2_lrg.jpg gr2 gr2_lrg.jpg jpg 318417 1242 1573 IMAGE-HIGH-RES 1-s2.0-S138111691100149X-gr3.jpg https://s3.amazonaws.com/prod-ucs-content-store-us-east/content/pii:S138111691100149X/gr3/DOWNSAMPLED/image/jpeg/87177ec7ad8c2ca45e0d325fab410355/gr3.jpg https://s3-eu-west-1.amazonaws.com/prod-ucs-content-store-eu-west/content/pii:S138111691100149X/gr3/DOWNSAMPLED/image/jpeg/87177ec7ad8c2ca45e0d325fab410355/gr3.jpg gr3 gr3.jpg jpg 32265 286 362 IMAGE-DOWNSAMPLED 1-s2.0-S138111691100149X-gr3.sml https://s3.amazonaws.com/prod-ucs-content-store-us-east/content/pii:S138111691100149X/gr3/THUMBNAIL/image/gif/81558a09717caab5702249876b6505d5/gr3.sml https://s3-eu-west-1.amazonaws.com/prod-ucs-content-store-eu-west/content/pii:S138111691100149X/gr3/THUMBNAIL/image/gif/81558a09717caab5702249876b6505d5/gr3.sml gr3 gr3.sml sml 6830 164 208 IMAGE-THUMBNAIL 1-s2.0-S138111691100149X-gr3_lrg.jpg https://s3.amazonaws.com/prod-ucs-content-store-us-east/content/pii:S138111691100149X/gr3/HIGHRES/image/jpeg/943d98ed22e53c04f01b0cc1d3f9e1cd/gr3_lrg.jpg https://s3-eu-west-1.amazonaws.com/prod-ucs-content-store-eu-west/content/pii:S138111691100149X/gr3/HIGHRES/image/jpeg/943d98ed22e53c04f01b0cc1d3f9e1cd/gr3_lrg.jpg gr3 gr3_lrg.jpg jpg 271728 1265 1603 IMAGE-HIGH-RES 1-s2.0-S138111691100149X-gr4.jpg https://s3.amazonaws.com/prod-ucs-content-store-us-east/content/pii:S138111691100149X/gr4/DOWNSAMPLED/image/jpeg/403a94089219c11f7631b3695cacf21f/gr4.jpg https://s3-eu-west-1.amazonaws.com/prod-ucs-content-store-eu-west/content/pii:S138111691100149X/gr4/DOWNSAMPLED/image/jpeg/403a94089219c11f7631b3695cacf21f/gr4.jpg gr4 gr4.jpg jpg 33021 288 368 IMAGE-DOWNSAMPLED 1-s2.0-S138111691100149X-gr4.sml https://s3.amazonaws.com/prod-ucs-content-store-us-east/content/pii:S138111691100149X/gr4/THUMBNAIL/image/gif/7e5d62c7ee559994b54d215d78f1e508/gr4.sml https://s3-eu-west-1.amazonaws.com/prod-ucs-content-store-eu-west/content/pii:S138111691100149X/gr4/THUMBNAIL/image/gif/7e5d62c7ee559994b54d215d78f1e508/gr4.sml gr4 gr4.sml sml 7665 164 209 IMAGE-THUMBNAIL 1-s2.0-S138111691100149X-gr4_lrg.jpg https://s3.amazonaws.com/prod-ucs-content-store-us-east/content/pii:S138111691100149X/gr4/HIGHRES/image/jpeg/79859c58b51fdf07b5d1163b36b83dc3/gr4_lrg.jpg https://s3-eu-west-1.amazonaws.com/prod-ucs-content-store-eu-west/content/pii:S138111691100149X/gr4/HIGHRES/image/jpeg/79859c58b51fdf07b5d1163b36b83dc3/gr4_lrg.jpg gr4 gr4_lrg.jpg jpg 311646 1277 1631 IMAGE-HIGH-RES 1-s2.0-S138111691100149X-gr5.jpg https://s3.amazonaws.com/prod-ucs-content-store-us-east/content/pii:S138111691100149X/gr5/DOWNSAMPLED/image/jpeg/5fd20657e05990070afdee81d63d68f0/gr5.jpg https://s3-eu-west-1.amazonaws.com/prod-ucs-content-store-eu-west/content/pii:S138111691100149X/gr5/DOWNSAMPLED/image/jpeg/5fd20657e05990070afdee81d63d68f0/gr5.jpg gr5 gr5.jpg jpg 33837 284 365 IMAGE-DOWNSAMPLED 1-s2.0-S138111691100149X-gr5.sml https://s3.amazonaws.com/prod-ucs-content-store-us-east/content/pii:S138111691100149X/gr5/THUMBNAIL/image/gif/151c4f2594b03311d09ad609fc51daa1/gr5.sml https://s3-eu-west-1.amazonaws.com/prod-ucs-content-store-eu-west/content/pii:S138111691100149X/gr5/THUMBNAIL/image/gif/151c4f2594b03311d09ad609fc51daa1/gr5.sml gr5 gr5.sml sml 7526 164 211 IMAGE-THUMBNAIL 1-s2.0-S138111691100149X-gr5_lrg.jpg https://s3.amazonaws.com/prod-ucs-content-store-us-east/content/pii:S138111691100149X/gr5/HIGHRES/image/jpeg/27939066213c13ca40dc0a9f04be9b79/gr5_lrg.jpg https://s3-eu-west-1.amazonaws.com/prod-ucs-content-store-eu-west/content/pii:S138111691100149X/gr5/HIGHRES/image/jpeg/27939066213c13ca40dc0a9f04be9b79/gr5_lrg.jpg gr5 gr5_lrg.jpg jpg 302797 1260 1619 IMAGE-HIGH-RES 1-s2.0-S138111691100149X-gr6.jpg https://s3.amazonaws.com/prod-ucs-content-store-us-east/content/pii:S138111691100149X/gr6/DOWNSAMPLED/image/jpeg/a91e9c68455f492b3f10cc6e583b6a8a/gr6.jpg https://s3-eu-west-1.amazonaws.com/prod-ucs-content-store-eu-west/content/pii:S138111691100149X/gr6/DOWNSAMPLED/image/jpeg/a91e9c68455f492b3f10cc6e583b6a8a/gr6.jpg gr6 gr6.jpg jpg 31632 275 356 IMAGE-DOWNSAMPLED 1-s2.0-S138111691100149X-gr6.sml https://s3.amazonaws.com/prod-ucs-content-store-us-east/content/pii:S138111691100149X/gr6/THUMBNAIL/image/gif/5f05fe8037cc5172a78a1e7b79a94282/gr6.sml https://s3-eu-west-1.amazonaws.com/prod-ucs-content-store-eu-west/content/pii:S138111691100149X/gr6/THUMBNAIL/image/gif/5f05fe8037cc5172a78a1e7b79a94282/gr6.sml gr6 gr6.sml sml 7209 164 212 IMAGE-THUMBNAIL 1-s2.0-S138111691100149X-gr6_lrg.jpg https://s3.amazonaws.com/prod-ucs-content-store-us-east/content/pii:S138111691100149X/gr6/HIGHRES/image/jpeg/c565f494de070b4def58b1c27dffd300/gr6_lrg.jpg https://s3-eu-west-1.amazonaws.com/prod-ucs-content-store-eu-west/content/pii:S138111691100149X/gr6/HIGHRES/image/jpeg/c565f494de070b4def58b1c27dffd300/gr6_lrg.jpg gr6 gr6_lrg.jpg jpg 280601 1218 1578 IMAGE-HIGH-RES 1-s2.0-S138111691100149X-gr7.jpg https://s3.amazonaws.com/prod-ucs-content-store-us-east/content/pii:S138111691100149X/gr7/DOWNSAMPLED/image/jpeg/be8c6da33e962fc7423a160f3178c3a9/gr7.jpg https://s3-eu-west-1.amazonaws.com/prod-ucs-content-store-eu-west/content/pii:S138111691100149X/gr7/DOWNSAMPLED/image/jpeg/be8c6da33e962fc7423a160f3178c3a9/gr7.jpg gr7 gr7.jpg jpg 24783 280 354 IMAGE-DOWNSAMPLED 1-s2.0-S138111691100149X-gr7.sml https://s3.amazonaws.com/prod-ucs-content-store-us-east/content/pii:S138111691100149X/gr7/THUMBNAIL/image/gif/a7ca88ab04f77bd150e0c4b143201579/gr7.sml https://s3-eu-west-1.amazonaws.com/prod-ucs-content-store-eu-west/content/pii:S138111691100149X/gr7/THUMBNAIL/image/gif/a7ca88ab04f77bd150e0c4b143201579/gr7.sml gr7 gr7.sml sml 6000 164 207 IMAGE-THUMBNAIL 1-s2.0-S138111691100149X-gr7_lrg.jpg https://s3.amazonaws.com/prod-ucs-content-store-us-east/content/pii:S138111691100149X/gr7/HIGHRES/image/jpeg/ef8804fa9c7dc022c3258429c6233a35/gr7_lrg.jpg https://s3-eu-west-1.amazonaws.com/prod-ucs-content-store-eu-west/content/pii:S138111691100149X/gr7/HIGHRES/image/jpeg/ef8804fa9c7dc022c3258429c6233a35/gr7_lrg.jpg gr7 gr7_lrg.jpg jpg 215426 1241 1568 IMAGE-HIGH-RES 1-s2.0-S138111691100149X-fx1.jpg https://s3.amazonaws.com/prod-ucs-content-store-us-east/content/pii:S138111691100149X/fx1/DOWNSAMPLED/image/jpeg/c4bd346dd6e657a8cacb1fff68ac4fca/fx1.jpg https://s3-eu-west-1.amazonaws.com/prod-ucs-content-store-eu-west/content/pii:S138111691100149X/fx1/DOWNSAMPLED/image/jpeg/c4bd346dd6e657a8cacb1fff68ac4fca/fx1.jpg fx1 true fx1.jpg jpg 18055 200 500 IMAGE-DOWNSAMPLED 1-s2.0-S138111691100149X-fx1.sml https://s3.amazonaws.com/prod-ucs-content-store-us-east/content/pii:S138111691100149X/fx1/THUMBNAIL/image/gif/a79f6160ecd98891ab6d7dc343b037ad/fx1.sml https://s3-eu-west-1.amazonaws.com/prod-ucs-content-store-eu-west/content/pii:S138111691100149X/fx1/THUMBNAIL/image/gif/a79f6160ecd98891ab6d7dc343b037ad/fx1.sml fx1 true fx1.sml sml 3432 88 219 IMAGE-THUMBNAIL 1-s2.0-S138111691100149X-fx1_lrg.jpg https://s3.amazonaws.com/prod-ucs-content-store-us-east/content/pii:S138111691100149X/fx1/HIGHRES/image/jpeg/08e30b7ad3084d77d3fee00b2f5aca05/fx1_lrg.jpg https://s3-eu-west-1.amazonaws.com/prod-ucs-content-store-eu-west/content/pii:S138111691100149X/fx1/HIGHRES/image/jpeg/08e30b7ad3084d77d3fee00b2f5aca05/fx1_lrg.jpg fx1 fx1_lrg.jpg jpg 176037 886 2213 IMAGE-HIGH-RES MOLCAA 8112 S1381-1169(11)00149-X 10.1016/j.molcata.2011.04.007 Elsevier B.V. Fig. 1 DRIFTS spectra of MeOH adsorption over Cu, Cu2O, CuO, and ZnO, after exposure to a stream of 26.7kPa methanol in He at 30cm3/min for 15min at 393K and at atmospheric pressure, and then purge with He to remove gas phase MeOH. MeO: methoxy, m-F: monodentate formate. Fig. 2 DRIFTS spectra of the MeOH adsorption over the Cu/ZnO after (a) calcination at 573K, and then reduction at (b) 423, (c) 450, (d) 463, (e) 473, and (f) 493K, after exposure to a stream of 26.7kPa methanol in He at 30cm3/min for 15min at 393K and at atmospheric pressure, and then purge with He to remove gas phase MeOH. MeO: methoxy, m-F: monodentate formate, C: carbonate. Fig. 3 DRIFTS spectra of (a) MeOH adsorption at 393K over ZnO and the subsequent stepwise TPD to (b) 433 and (c) 473K. The difference spectra include (d) 433–393K and (e) 473–433K. MeO: methoxy, m-F: monodentate formate. Fig. 4 DRIFTS spectra of (a) MeOH adsorption at 393K over the calcined Cu/ZnO and the subsequent stepwise TPD to (b) 433 and (c) 473K. The difference spectra include (d) 433–393K and (e) 473–433K. MeO: methoxy, m-F: monodentate formate, b-F: bidentate formate. Fig. 5 DRIFTS spectra of (a) MeOH adsorption at 393K over the 450K-reduced Cu/ZnO and the subsequent stepwise TPD to (b) 433 and (c) 473K. The difference spectra include (d) 433–393K and (e) 473–433K. MeO: methoxy, m-F: monodentate formate, C: carbonate. Fig. 6 DRIFTS spectra of (a) MeOH adsorption at 393K over the 493K-reduced Cu/ZnO and the subsequent stepwise TPD to (b) 433 and (c) 473K. The difference spectra include (d) 433–393K and (e) 473–433K. MeO: methoxy, m-F: monodentate formate, C: carbonate, b-F: bidentate formate. Fig. 7 DRIFTS spectra of the MeOH adsorption at 473K over (a) the 523K-reduced Cu/ZnO, (b) the 473K-reduced ZnO, and (c): the difference spectrum of (a) minus (b). MeO: methoxy, m-F: monodentate formate, b-F: bidentate formate, FAL: formaldehyde. Table 1 The reduction degrees a of Cu/ZnO after different treatments. Conditions Calcination H2, 450K H2, 493K H2, 523K After pretreatment 0 57 75 100 After MeOH adsorption and a following sTPD to 473K 7 66 79 100 a The reduction degrees were based on the hydrogen consumption calculated from TPR results, normalized by the hydrogen consumption of the calcined Cu/ZnO sample. In situ DRIFTS study on the methanol oxidation by lattice oxygen over Cu/ZnO catalyst Shawn D. Lin a ⁎ Hongkui Cheng a Ting C. Hsiao b a Department of Chemical Engineering, National Taiwan University of Science and Technology, Taipei, Taiwan, ROC b Department of Chemical Engineering and Materials Science, Yuan Ze University, Chung-Li, Taiwan, ROC ⁎ Corresponding author. Tel.: +886 2 2737 6984; fax: +886 2 2737 6644. Graphical abstract A sequential dehydrogenation to FAL, formyl, and CO occurs during methanol conversion on the completely reduced Cu/ZnO. Active oxygen related to Cu can react readily with adspecies on the surface leading to CO2 evolution. Highlights ► The state of Cu in Cu/ZnO was controlled by pretreating at different temperatures. ► In situ DRIFTS reveals the adspecies after methanol adsorption on Cu/ZnO catalyst. ► Lattice oxygen reacts with MeOH to CO2, and reduced Cu catalyzes this reaction. Previous research shows that lattice oxygen of Cu catalyst participates in the methanol conversion. In this study, Cu/ZnO catalyst was pretreated to become fully oxidized, partially reduced, or completely reduced. In situ diffuse-reflectance infrared Fourier-transformed spectroscopy (DRIFTS) was used to analyze the methanol (MeOH) adsorption at 393K and a following stepwise temperature-programmed desorption (sTPD). In addition to methoxy and formates appeared after MeOH adsorption, Cu/ZnO catalyst had formaldehyde but no CO2 while the Cu was completely reduced. When the Cu was in the oxidized or partially reduced states, CO2 formed and more formate appeared. Lattice oxygen participated in the MeOH conversion, and the reactivity was higher in the partially reduced Cu/ZnO than in the oxidized Cu/ZnO. This suggests that reduced Cu catalyzes the reaction between MeOH adspecies and lattice oxygen. Keywords Methanol DRIFT Stepwise TPD Cu/ZnO 1 Introduction Copper catalysts, especially Cu/ZnO, are widely used in many traditional applications such as the water–gas shift reaction (WGS) [1,2], methanol synthesis (MS) [3–7], higher alcohol synthesis (HAS) [8–10], methanol decomposition (MD) [11–15], partial oxidation of methanol (POM) [16–18], and steam reforming of methanol (SRM) reaction [19–21]. Researchers have recently focused on the POM (MeOH+O2), SRM (MeOH+H2O), or oxidative methanol reforming (OMR, MeOH+O2 +H2O) reaction [17–23] in an effort to produce CO-free hydrogen for fuel cells. These reactions are very complex and sometimes interrelated. The best example appears in Peppley et al. [22,23], who pointed out that MD, SRM, and WGS reactions must all be included in the kinetic analysis of the SRM. The working state of Cu/ZnO during reactions remains unclear, and may change with different reaction conditions. For MD and SRM, Cu0 is generally accepted as the active state of the Cu/ZnO catalysts [12,19,24]. Reitz et al. [25] suggested that Cu2+ was the dominant species of Cu/ZnO in OMR at low oxygen conversion (470–533K); however, Cu0 from the reduction of Cu2+ dominated at high oxygen conversion conditions and the pathway shifted to SRM. Alejo et al. [26] proposed that Cu0 is involved in the formation of CO2 and H2 in POM, Cu1+ sites favor the formation of CO and H2O, and Cu2+ is relatively inactive in OMR. These examples illustrate the controversy regarding the states of the Cu catalysts during methanol conversion, and suggest that the Cu state varies under different conditions. Using the MD reaction as a reference, we reported previously that co-feed species like H2O and O2 can change not only the MeOH conversion activity and selectivity, but also the Cu state [27]. We also examined differently reduced Cu/ZnO catalyst (the pretreatment effect) for the MD reaction [28]. The lattice oxygen in the incompletely reduced catalysts can take part in the reaction, leading to CO2 formation. To gain more insight to this pretreatment effect, this study examined the surface species or intermediates after methanol adsorption on the differently pretreated Cu/ZnO catalysts by in situ diffuse-reflectance infrared Fourier-transformed spectroscopy (DRIFTS) analysis. Previous studies [29–31] show that absorbance band positions from methanol adsorption over Cu catalysts could change in reducing or oxidic environments. The C–H stretching bands of the methoxy adspecies on Cu/SiO2 shifted from 2923 and 2816cm−1 to 2935 and 2823cm−1 after the reduced catalyst was re-oxidized [29]. Mudalige and Trenary [31] reported a red shift in the OCO vibration mode from 1340 to 1317cm−1 when the Cu(100) surface was precovered with O. These results indicate that the vibration modes of surface species can vary as the state of Cu changes. However, no researchers have tried to illustrate the effect of lattice oxygen on the evolution of MeOH adspecies as the temperature increases. This study reports the DRIFTS results from MeOH adsorption over Cu/ZnO catalysts at different extents of Cu reduction and discusses how the lattice oxygen may have participated in MeOH conversion. 2 Experimental 2.1 Sample preparation The experiments in this study involved a commercial Cu/ZnO catalyst (Nissan Girdler G66B; CuO: 30, ZnO: 60, Al2O3: 10wt%). The catalyst was ground and particles of 80–120 mesh were used in this study. Reference samples include powders of metallic Cu (Cerac, 99.999%, ∼100 mesh), CuO (Cerac, 99%, ∼200 mesh), Cu2O (Merck, 99%), and ZnO (Fluka, 99%). 2.2 In situ DRIFTS study Infrared spectra were collected using a Nicolet Magna-IR 550 with MCT detector and a diffuse reflectance FT-IR (DRIFT) accessory (Thermo Spectra-Tech). The spectra were collected at a resolution of 4cm−1 and an accumulation of 64 scans. The reference spectra were taken after the sample was pretreated and cooled to the experimental temperature under flowing helium. The H2 and He gases used in this study were obtained from San-Fu Gas Co. Ltd. High purity (>99.99%) gases of H2 and He were used after flowing through dryer and deoxygen columns. Methanol (Merck >99.9%, soaking with dehydrated molecular sieve) was carried into the system by a helium flow through a bubbler, whose temperature was controlled by a thermostat. Catalyst powders were packed in the sample holder of the in situ cell, subsequently calcined at 573K for 1h, and then reduced by H2 at different temperatures for 30min when needed. After feeding methanol at the desired adsorption temperature, methanol gas phase and reversibly adsorbed species were purged by helium until the spectra stabilized. A stepwise temperature-programmed desorption (sTPD) process was then carried out under He flow to 473K, and spectra were collected at each predetermined temperature. 2.3 Temperature-programmed reduction (TPR) Temperature-programmed reduction was performed at a heating rate of 5K/min using 10% hydrogen in nitrogen and a TCD detector. Samples of Cu/ZnO were pretreated by calcination at 573K for 1h with/without a subsequent hydrogen reduction at selective temperature for 30min, cooled down to room temperature, and then analyzed with TPR. The reduction degrees of the catalysts with different pretreatments were calculated according to the quantitative hydrogen consumption of TPR results. The effect of methanol adsorption and a following sTPD on the reduction degrees of the catalysts with different pretreatments were also examined. The pretreatment, methanol adsorption, and sTPD procedures prior to TPR analyses were kept exactly the same as those used in DRIFT analyses. 3 Results 3.1 Methanol adsorption on Cu, Cu2O, CuO, and ZnO To illustrate the interaction between MeOH and different Cu species, this study uses DRIFTS to determine MeOH adsorption on Cu, Cu2O, CuO, ZnO, and differently pretreated Cu/ZnO catalysts. Fig. 1 shows the DRIFTS spectra of MeOH adsorption at 393K for four reference compounds: Cu, Cu2O, CuO, and ZnO. The Cu powders showed absorbances at 2935, 1064, and 1030cm−1, attributable to the C–H stretching, the C–O stretching, and the CH3 rocking mode of methoxy (MeO), respectively [30,32–38]. In addition to MeO, Cu2O powders contained absorbance attributable to mono-dentate formate (m-F) at 1584 (υ as (OCO)) [30,39,40]. This implies that MeO interacted with surface oxygen to yield formate. Both CuO and ZnO showed stronger IR absorption than Cu and Cu2O. This suggests a relatively lower MeOH uptake on the reduced Cu surface than the oxidized surface. The absorption bands over CuO and ZnO can be assigned to MeO and m-F adspecies. However, shifts in band position were apparent compared to those over Cu and Cu2O. In addition, the ratio of methoxy (∼2818cm−1) to formate (∼1575cm−1) was different. ZnO showed higher intensity of methoxy than formate, but CuO showed higher intensity of formate than methoxy. 3.2 Effect of pretreatment on the MeOH adsorption over Cu/ZnO Fig. 2 shows the DRIFTS spectra of MeOH adsorption at 393K over the Cu/ZnO catalyst pretreated at different conditions. The calcined catalyst had a DRIFTS spectrum containing MeO and m-F absorbances. The ratio of MeO to m-F lies between that of CuO and ZnO, suggesting a combined contribution from both CuO and ZnO. After H2 reduction at 423K, the catalyst showed very similar DRIFTS spectrum as the calcined catalyst. This reduction temperature was too low to cause any change in the oxidation state of the catalyst, which agreed with previous TPR findings [28]. The DRIFTS spectra from MeOH adsorption at 393K changed as the reduction temperature increased to 450 and 463K, with a significant increase in water-related absorbance at 3000–3500 and at 1300–1600cm−1. This indicates the formation of H2O during MeOH adsorption over partially reduced Cu/ZnO catalyst. Ellis and Wang [41] reported that MeOH adsorption on O-preadsorbed Cu(100) yielded H2O via a 2-step process. The adspecies over the partially reduced Cu/ZnO catalyst included MeO, formate, and carbonates. Absorbances at 1415 and 1506cm−1 indicate the presence of carbonates. Weigel et al. [42] reported that surface carbonates appeared between 1700 and 1200cm−1 on Cu/ZrO2, which has a similar band shape to that in Fig. 2. The feature at 1506cm−1 could be assigned to the OCO asymmetrical stretching mode of bidentate carbonate, whose υ as and υ s were at 1512 and 1325cm−1 respectively [40], while that at 1415cm−1 could be assigned to polydentate carbonate [37] or uncoordinated carbonate [40]. The absorbances related to water and carbonates disappeared as the reduction temperature increased to 473 and 493K, while the MeO and m-F absorbances became stronger. This suggests that Cu/ZnO catalysts with more reduced Cu had more MeO and formate adspecies (Fig. 2(e) and (f)). The relatively higher intensity of MeO compared to m-F suggests that ZnO contributed more than Cu to the observed spectra over the reduced Cu/ZnO. 3.3 The MeOH sTPD over Cu/ZnO An analysis of MeOH adsorption on ZnO is a prerequisite to understand the interaction of MeOH with a Cu/ZnO catalyst. Fig. 3 shows the infrared spectra of the MeOH adsorption at 393K, the following stepwise TPD (sTPD) over ZnO to 433 and 473K, and their difference spectra. The adsorbed species at 393K contained MeO and m-F. The negative peaks at the OH band position (3670 and 3618cm−1) in Fig. 3 suggest that the hydroxyl groups interacted with the adsorbed species, as the background spectra were the same sample at the same temperatures before MeOH adsorption. DFT calculations [43] suggest that MeOH interacted with the hydroxyl group of ZnO to generate MeO and H2O. Similar species appeared during sTPD to 433 and 473K, but some bands shifted position. The difference spectrum between that at 433 and that at 473K (Fig. 3(e)) shows the disappearance of MeO and the appearance of bi-dentate formate (b-F). The features at 2964, 2867, and 2739cm−1 indicate the presence of b-F [30,40]. The small bands appearing at 3050, 1441, 1263cm−1 might be due to methyl formate (MF) [30]. The increasing temperature converted MeO from MeOH adsorption on ZnO to formate species. Fig. 4 shows the DRIFTS spectra and the difference spectra of MeOH adsorption at 393K and subsequent sTPD over the calcined Cu/ZnO. Surface MeO and m-F were found after MeOH adsorption at 393K. When the temperature increased stepwise to 433K and 473K, the intensity of the methoxy bands decreased. In the meantime, bands of CO2 (2349cm−1) and the υ (OCO) (1597cm−1) of m-F increased, as shown in the difference spectra of Fig. 4(d) and (e). At 473K, the bands attributable to b-F (2870 and 2740cm−1) became visible (Fig. 4(c)), but its intensity did not increase with increasing temperature as indicated by the difference spectrum. This suggests that b-F formed at a relatively low concentration during MeOH adsorption at 393K and its concentration did not change during sTPD. The formation of CO2 over the calcined Cu/ZnO catalyst suggests that it contained active oxygen for the reaction. Fig. 5 shows the DRIFTS spectra of the methanol adsorption and the following sTPD over the partially reduced (450K-reduced) Cu/ZnO. Intense bands of hydroxyl and water (3600–3100 and 1700–1250cm−1) appeared after MeOH adsorption, while MeO, m-F, CO2, and carbonates also appeared at 393K. In comparison, the temperature at which CO2 started to form was lower over the partially reduced Cu/ZnO than over the completely oxidized Cu/ZnO (Fig. 4). This implies that the oxygen within the partially reduced Cu/ZnO was more active than that in the calcined Cu/ZnO. The formation of hydroxyl and water can also be explained by the reaction between the oxygen and the hydrogen released by MeOH dehydrogenation. Increasing the temperature to 433K caused the formation of more CO2 at the expense of MeO, m-F, C, and some water. The difference spectrum in Fig. 5(e) shows that no further change occurred from 433 to 473K. The MeO might have been exhausted at 433K, as suggested by the very low absorbance of MeO. Fig. 6 shows the DRIFTS spectra of MeOH adsorption at 393K and the following sTPD to 473K over the 493K-reduced Cu/ZnO. TPR analysis (Table 1 , will be discussed later) shows that the 493K-reduced catalyst was almost completely reduced. At 393K, the spectrum (Fig. 6(a)) showed the presence of MeO, m-F, and carbonates. Unlike that of the 450K-reduced Cu/ZnO, no H2O formed and the intensity of carbonates was much lower which suggests that the 493K-reduced catalyst contained less active oxygen. When the temperature increased to 433 and to 473K, surface MeO decreased while CO2 increased. At 433 and 473K, the absorbances of b-F (at 2960 and 2740cm−1) became visible in Fig. 6(b) and (c), but the difference spectra suggest that b-F was a spectator species. 3.4 Effect of methanol adsorption temperature Fig. 7 shows the DRIFTS spectra of the methanol adsorption at 473K over the 523K-reduced Cu/ZnO and the 473K-reduced ZnO. The spectrum over ZnO (Fig. 7(b)) is almost the same as that over the non-reduced ZnO (Fig. 3(c)), which is the spectrum of sTPD to 473K after MeOH adsorption at 393K. Neither the hydrogen treatment at 473K nor the methanol adsorption temperature caused significant differences in the DRIFTS over ZnO at 473K. This suggests that the adsorbed species over ZnO changed due to thermodynamic stability. The methanol adsorption at 473K over the 523K-reduced Cu/ZnO catalyst had a similar spectrum as that over ZnO. This suggests that the absorbances were originated mainly from adspecies on ZnO surface. However, bands attributable to formaldehyde (FAL) [36,44] appeared in the difference spectrum, Fig. 7(c), wherein negatives peaks indicate less b-F over the completely reduced Cu/ZnO. The sequential dehydrogenation of MeOH, MeOH→MeO→FAL→formyl→CO, is suggested by a comprehensive DFT calculation over Cu(110) [45]. Our previous work [27] also indicates that an H-abstraction sequence of MeOH→MeO→FAL→formyl→CO occurs over Cu/ZnO when active oxygen is eliminated by co-feeding hydrogen with MeOH. The presence of FAL over the completely reduced Cu/ZnO (Fig. 7(c)) is consistent with that MeOH underwent dehydrogenation in the absence of oxygen for further reaction. 3.5 Degree of reduction of differently pretreated Cu/ZnO The degree of reduction of a catalyst can be used as a quantitative index of lattice oxygen. Table 1 shows the reduction degrees of the Cu/ZnO with different pretreatments, based on the hydrogen consumption of TPR analyses. The reduction degree increased, as expected, with increasing hydrogen reduction temperature. The procedures used in DRIFTS analysis were carried out exactly the same prior to TPR experiments, including the MeOH adsorption and a following sTPD. The in situ MeOH treatment (i.e., adsorption and sTPD) also increased the reduction degrees of differently pretreated Cu/ZnO catalysts. This indicates that the lattice oxygen related with Cu was consumed during the in situ methanol treatment and that the lattice oxygen was active under the conditions used in this study. This agrees with our previous results that there are more oxygen contents in the products than in the feed during methanol conversion on the calcined and partially reduced Cu/ZnO catalysts [28]. 4 Discussion Based on the TPR of the calcined Cu/ZnO (Table 1), the 523K-reduced catalyst was completely reduced, while the 493K-reduced catalyst was slightly less than completely reduced. The most significant difference in the DRIFTS of these two (Figs. 6(a) and 7(a)) was in CO2 formation, which appeared in the 493K-reduced but not in the 523K-reduced Cu/ZnO. This suggests that the slightly oxidized Cu state in the 493K-reduced Cu/ZnO caused the formation of CO2, since the experiments in this study were controlled with a limited supply of oxygen in feed using dry MeOH and dry gases. The slight increase in surface hydroxyl (Fig. 6(d)) during MeOH sTPD to 473K over the 493K-reduced Cu/ZnO also suggests the presence of a small amount of active oxygen. The 450K-reduced Cu/ZnO showed intense surface hydroxyl bands, and CO2 formation appeared upon MeOH adsorption at 393K. The lattice oxygen must be the source of oxygen for the formation of surface hydroxyl and CO2. These results suggest similar hydroxyl and CO2 formation over the calcined Cu/ZnO because it contains a large amount of lattice oxygen; however, this did not occur as shown in Fig. 4. A negligible amount of hydroxyl and CO2 formed during MeOH adsorption at 393K over the calcined Cu/ZnO, and they were produced only at higher temperatures in the following sTPD. This implies that reduced Cu surface is necessary for the formation of hydroxyl and CO2 at 393K. This is the catalytic effect of reduced Cu. The partially reduced Cu/ZnO contained reduced Cu surface and a supply of lattice oxygen for oxidation reaction, and therefore the formation of CO2 and hydroxyl was the most obvious in this study. Previous studies report the formation of water and CO2 during MeOH adsorption over oxygen-precovered Cu surfaces [41,46]. For example, Singnurkar et al. [46] reported the formation of H2O during MeOH adsorption on 0.25 monolayer O-precovered Cu(110) at 180K. The surface oxygen over reduced Cu appears to be more active than the lattice oxygen reported in this study. This study provides the first infrared evidence of the participation of lattice oxygen of Cu to interact with MeOH. On oxygen-free Cu surfaces, MeOH adsorption leads to MeO. Thereafter, a sequential dehydrogenation to FAL, formyl, and CO occurs during MeOH decomposition. Comprehensive DFT calculations [45] and experiments involving model systems [47] and real catalysts [27] revealed such a sequential dehydrogenation mechanism. MeO to FAL is the rate determining step in this MeOH sequential dehydrogenation. [27,45,47]. In this study, FAL appeared over the completely reduced Cu/ZnO (Fig. 7) but no CO2 formed. Over the other incompletely reduced Cu/ZnO (Figs. 4–6), no FAL appeared but CO2 formed. This suggests that active oxygen can react readily with either MeO or FAL leading to CO2 evolution. A η2-formaldehyde species was proposed as the intermediate leading to CO2, when FAL interacts with OH over an oxygen-precovered Cu(110) surface [46]. Based on DFT calculations, Bo et al. [48] reported that the reaction of FAL with Oad over Cu(100) is thermodynamically more favorable than the reaction with OHad, and that formate is an intermediate to the formation of CO2. These results clearly demonstrate that surface O and OH can react with FAL to form CO2 over a Cu surface. The results of this study imply that lattice oxygen in the partially reduced Cu/ZnO catalyst migrates to the surface and participates in the adsorption of MeOH and subsequent surface reaction. The support surface of Cu catalysts provides additional sites for MeOH adsorption. The MeOH adsorption over ZnO also results in MeO and formate. The adsorbed MeOH gives away one H to become MeO, probably due to the hydrogen adsorption capability of ZnO surface [49]. However, neither FAL nor CO2 appeared on ZnO in this study, although previous research reports FAL from MeOH adsorption over polar ZnO surface [50]. The absence of CO2 formation agrees with the negligible MeOH decomposition activity over ZnO, indicating that the hydroxyl groups on ZnO cannot be a source of active oxygen for CO2 formation. Formate was present on ZnO due to the interaction of MeO with surface hydroxyls or lattice oxygen, as indicated by the formation of more formates at the expense of MeO during sTPD (Fig. 3). The adspecies over ZnO can migrate to the metal-support interface and become converted with the help of Cu, provided the migration of adspecies is thermally driven. From the sTPD over differently pretreated Cu/ZnO, DRIFTS analyses indicate that MeO decreased as the temperature increased, which in turn increased the formates and CO2. The increase in formates is at least partially due to MeO conversion on ZnO surface. Over the partially reduced Cu/ZnO, carbonates and water were formed upon MeOH adsorption at 393K. These species decreased together with MeO and m-F as the temperature increases, while CO2 was formed. This implies that the surface carbonates and m-F may decompose or the m-F on ZnO may migrate to the Cu–ZnO interface to form CO2. After heating to 473K, the lower intensity of MeO band over partially reduced Cu/ZnO (Figs. 5(c) and 6(c)) compared to that over ZnO (Figs. 3(c) and 7(b)) suggests the migration of adspecies on ZnO to the Cu–ZnO interface for reaction. However, Fig. 6 suggests that b-F is just a spectator species, which may be due to its low migration mobility. The formation of CO2 and waters (hydroxyls) occurs at a lower temperature over the partially reduced Cu/ZnO than that over the calcined Cu/ZnO. This is consistent with previous results about methanol decomposition, for example, methanol conversions at 423K were 0, 1.1, and 5.2% on the calcined, the 450K-reduced and the 493K-reduced Cu/ZnO catalysts, respectively [28]. This indicates that the transformation rate of adspecies increases with the increase in reduction degree of the Cu/ZnO catalyst. This suggests that the reduced Cu surface catalyzed the reaction between the adspecies and the oxygen migrated from lattice. The most likely morphology in the partially reduced Cu/ZnO should be Cu particles with a reduced Cu surface and a CuO x core. The interaction of O (or OH) with adspecies from MeOH adsorption over Cu surfaces proceeds readily at temperatures below 120K [41]. Under the conditions of this study, the mobility of lattice oxygen is obviously sufficient for supplying O to the surface. Over Cu surface, O and OH take part in the MeOH adsorption and reaction, as indicated in the MeOH sTPD over the partially reduced Cu/ZnO. The migration of adspecies over ZnO to the Cu–ZnO interface may contribute to the formation of CO2 over the Cu surface. For the calcined Cu/ZnO, the reaction can occur only after part of the oxidized Cu surface is activated and reduced by the H from MeOH dehydrogenation (to MeO and m-F). The lattice oxygen can then participate in the reaction. This can be confirmed by the enhancement of reduction degree of the calcined and partially reduced Cu/ZnO after in situ methanol treatment as shown in Table 1. 5 Conclusions 1. Over ZnO surface, MeOH adsorption resulted in methoxy and monodentate-formate adspecies. Increasing the temperature caused the transformation of methoxy to formate. No further reaction occurred on ZnO. However, adspecies migrated to the Cu–ZnO interface and became oxidized when active oxygen was present. 2. Over the calcined Cu/ZnO, methoxy, and formate formed upon MeOH adsorption. Increasing the temperature caused the conversion of methoxy to formate and CO2. The lattice oxygen participated in the oxidation of adspecies only after thermal activation. 3. Over the partially reduced Cu/ZnO, MeOH adsorption at 393K resulted in water and CO2 formation in addition to methoxy, formate, and carbonates. The higher oxidation activity of lattice oxygen suggests a catalytic effect of reduced Cu. 4. Over the completely reduced Cu/ZnO, the sequential dehydrogenation of MeOH appeared in MeOH adsorption and sTPD. In the absence of lattice oxygen, no CO2 formation appeared. Acknowledgment We are obliged to the National Science Council, Taiwan, ROC for the financial support to this research. References [1] M.J.L. Ginés N. Amadeo M. Laborde C.R. Apesteguía Appl. Catal. A 131 1995 283 296 [2] T. Shishido M. Yamamoto D. Li Y. Tian H. Morioka M. Honda T. Sano K. Takehira Appl. Catal. A 303 2006 62 71 [3] W.X. Pan R. Cao D.L. Roberts G.L. Griffin J. Catal. 114 1988 440 446 [4] K.C. Waugh Catal. Today 15 1992 51 75 [5] J.S. Lee K.H. Lee S.Y. Lee Y.G. Kim J. Catal. 144 1993 414 424 [6] S. Fujita M. Usui H. Ito N. Takezawa J. Catal. 157 1995 403 413 [7] J. Nakamura Y. Choi T. Fujitani Top. Catal. 22 2003 277 285 [8] J.G. Nunan C.E. Bogdan K. Klier K.J. Smith C.W. Young R.G. Herman J. Catal. 116 1989 195 221 [9] I. Boz M. Sahibzada I.S. Metcalfe Ind. Eng. Chem. Res. 33 1994 2021 2128 [10] A.M. Hilmen M. Xu M.J.L. Gines E. Iglesia Appl. Catal. A 169 1998 355 372 [11] S.S. Fu G.A. Somorjai J. Phys. Chem. 96 1992 4542 4549 [12] W.H. Cheng Appl. Catal. A 130 1995 13 30 [13] J.Y. Xi Z.F. Wang G.X. Lu Appl. Catal. A 225 2002 77 86 [14] A.Y. Rozovskiil G.I. Lin Top. Catal. 22 2003 137 150 [15] M.V. Twigg M.S. Spencer Top. Catal. 22 2003 191 203 [16] J. Agrell K. Hasselbo K. Jansson S.G. Järås M. Boutonnet Appl. Catal. A 211 2001 239 250 [17] R.M. Navarro M.A. Peña J.L.G. Fierro J. Catal. 212 2002 112 118 [18] L.A. Espinosa R.M. Lago M.A. Peña J.L.G. Fierro Top. Catal. 22 2003 245 251 [19] M.M. Günter T. Ressler R.E. Jentoft B. Bems J. Catal. 203 2001 133 149 [20] Y. Choi H.G. Stenger Appl. Catal. B 38 2002 259 269 [21] H. Purnama T. Ressler R.E. Jentoft H. Soerijanto R. Schlögl R. Schomäcker Appl. Catal. A 259 2004 83 94 [22] B.A. Peppley J.C. Amphlett L.M. Kearns R.F. Mann Appl. Catal. A 179 1999 21 29 [23] B.A. Peppley J.C. Amphlett L.M. Kearns R.F. Mann Appl. Catal. A 179 1999 31 49 [24] H. Kobayashi N. Takezawa C. Minochi J. Catal. 69 1981 487 494 [25] T.L. Reitz P.L. Lee K.F. Czaplewski J.C. Lang K.E. Popp H.H. Kung J. Catal. 199 2001 193 201 [26] L. Alejo R. Lago M.A. Peña J.L.G. Fierro Appl. Catal. A 162 1997 281 297 [27] T.C. Hsiao S.D. Lin J. Mol. Chem. A 277 2007 137 144 [28] S.D. Lin T.C. Hsiao L.C. Chen Appl. Catal. A 360 2009 226 231 [29] G.J. Millar C.H. Rochester J. Chem. Soc. Faraday Trans. 87 1991 1467 1472 [30] G.J. Millar C.H. Rochester J. Chem. Soc. Faraday Trans. 88 1992 2257 2261 [31] K. Mudalige M. Trenary Surf. Sci. 504 2002 208 214 [32] A. Ueno T. Onishi K. Tamaru Trans. Faraday Soc. 67 1971 3585 3589 [33] D.L. Roberts G.L. Griffin J. Catal. 95 1985 617 620 [34] J.P. Camplin E.M. McCash Surf. Sci. 360 1996 229 241 [35] R.L. Brainard R.J. Madix Surf. Sci. 214 1989 396 406 [36] G.J. Millar C.H. Rochester K.C. Waugh J. Chem. Soc. Faraday Trans. 87 1991 2785 2793 [37] I.A. Fisher A.T. Bell J. Catal. 178 1998 153 173 [38] G. Busca T. Montanari C. Resini G. Ramis U. Costantino Catal. Today 143 2009 2 8 [39] G.J. Millar C.H. Rochester K.C. Waugh J. Chem. Soc. Faraday Trans. 88 1992 3497 3503 [40] G.J. Millar C.H. Rochester K.C. Waugh J. Chem. Soc. Faraday Trans. 88 1992 1033 1039 [41] T.H. Ellis H. Wang Langmuir 10 1994 4083 4088 [42] J. Weigel R.A. Koeppel A. Baiker A. Wokaun Langmuir 12 1996 5319 5329 [43] L.-C. Li Y.-W. Wang X. Wang A.-M. Tian N.-B. Wong J. Theor. Comput. Chem. 7 2008 357 365 [44] G. Busca J. Lamotte J.-C. Lavalley V. Lorenzelli J. Am. Chem. Soc. 109 1987 5197 5202 [45] D. Mei L. Xu G. Henkelman J. Phys. Chem. C 113 2009 4522 4537 [46] P. Singnurkar I. Bako H.P. Koch E. Demirci A. Winkler R. Schennach J. Phys. Chem. C 112 2008 14034 14040 [47] A.K. Chen R. Masel Surf. Sci. 343 1995 17 23 [48] J.-Y. Bo S. Zhang K.H. Lim Catal. Lett. 129 2009 444 448 [49] S. Akhter K. Lui H.H. Kung J. Phys. Chem. 89 1985 1958 1964 [50] W.H. Cheng S. Akhter H.H. Kung J. Catal. 82 1983 341 350",
      "scopus-id": "79957992444",
      "coredata": {
        "eid": "1-s2.0-S138111691100149X",
        "dc:description": "Previous research shows that lattice oxygen of Cu catalyst participates in the methanol conversion. In this study, Cu/ZnO catalyst was pretreated to become fully oxidized, partially reduced, or completely reduced. In situ diffuse-reflectance infrared Fourier-transformed spectroscopy (DRIFTS) was used to analyze the methanol (MeOH) adsorption at 393K and a following stepwise temperature-programmed desorption (sTPD). In addition to methoxy and formates appeared after MeOH adsorption, Cu/ZnO catalyst had formaldehyde but no CO2 while the Cu was completely reduced. When the Cu was in the oxidized or partially reduced states, CO2 formed and more formate appeared. Lattice oxygen participated in the MeOH conversion, and the reactivity was higher in the partially reduced Cu/ZnO than in the oxidized Cu/ZnO. This suggests that reduced Cu catalyzes the reaction between MeOH adspecies and lattice oxygen.",
        "openArchiveArticle": "false",
        "prism:coverDate": "2011-06-01",
        "openaccessUserLicense": null,
        "prism:aggregationType": "Journal",
        "prism:url": "https://api.elsevier.com/content/article/pii/S138111691100149X",
        "dc:creator": [
          {
            "@_fa": "true",
            "$": "Lin, Shawn D."
          },
          {
            "@_fa": "true",
            "$": "Cheng, Hongkui"
          },
          {
            "@_fa": "true",
            "$": "Hsiao, Ting C."
          }
        ],
        "link": [
          {
            "@_fa": "true",
            "@rel": "self",
            "@href": "https://api.elsevier.com/content/article/pii/S138111691100149X"
          },
          {
            "@_fa": "true",
            "@rel": "scidir",
            "@href": "https://www.sciencedirect.com/science/article/pii/S138111691100149X"
          }
        ],
        "dc:format": "application/json",
        "openaccessType": null,
        "pii": "S1381-1169(11)00149-X",
        "prism:volume": "342",
        "prism:publisher": "Elsevier B.V.",
        "dc:title": "In situ DRIFTS study on the methanol oxidation by lattice oxygen over Cu/ZnO catalyst",
        "prism:copyright": "Copyright © 2011 Elsevier B.V. All rights reserved.",
        "openaccess": "0",
        "prism:issn": "13811169",
        "dcterms:subject": [
          {
            "@_fa": "true",
            "$": "Methanol"
          },
          {
            "@_fa": "true",
            "$": "DRIFT"
          },
          {
            "@_fa": "true",
            "$": "Stepwise TPD"
          },
          {
            "@_fa": "true",
            "$": "Cu/ZnO"
          }
        ],
        "openaccessArticle": "false",
        "prism:publicationName": "Journal of Molecular Catalysis A: Chemical",
        "openaccessSponsorType": null,
        "prism:pageRange": "35-40",
        "prism:endingPage": "40",
        "pubType": "fla",
        "prism:coverDisplayDate": "1 June 2011",
        "prism:doi": "10.1016/j.molcata.2011.04.007",
        "prism:startingPage": "35",
        "dc:identifier": "doi:10.1016/j.molcata.2011.04.007",
        "openaccessSponsorName": null
      },
      "objects": {
        "object": [
          {
            "@category": "standard",
            "@height": "311",
            "@width": "370",
            "@_fa": "true",
            "$": "https://api.elsevier.com/content/object/eid/1-s2.0-S138111691100149X-gr1.jpg?httpAccept=%2A%2F%2A",
            "@multimediatype": "JPEG image file",
            "@type": "IMAGE-DOWNSAMPLED",
            "@size": "37747",
            "@ref": "gr1",
            "@mimetype": "image/jpeg"
          },
          {
            "@category": "thumbnail",
            "@height": "164",
            "@width": "195",
            "@_fa": "true",
            "$": "https://api.elsevier.com/content/object/eid/1-s2.0-S138111691100149X-gr1.sml?httpAccept=%2A%2F%2A",
            "@multimediatype": "GIF image file",
            "@type": "IMAGE-THUMBNAIL",
            "@size": "7152",
            "@ref": "gr1",
            "@mimetype": "image/gif"
          },
          {
            "@category": "high",
            "@height": "1378",
            "@width": "1640",
            "@_fa": "true",
            "$": "https://api.elsevier.com/content/object/eid/1-s2.0-S138111691100149X-gr1_lrg.jpg?httpAccept=%2A%2F%2A",
            "@multimediatype": "JPEG image file",
            "@type": "IMAGE-HIGH-RES",
            "@size": "327698",
            "@ref": "gr1",
            "@mimetype": "image/jpeg"
          },
          {
            "@category": "standard",
            "@height": "280",
            "@width": "355",
            "@_fa": "true",
            "$": "https://api.elsevier.com/content/object/eid/1-s2.0-S138111691100149X-gr2.jpg?httpAccept=%2A%2F%2A",
            "@multimediatype": "JPEG image file",
            "@type": "IMAGE-DOWNSAMPLED",
            "@size": "35260",
            "@ref": "gr2",
            "@mimetype": "image/jpeg"
          },
          {
            "@category": "thumbnail",
            "@height": "164",
            "@width": "208",
            "@_fa": "true",
            "$": "https://api.elsevier.com/content/object/eid/1-s2.0-S138111691100149X-gr2.sml?httpAccept=%2A%2F%2A",
            "@multimediatype": "GIF image file",
            "@type": "IMAGE-THUMBNAIL",
            "@size": "7795",
            "@ref": "gr2",
            "@mimetype": "image/gif"
          },
          {
            "@category": "high",
            "@height": "1242",
            "@width": "1573",
            "@_fa": "true",
            "$": "https://api.elsevier.com/content/object/eid/1-s2.0-S138111691100149X-gr2_lrg.jpg?httpAccept=%2A%2F%2A",
            "@multimediatype": "JPEG image file",
            "@type": "IMAGE-HIGH-RES",
            "@size": "318417",
            "@ref": "gr2",
            "@mimetype": "image/jpeg"
          },
          {
            "@category": "standard",
            "@height": "286",
            "@width": "362",
            "@_fa": "true",
            "$": "https://api.elsevier.com/content/object/eid/1-s2.0-S138111691100149X-gr3.jpg?httpAccept=%2A%2F%2A",
            "@multimediatype": "JPEG image file",
            "@type": "IMAGE-DOWNSAMPLED",
            "@size": "32265",
            "@ref": "gr3",
            "@mimetype": "image/jpeg"
          },
          {
            "@category": "thumbnail",
            "@height": "164",
            "@width": "208",
            "@_fa": "true",
            "$": "https://api.elsevier.com/content/object/eid/1-s2.0-S138111691100149X-gr3.sml?httpAccept=%2A%2F%2A",
            "@multimediatype": "GIF image file",
            "@type": "IMAGE-THUMBNAIL",
            "@size": "6830",
            "@ref": "gr3",
            "@mimetype": "image/gif"
          },
          {
            "@category": "high",
            "@height": "1265",
            "@width": "1603",
            "@_fa": "true",
            "$": "https://api.elsevier.com/content/object/eid/1-s2.0-S138111691100149X-gr3_lrg.jpg?httpAccept=%2A%2F%2A",
            "@multimediatype": "JPEG image file",
            "@type": "IMAGE-HIGH-RES",
            "@size": "271728",
            "@ref": "gr3",
            "@mimetype": "image/jpeg"
          },
          {
            "@category": "standard",
            "@height": "288",
            "@width": "368",
            "@_fa": "true",
            "$": "https://api.elsevier.com/content/object/eid/1-s2.0-S138111691100149X-gr4.jpg?httpAccept=%2A%2F%2A",
            "@multimediatype": "JPEG image file",
            "@type": "IMAGE-DOWNSAMPLED",
            "@size": "33021",
            "@ref": "gr4",
            "@mimetype": "image/jpeg"
          },
          {
            "@category": "thumbnail",
            "@height": "164",
            "@width": "209",
            "@_fa": "true",
            "$": "https://api.elsevier.com/content/object/eid/1-s2.0-S138111691100149X-gr4.sml?httpAccept=%2A%2F%2A",
            "@multimediatype": "GIF image file",
            "@type": "IMAGE-THUMBNAIL",
            "@size": "7665",
            "@ref": "gr4",
            "@mimetype": "image/gif"
          },
          {
            "@category": "high",
            "@height": "1277",
            "@width": "1631",
            "@_fa": "true",
            "$": "https://api.elsevier.com/content/object/eid/1-s2.0-S138111691100149X-gr4_lrg.jpg?httpAccept=%2A%2F%2A",
            "@multimediatype": "JPEG image file",
            "@type": "IMAGE-HIGH-RES",
            "@size": "311646",
            "@ref": "gr4",
            "@mimetype": "image/jpeg"
          },
          {
            "@category": "standard",
            "@height": "284",
            "@width": "365",
            "@_fa": "true",
            "$": "https://api.elsevier.com/content/object/eid/1-s2.0-S138111691100149X-gr5.jpg?httpAccept=%2A%2F%2A",
            "@multimediatype": "JPEG image file",
            "@type": "IMAGE-DOWNSAMPLED",
            "@size": "33837",
            "@ref": "gr5",
            "@mimetype": "image/jpeg"
          },
          {
            "@category": "thumbnail",
            "@height": "164",
            "@width": "211",
            "@_fa": "true",
            "$": "https://api.elsevier.com/content/object/eid/1-s2.0-S138111691100149X-gr5.sml?httpAccept=%2A%2F%2A",
            "@multimediatype": "GIF image file",
            "@type": "IMAGE-THUMBNAIL",
            "@size": "7526",
            "@ref": "gr5",
            "@mimetype": "image/gif"
          },
          {
            "@category": "high",
            "@height": "1260",
            "@width": "1619",
            "@_fa": "true",
            "$": "https://api.elsevier.com/content/object/eid/1-s2.0-S138111691100149X-gr5_lrg.jpg?httpAccept=%2A%2F%2A",
            "@multimediatype": "JPEG image file",
            "@type": "IMAGE-HIGH-RES",
            "@size": "302797",
            "@ref": "gr5",
            "@mimetype": "image/jpeg"
          },
          {
            "@category": "standard",
            "@height": "275",
            "@width": "356",
            "@_fa": "true",
            "$": "https://api.elsevier.com/content/object/eid/1-s2.0-S138111691100149X-gr6.jpg?httpAccept=%2A%2F%2A",
            "@multimediatype": "JPEG image file",
            "@type": "IMAGE-DOWNSAMPLED",
            "@size": "31632",
            "@ref": "gr6",
            "@mimetype": "image/jpeg"
          },
          {
            "@category": "thumbnail",
            "@height": "164",
            "@width": "212",
            "@_fa": "true",
            "$": "https://api.elsevier.com/content/object/eid/1-s2.0-S138111691100149X-gr6.sml?httpAccept=%2A%2F%2A",
            "@multimediatype": "GIF image file",
            "@type": "IMAGE-THUMBNAIL",
            "@size": "7209",
            "@ref": "gr6",
            "@mimetype": "image/gif"
          },
          {
            "@category": "high",
            "@height": "1218",
            "@width": "1578",
            "@_fa": "true",
            "$": "https://api.elsevier.com/content/object/eid/1-s2.0-S138111691100149X-gr6_lrg.jpg?httpAccept=%2A%2F%2A",
            "@multimediatype": "JPEG image file",
            "@type": "IMAGE-HIGH-RES",
            "@size": "280601",
            "@ref": "gr6",
            "@mimetype": "image/jpeg"
          },
          {
            "@category": "standard",
            "@height": "280",
            "@width": "354",
            "@_fa": "true",
            "$": "https://api.elsevier.com/content/object/eid/1-s2.0-S138111691100149X-gr7.jpg?httpAccept=%2A%2F%2A",
            "@multimediatype": "JPEG image file",
            "@type": "IMAGE-DOWNSAMPLED",
            "@size": "24783",
            "@ref": "gr7",
            "@mimetype": "image/jpeg"
          },
          {
            "@category": "thumbnail",
            "@height": "164",
            "@width": "207",
            "@_fa": "true",
            "$": "https://api.elsevier.com/content/object/eid/1-s2.0-S138111691100149X-gr7.sml?httpAccept=%2A%2F%2A",
            "@multimediatype": "GIF image file",
            "@type": "IMAGE-THUMBNAIL",
            "@size": "6000",
            "@ref": "gr7",
            "@mimetype": "image/gif"
          },
          {
            "@category": "high",
            "@height": "1241",
            "@width": "1568",
            "@_fa": "true",
            "$": "https://api.elsevier.com/content/object/eid/1-s2.0-S138111691100149X-gr7_lrg.jpg?httpAccept=%2A%2F%2A",
            "@multimediatype": "JPEG image file",
            "@type": "IMAGE-HIGH-RES",
            "@size": "215426",
            "@ref": "gr7",
            "@mimetype": "image/jpeg"
          },
          {
            "@category": "standard",
            "@height": "200",
            "@width": "500",
            "@_fa": "true",
            "$": "https://api.elsevier.com/content/object/eid/1-s2.0-S138111691100149X-fx1.jpg?httpAccept=%2A%2F%2A",
            "@multimediatype": "JPEG image file",
            "@type": "IMAGE-DOWNSAMPLED",
            "@size": "18055",
            "@ref": "fx1",
            "@mimetype": "image/jpeg"
          },
          {
            "@category": "thumbnail",
            "@height": "88",
            "@width": "219",
            "@_fa": "true",
            "$": "https://api.elsevier.com/content/object/eid/1-s2.0-S138111691100149X-fx1.sml?httpAccept=%2A%2F%2A",
            "@multimediatype": "GIF image file",
            "@type": "IMAGE-THUMBNAIL",
            "@size": "3432",
            "@ref": "fx1",
            "@mimetype": "image/gif"
          },
          {
            "@category": "high",
            "@height": "886",
            "@width": "2213",
            "@_fa": "true",
            "$": "https://api.elsevier.com/content/object/eid/1-s2.0-S138111691100149X-fx1_lrg.jpg?httpAccept=%2A%2F%2A",
            "@multimediatype": "JPEG image file",
            "@type": "IMAGE-HIGH-RES",
            "@size": "176037",
            "@ref": "fx1",
            "@mimetype": "image/jpeg"
          }
        ]
      },
      "link": {
        "@rel": "abstract",
        "@href": "https://api.elsevier.com/content/abstract/scopus_id/79957992444"
      }
    }
  }
}