{
  "metadata": {
    "title": "The application of a supported palladium catalyst for the hydrogenation of aromatic nitriles",
    "authors": "; ; ",
    "journal": "Journal of Molecular Catalysis A: Chemical",
    "date": "2016-01-31",
    "doi": "10.1016/j.molcata.2015.10.028",
    "abstract": "",
    "uri": "https://api.elsevier.com/content/article/pii/S138111691530131X",
    "pii": "S138111691530131X"
  },
  "fulltext": {
    "full-text-retrieval-response": {
      "scopus-eid": "2-s2.0-84946962716",
      "originalText": "serial JL 271358 291210 291744 291790 291809 31 Journal of Molecular Catalysis A: Chemical JOURNALMOLECULARCATALYSISACHEMICAL 2015-11-01 2015-11-01 2015-11-14 2015-11-14 2015-12-17T13:13:37 1-s2.0-S138111691530131X S1381-1169(15)30131-X S138111691530131X 10.1016/j.molcata.2015.10.028 S300 S300.1 FULL-TEXT 1-s2.0-S1381116915X00136 2016-09-03T12:57:23.100785-04:00 0 0 20160101 20160131 2016 2015-11-01T15:58:34.618471Z absattachment articleinfo articletitlenorm authfirstinitialnorm authfirstsurnamenorm cid cids contenttype copyright crossmark dateloaded dateloadedtxt datesearch datesort dateupdated dco docsubtype doctype doi eid ewtransactionid hubeid indexeddate issn issnnorm itemstage itemtransactionid itemweight openaccess openarchive pg pgfirst pglast pii piinorm pubdateend pubdatestart pubdatetxt pubyr sectiontitle sortorder srctitle srctitlenorm srctype ssids alllist content subj subheadings suppl tomb volfirst volissue volumelist webpdf webpdfpagecount yearnav figure body acknowledge affil articletitle auth authfirstini authfull authkeywords authlast grantsponsor grantsponsorid highlightsabst primabst ref specialabst 1381-1169 13811169 true 411 411 C Volume 411 30 239 246 239 246 201601 January 2016 2016-01-01 2016-01-31 2016 Regular Papers article fla Copyright © 2015 Elsevier B.V. All rights reserved. APPLICATIONASUPPORTEDPALLADIUMCATALYSTFORHYDROGENATIONAROMATICNITRILES MCMILLAN L 1 Introduction 2 Experimental 2.1 Materials 2.2 Hydrogenation reactions 2.3 Analysis 3 Results and discussion 3.1 Single reagent hydrogenation studies 3.1.1 The hydrogenation of benzonitrile (C6H5CN) 3.1.2 The hydrogenation of benzyl cyanide (C6H5CH2CN) 3.1.3 The hydrogenation of 3-phenylpropionitrile (C6H5CH2CH2CN) 3.1.4 The hydrogenation of cinnamonitrile (C6H5CH=CHCN) 3.2 Co-adsorption studies 3.2.1 The co-adsorption of benzonitrile (C6H5CN) and benzylamine (C6H5CH2NH2) 3.2.2 The co-adsorption of benzonitrile (C6H5CN) and benzyl cyanide (C6H5CH2CN) 3.3 Conclusions Acknowledgements References KLEEMANN 1994 A PHARMACEUTICALSUBSTANCESSYNTHESESPATENTSAPPLICATIONS KIRK 1994 R ENCYCLOPEDIACHEMICALTECHNOLOGY SHELDON 2001 R FINECHEMICALSTHROUGHHETEROGENEOUSCATALYSIS SABATIER 1905 482 P VOLF 1986 105 J DEBELLEFON 1994 459 C ORTIZHERNANDEZ 2007 3172 I SCHARRINGER 2008 16 P JUDAY 1955 4559 R BRAUN 1923 1988 J AUGUSTINE 1976 285 R MIGNONAC 1920 114 G HUANG 1999 365 Y DALLONS 1992 J CATALYSISINORGANICREACTIONS HEGEDUS 2005 209 L BOWKER 1998 M BASISAPPLICATIONHETEROGENEOUSCATALYSIS ERTL 1999 G PREPARATIONSOLIDCATALYSTS DEGISCHER 2001 241 O BAWANE 2004 13 S GREENFIELD 1967 142 H CHEN 2005 17 B BAKKER 2010 176 J BORODZINSKI 2006 91 A MOBUS 2014 153 K LENNON 2013 49 D YAP 2012 1179 A YAP 2011 1496 A SEGOBIA 2015 41 D LEAR 2005 174706 T LENNON 2007 219 D KENNEDY 2004 109 D FROST 1961 A KINETICSMECHANISM SHAIKHUTDINOV 2001 330 S RODE 1997 405 C ARAI 1998 1968 J KUKULA 2005 161 P KUKULA 2007 27 P MCMILLANX2016X239 MCMILLANX2016X239X246 MCMILLANX2016X239XL MCMILLANX2016X239X246XL UnderEmbargo 2017-11-14T00:00:00Z http://creativecommons.org/licenses/by-nc-nd/4.0/ item S1381-1169(15)30131-X S138111691530131X 1-s2.0-S138111691530131X 10.1016/j.molcata.2015.10.028 271358 2015-12-17T10:28:02.213264-05:00 2016-01-01 2016-01-31 1-s2.0-S138111691530131X-main.pdf https://s3-eu-west-1.amazonaws.com/prod-ucs-content-store-eu-west/content/pii:S138111691530131X/MAIN/application/pdf/3e7e3cb0719d59815cfe45da01aaceed/main.pdf https://s3.amazonaws.com/prod-ucs-content-store-us-east/content/pii:S138111691530131X/MAIN/application/pdf/3e7e3cb0719d59815cfe45da01aaceed/main.pdf main.pdf pdf true 1534728 MAIN 8 1-s2.0-S138111691530131X-main_1.png https://s3-eu-west-1.amazonaws.com/prod-ucs-content-store-eu-west/content/pii:S138111691530131X/PREVIEW/image/png/f7686d87558127adc79dcb7981f2b08c/main_1.png https://s3.amazonaws.com/prod-ucs-content-store-us-east/content/pii:S138111691530131X/PREVIEW/image/png/f7686d87558127adc79dcb7981f2b08c/main_1.png main_1.png png 55584 849 656 IMAGE-WEB-PDF 1 1-s2.0-S138111691530131X-fx1.sml https://s3-eu-west-1.amazonaws.com/prod-ucs-content-store-eu-west/content/pii:S138111691530131X/fx1/THUMBNAIL/image/gif/37bea5ee60f27b830dd8a046859b938e/fx1.sml https://s3.amazonaws.com/prod-ucs-content-store-us-east/content/pii:S138111691530131X/fx1/THUMBNAIL/image/gif/37bea5ee60f27b830dd8a046859b938e/fx1.sml fx1 true fx1.sml sml 2485 88 219 IMAGE-THUMBNAIL 1-s2.0-S138111691530131X-gr1.sml https://s3-eu-west-1.amazonaws.com/prod-ucs-content-store-eu-west/content/pii:S138111691530131X/gr1/THUMBNAIL/image/gif/02640211f8e4bdeb565b453fdff4a431/gr1.sml https://s3.amazonaws.com/prod-ucs-content-store-us-east/content/pii:S138111691530131X/gr1/THUMBNAIL/image/gif/02640211f8e4bdeb565b453fdff4a431/gr1.sml gr1 gr1.sml sml 12465 155 219 IMAGE-THUMBNAIL 1-s2.0-S138111691530131X-gr2.sml https://s3-eu-west-1.amazonaws.com/prod-ucs-content-store-eu-west/content/pii:S138111691530131X/gr2/THUMBNAIL/image/gif/4c2066fe12ecb33711f0bd841952e3e4/gr2.sml https://s3.amazonaws.com/prod-ucs-content-store-us-east/content/pii:S138111691530131X/gr2/THUMBNAIL/image/gif/4c2066fe12ecb33711f0bd841952e3e4/gr2.sml gr2 gr2.sml sml 15963 153 219 IMAGE-THUMBNAIL 1-s2.0-S138111691530131X-gr3.sml https://s3-eu-west-1.amazonaws.com/prod-ucs-content-store-eu-west/content/pii:S138111691530131X/gr3/THUMBNAIL/image/gif/54b4a1430bf988e2f9a3384003d28322/gr3.sml https://s3.amazonaws.com/prod-ucs-content-store-us-east/content/pii:S138111691530131X/gr3/THUMBNAIL/image/gif/54b4a1430bf988e2f9a3384003d28322/gr3.sml gr3 gr3.sml sml 18663 149 219 IMAGE-THUMBNAIL 1-s2.0-S138111691530131X-gr4.sml https://s3-eu-west-1.amazonaws.com/prod-ucs-content-store-eu-west/content/pii:S138111691530131X/gr4/THUMBNAIL/image/gif/c3d4b44873c2644c2b0097b8566ad311/gr4.sml https://s3.amazonaws.com/prod-ucs-content-store-us-east/content/pii:S138111691530131X/gr4/THUMBNAIL/image/gif/c3d4b44873c2644c2b0097b8566ad311/gr4.sml gr4 gr4.sml sml 16659 142 219 IMAGE-THUMBNAIL 1-s2.0-S138111691530131X-gr5.sml https://s3-eu-west-1.amazonaws.com/prod-ucs-content-store-eu-west/content/pii:S138111691530131X/gr5/THUMBNAIL/image/gif/5a5a8c4813fb9b97852c3e1e5aed0839/gr5.sml https://s3.amazonaws.com/prod-ucs-content-store-us-east/content/pii:S138111691530131X/gr5/THUMBNAIL/image/gif/5a5a8c4813fb9b97852c3e1e5aed0839/gr5.sml gr5 gr5.sml sml 16468 162 219 IMAGE-THUMBNAIL 1-s2.0-S138111691530131X-gr6.sml https://s3-eu-west-1.amazonaws.com/prod-ucs-content-store-eu-west/content/pii:S138111691530131X/gr6/THUMBNAIL/image/gif/da04c9d4dacef50450b315199677f8b8/gr6.sml https://s3.amazonaws.com/prod-ucs-content-store-us-east/content/pii:S138111691530131X/gr6/THUMBNAIL/image/gif/da04c9d4dacef50450b315199677f8b8/gr6.sml gr6 gr6.sml sml 16318 145 219 IMAGE-THUMBNAIL 1-s2.0-S138111691530131X-gr7.sml https://s3-eu-west-1.amazonaws.com/prod-ucs-content-store-eu-west/content/pii:S138111691530131X/gr7/THUMBNAIL/image/gif/79fd204f268935bcfb45144fceeb3b0e/gr7.sml https://s3.amazonaws.com/prod-ucs-content-store-us-east/content/pii:S138111691530131X/gr7/THUMBNAIL/image/gif/79fd204f268935bcfb45144fceeb3b0e/gr7.sml gr7 gr7.sml sml 15626 146 219 IMAGE-THUMBNAIL 1-s2.0-S138111691530131X-gr8.sml https://s3-eu-west-1.amazonaws.com/prod-ucs-content-store-eu-west/content/pii:S138111691530131X/gr8/THUMBNAIL/image/gif/eb78556f35ca0b9ceeb873040cb73306/gr8.sml https://s3.amazonaws.com/prod-ucs-content-store-us-east/content/pii:S138111691530131X/gr8/THUMBNAIL/image/gif/eb78556f35ca0b9ceeb873040cb73306/gr8.sml gr8 gr8.sml sml 16706 164 209 IMAGE-THUMBNAIL 1-s2.0-S138111691530131X-gr9.sml https://s3-eu-west-1.amazonaws.com/prod-ucs-content-store-eu-west/content/pii:S138111691530131X/gr9/THUMBNAIL/image/gif/092869934242438aa8954550936a7f18/gr9.sml https://s3.amazonaws.com/prod-ucs-content-store-us-east/content/pii:S138111691530131X/gr9/THUMBNAIL/image/gif/092869934242438aa8954550936a7f18/gr9.sml gr9 gr9.sml sml 18131 144 219 IMAGE-THUMBNAIL 1-s2.0-S138111691530131X-sc1.sml https://s3-eu-west-1.amazonaws.com/prod-ucs-content-store-eu-west/content/pii:S138111691530131X/sc1/THUMBNAIL/image/gif/28d893d6f0ae8576d536e2a456610b7b/sc1.sml https://s3.amazonaws.com/prod-ucs-content-store-us-east/content/pii:S138111691530131X/sc1/THUMBNAIL/image/gif/28d893d6f0ae8576d536e2a456610b7b/sc1.sml sc1 sc1.sml sml 13841 164 217 IMAGE-THUMBNAIL 1-s2.0-S138111691530131X-sc2.sml https://s3-eu-west-1.amazonaws.com/prod-ucs-content-store-eu-west/content/pii:S138111691530131X/sc2/THUMBNAIL/image/gif/752d73e9cc7fda053d53aec69f2edf99/sc2.sml https://s3.amazonaws.com/prod-ucs-content-store-us-east/content/pii:S138111691530131X/sc2/THUMBNAIL/image/gif/752d73e9cc7fda053d53aec69f2edf99/sc2.sml sc2 sc2.sml sml 7949 30 219 IMAGE-THUMBNAIL 1-s2.0-S138111691530131X-sc3.sml https://s3-eu-west-1.amazonaws.com/prod-ucs-content-store-eu-west/content/pii:S138111691530131X/sc3/THUMBNAIL/image/gif/6cec3cf96dbc1e28ec68fde1f404671a/sc3.sml https://s3.amazonaws.com/prod-ucs-content-store-us-east/content/pii:S138111691530131X/sc3/THUMBNAIL/image/gif/6cec3cf96dbc1e28ec68fde1f404671a/sc3.sml sc3 sc3.sml sml 11031 78 219 IMAGE-THUMBNAIL 1-s2.0-S138111691530131X-fx1.jpg https://s3-eu-west-1.amazonaws.com/prod-ucs-content-store-eu-west/content/pii:S138111691530131X/fx1/DOWNSAMPLED/image/jpeg/35e3f6d2714337a64d6dbd5f1328d4ca/fx1.jpg https://s3.amazonaws.com/prod-ucs-content-store-us-east/content/pii:S138111691530131X/fx1/DOWNSAMPLED/image/jpeg/35e3f6d2714337a64d6dbd5f1328d4ca/fx1.jpg fx1 true fx1.jpg jpg 10002 200 500 IMAGE-DOWNSAMPLED 1-s2.0-S138111691530131X-gr1.jpg https://s3-eu-west-1.amazonaws.com/prod-ucs-content-store-eu-west/content/pii:S138111691530131X/gr1/DOWNSAMPLED/image/jpeg/390f8c21ede5eddc0af2a3a6a7174a96/gr1.jpg https://s3.amazonaws.com/prod-ucs-content-store-us-east/content/pii:S138111691530131X/gr1/DOWNSAMPLED/image/jpeg/390f8c21ede5eddc0af2a3a6a7174a96/gr1.jpg gr1 gr1.jpg jpg 32308 277 393 IMAGE-DOWNSAMPLED 1-s2.0-S138111691530131X-gr2.jpg https://s3-eu-west-1.amazonaws.com/prod-ucs-content-store-eu-west/content/pii:S138111691530131X/gr2/DOWNSAMPLED/image/jpeg/396339ae11ee1ccb7439c26fe517953d/gr2.jpg https://s3.amazonaws.com/prod-ucs-content-store-us-east/content/pii:S138111691530131X/gr2/DOWNSAMPLED/image/jpeg/396339ae11ee1ccb7439c26fe517953d/gr2.jpg gr2 gr2.jpg jpg 33321 274 393 IMAGE-DOWNSAMPLED 1-s2.0-S138111691530131X-gr3.jpg https://s3-eu-west-1.amazonaws.com/prod-ucs-content-store-eu-west/content/pii:S138111691530131X/gr3/DOWNSAMPLED/image/jpeg/01d2d5dd78f0f0f1efb07924732b88d0/gr3.jpg https://s3.amazonaws.com/prod-ucs-content-store-us-east/content/pii:S138111691530131X/gr3/DOWNSAMPLED/image/jpeg/01d2d5dd78f0f0f1efb07924732b88d0/gr3.jpg gr3 gr3.jpg jpg 42775 267 393 IMAGE-DOWNSAMPLED 1-s2.0-S138111691530131X-gr4.jpg https://s3-eu-west-1.amazonaws.com/prod-ucs-content-store-eu-west/content/pii:S138111691530131X/gr4/DOWNSAMPLED/image/jpeg/31856a57e715093fb2ed8f5ab8e546d3/gr4.jpg https://s3.amazonaws.com/prod-ucs-content-store-us-east/content/pii:S138111691530131X/gr4/DOWNSAMPLED/image/jpeg/31856a57e715093fb2ed8f5ab8e546d3/gr4.jpg gr4 gr4.jpg jpg 38531 255 393 IMAGE-DOWNSAMPLED 1-s2.0-S138111691530131X-gr5.jpg https://s3-eu-west-1.amazonaws.com/prod-ucs-content-store-eu-west/content/pii:S138111691530131X/gr5/DOWNSAMPLED/image/jpeg/8b9cb84201efb6a9768334e97488dad2/gr5.jpg https://s3.amazonaws.com/prod-ucs-content-store-us-east/content/pii:S138111691530131X/gr5/DOWNSAMPLED/image/jpeg/8b9cb84201efb6a9768334e97488dad2/gr5.jpg gr5 gr5.jpg jpg 37217 291 393 IMAGE-DOWNSAMPLED 1-s2.0-S138111691530131X-gr6.jpg https://s3-eu-west-1.amazonaws.com/prod-ucs-content-store-eu-west/content/pii:S138111691530131X/gr6/DOWNSAMPLED/image/jpeg/9e228dffea78a44d468393ba4a7df7b6/gr6.jpg https://s3.amazonaws.com/prod-ucs-content-store-us-east/content/pii:S138111691530131X/gr6/DOWNSAMPLED/image/jpeg/9e228dffea78a44d468393ba4a7df7b6/gr6.jpg gr6 gr6.jpg jpg 43240 260 393 IMAGE-DOWNSAMPLED 1-s2.0-S138111691530131X-gr7.jpg https://s3-eu-west-1.amazonaws.com/prod-ucs-content-store-eu-west/content/pii:S138111691530131X/gr7/DOWNSAMPLED/image/jpeg/81cf1ac66ed25cbad5204d87627c4600/gr7.jpg https://s3.amazonaws.com/prod-ucs-content-store-us-east/content/pii:S138111691530131X/gr7/DOWNSAMPLED/image/jpeg/81cf1ac66ed25cbad5204d87627c4600/gr7.jpg gr7 gr7.jpg jpg 41550 262 393 IMAGE-DOWNSAMPLED 1-s2.0-S138111691530131X-gr8.jpg https://s3-eu-west-1.amazonaws.com/prod-ucs-content-store-eu-west/content/pii:S138111691530131X/gr8/DOWNSAMPLED/image/jpeg/a6b34d4cb50733ef12c9da06e4958a67/gr8.jpg https://s3.amazonaws.com/prod-ucs-content-store-us-east/content/pii:S138111691530131X/gr8/DOWNSAMPLED/image/jpeg/a6b34d4cb50733ef12c9da06e4958a67/gr8.jpg gr8 gr8.jpg jpg 36993 307 393 IMAGE-DOWNSAMPLED 1-s2.0-S138111691530131X-gr9.jpg https://s3-eu-west-1.amazonaws.com/prod-ucs-content-store-eu-west/content/pii:S138111691530131X/gr9/DOWNSAMPLED/image/jpeg/0f0bc86386290e3fa95808e950e1c9f9/gr9.jpg https://s3.amazonaws.com/prod-ucs-content-store-us-east/content/pii:S138111691530131X/gr9/DOWNSAMPLED/image/jpeg/0f0bc86386290e3fa95808e950e1c9f9/gr9.jpg gr9 gr9.jpg jpg 47490 259 393 IMAGE-DOWNSAMPLED 1-s2.0-S138111691530131X-sc1.jpg https://s3-eu-west-1.amazonaws.com/prod-ucs-content-store-eu-west/content/pii:S138111691530131X/sc1/DOWNSAMPLED/image/jpeg/0ac35c6aa2a8803f2fac81454e95f146/sc1.jpg https://s3.amazonaws.com/prod-ucs-content-store-us-east/content/pii:S138111691530131X/sc1/DOWNSAMPLED/image/jpeg/0ac35c6aa2a8803f2fac81454e95f146/sc1.jpg sc1 sc1.jpg jpg 44773 399 529 IMAGE-DOWNSAMPLED 1-s2.0-S138111691530131X-sc2.jpg https://s3-eu-west-1.amazonaws.com/prod-ucs-content-store-eu-west/content/pii:S138111691530131X/sc2/DOWNSAMPLED/image/jpeg/8f1778feab50e53444bacf7e91ddb698/sc2.jpg https://s3.amazonaws.com/prod-ucs-content-store-us-east/content/pii:S138111691530131X/sc2/DOWNSAMPLED/image/jpeg/8f1778feab50e53444bacf7e91ddb698/sc2.jpg sc2 sc2.jpg jpg 26546 103 753 IMAGE-DOWNSAMPLED 1-s2.0-S138111691530131X-sc3.jpg https://s3-eu-west-1.amazonaws.com/prod-ucs-content-store-eu-west/content/pii:S138111691530131X/sc3/DOWNSAMPLED/image/jpeg/5b4361e1cc0021446787adfb56f5e2bd/sc3.jpg https://s3.amazonaws.com/prod-ucs-content-store-us-east/content/pii:S138111691530131X/sc3/DOWNSAMPLED/image/jpeg/5b4361e1cc0021446787adfb56f5e2bd/sc3.jpg sc3 sc3.jpg jpg 44233 256 715 IMAGE-DOWNSAMPLED 1-s2.0-S138111691530131X-fx1_lrg.jpg https://s3-eu-west-1.amazonaws.com/prod-ucs-content-store-eu-west/content/pii:S138111691530131X/fx1/HIGHRES/image/jpeg/95a51167d69a1b55cd793a1599f0802f/fx1_lrg.jpg https://s3.amazonaws.com/prod-ucs-content-store-us-east/content/pii:S138111691530131X/fx1/HIGHRES/image/jpeg/95a51167d69a1b55cd793a1599f0802f/fx1_lrg.jpg fx1 true fx1_lrg.jpg jpg 84106 886 2213 IMAGE-HIGH-RES 1-s2.0-S138111691530131X-gr1_lrg.jpg https://s3-eu-west-1.amazonaws.com/prod-ucs-content-store-eu-west/content/pii:S138111691530131X/gr1/HIGHRES/image/jpeg/2988d6306fc98c7bd438166a39dd14c0/gr1_lrg.jpg https://s3.amazonaws.com/prod-ucs-content-store-us-east/content/pii:S138111691530131X/gr1/HIGHRES/image/jpeg/2988d6306fc98c7bd438166a39dd14c0/gr1_lrg.jpg gr1 gr1_lrg.jpg jpg 142019 1230 1742 IMAGE-HIGH-RES 1-s2.0-S138111691530131X-gr2_lrg.jpg https://s3-eu-west-1.amazonaws.com/prod-ucs-content-store-eu-west/content/pii:S138111691530131X/gr2/HIGHRES/image/jpeg/594d25cf6c9348f40b7a8f35b61a7a73/gr2_lrg.jpg https://s3.amazonaws.com/prod-ucs-content-store-us-east/content/pii:S138111691530131X/gr2/HIGHRES/image/jpeg/594d25cf6c9348f40b7a8f35b61a7a73/gr2_lrg.jpg gr2 gr2_lrg.jpg jpg 150078 1213 1741 IMAGE-HIGH-RES 1-s2.0-S138111691530131X-gr3_lrg.jpg https://s3-eu-west-1.amazonaws.com/prod-ucs-content-store-eu-west/content/pii:S138111691530131X/gr3/HIGHRES/image/jpeg/94bd4a23257504aceb6eba13205705a4/gr3_lrg.jpg https://s3.amazonaws.com/prod-ucs-content-store-us-east/content/pii:S138111691530131X/gr3/HIGHRES/image/jpeg/94bd4a23257504aceb6eba13205705a4/gr3_lrg.jpg gr3 gr3_lrg.jpg jpg 204129 1181 1741 IMAGE-HIGH-RES 1-s2.0-S138111691530131X-gr4_lrg.jpg https://s3-eu-west-1.amazonaws.com/prod-ucs-content-store-eu-west/content/pii:S138111691530131X/gr4/HIGHRES/image/jpeg/e53d0a9412846e617a081137c407fdfe/gr4_lrg.jpg https://s3.amazonaws.com/prod-ucs-content-store-us-east/content/pii:S138111691530131X/gr4/HIGHRES/image/jpeg/e53d0a9412846e617a081137c407fdfe/gr4_lrg.jpg gr4 gr4_lrg.jpg jpg 182467 1132 1742 IMAGE-HIGH-RES 1-s2.0-S138111691530131X-gr5_lrg.jpg https://s3-eu-west-1.amazonaws.com/prod-ucs-content-store-eu-west/content/pii:S138111691530131X/gr5/HIGHRES/image/jpeg/4069526aab05af1d9f47e4365a8d50c1/gr5_lrg.jpg https://s3.amazonaws.com/prod-ucs-content-store-us-east/content/pii:S138111691530131X/gr5/HIGHRES/image/jpeg/4069526aab05af1d9f47e4365a8d50c1/gr5_lrg.jpg gr5 gr5_lrg.jpg jpg 167065 1290 1742 IMAGE-HIGH-RES 1-s2.0-S138111691530131X-gr6_lrg.jpg https://s3-eu-west-1.amazonaws.com/prod-ucs-content-store-eu-west/content/pii:S138111691530131X/gr6/HIGHRES/image/jpeg/b8871ddd0d4d662bc00040b7e5b5de53/gr6_lrg.jpg https://s3.amazonaws.com/prod-ucs-content-store-us-east/content/pii:S138111691530131X/gr6/HIGHRES/image/jpeg/b8871ddd0d4d662bc00040b7e5b5de53/gr6_lrg.jpg gr6 gr6_lrg.jpg jpg 211803 1154 1742 IMAGE-HIGH-RES 1-s2.0-S138111691530131X-gr7_lrg.jpg https://s3-eu-west-1.amazonaws.com/prod-ucs-content-store-eu-west/content/pii:S138111691530131X/gr7/HIGHRES/image/jpeg/7900c2378614f5207e216374ad4a3c98/gr7_lrg.jpg https://s3.amazonaws.com/prod-ucs-content-store-us-east/content/pii:S138111691530131X/gr7/HIGHRES/image/jpeg/7900c2378614f5207e216374ad4a3c98/gr7_lrg.jpg gr7 gr7_lrg.jpg jpg 198133 1162 1742 IMAGE-HIGH-RES 1-s2.0-S138111691530131X-gr8_lrg.jpg https://s3-eu-west-1.amazonaws.com/prod-ucs-content-store-eu-west/content/pii:S138111691530131X/gr8/HIGHRES/image/jpeg/ba508db95c782e0a208c99b78097e589/gr8_lrg.jpg https://s3.amazonaws.com/prod-ucs-content-store-us-east/content/pii:S138111691530131X/gr8/HIGHRES/image/jpeg/ba508db95c782e0a208c99b78097e589/gr8_lrg.jpg gr8 gr8_lrg.jpg jpg 148991 1363 1742 IMAGE-HIGH-RES 1-s2.0-S138111691530131X-gr9_lrg.jpg https://s3-eu-west-1.amazonaws.com/prod-ucs-content-store-eu-west/content/pii:S138111691530131X/gr9/HIGHRES/image/jpeg/995d22a120b5091f4063538ef9820cf6/gr9_lrg.jpg https://s3.amazonaws.com/prod-ucs-content-store-us-east/content/pii:S138111691530131X/gr9/HIGHRES/image/jpeg/995d22a120b5091f4063538ef9820cf6/gr9_lrg.jpg gr9 gr9_lrg.jpg jpg 229489 1148 1742 IMAGE-HIGH-RES 1-s2.0-S138111691530131X-sc1_lrg.jpg https://s3-eu-west-1.amazonaws.com/prod-ucs-content-store-eu-west/content/pii:S138111691530131X/sc1/HIGHRES/image/jpeg/0d1266cd150c69b32e3eb57bfbcb6ff7/sc1_lrg.jpg https://s3.amazonaws.com/prod-ucs-content-store-us-east/content/pii:S138111691530131X/sc1/HIGHRES/image/jpeg/0d1266cd150c69b32e3eb57bfbcb6ff7/sc1_lrg.jpg sc1 sc1_lrg.jpg jpg 238724 1768 2342 IMAGE-HIGH-RES 1-s2.0-S138111691530131X-sc2_lrg.jpg https://s3-eu-west-1.amazonaws.com/prod-ucs-content-store-eu-west/content/pii:S138111691530131X/sc2/HIGHRES/image/jpeg/26e3faa6fa1df1cdf4a1d76f5427454c/sc2_lrg.jpg https://s3.amazonaws.com/prod-ucs-content-store-us-east/content/pii:S138111691530131X/sc2/HIGHRES/image/jpeg/26e3faa6fa1df1cdf4a1d76f5427454c/sc2_lrg.jpg sc2 sc2_lrg.jpg jpg 127203 456 3333 IMAGE-HIGH-RES 1-s2.0-S138111691530131X-sc3_lrg.jpg https://s3-eu-west-1.amazonaws.com/prod-ucs-content-store-eu-west/content/pii:S138111691530131X/sc3/HIGHRES/image/jpeg/32effb1c37fff1ad1380d26a9c18d918/sc3_lrg.jpg https://s3.amazonaws.com/prod-ucs-content-store-us-east/content/pii:S138111691530131X/sc3/HIGHRES/image/jpeg/32effb1c37fff1ad1380d26a9c18d918/sc3_lrg.jpg sc3 sc3_lrg.jpg jpg 239777 1133 3167 IMAGE-HIGH-RES MOLCAA 9671 S1381-1169(15)30131-X 10.1016/j.molcata.2015.10.028 Elsevier B.V. Scheme 1 Proposed reaction pathway to primary, secondary and tertiary amines via the reaction of intermediate imine species [11]. Scheme 2 Proposed reaction scheme for the hydrogenation of benzonitrile to benzylamine and subsequent hydrogenolysis to toluene over Pd/C. Scheme 3 Partitioning of adsorbed and liquid phase species in the hydrogenation of benzonitrile over Pd/C. Fig. 1 CO adsorption isotherm for 5% Pd/C at 313K. Fig. 2 CO temperature-programmed desorption profile for a saturation dose of CO on 5% Pd/C. Fig. 3 Reaction profile and mass balance for the hydrogenation of benzonitrile over 0.5g 5% Pd/C, at 333K, 4.0bar g, ca. 0.018mol of benzonitrile. The dashed line represents the incident concentration of benzonitrile. Fig. 4 Reaction profile and hydrogen uptake for the hydrogenation of benzyl cyanide over 0.5g 5% Pd/C, at 333K, 4.0bar g, ca. 0.017mol of benzyl cyanide. A 0 represents the incident concentration of benzylcyanide. Fig. 5 Reaction profile for the hydrogenation of 3-phenylpropionitrile over 0.5g 5% Pd/C at 333K, 4.0bar g, ca. 0.023mol of 3-phenylpropionitrile. A 0 represents the incident concentration of 3-phenylpropionitrile. Fig. 6 Reaction profile for the hydrogenation of cinnamonitrile over 0.5g 5% Pd/C at 333K, 4.0bar g, ca. 0.020mol of cinnamonitrile. A 0 represents the incident concentration of cinnamonitrile. Fig. 7 Reaction profile for the co-hydrogenation of benzonitrile and benzylamine over 5% Pd/C at 338K, 4.0bar g ca. 0.021mol of nitrile and amine. The dashed line represents the incident combined concentration of benzonitrile and benzylamine. Fig. 8 Schematic representation of how the Pd/C affects turnover in the benzonitrile (BN) hydrogenation reaction. Hydrogen dissociation occurs at Site I, hydrogenation occurs at Site II [benzonitrile→benzylamine (BA)] and hydrogenolysis takes place at Site III [benzylamine→toluene (Tol)]. Fig. 9 The co-hydrogenation of benzonitrile and benzyl cyanide over 0.5g 5% Pd/C, 333K, 4.0bar g, ca. 0.017mol of benzonitrile and benzyl cyanide. A 0 represents the incident combined concentration of benzonitrile and benzyl cyanide. N-BPEA= N-benzyl-2-phenethylamine. The application of a supported palladium catalyst for the hydrogenation of aromatic nitriles Liam McMillan a Lauren F. Gilpin a Justin Baker a Colin Brennan b Alan Hall b David T. Lundie c David Lennon a ⁎ a School of Chemistry, Joseph Black Building, University of Glasgow, Glasgow G12 8QQ, UK School of Chemistry Joseph Black Building University of Glasgow Glasgow G12 8QQ UK b Syngenta, Jeallot’s Hill International Research Centre, Bracknell, Berkshire RG42 6EY, UK Syngenta Jeallot’s Hill International Research Centre Bracknell Berkshire RG42 6EY UK c Hiden Analytical Ltd., 420 Europa Boulevard, Warrington WA5 7UN, UK Hiden Analytical Ltd. 420 Europa Boulevard Warrington WA5 7UN UK ⁎ Corresponding author. Graphical abstract The use of a Pd/C catalyst in the liquid phase hydrogenation of various aromatic nitriles (benzonitrile, benzyl cyanide, 3-phenyl propionitrile and cinnamonitrile) has been studied in order to assess the effectiveness of this type of catalyst for this class of reaction. On modifying the nitrile substituent and upon introducing conjugation, varying degrees of conversion are observed. For benzyl cyanide and 3-phenylpropionitrile, incomplete mass balance profiles are linked to spill-over to the carbon support. In the case of benzonitrile hydrogenation, a hydrogenolytic step leads to a loss of selectivity to the primary amine to yield toluene with, ultimately, complete selectivity. Co-hydrogenation measurements on mixtures of benzonitrile and benzylamine indicate the presence of site-selective chemistry. Co-hydrogenation studies on mixtures of benzonitrile and benzyl cyanide highlight the competitive nature of the reaction system and, indirectly, establish a contribution from adsorbed imine species. Keywords Pd/C catalyst Nitrile hydrogenation Hydrogenolysis 1 Introduction The hydrogenation of nitriles to amines is a valuable reaction of significance to many areas of the chemical industry, for example pharmaceuticals and agrichemicals [1–3]. Mechanistic detail of the hydrogenation of nitriles stems from early work reported by Sabatier and Senderens who proposed the hydrogenation to a primary amine occurred via an aldimine intermediate [4]. Historically, it has proven rather difficult to identify intermediate species in the hydrogenation of nitriles, which is attributed to their inherently high reactivity [5,6]. The presence of imines and enamines as intermediates has since been repeatedly established [7,8] and this mechanism is now almost universally accepted [7,9]. In 1923, Braun et al. further developed the understanding of the mechanism, by proposing a route by which secondary or tertiary amines can be formed as a result of a reaction between aldimine intermediates and amine products [10]. Scheme 1 shows some of the possible side reactions that can occur when the primary amine is the target product [11]. The addition of primary amine to intermediate aldimine, followed by subsequent hydrogenolysis leads to the formation of secondary amines. However, an equally valid pathway could be the elimination of ammonia to give a Schiff base, which is then hydrogenated to the final secondary amine [9,12]. The exact mechanisms followed are still under debate, but it has been shown that these further steps can take place on the surface of the catalyst/support system [13,14]. Hydrogenation of the nitrile group is assumed as being a relatively facile transformation [15], but selectivity is of great importance in such reactions, due to the often high-purity requirements of products and multiple possibilities of side reactions [10,16]. Skeletal metal catalysts based on Ni or Co have been used to control selectivity to primary amines [5,17] but considerable care is required in handling such pyrophoric catalysts on scale-up and, moreover, reactions often need to be carried out at relatively high pressure and temperatures [18,19]. Volf and Pasek showed that amongst transition metal catalysts, Rh displayed the highest selectivity to the primary amine. For Pd or Pt supported metal catalysts the reaction can be carried out under milder conditions, enabling hydrogenation of the nitrile group to be carried out without disruption to other functionalities [5], however, selectivity towards the primary amine was not as high. Many factors can influence the selectivity of the reaction in the liquid phase. Catalyst choice is the most important but the temperature, pressure, solvent, mixing conditions and even the type of reactor used can vary the outcome of the reaction. Secondary and tertiary amines are the most widely reported side products due to the highly reactive imine intermediate participating in a series of condensation reactions [19–21]. Nevertheless, Hegedűs and Máthes’ studies on the liquid phase hydrogenation of benzonitrile over a Pd/C catalyst report complete benzonitrile conversion and very high benzylamine selectivity [15], clearly demonstrating the usefulness of supported Pd catalysts for high value hydrogenation reactions of aromatic nitriles. Hydrogenolysis of the primary amine is a recognised side reaction [15] but, historically, has not featured prominently in the heterogeneous catalysis literature. It is often low-yielding and, typically, only occurs under harsh reaction reactions [15]. However, recent work from Bakker and co-workers has highlighted the importance of this reaction pathway in their study of hydrogenation of benzonitrile over a 5% γ-Al2O3 supported Pd catalyst, where toluene was observed as a by-product [22]. Here, the formation of a β-PdH phase at the catalyst surface, populated at hydrogen pressures in excess of 10bar hydrogen pressure were thought to be responsible for preventing the hydrogenolysis reaction, that is mirrored by an increase in the formation of the coupling product dibenzylamine [22]. The formation of β-palladium hydrides has previously been shown to affect the selectivity of other hydrogenation reactions, such as in the hydrogenation of ethyne, were a transition from the alpha to the beta hydride phase decreases ethane selectivity [23]. Further, inelastic neutron scattering (INS) measurements on various Pd supported catalysts has shown the presence of a beta hydride phase to have a noticeable effect on nitrobenzene hydrogenation activity [24]. Recently, INS has also detected the presence of a β-PdH phase during conditions that support selective propyne hydrogenation over a supported Pd catalyst [25]. Maschmeyer and co-workers have examined the hydrogenation and hydrogenolysis of benzonitrile over a carbon-supported Pd catalyst under mild conditions (80°C, 1bar H2) [26]. They report benzylamine to be strongly bound to the catalyst surface and to be capable of reversibly poisoning the hydrogenolysis function. Thus, high yields of the hydrogenolysis product (toluene) are prevented at low catalyst loadings [26]. This work follows on from earlier work from these authors, where they studied the hydrogenolysis of various nitriles, imines and amines over Pd/C [27]. Continuing the investigations of hydrogenation of aromatic nitriles, Segobia and co-workers have looked at the chemoselective hydrogenation of cinnamonitrile over a range of supported metal catalysts [28]. That work, concentrating on the selective formation of the primary amine (cinnamylamine) establishes how the reaction profile may be influenced by the metal catalyst used and also its dispersion. This work concentrates on the effectiveness of a generic carbon-supported Pd catalyst for the hydrogenation of a variety of aromatic nitrile compounds [benzonitrile (C6H5CN)), benzyl cyanide (C6H5CH2CN), 3-phenyl propionitrile (C6H5CH2CH2CN) and cinnamonitrile (C6H5CH=CHCN)] that have application in the fine chemical and agri-chemical industries. Thus, the work builds upon the earlier studies of Maschmeyer and co-workers [27] but concentrates on how the catalyst may be facilitating the chemical transformations observed. In particular, this work explores the interplay between nitrile hydrogenation and associated hydrogenolysis reactions over a supported Pd catalyst. Given the significance of amine chemistry within the fine chemicals sector [1–3], it is important to improve our awareness of how heterogeneous catalysis can be applied to access primary amines via the selective hydrogenation of aromatic nitriles. Reaction trends are considered with respect to issues such as the influence of aliphatic chain length and electronic factors. Significant retention of product by the support material is observed in several cases. Co-hydrogenation studies of benzonitrile and benzylamine are used to gain insight in to the operational phases of the catalyst particles and, importantly, reveal a role for site-selective chemistry. Co-hydrogenation studies on mixtures of benzonitrile and benzyl cyanide highlight the competitive nature of the reaction system and, indirectly, establish a contribution from adsorbed imine species. A reaction scheme is proposed to account for these observations. 2 Experimental 2.1 Materials A commercial grade 5% Pd/C catalyst (Sigma–Aldrich, code number: 205680) was used throughout and was intended to represent a generic fine chemicals hydrogenation catalyst. The percentage metal loading was determined by atomic absorption spectroscopy (PerkinElmer 1100 Atomic Absorption Spectrometer at 247.6nm) and found to be 3.60±0.02%. The CO adsorption isotherm was determined by mass spectrometry (Hiden CATLAB), (Fig. 1 ). A maximum CO capacity of 9.24×10−5 mol CO/gcatalyst was obtained. Assuming a CO:Pd(s) ratio of 1:2 [29], this equates to 1.11×1020 Pd(s) atoms/g(cat), which corresponds to a Pd dispersion of 39 % and a mean particle size of 2.8nm [29]. TEM analysis (JEOL 1200EX) reveals a narrow particle size distribution centred around 2.5nm in diameter, in good agreement with the chemisorption measurements. Fig. 2 shows the CO temperature-programmed desorption profile for the Pd/C catalyst with three features centred around 475, 640 and 850K. The lower CO bands are assigned to CO chemisorption on Pd crystallites, with the higher temperature CO band attributed to (partial) decomposition of carboxy species present on the carbon support material [30]. Benzonitrile (Sigma–Aldrich, 99.9% purity), phenylacetonitrile (Sigma–Aldrich, 98% purity), 3-phenylpropionitrile (Sigma–Aldrich, 99% purity) and cinnamonitrile (Sigma–Aldrich, 97% purity), were used as received. Propan-2-ol (Riedel-de Haën, 99.5% purity) was selected as the solvent in all cases. 2.2 Hydrogenation reactions The hydrogenation reactions were carried out in a 500mL stirred autoclave (Buchi Glas Uster). An automated gas flow controller (BPC 1202) allowed the delivery of inert (N2, BOC, 99.999% purity) and active (H2, BOC, ≥99.995% purity) gases to be delivered directly to the reactor via a gas reservoir. Reactions were heated by silicon oil passed around the reactor via a heating circulator (Julabo F25). The hydrogen uptake provided a direct indication of reaction rate and hydrogen consumption. The reactor was charged with the catalyst (0.5g), then the solvent (300mL, methanol) and the reactor was purged with inert gas (N2). The catalyst/solvent mixture was heated and stirred at 300rpm for 1h under a constant flow of hydrogen in order to reduce the catalyst. Meanwhile, the nitrile substrate (17–23mmol) was dissolved in 50mL of solvent and degassed under a constant flow of helium. Upon addition of the nitrile, stirring was stopped, the reactor sealed and the hydrogen pressure raised. Once reaction pressure (4bar g) was obtained, the reaction mixture was stirred at 800rpm and samples taken periodically via an outlet valve throughout the course of the reaction. An agitation rate of 800rpm corresponded to a mid-point of the plateau region of a plot of hydrogenation rate vs. agitation rate, where increased agitation speeds yield no improvement in hydrogenation rate. In this way, the reaction system was determined to be free from diffusion limitations and to be under kinetic control. All reactions were performed at least in duplicate, with the profiles presented here being representative of the replicate measurements. 2.3 Analysis Liquid samples were collected periodically and filtered (Minisart 0.2μm single use sterile filter) to remove any catalyst residue and analysed off-line. GLC analysis was carried out on a PerkinElmer 8500 Series Gas Chromatograph fitted with a Varian Chrompack CP-Sil 8CB column (30m×0.20mm ID, 0.33μm film). A o (initial concentration of starting material) values were calculated based on the amount of pre-weighed starting material added to the reactor prior to commencement of reaction. Errors in GC output and hydrogen consumption were determined by repeat analysis of a known stock of standards and repeat reactions respectively and both were found to be below 5%. 3 Results and discussion 3.1 Single reagent hydrogenation studies 3.1.1 The hydrogenation of benzonitrile (C6H5CN) Fig. 3 shows the concentration vs. time plot for the liquid phase hydrogenation of benzonitrile over 5% Pd/C at 338K. Benzonitrile was consumed quickly, with full consumption observed at ca. 60min., corresponding to a turnover number of 218. Fig. 3 shows the reaction to be complete at around 75min, with the reaction ultimately returning a complete mass balance. An initial mass imbalance is observed that is in excess of the number of Pd sites, as determined by the CO adsorption isotherm (missing benzonitrile molecules: Pd(s) at 10min=88: 1), therefore it is assumed that this quantity of reagent is retained by the carbon support [31]. The mass balance is recovered following the completion of reaction indicating desorption of organic material from the catalyst. The reaction profile is consistent with a consecutive reaction [32], whereby significant amounts of benzylamine are formed (31% selectivity to benzylamine at 50% benzonitrile conversion), before being consumed by a further reaction to form the undesired toluene (100% toluene selectivity at 100% conversion of benzonitrile). Repeat results at lower temperature and atmospheric pressure also showed significant amounts of toluene formation, by the route indicated in Scheme 2 . No secondary or tertiary amines were formed, in contrast to the generally accepted product distribution of hydrogenation of nitriles over Pd [19–21]. Thus, the hydrogenolysis product is achieved in high yields under mild reaction conditions using low catalyst loadings. Indeed, the complete mass balance evident in Fig. 3 shows that the hydrogenation of benzonitrile is not complicated by a contribution from coupling reactions. Given the modest hydrogen overpressure used here (4bar g), it is assumed that the palladium is buffering hydrogen as chemisorbed hydrogen and sub-surface hydrogen [33]. A role for β-hydride formation within this reaction system, as proposed by Bakker and co-workers [22], is also possible. Bakker et al. looked at this reaction over a Pd/Al2O3 catalyst and reported that toluene can be formed by direct hydrogenolysis of benzonitrile or indirectly from re-adsorbed benzylamine [22]. As the reaction profile presented in Fig. 3 adopts the form of a classic A→B→C consecutive process, it is thought that toluene is exclusively formed here as indicated in Scheme 2 by the hydrogenolysis of benzylamine that has formed via the reduction of the benzonitrile starting material. Further, it is noted that the extent of toluene formed in the present investigation (100% selectivity on completion of reaction) significantly exceeds that reported by Bakker et al., who also experience significant quantities of dibenzylamine production; something not observed here. In contrast to Bakker but in closer agreement to this work, Maschmeyer's and co-workers’ report high toluene yields (over 99% selectivity to toluene for benzonitrile hydrogenation over Pd/C at ca. 1bar H2 [27]), indicating the hydrogenolysis process to be facile in their reactions. Differences in the product distributions between different groups are thought to reflect differences in catalyst specifications and possibly Pd crystallite morphology, or even the type of support that is used. 3.1.2 The hydrogenation of benzyl cyanide (C6H5CH2CN) It was anticipated that benzyl cyanide would be readily hydrogenated to its corresponding primary amine in much the same way as benzonitrile. However, whilst conversion of benzyl cyanide occurred, as was determined by the reaction profile in Fig. 4 , no products were observed in the liquid phase. The hydrogen uptake curve shows that a stoichiometric amount of hydrogen was consumed by the reaction, i.e. sufficient to facilitate complete conversion of benzyl cyanide to phenethylamine (C6H5CH2CH2NH2). From comparisons with the initial mass imbalance for benzonitrile hydrogenation (Section 3.1.1), it is believed that phenethylamine was retained (via strong adsorption of the amine) by the carbon support, since again the number of substrate molecules is in large excess compared with the available Pd surface sites (phenethylamine (missing): Pd(s) at 200min=365: 1). Interestingly, the assumed (total) retention of phenethylamine by the catalyst has not caused catalytic activity to be shut down; this is consistent with the vast majority of the product residing on the high surface area carbon support. Moreover, no ethyl benzene was detected, indicating no hydrogenolysis channel to be accessible in this instance. Previous work has highlighted the relevance of the nitrile unit being in conjugation with the aromatic ring [34]. Although conjugation is absent with benzyl cyanide, the substrate has obtained 100% conversion (albeit with the absence of any detectable products in the liquid phase), so it appears that the nitrile group can be reduced with this catalyst despite no conjugation within the π network (overlap of p orbitals associated with the nitrile functional group and the aromatic ring). To examine this hypothesis further, an extended aliphatic ‘spacer’ unit was examined, Section 3.1.3. 3.1.3 The hydrogenation of 3-phenylpropionitrile (C6H5CH2CH2CN) The reaction profile for the hydrogenation of 3-phenylpropionitrile is seen in Fig. 5 where, in stark contrast to Fig. 3 but consistent with Fig. 4, no products are observed in the liquid phase. Interestingly, the reaction does not produce a complete mass balance, suggesting some degree of substrate/product retention by the catalyst. The quantity of ‘missing’ material (molecules of phenylpropionitrile (missing): Pd(s) at 200min=76: 1), again indicating retention of hydrocarbon by the carbon support. With little perceived conversion of nitrile and minimal hydrogen uptake (ca. 0.005mol H2 consumed; full conversion to primary amine equates to a hydrogen uptake of ca. 0.0335mol H2, i.e. ≈15% conversion), it is suggested that a small quantity of 3-phenylpropionitrile has been hydrogenated to 3-phenylpropylamine (C6H5CH2CH2CH2NH2), where the amine functionality strongly binds to the surface and, thereafter, effectively blocks further catalytic activity. Further, the mass imbalance evident at short reaction times is thought to indicate an initial activity, which is then quenched. Arai et al. have shown that catalyst deactivation in the initial stages of reaction may be attributed to strongly adsorbed amines blocking active sites [35]. Since the substrate concentration is in large excess compared to the surface Pd sites, only a fraction of the mass imbalance would be required to poison such sites. The precise reason why catalytic activity may be retained during production of phenethylamine and yet the assumed formation of 3-phenylpropylamine formation effectively poisons the catalyst is unknown at this time. However, one possible reason could be that, when formed, phenethylamine binds to the carbon support, whereas the 3-phenylpropylamine formed irreversibly binds to the metal. 3.1.4 The hydrogenation of cinnamonitrile (C6H5CH=CHCN) The above section demonstrates problems in hydrogenating 3-phenylpropionitrile. In their work on nitrile reduction for a variety of unsaturated nitrile compounds over a range of Co and Ni based catalysts in the liquid phase, Kukula and Koprivova demonstrated a role for conjugation in affecting the reducability of the nitrile group [36]. Therefore, is it possible that the presence of a double bond in the ring side chain that permits conjugation between the nitrile group and the aromatic ring could be used to induce hydrogenation of the nitrile group and lead to detectable products in the liquid phase? If so, this could be a route to formation of 3-phenylpropylamine. The reaction profile for cinnamonitrile hydrogenation over Pd/C is shown in Fig. 6 and shows hydrogenation of the double bond to yield 3-phenylpropionitrile to be rapid and comprehensive. However, interestingly, no further reduction takes place thereafter, with the nitrile functional unit remaining intact and the system returning a complete mass balance. Thermodynamically, in systems without ammonia, the CC bond has been shown to preferentially adsorb and be selectively reduced in preference to the CN group [37]. This is entirely consistent with Fig. 6, where only reduction of the olefinic unit is seen; no 3-phenylpropylamine is detectable over the full reaction coordinate and the induced conjugation has been ineffectual for enhancing the reducability of the nitrile group. 3.2 Co-adsorption studies 3.2.1 The co-adsorption of benzonitrile (C6H5CN) and benzylamine (C6H5CH2NH2) In order to explore further the consecutive nature of benzonitrile hydrogenation, equimolar amounts of both benzonitrile and benzylamine were studied. These experiments were undertaken in order to determine how the hydrogenation step (benzonitrile→benzylamine) might influence the hydrogenolysis step (benzylamine→toluene) [Scheme 2]. The resulting reaction profile is presented in Fig. 7 and quite definitively shows benzonitrile hydrogenation to be independent of benzylamine hydrogenolysis. The former conforms to a single exponential decay curve (consistent with a first order process) with a rate coefficient comparable to reactions without addition of benzylamine (Section 3.1.1). On the other hand, toluene formation commences from the onset of reaction at a rate that is independent of time/concentration up to a saturation value that represents full conversion. This zero order profile indicates that the hydrogenolysis reaction is occurring independently of the hydrogenation process. This situation is indicative of site-selective chemistry and can be explained within the confines of a 3-site model as depicted in Fig. 8 . Firstly, all processes require a steady supply of hydrogen, so Site I is attributed to Pd sites which support dissociative adsorption of dissolved dihydrogen. Site II is responsible for the hydrogenation step, whilst the hydrogenolysis reaction takes place at Site III. This arrangement would permit hydrogenation and hydrogenolysis to occur simultaneously, as is seen in Fig. 7. We acknowledge that this is in contrast to what Bakker et al. have previously reported [22], where their co-adsorption studies saw a drop in hydrogenation and hydrogenolysis activities, which is attributed to competitive adsorption on the same active sites of the catalyst. It is recognised that Sites I and II, as defined above, could actually be a single site. Namely, hydrogen dissociative adsorption and hydrogenation could occur at the same site, e.g. low index planes of the Pd crystallites. Comparisons between the contrasting profiles presented in Fig. 4 (benzyl cyanide hydrogenation, Section 3.1.2) and 5 (3-phenylpropionitrile hydrogenation, Section 3.1.3) are unhelpful in this matter. In the former case, complete hydrogen uptake is achieved with concomitant conversion of benzyl cyanide, and in the latter case hydrogen uptake and 3-phenylpropionitrile hydrogenation are rapidly halted to comparable degrees. Whereas this coincidence of hydrogen uptake and hydrogenation activity is consistent with a two site model (dissociative hydrogen adsorption/hydrogenation and hydrogenolysis), it can also be explained by the three site hypothesis: (i) in the case of benzyl cyanide hydrogenation, sites I and II are active; (ii) for 3-phenylpropionitrile hydrogenation although sites I and II are initially active, sufficient 3-phenylpropylamine is produced that irreversibly binds to either Site I or Site II, or both Sites I and II, to shut down all hydrogenation activity. Clearly, further work is required, including a Langmuir–Hinshelwood kinetic analysis, to refine the multi-site model, however such an analysis is deemed to be beyond the scope of the present communication. Nevertheless, it is noted that a three-site model is entirely consistent with the reaction profile presented in Fig. 7. Scheme 3 attempts to demonstrate how the molecules participating in the benzonitrile hydrogenation process are partitioned between the catalyst surface and the liquid phase. k 1 and k 2 are rate coefficients associated with the hydrogenation and hydrogenolysis steps respectively. K 1, K 2, K 3 and K 4 represent adsorption coefficients, with K 2 strongly favouring the adsorbed state whilst K4 favours the presence of toluene in the liquid phase. Scheme 3 can be used to describe outcomes seen for nitriles other than benzonitrile. For benzyl cyanide and 3-phenylprionitrile, no amine is seen in the liquid phase in either case. Concentrating on benzyl cyanide first, which exhibits full conversion with associated hydrogen uptake within 200min. (Fig. 4), it is assumed that the absence of phenethylamine indicates that this material is bound to the catalyst surface. However, as the quantity of amine vastly exceeds the surface Pd density (365:1), then this capacity can only be accommodated by the carbon support material. Assuming that hydrogenation only occurs on the metal, one needs to invoke a spillover process where the amine is actually bound to the carbon. In this situation K 3 disfavours partitioning from the metal to the liquid phase and the rate of spillover is a relatively facile process under the conditions examined. The situation is different with 3-phenylprionitrile as, in contrast to benzyl cyanide, only a finite degree of conversion (10–15%) is seen (Fig. 5). Thus, with reference to Scheme 3, it is thought that K 3 strongly favours retention of amine at the metal surface, which effectively poisons the catalyst and prevents any further hydrogenation activity. The fact that the degree of retained substrate molecules exceeds the surface Pd density (76:1) indicates that spillover is occurring in this instance as well. In order to define the more global nature of this reaction system, Scheme 3 needs to include a description for material spilling over on to the carbon support. Fig. 8 schematically links the concepts of the 3 site model with the interchange of molecules between the liquid phase, Pd crystallites and the carbon support. Fig. 8 is defined within the confines of the benzonitrile reaction profile (Fig. 3) but is intended to be generic, in that it provides an overview of the elementary process associated with the liquid phase hydrogenation of aromatic nitriles over a Pd/C catalyst. The initial mass imbalance observed in the hydrogenation of benzonitrile (Fig. 3) is also consistent with the proposed scheme (Fig. 8), if one acknowledges that mass transport of reactants and products can be mediated through the carbon support. Retention of reactants/products on the support, where no further reaction is thought to occur, would thus render that molecule undetectable in the liquid phase. Thus, in the case of benzonitrile hydrogenation at least, this pathway is thought to be the origin of the low mass balance in the initial stages of that reaction. Thereafter, reverse spillover occurs [31]. 3.2.2 The co-adsorption of benzonitrile (C6H5CN) and benzyl cyanide (C6H5CH2CN) To further understand the connection between different amines and hydrogenation lability, the hydrogenation of equimolar amounts of benzonitrile and benzyl cyanide were investigated. Fig. 9 shows the resulting reaction profile. In line with their individual profiles (Figs. 3 and 4 respectively), both reagents are fully converted, although at a slower rate than seen previously. This is thought to reflect competition for hydrogenation sites (Site II). Hydrogen consumption corresponds to a smooth growth curve and stops once no reagents remain. Concentrating first on benzonitrile, a similar profile to Fig. 3 is discernible, with benzylamine displaying an intermediate profile and toluene identified as the final product. However, the profile connected with benzyl cyanide conversion is different to that seen in Fig. 4 because significant quantities of phenethylamine are now seen in Fig. 9. Previously (Section 3.1.2), the absence of this product was attributed to retention by the carbon support. Its presence in the liquid phase in Fig. 9 suggests there to be a degree of competition for adsorption sites on the carbon under co-adsorption conditions. Moreover, the fact it is observable in this case gives some credibility to the assumption that phenethylamine is actually produced but does not partition in to the liquid phase when only benzyl cyanide and dihydrogen are added as reagents (Fig. 4). A further point worth noting in Fig. 9 is the formation of the secondary amine N-benzyl-2-phenethylamine (C6H5CH2CH2-NH-CH2C6H5) via the cross-coupling of intermediate benzylimine (C6H5CH=NH) with phenethylamine, or possibly of phenethyimine (C6H5CH2CH=NH) with benzylamine. No products were observed corresponding to the symmetrical secondary amines that one would expect from the coupling of (i) phenethyimine with phenethylamine or (ii) benzylimine with benzylamine. A small mass imbalance is evident in Fig. 9 (not shown) that may be accounted for by residual phenethylamine on the carbon support. Clearly, the co-adsorption of benzonitrile and benzyl cyanide (Fig. 9) leads to a series of competing interactions which perturb the reaction profiles seen in the single hydrogenation reactions (Figs. 3 and 4). Not least, this includes competition for adsorption sites on the carbon support by the benzyl cyanide derived amine (phenethylamine), as well as the formation of a secondary amine (N-benzyl-2-phenethylamine). Further, since neither benzylimine nor phenethyimine are observed in the liquid phase, it is believed that the coupling reactions that lead to formation of the secondary amine must be catalyst mediated. 3.3 Conclusions The liquid phase hydrogenation of benzonitrile, benzyl cyanide, 3-phenylpropionitrile and cinnamonitrile over a 5wt% Pd/C catalyst was investigated in methanol at 4bar g and 333K. The following observations can be made. • Benzonitrile hydrogenation appears as a consecutive process. First benzonitrile is hydrogenated to form benzylamine. This product then undergoes a hydrogenolysis reaction to form toluene. • Co-hydrogenation studies on a mixture of benzonitrile and benzylamine show the hydrogenation and hydrogenolysis reactions to be occurring simultaneously and independently. This behaviour in interpreted in terms of a 3 site model: dissociative hydrogen adsorption takes place at Site I; hydrogenation takes place at Site II; Site III is associated with the hydrogenolysis reaction. • Benzyl cyanide and 3-phenylpropionitrile hydrogenation result in no product formation in the liquid phase. In the case of 3-phenylpropionitrile loss of activity is attributed to amine product poisoning Pd sites. For benzyl cyanide, converted product is believed to partition on to the carbon support. • 3-phenylpropionitrile is the only product in the hydrogenation of cinnamonitrile. The carbon–carbon double bond is selectively reduced with respect to the carbon-nitrogen triple bond. The conjugation between the nitrile group and the aromatic ring does not assist nitrile reduction in this case. • Hydrogenation of a mixture of benzonitrile and benzyl cyanide indicates the competitive nature of the reaction system. The presence of phenethylamine (source=benzyl cyanide hydrogenation) in to the liquid phase is induced. This coincides with the formation of the secondary amine N-benzyl-2-phenethylamine which, due to the absence of imines in the liquid phase, is thought to form at the catalyst (Pd) surface. Acknowledgements Syngenta and WestChem are thanked for the award of studentships (LM and LG) and research support. Hiden Analytical Ltd. is thanked for assistance with catalyst characterisation procedures. The EPSRC are thanked for support via awards from a Knowledge Transfer Account [EP/H5001138/1] and an Impact Acceleration Account [EP/K503903/1]. References [1] A. Kleemann J. Engel B. Kutscher D. Reichert Pharmaceutical Substances: Syntheses, Patents, Applications 4th ed. 1994 Wiley Interscience New York [2] R. Kirk D. Othmer Encyclopedia of Chemical Technology 4th ed. 1994 Wiley Interscience New York [3] R.A. Sheldon H. van Bekkum Fine Chemicals Through Heterogeneous Catalysis 2001 Wiley-VCH Weinhein [4] P. Sabatier J.B. Senderens C. R. 140 1905 482 [5] J. Volf J. Pasek Stud. Surf. Sci. Catal. 27 1986 105 [6] C. DeBellefon P. Fouilloux Catal. Rev. -Sci. Eng. 36 1994 459 [7] I. Ortiz-Hernandez C. Williams Langmuir 23 2007 3172 [8] P. Scharringer T.E. Muller J.A. Lercher J. catal. 253 2008 16 [9] R. Juday H. Adkins J. Am. Chem. Soc. 77 1955 4559 [10] J.V. Braun G. Blessing F. Zobel Chem. Ber. 56B 1923 1988 [11] R.L. Augustine Catal. Today 13 1976 285 [12] G. Mignonac C. R. 171 1920 114 [13] Y. Huang W. Sachtler Appl. Catal. A. 182 1999 365 [14] J.L. Dallons A.V. Gysel G. Jannes Catalysis in Organic Reactions 1992 Dekker Inc. New York [15] L. Hegedűs T. Máthé Appl. Catal. A 296 2005 209 [16] M. Bowker The basis and Application of Heterogeneous Catalysis 1998 Oxford University Press Oxford [17] G. Ertl H. Knozinger J. Weitkamp Preparation of Solid Catalysts 1999 Weinheim Wiley-VCH [18] O.G. Degischer F. Roessler P. Rys Chem. Ind. Catal. Org. React. 82 2001 241 [19] S.P. Bawane S.B. Sawant Chem. Eng. J. 103 2004 13 [20] H. Greenfield Ind. Eng. Chem. Prod. Res. Dev. 6 1967 142 [21] B. Chen U. Dingerdissen J.G.E. Krauter H.G.J.L. Rotgerink K. Mobus D.J. Ostgard P. Panster T.H. Riermeier S. Seebald T. Tacke H. Trauthwein Appl. Catal. A. 280 2005 17 [22] J.J.W. Bakker A.G. van der Neut M.T. Kreutzer J.A. Moulijn F. Kapteijn J. Catal. 274 2010 176 [23] A. Borodzinski G.C. Bond Catal. Rev. 48 2006 91 [24] K. Möbus E. Grünewald S.D. Wieland S.F. Parker P.W. Albers J. Catal. 311 2014 153 [25] D. Lennon R. Warringham T. Guidi S.F. Parker Chem. Phys. 427 2013 49 [26] A.J. Yap A.F. Masters T. Maschmeyer ChemCatChem 4 2012 1179 [27] A.J. Yap B. Chan A.K.L. Yuen A.J. Ward A.F. Masters T. Maschmeyer ChemCatChem 3 2011 1496 [28] D.J. Segobia A.F. Trasarti C.R. Apesteguia Appl. Cat. A: Gen. 494 2015 41 [29] T. Lear R. Marshall J.A. Lopez-Sanchez S.D. Jackson T.M. Klapötke M. Bäumer G. Rupprechter H.J. Freund D. Lennon J. Chem. Phys. 123 2005 174706 [30] D. Lennon T. Lear N.G. Hamilton Catal. Today 126 2007 219 [31] D.R. Kennedy G. Webb S.D. Jackson D. Lennon Appl. Catal. A. 259 2004 109 [32] A.A. Frost R.G. Pearson Kinetics and Mechanism 1961 New York Wiley [33] S. Shaikhutdinov M. Heemeier M. Bäumer T. Lear D. Lennon R.J. Oldman S.D. Jackson H.-J. Freund J. Catal. 200 2001 330 [34] C.V. Rode M. Arai M. Shirai Y. Nishiyama Appl. Catal. A 148 1997 405 [35] J.M. Arai Y. Takada Y. Nishiyama J. Phys. Chem. 102 1998 1968 [36] P. Kukula K. Koprivova J. Catal. 234 2005 161 [37] P. Kukula V. Gabova K. Koprivova T. Trtik Catal. Today 121 2007 27",
      "scopus-id": "84946962716",
      "coredata": {
        "eid": "1-s2.0-S138111691530131X",
        "dc:description": "The use of a Pd/C catalyst in the liquid phase hydrogenation of various aromatic nitriles (benzonitrile, benzyl cyanide, 3-phenyl propionitrile and cinnamonitrile) has been studied in order to assess the effectiveness of this type of catalyst for this class of reaction. On modifying the nitrile substituent and upon introducing conjugation, varying degrees of conversion are observed. For benzyl cyanide and 3-phenylpropionitrile, incomplete mass balance profiles are linked to spill-over to the carbon support. In the case of benzonitrile hydrogenation, a hydrogenolytic step leads to a loss of selectivity to the primary amine to yield toluene with, ultimately, complete selectivity. Co-hydrogenation measurements on mixtures of benzonitrile and benzylamine indicate the presence of site-selective chemistry. Co-hydrogenation studies on mixtures of benzonitrile and benzyl cyanide highlight the competitive nature of the reaction system and, indirectly, establish a contribution from adsorbed imine species.",
        "openArchiveArticle": "false",
        "prism:coverDate": "2016-01-31",
        "openaccessUserLicense": null,
        "prism:aggregationType": "Journal",
        "prism:url": "https://api.elsevier.com/content/article/pii/S138111691530131X",
        "dc:creator": [
          {
            "@_fa": "true",
            "$": "McMillan, Liam"
          },
          {
            "@_fa": "true",
            "$": "Gilpin, Lauren F."
          },
          {
            "@_fa": "true",
            "$": "Baker, Justin"
          },
          {
            "@_fa": "true",
            "$": "Brennan, Colin"
          },
          {
            "@_fa": "true",
            "$": "Hall, Alan"
          },
          {
            "@_fa": "true",
            "$": "Lundie, David T."
          },
          {
            "@_fa": "true",
            "$": "Lennon, David"
          }
        ],
        "link": [
          {
            "@_fa": "true",
            "@rel": "self",
            "@href": "https://api.elsevier.com/content/article/pii/S138111691530131X"
          },
          {
            "@_fa": "true",
            "@rel": "scidir",
            "@href": "https://www.sciencedirect.com/science/article/pii/S138111691530131X"
          }
        ],
        "dc:format": "application/json",
        "openaccessType": null,
        "pii": "S1381-1169(15)30131-X",
        "prism:volume": "411",
        "prism:publisher": "Elsevier B.V.",
        "dc:title": "The application of a supported palladium catalyst for the hydrogenation of aromatic nitriles",
        "prism:copyright": "Copyright © 2015 Elsevier B.V. All rights reserved.",
        "openaccess": "0",
        "prism:issn": "13811169",
        "dcterms:subject": [
          {
            "@_fa": "true",
            "$": "Pd/C catalyst"
          },
          {
            "@_fa": "true",
            "$": "Nitrile hydrogenation"
          },
          {
            "@_fa": "true",
            "$": "Hydrogenolysis"
          }
        ],
        "openaccessArticle": "false",
        "prism:publicationName": "Journal of Molecular Catalysis A: Chemical",
        "openaccessSponsorType": null,
        "prism:pageRange": "239-246",
        "prism:endingPage": "246",
        "pubType": "fla",
        "prism:coverDisplayDate": "January 2016",
        "prism:doi": "10.1016/j.molcata.2015.10.028",
        "prism:startingPage": "239",
        "dc:identifier": "doi:10.1016/j.molcata.2015.10.028",
        "openaccessSponsorName": null
      },
      "objects": {
        "object": [
          {
            "@category": "thumbnail",
            "@height": "88",
            "@width": "219",
            "@_fa": "true",
            "$": "https://api.elsevier.com/content/object/eid/1-s2.0-S138111691530131X-fx1.sml?httpAccept=%2A%2F%2A",
            "@multimediatype": "GIF image file",
            "@type": "IMAGE-THUMBNAIL",
            "@size": "2485",
            "@ref": "fx1",
            "@mimetype": "image/gif"
          },
          {
            "@category": "thumbnail",
            "@height": "155",
            "@width": "219",
            "@_fa": "true",
            "$": "https://api.elsevier.com/content/object/eid/1-s2.0-S138111691530131X-gr1.sml?httpAccept=%2A%2F%2A",
            "@multimediatype": "GIF image file",
            "@type": "IMAGE-THUMBNAIL",
            "@size": "12465",
            "@ref": "gr1",
            "@mimetype": "image/gif"
          },
          {
            "@category": "thumbnail",
            "@height": "153",
            "@width": "219",
            "@_fa": "true",
            "$": "https://api.elsevier.com/content/object/eid/1-s2.0-S138111691530131X-gr2.sml?httpAccept=%2A%2F%2A",
            "@multimediatype": "GIF image file",
            "@type": "IMAGE-THUMBNAIL",
            "@size": "15963",
            "@ref": "gr2",
            "@mimetype": "image/gif"
          },
          {
            "@category": "thumbnail",
            "@height": "149",
            "@width": "219",
            "@_fa": "true",
            "$": "https://api.elsevier.com/content/object/eid/1-s2.0-S138111691530131X-gr3.sml?httpAccept=%2A%2F%2A",
            "@multimediatype": "GIF image file",
            "@type": "IMAGE-THUMBNAIL",
            "@size": "18663",
            "@ref": "gr3",
            "@mimetype": "image/gif"
          },
          {
            "@category": "thumbnail",
            "@height": "142",
            "@width": "219",
            "@_fa": "true",
            "$": "https://api.elsevier.com/content/object/eid/1-s2.0-S138111691530131X-gr4.sml?httpAccept=%2A%2F%2A",
            "@multimediatype": "GIF image file",
            "@type": "IMAGE-THUMBNAIL",
            "@size": "16659",
            "@ref": "gr4",
            "@mimetype": "image/gif"
          },
          {
            "@category": "thumbnail",
            "@height": "162",
            "@width": "219",
            "@_fa": "true",
            "$": "https://api.elsevier.com/content/object/eid/1-s2.0-S138111691530131X-gr5.sml?httpAccept=%2A%2F%2A",
            "@multimediatype": "GIF image file",
            "@type": "IMAGE-THUMBNAIL",
            "@size": "16468",
            "@ref": "gr5",
            "@mimetype": "image/gif"
          },
          {
            "@category": "thumbnail",
            "@height": "145",
            "@width": "219",
            "@_fa": "true",
            "$": "https://api.elsevier.com/content/object/eid/1-s2.0-S138111691530131X-gr6.sml?httpAccept=%2A%2F%2A",
            "@multimediatype": "GIF image file",
            "@type": "IMAGE-THUMBNAIL",
            "@size": "16318",
            "@ref": "gr6",
            "@mimetype": "image/gif"
          },
          {
            "@category": "thumbnail",
            "@height": "146",
            "@width": "219",
            "@_fa": "true",
            "$": "https://api.elsevier.com/content/object/eid/1-s2.0-S138111691530131X-gr7.sml?httpAccept=%2A%2F%2A",
            "@multimediatype": "GIF image file",
            "@type": "IMAGE-THUMBNAIL",
            "@size": "15626",
            "@ref": "gr7",
            "@mimetype": "image/gif"
          },
          {
            "@category": "thumbnail",
            "@height": "164",
            "@width": "209",
            "@_fa": "true",
            "$": "https://api.elsevier.com/content/object/eid/1-s2.0-S138111691530131X-gr8.sml?httpAccept=%2A%2F%2A",
            "@multimediatype": "GIF image file",
            "@type": "IMAGE-THUMBNAIL",
            "@size": "16706",
            "@ref": "gr8",
            "@mimetype": "image/gif"
          },
          {
            "@category": "thumbnail",
            "@height": "144",
            "@width": "219",
            "@_fa": "true",
            "$": "https://api.elsevier.com/content/object/eid/1-s2.0-S138111691530131X-gr9.sml?httpAccept=%2A%2F%2A",
            "@multimediatype": "GIF image file",
            "@type": "IMAGE-THUMBNAIL",
            "@size": "18131",
            "@ref": "gr9",
            "@mimetype": "image/gif"
          },
          {
            "@category": "thumbnail",
            "@height": "164",
            "@width": "217",
            "@_fa": "true",
            "$": "https://api.elsevier.com/content/object/eid/1-s2.0-S138111691530131X-sc1.sml?httpAccept=%2A%2F%2A",
            "@multimediatype": "GIF image file",
            "@type": "IMAGE-THUMBNAIL",
            "@size": "13841",
            "@ref": "sc1",
            "@mimetype": "image/gif"
          },
          {
            "@category": "thumbnail",
            "@height": "30",
            "@width": "219",
            "@_fa": "true",
            "$": "https://api.elsevier.com/content/object/eid/1-s2.0-S138111691530131X-sc2.sml?httpAccept=%2A%2F%2A",
            "@multimediatype": "GIF image file",
            "@type": "IMAGE-THUMBNAIL",
            "@size": "7949",
            "@ref": "sc2",
            "@mimetype": "image/gif"
          },
          {
            "@category": "thumbnail",
            "@height": "78",
            "@width": "219",
            "@_fa": "true",
            "$": "https://api.elsevier.com/content/object/eid/1-s2.0-S138111691530131X-sc3.sml?httpAccept=%2A%2F%2A",
            "@multimediatype": "GIF image file",
            "@type": "IMAGE-THUMBNAIL",
            "@size": "11031",
            "@ref": "sc3",
            "@mimetype": "image/gif"
          },
          {
            "@category": "standard",
            "@height": "200",
            "@width": "500",
            "@_fa": "true",
            "$": "https://api.elsevier.com/content/object/eid/1-s2.0-S138111691530131X-fx1.jpg?httpAccept=%2A%2F%2A",
            "@multimediatype": "JPEG image file",
            "@type": "IMAGE-DOWNSAMPLED",
            "@size": "10002",
            "@ref": "fx1",
            "@mimetype": "image/jpeg"
          },
          {
            "@category": "standard",
            "@height": "277",
            "@width": "393",
            "@_fa": "true",
            "$": "https://api.elsevier.com/content/object/eid/1-s2.0-S138111691530131X-gr1.jpg?httpAccept=%2A%2F%2A",
            "@multimediatype": "JPEG image file",
            "@type": "IMAGE-DOWNSAMPLED",
            "@size": "32308",
            "@ref": "gr1",
            "@mimetype": "image/jpeg"
          },
          {
            "@category": "standard",
            "@height": "274",
            "@width": "393",
            "@_fa": "true",
            "$": "https://api.elsevier.com/content/object/eid/1-s2.0-S138111691530131X-gr2.jpg?httpAccept=%2A%2F%2A",
            "@multimediatype": "JPEG image file",
            "@type": "IMAGE-DOWNSAMPLED",
            "@size": "33321",
            "@ref": "gr2",
            "@mimetype": "image/jpeg"
          },
          {
            "@category": "standard",
            "@height": "267",
            "@width": "393",
            "@_fa": "true",
            "$": "https://api.elsevier.com/content/object/eid/1-s2.0-S138111691530131X-gr3.jpg?httpAccept=%2A%2F%2A",
            "@multimediatype": "JPEG image file",
            "@type": "IMAGE-DOWNSAMPLED",
            "@size": "42775",
            "@ref": "gr3",
            "@mimetype": "image/jpeg"
          },
          {
            "@category": "standard",
            "@height": "255",
            "@width": "393",
            "@_fa": "true",
            "$": "https://api.elsevier.com/content/object/eid/1-s2.0-S138111691530131X-gr4.jpg?httpAccept=%2A%2F%2A",
            "@multimediatype": "JPEG image file",
            "@type": "IMAGE-DOWNSAMPLED",
            "@size": "38531",
            "@ref": "gr4",
            "@mimetype": "image/jpeg"
          },
          {
            "@category": "standard",
            "@height": "291",
            "@width": "393",
            "@_fa": "true",
            "$": "https://api.elsevier.com/content/object/eid/1-s2.0-S138111691530131X-gr5.jpg?httpAccept=%2A%2F%2A",
            "@multimediatype": "JPEG image file",
            "@type": "IMAGE-DOWNSAMPLED",
            "@size": "37217",
            "@ref": "gr5",
            "@mimetype": "image/jpeg"
          },
          {
            "@category": "standard",
            "@height": "260",
            "@width": "393",
            "@_fa": "true",
            "$": "https://api.elsevier.com/content/object/eid/1-s2.0-S138111691530131X-gr6.jpg?httpAccept=%2A%2F%2A",
            "@multimediatype": "JPEG image file",
            "@type": "IMAGE-DOWNSAMPLED",
            "@size": "43240",
            "@ref": "gr6",
            "@mimetype": "image/jpeg"
          },
          {
            "@category": "standard",
            "@height": "262",
            "@width": "393",
            "@_fa": "true",
            "$": "https://api.elsevier.com/content/object/eid/1-s2.0-S138111691530131X-gr7.jpg?httpAccept=%2A%2F%2A",
            "@multimediatype": "JPEG image file",
            "@type": "IMAGE-DOWNSAMPLED",
            "@size": "41550",
            "@ref": "gr7",
            "@mimetype": "image/jpeg"
          },
          {
            "@category": "standard",
            "@height": "307",
            "@width": "393",
            "@_fa": "true",
            "$": "https://api.elsevier.com/content/object/eid/1-s2.0-S138111691530131X-gr8.jpg?httpAccept=%2A%2F%2A",
            "@multimediatype": "JPEG image file",
            "@type": "IMAGE-DOWNSAMPLED",
            "@size": "36993",
            "@ref": "gr8",
            "@mimetype": "image/jpeg"
          },
          {
            "@category": "standard",
            "@height": "259",
            "@width": "393",
            "@_fa": "true",
            "$": "https://api.elsevier.com/content/object/eid/1-s2.0-S138111691530131X-gr9.jpg?httpAccept=%2A%2F%2A",
            "@multimediatype": "JPEG image file",
            "@type": "IMAGE-DOWNSAMPLED",
            "@size": "47490",
            "@ref": "gr9",
            "@mimetype": "image/jpeg"
          },
          {
            "@category": "standard",
            "@height": "399",
            "@width": "529",
            "@_fa": "true",
            "$": "https://api.elsevier.com/content/object/eid/1-s2.0-S138111691530131X-sc1.jpg?httpAccept=%2A%2F%2A",
            "@multimediatype": "JPEG image file",
            "@type": "IMAGE-DOWNSAMPLED",
            "@size": "44773",
            "@ref": "sc1",
            "@mimetype": "image/jpeg"
          },
          {
            "@category": "standard",
            "@height": "103",
            "@width": "753",
            "@_fa": "true",
            "$": "https://api.elsevier.com/content/object/eid/1-s2.0-S138111691530131X-sc2.jpg?httpAccept=%2A%2F%2A",
            "@multimediatype": "JPEG image file",
            "@type": "IMAGE-DOWNSAMPLED",
            "@size": "26546",
            "@ref": "sc2",
            "@mimetype": "image/jpeg"
          },
          {
            "@category": "standard",
            "@height": "256",
            "@width": "715",
            "@_fa": "true",
            "$": "https://api.elsevier.com/content/object/eid/1-s2.0-S138111691530131X-sc3.jpg?httpAccept=%2A%2F%2A",
            "@multimediatype": "JPEG image file",
            "@type": "IMAGE-DOWNSAMPLED",
            "@size": "44233",
            "@ref": "sc3",
            "@mimetype": "image/jpeg"
          },
          {
            "@category": "high",
            "@height": "886",
            "@width": "2213",
            "@_fa": "true",
            "$": "https://api.elsevier.com/content/object/eid/1-s2.0-S138111691530131X-fx1_lrg.jpg?httpAccept=%2A%2F%2A",
            "@multimediatype": "JPEG image file",
            "@type": "IMAGE-HIGH-RES",
            "@size": "84106",
            "@ref": "fx1",
            "@mimetype": "image/jpeg"
          },
          {
            "@category": "high",
            "@height": "1230",
            "@width": "1742",
            "@_fa": "true",
            "$": "https://api.elsevier.com/content/object/eid/1-s2.0-S138111691530131X-gr1_lrg.jpg?httpAccept=%2A%2F%2A",
            "@multimediatype": "JPEG image file",
            "@type": "IMAGE-HIGH-RES",
            "@size": "142019",
            "@ref": "gr1",
            "@mimetype": "image/jpeg"
          },
          {
            "@category": "high",
            "@height": "1213",
            "@width": "1741",
            "@_fa": "true",
            "$": "https://api.elsevier.com/content/object/eid/1-s2.0-S138111691530131X-gr2_lrg.jpg?httpAccept=%2A%2F%2A",
            "@multimediatype": "JPEG image file",
            "@type": "IMAGE-HIGH-RES",
            "@size": "150078",
            "@ref": "gr2",
            "@mimetype": "image/jpeg"
          },
          {
            "@category": "high",
            "@height": "1181",
            "@width": "1741",
            "@_fa": "true",
            "$": "https://api.elsevier.com/content/object/eid/1-s2.0-S138111691530131X-gr3_lrg.jpg?httpAccept=%2A%2F%2A",
            "@multimediatype": "JPEG image file",
            "@type": "IMAGE-HIGH-RES",
            "@size": "204129",
            "@ref": "gr3",
            "@mimetype": "image/jpeg"
          },
          {
            "@category": "high",
            "@height": "1132",
            "@width": "1742",
            "@_fa": "true",
            "$": "https://api.elsevier.com/content/object/eid/1-s2.0-S138111691530131X-gr4_lrg.jpg?httpAccept=%2A%2F%2A",
            "@multimediatype": "JPEG image file",
            "@type": "IMAGE-HIGH-RES",
            "@size": "182467",
            "@ref": "gr4",
            "@mimetype": "image/jpeg"
          },
          {
            "@category": "high",
            "@height": "1290",
            "@width": "1742",
            "@_fa": "true",
            "$": "https://api.elsevier.com/content/object/eid/1-s2.0-S138111691530131X-gr5_lrg.jpg?httpAccept=%2A%2F%2A",
            "@multimediatype": "JPEG image file",
            "@type": "IMAGE-HIGH-RES",
            "@size": "167065",
            "@ref": "gr5",
            "@mimetype": "image/jpeg"
          },
          {
            "@category": "high",
            "@height": "1154",
            "@width": "1742",
            "@_fa": "true",
            "$": "https://api.elsevier.com/content/object/eid/1-s2.0-S138111691530131X-gr6_lrg.jpg?httpAccept=%2A%2F%2A",
            "@multimediatype": "JPEG image file",
            "@type": "IMAGE-HIGH-RES",
            "@size": "211803",
            "@ref": "gr6",
            "@mimetype": "image/jpeg"
          },
          {
            "@category": "high",
            "@height": "1162",
            "@width": "1742",
            "@_fa": "true",
            "$": "https://api.elsevier.com/content/object/eid/1-s2.0-S138111691530131X-gr7_lrg.jpg?httpAccept=%2A%2F%2A",
            "@multimediatype": "JPEG image file",
            "@type": "IMAGE-HIGH-RES",
            "@size": "198133",
            "@ref": "gr7",
            "@mimetype": "image/jpeg"
          },
          {
            "@category": "high",
            "@height": "1363",
            "@width": "1742",
            "@_fa": "true",
            "$": "https://api.elsevier.com/content/object/eid/1-s2.0-S138111691530131X-gr8_lrg.jpg?httpAccept=%2A%2F%2A",
            "@multimediatype": "JPEG image file",
            "@type": "IMAGE-HIGH-RES",
            "@size": "148991",
            "@ref": "gr8",
            "@mimetype": "image/jpeg"
          },
          {
            "@category": "high",
            "@height": "1148",
            "@width": "1742",
            "@_fa": "true",
            "$": "https://api.elsevier.com/content/object/eid/1-s2.0-S138111691530131X-gr9_lrg.jpg?httpAccept=%2A%2F%2A",
            "@multimediatype": "JPEG image file",
            "@type": "IMAGE-HIGH-RES",
            "@size": "229489",
            "@ref": "gr9",
            "@mimetype": "image/jpeg"
          },
          {
            "@category": "high",
            "@height": "1768",
            "@width": "2342",
            "@_fa": "true",
            "$": "https://api.elsevier.com/content/object/eid/1-s2.0-S138111691530131X-sc1_lrg.jpg?httpAccept=%2A%2F%2A",
            "@multimediatype": "JPEG image file",
            "@type": "IMAGE-HIGH-RES",
            "@size": "238724",
            "@ref": "sc1",
            "@mimetype": "image/jpeg"
          },
          {
            "@category": "high",
            "@height": "456",
            "@width": "3333",
            "@_fa": "true",
            "$": "https://api.elsevier.com/content/object/eid/1-s2.0-S138111691530131X-sc2_lrg.jpg?httpAccept=%2A%2F%2A",
            "@multimediatype": "JPEG image file",
            "@type": "IMAGE-HIGH-RES",
            "@size": "127203",
            "@ref": "sc2",
            "@mimetype": "image/jpeg"
          },
          {
            "@category": "high",
            "@height": "1133",
            "@width": "3167",
            "@_fa": "true",
            "$": "https://api.elsevier.com/content/object/eid/1-s2.0-S138111691530131X-sc3_lrg.jpg?httpAccept=%2A%2F%2A",
            "@multimediatype": "JPEG image file",
            "@type": "IMAGE-HIGH-RES",
            "@size": "239777",
            "@ref": "sc3",
            "@mimetype": "image/jpeg"
          }
        ]
      },
      "link": {
        "@rel": "abstract",
        "@href": "https://api.elsevier.com/content/abstract/scopus_id/84946962716"
      }
    }
  }
}