{
  "metadata": {
    "title": "Preparation of linear low-density polyethylene from ethylene by tandem catalysis of iron and titanium non-metallocene catalysts",
    "authors": "; ; ",
    "journal": "Journal of Molecular Catalysis A: Chemical",
    "date": "2014-03-31",
    "doi": "10.1016/j.molcata.2013.11.024",
    "abstract": "",
    "uri": "https://api.elsevier.com/content/article/pii/S1381116913004469",
    "pii": "S1381116913004469"
  },
  "fulltext": {
    "full-text-retrieval-response": {
      "scopus-eid": "2-s2.0-84891133232",
      "originalText": "serial JL 271358 291210 291744 291790 291809 31 Journal of Molecular Catalysis A: Chemical JOURNALMOLECULARCATALYSISACHEMICAL 2013-12-01 2013-12-01 2014-02-18T00:46:35 1-s2.0-S1381116913004469 S1381-1169(13)00446-9 S1381116913004469 10.1016/j.molcata.2013.11.024 S300 S300.1 FULL-TEXT 1-s2.0-S1381116913X00147 2015-05-15T05:56:33.63776-04:00 0 0 20140301 20140331 2014 2013-12-01T00:00:00Z articleinfo crossmark dco dateupdated tomb dateloaded datesearch indexeddate volumelist yearnav absattachment articletitlenorm authfirstinitialnorm authfirstsurnamenorm cid cids contenttype copyright dateloadedtxt docsubtype doctype doi eid ewtransactionid hubeid issn issnnorm itemstage itemtransactionid itemweight openaccess openarchive pg pgfirst pglast pii piinorm pubdateend pubdatestart pubdatetxt pubyr sortorder srctitle srctitlenorm srctype subheadings suppl volfirst volissue webpdf webpdfpagecount figure table body mmlmath acknowledge affil articletitle auth authfirstini authfull authkeywords authlast highlightsabst primabst ref specialabst alllist content subj ssids 1381-1169 13811169 true 383 384 383 384 C Volumes 383–384 20 121 127 121 127 201403 March 2014 2014-03-01 2014-03-31 2014 article fla Copyright © 2013 Elsevier B.V. All rights reserved. PREPARATIONLINEARLOWDENSITYPOLYETHYLENEETHYLENEBYTANDEMCATALYSISIRONTITANIUMNONMETALLOCENECATALYSTS XIE G 1 Introduction 2 Experimental 2.1 Materials 2.2 Characterization 2.3 Oligomerization procedure 2.4 Ethylene polymerization and in situ copolymerization 3 Results and discussion 3.1 Ethylene oligomerization with iron catalyst 3.2 In situ copolymerization of ethylene with iron and titanium catalysts 3.2.1 Influence of Fe and Ti catalyst molar ratio 3.2.2 Influence of reaction temperature 3.2.3 Influence of Al/(Fe+Ti) molar ratio 4 Conclusions Acknowledgments References BEACH 1984 3027 D KISSIN 1986 1069 Y JOHNSON 1995 6414 L ITTEL 2000 1169 S SUZUKI 2003 293 N GUAN 2003 3680 Z GALLAND 1999 1620 G PELLECCHIA 1999 4491 C IZZO 1999 6913 L IZZO 2001 2 L MELILLO 2002 9256 G CAPACCHIONE 2004 2815 C SCHWERDTFEGER 2008 1080 E ZHU 2000 5006 F ZHU 2000 4258 F YANG 2009 905 M YAN 2009 1966 W YANG 2009 1427 M LIU 2001 1271 Z LIU 2001 1261 Z LIU 2001 509 Z LIU 2001 751 Z LU 2006 2898 Z FURLAN 2004 207 L ZHU 2004 2451 B BARNHART 1998 1082 R KOMON 2000 1830 Z KOMON 2002 15280 Z KOMON 2001 467 Z QUIJADA 2001 2411 R GALLAND 2002 339 G SPERBER 2003 9014 O WETROOS 2004 9314 D WETROOS 2006 6847 D WANG 2003 1546 H ZHANG 2005 984 Z ZHANG 2005 87 Z YE 2004 647 Z ALOBAIDI 2004 4327 F ZHANG 2007 3562 J ZHANG 2008 5369 J BIANCHINI 2005 1218 C TOTI 2008 3092 A BIANCHINI 2008 107 C SCHWERDTFEGER 2010 4838 E SEMERIL 2007 502 D MUSIKABHUMMA 2003 528 K KUHN 2006 827 M XU 2007 2143 H GUO 2010 725 C MILANI 2010 1094 M BRITOVSEK 1999 428 G GIBSON 2003 283 V MAKIO 2009 1532 H MAKIO 2011 2363 H MATSUGI 2008 1264 T PARK 2004 4263 S COLLINS 2011 118 S TAKEUCHI 2010 311 D REDSHAW 2012 4484 C XIE 2008 211 G XIE 2009 796 G XIE 2010 1199 G HU 2004 1684 W WANG 2005 1609 C WANG 2006 3259 C GAO 2007 1511 M GAO 2008 2807 M GAO 2008 62 M YANG 2008 4618 X YANG 2009 8945 X YANG 2009 8099 X CHEN 2003 1231 Y CHEN 2003 4312 Y KISSIN 2006 6159 Y GIBSON 2007 1745 V BIANCHINI 2006 1391 C BIANCHINI 2010 431 C ZHANG 2013 8988 W XIEX2014X121 XIEX2014X121X127 XIEX2014X121XG XIEX2014X121X127XG item S1381-1169(13)00446-9 S1381116913004469 1-s2.0-S1381116913004469 10.1016/j.molcata.2013.11.024 271358 2014-02-18T01:15:07.722476-05:00 2014-03-01 2014-03-31 1-s2.0-S1381116913004469-main.pdf https://s3.amazonaws.com/prod-ucs-content-store-us-east/content/pii:S1381116913004469/MAIN/application/pdf/f1a993f89c9f80ed30a68158fdbe512d/main.pdf https://s3-eu-west-1.amazonaws.com/prod-ucs-content-store-eu-west/content/pii:S1381116913004469/MAIN/application/pdf/f1a993f89c9f80ed30a68158fdbe512d/main.pdf main.pdf pdf true 1032227 MAIN 7 1-s2.0-S1381116913004469-main_1.png https://s3-eu-west-1.amazonaws.com/prod-ucs-content-store-eu-west/content/pii:S1381116913004469/PREVIEW/image/png/4ee8f6e9bac7db6b7008a6e4eb788f25/main_1.png https://s3.amazonaws.com/prod-ucs-content-store-us-east/content/pii:S1381116913004469/PREVIEW/image/png/4ee8f6e9bac7db6b7008a6e4eb788f25/main_1.png main_1.png png 62777 849 656 IMAGE-WEB-PDF 1 1-s2.0-S1381116913004469-si6.gif https://s3.amazonaws.com/prod-ucs-content-store-us-east/content/pii:S1381116913004469/STRIPIN/image/gif/e577d5eed8020af864ff0781f0f0d162/si6.gif https://s3-eu-west-1.amazonaws.com/prod-ucs-content-store-eu-west/content/pii:S1381116913004469/STRIPIN/image/gif/e577d5eed8020af864ff0781f0f0d162/si6.gif si6 si6.gif gif 177 16 18 ALTIMG 1-s2.0-S1381116913004469-si5.gif https://s3.amazonaws.com/prod-ucs-content-store-us-east/content/pii:S1381116913004469/STRIPIN/image/gif/cd40a444a0ffc6a5ae91b2c3749e6f88/si2.gif https://s3-eu-west-1.amazonaws.com/prod-ucs-content-store-eu-west/content/pii:S1381116913004469/STRIPIN/image/gif/cd40a444a0ffc6a5ae91b2c3749e6f88/si2.gif si5 si5.gif gif 188 16 19 ALTIMG 1-s2.0-S1381116913004469-si4.gif https://s3.amazonaws.com/prod-ucs-content-store-us-east/content/pii:S1381116913004469/STRIPIN/image/gif/3739b0c2d19e500587a7d244b376fbe0/si4.gif https://s3-eu-west-1.amazonaws.com/prod-ucs-content-store-eu-west/content/pii:S1381116913004469/STRIPIN/image/gif/3739b0c2d19e500587a7d244b376fbe0/si4.gif si4 si4.gif gif 179 16 18 ALTIMG 1-s2.0-S1381116913004469-si3.gif https://s3.amazonaws.com/prod-ucs-content-store-us-east/content/pii:S1381116913004469/STRIPIN/image/gif/e577d5eed8020af864ff0781f0f0d162/si6.gif https://s3-eu-west-1.amazonaws.com/prod-ucs-content-store-eu-west/content/pii:S1381116913004469/STRIPIN/image/gif/e577d5eed8020af864ff0781f0f0d162/si6.gif si3 si3.gif gif 177 16 18 ALTIMG 1-s2.0-S1381116913004469-si2.gif https://s3.amazonaws.com/prod-ucs-content-store-us-east/content/pii:S1381116913004469/STRIPIN/image/gif/cd40a444a0ffc6a5ae91b2c3749e6f88/si2.gif https://s3-eu-west-1.amazonaws.com/prod-ucs-content-store-eu-west/content/pii:S1381116913004469/STRIPIN/image/gif/cd40a444a0ffc6a5ae91b2c3749e6f88/si2.gif si2 si2.gif gif 188 16 19 ALTIMG 1-s2.0-S1381116913004469-si1.gif https://s3.amazonaws.com/prod-ucs-content-store-us-east/content/pii:S1381116913004469/STRIPIN/image/gif/3739b0c2d19e500587a7d244b376fbe0/si4.gif https://s3-eu-west-1.amazonaws.com/prod-ucs-content-store-eu-west/content/pii:S1381116913004469/STRIPIN/image/gif/3739b0c2d19e500587a7d244b376fbe0/si4.gif si1 si1.gif gif 179 16 18 ALTIMG 1-s2.0-S1381116913004469-sc1_lrg.jpg https://s3.amazonaws.com/prod-ucs-content-store-us-east/content/pii:S1381116913004469/sc1/HIGHRES/image/jpeg/3e565e69cb032e7fcf57b5b4993529b2/sc1_lrg.jpg https://s3-eu-west-1.amazonaws.com/prod-ucs-content-store-eu-west/content/pii:S1381116913004469/sc1/HIGHRES/image/jpeg/3e565e69cb032e7fcf57b5b4993529b2/sc1_lrg.jpg sc1 sc1_lrg.jpg jpg 168380 1429 1675 IMAGE-HIGH-RES 1-s2.0-S1381116913004469-gr6_lrg.jpg https://s3.amazonaws.com/prod-ucs-content-store-us-east/content/pii:S1381116913004469/gr6/HIGHRES/image/jpeg/71c9ad557c8f762a9e8a1d0e3e74b3a3/gr6_lrg.jpg https://s3-eu-west-1.amazonaws.com/prod-ucs-content-store-eu-west/content/pii:S1381116913004469/gr6/HIGHRES/image/jpeg/71c9ad557c8f762a9e8a1d0e3e74b3a3/gr6_lrg.jpg gr6 gr6_lrg.jpg jpg 294153 1829 2523 IMAGE-HIGH-RES 1-s2.0-S1381116913004469-gr5_lrg.jpg https://s3.amazonaws.com/prod-ucs-content-store-us-east/content/pii:S1381116913004469/gr5/HIGHRES/image/jpeg/76c88d6a24f37e9afc88dac10a5aec6f/gr5_lrg.jpg https://s3-eu-west-1.amazonaws.com/prod-ucs-content-store-eu-west/content/pii:S1381116913004469/gr5/HIGHRES/image/jpeg/76c88d6a24f37e9afc88dac10a5aec6f/gr5_lrg.jpg gr5 gr5_lrg.jpg jpg 285536 2362 1574 IMAGE-HIGH-RES 1-s2.0-S1381116913004469-gr4_lrg.jpg https://s3.amazonaws.com/prod-ucs-content-store-us-east/content/pii:S1381116913004469/gr4/HIGHRES/image/jpeg/0c46fc3f3e94a9341be9db79f52ac0b2/gr4_lrg.jpg https://s3-eu-west-1.amazonaws.com/prod-ucs-content-store-eu-west/content/pii:S1381116913004469/gr4/HIGHRES/image/jpeg/0c46fc3f3e94a9341be9db79f52ac0b2/gr4_lrg.jpg gr4 gr4_lrg.jpg jpg 251045 2208 1560 IMAGE-HIGH-RES 1-s2.0-S1381116913004469-gr3_lrg.jpg https://s3.amazonaws.com/prod-ucs-content-store-us-east/content/pii:S1381116913004469/gr3/HIGHRES/image/jpeg/22e2ecd57414d117878dd33a88d10a31/gr3_lrg.jpg https://s3-eu-west-1.amazonaws.com/prod-ucs-content-store-eu-west/content/pii:S1381116913004469/gr3/HIGHRES/image/jpeg/22e2ecd57414d117878dd33a88d10a31/gr3_lrg.jpg gr3 gr3_lrg.jpg jpg 337534 2403 1546 IMAGE-HIGH-RES 1-s2.0-S1381116913004469-fx1_lrg.jpg https://s3.amazonaws.com/prod-ucs-content-store-us-east/content/pii:S1381116913004469/fx1/HIGHRES/image/jpeg/a67c3286f6c99e097beb0a9aa012dc8d/fx1_lrg.jpg https://s3-eu-west-1.amazonaws.com/prod-ucs-content-store-eu-west/content/pii:S1381116913004469/fx1/HIGHRES/image/jpeg/a67c3286f6c99e097beb0a9aa012dc8d/fx1_lrg.jpg fx1 true fx1_lrg.jpg jpg 117750 886 2213 IMAGE-HIGH-RES 1-s2.0-S1381116913004469-gr2_lrg.gif https://s3.amazonaws.com/prod-ucs-content-store-us-east/content/pii:S1381116913004469/gr2/HIGHRES/image/gif/0e16453b94eaf7d9d74cb34a81bd1344/gr2_lrg.gif https://s3-eu-west-1.amazonaws.com/prod-ucs-content-store-eu-west/content/pii:S1381116913004469/gr2/HIGHRES/image/gif/0e16453b94eaf7d9d74cb34a81bd1344/gr2_lrg.gif gr2 gr2_lrg.gif gif 80345 2608 3333 IMAGE-HIGH-RES 1-s2.0-S1381116913004469-gr1_lrg.gif https://s3.amazonaws.com/prod-ucs-content-store-us-east/content/pii:S1381116913004469/gr1/HIGHRES/image/gif/eaf4d3f506aec7e16bdcef62a13eeaa1/gr1_lrg.gif https://s3-eu-west-1.amazonaws.com/prod-ucs-content-store-eu-west/content/pii:S1381116913004469/gr1/HIGHRES/image/gif/eaf4d3f506aec7e16bdcef62a13eeaa1/gr1_lrg.gif gr1 gr1_lrg.gif gif 42427 2277 3350 IMAGE-HIGH-RES 1-s2.0-S1381116913004469-sc1.jpg https://s3.amazonaws.com/prod-ucs-content-store-us-east/content/pii:S1381116913004469/sc1/DOWNSAMPLED/image/jpeg/792add7482396861b99645d7611c2a97/sc1.jpg https://s3-eu-west-1.amazonaws.com/prod-ucs-content-store-eu-west/content/pii:S1381116913004469/sc1/DOWNSAMPLED/image/jpeg/792add7482396861b99645d7611c2a97/sc1.jpg sc1 sc1.jpg jpg 30415 322 378 IMAGE-DOWNSAMPLED 1-s2.0-S1381116913004469-gr6.jpg https://s3.amazonaws.com/prod-ucs-content-store-us-east/content/pii:S1381116913004469/gr6/DOWNSAMPLED/image/jpeg/65c29703286545233dff90046ade17ce/gr6.jpg https://s3-eu-west-1.amazonaws.com/prod-ucs-content-store-eu-west/content/pii:S1381116913004469/gr6/DOWNSAMPLED/image/jpeg/65c29703286545233dff90046ade17ce/gr6.jpg gr6 gr6.jpg jpg 41152 413 570 IMAGE-DOWNSAMPLED 1-s2.0-S1381116913004469-gr5.jpg https://s3.amazonaws.com/prod-ucs-content-store-us-east/content/pii:S1381116913004469/gr5/DOWNSAMPLED/image/jpeg/e2409d062b1a4eb5ab9666c55063c49f/gr5.jpg https://s3-eu-west-1.amazonaws.com/prod-ucs-content-store-eu-west/content/pii:S1381116913004469/gr5/DOWNSAMPLED/image/jpeg/e2409d062b1a4eb5ab9666c55063c49f/gr5.jpg gr5 gr5.jpg jpg 35271 533 355 IMAGE-DOWNSAMPLED 1-s2.0-S1381116913004469-gr4.jpg https://s3.amazonaws.com/prod-ucs-content-store-us-east/content/pii:S1381116913004469/gr4/DOWNSAMPLED/image/jpeg/90dfef0006d7d52b2063e4bf0b22eb74/gr4.jpg https://s3-eu-west-1.amazonaws.com/prod-ucs-content-store-eu-west/content/pii:S1381116913004469/gr4/DOWNSAMPLED/image/jpeg/90dfef0006d7d52b2063e4bf0b22eb74/gr4.jpg gr4 gr4.jpg jpg 29154 498 352 IMAGE-DOWNSAMPLED 1-s2.0-S1381116913004469-gr3.jpg https://s3.amazonaws.com/prod-ucs-content-store-us-east/content/pii:S1381116913004469/gr3/DOWNSAMPLED/image/jpeg/7756d4cfb60967f6b0e100b4080cb959/gr3.jpg https://s3-eu-west-1.amazonaws.com/prod-ucs-content-store-eu-west/content/pii:S1381116913004469/gr3/DOWNSAMPLED/image/jpeg/7756d4cfb60967f6b0e100b4080cb959/gr3.jpg gr3 gr3.jpg jpg 37127 542 349 IMAGE-DOWNSAMPLED 1-s2.0-S1381116913004469-fx1.jpg https://s3.amazonaws.com/prod-ucs-content-store-us-east/content/pii:S1381116913004469/fx1/DOWNSAMPLED/image/jpeg/a3491f8fc4ea681fab2598d2d6f13c6a/fx1.jpg https://s3-eu-west-1.amazonaws.com/prod-ucs-content-store-eu-west/content/pii:S1381116913004469/fx1/DOWNSAMPLED/image/jpeg/a3491f8fc4ea681fab2598d2d6f13c6a/fx1.jpg fx1 true fx1.jpg jpg 16369 200 500 IMAGE-DOWNSAMPLED 1-s2.0-S1381116913004469-gr2.gif https://s3.amazonaws.com/prod-ucs-content-store-us-east/content/pii:S1381116913004469/gr2/DOWNSAMPLED/image/gif/ff699b3692e44f8f2a97bc4eaab65da8/gr2.gif https://s3-eu-west-1.amazonaws.com/prod-ucs-content-store-eu-west/content/pii:S1381116913004469/gr2/DOWNSAMPLED/image/gif/ff699b3692e44f8f2a97bc4eaab65da8/gr2.gif gr2 gr2.gif gif 9110 294 376 IMAGE-DOWNSAMPLED 1-s2.0-S1381116913004469-gr1.gif https://s3.amazonaws.com/prod-ucs-content-store-us-east/content/pii:S1381116913004469/gr1/DOWNSAMPLED/image/gif/2ebf03ead7c7c0a89e46500c78a3904f/gr1.gif https://s3-eu-west-1.amazonaws.com/prod-ucs-content-store-eu-west/content/pii:S1381116913004469/gr1/DOWNSAMPLED/image/gif/2ebf03ead7c7c0a89e46500c78a3904f/gr1.gif gr1 gr1.gif gif 4198 257 378 IMAGE-DOWNSAMPLED 1-s2.0-S1381116913004469-gr2.sml https://s3.amazonaws.com/prod-ucs-content-store-us-east/content/pii:S1381116913004469/gr2/THUMBNAIL/image/gif/0809f329bf4539bf8ce2d48653d419e2/gr2.sml https://s3-eu-west-1.amazonaws.com/prod-ucs-content-store-eu-west/content/pii:S1381116913004469/gr2/THUMBNAIL/image/gif/0809f329bf4539bf8ce2d48653d419e2/gr2.sml gr2 gr2.sml sml 3816 164 209 IMAGE-THUMBNAIL 1-s2.0-S1381116913004469-gr1.sml https://s3.amazonaws.com/prod-ucs-content-store-us-east/content/pii:S1381116913004469/gr1/THUMBNAIL/image/gif/871144e5c343a500e9488a2c48588fb3/gr1.sml https://s3-eu-west-1.amazonaws.com/prod-ucs-content-store-eu-west/content/pii:S1381116913004469/gr1/THUMBNAIL/image/gif/871144e5c343a500e9488a2c48588fb3/gr1.sml gr1 gr1.sml sml 2070 149 219 IMAGE-THUMBNAIL 1-s2.0-S1381116913004469-sc1.sml https://s3.amazonaws.com/prod-ucs-content-store-us-east/content/pii:S1381116913004469/sc1/THUMBNAIL/image/gif/cf961e12ede07c2c4a8f4fd3302f95d3/sc1.sml https://s3-eu-west-1.amazonaws.com/prod-ucs-content-store-eu-west/content/pii:S1381116913004469/sc1/THUMBNAIL/image/gif/cf961e12ede07c2c4a8f4fd3302f95d3/sc1.sml sc1 sc1.sml sml 3810 164 192 IMAGE-THUMBNAIL 1-s2.0-S1381116913004469-gr6.sml https://s3.amazonaws.com/prod-ucs-content-store-us-east/content/pii:S1381116913004469/gr6/THUMBNAIL/image/gif/8f06c734ad25d286dfcd22e6d4694c16/gr6.sml https://s3-eu-west-1.amazonaws.com/prod-ucs-content-store-eu-west/content/pii:S1381116913004469/gr6/THUMBNAIL/image/gif/8f06c734ad25d286dfcd22e6d4694c16/gr6.sml gr6 gr6.sml sml 9408 159 219 IMAGE-THUMBNAIL 1-s2.0-S1381116913004469-gr5.sml https://s3.amazonaws.com/prod-ucs-content-store-us-east/content/pii:S1381116913004469/gr5/THUMBNAIL/image/gif/122aedf4ec074da4ea0e0291630ad10c/gr5.sml https://s3-eu-west-1.amazonaws.com/prod-ucs-content-store-eu-west/content/pii:S1381116913004469/gr5/THUMBNAIL/image/gif/122aedf4ec074da4ea0e0291630ad10c/gr5.sml gr5 gr5.sml sml 3456 164 109 IMAGE-THUMBNAIL 1-s2.0-S1381116913004469-gr4.sml https://s3.amazonaws.com/prod-ucs-content-store-us-east/content/pii:S1381116913004469/gr4/THUMBNAIL/image/gif/40276b06d780734903398434013e6cc2/gr4.sml https://s3-eu-west-1.amazonaws.com/prod-ucs-content-store-eu-west/content/pii:S1381116913004469/gr4/THUMBNAIL/image/gif/40276b06d780734903398434013e6cc2/gr4.sml gr4 gr4.sml sml 3181 164 116 IMAGE-THUMBNAIL 1-s2.0-S1381116913004469-gr3.sml https://s3.amazonaws.com/prod-ucs-content-store-us-east/content/pii:S1381116913004469/gr3/THUMBNAIL/image/gif/2e65cffc504214fcbb2e352ea5749f89/gr3.sml https://s3-eu-west-1.amazonaws.com/prod-ucs-content-store-eu-west/content/pii:S1381116913004469/gr3/THUMBNAIL/image/gif/2e65cffc504214fcbb2e352ea5749f89/gr3.sml gr3 gr3.sml sml 3578 163 105 IMAGE-THUMBNAIL 1-s2.0-S1381116913004469-fx1.sml https://s3.amazonaws.com/prod-ucs-content-store-us-east/content/pii:S1381116913004469/fx1/THUMBNAIL/image/gif/f3cc0381102247bb0e2c8d254511dba6/fx1.sml https://s3-eu-west-1.amazonaws.com/prod-ucs-content-store-eu-west/content/pii:S1381116913004469/fx1/THUMBNAIL/image/gif/f3cc0381102247bb0e2c8d254511dba6/fx1.sml fx1 true fx1.sml sml 2719 88 219 IMAGE-THUMBNAIL MOLCAA 8946 S1381-1169(13)00446-9 10.1016/j.molcata.2013.11.024 Elsevier B.V. Fig. 1 Typical distribution of oligomers catalyzed by 1/MMAO (Run 2 in Table 1). Fig. 2 Typical 13C NMR spectrum of the LLDPE by 1/2/MMAO tandem system (Run 3 in Table 2). Fig. 3 Effects of reaction conditions on 13C NMR spectra of LLDPE: (a) Fe/Ti molar ratio and (b) Al/(Fe+Ti) molar ratio. Fig. 4 DSC thermograms for LLDPE under different conditions: (a) effect of Fe/Ti molar ratio and (b) effect of Al/(Fe+Ti) molar ratio. Fig. 5 Effects of different conditions on GPC curves for LLDPE: (a) Fe/Ti molar ratio and (b) reaction temperature. Fig. 6 Effects of reaction temperature and MMAO usage on distributions of α-olefins in oligomer and branches in LLDPE, (a) effect of temperature on distributions of α-olefins, (b) effect of temperature on distributions of branches, N ′ E , N ′ B and N ′ L refer to the number of ethyl, butyl and long chain branches, respectively, (c) effect of MMAO usage on distributions of α-olefins and (d) effect of MMAO usage on distributions of branches. Scheme 1 Table 1 Ethylene oligomerization catalyzed by Fe complex (1)/MMAO. a Run T (°C) Al/Fe Time (min) Oligomer (C n /Σc, %) Activity b C4 C6 C8 + 1 0 2000 10 19.4 17.0 63.6 0.62 2 25 2000 10 24.8 31.3 43.9 1.54 3 50 2000 10 33.0 33.5 33.5 0.78 4 25 1000 10 38.4 24.2 37.4 1.50 5 25 500 10 43.1 20.4 36.5 1.49 a 1 atmosphere pressure, 4μmol Fe complex (1), 30mL toluene. b 106 gmol−1 h−1 atm−1. Table 2 Preparation of LLDPE by tandem catalysis of Fe (1) and Ti (2) catalysts. a Run Fe/Ti Al/(Fe+Ti) Temp (°C) Act. b T m c (°C) X c c (%) Branching with respect to total [E] units Branch/1000C M w (104) M w/M n N ′ E (%) N ′ B (%) N ′ L (%) 1 0:1 2000 25 1.67 136.7 79.4 0 0 0 0 10.80 2.44 2 1:1 2000 25 1.79 126.2 52.0 0.58 0.34 0 4.6 3.24 3.35 3 2:1 2000 25 2.86 112.8 45.3 1.33 0.68 1.10 15.6 3.68 2.46 4 3:1 2000 25 4.38 113.2, 117.8 44.7 1.53 1.02 0.58 15.7 2.25 2.16 5 4:1 2000 25 6.04 116.0, 119.9 36.8 1.43 0.78 0.65 14.3 2.86 2.13 6 2:1 2000 0 1.28 118.3 46.8 0.74 0.48 0.51 8.7 23.71 1.93 7 2:1 2000 50 1.16 123.8 49.7 0.60 0.30 0 5.4 0.97 3.21 8 2:1 1500 25 2.45 114.9, 119.4 38.9 1.44 0.90 0.90 16.2 2.42 2.89 9 2:1 1000 25 1.54 113.5 34.8 2.03 1.05 1.44 22.6 2.16 2.69 10 2:1 500 25 1.10 109.8 3.8 3.75 1.84 2.26 39.3 7.24 2.57 a 10min, 1 atmosphere pressure, 2μmol Ti complex (1), 40mL toluene. b 106 gmol−1 h−1 atm−1. c Measured by DSC, X c is degree of crystallinity. Preparation of linear low-density polyethylene from ethylene by tandem catalysis of iron and titanium non-metallocene catalysts Guangyong Xie a b ⁎ Xiang Zhang a Tingcheng Li a Long Li a Gongyi Liu a Aiqing Zhang a ⁎⁎ a Key Laboratory of Catalysis and Materials Science of the State Ethnic Affairs Commission and Ministry of Education, Hubei Province, South-Central University for Nationalities, Wuhan 430074, China Key Laboratory of Catalysis and Materials Science of the State Ethnic Affairs Commission and Ministry of Education, Hubei Province, South-Central University for Nationalities Wuhan 430074 China b Ministry of Education Key Laboratory for the Green Preparation and Application of Functional Materials, Hubei University, Wuhan 430062, China Ministry of Education Key Laboratory for the Green Preparation and Application of Functional Materials, Hubei University Wuhan 430062 China ⁎ Corresponding author at: Key Laboratory of Catalysis and Materials Science of the State Ethnic Affairs Commission and Ministry of Education, Hubei Province, South-Central University for Nationalities, Wuhan 430074, China. Tel.: +86 27 67842752; fax: +86 27 67842752. ⁎⁎ Corresponding author. Tel.: +86 27 67843192. Graphical abstract A non-metallocene titanium complex of β-carbonylenamine derived [O−NS]TiCl3 (2), which can form a tandem catalytic system with difluoro-substituted 2,6-bis(imino)pyridyl iron complex (1), was firstly used as in situ copolymerization catalyst to prepare linear low-density polyethylene (LLDPE) with ethylene as the sole monomer stock and MMAO as the only cocatalyst. During the reaction, 1/MMAO oligomerized ethylene to linear α-olefins with high activity and selectivity, while 2/MMAO copolymerized ethylene with the in situ generated α-olefins to LLDPE with high activity (up to 6×106 g/molTihatm). The influences of reaction conditions upon catalytic activity and polymer structures and properties have been researched. The polymers were characterized by differential scanning calorimetry (DSC), high temperature gel permeation chromatography (GPC) and high temperature 13C NMR spectroscopy and proved to be LLDPE with ethyl, butyl as well as longer branches. The branching degrees were tuned efficiently from 4.6 to 39.3/1000C by different reaction conditions such as reaction temperature, Fe/Ti molar ratio and Al/(Fe+Ti) molar ratio. The melting points, degree of crystallinity and molecular weights also changed correspondingly with reaction conditions. Keywords Tandem catalysis In situ copolymerization Linear low-density polyethylene Non-metallocene Branching degree 1 Introduction Linear low-density polyethylene (LLDPE) is an important member of the family of polyethylenes which has better mechanical strength and processability than high-density polyethylene (HDPE) due to the presence of short-chain branches. Typically, LLDPE is obtained by ethylene copolymerization with α-olefin comonomers, such as 1-butene, 1-hexene, and 1-octene with Ziegler–Natta catalysts or recently developed single-site catalysts. However, α-olefins is commonly produced by oligomerization of ethylene. So the production of LLDPE requires integrating two different processes operating at different conditions: one is the oligomerization of ethylene to produce α-olefin comonomers, and the other is the copolymerization of ethylene with the produced α-olefin. LLDPE can also be prepared from ethylene-only stock in a single reactor since both stages use the same monomer, which is well known as tandem catalysis and attracted great interest due to its obvious advantages over the commonly used two-stage process in the costs of plant investment, α-olefin purification, storage, and transport. Tandem catalysis, which was first reported by Beach and Kissin in the 1980s [1], is also called in situ copolymerization and involves the cooperative action of oligomerization and copolymerization catalyst precursors in one reactor. Generally, four strategies can be used to produce branched polyethylene including LLDPE with ethylene as the sole monomer in a single reactor. The first one uses a single catalytic system comprising only one metal complex and one co-catalyst [2–4]. For example, nickel-diimine complexes are efficient in producing LLDPE with short-chain branched (SCB) structures through a catalytic mechanism called chain walking [2]. However, these catalysts produce PE with uncontrolled and randomly distributed short-chain branches (SCB) with predominantly methyl branches [3], and this makes it unsuitable for replacing conventional high α-olefin LLDPE. The second method adopts one catalyst precursor and two types of activators [5,6]. However, few catalyst precursors can be activated by different cocatalysts to provide the tandem catalytic system and it is also difficult to tune the structure of the obtained polyethylene. The third approach involves two catalyst precursors activated with two different co-catalysts [7]. Generally, such catalytic systems presented some problems like the interferences between the oligomerization catalyst and copolymerization catalyst, the catalysts and activators, and moreover, inferior control over the distribution of α-olefin and branching degree of the LLDPE obtained. The last strategy utilizes two or three catalyst precursors activated with only one activator [8], which is the most common method to prepare branched polyethylene since the structure of polymers produced by such in situ copolymerization can be regulated by the ratio of the oligomerization and polymerization catalysts and the reaction conditions. Fe or Cr complexes can be employed as oligomerization catalyst precursors, and metallocenes as the copolymerization precatalysts with MAO or B(C6F5)3 as the only co-catalyst. The catalytic systems employed in the latter three methods are also called dual-functional tandem catalytic systems and generally use Ziegler–Natta or metallocene catalysts as the copolymerization catalysts. In recent years, a great amount of research has been devoted to the development of group 4 non-metallocene catalysts for the controlled synthesis of polyolefin products [9]. Some of these catalysts exhibit good catalytic performances not only for ethylene polymerization but also for copolymerization of ethylene and α-olefin [10,11]. However, up to now, no literature on binary catalyst systems for ethylene using group 4 non-metallocene as copolymerization catalysts was reported. Here we described for the first time the direct synthesis of LLDPE from ethylene in a single reactor by a tandem iron (1) and titanium (2) non-metallocene dual-functional catalyst, which is shown in Scheme 1 . 2 Experimental 2.1 Materials All work involving air- and/or moisture-sensitive compounds was carried out with standard Schlenk techniques. Toluene was distilled from sodium benzophenone ketyl under nitrogen. MMAO (7% aluminum in a heptane solution) was purchased from Akzo Nobel Chemical Inc. All other commercial chemicals are used as received. Fe complex [12(a)] and Ti complex [11(g),11(h)] were prepared in good yields according to the literature. 2.2 Characterization The 1H NMR spectra of ligands and compounds were recorded on a Bruker Avance III 400MHz spectrometer with tetramethylsilane as an internal standard. Elemental analyses were carried out using Vario EL 111. Analysis of α-olefin oligomers was performed by gas chromatography (SHIMADZUGC-17A ATF), using an Alpha-Col AC10 column (30m×0.32mm) and a FID detector. The injector and detector temperature was maintained at 250°C. The program was set with an initial temperature of 30°C (hold 5min), finishing temperature 220°C (hold 10min), and a heating rate of 10°C/min. The 13C NMR data of the ethylene/α-olefin copolymers were obtained on a Varian XL 300MHz spectrometer at 120°C with o-C6D4Cl2 as the solvent. Differential scanning calorimetry (DSC) measurements were performed on a Perkin-Elmer Pyris 1 differential scanning calorimeter. Each sample was heated from 30 to 200°C at a heating rate of 10°C/min and reheated at the same rate. The M n and M w/M n of the polymers were determined at 150°C with a PL-GPC 220 high-temperature chromatograph using a polystyrene calibration. 1,2,4-Trichlorobenzene was employed as the solvent at a flow rate of 1.0mL/min. 2.3 Oligomerization procedure A flame-dried Schlenk flask was twice purged with N2 and charged with ethylene. The desired amount of freshly distilled toluene was transferred into the flask (placed in an oil bath at a desired temperature), and was saturated with ethylene. MMAO were injected into the flask using a syringe and the mixture was stirred for 5min. The oligomerization was started by adding a precursor catalyst solution in toluene with a syringe. After a desired time, the reaction solution was quickly cooled down to −20°C and then quenched with 5ml 5% dilute hydrochloric acid. After washed by water and dried by Na2SO4, the organic compounds were characterized by gas chromatography and GC–MS to determine the composition and molar mass distribution. 2.4 Ethylene polymerization and in situ copolymerization A procedure similar to the oligomerization was used. For the ethylene polymerization, only the solution of polymerization catalyst was added to the reactor. For the in situ copolymerization, the solutions of oligomerization and copolymerization catalysts were added at the same time. After a desired time, the polymerization was quenched with acidified ethanol (100mL, 10vol.% HCl in ethanol). The precipitated polymer was filtered off, washed with ethanol, and then dried under vacuum overnight at 50°C to constant weight. 3 Results and discussion 3.1 Ethylene oligomerization with iron catalyst 2,6-Bis(imino)pyridyl iron complexes activated by MMAO can be used as ethylene oligomerization catalysts to obtain linear α-olefins with high activity [13]. Among them difluoro-substituted 2,6-bis(imino)pyridyl iron complex (1) reported by Qian et al. [12] is one of the most active and selective iron-based ethylene oligomerization catalysts with MMAO as cocatalyst. The influences of reaction temperatures and Al/Fe molar ratio upon catalytic activities and oligomer distributions are researched, and the results are listed in Table 1 . The 1/MMAO has high oligomerization activity with high selectivity for linear α-olefins. The typical distribution of oligomers catalyzed by 1/MMAO (Run 2 in Table 1) is shown in Fig. 1 . The activity can reach 1.54×106 g/molFehatm at 25°C and an Al/Fe ratio of 2000 under 1 atmosphere pressure. The reaction temperature has a great effect on the catalytic activity and the distributions of α-olefins. The activity increased to a maximum from 0 to 25°C, then decreased as temperature rose further to 50°C (Runs 1–3 of Table 1). However, the contents of low carbon constituents including 1-butene and 1-hexene in α-olefins continuously increased with the increase of temperature and at the same time the contents of high carbon ones decreased. The usage of MMAO has a minor effect on catalytic activity, but has a significant impact on oligomer distribution. The increase of Al/Fe molar ratio lowered the content of 1-butene in α-olefins yet increased the proportions of C6 and C8+ (Runs 2, 4 and 5 of Table 1). This change of the constituents in α-olefins would also influence the proportions of different branches in the copolymerized LLDPE. 3.2 In situ copolymerization of ethylene with iron and titanium catalysts LLDPE can be prepared efficiently by tandem catalysis with bisiminopyridyl iron complex (1) and non-metallocene titanium complex (2) as dual-functional catalysts and ethylene as the only stock. The effects of the reaction temperature, Fe/Ti and Al/(Fe+Ti) molar ratios on the copolymerization activities and properties of the copolymers are researched. The branching degrees, molecular weights and melting temperatures are measured by 13C NMR, GPC and DSC, respectively. The results are summarized in Table 2 . It can be found that the melting temperature (T m) and crystallinity of the copolymers catalyzed by 1/2/MMAO decreased compared with those of the polymers catalyzed exclusively by 2/MMAO, which implied that higher amount of α-olefins were produced and incorporated in the main chain. The high temperature 13C NMR spectrum further confirmed the branching structure (Fig. 2 ), and the branching degrees are determined accordingly. According to ref. [8(f)], the presence of ethyl branches are indicated by the resonances at δ 11.19ppm, δ 26.95ppm, and δ 39.97ppm, the butyl branches at δ 23.36ppm and δ 29.57ppm, and the longer branches (n ≥6) at δ 13.94ppm, δ 22.82ppm, δ 32.19ppm, and δ 38.45ppm. The 13C NMR spectrum showed that the obtained polyethylene was LLDPE with various branches, including ethyl, butyl, and longer branches. Further more, the branching degrees and branching structures could be tuned efficiently by reaction conditions. 3.2.1 Influence of Fe and Ti catalyst molar ratio A clear change in activity with different Fe/Ti molar ratios was observed, as seen from Runs 1 to 5 of Table 2. The activity increased from 1.67×106 to 6.04×106 g/molTihatm when the Fe/Ti molar ratio increased from 0:1 to 4:1, which may be explained by a positive comonomer effect. More α-olefins would be produced with more oligomerization catalyst added, thus leads to higher calculated activities for Ti complex. These results are similar to the copolymerization of ethylene and α-olefin catalyzed only by Ti complex reported by Tang's group [11h]. Fig. 3a shows the high temperature 13C NMR spectra of obtained polymers with different catalyst ratios. It can be found that the polymer produced by Ti complex exhibits only a single peak, typical of the main chain of HDPE. Whereas branching peaks, including those of ethyl, butyl, and longer branches which are characteristic of LLDPE are observed when Fe and Ti catalysts are used together. The branching degrees calculated from 13C NMR spectra increased from 0 to a maximum of 15.6/1000C as Fe/Ti molar ratio increased from 0:1 to 2:1, then decreased slightly to 14.3/1000C when the ratio increased to 4:1 (Runs 1–5 of Table 2). This may be a result of the strong positive comonomer effect, which stems from a faster increase of the activity of Ti complex than that afforded by the increased amount of Fe oligomerization catalyst. For example, when the molar ratio was increased from 2:1 to 4:1, the amount of oligomerization catalyst was increased twofold, yet the activity of copolymerization catalyst was increased 2.11 times (Runs 3 and 5 of Table 2). From DSC data in Fig. 4a, it can be found that the T m's of the produced LLDPE decreased substantially from 136.7°C to 112.8°C as the Fe/Ti molar ratio increased from 0:1 to 2:1. This is not unexpected since as more oligomerization catalyst (the Fe complex 1) is added, more α-olefins will be produced and incorporated into the polymer backbone, hence the increase of branching degree and the decrease of crystallinity. When the Fe/Ti molar ratio increased further to 3:1 and 4:1, the T m's however increased a little instead, suggesting a decrease of branching degree. These results are consistent with the 13C NMR spectra. In addition, apparent double melting peaks are observed with a Fe/Ti molar ratio of 3:1 and 4:1, and in the other cases they may also be present, just that they are too close to see clearly. It is possible that the Ti pre-catalyst forms two active species of a similar nature when it reacts with MMAO. These two species react slightly differently with the formed oligomers and produce copolymers of a slightly different composition melting at slightly different temperatures. This also is probably why the M w/M n ratio is higher than 2.0. Another possible reason may be attributed to the change of relative concentration of comonomers during the reaction, which would lead to the formation of mixtures of polyethylenes with different branching. A similar phenomenon has been reported in the literature [7(f),8(k),8(s)]. The molecular weight distribution (MWD) curves of polymers produced in different Fe/Ti ratios are shown in Fig. 5a. The copolymers have lower weight–average molecular weights than that of the homo-PE produced with 2/MMAO under the same reaction conditions due to the incorporation of α-olefins. 3.2.2 Influence of reaction temperature The polymerization temperature influences greatly not only the catalytic activities but also the structure of polymers. From Runs 3, 6 and 7 of Table 2, when the reaction temperature increased from 0 to 50°C, the copolymerization activities increased to a maximum at 25°C and then decreased, so did the branching degrees. On one hand, the Ti complex itself has the highest copolymerization activity at 25°C, on the other hand, largest amount of oligomers would be produced by Fe complex at 25°C, which would augment the copolymerization activity due to the positive comonomer effect. The polymer produced at 25°C also has lowest T m and crystallinity compared with those made at 0 and 50°C. The branching degree was 15.6/1000C at 25°C, but decreased at either higher or lower temperature. These results indicate that the two catalysts have better match and synergy at room temperature than at other temperatures. The GPC curves of copolymers at different polymerization temperatures are shown in Fig. 5b. Enhancing the temperatures from 0 to 50°C decreased rapidly the M w from 23.71×104 g/mol to 0.97×104 g/mol but increased the MWD from 1.93 to 3.21. Fig. 6b exhibits the percentage of different branches among total branches. The proportions of ethyl branches are between 40% and 70%, and higher temperature would result in higher proportions of ethyl branches and lower amount of longer branches, which is also in agreement with the changing of the distribution of α-olefins produced by Fe catalyst at corresponding temperatures (Fig. 6a). In addition, the proportion of ethyl branches is more than the content of 1-butene in α-olefins at the same reaction temperature, which illustrates that short chain 1-butene has higher reactivity than the other longer chain α-olefins and is much easier to insert into the main chain. 3.2.3 Influence of Al/(Fe+Ti) molar ratio The molar ratio of Al/(Fe+Ti) also has a significant effect on the catalytic activities as well as the polymer structures. As the Al/(Fe+Ti) ratio increased from 500 to 2000, the activity of the oligomerization catalyst was almost unchanged (Table 1), but the activity of the copolymerization catalyst increased, as did the in situ copolymerization activity. Because the amounts of the comonomers afforded by oligomerization were almost the same, the average branching degrees of the resulting products would decrease, as presented in Table 2. Fig. 3b shows the high temperature 13C NMR spectra of polymers obtained at different Al/(Fe+Ti) ratios, from which it can be found that the intensity of branches decreased as the Al/(Fe+Ti) ratio increased. A calculation revealed that the branching degree lowered gradually from 39.3 to 15.6/1000C along with the increase of Al/(Fe+Ti) ratio. Fig. 6c shows the distributions of α-olefin in oligomers with different usages of MMAO, and the percentage of different branches is presented in Fig. 6d. The two figures demonstrate a similar change but higher proportions of ethyl branches relative to long branches are present in polymers. The amount of MMAO introduced into the reaction system can also influence the thermal properties of polymers. Fig. 4b displays the DSC thermograms of a series of copolymers produced with different amounts of MMAO. The sample exhibited a broad melting endotherm and a small degree of crystallinity at Al/(Fe+Ti) ratio of 500, suggesting the presence of greater proportion of branches, which would inhibit the rearrangement of molecular-chains and growth of larger crystals. The T m's and degrees of crystallinity increased however as increasing the Al/(Fe+Ti) ratio, which indicated a reduction of branching degrees. These results are fully consistent with 13C NMR characterization. 4 Conclusions Two non-metallocene catalysts, β-carbonylenamine derived [O−NS]TiCl3 (2)/MMAO and difluoro-substituted 2,6-bis(imino)pyridyl Fe (1)/MMAO, form a tandem catalytic system for the first time to in situ copolymerize ethylene to linear low-density polyethylene (LLDPE). During the reaction, 1/MMAO oligomerizes ethylene to linear α-olefins, while 2/MMAO copolymerizes ethylene with the in situ generated α-olefins to LLDPE with high activity up to 106 g/molTihatm. The polymerization conditions influence greatly not only the catalytic activities but also the structure of polymers. The Ti complex (2) shows a strong positive comonomer effect for the activity. The polymers were characterized in detail by DSC, high temperature GPC and high temperature 13C NMR spectroscopy and proved to be LLDPE with various branches, including ethyl, butyl and longer branches. The reaction conditions can change the constituents in α-olefins produced by 1/MMAO as well as the proportions of different branches in the copolymerized LLDPE. Further more, the branching degrees can be tuned efficiently from 4.6 to 39.3/1000C by varying reaction temperature, Fe/Ti or Al/(Fe+Ti) molar ratios. The melting points, crystallinity and molecular weights of the products can also be modified accordingly. Acknowledgments The authors are grateful for the financial support from the Natural Sciences Foundation of China (21172269, 40830852, 51373201) and the Open Fund of Ministry-of-Education Key Laboratory for the Green Preparation and Application of Functional Materials. References [1] (a) D.L. Beach Y.V. Kissin J. Polym. Sci. A: Polym. Chem. 22 1984 3027 (b) Y.V. Kissin D.L. Beach J. Polym. Sci. A: Polym. Chem. 24 1986 1069 [2] (a) L.K. Johnson C.M. Killian M. Brookhart J. Am. Chem. Soc. 117 1995 6414 (b) S.D. Ittel L.K. Johnson M. Brookhart Chem. Rev. 100 2000 1169 (c) N. Suzuki J. Yu Y. Masubuchi A. Horiuchi Y. Wakatsuki J. Polym. Sci. A: Polym. Chem. 41 2003 293 (d) Z. Guan J. Polym. Sci. A: Polym. Chem. 41 2003 3680 [3] G.B. Galland R.F. de Souza R.S. Mauler F.F. Nunes Macromolecules 32 1999 1620 [4] (a) C. Pellecchia D. Pappalardo G.J. Gruter Macromolecules 32 1999 4491 (b) L. Izzo L. Caporaso G. Senatore L. Oliva Macromolecules 32 1999 6913 (c) L. Izzo F.D. Riccardis C. Alfano L. Caporaso L. Oliva Macromolecules 34 2001 2 (d) G. Melillo L. Izzo M. Zinna C. Tedesco L. Oliva Macromolecules 35 2002 9256 (e) C. Capacchione A. Proto J. Okuda J. Polym. Sci. A: Polym. Chem. 42 2004 2815 (f) E.D. Schwerdtfeger L.J. Irwin S.A. Miller Macromolecules 41 2008 1080 [5] (a) F. Zhu Y. Fang H. Chen S. Lin Macromolecules 33 2000 5006 (b) F. Zhu Y. Huang Y. Yang S. Lin J. Polym. Sci. A: Polym. Chem. 38 2000 4258 [6] (a) M. Yang W. Yan X. Hao B. Liu L. Wen P. Liu Macromolecules 42 2009 905 (b) W. Yan X. Hao M. Yang B. Liu P. Liu J. Polym. Sci. A: Polym. Chem. 47 2009 1966 (c) M. Yang B. Liu L. Wang H. Ren W. Hu L. Wen W. Yan Catal. Commun. 10 2009 1427 [7] (a) Z. Liu J. Wang X. Li D. He Y. Hu W. Yan Chem. J. Chin. Univ. 22 2001 1271 (b) Z. Liu D. Xu J. Wang C. Guo D. He Y. Hu Chin. Sci. Bull. 46 2001 1261 (c) Z. Liu J. Wang D. Xu D. He Y. Hu Acta Polym. Sin. 4 2001 509 (d) Z. Liu M. Jia C. Guo D. He Y. Hu Acta Polym. Sin. 6 2001 751 (e) Z. Lu Z. Zhang Y. Li C. Wu Y. Hu J. Appl. Polym. Sci. 99 2006 2898 (f) L.G. Furlan F.A. Kunrath R.S. Mauler R.F. de Souza O.L. Casagrande Jr. J. Mol. Catal. A: Chem. 214 2004 207 (g) B. Zhu C. Guo Z. Liu Y. Yin J. Appl. Polym. Sci. 94 2004 2451 [8] (a) R.W. Barnhart G.C. Bazan J. Am. Chem. Soc. 120 1998 1082 (b) Z.J.A. Komon X. Bu G.C. Bazan J. Am. Chem. Soc. 122 2000 1830 (c) Z.J.A. Komon G.M. Diamond M.K. Leclerc V. Murphy M. Okazaki G.C. Bazan J. Am. Chem. Soc. 124 2002 15280 (d) Z.J.A. Komon G.C. Bazan Macromol. Rapid Commun. 22 2001 467 (e) R. Quijada R. Rojas G. Bazan Z.J.A. Komon R.S. Mauler G.B. Galland Macromolecules 34 2001 2411 (f) G.B. Galland R. Quijada R. Rojas G. Bazan Z.J.A. Komon Macromolecules 35 2002 339 (g) O. Sperber W. Kaminsky Macromolecules 36 2003 9014 (h) D.D. Wet-Roos J.T. Dixon Macromolecules 37 2004 9314 (i) D.D. Wet-Roos A.D. Toit D.J. Joubert J. Polym. Sci. A: Polym. Chem. 44 2006 6847 (j) H. Wang Z. Ma Y. Ke Y. Hu Polym. Int. 52 2003 1546 (k) Z. Zhang N. Cui Y. Lu Y. Ke Y. Hu J. Polym. Sci. A: Polym. Chem. 43 2005 984 (l) Z. Zhang Z. Lu S. Chen H. Li X. Zhang Y. Lu Y. Hu J. Mol. Catal. A: Chem. 236 2005 87 (m) Z. Ye F. AlObaidi S. Zhu Macromol. Rapid Commun. 25 2004 647 (n) F. Alobaidi Z. Ye S. Zhu J. Polym. Sci. A: Polym. Chem. 42 2004 4327 (o) J. Zhang B. Li H. Fan S. Zhu J. Polym. Sci. A: Polym. Chem. 45 2007 3562 (p) J. Zhang H. Fan B. Li S. Zhu Ind. Eng. Chem. Res. 47 2008 5369 (q) C. Bianchini M. Frediani G. Giambastiani W. Kaminsky A. Meli E. Passaglia Macromol. Rapid Commun. 26 2005 1218 (r) A. Toti G. Giambastiani C. Bianchini A. Meli S. Bredeau Ph. Dubois D. Bonduel M. Claes Chem. Mater. 20 2008 3092 (s) C. Bianchini G. Giambastiani A. Meli I. Guerrero Rios A. Toti E. Passaglia M. Frediani Top. Catal. 48 2008 107 (t) E.D. Schwerdtfeger C.J. Price J. Chai S.A. Miller Macromolecules 43 2010 4838 (u) D. Sémeril M. Lejeune D. Matt New J. Chem. 31 2007 502 (v) K. Musikabhumma T.P. Spaniol J. Okuda J. Polym. Sci. A: Polym. Chem. 41 2003 528 (w) M.C.A. Kuhn J.L. da Silva A.C.A. Casagrande R.S. Mauler O.L. Casagrande Jr. Macromol. Chem. Phys. 207 2006 827 (x) H. Xu C. Guo M. Zhang H. Yang J. Dong G. Yuan Catal. Commun. 8 2007 2143 (y) C. Guo H. Xu M. Zhang H. Yang F. Yan G. Yuan Polym. Int. 59 2010 725 (z) M.A. Milani M.O. de Souza R.F. de Souza Catal. Commun. 11 2010 1094 [9] (a) G.J.P. Britovsek V.C. Gibson D.F. Wass Angew Chem. Int. Ed. 38 1999 428 (b) V.C. Gibson S.K. Spitzmesser Chem. Rev. 103 2003 283 (c) H. Makio T. Fujita Acc. Chem. Res. 42 2009 1532 (d) H. Makio H. Terao A. Iwashita T. Fujita Chem. Rev. 111 2011 2363 (e) T. Matsugi T. Fujita Chem. Soc. Rev. 37 2008 1264 (f) S. Park Y. Han S.K. Kim J. Lee H.K. Kim Y. Do J. Organomet. Chem. 689 2004 4263 (g) S. Collins Coord. Chem. Rev. 255 2011 118 (h) D. Takeuchi Dalton Trans. 39 2010 311 (i) C. Redshaw Y. Tang Chem. Soc. Rev. 41 2012 4484 [10] (a) G. Xie C. Qian J. Polym. Sci. A: Polym. Chem. 46 2008 211 (b) G. Xie Y. Li J. Sun C. Qian Inorg. Chem. Commun. 12 2009 796 (c) G. Xie T. Li A. Zhang Inorg. Chem. Commun. 13 2010 1199 [11] (a) W.Q. Hu X.L. Sun C. Wang Y. Gao Y. Tang L.P. Shi W. Xia J. Sun H.L. Dai X.Q. Li X.L. Yao X.R. Wang Organometallics 23 2004 1684 (b) C. Wang X.L. Sun Y.H. Guo Y. Gao B. Liu Z. Ma W. Xia L.P. Shi Y. Tang Macromol. Rapid Commun. 26 2005 1609 (c) C. Wang Z. Ma X.L. Sun Y. Gao Y.H. Guo Y. Tang L.P. Shi Organometallics 25 2006 3259 (d) M.L. Gao C. Wang X.L. Sun C.T. Qian Z. Ma S.Z. Bu Y. Tang Z.W. Xie Macromol. Rapid Commun. 28 2007 1511 (e) M.L. Gao X.L. Sun Y.F. Gu X.L. Yao C.F. Li J.Y. Bai C. Wang Z. Ma Y. Tang Z.W. Xie S.Z. Bu C.T. Qian J. Polym. Sci. A: Polym. Chem. 46 2008 2807 (f) M.L. Gao Y.F. Gu C. Wang X.L. Yao X.L. Sun C.F. Li C.T. Qian B. Liu Z. Ma Y. Tang Z.W. Xie S.Z. Bu Y. Gao J. Mol. Catal. A: Chem. 292 2008 62 (g) X.H. Yang X.L. Sun F.B. Han B. Liu Y. Tang Z. Wang M.L. Gao Z.W. Xie S.Z. Bu Organometallics 27 2008 4618 (h) X.H. Yang Z. Wang X.L. Sun Y. Tang Dalton Trans. 2009 8945 (i) X.H. Yang C.R. Liu C. Wang X.L. Sun Y.H. Guo X.K. Wang Z. Wang Z. Xie Y. Tang Angew. Chem. Int. Ed. 48 2009 8099 [12] (a) Y. Chen C. Qian J. Sun Organometallics 22 2003 1231 (b) Y. Chen R. Chen C. Qian X. Dong J. Sun Organometallics 22 2003 4312 (c) Y.V. Kissin C. Qian G. Xie Y. Chen J. Polym. Sci. A: Polym. Chem. 44 2006 6159 [13] (a) V.C. Gibson C. Redshaw G.A. Solan Chem. Rev. 107 2007 1745 (b) C. Bianchini G. Giambastiani I.G. Rios G. Mantovani A. Meli A.M. Segarra Coord. Chem. Rev. 250 2006 1391 (c) C. Bianchini G. Giambastiani L. Luconi A. Meli Coord. Chem. Rev. 254 2010 431 (d) W. Zhang W.-H. Sun C. Redshaw Dalton Trans. 42 2013 8988",
      "scopus-id": "84891133232",
      "coredata": {
        "eid": "1-s2.0-S1381116913004469",
        "dc:description": "A non-metallocene titanium complex of β-carbonylenamine derived [O−NS]TiCl3 (2), which can form a tandem catalytic system with difluoro-substituted 2,6-bis(imino)pyridyl iron complex (1), was firstly used as in situ copolymerization catalyst to prepare linear low-density polyethylene (LLDPE) with ethylene as the sole monomer stock and MMAO as the only cocatalyst. During the reaction, 1/MMAO oligomerized ethylene to linear α-olefins with high activity and selectivity, while 2/MMAO copolymerized ethylene with the in situ generated α-olefins to LLDPE with high activity (up to 6×106 g/molTihatm). The influences of reaction conditions upon catalytic activity and polymer structures and properties have been researched. The polymers were characterized by differential scanning calorimetry (DSC), high temperature gel permeation chromatography (GPC) and high temperature 13C NMR spectroscopy and proved to be LLDPE with ethyl, butyl as well as longer branches. The branching degrees were tuned efficiently from 4.6 to 39.3/1000C by different reaction conditions such as reaction temperature, Fe/Ti molar ratio and Al/(Fe+Ti) molar ratio. The melting points, degree of crystallinity and molecular weights also changed correspondingly with reaction conditions.",
        "openArchiveArticle": "false",
        "prism:coverDate": "2014-03-31",
        "openaccessUserLicense": null,
        "prism:aggregationType": "Journal",
        "prism:url": "https://api.elsevier.com/content/article/pii/S1381116913004469",
        "dc:creator": [
          {
            "@_fa": "true",
            "$": "Xie, Guangyong"
          },
          {
            "@_fa": "true",
            "$": "Zhang, Xiang"
          },
          {
            "@_fa": "true",
            "$": "Li, Tingcheng"
          },
          {
            "@_fa": "true",
            "$": "Li, Long"
          },
          {
            "@_fa": "true",
            "$": "Liu, Gongyi"
          },
          {
            "@_fa": "true",
            "$": "Zhang, Aiqing"
          }
        ],
        "link": [
          {
            "@_fa": "true",
            "@rel": "self",
            "@href": "https://api.elsevier.com/content/article/pii/S1381116913004469"
          },
          {
            "@_fa": "true",
            "@rel": "scidir",
            "@href": "https://www.sciencedirect.com/science/article/pii/S1381116913004469"
          }
        ],
        "dc:format": "application/json",
        "openaccessType": null,
        "pii": "S1381-1169(13)00446-9",
        "prism:volume": "383",
        "prism:publisher": "Elsevier B.V.",
        "dc:title": "Preparation of linear low-density polyethylene from ethylene by tandem catalysis of iron and titanium non-metallocene catalysts",
        "prism:copyright": "Copyright © 2013 Elsevier B.V. All rights reserved.",
        "openaccess": "0",
        "prism:issn": "13811169",
        "dcterms:subject": [
          {
            "@_fa": "true",
            "$": "Tandem catalysis"
          },
          {
            "@_fa": "true",
            "$": "In situ copolymerization"
          },
          {
            "@_fa": "true",
            "$": "Linear low-density polyethylene"
          },
          {
            "@_fa": "true",
            "$": "Non-metallocene"
          },
          {
            "@_fa": "true",
            "$": "Branching degree"
          }
        ],
        "openaccessArticle": "false",
        "prism:publicationName": "Journal of Molecular Catalysis A: Chemical",
        "openaccessSponsorType": null,
        "prism:pageRange": "121-127",
        "prism:endingPage": "127",
        "pubType": "fla",
        "prism:coverDisplayDate": "March 2014",
        "prism:doi": "10.1016/j.molcata.2013.11.024",
        "prism:startingPage": "121",
        "dc:identifier": "doi:10.1016/j.molcata.2013.11.024",
        "openaccessSponsorName": null
      },
      "objects": {
        "object": [
          {
            "@category": "thumbnail",
            "@height": "16",
            "@width": "18",
            "@_fa": "true",
            "$": "https://api.elsevier.com/content/object/eid/1-s2.0-S1381116913004469-si6.gif?httpAccept=%2A%2F%2A",
            "@multimediatype": "GIF image file",
            "@type": "ALTIMG",
            "@size": "177",
            "@ref": "si6",
            "@mimetype": "image/gif"
          },
          {
            "@category": "thumbnail",
            "@height": "16",
            "@width": "19",
            "@_fa": "true",
            "$": "https://api.elsevier.com/content/object/eid/1-s2.0-S1381116913004469-si5.gif?httpAccept=%2A%2F%2A",
            "@multimediatype": "GIF image file",
            "@type": "ALTIMG",
            "@size": "188",
            "@ref": "si5",
            "@mimetype": "image/gif"
          },
          {
            "@category": "thumbnail",
            "@height": "16",
            "@width": "18",
            "@_fa": "true",
            "$": "https://api.elsevier.com/content/object/eid/1-s2.0-S1381116913004469-si4.gif?httpAccept=%2A%2F%2A",
            "@multimediatype": "GIF image file",
            "@type": "ALTIMG",
            "@size": "179",
            "@ref": "si4",
            "@mimetype": "image/gif"
          },
          {
            "@category": "thumbnail",
            "@height": "16",
            "@width": "18",
            "@_fa": "true",
            "$": "https://api.elsevier.com/content/object/eid/1-s2.0-S1381116913004469-si3.gif?httpAccept=%2A%2F%2A",
            "@multimediatype": "GIF image file",
            "@type": "ALTIMG",
            "@size": "177",
            "@ref": "si3",
            "@mimetype": "image/gif"
          },
          {
            "@category": "thumbnail",
            "@height": "16",
            "@width": "19",
            "@_fa": "true",
            "$": "https://api.elsevier.com/content/object/eid/1-s2.0-S1381116913004469-si2.gif?httpAccept=%2A%2F%2A",
            "@multimediatype": "GIF image file",
            "@type": "ALTIMG",
            "@size": "188",
            "@ref": "si2",
            "@mimetype": "image/gif"
          },
          {
            "@category": "thumbnail",
            "@height": "16",
            "@width": "18",
            "@_fa": "true",
            "$": "https://api.elsevier.com/content/object/eid/1-s2.0-S1381116913004469-si1.gif?httpAccept=%2A%2F%2A",
            "@multimediatype": "GIF image file",
            "@type": "ALTIMG",
            "@size": "179",
            "@ref": "si1",
            "@mimetype": "image/gif"
          },
          {
            "@category": "high",
            "@height": "1429",
            "@width": "1675",
            "@_fa": "true",
            "$": "https://api.elsevier.com/content/object/eid/1-s2.0-S1381116913004469-sc1_lrg.jpg?httpAccept=%2A%2F%2A",
            "@multimediatype": "JPEG image file",
            "@type": "IMAGE-HIGH-RES",
            "@size": "168380",
            "@ref": "sc1",
            "@mimetype": "image/jpeg"
          },
          {
            "@category": "high",
            "@height": "1829",
            "@width": "2523",
            "@_fa": "true",
            "$": "https://api.elsevier.com/content/object/eid/1-s2.0-S1381116913004469-gr6_lrg.jpg?httpAccept=%2A%2F%2A",
            "@multimediatype": "JPEG image file",
            "@type": "IMAGE-HIGH-RES",
            "@size": "294153",
            "@ref": "gr6",
            "@mimetype": "image/jpeg"
          },
          {
            "@category": "high",
            "@height": "2362",
            "@width": "1574",
            "@_fa": "true",
            "$": "https://api.elsevier.com/content/object/eid/1-s2.0-S1381116913004469-gr5_lrg.jpg?httpAccept=%2A%2F%2A",
            "@multimediatype": "JPEG image file",
            "@type": "IMAGE-HIGH-RES",
            "@size": "285536",
            "@ref": "gr5",
            "@mimetype": "image/jpeg"
          },
          {
            "@category": "high",
            "@height": "2208",
            "@width": "1560",
            "@_fa": "true",
            "$": "https://api.elsevier.com/content/object/eid/1-s2.0-S1381116913004469-gr4_lrg.jpg?httpAccept=%2A%2F%2A",
            "@multimediatype": "JPEG image file",
            "@type": "IMAGE-HIGH-RES",
            "@size": "251045",
            "@ref": "gr4",
            "@mimetype": "image/jpeg"
          },
          {
            "@category": "high",
            "@height": "2403",
            "@width": "1546",
            "@_fa": "true",
            "$": "https://api.elsevier.com/content/object/eid/1-s2.0-S1381116913004469-gr3_lrg.jpg?httpAccept=%2A%2F%2A",
            "@multimediatype": "JPEG image file",
            "@type": "IMAGE-HIGH-RES",
            "@size": "337534",
            "@ref": "gr3",
            "@mimetype": "image/jpeg"
          },
          {
            "@category": "high",
            "@height": "886",
            "@width": "2213",
            "@_fa": "true",
            "$": "https://api.elsevier.com/content/object/eid/1-s2.0-S1381116913004469-fx1_lrg.jpg?httpAccept=%2A%2F%2A",
            "@multimediatype": "JPEG image file",
            "@type": "IMAGE-HIGH-RES",
            "@size": "117750",
            "@ref": "fx1",
            "@mimetype": "image/jpeg"
          },
          {
            "@category": "high",
            "@height": "2608",
            "@width": "3333",
            "@_fa": "true",
            "$": "https://api.elsevier.com/content/object/eid/1-s2.0-S1381116913004469-gr2_lrg.gif?httpAccept=%2A%2F%2A",
            "@multimediatype": "GIF image file",
            "@type": "IMAGE-HIGH-RES",
            "@size": "80345",
            "@ref": "gr2",
            "@mimetype": "image/gif"
          },
          {
            "@category": "high",
            "@height": "2277",
            "@width": "3350",
            "@_fa": "true",
            "$": "https://api.elsevier.com/content/object/eid/1-s2.0-S1381116913004469-gr1_lrg.gif?httpAccept=%2A%2F%2A",
            "@multimediatype": "GIF image file",
            "@type": "IMAGE-HIGH-RES",
            "@size": "42427",
            "@ref": "gr1",
            "@mimetype": "image/gif"
          },
          {
            "@category": "standard",
            "@height": "322",
            "@width": "378",
            "@_fa": "true",
            "$": "https://api.elsevier.com/content/object/eid/1-s2.0-S1381116913004469-sc1.jpg?httpAccept=%2A%2F%2A",
            "@multimediatype": "JPEG image file",
            "@type": "IMAGE-DOWNSAMPLED",
            "@size": "30415",
            "@ref": "sc1",
            "@mimetype": "image/jpeg"
          },
          {
            "@category": "standard",
            "@height": "413",
            "@width": "570",
            "@_fa": "true",
            "$": "https://api.elsevier.com/content/object/eid/1-s2.0-S1381116913004469-gr6.jpg?httpAccept=%2A%2F%2A",
            "@multimediatype": "JPEG image file",
            "@type": "IMAGE-DOWNSAMPLED",
            "@size": "41152",
            "@ref": "gr6",
            "@mimetype": "image/jpeg"
          },
          {
            "@category": "standard",
            "@height": "533",
            "@width": "355",
            "@_fa": "true",
            "$": "https://api.elsevier.com/content/object/eid/1-s2.0-S1381116913004469-gr5.jpg?httpAccept=%2A%2F%2A",
            "@multimediatype": "JPEG image file",
            "@type": "IMAGE-DOWNSAMPLED",
            "@size": "35271",
            "@ref": "gr5",
            "@mimetype": "image/jpeg"
          },
          {
            "@category": "standard",
            "@height": "498",
            "@width": "352",
            "@_fa": "true",
            "$": "https://api.elsevier.com/content/object/eid/1-s2.0-S1381116913004469-gr4.jpg?httpAccept=%2A%2F%2A",
            "@multimediatype": "JPEG image file",
            "@type": "IMAGE-DOWNSAMPLED",
            "@size": "29154",
            "@ref": "gr4",
            "@mimetype": "image/jpeg"
          },
          {
            "@category": "standard",
            "@height": "542",
            "@width": "349",
            "@_fa": "true",
            "$": "https://api.elsevier.com/content/object/eid/1-s2.0-S1381116913004469-gr3.jpg?httpAccept=%2A%2F%2A",
            "@multimediatype": "JPEG image file",
            "@type": "IMAGE-DOWNSAMPLED",
            "@size": "37127",
            "@ref": "gr3",
            "@mimetype": "image/jpeg"
          },
          {
            "@category": "standard",
            "@height": "200",
            "@width": "500",
            "@_fa": "true",
            "$": "https://api.elsevier.com/content/object/eid/1-s2.0-S1381116913004469-fx1.jpg?httpAccept=%2A%2F%2A",
            "@multimediatype": "JPEG image file",
            "@type": "IMAGE-DOWNSAMPLED",
            "@size": "16369",
            "@ref": "fx1",
            "@mimetype": "image/jpeg"
          },
          {
            "@category": "standard",
            "@height": "294",
            "@width": "376",
            "@_fa": "true",
            "$": "https://api.elsevier.com/content/object/eid/1-s2.0-S1381116913004469-gr2.gif?httpAccept=%2A%2F%2A",
            "@multimediatype": "GIF image file",
            "@type": "IMAGE-DOWNSAMPLED",
            "@size": "9110",
            "@ref": "gr2",
            "@mimetype": "image/gif"
          },
          {
            "@category": "standard",
            "@height": "257",
            "@width": "378",
            "@_fa": "true",
            "$": "https://api.elsevier.com/content/object/eid/1-s2.0-S1381116913004469-gr1.gif?httpAccept=%2A%2F%2A",
            "@multimediatype": "GIF image file",
            "@type": "IMAGE-DOWNSAMPLED",
            "@size": "4198",
            "@ref": "gr1",
            "@mimetype": "image/gif"
          },
          {
            "@category": "thumbnail",
            "@height": "164",
            "@width": "209",
            "@_fa": "true",
            "$": "https://api.elsevier.com/content/object/eid/1-s2.0-S1381116913004469-gr2.sml?httpAccept=%2A%2F%2A",
            "@multimediatype": "GIF image file",
            "@type": "IMAGE-THUMBNAIL",
            "@size": "3816",
            "@ref": "gr2",
            "@mimetype": "image/gif"
          },
          {
            "@category": "thumbnail",
            "@height": "149",
            "@width": "219",
            "@_fa": "true",
            "$": "https://api.elsevier.com/content/object/eid/1-s2.0-S1381116913004469-gr1.sml?httpAccept=%2A%2F%2A",
            "@multimediatype": "GIF image file",
            "@type": "IMAGE-THUMBNAIL",
            "@size": "2070",
            "@ref": "gr1",
            "@mimetype": "image/gif"
          },
          {
            "@category": "thumbnail",
            "@height": "164",
            "@width": "192",
            "@_fa": "true",
            "$": "https://api.elsevier.com/content/object/eid/1-s2.0-S1381116913004469-sc1.sml?httpAccept=%2A%2F%2A",
            "@multimediatype": "GIF image file",
            "@type": "IMAGE-THUMBNAIL",
            "@size": "3810",
            "@ref": "sc1",
            "@mimetype": "image/gif"
          },
          {
            "@category": "thumbnail",
            "@height": "159",
            "@width": "219",
            "@_fa": "true",
            "$": "https://api.elsevier.com/content/object/eid/1-s2.0-S1381116913004469-gr6.sml?httpAccept=%2A%2F%2A",
            "@multimediatype": "GIF image file",
            "@type": "IMAGE-THUMBNAIL",
            "@size": "9408",
            "@ref": "gr6",
            "@mimetype": "image/gif"
          },
          {
            "@category": "thumbnail",
            "@height": "164",
            "@width": "109",
            "@_fa": "true",
            "$": "https://api.elsevier.com/content/object/eid/1-s2.0-S1381116913004469-gr5.sml?httpAccept=%2A%2F%2A",
            "@multimediatype": "GIF image file",
            "@type": "IMAGE-THUMBNAIL",
            "@size": "3456",
            "@ref": "gr5",
            "@mimetype": "image/gif"
          },
          {
            "@category": "thumbnail",
            "@height": "164",
            "@width": "116",
            "@_fa": "true",
            "$": "https://api.elsevier.com/content/object/eid/1-s2.0-S1381116913004469-gr4.sml?httpAccept=%2A%2F%2A",
            "@multimediatype": "GIF image file",
            "@type": "IMAGE-THUMBNAIL",
            "@size": "3181",
            "@ref": "gr4",
            "@mimetype": "image/gif"
          },
          {
            "@category": "thumbnail",
            "@height": "163",
            "@width": "105",
            "@_fa": "true",
            "$": "https://api.elsevier.com/content/object/eid/1-s2.0-S1381116913004469-gr3.sml?httpAccept=%2A%2F%2A",
            "@multimediatype": "GIF image file",
            "@type": "IMAGE-THUMBNAIL",
            "@size": "3578",
            "@ref": "gr3",
            "@mimetype": "image/gif"
          },
          {
            "@category": "thumbnail",
            "@height": "88",
            "@width": "219",
            "@_fa": "true",
            "$": "https://api.elsevier.com/content/object/eid/1-s2.0-S1381116913004469-fx1.sml?httpAccept=%2A%2F%2A",
            "@multimediatype": "GIF image file",
            "@type": "IMAGE-THUMBNAIL",
            "@size": "2719",
            "@ref": "fx1",
            "@mimetype": "image/gif"
          }
        ]
      },
      "link": {
        "@rel": "abstract",
        "@href": "https://api.elsevier.com/content/abstract/scopus_id/84891133232"
      }
    }
  }
}