{
  "metadata": {
    "title": "Polymerisation of ethylene or propylene with heterogeneous metallocene catalysts on clay minerals",
    "authors": "; ; ",
    "journal": "Journal of Molecular Catalysis A: Chemical",
    "date": "2002-05-31",
    "doi": "10.1016/S1381-1169(01)00481-2",
    "abstract": "",
    "uri": "https://api.elsevier.com/content/article/pii/S1381116901004812",
    "pii": "S1381116901004812"
  },
  "fulltext": {
    "full-text-retrieval-response": {
      "scopus-eid": "2-s2.0-3042793703",
      "originalText": "serial JL 271358 291210 291744 291790 291809 31 Journal of Molecular Catalysis A: Chemical JOURNALMOLECULARCATALYSISACHEMICAL 2001-12-28 2001-12-28 2010-04-18T17:18:08 1-s2.0-S1381116901004812 S1381-1169(01)00481-2 S1381116901004812 10.1016/S1381-1169(01)00481-2 S300 S300.1 FULL-TEXT 1-s2.0-S1381116900X01495 2015-05-15T05:56:33.301439-04:00 0 0 20020531 2002 2001-12-28T00:00:00Z articleinfo crossmark dco dateupdated tomb dateloaded datesearch indexeddate volumelist yearnav articletitlenorm authfirstinitialnorm authfirstsurnamenorm cid cids contenttype copyright dateloadedtxt docsubtype doctype doi eid ewtransactionid hubeid issn issnnorm itemstage itemtransactionid itemweight openaccess openarchive pg pgfirst pglast pii piinorm pubdatestart pubdatetxt pubyr sortorder srctitle srctitlenorm srctype subheadings suppl volfirst volissue webpdf webpdfpagecount figure table body acknowledge affil articletitle auth authfirstini authfull authkeywords authlast primabst ref alllist content subj ssids 1381-1169 13811169 182 183 182 183 C Volumes 182–183 15 143 149 143 149 20020531 31 May 2002 2002-05-31 2002 converted-article fla Copyright © 2002 Elsevier Science B.V. All rights reserved. POLYMERISATIONETHYLENEPROPYLENEHETEROGENEOUSMETALLOCENECATALYSTSCLAYMINERALS WEISS K 1 Introduction 2 Experimental 2.1 Syntheses of the titanocenes 1–4 (by Lang et al.) 2.2 Syntheses of heterogeneous Ti and Zr metallocene catalysts for ethylene and propylene polymerisation 3 Results 4 Conclusions Acknowledgements References LANG 1995 C32 H WEISS 1996 171 K LANG 2000 206 207 H LANG 1990 212 H WEISSX2002X143 WEISSX2002X143X149 WEISSX2002X143XK WEISSX2002X143X149XK item S1381-1169(01)00481-2 S1381116901004812 1-s2.0-S1381116901004812 10.1016/S1381-1169(01)00481-2 271358 2010-10-03T19:44:20.945278-04:00 2002-05-31 1-s2.0-S1381116901004812-main.pdf https://s3.amazonaws.com/prod-ucs-content-store-us-east/content/pii:S1381116901004812/MAIN/application/pdf/5791ce14a3ea1d5f0e092dffd14e94b1/main.pdf https://s3-eu-west-1.amazonaws.com/prod-ucs-content-store-eu-west/content/pii:S1381116901004812/MAIN/application/pdf/5791ce14a3ea1d5f0e092dffd14e94b1/main.pdf main.pdf pdf true 142182 MAIN 7 1-s2.0-S1381116901004812-main_1.png https://s3.amazonaws.com/prod-ucs-content-store-us-east/content/pii:S1381116901004812/PREVIEW/image/png/5aa26d77c869fff0766875e6dcb8d180/main_1.png https://s3-eu-west-1.amazonaws.com/prod-ucs-content-store-eu-west/content/pii:S1381116901004812/PREVIEW/image/png/5aa26d77c869fff0766875e6dcb8d180/main_1.png main_1.png png 58567 849 656 IMAGE-WEB-PDF 1 1-s2.0-S1381116901004812-si9.gif https://s3.amazonaws.com/prod-ucs-content-store-us-east/content/pii:S1381116901004812/STRIPIN/image/gif/624fe605656189fde315f22daf0340cc/si10.gif https://s3-eu-west-1.amazonaws.com/prod-ucs-content-store-eu-west/content/pii:S1381116901004812/STRIPIN/image/gif/624fe605656189fde315f22daf0340cc/si10.gif si9 si9.gif gif 244 19 31 ALTIMG 1-s2.0-S1381116901004812-si8.gif https://s3.amazonaws.com/prod-ucs-content-store-us-east/content/pii:S1381116901004812/STRIPIN/image/gif/6cf19c314139d5ae4f3ef2035e86c5fa/si16.gif https://s3-eu-west-1.amazonaws.com/prod-ucs-content-store-eu-west/content/pii:S1381116901004812/STRIPIN/image/gif/6cf19c314139d5ae4f3ef2035e86c5fa/si16.gif si8 si8.gif gif 550 19 102 ALTIMG 1-s2.0-S1381116901004812-si7.gif https://s3.amazonaws.com/prod-ucs-content-store-us-east/content/pii:S1381116901004812/STRIPIN/image/gif/74a814c9ae77ea046352daecbca9b508/si6.gif https://s3-eu-west-1.amazonaws.com/prod-ucs-content-store-eu-west/content/pii:S1381116901004812/STRIPIN/image/gif/74a814c9ae77ea046352daecbca9b508/si6.gif si7 si7.gif gif 353 16 76 ALTIMG 1-s2.0-S1381116901004812-si6.gif https://s3.amazonaws.com/prod-ucs-content-store-us-east/content/pii:S1381116901004812/STRIPIN/image/gif/74a814c9ae77ea046352daecbca9b508/si6.gif https://s3-eu-west-1.amazonaws.com/prod-ucs-content-store-eu-west/content/pii:S1381116901004812/STRIPIN/image/gif/74a814c9ae77ea046352daecbca9b508/si6.gif si6 si6.gif gif 353 16 76 ALTIMG 1-s2.0-S1381116901004812-si5.gif https://s3.amazonaws.com/prod-ucs-content-store-us-east/content/pii:S1381116901004812/STRIPIN/image/gif/bc0ad684770f8c2da6fa847252d83f28/si5.gif https://s3-eu-west-1.amazonaws.com/prod-ucs-content-store-eu-west/content/pii:S1381116901004812/STRIPIN/image/gif/bc0ad684770f8c2da6fa847252d83f28/si5.gif si5 si5.gif gif 339 31 44 ALTIMG 1-s2.0-S1381116901004812-si4.gif https://s3.amazonaws.com/prod-ucs-content-store-us-east/content/pii:S1381116901004812/STRIPIN/image/gif/da4901f752f8f1da103f2724db584d2c/si4.gif https://s3-eu-west-1.amazonaws.com/prod-ucs-content-store-eu-west/content/pii:S1381116901004812/STRIPIN/image/gif/da4901f752f8f1da103f2724db584d2c/si4.gif si4 si4.gif gif 273 31 33 ALTIMG 1-s2.0-S1381116901004812-si3.gif https://s3.amazonaws.com/prod-ucs-content-store-us-east/content/pii:S1381116901004812/STRIPIN/image/gif/da4901f752f8f1da103f2724db584d2c/si4.gif https://s3-eu-west-1.amazonaws.com/prod-ucs-content-store-eu-west/content/pii:S1381116901004812/STRIPIN/image/gif/da4901f752f8f1da103f2724db584d2c/si4.gif si3 si3.gif gif 273 31 33 ALTIMG 1-s2.0-S1381116901004812-si2.gif https://s3.amazonaws.com/prod-ucs-content-store-us-east/content/pii:S1381116901004812/STRIPIN/image/gif/5fd56664afd0e85266a649937ab6434a/si2.gif https://s3-eu-west-1.amazonaws.com/prod-ucs-content-store-eu-west/content/pii:S1381116901004812/STRIPIN/image/gif/5fd56664afd0e85266a649937ab6434a/si2.gif si2 si2.gif gif 907 31 158 ALTIMG 1-s2.0-S1381116901004812-si16.gif https://s3.amazonaws.com/prod-ucs-content-store-us-east/content/pii:S1381116901004812/STRIPIN/image/gif/6cf19c314139d5ae4f3ef2035e86c5fa/si16.gif https://s3-eu-west-1.amazonaws.com/prod-ucs-content-store-eu-west/content/pii:S1381116901004812/STRIPIN/image/gif/6cf19c314139d5ae4f3ef2035e86c5fa/si16.gif si16 si16.gif gif 550 19 102 ALTIMG 1-s2.0-S1381116901004812-si15.gif https://s3.amazonaws.com/prod-ucs-content-store-us-east/content/pii:S1381116901004812/STRIPIN/image/gif/222aed218799d1427a513e061c387942/si15.gif https://s3-eu-west-1.amazonaws.com/prod-ucs-content-store-eu-west/content/pii:S1381116901004812/STRIPIN/image/gif/222aed218799d1427a513e061c387942/si15.gif si15 si15.gif gif 511 22 81 ALTIMG 1-s2.0-S1381116901004812-si14.gif https://s3.amazonaws.com/prod-ucs-content-store-us-east/content/pii:S1381116901004812/STRIPIN/image/gif/37d68ca7ad8db277e8be0c92619a3ea4/si14.gif https://s3-eu-west-1.amazonaws.com/prod-ucs-content-store-eu-west/content/pii:S1381116901004812/STRIPIN/image/gif/37d68ca7ad8db277e8be0c92619a3ea4/si14.gif si14 si14.gif gif 335 14 62 ALTIMG 1-s2.0-S1381116901004812-si13.gif https://s3.amazonaws.com/prod-ucs-content-store-us-east/content/pii:S1381116901004812/STRIPIN/image/gif/431b18b20f0e9ffcfccfc77d8ebeb3e5/si13.gif https://s3-eu-west-1.amazonaws.com/prod-ucs-content-store-eu-west/content/pii:S1381116901004812/STRIPIN/image/gif/431b18b20f0e9ffcfccfc77d8ebeb3e5/si13.gif si13 si13.gif gif 300 19 42 ALTIMG 1-s2.0-S1381116901004812-si12.gif https://s3.amazonaws.com/prod-ucs-content-store-us-east/content/pii:S1381116901004812/STRIPIN/image/gif/624fe605656189fde315f22daf0340cc/si10.gif https://s3-eu-west-1.amazonaws.com/prod-ucs-content-store-eu-west/content/pii:S1381116901004812/STRIPIN/image/gif/624fe605656189fde315f22daf0340cc/si10.gif si12 si12.gif gif 244 19 31 ALTIMG 1-s2.0-S1381116901004812-si11.gif https://s3.amazonaws.com/prod-ucs-content-store-us-east/content/pii:S1381116901004812/STRIPIN/image/gif/624fe605656189fde315f22daf0340cc/si10.gif https://s3-eu-west-1.amazonaws.com/prod-ucs-content-store-eu-west/content/pii:S1381116901004812/STRIPIN/image/gif/624fe605656189fde315f22daf0340cc/si10.gif si11 si11.gif gif 244 19 31 ALTIMG 1-s2.0-S1381116901004812-si10.gif https://s3.amazonaws.com/prod-ucs-content-store-us-east/content/pii:S1381116901004812/STRIPIN/image/gif/624fe605656189fde315f22daf0340cc/si10.gif https://s3-eu-west-1.amazonaws.com/prod-ucs-content-store-eu-west/content/pii:S1381116901004812/STRIPIN/image/gif/624fe605656189fde315f22daf0340cc/si10.gif si10 si10.gif gif 244 19 31 ALTIMG 1-s2.0-S1381116901004812-si1.gif https://s3.amazonaws.com/prod-ucs-content-store-us-east/content/pii:S1381116901004812/STRIPIN/image/gif/37d68ca7ad8db277e8be0c92619a3ea4/si14.gif https://s3-eu-west-1.amazonaws.com/prod-ucs-content-store-eu-west/content/pii:S1381116901004812/STRIPIN/image/gif/37d68ca7ad8db277e8be0c92619a3ea4/si14.gif si1 si1.gif gif 335 14 62 ALTIMG 1-s2.0-S1381116901004812-gr1.sml https://s3.amazonaws.com/prod-ucs-content-store-us-east/content/pii:S1381116901004812/gr1/THUMBNAIL/image/gif/933b5e8c16af41e82a2c11b314500ccc/gr1.sml https://s3-eu-west-1.amazonaws.com/prod-ucs-content-store-eu-west/content/pii:S1381116901004812/gr1/THUMBNAIL/image/gif/933b5e8c16af41e82a2c11b314500ccc/gr1.sml gr1 gr1.sml sml 851 54 125 IMAGE-THUMBNAIL 1-s2.0-S1381116901004812-gr1.gif https://s3.amazonaws.com/prod-ucs-content-store-us-east/content/pii:S1381116901004812/gr1/DOWNSAMPLED/image/gif/44ee15b40d2858f1a10a406c1209c15c/gr1.gif https://s3-eu-west-1.amazonaws.com/prod-ucs-content-store-eu-west/content/pii:S1381116901004812/gr1/DOWNSAMPLED/image/gif/44ee15b40d2858f1a10a406c1209c15c/gr1.gif gr1 gr1.gif gif 5939 218 503 IMAGE-DOWNSAMPLED 1-s2.0-S1381116901004812-gr2.sml https://s3.amazonaws.com/prod-ucs-content-store-us-east/content/pii:S1381116901004812/gr2/THUMBNAIL/image/gif/c2dd1355bdd6c19c56af8237791e043f/gr2.sml https://s3-eu-west-1.amazonaws.com/prod-ucs-content-store-eu-west/content/pii:S1381116901004812/gr2/THUMBNAIL/image/gif/c2dd1355bdd6c19c56af8237791e043f/gr2.sml gr2 gr2.sml sml 1174 56 125 IMAGE-THUMBNAIL 1-s2.0-S1381116901004812-gr2.jpg https://s3.amazonaws.com/prod-ucs-content-store-us-east/content/pii:S1381116901004812/gr2/DOWNSAMPLED/image/jpeg/18fc2b19f839076046d126cf084963e3/gr2.jpg https://s3-eu-west-1.amazonaws.com/prod-ucs-content-store-eu-west/content/pii:S1381116901004812/gr2/DOWNSAMPLED/image/jpeg/18fc2b19f839076046d126cf084963e3/gr2.jpg gr2 gr2.jpg jpg 30287 292 653 IMAGE-DOWNSAMPLED 1-s2.0-S1381116901004812-gr3.sml https://s3.amazonaws.com/prod-ucs-content-store-us-east/content/pii:S1381116901004812/gr3/THUMBNAIL/image/gif/d386dc369c072481206a726c5695daa6/gr3.sml https://s3-eu-west-1.amazonaws.com/prod-ucs-content-store-eu-west/content/pii:S1381116901004812/gr3/THUMBNAIL/image/gif/d386dc369c072481206a726c5695daa6/gr3.sml gr3 gr3.sml sml 1260 88 125 IMAGE-THUMBNAIL 1-s2.0-S1381116901004812-gr3.gif https://s3.amazonaws.com/prod-ucs-content-store-us-east/content/pii:S1381116901004812/gr3/DOWNSAMPLED/image/gif/ef384f6b5d4b523bb1699b1f361801d3/gr3.gif https://s3-eu-west-1.amazonaws.com/prod-ucs-content-store-eu-west/content/pii:S1381116901004812/gr3/DOWNSAMPLED/image/gif/ef384f6b5d4b523bb1699b1f361801d3/gr3.gif gr3 gr3.gif gif 4132 213 301 IMAGE-DOWNSAMPLED 1-s2.0-S1381116901004812-gr4.sml https://s3.amazonaws.com/prod-ucs-content-store-us-east/content/pii:S1381116901004812/gr4/THUMBNAIL/image/gif/9a70bda6de4cc520faff402a6ef824b6/gr4.sml https://s3-eu-west-1.amazonaws.com/prod-ucs-content-store-eu-west/content/pii:S1381116901004812/gr4/THUMBNAIL/image/gif/9a70bda6de4cc520faff402a6ef824b6/gr4.sml gr4 gr4.sml sml 1530 46 125 IMAGE-THUMBNAIL 1-s2.0-S1381116901004812-gr4.gif https://s3.amazonaws.com/prod-ucs-content-store-us-east/content/pii:S1381116901004812/gr4/DOWNSAMPLED/image/gif/7f84d6e7137d3f5282b4086fb8391a64/gr4.gif https://s3-eu-west-1.amazonaws.com/prod-ucs-content-store-eu-west/content/pii:S1381116901004812/gr4/DOWNSAMPLED/image/gif/7f84d6e7137d3f5282b4086fb8391a64/gr4.gif gr4 gr4.gif gif 26022 248 672 IMAGE-DOWNSAMPLED MOLCAA 3456 S1381-1169(01)00481-2 10.1016/S1381-1169(01)00481-2 Elsevier Science B.V. Fig. 1 Formation of heterogeneous Ti and Zr metallocene catalysts. Fig. 2 Activities of homogeneous and heterogeneous ethylene polymerisation of catalysts 1 and 2. Fig. 3 Alkynyl substituted titanocenes. Fig. 4 Disorientation of the montmorillonite layers and formation of silica acid dendrimers by acid treatment. Table 1 Ethylene polymerisation with homogeneous and heterogeneous Ti and Zr metallocenes on kaolin a Polymerisation Catalyst Activity (kgPE/molZr(Ti)h) M̄ η × 10−6 (g/mol) T M (°C) Homogeneous Cp2ZrCl2 17437 0.30 136.5 Cp2ZrHCl 15683 0.32 136.7 Cp2TiCl2 9100 0.37 136.8 Heterogeneous Cp2ZrCl2 5269 0.38 137.7 Cp2ZrHCl 4310 0.48 138.4 Cp2TiCl2 1463 0.90 137.0 a Homogeneous: 0.003mmol Zr (Ti); Al/Zr (Ti)=2000; cocatalyst: 6mmol MAO. Heterogeneous: 5g kaolin, 0.024mmol Zr (Ti); Al/Zr (Ti)=500; cocatalyst: 12mmol TMA. Solvent: 200ml heptane; ethylene pressure: 10bar; polymerisation temperature: 50°C; polymerisation time: 1h. Table 2 Heterogeneous ethylene polymerisation on montmorillonite with TMA and TIBA as cocatalysts a Cocatalyst Al (mmol) Molar ratio of Al/Zr Activity (kg PE/mol Zr h) M̄ η × 10−6 (g/mol) T M (°C) TMA 6 500/1 5575 0.38 136.1 TIBA 6 500/1 6751 0.35 136.3 TMA 6 1000/1 7253 0.38 136.2 TIBA 6 1000/1 8250 0.34 136.2 TMA 12 2000/1 13508 0.34 136.5 TIBA 12 2000/1 14083 0.38 136.1 a Conditions: 5g montmorillonite; catalyst: Cp2ZrCl2; cocatalysts: TMA, TIBA; solvent: 200ml heptane; ethylene pressure: 10bar; polymerisation temperature: 50°C; polymerisation time: 1h. Table 3 Propylene polymerisation with homogeneous and heterogeneous rac-Et(Ind)2ZrCl2 catalysts a Catalyst system Catalyst/system/reaction temperature Molar ratio of Al/Zr Activity (kgPE/molZrh) M̄ η × 10−6 (g/mol) T M (°C) Tacticity (%) Homogeneous 4.8mmol MAO/4.8μmol Zr/40°C 1000 5700 32000 140.6 88.9 Heterogeneous 12mmol TMA/15μmol Zr/40°C 800 6800 1500 130.1 83.2 6mmol TIBA/1.9μmol Zr/50°C 3200 60300 11000 122.8 80.8 a Homogeneous: catalyst: rac-Et(Ind)2ZrCl2; cocatalyst: MAO. Heterogeneous: 5g montmorillonite; catalyst: rac-Et(Ind)2ZrCl2; cocatalysts: TMA, TIBA. Solvent: 250ml propene; polymerisation time: 1h. Table 4 Homogeneous and heterogeneous polymerisation of ethylene with the monomeric and dimeric titanocenes 1 and 2 as catalysts a Ti complex Catalyst system Activity (kgPE/molTih) M̄ η × 10−6 (g/mol) T M (°C) 1 Homogeneous 1367 0.42 138.8 Heterogeneous 2750 0.50 138.7 2 Homogeneous 3413 0.48 138.7 Heterogeneous 9563 0.77 137.8 a Homogeneous: catalyst 1: 0.006mmol; catalyst 2: 0.003mmol (two active titanium centres per molecule); cocatalyst: 12mmol MAO; Al/Ti=2000. Heterogeneous: 5g montmorillonite; catalyst 1: 0.006mmol; catalyst 2: 0.003mmol (two active titanium centres per molecule); cocatalyst: 12mmol TIBA; Al/Ti=2000. Solvent: 200ml heptane; ethylene pressure: 10bar; polymerisation temperature: 50°C; polymerisation time: 1h. Table 5 Homogeneous and heterogeneous polymerisation of ethylene with the alkynyl substituted titanocenes 3 and 4 as catalysts a Ti complex Catalyst system Activity (kgPE/molTih) M̄ η × 10−6 (g/mol) T M (°C) 3 Homogeneous 2902 0.50 137.5 Heterogeneous 5715 0.95 135.0 4 Homogeneous 435 0.32 135.4 Heterogeneous 3580 0.95 135.2 a Homogeneous: catalysts 3, 4: 0.006mmol; cocatalyst: 12mmol MAO; Al/Ti=2000. Heterogeneous: 5g montmorillonite; catalysts 3, 4: 0.006mmol; cocatalyst: 12mmol TIBA; Al/Ti=2000. Solvent: 200ml heptane; ethylene pressure: 10bar; polymerisation temperature: 60°C; polymerisation time: 1h. Polymerisation of ethylene or propylene with heterogeneous metallocene catalysts on clay minerals Karin Weiss a ∗ Christine Wirth-Pfeifer a Monika Hofmann a Sandra Botzenhardt a Heinrich Lang b K. Brüning b E. Meichel b a Department of Inorganic Chemistry, University of Bayreuth, D-95447 Bayreuth, Germany b Department of Inorganic Chemistry, University of Chemnitz, D-09111 Chemnitz, Germany * Corresponding author Heterogeneous metallocene catalysts avoid reactor fouling in olefin polymerisations. For technical use the metallocene catalysts must be fixed on carriers. Silica is one of the favoured inorganic carriers. But the activities of heterogeneous metallocene catalysts on silica in ethylene and propylene polymerisation are often lower than those of comparable homogeneous catalyst systems. We tested the clay minerals kaolin and montmorillonite as inorganic carriers for the polymerisation of ethylene and propylene with commercially available titanocenes and zirconocenes and also with new types of titanocenes. The heterogeneous catalysts on kaolin were less active in ethylene polymerisation as comparable homogeneous catalysts and they were not active in propylene polymerisation. In contrast the heterogeneous catalysts on montmorillonite are often more active in ethylene or propylene polymerisation than comparable homogeneous systems. As cocatalysts trimethylaluminium (AlMe3, TMA) and triisobutylaluminium (Al( i Bu3), TIBA) were used for heterogeneous polymerisations. As catalysts commercially available titanocenes and zirconocenes and also four titanocenes with unusual structures were tested which Lang et al. had synthesised. The high activities in ethylene or propylene polymerisations with montmorillonite may be due to the special structure of the montmorillonite carrier. Keywords Heterogeneous Ti and Zr metallocenes Clay minerals Montmorillonite structure 1 Introduction Some years ago we started with homogeneous ethylene and propylene polymerisations with Ti, Zr and Hf metallocenes as catalysts [1,2]. Our experience on heterogeneous metathesis catalysis [3,4] encouraged us to start 1998 with syntheses of heterogeneous metallocene catalysts. Many publications existed at this time on heterogeneous metallocene catalysts. Most of them used silica as inorganic carrier, therefore we tested the clay minerals kaolin and montmorillonite as inorganic carriers. In 1999 we published our first results on ethylene and propylene polymerisation with heterogeneous Ziegler–Natta and metallocene catalysts on the clay mineral montmorillonite [5]. The heterogeneous catalysts were formed in two simple reaction steps. In the first reaction an aluminium alkyl, triisobutylaluminium (Al( i Bu3), TIBA) or trimethylaluminium (AlMe3, TMA) and was added to a suspension of the dried inorganic carrier. The acid Si–OH groups on the surface of the montmorillonite or kaolin react with the Lewis acid to produce a heterogeneous cocatalyst. In a second reaction step the Ti or Zr metallocene was added to the suspension and the active heterogeneous catalyst system for the ethylene or propylene polymerisation was formed. Fig. 1 presents a postulated reaction pathway. As an inorganic carrier we used kaolin, a two-layered clay mineral and montmorillonite, a three-layered clay mineral. As catalysts we used commercially available metallocene catalysts like titanocenedichloride and zirconocenedichloride, or the Brintzinger catalyst, a bridged rac-Et(Ind)2ZrCl2, for olefin polymerisations. After our first results we recognised that we were not the first to use clay minerals as inorganic carrier for metallocene catalysts for olefin polymerisation. Suga et al. had studied a variety of clay minerals as inorganic carrier [6]. In contrast to them we used predominantly the cheap and easier to handle TIBA as cocatalyst and no additional TMA. 2 Experimental 2.1 Syntheses of the titanocenes 1–4 (by Lang et al.) (a) Synthesis of (η5-C5H5)[η5-C5H4SiMe2CHCH2]TiCl2 (1) [7]. (b) Synthesis of Me2Si(OCH2CH2CH2SiMe2CH2CH2SiMe2[η5-C5H4]Ti[η5-C5H5]Cl2)2 (2). To 0.7g (2.39mmol) (OCH3CH2CH2SiMe2CH2CH2SiMe2H)2 and 2.18g (4.78mmol) (η5-C5H5) [η5-C5H4SiMe2CHCH2]TiCl2 20ml THF is added. At 50°C two drops of Karsted catalyst are added and the mixture was stirred at 70°C for 12h. Then again some drops of the catalyst were added to the mixture and stirred at 70°C for 4h. Then the volatile products were distilled off in HV and 2.29g (2.39mmol, 100%) of the red, metallic bright metallocene 2 are separated. Elemental analysis for C40H68Cl4O2Si5Ti (958.3) (%): Anal. Calcd.: C, 50.13; H, 7.09. Found: C, 50.15; H, 7.05. IR (NaCl) (cm−1): ν SiC 1253 (vs); ν SiO 1058 (vs). 1 HNMR in CDCl3 (δ): 0.05 (m, 6H, Me 2 ̄ SiC H ̄ 2 ̄ C H ̄ 2 ̄ Si Me 2 ̄ ), 0.4 (s, 6H, Me2SiO), 0.6 (m, 4H, OCH2CH2 C H ̄ 2 ̄ Si); 1.6 (m, 4H, OCH2 C H ̄ 2 ̄ CH2Si); 3.6 (m, 4H, OC H ̄ 2 ̄ CH2CH2Si); 6.56 (s, 10H, C5H5); 6.63 (pt, 4H, C5H4, 3J HH =2.3 Hz); 6.90 (pt, 4H, C5H4, 3J HH =2.3 Hz). 13 C{1 H} NMR in CDCl3 (δ): 0.1 (Me2Si); 0.5 (Me2Si), 1.3 (Me2SiO); 4.1 (Me2SiCH2 C ̄ H 2 SiMe2); 7.3 (Me2Si C ̄ H 2 CH2SiMe2); 16.1 (OCH2CH2 C ̄ H 2 SiMe), 28.6 (OCH2 C ̄ H 2 CH2SiMe); 65.2 ( O C ̄ H 2 CH2CH2SiMe); 122.3 (C5H5), 122.7, 123.9 (C5H4), 131.8 (ipsoC–C5H4). (c) Synthesis of 3 (η5-C5H5)2Ti(Cl) (CCSiMe3). To the solution of 1.9g (3.0ml, 18mmol) HCCSiMe3 in 20ml THF at −70°C 7.35ml BuLi (18mmol, 2.5M solution in hexane) were added. After 5min the mixture is warmed up within 1h at 25°C. Then 4.55g (18mmol) (η5-C5H5)2TiCl2 are added and stirred for 10min. All volatile compound are distilled off in HV. To the residue ether is added and the solution filtered on silicagel. The ether is evaporated and 3.13g (10.1mmol, 56%) yellow orange solid titanocene 3 was produced. Elemental analysis for C15H19ClSiTi (310.70) (%): Anal. Calcd.: C, 58.06; H, 6.18. Found: C, 58.61; H, 6.74. IR (KBr) (cm−1): ν CC 2018 (w). 1 HNMR in CDCl3 (δ): 0.14 (s, 9H, CCSi Me 3 ̄ ); 6.43 (s, 10H, C5H5). 13 C{1 H} NMR in CDCl3 (δ): 1.4 (CCSiMe3); 116.8 (C5H5), 133.8 (CCSiMe3); 166.4 (CCSiMe3). EI-MS (m/z (relative intensity)): 310 (7), M+; 274 (96), M+–Cl; 178 (100), M+–CCSiMe3. (d) Synthesis of 4 (η5-C5H4SiMe3)2Ti(CCSiMe3)2 [8]. 2.2 Syntheses of heterogeneous Ti and Zr metallocene catalysts for ethylene and propylene polymerisation Commercially available montmorillonite K10 (Südchemie, Moosburg, Germany) was dried for 2h under argon or nitrogen at 200°C, kaolin in vacuum for 4h. Surface fixed alumoxanes were produced by reactions of TIBA or TMA with the dried carrier in toluene suspension. The reaction times with montmorillonite was 2h and with kaolin 3 days. The solvent was filtered and the residue washed twice with heptane to extract impurities. Then a solution of the metallocene catalyst in toluene was added. After 1h reaction time (with montmorillonite) and 4h (with kaolin) the heterogeneous metallocene catalysts were filtered and again washed twice with toluene. These catalysts can be used immediately for ethylene or propylene polymerisation. No further additives are necessary for olefin polymerisation. The catalysts can also be stored; after 1 week at 7°C the activity did not change. The ethylene polymerisation proceeded in heptane solution in a 1l Büchi autoclav usually at 10bar ethylene pressure. The polymerisation time was 1h. For propylene polymerisation 250ml propylene was condensed in the 1l reactor. For purification of the propylene 12mmol TIBA was added. The heterogeneous catalyst system was suspended in 10ml toluene and was transferred under argon pressure (6bar) into the reactor which was filled with liquid propylene. After reaching the reaction temperature the polymerisation continued for 1h before it was stopped. 3 Results Heterogeneous catalysts were produced with kaolin as inorganic carrier from Cp2ZrCl2, Cp2ZrHCl or Cp2TiCl2 and TMA as cocatalyst. These catalysts were active in ethylene polymerisation (Table 1 ), but not in propylene polymerisation. The three heterogeneous catalysts are not as active as the homogeneous catalysts are, but the molecular weights of the PE formed are higher than those of the homogeneous catalysts. In contrast to the heterogeneous catalysts on kaolin are the heterogeneous catalysts formed on montmorillonite as inorganic carrier very active in ethylene and propylene polymerisation. In many reactions their activities are higher than the activities of comparable homogeneous catalysts [9,10] (Table 2 ). The cocatalysts TMA and TIBA have some influence on the polymerisation activities, with TIBA as cocatalyst they are higher than with TMA. The polymerisation of propylene on montmorillonite was tested with TIBA or TMA as cocatalysts and the Brintzinger catalyst. On montmorillonite rac-Et(Ind)2ZrCl2 is a very active heterogeneous catalyst for ethylene or propylene polymerisations. The activities of these heterogeneous catalysts are remarkably higher than those of comparable homogeneous systems (Table 3 ). The polymerisation activity increase drastically when the reaction temperature changes from 40 to 50°C. The tacticities of the polymers formed with heterogeneous catalysts are not so high than those formed by homogeneous catalysts. Not only commercially available metallocenes were tested but also two silyl substituted titanocenes 1 and 2 and two alkynyl substituted titanocenes 3 and 4 as catalysts in homogeneous and heterogeneous ethylene polymerisation. The titanocene complexes 1–4 were synthesised by Lang et al., University of Chemnitz. The four titanocene complexes were tested as catalysts in homogeneous and heterogeneous ethylene polymerisations on montmorillonite. The activities of the heterogeneous silyl substituted catalysts 1 and 2 on montmorillonite are higher than those of the homogeneous catalysts (Table 4 ). Both titanium centres of the heterogeneous bimetallic catalyst 2 are obviously highly activated by the bridge and react with the heterogeneous cocatalyst on the montmorillonite surface [11] (Fig. 2 ). The heterogeneous alkynyl substituted titanocenes 3 and 4 are also very active in ethylene polymerisation and form polymers with higher molar masses [8] (Fig. 3 , Table 5 ). Both heterogeneous catalysts are more active than the homogeneous catalysts and produce PE with significant higher molar masses. 4 Conclusions The results of the studies on ethylene and propylene polymerisation with heterogeneous titanocene or zirconocene catalysts on kaolin or montmorillonite suggests that montmorillonite forms not the same catalytic centres as kaolin. The clay mineral montmorillonite has a three-layer structure, with an aluminium octaeder layer which is covered by two silica tetraeder layers; whereas kaolin has only two layers. For our studies we used the montmorillonite type K10, but we tested also K5, K20 and K30 types of montmorillonite (Südchemie, Moosburg, Germany) with different volumes or distribution of pores as inorganic carrier in ethylene polymerisation. They produce all similar polyethylenes as the montmorillonite type K10 forms under the same reaction conditions. Literature studies on clay minerals [12] revealed that montmorillonite is produced from bentonite by HCl or H2SO4 treatment at higher temperature. This process solves parts of the aluminium octaeders between the two insoluble silicate layers. By this reaction at the end of the layers moveable silica acids like dendrimers are formed on the montmorillonite surface. The cocatalysts TIBA or TMA can react with OH groups on these moveable silica acid arms and with the metallocenes to form many surface activated catalysts for ethylene and propylene polymerisation (Fig. 4 ). Acknowledgements The authors thank Josef Breu, University of Regensburg, for valuable discussion on the montmorillonite structure. References [1] H. Lang S. Blau A. Muth K. Weiss U. Neugebauer J. Organomet. Chem. 490 1995 C32 [2] K. Weiss U. Neugebauer S. Blau H. Lang J. Organomet. Chem. 520 1996 171 [3] K. Weiss, W. Guthmann, S. Maisuls, Heterogene Bimetall-Metathesekatalysatoren aus Carben-komplexen des Fischer Typs und dem reduzierten Phillipskatalysator, Angew. Chem. 100 (1988) 268; Angew. Chem. Int. Ed. Engl. 27 (1988) 267. [4] K. Weiss, G. Lößel, Darstellung heterogener, metatheseaktiver Carbenkomplexe des Schrock Typs durch Reaktion von Carbinwolfram(VI)komplexen mit Kieselgel, Angew. Chem. 101 (1989) 75; Angew. Chem. Int. Ed. Engl. 28 (1989) 62. [5] K. Weiss, S. Botzenhardt, M. Hofmann, Ziegler–Natta and metallocene polymerisation of olefins with heterogeneous catalysts, in: W. Kaminsky (Ed.), Metalorganic Catalysts for Synthesis and Polymerisation, Springer, Berlin, 1999, pp. 97–101. [6] Y. Suga, Y. Maruyama, E. Isobe, T. Suziki, F. Shimizu, EP 0511 665 A2 (1992), to Mitsubishi Kasei Corporation. [7] D. Seyferth, R. Wyrwa, PCT Int. Appl. WO 97 32,908 [Cl. C08F10/00] (12 September 1997). D. Seyferth, R. Wyrwa, PCT Int. Appl. WO 97 32,918 [Cl. C08G77/60] (12 September 1997). [8] H. Lang D.S. A George G. Rheinwald Coord. Chem. Rev. 101 2000 206 207 H. Lang D. Seyferth Z. Naturforschung B 45 1990 212 [9] S. Botzenhardt, Thesis, University of Bayreuth, 1999. [10] M. Hofmann, Thesis, University of Bayreuth, 2000. [11] C. Wirth-Pfeifer, Diplomarbeit, University of Bayreuth, 2000. [12] G. Lagaly, R. Fahn, Ullmanns Encyklopädie der technischen Chemie, Vol. 23, GmbH, Weinheim, 1983, p. 311.",
      "scopus-id": "3042793703",
      "coredata": {
        "eid": "1-s2.0-S1381116901004812",
        "dc:description": "Heterogeneous metallocene catalysts avoid reactor fouling in olefin polymerisations. For technical use the metallocene catalysts must be fixed on carriers. Silica is one of the favoured inorganic carriers. But the activities of heterogeneous metallocene catalysts on silica in ethylene and propylene polymerisation are often lower than those of comparable homogeneous catalyst systems. We tested the clay minerals kaolin and montmorillonite as inorganic carriers for the polymerisation of ethylene and propylene with commercially available titanocenes and zirconocenes and also with new types of titanocenes. The heterogeneous catalysts on kaolin were less active in ethylene polymerisation as comparable homogeneous catalysts and they were not active in propylene polymerisation. In contrast the heterogeneous catalysts on montmorillonite are often more active in ethylene or propylene polymerisation than comparable homogeneous systems. As cocatalysts trimethylaluminium (AlMe3, TMA) and triisobutylaluminium (Al( i Bu3), TIBA) were used for heterogeneous polymerisations. As catalysts commercially available titanocenes and zirconocenes and also four titanocenes with unusual structures were tested which Lang et al. had synthesised. The high activities in ethylene or propylene polymerisations with montmorillonite may be due to the special structure of the montmorillonite carrier.",
        "openArchiveArticle": "false",
        "prism:coverDate": "2002-05-31",
        "openaccessUserLicense": null,
        "prism:aggregationType": "Journal",
        "prism:url": "https://api.elsevier.com/content/article/pii/S1381116901004812",
        "dc:creator": [
          {
            "@_fa": "true",
            "$": "Weiss, Karin"
          },
          {
            "@_fa": "true",
            "$": "Wirth-Pfeifer, Christine"
          },
          {
            "@_fa": "true",
            "$": "Hofmann, Monika"
          },
          {
            "@_fa": "true",
            "$": "Botzenhardt, Sandra"
          },
          {
            "@_fa": "true",
            "$": "Lang, Heinrich"
          },
          {
            "@_fa": "true",
            "$": "Brüning, K."
          },
          {
            "@_fa": "true",
            "$": "Meichel, E."
          }
        ],
        "link": [
          {
            "@_fa": "true",
            "@rel": "self",
            "@href": "https://api.elsevier.com/content/article/pii/S1381116901004812"
          },
          {
            "@_fa": "true",
            "@rel": "scidir",
            "@href": "https://www.sciencedirect.com/science/article/pii/S1381116901004812"
          }
        ],
        "dc:format": "application/json",
        "openaccessType": null,
        "pii": "S1381-1169(01)00481-2",
        "prism:volume": "182",
        "prism:publisher": "Elsevier Science B.V.",
        "dc:title": "Polymerisation of ethylene or propylene with heterogeneous metallocene catalysts on clay minerals",
        "prism:copyright": "Copyright © 2002 Elsevier Science B.V. All rights reserved.",
        "openaccess": "0",
        "prism:issn": "13811169",
        "dcterms:subject": [
          {
            "@_fa": "true",
            "$": "Heterogeneous Ti and Zr metallocenes"
          },
          {
            "@_fa": "true",
            "$": "Clay minerals"
          },
          {
            "@_fa": "true",
            "$": "Montmorillonite structure"
          }
        ],
        "openaccessArticle": "false",
        "prism:publicationName": "Journal of Molecular Catalysis A: Chemical",
        "openaccessSponsorType": null,
        "prism:pageRange": "143-149",
        "prism:endingPage": "149",
        "pubType": "fla",
        "prism:coverDisplayDate": "31 May 2002",
        "prism:doi": "10.1016/S1381-1169(01)00481-2",
        "prism:startingPage": "143",
        "dc:identifier": "doi:10.1016/S1381-1169(01)00481-2",
        "openaccessSponsorName": null
      },
      "objects": {
        "object": [
          {
            "@category": "thumbnail",
            "@height": "19",
            "@width": "31",
            "@_fa": "true",
            "$": "https://api.elsevier.com/content/object/eid/1-s2.0-S1381116901004812-si9.gif?httpAccept=%2A%2F%2A",
            "@multimediatype": "GIF image file",
            "@type": "ALTIMG",
            "@size": "244",
            "@ref": "si9",
            "@mimetype": "image/gif"
          },
          {
            "@category": "thumbnail",
            "@height": "19",
            "@width": "102",
            "@_fa": "true",
            "$": "https://api.elsevier.com/content/object/eid/1-s2.0-S1381116901004812-si8.gif?httpAccept=%2A%2F%2A",
            "@multimediatype": "GIF image file",
            "@type": "ALTIMG",
            "@size": "550",
            "@ref": "si8",
            "@mimetype": "image/gif"
          },
          {
            "@category": "thumbnail",
            "@height": "16",
            "@width": "76",
            "@_fa": "true",
            "$": "https://api.elsevier.com/content/object/eid/1-s2.0-S1381116901004812-si7.gif?httpAccept=%2A%2F%2A",
            "@multimediatype": "GIF image file",
            "@type": "ALTIMG",
            "@size": "353",
            "@ref": "si7",
            "@mimetype": "image/gif"
          },
          {
            "@category": "thumbnail",
            "@height": "16",
            "@width": "76",
            "@_fa": "true",
            "$": "https://api.elsevier.com/content/object/eid/1-s2.0-S1381116901004812-si6.gif?httpAccept=%2A%2F%2A",
            "@multimediatype": "GIF image file",
            "@type": "ALTIMG",
            "@size": "353",
            "@ref": "si6",
            "@mimetype": "image/gif"
          },
          {
            "@category": "thumbnail",
            "@height": "31",
            "@width": "44",
            "@_fa": "true",
            "$": "https://api.elsevier.com/content/object/eid/1-s2.0-S1381116901004812-si5.gif?httpAccept=%2A%2F%2A",
            "@multimediatype": "GIF image file",
            "@type": "ALTIMG",
            "@size": "339",
            "@ref": "si5",
            "@mimetype": "image/gif"
          },
          {
            "@category": "thumbnail",
            "@height": "31",
            "@width": "33",
            "@_fa": "true",
            "$": "https://api.elsevier.com/content/object/eid/1-s2.0-S1381116901004812-si4.gif?httpAccept=%2A%2F%2A",
            "@multimediatype": "GIF image file",
            "@type": "ALTIMG",
            "@size": "273",
            "@ref": "si4",
            "@mimetype": "image/gif"
          },
          {
            "@category": "thumbnail",
            "@height": "31",
            "@width": "33",
            "@_fa": "true",
            "$": "https://api.elsevier.com/content/object/eid/1-s2.0-S1381116901004812-si3.gif?httpAccept=%2A%2F%2A",
            "@multimediatype": "GIF image file",
            "@type": "ALTIMG",
            "@size": "273",
            "@ref": "si3",
            "@mimetype": "image/gif"
          },
          {
            "@category": "thumbnail",
            "@height": "31",
            "@width": "158",
            "@_fa": "true",
            "$": "https://api.elsevier.com/content/object/eid/1-s2.0-S1381116901004812-si2.gif?httpAccept=%2A%2F%2A",
            "@multimediatype": "GIF image file",
            "@type": "ALTIMG",
            "@size": "907",
            "@ref": "si2",
            "@mimetype": "image/gif"
          },
          {
            "@category": "thumbnail",
            "@height": "19",
            "@width": "102",
            "@_fa": "true",
            "$": "https://api.elsevier.com/content/object/eid/1-s2.0-S1381116901004812-si16.gif?httpAccept=%2A%2F%2A",
            "@multimediatype": "GIF image file",
            "@type": "ALTIMG",
            "@size": "550",
            "@ref": "si16",
            "@mimetype": "image/gif"
          },
          {
            "@category": "thumbnail",
            "@height": "22",
            "@width": "81",
            "@_fa": "true",
            "$": "https://api.elsevier.com/content/object/eid/1-s2.0-S1381116901004812-si15.gif?httpAccept=%2A%2F%2A",
            "@multimediatype": "GIF image file",
            "@type": "ALTIMG",
            "@size": "511",
            "@ref": "si15",
            "@mimetype": "image/gif"
          },
          {
            "@category": "thumbnail",
            "@height": "14",
            "@width": "62",
            "@_fa": "true",
            "$": "https://api.elsevier.com/content/object/eid/1-s2.0-S1381116901004812-si14.gif?httpAccept=%2A%2F%2A",
            "@multimediatype": "GIF image file",
            "@type": "ALTIMG",
            "@size": "335",
            "@ref": "si14",
            "@mimetype": "image/gif"
          },
          {
            "@category": "thumbnail",
            "@height": "19",
            "@width": "42",
            "@_fa": "true",
            "$": "https://api.elsevier.com/content/object/eid/1-s2.0-S1381116901004812-si13.gif?httpAccept=%2A%2F%2A",
            "@multimediatype": "GIF image file",
            "@type": "ALTIMG",
            "@size": "300",
            "@ref": "si13",
            "@mimetype": "image/gif"
          },
          {
            "@category": "thumbnail",
            "@height": "19",
            "@width": "31",
            "@_fa": "true",
            "$": "https://api.elsevier.com/content/object/eid/1-s2.0-S1381116901004812-si12.gif?httpAccept=%2A%2F%2A",
            "@multimediatype": "GIF image file",
            "@type": "ALTIMG",
            "@size": "244",
            "@ref": "si12",
            "@mimetype": "image/gif"
          },
          {
            "@category": "thumbnail",
            "@height": "19",
            "@width": "31",
            "@_fa": "true",
            "$": "https://api.elsevier.com/content/object/eid/1-s2.0-S1381116901004812-si11.gif?httpAccept=%2A%2F%2A",
            "@multimediatype": "GIF image file",
            "@type": "ALTIMG",
            "@size": "244",
            "@ref": "si11",
            "@mimetype": "image/gif"
          },
          {
            "@category": "thumbnail",
            "@height": "19",
            "@width": "31",
            "@_fa": "true",
            "$": "https://api.elsevier.com/content/object/eid/1-s2.0-S1381116901004812-si10.gif?httpAccept=%2A%2F%2A",
            "@multimediatype": "GIF image file",
            "@type": "ALTIMG",
            "@size": "244",
            "@ref": "si10",
            "@mimetype": "image/gif"
          },
          {
            "@category": "thumbnail",
            "@height": "14",
            "@width": "62",
            "@_fa": "true",
            "$": "https://api.elsevier.com/content/object/eid/1-s2.0-S1381116901004812-si1.gif?httpAccept=%2A%2F%2A",
            "@multimediatype": "GIF image file",
            "@type": "ALTIMG",
            "@size": "335",
            "@ref": "si1",
            "@mimetype": "image/gif"
          },
          {
            "@category": "thumbnail",
            "@height": "54",
            "@width": "125",
            "@_fa": "true",
            "$": "https://api.elsevier.com/content/object/eid/1-s2.0-S1381116901004812-gr1.sml?httpAccept=%2A%2F%2A",
            "@multimediatype": "GIF image file",
            "@type": "IMAGE-THUMBNAIL",
            "@size": "851",
            "@ref": "gr1",
            "@mimetype": "image/gif"
          },
          {
            "@category": "standard",
            "@height": "218",
            "@width": "503",
            "@_fa": "true",
            "$": "https://api.elsevier.com/content/object/eid/1-s2.0-S1381116901004812-gr1.gif?httpAccept=%2A%2F%2A",
            "@multimediatype": "GIF image file",
            "@type": "IMAGE-DOWNSAMPLED",
            "@size": "5939",
            "@ref": "gr1",
            "@mimetype": "image/gif"
          },
          {
            "@category": "thumbnail",
            "@height": "56",
            "@width": "125",
            "@_fa": "true",
            "$": "https://api.elsevier.com/content/object/eid/1-s2.0-S1381116901004812-gr2.sml?httpAccept=%2A%2F%2A",
            "@multimediatype": "GIF image file",
            "@type": "IMAGE-THUMBNAIL",
            "@size": "1174",
            "@ref": "gr2",
            "@mimetype": "image/gif"
          },
          {
            "@category": "standard",
            "@height": "292",
            "@width": "653",
            "@_fa": "true",
            "$": "https://api.elsevier.com/content/object/eid/1-s2.0-S1381116901004812-gr2.jpg?httpAccept=%2A%2F%2A",
            "@multimediatype": "JPEG image file",
            "@type": "IMAGE-DOWNSAMPLED",
            "@size": "30287",
            "@ref": "gr2",
            "@mimetype": "image/jpeg"
          },
          {
            "@category": "thumbnail",
            "@height": "88",
            "@width": "125",
            "@_fa": "true",
            "$": "https://api.elsevier.com/content/object/eid/1-s2.0-S1381116901004812-gr3.sml?httpAccept=%2A%2F%2A",
            "@multimediatype": "GIF image file",
            "@type": "IMAGE-THUMBNAIL",
            "@size": "1260",
            "@ref": "gr3",
            "@mimetype": "image/gif"
          },
          {
            "@category": "standard",
            "@height": "213",
            "@width": "301",
            "@_fa": "true",
            "$": "https://api.elsevier.com/content/object/eid/1-s2.0-S1381116901004812-gr3.gif?httpAccept=%2A%2F%2A",
            "@multimediatype": "GIF image file",
            "@type": "IMAGE-DOWNSAMPLED",
            "@size": "4132",
            "@ref": "gr3",
            "@mimetype": "image/gif"
          },
          {
            "@category": "thumbnail",
            "@height": "46",
            "@width": "125",
            "@_fa": "true",
            "$": "https://api.elsevier.com/content/object/eid/1-s2.0-S1381116901004812-gr4.sml?httpAccept=%2A%2F%2A",
            "@multimediatype": "GIF image file",
            "@type": "IMAGE-THUMBNAIL",
            "@size": "1530",
            "@ref": "gr4",
            "@mimetype": "image/gif"
          },
          {
            "@category": "standard",
            "@height": "248",
            "@width": "672",
            "@_fa": "true",
            "$": "https://api.elsevier.com/content/object/eid/1-s2.0-S1381116901004812-gr4.gif?httpAccept=%2A%2F%2A",
            "@multimediatype": "GIF image file",
            "@type": "IMAGE-DOWNSAMPLED",
            "@size": "26022",
            "@ref": "gr4",
            "@mimetype": "image/gif"
          }
        ]
      },
      "link": {
        "@rel": "abstract",
        "@href": "https://api.elsevier.com/content/abstract/scopus_id/3042793703"
      }
    }
  }
}