{
  "metadata": {
    "title": "<ce:italic>ω</ce:italic>-Sulfonic-perfluoroalkylated poly(styrene–maleic anhydride)/silica hybridized nanocomposite as a new kind of solid acid catalyst",
    "authors": "; ; ",
    "journal": "Journal of Molecular Catalysis A: Chemical",
    "date": "2012-12-31",
    "doi": "10.1016/j.molcata.2012.08.011",
    "abstract": "",
    "uri": "https://api.elsevier.com/content/article/pii/S1381116912002567",
    "pii": "S1381116912002567"
  },
  "fulltext": {
    "full-text-retrieval-response": {
      "scopus-eid": "2-s2.0-84867463802",
      "originalText": "serial JL 271358 291210 291744 291790 291809 31 Journal of Molecular Catalysis A: Chemical JOURNALMOLECULARCATALYSISACHEMICAL 2012-08-24 2012-08-24 2012-10-06T17:47:50 1-s2.0-S1381116912002567 S1381-1169(12)00256-7 S1381116912002567 10.1016/j.molcata.2012.08.011 S300 S300.1 FULL-TEXT 1-s2.0-S1381116912X00098 2020-02-22T21:51:27.625296Z 0 0 20121201 20121231 2012 2012-08-24T00:00:00Z articleinfo crossmark dco dateupdated tomb dateloaded datesearch indexeddate volumelist yearnav absattachment articletitlenorm authfirstinitialnorm authfirstsurnamenorm cid cids contenttype copyright dateloadedtxt docsubtype doctype doi eid ewtransactionid hubeid issn issnnorm itemstage itemtransactionid itemweight openaccess openarchive pg pgfirst pglast pii piinorm pubdateend pubdatestart pubdatetxt pubyr sectiontitle sortorder srctitle srctitlenorm srctype subheadings suppl volfirst volissue webpdf webpdfpagecount figure table e-component body acknowledge affil appendices articletitle auth authfirstini authfull authkeywords authlast primabst ref specialabst alllist content subj ssids 1381-1169 13811169 false 365 365 C Volume 365 13 73 79 73 79 201212 December 2012 2012-12-01 2012-12-31 2012 Regular papers article fla Copyright © 2012 Elsevier B.V. All rights reserved. SULFONICPERFLUOROALKYLATEDPOLYSTYRENEMALEICANHYDRIDESILICAHYBRIDIZEDNANOCOMPOSITEANEWKINDSOLIDACIDCATALYST LIN Z 1 Introduction 2 Experimental 2.1 General information 2.2 Synthesis of FSMA/SiO2 2.3 Catalysis studies 3 Results and discussion 3.1 Synthesis and physical characterization 3.2 Pore structure and its controlling 3.3 The adjustment on exchange capacity of FSMA/SiO2 3.4 Cyclization of pseudoionone 3.5 Condensation of indole 3.6 Esterification of benzoic acid 4 Conclusions Acknowledgements Appendix A Supplementary data References SCHUBERT 2011 575 582 U YAO 2008 3357 3366 W ZHOU 2008 4986 4992 Z HOFFMANN 2006 3216 3251 F DESCALZO 2006 5924 5948 A CHEETHAM 2006 4780 4795 A GOMEZROMERO 2001 163 174 P ESCRIBANO 2008 23 40 P INNOCENZI 2005 3821 3831 P HOLDER 2008 1064 1078 E CHANDRASEKARAN 2011 1228 1238 J MITZI 2001 3283 3298 D PARDO 2011 672 687 R WANG 2010 361 376 M VALLETREGI 2011 596 607 M KUMAR 2010 1 14 P TRILLA 2008 577 590 M NAZIR 2010 100 106 T KANG 2007 903 912 D AHMAD 2001 3320 3330 Z SCHOTTNER 2001 3422 3435 G VALLIANT 2011 5083 5095 E BOURY 2002 795 802 B SHARMA 1995 3 23 M HEIDEKUM 1999 217 222 A YADAV 2000 153 165 G HARMER 2001 45 62 M YADAV 2002 99 110 G BARBARO 2008 515 529 P ALEXANDRATOS 2008 388 398 S SON 2011 2130 2132 S CHENG 2012 65 72 Y HARMER 1996 7708 7715 M MOLNAR 2008 159 181 A ALVARO 2004 956 957 M VLASENKO 2009 82 87 N ALVARO 2005 48 55 M MACQUARRIE 2005 2363 2365 D MART 2008 169 178 F HEIDEKUM 1998 260 263 A WANG 2001 666 670 S HARMER 1997 1803 1804 M HARMER 2000 7 14 M ZHAO 1983 4908 4910 C LIN 2007 31 35 Z LIN 2006 19 26 Z LIN 2005 3556 3558 Z LINX2012X73 LINX2012X73X79 LINX2012X73XZ LINX2012X73X79XZ 2020-02-17T21:51:24.544Z http://vtw.elsevier.com/data/voc/AddOnTypes/50.7/nlp S1381116912002567 Program for Innovative Research Team in Science and Technology in Fujian Province University Program for Jilin University Science and Technology Innovative Research Team http://data.elsevier.com/vocabulary/SciValFunders/501100013284 http://sws.geonames.org/1814991/ National Natural Science Foundation of China 60976019 SRFDP 20093223110002 NSFC National Natural Science Foundation of China http://data.elsevier.com/vocabulary/SciValFunders/501100001809 http://sws.geonames.org/1814991/ IRTSTFJ This work was supported by the National Natural Science Foundation of China ( 60976019 ), Specialized Research Fund for the Doctoral Program of Higher Education ( SRFDP 20093223110002 ), Program for Innovative Research Team in Science and Technology in Fujian Province University ( IRTSTFJ ). item S1381-1169(12)00256-7 S1381116912002567 1-s2.0-S1381116912002567 10.1016/j.molcata.2012.08.011 271358 2012-10-06T14:18:29.167077-04:00 2012-12-01 2012-12-31 1-s2.0-S1381116912002567-main.pdf https://s3.amazonaws.com/prod-ucs-content-store-us-east/content/pii:S1381116912002567/MAIN/application/pdf/c244716684f6b47873e7d4648bcd4e1c/main.pdf https://s3-eu-west-1.amazonaws.com/prod-ucs-content-store-eu-west/content/pii:S1381116912002567/MAIN/application/pdf/c244716684f6b47873e7d4648bcd4e1c/main.pdf main.pdf pdf true 855195 MAIN 7 1-s2.0-S1381116912002567-main_1.png https://s3.amazonaws.com/prod-ucs-content-store-us-east/content/pii:S1381116912002567/PREVIEW/image/png/38530a48c893cc24842b750c78e420df/main_1.png https://s3-eu-west-1.amazonaws.com/prod-ucs-content-store-eu-west/content/pii:S1381116912002567/PREVIEW/image/png/38530a48c893cc24842b750c78e420df/main_1.png main_1.png png 62919 849 656 IMAGE-WEB-PDF 1 1-s2.0-S1381116912002567-mmc1.doc https://s3.amazonaws.com/prod-ucs-content-store-us-east/content/pii:S1381116912002567/mmc1/MAIN/application/msword/4f9b2d4c162e0e2120fc34ba5cc31664/mmc1.doc https://s3-eu-west-1.amazonaws.com/prod-ucs-content-store-eu-west/content/pii:S1381116912002567/mmc1/MAIN/application/msword/4f9b2d4c162e0e2120fc34ba5cc31664/mmc1.doc mmc1 mmc1.doc doc 596480 APPLICATION 1-s2.0-S1381116912002567-sc1.jpg https://s3.amazonaws.com/prod-ucs-content-store-us-east/content/pii:S1381116912002567/sc1/DOWNSAMPLED/image/jpeg/7e39ed2dd96bca3306271db5f9af29a8/sc1.jpg https://s3-eu-west-1.amazonaws.com/prod-ucs-content-store-eu-west/content/pii:S1381116912002567/sc1/DOWNSAMPLED/image/jpeg/7e39ed2dd96bca3306271db5f9af29a8/sc1.jpg sc1 sc1.jpg jpg 55516 361 631 IMAGE-DOWNSAMPLED 1-s2.0-S1381116912002567-sc1.sml https://s3.amazonaws.com/prod-ucs-content-store-us-east/content/pii:S1381116912002567/sc1/THUMBNAIL/image/gif/bab26447b4cb01bdfe3bcb413df6455d/sc1.sml https://s3-eu-west-1.amazonaws.com/prod-ucs-content-store-eu-west/content/pii:S1381116912002567/sc1/THUMBNAIL/image/gif/bab26447b4cb01bdfe3bcb413df6455d/sc1.sml sc1 sc1.sml sml 3794 125 219 IMAGE-THUMBNAIL 1-s2.0-S1381116912002567-sc1_lrg.jpg https://s3.amazonaws.com/prod-ucs-content-store-us-east/content/pii:S1381116912002567/sc1/HIGHRES/image/jpeg/6516e6a5f24c1534c5a076848a628d1d/sc1_lrg.jpg https://s3-eu-west-1.amazonaws.com/prod-ucs-content-store-eu-west/content/pii:S1381116912002567/sc1/HIGHRES/image/jpeg/6516e6a5f24c1534c5a076848a628d1d/sc1_lrg.jpg sc1 sc1_lrg.jpg jpg 396185 1599 2793 IMAGE-HIGH-RES 1-s2.0-S1381116912002567-sc2.jpg https://s3.amazonaws.com/prod-ucs-content-store-us-east/content/pii:S1381116912002567/sc2/DOWNSAMPLED/image/jpeg/37c46b5e6583a9ac20cf544b592c5227/sc2.jpg https://s3-eu-west-1.amazonaws.com/prod-ucs-content-store-eu-west/content/pii:S1381116912002567/sc2/DOWNSAMPLED/image/jpeg/37c46b5e6583a9ac20cf544b592c5227/sc2.jpg sc2 sc2.jpg jpg 12444 83 383 IMAGE-DOWNSAMPLED 1-s2.0-S1381116912002567-sc2.sml https://s3.amazonaws.com/prod-ucs-content-store-us-east/content/pii:S1381116912002567/sc2/THUMBNAIL/image/gif/8d50a9863fbbef17543847f6dfcc6e08/sc2.sml https://s3-eu-west-1.amazonaws.com/prod-ucs-content-store-eu-west/content/pii:S1381116912002567/sc2/THUMBNAIL/image/gif/8d50a9863fbbef17543847f6dfcc6e08/sc2.sml sc2 sc2.sml sml 2241 48 219 IMAGE-THUMBNAIL 1-s2.0-S1381116912002567-sc2_lrg.jpg https://s3.amazonaws.com/prod-ucs-content-store-us-east/content/pii:S1381116912002567/sc2/HIGHRES/image/jpeg/fcd1402d0d9378b5a3ef6189019241cd/sc2_lrg.jpg https://s3-eu-west-1.amazonaws.com/prod-ucs-content-store-eu-west/content/pii:S1381116912002567/sc2/HIGHRES/image/jpeg/fcd1402d0d9378b5a3ef6189019241cd/sc2_lrg.jpg sc2 sc2_lrg.jpg jpg 64746 368 1695 IMAGE-HIGH-RES 1-s2.0-S1381116912002567-sc3.jpg https://s3.amazonaws.com/prod-ucs-content-store-us-east/content/pii:S1381116912002567/sc3/DOWNSAMPLED/image/jpeg/9f68066ef0122688a386233ed66ffd6c/sc3.jpg https://s3-eu-west-1.amazonaws.com/prod-ucs-content-store-eu-west/content/pii:S1381116912002567/sc3/DOWNSAMPLED/image/jpeg/9f68066ef0122688a386233ed66ffd6c/sc3.jpg sc3 sc3.jpg jpg 15603 82 339 IMAGE-DOWNSAMPLED 1-s2.0-S1381116912002567-sc3.sml https://s3.amazonaws.com/prod-ucs-content-store-us-east/content/pii:S1381116912002567/sc3/THUMBNAIL/image/gif/895cab1aec7cc2eb0063580d1a23edd5/sc3.sml https://s3-eu-west-1.amazonaws.com/prod-ucs-content-store-eu-west/content/pii:S1381116912002567/sc3/THUMBNAIL/image/gif/895cab1aec7cc2eb0063580d1a23edd5/sc3.sml sc3 sc3.sml sml 1761 53 219 IMAGE-THUMBNAIL 1-s2.0-S1381116912002567-sc3_lrg.jpg https://s3.amazonaws.com/prod-ucs-content-store-us-east/content/pii:S1381116912002567/sc3/HIGHRES/image/jpeg/e5ff4616460d6ea93c0ffa5ff393dbf4/sc3_lrg.jpg https://s3-eu-west-1.amazonaws.com/prod-ucs-content-store-eu-west/content/pii:S1381116912002567/sc3/HIGHRES/image/jpeg/e5ff4616460d6ea93c0ffa5ff393dbf4/sc3_lrg.jpg sc3 sc3_lrg.jpg jpg 70366 362 1500 IMAGE-HIGH-RES 1-s2.0-S1381116912002567-sc4.jpg https://s3.amazonaws.com/prod-ucs-content-store-us-east/content/pii:S1381116912002567/sc4/DOWNSAMPLED/image/jpeg/a679e81edd335a4b4fdab88f72d058f1/sc4.jpg https://s3-eu-west-1.amazonaws.com/prod-ucs-content-store-eu-west/content/pii:S1381116912002567/sc4/DOWNSAMPLED/image/jpeg/a679e81edd335a4b4fdab88f72d058f1/sc4.jpg sc4 sc4.jpg jpg 9561 51 339 IMAGE-DOWNSAMPLED 1-s2.0-S1381116912002567-sc4.sml https://s3.amazonaws.com/prod-ucs-content-store-us-east/content/pii:S1381116912002567/sc4/THUMBNAIL/image/gif/8aaf321765744db14235a73f33c367f4/sc4.sml https://s3-eu-west-1.amazonaws.com/prod-ucs-content-store-eu-west/content/pii:S1381116912002567/sc4/THUMBNAIL/image/gif/8aaf321765744db14235a73f33c367f4/sc4.sml sc4 sc4.sml sml 1234 33 219 IMAGE-THUMBNAIL 1-s2.0-S1381116912002567-sc4_lrg.jpg https://s3.amazonaws.com/prod-ucs-content-store-us-east/content/pii:S1381116912002567/sc4/HIGHRES/image/jpeg/74cc0b13cb49a020851d2bfc8bcd0004/sc4_lrg.jpg https://s3-eu-west-1.amazonaws.com/prod-ucs-content-store-eu-west/content/pii:S1381116912002567/sc4/HIGHRES/image/jpeg/74cc0b13cb49a020851d2bfc8bcd0004/sc4_lrg.jpg sc4 sc4_lrg.jpg jpg 46353 227 1500 IMAGE-HIGH-RES 1-s2.0-S1381116912002567-gr1.jpg https://s3.amazonaws.com/prod-ucs-content-store-us-east/content/pii:S1381116912002567/gr1/DOWNSAMPLED/image/jpeg/be7c714f0593361967c57efdb4daf32c/gr1.jpg https://s3-eu-west-1.amazonaws.com/prod-ucs-content-store-eu-west/content/pii:S1381116912002567/gr1/DOWNSAMPLED/image/jpeg/be7c714f0593361967c57efdb4daf32c/gr1.jpg gr1 gr1.jpg jpg 30452 259 339 IMAGE-DOWNSAMPLED 1-s2.0-S1381116912002567-gr1.sml https://s3.amazonaws.com/prod-ucs-content-store-us-east/content/pii:S1381116912002567/gr1/THUMBNAIL/image/gif/d74bbce5aa75f015b981fb49dc0a0ce2/gr1.sml https://s3-eu-west-1.amazonaws.com/prod-ucs-content-store-eu-west/content/pii:S1381116912002567/gr1/THUMBNAIL/image/gif/d74bbce5aa75f015b981fb49dc0a0ce2/gr1.sml gr1 gr1.sml sml 4225 164 214 IMAGE-THUMBNAIL 1-s2.0-S1381116912002567-gr1_lrg.jpg https://s3.amazonaws.com/prod-ucs-content-store-us-east/content/pii:S1381116912002567/gr1/HIGHRES/image/jpeg/8b21b40269b68777cbf8ee8d60506477/gr1_lrg.jpg https://s3-eu-west-1.amazonaws.com/prod-ucs-content-store-eu-west/content/pii:S1381116912002567/gr1/HIGHRES/image/jpeg/8b21b40269b68777cbf8ee8d60506477/gr1_lrg.jpg gr1 gr1_lrg.jpg jpg 149471 1148 1500 IMAGE-HIGH-RES 1-s2.0-S1381116912002567-gr2.jpg https://s3.amazonaws.com/prod-ucs-content-store-us-east/content/pii:S1381116912002567/gr2/DOWNSAMPLED/image/jpeg/58b042570201ec08f1cfc6234ced87b1/gr2.jpg https://s3-eu-west-1.amazonaws.com/prod-ucs-content-store-eu-west/content/pii:S1381116912002567/gr2/DOWNSAMPLED/image/jpeg/58b042570201ec08f1cfc6234ced87b1/gr2.jpg gr2 gr2.jpg jpg 25969 247 357 IMAGE-DOWNSAMPLED 1-s2.0-S1381116912002567-gr2.sml https://s3.amazonaws.com/prod-ucs-content-store-us-east/content/pii:S1381116912002567/gr2/THUMBNAIL/image/gif/f0a265aa1aae9863fa245c840e88abf9/gr2.sml https://s3-eu-west-1.amazonaws.com/prod-ucs-content-store-eu-west/content/pii:S1381116912002567/gr2/THUMBNAIL/image/gif/f0a265aa1aae9863fa245c840e88abf9/gr2.sml gr2 gr2.sml sml 3247 152 219 IMAGE-THUMBNAIL 1-s2.0-S1381116912002567-gr2_lrg.jpg https://s3.amazonaws.com/prod-ucs-content-store-us-east/content/pii:S1381116912002567/gr2/HIGHRES/image/jpeg/6c42015556c8b35091d4bd52fea03c58/gr2_lrg.jpg https://s3-eu-west-1.amazonaws.com/prod-ucs-content-store-eu-west/content/pii:S1381116912002567/gr2/HIGHRES/image/jpeg/6c42015556c8b35091d4bd52fea03c58/gr2_lrg.jpg gr2 gr2_lrg.jpg jpg 137833 1096 1583 IMAGE-HIGH-RES 1-s2.0-S1381116912002567-gr3.jpg https://s3.amazonaws.com/prod-ucs-content-store-us-east/content/pii:S1381116912002567/gr3/DOWNSAMPLED/image/jpeg/dc697d68fbc06ccd1b0032e2ce01b39d/gr3.jpg https://s3-eu-west-1.amazonaws.com/prod-ucs-content-store-eu-west/content/pii:S1381116912002567/gr3/DOWNSAMPLED/image/jpeg/dc697d68fbc06ccd1b0032e2ce01b39d/gr3.jpg gr3 gr3.jpg jpg 35675 341 489 IMAGE-DOWNSAMPLED 1-s2.0-S1381116912002567-gr3.sml https://s3.amazonaws.com/prod-ucs-content-store-us-east/content/pii:S1381116912002567/gr3/THUMBNAIL/image/gif/776bea8db352a038eb8b98bf34414ee1/gr3.sml https://s3-eu-west-1.amazonaws.com/prod-ucs-content-store-eu-west/content/pii:S1381116912002567/gr3/THUMBNAIL/image/gif/776bea8db352a038eb8b98bf34414ee1/gr3.sml gr3 gr3.sml sml 3699 153 219 IMAGE-THUMBNAIL 1-s2.0-S1381116912002567-gr3_lrg.jpg https://s3.amazonaws.com/prod-ucs-content-store-us-east/content/pii:S1381116912002567/gr3/HIGHRES/image/jpeg/12fc90c3a30c8fc1f96c5af9a8da95a4/gr3_lrg.jpg https://s3-eu-west-1.amazonaws.com/prod-ucs-content-store-eu-west/content/pii:S1381116912002567/gr3/HIGHRES/image/jpeg/12fc90c3a30c8fc1f96c5af9a8da95a4/gr3_lrg.jpg gr3 gr3_lrg.jpg jpg 217972 1512 2167 IMAGE-HIGH-RES 1-s2.0-S1381116912002567-gr4.jpg https://s3.amazonaws.com/prod-ucs-content-store-us-east/content/pii:S1381116912002567/gr4/DOWNSAMPLED/image/jpeg/ac6c65e0cc8885c11debec755afeccaf/gr4.jpg https://s3-eu-west-1.amazonaws.com/prod-ucs-content-store-eu-west/content/pii:S1381116912002567/gr4/DOWNSAMPLED/image/jpeg/ac6c65e0cc8885c11debec755afeccaf/gr4.jpg gr4 gr4.jpg jpg 14679 211 388 IMAGE-DOWNSAMPLED 1-s2.0-S1381116912002567-gr4.sml https://s3.amazonaws.com/prod-ucs-content-store-us-east/content/pii:S1381116912002567/gr4/THUMBNAIL/image/gif/97f8e16961df7d751a5239c8d5af3cc2/gr4.sml https://s3-eu-west-1.amazonaws.com/prod-ucs-content-store-eu-west/content/pii:S1381116912002567/gr4/THUMBNAIL/image/gif/97f8e16961df7d751a5239c8d5af3cc2/gr4.sml gr4 gr4.sml sml 1526 119 219 IMAGE-THUMBNAIL 1-s2.0-S1381116912002567-gr4_lrg.jpg https://s3.amazonaws.com/prod-ucs-content-store-us-east/content/pii:S1381116912002567/gr4/HIGHRES/image/jpeg/409a733987130ea4daa79628aeb84338/gr4_lrg.jpg https://s3-eu-west-1.amazonaws.com/prod-ucs-content-store-eu-west/content/pii:S1381116912002567/gr4/HIGHRES/image/jpeg/409a733987130ea4daa79628aeb84338/gr4_lrg.jpg gr4 gr4_lrg.jpg jpg 70362 938 1721 IMAGE-HIGH-RES 1-s2.0-S1381116912002567-gr5.jpg https://s3.amazonaws.com/prod-ucs-content-store-us-east/content/pii:S1381116912002567/gr5/DOWNSAMPLED/image/jpeg/7cf1efe56682ca6eaea1ba7c451a71cd/gr5.jpg https://s3-eu-west-1.amazonaws.com/prod-ucs-content-store-eu-west/content/pii:S1381116912002567/gr5/DOWNSAMPLED/image/jpeg/7cf1efe56682ca6eaea1ba7c451a71cd/gr5.jpg gr5 gr5.jpg jpg 60746 449 344 IMAGE-DOWNSAMPLED 1-s2.0-S1381116912002567-gr5.sml https://s3.amazonaws.com/prod-ucs-content-store-us-east/content/pii:S1381116912002567/gr5/THUMBNAIL/image/gif/25937cc1cb88c07e5bb6093298d12feb/gr5.sml https://s3-eu-west-1.amazonaws.com/prod-ucs-content-store-eu-west/content/pii:S1381116912002567/gr5/THUMBNAIL/image/gif/25937cc1cb88c07e5bb6093298d12feb/gr5.sml gr5 gr5.sml sml 7761 163 125 IMAGE-THUMBNAIL 1-s2.0-S1381116912002567-gr5_lrg.jpg https://s3.amazonaws.com/prod-ucs-content-store-us-east/content/pii:S1381116912002567/gr5/HIGHRES/image/jpeg/576c897459fa108031dfb0bab701e2d9/gr5_lrg.jpg https://s3-eu-west-1.amazonaws.com/prod-ucs-content-store-eu-west/content/pii:S1381116912002567/gr5/HIGHRES/image/jpeg/576c897459fa108031dfb0bab701e2d9/gr5_lrg.jpg gr5 gr5_lrg.jpg jpg 497425 1989 1524 IMAGE-HIGH-RES 1-s2.0-S1381116912002567-gr6.jpg https://s3.amazonaws.com/prod-ucs-content-store-us-east/content/pii:S1381116912002567/gr6/DOWNSAMPLED/image/jpeg/12f30bba2a734f5d2321de72b3ca0207/gr6.jpg https://s3-eu-west-1.amazonaws.com/prod-ucs-content-store-eu-west/content/pii:S1381116912002567/gr6/DOWNSAMPLED/image/jpeg/12f30bba2a734f5d2321de72b3ca0207/gr6.jpg gr6 gr6.jpg jpg 49706 242 339 IMAGE-DOWNSAMPLED 1-s2.0-S1381116912002567-gr6.sml https://s3.amazonaws.com/prod-ucs-content-store-us-east/content/pii:S1381116912002567/gr6/THUMBNAIL/image/gif/47a4141e0d2721ee7e43a90eb6ce6108/gr6.sml https://s3-eu-west-1.amazonaws.com/prod-ucs-content-store-eu-west/content/pii:S1381116912002567/gr6/THUMBNAIL/image/gif/47a4141e0d2721ee7e43a90eb6ce6108/gr6.sml gr6 gr6.sml sml 14530 157 219 IMAGE-THUMBNAIL 1-s2.0-S1381116912002567-gr6_lrg.jpg https://s3.amazonaws.com/prod-ucs-content-store-us-east/content/pii:S1381116912002567/gr6/HIGHRES/image/jpeg/0becb2bc6c2282e6c93f2c1ea9c76b30/gr6_lrg.jpg https://s3-eu-west-1.amazonaws.com/prod-ucs-content-store-eu-west/content/pii:S1381116912002567/gr6/HIGHRES/image/jpeg/0becb2bc6c2282e6c93f2c1ea9c76b30/gr6_lrg.jpg gr6 gr6_lrg.jpg jpg 405339 1072 1500 IMAGE-HIGH-RES 1-s2.0-S1381116912002567-fx1.jpg https://s3.amazonaws.com/prod-ucs-content-store-us-east/content/pii:S1381116912002567/fx1/DOWNSAMPLED/image/jpeg/eef50314fa16bc9754325604c6fbbe09/fx1.jpg https://s3-eu-west-1.amazonaws.com/prod-ucs-content-store-eu-west/content/pii:S1381116912002567/fx1/DOWNSAMPLED/image/jpeg/eef50314fa16bc9754325604c6fbbe09/fx1.jpg fx1 true fx1.jpg jpg 26084 146 500 IMAGE-DOWNSAMPLED 1-s2.0-S1381116912002567-fx1.sml https://s3.amazonaws.com/prod-ucs-content-store-us-east/content/pii:S1381116912002567/fx1/THUMBNAIL/image/gif/2ecdd193087703d15e501d86d441cb73/fx1.sml https://s3-eu-west-1.amazonaws.com/prod-ucs-content-store-eu-west/content/pii:S1381116912002567/fx1/THUMBNAIL/image/gif/2ecdd193087703d15e501d86d441cb73/fx1.sml fx1 true fx1.sml sml 4173 64 219 IMAGE-THUMBNAIL 1-s2.0-S1381116912002567-fx1_lrg.jpg https://s3.amazonaws.com/prod-ucs-content-store-us-east/content/pii:S1381116912002567/fx1/HIGHRES/image/jpeg/394864bfcef7376169349c16d3829180/fx1_lrg.jpg https://s3-eu-west-1.amazonaws.com/prod-ucs-content-store-eu-west/content/pii:S1381116912002567/fx1/HIGHRES/image/jpeg/394864bfcef7376169349c16d3829180/fx1_lrg.jpg fx1 fx1_lrg.jpg jpg 188539 646 2213 IMAGE-HIGH-RES MOLCAA 8505 S1381-1169(12)00256-7 10.1016/j.molcata.2012.08.011 Elsevier B.V. Scheme 1 The synthetic sequence of FSMA/SiO2. Scheme 2 Cyclization of pseudoionone. Scheme 3 Condensation of indole with acetone. Scheme 4 Esterification of benzoic acid with n-butanol. Fig. 1 FT-IR spectra of SMA (a), FSMA (b), FSMA/SiO2 (c) and SiO2 (d). Fig. 2 TGA of FSMA/SiO2 hybrid material. Fig. 3 XPS spectra of FSMA/SiO2 hybridized material. Fig. 4 Elemental analysis spectrum of the surface of FSMA/SiO2 tested by EDX. Fig. 5 Distribution of F, O and Si element in the surface of FSMA/SiO2. Fig. 6 SEM photo of FSMA/SiO2 hybridized material. Table 1 The effect of sol–gel condition on pore structure of FSMA/SiO2. a Entry Molar ratio (SFAP:SMA) Concentration of NH4OH (mol/L) BET surface area (m2/g) BJH pore volume (cm3/g) HJH pore diameter (nm) 1 1:10 0.5 425 0.48 3.7 2 1:10 1.3 332 0.81 6.5 3 1:10 2.6 289 0.93 10.5 4 1:1 2.6 221 0.77 11.3 a The molar ratio between TEOS and SMA is 11:1. Table 2 The effect of the molar ratio between SMA and SFAP on exchange capacity of FSMA/SiO2. Entry Molar ratio (SFAP:SMA) Content of F (wt%) RfSO3H loading (mmol/g) CO2H loading (mmol/g) a Loading ratio (RfSO3H:CO2H) Exchange capacity (mmol/g) b 1 1:10 0.8 0.05 0.14 1:3 0.19 2 1:5 1.0 0.07 0.14 1:2 0.21 3 1:2 1.3 0.09 0.16 1:1.5 0.25 4 1:1 3.1 0.20 0.15 1:0.8 0.35 a Calculated from exchange capacity. b Obtained by acidimetry. Table 3 Cyclization of pseudoionone catalyzed by solid acids based on resins. a Entry Catalyst Time (h) Conversion (%) Yield of ionone (%) α β 1 Amberlyst-15 0.5 11 4 1 2 95 26 7 2 Amberlyst-36 0.5 28 17 5 2 82 32 11 3 Nafion NR50 b 2 3 0 0 4 Nafion/SiO2 0.5 66 39 0 1 100 48 0 5 FSMA/SiO2 0.5 69 37 0 1 100 62 0 a Reactive temperature, 80°C; catalyst/pseudoionone=0.5g/1mL. b To use benzene as solvent. Table 4 Condensation of indole with acetone catalyzed by solid acids. a Entry Catalyst Loading of catalyst (mol%) b Yield (%) 1 Amberlyst-15 10 5 2 Nafion NR50 10 19 3 FPS 10 21 4 Nafion/SiO2 5 71 5 FSMA/SiO2 5 71 a Reactive time, 12h; temperature, 25°C. b Molar ratio (H+ in catalyst/acetone). Table 5 Esterification of benzyl acid with n-butanol catalyzed by solid acids. a Entry Catalyst Conversion of benzoic acid (%) 1 Amberlyst-15 69 2 Amberlyst-36 30 3 Nafion NR50 49 4 Nafion/SiO2 81 5 FSMA/SiO2 87 a Reactive time, 6h; temperature, 115°C; catalyst/benzoic acid=0.1mequiv. H+/1mmol. ω-Sulfonic-perfluoroalkylated poly(styrene–maleic anhydride)/silica hybridized nanocomposite as a new kind of solid acid catalyst Zhenghuan Lin a b Limei Huang a Qidan Ling a c ⁎ Hong Chen a Chengxue Zhao b ⁎ a College of Materials Science and Engineering, Fujian Normal University, Fuzhou 350007, China b Department of Chemistry, Shanghai Jiao Tong University, Shanghai 200240, China c Fujian Key Laboratory of Polymer Materials, Fuzhou 350007, Fujian, China ⁎ Corresponding authors. Tel.: +86 21 54709629; fax: +86 21 54741297. Graphical abstract Highlights ► The nanocomposite (FSMA/SiO2) bearing mixed acids was synthesized in mild condition. ► FSMA resin was uniformly distributed in silica framework through covalent linkage. ► The acidic amount and pore structure of FSMA/SiO2 are adjusted simultaneously. ► The acidity of FSMA/SiO2 is easily regulated for various catalytic processes. ► FSMA/SiO2 has showed high activity in cyclization, condensation and esterification. A new kind of ω-sulfonic-perfluoroalkylated poly(styrene–maleic anhydride)/silica hybrid nanocomposite FSMA/SiO2 has been synthesized under mild conditions by perfluoroalkylation of styrene–maleic anhydride copolymer (SMA) with ω-fluorosulfonylperfluorodiacyl peroxides (SFAP), and followed in turn by aminolysis using (3-aminopropyl)triethoxysilane (APTES), alkali hydrolysis, gelation with tetraethoxysilane (TEOS) and finally acidification. The hybrid solid acid FSMA/SiO2 with terminal perfluoroalkylsulfonic and carboxyl groups was characterized by FTIR, SEM, TEM, TGA, XPS, EDX, acidimetry and nitrogen sorption technique. Its pore structure, acid strength and acid amount were easily modulated by controlling the gelation and perfluoroalkylation conditions. The catalytic activity and selectivity, as well as reusability of FSMA/SiO2 were tested in three important reactions, namely, cyclization of pseudoionone, condensation of indole and esterification of benzoic acid. Owing to the higher exchange capacity than that of Nafion/SiO2, and the stronger acidity than that of Amberlyst-15, the nanocomposite FSMA/SiO2 showed higher activity and selectivity than these commercial solid acids in the reactions. Keywords Solid acid Sol–gel Nanocomposite Perfluoroalkanesulfonic Superacidity 1 Introduction Organic/inorganic hybrid materials, a kind of composite, offer the combinations of the advantages of both organic and inorganic components such as good mechanical strength, high thermostability, easy processability and low cost [1–7]. For allowing designing and controlling the structure in molecular level, hybrid materials are easily functionalized and widely applied in optics [8,9], electronic devices [10–12], photochrism [13,14], medicine [15], separation [16] and catalysis [4,17]. Traditional methods are difficult to prepare organic/inorganic hybrid materials for the different nature of two components. Sol–gel technique becomes one of the important ways to synthesize hybridized materials for its unique advantages: easy operation, mild reaction condition, high purity of products, diverse material shape molded for different applications [18–23]. Cation-exchange resins with strong acidity have been widely used as solid acid catalysts in organic reactions, including alkylation, transalkylation, isomerization, oligomerization, acylation, esterification and nitration, etc. [24–32]. There are two main classes of commercial strong-acid resin: nonfluorinated resin such as Amberlyst-15 and perfluoroalkylsulfonic resin such as Nafion NR50. The superacidity (H 0 =∼−12) and high thermostability (stable up to 280°C) of Nafion resins enable them to effectively catalyze alkylation of benzene, isomerization, and some select acylation [27]. However, Nafion NR50 is a kind of gel-type cation-exchange resin that does not swell in non-polar solvents. This makes its catalytic activity low in the reactions employing non-polar solvents due to the low accessibility of acid sites. To improve the surface area and the accessibility of acid sites, sulfonic resins were introduced into the silica skeleton to produce organic/inorganic hybrid composites [33–42]. For example, Harmer et al. employed sol–gel technique to prepare Nafion resin/silica nanocomposite (Nafion/SiO2) with surface area in the range of 50–500m2/g which is 1000 times higher than that of Nafion NR50 [33]. However, Nafion resin particles were entrapped within the porous silica network to produce Nafion/SiO2 hybrid composite without covalent linkage between organic and inorganic phase. Due to the aggregation of Nafion resin, the organic particles could not disperse uniformly in the silica framework, which made catalytic process complex [43]. In this work, we have developed a kind of ω-sulfonic-perfluoroalkylated poly(styrene–maleic anhydride)/silica hybridized nanocomposites (FSMA/SiO2) originated from SMA in mild condition. FSMA/SiO2 containing both perfluoroalkanesulfonic acid and carboxyl acid was synthesized by sol–gel method with covalent bond linkage between organic and inorganic phases. FSMA/SiO2 was characterized by FTIR, XPS, TGA, SEM, TEM, EDX, nitrogen sorption technique and acidimetry, and its catalytic activity as solid acid in the cyclization of pseudoionone, the condensation of indole, and esterification of benzoic acid was also investigated. 2 Experimental 2.1 General information BET surface area, pore diameter and BJH cumulative pore volume were obtained using a Micromeritics instrument (ASAP Micromeritics 2000). The morphological characteristics were observed with a SEM (Philips Sirion 200) and a TEM (JEM-2010). XPS spectra were obtained on an Omicron ESCA spectrometer. Fourier transform infrared spectroscopy (FTIR) using the KBr pellet was carried out on a Perkin–Elmer 930 spectrometer. The thermogravimetric studies were performed on a TGA 7 (Perkin–Elmer). Exchange capacity was determined by acidimetry. Nuclear magnetic resonance was performed using Varian Mercury 400 spectrometer using CDCl3 as the solvent. Microanalyses were completed on a VARIO EL III elemental analyzer. SMA containing 12mol% of maleic anhydride was obtained from Shanghai Research Institute of Petrochemical Technology (SRIPT). The solution of SFAP in F113 (CCl2FCClF2) was synthesized by following the reported procedure [44] and kept under a freezing condition before use. Other reagents were purchased from Sinopharm Chemical Reagent Co. and used as received. Amberlyst-15, Amberlyst-36 and Nafion NR50 were purchased from Aldrich. The commercial catalysts and Nafion/SiO2 prepared according to the reported method [33] were dried at 60°C under vacuum overnight before use. 2.2 Synthesis of FSMA/SiO2 SMA (0.75g, 7.3mmol) was dissolved in 5mL of dichloromethane, purging with nitrogen for 0.5h. Cooling to 0°C, F113 solution (0.4M) of SFAP (9mL, 3.6mmol) was added to the SMA solution under stirring. After 40h, the solution was washed with water and dried under vacuum to obtain perfluoroalkylated poly(styrene–maleic anhydride) FSMA. 19F NMR (CDCl3, 400MHz) of FSMA: δ −56.6 (1F, CFO), −38.9 (2F, CF2 S), −10.4 (3F,CF3), −5.3 to −2.4 (2F, OCF2), 118.4 (1F,SO2F). To a solution of FSMA in 7mL of THF, (3-aminopropyl)triethoxysilane (0.06g, 0.29mmol) was added at room temperature and stirred for 0.5h. Then, the solution was added to 15mL of 5% aqueous NaOH solution and stirred for 5h at 30°C followed by neutralization with HCl. The hydrolyzed FSMA solution was kept in the freezer. In a beaker (150mL) was added TEOS (17.2g, 80mmol), water (1.8mL) and 0.2N aqueous HCl (4.1mL). The mixture was stirred for 3h at room temperature and added to the hydrolyzed FSMA solution. After stirring for 15min, 30mL of 2.6N ammonia water was rapidly added to the solution. Within 20s with shaking, the mixed solutions gelled to form a hard solid. The solid gel was dried at 90°C for 24h, acidified with 6N aqueous HCl (30mL) for 36h, washed down residue HCl with water to neutral and then dried at 80°C under vacuum to a constant weight of FSMA/SiO2. 2.3 Catalysis studies Cyclization of pseudoionone was carried out in a two-necked flask. To a solution of pseudoionone (0.2mL) in cyclohexane (5mL), a solid catalyst (0.1g) was added under stirring at 80°C. Unreacted pseudoionone and main products were determined by an Agilent 6890N GC equipped with a FID detector. In condensation of indole with acetone, to 10mol% catalyst (catalyst/acetone=0.1mequiv. H+/1mmol) was added indole (2.0mmol), acetone (1.0mmol) and 5mL of CH2Cl2 as solvent. Then the mixture was stirred for 12h at room temperature. The catalyst was filtered and washed with ethanol three times. The combined solution was evaporated under reduced pressure. The residue was purified via column chromatography (silica gel, petroleum ether:ethyl acetate=4:1) to give dimethyl diindolylmethane: 1H NMR (CDCl3, 400MHz), δ 1.91 (s, 6H), 6.87 (t, 2H), 7.02 (m, 2H), 7.07 (t, 2H), 7.28 (d, 2H), 7.40 (d, 2H), 7.85 (brs, 2H); IR (KBr) ν (cm−1), 3440, 2964, 2859, 1659, 1384, 734. The esterification of benzoic acid was investigated in a 25mL round flask. To the flask was added benzoic acid (0.24g, 2mmol), n-butanol (0.44g, 6mmol) and solid catalyst (catalyst/benzoic acid=0.1mequiv. H+/1mmol) in turn. The mixture was stirred at 115°C for 6h, filtered and washed with ethyl acetate for three times, and then evaporated under vacuum. The conversion of benzoic acid was obtained from the amount of unreactive benzoic acid detected by column chromatography. 3 Results and discussion 3.1 Synthesis and physical characterization Through five-step reactions, namely, perfluoroalkylation, aminolysis, hydrolysis, co-gelation and acidification, the target nanocomposite FSMA/SiO2 was synthesized (Scheme 1 ). The perfluoroalkylation of SMA with FSAP was induced via single electron-transfer (SET) process [45] including a de-electronation of phenyl ring to yield cation radical, combination of the cation radical with perfluoroalkane radical to form δ-complex, and deprotonation of the complex to give ω-fluorosulfonylperfluoroalkylated poly(styrene–maleic anhydride) (FSMA). FSMA was further functionalized by aminolysis of maleic anhydride in SMA with coupling regent APTES. In this step, the loading of APTES had to be controlled to avoid the gelation in the following hydrolysis under NaOH. Followed by alkali hydrolysis, gelation with TEOS and acidification in HCl, the FSMA/SiO2 was finally obtained. The FTIR spectra of SMA (a), FSMA (b), FSMA/SiO2 (c) and SiO2 (d) are shown in Fig. 1 . The plot of FSMA shows strong bands characteristic of the perfluoroalkane group: ν (CF3) at 1310cm−1, ν (CF2) at 1227cm−1. The peak at 814cm−1 characteristic of a para-disubstituted phenyl ring, as well as carbonyl absorption, provides strong evidence for para-ω-fluorosulfonylperfluoroalkylation of SMA. The FTIR spectrum of FSMA/SiO2 shows similar peaks as that of SiO2 for the high amount of SiO2 in the hybrid materials. Fig. 2 shows TGA plot of SMA and FSMA/SiO2 under heating at 10°C/min from room temperature up to about 800°C. In the plot of SMA, The less than 5% weight loss before 150°C is due to residual moisture, and the loss (more than 93%) at 390°C is resulted from polymer decomposition. In the plot of FSMA/SiO2, there is a new loss at 283°C before 400°C, which is caused by desulfonation of perfluoroalkanesulfonic acid. X-ray photoelectron spectroscopy (XPS) and energy dispersive X-ray spectroscopy (EDX) were employed to analyzing the composition and distribution of the element in the surface of FSMA/SiO2. As shown in XPS spectra (Fig. 3 ) of FSMA/SiO2, there are five kinds of element detected in the surface of the nanocomposites with F1s at 688.8eV, O1s at 533.1eV, C1s at 285.3eV, Si2p at 103.1eV, and N1s at 400.1eV. S element is not found in XPS spectrum for its low amount. A similar result is exhibited in the EDX spectrum (Fig. 4 ) of FSMA/SiO2 except for a weak peak of S element. Element mapping of FSMA/SiO2 shown in Fig. 5 proves a uniform F, O, and Si distribution across the surface of nanocomposites. The distribution density of F is less than that of O and Si for its low amount in the FSMA/SiO2. 3.2 Pore structure and its controlling The microstructure and morphology of hybrid materials have been investigated by using SEM and TEM. The SEM photo (Fig. 6 ) at 200,000-fold magnification exhibits that the microstructure of FSMA/SiO2 is irregularly particulate in nature with primary particles in the range of 10–30nm, and that there are plenty of complex pores between particles with primary pores in the range of 2–20nm. The TEM image (see Supporting information, Fig. S1) of FSMA/SiO2 also shows irregular-shaped particles and porosity. Nitrogen sorption technique analysis of FSMA/SiO2 gave the porosity with 221m2/g of BET surface area, 0.77cm3/g of BJH pore volume and 11.3nm of BJH pore diameter which is consistent with the result of SEM. The isotherm plot and pore size distribution of are shown in Fig. S2 and S3 (see Supporting information). Like Nafion/SiO2, the pore structure of FSMA/SiO2 could be controlled by varying the sol–gel conditions, such as the concentration of alkali and the amount of the organic phase. As shown in Table 1 , the alkali (aqueous ammonia) concentration imposes great effects on all of the pore structure parameters (Entries 1–3). With the increase in concentration of alkali, the surface area of FSMA/SiO2 decreases dramatically, while pore volume and diameter increase observably. The effect of the concentration of alkali on adsorption isotherm and pore size distribution of FSMA/SiO2 was also investigated (see Supporting information, Fig. S4 and S5). It is found that using higher alkali concentration make the adsorption amount at the low pressure turn less and pore size distribution shift to the right, which indicates that the amount of micropore in composite becomes less, resulting in larger average pore diameter. When the molar ratio between SFAP and SMA rises from 1:10 to 1:1 (Entries 3 and 4) causing the increase in the content of organic resin, surface area and pore volume of FSMA/SiO2 decrease, and its pore diameter changes a little. These results keep consistent with that of Nafion/SiO2 [33]. 3.3 The adjustment on exchange capacity of FSMA/SiO2 There are two kinds of acidic groups in FSMA/SiO2. One is perfluoroalkanesulfonic acid (RfSO3H) originated from the perfluoroalkylation of styrene with SFAP. The other is carboxyl acid (CO2H) derived from the hydrolysis and aminolysis of maleic anhydride. The total amount of the two acids determines the exchange capacity of FSMA/SiO2. Therefore, the exchange capacity can be easily adjusted through changing the using amount of SFAP or the concentration of maleic anhydride in SMA, instead of varying the content of polymer resin in the composites, which would simultaneously change the porosity of composites. For instance, the surface area of Nafion/SiO2 dropped rapidly at high loading of Nafion resin (such as 60wt%) [33]. In this work, we have investigated the effect of molar ratio between SFAP and SMA on the exchange capacity of FSMA/SiO2 with the results shown in the Table 2 . The amount of RfSO3H in FSMA/SiO2 could be calculated from the content of F obtained from elemental analysis. With the increase in molar ratio between SFAP and SMA, the loading of RfSO3H in FSMA/SiO2 increase, reaching 0.2mmol/g (Entry 4) at the molar ratio of 1:1 (SFAP:SMA). From the molar ratio between SMA and APTES, the amount of CO2H could be calculated to be 0.25mmol/g. Thus, the total exchange capacity of FSMA/SiO2 should be 0.45mmol/g. However, the acidimetry gives the exchange capacity of 0.35mmol/g, which shows maleic anhydride was not hydrolyzed completely. From the measured exchange capacity of FSMA/SiO2, it can be deduced that the actual amount of CO2H is approximately 0.15mmol/g. Through change the molar ratio of SFAP and SMA, the loading ratio between RfSO3H and CO2H in FSMA/SiO2 is regulated from 1:3 to 1:0.8 with the exchange capacity adjusted from 0.19 to 0.35mmol/g. 3.4 Cyclization of pseudoionone The cyclization of pseudoionone (Scheme 2 ) was investigated with the FSMA/SiO2 nanocomposite. The conversion of pseudoionone and yield of ionone under FSMA/SiO2 are given in Table 3 with a comparison with the results by using Amberlyst-15, Amberlyst-36, Nafion NR50 and Nafion/SiO2. All of the catalysts containing RfSO3H (Entries 3–5) show good activity and selectivity except for Nafion NR50 because of its low surface area. Their excellent activity is attributed to their super-strong acidity of perfluoroalkanesulfonic acid group (RfSO3H). It is believed that their good selectivity is also ascribed to the bulky, lipophilic and flexible perfluoroalkyl side chain with ether linkage [46]. Due to higher surface area and more easily accessible acid sites, nanocomposites Nafion/SiO2 and FSMA/SiO2 exhibit higher yield than pure polymer catalysts. It took FSMA/SiO2 1h to yield 62% of α-ionone with quantitative conversion and 100% selectivity. In addition, we have tested the reusability of FSMA/SiO2 in the cyclization. FSMA/SiO2 recovered by simply washing with ethanol and drying was reused under the same conditions. In the five runs, FSMA/SiO2 showed high activity with the conversion of pseudoionone kept at 100%. In the sixth run, a slight deactivation took place with 93% of conversion. The result indicates good reusability of FSMA/SiO2 in the reaction. 3.5 Condensation of indole Diindolylmethane is a kind of compounds with health-promoting properties which arise from a beneficial shift in the balance of the sex hormones, estrogen and testosterone. Traditionally, diindolylmethane can be synthesized by condensation of indoles with carbonyl compounds. The condensation of indole with aldehyde was effectively catalyzed by solid acids to give hexyl diindolylmethanes [47]. However, the activity of the condensation of indole with ketone is lower than with aldehyde for its higher steric hindrance. Here, hybrid nanocomposites and pure polymer resins were employed to catalyze condensation of indole with acetone to produce dimethyl diindolylmethane (Scheme 3 ). The results are shown in the Table 4 . Fluorinated sulfonic resin FPS [48] (Entry 3) with RfSO3H exhibits best catalytic activity in polymer resins for being of the advantages of both Amberlyst-15 and Nafion NR50 resins such as big surface area and superacidity. However, the yield of diindolylmethane is not yet high at 10mol% of FPS loading. Obviously, the catalytic activity of nanocomposites is much higher than that of pure polymer resins for easy accessibility of acid sites with 71% of yield at 5mol% of loading. 3.6 Esterification of benzoic acid The esterification of benzoic acid with n-butanol (Scheme 4 ) was investigated with FSMA/SiO2, Amberlyst-15, Amberlyst-36, Nafion NR50 and its nanocomposites Nafion/SiO2. Table 5 gives the conversion of benzoic acid under these solid acids. Since the esterification can smoothly proceed under strong acid, Amberlyst-15 behaves good activity in pure polymer catalysts with 69% of conversion of benzoic acid. It is found that the conversion of benzoic acid under hybrid nanocomposites (Entries 4 and 5) is higher than under Amberlyst-15 owing to big surface area and easy accessibility of acidic sites, reaching 81% under Nafion/SiO2 and 87% under FSMA/SiO2, respectively. 4 Conclusions Via perfluoroalkylation of styrene–maleic anhydride copolymer with ω-fluorosulfonylperfluorodiacyl peroxides followed by aminolysis with (3-aminopropyl)triethoxysilane, alkali hydrolysis, gelation using tetraethoxysilane and acidification in aqueous HCl, we have developed a new kind of ω-sulfonic-perfluoroalkylated poly(styrene–maleic anhydride)/silica hybrid nanocomposites FSMA/SiO2 bearing perfluoroalkylsulfonic and carboxyl terminal groups. Compared to Nafion/SiO2, FSMA/SiO2 has advantages in low cost, mild synthetic conditions, high exchange capacity, homodispersity of the resin in silica, adjustable acidity and easy functionalization. The nanocomposite FSMA/SiO2 showed higher activity and better selectivity than the widely used commercial solid acids catalysts such as Nafion and Amberlyst-15 in the synthesis of ionone (cyclization), dimethyl diindolylmethane (condensation) and butyl benzoate (esterification). The further studies via tailoring FSMA/SiO2 nanocomposite by varying its acid strength and content for particular reactions, are under the way. Acknowledgements This work was supported by the National Natural Science Foundation of China (60976019), Specialized Research Fund for the Doctoral Program of Higher Education (SRFDP 20093223110002), Program for Innovative Research Team in Science and Technology in Fujian Province University (IRTSTFJ). Appendix A Supplementary data Supplementary data associated with this article can be found, in the online version, at http://dx.doi.org/10.1016/j.molcata.2012.08.011. Appendix A Supplementary data The following is the supplementary data to this article: References [1] U. Schubert Chem. Soc. Rev. 40 2011 575 582 [2] W.-T. Yao S.-H. Yu Adv. Funct. Mater. 18 2008 3357 3366 [3] Z. Zhou A.W. Franz M. Hartmann A. Seifert T.J. Mu W.R. Thiel Chem. Mater. 20 2008 4986 4992 [4] F. Hoffmann M. Cornelius J. Morell M. Fr Angew. Chem. Int. Ed. 45 2006 3216 3251 [5] A.B. Descalzo R. Mart F. Sancen K. Hoffmann K. Rurack Angew. Chem. Int. Ed. 45 2006 5924 5948 [6] A.K. Cheetham C.N. Rao R.K. Feller Chem. Commun. 2006 4780 4795 [7] P. Gomez-Romero Adv. Mater. 13 2001 163 174 [8] P. Escribano B. Julian-Lopez J. Planelles-Arago E. Cordoncillo B. Viana C. Sanchez J. Mater. Chem. 18 2008 23 40 [9] P. Innocenzi B. Lebeau J. Mater. Chem. 15 2005 3821 3831 [10] E. Holder N. Tessler A.L. Rogach J. Mater. Chem. 18 2008 1064 1078 [11] J. Chandrasekaran D. Nithyaprakash K.B. Ajjan S. Maruthamuthu D. Manoharan S. Kumar Renew. Sust. Energ. Rev. 15 2011 1228 1238 [12] D.B. Mitzi Chem. Mater. 13 2001 3283 3298 [13] R. Pardo M. Zayat D. Levy Chem. Soc. Rev. 40 2011 672 687 [14] M.-S. Wang G. Xu Z.-J. Zhang G.-C. Guo Chem. Commun. 46 2010 361 376 [15] M. Vallet-Regi M. Colilla B. Gonzalez Chem. Soc. Rev. 40 2011 596 607 [16] P. Kumar V.V. Guliants Micropor. Mesopor. Mater. 132 2010 1 14 [17] M. Trilla R. Pleixats M.W. Man C. Bied J.J. Moreau Adv. Synth. Catal. 350 2008 577 590 [18] T. Nazir A. Afzal H.M. Siddiqi Z. Ahmad M. Dumon Prog. Org. Coat. 69 2010 100 106 [19] D.J. Kang B.-S. Bae Acc. Chem. Res. 40 2007 903 912 [20] Z. Ahmad J.E. Mark Chem. Mater. 13 2001 3320 3330 [21] G. Schottner Chem. Mater. 13 2001 3422 3435 [22] E.M. Valliant J.R. Jones Soft Matter. 7 2011 5083 5095 [23] B. Boury R.J. Corriu Chem. Commun. 2002 795 802 [24] M.M. Sharma React. Funct. Polym. 26 1995 3 23 [25] A. Heidekum M.A. Harmer W.F. Hoelderich J. Catal. 181 1999 217 222 [26] G.D. Yadav H.B. Kulkarni React. Funct. Polym. 44 2000 153 165 [27] M.A. Harmer Q. Sun Appl. Catal. A 221 2001 45 62 [28] G.D. Yadav M.B. Thathagar React. Funct. Polym. 52 2002 99 110 [29] P. Barbaro F. Liguori Chem. Rev. 109 2008 515 529 [30] S.D. Alexandratos Ind. Eng. Chem. Res. 48 2008 388 398 [31] S.M. Son H. Kimura K. Kusakabe Bioresour. Technol. 102 2011 2130 2132 [32] Y. Cheng Y. Feng Y. Ren X. Liu A. Gao B. He F. Yan J. Li Bioresour. Technol. 113 2012 65 72 [33] M.A. Harmer W.E. Farneth Q. Sun J. Am. Chem. Soc. 118 1996 7708 7715 [34] A. Molnar Curr. Org. Chem. 12 2008 159 181 [35] M. Alvaro A. Corma D. Das V. Forn H. Garc Chem. Commun. 2004 956 957 [36] N.V. Vlasenko Y.N. Kochkin A.V. Topka P.E. Strizhak Appl. Catal. A 362 2009 82 87 [37] M. Alvaro A. Corma D. Das V. Forn H. Garc J. Catal. 231 2005 48 55 [38] D.J. Macquarrie S.J. Tavener M.A. Harmer Chem. Commun. 2005 2363 2365 [39] F. Mart G. Morales A. Mart G.R. Van Appl. Catal. A 347 2008 169 178 [40] A. Heidekum M.A. Harmer W.F. Hoelderich J. Catal. 176 1998 260 263 [41] S. Wang J.A. Guin Energy Fuels 15 2001 666 670 [42] M.A. Harmer Q. Sun M.J. Michalczyk Z. Yang Chem. Commun. 1997 1803 1804 [43] M.A. Harmer Q. Sun A.J. Vega W.E. Farneth A. Heidekum W.F. Hoelderich Green Chem. 2 2000 7 14 [44] C. Zhao, Y. Qu, H. He, CN1660804, 2005. [45] C.H. Zhao G.M. El-Taliawi C. Walling J. Org. Chem. 48 1983 4908 4910 [46] Z. Lin H. Ni H. Du C. Zhao Catal. Commun. 8 2007 31 35 [47] Z.H. Lin C.J. Guan X.L. Feng C.X. Zhao J. Mol. Catal. A: Chem. 247 2006 19 26 [48] Z.H. Lin C.X. Zhao Chem. Commun. 2005 3556 3558",
      "scopus-id": "84867463802",
      "coredata": {
        "eid": "1-s2.0-S1381116912002567",
        "dc:description": "A new kind of ω-sulfonic-perfluoroalkylated poly(styrene–maleic anhydride)/silica hybrid nanocomposite FSMA/SiO2 has been synthesized under mild conditions by perfluoroalkylation of styrene–maleic anhydride copolymer (SMA) with ω-fluorosulfonylperfluorodiacyl peroxides (SFAP), and followed in turn by aminolysis using (3-aminopropyl)triethoxysilane (APTES), alkali hydrolysis, gelation with tetraethoxysilane (TEOS) and finally acidification. The hybrid solid acid FSMA/SiO2 with terminal perfluoroalkylsulfonic and carboxyl groups was characterized by FTIR, SEM, TEM, TGA, XPS, EDX, acidimetry and nitrogen sorption technique. Its pore structure, acid strength and acid amount were easily modulated by controlling the gelation and perfluoroalkylation conditions. The catalytic activity and selectivity, as well as reusability of FSMA/SiO2 were tested in three important reactions, namely, cyclization of pseudoionone, condensation of indole and esterification of benzoic acid. Owing to the higher exchange capacity than that of Nafion/SiO2, and the stronger acidity than that of Amberlyst-15, the nanocomposite FSMA/SiO2 showed higher activity and selectivity than these commercial solid acids in the reactions.",
        "openArchiveArticle": "false",
        "prism:coverDate": "2012-12-31",
        "openaccessUserLicense": null,
        "prism:aggregationType": "Journal",
        "prism:url": "https://api.elsevier.com/content/article/pii/S1381116912002567",
        "dc:creator": [
          {
            "@_fa": "true",
            "$": "Lin, Zhenghuan"
          },
          {
            "@_fa": "true",
            "$": "Huang, Limei"
          },
          {
            "@_fa": "true",
            "$": "Ling, Qidan"
          },
          {
            "@_fa": "true",
            "$": "Chen, Hong"
          },
          {
            "@_fa": "true",
            "$": "Zhao, Chengxue"
          }
        ],
        "link": [
          {
            "@_fa": "true",
            "@rel": "self",
            "@href": "https://api.elsevier.com/content/article/pii/S1381116912002567"
          },
          {
            "@_fa": "true",
            "@rel": "scidir",
            "@href": "https://www.sciencedirect.com/science/article/pii/S1381116912002567"
          }
        ],
        "dc:format": "application/json",
        "openaccessType": null,
        "pii": "S1381-1169(12)00256-7",
        "prism:volume": "365",
        "prism:publisher": "Elsevier B.V.",
        "dc:title": "ω-Sulfonic-perfluoroalkylated poly(styrene–maleic anhydride)/silica hybridized nanocomposite as a new kind of solid acid catalyst",
        "prism:copyright": "Copyright © 2012 Elsevier B.V. All rights reserved.",
        "openaccess": "0",
        "prism:issn": "13811169",
        "dcterms:subject": [
          {
            "@_fa": "true",
            "$": "Solid acid"
          },
          {
            "@_fa": "true",
            "$": "Sol–gel"
          },
          {
            "@_fa": "true",
            "$": "Nanocomposite"
          },
          {
            "@_fa": "true",
            "$": "Perfluoroalkanesulfonic"
          },
          {
            "@_fa": "true",
            "$": "Superacidity"
          }
        ],
        "openaccessArticle": "false",
        "prism:publicationName": "Journal of Molecular Catalysis A: Chemical",
        "openaccessSponsorType": null,
        "prism:pageRange": "73-79",
        "prism:endingPage": "79",
        "pubType": "fla",
        "prism:coverDisplayDate": "December 2012",
        "prism:doi": "10.1016/j.molcata.2012.08.011",
        "prism:startingPage": "73",
        "dc:identifier": "doi:10.1016/j.molcata.2012.08.011",
        "openaccessSponsorName": null
      },
      "objects": {
        "object": [
          {
            "@category": "standard",
            "@_fa": "true",
            "$": "https://api.elsevier.com/content/object/eid/1-s2.0-S1381116912002567-mmc1.doc?httpAccept=%2A%2F%2A",
            "@multimediatype": "Microsoft Word file",
            "@type": "APPLICATION",
            "@size": "596480",
            "@ref": "mmc1",
            "@mimetype": "application/word"
          },
          {
            "@category": "standard",
            "@height": "361",
            "@width": "631",
            "@_fa": "true",
            "$": "https://api.elsevier.com/content/object/eid/1-s2.0-S1381116912002567-sc1.jpg?httpAccept=%2A%2F%2A",
            "@multimediatype": "JPEG image file",
            "@type": "IMAGE-DOWNSAMPLED",
            "@size": "55516",
            "@ref": "sc1",
            "@mimetype": "image/jpeg"
          },
          {
            "@category": "thumbnail",
            "@height": "125",
            "@width": "219",
            "@_fa": "true",
            "$": "https://api.elsevier.com/content/object/eid/1-s2.0-S1381116912002567-sc1.sml?httpAccept=%2A%2F%2A",
            "@multimediatype": "GIF image file",
            "@type": "IMAGE-THUMBNAIL",
            "@size": "3794",
            "@ref": "sc1",
            "@mimetype": "image/gif"
          },
          {
            "@category": "high",
            "@height": "1599",
            "@width": "2793",
            "@_fa": "true",
            "$": "https://api.elsevier.com/content/object/eid/1-s2.0-S1381116912002567-sc1_lrg.jpg?httpAccept=%2A%2F%2A",
            "@multimediatype": "JPEG image file",
            "@type": "IMAGE-HIGH-RES",
            "@size": "396185",
            "@ref": "sc1",
            "@mimetype": "image/jpeg"
          },
          {
            "@category": "standard",
            "@height": "83",
            "@width": "383",
            "@_fa": "true",
            "$": "https://api.elsevier.com/content/object/eid/1-s2.0-S1381116912002567-sc2.jpg?httpAccept=%2A%2F%2A",
            "@multimediatype": "JPEG image file",
            "@type": "IMAGE-DOWNSAMPLED",
            "@size": "12444",
            "@ref": "sc2",
            "@mimetype": "image/jpeg"
          },
          {
            "@category": "thumbnail",
            "@height": "48",
            "@width": "219",
            "@_fa": "true",
            "$": "https://api.elsevier.com/content/object/eid/1-s2.0-S1381116912002567-sc2.sml?httpAccept=%2A%2F%2A",
            "@multimediatype": "GIF image file",
            "@type": "IMAGE-THUMBNAIL",
            "@size": "2241",
            "@ref": "sc2",
            "@mimetype": "image/gif"
          },
          {
            "@category": "high",
            "@height": "368",
            "@width": "1695",
            "@_fa": "true",
            "$": "https://api.elsevier.com/content/object/eid/1-s2.0-S1381116912002567-sc2_lrg.jpg?httpAccept=%2A%2F%2A",
            "@multimediatype": "JPEG image file",
            "@type": "IMAGE-HIGH-RES",
            "@size": "64746",
            "@ref": "sc2",
            "@mimetype": "image/jpeg"
          },
          {
            "@category": "standard",
            "@height": "82",
            "@width": "339",
            "@_fa": "true",
            "$": "https://api.elsevier.com/content/object/eid/1-s2.0-S1381116912002567-sc3.jpg?httpAccept=%2A%2F%2A",
            "@multimediatype": "JPEG image file",
            "@type": "IMAGE-DOWNSAMPLED",
            "@size": "15603",
            "@ref": "sc3",
            "@mimetype": "image/jpeg"
          },
          {
            "@category": "thumbnail",
            "@height": "53",
            "@width": "219",
            "@_fa": "true",
            "$": "https://api.elsevier.com/content/object/eid/1-s2.0-S1381116912002567-sc3.sml?httpAccept=%2A%2F%2A",
            "@multimediatype": "GIF image file",
            "@type": "IMAGE-THUMBNAIL",
            "@size": "1761",
            "@ref": "sc3",
            "@mimetype": "image/gif"
          },
          {
            "@category": "high",
            "@height": "362",
            "@width": "1500",
            "@_fa": "true",
            "$": "https://api.elsevier.com/content/object/eid/1-s2.0-S1381116912002567-sc3_lrg.jpg?httpAccept=%2A%2F%2A",
            "@multimediatype": "JPEG image file",
            "@type": "IMAGE-HIGH-RES",
            "@size": "70366",
            "@ref": "sc3",
            "@mimetype": "image/jpeg"
          },
          {
            "@category": "standard",
            "@height": "51",
            "@width": "339",
            "@_fa": "true",
            "$": "https://api.elsevier.com/content/object/eid/1-s2.0-S1381116912002567-sc4.jpg?httpAccept=%2A%2F%2A",
            "@multimediatype": "JPEG image file",
            "@type": "IMAGE-DOWNSAMPLED",
            "@size": "9561",
            "@ref": "sc4",
            "@mimetype": "image/jpeg"
          },
          {
            "@category": "thumbnail",
            "@height": "33",
            "@width": "219",
            "@_fa": "true",
            "$": "https://api.elsevier.com/content/object/eid/1-s2.0-S1381116912002567-sc4.sml?httpAccept=%2A%2F%2A",
            "@multimediatype": "GIF image file",
            "@type": "IMAGE-THUMBNAIL",
            "@size": "1234",
            "@ref": "sc4",
            "@mimetype": "image/gif"
          },
          {
            "@category": "high",
            "@height": "227",
            "@width": "1500",
            "@_fa": "true",
            "$": "https://api.elsevier.com/content/object/eid/1-s2.0-S1381116912002567-sc4_lrg.jpg?httpAccept=%2A%2F%2A",
            "@multimediatype": "JPEG image file",
            "@type": "IMAGE-HIGH-RES",
            "@size": "46353",
            "@ref": "sc4",
            "@mimetype": "image/jpeg"
          },
          {
            "@category": "standard",
            "@height": "259",
            "@width": "339",
            "@_fa": "true",
            "$": "https://api.elsevier.com/content/object/eid/1-s2.0-S1381116912002567-gr1.jpg?httpAccept=%2A%2F%2A",
            "@multimediatype": "JPEG image file",
            "@type": "IMAGE-DOWNSAMPLED",
            "@size": "30452",
            "@ref": "gr1",
            "@mimetype": "image/jpeg"
          },
          {
            "@category": "thumbnail",
            "@height": "164",
            "@width": "214",
            "@_fa": "true",
            "$": "https://api.elsevier.com/content/object/eid/1-s2.0-S1381116912002567-gr1.sml?httpAccept=%2A%2F%2A",
            "@multimediatype": "GIF image file",
            "@type": "IMAGE-THUMBNAIL",
            "@size": "4225",
            "@ref": "gr1",
            "@mimetype": "image/gif"
          },
          {
            "@category": "high",
            "@height": "1148",
            "@width": "1500",
            "@_fa": "true",
            "$": "https://api.elsevier.com/content/object/eid/1-s2.0-S1381116912002567-gr1_lrg.jpg?httpAccept=%2A%2F%2A",
            "@multimediatype": "JPEG image file",
            "@type": "IMAGE-HIGH-RES",
            "@size": "149471",
            "@ref": "gr1",
            "@mimetype": "image/jpeg"
          },
          {
            "@category": "standard",
            "@height": "247",
            "@width": "357",
            "@_fa": "true",
            "$": "https://api.elsevier.com/content/object/eid/1-s2.0-S1381116912002567-gr2.jpg?httpAccept=%2A%2F%2A",
            "@multimediatype": "JPEG image file",
            "@type": "IMAGE-DOWNSAMPLED",
            "@size": "25969",
            "@ref": "gr2",
            "@mimetype": "image/jpeg"
          },
          {
            "@category": "thumbnail",
            "@height": "152",
            "@width": "219",
            "@_fa": "true",
            "$": "https://api.elsevier.com/content/object/eid/1-s2.0-S1381116912002567-gr2.sml?httpAccept=%2A%2F%2A",
            "@multimediatype": "GIF image file",
            "@type": "IMAGE-THUMBNAIL",
            "@size": "3247",
            "@ref": "gr2",
            "@mimetype": "image/gif"
          },
          {
            "@category": "high",
            "@height": "1096",
            "@width": "1583",
            "@_fa": "true",
            "$": "https://api.elsevier.com/content/object/eid/1-s2.0-S1381116912002567-gr2_lrg.jpg?httpAccept=%2A%2F%2A",
            "@multimediatype": "JPEG image file",
            "@type": "IMAGE-HIGH-RES",
            "@size": "137833",
            "@ref": "gr2",
            "@mimetype": "image/jpeg"
          },
          {
            "@category": "standard",
            "@height": "341",
            "@width": "489",
            "@_fa": "true",
            "$": "https://api.elsevier.com/content/object/eid/1-s2.0-S1381116912002567-gr3.jpg?httpAccept=%2A%2F%2A",
            "@multimediatype": "JPEG image file",
            "@type": "IMAGE-DOWNSAMPLED",
            "@size": "35675",
            "@ref": "gr3",
            "@mimetype": "image/jpeg"
          },
          {
            "@category": "thumbnail",
            "@height": "153",
            "@width": "219",
            "@_fa": "true",
            "$": "https://api.elsevier.com/content/object/eid/1-s2.0-S1381116912002567-gr3.sml?httpAccept=%2A%2F%2A",
            "@multimediatype": "GIF image file",
            "@type": "IMAGE-THUMBNAIL",
            "@size": "3699",
            "@ref": "gr3",
            "@mimetype": "image/gif"
          },
          {
            "@category": "high",
            "@height": "1512",
            "@width": "2167",
            "@_fa": "true",
            "$": "https://api.elsevier.com/content/object/eid/1-s2.0-S1381116912002567-gr3_lrg.jpg?httpAccept=%2A%2F%2A",
            "@multimediatype": "JPEG image file",
            "@type": "IMAGE-HIGH-RES",
            "@size": "217972",
            "@ref": "gr3",
            "@mimetype": "image/jpeg"
          },
          {
            "@category": "standard",
            "@height": "211",
            "@width": "388",
            "@_fa": "true",
            "$": "https://api.elsevier.com/content/object/eid/1-s2.0-S1381116912002567-gr4.jpg?httpAccept=%2A%2F%2A",
            "@multimediatype": "JPEG image file",
            "@type": "IMAGE-DOWNSAMPLED",
            "@size": "14679",
            "@ref": "gr4",
            "@mimetype": "image/jpeg"
          },
          {
            "@category": "thumbnail",
            "@height": "119",
            "@width": "219",
            "@_fa": "true",
            "$": "https://api.elsevier.com/content/object/eid/1-s2.0-S1381116912002567-gr4.sml?httpAccept=%2A%2F%2A",
            "@multimediatype": "GIF image file",
            "@type": "IMAGE-THUMBNAIL",
            "@size": "1526",
            "@ref": "gr4",
            "@mimetype": "image/gif"
          },
          {
            "@category": "high",
            "@height": "938",
            "@width": "1721",
            "@_fa": "true",
            "$": "https://api.elsevier.com/content/object/eid/1-s2.0-S1381116912002567-gr4_lrg.jpg?httpAccept=%2A%2F%2A",
            "@multimediatype": "JPEG image file",
            "@type": "IMAGE-HIGH-RES",
            "@size": "70362",
            "@ref": "gr4",
            "@mimetype": "image/jpeg"
          },
          {
            "@category": "standard",
            "@height": "449",
            "@width": "344",
            "@_fa": "true",
            "$": "https://api.elsevier.com/content/object/eid/1-s2.0-S1381116912002567-gr5.jpg?httpAccept=%2A%2F%2A",
            "@multimediatype": "JPEG image file",
            "@type": "IMAGE-DOWNSAMPLED",
            "@size": "60746",
            "@ref": "gr5",
            "@mimetype": "image/jpeg"
          },
          {
            "@category": "thumbnail",
            "@height": "163",
            "@width": "125",
            "@_fa": "true",
            "$": "https://api.elsevier.com/content/object/eid/1-s2.0-S1381116912002567-gr5.sml?httpAccept=%2A%2F%2A",
            "@multimediatype": "GIF image file",
            "@type": "IMAGE-THUMBNAIL",
            "@size": "7761",
            "@ref": "gr5",
            "@mimetype": "image/gif"
          },
          {
            "@category": "high",
            "@height": "1989",
            "@width": "1524",
            "@_fa": "true",
            "$": "https://api.elsevier.com/content/object/eid/1-s2.0-S1381116912002567-gr5_lrg.jpg?httpAccept=%2A%2F%2A",
            "@multimediatype": "JPEG image file",
            "@type": "IMAGE-HIGH-RES",
            "@size": "497425",
            "@ref": "gr5",
            "@mimetype": "image/jpeg"
          },
          {
            "@category": "standard",
            "@height": "242",
            "@width": "339",
            "@_fa": "true",
            "$": "https://api.elsevier.com/content/object/eid/1-s2.0-S1381116912002567-gr6.jpg?httpAccept=%2A%2F%2A",
            "@multimediatype": "JPEG image file",
            "@type": "IMAGE-DOWNSAMPLED",
            "@size": "49706",
            "@ref": "gr6",
            "@mimetype": "image/jpeg"
          },
          {
            "@category": "thumbnail",
            "@height": "157",
            "@width": "219",
            "@_fa": "true",
            "$": "https://api.elsevier.com/content/object/eid/1-s2.0-S1381116912002567-gr6.sml?httpAccept=%2A%2F%2A",
            "@multimediatype": "GIF image file",
            "@type": "IMAGE-THUMBNAIL",
            "@size": "14530",
            "@ref": "gr6",
            "@mimetype": "image/gif"
          },
          {
            "@category": "high",
            "@height": "1072",
            "@width": "1500",
            "@_fa": "true",
            "$": "https://api.elsevier.com/content/object/eid/1-s2.0-S1381116912002567-gr6_lrg.jpg?httpAccept=%2A%2F%2A",
            "@multimediatype": "JPEG image file",
            "@type": "IMAGE-HIGH-RES",
            "@size": "405339",
            "@ref": "gr6",
            "@mimetype": "image/jpeg"
          },
          {
            "@category": "standard",
            "@height": "146",
            "@width": "500",
            "@_fa": "true",
            "$": "https://api.elsevier.com/content/object/eid/1-s2.0-S1381116912002567-fx1.jpg?httpAccept=%2A%2F%2A",
            "@multimediatype": "JPEG image file",
            "@type": "IMAGE-DOWNSAMPLED",
            "@size": "26084",
            "@ref": "fx1",
            "@mimetype": "image/jpeg"
          },
          {
            "@category": "thumbnail",
            "@height": "64",
            "@width": "219",
            "@_fa": "true",
            "$": "https://api.elsevier.com/content/object/eid/1-s2.0-S1381116912002567-fx1.sml?httpAccept=%2A%2F%2A",
            "@multimediatype": "GIF image file",
            "@type": "IMAGE-THUMBNAIL",
            "@size": "4173",
            "@ref": "fx1",
            "@mimetype": "image/gif"
          },
          {
            "@category": "high",
            "@height": "646",
            "@width": "2213",
            "@_fa": "true",
            "$": "https://api.elsevier.com/content/object/eid/1-s2.0-S1381116912002567-fx1_lrg.jpg?httpAccept=%2A%2F%2A",
            "@multimediatype": "JPEG image file",
            "@type": "IMAGE-HIGH-RES",
            "@size": "188539",
            "@ref": "fx1",
            "@mimetype": "image/jpeg"
          }
        ]
      },
      "link": {
        "@rel": "abstract",
        "@href": "https://api.elsevier.com/content/abstract/scopus_id/84867463802"
      }
    }
  }
}