{
  "metadata": {
    "title": "WO<ce:inf loc=post><ce:italic>x</ce:italic></ce:inf>/ZrO<ce:inf loc=post>2</ce:inf>: A highly efficient catalyst for alkylation of catechol with <ce:italic>tert</ce:italic>-butyl alcohol",
    "authors": "; ; ",
    "journal": "Journal of Molecular Catalysis A: Chemical",
    "date": "2013-11-01",
    "doi": "10.1016/j.molcata.2013.05.010",
    "abstract": "",
    "uri": "https://api.elsevier.com/content/article/pii/S1381116913002008",
    "pii": "S1381116913002008"
  },
  "fulltext": {
    "full-text-retrieval-response": {
      "scopus-eid": "2-s2.0-84879049629",
      "originalText": "serial JL 271358 291210 291744 291790 291809 31 Journal of Molecular Catalysis A: Chemical JOURNALMOLECULARCATALYSISACHEMICAL 2013-05-21 2013-05-21 2013-08-31T12:44:11 1-s2.0-S1381116913002008 S1381-1169(13)00200-8 S1381116913002008 10.1016/j.molcata.2013.05.010 S300 S300.1 FULL-TEXT 1-s2.0-S1381116913X00093 2015-05-15T05:56:33.63776-04:00 0 0 20131101 2013 2013-05-21T00:00:00Z articleinfo crossmark dco dateupdated tomb dateloaded datesearch indexeddate volumelist yearnav absattachment articletitlenorm authfirstinitialnorm authfirstsurnamenorm cid cids contenttype copyright dateloadedtxt docsubtype doctype doi eid ewtransactionid hubeid issn issnnorm itemstage itemtransactionid itemweight openaccess openarchive pg pgfirst pglast pii piinorm pubdatestart pubdatetxt pubyr sortorder srctitle srctitlenorm srctype subheadings suppl volfirst volissue webpdf webpdfpagecount figure table body mmlmath acknowledge affil articletitle auth authfirstini authfull authkeywords authlast highlightsabst nomenclature primabst ref specialabst alllist content subj ssids 1381-1169 13811169 false 378 378 C Volume 378 6 22 29 22 29 20131101 1 November 2013 2013-11-01 2013 article fla Copyright © 2013 Elsevier B.V. All rights reserved. WOXZRO2AHIGHLYEFFICIENTCATALYSTFORALKYLATIONCATECHOLTERTBUTYLALCOHOL KUMAR A Nomenclature 1 Introduction 2 Experimental 2.1 Catalyst preparation 2.2 Catalyst characterization 2.3 Experimental procedure 3 Results and discussion 3.1 Physicochemical properties 3.2 Catalytic activity studies 3.2.1 Effect of WO3 loading 3.2.2 Effect of catalyst loading 3.2.3 Effect of molar ratio of catechol:TBA 3.2.4 Effect of temperature 3.3 Kinetic model – determination of the rate equation for alkylation of CAT 4 Conclusion Acknowledgements References 2000 555 ULLMANSENCYCLOPEDIAINDUSTRIALCHEMISTRY ANAND 2002 321 326 R YOO 1999 225 232 J JING 2008 13 15 Z CHUNHUI 2004 388 394 Z CHUNHUI 2004 607 613 Z CHUNHUI 2002 275 282 Z FRONTIERSSOLIDSTATECHEMISTRYPROCEEDINGSINTERNATIONALSYMPOSIUMSOLIDSTATECHEMISTRYINCHINA XIAOWA 2010 8157 8163 N VOLEVA 2011 1310 1312 V MADHUSUDHAN 2005 43 55 P WENLIN 2012 1090 1094 Z ARATA 1990 165 211 K ADVANCESINCATALYSIS HINO 1988 1259 1260 H SUN 2000 3717 3725 W BORDOLOI 2006 58 64 A SARISH 2005 123 131 S REDDY 2010 1224 1228 P YORI 1997 165 175 J KUBA 2003 353 361 S PARIDA 2006 35 42 K SOHN 1998 84 93 J DIGREGORIO 2004 45 55 F LOPEZ 2007 43 50 D ROSSMEDGAARDEN 2008 108 125 E HASAN 2012 216 221 Z CHENA 2012 60 65 S NARAYANAN 2001 273 278 S ALI 2011 6543 6555 A ALI 2011 6556 6566 A OJHA 2005 109 115 K KUMARX2013X22 KUMARX2013X22X29 KUMARX2013X22XA KUMARX2013X22X29XA item S1381-1169(13)00200-8 S1381116913002008 1-s2.0-S1381116913002008 10.1016/j.molcata.2013.05.010 271358 2013-08-31T08:21:02.803021-04:00 2013-11-01 1-s2.0-S1381116913002008-main.pdf https://s3.amazonaws.com/prod-ucs-content-store-us-east/content/pii:S1381116913002008/MAIN/application/pdf/2a6b4a316b2fb176c8d02d54e29be88d/main.pdf https://s3-eu-west-1.amazonaws.com/prod-ucs-content-store-eu-west/content/pii:S1381116913002008/MAIN/application/pdf/2a6b4a316b2fb176c8d02d54e29be88d/main.pdf main.pdf pdf true 722027 MAIN 8 1-s2.0-S1381116913002008-main_1.png https://s3-eu-west-1.amazonaws.com/prod-ucs-content-store-eu-west/content/pii:S1381116913002008/PREVIEW/image/png/3ddb69adc32ee5a72fb58e4f9c0e78ff/main_1.png https://s3.amazonaws.com/prod-ucs-content-store-us-east/content/pii:S1381116913002008/PREVIEW/image/png/3ddb69adc32ee5a72fb58e4f9c0e78ff/main_1.png main_1.png png 59195 849 656 IMAGE-WEB-PDF 1 1-s2.0-S1381116913002008-si9.gif https://s3.amazonaws.com/prod-ucs-content-store-us-east/content/pii:S1381116913002008/STRIPIN/image/gif/49827717698a48390fa57531e8d665f3/si9.gif https://s3-eu-west-1.amazonaws.com/prod-ucs-content-store-eu-west/content/pii:S1381116913002008/STRIPIN/image/gif/49827717698a48390fa57531e8d665f3/si9.gif si9 si9.gif gif 820 18 218 ALTIMG 1-s2.0-S1381116913002008-si8.gif https://s3.amazonaws.com/prod-ucs-content-store-us-east/content/pii:S1381116913002008/STRIPIN/image/gif/7939306c49c2ab5e2215d4e51699f8dc/si8.gif https://s3-eu-west-1.amazonaws.com/prod-ucs-content-store-eu-west/content/pii:S1381116913002008/STRIPIN/image/gif/7939306c49c2ab5e2215d4e51699f8dc/si8.gif si8 si8.gif gif 521 43 86 ALTIMG 1-s2.0-S1381116913002008-si7.gif https://s3.amazonaws.com/prod-ucs-content-store-us-east/content/pii:S1381116913002008/STRIPIN/image/gif/a62bbe7053bdf3a7fa5738d606aa2bb0/si7.gif https://s3-eu-west-1.amazonaws.com/prod-ucs-content-store-eu-west/content/pii:S1381116913002008/STRIPIN/image/gif/a62bbe7053bdf3a7fa5738d606aa2bb0/si7.gif si7 si7.gif gif 494 44 78 ALTIMG 1-s2.0-S1381116913002008-si6.gif https://s3.amazonaws.com/prod-ucs-content-store-us-east/content/pii:S1381116913002008/STRIPIN/image/gif/b0a6cf9240b69177768c8eb23d941d43/si6.gif https://s3-eu-west-1.amazonaws.com/prod-ucs-content-store-eu-west/content/pii:S1381116913002008/STRIPIN/image/gif/b0a6cf9240b69177768c8eb23d941d43/si6.gif si6 si6.gif gif 413 40 76 ALTIMG 1-s2.0-S1381116913002008-si5.gif https://s3.amazonaws.com/prod-ucs-content-store-us-east/content/pii:S1381116913002008/STRIPIN/image/gif/c3d878e4b35cda0aa81fba89f3a67587/si5.gif https://s3-eu-west-1.amazonaws.com/prod-ucs-content-store-eu-west/content/pii:S1381116913002008/STRIPIN/image/gif/c3d878e4b35cda0aa81fba89f3a67587/si5.gif si5 si5.gif gif 741 40 141 ALTIMG 1-s2.0-S1381116913002008-si4.gif https://s3.amazonaws.com/prod-ucs-content-store-us-east/content/pii:S1381116913002008/STRIPIN/image/gif/5d94ecfa0e5c01feee9af6a1ebb6460a/si4.gif https://s3-eu-west-1.amazonaws.com/prod-ucs-content-store-eu-west/content/pii:S1381116913002008/STRIPIN/image/gif/5d94ecfa0e5c01feee9af6a1ebb6460a/si4.gif si4 si4.gif gif 745 40 142 ALTIMG 1-s2.0-S1381116913002008-si3.gif https://s3.amazonaws.com/prod-ucs-content-store-us-east/content/pii:S1381116913002008/STRIPIN/image/gif/9614e3a105d471d836ca74caa8613072/si3.gif https://s3-eu-west-1.amazonaws.com/prod-ucs-content-store-eu-west/content/pii:S1381116913002008/STRIPIN/image/gif/9614e3a105d471d836ca74caa8613072/si3.gif si3 si3.gif gif 445 43 76 ALTIMG 1-s2.0-S1381116913002008-si24.gif https://s3.amazonaws.com/prod-ucs-content-store-us-east/content/pii:S1381116913002008/STRIPIN/image/gif/53fa84160d9e401980b415eaf2765854/si24.gif https://s3-eu-west-1.amazonaws.com/prod-ucs-content-store-eu-west/content/pii:S1381116913002008/STRIPIN/image/gif/53fa84160d9e401980b415eaf2765854/si24.gif si24 si24.gif gif 668 40 114 ALTIMG 1-s2.0-S1381116913002008-si23.gif https://s3.amazonaws.com/prod-ucs-content-store-us-east/content/pii:S1381116913002008/STRIPIN/image/gif/365b9cebe53d6e5dfe3634f8bef3f42c/si23.gif https://s3-eu-west-1.amazonaws.com/prod-ucs-content-store-eu-west/content/pii:S1381116913002008/STRIPIN/image/gif/365b9cebe53d6e5dfe3634f8bef3f42c/si23.gif si23 si23.gif gif 896 40 166 ALTIMG 1-s2.0-S1381116913002008-si22.gif https://s3.amazonaws.com/prod-ucs-content-store-us-east/content/pii:S1381116913002008/STRIPIN/image/gif/3a20fe3f7faf05878e58ce3ab2d9651e/si22.gif https://s3-eu-west-1.amazonaws.com/prod-ucs-content-store-eu-west/content/pii:S1381116913002008/STRIPIN/image/gif/3a20fe3f7faf05878e58ce3ab2d9651e/si22.gif si22 si22.gif gif 784 40 140 ALTIMG 1-s2.0-S1381116913002008-si21.gif https://s3.amazonaws.com/prod-ucs-content-store-us-east/content/pii:S1381116913002008/STRIPIN/image/gif/655d70ed2d7adb4667a8f5bcff111a62/si21.gif https://s3-eu-west-1.amazonaws.com/prod-ucs-content-store-eu-west/content/pii:S1381116913002008/STRIPIN/image/gif/655d70ed2d7adb4667a8f5bcff111a62/si21.gif si21 si21.gif gif 1087 39 206 ALTIMG 1-s2.0-S1381116913002008-si20.gif https://s3.amazonaws.com/prod-ucs-content-store-us-east/content/pii:S1381116913002008/STRIPIN/image/gif/a529beb7cc35a5f1f9bbefd8678a886b/si20.gif https://s3-eu-west-1.amazonaws.com/prod-ucs-content-store-eu-west/content/pii:S1381116913002008/STRIPIN/image/gif/a529beb7cc35a5f1f9bbefd8678a886b/si20.gif si20 si20.gif gif 1348 39 336 ALTIMG 1-s2.0-S1381116913002008-si2.gif https://s3.amazonaws.com/prod-ucs-content-store-us-east/content/pii:S1381116913002008/STRIPIN/image/gif/acabf8083a1099f29e9d711cb26f3a1d/si2.gif https://s3-eu-west-1.amazonaws.com/prod-ucs-content-store-eu-west/content/pii:S1381116913002008/STRIPIN/image/gif/acabf8083a1099f29e9d711cb26f3a1d/si2.gif si2 si2.gif gif 499 40 79 ALTIMG 1-s2.0-S1381116913002008-si19.gif https://s3.amazonaws.com/prod-ucs-content-store-us-east/content/pii:S1381116913002008/STRIPIN/image/gif/e89de2ad6be5585573502513b7385567/si19.gif https://s3-eu-west-1.amazonaws.com/prod-ucs-content-store-eu-west/content/pii:S1381116913002008/STRIPIN/image/gif/e89de2ad6be5585573502513b7385567/si19.gif si19 si19.gif gif 342 19 75 ALTIMG 1-s2.0-S1381116913002008-si18.gif https://s3.amazonaws.com/prod-ucs-content-store-us-east/content/pii:S1381116913002008/STRIPIN/image/gif/6a1325220c9d9eef27bcf420c7f2a1d7/si18.gif https://s3-eu-west-1.amazonaws.com/prod-ucs-content-store-eu-west/content/pii:S1381116913002008/STRIPIN/image/gif/6a1325220c9d9eef27bcf420c7f2a1d7/si18.gif si18 si18.gif gif 1442 42 336 ALTIMG 1-s2.0-S1381116913002008-si17.gif https://s3.amazonaws.com/prod-ucs-content-store-us-east/content/pii:S1381116913002008/STRIPIN/image/gif/37bd849fe7492cfe876669ad8538113c/si17.gif https://s3-eu-west-1.amazonaws.com/prod-ucs-content-store-eu-west/content/pii:S1381116913002008/STRIPIN/image/gif/37bd849fe7492cfe876669ad8538113c/si17.gif si17 si17.gif gif 711 14 189 ALTIMG 1-s2.0-S1381116913002008-si16.gif https://s3.amazonaws.com/prod-ucs-content-store-us-east/content/pii:S1381116913002008/STRIPIN/image/gif/adf586f40d4c9e2630cacd37e36c2b1b/si16.gif https://s3-eu-west-1.amazonaws.com/prod-ucs-content-store-eu-west/content/pii:S1381116913002008/STRIPIN/image/gif/adf586f40d4c9e2630cacd37e36c2b1b/si16.gif si16 si16.gif gif 990 36 302 ALTIMG 1-s2.0-S1381116913002008-si15.gif https://s3.amazonaws.com/prod-ucs-content-store-us-east/content/pii:S1381116913002008/STRIPIN/image/gif/adb6d6f905202fe83db0f419e68c3659/si15.gif https://s3-eu-west-1.amazonaws.com/prod-ucs-content-store-eu-west/content/pii:S1381116913002008/STRIPIN/image/gif/adb6d6f905202fe83db0f419e68c3659/si15.gif si15 si15.gif gif 1099 14 327 ALTIMG 1-s2.0-S1381116913002008-si14.gif https://s3.amazonaws.com/prod-ucs-content-store-us-east/content/pii:S1381116913002008/STRIPIN/image/gif/b7ad6ab794ab59fce46c193d1836c88f/si14.gif https://s3-eu-west-1.amazonaws.com/prod-ucs-content-store-eu-west/content/pii:S1381116913002008/STRIPIN/image/gif/b7ad6ab794ab59fce46c193d1836c88f/si14.gif si14 si14.gif gif 1297 36 366 ALTIMG 1-s2.0-S1381116913002008-si13.gif https://s3.amazonaws.com/prod-ucs-content-store-us-east/content/pii:S1381116913002008/STRIPIN/image/gif/c478a54ccdf9b22ed00fed9e94dea028/si13.gif https://s3-eu-west-1.amazonaws.com/prod-ucs-content-store-eu-west/content/pii:S1381116913002008/STRIPIN/image/gif/c478a54ccdf9b22ed00fed9e94dea028/si13.gif si13 si13.gif gif 1240 16 373 ALTIMG 1-s2.0-S1381116913002008-si12.gif https://s3.amazonaws.com/prod-ucs-content-store-us-east/content/pii:S1381116913002008/STRIPIN/image/gif/aac5bf8faa1448d24b50bcb82042b359/si12.gif https://s3-eu-west-1.amazonaws.com/prod-ucs-content-store-eu-west/content/pii:S1381116913002008/STRIPIN/image/gif/aac5bf8faa1448d24b50bcb82042b359/si12.gif si12 si12.gif gif 729 13 299 ALTIMG 1-s2.0-S1381116913002008-si11.gif https://s3.amazonaws.com/prod-ucs-content-store-us-east/content/pii:S1381116913002008/STRIPIN/image/gif/bfd30d775a8266c7e99e03957e0768d4/si11.gif https://s3-eu-west-1.amazonaws.com/prod-ucs-content-store-eu-west/content/pii:S1381116913002008/STRIPIN/image/gif/bfd30d775a8266c7e99e03957e0768d4/si11.gif si11 si11.gif gif 1839 42 427 ALTIMG 1-s2.0-S1381116913002008-si10.gif https://s3.amazonaws.com/prod-ucs-content-store-us-east/content/pii:S1381116913002008/STRIPIN/image/gif/b49c4eee773bb76fa331426ab7197c18/si10.gif https://s3-eu-west-1.amazonaws.com/prod-ucs-content-store-eu-west/content/pii:S1381116913002008/STRIPIN/image/gif/b49c4eee773bb76fa331426ab7197c18/si10.gif si10 si10.gif gif 502 14 126 ALTIMG 1-s2.0-S1381116913002008-si1.gif https://s3.amazonaws.com/prod-ucs-content-store-us-east/content/pii:S1381116913002008/STRIPIN/image/gif/9e757885570e9b420ee33da606153767/si1.gif https://s3-eu-west-1.amazonaws.com/prod-ucs-content-store-eu-west/content/pii:S1381116913002008/STRIPIN/image/gif/9e757885570e9b420ee33da606153767/si1.gif si1 si1.gif gif 2433 58 406 ALTIMG 1-s2.0-S1381116913002008-sc1_lrg.jpg https://s3.amazonaws.com/prod-ucs-content-store-us-east/content/pii:S1381116913002008/sc1/HIGHRES/image/jpeg/76a7972b3144108e4756014aaa13d81b/sc1_lrg.jpg https://s3-eu-west-1.amazonaws.com/prod-ucs-content-store-eu-west/content/pii:S1381116913002008/sc1/HIGHRES/image/jpeg/76a7972b3144108e4756014aaa13d81b/sc1_lrg.jpg sc1 sc1_lrg.jpg jpg 147723 953 2916 IMAGE-HIGH-RES 1-s2.0-S1381116913002008-gr7_lrg.jpg https://s3.amazonaws.com/prod-ucs-content-store-us-east/content/pii:S1381116913002008/gr7/HIGHRES/image/jpeg/b595ec50e9486737567e6f3bfaa35cda/gr7_lrg.jpg https://s3-eu-west-1.amazonaws.com/prod-ucs-content-store-eu-west/content/pii:S1381116913002008/gr7/HIGHRES/image/jpeg/b595ec50e9486737567e6f3bfaa35cda/gr7_lrg.jpg gr7 gr7_lrg.jpg jpg 57547 946 1746 IMAGE-HIGH-RES 1-s2.0-S1381116913002008-gr6_lrg.jpg https://s3.amazonaws.com/prod-ucs-content-store-us-east/content/pii:S1381116913002008/gr6/HIGHRES/image/jpeg/20d21fd1c85c43a66d0793e47210156c/gr6_lrg.jpg https://s3-eu-west-1.amazonaws.com/prod-ucs-content-store-eu-west/content/pii:S1381116913002008/gr6/HIGHRES/image/jpeg/20d21fd1c85c43a66d0793e47210156c/gr6_lrg.jpg gr6 gr6_lrg.jpg jpg 91151 1263 1703 IMAGE-HIGH-RES 1-s2.0-S1381116913002008-gr5_lrg.jpg https://s3.amazonaws.com/prod-ucs-content-store-us-east/content/pii:S1381116913002008/gr5/HIGHRES/image/jpeg/0d76b1c898f23a1cba68dbae95fb95e6/gr5_lrg.jpg https://s3-eu-west-1.amazonaws.com/prod-ucs-content-store-eu-west/content/pii:S1381116913002008/gr5/HIGHRES/image/jpeg/0d76b1c898f23a1cba68dbae95fb95e6/gr5_lrg.jpg gr5 gr5_lrg.jpg jpg 223994 2161 1736 IMAGE-HIGH-RES 1-s2.0-S1381116913002008-gr4_lrg.jpg https://s3.amazonaws.com/prod-ucs-content-store-us-east/content/pii:S1381116913002008/gr4/HIGHRES/image/jpeg/6584ab6bc0b99cef8cf9bd973ff483f1/gr4_lrg.jpg https://s3-eu-west-1.amazonaws.com/prod-ucs-content-store-eu-west/content/pii:S1381116913002008/gr4/HIGHRES/image/jpeg/6584ab6bc0b99cef8cf9bd973ff483f1/gr4_lrg.jpg gr4 gr4_lrg.jpg jpg 134295 2004 1710 IMAGE-HIGH-RES 1-s2.0-S1381116913002008-gr3_lrg.jpg https://s3.amazonaws.com/prod-ucs-content-store-us-east/content/pii:S1381116913002008/gr3/HIGHRES/image/jpeg/95345081ef1e88a47a3b4d0fe0bd6d3b/gr3_lrg.jpg https://s3-eu-west-1.amazonaws.com/prod-ucs-content-store-eu-west/content/pii:S1381116913002008/gr3/HIGHRES/image/jpeg/95345081ef1e88a47a3b4d0fe0bd6d3b/gr3_lrg.jpg gr3 gr3_lrg.jpg jpg 124435 2067 1739 IMAGE-HIGH-RES 1-s2.0-S1381116913002008-gr2_lrg.jpg https://s3.amazonaws.com/prod-ucs-content-store-us-east/content/pii:S1381116913002008/gr2/HIGHRES/image/jpeg/d34b7cf6c8dbafc493674b27d7f54e91/gr2_lrg.jpg https://s3-eu-west-1.amazonaws.com/prod-ucs-content-store-eu-west/content/pii:S1381116913002008/gr2/HIGHRES/image/jpeg/d34b7cf6c8dbafc493674b27d7f54e91/gr2_lrg.jpg gr2 gr2_lrg.jpg jpg 163188 2096 1681 IMAGE-HIGH-RES 1-s2.0-S1381116913002008-gr1_lrg.jpg https://s3.amazonaws.com/prod-ucs-content-store-us-east/content/pii:S1381116913002008/gr1/HIGHRES/image/jpeg/54e97c73fcc858edf7e7bfc16641be4c/gr1_lrg.jpg https://s3-eu-west-1.amazonaws.com/prod-ucs-content-store-eu-west/content/pii:S1381116913002008/gr1/HIGHRES/image/jpeg/54e97c73fcc858edf7e7bfc16641be4c/gr1_lrg.jpg gr1 gr1_lrg.jpg jpg 242323 1298 1678 IMAGE-HIGH-RES 1-s2.0-S1381116913002008-fx1_lrg.jpg https://s3.amazonaws.com/prod-ucs-content-store-us-east/content/pii:S1381116913002008/fx1/HIGHRES/image/jpeg/b7c8e9aabb990636625c4f305294cb63/fx1_lrg.jpg https://s3-eu-west-1.amazonaws.com/prod-ucs-content-store-eu-west/content/pii:S1381116913002008/fx1/HIGHRES/image/jpeg/b7c8e9aabb990636625c4f305294cb63/fx1_lrg.jpg fx1 true fx1_lrg.jpg jpg 75122 886 635 IMAGE-HIGH-RES 1-s2.0-S1381116913002008-sc1.jpg https://s3.amazonaws.com/prod-ucs-content-store-us-east/content/pii:S1381116913002008/sc1/DOWNSAMPLED/image/jpeg/df262347061a2a125f50706518dff024/sc1.jpg https://s3-eu-west-1.amazonaws.com/prod-ucs-content-store-eu-west/content/pii:S1381116913002008/sc1/DOWNSAMPLED/image/jpeg/df262347061a2a125f50706518dff024/sc1.jpg sc1 sc1.jpg jpg 18114 215 659 IMAGE-DOWNSAMPLED 1-s2.0-S1381116913002008-gr7.jpg https://s3.amazonaws.com/prod-ucs-content-store-us-east/content/pii:S1381116913002008/gr7/DOWNSAMPLED/image/jpeg/ea95b3012d0dc87ef67cd8730bbe1841/gr7.jpg https://s3-eu-west-1.amazonaws.com/prod-ucs-content-store-eu-west/content/pii:S1381116913002008/gr7/DOWNSAMPLED/image/jpeg/ea95b3012d0dc87ef67cd8730bbe1841/gr7.jpg gr7 gr7.jpg jpg 6818 213 394 IMAGE-DOWNSAMPLED 1-s2.0-S1381116913002008-gr6.jpg https://s3.amazonaws.com/prod-ucs-content-store-us-east/content/pii:S1381116913002008/gr6/DOWNSAMPLED/image/jpeg/540e4b88cb0b09fb6fec0807215779e8/gr6.jpg https://s3-eu-west-1.amazonaws.com/prod-ucs-content-store-eu-west/content/pii:S1381116913002008/gr6/DOWNSAMPLED/image/jpeg/540e4b88cb0b09fb6fec0807215779e8/gr6.jpg gr6 gr6.jpg jpg 11428 285 384 IMAGE-DOWNSAMPLED 1-s2.0-S1381116913002008-gr5.jpg https://s3.amazonaws.com/prod-ucs-content-store-us-east/content/pii:S1381116913002008/gr5/DOWNSAMPLED/image/jpeg/449604813cf1fac1041dd4e5de82740e/gr5.jpg https://s3-eu-west-1.amazonaws.com/prod-ucs-content-store-eu-west/content/pii:S1381116913002008/gr5/DOWNSAMPLED/image/jpeg/449604813cf1fac1041dd4e5de82740e/gr5.jpg gr5 gr5.jpg jpg 23585 488 392 IMAGE-DOWNSAMPLED 1-s2.0-S1381116913002008-gr4.jpg https://s3.amazonaws.com/prod-ucs-content-store-us-east/content/pii:S1381116913002008/gr4/DOWNSAMPLED/image/jpeg/b4acbb4304c8c6bfab439f0cb492da7a/gr4.jpg https://s3-eu-west-1.amazonaws.com/prod-ucs-content-store-eu-west/content/pii:S1381116913002008/gr4/DOWNSAMPLED/image/jpeg/b4acbb4304c8c6bfab439f0cb492da7a/gr4.jpg gr4 gr4.jpg jpg 16588 452 386 IMAGE-DOWNSAMPLED 1-s2.0-S1381116913002008-gr3.jpg https://s3.amazonaws.com/prod-ucs-content-store-us-east/content/pii:S1381116913002008/gr3/DOWNSAMPLED/image/jpeg/26cac7648161d5e9a1f1e1054a7b752e/gr3.jpg https://s3-eu-west-1.amazonaws.com/prod-ucs-content-store-eu-west/content/pii:S1381116913002008/gr3/DOWNSAMPLED/image/jpeg/26cac7648161d5e9a1f1e1054a7b752e/gr3.jpg gr3 gr3.jpg jpg 14096 467 393 IMAGE-DOWNSAMPLED 1-s2.0-S1381116913002008-gr2.jpg https://s3.amazonaws.com/prod-ucs-content-store-us-east/content/pii:S1381116913002008/gr2/DOWNSAMPLED/image/jpeg/49898a97b2cfa3da436ce7c1bc06a6cc/gr2.jpg https://s3-eu-west-1.amazonaws.com/prod-ucs-content-store-eu-west/content/pii:S1381116913002008/gr2/DOWNSAMPLED/image/jpeg/49898a97b2cfa3da436ce7c1bc06a6cc/gr2.jpg gr2 gr2.jpg jpg 18860 473 379 IMAGE-DOWNSAMPLED 1-s2.0-S1381116913002008-gr1.jpg https://s3.amazonaws.com/prod-ucs-content-store-us-east/content/pii:S1381116913002008/gr1/DOWNSAMPLED/image/jpeg/26df9c115fec4307bed01824a583fe94/gr1.jpg https://s3-eu-west-1.amazonaws.com/prod-ucs-content-store-eu-west/content/pii:S1381116913002008/gr1/DOWNSAMPLED/image/jpeg/26df9c115fec4307bed01824a583fe94/gr1.jpg gr1 gr1.jpg jpg 26509 293 379 IMAGE-DOWNSAMPLED 1-s2.0-S1381116913002008-fx1.jpg https://s3.amazonaws.com/prod-ucs-content-store-us-east/content/pii:S1381116913002008/fx1/DOWNSAMPLED/image/jpeg/62e78195d1ec3eda15e0211c6e3b22c0/fx1.jpg https://s3-eu-west-1.amazonaws.com/prod-ucs-content-store-eu-west/content/pii:S1381116913002008/fx1/DOWNSAMPLED/image/jpeg/62e78195d1ec3eda15e0211c6e3b22c0/fx1.jpg fx1 true fx1.jpg jpg 7854 200 143 IMAGE-DOWNSAMPLED 1-s2.0-S1381116913002008-sc1.sml https://s3.amazonaws.com/prod-ucs-content-store-us-east/content/pii:S1381116913002008/sc1/THUMBNAIL/image/gif/29ffd53fd427105b94693cb1aa219e70/sc1.sml https://s3-eu-west-1.amazonaws.com/prod-ucs-content-store-eu-west/content/pii:S1381116913002008/sc1/THUMBNAIL/image/gif/29ffd53fd427105b94693cb1aa219e70/sc1.sml sc1 sc1.sml sml 2385 72 219 IMAGE-THUMBNAIL 1-s2.0-S1381116913002008-gr7.sml https://s3.amazonaws.com/prod-ucs-content-store-us-east/content/pii:S1381116913002008/gr7/THUMBNAIL/image/gif/6d48ee5b66007216d660b7f2f03df5c4/gr7.sml https://s3-eu-west-1.amazonaws.com/prod-ucs-content-store-eu-west/content/pii:S1381116913002008/gr7/THUMBNAIL/image/gif/6d48ee5b66007216d660b7f2f03df5c4/gr7.sml gr7 gr7.sml sml 2055 119 219 IMAGE-THUMBNAIL 1-s2.0-S1381116913002008-gr6.sml https://s3.amazonaws.com/prod-ucs-content-store-us-east/content/pii:S1381116913002008/gr6/THUMBNAIL/image/gif/22d371aca352b2928e0da7733b2c587b/gr6.sml https://s3-eu-west-1.amazonaws.com/prod-ucs-content-store-eu-west/content/pii:S1381116913002008/gr6/THUMBNAIL/image/gif/22d371aca352b2928e0da7733b2c587b/gr6.sml gr6 gr6.sml sml 2847 162 219 IMAGE-THUMBNAIL 1-s2.0-S1381116913002008-gr5.sml https://s3.amazonaws.com/prod-ucs-content-store-us-east/content/pii:S1381116913002008/gr5/THUMBNAIL/image/gif/835d632d92a22e4e370a28b69d9f4e4f/gr5.sml https://s3-eu-west-1.amazonaws.com/prod-ucs-content-store-eu-west/content/pii:S1381116913002008/gr5/THUMBNAIL/image/gif/835d632d92a22e4e370a28b69d9f4e4f/gr5.sml gr5 gr5.sml sml 3116 163 131 IMAGE-THUMBNAIL 1-s2.0-S1381116913002008-gr4.sml https://s3.amazonaws.com/prod-ucs-content-store-us-east/content/pii:S1381116913002008/gr4/THUMBNAIL/image/gif/8bb613e0571d4b7b4d5997ab4a3b6722/gr4.sml https://s3-eu-west-1.amazonaws.com/prod-ucs-content-store-eu-west/content/pii:S1381116913002008/gr4/THUMBNAIL/image/gif/8bb613e0571d4b7b4d5997ab4a3b6722/gr4.sml gr4 gr4.sml sml 2568 164 140 IMAGE-THUMBNAIL 1-s2.0-S1381116913002008-gr3.sml https://s3.amazonaws.com/prod-ucs-content-store-us-east/content/pii:S1381116913002008/gr3/THUMBNAIL/image/gif/04954a611bd5596d1a25dbd383210646/gr3.sml https://s3-eu-west-1.amazonaws.com/prod-ucs-content-store-eu-west/content/pii:S1381116913002008/gr3/THUMBNAIL/image/gif/04954a611bd5596d1a25dbd383210646/gr3.sml gr3 gr3.sml sml 2358 164 138 IMAGE-THUMBNAIL 1-s2.0-S1381116913002008-gr2.sml https://s3.amazonaws.com/prod-ucs-content-store-us-east/content/pii:S1381116913002008/gr2/THUMBNAIL/image/gif/105e971a2bfdcc85c8425d72945e2610/gr2.sml https://s3-eu-west-1.amazonaws.com/prod-ucs-content-store-eu-west/content/pii:S1381116913002008/gr2/THUMBNAIL/image/gif/105e971a2bfdcc85c8425d72945e2610/gr2.sml gr2 gr2.sml sml 2653 163 131 IMAGE-THUMBNAIL 1-s2.0-S1381116913002008-gr1.sml https://s3.amazonaws.com/prod-ucs-content-store-us-east/content/pii:S1381116913002008/gr1/THUMBNAIL/image/gif/ef98a61e0b9d5fc9f177e8ab343d6d03/gr1.sml https://s3-eu-west-1.amazonaws.com/prod-ucs-content-store-eu-west/content/pii:S1381116913002008/gr1/THUMBNAIL/image/gif/ef98a61e0b9d5fc9f177e8ab343d6d03/gr1.sml gr1 gr1.sml sml 5440 164 212 IMAGE-THUMBNAIL 1-s2.0-S1381116913002008-fx1.sml https://s3.amazonaws.com/prod-ucs-content-store-us-east/content/pii:S1381116913002008/fx1/THUMBNAIL/image/gif/0e2c35af6901e713418e7344859eb964/fx1.sml https://s3-eu-west-1.amazonaws.com/prod-ucs-content-store-eu-west/content/pii:S1381116913002008/fx1/THUMBNAIL/image/gif/0e2c35af6901e713418e7344859eb964/fx1.sml fx1 true fx1.sml sml 3727 163 117 IMAGE-THUMBNAIL MOLCAA 8763 S1381-1169(13)00200-8 10.1016/j.molcata.2013.05.010 Elsevier B.V. Fig. 1 X-ray diffraction pattern for WO3–ZrO2 containing different WO3 loadings calcined at 973K, T and M indicate tetragonal and monoclinic phases, respectively. Fig. 2 Effect of % WO3 loading on conversion of catechol and selectivity of products at 413K 15% loading (w.r.t. catechol) catalyst for 30min. Fig. 3 Effect of catalyst loading (w.r.t. catechol) on conversion of catechol and selectivity of products at 413K 1:1 mole ratio of catechol:TBA for 30min. Fig. 4 Effect of moles of TBA (w.r.t. catechol) on conversion of catechol and selectivity of products at 413K 15% loading (w.r.t. catechol) of 15WZ for 30mins. Fig. 5 Effect of temperature on conversion of catechol at 1:1 mole ratio of catechol:TBA 15% loading (w.r.t. catechol) of 15WZ for 30min. Fig. 6 Comparison of experimental versus predicted rates. Fig. 7 Arrhenius plot. Scheme 1 tert-Butylation of CAT over WO x /ZrO2. Table 1 Surface area, pore size and surface acidity of the catalyst with varying WO3 loadings. Catalyst Calcination temp. (K) Measured WO3 (%) Surface area (m2 g−1) Pore size (Å) Surface acidity (mequiv./g) Surface density (W-atoms/nm2) ZrO2 0.0 23.02 163.8 0.28 1WZ 973 1.1 23.37 126.7 0.52 1.22 5WZ 973 5.2 53.24 81.8 1.11 2.53 15WZ 973 15.8 67.66 62.8 2.3 6.07 25WZ 973 26.3 44.31 87.8 1.14 15.42 50WZ 973 52.5 26.91 81.2 0.62 50.69 15WZ 873 15.8 74.92 79.2 2.6 5.48 15WZ 1073 15.8 61.44 95.8 3.0 6.69 Table 2 Comparison between the activity and selectivity of catalysts under optimum conditions. Catalyst % conversion of CAT % selectivity (4-TBC) Reaction conditions Reference HY 86.0 393–473K1:3 (CAT:TBA) [3] H-ZSM-5 90.0 84.0 443K1:3 (CAT:TBA) [4] Hβ 87.0 99.0 1:4 (CAT:TBA) [5] Montmorillonite 83.3 80.6 410K, 8h1:2 (CAT:TBA) [6] SO3H functionalized Ionic liquid 41.5 97.0 423K, 8h1:2 (CAT:TBA) [9] WO x /ZrO2 (current study 15WZ) 99.0 99.0 413K 30min1:1(CAT:TBA) Table 3 Adsorption and kinetic constants for butylation of CAT. Temperature (K) K r (kg/(kgmmolmin)) K 1 (dm3/g) K 2 (dm3/g) K C (dm3/g) K w (dm3/g) 353 6.508 2.456 2.123 0.890 0.968 363 10.045 2.019 1.490 0.806 0.806 373 12.841 1.873 1.184 0.725 0.735 383 16.155 1.653 1.033 0.683 0.6597 Table 4 Activation and pre-exponential factors. E a (kJ/mol) ΔH ad (kJ/mol) Pre-exponential factor Butylation of CAT 33.53 6.27×105 Adsorption (CAT) −14.23 1.88×10−2 Adsorption (TBA) −26.99 2.05×10−4 Adsorption (4-TBC) −10.13 2.81×10−2 Adsorption (water) −14.03 7.98×10−3 WO x /ZrO2: A highly efficient catalyst for alkylation of catechol with tert-butyl alcohol Arun Kumar a * Asraf Ali a K.N. Vinod a Amit Kumar Mondal a Hemant Hegde a Ashok Menon a B.H.S. Thimmappa b a Innovative Plastics Program, GE India Technology Centre, No. 122, EPIP, Whitefield Road, Bangalore 560066, Karnataka, India Innovative Plastics Program, GE India Technology Centre No. 122, EPIP, Whitefield Road Bangalore Karnataka 560066 India b Department of Chemistry, Manipal Institute of Technology, Manipal University, Manipal 576104, Karnataka, India Department of Chemistry, Manipal Institute of Technology, Manipal University Manipal Karnataka 576104 India * Corresponding author. Fax: +91 80 40122111. Graphical abstract The liquid phase alkylation of catechol with tert-butyl alcohol was carried out over a solid acid catalyst—WO x /ZrO2. p-tert-Butyl catechol (4-TBC) was the predominant product with 4,6-di-tert-butyl catechol as the minor product. A systematic study has been carried out to understand the effect of various parameters such as WO3 loading, mole ratio of the reactants, temperature and catalyst loading. The experimental results indicated that under optimized condition of 1:1 mole ratio of catechol to tert-butyl alcohol at 413K within 30min, both the conversion for catechol and selectivity towards 4-TBC was 99%. The Langmuir–Hinshelwood–Hougen–Watson (LHHW) surface reaction controlled model has been used for kinetic studies. Keywords Alkylation p-tert-Butyl catechol WO x /ZrO2 Kinetics LHHW model Nomenclature A catechol (CAT) B tert-butyl alcohol (TBA) C tert-butyl catechol (4-TBC) D 4,6-di-tert-butyl catechol W water k 1 rate constant for reaction 1 (g/molmin) k 2 rate constant for reaction 2 (g/molmin) k 3 rate constant for reaction 3 (g/molmin) k 4 rate constant for reaction 4 (g/molmin) k 5 rate constant for reaction 5 (g/molmin) K 1 adsorption constant of A (CAT) (dm3/g) K 2 adsorption constant of B (TBA) (dm3/g) K C adsorption constant of C (4-TBC) (dm3/g) K D adsorption constant of D (4,6-di-tert-butyl catechol) (dm3/g) K w adsorption constant of water (dm3/g) −r AS rate of reaction of catechol at the surface (alkylation) (mol/gmin) 1 Introduction Alkylation reaction of catechol (CAT) with tert-butyl alcohol (TBA) is an industrially important reaction. The product, 4-tert-butylcatechol (4-TBC) has widespread applications as antioxidants, polymerization inhibitors and also as stabilizer of many organic compounds [1]. This is a Friedel–Crafts reaction and is generally carried out using acids such as ZnCl2, HCl and FeCl3 as catalysts [2]. The use of these catalysts poses many problems such as handling, safety, corrosion and waste disposal. Thus, it is essential to develop a suitable alternate eco-friendly and commercially viable catalyst system. Although numerous studies have been reported on selective synthesis of phenol derivatives, there are limited reports available for the selective synthesis of 4-TBC using solid catalyst. The butylation of CAT to form 4-TBC is commonly carried out with TBA [3–11], methyltertiarybutyl ether [12–16] and isobutene [17–20] as alkylating agents. The most commonly employed catalysts when TBA is used as the alkylating agent includes acidic zeolites like H-Y [3], H-USY, H-ZSM-5 [4] and Hβ [5], clay-based porus montmorillonite heterostructures (PMH) solid acid catalysts [6–8], SO3H-functionalized ionic liquid [9] and Co-napthenate and ZnCl2 mixture [10]. Anand et al. [3] have studied the vapor phase alkylation in the temperature range 393–473K using a fixed-bed vertical flow reactor at 1:3 molar ratio of CAT:TBA over HY and dealuminated HY zeolites, they showed marked increase in conversion of CAT and selectivity of more than 86% towards 4-TBC with moderately steam-treated HY zeolites (steamed at 823K and 973K). Among the various microporus acidic zeolite catalysts like H-USY, Hβ̦γ-alumina and H-ZSM-5 studied by Yoo et al. [4], H-ZSM-5 showed a conversion of more than 90% and selectivity higher than 84% for 4-TBC at 443K using fixed-bed vertical flow reactor at 1:3 molar ratio of CAT:TBA. Hβ zeolite was found to be very efficient catalyst for the alkylation with conversion of CAT about 87% and selectivity towards 4-TBC was 99% at 1:4 molar ratio of CAT:TBA [5]. Chunhui et al. have reported the liquid phase alkylation of CAT with TBA over meso and nanoporus clay composites [6–8]. In their work on H-exchanged montmorillonite and novel mesoporus acidic montmorillonite heterostructure catalysts [6], they observed best CAT conversion of 83.3% and 4-TBC selectivity of 80.6% under the optimized reaction condition of 410K, 1:2 molar ratio of CAT:TBA for 8h. Under the same reaction condition over the synthetic nanoporous silicoaluminum montmorillonite heterostructured composites [7], CAT conversion of 76.8% and 4-TBC selectivity of 85.2% was observed. Recently, Xiaowa et al. [9] have studied the catalytic properties of several SO3H-functionalized ionic liquids for CAT alkylation with TBA by combination of experimental and computational techniques. They achieved the best CAT conversion of 41.5% and 4-TBC selectivity of 97.1% in 8h under the optimized reaction condition of 423K at 1:2 molar ratio of CAT:TBA. In recent years, solid super acid catalysts based on doping tungsten oxides on zirconia support (WO x /ZrO2) is considered to have better application prospects for alkylation of aromatics compared to many other solid super acids such as, sulfate supported ZrO2, SbF5, TiO2 and Fe2O3 super acids. This is because WO x /ZrO2 catalyst system is stable at very high temperature and in a solid–liquid system [21,22]. Since, it was first reported by Hino and Arata [21], it has been employed by researchers for many versatile catalytic reactions like alkylation of hydrocarbons, liquid-phase alkylation of phenol with long-chain olefins, acetylation of alcohols and isomerization of light alkanes and nitration of aromatics [23–29]. This prompted us to choose WO x /ZrO2 catalyst for selective alkylation of CAT with TBA to form 4-TBC. To investigate the influence of WO3 loading on the conversion and selectivity towards various products during alkylation of CAT with TBA, we have prepared pure zirconia and 1, 5, 15, 25 and 50wt.% tungsten oxide on zirconia. A systematic study has been made, which includes preparation of the above mentioned catalysts, detailed physicochemical studies and catalytic performance for the alkylation of CAT with TBA. We also made an attempt to correlate the physico-chemical properties towards the catalytic activity. The catalyst with highest activity has been used to study the effect of reaction parameters, such as reaction temperature, molar ratio of the reactants and catalyst loading on the conversions and product selectivity in both the reactions. Further, we have developed Langmuir–Hinshelwood–Hougen–Watson (L–H–H–W) surface reaction controlled kinetic model and estimated the model parameters. From the estimated rate constants at different temperatures, the activation energy of the CAT alkylation reaction with TBA was determined. 2 Experimental 2.1 Catalyst preparation Precipitate of Zr(OH)4 was obtained by adding aqueous ammonium hydroxide slowly into an aqueous solution of zirconium oxychloride at room temperature with constant stirring until the pH of the mother liquor reached about 10. The precipitate thus obtained was washed thoroughly with distilled water until chloride ion was not detected by AgNO3 solution, and was dried at 393K for 12h. Catalysts containing series of WO x /ZrO2 loading (1–50wt.% of zirconium oxyhydroxide) were prepared by adding Zr(OH)4 powder into aqueous solution of ammonium metatungstate [(NH4)6(H2W12O40)·nH2O] (Aldrich) followed by drying at 393K for 12h and calcining at 973K for 5h. This series of catalysts were denoted by xWZ, where x represents wt.% of tungsten oxide, W represents tungsten oxide and Z represents zirconia. For instance 5WZ represents ZrO2 that was dried at 393K and doped with 5wt.% tungsten oxide. ZrO2 is the pure support calcined at 973K for comparison purpose. Further, the catalyst 15WZ was calcined at different temperatures (873K and 1073K for 5h) to study the impact of calcination temperature on the catalyst performance. Tungsten content in all the prepared catalysts was determined by inductively coupled plasma optical emission spectroscopy (ICP-OES). The results are reported in Table 1 . 2.2 Catalyst characterization The following characterization has been made on the catalyst materials. Total surface acidity of all the catalysts was determined by immersing 0.1g of catalyst in known amount of excess n-butylamine in dry benzene and back titrating against standard HCl. Powder X-ray diffraction patterns (PXRD) were measured on a Philips X-ray diffractometer with Ni filtered Cu Kα radiation over the range of 2θ from 20̊ to 40̊ with the intensity data for each point being collected at a 4s interval. Surface area (BET), pore volume, average pore radius and pore size distribution of the WO x /ZrO2 samples were determined by nitrogen adsorption–desorption method at liquid nitrogen temperature (77K) using a Micromeritics ASAP2010 instrument. 2.3 Experimental procedure All the catalytic activity studies were carried out in a batch glass reactor, equipped with reflux condenser and magnetic stirrer at atmospheric pressure. The stirrer speed was maintained at 500rpm. The product samples withdrawn at different time intervals were analyzed for product compositions by gas chromatograph (Shimadzu 2010), equipped with FID and HP-5, 30m capillary column. Authentic standard and GC–MS (Shimadzu QP 5500) was used for confirmation of products. The conversion of CAT is defined as moles of consumed CAT to the moles of CAT used for the reaction. The selectivity to specific product is defined as moles of specific product divided by moles of consumed CAT. 3 Results and discussion 3.1 Physicochemical properties Total surface acidity of different tungsten loaded catalyst samples were shown in Table 1. It is evident from the data that there is an initial increase in the acidity and maximum acidity is observed for the 15WZ containing catalysts and acidity decreases with further increase in WO3 loading. The generation of strong acidic nature is attributed to the crystal structure of ZrO2 phase, the type of tungsten oxide species and the interaction between the surface tungsten oxide layer and ZrO2 support [30]. The XRD pattern of the catalysts with different WO3 loadings calcined at 973K along with 15WZ calcined at different temperatures is shown in Fig. 1 . Highly crystalline materials were obtained after calcination at 973K. It can be observed that even a small loading of tungsten exhibited mixtures of monoclinic (2θ =28.2̊, 31.5̊) and tetragonal (2θ =30.3̊) ZrO2 [31]. The fraction of tetragonal zirconia becomes dominant with subsequent loading of tungsten, and under the present treatment conditions tetragonal phase was clearly dominant for WO3 loadings of 15wt.% (Fig. 1). Thus, the added WO3 stabilizes the tetragonal phase of zirconia. X-ray diffraction lines characteristic of monoclinic WO3 (2θ =23.2̊, 23.6̊ and 24.5̊) are observed for sample containing above 15WZ loading. This indicates that WO3 is highly dispersed on the support for samples with less than 15WZ loading and the crystalline WO3 peaks are observed when the WO3 loading exceeds the monolayer coverage. The XRD of the 15WZ catalyst calcined at 873K, 973K and 1073K shows that ZrO2 exists mainly in the tetragonal phase at all the calcination temperatures. There was no crystalline WO3 peaks observed at calcination temperatures at and below 973K, indicating that WO3 is highly dispersed on the ZrO2 support. When the calcination temperature is increased beyond 973K new peaks at 2θ of 23.2̊, 23.6̊ and 24.5̊ was observed. These characteristic peaks of WO3 indicate that WO3 crystallizes at temperatures higher than 973K reducing the dispersion of WO3 at higher calcination temperature [32,33]. The BET surface area and BJH mean pore diameters of WO x /ZrO2 samples are also included in Table 1. The results indicate that an increase in the specific surface area for all the tungsten doped samples. Surface area becomes maximum at 15WZ (ca. 67m2 g−1), and thereafter, further loading of WO3 leads to decrease in the surface area. This confirms that the surface area stabilizing effect is due to strong interaction of WO3 species with ZrO2 crystallites. The presence of monoclinic WO3 as indicated from the XRD pattern for samples with higher concentration of tungsten species could be correlated to decrease in the surface area due to sintering of particles. Further, it is also observed that pore size of un-promoted zirconia is little wider compared to the W promoted samples. These values are in good agreement with the results reported in the literature [31]. The surface density shown in Table 1 of W is calculated as per the following formula: Surface density of W = [ WO 3 loading ( wt. % ) / 100 ] × 6.023 × 10 23 231.8 ( formula weight of WO 3 ) × BET surface area ( m 2 g − 1 ) × 10 18 . Surface density of W on the catalyst depends on both the WO3 loading and the calcination temperature. When the calcination temperature is increased from 873K to 973K, the surface density increases from 5.48 to ∼6W-atomsnm−2, which is equivalent to the surface density of W in the monolayer [32]. Also, when the calcination temperature is further increased beyond 973K to 1073K, the surface density increased to 6.69W-atomsnm−2, because WO x species agglomerate into monoclinic WO3 crystallites and becomes less effective sintering inhibitors of underlying amorphous zirconia support. Our observations are similar to other reported literature values [32–35]. 3.2 Catalytic activity studies The alkylation reaction of CAT with TBA is a typical example of Friedel–Craft acid-catalyzed electrophilic substitution reaction. Dehydroxylation of tert-butyl catechol by the acid sites of the catalyst leads to the formation of tert-butyl cation species. The butyl carbocation reacts mainly at the para-position of the CAT to form 4-TBC, trace amount of 4,6-di-tert-butyl catechol(DTBC) compounds is produced by further alkylation of 4-TBC (Scheme 1 ). 3.2.1 Effect of WO3 loading In order to investigate the effect of WO3 loading on tert-butylation of CAT, 0-50WZ catalysts calcined at 973K are used for alkylation reaction at 413K using equimolar ratio of TBA and CAT for 30min. It is clear from Fig. 2 , that pure ZrO2 showed the least conversion of 4%, and among the catalysts with different WO3 loadings, the conversion was found to increase with WO3 loading, and the catalyst 15WZ gave the highest conversion of 99%, as the WO3 loading is further increased the conversion of CAT decreased to 80% at 25WZ and finally at 50WZ it was found to be 63%. Interestingly, 0WZ and 1WZ catalysts under the same reaction condition, not only showed less conversion of CAT, but also produced more of DTBC. These observations are in good agreement with the characterization data and indicate that reaction is highly sensitive to acidity, surface area and pore size of the catalyst. 15WZ catalyst has the higher acidity (2.3mequiv./g), higher surface area (68m2 g−1) and least pore size (62Å) compared to other catalysts, and is found to be most active in the tert-butylation of CAT with a 99% conversion of CAT and 99% selectivity towards 4-TBC. From Fig. 2, it can also be observed that DTBC is formed up to 36% in pure ZrO2 and 25% with 1WZ. The reason could mainly be attributed to the pore size, which is found to be almost double for ZrO2 (163Å) and 1WZ (127Å) compared to catalysts with WO3 loading of 5% (81.8Å) and above (Table 1). Thus, it can be concluded that the formation of di-alkylated product from the mono-alkylated product is favored only when the steric hindrance is less, i.e. the catalyst has large pores to allow the bulky alkylated products to travel out [36]. At and beyond 5% tungsten loading, the pore size of all the catalysts reduces drastically to below 82Å, hence, in spite of higher acidity in the catalysts with WO3 loading of more than 5%, the selectivity towards the di-alkylated product is significantly low (<3%) under the same reaction conditions. These observations clearly indicate that addition of WO3 has a significant role in promoting the catalytic performance of ZrO2 for the tert-butylation of CAT with TBA. Further for the catalyst 15WZ calcined at different temperatures (873K, 973K and 1073K), it was found that calcination temperature also affects the catalytic performance. The conversion of CAT at 873K, 973K and 1073K was 92.9%, 99% and 97.2% and the selectivity towards 4-TBC was found to be 93%, 99% and 91%, respectively. The 15WZ (calcined at 973K) catalyst with high specific surface area, good balance of acid strength and pore size distribution was found to be the most efficient for the synthesis of 4-TBC. Therefore, the 15WZ catalyst was used to study the different reaction parameters. 3.2.2 Effect of catalyst loading To investigate the optimum amount of catalyst required for the reaction, reactions were carried out with the most active catalyst 15WZ at 413K for 30min with 1:1 mole ratio of CAT:TBA. The catalyst loading was varied from 0% (without catalyst) to 20% (w/w) with respect to CAT. There was no reaction observed in the absence of the catalyst (i.e. at 0wt.%). Fig. 3 suggests that as the catalyst loading is increased, conversion of CAT also increases. The conversion of CAT was found to be 83.0% with 5wt.% catalyst, which increased substantially to 94.0% with 10wt.% and to about 99.0% with 15% catalyst, and further increase to 20%, had only marginal effect on conversion of CAT. The conversion of CAT at 20% is about 99.5%. Hence, 15% loading seems to be optimum under the prevailing reaction conditions. In the heterogeneous catalysis, the reactants are expected to react on the surface of the catalyst. Hence, the conversion is expected to increase with increase in catalyst loading as there is availability of more surfaces for the reactants. Also, this behavior suggests that catalyst loading is an effective parameter which can influence the conversion if the catalyst loading is less than 15%. The catalyst loading does not seem to have any significant effect on the selectivity of the products. This is because though we have more active surfaces with increased catalyst loading, but we have limited amount of TBA. The moles of TBA are same as that of CAT, hence it leads to selective formation of 4-TBC (mono product). The di-alkylated product is less than 1% for all the catalyst loading as can be seen in Fig. 3. 3.2.3 Effect of molar ratio of catechol:TBA The effect of the molar ratios of the reactants has been studied using 15WZ as the catalyst and about 15% catalyst loading (w/w) with respect to CAT, at 413K for 30min. The molar ratio of CAT to TBA was varied from 1:1 to 1:3. Fig. 4 shows that there is no significant effect of increasing the moles of TBA on the conversion of CAT. The conversion of CAT was in the range of 99.0–99.9%. However, it can be seen from Fig. 4 that as the molar ratios (CAT/TBA<1) is increased, the selectivity towards 4-TBC decreases considerably from 99.02% at 1:1 to 73% at 1:2 and finally to 65% at 1:3 mole ratio of CAT:TBA, with corresponding increase in the dialkylated product. The increase in dialkylated product could be attributed to the availability of excess TBA. As there is more TBA in the reaction the possibility of unreacted TBA and 4-TBC (mono product) to collide at the active surface is higher, leading to formation of more dialkylated products. Hence, it can be concluded that the increase in the molar ratio (CAT/TBA<1) of TBA does not have a significant effect on conversion but decreases the selectivity towards the desired product 4-TBC. 3.2.4 Effect of temperature Increase in temperature leads to an increase in rate constants and hence we have carried out the experiments at seven different temperatures ranging from 353K to 433K, at equal moles of CAT:TBA using 15WZ catalyst loading. The samples were taken for GC analysis at 15min interval for first hour and after an hour it was taken at an interval of 30min. Fig. 5 shows the conversion of CAT at different temperatures. It can be observed from figure that the conversion of CAT at lower temperature (353K) increases from 37.2% at 15min to 93.8% at 90min and finally reaches 94.4% at 180min. Thus, indicating that beyond 90min the conversion does not change significantly. A very similar trend is also seen for conversion of CAT at temperatures of 363K, 373K and 383K. The conversion of CAT was observed to increases from 15min to 90min from 55.6% to 95.8%, 74.9% to 96.2% and 84.8% to 96.6% for temperatures of 363K, 373K and 383K respectively. When the temperature is further increased to 393K, the conversion of CAT is seen to increases from 90.4% at 15min to maximum of 97.7% at 60min and remains almost constant beyond 60min, while at 413K, the conversion at 15min is 99% and it becomes constant beyond 15min. Further, at reaction temperature of 433K, no significant increase in TBA conversion was observed. The temperature does not seem to have any significant impact on the selectivity of 4-TBC, as all the CAT was mostly converted to 4-TBC. The di-alkylated by-product was formed at a very low level of 1–2% at all the studied temperatures. It can be hence summarized that the optimum conditions for the synthesis of 4-TBC is by using 15% loading of 15WZ at 413K and 1:1 mole ratio of CAT:TBA. Under these conditions within 30min about 99% conversion of CAT is observed with 99% selectivity towards 4-TBC. The performance of WZ is compared with other reported catalysts for synthesis of 4-TBC in Table 2 . It is evident that catalytic performance of WZ is better than the other catalyst in terms of both conversion as well as selectivity. 3.3 Kinetic model – determination of the rate equation for alkylation of CAT Kinetic runs were conducted at four different temperatures 353, 363, 373 and 383K. The reaction products were sampled at 15, 30, 45, 60, 90, 120, 150 and 180min in order to have enough data points for evaluating the kinetic parameters with confidence. For the reaction studied at temperatures beyond 383K, it was found that the reaction reached completion within 45min, hence the temperatures beyond 383K were not used for estimating the kinetic parameters. Langmuir–Hinshelwood–Hougen–Watson (LHHW) approach was used to generate rate expression for the reaction scheme. The model considers the adsorption of TBA and CAT on the active sites of the catalyst. On the catalytic surface, CAT (A) combines with TBA (B) to form first the mono-alkylated products (C) 4-TBC. These monoalkylated products further undergo dialkylation to form dialkylated product (D), if more TBA is available at the catalytic site to combine with the monoalkylated products. This model is represented by the following mechanism. (a) Adsorption of the reactants (R1) A + S ⇄ k ′ 1 k 1 AS (R2) B + S ⇄ k ′ 2 k 2 BS (b) Surface reaction (i) Formation of mono alkylated products (4-tert-butyl catechol) (R3) AS + BS ⇄ k ′ 3 k 3 CS + WS (ii) Formation of dialkylated products (R4) CS + BS ⇄ k ′ 4 k 4 DS + WS (c) Desorption of the products (R5) CS ⇄ k ′ 5 k 5 C + S (R6) DS ⇄ k ′ 6 k 6 D + S (R7) WS ⇄ k ′ 7 k 7 W + S The rate for the surface reaction can be written as follows. The rate of alkylation (−r AS) is given as: (1) − r AS = k 3 C AS C BS − k ′ 3 C CS C WS If reversible natures of all reactive steps are neglected, then Eq. (1) can be reduced to: (2) − r AS = k 3 C AS C BS The adsorbed phase concentrations can be related to the bulk phase concentrations if adsorption is rapid as compared to chemical reaction rates, then (3) C AS = K 1 C A C S , C BS = K 2 C B C S , C CS = K C C C C S , C DS = K D C D C S , C WS = K W C W C S Balancing the total no of catalytic sites, we get (4) C T = C S + C AS + C BS + C CS + C DS + C WS Substituting Eq. (3) in (4), we obtain (5) C T = C S ( 1 + K 1 C A + K 2 C B + K C C C + K D C D K W C W ) Then one can get the vacant sites as: (6) C S = C T 1 + K 1 C A + K 2 C B + K C C C + K D C D + K W C W The adsorption of dialkylated compound is assumed to be lesser as compared to others species as it is the largest [37–39] i.e. (7) 1 + K 1 C A + K 2 C B + K C C C + K W C W ≫ K D C D Then (8) C S = C T 1 + K 1 C A + K 2 C B + K C C C + K W C W The rate of disappearance of CAT is reduced to (9) − r AS = k 3 K 1 C A C S K 2 C B C S (10) − r AS = k 3 C T 2 K 1 K 2 C A C B ( 1 + K 1 C A + K 2 C B + K C C C + K W C W ) 2 Let k 3 C T 2 = K r , then (11) − r AS = K r K 1 K 2 C A C B ( 1 + K 1 C A + K 2 C B + K C C C + K W C W ) 2 At t =0, C C, C D and C W =0. Thus the initial rate for the disappearance of CAT is given as: (12) − r AS = K r K 1 K 2 C A C B ( 1 + K 1 C A + K 2 C B ) 2 The rate constant for the surface reaction should follow an Arrhenius type temperature dependency. The temperature dependence of the kinetic and adsorption parameters can be expressed mathematically as: (13) K = K 0 exp − E a R T (14) K 1 = K 1 0 exp − Δ H ad R T The parameters K r, K 1 and K 2 were determined by fitting the LHHW models with experimental initial rate data in Eq. (12) and the remaining parameters K C, K D and K W were determined by fitting the LHHW model with experimental rate data over the entire reaction time. The optimum values of these parameters are obtained by minimizing the square of relative difference between the experimental rates and the theoretical rates. The experimental rate was calculated from the concentration profiles of CAT with respect to time as follows: (15) − r = 1 w d C A d t The experimental rate calculated by the above formula is plotted against the predicted rate in Fig. 6 and it shows that the experimental rate matches well with predicted rate. Table 3 describes the values of adsorption constants for the reactants and the products. It can be seen that the adsorption constant of the reactants is comparatively higher as compared to the product, indicating that the reactants would have more affinity to come to the surface and form the products. Once the product is formed, it would be desorbed more easily. Also, it can be observed from Table 3 that as the temperature increases the adsorption constant decreases and hence it indicates that adsorption of the reactants and products on the catalysts is an exothermic process. The rate constant for the alkylation reaction increases with increase in the temperature, the rate constant increases by about 1.5 times when temperature is increased from 353K to 363K further increase by 10K increases the rate constant by 1.2 times. The rate constant for the reaction increases by further 1.2 when the temperature is increased from 373K to 383K. The Arrhenius plot shown in Fig. 7 is used to calculate the energy of activation for the reaction and is found to be 33.53kJ/mol. The activation energy and pre-exponential factors are shown in Table 4 . It can be seen from the table that the pre-exponential factor for the reaction is higher than the adsorption indicating, that the adsorbed reactants can easily undergo surface reaction leading to products. 4 Conclusion Thus, we conclude that WO x /ZrO2 is a highly active and selective catalyst for the alkylation of CAT with TBA to produce 4-TBC as compared to conventional zeolites, functionalized ionic liquids or clay-based porus montmorillonite heterostructures (PMH) solid acid catalysts that are reported in the literature so far. The 15WZ catalyst, with very high specific surface area and good balance of acid strength and pore size distribution was found to be the most efficient with conversion and selectivity of 99% for the synthesis of 4-TBC. The LHHW surface reaction controlled kinetic model was developed based on the product distribution. The model was found to fit reasonably well with the experimental data. From the estimated adsorption and kinetic parameters, the energy of activation was evaluated and found to be 33.5kJ/mol. Acknowledgements The authors would like to acknowledge profusely to Dr. Jothi Mahalingam and Dr. Shantaram Naik for their fruitful suggestions and discussions rendered towards the preparation of this article. References [1] Ullman’s Encyclopedia of Industrial Chemistry vol. 26 2000 555 [2] J. Nagaoka, JP 49109325 (1974). [3] R. Anand R. Maheswari K.U. Gore V.R. Chumbhale Catal. Commun. 3 8 2002 321 326 [4] J.W. Yoo C.W. Lee S. Park J. Ko Appl. Catal. A: Gen. 187 1999 225 232 [5] Z. Jing W. Jian Q. Nan-nan B. Shao-hua Y. Jian-guo Huaxue Gongchengshi 22 11 2008 13 15 [6] Z. Chunhui G. Zhonghua L. Xiaonian T. Dongshen L. Qingwei G. Hongqiang J. Chinese Chem. Eng. 12 3 2004 388 394 [7] Z. Chunhui L. Xiaonian G. Zhonghua L. Qinwei T. Dongsheng Catal. Today 93–95 2004 607 613 [8] Z. Chunhui L. Qinwei G. Zhonghua L. Xiaonian F. Shou-Hua C. Jie-Sheng Frontiers of Solid State Chemistry, Proceedings of the International Symposium on Solid State Chemistry in China Changchun, China, August 9–12 2002 275 282 [9] N. Xiaowa L. Xin G. Lei L. Min S. Chunshan G. Xinwen Ind. Eng. Chem. Res. 49 17 2010 8157 8163 [10] Z. Guixing, Faming Zhuanli Shenqing Shuomingshu, Preparation of p-tert-butyl catechol from catechol, CN 1365960 A 20020828 (2002). [11] V.B. Vol’eva T.I. Prokof’eva I.S. Belostotskaya N.L. Komissarova D.B. Gorbunov L.N. Kurkovskaya Russ. J. Org. Chem. 47 9 2011 1310 1312 [12] P.R. Madhusudhan M.V. Landau A. Wolfson A.M. Shapira M. Herskowitz Micropor. Mesopor. Mater. 80 1–3 2005 43 55 [13] Z. Shaoying, Z. Ziqiao, F. Zhuanli Shenqing, Preparation of high-purity 4-tert catechol from catechol and methyl tert-butyl ether, CN 20120725 102603490 A (2012). [14] Z. Wenlin, S. Ruyi, D. Wei, M. Nan, L. Chunli, W. Xiaowen, F. Zhuanli Shenqing, Method for synthesis of p-tert-butyl catechol, CN 20120704 102531848 A (2012). [15] W. Shuqing, F. Ziyan, F Xiaoqiang, Faming Zhuanli Shenqing Gongkai Shuomingshu, Preparation of tert-butylated aromatic compounds using methyl tert-butyl ethers as alkylating agent, CN 1450031 A 20031022 (2003). [16] Z. Wenlin S. Ruyi D. Wei M. Nan S. Yongjun L. Chunli Energy Procedia 16 2012 1090 1094 [17] Faming Zhuanli Shenqing, Process for preparation of p-alkyl catechol for alkylation of catechol, CN 102464574 20120523 (2012). [18] Kokai Tokkyo Koho, Preparation of 4-tert-butyl catechol from isobutylene oligomer, JP07082197 A 199950328 (1995). [19] L. Jose Antonio, F.L. Sergio Reinaldo, Wagner Celio Ferraz From Braz. Pedido PI, Process and cation-exchanger resin catalyst for tert-butylation of phenols with alkyl tert butyl ethers, BR 9604546 A 19980901 (1998). [20] T.P. Malloy, D.J. Engel, Alkylation of hydroxyl substituted aromatic compounds (UOP Inc.), U.S. Patent 4,323,714 (1982). [21] K. Arata Advances in Catalysis vol. 37 1990 Elsevier, Academic Press Inc. San Diego 165 211 [22] H. Hino K. Arata J. Chem. Soc. Chem. Commun. 1988 1259 1260 [23] W. Sun Z. Zhao C. Guo X. Ye Y. Wu Ind. Eng. Chem. Res. 39 2000 3717 3725 [24] A. Bordoloi N.T. Mathew B.M. Devassy S.P. Mirajkar S.B. Halligudi J. Mol. Catal. A: Chem. 247 2006 58 64 [25] S. Sarish B.M. Devassy W. B̈ohringer J. Fletcher S.B. Halligudi J. Mol. Catal. A: Chem. 240 2005 123 131 [26] P.S. Reddy P. Sundarasanam G. Raju B.M. Reddy Catal. Commun. 11 15 2010 1224 1228 [27] J.C. Yori C.R. Vera J.M. Parera Appl. Catal. A: Gen. 163 1997 165 175 [28] S. Kuba P. Lukinskas R.K. Grasselli B.C. Gates H. Knozinger J. Catal. 216 2003 353 361 [29] K.M. Parida P.K. Patnayak P. Mohapatra J. Mol. Catal. A: Chem. 260 2006 35 42 [30] J.R. Sohn M.Y. Park J. Ind. Eng. Chem. 4 2 1998 84 93 [31] F. Di Gregorio V. Keller J. Catal. 225 2004 45 55 [32] D.E. López K. Suwannakarn D.A. Bruce J.G. Goodwin r. J. Catal. 247 2007 43 50 [33] E.I. Ross-Medgaarden W.V. Knowles T. Kim M.S. Wong W. Zhou C.J. Kiely I.E. Wachs J. Catal. 256 2008 108 125 [34] Z. Hasan J. Jeon S.H. Jhung J. Hazard. Mater. 205–206 2012 216 221 [35] S. Chena W. Wanga Y. Zhanga Y. Weib W. Fanga Y. Yangb J. Mol. Catal. A: Chem. 365 2012 60 65 [36] S. Narayanan K.V.V.S.B.S.R. Murthy Appl. Catal. A: Gen. 213 2001 273 278 [37] A.A. Ali V.G. Gaikar Ind. Eng. Chem. Res. 50 2011 6543 6555 [38] A.A. Ali V.G. Gaikar Ind. Eng. Chem. Res. 50 2011 6556 6566 [39] K. Ojha N.C. Pradhan A.N. Samanta Chem. Eng. J. 112 2005 109 115",
      "scopus-id": "84879049629",
      "coredata": {
        "eid": "1-s2.0-S1381116913002008",
        "dc:description": "The liquid phase alkylation of catechol with tert-butyl alcohol was carried out over a solid acid catalyst—WO x /ZrO2. p-tert-Butyl catechol (4-TBC) was the predominant product with 4,6-di-tert-butyl catechol as the minor product. A systematic study has been carried out to understand the effect of various parameters such as WO3 loading, mole ratio of the reactants, temperature and catalyst loading. The experimental results indicated that under optimized condition of 1:1 mole ratio of catechol to tert-butyl alcohol at 413K within 30min, both the conversion for catechol and selectivity towards 4-TBC was 99%. The Langmuir–Hinshelwood–Hougen–Watson (LHHW) surface reaction controlled model has been used for kinetic studies.",
        "openArchiveArticle": "false",
        "prism:coverDate": "2013-11-01",
        "openaccessUserLicense": null,
        "prism:aggregationType": "Journal",
        "prism:url": "https://api.elsevier.com/content/article/pii/S1381116913002008",
        "dc:creator": [
          {
            "@_fa": "true",
            "$": "Kumar, Arun"
          },
          {
            "@_fa": "true",
            "$": "Ali, Asraf"
          },
          {
            "@_fa": "true",
            "$": "Vinod, K.N."
          },
          {
            "@_fa": "true",
            "$": "Mondal, Amit Kumar"
          },
          {
            "@_fa": "true",
            "$": "Hegde, Hemant"
          },
          {
            "@_fa": "true",
            "$": "Menon, Ashok"
          },
          {
            "@_fa": "true",
            "$": "Thimmappa, B.H.S."
          }
        ],
        "link": [
          {
            "@_fa": "true",
            "@rel": "self",
            "@href": "https://api.elsevier.com/content/article/pii/S1381116913002008"
          },
          {
            "@_fa": "true",
            "@rel": "scidir",
            "@href": "https://www.sciencedirect.com/science/article/pii/S1381116913002008"
          }
        ],
        "dc:format": "application/json",
        "openaccessType": null,
        "pii": "S1381-1169(13)00200-8",
        "prism:volume": "378",
        "prism:publisher": "Elsevier B.V.",
        "dc:title": "WO x /ZrO2: A highly efficient catalyst for alkylation of catechol with tert-butyl alcohol",
        "prism:copyright": "Copyright © 2013 Elsevier B.V. All rights reserved.",
        "openaccess": "0",
        "prism:issn": "13811169",
        "dcterms:subject": [
          {
            "@_fa": "true",
            "$": "Alkylation"
          },
          {
            "@_fa": "true",
            "$": "p-tert-Butyl catechol"
          },
          {
            "@_fa": "true",
            "$": "WO x /ZrO2"
          },
          {
            "@_fa": "true",
            "$": "Kinetics"
          },
          {
            "@_fa": "true",
            "$": "LHHW model"
          }
        ],
        "openaccessArticle": "false",
        "prism:publicationName": "Journal of Molecular Catalysis A: Chemical",
        "openaccessSponsorType": null,
        "prism:pageRange": "22-29",
        "prism:endingPage": "29",
        "pubType": "fla",
        "prism:coverDisplayDate": "1 November 2013",
        "prism:doi": "10.1016/j.molcata.2013.05.010",
        "prism:startingPage": "22",
        "dc:identifier": "doi:10.1016/j.molcata.2013.05.010",
        "openaccessSponsorName": null
      },
      "objects": {
        "object": [
          {
            "@category": "thumbnail",
            "@height": "18",
            "@width": "218",
            "@_fa": "true",
            "$": "https://api.elsevier.com/content/object/eid/1-s2.0-S1381116913002008-si9.gif?httpAccept=%2A%2F%2A",
            "@multimediatype": "GIF image file",
            "@type": "ALTIMG",
            "@size": "820",
            "@ref": "si9",
            "@mimetype": "image/gif"
          },
          {
            "@category": "thumbnail",
            "@height": "43",
            "@width": "86",
            "@_fa": "true",
            "$": "https://api.elsevier.com/content/object/eid/1-s2.0-S1381116913002008-si8.gif?httpAccept=%2A%2F%2A",
            "@multimediatype": "GIF image file",
            "@type": "ALTIMG",
            "@size": "521",
            "@ref": "si8",
            "@mimetype": "image/gif"
          },
          {
            "@category": "thumbnail",
            "@height": "44",
            "@width": "78",
            "@_fa": "true",
            "$": "https://api.elsevier.com/content/object/eid/1-s2.0-S1381116913002008-si7.gif?httpAccept=%2A%2F%2A",
            "@multimediatype": "GIF image file",
            "@type": "ALTIMG",
            "@size": "494",
            "@ref": "si7",
            "@mimetype": "image/gif"
          },
          {
            "@category": "thumbnail",
            "@height": "40",
            "@width": "76",
            "@_fa": "true",
            "$": "https://api.elsevier.com/content/object/eid/1-s2.0-S1381116913002008-si6.gif?httpAccept=%2A%2F%2A",
            "@multimediatype": "GIF image file",
            "@type": "ALTIMG",
            "@size": "413",
            "@ref": "si6",
            "@mimetype": "image/gif"
          },
          {
            "@category": "thumbnail",
            "@height": "40",
            "@width": "141",
            "@_fa": "true",
            "$": "https://api.elsevier.com/content/object/eid/1-s2.0-S1381116913002008-si5.gif?httpAccept=%2A%2F%2A",
            "@multimediatype": "GIF image file",
            "@type": "ALTIMG",
            "@size": "741",
            "@ref": "si5",
            "@mimetype": "image/gif"
          },
          {
            "@category": "thumbnail",
            "@height": "40",
            "@width": "142",
            "@_fa": "true",
            "$": "https://api.elsevier.com/content/object/eid/1-s2.0-S1381116913002008-si4.gif?httpAccept=%2A%2F%2A",
            "@multimediatype": "GIF image file",
            "@type": "ALTIMG",
            "@size": "745",
            "@ref": "si4",
            "@mimetype": "image/gif"
          },
          {
            "@category": "thumbnail",
            "@height": "43",
            "@width": "76",
            "@_fa": "true",
            "$": "https://api.elsevier.com/content/object/eid/1-s2.0-S1381116913002008-si3.gif?httpAccept=%2A%2F%2A",
            "@multimediatype": "GIF image file",
            "@type": "ALTIMG",
            "@size": "445",
            "@ref": "si3",
            "@mimetype": "image/gif"
          },
          {
            "@category": "thumbnail",
            "@height": "40",
            "@width": "114",
            "@_fa": "true",
            "$": "https://api.elsevier.com/content/object/eid/1-s2.0-S1381116913002008-si24.gif?httpAccept=%2A%2F%2A",
            "@multimediatype": "GIF image file",
            "@type": "ALTIMG",
            "@size": "668",
            "@ref": "si24",
            "@mimetype": "image/gif"
          },
          {
            "@category": "thumbnail",
            "@height": "40",
            "@width": "166",
            "@_fa": "true",
            "$": "https://api.elsevier.com/content/object/eid/1-s2.0-S1381116913002008-si23.gif?httpAccept=%2A%2F%2A",
            "@multimediatype": "GIF image file",
            "@type": "ALTIMG",
            "@size": "896",
            "@ref": "si23",
            "@mimetype": "image/gif"
          },
          {
            "@category": "thumbnail",
            "@height": "40",
            "@width": "140",
            "@_fa": "true",
            "$": "https://api.elsevier.com/content/object/eid/1-s2.0-S1381116913002008-si22.gif?httpAccept=%2A%2F%2A",
            "@multimediatype": "GIF image file",
            "@type": "ALTIMG",
            "@size": "784",
            "@ref": "si22",
            "@mimetype": "image/gif"
          },
          {
            "@category": "thumbnail",
            "@height": "39",
            "@width": "206",
            "@_fa": "true",
            "$": "https://api.elsevier.com/content/object/eid/1-s2.0-S1381116913002008-si21.gif?httpAccept=%2A%2F%2A",
            "@multimediatype": "GIF image file",
            "@type": "ALTIMG",
            "@size": "1087",
            "@ref": "si21",
            "@mimetype": "image/gif"
          },
          {
            "@category": "thumbnail",
            "@height": "39",
            "@width": "336",
            "@_fa": "true",
            "$": "https://api.elsevier.com/content/object/eid/1-s2.0-S1381116913002008-si20.gif?httpAccept=%2A%2F%2A",
            "@multimediatype": "GIF image file",
            "@type": "ALTIMG",
            "@size": "1348",
            "@ref": "si20",
            "@mimetype": "image/gif"
          },
          {
            "@category": "thumbnail",
            "@height": "40",
            "@width": "79",
            "@_fa": "true",
            "$": "https://api.elsevier.com/content/object/eid/1-s2.0-S1381116913002008-si2.gif?httpAccept=%2A%2F%2A",
            "@multimediatype": "GIF image file",
            "@type": "ALTIMG",
            "@size": "499",
            "@ref": "si2",
            "@mimetype": "image/gif"
          },
          {
            "@category": "thumbnail",
            "@height": "19",
            "@width": "75",
            "@_fa": "true",
            "$": "https://api.elsevier.com/content/object/eid/1-s2.0-S1381116913002008-si19.gif?httpAccept=%2A%2F%2A",
            "@multimediatype": "GIF image file",
            "@type": "ALTIMG",
            "@size": "342",
            "@ref": "si19",
            "@mimetype": "image/gif"
          },
          {
            "@category": "thumbnail",
            "@height": "42",
            "@width": "336",
            "@_fa": "true",
            "$": "https://api.elsevier.com/content/object/eid/1-s2.0-S1381116913002008-si18.gif?httpAccept=%2A%2F%2A",
            "@multimediatype": "GIF image file",
            "@type": "ALTIMG",
            "@size": "1442",
            "@ref": "si18",
            "@mimetype": "image/gif"
          },
          {
            "@category": "thumbnail",
            "@height": "14",
            "@width": "189",
            "@_fa": "true",
            "$": "https://api.elsevier.com/content/object/eid/1-s2.0-S1381116913002008-si17.gif?httpAccept=%2A%2F%2A",
            "@multimediatype": "GIF image file",
            "@type": "ALTIMG",
            "@size": "711",
            "@ref": "si17",
            "@mimetype": "image/gif"
          },
          {
            "@category": "thumbnail",
            "@height": "36",
            "@width": "302",
            "@_fa": "true",
            "$": "https://api.elsevier.com/content/object/eid/1-s2.0-S1381116913002008-si16.gif?httpAccept=%2A%2F%2A",
            "@multimediatype": "GIF image file",
            "@type": "ALTIMG",
            "@size": "990",
            "@ref": "si16",
            "@mimetype": "image/gif"
          },
          {
            "@category": "thumbnail",
            "@height": "14",
            "@width": "327",
            "@_fa": "true",
            "$": "https://api.elsevier.com/content/object/eid/1-s2.0-S1381116913002008-si15.gif?httpAccept=%2A%2F%2A",
            "@multimediatype": "GIF image file",
            "@type": "ALTIMG",
            "@size": "1099",
            "@ref": "si15",
            "@mimetype": "image/gif"
          },
          {
            "@category": "thumbnail",
            "@height": "36",
            "@width": "366",
            "@_fa": "true",
            "$": "https://api.elsevier.com/content/object/eid/1-s2.0-S1381116913002008-si14.gif?httpAccept=%2A%2F%2A",
            "@multimediatype": "GIF image file",
            "@type": "ALTIMG",
            "@size": "1297",
            "@ref": "si14",
            "@mimetype": "image/gif"
          },
          {
            "@category": "thumbnail",
            "@height": "16",
            "@width": "373",
            "@_fa": "true",
            "$": "https://api.elsevier.com/content/object/eid/1-s2.0-S1381116913002008-si13.gif?httpAccept=%2A%2F%2A",
            "@multimediatype": "GIF image file",
            "@type": "ALTIMG",
            "@size": "1240",
            "@ref": "si13",
            "@mimetype": "image/gif"
          },
          {
            "@category": "thumbnail",
            "@height": "13",
            "@width": "299",
            "@_fa": "true",
            "$": "https://api.elsevier.com/content/object/eid/1-s2.0-S1381116913002008-si12.gif?httpAccept=%2A%2F%2A",
            "@multimediatype": "GIF image file",
            "@type": "ALTIMG",
            "@size": "729",
            "@ref": "si12",
            "@mimetype": "image/gif"
          },
          {
            "@category": "thumbnail",
            "@height": "42",
            "@width": "427",
            "@_fa": "true",
            "$": "https://api.elsevier.com/content/object/eid/1-s2.0-S1381116913002008-si11.gif?httpAccept=%2A%2F%2A",
            "@multimediatype": "GIF image file",
            "@type": "ALTIMG",
            "@size": "1839",
            "@ref": "si11",
            "@mimetype": "image/gif"
          },
          {
            "@category": "thumbnail",
            "@height": "14",
            "@width": "126",
            "@_fa": "true",
            "$": "https://api.elsevier.com/content/object/eid/1-s2.0-S1381116913002008-si10.gif?httpAccept=%2A%2F%2A",
            "@multimediatype": "GIF image file",
            "@type": "ALTIMG",
            "@size": "502",
            "@ref": "si10",
            "@mimetype": "image/gif"
          },
          {
            "@category": "thumbnail",
            "@height": "58",
            "@width": "406",
            "@_fa": "true",
            "$": "https://api.elsevier.com/content/object/eid/1-s2.0-S1381116913002008-si1.gif?httpAccept=%2A%2F%2A",
            "@multimediatype": "GIF image file",
            "@type": "ALTIMG",
            "@size": "2433",
            "@ref": "si1",
            "@mimetype": "image/gif"
          },
          {
            "@category": "high",
            "@height": "953",
            "@width": "2916",
            "@_fa": "true",
            "$": "https://api.elsevier.com/content/object/eid/1-s2.0-S1381116913002008-sc1_lrg.jpg?httpAccept=%2A%2F%2A",
            "@multimediatype": "JPEG image file",
            "@type": "IMAGE-HIGH-RES",
            "@size": "147723",
            "@ref": "sc1",
            "@mimetype": "image/jpeg"
          },
          {
            "@category": "high",
            "@height": "946",
            "@width": "1746",
            "@_fa": "true",
            "$": "https://api.elsevier.com/content/object/eid/1-s2.0-S1381116913002008-gr7_lrg.jpg?httpAccept=%2A%2F%2A",
            "@multimediatype": "JPEG image file",
            "@type": "IMAGE-HIGH-RES",
            "@size": "57547",
            "@ref": "gr7",
            "@mimetype": "image/jpeg"
          },
          {
            "@category": "high",
            "@height": "1263",
            "@width": "1703",
            "@_fa": "true",
            "$": "https://api.elsevier.com/content/object/eid/1-s2.0-S1381116913002008-gr6_lrg.jpg?httpAccept=%2A%2F%2A",
            "@multimediatype": "JPEG image file",
            "@type": "IMAGE-HIGH-RES",
            "@size": "91151",
            "@ref": "gr6",
            "@mimetype": "image/jpeg"
          },
          {
            "@category": "high",
            "@height": "2161",
            "@width": "1736",
            "@_fa": "true",
            "$": "https://api.elsevier.com/content/object/eid/1-s2.0-S1381116913002008-gr5_lrg.jpg?httpAccept=%2A%2F%2A",
            "@multimediatype": "JPEG image file",
            "@type": "IMAGE-HIGH-RES",
            "@size": "223994",
            "@ref": "gr5",
            "@mimetype": "image/jpeg"
          },
          {
            "@category": "high",
            "@height": "2004",
            "@width": "1710",
            "@_fa": "true",
            "$": "https://api.elsevier.com/content/object/eid/1-s2.0-S1381116913002008-gr4_lrg.jpg?httpAccept=%2A%2F%2A",
            "@multimediatype": "JPEG image file",
            "@type": "IMAGE-HIGH-RES",
            "@size": "134295",
            "@ref": "gr4",
            "@mimetype": "image/jpeg"
          },
          {
            "@category": "high",
            "@height": "2067",
            "@width": "1739",
            "@_fa": "true",
            "$": "https://api.elsevier.com/content/object/eid/1-s2.0-S1381116913002008-gr3_lrg.jpg?httpAccept=%2A%2F%2A",
            "@multimediatype": "JPEG image file",
            "@type": "IMAGE-HIGH-RES",
            "@size": "124435",
            "@ref": "gr3",
            "@mimetype": "image/jpeg"
          },
          {
            "@category": "high",
            "@height": "2096",
            "@width": "1681",
            "@_fa": "true",
            "$": "https://api.elsevier.com/content/object/eid/1-s2.0-S1381116913002008-gr2_lrg.jpg?httpAccept=%2A%2F%2A",
            "@multimediatype": "JPEG image file",
            "@type": "IMAGE-HIGH-RES",
            "@size": "163188",
            "@ref": "gr2",
            "@mimetype": "image/jpeg"
          },
          {
            "@category": "high",
            "@height": "1298",
            "@width": "1678",
            "@_fa": "true",
            "$": "https://api.elsevier.com/content/object/eid/1-s2.0-S1381116913002008-gr1_lrg.jpg?httpAccept=%2A%2F%2A",
            "@multimediatype": "JPEG image file",
            "@type": "IMAGE-HIGH-RES",
            "@size": "242323",
            "@ref": "gr1",
            "@mimetype": "image/jpeg"
          },
          {
            "@category": "high",
            "@height": "886",
            "@width": "635",
            "@_fa": "true",
            "$": "https://api.elsevier.com/content/object/eid/1-s2.0-S1381116913002008-fx1_lrg.jpg?httpAccept=%2A%2F%2A",
            "@multimediatype": "JPEG image file",
            "@type": "IMAGE-HIGH-RES",
            "@size": "75122",
            "@ref": "fx1",
            "@mimetype": "image/jpeg"
          },
          {
            "@category": "standard",
            "@height": "215",
            "@width": "659",
            "@_fa": "true",
            "$": "https://api.elsevier.com/content/object/eid/1-s2.0-S1381116913002008-sc1.jpg?httpAccept=%2A%2F%2A",
            "@multimediatype": "JPEG image file",
            "@type": "IMAGE-DOWNSAMPLED",
            "@size": "18114",
            "@ref": "sc1",
            "@mimetype": "image/jpeg"
          },
          {
            "@category": "standard",
            "@height": "213",
            "@width": "394",
            "@_fa": "true",
            "$": "https://api.elsevier.com/content/object/eid/1-s2.0-S1381116913002008-gr7.jpg?httpAccept=%2A%2F%2A",
            "@multimediatype": "JPEG image file",
            "@type": "IMAGE-DOWNSAMPLED",
            "@size": "6818",
            "@ref": "gr7",
            "@mimetype": "image/jpeg"
          },
          {
            "@category": "standard",
            "@height": "285",
            "@width": "384",
            "@_fa": "true",
            "$": "https://api.elsevier.com/content/object/eid/1-s2.0-S1381116913002008-gr6.jpg?httpAccept=%2A%2F%2A",
            "@multimediatype": "JPEG image file",
            "@type": "IMAGE-DOWNSAMPLED",
            "@size": "11428",
            "@ref": "gr6",
            "@mimetype": "image/jpeg"
          },
          {
            "@category": "standard",
            "@height": "488",
            "@width": "392",
            "@_fa": "true",
            "$": "https://api.elsevier.com/content/object/eid/1-s2.0-S1381116913002008-gr5.jpg?httpAccept=%2A%2F%2A",
            "@multimediatype": "JPEG image file",
            "@type": "IMAGE-DOWNSAMPLED",
            "@size": "23585",
            "@ref": "gr5",
            "@mimetype": "image/jpeg"
          },
          {
            "@category": "standard",
            "@height": "452",
            "@width": "386",
            "@_fa": "true",
            "$": "https://api.elsevier.com/content/object/eid/1-s2.0-S1381116913002008-gr4.jpg?httpAccept=%2A%2F%2A",
            "@multimediatype": "JPEG image file",
            "@type": "IMAGE-DOWNSAMPLED",
            "@size": "16588",
            "@ref": "gr4",
            "@mimetype": "image/jpeg"
          },
          {
            "@category": "standard",
            "@height": "467",
            "@width": "393",
            "@_fa": "true",
            "$": "https://api.elsevier.com/content/object/eid/1-s2.0-S1381116913002008-gr3.jpg?httpAccept=%2A%2F%2A",
            "@multimediatype": "JPEG image file",
            "@type": "IMAGE-DOWNSAMPLED",
            "@size": "14096",
            "@ref": "gr3",
            "@mimetype": "image/jpeg"
          },
          {
            "@category": "standard",
            "@height": "473",
            "@width": "379",
            "@_fa": "true",
            "$": "https://api.elsevier.com/content/object/eid/1-s2.0-S1381116913002008-gr2.jpg?httpAccept=%2A%2F%2A",
            "@multimediatype": "JPEG image file",
            "@type": "IMAGE-DOWNSAMPLED",
            "@size": "18860",
            "@ref": "gr2",
            "@mimetype": "image/jpeg"
          },
          {
            "@category": "standard",
            "@height": "293",
            "@width": "379",
            "@_fa": "true",
            "$": "https://api.elsevier.com/content/object/eid/1-s2.0-S1381116913002008-gr1.jpg?httpAccept=%2A%2F%2A",
            "@multimediatype": "JPEG image file",
            "@type": "IMAGE-DOWNSAMPLED",
            "@size": "26509",
            "@ref": "gr1",
            "@mimetype": "image/jpeg"
          },
          {
            "@category": "standard",
            "@height": "200",
            "@width": "143",
            "@_fa": "true",
            "$": "https://api.elsevier.com/content/object/eid/1-s2.0-S1381116913002008-fx1.jpg?httpAccept=%2A%2F%2A",
            "@multimediatype": "JPEG image file",
            "@type": "IMAGE-DOWNSAMPLED",
            "@size": "7854",
            "@ref": "fx1",
            "@mimetype": "image/jpeg"
          },
          {
            "@category": "thumbnail",
            "@height": "72",
            "@width": "219",
            "@_fa": "true",
            "$": "https://api.elsevier.com/content/object/eid/1-s2.0-S1381116913002008-sc1.sml?httpAccept=%2A%2F%2A",
            "@multimediatype": "GIF image file",
            "@type": "IMAGE-THUMBNAIL",
            "@size": "2385",
            "@ref": "sc1",
            "@mimetype": "image/gif"
          },
          {
            "@category": "thumbnail",
            "@height": "119",
            "@width": "219",
            "@_fa": "true",
            "$": "https://api.elsevier.com/content/object/eid/1-s2.0-S1381116913002008-gr7.sml?httpAccept=%2A%2F%2A",
            "@multimediatype": "GIF image file",
            "@type": "IMAGE-THUMBNAIL",
            "@size": "2055",
            "@ref": "gr7",
            "@mimetype": "image/gif"
          },
          {
            "@category": "thumbnail",
            "@height": "162",
            "@width": "219",
            "@_fa": "true",
            "$": "https://api.elsevier.com/content/object/eid/1-s2.0-S1381116913002008-gr6.sml?httpAccept=%2A%2F%2A",
            "@multimediatype": "GIF image file",
            "@type": "IMAGE-THUMBNAIL",
            "@size": "2847",
            "@ref": "gr6",
            "@mimetype": "image/gif"
          },
          {
            "@category": "thumbnail",
            "@height": "163",
            "@width": "131",
            "@_fa": "true",
            "$": "https://api.elsevier.com/content/object/eid/1-s2.0-S1381116913002008-gr5.sml?httpAccept=%2A%2F%2A",
            "@multimediatype": "GIF image file",
            "@type": "IMAGE-THUMBNAIL",
            "@size": "3116",
            "@ref": "gr5",
            "@mimetype": "image/gif"
          },
          {
            "@category": "thumbnail",
            "@height": "164",
            "@width": "140",
            "@_fa": "true",
            "$": "https://api.elsevier.com/content/object/eid/1-s2.0-S1381116913002008-gr4.sml?httpAccept=%2A%2F%2A",
            "@multimediatype": "GIF image file",
            "@type": "IMAGE-THUMBNAIL",
            "@size": "2568",
            "@ref": "gr4",
            "@mimetype": "image/gif"
          },
          {
            "@category": "thumbnail",
            "@height": "164",
            "@width": "138",
            "@_fa": "true",
            "$": "https://api.elsevier.com/content/object/eid/1-s2.0-S1381116913002008-gr3.sml?httpAccept=%2A%2F%2A",
            "@multimediatype": "GIF image file",
            "@type": "IMAGE-THUMBNAIL",
            "@size": "2358",
            "@ref": "gr3",
            "@mimetype": "image/gif"
          },
          {
            "@category": "thumbnail",
            "@height": "163",
            "@width": "131",
            "@_fa": "true",
            "$": "https://api.elsevier.com/content/object/eid/1-s2.0-S1381116913002008-gr2.sml?httpAccept=%2A%2F%2A",
            "@multimediatype": "GIF image file",
            "@type": "IMAGE-THUMBNAIL",
            "@size": "2653",
            "@ref": "gr2",
            "@mimetype": "image/gif"
          },
          {
            "@category": "thumbnail",
            "@height": "164",
            "@width": "212",
            "@_fa": "true",
            "$": "https://api.elsevier.com/content/object/eid/1-s2.0-S1381116913002008-gr1.sml?httpAccept=%2A%2F%2A",
            "@multimediatype": "GIF image file",
            "@type": "IMAGE-THUMBNAIL",
            "@size": "5440",
            "@ref": "gr1",
            "@mimetype": "image/gif"
          },
          {
            "@category": "thumbnail",
            "@height": "163",
            "@width": "117",
            "@_fa": "true",
            "$": "https://api.elsevier.com/content/object/eid/1-s2.0-S1381116913002008-fx1.sml?httpAccept=%2A%2F%2A",
            "@multimediatype": "GIF image file",
            "@type": "IMAGE-THUMBNAIL",
            "@size": "3727",
            "@ref": "fx1",
            "@mimetype": "image/gif"
          }
        ]
      },
      "link": {
        "@rel": "abstract",
        "@href": "https://api.elsevier.com/content/abstract/scopus_id/84879049629"
      }
    }
  }
}