{
  "metadata": {
    "title": "Methanol synthesis from CO<ce:inf loc=post>2</ce:inf> hydrogenation over copper catalysts supported on MgO-modified TiO<ce:inf loc=post>2</ce:inf>",
    "authors": "; ; ",
    "journal": "Journal of Molecular Catalysis A: Chemical",
    "date": "2016-12-15",
    "doi": "10.1016/j.molcata.2016.09.032",
    "abstract": "",
    "uri": "https://api.elsevier.com/content/article/pii/S1381116916304046",
    "pii": "S1381116916304046"
  },
  "fulltext": {
    "full-text-retrieval-response": {
      "scopus-eid": "2-s2.0-84988944598",
      "originalText": "serial JL 271358 291210 291744 291790 291809 31 Journal of Molecular Catalysis A: Chemical JOURNALMOLECULARCATALYSISACHEMICAL 2016-09-28 2016-09-28 2016-10-01 2016-10-01 2019-10-28T13:34:12 1-s2.0-S1381116916304046 S1381-1169(16)30404-6 S1381116916304046 10.1016/j.molcata.2016.09.032 S300 S300.2 FULL-TEXT 1-s2.0-S1381116916X00118 2019-10-30T00:38:56.0512Z 0 0 20161215 2016 2016-09-28T07:29:48.177004Z absattachment articleinfo articletitlenorm authfirstinitialnorm authfirstsurnamenorm cid cids contenttype copyright crossmark dateloaded dateloadedtxt datesearch datesort dateupdated dco docsubtype doctype doi eid ewtransactionid hubeid indexeddate issn issnnorm itemstage itemtransactionid itemweight openaccess openarchive pg pgfirst pglast pii piinorm pubdatestart pubdatetxt pubyr sectiontitle sortorder srctitle srctitlenorm srctype ssids alllist content subj subheadings suppl tomb volfirst volissue volumelist webpdf webpdfpagecount yearnav figure table body mmlmath acknowledge affil articletitle auth authfirstini authfull authkeywords authlast grantnumber grantsponsor grantsponsorid highlightsabst primabst ref specialabst 1381-1169 13811169 true 425 425 C Volume 425 12 86 93 86 93 20161215 15 December 2016 2016-12-15 2016 Regular Papers article fla © 2016 Elsevier B.V. All rights reserved. METHANOLSYNTHESISCO2HYDROGENATIONOVERCOPPERCATALYSTSSUPPORTEDMGOMODIFIEDTIO2 LIU C 1 Introduction 2 Experimental 2.1 Catalyst preparation 2.2 Catalyst characterization 2.3 Catalytic testing 3 Results and discussion 3.1 Textural and structural properties of the catalysts 3.2 XPS analysis 3.3 The reducibility of catalysts 3.4 The surface basicity of catalysts 3.5 Catalytic performance 4 Conclusions Acknowledgements References WANG 2011 3703 3727 W OLAH 2009 487 498 G ALI 2015 508 518 K LIU 2003 6518 6530 X TAGAWA 1995 193 202 T LEI 2015 161 166 H ARENA 2013 141 151 F RAUDASKOSKI 2007 57 60 R BAN 2014 50 54 H KILO 1997 169 184 M SLOCZYNSKI 2006 127 137 J GUO 2010 178 185 X GUO 2011 60 68 X GAO 2013 51 60 P BANDO 1997 391 409 K ZHANG 2012 118 123 L XIAO 2015 146 153 J FISHER 1997 222 237 I ARENA 2008 16 23 F GAO 2013 442 452 P GAO 2014 78 82 P ZHONG 2015 52958 52965 C CHINCHEN 1987 79 86 G SLOCZYNSKI 2004 11 23 J HINRICHSEN 2000 956 959 O JIN 2004 585 590 R DU 2015 79 84 Z FERRI 2009 192 198 E WANG 2007 16549 16557 L LI 2016 8479 8788 H LIU 2013 349 358 L HAN 2016 1065 1073 L PLATZMAN 2008 1101 1108 I ZHANG 2006 3360 3367 Y AVGOUROPOULOS 2005 87 93 G ARENA 2007 185 194 F AGRELL 2003 389 403 J BOND 1991 305 319 G DIEZ 2000 53 62 V VERZIU 2008 373 381 M FISHER 1997 11 17 I BOUDART 1995 661 666 M SUN 1997 92 105 Q FUJITA 2001 121 128 S TOYIR 2001 255 266 J RHODES 2005 198 209 M WANG 2014 923 931 G LIUX2016X86 LIUX2016X86X93 LIUX2016X86XC LIUX2016X86X93XC 2018-10-01T00:00:00.000Z http://creativecommons.org/licenses/by-nc-nd/4.0/ © 2016 Elsevier B.V. All rights reserved. 2019-03-25T04:07:47.359Z http://vtw.elsevier.com/data/voc/AddOnTypes/50.7/nlp S1381116916304046 National Natural Science Foundation of China 21273150 National Natural Science Foundation of China http://data.elsevier.com/vocabulary/SciValFunders/501100001809 http://sws.geonames.org/1814991/ Shanghai Municipal Education Commission 13YZ117 Shanghai Municipal Education Commission http://data.elsevier.com/vocabulary/SciValFunders/501100003395 http://sws.geonames.org/1814991/ Shanghai Municipal Science and Technology Commission 13ZR1441200 13ZR1461900 STCSM Science and Technology Commission of Shanghai Municipality http://data.elsevier.com/vocabulary/SciValFunders/501100003399 http://sws.geonames.org/1814991/ The authors thank Shanghai Municipal Education Commission (No. 13YZ117 ), Shanghai Municipal Science and Technology Commission (No. 13ZR1441200 , No. 13ZR1461900 ) and the National Natural Science Foundation of China (No. 21273150 ) for financial support. The helpful suggestions and linguistic revision of the manuscript provided by the anonymous reviewers are also gratefully acknowledged. item S1381-1169(16)30404-6 S1381116916304046 1-s2.0-S1381116916304046 10.1016/j.molcata.2016.09.032 271358 2019-10-30T00:38:56.0512Z 2016-12-15 1-s2.0-S1381116916304046-main.pdf https://s3.amazonaws.com/prod-ucs-content-store-us-east/content/pii:S1381116916304046/MAIN/application/pdf/71bcfade1bdabcc7a46d6568a25db8cb/main.pdf main.pdf pdf true 1874092 MAIN 8 1-s2.0-S1381116916304046-main_1.png https://s3.amazonaws.com/prod-ucs-content-store-us-east/content/pii:S1381116916304046/PREVIEW/image/png/73acf089ec1d571df1390ca29869dd68/main_1.png main_1.png png 57243 849 656 IMAGE-WEB-PDF 1 1-s2.0-S1381116916304046-fx1.sml https://s3.amazonaws.com/prod-ucs-content-store-us-east/content/pii:S1381116916304046/fx1/THUMBNAIL/image/gif/9e038a8a0e5569b7decedea4097b96b3/fx1.sml fx1 true fx1.sml sml 3500 88 219 IMAGE-THUMBNAIL 1-s2.0-S1381116916304046-gr1.sml https://s3.amazonaws.com/prod-ucs-content-store-us-east/content/pii:S1381116916304046/gr1/THUMBNAIL/image/gif/5d51224b5268da054c92986bedc2dbd2/gr1.sml gr1 gr1.sml sml 4602 163 93 IMAGE-THUMBNAIL 1-s2.0-S1381116916304046-gr2.sml https://s3.amazonaws.com/prod-ucs-content-store-us-east/content/pii:S1381116916304046/gr2/THUMBNAIL/image/gif/0a2c22de12578428152e068200a542cc/gr2.sml gr2 gr2.sml sml 6427 120 219 IMAGE-THUMBNAIL 1-s2.0-S1381116916304046-gr3.sml https://s3.amazonaws.com/prod-ucs-content-store-us-east/content/pii:S1381116916304046/gr3/THUMBNAIL/image/gif/39912f8fa9d107bfd76bf900a5e21298/gr3.sml gr3 gr3.sml sml 6051 120 219 IMAGE-THUMBNAIL 1-s2.0-S1381116916304046-gr4.sml https://s3.amazonaws.com/prod-ucs-content-store-us-east/content/pii:S1381116916304046/gr4/THUMBNAIL/image/gif/78f3e68c4d3f1e378e895d1d9b982836/gr4.sml gr4 gr4.sml sml 7856 164 210 IMAGE-THUMBNAIL 1-s2.0-S1381116916304046-gr5.sml https://s3.amazonaws.com/prod-ucs-content-store-us-east/content/pii:S1381116916304046/gr5/THUMBNAIL/image/gif/a02e49b550d20e964907048dfcd6cf10/gr5.sml gr5 gr5.sml sml 8044 164 206 IMAGE-THUMBNAIL 1-s2.0-S1381116916304046-gr6.sml https://s3.amazonaws.com/prod-ucs-content-store-us-east/content/pii:S1381116916304046/gr6/THUMBNAIL/image/gif/f1c90e864f049ab14ac910c26b68d073/gr6.sml gr6 gr6.sml sml 4571 164 205 IMAGE-THUMBNAIL 1-s2.0-S1381116916304046-gr7.sml https://s3.amazonaws.com/prod-ucs-content-store-us-east/content/pii:S1381116916304046/gr7/THUMBNAIL/image/gif/1b3675fb41c752c90364d722628c28cd/gr7.sml gr7 gr7.sml sml 6163 164 216 IMAGE-THUMBNAIL 1-s2.0-S1381116916304046-fx1.jpg https://s3.amazonaws.com/prod-ucs-content-store-us-east/content/pii:S1381116916304046/fx1/DOWNSAMPLED/image/jpeg/0e3bf2b2f5e72ae79a1c280cdee3c2a0/fx1.jpg fx1 true fx1.jpg jpg 15621 200 500 IMAGE-DOWNSAMPLED 1-s2.0-S1381116916304046-gr1.jpg https://s3.amazonaws.com/prod-ucs-content-store-us-east/content/pii:S1381116916304046/gr1/DOWNSAMPLED/image/jpeg/8233639d3b8f4080130805bfc5d0f51d/gr1.jpg gr1 gr1.jpg jpg 54721 615 351 IMAGE-DOWNSAMPLED 1-s2.0-S1381116916304046-gr2.jpg https://s3.amazonaws.com/prod-ucs-content-store-us-east/content/pii:S1381116916304046/gr2/DOWNSAMPLED/image/jpeg/54557e8cc77e36e797800bb94d5f1a6f/gr2.jpg gr2 gr2.jpg jpg 33899 272 497 IMAGE-DOWNSAMPLED 1-s2.0-S1381116916304046-gr3.jpg https://s3.amazonaws.com/prod-ucs-content-store-us-east/content/pii:S1381116916304046/gr3/DOWNSAMPLED/image/jpeg/6054704f5aecf7f1bf21c19b4863ef1d/gr3.jpg gr3 gr3.jpg jpg 33567 281 513 IMAGE-DOWNSAMPLED 1-s2.0-S1381116916304046-gr4.jpg https://s3.amazonaws.com/prod-ucs-content-store-us-east/content/pii:S1381116916304046/gr4/DOWNSAMPLED/image/jpeg/766e4983a9ac596d10dd12be8db6f6ed/gr4.jpg gr4 gr4.jpg jpg 24548 265 339 IMAGE-DOWNSAMPLED 1-s2.0-S1381116916304046-gr5.jpg https://s3.amazonaws.com/prod-ucs-content-store-us-east/content/pii:S1381116916304046/gr5/DOWNSAMPLED/image/jpeg/4484fadabb233590c3f8349a2862e23b/gr5.jpg gr5 gr5.jpg jpg 27043 269 339 IMAGE-DOWNSAMPLED 1-s2.0-S1381116916304046-gr6.jpg https://s3.amazonaws.com/prod-ucs-content-store-us-east/content/pii:S1381116916304046/gr6/DOWNSAMPLED/image/jpeg/71cd588a2d22ad5709ff2d4150b40c68/gr6.jpg gr6 gr6.jpg jpg 13867 271 339 IMAGE-DOWNSAMPLED 1-s2.0-S1381116916304046-gr7.jpg https://s3.amazonaws.com/prod-ucs-content-store-us-east/content/pii:S1381116916304046/gr7/DOWNSAMPLED/image/jpeg/e0b398af16ab8ad6e77175ee9816e7d3/gr7.jpg gr7 gr7.jpg jpg 18550 257 339 IMAGE-DOWNSAMPLED 1-s2.0-S1381116916304046-fx1_lrg.jpg https://s3.amazonaws.com/prod-ucs-content-store-us-east/content/pii:S1381116916304046/fx1/HIGHRES/image/jpeg/ab0916de80866e2f444f25f78025a189/fx1_lrg.jpg fx1 true fx1_lrg.jpg jpg 108306 886 2213 IMAGE-HIGH-RES 1-s2.0-S1381116916304046-gr1_lrg.jpg https://s3.amazonaws.com/prod-ucs-content-store-us-east/content/pii:S1381116916304046/gr1/HIGHRES/image/jpeg/b47a6c2c6f4460093f19bc57ea068693/gr1_lrg.jpg gr1 gr1_lrg.jpg jpg 426420 2723 1555 IMAGE-HIGH-RES 1-s2.0-S1381116916304046-gr2_lrg.jpg https://s3.amazonaws.com/prod-ucs-content-store-us-east/content/pii:S1381116916304046/gr2/HIGHRES/image/jpeg/bc98bb145cab4238526128045ca37877/gr2_lrg.jpg gr2 gr2_lrg.jpg jpg 242579 1207 2202 IMAGE-HIGH-RES 1-s2.0-S1381116916304046-gr3_lrg.jpg https://s3.amazonaws.com/prod-ucs-content-store-us-east/content/pii:S1381116916304046/gr3/HIGHRES/image/jpeg/fb4a45f41a32fa325c308d001148520c/gr3_lrg.jpg gr3 gr3_lrg.jpg jpg 259454 1246 2273 IMAGE-HIGH-RES 1-s2.0-S1381116916304046-gr4_lrg.jpg https://s3.amazonaws.com/prod-ucs-content-store-us-east/content/pii:S1381116916304046/gr4/HIGHRES/image/jpeg/c1f284b36e0bc1a964228d91301dc1a4/gr4_lrg.jpg gr4 gr4_lrg.jpg jpg 184737 1173 1500 IMAGE-HIGH-RES 1-s2.0-S1381116916304046-gr5_lrg.jpg https://s3.amazonaws.com/prod-ucs-content-store-us-east/content/pii:S1381116916304046/gr5/HIGHRES/image/jpeg/41ee878f849e14e33947a77691ef09a5/gr5_lrg.jpg gr5 gr5_lrg.jpg jpg 200647 1191 1500 IMAGE-HIGH-RES 1-s2.0-S1381116916304046-gr6_lrg.jpg https://s3.amazonaws.com/prod-ucs-content-store-us-east/content/pii:S1381116916304046/gr6/HIGHRES/image/jpeg/a0bc9ec34b9f39a73970e3be07ecb9d1/gr6_lrg.jpg gr6 gr6_lrg.jpg jpg 95309 1200 1500 IMAGE-HIGH-RES 1-s2.0-S1381116916304046-gr7_lrg.jpg https://s3.amazonaws.com/prod-ucs-content-store-us-east/content/pii:S1381116916304046/gr7/HIGHRES/image/jpeg/7f91048ea7ca33fbd90f301ae6195bea/gr7_lrg.jpg gr7 gr7_lrg.jpg jpg 128905 1138 1500 IMAGE-HIGH-RES 1-s2.0-S1381116916304046-si1.gif https://s3.amazonaws.com/prod-ucs-content-store-us-east/content/pii:S1381116916304046/STRIPIN/image/gif/f70b793d02faa9fd9d15d188933751e7/si1.gif si1 si1.gif gif 1193 23 293 ALTIMG 1-s2.0-S1381116916304046-si2.gif https://s3.amazonaws.com/prod-ucs-content-store-us-east/content/pii:S1381116916304046/STRIPIN/image/gif/321df0aa0bf12c316c3ad16dd880ae39/si2.gif si2 si2.gif gif 804 23 186 ALTIMG 1-s2.0-S1381116916304046-si3.gif https://s3.amazonaws.com/prod-ucs-content-store-us-east/content/pii:S1381116916304046/STRIPIN/image/gif/5380675abf5b562f6eb13d27c5abc90a/si3.gif si3 si3.gif gif 575 16 148 ALTIMG MOLCAA 10056 S1381-1169(16)30404-6 10.1016/j.molcata.2016.09.032 Elsevier B.V. Fig. 1 XRD patterns of TiO2, C/T and C/MT catalysts: (a) calcined catalysts, (b) reduced catalysts. TiO2 (anatase) (▼); TiO2 (rutile) (▲); CuO (●); Cu (■); MgTiO3 (★). Fig. 1 Fig. 2 XPS spectra of the calcined C/T and C/MT catalysts: (a) Cu 2p; (b) Ti 2p. Fig. 2 Fig. 3 XPS and AES spectra of the reduced C/T and C/MT catalysts: (a) Cu 2p; (b) Cu LMM. Fig. 3 Fig. 4 H2-TPR patterns of C/T and C/MT catalysts. Fig. 4 Fig. 5 CO2-TPD profiles of C/T and C/MT catalysts. Fig. 5 Fig. 6 The relationship between the TOF of CO2 conversion and the Cu surface area. Reaction conditions: H2/CO2 =3, T=220°C, P=3.0MPa, GHSV=4800h−1. Fig. 6 Fig. 7 Effect of temperature on the conversion of CO2 (solid symbols) and selectivity of methanol (open symbols) over C/T (circles) and C/1%MT (rectangles) catalysts. Reaction conditions: H2/CO2 =3, P=3.0MPa, GHSV=4800h−1. Fig. 7 Table 1 Physicochemical properties of TiO2, C/T and C/MT catalysts. Table 1 Sample S BET(m2/g) d CuO b (nm) d Cu b (nm) S Cu (m2/g) D Cu c (%) d Cu c (nm) Calcined Reduced a TiO2 121 – – – – – – C/T 80 75 26.4 30.9 1.94 3.51 29.6 C/0.5%MT 91 87 26.1 30.5 2.19 3.93 26.4 C/1%MT 101 97 26.3 30.8 2.31 4.16 25.0 C/3%MT 105 93 28.8 32.3 1.92 3.43 30.3 C/5%MT 100 82 28.7 32.2 1.84 3.24 32.1 C/7%MT 94 83 28.5 32.3 1.75 3.13 33.2 a After reduction at 300°C. b Calculated with Scherrer equation using the most intense peaks centered at 35.6° and 43.2° for CuO and Cu, respectively. c Derived from N2O titration measurements. Table 2 Composition of C/T and C/MT catalysts. Table 2 Catalysts Bulk concentration of metal (at.%) a Surface concentration of metal (at.%) b Cu Mg Ti Cu Mg Ti C/T 10.7 (11.2) – 89.3 (88.8) 15.2 – 84.8 C/0.5%MT 10.7 (11.1) 1.5 (1.4) 87.8 (87.5) 14.2 4.7 81.1 C/1%MT 10.6 (11.0) 2.9 (2.8) 86.5 (86.2) 13.1 9.8 77.1 C/3%MT 10.4 (10.7) 8.2 (8.0) 81.4 (81.3) 11.3 22.2 66.5 C/5%MT 10.3 (10.5) 12.9 (12.6) 76.8 (76.9) 9.1 25.4 65.5 C/7%MT 9.9 (10.2) 17.3 (16.8) 72.8 (73.0) 7.6 29.1 63.3 a Bulk composition are determined by atomic absorption spectrum; the values in parenthesis are the nominal fraction of metal. b Surface composition are determined by XPS. Table 3 Temperature of reduction peaks over C/T and C/MT catalysts. Table 3 Catalyst T α (°C) T β (°C) T γ (°C) C/T 146 159 172 C/0.5%MT 147 159 185 C/1%MT 149 159 189 C/3%MT 175 186 216 C/5%MT 183 196 229 C/7%MT 193 202 230 Table 4 The maximum temperature of CO2 desorption and the amount of basic site over C/T and C/MT catalysts. Table 4 Catalyst T α (°C) T β (°C) T γ (°C) Number of basic sites (μmol/g) Site α Site β Site γ C/T 105 249 390 1.98 0.04 0.32 C/0.5%MT 105 269 392 2.77 0.09 0.37 C/1%MT 105 320 395 3.42 0.57 0.41 C/3%MT 105 339 400 6.66 0.60 0.48 C/5%MT 106 345 408 7.78 0.63 0.52 C/7%MT 107 389 435 9.40 0.70 0.54 Table 5 Catalytic property for hydrogenation of CO2 to methanol over C/T and C/MT catalysts. Table 5 Catalyst CO2 conversion (%) CH3OH selectivity (%) CH3OH yield (%) TOFCO2 ×103 (s−1) C/T 4.3 29.8 1.28 6.8 C/0.5%MT 5.0 33.9 1.70 7.0 C/1%MT 5.2 37.9 1.97 6.9 C/3%MT 3.6 48.2 1.74 5.8 C/5%MT 2.6 55.5 1.44 4.3 C/7%MT 2.4 46.0 1.10 4.2 Reaction conditions: H2/CO2 =3, T=220°C, P=3.0MPa, GHSV=4800h−1. Experimental errors of the CO2 conversion and CH3OH selectivity are within ±3% of the values reported. Methanol synthesis from CO2 hydrogenation over copper catalysts supported on MgO-modified TiO2 Chaoheng Liu Xiaoming Guo ⁎ Qiangsheng Guo Dongsen Mao ⁎ Jun Yu Guanzhong Lu Research Institute of Applied Catalysis, School of Chemical and Environmental Engineering, Shanghai Institute of Technology, Shanghai 201418, People’s Republic of China Research Institute of Applied Catalysis School of Chemical and Environmental Engineering Shanghai Institute of Technology Shanghai 201418 People’s Republic of China ⁎ Corresponding authors. Graphical abstract A serials of copper catalysts supported on TiO2 modified with different amount of MgO were prepared by an impregnation method and tested for methanol synthesis from CO2 hydrogenation. The physico-chemical properties of the catalysts were characterized using XRD, N2 physisorption, N2O titration, XPS, H2-TPR and CO2-TPD techniques. With the increase in amount of MgO, the Cu surface area initially increases and then decreases. The modification of TiO2 with MgO hinders the interaction between CuO and TiO2, resulting in a decline in the reducibility of CuO. Furthermore, the number and strength of the moderate and strong basic sites over the surface of catalyst increase with increasing MgO loading. The catalyst exhibits an optimum catalytic activity as the content of MgO is 1wt%. The CO2 conversion is determined by the Cu specific surface area and the interaction between CuO and TiO2, and the CH3OH selectivity is related to the surface basicity of catalyst. Keywords Methanol CO2 hydrogenation MgO-modified TiO2 Cu surface area Reducibility Basicity 1 Introduction It is believed that the increase in atmospheric CO2 concentration caused by fossil fuels burning leads to the anthropogenic global warming. Converting CO2 into valuable chemicals has received much attention as one of the effective CO2 utilizing technologies. Most researchers focused on the process of CO2 hydrogenation to methanol because methanol is an important feedstock for the chemical industry and a clean and renewable energy source [1,2]. Methanol synthesis from CO2 hydrogenation is run mostly on copper catalyst for its inexpensive price and remarkable hydrogenation activity [3,4]. Generally, the amphoteric oxides are chosen as the supporter [5]. Copper catalysts supported on ZnO, Al2O3, and ZrO2 for CO2 hydrogenation have been investigated intensively in the past few decades [6–14]. TiO2 is a typical amphoteric oxide, and it possesses the chemical properties similar to that of ZrO2. However, comparatively few studies on the TiO2 supported (or promoted) copper catalyst for methanol synthesis have been published. Bando et al. prepared three catalysts (Cu/Al2O3, Cu/SiO2, and Cu/TiO2) by impregnation method, and they found that TiO2-supported Cu catalyst showed the highest turnover frequency for methanol production [15]. Zhang et al. investigated the influences of SiO2, TiO2 and TiO2-SiO2 promoters on the catalytic performance of CuO-ZnO-Al2O3. The results showed that TiO2 and TiO2-SiO2 improved the CuO dispersion and the adsorption of H2 on catalyst [16]. In a previous work, we disclosed that the introduction of TiO2 into CuO-ZnO catalyst increased the Cu dispersion and the adsorption capacity of CO2, and thus improving the catalytic activity and methanol selectivity [17]. According to the dual-site mechanism for CO2 hydrogenation over the copper catalyst, the adsorption and the activation of CO2 occur on the surface of supporter [18,19]. Recently, a number of studies showed that the catalytic performance was related closely to the surface basicity of catalyst because CO2 is intrinsically an acidic molecule [13,14,17]. Therefore, to improve the catalytic performance, several endeavors have been made to tune the basicity of the catalyst [20–22]. In this study, TiO2 was modified with MgO, one of the most common solid bases, and then copper catalyst supported on the MgO-modified TiO2 was prepared by an impregnation method. The catalysts were examined by various characterization techniques, and the catalytic activity for methanol synthesis from CO2 hydrogenation was tested. This study emphasizes the effect of MgO on the physicochemical properties of catalyst. Moreover, the relationship between catalytic behavior and the physicochemical properties was discussed in detail. 2 Experimental 2.1 Catalyst preparation TiO2 supporter was synthesized by a hydrothermal method. First, 2.0g hexamethylene tetramine was added to a solvent containing 45.7mL methanol and 50.0mL distilled water under stirring, and then 4.3mL titanium trichloride (15wt%) was added dropwise into the above solution. The resulting mixture was transferred to a dried Teflon-lined autoclave with a capacity of 200mL, followed by a hydrothermal treatment at 90°C for 1h and 190°C for 2h. After the hydrothermal reaction, the white precipitate was collected by centrifuge and washed with ethanol and distilled water until no chloride ion was detected with AgNO3 solution. Finally, the precipitate was dried in an oven at 80°C for 12h and ground into powder. MgO-modified TiO2 was prepared by an impregnation method with Mg(NO3)·6H2O as magnesium source. The amount of MgO, expressed as the ratio of Mg to TiO2, ranges from 0.5 to 7wt%. The impregnated precursor was dried at 110°C overnight and calcined in air at 400°C for 4h. Copper catalysts supported on TiO2 and MgO-modified TiO2 were prepared by an impregnation method with Cu(NO3)·3H2O as copper source. The nominal Cu loading is 10wt% of the supporter for all samples. The impregnated samples were dried at 110°C overnight, followed by a calcination in air at 400°C for 4h. All chemicals used were reagent grade products purchased from Shanghai Chemical Reagent Corporation, Shanghai, China. The synthesized catalysts are denoted as C/x%MT, where C/MT represents copper catalyst supported on the MgO-modified TiO2, and x% is the mass ratio of Mg to TiO2. 2.2 Catalyst characterization X-ray diffraction (XRD) analysis of samples was performed on a PANalytical X’Pert diffractometer, applying nickel-filtered Cu Kα radiation with a tube voltage of 40kV and a tube current of 40mA. Two theta angles ranged from 20° to 60° with a scanning rate of 5°/min. The specific surface area was determined with the BET method, using a Micromeritics ASAP2020 M+C adsorption apparatus. The samples were evacuated at 200°C for 3h prior to N2 dosage. The method of N2O titration was used to measure the Cu specific surface area (S Cu) over the reduced catalysts [23–25]. Before measurements, catalysts were reduced in situ at 300°C in a H2/He flow for 1h. The samples were flushed in a He flow, and then cooled to the reaction temperature (60°C). Afterward, a flow of 1 vol% N2O/He gas mixture was fed into the reactor. A mass spectrometer (Pfeiffer Vacuum Quadstar, 32-bit) was used to detect the amount of the consumption of N2O. The dispersion of Cu (D Cu) and S Cu were calculated considering a molar stoichiometry of N2O/Cu=0.5 and a value of 1.46×1019 Cu atoms/m2 for the copper surface atom density [19]. The Cu average particle size (d Cu) was obtained from the surface area of metallic copper using a spherical particle model [7]. The compositions of catalyst were determined by atomic absorption spectroscopy (AAS) on acid-digested samples, using a SpectrAA-220 Atomic absorption spectrometer (VARIAN). X-ray photoelectron spectroscopy (XPS) and X-ray-induced Auger electron spectroscopy (AES) measurements were performed on a ESCALAB 250Xi spectrometer using a focused monochromatized Al Kα (1486.6eV). The energy analyzer was set to a constant pass energy of 50eV. All the binding energy values were calibrated by using C 1s=284.6eV as a reference. Quantification of the surface atomic concentrations was carried out using the sensitivity factors supplied by the XPS instrument. In the case of the reduced catalyst, the calcined sample was first transferred to a separate reaction chamber under ultrahigh vacuum by a transfer rod, and then exposed to a 10% H2/N2 flow of 30mL/min at 300°C for 1h. After cooled to room temperature, the reaction chamber was evacuated. The samples were then transferred back to the analysis chamber without exposure to air. For the calcined catalysts, no pretreatment is required before XPS measurement. Temperature-programmed reduction (TPR) measurements were performed in a linear quartz micro-reactor. Approximately 0.03g of the catalyst was pretreated with an N2 at 300°C for 1h to remove physically adsorbed water and then cooled down to room temperature. The sample was reduced with a flow of H2/N2 gas mixture at a heating rate of 5°C/min up to 300°C. The hydrogen consumption for the reduction was monitored by a thermal conductivity detector (TCD). CO2 temperature-programmed desorption (CO2-TPD) was performed in a self-build apparatus. First, the sample was reduced in a flow of H2/N2 gas mixture at 300°C for 1h. After cooling down to room temperature, the catalyst was saturated with CO2 at 50°C for an hour, and then the physisorbed CO2 was purged with He flow. TPD of CO2 was measured by heating the temperature at 5°C/min, and the desorbed CO2 was detected by a mass spectrometer. The amount of the desorbed CO2 was quantitatively calibrated by injecting CO2 pulses. 2.3 Catalytic testing The catalytic hydrogenation of CO2 was carried out using a tubular, flow, high-pressure, fixed-bed reactor. The catalyst sample (0.5g) was mounted in the reactor and pre-reduced at 300°C for 3h in a stream of 10 vol% H2/N2. After cooling to 180°C, the reactant gas flow (N2:CO2:H2 =1:2:6, molar) was introduced, raising the pressure to 3.0MPa and the temperature to a given temperature. To avoid any condensation of some products, all post-reactor lines and valves were heated at 140°C. Effluent products were analyzed by a gas chromatograph (6820, Agilent) equipped with a two-column analytical system, the Porapak Q column and Carbosieve column, which connected to a thermal conductivity detector (CO, CO2, N2) and a flame ionization detector (organic products), respectively. The CO2 conversion (X CO2), the CH3OH selectivity and CH3OH yield were calculated according to the following equations: X CO 2 = ∑ ( n ∗ p i ) / [ ( p CO 2 ) o u t l e t + ∑ ( n ∗ p i ) ] S C H 3 O H = p C H 3 O H / ∑ ( n ∗ p i ) Y CH 3 OH = X CO 2 ∗ S C H 3 O H where P i is the partial pressure of a specific product (labelled as (i)) in the outlet gas, and n stands for the number of carbon atoms in the carbon containing product. 3 Results and discussion 3.1 Textural and structural properties of the catalysts The XRD spectra of TiO2 supporter, C/T and C/MT samples were shown in Fig. 1 (a). The peaks at 2θ of 25.3°, 37.8°, 48.1°, 54.1° and 55.1° were identified as the diffraction lines of anatase-TiO2 (JCPDS 21-1272). In comparison with the C/T sample, the diffraction peaks of TiO2 become weaker and broader with the addition of MgO, suggesting that MgO depresses the crystallization of TiO2. The characteristic diffraction peaks of CuO phase appear at 2θ of 35.6° and 38.8° (JCPDS 80-1268). As TiO2 supporter was modified with a small amount of MgO, no change in the diffraction peak of CuO could be discerned. However, an increase in the diffraction intensity of CuO is observed when the content of MgO reaches 3%. The crystallite sizes of CuO were calculated from the full width at half maximum of diffraction peaks at 2θ =35.6° with Scherrer equation and listed in Table 1 . The CuO crystallite sizes of C/0.5%MT and C/1%MT are close to that of C/T sample. As the content of MgO increases to 3%, the CuO crystallite size increases slightly. Furthermore, as shown in Fig. 1(a), no diffraction peak of MgO can be found for all the studied samples calcined at 400°C. This is because that the Mg2+ ions enter into TiO2 lattice resulting in the formation of non-crystalline MgTiO3 compound [26–28]. As-formed MgTiO3 could not be detected by XRD technique due to the low degree of crystallization. To confirm the formation of MgTiO3, the sample of C/5%MT was calcined at 800°C for 4h and examined by XRD. As shown in Fig. 1(a), after calcining at 800°C, the characteristic diffraction peaks of MgTiO3 can be observed at 2q of 32.9° and 40.6° (JCPDS 06-0494) [26–28]. Moreover, the diffraction peaks of rutile-TiO2 appear at 2q of 27.4°, 36.1°, 41.3° and 54.4° (JCPDS No. 21-1276), which is attributed to the transformation from anatase-TiO2 to rutile-TiO2 as the temperature is higher than 600°C [26]. The XRD pattern of the catalysts reduced in a flow of H2/N2 gas mixture at 300°C for 1h is presented in Fig. 1(b). The characteristic diffraction lines at 2θ values of 43.2° and 50.4° correspond to the metallic Cu (JCPDS 01-089-2838). Moreover, for all the samples, the diffraction peaks of CuO disappeared, suggesting that CuO was reduced to Cu completely. The change in the intensity of diffraction lines of Cu from C/T to C/1%MT can not be detected. A further increase of the MgO amount caused a slight rise in the intensity of diffraction lines of Cu. The crystallite size of Cu in the reduced catalysts were also calculated with Scherrer equation and listed in Table 1. It can be seen that there is a narrow size distribution (from 30.5 to 32.3nm) for the crystallite sizes of Cu, in which the differences among them are rather small. BET surface areas (S BET) of the samples before and after reduction are listed in Table 1. A S BET of 121m2/g is obtained over the TiO2 supporter, and the value of S BET decreases to 80m2/g after CuO loading. Comparing with C/T sample, the MgO-modified C/T catalyst exhibits a larger surface area since MgO depresses the crystallization of TiO2. After reduction at 300°C, the BET surface area of catalyst decreases slightly. Copper specific surface area (S Cu) determined by N2O titration is also shown in Table 1. With the addition of MgO, S Cu increase firstly and then decrease (i.e. a volcano trend), the maximum value is obtained over the sample of 1%CMT. As shown in Table 1, the variation of D Cu with the addition of MgO is similar to that of S Cu, accompanied by an inverse trend of d Cu. This can be explained as follows. On the one hand, the addition of MgO increases the BET surface area, which is favorable for the dispersion of Cu. On the other hand, MgO covers the surface of TiO2 and weakens the interaction between CuO and TiO2, leading to a decrease in the Cu dispersion. 3.2 XPS analysis The surface chemical state and composition of the catalysts were determined with the XPS technique. The representative photoelectron spectra of the Cu 2p and Ti 2p of the calcined samples are presented in Fig. 2 (a) and (b), respectively. The Cu 2p3/2 core line locates at a BE of 933.5eV together with a shake-up peak centered at 942.9eV suggesting that the chemical state of copper is Cu2+ [13,29]. With the loading of MgO, there is no significant variation in the BE of copper. However, a small shift of the BE of Ti 2p3/2 from 458.4 to 457.9eV was observed when the content of MgO increases from zero to 7%, which meant that MgO loading changes the electron density of Ti ion. The Mg 1s core line appears at a BE of 1303.7eV for all samples, which is indicative of the presence of Mg2+ [30]. Surface composition of the calcined catalyst was listed in Table 2 . For the C/T sample, the surface concentrations of Cu and Ti are 15.2% and 84.8%, respectively. With the addition of MgO, the surface Cu and Ti concentrations decrease continually, whereas an opposite trend is observed for the surface Mg concentration. As shown in Table 2, compared with the bulk composition, which is very close to the nominal composition for all samples, the surface of catalyst is depleted of Ti. In contrast, a remarkable enrichment of Mg on the surface of catalyst is observed. The occupation of the catalyst surface by Mg hinders the interaction between TiO2 and CuO leading to a decrease in the dispersion of Cu, which is in accordance with the results of N2O titration. The catalysts after in-situ reduction with H2 were also investigated by XPS. Fig. 3 (a) show that the Cu 2p3/2 and Cu2p1/2 peaks appear at 931.7 and 951.6eV, respectively, corresponding to the characteristic of Cu0 or Cu+ [31]. In addition, the shake-up satellite peak of Cu2+ at 942.9eV disappears, which indicates that there are no Cu2+ species left on the surface after reduction [31]. As is well known, XPS cannot differentiate between Cu0 and Cu+ species because Cu 2p spectra of them are almost identical [31,32]. Cu (LMM) Auger peaks are traditionally used to distinguish Cu0 and Cu+ since the kinetic energies (KE) of their Auger electrons are separated by approximately 2eV: Cu0 at 918.7eV and Cu+ at 916.8eV [33]. As shown in Fig. 3(b), for all samples, the KE of Cu (LMM) is about 918.9eV, demonstrating that Cu0 is the predominant copper species on the surface of the reduced catalyst. For element Ti and Mg, XPS spectra of the reduced catalysts are similar to that of the calcined samples under the reduction condition. 3.3 The reducibility of catalysts To assess the reduction behavior of the catalysts, TPR measurements were performed. Fig. 4 shows the H2-TPR profiles of the studied catalysts. All the profiles can be deconvoluted into three Gaussian peaks (dotted curves), and the temperatures of reduction peaks are listed in Table 3 . The low temperature peak (α peak) are due to the reduction of CuO surface species; the other two peaks (β and γ peak) appearing in a higher-temperature region correspond to the reduction of bulk-like CuO interacted with TiO2 strongly and weakly, respectively [29,34,35]. As Fig. 4 shows, when the loading amount of MgO is no more than 1wt%, apart from a small increase in the temperature of γ peak, there is no significant difference between the MgO-modified and unmodified C/T catalysts. However, as the content of MgO reached 3%, an abrupt increase in the temperature of reduction peak was observed, and the peak maxima of α, β and γ peak appear at 175, 186 and 216°C, respectively. With a further increase in MgO loading, the reduction peaks shift continually toward the higher temperature. In general, the reduction behavior of CuO in the catalyst is affected by two factors, the crystallite size of CuO and the interaction between CuO and the supporter. The smaller the crystallite size is, the lower the reduction temperature would be. The results of XRD revealed that the variation of CuO crystallite size was trivial. Therefore, in this study, the shift of the reduction peak of CuO mainly originated from the change in the interaction between CuO and TiO2. The interaction has a different effect on the reducibility of CuO according to the different supporters. As CuO disperses on the supporter of Al2O3 or ZnO, the interaction between CuO and supporter is unfavorable for the reduction of CuO [36,37]; as CuO disperses on ZrO2 or TiO2, the interaction results in an easily reducible CuO [37,38]. The interaction probably affects the reducibility of CuO by changing the strength of Cu-O bond [36]. Table 3 show that the temperatures of the reduction peaks over C/T catalyst locate in the range 146–172°C, well below that of the unsupported CuO (ca. 300°C) [22,29,36], confirming that the interaction between CuO and TiO2 facilitates the reduction of the supported CuO. After the modification with MgO, as stated in the part of XPS analysis, the surface of TiO2 was occupied partly by the component of Mg, especially as the MgO loading reached 3%, which would hinder and weaken the interaction between CuO and TiO2. The decrease in the interaction leads to a decline in the reducibility of CuO, in other word, an increase in the reduction temperature of CuO. It is noteworthy that the interaction between CuO and supporter related closely to the activity of Cu site formed after reduction [24,29]. 3.4 The surface basicity of catalysts The strength and amount of basic sites on the surface of catalysts were studied by CO2-TPD. The CO2 desorption profiles of the prereduced C/T and C/MT are presented in Fig. 5 . Additionally, the peak maximum temperature and the number of base sites are listed in Table 4 . Three CO2 desorption peaks (denote as α, β, and γ) can be observed for all the catalysts, and they correspond to weak, moderate and strong base sites according to the strength of base site, respectively. The weak base sites are originated from the surface hydroxyl groups, a Brönsted base. The moderate base sites are associated with the metal-oxygen pairs (i.e. Ti-O pairs in this case), and the strong base sites are related to low coordination oxygen atoms [14,39]. The moderate and strong base sites exhibit typical Lewis basicity. As shown in Fig. 5, after modification by MgO, there is almost no shift in the position of α peak, which means that the change in the strength of weak base site can be neglected. However, a substantial increase in the area of α peak was observed, suggesting a rise in the number of weak base sites. For the peak of β, it shifts toward higher temperature accompanying with an increase in the area. This indicates that MgO modification enhances the strength and number of the moderate base sites simultaneously. A similar variation trend was observed for γ peak with the adding of MgO. It is well known that, as far as oxide is concerned, Lewis basicity is mainly determined by the electronic property of oxygen anion [39,40]. The greater an oxygen anion's electro-donating is, the stronger its Lewis basicity will be. The XRD results illustrated that, after the modification with MgO, Ti4+ in TiO2 was substituted partly by Mg2+. The electronegativity of Mg2+ is smaller than that of Ti4+. Therefore, comparing to the unmodified C/T sample, a higher electro-donating character of oxygen anions neighboring Ti4+ over the C/MT was obtained, resulting in an increase in the strength of basic sites. 3.5 Catalytic performance The catalytic properties for methanol synthesis from CO2 hydrogenation over C/T and C/MT catalysts were presented in Table 5 . The main products of the reaction were methanol and CO under the present reaction conditions and traces of methane can be detected at high temperatures. As Table 5 illustrates, the modification of TiO2 with a small amount of MgO leads to an increase in the conversion of CO2. For example, the conversion of CO2 increases from 4.3% of C/T to 5.2% of C/1%MT. However, a drastic decrease in CO2 conversion was observed as the MgO loading reached 3%, and the value of CO2 conversion over this sample is only 3.6%. According to the mechanism of methanol synthesis from CO2 hydrogenation, the primary role of Cu is to provide a source of atomic hydrogen for the hydrogenation of carbon-containing species by spillover [18,19,41]. Actually, the production of atomic hydrogen includes two steps. First, the molecular H2 is adsorbed over the Cu active site, and then the adsorbed molecular H2 dissociates to give atomic hydrogen. The increase in the S Cu only means that more Cu active sites can be provided for the adsorption of H2 molecules. With regard to the dissociation of the adsorbed H2 molecule, it relates to the intrinsic activity of Cu site, which is affected by the interaction between Cu and TiO2. The stronger the interaction, the faster the dissociation rate of H2 molecule. The results of N2O titration (Table 1) showed that the modification of TiO2 supporter by a small amount of MgO gave rise to an increase in the S Cu. Moreover, the results of H2-TPR indicate that there is no significant change in the interaction between CuO and TiO2. As a result, more atomic hydrogenation can be produced per unit time for the hydrogenation of carbon-containing intermediates, and a higher CO2 conversion is obtained over the samples of C/0.5%MT and C/1%MT. When the content of MgO loading increased to 3%, apart from a decrease in the S Cu, H2-TPR indicated a drastic decline in the interaction between CuO and TiO2, suggesting that the dissociation of the adsorbed H2 became more difficult and the rate of producing atomic hydrogen diminished greatly. Therefore, the decrease in both the S Cu and the interaction between CuO and TiO2 are responsible for the decline in CO2 conversion as the amount of MgO reaches 3%. To better disclose the relationship between CO2 conversion and the S Cu, the turnover frequency (TOF) of CO2 conversion, which represents the molecule number of CO2 hydrogenated per second per metallic copper atom, was calculated and listed in Table 5. Moreover, a plot of TOF (CO2) versus S Cu was presented in Fig. 6 . The TOF will be a constant if all Cu site in different samples are equally active for the hydrogenation of CO2 [42,43]. As shown in Fig. 6, the TOF remains almost constant from the sample of CT to C/1%MT corresponding to the S Cu increase from 1.94 to 2.31m2/g. However, a significant decrease in TOF can be observed for the samples with MgO content from 3 to 7wt%. The decline in TOF indicates that the activity of Cu site decreases as the amount of MgO reaches 3%, and the reason for this change is ascribed to the decrease in the interaction between CuO and TiO2. Similar viewpoint was presented in the literature [24,29,43]. Obviously, the results of the TOF (CO2) confirm further that the CO2 conversion not only depends on the S Cu but also the interaction between CuO and TiO2. As shown in Table 5, the selectivity of methanol increases first and then decreases with increasing the amount of MgO loading. A value of 55.5% was obtained over the C/5%MT catalyst, which increased by 86% compared with the unmodified C/T sample. Although various factors affecting the methanol selectivity have been proposed, no agreement exists in the literature [44–46]. Recently, some researchers disclosed that the selectivity of methanol correlated with the surface basicity of the catalysts [13,14,20–22]. The carbon-containing intermediates adsorbed on the stronger basic site preferred to hydrogenate further to form methanol rather than dissociate to form CO [13,14]. The results of CO2-TPD show that the strength of moderate and strong basic sites increase continually with the addition of MgO. Consequently, an ascending trend in the CH3OH selectivity was observed from the unmodified C/T to C/5%MT. As far as C/7%MT is concerned, the decline in CH3OH selectivity is ascribed to the excessive basicity of the catalyst, which is unfavorable for the activation and hydrogenation of adsorbed intermediates [22]. Similar viewpoint had been proposed by Wang et al. [47]. CH3OH yield are also listed in Table 5. The CH3OH yield takes on a volcanic variation trend with the addition of MgO. A maximum value of 1.97% is obtained over the C/1%MT catalyst, and the value increased by 54% in comparison with the unmodified C/T sample. The effects of reaction temperature on the catalytic performance of C/T and C/1%MT catalysts were studied in the temperature range from 180 to 260°C, and the results were shown in Fig. 7 . With the elevation of reaction temperature, the conversion of CO2 increases, accompanied by a decrease in CH3OH selectivity. This trend can be explained in terms of thermodynamics and kinetics, and the related discussion was presented in the literature [12]. Furthermore, it is clear that the CO2 conversion and CH3OH selectivity over C/1%MT are higher than those over the unmodified sample of C/T. This proves further that the modification of TiO2 with an appropriate amount of MgO is favorable for the improvement of the catalytic property of Cu/TiO2 catalysts. 4 Conclusions Copper catalysts supported on TiO2 modified with different content of MgO were prepared and used for the synthesis of methanol from CO2 hydrogenation. With the addition of MgO, the Cu surface area increases first and then decreases, whereas the interaction between CuO and TiO2 decreases continually resulting in a decrease in the reducibility of CuO. Moreover, MgO modification increases the strength and number of the moderate and strong basic sites. The CO2 conversion takes on a volcanic variation trend with increasing the amount of MgO loading, which is a result of the synergetic effect of the S Cu and the interaction between CuO and TiO2. The CH3OH selectivity is related to the surface basicity of catalyst, and the appropriate strength of basic sites is beneficial for the CH3OH selectivity. A maximum methanol yield is obtained at the MgO loading of 1%. Acknowledgements The authors thank Shanghai Municipal Education Commission (No. 13YZ117), Shanghai Municipal Science and Technology Commission (No. 13ZR1441200, No.13ZR1461900) and the National Natural Science Foundation of China (No. 21273150) for financial support. The helpful suggestions and linguistic revision of the manuscript provided by the anonymous reviewers are also gratefully acknowledged. References [1] W. Wang S.P. Wang X.B. Ma J.L. Gong Chem. Soc. Res. 40 2011 3703 3727 [2] G.A. Olah A. Goeppert G.K.S. Prakash J. Org. Chem. 74 2009 487 498 [3] K.A. Ali A.Z. Abdullah A.R. Mohamed Renew. Sustain. Energy Rev. 44 2015 508 518 [4] X.M. Liu G.Q. Lu Z.F. Yan J. Beltramini Ind. Eng. Chem. Res. 42 2003 6518 6530 [5] T. Tagawa N. Nomura M. Shimakage S. Goto Res. Chem. Intermed. 21 1995 193 202 [6] H. Lei R.F. Nie G.Q. Wu Z.Y. Hou Fuel 154 2015 161 166 [7] F. Arena G. Mezzatesta G. Zafarana G. Trunfio F. Frusteri L. Spadaro J. Catal. 300 2013 141 151 [8] R. Raudaskoski M.V. Niemelä R.L. Keiski Top. Catal. 45 2007 57 60 [9] H.Y. Ban C.M. Li K. Asami K. Fujimoto Catal. Commun. 54 2014 50 54 [10] M. Kilo J. Weigel A. Wokaun R.A. Koeppel A. Stoeckli A. Baiker J. Mol. Catal. A: Chem. 126 1997 169 184 [11] J. Słoczyński R. Grabowski P. Olszewski A. Kozłowska J. Stoch M. Lachowska J. Skrzypek Appl. Catal. A: Gen. 310 2006 127 137 [12] X.M. Guo D.S. Mao G.Z. Lu S. Wang G.S. Wu J. Catal. 271 2010 178 185 [13] X.M. Guo D.S. Mao G.Z. Lu S. Wang G.S. Wu J. Mol. Catal. A: Chem. 345 2011 60 68 [14] P. Gao F. Li H.J. Zhan N. Zhao F.K. Xiao W. Wei L.S. Zhong H. Wang Y.H. Sun J. Catal. 298 2013 51 60 [15] K.K. Bando K. Sayama H. Kusama K. Okabe H. Arakawa Appl. Catal. A: Gen. 165 1997 391 409 [16] L.X. Zhang Y.C. Zhang S.Y. Chen Appl. Catal. A: Gel. 415–416 2012 118 123 [17] J. Xiao D.S. Mao X.M. Guo J. Yu Appl. Surf. Sci. 338 2015 146 153 [18] I.A. Fisher A.T. Bell J. Catal. 172 1997 222 237 [19] F. Arena G. Italiano K. Barbera S. Bordiga G. Bonura L. Spadaro F. Frusteri Appl. Catal. A: Gen. 350 2008 16 23 [20] P. Gao F. Li N. Zhao F.K. Xiao W. Wei L.S. Zhong Y.H. Sun Appl. Catal. A: Gen. 468 2013 442 452 [21] P. Gao F. Li H.J. Zhan N. Zhao F.k. Xiao W. Wei L.S. Zhong Y.H. Sun Catal. Commun. 50 2014 78 82 [22] C.L. Zhong X.M. Guo D.S. Mao S. Wang G.S. Wu G.Z. Lu RSC Adv. 5 2015 52958 52965 [23] G.C. Chinchen C.M. Hay H.D. Vandervell K.C. Waugh J. Catal. 103 1987 79 86 [24] J. Słoczyński R. Grabowski A. Kozłowska P. Olszewski J. Stoch J. Skrzypek M. Lachowska Appl. Catal. A: Gen. 278 2004 11 23 [25] O. Hinrichsen T. Genger M. Muhler Chem. Eng. Technol. 23 2000 956 959 [26] R.C. Jin W.L. Gao J.X. Chen H.S. Zeng F.X. Zhang Z.G. Liu N.J. Guan J. Photochem. Photobiol. A: Chem. 162 2004 585 590 [27] Z.P. Du F.S. Chen Z.K. Lin X.L. Li H. Yuan Y.X. Wu Chem. Eng. J. 278 2015 79 84 [28] E.A.V. Ferri J.C. Sczancoski L.S. Cavalcante E.C. Paris J.W.M. Espinosa A.T. de Figueiredo P.S. Pizani V.R. Mastelaro J.A. Varela E. Longo Mater. Chem. Phys. 117 2009 192 198 [29] L.C. Wang Q. Liu M. Chen Y.M. Liu Y. Gao H.Y. He K.N. Fan J. Phys. Chem. C 111 2007 16549 16557 [30] H.L. Li X.Y. Wu J. Wang Y. Gao L.Q. Li K. Shih Int. J. Hydrogen Energy 41 2016 8479 8788 [31] L.J. Liu F. Gao H.L. Zhao Y. Li Appl. Catal. B: Environ. 134–135 2013 349 358 [32] L.P. Han L. Zhang G.F. Zhao Y.F. Chen Q.F. Zhang R.J. Chai Y. Liu Y. Lu ChemCatChem 8 2016 1065 1073 [33] I. Platzman R. Brener H. Haick R. Tannenbaum J. Phys. Chem. C 112 2008 1101 1108 [34] Y.P. Zhang J.H. Fei Y.M. Yu X.M. Zheng Energy Convers. Manage. 47 2006 3360 3367 [35] G. Avgouropoulos T. Ioannides H. Matralis Appl. Catal. B: Environ. 56 2005 87 93 [36] F. Arena K. Barbera G. Italiano G. Bonura L. Spadaro F. Frusteri J. Catal. 249 2007 185 194 [37] J. Agrell H. Birgersson M. Boutonnet I. Melián-Cabrera R.M. Navarro J.L.G. Fierro J. Catal. 219 2003 389 403 [38] G.C. Bond S.N. Namijo J.S. Wakeman J. Mol. Catal. 64 1991 305 319 [39] V.K. Díez C.R. Apesteguía J.I. Di Cosimo Catal. Today 63 2000 53 62 [40] M. Verziu B. Cojocaru J.C. Hu R. Richards C. Ciuculescu P. Filip V.I. Parvulescu Green Chem. 10 2008 373 381 [41] I.A. Fisher H.C. Woo A.T. Bell Catal. Lett. 44 1997 11 17 [42] M. Boudart Chem. Rev. 95 1995 661 666 [43] Q. Sun Y.L. Zhang H.Y. Chen J.F. Deng D. Wu S.Y. Chen J. Catal. 167 1997 92 105 [44] S. Fujita S. Moribe Y. Kanamori M. Kakudate N. Takezawa Appl. Catal. A: Gen. 207 2001 121 128 [45] J. Toyir P. Ramírez de la Piscina J.L.G. Fierro N. Homs Appl. Catal. B: Environ. 34 2001 255 266 [46] M.D. Rhodes A.T. Bell J. Catal. 233 2005 198 209 [47] G.N. Wang L.M. Chen Y.Y. Guo M.L. Fu J.L. Wu B.C. Huang D.Q. Ye Acta Phys. −Chim. Sin. 30 2014 923 931",
      "scopus-id": "84988944598",
      "coredata": {
        "eid": "1-s2.0-S1381116916304046",
        "dc:description": "A serials of copper catalysts supported on TiO2 modified with different amount of MgO were prepared by an impregnation method and tested for methanol synthesis from CO2 hydrogenation. The physico-chemical properties of the catalysts were characterized using XRD, N2 physisorption, N2O titration, XPS, H2-TPR and CO2-TPD techniques. With the increase in amount of MgO, the Cu surface area initially increases and then decreases. The modification of TiO2 with MgO hinders the interaction between CuO and TiO2, resulting in a decline in the reducibility of CuO. Furthermore, the number and strength of the moderate and strong basic sites over the surface of catalyst increase with increasing MgO loading. The catalyst exhibits an optimum catalytic activity as the content of MgO is 1wt%. The CO2 conversion is determined by the Cu specific surface area and the interaction between CuO and TiO2, and the CH3OH selectivity is related to the surface basicity of catalyst.",
        "openArchiveArticle": "false",
        "prism:coverDate": "2016-12-15",
        "openaccessUserLicense": null,
        "prism:aggregationType": "Journal",
        "prism:url": "https://api.elsevier.com/content/article/pii/S1381116916304046",
        "dc:creator": [
          {
            "@_fa": "true",
            "$": "Liu, Chaoheng"
          },
          {
            "@_fa": "true",
            "$": "Guo, Xiaoming"
          },
          {
            "@_fa": "true",
            "$": "Guo, Qiangsheng"
          },
          {
            "@_fa": "true",
            "$": "Mao, Dongsen"
          },
          {
            "@_fa": "true",
            "$": "Yu, Jun"
          },
          {
            "@_fa": "true",
            "$": "Lu, Guanzhong"
          }
        ],
        "link": [
          {
            "@_fa": "true",
            "@rel": "self",
            "@href": "https://api.elsevier.com/content/article/pii/S1381116916304046"
          },
          {
            "@_fa": "true",
            "@rel": "scidir",
            "@href": "https://www.sciencedirect.com/science/article/pii/S1381116916304046"
          }
        ],
        "dc:format": "application/json",
        "openaccessType": null,
        "pii": "S1381-1169(16)30404-6",
        "prism:volume": "425",
        "prism:publisher": "Elsevier B.V.",
        "dc:title": "Methanol synthesis from CO2 hydrogenation over copper catalysts supported on MgO-modified TiO2",
        "prism:copyright": "© 2016 Elsevier B.V. All rights reserved.",
        "openaccess": "0",
        "prism:issn": "13811169",
        "dcterms:subject": [
          {
            "@_fa": "true",
            "$": "Methanol"
          },
          {
            "@_fa": "true",
            "$": "CO2 hydrogenation"
          },
          {
            "@_fa": "true",
            "$": "MgO-modified TiO2"
          },
          {
            "@_fa": "true",
            "$": "Cu surface area"
          },
          {
            "@_fa": "true",
            "$": "Reducibility"
          },
          {
            "@_fa": "true",
            "$": "Basicity"
          }
        ],
        "openaccessArticle": "false",
        "prism:publicationName": "Journal of Molecular Catalysis A: Chemical",
        "openaccessSponsorType": null,
        "prism:pageRange": "86-93",
        "prism:endingPage": "93",
        "pubType": "fla",
        "prism:coverDisplayDate": "15 December 2016",
        "prism:doi": "10.1016/j.molcata.2016.09.032",
        "prism:startingPage": "86",
        "dc:identifier": "doi:10.1016/j.molcata.2016.09.032",
        "openaccessSponsorName": null
      },
      "objects": {
        "object": [
          {
            "@category": "thumbnail",
            "@height": "88",
            "@width": "219",
            "@_fa": "true",
            "$": "https://api.elsevier.com/content/object/eid/1-s2.0-S1381116916304046-fx1.sml?httpAccept=%2A%2F%2A",
            "@multimediatype": "GIF image file",
            "@type": "IMAGE-THUMBNAIL",
            "@size": "3500",
            "@ref": "fx1",
            "@mimetype": "image/gif"
          },
          {
            "@category": "thumbnail",
            "@height": "163",
            "@width": "93",
            "@_fa": "true",
            "$": "https://api.elsevier.com/content/object/eid/1-s2.0-S1381116916304046-gr1.sml?httpAccept=%2A%2F%2A",
            "@multimediatype": "GIF image file",
            "@type": "IMAGE-THUMBNAIL",
            "@size": "4602",
            "@ref": "gr1",
            "@mimetype": "image/gif"
          },
          {
            "@category": "thumbnail",
            "@height": "120",
            "@width": "219",
            "@_fa": "true",
            "$": "https://api.elsevier.com/content/object/eid/1-s2.0-S1381116916304046-gr2.sml?httpAccept=%2A%2F%2A",
            "@multimediatype": "GIF image file",
            "@type": "IMAGE-THUMBNAIL",
            "@size": "6427",
            "@ref": "gr2",
            "@mimetype": "image/gif"
          },
          {
            "@category": "thumbnail",
            "@height": "120",
            "@width": "219",
            "@_fa": "true",
            "$": "https://api.elsevier.com/content/object/eid/1-s2.0-S1381116916304046-gr3.sml?httpAccept=%2A%2F%2A",
            "@multimediatype": "GIF image file",
            "@type": "IMAGE-THUMBNAIL",
            "@size": "6051",
            "@ref": "gr3",
            "@mimetype": "image/gif"
          },
          {
            "@category": "thumbnail",
            "@height": "164",
            "@width": "210",
            "@_fa": "true",
            "$": "https://api.elsevier.com/content/object/eid/1-s2.0-S1381116916304046-gr4.sml?httpAccept=%2A%2F%2A",
            "@multimediatype": "GIF image file",
            "@type": "IMAGE-THUMBNAIL",
            "@size": "7856",
            "@ref": "gr4",
            "@mimetype": "image/gif"
          },
          {
            "@category": "thumbnail",
            "@height": "164",
            "@width": "206",
            "@_fa": "true",
            "$": "https://api.elsevier.com/content/object/eid/1-s2.0-S1381116916304046-gr5.sml?httpAccept=%2A%2F%2A",
            "@multimediatype": "GIF image file",
            "@type": "IMAGE-THUMBNAIL",
            "@size": "8044",
            "@ref": "gr5",
            "@mimetype": "image/gif"
          },
          {
            "@category": "thumbnail",
            "@height": "164",
            "@width": "205",
            "@_fa": "true",
            "$": "https://api.elsevier.com/content/object/eid/1-s2.0-S1381116916304046-gr6.sml?httpAccept=%2A%2F%2A",
            "@multimediatype": "GIF image file",
            "@type": "IMAGE-THUMBNAIL",
            "@size": "4571",
            "@ref": "gr6",
            "@mimetype": "image/gif"
          },
          {
            "@category": "thumbnail",
            "@height": "164",
            "@width": "216",
            "@_fa": "true",
            "$": "https://api.elsevier.com/content/object/eid/1-s2.0-S1381116916304046-gr7.sml?httpAccept=%2A%2F%2A",
            "@multimediatype": "GIF image file",
            "@type": "IMAGE-THUMBNAIL",
            "@size": "6163",
            "@ref": "gr7",
            "@mimetype": "image/gif"
          },
          {
            "@category": "standard",
            "@height": "200",
            "@width": "500",
            "@_fa": "true",
            "$": "https://api.elsevier.com/content/object/eid/1-s2.0-S1381116916304046-fx1.jpg?httpAccept=%2A%2F%2A",
            "@multimediatype": "JPEG image file",
            "@type": "IMAGE-DOWNSAMPLED",
            "@size": "15621",
            "@ref": "fx1",
            "@mimetype": "image/jpeg"
          },
          {
            "@category": "standard",
            "@height": "615",
            "@width": "351",
            "@_fa": "true",
            "$": "https://api.elsevier.com/content/object/eid/1-s2.0-S1381116916304046-gr1.jpg?httpAccept=%2A%2F%2A",
            "@multimediatype": "JPEG image file",
            "@type": "IMAGE-DOWNSAMPLED",
            "@size": "54721",
            "@ref": "gr1",
            "@mimetype": "image/jpeg"
          },
          {
            "@category": "standard",
            "@height": "272",
            "@width": "497",
            "@_fa": "true",
            "$": "https://api.elsevier.com/content/object/eid/1-s2.0-S1381116916304046-gr2.jpg?httpAccept=%2A%2F%2A",
            "@multimediatype": "JPEG image file",
            "@type": "IMAGE-DOWNSAMPLED",
            "@size": "33899",
            "@ref": "gr2",
            "@mimetype": "image/jpeg"
          },
          {
            "@category": "standard",
            "@height": "281",
            "@width": "513",
            "@_fa": "true",
            "$": "https://api.elsevier.com/content/object/eid/1-s2.0-S1381116916304046-gr3.jpg?httpAccept=%2A%2F%2A",
            "@multimediatype": "JPEG image file",
            "@type": "IMAGE-DOWNSAMPLED",
            "@size": "33567",
            "@ref": "gr3",
            "@mimetype": "image/jpeg"
          },
          {
            "@category": "standard",
            "@height": "265",
            "@width": "339",
            "@_fa": "true",
            "$": "https://api.elsevier.com/content/object/eid/1-s2.0-S1381116916304046-gr4.jpg?httpAccept=%2A%2F%2A",
            "@multimediatype": "JPEG image file",
            "@type": "IMAGE-DOWNSAMPLED",
            "@size": "24548",
            "@ref": "gr4",
            "@mimetype": "image/jpeg"
          },
          {
            "@category": "standard",
            "@height": "269",
            "@width": "339",
            "@_fa": "true",
            "$": "https://api.elsevier.com/content/object/eid/1-s2.0-S1381116916304046-gr5.jpg?httpAccept=%2A%2F%2A",
            "@multimediatype": "JPEG image file",
            "@type": "IMAGE-DOWNSAMPLED",
            "@size": "27043",
            "@ref": "gr5",
            "@mimetype": "image/jpeg"
          },
          {
            "@category": "standard",
            "@height": "271",
            "@width": "339",
            "@_fa": "true",
            "$": "https://api.elsevier.com/content/object/eid/1-s2.0-S1381116916304046-gr6.jpg?httpAccept=%2A%2F%2A",
            "@multimediatype": "JPEG image file",
            "@type": "IMAGE-DOWNSAMPLED",
            "@size": "13867",
            "@ref": "gr6",
            "@mimetype": "image/jpeg"
          },
          {
            "@category": "standard",
            "@height": "257",
            "@width": "339",
            "@_fa": "true",
            "$": "https://api.elsevier.com/content/object/eid/1-s2.0-S1381116916304046-gr7.jpg?httpAccept=%2A%2F%2A",
            "@multimediatype": "JPEG image file",
            "@type": "IMAGE-DOWNSAMPLED",
            "@size": "18550",
            "@ref": "gr7",
            "@mimetype": "image/jpeg"
          },
          {
            "@category": "high",
            "@height": "886",
            "@width": "2213",
            "@_fa": "true",
            "$": "https://api.elsevier.com/content/object/eid/1-s2.0-S1381116916304046-fx1_lrg.jpg?httpAccept=%2A%2F%2A",
            "@multimediatype": "JPEG image file",
            "@type": "IMAGE-HIGH-RES",
            "@size": "108306",
            "@ref": "fx1",
            "@mimetype": "image/jpeg"
          },
          {
            "@category": "high",
            "@height": "2723",
            "@width": "1555",
            "@_fa": "true",
            "$": "https://api.elsevier.com/content/object/eid/1-s2.0-S1381116916304046-gr1_lrg.jpg?httpAccept=%2A%2F%2A",
            "@multimediatype": "JPEG image file",
            "@type": "IMAGE-HIGH-RES",
            "@size": "426420",
            "@ref": "gr1",
            "@mimetype": "image/jpeg"
          },
          {
            "@category": "high",
            "@height": "1207",
            "@width": "2202",
            "@_fa": "true",
            "$": "https://api.elsevier.com/content/object/eid/1-s2.0-S1381116916304046-gr2_lrg.jpg?httpAccept=%2A%2F%2A",
            "@multimediatype": "JPEG image file",
            "@type": "IMAGE-HIGH-RES",
            "@size": "242579",
            "@ref": "gr2",
            "@mimetype": "image/jpeg"
          },
          {
            "@category": "high",
            "@height": "1246",
            "@width": "2273",
            "@_fa": "true",
            "$": "https://api.elsevier.com/content/object/eid/1-s2.0-S1381116916304046-gr3_lrg.jpg?httpAccept=%2A%2F%2A",
            "@multimediatype": "JPEG image file",
            "@type": "IMAGE-HIGH-RES",
            "@size": "259454",
            "@ref": "gr3",
            "@mimetype": "image/jpeg"
          },
          {
            "@category": "high",
            "@height": "1173",
            "@width": "1500",
            "@_fa": "true",
            "$": "https://api.elsevier.com/content/object/eid/1-s2.0-S1381116916304046-gr4_lrg.jpg?httpAccept=%2A%2F%2A",
            "@multimediatype": "JPEG image file",
            "@type": "IMAGE-HIGH-RES",
            "@size": "184737",
            "@ref": "gr4",
            "@mimetype": "image/jpeg"
          },
          {
            "@category": "high",
            "@height": "1191",
            "@width": "1500",
            "@_fa": "true",
            "$": "https://api.elsevier.com/content/object/eid/1-s2.0-S1381116916304046-gr5_lrg.jpg?httpAccept=%2A%2F%2A",
            "@multimediatype": "JPEG image file",
            "@type": "IMAGE-HIGH-RES",
            "@size": "200647",
            "@ref": "gr5",
            "@mimetype": "image/jpeg"
          },
          {
            "@category": "high",
            "@height": "1200",
            "@width": "1500",
            "@_fa": "true",
            "$": "https://api.elsevier.com/content/object/eid/1-s2.0-S1381116916304046-gr6_lrg.jpg?httpAccept=%2A%2F%2A",
            "@multimediatype": "JPEG image file",
            "@type": "IMAGE-HIGH-RES",
            "@size": "95309",
            "@ref": "gr6",
            "@mimetype": "image/jpeg"
          },
          {
            "@category": "high",
            "@height": "1138",
            "@width": "1500",
            "@_fa": "true",
            "$": "https://api.elsevier.com/content/object/eid/1-s2.0-S1381116916304046-gr7_lrg.jpg?httpAccept=%2A%2F%2A",
            "@multimediatype": "JPEG image file",
            "@type": "IMAGE-HIGH-RES",
            "@size": "128905",
            "@ref": "gr7",
            "@mimetype": "image/jpeg"
          },
          {
            "@category": "thumbnail",
            "@height": "23",
            "@width": "293",
            "@_fa": "true",
            "$": "https://api.elsevier.com/content/object/eid/1-s2.0-S1381116916304046-si1.gif?httpAccept=%2A%2F%2A",
            "@multimediatype": "GIF image file",
            "@type": "ALTIMG",
            "@size": "1193",
            "@ref": "si1",
            "@mimetype": "image/gif"
          },
          {
            "@category": "thumbnail",
            "@height": "23",
            "@width": "186",
            "@_fa": "true",
            "$": "https://api.elsevier.com/content/object/eid/1-s2.0-S1381116916304046-si2.gif?httpAccept=%2A%2F%2A",
            "@multimediatype": "GIF image file",
            "@type": "ALTIMG",
            "@size": "804",
            "@ref": "si2",
            "@mimetype": "image/gif"
          },
          {
            "@category": "thumbnail",
            "@height": "16",
            "@width": "148",
            "@_fa": "true",
            "$": "https://api.elsevier.com/content/object/eid/1-s2.0-S1381116916304046-si3.gif?httpAccept=%2A%2F%2A",
            "@multimediatype": "GIF image file",
            "@type": "ALTIMG",
            "@size": "575",
            "@ref": "si3",
            "@mimetype": "image/gif"
          }
        ]
      },
      "link": {
        "@rel": "abstract",
        "@href": "https://api.elsevier.com/content/abstract/scopus_id/84988944598"
      }
    }
  }
}