{
  "metadata": {
    "title": "Gold nanoparticles dispersed into poly(aminothiophenol) as a novel electrocatalyst—Fabrication of modified electrode and evaluation of electrocatalytic activities for dioxygen reduction",
    "authors": "; ; ",
    "journal": "Journal of Molecular Catalysis A: Chemical",
    "date": "2006-08-18",
    "doi": "10.1016/j.molcata.2006.05.027",
    "abstract": "",
    "uri": "https://api.elsevier.com/content/article/pii/S1381116906008247",
    "pii": "S1381116906008247"
  },
  "fulltext": {
    "full-text-retrieval-response": {
      "scopus-eid": "2-s2.0-33747369685",
      "originalText": "serial JL 271358 291210 291744 291790 291809 31 Journal of Molecular Catalysis A: Chemical JOURNALMOLECULARCATALYSISACHEMICAL 2006-06-14 2006-06-14 2010-03-29T20:21:43 1-s2.0-S1381116906008247 S1381-1169(06)00824-7 S1381116906008247 10.1016/j.molcata.2006.05.027 S300 S300.1 FULL-TEXT 1-s2.0-S1381116906X02376 2015-05-15T05:56:33.323092-04:00 0 0 20060818 2006 2006-06-14T00:00:00Z articleinfo crossmark dco dateupdated tomb dateloaded datesearch indexeddate issuelist volumelist yearnav absattachment articletitlenorm authfirstinitialnorm authfirstsurnamenorm cid cids contenttype copyright dateloadedtxt docsubtype doctype doi eid ewtransactionid hubeid issfirst issn issnnorm itemstage itemtransactionid itemweight openaccess openarchive pg pgfirst pglast pii piinorm pubdatestart pubdatetxt pubyr sortorder srctitle srctitlenorm srctype subheadings volfirst volissue webpdf webpdfpagecount figure table body mmlmath acknowledge affil articletitle auth authfirstini authfull authkeywords authlast primabst ref specialabst alllist content subj ssids 1381-1169 13811169 256 256 1 2 1 2 Volume 256, Issues 1–2 52 335 345 335 345 20060818 18 August 2006 2006-08-18 2006 article fla Copyright © 2006 Elsevier B.V. All rights reserved. GOLDNANOPARTICLESDISPERSEDPOLYAMINOTHIOPHENOLANOVELELECTROCATALYSTFABRICATIONMODIFIEDELECTRODEEVALUATIONELECTROCATALYTICACTIVITIESFORDIOXYGENREDUCTION GOPALAN A 1 Introduction 2 Experimental 2.1 Materials 2.2 Formation of inclusion complex 2.3 Fabrication of PATP-Aunano catalyst 2.4 Characterization 2.5 Electrochemical measurements 3 Results and discussion 3.1 Fabrication of PATP-Aunano catalyst electrode 3.2 Electrocatalytic reduction of dioxygen on the PATP-Aunano 3.3 Chronoamperometry 3.4 RDE and RRDE experiments 3.5 Stability of PATP-Aunano catalysts 4 Conclusions Acknowledgments References SHEENEYHAJICHIA 2002 27 L HEPEL 1998 124 M KULESZA 2004 4128 P TIAN 2004 4103 S YISSAR 2002 670 V ZHANG 2003 6748 L MASCARO 2004 243 L SANTHOSH 2006 177 P VALDEN 1998 1647 M BROWN 2001 8911 L WHETTEN 1996 428 R BRUST 1994 801 M ELDEAB 2002 288 M ELDEAB 2002 4255 M SCHIMPF 2002 63 S HARUTA 1997 153 M DEKANSKI 2001 1195 A MARTEL 2000 1829 D SARAPUU 2001 446 A SCHULZ 2002 3757 J CHERSTIOUK 2003 3851 O LIU 2002 6059 S MATSUI 2004 1310 J FORZANI 2004 1785 E OSAKA 1989 306 T PAUL 1985 1441 E BREIMER 2001 305 M SASTRY 2000 1089 M ZAMBORINI 2000 4514 F MAMEDOV 2000 3941 A SCHMITT 1997 61 J SARATHY 1999 399 K HARADA 1992 325 A FINOT 1999 234 M OKAMURA 2005 9897 M LU 2005 175 G MICHRI 1972 351 A TRASATTI 1991 711 S KOZLOWSKA 1987 429 H HUANG 2005 15 M BADIA 1997 11104 A JANA 2003 14280 N HOSTETLER 1998 17 M HAYES 1996 3688 W YE 2003 272 S BARD 2001 A ELECTROCHEMICALMETHODSFUNDAMENTALSAPPLICATIONS SALIMI 1991 114 A YASSAR 1998 53 A GALUS 1976 Z FUNDAMENTALSELECTROCHEMICALANALYSIS KOMANICKY 2005 23550 V 2004 CRCHANDBOOKCHEMISTRYPHYSICS BARD 1980 A ELECTROCHEMICALMETHODSFUNDAMENTALSAPPLICATIONS TAMMEVESKI 1999 669 K ANASTASIJEVIC 1986 1125 N HAMANN 1998 C ELECTROCHEMISTRY ELDEAB 2005 29 M HERNANDEZ 2004 185 J LIU 2000 87 S JAKOBS 1985 1085 R GOPALANX2006X335 GOPALANX2006X335X345 GOPALANX2006X335XA GOPALANX2006X335X345XA item S1381-1169(06)00824-7 S1381116906008247 1-s2.0-S1381116906008247 10.1016/j.molcata.2006.05.027 271358 2010-10-08T06:20:36.750404-04:00 2006-08-18 1-s2.0-S1381116906008247-main.pdf https://s3.amazonaws.com/prod-ucs-content-store-us-east/content/pii:S1381116906008247/MAIN/application/pdf/ca64c233a5e54d245698e6189950cd94/main.pdf https://s3-eu-west-1.amazonaws.com/prod-ucs-content-store-eu-west/content/pii:S1381116906008247/MAIN/application/pdf/ca64c233a5e54d245698e6189950cd94/main.pdf main.pdf pdf true 713158 MAIN 11 1-s2.0-S1381116906008247-main_1.png https://s3.amazonaws.com/prod-ucs-content-store-us-east/content/pii:S1381116906008247/PREVIEW/image/png/ef787e96a2c58272b99f2a4375a59b23/main_1.png https://s3-eu-west-1.amazonaws.com/prod-ucs-content-store-eu-west/content/pii:S1381116906008247/PREVIEW/image/png/ef787e96a2c58272b99f2a4375a59b23/main_1.png main_1.png png 70693 849 656 IMAGE-WEB-PDF 1 1-s2.0-S1381116906008247-si9.gif https://s3.amazonaws.com/prod-ucs-content-store-us-east/content/pii:S1381116906008247/STRIPIN/image/gif/d4f9184a303425c83ca3172685265399/si9.gif https://s3-eu-west-1.amazonaws.com/prod-ucs-content-store-eu-west/content/pii:S1381116906008247/STRIPIN/image/gif/d4f9184a303425c83ca3172685265399/si9.gif si9 si9.gif gif 199 15 28 ALTIMG 1-s2.0-S1381116906008247-si8.gif https://s3.amazonaws.com/prod-ucs-content-store-us-east/content/pii:S1381116906008247/STRIPIN/image/gif/824a2f148909584afee884753aef2b89/si8.gif https://s3-eu-west-1.amazonaws.com/prod-ucs-content-store-eu-west/content/pii:S1381116906008247/STRIPIN/image/gif/824a2f148909584afee884753aef2b89/si8.gif si8 si8.gif gif 843 20 203 ALTIMG 1-s2.0-S1381116906008247-si7.gif https://s3.amazonaws.com/prod-ucs-content-store-us-east/content/pii:S1381116906008247/STRIPIN/image/gif/8b09dc20e297459ccf37c496fec2ef14/si7.gif https://s3-eu-west-1.amazonaws.com/prod-ucs-content-store-eu-west/content/pii:S1381116906008247/STRIPIN/image/gif/8b09dc20e297459ccf37c496fec2ef14/si7.gif si7 si7.gif gif 436 16 99 ALTIMG 1-s2.0-S1381116906008247-si6.gif https://s3.amazonaws.com/prod-ucs-content-store-us-east/content/pii:S1381116906008247/STRIPIN/image/gif/9ed4d65920dd93491c9fdced4c6b6b1a/si6.gif https://s3-eu-west-1.amazonaws.com/prod-ucs-content-store-eu-west/content/pii:S1381116906008247/STRIPIN/image/gif/9ed4d65920dd93491c9fdced4c6b6b1a/si6.gif si6 si6.gif gif 549 37 114 ALTIMG 1-s2.0-S1381116906008247-si5.gif https://s3.amazonaws.com/prod-ucs-content-store-us-east/content/pii:S1381116906008247/STRIPIN/image/gif/e08b17be5586d1d4da2a0206a4dceda3/si5.gif https://s3-eu-west-1.amazonaws.com/prod-ucs-content-store-eu-west/content/pii:S1381116906008247/STRIPIN/image/gif/e08b17be5586d1d4da2a0206a4dceda3/si5.gif si5 si5.gif gif 810 36 212 ALTIMG 1-s2.0-S1381116906008247-si4.gif https://s3.amazonaws.com/prod-ucs-content-store-us-east/content/pii:S1381116906008247/STRIPIN/image/gif/67d18adb6e39ef3ef3081f18dc4f4b90/si4.gif https://s3-eu-west-1.amazonaws.com/prod-ucs-content-store-eu-west/content/pii:S1381116906008247/STRIPIN/image/gif/67d18adb6e39ef3ef3081f18dc4f4b90/si4.gif si4 si4.gif gif 1182 39 258 ALTIMG 1-s2.0-S1381116906008247-si3.gif https://s3.amazonaws.com/prod-ucs-content-store-us-east/content/pii:S1381116906008247/STRIPIN/image/gif/7b4e4b0ab7203093704c50749f1b3869/si3.gif https://s3-eu-west-1.amazonaws.com/prod-ucs-content-store-eu-west/content/pii:S1381116906008247/STRIPIN/image/gif/7b4e4b0ab7203093704c50749f1b3869/si3.gif si3 si3.gif gif 580 30 148 ALTIMG 1-s2.0-S1381116906008247-si2.gif https://s3.amazonaws.com/prod-ucs-content-store-us-east/content/pii:S1381116906008247/STRIPIN/image/gif/99af30382276d88ac781b1be5defebc1/si2.gif https://s3-eu-west-1.amazonaws.com/prod-ucs-content-store-eu-west/content/pii:S1381116906008247/STRIPIN/image/gif/99af30382276d88ac781b1be5defebc1/si2.gif si2 si2.gif gif 439 37 67 ALTIMG 1-s2.0-S1381116906008247-si11.gif https://s3.amazonaws.com/prod-ucs-content-store-us-east/content/pii:S1381116906008247/STRIPIN/image/gif/eaea60ef7f689bbf2bab868a7d93ddcd/si11.gif https://s3-eu-west-1.amazonaws.com/prod-ucs-content-store-eu-west/content/pii:S1381116906008247/STRIPIN/image/gif/eaea60ef7f689bbf2bab868a7d93ddcd/si11.gif si11 si11.gif gif 969 37 157 ALTIMG 1-s2.0-S1381116906008247-si10.gif https://s3.amazonaws.com/prod-ucs-content-store-us-east/content/pii:S1381116906008247/STRIPIN/image/gif/6420c10ddbf6da0196b6c0725bc6c013/si10.gif https://s3-eu-west-1.amazonaws.com/prod-ucs-content-store-eu-west/content/pii:S1381116906008247/STRIPIN/image/gif/6420c10ddbf6da0196b6c0725bc6c013/si10.gif si10 si10.gif gif 185 15 26 ALTIMG 1-s2.0-S1381116906008247-si1.gif https://s3.amazonaws.com/prod-ucs-content-store-us-east/content/pii:S1381116906008247/STRIPIN/image/gif/4d46c307fefa6fb9b0698a69f08f40af/si1.gif https://s3-eu-west-1.amazonaws.com/prod-ucs-content-store-eu-west/content/pii:S1381116906008247/STRIPIN/image/gif/4d46c307fefa6fb9b0698a69f08f40af/si1.gif si1 si1.gif gif 594 39 86 ALTIMG 1-s2.0-S1381116906008247-gr3.jpg https://s3.amazonaws.com/prod-ucs-content-store-us-east/content/pii:S1381116906008247/gr3/DOWNSAMPLED/image/jpeg/429106c91dfffd5582df5d187ee63db9/gr3.jpg https://s3-eu-west-1.amazonaws.com/prod-ucs-content-store-eu-west/content/pii:S1381116906008247/gr3/DOWNSAMPLED/image/jpeg/429106c91dfffd5582df5d187ee63db9/gr3.jpg gr3 gr3.jpg jpg 62314 452 486 IMAGE-DOWNSAMPLED 1-s2.0-S1381116906008247-gr3.sml https://s3.amazonaws.com/prod-ucs-content-store-us-east/content/pii:S1381116906008247/gr3/THUMBNAIL/image/gif/e63f948a5bd6a4da281fae241f42a1a5/gr3.sml https://s3-eu-west-1.amazonaws.com/prod-ucs-content-store-eu-west/content/pii:S1381116906008247/gr3/THUMBNAIL/image/gif/e63f948a5bd6a4da281fae241f42a1a5/gr3.sml gr3 gr3.sml sml 1581 93 100 IMAGE-THUMBNAIL 1-s2.0-S1381116906008247-gr7.jpg https://s3.amazonaws.com/prod-ucs-content-store-us-east/content/pii:S1381116906008247/gr7/DOWNSAMPLED/image/jpeg/2604d9a4ba47b1a587ac7806cd8c8ad3/gr7.jpg https://s3-eu-west-1.amazonaws.com/prod-ucs-content-store-eu-west/content/pii:S1381116906008247/gr7/DOWNSAMPLED/image/jpeg/2604d9a4ba47b1a587ac7806cd8c8ad3/gr7.jpg gr7 gr7.jpg jpg 38241 358 363 IMAGE-DOWNSAMPLED 1-s2.0-S1381116906008247-gr7.sml https://s3.amazonaws.com/prod-ucs-content-store-us-east/content/pii:S1381116906008247/gr7/THUMBNAIL/image/gif/6b544b0fde92be0915ba39c42e910012/gr7.sml https://s3-eu-west-1.amazonaws.com/prod-ucs-content-store-eu-west/content/pii:S1381116906008247/gr7/THUMBNAIL/image/gif/6b544b0fde92be0915ba39c42e910012/gr7.sml gr7 gr7.sml sml 1570 93 94 IMAGE-THUMBNAIL 1-s2.0-S1381116906008247-gr2.jpg https://s3.amazonaws.com/prod-ucs-content-store-us-east/content/pii:S1381116906008247/gr2/DOWNSAMPLED/image/jpeg/545eb4fa034be52add7c351a6eb2cf4a/gr2.jpg https://s3-eu-west-1.amazonaws.com/prod-ucs-content-store-eu-west/content/pii:S1381116906008247/gr2/DOWNSAMPLED/image/jpeg/545eb4fa034be52add7c351a6eb2cf4a/gr2.jpg gr2 gr2.jpg jpg 64552 234 565 IMAGE-DOWNSAMPLED 1-s2.0-S1381116906008247-gr2.sml https://s3.amazonaws.com/prod-ucs-content-store-us-east/content/pii:S1381116906008247/gr2/THUMBNAIL/image/gif/910c80bba88723a5a08c6c9392dd3897/gr2.sml https://s3-eu-west-1.amazonaws.com/prod-ucs-content-store-eu-west/content/pii:S1381116906008247/gr2/THUMBNAIL/image/gif/910c80bba88723a5a08c6c9392dd3897/gr2.sml gr2 gr2.sml sml 3101 52 125 IMAGE-THUMBNAIL 1-s2.0-S1381116906008247-gr1.jpg https://s3.amazonaws.com/prod-ucs-content-store-us-east/content/pii:S1381116906008247/gr1/DOWNSAMPLED/image/jpeg/512dcb4b865381d11f65ba3a92316cfb/gr1.jpg https://s3-eu-west-1.amazonaws.com/prod-ucs-content-store-eu-west/content/pii:S1381116906008247/gr1/DOWNSAMPLED/image/jpeg/512dcb4b865381d11f65ba3a92316cfb/gr1.jpg gr1 gr1.jpg jpg 35855 343 365 IMAGE-DOWNSAMPLED 1-s2.0-S1381116906008247-gr1.sml https://s3.amazonaws.com/prod-ucs-content-store-us-east/content/pii:S1381116906008247/gr1/THUMBNAIL/image/gif/90f334faebc5d54be83706504ab9fc8d/gr1.sml https://s3-eu-west-1.amazonaws.com/prod-ucs-content-store-eu-west/content/pii:S1381116906008247/gr1/THUMBNAIL/image/gif/90f334faebc5d54be83706504ab9fc8d/gr1.sml gr1 gr1.sml sml 1780 93 99 IMAGE-THUMBNAIL 1-s2.0-S1381116906008247-gr5.jpg https://s3.amazonaws.com/prod-ucs-content-store-us-east/content/pii:S1381116906008247/gr5/DOWNSAMPLED/image/jpeg/526e91e281d94ebbd30dedd74543e7fe/gr5.jpg https://s3-eu-west-1.amazonaws.com/prod-ucs-content-store-eu-west/content/pii:S1381116906008247/gr5/DOWNSAMPLED/image/jpeg/526e91e281d94ebbd30dedd74543e7fe/gr5.jpg gr5 gr5.jpg jpg 74565 668 361 IMAGE-DOWNSAMPLED 1-s2.0-S1381116906008247-gr5.sml https://s3.amazonaws.com/prod-ucs-content-store-us-east/content/pii:S1381116906008247/gr5/THUMBNAIL/image/gif/18538c20f36aaacb6dbedc1e7c14937b/gr5.sml https://s3-eu-west-1.amazonaws.com/prod-ucs-content-store-eu-west/content/pii:S1381116906008247/gr5/THUMBNAIL/image/gif/18538c20f36aaacb6dbedc1e7c14937b/gr5.sml gr5 gr5.sml sml 1032 92 50 IMAGE-THUMBNAIL 1-s2.0-S1381116906008247-gr9.jpg https://s3.amazonaws.com/prod-ucs-content-store-us-east/content/pii:S1381116906008247/gr9/DOWNSAMPLED/image/jpeg/5250d4668e355f835f1f797917008d58/gr9.jpg https://s3-eu-west-1.amazonaws.com/prod-ucs-content-store-eu-west/content/pii:S1381116906008247/gr9/DOWNSAMPLED/image/jpeg/5250d4668e355f835f1f797917008d58/gr9.jpg gr9 gr9.jpg jpg 47404 467 356 IMAGE-DOWNSAMPLED 1-s2.0-S1381116906008247-gr9.sml https://s3.amazonaws.com/prod-ucs-content-store-us-east/content/pii:S1381116906008247/gr9/THUMBNAIL/image/gif/5532604bf5c154e4fc5a7eb7d157b589/gr9.sml https://s3-eu-west-1.amazonaws.com/prod-ucs-content-store-eu-west/content/pii:S1381116906008247/gr9/THUMBNAIL/image/gif/5532604bf5c154e4fc5a7eb7d157b589/gr9.sml gr9 gr9.sml sml 1200 93 71 IMAGE-THUMBNAIL 1-s2.0-S1381116906008247-sc1.jpg https://s3.amazonaws.com/prod-ucs-content-store-us-east/content/pii:S1381116906008247/sc1/DOWNSAMPLED/image/jpeg/7e1eef9e3dfadc1465ac455886bd17bb/sc1.jpg https://s3-eu-west-1.amazonaws.com/prod-ucs-content-store-eu-west/content/pii:S1381116906008247/sc1/DOWNSAMPLED/image/jpeg/7e1eef9e3dfadc1465ac455886bd17bb/sc1.jpg sc1 sc1.jpg jpg 129616 758 565 IMAGE-DOWNSAMPLED 1-s2.0-S1381116906008247-sc1.sml https://s3.amazonaws.com/prod-ucs-content-store-us-east/content/pii:S1381116906008247/sc1/THUMBNAIL/image/gif/5ddfefe4b6cf964ca3e77760b646dd66/sc1.sml https://s3-eu-west-1.amazonaws.com/prod-ucs-content-store-eu-west/content/pii:S1381116906008247/sc1/THUMBNAIL/image/gif/5ddfefe4b6cf964ca3e77760b646dd66/sc1.sml sc1 sc1.sml sml 2532 93 69 IMAGE-THUMBNAIL 1-s2.0-S1381116906008247-gr10.jpg https://s3.amazonaws.com/prod-ucs-content-store-us-east/content/pii:S1381116906008247/gr10/DOWNSAMPLED/image/jpeg/73aef46f4a06b95c2d215699c28091b1/gr10.jpg https://s3-eu-west-1.amazonaws.com/prod-ucs-content-store-eu-west/content/pii:S1381116906008247/gr10/DOWNSAMPLED/image/jpeg/73aef46f4a06b95c2d215699c28091b1/gr10.jpg gr10 gr10.jpg jpg 34992 356 357 IMAGE-DOWNSAMPLED 1-s2.0-S1381116906008247-gr10.sml https://s3.amazonaws.com/prod-ucs-content-store-us-east/content/pii:S1381116906008247/gr10/THUMBNAIL/image/gif/bf5377f3e37a292c8f83e211af6284cc/gr10.sml https://s3-eu-west-1.amazonaws.com/prod-ucs-content-store-eu-west/content/pii:S1381116906008247/gr10/THUMBNAIL/image/gif/bf5377f3e37a292c8f83e211af6284cc/gr10.sml gr10 gr10.sml sml 1369 93 93 IMAGE-THUMBNAIL 1-s2.0-S1381116906008247-gr6.jpg https://s3.amazonaws.com/prod-ucs-content-store-us-east/content/pii:S1381116906008247/gr6/DOWNSAMPLED/image/jpeg/30b519744be49fa616773a97d6d488f3/gr6.jpg https://s3-eu-west-1.amazonaws.com/prod-ucs-content-store-eu-west/content/pii:S1381116906008247/gr6/DOWNSAMPLED/image/jpeg/30b519744be49fa616773a97d6d488f3/gr6.jpg gr6 gr6.jpg jpg 68368 664 366 IMAGE-DOWNSAMPLED 1-s2.0-S1381116906008247-gr6.sml https://s3.amazonaws.com/prod-ucs-content-store-us-east/content/pii:S1381116906008247/gr6/THUMBNAIL/image/gif/3956cad98492064ae56ffe74939c19bb/gr6.sml https://s3-eu-west-1.amazonaws.com/prod-ucs-content-store-eu-west/content/pii:S1381116906008247/gr6/THUMBNAIL/image/gif/3956cad98492064ae56ffe74939c19bb/gr6.sml gr6 gr6.sml sml 1031 93 51 IMAGE-THUMBNAIL 1-s2.0-S1381116906008247-gr4.jpg https://s3.amazonaws.com/prod-ucs-content-store-us-east/content/pii:S1381116906008247/gr4/DOWNSAMPLED/image/jpeg/ad5891292d4b01d500452482bbc25e09/gr4.jpg https://s3-eu-west-1.amazonaws.com/prod-ucs-content-store-eu-west/content/pii:S1381116906008247/gr4/DOWNSAMPLED/image/jpeg/ad5891292d4b01d500452482bbc25e09/gr4.jpg gr4 gr4.jpg jpg 34144 349 359 IMAGE-DOWNSAMPLED 1-s2.0-S1381116906008247-gr4.sml https://s3.amazonaws.com/prod-ucs-content-store-us-east/content/pii:S1381116906008247/gr4/THUMBNAIL/image/gif/5588c11dc90f23c5a5f6a81bf2833f6d/gr4.sml https://s3-eu-west-1.amazonaws.com/prod-ucs-content-store-eu-west/content/pii:S1381116906008247/gr4/THUMBNAIL/image/gif/5588c11dc90f23c5a5f6a81bf2833f6d/gr4.sml gr4 gr4.sml sml 1533 93 96 IMAGE-THUMBNAIL 1-s2.0-S1381116906008247-gr8.jpg https://s3.amazonaws.com/prod-ucs-content-store-us-east/content/pii:S1381116906008247/gr8/DOWNSAMPLED/image/jpeg/c2be8c3a3ba3689bf4765a6bf03c38b5/gr8.jpg https://s3-eu-west-1.amazonaws.com/prod-ucs-content-store-eu-west/content/pii:S1381116906008247/gr8/DOWNSAMPLED/image/jpeg/c2be8c3a3ba3689bf4765a6bf03c38b5/gr8.jpg gr8 gr8.jpg jpg 40207 354 356 IMAGE-DOWNSAMPLED 1-s2.0-S1381116906008247-gr8.sml https://s3.amazonaws.com/prod-ucs-content-store-us-east/content/pii:S1381116906008247/gr8/THUMBNAIL/image/gif/bd217839a9b3c013ee78dc2f1e5cbf96/gr8.sml https://s3-eu-west-1.amazonaws.com/prod-ucs-content-store-eu-west/content/pii:S1381116906008247/gr8/THUMBNAIL/image/gif/bd217839a9b3c013ee78dc2f1e5cbf96/gr8.sml gr8 gr8.sml sml 1835 94 94 IMAGE-THUMBNAIL 1-s2.0-S1381116906008247-fx1.jpg https://s3.amazonaws.com/prod-ucs-content-store-us-east/content/pii:S1381116906008247/fx1/DOWNSAMPLED/image/jpeg/7e02c87538913a66c9ab06cf59ed43ba/fx1.jpg https://s3-eu-west-1.amazonaws.com/prod-ucs-content-store-eu-west/content/pii:S1381116906008247/fx1/DOWNSAMPLED/image/jpeg/7e02c87538913a66c9ab06cf59ed43ba/fx1.jpg fx1 true fx1.jpg jpg 38724 237 242 IMAGE-DOWNSAMPLED 1-s2.0-S1381116906008247-fx1.sml https://s3.amazonaws.com/prod-ucs-content-store-us-east/content/pii:S1381116906008247/fx1/THUMBNAIL/image/gif/5e1b6d1a6300b6ecc73b08d5d9a1b4e6/fx1.sml https://s3-eu-west-1.amazonaws.com/prod-ucs-content-store-eu-west/content/pii:S1381116906008247/fx1/THUMBNAIL/image/gif/5e1b6d1a6300b6ecc73b08d5d9a1b4e6/fx1.sml fx1 true fx1.sml sml 3958 93 95 IMAGE-THUMBNAIL MOLCAA 6033 S1381-1169(06)00824-7 10.1016/j.molcata.2006.05.027 Elsevier B.V. Fig. 1 Cyclic voltammograms of CD-ATP-IC coated GC electrode in the 0.5M H2SO4 solution containing 2.0×10−4 M HAuCl4 (inset shows the first cycle); scan rate: 50mVs−1. Fig. 2 SPM images of GC/CD-ATP-IC (a) and PATP-Aunano catalyst (b). Fig. 3 XPS spectra of PATP-Aunano catalyst showing (a) the Au(4f 7/2) and Au(4f 5/2) double peaks and (b) S(2p) peak and (c) N(1s) peak. Fig. 4 CV response of PATP-Aunano in N2 saturated 0.5M H2SO4 electrolyte with different Au0 loadings (a) 32, (b) 55, and (c) 93μgcm−2. Fig. 5 Cyclic voltammograms of (A) PATP-Aunano and (B) bare GC electrodes in (i) O2 and (ii) Ar saturated 0.5M H2SO4 electrolyte, respectively; (C) CVs of PATP-Aunano catalyst with different Au0 loadings in O2 saturated 0.5M H2SO4 electrolyte; (a) 15, (b) 32, (c) 55, (d) 78 and (e) 93μgcm−2. Fig. 6 (a) Chronoamperograms obtained at PATP-Aunano for O2 saturated 0.5M H2SO4 electrolyte by the double potential-step technique with different amount of Au0 (i) 15, (ii) 32, (iii) 55, (iv) 78 and (v) 93μgcm−2 and (b) dependence of net current (I) on t 1/2 derived from the data of double potential chronoamperometry in the presence of O2. Fig. 7 j(E) polarization curves for PATP-Aunano in O2 saturated 0.5M H2SO4 electrolyte for different Au0 loadings in the presence of O2 (a) 15, (b) 32, (c) 55, (d) 78 and (e) 93μgcm−2 (ω: 800rpm; temperature=25°C; scan rate=1mVs−1). Fig. 8 j(E) polarization curves at different rotation rates ω recorded for PATP-Aunano in O2 saturated 0.5M H2SO4 electrolyte; (a) in the absence of O2 and (b–l) at different rotating rates in presence of O2; (b) 50, (c) 100, (d) 200, (e) 300, (f) 400, (g) 500, (h) 600, (i) 700, (j) 800, (k) 900, and (l) 1000rpm; (Au0: 78μgcm−2; temperature=25°C; scan rate=1mVs−1) (inset shows the Tafel plot). Fig. 9 (a) Levich plot and (b) Koutecky–Levich plot of the kinetic limiting currents of the voltammograms. The solid lines is from the experimental data and the dashed lines are from the calculated data considering the reduction of O2 by four and two electrons, respectively. Fig. 10 Current–potential curves for the O2 reduction in O2 saturated 0.5M H2SO4 electrolyte at PATP-Aunano modified GC rotating disk electrode (Au0: 78μgcm−2) and platinum ring electrode at ω =100rpm; E R =1.0V vs. SCE. Scheme 1 Fabrication of PATP-Aunano catalyst through a cyclic electrochemical process. (a) Formation of inclusion complex of β-cyclodextrin with 4-aminothiophenol and (b) electrochemical steps for the sequential formation of Au0 nanoparticles and poly(4-aminothiophenol) by cyclic voltammetry. Table 1 Physical characteristics of PATP-Aunano catalyst with different Au0 loadings Au loading (μgcm−2) a Real surface area of Au loading (cm−2) Rugosity factor Specific surface area (cm2 μg−1) Particle size (nm) 15 0.63 8.91 59.40 5 32 0.82 11.59 36.21 9 55 0.98 13.86 25.20 12 78 1.32 18.67 23.93 13 93 1.54 21.78 23.41 13 a As estimated from the charge consumed for the reduction peak of the surface oxide monolayer of Au0 nanoparticles, the peak at ∼920mV in Fig. 4 using a reported value of 400μCcm−2 [39–41]. Table 2 Kinetic parameters for the ORR on the PATP-Aunano electrode with different Au0 loadings Au loading (μgcm−2) Limiting current density (mA/cm−2) Tafel slope (mV/decade) Exchange current density (μA/cm−2) 15 1.9 120 2.86 32 2.1 112 3.45 55 3.8 116 4.89 78 4.5 128 6.87 93 7.2 135 9.24 Gold nanoparticles dispersed into poly(aminothiophenol) as a novel electrocatalyst—Fabrication of modified electrode and evaluation of electrocatalytic activities for dioxygen reduction Anantha Iyengar Gopalan a b c Kwang-Pill Lee a b ⁎ Kalayil Manian Manesh a Padmanaban Santhosh a Jun Heon Kim a b a Advanced Analytical Science and Nanomaterials Laboratory, Department of Chemistry Education, Kyungpook National University, Daegu 702-701, South Korea b Nano Practical Application Center, Daegu 704-230, South Korea c Department of Industrial Chemistry, Alagappa University, Karaikudi-630003, India ⁎ Corresponding author. Tel.: +82 539505901; fax: +82 539528104. Graphical abstract Gold nanoparticles were embedded into an electroactive polymer layer to modify the glassy carbon (GC) electrode and to fabricate a novel catalyst electrode. Cyclic voltammetry was performed to form poly(4-aminothiophenol), PATP and Au0 nanoparticles in the cyclic potential operation and to fabricate the newer catalyst electrode, PATP-Aunano. A more positive onset potential and higher catalytic current for oxygen reduction are striking features of the PATP-Aunano. The PATP-Aunano catalysts with different loadings of Au0 nanoparticles show promise for their use in fuel cells, O2 sensor, etc. Gold nanoparticles were embedded into an electroactive polymer layer to modify the glassy carbon (GC) electrode and to fabricate a novel catalyst electrode. Cyclic voltammetry was performed to form the electroactive polymer, poly(aminothiophenol), PATP and deposit the Au0 nanoparticles, simultaneously. 4-Aminothiophenol (ATP) was converted into an inclusion complex with β-cyclodextrin and used to form the electroactive layer on the surface of GC electrode. Au0 nanoparticles were incorporated into film of PATP simultaneously by the electrolysis of a solution of HAuCl4. Thus, newer catalyst electrode, PATP-Aunano, was fabricated. The scanning probe microscopic image of PATP-Aunano indicates the presence of uniformly distributed Au0 nanoparticles of the sizes ∼10nm. Electroactivity of PATP-Aunano for reduction of dioxygen (O2) was evaluated in O2 saturated solution. Cyclic voltammetry was used to demonstrate the enhanced electrocatalytic activity of the PATP-Aunano. A reduction peak at ∼430mV with an enhanced peak current was observed for the oxygen reduction reaction (ORR) in O2 saturated 0.5M sulfuric acid solution. A more positive onset potential and higher catalytic current for ORR are the striking features of PATP-Aunano catalyst. Double potential chronoamperometry, rotating disc (RDE) and rotating ring–disk electrode (RRDE) experiments were carried out to investigate the kinetic parameters of ORR on this electrode. Results from RDE and RRDE voltammetry experiments demonstrate that ORR on the PATP-Aunano is a four electron and diffusion controlled process with a catalytic rate constant of 3.65×103 M−1 s−1 and a diffusion coefficient of 7.82×10−5 cm2 s−1. Keywords Gold nanoparticles Electroactive film Glassy carbon electrode Oxygen reduction 1 Introduction Materials generated from the incorporation of metal (Au/Pt/Pd) nanoparticles into polymer matrix receive substantial research interest directed to the development of hybrid materials of new catalytic [1–3], electronic and optoelectronic [4,5] functionalities. Specifically, loading of metallic particles into the matrix of a conducting polymer such as polyaniline [4,6] receives interest due to the electronic interactions between nanoparticles and groups in the conducting polymer. As a result of molecular interactions, the electrocatalytic properties of nanoparticles are significantly improved [7]. Gold nanoparticles anchored into certain substrates show catalytic activity for many reactions [8,9]. In particular, Au nanoparticles protected via self-assembly in two- or three-dimensional lattices are showing promise for the construction of nanodevices and nanocircuits [10,11]. Since the report by Brust et al. [12], Au nanoclusters covered by self-assembled monolayers of alkanethiols have attracted the attention of many research groups. Au nanoparticles were also found to have enhanced electrocatalytic activities toward the electrochemical reduction of dioxygen (O2) in acidic media [13,14], catalytic hydrogenation of unsaturated alcohols and aldehydes [15] and low-temperature oxidation of carbon monoxide [16]. While hydrophilic substrates are ideally suited to anchor Au particles, carbon based substrates require sufficient modifications prior to loading of Au nanoparticles. However, the process is tedious and involves multiple steps. Glassy carbon (GC) electrodes are characterized by their high chemical inertness as well as low oxidation rate in addition to low gas and liquid permeability [17]. These properties render GC electrode a suitable base for the loading of various metal particles or polymer thin films. Such modified catalyst electrodes are expected to have improved electrocatalytic activity toward several electrochemical applications [18,19] in comparison to the bulk electrode. However, it is difficult to deposit metal nanoparticles directly onto the GC electrode due to its hydrophobic nature. Hence, an additional procedure is required to immobilize nanocatalysts into these type of substrates to form one-dimensional (1D) or two-dimensional (2D) nanostructures [20]. Au nanoparticles deposited onto the solid supports exhibit useful catalytic and electrocatalytic properties. Moreover, the catalytic activity of Au nanoparticles significantly depends on the sizes [21]. Recently, many studies related to size control of Au nanoparticles, their composition, and their self-assembly or self-organization into 2D and 3D structures have been reported [22,23]. Conducting polymers are known to have wide variety of applications like sensors [24], cathode material of a lithium secondary battery [25], electrocatalysts [26], microelectronic devices [27], etc., due to their interesting electrochemical properties. The porous structure of the conducting polymer allows to disperse the catalyst particles into the polymer matrix and generate new catalytic and electrocatalytic sites [28,29]. Conducting polymers with dispersed metal nanoparticles have shown properties of the individual components with a synergistic effect. Various approaches have been developed for the fabrication of electrocatalysts in the form of films [30]. Layer-by-layer methods are adopted extensively, which involve covalent bonding [31], electrostatics [32,33] and ligand–metal ion–ligand bridges [34]. However, these procedures of fabricating modified catalyst electrodes require several steps. The method of fabrication of modified electrocatalysts in a single step through simultaneous deposition of the supporting layer and metal nanoparticles on the solid surface is not yet reported. In the present investigation, a novel electrocatalyst was prepared by uniformly dispersing Au0 nanoparticles into in situ generated poly(aminothiophenol), PATP film via thiol interactions. Cyclic voltammetry was used to deposit simultaneously the film of PATP and Au0 nanoparticles in a sequential process (Scheme 1 ). Surface of GC was modified with this electrocatalyst to fabricate a modified electrode, PATP-Aunano and the electrocatalytic activity of the modified electrode toward ORR was investigated. The PATP-Aunano possesses excellent electroactivity for ORR. Other electrochemical techniques such as double potential chronoamperometry and rotating ring–disk electrode were employed to investigate the kinetic parameters of ORR on the PATP-Aunano catalyst. 2 Experimental 2.1 Materials β-Cyclodextrin (CD), 4-aminothiophenol (ATP), auric acid and sulfuric acid of analytical grades were used as received. Double-distilled water was used throughout the experiments. 2.2 Formation of inclusion complex The inclusion complex of CD with ATP was prepared by adopting the procedure detailed in the literature [35]. In a typical synthesis of the inclusion complex, about 0.0626g of ATP was dissolved in 10mL of ethanol and added to an aqueous solution containing 0.5676g of CD in 40mL of water. A homogenous solution was obtained after stirring. After distilling off the solvents under reduced pressure, a white powder, inclusion complex of β-cyclodextrin with 4-aminothiophenol (CD-ATP-IC) (Scheme 1a) was collected. The powder was washed with acetone to remove the excess of ATP and dried to produce the powder of CD-ATP-IC. The formation of inclusion complex was ascertained by FT-IR and 1H NMR spectroscopic measurements. 2.3 Fabrication of PATP-Aunano catalyst A suspension was prepared by dissolving 50mg of the inclusion complex (CD-ATP-IC) in 10mL DMF. Five microliter of the suspension was dropped on the surface of the glassy carbon (GC) electrode and kept at 60°C for 12h to evaporate the solvent. The electrode was washed with water and stored under nitrogen atmosphere. Gold particles were electrochemically deposited into the GC/CD-ATP-IC electrode surface from 0.5M H2SO4 solution containing 2.0×10−4 M HAuCl4 by applying a repetitive potential scan between 1.0 and −0.1V (versus SCE) at a scan rate of 50mVs−1 for ‘n’ cycles, (n was varied to deposit different amount of Au0 particles). Poly(aminothiophenol) (PATP) and Au0 particles were simultaneously formed on the GC electrode. Thus, the modified electrode (PATP-Aunano) was fabricated. Formation of PATP-Aunano is illustrated in Scheme 1b. PATP-Aunano with different Au0 loading were also fabricated. 2.4 Characterization The surface topography of the PATP-Aunano was examined using scanning probe microscopy, SPM (Digital Instruments; Nanoscope Multimode) in the tapping mode with standard silicon nitride tips. X-ray photoelectron spectroscopy, XPS was recorded on VG Microtech and MT 500/L with a Mo Kα X-ray radiation as the X-ray source for excitation. The data were obtained at room temperature and the operating pressure in the analysis chamber was below 10−9 Torr with an analyzer pass energy of 50eV. The resolution was 0.2eV. 2.5 Electrochemical measurements The electrochemical experiments were carried out using a EG&G PAR electrochemical analyzer. The electrochemical experiments were performed in a standard single-compartment electrochemical cell that contained the PATP-Aunano as working electrode, SCE and platinum wire were used as reference and auxiliary electrodes, respectively. Cyclic voltammograms (CVs) were recorded between +1.0 and 0V versus SCE at a scan rate of 50mVs−1 in O2 or Ar saturated 0.5M H2SO4 solution. Double potential chronoamperograms were obtained by setting the first and second working electrode potential at 800 and 0mV (versus SCE), respectively. In the case of rotating ring–disc electrode (RRDE) measurements, a platinum ring and PATP-Aunano modified GC as disc electrode were used. 3 Results and discussion 3.1 Fabrication of PATP-Aunano catalyst electrode Electrocatalytic Au0 nanoparticles loaded GC modified electrode assembly, PATP-Aunano catalyst (designated as PATP-Aunano), was fabricated by the methodology represented in Scheme 1. Generally, it is difficult to deposit Au0 particles onto a bare GC electrode. A supporting matrix is required to anchor Au0 particles on the surface of GC. Toward this, an electroactive polymer film can be deposited onto the surface of GC and subsequently Au0 particles can be deposited over the film of electroactive polymer in a separate step. Otherwise, to fabricate a Au0 modified catalytic GC electrode, two independent electrochemical processes are needed. The modified electrode thus formed would have two layers; a supporting layer for anchoring Au0 particles and a layer of Au0 particles. Unless a strong electrostatic binding exists between Au0 particles and the supporting layer, the bilayer modified Au0 electrocatalyst may not be compatible under electrochemical operations. Hence, it is essential to have a supporting matrix on GC that would disperse and anchor Au0 particles. In the present study, we have used an electrochemical technique, cyclic voltammetry, for the simultaneous formation of film of an electroactive polymer and deposition of Au0 nanoparticles onto the surface of GC. The electroactive film PATP was formed by the oxidation of ATP present in the layer of CD-ATP-IC on the surface of GC and Au0 particles were deposited by the reduction of HAuCl4 from the electrolyte solution (Scheme 1). Further, Au0 particles in the electroactive films are stabilized through interactions with –SH groups (Scheme 1). Importantly, the electroactive polymer film, PATP was in situ formed as a film on the surface of GC electrode and Au0 nanoparticles are stabilized and anchored into the film to obtain the novel electrocatalyst, PATP-Aunano. The electrochemistry involved in the formation of PATP-Aunano is described below. CD-ATP-IC coated GC electrode was kept in a solution containing 2.0×10−4 M HAuCl4 (in 0.5M H2SO4) and cyclic voltammograms were recorded by scanning the potential from −100 to 1000mV at a scan rate of 50mVs−1 (Fig. 1 ). Interestingly, during the anodic potential scan, two peaks were observed, at 0.67 and 0.90V, with the increase in peak current with number of potential cycles. The two peaks signify the formation of a layer of PATP on the surface of the GC electrode. During the cathodic potential, two peaks were observed at ∼0.87 and ∼0.40V. The initial broad peak at 0.87V is attributed to the reduction of adsorbed AuCl4 − ions to Au0 [36]. These observations clearly suggest the successive formation of film of conducting polymer and incorporation of Au0 particles. As a result, the PATP-Aunano catalyst was fabricated. It must be noted that electropolymerization of a solution of ATP did not give any electroactive film. Hence, we propose the mechanism of modification of GC electrode with simultaneous formation of electroactive polymer film, PATP and Au0 particles as follows. ATP may have adequate configuration to convert into PATP when it is present as a self-assembled layer on the flat surface or Au0 atoms [37]. Hence, in the present study, the self-assembly of ATP was hastened by anchoring the inclusion complex, CD-ATP-IC over Au atoms (Scheme 1). The peaks observed at 0.67 and 0.90V in CVs (Fig. 1) corresponding to the fabrication of PATP-Aunano are assigned to the formation of polaronic and bipolaronic structures of PATP. Thus, we have fabricated a modified catalyst electrode in which Au0 particles are dispersed without any agglomeration through protection by –SH groups in PATP. Interestingly, we have used cyclic voltammetry to deposit simultaneously the PATP having –SH groups (during anodic potential scans) and Au0 particles (during cathodic potential scan) on the surface of GC electrode. Scanning probe microscopic (SPM) measurement reveals the existence of Au0 nanoparticles in the PATP-Aunano. Fig. 2a and b show the SPM images of CD-ATP-IC and PATP-Aunano, respectively. A relatively high-coverage of ordered monolayer of Au0 nanoparticles without agglomeration was found on PATP-Aunano with an average size of Au0 as ∼10–15nm (Fig. 2b). XPS spectrum of PATP-Aunano (Fig. 3 ) confirms the presence of Au0 nanoparticles. The XPS spectrum of PATP-Aunano shows the presence of sulfur (S 2p) and nitrogen (N 1s) peaks at 187.2 and 392.1eV, respectively. The peaks centered at 83.1 (4f 7/2) and 87.5eV (4f 5/2) are the signature of Au0 nanoparticles that exist on PATP-Aunano [38]. Further, catalyst electrodes were fabricated by loading different amounts of Au0 nanoparticles (15–93μgcm−2) into the PATP-IC matrix. True surface area, rugosity factor, specific surface area and the size of the Au0 nanoparticles on the PATP-Aunano catalyst with different loadings of Au0 particles were determined (Table 1 ). The specific surface area (cm2 μg−1) of the catalyst particles was calculated by using the relation, S = 100 A rsa W A gsa where A rsa is the real surface area (as estimated from the charge consumed for the reduction process of the surface oxide monolayer (the peak at ∼920mV in Fig. 4 and using a reported value of 400μCcm−2 [39–41]), A gsa the geometric surface area (A gsa =0.0707cm2) and W (in μgcm−2) is the amount of Au0 loading. The rugosity factor is the ratio of A rsa to A gsa. Assuming spherical particles of similar radius, the mean particle size of Au0 particles, d (in nm) was calculated from the following equation: d = 6000 ρ S where ρ is the density of Au0 particle (ρ =19.3gcm−3) and S is the specific surface area (in cm2 μg−1). The PATP-Aunano has shown excellent electrocatalytic activity for the reduction of dioxygen and the details are presented here. 3.2 Electrocatalytic reduction of dioxygen on the PATP-Aunano Electrocatalytic activity of the PATP-Aunano for oxygen reduction reaction (ORR) was ascertained by recording cyclic voltammograms for the O2 saturated 0.5M H2SO4 solution. Voltammetric results clearly demonstrated the excellent electroactivity of PATP-Aunano for ORR in comparison to the unmodified GC electrode. Fig. 5A (i and ii) shows the CVs of the PATP-Aunano in O2 saturated and Ar saturated solutions, respectively. A peak at ∼430mV was observed for the PATP-Aunano for ORR during the cathodic scan of potential (Fig. 5A; line (i)). Comparatively, a reduction wave at ∼300mV was noticed for ORR on the unmodified GC electrode (Fig. 5B; line (i)). An increased current was also observed at ∼430mV for the O2 saturated solution. Thus, an enhanced electrocatalytic activity was noticed for PATP-Aunano over the unmodified GC electrode with a positive shift of the O2 reduction potential from 300 to 430mV and an increase in the current for ORR (Fig. 5A). It is to be noted that a more positive potential for the reduction of O2 and a higher O2 reduction current are the two essential requirements for the catalysts to find utilities in fuel cell applications. The PATP-Aunano also exhibited a lower onset potential for ORR than that reported (0mV) for (Aunano/CoTMPyp)6 multilayer films [42]. The enhanced catalytic activity of the PATP-Aunano for ORR is expected to arise from the small (∼10nm) crystallite sizes of Au0 nanoparticles and fine distribution of Au0 nanoparticles on the surface of PATP film via the formation of Au0 particles through self-assembly configuration (Scheme 1). Small size (∼10nm) and uniform distribution of Au0 nanoparticles are evident from SPM topography (Fig. 2b). A high surface area is therefore expected due to the uniform distribution of Au0 nanoparticles. During electrolysis of HAuCl4, Au0 nanoparticles are preferentially anchored on the –SH sites (Scheme 1). As a result, the interaction between –SH groups in PATP and Au0 nanoparticles prevents aggregation of Au0 nanoparticles. Attachment of Au0 nanoparticles on to the –SH groups is well known [43–46]. We have also fabricated PATP-Aunano catalysts with different loadings of Au0 and tested for their electrocatalytic activity towards ORR. Fig. 5C shows the CVs of the PATP-Aunano with different Au0 loadings (15–93μgcm−2) in O2 saturated solution. Current–potential profiles were generated after making corrections for the background current. The correction was executed by subtracting the peak current values recorded in Ar atmosphere from the current values noticed in O2 saturated electrolyte. The voltammograms recorded for ORR on the PATP-Aunano with different Au0 loadings illustrate a shift in reduction potential for ORR with an increase of Au0 loading. This infers that overpotential for ORR decreases and the catalytic activity increases with the increase of Au0 loading [47]. The kinetics and reaction mechanism of ORR on the PATP-Aunano were investigated through chronoamperometry and hydrodynamic voltammetric experiments and the details of investigation are presented below. 3.3 Chronoamperometry To get an insight into the dynamics of charge transport on the catalyst electrodes, we have performed a series of chronoamperometry (double potential step) experiments. Fig. 6a shows the chronoamperograms obtained for the PATP-Aunano catalyst with different Au0 loadings in the presence of O2. In these cases, first and second working electrode potentials were set as 800 and 0mV (versus SCE), respectively. The effective (apparent) diffusion coefficient was estimated from the slopes of dependencies of net electrolysis current (I) versus square root of time (t 1/2) and using the integrated Cottrell equation [48,49]; I = n F A D 1 / 2 c o π 1 / 2 t 1 / 2 The slope of the plot is nFAD 1/2 c o/π 1/2 where n is the number of electrons transferred, F the Faraday constant (96484Cmol−1), A the electrode surface area, c o the bulk concentration, and D is the diffusion coefficient (cm2 s−1). Based on Cottrell's equation, the plots of net current, I versus t 1/2 for different Au0 loadings were drawn (Fig. 6b). The plot of I versus t 1/2 is a straight line (Fig. 6b) passing through the origin. The slope of the line gives D as 7.82×10−5 cm2 s−1. The D value obtained for the PATP-Aunano catalyst is comparable with the reported values [50,51]. A value of 1.64×10−5 cm2 s−1 for D was reported for ORR on a GC electrode modified by anthraquinone substituted podands [50]. A value of D in the order of 10−5 cm2 s−1 was reported for palladium particles dispersed in conducting polymer matrix [51]. The catalytic rate constant (k) for the ORR on the PATP-Aunano was calculated using the method proposed by Galus [52] and using I cat I l = γ 1 / 2 π 1 / 2 erf ( γ 1 / 2 ) + exp ( − γ ) γ 1 / 2 where I cat is the catalytic current of ORR on the PATP-Aunano, I l the limiting current in the absence of O2, and γ = kc o t (c o is the bulk concentration of O2) is the argument of the error function. When γ exceeds 2, the error function is almost equal to 1 and therefore the above equation can be reduced to; I cat I l = γ 1 / 2 π 1 / 2 = π 1 / 2 ( k c o t ) 1 / 2 where t is the time elapsed. The slope of I cat/I l versus t 1/2 plot gives k as 3.65×103 M−1 s−1. The rate constant for ORR on the PATP-Aunano catalyst is higher than the one obtained at 111–100 nanofaceted platinum surface (2.3×102 M−1 s−1) [53]. 3.4 RDE and RRDE experiments Kinetics of ORR was followed by using RDE assembly in which the saturation level of O2 supply to the surface of the electrode was varied by altering the rotation speed of the electrode. The solubility of O2 (2.293×10−5 mol fraction [54] at room temperature in aqueous electrolytes) is quite low for studying the kinetics of ORR in a stationary hanging-meniscus assembly. Hence, we have employed RDE experiments to follow the kinetics of ORR. Fig. 7 shows the hydrodynamic voltammograms recorded at 800rpm for the ORR on the PATP-Aunano with various Au0 loadings (15–93μgcm−2). The current for ORR on the disk electrode commences at ∼0.9V and reaches a limiting value around 0.6V. The limiting current increases with increasing Au0 loadings from 15 to 93μgcm−2. The increase in current for ORR is attributed to arise from the increase active surface area of the catalyst (Table 1). In order to determine the kinetic parameters of ORR on the PATP-Aunano catalyst, polarization curves were recorded for different electrode rotation rates (ω) between 50 and 1000rpm. Fig. 8 shows the polarization curves of ORR on the PATP-Aunano (Au0 loading: 78μgcm−2) recorded for different rotation rates. The current–potential profiles were recorded under quasi-stationary conditions by scanning the potential between 1.1 and 0.0V versus SCE with a slow scan rate of 1mVs−1. The limiting current for ORR increases with the rotation rate in the range from 50 to 1000rpm. Further insight into the kinetics of the ORR on the PATP-Aunano was deduced from the analysis of Tafel plots (Fig. 8; inset) derived from RDE. The plot of current density, j k as a function of the electrode potential E was used to determine the limiting current density, j l. The slope, ‘b’, was obtained from the Tafel plot (E versus ln[j k/(j l − j k)]). The intercept at the equilibrium potential gives the exchange current density, j o. The kinetic parameters, j l, j o and b obtained for the PATP-Aunano with different Au0 loadings are presented in Table 2 . The Levich plot (Fig. 9a, current density versus ω 1/2) for ORR on the PATP-Aunano is linear and suggests that ORR is a diffusion controlled process on the PATP-Aunano catalyst. Fig. 9a also reveals that ORR on the PATP-Aunano catalyst is a four electron process and this observation coincides with the theoretical line expected for the four-electron reduction of O2. Koutecky–Levich (KL) law is valid for a first-order process with respect to the diffusing species [55], and the current density, j is related to the rotation rate (ω) according to [56,57], 1 j = 1 j k + 1 B ω 1 / 2 where B is the Levich slope and are given by: j k = n F A k C O 2 B = 0.62 n F ( D O 2 ) 2 / 3 ν − 1 / 6 C O 2 where D O 2 is the diffusion coefficient of dioxygen (7.82×10−5 cm2 s−1), C O 2 the solubility of dioxygen (1.03×10−3 moldm−3), ν the kinematic viscosity (1.07×10−2 cm2 s−1) for sulfuric acid, A the area of the electrode, F the Faraday constant, and n is the number of electrons transferred per molecule of O2. Information on the reaction paths of ORR was also obtained from the KL plot. In general, the electrode potential that was selected to perform KL analysis, (j k)−1 was obtained from the intercept of the KL plot by extrapolating the ordinate to infinite frequency. The KL plots for the electrocatalytic ORR on the modified rotating-disk electrodes are presented in Fig. 9b. The linearity and parallel nature of the plot is usually taken as an indication of the first order reaction with respect to dissolved O2. At high polarizations, slopes over a wide frequency interval is fitted with the calculated behavior of n =4. Through this process, it was identified that the number of electrons involved in ORR is four that is consistent with the Levich analysis (Fig. 9a). For solutions saturated with oxygen, B depends exclusively on the number of electrons (n) consumed per oxygen molecule. In general, the mixed reaction paths are often observed for the reaction involving non-integer number for number of electrons. We have noticed a value close to four for number of electrons that indicates a single step process for ORR. These results therefore confirm that overall ORR is a four electron process and is given by, O2 +4H+ +4e− →2H2O It is known [58] that the direct 4e− path for ORR is favored on surfaces that enable the dissociation of adsorbed O2, i.e. in the cases when adsorption forces are equally distributed to both oxygen atoms. If one atom of a molecule is more strongly bonded than the other, the dissociation is aggravated and the indirect, 2e− reduction path is favored. A 2e− reduction path for ORR was reported for a Au-CoTMPyP modified GC electrode [42]. Earlier reports indicated that differences in the surface structure of the nanoparticles may influence the electrocatalytic behavior of the nanoparticles. Surface structure of the nanoparticles is decided by the modifier used during the preparation of the nanoparticles and the electrochemical ORR occurs accordingly on the catalyst surface [60]. Hernandez et al. [60] used the adsorbates such as iodide and sulfide (surface modifiers) during the synthesis of Au nanoparticles. Iodide induces the formation of (111) or (100) facets Au, whereas sulfide induces (110) facet Au. A four electron path for ORR was predominant on the Au(100) surface, whilst, the number of electrons for the ORR was found to be two on the Au(110) surface [60]. In the case of the Au-CoTMPyP modified GC electrode [42], a [tetrakis(N-methylpyridyl)porphyrinato] cobalt (CoTMPyP) anion was used during the formation of Au nanoparticles and a 2e− for ORR was witnessed. In the present study, it is presumed that Au nanoparticles are distributed in the network of PATP, a conducting polymer. Hence, the observed 4e− path for ORR is presumably due to the presence of PATP as a modifier for Au nanoparticles. In the present study, adsorption forces of both oxygen atoms may be considered equally distributed onto the catalytic surface of Au0. The electrocatalyst predominantly favors the formation of water than hydrogen peroxide through the 4e− path. A similar 4e− reduction path for ORR was reported for the Au0 nanoparticles prepared in the presence of cysteine [59]. A 4e− reduction path was reported for the ORR on Au0 nanoparticles synthesized in a water-in-oil microemulsion with potassium iodide [60]. Rotating GC electrode, modified with PATP-Aunano as disk and platinum ring electrode were used to carry out RRDE experiments. Quantity of H2O2 that was generated during the reduction process of O2 on the rotating disk electrode was determined. This provides further supports for the effectiveness of the catalyst for the proposed four-electron reduction of dioxygen. Fig. 10 shows the voltammetric curves for dioxygen reduction, recorded at the RRDE with the PATP-Aunano modified GC disk electrode. The disk potential was scanned from 1.1 to 0V, while the ring potential was kept at 1.0V to oxidize the H2O2 generated by O2 reduction on the disk electrode. A large disk current was observed for the PATP-Aunano modified GC disk electrode (Fig. 10). The ratio of the ring to disk current, i R/i D, is found to be 0.005 for the modified electrode. From the ratio of the ring–disk currents, the number of electrons involved in ORR is found to be 4 [61], which is consistent with the values obtained from the Levich and KL plot. Taking into account that the rates of formation of H2O2 and H2O are i R/N and i D − i R/N, respectively, the formation efficiency of H2O was estimated as follows [62]; P ( H 2 O ) = N ( i D / i R ) − 1 N ( i D / i R ) + 1 From the value of i R/i D, the efficiency of H2O formation for the PATP-Aunano catalyst was found to be 92%. This result indicates that the reduction of dioxygen on the PATP-Aunano catalyst mainly supports the 4e− pathway to produce a high yield of H2O. 3.5 Stability of PATP-Aunano catalysts We checked the stability of the PATP-Aunano electrode by measuring the current response of the catalyst for ORR for few days by storing the electrode in the electrolyte solution at 25°C. There was no apparent decrease in the current response for the first 2 days. In the next 2 days, a decrease of 3% of its initial value in the current response was noticed. After a week, a decrease of 4% in current response was witnessed. The results demonstrate the good stability of PATP-Aunano. 4 Conclusions New catalysts comprising of gold nanoparticles uniformly distributed into conducting poly(aminothiophenol), PATP matrix are developed by cyclic electrochemical process and a modified electrode was fabricated. The PATP-Aunano catalyst electrode has an enhanced electrocatalytic activity for oxygen reduction reaction and proves to be promising for its utility in fuel cells, O2 sensor, etc. Importantly, the PATP-Aunano catalyst can be formed on any substrate (hydrophobic (glassy carbon), hydrophilic (indium tin oxide) or electroactive membranes) using the methodology developed in the present investigation. Further, PATP-Aunano catalysts are expected to find useful for other electrochemical or chemical reactions. Acknowledgments The work was supported by Korean Research Foundation Grant (KRF-2004-005-00009) and Brain Pool Program. The authors acknowledge the Korea Basic Science Institute (Daegu) and Kyungpook National University Center for Scientific Instrument. References [1] L. Sheeney-Haj-Ichia G. Sharabi I. Willner Adv. Funct. Mater. 12 2002 27 [2] M. Hepel J. Electrochem. Soc. 145 1998 124 [3] P.J. Kulesza M. Chojak K. Karnicka K. Miecznikowski B. Palys A. Lewera A. Wieckowski Chem. Mater. 16 2004 4128 [4] S. Tian J. Liu T. Zhu W. Knoll Chem. Mater. 16 2004 4103 [5] V.P. Yissar T. Bourenko J. Wasserman I. Willner Adv. Mater. 14 2002 670 [6] L. Zhang M. Wan J. Phys. Chem. B 107 2003 6748 [7] L.H. Mascaro D. Goncalves L.O.S. Bulhoes Thin Solid Film 461 2004 243 [8] P. Santhosh A. Gopalan Kwang-Pill Lee J. Catal. 238 2006 177 [9] M. Valden X. Lai D.W. Goodman Science 281 1998 1647 [10] L.O. Brown J.E. Hutchison J. Phys. Chem. B 105 2001 8911 [11] R.L. Whetten J.T. Khoury M.M. Alvarez S. Murthy I. Vezmar Z.L. Wang P.W. Stephens C.L. Cleveland W.D. Luedtke U. Landman Adv. Mater. 8 1996 428 [12] M. Brust M. Walker D. Bethell D.J. Schiffrin R. Whyman J. Chem. Soc., Chem. Commun. 1994 801 [13] M.S. El-Deab T. Ohsaka Electrochem. Commun. 4 2002 288 [14] M.S. El-Deab T. Ohsaka Electrochim. Acta 47 2002 4255 [15] S. Schimpf M. Lucas C. Mohr U. Rodemerck A. Bruckner J. Radnik H. Hofmeister P. Claus Catal. Today 72 2002 63 [16] M. Haruta Catal. Today 36 1997 153 [17] A. Dekanski J. Stevanovic R. Stevanovic B.Z. Nikolic V.M. Jovanovic Carbon 39 2001 1195 [18] D. Martel A. Kuhn Electrochim. Acta 45 2000 1829 [19] A. Sarapuu K. Tammeveski T.T. Tenno V. Sammelselg K. Kontturi D.J. Schiffrin Electrochem. Commun. 3 2001 446 [20] J. Schulz A. Roucoux H. Patin Chem. Rev. 102 2002 3757 [21] O.V. Cherstiouk P.A. Simonov E.R. Savinova Electrochim. Acta 48 2003 3851 [22] S. Liu T. Zhu R. Hu Z. Liu Phys. Chem. Chem. Phys. 2002 6059 [23] J. Matsui K. Akamatsu S. Nishiguchi D. Miyoshi H. Nawafune K. Tamaki N. Sugimoto Anal. Chem. 76 2004 1310 [24] E.S. Forzani H. Zhang L.A. Nagahara I. Amlani R. Tsui N. Tao Nano Lett. 4 2004 1785 [25] T. Osaka S. Ogano K. Naoi N. Oyama J. Electrochem. Soc. 136 1989 306 [26] B. Srinivas, United States Patent 20,040,166,401 (2004). [27] E.W. Paul A.J. Ricco M.S. Wrighton J. Phys. Chem. 89 1985 1441 [28] M.A. Breimer G. Yevgeny S. Sy O.A. Sadik Nano Lett. 1 2001 305 [29] P. Santhosh, A. Gopalan, T. Vasudevan, Kwang-Pill Lee, Appl. Sur. Sci., in press. [30] M. Sastry Curr. Sci. 78 2000 1089 [31] F.P. Zamborini J.F. Hicks R.W. Murray J. Am. Chem. Soc. 122 2000 4514 [32] A. Mamedov J. Ostrander F. Aliev N.A. Kotov Langmuir 16 2000 3941 [33] J. Schmitt G. Decher W.J. Dressich S.L. Brandow R.E. Geer R. Shashidhar J.M. Calvert Adv. Mater. 9 1997 61 [34] K.V. Sarathy P.J. Thomas G.U. Kulkami C.N.R. Rao J. Phys. Chem. B 103 1999 399 [35] A. Harada M. Kamachi Nature 356 1992 325 [36] M.O. Finot G.D. Braybrook M.T. McDermott J. Electroanal. Chem. 466 1999 234 [37] M. Okamura T. Kondo K. Uosaki J. Phys. Chem. B 109 2005 9897 [38] G. Lu D. Ji G. Qian Y. Qi X. Wang J. Suo Appl. Catal. A 280 2005 175 [39] A.A. Michri A.G. Pshchenichikov Kh.R. Burshtein Sov. Electrochem. 8 1972 351 [40] S. Trasatti O.A. Petrii Pure Appl. Chem. 63 1991 711 [41] H.A. Kozlowska B.E. Conway A. Hamelin L. Stoicoviciu J. Electroanal. Chem. 1987 429 [42] M. Huang Y. Shen W. Cheng Y. Shao X. Sun B. Liu S. Dong Anal. Chim. Acta 535 2005 15 [43] A. Badia L. Demers L. Dickinson F.G. Morin R.B. Lennox L. Reven J. Am. Chem. Soc. 119 1997 11104 [44] N.R. Jana X. Peng J. Am. Chem. Soc. 125 2003 14280 [45] M.J. Hostetler J.E. Wingate C.J. Zhong J.E. Harris R.W. Vachet M.R. Clark J.D. Londono S.J. Green J.J. Stokes G.D. Wignall G.L. Glish M.D. Porter N.D. Evans R.W. Murray Langmuir 14 1998 17 [46] W.A. Hayes C. Shannon Langmuir 12 1996 3688 [47] S. Ye A.K. Vijh Electrochem. Commun. 5 2003 272 [48] A.J. Bard L.R. Faulkner Electrochemical Methods: Fundamentals and Applications second ed. 2001 Wiley [49] P.J. Kulesza, M.A. Malik, In: A. Wieckowski (Ed.), Interfacial Electrochemistry, Marcel Dekker. [50] A. Salimi H. Eshghi H. Sharghi S.M. Golabi M. Shamsipur Electroanalysis 11 1991 114 [51] A. Yassar J. Roncali F. Garnier J. Electroanal. Chem. 255 1998 53 [52] Z. Galus Fundamentals of Electrochemical Analysis 1976 Ellis Horwood Press New York p. 313 (Chapter 10) [53] V. Komanicky A. Menzel H. You J. Phys. Chem. B 109 2005 23550 [54] D.R. Lide CRC Handbook of Chemistry and Physics 85th ed. 2004 CRC Press Boca Raton, FL [55] A.J. Bard L.R. Faulkner Electrochemical Methods: Fundamentals and Applications 1980 Wiley New York [56] K. Tammeveski T. Tenno A. Rosental P. Talonen L.S. Johansson L. Niinisto J. Electrochem. Soc. 146 1999 669 [57] N.A. Anastasijevic Z.M. Dimitrijevic R.R. Adzic Electrochim. Acta 31 1986 1125 [58] C.H. Hamann A. Hamnett W. Vielstich Electrochemistry 1998 Wiley WCH p. 281 [59] M.S. El-Deab T. Sotomura T. Ohsaka Electrochem. Commun. 7 2005 29 [60] J. Hernandez J. Solla-Gullon E. Herrero J. Electroanal. Chem. 574 2004 185 [61] S. Liu J. Xu H. Sun D. Li Inorg. Chim. Acta 306 2000 87 [62] R.C.M. Jakobs L.J.J. Janssen E. Barendrecht Electrochim. Acta 30 1985 1085",
      "scopus-id": "33747369685",
      "coredata": {
        "eid": "1-s2.0-S1381116906008247",
        "dc:description": "Gold nanoparticles were embedded into an electroactive polymer layer to modify the glassy carbon (GC) electrode and to fabricate a novel catalyst electrode. Cyclic voltammetry was performed to form the electroactive polymer, poly(aminothiophenol), PATP and deposit the Au0 nanoparticles, simultaneously. 4-Aminothiophenol (ATP) was converted into an inclusion complex with β-cyclodextrin and used to form the electroactive layer on the surface of GC electrode. Au0 nanoparticles were incorporated into film of PATP simultaneously by the electrolysis of a solution of HAuCl4. Thus, newer catalyst electrode, PATP-Aunano, was fabricated. The scanning probe microscopic image of PATP-Aunano indicates the presence of uniformly distributed Au0 nanoparticles of the sizes ∼10nm. Electroactivity of PATP-Aunano for reduction of dioxygen (O2) was evaluated in O2 saturated solution. Cyclic voltammetry was used to demonstrate the enhanced electrocatalytic activity of the PATP-Aunano. A reduction peak at ∼430mV with an enhanced peak current was observed for the oxygen reduction reaction (ORR) in O2 saturated 0.5M sulfuric acid solution. A more positive onset potential and higher catalytic current for ORR are the striking features of PATP-Aunano catalyst. Double potential chronoamperometry, rotating disc (RDE) and rotating ring–disk electrode (RRDE) experiments were carried out to investigate the kinetic parameters of ORR on this electrode. Results from RDE and RRDE voltammetry experiments demonstrate that ORR on the PATP-Aunano is a four electron and diffusion controlled process with a catalytic rate constant of 3.65×103 M−1 s−1 and a diffusion coefficient of 7.82×10−5 cm2 s−1.",
        "openArchiveArticle": "false",
        "prism:coverDate": "2006-08-18",
        "openaccessUserLicense": null,
        "prism:aggregationType": "Journal",
        "prism:url": "https://api.elsevier.com/content/article/pii/S1381116906008247",
        "dc:creator": [
          {
            "@_fa": "true",
            "$": "Gopalan, Anantha Iyengar"
          },
          {
            "@_fa": "true",
            "$": "Lee, Kwang-Pill"
          },
          {
            "@_fa": "true",
            "$": "Manesh, Kalayil Manian"
          },
          {
            "@_fa": "true",
            "$": "Santhosh, Padmanaban"
          },
          {
            "@_fa": "true",
            "$": "Kim, Jun Heon"
          }
        ],
        "link": [
          {
            "@_fa": "true",
            "@rel": "self",
            "@href": "https://api.elsevier.com/content/article/pii/S1381116906008247"
          },
          {
            "@_fa": "true",
            "@rel": "scidir",
            "@href": "https://www.sciencedirect.com/science/article/pii/S1381116906008247"
          }
        ],
        "dc:format": "application/json",
        "openaccessType": null,
        "pii": "S1381-1169(06)00824-7",
        "prism:volume": "256",
        "prism:publisher": "Elsevier B.V.",
        "dc:title": "Gold nanoparticles dispersed into poly(aminothiophenol) as a novel electrocatalyst—Fabrication of modified electrode and evaluation of electrocatalytic activities for dioxygen reduction",
        "prism:copyright": "Copyright © 2006 Elsevier B.V. All rights reserved.",
        "openaccess": "0",
        "prism:issn": "13811169",
        "prism:issueIdentifier": "1-2",
        "dcterms:subject": [
          {
            "@_fa": "true",
            "$": "Gold nanoparticles"
          },
          {
            "@_fa": "true",
            "$": "Electroactive film"
          },
          {
            "@_fa": "true",
            "$": "Glassy carbon electrode"
          },
          {
            "@_fa": "true",
            "$": "Oxygen reduction"
          }
        ],
        "openaccessArticle": "false",
        "prism:publicationName": "Journal of Molecular Catalysis A: Chemical",
        "prism:number": "1-2",
        "openaccessSponsorType": null,
        "prism:pageRange": "335-345",
        "prism:endingPage": "345",
        "pubType": "fla",
        "prism:coverDisplayDate": "18 August 2006",
        "prism:doi": "10.1016/j.molcata.2006.05.027",
        "prism:startingPage": "335",
        "dc:identifier": "doi:10.1016/j.molcata.2006.05.027",
        "openaccessSponsorName": null
      },
      "objects": {
        "object": [
          {
            "@category": "thumbnail",
            "@height": "15",
            "@width": "28",
            "@_fa": "true",
            "$": "https://api.elsevier.com/content/object/eid/1-s2.0-S1381116906008247-si9.gif?httpAccept=%2A%2F%2A",
            "@multimediatype": "GIF image file",
            "@type": "ALTIMG",
            "@size": "199",
            "@ref": "si9",
            "@mimetype": "image/gif"
          },
          {
            "@category": "thumbnail",
            "@height": "20",
            "@width": "203",
            "@_fa": "true",
            "$": "https://api.elsevier.com/content/object/eid/1-s2.0-S1381116906008247-si8.gif?httpAccept=%2A%2F%2A",
            "@multimediatype": "GIF image file",
            "@type": "ALTIMG",
            "@size": "843",
            "@ref": "si8",
            "@mimetype": "image/gif"
          },
          {
            "@category": "thumbnail",
            "@height": "16",
            "@width": "99",
            "@_fa": "true",
            "$": "https://api.elsevier.com/content/object/eid/1-s2.0-S1381116906008247-si7.gif?httpAccept=%2A%2F%2A",
            "@multimediatype": "GIF image file",
            "@type": "ALTIMG",
            "@size": "436",
            "@ref": "si7",
            "@mimetype": "image/gif"
          },
          {
            "@category": "thumbnail",
            "@height": "37",
            "@width": "114",
            "@_fa": "true",
            "$": "https://api.elsevier.com/content/object/eid/1-s2.0-S1381116906008247-si6.gif?httpAccept=%2A%2F%2A",
            "@multimediatype": "GIF image file",
            "@type": "ALTIMG",
            "@size": "549",
            "@ref": "si6",
            "@mimetype": "image/gif"
          },
          {
            "@category": "thumbnail",
            "@height": "36",
            "@width": "212",
            "@_fa": "true",
            "$": "https://api.elsevier.com/content/object/eid/1-s2.0-S1381116906008247-si5.gif?httpAccept=%2A%2F%2A",
            "@multimediatype": "GIF image file",
            "@type": "ALTIMG",
            "@size": "810",
            "@ref": "si5",
            "@mimetype": "image/gif"
          },
          {
            "@category": "thumbnail",
            "@height": "39",
            "@width": "258",
            "@_fa": "true",
            "$": "https://api.elsevier.com/content/object/eid/1-s2.0-S1381116906008247-si4.gif?httpAccept=%2A%2F%2A",
            "@multimediatype": "GIF image file",
            "@type": "ALTIMG",
            "@size": "1182",
            "@ref": "si4",
            "@mimetype": "image/gif"
          },
          {
            "@category": "thumbnail",
            "@height": "30",
            "@width": "148",
            "@_fa": "true",
            "$": "https://api.elsevier.com/content/object/eid/1-s2.0-S1381116906008247-si3.gif?httpAccept=%2A%2F%2A",
            "@multimediatype": "GIF image file",
            "@type": "ALTIMG",
            "@size": "580",
            "@ref": "si3",
            "@mimetype": "image/gif"
          },
          {
            "@category": "thumbnail",
            "@height": "37",
            "@width": "67",
            "@_fa": "true",
            "$": "https://api.elsevier.com/content/object/eid/1-s2.0-S1381116906008247-si2.gif?httpAccept=%2A%2F%2A",
            "@multimediatype": "GIF image file",
            "@type": "ALTIMG",
            "@size": "439",
            "@ref": "si2",
            "@mimetype": "image/gif"
          },
          {
            "@category": "thumbnail",
            "@height": "37",
            "@width": "157",
            "@_fa": "true",
            "$": "https://api.elsevier.com/content/object/eid/1-s2.0-S1381116906008247-si11.gif?httpAccept=%2A%2F%2A",
            "@multimediatype": "GIF image file",
            "@type": "ALTIMG",
            "@size": "969",
            "@ref": "si11",
            "@mimetype": "image/gif"
          },
          {
            "@category": "thumbnail",
            "@height": "15",
            "@width": "26",
            "@_fa": "true",
            "$": "https://api.elsevier.com/content/object/eid/1-s2.0-S1381116906008247-si10.gif?httpAccept=%2A%2F%2A",
            "@multimediatype": "GIF image file",
            "@type": "ALTIMG",
            "@size": "185",
            "@ref": "si10",
            "@mimetype": "image/gif"
          },
          {
            "@category": "thumbnail",
            "@height": "39",
            "@width": "86",
            "@_fa": "true",
            "$": "https://api.elsevier.com/content/object/eid/1-s2.0-S1381116906008247-si1.gif?httpAccept=%2A%2F%2A",
            "@multimediatype": "GIF image file",
            "@type": "ALTIMG",
            "@size": "594",
            "@ref": "si1",
            "@mimetype": "image/gif"
          },
          {
            "@category": "standard",
            "@height": "452",
            "@width": "486",
            "@_fa": "true",
            "$": "https://api.elsevier.com/content/object/eid/1-s2.0-S1381116906008247-gr3.jpg?httpAccept=%2A%2F%2A",
            "@multimediatype": "JPEG image file",
            "@type": "IMAGE-DOWNSAMPLED",
            "@size": "62314",
            "@ref": "gr3",
            "@mimetype": "image/jpeg"
          },
          {
            "@category": "thumbnail",
            "@height": "93",
            "@width": "100",
            "@_fa": "true",
            "$": "https://api.elsevier.com/content/object/eid/1-s2.0-S1381116906008247-gr3.sml?httpAccept=%2A%2F%2A",
            "@multimediatype": "GIF image file",
            "@type": "IMAGE-THUMBNAIL",
            "@size": "1581",
            "@ref": "gr3",
            "@mimetype": "image/gif"
          },
          {
            "@category": "standard",
            "@height": "358",
            "@width": "363",
            "@_fa": "true",
            "$": "https://api.elsevier.com/content/object/eid/1-s2.0-S1381116906008247-gr7.jpg?httpAccept=%2A%2F%2A",
            "@multimediatype": "JPEG image file",
            "@type": "IMAGE-DOWNSAMPLED",
            "@size": "38241",
            "@ref": "gr7",
            "@mimetype": "image/jpeg"
          },
          {
            "@category": "thumbnail",
            "@height": "93",
            "@width": "94",
            "@_fa": "true",
            "$": "https://api.elsevier.com/content/object/eid/1-s2.0-S1381116906008247-gr7.sml?httpAccept=%2A%2F%2A",
            "@multimediatype": "GIF image file",
            "@type": "IMAGE-THUMBNAIL",
            "@size": "1570",
            "@ref": "gr7",
            "@mimetype": "image/gif"
          },
          {
            "@category": "standard",
            "@height": "234",
            "@width": "565",
            "@_fa": "true",
            "$": "https://api.elsevier.com/content/object/eid/1-s2.0-S1381116906008247-gr2.jpg?httpAccept=%2A%2F%2A",
            "@multimediatype": "JPEG image file",
            "@type": "IMAGE-DOWNSAMPLED",
            "@size": "64552",
            "@ref": "gr2",
            "@mimetype": "image/jpeg"
          },
          {
            "@category": "thumbnail",
            "@height": "52",
            "@width": "125",
            "@_fa": "true",
            "$": "https://api.elsevier.com/content/object/eid/1-s2.0-S1381116906008247-gr2.sml?httpAccept=%2A%2F%2A",
            "@multimediatype": "GIF image file",
            "@type": "IMAGE-THUMBNAIL",
            "@size": "3101",
            "@ref": "gr2",
            "@mimetype": "image/gif"
          },
          {
            "@category": "standard",
            "@height": "343",
            "@width": "365",
            "@_fa": "true",
            "$": "https://api.elsevier.com/content/object/eid/1-s2.0-S1381116906008247-gr1.jpg?httpAccept=%2A%2F%2A",
            "@multimediatype": "JPEG image file",
            "@type": "IMAGE-DOWNSAMPLED",
            "@size": "35855",
            "@ref": "gr1",
            "@mimetype": "image/jpeg"
          },
          {
            "@category": "thumbnail",
            "@height": "93",
            "@width": "99",
            "@_fa": "true",
            "$": "https://api.elsevier.com/content/object/eid/1-s2.0-S1381116906008247-gr1.sml?httpAccept=%2A%2F%2A",
            "@multimediatype": "GIF image file",
            "@type": "IMAGE-THUMBNAIL",
            "@size": "1780",
            "@ref": "gr1",
            "@mimetype": "image/gif"
          },
          {
            "@category": "standard",
            "@height": "668",
            "@width": "361",
            "@_fa": "true",
            "$": "https://api.elsevier.com/content/object/eid/1-s2.0-S1381116906008247-gr5.jpg?httpAccept=%2A%2F%2A",
            "@multimediatype": "JPEG image file",
            "@type": "IMAGE-DOWNSAMPLED",
            "@size": "74565",
            "@ref": "gr5",
            "@mimetype": "image/jpeg"
          },
          {
            "@category": "thumbnail",
            "@height": "92",
            "@width": "50",
            "@_fa": "true",
            "$": "https://api.elsevier.com/content/object/eid/1-s2.0-S1381116906008247-gr5.sml?httpAccept=%2A%2F%2A",
            "@multimediatype": "GIF image file",
            "@type": "IMAGE-THUMBNAIL",
            "@size": "1032",
            "@ref": "gr5",
            "@mimetype": "image/gif"
          },
          {
            "@category": "standard",
            "@height": "467",
            "@width": "356",
            "@_fa": "true",
            "$": "https://api.elsevier.com/content/object/eid/1-s2.0-S1381116906008247-gr9.jpg?httpAccept=%2A%2F%2A",
            "@multimediatype": "JPEG image file",
            "@type": "IMAGE-DOWNSAMPLED",
            "@size": "47404",
            "@ref": "gr9",
            "@mimetype": "image/jpeg"
          },
          {
            "@category": "thumbnail",
            "@height": "93",
            "@width": "71",
            "@_fa": "true",
            "$": "https://api.elsevier.com/content/object/eid/1-s2.0-S1381116906008247-gr9.sml?httpAccept=%2A%2F%2A",
            "@multimediatype": "GIF image file",
            "@type": "IMAGE-THUMBNAIL",
            "@size": "1200",
            "@ref": "gr9",
            "@mimetype": "image/gif"
          },
          {
            "@category": "standard",
            "@height": "758",
            "@width": "565",
            "@_fa": "true",
            "$": "https://api.elsevier.com/content/object/eid/1-s2.0-S1381116906008247-sc1.jpg?httpAccept=%2A%2F%2A",
            "@multimediatype": "JPEG image file",
            "@type": "IMAGE-DOWNSAMPLED",
            "@size": "129616",
            "@ref": "sc1",
            "@mimetype": "image/jpeg"
          },
          {
            "@category": "thumbnail",
            "@height": "93",
            "@width": "69",
            "@_fa": "true",
            "$": "https://api.elsevier.com/content/object/eid/1-s2.0-S1381116906008247-sc1.sml?httpAccept=%2A%2F%2A",
            "@multimediatype": "GIF image file",
            "@type": "IMAGE-THUMBNAIL",
            "@size": "2532",
            "@ref": "sc1",
            "@mimetype": "image/gif"
          },
          {
            "@category": "standard",
            "@height": "356",
            "@width": "357",
            "@_fa": "true",
            "$": "https://api.elsevier.com/content/object/eid/1-s2.0-S1381116906008247-gr10.jpg?httpAccept=%2A%2F%2A",
            "@multimediatype": "JPEG image file",
            "@type": "IMAGE-DOWNSAMPLED",
            "@size": "34992",
            "@ref": "gr10",
            "@mimetype": "image/jpeg"
          },
          {
            "@category": "thumbnail",
            "@height": "93",
            "@width": "93",
            "@_fa": "true",
            "$": "https://api.elsevier.com/content/object/eid/1-s2.0-S1381116906008247-gr10.sml?httpAccept=%2A%2F%2A",
            "@multimediatype": "GIF image file",
            "@type": "IMAGE-THUMBNAIL",
            "@size": "1369",
            "@ref": "gr10",
            "@mimetype": "image/gif"
          },
          {
            "@category": "standard",
            "@height": "664",
            "@width": "366",
            "@_fa": "true",
            "$": "https://api.elsevier.com/content/object/eid/1-s2.0-S1381116906008247-gr6.jpg?httpAccept=%2A%2F%2A",
            "@multimediatype": "JPEG image file",
            "@type": "IMAGE-DOWNSAMPLED",
            "@size": "68368",
            "@ref": "gr6",
            "@mimetype": "image/jpeg"
          },
          {
            "@category": "thumbnail",
            "@height": "93",
            "@width": "51",
            "@_fa": "true",
            "$": "https://api.elsevier.com/content/object/eid/1-s2.0-S1381116906008247-gr6.sml?httpAccept=%2A%2F%2A",
            "@multimediatype": "GIF image file",
            "@type": "IMAGE-THUMBNAIL",
            "@size": "1031",
            "@ref": "gr6",
            "@mimetype": "image/gif"
          },
          {
            "@category": "standard",
            "@height": "349",
            "@width": "359",
            "@_fa": "true",
            "$": "https://api.elsevier.com/content/object/eid/1-s2.0-S1381116906008247-gr4.jpg?httpAccept=%2A%2F%2A",
            "@multimediatype": "JPEG image file",
            "@type": "IMAGE-DOWNSAMPLED",
            "@size": "34144",
            "@ref": "gr4",
            "@mimetype": "image/jpeg"
          },
          {
            "@category": "thumbnail",
            "@height": "93",
            "@width": "96",
            "@_fa": "true",
            "$": "https://api.elsevier.com/content/object/eid/1-s2.0-S1381116906008247-gr4.sml?httpAccept=%2A%2F%2A",
            "@multimediatype": "GIF image file",
            "@type": "IMAGE-THUMBNAIL",
            "@size": "1533",
            "@ref": "gr4",
            "@mimetype": "image/gif"
          },
          {
            "@category": "standard",
            "@height": "354",
            "@width": "356",
            "@_fa": "true",
            "$": "https://api.elsevier.com/content/object/eid/1-s2.0-S1381116906008247-gr8.jpg?httpAccept=%2A%2F%2A",
            "@multimediatype": "JPEG image file",
            "@type": "IMAGE-DOWNSAMPLED",
            "@size": "40207",
            "@ref": "gr8",
            "@mimetype": "image/jpeg"
          },
          {
            "@category": "thumbnail",
            "@height": "94",
            "@width": "94",
            "@_fa": "true",
            "$": "https://api.elsevier.com/content/object/eid/1-s2.0-S1381116906008247-gr8.sml?httpAccept=%2A%2F%2A",
            "@multimediatype": "GIF image file",
            "@type": "IMAGE-THUMBNAIL",
            "@size": "1835",
            "@ref": "gr8",
            "@mimetype": "image/gif"
          },
          {
            "@category": "standard",
            "@height": "237",
            "@width": "242",
            "@_fa": "true",
            "$": "https://api.elsevier.com/content/object/eid/1-s2.0-S1381116906008247-fx1.jpg?httpAccept=%2A%2F%2A",
            "@multimediatype": "JPEG image file",
            "@type": "IMAGE-DOWNSAMPLED",
            "@size": "38724",
            "@ref": "fx1",
            "@mimetype": "image/jpeg"
          },
          {
            "@category": "thumbnail",
            "@height": "93",
            "@width": "95",
            "@_fa": "true",
            "$": "https://api.elsevier.com/content/object/eid/1-s2.0-S1381116906008247-fx1.sml?httpAccept=%2A%2F%2A",
            "@multimediatype": "GIF image file",
            "@type": "IMAGE-THUMBNAIL",
            "@size": "3958",
            "@ref": "fx1",
            "@mimetype": "image/gif"
          }
        ]
      },
      "link": {
        "@rel": "abstract",
        "@href": "https://api.elsevier.com/content/abstract/scopus_id/33747369685"
      }
    }
  }
}