{
  "metadata": {
    "title": "Low-temperature selective oxidation of CO in H<ce:inf loc=post>2</ce:inf>-rich gases over Ag/SiO<ce:inf loc=post>2</ce:inf> catalysts",
    "authors": "; ; ",
    "journal": "Journal of Molecular Catalysis A: Chemical",
    "date": "2005-09-14",
    "doi": "10.1016/j.molcata.2005.05.033",
    "abstract": "",
    "uri": "https://api.elsevier.com/content/article/pii/S1381116905003699",
    "pii": "S1381116905003699"
  },
  "fulltext": {
    "full-text-retrieval-response": {
      "scopus-eid": "2-s2.0-23344450543",
      "originalText": "serial JL 271358 291210 291744 291790 291809 31 Journal of Molecular Catalysis A: Chemical JOURNALMOLECULARCATALYSISACHEMICAL 2005-07-05 2005-07-05 2010-04-19T04:56:56 1-s2.0-S1381116905003699 S1381-1169(05)00369-9 S1381116905003699 10.1016/j.molcata.2005.05.033 S300 S300.1 FULL-TEXT 1-s2.0-S1381116905X02199 2020-02-17T13:16:58.998595Z 0 0 20050914 2005 2005-07-05T00:00:00Z articleinfo crossmark dco dateupdated tomb dateloaded datesearch indexeddate issuelist volumelist yearnav absattachment articletitlenorm authfirstinitialnorm authfirstsurnamenorm cid cids contenttype copyright dateloadedtxt docsubtype doctype doi eid ewtransactionid hubeid issfirst issn issnnorm itemstage itemtransactionid itemweight openaccess openarchive pg pgfirst pglast pii piinorm pubdatestart pubdatetxt pubyr sortorder srctitle srctitlenorm srctype subheadings volfirst volissue webpdf webpdfpagecount figure table body mmlmath acknowledge affil articletitle auth authfirstini authfull authkeywords authlast footnotes primabst ref specialabst alllist content subj ssids 1381-1169 13811169 239 239 1 2 1 2 Volume 239, Issues 1–2 6 22 31 22 31 20050914 14 September 2005 2005-09-14 2005 article fla Copyright © 2005 Published by Elsevier B.V. LOWTEMPERATURESELECTIVEOXIDATIONCOINH2RICHGASESOVERAGSIO2CATALYSTS QU Z 1 Introduction 2 Experimental 2.1 Catalyst preparation and characterization 2.2 Activity tests 3 Results and discussion 3.1 Catalyst characterization 3.2 Catalytic properties 3.2.1 Effects of supports on the activity and selectivity 3.2.2 Effects of silver loading 3.2.3 O2 effect 3.2.4 Activity after pretreatment with H2, O2 and He at 500°C 4 Conclusions Acknowledgements References LEMONS 1990 251 R APPLEBY 1989 A FUELCELLHANDBOOK GOTTESFELD 1988 2651 S KAHLICH 1997 93 M SCHUBERT 1997 256 M OH 1993 254 S IGARASHI 2000 1262 H BETHKE 2000 43 G IGARASHI 1997 159 H WATANABE 1995 21 M SCHUBERT 2001 143 M MANASILP 2002 17 A TAMARU 1997 167 K SERAFIN 1998 157 J XIA 1999 91 G IMAMURA 2000 226 S SONG 1997 65 K GULDUR 2002 219 C QU 2004 247 Z QU 2005 446 Z QU 2005 21 Z SCHERRER 1918 98 P IMAMURA 2000 221 S KUNG 1997 261 M YANG 1997 5 M AOYAMA 1997 249 N QU 2002 460 464 Z MEIMA 1989 293 G KUNDAKOVIC 1999 35 L BACKX 1981 364 C BAO 1993 14 X SANDLER 1964 227 Y PROCEEDINGTHIRDINTERNATIONALCONGRESSCATALYSISAMSTERDAMVOL1 KAHLICH 1999 430 M BOLLINGER 1996 417 M QUX2005X22 QUX2005X22X31 QUX2005X22XZ QUX2005X22X31XZ 2020-02-12T13:16:56.688Z http://vtw.elsevier.com/data/voc/AddOnTypes/50.7/nlp S1381116905003699 Chinese Ministry of Science and Technology MOST Ministry of Science and Technology of the People's Republic of China http://data.elsevier.com/vocabulary/SciValFunders/501100002855 http://sws.geonames.org/1814991/ Natural Science Foundation of China NSFC National Natural Science Foundation of China http://data.elsevier.com/vocabulary/SciValFunders/501100001809 http://sws.geonames.org/1814991/ We are grateful to the Chinese Ministry of Science and Technology and the Natural Science Foundation of China for support of this work. item S1381-1169(05)00369-9 S1381116905003699 1-s2.0-S1381116905003699 10.1016/j.molcata.2005.05.033 271358 2010-10-10T21:04:29.283464-04:00 2005-09-14 1-s2.0-S1381116905003699-main.pdf https://s3.amazonaws.com/prod-ucs-content-store-us-east/content/pii:S1381116905003699/MAIN/application/pdf/e468c597ca60513b253f56ebbeba2d60/main.pdf https://s3-eu-west-1.amazonaws.com/prod-ucs-content-store-eu-west/content/pii:S1381116905003699/MAIN/application/pdf/e468c597ca60513b253f56ebbeba2d60/main.pdf main.pdf pdf true 751719 MAIN 10 1-s2.0-S1381116905003699-main_1.png https://s3.amazonaws.com/prod-ucs-content-store-us-east/content/pii:S1381116905003699/PREVIEW/image/png/c83567dcb1ea9963e8d98d6e89f85123/main_1.png https://s3-eu-west-1.amazonaws.com/prod-ucs-content-store-eu-west/content/pii:S1381116905003699/PREVIEW/image/png/c83567dcb1ea9963e8d98d6e89f85123/main_1.png main_1.png png 62629 849 656 IMAGE-WEB-PDF 1 1-s2.0-S1381116905003699-si1.gif https://s3.amazonaws.com/prod-ucs-content-store-us-east/content/pii:S1381116905003699/STRIPIN/image/gif/352d3adae0d435209e9be03f7660113c/si1.gif https://s3-eu-west-1.amazonaws.com/prod-ucs-content-store-eu-west/content/pii:S1381116905003699/STRIPIN/image/gif/352d3adae0d435209e9be03f7660113c/si1.gif si1 si1.gif gif 487 21 132 ALTIMG 1-s2.0-S1381116905003699-si6.gif https://s3.amazonaws.com/prod-ucs-content-store-us-east/content/pii:S1381116905003699/STRIPIN/image/gif/12d27c378c552dbb5a8dc92aaebe14cd/si6.gif https://s3-eu-west-1.amazonaws.com/prod-ucs-content-store-eu-west/content/pii:S1381116905003699/STRIPIN/image/gif/12d27c378c552dbb5a8dc92aaebe14cd/si6.gif si6 si6.gif gif 2146 91 374 ALTIMG 1-s2.0-S1381116905003699-si2.gif https://s3.amazonaws.com/prod-ucs-content-store-us-east/content/pii:S1381116905003699/STRIPIN/image/gif/b0ebdb349cc2c488de6b3d3b771e82ff/si2.gif https://s3-eu-west-1.amazonaws.com/prod-ucs-content-store-eu-west/content/pii:S1381116905003699/STRIPIN/image/gif/b0ebdb349cc2c488de6b3d3b771e82ff/si2.gif si2 si2.gif gif 534 21 131 ALTIMG 1-s2.0-S1381116905003699-si7.gif https://s3.amazonaws.com/prod-ucs-content-store-us-east/content/pii:S1381116905003699/STRIPIN/image/gif/b2e7e1febbe57ded4414d2c427582f3c/si7.gif https://s3-eu-west-1.amazonaws.com/prod-ucs-content-store-eu-west/content/pii:S1381116905003699/STRIPIN/image/gif/b2e7e1febbe57ded4414d2c427582f3c/si7.gif si7 si7.gif gif 206 16 27 ALTIMG 1-s2.0-S1381116905003699-si5.gif https://s3.amazonaws.com/prod-ucs-content-store-us-east/content/pii:S1381116905003699/STRIPIN/image/gif/ccb0f17440f9b71f21dc5da002a87fc8/si5.gif https://s3-eu-west-1.amazonaws.com/prod-ucs-content-store-eu-west/content/pii:S1381116905003699/STRIPIN/image/gif/ccb0f17440f9b71f21dc5da002a87fc8/si5.gif si5 si5.gif gif 936 43 182 ALTIMG 1-s2.0-S1381116905003699-si4.gif https://s3.amazonaws.com/prod-ucs-content-store-us-east/content/pii:S1381116905003699/STRIPIN/image/gif/6e551bd4a66ca60d7a4e6e2ca9a94e22/si4.gif https://s3-eu-west-1.amazonaws.com/prod-ucs-content-store-eu-west/content/pii:S1381116905003699/STRIPIN/image/gif/6e551bd4a66ca60d7a4e6e2ca9a94e22/si4.gif si4 si4.gif gif 1388 40 295 ALTIMG 1-s2.0-S1381116905003699-si3.gif https://s3.amazonaws.com/prod-ucs-content-store-us-east/content/pii:S1381116905003699/STRIPIN/image/gif/fa6fefe7cc79e7c4b4325b41420f6af4/si3.gif https://s3-eu-west-1.amazonaws.com/prod-ucs-content-store-eu-west/content/pii:S1381116905003699/STRIPIN/image/gif/fa6fefe7cc79e7c4b4325b41420f6af4/si3.gif si3 si3.gif gif 1538 40 307 ALTIMG 1-s2.0-S1381116905003699-gr1.jpg https://s3.amazonaws.com/prod-ucs-content-store-us-east/content/pii:S1381116905003699/gr1/DOWNSAMPLED/image/jpeg/5fdf59b0632e733863b2e507b55c66f0/gr1.jpg https://s3-eu-west-1.amazonaws.com/prod-ucs-content-store-eu-west/content/pii:S1381116905003699/gr1/DOWNSAMPLED/image/jpeg/5fdf59b0632e733863b2e507b55c66f0/gr1.jpg gr1 gr1.jpg jpg 27044 297 358 IMAGE-DOWNSAMPLED 1-s2.0-S1381116905003699-gr1.sml https://s3.amazonaws.com/prod-ucs-content-store-us-east/content/pii:S1381116905003699/gr1/THUMBNAIL/image/gif/8b2417d4bb01b411738ba83e3bfa18ec/gr1.sml https://s3-eu-west-1.amazonaws.com/prod-ucs-content-store-eu-west/content/pii:S1381116905003699/gr1/THUMBNAIL/image/gif/8b2417d4bb01b411738ba83e3bfa18ec/gr1.sml gr1 gr1.sml sml 2469 93 112 IMAGE-THUMBNAIL 1-s2.0-S1381116905003699-gr10.jpg https://s3.amazonaws.com/prod-ucs-content-store-us-east/content/pii:S1381116905003699/gr10/DOWNSAMPLED/image/jpeg/9db0773f77ee36c9648f86bb9ab82fe1/gr10.jpg https://s3-eu-west-1.amazonaws.com/prod-ucs-content-store-eu-west/content/pii:S1381116905003699/gr10/DOWNSAMPLED/image/jpeg/9db0773f77ee36c9648f86bb9ab82fe1/gr10.jpg gr10 gr10.jpg jpg 91231 844 746 IMAGE-DOWNSAMPLED 1-s2.0-S1381116905003699-gr10.sml https://s3.amazonaws.com/prod-ucs-content-store-us-east/content/pii:S1381116905003699/gr10/THUMBNAIL/image/gif/c225befb3cd08edd8410c55dd56f7487/gr10.sml https://s3-eu-west-1.amazonaws.com/prod-ucs-content-store-eu-west/content/pii:S1381116905003699/gr10/THUMBNAIL/image/gif/c225befb3cd08edd8410c55dd56f7487/gr10.sml gr10 gr10.sml sml 2133 93 82 IMAGE-THUMBNAIL 1-s2.0-S1381116905003699-gr11.jpg https://s3.amazonaws.com/prod-ucs-content-store-us-east/content/pii:S1381116905003699/gr11/DOWNSAMPLED/image/jpeg/68adbe5dd65232dc7e5d8afe063c9ab9/gr11.jpg https://s3-eu-west-1.amazonaws.com/prod-ucs-content-store-eu-west/content/pii:S1381116905003699/gr11/DOWNSAMPLED/image/jpeg/68adbe5dd65232dc7e5d8afe063c9ab9/gr11.jpg gr11 gr11.jpg jpg 39705 580 364 IMAGE-DOWNSAMPLED 1-s2.0-S1381116905003699-gr11.sml https://s3.amazonaws.com/prod-ucs-content-store-us-east/content/pii:S1381116905003699/gr11/THUMBNAIL/image/gif/b50e3c5a1d416f9da29f1b6dae3e3ce2/gr11.sml https://s3-eu-west-1.amazonaws.com/prod-ucs-content-store-eu-west/content/pii:S1381116905003699/gr11/THUMBNAIL/image/gif/b50e3c5a1d416f9da29f1b6dae3e3ce2/gr11.sml gr11 gr11.sml sml 2170 92 58 IMAGE-THUMBNAIL 1-s2.0-S1381116905003699-gr12.jpg https://s3.amazonaws.com/prod-ucs-content-store-us-east/content/pii:S1381116905003699/gr12/DOWNSAMPLED/image/jpeg/92135dee50527c06f70b42f9ae66c344/gr12.jpg https://s3-eu-west-1.amazonaws.com/prod-ucs-content-store-eu-west/content/pii:S1381116905003699/gr12/DOWNSAMPLED/image/jpeg/92135dee50527c06f70b42f9ae66c344/gr12.jpg gr12 gr12.jpg jpg 46715 724 365 IMAGE-DOWNSAMPLED 1-s2.0-S1381116905003699-gr12.sml https://s3.amazonaws.com/prod-ucs-content-store-us-east/content/pii:S1381116905003699/gr12/THUMBNAIL/image/gif/99ea625e5a48b76aa32e80ea99df9fb8/gr12.sml https://s3-eu-west-1.amazonaws.com/prod-ucs-content-store-eu-west/content/pii:S1381116905003699/gr12/THUMBNAIL/image/gif/99ea625e5a48b76aa32e80ea99df9fb8/gr12.sml gr12 gr12.sml sml 1664 93 47 IMAGE-THUMBNAIL 1-s2.0-S1381116905003699-gr13.jpg https://s3.amazonaws.com/prod-ucs-content-store-us-east/content/pii:S1381116905003699/gr13/DOWNSAMPLED/image/jpeg/81c1ccce9f238d76f3466202745dd325/gr13.jpg https://s3-eu-west-1.amazonaws.com/prod-ucs-content-store-eu-west/content/pii:S1381116905003699/gr13/DOWNSAMPLED/image/jpeg/81c1ccce9f238d76f3466202745dd325/gr13.jpg gr13 gr13.jpg jpg 21697 245 372 IMAGE-DOWNSAMPLED 1-s2.0-S1381116905003699-gr13.sml https://s3.amazonaws.com/prod-ucs-content-store-us-east/content/pii:S1381116905003699/gr13/THUMBNAIL/image/gif/86cedf1fa3bc7908e27eaa8e51d30d75/gr13.sml https://s3-eu-west-1.amazonaws.com/prod-ucs-content-store-eu-west/content/pii:S1381116905003699/gr13/THUMBNAIL/image/gif/86cedf1fa3bc7908e27eaa8e51d30d75/gr13.sml gr13 gr13.sml sml 2439 82 125 IMAGE-THUMBNAIL 1-s2.0-S1381116905003699-gr2.jpg https://s3.amazonaws.com/prod-ucs-content-store-us-east/content/pii:S1381116905003699/gr2/DOWNSAMPLED/image/jpeg/aa82c3325b0c6774931c53f9011d4ed0/gr2.jpg https://s3-eu-west-1.amazonaws.com/prod-ucs-content-store-eu-west/content/pii:S1381116905003699/gr2/DOWNSAMPLED/image/jpeg/aa82c3325b0c6774931c53f9011d4ed0/gr2.jpg gr2 gr2.jpg jpg 35855 271 357 IMAGE-DOWNSAMPLED 1-s2.0-S1381116905003699-gr2.sml https://s3.amazonaws.com/prod-ucs-content-store-us-east/content/pii:S1381116905003699/gr2/THUMBNAIL/image/gif/cb8b97fd23803e086955d00898536dcb/gr2.sml https://s3-eu-west-1.amazonaws.com/prod-ucs-content-store-eu-west/content/pii:S1381116905003699/gr2/THUMBNAIL/image/gif/cb8b97fd23803e086955d00898536dcb/gr2.sml gr2 gr2.sml sml 3655 93 123 IMAGE-THUMBNAIL 1-s2.0-S1381116905003699-gr3.jpg https://s3.amazonaws.com/prod-ucs-content-store-us-east/content/pii:S1381116905003699/gr3/DOWNSAMPLED/image/jpeg/27b5d489fae97624ba131a58baa2ede4/gr3.jpg https://s3-eu-west-1.amazonaws.com/prod-ucs-content-store-eu-west/content/pii:S1381116905003699/gr3/DOWNSAMPLED/image/jpeg/27b5d489fae97624ba131a58baa2ede4/gr3.jpg gr3 gr3.jpg jpg 43704 525 361 IMAGE-DOWNSAMPLED 1-s2.0-S1381116905003699-gr3.sml https://s3.amazonaws.com/prod-ucs-content-store-us-east/content/pii:S1381116905003699/gr3/THUMBNAIL/image/gif/c544b8b002cfc2bcda131ad456ffbbc1/gr3.sml https://s3-eu-west-1.amazonaws.com/prod-ucs-content-store-eu-west/content/pii:S1381116905003699/gr3/THUMBNAIL/image/gif/c544b8b002cfc2bcda131ad456ffbbc1/gr3.sml gr3 gr3.sml sml 2029 93 64 IMAGE-THUMBNAIL 1-s2.0-S1381116905003699-gr4.jpg https://s3.amazonaws.com/prod-ucs-content-store-us-east/content/pii:S1381116905003699/gr4/DOWNSAMPLED/image/jpeg/2ea4fb4e127c8f5a35c77bf4907e522a/gr4.jpg https://s3-eu-west-1.amazonaws.com/prod-ucs-content-store-eu-west/content/pii:S1381116905003699/gr4/DOWNSAMPLED/image/jpeg/2ea4fb4e127c8f5a35c77bf4907e522a/gr4.jpg gr4 gr4.jpg jpg 122162 730 357 IMAGE-DOWNSAMPLED 1-s2.0-S1381116905003699-gr4.sml https://s3.amazonaws.com/prod-ucs-content-store-us-east/content/pii:S1381116905003699/gr4/THUMBNAIL/image/gif/6a20c5d8feecc67d302e2eb1275986aa/gr4.sml https://s3-eu-west-1.amazonaws.com/prod-ucs-content-store-eu-west/content/pii:S1381116905003699/gr4/THUMBNAIL/image/gif/6a20c5d8feecc67d302e2eb1275986aa/gr4.sml gr4 gr4.sml sml 1760 92 45 IMAGE-THUMBNAIL 1-s2.0-S1381116905003699-gr5.jpg https://s3.amazonaws.com/prod-ucs-content-store-us-east/content/pii:S1381116905003699/gr5/DOWNSAMPLED/image/jpeg/5b7545d0cb8643395a29ef477c30a8b0/gr5.jpg https://s3-eu-west-1.amazonaws.com/prod-ucs-content-store-eu-west/content/pii:S1381116905003699/gr5/DOWNSAMPLED/image/jpeg/5b7545d0cb8643395a29ef477c30a8b0/gr5.jpg gr5 gr5.jpg jpg 20029 263 359 IMAGE-DOWNSAMPLED 1-s2.0-S1381116905003699-gr5.sml https://s3.amazonaws.com/prod-ucs-content-store-us-east/content/pii:S1381116905003699/gr5/THUMBNAIL/image/gif/9186fe41e482cbd48695a2fce899d40c/gr5.sml https://s3-eu-west-1.amazonaws.com/prod-ucs-content-store-eu-west/content/pii:S1381116905003699/gr5/THUMBNAIL/image/gif/9186fe41e482cbd48695a2fce899d40c/gr5.sml gr5 gr5.sml sml 2020 92 125 IMAGE-THUMBNAIL 1-s2.0-S1381116905003699-gr7.jpg https://s3.amazonaws.com/prod-ucs-content-store-us-east/content/pii:S1381116905003699/gr7/DOWNSAMPLED/image/jpeg/b2121f5cff5611c7bade8d20f8308b7f/gr7.jpg https://s3-eu-west-1.amazonaws.com/prod-ucs-content-store-eu-west/content/pii:S1381116905003699/gr7/DOWNSAMPLED/image/jpeg/b2121f5cff5611c7bade8d20f8308b7f/gr7.jpg gr7 gr7.jpg jpg 20294 250 364 IMAGE-DOWNSAMPLED 1-s2.0-S1381116905003699-gr7.sml https://s3.amazonaws.com/prod-ucs-content-store-us-east/content/pii:S1381116905003699/gr7/THUMBNAIL/image/gif/373a62e7a9fd4b4d642fa0ff50863d54/gr7.sml https://s3-eu-west-1.amazonaws.com/prod-ucs-content-store-eu-west/content/pii:S1381116905003699/gr7/THUMBNAIL/image/gif/373a62e7a9fd4b4d642fa0ff50863d54/gr7.sml gr7 gr7.sml sml 2416 86 125 IMAGE-THUMBNAIL 1-s2.0-S1381116905003699-gr8.jpg https://s3.amazonaws.com/prod-ucs-content-store-us-east/content/pii:S1381116905003699/gr8/DOWNSAMPLED/image/jpeg/c41d0331542869321247446cf4c94db5/gr8.jpg https://s3-eu-west-1.amazonaws.com/prod-ucs-content-store-eu-west/content/pii:S1381116905003699/gr8/DOWNSAMPLED/image/jpeg/c41d0331542869321247446cf4c94db5/gr8.jpg gr8 gr8.jpg jpg 17781 253 361 IMAGE-DOWNSAMPLED 1-s2.0-S1381116905003699-gr8.sml https://s3.amazonaws.com/prod-ucs-content-store-us-east/content/pii:S1381116905003699/gr8/THUMBNAIL/image/gif/743828a670b0f468bdf33531bfc47eb3/gr8.sml https://s3-eu-west-1.amazonaws.com/prod-ucs-content-store-eu-west/content/pii:S1381116905003699/gr8/THUMBNAIL/image/gif/743828a670b0f468bdf33531bfc47eb3/gr8.sml gr8 gr8.sml sml 2243 88 125 IMAGE-THUMBNAIL 1-s2.0-S1381116905003699-gr9.jpg https://s3.amazonaws.com/prod-ucs-content-store-us-east/content/pii:S1381116905003699/gr9/DOWNSAMPLED/image/jpeg/5ca10c5b73fd3b237184b926036b11a2/gr9.jpg https://s3-eu-west-1.amazonaws.com/prod-ucs-content-store-eu-west/content/pii:S1381116905003699/gr9/DOWNSAMPLED/image/jpeg/5ca10c5b73fd3b237184b926036b11a2/gr9.jpg gr9 gr9.jpg jpg 17164 273 359 IMAGE-DOWNSAMPLED 1-s2.0-S1381116905003699-gr9.sml https://s3.amazonaws.com/prod-ucs-content-store-us-east/content/pii:S1381116905003699/gr9/THUMBNAIL/image/gif/7709f3eb5f917c7b1c332e3c3d4682d4/gr9.sml https://s3-eu-west-1.amazonaws.com/prod-ucs-content-store-eu-west/content/pii:S1381116905003699/gr9/THUMBNAIL/image/gif/7709f3eb5f917c7b1c332e3c3d4682d4/gr9.sml gr9 gr9.sml sml 1932 94 123 IMAGE-THUMBNAIL 1-s2.0-S1381116905003699-gr6.jpg https://s3.amazonaws.com/prod-ucs-content-store-us-east/content/pii:S1381116905003699/gr6/DOWNSAMPLED/image/jpeg/3873f2820633fe8258d1f66a0b9be64e/gr6.jpg https://s3-eu-west-1.amazonaws.com/prod-ucs-content-store-eu-west/content/pii:S1381116905003699/gr6/DOWNSAMPLED/image/jpeg/3873f2820633fe8258d1f66a0b9be64e/gr6.jpg gr6 gr6.jpg jpg 72413 706 372 IMAGE-DOWNSAMPLED 1-s2.0-S1381116905003699-gr6.sml https://s3.amazonaws.com/prod-ucs-content-store-us-east/content/pii:S1381116905003699/gr6/THUMBNAIL/image/gif/c110ca409e05b46e92b29e0bfc43f878/gr6.sml https://s3-eu-west-1.amazonaws.com/prod-ucs-content-store-eu-west/content/pii:S1381116905003699/gr6/THUMBNAIL/image/gif/c110ca409e05b46e92b29e0bfc43f878/gr6.sml gr6 gr6.sml sml 1949 93 49 IMAGE-THUMBNAIL 1-s2.0-S1381116905003699-fx1.gif https://s3.amazonaws.com/prod-ucs-content-store-us-east/content/pii:S1381116905003699/fx1/DOWNSAMPLED/image/gif/f7027fd40757b64932b3c2061bc582fa/fx1.gif https://s3-eu-west-1.amazonaws.com/prod-ucs-content-store-eu-west/content/pii:S1381116905003699/fx1/DOWNSAMPLED/image/gif/f7027fd40757b64932b3c2061bc582fa/fx1.gif fx1 true fx1.gif gif 3732 181 263 IMAGE-DOWNSAMPLED 1-s2.0-S1381116905003699-fx1.sml https://s3.amazonaws.com/prod-ucs-content-store-us-east/content/pii:S1381116905003699/fx1/THUMBNAIL/image/gif/1bf7b842cb590cdf28d3a1fb84cd6694/fx1.sml https://s3-eu-west-1.amazonaws.com/prod-ucs-content-store-eu-west/content/pii:S1381116905003699/fx1/THUMBNAIL/image/gif/1bf7b842cb590cdf28d3a1fb84cd6694/fx1.sml fx1 true fx1.sml sml 1253 86 125 IMAGE-THUMBNAIL MOLCAA 5322 S1381-1169(05)00369-9 10.1016/j.molcata.2005.05.033 Fig. 1 XRD patterns of silver catalysts supported on different supports. Fig. 2 XRD patterns of Ag/SiO2 catalysts with different loadings pretreated with He at 500°C for 2h. Fig. 3 XRD patterns of 16% Ag/SiO2 treated with oxygen and hydrogen atmospheres at 7500°C. (A) Firstly treated with oxygen for 2h (a), followed by hydrogen atmosphere at the same temperature for 1h (b). (B) Firstly treated with hydrogen for 2h (c), followed by oxygen atmosphere at the same temperature for 1h (d). Fig. 4 TEM micrographs of Ag/SiO2 catalysts treated with oxygen (a), and hydrogen (b) at 500°C for 2h. Fig. 5 Variations of CO conversion as a function of different SiO2/Al2O3 ratio of zeolite H-ZSM-5 at 50°C. Fig. 6 Variations of O2 conversion (a), CO conversion (b), and selectivity S (c) over Ag/SiO2 catalysts with different loadings as a function of the reaction temperature. CO 1.0%, O2 0.5%, H2 balance. Flow rate: 50ml/min, pretreatment with He at 500°C for 2h. Fig. 7 Maximum CO conversion and the corresponding selectivity over Ag/SiO2 catalysts as a function of silver loading. Fig. 8 The temperatures for 100% conversion of oxygen and the maximum conversion of CO as a function of silver loading. Fig. 9 The reaction rate of silver catalysts with different loadings for CO selective oxidation at 30°C. Fig. 10 Conversion of CO and O2, and the selectivity towards CO2 vs. reaction temperature on 16% Ag/SiO2 catalysts pretreated with He at 500°C for different λ. Fig. 11 Dependencies of the CO conversion (a), and the selectivity (b) as a function of O2 concentration at 45°C. CO 1%, H2 77.08% and He balance. Fig. 12 O2 conversion (a), CO conversion (b), and selectivity S (c) over 16% Ag/SiO2 catalysts treated with different gases as a function of the reaction temperature. Fig. 13 Stability of the 8% Ag/SiO2 catalyst for CO selective oxidation at 50°C. Table 1 Amounts of CO and O2 sorbed per gram of silver on the silica-supported silver catalysts with different loading Extrapolation (cc/G STP) 2% 4% 6% 8% 12% CO Total 1.4386 1.7282 2.0275 2.8596 3.1243 Reversible 1.3801 1.5765 1.8469 2.6272 2.6802 Irreversible 0.0366 0.1460 0.1845 0.2568 0.4417 O2 Total 0.9434 1.0106 1.1152 1.3532 1.5005 Reversible 0.9103 1.0033 1.1047 1.3428 1.4898 Irreversible 0.0366 0.0080 0.0113 0.0104 0.0107 Difference a 0.4952 0.7176 0.9123 1.5064 1.6238 a The difference between the total amounts of CO adsorbed and that of O2 adsorbed. Table 2 Characteristics of silver/silver compounds on the Ag/SiO2 catalyst pretreated with different gases at 500°C analyzed with XRD and TEM Oxygen Followed by H2 Hydrogen Followed by O2 TEM Particle size (nm) 11–18 6–10 XRD State Metal, oxide Metal Metal Metal Particle size (nm) 18 8 12 17 Table 3 Catalytic activities of silver catalysts supported on different supports Catalysts γ-Al2O3 CeO2 H-ZSM-5 (SiO2/Al2O3)=24) C MgO SiO2 TiO2 He 500°C/2h C CO (%) 13 7.94 – – 4.48 23.35 5.11 S (%) 15.85 9.07 – – 4.48 29.75 39.36 T CO (°C) 65 95 – – 150 60 130 Low-temperature selective oxidation of CO in H2-rich gases over Ag/SiO2 catalysts Zhenping Qu 1 Mojie Cheng Chuan Shi Xinhe Bao * State Key Laboratory of Catalysis, Dalian Institute of Chemical Physics, Chinese Academy of Sciences, 457 Zhongshan Road, P.O. Box 110, Dalian 116023, China * Corresponding author. Tel.: +86 411 84686637; fax: +86 411 84694447. 1 Present address: Institute of Physical Chemistry, University of Stuttgart, 70569 Stuttgart, Germany. Graphical abstract Both the maximum CO conversion and the corresponding selectivity increase with the Ag loading, and the silver catalyst with higher loading may apply more active oxygen species for CO oxidation. Factors influencing basic catalytic activity of Ag/SiO2 catalysts for CO selective oxidation in H2-rich gases, such as support, silver loading, oxygen concentration and reaction temperature, etc. were investigated. Among the supports used, SiO2 and the pure silica zeolite are better supports for silver catalyst. Ag/SiO2 catalyst has a better stabilization for CO selective oxidation at low temperatures. Carbon monoxide in the presence of large excess of hydrogen can be stoichiometrically oxidized by oxygen over Ag/SiO2 catalysts at low temperatures, and the catalytic activities increase with the increase of the silver loading. Low reaction temperature favors this process of selective oxidation of CO in H2-rich gas, and the selectivity of O2 to oxidize CO can reach 60–80%. The maximum conversion of CO under such selectivity levels for oxygen to oxidize CO also increases with the silver loading. XRD results show that the main species on all catalysts is crystallite silver, and the size of the silver particles increases with the silver loading. It is found that the CO conversion increases with increasing oxygen contents properly, however, CO is not consumed completely even when the overall concentration of O2 is increased to 3%. Pretreatment conditions have been found to strongly influence the activity and selectivity of the catalysts. The catalysts deactivate after pretreatment with hydrogen at 500°C, whereas a better activity is obtained after pretreatment with oxygen or He at the same temperature. Keywords Ag/SiO2 CO selective oxidation H2-rich gas 1 Introduction Polymer electrolyte membrane fuel cells (PEFCs), operating at a relatively low-temperature (e.g. 60–80°C) with pure hydrogen or reforming gases as fuels, have attracted much attention as power sources for electric vehicles [1,2]. However, at low-temperatures, the Pt anodes of the PEFC are extremely sensitive to and easily poisoned by traces of CO in the fuels [3]. When employing reforming gases, the CO concentration is generally ca. 1%, which is much higher than the 10ppm level desired for the PEFC. Therefore, it is essential to develop a method that can lower effectively the CO concentration in the reforming gases. Among the various methods available for CO removing, catalytic selective oxidation of CO seems to be a promising one and has been investigated extensively. Most catalysts employed previously are based on noble metals [4–9]. Pt/Al2O3 catalysts were reported to have a high activity and selectivity for the selective oxidation of CO; however, it requires more than 2% of oxygen to oxidize 1% of CO in H2-rich gases, which might result in a wasteful consumption of H2 and a risk of explosion [4,5]. Oh and Sinkevitch reported that Ru/Al2O3 and Rh/Al2O3 catalysts exhibited high activities for the selective oxidation of CO in H2-rich gases (900ppm CO, 800ppm O2 and 0.85vol% H2) [6,7]. However, the reaction temperature (200–250°C) over Pt, Rh catalysts is relatively high compared with that of PEFCs. Bethke has reported that selectivity of ca. 50% at 100°C was obtained over Au/γ-Al2O3 catalysts containing Au particles of about 5–10nm in size [8]. Basic factors influencing the activity and selectivity of catalysts for CO selective oxidation in H2 have also been widely investigated, which is very important for the application of the catalyst in the PEFCs and the research of the properties of the catalyst. The effect of the supports has also been investigated on the Au and Pt catalysts [9–11]. Igarashi and co-workers have shown that at high temperatures noble metal catalysts supported on mordenite and other zeolites possessed good selectivity for CO oxidation in H2 [7,10]. The better activity and selectivity can be obtained on the Au catalyst supported on the reducible oxide [11]. Reaction temperature and oxygen concentration in the feed gas were found to play an important role in the activity. Manasilp and Gulari have found that the best reaction activity of Pt/Al2O3 was obtained at 170°C, and CO can be completely oxidized when the oxygen concentration was increased to 1.35%, however, the selectivity increases with the decrease of the oxygen concentration [12]. Silver has been investigated and utilized as an oxidation catalyst [13,14], and supported silver catalysts have been proved to possess a stable activity for CO oxidation at low temperatures [15–17], e.g. complete CO oxidation over Ag/Mn/perovskite can be attained below 373K. Güldür and Balikci studied the Ag/Co and Ag/Mn composite oxide catalysts used in removing CO in H2-rich gases between 110 and 200°C. However, no obvious activity for CO selective oxidation was observed at the temperatures below 100°C [18]. Recently, we have shown that silver catalyst is a promising catalyst for the removal of CO in the fuels for PEFCs at low-temperatures [19–21]. We mainly focused on the activations of oxygen species and silver catalysts, and the effect of the formation of subsurface oxygen species on the CO oxidation. The formation of subsurface oxygen species increases the activity of the silver catalyst, and more reactant species can adsorb on the surface of silver catalyst. The presence of subsurface oxygen species supplies another way for CO oxidation. However, the basic factors influencing the activity of silver catalysts for CO selective oxidation are not carefully examined. In this paper, we concretely investigate the influence of reaction conditions, e.g. support, oxygen concentration, reaction temperature and silver loading, on the activity and selectivity. 2 Experimental 2.1 Catalyst preparation and characterization Silver catalysts supported on different supports were prepared by an incipient wetness impregnation method. The support was contacted with a certain amount of AgNO3 precursor solution under stirring. The as prepared AgNO3/support sample was then aged at RT and dried at 80°C for 12h. X-ray powder diffraction (XRD) experiments were carried out on a Rigaku D/max-γb X-ray diffractometer with monochromatic detector. Copper Kα radiation was used with power setting at 40kV and 100mA. Typical operation parameters were: a scan rate of 5°min−1. The size of the Ag particles was calculated from the half-width of the main peak at 2θ =38° according to the Scherrer's method [22]. Adsorption studies of CO and O2 were conducted in a Chemisorption 2800 instrument. Typically, the catalyst was treated in a flow of He at 500°C for 2h and degassed for 1h at the same temperature. The uptakes of CO and O2 were then measured at 35°C. TEM experiments were performed with the JEM-2000EX microscope, using an accelerating voltage of 100kV. For the TEM analysis, a sample was dispersed in absolute alcohol by an ultrasonic bath and deposited on a Formvar coated 200 mesh Cu grid. 2.2 Activity tests The reactions of selective oxidation of CO were carried out in a conventional flow reactor. The reactants were fed with a volume ratio of H2/CO/O2 =98.5/1/0.5, which were controlled by an independent thermal mass flow controller. While in the case of experiment for the effect of oxygen concentration on the activity and selectivity of catalysts, it consisted of 1vol% CO, 77.08vol% H2, O2 with varying O2:CO molar ratio (λ =1–4, 6) and He balance. The parameter λ is defined as the amount of oxygen present divided by the amount of oxygen needed to completely oxidize all of the CO in the feed gas (λ =2[O2]/[CO]), where λ =1 is sufficient to provide for the complete oxidation of CO to CO2 in the absence of an oxygen consuming side reaction. The total flow rate was 50ml/min. Typically, 0.25g of catalyst was used and pretreated under He, or 30% O2 in He, or highly pure hydrogen, at 773K for 2h. The temperature of the catalyst bed was monitored with a thermocouple that was put on the center of the reaction bed. On-line gas chromatograph with a TCD detector was employed to measure the reactor inlet and outlet effluent gas streams. Two columns were used: a molecular sieve 5A column (3m×4mm) was used to separate hydrogen, oxygen and carbon monoxide. A Porapak Q column (3m×4mm) was used to analyze carbon dioxide and H2O. Both columns were operated at a constant temperature of 30°C. Two parallel reactions occur in the present catalytic system: (1) CO + 1 2 O 2 → C O 2 (2) H 2 + 1 2 O 2 → H 2 O In this paper, the CO conversion was calculated from the change of the CO concentration: CO conversion = [ CO ] in − [ CO ] out [ CO ] in × 100 % , where [CO]in is the inlet CO concentration and [CO]out is the outlet CO concentration. The O2 conversion is based on oxygen consumption: O 2 conversion = [ O 2 ] in − [ O 2 ] out [ O 2 ] in × 100 % , where [O2]in is the inlet O2 concentration and [O2]out is the outlet O2 concentration. Selectivity towards CO2 was defined as the ratio of oxygen used to oxidize CO to CO2 over the total amount of oxygen consumption. S = Δ O 2 ( CO ) Δ O 2 ( CO ) + Δ O 2 ( H 2 O ) The amount of oxygen not used in oxidizing CO to CO2 was used to oxidize H2, which would reduce the amount of H2 used to feed into fuel cell. Then the selectivity should be large enough not to reduce the fuel efficiency. Because of the large error in the quantification of H2O, the selectivity of CO oxidation was calculated from the oxygen mass balance: S = 0.5 × [ C O 2 ] [ O 2 ] in − [ O 2 ] out × 100 % = 0.5 × C CO × [ CO ] in C O 2 × [ O 2 ] in = C CO λ × C O 2 where C CO is CO conversion and C O 2 is O2 conversion. A definition comparison of λ and S demonstrates that λ and S are interrelated. 3 Results and discussion 3.1 Catalyst characterization Fig. 1 shows the XRD patterns of silver catalysts (weight loading of 6%) supported on different supports. All catalysts were pretreated with He at 500°C for 2h. No diffraction peaks of silver species are observed when the silver is supported on the CeO2, Al2O3 and H-ZSM-5, indicating the silver species are finely dispersed on the support. The peaks for metallic silver particles appear on the SiO2, MgO, C and TiO2. According to the Scherrer's method, the size of silver particles is about 8nm for Ag/SiO2 catalyst. The half-width of the diffraction peak at 2θ =38° becomes sharp when supported on the MgO, C and TiO2, and the larger silver particles are formed. Different particle size is obtained when silver is supported on different supports. It is reasonable to think this phenomenon is related with the different properties of supports. Lower BET surface area of MgO (38.22m2/g), C (5.49m2/g) and TiO2 (11.76m2/g) will result in the poor dispersion of silver particles. However, a fine dispersion can still be obtained, though the BET surface area of CeO2 (74.54m2/g), Al2O3 (240.23m2/g) is lower than that of SiO2 (495m2/g). A strong interaction of silver species with CeO2 and Al2O3 is easily formed [23,24], meanwhile the properties of silver particles are changed. Powder XRD patterns of the Ag/SiO2 catalysts with various Ag loadings and that of a reference SiO2 sample are shown in Fig. 2 . All samples were pretreated under He atmosphere at 500°C. No diffraction peaks of silver or silver compounds are detected on the 2% Ag/SiO2 sample, indicating that silver species are well dispersed. Metallic silver, the main peak of which is at 2θ =38° and corresponding to the (111) plane of silver, appears in the high loading silver/silica samples. The crystallite sizes, determined by Scherrer's method from the XRD peak broadening, are 5.7, 8, 14, 16.5 and 18nm, respectively. The particle size of silver catalyst increases with the silver loading. When the silver loading of the catalyst is higher than 16%, the average size of the Ag particles does not change obviously (not shown here). A small peak appears at 2θ =33° for the Ag/SiO2 catalysts with Ag loadings higher than 8%. Table 1 shows the amounts of CO and O2 adsorbed per gram of silver on silica-supported catalysts with different silver loadings. As can be seen, the reversible adsorption for oxygen is the dominant adsorption at this temperature. Moreover, both the total amounts of adsorption of CO and O2 at 35°C and the difference between the adsorbed amounts of CO and O2 increases with the silver loading. To understand the difference in characteristics between the Ag/SiO2 catalysts treated with hydrogen and that with oxygen, the catalysts are characterized by XRD and TEM. The size distribution of silver particles after different treatment is shown in Table 2 . Only a range of the mean size of the silver particles is given in Table 2, due to the limit of the particle numbers. Fig. 3 shows the XRD patterns of the 16% Ag/SiO2 pretreated under oxygen and hydrogen atmospheres at 500°C, respectively. It can be clearly seen that the atmosphere employed in the pretreatment has a great influence on the size and structure of the Ag particles. The XRD pattern of the 16% Ag/SiO2 treated with oxygen at 500°C for 2h shows diffraction peaks corresponding to metal silver particles with average size of about 18nm, as well as ultrafine silver oxide species (2θ =33°) (Fig. 3A(a)). After the sample is purged with hydrogen at the same temperature for 1h, the diffraction peak of the silver oxide species disappears, and the average size of the silver particles decreases to about 8nm (Fig. 3A(b)). If the 16% Ag/SiO2 sample is firstly pretreated with highly pure hydrogen at 500°C for 2h, only metal silver particles with average size of about 12nm are observed by XRD (Fig. 3B(c)). The average size of the metallic silver particles (about 17nm) obviously increases after the sample (Fig. 3B(c)) is purged by oxygen at the same temperature for 1h (Fig. 3B(d)). However, in this case, no diffraction peak of silver oxide can be detected. Yang et al. have reported on the thermal stabilities of uniform silver clusters prepared on oxidized silicon and aluminum surface in oxidizing and reducing atmospheres [25]. The thermal stability of the silver cluster was significantly lower under the oxidizing conditions, and heating above 623–673K under the oxidizing conditions induced a migration of the silver cluster. Aoyama et al. have also shown that oxidation induced a size growth of the particles. On the contrary, metallic silver particles were finely dispersed by the reduction process [26]. For the Ag/SiO2 catalysts, it can also be obtained according to the characterization results that pretreatment at 500°C in oxygen favors the migration and aggregation of metal silver particles on the support, while following pretreatment at 500°C in hydrogen favors the dispersion of the silver particles. TEM results also confirm this conclusion. As shown in Fig. 4 , the mean silver particle size of the Ag/SiO2 catalyst treated with oxygen is larger than that treated with hydrogen. The detailed explanation about the aggregation of silver particle after oxygen treatment at high temperatures can be found in Ref. [20]. 3.2 Catalytic properties 3.2.1 Effects of supports on the activity and selectivity Table 3 shows the catalytic activity of silver catalyst supported on the different supports. The maximum CO conversion, the corresponding O2 selectivity and the reaction temperature are presented. No CO conversion is observed on the silver catalyst supported on the zeolite H-ZSM-5 (SiO2/Al2O3 =24) and activated carbon during the detection temperatures, moreover the oxygen is completely conversed only at the temperature higher than 140 and 220°C. The catalytic activity of silver catalyst supported on different supports follows: SiO2 >Al2O3 >CeO2 >TiO2 >MgO≫H-ZSM-5 (SiO2/Al2O3 =24) and activated carbon. It has been known from XRD patterns that a fine dispersion of silver particles on the Al2O3, CeO2 and H-ZSM-5 is obtained and larger silver particle is observed on the MgO and C supports. So it is thought that the main reason for the higher catalytic activity for CO selective oxidation over silver catalyst is not due to the smaller or larger size of silver particles, and should be related with the properties of support and the interaction between support and silver particles. The catalytic activities of silver catalyst supported on the H-ZSM-5 with different SiO2/Al2O3 ratio are also tested, as shown in Fig. 5 . The best catalytic activity is obtained on the silver catalyst supported on the pure-silica-zeolite H-ZSM-5, and the activity decreases with the decreasing of SiO2/Al2O3 ratio. The Al2O3 in the zeolite easily interacts with the silver species supported, and changes the properties of silver particles dispersed on the support. From the above results, we can also get that the reaction for CO selective oxidation over silver catalyst does not need the acidity of the support. Then the MCM-41 and SBA-15 zeolites are also chosen to support silver particles to examine the activity of silver catalyst and the effect of support. The CO conversion of about 30% at 45–50°C can be obtained, which is very similar with that of silver catalyst supported on SiO2. Anyway, the silica and the pure silica zeolites are better supports for silver catalyst. The effects of support on the properties of silver species and the catalytic activity need to be further investigated in the future. In the following research, SiO2 is chosen as the support of silver catalyst. 3.2.2 Effects of silver loading The catalytic behaviors of the Ag/SiO2 catalysts with various Ag loadings for the selective oxidation of CO in H2 atmosphere are shown in Fig. 6 . The same pretreatment is done before the activity tests. No activity was found on the SiO2 support for the selective oxidation of CO. Over all catalysts, the O2 conversion increases monotonously with the reaction temperature, and oxygen can be totally consumed above a certain temperature. The oxygen conversion at the same temperature also increases with the silver loading. It is interesting to note that the CO conversion curves are “volcano-shaped” on all of the catalysts. The temperature corresponding to maximum CO conversion decreases with the increase of the silver loading. Furthermore, the maximum CO conversion again increases with the silver loading, which is consistent with the result of Table 1, namely the adsorption amounts of CO and O2 increase with the silver loading. It is found that there is little change for the oxygen and CO conversions over the catalysts with silver loadings higher than 16% (not shown here). On the other hand, the selectivity for CO oxidation of the catalysts decreases with the reaction temperature, which indicates that the consumption of oxygen at high temperatures is mostly contributed by the oxidation of hydrogen. Therefore, for CO selective oxidation over the Ag/SiO2 catalysts, oxygen preferentially reacts with carbon monoxide at low temperatures, but with hydrogen at high temperatures. In other words, Ag/SiO2 catalysts seem to be a kind of promising catalysts for the selective oxidation of carbon monoxide at low temperatures. The effects of silver loading on the activity of Ag/SiO2 catalysts for selective CO oxidation can be seen more clearly in the Figs. 7 and 8 . Fig. 7 shows the maximum CO conversion and corresponding selectivity over Ag/SiO2 catalysts with different silver loadings. Both the maximum CO conversion and the corresponding selectivity increase with the Ag loading. The temperatures corresponding to the oxygen complete conversion and the maximum CO conversion decrease with the increase of the Ag loading, as shown in Fig. 8. The reaction rates of Ag/SiO2 with different silver loading at 30°C are shown in Fig. 9 . The reaction rate of the catalyst for CO selective oxidation increases with silver loading at low temperatures, however, the increase is not linearity. That is to say that the silver species loaded on supports does not completely exert the role of catalytic sites for CO selective oxidation. It has been found that more bulk oxygen species form, and the initial temperature of reaction for CO with surface oxygen species decreases obviously for silver catalysts with higher loading after treated with He at 500°C [27]. When the silver loading is increased, the ability of supplying active oxygen species of silver catalysts increases obviously. We believe that the activity increase of the silver catalyst should be related with the structure (oxygen species) of silver particles. 3.2.3 O2 effect To avoid an accidental explosion, the feed gas consisted of 1% CO, 77.08% H2, oxygen and He balance. Fig. 10 shows the CO conversion, oxygen conversion and selectivity for different λ as a function of temperature. In all cases, there exists a maximum value for CO conversion, and oxygen can be totally consumed above a certain temperature (50°C). The selectivity towards CO2 is not changed obviously at low temperatures. However, the slopes of the curves for oxygen conversion, CO conversion and the selectivity become larger above 45°C with increasing λ. That is to say that above certain temperature hydrogen can react with oxygen quickly, at the same time the CO conversion and selectivity decrease sharply with increasing oxygen concentration. Oxygen preferentially reacts with hydrogen at high temperatures; moreover it becomes stronger and more obvious with high oxygen concentration. This means that most of the oxygen added is used for the oxidation of hydrogen under such a condition. Changes in the activities for the oxidation of CO on the oxygen content in the feed gas at 45°C are shown in Fig. 11 . When increasing the oxygen content to 1%, the CO conversion increases from 43.72 to 61.88%. At high O2:CO ratio (λ =3) the CO conversion is 64.96%. However, no obvious increase of CO conversion is observed for increasing oxygen concentration further. Only 0.5% oxygen is necessary for stoichiometric oxidation of 1% CO, but CO still remains in the outlet gas even in case of the 3% oxygen on silver catalysts. The CO is not converted completely even in excess of oxygen. The selectivity is plotted against the oxygen concentration in Fig. 11b. The selectivity is increased by reducing the oxygen concentration at 45°C, and it decreases sharply when the oxygen concentration is increased to 1.5%. The oxygen concentration of 1% in the feed gas is suitable to oxidize CO in a large excess of hydrogen on Ag/SiO2 catalysts, taking into consideration both the high CO conversion, the high selectivity and the high safety for the oxidation of CO. 3.2.4 Activity after pretreatment with H2, O2 and He at 500°C Fig. 12 shows the catalytic behaviors of the 16% Ag/SiO2 pretreated in different atmospheres (O2, H2, He) at 500°C. It can be clearly seen that the pretreatment conditions strongly influenced the activity and selectivity of the catalysts towards the selective oxidation of CO. The O2 conversion can reach 100% for all catalysts treated under the three different gases. However, the O2 pretreated and the He pretreated catalysts exhibit higher activity and selectivity at low temperatures than those of the H2 pretreated catalyst. Meima et al. have reported that a severe deactivation of an alumina supported silver catalyst for CO oxidation occurred after reduction at 400°C and subsequent cooling in nitrogen [28]. Accordingly, similar deactivation phenomenon of the Ag/SiO2 catalyst treated with hydrogen at high temperatures can also be observed. It has been reported that larger silver particles were present on Ag/ZrO2 with high loadings, but were not present at lower silver contents, and the catalysts with high loadings were more active for the complete oxidation of methane [29]. Therefore, the small number of surface defects and the low reactivity of the predominant (111) face could explain the low activities of the catalysts, and larger silver particles appear to be polycrystalline with a large number of defects and grain boundaries, which increased the reaction activity [29]. In this paper, the size of silver particles and activity of catalysts also increase with the silver loading, moreover XRD results indicate that the metal silver particle sizes for the O2 pretreated and He pretreated catalysts are similar and are much larger than that of the H2 pretreated catalyst (Fig. 3). From the results above, it is believed that the polycrystalline formation due to the aggregation of silver particles is in favor of the reaction for CO selective oxidation and the increase of the adsorption ability of the catalyst. On the other hand, it has been reported that the formation of subsurface oxygen species on the silver surface would result in an activity increase of some reactions [30,31]. Moreover, in our research we found the formation of the subsurface oxygen species after pretreatment with oxygen or He at certain temperatures and its higher activity [20], and also observed the increasing of the amount of subsurface oxygen species with silver loading [27]. Reports of strongly adsorbed subsurface oxygen species associated with silver catalysts are prevalent in the literature, and evidence that large silver particles favors the formation of subsurface oxygen and oxygen can remain occluded in large silver particles after prolonged evacuation at 500°C [32]. Therefore, small silver particles have to aggregate into large one prior to the formation of the special silver-oxygen compound. Higher oxygen pretreatment temperature is required on the silver catalyst with low loading, which possesses smaller silver particle size, in order to obtain a higher reaction activity [20]. Interestingly, the deactivated catalyst can be re-activated after re-pretreatment with oxygen. The deactivation of silver catalyst after pretreatment with H2 at high temperatures is mainly due to the structure change of silver particles compared with that after oxygen pretreatment, and the absence of subsurface oxygen species. The stability of the 8% Ag/SiO2 catalyst for the selective oxidation of CO at a 50°C is shown in Fig. 13 . During this study, all of the catalysts show good stabilities. Only an initial activity decreasing within the first hour of the stream time was observed. Then a steady state is acquired. These observations of ours are consistent with some previous observations, in which the deactivation processes were investigated during the kinetic studies on CO selective oxidation on Au/α-Fe2O3 and CO oxidation on Au/TiO2, and the authors concluded that the steady states could only be attained after a period of time [33,34]. 4 Conclusions The effects of the supports, silver loading, oxygen concentration and pretreatment conditions on the activity and selectivity for CO selective oxidation are investigated in this paper. SiO2 and the pure silica zeolites are found to be better supports for silver catalyst. The activity and selectivity for CO oxidation as well as the CO maximum conversion increase with the silver loading. XRD patterns show that the intensity of the metallic silver peak and the size of the silver particles increase with the silver loading. The CO conversion increases with increasing oxygen concentration properly. However, the CO is not consumed completely even in case of 3% oxygen in the feed gas. The selectivity at low temperatures is not changed obviously, but the selectivity above 45°C decreases with oxygen concentration sharply. Above a certain temperature hydrogen reacts with oxygen easily and sharply. A pretreatment process exerts a strong influence on the activities of these catalysts towards CO selective oxidation. Under different pretreatment conditions, a change in the particle size and structure of silver occurs, which could influence the activity for CO oxidation. We also find that oxidation induces the aggregation of silver particles at high temperatures, whereas metallic silver can be caused to be finely dispersed by the reduction process. High activity and selectivity for CO oxidation are obtained over an Ag/SiO2 catalyst pretreated under oxygen atmosphere. The reversibility of changes in activity and selectivity for CO oxidation indicates that the activity and selectivity of silver catalysts might be related with the structure of silver particles. Acknowledgements We are grateful to the Chinese Ministry of Science and Technology and the Natural Science Foundation of China for support of this work. References [1] R.A. Lemons J. Power Sources 29 1990 251 [2] A.J. Appleby F.R. Foulkes Fuel Cell Handbook 1989 van Nostrand Reinhold New York [3] S. Gottesfeld J. Pafford J. Electrochem. Soc. 135 1988 2651 [4] M.J. Kahlich H.A. Gasteiger R.J. Behm J. Catal. 171 1997 93 [5] M.M. Schubert H.A. Gasteiger R.J. Behm J. Catal. 172 1997 256 [6] S.H. Oh R.M. Sinkevitch J. Catal. 142 1993 254 [7] H. Igarashi H. Uchida M. Watanabe Chem. Lett. 29 2000 1262 [8] G.K. Bethke H.H. Kung Appl. Catal. A 194 2000 43 [9] H. Igarashi H. Uchida M. Suzuki Y. Sasaki M. Watanabe Appl. Catal. A 159 1997 159 [10] M. Watanabe H. Uchida H. Igarashi M. Suzuki Chem. Lett. 24 1995 21 [11] M.M. Schubert V. Plzak J. Garche R.J. Behm Catal. Lett. 76 2001 143 [12] A. Manasilp E.E. Gulari Appl. Catal. B 37 2002 17 [13] K. Tamaru Appl. Catal. A 151 1997 167 [14] J.G. Serafin A.C. Liu S.R. Seyedmonir J. Mol. Catal. A 131 1998 157 [15] G.G. Xia Y.G. Yin W.S. Willis J.Y. Wang S.L. Suib J. Catal. 185 1999 91 [16] S. Imamura H. Yamada K. Utani Appl. Catal. A 192 2000 226 [17] K. Song S. Kang S.D. Kim Catal. Lett. 49 1997 65 [18] C. Güldür F. Balikci Int. J. Hydrogen Energy 27 2002 219 [19] Z.P. Qu M.J. Cheng X.L. Dong X.H. Bao Catal. Today 93 2004 247 [20] Z.P. Qu M.J. Cheng W.X. Huang X.H. Bao J. Catal. 229 2005 446 [21] Z.P. Qu S.T. Zhou W.C. Wu C. Li X.H. Bao Catal. Lett. 101 2005 21 [22] P. Scherrer Goettingen Nachr. 2 1918 98 [23] S. Imamura H. Yamada K. Utani Appl. Catal. A 192 2000 221 [24] M.C. Kung K.A. Bethke J. Yan J.H. Lee H.H. Kung Appl. Surf. Sci. 121 1997 261 [25] M.X. Yang P.W. Jacobs C. Yoon L. Muray E. Anderson D. Attwood G.A. Somorfai Catal. Lett. 45 1997 5 [26] N. Aoyama K. Yoshida A. Abe T. Miyadera Catal. Lett. 43 1997 249 [27] Z.P. Qu M.J. Cheng C. Shi X.H. Bao Chin. J. Catal. 23 2002 460 464 [28] G.R. Meima L.K. Knijff A.J. Van Dillen J.W. Geus J. Chem. Soc., Faraday Trans. I 85 1989 293 [29] Lj. Kundakovic M. Flytzani-Stephanopoulos Appl. Catal. A 183 1999 35 [30] C. Backx J. Moolhuysen P. Geenen R.A. Van Santen J. Catal. 72 1981 364 [31] X. Bao J. Barth G. Lempfuhl R. Schuster Y. Uchida R. Schlögl G. Ertl Surf. Sci. 284 1993 14 [32] Y.L. Sandler W.M. Hickam W.M.H. Sachtler G.C.A. Schuit P. Zwietering Proceeding of Third International Congress on Catalysis, Amsterdam, vol. 1 1964 227 [33] M.J. Kahlich H.A. Gasteiger R.J. Behm J. Catal. 182 1999 430 [34] M.A. Bollinger M.A. Vannice Appl. Catal. B 8 1996 417",
      "scopus-id": "23344450543",
      "coredata": {
        "eid": "1-s2.0-S1381116905003699",
        "dc:description": "Factors influencing basic catalytic activity of Ag/SiO2 catalysts for CO selective oxidation in H2-rich gases, such as support, silver loading, oxygen concentration and reaction temperature, etc. were investigated. Among the supports used, SiO2 and the pure silica zeolite are better supports for silver catalyst. Ag/SiO2 catalyst has a better stabilization for CO selective oxidation at low temperatures. Carbon monoxide in the presence of large excess of hydrogen can be stoichiometrically oxidized by oxygen over Ag/SiO2 catalysts at low temperatures, and the catalytic activities increase with the increase of the silver loading. Low reaction temperature favors this process of selective oxidation of CO in H2-rich gas, and the selectivity of O2 to oxidize CO can reach 60–80%. The maximum conversion of CO under such selectivity levels for oxygen to oxidize CO also increases with the silver loading. XRD results show that the main species on all catalysts is crystallite silver, and the size of the silver particles increases with the silver loading. It is found that the CO conversion increases with increasing oxygen contents properly, however, CO is not consumed completely even when the overall concentration of O2 is increased to 3%. Pretreatment conditions have been found to strongly influence the activity and selectivity of the catalysts. The catalysts deactivate after pretreatment with hydrogen at 500°C, whereas a better activity is obtained after pretreatment with oxygen or He at the same temperature.",
        "openArchiveArticle": "false",
        "prism:coverDate": "2005-09-14",
        "openaccessUserLicense": null,
        "prism:aggregationType": "Journal",
        "prism:url": "https://api.elsevier.com/content/article/pii/S1381116905003699",
        "dc:creator": [
          {
            "@_fa": "true",
            "$": "Qu, Zhenping"
          },
          {
            "@_fa": "true",
            "$": "Cheng, Mojie"
          },
          {
            "@_fa": "true",
            "$": "Shi, Chuan"
          },
          {
            "@_fa": "true",
            "$": "Bao, Xinhe"
          }
        ],
        "link": [
          {
            "@_fa": "true",
            "@rel": "self",
            "@href": "https://api.elsevier.com/content/article/pii/S1381116905003699"
          },
          {
            "@_fa": "true",
            "@rel": "scidir",
            "@href": "https://www.sciencedirect.com/science/article/pii/S1381116905003699"
          }
        ],
        "dc:format": "application/json",
        "openaccessType": null,
        "pii": "S1381-1169(05)00369-9",
        "prism:volume": "239",
        "prism:publisher": "Published by Elsevier B.V.",
        "dc:title": "Low-temperature selective oxidation of CO in H2-rich gases over Ag/SiO2 catalysts",
        "prism:copyright": "Copyright © 2005 Published by Elsevier B.V.",
        "openaccess": "0",
        "prism:issn": "13811169",
        "prism:issueIdentifier": "1-2",
        "dcterms:subject": [
          {
            "@_fa": "true",
            "$": "Ag/SiO2"
          },
          {
            "@_fa": "true",
            "$": "CO selective oxidation"
          },
          {
            "@_fa": "true",
            "$": "H2-rich gas"
          }
        ],
        "openaccessArticle": "false",
        "prism:publicationName": "Journal of Molecular Catalysis A: Chemical",
        "prism:number": "1-2",
        "openaccessSponsorType": null,
        "prism:pageRange": "22-31",
        "prism:endingPage": "31",
        "pubType": "fla",
        "prism:coverDisplayDate": "14 September 2005",
        "prism:doi": "10.1016/j.molcata.2005.05.033",
        "prism:startingPage": "22",
        "dc:identifier": "doi:10.1016/j.molcata.2005.05.033",
        "openaccessSponsorName": null
      },
      "objects": {
        "object": [
          {
            "@category": "thumbnail",
            "@height": "21",
            "@width": "132",
            "@_fa": "true",
            "$": "https://api.elsevier.com/content/object/eid/1-s2.0-S1381116905003699-si1.gif?httpAccept=%2A%2F%2A",
            "@multimediatype": "GIF image file",
            "@type": "ALTIMG",
            "@size": "487",
            "@ref": "si1",
            "@mimetype": "image/gif"
          },
          {
            "@category": "thumbnail",
            "@height": "91",
            "@width": "374",
            "@_fa": "true",
            "$": "https://api.elsevier.com/content/object/eid/1-s2.0-S1381116905003699-si6.gif?httpAccept=%2A%2F%2A",
            "@multimediatype": "GIF image file",
            "@type": "ALTIMG",
            "@size": "2146",
            "@ref": "si6",
            "@mimetype": "image/gif"
          },
          {
            "@category": "thumbnail",
            "@height": "21",
            "@width": "131",
            "@_fa": "true",
            "$": "https://api.elsevier.com/content/object/eid/1-s2.0-S1381116905003699-si2.gif?httpAccept=%2A%2F%2A",
            "@multimediatype": "GIF image file",
            "@type": "ALTIMG",
            "@size": "534",
            "@ref": "si2",
            "@mimetype": "image/gif"
          },
          {
            "@category": "thumbnail",
            "@height": "16",
            "@width": "27",
            "@_fa": "true",
            "$": "https://api.elsevier.com/content/object/eid/1-s2.0-S1381116905003699-si7.gif?httpAccept=%2A%2F%2A",
            "@multimediatype": "GIF image file",
            "@type": "ALTIMG",
            "@size": "206",
            "@ref": "si7",
            "@mimetype": "image/gif"
          },
          {
            "@category": "thumbnail",
            "@height": "43",
            "@width": "182",
            "@_fa": "true",
            "$": "https://api.elsevier.com/content/object/eid/1-s2.0-S1381116905003699-si5.gif?httpAccept=%2A%2F%2A",
            "@multimediatype": "GIF image file",
            "@type": "ALTIMG",
            "@size": "936",
            "@ref": "si5",
            "@mimetype": "image/gif"
          },
          {
            "@category": "thumbnail",
            "@height": "40",
            "@width": "295",
            "@_fa": "true",
            "$": "https://api.elsevier.com/content/object/eid/1-s2.0-S1381116905003699-si4.gif?httpAccept=%2A%2F%2A",
            "@multimediatype": "GIF image file",
            "@type": "ALTIMG",
            "@size": "1388",
            "@ref": "si4",
            "@mimetype": "image/gif"
          },
          {
            "@category": "thumbnail",
            "@height": "40",
            "@width": "307",
            "@_fa": "true",
            "$": "https://api.elsevier.com/content/object/eid/1-s2.0-S1381116905003699-si3.gif?httpAccept=%2A%2F%2A",
            "@multimediatype": "GIF image file",
            "@type": "ALTIMG",
            "@size": "1538",
            "@ref": "si3",
            "@mimetype": "image/gif"
          },
          {
            "@category": "standard",
            "@height": "297",
            "@width": "358",
            "@_fa": "true",
            "$": "https://api.elsevier.com/content/object/eid/1-s2.0-S1381116905003699-gr1.jpg?httpAccept=%2A%2F%2A",
            "@multimediatype": "JPEG image file",
            "@type": "IMAGE-DOWNSAMPLED",
            "@size": "27044",
            "@ref": "gr1",
            "@mimetype": "image/jpeg"
          },
          {
            "@category": "thumbnail",
            "@height": "93",
            "@width": "112",
            "@_fa": "true",
            "$": "https://api.elsevier.com/content/object/eid/1-s2.0-S1381116905003699-gr1.sml?httpAccept=%2A%2F%2A",
            "@multimediatype": "GIF image file",
            "@type": "IMAGE-THUMBNAIL",
            "@size": "2469",
            "@ref": "gr1",
            "@mimetype": "image/gif"
          },
          {
            "@category": "standard",
            "@height": "844",
            "@width": "746",
            "@_fa": "true",
            "$": "https://api.elsevier.com/content/object/eid/1-s2.0-S1381116905003699-gr10.jpg?httpAccept=%2A%2F%2A",
            "@multimediatype": "JPEG image file",
            "@type": "IMAGE-DOWNSAMPLED",
            "@size": "91231",
            "@ref": "gr10",
            "@mimetype": "image/jpeg"
          },
          {
            "@category": "thumbnail",
            "@height": "93",
            "@width": "82",
            "@_fa": "true",
            "$": "https://api.elsevier.com/content/object/eid/1-s2.0-S1381116905003699-gr10.sml?httpAccept=%2A%2F%2A",
            "@multimediatype": "GIF image file",
            "@type": "IMAGE-THUMBNAIL",
            "@size": "2133",
            "@ref": "gr10",
            "@mimetype": "image/gif"
          },
          {
            "@category": "standard",
            "@height": "580",
            "@width": "364",
            "@_fa": "true",
            "$": "https://api.elsevier.com/content/object/eid/1-s2.0-S1381116905003699-gr11.jpg?httpAccept=%2A%2F%2A",
            "@multimediatype": "JPEG image file",
            "@type": "IMAGE-DOWNSAMPLED",
            "@size": "39705",
            "@ref": "gr11",
            "@mimetype": "image/jpeg"
          },
          {
            "@category": "thumbnail",
            "@height": "92",
            "@width": "58",
            "@_fa": "true",
            "$": "https://api.elsevier.com/content/object/eid/1-s2.0-S1381116905003699-gr11.sml?httpAccept=%2A%2F%2A",
            "@multimediatype": "GIF image file",
            "@type": "IMAGE-THUMBNAIL",
            "@size": "2170",
            "@ref": "gr11",
            "@mimetype": "image/gif"
          },
          {
            "@category": "standard",
            "@height": "724",
            "@width": "365",
            "@_fa": "true",
            "$": "https://api.elsevier.com/content/object/eid/1-s2.0-S1381116905003699-gr12.jpg?httpAccept=%2A%2F%2A",
            "@multimediatype": "JPEG image file",
            "@type": "IMAGE-DOWNSAMPLED",
            "@size": "46715",
            "@ref": "gr12",
            "@mimetype": "image/jpeg"
          },
          {
            "@category": "thumbnail",
            "@height": "93",
            "@width": "47",
            "@_fa": "true",
            "$": "https://api.elsevier.com/content/object/eid/1-s2.0-S1381116905003699-gr12.sml?httpAccept=%2A%2F%2A",
            "@multimediatype": "GIF image file",
            "@type": "IMAGE-THUMBNAIL",
            "@size": "1664",
            "@ref": "gr12",
            "@mimetype": "image/gif"
          },
          {
            "@category": "standard",
            "@height": "245",
            "@width": "372",
            "@_fa": "true",
            "$": "https://api.elsevier.com/content/object/eid/1-s2.0-S1381116905003699-gr13.jpg?httpAccept=%2A%2F%2A",
            "@multimediatype": "JPEG image file",
            "@type": "IMAGE-DOWNSAMPLED",
            "@size": "21697",
            "@ref": "gr13",
            "@mimetype": "image/jpeg"
          },
          {
            "@category": "thumbnail",
            "@height": "82",
            "@width": "125",
            "@_fa": "true",
            "$": "https://api.elsevier.com/content/object/eid/1-s2.0-S1381116905003699-gr13.sml?httpAccept=%2A%2F%2A",
            "@multimediatype": "GIF image file",
            "@type": "IMAGE-THUMBNAIL",
            "@size": "2439",
            "@ref": "gr13",
            "@mimetype": "image/gif"
          },
          {
            "@category": "standard",
            "@height": "271",
            "@width": "357",
            "@_fa": "true",
            "$": "https://api.elsevier.com/content/object/eid/1-s2.0-S1381116905003699-gr2.jpg?httpAccept=%2A%2F%2A",
            "@multimediatype": "JPEG image file",
            "@type": "IMAGE-DOWNSAMPLED",
            "@size": "35855",
            "@ref": "gr2",
            "@mimetype": "image/jpeg"
          },
          {
            "@category": "thumbnail",
            "@height": "93",
            "@width": "123",
            "@_fa": "true",
            "$": "https://api.elsevier.com/content/object/eid/1-s2.0-S1381116905003699-gr2.sml?httpAccept=%2A%2F%2A",
            "@multimediatype": "GIF image file",
            "@type": "IMAGE-THUMBNAIL",
            "@size": "3655",
            "@ref": "gr2",
            "@mimetype": "image/gif"
          },
          {
            "@category": "standard",
            "@height": "525",
            "@width": "361",
            "@_fa": "true",
            "$": "https://api.elsevier.com/content/object/eid/1-s2.0-S1381116905003699-gr3.jpg?httpAccept=%2A%2F%2A",
            "@multimediatype": "JPEG image file",
            "@type": "IMAGE-DOWNSAMPLED",
            "@size": "43704",
            "@ref": "gr3",
            "@mimetype": "image/jpeg"
          },
          {
            "@category": "thumbnail",
            "@height": "93",
            "@width": "64",
            "@_fa": "true",
            "$": "https://api.elsevier.com/content/object/eid/1-s2.0-S1381116905003699-gr3.sml?httpAccept=%2A%2F%2A",
            "@multimediatype": "GIF image file",
            "@type": "IMAGE-THUMBNAIL",
            "@size": "2029",
            "@ref": "gr3",
            "@mimetype": "image/gif"
          },
          {
            "@category": "standard",
            "@height": "730",
            "@width": "357",
            "@_fa": "true",
            "$": "https://api.elsevier.com/content/object/eid/1-s2.0-S1381116905003699-gr4.jpg?httpAccept=%2A%2F%2A",
            "@multimediatype": "JPEG image file",
            "@type": "IMAGE-DOWNSAMPLED",
            "@size": "122162",
            "@ref": "gr4",
            "@mimetype": "image/jpeg"
          },
          {
            "@category": "thumbnail",
            "@height": "92",
            "@width": "45",
            "@_fa": "true",
            "$": "https://api.elsevier.com/content/object/eid/1-s2.0-S1381116905003699-gr4.sml?httpAccept=%2A%2F%2A",
            "@multimediatype": "GIF image file",
            "@type": "IMAGE-THUMBNAIL",
            "@size": "1760",
            "@ref": "gr4",
            "@mimetype": "image/gif"
          },
          {
            "@category": "standard",
            "@height": "263",
            "@width": "359",
            "@_fa": "true",
            "$": "https://api.elsevier.com/content/object/eid/1-s2.0-S1381116905003699-gr5.jpg?httpAccept=%2A%2F%2A",
            "@multimediatype": "JPEG image file",
            "@type": "IMAGE-DOWNSAMPLED",
            "@size": "20029",
            "@ref": "gr5",
            "@mimetype": "image/jpeg"
          },
          {
            "@category": "thumbnail",
            "@height": "92",
            "@width": "125",
            "@_fa": "true",
            "$": "https://api.elsevier.com/content/object/eid/1-s2.0-S1381116905003699-gr5.sml?httpAccept=%2A%2F%2A",
            "@multimediatype": "GIF image file",
            "@type": "IMAGE-THUMBNAIL",
            "@size": "2020",
            "@ref": "gr5",
            "@mimetype": "image/gif"
          },
          {
            "@category": "standard",
            "@height": "250",
            "@width": "364",
            "@_fa": "true",
            "$": "https://api.elsevier.com/content/object/eid/1-s2.0-S1381116905003699-gr7.jpg?httpAccept=%2A%2F%2A",
            "@multimediatype": "JPEG image file",
            "@type": "IMAGE-DOWNSAMPLED",
            "@size": "20294",
            "@ref": "gr7",
            "@mimetype": "image/jpeg"
          },
          {
            "@category": "thumbnail",
            "@height": "86",
            "@width": "125",
            "@_fa": "true",
            "$": "https://api.elsevier.com/content/object/eid/1-s2.0-S1381116905003699-gr7.sml?httpAccept=%2A%2F%2A",
            "@multimediatype": "GIF image file",
            "@type": "IMAGE-THUMBNAIL",
            "@size": "2416",
            "@ref": "gr7",
            "@mimetype": "image/gif"
          },
          {
            "@category": "standard",
            "@height": "253",
            "@width": "361",
            "@_fa": "true",
            "$": "https://api.elsevier.com/content/object/eid/1-s2.0-S1381116905003699-gr8.jpg?httpAccept=%2A%2F%2A",
            "@multimediatype": "JPEG image file",
            "@type": "IMAGE-DOWNSAMPLED",
            "@size": "17781",
            "@ref": "gr8",
            "@mimetype": "image/jpeg"
          },
          {
            "@category": "thumbnail",
            "@height": "88",
            "@width": "125",
            "@_fa": "true",
            "$": "https://api.elsevier.com/content/object/eid/1-s2.0-S1381116905003699-gr8.sml?httpAccept=%2A%2F%2A",
            "@multimediatype": "GIF image file",
            "@type": "IMAGE-THUMBNAIL",
            "@size": "2243",
            "@ref": "gr8",
            "@mimetype": "image/gif"
          },
          {
            "@category": "standard",
            "@height": "273",
            "@width": "359",
            "@_fa": "true",
            "$": "https://api.elsevier.com/content/object/eid/1-s2.0-S1381116905003699-gr9.jpg?httpAccept=%2A%2F%2A",
            "@multimediatype": "JPEG image file",
            "@type": "IMAGE-DOWNSAMPLED",
            "@size": "17164",
            "@ref": "gr9",
            "@mimetype": "image/jpeg"
          },
          {
            "@category": "thumbnail",
            "@height": "94",
            "@width": "123",
            "@_fa": "true",
            "$": "https://api.elsevier.com/content/object/eid/1-s2.0-S1381116905003699-gr9.sml?httpAccept=%2A%2F%2A",
            "@multimediatype": "GIF image file",
            "@type": "IMAGE-THUMBNAIL",
            "@size": "1932",
            "@ref": "gr9",
            "@mimetype": "image/gif"
          },
          {
            "@category": "standard",
            "@height": "706",
            "@width": "372",
            "@_fa": "true",
            "$": "https://api.elsevier.com/content/object/eid/1-s2.0-S1381116905003699-gr6.jpg?httpAccept=%2A%2F%2A",
            "@multimediatype": "JPEG image file",
            "@type": "IMAGE-DOWNSAMPLED",
            "@size": "72413",
            "@ref": "gr6",
            "@mimetype": "image/jpeg"
          },
          {
            "@category": "thumbnail",
            "@height": "93",
            "@width": "49",
            "@_fa": "true",
            "$": "https://api.elsevier.com/content/object/eid/1-s2.0-S1381116905003699-gr6.sml?httpAccept=%2A%2F%2A",
            "@multimediatype": "GIF image file",
            "@type": "IMAGE-THUMBNAIL",
            "@size": "1949",
            "@ref": "gr6",
            "@mimetype": "image/gif"
          },
          {
            "@category": "standard",
            "@height": "181",
            "@width": "263",
            "@_fa": "true",
            "$": "https://api.elsevier.com/content/object/eid/1-s2.0-S1381116905003699-fx1.gif?httpAccept=%2A%2F%2A",
            "@multimediatype": "GIF image file",
            "@type": "IMAGE-DOWNSAMPLED",
            "@size": "3732",
            "@ref": "fx1",
            "@mimetype": "image/gif"
          },
          {
            "@category": "thumbnail",
            "@height": "86",
            "@width": "125",
            "@_fa": "true",
            "$": "https://api.elsevier.com/content/object/eid/1-s2.0-S1381116905003699-fx1.sml?httpAccept=%2A%2F%2A",
            "@multimediatype": "GIF image file",
            "@type": "IMAGE-THUMBNAIL",
            "@size": "1253",
            "@ref": "fx1",
            "@mimetype": "image/gif"
          }
        ]
      },
      "link": {
        "@rel": "abstract",
        "@href": "https://api.elsevier.com/content/abstract/scopus_id/23344450543"
      }
    }
  }
}