{
  "metadata": {
    "title": "CPO-27-M as heterogeneous catalysts for aldehyde cyanosilylation and styrene oxidation",
    "authors": "; ; ",
    "journal": "Journal of Molecular Catalysis A: Chemical",
    "date": "2014-11-15",
    "doi": "10.1016/j.molcata.2014.06.040",
    "abstract": "",
    "uri": "https://api.elsevier.com/content/article/pii/S138111691400291X",
    "pii": "S138111691400291X"
  },
  "fulltext": {
    "full-text-retrieval-response": {
      "scopus-eid": "2-s2.0-84904891912",
      "originalText": "serial JL 271358 291210 291744 291790 291809 31 Journal of Molecular Catalysis A: Chemical JOURNALMOLECULARCATALYSISACHEMICAL 2014-07-07 2014-07-07 2018-07-14T07:05:35 1-s2.0-S138111691400291X S1381-1169(14)00291-X S138111691400291X 10.1016/j.molcata.2014.06.040 S300 S300.2 FULL-TEXT 1-s2.0-S1381116914X00105 2018-07-15T01:07:36.350453Z 0 0 20141115 2014 2014-07-07T00:00:00Z absattachment articleinfo articletitlenorm authfirstinitialnorm authfirstsurnamenorm cid cids contenttype copyright crossmark dateloaded dateloadedtxt datesearch datesort dateupdated dco docsubtype doctype doi eid ewtransactionid hubeid indexeddate issn issnnorm itemstage itemtransactionid itemweight openaccess openarchive pg pgfirst pglast pii piinorm pubdatestart pubdatetxt pubyr sectiontitle sortorder srctitle srctitlenorm srctype ssids alllist content subj subheadings suppl tomb volfirst volissue volumelist webpdf webpdfpagecount yearnav figure table e-component body acknowledge affil appendices articletitle auth authfirstini authfull authkeywords authlast grantnumber grantsponsor highlightsabst primabst ref specialabst 1381-1169 13811169 true 394 394 C Volume 394 12 57 65 57 65 20141115 15 November 2014 2014-11-15 2014 Regular Papers article fla Copyright © 2014 Elsevier B.V. All rights reserved. CPO27MHETEROGENEOUSCATALYSTSFORALDEHYDECYANOSILYLATIONSTYRENEOXIDATION YAO H 1 Introduction 2 Experimental 2.1 Materials and catalyst preparation 2.2 Characterization 2.3 Catalytic reaction 2.3.1 Cyanosilylation of benzaldehyde 2.3.2 Styrene oxidation 3 Results and discussion 3.1 Characterization of the catalysts 3.2 Catalytic properties for cyanosilylation 3.3 Catalytic properties for styrene oxidation 4 Conclusions Acknowledgements Appendix A Supplementary data References FURUKAWA 2013 1230444 H WANG 2013 13222 C ZHANG 2013 653 Z SUH 2012 782 M DELLAROCCA 2011 957 J KRENO 2012 1105 L VALVEKENS 2013 1435 P DHAKSHINAMOORTHY 2013 2509 A YOON 2012 1196 M DHAKSHINAMOORTHY 2011 6344 A COHEN 2012 970 S MOON 2013 1807 H JUANALCANIZ 2012 10102 J DHAKSHINAMOORTHY 2012 5262 A DIETZEL 2005 6354 P ROSI 2005 1504 N DIETZEL 2006 959 P DIETZEL 2008 3624 P CASKEY 2008 10870 S ZHOU 2008 15268 W BLOCH 2011 14814 E YANG 2012 6465 D CHO 2012 35 H FU 2012 3309 Y LEE 2010 1489 J SRINIVAS 2012 3633 G BHATTACHARJEE 2010 135 S MITCHELL 2013 606 L GREGORY 1999 3649 R NORTH 2008 5146 M FUJITA 1994 1151 M NEOGI 2009 1 S DVRIES 2012 11349 R LEUS 2010 5085 K MAKSIMCHUK 2010 2943 N SONG 2010 15390 F DHAKSHINAMOORTHY 2011 856 A DHAKSHINAMOORTHY 2012 259 A DHAKSHINAMOORTHY 2011 836 A XIE 2011 5521 M ZHANG 2012 6541 J DIETZEL 2010 4962 P EVANS 2001 10395 O SCHLICHTE 2004 81 K HORIKE 2008 5854 S GANDARA 2009 2393 F GUSTAFSSON 2010 3316 M PHUENGPHAI 2010 7936 P MAURYA 2007 227 M HULEA 2004 99 V SRIRAMBALAJI 2012 11650 R RANU 1998 8212 B YAOX2014X57 YAOX2014X57X65 YAOX2014X57XH YAOX2014X57X65XH item S1381-1169(14)00291-X S138111691400291X 1-s2.0-S138111691400291X 10.1016/j.molcata.2014.06.040 271358 2018-07-15T01:07:36.350453Z 2014-11-15 1-s2.0-S138111691400291X-main.pdf https://s3-eu-west-1.amazonaws.com/prod-ucs-content-store-eu-west/content/pii:S138111691400291X/MAIN/application/pdf/4ab8af9694091c9946a803446ca8d020/main.pdf https://s3.amazonaws.com/prod-ucs-content-store-us-east/content/pii:S138111691400291X/MAIN/application/pdf/4ab8af9694091c9946a803446ca8d020/main.pdf main.pdf pdf true 1154220 MAIN 9 1-s2.0-S138111691400291X-main_1.png https://s3-eu-west-1.amazonaws.com/prod-ucs-content-store-eu-west/content/pii:S138111691400291X/PREVIEW/image/png/76b2504c4670625856f625d3f8b5bcfa/main_1.png https://s3.amazonaws.com/prod-ucs-content-store-us-east/content/pii:S138111691400291X/PREVIEW/image/png/76b2504c4670625856f625d3f8b5bcfa/main_1.png main_1.png png 60394 849 656 IMAGE-WEB-PDF 1 1-s2.0-S138111691400291X-fx1.sml https://s3-eu-west-1.amazonaws.com/prod-ucs-content-store-eu-west/content/pii:S138111691400291X/fx1/THUMBNAIL/image/gif/e7f7a37c8253d41a424f31fb0b9d17c0/fx1.sml https://s3.amazonaws.com/prod-ucs-content-store-us-east/content/pii:S138111691400291X/fx1/THUMBNAIL/image/gif/e7f7a37c8253d41a424f31fb0b9d17c0/fx1.sml fx1 true fx1.sml sml 6819 92 219 IMAGE-THUMBNAIL 1-s2.0-S138111691400291X-fx10.sml https://s3-eu-west-1.amazonaws.com/prod-ucs-content-store-eu-west/content/pii:S138111691400291X/fx10/THUMBNAIL/image/gif/105927a8b224484e7c1572ca76c4d5df/fx10.sml https://s3.amazonaws.com/prod-ucs-content-store-us-east/content/pii:S138111691400291X/fx10/THUMBNAIL/image/gif/105927a8b224484e7c1572ca76c4d5df/fx10.sml fx10 fx10.sml sml 5147 141 219 IMAGE-THUMBNAIL 1-s2.0-S138111691400291X-fx11.sml https://s3-eu-west-1.amazonaws.com/prod-ucs-content-store-eu-west/content/pii:S138111691400291X/fx11/THUMBNAIL/image/gif/7df8d3a938c0f76bf704b540f641a4f2/fx11.sml https://s3.amazonaws.com/prod-ucs-content-store-us-east/content/pii:S138111691400291X/fx11/THUMBNAIL/image/gif/7df8d3a938c0f76bf704b540f641a4f2/fx11.sml fx11 fx11.sml sml 2861 81 141 IMAGE-THUMBNAIL 1-s2.0-S138111691400291X-fx3.sml https://s3-eu-west-1.amazonaws.com/prod-ucs-content-store-eu-west/content/pii:S138111691400291X/fx3/THUMBNAIL/image/gif/e1663441b0059588d1d885a560b69276/fx3.sml https://s3.amazonaws.com/prod-ucs-content-store-us-east/content/pii:S138111691400291X/fx3/THUMBNAIL/image/gif/e1663441b0059588d1d885a560b69276/fx3.sml fx3 fx3.sml sml 5704 164 215 IMAGE-THUMBNAIL 1-s2.0-S138111691400291X-fx4.sml https://s3-eu-west-1.amazonaws.com/prod-ucs-content-store-eu-west/content/pii:S138111691400291X/fx4/THUMBNAIL/image/gif/7f648f0d3bbeb664cb12d8c5fe087c19/fx4.sml https://s3.amazonaws.com/prod-ucs-content-store-us-east/content/pii:S138111691400291X/fx4/THUMBNAIL/image/gif/7f648f0d3bbeb664cb12d8c5fe087c19/fx4.sml fx4 fx4.sml sml 4001 164 164 IMAGE-THUMBNAIL 1-s2.0-S138111691400291X-fx5.sml https://s3-eu-west-1.amazonaws.com/prod-ucs-content-store-eu-west/content/pii:S138111691400291X/fx5/THUMBNAIL/image/gif/f343dea72f33dfc539bb5cfdd487d457/fx5.sml https://s3.amazonaws.com/prod-ucs-content-store-us-east/content/pii:S138111691400291X/fx5/THUMBNAIL/image/gif/f343dea72f33dfc539bb5cfdd487d457/fx5.sml fx5 fx5.sml sml 3250 106 219 IMAGE-THUMBNAIL 1-s2.0-S138111691400291X-fx6.sml https://s3-eu-west-1.amazonaws.com/prod-ucs-content-store-eu-west/content/pii:S138111691400291X/fx6/THUMBNAIL/image/gif/9f90323233a7d64375e92b1f2e5f4178/fx6.sml https://s3.amazonaws.com/prod-ucs-content-store-us-east/content/pii:S138111691400291X/fx6/THUMBNAIL/image/gif/9f90323233a7d64375e92b1f2e5f4178/fx6.sml fx6 fx6.sml sml 4513 125 219 IMAGE-THUMBNAIL 1-s2.0-S138111691400291X-fx7.sml https://s3-eu-west-1.amazonaws.com/prod-ucs-content-store-eu-west/content/pii:S138111691400291X/fx7/THUMBNAIL/image/gif/0fbfc3adfdf18f3c7a0417c944a55b2e/fx7.sml https://s3.amazonaws.com/prod-ucs-content-store-us-east/content/pii:S138111691400291X/fx7/THUMBNAIL/image/gif/0fbfc3adfdf18f3c7a0417c944a55b2e/fx7.sml fx7 fx7.sml sml 4084 164 198 IMAGE-THUMBNAIL 1-s2.0-S138111691400291X-fx8.sml https://s3-eu-west-1.amazonaws.com/prod-ucs-content-store-eu-west/content/pii:S138111691400291X/fx8/THUMBNAIL/image/gif/6b0bf52788031dba83ae8569c9f7da65/fx8.sml https://s3.amazonaws.com/prod-ucs-content-store-us-east/content/pii:S138111691400291X/fx8/THUMBNAIL/image/gif/6b0bf52788031dba83ae8569c9f7da65/fx8.sml fx8 fx8.sml sml 3422 102 219 IMAGE-THUMBNAIL 1-s2.0-S138111691400291X-fx9.sml https://s3-eu-west-1.amazonaws.com/prod-ucs-content-store-eu-west/content/pii:S138111691400291X/fx9/THUMBNAIL/image/gif/74b959eff90697d5a11378f938884489/fx9.sml https://s3.amazonaws.com/prod-ucs-content-store-us-east/content/pii:S138111691400291X/fx9/THUMBNAIL/image/gif/74b959eff90697d5a11378f938884489/fx9.sml fx9 fx9.sml sml 5169 164 198 IMAGE-THUMBNAIL 1-s2.0-S138111691400291X-gr1.sml https://s3-eu-west-1.amazonaws.com/prod-ucs-content-store-eu-west/content/pii:S138111691400291X/gr1/THUMBNAIL/image/gif/21dffed30d216f756e0ceb1b10dcf1f0/gr1.sml https://s3.amazonaws.com/prod-ucs-content-store-us-east/content/pii:S138111691400291X/gr1/THUMBNAIL/image/gif/21dffed30d216f756e0ceb1b10dcf1f0/gr1.sml gr1 gr1.sml sml 18257 164 125 IMAGE-THUMBNAIL 1-s2.0-S138111691400291X-fx12.sml https://s3-eu-west-1.amazonaws.com/prod-ucs-content-store-eu-west/content/pii:S138111691400291X/fx12/THUMBNAIL/image/gif/e9099fbf66a90be6f48ca850a37c73d6/fx12.sml https://s3.amazonaws.com/prod-ucs-content-store-us-east/content/pii:S138111691400291X/fx12/THUMBNAIL/image/gif/e9099fbf66a90be6f48ca850a37c73d6/fx12.sml fx12 fx12.sml sml 3304 134 129 IMAGE-THUMBNAIL 1-s2.0-S138111691400291X-fx13.sml https://s3-eu-west-1.amazonaws.com/prod-ucs-content-store-eu-west/content/pii:S138111691400291X/fx13/THUMBNAIL/image/gif/ffaafa4fe8ba7fa67eae868718e4616b/fx13.sml https://s3.amazonaws.com/prod-ucs-content-store-us-east/content/pii:S138111691400291X/fx13/THUMBNAIL/image/gif/ffaafa4fe8ba7fa67eae868718e4616b/fx13.sml fx13 fx13.sml sml 3540 164 170 IMAGE-THUMBNAIL 1-s2.0-S138111691400291X-fx2.sml https://s3-eu-west-1.amazonaws.com/prod-ucs-content-store-eu-west/content/pii:S138111691400291X/fx2/THUMBNAIL/image/gif/a79fca41677fc3504c7646106ed0a7b3/fx2.sml https://s3.amazonaws.com/prod-ucs-content-store-us-east/content/pii:S138111691400291X/fx2/THUMBNAIL/image/gif/a79fca41677fc3504c7646106ed0a7b3/fx2.sml fx2 fx2.sml sml 4284 125 219 IMAGE-THUMBNAIL 1-s2.0-S138111691400291X-gr2.sml https://s3-eu-west-1.amazonaws.com/prod-ucs-content-store-eu-west/content/pii:S138111691400291X/gr2/THUMBNAIL/image/gif/76a74d3de7d1884c64dfc45b19c1a50c/gr2.sml https://s3.amazonaws.com/prod-ucs-content-store-us-east/content/pii:S138111691400291X/gr2/THUMBNAIL/image/gif/76a74d3de7d1884c64dfc45b19c1a50c/gr2.sml gr2 gr2.sml sml 5690 140 219 IMAGE-THUMBNAIL 1-s2.0-S138111691400291X-gr3.sml https://s3-eu-west-1.amazonaws.com/prod-ucs-content-store-eu-west/content/pii:S138111691400291X/gr3/THUMBNAIL/image/gif/0de9721314a6c4b897dd146a61d216e3/gr3.sml https://s3.amazonaws.com/prod-ucs-content-store-us-east/content/pii:S138111691400291X/gr3/THUMBNAIL/image/gif/0de9721314a6c4b897dd146a61d216e3/gr3.sml gr3 gr3.sml sml 4831 164 116 IMAGE-THUMBNAIL 1-s2.0-S138111691400291X-gr4.sml https://s3-eu-west-1.amazonaws.com/prod-ucs-content-store-eu-west/content/pii:S138111691400291X/gr4/THUMBNAIL/image/gif/107464c1664c4a43043ee3e4f623578e/gr4.sml https://s3.amazonaws.com/prod-ucs-content-store-us-east/content/pii:S138111691400291X/gr4/THUMBNAIL/image/gif/107464c1664c4a43043ee3e4f623578e/gr4.sml gr4 gr4.sml sml 7548 114 219 IMAGE-THUMBNAIL 1-s2.0-S138111691400291X-gr5.sml https://s3-eu-west-1.amazonaws.com/prod-ucs-content-store-eu-west/content/pii:S138111691400291X/gr5/THUMBNAIL/image/gif/54f2b13798f889acb47e33bb12f8bee2/gr5.sml https://s3.amazonaws.com/prod-ucs-content-store-us-east/content/pii:S138111691400291X/gr5/THUMBNAIL/image/gif/54f2b13798f889acb47e33bb12f8bee2/gr5.sml gr5 gr5.sml sml 5102 164 122 IMAGE-THUMBNAIL 1-s2.0-S138111691400291X-gr6.sml https://s3-eu-west-1.amazonaws.com/prod-ucs-content-store-eu-west/content/pii:S138111691400291X/gr6/THUMBNAIL/image/gif/4136dfd2b084ee23defeb9803b3e4b37/gr6.sml https://s3.amazonaws.com/prod-ucs-content-store-us-east/content/pii:S138111691400291X/gr6/THUMBNAIL/image/gif/4136dfd2b084ee23defeb9803b3e4b37/gr6.sml gr6 gr6.sml sml 4887 163 107 IMAGE-THUMBNAIL 1-s2.0-S138111691400291X-gr7.sml https://s3-eu-west-1.amazonaws.com/prod-ucs-content-store-eu-west/content/pii:S138111691400291X/gr7/THUMBNAIL/image/gif/9a2bd054cdd011b9fcdc8ab1e7a1347d/gr7.sml https://s3.amazonaws.com/prod-ucs-content-store-us-east/content/pii:S138111691400291X/gr7/THUMBNAIL/image/gif/9a2bd054cdd011b9fcdc8ab1e7a1347d/gr7.sml gr7 gr7.sml sml 8071 163 161 IMAGE-THUMBNAIL 1-s2.0-S138111691400291X-sc2.sml https://s3-eu-west-1.amazonaws.com/prod-ucs-content-store-eu-west/content/pii:S138111691400291X/sc2/THUMBNAIL/image/gif/c6b9a02a4de6de9a0a9bb1a19d22eab2/sc2.sml https://s3.amazonaws.com/prod-ucs-content-store-us-east/content/pii:S138111691400291X/sc2/THUMBNAIL/image/gif/c6b9a02a4de6de9a0a9bb1a19d22eab2/sc2.sml sc2 sc2.sml sml 2329 42 219 IMAGE-THUMBNAIL 1-s2.0-S138111691400291X-sc3.sml https://s3-eu-west-1.amazonaws.com/prod-ucs-content-store-eu-west/content/pii:S138111691400291X/sc3/THUMBNAIL/image/gif/94ee6eb5288f2c5c9a2cc67d9dd99922/sc3.sml https://s3.amazonaws.com/prod-ucs-content-store-us-east/content/pii:S138111691400291X/sc3/THUMBNAIL/image/gif/94ee6eb5288f2c5c9a2cc67d9dd99922/sc3.sml sc3 sc3.sml sml 4391 163 152 IMAGE-THUMBNAIL 1-s2.0-S138111691400291X-sc1.sml https://s3-eu-west-1.amazonaws.com/prod-ucs-content-store-eu-west/content/pii:S138111691400291X/sc1/THUMBNAIL/image/gif/7fdeb293406077edf9c6dd18034260eb/sc1.sml https://s3.amazonaws.com/prod-ucs-content-store-us-east/content/pii:S138111691400291X/sc1/THUMBNAIL/image/gif/7fdeb293406077edf9c6dd18034260eb/sc1.sml sc1 sc1.sml sml 2625 34 219 IMAGE-THUMBNAIL 1-s2.0-S138111691400291X-gr2.gif https://s3-eu-west-1.amazonaws.com/prod-ucs-content-store-eu-west/content/pii:S138111691400291X/gr2/DOWNSAMPLED/image/gif/3a493aaf80f9f5b289aa0b2aa2e8686f/gr2.gif https://s3.amazonaws.com/prod-ucs-content-store-us-east/content/pii:S138111691400291X/gr2/DOWNSAMPLED/image/gif/3a493aaf80f9f5b289aa0b2aa2e8686f/gr2.gif gr2 gr2.gif gif 9436 217 339 IMAGE-DOWNSAMPLED 1-s2.0-S138111691400291X-gr3.gif https://s3-eu-west-1.amazonaws.com/prod-ucs-content-store-eu-west/content/pii:S138111691400291X/gr3/DOWNSAMPLED/image/gif/6d047dc13fea1ad36a69d6a0152d636b/gr3.gif https://s3.amazonaws.com/prod-ucs-content-store-us-east/content/pii:S138111691400291X/gr3/DOWNSAMPLED/image/gif/6d047dc13fea1ad36a69d6a0152d636b/gr3.gif gr3 gr3.gif gif 23491 556 393 IMAGE-DOWNSAMPLED 1-s2.0-S138111691400291X-gr4.gif https://s3-eu-west-1.amazonaws.com/prod-ucs-content-store-eu-west/content/pii:S138111691400291X/gr4/DOWNSAMPLED/image/gif/a985ea763f2718ecbff8085353a18dbe/gr4.gif https://s3.amazonaws.com/prod-ucs-content-store-us-east/content/pii:S138111691400291X/gr4/DOWNSAMPLED/image/gif/a985ea763f2718ecbff8085353a18dbe/gr4.gif gr4 gr4.gif gif 16206 177 339 IMAGE-DOWNSAMPLED 1-s2.0-S138111691400291X-gr5.gif https://s3-eu-west-1.amazonaws.com/prod-ucs-content-store-eu-west/content/pii:S138111691400291X/gr5/DOWNSAMPLED/image/gif/16726d846505350c579dde2bd3f0c269/gr5.gif https://s3.amazonaws.com/prod-ucs-content-store-us-east/content/pii:S138111691400291X/gr5/DOWNSAMPLED/image/gif/16726d846505350c579dde2bd3f0c269/gr5.gif gr5 gr5.gif gif 20944 456 339 IMAGE-DOWNSAMPLED 1-s2.0-S138111691400291X-gr6.gif https://s3-eu-west-1.amazonaws.com/prod-ucs-content-store-eu-west/content/pii:S138111691400291X/gr6/DOWNSAMPLED/image/gif/acc1aa23768354a590f96f99cc4d0924/gr6.gif https://s3.amazonaws.com/prod-ucs-content-store-us-east/content/pii:S138111691400291X/gr6/DOWNSAMPLED/image/gif/acc1aa23768354a590f96f99cc4d0924/gr6.gif gr6 gr6.gif gif 24084 516 339 IMAGE-DOWNSAMPLED 1-s2.0-S138111691400291X-gr7.gif https://s3-eu-west-1.amazonaws.com/prod-ucs-content-store-eu-west/content/pii:S138111691400291X/gr7/DOWNSAMPLED/image/gif/153278cabb13b28f6d71d6ce282de9d0/gr7.gif https://s3.amazonaws.com/prod-ucs-content-store-us-east/content/pii:S138111691400291X/gr7/DOWNSAMPLED/image/gif/153278cabb13b28f6d71d6ce282de9d0/gr7.gif gr7 gr7.gif gif 23771 344 339 IMAGE-DOWNSAMPLED 1-s2.0-S138111691400291X-sc2.gif https://s3-eu-west-1.amazonaws.com/prod-ucs-content-store-eu-west/content/pii:S138111691400291X/sc2/DOWNSAMPLED/image/gif/6dbe33d1436128233902b78765177a86/sc2.gif https://s3.amazonaws.com/prod-ucs-content-store-us-east/content/pii:S138111691400291X/sc2/DOWNSAMPLED/image/gif/6dbe33d1436128233902b78765177a86/sc2.gif sc2 sc2.gif gif 3928 72 376 IMAGE-DOWNSAMPLED 1-s2.0-S138111691400291X-sc3.gif https://s3-eu-west-1.amazonaws.com/prod-ucs-content-store-eu-west/content/pii:S138111691400291X/sc3/DOWNSAMPLED/image/gif/e81bac571bb4ea3e3a2b1eb4e5a0a3bc/sc3.gif https://s3.amazonaws.com/prod-ucs-content-store-us-east/content/pii:S138111691400291X/sc3/DOWNSAMPLED/image/gif/e81bac571bb4ea3e3a2b1eb4e5a0a3bc/sc3.gif sc3 sc3.gif gif 14750 404 376 IMAGE-DOWNSAMPLED 1-s2.0-S138111691400291X-sc1.gif https://s3-eu-west-1.amazonaws.com/prod-ucs-content-store-eu-west/content/pii:S138111691400291X/sc1/DOWNSAMPLED/image/gif/1df1d4ff3140d3fc658c3cdbaa3c2cea/sc1.gif https://s3.amazonaws.com/prod-ucs-content-store-us-east/content/pii:S138111691400291X/sc1/DOWNSAMPLED/image/gif/1df1d4ff3140d3fc658c3cdbaa3c2cea/sc1.gif sc1 sc1.gif gif 4595 58 376 IMAGE-DOWNSAMPLED 1-s2.0-S138111691400291X-fx1.jpg https://s3-eu-west-1.amazonaws.com/prod-ucs-content-store-eu-west/content/pii:S138111691400291X/fx1/DOWNSAMPLED/image/jpeg/dd9f2d9aa0c8ea66d29bfaae837df197/fx1.jpg https://s3.amazonaws.com/prod-ucs-content-store-us-east/content/pii:S138111691400291X/fx1/DOWNSAMPLED/image/jpeg/dd9f2d9aa0c8ea66d29bfaae837df197/fx1.jpg fx1 true fx1.jpg jpg 22808 200 475 IMAGE-DOWNSAMPLED 1-s2.0-S138111691400291X-fx10.jpg https://s3-eu-west-1.amazonaws.com/prod-ucs-content-store-eu-west/content/pii:S138111691400291X/fx10/DOWNSAMPLED/image/jpeg/4ebf4474a97b9eab50774beb484c627e/fx10.jpg https://s3.amazonaws.com/prod-ucs-content-store-us-east/content/pii:S138111691400291X/fx10/DOWNSAMPLED/image/jpeg/4ebf4474a97b9eab50774beb484c627e/fx10.jpg fx10 fx10.jpg jpg 2271 52 81 IMAGE-DOWNSAMPLED 1-s2.0-S138111691400291X-fx11.jpg https://s3-eu-west-1.amazonaws.com/prod-ucs-content-store-eu-west/content/pii:S138111691400291X/fx11/DOWNSAMPLED/image/jpeg/224d65bce95fce48660b40e85a8b75d4/fx11.jpg https://s3.amazonaws.com/prod-ucs-content-store-us-east/content/pii:S138111691400291X/fx11/DOWNSAMPLED/image/jpeg/224d65bce95fce48660b40e85a8b75d4/fx11.jpg fx11 fx11.jpg jpg 603 18 31 IMAGE-DOWNSAMPLED 1-s2.0-S138111691400291X-fx3.jpg https://s3-eu-west-1.amazonaws.com/prod-ucs-content-store-eu-west/content/pii:S138111691400291X/fx3/DOWNSAMPLED/image/jpeg/2d7259d14499cb19cf23605ce79c3376/fx3.jpg https://s3.amazonaws.com/prod-ucs-content-store-us-east/content/pii:S138111691400291X/fx3/DOWNSAMPLED/image/jpeg/2d7259d14499cb19cf23605ce79c3376/fx3.jpg fx3 fx3.jpg jpg 1639 48 63 IMAGE-DOWNSAMPLED 1-s2.0-S138111691400291X-fx4.jpg https://s3-eu-west-1.amazonaws.com/prod-ucs-content-store-eu-west/content/pii:S138111691400291X/fx4/DOWNSAMPLED/image/jpeg/3aae0aba6faa23f46948069a9c312ee6/fx4.jpg https://s3.amazonaws.com/prod-ucs-content-store-us-east/content/pii:S138111691400291X/fx4/DOWNSAMPLED/image/jpeg/3aae0aba6faa23f46948069a9c312ee6/fx4.jpg fx4 fx4.jpg jpg 1674 63 63 IMAGE-DOWNSAMPLED 1-s2.0-S138111691400291X-fx5.jpg https://s3-eu-west-1.amazonaws.com/prod-ucs-content-store-eu-west/content/pii:S138111691400291X/fx5/DOWNSAMPLED/image/jpeg/70f977090f8e824dcd4db026029ad3b6/fx5.jpg https://s3.amazonaws.com/prod-ucs-content-store-us-east/content/pii:S138111691400291X/fx5/DOWNSAMPLED/image/jpeg/70f977090f8e824dcd4db026029ad3b6/fx5.jpg fx5 fx5.jpg jpg 1703 48 99 IMAGE-DOWNSAMPLED 1-s2.0-S138111691400291X-fx6.jpg https://s3-eu-west-1.amazonaws.com/prod-ucs-content-store-eu-west/content/pii:S138111691400291X/fx6/DOWNSAMPLED/image/jpeg/8d565246a3b507ed1943527755af7121/fx6.jpg https://s3.amazonaws.com/prod-ucs-content-store-us-east/content/pii:S138111691400291X/fx6/DOWNSAMPLED/image/jpeg/8d565246a3b507ed1943527755af7121/fx6.jpg fx6 fx6.jpg jpg 1370 36 63 IMAGE-DOWNSAMPLED 1-s2.0-S138111691400291X-fx7.jpg https://s3-eu-west-1.amazonaws.com/prod-ucs-content-store-eu-west/content/pii:S138111691400291X/fx7/DOWNSAMPLED/image/jpeg/5796240fc6af6cd92463db7cef27970e/fx7.jpg https://s3.amazonaws.com/prod-ucs-content-store-us-east/content/pii:S138111691400291X/fx7/DOWNSAMPLED/image/jpeg/5796240fc6af6cd92463db7cef27970e/fx7.jpg fx7 fx7.jpg jpg 1309 52 63 IMAGE-DOWNSAMPLED 1-s2.0-S138111691400291X-fx8.jpg https://s3-eu-west-1.amazonaws.com/prod-ucs-content-store-eu-west/content/pii:S138111691400291X/fx8/DOWNSAMPLED/image/jpeg/05f2e0a775610b743becbe93f356fb23/fx8.jpg https://s3.amazonaws.com/prod-ucs-content-store-us-east/content/pii:S138111691400291X/fx8/DOWNSAMPLED/image/jpeg/05f2e0a775610b743becbe93f356fb23/fx8.jpg fx8 fx8.jpg jpg 1462 36 78 IMAGE-DOWNSAMPLED 1-s2.0-S138111691400291X-fx9.jpg https://s3-eu-west-1.amazonaws.com/prod-ucs-content-store-eu-west/content/pii:S138111691400291X/fx9/DOWNSAMPLED/image/jpeg/5b048d485257183d8fc9b031b32be062/fx9.jpg https://s3.amazonaws.com/prod-ucs-content-store-us-east/content/pii:S138111691400291X/fx9/DOWNSAMPLED/image/jpeg/5b048d485257183d8fc9b031b32be062/fx9.jpg fx9 fx9.jpg jpg 1734 52 63 IMAGE-DOWNSAMPLED 1-s2.0-S138111691400291X-gr1.jpg https://s3-eu-west-1.amazonaws.com/prod-ucs-content-store-eu-west/content/pii:S138111691400291X/gr1/DOWNSAMPLED/image/jpeg/8539869fbcb607dc254e22c2a7024c41/gr1.jpg https://s3.amazonaws.com/prod-ucs-content-store-us-east/content/pii:S138111691400291X/gr1/DOWNSAMPLED/image/jpeg/8539869fbcb607dc254e22c2a7024c41/gr1.jpg gr1 gr1.jpg jpg 92275 493 376 IMAGE-DOWNSAMPLED 1-s2.0-S138111691400291X-fx12.jpg https://s3-eu-west-1.amazonaws.com/prod-ucs-content-store-eu-west/content/pii:S138111691400291X/fx12/DOWNSAMPLED/image/jpeg/d7da5cc2b42b26745a7037714613738e/fx12.jpg https://s3.amazonaws.com/prod-ucs-content-store-us-east/content/pii:S138111691400291X/fx12/DOWNSAMPLED/image/jpeg/d7da5cc2b42b26745a7037714613738e/fx12.jpg fx12 fx12.jpg jpg 735 30 29 IMAGE-DOWNSAMPLED 1-s2.0-S138111691400291X-fx13.jpg https://s3-eu-west-1.amazonaws.com/prod-ucs-content-store-eu-west/content/pii:S138111691400291X/fx13/DOWNSAMPLED/image/jpeg/d6c8a2dc81272aca62350c6e32091dbe/fx13.jpg https://s3.amazonaws.com/prod-ucs-content-store-us-east/content/pii:S138111691400291X/fx13/DOWNSAMPLED/image/jpeg/d6c8a2dc81272aca62350c6e32091dbe/fx13.jpg fx13 fx13.jpg jpg 1323 52 54 IMAGE-DOWNSAMPLED 1-s2.0-S138111691400291X-fx2.jpg https://s3-eu-west-1.amazonaws.com/prod-ucs-content-store-eu-west/content/pii:S138111691400291X/fx2/DOWNSAMPLED/image/jpeg/685912f2e54137a648cc1079135eefcc/fx2.jpg https://s3.amazonaws.com/prod-ucs-content-store-us-east/content/pii:S138111691400291X/fx2/DOWNSAMPLED/image/jpeg/685912f2e54137a648cc1079135eefcc/fx2.jpg fx2 fx2.jpg jpg 1258 36 63 IMAGE-DOWNSAMPLED 1-s2.0-S138111691400291X-gr2_lrg.gif https://s3-eu-west-1.amazonaws.com/prod-ucs-content-store-eu-west/content/pii:S138111691400291X/gr2/HIGHRES/image/gif/db8308588de69f6f84f6ee1841f14e42/gr2_lrg.gif https://s3.amazonaws.com/prod-ucs-content-store-us-east/content/pii:S138111691400291X/gr2/HIGHRES/image/gif/db8308588de69f6f84f6ee1841f14e42/gr2_lrg.gif gr2 gr2_lrg.gif gif 43786 1918 3000 IMAGE-HIGH-RES 1-s2.0-S138111691400291X-gr3_lrg.gif https://s3-eu-west-1.amazonaws.com/prod-ucs-content-store-eu-west/content/pii:S138111691400291X/gr3/HIGHRES/image/gif/8e650be9f95f3f3940fc49473532997b/gr3_lrg.gif https://s3.amazonaws.com/prod-ucs-content-store-us-east/content/pii:S138111691400291X/gr3/HIGHRES/image/gif/8e650be9f95f3f3940fc49473532997b/gr3_lrg.gif gr3 gr3_lrg.gif gif 118904 4932 3484 IMAGE-HIGH-RES 1-s2.0-S138111691400291X-gr4_lrg.gif https://s3-eu-west-1.amazonaws.com/prod-ucs-content-store-eu-west/content/pii:S138111691400291X/gr4/HIGHRES/image/gif/0b03dd11c9ccbef8c8d7828da5471343/gr4_lrg.gif https://s3.amazonaws.com/prod-ucs-content-store-us-east/content/pii:S138111691400291X/gr4/HIGHRES/image/gif/0b03dd11c9ccbef8c8d7828da5471343/gr4_lrg.gif gr4 gr4_lrg.gif gif 82875 1564 3000 IMAGE-HIGH-RES 1-s2.0-S138111691400291X-gr5_lrg.gif https://s3-eu-west-1.amazonaws.com/prod-ucs-content-store-eu-west/content/pii:S138111691400291X/gr5/HIGHRES/image/gif/cee7919780031e9ae36cac35356c1809/gr5_lrg.gif https://s3.amazonaws.com/prod-ucs-content-store-us-east/content/pii:S138111691400291X/gr5/HIGHRES/image/gif/cee7919780031e9ae36cac35356c1809/gr5_lrg.gif gr5 gr5_lrg.gif gif 109104 4038 3000 IMAGE-HIGH-RES 1-s2.0-S138111691400291X-gr6_lrg.gif https://s3-eu-west-1.amazonaws.com/prod-ucs-content-store-eu-west/content/pii:S138111691400291X/gr6/HIGHRES/image/gif/1d5fc0667971c91c06bde891c102d8b5/gr6_lrg.gif https://s3.amazonaws.com/prod-ucs-content-store-us-east/content/pii:S138111691400291X/gr6/HIGHRES/image/gif/1d5fc0667971c91c06bde891c102d8b5/gr6_lrg.gif gr6 gr6_lrg.gif gif 118588 4564 3000 IMAGE-HIGH-RES 1-s2.0-S138111691400291X-gr7_lrg.gif https://s3-eu-west-1.amazonaws.com/prod-ucs-content-store-eu-west/content/pii:S138111691400291X/gr7/HIGHRES/image/gif/6ad6df3da5a225c5dd6bb8924da3a735/gr7_lrg.gif https://s3.amazonaws.com/prod-ucs-content-store-us-east/content/pii:S138111691400291X/gr7/HIGHRES/image/gif/6ad6df3da5a225c5dd6bb8924da3a735/gr7_lrg.gif gr7 gr7_lrg.gif gif 118736 3046 3000 IMAGE-HIGH-RES 1-s2.0-S138111691400291X-sc2_lrg.gif https://s3-eu-west-1.amazonaws.com/prod-ucs-content-store-eu-west/content/pii:S138111691400291X/sc2/HIGHRES/image/gif/809898876dbade79537d6a8161704727/sc2_lrg.gif https://s3.amazonaws.com/prod-ucs-content-store-us-east/content/pii:S138111691400291X/sc2/HIGHRES/image/gif/809898876dbade79537d6a8161704727/sc2_lrg.gif sc2 sc2_lrg.gif gif 16289 640 3334 IMAGE-HIGH-RES 1-s2.0-S138111691400291X-sc3_lrg.gif https://s3-eu-west-1.amazonaws.com/prod-ucs-content-store-eu-west/content/pii:S138111691400291X/sc3/HIGHRES/image/gif/49be5ea38335cbc60f034d41810b9436/sc3_lrg.gif https://s3.amazonaws.com/prod-ucs-content-store-us-east/content/pii:S138111691400291X/sc3/HIGHRES/image/gif/49be5ea38335cbc60f034d41810b9436/sc3_lrg.gif sc3 sc3_lrg.gif gif 74127 3584 3334 IMAGE-HIGH-RES 1-s2.0-S138111691400291X-sc1_lrg.gif https://s3-eu-west-1.amazonaws.com/prod-ucs-content-store-eu-west/content/pii:S138111691400291X/sc1/HIGHRES/image/gif/51ae472eb3c3aea32c1890ec46fd2708/sc1_lrg.gif https://s3.amazonaws.com/prod-ucs-content-store-us-east/content/pii:S138111691400291X/sc1/HIGHRES/image/gif/51ae472eb3c3aea32c1890ec46fd2708/sc1_lrg.gif sc1 sc1_lrg.gif gif 19303 516 3334 IMAGE-HIGH-RES 1-s2.0-S138111691400291X-fx1_lrg.jpg https://s3-eu-west-1.amazonaws.com/prod-ucs-content-store-eu-west/content/pii:S138111691400291X/fx1/HIGHRES/image/jpeg/9b6b08166c5cdb14d03a508b55abdb1b/fx1_lrg.jpg https://s3.amazonaws.com/prod-ucs-content-store-us-east/content/pii:S138111691400291X/fx1/HIGHRES/image/jpeg/9b6b08166c5cdb14d03a508b55abdb1b/fx1_lrg.jpg fx1 true fx1_lrg.jpg jpg 157378 886 2103 IMAGE-HIGH-RES 1-s2.0-S138111691400291X-fx10_lrg.jpg https://s3-eu-west-1.amazonaws.com/prod-ucs-content-store-eu-west/content/pii:S138111691400291X/fx10/HIGHRES/image/jpeg/eaf659508a296cac09bce7221d2a1906/fx10_lrg.jpg https://s3.amazonaws.com/prod-ucs-content-store-us-east/content/pii:S138111691400291X/fx10/HIGHRES/image/jpeg/eaf659508a296cac09bce7221d2a1906/fx10_lrg.jpg fx10 fx10_lrg.jpg jpg 14447 233 361 IMAGE-HIGH-RES 1-s2.0-S138111691400291X-fx11_lrg.jpg https://s3-eu-west-1.amazonaws.com/prod-ucs-content-store-eu-west/content/pii:S138111691400291X/fx11/HIGHRES/image/jpeg/e991d5a202df688e664d0a0d3a2a70c5/fx11_lrg.jpg https://s3.amazonaws.com/prod-ucs-content-store-us-east/content/pii:S138111691400291X/fx11/HIGHRES/image/jpeg/e991d5a202df688e664d0a0d3a2a70c5/fx11_lrg.jpg fx11 fx11_lrg.jpg jpg 2842 81 141 IMAGE-HIGH-RES 1-s2.0-S138111691400291X-fx3_lrg.jpg https://s3-eu-west-1.amazonaws.com/prod-ucs-content-store-eu-west/content/pii:S138111691400291X/fx3/HIGHRES/image/jpeg/b4e8898f141d0b28ce8612f3386cd4a2/fx3_lrg.jpg https://s3.amazonaws.com/prod-ucs-content-store-us-east/content/pii:S138111691400291X/fx3/HIGHRES/image/jpeg/b4e8898f141d0b28ce8612f3386cd4a2/fx3_lrg.jpg fx3 fx3_lrg.jpg jpg 10211 215 282 IMAGE-HIGH-RES 1-s2.0-S138111691400291X-fx4_lrg.jpg https://s3-eu-west-1.amazonaws.com/prod-ucs-content-store-eu-west/content/pii:S138111691400291X/fx4/HIGHRES/image/jpeg/9bf28d71faac06a7ccd702e45168729b/fx4_lrg.jpg https://s3.amazonaws.com/prod-ucs-content-store-us-east/content/pii:S138111691400291X/fx4/HIGHRES/image/jpeg/9bf28d71faac06a7ccd702e45168729b/fx4_lrg.jpg fx4 fx4_lrg.jpg jpg 10542 283 283 IMAGE-HIGH-RES 1-s2.0-S138111691400291X-fx5_lrg.jpg https://s3-eu-west-1.amazonaws.com/prod-ucs-content-store-eu-west/content/pii:S138111691400291X/fx5/HIGHRES/image/jpeg/eaec51fdb61b33e89c31aa90c87a273c/fx5_lrg.jpg https://s3.amazonaws.com/prod-ucs-content-store-us-east/content/pii:S138111691400291X/fx5/HIGHRES/image/jpeg/eaec51fdb61b33e89c31aa90c87a273c/fx5_lrg.jpg fx5 fx5_lrg.jpg jpg 10733 213 439 IMAGE-HIGH-RES 1-s2.0-S138111691400291X-fx6_lrg.jpg https://s3-eu-west-1.amazonaws.com/prod-ucs-content-store-eu-west/content/pii:S138111691400291X/fx6/HIGHRES/image/jpeg/4d2d7dd9658eee2be5a9b8f0d0ff5938/fx6_lrg.jpg https://s3.amazonaws.com/prod-ucs-content-store-us-east/content/pii:S138111691400291X/fx6/HIGHRES/image/jpeg/4d2d7dd9658eee2be5a9b8f0d0ff5938/fx6_lrg.jpg fx6 fx6_lrg.jpg jpg 8063 162 283 IMAGE-HIGH-RES 1-s2.0-S138111691400291X-fx7_lrg.jpg https://s3-eu-west-1.amazonaws.com/prod-ucs-content-store-eu-west/content/pii:S138111691400291X/fx7/HIGHRES/image/jpeg/aebf8fbd85cdaac86de54a9ff7ab04f7/fx7_lrg.jpg https://s3.amazonaws.com/prod-ucs-content-store-us-east/content/pii:S138111691400291X/fx7/HIGHRES/image/jpeg/aebf8fbd85cdaac86de54a9ff7ab04f7/fx7_lrg.jpg fx7 fx7_lrg.jpg jpg 7842 233 281 IMAGE-HIGH-RES 1-s2.0-S138111691400291X-fx8_lrg.jpg https://s3-eu-west-1.amazonaws.com/prod-ucs-content-store-eu-west/content/pii:S138111691400291X/fx8/HIGHRES/image/jpeg/075171a6caf3461f2f5f8e0bd1eb5d34/fx8_lrg.jpg https://s3.amazonaws.com/prod-ucs-content-store-us-east/content/pii:S138111691400291X/fx8/HIGHRES/image/jpeg/075171a6caf3461f2f5f8e0bd1eb5d34/fx8_lrg.jpg fx8 fx8_lrg.jpg jpg 8372 162 348 IMAGE-HIGH-RES 1-s2.0-S138111691400291X-fx9_lrg.jpg https://s3-eu-west-1.amazonaws.com/prod-ucs-content-store-eu-west/content/pii:S138111691400291X/fx9/HIGHRES/image/jpeg/0ec7c8416ec7db81a07f7f9ffc447346/fx9_lrg.jpg https://s3.amazonaws.com/prod-ucs-content-store-us-east/content/pii:S138111691400291X/fx9/HIGHRES/image/jpeg/0ec7c8416ec7db81a07f7f9ffc447346/fx9_lrg.jpg fx9 fx9_lrg.jpg jpg 10917 233 282 IMAGE-HIGH-RES 1-s2.0-S138111691400291X-gr1_lrg.jpg https://s3-eu-west-1.amazonaws.com/prod-ucs-content-store-eu-west/content/pii:S138111691400291X/gr1/HIGHRES/image/jpeg/881418c20b83875b53156557890455b2/gr1_lrg.jpg https://s3.amazonaws.com/prod-ucs-content-store-us-east/content/pii:S138111691400291X/gr1/HIGHRES/image/jpeg/881418c20b83875b53156557890455b2/gr1_lrg.jpg gr1 gr1_lrg.jpg jpg 551174 2184 1667 IMAGE-HIGH-RES 1-s2.0-S138111691400291X-fx12_lrg.jpg https://s3-eu-west-1.amazonaws.com/prod-ucs-content-store-eu-west/content/pii:S138111691400291X/fx12/HIGHRES/image/jpeg/0b7a85e0e08ebf12848abbbd4f825f8b/fx12_lrg.jpg https://s3.amazonaws.com/prod-ucs-content-store-us-east/content/pii:S138111691400291X/fx12/HIGHRES/image/jpeg/0b7a85e0e08ebf12848abbbd4f825f8b/fx12_lrg.jpg fx12 fx12_lrg.jpg jpg 3141 134 129 IMAGE-HIGH-RES 1-s2.0-S138111691400291X-fx13_lrg.jpg https://s3-eu-west-1.amazonaws.com/prod-ucs-content-store-eu-west/content/pii:S138111691400291X/fx13/HIGHRES/image/jpeg/77cbb5c1cd8594d35c29bc0606f353b9/fx13_lrg.jpg https://s3.amazonaws.com/prod-ucs-content-store-us-east/content/pii:S138111691400291X/fx13/HIGHRES/image/jpeg/77cbb5c1cd8594d35c29bc0606f353b9/fx13_lrg.jpg fx13 fx13_lrg.jpg jpg 7328 233 242 IMAGE-HIGH-RES 1-s2.0-S138111691400291X-fx2_lrg.jpg https://s3-eu-west-1.amazonaws.com/prod-ucs-content-store-eu-west/content/pii:S138111691400291X/fx2/HIGHRES/image/jpeg/bdb01c01a23fe97b37a8a52804982c94/fx2_lrg.jpg https://s3.amazonaws.com/prod-ucs-content-store-us-east/content/pii:S138111691400291X/fx2/HIGHRES/image/jpeg/bdb01c01a23fe97b37a8a52804982c94/fx2_lrg.jpg fx2 fx2_lrg.jpg jpg 7453 161 283 IMAGE-HIGH-RES 1-s2.0-S138111691400291X-mmc1.pdf https://s3-eu-west-1.amazonaws.com/prod-ucs-content-store-eu-west/content/pii:S138111691400291X/mmc1/MAIN/application/pdf/ec890e7c10c2b19fa529ed28307cf40f/mmc1.pdf https://s3.amazonaws.com/prod-ucs-content-store-us-east/content/pii:S138111691400291X/mmc1/MAIN/application/pdf/ec890e7c10c2b19fa529ed28307cf40f/mmc1.pdf mmc1 mmc1.pdf pdf false 208695 APPLICATION MOLCAA 9181 S1381-1169(14)00291-X 10.1016/j.molcata.2014.06.040 Elsevier B.V. Scheme 1 Cyanosilylation of benzaldehyde. Scheme 2 Oxidation of styrene catalyzed by CPO-27-M. Scheme 3 Possible mechanism for the styrene oxidation over CPO-27-Mn. Fig. 1 XRD patterns of the as-synthesized (a) and activated (b) CPO-27-M MOFs. Fig. 2 XRD patterns for mixed-metal MOFs and the parent materials. Fig. 3 Conversion vs. time plots for benzaldehyde cyanosilylation. (a) Reactions with and without CPO-27-M catalysts. (b) CPO-27-Mn-catalyzed reactions with and without filtering off the catalyst. Conditions: benzaldehyde, 5mmol; TMSCN, 10mmol; DCM, 15mL, reflux; cat., 0.5mmol (if used). Fig. 4 Recycling tests of CPO-27-Mn for benzaldehyde cyanosilylation. Conditions: benzaldehyde, 5mmol; TMSCN, 10mmol; DCM, 15mL, reflux; cat., 0.5mmol; 1h. Fig. 5 IR spectra (a) and XRD profiles (b) of the CPO-27-Mn catalyst before and after the cyanosilylation reaction. Fig. 6 Conversion vs. time plots for styrene oxidation. (a) Reactions with and without CPO-27-M catalysts. (b) CPO-27-Mn-catalyzed reaction and the control tests with catalyst filtration, with radical quenching, and without catalyst. Conditions: cat., 0.25mmol (if used); styrene, 5mmol; TBHP (5–6M in decane), 15mmol; 75°C. Fig. 7 (a) Conversion data of the recycling tests of CPO-27-Mn for the styrene oxidation (cat., 0.25mmol; styrene, 5mmol; TBHP (5–6M in decane), 15mmol; 75°C, 2h). (b) Comparison of the XRD profiles of CPO-27-Mn before and after the catalytic test. Table 1 Comparison of different catalysts for the cyanosilylation of benzaldehyde. a Entry Catalyst Time (h) f Conv. (%) f 1 Without catalyst 2, 48 ∼1, 17 2 CPO-27-Co b 2, 48 ∼2, 27 3 CPO-27-Ni 2, 48 5, 27 4 CPO-27-Zn 2, 48 14, 83 5 CPO-27-Mg 2, 48 19, 96 6 CPO-27-Mn 1 100 7 CPO-27-Co c 2, 48 3, 25 8 CPO-27-Mn0.57Co0.43 1 65 9 CPO-27-Mn0.10Co0.90 1, 2 5, 9 10 CPO-27-Mn+py d 1 38 11 CPO-27-Mn+ pyO e 1 24 12 MnCl2 g 1 44 13 H4dhtp 1, 48 ∼0, 17 a Conditions: benzaldehyde, 5mmol; TMSCN, 10mmol; DCM, 15mL, reflux; cat., 0.5mmol (10mol%). b The CPO-27-Co catalyst was prepared by a solvothermal procedure with THF-water as solvent. c The CPO-27-Co catalyst was prepared by a solvothermal procedure with DMF-ethanol-water as solvent. d In the presence of pyridine (5mmol). e In the presence of pyridine N-oxide (3.5mmol). f For some entries, more than one conversion data obtained for different time periods (separated by commas) are provided for convenience of comparison. g The amount of MnCl2 was 1.0mmol so that the metal content is the same as that of the MOF catalysts. Table 2 The influence of synthetic time and post-synthetic treatment on the catalytic activity of CPO-27-Mn. a Entry Synthetic time (h) b Methanol exchange Heating Time (h) c Conv. (%) c 1 24 − − 10 90 2 24 + − 10 >99 3 24 − + 3 >99 4 24 + + 0.2, 1 58, >99 5 4 + + 0.2, 1 60, >99 a Conditions: benzaldehyde, 5mmol; TMSCN, 10mmol; DCM, 15mL, reflux; cat., 0.5mmol (10mol%). “+”, the treatment was applied; “−”, the treatment was not applied. b The time duration of solvothermal reactions for the synthesis of the catalyst. c For some entries, more than one conversion data obtained for different time periods (separated by commas) are provided for convenience of comparison. Table 3 CPO-27-Mn catalyzed cyanosilylation of various aldehydes and ketones. a Entry Carbonyl substrate Time (min) Conv. (%) 1 60 ∼100 2 30 ∼100 3 35 ∼100 4 5 ∼100 5 60 89 6 60 97 7 60 66 8 60 61 9 60 21 10 5 ∼100 11 60 11 12 60 17 a Conditions: substrate, 5mmol; TMSCN, 10mmol; DCM, 15mL, reflux; cat., 0.5mmol (10mol%). Table 4 Influence of catalyst dose and temperature on benzaldehyde cyanosilylation over Mn-MOF and the comparison with selected MOFs studied elsewhere. a Entry Catalyst b Catalyst dose (mol%) c Temp. (°C) Time (h) d Conv. (%) d Ref. 1 CPO-27-Mn 2 40 1 63 This work 2 CPO-27-Mn 5 40 1 90 This work 3 CPO-27-Mn 10 40 1 ∼100 This work 4 CPO-27-Mn 4.5 r.t. 2, 5 30, 78 This work 5 CPO-27-Mn 10 r.t. 1, 4 54, 94 This work 6 [Cd(bpy)2](NO3)2 20 40 24 77 [36] 7 [Sm(H2L)(H3L)] 10 r.t. 16 69 [40] 8 Cu3(BTC)2 15.8 40 48 50 [41] 9 Mn3[(Mn4Cl)3(BTT)8]2 11 r.t. 9 98 [42] 10 Sc2(C4O4)3 4 r.t. 5, 12 45, 90 [43] 11 [Nd(BTC)] 4.5 r.t. 2 99 [44] 12 [Ho(BTC] 4.5 r.t. 2 76 [44] 13 [Er(BTC)] 4.5 r.t. 5 61 [44] 14 [Yb(BTC)] 4.5 r.t. 5 57 [44] 15 [Zn3(bpy)3.5(O2CH)4](ClO4)2 13 25 24 22 [45] 16 [Cd(L’)2(ClO4)2] 5 r.t. 14 92 [38] a All the catalytic reactions were performed with a 1:2 molar ratio of benzaldehyde to TMSCN in DCM. b H4L=2,2ʹ-diethoxy-1,1ʹ-binaphthalene-6,6ʹ-bisphosphonic acid, BTC=benzene 1,3,5-tricarboxylate, H3BTT=1,3,5-benzenetristetrazol-5-yl, Lʹ=bis(4-imidazol-1-yl-phenyl)diazene, bpy=4,4ʹ-bipyridine. c The catalyst doses all correspond to the molar amount of the metal ion relative to benzaldehyde. d For some entries, more than one conversion data obtained for different time periods (separated by commas) are provided for convenience of comparison. Table 5 Catalytic data for the oxidation of styrene over different CPO-27-M MOFs. a Entry Catalyst Time (h) Conv (%) Selectivity (%) A B C 1 CPO-27-Mn 2 95 38 55 7 2 CPO-27-Co 24 86 68 26 6 3 CPO-27-Ni 24 41 61 26 13 4 CPO-27-Mg 24 46 65 23 12 5 CPO-27-Zn 24 21 55 29 16 6 No catalyst 24 67 63 31 6 7 MnCl2 b 2 74 49 47 4 a Conditions: catalyst, 0.25mmol (5mol%); styrene, 5mmol; TBHP (5–6M in decane), 15mmol; 75°C. A=styrene oxide, B=benzaldehyde, C=phenylacetaldehyde. b The amount of MnCl2 was 0.5mmol so that the metal content is the same as that of the MOF catalysts. Table 6 Effect of solvents on the oxidation of styrene. a Entry Solvent Conv. (%) Selectivity (%) A B C 1 “Solvent free” 95 38 55 7 2 Acetonitrile 69 27 70 3 3 DCE 58 33 60 7 4 n-Decane 51 29 64 7 5 Benzene 44 30 59 11 6 n-hexane 31 31 64 5 7 DMF 12 36 63 1 8 Ethanol 11 32 67 1 a Conditions: catalyst, 0.25mmol; styrene, 5mmol; TBHP (5–6M in decane), 15mmol; solvent, 5mL; 75°C, 2h; DCE=1,2-dichloroethane, DMF= N,N’-dimethylformide; A=styrene oxide, B=benzaldehyde, C=phenylacetaldehyde. CPO-27-M as heterogeneous catalysts for aldehyde cyanosilylation and styrene oxidation Hong-Fei Yao Yang Yang Hui Liu Fu-Gui Xi En-Qing Gao ⁎ Shanghai Key Laboratory of Green Chemistry and Chemical Processes, Department of Chemistry, East China Normal University, Shanghai 200062, China Shanghai Key Laboratory of Green Chemistry and Chemical Processes, Department of Chemistry, East China Normal University Shanghai 200062 China ⁎ Corresponding author at: Shanghai Key Laboratory of Green Chemistry and Chemical Processes, Department of Chemistry, East China Normal University, 3663 North Zhongshan Rd., Shanghai 200062, China. Tel.: +86 21 62233404. Graphical abstract A series of isostructural 3D metal–organic frameworks of 2,5-dihydroxyterephthalate with different metal ions, CPO-27-M (or MOF-74-M, M=Co, Mg, Mn, Ni and Zn), have been studied as catalysts for cyanosilylation of aldehydes with trimethylsilylcyanide and oxidation of styrene with tert-butylhydroperoxide, and two mixed-metal Co-Mn MOFs also studied for cyanosilylation. All these MOFs are active in promoting cyanosilylation, but for styrene oxidation, only the Co and Mn MOFs are active while the others behave as initiators rather than catalysts. For both reactions, CPO-27-Mn exhibits the highest activity, and the catalytic processes are heterogeneous. Radical mechanisms were proposed for the styrene oxidation over CPO-27-Mn, which yields styrene oxide, benzaldehyde and a minor amount of phenylacetaldehyde. The cyanosilylation over CPO-27-Mn shows size selectivity towards aldehyde substrates, and the catalyst can be recycled without losing its structural integrity and catalytic activity. It is also recyclable for styrene oxidation, though the structure changes after the catalytic reaction. Keywords Metal–organic frameworks Heterogeneous catalysis Cyanosilylation Styrene oxidation Manganese 1 Introduction Metal–organic frameworks (MOFs) are a newly emerging class of porous materials that bear some intriguing features such as hybrid compositions, exceptionally high surface area, adjustable pore size as well as modifiable functionality [1,2], so they have brilliant prospects for applications such as gas adsorption/separation [3,4], drug delivery [5], chemical sensing [6], and heterogeneous catalysis [7–10]. Heterogeneous catalysts are highly desirable for several advantages in comparison with homogeneous ones, including easier recovery and recycle, less wastes and cleaner products. Furthermore, porosity can lead to enhanced reactivity and selectivity [10]. MOFs show great promise as new porous heterogeneous catalysts that can be alternative or complementary to conventional ones [10,11]. The catalytic sites of MOFs, either inherent in the frameworks or generated by post-synthetic methods [10,12], can be metal centers with unsaturated (or labile) coordination or any active groups attached to the frameworks. MOFs may also serve as host matrices encapsulating traditional catalysts such as nano-size metals, metal oxides and molecular catalysts [13–15]. The isostructural CPO-27-M (or MOF-74-M) series, of general formula M2(dhtp) (M=Co, Fe, Mg, Mn, Ni and Zn; H4dhtp=2,5-dihydroxyterephthalic acid), are 3D MOFs featuring 1D [M(μ-COO)(μ-OH)] n chains and honeycomb-like hexagonal channels with a free diameter of ∼12Å [16–23]. In the solvated forms, the channels are lined with coordinated water or DMF molecules. Upon desolvation, the metal coordination changes from octahedral to square pyramidal without compromising the framework integrity, leaving coordinatively unsaturated metal sites open to channels. The frameworks show good chemical stability, making them good candidates for heterogeneous catalysts. These materials represent a rare series of stable isostructural MOFs with a wide range of metals, offering a good opportunity to test the catalytic properties of different metal sites in almost identical environments. Furthermore, the isomorphism of these MOFs facilitates the preparation of mixed-metal catalysts with variable composition and tunable catalytic properties. However, catalytic studies with CPO-27-M are still rare, and the reactions studied have been limited to CO2 cycloaddition of epoxides (M=Co, Mg) [24–26], aerobic or H2O2 oxidation of cyclohexene (M=Co, Ni) [27,28], dehydrogenation of ammonia borane (M=Mg, Zn) [29,30] and phenol hydroxylation (M=Fe) [31]. For comparison with MIL-101-Sc, CPO-27-Ni has recently been studied for the intermolecular carbonyl ene reaction of ethylglyoxylate and the Friedel–Crafts Michael addition of indoles to methylvinyl ketone [32]. We are interested in the catalytic properties of the CPO-27-M series for two important organic reactions: carbonyl cyanosilylation and styrene oxidation. Cyanosilylation of carbonyl compounds provides a convenient route to cyanohydrins, which are versatile intermediates that can be readily converted into industrially important compounds [33,34]. Cyanosilylation of aldehydes does not require strong Lewis acidity, and it is one of most frequently used model reactions for the study of MOFs as Lewis acid catalysts [10,35–39]. Catalytic oxidation of alkenes is a fundamental reaction that finds important applications in chemical industry. The oxidation of various substrates has been accomplished using metal-containing homo- or heterogeneous catalysts, including an increasing number of MOFs [27,28,40–48]. In this paper, we present a systematic study on the catalytic properties of different CPO-27-M catalysts (M=Co, Mg, Mn, Ni and Zn) for aldehyde cyanosilylation with trimethylsilylcyanide and styrene oxidation with tert-butylhydroperoxide. After comparative investigations on these different MOFs, we are focused on the most active catalyst to study the heterogeneity, size selectivity, recyclability and the possible mechanisms. The studies on two mixed-metal catalysts, CPO-27-Mn0.57Co0.43 and CPO-27-Mn0.10Co0.90, are also included to confirm the influence of different metal ions. 2 Experimental 2.1 Materials and catalyst preparation The starting materials for catalyst synthesis [2,5-dihydroxyterephthalic acid (H4dhtp) and various metal salts] and those for catalytic reactions [trimethylsilylcyanide (TMSCN), benzaldehyde, styrene, tert-butylhydroperoxide (TBHP, 5–6M in decane)] were all used without further purifications. All of these materials except for TBHP (Sigma) were purchased from Sinopharm. CPO-27-M catalysts were synthesized by the solvothermal procedures described in the literature. For M=Co, Ni, Mg, Zn, a mixture of tetrahydrofuran (THF) and water was used as solvent, and the metal sources are metal acetates or nitrates [21,49]; CPO-27-Mn was synthesized from manganese chloride with a mixture of N,N’-dimethylformide (DMF), ethanol and water as solvent [22]. The method for CPO-27-Mn was also successfully applied to CPO-27-Co. Two mixed-metal MOFs (solid solutions) were prepared as follows. CPO-27-Mn 0.57 Co 0.43 . This compound was prepared according to the literature method for CPO-27-Mn. H4dhtp (0.34mmol, 67mg), MnCl2 . 4H2O (0.56mmol, 110mg), and CoCl2 . 6H2O (0.56mmol, 132mg) were dissolved in a mixture of DMF, ethanol and water (13/1/1, v/v; 15mL) in a 23mL Teflon lined stainless steel autoclave and heated at 135°C for 24h. After cooling to room temperature, the solid was filtered out, washed with methanol three times, and dried in air. Yield: 90%. The metal contents in the product were determined by EDS analysis CPO-27-Mn 0.10 Co 0.90 . This compound was prepared according to the literature method for CPO-27-Co. H4dhtp (0.34mmol, 67mg) in THF (1.5mL) and a solution of Co(OAc)2 . 4H2O (0.56mmol, 138mg) and Mn(OAc) . 4H2O (0.56mmol, 136mg) in H2O (2mL) were combined in the Teflon lined steel autoclave. The autoclave was sealed and heated in a pre-heated oven at 110°C for 3 days. After cooling to room temperature, the solid was filtered out, washed with methanol three times, and dried in air. Yield: 85%. The metal contents in the product were determined by EDS analysis. 2.2 Characterization The FT-IR spectra were recorded in the range 400–4000cm−1 using KBr pellets on a Nicolet NEXUS 670 spectrophotometer. Powder X-ray diffraction data were collected on a Rigaku Ultima IV diffractometer equipped with Cu-Kα at a scanning rate of 10°min−1 in the 2θ range 3–50°. The accelerating voltage and the applied current were 35 KV and 25mA, respectively. SEM study and the energy dispersive X-ray spectroscopy (EDS) analyses were carried out with a S-4800 HITACHI scanning electron microscope. Gas chromatography (GC) was conducted using a LingHua GC 9890E instrument equipped with an FID detector and an SE-54 capillary column (30m×0.25 mm×0.25μm). 2.3 Catalytic reaction Generally, before a catalytic test, the as-synthesized MOFs were activated by the following solvent-exchange and heating procedures, if not specified otherwise. The MOFs were immersed and stirred continuously in methanol for 12h, and then the liquid was decanted off. This methanol exchange procedure was repeated twice. The solid thus obtained was filtered, dried in air, transferred into a flask, heated at 170°C for 4h under dynamic vacuum, and cooled under nitrogen atmosphere to an appropriate temperature for the catalytic reaction. n-Dodecane was used as the internal standard for GC analysis. The temperature program for GC analysis was set as follows: the temperature was held at 40°C for 1min, then raised to 260°C at 30°C/min and held for 5min. Inlet and detector temperatures were 280°C. 2.3.1 Cyanosilylation of benzaldehyde The catalytic reactions were carried out in dichloromethane (DCM) solutions under nitrogen atmosphere. The solvent was dried and distilled before use. In a typical catalytic experiment, DCM (15mL), TMSCN (10mmol), n-dodecane (5mmol, as internal standard) and benzaldehyde (5mmol) were added into the flask containing activated CPO-27-M (0.5mmol). The mixture was stirred and refluxed in an oil bath. The reaction conversion was monitored by GC at different time intervals. 2.3.2 Styrene oxidation In a typical reaction, the flask containing the activated catalyst was charged with a given amount of styrene (5mmol), TBHP (5–6M in decane, 15mmol) and solvent (5mL, if needed). The reaction mixture was stirred and kept at the given temperature under nitrogen atmosphere. Aliquot samples were withdrawn at different time intervals and immediately detected by GC. 3 Results and discussion 3.1 Characterization of the catalysts The XRD patterns (Fig. 1 a) of all as-synthesized products with different metal ions (Co, Ni, Mg, Zn, and Mn) are similar to one another and in good agreement with those reported elsewhere [21,22,49], indicating that the products are isostructural and have the desired CPO-27-type structures. The XRD profiles (Fig. 1b) of the samples activated by methanol exchange and subsequent vacuum heating at 170°C showed no appreciable changes compared with those for the as-synthesized MOFs, confirming that the structural integrity of the frameworks is retained after activation. Initially, CPO-27-Mn was synthesized by a solvothermal reaction for 24h, according to a literature method [22]. However, we found that the compound can be obtained within a much shorter time, under otherwise identical conditions. The XRD pattern and the SEM picture of the sample obtained by reacting for 4h are provided as Fig. S1 in Supplementary material. It is obvious that the crystalline phase can be well formed within the reduced time. Catalytic tests (vide infra) indicated that the catalysts synthesized within 4 and 24h showed similar activity. We have also synthesized two mixed-metal MOFs, CPO-27-Mn0.57Co0.43 and CPO-27-Mn0.10Co0.90. XRD analysis indicated that they are isostructural with the parent MOFs (Fig. 2 ). Comparing the XRD patterns of the Co, Mn and Mn x Co1−x MOFs, one can see that the reflection peaks show systematic shifts towards low angles as the Mn content increases, consistent with the fact the ionic radius of Mn(II) is larger than that of Co(II). No splitting or broadening was observed for the peaks of mixed-metal systems compared with the single-metal compounds. The results suggest that the mixed-metal materials are essentially single phases (solid solutions with randomly distributed metal sites), rather than mechanical mixtures of phase-separated Co and Mn MOFs. 3.2 Catalytic properties for cyanosilylation The addition reactions of TMSCN to benzaldehyde (Scheme 1 ) were carried out to compare the catalytic performance of the different CPO-27-M MOFs (M=Co, Ni, Mg, Zn, Mn). The time dependence of benzaldehyde conversion is shown in Fig. 3 a and selected data are given in Table 1 . In all cases, the reactions of benzaldehyde with 2 molar equivalent of TMSCN in the presence of activated CPO-27-M yielded only the cyanosilylation product. Clearly, the catalytic activity is strongly dependent upon the nature of the metal ion in the catalyst. CPO-27-Co and -Ni show comparable activity with a conversion of ∼27% within 48h, which is higher by only 10% than the conversion for the blank test in the absence of any catalyst under otherwise identical conditions. CPO-27-Zn and -Mg are more active, giving much higher conversions within 48h (83% and 96%, respectively). Remarkably, CPO-27-Mn showed much higher activity than the above materials, the reaction reaching almost completion within 1h. The CPO-27-Mn catalyst was prepared by a solvothermal method using DMF as solvent (with a small amount of ethanol and water), while the other catalysts used in the above comparison were obtained by the solvothermal synthesis in a mixture of THF and water. Therefore, it should be clarified whether the exceptional activity of the Mn MOF is related to its special synthetic method. For this purpose, it is desirable to compare the CPO-27-Mn catalysts prepared by different methods. However, our efforts to synthesize CPO-27-Mn using the THF-water method proved to be unsuccessful. Nevertheless, the DMF method for CPO-27-Mn has been successfully used to prepare CPO-27-Co, making it possible to compare the CPO-27-Co catalysts obtained by two different methods. It proved that the two samples led to similar conversions (Table 1, entries 2 and 7), so it may be said that the different synthetic methods do not significantly influence the catalytic performance. To confirm that the remarkable difference in catalytic activity of the CPO-27-M MOFs is associated with the different metal centers, two mixed-metal MOFs, CPO-27-Mn0.57Co0.43 and CPO-27-Mn0.10Co0.90, which had been confirmed to be isostructural with the parent Co and Mn MOFs (Fig. 2), were tested for the same catalytic reaction. As can be seen from Table 1 (entries 8 and 9), the catalytic activity of the mixed-metal catalysts lies between the Co and Mn catalysts and increases with the Mn content. This confirms that it is the Mn(II) ion that is responsible for the remarkably high activity of CPO-27-Mn. The most active CPO-27-Mn was compared with a simple salt, manganese chloride. Under the same conditions, the salt is also active for cyanosilylation but led to a much lower conversion than CPO-Mn-27 (Table 1, entry 12. A comparison of the conversion vs. time plots is given as Fig. S2 in Supplementary material). It is obvious that the Mn MOF is superior to the salt in catalyzing the cyanosilylation reaction. The organic precursor, H4dhtp, was also tested. It turned out that the weak acid does not promote the reaction (Table 1, entry 13): no conversion was detected after 1h, and the conversion after 48h was the same as that for blank test. The catalysts used in the above catalytic experiments were activated by a general post-synthetic procedure (methanol exchange followed by heating treatment, see the experimental section). The CPO-27-Mn samples obtained by different post-synthetic procedures were also tested (Table 2 , entries 1–4). As can be seen, even the as-synthesized catalyst (no methanol exchange and no heating treatment before the catalytic test) shows significant activity for the cyanosilylation reaction, the conversion reaching 90% after 10h (entry 1). This observation may indicate that the solvent molecules coordinated to the metal centers are labile to some degree. The methanol treatment before use leads to enhanced activity, with almost complete conversion after 10h (entry 2). The heating treatment is more efficient in enhancing the activity: the reaction time required to achieve completion was dramatically reduced to 3h (entry 3). The reaction time is further reduced to 1h when both methanol exchange and subsequent heating treatment are applied to the catalyst (entry 4). These results indicate that the successive post-synthetic treatments can efficiently activate the catalyst and that the heating procedure is especially important in generating open metal sites. Hereafter in this paper, the fresh catalysts were all subjected to the general activation treatments. Table 2 also gives the catalytic data for the CPO-27-Mn sample synthesized by performing the solvothermal reaction for only 4h (entry 5). It seems that the catalytic activity is not sensitive to the synthetic time, at least in the range of 4–24h. Therefore, the CPO-27-Mn catalyst can be synthesized by a relatively time-saving procedure and activated by mild and simple treatments. To demonstrate whether the catalytic activity of the Mn MOF is due to active sites in the solid phase or to any active species leaching into the liquid phase, a control filtration test was carried out. After a reaction over CPO-27-Mn proceeded for 12min (58% conversion), the catalyst was removed by hot filtration, and the filtrate was refluxed again and monitored by GC analysis at different time intervals. The plot of benzaldehyde conversion vs. time is given in Fig. 3b, compared with the data for the reaction without filtration. The very small increase of the conversion after filtration could be attributed to a thermally activated slow reaction. The results suggest that there is no appreciable leaching of active species into the liquid phase and that the catalytic mechanism of the Mn MOF is heterogeneous in nature. To provide further evidence for the existence of Lewis acidic sites (open metal centers) in CPO-27-Mn, control experiments were performed in the presence of CPO-27-Mn and catalyst poisons (Table 1, entries 10 and 11). The conversions of benzaldehyde after 1h were dramatically decreased from 100% (in the absence of poisons) to 38% and 24% in the presence of pyridine and pyridine oxide, respectively. These results can be easily explained by the poisoning of the Lewis acid sites by strong interactions with pyridine or pyridine oxide. With the above experimental results, on can safely say that the cyanosilylation reaction over CPO-27-Mn is a Lewis-acid catalyzed process. The mechanism could be similar to that proposed elsewhere [34,39]. The open Mn(II) center interacts with the oxygen atom of benzaldehyde, thus the carbonyl group is further polarized to facilitate the nucleophilic addition by the cyanation agent. The size effects of aldehyde substrates (see below) indicates that the reaction mainly occurs within the channel of the catalyst. The recyclability of the CPO-27-Mn catalyst was also tested (Fig. 4 ). After the first reaction run (complete conversion, 1h), fresh benzaldehyde (5mmol) and TMSCN (5mmol) were added into the refluxing reaction mixture without separating out the catalyst and the product. It proved that the catalyst remained highly active with 100% conversion of benzaldehyde after 1h. If the procedure was repeated for the third run, the conversion after 1h was 86%. The reduced conversion in the third run could be due to the accumulation of product in the voids of the MOF. To support this assumption, the IR spectrum of the catalyst isolated after the third run was recorded and compared with that of the fresh catalyst (Fig. 5 a). The used catalyst shows two new bands at 2192 and 2145cm−1, attributable to the ν(C≡N) absorption of the TMSCN reactant and the cyanosilylation product, respectively. The used catalyst after the third run was washed several times with DCM (until no signals except that of DCM were detected by GC) and then reused for the fourth run. The conversion in 1h was increased to 91%. The somewhat lower conversion compared with the fresh catalyst could be due to the solid loss during the treatment. The recycling experiments indicate that the CPO-27-Mn catalyst can be reused with no need of heating reactivation and with no significant loss of activity. The XRD profiles of the catalysts isolated after the first and fourth runs are compared with that of the fresh catalyst in Fig. 5b. The crystalline phase of the catalyst is essentially retained after four cycles of reactions. Furthermore, the CPO-27-Mn catalyst was applied to the cyanosilylation of other carbonyl substrates (Table 3 ). It proved that CPO-27-Mn is highly active towards mono-substituted benzaldehydes. The three nitrobenzaldehydes show much higher reactivity than benzaldehyde, reflecting the strong electron-withdrawing effects of the nitro group. The weak electron-donating effects of the methyl group were evidenced by the fact that the three methylbenzaldehydes show somewhat lower reactivity than benzaldehyde. It is noted that the electronic effects are more significant for para-substituted substrates, with p-nitro- and p-methylbenzaldehydes showing the highest and lowest reactivity, respectively, among the mono-substituted benzaldehydes studied. p-Nitrobenzaldehyde can reach complete conversion within as short as 5min. The effects of substituent positions are open to further investigations. The catalyst shows size selectivity towards the substrates. In comparison with the complete conversion of benzaldehyde, the conversion of 1-naphthaldehyde dropped dramatically to 61% under the same conditions, and for the still larger substrate 9-anthrylaldehyde, the conversion was further decreased to only 21%. The size effect could suggest that the cyanosilylation reaction occurs mainly within the open channels of the MOF catalyst. For acetaldehyde, the catalyst shows high activity similar to that for p-nitrobenzaldehyde, the conversion reaching completion within as short as 5min. For acetone and acetophenone, the activity is much lower due to the low reactivity of ketones compared with aldehydes. A number of MOFs have been studied as catalysts for cyanosilylation of benzaldehyde and its derivatives. It is desirable to compare the performance of CPO-27-Mn with that of other MOFs studied previously. However, the reaction conditions used (catalytic dose, temperature, solvent, reaction time, the reactant ratio and even the substrate) are diverse so that it is impossible to make a meaningful comparison covering all the MOFs studied. To make the comparison to cover more (but not exhaustive) MOFs, we have performed additional reactions of benzaldehyde with TMSCN by varying the catalytic dose and the reaction temperature. As expected, the conversion within 1h increases with the amount of the catalyst and with the temperature (Table 4 , entries 1–5). The data reported for other MOF catalysts studied under comparable conditions [35,37,50–55] are also collected in Table 4. As can be seen, CPO-27-Mn is among the most active MOF catalysts for cyanosilylation addition. It is more active than most of the catalysts listed, including the Cd(II)/Zn(II) coordination polymers with neutral N-donor ligands (entries 6, 15 and 16), some MOFs with 1,3,5-benzenetricarboxylate (BTC) (entries 8, 13 and 14), the Sm(III) compound with a phosphonate ligand (entry 7), a Sc(III) species with squarate (entry 10) and the Mn(II) MOF with a tritetrazolate ligand (entry 9). Only the Nd(III) and Ho(III) MOFs with BTC (entries 11 and 12) show higher activity than CPO-27-Mn. 3.3 Catalytic properties for styrene oxidation First, we compared the catalytic ability of five CPO-27-M MOFs with different metal ions under “solvent-free” conditions (except for the decane introduced together with TBHP, no solvent was added into the reaction mixture). The time dependence of styrene conversion is shown in Fig. 6 a and selected data of conversion and selectivity are collected in Table 5 . As can be seen, the Mn and Co MOFs show different activities for the oxidation reaction, but the Mg, Zn and Ni MOFs are inactive and even have inhibition effects because the conversions in the presence of these MOFs are lower than that for the thermally activated reaction in the blank test (no catalyst). The Co MOF also plays an inhibiting role in the initial stage but becomes active after a long induction time. Although the mechanism of the inhibition effects is unclear, the activity of the Mn and Co species and the inactivity of the Zn, Mg and Ni analogs are in agreement with the different ability of these divalent metal ions in changing their oxidation state. A previous study has also revealed that the same Co MOF can catalyze the aerobic oxidation of cyclohexene while the Ni analog is totally inactive [27]. Notably, our results suggest that the Mn MOF is much more active (95% conversion after 2h) than the Co analog (86% conversion after 24h). This trend is qualitatively consistent with the fact that Mn(II) is easier to be oxidized than Co(II). The most active Mn MOF has been compared with MnCl2 for the oxidation reaction (Table 5, entry 7. A comparison of the conversion vs. time plots is given in Fig. S3 in Supplementary material). Ii turned out that he chloride salt is less active than CPO-27-Mn. During the reaction using the salt, partial dissolution of the solid was observed, and a filtration control test suggests that the catalysis with the salt is homogeneous (see Fig. S3 in the supplementary material). As shown in Table 5, the oxidation of styrene under the given conditions yielded styrene oxide (A), benzaldehyde (B), and phenylacetaldehyde (C) (Scheme 2 ). The time dependence of the conversion and yields is shown in Fig. S4 (see Supplementary material) for CPO-27-Co and -Mn. In both cases, phenylacetaldehyde is a minor product (less than 10%). With CPO-27-Mn, the selectivity for benzaldehyde is always higher than that for styrene oxide, while CPO-27-Co favors styrene oxide. The effects of temperature, catalyst dose and oxidant dose on the styrene oxidation over CPO-27-Mn were tested (see Fig. S5 in Supplementary material). As expected, the conversion increases with these reaction parameters. As far as selectivity is concerned, benzaldehyde is favored at lower temperature. Using a large amount of the catalyst (3mol% or more) or the oxidant (3equivalents) also increases the selectivity of benzaldehyde. The CPO-27-Mn catalyzed oxidation reactions were performed in various solvents for comparison with the “solvent-free” reaction. The results are compiled in Table 6 . In all solvents used, the selectivity for different products decreases in the order of benzaldehyde>styrene oxide≫phenylacetaldehyde, as observed in the solvent-free case. The results obtained for decane (Table 6, entry 4) suggest that dilution has a strong negative effect on the catalytic activity. The conversions in highly polar solvents such as ethanol and DMF are much lower than those in the other solvents, perhaps because ethanol and DMF have a strong coordination ability and lead to the blocking of metal sites. For the rest of the solvents, it seems that a more polar solvent lead to a higher conversion (acetonitrile>1,2-dichloroethane (DCE)>benzene> n-hexane). Nevertheless, the conversion of styrene in the presence of any of these solvents is significantly lower than that for the “solvent-free” reaction. Hereafter the oxidation was carried out under ‘solvent-free’ conditions. The heterogeneous character of the styrene oxidation over CPO-27-Mn was checked. After a catalytic reaction was carried out for 0.5h, the solid catalyst was filtered off from the hot mixture, and the filtrate was heated at the same temperature for some time. As shown in Fig. 6b, the reaction in the filtrate was much slower than the reaction without filtration. The slight increase of the conversion from 41% to 55% upon heating for 5.5h after filtration is most likely due to non-catalytic thermal oxidation. As also shown in Fig. 6b, the blank reaction in the absence of any catalyst reaches a conversion of 23% after 6h, confirming the occurrence of thermally activated oxidation. The above results suggest that the high reaction rate in the presence of CPO-27-Mn arises from the solid phase rather than leached species in the solution. The possible mechanism for the oxidation reaction was also investigated. To probe if radicals were involved, a radical scavenger, butyl hydroxy toluene (BHT, 2,6-di-tert-butyl-4-methylphenol), was added after the CPO-27-Mn catalyzed reaction proceeded for 0.5h. As can be seen from Fig. 6b, no further conversion of styrene was observed after the addition of BHT, indicating that both catalytic and non-catalytic processes were completely inhibited. The test suggests that the oxidation reaction proceeds via radicals. The radical mechanism for the catalytic formation of benzaldehyde and styrene oxide could be proposed as follows, similar to that for a Co(II) catalyst [48]. As shown in Scheme 3 , TBHP reacts with the Mn(II) MOF to generate a tert-butylperoxy radical. Then the radical was added to the styrene double bond to generate a benzylic radical derivative, which undergoes oxygen migration to form the epoxide (and the t-BuOH byproduct) (route I) or reacts with the tert-butylperoxy radical to give benzaldehyde via oxidative C–C bond cleavage (route II). Benzaldehyde may also be a secondary product coming from styrene oxide, the mechanism involving the ring-opening of styrene oxide with peroxides followed by C–C cleavage (route III) [56,57]. Concerning the formation of phenylacetaldehyde, it is often attributed to the Lewis-acid promoted ring-opening isomerization of styrene oxide [45,56,57], which involves a hydride migration (route IV) [58,59]. To gain information about the mechanism of aldehyde formation, we checked the product distribution of the above radical-inhibiting test and found no indications of the conversion of the epoxide product to aldehyde products (the amount of each product remained constant with time) after the styrene conversion was stopped by BHT. Furthermore, an independent control experiment was carried out, for which a mixture of styrene oxide, TBHP and CPO-27-Mn was allowed to react under the conditions used for styrene oxidation. No conversion of styrene oxide to aldehydes was detected. These results clearly suggest that both aldehydes are the primary products of styrene oxidation via radical-involving processes, rather than originating from the epoxide product, so routes III and IV could be ruled out. A possible mechanism for the formation of phenylacetaldehyde is that the benzylic radical immediate undergoes migration of a β-hydrogen to the benzylic carbon and simultaneous (or subsequent) O-O cleavage (route V). Finally, the recyclability of CPO-27-Mn for the oxidation reaction was confirmed. The conversion of styrene remains at a high level for three successive reaction cycles (Fig. 7 a) though XRD analysis indicated that the catalyst has lost the original structure and changed into an unknown phase after the first run (Fig. 7b). This represents a rare example of MOFs retaining the high catalytic activity after structural degradation. The catalytically active new phase derived from CPO-27-Mn is open to further investigations. 4 Conclusions In summary, we have presented a systematic study of using the isostructural CPO-27-M MOFs (M=Co, Mg, Mn, Ni, Zn, Mn0.57Co0.43, and Mn0.1Co0.9) as catalysts for two organic reactions, cyanosilylation of aldehydes with trimethylsilylcyanide and oxidation of styrene with tert-butylhydroperoxide. The catalytic performance is strongly dependent on the metal ion contained in the MOF. CPO-27-Mn is the most active for both reactions, while the Mg, Zn and Ni MOFs act as inhibitors rather than catalysts for the oxidation reaction. The CPO-27-Mn catalyzed cyanosilylation is heterogeneous and size selective towards aldehyde substrates, characteristic of a porous catalyst, and the catalyst retains the structural integrity and catalytic activity when recycled. Heterogeneity and reusability of CPO-27-Mn have also been confirmed for the oxidation reaction, though the structure changes after the reaction. After some intentional control tests, radical mechanisms were proposed for the formation of styrene oxide, benzaldehyde and phenylacetaldehyde from styrene. An extension of the study to more reactions is underway in this lab to further understand the great effects of different metal ions on catalytic performance of MOFs. Studies along this line may also open the possibility of using mixed-metal MOFs to tune catalytic properties and to develop catalysts for multicomponent or cascade reactions. Acknowledgements This work is supported by the National Natural Science foundation of China (NSFC no. 21173083) and the Research Fund for the Doctoral Program of Higher Education of China. Appendix A Supplementary data Supplementary data associated with this article can be found, in the online version, at http://dx.doi.org/10.1016/j.molcata.2014.06.040. Appendix A Supplementary data The following are the supplementary data to this article: References [1] H. Furukawa K.E. Cordova M. O’Keeffe O.M. Yaghi Science 341 2013 1230444 [2] C. Wang D. Liu W. Lin J. Am. Chem. Soc. 135 2013 13222 [3] Z. Zhang Y. Zhao Q. Gong Z. Li J. Li Chem. Commun. 49 2013 653 [4] M.P. Suh H.J. Park T.K. Prasad D.W. Lim Chem. Rev. 112 2012 782 [5] J. Della Rocca D.M. Liu W.B. Lin Acc. Chem. Res. 44 2011 957 [6] L.E. Kreno K. Leong O.K. Farha M. Allendorf R.P. Van Duyne J.T. Hupp Chem. Rev. 112 2012 1105 [7] P. Valvekens F. Vermoortele V.D. De Catal. Sci. Technol. 3 2013 1435 [8] A. Dhakshinamoorthy M. Opanasenko J. Cejka H. Garcia Catal. Sci. Technol. 3 2013 2509 [9] M. Yoon R. Srirambalaji K. Kim Chem. Rev. 112 2012 1196 [10] A. Corma, H. Garcia, F.X. Llabres i Xamena, Chem. Rev. 110 (2010) 4606. [11] A. Dhakshinamoorthy M. Alvaro A. Corma H. Garcia Dalton Trans. 40 2011 6344 [12] S.M. Cohen Chem. Rev. 112 2012 970 [13] H.R. Moon D.-W. Lim M.P. Suh Chem. Soc. Rev. 42 2013 1807 [14] J. Juan-Alcaniz J. Gascon F. Kapteijn J. Mater. Chem. 22 2012 10102 [15] A. Dhakshinamoorthy H. Garcia Chem. Soc. Rev. 41 2012 5262 [16] P.D.C. Dietzel Y. Morita R. Blom H. Fjellvaag Angew. Chem. Int. Ed. 44 2005 6354 [17] N.L. Rosi J. Kim M. Eddaoudi B. Chen M. O’Keeffe O.M. Yaghi J. Am. Chem. Soc. 127 2005 1504 [18] P.D.C. Dietzel B. Panella M. Hirscher R. Blom H. Fjellvag Chem. Commun. 2006 959 [19] P.D.C. Dietzel R. Blom H. Fjellvaag Eur. J. Inorg. Chem. 2008 3624 [20] S.R. Caskey A.G. Wong-Foy A.J. Matzger J. Am. Chem. Soc. 130 2008 10870 [21] P.D.C. Dietzel, R.E. Johnsen, R. Blom, H. Fjellvag, Chem. Eur. J. 14 (2008) 2389. [22] W. Zhou H. Wu T. Yildirim J. Am. Chem. Soc. 130 2008 15268 [23] E.D. Bloch L.J. Murray W.L. Queen S. Chavan S.N. Maximoff J.P. Bigi R. Krishna V.K. Peterson F. Grandjean G.J. Long B. Smit S. Bordiga C.M. Brown J.R. Long J. Am. Chem. Soc. 133 2011 14814 [24] J. Kim, S.-N. Kim, H.-G. Jang, G. Seo, W.-S. Ahn, Appl. Catal. A 453 (2013) 175. [25] D.-A. Yang H.-Y. Cho J. Kim S.-T. Yang W.-S. Ahn Energy Environ. Sci. 5 2012 6465 [26] H.-Y. Cho D.-A. Yang J. Kim S.-Y. Jeong W.-S. Ahn Catal. Today 185 2012 35 [27] Y. Fu D. Sun M. Qin R. Huang Z. Li RSC Adv. 2 2012 3309 [28] J.S. Lee S.B. Halligudi N.H. Jang D.W. Hwang J.-S. Chang Y.K. Hwang Bull. Korean Chem. Soc. 31 2010 1489 [29] G. Srinivas J. Ford W. Zhou T. Yildirim Int. J. Hydrogen Energy 37 2012 3633 [30] S. Gadipelli, J. Ford, W. Zhou, H. Wu, T.J. Udovic, T. Yildirim, Chem. Eur. J. 17 (2011) 6043. [31] S. Bhattacharjee J.S. Choi S.T. Yang S.B. Choi J. Kim W.S. Ahn J. Nanosci. Nanotechnol. 10 2010 135 [32] L. Mitchell B. Gonzalez-Santiago J.P.S. Mowat M.E. Gunn P. Williamson N. Acerbi M.L. Clarke P.A. Wright Catal. Sci. Technol. 3 2013 606 [33] R.J.H. Gregory Chem. Rev. 99 1999 3649 [34] M. North D.L. Usanov C. Young Chem. Rev. 108 2008 5146 [35] M. Fujita Y.J. Kwon S. Washizu K. Ogura J. Am. Chem. Soc. 116 1994 1151 [36] S. Neogi M.K. Sharma P.K. Bharadwaj J. Mol. Catal. A: Chem. 299 2009 1 [37] M.K. Sharma, P.P. Singh, P.K. Bharadwaj, J. Mol. Catal. A: Chem. 342–43 (2011) 6. [38] R.K. Das, A. Aijaz, M.K. Sharma, P. Lama, P.K. Bharadwaj, Chem. Eur. J. 18 (2012) 6866. [39] R.F. D’Vries M. Iglesias N. Snejko E. Gutierrez-Puebla M.A. Monge Inorg. Chem. 51 2012 11349 [40] K. Leus I. Muylaert M. Vandichel G.B. Marin M. Waroquier V. Van Speybroeck P. Van der Voort Chem. Commun. 46 2010 5085 [41] N.V. Maksimchuk K.A. Kovalenko V.P. Fedin O.A. Kholdeeva Adv. Synth. Catal. 352 2010 2943 [42] F.J. Song C. Wang J.M. Falkowski L.Q. Ma W.B. Lin J. Am. Chem. Soc. 132 2010 15390 [43] A. Dhakshinamoorthy M. Alvaro H. Garcia Catal. Sci. Technol. 1 2011 856 [44] A. Dhakshinamoorthy M. Alvaro H. Garcia J. Catal. 289 2012 259 [45] A. Dhakshinamoorthy M. Alvaro H. Garcia ACS Catal. 1 2011 836 [46] M.H. Xie X.L. Yang C.D. Wu Chem. Commun. 47 2011 5521 [47] M.J. Beier, W. Kleist, M.T. Wharmby, R. Kissner, B. Kimmerle, P.A. Wright, J.D. Grunwaldt, A. Baiker, Chem. Eur. J. 18 (2012) 887. [48] J.M. Zhang A.V. Biradar S. Pramanik T.J. Emge T. Asefa J. Li Chem. Commun. 48 2012 6541 [49] P.D.C. Dietzel P.A. Georgiev J. Eckert R. Blom T. Straessle T. Unruh Chem. Commun. 46 2010 4962 [50] O.R. Evans H.L. Ngo W. Lin J. Am. Chem. Soc. 123 2001 10395 [51] K. Schlichte T. Kratzke S. Kaskel Microporous Mesoporous Mater. 73 2004 81 [52] S. Horike M. Dinca K. Tamaki J.R. Long J. Am. Chem. Soc. 130 2008 5854 [53] F. Gandara B. Gomez-Lor M. Iglesias N. Snejko E. Gutierrez-Puebla A. Monge Chem. Commun. 2009 2393 [54] M. Gustafsson A. Bartoszewicz B. Martin-Matute J.L. Sun J. Grins T. Zhao Z.Y. Li G.S. Zhu X.D. Zou Chem. Mater. 22 2010 3316 [55] P. Phuengphai S. Youngme P. Gamez J. Reedijk Dalton Trans. 39 2010 7936 [56] M.R. Maurya A.K. Chandrakar S. Chand J. Mol. Catal. A: Chem. 263 2007 227 [57] V. Hulea E. Dumitriu Appl. Catal. A: Gen. 277 2004 99 [58] R. Srirambalaji S. Hong R. Natarajan M. Yoon R. Hota Y. Kim Y.H. Ko K. Kim Chem. Commun. 48 2012 11650 [59] B.C. Ranu U. Jana J. Org. Chem. 63 1998 8212",
      "scopus-id": "84904891912",
      "coredata": {
        "eid": "1-s2.0-S138111691400291X",
        "dc:description": "A series of isostructural 3D metal–organic frameworks of 2,5-dihydroxyterephthalate with different metal ions, CPO-27-M (or MOF-74-M, M=Co, Mg, Mn, Ni and Zn), have been studied as catalysts for cyanosilylation of aldehydes with trimethylsilylcyanide and oxidation of styrene with tert-butylhydroperoxide, and two mixed-metal Co-Mn MOFs also studied for cyanosilylation. All these MOFs are active in promoting cyanosilylation, but for styrene oxidation, only the Co and Mn MOFs are active while the others behave as initiators rather than catalysts. For both reactions, CPO-27-Mn exhibits the highest activity, and the catalytic processes are heterogeneous. Radical mechanisms were proposed for the styrene oxidation over CPO-27-Mn, which yields styrene oxide, benzaldehyde and a minor amount of phenylacetaldehyde. The cyanosilylation over CPO-27-Mn shows size selectivity towards aldehyde substrates, and the catalyst can be recycled without losing its structural integrity and catalytic activity. It is also recyclable for styrene oxidation, though the structure changes after the catalytic reaction.",
        "openArchiveArticle": "false",
        "prism:coverDate": "2014-11-15",
        "openaccessUserLicense": null,
        "prism:aggregationType": "Journal",
        "prism:url": "https://api.elsevier.com/content/article/pii/S138111691400291X",
        "dc:creator": [
          {
            "@_fa": "true",
            "$": "Yao, Hong-Fei"
          },
          {
            "@_fa": "true",
            "$": "Yang, Yang"
          },
          {
            "@_fa": "true",
            "$": "Liu, Hui"
          },
          {
            "@_fa": "true",
            "$": "Xi, Fu-Gui"
          },
          {
            "@_fa": "true",
            "$": "Gao, En-Qing"
          }
        ],
        "link": [
          {
            "@_fa": "true",
            "@rel": "self",
            "@href": "https://api.elsevier.com/content/article/pii/S138111691400291X"
          },
          {
            "@_fa": "true",
            "@rel": "scidir",
            "@href": "https://www.sciencedirect.com/science/article/pii/S138111691400291X"
          }
        ],
        "dc:format": "application/json",
        "openaccessType": null,
        "pii": "S1381-1169(14)00291-X",
        "prism:volume": "394",
        "prism:publisher": "Elsevier B.V.",
        "dc:title": "CPO-27-M as heterogeneous catalysts for aldehyde cyanosilylation and styrene oxidation",
        "prism:copyright": "Copyright © 2014 Elsevier B.V. All rights reserved.",
        "openaccess": "0",
        "prism:issn": "13811169",
        "dcterms:subject": [
          {
            "@_fa": "true",
            "$": "Metal–organic frameworks"
          },
          {
            "@_fa": "true",
            "$": "Heterogeneous catalysis"
          },
          {
            "@_fa": "true",
            "$": "Cyanosilylation"
          },
          {
            "@_fa": "true",
            "$": "Styrene oxidation"
          },
          {
            "@_fa": "true",
            "$": "Manganese"
          }
        ],
        "openaccessArticle": "false",
        "prism:publicationName": "Journal of Molecular Catalysis A: Chemical",
        "openaccessSponsorType": null,
        "prism:pageRange": "57-65",
        "prism:endingPage": "65",
        "pubType": "fla",
        "prism:coverDisplayDate": "15 November 2014",
        "prism:doi": "10.1016/j.molcata.2014.06.040",
        "prism:startingPage": "57",
        "dc:identifier": "doi:10.1016/j.molcata.2014.06.040",
        "openaccessSponsorName": null
      },
      "objects": {
        "object": [
          {
            "@category": "thumbnail",
            "@height": "92",
            "@width": "219",
            "@_fa": "true",
            "$": "https://api.elsevier.com/content/object/eid/1-s2.0-S138111691400291X-fx1.sml?httpAccept=%2A%2F%2A",
            "@multimediatype": "GIF image file",
            "@type": "IMAGE-THUMBNAIL",
            "@size": "6819",
            "@ref": "fx1",
            "@mimetype": "image/gif"
          },
          {
            "@category": "thumbnail",
            "@height": "141",
            "@width": "219",
            "@_fa": "true",
            "$": "https://api.elsevier.com/content/object/eid/1-s2.0-S138111691400291X-fx10.sml?httpAccept=%2A%2F%2A",
            "@multimediatype": "GIF image file",
            "@type": "IMAGE-THUMBNAIL",
            "@size": "5147",
            "@ref": "fx10",
            "@mimetype": "image/gif"
          },
          {
            "@category": "thumbnail",
            "@height": "81",
            "@width": "141",
            "@_fa": "true",
            "$": "https://api.elsevier.com/content/object/eid/1-s2.0-S138111691400291X-fx11.sml?httpAccept=%2A%2F%2A",
            "@multimediatype": "GIF image file",
            "@type": "IMAGE-THUMBNAIL",
            "@size": "2861",
            "@ref": "fx11",
            "@mimetype": "image/gif"
          },
          {
            "@category": "thumbnail",
            "@height": "164",
            "@width": "215",
            "@_fa": "true",
            "$": "https://api.elsevier.com/content/object/eid/1-s2.0-S138111691400291X-fx3.sml?httpAccept=%2A%2F%2A",
            "@multimediatype": "GIF image file",
            "@type": "IMAGE-THUMBNAIL",
            "@size": "5704",
            "@ref": "fx3",
            "@mimetype": "image/gif"
          },
          {
            "@category": "thumbnail",
            "@height": "164",
            "@width": "164",
            "@_fa": "true",
            "$": "https://api.elsevier.com/content/object/eid/1-s2.0-S138111691400291X-fx4.sml?httpAccept=%2A%2F%2A",
            "@multimediatype": "GIF image file",
            "@type": "IMAGE-THUMBNAIL",
            "@size": "4001",
            "@ref": "fx4",
            "@mimetype": "image/gif"
          },
          {
            "@category": "thumbnail",
            "@height": "106",
            "@width": "219",
            "@_fa": "true",
            "$": "https://api.elsevier.com/content/object/eid/1-s2.0-S138111691400291X-fx5.sml?httpAccept=%2A%2F%2A",
            "@multimediatype": "GIF image file",
            "@type": "IMAGE-THUMBNAIL",
            "@size": "3250",
            "@ref": "fx5",
            "@mimetype": "image/gif"
          },
          {
            "@category": "thumbnail",
            "@height": "125",
            "@width": "219",
            "@_fa": "true",
            "$": "https://api.elsevier.com/content/object/eid/1-s2.0-S138111691400291X-fx6.sml?httpAccept=%2A%2F%2A",
            "@multimediatype": "GIF image file",
            "@type": "IMAGE-THUMBNAIL",
            "@size": "4513",
            "@ref": "fx6",
            "@mimetype": "image/gif"
          },
          {
            "@category": "thumbnail",
            "@height": "164",
            "@width": "198",
            "@_fa": "true",
            "$": "https://api.elsevier.com/content/object/eid/1-s2.0-S138111691400291X-fx7.sml?httpAccept=%2A%2F%2A",
            "@multimediatype": "GIF image file",
            "@type": "IMAGE-THUMBNAIL",
            "@size": "4084",
            "@ref": "fx7",
            "@mimetype": "image/gif"
          },
          {
            "@category": "thumbnail",
            "@height": "102",
            "@width": "219",
            "@_fa": "true",
            "$": "https://api.elsevier.com/content/object/eid/1-s2.0-S138111691400291X-fx8.sml?httpAccept=%2A%2F%2A",
            "@multimediatype": "GIF image file",
            "@type": "IMAGE-THUMBNAIL",
            "@size": "3422",
            "@ref": "fx8",
            "@mimetype": "image/gif"
          },
          {
            "@category": "thumbnail",
            "@height": "164",
            "@width": "198",
            "@_fa": "true",
            "$": "https://api.elsevier.com/content/object/eid/1-s2.0-S138111691400291X-fx9.sml?httpAccept=%2A%2F%2A",
            "@multimediatype": "GIF image file",
            "@type": "IMAGE-THUMBNAIL",
            "@size": "5169",
            "@ref": "fx9",
            "@mimetype": "image/gif"
          },
          {
            "@category": "thumbnail",
            "@height": "164",
            "@width": "125",
            "@_fa": "true",
            "$": "https://api.elsevier.com/content/object/eid/1-s2.0-S138111691400291X-gr1.sml?httpAccept=%2A%2F%2A",
            "@multimediatype": "GIF image file",
            "@type": "IMAGE-THUMBNAIL",
            "@size": "18257",
            "@ref": "gr1",
            "@mimetype": "image/gif"
          },
          {
            "@category": "thumbnail",
            "@height": "134",
            "@width": "129",
            "@_fa": "true",
            "$": "https://api.elsevier.com/content/object/eid/1-s2.0-S138111691400291X-fx12.sml?httpAccept=%2A%2F%2A",
            "@multimediatype": "GIF image file",
            "@type": "IMAGE-THUMBNAIL",
            "@size": "3304",
            "@ref": "fx12",
            "@mimetype": "image/gif"
          },
          {
            "@category": "thumbnail",
            "@height": "164",
            "@width": "170",
            "@_fa": "true",
            "$": "https://api.elsevier.com/content/object/eid/1-s2.0-S138111691400291X-fx13.sml?httpAccept=%2A%2F%2A",
            "@multimediatype": "GIF image file",
            "@type": "IMAGE-THUMBNAIL",
            "@size": "3540",
            "@ref": "fx13",
            "@mimetype": "image/gif"
          },
          {
            "@category": "thumbnail",
            "@height": "125",
            "@width": "219",
            "@_fa": "true",
            "$": "https://api.elsevier.com/content/object/eid/1-s2.0-S138111691400291X-fx2.sml?httpAccept=%2A%2F%2A",
            "@multimediatype": "GIF image file",
            "@type": "IMAGE-THUMBNAIL",
            "@size": "4284",
            "@ref": "fx2",
            "@mimetype": "image/gif"
          },
          {
            "@category": "thumbnail",
            "@height": "140",
            "@width": "219",
            "@_fa": "true",
            "$": "https://api.elsevier.com/content/object/eid/1-s2.0-S138111691400291X-gr2.sml?httpAccept=%2A%2F%2A",
            "@multimediatype": "GIF image file",
            "@type": "IMAGE-THUMBNAIL",
            "@size": "5690",
            "@ref": "gr2",
            "@mimetype": "image/gif"
          },
          {
            "@category": "thumbnail",
            "@height": "164",
            "@width": "116",
            "@_fa": "true",
            "$": "https://api.elsevier.com/content/object/eid/1-s2.0-S138111691400291X-gr3.sml?httpAccept=%2A%2F%2A",
            "@multimediatype": "GIF image file",
            "@type": "IMAGE-THUMBNAIL",
            "@size": "4831",
            "@ref": "gr3",
            "@mimetype": "image/gif"
          },
          {
            "@category": "thumbnail",
            "@height": "114",
            "@width": "219",
            "@_fa": "true",
            "$": "https://api.elsevier.com/content/object/eid/1-s2.0-S138111691400291X-gr4.sml?httpAccept=%2A%2F%2A",
            "@multimediatype": "GIF image file",
            "@type": "IMAGE-THUMBNAIL",
            "@size": "7548",
            "@ref": "gr4",
            "@mimetype": "image/gif"
          },
          {
            "@category": "thumbnail",
            "@height": "164",
            "@width": "122",
            "@_fa": "true",
            "$": "https://api.elsevier.com/content/object/eid/1-s2.0-S138111691400291X-gr5.sml?httpAccept=%2A%2F%2A",
            "@multimediatype": "GIF image file",
            "@type": "IMAGE-THUMBNAIL",
            "@size": "5102",
            "@ref": "gr5",
            "@mimetype": "image/gif"
          },
          {
            "@category": "thumbnail",
            "@height": "163",
            "@width": "107",
            "@_fa": "true",
            "$": "https://api.elsevier.com/content/object/eid/1-s2.0-S138111691400291X-gr6.sml?httpAccept=%2A%2F%2A",
            "@multimediatype": "GIF image file",
            "@type": "IMAGE-THUMBNAIL",
            "@size": "4887",
            "@ref": "gr6",
            "@mimetype": "image/gif"
          },
          {
            "@category": "thumbnail",
            "@height": "163",
            "@width": "161",
            "@_fa": "true",
            "$": "https://api.elsevier.com/content/object/eid/1-s2.0-S138111691400291X-gr7.sml?httpAccept=%2A%2F%2A",
            "@multimediatype": "GIF image file",
            "@type": "IMAGE-THUMBNAIL",
            "@size": "8071",
            "@ref": "gr7",
            "@mimetype": "image/gif"
          },
          {
            "@category": "thumbnail",
            "@height": "42",
            "@width": "219",
            "@_fa": "true",
            "$": "https://api.elsevier.com/content/object/eid/1-s2.0-S138111691400291X-sc2.sml?httpAccept=%2A%2F%2A",
            "@multimediatype": "GIF image file",
            "@type": "IMAGE-THUMBNAIL",
            "@size": "2329",
            "@ref": "sc2",
            "@mimetype": "image/gif"
          },
          {
            "@category": "thumbnail",
            "@height": "163",
            "@width": "152",
            "@_fa": "true",
            "$": "https://api.elsevier.com/content/object/eid/1-s2.0-S138111691400291X-sc3.sml?httpAccept=%2A%2F%2A",
            "@multimediatype": "GIF image file",
            "@type": "IMAGE-THUMBNAIL",
            "@size": "4391",
            "@ref": "sc3",
            "@mimetype": "image/gif"
          },
          {
            "@category": "thumbnail",
            "@height": "34",
            "@width": "219",
            "@_fa": "true",
            "$": "https://api.elsevier.com/content/object/eid/1-s2.0-S138111691400291X-sc1.sml?httpAccept=%2A%2F%2A",
            "@multimediatype": "GIF image file",
            "@type": "IMAGE-THUMBNAIL",
            "@size": "2625",
            "@ref": "sc1",
            "@mimetype": "image/gif"
          },
          {
            "@category": "standard",
            "@height": "217",
            "@width": "339",
            "@_fa": "true",
            "$": "https://api.elsevier.com/content/object/eid/1-s2.0-S138111691400291X-gr2.gif?httpAccept=%2A%2F%2A",
            "@multimediatype": "GIF image file",
            "@type": "IMAGE-DOWNSAMPLED",
            "@size": "9436",
            "@ref": "gr2",
            "@mimetype": "image/gif"
          },
          {
            "@category": "standard",
            "@height": "556",
            "@width": "393",
            "@_fa": "true",
            "$": "https://api.elsevier.com/content/object/eid/1-s2.0-S138111691400291X-gr3.gif?httpAccept=%2A%2F%2A",
            "@multimediatype": "GIF image file",
            "@type": "IMAGE-DOWNSAMPLED",
            "@size": "23491",
            "@ref": "gr3",
            "@mimetype": "image/gif"
          },
          {
            "@category": "standard",
            "@height": "177",
            "@width": "339",
            "@_fa": "true",
            "$": "https://api.elsevier.com/content/object/eid/1-s2.0-S138111691400291X-gr4.gif?httpAccept=%2A%2F%2A",
            "@multimediatype": "GIF image file",
            "@type": "IMAGE-DOWNSAMPLED",
            "@size": "16206",
            "@ref": "gr4",
            "@mimetype": "image/gif"
          },
          {
            "@category": "standard",
            "@height": "456",
            "@width": "339",
            "@_fa": "true",
            "$": "https://api.elsevier.com/content/object/eid/1-s2.0-S138111691400291X-gr5.gif?httpAccept=%2A%2F%2A",
            "@multimediatype": "GIF image file",
            "@type": "IMAGE-DOWNSAMPLED",
            "@size": "20944",
            "@ref": "gr5",
            "@mimetype": "image/gif"
          },
          {
            "@category": "standard",
            "@height": "516",
            "@width": "339",
            "@_fa": "true",
            "$": "https://api.elsevier.com/content/object/eid/1-s2.0-S138111691400291X-gr6.gif?httpAccept=%2A%2F%2A",
            "@multimediatype": "GIF image file",
            "@type": "IMAGE-DOWNSAMPLED",
            "@size": "24084",
            "@ref": "gr6",
            "@mimetype": "image/gif"
          },
          {
            "@category": "standard",
            "@height": "344",
            "@width": "339",
            "@_fa": "true",
            "$": "https://api.elsevier.com/content/object/eid/1-s2.0-S138111691400291X-gr7.gif?httpAccept=%2A%2F%2A",
            "@multimediatype": "GIF image file",
            "@type": "IMAGE-DOWNSAMPLED",
            "@size": "23771",
            "@ref": "gr7",
            "@mimetype": "image/gif"
          },
          {
            "@category": "standard",
            "@height": "72",
            "@width": "376",
            "@_fa": "true",
            "$": "https://api.elsevier.com/content/object/eid/1-s2.0-S138111691400291X-sc2.gif?httpAccept=%2A%2F%2A",
            "@multimediatype": "GIF image file",
            "@type": "IMAGE-DOWNSAMPLED",
            "@size": "3928",
            "@ref": "sc2",
            "@mimetype": "image/gif"
          },
          {
            "@category": "standard",
            "@height": "404",
            "@width": "376",
            "@_fa": "true",
            "$": "https://api.elsevier.com/content/object/eid/1-s2.0-S138111691400291X-sc3.gif?httpAccept=%2A%2F%2A",
            "@multimediatype": "GIF image file",
            "@type": "IMAGE-DOWNSAMPLED",
            "@size": "14750",
            "@ref": "sc3",
            "@mimetype": "image/gif"
          },
          {
            "@category": "standard",
            "@height": "58",
            "@width": "376",
            "@_fa": "true",
            "$": "https://api.elsevier.com/content/object/eid/1-s2.0-S138111691400291X-sc1.gif?httpAccept=%2A%2F%2A",
            "@multimediatype": "GIF image file",
            "@type": "IMAGE-DOWNSAMPLED",
            "@size": "4595",
            "@ref": "sc1",
            "@mimetype": "image/gif"
          },
          {
            "@category": "standard",
            "@height": "200",
            "@width": "475",
            "@_fa": "true",
            "$": "https://api.elsevier.com/content/object/eid/1-s2.0-S138111691400291X-fx1.jpg?httpAccept=%2A%2F%2A",
            "@multimediatype": "JPEG image file",
            "@type": "IMAGE-DOWNSAMPLED",
            "@size": "22808",
            "@ref": "fx1",
            "@mimetype": "image/jpeg"
          },
          {
            "@category": "standard",
            "@height": "52",
            "@width": "81",
            "@_fa": "true",
            "$": "https://api.elsevier.com/content/object/eid/1-s2.0-S138111691400291X-fx10.jpg?httpAccept=%2A%2F%2A",
            "@multimediatype": "JPEG image file",
            "@type": "IMAGE-DOWNSAMPLED",
            "@size": "2271",
            "@ref": "fx10",
            "@mimetype": "image/jpeg"
          },
          {
            "@category": "standard",
            "@height": "18",
            "@width": "31",
            "@_fa": "true",
            "$": "https://api.elsevier.com/content/object/eid/1-s2.0-S138111691400291X-fx11.jpg?httpAccept=%2A%2F%2A",
            "@multimediatype": "JPEG image file",
            "@type": "IMAGE-DOWNSAMPLED",
            "@size": "603",
            "@ref": "fx11",
            "@mimetype": "image/jpeg"
          },
          {
            "@category": "standard",
            "@height": "48",
            "@width": "63",
            "@_fa": "true",
            "$": "https://api.elsevier.com/content/object/eid/1-s2.0-S138111691400291X-fx3.jpg?httpAccept=%2A%2F%2A",
            "@multimediatype": "JPEG image file",
            "@type": "IMAGE-DOWNSAMPLED",
            "@size": "1639",
            "@ref": "fx3",
            "@mimetype": "image/jpeg"
          },
          {
            "@category": "standard",
            "@height": "63",
            "@width": "63",
            "@_fa": "true",
            "$": "https://api.elsevier.com/content/object/eid/1-s2.0-S138111691400291X-fx4.jpg?httpAccept=%2A%2F%2A",
            "@multimediatype": "JPEG image file",
            "@type": "IMAGE-DOWNSAMPLED",
            "@size": "1674",
            "@ref": "fx4",
            "@mimetype": "image/jpeg"
          },
          {
            "@category": "standard",
            "@height": "48",
            "@width": "99",
            "@_fa": "true",
            "$": "https://api.elsevier.com/content/object/eid/1-s2.0-S138111691400291X-fx5.jpg?httpAccept=%2A%2F%2A",
            "@multimediatype": "JPEG image file",
            "@type": "IMAGE-DOWNSAMPLED",
            "@size": "1703",
            "@ref": "fx5",
            "@mimetype": "image/jpeg"
          },
          {
            "@category": "standard",
            "@height": "36",
            "@width": "63",
            "@_fa": "true",
            "$": "https://api.elsevier.com/content/object/eid/1-s2.0-S138111691400291X-fx6.jpg?httpAccept=%2A%2F%2A",
            "@multimediatype": "JPEG image file",
            "@type": "IMAGE-DOWNSAMPLED",
            "@size": "1370",
            "@ref": "fx6",
            "@mimetype": "image/jpeg"
          },
          {
            "@category": "standard",
            "@height": "52",
            "@width": "63",
            "@_fa": "true",
            "$": "https://api.elsevier.com/content/object/eid/1-s2.0-S138111691400291X-fx7.jpg?httpAccept=%2A%2F%2A",
            "@multimediatype": "JPEG image file",
            "@type": "IMAGE-DOWNSAMPLED",
            "@size": "1309",
            "@ref": "fx7",
            "@mimetype": "image/jpeg"
          },
          {
            "@category": "standard",
            "@height": "36",
            "@width": "78",
            "@_fa": "true",
            "$": "https://api.elsevier.com/content/object/eid/1-s2.0-S138111691400291X-fx8.jpg?httpAccept=%2A%2F%2A",
            "@multimediatype": "JPEG image file",
            "@type": "IMAGE-DOWNSAMPLED",
            "@size": "1462",
            "@ref": "fx8",
            "@mimetype": "image/jpeg"
          },
          {
            "@category": "standard",
            "@height": "52",
            "@width": "63",
            "@_fa": "true",
            "$": "https://api.elsevier.com/content/object/eid/1-s2.0-S138111691400291X-fx9.jpg?httpAccept=%2A%2F%2A",
            "@multimediatype": "JPEG image file",
            "@type": "IMAGE-DOWNSAMPLED",
            "@size": "1734",
            "@ref": "fx9",
            "@mimetype": "image/jpeg"
          },
          {
            "@category": "standard",
            "@height": "493",
            "@width": "376",
            "@_fa": "true",
            "$": "https://api.elsevier.com/content/object/eid/1-s2.0-S138111691400291X-gr1.jpg?httpAccept=%2A%2F%2A",
            "@multimediatype": "JPEG image file",
            "@type": "IMAGE-DOWNSAMPLED",
            "@size": "92275",
            "@ref": "gr1",
            "@mimetype": "image/jpeg"
          },
          {
            "@category": "standard",
            "@height": "30",
            "@width": "29",
            "@_fa": "true",
            "$": "https://api.elsevier.com/content/object/eid/1-s2.0-S138111691400291X-fx12.jpg?httpAccept=%2A%2F%2A",
            "@multimediatype": "JPEG image file",
            "@type": "IMAGE-DOWNSAMPLED",
            "@size": "735",
            "@ref": "fx12",
            "@mimetype": "image/jpeg"
          },
          {
            "@category": "standard",
            "@height": "52",
            "@width": "54",
            "@_fa": "true",
            "$": "https://api.elsevier.com/content/object/eid/1-s2.0-S138111691400291X-fx13.jpg?httpAccept=%2A%2F%2A",
            "@multimediatype": "JPEG image file",
            "@type": "IMAGE-DOWNSAMPLED",
            "@size": "1323",
            "@ref": "fx13",
            "@mimetype": "image/jpeg"
          },
          {
            "@category": "standard",
            "@height": "36",
            "@width": "63",
            "@_fa": "true",
            "$": "https://api.elsevier.com/content/object/eid/1-s2.0-S138111691400291X-fx2.jpg?httpAccept=%2A%2F%2A",
            "@multimediatype": "JPEG image file",
            "@type": "IMAGE-DOWNSAMPLED",
            "@size": "1258",
            "@ref": "fx2",
            "@mimetype": "image/jpeg"
          },
          {
            "@category": "high",
            "@height": "1918",
            "@width": "3000",
            "@_fa": "true",
            "$": "https://api.elsevier.com/content/object/eid/1-s2.0-S138111691400291X-gr2_lrg.gif?httpAccept=%2A%2F%2A",
            "@multimediatype": "GIF image file",
            "@type": "IMAGE-HIGH-RES",
            "@size": "43786",
            "@ref": "gr2",
            "@mimetype": "image/gif"
          },
          {
            "@category": "high",
            "@height": "4932",
            "@width": "3484",
            "@_fa": "true",
            "$": "https://api.elsevier.com/content/object/eid/1-s2.0-S138111691400291X-gr3_lrg.gif?httpAccept=%2A%2F%2A",
            "@multimediatype": "GIF image file",
            "@type": "IMAGE-HIGH-RES",
            "@size": "118904",
            "@ref": "gr3",
            "@mimetype": "image/gif"
          },
          {
            "@category": "high",
            "@height": "1564",
            "@width": "3000",
            "@_fa": "true",
            "$": "https://api.elsevier.com/content/object/eid/1-s2.0-S138111691400291X-gr4_lrg.gif?httpAccept=%2A%2F%2A",
            "@multimediatype": "GIF image file",
            "@type": "IMAGE-HIGH-RES",
            "@size": "82875",
            "@ref": "gr4",
            "@mimetype": "image/gif"
          },
          {
            "@category": "high",
            "@height": "4038",
            "@width": "3000",
            "@_fa": "true",
            "$": "https://api.elsevier.com/content/object/eid/1-s2.0-S138111691400291X-gr5_lrg.gif?httpAccept=%2A%2F%2A",
            "@multimediatype": "GIF image file",
            "@type": "IMAGE-HIGH-RES",
            "@size": "109104",
            "@ref": "gr5",
            "@mimetype": "image/gif"
          },
          {
            "@category": "high",
            "@height": "4564",
            "@width": "3000",
            "@_fa": "true",
            "$": "https://api.elsevier.com/content/object/eid/1-s2.0-S138111691400291X-gr6_lrg.gif?httpAccept=%2A%2F%2A",
            "@multimediatype": "GIF image file",
            "@type": "IMAGE-HIGH-RES",
            "@size": "118588",
            "@ref": "gr6",
            "@mimetype": "image/gif"
          },
          {
            "@category": "high",
            "@height": "3046",
            "@width": "3000",
            "@_fa": "true",
            "$": "https://api.elsevier.com/content/object/eid/1-s2.0-S138111691400291X-gr7_lrg.gif?httpAccept=%2A%2F%2A",
            "@multimediatype": "GIF image file",
            "@type": "IMAGE-HIGH-RES",
            "@size": "118736",
            "@ref": "gr7",
            "@mimetype": "image/gif"
          },
          {
            "@category": "high",
            "@height": "640",
            "@width": "3334",
            "@_fa": "true",
            "$": "https://api.elsevier.com/content/object/eid/1-s2.0-S138111691400291X-sc2_lrg.gif?httpAccept=%2A%2F%2A",
            "@multimediatype": "GIF image file",
            "@type": "IMAGE-HIGH-RES",
            "@size": "16289",
            "@ref": "sc2",
            "@mimetype": "image/gif"
          },
          {
            "@category": "high",
            "@height": "3584",
            "@width": "3334",
            "@_fa": "true",
            "$": "https://api.elsevier.com/content/object/eid/1-s2.0-S138111691400291X-sc3_lrg.gif?httpAccept=%2A%2F%2A",
            "@multimediatype": "GIF image file",
            "@type": "IMAGE-HIGH-RES",
            "@size": "74127",
            "@ref": "sc3",
            "@mimetype": "image/gif"
          },
          {
            "@category": "high",
            "@height": "516",
            "@width": "3334",
            "@_fa": "true",
            "$": "https://api.elsevier.com/content/object/eid/1-s2.0-S138111691400291X-sc1_lrg.gif?httpAccept=%2A%2F%2A",
            "@multimediatype": "GIF image file",
            "@type": "IMAGE-HIGH-RES",
            "@size": "19303",
            "@ref": "sc1",
            "@mimetype": "image/gif"
          },
          {
            "@category": "high",
            "@height": "886",
            "@width": "2103",
            "@_fa": "true",
            "$": "https://api.elsevier.com/content/object/eid/1-s2.0-S138111691400291X-fx1_lrg.jpg?httpAccept=%2A%2F%2A",
            "@multimediatype": "JPEG image file",
            "@type": "IMAGE-HIGH-RES",
            "@size": "157378",
            "@ref": "fx1",
            "@mimetype": "image/jpeg"
          },
          {
            "@category": "high",
            "@height": "233",
            "@width": "361",
            "@_fa": "true",
            "$": "https://api.elsevier.com/content/object/eid/1-s2.0-S138111691400291X-fx10_lrg.jpg?httpAccept=%2A%2F%2A",
            "@multimediatype": "JPEG image file",
            "@type": "IMAGE-HIGH-RES",
            "@size": "14447",
            "@ref": "fx10",
            "@mimetype": "image/jpeg"
          },
          {
            "@category": "high",
            "@height": "81",
            "@width": "141",
            "@_fa": "true",
            "$": "https://api.elsevier.com/content/object/eid/1-s2.0-S138111691400291X-fx11_lrg.jpg?httpAccept=%2A%2F%2A",
            "@multimediatype": "JPEG image file",
            "@type": "IMAGE-HIGH-RES",
            "@size": "2842",
            "@ref": "fx11",
            "@mimetype": "image/jpeg"
          },
          {
            "@category": "high",
            "@height": "215",
            "@width": "282",
            "@_fa": "true",
            "$": "https://api.elsevier.com/content/object/eid/1-s2.0-S138111691400291X-fx3_lrg.jpg?httpAccept=%2A%2F%2A",
            "@multimediatype": "JPEG image file",
            "@type": "IMAGE-HIGH-RES",
            "@size": "10211",
            "@ref": "fx3",
            "@mimetype": "image/jpeg"
          },
          {
            "@category": "high",
            "@height": "283",
            "@width": "283",
            "@_fa": "true",
            "$": "https://api.elsevier.com/content/object/eid/1-s2.0-S138111691400291X-fx4_lrg.jpg?httpAccept=%2A%2F%2A",
            "@multimediatype": "JPEG image file",
            "@type": "IMAGE-HIGH-RES",
            "@size": "10542",
            "@ref": "fx4",
            "@mimetype": "image/jpeg"
          },
          {
            "@category": "high",
            "@height": "213",
            "@width": "439",
            "@_fa": "true",
            "$": "https://api.elsevier.com/content/object/eid/1-s2.0-S138111691400291X-fx5_lrg.jpg?httpAccept=%2A%2F%2A",
            "@multimediatype": "JPEG image file",
            "@type": "IMAGE-HIGH-RES",
            "@size": "10733",
            "@ref": "fx5",
            "@mimetype": "image/jpeg"
          },
          {
            "@category": "high",
            "@height": "162",
            "@width": "283",
            "@_fa": "true",
            "$": "https://api.elsevier.com/content/object/eid/1-s2.0-S138111691400291X-fx6_lrg.jpg?httpAccept=%2A%2F%2A",
            "@multimediatype": "JPEG image file",
            "@type": "IMAGE-HIGH-RES",
            "@size": "8063",
            "@ref": "fx6",
            "@mimetype": "image/jpeg"
          },
          {
            "@category": "high",
            "@height": "233",
            "@width": "281",
            "@_fa": "true",
            "$": "https://api.elsevier.com/content/object/eid/1-s2.0-S138111691400291X-fx7_lrg.jpg?httpAccept=%2A%2F%2A",
            "@multimediatype": "JPEG image file",
            "@type": "IMAGE-HIGH-RES",
            "@size": "7842",
            "@ref": "fx7",
            "@mimetype": "image/jpeg"
          },
          {
            "@category": "high",
            "@height": "162",
            "@width": "348",
            "@_fa": "true",
            "$": "https://api.elsevier.com/content/object/eid/1-s2.0-S138111691400291X-fx8_lrg.jpg?httpAccept=%2A%2F%2A",
            "@multimediatype": "JPEG image file",
            "@type": "IMAGE-HIGH-RES",
            "@size": "8372",
            "@ref": "fx8",
            "@mimetype": "image/jpeg"
          },
          {
            "@category": "high",
            "@height": "233",
            "@width": "282",
            "@_fa": "true",
            "$": "https://api.elsevier.com/content/object/eid/1-s2.0-S138111691400291X-fx9_lrg.jpg?httpAccept=%2A%2F%2A",
            "@multimediatype": "JPEG image file",
            "@type": "IMAGE-HIGH-RES",
            "@size": "10917",
            "@ref": "fx9",
            "@mimetype": "image/jpeg"
          },
          {
            "@category": "high",
            "@height": "2184",
            "@width": "1667",
            "@_fa": "true",
            "$": "https://api.elsevier.com/content/object/eid/1-s2.0-S138111691400291X-gr1_lrg.jpg?httpAccept=%2A%2F%2A",
            "@multimediatype": "JPEG image file",
            "@type": "IMAGE-HIGH-RES",
            "@size": "551174",
            "@ref": "gr1",
            "@mimetype": "image/jpeg"
          },
          {
            "@category": "high",
            "@height": "134",
            "@width": "129",
            "@_fa": "true",
            "$": "https://api.elsevier.com/content/object/eid/1-s2.0-S138111691400291X-fx12_lrg.jpg?httpAccept=%2A%2F%2A",
            "@multimediatype": "JPEG image file",
            "@type": "IMAGE-HIGH-RES",
            "@size": "3141",
            "@ref": "fx12",
            "@mimetype": "image/jpeg"
          },
          {
            "@category": "high",
            "@height": "233",
            "@width": "242",
            "@_fa": "true",
            "$": "https://api.elsevier.com/content/object/eid/1-s2.0-S138111691400291X-fx13_lrg.jpg?httpAccept=%2A%2F%2A",
            "@multimediatype": "JPEG image file",
            "@type": "IMAGE-HIGH-RES",
            "@size": "7328",
            "@ref": "fx13",
            "@mimetype": "image/jpeg"
          },
          {
            "@category": "high",
            "@height": "161",
            "@width": "283",
            "@_fa": "true",
            "$": "https://api.elsevier.com/content/object/eid/1-s2.0-S138111691400291X-fx2_lrg.jpg?httpAccept=%2A%2F%2A",
            "@multimediatype": "JPEG image file",
            "@type": "IMAGE-HIGH-RES",
            "@size": "7453",
            "@ref": "fx2",
            "@mimetype": "image/jpeg"
          },
          {
            "@category": "standard",
            "@_fa": "true",
            "$": "https://api.elsevier.com/content/object/eid/1-s2.0-S138111691400291X-mmc1.pdf?httpAccept=%2A%2F%2A",
            "@multimediatype": "Acrobat PDF file",
            "@type": "APPLICATION",
            "@size": "208695",
            "@ref": "mmc1",
            "@mimetype": "application/pdf"
          }
        ]
      },
      "link": {
        "@rel": "abstract",
        "@href": "https://api.elsevier.com/content/abstract/scopus_id/84904891912"
      }
    }
  }
}