{
  "metadata": {
    "title": "JOURNAL OF MOLECULAR CATALYSIS B. ENZYMATIC",
    "authors": "",
    "journal": "Journal of Molecular Catalysis B: Enzymatic",
    "date": "2003-07-11",
    "doi": "10.1016/S1381-1177(03)00117-6",
    "abstract": "",
    "uri": "https://api.elsevier.com/content/article/pii/S1381117703001176",
    "pii": "S1381117703001176"
  },
  "fulltext": {
    "full-text-retrieval-response": {
      "originalText": "serial JL 271400 291210 291744 291809 291847 31 Journal of Molecular Catalysis B: Enzymatic JOURNALMOLECULARCATALYSISBENZYMATIC 2003-06-24 2003-06-24 2010-03-26T10:38:01 1-s2.0-S1381117703001176 S1381-1177(03)00117-6 S1381117703001176 10.1016/S1381-1177(03)00117-6 S300 S300.1 FULL-TEXT 1-s2.0-S1381117700X00586 2024-01-02T09:51:08.530659Z 0 0 20030711 2003 2003-06-24T00:00:00Z articleinfo crossmark dco dateupdated tomb dateloaded datesearch indexeddate issuelist volumelist yearnav articletitlenorm cid cids confeditor contenttype copyright dateloadedtxt docsubtype doctype doi eid ewtransactionid hubeid issfirst issn issnnorm itemstage itemtransactionid itemweight openaccess openarchive pg pgfirst pii piinorm pubdatestart pubdatetxt pubyr sortorder srctitle srctitlenorm srctype vol volfirst volissue webpdf webpdfpagecount table body articletitle alllist content subj ssids 1381-1177 13811177 22 22 5 6 5 6 Volume 22, Issues 5–6 1 IFC IFC 20030711 11 July 2003 2003-07-11 2003 Synthesis, Testing and Pharmacological Applications of Inhibitors of Lipolytic Enzymes Dr. Luciano Saso converted-article edi Copyright © 2003 Published by Elsevier B.V. JOURNALMOLECULARCATALYSISBENZYMATIC item S1381-1177(03)00117-6 S1381117703001176 1-s2.0-S1381117703001176 10.1016/S1381-1177(03)00117-6 271400 2024-01-02T09:51:08.530659Z 2003-07-11 1-s2.0-S1381117703001176-main.pdf https://s3.amazonaws.com/prod-ucs-content-store-us-east/content/pii:S1381117703001176/MAIN/application/pdf/b086f25f0de610d852d8ba9f8f01f331/main.pdf https://s3-eu-west-1.amazonaws.com/prod-ucs-content-store-eu-west/content/pii:S1381117703001176/MAIN/application/pdf/b086f25f0de610d852d8ba9f8f01f331/main.pdf main.pdf pdf true 50738 MAIN 1 1-s2.0-S1381117703001176-main_1.png https://s3.amazonaws.com/prod-ucs-content-store-us-east/content/pii:S1381117703001176/PREVIEW/image/png/6f4866cefc8962729455f2ebc6e007d6/main_1.png https://s3-eu-west-1.amazonaws.com/prod-ucs-content-store-eu-west/content/pii:S1381117703001176/PREVIEW/image/png/6f4866cefc8962729455f2ebc6e007d6/main_1.png main_1.png png 55504 849 656 IMAGE-WEB-PDF 1 MOLCAB 80000521 S1381-1177(03)00117-6 10.1016/S1381-1177(03)00117-6 JOURNAL OF MOLECULAR CATALYSIS B. ENZYMATIC Editor-in-Chief: Editors: Professor R.A. Sheldon Professor Y. Asano Professor J.D. Stewart Department of Organic Chemistry Biotechnology Research Center The University of Florida and Catalysis Toyama Prefectural University Department of Chemistry Faculty of Chemical Technology 5180 Kurokawa, Kosugi 127 Chemistry Research Building and Materials Science Toyama 939-0398 Gainesville, FL 32611-7200 Delft University of Technology Japan USA Julianalaan 136 Tel.: (+81-766) 567500 ext. 530 Tel.: +1 352 846 0743 2628 BL Delft Fax: (+81-766) 562498 Fax: +1 352 846 2095 Netherlands e-mail: asano@pu-toyama.ac.jp e-mail: jds2@chem.ufl.edu Tel.: (+31-15) 2782675 Fax: (+31-15) 2781415 e-mail: r.a.sheldon@stm.tudelft.nl Editorial Board P. Adlercreutz (Lund, Sweden) R.J. Kazlauskas (Montreal, Canada) S. Shimizu (Kyoto, Japan) A. Bommarius (Atlanta, USA) R.M. Kelly (Raleigh, NC, USA) Sim Tiow Suan (Singapore) S.G. Burton (Grahamstown, South Africa) H.-S. Kim (Taejon, Korea) J.T. Sime (Ashford, UK) J.M.S. Cabral (Lisbon, Portugal) A. Klibanov (Cambridge, MA, USA) J. Stewart (Gainesville, USA) D.H. Crout (Coventry, UK) T. Koyama (Sendai, Japan) V.K. Švedas (Moscow, Russia) W.-D. Fessner (Darmstadt, Germany) J. Lalonde (Cambridge, USA) N.J. Tumer (Edinburgh, UK) L. Fischer (Stuttgart, Germany) K. Nakamura (Kyoto, Japan) E.J. Vandamme (Ghent, Belgium) R. Furstoss (Marseille, France) H. Ohta (Yokohama, Japan) C. Wandrey (Jülich, Germany) P.J. Halling (Glasgow, UK) M. Palcic (Edmonton, Canada) B. Witholt (Zürich, Switzerland) H.L. Holland (St Catherines, Canada) M.P. Schneider (Wuppertal, Germany) J.H. Xu (Shanghai, China) S. Horinouchi (Tokyo, Japan) S. Servi (Milano, Italy) A. Zaks (New Jersey, USA) Scope The Journal of Molecular Catalysis B: Enzymatic provides an international forum devoted to research and developments in the applications of whole-cell and cell-free enzymes as catalysts in organic synthesis. Emphasis is placed on mechanistic and synthetic aspects of the biocatalytic transformation.The journal publishes papers on: – industrial applications of enzymatic processes, e.g., in fine chemical synthesis; – chemo-, regio- and enantioselective transformations; – screening for biocatalysts; – integration of biocatalytic and chemical steps in organic synthesis; – novel biocatalysts, e.g., enzymes for extremophiles and catalytic antibodies; – enzyme immobilization and stabilization, particularly in non-conventional media; – bioprocess engineering aspects, e.g., membrane bioreactors; – improvement of catalytic performance of enzymes, e.g., by protein engineering or chemical modification; – structural studies, including computer simulation, relating to substrate specificity and reaction selectivity; – biomimetic studies related to enzymatic transformations. Types of contribution – Letters (maximum 1500 words; will receive preferential treatment in editorial processing) – Invited Subject Reviews – Book Reviews – Original Papers – Conference Announcements and News Frequency The journal appears eight times a year.",
      "coredata": {
        "eid": "1-s2.0-S1381117703001176",
        "dc:description": null,
        "openArchiveArticle": "false",
        "prism:coverDate": "2003-07-11",
        "openaccessUserLicense": null,
        "prism:aggregationType": "Journal",
        "prism:url": "https://api.elsevier.com/content/article/pii/S1381117703001176",
        "link": [
          {
            "@_fa": "true",
            "@rel": "self",
            "@href": "https://api.elsevier.com/content/article/pii/S1381117703001176"
          },
          {
            "@_fa": "true",
            "@rel": "scidir",
            "@href": "https://www.sciencedirect.com/science/article/pii/S1381117703001176"
          }
        ],
        "dc:format": "application/json",
        "openaccessType": null,
        "pii": "S1381-1177(03)00117-6",
        "prism:volume": "22",
        "prism:publisher": "Published by Elsevier B.V.",
        "dc:title": "JOURNAL OF MOLECULAR CATALYSIS B. ENZYMATIC",
        "prism:copyright": "Copyright © 2003 Published by Elsevier B.V.",
        "prism:issueName": "Synthesis, Testing and Pharmacological Applications of Inhibitors of Lipolytic Enzymes",
        "openaccess": "0",
        "prism:issn": "13811177",
        "prism:issueIdentifier": "5-6",
        "openaccessArticle": "false",
        "prism:publicationName": "Journal of Molecular Catalysis B: Enzymatic",
        "prism:number": "5-6",
        "openaccessSponsorType": null,
        "prism:pageRange": "IFC",
        "pubType": "edi",
        "prism:coverDisplayDate": "11 July 2003",
        "prism:doi": "10.1016/S1381-1177(03)00117-6",
        "prism:startingPage": "IFC",
        "dc:identifier": "doi:10.1016/S1381-1177(03)00117-6",
        "openaccessSponsorName": null
      }
    }
  }
}