{
  "metadata": {
    "title": "Experimental and theoretical studies on ethylene polymerization using SiO<ce:inf loc=post>2</ce:inf>-supported silyl chromate type catalysts prepared by a green method",
    "authors": "; ; ",
    "journal": "Journal of Molecular Catalysis A: Chemical",
    "date": "2010-09-01",
    "doi": "10.1016/j.molcata.2010.07.002",
    "abstract": "",
    "uri": "https://api.elsevier.com/content/article/pii/S1381116910002852",
    "pii": "S1381116910002852"
  },
  "fulltext": {
    "full-text-retrieval-response": {
      "scopus-eid": "2-s2.0-77956961541",
      "originalText": "serial JL 271358 291210 291744 291790 291809 31 Journal of Molecular Catalysis A: Chemical JOURNALMOLECULARCATALYSISACHEMICAL 2010-07-08 2010-07-08 2010-10-31T17:19:41 1-s2.0-S1381116910002852 S1381-1169(10)00285-2 S1381116910002852 10.1016/j.molcata.2010.07.002 S300 S300.1 FULL-TEXT 1-s2.0-S1381116910X00139 2015-05-15T05:56:33.607047-04:00 0 0 20100901 2010 2010-07-08T00:00:00Z articleinfo crossmark dco dateupdated tomb dateloaded datesearch indexeddate issuelist volumelist yearnav absattachment articletitlenorm authfirstinitialnorm authfirstsurnamenorm cid cids contenttype copyright dateloadedtxt docsubtype doctype doi eid ewtransactionid hubeid issfirst issn issnnorm itemstage itemtransactionid itemweight openaccess openarchive pg pgfirst pglast pii piinorm pubdatestart pubdatetxt pubyr sectiontitle sortorder srctitle srctitlenorm srctype subheadings volfirst volissue webpdf webpdfpagecount figure table e-component body acknowledge affil appendices articletitle auth authfirstini authfull authkeywords authlast primabst ref specialabst alllist content subj ssids 1381-1169 13811169 330 330 1 2 1 2 Volume 330, Issues 1–2 10 56 65 56 65 20100901 1 September 2010 2010-09-01 2010 Regular papers article fla Copyright © 2010 Elsevier B.V. All rights reserved. EXPERIMENTALTHEORETICALSTUDIESETHYLENEPOLYMERIZATIONUSINGSIO2SUPPORTEDSILYLCHROMATETYPECATALYSTSPREPAREDBYAGREENMETHOD LI X 1 Introduction 2 Experimental 2.1 Raw materials 2.2 Catalyst preparation and characterization 2.2.1 Catalyst preparation 2.2.2 Characterization of catalysts and polyethylene products 2.3 Ethylene polymerization 3 Computational 4 Results and discussion 4.1 Characterization of catalysts and polyethylene products 4.2 Ethylene polymerization kinetics of catalysts 4.3 Effect of calcination temperatures on ethylene polymerization kinetics 4.4 Effect of hydroxyl on ethylene polymerization 4.5 Modification of PS catalyst by alkyl chlorosilane 5 Conclusion Acknowledgements Appendix A Supplementary data References RANDOLL 2008 3232 S KAROL 1972 2621 F CARRICK 1972 2609 W MCDANIEL 1985 47 M CANN 2004 29 K FANG 2006 240 Y BAKER 1970 774 L GASPAR 2001 105 A GASPAR 2002 241 A LI 2006 1 Y ESPELID 2002 366 O SCHMID 2000 265 R ESPELID 2002 331 O LIU 2006 234 B LIU 2004 963 B ESPELID 2002 177 O ESPELID 1998 10414 O ESPELID 2000 125 O GASPAR 2005 939 A RUDDICK 1997 9240 V RUDDICK 1996 11062 V RUDDICK 1997 469 V LIU 2004 165 B AUGUSTINE 1996 641 S QIU 2009 660 P BECKE 1988 3098 A LEE 1988 785 C HAY 1985 270 P GONZALEZ 1990 5523 C FANG 2006 295 Y DEMMELMAIER 2008 6439 C DEMMELMAIER 2009 44 C FANG 2005 131 Y MCDANIEL 1983 98 M NISHIMURA 1993 149 M KRAUSS 1975 97 H GROENEVELD 1979 153 C WITTGEN 1982 360 P COSSEE 1964 80 P REBENSTORF 1991 59 B VANSANT 1995 266 E LIX2010X56 LIX2010X56X65 LIX2010X56XX LIX2010X56X65XX item S1381-1169(10)00285-2 S1381116910002852 1-s2.0-S1381116910002852 10.1016/j.molcata.2010.07.002 271358 2010-12-01T15:42:23.163839-05:00 2010-09-01 1-s2.0-S1381116910002852-main.pdf https://s3.amazonaws.com/prod-ucs-content-store-us-east/content/pii:S1381116910002852/MAIN/application/pdf/47c1cfa201c3dfec14a5d9805ab2fbae/main.pdf https://s3-eu-west-1.amazonaws.com/prod-ucs-content-store-eu-west/content/pii:S1381116910002852/MAIN/application/pdf/47c1cfa201c3dfec14a5d9805ab2fbae/main.pdf main.pdf pdf true 389188 MAIN 10 1-s2.0-S1381116910002852-main_1.png https://s3-eu-west-1.amazonaws.com/prod-ucs-content-store-eu-west/content/pii:S1381116910002852/PREVIEW/image/png/d9852d27dd3fd05f0a7c3c127dbb7958/main_1.png https://s3.amazonaws.com/prod-ucs-content-store-us-east/content/pii:S1381116910002852/PREVIEW/image/png/d9852d27dd3fd05f0a7c3c127dbb7958/main_1.png main_1.png png 86136 849 656 IMAGE-WEB-PDF 1 1-s2.0-S1381116910002852-mmc1.doc https://s3.amazonaws.com/prod-ucs-content-store-us-east/content/pii:S1381116910002852/mmc1/MAIN/application/msword/c83690af7d3e2e2886c11040bf7195cb/mmc1.doc https://s3-eu-west-1.amazonaws.com/prod-ucs-content-store-eu-west/content/pii:S1381116910002852/mmc1/MAIN/application/msword/c83690af7d3e2e2886c11040bf7195cb/mmc1.doc mmc1 mmc1.doc doc 117248 APPLICATION 1-s2.0-S1381116910002852-fx1.jpg https://s3.amazonaws.com/prod-ucs-content-store-us-east/content/pii:S1381116910002852/fx1/DOWNSAMPLED/image/jpeg/81676ef49c5ac077ce639321562e6570/fx1.jpg https://s3-eu-west-1.amazonaws.com/prod-ucs-content-store-eu-west/content/pii:S1381116910002852/fx1/DOWNSAMPLED/image/jpeg/81676ef49c5ac077ce639321562e6570/fx1.jpg fx1 true fx1.jpg jpg 7378 156 222 IMAGE-DOWNSAMPLED 1-s2.0-S1381116910002852-fx1.sml https://s3.amazonaws.com/prod-ucs-content-store-us-east/content/pii:S1381116910002852/fx1/THUMBNAIL/image/gif/666a367baa261b531be87a1ed6599f29/fx1.sml https://s3-eu-west-1.amazonaws.com/prod-ucs-content-store-eu-west/content/pii:S1381116910002852/fx1/THUMBNAIL/image/gif/666a367baa261b531be87a1ed6599f29/fx1.sml fx1 true fx1.sml sml 2702 154 219 IMAGE-THUMBNAIL 1-s2.0-S1381116910002852-fx1_lrg.jpg https://s3.amazonaws.com/prod-ucs-content-store-us-east/content/pii:S1381116910002852/fx1/HIGHRES/image/jpeg/955c24b29cc486ad110e3ae3db1cf8f8/fx1_lrg.jpg https://s3-eu-west-1.amazonaws.com/prod-ucs-content-store-eu-west/content/pii:S1381116910002852/fx1/HIGHRES/image/jpeg/955c24b29cc486ad110e3ae3db1cf8f8/fx1_lrg.jpg fx1 fx1_lrg.jpg jpg 63925 691 984 IMAGE-HIGH-RES 1-s2.0-S1381116910002852-gr1.jpg https://s3.amazonaws.com/prod-ucs-content-store-us-east/content/pii:S1381116910002852/gr1/DOWNSAMPLED/image/jpeg/776f9f2a6afc4ca113253697640fe7e5/gr1.jpg https://s3-eu-west-1.amazonaws.com/prod-ucs-content-store-eu-west/content/pii:S1381116910002852/gr1/DOWNSAMPLED/image/jpeg/776f9f2a6afc4ca113253697640fe7e5/gr1.jpg gr1 gr1.jpg jpg 15637 289 376 IMAGE-DOWNSAMPLED 1-s2.0-S1381116910002852-gr1.sml https://s3.amazonaws.com/prod-ucs-content-store-us-east/content/pii:S1381116910002852/gr1/THUMBNAIL/image/gif/4c9cf09936ff43342be3efaeabb1df65/gr1.sml https://s3-eu-west-1.amazonaws.com/prod-ucs-content-store-eu-west/content/pii:S1381116910002852/gr1/THUMBNAIL/image/gif/4c9cf09936ff43342be3efaeabb1df65/gr1.sml gr1 gr1.sml sml 2237 164 213 IMAGE-THUMBNAIL 1-s2.0-S1381116910002852-gr1_lrg.jpg https://s3.amazonaws.com/prod-ucs-content-store-us-east/content/pii:S1381116910002852/gr1/HIGHRES/image/jpeg/fd8e623a08a55463fdece5a2837e7e8b/gr1_lrg.jpg https://s3-eu-west-1.amazonaws.com/prod-ucs-content-store-eu-west/content/pii:S1381116910002852/gr1/HIGHRES/image/jpeg/fd8e623a08a55463fdece5a2837e7e8b/gr1_lrg.jpg gr1 gr1_lrg.jpg jpg 109723 1280 1665 IMAGE-HIGH-RES 1-s2.0-S1381116910002852-gr2.jpg https://s3.amazonaws.com/prod-ucs-content-store-us-east/content/pii:S1381116910002852/gr2/DOWNSAMPLED/image/jpeg/5771c12598cb2c1c7f2d09e32704c3f1/gr2.jpg https://s3-eu-west-1.amazonaws.com/prod-ucs-content-store-eu-west/content/pii:S1381116910002852/gr2/DOWNSAMPLED/image/jpeg/5771c12598cb2c1c7f2d09e32704c3f1/gr2.jpg gr2 gr2.jpg jpg 41811 795 339 IMAGE-DOWNSAMPLED 1-s2.0-S1381116910002852-gr2.sml https://s3.amazonaws.com/prod-ucs-content-store-us-east/content/pii:S1381116910002852/gr2/THUMBNAIL/image/gif/c1f33ffd38979fbbfb42fc62c4147108/gr2.sml https://s3-eu-west-1.amazonaws.com/prod-ucs-content-store-eu-west/content/pii:S1381116910002852/gr2/THUMBNAIL/image/gif/c1f33ffd38979fbbfb42fc62c4147108/gr2.sml gr2 gr2.sml sml 1736 164 70 IMAGE-THUMBNAIL 1-s2.0-S1381116910002852-gr2_lrg.jpg https://s3.amazonaws.com/prod-ucs-content-store-us-east/content/pii:S1381116910002852/gr2/HIGHRES/image/jpeg/341aa445a156bb088fd4e487b9640585/gr2_lrg.jpg https://s3-eu-west-1.amazonaws.com/prod-ucs-content-store-eu-west/content/pii:S1381116910002852/gr2/HIGHRES/image/jpeg/341aa445a156bb088fd4e487b9640585/gr2_lrg.jpg gr2 gr2_lrg.jpg jpg 335857 3521 1501 IMAGE-HIGH-RES 1-s2.0-S1381116910002852-gr3.jpg https://s3.amazonaws.com/prod-ucs-content-store-us-east/content/pii:S1381116910002852/gr3/DOWNSAMPLED/image/jpeg/1e5de109c17394fdb3b6827e4e4ad4fe/gr3.jpg https://s3-eu-west-1.amazonaws.com/prod-ucs-content-store-eu-west/content/pii:S1381116910002852/gr3/DOWNSAMPLED/image/jpeg/1e5de109c17394fdb3b6827e4e4ad4fe/gr3.jpg gr3 gr3.jpg jpg 12716 265 352 IMAGE-DOWNSAMPLED 1-s2.0-S1381116910002852-gr3.sml https://s3.amazonaws.com/prod-ucs-content-store-us-east/content/pii:S1381116910002852/gr3/THUMBNAIL/image/gif/92b6607fff397b1f416c0e63e91f3bb8/gr3.sml https://s3-eu-west-1.amazonaws.com/prod-ucs-content-store-eu-west/content/pii:S1381116910002852/gr3/THUMBNAIL/image/gif/92b6607fff397b1f416c0e63e91f3bb8/gr3.sml gr3 gr3.sml sml 2597 164 218 IMAGE-THUMBNAIL 1-s2.0-S1381116910002852-gr3_lrg.jpg https://s3.amazonaws.com/prod-ucs-content-store-us-east/content/pii:S1381116910002852/gr3/HIGHRES/image/jpeg/57f003882e8ccfb071a26e98600b6250/gr3_lrg.jpg https://s3-eu-west-1.amazonaws.com/prod-ucs-content-store-eu-west/content/pii:S1381116910002852/gr3/HIGHRES/image/jpeg/57f003882e8ccfb071a26e98600b6250/gr3_lrg.jpg gr3 gr3_lrg.jpg jpg 91552 1175 1560 IMAGE-HIGH-RES 1-s2.0-S1381116910002852-sc1.jpg https://s3.amazonaws.com/prod-ucs-content-store-us-east/content/pii:S1381116910002852/sc1/DOWNSAMPLED/image/jpeg/245866e56e50672c17cb8827b347aba1/sc1.jpg https://s3-eu-west-1.amazonaws.com/prod-ucs-content-store-eu-west/content/pii:S1381116910002852/sc1/DOWNSAMPLED/image/jpeg/245866e56e50672c17cb8827b347aba1/sc1.jpg sc1 sc1.jpg jpg 26817 371 577 IMAGE-DOWNSAMPLED 1-s2.0-S1381116910002852-sc1.sml https://s3.amazonaws.com/prod-ucs-content-store-us-east/content/pii:S1381116910002852/sc1/THUMBNAIL/image/gif/bd89bdb201bce2d9e053f150a36a6778/sc1.sml https://s3-eu-west-1.amazonaws.com/prod-ucs-content-store-eu-west/content/pii:S1381116910002852/sc1/THUMBNAIL/image/gif/bd89bdb201bce2d9e053f150a36a6778/sc1.sml sc1 sc1.sml sml 2645 141 219 IMAGE-THUMBNAIL 1-s2.0-S1381116910002852-sc1_lrg.jpg https://s3.amazonaws.com/prod-ucs-content-store-us-east/content/pii:S1381116910002852/sc1/HIGHRES/image/jpeg/fcdd43e7dd72a05f2740699bd33b0d43/sc1_lrg.jpg https://s3-eu-west-1.amazonaws.com/prod-ucs-content-store-eu-west/content/pii:S1381116910002852/sc1/HIGHRES/image/jpeg/fcdd43e7dd72a05f2740699bd33b0d43/sc1_lrg.jpg sc1 sc1_lrg.jpg jpg 228516 1644 2556 IMAGE-HIGH-RES 1-s2.0-S1381116910002852-sc2.jpg https://s3.amazonaws.com/prod-ucs-content-store-us-east/content/pii:S1381116910002852/sc2/DOWNSAMPLED/image/jpeg/d93d855373f6c66b9148f1e1adb9a0ea/sc2.jpg https://s3-eu-west-1.amazonaws.com/prod-ucs-content-store-eu-west/content/pii:S1381116910002852/sc2/DOWNSAMPLED/image/jpeg/d93d855373f6c66b9148f1e1adb9a0ea/sc2.jpg sc2 sc2.jpg jpg 10213 134 546 IMAGE-DOWNSAMPLED 1-s2.0-S1381116910002852-sc2.sml https://s3.amazonaws.com/prod-ucs-content-store-us-east/content/pii:S1381116910002852/sc2/THUMBNAIL/image/gif/b7dc150e70cb9e6e3de4f5cb6085849b/sc2.sml https://s3-eu-west-1.amazonaws.com/prod-ucs-content-store-eu-west/content/pii:S1381116910002852/sc2/THUMBNAIL/image/gif/b7dc150e70cb9e6e3de4f5cb6085849b/sc2.sml sc2 sc2.sml sml 1137 54 219 IMAGE-THUMBNAIL 1-s2.0-S1381116910002852-sc2_lrg.jpg https://s3.amazonaws.com/prod-ucs-content-store-us-east/content/pii:S1381116910002852/sc2/HIGHRES/image/jpeg/ac4b62aa8e431a1374cf5975c6d2b2a5/sc2_lrg.jpg https://s3-eu-west-1.amazonaws.com/prod-ucs-content-store-eu-west/content/pii:S1381116910002852/sc2/HIGHRES/image/jpeg/ac4b62aa8e431a1374cf5975c6d2b2a5/sc2_lrg.jpg sc2 sc2_lrg.jpg jpg 79939 591 2417 IMAGE-HIGH-RES 1-s2.0-S1381116910002852-sc3.jpg https://s3.amazonaws.com/prod-ucs-content-store-us-east/content/pii:S1381116910002852/sc3/DOWNSAMPLED/image/jpeg/b7fefd9d599023c38d51d4567f2e5f73/sc3.jpg https://s3-eu-west-1.amazonaws.com/prod-ucs-content-store-eu-west/content/pii:S1381116910002852/sc3/DOWNSAMPLED/image/jpeg/b7fefd9d599023c38d51d4567f2e5f73/sc3.jpg sc3 sc3.jpg jpg 53819 574 565 IMAGE-DOWNSAMPLED 1-s2.0-S1381116910002852-sc3.sml https://s3.amazonaws.com/prod-ucs-content-store-us-east/content/pii:S1381116910002852/sc3/THUMBNAIL/image/gif/6278fcb7b7723b6f2c6df74e3e9a0113/sc3.sml https://s3-eu-west-1.amazonaws.com/prod-ucs-content-store-eu-west/content/pii:S1381116910002852/sc3/THUMBNAIL/image/gif/6278fcb7b7723b6f2c6df74e3e9a0113/sc3.sml sc3 sc3.sml sml 2672 164 161 IMAGE-THUMBNAIL 1-s2.0-S1381116910002852-sc3_lrg.jpg https://s3.amazonaws.com/prod-ucs-content-store-us-east/content/pii:S1381116910002852/sc3/HIGHRES/image/jpeg/ecbc9226327d6db32cbb00d6b3c6c5cb/sc3_lrg.jpg https://s3-eu-west-1.amazonaws.com/prod-ucs-content-store-eu-west/content/pii:S1381116910002852/sc3/HIGHRES/image/jpeg/ecbc9226327d6db32cbb00d6b3c6c5cb/sc3_lrg.jpg sc3 sc3_lrg.jpg jpg 290494 2540 2500 IMAGE-HIGH-RES 1-s2.0-S1381116910002852-sc4.jpg https://s3.amazonaws.com/prod-ucs-content-store-us-east/content/pii:S1381116910002852/sc4/DOWNSAMPLED/image/jpeg/0a7fac11954101bde97da0431b39ce09/sc4.jpg https://s3-eu-west-1.amazonaws.com/prod-ucs-content-store-eu-west/content/pii:S1381116910002852/sc4/DOWNSAMPLED/image/jpeg/0a7fac11954101bde97da0431b39ce09/sc4.jpg sc4 sc4.jpg jpg 32956 373 659 IMAGE-DOWNSAMPLED 1-s2.0-S1381116910002852-sc4.sml https://s3.amazonaws.com/prod-ucs-content-store-us-east/content/pii:S1381116910002852/sc4/THUMBNAIL/image/gif/c10a6c1926eaeb92cb952711357ace5b/sc4.sml https://s3-eu-west-1.amazonaws.com/prod-ucs-content-store-eu-west/content/pii:S1381116910002852/sc4/THUMBNAIL/image/gif/c10a6c1926eaeb92cb952711357ace5b/sc4.sml sc4 sc4.sml sml 2501 124 219 IMAGE-THUMBNAIL 1-s2.0-S1381116910002852-sc4_lrg.jpg https://s3.amazonaws.com/prod-ucs-content-store-us-east/content/pii:S1381116910002852/sc4/HIGHRES/image/jpeg/cfa3a8e0d9d6feeaa80ff07828525869/sc4_lrg.jpg https://s3-eu-west-1.amazonaws.com/prod-ucs-content-store-eu-west/content/pii:S1381116910002852/sc4/HIGHRES/image/jpeg/cfa3a8e0d9d6feeaa80ff07828525869/sc4_lrg.jpg sc4 sc4_lrg.jpg jpg 265603 1652 2917 IMAGE-HIGH-RES 1-s2.0-S1381116910002852-sc5.jpg https://s3.amazonaws.com/prod-ucs-content-store-us-east/content/pii:S1381116910002852/sc5/DOWNSAMPLED/image/jpeg/1a04533161861da4ffad7cd1f2f9e181/sc5.jpg https://s3-eu-west-1.amazonaws.com/prod-ucs-content-store-eu-west/content/pii:S1381116910002852/sc5/DOWNSAMPLED/image/jpeg/1a04533161861da4ffad7cd1f2f9e181/sc5.jpg sc5 sc5.jpg jpg 11736 145 565 IMAGE-DOWNSAMPLED 1-s2.0-S1381116910002852-sc5.sml https://s3.amazonaws.com/prod-ucs-content-store-us-east/content/pii:S1381116910002852/sc5/THUMBNAIL/image/gif/1fcc80895817a100ef19c00833622d26/sc5.sml https://s3-eu-west-1.amazonaws.com/prod-ucs-content-store-eu-west/content/pii:S1381116910002852/sc5/THUMBNAIL/image/gif/1fcc80895817a100ef19c00833622d26/sc5.sml sc5 sc5.sml sml 1185 56 219 IMAGE-THUMBNAIL 1-s2.0-S1381116910002852-sc5_lrg.jpg https://s3.amazonaws.com/prod-ucs-content-store-us-east/content/pii:S1381116910002852/sc5/HIGHRES/image/jpeg/aac8f25f6705384814b1cfbba87f3e8d/sc5_lrg.jpg https://s3-eu-west-1.amazonaws.com/prod-ucs-content-store-eu-west/content/pii:S1381116910002852/sc5/HIGHRES/image/jpeg/aac8f25f6705384814b1cfbba87f3e8d/sc5_lrg.jpg sc5 sc5_lrg.jpg jpg 93872 641 2504 IMAGE-HIGH-RES 1-s2.0-S1381116910002852-gr4.jpg https://s3.amazonaws.com/prod-ucs-content-store-us-east/content/pii:S1381116910002852/gr4/DOWNSAMPLED/image/jpeg/746e6023250bb979165f8d64a0acf13f/gr4.jpg https://s3-eu-west-1.amazonaws.com/prod-ucs-content-store-eu-west/content/pii:S1381116910002852/gr4/DOWNSAMPLED/image/jpeg/746e6023250bb979165f8d64a0acf13f/gr4.jpg gr4 gr4.jpg jpg 34816 267 470 IMAGE-DOWNSAMPLED 1-s2.0-S1381116910002852-gr4.sml https://s3.amazonaws.com/prod-ucs-content-store-us-east/content/pii:S1381116910002852/gr4/THUMBNAIL/image/gif/f7bc09034fc521e4e550dfb4b59ea7e8/gr4.sml https://s3-eu-west-1.amazonaws.com/prod-ucs-content-store-eu-west/content/pii:S1381116910002852/gr4/THUMBNAIL/image/gif/f7bc09034fc521e4e550dfb4b59ea7e8/gr4.sml gr4 gr4.sml sml 4625 124 219 IMAGE-THUMBNAIL 1-s2.0-S1381116910002852-gr4_lrg.jpg https://s3.amazonaws.com/prod-ucs-content-store-us-east/content/pii:S1381116910002852/gr4/HIGHRES/image/jpeg/4c158a00ec9f4cd3cfaff696c6b1433c/gr4_lrg.jpg https://s3-eu-west-1.amazonaws.com/prod-ucs-content-store-eu-west/content/pii:S1381116910002852/gr4/HIGHRES/image/jpeg/4c158a00ec9f4cd3cfaff696c6b1433c/gr4_lrg.jpg gr4 gr4_lrg.jpg jpg 197952 1184 2083 IMAGE-HIGH-RES MOLCAA 7891 S1381-1169(10)00285-2 10.1016/j.molcata.2010.07.002 Elsevier B.V. Fig. 1 Effect of TPS/Cr ratio on molecular weight distribution for polyethylene obtained from (a) Phillips; (b) PS1.0; (c) PS1.5; (d) PS2.0; and (e) S-2 catalysts. (Polymerization conditions: catalyst amount, 160mg; polymerization temperature, 90°C; polymerization time, 60min; ethylene pressure, 0.15MPa; solvent, heptane, 70mL; cocatalyst TEA, Al/Cr molar ratio=20.0). Fig. 2 Ethylene polymerization kinetics curves of catalysts (a) Phillips catalyst and PS1.5 catalyst with TEA cocatalyst (Al/Cr molar ratio=20.0); (b) PS1.5 catalyst and S-2 catalyst with TEA cocatalyst (Al/Cr molar ratio=15.0); (c) PS1.5 catalyst and S-2 catalyst with MAO cocatalyst (Al/Cr molar ratio=90.0). (Polymerization conditions: catalyst amount, 160mg; polymerization temperature, 90°C; polymerization time, 60min; ethylene pressure, 0.15MPa; solvent, heptane, 70mL.) Fig. 3 Ethylene polymerization activities of (a) Phillips catalyst and (b) PS1.5 catalyst prepared at different calcination temperatures (500, 600, 700°C). (Polymerization conditions: catalyst amount, 160mg; polymerization temperature, 90°C; polymerization time, 60min; ethylene pressure, 0.15MPa; solvent, heptane, 70mL; cocatalyst TEA, Al/Cr molar ratio=15.0). Fig. 4 Optimized structures for b-Co and b-Nonco models by DFT method. Scheme 1 Two methods for preparation of silyl chromate type catalyst: (A) S-2 catalyst prepared from bis(triphenylsilyl) chromate (BC); (B) Conversion of Phillips catalyst to silyl chromate type catalyst by the addition of triphenylsilanol (TPS). Scheme 2 Further plausible reaction between the obtained PS catalyst and TPS. Scheme 3 Computational models for catalysts (a) Phillips catalyst; (b-Co) PS catalyst with coordination between Cr and –OH; (b-Nonco) PS catalyst without coordination between Cr and –OH; (c) S-2 catalyst; (b-H) PS catalyst with –OH replaced by –H; (b-F) PS catalyst with –OH replaced by –F; (b′) simplified PS catalyst with phenyl replaced by methyl; (b′-Cl) PS catalyst modified by(CH3)3SiCl; (b′-2Cl) PS catalyst modified by (CH3)2SiCl2; (b′-3Cl) PS catalyst modified by CH3SiCl3. Scheme 4 Ethylene chain propagation over 1a and 2a models through Cossee mechanism. Scheme 5 Plausible reaction between PS catalyst and (CH3) x SiCl y . Table 1 Amount of Cr on catalyst before and after washing with n-hexane. Cat. Color of eluate Cr (wt%) a Before washing After washing Phillips Colorless 0.51 0.51 PS0.5 Colorless 0.51 0.50 PS1.0 Light yellow 0.51 0.46 PS1.5 Yellow 0.51 0.45 PS2.0 Yellow 0.51 0.45 PS3.0 Dark yellow 0.51 0.37 S-2 Dark yellow 0.47 0.23 a Determined by ICP (inductively-coupled plasma). Table 2 Effects of TPS/Cr ratio on catalysts and polyethylene products. Cat. Atomic percentage (%) a Si/C molar ratio Mn (×10−5) b Mw (×10−5) b Mw/Mn b Si C O Phillips 22.61 5.57 71.61 4.06 1.10 26.50 24.30 PS1.0 19.77 11.04 68.85 1.79 0.86 16.56 19.34 PS1.5 18.21 10.74 70.58 1.70 1.04 24.80 23.76 PS2.0 20.03 11.78 67.76 1.70 1.68 29.38 17.52 S-2 17.76 20.18 61.59 0.88 2.27 32.05 14.14 a The atomic percentage of the catalysts washed by n-hexane was measured by XPS. b The polyethylene was characterized by GPC method. Polymerization conditions: catalyst amount, 160mg; polymerization temperature, 90°C; polymerization time, 60min; ethylene pressure, 0.15MPa; solvent, heptane, 70mL; cocatalyst TEA, Al/Cr molar ratio=20.0. Table 3 Milliken charge on Cr(q), geometry parameters, and ethylene insertion energy barrier of cluster models. Models a q Cr b q Cr c Cr–O b (Å) Cr–O c (Å) Barrier (kcal/mol) a +0.609 +0.738 – – 19.22 b-Co +0.781 +0.735 2.136 2.220 22.03 b-Nonco +0.671 +0.757 4.328 4.173 23.66 b-H +0.694 +0.757 2.014 (Cr–H) 4.662 (Cr–H) 23.93 b-F +0.784 +0.731 2.152 (Cr–F) 2.333 (Cr–F) 20.63 b′ +0.844 +0.733 2.076 2.225 21.59 b′-Cl +0.686 +0.758 2.153 4.907 23.24 b′-2Cl +0.668 +0.753 2.236 5.250 23.44 b′-3Cl +0.686 +0.777 2.261 5.033 23.58 c +0.784 +0.760 – – 23.75 a Refer to models description in Scheme 3. b Before ethylene insertion. c After ethylene insertion. Table 4 Ethylene polymerization over PS1.5, PS1.5-Cl, PS1.5-2Cl, and PS1.5-3Cl catalysts with TEA cocatalyst a . Cat. Cocatalyst Al/Cr mol ratio Activity (kgPE/molCr h) PS1.5 TEA 15 38.9 PS1.5-Cl TEA 15 33.9 PS1.5-2Cl TEA 15 34.3 PS1.5-3Cl TEA 15 34.8 a Polymerization conditions: catalyst amount 120mg; polymerization temperature 90°C; ethylene pressure 0.15MPa; polymerization time 60min; solvent heptanes; 70mL. Experimental and theoretical studies on ethylene polymerization using SiO2-supported silyl chromate type catalysts prepared by a green method Xiaofang Li a Ruihua Cheng a ⁎ Jun Luo a Qi Dong a Xuelian He a Liuzhong Li b Yongling Yu b Jianwen Da b Boping Liu a ⁎ a State Key Laboratory of Chemical Engineering, East China University of Science and Technology, Meilong Road 130, Shanghai 200237, China b Research Institute of Qilu Branch Co., SINOPEC, Zibo 255400, Shandong, China ⁎ Corresponding authors. Tel.: +86 21 64253627; fax: +86 21 64253627. Graphical abstract A green route for preparation of SiO2-supported silyl chromate type catalysts through transformation from Phillips catalyst by reaction with triphenylsilanol (TPS) without using toxic bis(triphenylsilyl) chromate was investigated by theoretical and experimental methods. SiO2-supported silyl chromate catalyst (UCC S-2 catalyst) is an important catalyst for the commercial production of polyethylene. Cann first reported a possible green synthesis route for the preparation of S-2 catalyst through transformation from Phillips catalyst by addition of triphenylsilanol (TPS) to avoid the use of toxic bis(triphenylsilyl) chromate (BC). In this work, this green synthesis route was further investigated by the combination of experimental and theoretical methods. The obtained catalyst was named as PS catalyst based on the incomplete conversion of Phillips catalyst to S-2 catalyst. Polymerization activity of PS1.5 catalyst was higher than that of S-2 catalyst with either TEA or MAO as cocatalyst. The existence of the simultaneously formed hydroxyl group and its coordination to the reduced Cr site was favorable to the PS catalyst, and this might attribute to the higher polymerization activity of PS catalyst than that of S-2 catalyst. A further modification of PS catalyst by a series of alkyl chlorosilane compounds showed that the role of the electron-withdrawing group only limited at a certain distance away from Cr active site. This preliminary study provided a solid basis for a further innovation of PS catalysts and final substitution of S-2 catalyst in commercial processes. Keywords Silyl chromate S-2 catalyst Phillips catalyst Triphenylsilanol Ethylene polymerization Density functional theory (DFT) 1 Introduction Polyethylene (PE) is a most commonly used plastic with the largest market. Chromium based catalyst systems, including Phillips (chromium oxide) and silyl chromate supported on silica, have long been among the most important catalysts for the production of PE [1–5]. The silyl chromate catalyst, namely S-2 catalyst, was commercialized by Union Carbide Corporation (UCC) with a gas phase UNIPOL process for HDPE production. Until now, S-2 catalyst still produces several millions tons of HDPE, which have desirable molecular weight characteristics meeting different market demanding [6]. However, compared with Phillips catalyst, S-2 catalyst has not been fully investigated during the past several decades. Traditionally, S-2 catalyst is directly prepared from bis(triphenylsilyl) chromate (BC) using thermal treated silica gel as support by wet impregnation method as shown in Scheme 1(A) [3]. It is well known that the catalytic activity is markedly increased when BC is supported on silica gel and then treated with aluminum alkyl [3]. And the unsupported BC is also an active catalyst for ethylene polymerization under relatively high temperature and pressure [7]. Gaspar et al. found that S-2 catalyst showed lower polymerization activity than Phillips catalyst due to S-2 catalyst with less Cr6+ and Cr2+ active species in their calcined and reduced states, respectively [8,9]. However, S-2 catalyst using aluminum alkyl cocatalyst could produce polyethylene with broader molecular weight distribution (MWD) on both ends of high and low molecular weight than that of Phillips catalyst without using cocatalyst [5]. Generally, BC is prepared from triphenylsilanol (TPS) and chromium trioxide, and a higher BC product yield has been developed by Li et al. using triphenyl chlorosilane, potassium dichromate [10]. Nevertheless, the highly toxic BC does not meet the trend of the modern world with increasing concerns about environment and human health. In 2004, a pioneering work of a possible transformation from Phillips catalyst to silyl chromate catalyst through introduction of a silyl ligand from reaction with TPS was reported by Cann and co-workers [5,11]. It was found that the polymerization performance between the obtained catalyst and the silyl chromate catalyst tended to be similar in the case of two equivalents TPS to Cr on Phillips catalyst. The reaction was illustrated in Scheme 1(B). Furthermore, Liu et al. used different organo-silanol compound to modify Phillips catalyst and successfully developed a new SiO2-supported Cr-based catalysts for olefin polymerization [6]. In our opinion, the reports mentioned above indicated a possible green synthesis route for the preparation of silyl chromate type polyethylene catalyst. However, it was noticeable that a hydroxyl group appeared next to the Cr active site accompanied by the addition of TPS, while this kind of neighboring hydroxyl did not exist in the S-2 catalyst obtained through traditional preparation process. And also, this point was not considered within the previous work by Cann [5]. Considering the strong reverse correlation between the hydroxyl population on the silica surface and polymerization activity in Phillips catalyst [4], effect of the introduced hydroxyl group next to the Cr active site on the polymerization behavior of PS catalyst should be seriously considered. In recent years, molecular modeling based on density functional theory (DFT) method was increasingly used for the study of the Phillips catalyst [12–19]. Most work was focused on achieving a deeper understanding of the polymerization mechanisms on Phillips-type catalyst. Espelid and Borve [19] compared different routes of initiation and chain propagation with respect to structural, thermodynamic and kinetic properties, and concluded that only a three-coordinate mono-alkylchromium species was found to support chain propagation with the reaction barrier compatible with catalytic activity based on the model of disiloxanochromium site. Liu et al. [15] used a novel silsesquioxane-supported Phillips Cr catalyst as realistic model to elucidate the effects of surface chemistry of silica gel in terms of ligand variation on the catalytic properties of Phillips catalyst. And also, possible reaction mechanisms of olefin polymerization catalyzed by surface supported Cr(IV) species have been investigated using DFT method by Ziegler [13]. However, up to now, there has no theoretical study using DFT method on the silyl chromate type catalyst. In order to achieve the green synthesis of S-2 catalyst, the preparation of Phillips catalyst in a green method is principal. As a matter of fact, from about 1978, trivalent Cr compound, mostly basic chromium(III) acetate with much weaker toxicity, has been developed as raw material instead of chromium(VI) trioxide for the preparation of Phillips catalyst owing to the environmental and health considerations [9,10,20–25]. Ruddick et al. [22] studied the calcination process of Phillips catalysts using basic chromium(III) acetate and chromium(III) acetylacetonate, and concluded that chromium(III) acetate supported on silica decomposed in a way similar to that observed for bulk chromium acetate. A mechanism for the activation of silica-supported basic chromium acetate in oxidizing, inert, and reducing environments was proposed by Augustine and Blitz [25]. Liu et al. [24] utilized XPS to elucidate the specific transformation process of chromium(III) acetate into bulky CrO3 and subsequently into Cr(VI)O x,surf as a function of calcination temperatures between 120 and 800°C. Thus, in this work, the silica supported Phillips catalyst was first prepared from basic chromium(III) acetate with much lower toxicity compared with the commonly used chromium(VI) trioxide according to our previous report [26]. Subsequently, TPS was added to react with oxo chromate species in Phillips CrO x /SiO2 catalyst to form the silyl chromate type catalyst system, which was denoted as PS catalyst. Therefore, in this green synthesis route, highly toxic bis(triphenylsilyl) chromate(VI) (BC) was replaced by chromium (III) compound and TPS. Series PS catalysts and the obtained PE products were characterized. The ethylene polymerization kinetics of the PS1.5 catalysts was compared with those of Phillips catalyst and traditional S-2 catalyst. Specially, the simultaneously formed hydroxyl group next to the Cr active site during the preparation of PS catalyst was investigated by the theoretical method. This was the first theoretical investigation using DFT method for the silyl chromate type catalyst. Additionally, a further modification of the PS catalyst by alkyl chlorosilane compound to remove the nearby surface hydroxyl group was carried out by the combination of theoretical and experimental methods. Much deeper understanding on the SiO2-supported silyl chromate type catalyst for ethylene polymerization has been demonstrated. 2 Experimental 2.1 Raw materials Chromium(III) acetate hydroxide (with 24wt% Cr) was purchased from Johnson Matthey Company. Bis(triphenylsilyl) chromate (>96%) was obtained from Aldrich. Silica gel (Davison 955, surface area 270.4m2/g, pore volume 1.65cm3/g and average pore size 24.5nm) was donated by Qilu Branch Co., SINOPEC. Triphenylsilanol (TPS, >98%) and triethylaluminum (TEA, 25%, w/w, in hexane, >95%) were purchased from Alfa Aesar. Methylalumoxane (MAO) in toluene (MAO 9.1wt%, TMA 1.7wt%) were purchased from Shanghai Qigele Co. Chlorotrimethylsilane ((CH3)3SiCl, AR), dichlorodimethylsilane ((CH3)2SiCl2, AR) and methyltrichlorosilane (CH3SiCl3, 99%) were purchased from Aladin. Pure air (>99.999%) was supplied by Shanghai Wetry. n-Hexane and n-heptane were purified by distillation after drying over sodium metal slices prior to use. Silver molecular sieves and Q5 reactant catalyst (13wt% of Cu(II) oxide on alumina) purchased from Aldrich (St. Louis, MO) were used as oxygen scavenger for gas purification. Nitrogen was further purified by passing through columns of silver molecular sieves and 13X molecular sieves before use. Ethylene monomer was further purified by subsequently passing through columns of 4A molecular sieves, Q5 reactant catalyst, and 13X molecular sieves. 2.2 Catalyst preparation and characterization 2.2.1 Catalyst preparation Phillips catalyst (CrO x /SiO2) with a loading of 0.5wt% Cr was prepared by wet impregnation of aqueous solutions of chromium (III) acetate hydroxide on silica gel. After impregnation, the slurry was slowly dried at 120°C for 12h. Thereafter, about 10g of obtained sample was added into a fluidized-bed quartz reactor followed by an isothermal calcination process at 700°C in dried air with a flow rate of 600mL/min for 6h to obtain the Phillips catalyst. A stoichiometric amount of TPS was reacted with 1g Phillips catalyst in 150mL n-hexane for 2.5h at 45°C under inert atmosphere, and the molar ratios of TPS/Cr were 0.5, 1.0, 1.5, 2.0, 3.0, respectively. The series of TPS-modified Phillips catalysts were denoted as PSx (x =0.5, 1.0, 1.5, 2.0, 3.0). After reaction, the modified catalyst was washed by 50mL n-hexane for three times followed by vacuum drying at 70°C. The other two PS1.5 catalysts prepared from Phillips catalysts calcined at 500 and 600°C respectively were also carried out in similar way to investigate the effect of calcination temperatures. Afterwards, 2mol equivalents of (CH3) x SiCl y to Cr, chlorotrimethylsilane ((CH3)3SiCl), dichlorodimethylsilane ((CH3)2SiCl2), and trichloromethylsilane (CH3SiCl3) were added respectively to 1g PS1.5 catalysts in 50mL n-hexane at room temperature for 2h. After reaction, the catalyst was dried by vacuum at 70°C for 1h. Here, the (CH3) x SiCl y -modified PS1.5 catalysts were denoted as PS1.5-Cl, PS1.5-2Cl, and PS1.5-3Cl, respectively. For comparison, a traditional S-2 catalyst with a Cr loading of 0.5wt% Cr was directly prepared from BC using silica gel as support by wet impregnation method. The pretreatment of silica gel was conducted through an isothermal calcination process at 700°C in nitrogen with a flow rate of 600mL/min for 6h. The chemisorption of BC on dehydrated silica gel was carried out at 45°C in 150mL purified n-hexane for 4h. After reaction, the catalyst was washed by 50mL n-hexane for three times followed by vacuum drying at 70°C. 2.2.2 Characterization of catalysts and polyethylene products Inductively-coupled plasma (ICP) characterization of Phillips, PSx, and S-2 catalysts were carried out to determine the Cr loadings on the support before and after washing by n-hexane on IRIS 1000 Iris Plasma Spectrometer. X-ray photoelectron spectroscopy (XPS) data of the Phillips, PSx (after being washed by n-hexane and dried), and S-2 catalysts were obtained on an Axis Ultra DLD X-ray Photoelectron Spectrometer with monochromated Al K radiation in order to study the changes of elemental composition on the surface of catalysts. The vacuum in the main chamber was kept below 1×10−9 Torr. Voltage was 15kV and current was 10mA during XPS data acquisitions. Scanning frequency of Cr 2p regions were performed for each sample 12 times while other elements only 1 time in a cycle during high resolution XPS data acquisitions. Molecular weight (MW) and molecular weight distribution (MWD) of the polyethylene from Phillips, PSx, and S-2 catalysts were obtained by a Polymer Labs PL220 Gel Permeation Chromatograph using 1,2-dichlorobenzene as solvent with a flow rate of 1.0mL/min at a temperature of 135°C. Two PLGel mixed B columns were used. 2.3 Ethylene polymerization Ethylene polymerization was carried out in a 3-mouth flask, which was placed at a thermostatic bath keeping at 90°C. One small ampoule tube with about 160mg catalysts, which was previously weighed and sealed in nitrogen at a glove box, was carefully transferred to the flask. The reactor system was heated and vacuumed for 0.5h, and then 60mL n-heptane was added followed by introducing a certain amount of aluminum alkyl (Al/Cr molar ratios at 10.0–90.0). Then, ethylene was introduced up to the total pressure of 0.15MPa. The polymerization was initiated after opening the sealed catalyst tube. The real-time ethylene consumption was continuously monitored by an on-line mass flowmeter (Brooks Instrument 0150E). After 1h, the polymerization was stopped by adding 100mL ethanol/HCl solution. The obtained polymer was washed and dried in vacuum at 60°C for 6h before weighted. 3 Computational Geometry optimizations and energy calculations for model compounds were performed with Gaussian 03, using the nonlocal three-parameter hybrid density functional method B3LYP [27–29]. The Gaussian basis set LANL2DZ (Los Alamos National Laboratory Second Double-Zeta) was used for Cr, and the basis set 6-31G(d, p) was used for all other elements [30]. All transition states were verified using Intrinsic Reaction Coordinate (IRC) calculations, which indicated the transition state was directly connected to the involved reactant and product geometries [31]. All energies reported refer to Gibbs free energy corrections to the total electronic energies at 25.15°C in gas phase. The Mulliken charge of chromium atom was also calculated by Gaussian 03 program for analysis of the charge distribution on each center. 4 Results and discussion 4.1 Characterization of catalysts and polyethylene products The series of PSx, Phillips, and S-2 catalysts were characterized by ICP and XPS methods. During the PS catalyst preparation process, each catalyst was washed by 50mL n-hexane for three times after the reaction of Phillips catalyst with TPS. Table 1 shows the chemical analysis data on catalysts detected by ICP method before and after the n-hexane washing. The Cr loadings of Phillips and PS0.5 catalysts were maintained as the original 0.5wt% loading after washing. For the PS1.0, PS1.5, and PS2.0 catalysts, the Cr loadings were similar and slightly decreased to 0.45wt%. However, the Cr loading for PS3.0 was obviously decreased to 0.37wt%. As for S-2 catalyst, the Cr loading was dramatically decreased from 0.47% to 0.23% after n-hexane washing, thus only less than half of Cr was remained on the surface after washing. It was also consistent with the experimental evidence that the eluate gradually changed from colorless for PS0.5 to dark yellow for PS3.0, indicating that the increase of TPS amount seemed to accelerate the removal of surface hexavalent chromium species from Phillips catalyst by n-hexane washing. XPS method was applied to study the change of the elemental composition on PSx catalysts surface after being washed by n-hexane and dried. The results were summarized in Table 2 . The carbon content for Phillips catalyst was 5.57%, which might be due to the impact of contamination carbon in the sample preparation (from solvent). For PSx (x =1.0, 1.5, 2.0) catalysts, the carbon contents were increased up to about 11% after the modification of the Phillips catalyst by TPS, indicating that the reaction between TPS and oxo chromate species were likely occurring. The normalization atomic ratios of Si/C for PSx (x =1.0, 1.5, 2.0) catalysts implied the similar tendencies on these catalyst surfaces. Cann et al. reported that two equivalents of TPS were needed to complete the transformation of all oxo chromate species into silyl chromate species [5]. As shown in Table 1, the loading of Cr on PSx catalyst decreased with the increasing addition of TPS, suggesting a further reaction of the formed silyl chromate species and the TPS could occur even in the case of less than one equivalent addition of TPS (as shown in Scheme 2 ). With the increase of additional TPS amount, the degree of the conversion presented in Scheme 2 enhanced resulting into the loss of chromium loading. Therefore, the surface chromium species might be largely removed off from the surface of silica in form of BC with large amount of TPS. It could be concluded that the conversion from Phillips catalyst to S-2 catalyst by the addition of TPS could not occur completely because the reactions shown in Schemes 1(B) and 2 were simultaneous and reversible. Ethylene slurry polymerization using the Phillips, PSx (x =1.0, 1.5, 2.0), and S-2 catalysts was carried out at 90°C and 0.15MPa for 1h using heptane and TEA (Al/Cr=20) as solvent and cocatalyst, respectively. The polyethylene products were characterized in order to investigate the variations of the polymer molecular weight (MW) and molecular weight distribution (MWD). The corresponding MW and MWD were shown in Table 2, and the corresponding GPC curves of polyethylene were shown in Fig. 1 . As shown in Table 2 and Fig. 1, the MWD of the PEs obtained from Phillips and S-2 catalyst were the highest (Mw/Mn=24.30) and the lowest (Mw/Mn=14.14) values, respectively, although all the polymer products showed broad MWD. The MWD of polymers from PSx catalysts are between Phillips and S-2 catalyst. After the reaction of TPS (TPS/Cr=1.0) with Phillips catalyst, the GPC curve of PS1.0 catalyst significantly shifted to low MW region. With the further increase of TPS/Cr ratio, the GPC curves of the PSx catalysts gradually moved back to the high MW region analogous to that of S-2 catalyst. This could also be seen in Table 2 from the gradual increase of the average Mw with the increase of TPS/Cr ratio. Due to the use of cocatalyst, the Phillips catalyst produced the polyethylene with very broad MWD. According to the characterization results of PSx catalysts and their corresponding products, the PS1.5 catalyst was selected as a typical representative of the series of PSx catalysts for ethylene polymerization in the following sections investigation. 4.2 Ethylene polymerization kinetics of catalysts The ethylene polymerization kinetic of PS1.5 catalyst was investigated and compared with those of Phillips and traditional S-2 catalysts. Fig. 2 presents the polymerization kinetics curves of Phillips, PS1.5, and S-2 catalysts with TEA or MAO as cocatalyst, respectively, and the molar ratio of Al/Cr was selected according to the optimum condition of catalyst. The polymerization kinetics curve of PS1.5 catalyst declined obviously compared with that of Phillips catalyst, and the polymerization activity of PS1.5 catalyst was much lower than that of Phillips catalyst. For PS1.5 and S-2 catalysts, the kinetics curves for the two catalysts with the same cocatalyst were similar, and a higher activity of PS1.5 catalyst was obtained than that of S-2 catalyst. However, significantly different kinetics curves were observed when the two catalysts were treated with different cocatalysts. When TEA was chosen as cocatalyst (shown in Fig. 2(b)), the kinetics curves of PS1.5 and S-2 catalysts characterized with a tendency of fast built up and then fast decay. In the case of MAO (shown in Fig. 2(c)), an obvious changes were found that the kinetics curves reached to a relatively lower peak but stabilized at a higher rate level accompanied by an increased induction period. The similar type of kinetics curves for PS1.5 and S-2 catalysts implied the similar active site properties of the two catalysts. Different polymerization kinetics with different cocatalyst may be explained that the reducing and alkylation capability of MAO was weaker than that of TEA leading to a prolonged induction period for the formation of active site. However, the active sites formed with MAO might be stable due to the weaker reduction power of MAO, while active site formed with TEA could be easily deactivated owing to the over-reduction by TEA with much stronger reduction power [32]. There may be several reasons for the significant decline of polymerization activity from Phillips catalyst to PS1.5 catalyst. Firstly, coordinated ligands of Cr active site for PS1.5 catalyst were quite different from that of Phillips catalyst. The phenyl, electron-donating group, which was introduced through the addition of TPS, resulted in the decline of Cr electron-deficiency and greater steric hindrance for ethylene coordination and insertion. Secondly, during the addition of TPS, the opening of Si–O–Cr–O–Si–O ring of Phillips catalyst led to the release of surface ring strain and decline of the electron-deficiency of Cr. The ethylene polymerization of Phillips catalyst and PS1.5 catalyst calcined at different temperatures was conducted subjected to the release of surface ring strain, and the results would be discussed in Section 4.3. Thirdly, it was noteworthy that a hydroxyl group was introduced next to the Cr active site after the reaction between Phillips catalyst and TPS. Considering the strong reverse correlation between the hydroxyl population on the silica surface and polymerization performance of Phillips catalyst [4], the plausible effect of the introduced hydroxyl on polymerization performance of PS catalyst was discussed in Section 4.4. 4.3 Effect of calcination temperatures on ethylene polymerization kinetics As mentioned above, PS1.5 catalyst was prepared from the reaction between TPS and silica supported Phillips catalyst, which had been calcined at high temperatures. Silica gel, being the most commonly used support for heterogeneous olefin polymerization catalysts, contains surface Si–OH groups of varying structures and concentrations depending on the calcination temperatures. Considering the effect of the calcination temperature, PS1.5 catalyst was prepared based on the Phillips catalysts calcined at 500, 600, and 700°C, respectively, and the ethylene polymerization performances of PS1.5 and Phillips catalyst counterparts were compared in Fig. 3 . The activities for Phillips catalyst linearly increased with the increasing calcination temperatures from 500 to 700°C. The reasons for the increased activity with increased calcined temperature for Phillips catalyst were the decreasing amount of residual hydroxyl groups and introduced surface ring strain into Si–O–Cr–O–Si bonds making the electron-deficient Cr center more active [24,33–35]. Conversely, the activity for PS1.5 catalyst obtained from Phillips catalyst calcined at 700°C was even slightly lower than that at 600°C, suggesting the activity of PS catalyst was not directly related with that of the corresponding Phillips catalyst. And a significant activity decline was found between Phillips and PS1.5 catalysts calcined at 700°C, while the differences were smaller at 500 and 600°C, respectively. This might be rationalized well as follows. On the one hand, the increasing of calcination temperature could decrease the surface residual hydroxyl groups and increase the electron-deficiency of Cr center and thus favor the polymerization reaction on PS catalyst. On the other hand, the opening of Si–O–Cr–O–Si–O ring accompanied with the release of ring strain during the formation of PS catalyst in Scheme 1(B) and decline of electron-deficiency of Cr center could become dominant for PS catalyst calcined at higher temperature. Therefore, the highest polymerization activity for PS1.5 was achieved at 600°C calcination temperature. 4.4 Effect of hydroxyl on ethylene polymerization Hydroxyl was another important factor to affect the catalytic performance of Phillips catalyst, and there was a strong reverse correlation between the hydroxyl population on the silica surface and the polymerization activity for Phillips catalyst [4]. However, there was still no clear explanation [36–40]. One of the explanations was that the hydroxyl might coordinate to the reduced Cr site and thus poison the active Cr center [37]. Another explanation was that the Cr(II) active center might be reoxidized by hydroxyl into Cr(III) [38,39]. Another possibility was that the hydroxyls might not be directly involved in the polymerization reaction, but be merely removed through an annealing of the surface which better exposed the Cr sites and induced some important change in terms of the surface strain by the condensation of surface hydroxyl groups during the annealing [36]. Some reports even suggested the favorable effect of hydroxyl for Phillips catalyst was that surface hydroxyl groups might be a necessary source of the active site by providing the first proton during the initiation stage of polymerization [39,40]. Therefore, during the preparation of PSx catalysts (Scheme 1(B)), a simultaneously formed hydroxyl group next to the Cr center should be seriously considered and investigated. Firstly, FTIR characterizations of the PSx, Phillips, and S-2 catalysts were carried out in order to obtain some information about the hydroxyl groups on the catalyst surface. As shown in Fig. SI-1 (in the supporting information), the gradual increase of surface hydroxyl groups with increase of TPS/Cr molar ratios could be observed, which provided the direct evidence of the formation of surface hydroxyl groups on the PSx catalysts. The effect of the neighboring hydroxyl groups on the catalytic properties of the Cr centers was further investigated by molecular modeling using DFT method. DFT calculations was performed on three site models (Scheme 3 ), a model for Phillips catalyst was taken as a comparison, and active site b model for PS catalyst and c model for S-2 catalyst were established, respectively. Two cases for model b were considered involving the coordination (model b-Co) or non-coordination (model b-Nonco) between Cr active site and the neighboring hydroxyl group for PS catalyst. Taking b-Co and b-Nonco models as examples, the optimized structures were shown in Fig. 4 . In Scheme 4 , the chain propagation based on the popularly accepted Cossee mechanism [41] on heterogeneous coordination polymerization catalysts was shown. And, the DFT calculations for the chain propagation with the growing polymer chain simplified as methyl group on several models were presented in Table 3 . The energy barrier for ethylene insertion significantly increased from 19.22kcal/mol for a model (Phillips catalyst) to 22.03kcal/mol for b model (PS catalyst). The consistence with the experimental result in Fig. 2(a) suggested that the models were somewhat reasonable. Also, it was interesting to note that the calculated free energy of −1953.70 hartree for the model b-Co involved Cr and –OH coordination was lower than that of model b-Nonco with Cr and –OH non-coordination of –1953.68 hartree, primarily indicating that the PS catalyst was more likely to be existed in the coordinated form between Cr and –OH. The insertion energy barrier for the case of b-Co (Cr and –OH coordination) was even lower than that of model b-Nonco (non-coordination between Cr and –OH) in Table 3. Moreover, Mulliken charge of Cr for model b-Co was higher than that of model b-Nonco, indicating an increased electron-deficiency of Cr active center for b-Co, which would be beneficial to the ethylene insertion. The insertion energy for model c with non-vicinal hydroxyl coordination presented 23.75kcal/mol, which was similar with the case of model b-Nonco and higher than that of model b-Co. Above calculation results were also consistent with the activity decline from PS1.5 catalyst to S-2 catalyst as shown in Fig. 2(b) and (c). Furthermore, b-H and b-F models referred as hydroxyl group replaced by hydrogen and fluorine atoms, respectively, were established in order to further determine the role of surface hydroxyl. In Table 3, the Mulliken charge of Cr for b-H (+0.694) was obviously lower than those for b–F (+0.784) and b-Co (+0.781), respectively. And the insertion energy barriers for b-H (23.93kcal/mol) were also higher than those for b-F (20.63kcal/mol) and b-Co (22.03kcal/mol). It indicated that the introduced hydroxyl group in PS catalyst behaving similar electron-withdrawing effect as F-ligand was beneficial to the ethylene insertion, which is quite different with the case of Phillips catalyst. This difference from the surface hydroxyl groups between Phillips and PS catalysts might be derived from the completely different ligand environment of the two catalyst systems. All above computational and experimental results suggested that the existence of the introduced hydroxyl and its coordination to the reduced Cr site was favorable to the polymerization activity of PS catalysts. The Cr active site in model b-Co mainly including three phenyl ligands (strong electron-donating group) may lead to the change of hydroxyl role from an electron-donating group into electron-withdrawing group resulting in the increase of electron-deficiency of Cr, which was beneficial to the ethylene insertion. Also, it can be seen that the decreased activity from Phillips catalyst to PS1.5 catalyst might be due to the presence of phenyl ligands and the release of surface ring strain in PS catalysts decreasing the electron-deficiency of the Cr active site, but not the introduction of the hydroxyl group next to the Cr active site. 4.5 Modification of PS catalyst by alkyl chlorosilane As a consequence of the above considerations, due to the positive effect of F modification of PS1.5 catalyst obtained from the prediction of theoretical calculation, it is necessary to carry out a detailed experiment. In practice, high temperature is necessary for the F modified Phillips catalyst by (NH4)SiF6 to remove the ammonia ion [42–44]. Unfortunately, the introduction of F was impracticable due to the loss of remaining TPS ligand under high temperature. Alternatively, three different kinds of alkyl chlorosilane, chlorotrimethylsilane (CH3)3SiCl, dichlorodimethylsilane (CH3)2SiCl2, and trichloromethylsilane CH3SiCl3 were studied systematically. The reaction of surface silanol of the silica gel with alkyl chlorosilane was applied as a typical method to quantification of the silanol number [45]. A plausible reaction between the surface hydroxyl group on PS1.5 catalyst and alkyl chlorosilane is shown in Scheme 5 . Firstly, DFT method was used to gain basic understanding on the influence of the modification of PS catalyst by alkyl chlorosilane, and a set of simplified models were presented in Scheme 3. Model b′ was derived from model b with replacement of phenyl by methyl ligand. Models b′-Cl, b′-2Cl and b′-3Cl were derived from model b′ modified by alkyl chlorosilane compounds with one, two, and three chlorine atoms, respectively. As shown in Table 3, there was a significant decline for Mulliken charge of Cr but an increase of bond length (r Cr–O) from b′ to b′-Cl, b′-2Cl, and b′-3Cl. The energy barriers of ethylene insertion for alkyl chlorosilane modified PS models were all around 23 kcal/mol, which was higher than b′ with 21.59kcal/mol, indicating that the modification of PS catalyst by alkyl chlorosilane was unfavorable for ethylene polymerization. Next, ethylene polymerization experiments using the corresponding PS catalysts were carried out in order to further confirm the above computational results. And 2mol equivalents of alkyl chlorosilane were excessively added to PS1.5 obtained by the reaction of TPS and Phillips catalyst. Table 4 shows the activity of alkyl chlorosilane-modified PS1.5 catalysts. Compared with the original PS1.5 catalyst, the chlorosilane-modification resulted in a decrease in activity. And the activity difference between three different kinds of chlorosilane compounds was small, which was consistent with the computational results. Both computational and experimental results showed that the modification of PS catalyst by alkyl chlorosilane compounds was unfavorable for polymerization activity, which further verified that the coordination of hydroxyl with the reduced Cr site was favorable for PS1.5 catalyst (Table 3). We also found that PS catalyst modified by three different kinds of chlorosilane compounds made very small difference despite of the introduction of electron-withdrawing group Cl in models b′-2Cl and b′-3Cl, indicating that the electron-withdrawing group may play the role only limited at a certain distance away from the Cr active site as model b-F did. Further investigation using other modification reagents is still being carried out by experiments combined with molecular modeling in order to improve the performance of PS catalysts. 5 Conclusion A green synthesis route for the preparation of silica gel supported silyl chromate type catalysts namely PS catalysts for ethylene polymerization through a transformation reaction between Phillips catalyst and TPS was systematically investigated by combined theoretical and experimental methods. The element analysis of the catalysts demonstrated that the conversion from Phillips catalyst to the UCC S-2 catalyst could not occur completely suggesting the chromium might be partially removed off from the surface of silica gel in the form of BC especially at high TPS/Cr molar ratio. Though the PS1.5 and S-2 catalysts presented similar kinetics curves for the same kind of TEA or MAO cocatalyst, the corresponding polymerization activity of PS1.5 catalyst was higher than that of S-2 catalyst. Compared with the Phillips catalyst, the activity of the PS1.5 was not increased with the increasing calcination temperature, and the highest activity was obtained at 600°C. The decreased activity from Phillips catalyst to PS1.5 catalyst may be due to the presence of phenyl ligands and the release of surface ring strain in PS catalyst decreasing the electron-deficiency of the Cr active site. The simultaneous formation of a hydroxyl group next to the Cr active site during the preparation of PS catalyst was investigated. The existence of the introduced hydroxyl and its coordination to the reduced Cr active site seemed favorable to the polymerization activity for PS catalysts, and this might be the reason for the higher activity of PS catalysts than that of S-2 catalyst. Further modification of PS catalyst by three different kinds of alkyl chlorosilane compounds presenting similarly computational and experimental results indicated that the effect of the electron-withdrawing group was limited at a certain distance away from Cr active site. This preliminary study with combination of theoretical and experimental methods provided a solid basis for the further innovation of silica gel supported silyl chromate type catalysts and final substitution of UCC S-2 catalyst in commercial processes. Acknowledgements The authors thank the financial support by the Key Project in the National Science & Technology Pillar Program during the 11th Five-Year Plan Period (2007BAE50B04) and Qilu Branch Co., SINOPEC. The work was also supported by National Natural Science Foundation of China (20774025), the research program of the State Key Laboratory of Chemical Engineering, Shanghai Pujiang Talent Plan Project (08PJ14032) and the Program of Introducing Talents of Discipline to Universities (B08021). Appendix A Supplementary data Supplementary data associated with this article can be found, in the online version, at doi:10.1016/j.molcata.2010.07.002. Appendix A Supplementary data References [1] S. Randoll P.G. Jones M. Tamm Organometallics 27 2008 3232 [2] F.J. Karol G.L. Karapinka C. Wu A.W. Dow R.N. Johnson W.L. Carrick J. Polym. Sci. Part A: Polym. Chem. 10 1972 2621 [3] W.L. Carrick R.J. Turbett F.J. Karol G.L. Karapinka A.S. Fox R.N. Johnson J. Polym. Sci. Part A: Polym. Chem. 10 1972 2609 [4] M.P. McDaniel Adv. Catal. 33 1985 47 [5] K. Cann M. Apecetche M. Zhang Macromol. Symp. 213 2004 29 [6] Y. Fang W. Xia M. He B. Liu K. Hasebe M. Terano J. Mol. Catal. A: Chem. 247 2006 240 [7] L.M. Baker W.L. Carrick J. Org. Chem. 35 1970 774 [8] A.B. Gaspar R.L. Martins M. Schmal L.C. Dieguez J. Mol. Catal. A: Chem. 169 2001 105 [9] A.B. Gaspar L.C. Dieguez Appl. Catal. A: Gen. 227 2002 241 [10] Y. Li H. Ji W. Lin X. Xu L. Dai Adv. Fine Petrochem. 7 2006 1 [11] K. Cann, M. Zhang, M. Apecetche, WO2004076494 (2004). [12] O. Espelid K.J. Borve J. Catal. 205 2002 366 [13] R. Schmid T. Ziegler Can. J. Chem. 78 2000 265 [14] O. Espelid K.J. Borve J. Catal. 206 2002 331 [15] B. Liu Y. Fang W. Xia M. Terano Kinet. Catal. 47 2006 234 [16] B. Liu Y. Fang M. Terano Mol. Simul. 30 2004 963 [17] O. Espelid K.J. Borve J. Catal. 205 2002 177 [18] O. Espelid K.J. Borve V.R. Jensen J. Phys. Chem. A 102 1998 10414 [19] O. Espelid K.J. Borve J. Catal. 195 2000 125 [20] A.B. Gaspar C.A.C. Perez L.C. Dieguez Appl. Surf. Sci. 252 2005 939 [21] V.J. Ruddick J.P.S. Badyal J. Phys. Chem. B 101 1997 9240 [22] V.J. Ruddick P.W. Dyer G. Bell V.C. Gibson J.P.S. Badyal J. Phys. Chem. 100 1996 11062 [23] V.J. Ruddick J.P.S. Badyal Langmuir 13 1997 469 [24] B. Liu Y. Fang M. Terano J. Mol. Catal. A: Chem. 219 2004 165 [25] S.M. Augustine J.P. Blitz J. Catal. 161 1996 641 [26] P. Qiu X. Li S. Zhang R. Cheng Q. Dong B. Liu L. Li Y. Yu Y. Tang J. Xie W. Wang Asia-Pac. J. Chem. Eng. 4 2009 660 [27] M.J. Frisch, G.W. Trucks, H.B. Schlegel, G.E. Scuseria, M.A. Robb, J.R. Cheeseman, J.A. Montgomery, T. Vreven Jr., K.N. Kudin, J.C. Burant, J.M. Millam, S.S. Iyengar, J. Tomasi, V. Barone, B. Mennucci, M. Cossi, G. Scalmani, N. Rega, G.A. Petersson, H. Nakatsuji, M. Hada, M. Ehara, K. Toyota, R. Fukuda, J. Hasegawa, M. Ishida, T. Nakajima, Y. Honda, O. Kitao, H. Nakai, M. Klene, X. Li, J.E. Knox, H.P. Hratchian, J.B. Cross, V. Bakken, C. Adamo, J. Jaramillo, R. Gomperts, R.E. Stratmann, O. Yazyev, A.J. Austin, R. Cammi, C. Pomelli, J.W. Ochterski, P.Y. Ayala, K. Morokuma, G.A. Voth, P. Salvador, J.J. Dannenberg, V.G. Zakrzewski, S. Dapprich, A.D. Daniels, M.C. Strain, O. Farkas, D.K. Malick, A.D. Rabuck, K. Raghavachari, J.B. Foresman, J.V. Ortiz, Q. Cui, A.G. Baboul, S. Clifford, J. Cioslowski, B.B. Stefanov, G. Liu, A. Liashenko, P. Piskorz, I. Komaromi, R.L. Martin, D.J. Fox, T. Keith, M.A. Al-Laham, C.Y. Peng, A. Nanayakkara, M. Challacombe, P.M.W. Gill, B. Johnson, W. Chen, M.W. Wong, C. Gonzalez, J.A. Pople, Gaussian 03, Revision E.01, Gaussian, Inc., Wallingford, CT, 2004. [28] A.D. Becke Phys. Rev. A 38 1988 3098 [29] C. Lee W. Yang R.G. Parr Phys. Rev. B 37 1988 785 [30] P.J. Hay W.R. Wadt J. Chem. Phys. 82 1985 270 [31] C. Gonzalez H.B. Schlegel J. Phys. Chem. 94 1990 5523 [32] Y. Fang B. Liu M. Terano Kinet. Catal. 47 2006 295 [33] C.A. Demmelmaier R.E. White J.A. van Bokhoven S.L. Scott J. Phys. Chem. C 112 2008 6439 [34] C.A. Demmelmaier R.E. White J.A. van Bokhoven S.L. Scott J. Catal. 262 2009 44 [35] Y. Fang B. Liu M. Terano Appl. Catal. A: Gen. 279 2005 131 [36] M.P. McDaniel M.B. Welch J. Catal. 82 1983 98 [37] M. Nishimura J.M. Thomas Catal. Lett. 21 1993 149 [38] H.L. Krauss B. Rebenstorf U. Westphal Z. Anorg. Allg. Chem. 414 1975 97 [39] C. Groeneveld P.P.M.M. Wittgen A.M. van Kersbergen P.L.M. Mestrom C.E. Nuijten G.C.A. Schuit J. Catal. 59 1979 153 [40] P.P.M.M. Wittgen C. Groeneveld P.J.C.J.M. Zwaans H.J.B. Morgenstern A.H. van Heughten C.J.M. van Heumen G.C.A. Schuit J. Catal. 77 1982 360 [41] P. Cossee J. Catal. 3 1964 80 [42] J.P. Hogan, US3130188 (1964). [43] L.R. Kallenbach, US3445367 (1969). [44] B. Rebenstorf J. Mol. Catal. 66 1991 59 [45] E.F. Vansant P.V.D. Voort K.C. Vrancken Stud. Surf. Sci. Catal. 93 1995 266",
      "scopus-id": "77956961541",
      "coredata": {
        "eid": "1-s2.0-S1381116910002852",
        "dc:description": "SiO2-supported silyl chromate catalyst (UCC S-2 catalyst) is an important catalyst for the commercial production of polyethylene. Cann first reported a possible green synthesis route for the preparation of S-2 catalyst through transformation from Phillips catalyst by addition of triphenylsilanol (TPS) to avoid the use of toxic bis(triphenylsilyl) chromate (BC). In this work, this green synthesis route was further investigated by the combination of experimental and theoretical methods. The obtained catalyst was named as PS catalyst based on the incomplete conversion of Phillips catalyst to S-2 catalyst. Polymerization activity of PS1.5 catalyst was higher than that of S-2 catalyst with either TEA or MAO as cocatalyst. The existence of the simultaneously formed hydroxyl group and its coordination to the reduced Cr site was favorable to the PS catalyst, and this might attribute to the higher polymerization activity of PS catalyst than that of S-2 catalyst. A further modification of PS catalyst by a series of alkyl chlorosilane compounds showed that the role of the electron-withdrawing group only limited at a certain distance away from Cr active site. This preliminary study provided a solid basis for a further innovation of PS catalysts and final substitution of S-2 catalyst in commercial processes.",
        "openArchiveArticle": "false",
        "prism:coverDate": "2010-09-01",
        "openaccessUserLicense": null,
        "prism:aggregationType": "Journal",
        "prism:url": "https://api.elsevier.com/content/article/pii/S1381116910002852",
        "dc:creator": [
          {
            "@_fa": "true",
            "$": "Li, Xiaofang"
          },
          {
            "@_fa": "true",
            "$": "Cheng, Ruihua"
          },
          {
            "@_fa": "true",
            "$": "Luo, Jun"
          },
          {
            "@_fa": "true",
            "$": "Dong, Qi"
          },
          {
            "@_fa": "true",
            "$": "He, Xuelian"
          },
          {
            "@_fa": "true",
            "$": "Li, Liuzhong"
          },
          {
            "@_fa": "true",
            "$": "Yu, Yongling"
          },
          {
            "@_fa": "true",
            "$": "Da, Jianwen"
          },
          {
            "@_fa": "true",
            "$": "Liu, Boping"
          }
        ],
        "link": [
          {
            "@_fa": "true",
            "@rel": "self",
            "@href": "https://api.elsevier.com/content/article/pii/S1381116910002852"
          },
          {
            "@_fa": "true",
            "@rel": "scidir",
            "@href": "https://www.sciencedirect.com/science/article/pii/S1381116910002852"
          }
        ],
        "dc:format": "application/json",
        "openaccessType": null,
        "pii": "S1381-1169(10)00285-2",
        "prism:volume": "330",
        "prism:publisher": "Elsevier B.V.",
        "dc:title": "Experimental and theoretical studies on ethylene polymerization using SiO2-supported silyl chromate type catalysts prepared by a green method",
        "prism:copyright": "Copyright © 2010 Elsevier B.V. All rights reserved.",
        "openaccess": "0",
        "prism:issn": "13811169",
        "prism:issueIdentifier": "1-2",
        "dcterms:subject": [
          {
            "@_fa": "true",
            "$": "Silyl chromate S-2 catalyst"
          },
          {
            "@_fa": "true",
            "$": "Phillips catalyst"
          },
          {
            "@_fa": "true",
            "$": "Triphenylsilanol"
          },
          {
            "@_fa": "true",
            "$": "Ethylene polymerization"
          },
          {
            "@_fa": "true",
            "$": "Density functional theory (DFT)"
          }
        ],
        "openaccessArticle": "false",
        "prism:publicationName": "Journal of Molecular Catalysis A: Chemical",
        "prism:number": "1-2",
        "openaccessSponsorType": null,
        "prism:pageRange": "56-65",
        "prism:endingPage": "65",
        "pubType": "fla",
        "prism:coverDisplayDate": "1 September 2010",
        "prism:doi": "10.1016/j.molcata.2010.07.002",
        "prism:startingPage": "56",
        "dc:identifier": "doi:10.1016/j.molcata.2010.07.002",
        "openaccessSponsorName": null
      },
      "objects": {
        "object": [
          {
            "@category": "standard",
            "@_fa": "true",
            "$": "https://api.elsevier.com/content/object/eid/1-s2.0-S1381116910002852-mmc1.doc?httpAccept=%2A%2F%2A",
            "@multimediatype": "Microsoft Word file",
            "@type": "APPLICATION",
            "@size": "117248",
            "@ref": "mmc1",
            "@mimetype": "application/word"
          },
          {
            "@category": "standard",
            "@height": "156",
            "@width": "222",
            "@_fa": "true",
            "$": "https://api.elsevier.com/content/object/eid/1-s2.0-S1381116910002852-fx1.jpg?httpAccept=%2A%2F%2A",
            "@multimediatype": "JPEG image file",
            "@type": "IMAGE-DOWNSAMPLED",
            "@size": "7378",
            "@ref": "fx1",
            "@mimetype": "image/jpeg"
          },
          {
            "@category": "thumbnail",
            "@height": "154",
            "@width": "219",
            "@_fa": "true",
            "$": "https://api.elsevier.com/content/object/eid/1-s2.0-S1381116910002852-fx1.sml?httpAccept=%2A%2F%2A",
            "@multimediatype": "GIF image file",
            "@type": "IMAGE-THUMBNAIL",
            "@size": "2702",
            "@ref": "fx1",
            "@mimetype": "image/gif"
          },
          {
            "@category": "high",
            "@height": "691",
            "@width": "984",
            "@_fa": "true",
            "$": "https://api.elsevier.com/content/object/eid/1-s2.0-S1381116910002852-fx1_lrg.jpg?httpAccept=%2A%2F%2A",
            "@multimediatype": "JPEG image file",
            "@type": "IMAGE-HIGH-RES",
            "@size": "63925",
            "@ref": "fx1",
            "@mimetype": "image/jpeg"
          },
          {
            "@category": "standard",
            "@height": "289",
            "@width": "376",
            "@_fa": "true",
            "$": "https://api.elsevier.com/content/object/eid/1-s2.0-S1381116910002852-gr1.jpg?httpAccept=%2A%2F%2A",
            "@multimediatype": "JPEG image file",
            "@type": "IMAGE-DOWNSAMPLED",
            "@size": "15637",
            "@ref": "gr1",
            "@mimetype": "image/jpeg"
          },
          {
            "@category": "thumbnail",
            "@height": "164",
            "@width": "213",
            "@_fa": "true",
            "$": "https://api.elsevier.com/content/object/eid/1-s2.0-S1381116910002852-gr1.sml?httpAccept=%2A%2F%2A",
            "@multimediatype": "GIF image file",
            "@type": "IMAGE-THUMBNAIL",
            "@size": "2237",
            "@ref": "gr1",
            "@mimetype": "image/gif"
          },
          {
            "@category": "high",
            "@height": "1280",
            "@width": "1665",
            "@_fa": "true",
            "$": "https://api.elsevier.com/content/object/eid/1-s2.0-S1381116910002852-gr1_lrg.jpg?httpAccept=%2A%2F%2A",
            "@multimediatype": "JPEG image file",
            "@type": "IMAGE-HIGH-RES",
            "@size": "109723",
            "@ref": "gr1",
            "@mimetype": "image/jpeg"
          },
          {
            "@category": "standard",
            "@height": "795",
            "@width": "339",
            "@_fa": "true",
            "$": "https://api.elsevier.com/content/object/eid/1-s2.0-S1381116910002852-gr2.jpg?httpAccept=%2A%2F%2A",
            "@multimediatype": "JPEG image file",
            "@type": "IMAGE-DOWNSAMPLED",
            "@size": "41811",
            "@ref": "gr2",
            "@mimetype": "image/jpeg"
          },
          {
            "@category": "thumbnail",
            "@height": "164",
            "@width": "70",
            "@_fa": "true",
            "$": "https://api.elsevier.com/content/object/eid/1-s2.0-S1381116910002852-gr2.sml?httpAccept=%2A%2F%2A",
            "@multimediatype": "GIF image file",
            "@type": "IMAGE-THUMBNAIL",
            "@size": "1736",
            "@ref": "gr2",
            "@mimetype": "image/gif"
          },
          {
            "@category": "high",
            "@height": "3521",
            "@width": "1501",
            "@_fa": "true",
            "$": "https://api.elsevier.com/content/object/eid/1-s2.0-S1381116910002852-gr2_lrg.jpg?httpAccept=%2A%2F%2A",
            "@multimediatype": "JPEG image file",
            "@type": "IMAGE-HIGH-RES",
            "@size": "335857",
            "@ref": "gr2",
            "@mimetype": "image/jpeg"
          },
          {
            "@category": "standard",
            "@height": "265",
            "@width": "352",
            "@_fa": "true",
            "$": "https://api.elsevier.com/content/object/eid/1-s2.0-S1381116910002852-gr3.jpg?httpAccept=%2A%2F%2A",
            "@multimediatype": "JPEG image file",
            "@type": "IMAGE-DOWNSAMPLED",
            "@size": "12716",
            "@ref": "gr3",
            "@mimetype": "image/jpeg"
          },
          {
            "@category": "thumbnail",
            "@height": "164",
            "@width": "218",
            "@_fa": "true",
            "$": "https://api.elsevier.com/content/object/eid/1-s2.0-S1381116910002852-gr3.sml?httpAccept=%2A%2F%2A",
            "@multimediatype": "GIF image file",
            "@type": "IMAGE-THUMBNAIL",
            "@size": "2597",
            "@ref": "gr3",
            "@mimetype": "image/gif"
          },
          {
            "@category": "high",
            "@height": "1175",
            "@width": "1560",
            "@_fa": "true",
            "$": "https://api.elsevier.com/content/object/eid/1-s2.0-S1381116910002852-gr3_lrg.jpg?httpAccept=%2A%2F%2A",
            "@multimediatype": "JPEG image file",
            "@type": "IMAGE-HIGH-RES",
            "@size": "91552",
            "@ref": "gr3",
            "@mimetype": "image/jpeg"
          },
          {
            "@category": "standard",
            "@height": "371",
            "@width": "577",
            "@_fa": "true",
            "$": "https://api.elsevier.com/content/object/eid/1-s2.0-S1381116910002852-sc1.jpg?httpAccept=%2A%2F%2A",
            "@multimediatype": "JPEG image file",
            "@type": "IMAGE-DOWNSAMPLED",
            "@size": "26817",
            "@ref": "sc1",
            "@mimetype": "image/jpeg"
          },
          {
            "@category": "thumbnail",
            "@height": "141",
            "@width": "219",
            "@_fa": "true",
            "$": "https://api.elsevier.com/content/object/eid/1-s2.0-S1381116910002852-sc1.sml?httpAccept=%2A%2F%2A",
            "@multimediatype": "GIF image file",
            "@type": "IMAGE-THUMBNAIL",
            "@size": "2645",
            "@ref": "sc1",
            "@mimetype": "image/gif"
          },
          {
            "@category": "high",
            "@height": "1644",
            "@width": "2556",
            "@_fa": "true",
            "$": "https://api.elsevier.com/content/object/eid/1-s2.0-S1381116910002852-sc1_lrg.jpg?httpAccept=%2A%2F%2A",
            "@multimediatype": "JPEG image file",
            "@type": "IMAGE-HIGH-RES",
            "@size": "228516",
            "@ref": "sc1",
            "@mimetype": "image/jpeg"
          },
          {
            "@category": "standard",
            "@height": "134",
            "@width": "546",
            "@_fa": "true",
            "$": "https://api.elsevier.com/content/object/eid/1-s2.0-S1381116910002852-sc2.jpg?httpAccept=%2A%2F%2A",
            "@multimediatype": "JPEG image file",
            "@type": "IMAGE-DOWNSAMPLED",
            "@size": "10213",
            "@ref": "sc2",
            "@mimetype": "image/jpeg"
          },
          {
            "@category": "thumbnail",
            "@height": "54",
            "@width": "219",
            "@_fa": "true",
            "$": "https://api.elsevier.com/content/object/eid/1-s2.0-S1381116910002852-sc2.sml?httpAccept=%2A%2F%2A",
            "@multimediatype": "GIF image file",
            "@type": "IMAGE-THUMBNAIL",
            "@size": "1137",
            "@ref": "sc2",
            "@mimetype": "image/gif"
          },
          {
            "@category": "high",
            "@height": "591",
            "@width": "2417",
            "@_fa": "true",
            "$": "https://api.elsevier.com/content/object/eid/1-s2.0-S1381116910002852-sc2_lrg.jpg?httpAccept=%2A%2F%2A",
            "@multimediatype": "JPEG image file",
            "@type": "IMAGE-HIGH-RES",
            "@size": "79939",
            "@ref": "sc2",
            "@mimetype": "image/jpeg"
          },
          {
            "@category": "standard",
            "@height": "574",
            "@width": "565",
            "@_fa": "true",
            "$": "https://api.elsevier.com/content/object/eid/1-s2.0-S1381116910002852-sc3.jpg?httpAccept=%2A%2F%2A",
            "@multimediatype": "JPEG image file",
            "@type": "IMAGE-DOWNSAMPLED",
            "@size": "53819",
            "@ref": "sc3",
            "@mimetype": "image/jpeg"
          },
          {
            "@category": "thumbnail",
            "@height": "164",
            "@width": "161",
            "@_fa": "true",
            "$": "https://api.elsevier.com/content/object/eid/1-s2.0-S1381116910002852-sc3.sml?httpAccept=%2A%2F%2A",
            "@multimediatype": "GIF image file",
            "@type": "IMAGE-THUMBNAIL",
            "@size": "2672",
            "@ref": "sc3",
            "@mimetype": "image/gif"
          },
          {
            "@category": "high",
            "@height": "2540",
            "@width": "2500",
            "@_fa": "true",
            "$": "https://api.elsevier.com/content/object/eid/1-s2.0-S1381116910002852-sc3_lrg.jpg?httpAccept=%2A%2F%2A",
            "@multimediatype": "JPEG image file",
            "@type": "IMAGE-HIGH-RES",
            "@size": "290494",
            "@ref": "sc3",
            "@mimetype": "image/jpeg"
          },
          {
            "@category": "standard",
            "@height": "373",
            "@width": "659",
            "@_fa": "true",
            "$": "https://api.elsevier.com/content/object/eid/1-s2.0-S1381116910002852-sc4.jpg?httpAccept=%2A%2F%2A",
            "@multimediatype": "JPEG image file",
            "@type": "IMAGE-DOWNSAMPLED",
            "@size": "32956",
            "@ref": "sc4",
            "@mimetype": "image/jpeg"
          },
          {
            "@category": "thumbnail",
            "@height": "124",
            "@width": "219",
            "@_fa": "true",
            "$": "https://api.elsevier.com/content/object/eid/1-s2.0-S1381116910002852-sc4.sml?httpAccept=%2A%2F%2A",
            "@multimediatype": "GIF image file",
            "@type": "IMAGE-THUMBNAIL",
            "@size": "2501",
            "@ref": "sc4",
            "@mimetype": "image/gif"
          },
          {
            "@category": "high",
            "@height": "1652",
            "@width": "2917",
            "@_fa": "true",
            "$": "https://api.elsevier.com/content/object/eid/1-s2.0-S1381116910002852-sc4_lrg.jpg?httpAccept=%2A%2F%2A",
            "@multimediatype": "JPEG image file",
            "@type": "IMAGE-HIGH-RES",
            "@size": "265603",
            "@ref": "sc4",
            "@mimetype": "image/jpeg"
          },
          {
            "@category": "standard",
            "@height": "145",
            "@width": "565",
            "@_fa": "true",
            "$": "https://api.elsevier.com/content/object/eid/1-s2.0-S1381116910002852-sc5.jpg?httpAccept=%2A%2F%2A",
            "@multimediatype": "JPEG image file",
            "@type": "IMAGE-DOWNSAMPLED",
            "@size": "11736",
            "@ref": "sc5",
            "@mimetype": "image/jpeg"
          },
          {
            "@category": "thumbnail",
            "@height": "56",
            "@width": "219",
            "@_fa": "true",
            "$": "https://api.elsevier.com/content/object/eid/1-s2.0-S1381116910002852-sc5.sml?httpAccept=%2A%2F%2A",
            "@multimediatype": "GIF image file",
            "@type": "IMAGE-THUMBNAIL",
            "@size": "1185",
            "@ref": "sc5",
            "@mimetype": "image/gif"
          },
          {
            "@category": "high",
            "@height": "641",
            "@width": "2504",
            "@_fa": "true",
            "$": "https://api.elsevier.com/content/object/eid/1-s2.0-S1381116910002852-sc5_lrg.jpg?httpAccept=%2A%2F%2A",
            "@multimediatype": "JPEG image file",
            "@type": "IMAGE-HIGH-RES",
            "@size": "93872",
            "@ref": "sc5",
            "@mimetype": "image/jpeg"
          },
          {
            "@category": "standard",
            "@height": "267",
            "@width": "470",
            "@_fa": "true",
            "$": "https://api.elsevier.com/content/object/eid/1-s2.0-S1381116910002852-gr4.jpg?httpAccept=%2A%2F%2A",
            "@multimediatype": "JPEG image file",
            "@type": "IMAGE-DOWNSAMPLED",
            "@size": "34816",
            "@ref": "gr4",
            "@mimetype": "image/jpeg"
          },
          {
            "@category": "thumbnail",
            "@height": "124",
            "@width": "219",
            "@_fa": "true",
            "$": "https://api.elsevier.com/content/object/eid/1-s2.0-S1381116910002852-gr4.sml?httpAccept=%2A%2F%2A",
            "@multimediatype": "GIF image file",
            "@type": "IMAGE-THUMBNAIL",
            "@size": "4625",
            "@ref": "gr4",
            "@mimetype": "image/gif"
          },
          {
            "@category": "high",
            "@height": "1184",
            "@width": "2083",
            "@_fa": "true",
            "$": "https://api.elsevier.com/content/object/eid/1-s2.0-S1381116910002852-gr4_lrg.jpg?httpAccept=%2A%2F%2A",
            "@multimediatype": "JPEG image file",
            "@type": "IMAGE-HIGH-RES",
            "@size": "197952",
            "@ref": "gr4",
            "@mimetype": "image/jpeg"
          }
        ]
      },
      "link": {
        "@rel": "abstract",
        "@href": "https://api.elsevier.com/content/abstract/scopus_id/77956961541"
      }
    }
  }
}