{
  "metadata": {
    "title": "<ce:italic>In situ</ce:italic> generated Pd(0) nanoparticles stabilized by bis(aryl)acenaphthenequinone diimines as catalysts for aminocarbonylation reactions in water",
    "authors": "; ; ",
    "journal": "Journal of Molecular Catalysis A: Chemical",
    "date": "2016-12-15",
    "doi": "10.1016/j.molcata.2016.10.025",
    "abstract": "",
    "uri": "https://api.elsevier.com/content/article/pii/S1381116916304472",
    "pii": "S1381116916304472"
  },
  "fulltext": {
    "full-text-retrieval-response": {
      "scopus-eid": "2-s2.0-84999106928",
      "originalText": "serial JL 271358 291210 291744 291790 291809 31 Journal of Molecular Catalysis A: Chemical JOURNALMOLECULARCATALYSISACHEMICAL 2016-10-20 2016-10-20 2016-11-29 2016-11-29 2019-10-28T13:34:12 1-s2.0-S1381116916304472 S1381-1169(16)30447-2 S1381116916304472 10.1016/j.molcata.2016.10.025 S300 S300.2 FULL-TEXT 1-s2.0-S1381116916X00118 2019-10-30T00:38:56.052744Z 0 0 20161215 2016 2016-10-20T16:10:32.408678Z absattachment articleinfo articletitlenorm authfirstinitialnorm authfirstsurnamenorm cid cids contenttype copyright crossmark dateloaded dateloadedtxt datesearch datesort dateupdated dco docsubtype doctype doi eid ewtransactionid hubeid indexeddate issn issnnorm itemstage itemtransactionid itemweight openaccess openarchive pg pgfirst pglast pii piinorm pubdatestart pubdatetxt pubyr sortorder srctitle srctitlenorm srctype ssids alllist content subj subheadings suppl tomb volfirst volissue volumelist webpdf webpdfpagecount yearnav figure table e-component body acknowledge affil appendices articletitle auth authfirstini authfull authkeywords authlast grantnumber grantsponsor highlightsabst primabst pubtype ref specialabst 1381-1169 13811169 true 425 425 C Volume 425 38 322 331 322 331 20161215 15 December 2016 2016-12-15 2016 article fla © 2016 Elsevier B.V. All rights reserved. INSITUGENERATEDPD0NANOPARTICLESSTABILIZEDBYBISARYLACENAPHTHENEQUINONEDIIMINESCATALYSTSFORAMINOCARBONYLATIONREACTIONSINWATER WOJCIK P 1 Introduction 2 Experimental 2.1 Synthesis of [PdCl2(Ar2-BIAN)], 1a - 3a 2.2 Aminocarbonylation reaction 2.3 Procedure for catalyst recycling 2.4 Analysis of Pd(0) nanoparticles 2.5 X-ray structure determination 3 Results and discussion 3.1 Synthesis and X-ray structure of [PdCl2(Ar2-BIAN)] complexes 3.2 Catalytic activity of the palladium complexes, 1a − 3a, in the aminocarbonylation reaction 3.3 TEM experiment 3.4 Characterization of palladium nanoparticles 3.5 Recycling of palladium catalyst 3.6 Poisoning tests 3.7 Aminocarbonylation reactions of iodobenzene with substituted anilines 3.8 Aminocarbonylation reactions of iodobenzene with aliphatic amines 3.9 Plausible mechanism of aminocarbonylation 4 Conclusions Acknowledgements Appendix A Supplementary data References BRENNFUHRER 2009 4114 4133 A DARA 2015 1 8 B SHEN 2015 2994 2999 C MOGHADDAM 2014 3474 3481 F LI 2015 10239 10243 H CHO 2011 5068 5083 S VALEUR 2009 606 631 E MONTALBETTI 2005 10827 10852 C BELLER 1995 17 85 M GRIGG 2010 5515 5548 R SCHOENBERG 1974 3327 3331 A GADGE 2014 10367 10389 S FAIRLAMB 2007 859 865 I ZHANG 2014 9702 9706 C QURESHI 2012 148 153 Z WU 2011 3702 3704 X XU 2013 5496 5499 T SALVADORI 2010 1841 1847 J KHEDKAR 2011 3415 3422 M TAKACS 2016 247 256 A GERGELY 2014 218 224 M HORVATH 2010 54 60 L TAKACS 2010 4479 4483 A TAKACS 2009 4795 4800 A TAKACS 2008 61 66 A TAKACS 2014 1473 1478 A TAKACS 2008 8726 8730 A MULLER 2005 797 802 E ZHU 2011 9320 9325 Y DUTTA 2015 31 36 B BIYING 2013 184 188 A PRASAD 2013 4167 4174 A CHEN 2015 23 29 B DANG 2012 1805 1807 T DANG 2013 1406 1410 T TINNIS 2014 5885 5889 F SHARMA 2016 314 320 N LIU 2009 623 627 J GENELOT 2012 1886 1893 M PAPP 2013 193 199 M SAITO 2015 2358 2361 N CHEN 2014 54 61 B DU 2015 7816 7823 H GONG 2012 2768 2772 X TAMBADE 2012 176 185 P WANG 2014 2539 2546 Y GROEN 1997 68 77 J SCAREL 2008 1486 1494 A VANLAREN 1999 3715 3717 M CENINI 1996 37 41 S GRASA 2001 1077 1080 G GOTTUMUKKALA 2011 3498 3501 A VANASSELT 1994 88 98 R GASPERINI 2002 2950 2957 M GASPERINI 2004 995 1001 M KLUWER 2005 15470 15480 A GASPERINI 2004 3376 3382 M SHELDRICK 2008 112 122 G OXFORDDIFFRACTION 2008 CRYSALISREDVERSION11713355 FARRUGIA 1997 565 L SHULTZ 2001 3975 3982 L VANASSELT 1997 317 328 R FERNANDEZ 2007 5572 5581 F PHAN 2006 609 680 N PERDIAU 2012 2427 2434 S WIDERGEN 2003 317 341 J DROST 2015 2095 2107 R REETZ 2000 165 168 M GNIEWEK 2005 332 343 A JIAO 2015 26913 26922 N ZHOU 2014 1454 1460 Q BALOGH 2009 76 79 J DELAFUENTE 2012 1695 1697 V FERNANDEZALVAREZ 2014 10982 10989 V UOZUMI 2001 5272 5274 Y TSUKADA 2003 436 444 N URBAN 2015 150 157 B ZHENG 2014 48 53 S WOJCIKX2016X322 WOJCIKX2016X322X331 WOJCIKX2016X322XP WOJCIKX2016X322X331XP 2018-11-29T00:00:00.000Z http://creativecommons.org/licenses/by-nc-nd/4.0/ © 2016 Elsevier B.V. All rights reserved. 2019-03-16T07:20:08.148Z http://vtw.elsevier.com/data/voc/AddOnTypes/50.7/nlp National Science Centre 2014/15/B/ST5/02101 Narodowe Centrum Nauki http://data.elsevier.com/vocabulary/SciValFunders/501100004281 http://sws.geonames.org/798544/ Financial support of National Science Centre (NCN, Poland) with grant 2014/15/B/ST5/02101 (P.W., A.G., A.M.T.) is gratefully acknowledged. item S1381-1169(16)30447-2 S1381116916304472 1-s2.0-S1381116916304472 10.1016/j.molcata.2016.10.025 271358 2019-10-30T00:38:56.052744Z 2016-12-15 1-s2.0-S1381116916304472-main.pdf https://s3.amazonaws.com/prod-ucs-content-store-us-east/content/pii:S1381116916304472/MAIN/application/pdf/9a9e52b699d2cbfa22db99088ecff84c/main.pdf main.pdf pdf true 2259911 MAIN 10 1-s2.0-S1381116916304472-main_1.png https://s3.amazonaws.com/prod-ucs-content-store-us-east/content/pii:S1381116916304472/PREVIEW/image/png/d17353115ef5e6f94a5fd07605bb3fa3/main_1.png main_1.png png 57481 849 656 IMAGE-WEB-PDF 1 1-s2.0-S1381116916304472-fx1.sml https://s3.amazonaws.com/prod-ucs-content-store-us-east/content/pii:S1381116916304472/fx1/THUMBNAIL/image/gif/0ed791c444ed232d9bd949026e964513/fx1.sml fx1 true fx1.sml sml 3364 88 219 IMAGE-THUMBNAIL 1-s2.0-S1381116916304472-fx10.sml https://s3.amazonaws.com/prod-ucs-content-store-us-east/content/pii:S1381116916304472/fx10/THUMBNAIL/image/gif/1fada39780981e16f15460099b8057aa/fx10.sml fx10 fx10.sml sml 2867 88 219 IMAGE-THUMBNAIL 1-s2.0-S1381116916304472-fx11.sml https://s3.amazonaws.com/prod-ucs-content-store-us-east/content/pii:S1381116916304472/fx11/THUMBNAIL/image/gif/8626f2c0bb7479e0a1fed6e267cf72d9/fx11.sml fx11 fx11.sml sml 3180 88 219 IMAGE-THUMBNAIL 1-s2.0-S1381116916304472-fx12.sml https://s3.amazonaws.com/prod-ucs-content-store-us-east/content/pii:S1381116916304472/fx12/THUMBNAIL/image/gif/75cb52fc8a6f74a29d4751384f38af78/fx12.sml fx12 fx12.sml sml 3061 88 219 IMAGE-THUMBNAIL 1-s2.0-S1381116916304472-fx13.sml https://s3.amazonaws.com/prod-ucs-content-store-us-east/content/pii:S1381116916304472/fx13/THUMBNAIL/image/gif/c5ec50c484bed5361653979f0bd5a944/fx13.sml fx13 fx13.sml sml 3388 88 219 IMAGE-THUMBNAIL 1-s2.0-S1381116916304472-fx14.sml https://s3.amazonaws.com/prod-ucs-content-store-us-east/content/pii:S1381116916304472/fx14/THUMBNAIL/image/gif/6996d61166bf8bb14e2bfd5d68810bbd/fx14.sml fx14 fx14.sml sml 3226 88 219 IMAGE-THUMBNAIL 1-s2.0-S1381116916304472-fx15.sml https://s3.amazonaws.com/prod-ucs-content-store-us-east/content/pii:S1381116916304472/fx15/THUMBNAIL/image/gif/5ffe7b91005696683b52089ea307e293/fx15.sml fx15 fx15.sml sml 3563 88 219 IMAGE-THUMBNAIL 1-s2.0-S1381116916304472-fx16.sml https://s3.amazonaws.com/prod-ucs-content-store-us-east/content/pii:S1381116916304472/fx16/THUMBNAIL/image/gif/8a6b3e540638d9fbf9d40ffc4da9d0ef/fx16.sml fx16 fx16.sml sml 2706 88 219 IMAGE-THUMBNAIL 1-s2.0-S1381116916304472-fx17.sml https://s3.amazonaws.com/prod-ucs-content-store-us-east/content/pii:S1381116916304472/fx17/THUMBNAIL/image/gif/320b23b34bc97d6c2d724099fc62a2de/fx17.sml fx17 fx17.sml sml 3632 88 219 IMAGE-THUMBNAIL 1-s2.0-S1381116916304472-fx18.sml https://s3.amazonaws.com/prod-ucs-content-store-us-east/content/pii:S1381116916304472/fx18/THUMBNAIL/image/gif/ec25be65867c11a3bb55fbc092a1a837/fx18.sml fx18 fx18.sml sml 3114 88 219 IMAGE-THUMBNAIL 1-s2.0-S1381116916304472-fx19.sml https://s3.amazonaws.com/prod-ucs-content-store-us-east/content/pii:S1381116916304472/fx19/THUMBNAIL/image/gif/6ae05951246e21071fd99e4ac7d2bef3/fx19.sml fx19 fx19.sml sml 3163 88 219 IMAGE-THUMBNAIL 1-s2.0-S1381116916304472-fx2.sml https://s3.amazonaws.com/prod-ucs-content-store-us-east/content/pii:S1381116916304472/fx2/THUMBNAIL/image/gif/fce639a40e6cd55c11bfc1c5d6f7e7bc/fx2.sml fx2 fx2.sml sml 2767 88 219 IMAGE-THUMBNAIL 1-s2.0-S1381116916304472-fx20.sml https://s3.amazonaws.com/prod-ucs-content-store-us-east/content/pii:S1381116916304472/fx20/THUMBNAIL/image/gif/fa0b77b595d229ee1a30a7af75b9785a/fx20.sml fx20 fx20.sml sml 2665 88 219 IMAGE-THUMBNAIL 1-s2.0-S1381116916304472-fx21.sml https://s3.amazonaws.com/prod-ucs-content-store-us-east/content/pii:S1381116916304472/fx21/THUMBNAIL/image/gif/ad75aae240aef9e1a989ba1bd1340878/fx21.sml fx21 fx21.sml sml 3222 88 219 IMAGE-THUMBNAIL 1-s2.0-S1381116916304472-fx22.sml https://s3.amazonaws.com/prod-ucs-content-store-us-east/content/pii:S1381116916304472/fx22/THUMBNAIL/image/gif/5c1be54ce32ef394dfa423f13ff8200f/fx22.sml fx22 fx22.sml sml 3704 88 219 IMAGE-THUMBNAIL 1-s2.0-S1381116916304472-fx23.sml https://s3.amazonaws.com/prod-ucs-content-store-us-east/content/pii:S1381116916304472/fx23/THUMBNAIL/image/gif/64e2d5c8bb7e61e4da95b56ce3776ad2/fx23.sml fx23 fx23.sml sml 3514 88 219 IMAGE-THUMBNAIL 1-s2.0-S1381116916304472-fx3.sml https://s3.amazonaws.com/prod-ucs-content-store-us-east/content/pii:S1381116916304472/fx3/THUMBNAIL/image/gif/6a3d7257fab45d3dfe323731d4142193/fx3.sml fx3 fx3.sml sml 2731 88 219 IMAGE-THUMBNAIL 1-s2.0-S1381116916304472-fx4.sml https://s3.amazonaws.com/prod-ucs-content-store-us-east/content/pii:S1381116916304472/fx4/THUMBNAIL/image/gif/e2659b2060453177c57be48fe7a8816c/fx4.sml fx4 fx4.sml sml 2490 88 219 IMAGE-THUMBNAIL 1-s2.0-S1381116916304472-fx5.sml https://s3.amazonaws.com/prod-ucs-content-store-us-east/content/pii:S1381116916304472/fx5/THUMBNAIL/image/gif/2dc5235bd57c1c0dad2a4bb469c18b8b/fx5.sml fx5 fx5.sml sml 3035 88 219 IMAGE-THUMBNAIL 1-s2.0-S1381116916304472-fx6.sml https://s3.amazonaws.com/prod-ucs-content-store-us-east/content/pii:S1381116916304472/fx6/THUMBNAIL/image/gif/661b692724e7c8122043829843f53682/fx6.sml fx6 fx6.sml sml 2546 88 219 IMAGE-THUMBNAIL 1-s2.0-S1381116916304472-fx7.sml https://s3.amazonaws.com/prod-ucs-content-store-us-east/content/pii:S1381116916304472/fx7/THUMBNAIL/image/gif/b9668719505078285d114cb3994df090/fx7.sml fx7 fx7.sml sml 2933 88 219 IMAGE-THUMBNAIL 1-s2.0-S1381116916304472-fx8.sml https://s3.amazonaws.com/prod-ucs-content-store-us-east/content/pii:S1381116916304472/fx8/THUMBNAIL/image/gif/bb1da4fd5e1c7e4fb8308f42b4825b84/fx8.sml fx8 fx8.sml sml 2954 88 219 IMAGE-THUMBNAIL 1-s2.0-S1381116916304472-fx9.sml https://s3.amazonaws.com/prod-ucs-content-store-us-east/content/pii:S1381116916304472/fx9/THUMBNAIL/image/gif/413bdde7bb1a9907033cb7004995a335/fx9.sml fx9 fx9.sml sml 2549 88 219 IMAGE-THUMBNAIL 1-s2.0-S1381116916304472-gr1.sml https://s3.amazonaws.com/prod-ucs-content-store-us-east/content/pii:S1381116916304472/gr1/THUMBNAIL/image/gif/407e354d19f6936e89eb401db89595fb/gr1.sml gr1 gr1.sml sml 1989 45 219 IMAGE-THUMBNAIL 1-s2.0-S1381116916304472-gr10.sml https://s3.amazonaws.com/prod-ucs-content-store-us-east/content/pii:S1381116916304472/gr10/THUMBNAIL/image/gif/2389a839b5846a72f52e99ac9aa95218/gr10.sml gr10 gr10.sml sml 4662 164 208 IMAGE-THUMBNAIL 1-s2.0-S1381116916304472-gr2.sml https://s3.amazonaws.com/prod-ucs-content-store-us-east/content/pii:S1381116916304472/gr2/THUMBNAIL/image/gif/a80f96ba3a068e9d88fd2fc0422e2560/gr2.sml gr2 gr2.sml sml 7133 140 219 IMAGE-THUMBNAIL 1-s2.0-S1381116916304472-gr3.sml https://s3.amazonaws.com/prod-ucs-content-store-us-east/content/pii:S1381116916304472/gr3/THUMBNAIL/image/gif/ce06ed9b24f299fa8574b10477b0c207/gr3.sml gr3 gr3.sml sml 7063 135 219 IMAGE-THUMBNAIL 1-s2.0-S1381116916304472-gr4.sml https://s3.amazonaws.com/prod-ucs-content-store-us-east/content/pii:S1381116916304472/gr4/THUMBNAIL/image/gif/a735e6176959451d7d285b654387602a/gr4.sml gr4 gr4.sml sml 9736 69 219 IMAGE-THUMBNAIL 1-s2.0-S1381116916304472-gr5.sml https://s3.amazonaws.com/prod-ucs-content-store-us-east/content/pii:S1381116916304472/gr5/THUMBNAIL/image/gif/b07b34a22a661b274a690ea629494689/gr5.sml gr5 gr5.sml sml 8048 164 215 IMAGE-THUMBNAIL 1-s2.0-S1381116916304472-gr6.sml https://s3.amazonaws.com/prod-ucs-content-store-us-east/content/pii:S1381116916304472/gr6/THUMBNAIL/image/gif/fbdc7b45b239593fe4e6ce560ed5ed2a/gr6.sml gr6 gr6.sml sml 6607 164 195 IMAGE-THUMBNAIL 1-s2.0-S1381116916304472-gr7.sml https://s3.amazonaws.com/prod-ucs-content-store-us-east/content/pii:S1381116916304472/gr7/THUMBNAIL/image/gif/64d7d27317eaeeeaf10b9e921ed86e6c/gr7.sml gr7 gr7.sml sml 5089 113 219 IMAGE-THUMBNAIL 1-s2.0-S1381116916304472-gr8.sml https://s3.amazonaws.com/prod-ucs-content-store-us-east/content/pii:S1381116916304472/gr8/THUMBNAIL/image/gif/55a9a4b9d29d012ee9b0e2ff7465aad3/gr8.sml gr8 gr8.sml sml 7386 67 219 IMAGE-THUMBNAIL 1-s2.0-S1381116916304472-gr9.sml https://s3.amazonaws.com/prod-ucs-content-store-us-east/content/pii:S1381116916304472/gr9/THUMBNAIL/image/gif/8dee54465a219ec8d76a1eb7f17581d4/gr9.sml gr9 gr9.sml sml 5653 103 219 IMAGE-THUMBNAIL 1-s2.0-S1381116916304472-sc1.sml https://s3.amazonaws.com/prod-ucs-content-store-us-east/content/pii:S1381116916304472/sc1/THUMBNAIL/image/gif/6b5e34bf1b46c90043289cd963a9ba56/sc1.sml sc1 sc1.sml sml 4083 135 219 IMAGE-THUMBNAIL 1-s2.0-S1381116916304472-sc2.sml https://s3.amazonaws.com/prod-ucs-content-store-us-east/content/pii:S1381116916304472/sc2/THUMBNAIL/image/gif/b5474ac70b28458cfcf26fcca4c01e37/sc2.sml sc2 sc2.sml sml 3228 68 219 IMAGE-THUMBNAIL 1-s2.0-S1381116916304472-sc3.sml https://s3.amazonaws.com/prod-ucs-content-store-us-east/content/pii:S1381116916304472/sc3/THUMBNAIL/image/gif/0ca943d5fecc2264cf31383238f97796/sc3.sml sc3 sc3.sml sml 2408 46 219 IMAGE-THUMBNAIL 1-s2.0-S1381116916304472-sc4.sml https://s3.amazonaws.com/prod-ucs-content-store-us-east/content/pii:S1381116916304472/sc4/THUMBNAIL/image/gif/4bded9c7cd419c5b760bc95e167527fb/sc4.sml sc4 sc4.sml sml 2450 39 219 IMAGE-THUMBNAIL 1-s2.0-S1381116916304472-sc5.sml https://s3.amazonaws.com/prod-ucs-content-store-us-east/content/pii:S1381116916304472/sc5/THUMBNAIL/image/gif/3f76286412059e1b40c0461ad64588b8/sc5.sml sc5 sc5.sml sml 2054 32 219 IMAGE-THUMBNAIL 1-s2.0-S1381116916304472-fx1.jpg https://s3.amazonaws.com/prod-ucs-content-store-us-east/content/pii:S1381116916304472/fx1/DOWNSAMPLED/image/jpeg/f1d5439b42d5b0f23c7830e69da34fd4/fx1.jpg fx1 true fx1.jpg jpg 15765 200 500 IMAGE-DOWNSAMPLED 1-s2.0-S1381116916304472-fx10.jpg https://s3.amazonaws.com/prod-ucs-content-store-us-east/content/pii:S1381116916304472/fx10/DOWNSAMPLED/image/jpeg/40f437daa3f4d90f8d6cad70dff0dfb7/fx10.jpg fx10 fx10.jpg jpg 10050 200 500 IMAGE-DOWNSAMPLED 1-s2.0-S1381116916304472-fx11.jpg https://s3.amazonaws.com/prod-ucs-content-store-us-east/content/pii:S1381116916304472/fx11/DOWNSAMPLED/image/jpeg/8cfffc9792059145c84f131dc95ffbce/fx11.jpg fx11 fx11.jpg jpg 11924 200 500 IMAGE-DOWNSAMPLED 1-s2.0-S1381116916304472-fx12.jpg https://s3.amazonaws.com/prod-ucs-content-store-us-east/content/pii:S1381116916304472/fx12/DOWNSAMPLED/image/jpeg/b34380c0a98ae6dcfa6c2fc2d6297a1b/fx12.jpg fx12 fx12.jpg jpg 11673 200 500 IMAGE-DOWNSAMPLED 1-s2.0-S1381116916304472-fx13.jpg https://s3.amazonaws.com/prod-ucs-content-store-us-east/content/pii:S1381116916304472/fx13/DOWNSAMPLED/image/jpeg/d8225cab9091c3d623de1304454d206a/fx13.jpg fx13 fx13.jpg jpg 12709 200 500 IMAGE-DOWNSAMPLED 1-s2.0-S1381116916304472-fx14.jpg https://s3.amazonaws.com/prod-ucs-content-store-us-east/content/pii:S1381116916304472/fx14/DOWNSAMPLED/image/jpeg/b2bdc7cedcf5fef3b806e61792b1e417/fx14.jpg fx14 fx14.jpg jpg 11205 200 500 IMAGE-DOWNSAMPLED 1-s2.0-S1381116916304472-fx15.jpg https://s3.amazonaws.com/prod-ucs-content-store-us-east/content/pii:S1381116916304472/fx15/DOWNSAMPLED/image/jpeg/aa8f4f7de2d4ffecddce5496d8383c51/fx15.jpg fx15 fx15.jpg jpg 13132 200 500 IMAGE-DOWNSAMPLED 1-s2.0-S1381116916304472-fx16.jpg https://s3.amazonaws.com/prod-ucs-content-store-us-east/content/pii:S1381116916304472/fx16/DOWNSAMPLED/image/jpeg/c74fa9c5e2b517d44411d3ffbb0c3807/fx16.jpg fx16 fx16.jpg jpg 6320 200 500 IMAGE-DOWNSAMPLED 1-s2.0-S1381116916304472-fx17.jpg https://s3.amazonaws.com/prod-ucs-content-store-us-east/content/pii:S1381116916304472/fx17/DOWNSAMPLED/image/jpeg/256e25cd85f934eaafa5757a850d770c/fx17.jpg fx17 fx17.jpg jpg 8712 200 500 IMAGE-DOWNSAMPLED 1-s2.0-S1381116916304472-fx18.jpg https://s3.amazonaws.com/prod-ucs-content-store-us-east/content/pii:S1381116916304472/fx18/DOWNSAMPLED/image/jpeg/6b3d8bd656245d21009846905a32336b/fx18.jpg fx18 fx18.jpg jpg 6776 200 500 IMAGE-DOWNSAMPLED 1-s2.0-S1381116916304472-fx19.jpg https://s3.amazonaws.com/prod-ucs-content-store-us-east/content/pii:S1381116916304472/fx19/DOWNSAMPLED/image/jpeg/32c8584465ff7aed8247a94c135279bc/fx19.jpg fx19 fx19.jpg jpg 6756 200 500 IMAGE-DOWNSAMPLED 1-s2.0-S1381116916304472-fx2.jpg https://s3.amazonaws.com/prod-ucs-content-store-us-east/content/pii:S1381116916304472/fx2/DOWNSAMPLED/image/jpeg/d381c5d7da4ea9f192452d7fbad39a46/fx2.jpg fx2 fx2.jpg jpg 9231 200 500 IMAGE-DOWNSAMPLED 1-s2.0-S1381116916304472-fx20.jpg https://s3.amazonaws.com/prod-ucs-content-store-us-east/content/pii:S1381116916304472/fx20/DOWNSAMPLED/image/jpeg/6c612b6eceecf74e997eee1572286af1/fx20.jpg fx20 fx20.jpg jpg 6804 200 500 IMAGE-DOWNSAMPLED 1-s2.0-S1381116916304472-fx21.jpg https://s3.amazonaws.com/prod-ucs-content-store-us-east/content/pii:S1381116916304472/fx21/DOWNSAMPLED/image/jpeg/393060709ef20eb6059ee6f2e70917d2/fx21.jpg fx21 fx21.jpg jpg 7383 200 500 IMAGE-DOWNSAMPLED 1-s2.0-S1381116916304472-fx22.jpg https://s3.amazonaws.com/prod-ucs-content-store-us-east/content/pii:S1381116916304472/fx22/DOWNSAMPLED/image/jpeg/0757bd9c2ef3eeb6eea3065cd8313fdb/fx22.jpg fx22 fx22.jpg jpg 8501 200 500 IMAGE-DOWNSAMPLED 1-s2.0-S1381116916304472-fx23.jpg https://s3.amazonaws.com/prod-ucs-content-store-us-east/content/pii:S1381116916304472/fx23/DOWNSAMPLED/image/jpeg/cb7147b79c1f41b4edadb883a9125bfc/fx23.jpg fx23 fx23.jpg jpg 8101 200 500 IMAGE-DOWNSAMPLED 1-s2.0-S1381116916304472-fx3.jpg https://s3.amazonaws.com/prod-ucs-content-store-us-east/content/pii:S1381116916304472/fx3/DOWNSAMPLED/image/jpeg/77eea9b47166d462adf74d91a2e10d6f/fx3.jpg fx3 fx3.jpg jpg 9268 200 500 IMAGE-DOWNSAMPLED 1-s2.0-S1381116916304472-fx4.jpg https://s3.amazonaws.com/prod-ucs-content-store-us-east/content/pii:S1381116916304472/fx4/DOWNSAMPLED/image/jpeg/78b69aeada60afab9500611861ad18ea/fx4.jpg fx4 fx4.jpg jpg 8128 200 500 IMAGE-DOWNSAMPLED 1-s2.0-S1381116916304472-fx5.jpg https://s3.amazonaws.com/prod-ucs-content-store-us-east/content/pii:S1381116916304472/fx5/DOWNSAMPLED/image/jpeg/469db3ee0b114e1319c3e85487402077/fx5.jpg fx5 fx5.jpg jpg 10530 200 500 IMAGE-DOWNSAMPLED 1-s2.0-S1381116916304472-fx6.jpg https://s3.amazonaws.com/prod-ucs-content-store-us-east/content/pii:S1381116916304472/fx6/DOWNSAMPLED/image/jpeg/c45a408f452ce7761afaf9349b84a97e/fx6.jpg fx6 fx6.jpg jpg 8930 200 500 IMAGE-DOWNSAMPLED 1-s2.0-S1381116916304472-fx7.jpg https://s3.amazonaws.com/prod-ucs-content-store-us-east/content/pii:S1381116916304472/fx7/DOWNSAMPLED/image/jpeg/622d627a46a65b27d7b33884cf406512/fx7.jpg fx7 fx7.jpg jpg 10684 200 500 IMAGE-DOWNSAMPLED 1-s2.0-S1381116916304472-fx8.jpg https://s3.amazonaws.com/prod-ucs-content-store-us-east/content/pii:S1381116916304472/fx8/DOWNSAMPLED/image/jpeg/0e997a9f36a7462abc7b28af643e96af/fx8.jpg fx8 fx8.jpg jpg 10884 200 500 IMAGE-DOWNSAMPLED 1-s2.0-S1381116916304472-fx9.jpg https://s3.amazonaws.com/prod-ucs-content-store-us-east/content/pii:S1381116916304472/fx9/DOWNSAMPLED/image/jpeg/ecfdca965a761cd0b950b73943e9068e/fx9.jpg fx9 fx9.jpg jpg 8898 200 500 IMAGE-DOWNSAMPLED 1-s2.0-S1381116916304472-gr1.jpg https://s3.amazonaws.com/prod-ucs-content-store-us-east/content/pii:S1381116916304472/gr1/DOWNSAMPLED/image/jpeg/5bda207d3fe8267074325ef307e34b19/gr1.jpg gr1 gr1.jpg jpg 12910 116 565 IMAGE-DOWNSAMPLED 1-s2.0-S1381116916304472-gr10.jpg https://s3.amazonaws.com/prod-ucs-content-store-us-east/content/pii:S1381116916304472/gr10/DOWNSAMPLED/image/jpeg/9a7d03229ac4fb20aa6574bc6fcd3da8/gr10.jpg gr10 gr10.jpg jpg 53805 504 640 IMAGE-DOWNSAMPLED 1-s2.0-S1381116916304472-gr2.jpg https://s3.amazonaws.com/prod-ucs-content-store-us-east/content/pii:S1381116916304472/gr2/DOWNSAMPLED/image/jpeg/d4e99099153761ee3655881186d6320e/gr2.jpg gr2 gr2.jpg jpg 22883 240 376 IMAGE-DOWNSAMPLED 1-s2.0-S1381116916304472-gr3.jpg https://s3.amazonaws.com/prod-ucs-content-store-us-east/content/pii:S1381116916304472/gr3/DOWNSAMPLED/image/jpeg/ac3655ce08fd696929048288973db1a5/gr3.jpg gr3 gr3.jpg jpg 22242 232 376 IMAGE-DOWNSAMPLED 1-s2.0-S1381116916304472-gr4.jpg https://s3.amazonaws.com/prod-ucs-content-store-us-east/content/pii:S1381116916304472/gr4/DOWNSAMPLED/image/jpeg/54315d91074d48a72595a271373ca93c/gr4.jpg gr4 gr4.jpg jpg 39409 201 640 IMAGE-DOWNSAMPLED 1-s2.0-S1381116916304472-gr5.jpg https://s3.amazonaws.com/prod-ucs-content-store-us-east/content/pii:S1381116916304472/gr5/DOWNSAMPLED/image/jpeg/7b4d27657f5bb9bf1e065525e5b463e3/gr5.jpg gr5 gr5.jpg jpg 21892 287 376 IMAGE-DOWNSAMPLED 1-s2.0-S1381116916304472-gr6.jpg https://s3.amazonaws.com/prod-ucs-content-store-us-east/content/pii:S1381116916304472/gr6/DOWNSAMPLED/image/jpeg/344c799dfe1a2c557a69dcbda10b802d/gr6.jpg gr6 gr6.jpg jpg 21652 316 376 IMAGE-DOWNSAMPLED 1-s2.0-S1381116916304472-gr7.jpg https://s3.amazonaws.com/prod-ucs-content-store-us-east/content/pii:S1381116916304472/gr7/DOWNSAMPLED/image/jpeg/4bc3a28c1fb32fcb6ec67a11e06c3f1f/gr7.jpg gr7 gr7.jpg jpg 11593 165 320 IMAGE-DOWNSAMPLED 1-s2.0-S1381116916304472-gr8.jpg https://s3.amazonaws.com/prod-ucs-content-store-us-east/content/pii:S1381116916304472/gr8/DOWNSAMPLED/image/jpeg/f8f2116d1efc70109f06ac96eb9f0bb9/gr8.jpg gr8 gr8.jpg jpg 36132 184 602 IMAGE-DOWNSAMPLED 1-s2.0-S1381116916304472-gr9.jpg https://s3.amazonaws.com/prod-ucs-content-store-us-east/content/pii:S1381116916304472/gr9/DOWNSAMPLED/image/jpeg/1d25835bb57014c32e092d1862189131/gr9.jpg gr9 gr9.jpg jpg 20379 177 376 IMAGE-DOWNSAMPLED 1-s2.0-S1381116916304472-sc1.jpg https://s3.amazonaws.com/prod-ucs-content-store-us-east/content/pii:S1381116916304472/sc1/DOWNSAMPLED/image/jpeg/be9b1a6945fe090ac1877530cb517705/sc1.jpg sc1 sc1.jpg jpg 10974 197 320 IMAGE-DOWNSAMPLED 1-s2.0-S1381116916304472-sc2.jpg https://s3.amazonaws.com/prod-ucs-content-store-us-east/content/pii:S1381116916304472/sc2/DOWNSAMPLED/image/jpeg/b7d16f545b4d0fa18f234756a192bc5b/sc2.jpg sc2 sc2.jpg jpg 9894 116 376 IMAGE-DOWNSAMPLED 1-s2.0-S1381116916304472-sc3.jpg https://s3.amazonaws.com/prod-ucs-content-store-us-east/content/pii:S1381116916304472/sc3/DOWNSAMPLED/image/jpeg/509bd91a86daa757c902b8aa1f3811fb/sc3.jpg sc3 sc3.jpg jpg 6783 80 377 IMAGE-DOWNSAMPLED 1-s2.0-S1381116916304472-sc4.jpg https://s3.amazonaws.com/prod-ucs-content-store-us-east/content/pii:S1381116916304472/sc4/DOWNSAMPLED/image/jpeg/526123a5f6560bafae722fe54c0ff0f9/sc4.jpg sc4 sc4.jpg jpg 10585 93 527 IMAGE-DOWNSAMPLED 1-s2.0-S1381116916304472-sc5.jpg https://s3.amazonaws.com/prod-ucs-content-store-us-east/content/pii:S1381116916304472/sc5/DOWNSAMPLED/image/jpeg/5c91d6b61e3dba69c01da3f4c35b882d/sc5.jpg sc5 sc5.jpg jpg 12426 100 678 IMAGE-DOWNSAMPLED 1-s2.0-S1381116916304472-fx1_lrg.jpg https://s3.amazonaws.com/prod-ucs-content-store-us-east/content/pii:S1381116916304472/fx1/HIGHRES/image/jpeg/7de364fd13a435d2a1bd7f6840f40c56/fx1_lrg.jpg fx1 true fx1_lrg.jpg jpg 108181 886 2213 IMAGE-HIGH-RES 1-s2.0-S1381116916304472-fx10_lrg.jpg https://s3.amazonaws.com/prod-ucs-content-store-us-east/content/pii:S1381116916304472/fx10/HIGHRES/image/jpeg/7c6e15edfdd6e843d22ce87721fff74f/fx10_lrg.jpg fx10 fx10_lrg.jpg jpg 70685 886 2213 IMAGE-HIGH-RES 1-s2.0-S1381116916304472-fx11_lrg.jpg https://s3.amazonaws.com/prod-ucs-content-store-us-east/content/pii:S1381116916304472/fx11/HIGHRES/image/jpeg/e63e04f009ee0fc6dd7794e6d2476ca6/fx11_lrg.jpg fx11 fx11_lrg.jpg jpg 83435 886 2213 IMAGE-HIGH-RES 1-s2.0-S1381116916304472-fx12_lrg.jpg https://s3.amazonaws.com/prod-ucs-content-store-us-east/content/pii:S1381116916304472/fx12/HIGHRES/image/jpeg/fa316cdd81460874b6543d2ed0b59135/fx12_lrg.jpg fx12 fx12_lrg.jpg jpg 82207 886 2213 IMAGE-HIGH-RES 1-s2.0-S1381116916304472-fx13_lrg.jpg https://s3.amazonaws.com/prod-ucs-content-store-us-east/content/pii:S1381116916304472/fx13/HIGHRES/image/jpeg/fa5007918c9d714158332eb3951635e5/fx13_lrg.jpg fx13 fx13_lrg.jpg jpg 86468 886 2213 IMAGE-HIGH-RES 1-s2.0-S1381116916304472-fx14_lrg.jpg https://s3.amazonaws.com/prod-ucs-content-store-us-east/content/pii:S1381116916304472/fx14/HIGHRES/image/jpeg/018e98365266c53e5846fe952850fdd4/fx14_lrg.jpg fx14 fx14_lrg.jpg jpg 77615 886 2213 IMAGE-HIGH-RES 1-s2.0-S1381116916304472-fx15_lrg.jpg https://s3.amazonaws.com/prod-ucs-content-store-us-east/content/pii:S1381116916304472/fx15/HIGHRES/image/jpeg/36c8b4ac9648c9fcff0b6285f6b49595/fx15_lrg.jpg fx15 fx15_lrg.jpg jpg 88619 886 2213 IMAGE-HIGH-RES 1-s2.0-S1381116916304472-fx16_lrg.jpg https://s3.amazonaws.com/prod-ucs-content-store-us-east/content/pii:S1381116916304472/fx16/HIGHRES/image/jpeg/de6f51ac3b36cdca2460a4215faba56d/fx16_lrg.jpg fx16 fx16_lrg.jpg jpg 49283 886 2213 IMAGE-HIGH-RES 1-s2.0-S1381116916304472-fx17_lrg.jpg https://s3.amazonaws.com/prod-ucs-content-store-us-east/content/pii:S1381116916304472/fx17/HIGHRES/image/jpeg/5a1c750320937e787f10222b5b1f3199/fx17_lrg.jpg fx17 fx17_lrg.jpg jpg 68678 886 2213 IMAGE-HIGH-RES 1-s2.0-S1381116916304472-fx18_lrg.jpg https://s3.amazonaws.com/prod-ucs-content-store-us-east/content/pii:S1381116916304472/fx18/HIGHRES/image/jpeg/f7c7398b0a9ab40bcd1f8662f56f89eb/fx18_lrg.jpg fx18 fx18_lrg.jpg jpg 55748 886 2213 IMAGE-HIGH-RES 1-s2.0-S1381116916304472-fx19_lrg.jpg https://s3.amazonaws.com/prod-ucs-content-store-us-east/content/pii:S1381116916304472/fx19/HIGHRES/image/jpeg/1df503b43fe0554b7699c347c84ca225/fx19_lrg.jpg fx19 fx19_lrg.jpg jpg 55687 886 2213 IMAGE-HIGH-RES 1-s2.0-S1381116916304472-fx2_lrg.jpg https://s3.amazonaws.com/prod-ucs-content-store-us-east/content/pii:S1381116916304472/fx2/HIGHRES/image/jpeg/725d1d0e8e6161d9ff75cffbd9ffdb5b/fx2_lrg.jpg fx2 fx2_lrg.jpg jpg 62125 886 2213 IMAGE-HIGH-RES 1-s2.0-S1381116916304472-fx20_lrg.jpg https://s3.amazonaws.com/prod-ucs-content-store-us-east/content/pii:S1381116916304472/fx20/HIGHRES/image/jpeg/662873ee5c2f45c62248b2affad126a2/fx20_lrg.jpg fx20 fx20_lrg.jpg jpg 51856 886 2213 IMAGE-HIGH-RES 1-s2.0-S1381116916304472-fx21_lrg.jpg https://s3.amazonaws.com/prod-ucs-content-store-us-east/content/pii:S1381116916304472/fx21/HIGHRES/image/jpeg/1a97a6e17faed019f47a09152a72bbd7/fx21_lrg.jpg fx21 fx21_lrg.jpg jpg 60933 886 2213 IMAGE-HIGH-RES 1-s2.0-S1381116916304472-fx22_lrg.jpg https://s3.amazonaws.com/prod-ucs-content-store-us-east/content/pii:S1381116916304472/fx22/HIGHRES/image/jpeg/89d8090da83e7c6a41517508de0a4502/fx22_lrg.jpg fx22 fx22_lrg.jpg jpg 68685 886 2213 IMAGE-HIGH-RES 1-s2.0-S1381116916304472-fx23_lrg.jpg https://s3.amazonaws.com/prod-ucs-content-store-us-east/content/pii:S1381116916304472/fx23/HIGHRES/image/jpeg/eb55074861c6039bc5e67b6bc50c197d/fx23_lrg.jpg fx23 fx23_lrg.jpg jpg 66269 886 2213 IMAGE-HIGH-RES 1-s2.0-S1381116916304472-fx3_lrg.jpg https://s3.amazonaws.com/prod-ucs-content-store-us-east/content/pii:S1381116916304472/fx3/HIGHRES/image/jpeg/dee521284855fbb3775b5bda965a909a/fx3_lrg.jpg fx3 fx3_lrg.jpg jpg 62228 886 2213 IMAGE-HIGH-RES 1-s2.0-S1381116916304472-fx4_lrg.jpg https://s3.amazonaws.com/prod-ucs-content-store-us-east/content/pii:S1381116916304472/fx4/HIGHRES/image/jpeg/d04b709c60eaeb6f76ece13a9c2c65ed/fx4_lrg.jpg fx4 fx4_lrg.jpg jpg 56414 886 2213 IMAGE-HIGH-RES 1-s2.0-S1381116916304472-fx5_lrg.jpg https://s3.amazonaws.com/prod-ucs-content-store-us-east/content/pii:S1381116916304472/fx5/HIGHRES/image/jpeg/21e78095ddad4fb691c5eea06627272d/fx5_lrg.jpg fx5 fx5_lrg.jpg jpg 69476 886 2213 IMAGE-HIGH-RES 1-s2.0-S1381116916304472-fx6_lrg.jpg https://s3.amazonaws.com/prod-ucs-content-store-us-east/content/pii:S1381116916304472/fx6/HIGHRES/image/jpeg/872987b54d775805df00019a1b5d436b/fx6_lrg.jpg fx6 fx6_lrg.jpg jpg 64264 886 2213 IMAGE-HIGH-RES 1-s2.0-S1381116916304472-fx7_lrg.jpg https://s3.amazonaws.com/prod-ucs-content-store-us-east/content/pii:S1381116916304472/fx7/HIGHRES/image/jpeg/75a6353f0faad39004eac49de930e895/fx7_lrg.jpg fx7 fx7_lrg.jpg jpg 74288 886 2213 IMAGE-HIGH-RES 1-s2.0-S1381116916304472-fx8_lrg.jpg https://s3.amazonaws.com/prod-ucs-content-store-us-east/content/pii:S1381116916304472/fx8/HIGHRES/image/jpeg/db59c510db7961507e9ffcd0b8b3425d/fx8_lrg.jpg fx8 fx8_lrg.jpg jpg 75679 886 2213 IMAGE-HIGH-RES 1-s2.0-S1381116916304472-fx9_lrg.jpg https://s3.amazonaws.com/prod-ucs-content-store-us-east/content/pii:S1381116916304472/fx9/HIGHRES/image/jpeg/0f25f9a318520c87f785f6c069e8d279/fx9_lrg.jpg fx9 fx9_lrg.jpg jpg 64622 886 2213 IMAGE-HIGH-RES 1-s2.0-S1381116916304472-gr1_lrg.jpg https://s3.amazonaws.com/prod-ucs-content-store-us-east/content/pii:S1381116916304472/gr1/HIGHRES/image/jpeg/62181d79d842253a0150567f403c473c/gr1_lrg.jpg gr1 gr1_lrg.jpg jpg 83523 514 2500 IMAGE-HIGH-RES 1-s2.0-S1381116916304472-gr10_lrg.jpg https://s3.amazonaws.com/prod-ucs-content-store-us-east/content/pii:S1381116916304472/gr10/HIGHRES/image/jpeg/3dbb1315e177ec9d267d2a64e73c1e30/gr10_lrg.jpg gr10 gr10_lrg.jpg jpg 407848 2230 2834 IMAGE-HIGH-RES 1-s2.0-S1381116916304472-gr2_lrg.jpg https://s3.amazonaws.com/prod-ucs-content-store-us-east/content/pii:S1381116916304472/gr2/HIGHRES/image/jpeg/abdf82ea09ea83ca28f505d09611c161/gr2_lrg.jpg gr2 gr2_lrg.jpg jpg 187085 1063 1667 IMAGE-HIGH-RES 1-s2.0-S1381116916304472-gr3_lrg.jpg https://s3.amazonaws.com/prod-ucs-content-store-us-east/content/pii:S1381116916304472/gr3/HIGHRES/image/jpeg/d331a30f94aad7445572d0d993fb61cc/gr3_lrg.jpg gr3 gr3_lrg.jpg jpg 182840 1028 1667 IMAGE-HIGH-RES 1-s2.0-S1381116916304472-gr4_lrg.jpg https://s3.amazonaws.com/prod-ucs-content-store-us-east/content/pii:S1381116916304472/gr4/HIGHRES/image/jpeg/25f9b8b3882cf8bcfb25da2484d68818/gr4_lrg.jpg gr4 gr4_lrg.jpg jpg 569910 889 2833 IMAGE-HIGH-RES 1-s2.0-S1381116916304472-gr5_lrg.jpg https://s3.amazonaws.com/prod-ucs-content-store-us-east/content/pii:S1381116916304472/gr5/HIGHRES/image/jpeg/fb6f73307942cb89c7df74f7774a4103/gr5_lrg.jpg gr5 gr5_lrg.jpg jpg 169531 1272 1667 IMAGE-HIGH-RES 1-s2.0-S1381116916304472-gr6_lrg.jpg https://s3.amazonaws.com/prod-ucs-content-store-us-east/content/pii:S1381116916304472/gr6/HIGHRES/image/jpeg/691fd084e029e78faa2a95a98768526d/gr6_lrg.jpg gr6 gr6_lrg.jpg jpg 191406 1403 1667 IMAGE-HIGH-RES 1-s2.0-S1381116916304472-gr7_lrg.jpg https://s3.amazonaws.com/prod-ucs-content-store-us-east/content/pii:S1381116916304472/gr7/HIGHRES/image/jpeg/6191a839355b3b6bf32ce64142243b4e/gr7_lrg.jpg gr7 gr7_lrg.jpg jpg 71563 729 1417 IMAGE-HIGH-RES 1-s2.0-S1381116916304472-gr8_lrg.jpg https://s3.amazonaws.com/prod-ucs-content-store-us-east/content/pii:S1381116916304472/gr8/HIGHRES/image/jpeg/5dc65da3fdda0b84d93709b8615f10f9/gr8_lrg.jpg gr8 gr8_lrg.jpg jpg 556491 813 2667 IMAGE-HIGH-RES 1-s2.0-S1381116916304472-gr9_lrg.jpg https://s3.amazonaws.com/prod-ucs-content-store-us-east/content/pii:S1381116916304472/gr9/HIGHRES/image/jpeg/92655fa704d3bb873599cc54295436da/gr9_lrg.jpg gr9 gr9_lrg.jpg jpg 156125 784 1667 IMAGE-HIGH-RES 1-s2.0-S1381116916304472-sc1_lrg.jpg https://s3.amazonaws.com/prod-ucs-content-store-us-east/content/pii:S1381116916304472/sc1/HIGHRES/image/jpeg/cde0db1f69f13bff66904ce2ed0404a7/sc1_lrg.jpg sc1 sc1_lrg.jpg jpg 76043 872 1419 IMAGE-HIGH-RES 1-s2.0-S1381116916304472-sc2_lrg.jpg https://s3.amazonaws.com/prod-ucs-content-store-us-east/content/pii:S1381116916304472/sc2/HIGHRES/image/jpeg/617635e7441a1f7b3d1cda637f686ce3/sc2_lrg.jpg sc2 sc2_lrg.jpg jpg 80584 514 1667 IMAGE-HIGH-RES 1-s2.0-S1381116916304472-sc3_lrg.jpg https://s3.amazonaws.com/prod-ucs-content-store-us-east/content/pii:S1381116916304472/sc3/HIGHRES/image/jpeg/89e27555f2578cf4a75a5b726347dd8e/sc3_lrg.jpg sc3 sc3_lrg.jpg jpg 44842 354 1670 IMAGE-HIGH-RES 1-s2.0-S1381116916304472-sc4_lrg.jpg https://s3.amazonaws.com/prod-ucs-content-store-us-east/content/pii:S1381116916304472/sc4/HIGHRES/image/jpeg/f43b93f89cc61e2a60656e9e8b38fa62/sc4_lrg.jpg sc4 sc4_lrg.jpg jpg 73295 411 2335 IMAGE-HIGH-RES 1-s2.0-S1381116916304472-sc5_lrg.jpg https://s3.amazonaws.com/prod-ucs-content-store-us-east/content/pii:S1381116916304472/sc5/HIGHRES/image/jpeg/dc77a6a57baa56b71acff4325bd6aee9/sc5_lrg.jpg sc5 sc5_lrg.jpg jpg 87146 442 3002 IMAGE-HIGH-RES 1-s2.0-S1381116916304472-mmc1.docx https://s3.amazonaws.com/prod-ucs-content-store-us-east/content/pii:S1381116916304472/mmc1/MAIN/application/vnd.openxmlformats-officedocument.wordprocessingml.document/dfa19f9fed05a51ff6d6bd56a26627ed/mmc1.docx mmc1 mmc1.docx docx 1988172 APPLICATION MOLCAA 10087 S1381-1169(16)30447-2 10.1016/j.molcata.2016.10.025 Scheme 1 Numbering of C and H atoms in Ar2-BIAN ligands for interpretation of NMR spectra. Scheme 1 Scheme 2 Synthesis of complexes 1a − 3a. Scheme 2 Scheme 3 The model aminocarbonylation reaction. Scheme 3 Scheme 4 Aminocarbonylation reaction of aryl iodides with substituted anilines. Scheme 4 Scheme 5 The aminocarbonylation reaction of iodobenzene with aliphatic amines. Scheme 5 Fig. 1 The investigated Ar2-BIAN ligands 1–3. Fig. 1 Fig. 2 Molecular structure of 2a. Displacement ellipsoids are drawn at the 30% probability level and H atoms are shown as small spheres of arbitrary radii. For clarity, solvent molecules (chloroform and acetone) have been omitted. Selected bond lengths (Å) and angles (°): Pd–Cl1 2.2790(11), Pd–Cl2 2.2757(11), Pd–N1 2.033(3), Pd–N2 2.054(3), N1–C11 1.438(5), N2–C21 1.438(5), Cl1–Pd–Cl2 92.51(5), Cl1–Pd–N1 92.44(9), Cl1–Pd–N2 173.74(9), Cl2–Pd–N2 93.75(10), Cl2–Pd–N1 175.05(9), N1–Pd–N2 81.30(13). Fig. 2 Fig. 3 Molecular structure of 3a. Displacement ellipsoids are drawn at the 30% probability level and H atoms are shown as small spheres of arbitrary radii. For clarity, solvent molecules (chloroform) have been omitted. Selected bond lengths (Å) and angles (°): Pd–Cl1 2.2789(16), Pd–Cl2 2.2661(18), Pd–N1 2.039(5), Pd–N2 2.036(5), N1–C11 1.426(8), N2–C21 1.430(8), Cl1–Pd–Cl2 91.44(6), Cl1–Pd–N1 93.74(14), Cl1–Pd–N2 174.70(16), Cl2–Pd–N2 92.98(16), Cl2–Pd–N1 174.26(15), N1–Pd–N2 81.7(2). Fig. 3 Fig. 4 TEM images of Pd(0) NPs formed during the aminocarbonylation reaction with 2a and particle size distribution. Fig. 4 Fig. 5 X-ray diffraction pattern of Pd(0) nanoparticles obtained by reduction of 2a. Fig. 5 Fig. 6 XPS spectrum of Pd(0) nanoparticles obtained by reduction of 2a. Fig. 6 Fig. 7 Recycling of the 3a catalyst in aminocarbonylation of iodobenzene with aniline. Reaction conditions: see Table 1. Fig. 7 Fig. 8 TEM images of Pd(0) nanoparticles after five catalytic runs and particle size distribution. Fig. 8 Fig. 9 Aminocarbonylation reaction of iodobenzene at the presence of Hg(0). Reaction conditions see Table 2. Fig. 9 Fig. 10 Plausible reaction mechanism. Fig. 10 Table 1 Aminocarbonylation reaction of iodobenzene with aniline. a Table 1 Run Precatalyst Pre-treatment time (h) (r.t., PCO =1atm) Reaction time (h) Yield of benzanilide (%) b 1 1a – 1.5 50 2 2a – 1.5 54 3 3a – 1.5 55 4 1a – 4 89 5 2a – 4 92 6 3a – 4 94 7 [PdCl2(cod)] – 4 66 8 [PdCl2(cod)]+ 3 – 4 85 9 [PdCl2] – 4 43 10 [PdCl2]+ 3 – 4 75 11 3a – 1 38 12 3a 0.5 1 44 13 3a 3 1 56 a Reaction conditions: PhI (1mmol), aniline (2mmol), [Pd] 0.5 mol%, CO (1atm),K2CO3 (2mmol), water (5mL), 90°C. b Yield was determined by GC using mesitylene as internal standard. Table 2 Aminocarbonylation reaction of iodobenzene catalyzed by Pd-(Ar2-BIAN) −effect of Hg, CS2 and TBAB. a Table 2 Poison additive Yield of benzanilide (%) None 94 Hg added at the beginning of the reaction 24 Hg added after 60min 35 CS2, 0.65 mol% 77 CS2, 1 mol% 67 CS2, 1.5 mol% 62 TBAB, 5 mol% 89 TBAB, 10 mol% 77 TBAB, 15 mol% 66 a Reaction conditions: 90°C, 3a 0.5 mol%, PhI (1mmol), aniline (2mmol), CO (1atm),K2CO3 (2mmol), water 5mL, 4h, [Hg]/[Pd]=300. Table 3 Aminocarbonylation reaction of aryl iodides with substituted anilines. a,b Table 3 92% (84%) c 81%, (73%) c 98%, (90%) c 47%, (40%) c 53%, (45%) c 72%, (67%) c 86%, (80%) c 98%, (91%) c 74% (65%) d 60%, c 81% (73%) d 31%, c 46% (33%) d 70%, c 100% (88%) d 90% (80%) d 42%, c 58% (41%) d a 2a (0.5 mol%), K2CO3 (2mmol), water (5mL), aryl iodide (1mmol), substituted aniline (2mmol), CO (1atm), 90°C, 4h. b Conversions were determined by GC using mesitylene as internal standard. c 6h. d Isolated yield. Table 4 Results of aminocarbonylation of iodobenzene with aliphatic amines. a,b Table 4 Amine Entry Amount of amine [mmol] T [°C] Time [h] CO [atm] Conv. C6H5I [%] b Yield A [%] Yield B [%] Yield C [%] H2N(C6H13) 1 2 60 4 1 67 57 1 9 2 2 60 6 1 91 60 4 27 3 1.1 60 6 1 85 40 26 16 4 3 60 6 1 93 63 11 19 5 5 60 6 1 94 76 (64) c 3 15 6 1.1 60 6 10 80 29 36 (25) c 15 7 1.1 90 4 10 91 20 54 17 H2N(C4H9) 9 2 60 4 1 61 25 17 19 10 2 60 6 1 95 22 35 36 11 1.1 60 6 1 78 16 44 14 12 5 60 6 1 90 69 (56) c 3 18 13 1.1 60 6 10 74 8 54 (40) c 12 14 1.1 90 4 10 94 8 70 16 15 2 60 4 1 79 23 38 17 16 2 60 6 1 82 24 24 30 17 1.1 60 6 1 75 13 45 14 18 5 60 6 1 90 31 (19) c 7 52 19 1.1 60 6 10 70 9 50 (35) c 11 20 1.1 90 4 10 94 7 75 12 21 2 90 4 1 97 63 15 0 22 1.1 60 6 1 61 23 36 0 23 5 60 6 1 64 57 (43) c 7 0 24 1.1 60 6 10 81 11 70 (60) c 0 25 1.1 90 4 10 100 10 90 0 a Reaction conditions: 2a (0.5 mol%), PhI (1mmol), water (5mL),K2CO3 (2mmol). b Conversion was determined by GC using mesitylene as internal standard. c Isolated yield. Table 5 Results of aminocarbonylation of aryl iodides with aliphatic amines. a,b Table 5 Aryl iodide Amine Entry Amount of amine [mmol] T [°C] Time [h] CO [atm] Conv. C6H5I [%] b Yield A [%] Yield B [%] Yield C [%] 1 1.1 90 4 10 100 34 60 (45) c 6 2 5 60 6 1 58 53 (44) c 3 2 3 1.1 90 4 10 100 39 61 (48) c 0 4 5 60 6 1 53 51 (40) c 2 0 5 1.1 90 4 10 100 8 92 (80) c 0 6 5 60 6 1 47 32 (18) c 15 0 7 1.1 90 4 10 100 4 96 (85) c 0 8 5 60 6 1 42 12 30 0 a Reaction conditions: 2a (0.5 mol%), PhI (1mmol), water (5mL),K2CO3 (2mmol). b Conversion was determined by GC using mesitylene as internal standard. c Isolated yield. Editor's choice paper In situ generated Pd(0) nanoparticles stabilized by bis(aryl)acenaphthenequinone diimines as catalysts for aminocarbonylation reactions in water P. Wójcik a V. Rosar b A. Gniewek a B. Milani b ⁎ A.M. Trzeciak a ⁎ a Faculty of Chemistry, University of Wroclaw, 14 F. Joliot-Curie Str., 50-383 Wroclaw, Poland Faculty of Chemistry University of Wroclaw 14 F. Joliot-Curie Str. Wroclaw 50-383 Poland b Dipartimento di Scienze Chimiche e Farmaceutiche, Università di Trieste, Via Licio Giorgieri 1, 34127 Trieste, Italy Dipartimento di Scienze Chimiche e Farmaceutiche Università di Trieste Via Licio Giorgieri 1 Trieste 34127 Italy ⁎ Corresponding authors. Graphical abstract Aminocarbonylation of aryl iodides with aromatic and aliphatic amines, leading to formation of the corresponding amides, was efficiently carried out in water under 1atm of CO using palladium nanoparticles (Pd NPs) formed in situ from [PdCl2(Ar2-BIAN)] complexes. The role of Ar2-BIAN ligands in the stabilization of Pd NPs was evidenced. The nature of the catalytically active species was confirmed by poisoning experiments, which highlighted that the catalyst is actually in the form of Pd NPs rather than soluble palladium complexes. In the aminocarbonylation of iodobenzene with substituted anilines good yields of amides were obtained, although the activity was depleted by the presence of substituents in the ortho positions of the aniline. On the other hand, in the reaction with aliphatic amines α-ketoamides were formed in addition to the amides. The selectivity towards α-ketoamides was increased by increasing the CO pressure to 10atm, at equimolar amounts of PhI and amine. Pd NPs were successfully recovered after the catalytic reaction and recycled in five subsequent runs with only a marginal loss of activity after the fourth cycle. Keywords Palladium α-diimines Aminocarbonylation Aqueous medium α-ketoamides 1 Introduction Amides constitute an interesting structural motif that is often present in pharmaceuticals (Atorvastatin, Mosapride, Imatinib, Nitroxazepine) [1–3] as well as in biologically active compounds (Acetaminophen, Aniracetam, Methacetin) [4,5]. Amides are also important building blocks for the synthesis of numerous pesticides, color pigments and natural products [6]. Traditionally, amides can be prepared in reactions of amines with acyl chlorides or carboxylic acids according to the relatively environmentally harmful processes [7,8]. For these reasons, development of new, cheap and efficient methods of their synthesis is greatly expected. An alternative technique for the amide synthesis is based on the palladium-catalyzed direct aminocarbonylation. In this three-component reaction, an aryl halide, an amine and carbon monoxide react to form the corresponding amide in a single-step process [9,10]. The first aminocarbonylation reactions of aryl heterocyclic and vinylic halides with primary or secondary amines have been reported by Heck in 1974 [11]. Advantageously, all these substrates are inexpensive and easily available, and high yields of the amide are obtained under relatively mild conditions (up to 120°C and 1–15bar) [12]. Aminocarbonylation was efficiently catalyzed by a Bedford palladacycle and dppf (dppf=bis-1,1-(diphenylphosphino)ferrocene) [13] and palladium complexes with NHC (NHC=N-heterocyclic carbene) ligands [14]. Palladium NHC complex supported on polymer was employed for the aminocarbonylation of aryl iodides with primary and secondary amines in aqueous medium [15]. The one-pot diazotization/aminocarbonylation conversion of anilines to benzamides has been reported [16]. The palladium-catalyzed aminocarbonylation using aqueous ammonia in toluene has been developed [17]. Commercially available Pd/C has been successfully employed as catalyst for the synthesis of amides [18,19]. Recently, the palladium-catalyzed aminocarbonylation of 5-iodoindole and 7-iodoindole derivatives with various primary and secondary amines has been reported [20]. Kollár described efficient aminocarbonylation of iodoalkenes and iodoaromatic with primary and secondary amines, catalyzed by Pd(OAc)2 with addition of PPh3 [21–26]. The same catalytic system has been used in aminocarbonylation of iodoalkenes and iodobenzene with diethyl α-aminobenzyl-phosphonate [27] and aminoacid methyl esters in ionic liquids [28]. In the last decade palladium nanoparticles have found application as the catalysts of the aminocarbonylation reaction [29–32]. They have been stabilized with ionic liquid [29], immobilized on magnetic nanoparticles [30], supported on carbon nanotubes [31] or on polymers [32,33]. Pd nanoparticles supported on MOF-5 [34], or ZIF-8, [35] on mesocellular foam [36] or on binaphthyl [37] catalyzed aminocarbonylation according to the heterogeneous mechanism. Other heterogeneous catalysts, active in a double carbonylation of aryl iodides and amines to α-ketoamides, such as Pd/C with PPh3 [38] or palladium supported on silica [39,40] have also been presented. Palladium nanoparticles leached from a sulfur-modified Au-supported palladium material (SAPd) [41] and supported over functional polymers (Pd/CFP) [42] have been used. A double carbonylation has been performed with high yield using palladium nanoparticles generated in situ in polyethylene glycol [43]. Despite this development of the double carbonylation reaction, synthesis of α-ketoamides still needs improvement. Moreover, to the best of our knowledge, the employment of the palladium nanoparticles for the aminocarbonylation in water has not been reported yet [44–47]. Therefore, our studies focused on the development of a catalytic system suitable for the aminocarbonylation reactions based on palladium nanoparticles generated in situ in an aqueous medium. To achieve this purpose, we selected palladium complexes with Ar2-BIAN (Ar2-BIAN=bis(aryl)acenaphthenequinonediimine) ligands. It was expected that these bulky chelating ligands would be strong enough to efficiently stabilize Pd nanoparticles against agglomeration and thus prevent loss of catalytic activity. Palladium complexes with the Ar2-BIAN ligands have been tested with very good results in alkene-CO copolymerization [48,49], selective hydrogenation of alkynes to alkenes [50], synthesis of indoles from ortho-nitrostyrenes and CO, [51] Suzuki-Miyaura [52] and Heck [53] cross-coupling reactions. However, their application for the aminocarbonylation has not been studied up to now. For this investigation three Ar2-BIAN ligands have been selected: the reference compound derived from the simple aniline 1, and the two molecules obtained from the 2,6-dimethyl- and the 3,5-dimethyl aniline, 2 and 3, respectively (Fig. 1 ). 2 Experimental All chemicals were purchased commercially (Sigma Aldrich) and used without further purification. Ar2-BIAN ligands were synthesized according to literature procedures by condensation of acenaphthenequinone with the proper aniline [54–57]. 2.1 Synthesis of [PdCl2(Ar2-BIAN)], 1a - 3a All the complexes were synthesized by following a general procedure based on the reaction of [PdCl2(cod)] with the proper Ar2-BIAN ligand in a 1:1.1 ratio. Complexes 1a - 3a were obtained with yields ranging from 80 to 85%. As an example, the detailed synthesis for complex 3a is reported below (Scheme 1 ). Under the nitrogen atmosphere [PdCl2(cod)] (0.035g, 0.124mmol) was added to a solution of (3,5-(CH3)2C6H3)2-BIAN (0.050g, 0.130mmol) in CH3CN (10mL). The reaction mixture was stirred at room temperature for 3h and then concentrated to half of the volume under reduced pressure. Upon the addition of diethyl ether a red-orange solid precipitate was formed; the precipitate was filtered off, washed with hexane, diethyl ether and dried in vacuum. Yield 0.059g (82%). [PdCl2(1)], 1a.- Anal. Calc. for C24H16Cl2N2Pd (509.72): C 56.55, H 3.16, N 5.50. Found: C 56.85, H 3.14, N 5.54%. 1H NMR (500MHz, CDCl3): δ 8.10 (d, JH-H =8.2Hz, 2H, H5), 7.57 (t, JH-H =7.5Hz, 4H, H 15,17), 7.51 (t, JH-H =7.3Hz, 2H, H16), 7.47 (dd, JH-H =8.2Hz, 7.6Hz, 2H, H4), 7.40 (m, 4H, H 14,18), 6.79 (d, JH-H =7.2Hz, 2H, H3) 13C NMR (125MHz, CDCl3): δ 175.3, 147.5, 145.1, 132.6, 131.6, 129.7, 129.2, 129.1, 126.3, 125.0, 122.7. IR (cm−1, KBr): 1621 ν(CN), 348 ν(Pd-Cl). [PdCl2(2)], 2a.- Anal. Calc. for C28H24Cl2N2Pd (565.83): C 59.43, H 4.27, N 4.95. Found: C 59.85, H 4.24, N 4.98%. 1H NMR (500MHz, CD2Cl2): δ 8.17 (d, JH-H =8.3Hz, 2H, H5), 7.53 (dd, JH-H =8.2Hz, 7.4Hz, 2H, H4), 7.39 (t, JH-H =7.5Hz, 2H, H16), 7.30 (d, JH-H =7.5Hz, 4H, H 15,17), 6.64 (d, JH-H =7.3Hz, 2H, H3), 2.34 (s, 12H, Ar(CH3)2). 13C NMR (125MHz, CD2Cl2): δ 176.3, 148.0, 143.8, 133.3, 131.9, 130.2, 130.1, 129.3, 129.1, 125.8, 125.0, 18.7. IR (cm−1, KBr): 1603 ν(CN), 344 ν(Pd-Cl). [PdCl2(3)], 3a.- Anal. Calc. for C28H24Cl2N2Pd (565.83): C 59.43, H 4.27, N 4.95. Found: C 59.07, H 4.29, N 4.93%. 1H NMR (500MHz, CDCl3): δ 8.09 (d, JH-H =8.2Hz, 2H, H5), 7.49 (dd, JH-H =8.2Hz, 7.4Hz, 2H, H4), 7.11 (s, 2H, H16), 6.97 (s, 4H, H 14,18), 6.80 (d, JH-H =7.3Hz, 2H, H3), 2.39 (s, 12H, Ar(CH3)2). 13C NMR (125MHz, CDCl3): δ 175.0, 147.3, 145.2, 139.5, 132.3, 131.6, 130.8, 129.1, 126.3, 125.1, 120.0, 21.7. IR (cm−1, KBr): 1611 ν(CN), 346 ν(Pd-Cl). 2.2 Aminocarbonylation reaction A 50mL Schlenk flask was charged with iodobenzene (1mmol), amine (2mmol),K2CO3 (2mmol) and catalyst (5·10−3 mmol). Afterward, 5mL of distilled water were added. Under balloon pressure of CO, the reaction mixture was stirred at 90°C for 4h. Then, the Schlenk flask was cooled down and the organic products were extracted with 3 portions of 7mL of diethyl ether (3×15min with stirring) and analyzed by GC with mesitylene as the internal standard (0.076cm3, 0.546mmol). The corresponding amides were isolated by evaporation of the solvents and purification of the crude product by column chromatography on silica gel using hexane and diethyl ether mixture (1:1) as the eluent. 2.3 Procedure for catalyst recycling After the first run, the organic products were separated by extraction (diethyl ether). The aqueous phase containing other reagents was removed to the second vessel by using a stainless steel tube and only the palladium particles were left in the Schlenk flask. Next, the palladium particles were washed with diethyl ether and distilled water. After that, the Schlenk flask was charged again with iodobenzene (1mmol), amine (2mmol), K2CO3 (2mmol) and distilled water (5mL). Under balloon pressure of CO, the reaction mixture was stirred at 90°C for 4h. Then, the Schlenk flask was cooled down and the organic products were extracted with 3 portions of 7mL of diethyl ether or hexane (3×15min with stirring) and then analyzed by GC with mesitylene as the internal standard (0.076cm3, 0.546mmol). 2.4 Analysis of Pd(0) nanoparticles After the aminocarbonylation reaction of iodobenzene with aniline, the black palladium particles were observed in water and on its surface. The palladium particles were filtered and washed with distilled water, diethyl ether, dried in vacuum and analyzed by elemental analysis. Found: C 2.77, H 0.30, N 0.19%. Pd(0) nanoparticles for structural characterization were obtained by reduction of 2a in water under CO (1atm) at 90°C. Under the nitrogen atmosphere 2a (0.09g) and K2CO3 (0.111g) were added to water (5mL). Next, the flask was evacuated and CO was introduced from the balloon (1atm). The mixture was stirred under CO at 90°C for 24h. After that time, the flask was cooled down, the black precipitate was filtered off, dried and analyzed by XPS, XRD and SEM/EDS methods. 2.5 X-ray structure determination Single crystals of 2a and 3a suitable for X-ray measurements were obtained by slow evaporation of CDCl3 solution. The single crystals were mounted on glass fibers and the diffraction data collected on a KM-4 CCD diffractometer with graphite monochromated Mo-Ka radiation (λ=0.71073Å). The structures were subsequently solved using direct methods and developed by full least-squares refinement on F2. Structural solution and refinement were carried out using SHELX suite of programs [58]. Analytical absorption corrections were performed with CrysAlis RED [59]. C, N, O, Cl and Pd atoms were refined anisotropically. All H atoms were positioned geometrically and refined isotropically using a riding model with a common fixed isotropic thermal parameter. The molecular structure plots were prepared using ORTEP-3 program [60]. The supplementary crystallographic data for this paper can be obtained from The Cambridge Crystallographic Data Centre via www.ccdc.cam.ac.uk/data_request/cif. CCDC reference codes: 1474030 for 2a and 1474031 for 3a. 3 Results and discussion 3.1 Synthesis and X-ray structure of [PdCl2(Ar2-BIAN)] complexes The three palladium complexes of the general formula [PdCl2(Ar2-BIAN)], 1a − 3a, were obtained by substitution of the weakly coordinated 1,5-cis,cis-cyclooctadiene (cod) of the precursor [PdCl2(cod)] in CH3CN solution, at room temperature, with the desired Ar2-BIAN (Scheme 2 ). Two of these compounds were synthesized earlier by a similar procedure [61,62]. The presence of the Ar2-BIAN ligands in the palladium coordination sphere was confirmed by 1H and 13C NMR spectroscopy. Single crystal X-ray analysis revealed that in 2a and 3a (Figs. 2 and 3 , respectively) palladium is coordinated in distorted square-planar geometry (selected bond lengths and angles are reported in the caption of the figures). The N1–C11 and N2–C21 bond lengths in 2a are slightly longer than the corresponding distances in 3a. The plane defined by atoms: N1, C11–C18 and N2, C21–C28 is perpendicular to the palladium coordination plane in 2a, while in 3a this dihedral angle is about 80°. 3.2 Catalytic activity of the palladium complexes, 1a − 3a, in the aminocarbonylation reaction The obtained palladium complexes, 1a − 3a were tested as the catalysts in the aminocarbonylation reaction of iodobenzene with aniline, under the optimized reaction conditions (Scheme 3 , Table 1 ). In all cases, the substrates were converted into the desired benzanilide, while no side products were observed, thus the yield of benzanilide corresponds to the conversion of the substrates. The catalytic activity of the three palladium complexes with the Ar2-BIAN ligands, differed only slightly and the yield of benzanilide varied from 50 to 55% after 1.5h and values of 89 to 94% were obtained when prolonging the reaction time up to 4h, with the catalyst 3a leading to the best results at both reaction times (Table 1, runs 1 − 6). On the other hand, when [PdCl2(cod)] was applied, the activity was significantly lower, with the yield of benzanilide only 66%. However, upon addition of a ligand to the palladium precursor the yield of benzanilide increased to 85% (Table 1, runs 7 and 8). Even stronger effect of the ligand was observed when PdCl2 was used. In this case, the yield of benzanilide increased from 43 to 75% after introduction of the ligand (Table 1, runs 9 and 10), thus indicating its very positive role on the catalytic activity of the system. It is straightforward to note that the application of the pre-synthesized complexes led to the best results, when compared to the in situ formed system. Two more experiments were carried out in order to evaluate the effect of precatalyst pre-treatment with CO for 0.5 and 3h before running the catalytic reaction (Table 1, runs 11 − 13). In both cases, the conversion increased and longer pre-treatment resulted in higher yields. This trend suggested that the catalytically active species were formed at the presence of CO and longer exposure resulted in more efficient activation of the precatalyst. 3.3 TEM experiment During the aminocarbonylation reaction, the color of the solution changed from orange, characteristic to the precatalysts, to gray-black, suggesting reduction of Pd(II) to Pd(0). In order to confirm this hypothesis, the post-catalytic reaction mixture was analyzed by TEM. The collected images confirmed that Pd(0) NPs with an average diameter of ca. 7nm were formed (Fig. 4 ). Black Pd(0) particles were also observed on the surface of the aqueous phase during extraction of the products. These particles were collected by filtration, washed with water, diethyl ether and dried under vacuum. Elemental analysis of this residue evidenced the presence of carbon (2.77%), hydrogen (0.30%) and nitrogen (0.19%), indicating the presence of an organic material along with palladium. These results suggest that during the catalytic reaction, the formed Pd(0) NPs are surrounded by Ar2-BIAN ligand, which plays an important role as a stabilizing agent preventing their agglomeration. 3.4 Characterization of palladium nanoparticles In order to get deeper knowledge about Pd(0) nanoparticles formed from [PdCl2(Ar2-BIAN)] complexes, reduction of 2a was performed under the CO atmosphere in aqueous solution containing K2CO3. The phase composition of the obtained precipitate was determined by X-ray powder diffraction (XRD). A typical diffractogram reveals several characteristic well-defined peaks (Fig. 5 ), which are attributed to Pd(0) crystallizing in Fm3m space group (JCPDS card number 5–681). Broadening of the diffraction lines confirms nanocrystalline nature of the material. According to the XPS analysis the sample contained only Pd(0), which was evidenced by the presence of signals at 335.3eV (Pd 3d5/2) and 340.6eV (Pd 3d3/2) (Fig. 6 ). The XPS spectrum of 2a measured for the comparison showed signals typical for Pd(II) at 338.0eV and 343.3eV. Interestingly, when the amount of K2CO3 was decreased by three times, the reduction was not complete and 66% of Pd(0) was found. EDS studies undertaken along with the SEM measurements enabled to estimate the distribution of the elements on the Pd(0) nanoparticles surface. Interestingly, in all points nitrogen was found in amounts higher than 6 atom% indicating the presence of Ar2-BIAN ligand. Analysis of the chloride content evidenced its presence only in few points in amounts of 0.62–3.09 atom%, considerably smaller than palladium (1.68–23.06 atom%). As expected, chlorides were removed during formation of the Pd NPs. 3.5 Recycling of palladium catalyst In order to estimate the stability of the Pd nanoparticles formed from 3a during the catalytic reaction, attempts of their recycling have been undertaken. To achieve this aim, the aminocarbonylation reaction was carried out with 3a, yielding 90% of benzanilide. The organic products were extracted with diethyl ether and the organic phase was separated from the aqueous phase. The Pd nanoparticles were observed as suspended in the aqueous phase. Water was then transferred to another flask by using a stainless steel tube (catheter tubing). Next, fresh reactants and the solvent were added to the Pd nanoparticles left in the Schlenk flask and the reaction was carried out again for 4h. This process was repeated 4 times with unexpectedly high efficiency of the catalytic system in each run, with the yield of the desired product always higher than 90%, and the highest value of 98% achieved at the first recycling test. In the fifth run, the activity slightly decreased, although still 86% of benzanilide was formed (Fig. 7 ). It should be pointed out that these results were obtained without any additional stabilizing agent. The TEM analysis of the palladium residue recovered at the end of this experiment evidenced non-agglomerated Pd nanoparticles of the average diameter of 5nm, slightly smaller as compared to the first catalytic run (Fig. 8 ). 3.6 Poisoning tests With the aim to determine whether the Pd nanoparticles are responsible for the catalytic reaction, the mercury test was performed [63–66]. According to the literature, the addition of Hg(0) to the reaction mixture should result in retarding of the catalytic process due to the formation of inactive Pd/Hg amalgam. On the other hand, when soluble palladium species are involved in the catalytic process, the catalytic activity should not be effected by the addition of Hg(0). For the studied reaction, two mercury tests were carried out, differing in the time when Hg(0) was added. When Hg(0) was added to the catalytic system together with the substrates, the conversion of iodobenzene was as low as 24%, while when Hg(0) was added after 60min from the beginning of the catalytic run, the reaction stopped at 35% conversion of iodobenzene (Table 2 , Fig. 9 ). Therefore, it is reasonable to conclude that in this reaction palladium nanoparticles are involved in the catalytic process taking place on their surface. Similar heterogeneous mechanism of the aminocarbonylation was suggested for the system based on Pd nanoparticles immobilized on MOF-5, [34] or ZIF-8, [35] on mesocellular foam [36] and binaphthyl-supported [37]. An additional indication of the heterogeneous reaction pathway was obtained from the studies of the solution activity after the separation of the Pd nanoparticles. Thus, the catalytic reaction with 2a was stopped after 1.5h and the catalyst was removed by filtration. The remaining liquid phase was re-heated under CO (1atm) for 4h at 90°C. After that time the GC analysis showed 60% conversion of iodobenzene, which corresponds to the yield of benzanilide. The obtained yield was comparable to that obtained after 1.5h (54%, Table 1) and significantly lower than that noted after 4h (92%, Table 1) of the catalytic reaction. Although recently a new protocol based on a quantitative partial poisoning with tetramethylthiourea has been introduced to distinguish between well-defined molecular and nanoparticle-based catalysts [67], in addition to the mercury test we applied the standard method based on the use of CS2 poison [64]. Thus, the decrease of the yield of benzanilide at the presence of CS2 indicated on the limited access of the substrates to the palladium surface covered by CS2. Next, the effect of TBAB (tetrabutylammonium bromide) on the reaction course was studied. It can be expected that stabilization of Pd nanoparticles would increase at the presence of ammonium salt, resulting in the reactivity increase [68]. However, another effect should also be considered, namely intensive dissolution of Pd NPs while heating with PhI at the presence of TBAB [69]. Thus, we decided to test the effect of TBAB by adding it to the reaction mixture in 10- to 30-fold excess with respect to palladium. As a result, the yield of benzanilide decreased (Table 2). Considering the fact that formation of the soluble palladium species was very plausible under the applied conditions, it can be concluded that their activity was remarkably lower than that of Pd NPs. Interestingly, in a similar reaction, such as carbonylative Suzuki coupling, soluble palladium species that leached from the Pd nanoparticles during the catalytic process were considered to be catalytically active [70,71]. 3.7 Aminocarbonylation reactions of iodobenzene with substituted anilines The scope of the reaction was expanded by using substituted anilines (Scheme 4 ) under the optimized reaction conditions and using 2a as the precatalyst (Table 3 ). It is worth to note that in these reactions only one kind of product (secondary amide) was obtained, thus indicating that even with substituted anilines or substituted iodobenzenes the catalyst is extremely selective. On the other hand, a remarkable effect of the substituents of the aniline on the activity of the catalyst was observed. The best results were obtained with the 2,5-dichloroaniline and 4-acetylaniline, which led to almost complete conversion to the corresponding benzanilides. For all the other substrates conversions lower than that of the simple aniline were observed. Indeed, the presence of either electron withdrawing or electron repulsing substituents in para position resulted in a decrease of the activity. That was even more pronounced when the substituents were in ortho position. These data suggest that both the electronic and steric effect remarkably affect in a negative way the activity of the catalyst. An effect of the substituents of the iodobenzene was also noted. The presence of electron withdrawing group (1-iodo-4-nitrobenzene) in para position led to lower conversion than that obtained for electron repulsing substituents (4-iodoanisole and 4-iodotoluene). On the other hand, methoxy substituent in ortho position increased conversion to the corresponding benzanilide compared to methoxy substituent in para position. Very good result, 90% conversion to the corresponding benzanilide, was obtained for 2-iodothiophene. 3.8 Aminocarbonylation reactions of iodobenzene with aliphatic amines As far as aliphatic amines are concerned, it is well known that with these substrates the aminocarbonylation is less selective than with aromatic ones [72]. Except the expected amide, α-ketoamide and α-iminoamide may also be formed in these reactions (Scheme 5 ). Various additives have been used to improve the selectivity and very good results have been obtained when DBU (1,8-diazabicyclo[5.4.0]undec-7-ene) was used [73,74]. We decided to test our catalytic system in the aminocarbonylation reaction of four aliphatic amines without any additional agents (Table 4 ). Initially, the catalytic reactions were run for 4h leading to moderate conversions which increased to more than 90% with prolonging the reaction time up to 6h. The obtained data indicated that the reaction selectivity into the specified product was influenced mainly by the [RNH2]/[PhI] ratio. In general, an increase of the amine amount favored formation of the amide, while at lower concentration of the amine, [RNH2]/[PhI]=1/1, the yield of α-ketoamide was higher. On increasing the CO pressure from 1 to 10atm a remarkable decrease in the selectivity into amide in favor of the double carbonylated adduct, the α-ketoamide, was observed. Further improvement of the yield of α-ketoamide was achieved after temperature increase to 90°C. Under these conditions 90% of α-ketoamide was formed in the reaction with benzylamine (Table 4, entry 25). In the reactions with n-hexylamine the amount of the amide increased from 40 to 76% when [RNH2]/[PhI] ratio was changed from 1.1 to 5 (Table 4, entry 3 and 5). The highest yield of the α-ketoamide, 54%, was obtained at 10atm of CO and 90°C (Table 4, entry 7). Similarly reacted n-butylamine, which formed 69% of the amide at a 5-fold excess of the amine to PhI (Table 4, entry 12). On the other hand, formation of the α-ketoamide was preferred at [RNH2]/[PhI] ratio equal to 1.1, enabling to obtain 44% of this product at 1atm of CO (Table 4, entry 11) and 70% at 10atm of CO and 90°C (Table 4, entry 14). The reaction with cyclohexylamine was less selective and the highest yield of the amide was 31% (Table 4, entry 18), whereas 50% of the α-ketoamide was obtained after using CO at the pressure of 10atm at 60°C (Table 4, entry 19). At 90°C the yield of α-ketoamide increased to 75% (Table 4, entry 20). In all these reactions the high basicity of the amine (pKb =3.31–3.43) facilitated formation of the α-iminoamide side-product in amount between 11 and 56%. In contrast, less basic benzylamine (pKb =4.94) provided more selective reaction conditions, without formation of the α-iminoamide. At the [RNH2]/[PhI] ratio equal to 2 the reaction produced 63% of the amide (Table 4, entry 21). The best conditions for the α-ketoamide were found with equimolar amounts of the amine and PhI employed at 10atm of CO (Table 4, entry 24 and 25). In further studies the aminocarbonylation reaction of three iodoaromatic substrates with aliphatic amines under conditions optimized for iodobenzene were performed (Table 5 ). 2-Iodothiophene reacted with cyclohexylamine forming 60% α-ketoamide at 10atm of CO and 90°C (Table 5, entry 1). At 1atm of CO amide was predominantly formed with the yield 53% (Table 5, entry 2). In this reactions a small amount of α-iminoamide was also formed. Similar yield of α-ketoamide (61%) and amide (51%) were obtained in aminocarbonylation of 2-iodothiophene with less basic benzylamine (Table 5, entry 3 and 4). In these reactions side-product was not found. Very good selectivity to α-ketoamide was noted in reactions of 4-iodotoluene and 4-iodoanisole with benzylamine at 10atm of CO (Table 5, entry 5 and 7). The corresponding α-ketoamides were obtained in amount 92% and 96%, slightly higher when compare with iodobenzene. On decreasing of the CO pressure from 10atm to 1atm the yield of amides increased for both substrates to 32% and 12% (Table 5, entry 6 and 8). Interestingly, 4-iodoanisole reacted mainly to the α-ketoamide even at 1atm of CO and 60°C. 3.9 Plausible mechanism of aminocarbonylation Considering the results of the performed poisoning tests and composition of the obtained products, a plausible mechanism for the studied reaction can be proposed (Fig. 10 ). Initially, the Pd(II) precursor is converted in situ into Pd-(Ar2-BIAN) nanoparticles that is the catalytically active form. Subsequent steps of the reaction occur on the surface of Pd-(Ar2-BIAN) NPs and are similar to those proposed in the literature [74,75]. Thus, oxidative addition of iodobenzene followed by migratory insertion of CO lead to the acyl intermediate 2. Nucleophilic attack of the amine on the acyl ligand results in formation of the amide (pathway 1). Alternatively, the amine coordinates to the intermediate 2, which is transformed into the acyl-amide intermediate 4 at the presence of CO (pathway 2). Formation of the CC bond on the species 4 followed by reductive elimination leads to the dicarbonylation product, α-ketoamide. Preference of the pathway 1 over 2 is determined by the basicity of the used amine. Less basic, aromatic amines, reacted exclusively according to pathway 1, while increased basicity of amine favored the dicarbonylation pathway 2. The intermediate 4 can also react with a second molecule of the amine by its nucleophilic attack on the acyl group. In this case, the side product, α-iminoamide is formed. Formation of this product is preferred for strong Lewis bases, such as cyclohexylamine. 4 Conclusions In summary, we have developed novel nanosized palladium catalysts for the aminocarbonylation of iodobenzene with either aromatic or aliphatic amines in aqueos medium. The catalysts, formed in situ from [PdCl2(Ar2-BIAN)] complexes, comprises of the Pd(0) nanoparticles stabilized with Ar2-BIAN ligands. They can be easily recovered and reused in several catalytic runs with high activity. In reaction with aromatic amines, amides were formed as the only products. In contrast, in the reaction with aliphatic amines, α-ketoamides were also formed. The yield of α-ketoamides increased at lower concentration of the amine and at higher CO pressure (10atm). The carbonylation reactions of iodobenzene with aromatic amines studied by us proceed under milder conditions than the aminocarbonylation reactions in water presented so far in the literature [15,50–52]. For example, according to the previous papers, benzanilide has been obtained in 8h at 2–14atm of CO and with the amount of the catalyst 1–2mol%. The aminocarbonylation reactions catalyzed by the commercially available catalyst Pd/C also required more harsh conditions than applied by us. In the reactions catalyzed by Pd/C the authors used higher amounts of the catalyst (minimum 2mol%), CO pressure higher than 1atm and the temperature in the range 100–140°C [18,19]. Our catalytic system works efficiently under more attractive reaction conditions. Advantageously, the reaction conditions used by us for the double carbonylation are more attractive than those reported till now for this process. Our reactions were performed in 4h whereas in most cases longer time, 8–24h [14,38,41,42,47,76,77] was needed to reach the high conversion. The CO pressure equal 10atm was significantly lower than used by other authors (20–40atm) [14,38–40,42,47,73,78]. Finally, the amount of the catalyst, 0.5mol%, was smaller than in other systems [38–40,42,73,77]. Acknowledgements Financial support of National Science Centre (NCN, Poland) with grant 2014/15/B/ST5/02101 (P.W., A.G., A.M.T.) is gratefully acknowledged. Authors would like to thank to Dr Wlodzimierz Tylus (Wrocław University of Technology) for performing of XPS measurements and Dr Wojciech Gil (Faculty of Chemistry, University of Wrocław) for SEM/EDS and TEM analyses. This work was carried out in the framework of COST Action CM1205 – CARISMA. BM and VR wish to thank Università degli Studi di Trieste - Finanziamento di Ateneo per progetti di ricerca scientifica - FRA2015. Appendix A Supplementary data Supplementary data associated with this article can be found, in the online version, at http://dx.doi.org/10.1016/j.molcata.2016.10.025. Appendix A Supplementary data The following is Supplementary data to this article: References [1] A. Brennführer H. Neumann M. Beller Angew. Chem. Int. Ed. 48 2009 4114 4133 [2] B.A. Dara N. Pandey S. Singh P. Kumar M. Farooquic B. Singh Green Chem. Lett. Rev. 8 2015 1 8 [3] C. Shen H. Neumann X.-F. Wu Green Chem. 17 2015 2994 2999 [4] F.M. Moghaddam G. Tavakoli A. Moafi V. Saberi H.R. Rezvani ChemCatChem 6 2014 3474 3481 [5] H. Li K. Dong H. Neumann M. Beller Angew. Chem. Int. Ed. 54 2015 10239 10243 [6] S.H. Cho J.Y. Kim J. Kwak S. Chang Chem. Soc. Rev. 40 2011 5068 5083 [7] E. Valeur M. Bradley Chem. Soc. Rev. 38 2009 606 631 [8] C.A.G.N. Montalbetti V. Falque Tetrahedron 61 2005 10827 10852 [9] M. Beller B. Cornils C.D. Frohning C.W. Kohlpaintner J. Mol. Catal. A: Chem. 104 1995 17 85 [10] R. Grigg S.P. Mutton Tetrahedron 66 2010 5515 5548 [11] A. Schoenberg R.F. Heck J. Org. Chem. 39 1974 3327 3331 [12] S.T. Gadge B.M. Bhanage RSC Adv. 4 2014 10367 10389 [13] I.J.S. Fairlamb S. Grant P. McCormack J. Whittall Dalton Trans. 2007 859 865 [14] C. Zhang J. Liu C. Xia Org. Biomol. Chem. 12 2014 9702 9706 [15] Z.S. Qureshi S.A. Revankar M.V. Khedkar B.M. Bhanage Catal. Today. 198 2012 148 153 [16] X.-F. Wu J. Schranck H. Neumann M. Beller Tetrahedron Lett. 52 2011 3702 3704 [17] T. Xu H. Alper Tetrahedron Lett. 54 2013 5496 5499 [18] J. Salvadori E. Balducci S. Zaza E. Petricci M. Taddei J. Org. Chem. 75 2010 1841 1847 [19] M.V. Khedkar S.R. Khan D.N. Sawant D.B. Bagal B.M. Bhanage Adv. Synth. Catal. 353 2011 3415 3422 [20] A. Takács D. Marosvölgyi-Haskó Z. Kobak-Solt L. Damas F.M.S. Rodrigues R.M.B. Carrilho M. Pineiro M.M. Pereira L. Kollár Tetrahedron 72 2016 247 256 [21] M. Gergely R. Farkas A. Takács A. Petz L. Kollár Tetrahedron 70 2014 218 224 [22] L. Horváth A. Petz L. Kollár Lett. Org. Chem. 7 2010 54 60 [23] A. Takács A. Petz L. Kollár Tetrahedron 66 2010 4479 4483 [24] A. Takács R. Farkas A. Petz L. Kollár Tetrahedron 65 2009 4795 4800 [25] A. Takács R. Farkas L. Kollár Tetrahedron 64 2008 61 66 [26] A. Takács Z. Kobak-Solt G. Mikle L. Kollár Monatsh. Chem. 145 2014 1473 1478 [27] A. Takács A. Petz L. Kollár Tetrahedron 64 2008 8726 8730 [28] E. Müller G. Péczezy R. Skoda-Földes E. Takács G. Kokotos E. Bellis L. Kollár Tetrahedron 61 2005 797 802 [29] Y. Zhu L. Chuanzhao A.O. Biying M. Sudarmadji A. Chen D.T. Tuan A.M. Seayad Dalton Trans. 40 2011 9320 9325 [30] B. Dutta S. Omar S. Natour R. Abu-Reziq Catal. Commun. 61 2015 31 36 [31] A.O. Biying K.T. Yuanting N.S. Hosmane Z. Yinghuai J. Organomet. Chem. 747 2013 184 188 [32] A.V. Prasad A.O. Biying W.Y. Ling L.P. Stubbs Y. Zhu J. Polym. Sci. Part A: Polym. Chem. 51 2013 4167 4174 [33] B. Chen F. Li Z. Huang T. Lu G. Yuan App. Catal. A 500 2015 23 29 [34] T.T. Dang Y. Zhu S.C. Ghosh A. Chen C.L.L. Chai A.M. Seayad Chem. Commun. 48 2012 1805 1807 [35] T.T. Dang Y. Zhu J.S.Y. Ngiam S.C. Ghosh A. Chen A.M. Seayad ACS Catal. 3 2013 1406 1410 [36] F. Tinnis O. Verho K.P.J. Gustafson C.-W. Tai J.-E. Bäckvall H. Adolfsson Chem. Eur. J. 20 2014 5885 5889 [37] N. Sharma G. Sekar Adv. Synth. Catal. 358 2016 314 320 [38] J. Liu S. Zheng W. Sun Ch. Xia Chin. J. Chem. 27 2009 623 627 [39] M. Genelot N. Villandier A. Bendjeriou P. Jaithong L. Djakovitch V. Dufaudz Catal. Sci. Technol. 2 2012 1886 1893 [40] M. Papp R. Skoda-Földes J. Mol. Catal. A Chem. 378 2013 193 199 [41] N. Saito T. Taniguchi N. Hoshiya S. Shuto M. Arisawa Y. Sato Green Chem. 17 2015 2358 2361 [42] B. Chen F. Li Z. Huang T. Lu G. Yuan Appl. Catal. A 481 2014 54 61 [43] H. Du Q. Ruan M. Qi W. Han J. Org. Chem. 80 2015 7816 7823 [44] X. Gong P.W. Miller A.D. Gee N.J. Long A.J. de Mello R. Vilar Chem. Eur. J. 18 2012 2768 2772 [45] P.J. Tambade Y.P. Patil Z.S. Qureshi K.P. Dhake B.M. Bhanage Synth. Commun. 42 2012 176 185 [46] Y. Wang X. Yang Ch. Zhang J. Yu J. Liu Ch. Xia Adv. Synth. Catal. 356 2014 2539 2546 [47] J.H. Groen J.G.P. Delis P.W.N.M. van Leeuwen K. Vrieze Organometallics 16 1997 68 77 [48] A. Scarel M.R. Axet F. Amoroso F. Ragaini C.J. Elsevier A. Holuigue C. Carfagna L. Mosca B. Milani Organometallics 27 2008 1486 1494 [49] M.W. van Laren C.J. Elsevier Angew. Chem. Int. Ed. 38 1999 3715 3717 [50] S. Cenini E. Bettetini M. Fedele S. Tollari J. Mol. Catal. 111 1996 37 41 [51] G.A. Grasa A.C. Hillier S.P. Nolan Org. Lett. 3 2001 1077 1080 [52] A.L. Gottumukkala J.F. Teichert D. Heijnen N. Eisink S. van Dijk C. Ferrer A. van den Hoogenband A.J. Minnaard J. Org. Chem. 76 2011 3498 3501 [53] R. Van Asselt C.J. Elsevier W.J.J. Smeets A.L. Spek R. Benedix Recl. Trav. Chim. Pays-Bas 113 1994 88 98 [54] M. Gasperini F. Ragaini S. Cenini Organometallics 21 2002 2950 2957 [55] M. Gasperini F. Ragaini Organometallics 23 2004 995 1001 [56] A.M. Kluwer T.S. Koblenz T. Jonischkeit K. Woelk C.J. Elsevier J. Am. Chem. Soc. 127 2005 15470 15480 [57] M. Gasperini F. Ragaini E. Gazzola A. Caselli P. Macchi Dalton Trans. 2004 3376 3382 [58] G.M. Sheldrick Acta Crystallogr. Sect. A 64 2008 112 122 [59] Oxford Diffraction CrysAlis RED Version 1.171.33.55 2008 Oxford Diffraction Ltd Wrocław, Poland [60] L.J. Farrugia J. Appl. Cryst. 30 1997 565 [61] L.H. Shultz M. Brookhart Organometallics 20 2001 3975 3982 [62] R. van Asselt C.J. Elsevier Ch. Amatore A. Jutand Organometallics 16 1997 317 328 [63] F. Fernandez B. Cordero J. Durand G. Muller F. Malbose Y. Kihn E. Teuma M. Gomez Dalton Trans. 2007 5572 5581 [64] N.T.S. Phan M. van Der Sluys Ch.W. Jones Adv. Synth. Catal. 348 2006 609 680 [65] S. Perdiau S. Harder H.J. Heeres J.G. de Vries ChemSusChem 5 2012 2427 2434 [66] J.A. Widergen R.F. Finke J. Mol. Catal. A: Chem. 198 2003 317 341 [67] R.M. Drost V. Rosar S.D. Marta M. Lutz N. Demitri B. Milani B. de Bruin C.J. Elsevier ChemCatChem 7 2015 2095 2107 [68] M.T. Reetz E. Westermann Angew. Chem. Int. Ed. 39 2000 165 168 [69] A. Gniewek A.M. Trzeciak J.J. Ziółkowski L. Kępiński J. Wrzyszcz W. Tylus J. Catal. 229 2005 332 343 [70] N. Jiao Z. Li Y. Wang J. Liu C. Xia RSC Adv. 5 2015 26913 26922 [71] Q. Zhou S. Wei W. Han J. Org. Chem. 79 2014 1454 1460 [72] J. Balogh A. Kuik L. Urge F. Darvas J. Bakos R. Skoda-Foldes J. Mol. Catal. A: Chem. 302 2009 76 79 [73] V. de la Fuente C. Godard E. Zangrando C. Claver S. Castillon Chem. Commun. 48 2012 1695 1697 [74] V.M. Fernandez-Alvarez V. de la Fuente C. Godard S. Castillon C. Claver F. Maseras J.J. Carbo J. Chem Eur 20 2014 10982 10989 [75] Y. Uozumi T. Arii T. Watanabe J. Org. Chem. 66 2001 5272 5274 [76] N. Tsukada Y. Ohba Y. Inoue J. Organomet. Chem. 687 2003 436 444 [77] B. Urbán M. Papp D. Srankó R. Skoda-Földes J. Mol. Catal. A Chem. 397 2015 150 157 [78] S. Zheng Y. Wang Ch. Zhang J. Liu Ch. Xia Appl. Organomet. Chem. 28 2014 48 53",
      "scopus-id": "84999106928",
      "coredata": {
        "eid": "1-s2.0-S1381116916304472",
        "dc:description": "Aminocarbonylation of aryl iodides with aromatic and aliphatic amines, leading to formation of the corresponding amides, was efficiently carried out in water under 1atm of CO using palladium nanoparticles (Pd NPs) formed in situ from [PdCl2(Ar2-BIAN)] complexes. The role of Ar2-BIAN ligands in the stabilization of Pd NPs was evidenced. The nature of the catalytically active species was confirmed by poisoning experiments, which highlighted that the catalyst is actually in the form of Pd NPs rather than soluble palladium complexes. In the aminocarbonylation of iodobenzene with substituted anilines good yields of amides were obtained, although the activity was depleted by the presence of substituents in the ortho positions of the aniline. On the other hand, in the reaction with aliphatic amines α-ketoamides were formed in addition to the amides. The selectivity towards α-ketoamides was increased by increasing the CO pressure to 10atm, at equimolar amounts of PhI and amine. Pd NPs were successfully recovered after the catalytic reaction and recycled in five subsequent runs with only a marginal loss of activity after the fourth cycle.",
        "openArchiveArticle": "false",
        "prism:coverDate": "2016-12-15",
        "openaccessUserLicense": null,
        "prism:aggregationType": "Journal",
        "prism:url": "https://api.elsevier.com/content/article/pii/S1381116916304472",
        "dc:creator": [
          {
            "@_fa": "true",
            "$": "Wójcik, P."
          },
          {
            "@_fa": "true",
            "$": "Rosar, V."
          },
          {
            "@_fa": "true",
            "$": "Gniewek, A."
          },
          {
            "@_fa": "true",
            "$": "Milani, B."
          },
          {
            "@_fa": "true",
            "$": "Trzeciak, A.M."
          }
        ],
        "link": [
          {
            "@_fa": "true",
            "@rel": "self",
            "@href": "https://api.elsevier.com/content/article/pii/S1381116916304472"
          },
          {
            "@_fa": "true",
            "@rel": "scidir",
            "@href": "https://www.sciencedirect.com/science/article/pii/S1381116916304472"
          }
        ],
        "dc:format": "application/json",
        "openaccessType": null,
        "pii": "S1381-1169(16)30447-2",
        "prism:volume": "425",
        "prism:publisher": "Elsevier B.V.",
        "dc:title": "In situ generated Pd(0) nanoparticles stabilized by bis(aryl)acenaphthenequinone diimines as catalysts for aminocarbonylation reactions in water",
        "prism:copyright": "© 2016 Elsevier B.V. All rights reserved.",
        "openaccess": "0",
        "prism:issn": "13811169",
        "dcterms:subject": [
          {
            "@_fa": "true",
            "$": "Palladium"
          },
          {
            "@_fa": "true",
            "$": "α-diimines"
          },
          {
            "@_fa": "true",
            "$": "Aminocarbonylation"
          },
          {
            "@_fa": "true",
            "$": "Aqueous medium"
          },
          {
            "@_fa": "true",
            "$": "α-ketoamides"
          }
        ],
        "openaccessArticle": "false",
        "prism:publicationName": "Journal of Molecular Catalysis A: Chemical",
        "openaccessSponsorType": null,
        "prism:pageRange": "322-331",
        "prism:endingPage": "331",
        "pubType": "fla",
        "prism:coverDisplayDate": "15 December 2016",
        "prism:doi": "10.1016/j.molcata.2016.10.025",
        "prism:startingPage": "322",
        "dc:identifier": "doi:10.1016/j.molcata.2016.10.025",
        "openaccessSponsorName": null
      },
      "objects": {
        "object": [
          {
            "@category": "thumbnail",
            "@height": "88",
            "@width": "219",
            "@_fa": "true",
            "$": "https://api.elsevier.com/content/object/eid/1-s2.0-S1381116916304472-fx1.sml?httpAccept=%2A%2F%2A",
            "@multimediatype": "GIF image file",
            "@type": "IMAGE-THUMBNAIL",
            "@size": "3364",
            "@ref": "fx1",
            "@mimetype": "image/gif"
          },
          {
            "@category": "thumbnail",
            "@height": "88",
            "@width": "219",
            "@_fa": "true",
            "$": "https://api.elsevier.com/content/object/eid/1-s2.0-S1381116916304472-fx10.sml?httpAccept=%2A%2F%2A",
            "@multimediatype": "GIF image file",
            "@type": "IMAGE-THUMBNAIL",
            "@size": "2867",
            "@ref": "fx10",
            "@mimetype": "image/gif"
          },
          {
            "@category": "thumbnail",
            "@height": "88",
            "@width": "219",
            "@_fa": "true",
            "$": "https://api.elsevier.com/content/object/eid/1-s2.0-S1381116916304472-fx11.sml?httpAccept=%2A%2F%2A",
            "@multimediatype": "GIF image file",
            "@type": "IMAGE-THUMBNAIL",
            "@size": "3180",
            "@ref": "fx11",
            "@mimetype": "image/gif"
          },
          {
            "@category": "thumbnail",
            "@height": "88",
            "@width": "219",
            "@_fa": "true",
            "$": "https://api.elsevier.com/content/object/eid/1-s2.0-S1381116916304472-fx12.sml?httpAccept=%2A%2F%2A",
            "@multimediatype": "GIF image file",
            "@type": "IMAGE-THUMBNAIL",
            "@size": "3061",
            "@ref": "fx12",
            "@mimetype": "image/gif"
          },
          {
            "@category": "thumbnail",
            "@height": "88",
            "@width": "219",
            "@_fa": "true",
            "$": "https://api.elsevier.com/content/object/eid/1-s2.0-S1381116916304472-fx13.sml?httpAccept=%2A%2F%2A",
            "@multimediatype": "GIF image file",
            "@type": "IMAGE-THUMBNAIL",
            "@size": "3388",
            "@ref": "fx13",
            "@mimetype": "image/gif"
          },
          {
            "@category": "thumbnail",
            "@height": "88",
            "@width": "219",
            "@_fa": "true",
            "$": "https://api.elsevier.com/content/object/eid/1-s2.0-S1381116916304472-fx14.sml?httpAccept=%2A%2F%2A",
            "@multimediatype": "GIF image file",
            "@type": "IMAGE-THUMBNAIL",
            "@size": "3226",
            "@ref": "fx14",
            "@mimetype": "image/gif"
          },
          {
            "@category": "thumbnail",
            "@height": "88",
            "@width": "219",
            "@_fa": "true",
            "$": "https://api.elsevier.com/content/object/eid/1-s2.0-S1381116916304472-fx15.sml?httpAccept=%2A%2F%2A",
            "@multimediatype": "GIF image file",
            "@type": "IMAGE-THUMBNAIL",
            "@size": "3563",
            "@ref": "fx15",
            "@mimetype": "image/gif"
          },
          {
            "@category": "thumbnail",
            "@height": "88",
            "@width": "219",
            "@_fa": "true",
            "$": "https://api.elsevier.com/content/object/eid/1-s2.0-S1381116916304472-fx16.sml?httpAccept=%2A%2F%2A",
            "@multimediatype": "GIF image file",
            "@type": "IMAGE-THUMBNAIL",
            "@size": "2706",
            "@ref": "fx16",
            "@mimetype": "image/gif"
          },
          {
            "@category": "thumbnail",
            "@height": "88",
            "@width": "219",
            "@_fa": "true",
            "$": "https://api.elsevier.com/content/object/eid/1-s2.0-S1381116916304472-fx17.sml?httpAccept=%2A%2F%2A",
            "@multimediatype": "GIF image file",
            "@type": "IMAGE-THUMBNAIL",
            "@size": "3632",
            "@ref": "fx17",
            "@mimetype": "image/gif"
          },
          {
            "@category": "thumbnail",
            "@height": "88",
            "@width": "219",
            "@_fa": "true",
            "$": "https://api.elsevier.com/content/object/eid/1-s2.0-S1381116916304472-fx18.sml?httpAccept=%2A%2F%2A",
            "@multimediatype": "GIF image file",
            "@type": "IMAGE-THUMBNAIL",
            "@size": "3114",
            "@ref": "fx18",
            "@mimetype": "image/gif"
          },
          {
            "@category": "thumbnail",
            "@height": "88",
            "@width": "219",
            "@_fa": "true",
            "$": "https://api.elsevier.com/content/object/eid/1-s2.0-S1381116916304472-fx19.sml?httpAccept=%2A%2F%2A",
            "@multimediatype": "GIF image file",
            "@type": "IMAGE-THUMBNAIL",
            "@size": "3163",
            "@ref": "fx19",
            "@mimetype": "image/gif"
          },
          {
            "@category": "thumbnail",
            "@height": "88",
            "@width": "219",
            "@_fa": "true",
            "$": "https://api.elsevier.com/content/object/eid/1-s2.0-S1381116916304472-fx2.sml?httpAccept=%2A%2F%2A",
            "@multimediatype": "GIF image file",
            "@type": "IMAGE-THUMBNAIL",
            "@size": "2767",
            "@ref": "fx2",
            "@mimetype": "image/gif"
          },
          {
            "@category": "thumbnail",
            "@height": "88",
            "@width": "219",
            "@_fa": "true",
            "$": "https://api.elsevier.com/content/object/eid/1-s2.0-S1381116916304472-fx20.sml?httpAccept=%2A%2F%2A",
            "@multimediatype": "GIF image file",
            "@type": "IMAGE-THUMBNAIL",
            "@size": "2665",
            "@ref": "fx20",
            "@mimetype": "image/gif"
          },
          {
            "@category": "thumbnail",
            "@height": "88",
            "@width": "219",
            "@_fa": "true",
            "$": "https://api.elsevier.com/content/object/eid/1-s2.0-S1381116916304472-fx21.sml?httpAccept=%2A%2F%2A",
            "@multimediatype": "GIF image file",
            "@type": "IMAGE-THUMBNAIL",
            "@size": "3222",
            "@ref": "fx21",
            "@mimetype": "image/gif"
          },
          {
            "@category": "thumbnail",
            "@height": "88",
            "@width": "219",
            "@_fa": "true",
            "$": "https://api.elsevier.com/content/object/eid/1-s2.0-S1381116916304472-fx22.sml?httpAccept=%2A%2F%2A",
            "@multimediatype": "GIF image file",
            "@type": "IMAGE-THUMBNAIL",
            "@size": "3704",
            "@ref": "fx22",
            "@mimetype": "image/gif"
          },
          {
            "@category": "thumbnail",
            "@height": "88",
            "@width": "219",
            "@_fa": "true",
            "$": "https://api.elsevier.com/content/object/eid/1-s2.0-S1381116916304472-fx23.sml?httpAccept=%2A%2F%2A",
            "@multimediatype": "GIF image file",
            "@type": "IMAGE-THUMBNAIL",
            "@size": "3514",
            "@ref": "fx23",
            "@mimetype": "image/gif"
          },
          {
            "@category": "thumbnail",
            "@height": "88",
            "@width": "219",
            "@_fa": "true",
            "$": "https://api.elsevier.com/content/object/eid/1-s2.0-S1381116916304472-fx3.sml?httpAccept=%2A%2F%2A",
            "@multimediatype": "GIF image file",
            "@type": "IMAGE-THUMBNAIL",
            "@size": "2731",
            "@ref": "fx3",
            "@mimetype": "image/gif"
          },
          {
            "@category": "thumbnail",
            "@height": "88",
            "@width": "219",
            "@_fa": "true",
            "$": "https://api.elsevier.com/content/object/eid/1-s2.0-S1381116916304472-fx4.sml?httpAccept=%2A%2F%2A",
            "@multimediatype": "GIF image file",
            "@type": "IMAGE-THUMBNAIL",
            "@size": "2490",
            "@ref": "fx4",
            "@mimetype": "image/gif"
          },
          {
            "@category": "thumbnail",
            "@height": "88",
            "@width": "219",
            "@_fa": "true",
            "$": "https://api.elsevier.com/content/object/eid/1-s2.0-S1381116916304472-fx5.sml?httpAccept=%2A%2F%2A",
            "@multimediatype": "GIF image file",
            "@type": "IMAGE-THUMBNAIL",
            "@size": "3035",
            "@ref": "fx5",
            "@mimetype": "image/gif"
          },
          {
            "@category": "thumbnail",
            "@height": "88",
            "@width": "219",
            "@_fa": "true",
            "$": "https://api.elsevier.com/content/object/eid/1-s2.0-S1381116916304472-fx6.sml?httpAccept=%2A%2F%2A",
            "@multimediatype": "GIF image file",
            "@type": "IMAGE-THUMBNAIL",
            "@size": "2546",
            "@ref": "fx6",
            "@mimetype": "image/gif"
          },
          {
            "@category": "thumbnail",
            "@height": "88",
            "@width": "219",
            "@_fa": "true",
            "$": "https://api.elsevier.com/content/object/eid/1-s2.0-S1381116916304472-fx7.sml?httpAccept=%2A%2F%2A",
            "@multimediatype": "GIF image file",
            "@type": "IMAGE-THUMBNAIL",
            "@size": "2933",
            "@ref": "fx7",
            "@mimetype": "image/gif"
          },
          {
            "@category": "thumbnail",
            "@height": "88",
            "@width": "219",
            "@_fa": "true",
            "$": "https://api.elsevier.com/content/object/eid/1-s2.0-S1381116916304472-fx8.sml?httpAccept=%2A%2F%2A",
            "@multimediatype": "GIF image file",
            "@type": "IMAGE-THUMBNAIL",
            "@size": "2954",
            "@ref": "fx8",
            "@mimetype": "image/gif"
          },
          {
            "@category": "thumbnail",
            "@height": "88",
            "@width": "219",
            "@_fa": "true",
            "$": "https://api.elsevier.com/content/object/eid/1-s2.0-S1381116916304472-fx9.sml?httpAccept=%2A%2F%2A",
            "@multimediatype": "GIF image file",
            "@type": "IMAGE-THUMBNAIL",
            "@size": "2549",
            "@ref": "fx9",
            "@mimetype": "image/gif"
          },
          {
            "@category": "thumbnail",
            "@height": "45",
            "@width": "219",
            "@_fa": "true",
            "$": "https://api.elsevier.com/content/object/eid/1-s2.0-S1381116916304472-gr1.sml?httpAccept=%2A%2F%2A",
            "@multimediatype": "GIF image file",
            "@type": "IMAGE-THUMBNAIL",
            "@size": "1989",
            "@ref": "gr1",
            "@mimetype": "image/gif"
          },
          {
            "@category": "thumbnail",
            "@height": "164",
            "@width": "208",
            "@_fa": "true",
            "$": "https://api.elsevier.com/content/object/eid/1-s2.0-S1381116916304472-gr10.sml?httpAccept=%2A%2F%2A",
            "@multimediatype": "GIF image file",
            "@type": "IMAGE-THUMBNAIL",
            "@size": "4662",
            "@ref": "gr10",
            "@mimetype": "image/gif"
          },
          {
            "@category": "thumbnail",
            "@height": "140",
            "@width": "219",
            "@_fa": "true",
            "$": "https://api.elsevier.com/content/object/eid/1-s2.0-S1381116916304472-gr2.sml?httpAccept=%2A%2F%2A",
            "@multimediatype": "GIF image file",
            "@type": "IMAGE-THUMBNAIL",
            "@size": "7133",
            "@ref": "gr2",
            "@mimetype": "image/gif"
          },
          {
            "@category": "thumbnail",
            "@height": "135",
            "@width": "219",
            "@_fa": "true",
            "$": "https://api.elsevier.com/content/object/eid/1-s2.0-S1381116916304472-gr3.sml?httpAccept=%2A%2F%2A",
            "@multimediatype": "GIF image file",
            "@type": "IMAGE-THUMBNAIL",
            "@size": "7063",
            "@ref": "gr3",
            "@mimetype": "image/gif"
          },
          {
            "@category": "thumbnail",
            "@height": "69",
            "@width": "219",
            "@_fa": "true",
            "$": "https://api.elsevier.com/content/object/eid/1-s2.0-S1381116916304472-gr4.sml?httpAccept=%2A%2F%2A",
            "@multimediatype": "GIF image file",
            "@type": "IMAGE-THUMBNAIL",
            "@size": "9736",
            "@ref": "gr4",
            "@mimetype": "image/gif"
          },
          {
            "@category": "thumbnail",
            "@height": "164",
            "@width": "215",
            "@_fa": "true",
            "$": "https://api.elsevier.com/content/object/eid/1-s2.0-S1381116916304472-gr5.sml?httpAccept=%2A%2F%2A",
            "@multimediatype": "GIF image file",
            "@type": "IMAGE-THUMBNAIL",
            "@size": "8048",
            "@ref": "gr5",
            "@mimetype": "image/gif"
          },
          {
            "@category": "thumbnail",
            "@height": "164",
            "@width": "195",
            "@_fa": "true",
            "$": "https://api.elsevier.com/content/object/eid/1-s2.0-S1381116916304472-gr6.sml?httpAccept=%2A%2F%2A",
            "@multimediatype": "GIF image file",
            "@type": "IMAGE-THUMBNAIL",
            "@size": "6607",
            "@ref": "gr6",
            "@mimetype": "image/gif"
          },
          {
            "@category": "thumbnail",
            "@height": "113",
            "@width": "219",
            "@_fa": "true",
            "$": "https://api.elsevier.com/content/object/eid/1-s2.0-S1381116916304472-gr7.sml?httpAccept=%2A%2F%2A",
            "@multimediatype": "GIF image file",
            "@type": "IMAGE-THUMBNAIL",
            "@size": "5089",
            "@ref": "gr7",
            "@mimetype": "image/gif"
          },
          {
            "@category": "thumbnail",
            "@height": "67",
            "@width": "219",
            "@_fa": "true",
            "$": "https://api.elsevier.com/content/object/eid/1-s2.0-S1381116916304472-gr8.sml?httpAccept=%2A%2F%2A",
            "@multimediatype": "GIF image file",
            "@type": "IMAGE-THUMBNAIL",
            "@size": "7386",
            "@ref": "gr8",
            "@mimetype": "image/gif"
          },
          {
            "@category": "thumbnail",
            "@height": "103",
            "@width": "219",
            "@_fa": "true",
            "$": "https://api.elsevier.com/content/object/eid/1-s2.0-S1381116916304472-gr9.sml?httpAccept=%2A%2F%2A",
            "@multimediatype": "GIF image file",
            "@type": "IMAGE-THUMBNAIL",
            "@size": "5653",
            "@ref": "gr9",
            "@mimetype": "image/gif"
          },
          {
            "@category": "thumbnail",
            "@height": "135",
            "@width": "219",
            "@_fa": "true",
            "$": "https://api.elsevier.com/content/object/eid/1-s2.0-S1381116916304472-sc1.sml?httpAccept=%2A%2F%2A",
            "@multimediatype": "GIF image file",
            "@type": "IMAGE-THUMBNAIL",
            "@size": "4083",
            "@ref": "sc1",
            "@mimetype": "image/gif"
          },
          {
            "@category": "thumbnail",
            "@height": "68",
            "@width": "219",
            "@_fa": "true",
            "$": "https://api.elsevier.com/content/object/eid/1-s2.0-S1381116916304472-sc2.sml?httpAccept=%2A%2F%2A",
            "@multimediatype": "GIF image file",
            "@type": "IMAGE-THUMBNAIL",
            "@size": "3228",
            "@ref": "sc2",
            "@mimetype": "image/gif"
          },
          {
            "@category": "thumbnail",
            "@height": "46",
            "@width": "219",
            "@_fa": "true",
            "$": "https://api.elsevier.com/content/object/eid/1-s2.0-S1381116916304472-sc3.sml?httpAccept=%2A%2F%2A",
            "@multimediatype": "GIF image file",
            "@type": "IMAGE-THUMBNAIL",
            "@size": "2408",
            "@ref": "sc3",
            "@mimetype": "image/gif"
          },
          {
            "@category": "thumbnail",
            "@height": "39",
            "@width": "219",
            "@_fa": "true",
            "$": "https://api.elsevier.com/content/object/eid/1-s2.0-S1381116916304472-sc4.sml?httpAccept=%2A%2F%2A",
            "@multimediatype": "GIF image file",
            "@type": "IMAGE-THUMBNAIL",
            "@size": "2450",
            "@ref": "sc4",
            "@mimetype": "image/gif"
          },
          {
            "@category": "thumbnail",
            "@height": "32",
            "@width": "219",
            "@_fa": "true",
            "$": "https://api.elsevier.com/content/object/eid/1-s2.0-S1381116916304472-sc5.sml?httpAccept=%2A%2F%2A",
            "@multimediatype": "GIF image file",
            "@type": "IMAGE-THUMBNAIL",
            "@size": "2054",
            "@ref": "sc5",
            "@mimetype": "image/gif"
          },
          {
            "@category": "standard",
            "@height": "200",
            "@width": "500",
            "@_fa": "true",
            "$": "https://api.elsevier.com/content/object/eid/1-s2.0-S1381116916304472-fx1.jpg?httpAccept=%2A%2F%2A",
            "@multimediatype": "JPEG image file",
            "@type": "IMAGE-DOWNSAMPLED",
            "@size": "15765",
            "@ref": "fx1",
            "@mimetype": "image/jpeg"
          },
          {
            "@category": "standard",
            "@height": "200",
            "@width": "500",
            "@_fa": "true",
            "$": "https://api.elsevier.com/content/object/eid/1-s2.0-S1381116916304472-fx10.jpg?httpAccept=%2A%2F%2A",
            "@multimediatype": "JPEG image file",
            "@type": "IMAGE-DOWNSAMPLED",
            "@size": "10050",
            "@ref": "fx10",
            "@mimetype": "image/jpeg"
          },
          {
            "@category": "standard",
            "@height": "200",
            "@width": "500",
            "@_fa": "true",
            "$": "https://api.elsevier.com/content/object/eid/1-s2.0-S1381116916304472-fx11.jpg?httpAccept=%2A%2F%2A",
            "@multimediatype": "JPEG image file",
            "@type": "IMAGE-DOWNSAMPLED",
            "@size": "11924",
            "@ref": "fx11",
            "@mimetype": "image/jpeg"
          },
          {
            "@category": "standard",
            "@height": "200",
            "@width": "500",
            "@_fa": "true",
            "$": "https://api.elsevier.com/content/object/eid/1-s2.0-S1381116916304472-fx12.jpg?httpAccept=%2A%2F%2A",
            "@multimediatype": "JPEG image file",
            "@type": "IMAGE-DOWNSAMPLED",
            "@size": "11673",
            "@ref": "fx12",
            "@mimetype": "image/jpeg"
          },
          {
            "@category": "standard",
            "@height": "200",
            "@width": "500",
            "@_fa": "true",
            "$": "https://api.elsevier.com/content/object/eid/1-s2.0-S1381116916304472-fx13.jpg?httpAccept=%2A%2F%2A",
            "@multimediatype": "JPEG image file",
            "@type": "IMAGE-DOWNSAMPLED",
            "@size": "12709",
            "@ref": "fx13",
            "@mimetype": "image/jpeg"
          },
          {
            "@category": "standard",
            "@height": "200",
            "@width": "500",
            "@_fa": "true",
            "$": "https://api.elsevier.com/content/object/eid/1-s2.0-S1381116916304472-fx14.jpg?httpAccept=%2A%2F%2A",
            "@multimediatype": "JPEG image file",
            "@type": "IMAGE-DOWNSAMPLED",
            "@size": "11205",
            "@ref": "fx14",
            "@mimetype": "image/jpeg"
          },
          {
            "@category": "standard",
            "@height": "200",
            "@width": "500",
            "@_fa": "true",
            "$": "https://api.elsevier.com/content/object/eid/1-s2.0-S1381116916304472-fx15.jpg?httpAccept=%2A%2F%2A",
            "@multimediatype": "JPEG image file",
            "@type": "IMAGE-DOWNSAMPLED",
            "@size": "13132",
            "@ref": "fx15",
            "@mimetype": "image/jpeg"
          },
          {
            "@category": "standard",
            "@height": "200",
            "@width": "500",
            "@_fa": "true",
            "$": "https://api.elsevier.com/content/object/eid/1-s2.0-S1381116916304472-fx16.jpg?httpAccept=%2A%2F%2A",
            "@multimediatype": "JPEG image file",
            "@type": "IMAGE-DOWNSAMPLED",
            "@size": "6320",
            "@ref": "fx16",
            "@mimetype": "image/jpeg"
          },
          {
            "@category": "standard",
            "@height": "200",
            "@width": "500",
            "@_fa": "true",
            "$": "https://api.elsevier.com/content/object/eid/1-s2.0-S1381116916304472-fx17.jpg?httpAccept=%2A%2F%2A",
            "@multimediatype": "JPEG image file",
            "@type": "IMAGE-DOWNSAMPLED",
            "@size": "8712",
            "@ref": "fx17",
            "@mimetype": "image/jpeg"
          },
          {
            "@category": "standard",
            "@height": "200",
            "@width": "500",
            "@_fa": "true",
            "$": "https://api.elsevier.com/content/object/eid/1-s2.0-S1381116916304472-fx18.jpg?httpAccept=%2A%2F%2A",
            "@multimediatype": "JPEG image file",
            "@type": "IMAGE-DOWNSAMPLED",
            "@size": "6776",
            "@ref": "fx18",
            "@mimetype": "image/jpeg"
          },
          {
            "@category": "standard",
            "@height": "200",
            "@width": "500",
            "@_fa": "true",
            "$": "https://api.elsevier.com/content/object/eid/1-s2.0-S1381116916304472-fx19.jpg?httpAccept=%2A%2F%2A",
            "@multimediatype": "JPEG image file",
            "@type": "IMAGE-DOWNSAMPLED",
            "@size": "6756",
            "@ref": "fx19",
            "@mimetype": "image/jpeg"
          },
          {
            "@category": "standard",
            "@height": "200",
            "@width": "500",
            "@_fa": "true",
            "$": "https://api.elsevier.com/content/object/eid/1-s2.0-S1381116916304472-fx2.jpg?httpAccept=%2A%2F%2A",
            "@multimediatype": "JPEG image file",
            "@type": "IMAGE-DOWNSAMPLED",
            "@size": "9231",
            "@ref": "fx2",
            "@mimetype": "image/jpeg"
          },
          {
            "@category": "standard",
            "@height": "200",
            "@width": "500",
            "@_fa": "true",
            "$": "https://api.elsevier.com/content/object/eid/1-s2.0-S1381116916304472-fx20.jpg?httpAccept=%2A%2F%2A",
            "@multimediatype": "JPEG image file",
            "@type": "IMAGE-DOWNSAMPLED",
            "@size": "6804",
            "@ref": "fx20",
            "@mimetype": "image/jpeg"
          },
          {
            "@category": "standard",
            "@height": "200",
            "@width": "500",
            "@_fa": "true",
            "$": "https://api.elsevier.com/content/object/eid/1-s2.0-S1381116916304472-fx21.jpg?httpAccept=%2A%2F%2A",
            "@multimediatype": "JPEG image file",
            "@type": "IMAGE-DOWNSAMPLED",
            "@size": "7383",
            "@ref": "fx21",
            "@mimetype": "image/jpeg"
          },
          {
            "@category": "standard",
            "@height": "200",
            "@width": "500",
            "@_fa": "true",
            "$": "https://api.elsevier.com/content/object/eid/1-s2.0-S1381116916304472-fx22.jpg?httpAccept=%2A%2F%2A",
            "@multimediatype": "JPEG image file",
            "@type": "IMAGE-DOWNSAMPLED",
            "@size": "8501",
            "@ref": "fx22",
            "@mimetype": "image/jpeg"
          },
          {
            "@category": "standard",
            "@height": "200",
            "@width": "500",
            "@_fa": "true",
            "$": "https://api.elsevier.com/content/object/eid/1-s2.0-S1381116916304472-fx23.jpg?httpAccept=%2A%2F%2A",
            "@multimediatype": "JPEG image file",
            "@type": "IMAGE-DOWNSAMPLED",
            "@size": "8101",
            "@ref": "fx23",
            "@mimetype": "image/jpeg"
          },
          {
            "@category": "standard",
            "@height": "200",
            "@width": "500",
            "@_fa": "true",
            "$": "https://api.elsevier.com/content/object/eid/1-s2.0-S1381116916304472-fx3.jpg?httpAccept=%2A%2F%2A",
            "@multimediatype": "JPEG image file",
            "@type": "IMAGE-DOWNSAMPLED",
            "@size": "9268",
            "@ref": "fx3",
            "@mimetype": "image/jpeg"
          },
          {
            "@category": "standard",
            "@height": "200",
            "@width": "500",
            "@_fa": "true",
            "$": "https://api.elsevier.com/content/object/eid/1-s2.0-S1381116916304472-fx4.jpg?httpAccept=%2A%2F%2A",
            "@multimediatype": "JPEG image file",
            "@type": "IMAGE-DOWNSAMPLED",
            "@size": "8128",
            "@ref": "fx4",
            "@mimetype": "image/jpeg"
          },
          {
            "@category": "standard",
            "@height": "200",
            "@width": "500",
            "@_fa": "true",
            "$": "https://api.elsevier.com/content/object/eid/1-s2.0-S1381116916304472-fx5.jpg?httpAccept=%2A%2F%2A",
            "@multimediatype": "JPEG image file",
            "@type": "IMAGE-DOWNSAMPLED",
            "@size": "10530",
            "@ref": "fx5",
            "@mimetype": "image/jpeg"
          },
          {
            "@category": "standard",
            "@height": "200",
            "@width": "500",
            "@_fa": "true",
            "$": "https://api.elsevier.com/content/object/eid/1-s2.0-S1381116916304472-fx6.jpg?httpAccept=%2A%2F%2A",
            "@multimediatype": "JPEG image file",
            "@type": "IMAGE-DOWNSAMPLED",
            "@size": "8930",
            "@ref": "fx6",
            "@mimetype": "image/jpeg"
          },
          {
            "@category": "standard",
            "@height": "200",
            "@width": "500",
            "@_fa": "true",
            "$": "https://api.elsevier.com/content/object/eid/1-s2.0-S1381116916304472-fx7.jpg?httpAccept=%2A%2F%2A",
            "@multimediatype": "JPEG image file",
            "@type": "IMAGE-DOWNSAMPLED",
            "@size": "10684",
            "@ref": "fx7",
            "@mimetype": "image/jpeg"
          },
          {
            "@category": "standard",
            "@height": "200",
            "@width": "500",
            "@_fa": "true",
            "$": "https://api.elsevier.com/content/object/eid/1-s2.0-S1381116916304472-fx8.jpg?httpAccept=%2A%2F%2A",
            "@multimediatype": "JPEG image file",
            "@type": "IMAGE-DOWNSAMPLED",
            "@size": "10884",
            "@ref": "fx8",
            "@mimetype": "image/jpeg"
          },
          {
            "@category": "standard",
            "@height": "200",
            "@width": "500",
            "@_fa": "true",
            "$": "https://api.elsevier.com/content/object/eid/1-s2.0-S1381116916304472-fx9.jpg?httpAccept=%2A%2F%2A",
            "@multimediatype": "JPEG image file",
            "@type": "IMAGE-DOWNSAMPLED",
            "@size": "8898",
            "@ref": "fx9",
            "@mimetype": "image/jpeg"
          },
          {
            "@category": "standard",
            "@height": "116",
            "@width": "565",
            "@_fa": "true",
            "$": "https://api.elsevier.com/content/object/eid/1-s2.0-S1381116916304472-gr1.jpg?httpAccept=%2A%2F%2A",
            "@multimediatype": "JPEG image file",
            "@type": "IMAGE-DOWNSAMPLED",
            "@size": "12910",
            "@ref": "gr1",
            "@mimetype": "image/jpeg"
          },
          {
            "@category": "standard",
            "@height": "504",
            "@width": "640",
            "@_fa": "true",
            "$": "https://api.elsevier.com/content/object/eid/1-s2.0-S1381116916304472-gr10.jpg?httpAccept=%2A%2F%2A",
            "@multimediatype": "JPEG image file",
            "@type": "IMAGE-DOWNSAMPLED",
            "@size": "53805",
            "@ref": "gr10",
            "@mimetype": "image/jpeg"
          },
          {
            "@category": "standard",
            "@height": "240",
            "@width": "376",
            "@_fa": "true",
            "$": "https://api.elsevier.com/content/object/eid/1-s2.0-S1381116916304472-gr2.jpg?httpAccept=%2A%2F%2A",
            "@multimediatype": "JPEG image file",
            "@type": "IMAGE-DOWNSAMPLED",
            "@size": "22883",
            "@ref": "gr2",
            "@mimetype": "image/jpeg"
          },
          {
            "@category": "standard",
            "@height": "232",
            "@width": "376",
            "@_fa": "true",
            "$": "https://api.elsevier.com/content/object/eid/1-s2.0-S1381116916304472-gr3.jpg?httpAccept=%2A%2F%2A",
            "@multimediatype": "JPEG image file",
            "@type": "IMAGE-DOWNSAMPLED",
            "@size": "22242",
            "@ref": "gr3",
            "@mimetype": "image/jpeg"
          },
          {
            "@category": "standard",
            "@height": "201",
            "@width": "640",
            "@_fa": "true",
            "$": "https://api.elsevier.com/content/object/eid/1-s2.0-S1381116916304472-gr4.jpg?httpAccept=%2A%2F%2A",
            "@multimediatype": "JPEG image file",
            "@type": "IMAGE-DOWNSAMPLED",
            "@size": "39409",
            "@ref": "gr4",
            "@mimetype": "image/jpeg"
          },
          {
            "@category": "standard",
            "@height": "287",
            "@width": "376",
            "@_fa": "true",
            "$": "https://api.elsevier.com/content/object/eid/1-s2.0-S1381116916304472-gr5.jpg?httpAccept=%2A%2F%2A",
            "@multimediatype": "JPEG image file",
            "@type": "IMAGE-DOWNSAMPLED",
            "@size": "21892",
            "@ref": "gr5",
            "@mimetype": "image/jpeg"
          },
          {
            "@category": "standard",
            "@height": "316",
            "@width": "376",
            "@_fa": "true",
            "$": "https://api.elsevier.com/content/object/eid/1-s2.0-S1381116916304472-gr6.jpg?httpAccept=%2A%2F%2A",
            "@multimediatype": "JPEG image file",
            "@type": "IMAGE-DOWNSAMPLED",
            "@size": "21652",
            "@ref": "gr6",
            "@mimetype": "image/jpeg"
          },
          {
            "@category": "standard",
            "@height": "165",
            "@width": "320",
            "@_fa": "true",
            "$": "https://api.elsevier.com/content/object/eid/1-s2.0-S1381116916304472-gr7.jpg?httpAccept=%2A%2F%2A",
            "@multimediatype": "JPEG image file",
            "@type": "IMAGE-DOWNSAMPLED",
            "@size": "11593",
            "@ref": "gr7",
            "@mimetype": "image/jpeg"
          },
          {
            "@category": "standard",
            "@height": "184",
            "@width": "602",
            "@_fa": "true",
            "$": "https://api.elsevier.com/content/object/eid/1-s2.0-S1381116916304472-gr8.jpg?httpAccept=%2A%2F%2A",
            "@multimediatype": "JPEG image file",
            "@type": "IMAGE-DOWNSAMPLED",
            "@size": "36132",
            "@ref": "gr8",
            "@mimetype": "image/jpeg"
          },
          {
            "@category": "standard",
            "@height": "177",
            "@width": "376",
            "@_fa": "true",
            "$": "https://api.elsevier.com/content/object/eid/1-s2.0-S1381116916304472-gr9.jpg?httpAccept=%2A%2F%2A",
            "@multimediatype": "JPEG image file",
            "@type": "IMAGE-DOWNSAMPLED",
            "@size": "20379",
            "@ref": "gr9",
            "@mimetype": "image/jpeg"
          },
          {
            "@category": "standard",
            "@height": "197",
            "@width": "320",
            "@_fa": "true",
            "$": "https://api.elsevier.com/content/object/eid/1-s2.0-S1381116916304472-sc1.jpg?httpAccept=%2A%2F%2A",
            "@multimediatype": "JPEG image file",
            "@type": "IMAGE-DOWNSAMPLED",
            "@size": "10974",
            "@ref": "sc1",
            "@mimetype": "image/jpeg"
          },
          {
            "@category": "standard",
            "@height": "116",
            "@width": "376",
            "@_fa": "true",
            "$": "https://api.elsevier.com/content/object/eid/1-s2.0-S1381116916304472-sc2.jpg?httpAccept=%2A%2F%2A",
            "@multimediatype": "JPEG image file",
            "@type": "IMAGE-DOWNSAMPLED",
            "@size": "9894",
            "@ref": "sc2",
            "@mimetype": "image/jpeg"
          },
          {
            "@category": "standard",
            "@height": "80",
            "@width": "377",
            "@_fa": "true",
            "$": "https://api.elsevier.com/content/object/eid/1-s2.0-S1381116916304472-sc3.jpg?httpAccept=%2A%2F%2A",
            "@multimediatype": "JPEG image file",
            "@type": "IMAGE-DOWNSAMPLED",
            "@size": "6783",
            "@ref": "sc3",
            "@mimetype": "image/jpeg"
          },
          {
            "@category": "standard",
            "@height": "93",
            "@width": "527",
            "@_fa": "true",
            "$": "https://api.elsevier.com/content/object/eid/1-s2.0-S1381116916304472-sc4.jpg?httpAccept=%2A%2F%2A",
            "@multimediatype": "JPEG image file",
            "@type": "IMAGE-DOWNSAMPLED",
            "@size": "10585",
            "@ref": "sc4",
            "@mimetype": "image/jpeg"
          },
          {
            "@category": "standard",
            "@height": "100",
            "@width": "678",
            "@_fa": "true",
            "$": "https://api.elsevier.com/content/object/eid/1-s2.0-S1381116916304472-sc5.jpg?httpAccept=%2A%2F%2A",
            "@multimediatype": "JPEG image file",
            "@type": "IMAGE-DOWNSAMPLED",
            "@size": "12426",
            "@ref": "sc5",
            "@mimetype": "image/jpeg"
          },
          {
            "@category": "high",
            "@height": "886",
            "@width": "2213",
            "@_fa": "true",
            "$": "https://api.elsevier.com/content/object/eid/1-s2.0-S1381116916304472-fx1_lrg.jpg?httpAccept=%2A%2F%2A",
            "@multimediatype": "JPEG image file",
            "@type": "IMAGE-HIGH-RES",
            "@size": "108181",
            "@ref": "fx1",
            "@mimetype": "image/jpeg"
          },
          {
            "@category": "high",
            "@height": "886",
            "@width": "2213",
            "@_fa": "true",
            "$": "https://api.elsevier.com/content/object/eid/1-s2.0-S1381116916304472-fx10_lrg.jpg?httpAccept=%2A%2F%2A",
            "@multimediatype": "JPEG image file",
            "@type": "IMAGE-HIGH-RES",
            "@size": "70685",
            "@ref": "fx10",
            "@mimetype": "image/jpeg"
          },
          {
            "@category": "high",
            "@height": "886",
            "@width": "2213",
            "@_fa": "true",
            "$": "https://api.elsevier.com/content/object/eid/1-s2.0-S1381116916304472-fx11_lrg.jpg?httpAccept=%2A%2F%2A",
            "@multimediatype": "JPEG image file",
            "@type": "IMAGE-HIGH-RES",
            "@size": "83435",
            "@ref": "fx11",
            "@mimetype": "image/jpeg"
          },
          {
            "@category": "high",
            "@height": "886",
            "@width": "2213",
            "@_fa": "true",
            "$": "https://api.elsevier.com/content/object/eid/1-s2.0-S1381116916304472-fx12_lrg.jpg?httpAccept=%2A%2F%2A",
            "@multimediatype": "JPEG image file",
            "@type": "IMAGE-HIGH-RES",
            "@size": "82207",
            "@ref": "fx12",
            "@mimetype": "image/jpeg"
          },
          {
            "@category": "high",
            "@height": "886",
            "@width": "2213",
            "@_fa": "true",
            "$": "https://api.elsevier.com/content/object/eid/1-s2.0-S1381116916304472-fx13_lrg.jpg?httpAccept=%2A%2F%2A",
            "@multimediatype": "JPEG image file",
            "@type": "IMAGE-HIGH-RES",
            "@size": "86468",
            "@ref": "fx13",
            "@mimetype": "image/jpeg"
          },
          {
            "@category": "high",
            "@height": "886",
            "@width": "2213",
            "@_fa": "true",
            "$": "https://api.elsevier.com/content/object/eid/1-s2.0-S1381116916304472-fx14_lrg.jpg?httpAccept=%2A%2F%2A",
            "@multimediatype": "JPEG image file",
            "@type": "IMAGE-HIGH-RES",
            "@size": "77615",
            "@ref": "fx14",
            "@mimetype": "image/jpeg"
          },
          {
            "@category": "high",
            "@height": "886",
            "@width": "2213",
            "@_fa": "true",
            "$": "https://api.elsevier.com/content/object/eid/1-s2.0-S1381116916304472-fx15_lrg.jpg?httpAccept=%2A%2F%2A",
            "@multimediatype": "JPEG image file",
            "@type": "IMAGE-HIGH-RES",
            "@size": "88619",
            "@ref": "fx15",
            "@mimetype": "image/jpeg"
          },
          {
            "@category": "high",
            "@height": "886",
            "@width": "2213",
            "@_fa": "true",
            "$": "https://api.elsevier.com/content/object/eid/1-s2.0-S1381116916304472-fx16_lrg.jpg?httpAccept=%2A%2F%2A",
            "@multimediatype": "JPEG image file",
            "@type": "IMAGE-HIGH-RES",
            "@size": "49283",
            "@ref": "fx16",
            "@mimetype": "image/jpeg"
          },
          {
            "@category": "high",
            "@height": "886",
            "@width": "2213",
            "@_fa": "true",
            "$": "https://api.elsevier.com/content/object/eid/1-s2.0-S1381116916304472-fx17_lrg.jpg?httpAccept=%2A%2F%2A",
            "@multimediatype": "JPEG image file",
            "@type": "IMAGE-HIGH-RES",
            "@size": "68678",
            "@ref": "fx17",
            "@mimetype": "image/jpeg"
          },
          {
            "@category": "high",
            "@height": "886",
            "@width": "2213",
            "@_fa": "true",
            "$": "https://api.elsevier.com/content/object/eid/1-s2.0-S1381116916304472-fx18_lrg.jpg?httpAccept=%2A%2F%2A",
            "@multimediatype": "JPEG image file",
            "@type": "IMAGE-HIGH-RES",
            "@size": "55748",
            "@ref": "fx18",
            "@mimetype": "image/jpeg"
          },
          {
            "@category": "high",
            "@height": "886",
            "@width": "2213",
            "@_fa": "true",
            "$": "https://api.elsevier.com/content/object/eid/1-s2.0-S1381116916304472-fx19_lrg.jpg?httpAccept=%2A%2F%2A",
            "@multimediatype": "JPEG image file",
            "@type": "IMAGE-HIGH-RES",
            "@size": "55687",
            "@ref": "fx19",
            "@mimetype": "image/jpeg"
          },
          {
            "@category": "high",
            "@height": "886",
            "@width": "2213",
            "@_fa": "true",
            "$": "https://api.elsevier.com/content/object/eid/1-s2.0-S1381116916304472-fx2_lrg.jpg?httpAccept=%2A%2F%2A",
            "@multimediatype": "JPEG image file",
            "@type": "IMAGE-HIGH-RES",
            "@size": "62125",
            "@ref": "fx2",
            "@mimetype": "image/jpeg"
          },
          {
            "@category": "high",
            "@height": "886",
            "@width": "2213",
            "@_fa": "true",
            "$": "https://api.elsevier.com/content/object/eid/1-s2.0-S1381116916304472-fx20_lrg.jpg?httpAccept=%2A%2F%2A",
            "@multimediatype": "JPEG image file",
            "@type": "IMAGE-HIGH-RES",
            "@size": "51856",
            "@ref": "fx20",
            "@mimetype": "image/jpeg"
          },
          {
            "@category": "high",
            "@height": "886",
            "@width": "2213",
            "@_fa": "true",
            "$": "https://api.elsevier.com/content/object/eid/1-s2.0-S1381116916304472-fx21_lrg.jpg?httpAccept=%2A%2F%2A",
            "@multimediatype": "JPEG image file",
            "@type": "IMAGE-HIGH-RES",
            "@size": "60933",
            "@ref": "fx21",
            "@mimetype": "image/jpeg"
          },
          {
            "@category": "high",
            "@height": "886",
            "@width": "2213",
            "@_fa": "true",
            "$": "https://api.elsevier.com/content/object/eid/1-s2.0-S1381116916304472-fx22_lrg.jpg?httpAccept=%2A%2F%2A",
            "@multimediatype": "JPEG image file",
            "@type": "IMAGE-HIGH-RES",
            "@size": "68685",
            "@ref": "fx22",
            "@mimetype": "image/jpeg"
          },
          {
            "@category": "high",
            "@height": "886",
            "@width": "2213",
            "@_fa": "true",
            "$": "https://api.elsevier.com/content/object/eid/1-s2.0-S1381116916304472-fx23_lrg.jpg?httpAccept=%2A%2F%2A",
            "@multimediatype": "JPEG image file",
            "@type": "IMAGE-HIGH-RES",
            "@size": "66269",
            "@ref": "fx23",
            "@mimetype": "image/jpeg"
          },
          {
            "@category": "high",
            "@height": "886",
            "@width": "2213",
            "@_fa": "true",
            "$": "https://api.elsevier.com/content/object/eid/1-s2.0-S1381116916304472-fx3_lrg.jpg?httpAccept=%2A%2F%2A",
            "@multimediatype": "JPEG image file",
            "@type": "IMAGE-HIGH-RES",
            "@size": "62228",
            "@ref": "fx3",
            "@mimetype": "image/jpeg"
          },
          {
            "@category": "high",
            "@height": "886",
            "@width": "2213",
            "@_fa": "true",
            "$": "https://api.elsevier.com/content/object/eid/1-s2.0-S1381116916304472-fx4_lrg.jpg?httpAccept=%2A%2F%2A",
            "@multimediatype": "JPEG image file",
            "@type": "IMAGE-HIGH-RES",
            "@size": "56414",
            "@ref": "fx4",
            "@mimetype": "image/jpeg"
          },
          {
            "@category": "high",
            "@height": "886",
            "@width": "2213",
            "@_fa": "true",
            "$": "https://api.elsevier.com/content/object/eid/1-s2.0-S1381116916304472-fx5_lrg.jpg?httpAccept=%2A%2F%2A",
            "@multimediatype": "JPEG image file",
            "@type": "IMAGE-HIGH-RES",
            "@size": "69476",
            "@ref": "fx5",
            "@mimetype": "image/jpeg"
          },
          {
            "@category": "high",
            "@height": "886",
            "@width": "2213",
            "@_fa": "true",
            "$": "https://api.elsevier.com/content/object/eid/1-s2.0-S1381116916304472-fx6_lrg.jpg?httpAccept=%2A%2F%2A",
            "@multimediatype": "JPEG image file",
            "@type": "IMAGE-HIGH-RES",
            "@size": "64264",
            "@ref": "fx6",
            "@mimetype": "image/jpeg"
          },
          {
            "@category": "high",
            "@height": "886",
            "@width": "2213",
            "@_fa": "true",
            "$": "https://api.elsevier.com/content/object/eid/1-s2.0-S1381116916304472-fx7_lrg.jpg?httpAccept=%2A%2F%2A",
            "@multimediatype": "JPEG image file",
            "@type": "IMAGE-HIGH-RES",
            "@size": "74288",
            "@ref": "fx7",
            "@mimetype": "image/jpeg"
          },
          {
            "@category": "high",
            "@height": "886",
            "@width": "2213",
            "@_fa": "true",
            "$": "https://api.elsevier.com/content/object/eid/1-s2.0-S1381116916304472-fx8_lrg.jpg?httpAccept=%2A%2F%2A",
            "@multimediatype": "JPEG image file",
            "@type": "IMAGE-HIGH-RES",
            "@size": "75679",
            "@ref": "fx8",
            "@mimetype": "image/jpeg"
          },
          {
            "@category": "high",
            "@height": "886",
            "@width": "2213",
            "@_fa": "true",
            "$": "https://api.elsevier.com/content/object/eid/1-s2.0-S1381116916304472-fx9_lrg.jpg?httpAccept=%2A%2F%2A",
            "@multimediatype": "JPEG image file",
            "@type": "IMAGE-HIGH-RES",
            "@size": "64622",
            "@ref": "fx9",
            "@mimetype": "image/jpeg"
          },
          {
            "@category": "high",
            "@height": "514",
            "@width": "2500",
            "@_fa": "true",
            "$": "https://api.elsevier.com/content/object/eid/1-s2.0-S1381116916304472-gr1_lrg.jpg?httpAccept=%2A%2F%2A",
            "@multimediatype": "JPEG image file",
            "@type": "IMAGE-HIGH-RES",
            "@size": "83523",
            "@ref": "gr1",
            "@mimetype": "image/jpeg"
          },
          {
            "@category": "high",
            "@height": "2230",
            "@width": "2834",
            "@_fa": "true",
            "$": "https://api.elsevier.com/content/object/eid/1-s2.0-S1381116916304472-gr10_lrg.jpg?httpAccept=%2A%2F%2A",
            "@multimediatype": "JPEG image file",
            "@type": "IMAGE-HIGH-RES",
            "@size": "407848",
            "@ref": "gr10",
            "@mimetype": "image/jpeg"
          },
          {
            "@category": "high",
            "@height": "1063",
            "@width": "1667",
            "@_fa": "true",
            "$": "https://api.elsevier.com/content/object/eid/1-s2.0-S1381116916304472-gr2_lrg.jpg?httpAccept=%2A%2F%2A",
            "@multimediatype": "JPEG image file",
            "@type": "IMAGE-HIGH-RES",
            "@size": "187085",
            "@ref": "gr2",
            "@mimetype": "image/jpeg"
          },
          {
            "@category": "high",
            "@height": "1028",
            "@width": "1667",
            "@_fa": "true",
            "$": "https://api.elsevier.com/content/object/eid/1-s2.0-S1381116916304472-gr3_lrg.jpg?httpAccept=%2A%2F%2A",
            "@multimediatype": "JPEG image file",
            "@type": "IMAGE-HIGH-RES",
            "@size": "182840",
            "@ref": "gr3",
            "@mimetype": "image/jpeg"
          },
          {
            "@category": "high",
            "@height": "889",
            "@width": "2833",
            "@_fa": "true",
            "$": "https://api.elsevier.com/content/object/eid/1-s2.0-S1381116916304472-gr4_lrg.jpg?httpAccept=%2A%2F%2A",
            "@multimediatype": "JPEG image file",
            "@type": "IMAGE-HIGH-RES",
            "@size": "569910",
            "@ref": "gr4",
            "@mimetype": "image/jpeg"
          },
          {
            "@category": "high",
            "@height": "1272",
            "@width": "1667",
            "@_fa": "true",
            "$": "https://api.elsevier.com/content/object/eid/1-s2.0-S1381116916304472-gr5_lrg.jpg?httpAccept=%2A%2F%2A",
            "@multimediatype": "JPEG image file",
            "@type": "IMAGE-HIGH-RES",
            "@size": "169531",
            "@ref": "gr5",
            "@mimetype": "image/jpeg"
          },
          {
            "@category": "high",
            "@height": "1403",
            "@width": "1667",
            "@_fa": "true",
            "$": "https://api.elsevier.com/content/object/eid/1-s2.0-S1381116916304472-gr6_lrg.jpg?httpAccept=%2A%2F%2A",
            "@multimediatype": "JPEG image file",
            "@type": "IMAGE-HIGH-RES",
            "@size": "191406",
            "@ref": "gr6",
            "@mimetype": "image/jpeg"
          },
          {
            "@category": "high",
            "@height": "729",
            "@width": "1417",
            "@_fa": "true",
            "$": "https://api.elsevier.com/content/object/eid/1-s2.0-S1381116916304472-gr7_lrg.jpg?httpAccept=%2A%2F%2A",
            "@multimediatype": "JPEG image file",
            "@type": "IMAGE-HIGH-RES",
            "@size": "71563",
            "@ref": "gr7",
            "@mimetype": "image/jpeg"
          },
          {
            "@category": "high",
            "@height": "813",
            "@width": "2667",
            "@_fa": "true",
            "$": "https://api.elsevier.com/content/object/eid/1-s2.0-S1381116916304472-gr8_lrg.jpg?httpAccept=%2A%2F%2A",
            "@multimediatype": "JPEG image file",
            "@type": "IMAGE-HIGH-RES",
            "@size": "556491",
            "@ref": "gr8",
            "@mimetype": "image/jpeg"
          },
          {
            "@category": "high",
            "@height": "784",
            "@width": "1667",
            "@_fa": "true",
            "$": "https://api.elsevier.com/content/object/eid/1-s2.0-S1381116916304472-gr9_lrg.jpg?httpAccept=%2A%2F%2A",
            "@multimediatype": "JPEG image file",
            "@type": "IMAGE-HIGH-RES",
            "@size": "156125",
            "@ref": "gr9",
            "@mimetype": "image/jpeg"
          },
          {
            "@category": "high",
            "@height": "872",
            "@width": "1419",
            "@_fa": "true",
            "$": "https://api.elsevier.com/content/object/eid/1-s2.0-S1381116916304472-sc1_lrg.jpg?httpAccept=%2A%2F%2A",
            "@multimediatype": "JPEG image file",
            "@type": "IMAGE-HIGH-RES",
            "@size": "76043",
            "@ref": "sc1",
            "@mimetype": "image/jpeg"
          },
          {
            "@category": "high",
            "@height": "514",
            "@width": "1667",
            "@_fa": "true",
            "$": "https://api.elsevier.com/content/object/eid/1-s2.0-S1381116916304472-sc2_lrg.jpg?httpAccept=%2A%2F%2A",
            "@multimediatype": "JPEG image file",
            "@type": "IMAGE-HIGH-RES",
            "@size": "80584",
            "@ref": "sc2",
            "@mimetype": "image/jpeg"
          },
          {
            "@category": "high",
            "@height": "354",
            "@width": "1670",
            "@_fa": "true",
            "$": "https://api.elsevier.com/content/object/eid/1-s2.0-S1381116916304472-sc3_lrg.jpg?httpAccept=%2A%2F%2A",
            "@multimediatype": "JPEG image file",
            "@type": "IMAGE-HIGH-RES",
            "@size": "44842",
            "@ref": "sc3",
            "@mimetype": "image/jpeg"
          },
          {
            "@category": "high",
            "@height": "411",
            "@width": "2335",
            "@_fa": "true",
            "$": "https://api.elsevier.com/content/object/eid/1-s2.0-S1381116916304472-sc4_lrg.jpg?httpAccept=%2A%2F%2A",
            "@multimediatype": "JPEG image file",
            "@type": "IMAGE-HIGH-RES",
            "@size": "73295",
            "@ref": "sc4",
            "@mimetype": "image/jpeg"
          },
          {
            "@category": "high",
            "@height": "442",
            "@width": "3002",
            "@_fa": "true",
            "$": "https://api.elsevier.com/content/object/eid/1-s2.0-S1381116916304472-sc5_lrg.jpg?httpAccept=%2A%2F%2A",
            "@multimediatype": "JPEG image file",
            "@type": "IMAGE-HIGH-RES",
            "@size": "87146",
            "@ref": "sc5",
            "@mimetype": "image/jpeg"
          },
          {
            "@category": "standard",
            "@_fa": "true",
            "$": "https://api.elsevier.com/content/object/eid/1-s2.0-S1381116916304472-mmc1.docx?httpAccept=%2A%2F%2A",
            "@multimediatype": "Microsoft Word file",
            "@type": "APPLICATION",
            "@size": "1988172",
            "@ref": "mmc1",
            "@mimetype": "application/word"
          }
        ]
      },
      "link": {
        "@rel": "abstract",
        "@href": "https://api.elsevier.com/content/abstract/scopus_id/84999106928"
      }
    }
  }
}