{
  "metadata": {
    "title": "Structural studies on a solid self-supported Ziegler–Natta-type catalyst for propylene polymerization",
    "authors": "; ; ",
    "journal": "Journal of Molecular Catalysis A: Chemical",
    "date": "2007-12-14",
    "doi": "10.1016/j.molcata.2007.08.027",
    "abstract": "",
    "uri": "https://api.elsevier.com/content/article/pii/S1381116907004980",
    "pii": "S1381116907004980"
  },
  "fulltext": {
    "full-text-retrieval-response": {
      "scopus-eid": "2-s2.0-35748971415",
      "originalText": "serial JL 271358 291210 291744 291790 291809 31 Journal of Molecular Catalysis A: Chemical JOURNALMOLECULARCATALYSISACHEMICAL 2007-09-02 2007-09-02 2010-03-27T18:10:43 1-s2.0-S1381116907004980 S1381-1169(07)00498-0 S1381116907004980 10.1016/j.molcata.2007.08.027 S300 S300.1 FULL-TEXT 1-s2.0-S1381116907X02607 2015-05-15T05:56:33.307883-04:00 0 0 20071214 2007 2007-09-02T00:00:00Z articleinfo crossmark dco dateupdated tomb dateloaded datesearch indexeddate issuelist volumelist yearnav absattachment articletitlenorm authfirstinitialnorm authfirstsurnamenorm cid cids contenttype copyright dateloadedtxt docsubtype doctype doi eid ewtransactionid hubeid issfirst issn issnnorm itemstage itemtransactionid itemweight openaccess openarchive pg pgfirst pglast pii piinorm pubdatestart pubdatetxt pubyr sectiontitle sortorder srctitle srctitlenorm srctype subheadings volfirst volissue webpdf webpdfpagecount figure table body acknowledge affil articletitle auth authfirstini authfull authkeywords authlast primabst ref specialabst alllist content subj ssids 1381-1169 13811169 278 278 1 2 1 2 Volume 278, Issues 1–2 21 127 134 127 134 20071214 14 December 2007 2007-12-14 2007 Regular papers article fla Copyright © 2007 Elsevier B.V. All rights reserved. STRUCTURALSTUDIESASOLIDSELFSUPPORTEDZIEGLERNATTATYPECATALYSTFORPROPYLENEPOLYMERIZATION RONKKO H 1 Introduction 2 Experimental 2.1 Preparation of solid catalyst 2.2 Polymerizations 2.3 Characterization methods 2.3.1 BET method 2.3.2 Scanning electron microscopy 2.3.3 Powder X-ray diffraction measurements 2.3.4 Infrared spectroscopy 2.3.5 Raman spectroscopy 2.3.6 Moisture treatment of the catalyst sample 3 Results and discussion 3.1 Polymerization activity 3.2 Catalyst morphology and inner structure 3.3 Moisture treatment of the catalyst sample 4 Conclusions Acknowledgments References KAROL 1999 277 F ERTL 1999 G PREPARATIONSOLIDCATALYSTS DUSSEAULT 1993 103 J LEOFANTI 1998 207 G NIEMANTSVERDRIET 1995 J SPECTSOSCOPYINCATALYSISINTRODUCTION BRAMBILLA 2004 287 L ARZOUMANIDIS 1990 147 G ABBOUD 2005 1220 M DINOTO 1996 3827 V KIS 1997 123 E SOCRATES 2004 G RAMANCHARACTERISTICGROUPFREQUENCIESTABLESCHARTS VITTADELLO 2006 2513 M DINOTO 1992 161 V DINOTO 1991 279 V DINOTO 1991 223 V CHANG 2006 347 M RONKKOX2007X127 RONKKOX2007X127X134 RONKKOX2007X127XH RONKKOX2007X127X134XH item S1381-1169(07)00498-0 S1381116907004980 1-s2.0-S1381116907004980 10.1016/j.molcata.2007.08.027 271358 2010-09-17T22:46:39.38017-04:00 2007-12-14 1-s2.0-S1381116907004980-main.pdf https://s3.amazonaws.com/prod-ucs-content-store-us-east/content/pii:S1381116907004980/MAIN/application/pdf/f9b15675b13fcf84eaccbf1435088fe7/main.pdf https://s3-eu-west-1.amazonaws.com/prod-ucs-content-store-eu-west/content/pii:S1381116907004980/MAIN/application/pdf/f9b15675b13fcf84eaccbf1435088fe7/main.pdf main.pdf pdf true 1003679 MAIN 8 1-s2.0-S1381116907004980-main_1.png https://s3.amazonaws.com/prod-ucs-content-store-us-east/content/pii:S1381116907004980/PREVIEW/image/png/dbec62fb78bc14ee7b307794884dd2a9/main_1.png https://s3-eu-west-1.amazonaws.com/prod-ucs-content-store-eu-west/content/pii:S1381116907004980/PREVIEW/image/png/dbec62fb78bc14ee7b307794884dd2a9/main_1.png main_1.png png 71375 849 656 IMAGE-WEB-PDF 1 1-s2.0-S1381116907004980-gr1.jpg https://s3.amazonaws.com/prod-ucs-content-store-us-east/content/pii:S1381116907004980/gr1/DOWNSAMPLED/image/jpeg/3d71e1e27c3f1f7596ffc636ec397e08/gr1.jpg https://s3-eu-west-1.amazonaws.com/prod-ucs-content-store-eu-west/content/pii:S1381116907004980/gr1/DOWNSAMPLED/image/jpeg/3d71e1e27c3f1f7596ffc636ec397e08/gr1.jpg gr1 gr1.jpg jpg 38131 365 545 IMAGE-DOWNSAMPLED 1-s2.0-S1381116907004980-gr1.sml https://s3.amazonaws.com/prod-ucs-content-store-us-east/content/pii:S1381116907004980/gr1/THUMBNAIL/image/gif/a93ed307329781e6aba1c5f7591ee99d/gr1.sml https://s3-eu-west-1.amazonaws.com/prod-ucs-content-store-eu-west/content/pii:S1381116907004980/gr1/THUMBNAIL/image/gif/a93ed307329781e6aba1c5f7591ee99d/gr1.sml gr1 gr1.sml sml 1241 84 125 IMAGE-THUMBNAIL 1-s2.0-S1381116907004980-gr10.jpg https://s3.amazonaws.com/prod-ucs-content-store-us-east/content/pii:S1381116907004980/gr10/DOWNSAMPLED/image/jpeg/4e989427e7e4f75518454f0cb9cf8ac3/gr10.jpg https://s3-eu-west-1.amazonaws.com/prod-ucs-content-store-eu-west/content/pii:S1381116907004980/gr10/DOWNSAMPLED/image/jpeg/4e989427e7e4f75518454f0cb9cf8ac3/gr10.jpg gr10 gr10.jpg jpg 37578 283 376 IMAGE-DOWNSAMPLED 1-s2.0-S1381116907004980-gr10.sml https://s3.amazonaws.com/prod-ucs-content-store-us-east/content/pii:S1381116907004980/gr10/THUMBNAIL/image/gif/7da2af7797f587671c467637f6716531/gr10.sml https://s3-eu-west-1.amazonaws.com/prod-ucs-content-store-eu-west/content/pii:S1381116907004980/gr10/THUMBNAIL/image/gif/7da2af7797f587671c467637f6716531/gr10.sml gr10 gr10.sml sml 3363 93 124 IMAGE-THUMBNAIL 1-s2.0-S1381116907004980-gr11.jpg https://s3.amazonaws.com/prod-ucs-content-store-us-east/content/pii:S1381116907004980/gr11/DOWNSAMPLED/image/jpeg/e70db5649ec65edcccea476ccc79197e/gr11.jpg https://s3-eu-west-1.amazonaws.com/prod-ucs-content-store-eu-west/content/pii:S1381116907004980/gr11/DOWNSAMPLED/image/jpeg/e70db5649ec65edcccea476ccc79197e/gr11.jpg gr11 gr11.jpg jpg 29115 161 376 IMAGE-DOWNSAMPLED 1-s2.0-S1381116907004980-gr11.sml https://s3.amazonaws.com/prod-ucs-content-store-us-east/content/pii:S1381116907004980/gr11/THUMBNAIL/image/gif/76b73564566b332351af355835bc7bbe/gr11.sml https://s3-eu-west-1.amazonaws.com/prod-ucs-content-store-eu-west/content/pii:S1381116907004980/gr11/THUMBNAIL/image/gif/76b73564566b332351af355835bc7bbe/gr11.sml gr11 gr11.sml sml 1286 53 125 IMAGE-THUMBNAIL 1-s2.0-S1381116907004980-gr12.jpg https://s3.amazonaws.com/prod-ucs-content-store-us-east/content/pii:S1381116907004980/gr12/DOWNSAMPLED/image/jpeg/734356ed41b6512ea040a662aeba0bc2/gr12.jpg https://s3-eu-west-1.amazonaws.com/prod-ucs-content-store-eu-west/content/pii:S1381116907004980/gr12/DOWNSAMPLED/image/jpeg/734356ed41b6512ea040a662aeba0bc2/gr12.jpg gr12 gr12.jpg jpg 30669 181 372 IMAGE-DOWNSAMPLED 1-s2.0-S1381116907004980-gr12.sml https://s3.amazonaws.com/prod-ucs-content-store-us-east/content/pii:S1381116907004980/gr12/THUMBNAIL/image/gif/e2a1050a0579d435e9e7b46217569a57/gr12.sml https://s3-eu-west-1.amazonaws.com/prod-ucs-content-store-eu-west/content/pii:S1381116907004980/gr12/THUMBNAIL/image/gif/e2a1050a0579d435e9e7b46217569a57/gr12.sml gr12 gr12.sml sml 1420 61 125 IMAGE-THUMBNAIL 1-s2.0-S1381116907004980-gr2.jpg https://s3.amazonaws.com/prod-ucs-content-store-us-east/content/pii:S1381116907004980/gr2/DOWNSAMPLED/image/jpeg/7a7aa52ae6286b63afa34a5706278389/gr2.jpg https://s3-eu-west-1.amazonaws.com/prod-ucs-content-store-eu-west/content/pii:S1381116907004980/gr2/DOWNSAMPLED/image/jpeg/7a7aa52ae6286b63afa34a5706278389/gr2.jpg gr2 gr2.jpg jpg 31889 257 370 IMAGE-DOWNSAMPLED 1-s2.0-S1381116907004980-gr2.sml https://s3.amazonaws.com/prod-ucs-content-store-us-east/content/pii:S1381116907004980/gr2/THUMBNAIL/image/gif/39bef4f69fad2456d1870700c6013445/gr2.sml https://s3-eu-west-1.amazonaws.com/prod-ucs-content-store-eu-west/content/pii:S1381116907004980/gr2/THUMBNAIL/image/gif/39bef4f69fad2456d1870700c6013445/gr2.sml gr2 gr2.sml sml 1673 87 125 IMAGE-THUMBNAIL 1-s2.0-S1381116907004980-gr3.gif https://s3.amazonaws.com/prod-ucs-content-store-us-east/content/pii:S1381116907004980/gr3/DOWNSAMPLED/image/gif/c3d639b96e30567453378c41bf851cd5/gr3.gif https://s3-eu-west-1.amazonaws.com/prod-ucs-content-store-eu-west/content/pii:S1381116907004980/gr3/DOWNSAMPLED/image/gif/c3d639b96e30567453378c41bf851cd5/gr3.gif gr3 gr3.gif gif 9652 252 373 IMAGE-DOWNSAMPLED 1-s2.0-S1381116907004980-gr3.sml https://s3.amazonaws.com/prod-ucs-content-store-us-east/content/pii:S1381116907004980/gr3/THUMBNAIL/image/gif/7e304aa63c4d9860a63e03e7ad30b9d5/gr3.sml https://s3-eu-west-1.amazonaws.com/prod-ucs-content-store-eu-west/content/pii:S1381116907004980/gr3/THUMBNAIL/image/gif/7e304aa63c4d9860a63e03e7ad30b9d5/gr3.sml gr3 gr3.sml sml 1801 85 125 IMAGE-THUMBNAIL 1-s2.0-S1381116907004980-gr4.gif https://s3.amazonaws.com/prod-ucs-content-store-us-east/content/pii:S1381116907004980/gr4/DOWNSAMPLED/image/gif/aaae63a28cbe58aaabdf5eb5df1ccd90/gr4.gif https://s3-eu-west-1.amazonaws.com/prod-ucs-content-store-eu-west/content/pii:S1381116907004980/gr4/DOWNSAMPLED/image/gif/aaae63a28cbe58aaabdf5eb5df1ccd90/gr4.gif gr4 gr4.gif gif 9991 257 376 IMAGE-DOWNSAMPLED 1-s2.0-S1381116907004980-gr4.sml https://s3.amazonaws.com/prod-ucs-content-store-us-east/content/pii:S1381116907004980/gr4/THUMBNAIL/image/gif/86ee5338f853115eb7ee100c20db8f07/gr4.sml https://s3-eu-west-1.amazonaws.com/prod-ucs-content-store-eu-west/content/pii:S1381116907004980/gr4/THUMBNAIL/image/gif/86ee5338f853115eb7ee100c20db8f07/gr4.sml gr4 gr4.sml sml 1787 85 125 IMAGE-THUMBNAIL 1-s2.0-S1381116907004980-gr5.gif https://s3.amazonaws.com/prod-ucs-content-store-us-east/content/pii:S1381116907004980/gr5/DOWNSAMPLED/image/gif/51ecaef9ab1d1768869ce60f85f526b3/gr5.gif https://s3-eu-west-1.amazonaws.com/prod-ucs-content-store-eu-west/content/pii:S1381116907004980/gr5/DOWNSAMPLED/image/gif/51ecaef9ab1d1768869ce60f85f526b3/gr5.gif gr5 gr5.gif gif 4701 266 368 IMAGE-DOWNSAMPLED 1-s2.0-S1381116907004980-gr5.sml https://s3.amazonaws.com/prod-ucs-content-store-us-east/content/pii:S1381116907004980/gr5/THUMBNAIL/image/gif/c44f889aa0f140b0e4dc2bcda55313c6/gr5.sml https://s3-eu-west-1.amazonaws.com/prod-ucs-content-store-eu-west/content/pii:S1381116907004980/gr5/THUMBNAIL/image/gif/c44f889aa0f140b0e4dc2bcda55313c6/gr5.sml gr5 gr5.sml sml 1021 90 125 IMAGE-THUMBNAIL 1-s2.0-S1381116907004980-gr6.jpg https://s3.amazonaws.com/prod-ucs-content-store-us-east/content/pii:S1381116907004980/gr6/DOWNSAMPLED/image/jpeg/38dde3f21c277cb30a45851a2378cf50/gr6.jpg https://s3-eu-west-1.amazonaws.com/prod-ucs-content-store-eu-west/content/pii:S1381116907004980/gr6/DOWNSAMPLED/image/jpeg/38dde3f21c277cb30a45851a2378cf50/gr6.jpg gr6 gr6.jpg jpg 44475 276 376 IMAGE-DOWNSAMPLED 1-s2.0-S1381116907004980-gr6.sml https://s3.amazonaws.com/prod-ucs-content-store-us-east/content/pii:S1381116907004980/gr6/THUMBNAIL/image/gif/54f38c44aaf4654895afb3c2b2dec122/gr6.sml https://s3-eu-west-1.amazonaws.com/prod-ucs-content-store-eu-west/content/pii:S1381116907004980/gr6/THUMBNAIL/image/gif/54f38c44aaf4654895afb3c2b2dec122/gr6.sml gr6 gr6.sml sml 5572 92 125 IMAGE-THUMBNAIL 1-s2.0-S1381116907004980-gr7.jpg https://s3.amazonaws.com/prod-ucs-content-store-us-east/content/pii:S1381116907004980/gr7/DOWNSAMPLED/image/jpeg/07d82dfa52f14c6845f6b99f23d5136d/gr7.jpg https://s3-eu-west-1.amazonaws.com/prod-ucs-content-store-eu-west/content/pii:S1381116907004980/gr7/DOWNSAMPLED/image/jpeg/07d82dfa52f14c6845f6b99f23d5136d/gr7.jpg gr7 gr7.jpg jpg 60723 281 376 IMAGE-DOWNSAMPLED 1-s2.0-S1381116907004980-gr7.sml https://s3.amazonaws.com/prod-ucs-content-store-us-east/content/pii:S1381116907004980/gr7/THUMBNAIL/image/gif/bff6e557489b6861b7e9726788c6b9f3/gr7.sml https://s3-eu-west-1.amazonaws.com/prod-ucs-content-store-eu-west/content/pii:S1381116907004980/gr7/THUMBNAIL/image/gif/bff6e557489b6861b7e9726788c6b9f3/gr7.sml gr7 gr7.sml sml 4571 94 125 IMAGE-THUMBNAIL 1-s2.0-S1381116907004980-gr8.jpg https://s3.amazonaws.com/prod-ucs-content-store-us-east/content/pii:S1381116907004980/gr8/DOWNSAMPLED/image/jpeg/4d99a37940f25917a61ceaa9198bcd21/gr8.jpg https://s3-eu-west-1.amazonaws.com/prod-ucs-content-store-eu-west/content/pii:S1381116907004980/gr8/DOWNSAMPLED/image/jpeg/4d99a37940f25917a61ceaa9198bcd21/gr8.jpg gr8 gr8.jpg jpg 38677 279 376 IMAGE-DOWNSAMPLED 1-s2.0-S1381116907004980-gr8.sml https://s3.amazonaws.com/prod-ucs-content-store-us-east/content/pii:S1381116907004980/gr8/THUMBNAIL/image/gif/5d8c773e14de13ae3c6aee4bebcf586c/gr8.sml https://s3-eu-west-1.amazonaws.com/prod-ucs-content-store-eu-west/content/pii:S1381116907004980/gr8/THUMBNAIL/image/gif/5d8c773e14de13ae3c6aee4bebcf586c/gr8.sml gr8 gr8.sml sml 3276 93 125 IMAGE-THUMBNAIL 1-s2.0-S1381116907004980-gr9.jpg https://s3.amazonaws.com/prod-ucs-content-store-us-east/content/pii:S1381116907004980/gr9/DOWNSAMPLED/image/jpeg/a5d53386182bf2a828265003eb81d855/gr9.jpg https://s3-eu-west-1.amazonaws.com/prod-ucs-content-store-eu-west/content/pii:S1381116907004980/gr9/DOWNSAMPLED/image/jpeg/a5d53386182bf2a828265003eb81d855/gr9.jpg gr9 gr9.jpg jpg 59810 281 376 IMAGE-DOWNSAMPLED 1-s2.0-S1381116907004980-gr9.sml https://s3.amazonaws.com/prod-ucs-content-store-us-east/content/pii:S1381116907004980/gr9/THUMBNAIL/image/gif/166e6c9e197672c788f3a46b786b1e34/gr9.sml https://s3-eu-west-1.amazonaws.com/prod-ucs-content-store-eu-west/content/pii:S1381116907004980/gr9/THUMBNAIL/image/gif/166e6c9e197672c788f3a46b786b1e34/gr9.sml gr9 gr9.sml sml 3788 94 125 IMAGE-THUMBNAIL 1-s2.0-S1381116907004980-sc1.gif https://s3.amazonaws.com/prod-ucs-content-store-us-east/content/pii:S1381116907004980/sc1/DOWNSAMPLED/image/gif/72959be027fd12aacf95b6bdcfbb425c/sc1.gif https://s3-eu-west-1.amazonaws.com/prod-ucs-content-store-eu-west/content/pii:S1381116907004980/sc1/DOWNSAMPLED/image/gif/72959be027fd12aacf95b6bdcfbb425c/sc1.gif sc1 sc1.gif gif 17043 470 526 IMAGE-DOWNSAMPLED 1-s2.0-S1381116907004980-sc1.sml https://s3.amazonaws.com/prod-ucs-content-store-us-east/content/pii:S1381116907004980/sc1/THUMBNAIL/image/gif/8cff83731c32c2c51cb096f2216262dd/sc1.sml https://s3-eu-west-1.amazonaws.com/prod-ucs-content-store-eu-west/content/pii:S1381116907004980/sc1/THUMBNAIL/image/gif/8cff83731c32c2c51cb096f2216262dd/sc1.sml sc1 sc1.sml sml 1407 93 104 IMAGE-THUMBNAIL 1-s2.0-S1381116907004980-fx1.jpg https://s3.amazonaws.com/prod-ucs-content-store-us-east/content/pii:S1381116907004980/fx1/DOWNSAMPLED/image/jpeg/598291c7a3f6bb5d3a39a3b3567d35c9/fx1.jpg https://s3-eu-west-1.amazonaws.com/prod-ucs-content-store-eu-west/content/pii:S1381116907004980/fx1/DOWNSAMPLED/image/jpeg/598291c7a3f6bb5d3a39a3b3567d35c9/fx1.jpg fx1 true fx1.jpg jpg 27883 183 244 IMAGE-DOWNSAMPLED 1-s2.0-S1381116907004980-fx1.sml https://s3.amazonaws.com/prod-ucs-content-store-us-east/content/pii:S1381116907004980/fx1/THUMBNAIL/image/gif/505393b1fbd24e476d821249aaeb9e91/fx1.sml https://s3-eu-west-1.amazonaws.com/prod-ucs-content-store-eu-west/content/pii:S1381116907004980/fx1/THUMBNAIL/image/gif/505393b1fbd24e476d821249aaeb9e91/fx1.sml fx1 true fx1.sml sml 3394 93 124 IMAGE-THUMBNAIL MOLCAA 6901 S1381-1169(07)00498-0 10.1016/j.molcata.2007.08.027 Elsevier B.V. Scheme 1 Main reactions of the catalyst preparation. Fig. 1 Powder X-ray diffractogram of the catalyst sample. Fig. 2 Mid-IR spectrum of the self-supported catalyst sample. Fig. 3 Far-IR spectrum of the self-supported catalyst sample. Fig. 4 Raman spectrum of the self-supported catalyst sample. Fig. 5 Raman spectrum of MgCl2. Fig. 6 Optical microscope image of the catalyst particles. Fig. 7 SEM photograph of the catalyst particles. Fig. 8 SEM photograph of the catalyst particle. Fig. 9 SEM photograph of the ruptured catalyst particle. Fig. 10 SEM photograph from the surface of the catalyst particle. Fig. 11 SEM/EDS mapping of the catalyst particle. Fig. 12 SEM/EDS mapping of the catalyst particle after moisture treatment. Table 1 Characteristic IR and Raman vibrations of the catalyst sample Vibration Type of vibration Region (cm−1) IR Raman C–HAr Stretching 3070 3080 CH2/CH3 Stretching 2800–3000 2800–3000 CO Stretching 1684 1685 C C Ar Stretching – 1592 CH2/CH3 Deformation vibration 1454 1449 CH3 Symmetric deformation vibration 1392 1395 C–O–C Asymmetric stretching 1308 1302 C–O–C Symmetric stretching 1156 1156 C–HAr In plane deformation vibration – 1140 O–CO Asymmetric stretching 1082 – C–HAr In plane deformation vibration – 1052 O–CO Symmetric stretching 934 – C–H Out of plane deformation vibration 736 647 M–O (Mg–O or Ti–O) Stretching 460 – Titanium compound Stretching – 419 M–O (Mg–O or Ti–O) Stretching 350 350 M–O (Mg–O or Ti–O) Stretching 314 303 Ti–Cl Stretching 375 – Ti–Cl Stretching 365 – Ti–Cl Stretching 382 – Mg–Cl Stretching 233 238 Mg–Cl Stretching 242 – Structural studies on a solid self-supported Ziegler–Natta-type catalyst for propylene polymerization Hanna-Leena Rönkkö a Hilkka Knuuttila a ⁎ Peter Denifl b Timo Leinonen b Tapani Venäläinen a a Department of Chemistry, University of Joensuu, P.O. Box 111, FIN-80101 Joensuu, Finland b Borealis Polymers Oy, P.O. Box 330, FIN-06101 Porvoo, Finland ⁎ Corresponding author at: Yliopistokatu 7, FIN-80101 Joensuu, Finland. Tel.: +358 13 251 3350; fax: +358 13 251 3390. Graphical abstract The article describes structural studies on a solid MgCl2-based TiCl4 Ziegler–Natta catalyst for propylene polymerization prepared via emulsion technique. Although the surface area of this self-supported catalyst sample is exceptionally low, the activity is high. SEM measurements revealed an intriguing structure: evidently the catalyst particle is composed of nanoribbons (figure) that extend from the center of the particle to the surface. The article describes structural studies on a solid MgCl2-based TiCl4 Ziegler–Natta catalyst for propylene polymerization prepared via emulsion technique. Surface area of the catalyst sample was found to be very low. Polymerization activity of the catalyst was nevertheless high. Powder X-ray diffraction (XRD) measurements indicated the presence of δ-MgCl2 in the catalyst sample, and IR and Raman studies the presence of a Mg–Cl bond. Scanning electron microscopy (SEM) measurements revealed an intriguing structure: evidently the catalyst particle is composed of chains (or nanoribbons) that extend from the center of the particle to the surface. SEM measurements further revealed spherical species (diameter about 60nm) on the surface. Scanning electron microscopy/energy dispersive spectroscopy (SEM/EDS) mappings indicated a high content of titanium evenly distributed throughout the particle, but after moisture treatment of the sample the content was evenly decreased. Keywords Ziegler–Natta catalyst MgCl2 Propylene polymerization IR Raman 1 Introduction Ever since its discovery in the 1950s, the Ziegler–Natta catalyst has played an essential role in the production of polyolefin plastics. The Ziegler–Natta catalysts enable the preparation of polyolefin plastics under conditions of low pressure and temperature. The conventional Ziegler–Natta polypropylene catalyst consists of a MgCl2 support and transition metal component, usually TiCl4 together with the cocatalyst which is usually an aluminum alkyl, such as triethyl aluminum (TEA) or ethyl aluminum dichloride (EADC). Internal and external electron donor compounds are used to control the stereoselectivity. The internal donor is added during the catalyst preparation and the external donor, together with the cocatalyst, to the polymerization reactor [1]. The spherical MgCl2 support for propylene catalysts is prepared in a variety of ways. The methods most widely employed by industry are precipitation and emulsion [2]. Spray crystallization is occasionally used [3,4]. Spray drying and fast quenching methods have been applied as well, but a number of problems remain to be solved (low yield of adduct, fragility, complexity of the process). In the preparation of the MgCl2-supported TiCl4 catalyst, the active component (TiCl4) can be fixed on the MgCl2 support by one of the various methods [5]. Typical methods are impregnation and refluxing for a specific time at a specific temperature [6]. A porous structure with large surface area is obtained. Ziegler–Natta catalysts for ethylene and propylene polymerization are widely studied and are characterized by many methods. But still, the accurate structure of the catalysts has not been completely solved. Characterization of the structure of a catalyst and the way the catalyst works can offer significant support to catalyst design and development. Also, better control of the polymerization process can be achieved by understanding the relationship between structure and properties of a catalyst. It would be useful to find a relatively easy and quick method of characterization, which indicates, for example, whether the catalyst is active. Nitrogen adsorption is recommended and generally used for the study of surface areas larger than 5m2/g at low temperature. Argon adsorption is a less common method to measure the adsorption at low temperature. Nitrogen adsorption at 77K is used to study mesoporous samples and argon adsorption at 87K to study microporous solids. Brunauer–Emmett–Teller (BET) method is the most common tool for measurement of the surface area of solids [7]. Because the surface area of the present catalyst sample was low, both nitrogen and argon adsorption were applied in measuring the BET surface area. Electron microscopy is a relatively simple technique for determining particle size and shape and it can even reveal information about the composition and inner structure of a catalyst particle [8]. Scanning electron microscopy (SEM) with elemental analysis was used as an additional technique in the present study. X-ray diffraction (XRD) is one of the oldest and most widely used techniques for the study of catalysts. XRD is used to identify bulk phases, to describe the kinetics of bulk transformation, and to estimate particle sizes [8]. We used XRD to determine the crystal structure of the catalyst sample and the presence of MgCl2 in the sample. The use of IR spectroscopy in the characterization of heterogeneous Ziegler–Natta catalysts has intensified in recent years. The most intensely studied region in the IR spectra of catalyst samples is 1800–1600cm−1, where the frequency of νCO (internal electron donor) appears. The far-IR region is also important, where the signals of metal–chloride and metal–oxygen bonds occur. Interpretation of the far-IR region is not easy, however, especially for MgCl2-supported catalysts, because the characteristic signals of the catalyst complex tend to be weak compared with the vibrational transitions of MgCl2. Raman spectroscopy is less often used in catalyst characterization. However, the Raman spectra of MgCl2-supported Ziegler–Natta catalysts are relatively easy to interpret, and the signals of TiCl4 and MgCl2 can be isolated [9,10]. Raman spectroscopy might therefore be a more useful technique than IR spectroscopy to study the MgCl2-based Ziegler–Natta catalyst. In this work we were interested in the signals of Mg–Cl and Ti–Cl bonds and metal–oxygen bonds. The methods described above were applied to elucidate the structural features of a solid self-supported Ziegler–Natta-type polypropylene catalyst prepared by an emulsion technique patented by Borealis Polymers Oy [11]. The emulsion technique represents a unique approach to the preparation of polymerization catalysts. In conventional polypropylene catalysts the active species are fixed to the solid support, whereas in studied catalyst the solid support is formed during the catalyst preparation process as an integral part of the catalyst particle. The catalyst can thus be described as self-supported. Traditionally, the Ziegler–Natta catalyst has a large surface area, which is thought to be the prerequisite for high-polymerization activity. The surface area of studied catalyst was exceptionally low, but still the activity of the catalyst was very good. 2 Experimental 2.1 Preparation of solid catalyst The catalyst was synthesized by a novel emulsion method developed by Borealis Polymers Oy. Main reactions of the catalyst preparation are presented in Scheme 1 . The first stage of the preparation consisted of in situ formation of a liquid/liquid two-phase system where one phase was a solution of the catalyst components in an inert solvent. In the first step of stage 1, butyl octyl magnesium (BOMAG) and 2-ethyl-1-hexanol were reacted to magnesium alkoxide. In step 2 the magnesium alkoxide (formed in step 1) was allowed to react with phthaloyl dichloride (PDC) at 60°C and the MgCl2/DEHP complex was formed. Di(ethylhexyl)phthalate (DEHP) is also known as di(octyl)phthalate (DOP). In step 3 the MgCl2/DEHP complex was reacted with TiCl4 and a liquid/liquid two-phase system was formed. In the second stage the catalyst droplets were stabilized through an addition of surfactant (emulsification). The final stage, solidification of the catalyst droplets, was achieved by changing the reaction conditions of the emulsion system. The catalyst particles were then isolated and dried [11]. 2.2 Polymerizations The propylene bulk polymerizations were carried out in a stirred 5-l tank reactor in Borealis Polymers’ catalyst laboratory. The cocatalyst was triethyl aluminum (TEA) and the external donor cyclohexyl methyl dimethoxy silane (CMMS). Al/Ti mole ratio and Al/CMMS mole ratio were 250mol/mol and 10mol/mol, respectively. In the polymerization the cocatalyst, external donor, and 30ml n-pentane were first mixed and allowed to react for 5min. Half of the mixture was then added to the polymerization reactor and the other half was mixed with about 20mg of catalyst. After an additional 5min, the catalyst/TEA/donor/n-pentane mixture was added to the reactor. Seventy-millimole hydrogen and 1400g propylene were introduced into the reactor and the temperature was raised within ca. 15min to 70°C. The polymerization time after reaching polymerization temperature was 60min. 2.3 Characterization methods 2.3.1 BET method Surface area of the catalyst sample was determined by Brunauer–Emmett–Teller (BET) method via nitrogen adsorption and argon adsorption. The instrument was a Micromeritics ASAP 2010. Both N2 gas and Ar gas were used at their liquefaction temperatures (77K and 87K, respectively). Samples were handled and packed to the analysis tubes under nitrogen atmosphere and the surface area measurements were carried out inertly. 2.3.2 Scanning electron microscopy A high-resolution Hitachi S4800 field emission scanning electron microscope was used in the scanning electron microscopy (SEM) measurements. The catalyst sample was preserved under nitrogen atmosphere. Before the measurements the sample was quickly fixed on a glue-covered tape and then quickly moved to the loading chamber of the electron microscope. Voltage and the working distance varied during the measurements as noted on the SEM photographs. The energy dispersive spectroscopic analyses (SEM/EDS) were done in the laboratory of Borealis Polymers Oy. The SEM equipment was a JEOL 840 and the EDS equipment a Princeton Gamma-Tech (PGT) with Omega detector. 2.3.3 Powder X-ray diffraction measurements The instrument used for the powder X-ray diffraction measurements was a Bruker AXS, D8 Advance X-ray diffractometer. The catalyst sample was placed on the special sample holder made of stainless steel, and the holder was sealed with a thin Mylar film of 3.6μm so that the measurement could be performed inertly. The step size in the XRD measurements was 0.04° and the time per step was 8s. 2.3.4 Infrared spectroscopy The mid-IR spectra of the catalyst samples were measured using a Nicolet Impact 400 D infrared spectroscope. The equipment was mounted inside a glove box so that samples could be measured by inert diffuse reflectance infrared Fourier transform (DRIFT) method. The measuring range was 4000–650cm−1. Far-IR spectra were measured at the University of Helsinki (Department of Inorganic Chemistry) with a Perkin-Elmer Spectrum GX spectroscope. Measurements were carried out in the area 30–710cm−1 but the area reported was defined between 200cm−1 and 650cm−1 because the most important vibrations can be assumed to occur in this area, and below 200cm−1 the noise was too disruptive. Far-IR measurements were performed by two methods: in KBr and in Nujol mull on polystyrene film. The both methods gave similar results. 2.3.5 Raman spectroscopy Raman measurements were carried out using red (633nm), green (515), and UV (325nm) lasers at the Mikkeli Technology Center on Jobin Yvon Horiba HR 800 UV equipment. Samples were packed in quartz glass capillaries in nitrogen atmosphere. Unfortunately, catalyst samples were destroyed during the measurements (with all lasers mentioned above). Subsequently, samples were however successfully measured with the FT-Raman spectrometer RFS100/S from Bruker Optics GmbH, using a laser of 1064nm. Fluorescence was corrected with the concave rubberband correction method. 2.3.6 Moisture treatment of the catalyst sample The catalyst sample was treated with toluene of known moisture content to study the effect of moisture on the catalyst structure. The moisture content in toluene was 120ppm. After the moisture treatment the sample was studied by SEM and SEM/EDS, and elemental analysis was carried out. 3 Results and discussion 3.1 Polymerization activity The catalyst characterized in this study obtained activity of 23.1–35.5kgPP/(gcath) in propylene bulk polymerization. Melt mass-flow rate (230°C/2.16kg) was in the range of 4–5.8g/10min and xylene solubility was 1.4–1.5wt%. 3.2 Catalyst morphology and inner structure The surface area of the catalyst sample was determined with use of both nitrogen (77K) and argon (87K) gases. The results obtained with the two gases were similar: the surface area was only about 2m2/g, which is an exceptionally low value for a polymerization catalyst. The corresponding value of the reference catalyst (conventional MgCl2-supported PP catalyst) may be 300m2/g or more [12]. The powder X-ray diffractogram of the catalyst sample is presented in Fig. 1 . Signals at 16.3°, 28–37°, and 50.4° and the profiles of those signals correspond to structurally disordered δ-MgCl2, while the signals at the 2θ values of 38.3°, 44.5°, 64.7°, and 77.8° are due to the stainless steel sample holder. The signal at about 16.3° is related to the stacking of Cl–Mg–Cl triple layers along the crystallographic direction. Signals at 28–37° and 50.4° are related to stacking faults in the triple layers [13,14]. The primary interest in the IR and Raman measurements was the signals of the Ti–Cl, Mg–Cl, Ti–O, and Mg–O bonds. Also, the signals of the electron donor were studied. Fig. 2 presents the mid-IR spectrum and Fig. 3 the far-IR spectrum of the self-supported catalyst sample. The Raman spectrum of the same sample is presented in Fig. 4 . The characteristic IR and Raman vibrations are collected in Table 1 . The typical signals of the alkyl groups are seen in the mid-IR (Fig. 2) and Raman (Fig. 4) spectra of the catalyst sample. The signal at 3080cm−1 with strong intensity in the Raman spectrum and weak intensity in the mid-IR spectrum is due to the stretching vibration of the ring C–H bonds [15]. The mid-IR spectrum (Fig. 2) shows a signal at 736cm−1 due to the aromatic out-of-plane C–H deformation vibrations and ring out-of-plane vibrations, indicating that the aromatic ring is 1,2-disubstituted. No signal appears in the area 660–730cm−1, indicating that the substituents are identical (IR inactive). The Raman spectrum (Fig. 4) exhibits a strong signal at about 650cm−1 due to the ring vibrations. The weak signals at 1492–1555cm−1 in the mid-IR spectrum are due to aromatic CC stretching vibrations, and the doublet at 1578cm−1 and 1591cm−1 is due to aromatic ring where CO is directly conjugated to the ring. The signal at 1592cm−1 in the Raman spectrum (Fig. 4) is due to aromatic CC stretching vibrations. Often this is the strongest signal of the Raman spectrum [15]. The intense signal at 1684cm−1 in the IR spectrum (Fig. 2) and the weak signal at 1685cm−1 in the Raman spectrum (Fig. 4) are due to the CO stretching vibrations of the carbonyl group of the ester. The signals of the asymmetric and symmetric stretching vibrations of C–O–C are present in the IR spectrum of the catalyst sample (Fig. 2) at 1308cm−1 and 1156cm−1, respectively, with strong intensity. In the Raman spectrum (Fig. 4) these signals exist at 1302cm−1 and 1156cm−1 with medium and weak intensities, respectively. The signal at 1044cm−1 with weak intensity in the IR spectrum and at 1052cm−1 with medium intensity in the Raman spectrum is due to the ring stretching vibrations. The far-IR spectrum of the catalyst sample (Fig. 3) shows a signal at 242cm−1 due to the Mg–Cl bond. There is also a signal at 235cm−1 in the IR spectrum and at 238cm−1 in the Raman spectrum (Fig. 4), which may be due to the Mg–Cl bond [16]. A strong signal at 243cm−1 can also be found in the Raman spectrum of MgCl2 (Fig. 5 , measured with UV-laser). The signal at 375cm−1 in the IR spectrum of the catalyst sample is due to the Ti–Cl bond, where Cl is terminal and the titanium is six-coordinated. The shoulders at 365cm−1 and 382cm−1 are also due to the terminal Ti–Cl bond [15]. The signal at 419cm−1 in the Raman spectrum of the sample (Fig. 4) is the signal of the titanium compound [17]. The Raman spectrum of the catalyst sample also shows signals at 308cm−1 and 350cm−1, which appear in the far-IR spectrum at 314cm−1 and 350cm−1. These probably are the signals of the metal–oxygen bond (Mg–O or Ti–O). The optical microscope image of the catalyst sample (Fig. 6 ) shows the catalyst particles to be of perfectly spherical shape, about 20μm in diameter. None of the particles were agglomerated. The accurate high-resolution SEM micrographs of the catalyst particle revealed spherical surface species about 40–60nm in diameter. Further, SEM measurements revealed a chain-like inner structure of the particles, where the chains extend from the center of the particle to the surface. This is clearly seen in Figs. 7–9 . An SEM photograph of the surface species of the catalyst particle is presented in Fig. 10 . Several studies [18–21] have suggested that MgCl2B x adducts (B=Lewis base) consist of MgCl2 polymeric chains. The authors propose that the δ-form of MgCl2 (obtainable by complete elimination of Lewis base from the adduct) consists of a large number of covalent [MgCl2] n polymeric chains. In agreement with this, our self-supported catalyst consists of polymeric nanoribbons of MgCl2 to which titanium active centers and internal electron donor are attached. In addition to the signals of δ-MgCl2 appearing in the powder XRD measurements, the presence of MgCl2 in the catalyst was indicated by the signals of the Mg–Cl bond in IR and Raman spectra. Chang et al. [22] have detected a similar inner structure for a PP catalyst prepared by a precipitation method. They prepared microcrystal particles of MgCl2 by dissolving a mixture of complexes of anhydrous MgCl2 with epichlorohydrin and tributyl phosphate in toluene and then removing the organic components from the MgCl2 complexes with excess of TiCl4. Solid support particles of microspherical form were obtained after heating. The authors report a “sea urchin”-type crystallite structure for the catalyst particles: particles are tightly filled with long rods of MgCl2 crystallites, and the planes of the Cl–Mg–Cl crystal layers are directed perpendicular to the lengths of the rods. However, according to SEM pictures the morphology of the catalyst particles suggests agglomerates of several spherical primary particles. To reiterate, studied catalyst particles are non-agglomerated and filled with δ-MgCl2 nanoribbons. Titanium active centers and internal donors are coordinated to these ribbons, creating a porous structure inside the catalyst particle. BET measurements showed that the catalyst is characterized by exceptionally low mesoporosity, while the powder XRD and SEM pictures together revealed a porous δ-MgCl2 crystallite structure. SEM/EDS mappings revealed good distribution of titanium throughout the particle (Fig. 11 ). The catalyst was highly active in propylene polymerization (35kgPP/(gcath)), and evidently, because of this exceptional structure, the monomer does not encounter a diffusion problem in the polymerization. 3.3 Moisture treatment of the catalyst sample Despite the low mesoporosity and low surface area of studied self-supported catalyst, the polymerization activity was good. SEM/EDS studies on cross-sections of the catalyst particles showed a highly even distribution of titanium through the particle indicating homogeneous structure of the catalyst particles. SEM/EDS mapping (Fig. 12 ) of particles that had been treated with wetted toluene (120ppm) further indicated an even loss of titanium from the whole particle. Even though the surface area and pore volume of the particles are very small, the titanium appears able to disengage evenly from the catalyst particle. The unique inner structure of the catalyst sample (nanoribbons) may explain why the titanium was capable of being consumed evenly. 4 Conclusions A solid self-supported Ziegler–Natta-type catalyst for propylene polymerization was studied and characterized by various methods. BET measurements with nitrogen and argon revealed an exceptionally low surface area and low mesoporosity, especially compared with that of the conventional MgCl2-based Ziegler–Natta-type catalyst for propylene polymerization. Despite the low mesoporosity and low surface area of the catalyst, the polymerization activity was good. Powder XRD measurements indicated the presence of δ-MgCl2 nanoribbons in the catalyst structure, and IR and Raman spectroscopies the presence of Mg–Cl bond. High-resolution SEM micrographs revealed spherical surface species about 40–60nm in diameter, and also a chain-like structure within the catalyst particles, with the chains extending from the center of the particle to the surface. Evidently, because of this exceptional structure, the monomer does not encounter diffusion problems in the polymerization. According to the IR characterization of the catalyst samples it seems that the active titanium centers and internal donors are coordinated to these MgCl2 nanoribbons, creating a porous structure inside the catalyst particle. SEM/EDS mappings revealed that the titanium content is high and the titanium is evenly distributed through the particle. Moisture treatment decreased the content of titanium evenly. Even though the structure of the catalyst appeared compact, the titanium was capable of disengaging evenly from the whole particle. The explanation for this may be the chain-like inner structure of the catalyst particle. Acknowledgments Our thanks to Borealis Polymers Oy (Finland) for funding the research and supplying the catalyst samples, to Mikkeli Technology center and Bruker Optics GmbH for the Raman measurements, and to the Department of Inorganic Chemistry, University of Helsinki, for putting the far-IR equipment at our disposal. Valtteri Kalima is thanked for taking the high-resolution SEM pictures. References [1] F.J. Karol Polym. Mater. Sci. Eng. 80 1999 277 [2] G. Collina, D. Evangeliste, M. Sacchetti, WO Patent 2005/063832 A1 (2005), to Basell Poliolefine Italia S.P.A. [3] A.K. Karbasi, T. Leinonen, P. Sormunen, EP Patent 0,627,449 A1 (1994), to Neste Oy. [4] J. Koskinen, P. Jokinen, WO Patent 93/19100 (1993), to Neste Oy. [5] G. Ertl H. Knözinger J. Weitkamp Preparation of Solid Catalysts 1999 VCH Weinheim [6] J.J.A. Dusseault C.C. Hsu J. Macromol. Sci. Rev. Macromol. Chem. Phys. C 33 2 1993 103 [7] G. Leofanti M. Padovan G. Tozzola B. Venturelli Catal. Today 41 1998 207 [8] J.W. Niemantsverdriet Spectsoscopy in Catalysis, An Introduction 1995 VCH Weinheim [9] L. Brambilla G. Zerbi S. Nascetti F. Piemontesi G. Moroni Macromol. Symp. 213 2004 287 [10] G.G. Arzoumanidis N.M. Karayannis Stud. Surf. Sci. Catal. 56 1990 147 [11] T. Leinonen, P. Denifl, EP Patent 1,273,595 A1 (2003), to Borealis Technology Oy. [12] M. Abboud P. Denifl K.-H. Reichert Macromol. Mater. Eng. 290 2005 1220 [13] V. Di Noto S. Bresadola Macromol. Chem. Phys. 197 1996 3827 [14] E.E. Kis G.A. Lomic B.D. Skrbic D.M. Stoiljkovic E.M. Dinkova Acta Period. Technol. 28 1997 123 [15] G. Socrates Infrared Raman Characteristic Group Frequencies, Tables and Charts 3rd ed. 2004 Wiley England [16] C.R. Tewell, UV–Raman spectroscopy, X-ray photoelectron spectroscopy and temperature programmed desorption studies of model bulk heterogeneous catalysts, Dissertation, 2002. [17] M. Hosaka, I. Nishiyama, US Patent 6,228,793 B1 (2001), to Toho Titanium Co. [18] M. Vittadello P.E. Stallworth F.M. Alamgir S. Suarez S. Abbrent C.M. Drain V. Di Noto S.G. Greenbaum Inorg. Chim. Acta 359 2006 2513 [19] V. Di Noto S. Bresadola R. Zannetti M. Viviani Zeit. Kristallogr. 201 1992 161 [20] V. Di Noto R. Zannetti S. Bresadola A. Marigo C. Marega Inorg. Chim. Acta 190 1991 279 [21] V. Di Noto L. Pavanello M. Viviani G. Storti S. Bresadola Thermochim. Acta 189 1991 223 [22] M. Chang X. Liu P.J. Nelson G.R. Munzing T.A. Gegan Y.V. Kissin J. Catal. 239 2006 347",
      "scopus-id": "35748971415",
      "coredata": {
        "eid": "1-s2.0-S1381116907004980",
        "dc:description": "The article describes structural studies on a solid MgCl2-based TiCl4 Ziegler–Natta catalyst for propylene polymerization prepared via emulsion technique. Surface area of the catalyst sample was found to be very low. Polymerization activity of the catalyst was nevertheless high. Powder X-ray diffraction (XRD) measurements indicated the presence of δ-MgCl2 in the catalyst sample, and IR and Raman studies the presence of a Mg–Cl bond. Scanning electron microscopy (SEM) measurements revealed an intriguing structure: evidently the catalyst particle is composed of chains (or nanoribbons) that extend from the center of the particle to the surface. SEM measurements further revealed spherical species (diameter about 60nm) on the surface. Scanning electron microscopy/energy dispersive spectroscopy (SEM/EDS) mappings indicated a high content of titanium evenly distributed throughout the particle, but after moisture treatment of the sample the content was evenly decreased.",
        "openArchiveArticle": "false",
        "prism:coverDate": "2007-12-14",
        "openaccessUserLicense": null,
        "prism:aggregationType": "Journal",
        "prism:url": "https://api.elsevier.com/content/article/pii/S1381116907004980",
        "dc:creator": [
          {
            "@_fa": "true",
            "$": "Rönkkö, Hanna-Leena"
          },
          {
            "@_fa": "true",
            "$": "Knuuttila, Hilkka"
          },
          {
            "@_fa": "true",
            "$": "Denifl, Peter"
          },
          {
            "@_fa": "true",
            "$": "Leinonen, Timo"
          },
          {
            "@_fa": "true",
            "$": "Venäläinen, Tapani"
          }
        ],
        "link": [
          {
            "@_fa": "true",
            "@rel": "self",
            "@href": "https://api.elsevier.com/content/article/pii/S1381116907004980"
          },
          {
            "@_fa": "true",
            "@rel": "scidir",
            "@href": "https://www.sciencedirect.com/science/article/pii/S1381116907004980"
          }
        ],
        "dc:format": "application/json",
        "openaccessType": null,
        "pii": "S1381-1169(07)00498-0",
        "prism:volume": "278",
        "prism:publisher": "Elsevier B.V.",
        "dc:title": "Structural studies on a solid self-supported Ziegler–Natta-type catalyst for propylene polymerization",
        "prism:copyright": "Copyright © 2007 Elsevier B.V. All rights reserved.",
        "openaccess": "0",
        "prism:issn": "13811169",
        "prism:issueIdentifier": "1-2",
        "dcterms:subject": [
          {
            "@_fa": "true",
            "$": "Ziegler–Natta catalyst"
          },
          {
            "@_fa": "true",
            "$": "MgCl2"
          },
          {
            "@_fa": "true",
            "$": "Propylene polymerization"
          },
          {
            "@_fa": "true",
            "$": "IR"
          },
          {
            "@_fa": "true",
            "$": "Raman"
          }
        ],
        "openaccessArticle": "false",
        "prism:publicationName": "Journal of Molecular Catalysis A: Chemical",
        "prism:number": "1-2",
        "openaccessSponsorType": null,
        "prism:pageRange": "127-134",
        "prism:endingPage": "134",
        "pubType": "fla",
        "prism:coverDisplayDate": "14 December 2007",
        "prism:doi": "10.1016/j.molcata.2007.08.027",
        "prism:startingPage": "127",
        "dc:identifier": "doi:10.1016/j.molcata.2007.08.027",
        "openaccessSponsorName": null
      },
      "objects": {
        "object": [
          {
            "@category": "standard",
            "@height": "365",
            "@width": "545",
            "@_fa": "true",
            "$": "https://api.elsevier.com/content/object/eid/1-s2.0-S1381116907004980-gr1.jpg?httpAccept=%2A%2F%2A",
            "@multimediatype": "JPEG image file",
            "@type": "IMAGE-DOWNSAMPLED",
            "@size": "38131",
            "@ref": "gr1",
            "@mimetype": "image/jpeg"
          },
          {
            "@category": "thumbnail",
            "@height": "84",
            "@width": "125",
            "@_fa": "true",
            "$": "https://api.elsevier.com/content/object/eid/1-s2.0-S1381116907004980-gr1.sml?httpAccept=%2A%2F%2A",
            "@multimediatype": "GIF image file",
            "@type": "IMAGE-THUMBNAIL",
            "@size": "1241",
            "@ref": "gr1",
            "@mimetype": "image/gif"
          },
          {
            "@category": "standard",
            "@height": "283",
            "@width": "376",
            "@_fa": "true",
            "$": "https://api.elsevier.com/content/object/eid/1-s2.0-S1381116907004980-gr10.jpg?httpAccept=%2A%2F%2A",
            "@multimediatype": "JPEG image file",
            "@type": "IMAGE-DOWNSAMPLED",
            "@size": "37578",
            "@ref": "gr10",
            "@mimetype": "image/jpeg"
          },
          {
            "@category": "thumbnail",
            "@height": "93",
            "@width": "124",
            "@_fa": "true",
            "$": "https://api.elsevier.com/content/object/eid/1-s2.0-S1381116907004980-gr10.sml?httpAccept=%2A%2F%2A",
            "@multimediatype": "GIF image file",
            "@type": "IMAGE-THUMBNAIL",
            "@size": "3363",
            "@ref": "gr10",
            "@mimetype": "image/gif"
          },
          {
            "@category": "standard",
            "@height": "161",
            "@width": "376",
            "@_fa": "true",
            "$": "https://api.elsevier.com/content/object/eid/1-s2.0-S1381116907004980-gr11.jpg?httpAccept=%2A%2F%2A",
            "@multimediatype": "JPEG image file",
            "@type": "IMAGE-DOWNSAMPLED",
            "@size": "29115",
            "@ref": "gr11",
            "@mimetype": "image/jpeg"
          },
          {
            "@category": "thumbnail",
            "@height": "53",
            "@width": "125",
            "@_fa": "true",
            "$": "https://api.elsevier.com/content/object/eid/1-s2.0-S1381116907004980-gr11.sml?httpAccept=%2A%2F%2A",
            "@multimediatype": "GIF image file",
            "@type": "IMAGE-THUMBNAIL",
            "@size": "1286",
            "@ref": "gr11",
            "@mimetype": "image/gif"
          },
          {
            "@category": "standard",
            "@height": "181",
            "@width": "372",
            "@_fa": "true",
            "$": "https://api.elsevier.com/content/object/eid/1-s2.0-S1381116907004980-gr12.jpg?httpAccept=%2A%2F%2A",
            "@multimediatype": "JPEG image file",
            "@type": "IMAGE-DOWNSAMPLED",
            "@size": "30669",
            "@ref": "gr12",
            "@mimetype": "image/jpeg"
          },
          {
            "@category": "thumbnail",
            "@height": "61",
            "@width": "125",
            "@_fa": "true",
            "$": "https://api.elsevier.com/content/object/eid/1-s2.0-S1381116907004980-gr12.sml?httpAccept=%2A%2F%2A",
            "@multimediatype": "GIF image file",
            "@type": "IMAGE-THUMBNAIL",
            "@size": "1420",
            "@ref": "gr12",
            "@mimetype": "image/gif"
          },
          {
            "@category": "standard",
            "@height": "257",
            "@width": "370",
            "@_fa": "true",
            "$": "https://api.elsevier.com/content/object/eid/1-s2.0-S1381116907004980-gr2.jpg?httpAccept=%2A%2F%2A",
            "@multimediatype": "JPEG image file",
            "@type": "IMAGE-DOWNSAMPLED",
            "@size": "31889",
            "@ref": "gr2",
            "@mimetype": "image/jpeg"
          },
          {
            "@category": "thumbnail",
            "@height": "87",
            "@width": "125",
            "@_fa": "true",
            "$": "https://api.elsevier.com/content/object/eid/1-s2.0-S1381116907004980-gr2.sml?httpAccept=%2A%2F%2A",
            "@multimediatype": "GIF image file",
            "@type": "IMAGE-THUMBNAIL",
            "@size": "1673",
            "@ref": "gr2",
            "@mimetype": "image/gif"
          },
          {
            "@category": "standard",
            "@height": "252",
            "@width": "373",
            "@_fa": "true",
            "$": "https://api.elsevier.com/content/object/eid/1-s2.0-S1381116907004980-gr3.gif?httpAccept=%2A%2F%2A",
            "@multimediatype": "GIF image file",
            "@type": "IMAGE-DOWNSAMPLED",
            "@size": "9652",
            "@ref": "gr3",
            "@mimetype": "image/gif"
          },
          {
            "@category": "thumbnail",
            "@height": "85",
            "@width": "125",
            "@_fa": "true",
            "$": "https://api.elsevier.com/content/object/eid/1-s2.0-S1381116907004980-gr3.sml?httpAccept=%2A%2F%2A",
            "@multimediatype": "GIF image file",
            "@type": "IMAGE-THUMBNAIL",
            "@size": "1801",
            "@ref": "gr3",
            "@mimetype": "image/gif"
          },
          {
            "@category": "standard",
            "@height": "257",
            "@width": "376",
            "@_fa": "true",
            "$": "https://api.elsevier.com/content/object/eid/1-s2.0-S1381116907004980-gr4.gif?httpAccept=%2A%2F%2A",
            "@multimediatype": "GIF image file",
            "@type": "IMAGE-DOWNSAMPLED",
            "@size": "9991",
            "@ref": "gr4",
            "@mimetype": "image/gif"
          },
          {
            "@category": "thumbnail",
            "@height": "85",
            "@width": "125",
            "@_fa": "true",
            "$": "https://api.elsevier.com/content/object/eid/1-s2.0-S1381116907004980-gr4.sml?httpAccept=%2A%2F%2A",
            "@multimediatype": "GIF image file",
            "@type": "IMAGE-THUMBNAIL",
            "@size": "1787",
            "@ref": "gr4",
            "@mimetype": "image/gif"
          },
          {
            "@category": "standard",
            "@height": "266",
            "@width": "368",
            "@_fa": "true",
            "$": "https://api.elsevier.com/content/object/eid/1-s2.0-S1381116907004980-gr5.gif?httpAccept=%2A%2F%2A",
            "@multimediatype": "GIF image file",
            "@type": "IMAGE-DOWNSAMPLED",
            "@size": "4701",
            "@ref": "gr5",
            "@mimetype": "image/gif"
          },
          {
            "@category": "thumbnail",
            "@height": "90",
            "@width": "125",
            "@_fa": "true",
            "$": "https://api.elsevier.com/content/object/eid/1-s2.0-S1381116907004980-gr5.sml?httpAccept=%2A%2F%2A",
            "@multimediatype": "GIF image file",
            "@type": "IMAGE-THUMBNAIL",
            "@size": "1021",
            "@ref": "gr5",
            "@mimetype": "image/gif"
          },
          {
            "@category": "standard",
            "@height": "276",
            "@width": "376",
            "@_fa": "true",
            "$": "https://api.elsevier.com/content/object/eid/1-s2.0-S1381116907004980-gr6.jpg?httpAccept=%2A%2F%2A",
            "@multimediatype": "JPEG image file",
            "@type": "IMAGE-DOWNSAMPLED",
            "@size": "44475",
            "@ref": "gr6",
            "@mimetype": "image/jpeg"
          },
          {
            "@category": "thumbnail",
            "@height": "92",
            "@width": "125",
            "@_fa": "true",
            "$": "https://api.elsevier.com/content/object/eid/1-s2.0-S1381116907004980-gr6.sml?httpAccept=%2A%2F%2A",
            "@multimediatype": "GIF image file",
            "@type": "IMAGE-THUMBNAIL",
            "@size": "5572",
            "@ref": "gr6",
            "@mimetype": "image/gif"
          },
          {
            "@category": "standard",
            "@height": "281",
            "@width": "376",
            "@_fa": "true",
            "$": "https://api.elsevier.com/content/object/eid/1-s2.0-S1381116907004980-gr7.jpg?httpAccept=%2A%2F%2A",
            "@multimediatype": "JPEG image file",
            "@type": "IMAGE-DOWNSAMPLED",
            "@size": "60723",
            "@ref": "gr7",
            "@mimetype": "image/jpeg"
          },
          {
            "@category": "thumbnail",
            "@height": "94",
            "@width": "125",
            "@_fa": "true",
            "$": "https://api.elsevier.com/content/object/eid/1-s2.0-S1381116907004980-gr7.sml?httpAccept=%2A%2F%2A",
            "@multimediatype": "GIF image file",
            "@type": "IMAGE-THUMBNAIL",
            "@size": "4571",
            "@ref": "gr7",
            "@mimetype": "image/gif"
          },
          {
            "@category": "standard",
            "@height": "279",
            "@width": "376",
            "@_fa": "true",
            "$": "https://api.elsevier.com/content/object/eid/1-s2.0-S1381116907004980-gr8.jpg?httpAccept=%2A%2F%2A",
            "@multimediatype": "JPEG image file",
            "@type": "IMAGE-DOWNSAMPLED",
            "@size": "38677",
            "@ref": "gr8",
            "@mimetype": "image/jpeg"
          },
          {
            "@category": "thumbnail",
            "@height": "93",
            "@width": "125",
            "@_fa": "true",
            "$": "https://api.elsevier.com/content/object/eid/1-s2.0-S1381116907004980-gr8.sml?httpAccept=%2A%2F%2A",
            "@multimediatype": "GIF image file",
            "@type": "IMAGE-THUMBNAIL",
            "@size": "3276",
            "@ref": "gr8",
            "@mimetype": "image/gif"
          },
          {
            "@category": "standard",
            "@height": "281",
            "@width": "376",
            "@_fa": "true",
            "$": "https://api.elsevier.com/content/object/eid/1-s2.0-S1381116907004980-gr9.jpg?httpAccept=%2A%2F%2A",
            "@multimediatype": "JPEG image file",
            "@type": "IMAGE-DOWNSAMPLED",
            "@size": "59810",
            "@ref": "gr9",
            "@mimetype": "image/jpeg"
          },
          {
            "@category": "thumbnail",
            "@height": "94",
            "@width": "125",
            "@_fa": "true",
            "$": "https://api.elsevier.com/content/object/eid/1-s2.0-S1381116907004980-gr9.sml?httpAccept=%2A%2F%2A",
            "@multimediatype": "GIF image file",
            "@type": "IMAGE-THUMBNAIL",
            "@size": "3788",
            "@ref": "gr9",
            "@mimetype": "image/gif"
          },
          {
            "@category": "standard",
            "@height": "470",
            "@width": "526",
            "@_fa": "true",
            "$": "https://api.elsevier.com/content/object/eid/1-s2.0-S1381116907004980-sc1.gif?httpAccept=%2A%2F%2A",
            "@multimediatype": "GIF image file",
            "@type": "IMAGE-DOWNSAMPLED",
            "@size": "17043",
            "@ref": "sc1",
            "@mimetype": "image/gif"
          },
          {
            "@category": "thumbnail",
            "@height": "93",
            "@width": "104",
            "@_fa": "true",
            "$": "https://api.elsevier.com/content/object/eid/1-s2.0-S1381116907004980-sc1.sml?httpAccept=%2A%2F%2A",
            "@multimediatype": "GIF image file",
            "@type": "IMAGE-THUMBNAIL",
            "@size": "1407",
            "@ref": "sc1",
            "@mimetype": "image/gif"
          },
          {
            "@category": "standard",
            "@height": "183",
            "@width": "244",
            "@_fa": "true",
            "$": "https://api.elsevier.com/content/object/eid/1-s2.0-S1381116907004980-fx1.jpg?httpAccept=%2A%2F%2A",
            "@multimediatype": "JPEG image file",
            "@type": "IMAGE-DOWNSAMPLED",
            "@size": "27883",
            "@ref": "fx1",
            "@mimetype": "image/jpeg"
          },
          {
            "@category": "thumbnail",
            "@height": "93",
            "@width": "124",
            "@_fa": "true",
            "$": "https://api.elsevier.com/content/object/eid/1-s2.0-S1381116907004980-fx1.sml?httpAccept=%2A%2F%2A",
            "@multimediatype": "GIF image file",
            "@type": "IMAGE-THUMBNAIL",
            "@size": "3394",
            "@ref": "fx1",
            "@mimetype": "image/gif"
          }
        ]
      },
      "link": {
        "@rel": "abstract",
        "@href": "https://api.elsevier.com/content/abstract/scopus_id/35748971415"
      }
    }
  }
}