{
  "metadata": {
    "title": "Nature of the NiMoS catalyst edge sites: An atom in molecules theory and electrostatic potential studies",
    "authors": "; ; ",
    "journal": "Journal of Molecular Catalysis A: Chemical",
    "date": "2007-06-18",
    "doi": "10.1016/j.molcata.2007.02.016",
    "abstract": "",
    "uri": "https://api.elsevier.com/content/article/pii/S1381116907001069",
    "pii": "S1381116907001069"
  },
  "fulltext": {
    "full-text-retrieval-response": {
      "scopus-eid": "2-s2.0-34248185652",
      "originalText": "serial JL 271358 291210 291744 291790 291809 31 Journal of Molecular Catalysis A: Chemical JOURNALMOLECULARCATALYSISACHEMICAL 2007-02-20 2007-02-20 2010-03-27T18:10:43 1-s2.0-S1381116907001069 S1381-1169(07)00106-9 S1381116907001069 10.1016/j.molcata.2007.02.016 S300 S300.1 FULL-TEXT 1-s2.0-S1381116907X0253X 2015-05-15T05:56:33.323092-04:00 0 0 20070618 2007 2007-02-20T00:00:00Z articleinfo crossmark dco dateupdated tomb dateloaded datesearch indexeddate issuelist volumelist yearnav absattachment articletitlenorm authfirstinitialnorm authfirstsurnamenorm cid cids contenttype copyright dateloadedtxt docsubtype doctype doi eid ewtransactionid hubeid issfirst issn issnnorm itemstage itemtransactionid itemweight openaccess openarchive pg pgfirst pglast pii piinorm pubdatestart pubdatetxt pubyr sortorder srctitle srctitlenorm srctype subheadings volfirst volissue webpdf webpdfpagecount figure table body mmlmath affil articletitle auth authfirstini authfull authkeywords authlast primabst ref specialabst alllist content subj ssids 1381-1169 13811169 271 271 1 2 1 2 Volume 271, Issues 1–2 21 105 116 105 116 20070618 18 June 2007 2007-06-18 2007 article fla Copyright © 2007 Elsevier B.V. All rights reserved. NATURENIMOSCATALYSTEDGESITESATOMINMOLECULESTHEORYELECTROSTATICPOTENTIALSTUDIES ARAY Y 1 Introduction 2 The AIM theory 3 The electrostatic potential methodology 4 Computational methodology 5 Catalyst models 6 Results 7 Concluding remarks References WEISSER 1973 O SULFIDECATALYSTSPROPERTIESAPPLICATIONS TOPSOE 1996 H HYDROTREATINGCATALYSISSCIENCETECHNOLOGY RODRIGUEZ 1999 L462 L468 J BERHAULT 1998 555 565 G BREYSSE 2001 13 20 M PISDIEZ 1993 219 325 R NORSKOV 1992 1 8 J TOPSOE 1995 283 H TOULHOAT 1997 114 H TOULHOAT 1999 629 636 H PECORARO 1981 430 445 T CHIANELLI 2002 83 96 R CHIANELLI 1994 117 232 R HARRIS 1984 400 412 S TOULHOAT 2003 63 72 H VISSERS 1984 813 821 J LEDOUX 1986 275 288 M BURDETT 1990 L353 L357 J SMITH 1994 361 T RAYBAUD 1997 11085 11106 P RAYBAUD 2000 128 143 P NEUROCK 1994 4427 4439 M ARAY 2000 3810 3813 Y CLAUSEN 1981 1249 1259 B PARHAM 1984 295 310 T TAUSTER 1980 515 519 S TOPSOE 1984 783 806 H LAURITSEN 2004 510 522 J SCHWEIGER 2002 33 38 H RAYBAUD 2000 129 146 P SCHWEIGER 2002 76 87 H PRINS 1989 1 41 R SUN 2004 131 143 M SUN 2004 32 40 M RODRIGUEZ 1997 85 J RODRIGUEZ 1977 7524 J SUN 2005 36 M SUN 2005 411 M BADER 1990 R ATOMSINMOLECULESQQUANTUMTHEORY BADER 1991 893 R BADER 1998 7314 7323 R BADER 1994 620 631 R ZOU 1994 714 725 P EBERHART 1996 1229 M EBERHART 1996 47 M ARAY 2000 4608 Y PENDAS 1997 4275 M POPELIER 2000 P ATOMSINMOLECULESANINTRODUCTION GILLESPIE 2001 R CHEMICALBONDINGMOLECULARGEOMETRYLEWISELECTRONDENSITIES GHERMANI 1996 4231 N HENAFF 1997 870 C IVANOV 1998 774 Y KORITSANSZKY 2001 1583 T DOWNS 2002 369 R ABRAMOV 1997 187 Y TAKATA 1994 330 M VYBOISHCHIKOV 1994 2024 S BOESE 1997 1489 R BOESE 1997 5794 R MUNSHI 2006 199 P MEI 1993 287 C ARAY 1997 6976 Y EBERHART 1993 5762 M EBERHART 1993 438 M HAUSSERMANN 1994 2073 U GROSCH 1996 39 G KNECHT 1997 166 M TIRELSON 1995 143 V GATTI 1994 10686 C PLATS 1996 4668 J LUANA 2003 4912 V BLANCO 2000 12028 M PENDAS 1997 4285 M LEBOEUF 1999 4893 M GADRE 2000 S ELECTROSTATICSATOMSMOLECULES PINGALE 1998 9987 S DESHMUKH 2004 12402 M JOSHI 2005 87 K TACHIKAWA 2005 117 H PATHAK 1990 1770 R GADRE 1992 5253 S GADRE 1989 18 S ALHAMBRA 1995 3084 C KORNELAK 2005 175 P MICHALAK 2004 346 A POLITZER 1982 P CHEMICALAPPLICATIONSATOMICMOLECULARELECTROSTATICPOTENTIALS MURRAY 1996 J MOLECULARELECTROSTATICPOTENTIALCONCEPTSAPPLICATIONS OROZCO 1996 181 M ARAY 2003 8946 Y ARAY 2004 2418 Y ARAY 2004 18942 Y TAL 1980 1 Y KEITH 1996 183 T SJOBERG 1990 3959 P ARAY 2005 23564 23570 Y DELLEY 1990 508 B DELLEY 2000 7756 B PERDEW 1996 3865 J BYSKOV 2000 95 L BYSKOV 1997 177 L BYSKOV 1999 109 L RAYBAUD 1998 1481 P RAYBAUD 1998 237 P CRISTOL 2000 11220 S PAUL 2003 4057 J SUN 2005 223 M ARAYX2007X105 ARAYX2007X105X116 ARAYX2007X105XY ARAYX2007X105X116XY item S1381-1169(07)00106-9 S1381116907001069 1-s2.0-S1381116907001069 10.1016/j.molcata.2007.02.016 271358 2010-09-17T22:43:36.719077-04:00 2007-06-18 1-s2.0-S1381116907001069-main.pdf https://s3.amazonaws.com/prod-ucs-content-store-us-east/content/pii:S1381116907001069/MAIN/application/pdf/3e299889bfed9a14843f94710e8e79ee/main.pdf https://s3-eu-west-1.amazonaws.com/prod-ucs-content-store-eu-west/content/pii:S1381116907001069/MAIN/application/pdf/3e299889bfed9a14843f94710e8e79ee/main.pdf main.pdf pdf true 3083383 MAIN 12 1-s2.0-S1381116907001069-main_1.png https://s3.amazonaws.com/prod-ucs-content-store-us-east/content/pii:S1381116907001069/PREVIEW/image/png/8d47fa0d3ffa2a6efe31b77b65cd69b6/main_1.png https://s3-eu-west-1.amazonaws.com/prod-ucs-content-store-eu-west/content/pii:S1381116907001069/PREVIEW/image/png/8d47fa0d3ffa2a6efe31b77b65cd69b6/main_1.png main_1.png png 73099 849 656 IMAGE-WEB-PDF 1 1-s2.0-S1381116907001069-si5.gif https://s3.amazonaws.com/prod-ucs-content-store-us-east/content/pii:S1381116907001069/STRIPIN/image/gif/98edab50da13cb412bbe495be843ad1b/si5.gif https://s3-eu-west-1.amazonaws.com/prod-ucs-content-store-eu-west/content/pii:S1381116907001069/STRIPIN/image/gif/98edab50da13cb412bbe495be843ad1b/si5.gif si5 si5.gif gif 1352 38 315 ALTIMG 1-s2.0-S1381116907001069-si4.gif https://s3.amazonaws.com/prod-ucs-content-store-us-east/content/pii:S1381116907001069/STRIPIN/image/gif/1f0477d4673ad8beff6f93e33b220e7e/si4.gif https://s3-eu-west-1.amazonaws.com/prod-ucs-content-store-eu-west/content/pii:S1381116907001069/STRIPIN/image/gif/1f0477d4673ad8beff6f93e33b220e7e/si4.gif si4 si4.gif gif 638 34 152 ALTIMG 1-s2.0-S1381116907001069-si3.gif https://s3.amazonaws.com/prod-ucs-content-store-us-east/content/pii:S1381116907001069/STRIPIN/image/gif/d9d61938c68f73949e907d0fa986ef6b/si3.gif https://s3-eu-west-1.amazonaws.com/prod-ucs-content-store-eu-west/content/pii:S1381116907001069/STRIPIN/image/gif/d9d61938c68f73949e907d0fa986ef6b/si3.gif si3 si3.gif gif 1123 41 267 ALTIMG 1-s2.0-S1381116907001069-si2.gif https://s3.amazonaws.com/prod-ucs-content-store-us-east/content/pii:S1381116907001069/STRIPIN/image/gif/604e48e897718f7edbc653f7dc67ace4/si2.gif https://s3-eu-west-1.amazonaws.com/prod-ucs-content-store-eu-west/content/pii:S1381116907001069/STRIPIN/image/gif/604e48e897718f7edbc653f7dc67ace4/si2.gif si2 si2.gif gif 502 14 145 ALTIMG 1-s2.0-S1381116907001069-si1.gif https://s3.amazonaws.com/prod-ucs-content-store-us-east/content/pii:S1381116907001069/STRIPIN/image/gif/51fb11de2852e6561759e78905cc0eec/si1.gif https://s3-eu-west-1.amazonaws.com/prod-ucs-content-store-eu-west/content/pii:S1381116907001069/STRIPIN/image/gif/51fb11de2852e6561759e78905cc0eec/si1.gif si1 si1.gif gif 356 13 122 ALTIMG 1-s2.0-S1381116907001069-fx2.gif https://s3.amazonaws.com/prod-ucs-content-store-us-east/content/pii:S1381116907001069/fx2/DOWNSAMPLED/image/gif/b5d026100fb36168c1fbed5f81fa6b92/fx2.gif https://s3-eu-west-1.amazonaws.com/prod-ucs-content-store-eu-west/content/pii:S1381116907001069/fx2/DOWNSAMPLED/image/gif/b5d026100fb36168c1fbed5f81fa6b92/fx2.gif fx2 fx2.gif gif 503 29 105 IMAGE-DOWNSAMPLED 1-s2.0-S1381116907001069-fx2.sml https://s3.amazonaws.com/prod-ucs-content-store-us-east/content/pii:S1381116907001069/fx2/THUMBNAIL/image/gif/688927d6c740fc29f65baec08be02275/fx2.sml https://s3-eu-west-1.amazonaws.com/prod-ucs-content-store-eu-west/content/pii:S1381116907001069/fx2/THUMBNAIL/image/gif/688927d6c740fc29f65baec08be02275/fx2.sml fx2 fx2.sml sml 672 34 125 IMAGE-THUMBNAIL 1-s2.0-S1381116907001069-fx3.gif https://s3.amazonaws.com/prod-ucs-content-store-us-east/content/pii:S1381116907001069/fx3/DOWNSAMPLED/image/gif/8d421150aa00ed929cad72009e10a9c8/fx3.gif https://s3-eu-west-1.amazonaws.com/prod-ucs-content-store-eu-west/content/pii:S1381116907001069/fx3/DOWNSAMPLED/image/gif/8d421150aa00ed929cad72009e10a9c8/fx3.gif fx3 fx3.gif gif 429 31 95 IMAGE-DOWNSAMPLED 1-s2.0-S1381116907001069-fx3.sml https://s3.amazonaws.com/prod-ucs-content-store-us-east/content/pii:S1381116907001069/fx3/THUMBNAIL/image/gif/ac3bf4702ec784a8c4b5e808268465f5/fx3.sml https://s3-eu-west-1.amazonaws.com/prod-ucs-content-store-eu-west/content/pii:S1381116907001069/fx3/THUMBNAIL/image/gif/ac3bf4702ec784a8c4b5e808268465f5/fx3.sml fx3 fx3.sml sml 568 40 125 IMAGE-THUMBNAIL 1-s2.0-S1381116907001069-gr1.jpg https://s3.amazonaws.com/prod-ucs-content-store-us-east/content/pii:S1381116907001069/gr1/DOWNSAMPLED/image/jpeg/f86dc8960ba266403c1a257a5b8cb495/gr1.jpg https://s3-eu-west-1.amazonaws.com/prod-ucs-content-store-eu-west/content/pii:S1381116907001069/gr1/DOWNSAMPLED/image/jpeg/f86dc8960ba266403c1a257a5b8cb495/gr1.jpg gr1 gr1.jpg jpg 45798 276 376 IMAGE-DOWNSAMPLED 1-s2.0-S1381116907001069-gr1.sml https://s3.amazonaws.com/prod-ucs-content-store-us-east/content/pii:S1381116907001069/gr1/THUMBNAIL/image/gif/e3736cd6046ad67a25b5b75a2823276f/gr1.sml https://s3-eu-west-1.amazonaws.com/prod-ucs-content-store-eu-west/content/pii:S1381116907001069/gr1/THUMBNAIL/image/gif/e3736cd6046ad67a25b5b75a2823276f/gr1.sml gr1 gr1.sml sml 4184 92 125 IMAGE-THUMBNAIL 1-s2.0-S1381116907001069-gr2.jpg https://s3.amazonaws.com/prod-ucs-content-store-us-east/content/pii:S1381116907001069/gr2/DOWNSAMPLED/image/jpeg/9c5d7b1193e8c1944a663346413104a3/gr2.jpg https://s3-eu-west-1.amazonaws.com/prod-ucs-content-store-eu-west/content/pii:S1381116907001069/gr2/DOWNSAMPLED/image/jpeg/9c5d7b1193e8c1944a663346413104a3/gr2.jpg gr2 gr2.jpg jpg 166720 940 760 IMAGE-DOWNSAMPLED 1-s2.0-S1381116907001069-gr2.sml https://s3.amazonaws.com/prod-ucs-content-store-us-east/content/pii:S1381116907001069/gr2/THUMBNAIL/image/gif/75c7b8b397f85602a7a1b9ad0ec0d61f/gr2.sml https://s3-eu-west-1.amazonaws.com/prod-ucs-content-store-eu-west/content/pii:S1381116907001069/gr2/THUMBNAIL/image/gif/75c7b8b397f85602a7a1b9ad0ec0d61f/gr2.sml gr2 gr2.sml sml 2550 93 75 IMAGE-THUMBNAIL 1-s2.0-S1381116907001069-gr3ad.jpg https://s3.amazonaws.com/prod-ucs-content-store-us-east/content/pii:S1381116907001069/gr3ad/DOWNSAMPLED/image/jpeg/18c601ebc96bc49adae735f4a8a011ec/gr3ad.jpg https://s3-eu-west-1.amazonaws.com/prod-ucs-content-store-eu-west/content/pii:S1381116907001069/gr3ad/DOWNSAMPLED/image/jpeg/18c601ebc96bc49adae735f4a8a011ec/gr3ad.jpg gr3ad gr3ad.jpg jpg 176255 668 766 IMAGE-DOWNSAMPLED 1-s2.0-S1381116907001069-gr3ad.sml https://s3.amazonaws.com/prod-ucs-content-store-us-east/content/pii:S1381116907001069/gr3ad/THUMBNAIL/image/gif/8e5aaf11f0ee5003c278bec2879d077f/gr3ad.sml https://s3-eu-west-1.amazonaws.com/prod-ucs-content-store-eu-west/content/pii:S1381116907001069/gr3ad/THUMBNAIL/image/gif/8e5aaf11f0ee5003c278bec2879d077f/gr3ad.sml gr3ad gr3ad.sml sml 5684 93 107 IMAGE-THUMBNAIL 1-s2.0-S1381116907001069-gr3eg.jpg https://s3.amazonaws.com/prod-ucs-content-store-us-east/content/pii:S1381116907001069/gr3eg/DOWNSAMPLED/image/jpeg/2dabae910d64ee8089130359dd95078f/gr3eg.jpg https://s3-eu-west-1.amazonaws.com/prod-ucs-content-store-eu-west/content/pii:S1381116907001069/gr3eg/DOWNSAMPLED/image/jpeg/2dabae910d64ee8089130359dd95078f/gr3eg.jpg gr3eg gr3eg.jpg jpg 120461 702 644 IMAGE-DOWNSAMPLED 1-s2.0-S1381116907001069-gr3eg.sml https://s3.amazonaws.com/prod-ucs-content-store-us-east/content/pii:S1381116907001069/gr3eg/THUMBNAIL/image/gif/4ef5faa2fcc3990e5e71bece531843d8/gr3eg.sml https://s3-eu-west-1.amazonaws.com/prod-ucs-content-store-eu-west/content/pii:S1381116907001069/gr3eg/THUMBNAIL/image/gif/4ef5faa2fcc3990e5e71bece531843d8/gr3eg.sml gr3eg gr3eg.sml sml 4371 94 86 IMAGE-THUMBNAIL 1-s2.0-S1381116907001069-gr4.jpg https://s3.amazonaws.com/prod-ucs-content-store-us-east/content/pii:S1381116907001069/gr4/DOWNSAMPLED/image/jpeg/b17dee80f157d69452b90b3bf2a00bf5/gr4.jpg https://s3-eu-west-1.amazonaws.com/prod-ucs-content-store-eu-west/content/pii:S1381116907001069/gr4/DOWNSAMPLED/image/jpeg/b17dee80f157d69452b90b3bf2a00bf5/gr4.jpg gr4 gr4.jpg jpg 130985 720 373 IMAGE-DOWNSAMPLED 1-s2.0-S1381116907001069-gr4.sml https://s3.amazonaws.com/prod-ucs-content-store-us-east/content/pii:S1381116907001069/gr4/THUMBNAIL/image/gif/ce9f4f8e42e5a6f59c227622f138c354/gr4.sml https://s3-eu-west-1.amazonaws.com/prod-ucs-content-store-eu-west/content/pii:S1381116907001069/gr4/THUMBNAIL/image/gif/ce9f4f8e42e5a6f59c227622f138c354/gr4.sml gr4 gr4.sml sml 3470 93 48 IMAGE-THUMBNAIL 1-s2.0-S1381116907001069-gr5.jpg https://s3.amazonaws.com/prod-ucs-content-store-us-east/content/pii:S1381116907001069/gr5/DOWNSAMPLED/image/jpeg/9ab159b0af7d36619561bb0917e95788/gr5.jpg https://s3-eu-west-1.amazonaws.com/prod-ucs-content-store-eu-west/content/pii:S1381116907001069/gr5/DOWNSAMPLED/image/jpeg/9ab159b0af7d36619561bb0917e95788/gr5.jpg gr5 gr5.jpg jpg 125371 483 590 IMAGE-DOWNSAMPLED 1-s2.0-S1381116907001069-gr5.sml https://s3.amazonaws.com/prod-ucs-content-store-us-east/content/pii:S1381116907001069/gr5/THUMBNAIL/image/gif/e44e48a205fe352da8e2134b7b1b5f13/gr5.sml https://s3-eu-west-1.amazonaws.com/prod-ucs-content-store-eu-west/content/pii:S1381116907001069/gr5/THUMBNAIL/image/gif/e44e48a205fe352da8e2134b7b1b5f13/gr5.sml gr5 gr5.sml sml 7570 93 114 IMAGE-THUMBNAIL 1-s2.0-S1381116907001069-gr6.jpg https://s3.amazonaws.com/prod-ucs-content-store-us-east/content/pii:S1381116907001069/gr6/DOWNSAMPLED/image/jpeg/a20c8d4a4e5547076e4189c7055ca19f/gr6.jpg https://s3-eu-west-1.amazonaws.com/prod-ucs-content-store-eu-west/content/pii:S1381116907001069/gr6/DOWNSAMPLED/image/jpeg/a20c8d4a4e5547076e4189c7055ca19f/gr6.jpg gr6 gr6.jpg jpg 41922 612 376 IMAGE-DOWNSAMPLED 1-s2.0-S1381116907001069-gr6.sml https://s3.amazonaws.com/prod-ucs-content-store-us-east/content/pii:S1381116907001069/gr6/THUMBNAIL/image/gif/92b95faa1413fbda79eb538c44b46cd6/gr6.sml https://s3-eu-west-1.amazonaws.com/prod-ucs-content-store-eu-west/content/pii:S1381116907001069/gr6/THUMBNAIL/image/gif/92b95faa1413fbda79eb538c44b46cd6/gr6.sml gr6 gr6.sml sml 2181 93 57 IMAGE-THUMBNAIL 1-s2.0-S1381116907001069-gr7.jpg https://s3.amazonaws.com/prod-ucs-content-store-us-east/content/pii:S1381116907001069/gr7/DOWNSAMPLED/image/jpeg/95b7c643c44a499945b64c2d900a320a/gr7.jpg https://s3-eu-west-1.amazonaws.com/prod-ucs-content-store-eu-west/content/pii:S1381116907001069/gr7/DOWNSAMPLED/image/jpeg/95b7c643c44a499945b64c2d900a320a/gr7.jpg gr7 gr7.jpg jpg 74544 781 376 IMAGE-DOWNSAMPLED 1-s2.0-S1381116907001069-gr7.sml https://s3.amazonaws.com/prod-ucs-content-store-us-east/content/pii:S1381116907001069/gr7/THUMBNAIL/image/gif/692b264bbd5b20d66ecafa761df29467/gr7.sml https://s3-eu-west-1.amazonaws.com/prod-ucs-content-store-eu-west/content/pii:S1381116907001069/gr7/THUMBNAIL/image/gif/692b264bbd5b20d66ecafa761df29467/gr7.sml gr7 gr7.sml sml 2996 93 45 IMAGE-THUMBNAIL 1-s2.0-S1381116907001069-gr8.jpg https://s3.amazonaws.com/prod-ucs-content-store-us-east/content/pii:S1381116907001069/gr8/DOWNSAMPLED/image/jpeg/911134328a376222c45dbcc58fdb4833/gr8.jpg https://s3-eu-west-1.amazonaws.com/prod-ucs-content-store-eu-west/content/pii:S1381116907001069/gr8/DOWNSAMPLED/image/jpeg/911134328a376222c45dbcc58fdb4833/gr8.jpg gr8 gr8.jpg jpg 91824 496 376 IMAGE-DOWNSAMPLED 1-s2.0-S1381116907001069-gr8.sml https://s3.amazonaws.com/prod-ucs-content-store-us-east/content/pii:S1381116907001069/gr8/THUMBNAIL/image/gif/43c7c263c7f0eabac19d06662c5a22e3/gr8.sml https://s3-eu-west-1.amazonaws.com/prod-ucs-content-store-eu-west/content/pii:S1381116907001069/gr8/THUMBNAIL/image/gif/43c7c263c7f0eabac19d06662c5a22e3/gr8.sml gr8 gr8.sml sml 5266 94 71 IMAGE-THUMBNAIL 1-s2.0-S1381116907001069-fx1.jpg https://s3.amazonaws.com/prod-ucs-content-store-us-east/content/pii:S1381116907001069/fx1/DOWNSAMPLED/image/jpeg/1c96d1f467c6beb1febe41630a8d99bf/fx1.jpg https://s3-eu-west-1.amazonaws.com/prod-ucs-content-store-eu-west/content/pii:S1381116907001069/fx1/DOWNSAMPLED/image/jpeg/1c96d1f467c6beb1febe41630a8d99bf/fx1.jpg fx1 true fx1.jpg jpg 35137 112 204 IMAGE-DOWNSAMPLED 1-s2.0-S1381116907001069-fx1.sml https://s3.amazonaws.com/prod-ucs-content-store-us-east/content/pii:S1381116907001069/fx1/THUMBNAIL/image/gif/36e724d025b929f5781a1c42b8789de7/fx1.sml https://s3-eu-west-1.amazonaws.com/prod-ucs-content-store-eu-west/content/pii:S1381116907001069/fx1/THUMBNAIL/image/gif/36e724d025b929f5781a1c42b8789de7/fx1.sml fx1 true fx1.sml sml 7373 69 125 IMAGE-THUMBNAIL MOLCAA 6592 S1381-1169(07)00106-9 10.1016/j.molcata.2007.02.016 Elsevier B.V. Fig. 1 Balls and cylinders model showing a side view of a hypothetical three-layer MoS2 nanoparticle placed at the surface of the support (spheres at the left) that simulates the particles of Ref. [4]. White, gray and black spheres denote the Mo, S and Ni atoms on the edges, respectively. A white rectangle highlights the structure of the site that interacts with the incoming molecules. Right, center and left layers simulate a Mo edge promoted by three Ni atoms, an S edge and a non-promoted Mo edge, respectively. Fig. 2 (Left) Top-view (XZ plane) and (right) side-view (YZ plane) of the NiMoS edges unit cell. M33 (a and b), M66 (c and d) and M100 (e and f) contain one, two and three Ni atoms by cell, respectively. White, gray and black spheres denote the Mo, S and Ni atoms, respectively. The S edges are on the right of each unit cell and expose six S atoms by cell. Fig. 3 (a) Side-view of the atomic basins for the outermost atoms on M33 defined by the metal–sulfur IAS (white structures). Note that these atoms are open system and a practical definition is to cap them with an isosurface (pointed by a white arrow) of ρ(r). (b) Side-view and (c) Top-view of the IAS defining the basin of the outermost S atoms on the Mo edge. (d)–(g) Corresponding views of the outermost Mo and Ni basin on the Mo edge, respectively. Gray spheres denote metal–sulfur bond CPs, respectively. Light blue, and yellow spheres denote Ni and S atoms, respectively. The Mo atoms are almost covered by the S atoms. White ellipses highlight the small atom region open to the exterior. (For interpretation of the references to color in this figure legend, the reader is referred to the web version of the article.) Fig. 4 Top-view of the M33 (a), M66 (b) and M100 (c) surface periodic model showing the IAS defining the basins of the outermost atoms. Dark blue and yellow spheres denote Ni and S atoms, respectively. In (a) an S edge (highlighted by a black brace) with two Mo edges at both sides is showed, while (b) and (c) only show just one Mo edge. Note that the Mo atoms are practically encapsulated by the outermost S atoms. (For interpretation of the references to color in this figure legend, the reader is referred to the web version of the article.) Fig. 5 Top view of the V(r) mapping on the 0.007au contour of ρ(r) defining the outermost border of the Mo edge exposed atoms for (a) M33, (b) M66 and (c) M100. A double cell along to the Mo edge is showed. One cell shows the superposition of the color map on the exposed atoms basins of the Mo-edge while the other cell only shows the V(r) color map. The tab at the bottom is, blue jay (−157.530 to −78.765kJ/mol), blue heaven (−78.765 to −42.008kJ/mol), light blue (−42.008 to −31.506kJ/mol), dark green (−31.506 to −21.004kJ/mol), green (−21.004 to −10.502kJ/mol), light green (−10.502 to 0.000kJ/mol), yellow (0.000 to 26.255kJ/mol), yellow cream (26.255 to 52.510kJ/mol), orange (52.510 to 65.638kJ/mol), brown (65.638 to 78.765kJ/mol), purple (78.765 to 91.893kJ/mol), light red (91.893 to 105.020kJ/mol) and red (105.020 to 144.403kJ/mol). Black arrows pointed to the Ni atoms while black ellipses highlight the small Mo regions exhibited to the exterior of the edge. (For interpretation of the references to color in this figure legend, the reader is referred to the web version of the article.) Fig. 6 Cylinders model for the adsorption optimized geometry (distances in Å) of a pyridine molecule adsorbed on M66 (a), M33 (b) and M100 (c). Light blue, dark blue and yellow cylinders denote Mo, Ni and S atoms for the NiMoS edge model, while dark blue, gray and white cylinders denote the N, C and H atoms of the pyridine molecule. (For interpretation of the references to color in this figure legend, the reader is referred to the web version of the article.) Fig. 7 Side view of the V(r) mapping on the 0.007au contour of ρ(r) defining the outermost border of the pyridine molecule adsorbed on the Mo edge exposed atoms for (a) M66 and (b) M33. The color tab is the same of Fig. 5. White arrows point to the strongest Lewis acid sites while, white square highlight the most negative sites at the pyridine N atom and the outermost S atoms. (For interpretation of the references to color in this figure legend, the reader is referred to the web version of the article.) Fig. 8 (a) Top-view of the Mo edge of M66_uncov surface periodic model with the outermost S atoms extracted to create uncovered Mo atoms showing the IAS defining the basins of the outermost atoms. Dark blue, light blue, and yellow spheres denote Ni, Mo and S atoms, respectively. (b) Top view of the V(r) mapping on the 0.007 au contour of ρ(r) defining the outermost border of the Mo edge exposed atoms for M66_uncov. A double cell along to the Mo edge is showed. One cell shows the superposition of the color map on the exposed atoms basins of the Mo-edge while the other cell only shows the V(r) color map. The tab at the bottom additionally includes white (144.403 to 183.785kJ/mol) and brown (183.785 to 236.295kJ/mol) zones. (For interpretation of the references to color in this figure legend, the reader is referred to the web version of the article.) Table 1 Maximum positive value of V(r) and vacancy creation energy, CE (Eq. (7)) for the studied sites on the metallic edges of the NiMo sulfide Ni coverage V(r) maximum (kJ/mol) on ρ (r)=0.002e/A3 Located at V(r) maximum (kJ/mol) on ρ (r)=0.007e/A3 Located at 100% (Fig. 5a) 45.946 Ni 81.391 Ni 66% (Fig. 5b) 27.305 Ni 66.688 Ni 33% (Fig. 5c) 52.773 Mo 94.781 Mo Ni coverage CE (kJ/mol) V(r) maximum (kJ/mol) on ρ (r)=0.002e/A3 Located at V(r) maximum (kJ/mol) on ρ (r)=0.007e/A3 Located at One sulfur atom removed 66% (Fig. 8) 168.300 137.314 Mo 210.303 Mo 33% 250.649 119.723 Mo Mo Nature of the NiMoS catalyst edge sites: An atom in molecules theory and electrostatic potential studies Yosslen Aray ⁎ Jesús Rodríguez Alba Beatriz Vidal Santiago Coll Centro de Química, IVIC, Apartado 21827, Caracas 1020 A, Venezuela ⁎ Corresponding author. Tel.: +58 212 504 1356; fax: +58 212 504 1350. Graphical abstract The nature of the active sites on the NiMoS catalyst was explored using the combination of the atoms in molecules theory and an electrostatic potential based methodology. The active sites on the catalyst surface were localized visualizing the basin of the outermost atoms of the surface. Direct visualization (see picture at the left) of the interatomic metal–sulfur surface (white structures) defining the basin of the outermost atoms of the studied NiMoS edge models has shown that the Mo atoms are practically covered by the outermost S atoms (yellow spheres) while the promoter Ni (blue spheres) are the most accessible metal atoms to the exterior of the edges. Electrostatic potential mapping on the atomic border exposed to the exterior of the edge (picture at the right) has shown that the most acidity sites (red zones) are located at very small regions (highlighted by black ellipses) at the Mo atoms on the Mo edges. However, the accesses to these sites are very impeded by the outermost S atoms. Adsorption of a molecule containing the pollutant atoms strongly depends on two factors: the Lewis acidity of the site and the repulsive interaction of the incoming molecule with sulfur atoms impeding the free access to the site. In this sense, the main role of the promoter is to produce uncovered Lewis acid sites. The nature of the active sites on the NiMoS catalyst was explored using the combination of the atoms in molecules theory and an electrostatic potential based methodology. Direct visualization of the basin of the outermost atoms of the studied NiMoS edge models has shown that the Mo atoms are practically covered by the outermost S atoms while the promoter Ni are the most accessible atoms to the exterior of the edges. Electrostatic potential mapping on the atomic border exposed to the exterior of the edge and adsorption of pyridine as the probe molecule have shown that the adsorption of a molecule containing the pollutant atoms strongly depends on two factors: the Lewis acidity of the site and the repulsive interaction of the incoming molecule with sulfur atoms impeding the free access to the site. In this sense, the main role of the promoter is to produce sulfur uncovered Lewis acid sites. Extraction of the outermost S atom creates a very strong Lewis acid site locate at uncovered Mo atoms. Keywords HDS Atoms in molecules theory Electrostatic potential NiMoS DFT 1 Introduction Transition metal sulfides (TMS) belong to a very important class of catalysts characterized by being stable under strong conditions in hydrodesulfurization (HDS), hydrodenitrogenation (HDN) and hydrogenation reactions [1–3]. In these processes, the surfaces of the sulfides are reduced by sulfur elimination using large excess of hydrogen at temperature ranging from 573 to 673K creating coordinatively unsaturated sites (CUS) or vacancies around the metals. CUS intervenes as an electron-withdrawing site whose properties may be regarded as a Lewis acid center interacting with electrodonating organic substrates [4–6]. The nature of these sites is suggested to be intimately related to the metal sulfur bond strength [4,5,7,8]. Basic studies support the view that differences in catalytic activities, are related to variations in the concentration of CUS (the Lewis acid sites), which in turn depend on the metal–sulfur bond strength [9–20]. Based on ab initio calculations [2,7], a bond energy model (BEM), which describes the variation in the metal–sulfur bond energies for all the transition metal sulfides was developed. It was found that the trends in the calculated bond energies follow closely the trend in the HDS activities. Nickel- (and cobalt) promoted Molybdenum sulfide catalysts have for many years been among the most important catalysts in refinery service. Studies using X-ray absorption fine structure (EXAFS) have established that the active Mo atom is present as small MoS2-like nanostructures [21,22]. Adsorption and activity experiments [23,24] have revealed that the active sites reside at the edges of the MoS2 structures and a recently high-resolution scanning tunneling microscopy (STM) and density-functional theory (DFT) studies [25] have shown that the MoS2 nanoclusters adopt a hexagonal shape exposing two different types of edges, Mo edges covered with S monomers and fully sulfur-saturated S edges. On the other hand, the incorporation of nickel or cobalt into these edges significantly increases the activity of the catalyst [2,26,27]. Hydrogen species on the surface of catalyst is crucial to catalytic activity. In this sense, Ni facilitated the dissociation of H2 by increasing the stability of the transition state and products for this reaction [28]. Under typical sulfidation conditions Ni prefers to incorporate into the metal edge. A fully Ni promoted metal edge tends to be not covered with sulfur atoms [27]. The addition of one sulfur atom on such a surface is an endothermic process. On a partially promoted metal edge, sulfur atoms bond to the outermost Mo atoms and the promoter atoms tend to be uncovered. The “atoms in molecules theory” (AIM) of Bader et al. is very useful to obtain the chemical information from the charge density [29–38]. AIM is a firm, rigorous and quantum mechanically well-defined theory based on observables such as the electron density or energy density fields. Most modern theories of bonding are based, in one way or another, on the partition of charge (or electronic density) among the different nuclear centers under study, usually by means of Mulliken-i.e., projected density of states in solid-analysis. In this way, an important amount of the interpretative models of chemical behavior are based on concepts that are known to be very badly defined, and to give answers extremely dependent on a whole hierarchy of approximations [36]. AIM provides a quantitative link between the total electron density (regardless of how it was generated: calculated or experimental) and the all important physical properties of a molecule, bypasses the wave function in the analysis. AIM is an orbital concept free methodology. In particular, it provides a rigorous definition of chemical bonds and geometrical structure for all types of molecules and solids and has proven useful in the analysis of physical properties of insulators, pure metals and alloys [32–36]. High-quality experimental densities of minerals [39–43], covalent [44], metallic [45], and molecular crystals [46–49] have been analyzed in terms of AIM concepts. Theoretical calculations on simple metals [35,50–52], alloys and intermetallic phases [53–57], molecular [52,58–60], covalent and ionic crystals have also been reported [36,43,44,52,61,62]. AIM also provides a rigorous topological and quantum mechanical definition of atoms that have been identified with the atom of chemistry. These atoms have shown to recover the essential notions associated with the atomic concept: (i) the atomic properties are characteristic and additive to yield the corresponding values for the total system; (ii) they are as transferable from one system to another as are the forms of the atoms in real space; that is, as transferable as are the atomic charge distribution. In particular, atomic and group properties predicted in this manner have been shown to recover the experimentally determined contributions to the volume, energy, polarizability, and magnetic susceptibility [25]. Additionally, the most agreeable feature of AIM probably is that it lends itself so well to visualization of the atoms using computer graphics. The connection between the topology of the electron density and the chemical and structural stability of isolated molecules and crystals has been well established [30,36,34,19,32,35,63]. Recently, the nature of the MoS2 catalyst edge using AIM was reported [20]. Two interesting facts were observed: first, similar to the bulk case, the layers are bonded by S–S interlayer bonds and second, much bigger electron density on the graphs describing the Mo edge suggests to be the origin of the well-known easiness to create vacancies on the S edge. Additionally, it has found that potential active sites on the catalyst surface can be localized by direct visualization of the outermost surface atoms basin. These atoms, similar to an atom in an isolated molecule, have considerable open parts that extend to infinity. Exposed atoms are open or unbounded at the exterior of the surface and a practical definition [37] is to cap these atoms with an isosurface of the electron density with small ρ(r) value representing the van der Waals envelope of the system. A very efficient way to visualize and quantify the strength of the active sites is to map the electrostatic potential onto colors on this exterior atomic border [20]. In order to continue improving the understanding of HDS catalysts, in the present paper we have explored the nature of the active sites on the NiMoS catalyst using the combination of AIM and the electrostatic potential based methodology of Ref. [20]. 2 The AIM theory The topological properties of a crystal charge distribution are summarized by its critical points (CP) [29,38]. These are points where the gradient vector field, ▿ρ(r) vanishes, and they are classified by the ρ(r) curvatures or three eigenvalues λ i (i =1, 2, and 3) of the Hessian matrix (H ij = ∂ 2 ρ(r)/∂x i ∂x j ). They are labeled by their rank (number of nonzero eigenvalues) and signatures (excess number of positive over negative eigenvalues) and correspond to maxima (3, −3), minima (3, +3), and saddle points (3, +1) and (3, −1). Every CP has a characteristic pattern of trajectories or gradient paths of ρ(r). The trajectories originate and end at critical points. Only the (3, −3) points are three-dimensional trajectory attractors: trajectories only terminate at this CP. The (3, −3) points occur generally at the nuclear positions so that each nucleus is a three-dimensional point attractor in the vector field ▿ ρ(r). The region traversed by the gradient paths, which terminate at a given attractor defines the basin of the attractor. A (3, −1) CP, the bond critical point (b), is found between every pair of neighboring nuclei. It represents both local maxima in two directions and a local minimum in the third direction. The gradient paths associated with the negative eigenvalues at the (3, −1) point terminate at this CP and define the interatomic surfaces, IAS, that partition the crystal into unique fragments (the atomic basins). In general, the boundary of an atom in a crystal consists of the union of its interatomic surfaces. The unique pair of trajectories associated with the positive eigenvalue of the (3, −1) CP originates at this point and terminate at the neighboring attractors. These two unique gradient paths define a line (the bond path) linking the nuclei (n), along which the charge density is a maximum with respect to any neighboring line. The network of bond paths defines a graph, namely the crystal graph, which describes the atomic connectivity and structure within a crystal cell. The other CPs occur as a consequence of the geometrical arrangements of bond paths and they define the remaining elements of crystal structure, namely rings and cages. If the bond paths are linked to form a ring of bonded atoms then a (3, +1) CP is found in the interior of the ring. The eigenvectors associated with the two positive eigenvalues of the (3, +1), a ring (r) CP, generate an infinite set of gradient paths which originate at the CP and define a surface, called the ring surface. All of these trajectories terminate at the ring nuclei or at the bond CPs whose bond paths form the perimeter of the ring. The single negative eigenvector of the ring CP generates a pair of gradient paths, which terminate at the CP and define a unique axis perpendicular to the ring surface at the critical point. The (3, +3) or cage (c) CPs are located inside a cage nuclear arrangement. The charge density is a local minimum at a cage CP and in crystals it is the main source of trajectories of ▿ ρ(r): trajectories only originate at such CPs and terminate at nuclei, bond or ring CPs. The type and numbers of CPs for an extended system [32,37] satisfy the Morse invariant relationships (1) n − b + r − c = 0 3 The electrostatic potential methodology Nature of active sites can be particularly explored using the electrostatic potential, V(r), which let us directly to determine where the electron-rich sites in a molecule or crystal are localized [64–74]. V(r) at a point r generated by a molecule or crystal is given by, (2) V ( r ) = V N ( r ) + V E ( r ) where the two terms V N(r) and V E(r) represent the bare nuclear and electronic contributions, respectively, to the total electrostatic potential. The sign of V(r) at a given point indicates whether the nuclear (positive) or electronic (negative) effects are dominant. The electrostatic potential at r generated by the total charge distribution, ρ tot, of a periodic system is given by, (3) V ( r ) = ∑ n ∫ ρ tot ( r ′ − R n ) | r − r ′ | − 1 d r ′ The summation extends to all direct lattice vectors, the prime on the integral sign indicating that an infinitesimal region about r = r′ is excluded from the domain of integration to avoid divergent nuclear self-interactions terms that would otherwise arise in the electrostatic energy per cell. ρ tot may be decomposed into electronic and nuclear components, (4) ρ nuc ( r ) = ∑ a q a δ ( r a , r ) where the summation extends to all the reference cell nuclei, with atomic numbers and position vectors denoted q a and r a, respectively. (5) ρ el ( r ) = − ∑ i j ∑ μ v P μ R i v R j χ μ ( r − R i ) χ ν ∗ ( r − R i ) where P is the density matrix and χ μ (r − R i ) is the μ th reference cell basis function translated by the direct lattice vector R i . The summations over i and j extend to all direct lattice vectors, while those over μ and ν include all the basis functions of the reference cell. Substitution of Eqs. (4) and (5) into Eq. (3) gives the nuclear and electronic V(r) contributions. For the region nearest to the nucleus V N dominates and V(r) has similar topology to the electron density [75,76], ρ(r). i.e., positive-valued maxima at the nuclear site and a positive-valued saddle point between every pair of bonded atoms. Nevertheless, the existence of maxima is ruled out via an established result that, barring the nuclear position, there can not exist any strict local maxima in the V(r) map [67,68]. For the region where V E dominates (V(r) is negative) the V(r) topography can be more complex. However, it is well known that lone pairs of electrons as well as double π bonds (CC, CN, etc.) are generally characterized as negative valued minima [66,69]. In summary, the region nearest to the nucleus is always positive-valued while the region where the potential is negative-valued contains the minima that characterize the atom lone pairs. The minima of the negative region denote the zones to which an approaching electrophile may be attracted. On the contrary, the positive regions do not have maxima that might indicate sites for nucleophilic attack. Nevertheless, Politzer and Sjoberg have shown that by computing V(r) on the 0.002-electron/bohr3 contour isosurface [77] of the molecular electronic density ρ(r), we can quantify the susceptibility of molecules to nucleophilic attack. They demonstrated that relative magnitudes of the positive electrostatic potential in various regions on this surface do reveal the sites most susceptible to nucleophilic attack. This contour isosurface for a group of diatomic molecules and for methane encompasses at least 95% of the electronic charge and yields physically reasonable molecular dimensions [77]. Mapping on this isosurface the V(r) values onto colors let us to identify the host sites in which nucleophiles (most positive zone) and electrophiles (most negative zone) should bind. Additionally, the active sites susceptibility can be quantify determining the minimum and maximum V(r) values at the determined host zones using a Newton-Raphson technique like to those that we have previously reported for the study of the electronic density [20,78] and electrostatic potential topology [73,74,79]. 4 Computational methodology ρ( r ) and V( r ) were calculated by means of the Dmol3 [80,81] program using the Kohn-Sham Hamiltonian with the gradient-corrected Perdew-Becke-Ernzerhof (PBE) exchange-correlation functional [82]. Dmol3 calculates variational self-consistent solutions to the DFT equations, expressed in an accurate numerical atomic orbital basis. The solutions to these equations provide the molecular electron densities, which can be used to evaluate the total electrostatic potential of the system. The numerical double-zeta plus polarization basis set DNP [80,81] was used in all calculations. DMol3 uses DFT to obtain high accuracy while keeping the computational cost fairly low for an ab-initio method. Six special k points generated using a [431] mesh along the three cell axes and the Monkhorst-Pack scheme [80,81] were used to integrate the wavefunction in the reciprocal space. The topology of ρ(r) was determined using a reported implementation [78] of the Newton-Raphson and fifth-order Cash-Karp Runge-Kutta methods in a ρ(r) three-dimensional grid. 5 Catalyst models STM allows direct imaging of catalytically relevant surface structure on the atomic scale. By studying [25] a realistic HDS model system consisting of few-nanometer-wide gold-supported MoS2 particles it was shown that morphology of the nanoparticles is sensitive to sulfiding and reactions conditions, this means, triangles under heavy sulfiding conditions or truncated hexagons under more sulfo-reductive conditions resembling HDS conditions. These hexagonal clusters expose the basal plane and two different types of edges: Mo edges covered with S monomers and fully-saturated S edges with H atoms adsorbed [25]. Different models have been used to study the edge structure of MoS2 catalysts using DFT methods: cluster models including a finite number of atom [25,83], a single S–Mo–S periodic slab [84,85] and a larger slab model containing two S–Mo–S sheets exposing Mo- and S-edges alternatively [25,27,86–89]. From these studies a clear picture of the MoS2 edge structures has emerged. The most external Mo atoms of the Mo edge contain 50% sulfur coverage with each sulfur atom bridged to two neighboring molybdenum atoms. A significant reconstruction of the Mo edge take places: the bridged S atoms are to be shifted by half a lattice constant relative to the bulk S lattice, and they move down to a bridging position in-plane with the Mo lattice. The S edges of the electronically most stable structure remain fully sulfide [88] and a maximum Mo coordination to six sulfur atoms is achieved in one configuration where the edge is terminated by a row of sulfur atoms positioned in bridge position close to those expected from bulk-terminated MoS2. Both edge geometries lead to a coordination number of six for the outermost molybdenum atoms and two for the corresponding sulfur atoms. The local atomic structure of NiMoS catalysts has been resolved by means of DFT calculations coupled with simple thermodynamics determinations [17,27]. Under typical sulfidation conditions nickel prefers to incorporate into the metal edge in a square planar geometry with no sulfur atoms. On a partially promoted metal edge, sulfur atoms bond to the outermost Mo atoms and the Ni atoms tend to be uncovered [27]. High-resolution electron microscopy studies of silica-supported Mo based catalysts have shown that the morphology of the catalyst can be depicted as small particles dispersed at the surface of the support with an average size of 29Å (mean diameter) and three slabs of wide. Fig. 1 shows a model of such as particle. The structure of the particle edge (the active site) is highlighted by means of a white square. We have modeled these sites by means of the larger slab model (Fig. 2 ) that exposes alternating layers of Mo and S edges denoting nanoparticles several layers wide. The unit cell (9.480Å×12.294Å×36.000Å) of the non-promoted surface exhibits three and six bridged S atoms on the Mo and S edges, respectively [20]. Partial substitution of one or two Mo atoms on the Mo-edge generated an edge structure, M(33), with 33% (Fig. 2a and b) and M(66) with 66% (Fig. 2c and d) Mo atoms substituted by Ni atoms, respectively. Substitution of the three Mo atoms on the Mo-edge generated an edge structure, M(100), with 100% Mo atoms substituted by the Ni atoms (Fig. 2e and f). The unit cells containing a periodic slab of several layers of atoms initially having the same structure of the surface built directly from the bulk. Vacuum layers thicker than 15Å were used to ensure that there were no interactions between adjacent slabs. The geometry of those models was optimized using algorithms included in the Dmol3 program [80,81]. The two upper rows were allowed to relax while the atoms of the lower ones were kept fixed at their optimized bulk positions to simulate bulk constrains. 6 Results Atomic basins, i.e., the volume spanned by the paths ending at a given nucleus, are topologically equivalent to polyhedra, in the sense that they have faces, edges and vertexes, and they satisfy Euleŕs relationship (faces−edges+vertexes=2) [36]. Unlike polyhedra, however, basins tend to have rather curved edges and faces. Vertexes are cage CPs, edges are the attraction lines between cage and ring CPs and each face is the attraction surface of a bond CP, i.e., the IAS. A vision 3D of the metal-S IAS (white structure) defining the basin for the outermost atoms for M33 are given in Fig. 3 . The basin for the outermost S atom (pointed by a white arrow) on the Mo edge, is bordered by two Mo–S interatomic surfaces. This atom, such as an atom in an isolated molecule [38], has considerable open parts that extend to infinity (Fig. 3b and c). A practical definition of open or unbounded atoms at the exterior is to cap the atom with an isosurface of the electron density with small ρ(r) value representing the van der Waals envelope of the system [38]. The 0.007electron/Å3 contour of ρ(r) shown in Fig. 3a just defines the border of the outermost atoms of the NiMoS edges. The basin for the outermost Mo atoms on the Mo-edge (Fig. 3d and e) is bordered by five Mo–S IAS, four shared with its closest S neighbors locate just below them and one shared with the outermost S atom that is locate above them. This later IAS corresponds just to a half of the outermost sulfur atom base and almost covers and encapsulates the Mo atoms. The basin for the Ni atom (Fig. 3f and g) is bordered by four Ni–S IAS and likes to the outermost S atom is open to the exterior of the NiMoS edges. Thus, the outermost atoms of the NiMoS edges are mainly defining by metal–sulfur interatomic surfaces. A recently study of the MoS2 edges has shown that direct visualization of the structure and shape of the basin of these metal–sulfur IAS allow us to locate the Lewis acid site (the CUS) on the surface edges [20]. In the same way, Fig. 4 shows a top view of super-cells for the studied NiMoS edge models. As we can see, similar to the non-promoted MoS2 catalyst, the Mo atoms are mainly covered by the outermost sulfur atoms which obstruct the Mo interaction with the pollutant sulfur (or nitrogen) atoms on the incoming molecules (pyridine, thiophene, dibenzothiophene, etc.). The basins for the outermost S atoms on the S edges show exactly the same structure and shape of the corresponding atoms of the un-promoted MoS2 edges. Thus, the metal atoms most accessible to the exterior of the edges are the Ni atoms (dark blue spheres). HDS susceptibility of the sites on the exposed atoms can be particularly explored mapping the electrostatic potential on the ρ(r) isosurface capping them [20]. This mapping allows us to identify the host sites in which nucleophiles (most positive zone) and electrophiles (most negative zone) should bind. Additionally, the local maximum value of V(r) at the determined host zones provides a quantitative determination of the Lewis acidity strength on the outermost atoms. For the non-promoted MoS2 catalyst [79], a site obtained by removing three S atoms from the cell, just on the S edge, with 50% of sulfur coverage was suggested to be the HDS potential active site. A hole in the IAS defining the outermost S atoms corresponds to the site where the Mo atoms are most accessible to the incoming molecules. Located at this hole, a V(r) maximum on the ρ(r) isosurface with a value of 51.982kJ/mol was determined [79]. A top view of the V(r) color maps for the NiMoS Mo-edge models studied in the present paper are shown in Fig. 5 . A double cell along to the Mo edge is showed. One cell shows the superposition of the color map on the exposed atoms basins of the Mo-edge while the other cell only shows the V(r) color map. Starting from the most negative V(r) values (see caption of Fig. 5), three kinds of blue and three kinds of green denote the most negative ones while two kinds of yellows, one orange, one brown, one purple and two kinds of red denote the positive V(r) values. M33 (Fig. 5a) exhibits small areas of red zones (highlighted by black ellipses) localized at both sides of the Mo basin, just at small holes in the IAS that define the outermost S atom. These red zones are the most positive sites on M33. Purple zones (pointed by black arrows) at the Ni atoms suggest that these atoms are less acid than the Mo atoms. Fig. 5b suggests that all the atoms of M66 are less acid than M33. Negative green zones cover the outermost S atoms which in turn totally cover the Mo atoms, while brown zones (less positive than the purple one) are localized on the Ni atoms. Fig. 5c shows a purple zone on each Ni atom of M100 suggesting that the Lewis acidity of these atoms increase with regard to the corresponding atoms of M66 and it make no difference with M33. The determined V(r) maxima values by Mo-edge cell are presented in Table 1 . These values are reported for the mapping on two ρ(r) isosurfaces, ρ(r)=0.002 and ρ(r)=0.007e/Å3. This later isosurface (0.001au) can be considered as the practical outer limit of the atoms in molecules, crystals or surfaces; because, in general, it encompasses at least 95% of the electronic charge of the system [38]. However, any ρ(r) isosurface closest to 0.007e/Å3 leads to same deductions: the maxima (or minima) are exactly at the same place. The V(r) value at these maxima depends on the ρ(r) isosurface value: in general, V(r) increase as the ρ(r) isosurface value increase and the isosurface is closer to the atomic nuclei. However, in a series of molecules or surfaces, the V(r) maxima show exactly the same trends. Thus, the obtained trends for both isosurfaces is, ρ(r)=0.007e/Å3:Mo_M33 (94.781)>Ni_M33 (79.815)≈Ni_M100 (81.391)>Ni_M66 (66.688), ρ(r)=0.002e/Å3:Mo_M33 (52.773)>Ni_M33 (45.421)≈Ni_M100 (45.946)>Ni_M66 (27.305). These results suggest that the most Lewis acidity sites (the most positive one) on the NiMoS edge models are localized on the M33 Mo atoms. The Ni atom for M33 and M100 should exhibit almost the same acidity, while for M66 the acidity of the Ni atoms appreciably decreases. M100 and M66 should be less acid than non-promoted MoS2 catalyst (V(r)max =51.982kJ/mol on the ρ(r) isosurface=0.002e/Å3) and the most acid site at M33 should be similar acid than the non-promoted MoS2 edges. However, an appreciable improves of the Lewis acidity strength was reported for the promoted catalyst system using FTIR spectroscopy [4] and DFT theoretical study [90] with pyridine, PY, as the probe molecule. On non-promoted catalyst and a CoMoS phase, PY adsorption rise to bands at 1600 (of low intensity) and 1609 (of high intensity) cm−1, respectively [4]. In agreement with this experimental results, DFT calculations of the adsorption energy of a pyridine molecule on periodic models of non-promoted [79] and on the M100 Ni-edge [90] have reported values of 88.852 and 124.466kJ/mol, respectively. From this trend it is evident that in the adsorption of PY on the NiMoS edges other additional features should be considered. Therefore, we have explored the binding of PY on the three studies models, using Dmol3 again. A PY molecule was placed inside the surface unit cell, on the considered metal atom, aligned as the V(r) map predicts. The geometry was fully optimized to their most energetically favorable positions, maintaining fixed the two innermost layers at the bottom of the cell. The predicted geometries are shown in Fig. 6 and the trend of binding energy, BE, obtained was, M100(128.650kJ/mol)>M33(108.696kJ/mol)>M66(57.971kJ/mol) The smaller BE was found for M66, where the nitrogen atom of PY is adsorbed on top of a Ni atom with a bond distance nitrogen–nickel, ReN–Ni of 2.752Å. The nitrogen atom is just at the side of an outermost S atom doing an interatomic distance nitrogen–sulfur, ReN–S of 3.582Å. For M33, an increase around of 100% in BE with respect to M66 was obtained. PY is adsorbed atop of the only Ni atom of the cell, with ReN–Ni and RN–S equals to 2.030 and 4.825Å, respectively. For M33, the access to the most acidity site which is located at the Mo atom is not allowed for the outermost S atoms. An additional increases of 18% in BE was determined for M100 where PY also adsorbs on top of a Ni atom with ReN–Ni =1.994Å. To further examine these findings, we have studied the V(r) color maps ρ(r)=0.002e/Å3 for the interaction of the PY molecule with M66 and M33 and the results are shown in Fig. 7 . For PY a negative zone embraces the nonbonding region of the N atom (blue zone) with a minimum value (denotes as a white square in Fig. 7) of −115.522kJ/mol while a negative zone (green zone) with a local minimum of −12.864kJ/mol covers the M66 outermost sulfur atom (Fig. 7a). Repulsion between both negative regions impedes the free access to the Lewis acid sites (denote as white arrows). The outermost S atoms for M33 (Fig. 7b) show a light green zone with a local minimum of −5.536kJ/mol just at the center of the atom. This smaller minimum and the presence of a positive valley between the outermost S atoms allow a comfortable interaction with the N negative blue zone of PY. From these results it is evident that the N atom of PY has a tendency to adsorb at sites where the repulsive nitrogen-outermost S interaction is minimized. Thus, the PY adsorption strongly depends on two factors: the Lewis acidity of the site and the repulsive interaction of the N atom with S atoms impeding the free access to the site. PY binding on a site like to M100 containing an uncovered by sulfur atoms site with V(r)max =45.946kJ/mol shows an increase of 18% and 45%, respect to M33 and the non-promoted MoS2 edges [79], that contain obstructed Lewis acid sites with V(r)max of 52.773 and 51.982kJ/mol, respectively. In this sense, the main role of the promoter is to produce uncovered Lewis acid sites. The effect on the stability of the non-promoted MoS2 edge surface of the reaction conditions such as temperature and partial pressure of H2 and H2S present in the surrounding atmosphere has been reported [88], using a combination of periodic DFT calculations and thermodynamic analysis. It was found that the sulfur coverage of both kinds of edges is strongly dependent on the H2S/H2 partial pressure ratio in the surrounding gas phase. For high pressure of H2S the surface with six sulfur atoms at the S edge is the most stable surface. For high hydrogen pressure, that should correspond to the catalyst working conditions, the surface with 50% sulfur coverage (three sulfur vacancies by cell) at the S edge, AS, should be the most stable surface. Vacancies or CUS are created by a reduction process where H2 reacts with exposed sulfur atoms to produce H2S and therefore, the energy to create a sulfur vacancy can be calculated using the following equilibrium: (6) Surface-S+H2 ⇔Surface-□+H2S. Thus, the creation energy, CE, of a sulfur vacancy is given by the expression: (7) CE=E(Surface-□)+E(H2S)−E(Surface-S)−E(H2) Removal of three S atoms on the sulfur edge to create the non-promoted AS only needs 72.579kJ/mol while removal of just one S atom on the Mo edge costs 153.345kJ/mol [79]. In spite of this thermodynamic result, kinetic modeling [89] of H2S removal from the edge surfaces has shown that is possible to extract one S atom per Mo edge creating a very small number of vacancy/cell on this edge. However, the previous study [79] of the MoS2 edge vacancies Lewis acidity strength has shown that just one CUS on the Mo edge creates weak Lewis acid sites, even weaker than AS. In order to obtain very acid sites at least two atoms have to be removed at the Mo edges, but to a cost of a huge (271.810kJ/mol) creation energy. These results confirm the presence of available weak Lewis acidic sites on the non-promoted MoS2 catalyst such as AS at the catalytic reaction conditions. In the present work, we have studied the removal of the outermost S atom for M33 and M66 using Eq. (7) and the obtained CEs are also listed in Table 1. M33 and M66 contain and sites. For M66, the energy cost (168.30kJ/mol) for creating a totally uncovered sulfur site, M66unconv, corresponds to an increase of only 10% of the corresponding cost (153.345kJ/mol) to extract an S atom on the non-promoted Mo edge. However, different to the non-promoted catalysts, M66unconv (see Fig. 8 ) contains very strong Lewis acid sites with V(r)max =137.314kJ/mol on ρ(r)=0.002e/Å3. If similar for the non-promoted MoS2, the extraction of a sulfur atom on the Mo edge is possible then a strong Lewis acid site like to M66unconv will be present at the particles edge of the NiMoS catalyst. TDS, XPS and hydrogen-chemisorption studies [28a] and Ab initio DFT study of hydrogen dissociation on NiMoS including mechanism, kinetics and vibrational frequencies [28d] have found that H2 could dissociate on the Ni sites and move to react with S centers and form a S vacancy. Thus, in general, we can conclude that the main role of the Ni atoms is to make possible the formation of uncovered metal sites at the Mo edges of the MoS2 nanocrystallites and the most Lewis acid sites should be located at Ni–Mo–Ni sites containing uncovers Mo atoms. 7 Concluding remarks Direct visualization of the basin of the outermost atoms of the studied NiMoS edge models has shown that the Mo atoms are practically covered by the outermost S atoms while the promoter Ni are the most accessible atoms to the exterior of the edges. V(r) mapping on the ρ(r) isosurface capping the outermost edge atoms and adsorption of pyridine as the probe molecule have shown that the adsorption of a molecule containing the pollutant atoms strongly depends on two factors: the Lewis acidity of the site and the repulsive interaction of the incoming molecule with outermost sulfur atoms impeding the free access to the site. In this sense, the main role of the promoter is to produce sulfur uncovered Lewis acid sites. To obtain very strong Lewis acidic sites, the outermost S atom has to be extracted to create uncovered Mo atoms located at Ni–Mo–Ni sites. References [1] O. Weisser S. Landa Sulfide Catalysts: Their Properties and Applications 1973 Pergamon Oxford, UK [2] H. Topsoe B.S. Clausen F.E. Massoth Hydrotreating Catalysis Science and Technology vol. 11 1996 Springer Verlag Berlin [3] J.A. Rodriguez J. Dvorak A.T. Capitano A.M. Gabelnick J.L. Gland Surf. Sci. 429 1999 L462 L468 [4] G. Berhault M. Lacroix M. Breysse F. Maugé J.-C. Lavalley H. Nie L. Qu J. Catal. 178 1998 555 565 [5] M. Breysse G. Berhault S. Kasztelan M. Lacroix F. Maugé G. Perot Catal. Today 66 2001 13 20 [6] R. Pis Diez A.H. Jubert J. Mol. Catal. 83 1993 219 325 [7] (a) J.K. NØrskov B.S. Clausen H. TopsØe Catal. Lett. 13 1992 1 8 (b) H. TopsØe B.S. Clausen N.-Y. TopsØe J.K. NØrskov C.V. Ovesen C.J.H. Jacobsen Bull. Soc. Chim. Belg. 104 1995 283 [8] (a) H. Toulhoat G. Kresse Am. Chem. Soc. Div. Petrol. Chem. Prepr. 42 1997 114 (b) H. Toulhoat P. Raybaud S. Kasztelan G. Kresse J. Hafner Catal. Today 50 1999 629 636 [9] (a) T.A. Pecoraro R.R. Chianelli J. Catal. 67 1981 430 445 (b) R.R. Chianelli G. Berhault P. Raybaud S. Kasztelan J. Hafner H. Toulhoat Appl. Catal. A: Gen. 227 2002 83 96 [10] R.R. Chianelli M. Daage M.J. Ledoux Adv. Catal. 40 1994 117 232 [11] S. Harris R.R. Chianelli J. Catal. 86 1984 400 412 H. Toulhoat P. Raybaud J. Catal. 216 2003 63 72 [12] J.P.R. Vissers C.K. Groot E.M. Vanoers V.H.J. de Beer Bull. Soc. Chim. Belg. 93 1984 813 821 [13] M.J. Ledoux O. Michaux G. Agostini P. Panisso J. Catal. 102 1986 275 288 [14] J.K. Burdett J.T. Chung Surf. Sci. Lett. 236 1990 L353 L357 [15] T.S. Smith K.H. Johnson Catal. Lett. 28 1994 361 [16] P. Raybaud G. Kresse J. Hafner H. Toulhoat J. Phys.: Condens. Matter 9 1997 11085 11106 [17] P. Raybaud J. Hafner G. Kresse S. Kasztelan H. Toulhoat J. Catal. 190 2000 128 143 [18] M. Neurock R.A. van Santen J. Am. Chem. Soc. 116 1994 4427 4439 [19] Y. Aray J. Rodriguez D. Vega E.N. Rodriguez-Arias Angew. Chem. Int. Ed. 39 2000 3810 3813 [20] Y. Aray, J. Rodriguez, J. Mol. Catal. A: Chem., in press. [21] B.S. Clausen B. Lengeler R. Candia J. Als-Nielsen H. Topsoe Bull. Soc. Chim. Belg. 90 1981 1249 1259 [22] T.G. Parham R.P. Merrill J. Catal. 85 1984 295 310 [23] S.J. Tauster T.A. Pecoraro R.R. Chianelli J. Catal. 63 1980 515 519 [24] H. Topsoe R. Candia N.Y. Topsoe B.S. Clausen Bull. Soc. Chim. Belg. 93 1984 783 806 [25] (a) J.V. Lauritsen M.V. Bollinger E. Lægsgaard K.W. Jacobsen J.K. Nørskov B.S. Clausen H. Topsøe F. Besenbacher J. Catal. 221 2004 510 522 (b) H. Schweiger P. Raybaud H. Toulhoat J. Catal. 212 2002 33 38 (c) P. Raybaud J. Hafner G. Kresse S. Kasztelan H. Toulhoat J. Catal. 189 2000 129 146 (d) H. Schweiger P. Raybaud G. Kresse H. Toulhoat J. Catal. 207 2002 76 87 [26] R. Prins V.H.J. de Beer G.A. Somorjai Catal. Rev.-Sci. Eng. 31 1989 1 41 [27] (a) M. Sun J. Adjaye A.E. Nelson Appl. Catal. A: Gen. 263 2004 131 143 (b) M. Sun J. Adjaye A.E. Nelson J. Catal. 226 2004 32 40 [28] (a) J.A. Rodriguez S.Y. Li J. Hrbek H.H. Huang G.-Q. Xu Surf. Sci. 370 1997 85 (b) J.A. Rodriguez J. Phys. Chem. B 101 1977 7524 (c) M. Sun A. Nelson J. Adjaye Catal. Today 105 2005 36 (d) M. Sun Adjaye J. Catal. 233 2005 411 [29] (a) R.F.W. Bader Atoms in Molecules-q Quantum Theory 1990 Clarendon Press Oxford, UK (b) R.F.W. Bader Chem. Rev. 91 1991 893 [30] R.F.W. Bader J. Phys. Chem. A 102 1998 7314 7323 [31] R.F.W. Bader P.L.A. Popelier T.A. Keith Angew. Chem. Intl. Ed. Eng. 33 1994 620 631 [32] P.F. Zou R.F.W. Bader Acta Crystallogr. A50 1994 714 725 [33] M.E. Eberhart J. Can. Chem. Soc. 74 1996 1229 [34] M.E. Eberhart Philos. Mag. A 73 1996 47 [35] Y. Aray J. Rodriguez D. Vega J. Phys. Chem. B 104 2000 4608 [36] M.A. Pendás A. Costales V. Luaña Phys. Rev. B 55 1997 4275 [37] P. Popelier Atoms in Molecules—An Introduction 2000 Prentice Hall Harlow-England [38] R.J. Gillespie P.L.A. Popelier Chemical Bonding and Molecular Geometry: From Lewis to Electrón Densities 2001 Oxford University Press New York, Oxford [39] N.E. Ghermani C. Lecomte Y. Dusausoy Phys. Rev. B 53 1996 4231 [40] C.L. Hénaff N.K. Hansen J. Protas G. Marnier Acta Crystallogr., B 53 1997 870 [41] Y.V. Ivanov E.L. Belokoneva J. Protas N.K. Hansen V.G. Tirelson Acta Crystallogr. B 54 1998 774 [42] T.S. Koritsanszky P. Coppens Chem. Rev. 101 2001 1583 [43] R.T. Downs G.V. Gibbs M.B. Boisen Jr. K.M. Rosso Phys. Chem. Miner. 29 2002 369 [44] Y.A. Abramov F.P. Okamura Acta Crystallogr. A 53 1997 187 [45] M. Takata M. Sakata S. Kumazawa F.K. Larsen B. Iversen Acta Crystallogr. A 50 1994 330 [46] S.F. Vyboishchikov A.E. Masunov V.A. Streltsov P.M. Zorkii V.G. Tirelson Zh. Fiz. Khim. 68 1994 2024 [47] R. Boese A.D. Boese D. Blazer M.Y. Antipin A. Ellern K. Seppelt Angew. Chem. Int. Ed. Engl. 36 1997 1489 [48] R. Boese N. Niederprum D. Blazer A. Maulitz M.Y. Antipin P.R. Mallison J. Phys. Chem. B 101 1997 5794 [49] P. Munshi T.N. Guru Row Crystallogr. Rev. 11 2006 199 [50] C.J. Mei K.E. Edgecombe V.H. Smith A. Heilingbrunner Int. J. Quantum Chem. 48 1993 287 [51] Y. Aray J. Rodríguez J. Rivero J. Phys. Chem. A 101 1997 6976 [52] P. Mori-Sánchez, Densidad electrónica y enlace químico, De la molécula al cristal, Ph.D. Thesis, Universidad de Oviedo, 2002. [53] M.E. Eberhart D.P. Clougherty J.M. MacLaren J. Am. Chem. Soc. 115 1993 5762 [54] M.E. Eberhart D.P. Clougherty J.M. MacLaren J. Mater. Res. 8 1993 438 [55] U. Haussermann S. Wengert R. Nesper Angew. Chem. Int. Ed. Engl. 33 1994 2073 [56] G.H. Grosch K.J. Range J. Alloys Compd. 233 1996 39 [57] M. Knecht H. Ebert W. Bensch J. Alloys Compd. 246 1997 166 [58] V.G. Tirelson P. F: Zou T.H. Tang R.F.W. Bader Acta Crystallogr. A 51 1995 143 [59] C. Gatti V.R. Saunders C. Roetti J. Chem. Phys. 101 1994 10686 [60] J.A. Plats S.T. Howard J. Chem. Phys. 105 1996 4668 [61] V. Luaña A. Costales P. Mori-Sánchez M.A. Pendás J. Phys. Chem. B 107 2003 4912 [62] M.A. Blanco A. Costales A.M. Pendás V. Luaña Phys. Rev. B 62 2000 12028 [63] M.A. Pendás A. Costales V. Luaña Phys. Rev. B 55 1997 4285 [64] M. Leboeuf M. Koster K. Jug D.R. Salahub J. Chem. Phys. 111 1999 4893 [65] S.R. Gadre R.N. Shirsat Electrostatics of Atoms and Molecules 2000 Universities Press Hyderabad [66] (a) S.S. Pingale S.R. Gadre L.J. Batolotti J. Phys. Chem. A 102 1998 9987 (b) M.M. Deshmukh N.V. Sastry S.R. Gadre J. Chem. Phys. 121 2004 12402 (c) K.A. Joshi S.P. Gejji J. Mol. Struct. Theochem. 724 2005 87 (d) H. Tachikawa T. Iyama H. Kawabata J. Mol. Struct. Theochem 718 2005 117 [67] (a) R.K. Pathak S.R. Gadre J. Chem. Phys. 93 1990 1770 (b) S.R. Gadre S.A. Kulkarni I.H. Shrivastava J. Chem. Phys. 96 1992 5253 [68] S.R. Gadre R.K. Pathak Proc. Ind. Acad. Sci. (Chem. Sci). 102 1989 18 [69] (a) C. Alhambra F.J. Luque M. Orozco J. Phys. Chem. 99 1995 3084 (b) P. Kornelak A. Michalak M. Najbar Catal. Today 101 2005 175 (c) A. Michalak Chem. Phys. Lett. 386 2004 346 [70] P. Politzer D.G. Truhlar Chemical Applications of Atomic and Molecular Electrostatic Potentials 1982 Plenum New York [71] J.S. Murray K.D. Sen Molecular Electrostatic Potential: Concepts and Applications 1996 Elsevier Amsterdam [72] M. Orozco F.J. Luque Theor. Comput. Chem. Ser. 3 1996 181 [73] Y. Aray M. Marquez J. Rodríguez S. Coll Y. Simón-Manso C. Gonzalez D.A. Weitz J. Phys. Chem. B 107 2003 8946 [74] (a) Y. Aray M. Marquez J. Rodríguez S. Coll Y. Simón-Manso C. Gonzalez D.A. Weitz J. Phys. Chem. B 108 2004 2418 (b) Y. Aray J. Rodríguez S. Coll C. Gonzalez M. Marquez J. Phys. Chem. B 108 2004 18942 [75] Y. Tal R.F.W. Bader J. Erkku Phys. Rev. A 21 1980 1 [76] T.A. Keith R.F.W. Bader Y. Aray Int. J. Quant. Chem. 57 1996 183 [77] P. Sjoberg P. Politzer J. Phys. Chem. 94 1990 3959 [78] Y. Aray, J. Rodriguez, D. Vega, in: C.F. Matta, R.J. Boyd (Eds.), The Quatum Theory of Atoms in Molecules: From DNA to Solid and Drug Design, Wiley–VCH, Weinheim, in press. [79] Y. Aray J. Rodriguez S. Coll E. Rodríguez-Arias D. Vega J. Phys. Chem. B 109 2005 23564 23570 [80] DMol3 is available as part of Material Studio. Accelrys Inc., San Diego, USA, 2002. [81] B. Delley J. Chem. Phys. 92 1990 508 B. Delley J. Chem. Phys. 113 2000 7756 [82] J.P. Perdew K. Burke M. Emzerhof Phys. Rev. Lett. 77 1996 3865 [83] L.S. Byskov J.K. Norskov B.S. Clausen H. Topsoe Catal. Lett. 64 2000 95 [84] L.S. Byskov J.K. Norskov B.S. Clausen H. Topsoe Catal. Lett. 47 1997 177 [85] L.S. Byskov J.K. Norskov B.S. Clausen H. Topsoe J. Catal. 187 1999 109 [86] P. Raybaud J. Hafner H. Kresse H. Toulhoat Phys. Rev. Lett. 80 1998 1481 [87] P. Raybaud J. Hafner H. Kresse H. Toulhoat Surf. Sci. 407 1998 237 [88] S. Cristol J.F. Paul E. Payen D. Bougeard F. Clemendot F. Hutschka J. Phys. Chem. 104 2000 11220 [89] J.F. Paul E. Payen J. Phys. Chem. B 107 2003 4057 [90] M. Sun A. Nelson J. Adjaye J. Catal. 231 2005 223",
      "scopus-id": "34248185652",
      "coredata": {
        "eid": "1-s2.0-S1381116907001069",
        "dc:description": "The nature of the active sites on the NiMoS catalyst was explored using the combination of the atoms in molecules theory and an electrostatic potential based methodology. Direct visualization of the basin of the outermost atoms of the studied NiMoS edge models has shown that the Mo atoms are practically covered by the outermost S atoms while the promoter Ni are the most accessible atoms to the exterior of the edges. Electrostatic potential mapping on the atomic border exposed to the exterior of the edge and adsorption of pyridine as the probe molecule have shown that the adsorption of a molecule containing the pollutant atoms strongly depends on two factors: the Lewis acidity of the site and the repulsive interaction of the incoming molecule with sulfur atoms impeding the free access to the site. In this sense, the main role of the promoter is to produce sulfur uncovered Lewis acid sites. Extraction of the outermost S atom creates a very strong Lewis acid site locate at uncovered Mo atoms.",
        "openArchiveArticle": "false",
        "prism:coverDate": "2007-06-18",
        "openaccessUserLicense": null,
        "prism:aggregationType": "Journal",
        "prism:url": "https://api.elsevier.com/content/article/pii/S1381116907001069",
        "dc:creator": [
          {
            "@_fa": "true",
            "$": "Aray, Yosslen"
          },
          {
            "@_fa": "true",
            "$": "Rodríguez, Jesús"
          },
          {
            "@_fa": "true",
            "$": "Vidal, Alba Beatriz"
          },
          {
            "@_fa": "true",
            "$": "Coll, Santiago"
          }
        ],
        "link": [
          {
            "@_fa": "true",
            "@rel": "self",
            "@href": "https://api.elsevier.com/content/article/pii/S1381116907001069"
          },
          {
            "@_fa": "true",
            "@rel": "scidir",
            "@href": "https://www.sciencedirect.com/science/article/pii/S1381116907001069"
          }
        ],
        "dc:format": "application/json",
        "openaccessType": null,
        "pii": "S1381-1169(07)00106-9",
        "prism:volume": "271",
        "prism:publisher": "Elsevier B.V.",
        "dc:title": "Nature of the NiMoS catalyst edge sites: An atom in molecules theory and electrostatic potential studies",
        "prism:copyright": "Copyright © 2007 Elsevier B.V. All rights reserved.",
        "openaccess": "0",
        "prism:issn": "13811169",
        "prism:issueIdentifier": "1-2",
        "dcterms:subject": [
          {
            "@_fa": "true",
            "$": "HDS"
          },
          {
            "@_fa": "true",
            "$": "Atoms in molecules theory"
          },
          {
            "@_fa": "true",
            "$": "Electrostatic potential"
          },
          {
            "@_fa": "true",
            "$": "NiMoS"
          },
          {
            "@_fa": "true",
            "$": "DFT"
          }
        ],
        "openaccessArticle": "false",
        "prism:publicationName": "Journal of Molecular Catalysis A: Chemical",
        "prism:number": "1-2",
        "openaccessSponsorType": null,
        "prism:pageRange": "105-116",
        "prism:endingPage": "116",
        "pubType": "fla",
        "prism:coverDisplayDate": "18 June 2007",
        "prism:doi": "10.1016/j.molcata.2007.02.016",
        "prism:startingPage": "105",
        "dc:identifier": "doi:10.1016/j.molcata.2007.02.016",
        "openaccessSponsorName": null
      },
      "objects": {
        "object": [
          {
            "@category": "thumbnail",
            "@height": "38",
            "@width": "315",
            "@_fa": "true",
            "$": "https://api.elsevier.com/content/object/eid/1-s2.0-S1381116907001069-si5.gif?httpAccept=%2A%2F%2A",
            "@multimediatype": "GIF image file",
            "@type": "ALTIMG",
            "@size": "1352",
            "@ref": "si5",
            "@mimetype": "image/gif"
          },
          {
            "@category": "thumbnail",
            "@height": "34",
            "@width": "152",
            "@_fa": "true",
            "$": "https://api.elsevier.com/content/object/eid/1-s2.0-S1381116907001069-si4.gif?httpAccept=%2A%2F%2A",
            "@multimediatype": "GIF image file",
            "@type": "ALTIMG",
            "@size": "638",
            "@ref": "si4",
            "@mimetype": "image/gif"
          },
          {
            "@category": "thumbnail",
            "@height": "41",
            "@width": "267",
            "@_fa": "true",
            "$": "https://api.elsevier.com/content/object/eid/1-s2.0-S1381116907001069-si3.gif?httpAccept=%2A%2F%2A",
            "@multimediatype": "GIF image file",
            "@type": "ALTIMG",
            "@size": "1123",
            "@ref": "si3",
            "@mimetype": "image/gif"
          },
          {
            "@category": "thumbnail",
            "@height": "14",
            "@width": "145",
            "@_fa": "true",
            "$": "https://api.elsevier.com/content/object/eid/1-s2.0-S1381116907001069-si2.gif?httpAccept=%2A%2F%2A",
            "@multimediatype": "GIF image file",
            "@type": "ALTIMG",
            "@size": "502",
            "@ref": "si2",
            "@mimetype": "image/gif"
          },
          {
            "@category": "thumbnail",
            "@height": "13",
            "@width": "122",
            "@_fa": "true",
            "$": "https://api.elsevier.com/content/object/eid/1-s2.0-S1381116907001069-si1.gif?httpAccept=%2A%2F%2A",
            "@multimediatype": "GIF image file",
            "@type": "ALTIMG",
            "@size": "356",
            "@ref": "si1",
            "@mimetype": "image/gif"
          },
          {
            "@category": "standard",
            "@height": "29",
            "@width": "105",
            "@_fa": "true",
            "$": "https://api.elsevier.com/content/object/eid/1-s2.0-S1381116907001069-fx2.gif?httpAccept=%2A%2F%2A",
            "@multimediatype": "GIF image file",
            "@type": "IMAGE-DOWNSAMPLED",
            "@size": "503",
            "@ref": "fx2",
            "@mimetype": "image/gif"
          },
          {
            "@category": "thumbnail",
            "@height": "34",
            "@width": "125",
            "@_fa": "true",
            "$": "https://api.elsevier.com/content/object/eid/1-s2.0-S1381116907001069-fx2.sml?httpAccept=%2A%2F%2A",
            "@multimediatype": "GIF image file",
            "@type": "IMAGE-THUMBNAIL",
            "@size": "672",
            "@ref": "fx2",
            "@mimetype": "image/gif"
          },
          {
            "@category": "standard",
            "@height": "31",
            "@width": "95",
            "@_fa": "true",
            "$": "https://api.elsevier.com/content/object/eid/1-s2.0-S1381116907001069-fx3.gif?httpAccept=%2A%2F%2A",
            "@multimediatype": "GIF image file",
            "@type": "IMAGE-DOWNSAMPLED",
            "@size": "429",
            "@ref": "fx3",
            "@mimetype": "image/gif"
          },
          {
            "@category": "thumbnail",
            "@height": "40",
            "@width": "125",
            "@_fa": "true",
            "$": "https://api.elsevier.com/content/object/eid/1-s2.0-S1381116907001069-fx3.sml?httpAccept=%2A%2F%2A",
            "@multimediatype": "GIF image file",
            "@type": "IMAGE-THUMBNAIL",
            "@size": "568",
            "@ref": "fx3",
            "@mimetype": "image/gif"
          },
          {
            "@category": "standard",
            "@height": "276",
            "@width": "376",
            "@_fa": "true",
            "$": "https://api.elsevier.com/content/object/eid/1-s2.0-S1381116907001069-gr1.jpg?httpAccept=%2A%2F%2A",
            "@multimediatype": "JPEG image file",
            "@type": "IMAGE-DOWNSAMPLED",
            "@size": "45798",
            "@ref": "gr1",
            "@mimetype": "image/jpeg"
          },
          {
            "@category": "thumbnail",
            "@height": "92",
            "@width": "125",
            "@_fa": "true",
            "$": "https://api.elsevier.com/content/object/eid/1-s2.0-S1381116907001069-gr1.sml?httpAccept=%2A%2F%2A",
            "@multimediatype": "GIF image file",
            "@type": "IMAGE-THUMBNAIL",
            "@size": "4184",
            "@ref": "gr1",
            "@mimetype": "image/gif"
          },
          {
            "@category": "standard",
            "@height": "940",
            "@width": "760",
            "@_fa": "true",
            "$": "https://api.elsevier.com/content/object/eid/1-s2.0-S1381116907001069-gr2.jpg?httpAccept=%2A%2F%2A",
            "@multimediatype": "JPEG image file",
            "@type": "IMAGE-DOWNSAMPLED",
            "@size": "166720",
            "@ref": "gr2",
            "@mimetype": "image/jpeg"
          },
          {
            "@category": "thumbnail",
            "@height": "93",
            "@width": "75",
            "@_fa": "true",
            "$": "https://api.elsevier.com/content/object/eid/1-s2.0-S1381116907001069-gr2.sml?httpAccept=%2A%2F%2A",
            "@multimediatype": "GIF image file",
            "@type": "IMAGE-THUMBNAIL",
            "@size": "2550",
            "@ref": "gr2",
            "@mimetype": "image/gif"
          },
          {
            "@category": "standard",
            "@height": "668",
            "@width": "766",
            "@_fa": "true",
            "$": "https://api.elsevier.com/content/object/eid/1-s2.0-S1381116907001069-gr3ad.jpg?httpAccept=%2A%2F%2A",
            "@multimediatype": "JPEG image file",
            "@type": "IMAGE-DOWNSAMPLED",
            "@size": "176255",
            "@ref": "gr3ad",
            "@mimetype": "image/jpeg"
          },
          {
            "@category": "thumbnail",
            "@height": "93",
            "@width": "107",
            "@_fa": "true",
            "$": "https://api.elsevier.com/content/object/eid/1-s2.0-S1381116907001069-gr3ad.sml?httpAccept=%2A%2F%2A",
            "@multimediatype": "GIF image file",
            "@type": "IMAGE-THUMBNAIL",
            "@size": "5684",
            "@ref": "gr3ad",
            "@mimetype": "image/gif"
          },
          {
            "@category": "standard",
            "@height": "702",
            "@width": "644",
            "@_fa": "true",
            "$": "https://api.elsevier.com/content/object/eid/1-s2.0-S1381116907001069-gr3eg.jpg?httpAccept=%2A%2F%2A",
            "@multimediatype": "JPEG image file",
            "@type": "IMAGE-DOWNSAMPLED",
            "@size": "120461",
            "@ref": "gr3eg",
            "@mimetype": "image/jpeg"
          },
          {
            "@category": "thumbnail",
            "@height": "94",
            "@width": "86",
            "@_fa": "true",
            "$": "https://api.elsevier.com/content/object/eid/1-s2.0-S1381116907001069-gr3eg.sml?httpAccept=%2A%2F%2A",
            "@multimediatype": "GIF image file",
            "@type": "IMAGE-THUMBNAIL",
            "@size": "4371",
            "@ref": "gr3eg",
            "@mimetype": "image/gif"
          },
          {
            "@category": "standard",
            "@height": "720",
            "@width": "373",
            "@_fa": "true",
            "$": "https://api.elsevier.com/content/object/eid/1-s2.0-S1381116907001069-gr4.jpg?httpAccept=%2A%2F%2A",
            "@multimediatype": "JPEG image file",
            "@type": "IMAGE-DOWNSAMPLED",
            "@size": "130985",
            "@ref": "gr4",
            "@mimetype": "image/jpeg"
          },
          {
            "@category": "thumbnail",
            "@height": "93",
            "@width": "48",
            "@_fa": "true",
            "$": "https://api.elsevier.com/content/object/eid/1-s2.0-S1381116907001069-gr4.sml?httpAccept=%2A%2F%2A",
            "@multimediatype": "GIF image file",
            "@type": "IMAGE-THUMBNAIL",
            "@size": "3470",
            "@ref": "gr4",
            "@mimetype": "image/gif"
          },
          {
            "@category": "standard",
            "@height": "483",
            "@width": "590",
            "@_fa": "true",
            "$": "https://api.elsevier.com/content/object/eid/1-s2.0-S1381116907001069-gr5.jpg?httpAccept=%2A%2F%2A",
            "@multimediatype": "JPEG image file",
            "@type": "IMAGE-DOWNSAMPLED",
            "@size": "125371",
            "@ref": "gr5",
            "@mimetype": "image/jpeg"
          },
          {
            "@category": "thumbnail",
            "@height": "93",
            "@width": "114",
            "@_fa": "true",
            "$": "https://api.elsevier.com/content/object/eid/1-s2.0-S1381116907001069-gr5.sml?httpAccept=%2A%2F%2A",
            "@multimediatype": "GIF image file",
            "@type": "IMAGE-THUMBNAIL",
            "@size": "7570",
            "@ref": "gr5",
            "@mimetype": "image/gif"
          },
          {
            "@category": "standard",
            "@height": "612",
            "@width": "376",
            "@_fa": "true",
            "$": "https://api.elsevier.com/content/object/eid/1-s2.0-S1381116907001069-gr6.jpg?httpAccept=%2A%2F%2A",
            "@multimediatype": "JPEG image file",
            "@type": "IMAGE-DOWNSAMPLED",
            "@size": "41922",
            "@ref": "gr6",
            "@mimetype": "image/jpeg"
          },
          {
            "@category": "thumbnail",
            "@height": "93",
            "@width": "57",
            "@_fa": "true",
            "$": "https://api.elsevier.com/content/object/eid/1-s2.0-S1381116907001069-gr6.sml?httpAccept=%2A%2F%2A",
            "@multimediatype": "GIF image file",
            "@type": "IMAGE-THUMBNAIL",
            "@size": "2181",
            "@ref": "gr6",
            "@mimetype": "image/gif"
          },
          {
            "@category": "standard",
            "@height": "781",
            "@width": "376",
            "@_fa": "true",
            "$": "https://api.elsevier.com/content/object/eid/1-s2.0-S1381116907001069-gr7.jpg?httpAccept=%2A%2F%2A",
            "@multimediatype": "JPEG image file",
            "@type": "IMAGE-DOWNSAMPLED",
            "@size": "74544",
            "@ref": "gr7",
            "@mimetype": "image/jpeg"
          },
          {
            "@category": "thumbnail",
            "@height": "93",
            "@width": "45",
            "@_fa": "true",
            "$": "https://api.elsevier.com/content/object/eid/1-s2.0-S1381116907001069-gr7.sml?httpAccept=%2A%2F%2A",
            "@multimediatype": "GIF image file",
            "@type": "IMAGE-THUMBNAIL",
            "@size": "2996",
            "@ref": "gr7",
            "@mimetype": "image/gif"
          },
          {
            "@category": "standard",
            "@height": "496",
            "@width": "376",
            "@_fa": "true",
            "$": "https://api.elsevier.com/content/object/eid/1-s2.0-S1381116907001069-gr8.jpg?httpAccept=%2A%2F%2A",
            "@multimediatype": "JPEG image file",
            "@type": "IMAGE-DOWNSAMPLED",
            "@size": "91824",
            "@ref": "gr8",
            "@mimetype": "image/jpeg"
          },
          {
            "@category": "thumbnail",
            "@height": "94",
            "@width": "71",
            "@_fa": "true",
            "$": "https://api.elsevier.com/content/object/eid/1-s2.0-S1381116907001069-gr8.sml?httpAccept=%2A%2F%2A",
            "@multimediatype": "GIF image file",
            "@type": "IMAGE-THUMBNAIL",
            "@size": "5266",
            "@ref": "gr8",
            "@mimetype": "image/gif"
          },
          {
            "@category": "standard",
            "@height": "112",
            "@width": "204",
            "@_fa": "true",
            "$": "https://api.elsevier.com/content/object/eid/1-s2.0-S1381116907001069-fx1.jpg?httpAccept=%2A%2F%2A",
            "@multimediatype": "JPEG image file",
            "@type": "IMAGE-DOWNSAMPLED",
            "@size": "35137",
            "@ref": "fx1",
            "@mimetype": "image/jpeg"
          },
          {
            "@category": "thumbnail",
            "@height": "69",
            "@width": "125",
            "@_fa": "true",
            "$": "https://api.elsevier.com/content/object/eid/1-s2.0-S1381116907001069-fx1.sml?httpAccept=%2A%2F%2A",
            "@multimediatype": "GIF image file",
            "@type": "IMAGE-THUMBNAIL",
            "@size": "7373",
            "@ref": "fx1",
            "@mimetype": "image/gif"
          }
        ]
      },
      "link": {
        "@rel": "abstract",
        "@href": "https://api.elsevier.com/content/abstract/scopus_id/34248185652"
      }
    }
  }
}