{
  "metadata": {
    "title": "Synthesis, characteristics and catalytic activity of water-soluble [Pd(lysine·HCl)(Cl)<ce:inf loc=post>2</ce:inf>] complex as hydrogenation catalyst",
    "authors": "; ; ",
    "journal": "Journal of Molecular Catalysis A: Chemical",
    "date": "2007-03-16",
    "doi": "10.1016/j.molcata.2006.09.045",
    "abstract": "",
    "uri": "https://api.elsevier.com/content/article/pii/S138111690601257X",
    "pii": "S138111690601257X"
  },
  "fulltext": {
    "full-text-retrieval-response": {
      "scopus-eid": "2-s2.0-33847673523",
      "originalText": "serial JL 271358 291210 291744 291790 291809 31 Journal of Molecular Catalysis A: Chemical JOURNALMOLECULARCATALYSISACHEMICAL 2006-10-06 2006-10-06 2010-03-27T18:10:43 1-s2.0-S138111690601257X S1381-1169(06)01257-X S138111690601257X 10.1016/j.molcata.2006.09.045 S300 S300.1 FULL-TEXT 1-s2.0-S1381116906X02479 2015-05-15T05:56:33.323092-04:00 0 0 20070316 2007 2006-10-06T00:00:00Z articleinfo crossmark dco dateupdated tomb dateloaded datesearch indexeddate issuelist volumelist yearnav absattachment articletitlenorm authfirstinitialnorm authfirstsurnamenorm cid cids contenttype copyright dateloadedtxt docsubtype doctype doi eid ewtransactionid hubeid issfirst issn issnnorm itemstage itemtransactionid itemweight openaccess openarchive pg pgfirst pglast pii piinorm pubdatestart pubdatetxt pubyr sortorder srctitle srctitlenorm srctype subheadings volfirst volissue webpdf webpdfpagecount figure table body mmlmath affil articletitle auth authfirstini authfull authkeywords authlast primabst ref specialabst alllist content subj ssids 1381-1169 13811169 265 265 1 2 1 2 Volume 265, Issues 1–2 39 258 267 258 267 20070316 16 March 2007 2007-03-16 2007 article fla Copyright © 2006 Elsevier B.V. All rights reserved. SYNTHESISCHARACTERISTICSCATALYTICACTIVITYWATERSOLUBLEPDLYSINEHCLCL2COMPLEXHYDROGENATIONCATALYST HAO Y 1 Introduction 2 Experimental 2.1 Material 2.2 Preparation of the water-soluble Pd–aminoacid complex 2.3 Two-phase hydrogenation reaction in the autoclave 2.3.1 Hydrogenation reaction 2.3.2 Hydrogenation and dimerization reaction 2.4 Sample characterization 3 Results and discussion 3.1 Preparation of Pd–lysine complex 3.2 The structure of Pd–lysine complex 3.2.1 The coordinate ratio of metal:ligand of Pd–lysine complex 3.2.2 The coordinate structure of the Pd–lysine complex 3.2.3 The further confirmation of coordinate structure of Pd–lysine complex by IR, 1H NMR spectra and single crystal diffraction determination 3.3 The catalytic reactivity of Pd–lysine complex catalyst 3.3.1 Hydrogenation of p-chloronitrobenzene 3.3.2 Hydrogenation and dimerization of 2-nitro-5-chlorobenzotrifluoride 4 Conclusion References HERRMANN 1993 1524 W KALCK 1992 219 P CORNILS 1995 B COMILS 1995 33 B HAGGIN 1994 28 J NOMURA 1998 1 K TAFESH 1995 9305 A MONFLIER 1995 9481 E JIANG 1998 79 H GONG 2000 225 A TOUR 1990 3452 J TOUR 1990 4719 J JOO 1991 34 F REETA 1997 1526 M KANEDA 1994 L267 K BRUKERAXS 1998 SAINTSOFTWAREREFERENCEMANUAL SHELDRICK 1997 G SHELXTLNTVERSION51PROGRAMFORSOLUTIONREFINEMENTCRYSTALSTRUCTURES NAKAGAWA 1965 1 I MA 1995 48 A STERN 1972 120 E 1974 132 HOMOGENEOUSCATALYSISPARTIIADVANCEDCHEMICALSERIES CAO 1989 230 Y HAOX2007X258 HAOX2007X258X267 HAOX2007X258XY HAOX2007X258X267XY item S1381-1169(06)01257-X S138111690601257X 1-s2.0-S138111690601257X 10.1016/j.molcata.2006.09.045 271358 2010-09-17T22:40:59.257167-04:00 2007-03-16 1-s2.0-S138111690601257X-main.pdf https://s3.amazonaws.com/prod-ucs-content-store-us-east/content/pii:S138111690601257X/MAIN/application/pdf/fab5391b23c9feb1879110dd6858eff4/main.pdf https://s3-eu-west-1.amazonaws.com/prod-ucs-content-store-eu-west/content/pii:S138111690601257X/MAIN/application/pdf/fab5391b23c9feb1879110dd6858eff4/main.pdf main.pdf pdf true 827459 MAIN 10 1-s2.0-S138111690601257X-main_1.png https://s3.amazonaws.com/prod-ucs-content-store-us-east/content/pii:S138111690601257X/PREVIEW/image/png/574a36441836fd8121d27a4afa6e5f62/main_1.png https://s3-eu-west-1.amazonaws.com/prod-ucs-content-store-eu-west/content/pii:S138111690601257X/PREVIEW/image/png/574a36441836fd8121d27a4afa6e5f62/main_1.png main_1.png png 69274 849 656 IMAGE-WEB-PDF 1 1-s2.0-S138111690601257X-si1.gif https://s3.amazonaws.com/prod-ucs-content-store-us-east/content/pii:S138111690601257X/STRIPIN/image/gif/9eb4c9669d29b56b745436b29b7cbd14/si1.gif https://s3-eu-west-1.amazonaws.com/prod-ucs-content-store-eu-west/content/pii:S138111690601257X/STRIPIN/image/gif/9eb4c9669d29b56b745436b29b7cbd14/si1.gif si1 si1.gif gif 417 13 98 ALTIMG 1-s2.0-S138111690601257X-fx1.gif https://s3.amazonaws.com/prod-ucs-content-store-us-east/content/pii:S138111690601257X/fx1/DOWNSAMPLED/image/gif/faed8dc93018eea2a0522ac637a52c8a/fx1.gif https://s3-eu-west-1.amazonaws.com/prod-ucs-content-store-eu-west/content/pii:S138111690601257X/fx1/DOWNSAMPLED/image/gif/faed8dc93018eea2a0522ac637a52c8a/fx1.gif fx1 true fx1.gif gif 2672 203 160 IMAGE-DOWNSAMPLED 1-s2.0-S138111690601257X-fx1.sml https://s3.amazonaws.com/prod-ucs-content-store-us-east/content/pii:S138111690601257X/fx1/THUMBNAIL/image/gif/5f00826236d69433cf68cb33c636ba23/fx1.sml https://s3-eu-west-1.amazonaws.com/prod-ucs-content-store-eu-west/content/pii:S138111690601257X/fx1/THUMBNAIL/image/gif/5f00826236d69433cf68cb33c636ba23/fx1.sml fx1 true fx1.sml sml 1002 93 73 IMAGE-THUMBNAIL 1-s2.0-S138111690601257X-gr1.jpg https://s3.amazonaws.com/prod-ucs-content-store-us-east/content/pii:S138111690601257X/gr1/DOWNSAMPLED/image/jpeg/f0af6a9adecc00e3027c53dff7d52629/gr1.jpg https://s3-eu-west-1.amazonaws.com/prod-ucs-content-store-eu-west/content/pii:S138111690601257X/gr1/DOWNSAMPLED/image/jpeg/f0af6a9adecc00e3027c53dff7d52629/gr1.jpg gr1 gr1.jpg jpg 17573 296 392 IMAGE-DOWNSAMPLED 1-s2.0-S138111690601257X-gr1.sml https://s3.amazonaws.com/prod-ucs-content-store-us-east/content/pii:S138111690601257X/gr1/THUMBNAIL/image/gif/fe26e1cb0630df375d19f740f93d0c0c/gr1.sml https://s3-eu-west-1.amazonaws.com/prod-ucs-content-store-eu-west/content/pii:S138111690601257X/gr1/THUMBNAIL/image/gif/fe26e1cb0630df375d19f740f93d0c0c/gr1.sml gr1 gr1.sml sml 1457 94 124 IMAGE-THUMBNAIL 1-s2.0-S138111690601257X-gr10.jpg https://s3.amazonaws.com/prod-ucs-content-store-us-east/content/pii:S138111690601257X/gr10/DOWNSAMPLED/image/jpeg/329d5d03d120797ab25fc0f652068726/gr10.jpg https://s3-eu-west-1.amazonaws.com/prod-ucs-content-store-eu-west/content/pii:S138111690601257X/gr10/DOWNSAMPLED/image/jpeg/329d5d03d120797ab25fc0f652068726/gr10.jpg gr10 gr10.jpg jpg 11801 279 345 IMAGE-DOWNSAMPLED 1-s2.0-S138111690601257X-gr10.sml https://s3.amazonaws.com/prod-ucs-content-store-us-east/content/pii:S138111690601257X/gr10/THUMBNAIL/image/gif/5123f154bd96b4de70f3c69ca99a6692/gr10.sml https://s3-eu-west-1.amazonaws.com/prod-ucs-content-store-eu-west/content/pii:S138111690601257X/gr10/THUMBNAIL/image/gif/5123f154bd96b4de70f3c69ca99a6692/gr10.sml gr10 gr10.sml sml 1074 94 116 IMAGE-THUMBNAIL 1-s2.0-S138111690601257X-gr11.jpg https://s3.amazonaws.com/prod-ucs-content-store-us-east/content/pii:S138111690601257X/gr11/DOWNSAMPLED/image/jpeg/df492fce5642f7e7ea67b7902a839e2b/gr11.jpg https://s3-eu-west-1.amazonaws.com/prod-ucs-content-store-eu-west/content/pii:S138111690601257X/gr11/DOWNSAMPLED/image/jpeg/df492fce5642f7e7ea67b7902a839e2b/gr11.jpg gr11 gr11.jpg jpg 16879 291 377 IMAGE-DOWNSAMPLED 1-s2.0-S138111690601257X-gr11.sml https://s3.amazonaws.com/prod-ucs-content-store-us-east/content/pii:S138111690601257X/gr11/THUMBNAIL/image/gif/15c9d9d608d1e030443e654dfa210b27/gr11.sml https://s3-eu-west-1.amazonaws.com/prod-ucs-content-store-eu-west/content/pii:S138111690601257X/gr11/THUMBNAIL/image/gif/15c9d9d608d1e030443e654dfa210b27/gr11.sml gr11 gr11.sml sml 1260 93 121 IMAGE-THUMBNAIL 1-s2.0-S138111690601257X-gr12.jpg https://s3.amazonaws.com/prod-ucs-content-store-us-east/content/pii:S138111690601257X/gr12/DOWNSAMPLED/image/jpeg/4be21cf4244ba6b7494cb2a6fe8fa757/gr12.jpg https://s3-eu-west-1.amazonaws.com/prod-ucs-content-store-eu-west/content/pii:S138111690601257X/gr12/DOWNSAMPLED/image/jpeg/4be21cf4244ba6b7494cb2a6fe8fa757/gr12.jpg gr12 gr12.jpg jpg 54039 850 541 IMAGE-DOWNSAMPLED 1-s2.0-S138111690601257X-gr12.sml https://s3.amazonaws.com/prod-ucs-content-store-us-east/content/pii:S138111690601257X/gr12/THUMBNAIL/image/gif/22f79669c9b58b82f2b9b2f1588292a0/gr12.sml https://s3-eu-west-1.amazonaws.com/prod-ucs-content-store-eu-west/content/pii:S138111690601257X/gr12/THUMBNAIL/image/gif/22f79669c9b58b82f2b9b2f1588292a0/gr12.sml gr12 gr12.sml sml 776 93 59 IMAGE-THUMBNAIL 1-s2.0-S138111690601257X-gr13.gif https://s3.amazonaws.com/prod-ucs-content-store-us-east/content/pii:S138111690601257X/gr13/DOWNSAMPLED/image/gif/cb6770f2e5fd122c17dd674336cb12c3/gr13.gif https://s3-eu-west-1.amazonaws.com/prod-ucs-content-store-eu-west/content/pii:S138111690601257X/gr13/DOWNSAMPLED/image/gif/cb6770f2e5fd122c17dd674336cb12c3/gr13.gif gr13 gr13.gif gif 7925 177 386 IMAGE-DOWNSAMPLED 1-s2.0-S138111690601257X-gr13.sml https://s3.amazonaws.com/prod-ucs-content-store-us-east/content/pii:S138111690601257X/gr13/THUMBNAIL/image/gif/de0cdcb72553a197013a3a9c242c4640/gr13.sml https://s3-eu-west-1.amazonaws.com/prod-ucs-content-store-eu-west/content/pii:S138111690601257X/gr13/THUMBNAIL/image/gif/de0cdcb72553a197013a3a9c242c4640/gr13.sml gr13 gr13.sml sml 1547 57 125 IMAGE-THUMBNAIL 1-s2.0-S138111690601257X-gr14.jpg https://s3.amazonaws.com/prod-ucs-content-store-us-east/content/pii:S138111690601257X/gr14/DOWNSAMPLED/image/jpeg/8d7ab849e159a0a843ab5cd9ebdd73ff/gr14.jpg https://s3-eu-west-1.amazonaws.com/prod-ucs-content-store-eu-west/content/pii:S138111690601257X/gr14/DOWNSAMPLED/image/jpeg/8d7ab849e159a0a843ab5cd9ebdd73ff/gr14.jpg gr14 gr14.jpg jpg 8031 243 314 IMAGE-DOWNSAMPLED 1-s2.0-S138111690601257X-gr14.sml https://s3.amazonaws.com/prod-ucs-content-store-us-east/content/pii:S138111690601257X/gr14/THUMBNAIL/image/gif/43046734effd083fcb8cd867210a1daa/gr14.sml https://s3-eu-west-1.amazonaws.com/prod-ucs-content-store-eu-west/content/pii:S138111690601257X/gr14/THUMBNAIL/image/gif/43046734effd083fcb8cd867210a1daa/gr14.sml gr14 gr14.sml sml 847 93 120 IMAGE-THUMBNAIL 1-s2.0-S138111690601257X-gr15.jpg https://s3.amazonaws.com/prod-ucs-content-store-us-east/content/pii:S138111690601257X/gr15/DOWNSAMPLED/image/jpeg/4afaec88a068481b662b0a4ddd4e7faa/gr15.jpg https://s3-eu-west-1.amazonaws.com/prod-ucs-content-store-eu-west/content/pii:S138111690601257X/gr15/DOWNSAMPLED/image/jpeg/4afaec88a068481b662b0a4ddd4e7faa/gr15.jpg gr15 gr15.jpg jpg 22396 254 288 IMAGE-DOWNSAMPLED 1-s2.0-S138111690601257X-gr15.sml https://s3.amazonaws.com/prod-ucs-content-store-us-east/content/pii:S138111690601257X/gr15/THUMBNAIL/image/gif/cad8448aa3f61869435c7c4775041840/gr15.sml https://s3-eu-west-1.amazonaws.com/prod-ucs-content-store-eu-west/content/pii:S138111690601257X/gr15/THUMBNAIL/image/gif/cad8448aa3f61869435c7c4775041840/gr15.sml gr15 gr15.sml sml 1611 93 106 IMAGE-THUMBNAIL 1-s2.0-S138111690601257X-gr2.jpg https://s3.amazonaws.com/prod-ucs-content-store-us-east/content/pii:S138111690601257X/gr2/DOWNSAMPLED/image/jpeg/6ce5d97dbb74380a0e33c4a7694bdc4f/gr2.jpg https://s3-eu-west-1.amazonaws.com/prod-ucs-content-store-eu-west/content/pii:S138111690601257X/gr2/DOWNSAMPLED/image/jpeg/6ce5d97dbb74380a0e33c4a7694bdc4f/gr2.jpg gr2 gr2.jpg jpg 9985 285 379 IMAGE-DOWNSAMPLED 1-s2.0-S138111690601257X-gr2.sml https://s3.amazonaws.com/prod-ucs-content-store-us-east/content/pii:S138111690601257X/gr2/THUMBNAIL/image/gif/ea2517258ad5d5091ece602fd598ca80/gr2.sml https://s3-eu-west-1.amazonaws.com/prod-ucs-content-store-eu-west/content/pii:S138111690601257X/gr2/THUMBNAIL/image/gif/ea2517258ad5d5091ece602fd598ca80/gr2.sml gr2 gr2.sml sml 909 93 124 IMAGE-THUMBNAIL 1-s2.0-S138111690601257X-gr3.jpg https://s3.amazonaws.com/prod-ucs-content-store-us-east/content/pii:S138111690601257X/gr3/DOWNSAMPLED/image/jpeg/b230f52bfb0d90a25352bb935f515999/gr3.jpg https://s3-eu-west-1.amazonaws.com/prod-ucs-content-store-eu-west/content/pii:S138111690601257X/gr3/DOWNSAMPLED/image/jpeg/b230f52bfb0d90a25352bb935f515999/gr3.jpg gr3 gr3.jpg jpg 7791 279 380 IMAGE-DOWNSAMPLED 1-s2.0-S138111690601257X-gr3.sml https://s3.amazonaws.com/prod-ucs-content-store-us-east/content/pii:S138111690601257X/gr3/THUMBNAIL/image/gif/223a63ada9a0a6426f61d86273fd2dd0/gr3.sml https://s3-eu-west-1.amazonaws.com/prod-ucs-content-store-eu-west/content/pii:S138111690601257X/gr3/THUMBNAIL/image/gif/223a63ada9a0a6426f61d86273fd2dd0/gr3.sml gr3 gr3.sml sml 741 92 125 IMAGE-THUMBNAIL 1-s2.0-S138111690601257X-gr4.jpg https://s3.amazonaws.com/prod-ucs-content-store-us-east/content/pii:S138111690601257X/gr4/DOWNSAMPLED/image/jpeg/82f3cb3338c1b8fba208e8cd11a0dc34/gr4.jpg https://s3-eu-west-1.amazonaws.com/prod-ucs-content-store-eu-west/content/pii:S138111690601257X/gr4/DOWNSAMPLED/image/jpeg/82f3cb3338c1b8fba208e8cd11a0dc34/gr4.jpg gr4 gr4.jpg jpg 18752 276 358 IMAGE-DOWNSAMPLED 1-s2.0-S138111690601257X-gr4.sml https://s3.amazonaws.com/prod-ucs-content-store-us-east/content/pii:S138111690601257X/gr4/THUMBNAIL/image/gif/e966c1b32b9e884bee0d109c876a3a19/gr4.sml https://s3-eu-west-1.amazonaws.com/prod-ucs-content-store-eu-west/content/pii:S138111690601257X/gr4/THUMBNAIL/image/gif/e966c1b32b9e884bee0d109c876a3a19/gr4.sml gr4 gr4.sml sml 1477 93 121 IMAGE-THUMBNAIL 1-s2.0-S138111690601257X-gr5.gif https://s3.amazonaws.com/prod-ucs-content-store-us-east/content/pii:S138111690601257X/gr5/DOWNSAMPLED/image/gif/1de61498867ebeefcbcbddfc1812ec5c/gr5.gif https://s3-eu-west-1.amazonaws.com/prod-ucs-content-store-eu-west/content/pii:S138111690601257X/gr5/DOWNSAMPLED/image/gif/1de61498867ebeefcbcbddfc1812ec5c/gr5.gif gr5 gr5.gif gif 8360 288 374 IMAGE-DOWNSAMPLED 1-s2.0-S138111690601257X-gr5.sml https://s3.amazonaws.com/prod-ucs-content-store-us-east/content/pii:S138111690601257X/gr5/THUMBNAIL/image/gif/f28de8f2863964e04e8976c43fe80915/gr5.sml https://s3-eu-west-1.amazonaws.com/prod-ucs-content-store-eu-west/content/pii:S138111690601257X/gr5/THUMBNAIL/image/gif/f28de8f2863964e04e8976c43fe80915/gr5.sml gr5 gr5.sml sml 1577 93 121 IMAGE-THUMBNAIL 1-s2.0-S138111690601257X-gr6.jpg https://s3.amazonaws.com/prod-ucs-content-store-us-east/content/pii:S138111690601257X/gr6/DOWNSAMPLED/image/jpeg/2e18df58c3a953a45ad2965286e05298/gr6.jpg https://s3-eu-west-1.amazonaws.com/prod-ucs-content-store-eu-west/content/pii:S138111690601257X/gr6/DOWNSAMPLED/image/jpeg/2e18df58c3a953a45ad2965286e05298/gr6.jpg gr6 gr6.jpg jpg 11167 299 381 IMAGE-DOWNSAMPLED 1-s2.0-S138111690601257X-gr6.sml https://s3.amazonaws.com/prod-ucs-content-store-us-east/content/pii:S138111690601257X/gr6/THUMBNAIL/image/gif/5068b9e8a4abff437961a90e25dde124/gr6.sml https://s3-eu-west-1.amazonaws.com/prod-ucs-content-store-eu-west/content/pii:S138111690601257X/gr6/THUMBNAIL/image/gif/5068b9e8a4abff437961a90e25dde124/gr6.sml gr6 gr6.sml sml 952 93 119 IMAGE-THUMBNAIL 1-s2.0-S138111690601257X-gr7.jpg https://s3.amazonaws.com/prod-ucs-content-store-us-east/content/pii:S138111690601257X/gr7/DOWNSAMPLED/image/jpeg/bb57b0e372ec4f80e4ae15b9570794ed/gr7.jpg https://s3-eu-west-1.amazonaws.com/prod-ucs-content-store-eu-west/content/pii:S138111690601257X/gr7/DOWNSAMPLED/image/jpeg/bb57b0e372ec4f80e4ae15b9570794ed/gr7.jpg gr7 gr7.jpg jpg 36444 256 386 IMAGE-DOWNSAMPLED 1-s2.0-S138111690601257X-gr7.sml https://s3.amazonaws.com/prod-ucs-content-store-us-east/content/pii:S138111690601257X/gr7/THUMBNAIL/image/gif/ea14edd24d8a524239401942be85532e/gr7.sml https://s3-eu-west-1.amazonaws.com/prod-ucs-content-store-eu-west/content/pii:S138111690601257X/gr7/THUMBNAIL/image/gif/ea14edd24d8a524239401942be85532e/gr7.sml gr7 gr7.sml sml 1937 83 125 IMAGE-THUMBNAIL 1-s2.0-S138111690601257X-gr8.jpg https://s3.amazonaws.com/prod-ucs-content-store-us-east/content/pii:S138111690601257X/gr8/DOWNSAMPLED/image/jpeg/9b9c40d1c8f43ccf810d0a0fd48f67e6/gr8.jpg https://s3-eu-west-1.amazonaws.com/prod-ucs-content-store-eu-west/content/pii:S138111690601257X/gr8/DOWNSAMPLED/image/jpeg/9b9c40d1c8f43ccf810d0a0fd48f67e6/gr8.jpg gr8 gr8.jpg jpg 11562 270 343 IMAGE-DOWNSAMPLED 1-s2.0-S138111690601257X-gr8.sml https://s3.amazonaws.com/prod-ucs-content-store-us-east/content/pii:S138111690601257X/gr8/THUMBNAIL/image/gif/5c979749c7476771bd0396a56d07975b/gr8.sml https://s3-eu-west-1.amazonaws.com/prod-ucs-content-store-eu-west/content/pii:S138111690601257X/gr8/THUMBNAIL/image/gif/5c979749c7476771bd0396a56d07975b/gr8.sml gr8 gr8.sml sml 989 93 118 IMAGE-THUMBNAIL 1-s2.0-S138111690601257X-gr9.jpg https://s3.amazonaws.com/prod-ucs-content-store-us-east/content/pii:S138111690601257X/gr9/DOWNSAMPLED/image/jpeg/49add8d08c552e10900c3f88ffb390a6/gr9.jpg https://s3-eu-west-1.amazonaws.com/prod-ucs-content-store-eu-west/content/pii:S138111690601257X/gr9/DOWNSAMPLED/image/jpeg/49add8d08c552e10900c3f88ffb390a6/gr9.jpg gr9 gr9.jpg jpg 24578 254 372 IMAGE-DOWNSAMPLED 1-s2.0-S138111690601257X-gr9.sml https://s3.amazonaws.com/prod-ucs-content-store-us-east/content/pii:S138111690601257X/gr9/THUMBNAIL/image/gif/efe7ae72960198f9efce2038e27f3289/gr9.sml https://s3-eu-west-1.amazonaws.com/prod-ucs-content-store-eu-west/content/pii:S138111690601257X/gr9/THUMBNAIL/image/gif/efe7ae72960198f9efce2038e27f3289/gr9.sml gr9 gr9.sml sml 1688 85 125 IMAGE-THUMBNAIL 1-s2.0-S138111690601257X-sc1.gif https://s3.amazonaws.com/prod-ucs-content-store-us-east/content/pii:S138111690601257X/sc1/DOWNSAMPLED/image/gif/55c85eb6741617843374529184646e5c/sc1.gif https://s3-eu-west-1.amazonaws.com/prod-ucs-content-store-eu-west/content/pii:S138111690601257X/sc1/DOWNSAMPLED/image/gif/55c85eb6741617843374529184646e5c/sc1.gif sc1 sc1.gif gif 3634 164 376 IMAGE-DOWNSAMPLED 1-s2.0-S138111690601257X-sc1.sml https://s3.amazonaws.com/prod-ucs-content-store-us-east/content/pii:S138111690601257X/sc1/THUMBNAIL/image/gif/d1bd60e62c77c9b33ea3ca423b4b30bf/sc1.sml https://s3-eu-west-1.amazonaws.com/prod-ucs-content-store-eu-west/content/pii:S138111690601257X/sc1/THUMBNAIL/image/gif/d1bd60e62c77c9b33ea3ca423b4b30bf/sc1.sml sc1 sc1.sml sml 795 54 125 IMAGE-THUMBNAIL 1-s2.0-S138111690601257X-sc2.gif https://s3.amazonaws.com/prod-ucs-content-store-us-east/content/pii:S138111690601257X/sc2/DOWNSAMPLED/image/gif/e33af6e15a047bc15e6e31cecaa09668/sc2.gif https://s3-eu-west-1.amazonaws.com/prod-ucs-content-store-eu-west/content/pii:S138111690601257X/sc2/DOWNSAMPLED/image/gif/e33af6e15a047bc15e6e31cecaa09668/sc2.gif sc2 sc2.gif gif 1956 193 113 IMAGE-DOWNSAMPLED 1-s2.0-S138111690601257X-sc2.sml https://s3.amazonaws.com/prod-ucs-content-store-us-east/content/pii:S138111690601257X/sc2/THUMBNAIL/image/gif/64fa40f053ae19fb9618a9939f76ec31/sc2.sml https://s3-eu-west-1.amazonaws.com/prod-ucs-content-store-eu-west/content/pii:S138111690601257X/sc2/THUMBNAIL/image/gif/64fa40f053ae19fb9618a9939f76ec31/sc2.sml sc2 sc2.sml sml 743 92 54 IMAGE-THUMBNAIL 1-s2.0-S138111690601257X-sc3.gif https://s3.amazonaws.com/prod-ucs-content-store-us-east/content/pii:S138111690601257X/sc3/DOWNSAMPLED/image/gif/fb7f38a1f32541b168ef0a16d010accc/sc3.gif https://s3-eu-west-1.amazonaws.com/prod-ucs-content-store-eu-west/content/pii:S138111690601257X/sc3/DOWNSAMPLED/image/gif/fb7f38a1f32541b168ef0a16d010accc/sc3.gif sc3 sc3.gif gif 4424 232 239 IMAGE-DOWNSAMPLED 1-s2.0-S138111690601257X-sc3.sml https://s3.amazonaws.com/prod-ucs-content-store-us-east/content/pii:S138111690601257X/sc3/THUMBNAIL/image/gif/f7f6360313c8dcad7a00c28d232bb5ec/sc3.sml https://s3-eu-west-1.amazonaws.com/prod-ucs-content-store-eu-west/content/pii:S138111690601257X/sc3/THUMBNAIL/image/gif/f7f6360313c8dcad7a00c28d232bb5ec/sc3.sml sc3 sc3.sml sml 1173 93 96 IMAGE-THUMBNAIL 1-s2.0-S138111690601257X-sc5.gif https://s3.amazonaws.com/prod-ucs-content-store-us-east/content/pii:S138111690601257X/sc5/DOWNSAMPLED/image/gif/27f344109758fdcef469cb6d7b513689/sc5.gif https://s3-eu-west-1.amazonaws.com/prod-ucs-content-store-eu-west/content/pii:S138111690601257X/sc5/DOWNSAMPLED/image/gif/27f344109758fdcef469cb6d7b513689/sc5.gif sc5 sc5.gif gif 7462 402 489 IMAGE-DOWNSAMPLED 1-s2.0-S138111690601257X-sc5.sml https://s3.amazonaws.com/prod-ucs-content-store-us-east/content/pii:S138111690601257X/sc5/THUMBNAIL/image/gif/e8520c31a602cbf5f1bdaeb31f5ec725/sc5.sml https://s3-eu-west-1.amazonaws.com/prod-ucs-content-store-eu-west/content/pii:S138111690601257X/sc5/THUMBNAIL/image/gif/e8520c31a602cbf5f1bdaeb31f5ec725/sc5.sml sc5 sc5.sml sml 959 94 114 IMAGE-THUMBNAIL 1-s2.0-S138111690601257X-sc6.gif https://s3.amazonaws.com/prod-ucs-content-store-us-east/content/pii:S138111690601257X/sc6/DOWNSAMPLED/image/gif/698ec843371a44f4510c533fad8d9639/sc6.gif https://s3-eu-west-1.amazonaws.com/prod-ucs-content-store-eu-west/content/pii:S138111690601257X/sc6/DOWNSAMPLED/image/gif/698ec843371a44f4510c533fad8d9639/sc6.gif sc6 sc6.gif gif 5117 324 336 IMAGE-DOWNSAMPLED 1-s2.0-S138111690601257X-sc6.sml https://s3.amazonaws.com/prod-ucs-content-store-us-east/content/pii:S138111690601257X/sc6/THUMBNAIL/image/gif/c6b313ca044ce506d4a7c5dd96f7c08f/sc6.sml https://s3-eu-west-1.amazonaws.com/prod-ucs-content-store-eu-west/content/pii:S138111690601257X/sc6/THUMBNAIL/image/gif/c6b313ca044ce506d4a7c5dd96f7c08f/sc6.sml sc6 sc6.sml sml 914 94 97 IMAGE-THUMBNAIL 1-s2.0-S138111690601257X-sc7.gif https://s3.amazonaws.com/prod-ucs-content-store-us-east/content/pii:S138111690601257X/sc7/DOWNSAMPLED/image/gif/3ba42eff3d99293d4a25b10bd7be5c74/sc7.gif https://s3-eu-west-1.amazonaws.com/prod-ucs-content-store-eu-west/content/pii:S138111690601257X/sc7/DOWNSAMPLED/image/gif/3ba42eff3d99293d4a25b10bd7be5c74/sc7.gif sc7 sc7.gif gif 2653 82 348 IMAGE-DOWNSAMPLED 1-s2.0-S138111690601257X-sc7.sml https://s3.amazonaws.com/prod-ucs-content-store-us-east/content/pii:S138111690601257X/sc7/THUMBNAIL/image/gif/9296ac568df63185a1e311e619bd3a21/sc7.sml https://s3-eu-west-1.amazonaws.com/prod-ucs-content-store-eu-west/content/pii:S138111690601257X/sc7/THUMBNAIL/image/gif/9296ac568df63185a1e311e619bd3a21/sc7.sml sc7 sc7.sml sml 631 29 125 IMAGE-THUMBNAIL 1-s2.0-S138111690601257X-sc4.gif https://s3.amazonaws.com/prod-ucs-content-store-us-east/content/pii:S138111690601257X/sc4/DOWNSAMPLED/image/gif/9de4c7d8c4a08109fbf6f578cc8f9ea0/sc4.gif https://s3-eu-west-1.amazonaws.com/prod-ucs-content-store-eu-west/content/pii:S138111690601257X/sc4/DOWNSAMPLED/image/gif/9de4c7d8c4a08109fbf6f578cc8f9ea0/sc4.gif sc4 sc4.gif gif 9736 422 566 IMAGE-DOWNSAMPLED 1-s2.0-S138111690601257X-sc4.sml https://s3.amazonaws.com/prod-ucs-content-store-us-east/content/pii:S138111690601257X/sc4/THUMBNAIL/image/gif/c31527c88a3c106cbff5091fb6cf2494/sc4.sml https://s3-eu-west-1.amazonaws.com/prod-ucs-content-store-eu-west/content/pii:S138111690601257X/sc4/THUMBNAIL/image/gif/c31527c88a3c106cbff5091fb6cf2494/sc4.sml sc4 sc4.sml sml 1079 93 125 IMAGE-THUMBNAIL MOLCAA 6363 S1381-1169(06)01257-X 10.1016/j.molcata.2006.09.045 Elsevier B.V. Scheme 1 Scheme 2 Scheme 3 Scheme 4 Mechanism of hydride hydrogenation. Scheme 5 Simple hydrogenation mechanism. Scheme 6 Mechanism of hydrogenation dechorination. Scheme 7 Fig. 1 The UV–vis spectra of Pd–lysine complex as reaction time at room temperature. Fig. 2 The maximum Abs of UV–vis spectra of Pd–lysine complex as reaction time at room temperature. Fig. 3 The maximum Abs of UV–vis spectra of Pd–lysine complex as reaction time at 50°C. Fig. 4 The UV–vis spectra of Pd–lysine complexes prepared at different pH. Fig. 5 The UV–vis spectra of Pd–lysine complex at different mole ratio of n(lysine·HCl)/n(H2PdCl4) at pH 4. Fig. 6 The curve between UV–vis Abs and the mole ratio of n(lysine·HCl)/n(H2PdCl4) at pH 4. Fig. 7 The UV–vis spectra of Pd–lysine complex at different mole ratio of n(lysine·HCl)/n(H2PdCl4) at pH 2. Fig. 8 The curve between UV–vis Abs and the mole ratio of n(lysine·HCl)/n(H2PdCl4) at pH 2. Fig. 9 The UV–vis spectra of Pd–lysine complex at different mole ratio of n(lysine·HCl)/n(H2PdCl4) at pH 5.5. Fig. 10 The curve between UV–vis Abs and the mole ratio of n(lysine·HCl)/n(H2PdCl4) at pH 5.5. Fig. 11 The UV–vis spectra of Pd–aminoacid complexes and aminoacids. Fig. 12 1H NMR spectra of lysine·HCl and Pd–lysine complex. Fig. 13 The ORTEP view of [Pd(valine)2]·H2O. Fig. 14 The conversion and selectivity of six recycling reactions. Fig. 15 The UV–vis spectra of the catalyst after six recycling reactions. Table 1 The parts of IR absorbance peaks and ascription of valine and Pd–valine complex crystal Valine (cm−1) Pd–valine (cm−1) Ascription 1627 δ(NH3 +) 1596 1661 ν(COO−) 1503 1592, 1631 ν(NH3 +) 1473 δ(CH3) 1416 1458 ν(COO−) Table 2 The 1H NMR spectra of lysine·HCl and Pd–lysine complex Lysine·HCl, δ (ppm) Pd–lysine, δ (ppm) Ascription 1.22–1.32 (m, 2H) 1.28–1.36 (m, 2H) CH2(4) 1.47–1.55 (p, 2H) 1.50–1.58 (p, 2H) CH2(5) 1.66–1.74 (q, 2H) 1.69–1.78 (q, 2H) CH2(3) 2.79–2.85 (t, 2H) 2.80–2.85 (t, 2H) CH2(6) 3.53–3.57 (t, 1H) 3.65–3.69 (t, 1H) CH(2) 4.63 (s, 6H) 4.31 (s, 2H) NH2 4.58 (s, 3H) NH3 + 4.78 (s, 1H) COOH(1) Table 3 Selected bond lengths (Å) and bond angles (°) for [Pd(valine)2]·H2O Bond distances (Å) Pd(1)–O(1) 1.990(3) Pd(1)–N(2) 1.997(4) Pd(1)–N(1) 2.001(4) Pd(1)–O(3) 2.006(3) Bond angles (°) O(1)–Pd(1)–N(2) 179.04(16) O(1)–Pd(1)–N(1) 83.20(15) N(2)–Pd(1)–N(1) 97.76(17) O(1)–Pd(1)–O(3) 95.41(12) N(2)-Pd(1)–O(3) 83.63(14) N(1)–Pd(1)–O(3) 178.59(15) Table 4 Hydrogenation product distributions of p-chloronitrobenzene at different reaction conditions T (°C) Reaction condition Product distribution (%) Reaction conversion (%) Selectivity of p-chloroaniline (%) H2 pressure (MPa) Catalyst amount (mL) p-Chloroaniline Aniline 50 0.1 35 49.5 1.0 50.5 98.0 50 0.4 35 75.5 7.8 83.3 90.6 75 0.1 35 63.3 12.3 75.6 83.7 25 0.1 35 30.0 0.1 30.1 99.7 50 0.1 70 92.6 0.8 93.4 99.1 50 0.1 17.5 23.2 0.4 23.6 98.3 Catalyst concentration: 0.066mmol/mL. Synthesis, characteristics and catalytic activity of water-soluble [Pd(lysine·HCl)(Cl)2] complex as hydrogenation catalyst Yu-Zhi Hao a b ⁎ Zuo-Xi Li a Jin-Lei Tian a a Department of Chemistry, Nankai University, Tianjin 300071, PR China b School of Chemical Engineering, Hebei University of Technology, Tianjin 300130, PR China ⁎ Corresponding author at: School of Chemical Engineering, Hebei University of Technology, Tianjin 300130, PR China. Tel.: +86 22 60204303; fax: +86 22 60204019. Graphical abstract Two water-soluble Pd–aminoacid complexes were prepared under mild condition and were characterized by various techniques such as IR, UV–vis, 1H NMR spectra. X-ray crystallography reveals the structure of Pd–valine complex with the molecular formula of [Pd(valine)2]·H2O and the composition of Pd–lysine complex was suggested as [Pd(lysine·HCl)(Cl)2] at pH 2–5.5. Hydrogenation performance of Pd–lysine complex in two-phase was evaluated by using p-chloronitrobenzene. The hydrogenation and dimer performance of Pd–lysine complex was also evaluated by using 2-nitro-5-chlorobenzotrifluride. Keywords Pd–lysine Hydrogenation Water-soluble Two-phase Catalyst 1 Introduction Two-phase catalysis with water-soluble catalysts offers the most important principle for catalyst recycling in homogeneous catalysis [1–3]. Water-soluble catalyst plays an important key for the catalyst separation, because the product can thus easily be obtained by simple phase separation. The special issues about catalysis in water have been given [4–7]. The water-soluble catalysts are mainly the complex catalyst with the water-soluble ligands [6–11]. The structures of these ligands are various, so the catalytic activities of their complexes are also different. The water-soluble palladium acetate/triethoxylsilane catalysts for alkene and alkyne hydrogenation have been researched [12,13]. Pd–di(sodium alizarinmonosulfonate) as catalyst of unsaturated fatty acids etherified in liquid has been developed [14]. Polyaminodiphosphine dendrimer was used as support for rhodium and palladium catalyst [15]. Palladium/TPPTS or BINAS (BINAS=mixture of tetra-, penta-, hexa-sulfonated 2,2′-bisdiphenylphosphinomethylene binaphthyl) was used as catalyst of aromatic nitro compounds (ArNO2) hydrogenation under CO (2–8atm) and 80°C [16]. Tafesh and Beller [8] employed palladium complexes involving water-soluble ligands such as TPPTS or BINAS for reduction of various aromatic nitro compounds under CO (60–120bar) and H2O condition. The nitro group was reduced selectively to an amine whereby other functional groups, i.e. ketone, nitrile, chloride and alkene were not influenced. Though the catalytic activities and selectivities of these catalysts are high enough, the synthesis of these ligands is difficult, so cheaper water-soluble ligands are expected. Lysine is a kind of water-soluble ligand and very cheap, but how to prepare the complex with catalytic activity between lysine and Pd is the key. Preparation of water-soluble Pd–aminoacid complex was discussed in this paper. The complexes were characterized by IR, UV–vis, 1H NMR spectra and single crystal diffraction techniques. The synthesis condition, composition and structure of Pd–lysine complex with catalytic activity were discussed. Hydrogenation performance of Pd–lysine complex in two-phase was evaluated by using p-chloronitrobenzene to give p-chloroaniline. The hydrogenation and dimerization of 2-nitro-5-chlorobenzotrifluride was evaluated, too. 2 Experimental 2.1 Material Lysine·HCl and valine were obtained from Tianjin reagent company. Pd metal was from Chinese Jinchuan colored metal company. The p-chloronitrobenzene (99%) and 2-nitro-5-chlorobenzotrifluride (97%) were obtained commercially and were used directly. 2.2 Preparation of the water-soluble Pd–aminoacid complex H2PdCl4 solution was prepared by adding 2.1093g commercial palladium metal (99.99%) and 20mL HCl (33%) in 100mL three-necked flask with water bath, then stirring and slowly dropping 10mL H2O2 solution (30%), controlling the mixture temperature below 30°C until all palladium metal dissolved, finally diluting the solution to 100mL. The preparation of Pd–lysine complex was shown as follows: 10.0mL the H2PdCl4 (21.09mg/mL) solution prepared above was diluted to 30mL in a 100mL three-necked flask, the pH was adjusted to 3–6 by dropping 0.1mol/L NaOH solution, then 0.3641g (1.995mmol) lysine·HCl was added. The mixture was stirred at 60–70°C for 2h. The Pd–valine complex was prepared by the same procedure (the valine was 1.995mmol). The single crystal of Pd–valine was prepared by adding the 10mL solution of Pd–valine complex in a test-tube and was allowed to stand at room temperature. After about 2 weeks, yellow well-shaped prismatic crystals were obtained at the bottom of test-tube, and many of them were suitable for X-ray diffraction studies. 2.3 Two-phase hydrogenation reaction in the autoclave All reactions were carried out in 1L stainless pressure vessel. 2.3.1 Hydrogenation reaction Hundred millilitres of p-chloronitrobenzene and 80mL deionised water were added into the autoclave, the pH of the mixture was adjusted to about 6 by acetic acid, then 35mL Pd–lysine complex was poured. The autoclave was pressed and vented three times with N2 and H2, respectively, and the pressure was set to 0.1–0.4MPa. The autoclave was heated to 40°C and the reaction commenced by starting the stirring. After 4h, the autoclave was cooled to room temperature, depressurized and replaced three times by N2. The organic phase was separated and immediately analyzed with GC. The water phase can be recycled. 2.3.2 Hydrogenation and dimerization reaction Hundred millilitres of 2-nitro-5-chlorotrifluoride and 80mL ethanol were added into autoclave, then 5mL acetic acid, finally 35mL Pd–lysine complex was poured. The autoclave was pressed and vented three times with N2 and H2, respectively, and the pressure was set to 0.4MPa. The autoclave was heated to 40°C and the reaction commenced by starting the stirring. After 4h, the autoclave was cooled to room temperature, depressurized and replaced three times by N2. The reaction product was sheet and light yellow crystal. The elemental analysis of the product was C 40.45%; N 7.17%; H 2.15%; Cl 18.69%. The crystal was dissolved in CHCl3 and analyzed with GC–MS. 2.4 Sample characterization UV–vis spectra were recorded on HITACHI UV-3010 spectrometer. 1H NMR spectra were carried out on a Varian Mercury V×300 spectrometer in D2O, TMS was used as standard for 1H NMR spectra. Elemental analysis was performed on an Elementar Vario EL system. IR spectra were taken on a Bruker TENSOR 27 spectrometer. The reaction product was analyzed on Shimadzu GC-9A gas chromatograph with polyglycol capillary column (30m) and FID detector, and on MASPEC II GC–MS system. X-ray structure determination of Pd–valine was carried out on a Bruker Smart 1000 CCD diffractometer equipped with a graphite crystal monochromator situated in the incident beam for data collection at 293(2)K. The determinations of unit cell parameters and data collections were performed with Mo Kα radiation (λ =0.71073Å) and unit cell dimensions were obtained with least-squares refinements. The program SAINT [17] was used for integration of the diffraction profiles. The structure was solved by direct methods using the SHELXS program of the SHELXTL package and refined with SHELXL [18]. All non-hydrogen atoms were located in successive difference Fourier syntheses. The final refinement was performed by full matrix least-squares methods with anisotropic thermal parameters for non-hydrogen atoms on F 2. The hydrogen atoms were added theoretically, riding on the concerned atoms and refined with fixed thermal factors. 3 Results and discussion 3.1 Preparation of Pd–lysine complex Three millilitres 0.1mol/L NaoH solution and 6.9mg (0.038mmol) lysine·HCl were added in 5.0mL H2PdCl4 solution (Pd 0.81mg/mL), the mixture was stirred at room temperature, the UV–vis spectra of the mixture were recorded as the reaction time increased (Figs. 1 and 2 ). From the UV–vis spectra, the maximum Abs of UV–vis spectra shifted from about 428nm to 392nm as the reaction time increased and became stable after about 120min, therefore a new complex was formed after H2PdCl4 solution reacted with lysine·HCl. In the same way, the relation between maximum Abs of UV–vis spectra and reaction time of the mixture at 50°C was summarized in Fig. 3 . Similarly, the maximum Abs of UV–vis spectra shifted from about 428nm to 392nm as the reaction time increased and became stable after about 33min, therefore the complex reaction was the same at different reaction temperature, and the rate of complex reaction became faster as the reaction temperature raised. The Pd–lysine mixtures were prepared at different pH by NaOH solution adjusting. The UV–vis spectra of these mixtures after reaction at 70°C for 1h were recorded in Fig. 4 . Obviously, the UV–vis spectra of Pd–lysine complexes were similar between pH 3 and 6, so the Pd–lysine complex prepared was stable at pH 3–6. But when pH was above 6, the UV–vis spectrum changed obviously, the maximum Abs shifted from about 392nm to 340nm, therefore the complex structure was different from that of at pH 3–6. Thus according to these results, the Pd–lysine complex may be prepared at 50–70°C for 1h and stable at pH 3–6. 3.2 The structure of Pd–lysine complex 3.2.1 The coordinate ratio of metal:ligand of Pd–lysine complex Eighteen millilitres 0.1mol/L NaOH solution was added into 30mL H2PdCl4 solution (Pd 0.81mg/mL), the pH of mixture was about 4. The mixture was stirred and heated to 60°C for 1h, then 8.3mg lysine·HCl was poured, the UV–vis spectrum of the mixture was examined after reaction for 30min. In the same way, each adding 8.3mg lysine·HCl in the mixture, the UV–vis spectrum of the mixture was recorded after reaction for 30min, the mole ratio of n(lysine·HCl)/n(H2PdCl4) was separately 0.20, 0.39, 0.60, 0.79, 0.98, 1.18, 1.38, 1.57, 1.77, 1.97, 2.16, 2.36, 2.56, 2.75, 2.95, 3.15, 3.34, 3.54. The corresponding curves were nos. 1–18. After the sixth adding, the UV–vis spectra of the mixture became similar (from Fig. 5 ). So when the mole ratio of n(lysine·HCl)/n(H2PdCl4) was about 1.18, the complex did not changed. After the sixth adding, the lysine·HCl did not react again with any substance. According to the curve of between UV–vis Abs and the mole ratio of n(lysine·HCl)/n(H2PdCl4) at pH 4 (Fig. 6 ), the inflexion of the curve was at the mole ratio of n(lysine·HCl)/n(H2PdCl4)=1.00, so the complex between lysine·HCl and Pd prepared at pH 4 was 1:1 (metal:ligand) complex. Thirty millilitres of H2PdCl4 solution (Pd 0.81mg/mL), the pH of solution was about 2, was heated to 70°C for 1h, then 8.3mg lysine·HCl was added. The UV–vis spectrum of the mixture was examined after 30min. In the same way, each adding 8.3mg lysine·HCl in the mixture, the UV–vis spectrum of the mixture was recorded after reaction for 30min, the mole ratio of n(lysine·HCl)/n(H2PdCl4) was separately 0.20, 0.39, 0.60, 0.79, 0.98, 1.18, 1.38, 1.57, 1.77, 1.97, 2.16, 2.36, 2.56. The corresponding curves were nos. 1–13. After each adding, the UV–vis spectra of the mixture were different (from Fig. 7 ). According to the curve of between UV–vis Abs and the mole ratio of n(lysine·HCl)/n(H2PdCl4) at pH 2 (Fig. 8 ), the inflexion of the curve was at the mole ratio of n(lysine·HCl)/n(H2PdCl4)=0.99, but after the fifth adding, the UV–vis Abs continue to rise, the coordination structure has not stopped changing, so the complex between lysine·HCl and Pd prepared at pH 2 was not 1:1 (metal:ligand) complex. A 21.6mL 0.1mol NaOH solution was added into 30mL H2PdCl4 solution (Pd 0.81mg/mL), the pH of mixture was about 5.5. By the same method above, the UV–vis spectrum of the mixture was recorded (Fig. 9 ). After each adding lysine·HCl, the UV–vis spectra of the mixture were different. According to the curve of between UV–vis Abs and the mole ratio of n(lysine·HCl)/n(H2PdCl4) at pH 5.5 (Fig. 10 ), the inflexion of the curve was at the mole ratio of n(lysine·HCl)/n(H2PdCl4)=0.93, but after the fifth adding, a few deposits appeared, the UV–vis Abs became to fall, so the complex between lysine·HCl and Pd prepared at pH 5.5 was not 1:1 (metal:ligand) complex, too. Therefore, only pH of the mixture was at between 2 and 5.5, the complex between lysine·HCl and Pd prepared was 1:1 (metal:ligand) complex, the composition of Pd–lysine complex was [Pd(lysine·HCl)(Cl)2]. When pH was above 5.5 or under 2, the coordinate ratio of complex between lysine·HCl and Pd was uncertain, thus the complex was not suitable to catalyst. 3.2.2 The coordinate structure of the Pd–lysine complex The UV–vis spectra of lysine·HCl, valine, Pd–lysine complex, Pd–valine complex and H2PdCl4 solution were summarized in Fig. 11 . Obviously, UV–vis Abs of H2PdCl4 solution (428nm) was different from those of Pd–lysine complex (392nm), Pd–valine complex (391nm) and lysine·HCl (0nm), valine (0nm), but the UV–vis spectra of Pd–lysine complex and Pd–valine complex were similar. Because Pd–valine and Pd–lysine complex were prepared at the same condition, and there are only α-NH3 + and –COO− functional groups in valine, so the coordinate structures of Pd–valine and Pd–lysine complex were similar and the coordinate bonds were between Pd and α-NH3 + or –COO− groups. It is known that aminoacids undergo two reversible proton ionization steps (Scheme 1 ), therefore aminoacids may coordinate as the α-NH2 and –COOH groups under certain condition. 3.2.3 The further confirmation of coordinate structure of Pd–lysine complex by IR, 1H NMR spectra and single crystal diffraction determination The IR absorbance peaks of valine and Pd–valine complex crystal were summarized in Table 1 . The ascriptions of IR absorbance peaks were on the basis of Nakagawa et al. [19] and Ma et al. [20] suggests. The IR absorbance peaks of –COO− and –NH3 + groups of Pd–valine (1661cm−1, 1458cm−1; 1592cm−1, 1631cm−1) were different from that of valine (1561cm−1, 1416cm−1; 1627cm−1, 1503cm−1), the IR absorbance peaks of –COO− group shifted from 1596cm−1 to 1661cm−1 and from 1416cm−1 to 1458cm−1, the IR absorbance peak of –NH3 + group changed into two peaks and shifted from 1503cm−1 to 1592cm−1 and 1631cm−1, so the IR absorbance peaks of –COO− and –NH3 + groups of valine took change after complex with H2PdCl4, they may interact with Pd atom. Because there are only –COO− and α-NH3 + functional groups in valine, so α-NH3 + and –COO− groups may interact with H2PdCl4 to form coordinate bonds. Because there were similar coordinate structure between Pd–valine complex and Pd–lysine complex (from Fig. 11), so α-NH3 + and –COO− groups in lysine·HCl may form coordinate bonds with Pd atom. Because α-NH3 + cannot form the coordinate bond, the inter salt structure of valine and lysine·HCl must transfer into α-NH2 carboxylic acid before coordination. Because the five-membered chelating ring structure was very stable, the coordinate structure of Pd–lysine complex may be suggested as in Scheme 2 . The coordinate structure of Pd–lysine complex may be further verified by 1H NMR spectra of Table 2 , Fig. 12 and Scheme 3 . After H2PdCl4 interacted with lysine·HCl, the signal corresponding to 1H NMR peak of –NH3 + identified at δ 4.63ppm changed into three signals, they were identified at δ 4.31ppm, 4.58ppm, 4.78ppm, corresponding to 1H NMR peaks of –NH2, –NH3 +, –COOH, respectively. The signal corresponding to 1H NMR peak of –CH(2) shifted 0.1ppm, from δ 3.53–3.57ppm to δ 3.65–3.69ppm, the other signals corresponding to 1H NMR peaks of –CH2(3–6) did not change, so the coordinate bonds were formed between α-NH3 + and –COO− groups and metal Pd. Because –NH3 + cannot form the coordinate bond, the inter salt of lysine·HCl must become α-NH2 carboxylic acid before coordination. Under the same synthesis condition, Pd–lysine complex single crystal did not appear, but we obtained the single crystal of Pd–valine with the molecular formula of [Pd(valine)2]H2O. Crystal data for the complex, orthorhombic, space group P212121, with a =9.627(2)Å, b =9.659(2)Å, c =15.278(4)Å, V =1420.7(5)Å3, Z =4, R 1 =0.0319, w R 2 = 0.0489 . The ORTEP drawing of the complex are shown in Fig. 13 and the selected bond lengths and angles are listed in Table 3 . X-ray crystallography reveals α-NH2 and –COO− groups of each valine ligand coordinate to Pd to form one five-membered chelating ring. Since the Pd–valine complex contains two very stable five-membered chelating rings, it may not be suitable as catalyst. 3.3 The catalytic reactivity of Pd–lysine complex catalyst 3.3.1 Hydrogenation of p-chloronitrobenzene Hydrogenation product distributions of p-chloronitrobenzene at different reaction conditions were summarized in Table 4 , Pd–lysine complex catalyst may make p-chloronitrobenzene hydrogenate to p-chloroaniline in two-phases under mild reaction condition (50°C, 0.1MPa), the reaction conversion was 50.5% (GC) and the selectivity of p-chloroaniline was 98.0%. So the hydrogenation selectivity was good at lower pressure, little dechlorination reaction occurred. But at higher pressure, dechlorination product (aniline) increased, the aniline percent increased to 7.8%, the selectivity of p-chloroaniline was 90.6%, so Pd–lysine complex catalyst had dechlorination ability in two-phase reaction at higher pressure. When the reaction temperature raises to 75°C, the conversion increased to 75.6%, but the aniline percent increased to 12.3%, the selectivity of p-chloroaniline decreased to 83.7%. When the catalyst amount increased one times, the conversion increased to 93.4%, but the selectivity was still 99.1%. Therefore, only the increase of catalyst amount could obtain good conversion and selectivity of p-chloroaniline. Though there are four hydrogenation mechanistic pathways: (a) an oxidative addition of hydrogen, (b) hydride species, (c) unsaturated compound insertion (coordination), and (d) formation of an alkyl intermediate [21,22]. Pd–lysine complex prepared at pH 2.0–5.5 was complex catalyst, we suggest that the most possible hydrogenation mechanism should be hydride mechanism at pH 2.0–5.5. Because no other intermediate products were determined during reaction, many researches about the hydrogenation of –ArNO2 have been published and the intermediate products have been identified, therefore, the hydrogenation reaction mechanism of –NO2 in p-ClArNO2 was suggested as in Scheme 4 . As there are two Cl− coordinate bonds with Pd in Pd–lysine complex, the hydrogenation mechanism may be curtailed as Scheme 5 . The –ArNO2 may not be desorbed from the Pd complex until –ArNH2 was formed because of alternating action of two Pd–H bonds. This action can make the hydrogenation rate increase. There was dechlorination reaction during the hydrogenation reaction of p-ClArNO2. The mechanism of hydrogenation dechlorination of p-ClArNH2 was suggested in Scheme 6 . Because the constitution of intermediate of five coordinate complex was difficult, the hydrogenation dechlorination rate was slower than –ArNO2 hydrogenation. After reaction, Pd–lysine complex catalyst may be recycled by simple phase separation. Because the water was produced during –ArNO2 hydrogenation, the concentration of recycled Pd–lysine complex catalyst was diluted, thus the recycled Pd–lysine complex catalyst must be condensed under 80°C before using again to obtain the same concentration catalyst. Under the same reaction condition, the recycled catalyst was used to catalyze the hydrogenation of p-ClArNO2. After six recycling, the conversion and selectivity of p-ClArNO2 changed less (Fig. 14 ), the UV–vis spectra of recycled catalysts were similar and same as the spectrum of the new catalyst (Fig. 15 ). Thus, the stability of Pd–lysine complex catalyst was good under the reaction condition (50°C, 0.1MPa, catalyst amount 35mL, catalyst concentration 0.066mmol/mL, the pH 4–4.5). 3.3.2 Hydrogenation and dimerization of 2-nitro-5-chlorobenzotrifluoride According to GC–MS analysis and elemental analysis, we suggest when using ethanol as solvent and in H2, after 2-nitro-5-chlorobenzotrifluoride was hydrogenated to 2-amino-5-chlorobenzotrifluride, the 2-amino-5-chlorobenzotrifluride may occur dimerization, the product was light yellow crystal. The crystal was washed by ethanol and dried in 80°C, the total weight was 71.4g, the conversion of 2-nitro-5-chlorobenzotrifluoride was 55%, the selectivity of dimmer was 98%. The reaction was as in Scheme 7 . Because polyaniline was produced at o- or p-position of amino group [23], the dimerization product was only at o-position of amino group. According to above reaction results, the Pd–lysine complex prepared at pH 2–5.5 may be catalysts of hydrogenation of –ArNO2, hydrogenation dechlorination of –ArCl and dimerization of –ArNH2. As the CH(2) in lysine is a chiral carbon atom, the Pd–lysine complex prepared above may be chiral catalyst. The enantioselective catalytic activity about these catalysts will be further researched. 4 Conclusion Pd–lysine complex was prepared under mild condition and the N, O in α-NH2 and –COOH groups may coordinate to the central Pd atom to form one stable five-membered chelating ring. The composition of Pd–lysine complex was [Pd(lysine·HCl)(Cl)2] at pH 2–5.5, it may be used as two-phase hydrogenation catalyst for its property of water-soluble and it may easily be recycled by simple phase separation. Pd–lysine complex can make p-chloronitrobenzene hydrogenate to p-chloroaniline or hydrogenate and dechlorinate to aniline, and can make 2-nitro-5-chlorobenzotrifluoride hydrogenate and dimerize to dimer. References [1] W.A. Herrmann C.W. Kohlpainter Angew. Chem. Int. Ed. Engl. 32 1993 1524 [2] P. Kalck F. Monteil Adv. Organomet. Chem. 34 1992 219 [3] B. Cornils E. Wiebus Chemtech 33 1995 [4] B. Comils E. Iebus Chemtech 26 1995 33 [5] J. Haggin Chem. Eng. News 72 1994 28 [6] K. Nomura J. Mol. Catal. A 130 1998 1 [7] I.T. Horvath (ed.), Catalysis in Water, J. Mol. Catal. A 116 (1997) (special issue). [8] A.M. Tafesh M. Beller Tetrahedron Lett. 36 1995 9305 [9] E. Monflier S. Tilloy G. Fremy Y. Castanet A. Mertreuxon Tetrahedron Lett. 36 1995 9481 [10] H. Jiang Y. Xu S.J. Liao D.R. Yu H. Chen X.J. Li J. Mol. Catal. A 130 1998 79 [11] A.J. Gong Q.H. Fan Y.M. Chen H.W. Liu C.F. Chen F. Xi J. Mol. Catal. A 159 2000 225 [12] J.M. Tour J.P. Cooper S.L. Pendalwar J. Org. Chem. 55 1990 3452 [13] J.M. Tour S.L. Pendalwar Tetrahedron Lett. 31 1990 4719 [14] F. Joo N. Balogh L.I. Horvath G. Filep I. Horvath L. Vigh Anal. Biochem. 194 1991 34 [15] M.T. Reeta G. Lohmer R. Schwicjard Angew. Chem. Int. Ed. Engl. 36 13/14 1997 1526 [16] K. Kaneda H. Kuwahara T. Imanaka J. Mol. Catal. 88 1994 L267 [17] Bruker AXS SAINT Software Reference Manual 1998 Bruker AXS Madison, WI [18] G.M. Sheldrick SHELXTL NT Version 5.1. Program for Solution and Refinement of Crystal Structures 1997 University of Göttingen Germany [19] I. Nakagawa R.J. Hooper J.L. Walter Spectrachonica Acta 21 1965 1 [20] A.Z. Ma L.M. Li S.Q. Xi Chin. J. Appl. Chem. 12 1995 48 [21] E.W. Stern P.K. Maples J. Catal. 27 1972 120 [22] D. Foster J.F. Roth Homogeneous Catalysis. Part II. Advanced Chemical Series 1974 132 [23] Y. Cao A. Andreatta A.J. Heeger P. Smith Polymer 30 1989 230",
      "scopus-id": "33847673523",
      "coredata": {
        "eid": "1-s2.0-S138111690601257X",
        "dc:description": "Two water-soluble Pd–aminoacid complexes were prepared under mild condition and were characterized by various techniques such as IR, UV–vis, 1H NMR spectra. X-ray crystallography reveals the structure of Pd–valine complex with the molecular formula of [Pd(valine)2]·H2O and the composition of Pd–lysine complex was suggested as [Pd(lysine·HCl)(Cl)2] at pH 2–5.5. Hydrogenation performance of Pd–lysine complex in two-phase was evaluated by using p-chloronitrobenzene. The hydrogenation and dimer performance of Pd–lysine complex was also evaluated by using 2-nitro-5-chlorobenzotrifluride.",
        "openArchiveArticle": "false",
        "prism:coverDate": "2007-03-16",
        "openaccessUserLicense": null,
        "prism:aggregationType": "Journal",
        "prism:url": "https://api.elsevier.com/content/article/pii/S138111690601257X",
        "dc:creator": [
          {
            "@_fa": "true",
            "$": "Hao, Yu-Zhi"
          },
          {
            "@_fa": "true",
            "$": "Li, Zuo-Xi"
          },
          {
            "@_fa": "true",
            "$": "Tian, Jin-Lei"
          }
        ],
        "link": [
          {
            "@_fa": "true",
            "@rel": "self",
            "@href": "https://api.elsevier.com/content/article/pii/S138111690601257X"
          },
          {
            "@_fa": "true",
            "@rel": "scidir",
            "@href": "https://www.sciencedirect.com/science/article/pii/S138111690601257X"
          }
        ],
        "dc:format": "application/json",
        "openaccessType": null,
        "pii": "S1381-1169(06)01257-X",
        "prism:volume": "265",
        "prism:publisher": "Elsevier B.V.",
        "dc:title": "Synthesis, characteristics and catalytic activity of water-soluble [Pd(lysine·HCl)(Cl)2] complex as hydrogenation catalyst",
        "prism:copyright": "Copyright © 2006 Elsevier B.V. All rights reserved.",
        "openaccess": "0",
        "prism:issn": "13811169",
        "prism:issueIdentifier": "1-2",
        "dcterms:subject": [
          {
            "@_fa": "true",
            "$": "Pd–lysine"
          },
          {
            "@_fa": "true",
            "$": "Hydrogenation"
          },
          {
            "@_fa": "true",
            "$": "Water-soluble"
          },
          {
            "@_fa": "true",
            "$": "Two-phase"
          },
          {
            "@_fa": "true",
            "$": "Catalyst"
          }
        ],
        "openaccessArticle": "false",
        "prism:publicationName": "Journal of Molecular Catalysis A: Chemical",
        "prism:number": "1-2",
        "openaccessSponsorType": null,
        "prism:pageRange": "258-267",
        "prism:endingPage": "267",
        "pubType": "fla",
        "prism:coverDisplayDate": "16 March 2007",
        "prism:doi": "10.1016/j.molcata.2006.09.045",
        "prism:startingPage": "258",
        "dc:identifier": "doi:10.1016/j.molcata.2006.09.045",
        "openaccessSponsorName": null
      },
      "objects": {
        "object": [
          {
            "@category": "thumbnail",
            "@height": "13",
            "@width": "98",
            "@_fa": "true",
            "$": "https://api.elsevier.com/content/object/eid/1-s2.0-S138111690601257X-si1.gif?httpAccept=%2A%2F%2A",
            "@multimediatype": "GIF image file",
            "@type": "ALTIMG",
            "@size": "417",
            "@ref": "si1",
            "@mimetype": "image/gif"
          },
          {
            "@category": "standard",
            "@height": "203",
            "@width": "160",
            "@_fa": "true",
            "$": "https://api.elsevier.com/content/object/eid/1-s2.0-S138111690601257X-fx1.gif?httpAccept=%2A%2F%2A",
            "@multimediatype": "GIF image file",
            "@type": "IMAGE-DOWNSAMPLED",
            "@size": "2672",
            "@ref": "fx1",
            "@mimetype": "image/gif"
          },
          {
            "@category": "thumbnail",
            "@height": "93",
            "@width": "73",
            "@_fa": "true",
            "$": "https://api.elsevier.com/content/object/eid/1-s2.0-S138111690601257X-fx1.sml?httpAccept=%2A%2F%2A",
            "@multimediatype": "GIF image file",
            "@type": "IMAGE-THUMBNAIL",
            "@size": "1002",
            "@ref": "fx1",
            "@mimetype": "image/gif"
          },
          {
            "@category": "standard",
            "@height": "296",
            "@width": "392",
            "@_fa": "true",
            "$": "https://api.elsevier.com/content/object/eid/1-s2.0-S138111690601257X-gr1.jpg?httpAccept=%2A%2F%2A",
            "@multimediatype": "JPEG image file",
            "@type": "IMAGE-DOWNSAMPLED",
            "@size": "17573",
            "@ref": "gr1",
            "@mimetype": "image/jpeg"
          },
          {
            "@category": "thumbnail",
            "@height": "94",
            "@width": "124",
            "@_fa": "true",
            "$": "https://api.elsevier.com/content/object/eid/1-s2.0-S138111690601257X-gr1.sml?httpAccept=%2A%2F%2A",
            "@multimediatype": "GIF image file",
            "@type": "IMAGE-THUMBNAIL",
            "@size": "1457",
            "@ref": "gr1",
            "@mimetype": "image/gif"
          },
          {
            "@category": "standard",
            "@height": "279",
            "@width": "345",
            "@_fa": "true",
            "$": "https://api.elsevier.com/content/object/eid/1-s2.0-S138111690601257X-gr10.jpg?httpAccept=%2A%2F%2A",
            "@multimediatype": "JPEG image file",
            "@type": "IMAGE-DOWNSAMPLED",
            "@size": "11801",
            "@ref": "gr10",
            "@mimetype": "image/jpeg"
          },
          {
            "@category": "thumbnail",
            "@height": "94",
            "@width": "116",
            "@_fa": "true",
            "$": "https://api.elsevier.com/content/object/eid/1-s2.0-S138111690601257X-gr10.sml?httpAccept=%2A%2F%2A",
            "@multimediatype": "GIF image file",
            "@type": "IMAGE-THUMBNAIL",
            "@size": "1074",
            "@ref": "gr10",
            "@mimetype": "image/gif"
          },
          {
            "@category": "standard",
            "@height": "291",
            "@width": "377",
            "@_fa": "true",
            "$": "https://api.elsevier.com/content/object/eid/1-s2.0-S138111690601257X-gr11.jpg?httpAccept=%2A%2F%2A",
            "@multimediatype": "JPEG image file",
            "@type": "IMAGE-DOWNSAMPLED",
            "@size": "16879",
            "@ref": "gr11",
            "@mimetype": "image/jpeg"
          },
          {
            "@category": "thumbnail",
            "@height": "93",
            "@width": "121",
            "@_fa": "true",
            "$": "https://api.elsevier.com/content/object/eid/1-s2.0-S138111690601257X-gr11.sml?httpAccept=%2A%2F%2A",
            "@multimediatype": "GIF image file",
            "@type": "IMAGE-THUMBNAIL",
            "@size": "1260",
            "@ref": "gr11",
            "@mimetype": "image/gif"
          },
          {
            "@category": "standard",
            "@height": "850",
            "@width": "541",
            "@_fa": "true",
            "$": "https://api.elsevier.com/content/object/eid/1-s2.0-S138111690601257X-gr12.jpg?httpAccept=%2A%2F%2A",
            "@multimediatype": "JPEG image file",
            "@type": "IMAGE-DOWNSAMPLED",
            "@size": "54039",
            "@ref": "gr12",
            "@mimetype": "image/jpeg"
          },
          {
            "@category": "thumbnail",
            "@height": "93",
            "@width": "59",
            "@_fa": "true",
            "$": "https://api.elsevier.com/content/object/eid/1-s2.0-S138111690601257X-gr12.sml?httpAccept=%2A%2F%2A",
            "@multimediatype": "GIF image file",
            "@type": "IMAGE-THUMBNAIL",
            "@size": "776",
            "@ref": "gr12",
            "@mimetype": "image/gif"
          },
          {
            "@category": "standard",
            "@height": "177",
            "@width": "386",
            "@_fa": "true",
            "$": "https://api.elsevier.com/content/object/eid/1-s2.0-S138111690601257X-gr13.gif?httpAccept=%2A%2F%2A",
            "@multimediatype": "GIF image file",
            "@type": "IMAGE-DOWNSAMPLED",
            "@size": "7925",
            "@ref": "gr13",
            "@mimetype": "image/gif"
          },
          {
            "@category": "thumbnail",
            "@height": "57",
            "@width": "125",
            "@_fa": "true",
            "$": "https://api.elsevier.com/content/object/eid/1-s2.0-S138111690601257X-gr13.sml?httpAccept=%2A%2F%2A",
            "@multimediatype": "GIF image file",
            "@type": "IMAGE-THUMBNAIL",
            "@size": "1547",
            "@ref": "gr13",
            "@mimetype": "image/gif"
          },
          {
            "@category": "standard",
            "@height": "243",
            "@width": "314",
            "@_fa": "true",
            "$": "https://api.elsevier.com/content/object/eid/1-s2.0-S138111690601257X-gr14.jpg?httpAccept=%2A%2F%2A",
            "@multimediatype": "JPEG image file",
            "@type": "IMAGE-DOWNSAMPLED",
            "@size": "8031",
            "@ref": "gr14",
            "@mimetype": "image/jpeg"
          },
          {
            "@category": "thumbnail",
            "@height": "93",
            "@width": "120",
            "@_fa": "true",
            "$": "https://api.elsevier.com/content/object/eid/1-s2.0-S138111690601257X-gr14.sml?httpAccept=%2A%2F%2A",
            "@multimediatype": "GIF image file",
            "@type": "IMAGE-THUMBNAIL",
            "@size": "847",
            "@ref": "gr14",
            "@mimetype": "image/gif"
          },
          {
            "@category": "standard",
            "@height": "254",
            "@width": "288",
            "@_fa": "true",
            "$": "https://api.elsevier.com/content/object/eid/1-s2.0-S138111690601257X-gr15.jpg?httpAccept=%2A%2F%2A",
            "@multimediatype": "JPEG image file",
            "@type": "IMAGE-DOWNSAMPLED",
            "@size": "22396",
            "@ref": "gr15",
            "@mimetype": "image/jpeg"
          },
          {
            "@category": "thumbnail",
            "@height": "93",
            "@width": "106",
            "@_fa": "true",
            "$": "https://api.elsevier.com/content/object/eid/1-s2.0-S138111690601257X-gr15.sml?httpAccept=%2A%2F%2A",
            "@multimediatype": "GIF image file",
            "@type": "IMAGE-THUMBNAIL",
            "@size": "1611",
            "@ref": "gr15",
            "@mimetype": "image/gif"
          },
          {
            "@category": "standard",
            "@height": "285",
            "@width": "379",
            "@_fa": "true",
            "$": "https://api.elsevier.com/content/object/eid/1-s2.0-S138111690601257X-gr2.jpg?httpAccept=%2A%2F%2A",
            "@multimediatype": "JPEG image file",
            "@type": "IMAGE-DOWNSAMPLED",
            "@size": "9985",
            "@ref": "gr2",
            "@mimetype": "image/jpeg"
          },
          {
            "@category": "thumbnail",
            "@height": "93",
            "@width": "124",
            "@_fa": "true",
            "$": "https://api.elsevier.com/content/object/eid/1-s2.0-S138111690601257X-gr2.sml?httpAccept=%2A%2F%2A",
            "@multimediatype": "GIF image file",
            "@type": "IMAGE-THUMBNAIL",
            "@size": "909",
            "@ref": "gr2",
            "@mimetype": "image/gif"
          },
          {
            "@category": "standard",
            "@height": "279",
            "@width": "380",
            "@_fa": "true",
            "$": "https://api.elsevier.com/content/object/eid/1-s2.0-S138111690601257X-gr3.jpg?httpAccept=%2A%2F%2A",
            "@multimediatype": "JPEG image file",
            "@type": "IMAGE-DOWNSAMPLED",
            "@size": "7791",
            "@ref": "gr3",
            "@mimetype": "image/jpeg"
          },
          {
            "@category": "thumbnail",
            "@height": "92",
            "@width": "125",
            "@_fa": "true",
            "$": "https://api.elsevier.com/content/object/eid/1-s2.0-S138111690601257X-gr3.sml?httpAccept=%2A%2F%2A",
            "@multimediatype": "GIF image file",
            "@type": "IMAGE-THUMBNAIL",
            "@size": "741",
            "@ref": "gr3",
            "@mimetype": "image/gif"
          },
          {
            "@category": "standard",
            "@height": "276",
            "@width": "358",
            "@_fa": "true",
            "$": "https://api.elsevier.com/content/object/eid/1-s2.0-S138111690601257X-gr4.jpg?httpAccept=%2A%2F%2A",
            "@multimediatype": "JPEG image file",
            "@type": "IMAGE-DOWNSAMPLED",
            "@size": "18752",
            "@ref": "gr4",
            "@mimetype": "image/jpeg"
          },
          {
            "@category": "thumbnail",
            "@height": "93",
            "@width": "121",
            "@_fa": "true",
            "$": "https://api.elsevier.com/content/object/eid/1-s2.0-S138111690601257X-gr4.sml?httpAccept=%2A%2F%2A",
            "@multimediatype": "GIF image file",
            "@type": "IMAGE-THUMBNAIL",
            "@size": "1477",
            "@ref": "gr4",
            "@mimetype": "image/gif"
          },
          {
            "@category": "standard",
            "@height": "288",
            "@width": "374",
            "@_fa": "true",
            "$": "https://api.elsevier.com/content/object/eid/1-s2.0-S138111690601257X-gr5.gif?httpAccept=%2A%2F%2A",
            "@multimediatype": "GIF image file",
            "@type": "IMAGE-DOWNSAMPLED",
            "@size": "8360",
            "@ref": "gr5",
            "@mimetype": "image/gif"
          },
          {
            "@category": "thumbnail",
            "@height": "93",
            "@width": "121",
            "@_fa": "true",
            "$": "https://api.elsevier.com/content/object/eid/1-s2.0-S138111690601257X-gr5.sml?httpAccept=%2A%2F%2A",
            "@multimediatype": "GIF image file",
            "@type": "IMAGE-THUMBNAIL",
            "@size": "1577",
            "@ref": "gr5",
            "@mimetype": "image/gif"
          },
          {
            "@category": "standard",
            "@height": "299",
            "@width": "381",
            "@_fa": "true",
            "$": "https://api.elsevier.com/content/object/eid/1-s2.0-S138111690601257X-gr6.jpg?httpAccept=%2A%2F%2A",
            "@multimediatype": "JPEG image file",
            "@type": "IMAGE-DOWNSAMPLED",
            "@size": "11167",
            "@ref": "gr6",
            "@mimetype": "image/jpeg"
          },
          {
            "@category": "thumbnail",
            "@height": "93",
            "@width": "119",
            "@_fa": "true",
            "$": "https://api.elsevier.com/content/object/eid/1-s2.0-S138111690601257X-gr6.sml?httpAccept=%2A%2F%2A",
            "@multimediatype": "GIF image file",
            "@type": "IMAGE-THUMBNAIL",
            "@size": "952",
            "@ref": "gr6",
            "@mimetype": "image/gif"
          },
          {
            "@category": "standard",
            "@height": "256",
            "@width": "386",
            "@_fa": "true",
            "$": "https://api.elsevier.com/content/object/eid/1-s2.0-S138111690601257X-gr7.jpg?httpAccept=%2A%2F%2A",
            "@multimediatype": "JPEG image file",
            "@type": "IMAGE-DOWNSAMPLED",
            "@size": "36444",
            "@ref": "gr7",
            "@mimetype": "image/jpeg"
          },
          {
            "@category": "thumbnail",
            "@height": "83",
            "@width": "125",
            "@_fa": "true",
            "$": "https://api.elsevier.com/content/object/eid/1-s2.0-S138111690601257X-gr7.sml?httpAccept=%2A%2F%2A",
            "@multimediatype": "GIF image file",
            "@type": "IMAGE-THUMBNAIL",
            "@size": "1937",
            "@ref": "gr7",
            "@mimetype": "image/gif"
          },
          {
            "@category": "standard",
            "@height": "270",
            "@width": "343",
            "@_fa": "true",
            "$": "https://api.elsevier.com/content/object/eid/1-s2.0-S138111690601257X-gr8.jpg?httpAccept=%2A%2F%2A",
            "@multimediatype": "JPEG image file",
            "@type": "IMAGE-DOWNSAMPLED",
            "@size": "11562",
            "@ref": "gr8",
            "@mimetype": "image/jpeg"
          },
          {
            "@category": "thumbnail",
            "@height": "93",
            "@width": "118",
            "@_fa": "true",
            "$": "https://api.elsevier.com/content/object/eid/1-s2.0-S138111690601257X-gr8.sml?httpAccept=%2A%2F%2A",
            "@multimediatype": "GIF image file",
            "@type": "IMAGE-THUMBNAIL",
            "@size": "989",
            "@ref": "gr8",
            "@mimetype": "image/gif"
          },
          {
            "@category": "standard",
            "@height": "254",
            "@width": "372",
            "@_fa": "true",
            "$": "https://api.elsevier.com/content/object/eid/1-s2.0-S138111690601257X-gr9.jpg?httpAccept=%2A%2F%2A",
            "@multimediatype": "JPEG image file",
            "@type": "IMAGE-DOWNSAMPLED",
            "@size": "24578",
            "@ref": "gr9",
            "@mimetype": "image/jpeg"
          },
          {
            "@category": "thumbnail",
            "@height": "85",
            "@width": "125",
            "@_fa": "true",
            "$": "https://api.elsevier.com/content/object/eid/1-s2.0-S138111690601257X-gr9.sml?httpAccept=%2A%2F%2A",
            "@multimediatype": "GIF image file",
            "@type": "IMAGE-THUMBNAIL",
            "@size": "1688",
            "@ref": "gr9",
            "@mimetype": "image/gif"
          },
          {
            "@category": "standard",
            "@height": "164",
            "@width": "376",
            "@_fa": "true",
            "$": "https://api.elsevier.com/content/object/eid/1-s2.0-S138111690601257X-sc1.gif?httpAccept=%2A%2F%2A",
            "@multimediatype": "GIF image file",
            "@type": "IMAGE-DOWNSAMPLED",
            "@size": "3634",
            "@ref": "sc1",
            "@mimetype": "image/gif"
          },
          {
            "@category": "thumbnail",
            "@height": "54",
            "@width": "125",
            "@_fa": "true",
            "$": "https://api.elsevier.com/content/object/eid/1-s2.0-S138111690601257X-sc1.sml?httpAccept=%2A%2F%2A",
            "@multimediatype": "GIF image file",
            "@type": "IMAGE-THUMBNAIL",
            "@size": "795",
            "@ref": "sc1",
            "@mimetype": "image/gif"
          },
          {
            "@category": "standard",
            "@height": "193",
            "@width": "113",
            "@_fa": "true",
            "$": "https://api.elsevier.com/content/object/eid/1-s2.0-S138111690601257X-sc2.gif?httpAccept=%2A%2F%2A",
            "@multimediatype": "GIF image file",
            "@type": "IMAGE-DOWNSAMPLED",
            "@size": "1956",
            "@ref": "sc2",
            "@mimetype": "image/gif"
          },
          {
            "@category": "thumbnail",
            "@height": "92",
            "@width": "54",
            "@_fa": "true",
            "$": "https://api.elsevier.com/content/object/eid/1-s2.0-S138111690601257X-sc2.sml?httpAccept=%2A%2F%2A",
            "@multimediatype": "GIF image file",
            "@type": "IMAGE-THUMBNAIL",
            "@size": "743",
            "@ref": "sc2",
            "@mimetype": "image/gif"
          },
          {
            "@category": "standard",
            "@height": "232",
            "@width": "239",
            "@_fa": "true",
            "$": "https://api.elsevier.com/content/object/eid/1-s2.0-S138111690601257X-sc3.gif?httpAccept=%2A%2F%2A",
            "@multimediatype": "GIF image file",
            "@type": "IMAGE-DOWNSAMPLED",
            "@size": "4424",
            "@ref": "sc3",
            "@mimetype": "image/gif"
          },
          {
            "@category": "thumbnail",
            "@height": "93",
            "@width": "96",
            "@_fa": "true",
            "$": "https://api.elsevier.com/content/object/eid/1-s2.0-S138111690601257X-sc3.sml?httpAccept=%2A%2F%2A",
            "@multimediatype": "GIF image file",
            "@type": "IMAGE-THUMBNAIL",
            "@size": "1173",
            "@ref": "sc3",
            "@mimetype": "image/gif"
          },
          {
            "@category": "standard",
            "@height": "402",
            "@width": "489",
            "@_fa": "true",
            "$": "https://api.elsevier.com/content/object/eid/1-s2.0-S138111690601257X-sc5.gif?httpAccept=%2A%2F%2A",
            "@multimediatype": "GIF image file",
            "@type": "IMAGE-DOWNSAMPLED",
            "@size": "7462",
            "@ref": "sc5",
            "@mimetype": "image/gif"
          },
          {
            "@category": "thumbnail",
            "@height": "94",
            "@width": "114",
            "@_fa": "true",
            "$": "https://api.elsevier.com/content/object/eid/1-s2.0-S138111690601257X-sc5.sml?httpAccept=%2A%2F%2A",
            "@multimediatype": "GIF image file",
            "@type": "IMAGE-THUMBNAIL",
            "@size": "959",
            "@ref": "sc5",
            "@mimetype": "image/gif"
          },
          {
            "@category": "standard",
            "@height": "324",
            "@width": "336",
            "@_fa": "true",
            "$": "https://api.elsevier.com/content/object/eid/1-s2.0-S138111690601257X-sc6.gif?httpAccept=%2A%2F%2A",
            "@multimediatype": "GIF image file",
            "@type": "IMAGE-DOWNSAMPLED",
            "@size": "5117",
            "@ref": "sc6",
            "@mimetype": "image/gif"
          },
          {
            "@category": "thumbnail",
            "@height": "94",
            "@width": "97",
            "@_fa": "true",
            "$": "https://api.elsevier.com/content/object/eid/1-s2.0-S138111690601257X-sc6.sml?httpAccept=%2A%2F%2A",
            "@multimediatype": "GIF image file",
            "@type": "IMAGE-THUMBNAIL",
            "@size": "914",
            "@ref": "sc6",
            "@mimetype": "image/gif"
          },
          {
            "@category": "standard",
            "@height": "82",
            "@width": "348",
            "@_fa": "true",
            "$": "https://api.elsevier.com/content/object/eid/1-s2.0-S138111690601257X-sc7.gif?httpAccept=%2A%2F%2A",
            "@multimediatype": "GIF image file",
            "@type": "IMAGE-DOWNSAMPLED",
            "@size": "2653",
            "@ref": "sc7",
            "@mimetype": "image/gif"
          },
          {
            "@category": "thumbnail",
            "@height": "29",
            "@width": "125",
            "@_fa": "true",
            "$": "https://api.elsevier.com/content/object/eid/1-s2.0-S138111690601257X-sc7.sml?httpAccept=%2A%2F%2A",
            "@multimediatype": "GIF image file",
            "@type": "IMAGE-THUMBNAIL",
            "@size": "631",
            "@ref": "sc7",
            "@mimetype": "image/gif"
          },
          {
            "@category": "standard",
            "@height": "422",
            "@width": "566",
            "@_fa": "true",
            "$": "https://api.elsevier.com/content/object/eid/1-s2.0-S138111690601257X-sc4.gif?httpAccept=%2A%2F%2A",
            "@multimediatype": "GIF image file",
            "@type": "IMAGE-DOWNSAMPLED",
            "@size": "9736",
            "@ref": "sc4",
            "@mimetype": "image/gif"
          },
          {
            "@category": "thumbnail",
            "@height": "93",
            "@width": "125",
            "@_fa": "true",
            "$": "https://api.elsevier.com/content/object/eid/1-s2.0-S138111690601257X-sc4.sml?httpAccept=%2A%2F%2A",
            "@multimediatype": "GIF image file",
            "@type": "IMAGE-THUMBNAIL",
            "@size": "1079",
            "@ref": "sc4",
            "@mimetype": "image/gif"
          }
        ]
      },
      "link": {
        "@rel": "abstract",
        "@href": "https://api.elsevier.com/content/abstract/scopus_id/33847673523"
      }
    }
  }
}