{
  "metadata": {
    "title": "Ruthenium/magnesium–lanthanum mixed oxide: An efficient reusable catalyst for oxidation of alcohols by using molecular oxygen",
    "authors": "; ; ",
    "journal": "Journal of Molecular Catalysis A: Chemical",
    "date": "2012-07-31",
    "doi": "10.1016/j.molcata.2012.03.013",
    "abstract": "",
    "uri": "https://api.elsevier.com/content/article/pii/S138111691200091X",
    "pii": "S138111691200091X"
  },
  "fulltext": {
    "full-text-retrieval-response": {
      "scopus-eid": "2-s2.0-84860833414",
      "originalText": "serial JL 271358 291210 291744 291790 291809 31 Journal of Molecular Catalysis A: Chemical JOURNALMOLECULARCATALYSISACHEMICAL 2012-03-23 2012-03-23 2012-05-08T02:11:16 1-s2.0-S138111691200091X S1381-1169(12)00091-X S138111691200091X 10.1016/j.molcata.2012.03.013 S300 S300.1 FULL-TEXT 1-s2.0-S1381116912X00050 2015-05-15T05:56:33.607047-04:00 0 0 20120701 20120731 2012 2012-03-23T00:00:00Z articleinfo crossmark dco dateupdated tomb dateloaded datesearch indexeddate volumelist yearnav absattachment articletitlenorm authfirstinitialnorm authfirstsurnamenorm cid cids contenttype copyright dateloadedtxt docsubtype doctype doi eid ewtransactionid hubeid issn issnnorm itemstage itemtransactionid itemweight openaccess openarchive pg pgfirst pglast pii piinorm pubdateend pubdatestart pubdatetxt pubyr sectiontitle sortorder srctitle srctitlenorm srctype subheadings suppl volfirst volissue webpdf webpdfpagecount figure table e-component body acknowledge affil appendices articletitle auth authfirstini authfull authkeywords authlast primabst ref specialabst alllist content subj ssids 1381-1169 13811169 359 359 C Volume 359 3 1 7 1 7 201207 July 2012 2012-07-01 2012-07-31 2012 Regular Papers article fla Copyright © 2012 Elsevier B.V. All rights reserved. RUTHENIUMMAGNESIUMLANTHANUMMIXEDOXIDEEFFICIENTREUSABLECATALYSTFOROXIDATIONALCOHOLSBYUSINGMOLECULAROXYGEN KANTAM M 1 Introduction 2 Experimental 2.1 Materials and methods 2.2 Preparation of catalyst 2.3 General procedure for the oxidation of alcohols 3 Results and discussion 3.1 Catalyst characterization 3.2 Catalytic activity of Ru/Mg–LaO for oxidation of alcohols 4 Conclusions Acknowledgements Appendix A Supplementary data References HILL 1988 C ADVANCESINOXYGENATEDPROCESSES HUNDLUCKY 1990 M OXIDATIONSINORGANICCHEMISTRY SHELDON 2002 774 781 R MALLAT 2004 3037 3058 T MATSUMOTO 2008 196 214 T BILGRIEN 1987 3786 3787 C MURAHASHI 1993 7318 7319 S MARKO 1997 12661 12662 I DIJKSMAN 2001 6826 6833 A CSJERNYIK 2002 1657 1662 G HEERES 1997 221 227 A SHELDON 2006 200 214 R KOCHKAR 2000 343 351 H BRUNEL 2001 73 82 D MATSUMOTO 1984 3435 3436 M YAMAGUCHI 2000 7144 7145 K OPRE 2007 48 58 Z FU 2007 190 197 X NISHIMURA 2000 1245 1246 T MORI 2002 11572 11573 K MORI 2004 10657 10666 K TENBRINK 2000 636 1639 G TENBRINK 2003 1341 1352 G TENBRINK 2003 497 505 G YAMADA 2007 704 706 Y CHOUDARY 2001 763 766 B ABAD 2006 6666 6672 A ABAD 2005 4066 4069 A OPRE 2006 287 295 Z LAKSHMIKANTAM 2008 1225 1229 M MATSUMOTO 2007 531 534 T YAMAGUCHI 2002 4538 4542 K HINZEN 1997 1907 1908 B BLELOCH 1999 1907 1908 A VELDURTHY 2004 734 735 B VELDURTHY 2005 767 771 B LAKSHMIKANTAM 2007 1887 1890 M CWIK 2006 523 530 A CWIK 2005 4307 4309 A GRAVELLE 1972 191 263 P AUROUX 1990 6371 6379 A DOSKOCIL 1997 327 337 E BETANCOURT 1998 307 314 P BOSSI 1978 405 A MURATA 1992 118 125 S OPRE 2005 406 419 Z KOOPMAN 1981 172 179 J CHAN 1997 336 345 H KANTAMX2012X1 KANTAMX2012X1X7 KANTAMX2012X1XM KANTAMX2012X1X7XM item S1381-1169(12)00091-X S138111691200091X 1-s2.0-S138111691200091X 10.1016/j.molcata.2012.03.013 271358 2012-05-07T22:59:36.420704-04:00 2012-07-01 2012-07-31 1-s2.0-S138111691200091X-main.pdf https://s3.amazonaws.com/prod-ucs-content-store-us-east/content/pii:S138111691200091X/MAIN/application/pdf/4bc2831e37403bb85a0e7fa0087a171a/main.pdf https://s3-eu-west-1.amazonaws.com/prod-ucs-content-store-eu-west/content/pii:S138111691200091X/MAIN/application/pdf/4bc2831e37403bb85a0e7fa0087a171a/main.pdf main.pdf pdf true 906823 MAIN 7 1-s2.0-S138111691200091X-main_1.png https://s3-eu-west-1.amazonaws.com/prod-ucs-content-store-eu-west/content/pii:S138111691200091X/PREVIEW/image/png/06498ed02529718c194bdbf739c1deb0/main_1.png https://s3.amazonaws.com/prod-ucs-content-store-us-east/content/pii:S138111691200091X/PREVIEW/image/png/06498ed02529718c194bdbf739c1deb0/main_1.png main_1.png png 59421 849 656 IMAGE-WEB-PDF 1 1-s2.0-S138111691200091X-mmc1.doc https://s3.amazonaws.com/prod-ucs-content-store-us-east/content/pii:S138111691200091X/mmc1/MAIN/application/msword/b305fc98fbedadb15a0ec1c427ad7042/mmc1.doc https://s3-eu-west-1.amazonaws.com/prod-ucs-content-store-eu-west/content/pii:S138111691200091X/mmc1/MAIN/application/msword/b305fc98fbedadb15a0ec1c427ad7042/mmc1.doc mmc1 mmc1.doc doc 790528 APPLICATION 1-s2.0-S138111691200091X-sc1.jpg https://s3.amazonaws.com/prod-ucs-content-store-us-east/content/pii:S138111691200091X/sc1/DOWNSAMPLED/image/jpeg/cd285316d5e7e766033ebb611be9ed11/sc1.jpg https://s3-eu-west-1.amazonaws.com/prod-ucs-content-store-eu-west/content/pii:S138111691200091X/sc1/DOWNSAMPLED/image/jpeg/cd285316d5e7e766033ebb611be9ed11/sc1.jpg sc1 sc1.jpg jpg 16868 105 356 IMAGE-DOWNSAMPLED 1-s2.0-S138111691200091X-sc1.sml https://s3.amazonaws.com/prod-ucs-content-store-us-east/content/pii:S138111691200091X/sc1/THUMBNAIL/image/gif/9448c11959468241f0e7858081b201b0/sc1.sml https://s3-eu-west-1.amazonaws.com/prod-ucs-content-store-eu-west/content/pii:S138111691200091X/sc1/THUMBNAIL/image/gif/9448c11959468241f0e7858081b201b0/sc1.sml sc1 sc1.sml sml 1852 65 219 IMAGE-THUMBNAIL 1-s2.0-S138111691200091X-sc1_lrg.jpg https://s3.amazonaws.com/prod-ucs-content-store-us-east/content/pii:S138111691200091X/sc1/HIGHRES/image/jpeg/a704bdb352374878b1cb7c89e9ea60a5/sc1_lrg.jpg https://s3-eu-west-1.amazonaws.com/prod-ucs-content-store-eu-west/content/pii:S138111691200091X/sc1/HIGHRES/image/jpeg/a704bdb352374878b1cb7c89e9ea60a5/sc1_lrg.jpg sc1 sc1_lrg.jpg jpg 79633 466 1578 IMAGE-HIGH-RES 1-s2.0-S138111691200091X-gr1.jpg https://s3.amazonaws.com/prod-ucs-content-store-us-east/content/pii:S138111691200091X/gr1/DOWNSAMPLED/image/jpeg/45502888d4d32792bdcd410a13029bf2/gr1.jpg https://s3-eu-west-1.amazonaws.com/prod-ucs-content-store-eu-west/content/pii:S138111691200091X/gr1/DOWNSAMPLED/image/jpeg/45502888d4d32792bdcd410a13029bf2/gr1.jpg gr1 gr1.jpg jpg 28387 287 372 IMAGE-DOWNSAMPLED 1-s2.0-S138111691200091X-gr1.sml https://s3.amazonaws.com/prod-ucs-content-store-us-east/content/pii:S138111691200091X/gr1/THUMBNAIL/image/gif/abe6f43d98e42dfa870dbd606342449e/gr1.sml https://s3-eu-west-1.amazonaws.com/prod-ucs-content-store-eu-west/content/pii:S138111691200091X/gr1/THUMBNAIL/image/gif/abe6f43d98e42dfa870dbd606342449e/gr1.sml gr1 gr1.sml sml 3789 164 212 IMAGE-THUMBNAIL 1-s2.0-S138111691200091X-gr1_lrg.jpg https://s3.amazonaws.com/prod-ucs-content-store-us-east/content/pii:S138111691200091X/gr1/HIGHRES/image/jpeg/2af02ae4940be339e9e535d19a469d81/gr1_lrg.jpg https://s3-eu-west-1.amazonaws.com/prod-ucs-content-store-eu-west/content/pii:S138111691200091X/gr1/HIGHRES/image/jpeg/2af02ae4940be339e9e535d19a469d81/gr1_lrg.jpg gr1 gr1_lrg.jpg jpg 177524 1274 1650 IMAGE-HIGH-RES 1-s2.0-S138111691200091X-gr2.jpg https://s3.amazonaws.com/prod-ucs-content-store-us-east/content/pii:S138111691200091X/gr2/DOWNSAMPLED/image/jpeg/5c04ca58294c08062f54ab6361919ac8/gr2.jpg https://s3-eu-west-1.amazonaws.com/prod-ucs-content-store-eu-west/content/pii:S138111691200091X/gr2/DOWNSAMPLED/image/jpeg/5c04ca58294c08062f54ab6361919ac8/gr2.jpg gr2 gr2.jpg jpg 25959 243 393 IMAGE-DOWNSAMPLED 1-s2.0-S138111691200091X-gr2.sml https://s3.amazonaws.com/prod-ucs-content-store-us-east/content/pii:S138111691200091X/gr2/THUMBNAIL/image/gif/9d0a4bc938b84749d3a076187523f4b4/gr2.sml https://s3-eu-west-1.amazonaws.com/prod-ucs-content-store-eu-west/content/pii:S138111691200091X/gr2/THUMBNAIL/image/gif/9d0a4bc938b84749d3a076187523f4b4/gr2.sml gr2 gr2.sml sml 3148 136 219 IMAGE-THUMBNAIL 1-s2.0-S138111691200091X-gr2_lrg.jpg https://s3.amazonaws.com/prod-ucs-content-store-us-east/content/pii:S138111691200091X/gr2/HIGHRES/image/jpeg/93bd68cde48e18f886c906708c24a07e/gr2_lrg.jpg https://s3-eu-west-1.amazonaws.com/prod-ucs-content-store-eu-west/content/pii:S138111691200091X/gr2/HIGHRES/image/jpeg/93bd68cde48e18f886c906708c24a07e/gr2_lrg.jpg gr2 gr2_lrg.jpg jpg 141146 1078 1742 IMAGE-HIGH-RES 1-s2.0-S138111691200091X-gr3.jpg https://s3.amazonaws.com/prod-ucs-content-store-us-east/content/pii:S138111691200091X/gr3/DOWNSAMPLED/image/jpeg/a7b23f42b8c02856ed02ac6d019547fc/gr3.jpg https://s3-eu-west-1.amazonaws.com/prod-ucs-content-store-eu-west/content/pii:S138111691200091X/gr3/DOWNSAMPLED/image/jpeg/a7b23f42b8c02856ed02ac6d019547fc/gr3.jpg gr3 gr3.jpg jpg 59553 219 602 IMAGE-DOWNSAMPLED 1-s2.0-S138111691200091X-gr3.sml https://s3.amazonaws.com/prod-ucs-content-store-us-east/content/pii:S138111691200091X/gr3/THUMBNAIL/image/gif/c1cdb4bfec5428761b6e2d68abb5d95f/gr3.sml https://s3-eu-west-1.amazonaws.com/prod-ucs-content-store-eu-west/content/pii:S138111691200091X/gr3/THUMBNAIL/image/gif/c1cdb4bfec5428761b6e2d68abb5d95f/gr3.sml gr3 gr3.sml sml 7640 80 219 IMAGE-THUMBNAIL 1-s2.0-S138111691200091X-gr3_lrg.jpg https://s3.amazonaws.com/prod-ucs-content-store-us-east/content/pii:S138111691200091X/gr3/HIGHRES/image/jpeg/496975ef6b300b6faf9da75dff3f62cb/gr3_lrg.jpg https://s3-eu-west-1.amazonaws.com/prod-ucs-content-store-eu-west/content/pii:S138111691200091X/gr3/HIGHRES/image/jpeg/496975ef6b300b6faf9da75dff3f62cb/gr3_lrg.jpg gr3 gr3_lrg.jpg jpg 819751 969 2667 IMAGE-HIGH-RES 1-s2.0-S138111691200091X-gr4.jpg https://s3.amazonaws.com/prod-ucs-content-store-us-east/content/pii:S138111691200091X/gr4/DOWNSAMPLED/image/jpeg/4e626b9fc6305b2d193098171bdc8838/gr4.jpg https://s3-eu-west-1.amazonaws.com/prod-ucs-content-store-eu-west/content/pii:S138111691200091X/gr4/DOWNSAMPLED/image/jpeg/4e626b9fc6305b2d193098171bdc8838/gr4.jpg gr4 gr4.jpg jpg 44645 257 602 IMAGE-DOWNSAMPLED 1-s2.0-S138111691200091X-gr4.sml https://s3.amazonaws.com/prod-ucs-content-store-us-east/content/pii:S138111691200091X/gr4/THUMBNAIL/image/gif/5066e7500ac85836e8e441541428ca27/gr4.sml https://s3-eu-west-1.amazonaws.com/prod-ucs-content-store-eu-west/content/pii:S138111691200091X/gr4/THUMBNAIL/image/gif/5066e7500ac85836e8e441541428ca27/gr4.sml gr4 gr4.sml sml 7221 93 219 IMAGE-THUMBNAIL 1-s2.0-S138111691200091X-gr4_lrg.jpg https://s3.amazonaws.com/prod-ucs-content-store-us-east/content/pii:S138111691200091X/gr4/HIGHRES/image/jpeg/aa4269fbfb39d6330e90fc07a06276b9/gr4_lrg.jpg https://s3-eu-west-1.amazonaws.com/prod-ucs-content-store-eu-west/content/pii:S138111691200091X/gr4/HIGHRES/image/jpeg/aa4269fbfb39d6330e90fc07a06276b9/gr4_lrg.jpg gr4 gr4_lrg.jpg jpg 184034 682 1600 IMAGE-HIGH-RES 1-s2.0-S138111691200091X-gr5.jpg https://s3.amazonaws.com/prod-ucs-content-store-us-east/content/pii:S138111691200091X/gr5/DOWNSAMPLED/image/jpeg/bcf78c12032f1edf4d572d264dd3f4de/gr5.jpg https://s3-eu-west-1.amazonaws.com/prod-ucs-content-store-eu-west/content/pii:S138111691200091X/gr5/DOWNSAMPLED/image/jpeg/bcf78c12032f1edf4d572d264dd3f4de/gr5.jpg gr5 gr5.jpg jpg 23777 250 296 IMAGE-DOWNSAMPLED 1-s2.0-S138111691200091X-gr5.sml https://s3.amazonaws.com/prod-ucs-content-store-us-east/content/pii:S138111691200091X/gr5/THUMBNAIL/image/gif/b672f4cf575a92f68afc70df477ff026/gr5.sml https://s3-eu-west-1.amazonaws.com/prod-ucs-content-store-eu-west/content/pii:S138111691200091X/gr5/THUMBNAIL/image/gif/b672f4cf575a92f68afc70df477ff026/gr5.sml gr5 gr5.sml sml 3590 164 194 IMAGE-THUMBNAIL 1-s2.0-S138111691200091X-gr5_lrg.jpg https://s3.amazonaws.com/prod-ucs-content-store-us-east/content/pii:S138111691200091X/gr5/HIGHRES/image/jpeg/66b523683ab5587e9562d0ba3517856b/gr5_lrg.jpg https://s3-eu-west-1.amazonaws.com/prod-ucs-content-store-eu-west/content/pii:S138111691200091X/gr5/HIGHRES/image/jpeg/66b523683ab5587e9562d0ba3517856b/gr5_lrg.jpg gr5 gr5_lrg.jpg jpg 122423 1112 1314 IMAGE-HIGH-RES 1-s2.0-S138111691200091X-gr6.jpg https://s3.amazonaws.com/prod-ucs-content-store-us-east/content/pii:S138111691200091X/gr6/DOWNSAMPLED/image/jpeg/d424b0e607e9e87518ac3c709a941876/gr6.jpg https://s3-eu-west-1.amazonaws.com/prod-ucs-content-store-eu-west/content/pii:S138111691200091X/gr6/DOWNSAMPLED/image/jpeg/d424b0e607e9e87518ac3c709a941876/gr6.jpg gr6 gr6.jpg jpg 34338 437 320 IMAGE-DOWNSAMPLED 1-s2.0-S138111691200091X-gr6.sml https://s3.amazonaws.com/prod-ucs-content-store-us-east/content/pii:S138111691200091X/gr6/THUMBNAIL/image/gif/cf581e917c04e6a67036a5e7a88fe7cf/gr6.sml https://s3-eu-west-1.amazonaws.com/prod-ucs-content-store-eu-west/content/pii:S138111691200091X/gr6/THUMBNAIL/image/gif/cf581e917c04e6a67036a5e7a88fe7cf/gr6.sml gr6 gr6.sml sml 3029 164 120 IMAGE-THUMBNAIL 1-s2.0-S138111691200091X-gr6_lrg.jpg https://s3.amazonaws.com/prod-ucs-content-store-us-east/content/pii:S138111691200091X/gr6/HIGHRES/image/jpeg/578ddfbfe9339ba344952abb0c665774/gr6_lrg.jpg https://s3-eu-west-1.amazonaws.com/prod-ucs-content-store-eu-west/content/pii:S138111691200091X/gr6/HIGHRES/image/jpeg/578ddfbfe9339ba344952abb0c665774/gr6_lrg.jpg gr6 gr6_lrg.jpg jpg 203932 1933 1417 IMAGE-HIGH-RES 1-s2.0-S138111691200091X-fx1.jpg https://s3.amazonaws.com/prod-ucs-content-store-us-east/content/pii:S138111691200091X/fx1/DOWNSAMPLED/image/jpeg/443379b067b76d9e333d296bde14a3b1/fx1.jpg https://s3-eu-west-1.amazonaws.com/prod-ucs-content-store-eu-west/content/pii:S138111691200091X/fx1/DOWNSAMPLED/image/jpeg/443379b067b76d9e333d296bde14a3b1/fx1.jpg fx1 true fx1.jpg jpg 18325 187 500 IMAGE-DOWNSAMPLED 1-s2.0-S138111691200091X-fx1.sml https://s3.amazonaws.com/prod-ucs-content-store-us-east/content/pii:S138111691200091X/fx1/THUMBNAIL/image/gif/c4d06ef4ae4a5912c26afabc8289bdf7/fx1.sml https://s3-eu-west-1.amazonaws.com/prod-ucs-content-store-eu-west/content/pii:S138111691200091X/fx1/THUMBNAIL/image/gif/c4d06ef4ae4a5912c26afabc8289bdf7/fx1.sml fx1 true fx1.sml sml 2412 82 219 IMAGE-THUMBNAIL 1-s2.0-S138111691200091X-fx1_lrg.jpg https://s3.amazonaws.com/prod-ucs-content-store-us-east/content/pii:S138111691200091X/fx1/HIGHRES/image/jpeg/84b0abeedcd9a76479e520f73326c839/fx1_lrg.jpg https://s3-eu-west-1.amazonaws.com/prod-ucs-content-store-eu-west/content/pii:S138111691200091X/fx1/HIGHRES/image/jpeg/84b0abeedcd9a76479e520f73326c839/fx1_lrg.jpg fx1 fx1_lrg.jpg jpg 131801 828 2213 IMAGE-HIGH-RES 1-s2.0-S138111691200091X-fx2.jpg https://s3.amazonaws.com/prod-ucs-content-store-us-east/content/pii:S138111691200091X/fx2/DOWNSAMPLED/image/jpeg/4ea245917276040dda5b1250e2146818/fx2.jpg https://s3-eu-west-1.amazonaws.com/prod-ucs-content-store-eu-west/content/pii:S138111691200091X/fx2/DOWNSAMPLED/image/jpeg/4ea245917276040dda5b1250e2146818/fx2.jpg fx2 fx2.jpg jpg 61389 784 406 IMAGE-DOWNSAMPLED 1-s2.0-S138111691200091X-fx2.sml https://s3.amazonaws.com/prod-ucs-content-store-us-east/content/pii:S138111691200091X/fx2/THUMBNAIL/image/gif/1204800b9cb5156deb5c4fbefd3ee22e/fx2.sml https://s3-eu-west-1.amazonaws.com/prod-ucs-content-store-eu-west/content/pii:S138111691200091X/fx2/THUMBNAIL/image/gif/1204800b9cb5156deb5c4fbefd3ee22e/fx2.sml fx2 fx2.sml sml 2009 164 85 IMAGE-THUMBNAIL 1-s2.0-S138111691200091X-fx2_lrg.jpg https://s3.amazonaws.com/prod-ucs-content-store-us-east/content/pii:S138111691200091X/fx2/HIGHRES/image/jpeg/ba0b6c7733fcb919e01cce04350e1c25/fx2_lrg.jpg https://s3-eu-west-1.amazonaws.com/prod-ucs-content-store-eu-west/content/pii:S138111691200091X/fx2/HIGHRES/image/jpeg/ba0b6c7733fcb919e01cce04350e1c25/fx2_lrg.jpg fx2 fx2_lrg.jpg jpg 435529 3474 1800 IMAGE-HIGH-RES MOLCAA 8389 S1381-1169(12)00091-X 10.1016/j.molcata.2012.03.013 Elsevier B.V. Fig. 1 The basicity of various support materials measured by CO2 adsorption at 303K. Fig. 2 XRD patterns of the (a) Ru/Mg–LaO fresh, (b) Mg–LaO and (c) Ru/Mg–LaO used samples. Fig. 3 Images of (a) fresh and (b) used Ru/Mg–LaO catalyst. SEM images of (a-1) fresh and (b-1) used catalyst. Element mapping of (a-2) and (b-2) Ru, (a-3) and (b-3) La, and (a-4) and (b-4) Mg. Fig. 4 TEM images of the (a) fresh Ru/Mg–LaO and (b) used Ru/Mg–LaO catalysts. Fig. 5 TPR patterns of the (a) fresh and (b) used Ru/Mg–LaO catalyst. Fig. 6 X-ray photoelectron spectra of the (a) Ru 3d5/2 fresh and (b) Ru 3d5/2 used catalysts. Scheme 1 Oxidation of alcohols over Ru/Mg–LaO catalyst. Table 1 Effect of the support on the catalytic properties of ruthenium for the selective oxidation of 1-phenylethanol to acetophenone. a Entry a Catalyst Solvent Yield (%) b 1 MgLaO Toluene n.r. c 2 RuCl3 Toluene n.r. c 3 Ru/MgLaO Toluene 96, 95 d 4 Ru/MgLaO Trifluorotoluene 95 5 Ru/MgLaO DMF 80 6 Ru/SiO2 Toluene 45 7 Ru/Al2O3 Toluene 40 8 Ru/MgO Toluene 36 9 Ru/TiO2 Toluene 22 a Reaction conditions: alcohol (1.0mmol), catalyst (0.1g), toluene (5.0mL), 353K, O2 balloon. b Isolated yield after column chromatography. c Determined by NMR spectroscopic integration. d Yield in fifth cycle. Table 2 Oxidation of various alcohols using molecular oxygen using Ru/Mg–LaO mixed oxide catalyst. a a Reaction: alcohol (1.0mmol), catalyst (0.1g), toluene (5.0mL), 353K, O2 atmosphere, reaction time 4h. bIsolated yield. Table 3 Reusability of the Ru/Mg–LaO catalyst. a Trial Time (h) Yield (%) b 1 4 96 2 4 96 4 95 4 4 95 5 4 95 a Reaction conditions: 1-phenyl ethanol (1mmol), catalyst (0.1g), toluene (5mL), 353K, O2 atmosphere b Isolated yields. Ruthenium/magnesium–lanthanum mixed oxide: An efficient reusable catalyst for oxidation of alcohols by using molecular oxygen M. Lakshmi Kantam a ⁎ R. Sudarshan Reddy a Ujjwal Pal a M. Sudhakar a A. Venugopal a K. Jeeva Ratnam a F. Figueras b Venkat Reddy Chintareddy c Yuta Nishina d a Inorganic and Physical Chemistry Division, Indian Institute of Chemical Technology, Hyderabad 500 607, India b Institut de recherches sur la catalyse et l’environnement, 2 avenue A. Einstein 69626, Villeurbanne Cedex, France c 1311 Gilman Hall, Department of Chemistry, Iowa State University, Ames, IA 50011, USA d Research Core for Interdisciplinary Sciences, Okayama University, Tsushima, Kita-ku, Okayama 700-8530, Japan ⁎ Corresponding author. Tel.: +91 40 2719 3510; fax: +91 40 2716 0921. Graphical abstract An efficient method for the oxidation of benzylic and secondary aromatic alcohols into aldehydes or ketones has been achieved by using ruthenium supported magnesium–lanthanum mixed oxide as a heterogeneous catalyst in toluene, with molecular oxygen as the sole oxidant. Highlights ► Ru/Mg–LaO catalyst shows high efficiency in the oxidation of benzylic and secondary aromatic alcohols. ► The high basicity of Mg–LaO mixed oxide plays an important role as a support for Ru in oxidation of alcohols. ► The catalyst can be used for five cycles with consistent activity and selectivity. An efficient method for the oxidation of benzylic and secondary aromatic alcohols into their corresponding aldehydes or ketones has been achieved by using ruthenium supported magnesium–lanthanum mixed oxide as a heterogeneous catalyst in toluene, with molecular oxygen as the sole oxidant. This catalyst can also be operated in solvent free conditions at 393K and reused for five cycles with consistent yield and selectivity. Keywords Oxidation Alcohols Ru/Mg–LaO mixed oxide Heterogeneous Solvent free 1 Introduction One of the most commonly practiced routes for the synthesis of carbonyl compounds is the oxidation of their corresponding alcohols [1,2]. Several transition metal-based oxidizing reagents have been developed, usually used in stoichiometric amounts, and lead to a large amount of waste. Molecular oxygen is an attractive and environmentally friendly oxidant. In this context, the oxidation of alcohols using molecular oxygen catalyzed by reusable heterogeneous catalysis is ideal from an environmental and atom economical point of view [3–5]. Solutions based on homogeneous catalysis are known [6–8], but heterogeneous processes are considered as more economical since they offer advantages such as ease of recovery and recycling. Most of the heterogeneous catalysts for oxidation reported so far are based on TEMPO supported by polymers or silicas [9–14], Ru [15–18] and Pd [19–25] employing molecular oxygen or air as a stoichiometric oxidant. Previously, we reported an effective method for the oxidation of alcohols using Ni–Al hydrotalcite catalyst with molecular oxygen [26]. Recently, Abad et al. reported an efficient method for the selective aerobic oxidation of alcohols by using Au/CeO2 and Pd/CeO2 [27,28]. Pioneering efforts from Baiker [17], Nishimura [19], Kaneda [20,21], Sheldon [22–24] and Uozumi [25] in aerobic oxidation of alcohols using reusable catalysts in the recent years resulted in great progress in this area. However, the development of a novel catalytic system that exhibits a wide range of substrate tolerance under mild conditions still remains a major challenge. Ruthenium is an attractive and efficient metal in catalyzing organic reactions. Ruthenium physico-chemically deposited on various supports such as hydroxyapatite (HAP) [29] showed a low activity but treatment with basic additives such as proline or prolinol significantly increased its catalytic activity. Recently we reported that ruthenium supported on nanocrystalline magnesium oxide modified by basic ionic liquids (Ru–CHNAP–MgO) was an active and recyclable catalyst whereas ruthenium supported onto pristine nanocrystalline magnesium oxide (Ru–NAP–MgO), though catalytically active was not recyclable as the metal leached into the solution [30]. It can be pointed out that ruthenium was stabilized by modifying the support with base [30]. Matsumoto et al. reported the oxidation of alcohols with polymer incarcerated ruthenium catalyst and TEMPO, in dichloroethane as solvent using oxygen [31]. However, leaching of ruthenium was observed and could be suppressed by treatment with a strong base (NaOH, 0.5N) in the preparation step. Ru/Al2O3 has also been reported to give very good results [32]; however, the preparation of the catalyst included an additional step of hydrolysis of the adsorbed RuCl3 precursor at pH=13.2 by 1M NaOH for 24h, which is believed to increase the basicity of the support and stabilize Ru. It has been demonstrated that ruthenates are active species for this reaction [33]. In oxidizing atmosphere Ru is easily oxidized, probably to ruthenate species. These species being anionic are unstable on cation exchangers (solid acids) but are stabilized by solid bases. In such a case, the nature of the support should be important for determining its activity and recyclability. Indeed Ru/MCM-41 has been reported to be a selective catalyst for the oxidation of alcohols, but it has to be modified by anchored quaternary ammonium species to make it recyclable [34]. Mg–La mixed oxides have received much attention as basic catalysts and support materials. Recently, we efficiently carried out transesterification of diethyl carbonate by alcohols [35]. Michael addition reactions [36], aldol type reaction of aldehydes and imines with ethyl diazoacetate by using this highly basic Mg–La mixed oxide catalyst under recyclable conditions [37]. We have also used the Mg–La mixed oxide as a support for palladium catalyzed cross-coupling reactions [38,39]. This highly basic magnesium lanthanum mixed oxide was found to promote the activity of palladium. In this work, we report the oxidation of benzylic and secondary aromatic alcohols under heterogeneous conditions to aldehydes or ketones by O2 or air in the liquid phase with a high efficiency using Ru/Mg–La mixed oxide catalyst at 353K in toluene as solvent, or at 393K without solvent. The catalyst was characterized by DSC, powder XRD, BET surface area, TEM, TPR, SEM-EDX, TPD of CO2 and XPS analyses. 2 Experimental 2.1 Materials and methods All solvents used in the catalytic test were of analytical grade and were used as received from Merck India Pvt. Ltd. High purity oxygen was used in the oxidation of alcohols. Purification of reaction products was carried out by flash chromatography using 100–200 mesh silica gel, and a mixture of ethyl acetate and petroleum ether as the eluting agent. All the products were characterized by 1H-NMR spectroscopy. The 1H spectra of samples were recorded on a Gemini 200MHz, and/or a Bruker-Avance-300MHz Spectrometer using TMS as an internal standard in CDCl3. X-ray photoelectron spectra were recorded on a KRATOS AXIS 165 with a dual anode (Mg and Al) apparatus using the Mg Kα anode. The pressure in the spectrometer was about 10−9 Torr. For energy calibration, we used the carbon 1s photoelectron line. The carbon 1s binding energy was taken to be 284.6eV. Spectra were deconvoluted using the Sun Solaris based Vision 2 curve resolver. The location and the full width at half maximum (FWHM) for a species were first determined using the spectrum of a pure sample. The location and FWHM of the products, which were not obtained as pure species, were adjusted until the best fit was obtained. Symmetric Gaussian shapes were used in all cases. Binding energies for identical samples were, in general, reproducible within ±0.1eV. The TPR profile was recorded on Micromeritics (Auto Chem 2910) using 0.05g of catalyst sample. In a typical method the catalyst was loaded in an isothermal zone of a quartz reactor (i.d=6mm, length=300mm) heated by an electric furnace at a rate of 10°C/min to 300°C/min in flowing helium gas at a rate of 30cm3/min, which facilitates desorption of the physically adsorbed water. After degassing, the sample was cooled to room temperature and the helium gas was switched to 36cm3/min reducing gas of 5% H2 in argon and the temperature was increased to 725°C at a ramping rate of 10°C/min. Hydrogen consumption was measured by analyzing effluent gas by means of thermal conductivity detector. The consumption of hydrogen was calibrated measuring the TPR of Ag2O (20mg), with the same protocol. The XRD patterns of Mg–LaO and Ru/Mg–LaO samples were obtained on a Rigaku miniflex X-ray diffractometer using Ni filtered Cu Kα radiation (λ =0.15406nm) from 2θ =2–80°, at a scan rate of 2°/min, with the beam voltage and a beam current of 30kV and 15mA, respectively. The basicity of the support was investigated by calorimetry [40], using CO2 adsorption at 303K and samples activated in vacuum at 723K. The instrument is a Tian–Calvet calorimeter. CO2 is an acidic probe, which has been commonly used to measure basicity [41,42]. The heat of adsorption measures the strength of the interaction with basic sites and therefore the basic strength as a function of coverage. The TPD of CO2 of Ru/Mg–LaO fresh and used samples are measured using an Auto Chem 2910 (Micromeritics, USA). In a typical method about 0.1g of sample is reduced at 400°C for 5h in hydrogen at a flow rate of 30mLmin−1. After reductive pre-treatment the sample is saturated with 9.9% CO2 (balance helium) at 60°C, at a flow rate of 50mLmin−1 and subsequently flushed with helium gas at 60°C for 1h. The TPD measurements are carried out from 60°C to 700°C at a ramping rate of 10°C/min. The amount of desorbed CO2 is calculated using GRAMS/32 software. GC analysis was done by GC-2010, gas chromatograph Shimadzu, with ZB5 capillary column, internal diameter 0.53mm, film thickness 1.50μm, length 30m, initial temperature 70°C (hold 2min), ramp 7°C/min→279°C (hold 7min), injection temperature 250°C, and detector temperature 280°C (FID). For the transmission electron microscope (TEM) analysis, samples were dispersed in methanol solution and dropped on a 200-mesh Cu grid, and images were taken using JEOL JEM 2100F high-resolution transmission electron microscope at an acceleration voltage of 200kV. For scanning electron microscopy (SEM) and the energy dispersive X-ray spectroscopy (EDX) analysis, samples were fixed on carbon tape and images were taken using JEOL JSM-6700FE. 2.2 Preparation of catalyst The magnesium-lanthanum mixed oxide was prepared by the co-precipitation method described earlier. It was calcined at 923K in air [35,36]. The powder XRD pattern of the Ru/Mg–LaO calcined mixed oxide showed the diffraction lines of a lanthanum oxide carbonate and lanthanum hydroxides with parameters corresponding to those reported in the literature. This biphasic solid probably consists of a layer of lanthanum oxide deposited on magnesia. This mixed oxide has a surface area of 37.6m2 g−1. The calcined sample of Mg–LaO mixed oxide (1.78g) was stirred with RuCl3 (0.415g, 2.67×10−2 M) in 75mL of freshly prepared deionized water at 298K for 24h under nitrogen atmosphere. The catalyst was filtered, washed with deionized water, acetone and dried overnight at 383K in an oven. The prepared Ru/Mg–LaO catalyst was grey in colour and from the elemental analysis the Ru content was found to be 1.0mmol/g (Ru content: 10.10wt%). The same procedure was used to prepare Ru supported on γ-alumina [Harshaw, 224m2 g−1], silica [Aldrich, 500m2 g−1], and titania [Aldrich P25 Anatase, 50m2 g−1] magnesia [NAP–MgO with a specific surface area (BET)≥600m2 g−1 was purchased from “Nano Scale Corp., Manhattan, KS, USA.” It was then calcined at 450°C for four hours in air. The BET surface area obtained was 183m2 g−1 catalysts. 2.3 General procedure for the oxidation of alcohols An oven dried 50mL two-necked round bottomed flask equipped with a reflux condenser connected with a balloon filled with oxygen was charged with Ru/Mg–LaO catalyst (0.102g), alcohol (1.0mmol) and toluene (5.0mL). The resulting mixture was stirred at 353K. After completion of the reaction (as monitored by TLC and GC), the reaction mixture was centrifuged to separate the solid catalyst. The catalyst was washed with toluene (2×20mL) for complete recovery of the organic materials. In case of recycling studies, the catalyst was washed with deionized water and dried prior to the reusability experiments. The combined filtrate was dried over anhydrous Na2SO4 and the solvent was removed under reduced pressure. The crude product was purified by column chromatography (silica gel: 100–200 mesh using ethyl acetate and petroleum ether) to give the corresponding aldehyde or ketone. For the solvent free oxidation of benzyl alcohol, a dry 100mL three-neck round bottomed flask, equipped with a reflux condenser was charged with Ru/Mg–LaO catalyst (0.490g) and freshly distilled benzyl alcohol (1.08g, 10mmol). The resulting mixture was stirred at 393K under one atmosphere of oxygen. Conversion and selectivity were determined by GC using undecane as external standard. The combined organic layers were dried using anhydrous Na2SO4, filtered. The distillation of the residue gave pure benzaldehyde (75% yield). 3 Results and discussion 3.1 Catalyst characterization The Ru/Mg–LaO catalyst was characterized by powder XRD, TPR, XPS and SEM–EDX in order to determine the nature of the ruthenium dispersed on the solid. The support was characterized by calorimetry in order to determine the basicity. The results are reported in Fig. 1 , in which a nano MgO sample of high surface area (183m2 g−1), TiO2 (50m2 g−1), SiO2 (500m2 g−1) and γ-alumina (224m2 g−1) surface areas are added as reference. It appears clearly that the mixed oxide shows a higher basic strength than MgO. The CO2 uptakes of the fresh and used form of Ru/Mg–LaO are carried out by TPD of CO2 in order to measure the basicity of the samples. The CO2 uptakes of the fresh and used catalysts are found to be 240 and 214μmol/g respectively. The XRD diffractogram (Fig. 2a) of Ru/Mg–LaO fresh is similar to that of the support Mg–LaO (Fig. 2b) and used (Fig. 2c) samples, and it can then be concluded that the Ru oxide is dispersed as small particles. This high dispersion of Ru is confirmed by the examination of scanning electron microscopy–energy dispersive X-ray spectroscopy (SEM–EDX) (Fig. 3 ). The ratio of Ru:Mg:La did not change dramatically before and after the reaction (before, 21.75:55.48:22.77, used, 21.49:60.33:18.18, respectively). Fig. 4 shows the TEM micrographs of the fresh and used 10%Ru/Mg–LaO catalysts. It can be seen that the particles are almost spherical shape with a mean diameter of 15 and 30nm for fresh and used catalysts respectively. Although some aggregation was observed in the used catalyst, it did not affect the product yield. The oxidation state of Ru was investigated by two methods: TPR and XPS. The TPR profiles of the fresh and used Ru/Mg–LaO catalysts, reported in Fig. 5 shows one large peak at about 550K, with a shoulder at 750K. The high temperature peak at about 750K, linked to a very stable Ru species, is assigned to the oxychloride, and the low temperature peak to Ru cations well dispersed at the surface [41,43]. The peak at about 550K has been assigned due to the reduction of RuO2. The integration of the area under the peaks in the interval 400–900K, coupled with the calibration of the hydrogen consumption, permits to determine the number of H atoms required for the reduction of Ru. This determination gives a ratio H/Ru=3.86, corresponding to the reduction of a mixture of 80% Ru4+ and 20% Ru3+. In the XPS spectrum, the comparison of the surfaces of Ru 3d peaks at 285eV with that of the 2p Cl peak at 199eV gives a Ru/Cl atomic ratio of 61/38; using the Ru 3p line at 466eV, a similar result is obtained with Ru/Cl=63/36. It can then be concluded that drying the solid at oven temperature induces hydrolysis of RuCl bonds with formation of oxides. The strong basicity of the mixed oxides has induced the same effect as that of by NaOH treatment. It has been however known that chlorine is not completely eliminated from Ru supported on alumina [40] or silica [41,42] after calcination or even after calcination followed by reduction. The retention of Cl was attributed to the formation of an oxychloride, which should be present here in rather small amounts. This oxychloride can be responsible for the high temperature shoulder appeared in the TPR curve. The deconvolution of the XPS lines of Ru 3d level (for fresh and used Ru/Mg-LaO mixed oxide catalysts) is reported in Fig. 6 . It is observed that both fresh and used catalysts show common features, indicating that there is no change in the surface structure of the fresh catalyst after the reaction. These spectra contain three lines attributed to C; the one at 284.6 and 286.8eV are due to pollution carbon, and a smaller peak at 289eV can be attributed to carbonates adsorbed at the basic sites of the support. Due to spin–orbit interactions, the transition corresponding to Ru is composed of two doublets [44], the relative weight of which are 60% for Ru 3d5/2 at 283.06eV attributed to Ru3+ and 40% for Ru 3d3/2 at 284.2eV ascribed to Ru4+ [45–48] (Fig. 6). This XPS analysis therefore confirms that Ru could exist as RuO2 at the surface. 3.2 Catalytic activity of Ru/Mg–LaO for oxidation of alcohols The oxidation of various alcohols in oxygen atmosphere on different supported Ru catalysts has been performed with the non-reduced catalyst at 353K (Scheme 1 ) and the results are reported in Table 1 . As can be seen from Table 1, Ru supported on acidic silica or on weak solid bases such as Al2O3, MgO and TiO2 afforded low yields reaching 45%, 40%, 36% and 22% yields after 4h (Table 1, entries 6–9). It can be pointed out that RuCl3 has not suffered here any treatment with NaOH, so that the low basicity of alumina is retained, and this puts in evidence the strong effect of this treatment. The best result was obtained with the catalyst Ru/Mg–LaO (96%, Table 1, entry 3). The efficiency and stability of this newly established catalytic system was examined in detail with 1-phenylethanol as substrate. Oxidation proceeds to completion giving excellent isolated yields through five successive cycles (Table 1, entry 3). The particularity of Mg–LaO is tentatively attributed to its strong basicity which would stabilize Ru as ruthenates at the surface of the solid. The activity pattern of Ru/Mg–LaO was investigated on a series of alcohols (Table 2 ). All aromatic secondary alcohols were converted to their corresponding ketones in short reaction times, with nearly quantitative yields (Table 2, entries 1–5 and 9–12). It is worth mentioning here that benzyl alcohol was cleanly converted to benzaldehyde and was obtained in 92% isolated yield (Table 2, entry 6), which is a significant improvement compared to our previous protocol which involved the use Ni–Al hydrotalcite wherein only 36% yield was obtained [26]. Substituted benzyl alcohols also afforded the corresponding aldehyde product in good yields (Table 2, entries 7 and 8). We were also pleased to find that nitrogen containing heterocyclic alcohol, i.e. 1-(pyridin-2-yl) ethanol could be selectively oxidized to its corresponding ketone in good yields (Table 2, entry 11). These results encouraged us to evaluate the oxidation of long chain aliphatic alcohols such as1-hexanol, 1-heptanol, 1-octanol and 1-nonanol under similar reaction conditions and also at high temperatures but unfortunately no catalytic activity was observed in these cases. The oxidation reaction was also conducted under solvent free conditions taking benzyl alcohol as the substrate. The results show only 75% of conversion with 69% yield of benzaldehyde at 393K, analyzed by GC using undecane as an external standard. This lower conversion, compared to the diluted system, was attributed to the production of water by the reaction, leading to an inhibition of the reaction rate. The solvent free reaction was then performed at 393K, giving a high conversion (>99), attributed to desorption of the water at this temperature. The best catalyst reported so far for this type of reaction is Au/CeO2 [27,28], which consists small particles of metallic gold of about 4–5nm in size, deposited on ceria of high surface area. The active sites, identified to Au3+ cations, are supposed to be localized at the interface of ceria and gold. In solvent free conditions Corma and co-workers observed esters during the oxidation of 1-phenylethanol over Au/CeO2. On Ru/Mg–La mixed oxide this substrate produced selectively ketone (Table 2, entry 1). The described methodology illustrates a very simple oxidation procedure, using a simple catalyst preparation. This solid consisting of Ru exchanged on to the Mg–LaO support is believed to sustain at high temperatures if required. The effect of the organic solvents on the oxidation was examined, where toluene and trifluorotoluene gave high yields. For safety and environmental reasons, we routinely made the reactions with toluene, but as demonstrated the solvent can be omitted. We have conducted the hot filtration experiment for leaching studies. After 1h, the catalyst was filtered out of the reaction mixture; the filtrate was stirred under the same reaction conditions for 3h. No propagation of the reaction was observed by GC analysis. The catalyst Ru/Mg–LaO was reused four times with consistent activity under the same reaction conditions without any detectable metal leaching (Table 3 ). There is no reaction with the filtrate, when a fresh amount of the reactant was added. 4 Conclusions In conclusion, mild and efficient green oxidation of various benzylic and secondary aromatic alcohols to aldehydes or ketones can be obtained by using Ru supported on a strong basic Mg–La mixed oxide and molecular oxygen as an oxidant. The catalyst can be used for five cycles with consistent activity and selectivity. Acknowledgements R.S. Reddy, U. Pal and M. Sudhakar thank the Council of Scientific and Industrial Research, New Delhi, for their research fellowships. We also thank P. Delichère for the analysis of the XPS spectrum (IRCE Lyon, France). This research has been performed as part of the Indo-French “Joint Laboratory for Sustainable Chemistry at Interfaces”. We thank CNRS, MESR, French Ministry for foreign affairs and CSIR for support of this research. MLK thanks DST-JSPS for the exploratory visit to Okayama University, Japan as part of India–Japan Cooperative Science Program (IJCSP). Appendix A Supplementary data Supplementary data associated with this article can be found, in the online version, at doi:10.1016/j.molcata.2012.03.013. Appendix A Supplementary data References [1] C.L. Hill Advances in Oxygenated Processes vol. 1 1988 JAI Press London p. 030 [2] M. Hundlucky Oxidations in Organic Chemistry 5th ed. 1990 American Chemical Society Washington, DC [3] R.A. Sheldon I.W.C.E. Arends G.J. ten Brink A. Dijksman Acc. Chem. Res. 35 2002 774 781 [4] T. Mallat A. Baiker Chem. Rev. 104 2004 3037 3058 [5] T. Matsumoto M. Ueno N. Wang S. Kobayashi Chem. Asian J. 3 2008 196 214 [6] C. Bilgrien S. Davis R.S. Drago J. Am. Chem. Soc. 109 1987 3786 3787 [7] S.I. Murahashi T. Naota N. Hirai J. Org.Chem. 58 1993 7318 7319 [8] I.E. Marko P.R. Giles M. Tsukazaki I.C. Regnaut C.J. Urch S.M. Brown J. Am. Chem. Soc. 119 1997 12661 12662 [9] A. Dijksman M. Marino-Gonzalez A.M. Payeras W.C.E.I. Sheldon R.A. Arends J. Am. Chem. Soc. 123 2001 6826 6833 [10] G. Csjernyik A.H. Eall L. Fadini B. Pugin J.E. Backvall J. Org. Chem. 67 2002 1657 1662 [11] A. Heeres H.A.V. Doren K. Gotlieb I.P. Bleeker Carbohydr. Res. 299 1997 221 227 [12] R.A. Sheldon I.W.C.E. Arends J. Mol. Catal. A: Chem. 251 2006 200 214 [13] H. Kochkar L. Lassalle M. Holderich W.F. Morawietz J. Catal. 194 2000 343 351 [14] D. Brunel F. Fajula J.B. Nagy B. Deroide M. Verhoef J.L. Veum J.A. Peters H.V. Bekkum Appl. Catal. A: Gen. 213 2001 73 82 [15] M. Matsumoto N. Watanabe J. Org. Chem. 49 1984 3435 3436 [16] K. Yamaguchi K. Mori T. Mizugaki K. Ebitani K. Kaneda J. Am. Chem. Soc. 122 2000 7144 7145 [17] Z. Opre D. Ferri F. Krumeich T. Mallat A. Baiker J. Catal. 251 2007 48 58 [18] X. Fu H. Yu F. Peng H. Wang Y. Qian Appl. Catal. A: Gen. 321 2007 190 197 [19] T. Nishimura N. Kakiuchi M. Inoue S. Uemura Chem. Commun. 2000 1245 1246 [20] K. Mori K. Yamaguchi T. Hara T. Mizugaki K. Ebitani K. Kaneda J. Am. Chem. Soc. 124 2002 11572 11573 [21] K. Mori T. Hara T. Mizugaki K. Ebitani K. Kaneda J. Am. Chem. Soc. 126 2004 10657 10666 [22] G.J. tenBrink I.W.C.E. Arends R.A. Sheldon Science 287 2000 636 1639 [23] G.J. ten Brink I.W.C.E. Arends M. Hoogenraad G. Verspui R.A. Sheldon Adv. Synth. Catal. 345 2003 1341 1352 [24] G.J. ten Brink I.W.C.E. Arends M. Hoogenraad G. Verspui R.A. Sheldon Adv. Synth. Catal. 345 2003 497 505 [25] Y.M.A. Yamada T. Arakawa H. Hocke Y. Uozumi Angew. Chem. Int. Ed. 46 2007 704 706 [26] B.M. Choudary M. Lakshmi Kantam A. Rahman Ch. Venkat Reddy K.K. Rao Angew. Chem. Int. Ed. 40 2001 763 766 [27] A. Abad C. Almela A. Corma H. Garcia Tetrahedron 62 2006 6666 6672 [28] A. Abad P. Concepcion A. Corma H. Garcia Angew. Chem. Int. Ed. 44 2005 4066 4069 [29] Z. Opre D. Ferri F. Krumeich T. Mallat A. Baiker J. Catal. 241 2006 287 295 [30] M. Lakshmi Kantam U. Pal B.M. Choudary S. Bharghava Adv. Synth. Catal. 350 2008 1225 1229 [31] T. Matsumoto M. Ueno J. Kobayashi H. Miyamura Y. Mori S. Kobayashi Adv. Synth. Catal. 349 2007 531 534 [32] K. Yamaguchi N. Mizuno Angew. Chem. Int. Ed. 41 2002 4538 4542 [33] B. Hinzen S.V. Ley J. Chem. Soc. Perkin Trans. 1 1997 1907 1908 [34] A. Bleloch B.F.G. Johnson S.V. Ley A.J. Price D.S. Shephard A.W. Thomas Chem. Commun. 1999 1907 1908 [35] B. Veldurthy F. Figueras Chem. Commun. 6 2004 734 735 [36] B. Veldurthy J.M. Clacens F. Figueras Adv. Synth. Catal. 347 2005 767 771 [37] M. Lakshmi Kantam V. Balasubramanyam K.B.S. Kumar G.T. Venkanna F. Figueras Adv. Synth. Catal. 349 2007 1887 1890 [38] A. Cwik Z. Hell F. Figueras Adv. Synth. Catal. 348 2006 523 530 [39] A. Cwik Z. Hell F. Figueras Org. Biomol. Chem. 3 2005 4307 4309 [40] P.C. Gravelle Adv. Catal. 72 1972 191 263 [41] A. Auroux A. Gervasini J. Phys. Chem. 94 1990 6371 6379 [42] E.J. Doskocil S.V. Bordawekar R.J. Davis J. Catal. 169 1997 327 337 [43] P. Betancourt A. Rives R. Hubaut C.E. Scott J. Goldwasser Appl. Catal. A: Gen. 170 1998 307 314 [44] A. Bossi F. Garbassi A. Orlandi G. Petrini L. Zanderighi Stud. Surf. Sci. Catal. 3 1978 405 [45] S. Murata K.I. Aika J. Catal. 136 1992 118 125 [46] Z. Opre J.D. Grunwaldt M. Maciejewski D. Ferri T. Mallat A. Baiker J. Catal. 230 2005 406 419 [47] J.P.G. Koopman A.P.G. Kieboom H.V. Bekkum J. Catal. 69 1981 172 179 [48] H.Y.H. Chan C.G. Takoudis M.J. Weaver J. Catal. 172 1997 336 345",
      "scopus-id": "84860833414",
      "coredata": {
        "eid": "1-s2.0-S138111691200091X",
        "dc:description": "An efficient method for the oxidation of benzylic and secondary aromatic alcohols into their corresponding aldehydes or ketones has been achieved by using ruthenium supported magnesium–lanthanum mixed oxide as a heterogeneous catalyst in toluene, with molecular oxygen as the sole oxidant. This catalyst can also be operated in solvent free conditions at 393K and reused for five cycles with consistent yield and selectivity.",
        "openArchiveArticle": "false",
        "prism:coverDate": "2012-07-31",
        "openaccessUserLicense": null,
        "prism:aggregationType": "Journal",
        "prism:url": "https://api.elsevier.com/content/article/pii/S138111691200091X",
        "dc:creator": [
          {
            "@_fa": "true",
            "$": "Kantam, M. Lakshmi"
          },
          {
            "@_fa": "true",
            "$": "Reddy, R. Sudarshan"
          },
          {
            "@_fa": "true",
            "$": "Pal, Ujjwal"
          },
          {
            "@_fa": "true",
            "$": "Sudhakar, M."
          },
          {
            "@_fa": "true",
            "$": "Venugopal, A."
          },
          {
            "@_fa": "true",
            "$": "Ratnam, K. Jeeva"
          },
          {
            "@_fa": "true",
            "$": "Figueras, F."
          },
          {
            "@_fa": "true",
            "$": "Chintareddy, Venkat Reddy"
          },
          {
            "@_fa": "true",
            "$": "Nishina, Yuta"
          }
        ],
        "link": [
          {
            "@_fa": "true",
            "@rel": "self",
            "@href": "https://api.elsevier.com/content/article/pii/S138111691200091X"
          },
          {
            "@_fa": "true",
            "@rel": "scidir",
            "@href": "https://www.sciencedirect.com/science/article/pii/S138111691200091X"
          }
        ],
        "dc:format": "application/json",
        "openaccessType": null,
        "pii": "S1381-1169(12)00091-X",
        "prism:volume": "359",
        "prism:publisher": "Elsevier B.V.",
        "dc:title": "Ruthenium/magnesium–lanthanum mixed oxide: An efficient reusable catalyst for oxidation of alcohols by using molecular oxygen",
        "prism:copyright": "Copyright © 2012 Elsevier B.V. All rights reserved.",
        "openaccess": "0",
        "prism:issn": "13811169",
        "dcterms:subject": [
          {
            "@_fa": "true",
            "$": "Oxidation"
          },
          {
            "@_fa": "true",
            "$": "Alcohols"
          },
          {
            "@_fa": "true",
            "$": "Ru/Mg–LaO mixed oxide"
          },
          {
            "@_fa": "true",
            "$": "Heterogeneous"
          },
          {
            "@_fa": "true",
            "$": "Solvent free"
          }
        ],
        "openaccessArticle": "false",
        "prism:publicationName": "Journal of Molecular Catalysis A: Chemical",
        "openaccessSponsorType": null,
        "prism:pageRange": "1-7",
        "prism:endingPage": "7",
        "pubType": "fla",
        "prism:coverDisplayDate": "July 2012",
        "prism:doi": "10.1016/j.molcata.2012.03.013",
        "prism:startingPage": "1",
        "dc:identifier": "doi:10.1016/j.molcata.2012.03.013",
        "openaccessSponsorName": null
      },
      "objects": {
        "object": [
          {
            "@category": "standard",
            "@_fa": "true",
            "$": "https://api.elsevier.com/content/object/eid/1-s2.0-S138111691200091X-mmc1.doc?httpAccept=%2A%2F%2A",
            "@multimediatype": "Microsoft Word file",
            "@type": "APPLICATION",
            "@size": "790528",
            "@ref": "mmc1",
            "@mimetype": "application/word"
          },
          {
            "@category": "standard",
            "@height": "105",
            "@width": "356",
            "@_fa": "true",
            "$": "https://api.elsevier.com/content/object/eid/1-s2.0-S138111691200091X-sc1.jpg?httpAccept=%2A%2F%2A",
            "@multimediatype": "JPEG image file",
            "@type": "IMAGE-DOWNSAMPLED",
            "@size": "16868",
            "@ref": "sc1",
            "@mimetype": "image/jpeg"
          },
          {
            "@category": "thumbnail",
            "@height": "65",
            "@width": "219",
            "@_fa": "true",
            "$": "https://api.elsevier.com/content/object/eid/1-s2.0-S138111691200091X-sc1.sml?httpAccept=%2A%2F%2A",
            "@multimediatype": "GIF image file",
            "@type": "IMAGE-THUMBNAIL",
            "@size": "1852",
            "@ref": "sc1",
            "@mimetype": "image/gif"
          },
          {
            "@category": "high",
            "@height": "466",
            "@width": "1578",
            "@_fa": "true",
            "$": "https://api.elsevier.com/content/object/eid/1-s2.0-S138111691200091X-sc1_lrg.jpg?httpAccept=%2A%2F%2A",
            "@multimediatype": "JPEG image file",
            "@type": "IMAGE-HIGH-RES",
            "@size": "79633",
            "@ref": "sc1",
            "@mimetype": "image/jpeg"
          },
          {
            "@category": "standard",
            "@height": "287",
            "@width": "372",
            "@_fa": "true",
            "$": "https://api.elsevier.com/content/object/eid/1-s2.0-S138111691200091X-gr1.jpg?httpAccept=%2A%2F%2A",
            "@multimediatype": "JPEG image file",
            "@type": "IMAGE-DOWNSAMPLED",
            "@size": "28387",
            "@ref": "gr1",
            "@mimetype": "image/jpeg"
          },
          {
            "@category": "thumbnail",
            "@height": "164",
            "@width": "212",
            "@_fa": "true",
            "$": "https://api.elsevier.com/content/object/eid/1-s2.0-S138111691200091X-gr1.sml?httpAccept=%2A%2F%2A",
            "@multimediatype": "GIF image file",
            "@type": "IMAGE-THUMBNAIL",
            "@size": "3789",
            "@ref": "gr1",
            "@mimetype": "image/gif"
          },
          {
            "@category": "high",
            "@height": "1274",
            "@width": "1650",
            "@_fa": "true",
            "$": "https://api.elsevier.com/content/object/eid/1-s2.0-S138111691200091X-gr1_lrg.jpg?httpAccept=%2A%2F%2A",
            "@multimediatype": "JPEG image file",
            "@type": "IMAGE-HIGH-RES",
            "@size": "177524",
            "@ref": "gr1",
            "@mimetype": "image/jpeg"
          },
          {
            "@category": "standard",
            "@height": "243",
            "@width": "393",
            "@_fa": "true",
            "$": "https://api.elsevier.com/content/object/eid/1-s2.0-S138111691200091X-gr2.jpg?httpAccept=%2A%2F%2A",
            "@multimediatype": "JPEG image file",
            "@type": "IMAGE-DOWNSAMPLED",
            "@size": "25959",
            "@ref": "gr2",
            "@mimetype": "image/jpeg"
          },
          {
            "@category": "thumbnail",
            "@height": "136",
            "@width": "219",
            "@_fa": "true",
            "$": "https://api.elsevier.com/content/object/eid/1-s2.0-S138111691200091X-gr2.sml?httpAccept=%2A%2F%2A",
            "@multimediatype": "GIF image file",
            "@type": "IMAGE-THUMBNAIL",
            "@size": "3148",
            "@ref": "gr2",
            "@mimetype": "image/gif"
          },
          {
            "@category": "high",
            "@height": "1078",
            "@width": "1742",
            "@_fa": "true",
            "$": "https://api.elsevier.com/content/object/eid/1-s2.0-S138111691200091X-gr2_lrg.jpg?httpAccept=%2A%2F%2A",
            "@multimediatype": "JPEG image file",
            "@type": "IMAGE-HIGH-RES",
            "@size": "141146",
            "@ref": "gr2",
            "@mimetype": "image/jpeg"
          },
          {
            "@category": "standard",
            "@height": "219",
            "@width": "602",
            "@_fa": "true",
            "$": "https://api.elsevier.com/content/object/eid/1-s2.0-S138111691200091X-gr3.jpg?httpAccept=%2A%2F%2A",
            "@multimediatype": "JPEG image file",
            "@type": "IMAGE-DOWNSAMPLED",
            "@size": "59553",
            "@ref": "gr3",
            "@mimetype": "image/jpeg"
          },
          {
            "@category": "thumbnail",
            "@height": "80",
            "@width": "219",
            "@_fa": "true",
            "$": "https://api.elsevier.com/content/object/eid/1-s2.0-S138111691200091X-gr3.sml?httpAccept=%2A%2F%2A",
            "@multimediatype": "GIF image file",
            "@type": "IMAGE-THUMBNAIL",
            "@size": "7640",
            "@ref": "gr3",
            "@mimetype": "image/gif"
          },
          {
            "@category": "high",
            "@height": "969",
            "@width": "2667",
            "@_fa": "true",
            "$": "https://api.elsevier.com/content/object/eid/1-s2.0-S138111691200091X-gr3_lrg.jpg?httpAccept=%2A%2F%2A",
            "@multimediatype": "JPEG image file",
            "@type": "IMAGE-HIGH-RES",
            "@size": "819751",
            "@ref": "gr3",
            "@mimetype": "image/jpeg"
          },
          {
            "@category": "standard",
            "@height": "257",
            "@width": "602",
            "@_fa": "true",
            "$": "https://api.elsevier.com/content/object/eid/1-s2.0-S138111691200091X-gr4.jpg?httpAccept=%2A%2F%2A",
            "@multimediatype": "JPEG image file",
            "@type": "IMAGE-DOWNSAMPLED",
            "@size": "44645",
            "@ref": "gr4",
            "@mimetype": "image/jpeg"
          },
          {
            "@category": "thumbnail",
            "@height": "93",
            "@width": "219",
            "@_fa": "true",
            "$": "https://api.elsevier.com/content/object/eid/1-s2.0-S138111691200091X-gr4.sml?httpAccept=%2A%2F%2A",
            "@multimediatype": "GIF image file",
            "@type": "IMAGE-THUMBNAIL",
            "@size": "7221",
            "@ref": "gr4",
            "@mimetype": "image/gif"
          },
          {
            "@category": "high",
            "@height": "682",
            "@width": "1600",
            "@_fa": "true",
            "$": "https://api.elsevier.com/content/object/eid/1-s2.0-S138111691200091X-gr4_lrg.jpg?httpAccept=%2A%2F%2A",
            "@multimediatype": "JPEG image file",
            "@type": "IMAGE-HIGH-RES",
            "@size": "184034",
            "@ref": "gr4",
            "@mimetype": "image/jpeg"
          },
          {
            "@category": "standard",
            "@height": "250",
            "@width": "296",
            "@_fa": "true",
            "$": "https://api.elsevier.com/content/object/eid/1-s2.0-S138111691200091X-gr5.jpg?httpAccept=%2A%2F%2A",
            "@multimediatype": "JPEG image file",
            "@type": "IMAGE-DOWNSAMPLED",
            "@size": "23777",
            "@ref": "gr5",
            "@mimetype": "image/jpeg"
          },
          {
            "@category": "thumbnail",
            "@height": "164",
            "@width": "194",
            "@_fa": "true",
            "$": "https://api.elsevier.com/content/object/eid/1-s2.0-S138111691200091X-gr5.sml?httpAccept=%2A%2F%2A",
            "@multimediatype": "GIF image file",
            "@type": "IMAGE-THUMBNAIL",
            "@size": "3590",
            "@ref": "gr5",
            "@mimetype": "image/gif"
          },
          {
            "@category": "high",
            "@height": "1112",
            "@width": "1314",
            "@_fa": "true",
            "$": "https://api.elsevier.com/content/object/eid/1-s2.0-S138111691200091X-gr5_lrg.jpg?httpAccept=%2A%2F%2A",
            "@multimediatype": "JPEG image file",
            "@type": "IMAGE-HIGH-RES",
            "@size": "122423",
            "@ref": "gr5",
            "@mimetype": "image/jpeg"
          },
          {
            "@category": "standard",
            "@height": "437",
            "@width": "320",
            "@_fa": "true",
            "$": "https://api.elsevier.com/content/object/eid/1-s2.0-S138111691200091X-gr6.jpg?httpAccept=%2A%2F%2A",
            "@multimediatype": "JPEG image file",
            "@type": "IMAGE-DOWNSAMPLED",
            "@size": "34338",
            "@ref": "gr6",
            "@mimetype": "image/jpeg"
          },
          {
            "@category": "thumbnail",
            "@height": "164",
            "@width": "120",
            "@_fa": "true",
            "$": "https://api.elsevier.com/content/object/eid/1-s2.0-S138111691200091X-gr6.sml?httpAccept=%2A%2F%2A",
            "@multimediatype": "GIF image file",
            "@type": "IMAGE-THUMBNAIL",
            "@size": "3029",
            "@ref": "gr6",
            "@mimetype": "image/gif"
          },
          {
            "@category": "high",
            "@height": "1933",
            "@width": "1417",
            "@_fa": "true",
            "$": "https://api.elsevier.com/content/object/eid/1-s2.0-S138111691200091X-gr6_lrg.jpg?httpAccept=%2A%2F%2A",
            "@multimediatype": "JPEG image file",
            "@type": "IMAGE-HIGH-RES",
            "@size": "203932",
            "@ref": "gr6",
            "@mimetype": "image/jpeg"
          },
          {
            "@category": "standard",
            "@height": "187",
            "@width": "500",
            "@_fa": "true",
            "$": "https://api.elsevier.com/content/object/eid/1-s2.0-S138111691200091X-fx1.jpg?httpAccept=%2A%2F%2A",
            "@multimediatype": "JPEG image file",
            "@type": "IMAGE-DOWNSAMPLED",
            "@size": "18325",
            "@ref": "fx1",
            "@mimetype": "image/jpeg"
          },
          {
            "@category": "thumbnail",
            "@height": "82",
            "@width": "219",
            "@_fa": "true",
            "$": "https://api.elsevier.com/content/object/eid/1-s2.0-S138111691200091X-fx1.sml?httpAccept=%2A%2F%2A",
            "@multimediatype": "GIF image file",
            "@type": "IMAGE-THUMBNAIL",
            "@size": "2412",
            "@ref": "fx1",
            "@mimetype": "image/gif"
          },
          {
            "@category": "high",
            "@height": "828",
            "@width": "2213",
            "@_fa": "true",
            "$": "https://api.elsevier.com/content/object/eid/1-s2.0-S138111691200091X-fx1_lrg.jpg?httpAccept=%2A%2F%2A",
            "@multimediatype": "JPEG image file",
            "@type": "IMAGE-HIGH-RES",
            "@size": "131801",
            "@ref": "fx1",
            "@mimetype": "image/jpeg"
          },
          {
            "@category": "standard",
            "@height": "784",
            "@width": "406",
            "@_fa": "true",
            "$": "https://api.elsevier.com/content/object/eid/1-s2.0-S138111691200091X-fx2.jpg?httpAccept=%2A%2F%2A",
            "@multimediatype": "JPEG image file",
            "@type": "IMAGE-DOWNSAMPLED",
            "@size": "61389",
            "@ref": "fx2",
            "@mimetype": "image/jpeg"
          },
          {
            "@category": "thumbnail",
            "@height": "164",
            "@width": "85",
            "@_fa": "true",
            "$": "https://api.elsevier.com/content/object/eid/1-s2.0-S138111691200091X-fx2.sml?httpAccept=%2A%2F%2A",
            "@multimediatype": "GIF image file",
            "@type": "IMAGE-THUMBNAIL",
            "@size": "2009",
            "@ref": "fx2",
            "@mimetype": "image/gif"
          },
          {
            "@category": "high",
            "@height": "3474",
            "@width": "1800",
            "@_fa": "true",
            "$": "https://api.elsevier.com/content/object/eid/1-s2.0-S138111691200091X-fx2_lrg.jpg?httpAccept=%2A%2F%2A",
            "@multimediatype": "JPEG image file",
            "@type": "IMAGE-HIGH-RES",
            "@size": "435529",
            "@ref": "fx2",
            "@mimetype": "image/jpeg"
          }
        ]
      },
      "link": {
        "@rel": "abstract",
        "@href": "https://api.elsevier.com/content/abstract/scopus_id/84860833414"
      }
    }
  }
}