{
  "metadata": {
    "title": "Graphene anchored palladium complex as efficient and recyclable catalyst in the Heck cross-coupling reaction",
    "authors": "; ; ",
    "journal": "Journal of Molecular Catalysis A: Chemical",
    "date": "2016-05-15",
    "doi": "10.1016/j.molcata.2016.02.023",
    "abstract": "",
    "uri": "https://api.elsevier.com/content/article/pii/S1381116916300577",
    "pii": "S1381116916300577"
  },
  "fulltext": {
    "full-text-retrieval-response": {
      "scopus-eid": "2-s2.0-84961653783",
      "originalText": "serial JL 271358 291210 291744 291790 291809 31 Journal of Molecular Catalysis A: Chemical JOURNALMOLECULARCATALYSISACHEMICAL 2016-02-24 2016-02-24 2016-03-09 2016-03-09 2016-07-04T17:09:59 1-s2.0-S1381116916300577 S1381-1169(16)30057-7 S1381116916300577 10.1016/j.molcata.2016.02.023 S300 S300.2 FULL-TEXT 1-s2.0-S1381116916X00039 2025-07-16T16:48:29.225658Z 0 0 20160515 2016 2016-02-24T17:23:11.756862Z absattachment articleinfo articletitlenorm authfirstinitialnorm authfirstsurnamenorm cid cids contenttype copyright crossmark dateloaded dateloadedtxt datesearch datesort dateupdated dco docsubtype doctype doi eid ewtransactionid hubeid indexeddate issn issnnorm itemstage itemtransactionid itemweight openaccess openarchive pg pgfirst pglast pii piinorm pubdatestart pubdatetxt pubyr sectiontitle sortorder srctitle srctitlenorm srctype ssids alllist content subj subheadings suppl tomb volfirst volissue volumelist webpdf webpdfpagecount yearnav figure table e-component body acknowledge affil appendices articletitle auth authfirstini authfull authkeywords authlast grantnumber grantsponsor highlightsabst primabst ref specialabst 1381-1169 13811169 true 416 416 C Volume 416 18 140 146 140 146 20160515 15 May 2016 2016-05-15 2016 Regular Papers article fla Copyright © 2016 Elsevier B.V. All rights reserved. GRAPHENEANCHOREDPALLADIUMCOMPLEXEFFICIENTRECYCLABLECATALYSTINHECKCROSSCOUPLINGREACTION FERNANDEZGARCIA L 1 Introduction 2 Materials and methods 2.1 Materials 2.2 Functionalization route 2.3 Catalytic reactions 2.4 Characterization methods 3 Results and discussion 3.1 Synthesis of the graphenic material 3.2 Decoration of the material with the palladium complex 3.3 Catalytic activity 4 Conclusions Acknowledgments Appendix A Supplementary data References ZAPF 2002 101 109 A GLASNOV 2009 1001 1010 T WITTMANN 2010 1867 1870 S MA 2003 327 336 Z SAVADOGO 2004 105 109 O PAGLIARO 2012 432 445 M FORTMAN 2011 5151 5169 G SEECHURN 2012 5062 5085 C YUAN 2010 4054 4058 B LAMBLIN 2010 33 79 M MEHNERT 1998 12289 12296 C GARCIAMELCHOR 2013 2626 2634 M KLEIN 2010 3446 3449 J CERDENO 2001 817 829 A WANG 2010 315 319 D ROS 2013 15730 15733 A ROUHI 2004 49 A ECHEANDIA 2014 1061 1073 S DANG 2012 1805 1807 T RANGELRANGEL 2015 466 473 E XU 2012 16987 16990 X BENYOUNES 2015 137 144 A MAMANI 2014 48613 48620 L WANG 2015 53935 53939 S BAI 2014 1617 1623 C ZHAO 2015 2609 2616 Q LI 2012 8426 8430 J LIANG 2011 780 786 Y WU 2012 33 37 G CASTRONETO 2009 109 162 A BALADIN 2011 569 581 A AKHAVAN 2010 5731 5736 O SCHAETZ 2012 1267 1284 A SCHEUERMANN 2009 8262 8270 G MALARDS 2009 51 87 L HADAD 2014 885 887 C WEI 2012 14708 14716 G CHEN 2012 14076 14084 C BLANCO 2015 21 31 M YURANOV 2004 760 761 I CUI 2007 9342 9345 X YOO 2009 2255 2259 E PETRUCCI 2015 27 34 C VOLOVYCH 2014 20 221 I LIU 2013 72 82 P MANDAL 2004 3714 3724 S CALO 2004 5154 5158 V KAWANO 2002 2545 2547 T FUJIWARA 1976 1681 1683 Y BOTAS 2013 476 485 C ALVAREZ 2015 160 163 P SHERWOOD 1990 574 P PRACTICALSURFACEANALYSISINAUGERXRAYPHOTOELECTRONSPECTROSCOPY ELGRABLI 2008 20 33 D FERNANDEZGARCIAX2016X140 FERNANDEZGARCIAX2016X140X146 FERNANDEZGARCIAX2016X140XL FERNANDEZGARCIAX2016X140X146XL 2018-03-09T00:00:00Z http://creativecommons.org/licenses/by-nc-nd/4.0/ item S1381-1169(16)30057-7 S1381116916300577 1-s2.0-S1381116916300577 10.1016/j.molcata.2016.02.023 271358 2016-07-04T14:32:21.873736-04:00 2016-05-15 1-s2.0-S1381116916300577-main.pdf https://s3-eu-west-1.amazonaws.com/prod-ucs-content-store-eu-west/content/pii:S1381116916300577/MAIN/application/pdf/a46485e43359e572c352a2f6ef72ff08/main.pdf https://s3.amazonaws.com/prod-ucs-content-store-us-east/content/pii:S1381116916300577/MAIN/application/pdf/a46485e43359e572c352a2f6ef72ff08/main.pdf main.pdf pdf true 1856487 MAIN 7 1-s2.0-S1381116916300577-main_1.png https://s3-eu-west-1.amazonaws.com/prod-ucs-content-store-eu-west/content/pii:S1381116916300577/PREVIEW/image/png/db6d80871ae572d557ef708b275c1030/main_1.png https://s3.amazonaws.com/prod-ucs-content-store-us-east/content/pii:S1381116916300577/PREVIEW/image/png/db6d80871ae572d557ef708b275c1030/main_1.png main_1.png png 57508 849 656 IMAGE-WEB-PDF 1 1-s2.0-S1381116916300577-fx1.sml https://s3-eu-west-1.amazonaws.com/prod-ucs-content-store-eu-west/content/pii:S1381116916300577/fx1/THUMBNAIL/image/gif/25dad2833605675304e9dcf43008e6ca/fx1.sml https://s3.amazonaws.com/prod-ucs-content-store-us-east/content/pii:S1381116916300577/fx1/THUMBNAIL/image/gif/25dad2833605675304e9dcf43008e6ca/fx1.sml fx1 true fx1.sml sml 3789 88 219 IMAGE-THUMBNAIL 1-s2.0-S1381116916300577-fx2.sml https://s3-eu-west-1.amazonaws.com/prod-ucs-content-store-eu-west/content/pii:S1381116916300577/fx2/THUMBNAIL/image/gif/62708717dd8ea9ca981fd46375e1d127/fx2.sml https://s3.amazonaws.com/prod-ucs-content-store-us-east/content/pii:S1381116916300577/fx2/THUMBNAIL/image/gif/62708717dd8ea9ca981fd46375e1d127/fx2.sml fx2 fx2.sml sml 2426 88 219 IMAGE-THUMBNAIL 1-s2.0-S1381116916300577-fx3.sml https://s3-eu-west-1.amazonaws.com/prod-ucs-content-store-eu-west/content/pii:S1381116916300577/fx3/THUMBNAIL/image/gif/3bbbd3ea34a237e73db688762565bc3c/fx3.sml https://s3.amazonaws.com/prod-ucs-content-store-us-east/content/pii:S1381116916300577/fx3/THUMBNAIL/image/gif/3bbbd3ea34a237e73db688762565bc3c/fx3.sml fx3 fx3.sml sml 2104 88 219 IMAGE-THUMBNAIL 1-s2.0-S1381116916300577-fx4.sml https://s3-eu-west-1.amazonaws.com/prod-ucs-content-store-eu-west/content/pii:S1381116916300577/fx4/THUMBNAIL/image/gif/daeb5d652945563af3fe1da56c23f11d/fx4.sml https://s3.amazonaws.com/prod-ucs-content-store-us-east/content/pii:S1381116916300577/fx4/THUMBNAIL/image/gif/daeb5d652945563af3fe1da56c23f11d/fx4.sml fx4 fx4.sml sml 2205 88 219 IMAGE-THUMBNAIL 1-s2.0-S1381116916300577-gr1.sml https://s3-eu-west-1.amazonaws.com/prod-ucs-content-store-eu-west/content/pii:S1381116916300577/gr1/THUMBNAIL/image/gif/860afaf2ed09d090e431bc0f59870266/gr1.sml https://s3.amazonaws.com/prod-ucs-content-store-us-east/content/pii:S1381116916300577/gr1/THUMBNAIL/image/gif/860afaf2ed09d090e431bc0f59870266/gr1.sml gr1 gr1.sml sml 17766 145 219 IMAGE-THUMBNAIL 1-s2.0-S1381116916300577-gr2.sml https://s3-eu-west-1.amazonaws.com/prod-ucs-content-store-eu-west/content/pii:S1381116916300577/gr2/THUMBNAIL/image/gif/3324fc3435354450121c0a838a3f08e3/gr2.sml https://s3.amazonaws.com/prod-ucs-content-store-us-east/content/pii:S1381116916300577/gr2/THUMBNAIL/image/gif/3324fc3435354450121c0a838a3f08e3/gr2.sml gr2 gr2.sml sml 14450 164 121 IMAGE-THUMBNAIL 1-s2.0-S1381116916300577-gr3.sml https://s3-eu-west-1.amazonaws.com/prod-ucs-content-store-eu-west/content/pii:S1381116916300577/gr3/THUMBNAIL/image/gif/cbfae3eaab4d07f8dd1b79a3d053c97f/gr3.sml https://s3.amazonaws.com/prod-ucs-content-store-us-east/content/pii:S1381116916300577/gr3/THUMBNAIL/image/gif/cbfae3eaab4d07f8dd1b79a3d053c97f/gr3.sml gr3 gr3.sml sml 26828 164 164 IMAGE-THUMBNAIL 1-s2.0-S1381116916300577-gr4.sml https://s3-eu-west-1.amazonaws.com/prod-ucs-content-store-eu-west/content/pii:S1381116916300577/gr4/THUMBNAIL/image/gif/db411d20a24d29faa57f099236e0c07e/gr4.sml https://s3.amazonaws.com/prod-ucs-content-store-us-east/content/pii:S1381116916300577/gr4/THUMBNAIL/image/gif/db411d20a24d29faa57f099236e0c07e/gr4.sml gr4 gr4.sml sml 8399 35 219 IMAGE-THUMBNAIL 1-s2.0-S1381116916300577-gr5.sml https://s3-eu-west-1.amazonaws.com/prod-ucs-content-store-eu-west/content/pii:S1381116916300577/gr5/THUMBNAIL/image/gif/69bbcac4373afd944d138b62fd0279d4/gr5.sml https://s3.amazonaws.com/prod-ucs-content-store-us-east/content/pii:S1381116916300577/gr5/THUMBNAIL/image/gif/69bbcac4373afd944d138b62fd0279d4/gr5.sml gr5 gr5.sml sml 13283 145 219 IMAGE-THUMBNAIL 1-s2.0-S1381116916300577-gr6.sml https://s3-eu-west-1.amazonaws.com/prod-ucs-content-store-eu-west/content/pii:S1381116916300577/gr6/THUMBNAIL/image/gif/091e9d360b13251f8a013a9a62a63df7/gr6.sml https://s3.amazonaws.com/prod-ucs-content-store-us-east/content/pii:S1381116916300577/gr6/THUMBNAIL/image/gif/091e9d360b13251f8a013a9a62a63df7/gr6.sml gr6 gr6.sml sml 16214 128 219 IMAGE-THUMBNAIL 1-s2.0-S1381116916300577-gr7.sml https://s3-eu-west-1.amazonaws.com/prod-ucs-content-store-eu-west/content/pii:S1381116916300577/gr7/THUMBNAIL/image/gif/2844e0cc60629705b89b61d32575f05d/gr7.sml https://s3.amazonaws.com/prod-ucs-content-store-us-east/content/pii:S1381116916300577/gr7/THUMBNAIL/image/gif/2844e0cc60629705b89b61d32575f05d/gr7.sml gr7 gr7.sml sml 27121 164 164 IMAGE-THUMBNAIL 1-s2.0-S1381116916300577-fx1.jpg https://s3-eu-west-1.amazonaws.com/prod-ucs-content-store-eu-west/content/pii:S1381116916300577/fx1/DOWNSAMPLED/image/jpeg/8881e245b18bcd8c51f865ec8bc4b285/fx1.jpg https://s3.amazonaws.com/prod-ucs-content-store-us-east/content/pii:S1381116916300577/fx1/DOWNSAMPLED/image/jpeg/8881e245b18bcd8c51f865ec8bc4b285/fx1.jpg fx1 true fx1.jpg jpg 15317 200 500 IMAGE-DOWNSAMPLED 1-s2.0-S1381116916300577-fx2.jpg https://s3-eu-west-1.amazonaws.com/prod-ucs-content-store-eu-west/content/pii:S1381116916300577/fx2/DOWNSAMPLED/image/jpeg/10fec815e49a7493e1b6ccafd99b577e/fx2.jpg https://s3.amazonaws.com/prod-ucs-content-store-us-east/content/pii:S1381116916300577/fx2/DOWNSAMPLED/image/jpeg/10fec815e49a7493e1b6ccafd99b577e/fx2.jpg fx2 fx2.jpg jpg 9999 200 500 IMAGE-DOWNSAMPLED 1-s2.0-S1381116916300577-fx3.jpg https://s3-eu-west-1.amazonaws.com/prod-ucs-content-store-eu-west/content/pii:S1381116916300577/fx3/DOWNSAMPLED/image/jpeg/a4bcbc484e99e6cd61e464a84fc153c9/fx3.jpg https://s3.amazonaws.com/prod-ucs-content-store-us-east/content/pii:S1381116916300577/fx3/DOWNSAMPLED/image/jpeg/a4bcbc484e99e6cd61e464a84fc153c9/fx3.jpg fx3 fx3.jpg jpg 7144 200 500 IMAGE-DOWNSAMPLED 1-s2.0-S1381116916300577-fx4.jpg https://s3-eu-west-1.amazonaws.com/prod-ucs-content-store-eu-west/content/pii:S1381116916300577/fx4/DOWNSAMPLED/image/jpeg/1a85ff378f1bee06e241f01ce36e3852/fx4.jpg https://s3.amazonaws.com/prod-ucs-content-store-us-east/content/pii:S1381116916300577/fx4/DOWNSAMPLED/image/jpeg/1a85ff378f1bee06e241f01ce36e3852/fx4.jpg fx4 fx4.jpg jpg 6099 200 500 IMAGE-DOWNSAMPLED 1-s2.0-S1381116916300577-gr1.jpg https://s3-eu-west-1.amazonaws.com/prod-ucs-content-store-eu-west/content/pii:S1381116916300577/gr1/DOWNSAMPLED/image/jpeg/185f372ba894485da8df68c3bfa3c2a9/gr1.jpg https://s3.amazonaws.com/prod-ucs-content-store-us-east/content/pii:S1381116916300577/gr1/DOWNSAMPLED/image/jpeg/185f372ba894485da8df68c3bfa3c2a9/gr1.jpg gr1 gr1.jpg jpg 96056 449 678 IMAGE-DOWNSAMPLED 1-s2.0-S1381116916300577-gr2.jpg https://s3-eu-west-1.amazonaws.com/prod-ucs-content-store-eu-west/content/pii:S1381116916300577/gr2/DOWNSAMPLED/image/jpeg/b93fd4896da213c7a344f7a22168f878/gr2.jpg https://s3.amazonaws.com/prod-ucs-content-store-us-east/content/pii:S1381116916300577/gr2/DOWNSAMPLED/image/jpeg/b93fd4896da213c7a344f7a22168f878/gr2.jpg gr2 gr2.jpg jpg 74290 604 446 IMAGE-DOWNSAMPLED 1-s2.0-S1381116916300577-gr3.jpg https://s3-eu-west-1.amazonaws.com/prod-ucs-content-store-eu-west/content/pii:S1381116916300577/gr3/DOWNSAMPLED/image/jpeg/f76bc70ea5c2fa9995cc367ee5f037ee/gr3.jpg https://s3.amazonaws.com/prod-ucs-content-store-us-east/content/pii:S1381116916300577/gr3/DOWNSAMPLED/image/jpeg/f76bc70ea5c2fa9995cc367ee5f037ee/gr3.jpg gr3 gr3.jpg jpg 109982 489 489 IMAGE-DOWNSAMPLED 1-s2.0-S1381116916300577-gr4.jpg https://s3-eu-west-1.amazonaws.com/prod-ucs-content-store-eu-west/content/pii:S1381116916300577/gr4/DOWNSAMPLED/image/jpeg/6e6a86ecc86df0e820f96c6b051dac45/gr4.jpg https://s3.amazonaws.com/prod-ucs-content-store-us-east/content/pii:S1381116916300577/gr4/DOWNSAMPLED/image/jpeg/6e6a86ecc86df0e820f96c6b051dac45/gr4.jpg gr4 gr4.jpg jpg 17952 60 376 IMAGE-DOWNSAMPLED 1-s2.0-S1381116916300577-gr5.jpg https://s3-eu-west-1.amazonaws.com/prod-ucs-content-store-eu-west/content/pii:S1381116916300577/gr5/DOWNSAMPLED/image/jpeg/b18455e022e87ca3294f313b3712bad4/gr5.jpg https://s3.amazonaws.com/prod-ucs-content-store-us-east/content/pii:S1381116916300577/gr5/DOWNSAMPLED/image/jpeg/b18455e022e87ca3294f313b3712bad4/gr5.jpg gr5 gr5.jpg jpg 31140 213 320 IMAGE-DOWNSAMPLED 1-s2.0-S1381116916300577-gr6.jpg https://s3-eu-west-1.amazonaws.com/prod-ucs-content-store-eu-west/content/pii:S1381116916300577/gr6/DOWNSAMPLED/image/jpeg/72236502cebf8639eb43c82d2d278788/gr6.jpg https://s3.amazonaws.com/prod-ucs-content-store-us-east/content/pii:S1381116916300577/gr6/DOWNSAMPLED/image/jpeg/72236502cebf8639eb43c82d2d278788/gr6.jpg gr6 gr6.jpg jpg 36696 220 376 IMAGE-DOWNSAMPLED 1-s2.0-S1381116916300577-gr7.jpg https://s3-eu-west-1.amazonaws.com/prod-ucs-content-store-eu-west/content/pii:S1381116916300577/gr7/DOWNSAMPLED/image/jpeg/1520e91a90eeda14e69b061445de226b/gr7.jpg https://s3.amazonaws.com/prod-ucs-content-store-us-east/content/pii:S1381116916300577/gr7/DOWNSAMPLED/image/jpeg/1520e91a90eeda14e69b061445de226b/gr7.jpg gr7 gr7.jpg jpg 101951 488 489 IMAGE-DOWNSAMPLED 1-s2.0-S1381116916300577-fx1_lrg.jpg https://s3-eu-west-1.amazonaws.com/prod-ucs-content-store-eu-west/content/pii:S1381116916300577/fx1/HIGHRES/image/jpeg/32462dd2cc3e2373728d2cc8fc5485ec/fx1_lrg.jpg https://s3.amazonaws.com/prod-ucs-content-store-us-east/content/pii:S1381116916300577/fx1/HIGHRES/image/jpeg/32462dd2cc3e2373728d2cc8fc5485ec/fx1_lrg.jpg fx1 true fx1_lrg.jpg jpg 122988 886 2213 IMAGE-HIGH-RES 1-s2.0-S1381116916300577-fx2_lrg.jpg https://s3-eu-west-1.amazonaws.com/prod-ucs-content-store-eu-west/content/pii:S1381116916300577/fx2/HIGHRES/image/jpeg/bc7af44adae88deb4037f993287b2d5b/fx2_lrg.jpg https://s3.amazonaws.com/prod-ucs-content-store-us-east/content/pii:S1381116916300577/fx2/HIGHRES/image/jpeg/bc7af44adae88deb4037f993287b2d5b/fx2_lrg.jpg fx2 fx2_lrg.jpg jpg 73767 886 2213 IMAGE-HIGH-RES 1-s2.0-S1381116916300577-fx3_lrg.jpg https://s3-eu-west-1.amazonaws.com/prod-ucs-content-store-eu-west/content/pii:S1381116916300577/fx3/HIGHRES/image/jpeg/0d4ad259fa48725d7ffd95220f7b5cbf/fx3_lrg.jpg https://s3.amazonaws.com/prod-ucs-content-store-us-east/content/pii:S1381116916300577/fx3/HIGHRES/image/jpeg/0d4ad259fa48725d7ffd95220f7b5cbf/fx3_lrg.jpg fx3 fx3_lrg.jpg jpg 57588 886 2213 IMAGE-HIGH-RES 1-s2.0-S1381116916300577-fx4_lrg.jpg https://s3-eu-west-1.amazonaws.com/prod-ucs-content-store-eu-west/content/pii:S1381116916300577/fx4/HIGHRES/image/jpeg/b3de1ec88164a271a05883c5c584697a/fx4_lrg.jpg https://s3.amazonaws.com/prod-ucs-content-store-us-east/content/pii:S1381116916300577/fx4/HIGHRES/image/jpeg/b3de1ec88164a271a05883c5c584697a/fx4_lrg.jpg fx4 fx4_lrg.jpg jpg 47583 886 2213 IMAGE-HIGH-RES 1-s2.0-S1381116916300577-gr1_lrg.jpg https://s3-eu-west-1.amazonaws.com/prod-ucs-content-store-eu-west/content/pii:S1381116916300577/gr1/HIGHRES/image/jpeg/ec31e854be55dc4344786da17823bb70/gr1_lrg.jpg https://s3.amazonaws.com/prod-ucs-content-store-us-east/content/pii:S1381116916300577/gr1/HIGHRES/image/jpeg/ec31e854be55dc4344786da17823bb70/gr1_lrg.jpg gr1 gr1_lrg.jpg jpg 804087 1988 3000 IMAGE-HIGH-RES 1-s2.0-S1381116916300577-gr2_lrg.jpg https://s3-eu-west-1.amazonaws.com/prod-ucs-content-store-eu-west/content/pii:S1381116916300577/gr2/HIGHRES/image/jpeg/05a1dc86c7b823673e6649e191bdb572/gr2_lrg.jpg https://s3.amazonaws.com/prod-ucs-content-store-us-east/content/pii:S1381116916300577/gr2/HIGHRES/image/jpeg/05a1dc86c7b823673e6649e191bdb572/gr2_lrg.jpg gr2 gr2_lrg.jpg jpg 411205 2674 1974 IMAGE-HIGH-RES 1-s2.0-S1381116916300577-gr3_lrg.jpg https://s3-eu-west-1.amazonaws.com/prod-ucs-content-store-eu-west/content/pii:S1381116916300577/gr3/HIGHRES/image/jpeg/1cc66c36b23ce2c771a02b7d95748442/gr3_lrg.jpg https://s3.amazonaws.com/prod-ucs-content-store-us-east/content/pii:S1381116916300577/gr3/HIGHRES/image/jpeg/1cc66c36b23ce2c771a02b7d95748442/gr3_lrg.jpg gr3 gr3_lrg.jpg jpg 707308 2166 2167 IMAGE-HIGH-RES 1-s2.0-S1381116916300577-gr4_lrg.jpg https://s3-eu-west-1.amazonaws.com/prod-ucs-content-store-eu-west/content/pii:S1381116916300577/gr4/HIGHRES/image/jpeg/5f0744ad8e782f7d48366ae8cdba666a/gr4_lrg.jpg https://s3.amazonaws.com/prod-ucs-content-store-us-east/content/pii:S1381116916300577/gr4/HIGHRES/image/jpeg/5f0744ad8e782f7d48366ae8cdba666a/gr4_lrg.jpg gr4 gr4_lrg.jpg jpg 58298 265 1667 IMAGE-HIGH-RES 1-s2.0-S1381116916300577-gr5_lrg.jpg https://s3-eu-west-1.amazonaws.com/prod-ucs-content-store-eu-west/content/pii:S1381116916300577/gr5/HIGHRES/image/jpeg/1f3870b6f8102f90ad0f78fc2c68a17a/gr5_lrg.jpg https://s3.amazonaws.com/prod-ucs-content-store-us-east/content/pii:S1381116916300577/gr5/HIGHRES/image/jpeg/1f3870b6f8102f90ad0f78fc2c68a17a/gr5_lrg.jpg gr5 gr5_lrg.jpg jpg 131300 941 1417 IMAGE-HIGH-RES 1-s2.0-S1381116916300577-gr6_lrg.jpg https://s3-eu-west-1.amazonaws.com/prod-ucs-content-store-eu-west/content/pii:S1381116916300577/gr6/HIGHRES/image/jpeg/5fdcf8a0a2b854b3e2e7eb642867de68/gr6_lrg.jpg https://s3.amazonaws.com/prod-ucs-content-store-us-east/content/pii:S1381116916300577/gr6/HIGHRES/image/jpeg/5fdcf8a0a2b854b3e2e7eb642867de68/gr6_lrg.jpg gr6 gr6_lrg.jpg jpg 138316 976 1667 IMAGE-HIGH-RES 1-s2.0-S1381116916300577-gr7_lrg.jpg https://s3-eu-west-1.amazonaws.com/prod-ucs-content-store-eu-west/content/pii:S1381116916300577/gr7/HIGHRES/image/jpeg/bb9a25c098b281cc4fdce93925ba0500/gr7_lrg.jpg https://s3.amazonaws.com/prod-ucs-content-store-us-east/content/pii:S1381116916300577/gr7/HIGHRES/image/jpeg/bb9a25c098b281cc4fdce93925ba0500/gr7_lrg.jpg gr7 gr7_lrg.jpg jpg 645425 2163 2167 IMAGE-HIGH-RES 1-s2.0-S1381116916300577-mmc1.docx https://s3-eu-west-1.amazonaws.com/prod-ucs-content-store-eu-west/content/pii:S1381116916300577/mmc1/MAIN/application/msword/e58b2b857802585846bd933484262761/mmc1.docx https://s3.amazonaws.com/prod-ucs-content-store-us-east/content/pii:S1381116916300577/mmc1/MAIN/application/msword/e58b2b857802585846bd933484262761/mmc1.docx mmc1 mmc1.docx docx 6198034 APPLICATION MOLCAA 9789 S1381-1169(16)30057-7 10.1016/j.molcata.2016.02.023 Elsevier B.V. Fig. 1 Functionalization route. Fig. 1 Fig. 2 (a) Raman spectra of the parent and modified samples (inset: I D/I G ratios); (b) XPS N1s curves of the parent and modified sample. Fig. 2 Fig. 3 TEM image of TRGO-NPy-Pd. Inset: XPS Pd3d spectrum. Fig. 3 Fig. 4 The Heck reaction studied. Fig. 4 Fig. 5 Kinetic profile of the E-stilbene synthesis catalyzed by TRGO-NPy-Pd and a homogeneous palladium based catalyst. Fig. 5 Fig. 6 Recycling studies (8th cycle performed under air). Fig. 6 Fig. 7 TEM image of TRGO-NPy-Pd sample after the catalytic cycles. Inset: XPS Pd3d region. Fig. 7 Table 1 Versatility of the catalyst. Table 1 Entry R 1 R 2 Yield b TON c TOF0 (s−1) d % (h) 1234567 HCH3 CF3 OMeCHONO2 Py 97899094959693 (5)(7.5)(5)(10)(1.5)(2)(6) 323297300313317320310 1.080.991.001.051.061.071.04 891011121314 HCH3 CF3 OMeCHONO2 Py 8560–55702687 (15)(18)(19)(21)(17)(18)(12) 283200–18323387290 0.950.67–0.610.780.290.97 aReaction conditions: vinyl substrate (1mmol), aryl bromide (1mmol), Na2CO3 (2mmol), DMF (4mL) and the catalyst (0.3mol% Pd based), 140°C. b Determined by 1H NMR. c Turnover number. d Turnover frequency calculated after 5min of reaction. Graphene anchored palladium complex as efficient and recyclable catalyst in the Heck cross-coupling reaction Laura Fernández-García Matías Blanco Clara Blanco Patricia Álvarez Marcos Granda Ricardo Santamaría Rosa Menéndez ⁎ Instituto Nacional del Carbón, INCAR-CSIC, P.O. Box 73, 33080 Oviedo, Spain Instituto Nacional del Carbón INCAR-CSIC P.O. Box 73 Oviedo 33080 Spain ⁎ Corresponding author. Graphical abstract The immobilization of organometallic molecular catalysts on carbon nanomaterials requires an appropriate synthesis and functionalization methodology to yield active heterogeneous systems. In this work, molecular palladium complexes were synthesized on the aromatic network of a graphenic material employing diazonium chemistry and additional simple modifications to generate a bidentate coordination site for the palladium atoms. The presence of 0.2–0.25nm palladium(II) species on the surface of the graphenic layers was confirmed by XPS and HRTEM. The modified palladium-graphene hybrid was found to be active as catalyst in the cross-coupling Heck reaction between styrene or n-butyl acrylate with a wide range of aryl bromides substituted with different electron-acceptor and electron-withdrawing groups. The coupled products were obtained in good to excellent yields, at initial TOFs as high as 1.1s−1. In addition, the catalyst showed excellent cyclability and air stability, and was reused over 8 cycles without any loss of activity. Keywords Graphene Pd complexes Functionalization Heck cross-coupling Recyclability 1 Introduction Palladium-based homogeneous and heterogeneous catalysts are versatile tools that can be used to perform a large number of chemical and electrochemical reactions, such as hydrogenation/dehydrogenation, petroleum cracking or certain fuel-cell processes [1–5]. In addition, palladium organometallic compounds are known to be valuable catalysts for forming carbon–carbon bonds in cross coupling processes [6]. Numerous examples of the use of palladium complexes [7,8], or even palladium nanoparticles [9], have been reported in the literature to catalyze, for instance, Suzuki, Stille, Sonogashira reactions and Heck couplings [10,11]. All of these have not only contributed to clarifying the different steps involved in the reaction mechanism [12] but also to achieve total synthesis [13], biomolecules [14], drugs [15], and even chiral compounds [16] in both at laboratory and at industrial scale. Clearly, the high cost of these catalysts, the toxicity of the reaction residues and the complicated synthesis of the final catalyst precursors make it necessary to develop palladium catalysts which are easy to recover and that, cycle without losing their catalytic performance and activity [17]. Several studies in the literature deal with the anchorage of these catalytic species on different kinds of support, such as zeolites [18], metal-organic frameworks (MOFs) [19], polymers [20], activated carbons [21] or even carbon nanomaterials, i.e., carbon nanotubes and graphene [22]. However, these kinds of hybrid systems usually involve the use of palladium nanoparticles, and the number of examples of the covalent anchoring of palladium-based molecular catalysts on a carbonaceous support is very small. The heterogenization of an active palladium molecular cross coupling catalyst on graphenic materials could revolutionize the organic synthesis research due to the transfer of the outstanding properties of graphene (i.e., electronic transport, thermal conduction, etc.) to the active palladium center. Other authors have noted synergistic effects between graphenic materials and metallic nanoparticles in catalyzed chemical and electrochemical processes [23–25]. Therefore, graphene can take part, by electron-transfer assistance, in the necessary palladium oxidations and reductions in which the Heck cross-coupling-reaction mechanism is based. The unique properties of graphene and related materials, in relation to electron and thermal conductivity [26,27], intrinsic porosity and chemical inertness in most of the media [28] make these materials suitable for use as supports of molecular palladium catalytic species. Also, long established and well-tried functionalization routes for decorating the graphene lattice (1,3-dipolar addition, diazonium chemistry, the Bingle reaction) [29] make it possible to construct the catalyst precursor by applying few steps based on simple organic reactions as a way to establish accessible binding sites for immobilizing the palladium center on the surface of the material. In this way, leaching can be avoided, while, at the same time, a surface effect that enhances activity and also affords stability and cyclability to the catalytic system can be created [30]. In this study, the covalent surface decoration of a graphenic material with a nitrogen bidentate molecular palladium organometallic compound introduced into the aromatic scaffold by means of a three-step procedure is reported. First, diazonium chemistry is applied to obtain a nitrogen-based reactive point on the surface of the graphene that can be modified in a second reaction to achieve a nitrogen bidentate binding site for the palladium complex. This novel graphene-palladium hybrid system was employed as catalyst in a Heck cross coupling reaction between aryl bromides of different characteristics and suitable aliphatic or aromatic vinyl substrates in order to test the versatility of our system. The cyclability and air stability of the catalyst were also studied. 2 Materials and methods 2.1 Materials The solvents were distilled immediately prior to use from appropriate drying agents or obtained from a Solvent Purification System (Innovative Technologies). All the chemicals and the graphite were purchased from Aldrich. Reagent grade or better quality was employed in all of the experiments. Graphite oxide (GO) was prepared by a modified Hummers method as described elsewhere [46]. The graphenic material, TRGO, was prepared in a two-steps procedure. The first step consisted in the simultaneous exfoliation-reduction of GO in a home-made self-designed stainless-steel reactor by means of thermal treatment of the material at 300°C under an inert atmosphere [47]. The graphenic material was then annealed at 2000°C for 1h under an argon atmosphere to yield TRGO which was subsequently employed in the functionalization steps (Fig. 1 ). 2.2 Functionalization route The graphenic material TRGO was modified with a palladium organometallic complex in a three step procedure. In the first step, 0.15g of the graphenic material was suspended in 200mL of N-methyl-2-pyrrolidone (NMP), subjected to 10min of sonication and then mixed with 5.18g (37.5mmol) of 4-nitroaniline and 10.1mL (75mmol) of isopenthyl nitrite. The reaction mixture was magnetically stirred at 85°C for 1h. Then, the solid product was thoroughly washed with dimethyl formamide (DMF) (3×100mL), methanol (3×100mL), ammonium hydroxide (2×200mL), Milli-Q water (2×200mL), methanol (2×100mL), ethyl acetate (2×100mL) and diethyl ether (1×50mL). The resultant sample was labelled TRGO-NO2 . The nitro group (0.125g of material obtained in the previous step) was deprotected by reduction with tin (II) chloride (0.375g, 2mmol) in a 200mL mixture of boiling (1:1) tetrahydrofuran (THF) − ethanol for 24h. The reaction crude was washed with a 0.5M HCl solution (8×50mL), Milli-Q water till neutral pH, a 0.5M solution of NaOH (8×50mL), Milli-Q water till neutral pH, THF (4×50mL) and ether (1×50mL). The resulting sample was labelled TRGO-NH2 . The second step was based on the reaction of the a aniline unit (0.125g of the material obtained in the preceding step) with picolinaldehide (0.386mL, 0.4mmol) catalyzed by introducing a drop of formic acid into 200mL of ethanol at refluxing conditions for 48h. After the reaction, the sample was washed with 6×50mL of ethanol, 6×50mL of dichloromethane (DCM) and 1×50mL of ether. The resultant sample was labelled TRGO-NPy. Finally, the palladium complex was formed by reacting 0.1g of TRGO-NPy with 0.05g (0.13mmol) of palladium(II) acetate and KCl (0.0193g, 0.26mmol) in 100mL of acetonitrile. The reaction was held for 5h under reflux conditions. The sample was then washed with 6×50mL of acetonitrile and ether, and labelled TRGO-NPy-Pd. 2.3 Catalytic reactions In a typical experiment, the vinyl substrate (styrene derivatives or butyl acrylate derivatives, 1mmol), the aryl bromide (1mmol), Na2CO3 (2mmol), solvent (DMF, 4mL) and the catalyst (0.3mol%, 15.6mg of sample) were introduced into a 25mL Schlenk round-bottomed flask. The reaction was held at 140°C for the desired time (Table 1 ). Aliquots were taken and subjected to thin-layer chromatography (TLC) or NMR spectroscopy in order to follow the progress of the reaction. Once the reaction was completed, the crude product was washed with water, extracted three times with ether, dried over anhydrous MgSO4 and concentrated under reduced pressure. Purification by recrystallization in ethanol or by flash chromatography in silica (hexane:ethyl acetate 10:1) yielded the final product. The TRGO-NPy-Pd sample was recovered by centrifugation and washed three times with 20mL of acetone. In the E-stilbene synthesis, several catalytic cycles were performed without adding any fresh catalyst precursor. The last cycle at least was carried out without an inert atmosphere. 2.4 Characterization methods Transmission electron microscopy (TEM) images were obtained on a JEOL JEM-2100F transmission electron microscope, equipped with a field-emission-gun (FEG) operating at 200kV and an Oxford Instruments Energy-dispersive X-ray spectroscopy (EDX) probe. The samples were prepared by casting a few drops of 1mgmL−1 ethanol suspensions over carbon grids. Raman spectra were recorded on an Invia Renishaw microspectrometer (50×) with the laser source set to 532nm. Fourier-Transformed Infrared (FTIR) spectra were recorded on a Nicolet 8700 FTIR spectrometer (Thermo Scientific) fitted with a DFT (deuterated triglycine sulfate) detector, operating in transmission mode on KBr pellets. The X-ray photoemission spectroscopy (XPS) spectra were recorded using a SPECS system operating under a pressure of 10−7 Pa with a Mg Kα X-ray source. Oxygen functional groups within the graphenic material were quantified by deconvoluting the high resolution C1s XPS peak and employing Gaussian and Lorentzian functions [48]. Nitrogenized species were analyzed with respect to the N1s band of the XPS spectra. The amount of palladium present in the samples was determined by means of Inductively Coupled Plasma Mass Spectrometry (ICP-MS) on an Agilent 7700× instrument. The samples were digested following a method described elsewhere [49]. Briefly, 30mg of sample was treated with 5mL of a mixture of concentrated nitric and hydrochloric acid (3:1 ratio) at 180°C for 3h under microwave irradiation. NMR spectra were recorded on a Bruker Advance 400 spectrometer operating at 400.16MHz (1H). NMR chemical shifts are reported in ppm relative to tetramethylsilane and referenced to partially deuterated solvent resonances. Coupling constants (J) are given in hertz. 3 Results and discussion 3.1 Synthesis of the graphenic material Graphenic materials are prepared by applying thermal flash treatment to a graphite oxide (GO) synthesized by a modified Hummers method, as described elsewhere [46]. The focus of this study was the reconstruction of the aromatic scaffold on the graphenic layers. Consequently, a high temperature thermal annealing process was applied after the thermal treatment of the GO, as a result of which TRGO was obtained (Fig. 1). The Raman spectrum of TGRO (Fig. 2 a) shows a typical D/G/2D bands pattern which corroborates the graphenic nature of the material. The shape of the spectrum confirms the reconstruction of the aromatic lattice, with a very low I D/I G ratio (I D/I G =0.21), and a pronounced second order spectrum, typical of a non-defective exfoliated-graphene material [31]. This was also evidenced by the XPS analysis of the sample, which showed a C/O ratio of 498 and an amount of Csp2 of 84.0%, indicating the successful reconstruction of the aromatic lattice, that is backed up by the deconvolution of the XPS C1s peak (Appendix A). Residual oxygen groups were mainly hydroxylic functions (6.0%), while epoxy and carboxylic groups were almost totally absent (0.6 and 0.0% respectively). TEM images of the graphenic material used in this study show the classical wrinkled appearance characteristic of graphenic materials obtained by thermal reduction (Appendix A). 3.2 Decoration of the material with the palladium complex Reconstruction of the sp2 aromatic lattice of the graphenic material allows functionalization by diazonium chemistry methods, as reported elsewhere [32]. Additional chemical modifications of the decorated units can be made in order to obtain the final catalyst precursor, on the basis of a suitable choice of the aniline [33]. In this way, the in situ formation of a diazonium salt from the p-nitroaniline amino group, followed by the thermal release of nitrogen and the entrapment of the nitrobenzene radical yields a functionalized graphenic layer TRGO-NO2 (Fig. 1). Deprotection of the nitro group by applying a standard reduction protocol based on tin chloride [20] yields the amino-functionalized graphenic material TRGO-NH2 . The introduction of the nitrobenzene unit and its subsequent reduction to an amino group was characterized by Raman and XPS spectroscopy. An increase in the I D/I G ratio (from 0.21 to 0.32) in the Raman spectra of TRGO-NO2 was detected (Fig. 2a) as a consequence of the generation of sp3 carbon due to the formation of a new CC bond between the graphenic layer and the diazonium salt [32]. In addition, the I D/I G ratio of the reduced sample was unchanged, which indicates that reduction took place only in the nitro group and not in the carbon nanomaterial, as confirmed by the increase in the nitrogen content of the functionalized samples. The parent graphenic material TRGO contained a negligible amount of nitrogen (0.0%), which is increased to 1.2% in TRGO-NO2 , and this value was maintained in the reduced sample TRGO-NH2 (1.2%). In addition, nitrogenized species were identified. A shift in the maxima of the N1s bands occurred (Fig. 2b), varying from 406.2eV in TRGO-NO2 , corresponding exclusively to the NO2 group, to lower energies of 399.5eV in TRGO-NH2 . These data fully agree with the positive reduction from a nitro to an amino group [34]. As can also be seen in Fig. 2b, the parent material TRGO only gives a noise curve due to its null nitrogen content. The presence of the nitro and amino groups in both samples was also corroborated by FTIR spectroscopy (Appendix A), the characteristic scissors bands at 1600–1400cm−1 of the NO bonds had vanished while a broad band at higher wavenumbers, ∼3200cm−1 appeared corresponding to the NH bonds [20]. TRGO-NH2 reacted with picolinaldehide to generate the imino-functionalized material TRGO-NPy. Finally, individual palladium units were trapped by the two donor nitrogen atoms covalently attached to the graphenic material surface, resulting in the final hybrid material TRGO-NPy-Pd. ICP-MS analysis revealed that 2.4% of palladium was incorporated to the graphenic material, which is in agreement with the nitrogen content of the previous samples. In addition, 0.2–0.25 of nm electron-dense regions were found to be attached to the surface of the graphenic layers in the TEM observations (Fig. 3 ). Although larger particles were also detected, possibly due to beam irradiation under high vacuum inside the microscope chamber, the size of the spots was in agreement with molecular complexes. Similar observations had been previously reported for molecular iridium complexes supported on graphene oxide and related thermally reduced graphenic material [35]. EDX analysis confirmed the presence of palladium species (Appendix A), and the oxidation state, as determined by XPS, corresponds to palladium(II) species (Fig. 3 inset), while two maxima were obtained at 335.7 and 341.0eV, [36] evidencing that the organometallic palladium complex proposed in Fig. 1 anchored onto the graphenic material surface. 3.3 Catalytic activity The palladium hybrid material TRGO-NPy-Pd was tested as catalyst precursor in the CC cross coupling Heck reaction between aryl bromides and vinyl substrates (Fig. 4 ) [37]. Firstly, the catalytic performance of the hybrid material was tested on a model reaction involving styrene (1mmol) and bromobenzene (1mmol), with an excess of Na2CO3 (2mmol) acting as base in boiling DMF. It is worth noting that in the experimental setup used, neither phosphine nor any other donor ligand was employed to stabilize the palladium center. With a catalyst loading of 0.3mol %, the reaction proceeded smoothly, yielding the desired product E-stilbene, in a high isolated yield (97%) after 18h of reaction. As expected, the reaction performed without using a palladium source, employing TRGO-NPy as catalyst, led to a negligible conversion (see Appendix A). Moreover, the heterogeneous system was more active than the homogeneous catalyst based on palladium acetate test performed under the same conditions for comparative purposes. In the homogeneous reaction, only 75% of isolated yield was obtained after 24h of reaction. Heterogenization of the catalyst, combined with the surface effect afforded by the graphenic material [38] and the homogeneous dispersion of palladium centers throughout the graphene layer (see Fig. 3) may have been responsible for enhancing the catalytic activity. A kinetic profile was constructed to obtain a better understanding of the system. 0.1mL aliquots were taken at different reaction times, and analyzed by TLC and 1H NMR spectroscopy. As can be seen in Fig. 5 , no induction period was observed following the thermal equilibration of the reactants. The formation of E-stilbene was detected immediately, with TRGO-NPy-Pd achieving an initial TOF of 1.08s−1 (Table 1), which is higher than that of other palladium systems used for the Heck reaction reported in the literature, such as metallic nanoparticles supported on phosphates [39], silica matrixes [40], polymers [41], zeolites [42] and ionic liquids [43], and even homogenous systems [44]. Moreover, a conversion of more than 90% was obtained after 3h of reaction, and complete saturation was reached after 5h. It should also be mentioned that the model reaction was studied using a substrate (bromobenzene) without any electron-donor or electron-withdrawing groups that might have modified the electronic density of the system. An important feature of a heterogeneous catalyst is its capacity to be reused. Consequently, the recyclability of the system based on the Heck model reaction was tested. After each run, the black solids were recovered by centrifugation, washed three times with 20mL of acetone and then dried under vacuum. The recovered product was subjected to 8 catalytic cycles using for every single transformation a fresh reaction mixture but without adding any fresh catalyst precursor. Recycled TRGO-NPy-Pd exhibited similar conversions to the fresh catalyst (Fig. 6 ). However, a slight decrease in activity was observed after the fifth cycle, possibly due to a marginal loss of material in each of the recovery steps. Nevertheless, no leaching of palladium was detected by the ICP measurements. In addition, the catalyst remained stable under air due to the fact that a similar conversion of E-stilbene to those of the preceding experiments was achieved in the final cycle without using an inert atmosphere (Fig. 6). To study the versatility of the catalyst, several reactions were performed employing electron-donor and electron-withdrawing groups which modify the electronic density of the aryl bromide, such as Me, CHO, NO2, OMe, CF3 and even brominated pyridine. In addition, the scope of the catalyst was tested using aryl and vinyl substrates with styryl and acrylic skeletons to preserve the double bond. The results are depicted in Table 1. In general, all the reactions with styryl substrates (entries 1–7) were very clean and the corresponding white (or yellow, entry 6) solids were obtained in good to excellent yields within 1.5–10h. However, the butyl acrylate reactions produced lower yields and required longer times than the styrene-based ones. In addition, in the case of the aliphatic substrate, more byproducts were obtained, which were removed by flash chromatographic purification instead of using the simple recrystallization procedure applied to the stilbene derivatives. Interestingly, both pyridine couplings (entries 7, 14) gave rise to a very smooth reaction, from which a clean final product was obtained in a very short period of time, evidencing the versatility of the catalyst. In relation to the chemistry of the reaction, the electron-withdrawing groups required the shortest reaction times when both substrates were employed. It has frequently been reported in the literature that the Heck reaction achieves better results when the molecules are aromatic, and also, when the electron density is withdrawn from the carbon bonded to the halide [45], in agreement with our results. In light with these findings it is not surprising that electron-donating groups required the longest times to complete their reactions. After the reactions, the catalysts were subjected to another chemical and microscopic analysis (Fig. 7 ). No differences were found in the oxidation state of palladium in the XPS Pd3d spectrum. The same peaks at 335.7 and 341.0eV were obtained as before the catalytic reactions. In addition, the electron dense regions in the TEM corresponding to the palladium complexes did not increase in size. 0.2–0.25nm was detected for each region, in agreement with the data for the fresh graphenic catalyst. 4 Conclusions It has been demonstrated that the preparation of an active palladium-based molecular catalyst on the basal planes of a high-temperature reduced graphenic material is possible by applying diazonium chemistry, followed by some straightforward modifications reactions to yield covalently supported palladium complexes. The modified graphenic material was tested as a catalyst in the Heck cross coupling reaction, where it showed an excellent activity, a high recyclability and also good air stability. Furthermore, it was able to perform CC coupling in a wide range of different substrates with either electron donor or withdrawing groups, and even with aliphatic and aromatic compounds. In this study, the heterogeneous catalyst was found to be more active than the homogenous palladium complex. The good catalytic activity shown by our catalytic system combined with the fact that it is easy to prepare and the graphenic material is very stable could make our nanohybrid material an affordable and competitive alternative to conventional catalysts in organic synthesis research. Acknowledgments The research leading to these results has received funding from the European Union’s Research Fund for Coal and Steel research program under Grant Agreement number RFCR-CT-2013-00006. In addition, the authors acknowledge financial support from the Spanish Economy and Competitiveness Ministry (projects Consolider Ingenio 2010-CSD2009-00050- and MAT2013-48107-C3-1-R). M. Blanco thanks the Spanish Education Ministry for his FPU grant (AP2010-0025). Appendix A Supplementary data Supplementary data associated with this article can be found, in the online version, at http://dx.doi.org/10.1016/j.molcata.2016.02.023. Appendix A Supplementary data The following are Supplementary data to this article: References [1] A. Zapf M. Beller Top. Catal. 19 2002 101 109 [2] T.N. Glasnov S. Findenig C.O. Kappe Chem.—A Eur. J. 15 2009 1001 1010 [3] S. Wittmann A. Schtz R.N. Grass W.J. Stark O. Reiser Angew. Chem. Int. Ed. 49 2010 1867 1870 [4] Z.Q. Ma P. Cheng T.S. Zhao J. Membr. Sci. 215 2003 327 336 [5] O. Savadogo K. Lee K. Oishi S. Mitsushima N. Kamiya K.-I. Ota Electrochem. Commun. 6 2004 105 109 [6] M. Pagliaro V. Pandarus R. Ciriminna F. Bland P.D. Car ChemCatChem 4 2012 432 445 [7] G.C. Fortman S.P. Nolan Chem. Soc. Rev. 40 2011 5151 5169 [8] C.C.C.J. Seechurn M.O. Kitching T.J. Colacot V. Snieckus Angew. Chem. Int. Ed. 51 2012 5062 5085 [9] B. Yuan Y. Pan Y. Li B. Yin H. Jiang Angew. Chem. Int. Ed. 49 2010 4054 4058 [10] M. Lamblin L. Nassar-Hardy J. Hierso E. Fouquet F. Felpin Adv. Synth. Catal. 352 2010 33 79 [11] C.P. Mehnert D.W. Weaver J.Y. Ying J. Am. Chem. Soc. 120 1998 12289 12296 [12] M. García-Melchor A.C.A. Braga A. Lledós G. Ujaque F. Maseras Acc. Chem. Res. 46 2013 2626 2634 [13] J.E.M.N. Klein A. Perry D.S. Pugh R.J.K. Taylor Org. Lett. 12 2010 3446 3449 [14] A.M. Cerdeño M.J. Bibb G.L. Challis Chem. Biol. 8 2001 817 829 [15] D.-H. Wang K.M. Engle B.-F. Shi J.-Q. Yu Science 327 2010 315 319 [16] A. Ros B. Estepa P. Ramírez-López E. Álvarez R. Fernández J.M. Lassaletta J. Am. Chem. Soc. 135 2013 15730 15733 [17] A.M. Rouhi Chem. Eng. News 82 2004 49 [18] S. Echeandia B. Pawelec V.L. Barrio P.L. Arias J.F. Cambra C.V. Loricera J.L.G. Fierro Fuel 117 2014 1061 1073 [19] T.T. Dang Y. Zhu S.C. Ghosh A. Chen C.L.L. Chai A.M. Seayad Chem. Commun. 48 2012 1805 1807 [20] E. Rangel-Rangel E.M. Maya F. Sánchez J.G. de la Campa M. Iglesias Green Chem. 17 2015 466 473 [21] X. Xu Y. Li Y. Gong P. Zhang H. Li Y. Wang J. Am. Chem. Soc. 134 2012 16987 16990 [22] (a) A. Benyounes S. Louisia R.Z. Axet Mahfoud M. Kacimi P. Serp Catal. Today 249 2015 137 144 (b) L. Ma'mani S. Miri M. Mahdavi S. Bahadorikhalili E. Lotfi A. Foroumadi A. Shafiee RSC Adv. 4 2014 48613 48620 (c) S. Wang D. Hu W. Hua J. Gu Q. Zhang X. Jia K. Xi RSC Adv. 5 2015 53935 53939 (d) C. Bai Q. Zhao Y. Li G. Zhang F. Zhang X. Fan Catal. Lett. 144 2014 1617 1623 (e) Q. Zhao Y. Zhu Z. Sun Y. Li G. Zhang F. Zhang X. Fan J. Mater. Chem. A 3 2015 2609 2616 [23] J. Li C.-Y. Liu Y. Liu J. Mater. Chem. 22 2012 8426 8430 [24] Y. Liang Y. Li H. Wang J. Zhou J. Wang T. Regier H. Dai Nat. Mater. 10 2011 780 786 [25] G.-M. Wu Y.-F. Wu M.-C. Rong X.-M. Chen X. Chen Anal. Chim. Acta 745 2012 33 37 [26] A.H. Castro-Neto F. Guinea N.M.R. Peres A. Geim K. Novoselov Rev. Mod. Phys. 81 2009 109 162 [27] A.A. Baladin Nat. Mater. 10 2011 569 581 [28] O. Akhavan E. Ghaderi ACS Nano 4 2010 5731 5736 [29] A. Schaetz M. Zeltner W.J. Stark ACS Catal. 2 2012 1267 1284 [30] G.M. Scheuermann L. Rumi P. Steurer W. Bannwarth R. Mülhaupt J. Am. Chem. Soc. 131 2009 8262 8270 [31] L.M. Malards M.A. Pimenta G. Dresselhaus M.S. Dresselhaus Phys. Rep. 473 2009 51 87 [32] C. Hadad X. Ke M. Carraro A. Sartorel C. Bittencourt G.V. Tendeloo M. Bonchio M. Quintana M. Maurizio Prato Chem. Commun. 50 2014 885 887 [33] G. Wei Y. Yan R. Dong D. Wang X. Zhou J. Chen J. Hao Chem.—A Eur. J. 18 2012 14708 14716 [34] C.-M. Chen Q. Zhang X.-C. Zhao B. Zhang Q.-Q. Kong M.-G. Yang Q.-H. Yang M.-Z. Wang Y.-G. Yang R. Schlögl D.S. Su J. Mater. Chem. 22 2012 14076 14084 [35] M. Blanco P. Álvarez C. Blanco M.V. Jiménez J. Fernández-Tornos J.J. Pérez-Torrente L.A. Oro R. Menéndez Carbon 83 2015 21 31 [36] I. Yuranov L. Kiwi-Minsker P. Buffat A. Renken Chem. Mater. 16 2004 760 761 [37] X. Cui J. Li Z.-P. Zhang Y. Fu L. Liu Q.-X. Guo J. Org. Chem. 72 2007 9342 9345 [38] E. Yoo T. Okata T. Akita M. Kohyama J. Nakamura I. Honma Nano Lett. 9 2009 2255 2259 [39] C. Petrucci M. Cappelletti O. Piermatti M. Nocchetti M. Pica F. Pizzo L. Vaccaro J. Mol. Catal. A 401 2015 27 34 [40] I. Volovych Y. Kasaka M. Schwarze Z. Nairoukh J. Blum M. Fanun D. Avnir R. Schomäcker J. Mol. Catal. A 393 2014 20 221 [41] P. Liu Z. Ye W.-J. Wang B.-G. Li Macromolecules 46 2013 72 82 [42] S. Mandal D. Roy R.V. Chaudhari M. Sastry Chem. Mater. 16 2004 3714 3724 [43] V. Calò A. Nacci A. Monopoli A. Fornaro L. Sabbatini N. Cioffi N. Ditaranto Organometallics 23 2004 5154 5158 [44] T. Kawano T. Shinomaru I. Ueda Org. Lett. 4 2002 2545 2547 [45] Y. Fujiwara R. Asano I. Moritani S. Teanishi J. Org. Chem. 41 1976 1681 1683 [46] C. Botas P. Álvarez C. Blanco R. Santamaría M. Granda M.D. Gutiérrez F. Rodríguez-Reinoso R. Menéndez Carbon 52 2013 476 485 [47] P. Álvarez C. Blanco R. Santamaría P. Blanco Z. González L. Fernández-García U. Sierra M. Granda A. Páez R. Menéndez Carbon 90 2015 160 163 [48] P.M.A. Sherwood D. Briggs M.P. Seah Practical Surface Analysis in Auger and X-ray Photoelectron Spectroscopy vol. 1 1990 Wiley New York 574 [49] D. Elgrabli M. Floriani S. Abella-Gallar L. Meunier C. Gamez P. Delalain R. Rogerieux J. Boczkowski G. Lacroix Part. Fibre Toxicol. 5 2008 20 33",
      "scopus-id": "84961653783",
      "coredata": {
        "eid": "1-s2.0-S1381116916300577",
        "dc:description": "The immobilization of organometallic molecular catalysts on carbon nanomaterials requires an appropriate synthesis and functionalization methodology to yield active heterogeneous systems. In this work, molecular palladium complexes were synthesized on the aromatic network of a graphenic material employing diazonium chemistry and additional simple modifications to generate a bidentate coordination site for the palladium atoms. The presence of 0.2–0.25nm palladium(II) species on the surface of the graphenic layers was confirmed by XPS and HRTEM. The modified palladium-graphene hybrid was found to be active as catalyst in the cross-coupling Heck reaction between styrene or n-butyl acrylate with a wide range of aryl bromides substituted with different electron-acceptor and electron-withdrawing groups. The coupled products were obtained in good to excellent yields, at initial TOFs as high as 1.1s−1. In addition, the catalyst showed excellent cyclability and air stability, and was reused over 8 cycles without any loss of activity.",
        "openArchiveArticle": "false",
        "prism:coverDate": "2016-05-15",
        "openaccessUserLicense": null,
        "prism:aggregationType": "Journal",
        "prism:url": "https://api.elsevier.com/content/article/pii/S1381116916300577",
        "dc:creator": [
          {
            "@_fa": "true",
            "$": "Fernández-García, Laura"
          },
          {
            "@_fa": "true",
            "$": "Blanco, Matías"
          },
          {
            "@_fa": "true",
            "$": "Blanco, Clara"
          },
          {
            "@_fa": "true",
            "$": "Álvarez, Patricia"
          },
          {
            "@_fa": "true",
            "$": "Granda, Marcos"
          },
          {
            "@_fa": "true",
            "$": "Santamaría, Ricardo"
          },
          {
            "@_fa": "true",
            "$": "Menéndez, Rosa"
          }
        ],
        "link": [
          {
            "@_fa": "true",
            "@rel": "self",
            "@href": "https://api.elsevier.com/content/article/pii/S1381116916300577"
          },
          {
            "@_fa": "true",
            "@rel": "scidir",
            "@href": "https://www.sciencedirect.com/science/article/pii/S1381116916300577"
          }
        ],
        "dc:format": "application/json",
        "openaccessType": null,
        "pii": "S1381-1169(16)30057-7",
        "prism:volume": "416",
        "prism:publisher": "Elsevier B.V.",
        "dc:title": "Graphene anchored palladium complex as efficient and recyclable catalyst in the Heck cross-coupling reaction",
        "prism:copyright": "Copyright © 2016 Elsevier B.V. All rights reserved.",
        "openaccess": "0",
        "prism:issn": "13811169",
        "dcterms:subject": [
          {
            "@_fa": "true",
            "$": "Graphene"
          },
          {
            "@_fa": "true",
            "$": "Pd complexes"
          },
          {
            "@_fa": "true",
            "$": "Functionalization"
          },
          {
            "@_fa": "true",
            "$": "Heck cross-coupling"
          },
          {
            "@_fa": "true",
            "$": "Recyclability"
          }
        ],
        "openaccessArticle": "false",
        "prism:publicationName": "Journal of Molecular Catalysis A: Chemical",
        "openaccessSponsorType": null,
        "prism:pageRange": "140-146",
        "prism:endingPage": "146",
        "pubType": "fla",
        "prism:coverDisplayDate": "15 May 2016",
        "prism:doi": "10.1016/j.molcata.2016.02.023",
        "prism:startingPage": "140",
        "dc:identifier": "doi:10.1016/j.molcata.2016.02.023",
        "openaccessSponsorName": null
      },
      "objects": {
        "object": [
          {
            "@category": "thumbnail",
            "@height": "88",
            "@width": "219",
            "@_fa": "true",
            "$": "https://api.elsevier.com/content/object/eid/1-s2.0-S1381116916300577-fx1.sml?httpAccept=%2A%2F%2A",
            "@multimediatype": "GIF image file",
            "@type": "IMAGE-THUMBNAIL",
            "@size": "3789",
            "@ref": "fx1",
            "@mimetype": "image/gif"
          },
          {
            "@category": "thumbnail",
            "@height": "88",
            "@width": "219",
            "@_fa": "true",
            "$": "https://api.elsevier.com/content/object/eid/1-s2.0-S1381116916300577-fx2.sml?httpAccept=%2A%2F%2A",
            "@multimediatype": "GIF image file",
            "@type": "IMAGE-THUMBNAIL",
            "@size": "2426",
            "@ref": "fx2",
            "@mimetype": "image/gif"
          },
          {
            "@category": "thumbnail",
            "@height": "88",
            "@width": "219",
            "@_fa": "true",
            "$": "https://api.elsevier.com/content/object/eid/1-s2.0-S1381116916300577-fx3.sml?httpAccept=%2A%2F%2A",
            "@multimediatype": "GIF image file",
            "@type": "IMAGE-THUMBNAIL",
            "@size": "2104",
            "@ref": "fx3",
            "@mimetype": "image/gif"
          },
          {
            "@category": "thumbnail",
            "@height": "88",
            "@width": "219",
            "@_fa": "true",
            "$": "https://api.elsevier.com/content/object/eid/1-s2.0-S1381116916300577-fx4.sml?httpAccept=%2A%2F%2A",
            "@multimediatype": "GIF image file",
            "@type": "IMAGE-THUMBNAIL",
            "@size": "2205",
            "@ref": "fx4",
            "@mimetype": "image/gif"
          },
          {
            "@category": "thumbnail",
            "@height": "145",
            "@width": "219",
            "@_fa": "true",
            "$": "https://api.elsevier.com/content/object/eid/1-s2.0-S1381116916300577-gr1.sml?httpAccept=%2A%2F%2A",
            "@multimediatype": "GIF image file",
            "@type": "IMAGE-THUMBNAIL",
            "@size": "17766",
            "@ref": "gr1",
            "@mimetype": "image/gif"
          },
          {
            "@category": "thumbnail",
            "@height": "164",
            "@width": "121",
            "@_fa": "true",
            "$": "https://api.elsevier.com/content/object/eid/1-s2.0-S1381116916300577-gr2.sml?httpAccept=%2A%2F%2A",
            "@multimediatype": "GIF image file",
            "@type": "IMAGE-THUMBNAIL",
            "@size": "14450",
            "@ref": "gr2",
            "@mimetype": "image/gif"
          },
          {
            "@category": "thumbnail",
            "@height": "164",
            "@width": "164",
            "@_fa": "true",
            "$": "https://api.elsevier.com/content/object/eid/1-s2.0-S1381116916300577-gr3.sml?httpAccept=%2A%2F%2A",
            "@multimediatype": "GIF image file",
            "@type": "IMAGE-THUMBNAIL",
            "@size": "26828",
            "@ref": "gr3",
            "@mimetype": "image/gif"
          },
          {
            "@category": "thumbnail",
            "@height": "35",
            "@width": "219",
            "@_fa": "true",
            "$": "https://api.elsevier.com/content/object/eid/1-s2.0-S1381116916300577-gr4.sml?httpAccept=%2A%2F%2A",
            "@multimediatype": "GIF image file",
            "@type": "IMAGE-THUMBNAIL",
            "@size": "8399",
            "@ref": "gr4",
            "@mimetype": "image/gif"
          },
          {
            "@category": "thumbnail",
            "@height": "145",
            "@width": "219",
            "@_fa": "true",
            "$": "https://api.elsevier.com/content/object/eid/1-s2.0-S1381116916300577-gr5.sml?httpAccept=%2A%2F%2A",
            "@multimediatype": "GIF image file",
            "@type": "IMAGE-THUMBNAIL",
            "@size": "13283",
            "@ref": "gr5",
            "@mimetype": "image/gif"
          },
          {
            "@category": "thumbnail",
            "@height": "128",
            "@width": "219",
            "@_fa": "true",
            "$": "https://api.elsevier.com/content/object/eid/1-s2.0-S1381116916300577-gr6.sml?httpAccept=%2A%2F%2A",
            "@multimediatype": "GIF image file",
            "@type": "IMAGE-THUMBNAIL",
            "@size": "16214",
            "@ref": "gr6",
            "@mimetype": "image/gif"
          },
          {
            "@category": "thumbnail",
            "@height": "164",
            "@width": "164",
            "@_fa": "true",
            "$": "https://api.elsevier.com/content/object/eid/1-s2.0-S1381116916300577-gr7.sml?httpAccept=%2A%2F%2A",
            "@multimediatype": "GIF image file",
            "@type": "IMAGE-THUMBNAIL",
            "@size": "27121",
            "@ref": "gr7",
            "@mimetype": "image/gif"
          },
          {
            "@category": "standard",
            "@height": "200",
            "@width": "500",
            "@_fa": "true",
            "$": "https://api.elsevier.com/content/object/eid/1-s2.0-S1381116916300577-fx1.jpg?httpAccept=%2A%2F%2A",
            "@multimediatype": "JPEG image file",
            "@type": "IMAGE-DOWNSAMPLED",
            "@size": "15317",
            "@ref": "fx1",
            "@mimetype": "image/jpeg"
          },
          {
            "@category": "standard",
            "@height": "200",
            "@width": "500",
            "@_fa": "true",
            "$": "https://api.elsevier.com/content/object/eid/1-s2.0-S1381116916300577-fx2.jpg?httpAccept=%2A%2F%2A",
            "@multimediatype": "JPEG image file",
            "@type": "IMAGE-DOWNSAMPLED",
            "@size": "9999",
            "@ref": "fx2",
            "@mimetype": "image/jpeg"
          },
          {
            "@category": "standard",
            "@height": "200",
            "@width": "500",
            "@_fa": "true",
            "$": "https://api.elsevier.com/content/object/eid/1-s2.0-S1381116916300577-fx3.jpg?httpAccept=%2A%2F%2A",
            "@multimediatype": "JPEG image file",
            "@type": "IMAGE-DOWNSAMPLED",
            "@size": "7144",
            "@ref": "fx3",
            "@mimetype": "image/jpeg"
          },
          {
            "@category": "standard",
            "@height": "200",
            "@width": "500",
            "@_fa": "true",
            "$": "https://api.elsevier.com/content/object/eid/1-s2.0-S1381116916300577-fx4.jpg?httpAccept=%2A%2F%2A",
            "@multimediatype": "JPEG image file",
            "@type": "IMAGE-DOWNSAMPLED",
            "@size": "6099",
            "@ref": "fx4",
            "@mimetype": "image/jpeg"
          },
          {
            "@category": "standard",
            "@height": "449",
            "@width": "678",
            "@_fa": "true",
            "$": "https://api.elsevier.com/content/object/eid/1-s2.0-S1381116916300577-gr1.jpg?httpAccept=%2A%2F%2A",
            "@multimediatype": "JPEG image file",
            "@type": "IMAGE-DOWNSAMPLED",
            "@size": "96056",
            "@ref": "gr1",
            "@mimetype": "image/jpeg"
          },
          {
            "@category": "standard",
            "@height": "604",
            "@width": "446",
            "@_fa": "true",
            "$": "https://api.elsevier.com/content/object/eid/1-s2.0-S1381116916300577-gr2.jpg?httpAccept=%2A%2F%2A",
            "@multimediatype": "JPEG image file",
            "@type": "IMAGE-DOWNSAMPLED",
            "@size": "74290",
            "@ref": "gr2",
            "@mimetype": "image/jpeg"
          },
          {
            "@category": "standard",
            "@height": "489",
            "@width": "489",
            "@_fa": "true",
            "$": "https://api.elsevier.com/content/object/eid/1-s2.0-S1381116916300577-gr3.jpg?httpAccept=%2A%2F%2A",
            "@multimediatype": "JPEG image file",
            "@type": "IMAGE-DOWNSAMPLED",
            "@size": "109982",
            "@ref": "gr3",
            "@mimetype": "image/jpeg"
          },
          {
            "@category": "standard",
            "@height": "60",
            "@width": "376",
            "@_fa": "true",
            "$": "https://api.elsevier.com/content/object/eid/1-s2.0-S1381116916300577-gr4.jpg?httpAccept=%2A%2F%2A",
            "@multimediatype": "JPEG image file",
            "@type": "IMAGE-DOWNSAMPLED",
            "@size": "17952",
            "@ref": "gr4",
            "@mimetype": "image/jpeg"
          },
          {
            "@category": "standard",
            "@height": "213",
            "@width": "320",
            "@_fa": "true",
            "$": "https://api.elsevier.com/content/object/eid/1-s2.0-S1381116916300577-gr5.jpg?httpAccept=%2A%2F%2A",
            "@multimediatype": "JPEG image file",
            "@type": "IMAGE-DOWNSAMPLED",
            "@size": "31140",
            "@ref": "gr5",
            "@mimetype": "image/jpeg"
          },
          {
            "@category": "standard",
            "@height": "220",
            "@width": "376",
            "@_fa": "true",
            "$": "https://api.elsevier.com/content/object/eid/1-s2.0-S1381116916300577-gr6.jpg?httpAccept=%2A%2F%2A",
            "@multimediatype": "JPEG image file",
            "@type": "IMAGE-DOWNSAMPLED",
            "@size": "36696",
            "@ref": "gr6",
            "@mimetype": "image/jpeg"
          },
          {
            "@category": "standard",
            "@height": "488",
            "@width": "489",
            "@_fa": "true",
            "$": "https://api.elsevier.com/content/object/eid/1-s2.0-S1381116916300577-gr7.jpg?httpAccept=%2A%2F%2A",
            "@multimediatype": "JPEG image file",
            "@type": "IMAGE-DOWNSAMPLED",
            "@size": "101951",
            "@ref": "gr7",
            "@mimetype": "image/jpeg"
          },
          {
            "@category": "high",
            "@height": "886",
            "@width": "2213",
            "@_fa": "true",
            "$": "https://api.elsevier.com/content/object/eid/1-s2.0-S1381116916300577-fx1_lrg.jpg?httpAccept=%2A%2F%2A",
            "@multimediatype": "JPEG image file",
            "@type": "IMAGE-HIGH-RES",
            "@size": "122988",
            "@ref": "fx1",
            "@mimetype": "image/jpeg"
          },
          {
            "@category": "high",
            "@height": "886",
            "@width": "2213",
            "@_fa": "true",
            "$": "https://api.elsevier.com/content/object/eid/1-s2.0-S1381116916300577-fx2_lrg.jpg?httpAccept=%2A%2F%2A",
            "@multimediatype": "JPEG image file",
            "@type": "IMAGE-HIGH-RES",
            "@size": "73767",
            "@ref": "fx2",
            "@mimetype": "image/jpeg"
          },
          {
            "@category": "high",
            "@height": "886",
            "@width": "2213",
            "@_fa": "true",
            "$": "https://api.elsevier.com/content/object/eid/1-s2.0-S1381116916300577-fx3_lrg.jpg?httpAccept=%2A%2F%2A",
            "@multimediatype": "JPEG image file",
            "@type": "IMAGE-HIGH-RES",
            "@size": "57588",
            "@ref": "fx3",
            "@mimetype": "image/jpeg"
          },
          {
            "@category": "high",
            "@height": "886",
            "@width": "2213",
            "@_fa": "true",
            "$": "https://api.elsevier.com/content/object/eid/1-s2.0-S1381116916300577-fx4_lrg.jpg?httpAccept=%2A%2F%2A",
            "@multimediatype": "JPEG image file",
            "@type": "IMAGE-HIGH-RES",
            "@size": "47583",
            "@ref": "fx4",
            "@mimetype": "image/jpeg"
          },
          {
            "@category": "high",
            "@height": "1988",
            "@width": "3000",
            "@_fa": "true",
            "$": "https://api.elsevier.com/content/object/eid/1-s2.0-S1381116916300577-gr1_lrg.jpg?httpAccept=%2A%2F%2A",
            "@multimediatype": "JPEG image file",
            "@type": "IMAGE-HIGH-RES",
            "@size": "804087",
            "@ref": "gr1",
            "@mimetype": "image/jpeg"
          },
          {
            "@category": "high",
            "@height": "2674",
            "@width": "1974",
            "@_fa": "true",
            "$": "https://api.elsevier.com/content/object/eid/1-s2.0-S1381116916300577-gr2_lrg.jpg?httpAccept=%2A%2F%2A",
            "@multimediatype": "JPEG image file",
            "@type": "IMAGE-HIGH-RES",
            "@size": "411205",
            "@ref": "gr2",
            "@mimetype": "image/jpeg"
          },
          {
            "@category": "high",
            "@height": "2166",
            "@width": "2167",
            "@_fa": "true",
            "$": "https://api.elsevier.com/content/object/eid/1-s2.0-S1381116916300577-gr3_lrg.jpg?httpAccept=%2A%2F%2A",
            "@multimediatype": "JPEG image file",
            "@type": "IMAGE-HIGH-RES",
            "@size": "707308",
            "@ref": "gr3",
            "@mimetype": "image/jpeg"
          },
          {
            "@category": "high",
            "@height": "265",
            "@width": "1667",
            "@_fa": "true",
            "$": "https://api.elsevier.com/content/object/eid/1-s2.0-S1381116916300577-gr4_lrg.jpg?httpAccept=%2A%2F%2A",
            "@multimediatype": "JPEG image file",
            "@type": "IMAGE-HIGH-RES",
            "@size": "58298",
            "@ref": "gr4",
            "@mimetype": "image/jpeg"
          },
          {
            "@category": "high",
            "@height": "941",
            "@width": "1417",
            "@_fa": "true",
            "$": "https://api.elsevier.com/content/object/eid/1-s2.0-S1381116916300577-gr5_lrg.jpg?httpAccept=%2A%2F%2A",
            "@multimediatype": "JPEG image file",
            "@type": "IMAGE-HIGH-RES",
            "@size": "131300",
            "@ref": "gr5",
            "@mimetype": "image/jpeg"
          },
          {
            "@category": "high",
            "@height": "976",
            "@width": "1667",
            "@_fa": "true",
            "$": "https://api.elsevier.com/content/object/eid/1-s2.0-S1381116916300577-gr6_lrg.jpg?httpAccept=%2A%2F%2A",
            "@multimediatype": "JPEG image file",
            "@type": "IMAGE-HIGH-RES",
            "@size": "138316",
            "@ref": "gr6",
            "@mimetype": "image/jpeg"
          },
          {
            "@category": "high",
            "@height": "2163",
            "@width": "2167",
            "@_fa": "true",
            "$": "https://api.elsevier.com/content/object/eid/1-s2.0-S1381116916300577-gr7_lrg.jpg?httpAccept=%2A%2F%2A",
            "@multimediatype": "JPEG image file",
            "@type": "IMAGE-HIGH-RES",
            "@size": "645425",
            "@ref": "gr7",
            "@mimetype": "image/jpeg"
          },
          {
            "@category": "standard",
            "@_fa": "true",
            "$": "https://api.elsevier.com/content/object/eid/1-s2.0-S1381116916300577-mmc1.docx?httpAccept=%2A%2F%2A",
            "@multimediatype": "Microsoft Word file",
            "@type": "APPLICATION",
            "@size": "6198034",
            "@ref": "mmc1",
            "@mimetype": "application/word"
          }
        ]
      },
      "link": {
        "@rel": "abstract",
        "@href": "https://api.elsevier.com/content/abstract/scopus_id/84961653783"
      }
    }
  }
}