{
  "metadata": {
    "title": "Investigation of sol–gel supported palladium catalysts for Heck coupling reactions in o/w-microemulsions",
    "authors": "; ; ",
    "journal": "Journal of Molecular Catalysis A: Chemical",
    "date": "2014-11-01",
    "doi": "10.1016/j.molcata.2014.06.016",
    "abstract": "",
    "uri": "https://api.elsevier.com/content/article/pii/S1381116914002672",
    "pii": "S1381116914002672"
  },
  "fulltext": {
    "full-text-retrieval-response": {
      "scopus-eid": "2-s2.0-84903935508",
      "originalText": "serial JL 271358 291210 291744 291790 291809 31 Journal of Molecular Catalysis A: Chemical JOURNALMOLECULARCATALYSISACHEMICAL 2014-06-23 2014-06-23 2014-08-07T01:20:07 1-s2.0-S1381116914002672 S1381-1169(14)00267-2 S1381116914002672 10.1016/j.molcata.2014.06.016 S300 S300.1 FULL-TEXT 1-s2.0-S1381116914X00099 2015-05-15T05:56:33.63776-04:00 0 0 20141101 2014 2014-06-23T00:00:00Z absattachment articleinfo articletitlenorm authfirstinitialnorm authfirstsurnamenorm cid cids contenttype copyright crossmark dateloaded dateloadedtxt datesearch datesort dateupdated dco docsubtype doctype doi eid ewtransactionid hubeid indexeddate issn issnnorm itemstage itemtransactionid itemweight openaccess openarchive pg pgfirst pglast pii piinorm pubdatestart pubdatetxt pubyr sectiontitle sortorder srctitle srctitlenorm srctype subheadings suppl tomb volfirst volissue volumelist webpdf webpdfpagecount yearnav figure table e-component body mmlmath acknowledge affil appendices articletitle auth authfirstini authfull authkeywords authlast highlightsabst primabst ref specialabst alllist content subj ssids 1381-1169 13811169 true 393 393 C Volume 393 28 210 221 210 221 20141101 1 November 2014 2014-11-01 2014 Regular Papers article fla Copyright © 2014 Elsevier B.V. All rights reserved. INVESTIGATIONSOLGELSUPPORTEDPALLADIUMCATALYSTSFORHECKCOUPLINGREACTIONSINOWMICROEMULSIONS VOLOVYCH I 1 Introduction 2 Experimental 2.1 Chemicals 2.2 Synthesis of sol–gel supported palladium catalysts 2.3 Reaction procedure 2.4 Instruments 3 Results 3.1 Catalyst characterization 3.2 Catalytic activity of the sol–gel immobilized palladium composites 3.3 Effect of the surfactant 3.4 Substrates 3.5 Effect of surface modification 3.6 Kinetics of the reaction 3.7 Catalyst recycling 4 Discussion 5 Conclusion Acknowledgment Appendix A Supplementary data References CORMA 2003 41 49 A DJAKOVITCH 2001 5990 5999 L LI 2012 1307 1318 P LIM 2010 412 434 C DU 2012 3577 3584 Q SHINDE 2012 117 122 M CRUDDEN 2005 10045 10050 C POLSHETTIWAR 2007 6949 6976 V JANA 2008 5512 5520 S JI 2005 17232 17238 Y GELMAN 1999 123 128 F NAIROUKH 2012 129 133 Z HAMZA 2009 1502 1505 K YOSEF 2011 46 51 T MELTZER 2011 8 13 D DAHOAH 2013 90 93 S ROSINBENBARUCH 2010 65 69 A LIPSHUTZ 2008 59 72 B BHATTACHARYA 2005 3557 3560 S ARCADI 2003 4080 4086 A BOTELLA 2004 5563 5570 L KEE 2010 5646 5660 C BUCHWALD 1999 A GDCHMONOGRAPHIE AVNIR 1995 328 334 D ERTL 2008 G HANDBOOKHETEROGENEOUSCATALYSIS SCHMIDT 2001 176 184 H PARKA 2000 1437 1440 J VOLOVYCH 2013 359 367 I JOST 1962 77 W WEISZ 1954 143 196 P POLESTRA 1953 4168 4169 M MEADOWS 2003 555 567 E ERTL 2006 G HANDBOOKHETEROGENEOUSCATALYSIS JAGTAP 2012 457 473 S JIANG 2006 938 943 J SOMMER 2005 4351 4361 W RICHARDSON 2006 1207 1216 J DODDS 2012 1660 1671 D JAGTAP 2008 353 359 S YIN 2007 133 173 L LU 2010 193 196 G BEHR 2008 A APPLIEDHOMOGENEOUSCATALYSIS SCHWARZE 2011 474 483 M HAMERLA 2010 T UNTERSUCHUNGENZURHYDRIERUNGVONPROCHIRALENOLEFINENMITRHODIUMKATALYSATORENINTENSIDSYSTEMEN WEIDEMAIER 1997 9352 9361 K CHATTERJEE 2001 12823 12831 A MORI 2002 11572 11573 K OHTAKA 2011 9067 9076 A ZHANG 2009 1428 1432 G VOLOVYCHX2014X210 VOLOVYCHX2014X210X221 VOLOVYCHX2014X210XI VOLOVYCHX2014X210X221XI item S1381-1169(14)00267-2 S1381116914002672 1-s2.0-S1381116914002672 10.1016/j.molcata.2014.06.016 271358 2014-08-07T00:20:30.742798-04:00 2014-11-01 1-s2.0-S1381116914002672-main.pdf https://s3.amazonaws.com/prod-ucs-content-store-us-east/content/pii:S1381116914002672/MAIN/application/pdf/07674c0419976670417ce25fa99bd544/main.pdf https://s3-eu-west-1.amazonaws.com/prod-ucs-content-store-eu-west/content/pii:S1381116914002672/MAIN/application/pdf/07674c0419976670417ce25fa99bd544/main.pdf main.pdf pdf true 2434922 MAIN 12 1-s2.0-S1381116914002672-main_1.png https://s3-eu-west-1.amazonaws.com/prod-ucs-content-store-eu-west/content/pii:S1381116914002672/PREVIEW/image/png/74c296a78e879fad7db3fa6e0e0a34fd/main_1.png https://s3.amazonaws.com/prod-ucs-content-store-us-east/content/pii:S1381116914002672/PREVIEW/image/png/74c296a78e879fad7db3fa6e0e0a34fd/main_1.png main_1.png png 57512 849 656 IMAGE-WEB-PDF 1 1-s2.0-S1381116914002672-si9.gif https://s3.amazonaws.com/prod-ucs-content-store-us-east/content/pii:S1381116914002672/STRIPIN/image/gif/d410e9d1d15bd4ea676e585631a8ff95/si9.gif https://s3-eu-west-1.amazonaws.com/prod-ucs-content-store-eu-west/content/pii:S1381116914002672/STRIPIN/image/gif/d410e9d1d15bd4ea676e585631a8ff95/si9.gif si9 si9.gif gif 381 33 72 ALTIMG 1-s2.0-S1381116914002672-si8.gif https://s3.amazonaws.com/prod-ucs-content-store-us-east/content/pii:S1381116914002672/STRIPIN/image/gif/e1962f4b1da7d1e17ce58361d6f555d4/si8.gif https://s3-eu-west-1.amazonaws.com/prod-ucs-content-store-eu-west/content/pii:S1381116914002672/STRIPIN/image/gif/e1962f4b1da7d1e17ce58361d6f555d4/si8.gif si8 si8.gif gif 1165 37 231 ALTIMG 1-s2.0-S1381116914002672-si7.gif https://s3.amazonaws.com/prod-ucs-content-store-us-east/content/pii:S1381116914002672/STRIPIN/image/gif/1da0ed41bbbe034855e9d1d58d9706b1/si7.gif https://s3-eu-west-1.amazonaws.com/prod-ucs-content-store-eu-west/content/pii:S1381116914002672/STRIPIN/image/gif/1da0ed41bbbe034855e9d1d58d9706b1/si7.gif si7 si7.gif gif 1215 33 278 ALTIMG 1-s2.0-S1381116914002672-si6.gif https://s3.amazonaws.com/prod-ucs-content-store-us-east/content/pii:S1381116914002672/STRIPIN/image/gif/9c14f1ae11fd1e8d247ddb348a7659a9/si6.gif https://s3-eu-west-1.amazonaws.com/prod-ucs-content-store-eu-west/content/pii:S1381116914002672/STRIPIN/image/gif/9c14f1ae11fd1e8d247ddb348a7659a9/si6.gif si6 si6.gif gif 814 33 178 ALTIMG 1-s2.0-S1381116914002672-si5.gif https://s3.amazonaws.com/prod-ucs-content-store-us-east/content/pii:S1381116914002672/STRIPIN/image/gif/bcf84f2f99eaa258031b7e97effa6c4f/si5.gif https://s3-eu-west-1.amazonaws.com/prod-ucs-content-store-eu-west/content/pii:S1381116914002672/STRIPIN/image/gif/bcf84f2f99eaa258031b7e97effa6c4f/si5.gif si5 si5.gif gif 1475 34 275 ALTIMG 1-s2.0-S1381116914002672-si4.gif https://s3.amazonaws.com/prod-ucs-content-store-us-east/content/pii:S1381116914002672/STRIPIN/image/gif/084c379439488c598cde1b4cd16025a3/si4.gif https://s3-eu-west-1.amazonaws.com/prod-ucs-content-store-eu-west/content/pii:S1381116914002672/STRIPIN/image/gif/084c379439488c598cde1b4cd16025a3/si4.gif si4 si4.gif gif 540 33 111 ALTIMG 1-s2.0-S1381116914002672-si3.gif https://s3.amazonaws.com/prod-ucs-content-store-us-east/content/pii:S1381116914002672/STRIPIN/image/gif/37beadb26dce60d0d9a7c72ffc21fa68/si3.gif https://s3-eu-west-1.amazonaws.com/prod-ucs-content-store-eu-west/content/pii:S1381116914002672/STRIPIN/image/gif/37beadb26dce60d0d9a7c72ffc21fa68/si3.gif si3 si3.gif gif 679 18 157 ALTIMG 1-s2.0-S1381116914002672-si2.gif https://s3.amazonaws.com/prod-ucs-content-store-us-east/content/pii:S1381116914002672/STRIPIN/image/gif/5221b80bbb52cff0819fd7341e222c91/si2.gif https://s3-eu-west-1.amazonaws.com/prod-ucs-content-store-eu-west/content/pii:S1381116914002672/STRIPIN/image/gif/5221b80bbb52cff0819fd7341e222c91/si2.gif si2 si2.gif gif 269 13 58 ALTIMG 1-s2.0-S1381116914002672-si17.gif https://s3.amazonaws.com/prod-ucs-content-store-us-east/content/pii:S1381116914002672/STRIPIN/image/gif/b92173ccc25b7e35396d5108dca9ca01/si17.gif https://s3-eu-west-1.amazonaws.com/prod-ucs-content-store-eu-west/content/pii:S1381116914002672/STRIPIN/image/gif/b92173ccc25b7e35396d5108dca9ca01/si17.gif si17 si17.gif gif 2420 77 414 ALTIMG 1-s2.0-S1381116914002672-si16.gif https://s3.amazonaws.com/prod-ucs-content-store-us-east/content/pii:S1381116914002672/STRIPIN/image/gif/7023c10896883a402f220be477a46144/si16.gif https://s3-eu-west-1.amazonaws.com/prod-ucs-content-store-eu-west/content/pii:S1381116914002672/STRIPIN/image/gif/7023c10896883a402f220be477a46144/si16.gif si16 si16.gif gif 1284 22 376 ALTIMG 1-s2.0-S1381116914002672-si15.gif https://s3.amazonaws.com/prod-ucs-content-store-us-east/content/pii:S1381116914002672/STRIPIN/image/gif/74621c93a63175be0609ed9e5091ad95/si15.gif https://s3-eu-west-1.amazonaws.com/prod-ucs-content-store-eu-west/content/pii:S1381116914002672/STRIPIN/image/gif/74621c93a63175be0609ed9e5091ad95/si15.gif si15 si15.gif gif 709 32 159 ALTIMG 1-s2.0-S1381116914002672-si14.gif https://s3.amazonaws.com/prod-ucs-content-store-us-east/content/pii:S1381116914002672/STRIPIN/image/gif/e6b245a318d8228a83ba254b67cf1f3d/si14.gif https://s3-eu-west-1.amazonaws.com/prod-ucs-content-store-eu-west/content/pii:S1381116914002672/STRIPIN/image/gif/e6b245a318d8228a83ba254b67cf1f3d/si14.gif si14 si14.gif gif 403 32 79 ALTIMG 1-s2.0-S1381116914002672-si13.gif https://s3.amazonaws.com/prod-ucs-content-store-us-east/content/pii:S1381116914002672/STRIPIN/image/gif/9abae16f74d957cc23fcd00010cf69a6/si13.gif https://s3-eu-west-1.amazonaws.com/prod-ucs-content-store-eu-west/content/pii:S1381116914002672/STRIPIN/image/gif/9abae16f74d957cc23fcd00010cf69a6/si13.gif si13 si13.gif gif 598 36 87 ALTIMG 1-s2.0-S1381116914002672-si12.gif https://s3.amazonaws.com/prod-ucs-content-store-us-east/content/pii:S1381116914002672/STRIPIN/image/gif/a8aec829350b0a05c3e7bc886853195a/si12.gif https://s3-eu-west-1.amazonaws.com/prod-ucs-content-store-eu-west/content/pii:S1381116914002672/STRIPIN/image/gif/a8aec829350b0a05c3e7bc886853195a/si12.gif si12 si12.gif gif 636 29 158 ALTIMG 1-s2.0-S1381116914002672-si11.gif https://s3.amazonaws.com/prod-ucs-content-store-us-east/content/pii:S1381116914002672/STRIPIN/image/gif/0025a6d9bcad4f33da4cc41274a5c537/si11.gif https://s3-eu-west-1.amazonaws.com/prod-ucs-content-store-eu-west/content/pii:S1381116914002672/STRIPIN/image/gif/0025a6d9bcad4f33da4cc41274a5c537/si11.gif si11 si11.gif gif 811 35 201 ALTIMG 1-s2.0-S1381116914002672-si10.gif https://s3.amazonaws.com/prod-ucs-content-store-us-east/content/pii:S1381116914002672/STRIPIN/image/gif/c842a9ae66ddefb0ec20aa58d8db662c/si10.gif https://s3-eu-west-1.amazonaws.com/prod-ucs-content-store-eu-west/content/pii:S1381116914002672/STRIPIN/image/gif/c842a9ae66ddefb0ec20aa58d8db662c/si10.gif si10 si10.gif gif 999 33 233 ALTIMG 1-s2.0-S1381116914002672-si1.gif https://s3.amazonaws.com/prod-ucs-content-store-us-east/content/pii:S1381116914002672/STRIPIN/image/gif/f5046196d8e4fb54ae9037113ab80139/si1.gif https://s3-eu-west-1.amazonaws.com/prod-ucs-content-store-eu-west/content/pii:S1381116914002672/STRIPIN/image/gif/f5046196d8e4fb54ae9037113ab80139/si1.gif si1 si1.gif gif 527 19 107 ALTIMG 1-s2.0-S1381116914002672-sc4_lrg.jpg https://s3.amazonaws.com/prod-ucs-content-store-us-east/content/pii:S1381116914002672/sc4/HIGHRES/image/jpeg/e6e3022239125e2c2aa2044d565a29d9/sc4_lrg.jpg https://s3-eu-west-1.amazonaws.com/prod-ucs-content-store-eu-west/content/pii:S1381116914002672/sc4/HIGHRES/image/jpeg/e6e3022239125e2c2aa2044d565a29d9/sc4_lrg.jpg sc4 sc4_lrg.jpg jpg 131888 1017 2333 IMAGE-HIGH-RES 1-s2.0-S1381116914002672-sc3_lrg.jpg https://s3.amazonaws.com/prod-ucs-content-store-us-east/content/pii:S1381116914002672/sc3/HIGHRES/image/jpeg/057bcee5c73988ef7aa31d59bf223435/sc3_lrg.jpg https://s3-eu-west-1.amazonaws.com/prod-ucs-content-store-eu-west/content/pii:S1381116914002672/sc3/HIGHRES/image/jpeg/057bcee5c73988ef7aa31d59bf223435/sc3_lrg.jpg sc3 sc3_lrg.jpg jpg 356909 1943 2667 IMAGE-HIGH-RES 1-s2.0-S1381116914002672-sc2_lrg.jpg https://s3.amazonaws.com/prod-ucs-content-store-us-east/content/pii:S1381116914002672/sc2/HIGHRES/image/jpeg/e7fd7d3b00302ef6819e577048a131e3/sc2_lrg.jpg https://s3-eu-west-1.amazonaws.com/prod-ucs-content-store-eu-west/content/pii:S1381116914002672/sc2/HIGHRES/image/jpeg/e7fd7d3b00302ef6819e577048a131e3/sc2_lrg.jpg sc2 sc2_lrg.jpg jpg 141132 521 2083 IMAGE-HIGH-RES 1-s2.0-S1381116914002672-sc1_lrg.jpg https://s3.amazonaws.com/prod-ucs-content-store-us-east/content/pii:S1381116914002672/sc1/HIGHRES/image/jpeg/8abdab074f125346f02aae234c9674d5/sc1_lrg.jpg https://s3-eu-west-1.amazonaws.com/prod-ucs-content-store-eu-west/content/pii:S1381116914002672/sc1/HIGHRES/image/jpeg/8abdab074f125346f02aae234c9674d5/sc1_lrg.jpg sc1 sc1_lrg.jpg jpg 232469 1019 2667 IMAGE-HIGH-RES 1-s2.0-S1381116914002672-gr7_lrg.jpg https://s3.amazonaws.com/prod-ucs-content-store-us-east/content/pii:S1381116914002672/gr7/HIGHRES/image/jpeg/c4abc9596bfc5541d191ac888328212c/gr7_lrg.jpg https://s3-eu-west-1.amazonaws.com/prod-ucs-content-store-eu-west/content/pii:S1381116914002672/gr7/HIGHRES/image/jpeg/c4abc9596bfc5541d191ac888328212c/gr7_lrg.jpg gr7 gr7_lrg.jpg jpg 331715 3346 1333 IMAGE-HIGH-RES 1-s2.0-S1381116914002672-gr6_lrg.jpg https://s3.amazonaws.com/prod-ucs-content-store-us-east/content/pii:S1381116914002672/gr6/HIGHRES/image/jpeg/b564adc0473f76b5df86c4e30146c159/gr6_lrg.jpg https://s3-eu-west-1.amazonaws.com/prod-ucs-content-store-eu-west/content/pii:S1381116914002672/gr6/HIGHRES/image/jpeg/b564adc0473f76b5df86c4e30146c159/gr6_lrg.jpg gr6 gr6_lrg.jpg jpg 268363 2436 1667 IMAGE-HIGH-RES 1-s2.0-S1381116914002672-gr5_lrg.jpg https://s3.amazonaws.com/prod-ucs-content-store-us-east/content/pii:S1381116914002672/gr5/HIGHRES/image/jpeg/d7f3af3e659210d63f877c47feed4956/gr5_lrg.jpg https://s3-eu-west-1.amazonaws.com/prod-ucs-content-store-eu-west/content/pii:S1381116914002672/gr5/HIGHRES/image/jpeg/d7f3af3e659210d63f877c47feed4956/gr5_lrg.jpg gr5 gr5_lrg.jpg jpg 127413 1137 1500 IMAGE-HIGH-RES 1-s2.0-S1381116914002672-gr4_lrg.jpg https://s3.amazonaws.com/prod-ucs-content-store-us-east/content/pii:S1381116914002672/gr4/HIGHRES/image/jpeg/d168969dd06a7bfd103b263514261208/gr4_lrg.jpg https://s3-eu-west-1.amazonaws.com/prod-ucs-content-store-eu-west/content/pii:S1381116914002672/gr4/HIGHRES/image/jpeg/d168969dd06a7bfd103b263514261208/gr4_lrg.jpg gr4 gr4_lrg.jpg jpg 151664 1133 1500 IMAGE-HIGH-RES 1-s2.0-S1381116914002672-gr3_lrg.jpg https://s3.amazonaws.com/prod-ucs-content-store-us-east/content/pii:S1381116914002672/gr3/HIGHRES/image/jpeg/85b995f21939a33166c634e63afa2559/gr3_lrg.jpg https://s3-eu-west-1.amazonaws.com/prod-ucs-content-store-eu-west/content/pii:S1381116914002672/gr3/HIGHRES/image/jpeg/85b995f21939a33166c634e63afa2559/gr3_lrg.jpg gr3 gr3_lrg.jpg jpg 308864 2525 1667 IMAGE-HIGH-RES 1-s2.0-S1381116914002672-gr2_lrg.jpg https://s3.amazonaws.com/prod-ucs-content-store-us-east/content/pii:S1381116914002672/gr2/HIGHRES/image/jpeg/fe374e048448dd89c7615dee3d894fb6/gr2_lrg.jpg https://s3-eu-west-1.amazonaws.com/prod-ucs-content-store-eu-west/content/pii:S1381116914002672/gr2/HIGHRES/image/jpeg/fe374e048448dd89c7615dee3d894fb6/gr2_lrg.jpg gr2 gr2_lrg.jpg jpg 383318 2481 1667 IMAGE-HIGH-RES 1-s2.0-S1381116914002672-gr1_lrg.jpg https://s3.amazonaws.com/prod-ucs-content-store-us-east/content/pii:S1381116914002672/gr1/HIGHRES/image/jpeg/537592310828dfee47326852b8b280b9/gr1_lrg.jpg https://s3-eu-west-1.amazonaws.com/prod-ucs-content-store-eu-west/content/pii:S1381116914002672/gr1/HIGHRES/image/jpeg/537592310828dfee47326852b8b280b9/gr1_lrg.jpg gr1 gr1_lrg.jpg jpg 300496 900 900 IMAGE-HIGH-RES 1-s2.0-S1381116914002672-fx9_lrg.jpg https://s3.amazonaws.com/prod-ucs-content-store-us-east/content/pii:S1381116914002672/fx9/HIGHRES/image/jpeg/37076e2aea29c7f2b22b84e3a37592e3/fx9_lrg.jpg https://s3-eu-west-1.amazonaws.com/prod-ucs-content-store-eu-west/content/pii:S1381116914002672/fx9/HIGHRES/image/jpeg/37076e2aea29c7f2b22b84e3a37592e3/fx9_lrg.jpg fx9 fx9_lrg.jpg jpg 29149 292 785 IMAGE-HIGH-RES 1-s2.0-S1381116914002672-fx8_lrg.jpg https://s3.amazonaws.com/prod-ucs-content-store-us-east/content/pii:S1381116914002672/fx8/HIGHRES/image/jpeg/b1d968b0c382017897162a4a28c2972d/fx8_lrg.jpg https://s3-eu-west-1.amazonaws.com/prod-ucs-content-store-eu-west/content/pii:S1381116914002672/fx8/HIGHRES/image/jpeg/b1d968b0c382017897162a4a28c2972d/fx8_lrg.jpg fx8 fx8_lrg.jpg jpg 26296 153 1271 IMAGE-HIGH-RES 1-s2.0-S1381116914002672-fx7_lrg.jpg https://s3.amazonaws.com/prod-ucs-content-store-us-east/content/pii:S1381116914002672/fx7/HIGHRES/image/jpeg/c8818856820fa57c92d4bbd5904473c0/fx7_lrg.jpg https://s3-eu-west-1.amazonaws.com/prod-ucs-content-store-eu-west/content/pii:S1381116914002672/fx7/HIGHRES/image/jpeg/c8818856820fa57c92d4bbd5904473c0/fx7_lrg.jpg fx7 fx7_lrg.jpg jpg 52889 472 1479 IMAGE-HIGH-RES 1-s2.0-S1381116914002672-fx6_lrg.jpg https://s3.amazonaws.com/prod-ucs-content-store-us-east/content/pii:S1381116914002672/fx6/HIGHRES/image/jpeg/03856747e54166f3103458a3d39dd2d6/fx6_lrg.jpg https://s3-eu-west-1.amazonaws.com/prod-ucs-content-store-eu-west/content/pii:S1381116914002672/fx6/HIGHRES/image/jpeg/03856747e54166f3103458a3d39dd2d6/fx6_lrg.jpg fx6 fx6_lrg.jpg jpg 38527 340 1167 IMAGE-HIGH-RES 1-s2.0-S1381116914002672-fx5_lrg.jpg https://s3.amazonaws.com/prod-ucs-content-store-us-east/content/pii:S1381116914002672/fx5/HIGHRES/image/jpeg/574657552ebd62b08727814c1084c18f/fx5_lrg.jpg https://s3-eu-west-1.amazonaws.com/prod-ucs-content-store-eu-west/content/pii:S1381116914002672/fx5/HIGHRES/image/jpeg/574657552ebd62b08727814c1084c18f/fx5_lrg.jpg fx5 fx5_lrg.jpg jpg 31133 208 1423 IMAGE-HIGH-RES 1-s2.0-S1381116914002672-fx4_lrg.jpg https://s3.amazonaws.com/prod-ucs-content-store-us-east/content/pii:S1381116914002672/fx4/HIGHRES/image/jpeg/123d792359418e94dc60c0d3c7e06f11/fx4_lrg.jpg https://s3-eu-west-1.amazonaws.com/prod-ucs-content-store-eu-west/content/pii:S1381116914002672/fx4/HIGHRES/image/jpeg/123d792359418e94dc60c0d3c7e06f11/fx4_lrg.jpg fx4 fx4_lrg.jpg jpg 36132 319 1069 IMAGE-HIGH-RES 1-s2.0-S1381116914002672-fx3_lrg.jpg https://s3.amazonaws.com/prod-ucs-content-store-us-east/content/pii:S1381116914002672/fx3/HIGHRES/image/jpeg/033632217f46230493ab1b3bd25ea68e/fx3_lrg.jpg https://s3-eu-west-1.amazonaws.com/prod-ucs-content-store-eu-west/content/pii:S1381116914002672/fx3/HIGHRES/image/jpeg/033632217f46230493ab1b3bd25ea68e/fx3_lrg.jpg fx3 fx3_lrg.jpg jpg 34147 152 1527 IMAGE-HIGH-RES 1-s2.0-S1381116914002672-fx2_lrg.jpg https://s3.amazonaws.com/prod-ucs-content-store-us-east/content/pii:S1381116914002672/fx2/HIGHRES/image/jpeg/bf87517b7b0ebd87c60a0dbd2eb32925/fx2_lrg.jpg https://s3-eu-west-1.amazonaws.com/prod-ucs-content-store-eu-west/content/pii:S1381116914002672/fx2/HIGHRES/image/jpeg/bf87517b7b0ebd87c60a0dbd2eb32925/fx2_lrg.jpg fx2 fx2_lrg.jpg jpg 39015 306 1410 IMAGE-HIGH-RES 1-s2.0-S1381116914002672-fx11_lrg.jpg https://s3.amazonaws.com/prod-ucs-content-store-us-east/content/pii:S1381116914002672/fx11/HIGHRES/image/jpeg/913ce86a81c19fb1334c83c1c5d43652/fx11_lrg.jpg https://s3-eu-west-1.amazonaws.com/prod-ucs-content-store-eu-west/content/pii:S1381116914002672/fx11/HIGHRES/image/jpeg/913ce86a81c19fb1334c83c1c5d43652/fx11_lrg.jpg fx11 fx11_lrg.jpg jpg 62643 361 1499 IMAGE-HIGH-RES 1-s2.0-S1381116914002672-fx10_lrg.jpg https://s3.amazonaws.com/prod-ucs-content-store-us-east/content/pii:S1381116914002672/fx10/HIGHRES/image/jpeg/bf597451306f52870ee6d2a2acf4554f/fx10_lrg.jpg https://s3-eu-west-1.amazonaws.com/prod-ucs-content-store-eu-west/content/pii:S1381116914002672/fx10/HIGHRES/image/jpeg/bf597451306f52870ee6d2a2acf4554f/fx10_lrg.jpg fx10 fx10_lrg.jpg jpg 32432 139 1527 IMAGE-HIGH-RES 1-s2.0-S1381116914002672-fx1_lrg.jpg https://s3.amazonaws.com/prod-ucs-content-store-us-east/content/pii:S1381116914002672/fx1/HIGHRES/image/jpeg/c1a2393f6347d43c5a2786f464f3f908/fx1_lrg.jpg https://s3-eu-west-1.amazonaws.com/prod-ucs-content-store-eu-west/content/pii:S1381116914002672/fx1/HIGHRES/image/jpeg/c1a2393f6347d43c5a2786f464f3f908/fx1_lrg.jpg fx1 true fx1_lrg.jpg jpg 77330 886 2213 IMAGE-HIGH-RES 1-s2.0-S1381116914002672-sc4.jpg https://s3.amazonaws.com/prod-ucs-content-store-us-east/content/pii:S1381116914002672/sc4/DOWNSAMPLED/image/jpeg/0925c11fb6a58fadd6d5aab3f01f1189/sc4.jpg https://s3-eu-west-1.amazonaws.com/prod-ucs-content-store-eu-west/content/pii:S1381116914002672/sc4/DOWNSAMPLED/image/jpeg/0925c11fb6a58fadd6d5aab3f01f1189/sc4.jpg sc4 sc4.jpg jpg 20559 230 527 IMAGE-DOWNSAMPLED 1-s2.0-S1381116914002672-sc3.jpg https://s3.amazonaws.com/prod-ucs-content-store-us-east/content/pii:S1381116914002672/sc3/DOWNSAMPLED/image/jpeg/f31f27b9344925a3ebce49da395ff270/sc3.jpg https://s3-eu-west-1.amazonaws.com/prod-ucs-content-store-eu-west/content/pii:S1381116914002672/sc3/DOWNSAMPLED/image/jpeg/f31f27b9344925a3ebce49da395ff270/sc3.jpg sc3 sc3.jpg jpg 48435 439 602 IMAGE-DOWNSAMPLED 1-s2.0-S1381116914002672-sc2.jpg https://s3.amazonaws.com/prod-ucs-content-store-us-east/content/pii:S1381116914002672/sc2/DOWNSAMPLED/image/jpeg/c2af39a5a5cd7afb3194b3dfcb76db8c/sc2.jpg https://s3-eu-west-1.amazonaws.com/prod-ucs-content-store-eu-west/content/pii:S1381116914002672/sc2/DOWNSAMPLED/image/jpeg/c2af39a5a5cd7afb3194b3dfcb76db8c/sc2.jpg sc2 sc2.jpg jpg 16898 118 470 IMAGE-DOWNSAMPLED 1-s2.0-S1381116914002672-sc1.jpg https://s3.amazonaws.com/prod-ucs-content-store-us-east/content/pii:S1381116914002672/sc1/DOWNSAMPLED/image/jpeg/b4689208107af25099409613deb5e12d/sc1.jpg https://s3-eu-west-1.amazonaws.com/prod-ucs-content-store-eu-west/content/pii:S1381116914002672/sc1/DOWNSAMPLED/image/jpeg/b4689208107af25099409613deb5e12d/sc1.jpg sc1 sc1.jpg jpg 32746 230 602 IMAGE-DOWNSAMPLED 1-s2.0-S1381116914002672-gr7.jpg https://s3.amazonaws.com/prod-ucs-content-store-us-east/content/pii:S1381116914002672/gr7/DOWNSAMPLED/image/jpeg/5b8acd848e66b6e11bb38d5fc0c948e3/gr7.jpg https://s3-eu-west-1.amazonaws.com/prod-ucs-content-store-eu-west/content/pii:S1381116914002672/gr7/DOWNSAMPLED/image/jpeg/5b8acd848e66b6e11bb38d5fc0c948e3/gr7.jpg gr7 gr7.jpg jpg 45830 756 301 IMAGE-DOWNSAMPLED 1-s2.0-S1381116914002672-gr6.jpg https://s3.amazonaws.com/prod-ucs-content-store-us-east/content/pii:S1381116914002672/gr6/DOWNSAMPLED/image/jpeg/34dba9095e57d3ccbf04869ac6e26b12/gr6.jpg https://s3-eu-west-1.amazonaws.com/prod-ucs-content-store-eu-west/content/pii:S1381116914002672/gr6/DOWNSAMPLED/image/jpeg/34dba9095e57d3ccbf04869ac6e26b12/gr6.jpg gr6 gr6.jpg jpg 40534 549 376 IMAGE-DOWNSAMPLED 1-s2.0-S1381116914002672-gr5.jpg https://s3.amazonaws.com/prod-ucs-content-store-us-east/content/pii:S1381116914002672/gr5/DOWNSAMPLED/image/jpeg/ee992961567c959c7ead6b36ae9e5fb7/gr5.jpg https://s3-eu-west-1.amazonaws.com/prod-ucs-content-store-eu-west/content/pii:S1381116914002672/gr5/DOWNSAMPLED/image/jpeg/ee992961567c959c7ead6b36ae9e5fb7/gr5.jpg gr5 gr5.jpg jpg 21867 257 339 IMAGE-DOWNSAMPLED 1-s2.0-S1381116914002672-gr4.jpg https://s3.amazonaws.com/prod-ucs-content-store-us-east/content/pii:S1381116914002672/gr4/DOWNSAMPLED/image/jpeg/0694bf47cd752bb2b4087e89ec6d81bb/gr4.jpg https://s3-eu-west-1.amazonaws.com/prod-ucs-content-store-eu-west/content/pii:S1381116914002672/gr4/DOWNSAMPLED/image/jpeg/0694bf47cd752bb2b4087e89ec6d81bb/gr4.jpg gr4 gr4.jpg jpg 25216 256 339 IMAGE-DOWNSAMPLED 1-s2.0-S1381116914002672-gr3.jpg https://s3.amazonaws.com/prod-ucs-content-store-us-east/content/pii:S1381116914002672/gr3/DOWNSAMPLED/image/jpeg/d9125a0b93944198301791d13ce0166f/gr3.jpg https://s3-eu-west-1.amazonaws.com/prod-ucs-content-store-eu-west/content/pii:S1381116914002672/gr3/DOWNSAMPLED/image/jpeg/d9125a0b93944198301791d13ce0166f/gr3.jpg gr3 gr3.jpg jpg 42729 570 376 IMAGE-DOWNSAMPLED 1-s2.0-S1381116914002672-gr2.jpg https://s3.amazonaws.com/prod-ucs-content-store-us-east/content/pii:S1381116914002672/gr2/DOWNSAMPLED/image/jpeg/c0d6b796324fc429933bcd3e3524b236/gr2.jpg https://s3-eu-west-1.amazonaws.com/prod-ucs-content-store-eu-west/content/pii:S1381116914002672/gr2/DOWNSAMPLED/image/jpeg/c0d6b796324fc429933bcd3e3524b236/gr2.jpg gr2 gr2.jpg jpg 50246 560 376 IMAGE-DOWNSAMPLED 1-s2.0-S1381116914002672-gr1.jpg https://s3.amazonaws.com/prod-ucs-content-store-us-east/content/pii:S1381116914002672/gr1/DOWNSAMPLED/image/jpeg/222266ce074a5fe5e7e234363d0a7960/gr1.jpg https://s3-eu-west-1.amazonaws.com/prod-ucs-content-store-eu-west/content/pii:S1381116914002672/gr1/DOWNSAMPLED/image/jpeg/222266ce074a5fe5e7e234363d0a7960/gr1.jpg gr1 gr1.jpg jpg 44095 339 339 IMAGE-DOWNSAMPLED 1-s2.0-S1381116914002672-fx9.jpg https://s3.amazonaws.com/prod-ucs-content-store-us-east/content/pii:S1381116914002672/fx9/DOWNSAMPLED/image/jpeg/9a40c6ab14901e3d93109c8b251eadef/fx9.jpg https://s3-eu-west-1.amazonaws.com/prod-ucs-content-store-eu-west/content/pii:S1381116914002672/fx9/DOWNSAMPLED/image/jpeg/9a40c6ab14901e3d93109c8b251eadef/fx9.jpg fx9 fx9.jpg jpg 11081 66 177 IMAGE-DOWNSAMPLED 1-s2.0-S1381116914002672-fx8.jpg https://s3.amazonaws.com/prod-ucs-content-store-us-east/content/pii:S1381116914002672/fx8/DOWNSAMPLED/image/jpeg/0e99194c0f478277eba1baea674bbbe9/fx8.jpg https://s3-eu-west-1.amazonaws.com/prod-ucs-content-store-eu-west/content/pii:S1381116914002672/fx8/DOWNSAMPLED/image/jpeg/0e99194c0f478277eba1baea674bbbe9/fx8.jpg fx8 fx8.jpg jpg 6835 35 287 IMAGE-DOWNSAMPLED 1-s2.0-S1381116914002672-fx7.jpg https://s3.amazonaws.com/prod-ucs-content-store-us-east/content/pii:S1381116914002672/fx7/DOWNSAMPLED/image/jpeg/a11549b3c87343c4740860911dd99ab1/fx7.jpg https://s3-eu-west-1.amazonaws.com/prod-ucs-content-store-eu-west/content/pii:S1381116914002672/fx7/DOWNSAMPLED/image/jpeg/a11549b3c87343c4740860911dd99ab1/fx7.jpg fx7 fx7.jpg jpg 10273 107 334 IMAGE-DOWNSAMPLED 1-s2.0-S1381116914002672-fx6.jpg https://s3.amazonaws.com/prod-ucs-content-store-us-east/content/pii:S1381116914002672/fx6/DOWNSAMPLED/image/jpeg/cd717e62dae972ad9b858e359a45ab7a/fx6.jpg https://s3-eu-west-1.amazonaws.com/prod-ucs-content-store-eu-west/content/pii:S1381116914002672/fx6/DOWNSAMPLED/image/jpeg/cd717e62dae972ad9b858e359a45ab7a/fx6.jpg fx6 fx6.jpg jpg 8697 77 263 IMAGE-DOWNSAMPLED 1-s2.0-S1381116914002672-fx5.jpg https://s3.amazonaws.com/prod-ucs-content-store-us-east/content/pii:S1381116914002672/fx5/DOWNSAMPLED/image/jpeg/8d55d64a762eeb55e816886bde3db5b4/fx5.jpg https://s3-eu-west-1.amazonaws.com/prod-ucs-content-store-eu-west/content/pii:S1381116914002672/fx5/DOWNSAMPLED/image/jpeg/8d55d64a762eeb55e816886bde3db5b4/fx5.jpg fx5 fx5.jpg jpg 7643 47 321 IMAGE-DOWNSAMPLED 1-s2.0-S1381116914002672-fx4.jpg https://s3.amazonaws.com/prod-ucs-content-store-us-east/content/pii:S1381116914002672/fx4/DOWNSAMPLED/image/jpeg/e8c1efcba1d410559bdfc34391d4e53b/fx4.jpg https://s3-eu-west-1.amazonaws.com/prod-ucs-content-store-eu-west/content/pii:S1381116914002672/fx4/DOWNSAMPLED/image/jpeg/e8c1efcba1d410559bdfc34391d4e53b/fx4.jpg fx4 fx4.jpg jpg 8625 72 241 IMAGE-DOWNSAMPLED 1-s2.0-S1381116914002672-fx3.jpg https://s3.amazonaws.com/prod-ucs-content-store-us-east/content/pii:S1381116914002672/fx3/DOWNSAMPLED/image/jpeg/b617fb5bc03ab8dc9e9dde8d5936e08d/fx3.jpg https://s3-eu-west-1.amazonaws.com/prod-ucs-content-store-eu-west/content/pii:S1381116914002672/fx3/DOWNSAMPLED/image/jpeg/b617fb5bc03ab8dc9e9dde8d5936e08d/fx3.jpg fx3 fx3.jpg jpg 10676 34 345 IMAGE-DOWNSAMPLED 1-s2.0-S1381116914002672-fx2.jpg https://s3.amazonaws.com/prod-ucs-content-store-us-east/content/pii:S1381116914002672/fx2/DOWNSAMPLED/image/jpeg/07e927b6a92713e57a8aa9b431adfc48/fx2.jpg https://s3-eu-west-1.amazonaws.com/prod-ucs-content-store-eu-west/content/pii:S1381116914002672/fx2/DOWNSAMPLED/image/jpeg/07e927b6a92713e57a8aa9b431adfc48/fx2.jpg fx2 fx2.jpg jpg 10893 69 318 IMAGE-DOWNSAMPLED 1-s2.0-S1381116914002672-fx11.jpg https://s3.amazonaws.com/prod-ucs-content-store-us-east/content/pii:S1381116914002672/fx11/DOWNSAMPLED/image/jpeg/12cf37e3509ac27999e097316e2f2afe/fx11.jpg https://s3-eu-west-1.amazonaws.com/prod-ucs-content-store-eu-west/content/pii:S1381116914002672/fx11/DOWNSAMPLED/image/jpeg/12cf37e3509ac27999e097316e2f2afe/fx11.jpg fx11 fx11.jpg jpg 13903 81 338 IMAGE-DOWNSAMPLED 1-s2.0-S1381116914002672-fx10.jpg https://s3.amazonaws.com/prod-ucs-content-store-us-east/content/pii:S1381116914002672/fx10/DOWNSAMPLED/image/jpeg/13c11c87af71f64e0d2e3f670f68a3b2/fx10.jpg https://s3-eu-west-1.amazonaws.com/prod-ucs-content-store-eu-west/content/pii:S1381116914002672/fx10/DOWNSAMPLED/image/jpeg/13c11c87af71f64e0d2e3f670f68a3b2/fx10.jpg fx10 fx10.jpg jpg 7575 31 345 IMAGE-DOWNSAMPLED 1-s2.0-S1381116914002672-fx1.jpg https://s3.amazonaws.com/prod-ucs-content-store-us-east/content/pii:S1381116914002672/fx1/DOWNSAMPLED/image/jpeg/2cd88ff55c4778cd696a9b1c5a0cc2b4/fx1.jpg https://s3-eu-west-1.amazonaws.com/prod-ucs-content-store-eu-west/content/pii:S1381116914002672/fx1/DOWNSAMPLED/image/jpeg/2cd88ff55c4778cd696a9b1c5a0cc2b4/fx1.jpg fx1 true fx1.jpg jpg 9844 200 500 IMAGE-DOWNSAMPLED 1-s2.0-S1381116914002672-sc4.sml https://s3.amazonaws.com/prod-ucs-content-store-us-east/content/pii:S1381116914002672/sc4/THUMBNAIL/image/gif/c16b7e2e9f91ff834e2ddc06ba00e66f/sc4.sml https://s3-eu-west-1.amazonaws.com/prod-ucs-content-store-eu-west/content/pii:S1381116914002672/sc4/THUMBNAIL/image/gif/c16b7e2e9f91ff834e2ddc06ba00e66f/sc4.sml sc4 sc4.sml sml 2134 95 219 IMAGE-THUMBNAIL 1-s2.0-S1381116914002672-sc3.sml https://s3.amazonaws.com/prod-ucs-content-store-us-east/content/pii:S1381116914002672/sc3/THUMBNAIL/image/gif/bbb3fa945a8581d015adcc58ab6e61d3/sc3.sml https://s3-eu-west-1.amazonaws.com/prod-ucs-content-store-eu-west/content/pii:S1381116914002672/sc3/THUMBNAIL/image/gif/bbb3fa945a8581d015adcc58ab6e61d3/sc3.sml sc3 sc3.sml sml 3581 160 219 IMAGE-THUMBNAIL 1-s2.0-S1381116914002672-sc2.sml https://s3.amazonaws.com/prod-ucs-content-store-us-east/content/pii:S1381116914002672/sc2/THUMBNAIL/image/gif/cff253c74bba8d97c4e344290abc379d/sc2.sml https://s3-eu-west-1.amazonaws.com/prod-ucs-content-store-eu-west/content/pii:S1381116914002672/sc2/THUMBNAIL/image/gif/cff253c74bba8d97c4e344290abc379d/sc2.sml sc2 sc2.sml sml 2188 55 219 IMAGE-THUMBNAIL 1-s2.0-S1381116914002672-sc1.sml https://s3.amazonaws.com/prod-ucs-content-store-us-east/content/pii:S1381116914002672/sc1/THUMBNAIL/image/gif/3571d4753891d84a2b798b74c99b79cd/sc1.sml https://s3-eu-west-1.amazonaws.com/prod-ucs-content-store-eu-west/content/pii:S1381116914002672/sc1/THUMBNAIL/image/gif/3571d4753891d84a2b798b74c99b79cd/sc1.sml sc1 sc1.sml sml 2705 84 219 IMAGE-THUMBNAIL 1-s2.0-S1381116914002672-gr7.sml https://s3.amazonaws.com/prod-ucs-content-store-us-east/content/pii:S1381116914002672/gr7/THUMBNAIL/image/gif/70ba144e51f0699405cf60289ff890a7/gr7.sml https://s3-eu-west-1.amazonaws.com/prod-ucs-content-store-eu-west/content/pii:S1381116914002672/gr7/THUMBNAIL/image/gif/70ba144e51f0699405cf60289ff890a7/gr7.sml gr7 gr7.sml sml 2080 163 65 IMAGE-THUMBNAIL 1-s2.0-S1381116914002672-gr6.sml https://s3.amazonaws.com/prod-ucs-content-store-us-east/content/pii:S1381116914002672/gr6/THUMBNAIL/image/gif/ce2a8df12b0a3b26454a836e504b0ad2/gr6.sml https://s3-eu-west-1.amazonaws.com/prod-ucs-content-store-eu-west/content/pii:S1381116914002672/gr6/THUMBNAIL/image/gif/ce2a8df12b0a3b26454a836e504b0ad2/gr6.sml gr6 gr6.sml sml 2405 164 112 IMAGE-THUMBNAIL 1-s2.0-S1381116914002672-gr5.sml https://s3.amazonaws.com/prod-ucs-content-store-us-east/content/pii:S1381116914002672/gr5/THUMBNAIL/image/gif/7358b706a53e67edebe31405885c2231/gr5.sml https://s3-eu-west-1.amazonaws.com/prod-ucs-content-store-eu-west/content/pii:S1381116914002672/gr5/THUMBNAIL/image/gif/7358b706a53e67edebe31405885c2231/gr5.sml gr5 gr5.sml sml 3384 164 216 IMAGE-THUMBNAIL 1-s2.0-S1381116914002672-gr4.sml https://s3.amazonaws.com/prod-ucs-content-store-us-east/content/pii:S1381116914002672/gr4/THUMBNAIL/image/gif/06676b3db668bddac65fcabb9dcc1d25/gr4.sml https://s3-eu-west-1.amazonaws.com/prod-ucs-content-store-eu-west/content/pii:S1381116914002672/gr4/THUMBNAIL/image/gif/06676b3db668bddac65fcabb9dcc1d25/gr4.sml gr4 gr4.sml sml 3884 164 217 IMAGE-THUMBNAIL 1-s2.0-S1381116914002672-gr3.sml https://s3.amazonaws.com/prod-ucs-content-store-us-east/content/pii:S1381116914002672/gr3/THUMBNAIL/image/gif/0825292f2c8c55b0d532587713b1a77c/gr3.sml https://s3-eu-west-1.amazonaws.com/prod-ucs-content-store-eu-west/content/pii:S1381116914002672/gr3/THUMBNAIL/image/gif/0825292f2c8c55b0d532587713b1a77c/gr3.sml gr3 gr3.sml sml 2440 164 108 IMAGE-THUMBNAIL 1-s2.0-S1381116914002672-gr2.sml https://s3.amazonaws.com/prod-ucs-content-store-us-east/content/pii:S1381116914002672/gr2/THUMBNAIL/image/gif/a075d50c5fd03340bd35d92757219a59/gr2.sml https://s3-eu-west-1.amazonaws.com/prod-ucs-content-store-eu-west/content/pii:S1381116914002672/gr2/THUMBNAIL/image/gif/a075d50c5fd03340bd35d92757219a59/gr2.sml gr2 gr2.sml sml 3035 164 110 IMAGE-THUMBNAIL 1-s2.0-S1381116914002672-gr1.sml https://s3.amazonaws.com/prod-ucs-content-store-us-east/content/pii:S1381116914002672/gr1/THUMBNAIL/image/gif/4d8da6fc27ca32e5bae4bee5e1b6791f/gr1.sml https://s3-eu-west-1.amazonaws.com/prod-ucs-content-store-eu-west/content/pii:S1381116914002672/gr1/THUMBNAIL/image/gif/4d8da6fc27ca32e5bae4bee5e1b6791f/gr1.sml gr1 gr1.sml sml 7850 164 164 IMAGE-THUMBNAIL 1-s2.0-S1381116914002672-fx9.sml https://s3.amazonaws.com/prod-ucs-content-store-us-east/content/pii:S1381116914002672/fx9/THUMBNAIL/image/gif/0dfc10913108b69522e00fe5a6f16184/fx9.sml https://s3-eu-west-1.amazonaws.com/prod-ucs-content-store-eu-west/content/pii:S1381116914002672/fx9/THUMBNAIL/image/gif/0dfc10913108b69522e00fe5a6f16184/fx9.sml fx9 fx9.sml sml 2509 81 219 IMAGE-THUMBNAIL 1-s2.0-S1381116914002672-fx8.sml https://s3.amazonaws.com/prod-ucs-content-store-us-east/content/pii:S1381116914002672/fx8/THUMBNAIL/image/gif/9979829828d9e229fd286b7b28133084/fx8.sml https://s3-eu-west-1.amazonaws.com/prod-ucs-content-store-eu-west/content/pii:S1381116914002672/fx8/THUMBNAIL/image/gif/9979829828d9e229fd286b7b28133084/fx8.sml fx8 fx8.sml sml 1535 26 219 IMAGE-THUMBNAIL 1-s2.0-S1381116914002672-fx7.sml https://s3.amazonaws.com/prod-ucs-content-store-us-east/content/pii:S1381116914002672/fx7/THUMBNAIL/image/gif/71e819f079f5f1050d491f269df0faea/fx7.sml https://s3-eu-west-1.amazonaws.com/prod-ucs-content-store-eu-west/content/pii:S1381116914002672/fx7/THUMBNAIL/image/gif/71e819f079f5f1050d491f269df0faea/fx7.sml fx7 fx7.sml sml 2181 70 219 IMAGE-THUMBNAIL 1-s2.0-S1381116914002672-fx6.sml https://s3.amazonaws.com/prod-ucs-content-store-us-east/content/pii:S1381116914002672/fx6/THUMBNAIL/image/gif/62ca227bc5fd7fd3ec163cd557d80ffa/fx6.sml https://s3-eu-west-1.amazonaws.com/prod-ucs-content-store-eu-west/content/pii:S1381116914002672/fx6/THUMBNAIL/image/gif/62ca227bc5fd7fd3ec163cd557d80ffa/fx6.sml fx6 fx6.sml sml 2337 64 219 IMAGE-THUMBNAIL 1-s2.0-S1381116914002672-fx5.sml https://s3.amazonaws.com/prod-ucs-content-store-us-east/content/pii:S1381116914002672/fx5/THUMBNAIL/image/gif/ab349c1291b46d82842a9fef1a2cf727/fx5.sml https://s3-eu-west-1.amazonaws.com/prod-ucs-content-store-eu-west/content/pii:S1381116914002672/fx5/THUMBNAIL/image/gif/ab349c1291b46d82842a9fef1a2cf727/fx5.sml fx5 fx5.sml sml 1566 32 219 IMAGE-THUMBNAIL 1-s2.0-S1381116914002672-fx4.sml https://s3.amazonaws.com/prod-ucs-content-store-us-east/content/pii:S1381116914002672/fx4/THUMBNAIL/image/gif/2393b4dda5975c51b5a65246e9c1d886/fx4.sml https://s3-eu-west-1.amazonaws.com/prod-ucs-content-store-eu-west/content/pii:S1381116914002672/fx4/THUMBNAIL/image/gif/2393b4dda5975c51b5a65246e9c1d886/fx4.sml fx4 fx4.sml sml 2381 65 219 IMAGE-THUMBNAIL 1-s2.0-S1381116914002672-fx3.sml https://s3.amazonaws.com/prod-ucs-content-store-us-east/content/pii:S1381116914002672/fx3/THUMBNAIL/image/gif/0ec49b5a9213e28a3d6467343f55a181/fx3.sml https://s3-eu-west-1.amazonaws.com/prod-ucs-content-store-eu-west/content/pii:S1381116914002672/fx3/THUMBNAIL/image/gif/0ec49b5a9213e28a3d6467343f55a181/fx3.sml fx3 fx3.sml sml 1442 22 219 IMAGE-THUMBNAIL 1-s2.0-S1381116914002672-fx2.sml https://s3.amazonaws.com/prod-ucs-content-store-us-east/content/pii:S1381116914002672/fx2/THUMBNAIL/image/gif/d898d8e9ab625947691cbd5f08bfb574/fx2.sml https://s3-eu-west-1.amazonaws.com/prod-ucs-content-store-eu-west/content/pii:S1381116914002672/fx2/THUMBNAIL/image/gif/d898d8e9ab625947691cbd5f08bfb574/fx2.sml fx2 fx2.sml sml 1726 48 219 IMAGE-THUMBNAIL 1-s2.0-S1381116914002672-fx11.sml https://s3.amazonaws.com/prod-ucs-content-store-us-east/content/pii:S1381116914002672/fx11/THUMBNAIL/image/gif/8bd9cd5dad913af95560e1ea2df9959d/fx11.sml https://s3-eu-west-1.amazonaws.com/prod-ucs-content-store-eu-west/content/pii:S1381116914002672/fx11/THUMBNAIL/image/gif/8bd9cd5dad913af95560e1ea2df9959d/fx11.sml fx11 fx11.sml sml 1512 53 219 IMAGE-THUMBNAIL 1-s2.0-S1381116914002672-fx10.sml https://s3.amazonaws.com/prod-ucs-content-store-us-east/content/pii:S1381116914002672/fx10/THUMBNAIL/image/gif/60304ccc2675a854f5cbb167f88f96f0/fx10.sml https://s3-eu-west-1.amazonaws.com/prod-ucs-content-store-eu-west/content/pii:S1381116914002672/fx10/THUMBNAIL/image/gif/60304ccc2675a854f5cbb167f88f96f0/fx10.sml fx10 fx10.sml sml 1548 20 219 IMAGE-THUMBNAIL 1-s2.0-S1381116914002672-fx1.sml https://s3.amazonaws.com/prod-ucs-content-store-us-east/content/pii:S1381116914002672/fx1/THUMBNAIL/image/gif/9f6586d7d0e63c971d58daf7172f9dc9/fx1.sml https://s3-eu-west-1.amazonaws.com/prod-ucs-content-store-eu-west/content/pii:S1381116914002672/fx1/THUMBNAIL/image/gif/9f6586d7d0e63c971d58daf7172f9dc9/fx1.sml fx1 true fx1.sml sml 1456 88 219 IMAGE-THUMBNAIL 1-s2.0-S1381116914002672-mmc1.pdf https://s3.amazonaws.com/prod-ucs-content-store-us-east/content/pii:S1381116914002672/mmc1/MAIN/application/pdf/933286b73d438be0ec0277a02a2aa0a6/mmc1.pdf https://s3-eu-west-1.amazonaws.com/prod-ucs-content-store-eu-west/content/pii:S1381116914002672/mmc1/MAIN/application/pdf/933286b73d438be0ec0277a02a2aa0a6/mmc1.pdf mmc1 mmc1.pdf pdf 124264 APPLICATION MOLCAA 9157 S1381-1169(14)00267-2 10.1016/j.molcata.2014.06.016 Elsevier B.V. Fig. 1 TEM image of palladium (II) acetate@PhSiO2. Fig. 2 Comparison of (a) catalyst/ligand precursors immobilized on hydrophobically modified PhSiO2 surface in coupling of bromobenzene with styrene and (b) catalyst/substrate interactions (1.34mmol alkene, 1.5mmol PhX, 0.276gK2CO3, 15mg PdX2@PhSiO2, 46mL microemulsion, 80°C, AA=acrylic acid). Fig. 3 Comparison of commercial and sol–gel immobilized catalysts (a) bromobenzene/styrene and (b) iodobenzene/styrene (1.34mmol alkene, 1.5mmol PhX, 0.276gK2CO3, 15mg PdX2@support, 46mL microemulsion, 80°C). Fig. 4 Influence of HLB values of surfactants on the conversion of the Heck reaction (1.34mmol styrene, 1.5mmol bromobenzene, 0.276gK2CO3, 15mg Pd(OAc)2@PhSiO2, 46mL microemulsion, 80°C). Fig. 5 Influence of the hydrophobicity of the sol–gel support on the catalytic activity (1.34mmol styrene, 1.5mmol bromobenzene, 0.276gK2CO3, 15mg Pd(OAc)2@support, 46mL microemulsion, 80°C). Fig. 6 Comparison of homogeneous and heterogeneous catalyzed Heck reactions in microemulsion (a) X styrene-t-curve (80°C), (b) Arrhenius plot (1.34mmol styrene, 1.5mmol PhBr, 0.276gK2CO3, 15mg Pd(OAc)2@PhSiO2 or 15mg homogeneous Pd(OAc)2, 46mL microemulsion). Fig. 7 Recycling of sol–gel immobilized catalyst for (a) iodobenzene, styrene, Pd(OAc)2@PhSiO2; (b) bromobenzene, styrene, Pd(OAc)2@OcSiO2; (c) bromobenzene, styrene, Pd(OAc)2@PhSiO2 (1.34mmol activated alkenes, 1.5mmol aryl halides, 0.276gK2CO3, Pd(OAc)2@R1SiO2, 46mL microemulsion, 80°C). Scheme 1 Mechanism of the sol–gel supported catalysis in microemulsion as reaction medium. Scheme 2 Heck reaction. Scheme 3 Entrapment of catalyst into sol–gel matrix with R1 =Ph or Oc and R=Et or Me. Scheme 4 Product and catalyst separation. Table 1 Specific surface areas A of supported palladium catalysts. Catalyst Support A [m2/g] Pd(OAc)2 PhSiO2 225.0 PhSiO2 249.7 Pd(OAc)2 a PhSiO2 110.2 Pd(OAc)2 b PhSiO2 66.7 Pd(OAc)2 OcSiO2 22.8 OcSiO2 4.2 Pd(OAc)2 SiO2 338.2 SiO2 386.5 PdBr2 PhSiO2 216.3 Pd c SiO2 254.7 Pd c C 792.6 Pd c Al2O3 160.9 a TPPTS as ligand. b Xantphos as ligand. c Commercial catalyst. Table 2 Structures and characteristic properties of the surfactants. Surfactant Structure Type cmc [gL−1] [43,44] d micelle [nm] [43,44] SDS Anionic 2.250 2.06 CTAB Cationic 0.330 5.39 (4.3) [45] Triton TX-100 Nonionic 0.325 8.68 TTAB Cationic 1.344 3.84 [45] Igepal CA-520 Nonionic DSS Anionic 1.267 [46] DTAB Cationic 4.330 3.34 [45] Marlipal 24/60 Nonionic 0.012 Brij®35 Nonionic 0.016 7.94 Table 3 Substrate variation a . Entry X Y W Product Reaction time t (min) Yield Y (%) 1 Cl H -COOH Cinnamic acid 429 70 2 Br H -COOH Cinnamic acid 396 76 3 I H -COOH Cinnamic acid 359 98 4 I Br -COOH 4-Bromocinnamic acid 513 77 5 Br H -COOMe Trans-methylcinnamate 372 45 6 I H -COOMe Trans-methylcinnamate 407 72 7 Br H -COOCH2-CH(Et)(Bu) 2-Ethylhexylcinnamate 359 64 8 I H -COOCH2-CH(Et)(Bu) 2-Ethylhexylcinnamate 451 82 9 Br H α-Me-COOH α-Methylcinnamic acid 389 64 10 I H α-Me-COOH α-Methylcinnamic acid 477 62 11 Br H α-Me-COOMe Methyl-(E)-α-methylcinnamate 339 46 b 12 I H α-Me-COOMe Methyl-(E)-α-methylcinnamate 435 54 b 13 Br H α-Me-COOtBu (E)-tButyl-2-methyl-3-phenylacrylate 387 45 14 I H α-Me-COOtBu (E)-tButyl-2-methyl-3-phenylacrylate 422 89 15 Br H α-Me-COO(CH2)2-OH 2-Hydroxyethyl-(E)-α-methylcinnamate 407 50 16 I H α-Me-COO(CH2)2-OH 2-Hydroxyethyl-(E)-α-methylcinnamate 485 70 17 Cl H Ph- Trans-stilbene 327 62 18 Br H Ph- Trans-stilbene 555 100 19 I H Ph- Trans-stilbene 480 94 20 I Br Ph- 4-Trans-bromostilbene 398 89 21 Br Ortho-NH2-CH2-Ph- Ph- 4-[(1E)-2-(phenyl)ethenyl]-benzenemethanamine 458 57 22 Cl Ortho-CN-Ph- Ph- 2-Trans-cyanostilbene 433 41 23 Br Ortho-CN-Ph- Ph- 2-Trans-cyanostilbene 393 59 24 Cl Ortho-Me-Ph- Ph- Trans-2-methylstilbene 477 44 25 Cl Ortho-Me-Ph- Ph- 2,6-Trans-dimethylstilbene 367 55 26 Cl MeOCPh- Ph- 4-Trans-acetylstilbene 444 65 27 Br MeOCPh- Ph- 4-Trans-acetylstilbene 446 60 28 Cl Styrene Ph- Distyrylbenzene 419 0 29 Br Styrene Ph- Distyrylbenzene 448 20 30 Br H Para-Cl-Ph- 4-Trans-chlorostilbene 371 50 31 I H Para-Cl-Ph- 4-Trans-chlorostilbene 415 92 32 Br H α-Me-Ph- α-Methylstilbene 377 32 b 33 I H α-Me-Ph- α-Methylstilbene 318 65 b a Reaction conditions: 1.5mmol olefine, 1.34mmol alkene or styrene, 2mmolK2CO3, 1.25wt% Pd(OAc)2@ PhSiO2 (0.067mmol Pd(OAc)2), 46mL microemulsion (3.3wt% CTAB, 89.3wt% H2O, 6.6wt% propanol), 80°C. b 1:1 product: terminal olefine Table 4 Weisz-modulus for the Pd(OAc)2 catalysts immobilized on silica. Material D eff, styrene [cm2 s−1] r 0 [moll−1 ·s−1] Weisz-Modulus Ψ Pd(OAc)2@SiO2 6.0×10−10 7.5×10−7 4 Pd(OAc)2@PhSiO2 1.2×10−9 2.3×10−6 3 Pd(OAc)2@OcSiO2 3.6×10−9 3.0×10−6 5 Table 5 Catalyst leaching into the reaction solution. Catalyst precursor Support g Pd ( OAc ) 2 / g support d , e [%] Leaching after reaction m Pd ( OAc ) 2 in solution/m Pd ( OAc ) 2 catalyst e [%] Pd(OAc)2 PhSiO2 1.2 0.010–0.012 PdBr2 PhSiO2 1.2 0.031–0.077 Pd(OAc)2 a PhSiO2 1.2 0.062 (5.475 ligand) Pd(OAc)2 b PhSiO2 1.2 0.068 (7.800 ligand) Pd(OAc)2 OcSiO2 1.2 0.013 Pd(OAc)2 SiO2 1.2 0.013 Pd c SiO2 5.0 0 Pd c Charcoal 10.0 0 Pd c Al2O3 1.0 0 a TPPTS. b Xantphos. c Commercial catalyst. d Determined by microwave decomposition. e Palladium and ligand amount determined from ICP measurements. Table 6 Effect of reaction media on the Heck coupling of bromobenzene and styrene. Solvent Catalyst Base T [°C] X [%] t [min] Ref. MeOH a Pd(OAc)2@PhSiO2 K2CO3 80 10 438 MeOH a , b Pd(OAc)2@PhSiO2 K2CO3 80 31 380 DMF a Pd(OAc)2@PhSiO2 K2CO3 80 30 433 DMF PdCl2@zeolite K2CO3 153 74 150 [1] NMP Pd@hydroxyapatite K2CO3 130 94 1440 [47] DMF a , b Pd(OAc)2@PhSiO2 K2CO3 80 17 1335 DMF a , c Pd(OAc)2@PhSiO2 K2CO3 80 2 1334 ACN/H2O (1:1) a Pd(OAc)2@PhSiO2 K2CO3 80 45 420 H2O a Pd(OAc)2@PhSiO2 K2CO3 80 88 420 H2O e Pd@polystyrene KOH 90 10 1320 [48] 10g/L CTAB/H2O a Pd(OAc)2@PhSiO2 K2CO3 80 100 420 70g/L SDS/H2O a Pd(OAc)2@PhSiO2 K2CO3 80 50 360 CTAB/H2O e Pd@C K2CO3 80 60 240 [6] CTAB/propanol/H2O a , d Pd(OAc)2@PhSiO2 K2CO3 80 100 420 TX-100/H2O/[BMIM]PF6 e PdCl2 NEt3 100 100 120 [49] a Reaction conditions: 1.5mmol bromobenzene, 1.34mmol styrene, 2mmolK2CO3, 1.25wt% Pd(OAc)2@PhSiO2 (0.067mmol Pd(OAc)2), V =46mL, 80°C. b TPPTS. c Xantphos. d 3.3wt% CTAB, 89.3wt% H2O, 6.6wt% propanol. e Iodobenzene and styrene as reactants. Investigation of sol–gel supported palladium catalysts for Heck coupling reactions in o/w-microemulsions I. Volovych a Y. Kasaka a M. Schwarze a ⁎ Z. Nairoukh b J. Blum b M. Fanun c D. Avnir b R. Schomäcker a a Institute of Chemistry, Berlin Institute of Technology, Straße des 17, Juni 124, D-10623 Berlin, Germany Institute of Chemistry, Berlin Institute of Technology Straße des 17, Juni 124 Berlin D-10623 Germany b Institute of Chemistry, The Hebrew University, Jerusalem 91904, Israel Institute of Chemistry, The Hebrew University Jerusalem 91904 Israel c Center for Colloid and Surface Research, Al-Quds University, East Jerusalem 51000, Palestinian Authority Center for Colloid and Surface Research, Al-Quds University East Jerusalem 51000 Palestinian Authority ⁎ Corresponding author. Tel.: +49 3031424097; fax: +49 3031421595. Graphical abstract Sol–gel supported palladium catalysts are investigated for the Heck coupling reaction between styrene and iodo-/bromobenzene to trans-stilbenes in o/w-microemulsions as alternative reaction medium. High conversions and selectivities are obtained with these catalysts and they show better catalytic performance than their commercial analogs Pd@SiO2 or Pd/C. The influence of the catalyst structure on the activity is investigated in detail showing mass transport limitations that can be optimized by the palladium loading. The catalyst is recyclable >6 times with negligible palladium leaching into the solution. Because of the good recyclability under retention of activity and selectivity, the influence of transport limitations is suppressed and the total catalyst efficiency is increased to more than 2. Keywords Heck coupling Microemulsion Palladium acetate Sol–gel method Trans-stilbene 1 Introduction A general trend in catalysis is the immobilization of homogenous catalyst complexes or metal nanoparticles on solid supports in order to obtain high turnover numbers by facilitating the catalyst recycling. The recycling becomes more important with increasing catalyst costs and decreasing catalytic activity. Especially in important organic transformations, e.g. coupling reactions, an active and stable supported catalyst would allow for continuous reaction processes and definitively lead to higher added values. An often investigated coupling reaction is the Heck reaction and as supported catalysts highly active zeolite PdCl2-CsX [1] or Pd-NaY [2], magnetically recyclable palladium nanoparticles [3–5], palladium immobilized on carbon [6] or on different modified silica's [7–9] have been investigated. The main criteria for the selection of support materials are the activity of the prepared catalysts and the extent of leaching of the active component into the reaction solution. For example, palladium catalysts immobilized on zeolite are more active than on silica, but they show higher leaching [10]; therefore, silica is often used as support material. Rhodium and palladium catalysts immobilized on silica via the sol–gel method can be used in a variety of catalytic reactions including hydrogenation [11], hydroformylation [12,13], disproportionation [14], isomerization [15], aldehyde decarbonylation [16] and coupling reactions [17], and almost all cases the catalyst retained its activity in consecutive runs. Not only the structure and morphology of the heterogeneous catalyst is responsible for its activity but also the choice of the solvent. Commonly organic solvents are applied as typical reaction medium, but in the recent years the use of aqueous solutions as solvents has increased [6,18–20] due to the more environmentally friendly properties of water. Unfortunately, reactions with hydrophobic reactants, as used in Heck reactions, cannot be performed in water due to the low solubility of the reactants. For this reason the addition of solubilizers is recommended. Typical solubilizers are surfactants. At concentrations above the critical micelle concentration (cmc), the surfactants form micelles, large supramolecular aggregates which consist of hydrophilic head groups directed to water and hydrophobic cores able to solubilize the hydrophobic reactants and the resulting products. In this contribution we perform Heck reactions in a surfactant system with sol–gel supported catalysts. The mechanism of a heterogeneously catalyzed reaction in micellar systems is complicated due to the inhomogeneous distribution of the reactants within the micro-heterogeneous reaction medium. Therefore many factors influence the course of the reaction. From Scheme 1 it can be primarily expected that the structure of the sol–gel immobilized catalyst influences the reaction rate. The structure depends on the nature of entrapped metal nanoparticles, the gel-building agent and on the modification of the support surface. Additionally, the choice of the solvent (surfactant, cosurfactant) and substrate type is crucial for optimizing the reaction conditions. In this contribution we apply sol–gel supported palladium catalysts and study the influence of the support materials, catalyst precursors, surfactants, solvents and substrates on the activity and selectivity of the Heck reaction of halobenzene and styrene (Scheme 2 ). The more thermodynamically stable E-(trans)-stilbene product is favored (>99%) which can be applied further for the synthesis of fine chemicals, e.g. resveratrol [21,22]. Furthermore, for a detailed comparison, unsupported palladium catalysts are investigated for the same reaction. Finally, the heterogeneity of the supported catalysts, the influence of the pore structure and their recycling behavior are studied. 2 Experimental 2.1 Chemicals 2-Bromobenzonitrile, 2-chlorotoluene, methylcinnamate, trans-α-methylstilbene, palladium on silica powder (Pd@SiO2, 5wt% Pd) and palladium(II) bromide (PdBr2) were purchased from abcr GmbH & Co. KG Karlsruhe/Germany. 1-(Tetradecyl)trimethylammonium bromide (TTAB) was obtained from Alfa Aesar Company Karlsruhe/Germany. Sodium dodecylsulfate (SDS) was obtained from AppliChem GmbH Darmstadt/Germany. 30mol-% 3,3′,3″-phosphinidynetris(benzenesulfonic acid) trisodium salt solution (TPPTS) was obtained from Celanese Corporation Irving/USA. Cinnamic acid (CA), 2-ethylhexylacrylate and styrene were purchased from Fluka. Acrylic acid (AA), polyoxyethylen (23) laurylether (Brij®35) and palladium on activated carbon (Pd@C, 10wt% Pd) were ordered from Merck KGaA Darmstadt/Germany. Acetonitril (ACN), dimethyl formamide (DMF) and water (HPLC grade) were purchased from Carl Roth GmbH & Co. KG Karlsruhe/Germany. Marlipal 24/60 was provided from Sasol Germany GmbH Marl/Germany. α-Methylstyrene, 4-bromoacetophenone, bromobenzene (PhBr), 4-bromobenzylamine, 1-bromo-4-iodobenzene (IPhBr), tert-butylmethacrylate, 4-chloroacetophenone, chlorobenzene (PhCl), 2-chloro-benzonitrile, 2-chloro-1,3-dimethylbenzene, 1-chloro-2-nitrobenzene, 4-chlorostyrene, trans-4-chlorostilbene, dodecyltrimethylammonium bromide (DTAB), hexadecyltrimethyl-ammonium bromide (CTAB), 2-hydroxyethylmethacrylate, IGEPAL CA-520, iodobenzene (PhI), palladium (1000mg/L) and phosphor (1000mg/L) ICP standard solutions, methacrylic acid, methylacrylate, α-methylcinnamic acid, methylmethacrylate, methyl-α-methyl-cinnamate, palladium on alumina powder (Pd@Al2O3, 1wt%), palladium(II) acetate (Pd(OAc)2), poly(4-vinylpyridine) (PvyPy), potassium carbonate (K2CO3), tetramethyl orthosilicate (TMOS), trans-stilbene, triethoxyphenylsilane (PhSi(OEt)3), trimethoxy(octyl)-silane (OcSi(OMe)3), dioctyl sodium sulfosuccinate (DSS), Triton X-100 (TX-100) and 4,5-bis(diphenylphosphino)-9,9-dimethylxanthene (Xantphos) were obtained from Sigma–Aldrich Company Munich/Germany. Trans-4-bromostilbene and trans-4-chlorostilbene were purchased from TCI Europe Eschborn/Germany. 2.2 Synthesis of sol–gel supported palladium catalysts The synthesis is comparable to the procedure reported by Rozin-Ben Baruch et al. [17]. Entrapment of the catalyst within hydrophobic silica sol–gel matrix was carried out as follows: trimethoxy(octyl)silane (2.1mL, 9.877mmol) or triethoxyphenylsilane (1.612mL, 6.680mmol) was hydrolized in 0.4mL distilled water and 4.25mL methanol or ethanol for 24h. Then separately a solution of tetramethyl orthosilicate (3.6mL, 22.961mmol) was stirred in 2.4mL methanol and 2mL water for 20min. Both solutions were combined and stirred for another 30minutes to produce the hydrophobically modified silane. Palladium(II) acetate (30mg, 0.134mmol) or palladium(II) bromide (35mg, 0.134mmol) was dissolved in 4mL dichloromethane and stirred for 20minutes. After this step, the catalyst solution was combined with the solution of the hydrophobically modified silane and the mixture was shaken until gelation. Thereafter, the gel was first dried for 4–6h at 80°C and then it was dried for another 8–10h at 80°C and 103 Pa to remove the solvents. The catalyst was washed carefully with boiling dichloromethane and dried again at 80°C and 103 Pa for 8–10h. After the immobilization procedure about 2.2–2.4g of black-colored sol–gel supported palladium catalyst was obtained. Palladium catalyst immobilized on hydrophilic support was prepared without addition of trimethoxy(octyl)silane or triethoxyphenylsilane to the hydrolyzed tetramethyl orthosilicate solution. For the immobilization of palladium catalysts in the presence of phosphine ligands (1:1 ratio) the following modification was done: palladium acetate (11.8mg, 0.052mmol) and Xantphos (30.420mg, 0.052mmol) or TPPTS (0.508g, 0.052mmol) were mixed with 4mL dichloromethane and stirred for 6h. 2.3 Reaction procedure A typical Heck reaction was performed in a double walled glass reactor with reflux condenser at ambient pressure. 153μL (1.34mmol) alkene (e.g. styrene) and 158μL (1.50mmol) aryl halide (e.g. iodobenzene) were dissolved in 46mL organic solvent or aqueous microemulsion in the presence of 0.276g (2.00mmol)K2CO3 as base and stirred at desired reaction temperature.1.2–1.4g of the immobilized catalyst containing 15mg (0.067mmol) Pd(OAc)2 on silica was added to the reaction mixture and the reaction was started. For the Heck reaction with homogeneous catalyst only 15mg (0.067mmol) of palladium (II) acetate was added. The reaction progress was monitored by measuring the reactant concentrations at different reaction times by high performance liquid chromatography (HPLC). The used one phase microemulsion consists of CTAB (1.510g, 3.3wt%) as surfactant, 1-propanol (3.020g, 6.6wt%) as cosurfactant, H2O (40.855g, 89.3wt%) and organic substrates e.g. iodobenzene and styrene (2.84mmol, 0.8wt%). The composition of the microemulsion is usually described by the parameters α (oil ratio), γ (surfactant ratio) and δ (cosurfactant ratio). For the used microemulsions α, γ and δ were 0.9wt%, 9.9wt% and 66.7wt%, respectively. For the calculation of the parameters, Eqs. (1)–(3) were used. (1) α = m o i l m o i l + m H 2 O (2) γ = m surfactant + m cosurfactant m surfactant + m cosurfactant + m H 2 O + m o i l (3) δ = m cosurfactant m surfactant + m cosurfactant The conversions of reactants and yields of the products were calculated from the concentrations determined by HPLC analysis using the following equations: (4) c o n v e r s i o n X ( t ) = c o , s t y r e n e − c t , s t y r e n e c o , s t y r e n e ⋅ 100 (5) y i e l d Y ( t ) = c t , s t i l b e n e / M s t i l b e n e c o , s t y r e n e / M s t y r e n e ⋅ 100 The amount of catalyst and ligand that leached from the immobilized catalyst into the reaction mixture after the coupling reaction was measured by ICP. The formed trans-stilbene was separated from the microemulsion by extraction with heptane or dichloromethane, followed by solvent evaporation. 2.4 Instruments The dissolution of palladium from the silica support was carried out by microwave decomposition (p =20×105 Pa, t =35min and T =200°C) with a CEM Discover SP-D (sample preparation−digestion) instrument (CEM GmbH, Camp-Lintfort/Germany). Before this procedure, the catalysts were ball milled and mixed with 12mL of a HNO3/HCl/H2SO4 solution (2eq/6eq/4eq). After the microwave treatment, the solid white silica was removed by filtration and the residual solution was analyzed for palladium or/and phosphorus contents using a Varian 715-ES Optical Emission Spectrometer (ICP-OES). Calibration of the instrument was performed with commercial palladium and phosphorus standards. The compositions of samples withdrawn from the reaction mixture were determined by HPLC using an Agilent instrument with 250×4mm chromatographic column Multospher 120 RP18-5μ from Ziemer Chromatographie Langerwehe/Germany. A mixture of acetonitrile/water (70vol%/30vol%) was used as eluent, the flow-rate was 1mL/min, wavelengths were λ =225nm and 275nm, t measurement =11min, T =25°C and injection volume was 10μL. Specific surface area and pore size distribution of sol–gel immobilized and commercial palladium catalysts were obtained by N2 adsorption measurements (N2-BET) using a Micromeritics Gemini 1325 instrument. Transmission electron microscopy was performed with a conventional LaB6-TEM Tecnai G220 S-TWIN instrument (FEI Company, USA) operated at 200kV and equipped with EDAX-EDS for identification of elemental compositions. High resolution XPS measurements were performed with a Kratos Axis ultra X-ray photoelectron spectrometer for the determination of the oxidation state of palladium. The spectra were acquired with monochromatic AlKα (1486.7eV) X-ray source with 0° take off angle. The pressure in the test chamber was maintained at 1.99×10−7 Pa during the acquisition process. Data analysis was performed with Vision processing data reduction software (Kratos Analytica Ltd. and Casa SPX Software Ltd.). The size of palladium particles and the structure of the palladium acetate immobilized on PhSiO2 were determined by X-ray diffraction measurements (XRD) in X-ray apparatus (D8 Bruker Advance) with KFL Cu 2k X-ray tube as source and Lyux Eye Detector. The samples were previously dried and pulverized. Effective diffusion coefficients D eff were determined by a method used for porous materials in the construction chemistry [23]. For this purpose the immobilized catalysts were stored in an aqueous SrCl2 solution for 24h under N2. Then they were filtered and placed in a stirred glass reactor with pure water. The increase in electrical conductivity κ(t) due to the diffusion of the salt ions out of the pores into the solution was measured at 25°C. The measured diffusion coefficient D (Eq. (6)) was calculated from the slope m (Eq. (7)) of the semilogarithmic plot (see Fig. S2b in Supporting Information) of the relative conductivity change against time, where r is radius of the catalyst nanoparticles: (6) D = m ⋅ r 2 π 2 (7) m = d ln ( ( κ ( t ) − κ e n d ) / ( κ O − κ e n d ) ) d t 3 Results 3.1 Catalyst characterization The mechanism of the sol–gel process was considerably described in the literature by Avnir [24], Landau [25] and Schmidt [26]. In our case palladium precursor was entrapped into a hydrophobically modified silane matrix, which was formed from a mixture of the hydrolized hydrophilic tetramethyl orthosilicate and hydrophobic triethoxyphenyl- or trimethoxyoctyl-silane according to the steps shown in Scheme 3 . During the catalyst entrapment, red palladium (II) species turned in black palladium (0) nanoparticles. Measurements were done to analyze the oxidation state of the immobilized palladium catalyst. Binding energy peaks at 335eV and 340.471eV were detected, which are characteristic for 3d5/2 and 3d3/2 Pd(0) species. The resulting palladium acetate loading on support material was 0.8–1.1wt% and was determined from microwave decomposition of the catalyst followed by ICP measurements. No leaching of the palladium was detected after the washing steps with dichloromethane. From these results the immobilization efficiency η immobilization of the catalyst can be estimated to be 1. Specific surface areas of all catalysts are shown in Table 1 . For the hydrophobic surface modification essentially phenyl groups were chosen to provide a good compatibility with the aromatic reactants. Octyl modified and unmodified catalysts were prepared for comparison studies. From Table 1 it can be seen that BET surface areas of sol–gel immobilized catalysts are in the range 200–300m2/g. The average pore size of the immobilized palladium catalyst was ≤2nm and pore volume V pore ≈0.176g/cm3. Only for OcSiO2, Pd(OAc)2@ OcSiO2 and in the presence of phosphine ligands, the surface areas were significantly decreased. These results can be explained due to the differences in the formed structures of sol–gel materials containing octyl moieties [27]. Transmission electron microscopy image of the immobilized Pd(OAc)2 catalyst is shown in Fig. 1 . The catalyst has many small pores with an average pore diameter of 1–5nm as it was already seen from the BET measurements. The entrapped palladium nanoparticles with the metallic fcc structure were identified from the XRD patterns (see Fig. S1 in Supporting Information). From line shape analysis an average diameter for the Pd particles of 3.0±0.3nm was derived with the Scherrer equation. 3.2 Catalytic activity of the sol–gel immobilized palladium composites To optimize the reaction conditions, Heck coupling of bromobenzene and styrene to trans-stilbene was performed with heterogeneous sol–gel immobilized palladium catalysts prepared from different orthosilicate precursors (Fig. 2a). In comparison to Pd(OAc)2, the reaction rate with PdBr2 as precursor was slower by a factor of about 2. No improvement of the catalytic performance was obtained when the palladium catalysts were modified with water soluble ligand TPPTS or with Xantphos. The decrease in activity by using a metal-ligand complex can be explained by hindered access of reactants or retarded catalyst dynamics due to the large structure inside the pores of the catalyst. The ligand modified catalysts were also not very stable and ligand leaching into the solutions occurred. Catalysts prepared from PdBr2 or Pd(OAc2) as precursor were also tested for the coupling of more reactive iodobenzene with styrene or acrylic acid (Fig. 2b). In contrast to bromobenzene, similar conversions were obtained in the coupling reaction with iodobenzene regardless the used precursor. The lower reaction rate for the coupling of bromobenzene with styrene catalyzed by PdBr2@PhSiO2 can be explained by a lower reactivity of the bromobenzene. The commercial catalysts tested in this reaction were very stable and no metal leaching was detected. However, the coupling of bromobenzene and styrene with these catalysts was very slow in comparison to the sol–gel immobilized catalysts (Fig. 3a). These commercial catalysts are commonly applied for the hydrogenations of unsaturated substrates and are not suitable for the coupling reactions. The same catalysts were tested for the coupling of more reactive iodobenzene and styrene. The results are shown in Fig. 3b. Here, we found that the reaction rates with commercial catalysts were much higher than in the Heck coupling of bromobenzene and styrene. The reaction rate with Pd@Al2O3 as catalyst was comparable to the sol–gel immobilized catalyst. Therefore, the commercial catalysts can be applied for Heck reaction. However, the reaction rate mainly depends on the type of substrate. Furthermore, their reactivity is lower compared to the hydrophobically modified sol–gel catalysts. The strong difference in the behavior of the commercial catalysts with certain substrates is unexpected and very difficult to predict. 3.3 Effect of the surfactant As it was shown in Scheme 1, beside the parameters determined by the preparation of the sol–gel immobilized Pd catalyst also the selected solvent is important for the total catalytic performance. In Section 3.2 we studied the influence of the Pd precursor and silica support, and we could find optimized conditions with respect to the catalyst synthesis. For the solubilization of the hydrophobic reactants in an aqueous environment, surfactants can be used. The interactions between the silica support and formed micellar aggregates will also affect the reaction rate. Therefore, Heck reaction was investigated in aqueous microemulsions with different anionic, nonionic and cationic surfactants. Their structures, critical micelle concentrations (cmc) and the average diameter of the micelles (d micelle) measured in aqueous-micellar solutions are given in the Table 2 . All microemulsions were transparent and homogeneous except microemulsions containing DSS or Igepal CA-520 as surfactant. As can be seen from Fig. 4 , a broad variety of surfactants can be applied for the formulation of the reaction medium. Full conversion was obtained after 6–7h with cationic CTAB, nonionic Triton TX-100 and anionic SDS as surfactants. The conversion increases with increasing C-chain length, decreasing HLB-value (hydrophilic–lipophilic balance) and decreasing cmc, if homologue series of cationic surfactants CTAB, TTAB and DTAB were used: C16 >>C14 ≈C12. The most hydrophobic surfactant CTAB is preferred because of the more hydrophobic micelle cores (d micelle ) and largest storage capacity for the substrates. Predictions cannot be done for the behavior of the other not homologue surfactants in this reaction because of their different structures. There is also no dependence on the type of the surfactant and the reaction rate. 3.4 Substrates To extend the scope of the protocol, we applied the palladium(II) acetate immobilized on hydrophobically modified silica catalyst to screen for a wide variety of substrates. A screening of aryl halides Y-Ph-X shows that this catalytic system is suitable for all kinds of aryl halide. It results in the expected ranking with higher reactivity of iodobenzene than bromobenzene, 1-bromo-4-iodobenzene (with 4-bromo-trans-stilbene as product) and lowest reactivity of less active chlorobenzene as can be seen from Table 3 . These results are typical for the reaction of aryl halide with styrene (Entry 17–20), acrylic acid (Entry 1–4) and methacrylic acid (Entry 9–10). Because of the mechanistic aspects of Heck coupling, trans-products are favored. The reactivity of styrene is higher than that of 4-chlorostyrene and α-methylstyrene (with terminal olefins as by products 1:1) as shown in Table 3 (Entry 30–33) for the reaction with iodo- and bromobenzene. Also different aromatic ortho- and para- substituted aryl halides Y-Ph-X react with styrene to trans-stilbene derivates. The reactivity decreases if the para-substituted substrates (e.g. para-iodobromobenzene) are applied in the reaction (Table 3 Entry 21–29) and is very small with the ortho-substituted substrates (e.g. ortho-methylchlorobenzene). The reaction rate depends not only on the position of the substituent, but also on the substituent type. Substituents with electron withdrawing groups (e.g. cyano or acetyl group) are more active than these with electron donating groups (e.g. methoxy or methyl group). The nonaromatic acrylic acid shows good reactivity with iodobenzene and its reactivity is comparable to aromatic styrene. The more sterically hindered methacrylic acid and derivates were less reactive (Table 3 entry 5–16) and side-products were formed. The arylation of medically interesting 1,1-substituated olefine like methacrylate or α-methylstyrene can afford different products in dependency of the direction of the β-H-elimination: the main desired product α-methylcinnamate with E- or Z-stereochemistry or a by-product α-benzylacrylate with a terminal double bond. The product and by-product ratio was 1:1. All substrates tested in Heck coupling reaction in aqueous microemulsions show similar reactivities as in commonly used organic solvents, e.g. dimethylformamide or acetonitrile, at higher temperatures. For the following investigations only the reactions of styrene and iodo- or bromobenzene to trans-stilbene were considered. 3.5 Effect of surface modification As shown in Section 3.2, Figs. 2 and 3, various commercial and synthesized palladium catalysts were tested for the Heck coupling. Pd(OAc)2 immobilized on PhSiO2 was the choice of catalyst for further investigations, because of its high stability and reactivity. The influence of different silica support materials on the reaction rate was also studied. In addition to the nonmodified sol–gel prepared from tetramethyl orthosilicate alone, two hydrophobically modified sol–gel matrices were prepared using octyl and phenyl substituted alkoxysilane precursor. The adsorption of the aromatic compounds used in the reaction was stronger if catalysts immobilized on hydrophobic support were used. The inverse adsorption effect was already shown in our previous publication about the enantioselective hydrogenation of itaconic acid and derivates [28]. The hydrogenation of hydrophilic nonaromatic substrates is favored using Rh/BPPM catalysts immobilized on hydrophilically modified sol–gel materials. Whereas the reaction is much slower when performed using hydrophobically modified surfaces. The transport processes of the reactants in the catalyst pores can be described by the diffusion coefficients D eff,tracer which were calculated from diffusion measurements with SrCl2 salts as tracers [29]. From the diffusion coefficients D eff,tracer it is also clear that the adsorption of the substrates on hydrophilic surfaces is smaller than on hydrophobically modified surfaces (see Fig. S2a and b in Supporting Information). The determined diffusion coefficients D eff,tracer show the following ranking: SiO2 (8.1×10−9 cm2 s−1)<OcSiO2 (1.5×10−8 cm2 s−1)≪PhSiO2 (4.7×10−8 cm2 s−1). As shown in Fig. 5 , the hydrophobicity of the sol–gel affects the reaction rate and conversion of the palladium catalyzed coupling of bromobenzene and styrene. The best results were obtained when phenyl moiety was introduced, followed by octyl modified catalyst. The reaction was the slowest when hydrophilic modification was applied. To examine the influence of the diffusion of the reactants inside the catalyst pores on the reaction rate, the ratio of the reaction time constant and the diffusion time constant are estimated and expressed as the Weisz modulus Ψ. This is a characteristic parameter to test for mass transfer limitations on heterogeneously catalyzed reactions and can be calculated using the Weisz–Prater criterion [15,30]: (8) Ψ = L c a t 2 ⋅ n + 1 2 ⋅ r ⋅ ρ c a t c o ⋅ D e f f , s t y r e n e In Eq. (8), L cat is radius of the catalyst nanoparticles, n is reaction order, r is the reaction rate, ρ cat is density of the catalyst, c0 is initial styrene concentration and D eff,styrene is effective diffusion coefficient of styrene. For Ψ ≪1 no diffusion limitation influences the reaction. For our discussion the measured diffusion coefficients D eff,tracer of SrCl2 were transferred in the effective diffusion coefficients of styrene D eff,styrene according to the ratio of the molecular diffusion coefficients at ambient temperature in water (D M,tracer =SrCl2 =1.4×10−4 cm2 s−1 [31] and D M,styrene =styrene=1×10−5 cm2 s−1 [32]): (9) D e f f , s t y r e n e = D M , s t y r e n e ⋅ ε τ (10) ε τ = D e f f , t r a c e r D M , t r a c e r In Eq. (10), ɛ is the porosity of the immobilized catalyst and τ is the tortuosity. The porosity of Pd(OAc)2@PhSiO2 can be calculated from the ratio of pore volume Vpore (BET measurement) to the volume of catalyst resulting in ɛ =33.4%. The tortuosity τ describes the way of the diffusion in the pores of the catalyst and can be determined from Equation 10 (τ =4.689). The pore diameter is 1–2nm. The initial reaction rates using different catalysts were determined according to: (11) r 0 = c 0 ⋅ d X d t The average particle size of 200μm and ρ cat of 1.9g/cm3 were considered for all calculations (Table 4 ). In our case the Weisz modulus was Ψ ≈3 for the heterogeneous reaction with mostly applied Pd(OAc)2@PhSiO2, indicating a substantial limitation of the reaction rate by the diffusion of the reactants inside the pores of the catalyst. This result is also supported by the comparison of the temperature dependency of the heterogeneous and the homogeneous catalysts as will be discussed in Section 3.6. The pore efficiency η pore can be calculated from the Weisz-Prater criterion Ψ for various reaction orders [33]: η pore =1 (for Ψ <1, no diffusion limitations) and η pore = Ψ −1 (for Ψ ≥1, diffusion limited reaction). From the correlation for Ψ ≥1, for the applied Pd(OAc)2@PhSiO2 catalysts a value of about 40% is obtained for ηpore. By decreasing the Pd(OAc)2 loading on silica material from 1.2% to 0.5%, the specific productivity of the palladium was increased by a factor of 2 from 2.5×10−4 to 5×10−4 mol/gPd·min (see Fig.S3 in Supporting Information). 3.6 Kinetics of the reaction The coupling of styrene with bromobenzene or iodobenzene is known to follow a second order reaction rate [34,35]. In our studies the reaction rate also increases linearly with the concentrations of both reactants. The distinction has to be drawn between homogeneously (in situ formed not supported palladium (0) nanoparticles) and heterogeneously catalyzed Heck reaction (Pd(OAc)2 immobilized on silica by a sol–gel method). In comparison to the homogeneously catalyzed reaction, the reaction with sol–gel immobilized catalyst (1.2% Pd(OAc)2 on phenyl modified silica) is slower at the beginning as can be seen from the measurements at 80°C shown in Fig. 6a, but finally proceed to reach a higher conversion than the homogeneous catalyst. This experiment was repeated for temperatures ranging from 50 to 90°C (for both catalysts). Activation energies E A were determined for the coupling of bromobenzene and styrene using homogeneous and heterogeneous catalysts (Fig. 6b) according to Eq. (12): (12) ln ( k ) = − E A R ⋅ T + ln ( k ∞ ) E A, heterogeneous =60.4kJmol−1 E A, homogeneous =74.5kJmol−1 The activation energy of the heterogeneous reaction is lower than that of the homogeneous reaction, because of the diffusion limitation that is much less temperature sensitive than the chemical reaction itself. It is known that for porous heterogeneous catalysts pore diffusion limitations can lead to lower rates in comparison to the homogenously catalyzed reaction. By adjusting the catalyst size (smaller particles) or temperature (lower temperatures) it is possible to suppress the diffusion limitation effect because the reaction rate is no longer limited to the rate for the transport of reactants. In this case, the catalyst efficiency is comparable to the homogenous catalyst. For supported metal catalysts, in which a metal is the active material, it is possible that the reaction rate remains lower even if diffusion limitation is eliminated because some of the metal can be intercalated and not be available for the reactants. By comparison of the reaction rates for the supported and unsupported catalysts, done in the kinetically controlled regime, the impact of intercalation was calculated to be η intercalation =0.81. 3.7 Catalyst recycling The recycling experiments were carried out for the coupling of bromobenzene or iodobenzene with styrene to produce trans-stilbene. Palladium(II)acetate catalysts immobilized on hydrophobic octyl or phenyl modified silica supports could be recycled 6 times without any significant decrease in activity (Fig. 7 ). Only small amount of palladium leaching into the solution was detected by ICP measurements after each reaction as can be seen in Table 3 and no leaching was detected after second and the following recycling steps. Different tests were performed to check if the active catalyst is indeed heterogeneous. First the hot filtration of the catalyst after obtaining a conversion of about 50% was done. Thereafter, the reaction was continued with the residual solution. No further conversion was observed in the reaction as a proof that no homogeneous catalyst was present in the reaction mixture. Also a poisoning test was done with 300 eq of highly cross linked poly(4-vinylpyridine) [10,36,37]. This substance can bind to homogeneous Pd(II) species and poisons it, resulting in a decrease in reaction rate. The reaction with heterogeneous catalyst (Pd(OAc)2@PhSiO2) showed no decrease in reactivity upon the addition of poly(4-vinylpyridine). Also the analysis of the reaction mixtures after the reactions (Table 5 ) showed only a small amount of leaching of Pd into the solution. From these experiments we conclude that no homogeneous catalyst is involved in the Heck coupling with sol–gel immobilized catalyst in aqueous microemulsion. From these results the recycling efficiency of the sol–gel immobilized catalyst η recycling can be estimated. For mostly applied Pd(OAc)2@PhSiO2 only 0.01% palladium acetate leaching after the first reaction and no further metal leaching was determined afterwards. That's why the recycling efficiency η recycling of the catalyst can be estimated to be 0.999. 4 Discussion Heck coupling of iodobenzene and styrene catalyzed by sol–gel immobilized palladium (II) acetate represents a good alternative to the commonly used homogeneous, e.g. Pd(dba)2/phosphoramidite, catalyzed coupling of iodobenzene and styrene in dimethylformamide at 80°C (TOF=315/h) [38]. Also heterogeneously catalyzed reactions, e.g. Heck coupling of styrene and 4-bromofluorobenzene catalyzed by palladium immobilized on zeolite at 140°C in dimethyl acetamide (TOF[Pd(0)]-NaY =20/h and TOF[Pd(OAc)2]-NaY =2000/h) [2], or reactions under biphasic conditions, e.g. PdCl2(bipy) catalyzed coupling of iodobenzene and styrene in n-octane/p-xylene/ethylene glycol at 150°C (TOF=227/h) [39], were already reported by other research groups. The reactions in conventional solvents at high temperatures, which were already reported in the literature, had higher turnover frequencies. For example, Heck coupling catalyzed by Pd/C in NMP at 150°C [40] had TOF>18,000/h. By lowering the reaction temperature the Turnover Frequency would decrease below TOF80°C =8–140/h. On the other hand, a more environmentally friendly process management on the example of Heck coupling in microemulsion with >90% of water at lower temperatures could be shown. In addition to this, the catalyst and product recycling was enabled. The reaction of iodobenzene and styrene with Pd/C in different aqueous-micellar solutions of cationic surfactants was reported earlier, but no conversions were obtained for the less water-soluble substrates bromo- or chlorobenzene [6]. Heck reaction of iodobenzene and styrene in aqueous-micellar solutions of different surfactants with palladium catalyst and PPh3 ligand [41] or Suzuki coupling with Pd/C catalyst could also be performed [20]. The addition of small amount of alcohol as a cosurfactant and the formation of aqueous microemulsion is desirable, for example for a Heck reaction in a microemulsion of TX-100/n-heptane/butanol/water/propylene glycol mixture [35]. A comparison of the reaction of styrene and bromobenzene in different reaction media with Pd(OAc)2@PhSiO2 is given in Table 6 , including some examples from literature. To clearly show the micellar effect it is common to compare the surfactant system with pure water. Here, the reaction in water was also possible, but the substrates could not be completely solubilized. A small increase in solubility was achieved by adding the hydrophilic surfactant SDS and much higher solubilization was achieved if the hydrophobic surfactant CTAB was added. The full solubility could only be obtained by using an aqueous microemulsion with a short chain alcohol as cosurfactant. Under complete dissolution of the reactants full conversion at 80°C is obtained in 420min. We tested the same reaction in different organic solvents instead of microemulsions and activity was much lower. Within the same reaction time, the conversion was only about 30%. As shown by other groups, in organic solvents higher temperatures (about 130–150°C) are needed to obtain higher conversions. During the reaction the homogeneous Pd(II) species are reduced to the black active Pd(0) in the presence of surfactant. The use of the sol–gel immobilized palladium catalyst in the Heck reaction with different substrates is preferable because of the higher activities in comparison to the commercial catalysts. The catalysts can be reused more than 6 times without loss in activity and with only a minor leaching of the palladium species into the reaction solution and can indeed be classified as a heterogeneous catalyst. The separation process (Scheme 4 ) of the catalyst and product after the reaction is very simple: (a) filtration and reuse of solid catalyst, (b) product separation through extraction with heptane and (c) separation and reuse of surfactant from water, e.g. by micellar enhanced ultra filtration (MEUF) or adsorption on silica or granite sand. At last the overall efficiency η of porous Pd(OAc)2 catalyst immobilized on PhSiO2 was estimated from the different efficiencies, which were calculated above by multiplication of all factors: (13) η = η immobilisation ⋅ η intercalation ⋅ η pore ⋅ ( > N cycle ) × η recycling ( > N ) η =1·0.81·0.4·(>6)·(>0.999)= (≥1.92) In Eq. (13), η immobilization and η recycling are palladium acetate leaching fractions into the solution after the catalyst synthesis and after N recycling experiments and were determined from ICP measurements, N cycle is the number of recycling experiments, η intercalation is the efficiency of the immobilized catalysts compared to the homogeneous catalysts and can be estimated from the comparison of reaction rates for homogeneously and heterogeneously catalyzed reaction and η pore is the pore efficiency calculated from the Weisz–Prater criterion Ψ for the second order reaction. For Ψ =3, the pore efficiency was 40%. Because no deactivation and leaching of the catalyst after sixth recycling step was seen, further application of the catalyst in much more recycling steps can be predicted. That's why the number of the recycling steps was estimated to be >6. Catalyst efficiencies η ≥1 are typical for very stable and active catalysts and demonstrate that palladium acetate immobilized on hydrophobically modified silica by sol–gel method is a good alternative to homogeneous one. In comparison to these results, the catalysts with high metal leaching and low reactivity would show smaller section efficiencies and the complete efficiency of the catalyst would be ≪1. Of course is the immobilization of homogeneous catalysts disadvantageous in comparison to homogeneous catalysts because of diffusion limitations and decrease in reactivity. But on the other side the possibility to recycle the catalysts more than 6 times increases the efficiency of sol–gel immobilized catalysts enormously and reduces the cost of the complete process. The Turnover Number (TON) and Turnover frequency (TOF) provides the information about the activity and efficiency of the catalyst: (14) TOF = TON t = n product / n Pd ( OAc ) 2 t = ( 1.34 mmol ) / 0.0668 mmol Pd ( OAc ) 2 6 h = 20.1 6 h = 3.34 h For the most often used Pd(OAc)2@PhSiO2, the TON is 20 and TOF is 3.3/h for the reaction of iodobenzene and styrene. For the homogeneous Pd(OAc)2 catalyzed reaction the same results would be obtained. TOF should be >500/h (TON>1000) for industrially usable catalysts [42]. In Fig. 7 we have shown that Pd(OAc)2@PhSiO2 could be recycled more than 6 times without loss in activity. Considering these results the TON would be >501 after 25 runs, which is useful for industrial application. The reactant concentrations can be increased up to 5 times, which would also increase the Turnover Number to TON=100 after one run up to TON>1000 for 10 runs. 5 Conclusion Heck reaction in aqueous microemulsions with Pd(OAc)2 or PdBr2 catalysts immobilized on modified silica support materials is a alternative to the conventional organic solvents. One phase microemulsions (water/propanol/CTAB) with the consistence α =0.9%, γ =9.9% and δ =66.7% as reaction media allows a better solubility of hydrophobic substrates in water. To improve the reactivity of the sol–gel immobilized catalysts the application of hydrophobically modified surfaces (PhSiO2) is preferred, because of the attractive interactions between the hydrophobic aromatic substrates, e.g. iodobenzene, and the palladium catalyst immobilized on phenyl modified silica. The synthesized catalysts are more active in comparison to commercial catalysts (e.g. Pd@SiO2 or Pd@C) and can be used in a variety of Heck reactions. These immobilized catalysts could be recycled more than 6 times without loss in activity. No homogeneous species were detected in the reaction mixture, as proved by the heterogeneity tests. Due to the high porosity and the strongly branched pore systems of the sol–gel materials the diffusion of small reactant molecules inside the pore systems was not very high. To obtain a good utilization of the active noble metal immobilized in the support material the loading should be limited to an amount that still guarantees a high effectiveness factor of the composite catalysts (see Fig. S3 in Supporting Information). The influence of the mass transport limitations on the reaction rate can be quantified from the comparison of the activation energies E A of the coupling reaction between bromobenzene and styrene with sol–gel immobilized catalyst and with homogeneous catalyst. It was also showed that the Weisz-modulus was Ψ >1. With a well adjusted Pd(OAc)2 loading in the range of 0.5% a highly efficient catalyst was obtained for the reaction tested here that also show stable recycling behavior. The immobilization process of the palladium catalysts was disadvantageous in comparison to homogeneous catalysts. But on the other side the possibility of catalyst recycling more than 6 times compensate this disadvantage and a catalyst efficiency η ≫1 could be arrived, which is characteristic for very stable and active heterogeneous catalysts. Acknowledgment We gratefully acknowledge the financial support of this study by Deutsche Forschungsgemeinschaft (DFG) through grant SCHO687/8-2. Appendix A Supplementary data Supplementary data associated with this article can be found, in the online version, at http://dx.doi.org/10.1016/j.molcata.2014.06.016. Appendix A Supplementary data The following are the supplementary data to this article: References [1] A. Corma H. Garcı́a A. Leyva A. Primo Appl. Catal. A 247 2003 41 49 [2] L. Djakovitch K. Koehler J. Am. Chem. Soc. 123 2001 5990 5999 [3] P. Li L. Wang L. Zhang G. Wang Adv. Synth. Catal. 354 2012 1307 1318 [4] C.W. Lim I.S. Lee Nano Today 5 2010 412 434 [5] Q. Du W. Zhang H. Ma J. Zheng B. Zhou Y. Li Tetrahedron 68 2012 3577 3584 [6] M.M. Shinde S.S. Bhagwat J. Dispers. Sci. Technol. 33 2012 117 122 [7] C.M. Crudden M. Sateesh R. Lewis C. Kl J. Am. Chem. Soc. 127 2005 10045 10050 [8] V. Polshettiwar Á. Molnár Tetrahedron 63 2007 6949 6976 [9] S. Jana B. Dutta R. Bera S. Koner Inorg. Chem. 47 2008 5512 5520 [10] Y. Ji S. Jain R.J. Davis J. Phys. Chem. B 109 2005 17232 17238 [11] F. Gelman D. Avnir H. Schumann J. Blum J. Mol. Catal. A: Chem. 146 1999 123 128 [12] Z. Nairoukh J. Blum J. Mol. Catal. A: Chem. 358 2012 129 133 [13] K. Hamza H. Schumann J. Blum Eur. J. Org. Chem. 2009 1502 1505 [14] T. Yosef R. Schomäcker M. Schwarze M. Fanun F. Gelman J. Mol. Catal. A: Chem. 351 2011 46 51 [15] D. Meltzer D. Avnir M. Fanun V. Gutkin I. Popov R. Schomäcker M. Schwarze J. Blum J. Mol. Catal. A: Chem. 335 2011 8 13 [16] S. Dahoah Z. Nairoukh M. Fanun M. Schwarze R. Schomäcker J. Blum J. Mol. Catal. A: Chem. 380 2013 90 93 [17] A. Rosin-Ben Baruch D. Tsvelikhovsky M. Schwarze R. Schomäcker M. Fanun J. Blum J. Mol. Catal. A: Chem. 323 2010 65 69 [18] B.H. Lipshutz S. Ghorai Ald. Acta 41 2008 59 72 [19] S. Bhattacharya A. Srivastava S. Sengupta Tetrahedron Lett. 46 2005 3557 3560 [20] A. Arcadi G. Cerichelli M. Chiarini M. Correa D. Zorzan Eur. J. Org. Chem. 2003 2003 4080 4086 [21] L. Botella C. Nájera Tetrahedron 60 2004 5563 5570 [22] C.H. Kee Org. Biomol. Chem. 8 2010 5646 5660 [23] A. Buchwald C. Kaps GDCh-Monographie 1999 [24] D. Avnir Acc. Chem. Res. 28 1995 328 334 [25] G. Ertl H. Knözinger F. Schüth Handbook of Heterogeneous Catalysis 2008 Wiley-VCH Weinheim [26] H.K. Schmidt Chem. Unserer Zeit 3 2001 176 184 [27] J. Parka M. Komarnenia S. Lima W.T. Heoa N.H. Choia J. Mater. Res. 15 2000 1437 1440 [28] I. Volovych M. Schwarze T. Hamerla J. Blum R. Schomäcker J. Mol. Catal. A: Chem. 366 2013 359 367 [29] W. Jost K. Hauffe Ber. Der Bunsenges. Phys. Chem. 66 1962 77 [30] P.B. Weisz C.D. Prater Adv. Catal. 6 1954 143 196 [31] M. Polestra H.S. Harned J. Am. Chem. Soc. 75 1953 4168 4169 [32] E.S. Meadows T.J. Crowley C.D. Immanuel Ind. Eng. Chem. Res. 42 2003 555 567 [33] G. Ertl H. Knözinger F. Schüth Handbook of Heterogeneous Catalysis 2006 Wiley-VCH [34] S.V. Jagtap R.M. Deshpande React. Kinet. Mech. Cat. 106 2012 457 473 [35] J.-Z. Jiang C. Cai J. Colloid Interface Sci. 299 2006 938 943 [36] W.J. Sommer K. Yu J.S. Sears Y. Ji X. Zheng R.J. Davis C.D. Sherrill C.W. Jones M. Weck Organometallics 24 2005 4351 4361 [37] J.M. Richardson C.W. Jones Adv. Synth. Catal. 348 2006 1207 1216 [38] D.L. Dodds M.D.K. Boele G.P.F. van Strijdonck J.G. de Vries P.W.N.M. van Leeuwen P.C.J. Kamer Eur. J. Inorg. Chem. 2012 1660 1671 [39] S.V. Jagtap R.M. Deshpande Catal. Today 131 2008 353 359 [40] L. Yin J. Liebscher Chem. Rev. 107 2007 133 173 [41] G. Lu C. Cai Colloids Surf. A 355 2010 193 196 [42] A. Behr Applied Homogeneous Catalysis 2008 Wiley-VCH Weinheim [43] M. Schwarze J.S. Milano-Brusco V. Strempel T. Hamerla S. Wille C. Fischer W. Baumann W. Arlt R. Schomäcker RSC Adv. 1 2011 474 483 [44] T. Hamerla Untersuchungen zur Hydrierung von prochiralen Olefinen mit Rhodium-Katalysatoren in Tensidsystemen Diploma thesis 2010 [45] K. Weidemaier H.L. Tavernier M.D. Fayer J. Phys. Chem. B 101 1997 9352 9361 [46] A. Chatterjee S.P. Moulik S.K. Sanyal B.K. Mishra P.M. Puri J. Phys. Chem. B 105 2001 12823 12831 [47] K. Mori K. Yamaguchi T. Hara T. Mizugaki K. Ebitani K. Kaneda J. Am. Chem. Soc. 124 2002 11572 11573 [48] A. Ohtaka T. Yamaguchi T. Teratani O. Shimomura R. Nomura Molecules 16 2011 9067 9076 [49] G. Zhang H. Zhou J. Hu M. Liu Y. Kuang Green Chem. 11 2009 1428 1432",
      "scopus-id": "84903935508",
      "coredata": {
        "eid": "1-s2.0-S1381116914002672",
        "dc:description": "Sol–gel supported palladium catalysts are investigated for the Heck coupling reaction between styrene and iodo-/bromobenzene to trans-stilbenes in o/w-microemulsions as alternative reaction medium. High conversions and selectivities are obtained with these catalysts and they show better catalytic performance than their commercial analogs Pd@SiO2 or Pd/C. The influence of the catalyst structure on the activity is investigated in detail showing mass transport limitations that can be optimized by the palladium loading. The catalyst is recyclable >6 times with negligible palladium leaching into the solution. Because of the good recyclability under retention of activity and selectivity, the influence of transport limitations is suppressed and the total catalyst efficiency is increased to more than 2.",
        "openArchiveArticle": "false",
        "prism:coverDate": "2014-11-01",
        "openaccessUserLicense": null,
        "prism:aggregationType": "Journal",
        "prism:url": "https://api.elsevier.com/content/article/pii/S1381116914002672",
        "dc:creator": [
          {
            "@_fa": "true",
            "$": "Volovych, I."
          },
          {
            "@_fa": "true",
            "$": "Kasaka, Y."
          },
          {
            "@_fa": "true",
            "$": "Schwarze, M."
          },
          {
            "@_fa": "true",
            "$": "Nairoukh, Z."
          },
          {
            "@_fa": "true",
            "$": "Blum, J."
          },
          {
            "@_fa": "true",
            "$": "Fanun, M."
          },
          {
            "@_fa": "true",
            "$": "Avnir, D."
          },
          {
            "@_fa": "true",
            "$": "Schomäcker, R."
          }
        ],
        "link": [
          {
            "@_fa": "true",
            "@rel": "self",
            "@href": "https://api.elsevier.com/content/article/pii/S1381116914002672"
          },
          {
            "@_fa": "true",
            "@rel": "scidir",
            "@href": "https://www.sciencedirect.com/science/article/pii/S1381116914002672"
          }
        ],
        "dc:format": "application/json",
        "openaccessType": null,
        "pii": "S1381-1169(14)00267-2",
        "prism:volume": "393",
        "prism:publisher": "Elsevier B.V.",
        "dc:title": "Investigation of sol–gel supported palladium catalysts for Heck coupling reactions in o/w-microemulsions",
        "prism:copyright": "Copyright © 2014 Elsevier B.V. All rights reserved.",
        "openaccess": "0",
        "prism:issn": "13811169",
        "dcterms:subject": [
          {
            "@_fa": "true",
            "$": "Heck coupling"
          },
          {
            "@_fa": "true",
            "$": "Microemulsion"
          },
          {
            "@_fa": "true",
            "$": "Palladium acetate"
          },
          {
            "@_fa": "true",
            "$": "Sol–gel method"
          },
          {
            "@_fa": "true",
            "$": "Trans-stilbene"
          }
        ],
        "openaccessArticle": "false",
        "prism:publicationName": "Journal of Molecular Catalysis A: Chemical",
        "openaccessSponsorType": null,
        "prism:pageRange": "210-221",
        "prism:endingPage": "221",
        "pubType": "fla",
        "prism:coverDisplayDate": "1 November 2014",
        "prism:doi": "10.1016/j.molcata.2014.06.016",
        "prism:startingPage": "210",
        "dc:identifier": "doi:10.1016/j.molcata.2014.06.016",
        "openaccessSponsorName": null
      },
      "objects": {
        "object": [
          {
            "@category": "thumbnail",
            "@height": "33",
            "@width": "72",
            "@_fa": "true",
            "$": "https://api.elsevier.com/content/object/eid/1-s2.0-S1381116914002672-si9.gif?httpAccept=%2A%2F%2A",
            "@multimediatype": "GIF image file",
            "@type": "ALTIMG",
            "@size": "381",
            "@ref": "si9",
            "@mimetype": "image/gif"
          },
          {
            "@category": "thumbnail",
            "@height": "37",
            "@width": "231",
            "@_fa": "true",
            "$": "https://api.elsevier.com/content/object/eid/1-s2.0-S1381116914002672-si8.gif?httpAccept=%2A%2F%2A",
            "@multimediatype": "GIF image file",
            "@type": "ALTIMG",
            "@size": "1165",
            "@ref": "si8",
            "@mimetype": "image/gif"
          },
          {
            "@category": "thumbnail",
            "@height": "33",
            "@width": "278",
            "@_fa": "true",
            "$": "https://api.elsevier.com/content/object/eid/1-s2.0-S1381116914002672-si7.gif?httpAccept=%2A%2F%2A",
            "@multimediatype": "GIF image file",
            "@type": "ALTIMG",
            "@size": "1215",
            "@ref": "si7",
            "@mimetype": "image/gif"
          },
          {
            "@category": "thumbnail",
            "@height": "33",
            "@width": "178",
            "@_fa": "true",
            "$": "https://api.elsevier.com/content/object/eid/1-s2.0-S1381116914002672-si6.gif?httpAccept=%2A%2F%2A",
            "@multimediatype": "GIF image file",
            "@type": "ALTIMG",
            "@size": "814",
            "@ref": "si6",
            "@mimetype": "image/gif"
          },
          {
            "@category": "thumbnail",
            "@height": "34",
            "@width": "275",
            "@_fa": "true",
            "$": "https://api.elsevier.com/content/object/eid/1-s2.0-S1381116914002672-si5.gif?httpAccept=%2A%2F%2A",
            "@multimediatype": "GIF image file",
            "@type": "ALTIMG",
            "@size": "1475",
            "@ref": "si5",
            "@mimetype": "image/gif"
          },
          {
            "@category": "thumbnail",
            "@height": "33",
            "@width": "111",
            "@_fa": "true",
            "$": "https://api.elsevier.com/content/object/eid/1-s2.0-S1381116914002672-si4.gif?httpAccept=%2A%2F%2A",
            "@multimediatype": "GIF image file",
            "@type": "ALTIMG",
            "@size": "540",
            "@ref": "si4",
            "@mimetype": "image/gif"
          },
          {
            "@category": "thumbnail",
            "@height": "18",
            "@width": "157",
            "@_fa": "true",
            "$": "https://api.elsevier.com/content/object/eid/1-s2.0-S1381116914002672-si3.gif?httpAccept=%2A%2F%2A",
            "@multimediatype": "GIF image file",
            "@type": "ALTIMG",
            "@size": "679",
            "@ref": "si3",
            "@mimetype": "image/gif"
          },
          {
            "@category": "thumbnail",
            "@height": "13",
            "@width": "58",
            "@_fa": "true",
            "$": "https://api.elsevier.com/content/object/eid/1-s2.0-S1381116914002672-si2.gif?httpAccept=%2A%2F%2A",
            "@multimediatype": "GIF image file",
            "@type": "ALTIMG",
            "@size": "269",
            "@ref": "si2",
            "@mimetype": "image/gif"
          },
          {
            "@category": "thumbnail",
            "@height": "77",
            "@width": "414",
            "@_fa": "true",
            "$": "https://api.elsevier.com/content/object/eid/1-s2.0-S1381116914002672-si17.gif?httpAccept=%2A%2F%2A",
            "@multimediatype": "GIF image file",
            "@type": "ALTIMG",
            "@size": "2420",
            "@ref": "si17",
            "@mimetype": "image/gif"
          },
          {
            "@category": "thumbnail",
            "@height": "22",
            "@width": "376",
            "@_fa": "true",
            "$": "https://api.elsevier.com/content/object/eid/1-s2.0-S1381116914002672-si16.gif?httpAccept=%2A%2F%2A",
            "@multimediatype": "GIF image file",
            "@type": "ALTIMG",
            "@size": "1284",
            "@ref": "si16",
            "@mimetype": "image/gif"
          },
          {
            "@category": "thumbnail",
            "@height": "32",
            "@width": "159",
            "@_fa": "true",
            "$": "https://api.elsevier.com/content/object/eid/1-s2.0-S1381116914002672-si15.gif?httpAccept=%2A%2F%2A",
            "@multimediatype": "GIF image file",
            "@type": "ALTIMG",
            "@size": "709",
            "@ref": "si15",
            "@mimetype": "image/gif"
          },
          {
            "@category": "thumbnail",
            "@height": "32",
            "@width": "79",
            "@_fa": "true",
            "$": "https://api.elsevier.com/content/object/eid/1-s2.0-S1381116914002672-si14.gif?httpAccept=%2A%2F%2A",
            "@multimediatype": "GIF image file",
            "@type": "ALTIMG",
            "@size": "403",
            "@ref": "si14",
            "@mimetype": "image/gif"
          },
          {
            "@category": "thumbnail",
            "@height": "36",
            "@width": "87",
            "@_fa": "true",
            "$": "https://api.elsevier.com/content/object/eid/1-s2.0-S1381116914002672-si13.gif?httpAccept=%2A%2F%2A",
            "@multimediatype": "GIF image file",
            "@type": "ALTIMG",
            "@size": "598",
            "@ref": "si13",
            "@mimetype": "image/gif"
          },
          {
            "@category": "thumbnail",
            "@height": "29",
            "@width": "158",
            "@_fa": "true",
            "$": "https://api.elsevier.com/content/object/eid/1-s2.0-S1381116914002672-si12.gif?httpAccept=%2A%2F%2A",
            "@multimediatype": "GIF image file",
            "@type": "ALTIMG",
            "@size": "636",
            "@ref": "si12",
            "@mimetype": "image/gif"
          },
          {
            "@category": "thumbnail",
            "@height": "35",
            "@width": "201",
            "@_fa": "true",
            "$": "https://api.elsevier.com/content/object/eid/1-s2.0-S1381116914002672-si11.gif?httpAccept=%2A%2F%2A",
            "@multimediatype": "GIF image file",
            "@type": "ALTIMG",
            "@size": "811",
            "@ref": "si11",
            "@mimetype": "image/gif"
          },
          {
            "@category": "thumbnail",
            "@height": "33",
            "@width": "233",
            "@_fa": "true",
            "$": "https://api.elsevier.com/content/object/eid/1-s2.0-S1381116914002672-si10.gif?httpAccept=%2A%2F%2A",
            "@multimediatype": "GIF image file",
            "@type": "ALTIMG",
            "@size": "999",
            "@ref": "si10",
            "@mimetype": "image/gif"
          },
          {
            "@category": "thumbnail",
            "@height": "19",
            "@width": "107",
            "@_fa": "true",
            "$": "https://api.elsevier.com/content/object/eid/1-s2.0-S1381116914002672-si1.gif?httpAccept=%2A%2F%2A",
            "@multimediatype": "GIF image file",
            "@type": "ALTIMG",
            "@size": "527",
            "@ref": "si1",
            "@mimetype": "image/gif"
          },
          {
            "@category": "high",
            "@height": "1017",
            "@width": "2333",
            "@_fa": "true",
            "$": "https://api.elsevier.com/content/object/eid/1-s2.0-S1381116914002672-sc4_lrg.jpg?httpAccept=%2A%2F%2A",
            "@multimediatype": "JPEG image file",
            "@type": "IMAGE-HIGH-RES",
            "@size": "131888",
            "@ref": "sc4",
            "@mimetype": "image/jpeg"
          },
          {
            "@category": "high",
            "@height": "1943",
            "@width": "2667",
            "@_fa": "true",
            "$": "https://api.elsevier.com/content/object/eid/1-s2.0-S1381116914002672-sc3_lrg.jpg?httpAccept=%2A%2F%2A",
            "@multimediatype": "JPEG image file",
            "@type": "IMAGE-HIGH-RES",
            "@size": "356909",
            "@ref": "sc3",
            "@mimetype": "image/jpeg"
          },
          {
            "@category": "high",
            "@height": "521",
            "@width": "2083",
            "@_fa": "true",
            "$": "https://api.elsevier.com/content/object/eid/1-s2.0-S1381116914002672-sc2_lrg.jpg?httpAccept=%2A%2F%2A",
            "@multimediatype": "JPEG image file",
            "@type": "IMAGE-HIGH-RES",
            "@size": "141132",
            "@ref": "sc2",
            "@mimetype": "image/jpeg"
          },
          {
            "@category": "high",
            "@height": "1019",
            "@width": "2667",
            "@_fa": "true",
            "$": "https://api.elsevier.com/content/object/eid/1-s2.0-S1381116914002672-sc1_lrg.jpg?httpAccept=%2A%2F%2A",
            "@multimediatype": "JPEG image file",
            "@type": "IMAGE-HIGH-RES",
            "@size": "232469",
            "@ref": "sc1",
            "@mimetype": "image/jpeg"
          },
          {
            "@category": "high",
            "@height": "3346",
            "@width": "1333",
            "@_fa": "true",
            "$": "https://api.elsevier.com/content/object/eid/1-s2.0-S1381116914002672-gr7_lrg.jpg?httpAccept=%2A%2F%2A",
            "@multimediatype": "JPEG image file",
            "@type": "IMAGE-HIGH-RES",
            "@size": "331715",
            "@ref": "gr7",
            "@mimetype": "image/jpeg"
          },
          {
            "@category": "high",
            "@height": "2436",
            "@width": "1667",
            "@_fa": "true",
            "$": "https://api.elsevier.com/content/object/eid/1-s2.0-S1381116914002672-gr6_lrg.jpg?httpAccept=%2A%2F%2A",
            "@multimediatype": "JPEG image file",
            "@type": "IMAGE-HIGH-RES",
            "@size": "268363",
            "@ref": "gr6",
            "@mimetype": "image/jpeg"
          },
          {
            "@category": "high",
            "@height": "1137",
            "@width": "1500",
            "@_fa": "true",
            "$": "https://api.elsevier.com/content/object/eid/1-s2.0-S1381116914002672-gr5_lrg.jpg?httpAccept=%2A%2F%2A",
            "@multimediatype": "JPEG image file",
            "@type": "IMAGE-HIGH-RES",
            "@size": "127413",
            "@ref": "gr5",
            "@mimetype": "image/jpeg"
          },
          {
            "@category": "high",
            "@height": "1133",
            "@width": "1500",
            "@_fa": "true",
            "$": "https://api.elsevier.com/content/object/eid/1-s2.0-S1381116914002672-gr4_lrg.jpg?httpAccept=%2A%2F%2A",
            "@multimediatype": "JPEG image file",
            "@type": "IMAGE-HIGH-RES",
            "@size": "151664",
            "@ref": "gr4",
            "@mimetype": "image/jpeg"
          },
          {
            "@category": "high",
            "@height": "2525",
            "@width": "1667",
            "@_fa": "true",
            "$": "https://api.elsevier.com/content/object/eid/1-s2.0-S1381116914002672-gr3_lrg.jpg?httpAccept=%2A%2F%2A",
            "@multimediatype": "JPEG image file",
            "@type": "IMAGE-HIGH-RES",
            "@size": "308864",
            "@ref": "gr3",
            "@mimetype": "image/jpeg"
          },
          {
            "@category": "high",
            "@height": "2481",
            "@width": "1667",
            "@_fa": "true",
            "$": "https://api.elsevier.com/content/object/eid/1-s2.0-S1381116914002672-gr2_lrg.jpg?httpAccept=%2A%2F%2A",
            "@multimediatype": "JPEG image file",
            "@type": "IMAGE-HIGH-RES",
            "@size": "383318",
            "@ref": "gr2",
            "@mimetype": "image/jpeg"
          },
          {
            "@category": "high",
            "@height": "900",
            "@width": "900",
            "@_fa": "true",
            "$": "https://api.elsevier.com/content/object/eid/1-s2.0-S1381116914002672-gr1_lrg.jpg?httpAccept=%2A%2F%2A",
            "@multimediatype": "JPEG image file",
            "@type": "IMAGE-HIGH-RES",
            "@size": "300496",
            "@ref": "gr1",
            "@mimetype": "image/jpeg"
          },
          {
            "@category": "high",
            "@height": "292",
            "@width": "785",
            "@_fa": "true",
            "$": "https://api.elsevier.com/content/object/eid/1-s2.0-S1381116914002672-fx9_lrg.jpg?httpAccept=%2A%2F%2A",
            "@multimediatype": "JPEG image file",
            "@type": "IMAGE-HIGH-RES",
            "@size": "29149",
            "@ref": "fx9",
            "@mimetype": "image/jpeg"
          },
          {
            "@category": "high",
            "@height": "153",
            "@width": "1271",
            "@_fa": "true",
            "$": "https://api.elsevier.com/content/object/eid/1-s2.0-S1381116914002672-fx8_lrg.jpg?httpAccept=%2A%2F%2A",
            "@multimediatype": "JPEG image file",
            "@type": "IMAGE-HIGH-RES",
            "@size": "26296",
            "@ref": "fx8",
            "@mimetype": "image/jpeg"
          },
          {
            "@category": "high",
            "@height": "472",
            "@width": "1479",
            "@_fa": "true",
            "$": "https://api.elsevier.com/content/object/eid/1-s2.0-S1381116914002672-fx7_lrg.jpg?httpAccept=%2A%2F%2A",
            "@multimediatype": "JPEG image file",
            "@type": "IMAGE-HIGH-RES",
            "@size": "52889",
            "@ref": "fx7",
            "@mimetype": "image/jpeg"
          },
          {
            "@category": "high",
            "@height": "340",
            "@width": "1167",
            "@_fa": "true",
            "$": "https://api.elsevier.com/content/object/eid/1-s2.0-S1381116914002672-fx6_lrg.jpg?httpAccept=%2A%2F%2A",
            "@multimediatype": "JPEG image file",
            "@type": "IMAGE-HIGH-RES",
            "@size": "38527",
            "@ref": "fx6",
            "@mimetype": "image/jpeg"
          },
          {
            "@category": "high",
            "@height": "208",
            "@width": "1423",
            "@_fa": "true",
            "$": "https://api.elsevier.com/content/object/eid/1-s2.0-S1381116914002672-fx5_lrg.jpg?httpAccept=%2A%2F%2A",
            "@multimediatype": "JPEG image file",
            "@type": "IMAGE-HIGH-RES",
            "@size": "31133",
            "@ref": "fx5",
            "@mimetype": "image/jpeg"
          },
          {
            "@category": "high",
            "@height": "319",
            "@width": "1069",
            "@_fa": "true",
            "$": "https://api.elsevier.com/content/object/eid/1-s2.0-S1381116914002672-fx4_lrg.jpg?httpAccept=%2A%2F%2A",
            "@multimediatype": "JPEG image file",
            "@type": "IMAGE-HIGH-RES",
            "@size": "36132",
            "@ref": "fx4",
            "@mimetype": "image/jpeg"
          },
          {
            "@category": "high",
            "@height": "152",
            "@width": "1527",
            "@_fa": "true",
            "$": "https://api.elsevier.com/content/object/eid/1-s2.0-S1381116914002672-fx3_lrg.jpg?httpAccept=%2A%2F%2A",
            "@multimediatype": "JPEG image file",
            "@type": "IMAGE-HIGH-RES",
            "@size": "34147",
            "@ref": "fx3",
            "@mimetype": "image/jpeg"
          },
          {
            "@category": "high",
            "@height": "306",
            "@width": "1410",
            "@_fa": "true",
            "$": "https://api.elsevier.com/content/object/eid/1-s2.0-S1381116914002672-fx2_lrg.jpg?httpAccept=%2A%2F%2A",
            "@multimediatype": "JPEG image file",
            "@type": "IMAGE-HIGH-RES",
            "@size": "39015",
            "@ref": "fx2",
            "@mimetype": "image/jpeg"
          },
          {
            "@category": "high",
            "@height": "361",
            "@width": "1499",
            "@_fa": "true",
            "$": "https://api.elsevier.com/content/object/eid/1-s2.0-S1381116914002672-fx11_lrg.jpg?httpAccept=%2A%2F%2A",
            "@multimediatype": "JPEG image file",
            "@type": "IMAGE-HIGH-RES",
            "@size": "62643",
            "@ref": "fx11",
            "@mimetype": "image/jpeg"
          },
          {
            "@category": "high",
            "@height": "139",
            "@width": "1527",
            "@_fa": "true",
            "$": "https://api.elsevier.com/content/object/eid/1-s2.0-S1381116914002672-fx10_lrg.jpg?httpAccept=%2A%2F%2A",
            "@multimediatype": "JPEG image file",
            "@type": "IMAGE-HIGH-RES",
            "@size": "32432",
            "@ref": "fx10",
            "@mimetype": "image/jpeg"
          },
          {
            "@category": "high",
            "@height": "886",
            "@width": "2213",
            "@_fa": "true",
            "$": "https://api.elsevier.com/content/object/eid/1-s2.0-S1381116914002672-fx1_lrg.jpg?httpAccept=%2A%2F%2A",
            "@multimediatype": "JPEG image file",
            "@type": "IMAGE-HIGH-RES",
            "@size": "77330",
            "@ref": "fx1",
            "@mimetype": "image/jpeg"
          },
          {
            "@category": "standard",
            "@height": "230",
            "@width": "527",
            "@_fa": "true",
            "$": "https://api.elsevier.com/content/object/eid/1-s2.0-S1381116914002672-sc4.jpg?httpAccept=%2A%2F%2A",
            "@multimediatype": "JPEG image file",
            "@type": "IMAGE-DOWNSAMPLED",
            "@size": "20559",
            "@ref": "sc4",
            "@mimetype": "image/jpeg"
          },
          {
            "@category": "standard",
            "@height": "439",
            "@width": "602",
            "@_fa": "true",
            "$": "https://api.elsevier.com/content/object/eid/1-s2.0-S1381116914002672-sc3.jpg?httpAccept=%2A%2F%2A",
            "@multimediatype": "JPEG image file",
            "@type": "IMAGE-DOWNSAMPLED",
            "@size": "48435",
            "@ref": "sc3",
            "@mimetype": "image/jpeg"
          },
          {
            "@category": "standard",
            "@height": "118",
            "@width": "470",
            "@_fa": "true",
            "$": "https://api.elsevier.com/content/object/eid/1-s2.0-S1381116914002672-sc2.jpg?httpAccept=%2A%2F%2A",
            "@multimediatype": "JPEG image file",
            "@type": "IMAGE-DOWNSAMPLED",
            "@size": "16898",
            "@ref": "sc2",
            "@mimetype": "image/jpeg"
          },
          {
            "@category": "standard",
            "@height": "230",
            "@width": "602",
            "@_fa": "true",
            "$": "https://api.elsevier.com/content/object/eid/1-s2.0-S1381116914002672-sc1.jpg?httpAccept=%2A%2F%2A",
            "@multimediatype": "JPEG image file",
            "@type": "IMAGE-DOWNSAMPLED",
            "@size": "32746",
            "@ref": "sc1",
            "@mimetype": "image/jpeg"
          },
          {
            "@category": "standard",
            "@height": "756",
            "@width": "301",
            "@_fa": "true",
            "$": "https://api.elsevier.com/content/object/eid/1-s2.0-S1381116914002672-gr7.jpg?httpAccept=%2A%2F%2A",
            "@multimediatype": "JPEG image file",
            "@type": "IMAGE-DOWNSAMPLED",
            "@size": "45830",
            "@ref": "gr7",
            "@mimetype": "image/jpeg"
          },
          {
            "@category": "standard",
            "@height": "549",
            "@width": "376",
            "@_fa": "true",
            "$": "https://api.elsevier.com/content/object/eid/1-s2.0-S1381116914002672-gr6.jpg?httpAccept=%2A%2F%2A",
            "@multimediatype": "JPEG image file",
            "@type": "IMAGE-DOWNSAMPLED",
            "@size": "40534",
            "@ref": "gr6",
            "@mimetype": "image/jpeg"
          },
          {
            "@category": "standard",
            "@height": "257",
            "@width": "339",
            "@_fa": "true",
            "$": "https://api.elsevier.com/content/object/eid/1-s2.0-S1381116914002672-gr5.jpg?httpAccept=%2A%2F%2A",
            "@multimediatype": "JPEG image file",
            "@type": "IMAGE-DOWNSAMPLED",
            "@size": "21867",
            "@ref": "gr5",
            "@mimetype": "image/jpeg"
          },
          {
            "@category": "standard",
            "@height": "256",
            "@width": "339",
            "@_fa": "true",
            "$": "https://api.elsevier.com/content/object/eid/1-s2.0-S1381116914002672-gr4.jpg?httpAccept=%2A%2F%2A",
            "@multimediatype": "JPEG image file",
            "@type": "IMAGE-DOWNSAMPLED",
            "@size": "25216",
            "@ref": "gr4",
            "@mimetype": "image/jpeg"
          },
          {
            "@category": "standard",
            "@height": "570",
            "@width": "376",
            "@_fa": "true",
            "$": "https://api.elsevier.com/content/object/eid/1-s2.0-S1381116914002672-gr3.jpg?httpAccept=%2A%2F%2A",
            "@multimediatype": "JPEG image file",
            "@type": "IMAGE-DOWNSAMPLED",
            "@size": "42729",
            "@ref": "gr3",
            "@mimetype": "image/jpeg"
          },
          {
            "@category": "standard",
            "@height": "560",
            "@width": "376",
            "@_fa": "true",
            "$": "https://api.elsevier.com/content/object/eid/1-s2.0-S1381116914002672-gr2.jpg?httpAccept=%2A%2F%2A",
            "@multimediatype": "JPEG image file",
            "@type": "IMAGE-DOWNSAMPLED",
            "@size": "50246",
            "@ref": "gr2",
            "@mimetype": "image/jpeg"
          },
          {
            "@category": "standard",
            "@height": "339",
            "@width": "339",
            "@_fa": "true",
            "$": "https://api.elsevier.com/content/object/eid/1-s2.0-S1381116914002672-gr1.jpg?httpAccept=%2A%2F%2A",
            "@multimediatype": "JPEG image file",
            "@type": "IMAGE-DOWNSAMPLED",
            "@size": "44095",
            "@ref": "gr1",
            "@mimetype": "image/jpeg"
          },
          {
            "@category": "standard",
            "@height": "66",
            "@width": "177",
            "@_fa": "true",
            "$": "https://api.elsevier.com/content/object/eid/1-s2.0-S1381116914002672-fx9.jpg?httpAccept=%2A%2F%2A",
            "@multimediatype": "JPEG image file",
            "@type": "IMAGE-DOWNSAMPLED",
            "@size": "11081",
            "@ref": "fx9",
            "@mimetype": "image/jpeg"
          },
          {
            "@category": "standard",
            "@height": "35",
            "@width": "287",
            "@_fa": "true",
            "$": "https://api.elsevier.com/content/object/eid/1-s2.0-S1381116914002672-fx8.jpg?httpAccept=%2A%2F%2A",
            "@multimediatype": "JPEG image file",
            "@type": "IMAGE-DOWNSAMPLED",
            "@size": "6835",
            "@ref": "fx8",
            "@mimetype": "image/jpeg"
          },
          {
            "@category": "standard",
            "@height": "107",
            "@width": "334",
            "@_fa": "true",
            "$": "https://api.elsevier.com/content/object/eid/1-s2.0-S1381116914002672-fx7.jpg?httpAccept=%2A%2F%2A",
            "@multimediatype": "JPEG image file",
            "@type": "IMAGE-DOWNSAMPLED",
            "@size": "10273",
            "@ref": "fx7",
            "@mimetype": "image/jpeg"
          },
          {
            "@category": "standard",
            "@height": "77",
            "@width": "263",
            "@_fa": "true",
            "$": "https://api.elsevier.com/content/object/eid/1-s2.0-S1381116914002672-fx6.jpg?httpAccept=%2A%2F%2A",
            "@multimediatype": "JPEG image file",
            "@type": "IMAGE-DOWNSAMPLED",
            "@size": "8697",
            "@ref": "fx6",
            "@mimetype": "image/jpeg"
          },
          {
            "@category": "standard",
            "@height": "47",
            "@width": "321",
            "@_fa": "true",
            "$": "https://api.elsevier.com/content/object/eid/1-s2.0-S1381116914002672-fx5.jpg?httpAccept=%2A%2F%2A",
            "@multimediatype": "JPEG image file",
            "@type": "IMAGE-DOWNSAMPLED",
            "@size": "7643",
            "@ref": "fx5",
            "@mimetype": "image/jpeg"
          },
          {
            "@category": "standard",
            "@height": "72",
            "@width": "241",
            "@_fa": "true",
            "$": "https://api.elsevier.com/content/object/eid/1-s2.0-S1381116914002672-fx4.jpg?httpAccept=%2A%2F%2A",
            "@multimediatype": "JPEG image file",
            "@type": "IMAGE-DOWNSAMPLED",
            "@size": "8625",
            "@ref": "fx4",
            "@mimetype": "image/jpeg"
          },
          {
            "@category": "standard",
            "@height": "34",
            "@width": "345",
            "@_fa": "true",
            "$": "https://api.elsevier.com/content/object/eid/1-s2.0-S1381116914002672-fx3.jpg?httpAccept=%2A%2F%2A",
            "@multimediatype": "JPEG image file",
            "@type": "IMAGE-DOWNSAMPLED",
            "@size": "10676",
            "@ref": "fx3",
            "@mimetype": "image/jpeg"
          },
          {
            "@category": "standard",
            "@height": "69",
            "@width": "318",
            "@_fa": "true",
            "$": "https://api.elsevier.com/content/object/eid/1-s2.0-S1381116914002672-fx2.jpg?httpAccept=%2A%2F%2A",
            "@multimediatype": "JPEG image file",
            "@type": "IMAGE-DOWNSAMPLED",
            "@size": "10893",
            "@ref": "fx2",
            "@mimetype": "image/jpeg"
          },
          {
            "@category": "standard",
            "@height": "81",
            "@width": "338",
            "@_fa": "true",
            "$": "https://api.elsevier.com/content/object/eid/1-s2.0-S1381116914002672-fx11.jpg?httpAccept=%2A%2F%2A",
            "@multimediatype": "JPEG image file",
            "@type": "IMAGE-DOWNSAMPLED",
            "@size": "13903",
            "@ref": "fx11",
            "@mimetype": "image/jpeg"
          },
          {
            "@category": "standard",
            "@height": "31",
            "@width": "345",
            "@_fa": "true",
            "$": "https://api.elsevier.com/content/object/eid/1-s2.0-S1381116914002672-fx10.jpg?httpAccept=%2A%2F%2A",
            "@multimediatype": "JPEG image file",
            "@type": "IMAGE-DOWNSAMPLED",
            "@size": "7575",
            "@ref": "fx10",
            "@mimetype": "image/jpeg"
          },
          {
            "@category": "standard",
            "@height": "200",
            "@width": "500",
            "@_fa": "true",
            "$": "https://api.elsevier.com/content/object/eid/1-s2.0-S1381116914002672-fx1.jpg?httpAccept=%2A%2F%2A",
            "@multimediatype": "JPEG image file",
            "@type": "IMAGE-DOWNSAMPLED",
            "@size": "9844",
            "@ref": "fx1",
            "@mimetype": "image/jpeg"
          },
          {
            "@category": "thumbnail",
            "@height": "95",
            "@width": "219",
            "@_fa": "true",
            "$": "https://api.elsevier.com/content/object/eid/1-s2.0-S1381116914002672-sc4.sml?httpAccept=%2A%2F%2A",
            "@multimediatype": "GIF image file",
            "@type": "IMAGE-THUMBNAIL",
            "@size": "2134",
            "@ref": "sc4",
            "@mimetype": "image/gif"
          },
          {
            "@category": "thumbnail",
            "@height": "160",
            "@width": "219",
            "@_fa": "true",
            "$": "https://api.elsevier.com/content/object/eid/1-s2.0-S1381116914002672-sc3.sml?httpAccept=%2A%2F%2A",
            "@multimediatype": "GIF image file",
            "@type": "IMAGE-THUMBNAIL",
            "@size": "3581",
            "@ref": "sc3",
            "@mimetype": "image/gif"
          },
          {
            "@category": "thumbnail",
            "@height": "55",
            "@width": "219",
            "@_fa": "true",
            "$": "https://api.elsevier.com/content/object/eid/1-s2.0-S1381116914002672-sc2.sml?httpAccept=%2A%2F%2A",
            "@multimediatype": "GIF image file",
            "@type": "IMAGE-THUMBNAIL",
            "@size": "2188",
            "@ref": "sc2",
            "@mimetype": "image/gif"
          },
          {
            "@category": "thumbnail",
            "@height": "84",
            "@width": "219",
            "@_fa": "true",
            "$": "https://api.elsevier.com/content/object/eid/1-s2.0-S1381116914002672-sc1.sml?httpAccept=%2A%2F%2A",
            "@multimediatype": "GIF image file",
            "@type": "IMAGE-THUMBNAIL",
            "@size": "2705",
            "@ref": "sc1",
            "@mimetype": "image/gif"
          },
          {
            "@category": "thumbnail",
            "@height": "163",
            "@width": "65",
            "@_fa": "true",
            "$": "https://api.elsevier.com/content/object/eid/1-s2.0-S1381116914002672-gr7.sml?httpAccept=%2A%2F%2A",
            "@multimediatype": "GIF image file",
            "@type": "IMAGE-THUMBNAIL",
            "@size": "2080",
            "@ref": "gr7",
            "@mimetype": "image/gif"
          },
          {
            "@category": "thumbnail",
            "@height": "164",
            "@width": "112",
            "@_fa": "true",
            "$": "https://api.elsevier.com/content/object/eid/1-s2.0-S1381116914002672-gr6.sml?httpAccept=%2A%2F%2A",
            "@multimediatype": "GIF image file",
            "@type": "IMAGE-THUMBNAIL",
            "@size": "2405",
            "@ref": "gr6",
            "@mimetype": "image/gif"
          },
          {
            "@category": "thumbnail",
            "@height": "164",
            "@width": "216",
            "@_fa": "true",
            "$": "https://api.elsevier.com/content/object/eid/1-s2.0-S1381116914002672-gr5.sml?httpAccept=%2A%2F%2A",
            "@multimediatype": "GIF image file",
            "@type": "IMAGE-THUMBNAIL",
            "@size": "3384",
            "@ref": "gr5",
            "@mimetype": "image/gif"
          },
          {
            "@category": "thumbnail",
            "@height": "164",
            "@width": "217",
            "@_fa": "true",
            "$": "https://api.elsevier.com/content/object/eid/1-s2.0-S1381116914002672-gr4.sml?httpAccept=%2A%2F%2A",
            "@multimediatype": "GIF image file",
            "@type": "IMAGE-THUMBNAIL",
            "@size": "3884",
            "@ref": "gr4",
            "@mimetype": "image/gif"
          },
          {
            "@category": "thumbnail",
            "@height": "164",
            "@width": "108",
            "@_fa": "true",
            "$": "https://api.elsevier.com/content/object/eid/1-s2.0-S1381116914002672-gr3.sml?httpAccept=%2A%2F%2A",
            "@multimediatype": "GIF image file",
            "@type": "IMAGE-THUMBNAIL",
            "@size": "2440",
            "@ref": "gr3",
            "@mimetype": "image/gif"
          },
          {
            "@category": "thumbnail",
            "@height": "164",
            "@width": "110",
            "@_fa": "true",
            "$": "https://api.elsevier.com/content/object/eid/1-s2.0-S1381116914002672-gr2.sml?httpAccept=%2A%2F%2A",
            "@multimediatype": "GIF image file",
            "@type": "IMAGE-THUMBNAIL",
            "@size": "3035",
            "@ref": "gr2",
            "@mimetype": "image/gif"
          },
          {
            "@category": "thumbnail",
            "@height": "164",
            "@width": "164",
            "@_fa": "true",
            "$": "https://api.elsevier.com/content/object/eid/1-s2.0-S1381116914002672-gr1.sml?httpAccept=%2A%2F%2A",
            "@multimediatype": "GIF image file",
            "@type": "IMAGE-THUMBNAIL",
            "@size": "7850",
            "@ref": "gr1",
            "@mimetype": "image/gif"
          },
          {
            "@category": "thumbnail",
            "@height": "81",
            "@width": "219",
            "@_fa": "true",
            "$": "https://api.elsevier.com/content/object/eid/1-s2.0-S1381116914002672-fx9.sml?httpAccept=%2A%2F%2A",
            "@multimediatype": "GIF image file",
            "@type": "IMAGE-THUMBNAIL",
            "@size": "2509",
            "@ref": "fx9",
            "@mimetype": "image/gif"
          },
          {
            "@category": "thumbnail",
            "@height": "26",
            "@width": "219",
            "@_fa": "true",
            "$": "https://api.elsevier.com/content/object/eid/1-s2.0-S1381116914002672-fx8.sml?httpAccept=%2A%2F%2A",
            "@multimediatype": "GIF image file",
            "@type": "IMAGE-THUMBNAIL",
            "@size": "1535",
            "@ref": "fx8",
            "@mimetype": "image/gif"
          },
          {
            "@category": "thumbnail",
            "@height": "70",
            "@width": "219",
            "@_fa": "true",
            "$": "https://api.elsevier.com/content/object/eid/1-s2.0-S1381116914002672-fx7.sml?httpAccept=%2A%2F%2A",
            "@multimediatype": "GIF image file",
            "@type": "IMAGE-THUMBNAIL",
            "@size": "2181",
            "@ref": "fx7",
            "@mimetype": "image/gif"
          },
          {
            "@category": "thumbnail",
            "@height": "64",
            "@width": "219",
            "@_fa": "true",
            "$": "https://api.elsevier.com/content/object/eid/1-s2.0-S1381116914002672-fx6.sml?httpAccept=%2A%2F%2A",
            "@multimediatype": "GIF image file",
            "@type": "IMAGE-THUMBNAIL",
            "@size": "2337",
            "@ref": "fx6",
            "@mimetype": "image/gif"
          },
          {
            "@category": "thumbnail",
            "@height": "32",
            "@width": "219",
            "@_fa": "true",
            "$": "https://api.elsevier.com/content/object/eid/1-s2.0-S1381116914002672-fx5.sml?httpAccept=%2A%2F%2A",
            "@multimediatype": "GIF image file",
            "@type": "IMAGE-THUMBNAIL",
            "@size": "1566",
            "@ref": "fx5",
            "@mimetype": "image/gif"
          },
          {
            "@category": "thumbnail",
            "@height": "65",
            "@width": "219",
            "@_fa": "true",
            "$": "https://api.elsevier.com/content/object/eid/1-s2.0-S1381116914002672-fx4.sml?httpAccept=%2A%2F%2A",
            "@multimediatype": "GIF image file",
            "@type": "IMAGE-THUMBNAIL",
            "@size": "2381",
            "@ref": "fx4",
            "@mimetype": "image/gif"
          },
          {
            "@category": "thumbnail",
            "@height": "22",
            "@width": "219",
            "@_fa": "true",
            "$": "https://api.elsevier.com/content/object/eid/1-s2.0-S1381116914002672-fx3.sml?httpAccept=%2A%2F%2A",
            "@multimediatype": "GIF image file",
            "@type": "IMAGE-THUMBNAIL",
            "@size": "1442",
            "@ref": "fx3",
            "@mimetype": "image/gif"
          },
          {
            "@category": "thumbnail",
            "@height": "48",
            "@width": "219",
            "@_fa": "true",
            "$": "https://api.elsevier.com/content/object/eid/1-s2.0-S1381116914002672-fx2.sml?httpAccept=%2A%2F%2A",
            "@multimediatype": "GIF image file",
            "@type": "IMAGE-THUMBNAIL",
            "@size": "1726",
            "@ref": "fx2",
            "@mimetype": "image/gif"
          },
          {
            "@category": "thumbnail",
            "@height": "53",
            "@width": "219",
            "@_fa": "true",
            "$": "https://api.elsevier.com/content/object/eid/1-s2.0-S1381116914002672-fx11.sml?httpAccept=%2A%2F%2A",
            "@multimediatype": "GIF image file",
            "@type": "IMAGE-THUMBNAIL",
            "@size": "1512",
            "@ref": "fx11",
            "@mimetype": "image/gif"
          },
          {
            "@category": "thumbnail",
            "@height": "20",
            "@width": "219",
            "@_fa": "true",
            "$": "https://api.elsevier.com/content/object/eid/1-s2.0-S1381116914002672-fx10.sml?httpAccept=%2A%2F%2A",
            "@multimediatype": "GIF image file",
            "@type": "IMAGE-THUMBNAIL",
            "@size": "1548",
            "@ref": "fx10",
            "@mimetype": "image/gif"
          },
          {
            "@category": "thumbnail",
            "@height": "88",
            "@width": "219",
            "@_fa": "true",
            "$": "https://api.elsevier.com/content/object/eid/1-s2.0-S1381116914002672-fx1.sml?httpAccept=%2A%2F%2A",
            "@multimediatype": "GIF image file",
            "@type": "IMAGE-THUMBNAIL",
            "@size": "1456",
            "@ref": "fx1",
            "@mimetype": "image/gif"
          },
          {
            "@category": "standard",
            "@_fa": "true",
            "$": "https://api.elsevier.com/content/object/eid/1-s2.0-S1381116914002672-mmc1.pdf?httpAccept=%2A%2F%2A",
            "@multimediatype": "Acrobat PDF file",
            "@type": "APPLICATION",
            "@size": "124264",
            "@ref": "mmc1",
            "@mimetype": "application/pdf"
          }
        ]
      },
      "link": {
        "@rel": "abstract",
        "@href": "https://api.elsevier.com/content/abstract/scopus_id/84903935508"
      }
    }
  }
}