{
  "metadata": {
    "title": "Oxidative dehydrogenation of <ce:italic>n</ce:italic>-butane to butadiene over Bi–Ni–O/γ-alumina catalyst",
    "authors": "; ; ",
    "journal": "Journal of Molecular Catalysis A: Chemical",
    "date": "2015-05-01",
    "doi": "10.1016/j.molcata.2015.01.016",
    "abstract": "",
    "uri": "https://api.elsevier.com/content/article/pii/S1381116915000205",
    "pii": "S1381116915000205"
  },
  "fulltext": {
    "full-text-retrieval-response": {
      "scopus-eid": "2-s2.0-84924243773",
      "originalText": "serial JL 271358 291210 291744 291790 291809 31 Journal of Molecular Catalysis A: Chemical JOURNALMOLECULARCATALYSISACHEMICAL 2015-01-20 2015-01-20 2015-03-16T16:56:58 1-s2.0-S1381116915000205 S1381-1169(15)00020-5 S1381116915000205 10.1016/j.molcata.2015.01.016 S300 S300.1 FULL-TEXT 1-s2.0-S1381116915X00033 2015-05-15T05:56:33.63776-04:00 0 0 20150501 2015 2015-01-20T07:43:13.513181Z absattachment articleinfo articletitlenorm authfirstinitialnorm authfirstsurnamenorm cid cids contenttype copyright crossmark dateloaded dateloadedtxt datesearch datesort dateupdated dco docsubtype doctype doi eid ewtransactionid hubeid indexeddate issn issnnorm itemstage itemtransactionid itemweight openaccess openarchive pg pgfirst pglast pii piinorm pubdatestart pubdatetxt pubyr sectiontitle sortorder srctitle srctitlenorm srctype ssids alllist content subj subheadings suppl tomb volfirst volissue volumelist webpdf webpdfpagecount yearnav figure table body mmlmath acknowledge affil articletitle auth authfirstini authfull authkeywords authlast highlightsabst orcid primabst ref specialabst 1381-1169 13811169 true 400 400 C Volume 400 18 121 131 121 131 20150501 1 May 2015 2015-05-01 2015 Regular Papers article fla Copyright © 2015 Elsevier B.V. All rights reserved. OXIDATIVEDEHYDROGENATIONNBUTANEBUTADIENEOVERBINIOALUMINACATALYST JERMY B 1 Introduction 2 Experimental 2.1 Catalyst preparation 2.2 Catalyst characterization 2.3 Catalytic evaluation 3 Results and discussion 3.1 Catalytic evaluation 3.1.1 Effect of nickel loading over γ-Al2O3 3.1.2 Bi–Ni oxide/γ-Al2O3 catalyst 3.1.2.1 Influence of bismuth substitution over 30wt% Ni/γ-Al2O3 catalyst 3.1.2.2 Effect of bismuth addition to 20wt% Ni/γ-Al2O3 3.1.3 Influence of reaction condition over Bi–Ni oxide/γ-Al2O3 catalyst 3.1.3.1 O2/n-C4H10 ratio 3.1.3.2 Reaction temperature 3.1.4 Effectiveness of oxidative hydrogen removal 3.2 Catalyst characterization 3.2.1 Surface area and porosity 3.2.2 X-ray diffraction 3.2.3 Temperature programmed reduction 3.2.4 Temperature programmed desorption (NH3/CO2) 3.3 Modeling of catalyst and reaction 4 Conclusions Acknowledgements References BURRINGTON 1980 235 254 J CORMA 1995 559 614 A LOPEZNIETOA 1998 215 228 J MADEIRA 2002 247 286 L KEYVANLOO 2010 224 230 K LIU 2009 156 160 J WANG 2010 51 58 F AJAYI 2012 189 196 B AJAYI 2013 1257 1270 B MARCUA 2003 241 250 I MURGIA 2006 134 143 V SOARES 2003 191 200 A LEMONIDOU 2007 132 138 A BHATTACHARYYA 1992 29 43 D RUBIO 2003 4619 4627 O KIJIMA 2009 63 69 N MALDONADOHODAR 1996 399 410 F MALDONADOHODAR 1996 313 323 F PACHECO 2000 101 107 M HERACLEOUS 2010 67 75 E CLAUDIABERGERKARIN 2011 116 124 KIMURA 2013 1175 1181 T KIMURA 2011 s101 s105 T HERACLEOUS 2005 159 171 E HERACLEOUS 2006 175 189 SKOUFA 2012 48 56 Z DAI 2004 491 499 H AI 1972 202 211 S JERMYX2015X121 JERMYX2015X121X131 JERMYX2015X121XB JERMYX2015X121X131XB item S1381-1169(15)00020-5 S1381116915000205 1-s2.0-S1381116915000205 10.1016/j.molcata.2015.01.016 271358 2015-03-16T15:58:15.826841-04:00 2015-05-01 1-s2.0-S1381116915000205-main.pdf https://s3.amazonaws.com/prod-ucs-content-store-us-east/content/pii:S1381116915000205/MAIN/application/pdf/44362b5dabae55f2115a70168a1de00f/main.pdf https://s3-eu-west-1.amazonaws.com/prod-ucs-content-store-eu-west/content/pii:S1381116915000205/MAIN/application/pdf/44362b5dabae55f2115a70168a1de00f/main.pdf main.pdf pdf true 1015155 MAIN 11 1-s2.0-S1381116915000205-main_1.png https://s3-eu-west-1.amazonaws.com/prod-ucs-content-store-eu-west/content/pii:S1381116915000205/PREVIEW/image/png/21778fea7dd17d0f40f4d00a069b55e7/main_1.png https://s3.amazonaws.com/prod-ucs-content-store-us-east/content/pii:S1381116915000205/PREVIEW/image/png/21778fea7dd17d0f40f4d00a069b55e7/main_1.png main_1.png png 59055 849 656 IMAGE-WEB-PDF 1 1-s2.0-S1381116915000205-si1.gif https://s3.amazonaws.com/prod-ucs-content-store-us-east/content/pii:S1381116915000205/STRIPIN/image/gif/38787da67f9054ff37779fbef47cc38c/si1.gif https://s3-eu-west-1.amazonaws.com/prod-ucs-content-store-eu-west/content/pii:S1381116915000205/STRIPIN/image/gif/38787da67f9054ff37779fbef47cc38c/si1.gif si1 si1.gif gif 1040 16 242 ALTIMG 1-s2.0-S1381116915000205-gr9_lrg.jpg https://s3.amazonaws.com/prod-ucs-content-store-us-east/content/pii:S1381116915000205/gr9/HIGHRES/image/jpeg/de01627e1cca1fc76b8f50a4db40b588/gr9_lrg.jpg https://s3-eu-west-1.amazonaws.com/prod-ucs-content-store-eu-west/content/pii:S1381116915000205/gr9/HIGHRES/image/jpeg/de01627e1cca1fc76b8f50a4db40b588/gr9_lrg.jpg gr9 gr9_lrg.jpg jpg 193416 1006 900 IMAGE-HIGH-RES 1-s2.0-S1381116915000205-gr8_lrg.jpg https://s3.amazonaws.com/prod-ucs-content-store-us-east/content/pii:S1381116915000205/gr8/HIGHRES/image/jpeg/4928d2fcab6f356b6cbbfe296d255f94/gr8_lrg.jpg https://s3-eu-west-1.amazonaws.com/prod-ucs-content-store-eu-west/content/pii:S1381116915000205/gr8/HIGHRES/image/jpeg/4928d2fcab6f356b6cbbfe296d255f94/gr8_lrg.jpg gr8 gr8_lrg.jpg jpg 182461 1597 1000 IMAGE-HIGH-RES 1-s2.0-S1381116915000205-gr7_lrg.jpg https://s3.amazonaws.com/prod-ucs-content-store-us-east/content/pii:S1381116915000205/gr7/HIGHRES/image/jpeg/d13ce292a17dc8e780b2ef42f280f904/gr7_lrg.jpg https://s3-eu-west-1.amazonaws.com/prod-ucs-content-store-eu-west/content/pii:S1381116915000205/gr7/HIGHRES/image/jpeg/d13ce292a17dc8e780b2ef42f280f904/gr7_lrg.jpg gr7 gr7_lrg.jpg jpg 100329 726 850 IMAGE-HIGH-RES 1-s2.0-S1381116915000205-gr6_lrg.jpg https://s3.amazonaws.com/prod-ucs-content-store-us-east/content/pii:S1381116915000205/gr6/HIGHRES/image/jpeg/835019e5aef46df058f5ca9bc6b8e633/gr6_lrg.jpg https://s3-eu-west-1.amazonaws.com/prod-ucs-content-store-eu-west/content/pii:S1381116915000205/gr6/HIGHRES/image/jpeg/835019e5aef46df058f5ca9bc6b8e633/gr6_lrg.jpg gr6 gr6_lrg.jpg jpg 124949 604 1718 IMAGE-HIGH-RES 1-s2.0-S1381116915000205-gr5_lrg.jpg https://s3.amazonaws.com/prod-ucs-content-store-us-east/content/pii:S1381116915000205/gr5/HIGHRES/image/jpeg/e1920471c4aa3db429d3a69497579a76/gr5_lrg.jpg https://s3-eu-west-1.amazonaws.com/prod-ucs-content-store-eu-west/content/pii:S1381116915000205/gr5/HIGHRES/image/jpeg/e1920471c4aa3db429d3a69497579a76/gr5_lrg.jpg gr5 gr5_lrg.jpg jpg 109598 618 1737 IMAGE-HIGH-RES 1-s2.0-S1381116915000205-gr4_lrg.jpg https://s3.amazonaws.com/prod-ucs-content-store-us-east/content/pii:S1381116915000205/gr4/HIGHRES/image/jpeg/0b8efb43bc38dc24ea59388aeee13b3a/gr4_lrg.jpg https://s3-eu-west-1.amazonaws.com/prod-ucs-content-store-eu-west/content/pii:S1381116915000205/gr4/HIGHRES/image/jpeg/0b8efb43bc38dc24ea59388aeee13b3a/gr4_lrg.jpg gr4 gr4_lrg.jpg jpg 125637 621 1723 IMAGE-HIGH-RES 1-s2.0-S1381116915000205-gr3_lrg.jpg https://s3.amazonaws.com/prod-ucs-content-store-us-east/content/pii:S1381116915000205/gr3/HIGHRES/image/jpeg/c230e29a6ee6462500488407d3b11930/gr3_lrg.jpg https://s3-eu-west-1.amazonaws.com/prod-ucs-content-store-eu-west/content/pii:S1381116915000205/gr3/HIGHRES/image/jpeg/c230e29a6ee6462500488407d3b11930/gr3_lrg.jpg gr3 gr3_lrg.jpg jpg 659851 3720 2304 IMAGE-HIGH-RES 1-s2.0-S1381116915000205-gr2_lrg.jpg https://s3.amazonaws.com/prod-ucs-content-store-us-east/content/pii:S1381116915000205/gr2/HIGHRES/image/jpeg/26da22be8a7ca163ff2e9b242a42d3a6/gr2_lrg.jpg https://s3-eu-west-1.amazonaws.com/prod-ucs-content-store-eu-west/content/pii:S1381116915000205/gr2/HIGHRES/image/jpeg/26da22be8a7ca163ff2e9b242a42d3a6/gr2_lrg.jpg gr2 gr2_lrg.jpg jpg 200401 1556 946 IMAGE-HIGH-RES 1-s2.0-S1381116915000205-gr13_lrg.jpg https://s3.amazonaws.com/prod-ucs-content-store-us-east/content/pii:S1381116915000205/gr13/HIGHRES/image/jpeg/7ae5207c0c8b69a09753c3267a290ea9/gr13_lrg.jpg https://s3-eu-west-1.amazonaws.com/prod-ucs-content-store-eu-west/content/pii:S1381116915000205/gr13/HIGHRES/image/jpeg/7ae5207c0c8b69a09753c3267a290ea9/gr13_lrg.jpg gr13 gr13_lrg.jpg jpg 248187 1616 1500 IMAGE-HIGH-RES 1-s2.0-S1381116915000205-gr12_lrg.jpg https://s3.amazonaws.com/prod-ucs-content-store-us-east/content/pii:S1381116915000205/gr12/HIGHRES/image/jpeg/6402c8c4dc16f4e7fa205bc6879be9f2/gr12_lrg.jpg https://s3-eu-west-1.amazonaws.com/prod-ucs-content-store-eu-west/content/pii:S1381116915000205/gr12/HIGHRES/image/jpeg/6402c8c4dc16f4e7fa205bc6879be9f2/gr12_lrg.jpg gr12 gr12_lrg.jpg jpg 133162 1160 738 IMAGE-HIGH-RES 1-s2.0-S1381116915000205-gr11_lrg.jpg https://s3.amazonaws.com/prod-ucs-content-store-us-east/content/pii:S1381116915000205/gr11/HIGHRES/image/jpeg/9b6b194ecf276def6fff350f73f72b29/gr11_lrg.jpg https://s3-eu-west-1.amazonaws.com/prod-ucs-content-store-eu-west/content/pii:S1381116915000205/gr11/HIGHRES/image/jpeg/9b6b194ecf276def6fff350f73f72b29/gr11_lrg.jpg gr11 gr11_lrg.jpg jpg 127194 1074 674 IMAGE-HIGH-RES 1-s2.0-S1381116915000205-gr10_lrg.jpg https://s3.amazonaws.com/prod-ucs-content-store-us-east/content/pii:S1381116915000205/gr10/HIGHRES/image/jpeg/2b6e8770f9be09b5ba1d95ab93b1098e/gr10_lrg.jpg https://s3-eu-west-1.amazonaws.com/prod-ucs-content-store-eu-west/content/pii:S1381116915000205/gr10/HIGHRES/image/jpeg/2b6e8770f9be09b5ba1d95ab93b1098e/gr10_lrg.jpg gr10 gr10_lrg.jpg jpg 136758 873 1002 IMAGE-HIGH-RES 1-s2.0-S1381116915000205-gr1_lrg.jpg https://s3.amazonaws.com/prod-ucs-content-store-us-east/content/pii:S1381116915000205/gr1/HIGHRES/image/jpeg/91299fcf547d3d91b302a111087b3b00/gr1_lrg.jpg https://s3-eu-west-1.amazonaws.com/prod-ucs-content-store-eu-west/content/pii:S1381116915000205/gr1/HIGHRES/image/jpeg/91299fcf547d3d91b302a111087b3b00/gr1_lrg.jpg gr1 gr1_lrg.jpg jpg 63744 678 846 IMAGE-HIGH-RES 1-s2.0-S1381116915000205-fx1_lrg.jpg https://s3.amazonaws.com/prod-ucs-content-store-us-east/content/pii:S1381116915000205/fx1/HIGHRES/image/jpeg/0f6d43df53aa29a23e5f4e3940999412/fx1_lrg.jpg https://s3-eu-west-1.amazonaws.com/prod-ucs-content-store-eu-west/content/pii:S1381116915000205/fx1/HIGHRES/image/jpeg/0f6d43df53aa29a23e5f4e3940999412/fx1_lrg.jpg fx1 true fx1_lrg.jpg jpg 153967 886 2213 IMAGE-HIGH-RES 1-s2.0-S1381116915000205-gr9.jpg https://s3.amazonaws.com/prod-ucs-content-store-us-east/content/pii:S1381116915000205/gr9/DOWNSAMPLED/image/jpeg/3b8563f7609a1398781b43a91a0e5826/gr9.jpg https://s3-eu-west-1.amazonaws.com/prod-ucs-content-store-eu-west/content/pii:S1381116915000205/gr9/DOWNSAMPLED/image/jpeg/3b8563f7609a1398781b43a91a0e5826/gr9.jpg gr9 gr9.jpg jpg 53470 379 339 IMAGE-DOWNSAMPLED 1-s2.0-S1381116915000205-gr8.jpg https://s3.amazonaws.com/prod-ucs-content-store-us-east/content/pii:S1381116915000205/gr8/DOWNSAMPLED/image/jpeg/46c5c935f5be810191ed0a22d4bc9fa4/gr8.jpg https://s3-eu-west-1.amazonaws.com/prod-ucs-content-store-eu-west/content/pii:S1381116915000205/gr8/DOWNSAMPLED/image/jpeg/46c5c935f5be810191ed0a22d4bc9fa4/gr8.jpg gr8 gr8.jpg jpg 50155 600 376 IMAGE-DOWNSAMPLED 1-s2.0-S1381116915000205-gr7.jpg https://s3.amazonaws.com/prod-ucs-content-store-us-east/content/pii:S1381116915000205/gr7/DOWNSAMPLED/image/jpeg/abb1dce64d04ac5c85aeb89371433086/gr7.jpg https://s3-eu-west-1.amazonaws.com/prod-ucs-content-store-eu-west/content/pii:S1381116915000205/gr7/DOWNSAMPLED/image/jpeg/abb1dce64d04ac5c85aeb89371433086/gr7.jpg gr7 gr7.jpg jpg 30537 273 320 IMAGE-DOWNSAMPLED 1-s2.0-S1381116915000205-gr6.jpg https://s3.amazonaws.com/prod-ucs-content-store-us-east/content/pii:S1381116915000205/gr6/DOWNSAMPLED/image/jpeg/fe7a78e02d3e2926ddf97e22d2cce982/gr6.jpg https://s3-eu-west-1.amazonaws.com/prod-ucs-content-store-eu-west/content/pii:S1381116915000205/gr6/DOWNSAMPLED/image/jpeg/fe7a78e02d3e2926ddf97e22d2cce982/gr6.jpg gr6 gr6.jpg jpg 35442 227 647 IMAGE-DOWNSAMPLED 1-s2.0-S1381116915000205-gr5.jpg https://s3.amazonaws.com/prod-ucs-content-store-us-east/content/pii:S1381116915000205/gr5/DOWNSAMPLED/image/jpeg/7f9e4300a2b3c8be99f5316289ab4846/gr5.jpg https://s3-eu-west-1.amazonaws.com/prod-ucs-content-store-eu-west/content/pii:S1381116915000205/gr5/DOWNSAMPLED/image/jpeg/7f9e4300a2b3c8be99f5316289ab4846/gr5.jpg gr5 gr5.jpg jpg 32605 233 654 IMAGE-DOWNSAMPLED 1-s2.0-S1381116915000205-gr4.jpg https://s3.amazonaws.com/prod-ucs-content-store-us-east/content/pii:S1381116915000205/gr4/DOWNSAMPLED/image/jpeg/11486b00f76d24af4b256a081211f27c/gr4.jpg https://s3-eu-west-1.amazonaws.com/prod-ucs-content-store-eu-west/content/pii:S1381116915000205/gr4/DOWNSAMPLED/image/jpeg/11486b00f76d24af4b256a081211f27c/gr4.jpg gr4 gr4.jpg jpg 36677 234 648 IMAGE-DOWNSAMPLED 1-s2.0-S1381116915000205-gr3.jpg https://s3.amazonaws.com/prod-ucs-content-store-us-east/content/pii:S1381116915000205/gr3/DOWNSAMPLED/image/jpeg/30cd6a5fc7ce5370cdd33723fd2d7b64/gr3.jpg https://s3-eu-west-1.amazonaws.com/prod-ucs-content-store-eu-west/content/pii:S1381116915000205/gr3/DOWNSAMPLED/image/jpeg/30cd6a5fc7ce5370cdd33723fd2d7b64/gr3.jpg gr3 gr3.jpg jpg 41539 599 371 IMAGE-DOWNSAMPLED 1-s2.0-S1381116915000205-gr2.jpg https://s3.amazonaws.com/prod-ucs-content-store-us-east/content/pii:S1381116915000205/gr2/DOWNSAMPLED/image/jpeg/b2bb89c3313f8cd411b419863e316e89/gr2.jpg https://s3-eu-west-1.amazonaws.com/prod-ucs-content-store-eu-west/content/pii:S1381116915000205/gr2/DOWNSAMPLED/image/jpeg/b2bb89c3313f8cd411b419863e316e89/gr2.jpg gr2 gr2.jpg jpg 56610 586 356 IMAGE-DOWNSAMPLED 1-s2.0-S1381116915000205-gr13.jpg https://s3.amazonaws.com/prod-ucs-content-store-us-east/content/pii:S1381116915000205/gr13/DOWNSAMPLED/image/jpeg/55ebdfa9281bf8455d9f7eaf968e711c/gr13.jpg https://s3-eu-west-1.amazonaws.com/prod-ucs-content-store-eu-west/content/pii:S1381116915000205/gr13/DOWNSAMPLED/image/jpeg/55ebdfa9281bf8455d9f7eaf968e711c/gr13.jpg gr13 gr13.jpg jpg 71450 609 565 IMAGE-DOWNSAMPLED 1-s2.0-S1381116915000205-gr12.jpg https://s3.amazonaws.com/prod-ucs-content-store-us-east/content/pii:S1381116915000205/gr12/DOWNSAMPLED/image/jpeg/6ca1614e8951754b8a9365e3e12d8445/gr12.jpg https://s3-eu-west-1.amazonaws.com/prod-ucs-content-store-eu-west/content/pii:S1381116915000205/gr12/DOWNSAMPLED/image/jpeg/6ca1614e8951754b8a9365e3e12d8445/gr12.jpg gr12 gr12.jpg jpg 39389 435 277 IMAGE-DOWNSAMPLED 1-s2.0-S1381116915000205-gr11.jpg https://s3.amazonaws.com/prod-ucs-content-store-us-east/content/pii:S1381116915000205/gr11/DOWNSAMPLED/image/jpeg/2021c818fd361f70704a1e9596c95b8f/gr11.jpg https://s3-eu-west-1.amazonaws.com/prod-ucs-content-store-eu-west/content/pii:S1381116915000205/gr11/DOWNSAMPLED/image/jpeg/2021c818fd361f70704a1e9596c95b8f/gr11.jpg gr11 gr11.jpg jpg 38004 403 253 IMAGE-DOWNSAMPLED 1-s2.0-S1381116915000205-gr10.jpg https://s3.amazonaws.com/prod-ucs-content-store-us-east/content/pii:S1381116915000205/gr10/DOWNSAMPLED/image/jpeg/e002a96941ed47ab84aea87c60c42188/gr10.jpg https://s3-eu-west-1.amazonaws.com/prod-ucs-content-store-eu-west/content/pii:S1381116915000205/gr10/DOWNSAMPLED/image/jpeg/e002a96941ed47ab84aea87c60c42188/gr10.jpg gr10 gr10.jpg jpg 40823 328 377 IMAGE-DOWNSAMPLED 1-s2.0-S1381116915000205-gr1.jpg https://s3.amazonaws.com/prod-ucs-content-store-us-east/content/pii:S1381116915000205/gr1/DOWNSAMPLED/image/jpeg/86aa95a4aae90bd41ea15e8e4faf993a/gr1.jpg https://s3-eu-west-1.amazonaws.com/prod-ucs-content-store-eu-west/content/pii:S1381116915000205/gr1/DOWNSAMPLED/image/jpeg/86aa95a4aae90bd41ea15e8e4faf993a/gr1.jpg gr1 gr1.jpg jpg 21670 255 318 IMAGE-DOWNSAMPLED 1-s2.0-S1381116915000205-fx1.jpg https://s3.amazonaws.com/prod-ucs-content-store-us-east/content/pii:S1381116915000205/fx1/DOWNSAMPLED/image/jpeg/c134f4ef5d346ddb8b813e42bea8d57b/fx1.jpg https://s3-eu-west-1.amazonaws.com/prod-ucs-content-store-eu-west/content/pii:S1381116915000205/fx1/DOWNSAMPLED/image/jpeg/c134f4ef5d346ddb8b813e42bea8d57b/fx1.jpg fx1 true fx1.jpg jpg 22573 200 500 IMAGE-DOWNSAMPLED 1-s2.0-S1381116915000205-gr9.sml https://s3.amazonaws.com/prod-ucs-content-store-us-east/content/pii:S1381116915000205/gr9/THUMBNAIL/image/gif/274bb0b429a61dd6df81f96cc74f5028/gr9.sml https://s3-eu-west-1.amazonaws.com/prod-ucs-content-store-eu-west/content/pii:S1381116915000205/gr9/THUMBNAIL/image/gif/274bb0b429a61dd6df81f96cc74f5028/gr9.sml gr9 gr9.sml sml 6712 163 146 IMAGE-THUMBNAIL 1-s2.0-S1381116915000205-gr8.sml https://s3.amazonaws.com/prod-ucs-content-store-us-east/content/pii:S1381116915000205/gr8/THUMBNAIL/image/gif/cfe39f81edbf262b46bbfe2a5f307199/gr8.sml https://s3-eu-west-1.amazonaws.com/prod-ucs-content-store-eu-west/content/pii:S1381116915000205/gr8/THUMBNAIL/image/gif/cfe39f81edbf262b46bbfe2a5f307199/gr8.sml gr8 gr8.sml sml 3802 163 102 IMAGE-THUMBNAIL 1-s2.0-S1381116915000205-gr7.sml https://s3.amazonaws.com/prod-ucs-content-store-us-east/content/pii:S1381116915000205/gr7/THUMBNAIL/image/gif/3a74ffbcab4ef009562ab90a1df81235/gr7.sml https://s3-eu-west-1.amazonaws.com/prod-ucs-content-store-eu-west/content/pii:S1381116915000205/gr7/THUMBNAIL/image/gif/3a74ffbcab4ef009562ab90a1df81235/gr7.sml gr7 gr7.sml sml 5928 164 192 IMAGE-THUMBNAIL 1-s2.0-S1381116915000205-gr6.sml https://s3.amazonaws.com/prod-ucs-content-store-us-east/content/pii:S1381116915000205/gr6/THUMBNAIL/image/gif/f43a8a9e4c19aaf8e92217c1eaa32969/gr6.sml https://s3-eu-west-1.amazonaws.com/prod-ucs-content-store-eu-west/content/pii:S1381116915000205/gr6/THUMBNAIL/image/gif/f43a8a9e4c19aaf8e92217c1eaa32969/gr6.sml gr6 gr6.sml sml 3771 77 219 IMAGE-THUMBNAIL 1-s2.0-S1381116915000205-gr5.sml https://s3.amazonaws.com/prod-ucs-content-store-us-east/content/pii:S1381116915000205/gr5/THUMBNAIL/image/gif/e7c0539407b14023e53dffaaffaa2522/gr5.sml https://s3-eu-west-1.amazonaws.com/prod-ucs-content-store-eu-west/content/pii:S1381116915000205/gr5/THUMBNAIL/image/gif/e7c0539407b14023e53dffaaffaa2522/gr5.sml gr5 gr5.sml sml 3455 78 219 IMAGE-THUMBNAIL 1-s2.0-S1381116915000205-gr4.sml https://s3.amazonaws.com/prod-ucs-content-store-us-east/content/pii:S1381116915000205/gr4/THUMBNAIL/image/gif/2404d9fc8c4664fbbd98955e4d2ceae0/gr4.sml https://s3-eu-west-1.amazonaws.com/prod-ucs-content-store-eu-west/content/pii:S1381116915000205/gr4/THUMBNAIL/image/gif/2404d9fc8c4664fbbd98955e4d2ceae0/gr4.sml gr4 gr4.sml sml 3732 79 219 IMAGE-THUMBNAIL 1-s2.0-S1381116915000205-gr3.sml https://s3.amazonaws.com/prod-ucs-content-store-us-east/content/pii:S1381116915000205/gr3/THUMBNAIL/image/gif/1e61570e6fb6300ff29f1fd2f4f4eace/gr3.sml https://s3-eu-west-1.amazonaws.com/prod-ucs-content-store-eu-west/content/pii:S1381116915000205/gr3/THUMBNAIL/image/gif/1e61570e6fb6300ff29f1fd2f4f4eace/gr3.sml gr3 gr3.sml sml 3943 163 101 IMAGE-THUMBNAIL 1-s2.0-S1381116915000205-gr2.sml https://s3.amazonaws.com/prod-ucs-content-store-us-east/content/pii:S1381116915000205/gr2/THUMBNAIL/image/gif/51b3ef62b704d0009a8e83c03980769a/gr2.sml https://s3-eu-west-1.amazonaws.com/prod-ucs-content-store-eu-west/content/pii:S1381116915000205/gr2/THUMBNAIL/image/gif/51b3ef62b704d0009a8e83c03980769a/gr2.sml gr2 gr2.sml sml 4293 163 99 IMAGE-THUMBNAIL 1-s2.0-S1381116915000205-gr13.sml https://s3.amazonaws.com/prod-ucs-content-store-us-east/content/pii:S1381116915000205/gr13/THUMBNAIL/image/gif/b785ad9de74795f0620b44149cf64a64/gr13.sml https://s3-eu-west-1.amazonaws.com/prod-ucs-content-store-eu-west/content/pii:S1381116915000205/gr13/THUMBNAIL/image/gif/b785ad9de74795f0620b44149cf64a64/gr13.sml gr13 gr13.sml sml 4602 164 152 IMAGE-THUMBNAIL 1-s2.0-S1381116915000205-gr12.sml https://s3.amazonaws.com/prod-ucs-content-store-us-east/content/pii:S1381116915000205/gr12/THUMBNAIL/image/gif/9ef2a7d908c3139baff6c0e71b265a65/gr12.sml https://s3-eu-west-1.amazonaws.com/prod-ucs-content-store-eu-west/content/pii:S1381116915000205/gr12/THUMBNAIL/image/gif/9ef2a7d908c3139baff6c0e71b265a65/gr12.sml gr12 gr12.sml sml 3968 163 104 IMAGE-THUMBNAIL 1-s2.0-S1381116915000205-gr11.sml https://s3.amazonaws.com/prod-ucs-content-store-us-east/content/pii:S1381116915000205/gr11/THUMBNAIL/image/gif/0466facf142c3a588ecc27d549dd0d89/gr11.sml https://s3-eu-west-1.amazonaws.com/prod-ucs-content-store-eu-west/content/pii:S1381116915000205/gr11/THUMBNAIL/image/gif/0466facf142c3a588ecc27d549dd0d89/gr11.sml gr11 gr11.sml sml 4220 164 103 IMAGE-THUMBNAIL 1-s2.0-S1381116915000205-gr10.sml https://s3.amazonaws.com/prod-ucs-content-store-us-east/content/pii:S1381116915000205/gr10/THUMBNAIL/image/gif/a0748d9b7e70d7ec187dcb022633bbd4/gr10.sml https://s3-eu-west-1.amazonaws.com/prod-ucs-content-store-eu-west/content/pii:S1381116915000205/gr10/THUMBNAIL/image/gif/a0748d9b7e70d7ec187dcb022633bbd4/gr10.sml gr10 gr10.sml sml 5703 164 188 IMAGE-THUMBNAIL 1-s2.0-S1381116915000205-gr1.sml https://s3.amazonaws.com/prod-ucs-content-store-us-east/content/pii:S1381116915000205/gr1/THUMBNAIL/image/gif/8e2d745f518037d1b1b5f2a58935709f/gr1.sml https://s3-eu-west-1.amazonaws.com/prod-ucs-content-store-eu-west/content/pii:S1381116915000205/gr1/THUMBNAIL/image/gif/8e2d745f518037d1b1b5f2a58935709f/gr1.sml gr1 gr1.sml sml 4483 163 204 IMAGE-THUMBNAIL 1-s2.0-S1381116915000205-fx1.sml https://s3.amazonaws.com/prod-ucs-content-store-us-east/content/pii:S1381116915000205/fx1/THUMBNAIL/image/gif/8a1eef6508956761865281d05b20c3c0/fx1.sml https://s3-eu-west-1.amazonaws.com/prod-ucs-content-store-eu-west/content/pii:S1381116915000205/fx1/THUMBNAIL/image/gif/8a1eef6508956761865281d05b20c3c0/fx1.sml fx1 true fx1.sml sml 3959 88 219 IMAGE-THUMBNAIL MOLCAA 9399 S1381-1169(15)00020-5 10.1016/j.molcata.2015.01.016 Elsevier B.V. Fig. 1 Effect of Ni loading amount on n-butane conversion, NiO/γ-Al2O3, 400–500°C, O2/C4 =2 [mol/mol]. Fig. 2 Effect of Ni loading amount on product selectivity, NiO/γ-Al2O3, 400–500°C, O2/C4 =2 [mol/mol]. Fig. 3 Effect of Bi–Ni composition on n-butane conversion and product selectivity, catalyst: 30wt% metal/γ-Al2O3, reaction condition: 450°C, O2/C4 =2 [mol/mol]. Fig. 4 Effect of Bi amount to 20wt% Ni on n-butane conversion and product selectivity, 450°C, O2/C4 =2 [mol/mol]. Fig. 5 Effect of O2/C4 ratio on n-butane conversion and product selectivity, catalyst: 30wt Bi-20wt Ni/γ-Al2O3, 450°C. Fig. 6 Effect of temperature on n-butane conversion and product selectivity, catalyst: 30wt Bi-20wt Ni/γ-Al2O3, O2/C4 =2 [mol/mol]. Fig. 7 Effect of Bi amount to Ni on H2 formation at 450°C, O2/C4 =2 [mol/mol]. Fig. 8 Pore size distribution pattern of (a) γ-Al2O3, (b) 5wt% Ni/γ-Al2O3, (c) 10wt% Ni/γ-Al2O3, (d) 20wt% Ni/γ-Al2O3, (e) 30wt% Ni/γ-Al2O3, (f)10wt% Bi20wt% Ni/γ-Al2O3, (g) 20wt%Bi 10wt% Ni/γ-Al2O3, and (h) 30wt% Bi/γ-Al2O3. Fig. 9 XRD diffraction patterns of (a) γ-Al2O3, (b) 5wt% Ni/γ-Al2O3, (c) 10wt% Ni/γ-Al2O3, (d) 20wt% Ni/γ-Al2O3, (e) 30wt% Ni/γ-Al2O3, (f) 10wt% Bi20wt% Ni/γ-Al2O3, (g) 20wt%Bi 10wt% Ni/γ-Al2O3, and (h) 30wt% Bi/γ-Al2O3. Fig. 10 TPR profiles of (a) γ-Al2O3, (b) 5wt% Ni/γ-Al2O3, (c) 10wt% Ni/γ-Al2O3, (d) 20wt% Ni/γ-Al2O3, (e) 30wt% Ni/γ-Al2O3, (f) 10wt% Bi20wt% Ni/γ-Al2O3, (g) 20wt% Bi10wt% Ni/γ-Al2O3, and (h) 30wt% Bi/γ-Al2O3. Fig. 11 TPD of NH3 (a) γ-Al2O3, (b) 5wt% Ni/γ-Al2O3, (c) 10wt% Ni/γ-Al2O3, (d) 20wt% Ni/γ-Al2O3, (e) 30wt% Ni/γ-Al2O3, (f) 10wt% Bi20wt% Ni/γ-Al2O3, (g) 20wt% Bi10wt% Ni/γ-Al2O3, and (h) 30wt% Bi/γ-Al2O3. Fig. 12 TPD of CO2 (a) γ-Al2O3, (b) 5wt% Ni/γ-Al2O3, (c) 10wt% Ni/γ-Al2O3, (d) 20wt% Ni/γ-Al2O3, (e) 30wt% Ni/γ-Al2O3, (f) 10wt% Bi20wt% Ni/γ-Al2O3, (g) 20wt% Bi10wt% Ni/γ-Al2O3, and (h) 30wt% Bi/γ-Al2O3. Fig. 13 (i) Model of reaction and catalyst for oxidative dehydrogenation of n-butane to butadiene over Ni oxide/g-Al2O3 catalyst (a) γ-Al2O3 (b) 5wt% Ni/γ-Al2O3 (c) 10wt% Ni/γ-Al2O3 and (d) 30wt% Ni/γ-Al2O3. (ii) Model of reaction and catalyst for oxidative dehydrogenation of n-butane to butadiene over Bi-Ni oxide/g-Al2O3 catalyst (a) 30wt% Ni/γ-Al2O3 (b) 10wt% Bi20wt% Ni/γ-Al2O3 (c) 20wt% Bi10wt% Ni/γ-Al2O3 and (d) 30wt% Bi/γ-Al2O3. Table 1 Hydrogen formation and removal based on comparison between the observed and the hypothetical from reactions. Catalyst (wt%/Al2O3) Rx condition Observed H2 in product Hypothetical H2 Ef a O2 Conversion(%) O2/n-C4H10 Temperature (°C) Via DH b Via PO c None(γ-Al2O3) 2 450 2.0 6.8 39 96 41 5Ni 31 16 52 53 43 10Ni 28 20 30 43 45 20Ni 17 23 22 62 45 30Ni 11 21 23 74 43 10Bi–20Ni 6.5 32 7.1 84 42 20Bi–10Ni 0.8 26 1.5 97 38 30Bi 0.4 13 6.4 98 33 4Bi–20Ni 11 31 17 77 46 10Bi–20Ni 6.5 32 7.1 84 42 30Bi–20Ni 1.7 33 1.5 95 40 60Bi–20Ni 1.1 32 0.8 97 38 1 450 1.2 24 0.9 95 45 2 1.7 33 1.5 95 40 3 1.7 40 2.4 96 39 4 1.5 50 3.6 97 39 30Bi–20Ni 2 400 2.1 20 1.2 90 26 425 2.0 26 1.2 93 32 450 1.7 33 1.5 95 40 475 1.2 33 2.0 97 42 500 2.7 33 2.4 93 45 H2 amount: mol% to feed n-C4H10. a Ef: efficiency of oxidative hydrogen removal. b Dehydrogenation including butenes and doubly accounted butadiene. c Partial oxidation to 4CO/5H2. Table 2 BET surface area and pore structure of γ-Al2O3, NiO/γ-Al2O3 and Bi–NiO/γ-Al2O3 catalysts. Catalysts (wt%/Al2O3) BET surface area Surface area Pore volume Average pore diameter [m2/g-cat] a [m2/g-Al2O3] c [m2/g-cat] b [m2/g-Al2O3] c [cc/g-cat] b [cc/g-Al2O3] c [nm] d None(γ-Al2O3) 276 338 0.83 9.8 5Ni 294 312 312 331 0.66 0.76 9.2 10Ni 280 315 291 328 0.63 0.71 8.7 20Ni 246 308 250 313 0.42 0.53 6.8 30Ni 180 248 186 257 0.29 0.40 6.2 10Bi–20Ni 172 235 209 285 0.53 0.72 10.1 20Bi–10Ni 134 181 163 220 0.42 0.57 10.4 30Bi 144 197 168 224 0.41 0.54 9.6 a BET surface area. b Surface area, pore volume and average pore diameter measured using BJH isotherm. c Surface area and pore volume calculated by volume based Al2O3 using the equation: S A or P V × [ Σ ( M O X / M ) + 100 ] / 100 , where M=metal wt%; MOx=metal oxide wt%; SA=surface area; PV=pore volume. d Average pore diameter=4000×PV/SA. Table 3 H2 consumption in TPR of NiO/γ-Al2O3and Bi–NiO/γ-Al2O3 catalysts. Catalysts (wt%/Al2O3) TPR H2 consumption [m mol/g] (TM[°C]) I II III IV Total None(γ-Al2O3) – – – 0.571 (670) 0.571 5Ni 0.57 (317) 1.19 (560) 0.12 (800) – 1.88 10Ni 0.70 (298) 1.52 (536) 0.12 (775) – 2.34 20Ni 1.20 (280) 0.96 (500) 1.85 (559) 0.34 (780) 4.35 30Ni 1.24 (278) 1.02 (482) 1.87 (568) 0.26 (780) 4.39 10Bi–20Ni 1.11 (274) 0.75 (382) 2.00 (487) 1.74 (545) 5.60 20Bi–10Ni 1.04 (338) 0.60 (425) 1.28 (510) 1.14 (566) 4.06 30Bi 0.82 (407) 1.16 (475) 1.01 (537) 0.59 (584) 3.58 Table 4 Temperature programmed analysis (NH3- and CO2-TPD) of Ni/γ-Al2O3 and Bi–NiO/γ-Al2O3 catalysts. Catalysts (wt%/Al2O3) NH3-TPD Acidity [mmol/g] a CO2-TPD Basicity [mmol/g] b I(°C) II(°C) III(°C) Total I(°C) II(°C) Total None(γ-Al2O3) 0.120(180) 0.249(350) 0.047(450) 0.416 0.067(150) 0.370(360) 0.437 5Ni 0.155(180) 0.286(300) – 0.441 0.046(150) 0.313(360) 0.359 10Ni 0.100(180) 0.281(300) – 0.381 0.050(160) 0.055(400) 0.105 20Ni 0.102(170) 0.263(250) – 0.365 0.052(160) 0.052(370) 0.104 30Ni 0.097(170) 0.234(250) – 0.331 0.040(160) 0.048(350) 0.088 10Bi–20Ni 0.100(170) 0.203(260) 0.025(450) 0.328 0.057(150) 0.201(340) 0.258 20Bi–10Ni 0.101(180) 0.377(270) 0.048(470) 0.526 0.061(150) 0.132(400) 0.193 30Bi 0.070(175) 0.091(340) 0.040(450) 0.201 0.060(150) 0.143(400) 0.203 a I: weak acid, II: moderate acid, III: strong acid. b I: weak base, II: strong (non-desorbed CO2). Oxidative dehydrogenation of n-butane to butadiene over Bi–Ni–O/γ-alumina catalyst B.Rabindran Jermy a B.P. Ajayi a b B.A. Abussaud b S. Asaoka a S. Al-Khattaf a b ⁎ a Center of Research Excellence in Petroleum Refining and Petrochemicals, King Fahd University of Petroleum & Minerals, Dhahran 31261, Saudi Arabia Center of Research Excellence in Petroleum Refining and Petrochemicals King Fahd University of Petroleum & Minerals Dhahran 31261 Saudi Arabia b Department of Chemical Engineering, King Fahd University of Petroleum & Minerals, Dhahran 31261, Saudi Arabia Department of Chemical Engineering King Fahd University of Petroleum & Minerals Dhahran 31261 Saudi Arabia ⁎ Corresponding author at: Center of Excellence in Petroleum Refining and Petrochemicals, King Fahd University of Petroleum & Minerals, Dhahran 31261, Saudi Arabia. Tel.: +966 3 860 1344; fax: +966 3 860 7277. Graphical abstract Oxidative dehydrogenation of n-butane to 1,3-butadiene over Bi–Ni oxide/γ-Al2O3 catalyst was studied with fixed bed/flow-type reactor at 400–500°C. The γ-Al2O3 support itself showed activity for oxidative dehydrogenation from n-butane to n-butenes as well as partial oxidation to CO. The role of Ni oxide on γ-Al2O3 was confirmed that sole Ni oxide loading until 30wt% Ni on γ-Al2O3 resulted higher activity and selectivity to butadiene by diminishing partial oxidation related to γ-Al2O3 and enhancing conversion to butadiene. The concerted effect of Bi and Ni in Bi–Ni oxide/γ-Al2O3 catalyst was confirmed with two methods: (1) partial or full substitution of Bi for 1/3, 2/3 and 3/3 Ni of 30wt% Ni on γ-Al2O3, and (2) various amounts of Bi addition to 20wt% Ni on γ-Al2O3. As for (1) Bi substitution, 10wt% Bi-20wt% Ni showed higher activity and selectivity than the others. As for (2) Bi addition, it until Bi/Ni=0.82 (60wt% Bi-20wt% Ni) lead to suppressed CO/H2 production and improved conversion to butadiene. 30wt% Bi-20wt% Ni oxide/γ-Al2O3 catalyst showing the highest butadiene selectivity of about 47% at 450°C was used to confirm the relation between the state of oxygen and the reaction pathways by changing reaction condition factors, oxygen-to-butane ratio and temperature. It was revealed by catalyst characterization that the catalyst of Bi modified and Ni oxide highly loaded on γ-Al2O3 has high activity and selectivity for oxidative dehydrogenation of n-butane to butadiene due to either an improved Ni dispersion and redox property or a couple of weak acidity and moderate basicity. Keywords Oxidative dehydrogenation n-butane Butadiene Binary oxide Impregnation 1 Introduction Butadiene is an important petrochemical feedstock to manufacture petrochemicals and materials for industries including automotive, paints, textile, appliance manufacturing and others. Its main application segments include styrene-butadiene rubber (SBR), polybutadiene rubber (PBR), acrylonitrile butadiene styrene resins (ABS), styrene butadiene latex (SB Latex), adiponitrile, and nitrile rubber (NR). Currently there is a renewed interest for butadiene supply especially from Asia-Pacific markets largely driven by automotive sector [1]. The butadiene is mainly obtained as a byproduct from naphtha cracker to manufacture ethylene and propylene. The butadiene is also produced by n-butane based catalytic direct dehydrogenation process over chromium/alumina catalysts at temperature approximately 600–680°C [2]. At such high operating condition, thermal cracking of hydrocarbon occurs and frequent catalyst regeneration is required due to coke deposition. Several Pt or Cr based alumina catalysts were extensively studied for direct dehydrogenation process of n-butane to light olefins, not focused on butadiene [3–9]. As our previous work, supported Cr–V catalysts were investigated for direct dehydrogenation process of n-butane to butadiene [10]. However, as this direct dehydrogenation process to produce butadiene is required by high temperature operation due to thermodynamic equilibrium to butadiene, it inevitably causes the formation of excessive coke and quick deactivation of catalyst system. Furthermore, co-existence of carbon dioxide in the direct dehydrogenation process over the supported Cr–V catalyst was studied to lower the operation temperature with hydrogen removal by reverse water-gas shift reaction. The effect was still rather limited, as shown in our previous paper [11]. On the other hand, oxidative dehydrogenation with oxygen can be carried out at relatively lower reaction temperature. The process is not limited by thermodynamic equilibrium and the catalyst deactivation is reduced due to the presence of oxygen [12,13]. However, in oxidative dehydrogenation, selective oxidation of n-butane to 1,3-butadiene is challenging. High temperature are required to activate n-butane, while dehydrogenated products (i.e., butenes and butadiene) react rapidly with oxygen to form stable combustion products like carbon dioxide and water [12,14]. A suitable catalyst is needed to overcome this limitation by operating at relatively less reaction temperature at lower O2/n-C4 ratio. It has been generally recognized that the catalytic activity and selectivity for oxidative dehydrogenation are related to the redox property and surface acid–base character. For the redox property, the catalyst lattice oxygen participates in oxidation reaction for hydrogen and hydrocarbon intermediates. And then the reduced catalyst surface is restored to its earlier oxidation state by adsorption of oxygen from gas phase. The evolution of lattice oxygen is usually promoted by the interaction between metal oxides of the components [15]. A number of catalysts have been investigated for the oxidative dehydrogenation of n-butane to preferably butenes, including V–MgO [16–18], Ni–Mo–O [19,20], MoO3/MgO [21], titanium pyrophosphate [12] and V2O5/SiO2 [13]. In such catalytic systems, despite high dehydrogenation activity, selectivity with respect to butadiene is very low. For instance, it was reported over titanium pyrophosphate catalyst that the maximum n-butane conversion was of 28% and selectivity to dehydrogenation products was of 47%, while the formation of butadiene remained at about 14% and less compared to butenes (33%) [12]. It was reported over vanadia dispersed SiO2 catalyst that the predominant reaction products were butenes (1-butene, trans and cis-2-butene), while 1,3-butadiene product selectivity was minor (16%) along with cracking products [13]. In the previous literatures, most of the works are related to the oxidative dehydrogenation of n-butane mainly to butenes. In such cases, the selectivity to butenes occurs by inner CH group activation of butane on the acid centers of catalyst surface. For selective butadiene formation, further activation of second CH group of butenes is needed. In such case, the literature dealing with desired characteristics of catalyst (both acid and base) are limited and needed to be investigated. Ni oxide/γ-Al2O3 based catalysts have attracted much attention for oxidative dehydrogenation of ethane to ethylene, where nickel sites seem to be the active centers for ethane activation [22,23]. The catalyst concept for the ethane oxidative dehydrogenation over Ni oxide/γ-Al2O3 based catalysts was considered as also effective against an activation of methyl CH bond at the end of n-butane and n-butenes. On the other hand, as for supported NiO catalyst in our previous work [24], nano-sized porous γ-Al2O3 was found as an effective support for preparing NiO based multicomponent catalyst equivalent to co-precipitated or powder mixed one. This technology of the supported NiO based multicomponent catalyst was applied and extended to study the oxidative dehydrogenation of n-butane to butadiene. First, activity and selectivity over the γ-Al2O3 support itself were confirmed. Second, the effect of NiO loading on the dehydrogenation performance were studied over a series of Ni/γ-Al2O3 catalysts with different nickel contents increased until saturated value (ca. 30wt%). Third, the combination of Bi and Ni oxide on γ-Al2O3 for the activity and selectivity were confirmed with two methods: (1) partial or full substitution of Bi oxide for Ni oxide of 30wt% Ni on γ-Al2O3 catalyst and (2) various amounts of Bi addition to 20wt% Ni on γ-Al2O3 catalyst. Fourth, the catalyst with the best performance was investigated on the reaction pathways by changing reaction condition factors, oxygen-to-butane ratio and temperature. Finally, the catalytic performances due to NiO loading, Bi oxide substitution for NiO and Bi addition were discussed with characterizations of structure, redox property, acidity and basicity. 2 Experimental 2.1 Catalyst preparation The nano-sized porous γ-Al2O3 (pore diameter: 11nm, and pore volume: 0.75cc/g) calcined at 550°C was synthesized by successfully pH-controlled precipitation method using aluminum nitrate and sodium aluminate as precursors of boehmite and an acid–base pair of precipitating reagents according to detailed preparation technique as described by Kimura et al. [25]. 5–30wt% nickel impregnated γ-Al2O3 catalysts were prepared by incipient wetness technique. Nickel nitrate hexahydrate Ni(NO3)2·6H2O (99%, Fisher Scientific) commercially available was used as nickel source without further purification. The binary oxide Bi–Ni–O/γ-Al2O3 catalysts were prepared by co-impregnation technique. For 20wt% Bi-10wt% Ni/γ-Al2O3 catalyst, 0.49g of nickel nitrate hexahydrate Ni(NO3)2·6H2O was dissolved in 80ml of deionized water. After dissolution, 0.46g of bismuth nitrate pentahydrate Bi(NO3)3·5H2O (98%, Fluka-Garantie) was added to the above solution and the resultant suspension was stirred for dissolution. Then 1g of γ-Al2O3 was added and left overnight for impregnation. After impregnation, the sample was dried at 120°C for 3h to obtain an as-prepared catalyst. The binary oxide catalysts with different bismuth content (4wt% Bi-20wt% Ni/γ-Al2O3, 10wt% Bi-20wt% Ni/γ-Al2O3, 30wt% Bi-20wt% Ni/γ-Al2O3, 60wt% Bi-20wt% Ni/γ-Al2O3, and 30wt% Bi/γ-Al2O3) were also prepared in similar manner. For consistency between catalyst characterization and catalytic evaluation the as-prepared catalysts were served to the both experiments after activation and stabilization by calcination at 370°C for 3h followed by 590°C for 2h under flowing air. 2.2 Catalyst characterization The BET surface area and pore structure of catalysts were measured on a Micromeritics ASAP 2020 instrument (Norcross, GA). Before adsorption measurements, samples (ca. 0.1g) were degassed at 240°C for 3h under nitrogen flow. The nitrogen adsorption isotherms were measured at liquid nitrogen temperature (−196°C). Powder XRD analyses of the catalysts were carried out using Rigaku Miniflex II desktop X-ray diffractometer in a diffraction angle (2θ) range of 5–80° with Cu Kα radiation (λ =1.5406Å) at operating parameters of 30mA and 40kV with a step size of 0.02° and speed of 2°/min. TPR and TPD (temperature-programmed reduction and desorption) experiments were performed in BEL-CAT-A-200 chemisorption apparatus. The equipment consists of quartz sample holder with high temperature furnace, and a pair of a thermal conductivity detector (TCD) and a mass spectrometer. The linearity of the TCD response was established by the injection of gas pulses of known volume in helium background flow. H2-TPR analysis was performed using Ar/H2 gas mixture (95/5vol%). The total flow rate of the gas mixture was 50cm3/min. The sample (100mg) was preheated in He at 300°C for 3h, and then cooled to room temperature. Then the sample was heated at 20°C/min to the final temperature of 900°C. The H2 consumption was measured by a thermal conductivity detector and CuO was used as a reference for the calibration of H2 consumption. Temperature programmed desorption of ammonia (NH3-TPD) was carried out on the same instrument with substantially the same procedure to measure acidity. The procedure of NH3-TPD is as follows. The catalyst sample (100mg) was pretreated regularly in a flow of He (50mL/min) at 500°C for 1h. Then the sample was exposed to He/NH3 mixture (95/5vol%) at 100°C for 30min. The gas phase NH3 was removed by He purging for 1h followed by which TPD was performed in He flow (50mL/min) at a heating rate of 10°C/min, and the desorbed NH3 was monitored by either a TCD detector or a mass spectroscopy. Temperature programmed desorption of carbon dioxide (CO2-TPD) was carried out on the same instrument with substantially the same procedure to measure basicity. In the case of CO2-TPD, the gas phase is He/CO2 mixture (95/5vol%). 2.3 Catalytic evaluation The catalytic runs were carried out in a fully integrated, fixed bed continuous flow-type reactor system (BELCAT). The system consists of one tubular quartz reactor attached with stainless steel one-zone furnace assembly through reactor furnace wall thermo well. The as-prepared catalyst sample (0.30g) was packed in the reactor and pretreated to activate and stabilize as a catalyst under flowing air at higher temperature. The reaction test started after cooling-down to the reaction test temperature under flowing nitrogen. The flow rate of reactant (n-butane and air) and N2 were controlled at appropriate proportions. In the study on the oxidative dehydrogenation, the oxygen to hydrocarbon ratio (O2/n-C4H10) and temperature is considered to play a decisive role in the catalytic selectivity. The catalyst evaluation was operated selecting the reaction conditions at different temperatures (400–500°C) and under different feed ratio of oxygen to n-butane (O2/n-C4H10 =1–4mol/mol). The effluent was analyzed online by using a GC system (Agilent, 7890N). One GC equipped with FID and GC-GasPro capillary column (L: 60m and ID: 0.32mm) was used to analyze hydrocarbons and oxygenates. The other GC with TCD and ShinCarbon 80/100 mesh SS column (He carrier) and MS5A 60/80 mesh SS column (Ar carrier) were used to detect the gases, N2, O2, CO and CO2, and H2, respectively. The products were identified by comparison with standard samples. Conversion of n-butane and selectivity to products was calculated based on the balance of carbon. 3 Results and discussion 3.1 Catalytic evaluation 3.1.1 Effect of nickel loading over γ-Al2O3 The effects of the nickel loadings over γ-Al2O3 varied as 0, 5, 10, 20 and 30wt% on the activity as the conversion and the selectivity at 400, 450 and 500°C are shown in Fig. 1 and Fig. 2 , respectively. The main products in the effluent were obtained from dehydrogenation (DH: 1-butene, t-2-butene, cis-2-butene, 1,3-butadiene), cracking (CR: mainly ethylene and propylene), and partial oxidation (PO: CO), while CO2, CH4, C2H6, C3H8 and oxygen containing products were also detected as the negligible carbon-containing products from GC analysis. First, Figs. 1 and 2 revealed that the support γ-Al2O3 itself (Ni=0wt%) shows nearly half activity and lower selectivity of 5wt% Ni loaded catalyst. At 400°C, the butane conversion was 5.2%, and the product selectivity of dehydrogenation to butenes (C4 =), partial oxidation and cracking was 44.3%, 47.3% and 8.4%, respectively. With an increase of the reaction temperature, the conversion increased until 27%, while the selectivity of the dehydrogenation decreased to 22%, the selectivity of partial oxidation and cracking increased to 60% and 18%, respectively. At any temperature, butadiene production was nearly not detected. Second, the conversion and selectivity changed with nickel loading, as shown in Figs. 1 and 2. As for the catalytic activity of nickel loaded catalysts, the conversions at 400°C over 5wt% Ni/γ-Al2O3, 10wt% Ni/γ-Al2O3, 20wt% Ni/γ-Al2O3, and 30wt% Ni/γ-Al2O3 increased to 10%, 11%, 12% and 15%, respectively. At 450°C, the butane conversion rose to the maximum of 26% over 5wt% Ni/γ-Al2O3 and then decreased to stabilize at about 21% over other three catalysts. At 500°C, the 5wt% Ni/γ-Al2O3 catalyst showed high conversion of butane of about 39%, which then gradually reduced to about 33%, 26% and 25% over 10wt% Ni/γ-Al2O3, 20wt% Ni/γ-Al2O3, and 30wt% Ni/γ-Al2O3, respectively. On the other hand as the product distribution shown in Fig. 2, dehydrogenation selectivity not only to butenes but also to butadiene improved in turn to the aim with an increase of Ni loading at each temperature. With increasing nickel loading (Ni=5, 10, 20 and 30wt%) at 400°C, the dehydrogenation selectivity to the total of butenes and butadiene reached the maximum of 90% with nickel loading of 30wt%. Particularly, the butadiene selectivity (C4 2=) started at almost 0% and reached 30%. Reversely, the partial oxidation selectivity (PO) dominant over γ-Al2O3 support was favorably decreased to less than 10%, resulting in the highest butadiene selectivity. The cracking selectivity (CR) shown over γ-Al2O3 remained nearly constant after Ni loading. At higher temperatures, the behavior of the selectivity was similar to the obtained at 400°C, except that the selectivity of the partial oxidation and cracking was higher at each Ni loading and remained at higher levels even after 30wt% Ni loading than these at 400°C. Therefore, this study shows that conversion to butadiene and its selectivity are due in good part to the nickel species and its character, which were controlled by supporting on the specific γ-Al2O3. 3.1.2 Bi–Ni oxide/γ-Al2O3 catalyst 3.1.2.1 Influence of bismuth substitution over 30wt% Ni/γ-Al2O3 catalyst Based on the performance as shown in Figs. 1 and 2, 30wt% Ni/γ-Al2O3 was chosen as the start catalyst to study the concerted effect of Bi–Ni by bismuth substitution. The overall metal loading over γ-Al2O3 was maintained at 30wt%, while bismuth to total metal loading weight ratio was subsequently varied among 1/3, 2/3 and 1. The activity was compared with 30wt% Ni/γ-Al2O3. Fig. 3 shows the butane conversion and the product distribution. The conversion over 10wt% Bi-20wt% Ni/γ-Al2O3 was the highest of 23%, while decreased to the lowest of 13% over 30wt% Bi/γ-Al2O3 in volcano shape. The product distribution profile showed the clear influence of bismuth substitution. Considering the product selectivity, 10wt% Bi-20wt% Ni/γ-Al2O3 also showed the highest selectivity of dehydrogenation and butadiene production than 30wt% Ni, 20wt% Bi-10wt% Ni and 30wt% Bi in volcano shape. The further enhanced butadiene selectivity can be clearly related to the partial substitution of bismuth for nickel. The partial oxidation changed significantly until less than 3% as the bottom at 10wt% Bi-20wt% Ni in valley shape, while the cracking increased until near 30% as the top at 10wt% Bi-20wt% Ni in volcano shape. In the study on the partial substitution of bismuth for nickel in the catalyst, 10wt% Bi-20wt% Ni/γ-Al2O3 catalyst exhibited the highest selectivity for either dehydrogenation or butadiene and low selectivity for partial oxidation and cracking so that the 20wt% Ni/γ-Al2O3 was selected as the start catalyst for bismuth addition study. 3.1.2.2 Effect of bismuth addition to 20wt% Ni/γ-Al2O3 In order to obtain any further improvement, the bismuth content was gradually increased as 4, 10, 30 and 60wt% at fixed nickel loading of 20wt%. The 4, 10, 30 and 60wt% bismuth addition corresponds to 0.05, 0.14, 0.41 and 0.82 of Bi/Ni molar ratio, respectively. As shown in Fig. 4 , the conversion of butane kept nearly constant in low hill shape at 22%, 25%, 24%, 23% and 22% over Ni/γ-Al2O3, Bi0.05Ni/γ-Al2O3, Bi0.14Ni/γ-Al2O3, Bi0.41Ni/γ-Al2O3, and Bi0.82Ni/γ-Al2O3, respectively. In the product distribution, the selectivity to dehydrogenation and butadiene improved with Bi/Ni ratio from 73% to 92%, respectively. The Bi0.41Ni/γ-Al2O3 (30wt% Bi-20wt% Ni/γ-Al2O3) catalyst showed the highest butane selectivity with negligible selectivity of partial oxidation, while the cracking selectivity was not clearly influenced by the bismuth addition within the studied extent. 3.1.3 Influence of reaction condition over Bi–Ni oxide/γ-Al2O3 catalyst 3.1.3.1 O2/n-C4H10 ratio Using this catalyst, 30wt% Bi-20wt% Ni/γ-Al2O3 as the standard Bi–Ni oxide/γ-Al2O3 catalyst, the reaction pathways related to catalyst sites was investigated by changing reaction condition factors, oxygen-to-butane ratio and temperature. The oxygen to hydrocarbon ratio (O2/n-C4H10) is considered to play a decisive role in catalytic activity and selectivity. As shown in Fig. 5 , the conversion of butane mainly producing butenes (C4 =) and butadiene (BD) increased not proportionally but linearly with increase of O2/n-C4H10 molar ratio from 1 to 4. However, the cracking selectivity increased in 2nd order curve. The product selectivity of butenes decreased instead, while the butadiene selectivity kept nearly constant. The very low selectivity of partial oxidation (PO) increased similarly to that of cracking (see Table 1 ). The result from partial oxidation selectivity is in line with previous reports [26–28], demonstrating that oxidation reactions leading to partial oxidation formation have a strong dependence on oxygen amount. Considering either (i) the tradeoff relation of the product selectivity between butanes and the cracked or (ii) the analogy of the selectivity dependence on the oxygen to hydrocarbon ratio between the cracking and the partial oxidation, the cracked products were thought as decarbonated derivatives of carboxylic acids from n-butenes through oxidation by oxygen. 3.1.3.2 Reaction temperature In order to investigate further on reaction pathway over the Bi–Ni oxide/γ-Al2O3 catalyst, the effect of temperature on the activity and selectivity was studied at the extent of 400 to 500°C, as shown in Fig. 6 . With increase of reaction temperature until 450°C, the conversion of butane increased and it did not changed more than 450°C. However, the butadiene increased continuously until 500°C, while the selectivity of the cracking and butenes was very similar to that with the oxygen to hydrocarbon ratio. The formation of partial oxidation remained at low level with a slight increase (see Table 1). These results suggest that the cracking reaction and the partial oxidation occur separately on activated oxygen sites and other concentrated oxygen sites, respectively. Bi effect on the reaction selectivity works probably only toward reducing the concentrated oxygen sites for the partial oxidation by increasing oxygen mobility to consume at the sites for butene dehydrogenation to butadiene. Therefore, in order to suppress the cracking reaction, the other modifier to the support may be selected among reagent reducing oxygen species for oxygenate formation, because the cracking activity exists over the γ-Al2O3 itself. 3.1.4 Effectiveness of oxidative hydrogen removal In some cases of the reaction test, small amounts of H2 were observed in the product effluent. H2 formation through simple dehydrogenation of n-butane is reversible and the dehydrogenation conversion is thermodynamically limited to a low level. Therefore, in order to explain the advantage of the catalyst system in this work for n-butane oxidative dehydrogenation, the hydrogen amounts hypothesized from reactions of dehydrogenation and partial oxidation were compared to the effluent H2. Furthermore, in order to clarify the effect of the factors due to either the catalysts (Ni loading and the bismuth substitution/addition) or reaction condition (O2/n-C4H10 ratio and temperature) on the selectivity, effectiveness of oxidative hydrogen removal was discussed from the observed hydrogen amount in the reaction effluent and the hydrogen balance based on the reaction selectivity. The effluent hydrogen molecule was compared with the hypothetical calculated amount from the reactions, as shown in Table 1. Ni/γ-Al2O3 is well-known as either a dry/steam reforming catalyst or a water-gas shift catalyst. CO and H2 from dry/steam reforming with water-gas shift reaction are probably contributed to H2 formation. But CO2 and the steam are not in the feedstock but the product from the first step reaction contributing to the second step reaction. And the increase of Ni loading makes the selectivity of partial oxidation (CO formation) decrease. Furthermore, even when CO and H2 from dry/steam reforming are included as the second step reaction, the ratio of CO to H2 as a total equation is not so changed from direct partial oxidation of n-butane. According to this consideration, stoichiometry of direct partial oxidation was representatively adapted to the calculation of H2 formation from the produced CO. The hydrogen produced by partial oxidation looks like released into the product effluent as molecular hydrogen except γ-Al2O3 itself and only Bi loaded γ-Al2O3, on which the partial oxidation may occur through another route without formation of molecular hydrogen. For example, CO may be produced from strongly adsorbed butadiene or more dehydrogenated, because in the case of both catalysts the butadiene production was very low. The released hydrogen probably holds some influence on the butadiene production through thermodynamic equilibrium. As the result, it has been confirmed that the hydrogen atoms withdrawn from n-butane and butenes are effectively removed through oxidative dehydrogenation without H2 formation. And the observed hydrogen molecule was assumed as the product from partial oxidation, independently from dehydrogenation of n-butane and butenes. To make it more clear, Fig. 7 : effect of Bi amount to Ni on H2 formation at 450°C, O2/C4 =2 [mol/mol] has been included as the typical example figure of the comparison. The O2 conversions as measured from O2 concentration difference between the reactor inlet and outlet are shown in Table 1. The O2 conversions suggest the existence of unassigned consumer except for oxidative dehydrogenation and partial oxidation. According to the result of this consideration, the cracked products, mainly ethylene and propylene, were considered to be secondary products from oxygenates, i.e., maleic acid and butenic acid, through decarbonation (deCO2). Oxygenates as liquid product, i.e., maleic acid and butenic acid, are also candidates as oxygen consumers. Though they were measured only as the trace, the oxygen conversion suggests that the oxygenate production probably occurs at the extent similar to the cracked production. Therefore, in future, the catalyst should be redesigned to improve the selectivity of O2 conversion by suppressing oxygenate formation. In the summary of the catalytic evaluation, the suppression of the partial oxidation by Bi modification to Ni oxide/γ-Al2O3 catalyst directly leads to an improvement for the butadiene production. 3.2 Catalyst characterization 3.2.1 Surface area and porosity The surface areas of γ-Al2O3, Ni/γ-Al2O3 and Bi–NiO/γ-Al2O3 samples are presented in Table 2 . γ-Al2O3 showed the BET surface area of 276m2/g. 5wt% Ni/γ-Al2O3 and 10wt% Ni/γ-Al2O3 exhibited higher surface than γ-Al2O3 support itself, which then decreased significantly over 30wt% nickel impregnation to 180m2/g. The substitution of 10wt% and 20wt% bismuth oxide for 30wt% Ni/γ-Al2O3 catalyst showed lower surface area than 30wt% Ni/γ-Al2O3 at about 172m2/g and 134m2/g, respectively. 30wt% Bi/γ-Al2O3 showed the surface area of 144m2/g, which is still enough to work as the catalyst. The substantial surface area, which is calculated by volume based alumina showed the presence of high surface area over 5–20wt% nickel impregnation, which then decreased with 30wt% Ni/γ-Al2O3 to 248m2/g (Table 2). The fact suggests that Ni oxide dispersed as fine particles holds additional high surface area. The surface area and pore volume calculated from BJH adsorption exhibited similar characteristics pattern, where the addition of 30wt% Ni showed a decrease in the surface area indicating filling of fractal surface area of alumina. On the other hand, the high porosity of γ-Al2O3 support was kept after a large amount of Bi and Ni loading, as shown in Table 2 and Fig. 8 . Therefore, the results in the catalyst evaluation are considered to reflect the chemical character of the surface. 3.2.2 X-ray diffraction The XRD diffraction patterns for nickel and bismuth–nickel impregnated samples are shown in Fig. 9 . The diffraction patterns of γ-Al2O3 with primary 2θ peaks at 46° and 67° (JCPDS 10-425) distinguished in all the samples is available as the internal standard. The characteristic reflections of NiO are present at 2θ values equal to 9°, 20° and 60°. The samples with 5–30wt% Ni loaded showed diffraction peaks corresponding to the presence of NiO species. It is well-known rather difficult to identify the diffraction patterns of NiO compound supported on γ-Al2O3 because of the overlap between γ-Al2O3 and Ni Al2O4 peaks, when the crystallite size of the dispersed NiO species on support is near detection limit of XRD. However, the diffraction peaks corresponding to nickel oxide were observed proportionally along nickel amount with increased nickel loading, as shown in Fig. 9. In addition, the nickel species showed nano-meter sized crystalline phase as evidenced by the broad peaks equivalent to the peaks of γ-Al2O3. The fact by the broad peaks is in good agreement with the high surface area of these samples that reflects finer particles dispersed on the alumina (Table 2). While the formation of NiAl2O4 phase with nickel addition is well-known to cause the diffraction peak of alumina shift toward lower angle indicating diffusion of NiO particles into the support, no appreciable shift is observed in the present study because of calcination at the controlled temperature not to NiAl2O4 phase. The XRD profiles of Bi substituted catalyst 10wt% Bi-20wt% Ni/γ-Al2O3 showed positive effect on Ni dispersion in comparison with 20wt% Ni/γ-Al2O3 and 30wt% Ni/γ-Al2O3. The diffraction patterns of α-Bi2O3 and β-Bi2O3 with sharp primary 2θ peaks (JCPDS 41-1449) increased with bismuth substitution in the samples 10wt% Bi-20wt% Ni/γ-Al2O3, 20wt% Bi-10wt% Ni/γ-Al2O3 and 30wt% Bi/γ-Al2O3. The crystalline size of the Bi2O3 observed by XRD is too large to modify NiO species because of the low surface area. The large crystalline probably fills up fractal pore surface to make smooth in good agreement with the decreasing of surface area on these samples (Table 2). This fact suggests that Bi effect on NiO works through face-to-face contacting between NiO and the other part of Bi species by forming very fine particles in some binary oxide phase undetected by XRD. This suggestion was also supported by TPR and NH3/CO2 TPD as the effect causes changes of chemical characters. 3.2.3 Temperature programmed reduction In general for oxidative dehydrogenation of alkanes, the reaction is considered to proceed via redox mechanism, in which the reducibility of active sites is a key factor for the catalyst activity [29]. In order to measure the reducibility of NiO species and metal oxide support interaction, TPR analyses were performed. Fig. 10 shows the TPR profiles of γ-Al2O3, 5–30wt% Ni/γ-Al2O3, 10wt% Bi-20wt% Ni/γ-Al2O3, 20wt% Bi-10wt% Ni/γ-Al2O3 and 30wt% Bi/γ-Al2O3 catalysts. The reduction peak maxima as well as the amount of H2 uptake (mmol/g) was summarized in Table 3 . For γ-Al2O3, a small peak is observed corresponding to adsorbed O2 being removed from surface of support. The results showed that nickel impregnated samples exhibited two reduction peaks (200–750°C). With increasing nickel loading, the increase of the both peaks was observed. The first reduction peak located at about 317°C moderately shifted to 278°C with growing along Ni loading. A new shoulder peak at about 350–500°C on low temperature slope of the second peak was gradually observed. As for Bi substitution for Ni/γ-Al2O3, the shoulder was more clearly identified as a peak in the case of 10wt% Bi-20wt% Ni/γ-Al2O3, the first peak of which shifted toward the lowest temperature 274°C. The shoulder peak lying between 380–545°C indicates the generation of easily reducible nickel oxide species by Bi species from difficultly reducible one on the γ-Al2O3. However, increasing the bismuth substitution (20wt% Bi), and decreasing the nickel content (10wt%) over γ-Al2O3 dramatically reverted the first peak from 274°C to 338°C as an excess rebound. A distinct peaks ascribed to the reduction of Bi2O3 is as the first at 380 and as the main 584°C for 30wt% Bi/γ-Al2O3 catalyst. The first peak with sharp reduction at low temperature is attributed to the reduced NiO species at the reaction temperature existing on the edge-side of NiO crystalline, which increases the percentage in total Ni and the freedom from the γ-Al2O3 surface by the stacking along Ni loading in accordance with crystalline size data from XRD. It is considered that the reduced NiO species work as active sites for either the first step dehydrogenation or molecular hydrogen formation in the partial oxidation reaction. The similar consideration leads the shoulder peak at about 350–500°C is attributed to the NiO species on the crystal step side. It is implied that the species work as active sites for the second step dehydrogenation to butadiene and suppress the partial oxidation due to reduced oxygen concentration on its surface linking with the reduced NiO species as the redox system. The redox system is accelerated under the controlled oxygen diffusion by Bi species so that the partial oxidation on the concentrated oxygen sites is also suppressed. The activated oxygen sites for oxidative hydroxylation to the cracking reaction are probably related to the first edge attached to γ-Al2O3 surface because the reaction is less influenced with the increase of Ni loading and accelerated by Bi species in Bi–Ni oxide catalyst system independently from the partial oxidation. 3.2.4 Temperature programmed desorption (NH3/CO2) Fig. 11 shows the acidity of 0–30wt% Ni/γ-Al2O3 and Bi–NiO/γ-Al2O3 samples studied by temperature programmed desorption technique (TPD). The acid amount deconvolved to the strength groups were calculated from the deconvolved amounts of the desorbed NH3. The results are presented in Table 4. The NH3-TPD spectra showed an initial desorption peak around 180°C accompanied with a broad desorption shoulder extending upto 500°C. In the case of 5wt% Ni/γ-Al2O3, the acid amount was markedly larger (0.257mmol/g), which then decreased to as low as 0.179mmol/g with 30wt% Ni loading. In the case of bismuth modified catalyst 10wt% Bi-20wt% Ni/γ-Al2O3, the acid amount (0.171mmol/g) was similar to that of 30wt% Ni loading and the presence of less intense desorption peak at high temperature suggest the elimination of strong acid sites. This indicates the addition of 10wt% Bi over 20wt% Ni does not affect the acidity. It was observed that, when bismuth addition increased to 20wt% and nickel loading decreased to 10wt%, the acid amount corresponding to the strong acid sites of the catalyst increased significantly (0.310mmol/g). This clearly shows that addition of 20wt% bismuth decreased the dispersion of nickel atom over alumina support. In the case of 30wt% Bi/γ-Al2O3, the presence of weak, medium and strong acid sites are clearly observed (Table 4 .). The basicity of samples was measured using CO2-TPD (Fig. 12 ). The sample 5wt% Ni/γ-Al2O3 showed the highest capacity to adsorb CO2 with two distinct desorption peaks centered at about 188°C and 270°C. The low temperature desorption peak was assigned to the low-strength basic sites, which resulted from the interaction between CO2 with weak basic surface hydroxyl groups. The increased loading of nickel amount found to decrease the CO2 adsorption capacity. However, the strength of the basic character increased, leading to the shift of desorption temperature greater than 300°C. Significantly, the loading of 10wt% bismuth to 20wt% Ni/γ-Al2O3 found to reverse the basic characteristics similar to those found with 5wt% Ni/γ-Al2O3. The increased loading of bismuth to 20wt%, and decreasing the nickel content to 10wt% tended to lower that basicity but the strength increased with an extra shift in the desorption peaks greater than 350°C. The latter peak is probably due to high-strength basic sites. The impregnation of bismuth oxide of 30wt% over alumina showed no significant basic character compared to all other catalysts Table 4 As the characterization of the spent (after testing) catalyst might also provide valuable information to determine the state of nickel species, i.e., metallic or oxidized. The state of Ni species of the catalyst was confirmed by XRD and color of the spent sample to be stably oxidized (nano-sized NiO and light green: Ni2+, respectively) even after 10h-on-stream of the reaction test. With respect to the activity and the selectivity, they are also stable without any results suggesting change of the catalyst characteristics as far as the catalysts were tested. In general, the presence of gray color indicates the reduction of Ni2+ to Ni0. Therefore, the characterization of the fresh (just after calcination at 590°C for stabilization) catalyst itself is considered sufficient to give valuable information about catalytic character Table 4. The activities and selectivities in the oxidation reactions are possibly governed either by redox character or by the acid–base properties of the catalyst and the reactant [30]. The dehydrogenated products, butenes and butadiene, are considered to be basic compounds because of their double bonds. The basicity of butadiene is greater than that of butenes. A necessary condition for an effective catalyst for the production of dehydrogenated basic compounds is the possession of sufficient basic property for desorption. Similar trends were observed with our results (Figs. 1 and 2). γ-Al2O3 and 5–10wt% Ni/γ-Al2O3 catalyst are acidic (Fig. 11) and as the result, the overall selectivity to butadiene was lower than that over 20–30wt% nickel loading. Interestingly, in the case of 10wt% Bi20wt% Ni/γ-Al2O3, the acidity remains similar to that of 30wt% Ni loading, but generation of strong basic sites is seen with bismuth addition (Fig. 12), which leads to enhanced butadiene formation (Fig. 3–5). The bismuth addition proposed to rationalize the over oxidative ability of nickel atoms from butadiene to CO formation (Fig. 10). However substituting nickel content with 20wt% bismuth is found to increase the basicity of the catalyst, which subsequently increases cracking and partial oxidation product formation (Figs. 3–5 and Table 1). This shows that apart from butadiene formation, the formation of ethylene, propylene shows that other route (involving carboxylic acid) is created. This kind of cracking is related to bismuth oxide, where lattice oxygen of bismuth oxide influences the formation of these products. The catalyst characterization on the bismuth added nickel alumina also supports the observed catalytic evaluation results. 3.3 Modeling of catalyst and reaction Fig. 13 (i) and (ii) shows the simplified scheme of Ni/γ-Al2O3 and Bi–NiO/γ-Al2O3 catalysts for oxidative dehydrogenation of n-butane to butadiene. The catalytic evaluation showed that over 30wt% Ni/γ-Al2O3, the butane conversion and butadiene selectivity are high. The influence of bismuth substitution with nickel (10wt% Bi20wt% Ni/γ-Al2O3, 20wt% Bi10wt% Ni/γ-Al2O3) over γ-Al2O3 was investigated for improved butadiene formation (Fig. 3). The activity was compared with 30wt% Ni/γ-Al2O3 and 30wt% Bi/γ-Al2O3 catalysts. The study showed that the dehydrogenation activity is effectively increased with bismuth substitution. The conversion reaches the maximum with 10wt% bismuth and 20wt% Ni loading and then the activity drops with further increased bismuth substitution (Fig. 3). In the case of sole nickel impregnated sample 30wt% Ni/γ-Al2O3, partial oxidation product dominates, while with 30Bi/γ-Al2O3, the cracking products dominate and increased to the maximum of 29.6%. Remarkably, 10wt% Bi20wt% Ni/γ-Al2O3 showed high butadiene selectivity (Fig. 3). The formation of partial oxidation and cracking product remains less than over 30wt% Ni/γ-Al2O3 and 30Bi/γ-Al2O3. 4 Conclusions The oxidative dehydrogenation of n-butane to butadiene was studied over 0–30wt% Ni/γ-Al2O3 and Bi–NiO/γ-Al2O3 catalyst at different O2/n-C4 ratio (1–4mol/mol) in the temperature range of 400–500°C. The influence of bismuth was studied by varying Bi/Ni loading ratio (0.5 and 2) over γ-Al2O3. The activity was compared with 30wt% Ni/γ-Al2O3 and 30wt% Bi/γ-Al2O3. The catalysts were characterized by BET/porosity, XRD, H2-TPR and NH3/CO2-TPD measurement techniques. The Bi-Ni oxide interaction affected the reduction behavior of the catalysts, and facilities the reduction of the nickel oxide surface species. Highly loaded Ni oxide/γ-Al2O3 catalyst showed better 1,3-butadiene selectivity. TPR analysis of 5–30wt% Ni/γ-Al2O3 samples showed two reduction steps substantially associated with NiO species. Nickel loading of 5–30wt% found to increase the reducibility due to NiO crystalline stacking. With bismuth addition, further shifts in the reduction temperature toward lower temperature were observed. The catalyst characterizations supported the catalyst evaluation results. It was revealed that the catalyst of Bi modified and Ni oxide highly loaded on γ-Al2O3 have high activity and selectivity for oxidative dehydrogenation of n-butane to butadiene due to either an improved Ni dispersion and redox property or a couple of weak acidity and moderate basicity. Acknowledgements We are grateful for the support from Ministry of Higher Education, Saudi Arabia for the establishment of the Center of Research Excellence in Petroleum Refining and Petrochemicals at King Fahd University of Petroleum and Minerals (KFUPM). The authors acknowledge Japan Cooperation Center, Petroleum (JCCP) to give the opportunity of this collaborative research. References [1] Petroleum and Petrochemicals Economics Program: Petrochemical Market Dynamics: Butadiene Derivatives published by Nexant, 2012. [2] Butadiene Product Stewardship Guidance Manual, American Chemistry Council Olefins Panel, American Chemistry Council, 2001, Revised 2002. [3] J.D. Burrington C.T. Kartisek R.K. Grasselli J. Catal. 63 1980 235 254 [4] A. Corma Inorganic solid acids and their use in acid-catalyzed hydrocarbon reactions Chem. Rev. 95 1995 559 614 [5] J.M. López Nietoa A. Dejozb M.I. Vazquezb W. O'Learyc J. Cunningham Catal. Today 40 1998 215 228 [6] L.M. Madeira M.F. Portela Catal. Rev. 44 2002 247 286 [7] K. Keyvanloo J. Towfighi A. Sadrameli S.M. Mohamadalizadeh J. Anal. Appl. Pyrol. 87 2010 224 230 [8] J.C. Liu B.X. Shen J.H. Wang D.Q. Dong J. Pet. Sci. Technol. 66 2009 156 160 [9] F. Wang Y. Xu Y. Ren J. Li Chem. Eng. Process 49 2010 51 58 [10] B.P. Ajayi B. Rabindran Jermy K.E. Ogunronbi B.A. Abussaud S. Al-Khattaf Catal. Today 204 2012 189 196 [11] B.P. Ajayi B. Rabindran Jermy B.A. Abussaud S. Al-Khattaf J. Porous Mater. 20 2013 1257 1270 [12] I.-C. Marcua I. Sandulescu J.-M.M. Millet J. Mol. Catal. A: Chem. 203 2003 241 250 [13] V. Murgia E.M.F. Torres J.C. Gottifredi E.L. Sham Appl. Catal. A: Gen. 312 2006 134 143 [14] A.P.V. Soares L.D. Dimitrov M.C.A. de Oliveira L. Hilaire M.F. Portela R.K. Grasselli Appl. Catal. A: Gen. 253 2003 191 200 [15] A.A. Lemonidou M. Machli Catal. Today 127 2007 132 138 [16] D. Bhattacharyya K. Shyamal S. Bej Musti Rao Appl. Catal. A: Gen. 87 1992 29 43 [17] O. Rubio J. Herguido M. Menendez Chem. Eng. Sci. 58 2003 4619 4627 [18] N. Kijima M. Toba Y. Yoshimura Catal. Lett. 127 2009 63 69 [19] F.J. Maldonado-Hodar L.M. Palma Madeira M. Farinha Portela J. Catal. 164 1996 399 410 [20] F.J. Maldonado-Hódar L.M. Madeira M.F. Portela R.M. Martin-Aranda F. Freire J. Mol. Catal. A 111 1996 313 323 [21] M.L. Pacheco J. Soler A. Dejoz J.M.L. Nieto J. Herguido M. Menéndeza J. Santamaria Catal. Today 61 2000 101 107 [22] E. Heracleous A.A. Lemonidou J. Catal. 270 2010 67 75 [23] Claudia Berger-Karin Jörg Radnik V. Evgenii Kondratenko J. Catal. 280 2011 116 124 [24] T. Kimura H. Imai X. Li K. Sakashita S. Asaoka S. Al-Khattaf Catal. Lett. 143 2013 1175 1181 [25] T. Kimura S. Sakashita K. Asaoka Mater. Res. Innovations 15 2011 s101 s105 [26] E. Heracleous A.F. Lee A.A. Wilson K. Lemonidou J. Catal. 231 2005 159 171 [27] Heracleous Lemonidou J. Catal. 237 2006 175 189 [28] Z. Skoufa E. Heracleous A.A. Lemonidou Chem. Eng. Sci. 84 2012 48 56 [29] H.X. Dai E.J. Bell A.T. Iglesia J. Catal. 221 2004 491 499 [30] S. Ai M. Suzuki J. Catal. 26 1972 202 211",
      "scopus-id": "84924243773",
      "coredata": {
        "eid": "1-s2.0-S1381116915000205",
        "dc:description": "Oxidative dehydrogenation of n-butane to 1,3-butadiene over Bi–Ni oxide/γ-Al2O3 catalyst was studied with fixed bed/flow-type reactor at 400–500°C. The γ-Al2O3 support itself showed activity for oxidative dehydrogenation from n-butane to n-butenes as well as partial oxidation to CO. The role of Ni oxide on γ-Al2O3 was confirmed that sole Ni oxide loading until 30wt% Ni on γ-Al2O3 resulted higher activity and selectivity to butadiene by diminishing partial oxidation related to γ-Al2O3 and enhancing conversion to butadiene. The concerted effect of Bi and Ni in Bi–Ni oxide/γ-Al2O3 catalyst was confirmed with two methods: (1) partial or full substitution of Bi for 1/3, 2/3 and 3/3 Ni of 30wt% Ni on γ-Al2O3, and (2) various amounts of Bi addition to 20wt% Ni on γ-Al2O3. As for (1) Bi substitution, 10wt% Bi-20wt% Ni showed higher activity and selectivity than the others. As for (2) Bi addition, it until Bi/Ni=0.82 (60wt% Bi-20wt% Ni) lead to suppressed CO/H2 production and improved conversion to butadiene. 30wt% Bi-20wt% Ni oxide/γ-Al2O3 catalyst showing the highest butadiene selectivity of about 47% at 450°C was used to confirm the relation between the state of oxygen and the reaction pathways by changing reaction condition factors, oxygen-to-butane ratio and temperature. It was revealed by catalyst characterization that the catalyst of Bi modified and Ni oxide highly loaded on γ-Al2O3 has high activity and selectivity for oxidative dehydrogenation of n-butane to butadiene due to either an improved Ni dispersion and redox property or a couple of weak acidity and moderate basicity.",
        "openArchiveArticle": "false",
        "prism:coverDate": "2015-05-01",
        "openaccessUserLicense": null,
        "prism:aggregationType": "Journal",
        "prism:url": "https://api.elsevier.com/content/article/pii/S1381116915000205",
        "dc:creator": [
          {
            "@_fa": "true",
            "$": "Jermy, B.Rabindran"
          },
          {
            "@_fa": "true",
            "$": "Ajayi, B.P."
          },
          {
            "@_fa": "true",
            "$": "Abussaud, B.A."
          },
          {
            "@_fa": "true",
            "$": "Asaoka, S."
          },
          {
            "@_fa": "true",
            "$": "Al-Khattaf, S."
          }
        ],
        "link": [
          {
            "@_fa": "true",
            "@rel": "self",
            "@href": "https://api.elsevier.com/content/article/pii/S1381116915000205"
          },
          {
            "@_fa": "true",
            "@rel": "scidir",
            "@href": "https://www.sciencedirect.com/science/article/pii/S1381116915000205"
          }
        ],
        "dc:format": "application/json",
        "openaccessType": null,
        "pii": "S1381-1169(15)00020-5",
        "prism:volume": "400",
        "prism:publisher": "Elsevier B.V.",
        "dc:title": "Oxidative dehydrogenation of n-butane to butadiene over Bi–Ni–O/γ-alumina catalyst",
        "prism:copyright": "Copyright © 2015 Elsevier B.V. All rights reserved.",
        "openaccess": "0",
        "prism:issn": "13811169",
        "dcterms:subject": [
          {
            "@_fa": "true",
            "$": "Oxidative dehydrogenation"
          },
          {
            "@_fa": "true",
            "$": "n-butane"
          },
          {
            "@_fa": "true",
            "$": "Butadiene"
          },
          {
            "@_fa": "true",
            "$": "Binary oxide"
          },
          {
            "@_fa": "true",
            "$": "Impregnation"
          }
        ],
        "openaccessArticle": "false",
        "prism:publicationName": "Journal of Molecular Catalysis A: Chemical",
        "openaccessSponsorType": null,
        "prism:pageRange": "121-131",
        "prism:endingPage": "131",
        "pubType": "fla",
        "prism:coverDisplayDate": "1 May 2015",
        "prism:doi": "10.1016/j.molcata.2015.01.016",
        "prism:startingPage": "121",
        "dc:identifier": "doi:10.1016/j.molcata.2015.01.016",
        "openaccessSponsorName": null
      },
      "objects": {
        "object": [
          {
            "@category": "thumbnail",
            "@height": "16",
            "@width": "242",
            "@_fa": "true",
            "$": "https://api.elsevier.com/content/object/eid/1-s2.0-S1381116915000205-si1.gif?httpAccept=%2A%2F%2A",
            "@multimediatype": "GIF image file",
            "@type": "ALTIMG",
            "@size": "1040",
            "@ref": "si1",
            "@mimetype": "image/gif"
          },
          {
            "@category": "high",
            "@height": "1006",
            "@width": "900",
            "@_fa": "true",
            "$": "https://api.elsevier.com/content/object/eid/1-s2.0-S1381116915000205-gr9_lrg.jpg?httpAccept=%2A%2F%2A",
            "@multimediatype": "JPEG image file",
            "@type": "IMAGE-HIGH-RES",
            "@size": "193416",
            "@ref": "gr9",
            "@mimetype": "image/jpeg"
          },
          {
            "@category": "high",
            "@height": "1597",
            "@width": "1000",
            "@_fa": "true",
            "$": "https://api.elsevier.com/content/object/eid/1-s2.0-S1381116915000205-gr8_lrg.jpg?httpAccept=%2A%2F%2A",
            "@multimediatype": "JPEG image file",
            "@type": "IMAGE-HIGH-RES",
            "@size": "182461",
            "@ref": "gr8",
            "@mimetype": "image/jpeg"
          },
          {
            "@category": "high",
            "@height": "726",
            "@width": "850",
            "@_fa": "true",
            "$": "https://api.elsevier.com/content/object/eid/1-s2.0-S1381116915000205-gr7_lrg.jpg?httpAccept=%2A%2F%2A",
            "@multimediatype": "JPEG image file",
            "@type": "IMAGE-HIGH-RES",
            "@size": "100329",
            "@ref": "gr7",
            "@mimetype": "image/jpeg"
          },
          {
            "@category": "high",
            "@height": "604",
            "@width": "1718",
            "@_fa": "true",
            "$": "https://api.elsevier.com/content/object/eid/1-s2.0-S1381116915000205-gr6_lrg.jpg?httpAccept=%2A%2F%2A",
            "@multimediatype": "JPEG image file",
            "@type": "IMAGE-HIGH-RES",
            "@size": "124949",
            "@ref": "gr6",
            "@mimetype": "image/jpeg"
          },
          {
            "@category": "high",
            "@height": "618",
            "@width": "1737",
            "@_fa": "true",
            "$": "https://api.elsevier.com/content/object/eid/1-s2.0-S1381116915000205-gr5_lrg.jpg?httpAccept=%2A%2F%2A",
            "@multimediatype": "JPEG image file",
            "@type": "IMAGE-HIGH-RES",
            "@size": "109598",
            "@ref": "gr5",
            "@mimetype": "image/jpeg"
          },
          {
            "@category": "high",
            "@height": "621",
            "@width": "1723",
            "@_fa": "true",
            "$": "https://api.elsevier.com/content/object/eid/1-s2.0-S1381116915000205-gr4_lrg.jpg?httpAccept=%2A%2F%2A",
            "@multimediatype": "JPEG image file",
            "@type": "IMAGE-HIGH-RES",
            "@size": "125637",
            "@ref": "gr4",
            "@mimetype": "image/jpeg"
          },
          {
            "@category": "high",
            "@height": "3720",
            "@width": "2304",
            "@_fa": "true",
            "$": "https://api.elsevier.com/content/object/eid/1-s2.0-S1381116915000205-gr3_lrg.jpg?httpAccept=%2A%2F%2A",
            "@multimediatype": "JPEG image file",
            "@type": "IMAGE-HIGH-RES",
            "@size": "659851",
            "@ref": "gr3",
            "@mimetype": "image/jpeg"
          },
          {
            "@category": "high",
            "@height": "1556",
            "@width": "946",
            "@_fa": "true",
            "$": "https://api.elsevier.com/content/object/eid/1-s2.0-S1381116915000205-gr2_lrg.jpg?httpAccept=%2A%2F%2A",
            "@multimediatype": "JPEG image file",
            "@type": "IMAGE-HIGH-RES",
            "@size": "200401",
            "@ref": "gr2",
            "@mimetype": "image/jpeg"
          },
          {
            "@category": "high",
            "@height": "1616",
            "@width": "1500",
            "@_fa": "true",
            "$": "https://api.elsevier.com/content/object/eid/1-s2.0-S1381116915000205-gr13_lrg.jpg?httpAccept=%2A%2F%2A",
            "@multimediatype": "JPEG image file",
            "@type": "IMAGE-HIGH-RES",
            "@size": "248187",
            "@ref": "gr13",
            "@mimetype": "image/jpeg"
          },
          {
            "@category": "high",
            "@height": "1160",
            "@width": "738",
            "@_fa": "true",
            "$": "https://api.elsevier.com/content/object/eid/1-s2.0-S1381116915000205-gr12_lrg.jpg?httpAccept=%2A%2F%2A",
            "@multimediatype": "JPEG image file",
            "@type": "IMAGE-HIGH-RES",
            "@size": "133162",
            "@ref": "gr12",
            "@mimetype": "image/jpeg"
          },
          {
            "@category": "high",
            "@height": "1074",
            "@width": "674",
            "@_fa": "true",
            "$": "https://api.elsevier.com/content/object/eid/1-s2.0-S1381116915000205-gr11_lrg.jpg?httpAccept=%2A%2F%2A",
            "@multimediatype": "JPEG image file",
            "@type": "IMAGE-HIGH-RES",
            "@size": "127194",
            "@ref": "gr11",
            "@mimetype": "image/jpeg"
          },
          {
            "@category": "high",
            "@height": "873",
            "@width": "1002",
            "@_fa": "true",
            "$": "https://api.elsevier.com/content/object/eid/1-s2.0-S1381116915000205-gr10_lrg.jpg?httpAccept=%2A%2F%2A",
            "@multimediatype": "JPEG image file",
            "@type": "IMAGE-HIGH-RES",
            "@size": "136758",
            "@ref": "gr10",
            "@mimetype": "image/jpeg"
          },
          {
            "@category": "high",
            "@height": "678",
            "@width": "846",
            "@_fa": "true",
            "$": "https://api.elsevier.com/content/object/eid/1-s2.0-S1381116915000205-gr1_lrg.jpg?httpAccept=%2A%2F%2A",
            "@multimediatype": "JPEG image file",
            "@type": "IMAGE-HIGH-RES",
            "@size": "63744",
            "@ref": "gr1",
            "@mimetype": "image/jpeg"
          },
          {
            "@category": "high",
            "@height": "886",
            "@width": "2213",
            "@_fa": "true",
            "$": "https://api.elsevier.com/content/object/eid/1-s2.0-S1381116915000205-fx1_lrg.jpg?httpAccept=%2A%2F%2A",
            "@multimediatype": "JPEG image file",
            "@type": "IMAGE-HIGH-RES",
            "@size": "153967",
            "@ref": "fx1",
            "@mimetype": "image/jpeg"
          },
          {
            "@category": "standard",
            "@height": "379",
            "@width": "339",
            "@_fa": "true",
            "$": "https://api.elsevier.com/content/object/eid/1-s2.0-S1381116915000205-gr9.jpg?httpAccept=%2A%2F%2A",
            "@multimediatype": "JPEG image file",
            "@type": "IMAGE-DOWNSAMPLED",
            "@size": "53470",
            "@ref": "gr9",
            "@mimetype": "image/jpeg"
          },
          {
            "@category": "standard",
            "@height": "600",
            "@width": "376",
            "@_fa": "true",
            "$": "https://api.elsevier.com/content/object/eid/1-s2.0-S1381116915000205-gr8.jpg?httpAccept=%2A%2F%2A",
            "@multimediatype": "JPEG image file",
            "@type": "IMAGE-DOWNSAMPLED",
            "@size": "50155",
            "@ref": "gr8",
            "@mimetype": "image/jpeg"
          },
          {
            "@category": "standard",
            "@height": "273",
            "@width": "320",
            "@_fa": "true",
            "$": "https://api.elsevier.com/content/object/eid/1-s2.0-S1381116915000205-gr7.jpg?httpAccept=%2A%2F%2A",
            "@multimediatype": "JPEG image file",
            "@type": "IMAGE-DOWNSAMPLED",
            "@size": "30537",
            "@ref": "gr7",
            "@mimetype": "image/jpeg"
          },
          {
            "@category": "standard",
            "@height": "227",
            "@width": "647",
            "@_fa": "true",
            "$": "https://api.elsevier.com/content/object/eid/1-s2.0-S1381116915000205-gr6.jpg?httpAccept=%2A%2F%2A",
            "@multimediatype": "JPEG image file",
            "@type": "IMAGE-DOWNSAMPLED",
            "@size": "35442",
            "@ref": "gr6",
            "@mimetype": "image/jpeg"
          },
          {
            "@category": "standard",
            "@height": "233",
            "@width": "654",
            "@_fa": "true",
            "$": "https://api.elsevier.com/content/object/eid/1-s2.0-S1381116915000205-gr5.jpg?httpAccept=%2A%2F%2A",
            "@multimediatype": "JPEG image file",
            "@type": "IMAGE-DOWNSAMPLED",
            "@size": "32605",
            "@ref": "gr5",
            "@mimetype": "image/jpeg"
          },
          {
            "@category": "standard",
            "@height": "234",
            "@width": "648",
            "@_fa": "true",
            "$": "https://api.elsevier.com/content/object/eid/1-s2.0-S1381116915000205-gr4.jpg?httpAccept=%2A%2F%2A",
            "@multimediatype": "JPEG image file",
            "@type": "IMAGE-DOWNSAMPLED",
            "@size": "36677",
            "@ref": "gr4",
            "@mimetype": "image/jpeg"
          },
          {
            "@category": "standard",
            "@height": "599",
            "@width": "371",
            "@_fa": "true",
            "$": "https://api.elsevier.com/content/object/eid/1-s2.0-S1381116915000205-gr3.jpg?httpAccept=%2A%2F%2A",
            "@multimediatype": "JPEG image file",
            "@type": "IMAGE-DOWNSAMPLED",
            "@size": "41539",
            "@ref": "gr3",
            "@mimetype": "image/jpeg"
          },
          {
            "@category": "standard",
            "@height": "586",
            "@width": "356",
            "@_fa": "true",
            "$": "https://api.elsevier.com/content/object/eid/1-s2.0-S1381116915000205-gr2.jpg?httpAccept=%2A%2F%2A",
            "@multimediatype": "JPEG image file",
            "@type": "IMAGE-DOWNSAMPLED",
            "@size": "56610",
            "@ref": "gr2",
            "@mimetype": "image/jpeg"
          },
          {
            "@category": "standard",
            "@height": "609",
            "@width": "565",
            "@_fa": "true",
            "$": "https://api.elsevier.com/content/object/eid/1-s2.0-S1381116915000205-gr13.jpg?httpAccept=%2A%2F%2A",
            "@multimediatype": "JPEG image file",
            "@type": "IMAGE-DOWNSAMPLED",
            "@size": "71450",
            "@ref": "gr13",
            "@mimetype": "image/jpeg"
          },
          {
            "@category": "standard",
            "@height": "435",
            "@width": "277",
            "@_fa": "true",
            "$": "https://api.elsevier.com/content/object/eid/1-s2.0-S1381116915000205-gr12.jpg?httpAccept=%2A%2F%2A",
            "@multimediatype": "JPEG image file",
            "@type": "IMAGE-DOWNSAMPLED",
            "@size": "39389",
            "@ref": "gr12",
            "@mimetype": "image/jpeg"
          },
          {
            "@category": "standard",
            "@height": "403",
            "@width": "253",
            "@_fa": "true",
            "$": "https://api.elsevier.com/content/object/eid/1-s2.0-S1381116915000205-gr11.jpg?httpAccept=%2A%2F%2A",
            "@multimediatype": "JPEG image file",
            "@type": "IMAGE-DOWNSAMPLED",
            "@size": "38004",
            "@ref": "gr11",
            "@mimetype": "image/jpeg"
          },
          {
            "@category": "standard",
            "@height": "328",
            "@width": "377",
            "@_fa": "true",
            "$": "https://api.elsevier.com/content/object/eid/1-s2.0-S1381116915000205-gr10.jpg?httpAccept=%2A%2F%2A",
            "@multimediatype": "JPEG image file",
            "@type": "IMAGE-DOWNSAMPLED",
            "@size": "40823",
            "@ref": "gr10",
            "@mimetype": "image/jpeg"
          },
          {
            "@category": "standard",
            "@height": "255",
            "@width": "318",
            "@_fa": "true",
            "$": "https://api.elsevier.com/content/object/eid/1-s2.0-S1381116915000205-gr1.jpg?httpAccept=%2A%2F%2A",
            "@multimediatype": "JPEG image file",
            "@type": "IMAGE-DOWNSAMPLED",
            "@size": "21670",
            "@ref": "gr1",
            "@mimetype": "image/jpeg"
          },
          {
            "@category": "standard",
            "@height": "200",
            "@width": "500",
            "@_fa": "true",
            "$": "https://api.elsevier.com/content/object/eid/1-s2.0-S1381116915000205-fx1.jpg?httpAccept=%2A%2F%2A",
            "@multimediatype": "JPEG image file",
            "@type": "IMAGE-DOWNSAMPLED",
            "@size": "22573",
            "@ref": "fx1",
            "@mimetype": "image/jpeg"
          },
          {
            "@category": "thumbnail",
            "@height": "163",
            "@width": "146",
            "@_fa": "true",
            "$": "https://api.elsevier.com/content/object/eid/1-s2.0-S1381116915000205-gr9.sml?httpAccept=%2A%2F%2A",
            "@multimediatype": "GIF image file",
            "@type": "IMAGE-THUMBNAIL",
            "@size": "6712",
            "@ref": "gr9",
            "@mimetype": "image/gif"
          },
          {
            "@category": "thumbnail",
            "@height": "163",
            "@width": "102",
            "@_fa": "true",
            "$": "https://api.elsevier.com/content/object/eid/1-s2.0-S1381116915000205-gr8.sml?httpAccept=%2A%2F%2A",
            "@multimediatype": "GIF image file",
            "@type": "IMAGE-THUMBNAIL",
            "@size": "3802",
            "@ref": "gr8",
            "@mimetype": "image/gif"
          },
          {
            "@category": "thumbnail",
            "@height": "164",
            "@width": "192",
            "@_fa": "true",
            "$": "https://api.elsevier.com/content/object/eid/1-s2.0-S1381116915000205-gr7.sml?httpAccept=%2A%2F%2A",
            "@multimediatype": "GIF image file",
            "@type": "IMAGE-THUMBNAIL",
            "@size": "5928",
            "@ref": "gr7",
            "@mimetype": "image/gif"
          },
          {
            "@category": "thumbnail",
            "@height": "77",
            "@width": "219",
            "@_fa": "true",
            "$": "https://api.elsevier.com/content/object/eid/1-s2.0-S1381116915000205-gr6.sml?httpAccept=%2A%2F%2A",
            "@multimediatype": "GIF image file",
            "@type": "IMAGE-THUMBNAIL",
            "@size": "3771",
            "@ref": "gr6",
            "@mimetype": "image/gif"
          },
          {
            "@category": "thumbnail",
            "@height": "78",
            "@width": "219",
            "@_fa": "true",
            "$": "https://api.elsevier.com/content/object/eid/1-s2.0-S1381116915000205-gr5.sml?httpAccept=%2A%2F%2A",
            "@multimediatype": "GIF image file",
            "@type": "IMAGE-THUMBNAIL",
            "@size": "3455",
            "@ref": "gr5",
            "@mimetype": "image/gif"
          },
          {
            "@category": "thumbnail",
            "@height": "79",
            "@width": "219",
            "@_fa": "true",
            "$": "https://api.elsevier.com/content/object/eid/1-s2.0-S1381116915000205-gr4.sml?httpAccept=%2A%2F%2A",
            "@multimediatype": "GIF image file",
            "@type": "IMAGE-THUMBNAIL",
            "@size": "3732",
            "@ref": "gr4",
            "@mimetype": "image/gif"
          },
          {
            "@category": "thumbnail",
            "@height": "163",
            "@width": "101",
            "@_fa": "true",
            "$": "https://api.elsevier.com/content/object/eid/1-s2.0-S1381116915000205-gr3.sml?httpAccept=%2A%2F%2A",
            "@multimediatype": "GIF image file",
            "@type": "IMAGE-THUMBNAIL",
            "@size": "3943",
            "@ref": "gr3",
            "@mimetype": "image/gif"
          },
          {
            "@category": "thumbnail",
            "@height": "163",
            "@width": "99",
            "@_fa": "true",
            "$": "https://api.elsevier.com/content/object/eid/1-s2.0-S1381116915000205-gr2.sml?httpAccept=%2A%2F%2A",
            "@multimediatype": "GIF image file",
            "@type": "IMAGE-THUMBNAIL",
            "@size": "4293",
            "@ref": "gr2",
            "@mimetype": "image/gif"
          },
          {
            "@category": "thumbnail",
            "@height": "164",
            "@width": "152",
            "@_fa": "true",
            "$": "https://api.elsevier.com/content/object/eid/1-s2.0-S1381116915000205-gr13.sml?httpAccept=%2A%2F%2A",
            "@multimediatype": "GIF image file",
            "@type": "IMAGE-THUMBNAIL",
            "@size": "4602",
            "@ref": "gr13",
            "@mimetype": "image/gif"
          },
          {
            "@category": "thumbnail",
            "@height": "163",
            "@width": "104",
            "@_fa": "true",
            "$": "https://api.elsevier.com/content/object/eid/1-s2.0-S1381116915000205-gr12.sml?httpAccept=%2A%2F%2A",
            "@multimediatype": "GIF image file",
            "@type": "IMAGE-THUMBNAIL",
            "@size": "3968",
            "@ref": "gr12",
            "@mimetype": "image/gif"
          },
          {
            "@category": "thumbnail",
            "@height": "164",
            "@width": "103",
            "@_fa": "true",
            "$": "https://api.elsevier.com/content/object/eid/1-s2.0-S1381116915000205-gr11.sml?httpAccept=%2A%2F%2A",
            "@multimediatype": "GIF image file",
            "@type": "IMAGE-THUMBNAIL",
            "@size": "4220",
            "@ref": "gr11",
            "@mimetype": "image/gif"
          },
          {
            "@category": "thumbnail",
            "@height": "164",
            "@width": "188",
            "@_fa": "true",
            "$": "https://api.elsevier.com/content/object/eid/1-s2.0-S1381116915000205-gr10.sml?httpAccept=%2A%2F%2A",
            "@multimediatype": "GIF image file",
            "@type": "IMAGE-THUMBNAIL",
            "@size": "5703",
            "@ref": "gr10",
            "@mimetype": "image/gif"
          },
          {
            "@category": "thumbnail",
            "@height": "163",
            "@width": "204",
            "@_fa": "true",
            "$": "https://api.elsevier.com/content/object/eid/1-s2.0-S1381116915000205-gr1.sml?httpAccept=%2A%2F%2A",
            "@multimediatype": "GIF image file",
            "@type": "IMAGE-THUMBNAIL",
            "@size": "4483",
            "@ref": "gr1",
            "@mimetype": "image/gif"
          },
          {
            "@category": "thumbnail",
            "@height": "88",
            "@width": "219",
            "@_fa": "true",
            "$": "https://api.elsevier.com/content/object/eid/1-s2.0-S1381116915000205-fx1.sml?httpAccept=%2A%2F%2A",
            "@multimediatype": "GIF image file",
            "@type": "IMAGE-THUMBNAIL",
            "@size": "3959",
            "@ref": "fx1",
            "@mimetype": "image/gif"
          }
        ]
      },
      "link": {
        "@rel": "abstract",
        "@href": "https://api.elsevier.com/content/abstract/scopus_id/84924243773"
      }
    }
  }
}