{
  "metadata": {
    "title": "Experimental and theoretical investigation of the enantioselective hydrogenation of ethyl pyruvate with a Pt catalyst with new non-cinchona chiral modifiers",
    "authors": "; ; ",
    "journal": "Journal of Molecular Catalysis A: Chemical",
    "date": "2016-11-30",
    "doi": "10.1016/j.molcata.2016.07.009",
    "abstract": "",
    "uri": "https://api.elsevier.com/content/article/pii/S138111691630259X",
    "pii": "S138111691630259X"
  },
  "fulltext": {
    "full-text-retrieval-response": {
      "scopus-eid": "2-s2.0-84978315689",
      "originalText": "serial JL 271358 291210 291744 291790 291809 31 Journal of Molecular Catalysis A: Chemical JOURNALMOLECULARCATALYSISACHEMICAL 2016-07-05 2016-07-05 2016-07-16 2016-07-16 2019-10-28T13:34:12 1-s2.0-S138111691630259X S1381-1169(16)30259-X S138111691630259X 10.1016/j.molcata.2016.07.009 S300 S300.5 FULL-TEXT 1-s2.0-S1381116916X0009X 2019-10-30T00:36:17.500705Z 0 0 20161101 20161130 2016 2016-07-05T15:37:25.952014Z absattachment articleinfo articletitlenorm authfirstinitialnorm authfirstsurnamenorm cid cids contenttype copyright crossmark dateloaded dateloadedtxt datesearch datesort dateupdated dco docsubtype doctype doi eid ewtransactionid hubeid indexeddate issn issnnorm itemstage itemtransactionid itemweight openaccess openarchive pg pgfirst pglast pii piinorm pubdateend pubdatestart pubdatetxt pubyr sectiontitle sortorder srctitle srctitlenorm srctype ssids alllist content subj subheadings suppl tomb volfirst volissue volumelist webpdf webpdfpagecount yearnav figure table e-component body mmlmath acknowledge affil appendices articletitle auth authfirstini authfull authkeywords authlast grantsponsor highlightsabst orcid primabst ref specialabst 1381-1169 13811169 true 423 423 C Volume 423 28 233 239 233 239 201611 November 2016 2016-11-01 2016-11-30 2016 Regular Papers article fla © 2016 Elsevier B.V. All rights reserved. EXPERIMENTALTHEORETICALINVESTIGATIONENANTIOSELECTIVEHYDROGENATIONETHYLPYRUVATEAPTCATALYSTNEWNONCINCHONACHIRALMODIFIERS RUGGERA J 1 Introduction 2 Experimental and computational methods 2.1 Catalyst preparation and modification 2.2 Catalyst characterization 2.3 Hydrogenation reactions 2.4 Theoretical calculations 3 Results and discussion 3.1 Catalyst characterization 3.2 Hydrogenation of ethyl pyruvate 3.3 Theoretical calculations 4 Conclusions Acknowledgements Appendix A Supplementary data References STINSON 2001 79 S ROUHI 2003 45 A ROUHI 2004 47 A BLASER 2001 119 143 H BLASER 1999 459 464 H OSAWA 2000 155 168 T IZUMI 1983 215 271 Y MURZIN 2005 175 256 D BLASER 1996 85 94 H ORITO 1979 173 174 Y SZOLLOSI 2013 81 85 G MONDELLI 2010 87 91 C SZOLLOSI 2010 263 271 G PAN 2013 108 114 H CAMPOS 2013 198 207 C AZMAT 2011 42 50 M BALAZSIK 2004 463 472 K LEBLANC 2004 277 289 R FERRI 2001 12074 12084 D CARLEY 1995 2167 2172 A BONELLO 2001 207 J BURGI 2000 5953 5960 T BURGI 2000 109 112 T BURGI 2000 445 451 T BAIKER 2000 205 220 A DEMCARNEIROA 2005 221 226 J TALAS 2010 3 15 E KUKULA 2007 2859 2868 P MERLO 2008 654 660 A BEKE 1993 1372 1377 A LEE 1988 785 789 C FONSECAGUERRA 1998 391 403 C TEVELDE 2001 931 967 G PYE 2009 790 797 C JOHNSON 2010 6498 6505 E CONTRERASGARCIA 2011 12983 12990 J CHAUDRET 2014 9876 9891 R ALLOUCHE A WEHRLI 1990 207 226 J TOUKONIITTY 2000 3363 3368 E HO 1998 293 298 L WEHRLI 1989 245 257 J BLASER 1991 215 222 U CSERENYI 2006 108 115 S CSERENYI 2005 395 403 S SZORI 2009 178 184 K BLASER 2000 12675 12682 H BOUCHOUX 2012 353 390 G VONARX 2002 75 87 M STUDER 2003 45 65 M BONALUMI 2003 13342 13343 N EVANS 1999 L691 L696 T JEFFREY 1997 G INTRODUCTIONHYDROGENBONDIG SZATYLOWICZ 2008 897 914 H BOUCHET 2015 25809 25821 A RUGGERAX2016X233 RUGGERAX2016X233X239 RUGGERAX2016X233XJ RUGGERAX2016X233X239XJ 2018-07-16T00:00:00Z http://creativecommons.org/licenses/by-nc-nd/4.0/ © 2016 Elsevier B.V. All rights reserved. 2019-03-25T21:50:24.543Z http://vtw.elsevier.com/data/voc/AddOnTypes/50.7/nlp S138111691630259X Consejo Nacional de Investigaciones Científicas y Técnicas PIP 0276 Consejo Nacional de Investigaciones Científicas y Técnicas http://data.elsevier.com/vocabulary/SciValFunders/501100002923 http://sws.geonames.org/3865483/ Universidad Nacional de La Plata X700 UNLP Universidad Nacional de La Plata http://data.elsevier.com/vocabulary/SciValFunders/501100003947 http://sws.geonames.org/3865483/ The authors thank the Consejo Nacional de Investigaciones Científicas y Técnicas (CONICET) for grant PIP 0276 and the Universidad Nacional de La Plata (Projec X700) for institutional support. Appendix A item S1381-1169(16)30259-X S138111691630259X 1-s2.0-S138111691630259X 10.1016/j.molcata.2016.07.009 271358 2019-10-30T00:36:17.500705Z 2016-11-01 2016-11-30 1-s2.0-S138111691630259X-main.pdf https://s3.amazonaws.com/prod-ucs-content-store-us-east/content/pii:S138111691630259X/MAIN/application/pdf/13701ce3cfb2171ce6723adb47f15e57/main.pdf main.pdf pdf true 1221572 MAIN 7 1-s2.0-S138111691630259X-main_1.png https://s3.amazonaws.com/prod-ucs-content-store-us-east/content/pii:S138111691630259X/PREVIEW/image/png/0d7856483314a91e920572dc6192c8c7/main_1.png main_1.png png 55557 849 656 IMAGE-WEB-PDF 1 1-s2.0-S138111691630259X-fx1.sml https://s3.amazonaws.com/prod-ucs-content-store-us-east/content/pii:S138111691630259X/fx1/THUMBNAIL/image/gif/a94c166c28895acec25387eb9f293593/fx1.sml fx1 true fx1.sml sml 12125 88 219 IMAGE-THUMBNAIL 1-s2.0-S138111691630259X-gr1.sml https://s3.amazonaws.com/prod-ucs-content-store-us-east/content/pii:S138111691630259X/gr1/THUMBNAIL/image/gif/743150fba78fc2bbb19fb912f21807e9/gr1.sml gr1 gr1.sml sml 2340 38 219 IMAGE-THUMBNAIL 1-s2.0-S138111691630259X-gr2.sml https://s3.amazonaws.com/prod-ucs-content-store-us-east/content/pii:S138111691630259X/gr2/THUMBNAIL/image/gif/2b680a04b8c1652ac922308be923d430/gr2.sml gr2 gr2.sml sml 19810 151 219 IMAGE-THUMBNAIL 1-s2.0-S138111691630259X-gr3.sml https://s3.amazonaws.com/prod-ucs-content-store-us-east/content/pii:S138111691630259X/gr3/THUMBNAIL/image/gif/93a6e1d25407dc223e5152dcd776f983/gr3.sml gr3 gr3.sml sml 6077 164 218 IMAGE-THUMBNAIL 1-s2.0-S138111691630259X-gr4.sml https://s3.amazonaws.com/prod-ucs-content-store-us-east/content/pii:S138111691630259X/gr4/THUMBNAIL/image/gif/c7f75fb83043c4db2513daae56ed533b/gr4.sml gr4 gr4.sml sml 6682 164 201 IMAGE-THUMBNAIL 1-s2.0-S138111691630259X-gr5.sml https://s3.amazonaws.com/prod-ucs-content-store-us-east/content/pii:S138111691630259X/gr5/THUMBNAIL/image/gif/806b02ead30f4e03133b1ff88c2e69d6/gr5.sml gr5 gr5.sml sml 7198 109 219 IMAGE-THUMBNAIL 1-s2.0-S138111691630259X-gr6.sml https://s3.amazonaws.com/prod-ucs-content-store-us-east/content/pii:S138111691630259X/gr6/THUMBNAIL/image/gif/da75915391b3bd1099f89ba55520685e/gr6.sml gr6 gr6.sml sml 6710 79 219 IMAGE-THUMBNAIL 1-s2.0-S138111691630259X-sc1.sml https://s3.amazonaws.com/prod-ucs-content-store-us-east/content/pii:S138111691630259X/sc1/THUMBNAIL/image/gif/fa79ca0adfd1385b4ea585878899ae38/sc1.sml sc1 sc1.sml sml 4467 164 165 IMAGE-THUMBNAIL 1-s2.0-S138111691630259X-fx1.jpg https://s3.amazonaws.com/prod-ucs-content-store-us-east/content/pii:S138111691630259X/fx1/DOWNSAMPLED/image/jpeg/5fc38f7bf56876f9a6e6b08583b18113/fx1.jpg fx1 true fx1.jpg jpg 27284 200 500 IMAGE-DOWNSAMPLED 1-s2.0-S138111691630259X-gr1.jpg https://s3.amazonaws.com/prod-ucs-content-store-us-east/content/pii:S138111691630259X/gr1/DOWNSAMPLED/image/jpeg/4bf62711f57a1da88df5be6c0dd3f72b/gr1.jpg gr1 gr1.jpg jpg 9073 85 489 IMAGE-DOWNSAMPLED 1-s2.0-S138111691630259X-gr2.jpg https://s3.amazonaws.com/prod-ucs-content-store-us-east/content/pii:S138111691630259X/gr2/DOWNSAMPLED/image/jpeg/dd29b34dfdf0755f9286d4826c2c5eeb/gr2.jpg gr2 gr2.jpg jpg 28069 258 376 IMAGE-DOWNSAMPLED 1-s2.0-S138111691630259X-gr3.jpg https://s3.amazonaws.com/prod-ucs-content-store-us-east/content/pii:S138111691630259X/gr3/DOWNSAMPLED/image/jpeg/737ce042d6b97c33570a706427956050/gr3.jpg gr3 gr3.jpg jpg 14018 226 301 IMAGE-DOWNSAMPLED 1-s2.0-S138111691630259X-gr4.jpg https://s3.amazonaws.com/prod-ucs-content-store-us-east/content/pii:S138111691630259X/gr4/DOWNSAMPLED/image/jpeg/6904a1adb83b12821062e915cfdb4688/gr4.jpg gr4 gr4.jpg jpg 35847 461 565 IMAGE-DOWNSAMPLED 1-s2.0-S138111691630259X-gr5.jpg https://s3.amazonaws.com/prod-ucs-content-store-us-east/content/pii:S138111691630259X/gr5/DOWNSAMPLED/image/jpeg/d578342eededaaf8394f33f70d7cec60/gr5.jpg gr5 gr5.jpg jpg 32939 281 565 IMAGE-DOWNSAMPLED 1-s2.0-S138111691630259X-gr6.jpg https://s3.amazonaws.com/prod-ucs-content-store-us-east/content/pii:S138111691630259X/gr6/DOWNSAMPLED/image/jpeg/2ae372f51219b458b4870d45d563a8f8/gr6.jpg gr6 gr6.jpg jpg 26703 204 565 IMAGE-DOWNSAMPLED 1-s2.0-S138111691630259X-sc1.jpg https://s3.amazonaws.com/prod-ucs-content-store-us-east/content/pii:S138111691630259X/sc1/DOWNSAMPLED/image/jpeg/0b763f1ecb4e20d0f32542d159f4f300/sc1.jpg sc1 sc1.jpg jpg 22507 372 374 IMAGE-DOWNSAMPLED 1-s2.0-S138111691630259X-fx1_lrg.jpg https://s3.amazonaws.com/prod-ucs-content-store-us-east/content/pii:S138111691630259X/fx1/HIGHRES/image/jpeg/1e106ae0717994abac6835c93d9752ae/fx1_lrg.jpg fx1 true fx1_lrg.jpg jpg 196584 886 2213 IMAGE-HIGH-RES 1-s2.0-S138111691630259X-gr1_lrg.jpg https://s3.amazonaws.com/prod-ucs-content-store-us-east/content/pii:S138111691630259X/gr1/HIGHRES/image/jpeg/45c4b570346b0fce1bb50355388e8dd6/gr1_lrg.jpg gr1 gr1_lrg.jpg jpg 66491 375 2167 IMAGE-HIGH-RES 1-s2.0-S138111691630259X-gr2_lrg.jpg https://s3.amazonaws.com/prod-ucs-content-store-us-east/content/pii:S138111691630259X/gr2/HIGHRES/image/jpeg/5361c9627b210e182f3b06d862f45c0d/gr2_lrg.jpg gr2 gr2_lrg.jpg jpg 419810 1146 1667 IMAGE-HIGH-RES 1-s2.0-S138111691630259X-gr3_lrg.jpg https://s3.amazonaws.com/prod-ucs-content-store-us-east/content/pii:S138111691630259X/gr3/HIGHRES/image/jpeg/b36a927629ef5ee39e4a6bfcd4889adc/gr3_lrg.jpg gr3 gr3_lrg.jpg jpg 110144 1003 1333 IMAGE-HIGH-RES 1-s2.0-S138111691630259X-gr4_lrg.jpg https://s3.amazonaws.com/prod-ucs-content-store-us-east/content/pii:S138111691630259X/gr4/HIGHRES/image/jpeg/2ea55092c2a667e33b648144c407fcc2/gr4_lrg.jpg gr4 gr4_lrg.jpg jpg 284494 2042 2500 IMAGE-HIGH-RES 1-s2.0-S138111691630259X-gr5_lrg.jpg https://s3.amazonaws.com/prod-ucs-content-store-us-east/content/pii:S138111691630259X/gr5/HIGHRES/image/jpeg/b65d6fd7a61e6fa1fef6d8e698b225f0/gr5_lrg.jpg gr5 gr5_lrg.jpg jpg 264576 1243 2500 IMAGE-HIGH-RES 1-s2.0-S138111691630259X-gr6_lrg.jpg https://s3.amazonaws.com/prod-ucs-content-store-us-east/content/pii:S138111691630259X/gr6/HIGHRES/image/jpeg/3f9adc22c3c04919d9b99043d97165fd/gr6_lrg.jpg gr6 gr6_lrg.jpg jpg 219857 903 2500 IMAGE-HIGH-RES 1-s2.0-S138111691630259X-sc1_lrg.jpg https://s3.amazonaws.com/prod-ucs-content-store-us-east/content/pii:S138111691630259X/sc1/HIGHRES/image/jpeg/2731089c22ca79f678031af1526ca991/sc1_lrg.jpg sc1 sc1_lrg.jpg jpg 174215 1647 1655 IMAGE-HIGH-RES 1-s2.0-S138111691630259X-mmc1.pdf https://s3.amazonaws.com/prod-ucs-content-store-us-east/content/pii:S138111691630259X/mmc1/MAIN/application/pdf/4ecc2fafe7ef9446d10ddd3d5dbcc4ea/mmc1.pdf mmc1 mmc1.pdf pdf false 315594 APPLICATION 1-s2.0-S138111691630259X-si1.gif https://s3.amazonaws.com/prod-ucs-content-store-us-east/content/pii:S138111691630259X/STRIPIN/image/gif/b0911135c3f0cb35c001d315cbc25f3f/si1.gif si1 si1.gif gif 611 40 78 ALTIMG 1-s2.0-S138111691630259X-si2.gif https://s3.amazonaws.com/prod-ucs-content-store-us-east/content/pii:S138111691630259X/STRIPIN/image/gif/2ae52bfa8b49a54eafbcdc0d81850d77/si2.gif si2 si2.gif gif 821 35 160 ALTIMG 1-s2.0-S138111691630259X-si3.gif https://s3.amazonaws.com/prod-ucs-content-store-us-east/content/pii:S138111691630259X/STRIPIN/image/gif/81421dd631c91b416ddcc41ddf70c60f/si3.gif si3 si3.gif gif 735 16 227 ALTIMG 1-s2.0-S138111691630259X-si4.gif https://s3.amazonaws.com/prod-ucs-content-store-us-east/content/pii:S138111691630259X/STRIPIN/image/gif/4557d794fbf9ab5d57d69b5b0719f0dc/si4.gif si4 si4.gif gif 745 16 244 ALTIMG 1-s2.0-S138111691630259X-si5.gif https://s3.amazonaws.com/prod-ucs-content-store-us-east/content/pii:S138111691630259X/STRIPIN/image/gif/1c6325e9b66d3953ed9a16bb6cf040b2/si5.gif si5 si5.gif gif 791 55 132 ALTIMG MOLCAA 9943 S1381-1169(16)30259-X 10.1016/j.molcata.2016.07.009 Elsevier B.V. Fig. 1 Enantioselective hydrogenation of ethyl pyruvate to (R) and (S)-ethyl lactate. Fig. 1 Fig. 2 TEM image of Pt/SiO2 catalyst. Fig. 2 Fig. 3 Hydrogenation reaction of ethyl pyruvate in 2-propanol. Conversion as a function of time for the Pt/SiO2 catalyst without modifier (×) and modified with: (S)-(+)-1-aminoindan (▲), (R)-(−)-1-aminoindan (●), (1R,2S)-(+)-cis-1-amino-2-indanol (□), (1S,2R)-(+)-cis-1-amino-2-indanol (■), (S)-(+)-indanol (◊) y (R)-(−)-indanol (○). (For experimental conditions, see the text). Fig. 3 Fig. 4 Optimized geometries for the complex formed between (S)-(+)-1-aminoindan and ethyl pyruvate. Fig. 4 Fig. 5 Binding lengths between the oxygen atom of the hydroxyl group and its closest hydrogen atom of the protonated amino group (Å) and bond angle between NHO for both aminoindanol molecules. Fig. 5 Fig. 6 The most stable structures for (1R,2S)-(+)-cis-1-amino-2-indanol (a) and (1S,2R)-(−)-cis-1-amino-2-indanol (b), with their respective isosurfaces calculated through NCI analysis. (For interpretation of the colors in this figure, the reader is referred to the web version of this article). Fig. 6 Scheme 1 Chemical structures of the chiral modifiers studied. Scheme 1 Table 1 Racemic and enantioselective hydrogenation of ethyl pyruvate. Table 1 Modifier ee% a ri b – 0 2.96 (S)-(+)-1-aminoindan 63 (R) 7.35 (R)-(−)-1-aminoindan 45 (R) 6.96 (1R,2S)-(+)-cis-1-amino-2-indanol <5 (R) 1.89 (1S,2R)-(−)-cis-1-amino-2-indanol 30 (R) 3.59 (S)-(+)-1-indanol <5 (S) 3.68 (R)-(−)-1-indanol 8 (S) 3.38 Reaction conditions: 250mg of 2wt% Pt/SiO2 catalyst; 1.0MPa of H2 pressure; solvent: 2-propanol; 273K. a Enantiomeric excess calculated with Eq. (1) at 80% conversion. Absolute configuration in brackets. b Reaction rate estimated between 0% and 10% conversion. Expressed as mmolg‐1 Ptsup sec−1. Table 2 Proton affinity (PA) calculated for the different modifiers at BLYP/TZP level of theory. Table 2 Modifier PA (kJ/mol) 1-aminoindan 896.4 cis-1-amino-2-indanol 895.2 1-indanol 881.6 Table 3 ΔG f (kJmol−1) for each modifier-substrate complex studied, theoretical ee% calculated from a Maxwell-Boltzmann distribution (298K) and experimental ee%. Table 3 Modifier Complex conformation ΔGf (kJmol−1 ) ee% a (calc) ee% (exp) (S)-(+)-1-aminoindan pro-R-cis 173.93 81.37 (R) 63 (R) pro-R-trans 194.89 pro-S-cis 179.58 pro-S-trans 200.87 (1S,2R)-(−)-cis-1-amino-2-indanol pro-R-cis 54.77 24.37 (R) 30 (R) pro-R-trans 65.60 pro-S-cis 56.15 pro-S-trans 62.51 a Calculated using Eq. (4). Experimental and theoretical investigation of the enantioselective hydrogenation of ethyl pyruvate with a Pt catalyst with new non-cinchona chiral modifiers José F. Ruggera a ⁎ Andrea B. Merlo a Reinaldo Pis Diez b Mónica L. Casella a a Centro de Investigación y Desarrollo en Ciencias Aplicadas “Dr. Jorge J. Ronco”, CINDECA (Facultad de Ciencias Exactas, UNLP – CCT La Plata, CONICET), calle 47 N° 257 1900, La Plata, Argentina Centro de Investigación y Desarrollo en Ciencias Aplicadas “Dr. Jorge J. Ronco” CINDECA (Facultad de Ciencias Exactas, UNLP – CCT La Plata, CONICET) calle 47 N° 257 1900 La Plata Argentina b Centro de Química Inorgánica, CEQUINOR (Facultad de Ciencias Exactas, UNLP-CCT La Plata, CONICET) Bv. 120 e/60 y 64 N°1465, C. C. 962–1900, La Plata, Argentina Centro de Química Inorgánica CEQUINOR (Facultad de Ciencias Exactas, UNLP-CCT La Plata, CONICET) Bv. 120 e/60 y 64 N°1465, C. C. 962–1900 La Plata Argentina ⁎ Corresponding author. Graphical abstract The enantioselective hydrogenation of ethyl pyruvate using a Pt/SiO2 catalyst modified with six different chiral modifiers was studied. The chiral modifiers chosen were: (S)-(+)-1-aminoindan, (R)-(−)-1-aminoindan, (1R,2S)-(+)-cis-1- amino-2-indanol, (1S,2R)-(−)-cis-1-amino-2-indanol, (S)-(+)-1-indanol and (R)-(−)-1-indanol.An excess of the (R) enantiomer of the product of 63% and 45% with (S)-(+)-1-aminoindan and (R)-(−)-1-aminoindan modifiers, respectively was obtained. When using (1S,2R)-(−)-cis-1-amino-2-indanol and (1R,2S)-(+)-cis-1-amino-2-indanol, the enantiomeric excess (ee%) obtained was 30% and 5%, respectively, while with both indanols ee% did not exceed 8%. Molecular modeling of the complex formed between the chiral modifier and ethyl pyruvate performed by DFT calculations allowed predicting the values of ee% obtained experimentally. The low ee% value obtained both aminoindanol chiral modifiers were used, could be explained by the analysis of non-covalent interactions (NCI) method. These calculations demonstrated the presence of an intramolecular hydrogen bond in the structure of these modifiers. Keywords Enantioselectivity Ethyl pyruvate Non-cinchona modifiers DFT Platinum 1 Introduction The growing demand for enantiomerically pure compounds in the field of pharmaceutical and agrochemical industries has increased the importance of optically active compounds synthesis [1–3]. In this sense, asymmetric catalysis has become a challenging subject in the field of catalysis over the last years. One of the very interesting heterogeneous catalytic processes, named “classical approach”, is enantioselective hydrogenation using metallic catalysts modified with chiral compounds [4,5]. This methodology allowed the development of the most widely employed heterogeneous chiral catalysts: Ni catalyst modified with sodium tartrate/NaBr [6,7] and Pt(Pd) catalyst modified with alkaloids of the cinchona group used to hydrogenate α-ketoesters ([8] and references therein). The enantioselective hydrogenation of α-ketoesters constitutes a useful reaction at industrial level since the reaction products, α-hydroxyesters, are key intermediates in the synthesis of biologically active compounds [9]. Japanese researchers were the first ones to perform studies in the field of asymmetric catalysis using Pt/C catalysts modified with cinchonidine for the hydrogenation of ethyl pyruvate, obtaining high optical yields [10]. In the last three decades, these reactions have been studied for the enantioselective hydrogenation of a large number of α-ketoesters and α-diketones [11–16]. With respect to the nature of the chiral modifier, when analyzing the performance of Pt-based catalysts modified with cinchonidine, the effectiveness in obtaining a high enantiomeric excess is assigned to the structure of this modifier. Three factors are crucial: a group capable of anchoring the molecule onto the surface of the metallic catalyst, the presence of a basic nitrogen atom near the stereogenic center, and a chiral center [10]. There is clear evidence that cinchonidine adsorbs on the metal surface via the aromatic quinoline π-system [17–20] forming the chiral site. Methyl pyruvate, one of the most widely molecules used as substrate in hydrogenation reactions, adsorbs on these modified chiral sites either by the oxygen lone pairs [21,22] or the π-bonding of the CO groups [23]. Hydrogen bond and donor–acceptor interactions between the modifier and selected functional groups of the substrate molecule control the adsorption mode of methyl pyruvate and facilitate the addition of hydrogen, thereby increasing the reactivity [24,25].The formation of a complex between the modifier and the substrate in a 1:1 stoichiometry is a key feature in this mechanism [26]. In this sense, many studies have been carried out aiming at understanding the role of the chiral modifier structure in the mechanism of Orito’s reaction. Tálas and Margitfalvi have written a very complete review article, in which they describe the behavior of natural alkaloids, their synthetic derivatives and analogues as chiral templates in the heterogeneous catalytic asymmetric hydrogenation of activated ketones [27]. The authors demonstrated that different types of activated ketones could be successfully hydrogenated by use of different chiral templates, being cinchonidine the most usable chiral modifier for the asymmetric hydrogenation of a wide variety of activated ketones. Kukula et al. also studied the structural effects in the chiral base employed in the Pd-induced enantioselective deprotection–decarboxylation of β-ketoesters. Various chiral amines and amino alcohols were tested in the reaction, achieving enantioselectivities up to 60% quinine and quinidine [28]. In this work, the enantioselective hydrogenation of ethyl pyruvate using a Pt/SiO2 catalyst modified with (S)-(+)-1-aminoindan, (R)-(−)-1-aminoindan, (1R,2S)-(+)-cis-1-amino-2-indanol and (1S,2R)-(−)-cis-1-amino-2-indanol was studied. The chosen modifiers are simpler and more rigid than cinchonidine, but still present its main structural features. (S)-(+)-1-indanol and (R)-(−)-1-indanol were also selected as chiral modifiers. All the modifiers employed are represented in Scheme 1 . The interaction between the modifiers and the ethyl pyruvate molecule was also modeled using tools from the density functional theory (DFT). 2 Experimental and computational methods 2.1 Catalyst preparation and modification The monometallic catalyst, Pt/SiO2, was prepared by ion exchange, using SiO2 as support (Aerosil Degussa 180m2 g−1), previously treated with NH4OH(aq). The solid obtained was reduced and modified with (S)-(+)-1-aminoindan, (R)-(−)-1-aminoindan, (1R,2S)-(+)-cis-1-amino-2-indanol, (1S,2R)-(−)-cis-1-amino-2-indanol, (S)-(+)-1-indanol and (R)-(−)-1-indanol (Aldrich), according to the previously published procedure [29]. 2.2 Catalyst characterization The platinum content was determined with the aid of an atomic emission spectrometer Perkin Elmer AAnalyst 100 after dissolving the solid. The distribution of metallic particle size was determined by transmission electron microscopy (TEM) using a JEOL 100 CX instrument. To estimate the mean particle size, the particles were considered spherical, and the second moment of the distribution was employed. The expression used for the calculation was: d = ∑ ⁣ n i d i 3 ∑ ⁣ n i d i 2 where ni is the number of particles with di size. Temperature-programmed reduction (TPR) tests were carried out in a conventional reactor with a feeding flow of 20cm3 min−1 (10% H2 in N2) at a heating rate of 10Kmin−1, from room temperature to 1073K. H2 consumption during reduction was analyzed on line with a Shimadzu GC-8A gas chromatograph with a thermal conductivity detector (TCD). 2.3 Hydrogenation reactions The hydrogenation reaction of 1mL ethyl pyruvate (Aldrich) (Fig. 1 ) was performed in an autoclave type reactor (Autoclave Engineers), at 1.0MPa H2 pressure and at a temperature of 273K, using 0.25g catalyst and 60mL of 2-propanol as solvent. The reaction advance was followed by gas chromatography in a Varian GC 3800 chromatograph equipped with a capillary column (CP–Chirasil–Dex CB) and a FID detector. The only reaction products obtained, (R) and (S)-ethyl lactate, were completely separated under the analysis conditions used. The enantiomeric excess (ee%) was calculated using the following expression: (1) e e % = ( [ R ] − [ S ] ) ( [ R ] + [ S ] ) × 100 where [R] and [S] are the concentrations of the R and S enantiomers, respectively. 2.4 Theoretical calculations The proton affinity (PA) of the chiral modifiers was calculated as: (2) M o d i f i e r + H + → ( M o d i f i e r − H + ) and it was characterized by the enthalpy change at standard conditions (273K, 1bar). For (S)-(+)-1-aminoindan, (R)-(−)-1-aminoindan, (1R,2S)-(+)-cis-1-amino-2-indanol and (1S,2R)-(−)-cis-1-amino-2-indanol molecules, the amino group was evaluated as the protonation site, while for (S)-(+)-1-indanol and (R)-(−)-1-indanol molecules, the alcohol group was chosen. The equilibrium structures for the neutral and protonated molecules of the different modifiers were obtained with the BLYP exchange-correlation functional [30,31] and a basis set of triple-ζ quality, augmented with polarization functions. The eigenvalues of the Hessian matrix of the total electronic energy with respect to the nuclear coordinates were also calculated to confirm whether the optimized geometries correspond to minima or saddle points on the potential energy surface of the molecules. All calculations were performed with the Amsterdam Density Functional (ADF) software [32]. Due to the complexity of the metallic catalyst/chiral modifier/substrate/solvent system, a number of simplifications were made in order to carry out the calculations. Thus, the contribution of the metal was not explicitly considered in this model since it involves a large computational demand. In addition, it was considered that the molecules of all the studied modifiers adsorb onto the metal surface through a link involving their benzene system, so that they remain substantially parallel to the surface. Both the cis and trans conformations of the substrate (ethyl pyruvate) were considered, and their geometries were optimized. The geometries of the protonated forms of the modifiers were also optimized. Finally, different starting geometries for the substrate– modifier complex were modeled, four for every modifier, pro-R-cis, pro-R-trans, pro‐S‐cis and pro-S-trans. The geometries of the substrate–modifier complexes were optimized at the BLYP/TZP level theory. The solvent effect was taken into account through the implementation of the COSMO model [33]. The difference in the Gibbs free energy of formation (ΔGf ) of all the complexes was calculated as the difference between the Gibbs free energy of the modifier–substrate complex and their isolated components: (3) Δ G f = G c o m p l e x − ( G m o d i f i e r + G s u b s t r a t e ) The theoretical enantiomeric excess was calculated taking into account the relative abundance of each complex at 273K, 1bar of pressure and in a 2-propanol medium. This relative abundance was calculated from the Gibbs free energies of formation using a Maxwell-Boltzmann distribution: (4) N i N = e − Δ G f i R T ∑ i e − Δ G f i R T The noncovalent interaction (NCI) approach was used to visualize possible intramolecular hydrogen bonding [34]. The NCI approach is based on the study of electron densities and their gradient in low electron density regions and small reduced gradients. The zones where the reduced gradient s(ρ) is close to zero are typical of noncovalent interactions. In order to visualize it in the molecule, isosurfaces are plotted and colored considering the sign of the second eigenvalue of the Hessian matrix λ2 (second derivative of the electron density as a function of nuclear coordinates). The blue isosurface zones correspond to positive λ2 values, which represent the areas where repulsive interactions occur. The red zones, which correspond to negative λ2 values, identify regions with attractive noncovalent interactions, such as hydrogen bonds. Green isosurface zones are those where the value of λ2 is close to zero and indicate regions involving weak delocalized interactions [35,36]. GABEDIT software was used to draw all molecule graphs and do the NCI analysis [37] 3 Results and discussion 3.1 Catalyst characterization The atomic absorption results show a Pt content of 2wt%. The prepared catalyst was characterized by TEM in order to evaluate the metallic particle size distribution. The micrograph presented in Fig. 2 indicates that the metallic particles of the Pt/SiO2 catalyst are well dispersed on the support and a mean particle size of about 6.5nm was calculated using the expression given in the experimental section. The size of the metal particles is very important in the development of active catalysts for enantioselective hydrogenations, since there is plenty of evidence that they are very sensitive to this parameter. It has been reported in the literature that the hydrogenation of ethyl pyruvate using cinchodine as modifier requires a Pt particle size of at least 3nm [38]. When a larger substrate such as 1-phenyl-1,2-propanodione is used, a Pt particle size of 4nm when the support is Al2O3 and 3.8nm when the support is SiO2 is required [39]. With respect to the TPR test, the diagram (not shown) presented two major peaks of H2 consumption: one reduction peak at a lower temperature, around 460K, and the other at a higher temperature (ca. 715K). According to the literature, the low temperature peak can be assigned to the presence of Pt (IV) species, generated during the calcination pretreatment. The high temperature peak may be assigned to species of the type Pt-(O-Si)y n−y (n=2+ or 4+), formed through the interaction of the metallic precursor and the support [40]. The peaks obtained were broad and presented shoulders, which could be due to the different environment of the ions on the support surface. 3.2 Hydrogenation of ethyl pyruvate Fig. 3 and Table 1 present the results achieved in the racemic and enantioselective hydrogenation of ethyl pyruvate employing the Pt/SiO2 catalyst, using 2-propanol as solvent, at 273K. For the enantioselective hydrogenation experiments, the catalyst was modified with different chiral inducers. The adsorption of small amounts of a chiral modifier on the surface of the metallic catalyst generates a “chiral catalytic site” suitable for the interaction of the substrate to be hydrogenated. Besides, in most of the cases, the modifier leads to a significant increase in the reaction rate, compared to what occurs with the unmodified catalyst. This rate acceleration has been traditionally observed for the hydrogenation of several prochiral carbonyl compounds in the presence of different modifiers of the cinchona alkaloids [41,42]. When analyzing the activity of the different catalytic systems employed in this work, it is possible to observe that the (S)-(+)-1-aminoindan and (R)-(−)-1-aminoindan present an almost complete conversion for a reaction time of about 30min. These results are comparable with those previously obtained with the same Pt/SiO2 catalyst modified with cinchonidine [43]. When the modifiers (1S,2R)-(−)-cis-1-amino-2-indanol and (1R,2S)-(+)-cis-1-amino-2-indanol are used, the conversion does not reach 60% or 30%, respectively, for the same reaction time (Fig. 4 ). On the other hand, with the (S)-(+)-1-indanol and (R)-(−)-1-indanol modifiers, 65% and 55% conversion values are obtained, respectively, for 30min of reaction. The significant difference in the hydrogenation rate between aminoindan and aminoindanol modifiers can be interpreted on the basis of the existence of an important interaction between OH and NH2 groups in the aminoindanol molecule [44,29]. Table 1 shows that the catalytic systems using (S)-(+)-1-aminoindan and (R)-(−)-1-aminoindan gave an excess of 63% and 45% of the enantiomer (R) of the reaction product. The ee% reached with the (S)-(+)-1-aminoindan modifier is comparable to that obtained in our laboratory using cinchonidine as modifier, under the same experimental conditions [40]. When (1S,2R)-(−)-cis-1-amino-2-indanol was used, ee% reached 30%, while for the reaction with (1R,2S)-(+)-cis-1-amino-2-indanol as modifier, ee% did not exceed 5%, with mainly (R)-ethyl lactate being obtained in both cases. The significant decrease of ee% in the reactions when these two modifiers are used may be due to the presence of an intramolecular hydrogen bond between one hydrogen atom of the protonated amino group and the oxygen atom of the alcohol group in the molecules of both modifiers. Furthermore, when (S)-(+)-1-indanol and (R)-(−)-1-indanol were used as modifiers, very low ee% values were obtained, namely, <5% and 8%, respectively. These poor ee% values may be due to the absence of a basic nitrogen atom in the chiral modifier. As mentioned in the literature, in order for a molecule to act as chiral modifier, the presence of a basic nitrogen that can get protonated is an essential requirement. In other cases, it has been demonstrated that the absence of basic nitrogen substantially decreases ee%, and may even make it disappear. This behavior was noted by Blaser et al. when, on alkylating the quinuclidine nitrogen of the cinchonidine molecule, they found that the enantiodifferentiation was completely lost [45]. A remarkable observation that can be done about the ee% data shown in Table 1 is the existence of the so-called “inversion of enantioselectivity”. That is, whatever the isomer of the chiral modifier used, mainly the same ethyl lactate enantiomer was obtained. This inversion of the sense of the enantioselectivity as compared to the expected sense based on the configuration of stereogenic center of the modifier has already been observed by several authors and is usually assigned to the stereochemistry of the adsorbed intermediate complex [46]. 3.3 Theoretical calculations In order to explain the experimental results, a series of computer calculations were performed. First, it was considered that the proton has a key role in the modifier–substract interactions as it is involved in the hydrogen bond formed between the modifier and the reactant. The proton affinity (PA) was calculated in order to get information on how feasible the protonation of each modifier is. The proton affinities calculated using Eq. (1) for the different modifiers are listed in Table 2 . As expected, proton affinities calculated for each pair of isomeric modifiers yielded the same value within the calculation error. Thus, the PA value informed in Table 2 for “1-aminoindan” corresponds to the value obtained for both (S)-(+)-1-aminoindan and (R)-(−)-1-aminoindan modifiers. Likewise, PA values listed for “cis-1-amino-2-indanol” and “1-indanol” entries in Table 2 correspond to those calculated for each pair of isomers of both modifiers. Calculations demonstrate that both 1-aminoindanes and cis-1-amino-2-indanols present a very similar proton affinity. Moreover, that value is higher than the proton affinity calculated for both 1-indanols. The difference is about 15kJ/mol. These findings indicate that the amino groups present in both aminoindanol and aminoindan are the preferred sites for protonation when compared with the OH group in indanol, in agreement with previous reports on aromatic amino-alcohols [47]. According to current understanding, a one-to-one reactant–modifier complex is the source of enantiodifferentiation in the Orito reaction. The important reactant–modifier interaction takes place via a hydrogen bond between the carbonyl oxygen and proton bonded to quinuclidine nitrogen of the cinchonidine (CO⋯HN+) [25,45,48,49]. This kind of hydrogen bond between an α-ketoester and a chiral modifier was observed experimentally by attenuated total reflection IR concentration modulation spectroscopy [50]. The source of enantiodifferentiation is the interaction between the protonated chiral modifier and the substrate. In this sense, in the theoretical calculations for this type of reaction, the protonated modifier has been commonly utilized as a starting point [24]. Taking into account that the protonated modifier is mandatory for the complex formation, this difference can explain the lowest ee% obtained using both indanol molecules as chiral modifiers (Table 1 ). Hereafter, due to its low enantioselective activity, both indanols will not be taken into account in the modifier–substrate interaction calculations. The interaction between ethyl pyruvate and (S)-(+)-1-aminoindan and between ethyl pyruvate and (1S,2R)-(−)-cis-1-amino-2-indanol was examined by means of computational modeling. The selected chiral modifiers correspond in each case, to the isomer with which the higher enantiomeric excess in the hydrogenation reaction of ethyl pyruvate was obtained. As an example, Fig. 4 shows four optimized geometries for the possible complexes formed between (S)-(+)-1-aminoindan and ethyl pyruvate. The optimized geometries for all the complexes formed by the two calculated modifiers and ethyl pyruvate are available as Supplementary material. As aforementioned, although no DFT calculations on the metallic surface were performed, it is considered that both the chiral modifier and the substrate adsorb almost parallel to the surface. This is based on the assumption that the behavior of such modifiers is similar to that of cinchonidine molecules, a classical chiral modifier for this type of catalytic system. Experimental evidence from Near Edge X-Ray Absorption Fine Structure (NEXAFS) studies under ultrahigh vacuum (UHV) conditions indicates that cinchonidine molecules preferentially adsorb parallel to a Pt (111) surface [51]. The binding energies for each complex studied and the theoretically calculated ee% values, as well as the experimental ee% values, are listed in Table 3 . Regardless of the modifier used, the complexes where the substrate is in cis conformation always have a lower ΔG f than in trans conformation. This may be because when the substrate has a cis conformation, it can interact through two carbonyl oxygen atoms with the hydrogen atom of the protonated amino group. In the case of complexes formed by trans isomers, the longer distance between the oxygen atom of the substrate ester group and the amino group hydrogen atom of the modifier would generate very weak interactions compared to those of the complexes involving the substrate en the cis conformation. The calculated ee% values are very close to the experimental ones, and in all cases an excess of the R enantiomer was predicted, as was observed in the experimental tests. Moreover, all the calculated binding energies for complex formation between the (S)-(+)-1-aminoindan are greater than the ΔG f calculated for the complexes formed between the substrate and (1S,2R)-(−)-cis-1-amino-2-indanol. In order to explain the decrease in ee% when both aminoindanols were used as modifiers, the possible intramolecular hydrogen bridge bonding, hindering complex formation between the substrate and these two modifiers, was examined. Fig. 5 shows the binding lengths and angles between the oxygen atom of the hydroxyl group and its closest hydrogen atom of the protonated amino group. From the values of these calculated parameters, it follows that in both aminoindanol molecules there exist moderate to weak hydrogen bridge bonds based on Jeffrey’s classification [52]. The bond length obtained falls within the range of NH⋯O bond lengths described as characteristic of moderate strength bonds by Szatyłowicz [53]. Fig. 6 shows the most stable structures for the (1R,2S)-(+)-cis-1-amino-2-indanol and (1S,2R)-(−)-cis-1-amino-2-indanol molecules calculated from the graph of the 3D analysis of noncovalent interactions. In agreement with Zehnacker et al. [54], a bicolored isosurface, typical of intramolecular hydrogen bonding, is observed. The red isosurface, which corresponds to a negative λ2 value, between the oxygen atom and the hydrogen atom of the protonated amino group, clearly indicates the presence of intramolecular hydrogen bonding. The blue zones, with a positive λ2 value, at the center of both rings, correspond to repulsive interactions characteristic of the steric repulsions deriving from ring formation. The green isosurface represents a zone where the reduced gradient is close to zero. A zone between a hydrogen atom of the protonated amino group and another hydrogen atom bonded to an aromatic ring carbon is observed in both molecules. The zones where the reduced gradient is close to zero are characteristic of weak van der Waals interactions. The NCI analysis revealed intramolecular hydrogen bonding. Due to this intramolecular bonding, the protons of the protonated amino group, which are essential for complex formation between the chiral modifier and the substrate, become less available. This would lead to a decrease in ee% when these chiral modifiers are used. However, the R enantiomer is preferentially formed in both cases. 4 Conclusions Six new non-cinchona chiral modifiers for the enantioselective hydrogenation reaction of ethyl pyruvate were studied. They are smaller, more rigid and simpler than cinchonidine, the most efficient and widely used chiral modifier for this reaction. With the four modifiers that have a basic nitrogen atom in their structure, an enantiomeric excess (ee%) of the (R)-ethyl lactate isomer was obtained. When the chiral modifier used did not have a basic nitrogen atom in its structure, as in (S)-(+)-1-indanol and (R)-(−)-1-indanol, which is essential for the enantiodifferentiation, the ee% values were very low. Theoretical calculations indicated that the alcohol group in indanols has a smaller proton affinity than the amino groups of aminoindans and aminoindanols. This is the reason why basic nitrogen that can be protonated is required for complex formation with the substrate to be hydrogenated. With a simple model, where the metallic surface was not explicitly considered, and a low computational cost, theoretical results may accurately predict the experimental ee% values. From theoretical calculations and an NCI analysis, intramolecular hydrogen bonding was also proven. This intramolecular hydrogen bond is responsible for the decrease in ee% compared to the results arrived at when the aminoindans were used as chiral modifiers. Acknowledgements The authors thank the Consejo Nacional de Investigaciones Científicas y Técnicas (CONICET) for grant PIP 0276 and the Universidad Nacional de La Plata (Projec X700) for institutional support. Appendix A Supplementary data Supplementary data associated with this article can be found, in the online version, at http://dx.doi.org/10.1016/j.molcata.2016.07.009. Appendix A Supplementary data The following is Supplementary data to this article: References [1] S.C. Stinson Chem. Eng. News 79 2001 79 [2] A.M. Rouhi Chem. Eng. News 81 2003 45 [3] A.M. Rouhi Chem. Eng. News 82 2004 47 [4] H.U. Blaser F. Spindler M. Studer Appl. Catal. A 221 2001 119 143 [5] H.U. Blaser M. Studer Chirality 11 1999 459 464 [6] T. Osawa T. Harada O. Takayasu Top. Catal. 13 2000 155 168 [7] Y. Izumi Adv. Catal. 32 1983 215 271 [8] D.Y. Murzin P. Maki-Arvela E. Toukoniitty T. Salmi Catal. Rev. Sci. Eng. 47 2005 175 256 [9] H.U. Blaser H.-P. Jalett F. Spindler J. Mol. Catal. A: Chem. 107 1996 85 94 [10] Y. Orito S. Imai S. Niwa G.H. Nguyen Synth. Org. Chem. Jpn. 37 1979 173 174 [11] G. Szőllősi K. Balázsik I. Bucsi T. Bartók M. Bartók Catal. Comm. 32 2013 81 85 [12] C. Mondelli C. Bucher A. Baiker R. Gilmour J. Mol. Catal. A: Chem. 327 2010 87 91 [13] G. Szőllősi S. Cserényi I. Bucsi T. Bartók F. Fülöp M. Bartók App. Catal. A: Gen. 382 2010 263 271 [14] H. Pan X. Li D. Zhang Y. Guan P. Wu J. Mol. Catal. A: Chem. 377 2013 108 114 [15] C.H. Campos C. Torres J.L. García Fierro P. Reyes App. Catal. A 466 2013 198 207 [16] M.U. Azmat Guo Y. Guo Y. Guo Y. Wang G. Lu J. Mol. Catal. A: Chem 336 2011 42 50 [17] K. Balázsik M. Bartók J. Catal. 224 2004 463 472 [18] R.J. LeBlanc W. Chu C.T. Williams J. Mol. Catal. A: Chem. 212 2004 277 289 [19] D. Ferri T. Bürgi J. Am. Chem. Soc. 123 2001 12074 12084 [20] A.F. Carley M.K. Rajumon M.W. Roberts P.B. Wells J. Chem. Soc. Faraday Trans. 91 1995 2167 2172 [21] J.M. Bonello E.C.H. Sykes R. Lindsay F.J. Williams A.K. Santra R.M. Lambert Surf. Sci. 482–485 2001 207 [22] T. Bürgi F. Atamny R. Schlögl A. Baiker J. Phys. Chem. B 104 2000 5953 5960 [23] T. Bürgi F. Atamny A. Knop-Gericke M. Hävecker T. Schedel-Niedrig R. Schlögl A. Baiker Catal. Lett. 66 2000 109 112 [24] T. Bürgi A. Baiker J. Catal. 194 2000 445 451 [25] A. Baiker J. Mol. Catal. A: Chem. 163 2000 205 220 [26] J. Walkimar de M. Carneiroa C. da S.B. de Oliveira F.B. Passos D.A.G. Aranda P.R.N. de Souza O.A.C. Antunes J. Mol. Catal. A: Chem. 226 2005 221 226 [27] E. Tálas J.L. Margitfalvi Chirality 22 2010 3 15 and references cited therein [28] P. Kukula V. Matoušek T. Mallat A. Baiker Tetrahedron: Asymmetry 18 2007 2859 2868 [29] A.B. Merlo J.F. Ruggera G.F. Santori A. Moglioni G.Y. Moltrasio Iglesias M.L. Casella O.A. Ferretti Catal. Today 133–135 2008 654 660 [30] A.D. Beke J. Chem. Phys. 98 1993 1372 1377 [31] C. Lee W. Yang R.G. Parr Phys Rev. A 37 1988 785 789 [32] (b) C. Fonseca Guerra J.G. Snijders G. te Velde E.J. Baerends Theor. Chem. Acc. 99 1998 391 403 ADF2004.01, SCM, Theoretical Chemistry, Vrije Universiteit, Amsterdam, The Netherlands. Available from: http://www.scm.com. (c) G. te Velde F.M. Bickelhaupt S.J.A. van Gisbergen C. Fonseca Guerra E.J. Baerends J.G. Snijders T. Ziegler J. Comput. Chem. 22 2001 931 967 [33] C.C. Pye T. Ziegler E. van Lenthe J.N. Louwen An implementation of the conductor-like screening model of solvation within the Amsterdam density functional package. Part II. COSMO for real solvents Can. J. Chem. 87 2009 790 797 [34] E.R. Johnson S. Keinan P. Mori-Sanchez J. Contreras-Garcia A.J. Cohen W. Yang J. Am. Chem. Soc. 132 2010 6498 6505 [35] J. Contreras-Garcia W.T. Yang E.R. Johnson J. Phys. Chem. A 115 2011 12983 12990 [36] R. Chaudret B. d. Courcy J. Contreras-Garcia E. Gloaguen A. Zehnacker-Rentien M. Mons J.P. Piquemal Phys. Chem. Chem. Phys. 16 2014 9876 9891 [37] A.R. Allouche Gabedit Is a Free Graphical User Interface for Computational Chemistry Packages It is available from: http://gabedit.sourceforge.net/ [38] J.T. Wehrli A. Baiker D.M. Monti H.U. Blazer J. Mol. Catal. 61 1990 207 226 [39] E. Toukoniitty P. Mäki-Arvela A. Kalantar Neyestanaki T. Salmi A. Villela R. Leino R. Sjöholm E. Laine J. Väyrynen T. Ollonqvist Stud. Surf. Sci. Catal. 130 2000 3363 3368 [40] L.W. Ho C.P. Hwang J.F. Lee I. Wang C.T. Yeh J. Mol. Catal. A: Chem. 136 1998 293 298 [41] J.T. Wehrli A. Baiker D.M. Monti H.U. Blaser H.P. Jalett J. Mol. Catal. 57 1989 245 257 [42] U. Blaser H.P. Jalett J. Wiehl J. Mol. Catal. A: Chem. 68 1991 215 222 [43] S. Cserényi I. Bucsi K. Felföldi K. Balázsik G. Szöllösi M. Bartók J. Mol. Catal. A: Chem. 247 2006 108 115 [44] S. Cserényi I. Bucsi K. Felföldi React. Kinet. Catal. Lett. 87 2005 395 403 [45] K. Szőri K. Balázsik S. Cserényi G. Szőllősi M. Bartók Appl. Cata. A: Gen. 362 2009 178 184 [46] H.U. Blaser H.P. Jalett W. Lottenbach M. Studer J. Am. Chem. Soc. 122 2000 12675 12682 [47] G. Bouchoux J.Y. Salpin Mass Spectrom. Rev. 31 2012 353 390 [48] M. vonArx T. Mallat A. Baiker Top. Catal. 19 2002 75 87 [49] M. Studer H.-U. Blaser C. Exner Adv. Synth. Catal. 345 2003 45 65 [50] N. Bonalumi T. Burgi A. Baiker J. Am. Chem. Soc. 125 2003 13342 13343 [51] T. Evans A.P. Woodhead A. Gutiérrez-Sosa G. Thornton T.J. Hall A.A. Davis N.A. Young P.B. Wells R.J. Oldman O. Plashkevych O. Vahtras H. Ågren V. Carravetta Surf. Sci. 436 1999 L691 L696 [52] G.A. Jeffrey An Introduction to Hydrogen Bondig 1997 Oxford University Press Oxford [53] H. Szatyłowicz J. Phys. Org. Chem. 21 2008 897 914 [54] A. Bouchet J. Klyne G. Piani O. Dopfer A. Zehnacker Phys. Chem. Chem. Phys. 17 2015 25809 25821",
      "scopus-id": "84978315689",
      "coredata": {
        "eid": "1-s2.0-S138111691630259X",
        "dc:description": "The enantioselective hydrogenation of ethyl pyruvate using a Pt/SiO2 catalyst modified with six different chiral modifiers was studied. The chiral modifiers chosen were: (S)-(+)-1-aminoindan, (R)-(−)-1-aminoindan, (1R,2S)-(+)-cis-1- amino-2-indanol, (1S,2R)-(−)-cis-1-amino-2-indanol, (S)-(+)-1-indanol and (R)-(−)-1-indanol.An excess of the (R) enantiomer of the product of 63% and 45% with (S)-(+)-1-aminoindan and (R)-(−)-1-aminoindan modifiers, respectively was obtained. When using (1S,2R)-(−)-cis-1-amino-2-indanol and (1R,2S)-(+)-cis-1-amino-2-indanol, the enantiomeric excess (ee%) obtained was 30% and 5%, respectively, while with both indanols ee% did not exceed 8%. Molecular modeling of the complex formed between the chiral modifier and ethyl pyruvate performed by DFT calculations allowed predicting the values of ee% obtained experimentally. The low ee% value obtained both aminoindanol chiral modifiers were used, could be explained by the analysis of non-covalent interactions (NCI) method. These calculations demonstrated the presence of an intramolecular hydrogen bond in the structure of these modifiers.",
        "openArchiveArticle": "false",
        "prism:coverDate": "2016-11-30",
        "openaccessUserLicense": null,
        "prism:aggregationType": "Journal",
        "prism:url": "https://api.elsevier.com/content/article/pii/S138111691630259X",
        "dc:creator": [
          {
            "@_fa": "true",
            "$": "Ruggera, José F."
          },
          {
            "@_fa": "true",
            "$": "Merlo, Andrea B."
          },
          {
            "@_fa": "true",
            "$": "Diez, Reinaldo Pis"
          },
          {
            "@_fa": "true",
            "$": "Casella, Mónica L."
          }
        ],
        "link": [
          {
            "@_fa": "true",
            "@rel": "self",
            "@href": "https://api.elsevier.com/content/article/pii/S138111691630259X"
          },
          {
            "@_fa": "true",
            "@rel": "scidir",
            "@href": "https://www.sciencedirect.com/science/article/pii/S138111691630259X"
          }
        ],
        "dc:format": "application/json",
        "openaccessType": null,
        "pii": "S1381-1169(16)30259-X",
        "prism:volume": "423",
        "prism:publisher": "Elsevier B.V.",
        "dc:title": "Experimental and theoretical investigation of the enantioselective hydrogenation of ethyl pyruvate with a Pt catalyst with new non-cinchona chiral modifiers",
        "prism:copyright": "© 2016 Elsevier B.V. All rights reserved.",
        "openaccess": "0",
        "prism:issn": "13811169",
        "dcterms:subject": [
          {
            "@_fa": "true",
            "$": "Enantioselectivity"
          },
          {
            "@_fa": "true",
            "$": "Ethyl pyruvate"
          },
          {
            "@_fa": "true",
            "$": "Non-cinchona modifiers"
          },
          {
            "@_fa": "true",
            "$": "DFT"
          },
          {
            "@_fa": "true",
            "$": "Platinum"
          }
        ],
        "openaccessArticle": "false",
        "prism:publicationName": "Journal of Molecular Catalysis A: Chemical",
        "openaccessSponsorType": null,
        "prism:pageRange": "233-239",
        "prism:endingPage": "239",
        "pubType": "fla",
        "prism:coverDisplayDate": "November 2016",
        "prism:doi": "10.1016/j.molcata.2016.07.009",
        "prism:startingPage": "233",
        "dc:identifier": "doi:10.1016/j.molcata.2016.07.009",
        "openaccessSponsorName": null
      },
      "objects": {
        "object": [
          {
            "@category": "thumbnail",
            "@height": "88",
            "@width": "219",
            "@_fa": "true",
            "$": "https://api.elsevier.com/content/object/eid/1-s2.0-S138111691630259X-fx1.sml?httpAccept=%2A%2F%2A",
            "@multimediatype": "GIF image file",
            "@type": "IMAGE-THUMBNAIL",
            "@size": "12125",
            "@ref": "fx1",
            "@mimetype": "image/gif"
          },
          {
            "@category": "thumbnail",
            "@height": "38",
            "@width": "219",
            "@_fa": "true",
            "$": "https://api.elsevier.com/content/object/eid/1-s2.0-S138111691630259X-gr1.sml?httpAccept=%2A%2F%2A",
            "@multimediatype": "GIF image file",
            "@type": "IMAGE-THUMBNAIL",
            "@size": "2340",
            "@ref": "gr1",
            "@mimetype": "image/gif"
          },
          {
            "@category": "thumbnail",
            "@height": "151",
            "@width": "219",
            "@_fa": "true",
            "$": "https://api.elsevier.com/content/object/eid/1-s2.0-S138111691630259X-gr2.sml?httpAccept=%2A%2F%2A",
            "@multimediatype": "GIF image file",
            "@type": "IMAGE-THUMBNAIL",
            "@size": "19810",
            "@ref": "gr2",
            "@mimetype": "image/gif"
          },
          {
            "@category": "thumbnail",
            "@height": "164",
            "@width": "218",
            "@_fa": "true",
            "$": "https://api.elsevier.com/content/object/eid/1-s2.0-S138111691630259X-gr3.sml?httpAccept=%2A%2F%2A",
            "@multimediatype": "GIF image file",
            "@type": "IMAGE-THUMBNAIL",
            "@size": "6077",
            "@ref": "gr3",
            "@mimetype": "image/gif"
          },
          {
            "@category": "thumbnail",
            "@height": "164",
            "@width": "201",
            "@_fa": "true",
            "$": "https://api.elsevier.com/content/object/eid/1-s2.0-S138111691630259X-gr4.sml?httpAccept=%2A%2F%2A",
            "@multimediatype": "GIF image file",
            "@type": "IMAGE-THUMBNAIL",
            "@size": "6682",
            "@ref": "gr4",
            "@mimetype": "image/gif"
          },
          {
            "@category": "thumbnail",
            "@height": "109",
            "@width": "219",
            "@_fa": "true",
            "$": "https://api.elsevier.com/content/object/eid/1-s2.0-S138111691630259X-gr5.sml?httpAccept=%2A%2F%2A",
            "@multimediatype": "GIF image file",
            "@type": "IMAGE-THUMBNAIL",
            "@size": "7198",
            "@ref": "gr5",
            "@mimetype": "image/gif"
          },
          {
            "@category": "thumbnail",
            "@height": "79",
            "@width": "219",
            "@_fa": "true",
            "$": "https://api.elsevier.com/content/object/eid/1-s2.0-S138111691630259X-gr6.sml?httpAccept=%2A%2F%2A",
            "@multimediatype": "GIF image file",
            "@type": "IMAGE-THUMBNAIL",
            "@size": "6710",
            "@ref": "gr6",
            "@mimetype": "image/gif"
          },
          {
            "@category": "thumbnail",
            "@height": "164",
            "@width": "165",
            "@_fa": "true",
            "$": "https://api.elsevier.com/content/object/eid/1-s2.0-S138111691630259X-sc1.sml?httpAccept=%2A%2F%2A",
            "@multimediatype": "GIF image file",
            "@type": "IMAGE-THUMBNAIL",
            "@size": "4467",
            "@ref": "sc1",
            "@mimetype": "image/gif"
          },
          {
            "@category": "standard",
            "@height": "200",
            "@width": "500",
            "@_fa": "true",
            "$": "https://api.elsevier.com/content/object/eid/1-s2.0-S138111691630259X-fx1.jpg?httpAccept=%2A%2F%2A",
            "@multimediatype": "JPEG image file",
            "@type": "IMAGE-DOWNSAMPLED",
            "@size": "27284",
            "@ref": "fx1",
            "@mimetype": "image/jpeg"
          },
          {
            "@category": "standard",
            "@height": "85",
            "@width": "489",
            "@_fa": "true",
            "$": "https://api.elsevier.com/content/object/eid/1-s2.0-S138111691630259X-gr1.jpg?httpAccept=%2A%2F%2A",
            "@multimediatype": "JPEG image file",
            "@type": "IMAGE-DOWNSAMPLED",
            "@size": "9073",
            "@ref": "gr1",
            "@mimetype": "image/jpeg"
          },
          {
            "@category": "standard",
            "@height": "258",
            "@width": "376",
            "@_fa": "true",
            "$": "https://api.elsevier.com/content/object/eid/1-s2.0-S138111691630259X-gr2.jpg?httpAccept=%2A%2F%2A",
            "@multimediatype": "JPEG image file",
            "@type": "IMAGE-DOWNSAMPLED",
            "@size": "28069",
            "@ref": "gr2",
            "@mimetype": "image/jpeg"
          },
          {
            "@category": "standard",
            "@height": "226",
            "@width": "301",
            "@_fa": "true",
            "$": "https://api.elsevier.com/content/object/eid/1-s2.0-S138111691630259X-gr3.jpg?httpAccept=%2A%2F%2A",
            "@multimediatype": "JPEG image file",
            "@type": "IMAGE-DOWNSAMPLED",
            "@size": "14018",
            "@ref": "gr3",
            "@mimetype": "image/jpeg"
          },
          {
            "@category": "standard",
            "@height": "461",
            "@width": "565",
            "@_fa": "true",
            "$": "https://api.elsevier.com/content/object/eid/1-s2.0-S138111691630259X-gr4.jpg?httpAccept=%2A%2F%2A",
            "@multimediatype": "JPEG image file",
            "@type": "IMAGE-DOWNSAMPLED",
            "@size": "35847",
            "@ref": "gr4",
            "@mimetype": "image/jpeg"
          },
          {
            "@category": "standard",
            "@height": "281",
            "@width": "565",
            "@_fa": "true",
            "$": "https://api.elsevier.com/content/object/eid/1-s2.0-S138111691630259X-gr5.jpg?httpAccept=%2A%2F%2A",
            "@multimediatype": "JPEG image file",
            "@type": "IMAGE-DOWNSAMPLED",
            "@size": "32939",
            "@ref": "gr5",
            "@mimetype": "image/jpeg"
          },
          {
            "@category": "standard",
            "@height": "204",
            "@width": "565",
            "@_fa": "true",
            "$": "https://api.elsevier.com/content/object/eid/1-s2.0-S138111691630259X-gr6.jpg?httpAccept=%2A%2F%2A",
            "@multimediatype": "JPEG image file",
            "@type": "IMAGE-DOWNSAMPLED",
            "@size": "26703",
            "@ref": "gr6",
            "@mimetype": "image/jpeg"
          },
          {
            "@category": "standard",
            "@height": "372",
            "@width": "374",
            "@_fa": "true",
            "$": "https://api.elsevier.com/content/object/eid/1-s2.0-S138111691630259X-sc1.jpg?httpAccept=%2A%2F%2A",
            "@multimediatype": "JPEG image file",
            "@type": "IMAGE-DOWNSAMPLED",
            "@size": "22507",
            "@ref": "sc1",
            "@mimetype": "image/jpeg"
          },
          {
            "@category": "high",
            "@height": "886",
            "@width": "2213",
            "@_fa": "true",
            "$": "https://api.elsevier.com/content/object/eid/1-s2.0-S138111691630259X-fx1_lrg.jpg?httpAccept=%2A%2F%2A",
            "@multimediatype": "JPEG image file",
            "@type": "IMAGE-HIGH-RES",
            "@size": "196584",
            "@ref": "fx1",
            "@mimetype": "image/jpeg"
          },
          {
            "@category": "high",
            "@height": "375",
            "@width": "2167",
            "@_fa": "true",
            "$": "https://api.elsevier.com/content/object/eid/1-s2.0-S138111691630259X-gr1_lrg.jpg?httpAccept=%2A%2F%2A",
            "@multimediatype": "JPEG image file",
            "@type": "IMAGE-HIGH-RES",
            "@size": "66491",
            "@ref": "gr1",
            "@mimetype": "image/jpeg"
          },
          {
            "@category": "high",
            "@height": "1146",
            "@width": "1667",
            "@_fa": "true",
            "$": "https://api.elsevier.com/content/object/eid/1-s2.0-S138111691630259X-gr2_lrg.jpg?httpAccept=%2A%2F%2A",
            "@multimediatype": "JPEG image file",
            "@type": "IMAGE-HIGH-RES",
            "@size": "419810",
            "@ref": "gr2",
            "@mimetype": "image/jpeg"
          },
          {
            "@category": "high",
            "@height": "1003",
            "@width": "1333",
            "@_fa": "true",
            "$": "https://api.elsevier.com/content/object/eid/1-s2.0-S138111691630259X-gr3_lrg.jpg?httpAccept=%2A%2F%2A",
            "@multimediatype": "JPEG image file",
            "@type": "IMAGE-HIGH-RES",
            "@size": "110144",
            "@ref": "gr3",
            "@mimetype": "image/jpeg"
          },
          {
            "@category": "high",
            "@height": "2042",
            "@width": "2500",
            "@_fa": "true",
            "$": "https://api.elsevier.com/content/object/eid/1-s2.0-S138111691630259X-gr4_lrg.jpg?httpAccept=%2A%2F%2A",
            "@multimediatype": "JPEG image file",
            "@type": "IMAGE-HIGH-RES",
            "@size": "284494",
            "@ref": "gr4",
            "@mimetype": "image/jpeg"
          },
          {
            "@category": "high",
            "@height": "1243",
            "@width": "2500",
            "@_fa": "true",
            "$": "https://api.elsevier.com/content/object/eid/1-s2.0-S138111691630259X-gr5_lrg.jpg?httpAccept=%2A%2F%2A",
            "@multimediatype": "JPEG image file",
            "@type": "IMAGE-HIGH-RES",
            "@size": "264576",
            "@ref": "gr5",
            "@mimetype": "image/jpeg"
          },
          {
            "@category": "high",
            "@height": "903",
            "@width": "2500",
            "@_fa": "true",
            "$": "https://api.elsevier.com/content/object/eid/1-s2.0-S138111691630259X-gr6_lrg.jpg?httpAccept=%2A%2F%2A",
            "@multimediatype": "JPEG image file",
            "@type": "IMAGE-HIGH-RES",
            "@size": "219857",
            "@ref": "gr6",
            "@mimetype": "image/jpeg"
          },
          {
            "@category": "high",
            "@height": "1647",
            "@width": "1655",
            "@_fa": "true",
            "$": "https://api.elsevier.com/content/object/eid/1-s2.0-S138111691630259X-sc1_lrg.jpg?httpAccept=%2A%2F%2A",
            "@multimediatype": "JPEG image file",
            "@type": "IMAGE-HIGH-RES",
            "@size": "174215",
            "@ref": "sc1",
            "@mimetype": "image/jpeg"
          },
          {
            "@category": "standard",
            "@_fa": "true",
            "$": "https://api.elsevier.com/content/object/eid/1-s2.0-S138111691630259X-mmc1.pdf?httpAccept=%2A%2F%2A",
            "@multimediatype": "Acrobat PDF file",
            "@type": "APPLICATION",
            "@size": "315594",
            "@ref": "mmc1",
            "@mimetype": "application/pdf"
          },
          {
            "@category": "thumbnail",
            "@height": "40",
            "@width": "78",
            "@_fa": "true",
            "$": "https://api.elsevier.com/content/object/eid/1-s2.0-S138111691630259X-si1.gif?httpAccept=%2A%2F%2A",
            "@multimediatype": "GIF image file",
            "@type": "ALTIMG",
            "@size": "611",
            "@ref": "si1",
            "@mimetype": "image/gif"
          },
          {
            "@category": "thumbnail",
            "@height": "35",
            "@width": "160",
            "@_fa": "true",
            "$": "https://api.elsevier.com/content/object/eid/1-s2.0-S138111691630259X-si2.gif?httpAccept=%2A%2F%2A",
            "@multimediatype": "GIF image file",
            "@type": "ALTIMG",
            "@size": "821",
            "@ref": "si2",
            "@mimetype": "image/gif"
          },
          {
            "@category": "thumbnail",
            "@height": "16",
            "@width": "227",
            "@_fa": "true",
            "$": "https://api.elsevier.com/content/object/eid/1-s2.0-S138111691630259X-si3.gif?httpAccept=%2A%2F%2A",
            "@multimediatype": "GIF image file",
            "@type": "ALTIMG",
            "@size": "735",
            "@ref": "si3",
            "@mimetype": "image/gif"
          },
          {
            "@category": "thumbnail",
            "@height": "16",
            "@width": "244",
            "@_fa": "true",
            "$": "https://api.elsevier.com/content/object/eid/1-s2.0-S138111691630259X-si4.gif?httpAccept=%2A%2F%2A",
            "@multimediatype": "GIF image file",
            "@type": "ALTIMG",
            "@size": "745",
            "@ref": "si4",
            "@mimetype": "image/gif"
          },
          {
            "@category": "thumbnail",
            "@height": "55",
            "@width": "132",
            "@_fa": "true",
            "$": "https://api.elsevier.com/content/object/eid/1-s2.0-S138111691630259X-si5.gif?httpAccept=%2A%2F%2A",
            "@multimediatype": "GIF image file",
            "@type": "ALTIMG",
            "@size": "791",
            "@ref": "si5",
            "@mimetype": "image/gif"
          }
        ]
      },
      "link": {
        "@rel": "abstract",
        "@href": "https://api.elsevier.com/content/abstract/scopus_id/84978315689"
      }
    }
  }
}