{
  "metadata": {
    "title": "Peroxomolybdate supported on water soluble polymers as efficient catalysts for green and selective sulfoxidation in aqueous medium",
    "authors": "; ; ",
    "journal": "Journal of Molecular Catalysis A: Chemical",
    "date": "2016-12-15",
    "doi": "10.1016/j.molcata.2016.09.026",
    "abstract": "",
    "uri": "https://api.elsevier.com/content/article/pii/S1381116916303983",
    "pii": "S1381116916303983"
  },
  "fulltext": {
    "full-text-retrieval-response": {
      "scopus-eid": "2-s2.0-84988531200",
      "originalText": "serial JL 271358 291210 291744 291790 291809 31 Journal of Molecular Catalysis A: Chemical JOURNALMOLECULARCATALYSISACHEMICAL 2016-09-16 2016-09-16 2016-09-22 2016-09-22 2019-10-28T13:34:12 1-s2.0-S1381116916303983 S1381-1169(16)30398-3 S1381116916303983 10.1016/j.molcata.2016.09.026 S300 S300.2 FULL-TEXT 1-s2.0-S1381116916X00118 2019-10-30T00:38:56.048209Z 0 0 20161215 2016 2016-09-16T22:31:26.252098Z absattachment articleinfo articletitlenorm authfirstinitialnorm authfirstsurnamenorm cid cids contenttype copyright crossmark dateloaded dateloadedtxt datesearch datesort dateupdated dco docsubtype doctype doi eid ewtransactionid hubeid indexeddate issn issnnorm itemstage itemtransactionid itemweight openaccess openarchive pg pgfirst pglast pii piinorm pubdatestart pubdatetxt pubyr sectiontitle sortorder srctitle srctitlenorm srctype ssids alllist content subj subheadings suppl tomb volfirst volissue volumelist webpdf webpdfpagecount yearnav figure table e-component body acknowledge affil appendices articletitle auth authfirstini authfull authkeywords authlast footnotes grantsponsor highlightsabst primabst ref specialabst 1381-1169 13811169 true 425 425 C Volume 425 5 21 30 21 30 20161215 15 December 2016 2016-12-15 2016 Regular Papers article fla © 2016 Elsevier B.V. All rights reserved. PEROXOMOLYBDATESUPPORTEDWATERSOLUBLEPOLYMERSEFFICIENTCATALYSTSFORGREENSELECTIVESULFOXIDATIONINAQUEOUSMEDIUM BORUAH J 1 Introduction 2 Results and discussion 2.1 Catalyst preparation and characterization 2.1.1 SEM and energy dispersive X-ray (EDX) analysis 2.1.2 IR, Raman and electronic spectral studies 2.1.3 13C and 95Mo NMR 2.1.4 Thermal analysis 2.2 Catalytic activity of the supported complexes, PSMo and PAMo 2.2.1 Oxidation of sulfides to sulfoxides 2.2.2 Recyclability of the catalyst 2.2.3 The proposed catalytic cycle 3 Experimental 3.1 Materials and methods 3.2 Synthesis of [MoO(O2)2(sulfonate)]–PS [PS=poly(sodium vinyl sulfonate)] (PSMo) 3.3 General procedure for catalytic oxidation of sulfides to sulfoxides 3.4 Procedure for regeneration of the catalyst 4 Conclusions Acknowledgements Appendix A Supplementary data References CARON 2006 2943 2989 S TANAKA 1997 17 21 M COTTON 2000 3819 3825 H HOLLAND 1988 473 485 H FERNANDEZ 2003 3651 3706 I PATAI 1994 S SYNTHESISSULFONESSULFOXIDESCYCLICSULFIDES CARRENO 1995 1717 1760 M BENTLEY 2005 609 624 R LEGROS 2005 19 31 J DING 2011 1210 1216 Y LI 2009 1354 1357 H ZHU 2011 8 14 W MAURYA 2010 6586 6600 M HULEA 2001 179 186 V CHOUDARY 2002 2069 2074 B SATO 2001 2469 2476 K BORUAH 2013 2944 2959 J GOGOI 2015 595 610 S DAS 2012 36 45 S DAS 2012 1163 1168 S DOHERTY 2015 1559 1571 S CHAKRAVARTHY 2014 2190 2196 R KARIMI 2005 625 628 B AMINI 2013 1093 1121 M KOO 2005 5015 5018 D STRUKUL 2013 1 20 G ENVIRONMENTALLYBENIGNOXIDANTSINLIQUIDPHASEOXIDATIONVIAHETEROGENEOUSCATALYSIS NOYORI 2003 1977 1986 R LANE 2003 2457 2474 B JONES 1999 C APPLICATIONSHYDROGENPEROXIDEDERIVATIVES GOMEZ 2007 331 336 M STRUKUL 1992 G CATALYTICOXIDATIONSHYDROGENPEROXIDEOXIDANT KARMEE 2010 6705 6707 S GREGORI 2008 124 127 F CONTE 2011 1419 1436 V HUSSAIN 2012 6512 6515 S RAJABI 2011 2060 2066 F BAGHERZADEH 2008 196 200 M EGAMI 2007 8940 8941 H YANG 2009 1401 1405 C SHEIKHSHOAIE 2009 733 738 I ROMANELLI 2011 726 730 G BORUAH 2013 246 254 J KAMATA 2009 3958 3960 K SATO 2001 2469 2476 K HULEA 2006 200 207 V PRASANTH 2007 45 49 K RIDEOUT 1980 7816 7817 D LINDSTROM 2007 U ORGANICREACTIONSINWATER LI 2006 68 82 C LINDSTROM 2002 2751 2772 U SIMON 2012 1415 1427 M NARAYAN 2005 3275 3279 S SHI 2008 142 147 X HERRMANN 1997 1049 1067 W ZENG 2011 973 977 X YU 2014 1818 1821 B IMADA 2013 621 624 Y GRESLEY 1997 185 198 N KALITA 2008 876 890 D FUERTE 2004 227 235 A DICKMAN 1994 569 584 M TAMAMI 1999 1445 1450 B GHIRON 1989 3647 3650 A MIMOUN 1987 281 295 H YAMADA 2004 4087 4096 Y TWAITES 2004 551 566 B MURTHY 2003 365 374 N PUSTAM 2010 545 554 A OKHAPKIN 2006 177 210 I ISLAM 2015 777 795 N MERRIFIELD 1985 799 810 R LETSINGER 1966 2062 2063 I BERGBREITER 2002 3345 3384 D POMOGAILO 1998 A CATALYSISBYPOLYMERIMMOBILISEDMETALCOMPLEXES WOHRLE 2005 666 742 D HANDBOOKPOLYMERSYNTHESIS BORUAH 2011 8046 8062 J DAS 2012 7248 7261 S MCLAUCHLAN 2015 163 199 C RIVAS 2011 294 322 B KADAJJI 2011 1972 2009 V RIVAS 2002 2546 2551 B POURJAVADI 2007 1388 1395 A FENG 1996 3909 3917 Y SILVERSTEIN 1991 R SPECTROMETRICIDENTIFICATIONORGANICCOMPOUNDS WAHED 1995 117 122 M CRISTOVAN 2006 514 520 F CRISTOVAN 1989 1379 1386 N LEVER 1978 348 355 A DENGEL 1987 991 995 A FAN 2013 1153 1161 Y EDWARDS 2001 111 125 H KAR 2016 176 186 P DJORDJEVIC 1997 1798 1805 C NARDELLO 1995 4950 4957 V JIANG 1999 423 434 D MAITI 2005 554 563 S PATONAY 2001 2275 2280 T BACIOCCHI 2004 3586 3589 E KHOLDEEVA 2013 1595 1605 O SCHULTZ 1963 1140 1142 H BORTOLINI 1985 2688 2690 O BONCHIO 1995 4475 4480 M MACIUCA 2008 33 37 A GRAVERT 1997 489 509 D JOERGENSEN 1989 431 458 K THIEL 1997 696 705 W BASSETT 1978 472 473 J VOGELSTEXTBOOKQUANTITATIVEINORGANICANALYSISINCLUDINGELEMENTARYINSTRUMENTALANALYSIS BORUAHX2016X21 BORUAHX2016X21X30 BORUAHX2016X21XJ BORUAHX2016X21X30XJ 2018-09-22T00:00:00.000Z http://creativecommons.org/licenses/by-nc-nd/4.0/ © 2016 Elsevier B.V. All rights reserved. 2019-03-29T16:56:10.617Z http://vtw.elsevier.com/data/voc/AddOnTypes/50.7/nlp S1381116916303983 Department of Science and Technology Department of Science and Technology, Ministry of Science and Technology http://data.elsevier.com/vocabulary/SciValFunders/501100001409 http://sws.geonames.org/1269750/ University Grants Commission University Grants Commission http://data.elsevier.com/vocabulary/SciValFunders/501100001501 http://sws.geonames.org/1269750/ The authors gratefully acknowledge the Department of Science and Technology, New Delhi, India , for providing financial support. We are also grateful to the University Grants Commission, New Delhi, for providing Moulana Azad National Fellowship to K.A. Notes and references Appendix A item S1381-1169(16)30398-3 S1381116916303983 1-s2.0-S1381116916303983 10.1016/j.molcata.2016.09.026 271358 2019-10-30T00:38:56.048209Z 2016-12-15 1-s2.0-S1381116916303983-main.pdf https://s3.amazonaws.com/prod-ucs-content-store-us-east/content/pii:S1381116916303983/MAIN/application/pdf/341246044ea5811eb0ee3f9a17a2d137/main.pdf main.pdf pdf true 1733792 MAIN 10 1-s2.0-S1381116916303983-main_1.png https://s3.amazonaws.com/prod-ucs-content-store-us-east/content/pii:S1381116916303983/PREVIEW/image/png/bc0bdbb93a86fe540810c92c386a12a2/main_1.png main_1.png png 57515 849 656 IMAGE-WEB-PDF 1 1-s2.0-S1381116916303983-fx1.sml https://s3.amazonaws.com/prod-ucs-content-store-us-east/content/pii:S1381116916303983/fx1/THUMBNAIL/image/gif/aadc06e2f5e50ae5b53769d07a60aa8f/fx1.sml fx1 true fx1.sml sml 4577 88 219 IMAGE-THUMBNAIL 1-s2.0-S1381116916303983-fx10.sml https://s3.amazonaws.com/prod-ucs-content-store-us-east/content/pii:S1381116916303983/fx10/THUMBNAIL/image/gif/5220ae704d5f69fe1eb71b4a59dd4df9/fx10.sml fx10 fx10.sml sml 3231 88 219 IMAGE-THUMBNAIL 1-s2.0-S1381116916303983-fx11.sml https://s3.amazonaws.com/prod-ucs-content-store-us-east/content/pii:S1381116916303983/fx11/THUMBNAIL/image/gif/f7372e1db98b7164cb0a6de150837d22/fx11.sml fx11 fx11.sml sml 3148 88 219 IMAGE-THUMBNAIL 1-s2.0-S1381116916303983-fx12.sml https://s3.amazonaws.com/prod-ucs-content-store-us-east/content/pii:S1381116916303983/fx12/THUMBNAIL/image/gif/a776e0015f6b1e13a22badece1f453d3/fx12.sml fx12 fx12.sml sml 3729 88 219 IMAGE-THUMBNAIL 1-s2.0-S1381116916303983-fx13.sml https://s3.amazonaws.com/prod-ucs-content-store-us-east/content/pii:S1381116916303983/fx13/THUMBNAIL/image/gif/d9c5b6d56454d17e8fb32cb5690b65fd/fx13.sml fx13 fx13.sml sml 3635 88 219 IMAGE-THUMBNAIL 1-s2.0-S1381116916303983-fx14.sml https://s3.amazonaws.com/prod-ucs-content-store-us-east/content/pii:S1381116916303983/fx14/THUMBNAIL/image/gif/2ef08fb6cb50d167170971a02f97e9c2/fx14.sml fx14 fx14.sml sml 3150 88 219 IMAGE-THUMBNAIL 1-s2.0-S1381116916303983-fx15.sml https://s3.amazonaws.com/prod-ucs-content-store-us-east/content/pii:S1381116916303983/fx15/THUMBNAIL/image/gif/7108a217ebe28b39b1030724a22b0d8f/fx15.sml fx15 fx15.sml sml 4419 88 219 IMAGE-THUMBNAIL 1-s2.0-S1381116916303983-fx16.sml https://s3.amazonaws.com/prod-ucs-content-store-us-east/content/pii:S1381116916303983/fx16/THUMBNAIL/image/gif/eca0ccabdcd409ed133f922623c483c4/fx16.sml fx16 fx16.sml sml 3963 88 219 IMAGE-THUMBNAIL 1-s2.0-S1381116916303983-fx17.sml https://s3.amazonaws.com/prod-ucs-content-store-us-east/content/pii:S1381116916303983/fx17/THUMBNAIL/image/gif/8360ad5e8e2e9b66454f69bd7eed6206/fx17.sml fx17 fx17.sml sml 3424 88 219 IMAGE-THUMBNAIL 1-s2.0-S1381116916303983-fx2.sml https://s3.amazonaws.com/prod-ucs-content-store-us-east/content/pii:S1381116916303983/fx2/THUMBNAIL/image/gif/8883139f7f4e3b0e5ea2e280282c6dfe/fx2.sml fx2 fx2.sml sml 4590 88 219 IMAGE-THUMBNAIL 1-s2.0-S1381116916303983-fx3.sml https://s3.amazonaws.com/prod-ucs-content-store-us-east/content/pii:S1381116916303983/fx3/THUMBNAIL/image/gif/c74fb317dcfd1eb1d94e0f6220b16258/fx3.sml fx3 fx3.sml sml 3988 88 219 IMAGE-THUMBNAIL 1-s2.0-S1381116916303983-fx4.sml https://s3.amazonaws.com/prod-ucs-content-store-us-east/content/pii:S1381116916303983/fx4/THUMBNAIL/image/gif/0e31141eeff277e481c92c0445455a41/fx4.sml fx4 fx4.sml sml 2207 88 219 IMAGE-THUMBNAIL 1-s2.0-S1381116916303983-fx5.sml https://s3.amazonaws.com/prod-ucs-content-store-us-east/content/pii:S1381116916303983/fx5/THUMBNAIL/image/gif/84c1ba5d3707b00f1b783f6902595da5/fx5.sml fx5 fx5.sml sml 2520 88 219 IMAGE-THUMBNAIL 1-s2.0-S1381116916303983-fx6.sml https://s3.amazonaws.com/prod-ucs-content-store-us-east/content/pii:S1381116916303983/fx6/THUMBNAIL/image/gif/f4ad6795b323114530e93964584dbd7b/fx6.sml fx6 fx6.sml sml 3362 88 219 IMAGE-THUMBNAIL 1-s2.0-S1381116916303983-fx7.sml https://s3.amazonaws.com/prod-ucs-content-store-us-east/content/pii:S1381116916303983/fx7/THUMBNAIL/image/gif/007d4acc26d6d3d491b64d1727d738be/fx7.sml fx7 fx7.sml sml 3466 88 219 IMAGE-THUMBNAIL 1-s2.0-S1381116916303983-fx8.sml https://s3.amazonaws.com/prod-ucs-content-store-us-east/content/pii:S1381116916303983/fx8/THUMBNAIL/image/gif/323a0d387e520b7b443c22a425556c14/fx8.sml fx8 fx8.sml sml 3216 88 219 IMAGE-THUMBNAIL 1-s2.0-S1381116916303983-fx9.sml https://s3.amazonaws.com/prod-ucs-content-store-us-east/content/pii:S1381116916303983/fx9/THUMBNAIL/image/gif/ca3e41924dc572a788161c3dcd469ba3/fx9.sml fx9 fx9.sml sml 3058 88 219 IMAGE-THUMBNAIL 1-s2.0-S1381116916303983-gr1.sml https://s3.amazonaws.com/prod-ucs-content-store-us-east/content/pii:S1381116916303983/gr1/THUMBNAIL/image/gif/600d00e1de8444176eaee85ee32b6298/gr1.sml gr1 gr1.sml sml 12792 164 200 IMAGE-THUMBNAIL 1-s2.0-S1381116916303983-gr2.sml https://s3.amazonaws.com/prod-ucs-content-store-us-east/content/pii:S1381116916303983/gr2/THUMBNAIL/image/gif/7c0627cb7de0adb0136bb37f6b38ad4c/gr2.sml gr2 gr2.sml sml 4312 164 144 IMAGE-THUMBNAIL 1-s2.0-S1381116916303983-gr3.sml https://s3.amazonaws.com/prod-ucs-content-store-us-east/content/pii:S1381116916303983/gr3/THUMBNAIL/image/gif/6c431c108c193fd5afd140d76b0efda8/gr3.sml gr3 gr3.sml sml 3997 136 219 IMAGE-THUMBNAIL 1-s2.0-S1381116916303983-gr4.sml https://s3.amazonaws.com/prod-ucs-content-store-us-east/content/pii:S1381116916303983/gr4/THUMBNAIL/image/gif/7bcab420d98bd371821b1bf2c5b0537a/gr4.sml gr4 gr4.sml sml 3978 96 219 IMAGE-THUMBNAIL 1-s2.0-S1381116916303983-gr5.sml https://s3.amazonaws.com/prod-ucs-content-store-us-east/content/pii:S1381116916303983/gr5/THUMBNAIL/image/gif/28b5cf102ccc2f85afca7c32835761df/gr5.sml gr5 gr5.sml sml 4851 131 219 IMAGE-THUMBNAIL 1-s2.0-S1381116916303983-gr6.sml https://s3.amazonaws.com/prod-ucs-content-store-us-east/content/pii:S1381116916303983/gr6/THUMBNAIL/image/gif/82538c02d8edc5f985681ed8bdb9c53a/gr6.sml gr6 gr6.sml sml 3818 164 136 IMAGE-THUMBNAIL 1-s2.0-S1381116916303983-gr7.sml https://s3.amazonaws.com/prod-ucs-content-store-us-east/content/pii:S1381116916303983/gr7/THUMBNAIL/image/gif/34b46d16f9b9ccf109e5d10ac6687555/gr7.sml gr7 gr7.sml sml 11753 124 219 IMAGE-THUMBNAIL 1-s2.0-S1381116916303983-gr8.sml https://s3.amazonaws.com/prod-ucs-content-store-us-east/content/pii:S1381116916303983/gr8/THUMBNAIL/image/gif/edaf86f6fb653c81191aab2485edb062/gr8.sml gr8 gr8.sml sml 5087 134 219 IMAGE-THUMBNAIL 1-s2.0-S1381116916303983-sc1.sml https://s3.amazonaws.com/prod-ucs-content-store-us-east/content/pii:S1381116916303983/sc1/THUMBNAIL/image/gif/8bfa2f873d1786841585dbcfa74e2725/sc1.sml sc1 sc1.sml sml 3211 93 219 IMAGE-THUMBNAIL 1-s2.0-S1381116916303983-fx1.jpg https://s3.amazonaws.com/prod-ucs-content-store-us-east/content/pii:S1381116916303983/fx1/DOWNSAMPLED/image/jpeg/49ce1767f1f38bc5c3059809970b5657/fx1.jpg fx1 true fx1.jpg jpg 18458 200 500 IMAGE-DOWNSAMPLED 1-s2.0-S1381116916303983-fx10.jpg https://s3.amazonaws.com/prod-ucs-content-store-us-east/content/pii:S1381116916303983/fx10/DOWNSAMPLED/image/jpeg/76e9c362df2e449b71ef2f2e6c92c736/fx10.jpg fx10 fx10.jpg jpg 8234 200 500 IMAGE-DOWNSAMPLED 1-s2.0-S1381116916303983-fx11.jpg https://s3.amazonaws.com/prod-ucs-content-store-us-east/content/pii:S1381116916303983/fx11/DOWNSAMPLED/image/jpeg/f2cb1b185ca79f9adc59c054661ad24b/fx11.jpg fx11 fx11.jpg jpg 8397 200 500 IMAGE-DOWNSAMPLED 1-s2.0-S1381116916303983-fx12.jpg https://s3.amazonaws.com/prod-ucs-content-store-us-east/content/pii:S1381116916303983/fx12/DOWNSAMPLED/image/jpeg/4c403793bc3eb070fc208719995a3282/fx12.jpg fx12 fx12.jpg jpg 9456 200 500 IMAGE-DOWNSAMPLED 1-s2.0-S1381116916303983-fx13.jpg https://s3.amazonaws.com/prod-ucs-content-store-us-east/content/pii:S1381116916303983/fx13/DOWNSAMPLED/image/jpeg/d22a8cb05c58a855b63fce28b6a69a60/fx13.jpg fx13 fx13.jpg jpg 9299 200 500 IMAGE-DOWNSAMPLED 1-s2.0-S1381116916303983-fx14.jpg https://s3.amazonaws.com/prod-ucs-content-store-us-east/content/pii:S1381116916303983/fx14/DOWNSAMPLED/image/jpeg/6ab88d974253165a6460077665f1952c/fx14.jpg fx14 fx14.jpg jpg 8181 200 500 IMAGE-DOWNSAMPLED 1-s2.0-S1381116916303983-fx15.jpg https://s3.amazonaws.com/prod-ucs-content-store-us-east/content/pii:S1381116916303983/fx15/DOWNSAMPLED/image/jpeg/5639871968605945a4268b793a34a619/fx15.jpg fx15 fx15.jpg jpg 12124 200 500 IMAGE-DOWNSAMPLED 1-s2.0-S1381116916303983-fx16.jpg https://s3.amazonaws.com/prod-ucs-content-store-us-east/content/pii:S1381116916303983/fx16/DOWNSAMPLED/image/jpeg/71b41395814acaed39cfa9e0d10ef9e8/fx16.jpg fx16 fx16.jpg jpg 10520 200 500 IMAGE-DOWNSAMPLED 1-s2.0-S1381116916303983-fx17.jpg https://s3.amazonaws.com/prod-ucs-content-store-us-east/content/pii:S1381116916303983/fx17/DOWNSAMPLED/image/jpeg/74792e815c9a6f4643ed88117317d1f4/fx17.jpg fx17 fx17.jpg jpg 9420 200 500 IMAGE-DOWNSAMPLED 1-s2.0-S1381116916303983-fx2.jpg https://s3.amazonaws.com/prod-ucs-content-store-us-east/content/pii:S1381116916303983/fx2/DOWNSAMPLED/image/jpeg/8d860226abc3372319489a23708358a0/fx2.jpg fx2 fx2.jpg jpg 8927 200 500 IMAGE-DOWNSAMPLED 1-s2.0-S1381116916303983-fx3.jpg https://s3.amazonaws.com/prod-ucs-content-store-us-east/content/pii:S1381116916303983/fx3/DOWNSAMPLED/image/jpeg/e99648b1669e987b8b24ac1b8fda0b78/fx3.jpg fx3 fx3.jpg jpg 8705 200 500 IMAGE-DOWNSAMPLED 1-s2.0-S1381116916303983-fx4.jpg https://s3.amazonaws.com/prod-ucs-content-store-us-east/content/pii:S1381116916303983/fx4/DOWNSAMPLED/image/jpeg/0add22029c57ec082d82e598eca286ad/fx4.jpg fx4 fx4.jpg jpg 8184 200 500 IMAGE-DOWNSAMPLED 1-s2.0-S1381116916303983-fx5.jpg https://s3.amazonaws.com/prod-ucs-content-store-us-east/content/pii:S1381116916303983/fx5/DOWNSAMPLED/image/jpeg/89696a7cab77d0fd0fe957d6509f70ae/fx5.jpg fx5 fx5.jpg jpg 9260 200 500 IMAGE-DOWNSAMPLED 1-s2.0-S1381116916303983-fx6.jpg https://s3.amazonaws.com/prod-ucs-content-store-us-east/content/pii:S1381116916303983/fx6/DOWNSAMPLED/image/jpeg/7848d9e79a8cc2c95a6f398639ac9f6f/fx6.jpg fx6 fx6.jpg jpg 7803 200 500 IMAGE-DOWNSAMPLED 1-s2.0-S1381116916303983-fx7.jpg https://s3.amazonaws.com/prod-ucs-content-store-us-east/content/pii:S1381116916303983/fx7/DOWNSAMPLED/image/jpeg/e902499676c449b709449a673e973b3f/fx7.jpg fx7 fx7.jpg jpg 7382 200 500 IMAGE-DOWNSAMPLED 1-s2.0-S1381116916303983-fx8.jpg https://s3.amazonaws.com/prod-ucs-content-store-us-east/content/pii:S1381116916303983/fx8/DOWNSAMPLED/image/jpeg/85196b809e1fb01e1fcd56eada3dc013/fx8.jpg fx8 fx8.jpg jpg 7732 200 500 IMAGE-DOWNSAMPLED 1-s2.0-S1381116916303983-fx9.jpg https://s3.amazonaws.com/prod-ucs-content-store-us-east/content/pii:S1381116916303983/fx9/DOWNSAMPLED/image/jpeg/c80fb7d5969290fc96616106f0a9d3bd/fx9.jpg fx9 fx9.jpg jpg 8357 200 500 IMAGE-DOWNSAMPLED 1-s2.0-S1381116916303983-gr1.jpg https://s3.amazonaws.com/prod-ucs-content-store-us-east/content/pii:S1381116916303983/gr1/DOWNSAMPLED/image/jpeg/85a005b89a673ad644a06b54c109e0ee/gr1.jpg gr1 gr1.jpg jpg 43696 463 565 IMAGE-DOWNSAMPLED 1-s2.0-S1381116916303983-gr2.jpg https://s3.amazonaws.com/prod-ucs-content-store-us-east/content/pii:S1381116916303983/gr2/DOWNSAMPLED/image/jpeg/d9ed02203af62750161e53394f39827d/gr2.jpg gr2 gr2.jpg jpg 18490 428 376 IMAGE-DOWNSAMPLED 1-s2.0-S1381116916303983-gr3.jpg https://s3.amazonaws.com/prod-ucs-content-store-us-east/content/pii:S1381116916303983/gr3/DOWNSAMPLED/image/jpeg/5942b4fe886242c8273b94163fa12e29/gr3.jpg gr3 gr3.jpg jpg 10259 233 376 IMAGE-DOWNSAMPLED 1-s2.0-S1381116916303983-gr4.jpg https://s3.amazonaws.com/prod-ucs-content-store-us-east/content/pii:S1381116916303983/gr4/DOWNSAMPLED/image/jpeg/aff5f1699c8f107fe44b0e149bf8d852/gr4.jpg gr4 gr4.jpg jpg 11355 164 376 IMAGE-DOWNSAMPLED 1-s2.0-S1381116916303983-gr5.jpg https://s3.amazonaws.com/prod-ucs-content-store-us-east/content/pii:S1381116916303983/gr5/DOWNSAMPLED/image/jpeg/c7f39ade930ddcf2eb6ba6939705a328/gr5.jpg gr5 gr5.jpg jpg 14818 226 376 IMAGE-DOWNSAMPLED 1-s2.0-S1381116916303983-gr6.jpg https://s3.amazonaws.com/prod-ucs-content-store-us-east/content/pii:S1381116916303983/gr6/DOWNSAMPLED/image/jpeg/951f517077c886f866b800e9e71044ee/gr6.jpg gr6 gr6.jpg jpg 9203 249 207 IMAGE-DOWNSAMPLED 1-s2.0-S1381116916303983-gr7.jpg https://s3.amazonaws.com/prod-ucs-content-store-us-east/content/pii:S1381116916303983/gr7/DOWNSAMPLED/image/jpeg/6d2430e128625159a4bc33bd850ce7dd/gr7.jpg gr7 gr7.jpg jpg 31214 213 376 IMAGE-DOWNSAMPLED 1-s2.0-S1381116916303983-gr8.jpg https://s3.amazonaws.com/prod-ucs-content-store-us-east/content/pii:S1381116916303983/gr8/DOWNSAMPLED/image/jpeg/da06cf41231397c52ba5723db27f7f77/gr8.jpg gr8 gr8.jpg jpg 16162 230 376 IMAGE-DOWNSAMPLED 1-s2.0-S1381116916303983-sc1.jpg https://s3.amazonaws.com/prod-ucs-content-store-us-east/content/pii:S1381116916303983/sc1/DOWNSAMPLED/image/jpeg/5207f0a934f0ccaff4babfdfb2ea031f/sc1.jpg sc1 sc1.jpg jpg 15079 207 489 IMAGE-DOWNSAMPLED 1-s2.0-S1381116916303983-fx1_lrg.jpg https://s3.amazonaws.com/prod-ucs-content-store-us-east/content/pii:S1381116916303983/fx1/HIGHRES/image/jpeg/30c8085b005fb5a43b1287c8876c44bd/fx1_lrg.jpg fx1 true fx1_lrg.jpg jpg 116407 886 2213 IMAGE-HIGH-RES 1-s2.0-S1381116916303983-fx10_lrg.jpg https://s3.amazonaws.com/prod-ucs-content-store-us-east/content/pii:S1381116916303983/fx10/HIGHRES/image/jpeg/7137b01adf642ab275379365ca1ee88e/fx10_lrg.jpg fx10 fx10_lrg.jpg jpg 59927 886 2213 IMAGE-HIGH-RES 1-s2.0-S1381116916303983-fx11_lrg.jpg https://s3.amazonaws.com/prod-ucs-content-store-us-east/content/pii:S1381116916303983/fx11/HIGHRES/image/jpeg/0f663d929e394a62b7604344193aa8ae/fx11_lrg.jpg fx11 fx11_lrg.jpg jpg 63845 886 2213 IMAGE-HIGH-RES 1-s2.0-S1381116916303983-fx12_lrg.jpg https://s3.amazonaws.com/prod-ucs-content-store-us-east/content/pii:S1381116916303983/fx12/HIGHRES/image/jpeg/7e10870335b90e1656745df157397ee7/fx12_lrg.jpg fx12 fx12_lrg.jpg jpg 73788 886 2213 IMAGE-HIGH-RES 1-s2.0-S1381116916303983-fx13_lrg.jpg https://s3.amazonaws.com/prod-ucs-content-store-us-east/content/pii:S1381116916303983/fx13/HIGHRES/image/jpeg/233c01d51f46f765c91daa43a7c4d94a/fx13_lrg.jpg fx13 fx13_lrg.jpg jpg 68440 886 2213 IMAGE-HIGH-RES 1-s2.0-S1381116916303983-fx14_lrg.jpg https://s3.amazonaws.com/prod-ucs-content-store-us-east/content/pii:S1381116916303983/fx14/HIGHRES/image/jpeg/bfe18aa6aeddc28d7b3fab003d0a622e/fx14_lrg.jpg fx14 fx14_lrg.jpg jpg 63608 886 2213 IMAGE-HIGH-RES 1-s2.0-S1381116916303983-fx15_lrg.jpg https://s3.amazonaws.com/prod-ucs-content-store-us-east/content/pii:S1381116916303983/fx15/HIGHRES/image/jpeg/df01c4f6e756acaf3e487169c1bd7028/fx15_lrg.jpg fx15 fx15_lrg.jpg jpg 88546 886 2213 IMAGE-HIGH-RES 1-s2.0-S1381116916303983-fx16_lrg.jpg https://s3.amazonaws.com/prod-ucs-content-store-us-east/content/pii:S1381116916303983/fx16/HIGHRES/image/jpeg/bde206c695eb7be789d1e690da0da740/fx16_lrg.jpg fx16 fx16_lrg.jpg jpg 80444 886 2213 IMAGE-HIGH-RES 1-s2.0-S1381116916303983-fx17_lrg.jpg https://s3.amazonaws.com/prod-ucs-content-store-us-east/content/pii:S1381116916303983/fx17/HIGHRES/image/jpeg/1dafdc0bcb216593a9c525e49a3c3ad0/fx17_lrg.jpg fx17 fx17_lrg.jpg jpg 72525 886 2213 IMAGE-HIGH-RES 1-s2.0-S1381116916303983-fx2_lrg.jpg https://s3.amazonaws.com/prod-ucs-content-store-us-east/content/pii:S1381116916303983/fx2/HIGHRES/image/jpeg/b3b8ac3b119310721a1c7e908baa0f6e/fx2_lrg.jpg fx2 fx2_lrg.jpg jpg 62966 886 2213 IMAGE-HIGH-RES 1-s2.0-S1381116916303983-fx3_lrg.jpg https://s3.amazonaws.com/prod-ucs-content-store-us-east/content/pii:S1381116916303983/fx3/HIGHRES/image/jpeg/3b5d9449ae63dd9c518d691268732925/fx3_lrg.jpg fx3 fx3_lrg.jpg jpg 60082 886 2213 IMAGE-HIGH-RES 1-s2.0-S1381116916303983-fx4_lrg.jpg https://s3.amazonaws.com/prod-ucs-content-store-us-east/content/pii:S1381116916303983/fx4/HIGHRES/image/jpeg/b90daf06b5f3da50445e5a0125c47e90/fx4_lrg.jpg fx4 fx4_lrg.jpg jpg 59445 886 2213 IMAGE-HIGH-RES 1-s2.0-S1381116916303983-fx5_lrg.jpg https://s3.amazonaws.com/prod-ucs-content-store-us-east/content/pii:S1381116916303983/fx5/HIGHRES/image/jpeg/7408d28ab7fabf795fd3bc16297a020d/fx5_lrg.jpg fx5 fx5_lrg.jpg jpg 68625 886 2213 IMAGE-HIGH-RES 1-s2.0-S1381116916303983-fx6_lrg.jpg https://s3.amazonaws.com/prod-ucs-content-store-us-east/content/pii:S1381116916303983/fx6/HIGHRES/image/jpeg/562a44a2ac873365da00d6f445f97713/fx6_lrg.jpg fx6 fx6_lrg.jpg jpg 61154 886 2213 IMAGE-HIGH-RES 1-s2.0-S1381116916303983-fx7_lrg.jpg https://s3.amazonaws.com/prod-ucs-content-store-us-east/content/pii:S1381116916303983/fx7/HIGHRES/image/jpeg/ad8d9f6c2665655064cec2b537777566/fx7_lrg.jpg fx7 fx7_lrg.jpg jpg 56800 886 2213 IMAGE-HIGH-RES 1-s2.0-S1381116916303983-fx8_lrg.jpg https://s3.amazonaws.com/prod-ucs-content-store-us-east/content/pii:S1381116916303983/fx8/HIGHRES/image/jpeg/6c03ffa38823a30be54fc4d7af282275/fx8_lrg.jpg fx8 fx8_lrg.jpg jpg 57411 886 2213 IMAGE-HIGH-RES 1-s2.0-S1381116916303983-fx9_lrg.jpg https://s3.amazonaws.com/prod-ucs-content-store-us-east/content/pii:S1381116916303983/fx9/HIGHRES/image/jpeg/f115042b4d69947dc68326ccd87448a0/fx9_lrg.jpg fx9 fx9_lrg.jpg jpg 61337 886 2213 IMAGE-HIGH-RES 1-s2.0-S1381116916303983-gr1_lrg.jpg https://s3.amazonaws.com/prod-ucs-content-store-us-east/content/pii:S1381116916303983/gr1/HIGHRES/image/jpeg/ac6b13faa10d1e7caff80f5f2189463d/gr1_lrg.jpg gr1 gr1_lrg.jpg jpg 461384 2049 2500 IMAGE-HIGH-RES 1-s2.0-S1381116916303983-gr2_lrg.jpg https://s3.amazonaws.com/prod-ucs-content-store-us-east/content/pii:S1381116916303983/gr2/HIGHRES/image/jpeg/e733483407f738ed6ee95816f26bc1a6/gr2_lrg.jpg gr2 gr2_lrg.jpg jpg 155288 1896 1667 IMAGE-HIGH-RES 1-s2.0-S1381116916303983-gr3_lrg.jpg https://s3.amazonaws.com/prod-ucs-content-store-us-east/content/pii:S1381116916303983/gr3/HIGHRES/image/jpeg/dae2c34d7574dc5b563a5bffbfc0a3ea/gr3_lrg.jpg gr3 gr3_lrg.jpg jpg 83937 1035 1667 IMAGE-HIGH-RES 1-s2.0-S1381116916303983-gr4_lrg.jpg https://s3.amazonaws.com/prod-ucs-content-store-us-east/content/pii:S1381116916303983/gr4/HIGHRES/image/jpeg/22173c324b63d630d7db36c8e7634a09/gr4_lrg.jpg gr4 gr4_lrg.jpg jpg 96852 729 1667 IMAGE-HIGH-RES 1-s2.0-S1381116916303983-gr5_lrg.jpg https://s3.amazonaws.com/prod-ucs-content-store-us-east/content/pii:S1381116916303983/gr5/HIGHRES/image/jpeg/c3ea9c9064bc297f612c79676677e322/gr5_lrg.jpg gr5 gr5_lrg.jpg jpg 116469 1000 1667 IMAGE-HIGH-RES 1-s2.0-S1381116916303983-gr6_lrg.jpg https://s3.amazonaws.com/prod-ucs-content-store-us-east/content/pii:S1381116916303983/gr6/HIGHRES/image/jpeg/d5460844804f4f727eb594a2270a53ee/gr6_lrg.jpg gr6 gr6_lrg.jpg jpg 64009 1104 917 IMAGE-HIGH-RES 1-s2.0-S1381116916303983-gr7_lrg.jpg https://s3.amazonaws.com/prod-ucs-content-store-us-east/content/pii:S1381116916303983/gr7/HIGHRES/image/jpeg/a0f6d074d21fda5be230565b97ec8ca4/gr7_lrg.jpg gr7 gr7_lrg.jpg jpg 365548 944 1667 IMAGE-HIGH-RES 1-s2.0-S1381116916303983-gr8_lrg.jpg https://s3.amazonaws.com/prod-ucs-content-store-us-east/content/pii:S1381116916303983/gr8/HIGHRES/image/jpeg/c0096815a2059966e9a6d58e814ff58f/gr8_lrg.jpg gr8 gr8_lrg.jpg jpg 114357 1021 1667 IMAGE-HIGH-RES 1-s2.0-S1381116916303983-sc1_lrg.jpg https://s3.amazonaws.com/prod-ucs-content-store-us-east/content/pii:S1381116916303983/sc1/HIGHRES/image/jpeg/265501917ce291a68a664457a45dd756/sc1_lrg.jpg sc1 sc1_lrg.jpg jpg 111354 917 2167 IMAGE-HIGH-RES 1-s2.0-S1381116916303983-mmc1.doc https://s3.amazonaws.com/prod-ucs-content-store-us-east/content/pii:S1381116916303983/mmc1/MAIN/application/msword/46736adc06e4fc1f3772472f374bdcab/mmc1.doc mmc1 mmc1.doc doc 235008 APPLICATION MOLCAA 10050 S1381-1169(16)30398-3 10.1016/j.molcata.2016.09.026 Elsevier B.V. Scheme 1 Synthesis of soluble polymer anchored pMo complexes. (a) PSMo and (b) PAMo [76]. PS =poly(sodium vinyl sulfonate), PA =poly(sodium acrylate) and “ ” represents polymer chain. Scheme 1 Fig. 1 Scanning electron micrographs of (a) PS and (b) PSMo. EDX spectrum of (c) PSMo. Fig. 1 Fig. 2 FT-IR spectra of (a) PS, (b) PSMo and (c) PSMo after 10th reaction cycle. Fig. 2 Fig. 3 Raman spectrum of PSMo. Fig. 3 Fig. 4 95Mo NMR spectrum of (a) PSMo and (b) PSMo after 10th reaction cycle in D2O. Fig. 4 Fig. 5 TG-DTG plot of PSMo. Fig. 5 Fig. 6 Proposed structure of PSMo (“ ” represents polymer chain). Fig. 6 Fig. 7 Recyclability of PSMo and PAMo for the selective oxidation of MPS to sulfoxide. Fig. 7 Fig. 8 Proposed catalytic cycle. Fig. 8 Table 1 Optimization of reaction conditions for PSMo catalyzed selective oxidation of methyl phenyl sulfide (MPS) to sulfoxide by 30% H2O2 a . Table 1 Entry Molar ratio (Mo:MPS) H2O2 (equiv.) Solvent Temperature Time (min) Isolated yield (%) 1a:1b TON b TOF c (h−1) 1 1:1000 1 H2O RT 90 98 100:00 980 653 2 1:1000 2 H2O RT 60 96 100:00 960 960 3 1:500 2 H2O RT 45 94 100:00 470 627 4 1:1500 2 H2O RT 85 97 100:00 1455 1027 5 1:2000 2 H2O RT 100 98 100:00 1960 1176 6 1:1000 3 H2O RT 25 97 100:00 970 2328 7 1:1000 4 H2O RT 10 98 100:00 980 5880 8 1:1000 2 MeOH RT 80 97 100:00 970 727 9 1:1000 2 EtOH RT 65 97 100:00 970 895 10 1:1000 2 CH3CN RT 100 98 61:39 980 588 11 1:1000 2 CHCl3 RT 80 8 87:13 80 60 12 1:1000 2 CH2Cl2 RT 80 13 84:16 130 98 13 1:1000 2 H2O 60°C 20 90 100:00 900 2700 14 d 1:1000 4 H2O RT 10 16 68:32 160 960 15 e 16 f –– 44 H2OH2O RTRT 1010 1314 100:00100:00 –– –– Note: Values in bold signify optimized reaction condition. a All the reactions were carried out with 5mmol of substrate in 5mL of solvent. Catalyst amount=4.90mg for 0.005mmol of Mo. b TON (turnover number)=mmol of product per mmol of catalyst. c TOF (turnover frequency)=mmol of product per mmol of catalyst per hour. d Using Na2MoO4 as catalyst (1.03mg, 0.005mmol of Mo). e Blank experiment without any catalyst. f Reaction in presence of free poly(sodium vinyl sulfonate) (4.42mg). Table 2 Selective oxidation of sulfides to sulfoxides with 30% H2O2 catalyzed by PSMo and PAMo a . Table 2 PSMo PAMo Entry Substrate Time (min) Isolated yield (%) TON b TOF c (h−1) Time (min) Isolated yield (%) TON b TOF c (h−1) 1 10 98 980 5880 15 98 980 3920 10 96 d 960 5760 15 95 d 950 3800 10 97 e 970 5820 15 96 e 960 3840 2 5 96 960 11520 10 93 930 5580 3 8 97 970 7275 12 96 960 4800 4 8 96 960 7200 12 95 950 4750 5 10 94 940 5640 15 97 970 3880 6 15 98 980 3920 25 96 960 2307 7 50 97 970 1164 70 93 930 797 8 40 95 950 1425 60 93 930 930 9 130 97 970 448 155 96 960 372 10 150 96 960 384 180 94 940 313 11 f 150 98 980 392 160 97 970 363 12 g 11h 90 90 8.1 11h 89 89 8.0 a All reactions were carried out in 5mmol substrates, 20mmol 30% H2O2 and catalyst (0.005mmol of Mo) in 5mL H2O at RT, unless otherwise indicated. b TON (turnover number)=mmol of product per mmol of catalyst. c TOF (turnover frequency)=mmol of product per mmol of catalyst per hour. d Yield of 10th reaction cycle. e Scale up data (7.5g of MPS). f Reaction condition: 5mmol substrate, 20mmol 30% H2O2 and catalyst (0.005mmol of Mo) in 5mL methanol at RT. g Reaction condition: 5mmol substrate, 20mmol 30% H2O2 and catalyst (0.05mmol of Mo) at 65°C in refluxing methanol. Peroxomolybdate supported on water soluble polymers as efficient catalysts for green and selective sulfoxidation in aqueous medium Jeena Jyoti Boruah 1 Kabirun Ahmed 1 Srewashi Das Sandhya Rani Gogoi Gangutri Saikia Mitu Sharma Nashreen S. Islam ⁎ Department of Chemical Sciences, Tezpur University, Napaam, Tezpur 784028, Assam, India Department of Chemical Sciences Tezpur University Napaam Tezpur Assam 784028 India ⁎ Corresponding author at: Dept. of Chemical Sciences, Tezpur University, Napaam, Tezpur-784028, Assam, India. Tel.: +91 3712267007 (O)/+91 9435380222 (Off.); fax: +91 3712267006. 1 These authors contributed equally to this work. Graphical abstract Highly efficient recyclable and eco-compatible catalysts comprising peroxomolybdate immobilized on water soluble polymers have been developed for green and chemoselective oxidation of sulfides to sulfoxides in aqueous medium. Peroxomolybdenum(VI) species immobilized on linear water soluble polymers formulated as, [MoO(O2)2(sulfonate)]–PS [PS =poly(sodium vinyl sulfonate)] (PSMo) and[Mo2O2(O2)4(carboxylate)]–PA [PA =poly(sodium acrylate)](PAMo) served as efficient and recyclable catalysts for selective oxidation of organic sulfides to sulfoxide in water with 30% H2O2. The new polymer anchored complex, PSMo has been prepared by reacting H2MoO4 and 30% H2O2 with macromolecular ligand, poly(sodium vinyl sulfonate) and characterized by elemental analysis, spectral studies (FTIR, Raman, 13C NMR, 95Mo NMR, UV–vis), SEM, EDX and TGA-DTG analysis. The catalytic protocol effects clean and facile oxidation of a wide range of sulfides to afford pure sulfoxides with high TOF and excellent chemoselectivity at ambient temperature,with an easy work-up procedure. The catalysts can be regenerated in-situ and recycled at least up to ten consecutive reaction cycles without significant loss of activity and are amenable for ready scalability. The catalytic procedure thus provides an ecologically sustainable alternative as it involves water as solvent, H2O2 as green oxidant, a recyclable non-polluting catalyst, and is absolutely free from halide, organic co-solvent or co-catalyst. This is the first catalytic protocol for selective aqueous oxidation of sulfides using a catalytic system based on peroxometal species supported on water soluble polymers. Keywords Peroxomolybdenum(VI) catalyst Water soluble polymers Chemoselective sulfoxidation Non-polluting oxidation catalyst Selective aqueous sulfoxidation 1 Introduction Selective oxidation of organic sulfur containing compounds to sulfoxides is one of the pivotal reactions in organic synthesis, which holds immense interest from both chemical as well as biological perspectives [1–9]. Sulfoxides and sulfones serve as versatile synthetic precursors for production of a range of fine chemicals and biologically active molecules including pharmaceuticals, agrochemicals and chiral auxiliaries [4–9]. In addition, oxidative desulfurization of crude oil based on sulfide oxidation, is emerging as a sustainable alternative to the traditional catalytic hydrodesulfurization process [10–14]. Currently, with the ever increasing environmental concerns, research efforts are being oriented to development of simple, atom economical catalytic oxidation processes that use safer green reagents and oxidants, as well as benign non-polluting reaction media [15–32]. Among the multitude of available organic oxidants, aqueous 30% H2O2 with its high oxygen content, has been identified as an ideal atom efficient and environmentally acceptable terminal oxidant [13–16,27–30]. Consequently, scores of promising methodologies for selective sulfide oxidation with H2O2 using both homogeneous and heterogeneous transition metal catalysts have been reported in recent years [13–19,32–46]. Nevertheless, there still remains plenty of opportunities to design new alternative catalysts which can perform optimally in safer reaction media under mild condition, as some of the available protocols still rely upon volatile and toxic organic solvents, or require harsh reaction conditions, long reaction time, a promoter or a co-catalyst, or suffer from poor recyclability, which might compromise the ecological sustainability of an otherwise efficient process. Water is indeed the ultimate green natural solvent, being inexpensive, non-toxic, readily available with great redox stability and heat capacity [47–53]. It is therefore not surprising that we have been witnessing a dramatic upsurge in interest on water based organic synthesis [15,18,22,36,49–58]. Concomitant with the growing importance of aqueous phase organic reactions, the development of water-tolerant catalysts and water soluble ligands to support such transformations has become an area of intense investigation [50–52]. We have reported in recent years, several new catalysts and eco-compatible synthetic methodologies involving polymer immobilized peroxo derivatives of vanadium [59], molybdenum [17,42] and tungsten [20,42] for oxidative transformations, such as sulfide oxidation and oxidative bromination, using aqueous H2O2. Significantly, a set of peroxoniobium complexes has been shown to be excellent recoverable catalysts for clean conversion of organic sulfides with 30% H2O2 to the corresponding sulfoxide or sulfone with high selectivity and functional group compatibility in water [18]. In continuation of our efforts to develop simple and sustainable routes to accomplish selective sulfoxidation in aqueous medium, in the present work we have attempted to explore the scope of generating new peroxomolybdenum (pMo) based catalysts using water soluble polymers (WSP) as supports. We have envisaged that the combination of WSP support with a catalytically active pMo species would add advantages of polymeric reagent (stability and phase homogeneity to the catalyst and oxidant, for instance) to the inherent oxidant ability of the pMo species to afford immobilized recoverable catalysts usable in aqueous medium. Previous research has adequately proved that pMo complexes serve as stoichiometric oxidants or catalysts to activate H2O2 in a variety of organic oxidative transformations [17,22,60–65]. Utility of water soluble macromolecular metal complexes in diverse fields including biomedical [66,67] and environmental applications [67–69] has been well-documented in the literature [70]. However, the concept of application of soluble non-cross-linked polymers as support for attaching active metal peroxo complexes in catalyst design appears to have received scant attention, although the use of soluble polymers to recover catalyst in synthetic approaches related to peptide synthesis was introduced by Merrifield and Letsinger in the 1960 [71–73], which paved the way toward developing immobilized homogeneous catalysts [74,75]. It is pertinent to mention that we have previously gained an access to series of well-defined and stable peroxometal containing macro complexes by anchoring peroxo derivatives of vanadium, molybdenum or tungsten to the pendant functional groups of a variety of WSP matrices [59,76,77]. As some of these compounds exhibited unique oxidant activity as well as bio-relevant properties [59,76–78] very distinct from the corresponding neat peroxo complexes, the study of peroxometal anchored soluble macro complexes has subsequently been recognised as a promising new field [34,78]. Herein, we present a new catalytic protocol for H2O2 mediated selective oxidation of thioethers in aqueous medium using diperoxomolybdenum(VI) species anchored to non-cross linked soluble polymer resins, poly(sodium acrylate) (PA) or poly (sodium vinyl sulfonate) (PS) as recyclable catalysts. For practical application of the water soluble macroligand, apart from high hydrophilicity it should ideally possess an adequate molecular weight distribution, easy and cost-effective route of preparation, chemical stability, and high affinity to bind metal ions [79,80]. Apart from fulfilling all these requirements the chosen polymer supports are biocompatible and non-toxic as evident from their extensive use in development of pharmaceutical formulations [80]. As far as we are aware, this is the first report on application of a peroxometal derivative supported on water soluble polymer as catalyst for sulfide oxidation. 2 Results and discussion 2.1 Catalyst preparation and characterization Preparation of polymer anchored metal complexes using soluble polymeric ligands, which are essentially polychelatogens, often offers the convenience of adopting synthetic protocols used for obtaining their monomeric analogues. The new supported oxodiperoxomolybdenum catalyst, PSMo has been prepared conveniently by the reaction of molybdic acid, H2MoO4 with 30% H2O2 using commercially available polymer, poly(sodium vinyl sulfonate) in aqueous medium, as shown in Scheme 1 . The macro complex PAMo has been obtained earlier using an analogous synthetic protocol [76]. The pH of ca. 5 was found to be optimal for the desired synthesis. It was also important to limit the amount of water to that contributed by the hydrogen peroxide and sodium hydroxide solution used. The catalyst was finally isolated as solid by solvent induced precipitation using acetone. The water soluble compound PSMo like the polyacrylate bound catalyst PAMo, remains stable in the solid state for several weeks stored dry in closed containers at ambient temperature. The catalyst PSMo was characterized by elemental analysis and a combination of spectroscopic techniques viz., FTIR, 13C NMR, 95Mo NMR, UV–vis, as well as SEM- EDX and TGA-DTG analysis. The presence of pMo species in the compound in its oxodiperoxo form, [MoO(O2)2] was indicated by elemental analysis data showing the Mo:O2 2− ratio as 1:2. The molybdenum loading on the polymer, estimated on the basis of Mo content obtained from elemental analysis, atomic absorption spectroscopy (AAS) and EDX spectral analysis was found to be 1.02mmolg−1 of the polymeric support [Table S1 (Supplementary information)]. The value is observed to be slightly lower than the metal loading of the catalyst PAMo (1.45mmolg−1 of support). The occurrence of Mo in its +6 oxidation state in the immobilized compound was confirmed by the magnetic susceptibility measurement which revealed the diamagnetic nature of the compound. 2.1.1 SEM and energy dispersive X-ray (EDX) analysis The scanning electron micrograph shows that the smooth and even surface of the pristine polymer after the incorporation of pMo species, undergoes considerable morphological changes in PSMo revealing that the metal ions are distributed across the external surface of the polymer [Fig. 1 (a) and (b)]. Moreover, Energy dispersive X-ray spectroscopic analysis, carried out by focusing multiple regions over the surface of the polymeric catalyst clearly showed the presence of Mo, Na, C, O and S in the compound [Fig. 1(c)]. The composition of the compound as obtained from EDX analysis data was in close agreement with the elemental analysis values [Table S1 (supplementary)]. 2.1.2 IR, Raman and electronic spectral studies The FTIR and Raman spectra of the catalyst PSMo displayed the expected spectral pattern to indicate successful anchoring of pMo species to the polymer chain via pendant sulfonate group. As seen in Fig. 2 , the IR spectrum of the neat poly(sodium vinyl sulfonate) showed the ν sym vibration of sulfonate anion at 1040cm−1 in addition to a strong broad band representing SO stretching at 1190cm−1 [81,82]. The weak intensity ν a sym(CH2) and bending mode of CH2 group of the polymer chain occurred at 2954 and 1446cm−1, respectively [81,83,84]. In the spectrum of PSMo, apart from the band at 1042cm−1, a broad band with a distinct absorptions at 1210 and 1170cm−1 appeared which may be ascribed to the splitting of SO stretching vibrations originating from complexed sulfonate group [81,84–86]. The spectrum also showed diagnostic features depicting the presence of terminal oxo and side-on bound peroxo groups of the [MoO(O2)2] moiety with an intense absorption at 960cm−1 and well resolved bands at 860, 610 and 530cm−1 corresponding to ν(MoO), ν(OO), ν asym(MoO2) and ν sym(MoO2) frequencies, respectively [87,88]. The IR results have been corroborated further by the complementary Raman spectrum (Fig. 3 ) which exhibited the well resolved bands corresponding to ν(MoO), ν(OO), ν asym(MoO2) and ν sym(MoO2) vibrations at 974, 880, 650 and 553cm−1, respectively [89]. It also enabled identification of ν sym(SO) as a sharp absorption at 1080cm−1 as well as a broad band located in the 1150–1290 region with a peak at 1205cm−1 which may be ascribed to complexed sulfonate group [76,77,81,90,91]. The absorptions representing ν a sym(CH2) and shear mode of vibration of CH2 group of the polymer support were observed as strong band at 2956cm−1 and a relatively weaker intensity band at 1492cm−1, respectively [92]. The electronic spectrum of the compound recorded in aqueous solution displayed weak intensity broad band at 310–330nm, which is characteristic of peroxo to metal (LMCT) transition of a diperoxomolybdate species [Fig. S1 (Supplementary information)] [76,93]. 2.1.3 13C and 95Mo NMR The 13C NMR spectrum of the neat poly (sodium vinyl sulfonate) shows characteristic resonances due to the chain carbon atoms of CH2 and CH groups at 30.97 and 54.51ppm, respectively. In the spectrum of PSMo, positions of these peaks showed no significant shift compared to parent polymer, with CH2 and CH signals appearing at 30.98 and 54.53ppm, respectively indicating that the chain carbon atoms remain practically unaffected after incorporation of pMo moieties into the polymer matrix [Fig. S2 (Supplementary information)]. The observation is not unusual [76,77], considering that the metal anchoring occurs via pendant sulfonate groups and hence, are well separated from the carbon atoms of the polymer chain. The 95Mo NMR has been recognised as a sensitive and highly useful technique to study the nature of peroxomolybdenum species in aqueous solution [94]. 95Mo NMR spectrum of PSMo provided an unambiguous evidence in support of the presence of pMo species in its oxodiperoxo form by displaying (Fig. 4 ) a single resonance at −230ppm (relative to [MoO4]2−), as has been observed previously in case of the catalyst PAMo at −225ppm. These signals are in the range expected for a diperoxo molybdenum species [76,89,94]. Identification of a single peak in the spectrum further confirmed the existence of Mo(VI) in the compound in a single co-ordination environment suggesting inter alia, that the compound did not undergo hydrolysis and remained stable in solution. The stability of the catalyst PAMo in aqueous solution has been established previously [76]. 2.1.4 Thermal analysis The TGA-DTG profile of the catalyst, PSMo is shown in Fig. 5 , which revealed that the compound undergoes multistage decomposition on heating up to a final temperature of 750°C. Similar to other pMo compounds immobilized on WSP, including the catalyst PAMo [76], and unlike some monomeric peroxomolybdenum compounds [93], the catalyst PSMo did not explode on heating. After the initial dehydration step occurring with the liberation of water molecules of crystallization in the temperature range of 74–101°C, the next decomposition stage has been observed in the range of 110–199°C, with the corresponding weight loss of 6.04%, due to the loss of peroxo groups from the complex. The absence of peroxide group in the decomposition was also verified by its IR spectrum. The compound subsequently undergoes two decomposition processes accompanied by a weight loss of 43.63% in the temperature range commencing at 379°C which continued up to 750°C. On the basis of the thermal degradation pattern documented for poly(vinyl sulfonate) sodium salt, these decompositions have been ascribed to loss of sulfonate group with concomitant breakup of the polymer matrix [95]. It has been shown previously that the loss of sulfonate group is accompanied by release of ethylene, water, SO2 and CS2 from the compound [95]. The residue remaining at the end of the degradation process of the catalyst was characterized to be a hydrated oxomolybdenum species which showed the typical ν(MoO) and ν(OH) bands in the IR spectrum and was devoid of absorptions attributable to peroxo and the polymeric ligand of the starting catalyst. Significantly, the degradation pattern of PSMo closely resembled the pattern exhibited by the peroxotungsten containing analogue reported previously by us [77]. The TGA-DTG profile of the compound was thus found to be in conformity with the composition and formula assigned to the compounds. On the basis of the above collective evidences, a structure of the type shown in Fig. 6 has been proposed for the catalyst PSMo. 2.2 Catalytic activity of the supported complexes, PSMo and PAMo 2.2.1 Oxidation of sulfides to sulfoxides The macro complexes PSMo and PAMo were examined for their catalytic efficiency in sulfoxidation reaction with 30% H2O2 as terminal oxidant under aqueous conditions. In order to optimize the reaction condition an exploratory experiment has been first conducted employing thioanisole as the representative substrate and PSMo as the catalyst, maintaining Mo: substrate molar ratio at 1: 1000, and under continuous stirring at ambient temperature. The details of the study are summarized in Table 1 . To our pleasure, under these conditions MPS was completely and selectively transformed into sulfoxide within 90min of reaction time with a reasonably good TOF (Table 1, entry 1). Our assessment of the effect of the catalyst amount on the rate and selectivity of the reaction revealed that, increasing the amount of catalyst led to a substantial acceleration of thioanisole oxidation as expected, but rendered a decrease in the resulting TOF (Table 1, entry 3). On the other hand, the catalyst worked well even at Mo: substrate ratio of 1: 2000 with 2 equivalents of H2O2 affording a good TOF, albeit the reaction time increased considerably. Subsequently, the influence of the amount of oxidant on the reaction profile was examined. It was gratifying to note that increase in the amount of the oxidant led to a significant enhancement of the rate of the reaction, enabling us to achieve over eight fold improvement of TOF (Table 1, entry 7) simply by using 4 equivalents of H2O2, without altering other reaction parameters. Thus, for achieving best results in aqueous medium without compromising the selectivity, we have decided to maintain a Mo: substrate molar ratio of 1: 1000 and substrate: H2O2 at 1: 4 for subsequent reactions. A blank experiment conducted in absence of the catalyst under otherwise analogous reaction conditions, showed very low conversion of MPS to sulfoxide (ca. 13%) within the stipulated reaction time, (Table 1, entry 15), confirming the indispensability of the catalyst in obtaining the targeted product at a remarkably faster rate. Furthermore, we have investigated the activity of the supported pMo catalyst vis-à-vis unsupported peroxo molybdate generated in situ, by adding Na2MoO4 to the reaction mixture containing H2O2 under optimized reaction condition, maintaining essentially the same Mo: MPS ratio of 1: 1000. The distinctly superior activity displayed by the supported catalyst relative to the neat pMo species (Table 1, entry 14) made it apparent that immobilization of pMo species on the WSP support indeed led to an enhancement of the catalytic efficiency pMo derivatives both in terms of yield, as well as product selectivity. We have also performed the oxidation reactions under identical condition using the free polymer PA or PS in lieu of the pMo supported catalysts. The yield obtained in each case was nearly the same as that obtained from the blank experiment conducted in absence of the catalyst (Table 1, entry 16). The results clearly demonstrated that the chosen pristine polymers have no observable effect on the course of the oxidation reaction. Next, we considered it imperative to examine the performance of the catalysts in a variety of solvents other than water, since solvents have been known to have immense influence on the activity and selectivity of catalysts in sulfoxidation reaction. The solvent effect has been assessed in the oxidation of methyl phenyl sulfide using a series of common organic solvents viz., methanol, ethanol, acetonitrile, chloroform and dichloromethane. Interestingly, apart from water, the methodology for sulfoxidation has been found to be compatible in presence of other polar protic organic solvents such as methanol and ethanol, although not very effective in non-polar solvents (Table 1, entries 8 and 9). A good conversion was also obtained in acetonitrile although without product selectivity (Table 1, entry 10). It is notable that despite the insolubility of the catalysts in neat organic solvents, in presence of aqueous H2O2 of the reaction mixture, both the catalysts dissolve completely in the water miscible solvents viz., methanol, ethanol and acetonitrile, affording homogeneity of the catalytic process. From our survey of the solvent effect on sulfoxidation, water emerged to be the best solvent as indicated by the maximum TOF obtained along with 100% selectivity with respect to sulfoxide, despite the poor solubility of the organic substrates in water. Such observation is not unusual as it has been amply demonstrated by Sharpless et al. [52], followed by reports from some other laboratories [96,98], that for reactions to occur optimally in neat water, solubility of the organic reagents is not a fundamental requirement. Furthermore, our results are in accord with previous findings which showed that selective oxidation of sulfides to sulfoxides is highly favoured in polar protic solvent with ability to form H-bond [18,19,22,96–98]. It is worthy to note that in the present work all transformations occurred at the natural pH of the reaction medium. Notwithstanding previous literature [99–101], including our own work [18,42] showing considerable improvement of catalytic activity of peroxometallates in oxidative transformations in presence of acidic additives, we refrained from adjusting the pH as we endeavoured to bring about the desired transformations under mild condition, without involving any acid and by avoiding or minimizing the use of other hazardous auxiliaries. Also, in view of the environmentally benign aspect, we have chosen room temperature for our studies although, a significant increase in TOF could be attained at a moderately higher temperature as shown in (Table 1, entry 13). Having established the optimized reaction conditions for selective sulfoxidation of the model substrate, we extended the study to a range of structurally diverse sulfides such as dialkyl, diaryl, aryl alkyl, aryl vinyl, aryl alcohol as well as dibenzothiophene (DBT). The results depicted in Table 2 reveal that excellent yield with complete selectivity could be obtained in presence of each of the catalysts, PSMo and PAMo, across the series of substrates examined, affording the corresponding sulfoxide as the sole product. Significantly, no over oxidation of sulfoxide to sulfone was noted under the investigated conditions. Thus the catalytic protocol, being able to stop the oxidation at the sulfoxide level, provided complete control over degree of oxidation of the substrate. The catalyst PSMo, supported on poly (sodium vinyl sulfonate) with monomeric oxodiperoxomolybdenum moieties was observed to display consistently superior activity compared to the catalyst PAMo having dimeric pMo units. The distinct influence of the co-ordination sphere on catalytic activity of these supported pMo catalysts is thus apparent from the data. The methodology worked well for both aliphatic as well as aromatic substrates, albeit the rates of oxidation showed variations depending on the nature of the substrate and substituents attached. Previous work has already established that sulfide oxidation by H2O2 generally occurs via an electrophilic addition reaction of oxygen atoms, due to which sulfides with higher electron density on sulfur atom are expected to react faster [102,103]. The observed sequence in the present study (Table 2, entries 1–10) indicating the oxidation of aliphatic sulfides to be more facile in comparison to aromatic sulfides as well as other conjugated systems viz., allylic or vinylic sulfides is thus in accord with the decreasing nucleophilicity of the tested substrates, owing to conjugation of sulfur lone pair of electrons of the aromatic and allylic sulfides. It was therefore not surprising that the protocol enabled us to attain the highest TOF value of 11,520h−1 (for PSMo) for dimethyl sulfide oxidation (Table 2, entry 2), whereas the oxidation of diphenyl sulfide and benzyl phenyl sulfides (Table 2, entries 10 and 11) were rather sluggish and DBT being least nucleophilic and a relatively inert refractory sulfide, manifested no sulfoxidation reaction under the optimized condition in water even after 12h of reaction time. Nevertheless, it was possible to selectively oxidize these substrates, even DBT in presence of each of the developed catalysts by replacing H2O with methanol as medium of reaction and using a higher amount of catalyst (Mo: MPS ratio of 1:100). The reaction was conducted at a moderately elevated temperature of 65°C in case of DBT oxidation in order to enhance the reaction rate (Table 2, entry 12). One of the significant attributes of the catalysts is their excellent chemoselectivity displayed exclusively toward sulfur group of substrates containing other oxidation prone functional groups such as allylic, vinylic and alcoholic sulfides. As seen from the data of (Table 2, entries 8 and 9), allylic and vinylic sulfides were chemoselectively oxidized to the corresponding sulfoxide without epoxidation of CC. Similarly, the alcoholic and benzylic sulfides yielded the targeted sulfoxides without affecting any other functional group transformation (Table 2, entries 7 and 11) under the standard reaction conditions testifying to the excellent functional group tolerance of the catalysts. It is important to highlight herein that we have also confirmed the feasibility of the protocol for scaled-up synthetic applications by conducting the oxidation of thioanisole at ten-fold scale under the standard reaction conditions (Table 2, entry 1 e ). Furthermore, the oxidations occurred with high utilization efficiency of hydrogen peroxide (defined as: 100×mol of H2O2 consumed in the formation of the oxidised product/mol of H2O2 converted) [Text S1 (Supplementary information)] [45]. The H2O2 efficiency in the oxidations was found to be in the range of 90–94% in presence of each of the catalysts PSMo and PAMo. The mild reaction condition of the protocol with the requirement of reasonably short reaction time appears to be responsible for the observed high H2O2 efficiency. In case of DBT oxidation, relatively higher reaction temperature employed and longer reaction time required perhaps facilitates direct H2O2 decomposition leading to considerably lower H2O2 efficiency (ca. 58%). It is pertinent to mention that we have also explored the possibility of employing the same catalysts to obtain selectively sulfone from sulfide in aqueous medium, by varying the reaction conditions. Using MPS as the representative substrate, we could finally obtain pure sulfone with 50% H2O2 as oxidant in lieu of 30% H2O2, maintaining substrate: H2O2 molar ratio of 1: 8 and Mo: MPS ratio of 1: 500. The reaction however required nearly 24h for completion and the resulting TOF attained was about 20h−1. On the other hand, when the reaction was conducted in acetonitrile instead of water, MPS was selectively and completely converted to sulfone within 4h, affording a TOF of 253h−1, under otherwise analogous reaction condition. In the non-protic solvent acetonitrile, sulfone formation appears to be relatively more facile probably owing to the inability of acetonitrile to impart stability through hydrogen bond formation to the sulfoxide formed initially from sulfide. In fact, acetonitrile proved to be the best solvent to obtain pure sulfone from sulfide in some previous studies as well [17,21,45,103]. 2.2.2 Recyclability of the catalyst For practical utility of a catalytic process the longevity of the catalyst and its potential for regeneration and reusability are of fundamental importance. Albeit a homogeneous catalyst usually exhibits superior activity and selectivity vis-à-vis its heterogeneous counterpart, its recovery however, often involves tedious separation processes from organic products and lowered activity of recovered catalyst [50,53]. Interestingly however, it has been demonstrated that employing water soluble catalysts and water as the reaction medium it is possible to combine catalytic efficiency with easy recovery of the catalyst through simple phase separation, owing to poor solubility of the organic products in water [50,53]. Recovery of a soluble polymeric catalyst is often achieved by diluting the homogeneous solution with appropriate solvent to induce precipitation of the polymeric species which subsequently enables its isolation from the resulting heterogeneous mixture by filtration or centrifugation [104]. To our satisfaction, in the present study, the catalysts could be effectively regenerated in situ for reuse in subsequent cycles of reaction, simply by H2O2 treatment of the aqueous extract of the spent reaction mixture after separation of the organic product, followed by addition of a fresh batch of substrate after each catalytic cycle. Recycling experiments were conducted under optimized reaction condition using MPS as model substrate. The regenerated catalysts could be reused for at least ten reaction cycles with the activity and selectivity remaining nearly unaltered [Fig. 7 and Table 2 (entry 1 d )]. It was also possible to recover the catalysts as solid by addition of acetone to aqueous extract of the spent reaction mixture after replenishing the peroxide. The recovered catalyst could be reused in subsequent cycles of reaction without further conditioning. The approach of in situ recycling of the catalyst is definitely more convenient as the troublesome separation and purification steps usually associated with soluble catalyst could greatly be avoided. The redundancy of these steps further helped in limiting the use of organic solvents during the process. It is pertinent to mention that, using a similar approach we have previously achieved excellent results in case of recovery of homogeneous peroxoniobium as well as soluble polymer anchored peroxovanadium catalysts used in H2O2 induced oxidations [18,59]. It is important to highlight in this context that the overall TOF of ca. 57,530h−1 obtained using PSMo as catalysts, after ten cycles of MPS sulfoxidation in the present study, is nearly 7 and 4 fold higher than the corresponding values obtained after six reaction cycles in case of our recently reported homogeneous pNb catalysts [18] as well as heterogeneous polymer supported molybdenum(VI) catalysts [17], respectively. Although a direct comparison of the observed results with many of the other available methodologies is difficult in absence of TON or TOF values in most these reports, nevertheless, the efficiency of the catalysts PSMo and PAMo appear to be indeed remarkable, particularly considering the truly mild reaction conditions under which the reactions have been accomplished. In order to further ascertain that the catalysts retain their structural integrity during the catalytic cycles, the regenerated catalysts isolated from spent reaction mixture by treatment with acetone, was dried and subsequently subjected to characterization by elemental and spectral analysis. The FTIR spectra of the recovered catalysts showed the signature peaks corresponding to metal-peroxo as well as pendant functional groups of the polymer support as has been observed in the original catalyst (Fig. 2). The 95Mo NMR spectral pattern of the regenerated catalysts was identical with the corresponding spectrum of fresh catalyst (Fig. 4). Neither the metal loading nor the peroxide content of the recovered catalysts showed any significant decrease compared to the respective starting catalyst as revealed by elemental analysis and EDX spectral data. Moreover, the filtrate obtained after the isolation of the regenerated catalyst, subsequent to completion of the reaction, was treated with a fresh lot of H2O2 and MPS and the reaction was monitored over a period of 1h. The reaction afforded about 12% conversion after stipulated time, which is comparable to the value obtained in absence of the catalyst in the blank experiment. The absence of Mo in the filtrate after isolation of the catalysts was also ascertained by ICP analysis. Results of our studies thus confirm that there was no metal leaching out of the polymer during the catalytic process, indicating that the catalysts are structurally robust being capable of remaining intact during repeated cycles of oxidation. 2.2.3 The proposed catalytic cycle On the basis of the afore mentioned experimental findings, we propose the catalytic cycle for selective oxidation of sulfides to sulfoxide shown in Fig. 8 , using PSMo as representative. The first step of the reaction is likely to be the facile transfer of electrophilic oxygen from the active oxodiperoxomolybdenum(VI) species of the catalyst to sulfide to afford sulfoxide (reaction a) converting itself into a dioxomonoperoxo intermediate. The monoperoxo molybdenum derivative eventually combines with H2O2 and reverts back to form the original catalyst thus completing the catalytic cycle (reaction b). The proposed reaction cycle is in accord with the previous literature [15,17,20,61,64,105,106] on reactivity of pMo and peroxotungsten compounds where the formation of an inactive monoperoxo Mo(VI) and W(IV) intermediate during substrate oxidation by a more reactive diperoxo species of these metals has been well documented. 3 Experimental 3.1 Materials and methods Molybdic acid, poly (sodium vinyl sulfonate) (Mw=4000), methyl phenyl sulfide (MPS), ethyl phenyl sulfide (EPS), dimethyl sulfide (DMS), Methyl p-tolylsulfide (MpTS), dibutylsulfide (DBS), dibenzothiophene (DBT), dihexylsulfide (DHS), phenylvinylsulfide (PVS), 2- (phenylthio)ethanol (PTE), diphenylsulfide (DPS), benzyl phenyl sulfide (BPS) and allyl phenyl sulfide (APS) were purchased from Sigma-Aldrich Chemical Company, Milwaukee, USA. Poly (sodium acrylate) (Mw=2100) (Fluka). Hydrogen peroxide and sodium sulfate were obtained from E. Merck, India. Acetone, acetonitrile, methanol, ethylacetate, petroleum ether (boiling range 60–80°C), diethyl ether, dichloromethane, silica gel (60–120mesh), sodium hydroxide are the products of Rankem, India. [Mo2O2(O2)4(carboxylate)]–PA[PA=poly(sodium acrylate)] (PAMo) was obtained according to the method described in our earlier paper [76]. The water used for solution preparation was deionized and distilled. The molybdenum content of the synthesized compounds was determined by atomic absorption spectroscopy (AAS) using Thermo iCE 3000 series atomic absorption spectrophotometer model analyst 200, inductively coupled plasma optical emission spectrophotometer (ICP-OES) (Perkin Elmer, OPTIMA 2100 DV) analysis, as well as gravimetrically as molybdenum oxinate [107], MoO2(C9H6ON)2. Elemental analyses for C, H and N was performed on an elemental analyzer (Perkin-Elmer 2400 series II). Peroxide content was estimated volumetrically by procedures described in earlier papers [17,18]. The sodium content was measured by AAS and also with an ionometer (ORION VERSASTER). The IR spectra were recorded by making pressed pellets of samples with KBr using Perkin-Elmer spectrum 100 FTIR spectrophotometer. Raman spectra of the compounds were recorded using a Renishaw InVia Raman microscope equipped with an argon ion laser with an excitation wavelength of 514nm and a laser maximum output power of 20mW. The 13C NMR spectra were recorded on a JEOL JNM-ECS400 spectrometer at a carbon frequency of 100.5MHz, 131072 X-resolution points, number of scans 8000, 1.04s acquisition time, and 2.0s relaxation delay with the 1H NMR decoupling method in D2O. The 95 Mo NMR spectra were recorded in a Bruker AV 400MHz FT-NMR spectrometer at a molybdenum frequency of 26.07MHz with samples in a 10mm spinning tube with a sealed coaxial tube containing D2O, which provided the lock signal. The chemical shift data are recorded as negative values of ppm (δ) in the low-frequency direction with reference to 1M Na2MoO4·2H2O solution at 298K. Thermogravimetric analysis (TGA) was carried out on a SHIMADZU TGA-50 system at a heating rate of 10°Cmin−1 under N2 atmosphere using an aluminium pan. Scanning electron microscopy (SEM) characterizations of the compounds were obtained using a JEOL JSM-6390LV Scanning Electron Micrograph attached with an energy-dispersive X-ray detector. Scanning was done in the 10–20μM range, and images were taken at a magnification of 15–20kV. Data were obtained using INCA software. Standardization of the data analysis is an integral part of the SEM-EDX instrument employed. Magnetic susceptibilities of the complexes were measured by the Gouy method, using Hg[Co(NCS)] as the calibrant. 3.2 Synthesis of [MoO(O2)2(sulfonate)]–PS [PS=poly(sodium vinyl sulfonate)] (PSMo) To a solution of molybdic acid (1.84g, 11.50mmol) dissolved in 10mL of 30% H2O2 maintaining the temperature at 30–40°C, 1.5g of poly(sodium vinyl sulfonate) (PS) was added with constant stirring. The resulting mixture was stirred for an hour in an ice bath. The pH of the reaction solution at this stage was recorded to be ca. 2, which was adjusted at 5 by dropwise addition of 8M NaOH solution. On addition of about 50mL of pre-cooled acetone to the reaction solution with constant stirring, a red colored pasty product separated out which on repeated treatment with acetone turned into a microcrystalline solid. The compound was separated by centrifugation, washed 3–4 times with cold acetone and dried in vacuo over concentrated sulfuric acid. The compound was subsequently dried by heating up to 70°C under nitrogen atmosphere. The metal loading calculated from the observed molybdenum content is 1.02mmolg−1 of polymer for [MoO(O2)2(sulfonate)]–PS [Table S1 (Supplementary information)]. FT-IR (KBr pellet, cm−1): 1042, 1210, 1170 (SO), 960 (MO), 860 (OO), 610 and 530 (MO2). Raman (cm−1): 1080, 1205 (SO), 974 (MO), 880 (OO), 650 and 553 (MO2). 3.3 General procedure for catalytic oxidation of sulfides to sulfoxides In a typical reaction, organic substrate (5mmol) was added to a solution of catalyst [PAMo (3.44mg) or PSMo (4.9mg), containing 0.005mmol of Mo] and 30% H2O2 (2.26mL, 20mmol) in 5mL of water. The molar ratio of substrate: H2O2 and that of catalyst (Mo): substrate was maintained at 1: 4 and 1: 1000, respectively. The reaction was conducted at room temperature under magnetic stirring. The reaction progress was monitored by thin layer chromatography (TLC) and GC. After completion, the product and unreacted organic substrates were extracted with diethyl ether, dried over anhydrous sodium sulfate and distilled under reduced pressure to remove excess solvent. The crude product obtained was purified by column chromatography on silica gel with ethyl acetate- hexane (1: 9v/v) as the eluent. The product obtained was characterized by a combination of IR, 1H NMR, 13C NMR spectroscopy and melting point determination (for solid products) [Text S2 (Supplementary information)]. 3.4 Procedure for regeneration of the catalyst The recyclability of each of the catalysts was examined by using MPS as the substrate adopting the following procedures. For selective sulfoxidation, the catalyst could be regenerated and recycled in situ. After completion of the reaction run, the aqueous part of the reaction mixture was treated with 30% H2O2 (2.26mL, 20mmol) followed by a fresh batch of substrate and the reaction was conducted under optimized condition in the same manner as reported in the first run (Section 3.5). The progress of the reaction was monitored by thin layer chromatography (TLC) and GC. The process has been repeated for ten cycles of reaction. In an alternative procedure, the recovered catalyst could also be isolated as solid and reused in subsequent cycles of oxidation. The aqueous part of the spent reaction mixture was transferred to a beaker and treated with 30% H2O2 (2.26mL) in order to replenish the peroxide content of the catalyst state. To this solution pre-cooled acetone was added with constant stirring until the solid catalyst separated out which was isolated following the same work up procedure mentioned under Section 3.2. The dried solid catalyst was used in subsequent reaction cycle conducted under optimized condition. 4 Conclusions In conclusion, we successfully developed a simple, cost-effective and environmentally clean catalyst system comprising diperoxo molybdenum moiety immobilized onto non-cross linked water soluble polymer matrices, which exhibited remarkable efficiency in the selective oxidation of organic sulfides to the corresponding sulfoxide with 30% H2O2 in aqueous medium. Compatibility of the catalysts with relatively safer organic solvents such as methanol and ethanol is an additional significant feature of the catalysts, which has been used effectively to obtain high purity sulfoxide from less reactive dibenzothiophene in impressive yield. Most importantly, the catalysts are simply prepared from readily available non-toxic starting materials and are sufficiently robust to afford easy in-situ recyclability for sulfoxidation up to a minimum of ten reaction cycles with consistent activity selectivity profile. Moreover, ease of work-up, excellent chemoselectivity, ready scalability are additional green attributes of this novel methodology making it potentially attractive for practical applications. Our findings thus show that linear soluble polymers can be considered as a green and viable alternative to insoluble cross linked polymer support for designing sustainable peroxometal based catalysts for reactions in aqueous medium. The work on other applications of this highly efficient catalyst system to other important aqueous phase oxidative transformations including oxidation of biomass derived substrates are now underway in our laboratory. Acknowledgements The authors gratefully acknowledge the Department of Science and Technology, New Delhi, India, for providing financial support. We are also grateful to the University Grants Commission, New Delhi, for providing Moulana Azad National Fellowship to K.A. Notes and references Appendix A Supplementary data Supplementary data associated with this article can be found, in the online version, at http://dx.doi.org/10.1016/j.molcata.2016.09.026. Appendix A Supplementary data The following is Supplementary data to this article: References [1] S. Caron R.W. Dugger S.G. Ruggeri J.A. Ragan D.H.B. Ripin Chem. Rev. 106 2006 2943 2989 [2] M. Tanaka H. Yamazaki H. Hakusui N. Nakamichi H. Sekino Chirality 9 1997 17 21 [3] H. Cotton T. Elebring M. Larsson L. Li H.H. Sorensen S. VonUnge Tetrahedron: Asymmetry 11 2000 3819 3825 [4] H.L. Holland Chem. Rev. 88 1988 473 485 [5] I. Fernandez N. Khiar Chem. Rev. 103 2003 3651 3706 [6] S. Patai Z. Rappoport Synthesis of Sulfones, Sulfoxides and Cyclic Sulfides 1994 J. Wiley Chichester [7] M.C. Carreno Chem. Rev. 95 1995 1717 1760 [8] R. Bentley Chem. Rev. 105 2005 609 624 [9] J. Legros J.R. Dehli C. Bolm Adv. Synth. Catal. 347 2005 19 31 [10] Y. Ding W. Zhu H. Li W. Jeng M. Zhang Y. Duan Y. Chang Green Chem. 13 2011 1210 1216 [11] H. Li L. He J. Lu W. Zhu X. Jiang Y. Wang Y. Tan Energy Fuels 23 2009 1354 1357 [12] W. Zhu G. Zhu H. Li Y. Chao Y. Chang G. Chen C. Han J. Mol. Catal. A: Chem. 347 2011 8 14 [13] M.R. Maurya A. Arya A. Kumar M.L. Kuznetsov F. Avecilla J. Costa Pessoa Inorg. Chem. 49 2010 6586 6600 [14] V. Hulea F. Fajula J. Bousquet J. Catal. 198 2001 179 186 [15] B.M. Choudary B. Bharathi C.V. Reddy M.L. Kantam J. Chem. Soc. Perkin Trans. 1 2002 2069 2074 [16] K. Sato M. Hyodo M. Aoki X.-Q. Zheng R. Noyori Tetrahedron 57 2001 2469 2476 [17] J.J. Boruah S.P. Das S.R. Ankireddy S.R. Gogoi N.S. Islam Green Chem. 15 2013 2944 2959 [18] S.R. Gogoi J.J. Boruah G. Sengupta G. Saikia K. Ahmed K.K. Bania N.S. Islam Catal. Sci. Technol. 5 2015 595 610 [19] S.P. Das J.J. Boruah N. Sharma N.S. Islam J. Mol. Catal. A: Chem. 356 2012 36 45 [20] S.P. Das J.J. Boruah H. Chetry N.S. Islam Tetrahedron Lett. 53 2012 1163 1168 [21] S. Doherty J.G. Knight M.A. Carroll J.R. Ellison S.J. Hobson S. Stevens C. Hardacre P. Goodrichb Green Chem. 17 2015 1559 1571 [22] R.D. Chakravarthy V. Ramkumar D.K. Chand Green Chem. 16 2014 2190 2196 [23] B. Karimi M. Ghoreishi-Nezhad J.H. Clark Org. Lett. 7 2005 625 628 [24] M. Amini M.M. Haghdoostb M. Bagherzadehb Coord. Chem. Rev. 257 2013 1093 1121 [25] D.H. Koo M. Kim S. Chang Org. Lett. 7 2005 5015 5018 [26] G. Strukul A. Scarso M.G. Clerici O.A. Kholdeeva Environmentally Benign Oxidants, in Liquid Phase Oxidation via Heterogeneous Catalysis 2013 John Wiley & Sons, Inc Hoboken, New Jersey 1 20 [27] R. Noyori M. Aoki K. Sato Chem. Commun. 2003 1977 1986 [28] B.S. Lane K. Burgess Chem. Rev. 103 2003 2457 2474 [29] C.W. Jones Applications of Hydrogen Peroxide and Derivatives 1999 Royal Society of Chemistry Cambridge [30] M.V. Gómez R. Caballero E. Vázquez A. Moreno A. Hoz Á. Díaz-Ortiz Green Chem. 9 2007 331 336 [31] G. Strukul Catalytic Oxidations with Hydrogen Peroxide as Oxidant 1992 Kluwer Academic Publishers Dordrecht [32] S.K. Karmee L. Greiner A. Kraynov T.E. Müller B. Niemeijera W. Leitner Chem. Commun. 46 2010 6705 6707 [33] F. Gregori I. Nobili F. Bigi F. Maggi G. Predieri J. Mol. Catal. A: Chem. 286 2008 124 127 [34] V. Conte B. Floris Dalton Trans. 40 2011 1419 1436 [35] S. Hussain D. Talukdar S.K. Bharadwaj M.K. Chaudhuri Tetrahedron Lett. 53 2012 6512 6515 [36] F. Rajabi S. Naserian A. Primo R. Luque Adv. Synth. Catal. 353 2011 2060 2066 [37] M. Bagherzadeh R. Latifi L. Tahsini M. Amini Catal. Commun. 10 2008 196 200 [38] H. Egami T. Katsuki J. Am. Chem. Soc. 129 2007 8940 8941 [39] C. Yang Q.P. Jin H. Zhang J. Liao J. Zhu B. Yu J.G. Deng Green Chem. 11 2009 1401 1405 [40] I. Sheikhshoaie A. Rezaeifard N. Monadi S. Kaafi Polyhedron 28 2009 733 738 [41] G.P. Romanelli P.I. Villabrille C.V. Cáreres P.G. Vázquez P. Tundo Catal. Commun. 12 2011 726 730 [42] J.J. Boruah S.P. Das R. Borah S.R. Gogoi N.S. Islam Polyhedron 52 2013 246 254 [43] K. Kamata T. Hiranoa N. Mizuno Chem. Commun. 2009 3958 3960 [44] K. Sato M. Hyodo M. Aoki X.-Q. Zheng R. Noyori Tetrahedron 57 2001 2469 2476 [45] V. Hulea A.-L. Maciuca F. Fajula E. Dumitriu Appl. Catal. A 313 2006 200 207 [46] K.L. Prasanth H. Maheswaran J. Mol. Catal. A: Chem. 268 2007 45 49 [47] D.C. Rideout R.J. Breslow Am. Chem. Soc. 102 1980 7816 7817 [48] U.M. Lindstrom Organic Reactions in Water 2007 Black wellPublishing Oxford [49] C.-J. Li L. Chen Chem. Soc. Rev. 35 2006 68 82 [50] U.M. Lindstrom Chem. Rev. 102 2002 2751 2772 [51] M.-O. Simon C.-J. Li Chem. Soc. Rev. 41 2012 1415 1427 [52] S. Narayan J. Muldoon M.G. Finn V.V. Fokin H.C. Kolb K.B. Sharpless Angew. Chem. Int. Ed. 44 2005 3275 3279 [53] X.-Y. Shi J.F. Wei J. Mol. Catal. A: Chem. 280 2008 142 147 [54] W.A. Herrmann B. Cornils Angew. Chem. Int. Ed. Engl. 36 1997 1049 1067 [55] X.-M. Zeng J.-M. Chen A. Yoshimura K. Middletonb V.V. Zhdankin RSC Adv. 1 2011 973 977 [56] B. Yu C.-X. Guo C.-L. Zhong Z.-F. Diao L.-N. He Tetrahedron Lett. 55 2014 1818 1821 [57] Y. Imada T. Kitagawa H.-K. Wanga N. Komiya T. Naota Tetrahedron Lett. 54 2013 621 624 [58] N.M. Gresley W.P. Griffith A.C. Laemmel H.I.S. Nogueira B.C. Parkin J. Mol. Catal. A: Chem. 117 1997 185 198 [59] D. Kalita S. Sarmah S.P. Das D. Baishya A. Patowary S. Baruah N.S. Islam React. Funct. Polym. 68 2008 876 890 [60] A. Fuerte M. Iglesias F. Sánchez A. Corma J. Mol. Catal. A: Chem. 211 2004 227 235 [61] M.H. Dickman M.T. Pope Chem. Rev. 94 1994 569 584 [62] B. Tamami H. Yeganeh Eur. Polym. J. 35 1999 1445 1450 [63] A.F. Ghiron R.C. Thompson Inorg. Chem. 28 1989 3647 3650 [64] H. Mimoun Catal. Today 1 1987 281 295 [65] Y.M.A. Yamada H. Tabata M. Ichinohe H. Takahashi S. Ikegami Tetrahedron 60 2004 4087 4096 [66] B.R. Twaites C. de las H. Alarcón D. Cunliffe M. Lavigne S. Pennadam J.R. Smith D.C. Górecki C. Alexander J. Control. Release 97 2004 551 566 [67] N. Murthy J. Campbell N. Fausto A.S. Hoffman P.S. Stayton J. Control. Release 89 2003 365 374 [68] A.N. Pustam S.D. Alexandratos React. Funct. Polym. 70 2010 545 554 [69] I.M. Okhapkin E.E. Makhaeva A.R. Khokhlov Adv. Polym. Sci. 195 2006 177 210 [70] N.S. Islam J.J. Boruah J. Chem. Sci. 127 2015 777 795 [71] R.B. Merrifield Angew. Chem. Int. Ed. Engl. 24 1985 799 810 [72] I. Letsinger T.E. Wagner J. Am. Chem. Soc. 88 1966 2062 2063 [73] D.E. Bergbreiter Chem. Rev. 102 2002 3345 3384 [74] A.D. Pomogailo Catalysis by Polymer Immobilised Metal Complexes 1998 Gordon and Breach Science Publishers Amsterdam [75] D. Wohrle H.R. Kricheldorf Handbook of Polymer Synthesis 2005 Marcel Dekker New York 666 742 [76] J.J. Boruah D. Kalita S.P. Das S. Paul N.S. Islam Inorg. Chem. 50 2011 8046 8062 [77] S.P. Das S.R. Ankireddy J.J. Boruah N.S. Islam RSC Adv. 2 2012 7248 7261 [78] C.C. McLauchlan B.J. Peters G.R. Willsky D.C. Crans Coord. Chem. Rev. 301 2015 163 199 [79] B.L. Rivas E.D. Pereira M. Palencia J. Sánchez Prog. Polym. Sci. 36 2011 294 322 [80] V.G. Kadajji G.V. Betageri Polymers 3 2011 1972 2009 [81] B.L. Rivas G.V. Seguel K.E. Geckeler J. Appl. Polym. Sci. 85 2002 2546 2551 [82] A. Pourjavadi H. Ghasemzadeh Polym. Eng. Sci. 47 2007 1388 1395 [83] Y. Feng A. Schmidt R.A. Weiss Macromolecules 29 1996 3909 3917 [84] R.M. Silverstein G.C. Bassler T.C. Morrill Spectrometric Identification of Organic Compounds 1991 John Wiley and Sons, Inc Hoboken, New Jersey [85] M.G.A.E. Wahed K.A.E. Manakhly N.E. Kososy Mater. Chem. Phys. 41 1995 117 122 [86] F.H. Cristovan C.M. nascimento M.J.V. Bell E. Laureto J.L. Duarte I.F.L. Dias W.O. Cruz A. Marletta Chem. Phys. 326 2006 514 520 [87] N.J. Cristovan A.C. Dengel W.P. Griffith Polyhedron 8 1989 1379 1386 [88] A.B.P. Lever Harry B. Gray Acc. Chem. Res. 11 1978 348 355 [89] A.C. Dengel W.P. Griffith R.D. Powell A.C. Skapski J. Chem. Soc. Dalton Trans. 1987 991 995 [90] Y. Fan C.J. Cornelius J. Mater. Sci. 48 2013 1153 1161 [91] H.G.M. Edwards D.R. Brown J.R. Dale S. Plant J. Mol. Struct. 595 2001 111 125 [92] P. Kar A. Nayak Y.P. Bhoi B.G. Mishra Microporous Mesoporous Mater. 223 2016 176 186 [93] C. Djordjevic N. Vuletic B.A. Jacobs M.L. -R E. Sinn Inorg. Chem. 36 1997 1798 1805 [94] V. Nardello J. Marko G. Vermeersch J.M. Aubry Inorg. Chem. 34 1995 4950 4957 [95] D.D. Jiang Q. Yao M.A. McKinney C.A. Wilkie Polym. Degrad. Stab. 63 1999 423 434 [96] S.K. Maiti S. Banerjee A.K. Mukherjee K.M.A. Malik R. Bhattacharyya New J. Chem. 29 2005 554 563 [97] T. Patonay W. Adam A. Levai P. Kover M. Nemeth E.-M. Peters K. Peters J. Org. Chem. 66 2001 2275 2280 [98] E. Baciocchi M.F. Gerini A. Lapi J. Org. Chem. 69 2004 3586 3589 [99] O.A. Kholdeeva Eur. J. Inorg. Chem. 2013 1595 1605 [100] H.S. Schultz H.B. Freyermuth S.R. Buc J. Org. Chem. 28 1963 1140 1142 [101] O. Bortolini F. Di Furia G. Modena R. Seraglia J. Org. Chem. 50 1985 2688 2690 [102] M. Bonchio V. Conti M.A. De Conciliis F. Di Furia F.P. Ballistreri G.A. Tomaselli R.M. Toscano J. Org. Chem. 60 1995 4475 4480 [103] A.-L. Maciuca C.-E. Ciocan E. Dumitriu F. Fajula V. Hulea Catal. Today 138 2008 33 37 [104] D.J. Gravert K.D. Janda Chem. Rev. 97 1997 489 509 [105] K.A. Joergensen Chem. Rev. 89 1989 431 458 [106] W.R. Thiel J. Eppinger Chem.-Eur. J. 3 1997 696 705 [107] J. Bassett R.C. Denney G.H. Jeffery J. Mendham VOGEL’s Textbook of Quantitative Inorganic Analysis Including Elementary Instrumental Analysis 4th ed. 1978 Longman Group Ltd London 472 473",
      "scopus-id": "84988531200",
      "coredata": {
        "eid": "1-s2.0-S1381116916303983",
        "dc:description": "Peroxomolybdenum(VI) species immobilized on linear water soluble polymers formulated as, [MoO(O2)2(sulfonate)]–PS [PS =poly(sodium vinyl sulfonate)] (PSMo) and[Mo2O2(O2)4(carboxylate)]–PA [PA =poly(sodium acrylate)](PAMo) served as efficient and recyclable catalysts for selective oxidation of organic sulfides to sulfoxide in water with 30% H2O2. The new polymer anchored complex, PSMo has been prepared by reacting H2MoO4 and 30% H2O2 with macromolecular ligand, poly(sodium vinyl sulfonate) and characterized by elemental analysis, spectral studies (FTIR, Raman, 13C NMR, 95Mo NMR, UV–vis), SEM, EDX and TGA-DTG analysis. The catalytic protocol effects clean and facile oxidation of a wide range of sulfides to afford pure sulfoxides with high TOF and excellent chemoselectivity at ambient temperature,with an easy work-up procedure. The catalysts can be regenerated in-situ and recycled at least up to ten consecutive reaction cycles without significant loss of activity and are amenable for ready scalability. The catalytic procedure thus provides an ecologically sustainable alternative as it involves water as solvent, H2O2 as green oxidant, a recyclable non-polluting catalyst, and is absolutely free from halide, organic co-solvent or co-catalyst. This is the first catalytic protocol for selective aqueous oxidation of sulfides using a catalytic system based on peroxometal species supported on water soluble polymers.",
        "openArchiveArticle": "false",
        "prism:coverDate": "2016-12-15",
        "openaccessUserLicense": null,
        "prism:aggregationType": "Journal",
        "prism:url": "https://api.elsevier.com/content/article/pii/S1381116916303983",
        "dc:creator": [
          {
            "@_fa": "true",
            "$": "Boruah, Jeena Jyoti"
          },
          {
            "@_fa": "true",
            "$": "Ahmed, Kabirun"
          },
          {
            "@_fa": "true",
            "$": "Das, Srewashi"
          },
          {
            "@_fa": "true",
            "$": "Gogoi, Sandhya Rani"
          },
          {
            "@_fa": "true",
            "$": "Saikia, Gangutri"
          },
          {
            "@_fa": "true",
            "$": "Sharma, Mitu"
          },
          {
            "@_fa": "true",
            "$": "Islam, Nashreen S."
          }
        ],
        "link": [
          {
            "@_fa": "true",
            "@rel": "self",
            "@href": "https://api.elsevier.com/content/article/pii/S1381116916303983"
          },
          {
            "@_fa": "true",
            "@rel": "scidir",
            "@href": "https://www.sciencedirect.com/science/article/pii/S1381116916303983"
          }
        ],
        "dc:format": "application/json",
        "openaccessType": null,
        "pii": "S1381-1169(16)30398-3",
        "prism:volume": "425",
        "prism:publisher": "Elsevier B.V.",
        "dc:title": "Peroxomolybdate supported on water soluble polymers as efficient catalysts for green and selective sulfoxidation in aqueous medium",
        "prism:copyright": "© 2016 Elsevier B.V. All rights reserved.",
        "openaccess": "0",
        "prism:issn": "13811169",
        "dcterms:subject": [
          {
            "@_fa": "true",
            "$": "Peroxomolybdenum(VI) catalyst"
          },
          {
            "@_fa": "true",
            "$": "Water soluble polymers"
          },
          {
            "@_fa": "true",
            "$": "Chemoselective sulfoxidation"
          },
          {
            "@_fa": "true",
            "$": "Non-polluting oxidation catalyst"
          },
          {
            "@_fa": "true",
            "$": "Selective aqueous sulfoxidation"
          }
        ],
        "openaccessArticle": "false",
        "prism:publicationName": "Journal of Molecular Catalysis A: Chemical",
        "openaccessSponsorType": null,
        "prism:pageRange": "21-30",
        "prism:endingPage": "30",
        "pubType": "fla",
        "prism:coverDisplayDate": "15 December 2016",
        "prism:doi": "10.1016/j.molcata.2016.09.026",
        "prism:startingPage": "21",
        "dc:identifier": "doi:10.1016/j.molcata.2016.09.026",
        "openaccessSponsorName": null
      },
      "objects": {
        "object": [
          {
            "@category": "thumbnail",
            "@height": "88",
            "@width": "219",
            "@_fa": "true",
            "$": "https://api.elsevier.com/content/object/eid/1-s2.0-S1381116916303983-fx1.sml?httpAccept=%2A%2F%2A",
            "@multimediatype": "GIF image file",
            "@type": "IMAGE-THUMBNAIL",
            "@size": "4577",
            "@ref": "fx1",
            "@mimetype": "image/gif"
          },
          {
            "@category": "thumbnail",
            "@height": "88",
            "@width": "219",
            "@_fa": "true",
            "$": "https://api.elsevier.com/content/object/eid/1-s2.0-S1381116916303983-fx10.sml?httpAccept=%2A%2F%2A",
            "@multimediatype": "GIF image file",
            "@type": "IMAGE-THUMBNAIL",
            "@size": "3231",
            "@ref": "fx10",
            "@mimetype": "image/gif"
          },
          {
            "@category": "thumbnail",
            "@height": "88",
            "@width": "219",
            "@_fa": "true",
            "$": "https://api.elsevier.com/content/object/eid/1-s2.0-S1381116916303983-fx11.sml?httpAccept=%2A%2F%2A",
            "@multimediatype": "GIF image file",
            "@type": "IMAGE-THUMBNAIL",
            "@size": "3148",
            "@ref": "fx11",
            "@mimetype": "image/gif"
          },
          {
            "@category": "thumbnail",
            "@height": "88",
            "@width": "219",
            "@_fa": "true",
            "$": "https://api.elsevier.com/content/object/eid/1-s2.0-S1381116916303983-fx12.sml?httpAccept=%2A%2F%2A",
            "@multimediatype": "GIF image file",
            "@type": "IMAGE-THUMBNAIL",
            "@size": "3729",
            "@ref": "fx12",
            "@mimetype": "image/gif"
          },
          {
            "@category": "thumbnail",
            "@height": "88",
            "@width": "219",
            "@_fa": "true",
            "$": "https://api.elsevier.com/content/object/eid/1-s2.0-S1381116916303983-fx13.sml?httpAccept=%2A%2F%2A",
            "@multimediatype": "GIF image file",
            "@type": "IMAGE-THUMBNAIL",
            "@size": "3635",
            "@ref": "fx13",
            "@mimetype": "image/gif"
          },
          {
            "@category": "thumbnail",
            "@height": "88",
            "@width": "219",
            "@_fa": "true",
            "$": "https://api.elsevier.com/content/object/eid/1-s2.0-S1381116916303983-fx14.sml?httpAccept=%2A%2F%2A",
            "@multimediatype": "GIF image file",
            "@type": "IMAGE-THUMBNAIL",
            "@size": "3150",
            "@ref": "fx14",
            "@mimetype": "image/gif"
          },
          {
            "@category": "thumbnail",
            "@height": "88",
            "@width": "219",
            "@_fa": "true",
            "$": "https://api.elsevier.com/content/object/eid/1-s2.0-S1381116916303983-fx15.sml?httpAccept=%2A%2F%2A",
            "@multimediatype": "GIF image file",
            "@type": "IMAGE-THUMBNAIL",
            "@size": "4419",
            "@ref": "fx15",
            "@mimetype": "image/gif"
          },
          {
            "@category": "thumbnail",
            "@height": "88",
            "@width": "219",
            "@_fa": "true",
            "$": "https://api.elsevier.com/content/object/eid/1-s2.0-S1381116916303983-fx16.sml?httpAccept=%2A%2F%2A",
            "@multimediatype": "GIF image file",
            "@type": "IMAGE-THUMBNAIL",
            "@size": "3963",
            "@ref": "fx16",
            "@mimetype": "image/gif"
          },
          {
            "@category": "thumbnail",
            "@height": "88",
            "@width": "219",
            "@_fa": "true",
            "$": "https://api.elsevier.com/content/object/eid/1-s2.0-S1381116916303983-fx17.sml?httpAccept=%2A%2F%2A",
            "@multimediatype": "GIF image file",
            "@type": "IMAGE-THUMBNAIL",
            "@size": "3424",
            "@ref": "fx17",
            "@mimetype": "image/gif"
          },
          {
            "@category": "thumbnail",
            "@height": "88",
            "@width": "219",
            "@_fa": "true",
            "$": "https://api.elsevier.com/content/object/eid/1-s2.0-S1381116916303983-fx2.sml?httpAccept=%2A%2F%2A",
            "@multimediatype": "GIF image file",
            "@type": "IMAGE-THUMBNAIL",
            "@size": "4590",
            "@ref": "fx2",
            "@mimetype": "image/gif"
          },
          {
            "@category": "thumbnail",
            "@height": "88",
            "@width": "219",
            "@_fa": "true",
            "$": "https://api.elsevier.com/content/object/eid/1-s2.0-S1381116916303983-fx3.sml?httpAccept=%2A%2F%2A",
            "@multimediatype": "GIF image file",
            "@type": "IMAGE-THUMBNAIL",
            "@size": "3988",
            "@ref": "fx3",
            "@mimetype": "image/gif"
          },
          {
            "@category": "thumbnail",
            "@height": "88",
            "@width": "219",
            "@_fa": "true",
            "$": "https://api.elsevier.com/content/object/eid/1-s2.0-S1381116916303983-fx4.sml?httpAccept=%2A%2F%2A",
            "@multimediatype": "GIF image file",
            "@type": "IMAGE-THUMBNAIL",
            "@size": "2207",
            "@ref": "fx4",
            "@mimetype": "image/gif"
          },
          {
            "@category": "thumbnail",
            "@height": "88",
            "@width": "219",
            "@_fa": "true",
            "$": "https://api.elsevier.com/content/object/eid/1-s2.0-S1381116916303983-fx5.sml?httpAccept=%2A%2F%2A",
            "@multimediatype": "GIF image file",
            "@type": "IMAGE-THUMBNAIL",
            "@size": "2520",
            "@ref": "fx5",
            "@mimetype": "image/gif"
          },
          {
            "@category": "thumbnail",
            "@height": "88",
            "@width": "219",
            "@_fa": "true",
            "$": "https://api.elsevier.com/content/object/eid/1-s2.0-S1381116916303983-fx6.sml?httpAccept=%2A%2F%2A",
            "@multimediatype": "GIF image file",
            "@type": "IMAGE-THUMBNAIL",
            "@size": "3362",
            "@ref": "fx6",
            "@mimetype": "image/gif"
          },
          {
            "@category": "thumbnail",
            "@height": "88",
            "@width": "219",
            "@_fa": "true",
            "$": "https://api.elsevier.com/content/object/eid/1-s2.0-S1381116916303983-fx7.sml?httpAccept=%2A%2F%2A",
            "@multimediatype": "GIF image file",
            "@type": "IMAGE-THUMBNAIL",
            "@size": "3466",
            "@ref": "fx7",
            "@mimetype": "image/gif"
          },
          {
            "@category": "thumbnail",
            "@height": "88",
            "@width": "219",
            "@_fa": "true",
            "$": "https://api.elsevier.com/content/object/eid/1-s2.0-S1381116916303983-fx8.sml?httpAccept=%2A%2F%2A",
            "@multimediatype": "GIF image file",
            "@type": "IMAGE-THUMBNAIL",
            "@size": "3216",
            "@ref": "fx8",
            "@mimetype": "image/gif"
          },
          {
            "@category": "thumbnail",
            "@height": "88",
            "@width": "219",
            "@_fa": "true",
            "$": "https://api.elsevier.com/content/object/eid/1-s2.0-S1381116916303983-fx9.sml?httpAccept=%2A%2F%2A",
            "@multimediatype": "GIF image file",
            "@type": "IMAGE-THUMBNAIL",
            "@size": "3058",
            "@ref": "fx9",
            "@mimetype": "image/gif"
          },
          {
            "@category": "thumbnail",
            "@height": "164",
            "@width": "200",
            "@_fa": "true",
            "$": "https://api.elsevier.com/content/object/eid/1-s2.0-S1381116916303983-gr1.sml?httpAccept=%2A%2F%2A",
            "@multimediatype": "GIF image file",
            "@type": "IMAGE-THUMBNAIL",
            "@size": "12792",
            "@ref": "gr1",
            "@mimetype": "image/gif"
          },
          {
            "@category": "thumbnail",
            "@height": "164",
            "@width": "144",
            "@_fa": "true",
            "$": "https://api.elsevier.com/content/object/eid/1-s2.0-S1381116916303983-gr2.sml?httpAccept=%2A%2F%2A",
            "@multimediatype": "GIF image file",
            "@type": "IMAGE-THUMBNAIL",
            "@size": "4312",
            "@ref": "gr2",
            "@mimetype": "image/gif"
          },
          {
            "@category": "thumbnail",
            "@height": "136",
            "@width": "219",
            "@_fa": "true",
            "$": "https://api.elsevier.com/content/object/eid/1-s2.0-S1381116916303983-gr3.sml?httpAccept=%2A%2F%2A",
            "@multimediatype": "GIF image file",
            "@type": "IMAGE-THUMBNAIL",
            "@size": "3997",
            "@ref": "gr3",
            "@mimetype": "image/gif"
          },
          {
            "@category": "thumbnail",
            "@height": "96",
            "@width": "219",
            "@_fa": "true",
            "$": "https://api.elsevier.com/content/object/eid/1-s2.0-S1381116916303983-gr4.sml?httpAccept=%2A%2F%2A",
            "@multimediatype": "GIF image file",
            "@type": "IMAGE-THUMBNAIL",
            "@size": "3978",
            "@ref": "gr4",
            "@mimetype": "image/gif"
          },
          {
            "@category": "thumbnail",
            "@height": "131",
            "@width": "219",
            "@_fa": "true",
            "$": "https://api.elsevier.com/content/object/eid/1-s2.0-S1381116916303983-gr5.sml?httpAccept=%2A%2F%2A",
            "@multimediatype": "GIF image file",
            "@type": "IMAGE-THUMBNAIL",
            "@size": "4851",
            "@ref": "gr5",
            "@mimetype": "image/gif"
          },
          {
            "@category": "thumbnail",
            "@height": "164",
            "@width": "136",
            "@_fa": "true",
            "$": "https://api.elsevier.com/content/object/eid/1-s2.0-S1381116916303983-gr6.sml?httpAccept=%2A%2F%2A",
            "@multimediatype": "GIF image file",
            "@type": "IMAGE-THUMBNAIL",
            "@size": "3818",
            "@ref": "gr6",
            "@mimetype": "image/gif"
          },
          {
            "@category": "thumbnail",
            "@height": "124",
            "@width": "219",
            "@_fa": "true",
            "$": "https://api.elsevier.com/content/object/eid/1-s2.0-S1381116916303983-gr7.sml?httpAccept=%2A%2F%2A",
            "@multimediatype": "GIF image file",
            "@type": "IMAGE-THUMBNAIL",
            "@size": "11753",
            "@ref": "gr7",
            "@mimetype": "image/gif"
          },
          {
            "@category": "thumbnail",
            "@height": "134",
            "@width": "219",
            "@_fa": "true",
            "$": "https://api.elsevier.com/content/object/eid/1-s2.0-S1381116916303983-gr8.sml?httpAccept=%2A%2F%2A",
            "@multimediatype": "GIF image file",
            "@type": "IMAGE-THUMBNAIL",
            "@size": "5087",
            "@ref": "gr8",
            "@mimetype": "image/gif"
          },
          {
            "@category": "thumbnail",
            "@height": "93",
            "@width": "219",
            "@_fa": "true",
            "$": "https://api.elsevier.com/content/object/eid/1-s2.0-S1381116916303983-sc1.sml?httpAccept=%2A%2F%2A",
            "@multimediatype": "GIF image file",
            "@type": "IMAGE-THUMBNAIL",
            "@size": "3211",
            "@ref": "sc1",
            "@mimetype": "image/gif"
          },
          {
            "@category": "standard",
            "@height": "200",
            "@width": "500",
            "@_fa": "true",
            "$": "https://api.elsevier.com/content/object/eid/1-s2.0-S1381116916303983-fx1.jpg?httpAccept=%2A%2F%2A",
            "@multimediatype": "JPEG image file",
            "@type": "IMAGE-DOWNSAMPLED",
            "@size": "18458",
            "@ref": "fx1",
            "@mimetype": "image/jpeg"
          },
          {
            "@category": "standard",
            "@height": "200",
            "@width": "500",
            "@_fa": "true",
            "$": "https://api.elsevier.com/content/object/eid/1-s2.0-S1381116916303983-fx10.jpg?httpAccept=%2A%2F%2A",
            "@multimediatype": "JPEG image file",
            "@type": "IMAGE-DOWNSAMPLED",
            "@size": "8234",
            "@ref": "fx10",
            "@mimetype": "image/jpeg"
          },
          {
            "@category": "standard",
            "@height": "200",
            "@width": "500",
            "@_fa": "true",
            "$": "https://api.elsevier.com/content/object/eid/1-s2.0-S1381116916303983-fx11.jpg?httpAccept=%2A%2F%2A",
            "@multimediatype": "JPEG image file",
            "@type": "IMAGE-DOWNSAMPLED",
            "@size": "8397",
            "@ref": "fx11",
            "@mimetype": "image/jpeg"
          },
          {
            "@category": "standard",
            "@height": "200",
            "@width": "500",
            "@_fa": "true",
            "$": "https://api.elsevier.com/content/object/eid/1-s2.0-S1381116916303983-fx12.jpg?httpAccept=%2A%2F%2A",
            "@multimediatype": "JPEG image file",
            "@type": "IMAGE-DOWNSAMPLED",
            "@size": "9456",
            "@ref": "fx12",
            "@mimetype": "image/jpeg"
          },
          {
            "@category": "standard",
            "@height": "200",
            "@width": "500",
            "@_fa": "true",
            "$": "https://api.elsevier.com/content/object/eid/1-s2.0-S1381116916303983-fx13.jpg?httpAccept=%2A%2F%2A",
            "@multimediatype": "JPEG image file",
            "@type": "IMAGE-DOWNSAMPLED",
            "@size": "9299",
            "@ref": "fx13",
            "@mimetype": "image/jpeg"
          },
          {
            "@category": "standard",
            "@height": "200",
            "@width": "500",
            "@_fa": "true",
            "$": "https://api.elsevier.com/content/object/eid/1-s2.0-S1381116916303983-fx14.jpg?httpAccept=%2A%2F%2A",
            "@multimediatype": "JPEG image file",
            "@type": "IMAGE-DOWNSAMPLED",
            "@size": "8181",
            "@ref": "fx14",
            "@mimetype": "image/jpeg"
          },
          {
            "@category": "standard",
            "@height": "200",
            "@width": "500",
            "@_fa": "true",
            "$": "https://api.elsevier.com/content/object/eid/1-s2.0-S1381116916303983-fx15.jpg?httpAccept=%2A%2F%2A",
            "@multimediatype": "JPEG image file",
            "@type": "IMAGE-DOWNSAMPLED",
            "@size": "12124",
            "@ref": "fx15",
            "@mimetype": "image/jpeg"
          },
          {
            "@category": "standard",
            "@height": "200",
            "@width": "500",
            "@_fa": "true",
            "$": "https://api.elsevier.com/content/object/eid/1-s2.0-S1381116916303983-fx16.jpg?httpAccept=%2A%2F%2A",
            "@multimediatype": "JPEG image file",
            "@type": "IMAGE-DOWNSAMPLED",
            "@size": "10520",
            "@ref": "fx16",
            "@mimetype": "image/jpeg"
          },
          {
            "@category": "standard",
            "@height": "200",
            "@width": "500",
            "@_fa": "true",
            "$": "https://api.elsevier.com/content/object/eid/1-s2.0-S1381116916303983-fx17.jpg?httpAccept=%2A%2F%2A",
            "@multimediatype": "JPEG image file",
            "@type": "IMAGE-DOWNSAMPLED",
            "@size": "9420",
            "@ref": "fx17",
            "@mimetype": "image/jpeg"
          },
          {
            "@category": "standard",
            "@height": "200",
            "@width": "500",
            "@_fa": "true",
            "$": "https://api.elsevier.com/content/object/eid/1-s2.0-S1381116916303983-fx2.jpg?httpAccept=%2A%2F%2A",
            "@multimediatype": "JPEG image file",
            "@type": "IMAGE-DOWNSAMPLED",
            "@size": "8927",
            "@ref": "fx2",
            "@mimetype": "image/jpeg"
          },
          {
            "@category": "standard",
            "@height": "200",
            "@width": "500",
            "@_fa": "true",
            "$": "https://api.elsevier.com/content/object/eid/1-s2.0-S1381116916303983-fx3.jpg?httpAccept=%2A%2F%2A",
            "@multimediatype": "JPEG image file",
            "@type": "IMAGE-DOWNSAMPLED",
            "@size": "8705",
            "@ref": "fx3",
            "@mimetype": "image/jpeg"
          },
          {
            "@category": "standard",
            "@height": "200",
            "@width": "500",
            "@_fa": "true",
            "$": "https://api.elsevier.com/content/object/eid/1-s2.0-S1381116916303983-fx4.jpg?httpAccept=%2A%2F%2A",
            "@multimediatype": "JPEG image file",
            "@type": "IMAGE-DOWNSAMPLED",
            "@size": "8184",
            "@ref": "fx4",
            "@mimetype": "image/jpeg"
          },
          {
            "@category": "standard",
            "@height": "200",
            "@width": "500",
            "@_fa": "true",
            "$": "https://api.elsevier.com/content/object/eid/1-s2.0-S1381116916303983-fx5.jpg?httpAccept=%2A%2F%2A",
            "@multimediatype": "JPEG image file",
            "@type": "IMAGE-DOWNSAMPLED",
            "@size": "9260",
            "@ref": "fx5",
            "@mimetype": "image/jpeg"
          },
          {
            "@category": "standard",
            "@height": "200",
            "@width": "500",
            "@_fa": "true",
            "$": "https://api.elsevier.com/content/object/eid/1-s2.0-S1381116916303983-fx6.jpg?httpAccept=%2A%2F%2A",
            "@multimediatype": "JPEG image file",
            "@type": "IMAGE-DOWNSAMPLED",
            "@size": "7803",
            "@ref": "fx6",
            "@mimetype": "image/jpeg"
          },
          {
            "@category": "standard",
            "@height": "200",
            "@width": "500",
            "@_fa": "true",
            "$": "https://api.elsevier.com/content/object/eid/1-s2.0-S1381116916303983-fx7.jpg?httpAccept=%2A%2F%2A",
            "@multimediatype": "JPEG image file",
            "@type": "IMAGE-DOWNSAMPLED",
            "@size": "7382",
            "@ref": "fx7",
            "@mimetype": "image/jpeg"
          },
          {
            "@category": "standard",
            "@height": "200",
            "@width": "500",
            "@_fa": "true",
            "$": "https://api.elsevier.com/content/object/eid/1-s2.0-S1381116916303983-fx8.jpg?httpAccept=%2A%2F%2A",
            "@multimediatype": "JPEG image file",
            "@type": "IMAGE-DOWNSAMPLED",
            "@size": "7732",
            "@ref": "fx8",
            "@mimetype": "image/jpeg"
          },
          {
            "@category": "standard",
            "@height": "200",
            "@width": "500",
            "@_fa": "true",
            "$": "https://api.elsevier.com/content/object/eid/1-s2.0-S1381116916303983-fx9.jpg?httpAccept=%2A%2F%2A",
            "@multimediatype": "JPEG image file",
            "@type": "IMAGE-DOWNSAMPLED",
            "@size": "8357",
            "@ref": "fx9",
            "@mimetype": "image/jpeg"
          },
          {
            "@category": "standard",
            "@height": "463",
            "@width": "565",
            "@_fa": "true",
            "$": "https://api.elsevier.com/content/object/eid/1-s2.0-S1381116916303983-gr1.jpg?httpAccept=%2A%2F%2A",
            "@multimediatype": "JPEG image file",
            "@type": "IMAGE-DOWNSAMPLED",
            "@size": "43696",
            "@ref": "gr1",
            "@mimetype": "image/jpeg"
          },
          {
            "@category": "standard",
            "@height": "428",
            "@width": "376",
            "@_fa": "true",
            "$": "https://api.elsevier.com/content/object/eid/1-s2.0-S1381116916303983-gr2.jpg?httpAccept=%2A%2F%2A",
            "@multimediatype": "JPEG image file",
            "@type": "IMAGE-DOWNSAMPLED",
            "@size": "18490",
            "@ref": "gr2",
            "@mimetype": "image/jpeg"
          },
          {
            "@category": "standard",
            "@height": "233",
            "@width": "376",
            "@_fa": "true",
            "$": "https://api.elsevier.com/content/object/eid/1-s2.0-S1381116916303983-gr3.jpg?httpAccept=%2A%2F%2A",
            "@multimediatype": "JPEG image file",
            "@type": "IMAGE-DOWNSAMPLED",
            "@size": "10259",
            "@ref": "gr3",
            "@mimetype": "image/jpeg"
          },
          {
            "@category": "standard",
            "@height": "164",
            "@width": "376",
            "@_fa": "true",
            "$": "https://api.elsevier.com/content/object/eid/1-s2.0-S1381116916303983-gr4.jpg?httpAccept=%2A%2F%2A",
            "@multimediatype": "JPEG image file",
            "@type": "IMAGE-DOWNSAMPLED",
            "@size": "11355",
            "@ref": "gr4",
            "@mimetype": "image/jpeg"
          },
          {
            "@category": "standard",
            "@height": "226",
            "@width": "376",
            "@_fa": "true",
            "$": "https://api.elsevier.com/content/object/eid/1-s2.0-S1381116916303983-gr5.jpg?httpAccept=%2A%2F%2A",
            "@multimediatype": "JPEG image file",
            "@type": "IMAGE-DOWNSAMPLED",
            "@size": "14818",
            "@ref": "gr5",
            "@mimetype": "image/jpeg"
          },
          {
            "@category": "standard",
            "@height": "249",
            "@width": "207",
            "@_fa": "true",
            "$": "https://api.elsevier.com/content/object/eid/1-s2.0-S1381116916303983-gr6.jpg?httpAccept=%2A%2F%2A",
            "@multimediatype": "JPEG image file",
            "@type": "IMAGE-DOWNSAMPLED",
            "@size": "9203",
            "@ref": "gr6",
            "@mimetype": "image/jpeg"
          },
          {
            "@category": "standard",
            "@height": "213",
            "@width": "376",
            "@_fa": "true",
            "$": "https://api.elsevier.com/content/object/eid/1-s2.0-S1381116916303983-gr7.jpg?httpAccept=%2A%2F%2A",
            "@multimediatype": "JPEG image file",
            "@type": "IMAGE-DOWNSAMPLED",
            "@size": "31214",
            "@ref": "gr7",
            "@mimetype": "image/jpeg"
          },
          {
            "@category": "standard",
            "@height": "230",
            "@width": "376",
            "@_fa": "true",
            "$": "https://api.elsevier.com/content/object/eid/1-s2.0-S1381116916303983-gr8.jpg?httpAccept=%2A%2F%2A",
            "@multimediatype": "JPEG image file",
            "@type": "IMAGE-DOWNSAMPLED",
            "@size": "16162",
            "@ref": "gr8",
            "@mimetype": "image/jpeg"
          },
          {
            "@category": "standard",
            "@height": "207",
            "@width": "489",
            "@_fa": "true",
            "$": "https://api.elsevier.com/content/object/eid/1-s2.0-S1381116916303983-sc1.jpg?httpAccept=%2A%2F%2A",
            "@multimediatype": "JPEG image file",
            "@type": "IMAGE-DOWNSAMPLED",
            "@size": "15079",
            "@ref": "sc1",
            "@mimetype": "image/jpeg"
          },
          {
            "@category": "high",
            "@height": "886",
            "@width": "2213",
            "@_fa": "true",
            "$": "https://api.elsevier.com/content/object/eid/1-s2.0-S1381116916303983-fx1_lrg.jpg?httpAccept=%2A%2F%2A",
            "@multimediatype": "JPEG image file",
            "@type": "IMAGE-HIGH-RES",
            "@size": "116407",
            "@ref": "fx1",
            "@mimetype": "image/jpeg"
          },
          {
            "@category": "high",
            "@height": "886",
            "@width": "2213",
            "@_fa": "true",
            "$": "https://api.elsevier.com/content/object/eid/1-s2.0-S1381116916303983-fx10_lrg.jpg?httpAccept=%2A%2F%2A",
            "@multimediatype": "JPEG image file",
            "@type": "IMAGE-HIGH-RES",
            "@size": "59927",
            "@ref": "fx10",
            "@mimetype": "image/jpeg"
          },
          {
            "@category": "high",
            "@height": "886",
            "@width": "2213",
            "@_fa": "true",
            "$": "https://api.elsevier.com/content/object/eid/1-s2.0-S1381116916303983-fx11_lrg.jpg?httpAccept=%2A%2F%2A",
            "@multimediatype": "JPEG image file",
            "@type": "IMAGE-HIGH-RES",
            "@size": "63845",
            "@ref": "fx11",
            "@mimetype": "image/jpeg"
          },
          {
            "@category": "high",
            "@height": "886",
            "@width": "2213",
            "@_fa": "true",
            "$": "https://api.elsevier.com/content/object/eid/1-s2.0-S1381116916303983-fx12_lrg.jpg?httpAccept=%2A%2F%2A",
            "@multimediatype": "JPEG image file",
            "@type": "IMAGE-HIGH-RES",
            "@size": "73788",
            "@ref": "fx12",
            "@mimetype": "image/jpeg"
          },
          {
            "@category": "high",
            "@height": "886",
            "@width": "2213",
            "@_fa": "true",
            "$": "https://api.elsevier.com/content/object/eid/1-s2.0-S1381116916303983-fx13_lrg.jpg?httpAccept=%2A%2F%2A",
            "@multimediatype": "JPEG image file",
            "@type": "IMAGE-HIGH-RES",
            "@size": "68440",
            "@ref": "fx13",
            "@mimetype": "image/jpeg"
          },
          {
            "@category": "high",
            "@height": "886",
            "@width": "2213",
            "@_fa": "true",
            "$": "https://api.elsevier.com/content/object/eid/1-s2.0-S1381116916303983-fx14_lrg.jpg?httpAccept=%2A%2F%2A",
            "@multimediatype": "JPEG image file",
            "@type": "IMAGE-HIGH-RES",
            "@size": "63608",
            "@ref": "fx14",
            "@mimetype": "image/jpeg"
          },
          {
            "@category": "high",
            "@height": "886",
            "@width": "2213",
            "@_fa": "true",
            "$": "https://api.elsevier.com/content/object/eid/1-s2.0-S1381116916303983-fx15_lrg.jpg?httpAccept=%2A%2F%2A",
            "@multimediatype": "JPEG image file",
            "@type": "IMAGE-HIGH-RES",
            "@size": "88546",
            "@ref": "fx15",
            "@mimetype": "image/jpeg"
          },
          {
            "@category": "high",
            "@height": "886",
            "@width": "2213",
            "@_fa": "true",
            "$": "https://api.elsevier.com/content/object/eid/1-s2.0-S1381116916303983-fx16_lrg.jpg?httpAccept=%2A%2F%2A",
            "@multimediatype": "JPEG image file",
            "@type": "IMAGE-HIGH-RES",
            "@size": "80444",
            "@ref": "fx16",
            "@mimetype": "image/jpeg"
          },
          {
            "@category": "high",
            "@height": "886",
            "@width": "2213",
            "@_fa": "true",
            "$": "https://api.elsevier.com/content/object/eid/1-s2.0-S1381116916303983-fx17_lrg.jpg?httpAccept=%2A%2F%2A",
            "@multimediatype": "JPEG image file",
            "@type": "IMAGE-HIGH-RES",
            "@size": "72525",
            "@ref": "fx17",
            "@mimetype": "image/jpeg"
          },
          {
            "@category": "high",
            "@height": "886",
            "@width": "2213",
            "@_fa": "true",
            "$": "https://api.elsevier.com/content/object/eid/1-s2.0-S1381116916303983-fx2_lrg.jpg?httpAccept=%2A%2F%2A",
            "@multimediatype": "JPEG image file",
            "@type": "IMAGE-HIGH-RES",
            "@size": "62966",
            "@ref": "fx2",
            "@mimetype": "image/jpeg"
          },
          {
            "@category": "high",
            "@height": "886",
            "@width": "2213",
            "@_fa": "true",
            "$": "https://api.elsevier.com/content/object/eid/1-s2.0-S1381116916303983-fx3_lrg.jpg?httpAccept=%2A%2F%2A",
            "@multimediatype": "JPEG image file",
            "@type": "IMAGE-HIGH-RES",
            "@size": "60082",
            "@ref": "fx3",
            "@mimetype": "image/jpeg"
          },
          {
            "@category": "high",
            "@height": "886",
            "@width": "2213",
            "@_fa": "true",
            "$": "https://api.elsevier.com/content/object/eid/1-s2.0-S1381116916303983-fx4_lrg.jpg?httpAccept=%2A%2F%2A",
            "@multimediatype": "JPEG image file",
            "@type": "IMAGE-HIGH-RES",
            "@size": "59445",
            "@ref": "fx4",
            "@mimetype": "image/jpeg"
          },
          {
            "@category": "high",
            "@height": "886",
            "@width": "2213",
            "@_fa": "true",
            "$": "https://api.elsevier.com/content/object/eid/1-s2.0-S1381116916303983-fx5_lrg.jpg?httpAccept=%2A%2F%2A",
            "@multimediatype": "JPEG image file",
            "@type": "IMAGE-HIGH-RES",
            "@size": "68625",
            "@ref": "fx5",
            "@mimetype": "image/jpeg"
          },
          {
            "@category": "high",
            "@height": "886",
            "@width": "2213",
            "@_fa": "true",
            "$": "https://api.elsevier.com/content/object/eid/1-s2.0-S1381116916303983-fx6_lrg.jpg?httpAccept=%2A%2F%2A",
            "@multimediatype": "JPEG image file",
            "@type": "IMAGE-HIGH-RES",
            "@size": "61154",
            "@ref": "fx6",
            "@mimetype": "image/jpeg"
          },
          {
            "@category": "high",
            "@height": "886",
            "@width": "2213",
            "@_fa": "true",
            "$": "https://api.elsevier.com/content/object/eid/1-s2.0-S1381116916303983-fx7_lrg.jpg?httpAccept=%2A%2F%2A",
            "@multimediatype": "JPEG image file",
            "@type": "IMAGE-HIGH-RES",
            "@size": "56800",
            "@ref": "fx7",
            "@mimetype": "image/jpeg"
          },
          {
            "@category": "high",
            "@height": "886",
            "@width": "2213",
            "@_fa": "true",
            "$": "https://api.elsevier.com/content/object/eid/1-s2.0-S1381116916303983-fx8_lrg.jpg?httpAccept=%2A%2F%2A",
            "@multimediatype": "JPEG image file",
            "@type": "IMAGE-HIGH-RES",
            "@size": "57411",
            "@ref": "fx8",
            "@mimetype": "image/jpeg"
          },
          {
            "@category": "high",
            "@height": "886",
            "@width": "2213",
            "@_fa": "true",
            "$": "https://api.elsevier.com/content/object/eid/1-s2.0-S1381116916303983-fx9_lrg.jpg?httpAccept=%2A%2F%2A",
            "@multimediatype": "JPEG image file",
            "@type": "IMAGE-HIGH-RES",
            "@size": "61337",
            "@ref": "fx9",
            "@mimetype": "image/jpeg"
          },
          {
            "@category": "high",
            "@height": "2049",
            "@width": "2500",
            "@_fa": "true",
            "$": "https://api.elsevier.com/content/object/eid/1-s2.0-S1381116916303983-gr1_lrg.jpg?httpAccept=%2A%2F%2A",
            "@multimediatype": "JPEG image file",
            "@type": "IMAGE-HIGH-RES",
            "@size": "461384",
            "@ref": "gr1",
            "@mimetype": "image/jpeg"
          },
          {
            "@category": "high",
            "@height": "1896",
            "@width": "1667",
            "@_fa": "true",
            "$": "https://api.elsevier.com/content/object/eid/1-s2.0-S1381116916303983-gr2_lrg.jpg?httpAccept=%2A%2F%2A",
            "@multimediatype": "JPEG image file",
            "@type": "IMAGE-HIGH-RES",
            "@size": "155288",
            "@ref": "gr2",
            "@mimetype": "image/jpeg"
          },
          {
            "@category": "high",
            "@height": "1035",
            "@width": "1667",
            "@_fa": "true",
            "$": "https://api.elsevier.com/content/object/eid/1-s2.0-S1381116916303983-gr3_lrg.jpg?httpAccept=%2A%2F%2A",
            "@multimediatype": "JPEG image file",
            "@type": "IMAGE-HIGH-RES",
            "@size": "83937",
            "@ref": "gr3",
            "@mimetype": "image/jpeg"
          },
          {
            "@category": "high",
            "@height": "729",
            "@width": "1667",
            "@_fa": "true",
            "$": "https://api.elsevier.com/content/object/eid/1-s2.0-S1381116916303983-gr4_lrg.jpg?httpAccept=%2A%2F%2A",
            "@multimediatype": "JPEG image file",
            "@type": "IMAGE-HIGH-RES",
            "@size": "96852",
            "@ref": "gr4",
            "@mimetype": "image/jpeg"
          },
          {
            "@category": "high",
            "@height": "1000",
            "@width": "1667",
            "@_fa": "true",
            "$": "https://api.elsevier.com/content/object/eid/1-s2.0-S1381116916303983-gr5_lrg.jpg?httpAccept=%2A%2F%2A",
            "@multimediatype": "JPEG image file",
            "@type": "IMAGE-HIGH-RES",
            "@size": "116469",
            "@ref": "gr5",
            "@mimetype": "image/jpeg"
          },
          {
            "@category": "high",
            "@height": "1104",
            "@width": "917",
            "@_fa": "true",
            "$": "https://api.elsevier.com/content/object/eid/1-s2.0-S1381116916303983-gr6_lrg.jpg?httpAccept=%2A%2F%2A",
            "@multimediatype": "JPEG image file",
            "@type": "IMAGE-HIGH-RES",
            "@size": "64009",
            "@ref": "gr6",
            "@mimetype": "image/jpeg"
          },
          {
            "@category": "high",
            "@height": "944",
            "@width": "1667",
            "@_fa": "true",
            "$": "https://api.elsevier.com/content/object/eid/1-s2.0-S1381116916303983-gr7_lrg.jpg?httpAccept=%2A%2F%2A",
            "@multimediatype": "JPEG image file",
            "@type": "IMAGE-HIGH-RES",
            "@size": "365548",
            "@ref": "gr7",
            "@mimetype": "image/jpeg"
          },
          {
            "@category": "high",
            "@height": "1021",
            "@width": "1667",
            "@_fa": "true",
            "$": "https://api.elsevier.com/content/object/eid/1-s2.0-S1381116916303983-gr8_lrg.jpg?httpAccept=%2A%2F%2A",
            "@multimediatype": "JPEG image file",
            "@type": "IMAGE-HIGH-RES",
            "@size": "114357",
            "@ref": "gr8",
            "@mimetype": "image/jpeg"
          },
          {
            "@category": "high",
            "@height": "917",
            "@width": "2167",
            "@_fa": "true",
            "$": "https://api.elsevier.com/content/object/eid/1-s2.0-S1381116916303983-sc1_lrg.jpg?httpAccept=%2A%2F%2A",
            "@multimediatype": "JPEG image file",
            "@type": "IMAGE-HIGH-RES",
            "@size": "111354",
            "@ref": "sc1",
            "@mimetype": "image/jpeg"
          },
          {
            "@category": "standard",
            "@_fa": "true",
            "$": "https://api.elsevier.com/content/object/eid/1-s2.0-S1381116916303983-mmc1.doc?httpAccept=%2A%2F%2A",
            "@multimediatype": "Microsoft Word file",
            "@type": "APPLICATION",
            "@size": "235008",
            "@ref": "mmc1",
            "@mimetype": "application/word"
          }
        ]
      },
      "link": {
        "@rel": "abstract",
        "@href": "https://api.elsevier.com/content/abstract/scopus_id/84988531200"
      }
    }
  }
}