{
  "metadata": {
    "title": "Chiral Ru complex immobilized on mesoporous materials by ionic liquids as heterogeneous catalysts for hydrogenation of aromatic ketones",
    "authors": "; ; ",
    "journal": "Journal of Molecular Catalysis A: Chemical",
    "date": "2010-12-01",
    "doi": "10.1016/j.molcata.2010.08.018",
    "abstract": "",
    "uri": "https://api.elsevier.com/content/article/pii/S1381116910003584",
    "pii": "S1381116910003584"
  },
  "fulltext": {
    "full-text-retrieval-response": {
      "scopus-eid": "2-s2.0-78649636612",
      "originalText": "serial JL 271358 291210 291744 291790 291809 31 Journal of Molecular Catalysis A: Chemical JOURNALMOLECULARCATALYSISACHEMICAL 2010-09-25 2010-09-25 2010-11-26T22:28:45 1-s2.0-S1381116910003584 S1381-1169(10)00358-4 S1381116910003584 10.1016/j.molcata.2010.08.018 S300 S300.1 FULL-TEXT 1-s2.0-S1381116910X00164 2015-05-15T05:56:33.607047-04:00 0 0 20101201 2010 2010-09-25T00:00:00Z articleinfo crossmark dco dateupdated tomb dateloaded datesearch indexeddate issuelist volumelist yearnav absattachment articletitlenorm authfirstinitialnorm authfirstsurnamenorm cid cids contenttype copyright dateloadedtxt docsubtype doctype doi eid ewtransactionid hubeid issfirst issn issnnorm itemstage itemtransactionid itemweight openaccess openarchive pg pgfirst pglast pii piinorm pubdatestart pubdatetxt pubyr sectiontitle sortorder srctitle srctitlenorm srctype subheadings volfirst volissue webpdf webpdfpagecount figure table body acknowledge affil articletitle auth authfirstini authfull authkeywords authlast primabst ref specialabst alllist content subj ssids 1381-1169 13811169 333 333 1 2 1 2 Volume 333, Issues 1–2 7 20 27 20 27 20101201 1 December 2010 2010-12-01 2010 Regular papers article fla Copyright © 2010 Elsevier B.V. All rights reserved. CHIRALRUCOMPLEXIMMOBILIZEDMESOPOROUSMATERIALSBYIONICLIQUIDSHETEROGENEOUSCATALYSTSFORHYDROGENATIONAROMATICKETONES LOU L 1 Introduction 2 Experimental 2.1 General 2.2 Synthesis of ionic liquids 2.2.1 Synthesis of ionic liquid [bmim][BF4] 2.2.2 Synthesis of ionic liquid 1-methyl-3-(3-triethoxysilylpropyl)-imidazolium tetrafluoroborate ([Simim][BF4]) 2.3 Synthesis of immobilized chiral Ru catalysts 2.3.1 Synthesis of chiral Ru complex C1 2.3.2 Synthesis of ionic liquid modified supports (BF4-X) 2.3.3 Heterogenization of chiral Ru complex C1 2.4 Asymmetric hydrogenation of aromatic ketone 3 Results and discussion 3.1 Material characterization 3.2 Catalytic tests 3.2.1 Effects of reaction conditions on the asymmetric hydrogenation reaction 3.2.2 Asymmetric hydrogenation of aromatic ketones with different catalysts 3.2.3 Catalyst recycling and stability 4 Conclusions Acknowledgements References WELTON 1999 2071 2083 T WASSERSCHEID 2000 3772 3789 P SHI 2004 179 186 F LEE 2006 1049 1063 S MEHNERT 2002 12932 12933 C MEHNERT 2005 50 56 C RIISAGER 2006 91 102 A RIISAGER 2006 695 706 A SIEVERS 2006 13990 13991 C CHEN 2007 13879 13886 W RIISAGER 2003 452 455 A RIISAGER 2005 815 819 A YANG 2005 220 221 Y MEHNERT 2002 3010 3011 C HUANG 2004 1397 1399 J RODRIGUEZPEREZ 2008 4201 4203 L LOU 2008 1891 1893 L HAGIWARA 2004 2325 2328 H BREITENLECHNER 2004 175 179 S JIMENEZ 2006 2974 2976 O SHI 2005 225 230 F LOU 2006 6513 6516 L NOYORI 2001 40 73 R OHKUMA 1995 2675 2676 T OHKUMA 1998 13529 13530 T DOUCET 1998 1703 1707 H OHKUMA 2000 6510 6511 T XIE 2003 4404 4405 J SANDOVAL 2003 13490 13503 C FAN 2002 3385 3466 Q LI 2004 419 492 C TRINDADE 2009 418 514 A SONG 2002 3495 3524 C CARPENTIER 1995 39 42 J VANKELECOM 1996 1346 1348 I JAMIS 2001 37 43 J GHOSH 2004 386 396 A GU 2009 817 847 Y GRUTTADAURIA 2004 6113 6116 M GRUTTADAURIA 2006 82 92 M DIOOS 2006 217 219 B KRESGE 1992 710 712 C ZHAO 1998 548 552 D WILKES 1982 1263 1264 J SUAREZ 1996 1217 1219 P XIA 2005 132 138 Y JING 2005 1193 1197 Q LOUX2010X20 LOUX2010X20X27 LOUX2010X20XL LOUX2010X20X27XL item S1381-1169(10)00358-4 S1381116910003584 1-s2.0-S1381116910003584 10.1016/j.molcata.2010.08.018 271358 2010-11-29T14:37:22.543852-05:00 2010-12-01 1-s2.0-S1381116910003584-main.pdf https://s3.amazonaws.com/prod-ucs-content-store-us-east/content/pii:S1381116910003584/MAIN/application/pdf/dc3a30ee5a237f877d86244e75625eec/main.pdf https://s3-eu-west-1.amazonaws.com/prod-ucs-content-store-eu-west/content/pii:S1381116910003584/MAIN/application/pdf/dc3a30ee5a237f877d86244e75625eec/main.pdf main.pdf pdf true 573421 MAIN 8 1-s2.0-S1381116910003584-main_1.png https://s3-eu-west-1.amazonaws.com/prod-ucs-content-store-eu-west/content/pii:S1381116910003584/PREVIEW/image/png/62ad3859c49d1075dfabd3a72ba113f3/main_1.png https://s3.amazonaws.com/prod-ucs-content-store-us-east/content/pii:S1381116910003584/PREVIEW/image/png/62ad3859c49d1075dfabd3a72ba113f3/main_1.png main_1.png png 62130 849 656 IMAGE-WEB-PDF 1 1-s2.0-S1381116910003584-fx1.jpg https://s3.amazonaws.com/prod-ucs-content-store-us-east/content/pii:S1381116910003584/fx1/DOWNSAMPLED/image/jpeg/4d372f09e0c95c7bd2e909498fec8775/fx1.jpg https://s3-eu-west-1.amazonaws.com/prod-ucs-content-store-eu-west/content/pii:S1381116910003584/fx1/DOWNSAMPLED/image/jpeg/4d372f09e0c95c7bd2e909498fec8775/fx1.jpg fx1 true fx1.jpg jpg 11670 151 342 IMAGE-DOWNSAMPLED 1-s2.0-S1381116910003584-fx1.sml https://s3.amazonaws.com/prod-ucs-content-store-us-east/content/pii:S1381116910003584/fx1/THUMBNAIL/image/gif/8e1888b3cdfe9407d24c85968db4cc40/fx1.sml https://s3-eu-west-1.amazonaws.com/prod-ucs-content-store-eu-west/content/pii:S1381116910003584/fx1/THUMBNAIL/image/gif/8e1888b3cdfe9407d24c85968db4cc40/fx1.sml fx1 true fx1.sml sml 3618 97 219 IMAGE-THUMBNAIL 1-s2.0-S1381116910003584-fx1_lrg.jpg https://s3.amazonaws.com/prod-ucs-content-store-us-east/content/pii:S1381116910003584/fx1/HIGHRES/image/jpeg/cc36f177c03940a946d438819a815a13/fx1_lrg.jpg https://s3-eu-west-1.amazonaws.com/prod-ucs-content-store-eu-west/content/pii:S1381116910003584/fx1/HIGHRES/image/jpeg/cc36f177c03940a946d438819a815a13/fx1_lrg.jpg fx1 fx1_lrg.jpg jpg 47962 401 908 IMAGE-HIGH-RES 1-s2.0-S1381116910003584-fx2.jpg https://s3.amazonaws.com/prod-ucs-content-store-us-east/content/pii:S1381116910003584/fx2/DOWNSAMPLED/image/jpeg/cef6f8062be18c1b35f05d7a142223b2/fx2.jpg https://s3-eu-west-1.amazonaws.com/prod-ucs-content-store-eu-west/content/pii:S1381116910003584/fx2/DOWNSAMPLED/image/jpeg/cef6f8062be18c1b35f05d7a142223b2/fx2.jpg fx2 fx2.jpg jpg 6714 80 376 IMAGE-DOWNSAMPLED 1-s2.0-S1381116910003584-fx2.sml https://s3.amazonaws.com/prod-ucs-content-store-us-east/content/pii:S1381116910003584/fx2/THUMBNAIL/image/gif/21547de68199f32dc910600e9ad6064a/fx2.sml https://s3-eu-west-1.amazonaws.com/prod-ucs-content-store-eu-west/content/pii:S1381116910003584/fx2/THUMBNAIL/image/gif/21547de68199f32dc910600e9ad6064a/fx2.sml fx2 fx2.sml sml 2140 46 219 IMAGE-THUMBNAIL 1-s2.0-S1381116910003584-fx2_lrg.jpg https://s3.amazonaws.com/prod-ucs-content-store-us-east/content/pii:S1381116910003584/fx2/HIGHRES/image/jpeg/a122ab5a1b1e8f9bb9b79147b8447bbd/fx2_lrg.jpg https://s3-eu-west-1.amazonaws.com/prod-ucs-content-store-eu-west/content/pii:S1381116910003584/fx2/HIGHRES/image/jpeg/a122ab5a1b1e8f9bb9b79147b8447bbd/fx2_lrg.jpg fx2 fx2_lrg.jpg jpg 25800 212 1000 IMAGE-HIGH-RES 1-s2.0-S1381116910003584-gr1.jpg https://s3.amazonaws.com/prod-ucs-content-store-us-east/content/pii:S1381116910003584/gr1/DOWNSAMPLED/image/jpeg/9b7707dfd500b8b4782f80469d768984/gr1.jpg https://s3-eu-west-1.amazonaws.com/prod-ucs-content-store-eu-west/content/pii:S1381116910003584/gr1/DOWNSAMPLED/image/jpeg/9b7707dfd500b8b4782f80469d768984/gr1.jpg gr1 gr1.jpg jpg 50267 275 376 IMAGE-DOWNSAMPLED 1-s2.0-S1381116910003584-gr1.sml https://s3.amazonaws.com/prod-ucs-content-store-us-east/content/pii:S1381116910003584/gr1/THUMBNAIL/image/gif/6dc4b023b15fddd42a95eef7c0985546/gr1.sml https://s3-eu-west-1.amazonaws.com/prod-ucs-content-store-eu-west/content/pii:S1381116910003584/gr1/THUMBNAIL/image/gif/6dc4b023b15fddd42a95eef7c0985546/gr1.sml gr1 gr1.sml sml 6466 160 219 IMAGE-THUMBNAIL 1-s2.0-S1381116910003584-gr1_lrg.jpg https://s3.amazonaws.com/prod-ucs-content-store-us-east/content/pii:S1381116910003584/gr1/HIGHRES/image/jpeg/21e35d343cb1e3aab0066a33936334dc/gr1_lrg.jpg https://s3-eu-west-1.amazonaws.com/prod-ucs-content-store-eu-west/content/pii:S1381116910003584/gr1/HIGHRES/image/jpeg/21e35d343cb1e3aab0066a33936334dc/gr1_lrg.jpg gr1 gr1_lrg.jpg jpg 279576 1217 1667 IMAGE-HIGH-RES 1-s2.0-S1381116910003584-gr2.jpg https://s3.amazonaws.com/prod-ucs-content-store-us-east/content/pii:S1381116910003584/gr2/DOWNSAMPLED/image/jpeg/072ff296f1b5c14b27026c1513132d62/gr2.jpg https://s3-eu-west-1.amazonaws.com/prod-ucs-content-store-eu-west/content/pii:S1381116910003584/gr2/DOWNSAMPLED/image/jpeg/072ff296f1b5c14b27026c1513132d62/gr2.jpg gr2 gr2.jpg jpg 45579 541 671 IMAGE-DOWNSAMPLED 1-s2.0-S1381116910003584-gr2.sml https://s3.amazonaws.com/prod-ucs-content-store-us-east/content/pii:S1381116910003584/gr2/THUMBNAIL/image/gif/ec3a92da9b44b443f08db300f4534b2a/gr2.sml https://s3-eu-west-1.amazonaws.com/prod-ucs-content-store-eu-west/content/pii:S1381116910003584/gr2/THUMBNAIL/image/gif/ec3a92da9b44b443f08db300f4534b2a/gr2.sml gr2 gr2.sml sml 4566 164 203 IMAGE-THUMBNAIL 1-s2.0-S1381116910003584-gr2_lrg.jpg https://s3.amazonaws.com/prod-ucs-content-store-us-east/content/pii:S1381116910003584/gr2/HIGHRES/image/jpeg/44eb8de4cd35411f20ac42128dfabf1b/gr2_lrg.jpg https://s3-eu-west-1.amazonaws.com/prod-ucs-content-store-eu-west/content/pii:S1381116910003584/gr2/HIGHRES/image/jpeg/44eb8de4cd35411f20ac42128dfabf1b/gr2_lrg.jpg gr2 gr2_lrg.jpg jpg 184543 1439 1784 IMAGE-HIGH-RES 1-s2.0-S1381116910003584-gr3.jpg https://s3.amazonaws.com/prod-ucs-content-store-us-east/content/pii:S1381116910003584/gr3/DOWNSAMPLED/image/jpeg/683ae037e18878534edbc34a2bf77bed/gr3.jpg https://s3-eu-west-1.amazonaws.com/prod-ucs-content-store-eu-west/content/pii:S1381116910003584/gr3/DOWNSAMPLED/image/jpeg/683ae037e18878534edbc34a2bf77bed/gr3.jpg gr3 gr3.jpg jpg 87031 526 659 IMAGE-DOWNSAMPLED 1-s2.0-S1381116910003584-gr3.sml https://s3.amazonaws.com/prod-ucs-content-store-us-east/content/pii:S1381116910003584/gr3/THUMBNAIL/image/gif/1b3ce42b5c5565285fe52fcea9b58a20/gr3.sml https://s3-eu-west-1.amazonaws.com/prod-ucs-content-store-eu-west/content/pii:S1381116910003584/gr3/THUMBNAIL/image/gif/1b3ce42b5c5565285fe52fcea9b58a20/gr3.sml gr3 gr3.sml sml 7451 164 205 IMAGE-THUMBNAIL 1-s2.0-S1381116910003584-gr3_lrg.jpg https://s3.amazonaws.com/prod-ucs-content-store-us-east/content/pii:S1381116910003584/gr3/HIGHRES/image/jpeg/5aa93c05d418e5b1cf1a22f72bbc95b7/gr3_lrg.jpg https://s3-eu-west-1.amazonaws.com/prod-ucs-content-store-eu-west/content/pii:S1381116910003584/gr3/HIGHRES/image/jpeg/5aa93c05d418e5b1cf1a22f72bbc95b7/gr3_lrg.jpg gr3 gr3_lrg.jpg jpg 369898 1398 1750 IMAGE-HIGH-RES 1-s2.0-S1381116910003584-gr4.jpg https://s3.amazonaws.com/prod-ucs-content-store-us-east/content/pii:S1381116910003584/gr4/DOWNSAMPLED/image/jpeg/abcfeb960227d377ce40dc084291abef/gr4.jpg https://s3-eu-west-1.amazonaws.com/prod-ucs-content-store-eu-west/content/pii:S1381116910003584/gr4/DOWNSAMPLED/image/jpeg/abcfeb960227d377ce40dc084291abef/gr4.jpg gr4 gr4.jpg jpg 24277 317 392 IMAGE-DOWNSAMPLED 1-s2.0-S1381116910003584-gr4.sml https://s3.amazonaws.com/prod-ucs-content-store-us-east/content/pii:S1381116910003584/gr4/THUMBNAIL/image/gif/e21fcb00e3b8d7415bcae91a5d3a977b/gr4.sml https://s3-eu-west-1.amazonaws.com/prod-ucs-content-store-eu-west/content/pii:S1381116910003584/gr4/THUMBNAIL/image/gif/e21fcb00e3b8d7415bcae91a5d3a977b/gr4.sml gr4 gr4.sml sml 5176 164 202 IMAGE-THUMBNAIL 1-s2.0-S1381116910003584-gr4_lrg.jpg https://s3.amazonaws.com/prod-ucs-content-store-us-east/content/pii:S1381116910003584/gr4/HIGHRES/image/jpeg/80bf2996eb1f392850c6e79f174a262e/gr4_lrg.jpg https://s3-eu-west-1.amazonaws.com/prod-ucs-content-store-eu-west/content/pii:S1381116910003584/gr4/HIGHRES/image/jpeg/80bf2996eb1f392850c6e79f174a262e/gr4_lrg.jpg gr4 gr4_lrg.jpg jpg 99122 843 1041 IMAGE-HIGH-RES 1-s2.0-S1381116910003584-gr5.jpg https://s3.amazonaws.com/prod-ucs-content-store-us-east/content/pii:S1381116910003584/gr5/DOWNSAMPLED/image/jpeg/4fd807664c1f63512669a4a636293ea0/gr5.jpg https://s3-eu-west-1.amazonaws.com/prod-ucs-content-store-eu-west/content/pii:S1381116910003584/gr5/DOWNSAMPLED/image/jpeg/4fd807664c1f63512669a4a636293ea0/gr5.jpg gr5 gr5.jpg jpg 28852 262 693 IMAGE-DOWNSAMPLED 1-s2.0-S1381116910003584-gr5.sml https://s3.amazonaws.com/prod-ucs-content-store-us-east/content/pii:S1381116910003584/gr5/THUMBNAIL/image/gif/a0de8f004528f52aae63ab5b1939a4bb/gr5.sml https://s3-eu-west-1.amazonaws.com/prod-ucs-content-store-eu-west/content/pii:S1381116910003584/gr5/THUMBNAIL/image/gif/a0de8f004528f52aae63ab5b1939a4bb/gr5.sml gr5 gr5.sml sml 3223 83 219 IMAGE-THUMBNAIL 1-s2.0-S1381116910003584-gr5_lrg.jpg https://s3.amazonaws.com/prod-ucs-content-store-us-east/content/pii:S1381116910003584/gr5/HIGHRES/image/jpeg/ce7e58dbc1aa279af29410ce4648259f/gr5_lrg.jpg https://s3-eu-west-1.amazonaws.com/prod-ucs-content-store-eu-west/content/pii:S1381116910003584/gr5/HIGHRES/image/jpeg/ce7e58dbc1aa279af29410ce4648259f/gr5_lrg.jpg gr5 gr5_lrg.jpg jpg 115849 695 1841 IMAGE-HIGH-RES 1-s2.0-S1381116910003584-gr6.jpg https://s3.amazonaws.com/prod-ucs-content-store-us-east/content/pii:S1381116910003584/gr6/DOWNSAMPLED/image/jpeg/8af626c72f933270db642a1f2822ffb0/gr6.jpg https://s3-eu-west-1.amazonaws.com/prod-ucs-content-store-eu-west/content/pii:S1381116910003584/gr6/DOWNSAMPLED/image/jpeg/8af626c72f933270db642a1f2822ffb0/gr6.jpg gr6 gr6.jpg jpg 23180 297 377 IMAGE-DOWNSAMPLED 1-s2.0-S1381116910003584-gr6.sml https://s3.amazonaws.com/prod-ucs-content-store-us-east/content/pii:S1381116910003584/gr6/THUMBNAIL/image/gif/9ad5efd14466ffb55039df9a5edf680d/gr6.sml https://s3-eu-west-1.amazonaws.com/prod-ucs-content-store-eu-west/content/pii:S1381116910003584/gr6/THUMBNAIL/image/gif/9ad5efd14466ffb55039df9a5edf680d/gr6.sml gr6 gr6.sml sml 4844 164 208 IMAGE-THUMBNAIL 1-s2.0-S1381116910003584-gr6_lrg.jpg https://s3.amazonaws.com/prod-ucs-content-store-us-east/content/pii:S1381116910003584/gr6/HIGHRES/image/jpeg/d04f563ab16f4c982802faadd2db2a03/gr6_lrg.jpg https://s3-eu-west-1.amazonaws.com/prod-ucs-content-store-eu-west/content/pii:S1381116910003584/gr6/HIGHRES/image/jpeg/d04f563ab16f4c982802faadd2db2a03/gr6_lrg.jpg gr6 gr6_lrg.jpg jpg 86489 788 1001 IMAGE-HIGH-RES 1-s2.0-S1381116910003584-sc1.jpg https://s3.amazonaws.com/prod-ucs-content-store-us-east/content/pii:S1381116910003584/sc1/DOWNSAMPLED/image/jpeg/204b7cf65c25ca2bf7fb9b73f79505d7/sc1.jpg https://s3-eu-west-1.amazonaws.com/prod-ucs-content-store-eu-west/content/pii:S1381116910003584/sc1/DOWNSAMPLED/image/jpeg/204b7cf65c25ca2bf7fb9b73f79505d7/sc1.jpg sc1 sc1.jpg jpg 34584 178 520 IMAGE-DOWNSAMPLED 1-s2.0-S1381116910003584-sc1.sml https://s3.amazonaws.com/prod-ucs-content-store-us-east/content/pii:S1381116910003584/sc1/THUMBNAIL/image/gif/bdc3bd9217d0bb3baf2f6bd7495d52e0/sc1.sml https://s3-eu-west-1.amazonaws.com/prod-ucs-content-store-eu-west/content/pii:S1381116910003584/sc1/THUMBNAIL/image/gif/bdc3bd9217d0bb3baf2f6bd7495d52e0/sc1.sml sc1 sc1.sml sml 2490 75 219 IMAGE-THUMBNAIL 1-s2.0-S1381116910003584-sc1_lrg.jpg https://s3.amazonaws.com/prod-ucs-content-store-us-east/content/pii:S1381116910003584/sc1/HIGHRES/image/jpeg/d43260580897b3d65060d041411d0147/sc1_lrg.jpg https://s3-eu-west-1.amazonaws.com/prod-ucs-content-store-eu-west/content/pii:S1381116910003584/sc1/HIGHRES/image/jpeg/d43260580897b3d65060d041411d0147/sc1_lrg.jpg sc1 sc1_lrg.jpg jpg 196684 788 2301 IMAGE-HIGH-RES 1-s2.0-S1381116910003584-sc2.jpg https://s3.amazonaws.com/prod-ucs-content-store-us-east/content/pii:S1381116910003584/sc2/DOWNSAMPLED/image/jpeg/818fc909bf06ea5b15ea14f171cef2ff/sc2.jpg https://s3-eu-west-1.amazonaws.com/prod-ucs-content-store-eu-west/content/pii:S1381116910003584/sc2/DOWNSAMPLED/image/jpeg/818fc909bf06ea5b15ea14f171cef2ff/sc2.jpg sc2 sc2.jpg jpg 7920 109 391 IMAGE-DOWNSAMPLED 1-s2.0-S1381116910003584-sc2.sml https://s3.amazonaws.com/prod-ucs-content-store-us-east/content/pii:S1381116910003584/sc2/THUMBNAIL/image/gif/a63e2e9b44603c809ff1c0a08177731e/sc2.sml https://s3-eu-west-1.amazonaws.com/prod-ucs-content-store-eu-west/content/pii:S1381116910003584/sc2/THUMBNAIL/image/gif/a63e2e9b44603c809ff1c0a08177731e/sc2.sml sc2 sc2.sml sml 2414 61 219 IMAGE-THUMBNAIL 1-s2.0-S1381116910003584-sc2_lrg.jpg https://s3.amazonaws.com/prod-ucs-content-store-us-east/content/pii:S1381116910003584/sc2/HIGHRES/image/jpeg/687402469ed874cea2d98fbad15aedad/sc2_lrg.jpg https://s3-eu-west-1.amazonaws.com/prod-ucs-content-store-eu-west/content/pii:S1381116910003584/sc2/HIGHRES/image/jpeg/687402469ed874cea2d98fbad15aedad/sc2_lrg.jpg sc2 sc2_lrg.jpg jpg 33179 289 1040 IMAGE-HIGH-RES MOLCAA 7923 S1381-1169(10)00358-4 10.1016/j.molcata.2010.08.018 Elsevier B.V. Fig. 1 Supported ionic liquid phase catalyst BF4-X/C1 for asymmetric hydrogenation of aromatic ketone. Fig. 2 Powder XRD patterns of parent support, BF4-X and BF4-X/C1: (A) X =41, (B) X =15, and (C) X =48. Fig. 3 N2 adsorption–desorption isotherms of parent support, BF4-X and BF4-X/C1: (A) X =48, (B) X =41, (C) X =15, and (D) X =Si. Fig. 4 Representative FT-IR spectra of (a) MCM-41 and (b) BF4-41. Fig. 5 Conversions (left) and ee values (right) in the repeated experiments of acetophenone hydrogenation over the four immobilized catalysts. Fig. 6 DR UV–vis spectra of (a) Ru complex C1, (b) fresh catalyst BF4-Si/C1, (c) used catalyst Re-BF4-Si/C1, and (d) BF4-Si. Scheme 1 The synthesis of ionic liquid modified supports BF4-X. Scheme 2 The synthesis of chiral Ru complex C1. Table 1 Physico-chemical properties of BF4-X, BF4-X/C1 and the parent mesoporous supports. Sample S BET (m2/g) Pore volume (cm3/g) Pore diameter (Å) a Content of N (mmol/g) MCM-41 822 0.77 28.8 – BF4-41 669 0.46 26.3 1.41 BF4-41/C1 372 0.31 18.8 – MCM-48 1188 0.96 26.4 – BF4-48 969 0.67 24.5 1.21 BF4-48/C1 459 0.23 20.1 – SBA-15 813 1.11 62.3 – BF4-15 413 0.60 60.0 1.23 BF4-15/C1 232 0.42 59.2 – SiO2 347 0.93 86.0 – BF4-Si 276 0.71 82.5 1.08 BF4-Si/C1 74 0.28 80.8 – a The most probable pore diameter. Table 2 Influence of reaction temperature on asymmetric hydrogenation of acetophenone. a Entry Temperature (K) Conv. (%) b ee (%) c 1 273 14 80(R) 2 283 66 78(R) 3 293 100 78(R) 4 308 100 76(R) 5 323 100 61(R) a Reactions were performed in isopropanol under 3.0MPa of H2 for 6h using BF4-48/C1 with acetophenone/Ru/KOH=1:0.005:0.1. b Conversion % determined by GC with chiral column. c The ee value of the chiral product was determined by GC with BETA-DEX 325 chiral column and calculated from the expression: ee (%)=100×(R − S)/(R + S), where R and S are the molar fractions of the respective enantiomers. Table 3 Influence of reaction time on asymmetric hydrogenation of acetophenone. a Entry Time (h) Conv. (%) ee (%) 1 1 15 78(R) 2 2 43 76(R) 3 4 82 75(R) 4 6 100 78(R) 5 10 100 77(R) a Reaction temperature: 293K, other conditions were the same as those in Table 2. Table 4 Influence of H2 pressure on asymmetric hydrogenation of acetophenone. a Entry H2 pressure (MPa) Conv. (%) ee (%) 1 0.5 29 73(R) 2 1.0 72 74(R) 3 2.0 99 77(R) 4 3.0 100 78(R) 5 5.0 100 76(R) a Reaction temperature: 293K, reaction time: 6h, other conditions were the same as those in Table 2. Table 5 Asymmetric catalytic hydrogenation of aromatic ketones by different catalysts. a . Entry Ketone Catalyst Conv. (%) ee (%) 1 R=H C1 100 78(R) 2 R=H BF4-48/C1 100 78(R) 3 R=H BF4-41/C1 100 72(R) 4 R=H BF4-15/C1 100 72(R) 5 R=H BF4-Si/C1 100 77(R) 6 R=Cl C1 99 66(R) 7 R=Cl BF4-48/C1 99 64(R) 8 R=F C1 97 45(R) 9 R=F BF4-48/C1 98 48(R) a Reaction temperature: 293K, reaction time: 6h, H2 pressure: 3.0MPa, other conditions were the same as those in Table 2. Chiral Ru complex immobilized on mesoporous materials by ionic liquids as heterogeneous catalysts for hydrogenation of aromatic ketones Lan-Lan Lou a Yanling Dong a Kai Yu b Shu Jiang a Yang Song a Song Cao a Shuangxi Liu a ⁎ a Institute of New Catalytic Materials Science and Key Laboratory of Advanced Energy Materials Chemistry (Ministry of Education), College of Chemistry, Nankai University, Tianjin 300071, China b College of Environmental Science and Engineering, Nankai University, Tianjin 300071, China ⁎ Corresponding author. Tel.: +86 22 23509005; fax: +86 22 23509005. Graphical abstract . The chiral Ru catalysts immobilized in the mesoporous material-supported ionic liquid phase were highly active, enantioselective and stable for the asymmetric hydrogenation of aromatic ketones. Research highlights ▶ Chiral Ru complex was immobilized on mesoporous materials by ionic liquids. ▶ Immobilized catalysts showed as high catalytic performance as homogeneous one. ▶ Immobilized catalysts were stable and could be easily recovered for reuse. ▶ Both the two ionic liquids contributed to the high stability of immobilized catalyst. Four kinds of mesoporous material-supported ionic liquid phase catalysts containing chiral Ru complex were synthesized using mesoporous MCM-41, MCM-48, SBA-15 and amorphous SiO2, respectively. The results of N2 sorption and XRD indicated the successful immobilization of chiral Ru complex inside the channels of the mesoporous materials. These immobilized catalysts were evaluated in the asymmetric hydrogenation of aromatic ketones and the reaction conditions were optimized. Comparable catalytic activities and enantioselectivities to those of nonimmobilized counterpart were obtained. Moreover, all the four catalysts were stable and could be easily recovered for reuse for at least four times without obvious decrease in conversions and ee values. Especially, the SiO2-based catalyst still preserved high activity and enantioselectivity in the fifth run. The comparison experiments indicated that the two kinds of ionic liquids in the heterogeneous catalyst were beneficial to the enhancement of the stability of active species. Keywords Supported ionic liquid catalysis Chiral Ru complex Mesoporous silicate Enantioselective hydrogenation Aromatic ketone 1 Introduction Ionic liquids have received considerable attention as attractive mediums in the catalytic processes over the last decade [1,2]. Many organic reactions have been reported to proceed in ionic liquids or biphasic ionic liquid systems [3,4]. Although immobilization of homogeneous catalysts in biphasic reaction systems allowed effective separation of products and catalysts, a considerable amount of ionic liquid is always required in such system. In view of economic and possible toxicological concerns, it is desirable to minimize the amount of ionic liquid in a potential process while at the same time allowing a facile recovery of the catalyst. A relatively new approach fulfilling such a demand has recently been reported by using supported ionic liquid phases to immobilize homogeneous catalysts [5–10]. As described by Mehnert et al. [5,6], the concept of supported ionic liquid catalysis involves the covalent attachment of a monolayer of ionic liquid and the adsorption of multiple layers of free ionic liquid on the surface of a support material. The catalytic reaction is carried out in the multiple layers where the homogeneous catalyst is dissolved. The immobilized catalyst thus combines the advantages of ionic liquid phases with those of solid supports, and the amount of utilized ionic liquid is significantly reduced. Some studies have successfully used this concept in various catalytic processes, such as olefin hydroformylation [5,11–13], hydrogenation [14–17], Heck reaction [18], hydroamination [19,20], carbonylation [21], and epoxidation [22]. Asymmetric hydrogenation of prochiral ketones is one of the most important methods for the synthesis of enantiomerically pure secondary alcohols, which are valuable building blocks and intermediates for the manufacture of pharmaceuticals and advanced materials [23]. The chiral RuCl2(diphosphine)(1,2-diamine) complexes, of which the most attractive is Noyori's catalyst [RuCl2((R)-BINAP)((R,R)-DPEN)] (BINAP=2,2′-bis-(diarylphosphino)-1,1′-binaphthyl; DPEN=1,2-diphenylethylene-diamine), combined with a base and isopropanol, have proved to be highly efficient for the asymmetric homogeneous hydrogenation of simple ketones [23–29]. However, the high cost of the noble metal and chiral ligand, as well as the difficulties in the separation of the products from the reaction system and the recovery of the catalysts often hinder their practical applications. Thus the immobilization of such homogeneous catalysts has attracted much attention in the last decade due to easy catalyst separation and recovery [30–33]. Unfortunately, in most cases the heterogeneous chiral catalysts always provide lower activities and/or enantioselectivities as compared to those observed for their homogeneous counterparts [33–37]. Herein we employed the supported ionic liquid phase as carrier media to immobilize chiral ruthenium complex composed of a chiral diamine and an achiral monophosphine, with the aim to develop a cheaper, more active, enantioselective and recyclable heterogeneous catalyst for asymmetric hydrogenation of prochiral ketones. A few researches have successfully applied the concept of supported ionic liquid catalysis in asymmetric catalytic systems [38]. The organocatalyst l-proline was immobilized in a SiO2-supported ionic liquid phase, and comparable yields and enantiomeric excess (ee) values with respect to the homogeneous catalysis were obtained in aldol reactions between acetone and aromatic aldehydes [39,40]. Dioos and Jacobs [41] immobilized a dimeric Cr(salen) catalyst in ionic liquids onto the surface of SiO2, and the resulting material showed better reactivity and selectivity for asymmetric ring-opening reactions of epoxides than the Cr(salen) complex immobilized by impregnation. An MCM-48 supported ionic liquid phase catalyst containing chiral Mn(salen) complex was previously reported by our group [22], and the catalytic system exhibited comparable activity and higher enantioselectivity for the asymmetric epoxidation of olefins than the homogeneous counterpart. In the present work, the chiral ruthenium complex containing a cheap achiral monophosphine [RuCl2(PPh3)2(S,S-DPEN)] was prepared and immobilized in the ionic liquid [bmim][BF4] (bmim=1-butyl-3-methylimidazolium), which was confined on the surface of imidazolium-based ionic liquid modified mesoporous silicates, including MCM-48, MCM-41, SBA-15, and amorphous SiO2. The obtained materials were employed as efficient catalysts for the asymmetric hydrogenation of aromatic ketones, and the effects of various reaction conditions on the catalytic performance were studied in detail. It was found that all of these immobilized catalysts exhibited comparable catalytic activity and enantioselectivity to those of homogeneous counterpart, and they could be recycled at least four times with no obvious decrease in catalytic performance. 2 Experimental 2.1 General 3-Chloropropyltriethoxysilane (95%), Pluronic P123 (EO20-PO70-EO20, 30wt% PEG) and 1-methylimidazole (≥99%) were purchased from Aldrich. (1S,2S)-(+)-1,2-Diphenylethylenediamine (S,S-DPEN, ≥97%, ≥99% ee) was obtained by Likai Chiral Tech. Co. Ltd. in Chengdu. Acetophenone (99%) was provided by Kermel Chemical Reagent Co. Ltd. in Tianjin. o-Chloroacetophenone (>99%) and o-fluoroacetophenone (>98.5%) were purchased from Jintan Kingun Chemical Factory. Tris(triphenylphosphine)ruthenium(II) chloride [RuCl2(PPh3)3] (≥99.9%) was supplied by Shaanxi Kaida Chemical Engineering Co. Ltd. Cetyltrimethylammonium bromide (CTAB, 99%), tetraethyl orthosilicate (TEOS, AR), 1-chlorobutane (>99%) and NaBF4 (AR) were provided by Jiangtian Chemical Technology Co. Ltd. in Tianjin. The hydrogen gas used in the hydrogenation experiments was of 99.99% purity and was supplied by Tianjin Skarn Gas Co., Ltd. The highly ordered siliceous mesoporous materials MCM-41 and MCM-48 were synthesized according to the literature method [42], using CTAB as template and TEOS as silica source. The purely siliceous SBA-15 was synthesized using a triblock organic copolymer Pluronic P123 as template and TEOS as silica source [43]. Amorphous SiO2 was purchased from YuMinYuan silica-gel reagent factory. All of the solvents used in the present work were dried over 4A molecular sieves before use. 1H and 13C{1H} NMR spectra were obtained on a Varian Mercury Vx-300 spectrometer, 300MHz for 1H and 75MHz for 13C, respectively. The elemental analysis of C, H and N was performed on a PerkinElmer 240C analyzer. XRD patterns were recorded on an Rigaku D/max-2500 diffractometer with Cu Kα radiation at 40kV and 100mA. FT-IR spectra were carried out on a Bruker Vector 22 spectrometer using KBr pellets. N2 adsorption–desorption analysis was done at 77K on a Micromeritics TriStar 3000 apparatus. The specific surface areas were determined by the BET (Brunauer–Emmett–Teller) equation using adsorption data in the relative pressure range from 0.05 to 0.2, and the pore size distributions were estimated using the BJH (Barret–Joyner–Halenda) model. The content of Ru leaching in the reaction solution was determined by inductively coupled plasma-atomic emission spectrometry (ICP-AES) on an ICP-9000(N+M) spectrometer (TJA Co.). Diffuse-reflectance UV–vis (DR UV–vis) spectra were obtained on a Jasco V-570 UV–vis spectrophotometer in the range of 220–800nm. The products of hydrogenation reaction were determined by gas chromatography (GC) on a Rock GC7800 gas chromatograph equipped with a flame ionization detector and a chiral capillary column (BETA-DEX 325, 30m×0.25mm×0.25μm), using ultrapure nitrogen as a carrier gas. The injection and detector temperatures were set at 523K and 513K, respectively, and the column temperature was programmed in the range of 373–393K (10min hold at 373K, 1K/min from 373K to 393K). The injection volume was 0.2μL using a split ratio of 1:50. 2.2 Synthesis of ionic liquids 2.2.1 Synthesis of ionic liquid [bmim][BF4] 1-Methylimidazole (4.0mL, 50mmol) and 1-chlorobutane (5.2mL, 50mmol) were stirred in air at 343K for 24h [44]. The reaction mixture was cooled to room temperature and then repeatedly washed with ethyl acetate (3× 20mL). The residual ethyl acetate was evaporated at 313K under reduced pressure, and the residue was dried under vacuum at 323K to give [bmim]Cl as a white crystalline solid. 1H NMR (CDCl3, 300MHz, Me4Si): δ (ppm) 0.93–0.98 (t, 3H, CH2CH 3), 1.34–1.42 (m, 2H, CH 2CH3), 1.84–1.94 (m, 2H, CH2CH 2CH2), 4.12 (s, 3H, NCH 3), 4.31–4.36 (t, 2H, NCH 2), 7.41 (s, 1H, NCH), 7.54 (s, 1H, NCH), 10.49 (s, 1H, NCHN). To a solution of [bmim]Cl (7.0g, 40mmol) in acetone (50mL) was added NaBF4 (5.1g, 46mmol) [45]. The resulting mixture was vigorously stirred at room temperature for 72h and then filtrated. The filtrate was evaporated at 303K under reduced pressure to remove acetone, and dried at 313K under vacuum to give [bmim][BF4] as a clear, pale yellow liquid, which was stored in a vacuum desiccator before use. 1H NMR (CDCl3, 300MHz, Me4Si): δ (ppm) 0.93–0.98 (t, 3H, CH2CH 3), 1.25–1.41 (m, 2H, CH 2CH3), 1.72–1.91 (m, 2H, CH2CH 2CH2), 3.96 (s, 3H, NCH 3), 4.16–4.21 (t, 2H, NCH 2), 7.28 (s, 1H, NCH), 7.32 (s, 1H, NCH), 8.83 (s, 1H, NCHN). 2.2.2 Synthesis of ionic liquid 1-methyl-3-(3-triethoxysilylpropyl)-imidazolium tetrafluoroborate ([Simim][BF4]) The ionic liquid [Simim][BF4] was obtained through the synthesis sequence given in Scheme 1 [37]. 1-Methylimidazole (3.0mL, 38mmol) was reacted with 3-chloropropyltriethoxysilane (9.1mL, 38mmol) at 368K under nitrogen atmosphere for 24h. The reaction mixture was cooled to room temperature and then washed completely with diethyl ether. After dried under vacuum at 303K, a slight yellow viscous liquid 1-methyl-3-(3-triethoxysilylpropyl)-imidazolium chloride ([Simim]Cl) was obtained. 1H NMR (CDCl3, 300MHz, Me4Si): δ (ppm) 0.59–0.65 (t, 2H, SiCH 2), 1.20–1.25 (t, 9H, CH2CH 3), 1.97–2.07 (m, 2H, CH2CH 2CH2), 3.79–3.86 (q, 6H, CH 2CH3), 4.13 (s, 3H, NCH 3), 4.32–4.37 (t, 2H, NCH 2), 7.26 (s, 2H, NCH), 11.01 (s, 1H, NCHN). To a solution of [Simim]Cl (9.7g, 30mmol) in acetone (40mL), NaBF4 (3.8g, 35mmol) was added slowly. The resulting mixture was vigorously stirred at room temperature for 72h and then filtrated. The liquid phase was evaporated at 303K under reduced pressure to remove acetone, and dried under vacuum at 313K to give [Simim][BF4] as a yellow viscous liquid, which was stored in a vacuum desiccator before use. 1H NMR (CDCl3, 300MHz, Me4Si): δ (ppm) 0.56–0.62 (t, 2H, SiCH 2), 1.20–1.25 (t, 9H, CH2CH 3), 1.95–2.05 (m, 2H, CH2CH 2CH2), 3.79–3.86 (q, 6H, CH 2CH3), 3.95 (s, 3H, NCH 3), 4.17–4.22 (t, 2H, NCH 2), 7.28 (s, 2H, NCH), 8.61 (s, 1H, NCHN). 2.3 Synthesis of immobilized chiral Ru catalysts 2.3.1 Synthesis of chiral Ru complex C1 The complex RuCl2(PPh3)2(S,S-DPEN) C1 was synthesized [46] by refluxing RuCl2(PPh3)3 (0.5g, 0.52mmol) with S,S-DPEN (0.11g, 0.52mmol) in CH2Cl2 (30mL) under nitrogen atmosphere for 5h and then stirring at room temperature for 15h (Scheme 2 ). 1H NMR (CDCl3, 300MHz, Me4Si): δ (ppm) 3.35 (m, 2H, NHH), 3.71 (m, 2H, NHH), 4.29 (m, 2H, CH), 6.82–7.54 (m, 40H, 6-H). 13C{1H} NMR (CDCl3, 75MHz, Me4Si): δ (ppm) 63.5, 127.1, 127.6, 128.0, 128.7, 129.2, 134.9, 136.1, 139.6. 2.3.2 Synthesis of ionic liquid modified supports (BF4-X) The pretreated mesoporous material (3.0g, dried under vacuum and heated to 393K overnight) was suspended in chloroform (50mL), and then ionic liquid [Simim][BF4] (1.5g, 4.0mmol) was added. The resulting mixture was refluxed under vigorous stirring for 26h, and then the white solid BF4-X (Scheme 1, X =48, 41, 15 and Si while MCM-48, MCM-41, SBA-15 and SiO2 was used as support material, respectively) was obtained by filtration, washed orderly with chloroform, acetone and diethyl ether, and Soxhlet-extracted with dichloromethane for 20h. The nitrogen contents of BF4-X determined by elemental analysis are shown in Table 1 . 2.3.3 Heterogenization of chiral Ru complex C1 Chiral Ru complex C1 (0.55mmol) and ionic liquid [bmim][BF4] (2.2mmol) were dissolved in acetone (50mL), and to the solution BF4-X (1.5g) was added. The resulting mixture was stirred at room temperature for 3h, and then evaporated under reduced pressure to remove the volatile components. The obtained heterogeneous catalysts were denoted as BF4-X/C1, and their structures are shown in Fig. 1 . 2.4 Asymmetric hydrogenation of aromatic ketone The heterogeneous catalysts BF4-X/C1 (0.01mmol, 0.5mol%), KOH (0.011g, 0.2mmol), isopropanol (10mL) and ketone (2mmol) were added to a 30mL stainless steel autoclave with a magnetic stirrer. The mixture was stirred at room temperature for 0.5h, followed by a purge with hydrogen for three times. Then hydrogen was introduced to the desired hydrogen pressure. After the reaction was completed, hydrogen was carefully released. The solid catalyst was recovered by filtration, washed thoroughly with isopropanol, and dried for reuse. The conversions and ee values were determined by gas chromatography with a chiral BETA-DEX 325 capillary column. 3 Results and discussion 3.1 Material characterization The structure information of all the solid materials was studied using powder XRD and N2 sorption. Fig. 2A and B shows the powder XRD patterns of parent supports MCM-41 and SBA-15, [Simim][BF4] modified supports BF4-41 and BF4-15, and the heterogeneous catalysts BF4-41/C1 and BF4-15/C1. On modification with ionic liquid [Simim][BF4], a slight decrease in the relative intensities of the XRD reflections was observed, but the well-resolved (110) and (200) reflections for BF4-41 and BF4-15 indicated that the mesoporous structure of the parent supports remained intact after the modification. Although the intensities of all peaks decreased after the immobilization of chiral Ru complex C1, the typical hexagonal structure of the parent supports was maintained. Fig. 2C shows the powder XRD patterns of MCM-48, BF4-48 and BF4-48/C1. A gradual decrease in the relative intensities of all peaks was observed on [Simim][BF4] modification and complex C1 immobilization, while the cubic mesostructure of MCM-48 was also preserved in the heterogeneous catalyst BF4-48/C1. Thus it can be confirmed from the XRD results that immobilization of ionic liquid [Simim][BF4] and Ru complex C1 did not destroy the structure of the support materials. All of the parent supports, [Simim][BF4] modified supports BF4-X and the corresponding heterogeneous catalysts BF4-X/C1 were characterized by N2 sorption. Fig. 3 shows the low-temperature N2 adsorption–desorption isotherms of these materials. It could be observed that all the samples exhibited type IV isotherms with well-defined sharp inflections characteristic for capillary condensation within mesopores. This indicated that the mesoporous structures of parent supports were preserved in the modified supports BF4-X and heterogeneous catalysts BF4-X/C1. Moreover, after modification with [Simim][BF4] and then immobilization of Ru complex on the parent support, the position of the inflection points gradually shifted to lower value of the relative pressure, indicating that the pore diameters of the material decreased gradually. Table 1 gives the textural parameters of all the samples calculated by N2 adsorption–desorption isotherms. It could be observed that BF4-X showed decreased BET surface area, pore volume, and pore size compared with the corresponding parent support. This suggests that ionic liquid [Simim][BF4] is mainly located inside the channels of the parent supports. A further decrease in BET surface area, pore volume, and pore size was observed after immobilization of chiral Ru complex C1 on BF4-X, indicating that the complex C1 lies mainly on the interior surfaces of BF4-X. The composition of the mesoporous material BF4-X was determined by FT-IR. Fig. 4 shows the representative FT-IR spectra in the scan range of 400–3500cm−1 for MCM-41 and [Simim][BF4] modified MCM-41 (BF4-41). In the spectrum of MCM-41, the IR bands presented at around 1080, 810, and 460cm−1 were assigned to characteristic vibrations of the Si–O–Si framework, and the band near 1630cm−1 was attributed to the O–H bending vibrations of adsorbed water. Besides these absorptions, the FT-IR spectrum of BF4-41 showed the specific absorptions of ionic liquid [Simim][BF4]. The IR bands at 3164 and 3120cm−1 were due to C–H stretching vibrations of aromatic imidazole rings, and the bands near 2900cm−1 could be attributed to C–H stretching vibrations of alkyl groups. The IR absorptions at 1574 and 1461cm−1 were assigned to CC stretching vibrations of imidazole rings and C–H deformation vibrations of alkyl groups, respectively. The band presented at 1169cm−1 could be attributed to C–H in-plane deformation vibrations of imidazole rings, and the absorption assigned to B–F stretching vibrations appeared at around 1055cm−1, which was overlapped by the Si–O–Si vibrations. The FT-IR spectra confirmed the successful modification of the mesoporous support with ionic liquid [Simim][BF4]. 3.2 Catalytic tests 3.2.1 Effects of reaction conditions on the asymmetric hydrogenation reaction The prepared heterogeneous catalysts BF4-X/C1 were evaluated in the asymmetric hydrogenation of aromatic ketones, which produced chiral secondary alcohols via a metal-ligand bifunctional mechanism [23,29]. The effects of reaction temperature, reaction time and hydrogen pressure on the catalytic performance were studied in detail using BF4-48/C1 as a model catalyst and acetophenone as a substrate in order to achieve suitable reaction conditions. As shown in Table 2 , the catalytic activity increases significantly with the increasing of reaction temperature, while the enantioselectivity decreases gradually. The conversion of acetophenone and the ee value of the products were 14% and 80% at 273K, respectively. 100% conversion was obtained when the reaction temperature was increased to 293K with an ee value of 78%. A further increase in reaction temperature to 323K led to a much lower ee value of 61%. Considering both catalytic activity and enantioselectivity, the reaction temperature 293K was suitable over the catalyst for asymmetric hydrogenation of acetophenone. Table 3 displays the effect of reaction time on the catalytic performance of BF4-48/C1 for acetophenone hydrogenation. Only 15% conversion was obtained for 1h; with the increase of reaction time, acetophenone conversion increased gradually while the ee value of the products changed marginally. After 6h the reaction achieved steady-state, the conversion and ee value reached 100% and 78%, respectively. The data listed in Table 4 indicated that hydrogen pressure has a great effect on the catalytic activity for asymmetric hydrogenation of acetophenone. The conversion increased from 29% to 100% when hydrogen pressure was increased from 0.5MPa to 3.0MPa. No obvious effect of hydrogen pressure on the enantioselectivity was observed. Thus the following reactions in this work were all performed under 3.0MPa of hydrogen. 3.2.2 Asymmetric hydrogenation of aromatic ketones with different catalysts The four immobilized catalysts were evaluated in the asymmetric hydrogenation of acetophenone. For comparison, the chiral Ru pre-catalyst C1 was also investigated under the same reaction conditions. The results are summarized in Table 5 . The homogeneous catalyst C1 exhibited 100% conversion and 78% ee, which are comparable to the literature report [47]. It could be observed that all the heterogeneous catalysts showed comparable conversions and ee values to the homogeneous counterpart. The high catalytic activities may be attributed to the homogeneous-like properties of the active species in ionic liquid phase on the mesoporous supports. Among these heterogeneous catalysts, BF4-48/C1 exhibited a slightly higher ee value of 78% than those obtained for BF4-41/C1 (72%) and BF4-15/C1 (72%), which could be due to the better confinement effect of the three-dimensional topological structure of MCM-48 than that of the one-dimensional channel of MCM-41 and SBA-15. The SiO2-based catalyst BF4-Si/C1 also provided a rather good enantioselectivity (77% ee) that might be attributed to the complicated channel structure of SiO2. Besides acetophenone, the immobilized catalysts also showed satisfactory catalytic activity and enantioselectivity for other aromatic ketones. As shown in Table 5, BF4-48/C1 gave comparable conversions and ee values to the homogeneous counterpart for the asymmetric hydrogenation of o-chloroacetophenone and o-fluoroacetophenone. 3.2.3 Catalyst recycling and stability To assess the stability and reusability of BF4-X/C1, recycling experiments were carried out with acetophenone as a substrate over the four heterogeneous catalysts. After each experiment, the catalyst was recovered by filtration, washed thoroughly with isopropanol, dried and then subjected to a new run with fresh reactants under identical hydrogenation conditions. The results are shown in Fig. 5 . It could be found that all the four heterogeneous catalysts showed no obvious decrease in catalytic activity and enantioselectivity for four runs. In the fifth cycle, the SiO2-based catalyst BF4-Si/C1 still maintained its catalytic performance with comparable conversion and ee value to the first run, while the other three kinds of catalysts exhibited an obvious decrease in activity. ICP-AES analysis showed no leaching of Ru in the filtrates for each recycle experiment, suggesting that the Ru complex C1 was effectively confined on the surface of mesoporous supports and the loss of activity observed in the three reused catalytic systems was not caused by catalyst leaching. The decrease of catalytic activity might be due to the blockage of some mesopore channels during the recycling experiments, which caused increased diffusional resistance and the inaccessibility of some active species located inside the channels. The higher stability of BF4-Si/C1 could be attributed to the larger pore size and complicated channel structure in SiO2 particles, which favors material transmission and makes it possible that the pore channels maintained intact after several runs. After five catalytic runs, the total turnover number (TON) of the immobilized catalyst BF4-Si/C1 (1000) was much higher than that of the corresponding homogeneous catalyst C1 (200), which could not be recycled after reaction. To clarify the role of ionic liquids in the heterogeneous catalyst system, two kinds of catalysts MCM-48/C1 (in which the Ru complex C1 and ionic liquid [bmim][BF4] were directly adsorbed onto unmodified MCM-48) and BF4-48′/C1 (in which C1 was immobilized onto [Simim][BF4] modified MCM-48 without the additional adsorbed ionic liquid [bmim][BF4]) were synthesized and evaluated in the asymmetric hydrogenation of acetophenone. The unmodified MCM-48 supported catalyst MCM-48/C1 exhibited comparable catalytic performance (100% conversion and 77% ee) to those of BF4-48/C1. However, it gave a much lower conversion (only 8%) when reused for the second time, indicating that the covalently anchored ionic liquid on the surface of mesoporous supports was of benefit to the stability of the heterogeneous catalyst system. Similar results were obtained by the catalyst BF4-48′/C1, 6% conversion was presented for the second run. Thus it could be concluded that the synergistic interaction between the two kinds of ionic liquids can significantly enhance the stability of heterogeneous catalyst. The heterogeneous catalyst Re-BF4-Si/C1, which was recovered after two cycles of acetophenone hydrogenation, was submitted to DR UV–vis analysis. As shown in Fig. 6 , the spectrum of Re-BF4-Si/C1 exhibited features similar to those of Ru complex C1 and fresh catalyst BF4-Si/C1. The characteristic absorption bands near 260, 310, 360 and 470nm for Ru complex C1 were all presented in the spectrum of Re-BF4-Si/C1. This indicated the maintenance of active Ru complex on the recovered catalyst. 4 Conclusions The chiral Ru complex composed of a chiral diamine and a cheap achiral monophosphine was successfully immobilized in ionic liquids onto the surface of four ionic liquid-modified mesoporous materials, i.e., MCM-41, MCM-48, SBA-15 and amorphous SiO2. These heterogeneous catalysts were highly active and enantioselective for the asymmetric hydrogenation of aromatic ketones, and comparable conversions and ee values to those of the homogeneous counterpart were obtained. Moreover, all the four catalysts were stable and recyclable, no obvious decrease in catalytic activity and enantioselectivity was observed after four runs. In particular, the SiO2-supported catalyst showed the best stability, comparable conversion and ee value (100% and 76%, respectively) to the homogeneous catalytic results could be obtained for the fifth run, thus providing a significantly higher TON (1000) than the homogeneous one (200). The comparison experiments showed that both the two kinds of ionic liquids in the catalytic system had great effects on the stability of the heterogeneous catalyst. Acknowledgements We gratefully acknowledge the support of this research by the National Natural Science Foundation of China (Grant. 20773069), the Specialized Research Fund for the Doctoral Program of Higher Education (Grant. 200800551017), and the Fundamental Research Funds for the Central Universities. References [1] T. Welton Chem. Rev. 99 1999 2071 2083 [2] P. Wasserscheid W. Keim Angew. Chem., Int. Ed. 39 2000 3772 3789 [3] F. Shi Y. Gu Q. Zhang Y. Deng Catal. Surv. Asia 8 2004 179 186 [4] S. Lee Chem. Commun. 2006 1049 1063 [5] C.P. Mehnert R.A. Cook N.C. Dispenziere M. Afeworki J. Am. Chem. Soc. 124 2002 12932 12933 [6] C.P. Mehnert Chem. Eur. J. 11 2005 50 56 [7] A. Riisager R. Fehrmann M. Haumann P. Wasserscheid Top. Catal. 40 2006 91 102 [8] A. Riisager R. Fehrmann M. Haumann P. Wasserscheid Eur. J. Inorg. Chem. 4 2006 695 706 [9] C. Sievers O. Jimenez T.E. Müller S. Steuernagel J.A. Lercher J. Am. Chem. Soc. 128 2006 13990 13991 [10] W. Chen Y. Zhang L. Zhu J. Lan R. Xie J. You J. Am. Chem. Soc. 129 2007 13879 13886 [11] A. Riisager P. Wasserscheid R. van Hal R. Fehrmann J. Catal. 219 2003 452 455 [12] A. Riisager R. Fehrmann S. Flicker R. van Hal M. Haumann P. Wasserscheid Angew. Chem., Int. Ed. 44 2005 815 819 [13] Y. Yang H. Lin C. Deng J. She Y. Yuan Chem. Lett. 34 2005 220 221 [14] C.P. Mehnert E.J. Mozeleski R.A. Cook Chem. Commun. 2002 3010 3011 [15] J. Huang T. Jiang H. Gao B. Han Z. Liu W. Wu Y. Chang G. Zhao Angew. Chem., Int. Ed. 43 2004 1397 1399 [16] L. Rodríguez-Pérez E. Teuma A. Falqui M. Gómez P. Serp Chem. Commun. 2008 4201 4203 [17] L.-L. Lou X. Peng K. Yu S. Liu Catal. Commun. 9 2008 1891 1893 [18] H. Hagiwara Y. Sugawara K. Isobe T. Hoshi T. Suzuki Org. Lett. 6 2004 2325 2328 [19] S. Breitenlechner M. Fleck T.E. Müller A. Suppan J. Mol. Catal. A: Chem. 214 2004 175 179 [20] O. Jimenez T.E. Müller C. Sievers A. Spirkl J.A. Lercher Chem. Commun. 2006 2974 2976 [21] F. Shi Q. Zhang Y. Gu Y. Deng Adv. Synth. Catal. 347 2005 225 230 [22] L.-L. Lou K. Yu F. Ding W. Zhou X. Peng S. Liu Tetrahedron Lett. 47 2006 6513 6516 [23] R. Noyori T. Ohkuma Angew. Chem., Int. Ed. 40 2001 40 73 [24] T. Ohkuma H. Ooka S. Hashiguchi T. Ikariya R. Noyori J. Am. Chem. Soc. 117 1995 2675 2676 [25] T. Ohkuma M. Koizumi H. Doucet T. Pham M. Kozawa K. Murata E. Katayama T. Yokozawa T. Ikariya R. Noyori J. Am. Chem. Soc. 120 1998 13529 13530 [26] H. Doucet T. Ohkuma K. Murata T. Yokozawa M. Kozawa E. Katayama A.F. England T. Ikariya R. Noyori Angew. Chem., Int. Ed. 37 1998 1703 1707 [27] T. Ohkuma D. Ishii H. Takeno R. Noyori J. Am. Chem. Soc. 122 2000 6510 6511 [28] J.-H. Xie L.-X. Wang Y. Fu S.-F. Zhu B.-M. Fan H.-F. Duan Q.-L. Zhou J. Am. Chem. Soc. 125 2003 4404 4405 [29] C.A. Sandoval T. Ohkuma K. Muñiz R. Noyori J. Am. Chem. Soc. 125 2003 13490 13503 [30] Q.-H. Fan Y.-M. Li A.S.C. Chan Chem. Rev. 102 2002 3385 3466 [31] C. Li Catal. Rev. Sci. Eng. 46 2004 419 492 [32] A.F. Trindade P.M.P. Gois C.A.M. Afonso Chem. Rev. 109 2009 418 514 [33] C.E. Song S. Lee Chem. Rev. 102 2002 3495 3524 [34] J.-F. Carpentier F. Agbossou A. Mortreux Tetrahedron: Asymm. 6 1995 39 42 [35] I.F.J. Vankelecom D. Tas R.F. Parton V.V. Vyver P.A. Jacobs Angew. Chem., Int. Ed. Engl. 35 1996 1346 1348 [36] J. Jamis J.R. Anderson R.S. Dickson E.M. Campi W.R. Jackson J. Organomet. Chem. 627 2001 37 43 [37] A. Ghosh R. Kumar J. Catal. 228 2004 386 396 [38] Y. Gu G. Li Adv. Synth. Catal. 351 2009 817 847 [39] M. Gruttadauria S. Riela P.L. Meo F. D’Anna R. Noto Tetrahedron Lett. 45 2004 6113 6116 [40] M. Gruttadauria S. Riela C. Aprile P.L. Meo F. D’Anna R. Noto Adv. Synth. Catal. 348 2006 82 92 [41] B.M.L. Dioos P.A. Jacobs J. Catal. 243 2006 217 219 [42] C.T. Kresge M.E. Leonowicz W.J. Roth J.C. Vartuli J.S. Beck Nature 359 1992 710 712 [43] D. Zhao J. Feng Q. Huo N. Melosh G.H. Fredrickson B.F. Chmelka G.D. Stucky Science 279 1998 548 552 [44] J.S. Wilkes J.A. Levisky R.A. Wilson C.L. Hussey Inorg. Chem. 21 1982 1263 1264 [45] P.A.Z. Suarez J.E.L. Dullius S. Einloft R.F. de Souza J. Dupont Polyhedron 15 1996 1217 1219 [46] Y.-Q. Xia Y.-Y. Tang Z.-M. Liang C.-B. Yu X.-G. Zhou R.-X. Li X.-J. Li J. Mol. Catal. A: Chem. 240 2005 132 138 [47] Q. Jing X. Zhang J. Sun K. Ding Adv. Synth. Catal. 347 2005 1193 1197",
      "scopus-id": "78649636612",
      "coredata": {
        "eid": "1-s2.0-S1381116910003584",
        "dc:description": "Four kinds of mesoporous material-supported ionic liquid phase catalysts containing chiral Ru complex were synthesized using mesoporous MCM-41, MCM-48, SBA-15 and amorphous SiO2, respectively. The results of N2 sorption and XRD indicated the successful immobilization of chiral Ru complex inside the channels of the mesoporous materials. These immobilized catalysts were evaluated in the asymmetric hydrogenation of aromatic ketones and the reaction conditions were optimized. Comparable catalytic activities and enantioselectivities to those of nonimmobilized counterpart were obtained. Moreover, all the four catalysts were stable and could be easily recovered for reuse for at least four times without obvious decrease in conversions and ee values. Especially, the SiO2-based catalyst still preserved high activity and enantioselectivity in the fifth run. The comparison experiments indicated that the two kinds of ionic liquids in the heterogeneous catalyst were beneficial to the enhancement of the stability of active species.",
        "openArchiveArticle": "false",
        "prism:coverDate": "2010-12-01",
        "openaccessUserLicense": null,
        "prism:aggregationType": "Journal",
        "prism:url": "https://api.elsevier.com/content/article/pii/S1381116910003584",
        "dc:creator": [
          {
            "@_fa": "true",
            "$": "Lou, Lan-Lan"
          },
          {
            "@_fa": "true",
            "$": "Dong, Yanling"
          },
          {
            "@_fa": "true",
            "$": "Yu, Kai"
          },
          {
            "@_fa": "true",
            "$": "Jiang, Shu"
          },
          {
            "@_fa": "true",
            "$": "Song, Yang"
          },
          {
            "@_fa": "true",
            "$": "Cao, Song"
          },
          {
            "@_fa": "true",
            "$": "Liu, Shuangxi"
          }
        ],
        "link": [
          {
            "@_fa": "true",
            "@rel": "self",
            "@href": "https://api.elsevier.com/content/article/pii/S1381116910003584"
          },
          {
            "@_fa": "true",
            "@rel": "scidir",
            "@href": "https://www.sciencedirect.com/science/article/pii/S1381116910003584"
          }
        ],
        "dc:format": "application/json",
        "openaccessType": null,
        "pii": "S1381-1169(10)00358-4",
        "prism:volume": "333",
        "prism:publisher": "Elsevier B.V.",
        "dc:title": "Chiral Ru complex immobilized on mesoporous materials by ionic liquids as heterogeneous catalysts for hydrogenation of aromatic ketones",
        "prism:copyright": "Copyright © 2010 Elsevier B.V. All rights reserved.",
        "openaccess": "0",
        "prism:issn": "13811169",
        "prism:issueIdentifier": "1-2",
        "dcterms:subject": [
          {
            "@_fa": "true",
            "$": "Supported ionic liquid catalysis"
          },
          {
            "@_fa": "true",
            "$": "Chiral Ru complex"
          },
          {
            "@_fa": "true",
            "$": "Mesoporous silicate"
          },
          {
            "@_fa": "true",
            "$": "Enantioselective hydrogenation"
          },
          {
            "@_fa": "true",
            "$": "Aromatic ketone"
          }
        ],
        "openaccessArticle": "false",
        "prism:publicationName": "Journal of Molecular Catalysis A: Chemical",
        "prism:number": "1-2",
        "openaccessSponsorType": null,
        "prism:pageRange": "20-27",
        "prism:endingPage": "27",
        "pubType": "fla",
        "prism:coverDisplayDate": "1 December 2010",
        "prism:doi": "10.1016/j.molcata.2010.08.018",
        "prism:startingPage": "20",
        "dc:identifier": "doi:10.1016/j.molcata.2010.08.018",
        "openaccessSponsorName": null
      },
      "objects": {
        "object": [
          {
            "@category": "standard",
            "@height": "151",
            "@width": "342",
            "@_fa": "true",
            "$": "https://api.elsevier.com/content/object/eid/1-s2.0-S1381116910003584-fx1.jpg?httpAccept=%2A%2F%2A",
            "@multimediatype": "JPEG image file",
            "@type": "IMAGE-DOWNSAMPLED",
            "@size": "11670",
            "@ref": "fx1",
            "@mimetype": "image/jpeg"
          },
          {
            "@category": "thumbnail",
            "@height": "97",
            "@width": "219",
            "@_fa": "true",
            "$": "https://api.elsevier.com/content/object/eid/1-s2.0-S1381116910003584-fx1.sml?httpAccept=%2A%2F%2A",
            "@multimediatype": "GIF image file",
            "@type": "IMAGE-THUMBNAIL",
            "@size": "3618",
            "@ref": "fx1",
            "@mimetype": "image/gif"
          },
          {
            "@category": "high",
            "@height": "401",
            "@width": "908",
            "@_fa": "true",
            "$": "https://api.elsevier.com/content/object/eid/1-s2.0-S1381116910003584-fx1_lrg.jpg?httpAccept=%2A%2F%2A",
            "@multimediatype": "JPEG image file",
            "@type": "IMAGE-HIGH-RES",
            "@size": "47962",
            "@ref": "fx1",
            "@mimetype": "image/jpeg"
          },
          {
            "@category": "standard",
            "@height": "80",
            "@width": "376",
            "@_fa": "true",
            "$": "https://api.elsevier.com/content/object/eid/1-s2.0-S1381116910003584-fx2.jpg?httpAccept=%2A%2F%2A",
            "@multimediatype": "JPEG image file",
            "@type": "IMAGE-DOWNSAMPLED",
            "@size": "6714",
            "@ref": "fx2",
            "@mimetype": "image/jpeg"
          },
          {
            "@category": "thumbnail",
            "@height": "46",
            "@width": "219",
            "@_fa": "true",
            "$": "https://api.elsevier.com/content/object/eid/1-s2.0-S1381116910003584-fx2.sml?httpAccept=%2A%2F%2A",
            "@multimediatype": "GIF image file",
            "@type": "IMAGE-THUMBNAIL",
            "@size": "2140",
            "@ref": "fx2",
            "@mimetype": "image/gif"
          },
          {
            "@category": "high",
            "@height": "212",
            "@width": "1000",
            "@_fa": "true",
            "$": "https://api.elsevier.com/content/object/eid/1-s2.0-S1381116910003584-fx2_lrg.jpg?httpAccept=%2A%2F%2A",
            "@multimediatype": "JPEG image file",
            "@type": "IMAGE-HIGH-RES",
            "@size": "25800",
            "@ref": "fx2",
            "@mimetype": "image/jpeg"
          },
          {
            "@category": "standard",
            "@height": "275",
            "@width": "376",
            "@_fa": "true",
            "$": "https://api.elsevier.com/content/object/eid/1-s2.0-S1381116910003584-gr1.jpg?httpAccept=%2A%2F%2A",
            "@multimediatype": "JPEG image file",
            "@type": "IMAGE-DOWNSAMPLED",
            "@size": "50267",
            "@ref": "gr1",
            "@mimetype": "image/jpeg"
          },
          {
            "@category": "thumbnail",
            "@height": "160",
            "@width": "219",
            "@_fa": "true",
            "$": "https://api.elsevier.com/content/object/eid/1-s2.0-S1381116910003584-gr1.sml?httpAccept=%2A%2F%2A",
            "@multimediatype": "GIF image file",
            "@type": "IMAGE-THUMBNAIL",
            "@size": "6466",
            "@ref": "gr1",
            "@mimetype": "image/gif"
          },
          {
            "@category": "high",
            "@height": "1217",
            "@width": "1667",
            "@_fa": "true",
            "$": "https://api.elsevier.com/content/object/eid/1-s2.0-S1381116910003584-gr1_lrg.jpg?httpAccept=%2A%2F%2A",
            "@multimediatype": "JPEG image file",
            "@type": "IMAGE-HIGH-RES",
            "@size": "279576",
            "@ref": "gr1",
            "@mimetype": "image/jpeg"
          },
          {
            "@category": "standard",
            "@height": "541",
            "@width": "671",
            "@_fa": "true",
            "$": "https://api.elsevier.com/content/object/eid/1-s2.0-S1381116910003584-gr2.jpg?httpAccept=%2A%2F%2A",
            "@multimediatype": "JPEG image file",
            "@type": "IMAGE-DOWNSAMPLED",
            "@size": "45579",
            "@ref": "gr2",
            "@mimetype": "image/jpeg"
          },
          {
            "@category": "thumbnail",
            "@height": "164",
            "@width": "203",
            "@_fa": "true",
            "$": "https://api.elsevier.com/content/object/eid/1-s2.0-S1381116910003584-gr2.sml?httpAccept=%2A%2F%2A",
            "@multimediatype": "GIF image file",
            "@type": "IMAGE-THUMBNAIL",
            "@size": "4566",
            "@ref": "gr2",
            "@mimetype": "image/gif"
          },
          {
            "@category": "high",
            "@height": "1439",
            "@width": "1784",
            "@_fa": "true",
            "$": "https://api.elsevier.com/content/object/eid/1-s2.0-S1381116910003584-gr2_lrg.jpg?httpAccept=%2A%2F%2A",
            "@multimediatype": "JPEG image file",
            "@type": "IMAGE-HIGH-RES",
            "@size": "184543",
            "@ref": "gr2",
            "@mimetype": "image/jpeg"
          },
          {
            "@category": "standard",
            "@height": "526",
            "@width": "659",
            "@_fa": "true",
            "$": "https://api.elsevier.com/content/object/eid/1-s2.0-S1381116910003584-gr3.jpg?httpAccept=%2A%2F%2A",
            "@multimediatype": "JPEG image file",
            "@type": "IMAGE-DOWNSAMPLED",
            "@size": "87031",
            "@ref": "gr3",
            "@mimetype": "image/jpeg"
          },
          {
            "@category": "thumbnail",
            "@height": "164",
            "@width": "205",
            "@_fa": "true",
            "$": "https://api.elsevier.com/content/object/eid/1-s2.0-S1381116910003584-gr3.sml?httpAccept=%2A%2F%2A",
            "@multimediatype": "GIF image file",
            "@type": "IMAGE-THUMBNAIL",
            "@size": "7451",
            "@ref": "gr3",
            "@mimetype": "image/gif"
          },
          {
            "@category": "high",
            "@height": "1398",
            "@width": "1750",
            "@_fa": "true",
            "$": "https://api.elsevier.com/content/object/eid/1-s2.0-S1381116910003584-gr3_lrg.jpg?httpAccept=%2A%2F%2A",
            "@multimediatype": "JPEG image file",
            "@type": "IMAGE-HIGH-RES",
            "@size": "369898",
            "@ref": "gr3",
            "@mimetype": "image/jpeg"
          },
          {
            "@category": "standard",
            "@height": "317",
            "@width": "392",
            "@_fa": "true",
            "$": "https://api.elsevier.com/content/object/eid/1-s2.0-S1381116910003584-gr4.jpg?httpAccept=%2A%2F%2A",
            "@multimediatype": "JPEG image file",
            "@type": "IMAGE-DOWNSAMPLED",
            "@size": "24277",
            "@ref": "gr4",
            "@mimetype": "image/jpeg"
          },
          {
            "@category": "thumbnail",
            "@height": "164",
            "@width": "202",
            "@_fa": "true",
            "$": "https://api.elsevier.com/content/object/eid/1-s2.0-S1381116910003584-gr4.sml?httpAccept=%2A%2F%2A",
            "@multimediatype": "GIF image file",
            "@type": "IMAGE-THUMBNAIL",
            "@size": "5176",
            "@ref": "gr4",
            "@mimetype": "image/gif"
          },
          {
            "@category": "high",
            "@height": "843",
            "@width": "1041",
            "@_fa": "true",
            "$": "https://api.elsevier.com/content/object/eid/1-s2.0-S1381116910003584-gr4_lrg.jpg?httpAccept=%2A%2F%2A",
            "@multimediatype": "JPEG image file",
            "@type": "IMAGE-HIGH-RES",
            "@size": "99122",
            "@ref": "gr4",
            "@mimetype": "image/jpeg"
          },
          {
            "@category": "standard",
            "@height": "262",
            "@width": "693",
            "@_fa": "true",
            "$": "https://api.elsevier.com/content/object/eid/1-s2.0-S1381116910003584-gr5.jpg?httpAccept=%2A%2F%2A",
            "@multimediatype": "JPEG image file",
            "@type": "IMAGE-DOWNSAMPLED",
            "@size": "28852",
            "@ref": "gr5",
            "@mimetype": "image/jpeg"
          },
          {
            "@category": "thumbnail",
            "@height": "83",
            "@width": "219",
            "@_fa": "true",
            "$": "https://api.elsevier.com/content/object/eid/1-s2.0-S1381116910003584-gr5.sml?httpAccept=%2A%2F%2A",
            "@multimediatype": "GIF image file",
            "@type": "IMAGE-THUMBNAIL",
            "@size": "3223",
            "@ref": "gr5",
            "@mimetype": "image/gif"
          },
          {
            "@category": "high",
            "@height": "695",
            "@width": "1841",
            "@_fa": "true",
            "$": "https://api.elsevier.com/content/object/eid/1-s2.0-S1381116910003584-gr5_lrg.jpg?httpAccept=%2A%2F%2A",
            "@multimediatype": "JPEG image file",
            "@type": "IMAGE-HIGH-RES",
            "@size": "115849",
            "@ref": "gr5",
            "@mimetype": "image/jpeg"
          },
          {
            "@category": "standard",
            "@height": "297",
            "@width": "377",
            "@_fa": "true",
            "$": "https://api.elsevier.com/content/object/eid/1-s2.0-S1381116910003584-gr6.jpg?httpAccept=%2A%2F%2A",
            "@multimediatype": "JPEG image file",
            "@type": "IMAGE-DOWNSAMPLED",
            "@size": "23180",
            "@ref": "gr6",
            "@mimetype": "image/jpeg"
          },
          {
            "@category": "thumbnail",
            "@height": "164",
            "@width": "208",
            "@_fa": "true",
            "$": "https://api.elsevier.com/content/object/eid/1-s2.0-S1381116910003584-gr6.sml?httpAccept=%2A%2F%2A",
            "@multimediatype": "GIF image file",
            "@type": "IMAGE-THUMBNAIL",
            "@size": "4844",
            "@ref": "gr6",
            "@mimetype": "image/gif"
          },
          {
            "@category": "high",
            "@height": "788",
            "@width": "1001",
            "@_fa": "true",
            "$": "https://api.elsevier.com/content/object/eid/1-s2.0-S1381116910003584-gr6_lrg.jpg?httpAccept=%2A%2F%2A",
            "@multimediatype": "JPEG image file",
            "@type": "IMAGE-HIGH-RES",
            "@size": "86489",
            "@ref": "gr6",
            "@mimetype": "image/jpeg"
          },
          {
            "@category": "standard",
            "@height": "178",
            "@width": "520",
            "@_fa": "true",
            "$": "https://api.elsevier.com/content/object/eid/1-s2.0-S1381116910003584-sc1.jpg?httpAccept=%2A%2F%2A",
            "@multimediatype": "JPEG image file",
            "@type": "IMAGE-DOWNSAMPLED",
            "@size": "34584",
            "@ref": "sc1",
            "@mimetype": "image/jpeg"
          },
          {
            "@category": "thumbnail",
            "@height": "75",
            "@width": "219",
            "@_fa": "true",
            "$": "https://api.elsevier.com/content/object/eid/1-s2.0-S1381116910003584-sc1.sml?httpAccept=%2A%2F%2A",
            "@multimediatype": "GIF image file",
            "@type": "IMAGE-THUMBNAIL",
            "@size": "2490",
            "@ref": "sc1",
            "@mimetype": "image/gif"
          },
          {
            "@category": "high",
            "@height": "788",
            "@width": "2301",
            "@_fa": "true",
            "$": "https://api.elsevier.com/content/object/eid/1-s2.0-S1381116910003584-sc1_lrg.jpg?httpAccept=%2A%2F%2A",
            "@multimediatype": "JPEG image file",
            "@type": "IMAGE-HIGH-RES",
            "@size": "196684",
            "@ref": "sc1",
            "@mimetype": "image/jpeg"
          },
          {
            "@category": "standard",
            "@height": "109",
            "@width": "391",
            "@_fa": "true",
            "$": "https://api.elsevier.com/content/object/eid/1-s2.0-S1381116910003584-sc2.jpg?httpAccept=%2A%2F%2A",
            "@multimediatype": "JPEG image file",
            "@type": "IMAGE-DOWNSAMPLED",
            "@size": "7920",
            "@ref": "sc2",
            "@mimetype": "image/jpeg"
          },
          {
            "@category": "thumbnail",
            "@height": "61",
            "@width": "219",
            "@_fa": "true",
            "$": "https://api.elsevier.com/content/object/eid/1-s2.0-S1381116910003584-sc2.sml?httpAccept=%2A%2F%2A",
            "@multimediatype": "GIF image file",
            "@type": "IMAGE-THUMBNAIL",
            "@size": "2414",
            "@ref": "sc2",
            "@mimetype": "image/gif"
          },
          {
            "@category": "high",
            "@height": "289",
            "@width": "1040",
            "@_fa": "true",
            "$": "https://api.elsevier.com/content/object/eid/1-s2.0-S1381116910003584-sc2_lrg.jpg?httpAccept=%2A%2F%2A",
            "@multimediatype": "JPEG image file",
            "@type": "IMAGE-HIGH-RES",
            "@size": "33179",
            "@ref": "sc2",
            "@mimetype": "image/jpeg"
          }
        ]
      },
      "link": {
        "@rel": "abstract",
        "@href": "https://api.elsevier.com/content/abstract/scopus_id/78649636612"
      }
    }
  }
}