{
  "metadata": {
    "title": "Hydrogenation of succinic acid to γ-butyrolactone and 1,4-butanediol over mesoporous rhenium–copper–carbon composite catalyst",
    "authors": "; ; ",
    "journal": "Journal of Molecular Catalysis A: Chemical",
    "date": "2014-12-31",
    "doi": "10.1016/j.molcata.2014.08.032",
    "abstract": "",
    "uri": "https://api.elsevier.com/content/article/pii/S1381116914003896",
    "pii": "S1381116914003896"
  },
  "fulltext": {
    "full-text-retrieval-response": {
      "scopus-eid": "2-s2.0-84907487397",
      "originalText": "serial JL 271358 291210 291744 291790 291809 31 Journal of Molecular Catalysis A: Chemical JOURNALMOLECULARCATALYSISACHEMICAL 2014-08-28 2014-08-28 2014-11-28T00:56:14 1-s2.0-S1381116914003896 S1381-1169(14)00389-6 S1381116914003896 10.1016/j.molcata.2014.08.032 S300 S300.1 FULL-TEXT 1-s2.0-S1381116914X00117 2022-06-20T12:14:38.593406Z 0 0 20141201 20141231 2014 2014-08-28T11:07:07.249575Z absattachment articleinfo articletitlenorm authfirstinitialnorm authfirstsurnamenorm cid cids contenttype copyright crossmark dateloaded dateloadedtxt datesearch datesort dateupdated dco docsubtype doctype doi eid ewtransactionid hubeid indexeddate issn issnnorm itemstage itemtransactionid itemweight openaccess openarchive pg pgfirst pglast pii piinorm pubdateend pubdatestart pubdatetxt pubyr sectiontitle sortorder srctitle srctitlenorm srctype ssids alllist content subj subheadings suppl tomb volfirst volissue volumelist webpdf webpdfpagecount yearnav figure table body mmlmath acknowledge affil articletitle auth authfirstini authfull authkeywords authlast grantnumber grantsponsor grantsponsorid highlightsabst primabst ref specialabst 1381-1169 13811169 true 395 395 C Volume 395 32 234 242 234 242 201412 December 2014 2014-12-01 2014-12-31 2014 Regular Papers article fla Copyright © 2014 Elsevier B.V. All rights reserved. HYDROGENATIONSUCCINICACIDBUTYROLACTONE14BUTANEDIOLOVERMESOPOROUSRHENIUMCOPPERCARBONCOMPOSITECATALYST KANG K 1 Introduction 2 Experimental 2.1 Preparation of catalysts 2.2 Characterization 2.3 Hydrogenation of succinic acid to GBL and BDO 3 Results and discussion 3.1 Physicochemical properties and crystalline structures of catalysts 3.2 Metal–support interaction of catalysts 3.3 Metal dispersion in the catalysts 3.4 Hydrogenation of succinic acid to GBL and BDO 3.5 Stability and reusability of catalysts 4 Conclusions Acknowledgements References ROTH 1966 421 428 R SEITZ 2005 285 292 M MORGAN 1997 166 168 M ZEIKUS 1999 545 552 J JUNG 2003 297 302 S BECHTHOLD 2008 647 654 I DELHOMME 2009 13 26 C GALLEZOT 2012 1538 1558 P DESHPANDE 2002 269 274 R LUQUE 2009 5305 5307 R ROSI 2010 1314 1322 L MINH 2010 1270 1273 D LY 2012 466 473 B CHUNG 2012 205 210 S CORBELDEMAILLY 2013 2388 2395 L HONG 2013 7448 7453 U TAUSTER 1978 170 175 S WERTHEIM 1985 377 381 G PLANEIX 1994 7935 7936 J HONG 2012 462 468 U HONG 2012 141 148 U HONG 2014 466 471 U KRUK 1996 282 288 M MATOS 2006 38 46 I GALARNEAU 2003 73 79 A LI 2007 1686 1695 Z WAGNER 1999 231 251 R TYSOE 1988 1 14 W ERTL 1980 49 64 G TYSON 1977 267 276 W HILLENBRAND 1965 249 252 L COLOMA 1996 63 80 F SHUKLA 1994 1517 1522 A ESPINOS 2002 6921 6929 J GILBERT 2000 391 397 M KANGX2014X234 KANGX2014X234X242 KANGX2014X234XK KANGX2014X234X242XK 2022-06-10T05:40:05.463Z http://vtw.elsevier.com/data/voc/AddOnTypes/50.7/aggregated-refined Ministry of Education, Science and Technology, Korea 20110031575 MEST Ministry of Education, Science and Technology http://data.elsevier.com/vocabulary/SciValFunders/501100004085 http://sws.geonames.org/1835841/ National Research Foundation NRF National Research Foundation of Korea http://data.elsevier.com/vocabulary/SciValFunders/501100003725 http://sws.geonames.org/1835841/ This work was supported by the Global Frontier R&amp;D Program on Center for Multiscale Energy System funded by the National Research Foundation under the Ministry of Education, Science and Technology, Korea ( 20110031575 ). item S1381-1169(14)00389-6 S1381116914003896 1-s2.0-S1381116914003896 10.1016/j.molcata.2014.08.032 271358 2014-11-27T22:02:26.64802-05:00 2014-12-01 2014-12-31 1-s2.0-S1381116914003896-main.pdf https://s3.amazonaws.com/prod-ucs-content-store-us-east/content/pii:S1381116914003896/MAIN/application/pdf/03244b8c4e023717a0d13d94ad478a2d/main.pdf https://s3-eu-west-1.amazonaws.com/prod-ucs-content-store-eu-west/content/pii:S1381116914003896/MAIN/application/pdf/03244b8c4e023717a0d13d94ad478a2d/main.pdf main.pdf pdf true 1980709 MAIN 9 1-s2.0-S1381116914003896-main_1.png https://s3.amazonaws.com/prod-ucs-content-store-us-east/content/pii:S1381116914003896/PREVIEW/image/png/a1f410516803b0c6db74dd1d337844e6/main_1.png https://s3-eu-west-1.amazonaws.com/prod-ucs-content-store-eu-west/content/pii:S1381116914003896/PREVIEW/image/png/a1f410516803b0c6db74dd1d337844e6/main_1.png main_1.png png 58568 849 656 IMAGE-WEB-PDF 1 1-s2.0-S1381116914003896-si2.gif https://s3.amazonaws.com/prod-ucs-content-store-us-east/content/pii:S1381116914003896/STRIPIN/image/gif/70e20504535b77375f9ee71da8ef802a/si2.gif https://s3-eu-west-1.amazonaws.com/prod-ucs-content-store-eu-west/content/pii:S1381116914003896/STRIPIN/image/gif/70e20504535b77375f9ee71da8ef802a/si2.gif si2 si2.gif gif 2221 62 317 ALTIMG 1-s2.0-S1381116914003896-si1.gif https://s3.amazonaws.com/prod-ucs-content-store-us-east/content/pii:S1381116914003896/STRIPIN/image/gif/49975ffcd980eb6436d288dc8ee7d44d/si1.gif https://s3-eu-west-1.amazonaws.com/prod-ucs-content-store-eu-west/content/pii:S1381116914003896/STRIPIN/image/gif/49975ffcd980eb6436d288dc8ee7d44d/si1.gif si1 si1.gif gif 2196 61 316 ALTIMG 1-s2.0-S1381116914003896-gr9_lrg.jpg https://s3.amazonaws.com/prod-ucs-content-store-us-east/content/pii:S1381116914003896/gr9/HIGHRES/image/jpeg/f021e28efba6c53aea9f38920457453f/gr9_lrg.jpg https://s3-eu-west-1.amazonaws.com/prod-ucs-content-store-eu-west/content/pii:S1381116914003896/gr9/HIGHRES/image/jpeg/f021e28efba6c53aea9f38920457453f/gr9_lrg.jpg gr9 gr9_lrg.jpg jpg 124812 1566 1554 IMAGE-HIGH-RES 1-s2.0-S1381116914003896-gr8_lrg.jpg https://s3.amazonaws.com/prod-ucs-content-store-us-east/content/pii:S1381116914003896/gr8/HIGHRES/image/jpeg/1f3456ca7e357a21cb190e3a8dac6404/gr8_lrg.jpg https://s3-eu-west-1.amazonaws.com/prod-ucs-content-store-eu-west/content/pii:S1381116914003896/gr8/HIGHRES/image/jpeg/1f3456ca7e357a21cb190e3a8dac6404/gr8_lrg.jpg gr8 gr8_lrg.jpg jpg 469394 1499 1500 IMAGE-HIGH-RES 1-s2.0-S1381116914003896-gr7_lrg.jpg https://s3.amazonaws.com/prod-ucs-content-store-us-east/content/pii:S1381116914003896/gr7/HIGHRES/image/jpeg/226c4d7cf7486b4b384613af8b20928f/gr7_lrg.jpg https://s3-eu-west-1.amazonaws.com/prod-ucs-content-store-eu-west/content/pii:S1381116914003896/gr7/HIGHRES/image/jpeg/226c4d7cf7486b4b384613af8b20928f/gr7_lrg.jpg gr7 gr7_lrg.jpg jpg 758844 1241 1863 IMAGE-HIGH-RES 1-s2.0-S1381116914003896-gr6_lrg.jpg https://s3.amazonaws.com/prod-ucs-content-store-us-east/content/pii:S1381116914003896/gr6/HIGHRES/image/jpeg/ee84f69f6a21d29dba00885459e6ef80/gr6_lrg.jpg https://s3-eu-west-1.amazonaws.com/prod-ucs-content-store-eu-west/content/pii:S1381116914003896/gr6/HIGHRES/image/jpeg/ee84f69f6a21d29dba00885459e6ef80/gr6_lrg.jpg gr6 gr6_lrg.jpg jpg 330189 1675 2833 IMAGE-HIGH-RES 1-s2.0-S1381116914003896-gr5_lrg.jpg https://s3.amazonaws.com/prod-ucs-content-store-us-east/content/pii:S1381116914003896/gr5/HIGHRES/image/jpeg/2acece4dc92abdbf39081f19313a8e64/gr5_lrg.jpg https://s3-eu-west-1.amazonaws.com/prod-ucs-content-store-eu-west/content/pii:S1381116914003896/gr5/HIGHRES/image/jpeg/2acece4dc92abdbf39081f19313a8e64/gr5_lrg.jpg gr5 gr5_lrg.jpg jpg 196860 1754 1733 IMAGE-HIGH-RES 1-s2.0-S1381116914003896-gr4_lrg.jpg https://s3.amazonaws.com/prod-ucs-content-store-us-east/content/pii:S1381116914003896/gr4/HIGHRES/image/jpeg/ba8ce8d046d183a1c617aa98eb5dbd83/gr4_lrg.jpg https://s3-eu-west-1.amazonaws.com/prod-ucs-content-store-eu-west/content/pii:S1381116914003896/gr4/HIGHRES/image/jpeg/ba8ce8d046d183a1c617aa98eb5dbd83/gr4_lrg.jpg gr4 gr4_lrg.jpg jpg 224958 1951 1733 IMAGE-HIGH-RES 1-s2.0-S1381116914003896-gr3_lrg.jpg https://s3.amazonaws.com/prod-ucs-content-store-us-east/content/pii:S1381116914003896/gr3/HIGHRES/image/jpeg/747721c1300b764db980281cb9092d01/gr3_lrg.jpg https://s3-eu-west-1.amazonaws.com/prod-ucs-content-store-eu-west/content/pii:S1381116914003896/gr3/HIGHRES/image/jpeg/747721c1300b764db980281cb9092d01/gr3_lrg.jpg gr3 gr3_lrg.jpg jpg 243568 1657 1669 IMAGE-HIGH-RES 1-s2.0-S1381116914003896-gr2_lrg.jpg https://s3.amazonaws.com/prod-ucs-content-store-us-east/content/pii:S1381116914003896/gr2/HIGHRES/image/jpeg/847746cb3f9f330e3080d598583a937d/gr2_lrg.jpg https://s3-eu-west-1.amazonaws.com/prod-ucs-content-store-eu-west/content/pii:S1381116914003896/gr2/HIGHRES/image/jpeg/847746cb3f9f330e3080d598583a937d/gr2_lrg.jpg gr2 gr2_lrg.jpg jpg 144289 415 1798 IMAGE-HIGH-RES 1-s2.0-S1381116914003896-gr10_lrg.jpg https://s3.amazonaws.com/prod-ucs-content-store-us-east/content/pii:S1381116914003896/gr10/HIGHRES/image/jpeg/1e007a58028c0d26f9050068dd0a05bd/gr10_lrg.jpg https://s3-eu-west-1.amazonaws.com/prod-ucs-content-store-eu-west/content/pii:S1381116914003896/gr10/HIGHRES/image/jpeg/1e007a58028c0d26f9050068dd0a05bd/gr10_lrg.jpg gr10 gr10_lrg.jpg jpg 109695 1459 1528 IMAGE-HIGH-RES 1-s2.0-S1381116914003896-gr1_lrg.jpg https://s3.amazonaws.com/prod-ucs-content-store-us-east/content/pii:S1381116914003896/gr1/HIGHRES/image/jpeg/ff76629b3e1d883dd22e86c2f76f72f8/gr1_lrg.jpg https://s3-eu-west-1.amazonaws.com/prod-ucs-content-store-eu-west/content/pii:S1381116914003896/gr1/HIGHRES/image/jpeg/ff76629b3e1d883dd22e86c2f76f72f8/gr1_lrg.jpg gr1 gr1_lrg.jpg jpg 143442 1272 2667 IMAGE-HIGH-RES 1-s2.0-S1381116914003896-fx1_lrg.jpg https://s3.amazonaws.com/prod-ucs-content-store-us-east/content/pii:S1381116914003896/fx1/HIGHRES/image/jpeg/ba32bcadf4351dd8fa5224964f63a97a/fx1_lrg.jpg https://s3-eu-west-1.amazonaws.com/prod-ucs-content-store-eu-west/content/pii:S1381116914003896/fx1/HIGHRES/image/jpeg/ba32bcadf4351dd8fa5224964f63a97a/fx1_lrg.jpg fx1 true fx1_lrg.jpg jpg 54047 886 880 IMAGE-HIGH-RES 1-s2.0-S1381116914003896-gr9.jpg https://s3.amazonaws.com/prod-ucs-content-store-us-east/content/pii:S1381116914003896/gr9/DOWNSAMPLED/image/jpeg/f677d6a4b5f0b58e6b5ae189b3bc30b9/gr9.jpg https://s3-eu-west-1.amazonaws.com/prod-ucs-content-store-eu-west/content/pii:S1381116914003896/gr9/DOWNSAMPLED/image/jpeg/f677d6a4b5f0b58e6b5ae189b3bc30b9/gr9.jpg gr9 gr9.jpg jpg 15617 354 351 IMAGE-DOWNSAMPLED 1-s2.0-S1381116914003896-gr8.jpg https://s3.amazonaws.com/prod-ucs-content-store-us-east/content/pii:S1381116914003896/gr8/DOWNSAMPLED/image/jpeg/df43690d2021222a37b3f7b24ae94687/gr8.jpg https://s3-eu-west-1.amazonaws.com/prod-ucs-content-store-eu-west/content/pii:S1381116914003896/gr8/DOWNSAMPLED/image/jpeg/df43690d2021222a37b3f7b24ae94687/gr8.jpg gr8 gr8.jpg jpg 82171 565 565 IMAGE-DOWNSAMPLED 1-s2.0-S1381116914003896-gr7.jpg https://s3.amazonaws.com/prod-ucs-content-store-us-east/content/pii:S1381116914003896/gr7/DOWNSAMPLED/image/jpeg/260a32f3a4d03a8fd78745eebc2b6b47/gr7.jpg https://s3-eu-west-1.amazonaws.com/prod-ucs-content-store-eu-west/content/pii:S1381116914003896/gr7/DOWNSAMPLED/image/jpeg/260a32f3a4d03a8fd78745eebc2b6b47/gr7.jpg gr7 gr7.jpg jpg 129125 467 701 IMAGE-DOWNSAMPLED 1-s2.0-S1381116914003896-gr6.jpg https://s3.amazonaws.com/prod-ucs-content-store-us-east/content/pii:S1381116914003896/gr6/DOWNSAMPLED/image/jpeg/46eeab702f5d56f9f1b29625f33c4e85/gr6.jpg https://s3-eu-west-1.amazonaws.com/prod-ucs-content-store-eu-west/content/pii:S1381116914003896/gr6/DOWNSAMPLED/image/jpeg/46eeab702f5d56f9f1b29625f33c4e85/gr6.jpg gr6 gr6.jpg jpg 38030 378 640 IMAGE-DOWNSAMPLED 1-s2.0-S1381116914003896-gr5.jpg https://s3.amazonaws.com/prod-ucs-content-store-us-east/content/pii:S1381116914003896/gr5/DOWNSAMPLED/image/jpeg/25589205f2801967db7a06bc10e97aac/gr5.jpg https://s3-eu-west-1.amazonaws.com/prod-ucs-content-store-eu-west/content/pii:S1381116914003896/gr5/DOWNSAMPLED/image/jpeg/25589205f2801967db7a06bc10e97aac/gr5.jpg gr5 gr5.jpg jpg 24046 396 391 IMAGE-DOWNSAMPLED 1-s2.0-S1381116914003896-gr4.jpg https://s3.amazonaws.com/prod-ucs-content-store-us-east/content/pii:S1381116914003896/gr4/DOWNSAMPLED/image/jpeg/97a70aa5254b1ee6bbfeb7ef380b4a68/gr4.jpg https://s3-eu-west-1.amazonaws.com/prod-ucs-content-store-eu-west/content/pii:S1381116914003896/gr4/DOWNSAMPLED/image/jpeg/97a70aa5254b1ee6bbfeb7ef380b4a68/gr4.jpg gr4 gr4.jpg jpg 25776 440 391 IMAGE-DOWNSAMPLED 1-s2.0-S1381116914003896-gr3.jpg https://s3.amazonaws.com/prod-ucs-content-store-us-east/content/pii:S1381116914003896/gr3/DOWNSAMPLED/image/jpeg/51d3f579cbcaf03d4d921bbb94114ac2/gr3.jpg https://s3-eu-west-1.amazonaws.com/prod-ucs-content-store-eu-west/content/pii:S1381116914003896/gr3/DOWNSAMPLED/image/jpeg/51d3f579cbcaf03d4d921bbb94114ac2/gr3.jpg gr3 gr3.jpg jpg 29362 374 377 IMAGE-DOWNSAMPLED 1-s2.0-S1381116914003896-gr2.jpg https://s3.amazonaws.com/prod-ucs-content-store-us-east/content/pii:S1381116914003896/gr2/DOWNSAMPLED/image/jpeg/b68a8ee830c3fc5ccaa10c153f81b58e/gr2.jpg https://s3-eu-west-1.amazonaws.com/prod-ucs-content-store-eu-west/content/pii:S1381116914003896/gr2/DOWNSAMPLED/image/jpeg/b68a8ee830c3fc5ccaa10c153f81b58e/gr2.jpg gr2 gr2.jpg jpg 36707 156 677 IMAGE-DOWNSAMPLED 1-s2.0-S1381116914003896-gr10.jpg https://s3.amazonaws.com/prod-ucs-content-store-us-east/content/pii:S1381116914003896/gr10/DOWNSAMPLED/image/jpeg/1ce83a3a9e2a7f9bf320b78926e57281/gr10.jpg https://s3-eu-west-1.amazonaws.com/prod-ucs-content-store-eu-west/content/pii:S1381116914003896/gr10/DOWNSAMPLED/image/jpeg/1ce83a3a9e2a7f9bf320b78926e57281/gr10.jpg gr10 gr10.jpg jpg 14214 329 345 IMAGE-DOWNSAMPLED 1-s2.0-S1381116914003896-gr1.jpg https://s3.amazonaws.com/prod-ucs-content-store-us-east/content/pii:S1381116914003896/gr1/DOWNSAMPLED/image/jpeg/d051051fbdefc322b9e8d1e3b20a7dc1/gr1.jpg https://s3-eu-west-1.amazonaws.com/prod-ucs-content-store-eu-west/content/pii:S1381116914003896/gr1/DOWNSAMPLED/image/jpeg/d051051fbdefc322b9e8d1e3b20a7dc1/gr1.jpg gr1 gr1.jpg jpg 16880 287 602 IMAGE-DOWNSAMPLED 1-s2.0-S1381116914003896-fx1.jpg https://s3.amazonaws.com/prod-ucs-content-store-us-east/content/pii:S1381116914003896/fx1/DOWNSAMPLED/image/jpeg/7e678a8af951374c3662a479486d5a3c/fx1.jpg https://s3-eu-west-1.amazonaws.com/prod-ucs-content-store-eu-west/content/pii:S1381116914003896/fx1/DOWNSAMPLED/image/jpeg/7e678a8af951374c3662a479486d5a3c/fx1.jpg fx1 true fx1.jpg jpg 7279 199 198 IMAGE-DOWNSAMPLED 1-s2.0-S1381116914003896-gr9.sml https://s3.amazonaws.com/prod-ucs-content-store-us-east/content/pii:S1381116914003896/gr9/THUMBNAIL/image/gif/f2d2b161ea674024331f49ba8cff0e7a/gr9.sml https://s3-eu-west-1.amazonaws.com/prod-ucs-content-store-eu-west/content/pii:S1381116914003896/gr9/THUMBNAIL/image/gif/f2d2b161ea674024331f49ba8cff0e7a/gr9.sml gr9 gr9.sml sml 3175 163 162 IMAGE-THUMBNAIL 1-s2.0-S1381116914003896-gr8.sml https://s3.amazonaws.com/prod-ucs-content-store-us-east/content/pii:S1381116914003896/gr8/THUMBNAIL/image/gif/de33984d51b139936763e80caad599ee/gr8.sml https://s3-eu-west-1.amazonaws.com/prod-ucs-content-store-eu-west/content/pii:S1381116914003896/gr8/THUMBNAIL/image/gif/de33984d51b139936763e80caad599ee/gr8.sml gr8 gr8.sml sml 11363 164 164 IMAGE-THUMBNAIL 1-s2.0-S1381116914003896-gr7.sml https://s3.amazonaws.com/prod-ucs-content-store-us-east/content/pii:S1381116914003896/gr7/THUMBNAIL/image/gif/beb34be37eda3fcb73176ae63001653e/gr7.sml https://s3-eu-west-1.amazonaws.com/prod-ucs-content-store-eu-west/content/pii:S1381116914003896/gr7/THUMBNAIL/image/gif/beb34be37eda3fcb73176ae63001653e/gr7.sml gr7 gr7.sml sml 8592 146 219 IMAGE-THUMBNAIL 1-s2.0-S1381116914003896-gr6.sml https://s3.amazonaws.com/prod-ucs-content-store-us-east/content/pii:S1381116914003896/gr6/THUMBNAIL/image/gif/737b21433f3912b475e275e9e1fa481f/gr6.sml https://s3-eu-west-1.amazonaws.com/prod-ucs-content-store-eu-west/content/pii:S1381116914003896/gr6/THUMBNAIL/image/gif/737b21433f3912b475e275e9e1fa481f/gr6.sml gr6 gr6.sml sml 4479 129 219 IMAGE-THUMBNAIL 1-s2.0-S1381116914003896-gr5.sml https://s3.amazonaws.com/prod-ucs-content-store-us-east/content/pii:S1381116914003896/gr5/THUMBNAIL/image/gif/5000c865b467c7e9fc79f0f70447c495/gr5.sml https://s3-eu-west-1.amazonaws.com/prod-ucs-content-store-eu-west/content/pii:S1381116914003896/gr5/THUMBNAIL/image/gif/5000c865b467c7e9fc79f0f70447c495/gr5.sml gr5 gr5.sml sml 3745 164 162 IMAGE-THUMBNAIL 1-s2.0-S1381116914003896-gr4.sml https://s3.amazonaws.com/prod-ucs-content-store-us-east/content/pii:S1381116914003896/gr4/THUMBNAIL/image/gif/dc50fff289ded15f08903c653845dbff/gr4.sml https://s3-eu-west-1.amazonaws.com/prod-ucs-content-store-eu-west/content/pii:S1381116914003896/gr4/THUMBNAIL/image/gif/dc50fff289ded15f08903c653845dbff/gr4.sml gr4 gr4.sml sml 3483 163 145 IMAGE-THUMBNAIL 1-s2.0-S1381116914003896-gr3.sml https://s3.amazonaws.com/prod-ucs-content-store-us-east/content/pii:S1381116914003896/gr3/THUMBNAIL/image/gif/5dad923805a533d99aea051086ac41e5/gr3.sml https://s3-eu-west-1.amazonaws.com/prod-ucs-content-store-eu-west/content/pii:S1381116914003896/gr3/THUMBNAIL/image/gif/5dad923805a533d99aea051086ac41e5/gr3.sml gr3 gr3.sml sml 4997 164 165 IMAGE-THUMBNAIL 1-s2.0-S1381116914003896-gr2.sml https://s3.amazonaws.com/prod-ucs-content-store-us-east/content/pii:S1381116914003896/gr2/THUMBNAIL/image/gif/8b8aec2dcdd911a78b7d59e202a3c68f/gr2.sml https://s3-eu-west-1.amazonaws.com/prod-ucs-content-store-eu-west/content/pii:S1381116914003896/gr2/THUMBNAIL/image/gif/8b8aec2dcdd911a78b7d59e202a3c68f/gr2.sml gr2 gr2.sml sml 3513 51 219 IMAGE-THUMBNAIL 1-s2.0-S1381116914003896-gr10.sml https://s3.amazonaws.com/prod-ucs-content-store-us-east/content/pii:S1381116914003896/gr10/THUMBNAIL/image/gif/c1f6238158484c0318c79580c1771243/gr10.sml https://s3-eu-west-1.amazonaws.com/prod-ucs-content-store-eu-west/content/pii:S1381116914003896/gr10/THUMBNAIL/image/gif/c1f6238158484c0318c79580c1771243/gr10.sml gr10 gr10.sml sml 5856 164 172 IMAGE-THUMBNAIL 1-s2.0-S1381116914003896-gr1.sml https://s3.amazonaws.com/prod-ucs-content-store-us-east/content/pii:S1381116914003896/gr1/THUMBNAIL/image/gif/b69c118b3671f6fc22419f3f15994e5d/gr1.sml https://s3-eu-west-1.amazonaws.com/prod-ucs-content-store-eu-west/content/pii:S1381116914003896/gr1/THUMBNAIL/image/gif/b69c118b3671f6fc22419f3f15994e5d/gr1.sml gr1 gr1.sml sml 2354 104 219 IMAGE-THUMBNAIL 1-s2.0-S1381116914003896-fx1.sml https://s3.amazonaws.com/prod-ucs-content-store-us-east/content/pii:S1381116914003896/fx1/THUMBNAIL/image/gif/03b85457ddb1d26da77372d12e705cef/fx1.sml https://s3-eu-west-1.amazonaws.com/prod-ucs-content-store-eu-west/content/pii:S1381116914003896/fx1/THUMBNAIL/image/gif/03b85457ddb1d26da77372d12e705cef/fx1.sml fx1 true fx1.sml sml 3274 164 163 IMAGE-THUMBNAIL MOLCAA 9247 S1381-1169(14)00389-6 10.1016/j.molcata.2014.08.032 Elsevier B.V. Fig. 1 Reaction pathways for hydrogenation of succinic acid to GBL and BDO via DMS. Fig. 2 Schematic procedures for the preparation of Re–Cu–MC composite catalyst. Fig. 3 Nitrogen adsorption–desorption isotherms of the catalysts (Re–Cu–MC, Re/Cu–MC, Cu/Re–MC, and Re–Cu/MC) and mesoporous carbon support (MC). Fig. 4 XRD patterns of the reduced catalysts (Re–Cu–MC, Re/Cu–MC, Cu/Re–MC, and Re–Cu/MC). Fig. 5 TPR profiles of the catalysts (Re–Cu–MC, Re/Cu–MC, Cu/Re–MC, and Re–Cu/MC). Fig. 6 XPS spectra of Re 4f7/2 and Cu 2p3/2 levels in the reduced catalysts (Re–Cu–MC, Re/Cu–MC, Cu/Re–MC, and Re–Cu/MC). Fig. 7 HR-TEM images of (a) MC, (b) Re–Cu–MC, (c) Re/Cu–MC, (d) Cu/Re–MC, and (e) Re–Cu/MC catalysts. The catalysts were reduced at 600°C. Fig. 8 STEM images ((a) and (c)) of reduced Re–Cu–MC catalyst and EDX images ((b) and (d)) obtained by mapping on rhenium and copper. Fig. 9 A correlation between average metal particle size of the catalysts and catalytic activity in the hydrogenation of succinic acid to GBL and BDO. Fig. 10 Results for liquid-phase hydrogenation of succinic acid over Re–Cu–MC and Re–Cu/MC catalysts with respect to recycle run at 200°C and 80bar for 20h. Table 1 Physicochemical properties of the catalysts (Re–Cu–MC, Re/Cu–MC, Cu/Re–MC, and Re–Cu/MC) and mesoporous carbon support (MC). Sample Re content (wt%) a Cu content (wt%) a Surface area (m2/g) b Pore volume (cm3/g) c Pore diameter (nm) d MC – – 1189 1.18 4.3 Re–Cu–MC 4.6 17.9 1169 1.04 3.6 Re/Cu–MC 4.8 18.0 898 0.86 3.8 Cu/Re–MC 4.8 18.6 624 0.64 4.1 Re–Cu/MC 4.7 18.4 555 0.62 4.4 a Determined by ICP-MS measurement. b Calculated by the BET equation. c Total pore volume (P/P 0 =0.990). d Average pore diameter. Table 2 Surface atomic ratios of the reduced catalysts (Re–Cu–MC, Re/Cu–MC, Cu/Re–MC, and Re–Cu/MC). Catalyst Cu/Re a Re/C Cu/C (Re+Cu)/C Re–Cu–MC 10.6 (11.4) 0.0030 0.0319 0.0349 Re/Cu–MC 12.9 (11.0) 0.0025 0.0321 0.0346 Cu/Re–MC 9.1 (11.4) 0.0032 0.0291 0.0323 Re–Cu/MC 10.8 (11.5) 0.0022 0.0238 0.0260 a Values in parentheses indicate the bulk atomic ratios determined by ICP-MS measurement. Table 3 CO chemisorption results for the reduced catalysts (Re–Cu–MC, Re/Cu–MC, Cu/Re–MC, and Re–Cu/MC). Catalyst Metal surface area (m2/g) a Metal dispersion (%) a Average metal particle size (nm) a Re–Cu–MC 97.9 17.9 6.1 Re/Cu–MC 45.6 8.4 13.2 Cu/Re–MC 24.8 4.5 24.2 Re–Cu/MC 19.6 3.6 30.7 a Calculated by assuming a stoichiometry factor of CO/metal=1. Table 4 Performance of the catalysts (Re–Cu–MC, Re/Cu–MC, Cu/Re–MC, and Re–Cu/MC) in the liquid-phase hydrogenation of succinic acid to GBL and BDO at 200°C and 80bar for 20h. Catalyst Conversion of succinic acid (%) Yield (%) Total yield for GBL and BDO (%) TOF (h−1) a GBL BDO THF DMS Re–Cu–MC 100 22.5 19.4 3.2 53.6 41.9 14.1 Re/Cu–MC 100 18.5 16.2 2.8 55.4 34.7 13.5 Cu/Re–MC 100 19.7 9.3 3.0 63.1 29.0 13.8 Re–Cu/MC 100 13.9 6.5 1.0 66.2 20.4 13.8 a Calculated as moles of succinic acid converted per moles of surface metal atom per hour. Hydrogenation of succinic acid to γ-butyrolactone and 1,4-butanediol over mesoporous rhenium–copper–carbon composite catalyst Ki Hyuk Kang Ung Gi Hong Jin Oh Jun Ji Hwan Song Yongju Bang Jung Ho Choi Seung Ju Han In Kyu Song ⁎ School of Chemical and Biological Engineering, Institute of Chemical Processes, Seoul National University, Shinlim-dong, Kwanak-ku, Seoul 151-744, South Korea School of Chemical and Biological Engineering, Institute of Chemical Processes, Seoul National University Shinlim-dong, Kwanak-ku Seoul 151-744 South Korea ⁎ Corresponding author. Tel.: +82 2 880 9227; fax: +82 2 889 7415. Graphical abstract A mesoporous rhenium–copper–carbon composite catalyst (Re–Cu–MC) was prepared by a facile single-step surfactant-templating method. For comparison, a series of mesoporous carbon-supported catalysts (Re/Cu–MC, Cu/Re–MC, and Re–Cu/MC) were also prepared. The catalysts were applied to the liquid-phase hydrogenation of succinic acid to γ-butyrolactone (GBL) and 1,4-butanediol (BDO). The effect of preparation method on the physicochemical properties and catalytic activities of the catalysts was investigated. It was found that the catalysts based on metal–carbon composite (Re–Cu–MC, Re/Cu–MC, and Cu/Re–MC) were favorable for enhancing textural properties and metal–support interaction of the catalysts. Surface atomic ratios of metal species (Re/C and Cu/C) on the catalyst surface increased with increasing metal–support interaction. Yield for GBL and BDO increased with decreasing average metal particle size of the catalysts. It was revealed that metal particle size of the catalysts served as a key factor determining the catalytic activity and stability in the reaction. Among the catalysts tested, Re–Cu–MC catalyst with the smallest average metal particle size showed the best catalytic performance in the hydrogenation of succinic acid to GBL and BDO. Keywords Hydrogenation Succinic acid γ-Butyrolactone 1,4-Butandiol Mesoporous Re–Cu–carbon catalyst 1 Introduction γ-Butyrolactone (GBL) and 1,4-butanediol (BDO) have attracted much attention as important starting materials for petrochemical industries. GBL is a promising raw chemical for N-methyl-2-pyrrolidone (NMP) and 2-pyrrolidone in the pharmaceutical industry [1,2]. BDO is used as a key intermediate for engineering polymers such as polybutylene terephthalate (PBT) and polybutylene succinate (PBS) [3]. Traditionally, GBL and BDO have been produced by hydrogenation of maleic anhydride derived from petrochemical processes [4,5]. However, the use of limited fossil fuels has caused unstable price and environmental problem. Thus, researches for utilization of sustainable and renewable resources have been extensively investigated. With the development of biorefinery processes, succinic acid is recognized as one of the promising C4 platform chemicals that can replace maleic anhydride [6–8]. Therefore, conversion of succinic acid to GBL and BDO by catalytic hydrogenation has received recent attention [7,8]. For selective production of GBL and BDO from succinic acid, several metal catalysts have been reported [9–15]. However, noble metal catalysts such as Rh [10], Ru [11], and Pd [14] have been mainly used for hydrogenation of succinic acid to GBL. In addition, BDO production from succinic acid requires noble metal-based bimetallic catalysts such as Pd–Re [12,13] and Pt–Re [15]. Nonetheless, these catalysts are not still satisfactory for mass production of GBL and BDO through hydrogenation of succinic acid. To overcome these problems, we have previously reported a bifunctional metal catalyst supported on mesoporous carbon, which contained rhenium and copper [16]. Interestingly, this catalyst showed a considerable catalytic activity in the hydrogenation of succinic acid to GBL and BDO via dimethyl succinate (DMS) in the presence of methanol. Although the catalyst contains transition metal, yield for GBL and BDO over the catalyst was comparable to that over noble metal-based catalysts, due to its bifunctional catalysis. Thus, a systematic investigation on the catalyst based on a combination of transition metal and noble metal for hydrogenation of succinic acid to GBL and BDO would be worthwhile. Fig. 1 shows the reaction pathways for hydrogenation of succinic acid to GBL and BDO via DMS in the presence of methanol. According to the mechanism, GBL is produced by hydrogenation of succinic acid, and consecutive hydrogenation of GBL leads to the formation of BDO and THF. On the other hand, succinic acid also reacts with methanol to produce DMS by methylation, and BDO is finally formed through demethylation of DMS [16]. Hydrogenation of succinic acid to BDO via GBL and methylation of succinic acid to DMS mostly occur by rhenium species, while demethylation of DMS to BDO is strongly affected by copper species [16]. Therefore, it can be inferred that rhenium and copper species in the catalyst may serve as crucial active sites in the hydrogenation of succinic acid to GBL and BDO via DMS. It is known that dispersion of active sites can be controlled by modifying textural property and metal–support interaction of the catalyst [17–19]. In this respect, we have investigated mesoporous metal–carbon composite catalysts such as Re–C and Ru–C for practical application to hydrogenation of succinic acid [20–22]. However, the previous preparation methods for mesoporous metal–carbon composite catalysts required many preparation steps and H2SO4 post-treatment step to yield mesoporosity of carbon, which caused aggregation and leaching of the metal particles. In other words, a more facile preparation method for metal–carbon composite catalyst is necessary to improve activity and stability of the catalyst. Therefore, it is expected that a mesoporous rhenium–copper–composite catalyst prepared by a simple one-pot route may serve as an efficient catalyst for hydrogenation of succinic acid to GBL and BDO. In this work, a mesoporous rhenium–copper–composite catalyst (Re–Cu–MC) was prepared by a facile single-step surfactant-templating method. For comparison, a series of mesoporous carbon-supported catalysts (Re/Cu–MC, Cu/Re–MC, and Re–Cu/MC) were also prepared. The catalysts were applied to the liquid-phase hydrogenation of succinic acid to GBL and BDO. The catalysts were characterized by nitrogen adsorption–desorption, XRD, TPR, XPS, CO chemisorption, HR-TEM, and STEM-EDX analyses to elucidate the effect of preparation method on their physicochemical properties and catalytic activities. 2 Experimental 2.1 Preparation of catalysts A mesoporous rhenium–copper–carbon composite catalyst (Re–Cu–MC) was prepared by a facile single-step surfactant-templating method. Fig. 2 shows the schematic procedures for the preparation of Re–Cu–MC composite catalyst. 3.3g of (EO)20(PO)70(EO)20 triblock copolymer (Pluronic P123, Sigma-Aldrich) was dissolved in 1.3M HCl solution (100ml) at 37°C with vigorous stirring. 1.4g of carbon precursor (sucrose, Sigma-Aldrich) and 1.2ml of H2SO4 solution were then added into the solution with stirring for 1h. Known amounts of rhenium precursor (rhenium chloride, Sigma-Aldrich) and copper precursor (copper chloride, Sigma-Aldrich) were added into the mixed solution. Rhenium and copper contents were fixed at 5wt% and 20wt%, respectively. After the metal precursors were completely dissolved, 6.0g of silica precursor (TEOS, Sigma-Aldrich) was slowly added into the solution. The resulting solution was stirred at 37°C for 24h, and it was then kept at 100°C for 24h without stirring to induce self-assembly of micelle structure. The resultant was dried at 100°C for 48h, and the obtained composite solid was then carbonized at 800°C for 4h at a heating rate of 5°C/min in a nitrogen stream (100ml/min). The solid product was further treated with 5wt% HF solution for 20h to remove silica template, and then it was filtered and dried. The resulting rhenium–copper–carbon composite catalyst was denoted as Re–Cu–MC. For comparison, a series of mesoporous carbon-supported catalysts (Re/Cu–MC, Cu/Re–MC, and Re–Cu/MC) were prepared. The rhenium catalyst supported on copper–carbon composite (Re/Cu–MC) was prepared by a facile single-step surfactant-templating method and a subsequent impregnation method. A mesoporous copper–carbon composite (Cu–MC) was first prepared by the similar methods described above without a rhenium precursor. Rhenium precursor (rhenium chloride, Sigma-Aldrich) was then impregnated on Cu–MC by an incipient wetness impregnation method using an acetone solution. After drying the supported catalyst in a vacuum oven at 40°C, it was calcined at 600°C in a nitrogen stream. The resulting catalyst was denoted as Re/Cu–MC. The copper catalyst supported on rhenium–carbon composite (Cu/Re–MC) was prepared by the similar methods as Re/Cu–MC catalyst. A mesoporous rhenium–carbon composite (Re–MC) was prepared, and copper precursor (copper chloride, Sigma-Aldrich) was then impregnated on Re–MC using an acetone solution. The resultant was dried and it was calcined at 600°C in a nitrogen stream. The resulting catalyst was denoted as Cu/Re–MC. The rhenium–copper catalyst supported on mesoporous carbon (Re–Cu/MC) was also prepared according to the similar methods described above. A mesoporous carbon support (MC) was first prepared by a single-step surfactant-templating method without metal precursors. Rhenium and copper were then impregnated on MC using an acetone solution. The catalyst was dried and it was calcined at 600°C in a nitrogen stream. The resulting catalyst was denoted as Re–Cu/MC. Rhenium and copper contents in all the catalysts were fixed at 5wt% and 20wt%, respectively. Prior to the catalytic reaction, all the catalysts were reduced with a mixed stream of nitrogen (47.5ml/min) and hydrogen (2.5ml/min) at 600°C for 4h. 2.2 Characterization Nitrogen adsorption–desorption measurements were conducted to investigate textural properties of the catalysts using a BELSORP-mini II instrument (BEL Japan). Surface areas and pore volumes were calculated by the BET and BJH methods, respectively. Chemical compositions of the catalysts were determined by ICP-MS analyses (ELAN 6100, Perkin-Elmer SCIEX). Crystalline phases of the reduced catalysts were examined by X-ray diffraction (XRD) analyses (D-Max2500-PC, Rigaku) using Cu-Kα radiation (λ =1.541Å) operated at 50kV and 100mA. To investigate metal–support interaction of the catalysts, temperature-programmed reduction (TPR) measurements were conducted using a conventional flow system equipped with a thermal conductivity detector (TCD). 30mg of the catalyst sample was pretreated at 200°C for 1h under a flow of N2 (20ml/min). It was reduced with a mixed stream of H2 (2ml/min) and N2 (20ml/min) at temperatures ranging from room temperature to 1000°C with a heating rate of 5°C/min. X-ray photoelectron spectroscopy (XPS) analyses (AXIS-HSi, KRATOS) were carried out to measure binding energies and surface atomic ratios of metallic rhenium and copper in the reduced catalysts. All the XPS spectra were calibrated using C 1s peak (284.5eV) as a reference. CO chemisorption experiments (BELCAT-B, BEL Japan) were conducted to investigate metal surface area, metal dispersion, and average metal particle size of the catalysts. 30mg of each catalyst was reduced at 600°C for 4h, and the amount of carbon monoxide adsorbed on metallic rhenium and copper was measured by periodically injecting diluted carbon monoxide gas (5% carbon monoxide and 95% helium) into the reduced catalyst. Metal surface area, metal dispersion, and average metal particle size were calculated by assuming that one carbon monoxide molecule occupies one surface metal atom. Metal dispersion on the reduced catalysts was examined by high resolution-transmission electron microscopy (HR-TEM) analyses (JEM-3010, JEOL). In order to confirm the detailed dispersion of each metal species, scanning transmission electron microscopy (STEM) analyses (JEM-2100F, JEOL) were conducted with energy dispersive X-ray spectroscopy (EDX) mapping. 2.3 Hydrogenation of succinic acid to GBL and BDO Liquid-phase hydrogenation of succinic acid to GBL and BDO was conducted in a stainless steel autoclave reactor with a volume of 200ml. Methanol (25ml), succinic acid (0.5g), and reduced catalyst (0.2g) were initially charged into the reactor, and then 1,4-dioxane (25ml) as an inert aprotic solvent was charged to mitigate drastic vaporization of methanol. After purging the reactor with nitrogen, it was pressurized up to 50bar using hydrogen. After heating the reactor to the reaction temperature (200°C), the autoclave was pressurized up to 80bar using hydrogen. Catalytic reaction was carried out with constant stirring (700rpm) for 20h. After the reaction, the reactor was cooled to room temperature and depressurized. Reaction products were analyzed with a gas chromatograph (Younglin, ACME-6100) equipped with a flame ionization detector (FID). Conversion of succinic acid and yield for product were calculated according to the following equations. (1) Conversion of succinic acid ( % ) = mole of succinic acid reacted mole of succinic acid supplied × 100 (2) Yield for product % = mole of product formed mole of succinic acid supplied × 100 Turnover frequency (TOF) was calculated on the basis of moles of succinic acid converted and moles of surface metal atom determined from CO-chemisorption. Conversion of succinic acid used for TOF calculation was ca. 10%. 3 Results and discussion 3.1 Physicochemical properties and crystalline structures of catalysts Fig. 3 shows the nitrogen adsorption–desorption isotherms of the catalysts (Re–Cu–MC, Re/Cu–MC, Cu/Re–MC, and Re–Cu/MC). For comparison, isotherm of mesoporous carbon support (MC) is also presented. All the samples showed IV-type isotherms with H3-type hysteresis loops, indicating the existence of well-developed mesopores [23,24]. Detailed physicochemical properties of the catalysts (Re–Cu–MC, Re/Cu–MC, Cu/Re–MC, and Re–Cu/MC) and mesoporous carbon support (MC) are listed in Table 1 . Actual Re and Cu contents in all the catalysts were well matched with the designed values. Average pore diameters of the samples were in the range of 3.6–4.4nm, indicating successful formation of mesoporous carbon structure. It is interesting to note that average pore diameter decreased in the order of Re–Cu/MC>Cu/Re–MC>Re/Cu–MC>Re–Cu–MC. This was because pore size of mesoporous carbon decreased with increasing the amount of metal precursor located on silica wall during the single-step preparation [25]. On the other hand, surface area and pore volume of the catalysts decreased with increasing impregnated metal content due to pore blockage by metal particles. It should be noted that Re–Cu–MC catalyst showed higher surface area (1169m2/g) and larger pore volume (1.04cm3/g) than the other catalysts. Crystalline structures of the reduced catalysts (Re–Cu–MC, Re/Cu–MC, Cu/Re–MC, and Re–Cu/MC) were examined by XRD measurements as shown in Fig. 4 . All the catalysts showed a broad peak at 2θ =23° due to their graphitic carbon structure [26]. It is noteworthy that no characteristic diffraction peaks indicative of metallic rhenium (closed circles in Fig. 4) were detected in all the catalysts, because only a small amount (<5wt%) of rhenium was used for the catalyst preparation. In case of metallic copper, diffraction peaks (dashed lines in Fig. 4) were observed without a shift of diffraction angle. It has been reported that rhenium and copper are immiscible in the metallic phase due to their different lattice structure; rhenium has a hexagonal closed-packed structure with nearest-neighbor distance of 2.7609Å, while copper has a face-centered cubic structure with nearest-neighbor distance of 2.5509Å [27]. Therefore, it can be said that rhenium and copper species in all the catalysts did not form a phase transitional structure such as substitutional solid-solution. Interestingly, the catalysts based on copper–carbon composites (Re–Cu–MC and Re/Cu–MC) showed weaker intensity for metallic copper than carbon-supported copper catalysts (Cu/Re–MC and Re–Cu/MC). This means that copper particles in these catalysts based on copper–carbon composites (Re–Cu–MC and Re/Cu–MC) were finely incorporated into the carbon framework during the single-step preparation. 3.2 Metal–support interaction of catalysts In order to investigate metal–support interaction of the catalysts (Re–Cu–MC, Re/Cu–MC, Cu/Re–MC, and Re–Cu/MC), TPR experiments were conducted as shown in Fig. 5 . All the catalysts exhibited two reduction peaks at around 300–340°C and 550–650°C; the former corresponded to reduction of rhenium species, while the latter corresponded to reduction of copper species. It was found that the reduction peak temperatures of rhenium species increased in the order of Re–Cu/MC<Re/Cu–MC<Re–Cu–MC<Cu/Re–MC, and the reduction peak temperature of copper species increased in the order of Re–Cu/MC<Cu/Re–MC<Re–Cu–MC<Re/Cu–MC. It should be noted that the reduction peak temperatures of rhenium species in the catalysts based on rhenium–carbon composites (Re–Cu–MC and Cu/Re–MC) were higher than those of carbon-supported rhenium catalysts (Re/Cu–MC and Re–Cu/MC). Moreover, the reduction peak temperatures of copper species in the catalysts based on copper–carbon composites (Re–Cu–MC and Re/Cu–MC) were also higher than those of carbon-supported copper catalysts (Cu/Re–MC and Re–Cu/MC). This indicates that the metal species in the metal–carbon composite catalysts more strongly interacted with carbon framework than the impregnated metal species. XPS analyses were further performed to elucidate interaction between reduced metal particles and carbon framework in the catalysts. Fig. 6 shows the XPS spectra of Re 4f7/2 and Cu 2p3/2 levels in the reduced catalysts (Re–Cu–MC, Re/Cu–MC, Cu/Re–MC, and Re–Cu/MC). All the catalysts exhibited Re 4f7/2 peaks at 40.3–40.7eV and Cu 2p3/2 peaks at 932.2–932.7eV in the XPS spectra, corresponding to zerovalent rhenium and copper species, respectively [28,29]. Rhenium and copper are known to have little metal-metal interaction, because polarization of Re–Cu bonding is suppressed by their identical Pauling electronegativities [27,30]. Thus, any shift of binding energies by rhenium–copper interaction was not detected in the XPS spectra. It was found that binding energy of Re 4f7/2 increased in the order of Re–Cu/MC<Re/Cu–MC<Re–Cu–MC<Cu/Re–MC, while binding energy of Cu 2p3/2 increased in the order of Re–Cu/MC<Cu/Re–MC<Re–Cu–MC<Re/Cu–MC. It is interesting to note that these trends for two metal species were well consistent with trends of TPR peak temperatures (Fig. 5). This result can be explained by the fact that interaction between metal species and carbon framework was induced by electron transfer effect at the interfacial region [31–33]. In other words, the metal atom on the carbon framework serves as an electron donor to the carbon atom, leading to the shift of binding energy for metal species toward higher value in XPS spectra. From these results, it is believed that the metal–carbon composite catalysts (Re–Cu–MC, Re/Cu–MC, and Cu/Re–MC) were more favorable than the impregnated catalyst (Re–Cu/MC) for effective electron transfer, resulting in strong metal–support interaction in these three catalysts. 3.3 Metal dispersion in the catalysts In order to measure the amount of rhenium and copper atoms on the catalyst surface, quantitative XPS analyses of the reduced catalysts (Re–Cu–MC, Re/Cu–MC, Cu/Re–MC, and Re–Cu/MC) were conducted. Surface atomic ratios of rhenium and copper with respect to carbon are summarized in Table 2 . Surface Cu/Re atomic ratios of Re/Cu–MC and Cu/Re–MC were quite different from bulk atomic ratios due to relatively non-uniform dispersion of each metal species on the catalyst surface. It was observed that Re/C atomic ratio increased in the order of Re–Cu/MC<Re/Cu–MC<Re–Cu–MC<Cu/Re–MC, while Cu/C atomic ratio increased in the order of Re–Cu/MC<Cu/Re–MC<Re–Cu–MC<Re/Cu–MC. Interestingly, these trends were in good agreement with the trends of TPR peak temperatures (Fig. 5) and binding energies (Fig. 6). It is known that the amount of surface metal atom measured by XPS analyses decreases with increasing metal particle size, due to limited XPS penetration depth [34,35]. Therefore, it is inferred that the aggregation of metal particles was effectively suppressed with increasing metal–support interaction of the catalyst. It was found that (Re+Cu)/C atomic ratio increased in the order of Re–Cu/MC<Cu/Re–MC<Re/Cu–MC<Re–Cu–MC. This indicates that Re–Cu–MC composite catalyst retained the largest total amount of metal atoms exposed on the catalyst surface. CO chemisorption measurements were carried out to measure metal surface area, metal dispersion, and average metal particle size of the reduced catalysts (Re–Cu–MC, Re/Cu–MC, Cu/Re–MC, and Re–Cu/MC). As summarized in Table 3 , metal surface area and metal dispersion increased in the order of Re–Cu/MC<Cu/Re–MC<Re/Cu–MC<Re–Cu–MC, which was consistent with the trend of (Re+Cu)/C atomic ratio. This means that metal species in the catalysts based on metal–carbon composite were finely dispersed on both external and internal surfaces of carbon framework. It was also revealed that average metal particle size decreased in the order of Re–Cu/MC>Cu/Re–MC>Re/Cu–MC>Re–Cu–MC. This result was further confirmed by HR-TEM analyses. Fig. 7 shows the HR-TEM images of the reduced catalysts (Re–Cu–MC, Re/Cu–MC, Cu/Re–MC, and Re–Cu/MC) and carbon support (MC). All the samples retained a highly ordered mesoporous carbon structure. It should be noted that metallic rhenium and copper species were more aggregated with increasing impregnated metal content of the catalysts, which was well matched with the results of quantitative XPS analyses (Table 2) and CO chemisorption (Table 3). It was revealed that Re–Cu–MC composite catalyst showed smaller metal particle size and more uniform metal dispersion than the other catalysts. In order to confirm the dispersion of metallic rhenium and copper in the Re–Cu–MC catalyst, STEM-EDX analyses were conducted. Fig. 8 shows the STEM images and EDX mapping images of Re–Cu–MC catalyst. Metallic rhenium and copper were indistinguishable in the STEM images (Fig. 8(a) and (c)) in spite of the difference in atomic number, because of similar shape, contrast, and size distribution under the blurred background by carbon framework. On the other hand, each metal species was clearly identified in the EDX mapping images (Fig. 8(b) and (d)). It was revealed that rhenium and copper particles with a size of 4–8nm were uniformly distributed in the Re–Cu–MC catalyst, which was well matched with average metal particle size determined by CO-chemisorption. Furthermore, it was found that rhenium and copper were distributed as separate particles. On the basis of XRD, XPS, and EDX mapping results, it can be inferred that rhenium and copper species served as independent active sites. Therefore, it is expected that Re–Cu–MC catalyst, which retained smaller rhenium and copper particles than the other catalysts, would be more active in the hydrogenation of succinic acid to GBL and BDO. 3.4 Hydrogenation of succinic acid to GBL and BDO Performance of the catalysts (Re–Cu–MC, Re/Cu–MC, Cu/Re–MC, and Re–Cu/MC) in the liquid-phase hydrogenation of succinic acid is summarized in Table 4 . In the reaction, GBL and BDO were produced as major final products. Small amount of THF was also formed. In addition, DMS was produced as a major intermediate through the reaction of succinic acid with methanol. All the catalysts showed complete conversion of succinic acid. Yield for GBL and BDO increased in the order of Re–Cu/MC<Cu/Re–MC<Re/Cu–MC<Re–Cu–MC, and yield for DMS decreased in the order of Re–Cu/MC>Cu/Re–MC>Re/Cu–MC>Re–Cu–MC. Among the catalysts, Re–Cu–MC catalyst showed the highest total yield for GBL and BDO (41.9%). The catalytic performance of Re–Cu–MC catalyst was comparable to that of noble metal-based catalysts such as Pd–Re/C [12,13] and Pt–Re/C [15], demonstrating that Re–Cu–MC catalyst served as a promising bifunctional catalyst. It is believed that average metal particle size of rhenium and copper of the catalyst was closely related to the formation of GBL and BDO in the hydrogenation of succinic acid. Fig. 9 shows the correlation between average metal particle size and catalytic activity of the catalysts (Re–Cu–MC, Re/Cu–MC, Cu/Re–MC, and Re–Cu/MC) in the liquid-phase hydrogenation of succinic acid to GBL and BDO. It should be noted that total yield for GBL and BDO increased with decreasing average metal particle size (with increasing metal dispersion) of the catalysts. Interestingly, although average metal particle size of the catalysts was quite different, TOFs were nearly identical as listed in Table 4. This result indicates that hydrogenation of succinic acid over the catalysts (Re–Cu–MC, Re/Cu–MC, Cu/Re–MC, and Re–Cu/MC) was structure-insensitive. Among the catalysts tested, Re–Cu–MC composite catalyst with the smallest average metal particle size (with the highest metal dispersion) exhibited the best catalytic performance in the reaction. Thus, rhenium and copper particle size of the catalysts played an important role in determining catalytic performance in the hydrogenation of succinic acid to GBL and BDO. 3.5 Stability and reusability of catalysts In the liquid-phase hydrogenation of succinic acid, stability of active metal species under the acidic condition is very important [6,7]. Thus, recycle tests for hydrogenation of succinic acid were conducted three times to investigate stability and reusability of the catalyst. Fig. 10 shows the results for liquid-phase hydrogenation of succinic acid to GBL and BDO over Re–Cu–MC and Re–Cu/MC catalysts with respect to recycle run. Importantly, fresh and spent Re–Cu–MC catalysts retained similar catalytic performance. In case of Re–Cu/MC catalyst, however, total yield for GBL and BDO significantly decreased with recycle run. This indicates that Re–Cu–MC catalyst was stable and reusable under the acidic condition. In conclusion, Re–Cu–MC catalyst with the highest catalytic activity and stability served as the most efficient catalyst in the hydrogenation of succinic acid to GBL and BDO. 4 Conclusions A mesoporous rhenium–copper–carbon composite catalyst (Re–Cu–MC) was prepared by a facile single-step surfactant-templating method. For comparison, a series of mesoporous carbon-supported catalysts (Re/Cu–MC, Cu/Re–MC, and Re–Cu/MC) were also prepared. The prepared catalysts were applied to the liquid-phase hydrogenation of succinic acid to GBL and BDO. The effect of preparation method on the physicochemical properties and catalytic activities was investigated. Although all the catalysts retained a well-developed mesoporous structure, Re–Cu–MC composite catalyst exhibited excellent textural properties compared to the other catalysts. It was found that metallic copper and rhenium effectively interacted with carbon framework by electron transfer effect. Surface atomic ratios of metal species (Re/C and Cu/C) on the catalyst surface increased with increasing metal–support interaction. Yield for GBL and BDO increased with decreasing average metal particle size (with increasing metal dispersion) of the catalysts. Among the catalysts tested, Re–Cu–MC composite catalyst with the smallest average metal particle size showed the best catalytic performance with excellent reusability. Thus, metal particle size of the catalysts played a crucial role in determining the catalytic activity and stability in the reaction. It is concluded that Re–Cu–MC composite catalyst prepared by a facile single-step surfactant-templating method served as an efficient catalyst in the hydrogenation of succinic acid to GBL and BDO. Acknowledgements This work was supported by the Global Frontier R&D Program on Center for Multiscale Energy System funded by the National Research Foundation under the Ministry of Education, Science and Technology, Korea (20110031575). References [1] R.H. Roth J.M.R. Delgado N.J. Giarman Int. J. Neuropharmacol. 5 1966 421 428 [2] M. Seitz O. Reiser Curr. Opin. Chem. Biol. 9 2005 285 292 [3] M.L. Morgan Chem. Ind. 3 1997 166 168 [4] J.G. Zeikus M.K. Jain P. Elankovan Appl. Microbiol. Biotechnol. 51 1999 545 552 [5] S.M. Jung E. Godard S.Y. Jung K.-C. Park J.U. Choi J. Mol. Catal. A: Chem. 198 2003 297 302 [6] I. Bechthold K. Bretz S. Kabasci R. Kopitzky A. Springer Chem. Eng. Technol. 31 2008 647 654 [7] C. Delhomme D. Weuster-Botz F.E. Kuhn Green Chem. 11 2009 13 26 [8] P. Gallezot Chem. Soc. Rev. 41 2012 1538 1558 [9] R.M. Deshpande V.V. Buwa C.V. Rode R.V. Chaudhari P.L. Mills Catal. Commun. 3 2002 269 274 [10] R. Luque J.H. Clark K. Yoshida P.L. Gai Chem. Commun. 35 2009 5305 5307 [11] L. Rosi M. Frediani P. Frediani J. Organomet. Chem. 695 2010 1314 1322 [12] D.P. Minh M. Besson C. Pinel P. Fuertes C. Petitjean Top. Catal. 53 2010 1270 1273 [13] B.K. Ly D.P. Minh C. Pinel M. Besson B. Tapin F. Epron C. Especel Top. Catal. 55 2012 466 473 [14] S.-H. Chung Y.-M. Park M.-S. Kim K.-Y. Lee Catal. Today 185 2012 205 210 [15] L. Corbel-Demailly B.-H. Ly D.P. Minh B. Tapin C. Especel F. Epron A. Cabiac E. Guillon M. Besson C. Pinel ChemSusChem 6 2013 2388 2395 [16] U.G. Hong H.W. Park J. Lee S. Hwang J. Kwak J. Yi I.K. Song J. Nanosci. Nanotechnol. 13 2013 7448 7453 [17] S.J. Tauster S.C. Fung R.L. Garten J. Am. Chem. Soc. 100 1978 170 175 [18] G.K. Wertheim S.B. Dicenzo D.N.E. Buchanan P.A. Bennett Solid State Commun. 53 1985 377 381 [19] J.M. Planeix N. Coustel B. Coq V. Brotons P.S. Kumbhar R. Dutartre P. Geneste P. Bernier P.M. Ajayan J. Am. Chem. Soc. 116 1994 7935 7936 [20] U.G. Hong H.W. Park J. Lee S. Hwang I.K. Song J. Ind. Eng. Chem. 18 2012 462 468 [21] U.G. Hong H.W. Park J. Lee S. Hwang J. Yi I.K. Song Appl. Catal., A: Gen. 415–416 2012 141 148 [22] U.G. Hong J.K. Kim J. Lee J.K. Lee J.H. Song J. Yi I.K. Song Appl. Catal., A: Gen. 469 2014 466 471 [23] M. Kruk M. Jaroniec Y. Bereznitski J. Colloid Interface Sci. 182 1996 282 288 [24] I. Matos S. Fernandes L. Guerreiro S. Barata A.M. Ramos J. Vital I.M. Fonseca Microporous Mesoporous Mater. 92 2006 38 46 [25] A. Galarneau H. Cambon F.D. Renzo R. Ryoo M. Choi F. Fajula New J. Chem. 27 2003 73 79 [26] Z.Q. Li C.J. Lu Z.P. Xia Y. Zhou Z. Luo Carbon 45 2007 1686 1695 [27] R. Wagner D. Schlatterbeck K. Christmann Surf. Sci. 440 1999 231 251 [28] W.T. Tysoe F. Zaera G.A. Somorjai Surf. Sci. 200 1988 1 14 [29] G. Ertl R. Hierl H. Knozinger N. Thiele H.P. Urbach Appl. Surf. Sci. 5 1980 49 64 [30] W.R. Tyson W.A. Miller Surf. Sci. 62 1977 267 276 [31] L.J. Hillenbrand J.W. Lacksonen J. Electrochem. Soc. 112 1965 249 252 [32] F. Coloma A. Sepulveda J. Fierro F. Rodriguez-Reinoso Appl. Catal., A: Gen. 148 1996 63 80 [33] A.K. Shukla M.K. Ravikumar A. Roy S.R. Barman D.D. Sarma A.S. Arico V. Antonucci L. Pino N. Giordano J. Electrochem. Soc. 141 1994 1517 1522 [34] J.P. Espinos J. Morales A. Barranco A. Caballero J.P. Holgado A.R. Gonzalez-Elipe J. Phys. Chem. B 106 2002 6921 6929 [35] M. Gilbert I. Sutherland A. Guest J. Mater. Sci. 35 2000 391 397",
      "scopus-id": "84907487397",
      "coredata": {
        "eid": "1-s2.0-S1381116914003896",
        "dc:description": "A mesoporous rhenium–copper–carbon composite catalyst (Re–Cu–MC) was prepared by a facile single-step surfactant-templating method. For comparison, a series of mesoporous carbon-supported catalysts (Re/Cu–MC, Cu/Re–MC, and Re–Cu/MC) were also prepared. The catalysts were applied to the liquid-phase hydrogenation of succinic acid to γ-butyrolactone (GBL) and 1,4-butanediol (BDO). The effect of preparation method on the physicochemical properties and catalytic activities of the catalysts was investigated. It was found that the catalysts based on metal–carbon composite (Re–Cu–MC, Re/Cu–MC, and Cu/Re–MC) were favorable for enhancing textural properties and metal–support interaction of the catalysts. Surface atomic ratios of metal species (Re/C and Cu/C) on the catalyst surface increased with increasing metal–support interaction. Yield for GBL and BDO increased with decreasing average metal particle size of the catalysts. It was revealed that metal particle size of the catalysts served as a key factor determining the catalytic activity and stability in the reaction. Among the catalysts tested, Re–Cu–MC catalyst with the smallest average metal particle size showed the best catalytic performance in the hydrogenation of succinic acid to GBL and BDO.",
        "openArchiveArticle": "false",
        "prism:coverDate": "2014-12-31",
        "openaccessUserLicense": null,
        "prism:aggregationType": "Journal",
        "prism:url": "https://api.elsevier.com/content/article/pii/S1381116914003896",
        "dc:creator": [
          {
            "@_fa": "true",
            "$": "Kang, Ki Hyuk"
          },
          {
            "@_fa": "true",
            "$": "Hong, Ung Gi"
          },
          {
            "@_fa": "true",
            "$": "Jun, Jin Oh"
          },
          {
            "@_fa": "true",
            "$": "Song, Ji Hwan"
          },
          {
            "@_fa": "true",
            "$": "Bang, Yongju"
          },
          {
            "@_fa": "true",
            "$": "Choi, Jung Ho"
          },
          {
            "@_fa": "true",
            "$": "Han, Seung Ju"
          },
          {
            "@_fa": "true",
            "$": "Song, In Kyu"
          }
        ],
        "link": [
          {
            "@_fa": "true",
            "@rel": "self",
            "@href": "https://api.elsevier.com/content/article/pii/S1381116914003896"
          },
          {
            "@_fa": "true",
            "@rel": "scidir",
            "@href": "https://www.sciencedirect.com/science/article/pii/S1381116914003896"
          }
        ],
        "dc:format": "application/json",
        "openaccessType": null,
        "pii": "S1381-1169(14)00389-6",
        "prism:volume": "395",
        "prism:publisher": "Elsevier B.V.",
        "dc:title": "Hydrogenation of succinic acid to γ-butyrolactone and 1,4-butanediol over mesoporous rhenium–copper–carbon composite catalyst",
        "prism:copyright": "Copyright © 2014 Elsevier B.V. All rights reserved.",
        "openaccess": "0",
        "prism:issn": "13811169",
        "dcterms:subject": [
          {
            "@_fa": "true",
            "$": "Hydrogenation"
          },
          {
            "@_fa": "true",
            "$": "Succinic acid"
          },
          {
            "@_fa": "true",
            "$": "γ-Butyrolactone"
          },
          {
            "@_fa": "true",
            "$": "1,4-Butandiol"
          },
          {
            "@_fa": "true",
            "$": "Mesoporous Re–Cu–carbon catalyst"
          }
        ],
        "openaccessArticle": "false",
        "prism:publicationName": "Journal of Molecular Catalysis A: Chemical",
        "openaccessSponsorType": null,
        "prism:pageRange": "234-242",
        "prism:endingPage": "242",
        "pubType": "fla",
        "prism:coverDisplayDate": "December 2014",
        "prism:doi": "10.1016/j.molcata.2014.08.032",
        "prism:startingPage": "234",
        "dc:identifier": "doi:10.1016/j.molcata.2014.08.032",
        "openaccessSponsorName": null
      },
      "objects": {
        "object": [
          {
            "@category": "thumbnail",
            "@height": "62",
            "@width": "317",
            "@_fa": "true",
            "$": "https://api.elsevier.com/content/object/eid/1-s2.0-S1381116914003896-si2.gif?httpAccept=%2A%2F%2A",
            "@multimediatype": "GIF image file",
            "@type": "ALTIMG",
            "@size": "2221",
            "@ref": "si2",
            "@mimetype": "image/gif"
          },
          {
            "@category": "thumbnail",
            "@height": "61",
            "@width": "316",
            "@_fa": "true",
            "$": "https://api.elsevier.com/content/object/eid/1-s2.0-S1381116914003896-si1.gif?httpAccept=%2A%2F%2A",
            "@multimediatype": "GIF image file",
            "@type": "ALTIMG",
            "@size": "2196",
            "@ref": "si1",
            "@mimetype": "image/gif"
          },
          {
            "@category": "high",
            "@height": "1566",
            "@width": "1554",
            "@_fa": "true",
            "$": "https://api.elsevier.com/content/object/eid/1-s2.0-S1381116914003896-gr9_lrg.jpg?httpAccept=%2A%2F%2A",
            "@multimediatype": "JPEG image file",
            "@type": "IMAGE-HIGH-RES",
            "@size": "124812",
            "@ref": "gr9",
            "@mimetype": "image/jpeg"
          },
          {
            "@category": "high",
            "@height": "1499",
            "@width": "1500",
            "@_fa": "true",
            "$": "https://api.elsevier.com/content/object/eid/1-s2.0-S1381116914003896-gr8_lrg.jpg?httpAccept=%2A%2F%2A",
            "@multimediatype": "JPEG image file",
            "@type": "IMAGE-HIGH-RES",
            "@size": "469394",
            "@ref": "gr8",
            "@mimetype": "image/jpeg"
          },
          {
            "@category": "high",
            "@height": "1241",
            "@width": "1863",
            "@_fa": "true",
            "$": "https://api.elsevier.com/content/object/eid/1-s2.0-S1381116914003896-gr7_lrg.jpg?httpAccept=%2A%2F%2A",
            "@multimediatype": "JPEG image file",
            "@type": "IMAGE-HIGH-RES",
            "@size": "758844",
            "@ref": "gr7",
            "@mimetype": "image/jpeg"
          },
          {
            "@category": "high",
            "@height": "1675",
            "@width": "2833",
            "@_fa": "true",
            "$": "https://api.elsevier.com/content/object/eid/1-s2.0-S1381116914003896-gr6_lrg.jpg?httpAccept=%2A%2F%2A",
            "@multimediatype": "JPEG image file",
            "@type": "IMAGE-HIGH-RES",
            "@size": "330189",
            "@ref": "gr6",
            "@mimetype": "image/jpeg"
          },
          {
            "@category": "high",
            "@height": "1754",
            "@width": "1733",
            "@_fa": "true",
            "$": "https://api.elsevier.com/content/object/eid/1-s2.0-S1381116914003896-gr5_lrg.jpg?httpAccept=%2A%2F%2A",
            "@multimediatype": "JPEG image file",
            "@type": "IMAGE-HIGH-RES",
            "@size": "196860",
            "@ref": "gr5",
            "@mimetype": "image/jpeg"
          },
          {
            "@category": "high",
            "@height": "1951",
            "@width": "1733",
            "@_fa": "true",
            "$": "https://api.elsevier.com/content/object/eid/1-s2.0-S1381116914003896-gr4_lrg.jpg?httpAccept=%2A%2F%2A",
            "@multimediatype": "JPEG image file",
            "@type": "IMAGE-HIGH-RES",
            "@size": "224958",
            "@ref": "gr4",
            "@mimetype": "image/jpeg"
          },
          {
            "@category": "high",
            "@height": "1657",
            "@width": "1669",
            "@_fa": "true",
            "$": "https://api.elsevier.com/content/object/eid/1-s2.0-S1381116914003896-gr3_lrg.jpg?httpAccept=%2A%2F%2A",
            "@multimediatype": "JPEG image file",
            "@type": "IMAGE-HIGH-RES",
            "@size": "243568",
            "@ref": "gr3",
            "@mimetype": "image/jpeg"
          },
          {
            "@category": "high",
            "@height": "415",
            "@width": "1798",
            "@_fa": "true",
            "$": "https://api.elsevier.com/content/object/eid/1-s2.0-S1381116914003896-gr2_lrg.jpg?httpAccept=%2A%2F%2A",
            "@multimediatype": "JPEG image file",
            "@type": "IMAGE-HIGH-RES",
            "@size": "144289",
            "@ref": "gr2",
            "@mimetype": "image/jpeg"
          },
          {
            "@category": "high",
            "@height": "1459",
            "@width": "1528",
            "@_fa": "true",
            "$": "https://api.elsevier.com/content/object/eid/1-s2.0-S1381116914003896-gr10_lrg.jpg?httpAccept=%2A%2F%2A",
            "@multimediatype": "JPEG image file",
            "@type": "IMAGE-HIGH-RES",
            "@size": "109695",
            "@ref": "gr10",
            "@mimetype": "image/jpeg"
          },
          {
            "@category": "high",
            "@height": "1272",
            "@width": "2667",
            "@_fa": "true",
            "$": "https://api.elsevier.com/content/object/eid/1-s2.0-S1381116914003896-gr1_lrg.jpg?httpAccept=%2A%2F%2A",
            "@multimediatype": "JPEG image file",
            "@type": "IMAGE-HIGH-RES",
            "@size": "143442",
            "@ref": "gr1",
            "@mimetype": "image/jpeg"
          },
          {
            "@category": "high",
            "@height": "886",
            "@width": "880",
            "@_fa": "true",
            "$": "https://api.elsevier.com/content/object/eid/1-s2.0-S1381116914003896-fx1_lrg.jpg?httpAccept=%2A%2F%2A",
            "@multimediatype": "JPEG image file",
            "@type": "IMAGE-HIGH-RES",
            "@size": "54047",
            "@ref": "fx1",
            "@mimetype": "image/jpeg"
          },
          {
            "@category": "standard",
            "@height": "354",
            "@width": "351",
            "@_fa": "true",
            "$": "https://api.elsevier.com/content/object/eid/1-s2.0-S1381116914003896-gr9.jpg?httpAccept=%2A%2F%2A",
            "@multimediatype": "JPEG image file",
            "@type": "IMAGE-DOWNSAMPLED",
            "@size": "15617",
            "@ref": "gr9",
            "@mimetype": "image/jpeg"
          },
          {
            "@category": "standard",
            "@height": "565",
            "@width": "565",
            "@_fa": "true",
            "$": "https://api.elsevier.com/content/object/eid/1-s2.0-S1381116914003896-gr8.jpg?httpAccept=%2A%2F%2A",
            "@multimediatype": "JPEG image file",
            "@type": "IMAGE-DOWNSAMPLED",
            "@size": "82171",
            "@ref": "gr8",
            "@mimetype": "image/jpeg"
          },
          {
            "@category": "standard",
            "@height": "467",
            "@width": "701",
            "@_fa": "true",
            "$": "https://api.elsevier.com/content/object/eid/1-s2.0-S1381116914003896-gr7.jpg?httpAccept=%2A%2F%2A",
            "@multimediatype": "JPEG image file",
            "@type": "IMAGE-DOWNSAMPLED",
            "@size": "129125",
            "@ref": "gr7",
            "@mimetype": "image/jpeg"
          },
          {
            "@category": "standard",
            "@height": "378",
            "@width": "640",
            "@_fa": "true",
            "$": "https://api.elsevier.com/content/object/eid/1-s2.0-S1381116914003896-gr6.jpg?httpAccept=%2A%2F%2A",
            "@multimediatype": "JPEG image file",
            "@type": "IMAGE-DOWNSAMPLED",
            "@size": "38030",
            "@ref": "gr6",
            "@mimetype": "image/jpeg"
          },
          {
            "@category": "standard",
            "@height": "396",
            "@width": "391",
            "@_fa": "true",
            "$": "https://api.elsevier.com/content/object/eid/1-s2.0-S1381116914003896-gr5.jpg?httpAccept=%2A%2F%2A",
            "@multimediatype": "JPEG image file",
            "@type": "IMAGE-DOWNSAMPLED",
            "@size": "24046",
            "@ref": "gr5",
            "@mimetype": "image/jpeg"
          },
          {
            "@category": "standard",
            "@height": "440",
            "@width": "391",
            "@_fa": "true",
            "$": "https://api.elsevier.com/content/object/eid/1-s2.0-S1381116914003896-gr4.jpg?httpAccept=%2A%2F%2A",
            "@multimediatype": "JPEG image file",
            "@type": "IMAGE-DOWNSAMPLED",
            "@size": "25776",
            "@ref": "gr4",
            "@mimetype": "image/jpeg"
          },
          {
            "@category": "standard",
            "@height": "374",
            "@width": "377",
            "@_fa": "true",
            "$": "https://api.elsevier.com/content/object/eid/1-s2.0-S1381116914003896-gr3.jpg?httpAccept=%2A%2F%2A",
            "@multimediatype": "JPEG image file",
            "@type": "IMAGE-DOWNSAMPLED",
            "@size": "29362",
            "@ref": "gr3",
            "@mimetype": "image/jpeg"
          },
          {
            "@category": "standard",
            "@height": "156",
            "@width": "677",
            "@_fa": "true",
            "$": "https://api.elsevier.com/content/object/eid/1-s2.0-S1381116914003896-gr2.jpg?httpAccept=%2A%2F%2A",
            "@multimediatype": "JPEG image file",
            "@type": "IMAGE-DOWNSAMPLED",
            "@size": "36707",
            "@ref": "gr2",
            "@mimetype": "image/jpeg"
          },
          {
            "@category": "standard",
            "@height": "329",
            "@width": "345",
            "@_fa": "true",
            "$": "https://api.elsevier.com/content/object/eid/1-s2.0-S1381116914003896-gr10.jpg?httpAccept=%2A%2F%2A",
            "@multimediatype": "JPEG image file",
            "@type": "IMAGE-DOWNSAMPLED",
            "@size": "14214",
            "@ref": "gr10",
            "@mimetype": "image/jpeg"
          },
          {
            "@category": "standard",
            "@height": "287",
            "@width": "602",
            "@_fa": "true",
            "$": "https://api.elsevier.com/content/object/eid/1-s2.0-S1381116914003896-gr1.jpg?httpAccept=%2A%2F%2A",
            "@multimediatype": "JPEG image file",
            "@type": "IMAGE-DOWNSAMPLED",
            "@size": "16880",
            "@ref": "gr1",
            "@mimetype": "image/jpeg"
          },
          {
            "@category": "standard",
            "@height": "199",
            "@width": "198",
            "@_fa": "true",
            "$": "https://api.elsevier.com/content/object/eid/1-s2.0-S1381116914003896-fx1.jpg?httpAccept=%2A%2F%2A",
            "@multimediatype": "JPEG image file",
            "@type": "IMAGE-DOWNSAMPLED",
            "@size": "7279",
            "@ref": "fx1",
            "@mimetype": "image/jpeg"
          },
          {
            "@category": "thumbnail",
            "@height": "163",
            "@width": "162",
            "@_fa": "true",
            "$": "https://api.elsevier.com/content/object/eid/1-s2.0-S1381116914003896-gr9.sml?httpAccept=%2A%2F%2A",
            "@multimediatype": "GIF image file",
            "@type": "IMAGE-THUMBNAIL",
            "@size": "3175",
            "@ref": "gr9",
            "@mimetype": "image/gif"
          },
          {
            "@category": "thumbnail",
            "@height": "164",
            "@width": "164",
            "@_fa": "true",
            "$": "https://api.elsevier.com/content/object/eid/1-s2.0-S1381116914003896-gr8.sml?httpAccept=%2A%2F%2A",
            "@multimediatype": "GIF image file",
            "@type": "IMAGE-THUMBNAIL",
            "@size": "11363",
            "@ref": "gr8",
            "@mimetype": "image/gif"
          },
          {
            "@category": "thumbnail",
            "@height": "146",
            "@width": "219",
            "@_fa": "true",
            "$": "https://api.elsevier.com/content/object/eid/1-s2.0-S1381116914003896-gr7.sml?httpAccept=%2A%2F%2A",
            "@multimediatype": "GIF image file",
            "@type": "IMAGE-THUMBNAIL",
            "@size": "8592",
            "@ref": "gr7",
            "@mimetype": "image/gif"
          },
          {
            "@category": "thumbnail",
            "@height": "129",
            "@width": "219",
            "@_fa": "true",
            "$": "https://api.elsevier.com/content/object/eid/1-s2.0-S1381116914003896-gr6.sml?httpAccept=%2A%2F%2A",
            "@multimediatype": "GIF image file",
            "@type": "IMAGE-THUMBNAIL",
            "@size": "4479",
            "@ref": "gr6",
            "@mimetype": "image/gif"
          },
          {
            "@category": "thumbnail",
            "@height": "164",
            "@width": "162",
            "@_fa": "true",
            "$": "https://api.elsevier.com/content/object/eid/1-s2.0-S1381116914003896-gr5.sml?httpAccept=%2A%2F%2A",
            "@multimediatype": "GIF image file",
            "@type": "IMAGE-THUMBNAIL",
            "@size": "3745",
            "@ref": "gr5",
            "@mimetype": "image/gif"
          },
          {
            "@category": "thumbnail",
            "@height": "163",
            "@width": "145",
            "@_fa": "true",
            "$": "https://api.elsevier.com/content/object/eid/1-s2.0-S1381116914003896-gr4.sml?httpAccept=%2A%2F%2A",
            "@multimediatype": "GIF image file",
            "@type": "IMAGE-THUMBNAIL",
            "@size": "3483",
            "@ref": "gr4",
            "@mimetype": "image/gif"
          },
          {
            "@category": "thumbnail",
            "@height": "164",
            "@width": "165",
            "@_fa": "true",
            "$": "https://api.elsevier.com/content/object/eid/1-s2.0-S1381116914003896-gr3.sml?httpAccept=%2A%2F%2A",
            "@multimediatype": "GIF image file",
            "@type": "IMAGE-THUMBNAIL",
            "@size": "4997",
            "@ref": "gr3",
            "@mimetype": "image/gif"
          },
          {
            "@category": "thumbnail",
            "@height": "51",
            "@width": "219",
            "@_fa": "true",
            "$": "https://api.elsevier.com/content/object/eid/1-s2.0-S1381116914003896-gr2.sml?httpAccept=%2A%2F%2A",
            "@multimediatype": "GIF image file",
            "@type": "IMAGE-THUMBNAIL",
            "@size": "3513",
            "@ref": "gr2",
            "@mimetype": "image/gif"
          },
          {
            "@category": "thumbnail",
            "@height": "164",
            "@width": "172",
            "@_fa": "true",
            "$": "https://api.elsevier.com/content/object/eid/1-s2.0-S1381116914003896-gr10.sml?httpAccept=%2A%2F%2A",
            "@multimediatype": "GIF image file",
            "@type": "IMAGE-THUMBNAIL",
            "@size": "5856",
            "@ref": "gr10",
            "@mimetype": "image/gif"
          },
          {
            "@category": "thumbnail",
            "@height": "104",
            "@width": "219",
            "@_fa": "true",
            "$": "https://api.elsevier.com/content/object/eid/1-s2.0-S1381116914003896-gr1.sml?httpAccept=%2A%2F%2A",
            "@multimediatype": "GIF image file",
            "@type": "IMAGE-THUMBNAIL",
            "@size": "2354",
            "@ref": "gr1",
            "@mimetype": "image/gif"
          },
          {
            "@category": "thumbnail",
            "@height": "164",
            "@width": "163",
            "@_fa": "true",
            "$": "https://api.elsevier.com/content/object/eid/1-s2.0-S1381116914003896-fx1.sml?httpAccept=%2A%2F%2A",
            "@multimediatype": "GIF image file",
            "@type": "IMAGE-THUMBNAIL",
            "@size": "3274",
            "@ref": "fx1",
            "@mimetype": "image/gif"
          }
        ]
      },
      "link": {
        "@rel": "abstract",
        "@href": "https://api.elsevier.com/content/abstract/scopus_id/84907487397"
      }
    }
  }
}