{
  "metadata": {
    "title": "Selective <ce:italic>cis</ce:italic>-dihydroxylation of olefins using recyclable homogeneous molybdenum acetylide catalyst",
    "authors": "; ; ",
    "journal": "Journal of Molecular Catalysis A: Chemical",
    "date": "2008-04-18",
    "doi": "10.1016/j.molcata.2008.01.034",
    "abstract": "",
    "uri": "https://api.elsevier.com/content/article/pii/S1381116908000770",
    "pii": "S1381116908000770"
  },
  "fulltext": {
    "full-text-retrieval-response": {
      "scopus-eid": "2-s2.0-43049145771",
      "originalText": "serial JL 271358 291210 291744 291790 291809 31 Journal of Molecular Catalysis A: Chemical JOURNALMOLECULARCATALYSISACHEMICAL 2008-02-03 2008-02-03 2010-03-29T10:57:16 1-s2.0-S1381116908000770 S1381-1169(08)00077-0 S1381116908000770 10.1016/j.molcata.2008.01.034 S300 S300.1 FULL-TEXT 1-s2.0-S1381116908X00044 2015-05-15T05:56:33.307883-04:00 0 0 20080418 2008 2008-02-03T00:00:00Z articleinfo crossmark dco dateupdated tomb dateloaded datesearch indexeddate issuelist volumelist yearnav absattachment articletitlenorm authfirstinitialnorm authfirstsurnamenorm cid cids contenttype copyright dateloadedtxt docsubtype doctype doi eid ewtransactionid hubeid issfirst issn issnnorm itemstage itemtransactionid itemweight openaccess openarchive pg pgfirst pglast pii piinorm pubdatestart pubdatetxt pubyr sortorder srctitle srctitlenorm srctype subheadings volfirst volissue webpdf webpdfpagecount figure table body acknowledge affil articletitle auth authfirstini authfull authkeywords authlast primabst ref specialabst alllist content subj ssids 1381-1169 13811169 285 285 1 2 1 2 Volume 285, Issues 1–2 18 111 119 111 119 20080418 18 April 2008 2008-04-18 2008 article fla Copyright © 2008 Elsevier B.V. All rights reserved. SELECTIVECISDIHYDROXYLATIONOLEFINSUSINGRECYCLABLEHOMOGENEOUSMOLYBDENUMACETYLIDECATALYST BIRADAR A 1 Introduction 2 Experimental 2.1 General 2.2 Preparation of CpMo(CO)3(CCPh) (1) 2.3 Catalytic reactions 2.4 Product isolation 2.5 Cyclic voltametric studies 3 Results and discussion 3.1 Cyclic voltammetric studies 3.2 Mechanistic studies 4 Conclusion Acknowledgments References 2004 MODERNOXIDATIONMETHODS KATSUKI 2001 T ASYMMETRICOXIDATIONREACTIONAPRACTICALAPPROACHINCHEMISTRY 1986 ORGANICSYNTHESISBYOXIDATIONMETALCOMPOUNDS SHELDON 1981 R METALCATALYSEDOXIDATIONSORGANICCOMPOUND SCHROEDER 1980 187 213 M KOLB 1994 2483 2547 H BOLM 2000 399 C CATALYTICASYMMETRICSYNTHESIS CAINELLI 1989 45 47 G HERRMANN 1997 197 205 W KOBAYASHI 1999 11229 11230 S BOLM 2001 93 95 C MOTORINA 2001 2325 2328 I CHOUDARY 2002 5341 5349 B TANG 2004 1378 1379 W SEVEREYNS 2001 586 589 A LU 2000 575 576 X BECKER 1996 448 451 H FARNEGARDH 1999 10424 10425 K JONSSON 2001 1365 1371 S DOBLER 2000 10289 10297 C ELL 2003 1012 1016 A CHOUDARY 2004 183 187 B DEBOER 2005 7990 7991 J WAEWEL 1991 1578 1579 S SAMANTA 2004 235 241 S SATO 1998 1646 1647 K OLDENBURG 2005 15672 15673 P OLDENBURG 2006 15 21 P SCHROEDER 2007 6339 6342 K BITTERLICH 2007 521 529 B GELALCHA 2007 7293 7296 F DEHAYES 1975 2110 2116 L OHLER 2005 115 130 N DONGARE 2003 720 723 M PATIL 2003 429 434 P BIRADAR 2005 190 195 A MA 2004 101 106 X MAITI 2006 9843 9857 S MAITI 2005 554 563 S GHARAH 2004 2630 2632 N ABRANTES 2003 2112 2118 M GRIVANI 2005 375 378 G MARTINS 2005 2582 2589 A FREUND 2006 3718 3729 C VALENTE 2005 127 130 A DELAMATA 1999 155 161 F SHIU 1997 151 156 C WHITE 1970 261 266 C BRUCE 1984 1955 1961 M CALIN 2003 7304 7308 N HORNEBECQ 2003 3586 3593 V FUJIHARA 2000 383 390 T BIANCHI 1996 179 182 C CHAKRABORTY 1999 106 108 D DJORDJEVIC 1988 2926 2932 C TAN 2003 1180 1185 S CUI 2006 34 39 L DEMORAES 2004 513 518 M UNOURA 1999 7 15 K RAJAN 1981 660 664 O TOPALOGLUSOZUER 2005 3303 3310 I DEUBEL 2003 645 651 D YIP 2005 14239 14249 W RAU 1991 7420 7421 M KHOLDEEVA 2005 173 178 O BIRADARX2008X111 BIRADARX2008X111X119 BIRADARX2008X111XA BIRADARX2008X111X119XA item S1381-1169(08)00077-0 S1381116908000770 1-s2.0-S1381116908000770 10.1016/j.molcata.2008.01.034 271358 2010-10-11T07:03:07.497737-04:00 2008-04-18 1-s2.0-S1381116908000770-main.pdf https://s3.amazonaws.com/prod-ucs-content-store-us-east/content/pii:S1381116908000770/MAIN/application/pdf/05dbff8f3f09fb3c3045d95db4dad6fc/main.pdf https://s3-eu-west-1.amazonaws.com/prod-ucs-content-store-eu-west/content/pii:S1381116908000770/MAIN/application/pdf/05dbff8f3f09fb3c3045d95db4dad6fc/main.pdf main.pdf pdf true 457778 MAIN 9 1-s2.0-S1381116908000770-main_1.png https://s3-eu-west-1.amazonaws.com/prod-ucs-content-store-eu-west/content/pii:S1381116908000770/PREVIEW/image/png/c6ffeb50b8a9cb1475e1be31e915f6bc/main_1.png https://s3.amazonaws.com/prod-ucs-content-store-us-east/content/pii:S1381116908000770/PREVIEW/image/png/c6ffeb50b8a9cb1475e1be31e915f6bc/main_1.png main_1.png png 75535 849 656 IMAGE-WEB-PDF 1 1-s2.0-S1381116908000770-sc1.jpg https://s3.amazonaws.com/prod-ucs-content-store-us-east/content/pii:S1381116908000770/sc1/DOWNSAMPLED/image/jpeg/8e146a125c05d9c81b6d7cac69af84c5/sc1.jpg https://s3-eu-west-1.amazonaws.com/prod-ucs-content-store-eu-west/content/pii:S1381116908000770/sc1/DOWNSAMPLED/image/jpeg/8e146a125c05d9c81b6d7cac69af84c5/sc1.jpg sc1 sc1.jpg jpg 7592 67 377 IMAGE-DOWNSAMPLED 1-s2.0-S1381116908000770-sc1.sml https://s3.amazonaws.com/prod-ucs-content-store-us-east/content/pii:S1381116908000770/sc1/THUMBNAIL/image/gif/ce0b3454247c2d355a38031eb0ce077a/sc1.sml https://s3-eu-west-1.amazonaws.com/prod-ucs-content-store-eu-west/content/pii:S1381116908000770/sc1/THUMBNAIL/image/gif/ce0b3454247c2d355a38031eb0ce077a/sc1.sml sc1 sc1.sml sml 643 22 125 IMAGE-THUMBNAIL 1-s2.0-S1381116908000770-sc2.jpg https://s3.amazonaws.com/prod-ucs-content-store-us-east/content/pii:S1381116908000770/sc2/DOWNSAMPLED/image/jpeg/91e0dfe6d83a010bdb1e9eb61dc274f8/sc2.jpg https://s3-eu-west-1.amazonaws.com/prod-ucs-content-store-eu-west/content/pii:S1381116908000770/sc2/DOWNSAMPLED/image/jpeg/91e0dfe6d83a010bdb1e9eb61dc274f8/sc2.jpg sc2 sc2.jpg jpg 21653 330 384 IMAGE-DOWNSAMPLED 1-s2.0-S1381116908000770-sc2.sml https://s3.amazonaws.com/prod-ucs-content-store-us-east/content/pii:S1381116908000770/sc2/THUMBNAIL/image/gif/9a0fa6e6f3321fc872c8e2d92b48a2bc/sc2.sml https://s3-eu-west-1.amazonaws.com/prod-ucs-content-store-eu-west/content/pii:S1381116908000770/sc2/THUMBNAIL/image/gif/9a0fa6e6f3321fc872c8e2d92b48a2bc/sc2.sml sc2 sc2.sml sml 1387 94 109 IMAGE-THUMBNAIL 1-s2.0-S1381116908000770-gr1.jpg https://s3.amazonaws.com/prod-ucs-content-store-us-east/content/pii:S1381116908000770/gr1/DOWNSAMPLED/image/jpeg/b6d7437fd5ff237200a5f5a40a5cfa59/gr1.jpg https://s3-eu-west-1.amazonaws.com/prod-ucs-content-store-eu-west/content/pii:S1381116908000770/gr1/DOWNSAMPLED/image/jpeg/b6d7437fd5ff237200a5f5a40a5cfa59/gr1.jpg gr1 gr1.jpg jpg 23886 353 560 IMAGE-DOWNSAMPLED 1-s2.0-S1381116908000770-gr1.sml https://s3.amazonaws.com/prod-ucs-content-store-us-east/content/pii:S1381116908000770/gr1/THUMBNAIL/image/gif/46af1009e0215602c59f27aeb6311fa3/gr1.sml https://s3-eu-west-1.amazonaws.com/prod-ucs-content-store-eu-west/content/pii:S1381116908000770/gr1/THUMBNAIL/image/gif/46af1009e0215602c59f27aeb6311fa3/gr1.sml gr1 gr1.sml sml 1139 79 125 IMAGE-THUMBNAIL 1-s2.0-S1381116908000770-gr2.jpg https://s3.amazonaws.com/prod-ucs-content-store-us-east/content/pii:S1381116908000770/gr2/DOWNSAMPLED/image/jpeg/699bb84eafff941c7b97df1e2dc0b252/gr2.jpg https://s3-eu-west-1.amazonaws.com/prod-ucs-content-store-eu-west/content/pii:S1381116908000770/gr2/DOWNSAMPLED/image/jpeg/699bb84eafff941c7b97df1e2dc0b252/gr2.jpg gr2 gr2.jpg jpg 11306 281 383 IMAGE-DOWNSAMPLED 1-s2.0-S1381116908000770-gr2.sml https://s3.amazonaws.com/prod-ucs-content-store-us-east/content/pii:S1381116908000770/gr2/THUMBNAIL/image/gif/763cf086a3fcb3d7483f4b26770cf8ec/gr2.sml https://s3-eu-west-1.amazonaws.com/prod-ucs-content-store-eu-west/content/pii:S1381116908000770/gr2/THUMBNAIL/image/gif/763cf086a3fcb3d7483f4b26770cf8ec/gr2.sml gr2 gr2.sml sml 1033 92 125 IMAGE-THUMBNAIL 1-s2.0-S1381116908000770-gr3.jpg https://s3.amazonaws.com/prod-ucs-content-store-us-east/content/pii:S1381116908000770/gr3/DOWNSAMPLED/image/jpeg/d2a885c6e2f120691000aafcd2a5b61f/gr3.jpg https://s3-eu-west-1.amazonaws.com/prod-ucs-content-store-eu-west/content/pii:S1381116908000770/gr3/DOWNSAMPLED/image/jpeg/d2a885c6e2f120691000aafcd2a5b61f/gr3.jpg gr3 gr3.jpg jpg 9790 283 386 IMAGE-DOWNSAMPLED 1-s2.0-S1381116908000770-gr3.sml https://s3.amazonaws.com/prod-ucs-content-store-us-east/content/pii:S1381116908000770/gr3/THUMBNAIL/image/gif/407bef785ccbfde7bdefd108a050da90/gr3.sml https://s3-eu-west-1.amazonaws.com/prod-ucs-content-store-eu-west/content/pii:S1381116908000770/gr3/THUMBNAIL/image/gif/407bef785ccbfde7bdefd108a050da90/gr3.sml gr3 gr3.sml sml 876 91 125 IMAGE-THUMBNAIL 1-s2.0-S1381116908000770-gr4.jpg https://s3.amazonaws.com/prod-ucs-content-store-us-east/content/pii:S1381116908000770/gr4/DOWNSAMPLED/image/jpeg/c12c61721e50e889bf3d0bfbc4bb3008/gr4.jpg https://s3-eu-west-1.amazonaws.com/prod-ucs-content-store-eu-west/content/pii:S1381116908000770/gr4/DOWNSAMPLED/image/jpeg/c12c61721e50e889bf3d0bfbc4bb3008/gr4.jpg gr4 gr4.jpg jpg 19966 269 387 IMAGE-DOWNSAMPLED 1-s2.0-S1381116908000770-gr4.sml https://s3.amazonaws.com/prod-ucs-content-store-us-east/content/pii:S1381116908000770/gr4/THUMBNAIL/image/gif/60d735ae0ee5834c05e2c59466d6e78b/gr4.sml https://s3-eu-west-1.amazonaws.com/prod-ucs-content-store-eu-west/content/pii:S1381116908000770/gr4/THUMBNAIL/image/gif/60d735ae0ee5834c05e2c59466d6e78b/gr4.sml gr4 gr4.sml sml 1659 87 125 IMAGE-THUMBNAIL 1-s2.0-S1381116908000770-gr5.gif https://s3.amazonaws.com/prod-ucs-content-store-us-east/content/pii:S1381116908000770/gr5/DOWNSAMPLED/image/gif/ef908fc4bcd5cc418d12ddcaa23f7541/gr5.gif https://s3-eu-west-1.amazonaws.com/prod-ucs-content-store-eu-west/content/pii:S1381116908000770/gr5/DOWNSAMPLED/image/gif/ef908fc4bcd5cc418d12ddcaa23f7541/gr5.gif gr5 gr5.gif gif 13042 220 593 IMAGE-DOWNSAMPLED 1-s2.0-S1381116908000770-gr5.sml https://s3.amazonaws.com/prod-ucs-content-store-us-east/content/pii:S1381116908000770/gr5/THUMBNAIL/image/gif/f84b1c37229c7266c3a21d81add8af74/gr5.sml https://s3-eu-west-1.amazonaws.com/prod-ucs-content-store-eu-west/content/pii:S1381116908000770/gr5/THUMBNAIL/image/gif/f84b1c37229c7266c3a21d81add8af74/gr5.sml gr5 gr5.sml sml 1372 46 125 IMAGE-THUMBNAIL 1-s2.0-S1381116908000770-gr6.gif https://s3.amazonaws.com/prod-ucs-content-store-us-east/content/pii:S1381116908000770/gr6/DOWNSAMPLED/image/gif/694c779fb5e3ae612dfda582e03c080d/gr6.gif https://s3-eu-west-1.amazonaws.com/prod-ucs-content-store-eu-west/content/pii:S1381116908000770/gr6/DOWNSAMPLED/image/gif/694c779fb5e3ae612dfda582e03c080d/gr6.gif gr6 gr6.gif gif 10717 213 545 IMAGE-DOWNSAMPLED 1-s2.0-S1381116908000770-gr6.sml https://s3.amazonaws.com/prod-ucs-content-store-us-east/content/pii:S1381116908000770/gr6/THUMBNAIL/image/gif/7d6d07e16620c3874e3b624e9c0b96e1/gr6.sml https://s3-eu-west-1.amazonaws.com/prod-ucs-content-store-eu-west/content/pii:S1381116908000770/gr6/THUMBNAIL/image/gif/7d6d07e16620c3874e3b624e9c0b96e1/gr6.sml gr6 gr6.sml sml 1348 49 125 IMAGE-THUMBNAIL 1-s2.0-S1381116908000770-fx1.jpg https://s3.amazonaws.com/prod-ucs-content-store-us-east/content/pii:S1381116908000770/fx1/DOWNSAMPLED/image/jpeg/e18ba84d52a60b4314e6c1b3bf1ea353/fx1.jpg https://s3-eu-west-1.amazonaws.com/prod-ucs-content-store-eu-west/content/pii:S1381116908000770/fx1/DOWNSAMPLED/image/jpeg/e18ba84d52a60b4314e6c1b3bf1ea353/fx1.jpg fx1 true fx1.jpg jpg 21770 132 322 IMAGE-DOWNSAMPLED 1-s2.0-S1381116908000770-fx1.sml https://s3.amazonaws.com/prod-ucs-content-store-us-east/content/pii:S1381116908000770/fx1/THUMBNAIL/image/gif/ab2e4791ac879a626537a014819c33d7/fx1.sml https://s3-eu-west-1.amazonaws.com/prod-ucs-content-store-eu-west/content/pii:S1381116908000770/fx1/THUMBNAIL/image/gif/ab2e4791ac879a626537a014819c33d7/fx1.sml fx1 true fx1.sml sml 1022 51 125 IMAGE-THUMBNAIL MOLCAA 7089 S1381-1169(08)00077-0 10.1016/j.molcata.2008.01.034 Elsevier B.V. Fig. 1 FTIR spectrum of Catalyst 1 after addition of H2O2. Fig. 2 UV–vis spectrum of blue complex. Fig. 3 UV–vis spectrum of catalyst 1 after addition of hydrogen peroxide. Fig. 4 XPS spectrum of the Mo(3d) levels of blue complex. Fig. 5 (A) Cyclic voltammogram of catalyst 1 in CH2Cl2 at 50mV/s scan rate (B) Time dependent (after each 5 min) cyclic voltammograms of catalyst 1 after addition of H2O2 at 50mV/s scan rate. Fig. 6 (A) Superimposed cyclic voltammograms of blank (1) and of blue complex (2) in CH2Cl2 using 0.1M tetrabutyl ammoniumhexaflorophosphate as a supporting electrolyte. (B) Cycle dependence redox peaks of blue complex. Scheme 1 Dihydroxylation of cyclohexene. Scheme 2 Proposed mechanism for cyclohexene dihydroxylation. Table 1 Effect of solvent on conversion and selectivity Entry Solvent Conversion, % Selectivity, % TON cis-diol cis-Diol Ene-ol Ene-one Other 1 CH3CN 67 60 17 23 0 201 2 MeOH 91 42 4 6 48 a 191 3 t-BuOH 95 86 0 5 9 b 409 4 CH2Cl2 69 68 4 19 9 235 5 CHCl3 72 62 23 15 0 223 6 CCl4 68 60 21 19 0 204 Reaction conditions: Cyclohexene, 0.02mol; H2O2 (35%), 0.04mol; 1, 0.04×10−3 mol; TOS, 48h; temperature, 65°C. a 2-Methoxy cyclohexanol. b 2-Butoxy cyclohexanol. Table 2 Batchwise additions of substrate and oxidant without catalyst separation Cycle a TOS b , h Conversion, % Selectivity TON TOF Diol Eneol Eneone Ether 0 9 91 86 00 5.6 8.4 78 8.6 1 18 86 85.5 00 6 7.5 147 8.2 2 27 83 86 00 7 7 214 7.9 3 36 84 84 3 6 7 282 7.8 4 45 92 83.3 5.1 5.6 5.8 343 7.65 5 54 82 84 3.5 6.5 6 413 7.6 Reaction conditions: 1, 0.2mmol; temperature, 65°C; t-BuOH, 10g. a Charge added before each cycle: cyclohexene, 0.020mol; 35% H2O2, 0.04mmol. b Time up to each cycle. Table 3 Catalyst recycles study by isolating the catalyst Recycle a TOS b , h Conversion, % Diol selectivity, % TOF, h−1 0 9 92 86 8.8 1 9 89.2 85 8.4 2 9 86.9 86 8.3 3 9 85.8 85 8.2 4 9 83.1 84 7.9 5 9 82 83 7.8 Reaction conditions: 1, 0.2mmol. a Charge added before each cycle: cyclohexene, 0.020mol, 35% H2O2, 0.04mmol; t-butanol, 10g. b Time for each cycle separately. Table 4 Oxidation of olefins using catalyst 1 Entry Substrate Oxidant Temperature, °C Time, h Conversion, % Diol Selectivity Epoxide Others 1 Styrene H2O2 65 10 95 82 0 8 a , 10 b 2 Styrene TBHP 65 14 92 73.1 0 10.8 a , 16.1 b 3 α-Methyl styrene H2O2 90 5 65 73 0 27 c 9 90 58.3 0 41.7 c 4 α-Methyl styrene TBHP 90 5 53 63.4 0 36.6 c 12 80 45 0 55 c 5 Limonene H2O2 65 48 92 30 d , 15 e , 17 f 29 g 9 h 6 Limonene TBHP 65 48 86 92 d , 6 f 0 2 h 7 Cyclopentene H2O2 65 48 65 82 0 18 i Reaction conditions: Catalyst 1, 0.04×10−3 mol; substrate, 0.02mol; oxidant, 0.04mol; t-BuOH, 10g. a Diolether. b Benzaldehyde. c 2-Phenyl propionaldehyde. d Limonene 1,2-diol. e Limonene 8,9-diol. f Limonene 1,2-diol 8,9 oxide. g Limonene diepoxide. h Unidentified product. i Allylic oxidation products (cyclopentenone 13%+cyclopentenol 5%). Selective cis-dihydroxylation of olefins using recyclable homogeneous molybdenum acetylide catalyst Ankush V. Biradar a Bhaskar R. Sathe b Shubhangi B. Umbarkar a ⁎ Mohan K. Dongare a a Catalysis Division, National Chemical Laboratory, Dr. Homi Bhabha Road, Pune 411008, India b Physical Chemistry Division, National Chemical Laboratory, Dr. Homi Bhabha Road, Pune 411008, India ⁎ Corresponding author. Tel.: +91 20 25902044; fax: +91 20 25902633. Graphical abstract Selective cis-dihydroxylation of various olefins using molybdenum acetylide complex CpMo(CO)3(CCPh) as efficient and recyclabale catalyst with H2O2 as oxidant has been reported. The extensive characterization of catalyst and intermediate species suggest molybdenum oxo–peroxo complex to be catalytically active species and formation of dimeric molybdenum complex with mixed valence Mo(V) and Mo(VI) as reaction intermediate. Based on the characterization results possible mechanism is proposed. Selective cis-dihydroxylation of various olefins has been carried out using molybdenum acetylide complex CpMo(CO)3(CCPh) (1) as catalyst and hydrogen peroxide as an efficient and environmentally benign oxidant. In case of cyclohexene, very high conversion (95%) and selectivity (86%) for cis-dihydroxylated product has been achieved using H2O2 as an oxidant and t-butanol as a solvent. cis-Dihydroxylation of other substrates like styrene, α-methyl styrene, limonene and cyclopentene has also been carried out with very high selectivity for diol. The catalyst and intermediate species have been characterized using FT-IR, UV–vis spectral analysis and XPS studies as well as cyclic voltametric studies. These studies suggest that molybdenum oxo–peroxo complex is the catalytically active species. The intermediate blue complex when characterized by ESI MS suggested the formation of dimeric molybdenum complex and XPS and cyclic voltametric studies confirm the presence of mixed valence Mo(V) and Mo(VI) in the reaction intermediate. Based on the characterization results possible mechanism for dihydroxylation is proposed. Interestingly, even though the catalyst is homogeneous; it could be recovered quantitatively by extraction in aqueous phase and recycled five times without any appreciable loss in cyclohexene conversion and selectivity for cis-1,2-cyclohexanediol. Keywords cis-Dihydroxylation Acetylide complex Homogeneous catalysis Recyclable Hydrogen peroxide 1 Introduction Alkene oxidation is being widely studied because of its importance in the development of synthetic organic chemistry [1]. The osmium tetroxide (OsO4), catalyzed olefin dihydroxylation provides an efficient route for synthesis of vicinal diols, which are valuable synthetic intermediates for pharmaceuticals [2]. Especially, Sharpless asymmetric dihydroxylation (AD) provides highest enantioselectivity, which leads to the chiral process [2a]. Osmium tetroxide is the only efficient catalyst known today for asymmetric dihydroxylation for enantiomerically pure product. High cost, toxicity and possible contamination of the osmium catalyst in the products prohibit its use in industry. To overcome these drawbacks, complexation of osmium with ligands, which are heterogenized on soluble and insoluble polymers [3], silica gel [4], ion exchange [5] or dendrimer [6] support has been attempted by several groups [7]. Another disadvantage of osmium system is the need of various co-oxidants such as N-methyl morpholine N-oxide (NMO) [8], or K3Fe(CN)6 [9] so as to facilitate the use of OsO4 in catalytic amounts as against stoicheometric amounts in traditional dihydroxylation reactions. Hydrogen peroxide has been used as terminal oxidant [10] for recycle of Os(VI) to Os(VIII) along with NMO and biomimetic flavin [11]. Beller et al. have used molecular oxygen or air as stoicheometric oxidants for osmium catalyzed dihydroxylation with good to excellent chemoselectivity under optimized pH conditions. For α-methyl styrene as model substrate, under slightly elevated oxygen pressure very high yields of diols are obtained even at very low catalyst concentrations [12]. In order to overcome the problem of toxicity, cost and also to have environmentally benign process for dihydroxylation of olefins, there is a need to search for an alternative metal catalyst system for the production of vicinal diols. There are few reports on Os/Re [13], Os/Pd and Os/W [14] catalytic systems for dihydroxylation, however addition of co-oxidant and/or addition of various carboxylic acids for maintaining acidic medium is essential for dihydroxylation. Recently, Feringa et al. [15] have used manganese complexes as catalysts for dihydroxylation using hydrogen peroxide as oxidant. However they have shown that the use of various carboxylic acids as co-catalysts is essential in this case, and epoxide was obtained as a major product along with cis-diol in many cases. Warwel et al. [16] have reported oxidation of higher olefins with hydrogen peroxide in dioxane solvent forming vicinal diols using Re2O7 as catalyst. However selectively trans-diol was obtained only in the case of cyclohexene. Bhaumik et al. [17] have used Co(III) containing mesoporous silica as catalyst and H2O2, TBHP or oxygen as oxidant for dihydroxylation of cyclohexene, however the selectivity for trans-diol is much higher than cis-diol. Cyclohexene is used as a model substrate for studying different oxidation catalysts. Noyori et al. [18] have reported oxidation of various olefins including cyclohexenes to dicarboxylic acids with H2O2 using sodium tungstate as catalyst and quaternary ammonium hydrogensulphate as phase transfer catalyst. This provides very efficient route for adipic acid synthesis. Recently, Oldenburg and Que [19] have used non-heme iron complexes for cis-dihydroxylation of olefins using ten equivalents hydrogen peroxide with respect to catalyst. However turnover numbers reported are extremely low. Beller et al. [20] have shown the efficient use of FeCl3 with 2,6-pyridine dicarboxylic acid and various N containing ligands for epoxidation of olefins using hydrogen peroxide as an oxidant. They have also extended this to asymmetric epoxidation using chiral N containing ligands with excellent yields and ee up to 97% [21]. In biological systems all molybdenum containing enzymes catalyze redox processes by involving one or two electron transfer per enzyme molecule and this electron transfer depends on the oxidation states of the molybdenum atoms present in the neighboring enzymes [22]. Similar kind of behavior of molybdenum is expected in complexes containing mixed valent molybdenum centres. Various molybdenum complexes and oxides are known to be very good homogeneous as well as heterogeneous catalysts for oxidation/epoxidation reactions. MoO3 on different solid supports is used for oxidation [23], nitration [24] and transesterification [25] reactions. Bhattacharyya et al. have prepared different Mo(VI) oxo–peroxo or oxo–diperoxo complexes with various ligands and successfully used these complexes for epoxidation of various olefins and oxidation of alcohols to carbonyl compounds [26]. Molybdenum carbonyl complexes with different ligands like halides [27], N-containing [28] and cyclopentadienyl; η 5-C5R5; R=H, Me, Ph [29] are mainly used for epoxidation of variety of olefins. Kuehn et al. [30] as well as Goncalves et al. [31] have reported use of CpMo(CO)3Cl as catalyst for olefin oxidation with very high selectivity for epoxide [32]. Tungsten acetylide complexes are reported to form oxo–peroxo complexes on treatment with H2O2 in acidic medium [33]. Hence similar molybdenum complexes are expected to be good oxidation catalysts. To our knowledge there are no reports in the literature on the use of molybdenum catalyst, homogeneous or heterogeneous, for cis-dihydroxylation. Here we report for the first time cis-dihydroxylation of various olefins catalyzed by homogeneous recyclable molybdenum acetylide complex, CpMo(CO)3(CCPh); Cp= η 5-C5H5 (1) using hydrogen peroxide or TBHP as oxidant along with detailed cyclic voltammetric investigation of different forms of the Mo catalysts. 2 Experimental 2.1 General All reagents of commercial grade (Aldrich, SD fine) were used as received unless stated otherwise. Hydrogen peroxide used was 35% w/w in water. THF was dried according to standard method and freshly distilled prior to use. Cyclopentadiene was obtained by freshly cracking dicyclopentadiene (Aldrich make) by distillation prior to use. CpMo(CO)3Cl was prepared according to literature method [34]. Complex 1 was prepared according to literature method with slight modification [35] as follows. 2.2 Preparation of CpMo(CO)3(CCPh) (1) A 100mL 2 necked round bottom flask was charged with CpMo(CO)3Cl (2.0g, 0.0071mol), (H-CCPh) (1.05g, 0.010mol), catalytic amount of CuI (5mg) and diethyl amine (50mL) as solvent. The reaction mixture was stirred at room temperature for 15min. The progress of the reaction was monitored by TLC using hexane/dichloromethane (80/20) as solvent system. After the reaction was complete, diethyl amine was removed in vacuum. The residue was dissolved in minimum amount (5mL) of dicholometane and loaded on silica gel column and eluted using hexane/dichloromethane 80/20 (v/v) as solvent system to separate 1 from unreacted CpMo(CO)3Cl. Yield of CpMo(CO)3(CCPh) was 1.5g, 68% based on CpMo(CO)3Cl. The formation of 1 was confirmed by comparing its FT-IR spectrum in KBr; which matched with the reported values ν(CO), 1940, 2031cm−1; ν(C≡C), 2102cm−1 [35]. 2.3 Catalytic reactions In a typical catalytic reaction, 50mL two neck round bottom flask was charged with olefin (0.02mol), 35% hydrogen peroxide (0.04mol), 10g solvent and catalyst 1 (0.04×10−3 mol). The reaction mixture was heated to desired temperature and stirred till completion of the reaction. Reaction was monitored by GC. All samples were analyzed on an Agilent 6890 Gas Chromatograph equipped with a HP-5 dimethyl polysiloxane column (60m length, 0.25mm internal diameter, 0.25μm film thickness) with flame ionization detector and PerkinElmer autosystem XL equipped with a capillary column PE-1 (30m length, 0.25mm internal diameter and 1μm film thickness) with flame ionization detector. The reaction products were confirmed by GC-MS (Model GC Agilent 6890N with HP5 MS 30m capillary column, MS Agilent 5973 Network MSD and GCIR ((PerkinElmer Spectrum 2001, column DB-1, 25m length, 0.32mm internal diameter). The FT-IR was recorded as nujol mull using Shimadzu 8300. The electrospray mass spectra were recorded on a MICROMASS QUATTRO II triple quadrupole mass spectrometer. The sample dissolved in water was introduced into ESI source through syringe pump at the rate of 5μL per min. The ESI capillary was set at 3.5kV. The spectrum was collected in 6s scans. For each sample the spectra were recorded at a cone voltage of 30 and 80V. 2.4 Product isolation In case of cyclohexene, after completion of the reaction, the reaction mixture was cooled to room temperature and solvent was removed in vacuum. To the residue ethyl acetate and water was added and crude diol extracted in organic layer was obtained after removal of the solvent in vacuum. Diol was purified by column chromatography on silica gel using petroleum ether and ethyl acetate (90/10, v/v) solvent system. 2.5 Cyclic voltametric studies The cyclic voltammetric measurements were performed using a three electrode system comprised of platinum wires as counter and working electrodes in dichloromethane containing 0.1M tetrabutyl ammonium hexaflorophosphate as supporting electrolyte. A Pt quasi reference electrode was used to report all potentials values. Cyclic voltammograms were recorded using a CH instrument model no 400B, after purging the electrolyte with pure Argon. Each time, the working electrode was sonicated in 6% nitric acid and polished manually using 0.3μm alumina slurry over a fine polishing cloth. Final washings were done by the deionized water followed by acetone. For calibrating the quasi reference electrode, ferrocene was added to the electrolyte to make a 0.1M solution with respect to supporting electrolyte (tetra butyl ammonium hexaflorophosphate) and cyclic voltammogram was recorded. The E 1/2 for the ferrocene/ferrocinium redox couple was found to be 0.235V. FTIR of complex 1 and complex 1 after addition of H2O2 was recorded as KBr pallet using Shimadzu 8300 FTIR spectrometer. UV–vis spectral analysis was carried out using PerkinElmer Lambda 650 UV–vis spectrometer as t-BuOH solution and t-BuOH as reference in the range 200–800nm. XPS experiments were performed in a Vacuum Generators Escalab 220 XL spectrometer using a non-monochromatic Al Kα (hυ =1486.6eV) operated at 15kV and 20mA. The pressure in the sample chamber is maintained at 10−9 mbar or lower during the analysis. All the binding energies are with reference to carbon (C1s) at 285eV. Curve fitting of the Mo3d peaks was done using VG Eclipse Software. 3 Results and discussion When cyclohexene was treated with H2O2 in t-BuOH solvent in presence of catalytic amount of Mo–acetylide complex 1 (1/substrate ratio 1/500), cis-1,2-cyclohexane diol was obtained as the major product along with 2-alkoxy cyclohexanol, cyclohexenol and cyclohexenone as minor products (Scheme 1 ). Monoetherification of diol due to excess of alcohol used as solvent led to the formation of 2-alkoxy cyclohexanol. Cyclohexenol and cyclohexenone are obtained as a result of allylic oxidation. The reaction was monitored by GC and the products were confirmed by GC–MS, GCIR and NMR spectroscopy. Additionally, cis-1,2-cyclohexanediol was confirmed by its melting point (98°C). NMR (CDCl3) δ, ppm 2.63 (2H, CHO H ), 3.35 (2H, C H OH), 1.97 (2H, HC H e CHOH), 1.71 (2H, HC H a CHOH), 1.27 (4H, C H 2CH2CHOH). The reaction was carried out in different solvents (Table 1 ). The results show that alcohols are preferred solvents for this system, as it forms single phase with organic substrate and aqueous hydrogen peroxide. In case of lower alcohols like methanol, etherification was prominent leading to decrease in diol selectivity (entry 2). When bulky alcohol like t-BuOH was used (entry 3), selectivity for ether decreased drastically leading to very high selectivity (86%) for vicinal diol. In case of other solvents (entries 1 and 4–6) conversion as well as selectivity was less compared to alcohol. In all the cases the turn over number (TON=moles of product formed/moles of 1) in one cycle for cis-diol was quite high. Especially with t-BuOH as solvent (entry 3) very high TON (409) was obtained showing very high efficiency of the catalyst. Bhaumik et al. [17] have used Co(III) containing mesoporous silica as catalyst for cyclohexene dihydroxylation. The cyclohexene conversions are reported to be in the range of 47–85% with high selectivity for trans-diol compared to cis-diol. Using H2O2 as oxidant 80.6% cyclohexene conversion is reported with 35.6% selectivity for cis-diol and 64.4% selectivity for trans-diol. The maximum TON for cis-diol reported with Co containing silica is 28. Hence the selectivity for cis-diol obtained with 1 is much higher than Co containing silica. It is observed that higher catalyst loading leads to increase in the reaction rate. When catalyst loading was increased from 0.2 to 1mol% reaction was complete in 9h instead of 48h without change in diol selectivity. In order to check the stability of the catalyst fresh charge of cyclohexene and H2O2 was added to the reaction mixture after completion of the reaction with 1mol% catalyst loading. The reaction was further continued and the turn over frequency (TOF) was determined (Table 2 ). There was no change in TOF even after five additions of reactants. The stability of the catalyst was further tested by isolating the product in organic phase and recovering the catalyst in aqueous phase for its recycle. The aqueous phase was concentrated to remove maximum water before each recycle. The selectivity for cis-diol did not decrease considerably even after five such recycles (Table 3 ). The decrease in conversion can be attributed to the losses during handling of the small amount of catalyst during recycle. These results clearly show the stability of the molybdenum acetylide catalyst in the reaction media as well its recovery and recycle without any appreciable decrease in catalytic activity and selectivity which is rare case in homogeneous catalysis. In order to check the wider applicability of this catalyst to other olefins for cis-dihydroxylation, various other olefins like styrene, α-methyl styrene, limonene and cyclopentene were tested for its oxidation. The results of these oxidations are given in Table 4 . The results for styrene show very high conversion of styrene (>90%) using hydrogen peroxide (entry 1) as well as TBHP (entry 2) with no formation of epoxide. Very high selectivity for diol is obtained with formation of benzaldehyde as minor product. Etherification of styrene diol was observed to very less extent. (H2O2 8% and TBHP 10.8%). In case of α-methyl styrene (entry 3 and 4) though the conversion was slightly lower compared to styrene, no formation of epoxide was observed in this case also. Though formation of diol is prominent, it is observed that with longer reaction time, the diol gets converted to 2-phenyl propionaldehyde. The diol selectivity when H2O2 was used as an oxidant decreased from 73% at 5h to 53% at 9h with corresponding increase in the 2-phenyl propionaldehyde selectivity. Similarly when TBHP was used as an oxidant the selectivity for diol decreased from 63 (5h) to 45% (12h) with corresponding increase in 2-phenyl propionaldehyde selectivity. In case of cyclopentene (entry 8) high conversion (85%) with very high selectivity (82%) for diol was obtained with low selectivity (18%) for allylic oxidation products (cyclopentenone and cyclopentenol). In his case also no epoxide formation was observed. Though in case of limonene also very high conversion was obtained with H2O2 (92%) as well as TBHP (86%) the number of products obtained are more. The products obtained are limonene 1,2-diol, limonene 8,9-diol, limonene diepoxide and limonene 1,2-diol 8,9-oxide. Very high selectivity for limonene 1,2-diol (92%) was obtained when TBHP was used compared to H2O2 (30%). Though in case of TBHP no epoxide was obtained, in case of H2O2, 29% diepoxide was obtained. In both the cases small amount of limonene 1,2-diol 8,9-oxide was obtained. Above results show that in all the cases very high selectivity for diol was obtained though in some cases further etherification of diol was observed. In all the cases either no or very less quantity of epoxide was formed which shows very high efficiency of the catalyst for dihydroxylation. It is also observed that with TBHP the reaction is slow compared to H2O2, though no considerable change in the product distribution is observed. In case of cyclohexene dihydroxylation when less than stoicheometric amount of hydrogen peroxide was added, the reaction did not go to completion with formation of blue colored complex in the reaction mixture. The original color of the reaction mixture was faint yellow. It was observed that when further H2O2 was added to the same reaction mixture, the reaction continued with disappearance of the blue color. We have characterised the blue complex in the reaction mixture using various techniques. The color change of the catalyst from faint yellow to blue and again to faint yellow indicates the redox behavior of molybdenum centre. The blue color is characteristics of mixed valence molybdenum (MoVI and MoV), well known as molybdenum blue. Color of pure Mo(VI) species is faint yellow or brown where as the color of pure Mo(V) species is red [36]. Molybdenum blue species are referred to as compounds coming from redox process resulting in a mixture of Mo(VI) and Mo in lower oxidation state Mo(V) [37]. The presence of mixed valence molybdenum species was confirmed by cyclic voltammetric studies of blue complex, which showed presence of two reversible redox couples, one for Mo(V) to Mo(VI) and back to Mo(V) and other is for Mo(VI) to Mo(V) and back to Mo(VI). The FTIR spectrum of catalyst 1 after addition of H2O2 (Fig. 1 ) confirms the formation of molybdenum oxo–peroxo species. The peak at 953cm−1 confirms the presence of MoO terminal bond. The band at 858cm−1 corresponds to the OO stretching vibration of peroxo species. The weak bands at 664 and 577cm−1 can be assigned to the MoO2 (peroxo) asymmetric and symmetric stretching vibrations respectively. The IR positions for Mo oxo and peroxo moieties are in good agreement with the literature reports for various Mo oxo–peroxo complexes [38]. The acetylide moiety remains intact even after addition of H2O2, which is confirmed by broad low intensity band centered at 2100cm−1 assigned to ν(CC). The bands due to CH stretching vibrations of phenyl ring are observed in the range 2854–2955cm−1 and the CC stretching vibrations of the ring are observed at 1464 and 1377cm−1 even after addition of hydrogen peroxide. The bands due to carbonyl stretching (1940, 2031cm−1) disappear after addition of H2O2. This clearly indicates the removal of all the CO ligands after addition of hydrogen peroxide forming higher oxidation state Mo (VI) complex with retention of acetylide, CCPh group attached to Mo center. Roskey et al. [39] have reported for first time structural characterization of chloride oxo–peroxo compounds of Mo and W. The structure of the oxo–peroxo has been confirmed by single crystal X-ray diffraction analysis. UV–vis spectral analysis (Fig. 2 ) of the blue complex shows absorbance in the UV region at λ max 221nm and shoulder at 305 and 326nm. This can be attributed to charge transfer associated with organic group or MoO moiety. Broad absorption in visible region ∼747nm is responsible for the blue color of the complex. It can be due to d–d transitions involving Mo(V) and inter valence charge transfer transition (IVCT) between Mo(V) and Mo(VI) via an oxo bridge. The shoulder peaks at 305 and 326nm can be attributed to peroxo ligand to metal charge transfer (LMCT), which is in good agreement with the literature values reported for peroxo Mo-nicotinic acid complexes (304 and 310nm) [40]. The UV spectrum of catalyst 1 after addition of hydrogen peroxide (Fig. 3 ) shows two broad absorptions at 233 and 315nm, which confirms the formation of molybdenum peroxo species. The UV spectrum of catalyst 1 shows absorption at λ max 270nm, with a shoulder at 285nm and a broad band centered at 386. Attempts were made to record the 1H and 95Mo NMR spectrum of blue complex, however no signal was obtained due to presence of paramagnetic Mo(V) center. XPS studies of the blue complex confirmed the presence of mixed valent molybdenum centers, Mo(VI) and Mo(V). Fig. 4 shows the XPS spectrum of the Mo 3d levels of blue complex. The experimental data represented by solid circles clearly shows the characteristic Mo(3d) doublet composed of the 3d5/2 and 3d3/2 levels produced by spin-orbit coupling. Good fitting of the data points is made using two pairs of Gaussian functions, corresponding to two possible 3d doublets of Mo in different oxidation states, viz., Mo(VI) and Mo(V). The contribution from the Gaussian peaks centered at 232.0 and 235.2eV is major and is assigned to Mo(V). However the minor peaks centered at 233.4 and 236.4eV are assigned to Mo(VI). From the ratio of the areas of the two Gaussian pairs, the ratio of Mo(V) to Mo(VI) is 0.72/0.28, which clearly shows that Mo(V) is predominantly present in the blue complex. The binding energies are in agreement with the literature values [41]. Moraes et al. have prepared molybdenum oxide thin films by hot filament metal oxide deposition technique and characterized using XPS which indicates that Mo atoms are in mixed valence state, Mo(VI) (232.7 and 235.8eV) and Mo(V) (231.6 and 234.6eV) with high predominance of Mo(VI) and formation of oxygen deficient MoO3 film [42].. Thus XPS results of blue complex support the FTIR as well as UV–vis data for presence of molybdenum centers in mixed oxidation state, Mo(+5) and Mo(+6). 3.1 Cyclic voltammetric studies In the following section, we report the electrochemical investigation of Mo catalysts in various steps. Our results summarize the redox behavior of a blue complex containing molybdenum in two different oxidation states viz. Mo (V) and Mo (VI). Voltammetric response of 0.1M catalyst 1 in dichloromethane shows no peak corresponding to the redox behavior of catalyst (Fig. 5A). The cyclic voltammetric response of the same catalyst after addition of hydrogen peroxide (Fig. 5B) shows the time dependent increment in the irreversible oxidation peak at potential −0.080V (whereas a slightly time dependent shift towards negative potential −0.370V), which indicates the direct conversion of electro inactive species Mo (0) to stable higher oxidation state species Mo (VI) [43]. The slight oxidation peak could be observed in the voltammograms after the addition of the H2O2 to the catalytic solution, due to the oxygen adsorption on the platinum wire in a potential window between −0.5 and −0.2Vv/s Fc/Fc+ redox couple. Due to this reason the shift of nearly 290mV in potential towards negative potential is seen. The voltammograms for blue molybdenum intermediate complex is shown in Fig. 6 , which illustrates at a point of cathodic potential cycle (−0.65 and −0.96Vv/s Fc/Fc+) indicates a one electron per molybdenum reduction and the same occurs in the case of anodic potential cycle giving the second pair of peaks at −0.3 and −0.89Vv/s Fc/Fc+ respectively. A cyclic voltammogram of the freshly prepared complex recorded immediately interestingly indicates that the peaks at −0.96 and −0.89V dominates initially and with time the −0.65 and −0.3V peaks increase in height, these voltammetric results confirms that the −0.96V species is coupled with −0.89V species and the −0.3V peak is coupled with the −0.89V peak. The first two peaks are for two forms of Mo (VI) and the second two peaks are for Mo (V). Fig. 6B shows an increment in peak currents of Mo (VI) and Mo (V) accompanied by a shift to more positive values in the first two cycles indicating increased difficulty in oxidation. This could be attributed to some structural changes accompanying oxidation of the Mo centers, decreasing the thermodynamic feasibility (known from the formal potentials) of the anodic processes [44]. Interestingly, both the anodic peaks are found to merge in the third cycle giving rise to one broad peak at an intermediate potential, which could be due to the formation of mixed valence [Mo (VI) and Mo (V)] species. 3.2 Mechanistic studies Traditional OsO4 catalyzed dihydroxylation takes place by the mechanism where CC double bond undergoes either 3+2 addition to OOsO to form 5 membered metallacycle or it undergoes 2+2 addition to OsO to give 4 membered metallacycle followed by rearrangement [45]. During the five membered ring formation Os(VIII) gets reduced to Os(VI), which is reoxidised using co-oxidant. Recently, Che et al. [46] have reported stoichiometric cis-dihydroxylation of alkenes using [(Me3tanc)(CF3CO2)RuVIO2]+ complex where dioxo ligands are in cis-configuration. In this reaction the 3+2 cyclo addition of alkene to cis-dioxo moiety has been proved by isolating and characterizing the adduct by single crystal X-ray diffraction analysis. This gives an evidence for five membered metallacycle as intermediate for cis-dihydroxylation using MO2 systems. Geoffroy [47] has reported 2+2 cyclo addition of ketene to Cp*WO3 − anion where CC bond of ketene adds to WO to give four membered ring. Many organic and inorganic moieties add across one of the WO bond of Cp*WO3 − to give cyclic or acyclic addition products. The speculated mechanism for molybdenum acetylide 1 catalyzed dihydroxylation is given in Scheme 2 , where in the first step Mo oxo–peroxo complex is formed in presence of H2O2, which has been confirmed by FTIR and UV–vis spectral analysis. In the second step 3+2 addition of CC of cyclohexene to Mo-peroxo moiety takes place to give five membered metallacycle intermediate. In this case 2+2 addition followed by rearrangement to give 5 membered ring does not look probable as initial presence of 2 rings (3 membered M-peroxo and 4 membered ring) on one metal centre would be sterically hindered, hence 3+2 addition seems more probable. Dimerisation of the intermediate after probable reaction with water to give blue complex before the diol is liberated followed by reaction of Mo(IV) species thus formed with H2O2 to give again Mo-oxo–peroxo complex completes the catalytic cycle. The probable structure of blue complex is suggested based on the ESI-MS studies of the mixture. In the case of cyclohexene initial epoxide formation followed by hydrolysis of epoxide ring to yield diol does not look probable, as no trace of epoxide was observed in GC analysis. Kholdeeva et al. [48] have reported epoxide ring opening to give selective trans-diol formation using polyoxometalate. However in case of cyclohexene only cis-isomer is obtained without formation of even trace amount of trans-isomer. 4 Conclusion In summary molybdenum acetylide complex has proven to be an efficient catalyst for dihydroxylation of olefins with high conversion and selectivity for vicinal diols. This molybdenum acetylide complex is highly stable and can be recycled efficiently. This system overcomes the drawbacks of osmium systems as well as no co-catalyst or co-oxidant is needed. Hydrogen peroxide acts as efficient and environmentally benign oxidizing agent. Very high TON is obtained when t-butanol is used as solvent. This catalyst has potential to be used for asymmetric dihydroxylation (AD) with use of chiral cyclopentadiene as ligand instead of simple cyclopentadiene. Acknowledgments SBU acknowledges the financial support by Department of Science and Technology. AVB acknowledges the Council of Scientific and Industrial Research for fellowship. Authors kindly acknowledge Dr. Vijaymohanan for helpful discussion on cyclic voltametric studies. Thanks are due to SAIF, Lucknow for providing mass spectrum. Thanks are also due to Leon Gengembre, Martin Trentesaux and Marie Angelique Languille, UCCS, University of Lille 1, France for XPS studies. References [1] (a) J.-E. Backvall Modern Oxidation Methods 2004 Wiley-VCH (b) T. Katsuki Asymmetric Oxidation Reaction: A Practical Approach in Chemistry 2001 Oxford University Press (c) H.S. Singh W.J. Mijs De Jonge Organic Synthesis by Oxidation with Metal Compounds 1986 Plenum New York (d) R.A. Sheldon J.K. Kochi Metal Catalysed Oxidations of Organic Compound 1981 Academic Press [2] (a) M. Schroeder Chem. Rev. 80 1980 187 213 (b) H.C. Kolb M.S. Van Nieuwenhze K.B. Sharpless Chem. Rev. 94 1994 2483 2547 (c) C. Bolm J.P. Hildebrand K. Muniz I. Ojima Catalytic Asymmetric Synthesis second ed. 2000 VCH New York 399 [3] (a) G. Cainelli M. Contento F. Manescalchi L. Plessi Synthesis 1989 45 47 (b) W.A. Herrmann R.M. Kratzer J. Blümel H.B. Friedrich R.W. Fischer D.C. Apperley J. Mink O. Berkesi J. Mol. Catal. 120 1997 197 205 (c) S. Kobayashi M. Endo S. Nagayama J. Am. Chem. Soc. 121 1999 11229 11230 [4] (a) C. Bolm A. Maischak Synlett 2001 93 95 (b) I. Motorina C.M. Crudden Org. Lett. 3 2001 2325 2328 [5] B.M. Choudary N.S. Chowdari K. Jyothi M.L. Kantam J. Am. Chem. Soc. 124 2002 5341 5349 [6] W.J. Tang N.F. Yang B. Yi G.J. Deng Y.Y. Huang Q.H. Fan Chem. Commun. 2004 1378 1379 [7] A. Severeyns D.E. De Vos L. Fiermans F. Verpoort P.J. Grobet P.A. Jacobs Angew. Chem. Int. Ed. 40 2001 586 589 [8] X. Lu Z. Xu G. Yang Org. Process Res. Dev. 4 2000 575 576 [9] H. Becker K.B. Sharpless Angew. Chem. Int. Ed. Engl. 35 1996 448 451 [10] K. Fa1rnegårdh S.Y. Jonsson J.-E. Ba1ckvall J. Am. Chem. Soc. 121 1999 10424 10425 [11] S.Y. Jonsson K. Fa1rnegårdh J.-E. Ba1ckvall J. Am. Chem. Soc. 123 2001 1365 1371 [12] C. Dobler G.M. Mehltretter U. Sundermeier M. Beller J. Am. Chem. Soc. 122 2000 10289 10297 [13] A.H. Ell A. Closson H. Adolfsson J.-E. Blackvall Adv. Synth. Catal. 345 2003 1012 1016 [14] B.M. Choudary S. Madhi N.S. Chowdari M.L. Kantam Top. Catal. 29 2004 183 187 [15] J.W. De Boer J. Brinksma W.R. Browne A. Meetsma P.L. Alsters R. Hage B.L. Feringa J. Am. Chem. Soc. 127 2005 7990 7991 [16] S. Waewel M.R. Klass M. Sojka J.C.S. Chem. Commun. 1991 1578 1579 [17] S. Samanta S.C. Laha N.K. Mal A. Bhaumik J. Mol. Catal. A 222 2004 235 241 [18] K. Sato M. Aoki R. Noyori Science 281 1998 1646 1647 [19] (a) P.D. Oldenburg A.A. Shteinman L. Que Jr. J. Am. Chem. Soc. 127 2005 15672 15673 (b) P.D. Oldenburg L. Que Jr. Catal. Today 117 2006 15 21 [20] (a) K. Schroeder X. Tong B. Bitterlich M.K. Tse F.G. Gelalcha A. Brueckner M. Beller Tet. Lett. 48 2007 6339 6342 (b) B. Bitterlich G. Anilkumar F.G. Gelalcha B. Spilker A. Grotevendt R. Jackstell M.K. Tse M. Beller Chem. Asian J. 2 2007 521 529 [21] F.G. Gelalcha B. Bitterlich G. Anilkumar M.K. Tse M. Beller Angew. Chem. Int. Ed. 46 2007 7293 7296 [22] L.J. De Hayes C. Harold Faulkner H.W. Doub D.T. Sawyer Inorg. Chem. 14 1975 2110 2116 [23] N. Ohler A.T. Bell J. Catal. 231 2005 115 130 [24] (a) M.K. Dongare E. Kemnitz Green Chem. 5 2003 720 723 (b) P.T. Patil K.M. Malshe S.P. Dagade M.K. Dongare Catal. Commun. 4 2003 429 434 [25] (a) A.V. Biradar S.B. Umbarkar M.K. Dongare Appl. Catal. A 285 2005 190 195 (b) X. Ma J. Gong S. Wang N. Gao D. Wang X. Yang F. He Catal. Commun. 5 2004 101 106 [26] (a) S.K. Maiti K.M.A. Malik S. Gupta S. Chakraborty A.K. Ganguli A.K. Mukherjee R. Bhattacharyya Inorg. Chem. 45 2006 9843 9857 (b) S.K. Maiti S. Banerjee A.K. Mukherjee K.M.A. Malik R. Bhattacharyya New J. Chem. 29 2005 554 563 (c) N. Gharah S. Chakraborty A.K. Mukherjee R. Bhattacharyya Chem. Commun. 2004 2630 2632 [27] M. Abrantes A.M. Santos J. Mink F.E. Kuehn C.C. Romao Organometallics 22 2003 2112 2118 [28] G. Grivani S. Tangestaninejad M.H. Habibi V. Mirkhani Catal. Commun. 6 2005 375 378 [29] A.M. Martins C.C. Romao M. Abrantes M.C. Azevedo J. Cui A.R. Dias M.T. Duarte M.A. Lemos T. Lourenco R. Poli Organometallics 24 2005 2582 2589 [30] C. Freund M. Abrantes F.E. Kuehn J. Organomet. Chem. 691 2006 3718 3729 [31] A.A. Valente J.D. Seixas I.S. Goncalves M. Abrantes M. Pillinger C.C. Romao Catal. Lett. 101 2005 127 130 [32] F.J. de la Mata P. Giner P. Royo J. Organomet. Chem. 572 1999 155 161 [33] C-W. Shiu C-J. Su C.-W. Pin Y. Chi P.S.-M. Peng G.-H. Lee J. Organomet. Chem. 545–546 1997 151 156 [34] C. White R.J. Mawby Inorg. Chim. Acta 4 1970 261 266 [35] M.I. Bruce M.G. Humphrey J.G. Matisons S.K. Roy A.G. Swincer Aust. J. Chem. 37 1984 1955 1961 [36] N. Calin S.C. Sevov Inorg. Chem. 42 2003 7304 7308 [37] V. Hornebecq Y. Mastai M. Antonietti Polarz Chem. Mater. 15 2003 3586 3593 [38] (a) T. Fujihara K. Hoshiba Y. sasaki T. Imamura Bull. Chem. Soc. Jpn. 73 2000 383 390 (b) C.L. Bianchi F. Porta Vacuum 47 1996 179 182 [39] D. Chakraborty M. Bhattacharjee R. Kraetzner R. Siefken H.W. Roesky I. Uso’n H.-G. Schmidt Organometallics 18 1999 106 108 [40] C. Djordjevic B.C. Puryear N. Vuletic C.J. Abelt S.J. Sheffield Inorg. Chem. 27 1988 2926 2932 [41] (a) S. Tan M. Hobday J. Gorman G. Amiet C. Rix J. Mater. Chem. 13 2003 1180 1185 (b) L.-F. Cui D.-M. Li J.-F. Wu X.-B. Cui T.-G. Wang J.-Q. Xu J. Mol. Struct. 797 2006 34 39 [42] M.A.B. de Moraes B.C. Trasferetti F.P. Rouxinol R. Landers S.F. Durrant J. Scarmı’nio A. Urbano Chem. Mater. 16 2004 513 518 [43] K. Unoura T. Suzuki A. Nagasawa A. Yamazaki Y. Fukuda Inorg. Chim. Acta 29 1999 7 15 [44] (a) O.A. Rajan A. Chakravorty Inorg. Chem. 20 1981 660 664 (b) I. Topaloglu- Sozuer A. Gunyar S. Dulger-Irdem M. Baya R. Poli Inorg. Chim. Acta 357 2005 3303 3310 [45] D.V. Deubel G. Frenking Acc. Chem. Res. 36 2003 645 651 [46] W.-P. Yip W.-Y. Yu N. Zhu C.-M. Che J. Am. Chem. Soc. 127 2005 14239 14249 [47] M.S. Rau C.M. Kretz L.A. Mercando G.L. Geoffroy J. Am. Chem. Soc. 113 1991 7420 7421 [48] O.A. Kholdeeva T.A. Trubistina M.N. Timofeeva G.M. Maksimov R.I. Maksimovskaya V.A. Rogov J. Mol. Catal. A 232 2005 173 178",
      "scopus-id": "43049145771",
      "coredata": {
        "eid": "1-s2.0-S1381116908000770",
        "dc:description": "Selective cis-dihydroxylation of various olefins has been carried out using molybdenum acetylide complex CpMo(CO)3(CCPh) (1) as catalyst and hydrogen peroxide as an efficient and environmentally benign oxidant. In case of cyclohexene, very high conversion (95%) and selectivity (86%) for cis-dihydroxylated product has been achieved using H2O2 as an oxidant and t-butanol as a solvent. cis-Dihydroxylation of other substrates like styrene, α-methyl styrene, limonene and cyclopentene has also been carried out with very high selectivity for diol. The catalyst and intermediate species have been characterized using FT-IR, UV–vis spectral analysis and XPS studies as well as cyclic voltametric studies. These studies suggest that molybdenum oxo–peroxo complex is the catalytically active species. The intermediate blue complex when characterized by ESI MS suggested the formation of dimeric molybdenum complex and XPS and cyclic voltametric studies confirm the presence of mixed valence Mo(V) and Mo(VI) in the reaction intermediate. Based on the characterization results possible mechanism for dihydroxylation is proposed. Interestingly, even though the catalyst is homogeneous; it could be recovered quantitatively by extraction in aqueous phase and recycled five times without any appreciable loss in cyclohexene conversion and selectivity for cis-1,2-cyclohexanediol.",
        "openArchiveArticle": "false",
        "prism:coverDate": "2008-04-18",
        "openaccessUserLicense": null,
        "prism:aggregationType": "Journal",
        "prism:url": "https://api.elsevier.com/content/article/pii/S1381116908000770",
        "dc:creator": [
          {
            "@_fa": "true",
            "$": "Biradar, Ankush V."
          },
          {
            "@_fa": "true",
            "$": "Sathe, Bhaskar R."
          },
          {
            "@_fa": "true",
            "$": "Umbarkar, Shubhangi B."
          },
          {
            "@_fa": "true",
            "$": "Dongare, Mohan K."
          }
        ],
        "link": [
          {
            "@_fa": "true",
            "@rel": "self",
            "@href": "https://api.elsevier.com/content/article/pii/S1381116908000770"
          },
          {
            "@_fa": "true",
            "@rel": "scidir",
            "@href": "https://www.sciencedirect.com/science/article/pii/S1381116908000770"
          }
        ],
        "dc:format": "application/json",
        "openaccessType": null,
        "pii": "S1381-1169(08)00077-0",
        "prism:volume": "285",
        "prism:publisher": "Elsevier B.V.",
        "dc:title": "Selective cis-dihydroxylation of olefins using recyclable homogeneous molybdenum acetylide catalyst",
        "prism:copyright": "Copyright © 2008 Elsevier B.V. All rights reserved.",
        "openaccess": "0",
        "prism:issn": "13811169",
        "prism:issueIdentifier": "1-2",
        "dcterms:subject": [
          {
            "@_fa": "true",
            "$": "cis-Dihydroxylation"
          },
          {
            "@_fa": "true",
            "$": "Acetylide complex"
          },
          {
            "@_fa": "true",
            "$": "Homogeneous catalysis"
          },
          {
            "@_fa": "true",
            "$": "Recyclable"
          },
          {
            "@_fa": "true",
            "$": "Hydrogen peroxide"
          }
        ],
        "openaccessArticle": "false",
        "prism:publicationName": "Journal of Molecular Catalysis A: Chemical",
        "prism:number": "1-2",
        "openaccessSponsorType": null,
        "prism:pageRange": "111-119",
        "prism:endingPage": "119",
        "pubType": "fla",
        "prism:coverDisplayDate": "18 April 2008",
        "prism:doi": "10.1016/j.molcata.2008.01.034",
        "prism:startingPage": "111",
        "dc:identifier": "doi:10.1016/j.molcata.2008.01.034",
        "openaccessSponsorName": null
      },
      "objects": {
        "object": [
          {
            "@category": "standard",
            "@height": "67",
            "@width": "377",
            "@_fa": "true",
            "$": "https://api.elsevier.com/content/object/eid/1-s2.0-S1381116908000770-sc1.jpg?httpAccept=%2A%2F%2A",
            "@multimediatype": "JPEG image file",
            "@type": "IMAGE-DOWNSAMPLED",
            "@size": "7592",
            "@ref": "sc1",
            "@mimetype": "image/jpeg"
          },
          {
            "@category": "thumbnail",
            "@height": "22",
            "@width": "125",
            "@_fa": "true",
            "$": "https://api.elsevier.com/content/object/eid/1-s2.0-S1381116908000770-sc1.sml?httpAccept=%2A%2F%2A",
            "@multimediatype": "GIF image file",
            "@type": "IMAGE-THUMBNAIL",
            "@size": "643",
            "@ref": "sc1",
            "@mimetype": "image/gif"
          },
          {
            "@category": "standard",
            "@height": "330",
            "@width": "384",
            "@_fa": "true",
            "$": "https://api.elsevier.com/content/object/eid/1-s2.0-S1381116908000770-sc2.jpg?httpAccept=%2A%2F%2A",
            "@multimediatype": "JPEG image file",
            "@type": "IMAGE-DOWNSAMPLED",
            "@size": "21653",
            "@ref": "sc2",
            "@mimetype": "image/jpeg"
          },
          {
            "@category": "thumbnail",
            "@height": "94",
            "@width": "109",
            "@_fa": "true",
            "$": "https://api.elsevier.com/content/object/eid/1-s2.0-S1381116908000770-sc2.sml?httpAccept=%2A%2F%2A",
            "@multimediatype": "GIF image file",
            "@type": "IMAGE-THUMBNAIL",
            "@size": "1387",
            "@ref": "sc2",
            "@mimetype": "image/gif"
          },
          {
            "@category": "standard",
            "@height": "353",
            "@width": "560",
            "@_fa": "true",
            "$": "https://api.elsevier.com/content/object/eid/1-s2.0-S1381116908000770-gr1.jpg?httpAccept=%2A%2F%2A",
            "@multimediatype": "JPEG image file",
            "@type": "IMAGE-DOWNSAMPLED",
            "@size": "23886",
            "@ref": "gr1",
            "@mimetype": "image/jpeg"
          },
          {
            "@category": "thumbnail",
            "@height": "79",
            "@width": "125",
            "@_fa": "true",
            "$": "https://api.elsevier.com/content/object/eid/1-s2.0-S1381116908000770-gr1.sml?httpAccept=%2A%2F%2A",
            "@multimediatype": "GIF image file",
            "@type": "IMAGE-THUMBNAIL",
            "@size": "1139",
            "@ref": "gr1",
            "@mimetype": "image/gif"
          },
          {
            "@category": "standard",
            "@height": "281",
            "@width": "383",
            "@_fa": "true",
            "$": "https://api.elsevier.com/content/object/eid/1-s2.0-S1381116908000770-gr2.jpg?httpAccept=%2A%2F%2A",
            "@multimediatype": "JPEG image file",
            "@type": "IMAGE-DOWNSAMPLED",
            "@size": "11306",
            "@ref": "gr2",
            "@mimetype": "image/jpeg"
          },
          {
            "@category": "thumbnail",
            "@height": "92",
            "@width": "125",
            "@_fa": "true",
            "$": "https://api.elsevier.com/content/object/eid/1-s2.0-S1381116908000770-gr2.sml?httpAccept=%2A%2F%2A",
            "@multimediatype": "GIF image file",
            "@type": "IMAGE-THUMBNAIL",
            "@size": "1033",
            "@ref": "gr2",
            "@mimetype": "image/gif"
          },
          {
            "@category": "standard",
            "@height": "283",
            "@width": "386",
            "@_fa": "true",
            "$": "https://api.elsevier.com/content/object/eid/1-s2.0-S1381116908000770-gr3.jpg?httpAccept=%2A%2F%2A",
            "@multimediatype": "JPEG image file",
            "@type": "IMAGE-DOWNSAMPLED",
            "@size": "9790",
            "@ref": "gr3",
            "@mimetype": "image/jpeg"
          },
          {
            "@category": "thumbnail",
            "@height": "91",
            "@width": "125",
            "@_fa": "true",
            "$": "https://api.elsevier.com/content/object/eid/1-s2.0-S1381116908000770-gr3.sml?httpAccept=%2A%2F%2A",
            "@multimediatype": "GIF image file",
            "@type": "IMAGE-THUMBNAIL",
            "@size": "876",
            "@ref": "gr3",
            "@mimetype": "image/gif"
          },
          {
            "@category": "standard",
            "@height": "269",
            "@width": "387",
            "@_fa": "true",
            "$": "https://api.elsevier.com/content/object/eid/1-s2.0-S1381116908000770-gr4.jpg?httpAccept=%2A%2F%2A",
            "@multimediatype": "JPEG image file",
            "@type": "IMAGE-DOWNSAMPLED",
            "@size": "19966",
            "@ref": "gr4",
            "@mimetype": "image/jpeg"
          },
          {
            "@category": "thumbnail",
            "@height": "87",
            "@width": "125",
            "@_fa": "true",
            "$": "https://api.elsevier.com/content/object/eid/1-s2.0-S1381116908000770-gr4.sml?httpAccept=%2A%2F%2A",
            "@multimediatype": "GIF image file",
            "@type": "IMAGE-THUMBNAIL",
            "@size": "1659",
            "@ref": "gr4",
            "@mimetype": "image/gif"
          },
          {
            "@category": "standard",
            "@height": "220",
            "@width": "593",
            "@_fa": "true",
            "$": "https://api.elsevier.com/content/object/eid/1-s2.0-S1381116908000770-gr5.gif?httpAccept=%2A%2F%2A",
            "@multimediatype": "GIF image file",
            "@type": "IMAGE-DOWNSAMPLED",
            "@size": "13042",
            "@ref": "gr5",
            "@mimetype": "image/gif"
          },
          {
            "@category": "thumbnail",
            "@height": "46",
            "@width": "125",
            "@_fa": "true",
            "$": "https://api.elsevier.com/content/object/eid/1-s2.0-S1381116908000770-gr5.sml?httpAccept=%2A%2F%2A",
            "@multimediatype": "GIF image file",
            "@type": "IMAGE-THUMBNAIL",
            "@size": "1372",
            "@ref": "gr5",
            "@mimetype": "image/gif"
          },
          {
            "@category": "standard",
            "@height": "213",
            "@width": "545",
            "@_fa": "true",
            "$": "https://api.elsevier.com/content/object/eid/1-s2.0-S1381116908000770-gr6.gif?httpAccept=%2A%2F%2A",
            "@multimediatype": "GIF image file",
            "@type": "IMAGE-DOWNSAMPLED",
            "@size": "10717",
            "@ref": "gr6",
            "@mimetype": "image/gif"
          },
          {
            "@category": "thumbnail",
            "@height": "49",
            "@width": "125",
            "@_fa": "true",
            "$": "https://api.elsevier.com/content/object/eid/1-s2.0-S1381116908000770-gr6.sml?httpAccept=%2A%2F%2A",
            "@multimediatype": "GIF image file",
            "@type": "IMAGE-THUMBNAIL",
            "@size": "1348",
            "@ref": "gr6",
            "@mimetype": "image/gif"
          },
          {
            "@category": "standard",
            "@height": "132",
            "@width": "322",
            "@_fa": "true",
            "$": "https://api.elsevier.com/content/object/eid/1-s2.0-S1381116908000770-fx1.jpg?httpAccept=%2A%2F%2A",
            "@multimediatype": "JPEG image file",
            "@type": "IMAGE-DOWNSAMPLED",
            "@size": "21770",
            "@ref": "fx1",
            "@mimetype": "image/jpeg"
          },
          {
            "@category": "thumbnail",
            "@height": "51",
            "@width": "125",
            "@_fa": "true",
            "$": "https://api.elsevier.com/content/object/eid/1-s2.0-S1381116908000770-fx1.sml?httpAccept=%2A%2F%2A",
            "@multimediatype": "GIF image file",
            "@type": "IMAGE-THUMBNAIL",
            "@size": "1022",
            "@ref": "fx1",
            "@mimetype": "image/gif"
          }
        ]
      },
      "link": {
        "@rel": "abstract",
        "@href": "https://api.elsevier.com/content/abstract/scopus_id/43049145771"
      }
    }
  }
}