{
  "metadata": {
    "title": "Effect of oxidative pre-treatment on hydrogen spillover for a Ni/SiO<ce:inf loc=post>2</ce:inf> catalyst",
    "authors": "; ",
    "journal": "Journal of Molecular Catalysis A: Chemical",
    "date": "2017-01-31",
    "doi": "10.1016/j.molcata.2016.11.014",
    "abstract": "",
    "uri": "https://api.elsevier.com/content/article/pii/S1381116916304885",
    "pii": "S1381116916304885"
  },
  "fulltext": {
    "full-text-retrieval-response": {
      "scopus-eid": "2-s2.0-85000992026",
      "originalText": "serial JL 271358 291210 291744 291790 291809 31 Journal of Molecular Catalysis A: Chemical JOURNALMOLECULARCATALYSISACHEMICAL 2016-11-09 2016-11-09 2016-12-01 2016-12-01 2016-12-01T14:15:38 1-s2.0-S1381116916304885 S1381-1169(16)30488-5 S1381116916304885 10.1016/j.molcata.2016.11.014 S300 S300.1 FULL-TEXT 1-s2.0-S1381116916X0012X 2016-12-01T10:03:08.01607-05:00 0 0 20170101 20170131 2017 2016-11-09T16:53:52.088455Z absattachment articleinfo articletitlenorm authfirstinitialnorm authfirstsurnamenorm cid cids contenttype copyright crossmark dateloaded dateloadedtxt datesearch datesort dateupdated dco docsubtype doctype doi eid ewtransactionid hubeid indexeddate issn issnnorm itemstage itemtransactionid itemweight openaccess openarchive pg pgfirst pglast pii piinorm pubdateend pubdatestart pubdatetxt pubyr sortorder srctitle srctitlenorm srctype ssids alllist content subj subheadings suppl tomb volfirst volissue volumelist webpdf webpdfpagecount yearnav figure table e-component body affil appendices articletitle auth authfirstini authfull authkeywords authlast highlightsabst primabst pubtype ref specialabst 1381-1169 13811169 true 426 426 PA Volume 426, Part A 24 190 197 190 197 201701 January 2017 2017-01-01 2017-01-31 2017 article fla © 2016 Elsevier B.V. All rights reserved. EFFECTOXIDATIVEPRETREATMENTHYDROGENSPILLOVERFORANISIO2CATALYST BOUDJAHEM A 1 Introduction 2 Experimental 2.1 Catalyst preparation 2.2 Catalyst characterization 2.3 Catalytic tests and kinetic study 2.4 Study of the effect of calcination on catalyst reactivity 3 Results and discussion 3.1 Degree of reduction of nickel 3.2 H2 adsorption studies 3.3 H2-TPD studies 3.4 Catalytic activity 4 Conclusions Appendix A Supplementary data References BOUDJAHEM 2004 325 334 A CONNER 1995 759 788 W ROZANOV 1997 107 119 V PRINS 2012 14274 14283 R PRINS 2012 2714 2738 R IM 2014 3370 J LEE 2015 26 34 S BOUDART 1970 46 51 M CECKIEWICZ 1987 294 303 S VANNICE 1971 260 263 M MILLER 1996 41 49 J ANDERSON 1989 2983 2990 J PAWELEC 1996 307 322 B BARTHOLOMEW 1976 41 53 C KERMAREC 1995 967 976 M CLAUSE 1991 21 28 O TAUSTER 1978 170 175 S JASIK 2005 81 90 A LI 1984 880 C MOLINA 2001 162 170 R ANDERSON 1993 3651 3657 J MARTIN 1982 233 247 G VANMEERBEEK 1977 320 325 A BORBELY 1989 428 431 G PASCAL 1965 P NOUVEAUTRAITEDECHIMIEMINERALE DOLIDZE 1965 897 G BIANCHI 1979 467 D BIANCHI 1975 135 146 D RAJAGOPAL 1996 57 63 V BETTAHAR 2009 416 424 M WOJCIESZAK 2004 241 253 R BENSERADJ 2002 135 144 F ANTONICCI 1982 140 150 P KEANE 1997 347 355 M AZNAR 1996 105 114 A COUGHLAN 1992 90 109 B SRINIVAS 1994 470 477 S YOON 1983 457 468 K LIN 1993 539 553 S VANMARTEEN 1977 13 24 R LINDFORS 1993 34 42 L MARTIN 1981 367 382 G PRIMET 1977 25 36 M BOUDJAHEM 2011 500 506 A BABERNICS 1972 262 271 L PRIMET 1980 1953 1961 M CHOU 1987 129 139 P BOUDJAHEMX2017X190 BOUDJAHEMX2017X190X197 BOUDJAHEMX2017X190XA BOUDJAHEMX2017X190X197XA 2018-12-01T00:00:00.000Z UnderEmbargo http://creativecommons.org/licenses/by-nc-nd/4.0/ © 2016 Elsevier B.V. All rights reserved. item S1381-1169(16)30488-5 S1381116916304885 1-s2.0-S1381116916304885 10.1016/j.molcata.2016.11.014 271358 2016-12-01T09:27:33.242301-05:00 2017-01-01 2017-01-31 1-s2.0-S1381116916304885-main.pdf https://s3-eu-west-1.amazonaws.com/prod-ucs-content-store-eu-west/content/pii:S1381116916304885/MAIN/application/pdf/0763b5d1faea07202c802fc1acc1b287/main.pdf https://s3.amazonaws.com/prod-ucs-content-store-us-east/content/pii:S1381116916304885/MAIN/application/pdf/0763b5d1faea07202c802fc1acc1b287/main.pdf main.pdf pdf true 817653 MAIN 8 1-s2.0-S1381116916304885-main_1.png https://s3-eu-west-1.amazonaws.com/prod-ucs-content-store-eu-west/content/pii:S1381116916304885/PREVIEW/image/png/208ce9c1e5ed800303543ac6d10b6e08/main_1.png https://s3.amazonaws.com/prod-ucs-content-store-us-east/content/pii:S1381116916304885/PREVIEW/image/png/208ce9c1e5ed800303543ac6d10b6e08/main_1.png main_1.png png 56077 849 656 IMAGE-WEB-PDF 1 1-s2.0-S1381116916304885-fx1.sml https://s3-eu-west-1.amazonaws.com/prod-ucs-content-store-eu-west/content/pii:S1381116916304885/fx1/THUMBNAIL/image/gif/1e45344ac2cd7d202f4654429b8ec849/fx1.sml https://s3.amazonaws.com/prod-ucs-content-store-us-east/content/pii:S1381116916304885/fx1/THUMBNAIL/image/gif/1e45344ac2cd7d202f4654429b8ec849/fx1.sml fx1 true fx1.sml sml 3229 88 219 IMAGE-THUMBNAIL 1-s2.0-S1381116916304885-gr1.sml https://s3-eu-west-1.amazonaws.com/prod-ucs-content-store-eu-west/content/pii:S1381116916304885/gr1/THUMBNAIL/image/gif/7f20d7abe161ba5a2661e6f1eb4b2a15/gr1.sml https://s3.amazonaws.com/prod-ucs-content-store-us-east/content/pii:S1381116916304885/gr1/THUMBNAIL/image/gif/7f20d7abe161ba5a2661e6f1eb4b2a15/gr1.sml gr1 gr1.sml sml 8480 153 219 IMAGE-THUMBNAIL 1-s2.0-S1381116916304885-gr2.sml https://s3-eu-west-1.amazonaws.com/prod-ucs-content-store-eu-west/content/pii:S1381116916304885/gr2/THUMBNAIL/image/gif/d3e6ba781b0ad01db11ceba5d349b7d6/gr2.sml https://s3.amazonaws.com/prod-ucs-content-store-us-east/content/pii:S1381116916304885/gr2/THUMBNAIL/image/gif/d3e6ba781b0ad01db11ceba5d349b7d6/gr2.sml gr2 gr2.sml sml 7069 163 219 IMAGE-THUMBNAIL 1-s2.0-S1381116916304885-gr3.sml https://s3-eu-west-1.amazonaws.com/prod-ucs-content-store-eu-west/content/pii:S1381116916304885/gr3/THUMBNAIL/image/gif/6f9269f66ff6f4639a366515bd3d4ae9/gr3.sml https://s3.amazonaws.com/prod-ucs-content-store-us-east/content/pii:S1381116916304885/gr3/THUMBNAIL/image/gif/6f9269f66ff6f4639a366515bd3d4ae9/gr3.sml gr3 gr3.sml sml 4945 161 219 IMAGE-THUMBNAIL 1-s2.0-S1381116916304885-gr4.sml https://s3-eu-west-1.amazonaws.com/prod-ucs-content-store-eu-west/content/pii:S1381116916304885/gr4/THUMBNAIL/image/gif/991962cc756cab8037643d9de46c0c60/gr4.sml https://s3.amazonaws.com/prod-ucs-content-store-us-east/content/pii:S1381116916304885/gr4/THUMBNAIL/image/gif/991962cc756cab8037643d9de46c0c60/gr4.sml gr4 gr4.sml sml 5922 150 219 IMAGE-THUMBNAIL 1-s2.0-S1381116916304885-sc1.sml https://s3-eu-west-1.amazonaws.com/prod-ucs-content-store-eu-west/content/pii:S1381116916304885/sc1/THUMBNAIL/image/gif/e6486d87f19737b4afe5387949fb0a9d/sc1.sml https://s3.amazonaws.com/prod-ucs-content-store-us-east/content/pii:S1381116916304885/sc1/THUMBNAIL/image/gif/e6486d87f19737b4afe5387949fb0a9d/sc1.sml sc1 sc1.sml sml 4933 126 219 IMAGE-THUMBNAIL 1-s2.0-S1381116916304885-sc2.sml https://s3-eu-west-1.amazonaws.com/prod-ucs-content-store-eu-west/content/pii:S1381116916304885/sc2/THUMBNAIL/image/gif/93792ebe4b5b8db287ab1d3125d7cacd/sc2.sml https://s3.amazonaws.com/prod-ucs-content-store-us-east/content/pii:S1381116916304885/sc2/THUMBNAIL/image/gif/93792ebe4b5b8db287ab1d3125d7cacd/sc2.sml sc2 sc2.sml sml 5654 164 181 IMAGE-THUMBNAIL 1-s2.0-S1381116916304885-fx1.jpg https://s3-eu-west-1.amazonaws.com/prod-ucs-content-store-eu-west/content/pii:S1381116916304885/fx1/DOWNSAMPLED/image/jpeg/9554082d2571e6ccd9e495cc6415c595/fx1.jpg https://s3.amazonaws.com/prod-ucs-content-store-us-east/content/pii:S1381116916304885/fx1/DOWNSAMPLED/image/jpeg/9554082d2571e6ccd9e495cc6415c595/fx1.jpg fx1 true fx1.jpg jpg 11136 200 500 IMAGE-DOWNSAMPLED 1-s2.0-S1381116916304885-gr1.jpg https://s3-eu-west-1.amazonaws.com/prod-ucs-content-store-eu-west/content/pii:S1381116916304885/gr1/DOWNSAMPLED/image/jpeg/21b1a769b6e4ce6b964c6c5399e0bdaf/gr1.jpg https://s3.amazonaws.com/prod-ucs-content-store-us-east/content/pii:S1381116916304885/gr1/DOWNSAMPLED/image/jpeg/21b1a769b6e4ce6b964c6c5399e0bdaf/gr1.jpg gr1 gr1.jpg jpg 48202 368 527 IMAGE-DOWNSAMPLED 1-s2.0-S1381116916304885-gr2.jpg https://s3-eu-west-1.amazonaws.com/prod-ucs-content-store-eu-west/content/pii:S1381116916304885/gr2/DOWNSAMPLED/image/jpeg/6d33b7215261f0401634f40f6a2a4454/gr2.jpg https://s3.amazonaws.com/prod-ucs-content-store-us-east/content/pii:S1381116916304885/gr2/DOWNSAMPLED/image/jpeg/6d33b7215261f0401634f40f6a2a4454/gr2.jpg gr2 gr2.jpg jpg 40436 393 527 IMAGE-DOWNSAMPLED 1-s2.0-S1381116916304885-gr3.jpg https://s3-eu-west-1.amazonaws.com/prod-ucs-content-store-eu-west/content/pii:S1381116916304885/gr3/DOWNSAMPLED/image/jpeg/8ec2f778269774f3afcd70e24ea6f514/gr3.jpg https://s3.amazonaws.com/prod-ucs-content-store-us-east/content/pii:S1381116916304885/gr3/DOWNSAMPLED/image/jpeg/8ec2f778269774f3afcd70e24ea6f514/gr3.jpg gr3 gr3.jpg jpg 32795 387 527 IMAGE-DOWNSAMPLED 1-s2.0-S1381116916304885-gr4.jpg https://s3-eu-west-1.amazonaws.com/prod-ucs-content-store-eu-west/content/pii:S1381116916304885/gr4/DOWNSAMPLED/image/jpeg/2d6f6bf40a5e8e51c4270c3bb3b03176/gr4.jpg https://s3.amazonaws.com/prod-ucs-content-store-us-east/content/pii:S1381116916304885/gr4/DOWNSAMPLED/image/jpeg/2d6f6bf40a5e8e51c4270c3bb3b03176/gr4.jpg gr4 gr4.jpg jpg 38797 361 527 IMAGE-DOWNSAMPLED 1-s2.0-S1381116916304885-sc1.jpg https://s3-eu-west-1.amazonaws.com/prod-ucs-content-store-eu-west/content/pii:S1381116916304885/sc1/DOWNSAMPLED/image/jpeg/2ab0947dff4b7f366be61f9c460796dd/sc1.jpg https://s3.amazonaws.com/prod-ucs-content-store-us-east/content/pii:S1381116916304885/sc1/DOWNSAMPLED/image/jpeg/2ab0947dff4b7f366be61f9c460796dd/sc1.jpg sc1 sc1.jpg jpg 9580 151 263 IMAGE-DOWNSAMPLED 1-s2.0-S1381116916304885-sc2.jpg https://s3-eu-west-1.amazonaws.com/prod-ucs-content-store-eu-west/content/pii:S1381116916304885/sc2/DOWNSAMPLED/image/jpeg/568a02af3bb66ce3f021f5ac1d93b6b9/sc2.jpg https://s3.amazonaws.com/prod-ucs-content-store-us-east/content/pii:S1381116916304885/sc2/DOWNSAMPLED/image/jpeg/568a02af3bb66ce3f021f5ac1d93b6b9/sc2.jpg sc2 sc2.jpg jpg 12479 238 263 IMAGE-DOWNSAMPLED 1-s2.0-S1381116916304885-fx1_lrg.jpg https://s3-eu-west-1.amazonaws.com/prod-ucs-content-store-eu-west/content/pii:S1381116916304885/fx1/HIGHRES/image/jpeg/e68dccc55e3bae14a82aa9181c3ca80f/fx1_lrg.jpg https://s3.amazonaws.com/prod-ucs-content-store-us-east/content/pii:S1381116916304885/fx1/HIGHRES/image/jpeg/e68dccc55e3bae14a82aa9181c3ca80f/fx1_lrg.jpg fx1 true fx1_lrg.jpg jpg 76112 886 2213 IMAGE-HIGH-RES 1-s2.0-S1381116916304885-gr1_lrg.jpg https://s3-eu-west-1.amazonaws.com/prod-ucs-content-store-eu-west/content/pii:S1381116916304885/gr1/HIGHRES/image/jpeg/9b7da726617db5b9f6911883a51e47f1/gr1_lrg.jpg https://s3.amazonaws.com/prod-ucs-content-store-us-east/content/pii:S1381116916304885/gr1/HIGHRES/image/jpeg/9b7da726617db5b9f6911883a51e47f1/gr1_lrg.jpg gr1 gr1_lrg.jpg jpg 393582 1633 2336 IMAGE-HIGH-RES 1-s2.0-S1381116916304885-gr2_lrg.jpg https://s3-eu-west-1.amazonaws.com/prod-ucs-content-store-eu-west/content/pii:S1381116916304885/gr2/HIGHRES/image/jpeg/6bedd3c63b7581cd260f795a4d027e0d/gr2_lrg.jpg https://s3.amazonaws.com/prod-ucs-content-store-us-east/content/pii:S1381116916304885/gr2/HIGHRES/image/jpeg/6bedd3c63b7581cd260f795a4d027e0d/gr2_lrg.jpg gr2 gr2_lrg.jpg jpg 296264 1742 2336 IMAGE-HIGH-RES 1-s2.0-S1381116916304885-gr3_lrg.jpg https://s3-eu-west-1.amazonaws.com/prod-ucs-content-store-eu-west/content/pii:S1381116916304885/gr3/HIGHRES/image/jpeg/002a5bec5bc2fa1f81221cde7f09d566/gr3_lrg.jpg https://s3.amazonaws.com/prod-ucs-content-store-us-east/content/pii:S1381116916304885/gr3/HIGHRES/image/jpeg/002a5bec5bc2fa1f81221cde7f09d566/gr3_lrg.jpg gr3 gr3_lrg.jpg jpg 241026 1713 2333 IMAGE-HIGH-RES 1-s2.0-S1381116916304885-gr4_lrg.jpg https://s3-eu-west-1.amazonaws.com/prod-ucs-content-store-eu-west/content/pii:S1381116916304885/gr4/HIGHRES/image/jpeg/aa44fc3cbd4038578335a9178427cba6/gr4_lrg.jpg https://s3.amazonaws.com/prod-ucs-content-store-us-east/content/pii:S1381116916304885/gr4/HIGHRES/image/jpeg/aa44fc3cbd4038578335a9178427cba6/gr4_lrg.jpg gr4 gr4_lrg.jpg jpg 264498 1600 2333 IMAGE-HIGH-RES 1-s2.0-S1381116916304885-sc1_lrg.jpg https://s3-eu-west-1.amazonaws.com/prod-ucs-content-store-eu-west/content/pii:S1381116916304885/sc1/HIGHRES/image/jpeg/7a897f39545c65b2c4ecda822337e246/sc1_lrg.jpg https://s3.amazonaws.com/prod-ucs-content-store-us-east/content/pii:S1381116916304885/sc1/HIGHRES/image/jpeg/7a897f39545c65b2c4ecda822337e246/sc1_lrg.jpg sc1 sc1_lrg.jpg jpg 69987 672 1167 IMAGE-HIGH-RES 1-s2.0-S1381116916304885-sc2_lrg.jpg https://s3-eu-west-1.amazonaws.com/prod-ucs-content-store-eu-west/content/pii:S1381116916304885/sc2/HIGHRES/image/jpeg/1f40d6a705b02744c03eeac56d76d537/sc2_lrg.jpg https://s3.amazonaws.com/prod-ucs-content-store-us-east/content/pii:S1381116916304885/sc2/HIGHRES/image/jpeg/1f40d6a705b02744c03eeac56d76d537/sc2_lrg.jpg sc2 sc2_lrg.jpg jpg 89808 1056 1167 IMAGE-HIGH-RES 1-s2.0-S1381116916304885-mmc1.docx https://s3-eu-west-1.amazonaws.com/prod-ucs-content-store-eu-west/content/pii:S1381116916304885/mmc1/MAIN/application/msword/21e1ad362e7e2dd99575bc6d8d8185b2/mmc1.docx https://s3.amazonaws.com/prod-ucs-content-store-us-east/content/pii:S1381116916304885/mmc1/MAIN/application/msword/21e1ad362e7e2dd99575bc6d8d8185b2/mmc1.docx mmc1 mmc1.docx docx 137173 APPLICATION MOLCAA 10111 S1381-1169(16)30488-5 10.1016/j.molcata.2016.11.014 Elsevier B.V. Scheme 1 Overall protocol of the catalysts studies. Scheme 1 Scheme 2 Possible reactions paths in benzene hydrogenation over Ni/SiO2 hydrazine catalysts. Scheme 2 Fig. 1 Effect of calcination on the H2-TPD profiles of the Ni/SiO2 catalysts. Fig. 1 Fig. 2 Effect of calcination on the activity of the Ni/SiO2 catalyst. Fig. 2 Fig. 3 Effect of dilution by the support on the activity of a Ni/SiO2 calcined catalyst. Fig. 3 Fig. 4 H2 uptake and TOF’s (at 75°C) as a function the fraction of non reduced nickel. Fig. 4 Table 1 Effect Nickel oxide on Chemisorption and TPD of Hydrogen after Pre-treatment (or reduction) of the catalysts under H2/300°C/2h. Table 1 catalyst degree of reduction% H2 uptakeμmolg−1 Ni (μmolg−1 Ni 0) a H2 desorptionμmolg−1 Ni total at T<TH b at T>TH Ni0 REF – 1010 3089 1005 2084 Ni0 CALC4H 90.0 931(1034) 2584 909(1010) 1675 Ni0CALC10H 80.5 879(1092) 1684 902(1120) 782 Ni0CALC16H 71.8 842(1173) 1682 811(1129) 871 Ni0CALC24H 59.1 740(1252) 1679 773(1308) 906 Ni0CALC16H+SiO2 71.8 941(1310) 3149 756(1053) 2393 a H2 uptake on reduced nickel atoms only (see degree of reduction). b TH: temperature of treatment. Table 2 Degree of reduction and TOF’s for diluted and undiluted catalysts. Table 2 Catalyst Temperature 90°C 75°C 38°C (Extrapolated) Conversion(%) TOFs−1 Conversion(%) TOFs−1 Conversion(%) TOFs−1 Ni0 REF 44.6 0.169 22.2 0.082 9.0 0.034 Ni0 CALC16H 41.8 0.269 23.1 0.144 8.2 0.051 Ni0 CALC16H+SiO2 42.3 0.453 28.2 0.306 8.8 0.095 Editor’s choice paper Effect of oxidative pre-treatment on hydrogen spillover for a Ni/SiO2 catalyst Abdel-Ghani Boudjahem a ⁎ Mohammed M. Bettahar b ⁎ a Nanomaterials Chemistry Group, University of Guelma, Box 401, 24000 Guelma, Algeria Nanomaterials Chemistry Group University of Guelma Box 401 Guelma 24000 Algeria b Institut Jean Barriol, SRSMC, UMR CNRS 7565, Faculté des Sciences et de la Technologie, Université de Lorraine, Boulevard des Aiguillettes, BP 7036, 54506 Vandœuvre Cedex, France Institut Jean Barriol SRSMC UMR CNRS 7565 Faculté des Sciences et de la Technologie Université de Lorraine Boulevard des Aiguillettes BP 7036 Vandœuvre Cedex 54506 France ⁎ Corresponding authors. Graphical abstract The chemisorption and hydrogenating properties of Ni/SiO2 catalysts prepared by the hydrazine method then calcined at 400°C with various times were investigated. Metal dispersion and activity in benzene hydrogenation increased with increasing calcination time whereas desorbed amounts of hydrogen significantly decreased. Dilution of a calcined sample by the support led to a sharp increase of both hydrogen storage by the support and catalytic activity. Metal dispersion and hydrogen storage capacity influenced the reaction mechanisms of hydrogenation of benzene which, therefore, is believed to occur on the metal phase or/and on the support by the hydrogen spillover mechanism. The metal active phase would be composed of an ensemble of metallic and oxidized nickel species. Keywords Nickel catalysts Hydrogen storage Benzene hydrogenation Calcination Hydrogen spillover 1 Introduction In a previous paper we reported results on H2 chemisorption and hydrogenating properties of metallic nickel nanoparticles supported on silica of low surface area [1]. The catalysts were prepared by reduction in aqueous hydrazine. The activity in benzene hydrogenation and hydrogen storage of the support depended on the metal loading and thermal treatments. Remarkably, after calcination in air then re-activation in H2 atmosphere, the catalysts became more active but stored less hydrogen than the as-prepared catalysts. The results obtained were explained using the hydrogen spillover mechanism [2,3]. Since then this mechanism has been critically revisited by Prins et al. [4,5] and Choi et al. [6,7]. These authors report more subtile explanations on the nature of the spillover phenomena and particularly for metal catalysts supported over non reducible oxides. For Prins et al. [5] the surface diffusion of hydrogen species by the spillover mechanism is not possible with non reducible oxides (e.g. MgO, SiO2, zeolite) because the H-spiltover species are strongly bonded to a metal particle and only moderately to a non reducible support. As a result these species cannot be implied in the hydrogenation of unsaturated molecules unless the oxide contained defects or carbon deposits [8]. As to Choi et al. [6], they defined the conditions where the hydrogen spillover concept does hold with non reducible support oxides. The model catalyst was Pt particles encapsulated in a zeolite framework where the respective dimensions of the metal particles and zeolite pores allowed selective diffusion of H2 over various organic molecules. As a result the observed catalytic activities could be unambiguously attributed to catalytic reactions via H spillover at the external surface of the zeolite. The occurrence of H spillover also requires the presence of abundant surface hydroxyls. Effect of calcination on the spillover effect have been reported for metal catalysts supported on non reducible oxides. For Cęckiewicz and Delmon [9], calcination enhances the spillover effect in the hydrogenation of benzene over Pt/γ-Al2O3 diluted with the support because it removes the carbon impurities deposited on the catalyst surface. Contrary to that Vannice and Neikam [10] did not observe the spillover effect in the hydrogenation of benzene over Pd/Al2O3 catalysts diluted with the support and pre-calcined. For the authors, the spillover effect, when claimed for benzene hydrogenation, would be due to carbon impurities which allow the diffusion of surface H-species [5]. Miller et al. [11] reported that the amounts of hydrogen desorbing at high temperature over Pt/SiO2 (Al2O3, zeolites) decreased after a thermal treatment in air. However, the hydrogen molecules were not ascribed to spillover effect but to H-species incorporated in the support during the catalyst preparation. These new insights on the spillover phenomena [4–7] prompted us to confirm and re-examine our previous results on the effect of calcination on catalytic activity. Moreover, effect of calcination on the surface and catalytic properties of metal catalysts prepared by a chemical method has not been reported to our best knowledge. Such investigation would enlarge the knowledge of the role of calcination on the reactivity of metal supported catalysts [12,13]. A Ni0/SiO2 catalyst, prepared by the hydrazine method, was calcined at 400°C with various times. For each sample, the degree of reduction by O2 adsorption, H2 adsorption, H2 temperature programmed desorption (H2-TPD) and activity in benzene hydrogenation were evaluated. One sample was diluted by the support and similarly investigated. 2 Experimental 2.1 Catalyst preparation Nickel acetate tetrahydrate (99.0%, Fluka) and aqueous hydrazine 24–26% (_99.0%, Fluka) were used as received. The silica support (Chempur, 99.99%, 15m2 g−1 and grains of 325mesh) was pretreated in air at 500°C for 10h before use. The catalyst precursor was prepared by impregnating at room temperature a suspension of silica in a solution of nickel acetate, evaporating at 80°C in vacuum then drying at 100°C. The solid precursor was introduced in a solution of hydrazine and heated up to 70°C. The black solution obtained was cooled, filtered and washed with ethanol. The resulting filtrate was dried under vacuum and stored under argon. The final solid contained 1%Ni. 2.2 Catalyst characterization The nickel composition of the catalyst was determined on a Varian AA1275 atomic absorption spectrophotometer. The XRD patterns I(θ) were recorded at a classical θ/2θ diffractometer using Cu Kα radiation. Chemisorption experiments were carried out with a sample of 0.1g on a pulse chromatographic microreactor equipped with the catharometric detector of a microchromatograph (AT M200, Hewlett Packard) fitted with molecular sieve columns and MTI software. The utilized gases were purchased from Air Liquide. Oxygen traces were eliminated from argon (99.995%) and hydrogen (99.995%) by using a manganese oxytrap (Engelhardt). Diluted H2 and O2 in argon and synthetic air were used as received. Each sample was pre-treated with H2 pure (100mLmin−1/2h/300°C), purged under argon atmosphere (100mLmin−1/2h) and cooled to room temperature. After that, gaseous hydrogen (100ppm in argon) was injected in the reactor every 2min until saturation of the sample. Then, the hydrogen saturated sample was purged at room temperature under argon for 2h, a time after which no hydrogen (<1ppm) was detected in the exit gas. It was subsequently submitted to a TPD under same gas (50mLmin−1) with a heating rate of 7.5°Cmin−1 up to 800°C. O2 chemisorption was used to evaluate the degree of reduction of calcined samples, according to the literature data [14]. After calcination each sample was submitted to same H2 heat treatment as above, cooled to room temperature, purged then flowed with gaseous oxygen (150ppm of O2 in helium) every 2min until saturation. 2.3 Catalytic tests and kinetic study The gas-phase hydrogenation reaction was carried out in a quartz fixed-bed reactor after activation under hydrogen as described above for chemisorption studies. The catalytic tests were conducted with a sample of 0.1g and a feed gas of 1% C6H6/H2 and total rate flow of 50mLmin−1 at various temperatures. The catalyst was cleaned in a hydrogen flow (50cm3 min−1) for 30min after each test. The reactant and product analysis were conducted on line using a Hewlett-Packard 5730A FID gas chromatograph equipped with TCEP (2m, 1/8 in) and Sterling (3m, 1/8 in) columns. Conversion was determined by crossing the reaction temperature and, after each temperature, the catalyst was cleaned in a hydrogen flow (50cm3 min−1) for 30min. The kinetic study was performed at 100°C with a catalyst sample of 0.025g. The catalyst was flowed with 1% C6H6/H2 +He as a reactant mixture (100cm3 min−1). Helium (99.999%) was used as received from Air Liquide. The reaction products were analyzed as described above and the conversion was maintained below 3%. 2.4 Study of the effect of calcination on catalyst reactivity The freshly prepared catalyst was calcined at 400°C/air (flow rate of 50mLmin−1 with a heating rate 7.5°Cmin−1) for various times and stored under argon. Notation was Ni0 REF and Ni0 CALCxH for as-prepared and calcined samples respectively, where xH represents the time of calcination in hours. Oxidized nickel was denoted as NiOair. Due to contamination of nickel by moisture during handling, all samples were submitted to in situ standard hydrogen pre-treatment (see above) before chemisorption and catalysis experiments. The overall protocol of the study is reported in Scheme 1 . We underline that after the hydrogen pre-treatment, the reference sample contained Ni0 only whereas the calcined samples comprised both Ni0 and NiO species. This means that in each sample Ni0 is the sum of residual metallic nickel (not oxidized by the 400°C/air treatment) plus that due to the partial reduction of NiOair during the standard hydrogen pre-treatment. 3 Results and discussion 3.1 Degree of reduction of nickel In our previous study [1] XRD experiments evidenced the pattern of the Ni0 phase in a reference Ni/SiO2 catalyst where the metal content was of 3%. After calcination at 250°C/2h, this signal was still present with a lower intensity due to oxidation of metallic nickel. As to the signal of the expected nickel oxidized phases, it was not detected: absence of NiO species was ascribed to formation of amorphous phases. We assumed same mechanisms in the present study with the 1%Ni catalyst. Variation in the proportions metallic/oxidized phases was determined chemically. The degree of reduction was measured by O2 chemisorption. It decreased monotonously with the time of previous exposure to air (Table 1 ). The obtained samples were partly oxidized, reduced and unreduced nickel particles coexisting in various proportions. The rate of oxidation of metallic nickel is remarkably slow: the degree of reduction is still of 59.1% after 24h of calcination at 400°C. It is well established that various nickel silicates are formed during calcination of silica supported nickel catalysts [15,16]. Their stability is related to the strength of metal-support interactions [17,18]. These species probably also formed with the 1%Ni catalyst, however, the low nickel content did not allow their physical characterization. Note that the metal surface area of Ni0 in calcined samples comes from metallic phase not oxidized by the calcination treatment plus that due to the partial reduction of NiOair during the standard pre-treatment with H2/300°C/2h (see Scheme 1). 3.2 H2 adsorption studies Previous studies showed that the bare support did not adsorb hydrogen whereas the metal catalyst did [1]. The amounts of hydrogen adsorbed gradually decreased with diminishing degree of reduction (Table 1). The reference catalyst adsorbed 1010mmolg−1 Ni of hydrogen. The uptake dropped to 740mmolg−1 Ni when the degree of oxidation decreased to 59.1% (corresponding to 24h of oxidative pre-treatment). When a calcined sample is diluted with the support, it adsorbed some additional hydrogen: 941 instead of 842 740mmolg−1 Ni for Ni0 16H, i. e. a little increase of 10.5%. Less hydrogen adsorbed is a consequence of the presence of unreduced nickel in the calcined samples. The unreduced Ni2+ or NiO species formed after calcination adsorb H2 only to a smaller extent (or not at all) as compared to Ni0 [14]. Assuming that H2 is practically adsorbed on reduced nickel only, we have re-calculated the amounts of hydrogen adsorbed by metallic nickel in the samples. Strikingly, these amounts increased with increasing degree of oxidation. The augmentation of the H2 uptake is up to 25% (e.g.1252 against 1010mmolg−1 Ni 0 after 24h of calcination). Presence of unreduced nickel enhanced the metallic surface area. Dilution also promoted the metallic surface area to some extent: for Ni0 CALC16H it passed from 1173 to 1310mmolg−1 Ni 0, that is an augmentation of around 12%. Increase in metal surface area is ascribable to migration of the metal phase during the calcination. In the initial Ni0 REF sample, there existed instable nickel atoms, less interacting with the support, and also more prone to oxidation in air/400°C. The NiO entities formed moved to support new receiving sites, contributing to better metal dispersion. Migration of supported NiO to more stable sites during calcination has been reported and the intensity of the effect on the particle size depended on the thermal treatment and metal loading [14,19,20]. Stable NiO species formed (silicate, aluminate, …) cannot be reduced even under severe reducing conditions [14–16,20]. In turn, they may serve as anchors for Ni0 atoms during the subsequent hydrothermal treatment. As a result they act as a diluent in the Ni0 surface, thereby reducing the size of Ni ensembles [20,21]. The unreduced Ni therefore played a similar role to that of copper in Ni-Cu alloys [22]. Diluting mechanically Ni0 CALC16H with SiO2 led to some increase of the hydrogen uptake (12%). Since the mixture was subsequently reduced by the standard H2/300°C/2h treatment, migration of Ni0 particles to new receiving SiO2 sites is not likely. The mobility of a metal on an oxide surface is lower than that of an oxide [23]. The Ni0 particles rather have been re-dispersed due to the grinding procedure during the mixing, by breaking of metal particles to smaller ones. Choi et al. [8] stressed on possible degradation of a metal phase during its dilution on a support by too harsh mechanical grinding. The local catalyst composition and structure can change drastically depending on the types of diluents, severity of mixing (grinding procedure) and subsequent thermal treatment for catalyst [24]. 3.3 H2-TPD studies We have previously evidenced that the bare support desorbs hydrogen after H2/400°C reducing treatment [1]. The amounts desorbed substantially increased in the presence of nickel. Dissociative adsorption of hydrogen by non reducible oxides has been reported in earlier studies [25,26]. Surface H atoms adsorbed on silica has also been obtained catalytically by Teichner et al. [27,28]. Initially, SiO2 and a catalyst in close contact were treated with H2 at 430°C for 12h. After isolating, the treated silica was flowed with ethylene at 25 or 110°C. This led to ethane due to H atoms remaining on the oxide solid. The hydrogenation of ethylene was not observed in the absence of the catalyst during the hydro-pretreatment. Similar conclusions were reported later by Rajagopal et al. [29]. These experiments were commented by Prins [5] in his critical review on the hydrogen spillover. The author admitted that high temperature treatment of non reducible oxides may create defects on which H atoms may be anchored. In many of our previous studies on nickel based catalysts [e.g. [1,30,31]] we showed that the amounts of hydrogen desorbed were higher than that adsorbed and these amounts augmented again after dilution by the support. Similar studies were also reported by Benseradj et al. [32]: Rh/Al2O3 catalyst desorbed more hydrogen after dilution by alumina or other oxides. Indeed, total amounts of hydrogen desorbed by the catalyst were 120.4mmolg−1 cat and increased to 130.4, 148.0, 211.6 and 347.5mmolg−1 cat after dilution by silica, alumina, activated carbon and HY zeolite respectively. The hydrogen desorbed at high temperatures was attributed to the spillover effect. By the way, effect of a metal on surface diffusion of H atoms on non reducible oxides has been also reported: at 140°C, the diffusion coefficient of hydrogen atoms is 10−4–10−5 cm2 s−1 for isolated SiO2 and 1.5cm2 s−1 for SiO2 in Pd/SiO2 [2]. These considerations allowed us to ascribe the high temperatures peaks in H2-TPD experiments to hydrogen retained in the silica support during the thermal treatment under H2. This treatment has activated support defects or created new ones on which hydrogen molecules or atoms strongly adsorbed. As to the increase of the amounts of hydrogen stored in the presence of nickel it was ascribed to more hydrogen molecules dissociated by the metal particles then incorporated to the support on the H atoms acceptors sites. The H2-TPD profiles of catalysts presently examined showed that hydrogen desorption comprised two main peaks of temperature whether the sample was pre-oxidized or not (Fig. 1 ). The similarity of the temperature profiles suggests similar mechanisms of the adsorption/desorption processes. The first peak appeared from room temperature with a maximum temperature arising at ∼150°C then vanishing above 300°C. It was ascribed to hydrogen weakly adsorbed to nickel active sites. The maximum temperature is decreased to around 130°C for calcined samples. This weakening of the metal-hydrogen bonding cannot be ascribed to increased particle size because it rather diminished (the H2 uptake increased, Table 1). Also we ascribed decreased maximum temperature peak to presence of NiO species on which Ni0 species are anchored: the Ni2+ ions may exert an electron withdrawal on the metallic particles rendering easier the release of the H atoms bonded. This electronic effect is also invoked for the catalytic activity in benzene hydrogenation described below. The second desorption peak appeared at higher temperatures with maximum desorption at ∼500°C as a result of a strong adsorption. The maximum temperature slightly increased with the time of calcination. It is accompanied by a shoulder except for the sample calcined for 4h. The lower temperature of this shoulder indicated a medium strength of the corresponding desorption sites. The H2-TPD performed for diluted catalyst is very similar to those from the calcined catalysts. That is to say, the TPD profile of this catalyst also showed two main domains of desorption, in low (<300°C) and high temperature ranges, respectively. The oxidizing treatment is detrimental to the height of the reservoir (Table 1). The amount of H2 desorbed by the reference sample substantially decreased from 3089 to 2584mmolg−1 Ni for degree of reduction of 90.0 and 80.5% respectively. It remained constant at lower degrees (71.8–59.1%). In contrast, the reservoir sharply increased when the calcined catalyst is diluted with silica, increasing from 1682 to 3149mmolg−1 Ni for Ni0 CALC16H, it is multiplied by 2.7. Thermal effect of calcination would have to oxidize part of defects or metal impurities, and even to remove surface hydroxyls, all potential hosts for H spilt-over species. It increased with the time of calcination. The subsequent H2/300°C treatment was not strong enough to regenerate the H-receiving sites. Contrary to that, in the diluted sample, added silica supplied new active sites for the hydrogen reservoir which therefore augmented after the mixing of the reference catalyst with the support. Close inspection of results reported in Table 1 shows that the amounts of hydrogen desorbed at low temperature (<300°C) are roughly similar to that adsorbed except for the diluted sample (Table 1). This coincidence suggests that this type of hydrogen corresponds to the active species in hydrogenation reactions. As to the desorption occurring at higher temperature (Fig. 1) it was ascribed to hydrogen spillover incorporated in the support as discussed above. The amounts desorbed are sharply increased by dilution of the catalyst with the support. Effect of calcination on spilt-over species has not been reported to our knowledge. Also it is worthy to get back to Miller et al. [9] invoked in our introduction. The authors reported that pre-calcination decreased the amounts of hydrogen desorbed in the high temperature domain for Pt/zeolite catalysts. They ascribed this hydrogen, not to the spillover effect, but to the decomposition of NH3 that had been adsorbed on the acid sites of the support during catalyst preparation with the Pt(NH3)4Cl2 precursor. We also showed that N2H4 was incorporated to the support during the preparation of supported hydrazine catalysts [16]. The as-received catalyst decomposed during a subsequent heat treatment, also H2 +N2 or N2 alone were detected. Similar decomposition, if any, may have occurred with the initial heating in air of the Ni0 REF catalysts (Scheme 1). As to the subsequent H2/300°C treatment it should have incorporated hydrogen atoms in the support. Therefore high temperature hydrogen evidenced in our H2-TPD experiments is undoubtedly ascribable to hydrogen spillover, not to the decomposition of N2H4. To conclude, the TPD experiments evidenced the presence of hydrogen species weakly bonded to the support and identified as active sites for hydrogenation reactions. They also showed that the amounts of H atoms desorbing at high temperatures significantly decreased after calcination due to poisoning of the hydrogen receiving sites whereas they increased after dilution of the catalyst with the support due to increased hydrogen receiving sites. 3.4 Catalytic activity The activity of calcined and non calcined catalysts were determined after a standard pre-treatment of H2/300°C. Quasi steady-state and stable activity was rapidly reached. The catalysts were selective to cyclohexane, only traces of cyclohexene and methylcyclopentane were detected. The results obtained are reported in Figs. 2 and 3 and Table 2 . The catalysts exhibited a maximum of conversion as a function of the reaction temperature (Fig. 2). Moreover, this maximum shifts towards higher temperatures for the diluted catalyst, from 120 to 140°C. This shift was also reported in the literature [33]. In fact, rather than a maximum, a plateau was obtained which smoothly decreased with the reaction temperature. The plateau profile indicated a high activity of the catalyst. Existence of maximum activity with increasing temperature has been long known for the hydrogenation of benzene by metal catalysts [33] and verified in a great number of articles since then, e.g. [20]. We also observed this phenomenom in many of our studies for mono and bimetallic nickel based catalysts. It is admitted that a positive influence of the reaction kinetics prevails at the lower temperatures, whereas at the higher temperatures, the thermodynamic effect of the reaction was dominating and the conversion decreased, e.g. [34,35]. Benzene would be adsorbed on nickel via π bonding [34]. A reversible maximum for benzene hydrogenation against reaction temperature has been frequently reported [35–37]. In the high temperature domain, decreased activity with temperature is accounted for by competitive adsorption of the reactant molecules: the surface coverage by benzene molecules decreased at the higher temperatures, e.g. [38,39]. The reaction orders were determined at 100°C at around 3% of conversion. Assuming the empirical rate equation: r=k PH m PB n where k is the rate constant, the partial orders m and n of hydrogen and benzene respectively were determined. Values of 0.98 and 2.14 were obtained for m and n respectively (Figures not reported, see Supplementary information). The same values of m and n were also found for other SiO2 supported nickel catalysts prepared by the hydrazine method [40]. If the order value for hydrogen is in good accordance with that observed for classically prepared catalysts (in the range 0.3–2.3) [31,34,41], for benzene it is by far greater (in the range 0 to −1) [31,39,42]. Such a significant negative value is an indication of a strong adsorption of benzene on the catalyst surface [31]. The specific activity increases with the diminution of the degree of reduction (Fig. 2). TOF’s also sharply increased with decreasing degree of reduction as reported in Table 2 at different reaction temperatures. The calcined catalysts exhibited a higher activity than the non-calcined catalyst, in good accordance with increasing metal surface area as determined by hydrogen adsorption (Table 1). Experimental energies of activation in the temperature range 75–120°C were determined by the Arrhenius method (see Supplementary information). The energy of activation was 34.2kJmol−1 for Ni0 REF and a little decreased for calcined samples, e. g. 32.7kJmol−1 for Ni0 CALC16H. Our H2-TPD experiments showed that calcination enhanced the reactivity of H atoms desorbing from nickel at low temperature. Such a reactivity was ascribed to an electronic interaction between metallic and oxidized nickel species. We conclude that enhanced activity in benzene hydrogenation after calcination would be due, at least partly, to enhanced reactivity of the H2 reactant molecules at the metal surface. These findings are in agreement with papers on hydrogenation of benzene over classical nickel catalysts. The TOF was found influenced by the degree of nickel reduction. Certain authors suggested that the effect of oxidizing pre-treatment may be related to the presence of unreduced nickel for benzene hydrogenation [20–22]. They believe that unreduced nickel decreased the size of the nickel particles required for the adsorption of benzene in planar mode. Martin et al. [43,44] proposed that various phenomena, erroneously attributed to particle size effects in aromatic molecules hydrogenation, in fact result from the Ni0-Ni2+ interaction. We infer that both H2 and C6H6 reactant molecules may be strongly activated on metallic nickel in the presence of unreduced nickel. Recall that electronic effects were invoked to explain the role of surface acidity in aromatic molecules hydrogenation by metal supported catalysts: when metal particles are in contact with acid sites they become electron deficient and more active [39]. The activity is the highest when the catalyst is diluted with the support (Fig. 3). The energy of activation in the temperature range 75–120°C was 25.4kJmol−1, lower than that of the non diluted sample. Moreover, in contrast with the non calcined sample, it is not related to the increase of metallic surface area (Table 1). The activity is in effect multiplied by 2.0–2.4 in the temperature range 75°C–90°C investigated whereas the hydrogen uptake is multiplied by ∼1.1 only. Effect of dilution of metal supported catalysts in aromatics hydrogenation has long been discussed and was ascribed to the spillover effect [2,3]. Against spillover effect, in aromatic molecules hydrogenation, the main argument is related to the exothermicity of the reaction [5], notably at high conversion (≥20%) which is the case in many instances. The results obtained are considered as unreliable because the reaction is not isothermal and leads to underestimation of the activity of the undiluted catalyst [10]. Impurities may also have distorted the results. In the present study and according to this criterion, conversion of about 20% at 75°C may allow to consider the occurrence of the spillover. At this conversion TOF of the diluted catalyst is double that of the undiluted catalysts (Table 2). Extrapolating at lower conversion (<10%) one observes that the gap in activity with the diluted catalyst is maintained. Since the support was highly crystallized, relays for the hydrogen spillover would be defects. Metal impurities of the support may also play a similar role. Coke, eventually remaining on the catalysts after cleaning (see Experimental), is not a good candidate for this role because we found it did not contain graphitic carbonaceous material [45], an effective H transport agent [5]. At the higher temperatures where the conversions are ≥40%, the H-spillover mechanism existence was not considered. Calcination increased the catalysts activity. Since, in the mean time, it diminished the number of H-spiltover species on the support, one may think that improved activity is ascribable to the nickel phase, more dispersed and more active as showed our H2-TPD experiments. In contrast, dilution led to sharp increase in activity which could be attributed to the sharp increase of H-species incorporated in the support (multiplied by 2.7). The little increase of the metal surface area (∼10%) after dilution cannot be incriminated. Therefore one is allowed to think to the existence of competitive adsorption and reaction of benzene on nickel and on support for calcined catalysts. The nickel phase would be composed of Ni0-NiOx ensembles. Adsorption of benzene was studied on unsupported metallic nickel and nickel oxide in conditions near that of the hydrogenation [46]. It was established that there is no significant difference between the two adsorbents in the heats of adsorption or the ratios of the total and irreversible adsorption of the hydrocarbon. Fig 4 shows the good correlation between H2 uptake and TOF’s and the fraction of non reduced nickel for non diluted catalysts. In contrast, these trends are not fitted for the diluted catalyst. This corroborates a different mechanism. The significant difference of energy of activation of diluted (25.4kJmol−1) and undiluted (32.7kJmol−1) catalysts strengthens the existence of two reaction paths in benzene hydrogenation on our catalysts. Scheme 2 illustrates these mechanisms. In the model catalyst of Choi et al. [6] the spillover mechanism in benzene hydrogenation is undoubtful: because the Pt metal phase is not accessible to the benzene molecule, the reaction necessarily occurs on the support with the help of H-spilt-over species. Contrary to that, for Primet et al. [47], the hydrogenation of benzene occurs on the metal phase with Pt/zeolite used because the organic molecule was accessible and more strongly adsorbed on the Pt than on the zeolite support. A mix of both mechanisms was reported for Pd [48] and Pt [39] supported on alumina: the hydrogenation reaction would occur on both the metal phase and on the support. Our work suggests that, besides the kinetic parameters (rate and adsorption constants), the degree of oxidation and morphology of the metal phase may be an important factor for the occurrence of the spillover mechanism. 4 Conclusions Ni/SiO2 catalysts prepared by the hydrazine method then calcined at 400°C were studied after a standard treatment in H2/300°C/2h. Metal dispersion increased with increasing calcination time through nickel oxide migration to more stabilizing sites on the support. Hydrogen storage by the support strongly diminished with calcination due to poisoning of the receiving sites of the H-spiltover species. In contrast, dilution of a calcined catalyst by the support led to new adsorption sites for hydrogen and resulted in an increased hydrogen storage. Activity in benzene hydrogenation increased with increasing degree of oxidation of nickel in good accordance with increased metal dispersion. The activity also increased with dilution of the calcined sample by the support and was ascribed to the occurrence of the spillover mechanism. Discussion of the results obtained showed that the mechanism of hydrogenation of benzene is influenced by the degree of reduction of the catalysts. The benzene molecule may be competitively adsorbed and hydrogenated on the support or on the nickel phase. Calcination treatment which decreases the number of H-spilover species on the support favors the reaction occurring on the nickel phase. Dilution of the catalyst by the support, in contrast, increased the number of H-spilover species on the support and also favored the hydrogen spillover mechanism. The metal active phase would be composed of an ensemble of Ni0 and NiOx species interacting with the support. Appendix A Supplementary data Supplementary data associated with this article can be found, in the online version, at http://dx.doi.org/10.1016/j.molcata.2016.11.014. Appendix A Supplementary data The following is Supplementary data to this article: References [1] A. Boudjahem S. Monteverdi M. Mercy M. Bettahar Study of nickel catalysts supported on silica of low surface area and prepared by reduction of nickel acetate in aqueous hydrazine J. Catal. 221 2004 325 334 [2] W.C. Conner J.L. Falconer Spillover in heterogeneous catalysis Chem. Rev. 95 1995 759 788 [3] V.V. Rozanov O.V. Krylov Russ Hydrogen spillover in heterogeneous catalysis Chem. Rev. 66 1997 107 119 [4] R. Prins V.K. Palfi M. Reiher Hydrogen spillover to nonreducible supports J. Phys. Chem. C 116 2012 14274 14283 [5] R. Prins Hydrogen spillover. Facts and fiction Chem. Rev. 112 2012 2714 2738 [6] J. Im H. Shin H. Jang H. Kim M. Choi Maximizing the catalytic function of hydrogen spillover in platinum-encapsulated aluminosilicates with controlled nanostructures Nat. Commun. 5 2014 3370 [7] S. Lee K. Lee J. Im H. Kim M. Choi Revisiting hydrogen spillover in Pt/LTA: effects of physical diluents having different acid site distributions J. Catal. 325 2015 26 34 [8] M. Boudart A.W. Aldag M.A. Vannice On the slow uptake of hydrogen by platinized carbon J. Catal. 18 1970 46 51 [9] S. Cęckiewicz B. Delmon Cooperative action of Pt/γ-Al2O3 catalyst and γ-Al2O3 diluent in the hydrogenation of benzene J. Catal. 108 1987 294 303 [10] M.A. Vannice W.C. Neikam On the chemical nature of hydrogen spillover J. Catal. 20 1971 260 263 [11] J.T. Miller B.L. Meyers M.K. Barr F.S. Modica D.C. Koningsberger Hydrogen temperature-programmed desorptions in platinum catalysts: decomposition and isotopic exchange by spillover hydrogen of chemisorbed ammonia J. Catal. 159 1996 41 49 [12] J.A. Anderson M.G.V. Mordente C.H. Rochester Infrared study of the effects of oxidation/reducation treatments on Pt dispersion in Pt/Al2O3 catalysts J. Chem. Soc. Faraday Trans. 85 1989 2983 2990 [13] B. Pawelec L. Daza J.L. Fierro J.A. Anderson Regeneration of Ni-USY catalysts used in benzene hydrogenation Appl. Catal. A 145 1996 307 322 [14] C.H. Bartholomew R.J. Farrauto Chemistry of nickel-alumina catalysts J. Catal. 45 1976 41 53 [15] M. Kermarec A. Decarreau M. Che J.Y. Carriat Identification of supported phases produced in the preparation of silica-supported Ni catalysts by competitive cationic exchange Stud. Surf. Sci. Catal. 91 1995 967 976 [16] O. Clause L. Bonneviot M. Che H. Dexpert EXAFS characterization of the adsorbed state of Ni (II) ions in Ni/SiO 2 materials prepared by deposition-precipitation J. Catal. 130 1991 21 28 [17] S.J. Tauster S.C. Fung R.L. Garten Strong metal-support interactions: group 8 noble metals supported on titanium dioxide J. Am. Chem. Soc. 100 1978 170 175 [18] A. Jasik R. Wojcieszak S. Monteverdi M. Ziolek M.M. Bettahar Study of nickel catalysts supported on Al2O3, SiO2 or Nb2O5 oxides J. Mol. Catal. A: Chem. 242 2005 81 90 [19] C.P. Li A. Proctor D.M. Hercules Curve fitting analysis of ESCA Ni 2p spectra of nickel-oxygen compounds and Ni/Al2O3 catalysts Appl. Spectrosc. 38 1984 880 [20] R. Molina G. Poncelet Hydrogenation of benzene over alumina-supported nickel catalysts prepared from Ni (II) acetylacetonate J. Catal. 199 2001 162 170 [21] J.A. Anderson L. Daza J.L. Fierro T. Rodrigo Influence of preparation method on the characteristics of nickel/sepiolite catalysts J. Chem. Soc. Faraday Trans. 89 1993 3651 3657 [22] G.A. Martin J.A. Dalmon Benzene hydrogenation over nickel catalysts at low and high temperatures: structure-sensitivity and copper alloying effects J. Catal. 75 1982 233 247 [23] A. Van Meerbeek A. Jelli J.J. Fripiat Reduction of the surface of silica gel by hydrogen spillover J. Catal. 46 1977 320 325 [24] G. Borbely H.K. Beyer L. Radics P. Sandor H.G. Karge Solid-state ion exchange in zeolites: part IV. Evidence for contact-induced ion exchange between hydrated NaY zeolite and metal chlorides Zeolites 9 1989 428 431 [25] P. Pascal Nouveau Traité de Chimie Minérale vol. VIII 1965 Masson Paris (p. 93) [26] G.M. Dolidze Y.A. Kolbanovskii L.S. Polak Kinetika Kataliz 6 1965 897 [27] D. Bianchi M. Lacroix G.M. Pajonk S.J. Teichner Catalytic and infrared demonstrations of the effect of hydrogen spillover on a gel of silica J. Catal. 59 1979 467 [28] D. Bianchi G.E.E. Garde G.M. Pajonk S.J. Teichner Hydrogenation of ethylene on alumina after hydrogen spillover J. Catal. 38 1975 135 146 [29] V.K. Rajagopal R.D. Guthrie T. Fields B.H. Davis Hydrogenation catalysis by thermally activated silica Catal. Today 31 1996 57 63 [30] M.M. Bettahar R. Wojcieszak S. Monteverdi NiAg catalysts prepared by reduction of Ni 2+ ions in aqueous hydrazine: I. Support effect J. Colloids Interface Sci. 332 2009 416 424 [31] R. Wojcieszak S. Monteverdi M. Mercy M. Ziolek M.M. Bettahar Nickel containing MCM-41 and AlMCM-41 mesoporous molecular sieves: characteristics and activity in the hydrogenation of benzene Appl. Catal. A: Gen. 268 2004 241 253 [32] F. Benseradj F. Sadi M. Chater Hydrogen spillover studies on diluted Rh/Al2O3 catalyst Appl. Catal. A: Gen. 228 2002 135 144 [33] P. Antonicci N. Truong N. Giordano R. Maggiore Hydrogen spillover effects in the hydrogenation of benzene over Pt/γ-Al2O3 catalysts J. Catal. 75 1982 140 150 [34] M.A. Keane The Hydrogenation of o-, m-, and p-xylene over Ni/SiO2 J. Catal. 166 1997 347 355 [35] A.J. Aznar E. Gutierrez P. Diaz A. Alvarez Microporous Mater. 6 1996 105 114 [36] B. Coughlan M.A. Keane Silica from sepiolite: preparation, textural properties, and use as support to catalysts J. Mol. Catal. 71 1992 90 109 [37] S.T. Srinivas P.K. Rao Direct observation of hydrogen spillover on carbon-supported platinum and its influence on the hydrogenation of benzene J. Catal. 148 1994 470 477 [38] K.J. Yoon M.A. Vannice Benzene hydrogenation over iron: II. Reaction model over unsupported and supported catalysts J. Catal. 82 1983 457 468 [39] S.D. Lin M.A. Vannice Hydrogenation of aromatic hydrocarbons over supported Pt catalysts I. Benzene hydrogenation J. Catal. 143 1993 539 553 [40] A. Boudjahem, PhD Thesis, Nanoparticules de nickel supportées sur silice préparées en milieu aqueux. Mécanismes de formation. Caractérisation. Propriétés de surface. University of Lorraine, Nancy (2003). [41] R.C. Van Marteen J.W.E. Coenen Gas phase benzene hydrogenation on a nickel-silica catalyst: IV. Rate equations and curve fitting J. Catal. 46 1977 13 24 [42] L.P. Lindfors T. Salmi Kinetics of toluene hydrogenation on a supported nickel catalyst Ind. Eng. Chem. Res. 32 1993 34 42 [43] G.A. Martin C. Mirodatos H. Praliaud Chemistry of silica-supported catalysts: preparation activation and reduction Appl. Catal. 1 1981 367 382 [44] M. Primet J.A. Dalmon G.A. Martin Adsorption of CO on well-defined Ni/SiO2 catalysts in the 195–373K range studied by infrared spectroscopy and magnetic methods J. Catal. 46 1977 25 36 [45] A. Boudjahem W. Bouderbala M. Bettahar Benzene hydrogenation over Ni–Cu/SiO2 catalysts prepared by aqueous hydrazine reduction Fuel Process. Technol. 92 2011 500 506 [46] L. Babernics P. Tetenyi Investigation of the adsorption of benzene and cyclohexane on metallic Ni and NiO Zeitschrift Physikalische Chemie Neue Folge 82 1972 262 271 [47] M. Primet E. Garbowski M. Mathieu B. Imelik Spectroscopic studies of benzene hydrogenation on platinum-loaded zeolites. Part 2. Hydrogenation of adsorbed species J. Chem. Soc. Faraday 76 1980 1953 1961 [48] P. Chou M.A. Vannice Benzene hydrogenation over supported and unsupported palladium: I. Kinetic behavior J. Catal. 107 1987 129 139",
      "scopus-id": "85000992026",
      "coredata": {
        "eid": "1-s2.0-S1381116916304885",
        "dc:description": "The chemisorption and hydrogenating properties of Ni/SiO2 catalysts prepared by the hydrazine method then calcined at 400°C with various times were investigated. Metal dispersion and activity in benzene hydrogenation increased with increasing calcination time whereas desorbed amounts of hydrogen significantly decreased. Dilution of a calcined sample by the support led to a sharp increase of both hydrogen storage by the support and catalytic activity. Metal dispersion and hydrogen storage capacity influenced the reaction mechanisms of hydrogenation of benzene which, therefore, is believed to occur on the metal phase or/and on the support by the hydrogen spillover mechanism. The metal active phase would be composed of an ensemble of metallic and oxidized nickel species.",
        "openArchiveArticle": "false",
        "prism:coverDate": "2017-01-31",
        "openaccessUserLicense": null,
        "prism:aggregationType": "Journal",
        "prism:url": "https://api.elsevier.com/content/article/pii/S1381116916304885",
        "dc:creator": [
          {
            "@_fa": "true",
            "$": "Boudjahem, Abdel-Ghani"
          },
          {
            "@_fa": "true",
            "$": "Bettahar, Mohammed M."
          }
        ],
        "link": [
          {
            "@_fa": "true",
            "@rel": "self",
            "@href": "https://api.elsevier.com/content/article/pii/S1381116916304885"
          },
          {
            "@_fa": "true",
            "@rel": "scidir",
            "@href": "https://www.sciencedirect.com/science/article/pii/S1381116916304885"
          }
        ],
        "dc:format": "application/json",
        "openaccessType": null,
        "pii": "S1381-1169(16)30488-5",
        "prism:volume": "426",
        "prism:publisher": "Elsevier B.V.",
        "dc:title": "Effect of oxidative pre-treatment on hydrogen spillover for a Ni/SiO2 catalyst",
        "prism:copyright": "© 2016 Elsevier B.V. All rights reserved.",
        "openaccess": "0",
        "prism:issn": "13811169",
        "dcterms:subject": [
          {
            "@_fa": "true",
            "$": "Nickel catalysts"
          },
          {
            "@_fa": "true",
            "$": "Hydrogen storage"
          },
          {
            "@_fa": "true",
            "$": "Benzene hydrogenation"
          },
          {
            "@_fa": "true",
            "$": "Calcination"
          },
          {
            "@_fa": "true",
            "$": "Hydrogen spillover"
          }
        ],
        "openaccessArticle": "false",
        "prism:publicationName": "Journal of Molecular Catalysis A: Chemical",
        "openaccessSponsorType": null,
        "prism:pageRange": "190-197",
        "prism:endingPage": "197",
        "pubType": "fla",
        "prism:coverDisplayDate": "January 2017",
        "prism:doi": "10.1016/j.molcata.2016.11.014",
        "prism:startingPage": "190",
        "dc:identifier": "doi:10.1016/j.molcata.2016.11.014",
        "openaccessSponsorName": null
      },
      "objects": {
        "object": [
          {
            "@category": "thumbnail",
            "@height": "88",
            "@width": "219",
            "@_fa": "true",
            "$": "https://api.elsevier.com/content/object/eid/1-s2.0-S1381116916304885-fx1.sml?httpAccept=%2A%2F%2A",
            "@multimediatype": "GIF image file",
            "@type": "IMAGE-THUMBNAIL",
            "@size": "3229",
            "@ref": "fx1",
            "@mimetype": "image/gif"
          },
          {
            "@category": "thumbnail",
            "@height": "153",
            "@width": "219",
            "@_fa": "true",
            "$": "https://api.elsevier.com/content/object/eid/1-s2.0-S1381116916304885-gr1.sml?httpAccept=%2A%2F%2A",
            "@multimediatype": "GIF image file",
            "@type": "IMAGE-THUMBNAIL",
            "@size": "8480",
            "@ref": "gr1",
            "@mimetype": "image/gif"
          },
          {
            "@category": "thumbnail",
            "@height": "163",
            "@width": "219",
            "@_fa": "true",
            "$": "https://api.elsevier.com/content/object/eid/1-s2.0-S1381116916304885-gr2.sml?httpAccept=%2A%2F%2A",
            "@multimediatype": "GIF image file",
            "@type": "IMAGE-THUMBNAIL",
            "@size": "7069",
            "@ref": "gr2",
            "@mimetype": "image/gif"
          },
          {
            "@category": "thumbnail",
            "@height": "161",
            "@width": "219",
            "@_fa": "true",
            "$": "https://api.elsevier.com/content/object/eid/1-s2.0-S1381116916304885-gr3.sml?httpAccept=%2A%2F%2A",
            "@multimediatype": "GIF image file",
            "@type": "IMAGE-THUMBNAIL",
            "@size": "4945",
            "@ref": "gr3",
            "@mimetype": "image/gif"
          },
          {
            "@category": "thumbnail",
            "@height": "150",
            "@width": "219",
            "@_fa": "true",
            "$": "https://api.elsevier.com/content/object/eid/1-s2.0-S1381116916304885-gr4.sml?httpAccept=%2A%2F%2A",
            "@multimediatype": "GIF image file",
            "@type": "IMAGE-THUMBNAIL",
            "@size": "5922",
            "@ref": "gr4",
            "@mimetype": "image/gif"
          },
          {
            "@category": "thumbnail",
            "@height": "126",
            "@width": "219",
            "@_fa": "true",
            "$": "https://api.elsevier.com/content/object/eid/1-s2.0-S1381116916304885-sc1.sml?httpAccept=%2A%2F%2A",
            "@multimediatype": "GIF image file",
            "@type": "IMAGE-THUMBNAIL",
            "@size": "4933",
            "@ref": "sc1",
            "@mimetype": "image/gif"
          },
          {
            "@category": "thumbnail",
            "@height": "164",
            "@width": "181",
            "@_fa": "true",
            "$": "https://api.elsevier.com/content/object/eid/1-s2.0-S1381116916304885-sc2.sml?httpAccept=%2A%2F%2A",
            "@multimediatype": "GIF image file",
            "@type": "IMAGE-THUMBNAIL",
            "@size": "5654",
            "@ref": "sc2",
            "@mimetype": "image/gif"
          },
          {
            "@category": "standard",
            "@height": "200",
            "@width": "500",
            "@_fa": "true",
            "$": "https://api.elsevier.com/content/object/eid/1-s2.0-S1381116916304885-fx1.jpg?httpAccept=%2A%2F%2A",
            "@multimediatype": "JPEG image file",
            "@type": "IMAGE-DOWNSAMPLED",
            "@size": "11136",
            "@ref": "fx1",
            "@mimetype": "image/jpeg"
          },
          {
            "@category": "standard",
            "@height": "368",
            "@width": "527",
            "@_fa": "true",
            "$": "https://api.elsevier.com/content/object/eid/1-s2.0-S1381116916304885-gr1.jpg?httpAccept=%2A%2F%2A",
            "@multimediatype": "JPEG image file",
            "@type": "IMAGE-DOWNSAMPLED",
            "@size": "48202",
            "@ref": "gr1",
            "@mimetype": "image/jpeg"
          },
          {
            "@category": "standard",
            "@height": "393",
            "@width": "527",
            "@_fa": "true",
            "$": "https://api.elsevier.com/content/object/eid/1-s2.0-S1381116916304885-gr2.jpg?httpAccept=%2A%2F%2A",
            "@multimediatype": "JPEG image file",
            "@type": "IMAGE-DOWNSAMPLED",
            "@size": "40436",
            "@ref": "gr2",
            "@mimetype": "image/jpeg"
          },
          {
            "@category": "standard",
            "@height": "387",
            "@width": "527",
            "@_fa": "true",
            "$": "https://api.elsevier.com/content/object/eid/1-s2.0-S1381116916304885-gr3.jpg?httpAccept=%2A%2F%2A",
            "@multimediatype": "JPEG image file",
            "@type": "IMAGE-DOWNSAMPLED",
            "@size": "32795",
            "@ref": "gr3",
            "@mimetype": "image/jpeg"
          },
          {
            "@category": "standard",
            "@height": "361",
            "@width": "527",
            "@_fa": "true",
            "$": "https://api.elsevier.com/content/object/eid/1-s2.0-S1381116916304885-gr4.jpg?httpAccept=%2A%2F%2A",
            "@multimediatype": "JPEG image file",
            "@type": "IMAGE-DOWNSAMPLED",
            "@size": "38797",
            "@ref": "gr4",
            "@mimetype": "image/jpeg"
          },
          {
            "@category": "standard",
            "@height": "151",
            "@width": "263",
            "@_fa": "true",
            "$": "https://api.elsevier.com/content/object/eid/1-s2.0-S1381116916304885-sc1.jpg?httpAccept=%2A%2F%2A",
            "@multimediatype": "JPEG image file",
            "@type": "IMAGE-DOWNSAMPLED",
            "@size": "9580",
            "@ref": "sc1",
            "@mimetype": "image/jpeg"
          },
          {
            "@category": "standard",
            "@height": "238",
            "@width": "263",
            "@_fa": "true",
            "$": "https://api.elsevier.com/content/object/eid/1-s2.0-S1381116916304885-sc2.jpg?httpAccept=%2A%2F%2A",
            "@multimediatype": "JPEG image file",
            "@type": "IMAGE-DOWNSAMPLED",
            "@size": "12479",
            "@ref": "sc2",
            "@mimetype": "image/jpeg"
          },
          {
            "@category": "high",
            "@height": "886",
            "@width": "2213",
            "@_fa": "true",
            "$": "https://api.elsevier.com/content/object/eid/1-s2.0-S1381116916304885-fx1_lrg.jpg?httpAccept=%2A%2F%2A",
            "@multimediatype": "JPEG image file",
            "@type": "IMAGE-HIGH-RES",
            "@size": "76112",
            "@ref": "fx1",
            "@mimetype": "image/jpeg"
          },
          {
            "@category": "high",
            "@height": "1633",
            "@width": "2336",
            "@_fa": "true",
            "$": "https://api.elsevier.com/content/object/eid/1-s2.0-S1381116916304885-gr1_lrg.jpg?httpAccept=%2A%2F%2A",
            "@multimediatype": "JPEG image file",
            "@type": "IMAGE-HIGH-RES",
            "@size": "393582",
            "@ref": "gr1",
            "@mimetype": "image/jpeg"
          },
          {
            "@category": "high",
            "@height": "1742",
            "@width": "2336",
            "@_fa": "true",
            "$": "https://api.elsevier.com/content/object/eid/1-s2.0-S1381116916304885-gr2_lrg.jpg?httpAccept=%2A%2F%2A",
            "@multimediatype": "JPEG image file",
            "@type": "IMAGE-HIGH-RES",
            "@size": "296264",
            "@ref": "gr2",
            "@mimetype": "image/jpeg"
          },
          {
            "@category": "high",
            "@height": "1713",
            "@width": "2333",
            "@_fa": "true",
            "$": "https://api.elsevier.com/content/object/eid/1-s2.0-S1381116916304885-gr3_lrg.jpg?httpAccept=%2A%2F%2A",
            "@multimediatype": "JPEG image file",
            "@type": "IMAGE-HIGH-RES",
            "@size": "241026",
            "@ref": "gr3",
            "@mimetype": "image/jpeg"
          },
          {
            "@category": "high",
            "@height": "1600",
            "@width": "2333",
            "@_fa": "true",
            "$": "https://api.elsevier.com/content/object/eid/1-s2.0-S1381116916304885-gr4_lrg.jpg?httpAccept=%2A%2F%2A",
            "@multimediatype": "JPEG image file",
            "@type": "IMAGE-HIGH-RES",
            "@size": "264498",
            "@ref": "gr4",
            "@mimetype": "image/jpeg"
          },
          {
            "@category": "high",
            "@height": "672",
            "@width": "1167",
            "@_fa": "true",
            "$": "https://api.elsevier.com/content/object/eid/1-s2.0-S1381116916304885-sc1_lrg.jpg?httpAccept=%2A%2F%2A",
            "@multimediatype": "JPEG image file",
            "@type": "IMAGE-HIGH-RES",
            "@size": "69987",
            "@ref": "sc1",
            "@mimetype": "image/jpeg"
          },
          {
            "@category": "high",
            "@height": "1056",
            "@width": "1167",
            "@_fa": "true",
            "$": "https://api.elsevier.com/content/object/eid/1-s2.0-S1381116916304885-sc2_lrg.jpg?httpAccept=%2A%2F%2A",
            "@multimediatype": "JPEG image file",
            "@type": "IMAGE-HIGH-RES",
            "@size": "89808",
            "@ref": "sc2",
            "@mimetype": "image/jpeg"
          },
          {
            "@category": "standard",
            "@_fa": "true",
            "$": "https://api.elsevier.com/content/object/eid/1-s2.0-S1381116916304885-mmc1.docx?httpAccept=%2A%2F%2A",
            "@multimediatype": "Microsoft Word file",
            "@type": "APPLICATION",
            "@size": "137173",
            "@ref": "mmc1",
            "@mimetype": "application/word"
          }
        ]
      },
      "link": {
        "@rel": "abstract",
        "@href": "https://api.elsevier.com/content/abstract/scopus_id/85000992026"
      }
    }
  }
}