{
  "metadata": {
    "title": "Anionic iron(III) porphyrin immobilized on silanized kaolinite as catalyst for oxidation reactions",
    "authors": "; ; ",
    "journal": "Journal of Molecular Catalysis A: Chemical",
    "date": "2004-08-03",
    "doi": "10.1016/j.molcata.2004.03.004",
    "abstract": "",
    "uri": "https://api.elsevier.com/content/article/pii/S1381116904001360",
    "pii": "S1381116904001360"
  },
  "fulltext": {
    "full-text-retrieval-response": {
      "scopus-eid": "2-s2.0-2542463051",
      "originalText": "serial JL 271358 291210 291744 291790 291809 31 Journal of Molecular Catalysis A: Chemical JOURNALMOLECULARCATALYSISACHEMICAL 2004-04-17 2004-04-17 2010-03-28T13:36:59 1-s2.0-S1381116904001360 S1381-1169(04)00136-0 S1381116904001360 10.1016/j.molcata.2004.03.004 S300 S300.1 FULL-TEXT 1-s2.0-S1381116900X01902 2015-05-15T05:56:32.920819-04:00 0 0 20040803 2004 2004-04-17T00:00:00Z articleinfo crossmark dco dateupdated tomb dateloaded datesearch indexeddate issuelist volumelist yearnav absattachment articletitlenorm authfirstinitialnorm authfirstsurnamenorm cid cids contenttype copyright dateloadedtxt docsubtype doctype doi eid ewtransactionid hubeid issfirst issn issnnorm itemstage itemtransactionid itemweight openaccess openarchive pg pgfirst pglast pii piinorm pubdatestart pubdatetxt pubyr sortorder srctitle srctitlenorm srctype subheadings volfirst volissue webpdf webpdfpagecount figure table body acknowledge affil articletitle auth authfirstini authfull authkeywords authlast primabst ref specialabst alllist content subj ssids 1381-1169 13811169 217 217 1 2 1 2 Volume 217, Issues 1–2 21 121 131 121 131 20040803 3 August 2004 2004-08-03 2004 converted-article fla Copyright © 2004 Elsevier B.V. All rights reserved. ANIONICIRONIIIPORPHYRINIMMOBILIZEDSILANIZEDKAOLINITECATALYSTFOROXIDATIONREACTIONS NAKAGAKI S 1 Introduction 2 Experimental 2.1 Materials and synthesis 2.1.1 5,10,15,20-Tetrakis(2,6-difluorophenyl) porphyrin—H2(TDFPP) (1) 2.1.2 Anion of 5,10,15,20-tetrakis(2,6-difluoro-3-sulfonatophenyl) porphyrin—[H2(TDFSPP)]4− (2) 2.1.3 Anion of 5,10,15,20-tetrakis(2,6-difluoro-3-sulfonatophenyl) porphinato iron(III) chloride—[Fe(TDFSPP)Cl]4− (3) 2.1.4 Preparation of compound 4 by the functionalization of kaolinite with 3-aminopropyltriethoxysilane 2.1.5 Preparation of compound 5 by the immobilization of iron(III) porphyrin (3) on compound 4 2.1.6 Treatment of compound 5 with 2-(dimethylamino)pyridine (DMAP) 2.1.7 Oxidation of cyclooctene, heptane and cyclohexane by iodosylbenzene (PhIO) or H2O2 catalyzed by compound 5 2.2 Techniques used 3 Results and discussion 3.1 Synthesis of porphyrins and iron(III) porphyrin 3.2 Preparation of compound 5 (kaolinite 4 bound catalyst 3) 3.3 Oxidation reactions 4 Conclusions Acknowledgements References DEVOS 2000 105 D TONG 2002 1 Z LI 2002 47 Z VIDOTO 2002 151 E CUNNINGHAM 2002 25 I CAMPESTRINI 1992 1999 S MARTINEZLORENTE 1996 343 M HALMA 2002 502 M NAKAGAKI 2000 261 S MACHADO 2002 158 A NAKAGAKI 2002 203 S NAKAGAKI 2001 354 S HERRON 1998 25 N NAKAGAKI 1999 246 S GARDOLINSKI 1999 137 J GUIMARAES 1998 281 J SHAREFKIN 1963 62 J LUCAS 1963 483 H LINDSEY 1987 827 J TURK 1991 1253 H FLEISCHER 1971 3162 E RUHLMANN 1995 427 L BENEDITO 2003 1 F KNYUKSHTO 1998 540 V GHILADI 2001 5754 R ASSIS 1991 107 M TRAYLOR 1995 3468 T TAKAGI 1990 215 S DOLPHIN 1997 251 D BEDIOUI 1994 39 F BEDIOUI 1995 30 F GROVES 1979 7613 J MEUNIER 1986 578 B MANSUY 1990 741 D GARDOLINSKI 2000 284 J FROST 2002 2849 R SHIMIZU 1997 113 I TUNNEY 1995 473 J LOMBARDI 2002 270 K BARLOY 1992 71 L CADY 1978 1501 S TONG 2002 1 Z THOMAS 2001 191 J COOK 1986 7281 B PORIEL 2003 1759 C IAMAMOTO 1995 187 Y GOH 1999 914 Y NAM 2000 219 W LEE 1997 1916 K NAKAGAKIX2004X121 NAKAGAKIX2004X121X131 NAKAGAKIX2004X121XS NAKAGAKIX2004X121X131XS item S1381-1169(04)00136-0 S1381116904001360 1-s2.0-S1381116904001360 10.1016/j.molcata.2004.03.004 271358 2010-10-15T16:14:21.824155-04:00 2004-08-03 1-s2.0-S1381116904001360-main.pdf https://s3.amazonaws.com/prod-ucs-content-store-us-east/content/pii:S1381116904001360/MAIN/application/pdf/8cbcc4b5f27c3676acbaf8054f9f2209/main.pdf https://s3-eu-west-1.amazonaws.com/prod-ucs-content-store-eu-west/content/pii:S1381116904001360/MAIN/application/pdf/8cbcc4b5f27c3676acbaf8054f9f2209/main.pdf main.pdf pdf true 320401 MAIN 11 1-s2.0-S1381116904001360-main_1.png https://s3.amazonaws.com/prod-ucs-content-store-us-east/content/pii:S1381116904001360/PREVIEW/image/png/4f44bf7df500db6c6d06261f7d287bca/main_1.png https://s3-eu-west-1.amazonaws.com/prod-ucs-content-store-eu-west/content/pii:S1381116904001360/PREVIEW/image/png/4f44bf7df500db6c6d06261f7d287bca/main_1.png main_1.png png 71934 849 656 IMAGE-WEB-PDF 1 1-s2.0-S1381116904001360-si7.gif https://s3.amazonaws.com/prod-ucs-content-store-us-east/content/pii:S1381116904001360/STRIPIN/image/gif/1fb2202c6a9901d3492e1a11ed9c4f2c/si7.gif https://s3-eu-west-1.amazonaws.com/prod-ucs-content-store-eu-west/content/pii:S1381116904001360/STRIPIN/image/gif/1fb2202c6a9901d3492e1a11ed9c4f2c/si7.gif si7 si7.gif gif 265 20 38 ALTIMG 1-s2.0-S1381116904001360-si6.gif https://s3.amazonaws.com/prod-ucs-content-store-us-east/content/pii:S1381116904001360/STRIPIN/image/gif/30a6913e1cd16c33450125f5f316712b/si6.gif https://s3-eu-west-1.amazonaws.com/prod-ucs-content-store-eu-west/content/pii:S1381116904001360/STRIPIN/image/gif/30a6913e1cd16c33450125f5f316712b/si6.gif si6 si6.gif gif 149 14 20 ALTIMG 1-s2.0-S1381116904001360-si5.gif https://s3.amazonaws.com/prod-ucs-content-store-us-east/content/pii:S1381116904001360/STRIPIN/image/gif/30a6913e1cd16c33450125f5f316712b/si6.gif https://s3-eu-west-1.amazonaws.com/prod-ucs-content-store-eu-west/content/pii:S1381116904001360/STRIPIN/image/gif/30a6913e1cd16c33450125f5f316712b/si6.gif si5 si5.gif gif 149 14 20 ALTIMG 1-s2.0-S1381116904001360-si4.gif https://s3.amazonaws.com/prod-ucs-content-store-us-east/content/pii:S1381116904001360/STRIPIN/image/gif/30a6913e1cd16c33450125f5f316712b/si6.gif https://s3-eu-west-1.amazonaws.com/prod-ucs-content-store-eu-west/content/pii:S1381116904001360/STRIPIN/image/gif/30a6913e1cd16c33450125f5f316712b/si6.gif si4 si4.gif gif 149 14 20 ALTIMG 1-s2.0-S1381116904001360-si3.gif https://s3.amazonaws.com/prod-ucs-content-store-us-east/content/pii:S1381116904001360/STRIPIN/image/gif/30a6913e1cd16c33450125f5f316712b/si6.gif https://s3-eu-west-1.amazonaws.com/prod-ucs-content-store-eu-west/content/pii:S1381116904001360/STRIPIN/image/gif/30a6913e1cd16c33450125f5f316712b/si6.gif si3 si3.gif gif 149 14 20 ALTIMG 1-s2.0-S1381116904001360-si2.gif https://s3.amazonaws.com/prod-ucs-content-store-us-east/content/pii:S1381116904001360/STRIPIN/image/gif/3313f7bb5d302bce4e28fe71f41b99fb/si2.gif https://s3-eu-west-1.amazonaws.com/prod-ucs-content-store-eu-west/content/pii:S1381116904001360/STRIPIN/image/gif/3313f7bb5d302bce4e28fe71f41b99fb/si2.gif si2 si2.gif gif 380 12 84 ALTIMG 1-s2.0-S1381116904001360-si1.gif https://s3.amazonaws.com/prod-ucs-content-store-us-east/content/pii:S1381116904001360/STRIPIN/image/gif/30a6913e1cd16c33450125f5f316712b/si6.gif https://s3-eu-west-1.amazonaws.com/prod-ucs-content-store-eu-west/content/pii:S1381116904001360/STRIPIN/image/gif/30a6913e1cd16c33450125f5f316712b/si6.gif si1 true si1.gif gif 149 14 20 ALTIMG 1-s2.0-S1381116904001360-fx1.sml https://s3.amazonaws.com/prod-ucs-content-store-us-east/content/pii:S1381116904001360/fx1/THUMBNAIL/image/gif/ed0fccd35a5f0ec5ede41e35b23f7c96/fx1.sml https://s3-eu-west-1.amazonaws.com/prod-ucs-content-store-eu-west/content/pii:S1381116904001360/fx1/THUMBNAIL/image/gif/ed0fccd35a5f0ec5ede41e35b23f7c96/fx1.sml fx1 true fx1.sml sml 1622 94 119 IMAGE-THUMBNAIL 1-s2.0-S1381116904001360-fx1.gif https://s3.amazonaws.com/prod-ucs-content-store-us-east/content/pii:S1381116904001360/fx1/DOWNSAMPLED/image/gif/80c1d7ce8961d2bc97acfda4f1803355/fx1.gif https://s3-eu-west-1.amazonaws.com/prod-ucs-content-store-eu-west/content/pii:S1381116904001360/fx1/DOWNSAMPLED/image/gif/80c1d7ce8961d2bc97acfda4f1803355/fx1.gif fx1 true fx1.gif gif 4223 188 239 IMAGE-DOWNSAMPLED 1-s2.0-S1381116904001360-gr1.sml https://s3.amazonaws.com/prod-ucs-content-store-us-east/content/pii:S1381116904001360/gr1/THUMBNAIL/image/gif/33f31ecebf6ff9a7a13630f71e36483b/gr1.sml https://s3-eu-west-1.amazonaws.com/prod-ucs-content-store-eu-west/content/pii:S1381116904001360/gr1/THUMBNAIL/image/gif/33f31ecebf6ff9a7a13630f71e36483b/gr1.sml gr1 gr1.sml sml 2266 92 115 IMAGE-THUMBNAIL 1-s2.0-S1381116904001360-gr1.gif https://s3.amazonaws.com/prod-ucs-content-store-us-east/content/pii:S1381116904001360/gr1/DOWNSAMPLED/image/gif/a3cf90d49454ce414f47b83e46eff95f/gr1.gif https://s3-eu-west-1.amazonaws.com/prod-ucs-content-store-eu-west/content/pii:S1381116904001360/gr1/DOWNSAMPLED/image/gif/a3cf90d49454ce414f47b83e46eff95f/gr1.gif gr1 gr1.gif gif 4215 160 199 IMAGE-DOWNSAMPLED 1-s2.0-S1381116904001360-gr2.sml https://s3.amazonaws.com/prod-ucs-content-store-us-east/content/pii:S1381116904001360/gr2/THUMBNAIL/image/gif/9dfd44943190a2a723cfb061f289b73a/gr2.sml https://s3-eu-west-1.amazonaws.com/prod-ucs-content-store-eu-west/content/pii:S1381116904001360/gr2/THUMBNAIL/image/gif/9dfd44943190a2a723cfb061f289b73a/gr2.sml gr2 gr2.sml sml 1711 44 125 IMAGE-THUMBNAIL 1-s2.0-S1381116904001360-gr2.gif https://s3.amazonaws.com/prod-ucs-content-store-us-east/content/pii:S1381116904001360/gr2/DOWNSAMPLED/image/gif/3d9e15e28d9bc9efb8c02fdf9c958119/gr2.gif https://s3-eu-west-1.amazonaws.com/prod-ucs-content-store-eu-west/content/pii:S1381116904001360/gr2/DOWNSAMPLED/image/gif/3d9e15e28d9bc9efb8c02fdf9c958119/gr2.gif gr2 gr2.gif gif 7040 145 408 IMAGE-DOWNSAMPLED 1-s2.0-S1381116904001360-gr3.sml https://s3.amazonaws.com/prod-ucs-content-store-us-east/content/pii:S1381116904001360/gr3/THUMBNAIL/image/gif/f5a6048f8b095dd86e2038f382e9b99c/gr3.sml https://s3-eu-west-1.amazonaws.com/prod-ucs-content-store-eu-west/content/pii:S1381116904001360/gr3/THUMBNAIL/image/gif/f5a6048f8b095dd86e2038f382e9b99c/gr3.sml gr3 gr3.sml sml 1843 94 77 IMAGE-THUMBNAIL 1-s2.0-S1381116904001360-gr3.gif https://s3.amazonaws.com/prod-ucs-content-store-us-east/content/pii:S1381116904001360/gr3/DOWNSAMPLED/image/gif/caa3d65d11957b1c2d627a3731818bf9/gr3.gif https://s3-eu-west-1.amazonaws.com/prod-ucs-content-store-eu-west/content/pii:S1381116904001360/gr3/DOWNSAMPLED/image/gif/caa3d65d11957b1c2d627a3731818bf9/gr3.gif gr3 gr3.gif gif 4030 206 168 IMAGE-DOWNSAMPLED 1-s2.0-S1381116904001360-gr4.sml https://s3.amazonaws.com/prod-ucs-content-store-us-east/content/pii:S1381116904001360/gr4/THUMBNAIL/image/gif/fcdf233b84e6d7abe3ae763b59c31b97/gr4.sml https://s3-eu-west-1.amazonaws.com/prod-ucs-content-store-eu-west/content/pii:S1381116904001360/gr4/THUMBNAIL/image/gif/fcdf233b84e6d7abe3ae763b59c31b97/gr4.sml gr4 gr4.sml sml 2031 94 84 IMAGE-THUMBNAIL 1-s2.0-S1381116904001360-gr4.gif https://s3.amazonaws.com/prod-ucs-content-store-us-east/content/pii:S1381116904001360/gr4/DOWNSAMPLED/image/gif/84e84c6f783c25cb30047bde52f8c210/gr4.gif https://s3-eu-west-1.amazonaws.com/prod-ucs-content-store-eu-west/content/pii:S1381116904001360/gr4/DOWNSAMPLED/image/gif/84e84c6f783c25cb30047bde52f8c210/gr4.gif gr4 gr4.gif gif 4938 216 194 IMAGE-DOWNSAMPLED 1-s2.0-S1381116904001360-gr5.sml https://s3.amazonaws.com/prod-ucs-content-store-us-east/content/pii:S1381116904001360/gr5/THUMBNAIL/image/gif/68f1b5d50266efd8335a6ae67a9de047/gr5.sml https://s3-eu-west-1.amazonaws.com/prod-ucs-content-store-eu-west/content/pii:S1381116904001360/gr5/THUMBNAIL/image/gif/68f1b5d50266efd8335a6ae67a9de047/gr5.sml gr5 gr5.sml sml 2232 93 73 IMAGE-THUMBNAIL 1-s2.0-S1381116904001360-gr5.gif https://s3.amazonaws.com/prod-ucs-content-store-us-east/content/pii:S1381116904001360/gr5/DOWNSAMPLED/image/gif/546800094c0f4a74df690b79544d5204/gr5.gif https://s3-eu-west-1.amazonaws.com/prod-ucs-content-store-eu-west/content/pii:S1381116904001360/gr5/DOWNSAMPLED/image/gif/546800094c0f4a74df690b79544d5204/gr5.gif gr5 gr5.gif gif 6747 234 183 IMAGE-DOWNSAMPLED 1-s2.0-S1381116904001360-gr6.sml https://s3.amazonaws.com/prod-ucs-content-store-us-east/content/pii:S1381116904001360/gr6/THUMBNAIL/image/gif/00dd37c381782ad35255697717d42218/gr6.sml https://s3-eu-west-1.amazonaws.com/prod-ucs-content-store-eu-west/content/pii:S1381116904001360/gr6/THUMBNAIL/image/gif/00dd37c381782ad35255697717d42218/gr6.sml gr6 gr6.sml sml 2245 70 125 IMAGE-THUMBNAIL 1-s2.0-S1381116904001360-gr6.gif https://s3.amazonaws.com/prod-ucs-content-store-us-east/content/pii:S1381116904001360/gr6/DOWNSAMPLED/image/gif/620abc4b06de1bf4b7baa68a1d355c51/gr6.gif https://s3-eu-west-1.amazonaws.com/prod-ucs-content-store-eu-west/content/pii:S1381116904001360/gr6/DOWNSAMPLED/image/gif/620abc4b06de1bf4b7baa68a1d355c51/gr6.gif gr6 gr6.gif gif 7404 196 348 IMAGE-DOWNSAMPLED 1-s2.0-S1381116904001360-gr7.sml https://s3.amazonaws.com/prod-ucs-content-store-us-east/content/pii:S1381116904001360/gr7/THUMBNAIL/image/gif/ed80ac83f78712df4713ba982d80772b/gr7.sml https://s3-eu-west-1.amazonaws.com/prod-ucs-content-store-eu-west/content/pii:S1381116904001360/gr7/THUMBNAIL/image/gif/ed80ac83f78712df4713ba982d80772b/gr7.sml gr7 gr7.sml sml 2105 94 70 IMAGE-THUMBNAIL 1-s2.0-S1381116904001360-gr7.gif https://s3.amazonaws.com/prod-ucs-content-store-us-east/content/pii:S1381116904001360/gr7/DOWNSAMPLED/image/gif/ebb529ed5f0eb9960b2287fb18045b99/gr7.gif https://s3-eu-west-1.amazonaws.com/prod-ucs-content-store-eu-west/content/pii:S1381116904001360/gr7/DOWNSAMPLED/image/gif/ebb529ed5f0eb9960b2287fb18045b99/gr7.gif gr7 gr7.gif gif 5094 216 161 IMAGE-DOWNSAMPLED 1-s2.0-S1381116904001360-gr8.sml https://s3.amazonaws.com/prod-ucs-content-store-us-east/content/pii:S1381116904001360/gr8/THUMBNAIL/image/gif/f134bb982c696e5367023716e0c28a22/gr8.sml https://s3-eu-west-1.amazonaws.com/prod-ucs-content-store-eu-west/content/pii:S1381116904001360/gr8/THUMBNAIL/image/gif/f134bb982c696e5367023716e0c28a22/gr8.sml gr8 gr8.sml sml 2197 93 88 IMAGE-THUMBNAIL 1-s2.0-S1381116904001360-gr8.jpg https://s3.amazonaws.com/prod-ucs-content-store-us-east/content/pii:S1381116904001360/gr8/DOWNSAMPLED/image/jpeg/f9e43fab76033abab9b2902d8d8722c8/gr8.jpg https://s3-eu-west-1.amazonaws.com/prod-ucs-content-store-eu-west/content/pii:S1381116904001360/gr8/DOWNSAMPLED/image/jpeg/f9e43fab76033abab9b2902d8d8722c8/gr8.jpg gr8 gr8.jpg jpg 39983 380 361 IMAGE-DOWNSAMPLED 1-s2.0-S1381116904001360-gr9.sml https://s3.amazonaws.com/prod-ucs-content-store-us-east/content/pii:S1381116904001360/gr9/THUMBNAIL/image/gif/a84b11fab6472dd470b66e6b8f35b619/gr9.sml https://s3-eu-west-1.amazonaws.com/prod-ucs-content-store-eu-west/content/pii:S1381116904001360/gr9/THUMBNAIL/image/gif/a84b11fab6472dd470b66e6b8f35b619/gr9.sml gr9 gr9.sml sml 2277 93 104 IMAGE-THUMBNAIL 1-s2.0-S1381116904001360-gr9.jpg https://s3.amazonaws.com/prod-ucs-content-store-us-east/content/pii:S1381116904001360/gr9/DOWNSAMPLED/image/jpeg/98128f3df48f3c7d8a41182b4732f0d1/gr9.jpg https://s3-eu-west-1.amazonaws.com/prod-ucs-content-store-eu-west/content/pii:S1381116904001360/gr9/DOWNSAMPLED/image/jpeg/98128f3df48f3c7d8a41182b4732f0d1/gr9.jpg gr9 gr9.jpg jpg 36558 337 376 IMAGE-DOWNSAMPLED MOLCAA 4564 S1381-1169(04)00136-0 10.1016/j.molcata.2004.03.004 Elsevier B.V. Fig. 1 Structure representation of the iron porphyrin Na4[Fe(TDFSPP)Cl]. Fig. 2 (a) Synthesis of compound 4 by 3-APTS grafting process in delaminated kaolinite followed by the ethoxy groups hydrolysis (based on CA, CHN and TG–DSC results); (b) schematic representation of the immobilization reaction of the iron porphyrin (compound 3) in pre-silanized kaolinite (compound 4) to obtain compound 5. Fig. 3 UV-Vis spectra of: (a) Na4[Fe(TDFSPP)Cl] (compound 3); (b) H2TDFSPP (compound 2); (c) FeTDFSPP bound to 3-APTS-kaolinite (silanized kaolinite) in nujol mull (compound 5). Fig. 4 Powder X-ray diffraction patterns of the entire procedure to delaminate kaolinite, after mechanochemical intercalation of urea: (a) pure urea; (b) raw kaolinite; (c) K-urea; (d) kaolinite after the delamination process and grafting of silane (silanized kaolinite compound 4); (e) compound 5 (iron porphyrin bound to silanized kaolinite compound 4); (∗) silicon used as internal standard. Fig. 5 FTIR spectra of: (a) kaolinite; (b) silanized kaolinite (compound 4); (c) FeTDFSPP bound to silanized kaolinite (compound 5); (d) FeTDFSPP (compound 3). Fig. 6 TG (A) and DSC (B). Measurements of the raw kaolinite (a); kaolinite after the delamination and grafting reaction (compound 4) (b); after immobilization of the iron porphyrin (compound 5) (c). Fig. 7 EPR spectra of: (a) Na4[Fe(TDFSPP)Cl] bound to 3-APTS-kaolinite (compound 5); (b) Na4[Fe(TDFSPP)Cl] (compound 3); (c) silanized kaolinite (compound 4). Fig. 8 Schematic representation of catalytic selectivity results of compound 5. PhIO: iodosylbenzene; Imi: 1-methylimidazole; H2O2: hydrogen peroxide. Fig. 9 Schematic representation of catalytic selectivity results of Na4[Fe(TDFSPP)Cl] (compound 3) in homogeneous reactions. PhIO: iodosylbenzene; Im: 1-methylimidazole; H2O2: hydrogen peroxide. Table 1 Previous test to determinate the ideal immobilization conditions of iron porphyrin (compound 3) on silanized kaolinite (compound 4) Test number Reagents a Percent of iron porphyrin immobilized after washing process (%) b 1 (4) + (3) + H2O 52 2 (4) + (3) + methanol 40 3 (4) + (3) + H2O + HCl 63 4 Delaminated kaolinite + (3) + H2O 0 5 Delaminated kaolinite + (3) + methanol 0 a (4) = 10–20mg of silanized kaolinite; (3) = 5.0ml of iron porphyrin [Fe(TDFSPP)Cl]4− solution (4.0×10−5moll−1); 1.0 of HCl aqueous solution (1.0×10−5moll−1); test volume 6.0ml. b %Fepor: total iron porphyrin added−total iron porphyrin quantitatively determined by UV-Vis analyzed in all supernatants resulted from the washing of the solid resulted by the immobilization process (percent results based on the difference of the quantity of iron porphyrin added and the quantity removed or no immobilized after the reaction). Table 2 Oxidation of cyclooctene catalyzed by compound 5/PhIO system Run a Molar ratio of Fepor:PhIO Cyclooctene oxide (%) Turnover number b 1 1:10 63 110 2 1:50 92 152 3 1:100 94 153 4 1:1000 93 149 5 1:10000 97 488 Recycling run c 6–10 1:100 99 152 11–15 1:1000 95 200 16–20 1:10000 97 490 21 d 1:100 12 21 22 1:1000 21 39 Molar ratio of Fepor:H2O2:Imi 23 e 1:100 16 29 24 1:1000 17 29 25 f 1:100:1 28 46 26 1:1000:1 36 54 a Runs 1–20: heterogeneous reactions performed with compound 5. Yield based on starting PhIO. b Turnover number=moles of product (epoxide) per mole of iron porphyrin. c Groups of five recycling reactions performed with the same solid catalyst (compound 5) in the same molar ratio conditions. d Runs 21 and 22: homogeneous reactions performed with compound 3 in dichloromethane/acetonitrile solvent mixture (1:1v/v). e Runs 23 and 26: using H2O2 as oxidant instead of PhIO. f Runs 25 and 26: addition of 1equiv. of 1-methylimidazole per equivalent of iron porphyrin. Table 3 Oxidation of cyclohexane catalyzed by compound 5/PhIO system Run a Molar ratio of Fepor:PhIO Cyclohexanol yield (%) Cyclohexanone yield (%) Turnover number b 1 1:10 33 8 19 2 1:50 47 7 22 3 1:100 74 3 64 4 1:1000 85 3 367 5 1:10000 90 3 504 Recycling run c 6–10 1:100 82 2 69 10–15 1:1000 87 4 372 16–20 1:10000 92 4 510 21 d 1:100 23 – 11 22 1:1000 14 – 35 Molar ratio of Fepor:H2O2:Imi 23 e 1:100 24 <1 47 24 1:1000 21 – 52 25 f 1:100:1 25 – 50 26 1:1000:1 33 – 60 a Runs 1–20: heterogeneous reactions performed with compound 5. Yield based on starting PhIO. b Turnover number=moles of product (1×alcohol+2×ketone) per mole of iron porphyrin. c Groups of five recycling reactions performed with the same solid catalyst (compound 5) in the same molar ratio conditions. d Runs 21 and 22: homogeneous reactions performed with compound 3 in dichloromethane/acetonitrile solvent mixture (1:1v/v). e Runs 23 and 26: using H2O2 as oxidant instead of PhIO. f Runs 25 and 26: addition of 1equiv. of 1-methylimidazole per equivalent of iron porphyrin. Table 4 Oxidation of heptane catalyzed by Fepor-kao (compound 5)/PhIO system Run a Molar ratio of Fepor:oxidant Alcohol yield (%) Turnover number b Regioselectivity (%) (carbon position 1) 1 1:10 14 12 0 2 1:50 16 17 0 3 1:100 18 21 2 4 1:1000 41 51 1 5 1:10000 48 65 2 Recycling run c 6–10 1:100 30 40 2 11–15 1:1000 45 62 1 16–20 1:10000 53 75 1 21 d 1:100 1 <1 1 22 1:1000 2 4 2 Molar ratio of Fepor:H2O2:Imi 23 e 1:100 3 4 1 24 1:1000 4 6 3 25 f 1:100 6 8 2 26 1:1000 14 10 2 a Runs 1–20: heterogeneous reactions performed with compound 5. Yield based on starting PhIO. b Turnover number=moles of product (1×total moles of alcohol+2×total moles of ketones) per mole of iron porphyrin. c Groups of five recycling reactions performed with the same solid catalyst (compound 5) in the same molar ratio conditions. d Runs 21 and 22: homogeneous reactions performed with compound 3 in dichloromethane/acetonitrile solvent mixture (1:1v/v). e Runs 23 and 26: using H2O2 as oxidant instead of PhIO. f Runs 25 and 26: addition of 1equiv. of 1-methylimidazole per equivalent of catalyst. Anionic iron(III) porphyrin immobilized on silanized kaolinite as catalyst for oxidation reactions Shirley Nakagaki ∗ Flávio Luiz Benedito Fernando Wypych Bioinorganic Laboratory, Departamento de Quı́mica, Universidade Federal do Paraná, C.P. 19081, CEP 81531-990 Curitiba, PR, Brazil * Corresponding author. Tel.: +55-11-3665915; fax: +55-11-3665915. Silanized kaolinite was used as a new inorganic support for immobilization of the anionic iron(III) porphyrin [(FeTDFSPP)Cl]4−. The material (kaolinite-iron(III) porphyrin) was an efficient and selective catalyst for oxidation reactions. Kaolinite (KGa-2, standard poorly crystallized) was reacted with 3-aminopropyltriethoxysilane (3-APTS) (silanization reaction) after intercalation with urea and delamination under ultrasonic treatment. The silane groups were grafted partially on the layered kaolinite outer surface and aqueous treatment could hydrolyze the remaining ethoxy groups. The silanized kaolinite (compound 4) was used as a new inorganic support for immobilization of the anionic iron(III) porphyrin: 5,10,15,20-tetrakis(2,6-difluoro-3-sulfonatophenyl) porphyrinato iron(III) chloride [(FeTDFSPP)Cl]4− (compound 3). It was found that compound 4 was an appropriated structure to immobilize the [(FeTDFSPP)Cl]4− by electrostatic interactions. The obtained material (kaolinite-iron(III) porphyrin, compound 5) was characterized by different techniques such as UV-Vis and infrared (FTIR) spectroscopy, electron paramagnetic resonance (EPR), proton nuclear magnetic resonance ( 1 H NMR), atomic absorption spectrometry (AAS) and thermal analysis (simultaneous TG/DSC). Compound 5 was investigated in brand oxidation reactions using cyclooctene, heptane and cyclohexane. Iodosylbenzene (PhIO) was used as oxygen atom donor in different molar ratios of iron(III) porphyrin:PhIO. It was observed that compound 5 was an efficient and highly selective catalyst system for epoxidation of cyclooctene (97% of cyclooctene oxide) and hydroxylation of cyclohexane (90% cyclohexanol) after 1h. The heptane hydroxylation gave 50% of heptanols. The hydrogen peroxide was also used as oxidant but moderate results were obtained. After reuse (3–5 times) the catalyst showed a higher conversion than the primary reactions. Keywords Porphyrin Kaolinite Silanization Catalysis Oxidation 1 Introduction Metalloporphyrins are known to perform alkane hydroxylation and alkene epoxidation in a biomimetic catalytic way. In order to recover the catalyst from the reaction media for future reuse or recycling, heterogenization methods of the catalyst have been intensively investigated [1-7]. Main aim of these studies has been to obtain a solid compound that can stabilize the metalloporphyrin for reuse in the reactions and at the same time, promote the catalytic reaction in a selective and desirable stereo-specific manner. To achieve this, many different inorganic materials such as silica, zeolite, alumina, glasses, natural and synthetic layered material (clays and layered double hydroxides) have been used [8-12]. Kaolinite, Al2Si2O5(OH)4 is a dioctahedral layered hydrated aluminosilicate of the 1:1 type with two distinct interlayer surfaces. One side of the layer is gibbsite-like with aluminum atoms coordinated octahedrally to corner oxygen atoms and hydroxyl groups. The other side of the layer is constituted by a silica-like structure, where the silicon atoms are coordinated tetrahedrally to oxygen atoms. The adjacent layers are linked by hydrogen bonds involving aluminol (AlOH) and siloxane (SiO) groups. These binding forces hinder the intercalation processes, but the hydroxyl groups on the aluminum side of the layer are passive to solvation and covalent grafting reactions [13,14]. In the case of large molecules, it is expected that only the surface would be grafted. In this sense, a delamination process would be helpful to provide a small number of stacked layers producing crystals with a large basal surface area [15]. Mechanochemical intercalation of urea and treatment with water under ultrasound stirring is a very easy way to promote the delamination of kaolinite and produce high surface basal area crystals, ideal for the grafting reaction and subsequent immobilization of anionic porphyrins. Although kaolinite has a neutral structure and belongs to the same category of clay minerals, no report has been found so far for its use as support for the immobilization of molecules with catalytic activity. Hence in this work, we report the immobilization of the anionic iron(III) porphyrin Na4[Fe(TDFSPP)Cl] (Fig. 1 ) in silanized kaolinite and its use as catalyst to oxidation reaction. 2 Experimental 2.1 Materials and synthesis All chemicals used in this study were purchased from Aldrich, Sigma or Merck and were of analytical grade. Chloroform and toluene were treated with small portions of concentrated sulfuric acid, neutralized with NaOH solution to pH 7, dried with anhydrous CaCl2, bidistilled and stored in 4Å molecular sieves. Ethanol or methanol was refluxed over magnesium–iodine mixture and after distillation stored over 3Å molecular sieves. Pyrrole was bidistilled under reduced pressure and used immediately after distillation or stored over night in 4Å molecular sieves. The 2,6-difluorobenzaldehyde (98%), boron trifluoride diethyl etherate (BF3 etherate), p-chloranil (previously powdered) were used under nitrogen atmosphere and without treatment. Dichloromethane of analytical grade was distilled and stored over 4Å molecular sieves. Distilled water was purified by the Millipore filtration system. NaHCO3 anhydrous was dried. Pre-activated Silica gel (Merck) 60/70-230 mesh was used in the chromatographic purifications. Standard poorly crystallized kaolinite (KGa-2) purchased from the Clay Minerals Society (Source Clay Minerals Repository, Columbia, MO), was activated at 60°C under vacuum (chemical analysis was negative to carbon). The 3-aminopropyltriethoxysilane was reagent grade and used under nitrogen atmosphere. Sephadex resin SP-C25 was hydrated with aqueous HCl solution (1×10−5 moll−1) for 2h before use. Urea was powdered in a mortar before its use. Cyclohexane, heptane and cyclooctene were treated under argon atmosphere before use. Iodosylbenzene was prepared following the methods described by Sharefkin and Saltzmann [16] through hydrolysis of iodosylbenzenediacetate. The solid was carefully dried under reduced pressure and kept at 5°C. Hydrogen peroxide (30% in water) was stored at 5°C and titrated before use [17]. After use, all the reagents were discarded in an appropriate container for later treatment for reuse, or for final disposal. 2.1.1 5,10,15,20-Tetrakis(2,6-difluorophenyl) porphyrin—H2(TDFPP) (1) Compound 1 was synthesized following by the classical procedure described by Lindsay for preparation of meso-substituted porphyrin [18]. Stoichiometric amounts of 2,6-difluorobenzaldehyde and pyrrole were condensed in CHCl3, catalyzed by BF3 etherate, followed by the oxidation with powdered p-chloranil. The solvent mixture was evaporated to dryness resulting in a great quantity of deep purple solid material. The solid powder was analyzed by preparative thin layer chromatography on silica gel in pure CH2Cl2. The crude solid was dissolved in a minimal amount of CH2Cl2 and purified on silica gel chromatographic column (45 cm×1.5 cm) eluted with dichloromethane. The first deep dark purple band of porphyrin 1 was separated and dried under vacuum at 35–45°C, which yielded 63% of a thin deep red-purple solid 1. UV-Vis (chloroform), λ max (nm) (ε, moll−1 cm−1): 416 (Soret band) (2.48×105), 508 (1.37×104), 538 (2.43×103), 584 (5.22×103), 638 (4.52×102). Chem. anal. calcd. for C44H22N4F8 (FW 758.65): C 69.66%, H 2.92%, N 7.38%. Found: C 68.5%, H 2.81%, N 7.02%. IR (KBr, cm−1): 3427 (NH stretch), 3333, 3110 (CH stretch), 1587 (CC stretch), 1463, 1342, 1234, 1000, 817, 783, 711. 1 H NMR performed in CDCl3 (signal values in ppm): 8.95 (s, 8H, β-pyrrole-H), 7.82 (m, 4H, p-Ph-H), 7.41 (d, J=8.5Hz, 8H, m-Ph-H), −2.73 (s, 2H, internal NH ring). 2.1.2 Anion of 5,10,15,20-tetrakis(2,6-difluoro-3-sulfonatophenyl) porphyrin—[H2(TDFSPP)]4− (2) The sulfonation of 1 was made following the method of Turk and Ford [19,20]. The porphyrin 1 (0.39mmol) and concentrated H2SO4 (0.21mol) were magnetically stirred inside a single-long-neck round bottom flask under reflux at 185°C for 7h in a silicon oil bath. The mixture was cooled at room temperature, and stirred for 38h. The sulfonation reaction was accompanied by a porphyrin color change from red to light green. A small portion of the green mixture was neutralized with solid NaHCO3 followed by addition of CH2Cl2 and both phases were analyzed by UV-Vis spectroscopy. The sulfonation reaction was completed when no more porphyrin was present in CH2Cl2. The excess of H2SO4 was neutralized with NaHCO3 resulting in the porphyrin 2 bearing –SO3Na or –SO3H groups and Na2SO4. The mixture was dried under vacuum, which resulted in impure crude solid. The porphyrin 2 was extracted with methanol and the extraction process was repeated several times until no more porphyrin could be detected in the crude solid. The solvent was evaporated at 40°C under vacuum and the residual Na2SO4 was removed twice by column chromatography in silica gel eluted with methanol. After drying the pure porphyrin 2 was obtained (85% yield based on porphyrin bearing four SO3 − groups). UV-Vis (methanol), λ max (nm) (ε, moll−1 cm−1): 412 (Soret band) (2.22×105), 510 (1.40×104), 540 (2.70×103), 586 (4.60×103), 642 (8.60×102). Chem. anal. calcd. (considering four SO3 − groups and four H2O molecules per porphyrin ring) for C44H34N4F8S4O28Na4 (FW 1454.53): C 36.33%, H 2.35%, N 3.6%, S 10.97%. Found: C 36.99%, H 2.56%, N 3.22%, S 11.98%. IR (KBr, cm−1): 3425 (NH stretch), 3097 (CH stretch), 1614 (CC aromatic stretch), 1429 (CN stretch), 1107 (SO3 −), 1055–1000 (C–F multiple bands). 1 H NMR performed in D2O (signal values in ppm): 9.05 (m, 8H, β-pyrrole-H), 8.30 (m, 4H, p-Ph-H), 7.45 (m, 4H, m-Ph-H). 2.1.3 Anion of 5,10,15,20-tetrakis(2,6-difluoro-3-sulfonatophenyl) porphinato iron(III) chloride—[Fe(TDFSPP)Cl]4− (3) Porphyrin 2 (0.220mmol) and FeCl2·4H2O (2.20mmol) were refluxed in 20ml of N,N′-dimethylformamide (DMF) under argon atmosphere for 8h. The solvent was evaporated under vacuum and the dark solid was dissolved in a minimal amount of bidistilled water and purified by column chromatography packed with a cationic ion-exchange resin Sephadex SP-C25 (hydrogen form) to remove the excess of iron salt. The solution was evaporated and the porphyrin 3 solid was stored in desiccator under dried conditions. UV-Vis (H2O), λ max (nm) (ε, moll−1 cm−1): 390 (Soret band) (3.78×104), 504 (2.55×102), 578 (1.00×103), 656 (7.12×104). The EPR analysis showed an intense signal at g=6.0. IR spectrum showed similar bands of porphyrin 2 except the 3425cm−1 band characteristic of internal NH stretching. 2.1.4 Preparation of compound 4 by the functionalization of kaolinite with 3-aminopropyltriethoxysilane Kaolinite (6.0g) and urea (20%, m/m, 1.2g) were mixed in a agate mortar by grinding for 2h, transferred to 150ml of boiled hot water and treated in an ultrasound bath until a colloidal suspension of a delaminated kaolinite was obtained (about 0.5h after) [15]. The suspension was centrifuged at 4500rpm to remove the supernatant; the solid was washed several times with water to remove the excess of urea, and then dried under vacuum at 60°C for 12h. The dried solid (3.7g) was suspended in 95ml of toluene under magnetic stirring (argon atmosphere) and 3-aminopropyltriethoxysilane (12mmol) was added in drops and was refluxed for 48h. The suspension was filtered and washed in Soxhlet with toluene, ether, dichloromethane, methanol and acetone for 48h in order to remove the residual 3-aminopropyltriethoxysilane. The solid 4 was dried under vacuum at 65°C for 24h. The TG–DSC analyses and EA (chemical analysis) result suggested that there were 4.2mmol of 3-APTS groups per gram of kaolinite. IR spectroscopy showed characteristic bands of 3-APTS groups at 692 (SiC), 2933 (as CH) and 3292cm−1 (s NH). 2.1.5 Preparation of compound 5 by the immobilization of iron(III) porphyrin (3) on compound 4 Initially four experiments were performed to find the ideal condition to immobilize the Fe(TDFSPP) on inorganic support. All the tests reactions were carried out at same conditions and proportions of reagents (Table 1 ). General conditions to tests 1 and 2 were as follows: silanized kaolinite (compound 4) (10mg) was suspended in 1.0ml solvent (water or purified methanol) to which 5.0ml of Fe(TDFSPP) solution were added (solution prepared in the same solvent of the suspension, 4.0×10−5 moll−1). The suspension was magnetic stirring at room temperature during 1h. The system was air-tightly closed and again stirred magnetically for 1h in a water bath. The suspension was centrifuged and the solid was thoroughly washed with water and methanol. All the supernatant was transferred to a volumetric flask for quantitative UV-Vis analysis. For test 3 (Table 1) aqueous HCl solution (1.0ml, 1.0×10−5 moll−1) was added. For tests 4 and 5, pure delaminated kaolinite instead of silanized kaolinite (4) was used as inorganic support. From the tests described in Table 1, the best conditions of test 3 were chosen for the synthesis of compound 5. Compound 4 (800mg) was suspended in 15ml of pure water under magnetic stirring and 1.5ml of 10−5 moll−1 HCl solution was added followed by the addition of iron(III) porphyrin (3) (11μmol). The system was closed with air tightness and stirred magnetically for 1h in a water bath. The suspension was centrifuged and the solid obtained (compound 5) was thoroughly washed with water and methanol. All the supernatant was transferred to a volumetric flask for quantitative UV-Vis analysis. The green solid compound 5 was refluxed in methanol, kept for 14h in order to observe, if any iron(III) porphyrin was removed. The solid was again centrifuged and thoroughly washed. The supernatant was monitored by UV-Vis analysis in order to observe a possible leaching of Fe(TDFSPP) from the support (no iron(III) porphyrin was detected). The solid recovered was dried at 60°C for 72h. The TG–DSC and AAS results indicated 12μmoliron/g of compound 5, EA (chemical analysis, 1.56% C) and the quantitative UV-Vis analysis showed 13μmolFe(TDFSPP)/g of compound 5. 2.1.6 Treatment of compound 5 with 2-(dimethylamino)pyridine (DMAP) Compound 5 (0.1g) was suspended in 10ml of DMF under magnetic stirring at 60°C. The organic base 2-(dimethylamino)pyridine (DMAP, 0.18mmol), dissolved in a minimal amount of DMF was added in drops (DMAP:FeTDFSPP molar ratio was 10:1). The mixture was heated under magnetic stirring for 8h at 45°C. The solid was once again thoroughly washed with methanol and dichloromethane and the supernatant was stored and analyzed by UV-Vis spectroscopy with a view to quantify the iron(III) porphyrin removed from the matrix. 2.1.7 Oxidation of cyclooctene, heptane and cyclohexane by iodosylbenzene (PhIO) or H2O2 catalyzed by compound 5 Catalytic oxidation reactions were carried out in a 2ml thermostatic glass reactor equipped with a magnetic stirrer inside a dark chamber. In a typical reaction of heterogeneous catalysis, compound 5 (20mg) and iodosylbenzene solid were degassed with argon during 30min inside a 2ml vial. The solid mixture was suspended in 0.3ml of solvent (dichloromethane) and the substrate cyclooctene, heptane or cyclohexane (1.1mmol) were added resulting in a Fe(TDFSPP):oxidant:substrate constant molar ratio. The oxidation reaction was carried out during a controlled time interval (1, 3 and 6h) under magnetic stirring. Sodium sulfite was added in order to eliminate the excess of iodosylbenzene. The reaction products in solution were separated from the solid by centrifugation and the catalyst solid was washed with dichloromethane and acetonitrile solvents. All the extracted solution and supernatant were transferred to a volumetric flask and analyzed by gas chromatography. Product yields were determined based on PhIO with the internal standard method. The solid catalyst was thoroughly washed and dried for its reuse in another reaction. With a view to check the reproducibility of the determinations, all the reactions were repeated 3–5 times since a micro method was used to measure catalytic activities and only average results are reported. The same procedure was followed in the control reactions using: (a) only the substrate, (b) substrate+PhIO and (c) substrate+PhIO+compound 4. The procedure for homogeneous catalysis reactions was similar to that for heterogeneous catalysis reaction. Fe(TDFSPP) solution was prepared using a acetonitrile:dichloromethane (1:1) solvent mixture (8.0×10−5 moll−1). Hydrogen peroxide was used in the same way as PhIO with the addition of required amount of 30% aqueous solution. 1-Methylimidazole (Imi) solution also prepared in CH3CN:dichloromethane mixture (8.0×10−4 moll−1) was added to the iron(III) porphyrin solution before the substrate and oxidant. 2.2 Techniques used UV-Vis spectra were recorded in the 200–800nm range in a HP 8452A Diode Array Spectrophotometer. All analysis were obtained with a 0.5cm path length cell for 10−5 and 10−6 moll−1 of porphyrin solution. Spectra of solid samples were recorded in a 0.1cm path length quartz cell (Hellma) in nujol mull. Infrared spectra were obtained using a Bomem Michelson MB-100 spectrophotometer on powdered samples mixed with dried KBr and measured over the 4000–400cm−1 region, with 65 scans and a resolution of 4cm−1. Electron paramagnetic resonance (EPR) measurements of the powder materials were made with a Bruker ESP 300E spectrometer at X-band (ca. 9.5GHz) at 293 or 77K using liquid N2. Proton nuclear magnetic resonance ( 1 H NMR) measurement was made using INOVA 500-Varian 500MHz in CDCl3 or D2O. Atomic absorption spectroscopic (AAS) studies were carried out in a Perkin Elmer 4100-1319 Spectrophotometer using a conventional air–acetylene flame, after acid (HF) dissolution of known amounts of clay material in PARR digest pump. Chemical analysis (CA) measurements (CHN) were carried out with a Perkin Elmer 240C instrument. Thermogravimetric and differential scanning calorimetric (TG and DSC) measurements were performed with a Netzsch-STA 409EP series equipment. Samples were heated under air static atmosphere from 20 to 1000°C at a rate of 8°C/min, using 0.065ml alumina crucibles. X-ray diffraction study of powdered samples was performed with a Rigaku diffractometer using the Bragg–Bretano geometry (radiation Co Kα (=1.7902Å, 40kV and 20mA, Ni filter, scan speed of 1°min−1). Silicon powder was added to the samples and used as internal standard (denoted by an asterisk in the X-ray powder diffraction patterns). Products from organic oxidation were identified using a Shimadzu CG-14B gas chromatograph (flame ionization detector) with a DB-WAX capillary column (J&W Scientific). 3 Results and discussion 3.1 Synthesis of porphyrins and iron(III) porphyrin The required porphyrin ligand 1 was prepared following the general procedure developed by Lindsay based on thermodynamic equilibrium conditions [18]. The UV-Vis analysis of compound 1 shows an intense Soret band at 416nm and four Q-bands at 500–700nm region characteristic of the porphyrin free base. Compound 1 was sulfonated with concentrated sulfuric acid added at 185°C to give compound 2 [6,19,21]. Chemical analysis showed four SO3 − groups per porphyrin ring and 1 H NMR showed 100% of sulfonation in m-phenyl ring position. The UV-Vis spectrum of the water soluble compound 2 showed a large Soret band at 412nm. Metallation of compound 2 with iron(II) chloride produced compound 3 and the UV-Vis spectrum showed the characteristic reduction of Q-bands number (from 4 to 2) for metallated porphyrin [22-24] and the Soret band blue shifted to 390nm. The EPR analysis of compound 3 showed an intense signal related to S= 5 2 Fe(III) high spin in axial symmetry at g=6.0 [25]. It is expected that the halogen-substituted iron(III) porphyrin Fe(TDFSPP) would be a robust and efficient catalyst for oxidation reactions mediated by oxidants like PhIO. The resistance of the porphyrin ring against oxidation degradation can be explained by the introduction of highly electron-withdrawing fluorine substituents in the ortho positions of the meso phenyl porphyrin groups that can increase the acceptor character of the porphyrin ring in comparison with the classic tetraphenyl porphyrin (TPP) or other porphyrins with electron donor methyl groups to the meso-phenyl moieties [26,27]. In order to explore the full catalytic potential of the Na4[Fe(TDFSPP)Cl], the ways to graft it in solid supports are investigated in this study. 3.2 Preparation of compound 5 (kaolinite 4 bound catalyst 3) With a view to look for efficient immobilization condition of iron(III) porphyrin 3 to modified kaolinite 4, first five tests were performed (Table 1). Better results of iron(III) porphyrin immobilization were observed in water than in methanol as reaction solvent (tests 1 and 2, Table 1). The presence of acid increased the percent of immobilization in water from 52 to 63% (tests 1 and 3). The delaminated kaolinite showed no immobilization capacity in water or methanol, suggesting that the functional groups 3-APTS from compound 4 is necessary to the immobilization process (tests 4 and 5). Since the best results of iron(III) porphyrin immobilization were observed in test 3, compound 5 was synthesized in these conditions. Compound 5 was thoroughly washed and no removal of iron(III) porphyrin was observed by UV-Vis analysis suggesting that a strong interaction between the iron(III) porphyrin and the silanized kaolinite (compound 4) had taken place. Possible electrostatic bond could explain the success of the immobilization process since no new covalent bond was expected to be formed by the interaction of the anionic iron(III) porphyrin and the solid matrix. In fact, strong electrostatic bond is possible if one considers that the anionic iron(III) porphyrin is attracted by cationic amine generated by the protonation of the 3-APTS amine groups present in the silanized kaolinite 4 (Fig. 2b ). The nature of electrostatic interaction between iron(III) porphyrin and the kaolinite matrix was indirectly confirmed by reaction of compound 5 with the organic base 2-(dimethylamino)pyridine DMAP. The addition of a weak base such as DMAP could remove the iron(III) porphyrin immobilized exclusively by electrostatic interactions. After the reaction at mild conditions, the solid was thoroughly washed and the resulting supernatant analyzed by UV-Vis spectroscopy. The 98% of the iron(III) porphyrin was removed from the matrix confirming that the organic compound substituted the charged iron(III) porphyrin in the charged matrix. The presence of the Fe(TDFSPP) immobilized on silanized kaolinite (compound 5) was confirmed by UV-Vis spectra (Fig. 3c in nujol mull). The UV-Vis spectrum results suggested that no demetallation occurred during the preparation process, since the characteristic metalloporphyrin Soret peak was observed for supported porphyrins compound 5 at 412nm and no characteristic blue shift of Soret band associated with a significant amount of free base porphyrin (Fig. 3b) was observed [22,24,27,28]. The UV-Vis spectrum for iron(III) porphyrin in solution shows the Soret band in the range of 390nm (Fig. 3a). It can be observed from the X-ray diffraction analysis that kaolinite is intercalated with urea where a mixture of kaolinite (d=7.2Å), urea intercalated kaolinite (d=10.8Å) and an excess of urea, characterized by a sharp peak at 2θ=26°, Fig. 4 a–c. By the intensities of the basal peaks, an intercalation ratio of ca. 50% was obtained [29]. After the intercalation and delamination process (Fig. 4b), the basal peaks of kaolinite became broad and with low intensities, showing that the delamination process was efficient, urea totally being removed by the washing procedure. The crystals were very small with low stacking coherence along the basal direction. After the washing procedure, grafting (Fig. 4d) and immobilization process (Fig. 4e), the same basal spacing was obtained, indicating that the reactions proceeded on the surface of the layered kaolinite crystals. The FTIR spectra of: (a) the raw kaolinite, (b) silanized kaolinite (compound 4), (c) after reaction with the iron(III) porphyrin (compound 5) and (d) pure iron(III) porphyrin (compound 3) are shown in Fig. 5 . The interpretation of the FTIR spectra of the raw kaolinite has been reported earlier [30a] with the common band at 1635cm−1 being attributed to adsorbed water OH bending [30b]. After the grafting of the silane, new characteristic bands were observed at 1310, 1333, 1386, 1434, 1492, 1563, 1637, 2870 and 2938cm−1, which could be attributed to the organic grafted molecules [30b]. In the silanized kaolinite and reaction with the iron(III) porphyrin (5) (c) the FTIR spectra resembles that for pure kaolinite. One important characteristic distinction can be made between raw kaolinite, grafted kaolinite (4) and grafted kaolinite after the immobilization of the iron(III) porphyrin (5) as follows: the bands in 3696, 3667 and 3650cm−1, attributed to the surface OH groups have the intensities progressively reduced in comparison to the band at 3621cm−1, attributed to inner OH groups. This confirms that surface hydroxyl groups are involved in the grafting and immobilization of the porphyrin. The concentration of the porphyrin and the silane is too low to be detected in the FTIR spectra of the grafted and porphyrin immobilized kaolinite (5) (Fig. 5c). Fig. 6 shows the TG (A) and DSC (B) measurements on: (a) the raw kaolinite, (b) kaolinite after the delamination and grafting reaction (compound 4) and (c) after immobilization of the iron(III) porphyrin (compound 5). For raw kaolinite, the 2% mass loss observed at temperatures below 200°C could be attributed to the loss of moisture. The dehydroxylation of kaolinite was observed at 515°C and the crystallization of metakaolinite was observed as an exothermic peak centered at 984°C [31]. This process generated a mass loss of 14.8% (in dry weigh basis) and this was in good agreement with the predicted value of 13.96% [30a] from the theoretical formula of pure kaolinite (Al2Si2O5(OH)4). After the grafting process (Fig. 6b), two endothermic peaks were observed at 62 and 132°C related to the elimination of adsorbed/absorbed and coordinated water molecules, respectively. An exothermic peak was observed at 249°C followed by a broad band in the region of 400°C, both related to the combustion of the organic matter of the sample. The peaks related with the dehydroxylation of the matrix and the crystallization of the oxide as observed earlier for raw kaolinite, were observed at 507 and 987°C, respectively. A broad band was observed in the region of 550°C, related to the oxidation of the remaining organic matter of the sample. The mass loss between 200 and 1000°C was 35.7%, on dry weight basis. The two curves showed clearly that kaolinite was grafted with the silane, as proposed. After the process of the iron(III) porphyrin immobilization (Fig. 6c), the sample resembled the decomposed raw kaolinite. The difference could be characterized by a broad low intensity band centered at 330°C and a different mass loss of 3% up to 200°C and 18.7% between 200 and 1000°C (on dry weight basis). This result suggested that almost all the organic matter (grafted silane) was eliminated and only a small amount of iron(III) porphyrin remained immobilized as confirmed by quantitative UV-Vis analysis. The EPR spectra of the kaolinite and compounds 3–5 are shown in Fig. 7 . There are five main lines in the spectra at magnetic fields below 2500G, which are characteristic of kaolinites with g-values of 9.0, 5.0, 4.3, 3.5 and 2.8. Those lines are due to absorptions of the cation Fe(III) in both Fe(I) and Fe(II) sites of kaolinites resulting from spin resonance arising from the three Kramer’s doublets, whose energies are separated by crystal fields of rhombic symmetry. Fe(I) and Fe(II) are two inequivalent crystal sites in which Fe(III) can occupy the octahedra in kaolinite [32]. The EPR spectrum of compound 5 shows one signal at g=6.0 characteristic of Na4[Fe(TDFSPP)Cl], indicating the presence of the iron(III) porphyrin in the catalyst. 3.3 Oxidation reactions The most common systems for heterogeneous catalysis are based on metalloporphyrins immobilized inside porous materials or in the interlayer space of clays. The oxygen atom donors such as PhIO or organic peroxides have slow diffusion in these supports, hindering the access of these reagents to iron(III) porphyrin sites. Therefore, catalysts immobilized on the surface of inorganic matrix can be the solution to this problem imposed by the support [3]. There is a growing interest in using supported porphyrin as a catalyst: oxygen carriers mimicking biological systems as cytochrome P-450. In general, supports are used to replace the protein cavity of natural enzymes by a size- and shape-selective framework of the mineral matrix, preventing the complexes from undergoing dimerization, self-aggregations through π–π interactions and degradation mainly due to the immobilization opening the opportunity to the reuse of the catalyst [5,8-12,19,20,33]. The catalytic activity of compound 5 was investigated on the oxidation of cyclooctene and in the oxidation of weakly reactive alkanes such as cyclohexane and heptane. Epoxidation of cyclooctene with PhIO was first studied in order to investigate the efficiency and stability of the iron(III) porphyrin as a catalyst for alkene oxidation and also to have an idea of the accessibility of the iron(III) sites of the supported catalyst towards substrate and oxidant PhIO. Table 2 shows the epoxide yields from the oxidation reaction after one hour. The heterogeneous catalyst compound 5 led to a good yield of cyclooctene epoxide (63%, run 1) when the 1:10 molar ratio of Fepor:PhIO was used. The yield and turnover number were even slightly higher (90%) when the ratio increased to 1:50, 1:100, 1:1000 and 1:10000 (in the same ratio of substrate as shown in runs 2, 3, 9 and 15). These results indicated that the immobilization process did not hinder the access of the reagents to the iron(III) centers to generate the catalytic species. The high resistance of the catalyst is illustrated by the observation that the increase of the oxidant concentration (1:10–1:10000) led to higher yields of epoxide and turnover number for all reactions. Compound 5 also assisted the catalytic activity in the oxidation reaction of cyclohexane, a more inert substrate (runs 1–5, Table 3 ). When compared with the oxidation of cyclooctene, the high molar ratio of iron(III) porphyrin:PhIO favored the oxidation reaction and high selectivity was observed in the alcohol than ketone for all conditions studied. Oxidation of linear alkanes, such as heptane is a much more difficult reaction to take place in a controlled condition at lower temperature. In fact, linear alkanes are very resistant to attack by strong oxidizing agents [34]. The catalyst (compound 5) has shown moderate efficiency to convert the heptane to the oxidation products (runs 1–5, Table 4 ). In the best condition of heterogeneous catalyst (run 5, Table 4), the catalyst presented 48% to total alcohol conversion (alcohol in positions 2 and 3). Instead, good selectivity to the alcohol was observed (ketones yield was inferior to 2%), but negligible products were observed resulting in terminal oxidation (position 1) [34,35]. This tendency of low oxidation yields to catalytic oxidation of linear alkanes agrees with previous reports observed in the literature in manganese(III) porphyrin immobilized in silica and montmorillonite clay [4,7]. However, no oxidation product was observed quantitatively on position 1 of the linear alkene in compound 5 [34,35]; there was a remarkable position selectivity favoring the oxidation in position 2 followed the 3 to heptanols products. These results can be justified by the ease or difficulty posed by the support structure in obtaining active iron(III) porphyrin species through the use of linear substrates. The iron(III) porphyrin immobilized in kaolinite presented better oxy-functionalization results than the iron(III) porphyrin in solution (homogeneous catalysis, compound 3, runs 21 and 22, Tables 2–4) indicating that the immobilization favors the catalytic ability of this metalloporphyrin. As observed in Tables 2–4 (runs 6–20 in different molar ratios), the catalyst’s activity can be restored after the first use by simple filtration and washing the immobilized iron(III) porphyrin (compound 5) with dichloromethane and acetonitrile to reuse again. The results of the catalyst re-using in a new second reaction showed similar or higher yield than the first reaction for all substrates (cyclooctene, heptane and cyclohexane), suggesting that the first reaction and the recovering process could activate the iron(III) site for the subsequent reactions [3]. This fact can be an indicative of the probable resistance of iron(III) porphyrin to the harsh reaction conditions and that there is strong interaction between the iron(III) porphyrin and the support and it does not release from the surface after the first use. In fact, all reaction solutions analyzed after catalytic reactions did not show the characteristic iron(III) porphyrin Soret band at 390nm. After the second use, the catalyst was recovered again and reused which showed similar results (runs 7, 12 and 17 from Tables 2–4). This fact was also observed in three more subsequent reactions (runs 8–10, 13–15 and 18–20 from Tables 2–4). It is noteworthy that reactions using silanized kaolinite support (4) themselves (without iron(III) porphyrin) were the oxidation reaction of all the substrates and gave very low oxidation yields (under 2%) under identical conditions, indicating that the catalytic effect in the oxidation of the substrates could be attributed to the presence of the immobilized iron(III) porphyrin. The low solubility of Na4[Fe(TDFSPP)Cl] in CH2Cl2 or in CH2Cl2:CH3CN (1:1 ratio) solvent mixture in homogeneous catalysis (runs 21 and 22 in Tables 2–4) could be one of the reasons for the low yields obtained on homogeneous catalysis. The dimerization of the iron(III) porphyrin in solution could be another one because it is accompanied by μ-oxo complex formation [36]. Dimeric iron(III) porphyrins are frequently associated to low catalytic activity of porphyrin in homogeneous catalysis [27,28]. In fact, the structure of compound 3 does not have bulk groups that can avoid dimerization process in the porphyrin solution [27]. The catalyst oxidative degradation in solution is frequently responsible for the low yield in catalytic reaction using metalloporphyrins [5b]. In reaction using Na4[Fe(TDFSPP)Cl], no significant catalyst Soret band decay was quantitatively detected on the homogeneous oxidation reaction solution by UV-Vis analysis. Attempts were made to use H2O2 with compound 5 but the products were obtained lower than PhIO results (run 23 and 24, Tables 2–4). This phenomenon could probably be caused by a dismutation of the H2O2 or another secondary reaction in the presence of iron or other trace quantities of metal present in the supports [7]. The well-known catalase-like reaction in which the catalytically active species formed by the reaction of iron(III) porphyrin and iodosylbenzene could be involved in the transformation of hydrogen peroxide in molecular oxygen and water by the described OO homolysis, resulting in lower yields of products [27]. This problem was partially solved with the addition of 1-methylimidazole to the porphyrin solution (runs 25 and 26, Tables 2–4). The nitrogen atom of 1-methylimidazole was able to coordinate an axial position of iron(III) center, mimicking the histidine amino acid residue axially bound in cytochrome P-450 porphyrin site. This axial coordination made the redox cycling of the iron(III) porphyrin more favorable [37,38]. In summary, the catalytic ability of the immobilized iron(III) porphyrin (compound 5) and the iron(III) porphyrin Na4[Fe(TDFSPP)Cl] (compound 3) could be compared as observed in Figs. 8 and 9 . The immobilization process seemed to favor the catalytic ability of this metalloporphyrin probably because the immobilized catalyst had lower susceptibility to inactivation by molecular interaction process than the metalloporphyrin in solution. 4 Conclusions The functionalization of kaolinite showed a suitable hybrid organic–inorganic matrix for Fe(TDFSPP) immobilization by electrostatic interactions. Grafting the catalyst on the surface of kaolinite allowed the easy access of substrates and simple removal of products after short time reactions (1h). The present catalytic system is stable, safe to operate and can be recovered several times with negligible catalyst deactivation or leaching from the support. The iron(III) porphyrin is a very versatile and robust catalyst for alkene epoxidation and alkanes hydroxylation using PhIO. The Fe(TDFSPP) bound to kaolinite promotes a great conversion of products in high and fast turnover numbers. The use of three different substrates is possible to get an interesting view of efficiency and selectivity of compound 5. The comparative homogeneous reactions performed with H2O2 supplies low yields of products stimulated probably by hydrogen peroxide dismutation. The use of 1-methylimidazole increases the product yields showing an alternative way to improve catalytic results. Acknowledgements The authors are grateful to the Conselho Nacional de Desenvolvimento Cientı́fico e Tecnológico (CNPq), Coordenação de Aperfeiçoamento de Pessoal de Nı́vel Superior (CAPES), Fundação Araucaria, Fundação da Universidade Federal do Paraná (FUNPAR) and Universidade Federal do Paraná (UFPR) for the financial support, and Instituto de Tecnologia para o Desenvolvimento (LACTEC) for the atomic absorption spectra and chemical analysis. They gratefully acknowledge Msc. Geraldo R. Friedermann and Dr. Antonio S. Mangrich for the EPR facilities and analyses. They also gratefully acknowledge Prof. Kestur Gundappa Satyanarayana for his reading the manuscript, giving suggestions and helping in preparing the manuscript in English. References [1] D.E De Vos P.A Jacobs Catal. Today 57 2000 105 [2] Z Tong T Shichi K Tagaki Mater. Lett. 41 46 2002 1 [3] Z Li C Xia X Zhang J. Mol. Catal. A: Chem. 185 2002 47 [4] L. Barloy, P. Battioni, D. Mansuy, J. Chem. Soc., Chem. Commun. (1990) 1365. [5] (a) E.A Vidoto M.S.M Moreira F.S Vinhado K.J Ciuffi O.R Nascimento I Yamamoto J. Non-Cryst. Solids 304 2002 151 (b) I.D Cunningham T.N Danks J.N Hay I Hamerton S Gunathilagan C Janczak J. Mol. Catal. A: Chem. 185 2002 25 [6] S Campestrini B Meunier Inorg. Chem. 31 1992 1999 [7] (a) M.A Martinez-Lorente P Battioni W Kleemiss J.F Bartoli D Mansuy J. Mol. Catal. A: Chem. 113 1996 343 (b) M Halma F Wypych S.M Drechsel S Nakagaki J. Porph. Phthal. 6 2002 502 [8] (a) S Nakagaki C.R Xavier A.J Wosniak A.S Mangrich F Wypych M.P Cantão I Denicoló L.T Kubota J. Colloid Surf. A 168 2000 261 (b) A.M Machado F Wypych S.M Drechsel S Nakagaki J. Colloid Int. Sci. 254 2002 158 [9] S Nakagaki A.R Ramos F.L Benedito P.G Peralta-Zamora A.J.G Zabin J. Mol. Catal. A: Chem. 185 2002 203 [10] S Nakagaki F.L Benedito A.A Saczk P.G Peralta-Zamora J. Inorg. Biochem. 86 2001 354 [11] N Herron J. Coord. Chem. Soc. 19 1998 25 [12] S Nakagaki A.R Ramos A.A Saczk A.M Machado C.M.M Costa J. Inorg. Biochem. 74 1999 246 [13] J.E Gardolinski P.G Peralta-Zamora F Wypych J. Colloid Int. Sci. 211 1999 137 [14] J.L Guimarães P.G Peralta-Zamora F Wypych J. Colloid Int. Sci. 206 1998 281 [15] J.E. Gardolinski, M.P. Cantão, F. Wypych, Quı́mica. Nova, 24 (2001) 761. [16] (a) J.G Sharefkin H Saltzmann Org. Synth. 43 1963 62 (b) H.J Lucas E.R Kennedy M.W Forno Org. Synth. 43 1963 483 [17] J. Bassett, R.C. Denney, G.H. Jeffery, J. Mendham, Vogel’s Textbook of Quantitative Inorganic Analysis, Guanabara, Rio de Janeiro, 1981, p. 168. [18] J.S Lindsey J. Org. Chem. 54 1987 827 [19] H Turk W.T Ford J. Org. Chem. 56 1991 1253 [20] E.B Fleischer J.M Palmer T.S Srivastava A Chatterjee J. Am. Chem. Soc. 93 1971 3162 [21] L Ruhlmann A Nakamura J Vos J.H Fuhrhop Inorg. Chem. 37 1995 427 [22] (a) N. Carnieri, A. Harriman, G. Porter, J. Chem. Soc., Dalton Trans. II (1982) 931 (b) F.L Benedito S Nakagaki A.A Saczk P.G Peralta-Zamora C.M.M Costa Appl. Catal. A 250 2003 1 [23] V.N Knyukshto K.N Solovyov A.F Mironov G.D Egorova A.V Efimov Opt. Spectrosc. 85 1998 540 [24] R.A Ghiladi R.M Kretzer I Guzei A.L Rheingold Y.M Neuhold K.R Hatwell A.D Zuberbuhler K.D Karlin Inorg. Chem. 40 2001 5754 [25] M.D Assis O.A Serra Y Iamamoto Inorg. Chim. Acta 187 1991 107 [26] (a) T.G Traylor C Kim J.L Richards F Xu C.L Perrin J. Am. Chem. Soc. 117 1995 3468 (b) S Takagi Inorg. Chim. Acta 173 1990 215 [27] D Dolphin T.G Traylor L.Y Xie Acc. Chem. Res. 30 1997 251 [28] (a) F Bedioui Coord. Chem. Rev. 144 1994 39 (b) F Bedioui J Devynck C Bied-Charreton Acc. Chem. Res. 28 1995 30 (c) J.T Groves T.E Nemo R.S Meyers J. Am. Chem. Soc. 101 1979 7613 (d) B Meunier Bull. Soc. Chim. Fr. 4 1986 578 (e) D Mansuy Pure Appl. Chem. 62 1990 741 [29] J.E Gardolinski L.P Ramos G.P Souza F Wypych J. Colloid Int. Sci. 221 2000 284 [30] (a) R.L Frost E Makó J Kristóf J.T Kloprogge Spectrochem. Acta A 58 2002 2849 (b) I Shimizu H Okabayashi K Taga E Nishio C.J O’Connor Vibr. Spectrosc. 14 1997 113 [31] J.J Tunney C Detellier Clays Clay Miner. 4 1995 473 [32] K.C Lombardi J.L Guimarães A.S Mangrich N Mattoso M Abatte W.H Schreiner F Wypych J. Braz. Chem. Soc. 13 2002 270 [33] (a) L Barloy J.P Lallier P Battioni D Mansuy New J. Chem. 16 1992 71 (b) S.S Cady T.J Pinnavaia Inorg. Chem. 17 1978 1501 (c) Z Tong T Shichi K Takagi Mater. Lett. 41 2002 1 (d) M.D. Assis, J.S. Lindsay, J. Chem. Soc., Perkin Trans. II (1998) 2221. [34] J.M Thomas R Raja G Sankar R.G Bell Acc. Chem. Res. 34 2001 191 [35] B.R Cook T.J Reinert K.S Suslick J. Am. Chem. Soc. 108 1986 7281 [36] (a) C Poriel P.M Ferrand J Rault-Berthelot G Simonneaux Tetrahedron Lett. 44 2003 1759 (b) Y Iamamoto I.M Idemori S Nakagaki J. Mol. Catal. A: Chem. 99 1995 187 [37] (a) Y.M Goh W Nam Inorg. Chem. 38 1999 914 (b) W Nam A.J Lee S.Y Oh C Kim H.G Jang J. Inorg. Biochem. 80 2000 219 (c) K.A Lee W Nam J. Am. Chem. Soc. 119 1997 1916 [38] L.R. Milgrom (Ed.), The Colors of Life, Oxford University Press, New York, 1997.",
      "scopus-id": "2542463051",
      "coredata": {
        "eid": "1-s2.0-S1381116904001360",
        "dc:description": "Kaolinite (KGa-2, standard poorly crystallized) was reacted with 3-aminopropyltriethoxysilane (3-APTS) (silanization reaction) after intercalation with urea and delamination under ultrasonic treatment. The silane groups were grafted partially on the layered kaolinite outer surface and aqueous treatment could hydrolyze the remaining ethoxy groups. The silanized kaolinite (compound 4) was used as a new inorganic support for immobilization of the anionic iron(III) porphyrin: 5,10,15,20-tetrakis(2,6-difluoro-3-sulfonatophenyl) porphyrinato iron(III) chloride [(FeTDFSPP)Cl]4− (compound 3). It was found that compound 4 was an appropriated structure to immobilize the [(FeTDFSPP)Cl]4− by electrostatic interactions. The obtained material (kaolinite-iron(III) porphyrin, compound 5) was characterized by different techniques such as UV-Vis and infrared (FTIR) spectroscopy, electron paramagnetic resonance (EPR), proton nuclear magnetic resonance ( 1 H NMR), atomic absorption spectrometry (AAS) and thermal analysis (simultaneous TG/DSC). Compound 5 was investigated in brand oxidation reactions using cyclooctene, heptane and cyclohexane. Iodosylbenzene (PhIO) was used as oxygen atom donor in different molar ratios of iron(III) porphyrin:PhIO. It was observed that compound 5 was an efficient and highly selective catalyst system for epoxidation of cyclooctene (97% of cyclooctene oxide) and hydroxylation of cyclohexane (90% cyclohexanol) after 1h. The heptane hydroxylation gave 50% of heptanols. The hydrogen peroxide was also used as oxidant but moderate results were obtained. After reuse (3–5 times) the catalyst showed a higher conversion than the primary reactions.",
        "openArchiveArticle": "false",
        "prism:coverDate": "2004-08-03",
        "openaccessUserLicense": null,
        "prism:aggregationType": "Journal",
        "prism:url": "https://api.elsevier.com/content/article/pii/S1381116904001360",
        "dc:creator": [
          {
            "@_fa": "true",
            "$": "Nakagaki, Shirley"
          },
          {
            "@_fa": "true",
            "$": "Benedito, Flávio Luiz"
          },
          {
            "@_fa": "true",
            "$": "Wypych, Fernando"
          }
        ],
        "link": [
          {
            "@_fa": "true",
            "@rel": "self",
            "@href": "https://api.elsevier.com/content/article/pii/S1381116904001360"
          },
          {
            "@_fa": "true",
            "@rel": "scidir",
            "@href": "https://www.sciencedirect.com/science/article/pii/S1381116904001360"
          }
        ],
        "dc:format": "application/json",
        "openaccessType": null,
        "pii": "S1381-1169(04)00136-0",
        "prism:volume": "217",
        "prism:publisher": "Elsevier B.V.",
        "dc:title": "Anionic iron(III) porphyrin immobilized on silanized kaolinite as catalyst for oxidation reactions",
        "prism:copyright": "Copyright © 2004 Elsevier B.V. All rights reserved.",
        "openaccess": "0",
        "prism:issn": "13811169",
        "prism:issueIdentifier": "1-2",
        "dcterms:subject": [
          {
            "@_fa": "true",
            "$": "Porphyrin"
          },
          {
            "@_fa": "true",
            "$": "Kaolinite"
          },
          {
            "@_fa": "true",
            "$": "Silanization"
          },
          {
            "@_fa": "true",
            "$": "Catalysis"
          },
          {
            "@_fa": "true",
            "$": "Oxidation"
          }
        ],
        "openaccessArticle": "false",
        "prism:publicationName": "Journal of Molecular Catalysis A: Chemical",
        "prism:number": "1-2",
        "openaccessSponsorType": null,
        "prism:pageRange": "121-131",
        "prism:endingPage": "131",
        "pubType": "fla",
        "prism:coverDisplayDate": "3 August 2004",
        "prism:doi": "10.1016/j.molcata.2004.03.004",
        "prism:startingPage": "121",
        "dc:identifier": "doi:10.1016/j.molcata.2004.03.004",
        "openaccessSponsorName": null
      },
      "objects": {
        "object": [
          {
            "@category": "thumbnail",
            "@height": "20",
            "@width": "38",
            "@_fa": "true",
            "$": "https://api.elsevier.com/content/object/eid/1-s2.0-S1381116904001360-si7.gif?httpAccept=%2A%2F%2A",
            "@multimediatype": "GIF image file",
            "@type": "ALTIMG",
            "@size": "265",
            "@ref": "si7",
            "@mimetype": "image/gif"
          },
          {
            "@category": "thumbnail",
            "@height": "14",
            "@width": "20",
            "@_fa": "true",
            "$": "https://api.elsevier.com/content/object/eid/1-s2.0-S1381116904001360-si6.gif?httpAccept=%2A%2F%2A",
            "@multimediatype": "GIF image file",
            "@type": "ALTIMG",
            "@size": "149",
            "@ref": "si6",
            "@mimetype": "image/gif"
          },
          {
            "@category": "thumbnail",
            "@height": "14",
            "@width": "20",
            "@_fa": "true",
            "$": "https://api.elsevier.com/content/object/eid/1-s2.0-S1381116904001360-si5.gif?httpAccept=%2A%2F%2A",
            "@multimediatype": "GIF image file",
            "@type": "ALTIMG",
            "@size": "149",
            "@ref": "si5",
            "@mimetype": "image/gif"
          },
          {
            "@category": "thumbnail",
            "@height": "14",
            "@width": "20",
            "@_fa": "true",
            "$": "https://api.elsevier.com/content/object/eid/1-s2.0-S1381116904001360-si4.gif?httpAccept=%2A%2F%2A",
            "@multimediatype": "GIF image file",
            "@type": "ALTIMG",
            "@size": "149",
            "@ref": "si4",
            "@mimetype": "image/gif"
          },
          {
            "@category": "thumbnail",
            "@height": "14",
            "@width": "20",
            "@_fa": "true",
            "$": "https://api.elsevier.com/content/object/eid/1-s2.0-S1381116904001360-si3.gif?httpAccept=%2A%2F%2A",
            "@multimediatype": "GIF image file",
            "@type": "ALTIMG",
            "@size": "149",
            "@ref": "si3",
            "@mimetype": "image/gif"
          },
          {
            "@category": "thumbnail",
            "@height": "12",
            "@width": "84",
            "@_fa": "true",
            "$": "https://api.elsevier.com/content/object/eid/1-s2.0-S1381116904001360-si2.gif?httpAccept=%2A%2F%2A",
            "@multimediatype": "GIF image file",
            "@type": "ALTIMG",
            "@size": "380",
            "@ref": "si2",
            "@mimetype": "image/gif"
          },
          {
            "@category": "thumbnail",
            "@height": "14",
            "@width": "20",
            "@_fa": "true",
            "$": "https://api.elsevier.com/content/object/eid/1-s2.0-S1381116904001360-si1.gif?httpAccept=%2A%2F%2A",
            "@multimediatype": "GIF image file",
            "@type": "ALTIMG",
            "@size": "149",
            "@ref": "si1",
            "@mimetype": "image/gif"
          },
          {
            "@category": "thumbnail",
            "@height": "94",
            "@width": "119",
            "@_fa": "true",
            "$": "https://api.elsevier.com/content/object/eid/1-s2.0-S1381116904001360-fx1.sml?httpAccept=%2A%2F%2A",
            "@multimediatype": "GIF image file",
            "@type": "IMAGE-THUMBNAIL",
            "@size": "1622",
            "@ref": "fx1",
            "@mimetype": "image/gif"
          },
          {
            "@category": "standard",
            "@height": "188",
            "@width": "239",
            "@_fa": "true",
            "$": "https://api.elsevier.com/content/object/eid/1-s2.0-S1381116904001360-fx1.gif?httpAccept=%2A%2F%2A",
            "@multimediatype": "GIF image file",
            "@type": "IMAGE-DOWNSAMPLED",
            "@size": "4223",
            "@ref": "fx1",
            "@mimetype": "image/gif"
          },
          {
            "@category": "thumbnail",
            "@height": "92",
            "@width": "115",
            "@_fa": "true",
            "$": "https://api.elsevier.com/content/object/eid/1-s2.0-S1381116904001360-gr1.sml?httpAccept=%2A%2F%2A",
            "@multimediatype": "GIF image file",
            "@type": "IMAGE-THUMBNAIL",
            "@size": "2266",
            "@ref": "gr1",
            "@mimetype": "image/gif"
          },
          {
            "@category": "standard",
            "@height": "160",
            "@width": "199",
            "@_fa": "true",
            "$": "https://api.elsevier.com/content/object/eid/1-s2.0-S1381116904001360-gr1.gif?httpAccept=%2A%2F%2A",
            "@multimediatype": "GIF image file",
            "@type": "IMAGE-DOWNSAMPLED",
            "@size": "4215",
            "@ref": "gr1",
            "@mimetype": "image/gif"
          },
          {
            "@category": "thumbnail",
            "@height": "44",
            "@width": "125",
            "@_fa": "true",
            "$": "https://api.elsevier.com/content/object/eid/1-s2.0-S1381116904001360-gr2.sml?httpAccept=%2A%2F%2A",
            "@multimediatype": "GIF image file",
            "@type": "IMAGE-THUMBNAIL",
            "@size": "1711",
            "@ref": "gr2",
            "@mimetype": "image/gif"
          },
          {
            "@category": "standard",
            "@height": "145",
            "@width": "408",
            "@_fa": "true",
            "$": "https://api.elsevier.com/content/object/eid/1-s2.0-S1381116904001360-gr2.gif?httpAccept=%2A%2F%2A",
            "@multimediatype": "GIF image file",
            "@type": "IMAGE-DOWNSAMPLED",
            "@size": "7040",
            "@ref": "gr2",
            "@mimetype": "image/gif"
          },
          {
            "@category": "thumbnail",
            "@height": "94",
            "@width": "77",
            "@_fa": "true",
            "$": "https://api.elsevier.com/content/object/eid/1-s2.0-S1381116904001360-gr3.sml?httpAccept=%2A%2F%2A",
            "@multimediatype": "GIF image file",
            "@type": "IMAGE-THUMBNAIL",
            "@size": "1843",
            "@ref": "gr3",
            "@mimetype": "image/gif"
          },
          {
            "@category": "standard",
            "@height": "206",
            "@width": "168",
            "@_fa": "true",
            "$": "https://api.elsevier.com/content/object/eid/1-s2.0-S1381116904001360-gr3.gif?httpAccept=%2A%2F%2A",
            "@multimediatype": "GIF image file",
            "@type": "IMAGE-DOWNSAMPLED",
            "@size": "4030",
            "@ref": "gr3",
            "@mimetype": "image/gif"
          },
          {
            "@category": "thumbnail",
            "@height": "94",
            "@width": "84",
            "@_fa": "true",
            "$": "https://api.elsevier.com/content/object/eid/1-s2.0-S1381116904001360-gr4.sml?httpAccept=%2A%2F%2A",
            "@multimediatype": "GIF image file",
            "@type": "IMAGE-THUMBNAIL",
            "@size": "2031",
            "@ref": "gr4",
            "@mimetype": "image/gif"
          },
          {
            "@category": "standard",
            "@height": "216",
            "@width": "194",
            "@_fa": "true",
            "$": "https://api.elsevier.com/content/object/eid/1-s2.0-S1381116904001360-gr4.gif?httpAccept=%2A%2F%2A",
            "@multimediatype": "GIF image file",
            "@type": "IMAGE-DOWNSAMPLED",
            "@size": "4938",
            "@ref": "gr4",
            "@mimetype": "image/gif"
          },
          {
            "@category": "thumbnail",
            "@height": "93",
            "@width": "73",
            "@_fa": "true",
            "$": "https://api.elsevier.com/content/object/eid/1-s2.0-S1381116904001360-gr5.sml?httpAccept=%2A%2F%2A",
            "@multimediatype": "GIF image file",
            "@type": "IMAGE-THUMBNAIL",
            "@size": "2232",
            "@ref": "gr5",
            "@mimetype": "image/gif"
          },
          {
            "@category": "standard",
            "@height": "234",
            "@width": "183",
            "@_fa": "true",
            "$": "https://api.elsevier.com/content/object/eid/1-s2.0-S1381116904001360-gr5.gif?httpAccept=%2A%2F%2A",
            "@multimediatype": "GIF image file",
            "@type": "IMAGE-DOWNSAMPLED",
            "@size": "6747",
            "@ref": "gr5",
            "@mimetype": "image/gif"
          },
          {
            "@category": "thumbnail",
            "@height": "70",
            "@width": "125",
            "@_fa": "true",
            "$": "https://api.elsevier.com/content/object/eid/1-s2.0-S1381116904001360-gr6.sml?httpAccept=%2A%2F%2A",
            "@multimediatype": "GIF image file",
            "@type": "IMAGE-THUMBNAIL",
            "@size": "2245",
            "@ref": "gr6",
            "@mimetype": "image/gif"
          },
          {
            "@category": "standard",
            "@height": "196",
            "@width": "348",
            "@_fa": "true",
            "$": "https://api.elsevier.com/content/object/eid/1-s2.0-S1381116904001360-gr6.gif?httpAccept=%2A%2F%2A",
            "@multimediatype": "GIF image file",
            "@type": "IMAGE-DOWNSAMPLED",
            "@size": "7404",
            "@ref": "gr6",
            "@mimetype": "image/gif"
          },
          {
            "@category": "thumbnail",
            "@height": "94",
            "@width": "70",
            "@_fa": "true",
            "$": "https://api.elsevier.com/content/object/eid/1-s2.0-S1381116904001360-gr7.sml?httpAccept=%2A%2F%2A",
            "@multimediatype": "GIF image file",
            "@type": "IMAGE-THUMBNAIL",
            "@size": "2105",
            "@ref": "gr7",
            "@mimetype": "image/gif"
          },
          {
            "@category": "standard",
            "@height": "216",
            "@width": "161",
            "@_fa": "true",
            "$": "https://api.elsevier.com/content/object/eid/1-s2.0-S1381116904001360-gr7.gif?httpAccept=%2A%2F%2A",
            "@multimediatype": "GIF image file",
            "@type": "IMAGE-DOWNSAMPLED",
            "@size": "5094",
            "@ref": "gr7",
            "@mimetype": "image/gif"
          },
          {
            "@category": "thumbnail",
            "@height": "93",
            "@width": "88",
            "@_fa": "true",
            "$": "https://api.elsevier.com/content/object/eid/1-s2.0-S1381116904001360-gr8.sml?httpAccept=%2A%2F%2A",
            "@multimediatype": "GIF image file",
            "@type": "IMAGE-THUMBNAIL",
            "@size": "2197",
            "@ref": "gr8",
            "@mimetype": "image/gif"
          },
          {
            "@category": "standard",
            "@height": "380",
            "@width": "361",
            "@_fa": "true",
            "$": "https://api.elsevier.com/content/object/eid/1-s2.0-S1381116904001360-gr8.jpg?httpAccept=%2A%2F%2A",
            "@multimediatype": "JPEG image file",
            "@type": "IMAGE-DOWNSAMPLED",
            "@size": "39983",
            "@ref": "gr8",
            "@mimetype": "image/jpeg"
          },
          {
            "@category": "thumbnail",
            "@height": "93",
            "@width": "104",
            "@_fa": "true",
            "$": "https://api.elsevier.com/content/object/eid/1-s2.0-S1381116904001360-gr9.sml?httpAccept=%2A%2F%2A",
            "@multimediatype": "GIF image file",
            "@type": "IMAGE-THUMBNAIL",
            "@size": "2277",
            "@ref": "gr9",
            "@mimetype": "image/gif"
          },
          {
            "@category": "standard",
            "@height": "337",
            "@width": "376",
            "@_fa": "true",
            "$": "https://api.elsevier.com/content/object/eid/1-s2.0-S1381116904001360-gr9.jpg?httpAccept=%2A%2F%2A",
            "@multimediatype": "JPEG image file",
            "@type": "IMAGE-DOWNSAMPLED",
            "@size": "36558",
            "@ref": "gr9",
            "@mimetype": "image/jpeg"
          }
        ]
      },
      "link": {
        "@rel": "abstract",
        "@href": "https://api.elsevier.com/content/abstract/scopus_id/2542463051"
      }
    }
  }
}