{
  "metadata": {
    "title": "Influence of the nature of the support on the catalytic properties of Pt-based catalysts for hydrogenolysis of glycerol",
    "authors": "; ; ",
    "journal": "Journal of Molecular Catalysis A: Chemical",
    "date": "2013-02-28",
    "doi": "10.1016/j.molcata.2012.11.001",
    "abstract": "",
    "uri": "https://api.elsevier.com/content/article/pii/S1381116912003603",
    "pii": "S1381116912003603"
  },
  "fulltext": {
    "full-text-retrieval-response": {
      "scopus-eid": "2-s2.0-84871719329",
      "originalText": "serial JL 271358 291210 291744 291790 291809 31 Journal of Molecular Catalysis A: Chemical JOURNALMOLECULARCATALYSISACHEMICAL 2012-11-09 2012-11-09 2012-12-22T03:16:12 1-s2.0-S1381116912003603 S1381-1169(12)00360-3 S1381116912003603 10.1016/j.molcata.2012.11.001 S300 S300.1 FULL-TEXT 1-s2.0-S1381116912X00116 2015-05-15T05:56:33.607047-04:00 0 0 20130201 20130228 2013 2012-11-09T00:00:00Z articleinfo crossmark dco dateupdated tomb dateloaded datesearch indexeddate volumelist yearnav absattachment articletitlenorm authfirstinitialnorm authfirstsurnamenorm cid cids contenttype copyright dateloadedtxt docsubtype doctype doi eid ewtransactionid hubeid issn issnnorm itemstage itemtransactionid itemweight openaccess openarchive pg pgfirst pglast pii piinorm pubdateend pubdatestart pubdatetxt pubyr sortorder srctitle srctitlenorm srctype subheadings suppl volfirst volissue webpdf webpdfpagecount figure table body mmlmath acknowledge affil articletitle auth authfirstini authfull authkeywords authlast primabst ref specialabst alllist content subj ssids 1381-1169 13811169 false 367 367 C Volume 367 14 89 98 89 98 201302 February 2013 2013-02-01 2013-02-28 2013 article fla Copyright © 2012 Elsevier B.V. All rights reserved. INFLUENCENATURESUPPORTCATALYTICPROPERTIESPTBASEDCATALYSTSFORHYDROGENOLYSISGLYCEROL DELGADO S 1 Introduction 2 Experimental 2.1 Catalyst preparation 2.2 X-ray diffraction 2.3 N2 sorption 2.4 H2 chemisorption 2.5 Temperature programmed reduction experiments (TPR) 2.6 FTIR of adsorbed pyridine 2.7 Isomerization of 3,3-dimethyl-1-butene 2.8 Dehydrogenation of cyclohexane 2.9 Aqueous-phase transformation of glycerol 3 Results and discussion 3.1 XRD analysis 3.2 Specific surface and metal accessibility measurements 3.3 Temperature programmed reduction experiments 3.4 FTIR of adsorbed pyridine 3.5 Isomerization of 3,3-dimethyl-1-butene (33DMB1) 3.6 Dehydrogenation of cyclohexane 3.7 Aqueous phase transformation of glycerol 4 Conclusion Acknowledgement References DAVDA 2003 4068 R DAVDA 2003 13 R HUBER 2003 2075 G SHABAKER 2003 344 J SHABAKER 2003 1 J HUBER 2004 1549 G SHABAKER 2004 3105 J SHABAKER 2004 180 J SHABAKER 2005 67 J PAGLIARO 2007 4434 M CORMA 2007 2411 A BEHR 2008 13 A ZHOU 2007 527 C TAARNING 2009 625 E GANDARIAS 2010 248 I DASARI 2005 225 M YUAN 2010 7088 Z BIENHOLZ 2011 153 A MIYAZAWA 2006 213 T BALARAJU 2009 82 M BALARAJU 2010 107 M FURIKADO 2007 582 I WAWRZETZ 2010 411 A MARIS 2007 281 E ROY 2010 31 D GANDARIAS 2011 237 I MA 2008 2489 L DANIEL 2010 1107 O AMADA 2010 728 Y MA 2010 148 L NAKAGAWA 2010 191 Y AMADA 2011 117 Y HUGUES 1959 c33 T 135THNATMEETINGCHEMSOCDIVPETROLCHEMPREP4 EPRON 2005 157 F GUISNET 1997 1661 M KEMBALL 1972 416 C JOHN 1979 264 C PINES 1982 1 H MARTIN 1997 113 D CUSUMANO 1966 471 J RAVENELLE 2012 162 R LUO 2008 3483 N CHEN 2007 700 S CIFTCI 2012 113 A MARIS 2007 328 E VILCOCQ 2011 18 L RAVENELLE 2011 552 R CHAKRABORTY 1999 253 B MARQUES 2003 251 J KULKARNI 2006 274 A BLAKELY 1976 181 D RAMOS 1992 458 R MCVICKER 1985 355 G GONG 2010 119 L DAUTZENBERG 1980 119 F CORTRIGHT 1994 771 R DELGADOX2013X89 DELGADOX2013X89X98 DELGADOX2013X89XS DELGADOX2013X89X98XS item S1381-1169(12)00360-3 S1381116912003603 1-s2.0-S1381116912003603 10.1016/j.molcata.2012.11.001 271358 2012-12-22T00:50:35.272223-05:00 2013-02-01 2013-02-28 1-s2.0-S1381116912003603-main.pdf https://s3.amazonaws.com/prod-ucs-content-store-us-east/content/pii:S1381116912003603/MAIN/application/pdf/9983a21554a9c1802fe63261ee1cb4dd/main.pdf https://s3-eu-west-1.amazonaws.com/prod-ucs-content-store-eu-west/content/pii:S1381116912003603/MAIN/application/pdf/9983a21554a9c1802fe63261ee1cb4dd/main.pdf main.pdf pdf true 1208231 MAIN 10 1-s2.0-S1381116912003603-main_1.png https://s3-eu-west-1.amazonaws.com/prod-ucs-content-store-eu-west/content/pii:S1381116912003603/PREVIEW/image/png/8268018dc6f29f92736ebcc1e8575b69/main_1.png https://s3.amazonaws.com/prod-ucs-content-store-us-east/content/pii:S1381116912003603/PREVIEW/image/png/8268018dc6f29f92736ebcc1e8575b69/main_1.png main_1.png png 62697 849 656 IMAGE-WEB-PDF 1 1-s2.0-S1381116912003603-si3.gif https://s3.amazonaws.com/prod-ucs-content-store-us-east/content/pii:S1381116912003603/STRIPIN/image/gif/909a75ca0332510037bf574ad9507e71/si3.gif https://s3-eu-west-1.amazonaws.com/prod-ucs-content-store-eu-west/content/pii:S1381116912003603/STRIPIN/image/gif/909a75ca0332510037bf574ad9507e71/si3.gif si3 si3.gif gif 2016 38 357 ALTIMG 1-s2.0-S1381116912003603-si2.gif https://s3.amazonaws.com/prod-ucs-content-store-us-east/content/pii:S1381116912003603/STRIPIN/image/gif/5c660166bd5053db7bb29d436930c2ba/si2.gif https://s3-eu-west-1.amazonaws.com/prod-ucs-content-store-eu-west/content/pii:S1381116912003603/STRIPIN/image/gif/5c660166bd5053db7bb29d436930c2ba/si2.gif si2 si2.gif gif 2285 38 392 ALTIMG 1-s2.0-S1381116912003603-si1.gif https://s3.amazonaws.com/prod-ucs-content-store-us-east/content/pii:S1381116912003603/STRIPIN/image/gif/fdefd81fceef84f6b12326449c6bb90d/si1.gif https://s3-eu-west-1.amazonaws.com/prod-ucs-content-store-eu-west/content/pii:S1381116912003603/STRIPIN/image/gif/fdefd81fceef84f6b12326449c6bb90d/si1.gif si1 si1.gif gif 628 41 103 ALTIMG 1-s2.0-S1381116912003603-fx1_lrg.jpg https://s3.amazonaws.com/prod-ucs-content-store-us-east/content/pii:S1381116912003603/fx1/HIGHRES/image/jpeg/8fb03365a36083375b1b849fab14e411/fx1_lrg.jpg https://s3-eu-west-1.amazonaws.com/prod-ucs-content-store-eu-west/content/pii:S1381116912003603/fx1/HIGHRES/image/jpeg/8fb03365a36083375b1b849fab14e411/fx1_lrg.jpg fx1 true fx1_lrg.jpg jpg 163223 886 2124 IMAGE-HIGH-RES 1-s2.0-S1381116912003603-gr9_lrg.jpg https://s3.amazonaws.com/prod-ucs-content-store-us-east/content/pii:S1381116912003603/gr9/HIGHRES/image/jpeg/641bb2f174f46c50f4d34be03bcf65be/gr9_lrg.jpg https://s3-eu-west-1.amazonaws.com/prod-ucs-content-store-eu-west/content/pii:S1381116912003603/gr9/HIGHRES/image/jpeg/641bb2f174f46c50f4d34be03bcf65be/gr9_lrg.jpg gr9 gr9_lrg.jpg jpg 274061 1169 1749 IMAGE-HIGH-RES 1-s2.0-S1381116912003603-gr8_lrg.jpg https://s3.amazonaws.com/prod-ucs-content-store-us-east/content/pii:S1381116912003603/gr8/HIGHRES/image/jpeg/31a32a83f6b573973c83eeac0b309fa3/gr8_lrg.jpg https://s3-eu-west-1.amazonaws.com/prod-ucs-content-store-eu-west/content/pii:S1381116912003603/gr8/HIGHRES/image/jpeg/31a32a83f6b573973c83eeac0b309fa3/gr8_lrg.jpg gr8 gr8_lrg.jpg jpg 242191 1303 2092 IMAGE-HIGH-RES 1-s2.0-S1381116912003603-gr5_lrg.jpg https://s3.amazonaws.com/prod-ucs-content-store-us-east/content/pii:S1381116912003603/gr5/HIGHRES/image/jpeg/aaf78cd3ced790ca4c9f059aef7b8829/gr5_lrg.jpg https://s3-eu-west-1.amazonaws.com/prod-ucs-content-store-eu-west/content/pii:S1381116912003603/gr5/HIGHRES/image/jpeg/aaf78cd3ced790ca4c9f059aef7b8829/gr5_lrg.jpg gr5 gr5_lrg.jpg jpg 204472 1156 2258 IMAGE-HIGH-RES 1-s2.0-S1381116912003603-gr3_lrg.jpg https://s3.amazonaws.com/prod-ucs-content-store-us-east/content/pii:S1381116912003603/gr3/HIGHRES/image/jpeg/e6b28dc9ca11b271add736bc27d5628c/gr3_lrg.jpg https://s3-eu-west-1.amazonaws.com/prod-ucs-content-store-eu-west/content/pii:S1381116912003603/gr3/HIGHRES/image/jpeg/e6b28dc9ca11b271add736bc27d5628c/gr3_lrg.jpg gr3 gr3_lrg.jpg jpg 155531 1162 1742 IMAGE-HIGH-RES 1-s2.0-S1381116912003603-gr7_lrg.jpg https://s3.amazonaws.com/prod-ucs-content-store-us-east/content/pii:S1381116912003603/gr7/HIGHRES/image/jpeg/f1a107dcc3ab674b8fd1158c3764ebbf/gr7_lrg.jpg https://s3-eu-west-1.amazonaws.com/prod-ucs-content-store-eu-west/content/pii:S1381116912003603/gr7/HIGHRES/image/jpeg/f1a107dcc3ab674b8fd1158c3764ebbf/gr7_lrg.jpg gr7 gr7_lrg.jpg jpg 172760 937 2206 IMAGE-HIGH-RES 1-s2.0-S1381116912003603-gr6_lrg.jpg https://s3.amazonaws.com/prod-ucs-content-store-us-east/content/pii:S1381116912003603/gr6/HIGHRES/image/jpeg/0477cfa61a54dc06681a07774a230e17/gr6_lrg.jpg https://s3-eu-west-1.amazonaws.com/prod-ucs-content-store-eu-west/content/pii:S1381116912003603/gr6/HIGHRES/image/jpeg/0477cfa61a54dc06681a07774a230e17/gr6_lrg.jpg gr6 gr6_lrg.jpg jpg 72463 938 1663 IMAGE-HIGH-RES 1-s2.0-S1381116912003603-gr4_lrg.jpg https://s3.amazonaws.com/prod-ucs-content-store-us-east/content/pii:S1381116912003603/gr4/HIGHRES/image/jpeg/5aa856d00cc048e0756d591ece5947d1/gr4_lrg.jpg https://s3-eu-west-1.amazonaws.com/prod-ucs-content-store-eu-west/content/pii:S1381116912003603/gr4/HIGHRES/image/jpeg/5aa856d00cc048e0756d591ece5947d1/gr4_lrg.jpg gr4 gr4_lrg.jpg jpg 172147 1167 1742 IMAGE-HIGH-RES 1-s2.0-S1381116912003603-gr2_lrg.jpg https://s3.amazonaws.com/prod-ucs-content-store-us-east/content/pii:S1381116912003603/gr2/HIGHRES/image/jpeg/72c5f74456e8f8f56c344171bf902d26/gr2_lrg.jpg https://s3-eu-west-1.amazonaws.com/prod-ucs-content-store-eu-west/content/pii:S1381116912003603/gr2/HIGHRES/image/jpeg/72c5f74456e8f8f56c344171bf902d26/gr2_lrg.jpg gr2 gr2_lrg.jpg jpg 281956 1406 2110 IMAGE-HIGH-RES 1-s2.0-S1381116912003603-gr1_lrg.jpg https://s3.amazonaws.com/prod-ucs-content-store-us-east/content/pii:S1381116912003603/gr1/HIGHRES/image/jpeg/c9c2274cb02b159c4ca1cfa4633194f5/gr1_lrg.jpg https://s3-eu-west-1.amazonaws.com/prod-ucs-content-store-eu-west/content/pii:S1381116912003603/gr1/HIGHRES/image/jpeg/c9c2274cb02b159c4ca1cfa4633194f5/gr1_lrg.jpg gr1 gr1_lrg.jpg jpg 288350 1774 2859 IMAGE-HIGH-RES 1-s2.0-S1381116912003603-fx1.jpg https://s3.amazonaws.com/prod-ucs-content-store-us-east/content/pii:S1381116912003603/fx1/DOWNSAMPLED/image/jpeg/02bf15228ef90225c40a6d2ea0bfd03c/fx1.jpg https://s3-eu-west-1.amazonaws.com/prod-ucs-content-store-eu-west/content/pii:S1381116912003603/fx1/DOWNSAMPLED/image/jpeg/02bf15228ef90225c40a6d2ea0bfd03c/fx1.jpg fx1 true fx1.jpg jpg 19765 200 480 IMAGE-DOWNSAMPLED 1-s2.0-S1381116912003603-gr9.jpg https://s3.amazonaws.com/prod-ucs-content-store-us-east/content/pii:S1381116912003603/gr9/DOWNSAMPLED/image/jpeg/cd8609718f2c828f8c3bd33d296847b6/gr9.jpg https://s3-eu-west-1.amazonaws.com/prod-ucs-content-store-eu-west/content/pii:S1381116912003603/gr9/DOWNSAMPLED/image/jpeg/cd8609718f2c828f8c3bd33d296847b6/gr9.jpg gr9 gr9.jpg jpg 37456 264 395 IMAGE-DOWNSAMPLED 1-s2.0-S1381116912003603-gr8.jpg https://s3.amazonaws.com/prod-ucs-content-store-us-east/content/pii:S1381116912003603/gr8/DOWNSAMPLED/image/jpeg/4e96cd51426f08a87a9ee85223925614/gr8.jpg https://s3-eu-west-1.amazonaws.com/prod-ucs-content-store-eu-west/content/pii:S1381116912003603/gr8/DOWNSAMPLED/image/jpeg/4e96cd51426f08a87a9ee85223925614/gr8.jpg gr8 gr8.jpg jpg 38568 294 472 IMAGE-DOWNSAMPLED 1-s2.0-S1381116912003603-gr5.jpg https://s3.amazonaws.com/prod-ucs-content-store-us-east/content/pii:S1381116912003603/gr5/DOWNSAMPLED/image/jpeg/47a24df1e4fdfae530877e88038312ce/gr5.jpg https://s3-eu-west-1.amazonaws.com/prod-ucs-content-store-eu-west/content/pii:S1381116912003603/gr5/DOWNSAMPLED/image/jpeg/47a24df1e4fdfae530877e88038312ce/gr5.jpg gr5 gr5.jpg jpg 31121 261 510 IMAGE-DOWNSAMPLED 1-s2.0-S1381116912003603-gr3.jpg https://s3.amazonaws.com/prod-ucs-content-store-us-east/content/pii:S1381116912003603/gr3/DOWNSAMPLED/image/jpeg/9e66cb13fedd0a0c3d95cc77359115dc/gr3.jpg https://s3-eu-west-1.amazonaws.com/prod-ucs-content-store-eu-west/content/pii:S1381116912003603/gr3/DOWNSAMPLED/image/jpeg/9e66cb13fedd0a0c3d95cc77359115dc/gr3.jpg gr3 gr3.jpg jpg 29167 262 393 IMAGE-DOWNSAMPLED 1-s2.0-S1381116912003603-gr7.jpg https://s3.amazonaws.com/prod-ucs-content-store-us-east/content/pii:S1381116912003603/gr7/DOWNSAMPLED/image/jpeg/71ddaefac8d3dc4545847319430d44b4/gr7.jpg https://s3-eu-west-1.amazonaws.com/prod-ucs-content-store-eu-west/content/pii:S1381116912003603/gr7/DOWNSAMPLED/image/jpeg/71ddaefac8d3dc4545847319430d44b4/gr7.jpg gr7 gr7.jpg jpg 20730 212 498 IMAGE-DOWNSAMPLED 1-s2.0-S1381116912003603-gr6.jpg https://s3.amazonaws.com/prod-ucs-content-store-us-east/content/pii:S1381116912003603/gr6/DOWNSAMPLED/image/jpeg/4fe1e7d9b981e02b1b8dbe391c8d0740/gr6.jpg https://s3-eu-west-1.amazonaws.com/prod-ucs-content-store-eu-west/content/pii:S1381116912003603/gr6/DOWNSAMPLED/image/jpeg/4fe1e7d9b981e02b1b8dbe391c8d0740/gr6.jpg gr6 gr6.jpg jpg 10569 212 375 IMAGE-DOWNSAMPLED 1-s2.0-S1381116912003603-gr4.jpg https://s3.amazonaws.com/prod-ucs-content-store-us-east/content/pii:S1381116912003603/gr4/DOWNSAMPLED/image/jpeg/13ed5299232b9e4cd3e417f6be423c43/gr4.jpg https://s3-eu-west-1.amazonaws.com/prod-ucs-content-store-eu-west/content/pii:S1381116912003603/gr4/DOWNSAMPLED/image/jpeg/13ed5299232b9e4cd3e417f6be423c43/gr4.jpg gr4 gr4.jpg jpg 19956 263 393 IMAGE-DOWNSAMPLED 1-s2.0-S1381116912003603-gr2.jpg https://s3.amazonaws.com/prod-ucs-content-store-us-east/content/pii:S1381116912003603/gr2/DOWNSAMPLED/image/jpeg/cec0f7e24aa91e3fb8798c7da3f6945d/gr2.jpg https://s3-eu-west-1.amazonaws.com/prod-ucs-content-store-eu-west/content/pii:S1381116912003603/gr2/DOWNSAMPLED/image/jpeg/cec0f7e24aa91e3fb8798c7da3f6945d/gr2.jpg gr2 gr2.jpg jpg 35166 317 476 IMAGE-DOWNSAMPLED 1-s2.0-S1381116912003603-gr1.jpg https://s3.amazonaws.com/prod-ucs-content-store-us-east/content/pii:S1381116912003603/gr1/DOWNSAMPLED/image/jpeg/991c8c82a209f2c1b9135869de313397/gr1.jpg https://s3-eu-west-1.amazonaws.com/prod-ucs-content-store-eu-west/content/pii:S1381116912003603/gr1/DOWNSAMPLED/image/jpeg/991c8c82a209f2c1b9135869de313397/gr1.jpg gr1 gr1.jpg jpg 33581 401 646 IMAGE-DOWNSAMPLED 1-s2.0-S1381116912003603-fx1.sml https://s3.amazonaws.com/prod-ucs-content-store-us-east/content/pii:S1381116912003603/fx1/THUMBNAIL/image/gif/0a5b46e5ca60790073ef14a214c1a936/fx1.sml https://s3-eu-west-1.amazonaws.com/prod-ucs-content-store-eu-west/content/pii:S1381116912003603/fx1/THUMBNAIL/image/gif/0a5b46e5ca60790073ef14a214c1a936/fx1.sml fx1 true fx1.sml sml 4176 91 219 IMAGE-THUMBNAIL 1-s2.0-S1381116912003603-gr9.sml https://s3.amazonaws.com/prod-ucs-content-store-us-east/content/pii:S1381116912003603/gr9/THUMBNAIL/image/gif/fdc89e50f16a761562c921bc4a66cad9/gr9.sml https://s3-eu-west-1.amazonaws.com/prod-ucs-content-store-eu-west/content/pii:S1381116912003603/gr9/THUMBNAIL/image/gif/fdc89e50f16a761562c921bc4a66cad9/gr9.sml gr9 gr9.sml sml 6287 146 219 IMAGE-THUMBNAIL 1-s2.0-S1381116912003603-gr8.sml https://s3.amazonaws.com/prod-ucs-content-store-us-east/content/pii:S1381116912003603/gr8/THUMBNAIL/image/gif/f7ff7d61153e888c2524667889666762/gr8.sml https://s3-eu-west-1.amazonaws.com/prod-ucs-content-store-eu-west/content/pii:S1381116912003603/gr8/THUMBNAIL/image/gif/f7ff7d61153e888c2524667889666762/gr8.sml gr8 gr8.sml sml 5393 136 219 IMAGE-THUMBNAIL 1-s2.0-S1381116912003603-gr5.sml https://s3.amazonaws.com/prod-ucs-content-store-us-east/content/pii:S1381116912003603/gr5/THUMBNAIL/image/gif/ed93f254e195e83bb03cbb524207db6e/gr5.sml https://s3-eu-west-1.amazonaws.com/prod-ucs-content-store-eu-west/content/pii:S1381116912003603/gr5/THUMBNAIL/image/gif/ed93f254e195e83bb03cbb524207db6e/gr5.sml gr5 gr5.sml sml 3614 112 219 IMAGE-THUMBNAIL 1-s2.0-S1381116912003603-gr3.sml https://s3.amazonaws.com/prod-ucs-content-store-us-east/content/pii:S1381116912003603/gr3/THUMBNAIL/image/gif/31dfc52281609b05e8b714e743a7ae02/gr3.sml https://s3-eu-west-1.amazonaws.com/prod-ucs-content-store-eu-west/content/pii:S1381116912003603/gr3/THUMBNAIL/image/gif/31dfc52281609b05e8b714e743a7ae02/gr3.sml gr3 gr3.sml sml 3327 146 219 IMAGE-THUMBNAIL 1-s2.0-S1381116912003603-gr7.sml https://s3.amazonaws.com/prod-ucs-content-store-us-east/content/pii:S1381116912003603/gr7/THUMBNAIL/image/gif/d84914fb8dcba9e2f01db831812a43a1/gr7.sml https://s3-eu-west-1.amazonaws.com/prod-ucs-content-store-eu-west/content/pii:S1381116912003603/gr7/THUMBNAIL/image/gif/d84914fb8dcba9e2f01db831812a43a1/gr7.sml gr7 gr7.sml sml 3667 93 219 IMAGE-THUMBNAIL 1-s2.0-S1381116912003603-gr6.sml https://s3.amazonaws.com/prod-ucs-content-store-us-east/content/pii:S1381116912003603/gr6/THUMBNAIL/image/gif/5d8639783c9afa358696fe9a0fef15ae/gr6.sml https://s3-eu-west-1.amazonaws.com/prod-ucs-content-store-eu-west/content/pii:S1381116912003603/gr6/THUMBNAIL/image/gif/5d8639783c9afa358696fe9a0fef15ae/gr6.sml gr6 gr6.sml sml 5682 124 219 IMAGE-THUMBNAIL 1-s2.0-S1381116912003603-gr4.sml https://s3.amazonaws.com/prod-ucs-content-store-us-east/content/pii:S1381116912003603/gr4/THUMBNAIL/image/gif/467270e96d2531a896599c147779b1ea/gr4.sml https://s3-eu-west-1.amazonaws.com/prod-ucs-content-store-eu-west/content/pii:S1381116912003603/gr4/THUMBNAIL/image/gif/467270e96d2531a896599c147779b1ea/gr4.sml gr4 gr4.sml sml 5015 147 219 IMAGE-THUMBNAIL 1-s2.0-S1381116912003603-gr2.sml https://s3.amazonaws.com/prod-ucs-content-store-us-east/content/pii:S1381116912003603/gr2/THUMBNAIL/image/gif/c0e078dc1f62fd255c16b9392d658977/gr2.sml https://s3-eu-west-1.amazonaws.com/prod-ucs-content-store-eu-west/content/pii:S1381116912003603/gr2/THUMBNAIL/image/gif/c0e078dc1f62fd255c16b9392d658977/gr2.sml gr2 gr2.sml sml 6550 146 219 IMAGE-THUMBNAIL 1-s2.0-S1381116912003603-gr1.sml https://s3.amazonaws.com/prod-ucs-content-store-us-east/content/pii:S1381116912003603/gr1/THUMBNAIL/image/gif/54d9dc9840f99f05cf336770cff0c6a2/gr1.sml https://s3-eu-west-1.amazonaws.com/prod-ucs-content-store-eu-west/content/pii:S1381116912003603/gr1/THUMBNAIL/image/gif/54d9dc9840f99f05cf336770cff0c6a2/gr1.sml gr1 gr1.sml sml 3386 136 219 IMAGE-THUMBNAIL MOLCAA 8580 S1381-1169(12)00360-3 10.1016/j.molcata.2012.11.001 Elsevier B.V. Fig. 1 Reaction scheme for aqueous phase transformation of glycerol. Fig. 2 X-ray diffraction patterns of (A) fresh and (B) used supports (used samples obtained after glycerol transformation under N2 atmosphere): (a and e) TiO2; (b and f) γ-Al2O3; (c and g) Al2O3–SiO2 S20; (d and h) Al2O3–SiO2 S40. Peak assignment: (□) TiO2 rutile, (○) TiO2 anatase, (*) γ-Al2O3, (♢) AlO(OH). Fig. 3 TPR profiles of Pt-based catalysts as a function of the support nature (protocol: 1h O2 450°C – 15min Ar T amb – 1% H2/Ar 500°C 5°Cmin−1 – 1h at 500°C). Fig. 4 IR spectra of adsorbed pyridine at 150°C on the supported Pt catalysts. Fig. 5 Lewis acid sites distribution determined by FTIR of pyridine on the Pt-based catalysts. Fig. 6 Classification of the Brønsted acidity of the supported Pt catalysts, based on the extrapolation of their activity A for 33DMBl isomerization at 300°C (A per μmolm−2 h−1). Fig. 7 Glycerol conversion in function of reaction time on Pt-based catalysts under (a) N2 and (b) H2 atmosphere (*: Pt/TiO2; ■: Pt/Al2O3; ▴: Pt/S20; ♦: Pt/S40). Fig. 8 Catalytic performances of the supported Pt-based catalysts obtained at 360min reaction time during glycerol transformation under N2 and H2 atmosphere. Fig. 9 Distribution (mol%) in hydrocarbon at 360min of reaction time obtained on Pt-based catalysts during glycerol transformation under N2 or H2 atmosphere. Table 1 Properties of Pt-based catalysts before (fresh) and after (used) aqueous phase transformation of glycerol. Catalysts S sp a (m2 g−1) V P a (cm3 g−1) Dispersion b (%) H2 consumption c (μmolg−1 catal) H2/Pt c Fresh Used d Fresh Used d Fresh Used d Fresh N2 H2 N2 H2 N2 H2 Pt/TiO2 52 50 44 0.32 0.25 0.23 35 12 38 86 0.6 Pt/Al2O3 140 78 72 0.42 0.24 0.23 69 21 32 287 1.9 Pt/S20 e 314 338 336 0.46 0.56 0.56 68 21 21 206 1.3 Pt/S40 e 373 335 326 0.69 0.76 0.76 61 19 45 190 1.2 a Specific surface (S sp) and pore volume (V p) determined by BET measurement. b Determined by H2 chemisorption. c Determined by TPR experiment. d N2 or H2: atmosphere used during glycerol transformation in batch reactor. e Al2O3–SiO2 support (S20: SIRAL 20 and S40: SIRAL 40). Table 2 Activity of the catalysts in 33DMBl isomerization. Catalysts Reaction temperature T (°C) Activity at T °C (μmolm−2 h−1) Pt/TiO2 300 589 Pt/Al2O3 300 333 Pt/S20 150 106 Pt/S40 150 271 Table 3 Activity of Pt-based catalysts obtained for cyclohexane dehydrogenation at 270°C. Catalysts As (molh−1 g−1 metal) TOF (s−1) Number of accessible atomsg−1 metal determined by H2 chemisorption Pt/TiO2 4.5 0.70 1.07×1021 Pt/Al2O3 3.9 0.31 2.12×1021 Pt/S20 3.1 0.25 2.09×1021 Pt/S40 3.4 0.38 1.88×1021 Table 4 Selectivity to products at isoconversion (10%) and yield to H2 at 360min reaction time obtained during glycerol transformation with Pt-based catalysts. Catalysts Atmosphere a Selectivity (%) H2 yield (%mol) Acetol GLA 1,2-PD 1,3-PD 1P+2P EG EtOH MeOH CO2 HC b Others c Pt/TiO2 N2 32.3 0.3 25.0 – – 31.1 3.9 – 0.4 1.0 6.0 8.8 d – 49.4 d – 2.4 d 11.9 d 9.9 d – 5.4 d 8.7 d 3.5 d 16.9 Pt/Al2O3 N2 13.8 13.7 21.0 – – 32.3 5.6 – 7.8 5.8 – 31.4 Pt/S20 N2 10.0 2.2 20.0 – 0.6 8.0 3.8 43.5 2.8 6.3 2.8 16.2 Pt/S40 N2 21.1 4.1 22.9 – 2.1 21.9 14.4 4.4 1.5 3.1 4.5 19.5 Pt/TiO2 H2 9.0 0.9 68.0 – 1.0 14.5 1.5 – 0.5 1.6 3.0 1.7 e 3.9 e 61.8 e – 6.2 e 14.7 e 6.5 e – 1.5 e 3.0 e 0.7 e – Pt/Al2O3 H2 2.4 2.6 33.8 12.1 2.6 36.0 4.3 – 3.1 2.0 1.1 – Pt/S20 H2 1.6 2.3 21.5 5.5 4.0 23.3 5.5 29.4 1.6 1.4 3.9 – Pt/S40 H2 2.2 4.1 30.2 5.5 5.9 25.4 8.4 8.5 2.2 3.7 3.9 – a N2 or H2 gaseous atmosphere introduced in the autoclave. b HC: gaseous saturated hydrocarbons. c Others: ethylene, propene, acrolein, propanal, acetic acid. d After 360min reaction time (43% conversion). e After 360min reaction time (24% conversion). Influence of the nature of the support on the catalytic properties of Pt-based catalysts for hydrogenolysis of glycerol Séverine Noe Delgado David Yap Laurence Vivier Catherine Especel ⁎ IC2MP (Institut de Chimie des Milieux et des Matériaux de Poitiers), UMR 7285 CNRS, Université de Poitiers, 4 rue Michel Brunet, 82022 Poitiers Cedex, France ⁎ Corresponding author. Tel.: +33 05 49 45 39 94; fax: +33 05 49 45 37 41. Graphical abstract Highlights ► Pt/Al2O3, Pt/Al2O3–SiO2 and Pt/TiO2 catalysts were synthesized and characterized. ► Their performances were evaluated for glycerol transformation in aqueous phase. ► Textural and structural modifications of catalysts occur during catalytic test. ► Metallic and acidic sites are involved in the selective CO cleavage of glycerol. ► Pt/TiO2 system is the most active and selective to C3 compounds (1,2-PD, propanol). A series of platinum catalysts supported over various supports (Al2O3, Al2O3–SiO2 and TiO2) were prepared and characterized by X-ray diffraction, N2 sorption, H2 chemisorption, temperature programmed reduction, FTIR of adsorbed pyridine, 3,3-dimethyl-1-butene isomerization and cyclohexane dehydrogenation. These catalysts were evaluated for aqueous-phase process (APP) of glycerol at 210°C, under N2 or H2 atmosphere (60bar as total pressure). Among the tested catalysts, Pt/TiO2 was the most active and the most selective toward C3 products (propanediols, propanol) which can be further valorized into chemicals. TiO2 was identified as the support leading to the most stable Pt metallic phase, catalytic phase on which the hydrogenation/dehydrogenation reactions take place. The presence of acidic sites brought by the oxide support is necessary for the dehydration reactions (i.e. for CO cleavages), but a too high quantity of these sites can promote the CC bond cleavages via an acidic cracking mechanism. Among the various supported Pt-based catalysts studied in this work, Pt/TiO2 sample appears to be the most promising system for the transformation of polyol in aqueous phase. Keywords Glycerol hydrogenolysis Propanediol Platinum catalysts Aqueous phase process Aqueous phase reforming 1 Introduction At the time of the decrease in the fossil reserves of energy, the development of new processes for the transformation of the lignocellulosic biomass (resulting from the plants as wood, green residues, straw, etc.) in incorporable compounds to the fuel pool is a major orientation for the researchers. The use of the lignocellulosic biomass is attractive because of the low cost and the no competitiveness with the food plants. At the present time, research for the development of “second generation” biofuels is mainly directed toward the production of bioethanol, by saccharification of the carbohydrates resulting from the lignocellulosic part of the plants and fermentation of obtained sugars. Recently, a process consisting in transform sugars and polyols resulting from lignocellulosic biomass into aqueous phase (Aqueous Phase Process, APP) was developed [1–9]. Supported Pt catalysts have been often used in this process, although other metals were shown as also or even more active. The final products of the reaction are H2, alkanes, CO and CO2, and deoxygenated molecules (compared to the initial reactant) resulting of competitive CC and CO bond cleavages. CC cleavages will lead preferentially to the production of CO x and H2 (route called aqueous phase reforming, APR), whereas selective CO cleavages allow obtaining saturated hydrocarbons. However, the nature of hydrocarbons thus obtained is inherent to the structure of sugar or polyol used. The selectivity of the reaction can be directed by the experimental conditions and the nature of catalyst used (generally bifunctional system associating metallic and acidic functions). In this context, this work deals with the aqueous phase transformation of glycerol on supported Pt catalysts in order to identify, on this polyol of quite simple structure, selective systems toward CO cleavages to the detriment of the CC ones. Glycerol is one of the 12 molecules building blocks retained by the US Department of Energy to the investigations in the three important domains: fuels, chemicals with high added values and energy. The glycerol derived from biomass is interesting for its renewable nature and its abundance, due to biodiesel manufacture (100kg of glycerol produced per ton of biodiesel each day) [10]. This last is continually increasing its production, thus the secondary products are generating in glut and it is necessary to find a valorization for those, notably for the glycerol. Among routes existing for glycerol transformation, the most known is the valorization in chemicals like propanediols, acrolein and lactic acid [11–14]. The propanediols are used in fabrication of unsaturated polyester resins, pharmaceuticals/cosmetics, paints, etc. Acrolein is the main feedstock for the production of 1,3-propanediol and acrylic acid. Lactic acid is used in food industry or in biopolymer synthesis. In aqueous phase, in the presence of supported metallic catalysts, glycerol can be dehydrated to acetol or 3-hydroxypropanal, and then hydrogenated to propanediols. By the same mechanism, propanediols lead to 1- or 2-propanol and then to propane without cleavage of CC bonds [15]. These consecutive reactions correspond to selective hydrogenolysis to C3 products, compared to the CC bond cleavage and reforming. Indeed, in the same conditions, glycerol or intermediates can produce C2 and C1 compounds, such as ethylene glycol, ethanol, methanol, ethane, methane, as well as H2 and CO2 (Fig. 1 ). In latest years, much attention has been paid to develop supported metallic catalysts for the transformation of glycerol, in order to obtain high selectivity toward C3 products and low selectivity toward degradation products, as well as a good stability of the catalytic systems under the operating conditions. The catalysts the most largely studied involve monometallic systems based on Ni [16], Cu [16–18], Ru [19–21], Rh [22], Ir or Pt [15,23], as well as bimetallic systems combining these metals [24–26] or using Re as modifier [27–32]. The effects of the nature of the support were also reported in the literature, based mainly on the use of C, Al2O3, Al2O3–SiO2 and SiO2. The purpose of this study is to prepare and characterize Pt-based catalysts supported over various oxides, and to examine their performances for the aqueous phase transformation of glycerol in a batch reactor, either in the APR conditions (under N2 atmosphere) or under H2 atmosphere. Three oxides are studied: two supports commonly used for this kind of reaction, i.e. alumina and silica–alumina, and another one few studied until now for the glycerol hydrogenolysis, i.e. titania. 2 Experimental 2.1 Catalyst preparation TiO2 (Degussa P25, surface area=55m2 g−1), γ-Al2O3 (Puralox NGA 150, surface area=140m2 g−1), Al2O3–SiO2 SIRAL 20, labeled S20, containing 20wt.% SiO2 (SASOL, surface area=420m2 g−1) and Al2O3–SiO2 SIRAL 40, labeled S40, containing 40wt.% SiO2 (SASOL, surface area=522m2 g−1) were used as supports. They were calcined in flowing air for 4h at 500°C. Prior to use, they were ground (except SIRAL) and sieved to retain particles with sizes comprised between 0.04 and 0.10mm. Catalysts containing 3.0wt.% Pt were prepared by ion exchange method using H2PtCl6·6H2O (Alfa Aesar) as precursor salt and water as solvent. According to this procedure, the metal solution was added to the support previously hydrated and acidified to pH 1 with HCl (36wt.%). The water was further evaporated at moderate temperature (e.g. 40°C). The catalysts were dried overnight in oven at 120°C. After this step, the supported catalysts were calcined under an artificial air flow (80% N2 +20% O2) at 450°C for 2h. Finally, they were reduced for 2h in flowing H2 at 500°C or 300°C (the last temperature was exclusively used in the case of TiO2 support). 2.2 X-ray diffraction Powder X-ray diffraction (XRD) patterns were recorded on a Panalytical Empyrean diffractometer. The diffractograms were performed with Cu Kα radiation (λ =1.5404Å) in a 2θ range from 10° to 90° with a 0.04° step size. Crystalline phases were identified by comparison with the reference data from International Center for Diffraction Data (ICDD) files. 2.3 N2 sorption The BET surface areas were deduced from N2 adsorption performed at −196°C with a Micromeritics apparatus. Prior to the measurement, the samples were treated at 250°C under vacuum for 12h in order to eliminate the adsorbed species. 2.4 H2 chemisorption Pt dispersion was determined by H2 chemisorption. The catalysts were first reduced under H2 at 500°C or 300°C (for TiO2 support) for 1h, then evacuated at the same temperature under Ar for 2h and cooled down to room temperature. Pulses of H2 were injected at room temperature, every minute up to saturation (HC1). A new series of pulses was injected over the sample, after 30min of purge under pure Ar, in order to eliminate the reversible part of the chemisorbed hydrogen (HC2). The irreversible part was taken as HC=HC1 −HC2 and allows to estimate the metallic accessibility considering the stoichiometry between hydrogen and a surface Pt atom (H/Pts) equal to 1. The average particle size (d) was determined from the metal accessibility value (%D) according to Hugues et al. [33], who assimilated particles to cubes with one face in contact with the support. The equation is the following: d = 5 × 10 6 M D S ρ with M the atomic weight (gmol−1), S the surface by mol of Pt metal (53626m2 mol−1) and ρ the metal volumic weight (gcm−3). Analysis was carried out by using a thermal conductivity detector. 2.5 Temperature programmed reduction experiments (TPR) Prior to the TPR, the monometallic platinum catalysts were first pretreated in situ under O2 for 30min at 450°C, and cooled down to room temperature. The TPR experiments were performed with a 1.0vol.% H2/Ar gas mixture. The temperature range was 25–500°C with a ramp of 5°Cmin−1 and was then maintained at 500°C for 1h. The measurements of the H2 consumption were made in an AutoChem II/Micromeritics apparatus, using a thermal conductivity detector. 2.6 FTIR of adsorbed pyridine The Fourier transformed infrared spectroscopy (FTIR) of adsorbed pyridine was used to determine the number of Lewis acid sites on the metallic catalysts [34]. The samples, pressed into thin wafers (20–25mg), were pretreated under vacuum at 450°C for 12h. The background spectrum, recorded under identical operating conditions without sample, was systematically subtracted. The samples were exposed to pyridine vapors at a pressure of 2mbar for 5min at 150°C. Afterwards, spectra were recorded using a Nicolet-Magna IR 750 spectrometer, after evacuation for 1h at various temperatures (150°C, 250°C and 350°C). Normalized band areas were calculated by fitting the spectral profile with a Gaussian–Lorentzian function using IR OMNIC software. The concentration of Lewis acid sites was calculated from the integrated area of the band at 1450cm−1 using the value of the molar extinction coefficient of this band (1.28cmμmol−1) determined by Guisnet et al. [35]. 2.7 Isomerization of 3,3-dimethyl-1-butene The model reaction of skeletal isomerization of 3,3-dimethyl-1-butene (33DMB1) was used to characterize the Brønsted acid sites. Indeed, as demonstrated by Kemball et al. [36,37], the Lewis centers are not involved in this reaction and the 33DMB1 isomerization is likely to occur through a pure protonic mechanism [38,39]. The sample (100mg), loaded in a glass reactor, was calcined in situ for 1h at 450°C (air flow=60mLmin−1), then purged under N2 for 15min. Afterwards, the flow was switched to H2 and the catalyst was reduced for 1h (H2 flow=60mLmin−1). After treatment, the catalyst was cooled down to 150°C or 300°C (reaction temperature) under N2 (N2 flow=30mLmin−1). The reaction was performed under atmospheric pressure with a reactant flow rate of 15.2mmolh−1 and a reactant partial pressure of 20kPa. Analysis of the reaction products was performed by gas chromatography with a flame ionization detector (AlphaMos PR2100) on a Rtx-1 (Restek) column (105m×0.53mm×3.00μm). The detected products were 2,3-dimethyl-1-butene and 2,3-dimethyl-2-butene. 2.8 Dehydrogenation of cyclohexane Cyclohexane dehydrogenation is a structure insensitive reaction used to characterize the metallic function [40]. The reaction was carried out under atmospheric pressure in a continuous flow reactor at 270°C. Injection of cyclohexane was made using a calibrated motor-driven syringe. The partial pressures were 97 and 3kPa for H2 and cyclohexane, respectively. All measurements were performed with a total flow rate of 100mLmin−1. Analysis of the reaction products was performed by gas chromatography with a flame ionization detector (Varian 3400X) on a HP-PLOT Al2O3 “KCl” column. The only detected product was benzene. 2.9 Aqueous-phase transformation of glycerol The aqueous phase reaction was carried out under N2 or H2 atmosphere, at a total pressure of 60bar, and temperature of 210°C for 360min in a 300mL stirred batch autoclave (Autoclave Engineers) fitted with systems for liquid and gas sampling. In a typical experiment, glycerol (4.5wt.%) was loaded with 10mL of ultra-pure water into a feeder and the catalyst (1g) was loaded with 140mL of ultra-pure water into the reactor. The catalysts were pre-reduced and immersed in the solvent (ultra-pure water) without exposure to air before introduction into the autoclave. The autoclave was flushed with N2 and after with H2 (for experiments under H2 atmosphere). The temperature of the reactor was raised to 210°C under 20bar. Then, diluted glycerol (10mL) was loaded into the autoclave and the pressure was adjusted to 60bar. Zero time was taken when stirring was switched on. At different times, liquid samples were manually collected during the run and analyzed by HPLC. The mobile phase in HPLC was sulfuric acid in water (0.004molL−1) with a flow rate of 0.7mLmin−1. The column was BIO-RAD Aminex HPX 87H and it was used at 30°C with both refractive index (RI) and ultraviolet (UV) detectors. Gaseous products were analyzed online by a CP-3800 RGA system with 3 channels (2 TCD and 1 FID). Conversion of the glycerol and selectivity were calculated on the basis of the following equations: Conversion ( % ) = moles of glycerol consumed moles of glycerol initially charged × 100 Selectivity ( % ) = moles in specific products moles in all detected products × 100 3 Results and discussion 3.1 XRD analysis The diffractograms of the supports were measured before and after the glycerol transformation test performed under N2 atmosphere (Fig. 2 ). For the TiO2 support (Fig. 2a and e), peaks of anatase phase were located at 25.3°, 37.8°, 48.1° and 54.0°. Small peaks of rutile phase were observed at 27.4°, 36.1° and 54.3°. On both diffractograms, the results show a mix of rutile and anatase phases with small differences in respective intensities between the fresh and used supports. These results are in agreement with the stability in aqueous phase of this support [21]. Before catalytic test, the γ-Al2O3 (Fig. 2b) presents a typical diffractogram with two main peaks located at 45.8° and 67.0° corresponding to the (400) and (440) crystal planes of γ-Al2O3 structure, respectively [41]. After catalytic test, the main peaks observed on Al2O3 support correspond to a boehmite phase (Fig. 2f), i.e. 14.5°, 28.2°, 38.3° and 49.0° associating to the (020), (120), (140, 031), and (051) crystal planes, respectively [41]. The formation of AlO(OH) in the hydrothermal conditions on this type of supports has been reported in the literature [42–44]. Contrary to a recent study [44], no evident formation of boehmite was observed after catalytic test in alumina–silica supports (SIRAL 20 and 40, Fig. 2c–g and d–h respectively), evidencing that SiO2 stabilizes the Al2O3 phase in these supports. Reactants constituting the reaction medium during glycerol transformation play a significant role in the transformation of γ-Al2O3. Indeed, it was showed that this support reacts differently in aqueous solution of glycerol or sorbitol and in pure water [41]. Finally, this support was more affected by the aqueous medium reaction than the others. 3.2 Specific surface and metal accessibility measurements The physicochemical properties (specific area and Pt dispersion) were measured for each catalyst before (fresh) and after the glycerol transformation (used) (Table 1 ). Before Pt impregnation, the BET surfaces and pore volumes can be classified as follows: TiO2 <Al2O3 <SIRAL 20<SIRAL 40. For the alumina–silica supports, the BET surface increases with the SiO2 content. After Pt impregnation, the specific surfaces of the fresh samples decrease in a more or less extend according to the nature of the support. On the fresh catalysts, the Pt dispersion values are function of the support, in the 60–70% range for the alumina and alumina–silica (i.e. an average Pt particle size d around 1.3nm) and equal to 35% for TiO2 support (i.e. d around 2.4nm). After the glycerol transformation performed under N2 or H2 atmosphere (used catalysts), the BET surfaces decrease in a little extend (< 15%) on the Al2O3–SiO2 and TiO2 supports. A more remarkable decrease is obtained with Pt catalyst supported on Al2O3 whatever the atmosphere used during the test (N2 or H2), since a loss of around 45% of the initial BET surface is observed. This could be attributed to the destruction of the initial structure of alumina, and to the hydration phenomenon leading to the boehmite formation (as observed by XRD). With alumina support, the decrease in BET surface during the aqueous phase transformation of glycerol is associated with a marked decrease of the pore volume. Concerning the Pt dispersion, whatever the nature of the support, a noticeable decrease (superior to 65%) occurs during the catalytic test performed under N2 atmosphere. This loss of dispersion is linked to a sintering phenomenon of the Pt particles during the catalytic test in aqueous phase under 210°C and 60bar, as already observed in previous study [45]. Recently published papers devoted to the stability of Pt catalysts during aqueous phase hydrogenolysis of polyol clearly describe this phenomenon [41,46,47]. These authors observed that platinum sintering occurs in liquid water even at room temperature. The experimental parameters used for the polyol transformation (T, P) as well as the composition of the aqueous phase (polyol and derivates) further contribute to accentuate the sintering phenomenon generated mainly by the presence of water. Under H2 atmosphere, the Pt dispersion does not evolve compared to the fresh catalyst in the case of TiO2 support, and decreases for Al2O3 and SIRAL 40 supports but in a lower extend than under N2 atmosphere. For SIRAL 20, the same evolution between the fresh and used samples is obtained for both atmospheres. The different behaviors according to the atmosphere used during the glycerol transformation must be linked to various compositions of the reaction mixture. Moreover, a pH decrease is observed after tests from 7 (glycerol aqueous solution) to approximately a value of 3, whatever the catalyst and the atmosphere. 3.3 Temperature programmed reduction experiments Fig. 3 presents TPR profiles of the various Pt-based catalysts (experiments performed on fresh samples). The reduction of the metallic phase occurs in a temperature range comprised between 50 and 300°C for the Pt catalysts supported on alumina and alumina–silica, the maximum of the consumption peak being located at a slight higher temperature for Pt/S20. A reduction profile less large and at lower temperature is obtained for the Pt/TiO2 sample. The evolutions according to the support nature are in agreement with the different values of Pt dispersion (D%: Pt/Al2O3 ≈Pt/Al2O3–SiO2 >Pt/TiO2) knowing that Pt particles are all the most easily reduced than their size is important, i.e. in weaker interaction with the support. For all the catalysts, the H2 consumptions gathered in Table 1 are lower than the quantity necessary to reduce all the metal atoms (153μmolPt g−1 catal), if this one is considered to be in the PtO2 oxidized form before the TPR experiments (in that case, 2mol of H2 would be necessary to reduce 1mol of PtO2, involving a H2/Pt ratio equal to 2). This observation means that the pre-oxidation treatment is probably not sufficient to oxidize until the core the Pt particles in a PtO2 form and this notably for catalysts supported on both Al2O3–SiO2 and TiO2 (0.6<H2/Pt<1.3, Table 1). On the other hand, the formation of another oxide phase of lower stoichiometry (PtO) could not be excluded on these systems. Finally, the TPR experiments allow confirming that the metallic phase of the Pt catalysts is totally reduced after the activation treatment performed at the end of their preparation (reduction at 500°C for Pt deposited on Al2O3 and Al2O3–SiO2 supports, and at 300°C on TiO2 support). 3.4 FTIR of adsorbed pyridine The adsorption of pyridine followed by FTIR was performed in order to quantify, on the fresh catalysts, the amount of the Lewis acid sites and the distribution of their strength (weak, medium and strong). The spectral range studied was 1400–1700cm−1. The different attributions of bands are reported in the literature [48,49]. Fig. 4 shows the spectra of the Pt-based catalysts after pyridine adsorption at 150°C. The commonly accepted procedure for FTIR spectral interpretation of adsorbed pyridine attributes adsorption at 1624 and 1455cm−1 to strong sites, 1617, 1576 and 1451cm−1 to weak Lewis acid sites, 1540cm−1 to Brønsted acid sites, and 1494cm−1 to both Brønsted and Lewis sites [34,48,50]. On the four spectra, the very low intensity of the band at about 1540cm−1 indicates that there are no Brønsted acid sites on the surface strong enough to form pyridinium ions (PyH+). The total number of Lewis acid sites was calculated from the integrated area of the band at 1455cm−1 on the spectra after evacuation for 1h at 150°C. The strength of Lewis acid sites was determined by difference between the integrated areas obtained at various temperatures (250–150°C: weak sites/350–250°C: medium sites/area remaining at 350°C: strong sites). The results are presented in Fig. 5 for the four Pt-based catalysts. The total number of Lewis sites is more important on Al2O3 and Al2O3–SiO2 (around 300μmolg−1) than on TiO2 (150μmolg−1). The number of weak acid sites predominates on all samples. Al2O3–SiO2 supports (S20 and S40) exhibit a noticeable quantity of medium acid sites compared to the other supports. Finally, strong acid sites are in greatest quantity on Pt/Al2O3 and Pt/S40 catalysts. 3.5 Isomerization of 3,3-dimethyl-1-butene (33DMB1) At a temperature below 300°C, the isomerization of 3,3-dimethyl-1-butene leads to 2,3-dimethyl-1-butene and 2,3-dimethyl-2-butene and allows the characterization of the Brønsted acid centers with a medium strength. Methylpentenes appear at higher temperatures (>300°C) and their formation requires relatively strong Brønsted acid sites [38]. The reaction was performed at 150°C for Pt/Al2O3–SiO2 (S20 and S40) and 300°C for Pt/Al2O3 and Pt/TiO2 so as to measure correctly the conversion. Table 2 gives the temperature of reaction and the activities measured per μmolm−2 h−1 and calculated by considering the BET surface area reported in Table 1 for each fresh catalyst. The activation energy was close to 95kJmol−1 [39], which allows establishing a classification of the Brønsted acidity based on an extrapolation of the activity at 300°C (Fig. 6 ). Although the IR spectra of adsorbed pyridine show that there are few Brønsted acid sites (at 1540cm−1), the Pt/S20 and Pt/S40 catalysts show a good isomerization activity even at 150°C. The Brønsted acidities of Pt/TiO2 and Pt/Al2O3 samples are quite similar and around twice lower than these of Pt/Al2O3–SiO2 (S20 and S40) (Fig. 6). 3.6 Dehydrogenation of cyclohexane The different catalysts after preparation (fresh samples) were tested for cyclohexane dehydrogenation into benzene at 270°C and under atmospheric pressure. The performances of Pt-based catalysts are reported in Table 3 . This model reaction is known to be catalyzed only by the metallic phase and to be insensitive to the catalyst structure [40,51,52]. In function of the support nature (Al2O3, Al2O3–SiO2, TiO2), the obtained specific activities (As) are comprised between 3.1 and 4.5mol of cyclohexane converted per hour and per gram of metal. These values are quite comparable for the samples supported on Al2O3–SiO2 (S20 and S40), assuming an error of around 10% on the determination of As value, a little more important for Pt/Al2O3, and the highest one was obtained for Pt/TiO2. As all the catalysts do not have the same number of accessible platinum atoms, the intrinsic activities or TOF (turn over frequency) are more appropriated data to compare the properties of the different systems. TOF values are estimated taking into account the number of accessible Pt atoms per gram deduced from the H2-chemisorption experiments performed on fresh samples. The TOF values present the following order: Pt/S20<Pt/Al2O3 <Pt/S40≪Pt/TiO2. So, a Pt surface atom is more active for this reaction when deposited on the TiO2 support compared to the Al2O3 and Al2O3–SiO2 ones. This behavior can result from different metal–support interactions between the samples, leading to different electronic enrichments of the metallic particles, and then to various adsorption strengths of the reactant (cyclohexane) and product (benzene) onto the Pt surface. Indeed, TPR experiments have shown previously that the preoxidized Pt particles are reduced at lower temperature when deposited on TiO2 compared to other supports (Fig. 3). Thus, the highest metal–support interaction obtained with Al2O3 and Al2O3–SiO2 may induce an electronic transfer from metallic particles toward oxide supports, involving modifications of the metallic phase properties. These modifications, corresponding to an electronic deficiency, lead to a higher interaction between the Pt particles and the reaction product (benzene) and consequently to lower TOF values for Pt/Al2O3 and Pt/Al2O3–SiO2 systems. Moreover, it can be noticed that among these three samples, the Pt/S20 catalyst showed a TPR profile slightly shifted to higher temperatures, suggesting a metal–support interaction slightly higher in this case. This behavior can explain that the TOF value of this last sample during cyclohexane dehydrogenation is the lowest of the series. In conclusion, from the catalytic performances obtained during the probe reaction of cyclohexane dehydrogenation, we can assume that the four studied Pt-based catalysts present different metallic phases in terms of electronic properties. 3.7 Aqueous phase transformation of glycerol The reaction pathway of the glycerol transformation is summarized in Fig. 1. Generally, the nature of the obtained products depends on several parameters like the nature of the metallic phase and of the support, the reaction conditions (temperature, pressure). Generally, the dehydration steps are associated to catalysis via an acidic function, whereas the hydrogenation/dehydrogenation reactions need a metallic function. In the present work, the effects of the nature of the support (Al2O3, Al2O3–SiO2 and TiO2) and of the reaction atmosphere (N2 or H2) have been studied. In the experimental conditions (4.5wt.% glycerol, 210°C, 60bar total pressure), the main products observed in liquid phase (detected by HPLC) were: – C3 products resulting from CO bond selective cleavages, i.e. the first dehydration or dehydrogenation products (acetol, glyceraldehyde (GLA), respectively), further hydrogenation products (1,2- and 1,3-propanediol (1,2-PD, 1,3-PD)), and further hydrogenolysis products (1- and 2-propanol (1P+2P)). – C2 and C1 products (degradation products) resulting from one or two CC bond cleavages, respectively, i.e. ethylene glycol (EG), ethanol (EtOH) and methanol (MeOH). We can notice that the 3-hydroxypropanal (3-HPA), presented in Fig. 1 as a potential intermediary product, was not detected in any of the experiments, and no reference in the literature does not mention the detection of this compound. The stabilities of 3-HPA and acetol are different: stable acetol can be detected in the reaction while unstable 3-HPA is nearly instantaneously converted in subsequent reactions [15]. Hydrocarbons (propane, propene, ethane and methane) as well as CO2 and H2 were detected in the gas phase (CPG analysis). First, it is not detailed here but tests with only supports (before platinum impregnation) were made, the conversion of glycerol was inferior to 10% and the major product was acetol, product of dehydration. This behavior confirms on one hand, that the acid sites on the support are involved in the initial dehydration reaction [53], and on the other hand, that the hydrogenation reactions leading further to diols do not occur in the absence of metallic sites. The conversion of glycerol was determined in the presence of fresh Pt-based catalysts under N2 (Fig. 7a) and H2 (Fig. 7b) atmosphere. For all supported samples, the conversion is more important under N2 atmosphere than under H2, suggesting an inhibiting effect of hydrogen. This phenomenon has already been reported to be caused by the blocking of surface sites by adsorbed hydrogen atoms, decreasing then the surface concentrations of reactive intermediates [4,13]. Whatever the atmosphere used (N2 or H2), the Pt catalyst supported on TiO2 is by far more active than the others, highlighting the interesting behavior of this support for the conversion of glycerol in aqueous phase, compared to Al2O3 and Al2O3–SiO2 supports more classically used in the studies dedicated to APP of polyols on metallic catalysts [13,44]. For the selective hydrogenolysis of glycerol in liquid phase, a lot of monometallic catalytic systems were studied before. Among then, platinum-based catalysts were largely used, supported on various supports (active carbon, SiO2, Al2O3, Al2O3–SiO2), and tested under varied experimental conditions (type of reactor: batch or fixed-bed one, temperature, total pressure, concentration of reactant, catalyst mass) [15,23–25,28]. The different experimental conditions performed in these studies make complex the comparison of the obtained catalytic performances. On 1wt.% Pt/Al2O3–SiO2 catalysts tested in autoclave with 20wt.% glycerol initial concentration, 45bar pressure, 166mg catalyst/mg glycerol, Gandarias et al. obtained 20% of conversion at 220°C after 24h reaction time [15]. Under different conditions (1wt.% glycerol solution, 40bar pressure, 200°C, glycerol/surface platinum ratio of approximately 700), 3wt.% Pt/C catalysts led to a conversion of 13% after 5h reaction time [24]. To our knowledge, no Pt-based catalyst supported on TiO2 was studied until now for the glycerol transformation, apart Gong et al. who studied recently a complex system constituted of Pt/WO3/TiO2 deposited on silica, in which the presence of TiO2 species was observed to favor the dispersion of platinum [54]. In the present study, the higher conversions obtained for the Pt/TiO2 catalyst can be linked to the Pt particle size more important on TiO2 support than on the others, as observed by H2 chemisorption on the fresh catalysts (Table 1). In fact, hydrogenolysis reactions are known to be structure sensitive, and favored by the presence of large particles [55,56]. Nevertheless, particle size evolves during the test since sintering of the metallic Pt phase was observed on each catalyst, but the initial state of the fresh catalyst can be crucial. Moreover, the Pt/TiO2 catalyst seems more stable than the others overall the test, since a more important deactivation phenomenon is observed on the Pt systems supported on Al2O3 and Al2O3–SiO2. The amounts of carboneous deposit on the catalysts after tests have been measured and these amounts (<0.2wt.%) are not significant enough to explain this deactivation. Maris et al. evaluated the properties of carbon-supported monometallic and bimetallic systems constituted of Pt, Ru and Au, for the glycerol hydrogenolysis (solution of 1wt.%) performed at 200°C, 40bar H2 during 300min [24]. On Pt/C catalyst, these authors observed the same trend than on the present Pt systems, i.e. a significant deactivation of the sample after around 20min under reaction conditions. According to these authors, this behavior comes from a sintering of the Pt particles caused by the aqueous-phase processing, sintering they confirm besides by TEM and EXAFS analyses. Under H2 atmosphere, the performances of the four tested catalysts in terms of glycerol conversion can be classified as follow: Pt/TiO2 ≫Pt/Al2O3 ≈Pt/S40>Pt/S20. This classification was quite similar for the results obtained from the model reaction of cyclohexane dehydrogenation, with a turnover frequency for the Pt/TiO2 system more than three times higher compared to that of Pt/S20 catalyst, and around twice higher compared to these of Pt/Al2O3 and Pt/S40 samples. Nevertheless, the comparison between the catalytic properties observed for that model reaction and for the glycerol transformation has to be considered cautiously, since the operating conditions are very different (gas phase reaction performed in a fixed-bed reactor for the first one, and aqueous phase reaction carried out in an autoclave for the second one). Table 4 presents the selectivity in products obtained on each Pt catalyst at isoconversion (10%). For Pt/TiO2 sample, the selectivity after 360min reaction time is also reported. For the Pt/Al2O3, Pt/S20 and Pt/S40 catalysts, the results obtained at the final reaction time (360min) are not added since quite similar to data already presented in Table 4, the glycerol conversion hardly exceeding 10% on these samples. Acetol, primary product of dehydration, is formed in a higher proportion under N2 atmosphere. Under H2, this unsaturated product is easily hydrogenated toward C3 diol and mono-alcohols (1,2-PD, 1,3-PD, 1P+2P). With the increase in the reaction time, this first intermediate is further transformed, and then its proportion decreases (as seen on the Pt/TiO2 catalyst). 1,3-Propanediol (1,3-PD) is formed only under H2 and should be issue from 3-hydroxypropanal hydrogenation, that aldehyde being easily hydrogenated and never observed in our experimental conditions. It is important to mention that a noticeable formation of H2 occurred under N2 atmosphere, providing by the Aqueous Phase Reforming (APR) of glycerol on Pt sites [6]. The H2 molecules as formed can react further easily with intermediates adsorbed on neighboring Pt sites or, after spill over, with intermediates adsorbed on acidic sites of the support. During glycerol transformation carried out under H2 atmosphere, it is not possible to precisely quantify the produced H2 but the APR route should not be thermodynamically favored in the presence of H2 into the reaction medium. Glyceraldehyde (GAL), product issue from one glycerol dehydrogenation, is formed in a significant amount in the presence of Pt/Al2O3 under N2 atmosphere, that catalyst leading also to the highest H2 yield. The selectivities toward C3 diols and mono-alcohols (1,2-PD, 1,3-PD, 1P, 2P) are systematically higher under H2 atmosphere for all the catalysts. Nevertheless, after 360min reaction time, the selectivity to 1,2-PD in the case of the Pt/TiO2 catalyst tested under N2 atmosphere is finally higher than this obtained on Pt/Al2O3, Pt/S20 and Pt/S40 systems under H2 atmosphere. At 10% conversion under N2 atmosphere, the alcohols formed in aqueous phase are mainly C2 compounds, as well as methanol in the case of both alumina–silica supports. That peculiar formation of methanol can be due to the presence of a higher quantity of acidic sites on the Al2O3–SiO2 oxides compared to the other ones. Indeed, the previous characterizations have shown that Al2O3–SiO2 supports possess both the highest Lewis acidity (comparable to that of Al2O3) and the highest Brønsted acidity (twice higher that on the other oxides). The presence of such concentration of acidic sites may promote the CC bond cleavages, via an acidic cracking mechanism. Under both atmospheres, the formation of CO2 is also observed issue from CC bond cleavages via decarbonylation and/or decarboxylation reactions, and/or from reforming process. It must be noticed that a part of CO2 can dissolve in the aqueous phase, and this quantity cannot be accounted since a significant amount is removed during processing of the liquid sample analysis (decrease of temperature, filtration). Moreover, a production of hydrocarbon (HC) is obtained on each catalyst in more or less extends according to the nature of the support and of the atmosphere used during glycerol transformation. At 10% glycerol conversion, the HC selectivity is maximum on the Pt/Al2O3 and Pt/S20 samples tested under N2 atmosphere, but this value remains rather low (S HC ≈6%). After 360min reaction time, the production of HC is finally the highest on the Pt/TiO2 system under N2 atmosphere (S HC ≈9% for 43% of converted glycerol). It must be noted that some other products are detected in rather limited quantities (listed as “Others” in Table 4). The catalytic performances of all the systems obtained at the end of the reaction time (360min) are also gathered in Fig. 8 . After 360min reaction time, the Pt/TiO2 catalyst is by far the highest selective system toward C3 products, since the selectivity reaches 62% and 75% under N2 and H2 atmosphere, respectively. These C3 compounds are mainly composed of 1,2-PD (selectivity equal to 49% and 62% according to N2 or H2 atmosphere). The propanol (1P+2P) selectivity remains low (<7%), as on the other Pt catalysts, as well as the propane one (equal to 1%). In fact, the limited quantity of hydrocarbon produced during the reaction is not only constituted of propane, but also of ethane and methane. Fig. 9 shows the distribution in hydrocarbon obtained with the various catalysts at 360min of reaction time. Under N2 atmosphere, methane is the mainly formed hydrocarbon whatever the nature of the catalyst, and propane remains hugely limited suggesting probably that under this atmosphere, the CO produced by APR of glycerol may be transformed by methanation reaction. Under H2 atmosphere, the proportion of methane decreases in favor of propane and ethane, notably with the Pt/S40 catalyst, and above all with the Pt/TiO2 system. Finally, the performances of the Pt-based catalysts during glycerol transformation are linked to the nature of the support used, which modulates the dispersion of the metallic phase, the metal–support interaction, the electronic properties of the metallic particles and the acidic properties of the catalyst. Among the studied supports, TiO2 leads to the highest selective Pt catalyst toward propanediol and propanol, with the highest capacity to maintain the carboneous chain until propane formation without CC bond cleavage by working under H2 atmosphere. Consequently, successive dehydration/hydrogenation reactions occur selectively on Pt/TiO2 system, which could be a promising catalyst for further investigations concerning aqueous phase process of polyol transformation. 4 Conclusion Pt catalysts supported on various oxides (alumina, alumina–silica, titania) were prepared and characterized, and their performances were evaluated for the glycerol transformation performed in aqueous phase, at 210°C, under 60bar as total pressure, in a batch reactor. During aqueous phase reaction, the catalysts undergone structural and textural modifications, in a less or more extend according to the nature of the support, as well as to the nature of the gaseous atmosphere (N2 or H2) introduced into the batch reactor. XRD patterns showed the formation of boehmite from Al2O3 support, whereas no change of crystalline phases was observed with the other supports (Al2O3–SiO2 and TiO2). A sintering of the Pt particles occurred during the test, mainly under N2 atmosphere. However, TiO2 was identified as the support leading to the most stable Pt metallic phase in the reaction conditions. A higher Lewis and Brønsted acidity was obtained on the catalysts supported on Al2O3–SiO2. During glycerol transformation, the acidic sites are involved in the dehydration reactions, but unfortunately they can also promote the CC bond cleavages via an acidic cracking mechanism. Among the various supported Pt-based catalysts studied in this work, Pt/TiO2 sample appeared to be the most efficient system, leading to the highest glycerol conversion and to the highest selectivity toward C3 products (propanediols, propanol) that can be further valorized into chemicals. This catalyst was also the most efficient to keep intact the carboneous chain until propane formation without CC bond cleavage. In the field of the aqueous phase processes of C5 C6 polyols with the aim to produce C5 C6 hydrocarbons and incorporate them to fuel pool, Pt/TiO2 catalyst may then appear as promising. Acknowledgement We are grateful to Region Poitou-Charentes for financial support of this project. References [1] R.R. Davda J.A. Dumesic Angew. Chem. Int. Ed. 42 2003 4068 [2] R.R. Davda J.W. Shabaker G.W. Huber R.D. Cortright J.A. Dumesic Appl. Catal. B 43 2003 13 [3] G.W. Huber J.W. Shabaker J.A. Dumesic Science 300 2003 2075 [4] J.W. Shabaker R.R. Davda G.W. Huber R.D. Cortright J.A. Dumesic J. Catal. 215 2003 344 [5] J.W. Shabaker G.W. Huber R.R. Davda R.D. Cortright J.A. Dumesic Catal. Lett. 88 2003 1 [6] G.W. Huber R.D. Cortright J.A. Dumesic Angew. Chem. Int. Ed. 43 2004 1549 [7] J.W. Shabaker J.A. Dumesic Ind. Eng. Chem. Res. 43 2004 3105 [8] J.W. Shabaker G.W. Huber J.A. Dumesic J. Catal. 222 2004 180 [9] J.W. Shabaker D.A. Simonetti R.D. Cortright J.A. Dumesic J. Catal. 231 2005 67 [10] M. Pagliaro R. Ciriminna H. Kimura M. Rossi C. Della Pina Angew. Chem. Int. Ed. 46 2007 4434 [11] A. Corma S. Iborra A. Velty Chem. Rev. 107 2007 2411 [12] A. Behr J. Eilting K. Irawadi J. Leschinski F. Lindner Green Chem. 10 2008 13 [13] C.H. Zhou J.N. Beltramini Y.X. Fan G.Q.M. Lu Chem. Soc. Rev. 37 2007 527 [14] E. Taarning S. Saravanamurugan M.S. Holm J. Xiong R.M. West C.H. Christensen ChemSusChem 2 2009 625 [15] I. Gandarias P.L. Arias J. Requies M.B. Güemez J.L.G. Fierro Appl. Catal. B 97 2010 248 [16] M.A. Dasari P.-P. Kiatsimkul W.R. Sutterlin G.J. Suppes Appl. Catal. A 281 2005 225 [17] Z. Yuan J. Wang L. Wang W. Xie P. Chen Z. Hou X. Zheng Bioresour. Technol. 101 2010 7088 [18] A. Bienholz H. Hofmann P. Claus Appl. Catal. A 391 2011 153 [19] T. Miyazawa Y. Kusunoki K. Kunimori K. Tomishige J. Catal. 240 2006 213 [20] M. Balaraju V. Rekha P.S. Sai Prasad B.L.A. Prabhavathi Devi R.B.N. Prasad N. Lingaiah Appl. Catal. A 354 2009 82 [21] M. Balaraju V. Rekha B.L.A. Prabhavathi Devi R.B.N. Prasad P.S. Sai Prasad N. Lingaiah Appl. Catal. A 384 2010 107 [22] I. Furikado T. Miyazawa S. Koso A. Shimao K. Kunimori K. Tomishige Green Chem. 9 2007 582 [23] A. Wawrzetz B. Peng A. Hrabar A. Jentys A.A. Lemonidou J.A. Lercher J. Catal. 269 2010 411 [24] E.P. Maris W.C. Ketchie M. Murayama R.J. Davis J. Catal. 251 2007 281 [25] D. Roy B. Subramaniam R.V. Chaudhari Catal. Today 156 2010 31 [26] I. Gandarias P.L. Arias J. Requies M. El Doukkali M.B. Gũemez J. Catal. 282 2011 237 [27] L. Ma D. He Z. Li Catal. Commun. 9 2008 2489 [28] O.M. Daniel A. DeLaRiva E.L. Kunkes A.K. Datye J.A. Dumesic R.J. Davis ChemCatChem 2 2010 1107 [29] Y. Amada S. Koso Y. Nakagawa K. Tomishige ChemSusChem 3 2010 728 [30] L. Ma D. He Catal. Today 149 2010 148 [31] Y. Nakagawa Y. Shinmi S. Koso K. Tomishige J. Catal. 272 2010 191 [32] Y. Amada Y. Shinmi S. Koso T. Kubota Y. Nakagawa K. Tomishige Appl. Catal. B 105 2011 117 [33] T.R. Hugues R.H. Houston R.P. Sieg 135th Nat. Meeting Am. Chem. Soc. Div. Petrol. Chem., Prep. 4 1959 c33 [34] F. Epron C. Carnevillier P. Marécot Appl. Catal. A 295 2005 157 [35] M. Guisnet P. Ayrault C. Coutanceau M.F. Alvarez J. Datka J. Chem. Soc. Faraday Trans. 93 1997 1661 [36] C. Kemball H.F. Leach B. Skundric K.C. Taylor J. Catal. 27 1972 416 [37] C.S. John C. Kemball R.A. Rajadhayarsha J. Catal. 57 1979 264 [38] H.J. Pines J. Catal. 78 1982 1 [39] D. Martin D. Duprez J. Mol. Catal. A 118 1997 113 [40] J.A. Cusumano G.W. Dembinkski J.H. Sinfelt J. Catal. 5 1966 471 [41] R.M. Ravenelle J.R. Copeland A.D. Van Pelt J.C. Crittenden C. Sievers Top. Catal. 55 2012 162 [42] N. Luo X. Fu F. Cao T. Xiao P.P. Edwards Fuel 87 2008 3483 [43] S.C. Chen Q. Chen P.S. Chow G.H. Tan X.T. Zeng Z. Wang R.B.H. Tan J. Phys. Chem. C 111 2007 700 [44] A. Ciftci B. Peng A. Jentys J.A. Lercher E.J.M. Hensen Appl. Catal. A 431–432 2012 113 [45] E.P. Maris R.J. Davis J. Catal. 249 2007 328 [46] L. Vilcocq A. Cabiac C. Especel S. Lacombe D. Duprez Catal. Commun. 15 2011 18 [47] R. Ravenelle J.R. Copeland W.G. Kim J.C. Crittenden C. Sievers ACS Catal. 1 2011 552 [48] B. Chakraborty B. Viswanathan Catal. Today 49 1999 253 [49] J.P. Marques I. Gener P. Ayrault J.C. Bordado J.M. Lopes F. Ramôa Ribeiro M. Guisnet Microporous Mesoporous Mater. 60 2003 251 [50] A.P. Kulkarni D.S. Muggli Appl. Catal. A 302 2006 274 [51] D.W. Blakely G.A. Somorjai J. Catal. 42 1976 181 [52] R. Ramos A. Guerrero-Ruiz J. Catal. 135 1992 458 [53] G.B. McVicker G.M. Kramer J.J. Ziemiak J. Catal. 92 1985 355 [54] L. Gong Y. Lu Y. Ding R. Lin J. Li W. Dong T. Wang W. Chen Appl. Catal. A 390 2010 119 [55] F.M. Dautzenberg J.N. Helle P. Biloen W.M.H. Sachtler J. Catal. 63 1980 119 [56] R.D. Cortright J.A. Dumesic J. Catal. 148 1994 771",
      "scopus-id": "84871719329",
      "coredata": {
        "eid": "1-s2.0-S1381116912003603",
        "dc:description": "A series of platinum catalysts supported over various supports (Al2O3, Al2O3–SiO2 and TiO2) were prepared and characterized by X-ray diffraction, N2 sorption, H2 chemisorption, temperature programmed reduction, FTIR of adsorbed pyridine, 3,3-dimethyl-1-butene isomerization and cyclohexane dehydrogenation. These catalysts were evaluated for aqueous-phase process (APP) of glycerol at 210°C, under N2 or H2 atmosphere (60bar as total pressure). Among the tested catalysts, Pt/TiO2 was the most active and the most selective toward C3 products (propanediols, propanol) which can be further valorized into chemicals. TiO2 was identified as the support leading to the most stable Pt metallic phase, catalytic phase on which the hydrogenation/dehydrogenation reactions take place. The presence of acidic sites brought by the oxide support is necessary for the dehydration reactions (i.e. for CO cleavages), but a too high quantity of these sites can promote the CC bond cleavages via an acidic cracking mechanism. Among the various supported Pt-based catalysts studied in this work, Pt/TiO2 sample appears to be the most promising system for the transformation of polyol in aqueous phase.",
        "openArchiveArticle": "false",
        "prism:coverDate": "2013-02-28",
        "openaccessUserLicense": null,
        "prism:aggregationType": "Journal",
        "prism:url": "https://api.elsevier.com/content/article/pii/S1381116912003603",
        "dc:creator": [
          {
            "@_fa": "true",
            "$": "Delgado, Séverine Noe"
          },
          {
            "@_fa": "true",
            "$": "Yap, David"
          },
          {
            "@_fa": "true",
            "$": "Vivier, Laurence"
          },
          {
            "@_fa": "true",
            "$": "Especel, Catherine"
          }
        ],
        "link": [
          {
            "@_fa": "true",
            "@rel": "self",
            "@href": "https://api.elsevier.com/content/article/pii/S1381116912003603"
          },
          {
            "@_fa": "true",
            "@rel": "scidir",
            "@href": "https://www.sciencedirect.com/science/article/pii/S1381116912003603"
          }
        ],
        "dc:format": "application/json",
        "openaccessType": null,
        "pii": "S1381-1169(12)00360-3",
        "prism:volume": "367",
        "prism:publisher": "Elsevier B.V.",
        "dc:title": "Influence of the nature of the support on the catalytic properties of Pt-based catalysts for hydrogenolysis of glycerol",
        "prism:copyright": "Copyright © 2012 Elsevier B.V. All rights reserved.",
        "openaccess": "0",
        "prism:issn": "13811169",
        "dcterms:subject": [
          {
            "@_fa": "true",
            "$": "Glycerol hydrogenolysis"
          },
          {
            "@_fa": "true",
            "$": "Propanediol"
          },
          {
            "@_fa": "true",
            "$": "Platinum catalysts"
          },
          {
            "@_fa": "true",
            "$": "Aqueous phase process"
          },
          {
            "@_fa": "true",
            "$": "Aqueous phase reforming"
          }
        ],
        "openaccessArticle": "false",
        "prism:publicationName": "Journal of Molecular Catalysis A: Chemical",
        "openaccessSponsorType": null,
        "prism:pageRange": "89-98",
        "prism:endingPage": "98",
        "pubType": "fla",
        "prism:coverDisplayDate": "February 2013",
        "prism:doi": "10.1016/j.molcata.2012.11.001",
        "prism:startingPage": "89",
        "dc:identifier": "doi:10.1016/j.molcata.2012.11.001",
        "openaccessSponsorName": null
      },
      "objects": {
        "object": [
          {
            "@category": "thumbnail",
            "@height": "38",
            "@width": "357",
            "@_fa": "true",
            "$": "https://api.elsevier.com/content/object/eid/1-s2.0-S1381116912003603-si3.gif?httpAccept=%2A%2F%2A",
            "@multimediatype": "GIF image file",
            "@type": "ALTIMG",
            "@size": "2016",
            "@ref": "si3",
            "@mimetype": "image/gif"
          },
          {
            "@category": "thumbnail",
            "@height": "38",
            "@width": "392",
            "@_fa": "true",
            "$": "https://api.elsevier.com/content/object/eid/1-s2.0-S1381116912003603-si2.gif?httpAccept=%2A%2F%2A",
            "@multimediatype": "GIF image file",
            "@type": "ALTIMG",
            "@size": "2285",
            "@ref": "si2",
            "@mimetype": "image/gif"
          },
          {
            "@category": "thumbnail",
            "@height": "41",
            "@width": "103",
            "@_fa": "true",
            "$": "https://api.elsevier.com/content/object/eid/1-s2.0-S1381116912003603-si1.gif?httpAccept=%2A%2F%2A",
            "@multimediatype": "GIF image file",
            "@type": "ALTIMG",
            "@size": "628",
            "@ref": "si1",
            "@mimetype": "image/gif"
          },
          {
            "@category": "high",
            "@height": "886",
            "@width": "2124",
            "@_fa": "true",
            "$": "https://api.elsevier.com/content/object/eid/1-s2.0-S1381116912003603-fx1_lrg.jpg?httpAccept=%2A%2F%2A",
            "@multimediatype": "JPEG image file",
            "@type": "IMAGE-HIGH-RES",
            "@size": "163223",
            "@ref": "fx1",
            "@mimetype": "image/jpeg"
          },
          {
            "@category": "high",
            "@height": "1169",
            "@width": "1749",
            "@_fa": "true",
            "$": "https://api.elsevier.com/content/object/eid/1-s2.0-S1381116912003603-gr9_lrg.jpg?httpAccept=%2A%2F%2A",
            "@multimediatype": "JPEG image file",
            "@type": "IMAGE-HIGH-RES",
            "@size": "274061",
            "@ref": "gr9",
            "@mimetype": "image/jpeg"
          },
          {
            "@category": "high",
            "@height": "1303",
            "@width": "2092",
            "@_fa": "true",
            "$": "https://api.elsevier.com/content/object/eid/1-s2.0-S1381116912003603-gr8_lrg.jpg?httpAccept=%2A%2F%2A",
            "@multimediatype": "JPEG image file",
            "@type": "IMAGE-HIGH-RES",
            "@size": "242191",
            "@ref": "gr8",
            "@mimetype": "image/jpeg"
          },
          {
            "@category": "high",
            "@height": "1156",
            "@width": "2258",
            "@_fa": "true",
            "$": "https://api.elsevier.com/content/object/eid/1-s2.0-S1381116912003603-gr5_lrg.jpg?httpAccept=%2A%2F%2A",
            "@multimediatype": "JPEG image file",
            "@type": "IMAGE-HIGH-RES",
            "@size": "204472",
            "@ref": "gr5",
            "@mimetype": "image/jpeg"
          },
          {
            "@category": "high",
            "@height": "1162",
            "@width": "1742",
            "@_fa": "true",
            "$": "https://api.elsevier.com/content/object/eid/1-s2.0-S1381116912003603-gr3_lrg.jpg?httpAccept=%2A%2F%2A",
            "@multimediatype": "JPEG image file",
            "@type": "IMAGE-HIGH-RES",
            "@size": "155531",
            "@ref": "gr3",
            "@mimetype": "image/jpeg"
          },
          {
            "@category": "high",
            "@height": "937",
            "@width": "2206",
            "@_fa": "true",
            "$": "https://api.elsevier.com/content/object/eid/1-s2.0-S1381116912003603-gr7_lrg.jpg?httpAccept=%2A%2F%2A",
            "@multimediatype": "JPEG image file",
            "@type": "IMAGE-HIGH-RES",
            "@size": "172760",
            "@ref": "gr7",
            "@mimetype": "image/jpeg"
          },
          {
            "@category": "high",
            "@height": "938",
            "@width": "1663",
            "@_fa": "true",
            "$": "https://api.elsevier.com/content/object/eid/1-s2.0-S1381116912003603-gr6_lrg.jpg?httpAccept=%2A%2F%2A",
            "@multimediatype": "JPEG image file",
            "@type": "IMAGE-HIGH-RES",
            "@size": "72463",
            "@ref": "gr6",
            "@mimetype": "image/jpeg"
          },
          {
            "@category": "high",
            "@height": "1167",
            "@width": "1742",
            "@_fa": "true",
            "$": "https://api.elsevier.com/content/object/eid/1-s2.0-S1381116912003603-gr4_lrg.jpg?httpAccept=%2A%2F%2A",
            "@multimediatype": "JPEG image file",
            "@type": "IMAGE-HIGH-RES",
            "@size": "172147",
            "@ref": "gr4",
            "@mimetype": "image/jpeg"
          },
          {
            "@category": "high",
            "@height": "1406",
            "@width": "2110",
            "@_fa": "true",
            "$": "https://api.elsevier.com/content/object/eid/1-s2.0-S1381116912003603-gr2_lrg.jpg?httpAccept=%2A%2F%2A",
            "@multimediatype": "JPEG image file",
            "@type": "IMAGE-HIGH-RES",
            "@size": "281956",
            "@ref": "gr2",
            "@mimetype": "image/jpeg"
          },
          {
            "@category": "high",
            "@height": "1774",
            "@width": "2859",
            "@_fa": "true",
            "$": "https://api.elsevier.com/content/object/eid/1-s2.0-S1381116912003603-gr1_lrg.jpg?httpAccept=%2A%2F%2A",
            "@multimediatype": "JPEG image file",
            "@type": "IMAGE-HIGH-RES",
            "@size": "288350",
            "@ref": "gr1",
            "@mimetype": "image/jpeg"
          },
          {
            "@category": "standard",
            "@height": "200",
            "@width": "480",
            "@_fa": "true",
            "$": "https://api.elsevier.com/content/object/eid/1-s2.0-S1381116912003603-fx1.jpg?httpAccept=%2A%2F%2A",
            "@multimediatype": "JPEG image file",
            "@type": "IMAGE-DOWNSAMPLED",
            "@size": "19765",
            "@ref": "fx1",
            "@mimetype": "image/jpeg"
          },
          {
            "@category": "standard",
            "@height": "264",
            "@width": "395",
            "@_fa": "true",
            "$": "https://api.elsevier.com/content/object/eid/1-s2.0-S1381116912003603-gr9.jpg?httpAccept=%2A%2F%2A",
            "@multimediatype": "JPEG image file",
            "@type": "IMAGE-DOWNSAMPLED",
            "@size": "37456",
            "@ref": "gr9",
            "@mimetype": "image/jpeg"
          },
          {
            "@category": "standard",
            "@height": "294",
            "@width": "472",
            "@_fa": "true",
            "$": "https://api.elsevier.com/content/object/eid/1-s2.0-S1381116912003603-gr8.jpg?httpAccept=%2A%2F%2A",
            "@multimediatype": "JPEG image file",
            "@type": "IMAGE-DOWNSAMPLED",
            "@size": "38568",
            "@ref": "gr8",
            "@mimetype": "image/jpeg"
          },
          {
            "@category": "standard",
            "@height": "261",
            "@width": "510",
            "@_fa": "true",
            "$": "https://api.elsevier.com/content/object/eid/1-s2.0-S1381116912003603-gr5.jpg?httpAccept=%2A%2F%2A",
            "@multimediatype": "JPEG image file",
            "@type": "IMAGE-DOWNSAMPLED",
            "@size": "31121",
            "@ref": "gr5",
            "@mimetype": "image/jpeg"
          },
          {
            "@category": "standard",
            "@height": "262",
            "@width": "393",
            "@_fa": "true",
            "$": "https://api.elsevier.com/content/object/eid/1-s2.0-S1381116912003603-gr3.jpg?httpAccept=%2A%2F%2A",
            "@multimediatype": "JPEG image file",
            "@type": "IMAGE-DOWNSAMPLED",
            "@size": "29167",
            "@ref": "gr3",
            "@mimetype": "image/jpeg"
          },
          {
            "@category": "standard",
            "@height": "212",
            "@width": "498",
            "@_fa": "true",
            "$": "https://api.elsevier.com/content/object/eid/1-s2.0-S1381116912003603-gr7.jpg?httpAccept=%2A%2F%2A",
            "@multimediatype": "JPEG image file",
            "@type": "IMAGE-DOWNSAMPLED",
            "@size": "20730",
            "@ref": "gr7",
            "@mimetype": "image/jpeg"
          },
          {
            "@category": "standard",
            "@height": "212",
            "@width": "375",
            "@_fa": "true",
            "$": "https://api.elsevier.com/content/object/eid/1-s2.0-S1381116912003603-gr6.jpg?httpAccept=%2A%2F%2A",
            "@multimediatype": "JPEG image file",
            "@type": "IMAGE-DOWNSAMPLED",
            "@size": "10569",
            "@ref": "gr6",
            "@mimetype": "image/jpeg"
          },
          {
            "@category": "standard",
            "@height": "263",
            "@width": "393",
            "@_fa": "true",
            "$": "https://api.elsevier.com/content/object/eid/1-s2.0-S1381116912003603-gr4.jpg?httpAccept=%2A%2F%2A",
            "@multimediatype": "JPEG image file",
            "@type": "IMAGE-DOWNSAMPLED",
            "@size": "19956",
            "@ref": "gr4",
            "@mimetype": "image/jpeg"
          },
          {
            "@category": "standard",
            "@height": "317",
            "@width": "476",
            "@_fa": "true",
            "$": "https://api.elsevier.com/content/object/eid/1-s2.0-S1381116912003603-gr2.jpg?httpAccept=%2A%2F%2A",
            "@multimediatype": "JPEG image file",
            "@type": "IMAGE-DOWNSAMPLED",
            "@size": "35166",
            "@ref": "gr2",
            "@mimetype": "image/jpeg"
          },
          {
            "@category": "standard",
            "@height": "401",
            "@width": "646",
            "@_fa": "true",
            "$": "https://api.elsevier.com/content/object/eid/1-s2.0-S1381116912003603-gr1.jpg?httpAccept=%2A%2F%2A",
            "@multimediatype": "JPEG image file",
            "@type": "IMAGE-DOWNSAMPLED",
            "@size": "33581",
            "@ref": "gr1",
            "@mimetype": "image/jpeg"
          },
          {
            "@category": "thumbnail",
            "@height": "91",
            "@width": "219",
            "@_fa": "true",
            "$": "https://api.elsevier.com/content/object/eid/1-s2.0-S1381116912003603-fx1.sml?httpAccept=%2A%2F%2A",
            "@multimediatype": "GIF image file",
            "@type": "IMAGE-THUMBNAIL",
            "@size": "4176",
            "@ref": "fx1",
            "@mimetype": "image/gif"
          },
          {
            "@category": "thumbnail",
            "@height": "146",
            "@width": "219",
            "@_fa": "true",
            "$": "https://api.elsevier.com/content/object/eid/1-s2.0-S1381116912003603-gr9.sml?httpAccept=%2A%2F%2A",
            "@multimediatype": "GIF image file",
            "@type": "IMAGE-THUMBNAIL",
            "@size": "6287",
            "@ref": "gr9",
            "@mimetype": "image/gif"
          },
          {
            "@category": "thumbnail",
            "@height": "136",
            "@width": "219",
            "@_fa": "true",
            "$": "https://api.elsevier.com/content/object/eid/1-s2.0-S1381116912003603-gr8.sml?httpAccept=%2A%2F%2A",
            "@multimediatype": "GIF image file",
            "@type": "IMAGE-THUMBNAIL",
            "@size": "5393",
            "@ref": "gr8",
            "@mimetype": "image/gif"
          },
          {
            "@category": "thumbnail",
            "@height": "112",
            "@width": "219",
            "@_fa": "true",
            "$": "https://api.elsevier.com/content/object/eid/1-s2.0-S1381116912003603-gr5.sml?httpAccept=%2A%2F%2A",
            "@multimediatype": "GIF image file",
            "@type": "IMAGE-THUMBNAIL",
            "@size": "3614",
            "@ref": "gr5",
            "@mimetype": "image/gif"
          },
          {
            "@category": "thumbnail",
            "@height": "146",
            "@width": "219",
            "@_fa": "true",
            "$": "https://api.elsevier.com/content/object/eid/1-s2.0-S1381116912003603-gr3.sml?httpAccept=%2A%2F%2A",
            "@multimediatype": "GIF image file",
            "@type": "IMAGE-THUMBNAIL",
            "@size": "3327",
            "@ref": "gr3",
            "@mimetype": "image/gif"
          },
          {
            "@category": "thumbnail",
            "@height": "93",
            "@width": "219",
            "@_fa": "true",
            "$": "https://api.elsevier.com/content/object/eid/1-s2.0-S1381116912003603-gr7.sml?httpAccept=%2A%2F%2A",
            "@multimediatype": "GIF image file",
            "@type": "IMAGE-THUMBNAIL",
            "@size": "3667",
            "@ref": "gr7",
            "@mimetype": "image/gif"
          },
          {
            "@category": "thumbnail",
            "@height": "124",
            "@width": "219",
            "@_fa": "true",
            "$": "https://api.elsevier.com/content/object/eid/1-s2.0-S1381116912003603-gr6.sml?httpAccept=%2A%2F%2A",
            "@multimediatype": "GIF image file",
            "@type": "IMAGE-THUMBNAIL",
            "@size": "5682",
            "@ref": "gr6",
            "@mimetype": "image/gif"
          },
          {
            "@category": "thumbnail",
            "@height": "147",
            "@width": "219",
            "@_fa": "true",
            "$": "https://api.elsevier.com/content/object/eid/1-s2.0-S1381116912003603-gr4.sml?httpAccept=%2A%2F%2A",
            "@multimediatype": "GIF image file",
            "@type": "IMAGE-THUMBNAIL",
            "@size": "5015",
            "@ref": "gr4",
            "@mimetype": "image/gif"
          },
          {
            "@category": "thumbnail",
            "@height": "146",
            "@width": "219",
            "@_fa": "true",
            "$": "https://api.elsevier.com/content/object/eid/1-s2.0-S1381116912003603-gr2.sml?httpAccept=%2A%2F%2A",
            "@multimediatype": "GIF image file",
            "@type": "IMAGE-THUMBNAIL",
            "@size": "6550",
            "@ref": "gr2",
            "@mimetype": "image/gif"
          },
          {
            "@category": "thumbnail",
            "@height": "136",
            "@width": "219",
            "@_fa": "true",
            "$": "https://api.elsevier.com/content/object/eid/1-s2.0-S1381116912003603-gr1.sml?httpAccept=%2A%2F%2A",
            "@multimediatype": "GIF image file",
            "@type": "IMAGE-THUMBNAIL",
            "@size": "3386",
            "@ref": "gr1",
            "@mimetype": "image/gif"
          }
        ]
      },
      "link": {
        "@rel": "abstract",
        "@href": "https://api.elsevier.com/content/abstract/scopus_id/84871719329"
      }
    }
  }
}