{
  "metadata": {
    "title": "Methanol assisted methane conversion for higher hydrocarbon over bifunctional Zn-modified Mo/HZSM-5 catalyst",
    "authors": "; ; ",
    "journal": "Journal of Molecular Catalysis A: Chemical",
    "date": "2015-03-31",
    "doi": "10.1016/j.molcata.2014.12.019",
    "abstract": "",
    "uri": "https://api.elsevier.com/content/article/pii/S1381116914005792",
    "pii": "S1381116914005792"
  },
  "fulltext": {
    "full-text-retrieval-response": {
      "scopus-eid": "2-s2.0-84920903243",
      "originalText": "serial JL 271358 291210 291744 291790 291809 31 Journal of Molecular Catalysis A: Chemical JOURNALMOLECULARCATALYSISACHEMICAL 2014-12-31 2014-12-31 2015-02-25T12:51:39 1-s2.0-S1381116914005792 S1381-1169(14)00579-2 S1381116914005792 10.1016/j.molcata.2014.12.019 S300 S300.1 FULL-TEXT 1-s2.0-S1381116914X00142 2015-05-15T05:56:33.63776-04:00 0 0 20150301 20150331 2015 2014-12-31T16:59:08.307237Z absattachment articleinfo articletitlenorm authfirstinitialnorm authfirstsurnamenorm cid cids contenttype copyright crossmark dateloaded dateloadedtxt datesearch datesort dateupdated dco docsubtype doctype doi eid ewtransactionid hubeid indexeddate issn issnnorm itemstage itemtransactionid itemweight openaccess openarchive pg pgfirst pglast pii piinorm pubdateend pubdatestart pubdatetxt pubyr sectiontitle sortorder srctitle srctitlenorm srctype ssids alllist content subj subheadings suppl tomb volfirst volissue volumelist webpdf webpdfpagecount yearnav figure table body mmlmath acknowledge affil articletitle auth authfirstini authfull authkeywords authlast highlightsabst primabst ref specialabst 1381-1169 13811169 true 398 398 C Volume 398 47 368 375 368 375 201503 March 2015 2015-03-01 2015-03-31 2015 Regular Papers article fla Copyright © 2014 Elsevier B.V. All rights reserved. METHANOLASSISTEDMETHANECONVERSIONFORHIGHERHYDROCARBONOVERBIFUNCTIONALZNMODIFIEDMOHZSM5CATALYST MAJHI S 1 Introduction 2 Experimental 2.1 Catalyst preparation 2.2 Catalyst characterization 2.3 Catalytic activity test 3 Results and discussion 3.1 Surface area and pore volume of catalysts 3.2 TPR, chemisorption, and TPD analysis 3.3 Catalyst morphology 3.3.1 XRD analysis 3.4 SEM–EDX and TEM analyses 3.5 FT-IR analysis 3.6 Synthesis and product selectivity 3.7 TGA analysis of spent catalyst 4 Conclusion Acknowledgement References LIU 2008 7 J ALVAREZGALVAN 2011 15 M LUNSFORD 2000 165 J WANG 1997 173 L ZHANG 2003 145 Y CHOUDHARY 1996 2545 V CHOUDHARY 2005 4381 V MERIAUDEAU 1999 469 P BOUCHY 2000 283 C LIU 1997 257 W MATUS 2007 4063 E HA 2002 283 V IGLESIA 1997 339 E ZHANG 1998 207 C ENEIN 2011 3040 A JIANG 1999 95 H GUNTER 2001 133 M HOELDERICH 1999 257 W GRZECHOWIAK 2001 225 J LIU 2011 16954 B OVARI 2004 35 L XU 1996 207 Y XUA 2012 41 Y ZAIDI 2004 155 H ZAIDI 2008 2970 H MAJHIX2015X368 MAJHIX2015X368X375 MAJHIX2015X368XS MAJHIX2015X368X375XS item S1381-1169(14)00579-2 S1381116914005792 1-s2.0-S1381116914005792 10.1016/j.molcata.2014.12.019 271358 2015-02-25T12:06:24.660342-05:00 2015-03-01 2015-03-31 1-s2.0-S1381116914005792-main.pdf https://s3.amazonaws.com/prod-ucs-content-store-us-east/content/pii:S1381116914005792/MAIN/application/pdf/cb54e7e9b14ecdf588a3b62288f2c8fe/main.pdf https://s3-eu-west-1.amazonaws.com/prod-ucs-content-store-eu-west/content/pii:S1381116914005792/MAIN/application/pdf/cb54e7e9b14ecdf588a3b62288f2c8fe/main.pdf main.pdf pdf true 2245153 MAIN 8 1-s2.0-S1381116914005792-main_1.png https://s3-eu-west-1.amazonaws.com/prod-ucs-content-store-eu-west/content/pii:S1381116914005792/PREVIEW/image/png/6491d5d63e21d881a3a629e0cfd829f4/main_1.png https://s3.amazonaws.com/prod-ucs-content-store-us-east/content/pii:S1381116914005792/PREVIEW/image/png/6491d5d63e21d881a3a629e0cfd829f4/main_1.png main_1.png png 58452 849 656 IMAGE-WEB-PDF 1 1-s2.0-S1381116914005792-si8.gif https://s3.amazonaws.com/prod-ucs-content-store-us-east/content/pii:S1381116914005792/STRIPIN/image/gif/4434994f53c040e8fb398451adda1b2a/si8.gif https://s3-eu-west-1.amazonaws.com/prod-ucs-content-store-eu-west/content/pii:S1381116914005792/STRIPIN/image/gif/4434994f53c040e8fb398451adda1b2a/si8.gif si8 si8.gif gif 3493 88 445 ALTIMG 1-s2.0-S1381116914005792-si7.gif https://s3.amazonaws.com/prod-ucs-content-store-us-east/content/pii:S1381116914005792/STRIPIN/image/gif/250158efa5821a81479ad58ea14f61d2/si7.gif https://s3-eu-west-1.amazonaws.com/prod-ucs-content-store-eu-west/content/pii:S1381116914005792/STRIPIN/image/gif/250158efa5821a81479ad58ea14f61d2/si7.gif si7 si7.gif gif 3344 89 471 ALTIMG 1-s2.0-S1381116914005792-si6.gif https://s3.amazonaws.com/prod-ucs-content-store-us-east/content/pii:S1381116914005792/STRIPIN/image/gif/f3f429cda531b5c80cc4fd2c1e972e86/si6.gif https://s3-eu-west-1.amazonaws.com/prod-ucs-content-store-eu-west/content/pii:S1381116914005792/STRIPIN/image/gif/f3f429cda531b5c80cc4fd2c1e972e86/si6.gif si6 si6.gif gif 1790 54 378 ALTIMG 1-s2.0-S1381116914005792-si5.gif https://s3.amazonaws.com/prod-ucs-content-store-us-east/content/pii:S1381116914005792/STRIPIN/image/gif/1ccb33d2699c1a66563362d2b01112fc/si5.gif https://s3-eu-west-1.amazonaws.com/prod-ucs-content-store-eu-west/content/pii:S1381116914005792/STRIPIN/image/gif/1ccb33d2699c1a66563362d2b01112fc/si5.gif si5 si5.gif gif 485 15 145 ALTIMG 1-s2.0-S1381116914005792-si4.gif https://s3.amazonaws.com/prod-ucs-content-store-us-east/content/pii:S1381116914005792/STRIPIN/image/gif/12967f535f59916268604ed1e9a2da41/si4.gif https://s3-eu-west-1.amazonaws.com/prod-ucs-content-store-eu-west/content/pii:S1381116914005792/STRIPIN/image/gif/12967f535f59916268604ed1e9a2da41/si4.gif si4 si4.gif gif 859 31 213 ALTIMG 1-s2.0-S1381116914005792-si3.gif https://s3.amazonaws.com/prod-ucs-content-store-us-east/content/pii:S1381116914005792/STRIPIN/image/gif/ca39488a51d22020f39af18ba05770f6/si3.gif https://s3-eu-west-1.amazonaws.com/prod-ucs-content-store-eu-west/content/pii:S1381116914005792/STRIPIN/image/gif/ca39488a51d22020f39af18ba05770f6/si3.gif si3 si3.gif gif 1633 28 350 ALTIMG 1-s2.0-S1381116914005792-si2.gif https://s3.amazonaws.com/prod-ucs-content-store-us-east/content/pii:S1381116914005792/STRIPIN/image/gif/ec956073e1a4ac1adfd382975df269d2/si2.gif https://s3-eu-west-1.amazonaws.com/prod-ucs-content-store-eu-west/content/pii:S1381116914005792/STRIPIN/image/gif/ec956073e1a4ac1adfd382975df269d2/si2.gif si2 si2.gif gif 481 15 145 ALTIMG 1-s2.0-S1381116914005792-si1.gif https://s3.amazonaws.com/prod-ucs-content-store-us-east/content/pii:S1381116914005792/STRIPIN/image/gif/0340f695ac1809901a1645e86277fc43/si1.gif https://s3-eu-west-1.amazonaws.com/prod-ucs-content-store-eu-west/content/pii:S1381116914005792/STRIPIN/image/gif/0340f695ac1809901a1645e86277fc43/si1.gif si1 si1.gif gif 976 24 252 ALTIMG 1-s2.0-S1381116914005792-gr9_lrg.jpg https://s3.amazonaws.com/prod-ucs-content-store-us-east/content/pii:S1381116914005792/gr9/HIGHRES/image/jpeg/7b3a8c9f4f6f0c868f8791a02d379271/gr9_lrg.jpg https://s3-eu-west-1.amazonaws.com/prod-ucs-content-store-eu-west/content/pii:S1381116914005792/gr9/HIGHRES/image/jpeg/7b3a8c9f4f6f0c868f8791a02d379271/gr9_lrg.jpg gr9 gr9_lrg.jpg jpg 396549 2324 3000 IMAGE-HIGH-RES 1-s2.0-S1381116914005792-gr8_lrg.jpg https://s3.amazonaws.com/prod-ucs-content-store-us-east/content/pii:S1381116914005792/gr8/HIGHRES/image/jpeg/7d949ccf0c6ce15efcb64476f939a991/gr8_lrg.jpg https://s3-eu-west-1.amazonaws.com/prod-ucs-content-store-eu-west/content/pii:S1381116914005792/gr8/HIGHRES/image/jpeg/7d949ccf0c6ce15efcb64476f939a991/gr8_lrg.jpg gr8 gr8_lrg.jpg jpg 147111 994 1250 IMAGE-HIGH-RES 1-s2.0-S1381116914005792-gr7_lrg.jpg https://s3.amazonaws.com/prod-ucs-content-store-us-east/content/pii:S1381116914005792/gr7/HIGHRES/image/jpeg/34601e83883f7334bd01b05198e16fec/gr7_lrg.jpg https://s3-eu-west-1.amazonaws.com/prod-ucs-content-store-eu-west/content/pii:S1381116914005792/gr7/HIGHRES/image/jpeg/34601e83883f7334bd01b05198e16fec/gr7_lrg.jpg gr7 gr7_lrg.jpg jpg 979587 1248 2500 IMAGE-HIGH-RES 1-s2.0-S1381116914005792-gr6_lrg.jpg https://s3.amazonaws.com/prod-ucs-content-store-us-east/content/pii:S1381116914005792/gr6/HIGHRES/image/jpeg/0a2b3c4f75d4a836aa6990d94bf28ef8/gr6_lrg.jpg https://s3-eu-west-1.amazonaws.com/prod-ucs-content-store-eu-west/content/pii:S1381116914005792/gr6/HIGHRES/image/jpeg/0a2b3c4f75d4a836aa6990d94bf28ef8/gr6_lrg.jpg gr6 gr6_lrg.jpg jpg 820631 1484 3333 IMAGE-HIGH-RES 1-s2.0-S1381116914005792-gr5_lrg.jpg https://s3.amazonaws.com/prod-ucs-content-store-us-east/content/pii:S1381116914005792/gr5/HIGHRES/image/jpeg/0b0c7eb264e924f656deb3be4ad4c3ab/gr5_lrg.jpg https://s3-eu-west-1.amazonaws.com/prod-ucs-content-store-eu-west/content/pii:S1381116914005792/gr5/HIGHRES/image/jpeg/0b0c7eb264e924f656deb3be4ad4c3ab/gr5_lrg.jpg gr5 gr5_lrg.jpg jpg 132276 1124 1250 IMAGE-HIGH-RES 1-s2.0-S1381116914005792-gr4_lrg.jpg https://s3.amazonaws.com/prod-ucs-content-store-us-east/content/pii:S1381116914005792/gr4/HIGHRES/image/jpeg/fc99a15270b1255909659e487193a575/gr4_lrg.jpg https://s3-eu-west-1.amazonaws.com/prod-ucs-content-store-eu-west/content/pii:S1381116914005792/gr4/HIGHRES/image/jpeg/fc99a15270b1255909659e487193a575/gr4_lrg.jpg gr4 gr4_lrg.jpg jpg 138255 1062 1250 IMAGE-HIGH-RES 1-s2.0-S1381116914005792-gr3_lrg.jpg https://s3.amazonaws.com/prod-ucs-content-store-us-east/content/pii:S1381116914005792/gr3/HIGHRES/image/jpeg/ec337bb7920233f00eeb8dc58c6cfc0d/gr3_lrg.jpg https://s3-eu-west-1.amazonaws.com/prod-ucs-content-store-eu-west/content/pii:S1381116914005792/gr3/HIGHRES/image/jpeg/ec337bb7920233f00eeb8dc58c6cfc0d/gr3_lrg.jpg gr3 gr3_lrg.jpg jpg 108066 1100 1250 IMAGE-HIGH-RES 1-s2.0-S1381116914005792-gr2_lrg.jpg https://s3.amazonaws.com/prod-ucs-content-store-us-east/content/pii:S1381116914005792/gr2/HIGHRES/image/jpeg/62579d3ecf14516d958865c260a27996/gr2_lrg.jpg https://s3-eu-west-1.amazonaws.com/prod-ucs-content-store-eu-west/content/pii:S1381116914005792/gr2/HIGHRES/image/jpeg/62579d3ecf14516d958865c260a27996/gr2_lrg.jpg gr2 gr2_lrg.jpg jpg 423694 1965 2500 IMAGE-HIGH-RES 1-s2.0-S1381116914005792-gr10_lrg.jpg https://s3.amazonaws.com/prod-ucs-content-store-us-east/content/pii:S1381116914005792/gr10/HIGHRES/image/jpeg/cc54099a8ce2f4f38b170bddd2dc499c/gr10_lrg.jpg https://s3-eu-west-1.amazonaws.com/prod-ucs-content-store-eu-west/content/pii:S1381116914005792/gr10/HIGHRES/image/jpeg/cc54099a8ce2f4f38b170bddd2dc499c/gr10_lrg.jpg gr10 gr10_lrg.jpg jpg 107820 1051 1250 IMAGE-HIGH-RES 1-s2.0-S1381116914005792-gr1_lrg.jpg https://s3.amazonaws.com/prod-ucs-content-store-us-east/content/pii:S1381116914005792/gr1/HIGHRES/image/jpeg/f66dfebde1e73f4456f8c988309af06f/gr1_lrg.jpg https://s3-eu-west-1.amazonaws.com/prod-ucs-content-store-eu-west/content/pii:S1381116914005792/gr1/HIGHRES/image/jpeg/f66dfebde1e73f4456f8c988309af06f/gr1_lrg.jpg gr1 gr1_lrg.jpg jpg 351814 1583 3333 IMAGE-HIGH-RES 1-s2.0-S1381116914005792-fx1_lrg.jpg https://s3.amazonaws.com/prod-ucs-content-store-us-east/content/pii:S1381116914005792/fx1/HIGHRES/image/jpeg/0a87764122cbe642f9cbe1162174f519/fx1_lrg.jpg https://s3-eu-west-1.amazonaws.com/prod-ucs-content-store-eu-west/content/pii:S1381116914005792/fx1/HIGHRES/image/jpeg/0a87764122cbe642f9cbe1162174f519/fx1_lrg.jpg fx1 true fx1_lrg.jpg jpg 138895 886 2213 IMAGE-HIGH-RES 1-s2.0-S1381116914005792-gr9.jpg https://s3.amazonaws.com/prod-ucs-content-store-us-east/content/pii:S1381116914005792/gr9/DOWNSAMPLED/image/jpeg/c0591a33a36bb7cc2d974a4ae963959e/gr9.jpg https://s3-eu-west-1.amazonaws.com/prod-ucs-content-store-eu-west/content/pii:S1381116914005792/gr9/DOWNSAMPLED/image/jpeg/c0591a33a36bb7cc2d974a4ae963959e/gr9.jpg gr9 gr9.jpg jpg 55297 525 678 IMAGE-DOWNSAMPLED 1-s2.0-S1381116914005792-gr8.jpg https://s3.amazonaws.com/prod-ucs-content-store-us-east/content/pii:S1381116914005792/gr8/DOWNSAMPLED/image/jpeg/b329380157f8049316049b350ee597e4/gr8.jpg https://s3-eu-west-1.amazonaws.com/prod-ucs-content-store-eu-west/content/pii:S1381116914005792/gr8/DOWNSAMPLED/image/jpeg/b329380157f8049316049b350ee597e4/gr8.jpg gr8 gr8.jpg jpg 15930 224 282 IMAGE-DOWNSAMPLED 1-s2.0-S1381116914005792-gr7.jpg https://s3.amazonaws.com/prod-ucs-content-store-us-east/content/pii:S1381116914005792/gr7/DOWNSAMPLED/image/jpeg/0a7a52204a5ff43cb43b449fb5437351/gr7.jpg https://s3-eu-west-1.amazonaws.com/prod-ucs-content-store-eu-west/content/pii:S1381116914005792/gr7/DOWNSAMPLED/image/jpeg/0a7a52204a5ff43cb43b449fb5437351/gr7.jpg gr7 gr7.jpg jpg 44843 282 565 IMAGE-DOWNSAMPLED 1-s2.0-S1381116914005792-gr6.jpg https://s3.amazonaws.com/prod-ucs-content-store-us-east/content/pii:S1381116914005792/gr6/DOWNSAMPLED/image/jpeg/feaf6b2cfadb691e2303b850362f7b37/gr6.jpg https://s3-eu-west-1.amazonaws.com/prod-ucs-content-store-eu-west/content/pii:S1381116914005792/gr6/DOWNSAMPLED/image/jpeg/feaf6b2cfadb691e2303b850362f7b37/gr6.jpg gr6 gr6.jpg jpg 80621 335 753 IMAGE-DOWNSAMPLED 1-s2.0-S1381116914005792-gr5.jpg https://s3.amazonaws.com/prod-ucs-content-store-us-east/content/pii:S1381116914005792/gr5/DOWNSAMPLED/image/jpeg/d88d3c9a352dc469d67ab6a42c6e0c81/gr5.jpg https://s3-eu-west-1.amazonaws.com/prod-ucs-content-store-eu-west/content/pii:S1381116914005792/gr5/DOWNSAMPLED/image/jpeg/d88d3c9a352dc469d67ab6a42c6e0c81/gr5.jpg gr5 gr5.jpg jpg 14767 254 282 IMAGE-DOWNSAMPLED 1-s2.0-S1381116914005792-gr4.jpg https://s3.amazonaws.com/prod-ucs-content-store-us-east/content/pii:S1381116914005792/gr4/DOWNSAMPLED/image/jpeg/f32e71789775c9420fb9f1bb1bfcbe2a/gr4.jpg https://s3-eu-west-1.amazonaws.com/prod-ucs-content-store-eu-west/content/pii:S1381116914005792/gr4/DOWNSAMPLED/image/jpeg/f32e71789775c9420fb9f1bb1bfcbe2a/gr4.jpg gr4 gr4.jpg jpg 16863 240 282 IMAGE-DOWNSAMPLED 1-s2.0-S1381116914005792-gr3.jpg https://s3.amazonaws.com/prod-ucs-content-store-us-east/content/pii:S1381116914005792/gr3/DOWNSAMPLED/image/jpeg/8eb79132d7fafdd5721b1949df8ad39b/gr3.jpg https://s3-eu-west-1.amazonaws.com/prod-ucs-content-store-eu-west/content/pii:S1381116914005792/gr3/DOWNSAMPLED/image/jpeg/8eb79132d7fafdd5721b1949df8ad39b/gr3.jpg gr3 gr3.jpg jpg 13540 248 282 IMAGE-DOWNSAMPLED 1-s2.0-S1381116914005792-gr2.jpg https://s3.amazonaws.com/prod-ucs-content-store-us-east/content/pii:S1381116914005792/gr2/DOWNSAMPLED/image/jpeg/6965440fda75fffd7868a69621d99e40/gr2.jpg https://s3-eu-west-1.amazonaws.com/prod-ucs-content-store-eu-west/content/pii:S1381116914005792/gr2/DOWNSAMPLED/image/jpeg/6965440fda75fffd7868a69621d99e40/gr2.jpg gr2 gr2.jpg jpg 50808 444 565 IMAGE-DOWNSAMPLED 1-s2.0-S1381116914005792-gr10.jpg https://s3.amazonaws.com/prod-ucs-content-store-us-east/content/pii:S1381116914005792/gr10/DOWNSAMPLED/image/jpeg/bb950eb62676ae21dc07dea44cbe2abe/gr10.jpg https://s3-eu-west-1.amazonaws.com/prod-ucs-content-store-eu-west/content/pii:S1381116914005792/gr10/DOWNSAMPLED/image/jpeg/bb950eb62676ae21dc07dea44cbe2abe/gr10.jpg gr10 gr10.jpg jpg 13134 237 282 IMAGE-DOWNSAMPLED 1-s2.0-S1381116914005792-gr1.jpg https://s3.amazonaws.com/prod-ucs-content-store-us-east/content/pii:S1381116914005792/gr1/DOWNSAMPLED/image/jpeg/3482ed1c423c4648ab3f02d0aaac74cd/gr1.jpg https://s3-eu-west-1.amazonaws.com/prod-ucs-content-store-eu-west/content/pii:S1381116914005792/gr1/DOWNSAMPLED/image/jpeg/3482ed1c423c4648ab3f02d0aaac74cd/gr1.jpg gr1 gr1.jpg jpg 42889 358 753 IMAGE-DOWNSAMPLED 1-s2.0-S1381116914005792-fx1.jpg https://s3.amazonaws.com/prod-ucs-content-store-us-east/content/pii:S1381116914005792/fx1/DOWNSAMPLED/image/jpeg/6f7639c338fffafef50af3d004722ec2/fx1.jpg https://s3-eu-west-1.amazonaws.com/prod-ucs-content-store-eu-west/content/pii:S1381116914005792/fx1/DOWNSAMPLED/image/jpeg/6f7639c338fffafef50af3d004722ec2/fx1.jpg fx1 true fx1.jpg jpg 15589 200 500 IMAGE-DOWNSAMPLED 1-s2.0-S1381116914005792-gr9.sml https://s3.amazonaws.com/prod-ucs-content-store-us-east/content/pii:S1381116914005792/gr9/THUMBNAIL/image/gif/279af710b2429f7648642fa543ca204d/gr9.sml https://s3-eu-west-1.amazonaws.com/prod-ucs-content-store-eu-west/content/pii:S1381116914005792/gr9/THUMBNAIL/image/gif/279af710b2429f7648642fa543ca204d/gr9.sml gr9 gr9.sml sml 4474 164 212 IMAGE-THUMBNAIL 1-s2.0-S1381116914005792-gr8.sml https://s3.amazonaws.com/prod-ucs-content-store-us-east/content/pii:S1381116914005792/gr8/THUMBNAIL/image/gif/8c01792db4d079cc3a51c69dfbdb98c0/gr8.sml https://s3-eu-west-1.amazonaws.com/prod-ucs-content-store-eu-west/content/pii:S1381116914005792/gr8/THUMBNAIL/image/gif/8c01792db4d079cc3a51c69dfbdb98c0/gr8.sml gr8 gr8.sml sml 5551 164 206 IMAGE-THUMBNAIL 1-s2.0-S1381116914005792-gr7.sml https://s3.amazonaws.com/prod-ucs-content-store-us-east/content/pii:S1381116914005792/gr7/THUMBNAIL/image/gif/2366ad704ff73abfd6c5311a10047451/gr7.sml https://s3-eu-west-1.amazonaws.com/prod-ucs-content-store-eu-west/content/pii:S1381116914005792/gr7/THUMBNAIL/image/gif/2366ad704ff73abfd6c5311a10047451/gr7.sml gr7 gr7.sml sml 9622 109 219 IMAGE-THUMBNAIL 1-s2.0-S1381116914005792-gr6.sml https://s3.amazonaws.com/prod-ucs-content-store-us-east/content/pii:S1381116914005792/gr6/THUMBNAIL/image/gif/b719514a3244e4f06a15d9dbeb85e5b8/gr6.sml https://s3-eu-west-1.amazonaws.com/prod-ucs-content-store-eu-west/content/pii:S1381116914005792/gr6/THUMBNAIL/image/gif/b719514a3244e4f06a15d9dbeb85e5b8/gr6.sml gr6 gr6.sml sml 8430 98 219 IMAGE-THUMBNAIL 1-s2.0-S1381116914005792-gr5.sml https://s3.amazonaws.com/prod-ucs-content-store-us-east/content/pii:S1381116914005792/gr5/THUMBNAIL/image/gif/fe4a57315bd430715e88dcbeb490c186/gr5.sml https://s3-eu-west-1.amazonaws.com/prod-ucs-content-store-eu-west/content/pii:S1381116914005792/gr5/THUMBNAIL/image/gif/fe4a57315bd430715e88dcbeb490c186/gr5.sml gr5 gr5.sml sml 4015 164 182 IMAGE-THUMBNAIL 1-s2.0-S1381116914005792-gr4.sml https://s3.amazonaws.com/prod-ucs-content-store-us-east/content/pii:S1381116914005792/gr4/THUMBNAIL/image/gif/e037fbca6a4faa116ae450c50815e796/gr4.sml https://s3-eu-west-1.amazonaws.com/prod-ucs-content-store-eu-west/content/pii:S1381116914005792/gr4/THUMBNAIL/image/gif/e037fbca6a4faa116ae450c50815e796/gr4.sml gr4 gr4.sml sml 5093 164 193 IMAGE-THUMBNAIL 1-s2.0-S1381116914005792-gr3.sml https://s3.amazonaws.com/prod-ucs-content-store-us-east/content/pii:S1381116914005792/gr3/THUMBNAIL/image/gif/58bd4f3316756786f9467d0638444c14/gr3.sml https://s3-eu-west-1.amazonaws.com/prod-ucs-content-store-eu-west/content/pii:S1381116914005792/gr3/THUMBNAIL/image/gif/58bd4f3316756786f9467d0638444c14/gr3.sml gr3 gr3.sml sml 5245 164 186 IMAGE-THUMBNAIL 1-s2.0-S1381116914005792-gr2.sml https://s3.amazonaws.com/prod-ucs-content-store-us-east/content/pii:S1381116914005792/gr2/THUMBNAIL/image/gif/e8e50952040adde593326bd5b785c94b/gr2.sml https://s3-eu-west-1.amazonaws.com/prod-ucs-content-store-eu-west/content/pii:S1381116914005792/gr2/THUMBNAIL/image/gif/e8e50952040adde593326bd5b785c94b/gr2.sml gr2 gr2.sml sml 5738 163 208 IMAGE-THUMBNAIL 1-s2.0-S1381116914005792-gr10.sml https://s3.amazonaws.com/prod-ucs-content-store-us-east/content/pii:S1381116914005792/gr10/THUMBNAIL/image/gif/65296787ec9d9cf2b6f8141aa04768b6/gr10.sml https://s3-eu-west-1.amazonaws.com/prod-ucs-content-store-eu-west/content/pii:S1381116914005792/gr10/THUMBNAIL/image/gif/65296787ec9d9cf2b6f8141aa04768b6/gr10.sml gr10 gr10.sml sml 3937 164 195 IMAGE-THUMBNAIL 1-s2.0-S1381116914005792-gr1.sml https://s3.amazonaws.com/prod-ucs-content-store-us-east/content/pii:S1381116914005792/gr1/THUMBNAIL/image/gif/747969e51b5352814810c5c75357ed44/gr1.sml https://s3-eu-west-1.amazonaws.com/prod-ucs-content-store-eu-west/content/pii:S1381116914005792/gr1/THUMBNAIL/image/gif/747969e51b5352814810c5c75357ed44/gr1.sml gr1 gr1.sml sml 4072 104 219 IMAGE-THUMBNAIL 1-s2.0-S1381116914005792-fx1.sml https://s3.amazonaws.com/prod-ucs-content-store-us-east/content/pii:S1381116914005792/fx1/THUMBNAIL/image/gif/1cd9679bc2033f6f47276d3dbb6a12cb/fx1.sml https://s3-eu-west-1.amazonaws.com/prod-ucs-content-store-eu-west/content/pii:S1381116914005792/fx1/THUMBNAIL/image/gif/1cd9679bc2033f6f47276d3dbb6a12cb/fx1.sml fx1 true fx1.sml sml 2895 88 219 IMAGE-THUMBNAIL MOLCAA 9381 S1381-1169(14)00579-2 10.1016/j.molcata.2014.12.019 Elsevier B.V. Fig. 1 Experimental set-up for methane conversion. Fig. 2 N2 adsorption–desorption isotherm and BJH pore size distribution (inset) of the two catalysts. Fig. 3 H2-TPR profiles of CAT-1 and CAT-2 catalysts. Fig. 4 NH3-TPD profiles of CAT-1 and CAT-2 catalysts. Fig. 5 XRD analysis of HZSM-5, CAT-1, and CAT-2 calcined catalysts. Fig. 6 SEM–EDX analysis for CAT-1 and CAT-2 catalysts. Fig. 7 TEM analysis of CAT-1 and CAT-2 calcined catalysts. Fig. 8 FTIR analysis of HZSM-5, CAT-1 and CAT-2 calcined catalysts. Fig. 9 Catalytic methane conversion vs time on-stream on (A) CAT-1 at GHSV 400 ml/hgcat, (B) CAT-2 at GHSV 400ml/hgcat, (C) CAT-1 at GHSV 600ml/hgcat, (D) CAT-2 at GHSV 600ml/hgcat. Fig. 10 TGA profile of the spent CAT-2 catalyst (GHSV-400 ml/hgcat). Table 1 BET surface area, pore volume, average pore diameter, and percentage metal dispersion of the support and catalysts. Composition Nomenclature BET SA Pore volume Avg. pore diameter Percent metal dispersion (m2/g) (cm3/g) (A) H-ZSM-5 H-ZSM-5 262.14 0.36 55.89 – 5% Mo/HZSM-5 CAT-1 250.49 0.34 55.01 1.28 5% Mo–2% Zn/HZSM-5 CAT-2 236.01 0.32 724.39 0.72 Table 2 Elemental analysis of CAT-1 and CAT-2. Catalyst Si (wt%) Al (wt%) O (wt%) Mo (wt%) Zn (wt%) CAT-1 18.8 19.2 58.4 3.6 – CAT-2 17.6 16.8 60.9 3.4 1.3 Table 3 The hydrocarbons product selectivity for the catalytic conversion of methanol over CAT-1 and CAT-2 at temperature 550°C. The data were taken at 1h of time on stream. Selectivity CAT-1 CAT-2 Methane 3.2 2.4 Ethylene 8.6 9.2 Ethane 1.6 1.8 Propylene 3.4 3.5 Propane 1.8 1.1 Butylenes 4.2 3.8 Butane 5.2 5.7 Benzene 9.2 7.8 Toluene 6.8 6.4 C8 aromatics 24.7 25.2 C≥9 aromatics 31.3 33.1 Table 4 The effect of temperature on product selectivity over CAT-1 and CAT-2 at a methane flow rate 400cm3/gh for methane conversion. The data were taken at 1h of time on stream. Selectivity CAT-1 CAT-2 550°C 600°C 650°C 550°C 600°C 650°C Ethylene 7.95 11.64 12.83 5.32 8.79 8.45 Ethane 2.75 4.72 1.61 6.21 2.94 4.67 Propylene 1.26 0.97 1.37 1.14 1.3 0.53 Propane 1.42 0.83 0.62 1.01 2 3.93 Butylenes 0.56 1.87 2.6 0.77 0.45 0.71 Butane 1.87 0.38 0 0.2 0.5 0.46 Benzene 29.44 37.92 38.33 12.17 15.2 10.2 Toluene 23.68 10.16 5 29.65 19.92 10.71 C8 aromatics 20.71 16.96 21.22 37.62 28 21.74 C≥9 aromatics 10.36 14.56 16.42 5.89 20.9 38.6 Table 5 The effect of temperature on product selectivity over CAT-1 and CAT-2 at a methane flow rate 600cm3/gh for methane conversion. The data were taken at 1h of time on stream. Selectivity CAT-1 CAT-2 550°C 600°C 650°C 550°C 600°C 650°C Ethylene 8.01 14.75 12.51 6.59 12.7 11.88 Ethane 3.93 1.73 1.52 3.33 3.83 1.89 Propylene 1.31 1.59 2.32 8.16 1.91 1.54 Propane 0.83 0.45 1.15 1.28 1.22 0.37 Butylenes 0.38 1.46 1.07 0.93 0.43 0.36 Butane 1.16 0.38 1.01 3.77 0.15 0 Benzene 32.12 23.73 21.36 27.97 25.5 21.88 Toluene 18.75 24.24 12.4 12.08 18.2 14.35 C8 aromatics 21.11 17.54 16.69 29.16 27.57 24.9 C≥9 aromatics 12.4 14.13 29.96 6.72 8.49 22.83 Methanol assisted methane conversion for higher hydrocarbon over bifunctional Zn-modified Mo/HZSM-5 catalyst Sachchit Majhi a b Ajay K. Dalai b Kamal K. Pant a ⁎ a Department of Chemical Engineering, Indian Institute of Technology Delhi, Hauz Khas, New Delhi 110016, India Department of Chemical Engineering Indian Institute of Technology Delhi Hauz Khas New Delhi 110016 India b Department of Chemical and Biological Engineering, University of Saskatchewan, Saskatoon, SK S7 N 5C5, Canada Department of Chemical and Biological Engineering University of Saskatchewan Saskatoon SK S7 N 5C5 Canada ⁎ Corresponding author. Tel.: +91 11 26596177; fax: +91 11 2658 1120/2659 6172. Graphical abstract The co-conversion of methane with methanol was studied over Mo/H-ZSM-5 and Zn–Mo/H-ZSM-5 catalysts prepared by the wet impregnation method. The catalysts were calcined at 550°C followed by reduction at 450°C for 5h. The activity tests were carried out at three different temperature viz. 550, 600, and 650°C. BET, BJH pore volume distribution, H2-TPR, NH3-TPD, FTIR, SEM–EDX, TEM, and XRD techniques were used for the characterization of the pre-reduced catalyst. Incorporation of 2% Zn on to 5% Mo/H-ZSM-5 catalyst significantly improved the activity of the catalyst for methane conversion. Thermodynamic studies revealed that temperature below 600°C, methane aromatization is not possible, however, in the presence of methanol over bifunctional catalyst it becomes thermodynamic feasible (ΔG =−8.8, −15.5, and −22.2kJ/mol at 400, 500, and 600°C). The main products of the reaction were ethylene, ethane, propane, butane butylenes and aromatics such as benzene, toluene, ethyl benzene and xylene. Selectivity of alkylated aromatic product enhance in the presence of methanol. Keywords Co-conversion HZSM-5 Bifunctional catalyst Additives Aromatics Reaction mechanism 1 Introduction With the increased demand for energy worldwide and the limited worldwide availabilities of crude oil reserves have led to exorbitantly high crude oil prices. The abundance of natural gas worldwide has drawn much attention toward its effective utilization as fuel. The reserves of natural gas are located in remote areas where high transport costs affect exploitation; however, by adopting procedures for the conversion of natural gas to higher hydrocarbons these costs can be reduced [1]. Efforts are being made to convert methane into high-density liquid fuel by various researchers in industry and academia [2]. Methane can be converted to higher hydrocarbon by mainly two routes: indirect and direct methods. The indirect route for methane conversion (e.g., Fischer–Tropsch, Mobil Process, and Shell Middle Distillate Synthesis) requires the production of synthesis gas (CO and H2) from methane by the costly and inefficient process of steam reforming [3]. The direct route of methane conversion to higher hydrocarbons has attracted researchers, due to its potential for utilizing natural gas as industrial feedstock. However, the usefulness of this process is still limited as it has not been possible to achieve large-scale conversion of methane directly to higher hydrocarbons. Owing to its stable configuration of four symmetric CH bonds having bond energy of 435kJ/mol it is not feasible at low temperatures, whereas, at high temperature the tendency of coke deposition on the active surface also increases. In order to suppress coking with reasonably high conversion, additives such as alkanes or alcohols are required in the reactant stream to activate the methane molecule at low temperatures [4–7]. Thermodynamically; methane is unstable only above 530°C, becoming more unstable than benzene above 1030°C [3]. The equilibrium methane conversion at atmospheric pressure is low at moderate temperatures (about 5% at 600°C, 11.4% at 700°C and 16.2% at 750°C) [5]. For the case of methane methanol simultaneous conversion, ΔG =−8.8, −15.5, and −22.2kJ/mol at 400, 500, and 600°C, respectively, for one mole of methane converted per mole of methanol (Co-conversion of methane with methanol to benzene) [7]. The methanol to gasoline (MTG) is a highly exothermic reaction (ΔHr=−1670kJ/kg); whereas, methane conversion is an endothermic process. The present work examines a combination of the exothermic conversion of methanol with the highly endothermic methane cracking reaction to obtain relatively thermo-neutral reaction. The probable reaction mechanisms of the methane–methanol reaction can be understand by the following mechanism: (1) Z − H + +C H 3 OH ⥂ Z − [ CH 3 OH 2 ] + Z − C H 3 + + H 2 O ⁡ (2) Z − C H 3 + → Z − H + +C H 2 (3) 2C H 2 → C 2 H 4 → Aromatization Oliogomerization Aliphatics+Aromatics+ H 2 (4) C H 4 → Z − H + M n + O 2 − Z − [ C H 3 ] + + M n + O 2 − + H 2 (5) Z − C H 3 + → H + Z − +C H 2 (6) 2C H 2 → C 2 H 4 → Oliomerization Aromatization H + Z − + M n + O 2 − Aliphatics+Aromatics+ H 2 where H+Z− =HZSM-5, M n+ =Mo or Zn oxide Among the several catalysts tested, Mo/HZSM-5 has been reported the most promising catalyst [8–11]. This could be due to its framework of HZSM-5 and active sites located in cavities or channels of the zeolite pore system, which is predetermined by their structural nature, particularly the shape and size of pores. Thus, the accessibility of sites and nature of the products formed during the reaction is controlled by zeolite [12,13]. Having a two-dimensional porous structure and pore diameter close to the dynamic diameter of the benzene molecule, HZSM-5 as support for the aromatization of methane inhibition effectively ensures the formation of other products [14]. To modify the activity of the catalyst, the addition of a metal promoter was implemented, enhancing the catalytic activity and selectivity to benzene and other hydrocarbons [15]. In this work, a relatively thermo-neutral reaction by means of methanol as a co-reactant over the catalysts, namely 5% Mo/HZSM-5 and 5% Mo–2% Zn/HZSM-5, prepared by the impregnation method was studied. These catalysts were characterized by BET surface area, pore volume, BJH adsorption–desorption, and temperature programmed reaction (TPR) method. The acidity measurements of the calcined catalyst were conducted by FTIR and temperature programmed desorption (TPD) using NH3. The surface morphology was analyzed by SEM–EDX and TEM analyses. The percentage coke formed during the reaction was determined by TGA. The activity tests of these catalysts were performed in a quartz reactor over the temperature range of 550–650°C at atmospheric pressure. 2 Experimental 2.1 Catalyst preparation The chemicals used were (NH4)6Mo7O24·4H2O (Merck, Germany) and Zn(NO3)2·6H2O (Merck, Inida) as the metal precursor. Commercial HZSM-5 was supplied by Sud-chemie, having a silica alumina ratio of 55. Two catalysts were prepared by impregnation over an HZSM-5 support. The first catalyst, 5.0% Mo/HZSM-5 (ascribed as CAT-1), was prepared by impregnation with an aqueous solution of ammonium heptamolybdate [(NH4)6Mo7O24·H2O)] over HZSM-5 zeolite. After impregnation, the catalyst was dried at 110±5°C overnight and then calcined in air at 550±5°C for 5h. The second catalyst, 2% Zn–5% Mo/HZSM-5 (ascribed as CAT-2), was prepared by impregnation on HZSM-5 with ammonium heptmolybdate and a Zn(NO3)2·6H2O solution. The subsequent steps were the same as for CAT-1. 2.2 Catalyst characterization The textural properties of the catalyst and adsorption–desorption isotherms were determined using nitrogen and a Micromeritics ASAP 2010 apparatus. For the cross-sectional area of N2, a value of 0.162nm2 was used. Prior to the experiments, the samples were degassed at 150°C in the vacuum condition for 3h to remove moisture and gases. Micropore distributions were derived from the Horvath–Kawazoe (HK) method; whereas, mesopore distributions were derived from the Barrett–Joyner–Halenda (BJH) method. Surface areas and pore volumes of the catalyst samples were measured with the BET method. The temperature program reduction (TPR) study was done to determine the reduction temperature using a Micrometrics Pulse Chemisorb 2720 apparatus. Approximately 0.1g of the sample was taken in a U-type quartz tube and then reduced from ambient to 950°C at a ramp rate of 10°C/min, under a hydrogen–argon mixture (10% hydrogen), at a flow rate of 20ml/min. The hydrogen consumption during the TPR was recorded by means of a thermal conductivity detector (TCD). The acidity of the HZSM-5 and metal loaded HZSM-5 catalysts were measured by temperature programmed desorption (TPD) of ammonia using the same equipment. For this 0.2g of catalyst sample was pretreated in a flow of helium at 500°C for 1h to remove moisture present in the sample and then cooled down to room temperature. To complete saturation, an ammonia–helium mixture (5:95) was passed to the sample for 1h. Physisorbed ammonia was removed by flowing helium for 30min. After that, TPD was carried out in a stream of helium with a flow rate of 20ml/min (from room temperature to 650°C), at a ramp rate of 10°C/min. NH3 desorption was measured using a thermal conductivity detector (TCD) and the total desorbed NH3 was obtained from the integrated peak area of the TPD profiles relative to the calibration curve. The surface morphology and localized metal concentration of the catalysts were determined by SEM–EDX analysis using a Carl Zeiss SMT EVO series scanning electron microscope. The sample preparation was done by mounting wafer form samples on the sticky carbon tape and electrically conducting by plating the sample with silver (20nm thick) using a Bio-Rad Polaran sputter coater. Particle size of the calcined catalyst were analyzed by Philips CM12 model Transmission Electron Microscopy (TEM). The samples were prepared by ultrasonic dispersion of the calcined catalyst in methanol for 2h and the sample was then dispersed onto a carbon copper grid. The X-ray diffraction patterns of all three calcined catalysts were examined using a Phillips X Pert Diffractometer PW 1390 at 40kV and 30mA on Cu Kα radiation. The diffractograms were collected at 2θ between 10 and 80°. FT-IR spectra of HZSM-5, CAT-1, and CAT-2 catalysts were recorded in the vibrational region between 400 and 2000cm−1 with a PerkinElmer spectrum 100 infrared spectrometer using the conventional KBr disk technique. The catalyst sample was first dried at 350°C for 2h and the wafers were prepared with a ratio of catalyst: KBr=1:100 under a pressure of 5kg/cm3. 2.3 Catalytic activity test The catalytic activity test was performed in a fixed bed reactor made up of quartz having internal diameter of 10mm. The schematic diagram of the experimental set-up is shown in Fig. 1 . Approximately 3g of catalyst (0.5mm size) mixed with silicon carbide to avoid channeling was kept in the middle zone of the reactor. A K-type of thermocouple was placed near the catalyst bed to measure the temperature of the bed controlled by a PID controller. Prior to the catalytic test, the catalysts were first reduced in a stream of hydrogen and methane mixture (3:1) for 5h, at a temperature of 460°C, which was predetermined through the TPR study. After reduction, the reactor was heated under nitrogen stream to the desired reaction temperature. Methane was introduced into the reactor through a calibrated mass flow controller. The gas hourly space velocity of methane was varied between 400 and 600cm3/gh. The flow rate of methanol was 0.5cm3/h for all cases. The flow rate of the product gases were measured by a soap bubble flow meter and the mixture components were analyzed by gas chromatography. The amounts of aliphatic and aromatic hydrocarbons were determined using FID-based gas chromatography equipped with Porapak-Q column. The methane conversion and selectivity were calculated on the carbon number basis. The conversion and selectivity are calculated by the following formula: Conversion ( % ) = ( ( mol es ⁡ ⁡ of C H 4 fed − moles ⁡ of C H 4 out + moles of C H 4 produced from methanol ) moles of C H 4 fed ) × 100 (Methane produced from methanol under the same condition without methane addition in the feed) Selectivity ⁡ = ( Amount of product formed ( mol es ⁡ ⁡ ⁡ of C H 4 fed − moles of C H 4 out + moles of C H 4 produced from methanol ) ) × 100 3 Results and discussion 3.1 Surface area and pore volume of catalysts The BET surface area, pore volume, average pore diameter of the parent zeolite (HZSM-5, Si/Al=55), and the other two bimetallic catalysts are given in Table 1 . The data show that the surface area of catalyst decreased due to metal loading. The decrease in surface area with the increased metal concentration may be due to partial pore blockage during the impregnation of the Mo/Zn on the HZSM-5 which was also supported by the decrease in pore volume with the increase of metal concentration. Fig. 2 shows the N2 adsorption/desorption isotherms and pore size distribution of HZSM-5 and other two metal impregnated catalysts. Both isotherm showing a typical Type IV isotherm, with a capillary condensation at P/Po of 0.7–0.9 and a sharp rise in the gas uptake at higher relative pressure, signifying the presence of large mesopores. The BJH isotherm and pore volume distribution analyze indicate the presence of distinctive mesopores. For all of the catalyst samples, the effective diameters were almost equivalent to those of the original HZSM-5, which suggest that the metal has not much effect on pore size distribution. This could be the exchange of metal ions with protons of the H-ZSM-5 as a result of which metal particles are present at the outer surface as well as outside the channels and no pores were blocked. On the other hand, due to non-interference of the metal particles to the channels and pore openings of the H-ZSM-5, no significance difference has occurred in the pore size distribution of the base material and both the catalysts. According to the BJH calculation, the most of these mesopores and in the range of 2–21nm, with a sharp maxima at about 11.5nm (Fig. 2, inset), indicating that the catalysts exist in the combined form of micro and meso porosity which is favored from the mass transport point of view for methane conversion process. 3.2 TPR, chemisorption, and TPD analysis To determine the reducibility of the calcined catalysts, temperature-programmed reductions were performed from ambient temperature to 950°C. Fig. 3 shows the H2-TPR profile for the two catalysts, with two distinct peaks observed for each CAT-1 and CAT-2. The first peak appeared at the temperature range between 430 and 450°C, corresponding to the reduction of molybdenum species. The second peak significantly shifted to a higher temperature (∼950°C), this is attributed either to the reduction of the MoO nanoparticles being reduced to active Mo, or due to a strong interaction between MoO in the HZSM-5 framework reduced at higher temperatures [16]. There was no peak found at this temperature range for zinc oxide indicating that zinc oxide was not reduced within this temperature range which is in agreement with the literature [17,18] The acidity of calcined catalysts were determined by NH3-TPD analysis. As shown in Fig.4 , the NH3-TPD spectra of CAT-1 and CAT-2 resemble moderate acid sites. It has been reported that acid sites are classified as weak (<300°C), moderate (300–450°C), and strong (450–550°C), depending upon the desorption temperature [19]. Results indicate that presence of molybdenum into HZSM-5 decreases the strength of stronger acidic sites. Ma et al. reported that ammonia adsorbs on both the weak (Lewis) and strong (Brönsted) acid sites. Incorporation of Mo and zinc in HZSM-5 slightly changed the acidic properties of the catalysts due to which catalyst loses some of Brönsted acid sites and, ultimately, forming Lewis acid sites. Two reasons behind the Lewis acid formation are: firstly, the migration of Mo into the zeolite channel and, secondly, the pore occupied by the access metal concentration inside the zeolite [20,21]. 3.3 Catalyst morphology 3.3.1 XRD analysis XRD technique was used for the identification of the phase of molybdenum and zinc oxide on the HZM-5 support and their interaction. The diffraction peaks for HZSM-5, CAT-1, and CAT-2 (Fig. 5 ) did not show any appreciable change in 2θ position, implying that there was no any phase change in the catalysts after the impregnation of Mo and Zn on HZSM-5. Also, no new XRD peaks were observed for the molybdenum and zinc species, indicating that Mo and Zn are highly dispersed on the HZSM-5 surface and/or in its framework. Xu et al. [22] explained that Mo species on HZSM-5 prepared by the impregnation method are generally well dispersed on the zeolite surface and the crystal size of MoO3 and Al2(MoO4)3 below 4nm cannot be detected by the XRD technique. 3.4 SEM–EDX and TEM analyses The surface morphology of CAT-1 and CAT-2 was studied by SEM analysis. As shown in the SEM micrographs (Fig. 6 inset), the particles are irregular in shape with uneven distribution and their size varied from 200 to 257μm. The average concentrations of Mo and Zn in the calcined CAT-1 and CAT-2 catalysts were analyzed by EDX analysis. Molybdenum was found to be less than of 4% whereas zinc for CAT-2, was 1.3%. These results are shown in Table 2 and the EDX elemental mapping for both catalysts is shown in Fig. 6. From the data, it can be perceived that the Mo concentration for both catalysts is less that 4% and the Zn concentration is about 1.3% for CAT-2. TEM analysis was also used to determine the size and shape of the catalyst particles. From Fig. 7 , it can be seen that Mo particles are represented by the dark spots in the micrograph. The TEM images also showed clusters of metal particles with support, having an uneven distribution and being heterogeneously dispersed in an average cluster size of 20–100nm. 3.5 FT-IR analysis The framework structure of HZSM-5 and the two catalysts were characterized by FT-IR analysis. The position of all the structure-sensitive bands in the IR spectra of the HZSM-5 zeolite and the two calcined catalysts are observed at the same position (Fig. 8 ), which suggests that the basic zeolite structures are not affected much by the incorporation of Mo and Zn species. However, as indicated by the results of NH3 TPD (Fig. 4), where NH3 is desorbed at temperatures in the range of 110–400°C (weak site range), it is interesting to note how the strong sites are converted into weak sites. The absorption bands at 1222, 1100, 795, 547, and 453cm−1 are characteristic of the HZSM-5 framework [20]. Although both catalysts show similar bands at the same position, there is a difference in the decrease in intensity, suggesting that the loading of the metal species affect the bonding behavior in the zeolite framework. 3.6 Synthesis and product selectivity It is widely accepted that the most promising catalyst for non-oxidative methane conversion is Mo/H-ZSM-5 [23]. By the incorporation of zinc on HZSM-5, some of the protons are replaced by zinc atom, which increases reaction rate. Iglesia et al. explained that the activation of CH bond occur on protonic acid sites, but they recombine again with abundant surface hydrogen species, because protonic acid sites are not able to remove hydrogen via recombinative desorption. Zn cations can prevent these recombination reactions by providing a function for recombinative desorption and removing the hydrogen atoms formed during CH activation [13]. Keeping those in mind effects of activation procedures on methane–methanol co-conversion were compared over the CAT-1 and CAT-2 catalysts. In our previous work, the effect of copper and zinc loading on HZSM-5 were studied for methanol to higher hydrocarbon conversion [24,25]. It was found that the aromatics selectivity varied from 66 to 77%, rest were aliphatic hydrocarbon. In the same way, in the present investigation methanol conversion was tested over CAT-1 and CAT-2 catalysts under the same reaction conditions as that of methane–methanol co-conversion at 550°C. Nitrogen was used to maintain methane partial pressure. Methanol was found to be 100% conversion for both the catalyst. The product selectivity are shown in Table 3 for methanol conversion on water free basis. The catalytic performances of co-conversion of methane with methanol over CAT-1 and CAT-2 catalysts at two GHSV were studied at three different temperatures for 5h of reaction. Fig. 8 shows the methane conversion with the time on stream. The results indicated that the methane conversion over CAT-2 is higher than CAT-1 where as methanol was completely reacted. The decrease in methane conversion with time on stream may be due to the carbonaceous deposition of methane/methanol over the catalyst. This is supported by the TGA analysis of the catalyst after the reaction (Fig. 9 ). Zn has a significant contribution on the methane conversion. Tables 4 and 5 show the conversion results of effect of Zn on the reactivity of methane over catalysts CAT-1 and CAT-2. From Fig. 9, it can be revealed that there is a significant improvement in the catalytic performance after the incorporation of Zn. Tables 4 and 5 show the product selectivity distribution for CAT-1 and CAT-2. The main gaseous products of the reaction were ethylene, ethane, propylene, propane, butylenes and butane. The liquid product mainly contained benzene, toluene, ethyl benzene and xylene. Incorporation of zinc enhanced the selectivity towards aromatic range products. It can be seen that the as the temperature increases the methane conversion and ethylene selectivity increased remarkably. This may be due to the dominancy of cracking reaction. At a lower temperature 550°C, the selectivity of toluene and xylene is higher as compared higher temperature (600 and 650°C). The alkylation reaction favored at lower temperature. At relatively higher temperature, the contribution of oligomerization was favored because of which coke reposition occurred on the catalyst. The high selectivity of aromatics indicates a high activity of HZSM-5 and high concentration on its surface of strong acid centers responsible for aromatization of methane and methanol. The shift of the reaction toward low selectivity when temperature increases may be due to plugging of zeolite channels and voids with coke deposits, which deteriorate the catalyst activity (Fig. 10 ). 3.7 TGA analysis of spent catalyst Thermo gravimetric analysis (TGA) of spent catalyst (CAT-2) was done in a SDT Q600 thermal analyzer. TGA results are shown in Fig. 9. The weight loss was about 7% for 550°C, 8.5% for 600°C and 11% for 650°C. The reduction pattern indicates that between ambient and 150°C variation in wt% was approximately 5%, which indicates it might be due to the presence of moisture and volatiles matter deposited in the porous structure during the reaction. Above 150°C, a rise in the peak indicates the different carbonaceous compounds decomposed with some accumulation of mass due to reaction in presence of oxygen. 4 Conclusion 5% Mo/HZSM-5 (CAT-1) and 2% Zn–5% Mo/HZSM-5(CAT-2) catalysts were prepared by co-impregnation and tested for the co-conversion of methane with methanol at the condition of atmospheric pressure and three temperature (550, 600, and 650°C). It was found that the catalytic activity and selectivity of 5% Mo/HZSM-5 can be enhanced by the addition of Zn. A high methane conversion over the zinc-loaded Mo/HZSM-5 catalyst was found at a reaction temperature of 650°C; whereas, high selectivity was achieved at a reaction temperature of 600°C. BET surface area and pore volume were found to decrease in order when metal impregnation took place in HZSM-5. The BJH isotherm and pore volume distribution analysis revealed the mesoporous nature of the catalyst. FTIR and XRD analyses suggested that the original framework remained the same, even after metal impregnation; whereas, the TPD results defined the moderate acidic nature of the catalyst. Acknowledgement Financial support provided by Gas Authority India Limited (GAIL) for carrying out this research work is gratefully acknowledged References [1] J.F. Liu Y. Liu L.F. Peng J. Mol. Catal. A: Chem. 280 2008 7 [2] M.C. Alvarez-Galvan N. Mota M. Ojeda S. Rojas R.M. Navarro J.L.G. Fierro Catal. Today 171 2011 15 [3] J.H. Lunsford Catal. Today 63 2000 165 [4] L. Wang Y. Xu S.T. Wong W. Cui X. Guo Appl. Catal. A: Gen. 152 1997 173 [5] Y. Zhang D. Wang J. Fei X. Zheng J. Nat. Gas Chem. 12 2003 145 [6] V.R. Choudhary A.K. Kinage T.V. Choudhary Chem. Commun. 22 1996 2545 [7] V.R. Choudhary K.C. Mondal S.A.R. Mulla Angew. Chem. Int. Ed. 44 2005 4381 [8] P. Meriaudeau L.V. Tiep V.T.T. Ha C. Naccache G. Szabo J. Mol. Catal. A: Chem. 144 1999 469 [9] C. Bouchy I. Schmidt J.R. Anderson C.J.H. Jacobsen E.G. Derouane S.B. Derouane-Abd Hamid J. Mol. Catal. A: Chem. 163 2000 283 [10] W. Liu Y. Xu S.T. Wong L. Wang J. Qiu N. Yang J. Mol. Catal. A: Chem. 120 1997 257 [11] E.V. Matus I.Z. Ismagilov O.B. Sukhova V.I. Zaikovskii L.T. Tsikoza Z.R. Ismagilov J.A. Moulijn Ind. Eng. Chem. Res. 46 2007 4063 [12] V.T.T. Ha L.V. Tiepb P. Meriaudeau C. Naccache J. Mol. Catal. A: Chem. 181 2002 283 [13] E. Iglesia D.G. Barton J.A. Biscardi M.J.L. Gines S.L. Soled Catal. Today 38 1997 339 [14] C.L. Zhang S. Li Y. Yuana W.X. Zhang T.H. Wu L.W. Lin Catal. Lett. 56 1998 207 [15] A.A. Enein A.L.H. Mahmoud Fuel 90 2011 3040 [16] H. Jiang L. Wang W. Cui Y. Xu Catal. Lett. 57 1999 95 [17] M.M. Gunter T. Ressler R.E. Jentoft B. Bems J. Catal. 203 2001 133 [18] W.F. Hoelderich J. Tjoe Appl. Catal. A: Gen. 184 1999 257 [19] J.R. Grzechowiak J. Rynkowski I. Wereszczako-Zieliñska Catal. Today 65 2001 225 [20] B.S. Liu Y. Zhang J.F. Liu M. Tian F.M. Zhang C.T. Au A.S.C. Cheung J. Phys. Chem. C 115 2011 16954 [21] L. Ovári F. Solymosi J. Mol. Catal. A: Chem. 207 2004 35 [22] Y. Xu W. Liu S.T. Wong L. Wang X. Guo Catal. Lett. 40 1996 207 [23] Y. Xua J. Wang Y. Suzuki Z.G. Zhang Catal. Today 185 2012 41 [24] H.A. Zaidi K.K. Pant Catal. Today 96 2004 155 [25] H.A. Zaidi K.K. Pant Ind. Eng. Chem. Res. 47 2008 2970",
      "scopus-id": "84920903243",
      "coredata": {
        "eid": "1-s2.0-S1381116914005792",
        "dc:description": "The co-conversion of methane with methanol was studied over Mo/H-ZSM-5 and Zn–Mo/H-ZSM-5 catalysts prepared by the wet impregnation method. The catalysts were calcined at 550°C followed by reduction at 450°C for 5h. The activity tests were carried out at three different temperature viz. 550, 600, and 650°C. BET, BJH pore volume distribution, H2-TPR, NH3-TPD, FTIR, SEM–EDX, TEM, and XRD techniques were used for the characterization of the pre-reduced catalyst. Incorporation of 2% Zn on to 5% Mo/H-ZSM-5 catalyst significantly improved the activity of the catalyst for methane conversion. Thermodynamic studies revealed that temperature below 600°C, methane aromatization is not possible, however, in the presence of methanol over bifunctional catalyst it becomes thermodynamic feasible (ΔG =−8.8, −15.5, and −22.2kJ/mol at 400, 500, and 600°C). The main products of the reaction were ethylene, ethane, propane, butane butylenes and aromatics such as benzene, toluene, ethyl benzene and xylene. Selectivity of alkylated aromatic product enhance in the presence of methanol.",
        "openArchiveArticle": "false",
        "prism:coverDate": "2015-03-31",
        "openaccessUserLicense": null,
        "prism:aggregationType": "Journal",
        "prism:url": "https://api.elsevier.com/content/article/pii/S1381116914005792",
        "dc:creator": [
          {
            "@_fa": "true",
            "$": "Majhi, Sachchit"
          },
          {
            "@_fa": "true",
            "$": "Dalai, Ajay K."
          },
          {
            "@_fa": "true",
            "$": "Pant, Kamal K."
          }
        ],
        "link": [
          {
            "@_fa": "true",
            "@rel": "self",
            "@href": "https://api.elsevier.com/content/article/pii/S1381116914005792"
          },
          {
            "@_fa": "true",
            "@rel": "scidir",
            "@href": "https://www.sciencedirect.com/science/article/pii/S1381116914005792"
          }
        ],
        "dc:format": "application/json",
        "openaccessType": null,
        "pii": "S1381-1169(14)00579-2",
        "prism:volume": "398",
        "prism:publisher": "Elsevier B.V.",
        "dc:title": "Methanol assisted methane conversion for higher hydrocarbon over bifunctional Zn-modified Mo/HZSM-5 catalyst",
        "prism:copyright": "Copyright © 2014 Elsevier B.V. All rights reserved.",
        "openaccess": "0",
        "prism:issn": "13811169",
        "dcterms:subject": [
          {
            "@_fa": "true",
            "$": "Co-conversion"
          },
          {
            "@_fa": "true",
            "$": "HZSM-5"
          },
          {
            "@_fa": "true",
            "$": "Bifunctional catalyst"
          },
          {
            "@_fa": "true",
            "$": "Additives"
          },
          {
            "@_fa": "true",
            "$": "Aromatics"
          },
          {
            "@_fa": "true",
            "$": "Reaction mechanism"
          }
        ],
        "openaccessArticle": "false",
        "prism:publicationName": "Journal of Molecular Catalysis A: Chemical",
        "openaccessSponsorType": null,
        "prism:pageRange": "368-375",
        "prism:endingPage": "375",
        "pubType": "fla",
        "prism:coverDisplayDate": "March 2015",
        "prism:doi": "10.1016/j.molcata.2014.12.019",
        "prism:startingPage": "368",
        "dc:identifier": "doi:10.1016/j.molcata.2014.12.019",
        "openaccessSponsorName": null
      },
      "objects": {
        "object": [
          {
            "@category": "thumbnail",
            "@height": "88",
            "@width": "445",
            "@_fa": "true",
            "$": "https://api.elsevier.com/content/object/eid/1-s2.0-S1381116914005792-si8.gif?httpAccept=%2A%2F%2A",
            "@multimediatype": "GIF image file",
            "@type": "ALTIMG",
            "@size": "3493",
            "@ref": "si8",
            "@mimetype": "image/gif"
          },
          {
            "@category": "thumbnail",
            "@height": "89",
            "@width": "471",
            "@_fa": "true",
            "$": "https://api.elsevier.com/content/object/eid/1-s2.0-S1381116914005792-si7.gif?httpAccept=%2A%2F%2A",
            "@multimediatype": "GIF image file",
            "@type": "ALTIMG",
            "@size": "3344",
            "@ref": "si7",
            "@mimetype": "image/gif"
          },
          {
            "@category": "thumbnail",
            "@height": "54",
            "@width": "378",
            "@_fa": "true",
            "$": "https://api.elsevier.com/content/object/eid/1-s2.0-S1381116914005792-si6.gif?httpAccept=%2A%2F%2A",
            "@multimediatype": "GIF image file",
            "@type": "ALTIMG",
            "@size": "1790",
            "@ref": "si6",
            "@mimetype": "image/gif"
          },
          {
            "@category": "thumbnail",
            "@height": "15",
            "@width": "145",
            "@_fa": "true",
            "$": "https://api.elsevier.com/content/object/eid/1-s2.0-S1381116914005792-si5.gif?httpAccept=%2A%2F%2A",
            "@multimediatype": "GIF image file",
            "@type": "ALTIMG",
            "@size": "485",
            "@ref": "si5",
            "@mimetype": "image/gif"
          },
          {
            "@category": "thumbnail",
            "@height": "31",
            "@width": "213",
            "@_fa": "true",
            "$": "https://api.elsevier.com/content/object/eid/1-s2.0-S1381116914005792-si4.gif?httpAccept=%2A%2F%2A",
            "@multimediatype": "GIF image file",
            "@type": "ALTIMG",
            "@size": "859",
            "@ref": "si4",
            "@mimetype": "image/gif"
          },
          {
            "@category": "thumbnail",
            "@height": "28",
            "@width": "350",
            "@_fa": "true",
            "$": "https://api.elsevier.com/content/object/eid/1-s2.0-S1381116914005792-si3.gif?httpAccept=%2A%2F%2A",
            "@multimediatype": "GIF image file",
            "@type": "ALTIMG",
            "@size": "1633",
            "@ref": "si3",
            "@mimetype": "image/gif"
          },
          {
            "@category": "thumbnail",
            "@height": "15",
            "@width": "145",
            "@_fa": "true",
            "$": "https://api.elsevier.com/content/object/eid/1-s2.0-S1381116914005792-si2.gif?httpAccept=%2A%2F%2A",
            "@multimediatype": "GIF image file",
            "@type": "ALTIMG",
            "@size": "481",
            "@ref": "si2",
            "@mimetype": "image/gif"
          },
          {
            "@category": "thumbnail",
            "@height": "24",
            "@width": "252",
            "@_fa": "true",
            "$": "https://api.elsevier.com/content/object/eid/1-s2.0-S1381116914005792-si1.gif?httpAccept=%2A%2F%2A",
            "@multimediatype": "GIF image file",
            "@type": "ALTIMG",
            "@size": "976",
            "@ref": "si1",
            "@mimetype": "image/gif"
          },
          {
            "@category": "high",
            "@height": "2324",
            "@width": "3000",
            "@_fa": "true",
            "$": "https://api.elsevier.com/content/object/eid/1-s2.0-S1381116914005792-gr9_lrg.jpg?httpAccept=%2A%2F%2A",
            "@multimediatype": "JPEG image file",
            "@type": "IMAGE-HIGH-RES",
            "@size": "396549",
            "@ref": "gr9",
            "@mimetype": "image/jpeg"
          },
          {
            "@category": "high",
            "@height": "994",
            "@width": "1250",
            "@_fa": "true",
            "$": "https://api.elsevier.com/content/object/eid/1-s2.0-S1381116914005792-gr8_lrg.jpg?httpAccept=%2A%2F%2A",
            "@multimediatype": "JPEG image file",
            "@type": "IMAGE-HIGH-RES",
            "@size": "147111",
            "@ref": "gr8",
            "@mimetype": "image/jpeg"
          },
          {
            "@category": "high",
            "@height": "1248",
            "@width": "2500",
            "@_fa": "true",
            "$": "https://api.elsevier.com/content/object/eid/1-s2.0-S1381116914005792-gr7_lrg.jpg?httpAccept=%2A%2F%2A",
            "@multimediatype": "JPEG image file",
            "@type": "IMAGE-HIGH-RES",
            "@size": "979587",
            "@ref": "gr7",
            "@mimetype": "image/jpeg"
          },
          {
            "@category": "high",
            "@height": "1484",
            "@width": "3333",
            "@_fa": "true",
            "$": "https://api.elsevier.com/content/object/eid/1-s2.0-S1381116914005792-gr6_lrg.jpg?httpAccept=%2A%2F%2A",
            "@multimediatype": "JPEG image file",
            "@type": "IMAGE-HIGH-RES",
            "@size": "820631",
            "@ref": "gr6",
            "@mimetype": "image/jpeg"
          },
          {
            "@category": "high",
            "@height": "1124",
            "@width": "1250",
            "@_fa": "true",
            "$": "https://api.elsevier.com/content/object/eid/1-s2.0-S1381116914005792-gr5_lrg.jpg?httpAccept=%2A%2F%2A",
            "@multimediatype": "JPEG image file",
            "@type": "IMAGE-HIGH-RES",
            "@size": "132276",
            "@ref": "gr5",
            "@mimetype": "image/jpeg"
          },
          {
            "@category": "high",
            "@height": "1062",
            "@width": "1250",
            "@_fa": "true",
            "$": "https://api.elsevier.com/content/object/eid/1-s2.0-S1381116914005792-gr4_lrg.jpg?httpAccept=%2A%2F%2A",
            "@multimediatype": "JPEG image file",
            "@type": "IMAGE-HIGH-RES",
            "@size": "138255",
            "@ref": "gr4",
            "@mimetype": "image/jpeg"
          },
          {
            "@category": "high",
            "@height": "1100",
            "@width": "1250",
            "@_fa": "true",
            "$": "https://api.elsevier.com/content/object/eid/1-s2.0-S1381116914005792-gr3_lrg.jpg?httpAccept=%2A%2F%2A",
            "@multimediatype": "JPEG image file",
            "@type": "IMAGE-HIGH-RES",
            "@size": "108066",
            "@ref": "gr3",
            "@mimetype": "image/jpeg"
          },
          {
            "@category": "high",
            "@height": "1965",
            "@width": "2500",
            "@_fa": "true",
            "$": "https://api.elsevier.com/content/object/eid/1-s2.0-S1381116914005792-gr2_lrg.jpg?httpAccept=%2A%2F%2A",
            "@multimediatype": "JPEG image file",
            "@type": "IMAGE-HIGH-RES",
            "@size": "423694",
            "@ref": "gr2",
            "@mimetype": "image/jpeg"
          },
          {
            "@category": "high",
            "@height": "1051",
            "@width": "1250",
            "@_fa": "true",
            "$": "https://api.elsevier.com/content/object/eid/1-s2.0-S1381116914005792-gr10_lrg.jpg?httpAccept=%2A%2F%2A",
            "@multimediatype": "JPEG image file",
            "@type": "IMAGE-HIGH-RES",
            "@size": "107820",
            "@ref": "gr10",
            "@mimetype": "image/jpeg"
          },
          {
            "@category": "high",
            "@height": "1583",
            "@width": "3333",
            "@_fa": "true",
            "$": "https://api.elsevier.com/content/object/eid/1-s2.0-S1381116914005792-gr1_lrg.jpg?httpAccept=%2A%2F%2A",
            "@multimediatype": "JPEG image file",
            "@type": "IMAGE-HIGH-RES",
            "@size": "351814",
            "@ref": "gr1",
            "@mimetype": "image/jpeg"
          },
          {
            "@category": "high",
            "@height": "886",
            "@width": "2213",
            "@_fa": "true",
            "$": "https://api.elsevier.com/content/object/eid/1-s2.0-S1381116914005792-fx1_lrg.jpg?httpAccept=%2A%2F%2A",
            "@multimediatype": "JPEG image file",
            "@type": "IMAGE-HIGH-RES",
            "@size": "138895",
            "@ref": "fx1",
            "@mimetype": "image/jpeg"
          },
          {
            "@category": "standard",
            "@height": "525",
            "@width": "678",
            "@_fa": "true",
            "$": "https://api.elsevier.com/content/object/eid/1-s2.0-S1381116914005792-gr9.jpg?httpAccept=%2A%2F%2A",
            "@multimediatype": "JPEG image file",
            "@type": "IMAGE-DOWNSAMPLED",
            "@size": "55297",
            "@ref": "gr9",
            "@mimetype": "image/jpeg"
          },
          {
            "@category": "standard",
            "@height": "224",
            "@width": "282",
            "@_fa": "true",
            "$": "https://api.elsevier.com/content/object/eid/1-s2.0-S1381116914005792-gr8.jpg?httpAccept=%2A%2F%2A",
            "@multimediatype": "JPEG image file",
            "@type": "IMAGE-DOWNSAMPLED",
            "@size": "15930",
            "@ref": "gr8",
            "@mimetype": "image/jpeg"
          },
          {
            "@category": "standard",
            "@height": "282",
            "@width": "565",
            "@_fa": "true",
            "$": "https://api.elsevier.com/content/object/eid/1-s2.0-S1381116914005792-gr7.jpg?httpAccept=%2A%2F%2A",
            "@multimediatype": "JPEG image file",
            "@type": "IMAGE-DOWNSAMPLED",
            "@size": "44843",
            "@ref": "gr7",
            "@mimetype": "image/jpeg"
          },
          {
            "@category": "standard",
            "@height": "335",
            "@width": "753",
            "@_fa": "true",
            "$": "https://api.elsevier.com/content/object/eid/1-s2.0-S1381116914005792-gr6.jpg?httpAccept=%2A%2F%2A",
            "@multimediatype": "JPEG image file",
            "@type": "IMAGE-DOWNSAMPLED",
            "@size": "80621",
            "@ref": "gr6",
            "@mimetype": "image/jpeg"
          },
          {
            "@category": "standard",
            "@height": "254",
            "@width": "282",
            "@_fa": "true",
            "$": "https://api.elsevier.com/content/object/eid/1-s2.0-S1381116914005792-gr5.jpg?httpAccept=%2A%2F%2A",
            "@multimediatype": "JPEG image file",
            "@type": "IMAGE-DOWNSAMPLED",
            "@size": "14767",
            "@ref": "gr5",
            "@mimetype": "image/jpeg"
          },
          {
            "@category": "standard",
            "@height": "240",
            "@width": "282",
            "@_fa": "true",
            "$": "https://api.elsevier.com/content/object/eid/1-s2.0-S1381116914005792-gr4.jpg?httpAccept=%2A%2F%2A",
            "@multimediatype": "JPEG image file",
            "@type": "IMAGE-DOWNSAMPLED",
            "@size": "16863",
            "@ref": "gr4",
            "@mimetype": "image/jpeg"
          },
          {
            "@category": "standard",
            "@height": "248",
            "@width": "282",
            "@_fa": "true",
            "$": "https://api.elsevier.com/content/object/eid/1-s2.0-S1381116914005792-gr3.jpg?httpAccept=%2A%2F%2A",
            "@multimediatype": "JPEG image file",
            "@type": "IMAGE-DOWNSAMPLED",
            "@size": "13540",
            "@ref": "gr3",
            "@mimetype": "image/jpeg"
          },
          {
            "@category": "standard",
            "@height": "444",
            "@width": "565",
            "@_fa": "true",
            "$": "https://api.elsevier.com/content/object/eid/1-s2.0-S1381116914005792-gr2.jpg?httpAccept=%2A%2F%2A",
            "@multimediatype": "JPEG image file",
            "@type": "IMAGE-DOWNSAMPLED",
            "@size": "50808",
            "@ref": "gr2",
            "@mimetype": "image/jpeg"
          },
          {
            "@category": "standard",
            "@height": "237",
            "@width": "282",
            "@_fa": "true",
            "$": "https://api.elsevier.com/content/object/eid/1-s2.0-S1381116914005792-gr10.jpg?httpAccept=%2A%2F%2A",
            "@multimediatype": "JPEG image file",
            "@type": "IMAGE-DOWNSAMPLED",
            "@size": "13134",
            "@ref": "gr10",
            "@mimetype": "image/jpeg"
          },
          {
            "@category": "standard",
            "@height": "358",
            "@width": "753",
            "@_fa": "true",
            "$": "https://api.elsevier.com/content/object/eid/1-s2.0-S1381116914005792-gr1.jpg?httpAccept=%2A%2F%2A",
            "@multimediatype": "JPEG image file",
            "@type": "IMAGE-DOWNSAMPLED",
            "@size": "42889",
            "@ref": "gr1",
            "@mimetype": "image/jpeg"
          },
          {
            "@category": "standard",
            "@height": "200",
            "@width": "500",
            "@_fa": "true",
            "$": "https://api.elsevier.com/content/object/eid/1-s2.0-S1381116914005792-fx1.jpg?httpAccept=%2A%2F%2A",
            "@multimediatype": "JPEG image file",
            "@type": "IMAGE-DOWNSAMPLED",
            "@size": "15589",
            "@ref": "fx1",
            "@mimetype": "image/jpeg"
          },
          {
            "@category": "thumbnail",
            "@height": "164",
            "@width": "212",
            "@_fa": "true",
            "$": "https://api.elsevier.com/content/object/eid/1-s2.0-S1381116914005792-gr9.sml?httpAccept=%2A%2F%2A",
            "@multimediatype": "GIF image file",
            "@type": "IMAGE-THUMBNAIL",
            "@size": "4474",
            "@ref": "gr9",
            "@mimetype": "image/gif"
          },
          {
            "@category": "thumbnail",
            "@height": "164",
            "@width": "206",
            "@_fa": "true",
            "$": "https://api.elsevier.com/content/object/eid/1-s2.0-S1381116914005792-gr8.sml?httpAccept=%2A%2F%2A",
            "@multimediatype": "GIF image file",
            "@type": "IMAGE-THUMBNAIL",
            "@size": "5551",
            "@ref": "gr8",
            "@mimetype": "image/gif"
          },
          {
            "@category": "thumbnail",
            "@height": "109",
            "@width": "219",
            "@_fa": "true",
            "$": "https://api.elsevier.com/content/object/eid/1-s2.0-S1381116914005792-gr7.sml?httpAccept=%2A%2F%2A",
            "@multimediatype": "GIF image file",
            "@type": "IMAGE-THUMBNAIL",
            "@size": "9622",
            "@ref": "gr7",
            "@mimetype": "image/gif"
          },
          {
            "@category": "thumbnail",
            "@height": "98",
            "@width": "219",
            "@_fa": "true",
            "$": "https://api.elsevier.com/content/object/eid/1-s2.0-S1381116914005792-gr6.sml?httpAccept=%2A%2F%2A",
            "@multimediatype": "GIF image file",
            "@type": "IMAGE-THUMBNAIL",
            "@size": "8430",
            "@ref": "gr6",
            "@mimetype": "image/gif"
          },
          {
            "@category": "thumbnail",
            "@height": "164",
            "@width": "182",
            "@_fa": "true",
            "$": "https://api.elsevier.com/content/object/eid/1-s2.0-S1381116914005792-gr5.sml?httpAccept=%2A%2F%2A",
            "@multimediatype": "GIF image file",
            "@type": "IMAGE-THUMBNAIL",
            "@size": "4015",
            "@ref": "gr5",
            "@mimetype": "image/gif"
          },
          {
            "@category": "thumbnail",
            "@height": "164",
            "@width": "193",
            "@_fa": "true",
            "$": "https://api.elsevier.com/content/object/eid/1-s2.0-S1381116914005792-gr4.sml?httpAccept=%2A%2F%2A",
            "@multimediatype": "GIF image file",
            "@type": "IMAGE-THUMBNAIL",
            "@size": "5093",
            "@ref": "gr4",
            "@mimetype": "image/gif"
          },
          {
            "@category": "thumbnail",
            "@height": "164",
            "@width": "186",
            "@_fa": "true",
            "$": "https://api.elsevier.com/content/object/eid/1-s2.0-S1381116914005792-gr3.sml?httpAccept=%2A%2F%2A",
            "@multimediatype": "GIF image file",
            "@type": "IMAGE-THUMBNAIL",
            "@size": "5245",
            "@ref": "gr3",
            "@mimetype": "image/gif"
          },
          {
            "@category": "thumbnail",
            "@height": "163",
            "@width": "208",
            "@_fa": "true",
            "$": "https://api.elsevier.com/content/object/eid/1-s2.0-S1381116914005792-gr2.sml?httpAccept=%2A%2F%2A",
            "@multimediatype": "GIF image file",
            "@type": "IMAGE-THUMBNAIL",
            "@size": "5738",
            "@ref": "gr2",
            "@mimetype": "image/gif"
          },
          {
            "@category": "thumbnail",
            "@height": "164",
            "@width": "195",
            "@_fa": "true",
            "$": "https://api.elsevier.com/content/object/eid/1-s2.0-S1381116914005792-gr10.sml?httpAccept=%2A%2F%2A",
            "@multimediatype": "GIF image file",
            "@type": "IMAGE-THUMBNAIL",
            "@size": "3937",
            "@ref": "gr10",
            "@mimetype": "image/gif"
          },
          {
            "@category": "thumbnail",
            "@height": "104",
            "@width": "219",
            "@_fa": "true",
            "$": "https://api.elsevier.com/content/object/eid/1-s2.0-S1381116914005792-gr1.sml?httpAccept=%2A%2F%2A",
            "@multimediatype": "GIF image file",
            "@type": "IMAGE-THUMBNAIL",
            "@size": "4072",
            "@ref": "gr1",
            "@mimetype": "image/gif"
          },
          {
            "@category": "thumbnail",
            "@height": "88",
            "@width": "219",
            "@_fa": "true",
            "$": "https://api.elsevier.com/content/object/eid/1-s2.0-S1381116914005792-fx1.sml?httpAccept=%2A%2F%2A",
            "@multimediatype": "GIF image file",
            "@type": "IMAGE-THUMBNAIL",
            "@size": "2895",
            "@ref": "fx1",
            "@mimetype": "image/gif"
          }
        ]
      },
      "link": {
        "@rel": "abstract",
        "@href": "https://api.elsevier.com/content/abstract/scopus_id/84920903243"
      }
    }
  }
}