{
  "metadata": {
    "title": "Tunable regioselectivity in 1,3-butadiene polymerization by using 2,6-bis(dimethyl-2-oxazolin-2-yl)pyridine incorporated transition metal (Cr, Fe and Co) catalysts",
    "authors": "; ; ",
    "journal": "Journal of Molecular Catalysis A: Chemical",
    "date": "2015-09-30",
    "doi": "10.1016/j.molcata.2015.05.013",
    "abstract": "",
    "uri": "https://api.elsevier.com/content/article/pii/S1381116915001867",
    "pii": "S1381116915001867"
  },
  "fulltext": {
    "full-text-retrieval-response": {
      "scopus-eid": "2-s2.0-84930944213",
      "originalText": "serial JL 271358 291210 291744 291790 291809 31 Journal of Molecular Catalysis A: Chemical JOURNALMOLECULARCATALYSISACHEMICAL 2015-05-21 2015-05-21 2015-06-03 2015-06-03 2019-10-29T10:48:39 1-s2.0-S1381116915001867 S1381-1169(15)00186-7 S1381116915001867 10.1016/j.molcata.2015.05.013 S300 S300.2 FULL-TEXT 1-s2.0-S1381116915X00082 2019-10-31T15:33:58.889284Z 0 0 20150901 20150930 2015 2015-05-21T16:16:32.69077Z absattachment articleinfo articletitlenorm authfirstinitialnorm authfirstsurnamenorm cid cids contenttype copyright crossmark dateloaded dateloadedtxt datesearch datesort dateupdated dco docsubtype doctype doi eid ewtransactionid hubeid indexeddate issn issnnorm itemstage itemtransactionid itemweight openaccess openarchive pg pgfirst pglast pii piinorm pubdateend pubdatestart pubdatetxt pubyr sectiontitle sortorder srctitle srctitlenorm srctype ssids alllist content subj subheadings suppl tomb volfirst volissue volumelist webpdf webpdfpagecount yearnav figure table body acknowledge affil articletitle auth authfirstini authfull authkeywords authlast highlightsabst primabst ref specialabst 1381-1169 13811169 true 406 406 C Volume 406 18 78 84 78 84 201509 September 2015 2015-09-01 2015-09-30 2015 Regular Papers article fla Copyright © 2015 Elsevier B.V. All rights reserved. TUNABLEREGIOSELECTIVITYIN13BUTADIENEPOLYMERIZATIONBYUSING26BISDIMETHYL2OXAZOLIN2YLPYRIDINEINCORPORATEDTRANSITIONMETALCRFECOCATALYSTS GONG D 1 Introduction 2 Results and discussion 2.1 Syntheses and characterization and complexes 2.2 The tunability of the selectivity 2.3 The temperature and cocatalyst effect on catalytic performance of Co(II)Cl2L 2.4 The tunable selectivity of Co(II)Cl2L 3 Experimental 3.1 General methods 3.2 X-ray structure determinations 3.3 Syntheses and characterization of complexes 3.4 Procedure for butadiene polymerization Acknowledgments References HIGASHIHARA 2011 323 375 T JITCHUM 2007 1408 1412 V NATORI 1998 982 987 I HADJICHRISTIDIS 2001 3747 3792 N AJELLAL 2008 4344 4349 N MOYER 1965 217 229 P LASKY 1962 82 85 J COLAMARCO 2004 450 454 E UENO 1979 4153767 H ASHITAKA 1983 1951 1972 H KAITA 2006 1359 1363 S ROBERT 2008 2801 2809 D TAUBE 2001 327 336 R LI 2006 8184 8188 X ZHANG 2007 1909 1913 L GAO 2008 4984 4991 W ENDO 1999 312 314 K PORRI 1998 53 61 L CARIOU 2009 1443 1444 R PORRI 1976 1465 1476 L GONG 2014 4169 4178 D GONG 2011 1584 1590 D GONG 2013 35 42 D WANG 2008 1983 1988 B ZHANG 2005 14562 14563 L KAITA 2003 180 184 S VANDER 1995 3008 3021 L MIYAZAWA 2000 2796 2800 A BAN 2004 2698 2704 H KAMINSKY 2002 7225 7229 W CAPACCHIONE 2008 4573 4575 C MILIONE 2007 5638 5643 S DASSAUD 1993 2631 2639 J CHANDRAN 2008 505 512 D ENDO 2006 4088 4094 K RICCI 2001 5766 5769 G RICCI 2004 3727 3732 G RICCI 2005 1845 1854 G CARIOU 2010 9039 9045 R CARIOU 2009 1443 1444 R APPUKUTTAN 2009 1150 1158 V HE 2012 5208 5211 L CHEN 2012 4409 4412 T HE 2012 202 206 L GONG 2014 100 107 D SMALL 1998 4049 4050 B BRITOVSEK 1999 8728 8870 G GONG 2009 6259 6264 D EVANS 2001 12095 12096 D WANG 2013 8661 8665 J KAZI 2005 6051 6054 A HEARD 1997 1083 1088 P NAKAYAMA 2011 692 697 Y GUO 2015 124 132 J NOMURA 1999 599 605 K NOMURA 1999 4732 4734 K TOBISCH 2009 1392 1405 S JANG 2002 1477 1480 Y CHEN 2014 320 325 T GONGX2015X78 GONGX2015X78X84 GONGX2015X78XD GONGX2015X78X84XD 2017-06-03T00:00:00Z http://creativecommons.org/licenses/by-nc-nd/4.0/ item S1381-1169(15)00186-7 S1381116915001867 1-s2.0-S1381116915001867 10.1016/j.molcata.2015.05.013 271358 2019-10-31T15:33:58.889284Z 2015-09-01 2015-09-30 1-s2.0-S1381116915001867-main.pdf https://s3.amazonaws.com/prod-ucs-content-store-us-east/content/pii:S1381116915001867/MAIN/application/pdf/5c2c0cfd8015f1a9025d5defc10307f1/main.pdf main.pdf pdf true 466702 MAIN 7 1-s2.0-S1381116915001867-main_1.png https://s3.amazonaws.com/prod-ucs-content-store-us-east/content/pii:S1381116915001867/PREVIEW/image/png/ffbc709ec6518f98c19c72d37337838f/main_1.png main_1.png png 54560 849 656 IMAGE-WEB-PDF 1 1-s2.0-S1381116915001867-fx1.sml https://s3.amazonaws.com/prod-ucs-content-store-us-east/content/pii:S1381116915001867/fx1/THUMBNAIL/image/gif/02b6ee0703d017ba1893cbf577e9dafe/fx1.sml fx1 true fx1.sml sml 3106 88 219 IMAGE-THUMBNAIL 1-s2.0-S1381116915001867-gr2.sml https://s3.amazonaws.com/prod-ucs-content-store-us-east/content/pii:S1381116915001867/gr2/THUMBNAIL/image/gif/da4bd5530c7f66ca90b336e0ea4853c5/gr2.sml gr2 gr2.sml sml 17921 164 198 IMAGE-THUMBNAIL 1-s2.0-S1381116915001867-gr3.sml https://s3.amazonaws.com/prod-ucs-content-store-us-east/content/pii:S1381116915001867/gr3/THUMBNAIL/image/gif/52d3e03ae2644343e8525c8a7c0e7934/gr3.sml gr3 gr3.sml sml 17238 164 190 IMAGE-THUMBNAIL 1-s2.0-S1381116915001867-gr4.sml https://s3.amazonaws.com/prod-ucs-content-store-us-east/content/pii:S1381116915001867/gr4/THUMBNAIL/image/gif/16510442ce565cd0421e028872348027/gr4.sml gr4 gr4.sml sml 17297 164 173 IMAGE-THUMBNAIL 1-s2.0-S1381116915001867-gr1.sml https://s3.amazonaws.com/prod-ucs-content-store-us-east/content/pii:S1381116915001867/gr1/THUMBNAIL/image/gif/834519b920b0907d8a7e7d1cd15f8c63/gr1.sml gr1 gr1.sml sml 3571 93 219 IMAGE-THUMBNAIL 1-s2.0-S1381116915001867-gr1.gif https://s3.amazonaws.com/prod-ucs-content-store-us-east/content/pii:S1381116915001867/gr1/DOWNSAMPLED/image/gif/ce0bc3ec12e4e4a6975c00894611cb6e/gr1.gif gr1 gr1.gif gif 6229 149 353 IMAGE-DOWNSAMPLED 1-s2.0-S1381116915001867-fx1.jpg https://s3.amazonaws.com/prod-ucs-content-store-us-east/content/pii:S1381116915001867/fx1/DOWNSAMPLED/image/jpeg/24b9671d156b2fa8a93a2c2961102ec7/fx1.jpg fx1 true fx1.jpg jpg 14808 200 500 IMAGE-DOWNSAMPLED 1-s2.0-S1381116915001867-gr2.jpg https://s3.amazonaws.com/prod-ucs-content-store-us-east/content/pii:S1381116915001867/gr2/DOWNSAMPLED/image/jpeg/8e423c4e1d687fb456720ed3cd7979b9/gr2.jpg gr2 gr2.jpg jpg 33600 188 227 IMAGE-DOWNSAMPLED 1-s2.0-S1381116915001867-gr3.jpg https://s3.amazonaws.com/prod-ucs-content-store-us-east/content/pii:S1381116915001867/gr3/DOWNSAMPLED/image/jpeg/c1aea989c916c554d5de51611aae601a/gr3.jpg gr3 gr3.jpg jpg 32633 198 230 IMAGE-DOWNSAMPLED 1-s2.0-S1381116915001867-gr4.jpg https://s3.amazonaws.com/prod-ucs-content-store-us-east/content/pii:S1381116915001867/gr4/DOWNSAMPLED/image/jpeg/291598b48ab07c04fa227f7be2b6edd6/gr4.jpg gr4 gr4.jpg jpg 37465 252 266 IMAGE-DOWNSAMPLED 1-s2.0-S1381116915001867-gr1_lrg.gif https://s3.amazonaws.com/prod-ucs-content-store-us-east/content/pii:S1381116915001867/gr1/HIGHRES/image/gif/bdbf26d6420bb35de3e4f92fb5aaa4ad/gr1_lrg.gif gr1 gr1_lrg.gif gif 30351 1323 3132 IMAGE-HIGH-RES 1-s2.0-S1381116915001867-fx1_lrg.jpg https://s3.amazonaws.com/prod-ucs-content-store-us-east/content/pii:S1381116915001867/fx1/HIGHRES/image/jpeg/1ef1afa5f667e588c2b3f473799bd61b/fx1_lrg.jpg fx1 true fx1_lrg.jpg jpg 108493 886 2213 IMAGE-HIGH-RES 1-s2.0-S1381116915001867-gr2_lrg.jpg https://s3.amazonaws.com/prod-ucs-content-store-us-east/content/pii:S1381116915001867/gr2/HIGHRES/image/jpeg/e34a92f94e13b92498385b4fb3595b3e/gr2_lrg.jpg gr2 gr2_lrg.jpg jpg 116116 834 1008 IMAGE-HIGH-RES 1-s2.0-S1381116915001867-gr3_lrg.jpg https://s3.amazonaws.com/prod-ucs-content-store-us-east/content/pii:S1381116915001867/gr3/HIGHRES/image/jpeg/745ca35823655bf41753c3bc9eb41c33/gr3_lrg.jpg gr3 gr3_lrg.jpg jpg 131259 877 1018 IMAGE-HIGH-RES 1-s2.0-S1381116915001867-gr4_lrg.jpg https://s3.amazonaws.com/prod-ucs-content-store-us-east/content/pii:S1381116915001867/gr4/HIGHRES/image/jpeg/ae923e54e3337cc04bd4795e1fa504b4/gr4_lrg.jpg gr4 gr4_lrg.jpg jpg 176107 1118 1180 IMAGE-HIGH-RES MOLCAA 9499 S1381-1169(15)00186-7 10.1016/j.molcata.2015.05.013 Elsevier B.V. Fig. 1 2,6-Bis(dimethyl-2-oxazolin-2-yl) pyridine supported Cr(III)Cl3L, Fe(III)Cl3L, Fe(II)Cl2L and Co(II)Cl2L complexes. Fig. 2 ORTEP drawing of complex Cr(III)Cl3L with thermal ellipsoids at 30% probability level. Hydrogen atoms have been omitted for clarity. Fig. 3 ORTEP drawing of complex Fe(III)Cl3L with thermal ellipsoids at 30% probability level. Hydrogen atoms have been omitted for clarity. Fig. 4 ORTEP drawing of complex Co(II)Cl2L with thermal ellipsoids at 30% probability level. Hydrogen atoms have been omitted for clarity. Table 1 Crystal data and structure refinements of complexes Cr(III)Cl3L, Fe(III)Cl3L and Co(II)Cl2L. Cr(III)Cl3L Fe(III)Cl3L Co(II)Cl2L Formula C15H19Cl3CrN3O2 C15H19Cl3FeN3O2 C15H19Cl2Co1N3O2 Molecular weight 431.68 435.53 403.16 Crystal system Orthorhombic Orthorhombic Monoclinic Space group Pnma Pnma P21/C a (Å) 17.6621(4) 17.7708(4) 10.1419(2) b (Å) 8.4656(2) 12.7778(3) 15.7789(4) c (Å) 12.6468(3) 8.3375(2) 11.2958(3) α (deg) 90.00 90.00 90.00 β (deg) 90.00 90.00 98.996(2) γ (deg) 90.00 90.00 90.00 V (Å3) 1890.95(8) 1893.21(8) 1785.41(7) Z 4 4 4 D calcd (Mg/m3) 1.544 1.561 1.500 Absorp coeff (mm−1) 1.008 1.220 1.271 F(000) 10318 13360 828 Crystal size(mm) 0.33×0.21×0.21 0.29×0.20×0.11 0.33×0.21×0.18 θ Range (deg) 1.02 to 26.33 1.02–26.33 0.86–26.03 No. of reflns collected 7256 7501 9891 No. of indep reflns 2384(R int =0.0293) 2396(R int =0.028) 4282(R int =0.0283) No. of data/restraint /params 2384/0/120 2396/0/120 4282/0/212 GOF on F2 1.085 1.069 1.052 R 1(I>2sigma(I)) 0.0368 0.0333 0.0353 wR 2 0.0830 0.0704 0.0745 Table 2 The tunable selectivity of Pybox(-Me2) ligated Cr(III)Cl3L, Fe(III)Cl3L, Fe(II)Cl2L and Co(II)Cl2L catalysts. Run Precursor [MAO]/ [Mt] Yield (%) Microstructure (%) M n PDI Trans-1,4 Cis-1,4 1,2 (104) 1 Cr(III)Cl3L 300 47.4 93.3 4.9 1.8 1.6 1.9 2 Cr(III)Cl3L 600 53.2 91.9 6.7 1.4 – – 3 Fe(III)Cl3L 300 37.0 59.5 30.5 10.0 2.9 2.5 4 Fe(III)Cl3L 600 42.1 60.4 31.6 8.0 – – 5 Fe(II)Cl2L 300 56.9 55.6 32.6 11.2 3.1 2.9 6 Fe(II)Cl2L 600 48.9 57.8 30.7 11.5 – – 7 Co(II)Cl2L 300 75.2 3.5 95.3 1.2 11.6 2.7 Polymerization conditions: toluene, 20mL; butadiene, 0.1mol; precursor, 0.05 mmol; 25°C, polymerization time, 4h. Table 3 The performance of Co(II)Cl2L catalyzed cis-1,4 selective polymerization. Run Cocatalyst [Al]/ [Mt] Yield (%) Microstructure (%) M n PDI Trans-1,4 Cis-1,4 1,2 (104) 8 MAO 300 a 47.8 3.4 95.8 0.8 9.0 1.7 9 MAO 300 b 72.6 3.0 94.7 2.3 9.6 2.2 10 MAO 300 c 23.1 5.2 92.7 2.1 9.9 2.2 11 MAO 100 47.4 93.3 4.9 1.8 5.6 1.9 12 MAO 300 75.2 3.5 95.3 1.2 11.6 2.7 13 MAO 600 56.9 2.4 96.6 1.2 6.1 2.9 14 AliBu3 50 trace – – – – – 15 AliBu3 100 trace – – – – – 16 Ph3C+[B(C6F5)4]−/TIBA 50 d 71.9 2.9 91.2 5.9 10.5 2.7 17 AlEt2Cl 50 97.2 1.5 96.9 1.6 14.1 2.2 18 AlEt2Cl 100 97.4 1.6 97.0 1.4 15.9 2.2 19 Al2Et3Cl3 50 95.3 0.9 98.1 1.0 10.2 2.8 20 Al2Et3Cl3 100 97.5 1.2 97.2 1.6 9.5 2.4 Polymerization conditions: toluene, 20mL; butadiene, 0.1 mmol; precursor, 0.05 mmol; reaction temperature, room temperature. a At 0°C. b At 38°C. c At 55°C. d Ph3C+[B(C6F5)4]−/Co=1.0, TIBA/Co=50, polymerization time, 4h. Table 4 The phosphine effect on the catalytic performance of the cobalt catalyst. Run Phosphine (P) [P]/ [Co] Yield (%) Microstructure (%) M n PDI Trans-1,4 Cis-1,4 1,2 (104) 21 PPh3 0.1 85.5 7.8 63.2 29.0 9.0 2.6 22 PPh3 0.3 59.2 9.4 50.1 40.5 9.9 2.5 23 PPh3 0.6 78.8 7.6 30.1 62.3 9.7 2.5 24 PPh3 1.0 88.3 3.1 13.3 83.6 9.2 2.1 25 PPh3 1.2 90.0 3.7 13.9 82.4 11.0 2.3 26 PPh3 1.5 90.5 3.8 13.2 83.0 11.1 2.5 27 PEt3 1.0 56.5 3.5 79.4 17.1 7.4 2.7 28 PCy3 1.0 73.2 10.9 60.4 28.7 8.7 2.9 Polymerization conditions: toluene, 20mL; butadiene, 0.1mol; Co(II)Cl2L, 0.05 mmol; reaction temperature, room temperature, aat 0°C, bat 50°C, polymerization time, 4h. Tunable regioselectivity in 1,3-butadiene polymerization by using 2,6-bis(dimethyl-2-oxazolin-2-yl)pyridine incorporated transition metal (Cr, Fe and Co) catalysts Dirong Gong a b ⁎ Wen Liu a Weijing Pan a Tao Chen b c Xiaoyu Jia e f Kuo-Wei Huang b ⁎⁎ Xuequan Zhang d a Department of Polymer Science and Engineering, Faculty of Materials Science and Chemical Engineering, Ningbo University, Ningbo 315211, PR China Department of Polymer Science and Engineering Faculty of Materials Science and Chemical Engineering Ningbo University Ningbo 315211 PR China b King Abdullah University of Science and Technology, Division of Physical Sciences and Engineering and KAUST Catalysis Center, Thuwal 23955-6900, Saudi Arabia King Abdullah University of Science and Technology Division of Physical Sciences and Engineering and KAUST Catalysis Center Thuwal 23955-6900 Saudi Arabia c MOE Key Laboratory of Advanced Textile Materials & Manufacturing Technology, National Base for International Cooperation in Science & Technology of Textiles and Daily Chemistry, Zhejiang Sci-Tech University, Hangzhou 310018, PR China MOE Key Laboratory of Advanced Textile Materials & Manufacturing Technology National Base for International Cooperation in Science & Technology of Textiles and Daily Chemistry Zhejiang Sci-Tech University Hangzhou 310018 PR China d Key Laboratory of Synthetic Rubber, Changchun Institute of Applied Chemistry, Chinese Academy of Sciences, 5625 Renmin Street, Changchun 130022, PR China Key Laboratory of Synthetic Rubber Changchun Institute of Applied Chemistry Chinese Academy of Sciences 5625 Renmin Street Changchun 130022 PR China e Key Laboratory of Urban Environment and Health, Institute of Urban Environment, Chinese Academy of Sciences, No.1799, Jimei Road, Xiamen, Fujian 361021, PR China Key Laboratory of Urban Environment and Health Institute of Urban Environment Chinese Academy of Sciences No. 1799 Jimei Road Xiamen Fujian 361021 PR China f Ningbo Urban Environment Observation and Research Station-NUEORS, Chinese Academy of Sciences, Ningbo, Zhejiang 315830, PR China Ningbo Urban Environment Observation and Research Station-NUEORS Chinese Academy of Sciences Ningbo Zhejiang 315830 PR China ⁎ Corresponding author at: Department of Polymer Science and Engineering, Faculty of Materials Science and Chemical Engineering, Ningbo University, Ningbo 315211, PR China. Tel.: +8618258797241. ⁎⁎ Corresponding author. Graphical abstract Tridentate complexes Cr(III)Cl3L, [L =2,6-bis(dimethyl-2-oxazolin-2-yl) pyridine], Fe(III)Cl3L, Fe(II)Cl2L and Co(II)Cl2L have been prepared and fully characterized. The solid structures of Cr(III)Cl3L, Fe(III)Cl3L and Co(II)Cl2L have been revealed by single crystal X-ray diffraction, and the Cr(III)Cl3L and Fe(III)Cl3L complexes both exhibit a distorted octahedral geometry, while the Co(II)Cl2L complex has a trigonal bipyramidal conformation. Four complexes have been examined in regioselective polymerization of butadiene in combination with MAO in toluene at room temperature. The trans-1,4, cis-1,4 enchainment of resultant polybutadiene are controlled by the metal center. Activated by MAO, complex Cr(III)Cl3L produces high level of trans-1,4 selectivity (trans-1,4 up to 93.3%) with moderate polymer yield, complexes Fe(III)Cl3L and Fe(II)Cl2L both show equal cis-1,4 and trans-1,4 with minor 1,2 selectivity (<10%), and Co(II)Cl2L catalyst displays predominated cis-1,4 selectivity, which can be shifted to 1,2 selectivity by adding PPh3 as an additive. Thus, tuning of the cis-1,4, trans-1,4 and 1,2 selectivity in full range via central metal and additive chosen by these 2,6-bis(dimethyl-2-oxazolin-2-yl) pyridine supported catalysts has been achieved. Keywords Transition metal catalysts 1,3-butadiene Selectivity 2,6-bis(dimethyl-2-oxazolin-2-yl)pyridine Controllable microstructure 1 Introduction Of the varieties of elastomers, polybutadiene has been one of the most regarded materials for many practical applications. Stereochemistry in polymerization of butadiene plays a crucial role in determining the mechanical properties and the end use of the materials. The development of new polymerization catalysts for efficient control in chain architectures such as stereochemistry, functionality and chain length in polyconjugated dienes synthese has been one of most active research areas in rubber chemistry as it allows the synthesis of tailor-made polymers with the expected properties. Traditional free radical and anionic conjugated diene polymerization processed in a random manner resulted in stereoirregular chain microstructure, although recent advances shown precise polymer architecture specified in chain components and length such as block, graft and star polymers based on conjugated dienes and styrene have been achieved via controllable anionic and radical synthetic strategies [1–5]. High level of stereoregulated, but not the molecular weight of conjugated diene polymers can date back to the discovery and emplyment of Z-N type of catalysts since the middle of last century, which has remained one of the widely used organometallic mediated catalytic processes for large production of various rubber based materials. Industry applied systems such as tianium tetraethoxides/AlEt3 [6], vandium trichloride/AlR3 [7–8], Co(acac)3/CS2 or Ph3P [9–10] and recently emerged rare earth catalysts [11,12] are notable for their unique catalytic properties, in particular, polymers with high level of regioregularity such as trans-1,4 [11–13], cis-1,4 [14–23] and 3,4 (1,2) [24–25] regio- and/or stereoselectivity, as such, 1,2-syndiotactic [23] for polybutadiene, and syndiotactic 3,4 (1,2) [24], isotactic 3,4 [25] for polyisoprene as well as their block combinations have been unprecedently achieved. Research dedicated to the design and development of homogeneous, single-site catalysts for the synthesis of polydienes during the past twenty years have provided tremendous momentum in catalyst evolution and have revolutionized the field of polyolefin and polydiene research by establishing new opportunities for mechanistic understanding, catalyst control, and tailored polymer synthesis unachievable for heterogeneous catalyst systems. The infacy of metallocene catalyst has made significant progress with the development of single site group-3, 4 and lanthinide metallocene catalysts [26–30], and this revolution allows us to manipulate polymer microstructures, especially the powerful copolymerization capability of conjugated dienes and various α-olefin monmers furnishing varieties of copolymers with unique chemical and physical properties [31–33]. In paralled to the metallocene revolution, momentous developments have also been witnessed since the discovery of highly active nonmetallocene mid- and late-transition metal polymerization catalysts. Research in this area involves the design of various new ancillary ligands to support and activate the metal center toward diene monomers. In this respect, there has been increasing interests in the applications of NO [21,34–35], SOOS [31], PP [36–38], and pincer ligand N,N,X (X =N, P and C) [22,23,39–41] covering over a broad range of catalytic reactions, in particular, catalyzing diene with polar monomers, as such straightforwards access to a new family of functional rubber materials. We have been establishing pyridine based compounds as ligand family for transition metal catalyzed organic transformations [42–44] and olefin polymerizations [45]. The modification of substituents at proper positions of ligand may conveniently be altered to allow for the fine-tuning of both the steric and electronic properties of ligand, which in turn mediate metal induced catalytic performances. The discovery of bis(arylimino) pyridine ligand assisted olefin catalysts by Brookhart [46] and Gibson [47] have stimulated the evolvement of a great diversity of pincer complexes and many other geometry type of complexes as catalyst precursors over the past two decades. This finding has also intrigued us to investigate the catalytic performance in conjugated diene polymerization and allowed access to various microstructural controlled polybutadienes. The catalyst structure-polymer microstructure relationships show distinctive monomer coordination and insertion modes are operated [48]. In persuit of efficient catalyst, we also have developed classes of NNN [23] and NNP [42–45] pyridine transition metal olefin and conjugated diene catalysts which have straightforward transformed butadiene to generation of polybutadiene with desired structures. Herein, we report 2,6-bis(dimethyl-2-oxazolin-2-yl) pyridine (Pybox(-Me2)) supported transition metal complexes for microstructure controllable butadiene polymerization. 2 Results and discussion 2.1 Syntheses and characterization and complexes Pybox(-Me2) and the corresponding complexes were prepared with moderate to good yields (Fig. 1 ). The reaction of metal chlorides with 1.0 equiv. of the ligand in THF overnight under argon atmosphere, followed by removal of the solvent under reduced pressure afforded the corresponding complexes as stable solids. Crystals of four complexes Cr(III)Cl3L(C1), Fe(III)Cl3L(C2), Fe(II)Cl2L(C3) and Co(II)Cl2L(C4) obtained from recrystallization in methanol/hexane or diethylether mixtures give satisfactory elemental analyses, mass spectroscopy and IR results all consistent with the expected formula, which are all subject to catalysis. The broad peaks in NMR (CD3OD as solvent), however, are unable to give additional structural information due to the paramagnetic properties of all four complexes. Crystals of complexes Cr(III)Cl3L, Fe(III)Cl3L and Co(II)Cl2L suitable for X-ray diffraction were obtained at −30°C by double-layering methanol or DMF solutions of the complexes either with n-hexane or diethyl ether. The crystal data and structure refinements of complexes were listed in Table 1 . The differences in metal center do not lead to the significant distinction in their crystal and molecular structure. Single crystal X-ray structure analyses of Cr(III)Cl3L (Fig. 2 ) and Fe(III)Cl3L (Fig. 3 ) complexes are both crystallized in orthorhombic system and Pnma space group. They have an identical molecular structure with three coordinated nitrogen atoms and three coordinated chlorides, and the geometry at the metal center is a little distorted from the typical octahedral geometry. The whole molecule displays C 2v symmetry about the equatorial plane with the other two nitrogens situated on the ends of the bent axis, in consistent with the decribed six coordinated iron and chromium complexes [22,23]. As seen from the crystal structure, the coordination of three chlorides builds an equatorial plane approximately vertical to the plane defined by three chelating nitrogens. The metal pyridinyl nitrogen bond (MtN1, Mt denotes Cr and Fe) is shorter than the corresponding two MtN (Pybox(-Me2)) bonds in both Cr and Fe complexes, with CrN2 (2.039(2)Å and 2.0856(17)Å) having a remarkably shorter distance than the analogous bond FeN2(2.169(2) Å, 2.1655(15) Å), implying a contracted ionic radius of chromium (III). The metal and trans-chloride bond distance (with respect to pyridinyl nitrogen) is generally less than the other metal-chloride bonds, while the bond value of Cr–Cl2 (2.2907(8)Å) is slightly more than the corresponding Fe1–Cl2 (2.2539(8)Å). A relatively open coordinative environment constructed surrounding the chromium metal center can be observed from the smaller N1–Cr1–N1A (153.48(10)°) angle compared to analogous N1–Fe1–N1A 146.62(9)°. The crystallographic analysis reveals that the Co(II)Cl2L (Fig. 4 ) is a typical five-coordinated complex with pseudo-trigonal bipyramidal configuration about the cobalt center with tridentated nitrogens and two chlorides moieties. The pyridinyl nitrogen atom and two chlorides compose an equatorial plane, with the sum of three equatorial angles (119.79(3)°, 139.43(5)° and 100.77(5)°) being 359.99°, indicative of the central metal located exactly on the plane, and the Co–N2 and Co–N3 occupying the apical position with forming a subtended angle N2–Co–N3 of 147.89(7)°. The Cl1–Co–Cl2 is 119.79(3)° and N1–Co–N2 is 147.89(7)°, which are very close to values of the five coordinated cobalt dichloride complexes. Generally, the parameters of metal-nitrogen and metal-chloride bonds vary with the electron status of the central metal Cr(III) (d 3), Fe(III) (d 5) and Co(II) (d 7), with average distance changing in the order of Co(II)–N(2.168Å)>Fe(III)–N (2.167Å)>Cr(III)–N (2.070Å) and Fe(III)–Cl(2.312Å), Cr(III)–Cl (2.312Å)>Co(II)–Cl(2.282Å). These subtle structures may affect their catalytic performance by influencing the monomer orientation, coordination mode, insertion into the growing polymer as well as the interconversion of syn-ally between anti-ally intermediate isomers. 2.2 The tunability of the selectivity 2,6-Bis(oxazolin-2-yl) pyridines are versatile ligands assisted in metal catalysts for various organic transformation due to their feasible syntheses and easy modification of the steric and electronic properties, in particular, adjusting enantioselectivity via introducing chiral center into appropriate place of ligand has led to tremendous efficient chiral catalysts for organic building [49–52]. Description of their catalysis behavior for polymerization, however, is conspiculously less, and reported examples are only limited in chromium [53], iron [54] and ruthenium catalysts [55,56]. The polymerization results in this study are described including the effects of various catalyst and polymerization parameters such as metal center, cocatalyst and additive. The polymerization conditions and polymer analysis results were complied in Table 2 . Discussion of the experiment data in addition to the relation between catalytic performance and catalyst structure are also conducted, which could allow us to explore potential efficient catalysts. We begin our study with MAO as cocatalyst, as it has been demonstrated as a versatile activator in later transition metal catalyzed conjugated diene polymerization. It is worth noting, under identical conditions, blank experiments carried out with CrCl3/MAO, FeCl3/MAO and FeCl2/MAO alone show their inability to polymerize butadiene, while we did observe slow polymerization process with an estimated 20% in polymer yield and 92% cis-1,4 selectivity for CoCl2/MAO heterogeneous catalyst [48]. Herein, we examine with MAO/MtL (Mt=CrCl3, FeCl3, FeCl2 and CoCl2, L=Pybox(-Me2)) at value of 300 and 600. On the basis of the 13C NMR and IR analysis, microstructures in the resultant polymers were calculated and the data were also given in Table 2. Interestingly, the Pybox(-Me2) ligated transition metal catalysts/MAO shows a markable sensitivity to the central metal of catalyst. Chromium catalyst is basically favorable for trans-1,4 selectivity of 93.3% (Table 2, run 1), consistent with that of chromium analogue reported [53]. Of note is that an identical performance observed: a moderate trans-1,4 selectivity (59.5% and 55.6%, respectively) and cis-1,4 selectivity (30.5% and 32.6%, respectively) has been found for iron(III) (Table 2, run 3) and iron(II) (Table 2, run 5) catalysts, implying similar active centers involved in catalysis after activation by MAO, while cobalt catalyst displays a typical cis-1,4 selectivity (95.3%) (Table 2, run 7). This switchable selectivity induced by the metal centers can be elucidated by diene mechanism developed by Tobisch [57,58]. Our publications [23,48] relating to bisiminopyridine ligated iron, cobalt and nickel catalyzed butadiene polymerization have also proposed the possible reaction mechanism operated in the cis-1,4, trans-1,4 and 1,2 polymerizations and polymerization performances here indicate the analogous reaction mechanism is operated by tridentated ligand in the present catalyst system. It is assumed that at the initial stage, the reaction of complexes with Me-abstracting MAO reagent forms a cationic species of the type [LMtMe]+, and the generated vacant site is opening available for monomer either via trans-η 2 or cis-η 4 coordination mode. In case of Cr catalyst, the trans-η 2 coordinated monomer inserts into the Cralkyl bond forming allyl coordinated terminal group which takes preferably a thermal stable syn-conformation, affording trans-stereoregulated growing polymer chain. Considering one coordination bond (CoNpybox(-Me2)) is likely to cleavage [48] for generating cobalt active species, cis-η 4 coordination mode thus is assumed, and the formed anti-allyl configurated polymer chain ultimately lead to a kinetic favored cis-1,4 product. While for two Fe catalysts, due to the 16e characteristic of cationic iron center, trans-η 2 coordination of monomer to metal center could be considered first, in case of monomer insertion rate is comparable with the isomerization arrangement of syn-allyl iron species to anti-allyl configuration, a comparable cis-1,4 and trans-1,4 enchained product tends to be generated. This isomerization mechanism proceeding with retention or inversion of one configuration is of upmost importance when addressing stereospecific polymerization of butadiene. However, adjusting MAO addition (Al/Co=300 or 600) amount does not effect the selectivity significantly, and slightly influences on the polymer yield only. By GPC analysis, molecular weight of ten-thousand of magnitude and a polydispersity index (PDI) of 2–3 is calculated, implying single site active species are generated. 2.3 The temperature and cocatalyst effect on catalytic performance of Co(II)Cl2L Cis-1,4 polybutadiene is well-known for the excellent low abrasion and low heat building, and of particular interest is a slightly increased cis-1,4 percentage of high cis-1,4 polybutadiene (>98%) usually brings about a prominent stress induced crystallization which improves the mechanic properties significantly. Herein, we are examing the Co(II)Cl2L catalyzed cis-1,4 selective polymerization in detail. A temperature-dependent study is performed first for Co(II)Cl2L. At a precatalyst loading of 0.1mmol and employing 30mmol of MAO, an optimized polymer yield of 75.2% is recorded at room temperature with a number molecular weight (M n) of 11.6×104 (Table 3 , run 13). Compared with that under room temperature, the poor efficiency of the catalytic system is both found at 0°C (Table 3, run 8) andat 38°C with almost no effect on M n and selectivity (Table 3, run 9), however, when increasing temperature to 55°C (Table 3, run 10), polymer yield has decreased significantly, concurrent with decreased molecular weight and increased polydispersity index. Employing the optimized polymerization temperature, results for various cocatalysts activated cobalt catalyst for butadiene polymerization were tabulated in Table 3 (run 14–20). We examine the optimal operative cocatalyst for this study. Cocatalysts MAO, triisobutyl aluminum (TIBA), Ph3C+[B(C6F5)4]− and ethyl aluminum chlorides are selected and studied here for catalyst Co(II)Cl2L. We begin our cocatalyst studies from low MAO excess ratios, a polymer yield about 47.4% is observed at MAO/Co=100 (run 11 in Table 3). Run 12–13 in Table 3 show that both the polymer yield and M n of the polymers reaching maximum values at MAO/Co=300, and the produced polymers possess a very low PDI. Of note is that the selectivity is varied significantly, and it is found to be mainly trans-1,4 about 93.3% at MAO/Co=100, 95.3 % cis-1,4 at value of 300, and increased to 96.6% at 600. Presumably, the generated active species (at low MAO/Co=100) favors trans-η2 coordination with monomer, thus producing trans-1,4 polymer. In the case of MAO/Co=300 or 600, one of CoN bond is likely to diassociate by nucleophilic attack from excess of MAO, and the monomer tend to coordinates with metal by cis-η4 mode, as one more vacant site is available for binding, therefore, cis-1,4 polymer is produced. These results indicate MAO amount has ability to control the M n of polymers by chain transfer to aluminium and the selectivity without major critical changes polymer yield. Tested with TIBA, it is observed that this cocatalyst is virtually inactive toward butadiene, however addition of Ph3C+[B(C6F5)4]− results in an active catalyst for butadiene polymerization, with moderate activity and improved cis-1,4 selectivity. The increased activity indicates that the combined addition of TIBA and Ph3C+[B(C6F5)4]− is responsible for a synergetic catalytic property, producing more active cationic center, rather than mere action as an oxygen and moisture scavener agent for TIBA. The more Lewis acidic AlEt2Cl and Al2Et3Cl3 are tested and found to be superior to MAO, and TIBA/Ph3C+[B(C6F5)4]−on polymer yield and cis-1,4 specific selectivity, indicative of the generated more acidic cationic species is mainly responsible for accelerated monomer coordination, insertion and thus chain propogation. It is also significant that AlEt2Cl and Al2Et3Cl3 increase the electronic deficiency of the cationic LCoR+, enhance electrophilicity at the metal center and facilitate butadiene binding and activation, ultimately leading to an increased catalytic activity. Interestingly, the M n and PDI of all polymers remain a relatively narrow with range from 1.9–2.7, virtually independent of the nature of cocatalysts. 2.4 The tunable selectivity of Co(II)Cl2L Tuning the catalytic selectivity in situ is an efficient method for simultaneously realizing varieties of polymers based on one catalyst system, to reach this goal, various strategies including elaboration of ligand structure, central metal chosen, polymerization parameters screening such as temperature, cocatalyst and solvent as well as addition of additive have been reported. The importance of additive used mainly arised from powerful tuning ability, as well as their commercial availability, avoiding elaborate multi-step synthesis, which allow straightforward to useful industrial catalyst recipes. Cobalt catalysts are well-known for versatile selectivities as the catalytic performance can be well controlled by the catalyst components and polymerization parameters [21–23,38]. Herein, we investigate the selectivity under preexamined conditions by adding π-donor PPh3. Introducing 0.1 equiv. of Ph3P increases the polymer yield and 1,2-selectivity, though the typical cis-1,4 selectivity is intact. Generally, increasing of PPh3 leads to increasing in polymer yield and 1,2 selectivity (run 22-24). The dramatic selectivity changing from 96% of 1,4- up to 83.6 % for 1,2-enchainment with the use of 1.0 equivalent of PPh3 indicates the insertion mechanisms are significantly influenced by the use of phosphine containing additives, which results in a 1,2-insertion instead of 1,4-insertion. Also, the selectivity and the polymer yields are related to the phosphine feeding amount, both values reaching a pleatu at P/Co=1.0, and further increase feeding does not observe significant additional increases (Table 3, run 24–26) in Table 4 . This means 1.0 equivalent of phosphine is required to occupy the one vacant site, thus making trans-η 2 rather than cis-η 4 coordination of monomer to metal center possible, and the subsequent C3 insertion leads to a 1,2 rich enchainment [23,57]. Interestingly, addition of σ-donor PEt3 or PCy3 (Table 3, run 27,28) to the cobalt catalyst leads to only a slightly increased 1,2 selectivity, with 1,2 percentage of 17.1% and 28.4%, respectively, suggestive of the less importance of σ-nature of additive to 1,2 insertion [58]. Gel permeation chromatography (GPC) analyses on the resultant polymers by these catalysts show polymers have relative high molecular weight and basically unimodal and narrow PDI, keeping a characteristic for the single-site nature of these catalyst systems. In summary, we have prepared and characterized Pybox(-Me2) supported chromium, iron and cobalt butadiene catalysts. Feasible controlling of polymer microstructure from cis-1,4 to trans-1,4 has been realized via metal chosen, and controlling of 1,2 and cis-1,4 percentage within wide range have also been achieved by adding additive PPh3 in cobalt catalyst. 3 Experimental 3.1 General methods All experiments that required inert atmosphere were performed under argon using a Braun Labmaster drybox or standard Schlenk line techniques. 2,6-(chloromethyl) pyridine, 2-amino-2-dimethylpropanol and phosphines were purchased from Alfa Aesar. Methylaluminoxane, AliBu3, AlEt2Cl, Al2Et3Cl3 and Ph3C+[B(C6F5)4]− were purchased from AkzoNoble and Strem. All solvents were purified by standard methods. Polymerization grade 1,3-butadiene was purified by AlEt3 prior to use. Deturated solvents were purchased from Cambridge Isotope Laboratories, Inc. degassed, and dried over activated 4Å molecular sieves prior to use. Ligand was synthesized by our reported method [59]. NMR analyses of ligands and polymers were performed on a Bruker spectrometer, and the microstructures of polybutadiene were calculated by our reported methods [48].. IR spectra of ligands were recorded on a BRUKE Vertex-70 FIR spectrophotometer. Elemental analyses for carbon, nitrogen and hydrogen were carried out with an elemental Vario EL spectrometer. ICP–MS analyses for chromium, iron and cobalt were run by Agilent 7500cx after microwave digestion with concentrated HCl. The molecular weights (M w and M n) and the molecular weights distributions (M w/M n) of polymer samples were measured by VISCOTEK GPC1000 with TDA305 (Triple Detector Array) as detector at 30°C using THF as the solvent at a flow rate of the eluent of 1mL/min, calibrated by narrow polystyrene standards. 3.2 X-ray structure determinations Single crystals subject to analysis were grown by diffusion of hexane or diethyl ether to a saturated methanol or dichloromethane solution containing the corresponding complexes. X-ray analysis data were collected on a Bruker SMART APEX diffractometer with a CCD area detector, using graphite monochromated Mo K radiation (λ =0.71073Å). Crystal class and unit cell parameters were determined by the SMART program package. Reflection data file was yielded from raw frame data by SAINT and SADABS and the structures were solved based on SHELXTL program. Refinement was processed on F2 anisotropically for all non-hydrogen atoms by the full-matrix least-squares method. CCDC reference numbers 1,005,508 and 1,005,506, 1,005,507 are for complexes Cr(III)Cl3L, Fe(III)Cl3L and Co(II)Cl2L, respectively. 3.3 Syntheses and characterization of complexes [2,6-Bis(dimethyl-2-oxazolin-2-yl) pyridine]chromium trichloride (Cr(III)Cl3L) To a suspension of CrCl3(THF)3 (750mg, 2mmol) in THF (5mL) was added a THF (10mL) solution of ligand 2,6-bis(dimethyl-2-oxazolin-2-yl) pyridine (599mg, 2.2mmol). A green suspension was formed after about 2h at room temperature, and further stirred overnight was required to complete the reaction. A green solid (1.08g, 80% in yield) was finally collected by filtration, washed with diethyl ether (10mL×3) and drying. The other complexes Fe(III)Cl3L-Co(II)Cl2L were prepared by the similar method. Yield: 80%. IR (KBr, cm−1): 1620 (vC=N). Anal. Calc. for C15H19Cl3CrN3O2: C, 41.73; H, 4.44; N, 9.73. Found: C, 41.31; H, 4.53; N, 9.67 %. Cr: 12.04% (Calc.12.19%). MS (ESI): m/z 396.3, [M–Cl]+(100%); 428.2 [M–Cl+CH3OH]+(14%). [2,6-Bis(dimethyl-2-oxazolin-2-yl)pyridine]iron trichloride (Fe(III)Cl3L), Yield: 92.3%. IR (KBr, cm−1): 1620 (vC=N). Anal. Calc. for C15H19Cl3FeN3O2: C, 41.37; H, 4.40; N, 9.65. Found: C, 41.37; H, 4.48; N, 9.47 %. Fe: 12.82% (Calc.13.07%). MS (ESI): m/z 400.1, [M–Cl]+(28%); 432.2 [M–Cl+CH3OH]+(100%). [2,6-Bis(dimethyl-2-oxazolin-2-yl)pyridine]iron dichloride (Fe(II)Cl2L), Yield: 97.1%. IR (KBr, cm−1): 1620 (vC=N). Anal. Calc. for C15H19Cl2FeN3O2: C, 45.03; H, 4.79; N, 10.50. Found: C, 44.87; H, 4.88; N, 10.67 %. Fe: 13.96% (Calc.14.09%). MS (ESI): m/z 400.1, [M]+(43%); 432.2 [M+CH3OH]+(100%). [2,6-Bis(dimethyl-2-oxazolin-2-yl)pyridine]cobalt dichloride (Co(II)Cl2L), Yield: 94.6%. IR (KBr, cm−1): 1620 (vC=N). Anal. Calc. for C15H19Cl2CoN3O2: C, 44.69; H, 4.75; N, 10.42. Found: C, 44.77; H, 4.91; N, 10.59%. Co: 14.62% (Calc.14.87%). MS (ESI): m/z 403.17, [M]+(100%); 432.2 [M–Cl+CH3OH]+(32%). 3.4 Procedure for butadiene polymerization The polymerization runs were carried out following a standard procedure. A 100mL flask equipped with a magnetic bar was charged with cocatalyst and butadiene solution (0.58g, 0.0108mol) in toluene (15mL). After equilibration of the solution at the polymerization temperature the reaction was started by injection of a toluene suspension (5mL) of Cr(III)Cl3L (8mg, 12.5mol). The polymerization then was terminated after a given time by introducing acidified ethanol (15mL, 0.5% HCl) containing 1.0% 2,6-di-tert-butyl-4-methyl phenol as an antioxidant. The polymer was coagulated in acidified ethanol (20mL, 0.5% HCl), recovered by filtration, washed with an excess of ethanol and dried in vacuo at room temperature to a constant weight for subsequent characterization. The polymer yield was calculated based on the monomer loading and polymer weight. Acknowledgments This work is supported by the Natural Science Foundation of China (Grant No. 21304050), Natural Science Foundation of Ningbo (Grant No. 2014A610109), Natural Science Foundation of Fujian Province(Grant No. 2015H0045) and sponsored by K. C. Wong Magna Fund in Ningbo University. References [1] T. Higashihara M. Hayashi A. Hirao Prog. Polym. Sci. 36 2011 323 375 [2] V. Jitchum S. Perrier Macromolecules 40 2007 1408 1412 [3] I. Natori S. Inoue Macromolecules 31 1998 982 987 [4] N. Hadjichristidis M. Pitsikalis S. Pispas H. Iatrou Chem. Rev. 101 2001 3747 3792 [5] N. Ajellal C.M. Thomas J. Carpentier Polymer 49 2008 4344 4349 [6] P.H. Moyer M.I. Lehr J. Polym. Sci. Part A 3 1965 217 229 [7] J.S. Lasky H.K. Garner R.E. Ewart Ind. Eng. Chem. Prod. Res. Dev. 1 1962 82 85 [8] E. Colamarco S. Milione C. Cuomo A. Grassi Macromol. Rapid Commun. 25 2004 450 454 [9] H. Ueno K. Oizumi H. Ishikawa K. Nakajima N. Tsujimoto O. Kimura H. Aikwa U.S. Pat. 1979 4153767 [10] H. Ashitaka K. Jinda H. Ueno J. Polym. Sci. Polym. Chem. Ed. 21 1983 1951 1972 [11] S. Kaita M. Yamanaka A. Horiuchi Y. Wakatsuki Macromolecules 39 2006 1359 1363 [12] D. Robert T.P. Spaniol J. Okuda Eur. J. Inorg. Chem. 2008 2008 2801 2809 [13] R. Taube S. Maiwald J. Sieler J. Organomet. Chem. 621 2001 327 336 [14] X. Li J. Baldannis M. Nishiura O. Tardif Z. Hou Angew. Chem. Int. Ed. 45 2006 8184 8188 [15] L. Zhang T. Suzuki Y. Luo M. Nishiura Z. Hou Angew. Chem. Int. Ed. 46 2007 1909 1913 [16] W. Gao D. Cui J. Am. Chem. Soc. 130 2008 4984 4991 [17] K. Endo Y. Yamanaka Macromol. Rapid Commun. 20 1999 312 314 [18] L. Porri G. Ricci N. Shubin Macromol. Symp. 128 1998 53 61 [19] R. Cariou J. Chirinos V.C. Gibson G. Jacobsen A.K. Tomov M.R.J. Elsegood Macromolecules 42 2009 1443 1444 [20] L. Porri M. Aglietto Makromol. Chem. Macromol. Chem. Phys. 177 1976 1465 1476 [21] D. Gong B. Wang X. Jia X. Zhang Dalton Trans. 43 2014 4169 4178 [22] D. Gong B. Wang H. Cai X. Zhang L. Jiang J. Organomet. Chem. 696 2011 1584 1590 [23] D. Gong W. Jia T. Chen K.-W. Huang Appl. Catal. A: Gen. 464–465 2013 35 42 [24] B. Wang D.M. Cui K. Lv Macromolecules 41 2008 1983 1988 [25] L. Zhang Y. Luo Z. Hou J. Am. Chem. Soc. 127 2005 14562 14563 [26] S. Kaita Z. Hou M. Nishiura Y. Doi J. Kurazumi A.C. Horiuchi Y. Wakatsuki Macromol. Rapid Commun. 24 2003 180 184 [27] L.A. Van der J.C. Schaverien N. Meijboom C. Ganter A.G. Orpe J. Am. Chem. Soc. 117 1995 3008 3021 [28] A. Miyazawa T. Kase K. Soga Macromolecules 33 2000 2796 2800 [29] H.T. Ban Y. Tsunogae T. Shiono J. Polym. Sci. Part A: Polym. Chem. 42 2004 2698 2704 [30] W. Kaminsky B. Hinrichsa D. Rehderb Polymer 43 2002 7225 7229 [31] C. Capacchione A. Avagliano A. Proto Macromolecules 41 2008 4573 4575 [32] S. Milione C. Cuomo C. Capacchione C. Zannoni A. Grassi Macromolecules 40 2007 5638 5643 [33] J. Dassaud A. Guyot R. Spitz Makromol. Chem. 194 1993 2631 2639 [34] D. Chandran C.H. Kwak C.-S. Ha I. Kim Catal. Today 131 2008 505 512 [35] K. Endo T. Kitagawa K. Nakatani J. Polym. Sci. Part A: Polym. Chem. 44 2006 4088 4094 [36] G. Ricci M. Battistella Macromolecules 34 2001 5766 5769 [37] G. Ricci A. Forni A. Boglia M. Sonzogni Organometallics 23 2004 3727 3732 [38] G. Ricci A. Forni A. Boglia A. Sommazzi F. Masi J. Organomet. Chem. 690 2005 1845 1854 [39] R. Cariou J.J. Chirinos V.C. Gibson G. Jacobsen A.K. Tomov G.J.P. Britovsek A.J.P. Whitea Dalton Trans. 39 2010 9039 9045 [40] R. Cariou J. Chirinos V.C. Gibson G. Jacobsen A.K. Tomov M.R.J. Elsegood Macromolecule 42 2009 1443 1444 [41] V. Appukuttan L. Zhang C. Ha I. Kim Polymer 50 2009 1150 1158 [42] L. He T. Chen D. Gong Z. Lai K.-W. Huang Organometallics 31 2012 5208 5211 [43] T. Chen L. He D. Gong L. Yang X. Miao K.-W. Huang Tetrahedron Lett. 53 2012 4409 4412 [44] L. He T. Chen D. Xue M. Eddaoudi K.-W. Huang J. Organomet. Chem. 700 2012 202 206 [45] D. Gong W. Liu T. Chen Z. Chen K.-W. Huang J. Mole. Catal. Chem. 395 2014 100 107 [46] B.L. Small M. Brookhart A.M.A. Bennett J. Am. Chem. Soc. 120 1998 4049 4050 [47] G.J.P. Britovsek M. Bruce V.C. Gibson B.S. Kimberley P.J. Maddox S. Mastroianni J. Am. Chem. Soc. 121 1999 8728 8870 [48] D. Gong B. Wang C. Bai J. Bi F. Wang W. Dong L. Jiang X. Zhang Polymer 50 2009 6259 6264 [49] D.A. Evans Z.K. Sweeney T. Rovis J.S. Tedrow J. Am. Chem. Soc. 123 2001 12095 12096 [50] J. Wang M. Frings C. Bolm Angew. Chem. Int. Ed. 52 2013 8661 8665 [51] A.B. Kazi G.D. Jones D.A. Vicic Organometallics 24 2005 6051 6054 [52] P.J. Heard C. Jones J. Chem. Soc. Dalton Trans. 22 1997 1083 1088 [53] Y. Nakayama K. Sogo Z. Cai H. Yasuda T. Shiono Polym. Int. 60 2011 692 697 [54] J. Guo B. Wang J. Bi C. Zhang H. Zhang C. Bai Y. Hu X. Zhang Polymer 59 2015 124 132 [55] K. Nomura S. Warit Y. Imanishi Bull. Chem. Soc. Jpn. 73 1999 599 605 [56] K. Nomura S. Warit Y. Imanishi Macromolecules 32 1999 4732 4734 [57] S. Tobisch Can. J. Chem. -Revue Canadienne De Chimie 87 2009 1392 1405 [58] Y.C. Jang P.S. Kim H. Lee Macromolecules 35 2002 1477 1480 [59] T. Chen L. Yang D. Gong K.-W. Huang Inorg. Chim. Acta 423 2014 320 325",
      "scopus-id": "84930944213",
      "coredata": {
        "eid": "1-s2.0-S1381116915001867",
        "dc:description": "Tridentate complexes Cr(III)Cl3L, [L =2,6-bis(dimethyl-2-oxazolin-2-yl) pyridine], Fe(III)Cl3L, Fe(II)Cl2L and Co(II)Cl2L have been prepared and fully characterized. The solid structures of Cr(III)Cl3L, Fe(III)Cl3L and Co(II)Cl2L have been revealed by single crystal X-ray diffraction, and the Cr(III)Cl3L and Fe(III)Cl3L complexes both exhibit a distorted octahedral geometry, while the Co(II)Cl2L complex has a trigonal bipyramidal conformation. Four complexes have been examined in regioselective polymerization of butadiene in combination with MAO in toluene at room temperature. The trans-1,4, cis-1,4 enchainment of resultant polybutadiene are controlled by the metal center. Activated by MAO, complex Cr(III)Cl3L produces high level of trans-1,4 selectivity (trans-1,4 up to 93.3%) with moderate polymer yield, complexes Fe(III)Cl3L and Fe(II)Cl2L both show equal cis-1,4 and trans-1,4 with minor 1,2 selectivity (<10%), and Co(II)Cl2L catalyst displays predominated cis-1,4 selectivity, which can be shifted to 1,2 selectivity by adding PPh3 as an additive. Thus, tuning of the cis-1,4, trans-1,4 and 1,2 selectivity in full range via central metal and additive chosen by these 2,6-bis(dimethyl-2-oxazolin-2-yl) pyridine supported catalysts has been achieved.",
        "openArchiveArticle": "false",
        "prism:coverDate": "2015-09-30",
        "openaccessUserLicense": null,
        "prism:aggregationType": "Journal",
        "prism:url": "https://api.elsevier.com/content/article/pii/S1381116915001867",
        "dc:creator": [
          {
            "@_fa": "true",
            "$": "Gong, Dirong"
          },
          {
            "@_fa": "true",
            "$": "Liu, Wen"
          },
          {
            "@_fa": "true",
            "$": "Pan, Weijing"
          },
          {
            "@_fa": "true",
            "$": "Chen, Tao"
          },
          {
            "@_fa": "true",
            "$": "Jia, Xiaoyu"
          },
          {
            "@_fa": "true",
            "$": "Huang, Kuo-Wei"
          },
          {
            "@_fa": "true",
            "$": "Zhang, Xuequan"
          }
        ],
        "link": [
          {
            "@_fa": "true",
            "@rel": "self",
            "@href": "https://api.elsevier.com/content/article/pii/S1381116915001867"
          },
          {
            "@_fa": "true",
            "@rel": "scidir",
            "@href": "https://www.sciencedirect.com/science/article/pii/S1381116915001867"
          }
        ],
        "dc:format": "application/json",
        "openaccessType": null,
        "pii": "S1381-1169(15)00186-7",
        "prism:volume": "406",
        "prism:publisher": "Elsevier B.V.",
        "dc:title": "Tunable regioselectivity in 1,3-butadiene polymerization by using 2,6-bis(dimethyl-2-oxazolin-2-yl)pyridine incorporated transition metal (Cr, Fe and Co) catalysts",
        "prism:copyright": "Copyright © 2015 Elsevier B.V. All rights reserved.",
        "openaccess": "0",
        "prism:issn": "13811169",
        "dcterms:subject": [
          {
            "@_fa": "true",
            "$": "Transition metal catalysts"
          },
          {
            "@_fa": "true",
            "$": "1,3-butadiene"
          },
          {
            "@_fa": "true",
            "$": "Selectivity"
          },
          {
            "@_fa": "true",
            "$": "2,6-bis(dimethyl-2-oxazolin-2-yl)pyridine"
          },
          {
            "@_fa": "true",
            "$": "Controllable microstructure"
          }
        ],
        "openaccessArticle": "false",
        "prism:publicationName": "Journal of Molecular Catalysis A: Chemical",
        "openaccessSponsorType": null,
        "prism:pageRange": "78-84",
        "prism:endingPage": "84",
        "pubType": "fla",
        "prism:coverDisplayDate": "September 2015",
        "prism:doi": "10.1016/j.molcata.2015.05.013",
        "prism:startingPage": "78",
        "dc:identifier": "doi:10.1016/j.molcata.2015.05.013",
        "openaccessSponsorName": null
      },
      "objects": {
        "object": [
          {
            "@category": "thumbnail",
            "@height": "88",
            "@width": "219",
            "@_fa": "true",
            "$": "https://api.elsevier.com/content/object/eid/1-s2.0-S1381116915001867-fx1.sml?httpAccept=%2A%2F%2A",
            "@multimediatype": "GIF image file",
            "@type": "IMAGE-THUMBNAIL",
            "@size": "3106",
            "@ref": "fx1",
            "@mimetype": "image/gif"
          },
          {
            "@category": "thumbnail",
            "@height": "164",
            "@width": "198",
            "@_fa": "true",
            "$": "https://api.elsevier.com/content/object/eid/1-s2.0-S1381116915001867-gr2.sml?httpAccept=%2A%2F%2A",
            "@multimediatype": "GIF image file",
            "@type": "IMAGE-THUMBNAIL",
            "@size": "17921",
            "@ref": "gr2",
            "@mimetype": "image/gif"
          },
          {
            "@category": "thumbnail",
            "@height": "164",
            "@width": "190",
            "@_fa": "true",
            "$": "https://api.elsevier.com/content/object/eid/1-s2.0-S1381116915001867-gr3.sml?httpAccept=%2A%2F%2A",
            "@multimediatype": "GIF image file",
            "@type": "IMAGE-THUMBNAIL",
            "@size": "17238",
            "@ref": "gr3",
            "@mimetype": "image/gif"
          },
          {
            "@category": "thumbnail",
            "@height": "164",
            "@width": "173",
            "@_fa": "true",
            "$": "https://api.elsevier.com/content/object/eid/1-s2.0-S1381116915001867-gr4.sml?httpAccept=%2A%2F%2A",
            "@multimediatype": "GIF image file",
            "@type": "IMAGE-THUMBNAIL",
            "@size": "17297",
            "@ref": "gr4",
            "@mimetype": "image/gif"
          },
          {
            "@category": "thumbnail",
            "@height": "93",
            "@width": "219",
            "@_fa": "true",
            "$": "https://api.elsevier.com/content/object/eid/1-s2.0-S1381116915001867-gr1.sml?httpAccept=%2A%2F%2A",
            "@multimediatype": "GIF image file",
            "@type": "IMAGE-THUMBNAIL",
            "@size": "3571",
            "@ref": "gr1",
            "@mimetype": "image/gif"
          },
          {
            "@category": "standard",
            "@height": "149",
            "@width": "353",
            "@_fa": "true",
            "$": "https://api.elsevier.com/content/object/eid/1-s2.0-S1381116915001867-gr1.gif?httpAccept=%2A%2F%2A",
            "@multimediatype": "GIF image file",
            "@type": "IMAGE-DOWNSAMPLED",
            "@size": "6229",
            "@ref": "gr1",
            "@mimetype": "image/gif"
          },
          {
            "@category": "standard",
            "@height": "200",
            "@width": "500",
            "@_fa": "true",
            "$": "https://api.elsevier.com/content/object/eid/1-s2.0-S1381116915001867-fx1.jpg?httpAccept=%2A%2F%2A",
            "@multimediatype": "JPEG image file",
            "@type": "IMAGE-DOWNSAMPLED",
            "@size": "14808",
            "@ref": "fx1",
            "@mimetype": "image/jpeg"
          },
          {
            "@category": "standard",
            "@height": "188",
            "@width": "227",
            "@_fa": "true",
            "$": "https://api.elsevier.com/content/object/eid/1-s2.0-S1381116915001867-gr2.jpg?httpAccept=%2A%2F%2A",
            "@multimediatype": "JPEG image file",
            "@type": "IMAGE-DOWNSAMPLED",
            "@size": "33600",
            "@ref": "gr2",
            "@mimetype": "image/jpeg"
          },
          {
            "@category": "standard",
            "@height": "198",
            "@width": "230",
            "@_fa": "true",
            "$": "https://api.elsevier.com/content/object/eid/1-s2.0-S1381116915001867-gr3.jpg?httpAccept=%2A%2F%2A",
            "@multimediatype": "JPEG image file",
            "@type": "IMAGE-DOWNSAMPLED",
            "@size": "32633",
            "@ref": "gr3",
            "@mimetype": "image/jpeg"
          },
          {
            "@category": "standard",
            "@height": "252",
            "@width": "266",
            "@_fa": "true",
            "$": "https://api.elsevier.com/content/object/eid/1-s2.0-S1381116915001867-gr4.jpg?httpAccept=%2A%2F%2A",
            "@multimediatype": "JPEG image file",
            "@type": "IMAGE-DOWNSAMPLED",
            "@size": "37465",
            "@ref": "gr4",
            "@mimetype": "image/jpeg"
          },
          {
            "@category": "high",
            "@height": "1323",
            "@width": "3132",
            "@_fa": "true",
            "$": "https://api.elsevier.com/content/object/eid/1-s2.0-S1381116915001867-gr1_lrg.gif?httpAccept=%2A%2F%2A",
            "@multimediatype": "GIF image file",
            "@type": "IMAGE-HIGH-RES",
            "@size": "30351",
            "@ref": "gr1",
            "@mimetype": "image/gif"
          },
          {
            "@category": "high",
            "@height": "886",
            "@width": "2213",
            "@_fa": "true",
            "$": "https://api.elsevier.com/content/object/eid/1-s2.0-S1381116915001867-fx1_lrg.jpg?httpAccept=%2A%2F%2A",
            "@multimediatype": "JPEG image file",
            "@type": "IMAGE-HIGH-RES",
            "@size": "108493",
            "@ref": "fx1",
            "@mimetype": "image/jpeg"
          },
          {
            "@category": "high",
            "@height": "834",
            "@width": "1008",
            "@_fa": "true",
            "$": "https://api.elsevier.com/content/object/eid/1-s2.0-S1381116915001867-gr2_lrg.jpg?httpAccept=%2A%2F%2A",
            "@multimediatype": "JPEG image file",
            "@type": "IMAGE-HIGH-RES",
            "@size": "116116",
            "@ref": "gr2",
            "@mimetype": "image/jpeg"
          },
          {
            "@category": "high",
            "@height": "877",
            "@width": "1018",
            "@_fa": "true",
            "$": "https://api.elsevier.com/content/object/eid/1-s2.0-S1381116915001867-gr3_lrg.jpg?httpAccept=%2A%2F%2A",
            "@multimediatype": "JPEG image file",
            "@type": "IMAGE-HIGH-RES",
            "@size": "131259",
            "@ref": "gr3",
            "@mimetype": "image/jpeg"
          },
          {
            "@category": "high",
            "@height": "1118",
            "@width": "1180",
            "@_fa": "true",
            "$": "https://api.elsevier.com/content/object/eid/1-s2.0-S1381116915001867-gr4_lrg.jpg?httpAccept=%2A%2F%2A",
            "@multimediatype": "JPEG image file",
            "@type": "IMAGE-HIGH-RES",
            "@size": "176107",
            "@ref": "gr4",
            "@mimetype": "image/jpeg"
          }
        ]
      },
      "link": {
        "@rel": "abstract",
        "@href": "https://api.elsevier.com/content/abstract/scopus_id/84930944213"
      }
    }
  }
}