{
  "metadata": {
    "title": "Effect of vanadia and tungsten loadings on the physical and chemical characteristics of V<ce:inf loc=post>2</ce:inf>O<ce:inf loc=post>5</ce:inf>-WO<ce:inf loc=post>3</ce:inf>/TiO<ce:inf loc=post>2</ce:inf> catalysts",
    "authors": "; ; ",
    "journal": "Journal of Molecular Catalysis A: Chemical",
    "date": "2004-02-02",
    "doi": "10.1016/j.molcata.2003.07.016",
    "abstract": "",
    "uri": "https://api.elsevier.com/content/article/pii/S1381116903005545",
    "pii": "S1381116903005545"
  },
  "fulltext": {
    "full-text-retrieval-response": {
      "scopus-eid": "2-s2.0-0346906970",
      "originalText": "serial JL 271358 291210 291744 291790 291809 31 Journal of Molecular Catalysis A: Chemical JOURNALMOLECULARCATALYSISACHEMICAL 2003-10-09 2003-10-09 2010-03-28T13:36:59 1-s2.0-S1381116903005545 S1381-1169(03)00554-5 S1381116903005545 10.1016/j.molcata.2003.07.016 S300 S300.1 FULL-TEXT 1-s2.0-S1381116900X01781 2015-05-15T05:56:32.920819-04:00 0 0 20040202 2004 2003-10-09T00:00:00Z articleinfo crossmark dco dateupdated tomb dateloaded datesearch indexeddate issuelist volumelist yearnav absattachment articletitlenorm authfirstinitialnorm authfirstsurnamenorm cid cids contenttype copyright dateloadedtxt docsubtype doctype doi eid ewtransactionid hubeid issfirst issn issnnorm itemstage itemtransactionid itemweight openaccess openarchive pg pgfirst pglast pii piinorm pubdatestart pubdatetxt pubyr sortorder srctitle srctitlenorm srctype subheadings volfirst volissue webpdf webpdfpagecount figure table body affil articletitle auth authfirstini authfull authkeywords authlast primabst ref specialabst alllist content subj ssids 1381-1169 13811169 208 208 1 2 1 2 Volume 208, Issues 1–2 34 257 265 257 265 20040202 2 February 2004 2004-02-02 2004 converted-article fla Copyright © 2003 Elsevier B.V. All rights reserved. EFFECTVANADIATUNGSTENLOADINGSPHYSICALCHEMICALCHARACTERISTICSV2O5WO3TIO2CATALYSTS DJERAD S 1 Introduction 2 Experimental 2.1 Catalyst preparation 3 Results 3.1 XRD and morphology 3.2 Thermal analysis 3.3 Catalytic activity measurements 4 Discussion 5 Conclusions References BOSCH 1988 369 H FORZATTI 1996 33 P SPURR 1978 2481 R VERMAIRE 1989 309 D BOND 1991 1 31 G ALEMANY 1995 117 130 L BANARES 1996 69 76 M ALTYNNIKOV 1999 85 90 A ECKERDT 1989 6796 H ECKERDT 1990 347 H TURCO 1992 2631 M PEREIRA 1980 139 E ANDERSSON 1990 351 S ECONOMIDIS 1999 123 134 N BUSCA 1998 1 36 G SCHNEIDER 1994 326 343 M RAMANUJACHARY 1985 279 287 K SALEH 1986 102 114 R KOZLOWSKI 1983 5176 R LIETTI 1994 241 249 L PAGANINI 1997 195 M DJERADX2004X257 DJERADX2004X257X265 DJERADX2004X257XS DJERADX2004X257X265XS item S1381-1169(03)00554-5 S1381116903005545 1-s2.0-S1381116903005545 10.1016/j.molcata.2003.07.016 271358 2010-10-15T16:13:10.567395-04:00 2004-02-02 1-s2.0-S1381116903005545-main.pdf https://s3.amazonaws.com/prod-ucs-content-store-us-east/content/pii:S1381116903005545/MAIN/application/pdf/8999355f2c00a92b46f357dd98a2904e/main.pdf https://s3-eu-west-1.amazonaws.com/prod-ucs-content-store-eu-west/content/pii:S1381116903005545/MAIN/application/pdf/8999355f2c00a92b46f357dd98a2904e/main.pdf main.pdf pdf true 175237 MAIN 9 1-s2.0-S1381116903005545-main_1.png https://s3.amazonaws.com/prod-ucs-content-store-us-east/content/pii:S1381116903005545/PREVIEW/image/png/ad12c9e3e57899f810d295c18c6015d3/main_1.png https://s3-eu-west-1.amazonaws.com/prod-ucs-content-store-eu-west/content/pii:S1381116903005545/PREVIEW/image/png/ad12c9e3e57899f810d295c18c6015d3/main_1.png main_1.png png 65982 849 656 IMAGE-WEB-PDF 1 1-s2.0-S1381116903005545-si9.gif https://s3.amazonaws.com/prod-ucs-content-store-us-east/content/pii:S1381116903005545/STRIPIN/image/gif/01080e947aae0f0b6cdf36258e0db4f5/si9.gif https://s3-eu-west-1.amazonaws.com/prod-ucs-content-store-eu-west/content/pii:S1381116903005545/STRIPIN/image/gif/01080e947aae0f0b6cdf36258e0db4f5/si9.gif si9 si9.gif gif 934 40 139 ALTIMG 1-s2.0-S1381116903005545-si8.gif https://s3.amazonaws.com/prod-ucs-content-store-us-east/content/pii:S1381116903005545/STRIPIN/image/gif/4484d135254aa652c0a79e0db7877778/si8.gif https://s3-eu-west-1.amazonaws.com/prod-ucs-content-store-eu-west/content/pii:S1381116903005545/STRIPIN/image/gif/4484d135254aa652c0a79e0db7877778/si8.gif si8 si8.gif gif 809 14 207 ALTIMG 1-s2.0-S1381116903005545-si7.gif https://s3.amazonaws.com/prod-ucs-content-store-us-east/content/pii:S1381116903005545/STRIPIN/image/gif/f7e0f563a191eb0f69cf620d63af2a9a/si7.gif https://s3-eu-west-1.amazonaws.com/prod-ucs-content-store-eu-west/content/pii:S1381116903005545/STRIPIN/image/gif/f7e0f563a191eb0f69cf620d63af2a9a/si7.gif si7 si7.gif gif 859 20 202 ALTIMG 1-s2.0-S1381116903005545-si6.gif https://s3.amazonaws.com/prod-ucs-content-store-us-east/content/pii:S1381116903005545/STRIPIN/image/gif/22d6d8df94aa0f090810ec371300eb85/si6.gif https://s3-eu-west-1.amazonaws.com/prod-ucs-content-store-eu-west/content/pii:S1381116903005545/STRIPIN/image/gif/22d6d8df94aa0f090810ec371300eb85/si6.gif si6 si6.gif gif 776 13 199 ALTIMG 1-s2.0-S1381116903005545-si5.gif https://s3.amazonaws.com/prod-ucs-content-store-us-east/content/pii:S1381116903005545/STRIPIN/image/gif/b9e53b872c5ba09395c000db1ccfce8e/si5.gif https://s3-eu-west-1.amazonaws.com/prod-ucs-content-store-eu-west/content/pii:S1381116903005545/STRIPIN/image/gif/b9e53b872c5ba09395c000db1ccfce8e/si5.gif si5 si5.gif gif 812 20 189 ALTIMG 1-s2.0-S1381116903005545-si4.gif https://s3.amazonaws.com/prod-ucs-content-store-us-east/content/pii:S1381116903005545/STRIPIN/image/gif/dd5186c70e59fb3db753ba52c6415919/si4.gif https://s3-eu-west-1.amazonaws.com/prod-ucs-content-store-eu-west/content/pii:S1381116903005545/STRIPIN/image/gif/dd5186c70e59fb3db753ba52c6415919/si4.gif si4 si4.gif gif 963 14 259 ALTIMG 1-s2.0-S1381116903005545-si3.gif https://s3.amazonaws.com/prod-ucs-content-store-us-east/content/pii:S1381116903005545/STRIPIN/image/gif/a87ab795c6cc866bae37318469a823e9/si3.gif https://s3-eu-west-1.amazonaws.com/prod-ucs-content-store-eu-west/content/pii:S1381116903005545/STRIPIN/image/gif/a87ab795c6cc866bae37318469a823e9/si3.gif si3 si3.gif gif 930 14 245 ALTIMG 1-s2.0-S1381116903005545-si2.gif https://s3.amazonaws.com/prod-ucs-content-store-us-east/content/pii:S1381116903005545/STRIPIN/image/gif/740f02af4eec865af90a08630edfa66e/si2.gif https://s3-eu-west-1.amazonaws.com/prod-ucs-content-store-eu-west/content/pii:S1381116903005545/STRIPIN/image/gif/740f02af4eec865af90a08630edfa66e/si2.gif si2 si2.gif gif 878 14 239 ALTIMG 1-s2.0-S1381116903005545-si13.gif https://s3.amazonaws.com/prod-ucs-content-store-us-east/content/pii:S1381116903005545/STRIPIN/image/gif/3f802aaa1d69538a2afc04e78952ed30/si13.gif https://s3-eu-west-1.amazonaws.com/prod-ucs-content-store-eu-west/content/pii:S1381116903005545/STRIPIN/image/gif/3f802aaa1d69538a2afc04e78952ed30/si13.gif si13 si13.gif gif 613 20 131 ALTIMG 1-s2.0-S1381116903005545-si12.gif https://s3.amazonaws.com/prod-ucs-content-store-us-east/content/pii:S1381116903005545/STRIPIN/image/gif/4245323328d38e9c53834596c3321b8c/si12.gif https://s3-eu-west-1.amazonaws.com/prod-ucs-content-store-eu-west/content/pii:S1381116903005545/STRIPIN/image/gif/4245323328d38e9c53834596c3321b8c/si12.gif si12 si12.gif gif 574 20 122 ALTIMG 1-s2.0-S1381116903005545-si11.gif https://s3.amazonaws.com/prod-ucs-content-store-us-east/content/pii:S1381116903005545/STRIPIN/image/gif/6245ece35f83a7a382075f14d7fa038d/si11.gif https://s3-eu-west-1.amazonaws.com/prod-ucs-content-store-eu-west/content/pii:S1381116903005545/STRIPIN/image/gif/6245ece35f83a7a382075f14d7fa038d/si11.gif si11 si11.gif gif 1798 20 446 ALTIMG 1-s2.0-S1381116903005545-si10.gif https://s3.amazonaws.com/prod-ucs-content-store-us-east/content/pii:S1381116903005545/STRIPIN/image/gif/1d179288f2a2df8a6128304b12168e72/si10.gif https://s3-eu-west-1.amazonaws.com/prod-ucs-content-store-eu-west/content/pii:S1381116903005545/STRIPIN/image/gif/1d179288f2a2df8a6128304b12168e72/si10.gif si10 si10.gif gif 878 40 134 ALTIMG 1-s2.0-S1381116903005545-si1.gif https://s3.amazonaws.com/prod-ucs-content-store-us-east/content/pii:S1381116903005545/STRIPIN/image/gif/5748ba4b3b035664edc4dbb57dc19e13/si1.gif https://s3-eu-west-1.amazonaws.com/prod-ucs-content-store-eu-west/content/pii:S1381116903005545/STRIPIN/image/gif/5748ba4b3b035664edc4dbb57dc19e13/si1.gif si1 si1.gif gif 1412 39 263 ALTIMG 1-s2.0-S1381116903005545-fx1.sml https://s3.amazonaws.com/prod-ucs-content-store-us-east/content/pii:S1381116903005545/fx1/THUMBNAIL/image/gif/76f4c25a3784a39af104f0c1ac721b8c/fx1.sml https://s3-eu-west-1.amazonaws.com/prod-ucs-content-store-eu-west/content/pii:S1381116903005545/fx1/THUMBNAIL/image/gif/76f4c25a3784a39af104f0c1ac721b8c/fx1.sml fx1 true fx1.sml sml 916 93 64 IMAGE-THUMBNAIL 1-s2.0-S1381116903005545-fx1.gif https://s3.amazonaws.com/prod-ucs-content-store-us-east/content/pii:S1381116903005545/fx1/DOWNSAMPLED/image/gif/0a816c42f947914d0ee7a5f05e9f3b63/fx1.gif https://s3-eu-west-1.amazonaws.com/prod-ucs-content-store-eu-west/content/pii:S1381116903005545/fx1/DOWNSAMPLED/image/gif/0a816c42f947914d0ee7a5f05e9f3b63/fx1.gif fx1 true fx1.gif gif 6101 376 259 IMAGE-DOWNSAMPLED 1-s2.0-S1381116903005545-gr1.sml https://s3.amazonaws.com/prod-ucs-content-store-us-east/content/pii:S1381116903005545/gr1/THUMBNAIL/image/gif/eb4919ff13009f4d9aeb882ab66d3266/gr1.sml https://s3-eu-west-1.amazonaws.com/prod-ucs-content-store-eu-west/content/pii:S1381116903005545/gr1/THUMBNAIL/image/gif/eb4919ff13009f4d9aeb882ab66d3266/gr1.sml gr1 gr1.sml sml 1177 93 68 IMAGE-THUMBNAIL 1-s2.0-S1381116903005545-gr1.gif https://s3.amazonaws.com/prod-ucs-content-store-us-east/content/pii:S1381116903005545/gr1/DOWNSAMPLED/image/gif/298b25b84e755ac9400fd0c90563b4d0/gr1.gif https://s3-eu-west-1.amazonaws.com/prod-ucs-content-store-eu-west/content/pii:S1381116903005545/gr1/DOWNSAMPLED/image/gif/298b25b84e755ac9400fd0c90563b4d0/gr1.gif gr1 gr1.gif gif 28763 787 576 IMAGE-DOWNSAMPLED 1-s2.0-S1381116903005545-gr2.sml https://s3.amazonaws.com/prod-ucs-content-store-us-east/content/pii:S1381116903005545/gr2/THUMBNAIL/image/gif/c55ff4a88b2e5a570227482912de38ea/gr2.sml https://s3-eu-west-1.amazonaws.com/prod-ucs-content-store-eu-west/content/pii:S1381116903005545/gr2/THUMBNAIL/image/gif/c55ff4a88b2e5a570227482912de38ea/gr2.sml gr2 gr2.sml sml 685 93 32 IMAGE-THUMBNAIL 1-s2.0-S1381116903005545-gr2.gif https://s3.amazonaws.com/prod-ucs-content-store-us-east/content/pii:S1381116903005545/gr2/DOWNSAMPLED/image/gif/4544ca8663bb886562a8e7fc388183dd/gr2.gif https://s3-eu-west-1.amazonaws.com/prod-ucs-content-store-eu-west/content/pii:S1381116903005545/gr2/DOWNSAMPLED/image/gif/4544ca8663bb886562a8e7fc388183dd/gr2.gif gr2 gr2.gif gif 13804 742 256 IMAGE-DOWNSAMPLED 1-s2.0-S1381116903005545-gr3.sml https://s3.amazonaws.com/prod-ucs-content-store-us-east/content/pii:S1381116903005545/gr3/THUMBNAIL/image/gif/bac6ee56362d35c5558d1010753139c2/gr3.sml https://s3-eu-west-1.amazonaws.com/prod-ucs-content-store-eu-west/content/pii:S1381116903005545/gr3/THUMBNAIL/image/gif/bac6ee56362d35c5558d1010753139c2/gr3.sml gr3 gr3.sml sml 1611 93 37 IMAGE-THUMBNAIL 1-s2.0-S1381116903005545-gr3.gif https://s3.amazonaws.com/prod-ucs-content-store-us-east/content/pii:S1381116903005545/gr3/DOWNSAMPLED/image/gif/de3396f13db8d577d5a30ff922a50842/gr3.gif https://s3-eu-west-1.amazonaws.com/prod-ucs-content-store-eu-west/content/pii:S1381116903005545/gr3/DOWNSAMPLED/image/gif/de3396f13db8d577d5a30ff922a50842/gr3.gif gr3 gr3.gif gif 10549 464 185 IMAGE-DOWNSAMPLED 1-s2.0-S1381116903005545-gr4.sml https://s3.amazonaws.com/prod-ucs-content-store-us-east/content/pii:S1381116903005545/gr4/THUMBNAIL/image/gif/7d208817343524747849009bcc6b23ab/gr4.sml https://s3-eu-west-1.amazonaws.com/prod-ucs-content-store-eu-west/content/pii:S1381116903005545/gr4/THUMBNAIL/image/gif/7d208817343524747849009bcc6b23ab/gr4.sml gr4 gr4.sml sml 2535 77 125 IMAGE-THUMBNAIL 1-s2.0-S1381116903005545-gr4.gif https://s3.amazonaws.com/prod-ucs-content-store-us-east/content/pii:S1381116903005545/gr4/DOWNSAMPLED/image/gif/93bb2f733fa2175fabab5d1ba2c3491c/gr4.gif https://s3-eu-west-1.amazonaws.com/prod-ucs-content-store-eu-west/content/pii:S1381116903005545/gr4/DOWNSAMPLED/image/gif/93bb2f733fa2175fabab5d1ba2c3491c/gr4.gif gr4 gr4.gif gif 12359 269 438 IMAGE-DOWNSAMPLED 1-s2.0-S1381116903005545-gr5.sml https://s3.amazonaws.com/prod-ucs-content-store-us-east/content/pii:S1381116903005545/gr5/THUMBNAIL/image/gif/5f1282ef48b7926750ff9ec962a6e4f4/gr5.sml https://s3-eu-west-1.amazonaws.com/prod-ucs-content-store-eu-west/content/pii:S1381116903005545/gr5/THUMBNAIL/image/gif/5f1282ef48b7926750ff9ec962a6e4f4/gr5.sml gr5 gr5.sml sml 2344 84 125 IMAGE-THUMBNAIL 1-s2.0-S1381116903005545-gr5.gif https://s3.amazonaws.com/prod-ucs-content-store-us-east/content/pii:S1381116903005545/gr5/DOWNSAMPLED/image/gif/417987922f57d3a8282a8caf77c34239/gr5.gif https://s3-eu-west-1.amazonaws.com/prod-ucs-content-store-eu-west/content/pii:S1381116903005545/gr5/DOWNSAMPLED/image/gif/417987922f57d3a8282a8caf77c34239/gr5.gif gr5 gr5.gif gif 9818 281 416 IMAGE-DOWNSAMPLED 1-s2.0-S1381116903005545-gr6.sml https://s3.amazonaws.com/prod-ucs-content-store-us-east/content/pii:S1381116903005545/gr6/THUMBNAIL/image/gif/87b8707ba56c2e9505cbbd8191f59166/gr6.sml https://s3-eu-west-1.amazonaws.com/prod-ucs-content-store-eu-west/content/pii:S1381116903005545/gr6/THUMBNAIL/image/gif/87b8707ba56c2e9505cbbd8191f59166/gr6.sml gr6 gr6.sml sml 1888 94 74 IMAGE-THUMBNAIL 1-s2.0-S1381116903005545-gr6.gif https://s3.amazonaws.com/prod-ucs-content-store-us-east/content/pii:S1381116903005545/gr6/DOWNSAMPLED/image/gif/1408304b42915702ba1b35be324e7df2/gr6.gif https://s3-eu-west-1.amazonaws.com/prod-ucs-content-store-eu-west/content/pii:S1381116903005545/gr6/DOWNSAMPLED/image/gif/1408304b42915702ba1b35be324e7df2/gr6.gif gr6 gr6.gif gif 4447 210 166 IMAGE-DOWNSAMPLED 1-s2.0-S1381116903005545-gr7.sml https://s3.amazonaws.com/prod-ucs-content-store-us-east/content/pii:S1381116903005545/gr7/THUMBNAIL/image/gif/778560bc78bf13b12098a8a6f80d65d8/gr7.sml https://s3-eu-west-1.amazonaws.com/prod-ucs-content-store-eu-west/content/pii:S1381116903005545/gr7/THUMBNAIL/image/gif/778560bc78bf13b12098a8a6f80d65d8/gr7.sml gr7 gr7.sml sml 2113 94 74 IMAGE-THUMBNAIL 1-s2.0-S1381116903005545-gr7.gif https://s3.amazonaws.com/prod-ucs-content-store-us-east/content/pii:S1381116903005545/gr7/DOWNSAMPLED/image/gif/3c4231da33df89a78a73b3dd9cf6cfd5/gr7.gif https://s3-eu-west-1.amazonaws.com/prod-ucs-content-store-eu-west/content/pii:S1381116903005545/gr7/DOWNSAMPLED/image/gif/3c4231da33df89a78a73b3dd9cf6cfd5/gr7.gif gr7 gr7.gif gif 6196 243 192 IMAGE-DOWNSAMPLED MOLCAA 4291 S1381-1169(03)00554-5 10.1016/j.molcata.2003.07.016 Elsevier B.V. Fig. 1 X-ray powder diffraction patterns of: (a) Ti; (b) W3Ti; (c) W5Ti; (d) W9Ti calcined from 400 to 800°C. Fig. 2 X-ray powder diffraction patterns of: (a) V3W9/Ti; (b) V8W9/Ti calcined from 400 to 800°C. Fig. 3 Thermoanalytical curves of: (a) Ti and (b) W9Ti gels heated under air. Heating rate 5°C/min; sample weight 15mg; air flow rate 100cm3/min. Fig. 4 Thermoanalytical curves of: (a) V3W9Ti; (b) V8W9Ti gels heated under air. Heating rate 5°C/min; sample weight 15mg; air flow rate 100cm3/min. Fig. 5 NO x conversion (a) and N2 selectivity (b) vs. temperature over V3W9Ti and V8W9Ti. Fig. 6 N2O formation during SCR reaction over V3W9Ti (a) and V8W9Ti (b). Fig. 7 Ammonia conversion (a, b) and N2O formation (c, d) during NH3 oxidation over V3W9Ti and V8W9Ti, respectively. Table 1 Morphological properties Catalyst T calculated (°C) S a (m2/g) Phase D c (Å) V p (cm3/g) r pexp (Å) Ti 400 47 A 285 0.267 18.6 500 19 A 427 0.266 21.6 600 10 77% A + 23% R 773 – – 800 – R 983 – – W3/Ti 400 97 A 250 0.293 18.2 600 22 A 511 0.284 25.2 800 – 68% A + 32% R 919 – – W5/Ti 400 95 A 227 0.31 17.3 600 40 A 475 0.255 29 800 10 90% A + 10% R 919 – – W9/Ti 400 124 A 199 0.283 18 600 54 A 404 0.257 25.6 800 15 A 766 0.25 31 V3W9/Ti 400 115 A 265 0.336 16.6 500 77 A 319 0.289 20 600 22 A 579 0.248 23.2 800 7 R 783 – – V8W9/Ti 400 154 A 265 0.31 30 500 22 A 682 0.29 72 600 14 43% A + 57% R 1068 – – 800 – R – – – A: anatase, R: rutile. Effect of vanadia and tungsten loadings on the physical and chemical characteristics of V2O5-WO3/TiO2 catalysts S. Djerad a ∗ L. Tifouti a M. Crocoll b W. Weisweiler b a Département de Génie des Procédés, Université de Annaba, BP 12, El Hadjar, Annaba, Algeria b Institut für Chemische Technik, Universität Karlsruhe (TH), Karlsruhe, Germany * Corresponding author. The selective catalytic reduction of NO x by ammonia over 3%V2O5–9%WO3/TiO2 and 8%V2O5–9%WO3/TiO2 catalyst prepared by the sol–gel method have been investigated. More significant changes in activity occurs on the catalyst V8 which displayed a higher NO x conversion but in a narrow temperature range while V3 exhibits a lower reactivity but with high selectivity to N2 over the whole temperature range. Titania-supported tungsten and vanadia oxides with different W and V loadings and calcined at different temperatures have been prepared by the sol–gel method and characterized. Large amount of tungsten (9%; w/w) provides thermal stability to WO3/TiO2 systems upon addition of vanadia. It is found that WO3 and V2O5 crystallites are formed when their concentrations are higher than those corresponding to three monolayers. DTA analyses have shown that the presence of V2O5 crystallites is not essential for the transformation of titania anatase into rutile. High reactivity in limited temperature range (225–350°C) has been observed for the catalyst with 8% (w/w) V2O5 with a high formation of N2O amount during the SCR reaction. The catalyst with 3% (w/w) V2O5 exhibits a slight lower reactivity but with a high selectivity to N2 preserved in all working temperature. Keywords Titania Vanadium oxide Catalyst characterization Monolayers SCR reaction 1 Introduction Among the various catalysts which have been tested for the selective catalytic reduction (SCR) of NO by ammonia,V2O5–WO3/TiO2 gained wide technical application. Several studies [1,2] have shown that the catalytic properties as well as the chemical and physical structure of such products are markedly influenced by parameters, such as the method of preparation, the concentration of the active component, and the nature of the support. In the previous studies carried out on V-W/Ti catalysts prepared by several methods (grafting, impregnation), the formation of V2O5 crystallites occurs after the TiO2 anatase is covered with a complete monolayer vanadia species. The sol–gel process is known as a method of preparation of a highly pure and homogeneous multicomponent metal oxides. This method leads to the increase in the interactions between V and Ti which strongly enhance the catalytic properties. The objective of the present paper is first to investigate whether or not the sol–gel method leads to the formation of V2O5 crystallites when the V content is higher than the surface coverage as it is known in literature, and secondly to study the effect of high vanadia loading on the selective catalytic reduction of NO x . For this purpose, X-ray diffraction (XRD), surface area (S a), thermal analysis (TG/DTA) and SCR activity were employed to investigate the structural and physico-chemical characteristics of V2O5-WO3/TiO2 catalysts with high and low vanadia loading. 2 Experimental 2.1 Catalyst preparation The TiO2 and V2O5–WO3/TiO2 samples with different loadings of WO3 (3–5–9%; w/w) and V2O5 (3–8%; w/w) have been prepared by a sol–gel method using titania(IV)-bis-ethylacetoacetato-isopropyl at (C18H32O8Ti, Fluka Chemicals, Inc., ≥95%) as precursor for TiO2, vanadyl (IV) acetylacetonat (VC10H14O5, Fluka Chemicals, Inc., ≥97%) as precursor for V2O5 and NH4 metatungstate hydrate (H26N6O41W12 aq.) as precursor for WO3. Acetyl acetone, ethylene glycol and water were added in appropriate amounts to the ternary mixture. After stirring the mixture for ca: 15min at ambient temperature, the excess solvent was removed by a first drying on an evaporator at 70°C followed by an overnight drying at 120°C. The catalysts were subsequently calcined in air for 2h at calcination temperatures from 400 to 800°C. X-ray diffraction patterns were obtained with a Siemens D-500 powder X-ray diffractometer using CuKα radiation (λ=1.5406Å) in step mode between 20 and 80°, using a step size of 0.02 step/s. The anatase and rutile relative contents were determined according to the equation reported in literature [3]. A(%)= 1 1+(1.4I(110) R /I(101) A ) where I is the intensity of the corresponding XRD peak. The crystallite dimensions were calculated using the Shirrer method. BET measurements were performed with a quantochrome autosorb 1C using Nitrogen. Mesopores distribution measurements have been obtained by mercury penetration method using a porosimeter (Autopore III). Thermal analysis (TG/DTA) was performed in a Netzsch STA 409. Catalytic measurements have been carried out in a quartz tubular fixed bed micro-reactor (i.d. 10mm) containing 200mg catalyst. A feed consisting of ∼400ppm NO, ∼100ppm NO2, ∼500ppm NH3, and ∼6% (v/v) O2 with N2 being a carrier gas (total flow rate=100Ncm3/min). The flow was accurately measured and controlled by means of mass flow meters and controllers. Activity data have been collected at different temperatures in the range 150–500°C, each temperature was maintained until steady-state conditions were reached. NO and NO2 conversions were measured using chemiluminescence method with apparatus type “CLD 700 EL hat” while NH3 and N2O were measured using NDIR Spectrometers type BINOS 4b.1 and Ultramat 5E, respectively. 3 Results 3.1 XRD and morphology Table 1 shows the surface area (S a), the phase composition, the mean crystallite dimensions (D c) (calculated from XRD measurements), the pore volume (V p) and the mean pore radius (r p) obtained from the experimental pore size distribution. Up to the calcination temperature of 500°C, all samples are monophasic and only anatase polymorph of TiO2 (2θ=25.3–38–48°) is detected. The surface area decreases as the calcination temperature increases in all cases. The mean pore radius increases and the pore volume decreases even with high WO3 loading. For pure TiO2, the anatase to rutile phase transformation (2θ=27.5–36–54.5°) is detected starting from 600°C and is complete at 800°C (Fig. 1a ). For TiO2 doped with WO3, the increase in tungsten loading leads to inhibit this transformation (Fig. 1b–d). The W and V surface coverages have been calculated from values of S a and from the nominal oxide loading by assuming a monolayer capacity of 7μmol/m2 for WO3 [4] and of 0.145% (w/w) for V2O5/m2 [5]. No rutile phase has been observed in all calcination temperatures for sample W9Ti, however WO3 segregation was evidenced by XRD (2θ=17.8–20.2–23.1°) (Fig. 1d). This formation occurs, normally, as is described in literature, after the TiO2 anatase is covered with a complete monolayer tungsten species [6]. The calculations of W coverages for samples W–Ti show that WO3 crystallites are detected when the W concentration is higher than the one corresponding to three monolayers. This was the case for W9Ti at 800°C. However, W5 sample exhibits an excess of monolayer at 800°C without showing any WO3 crystallites, this is probably due to the W amount which is below the XRD detection limits. Crystallite dimensions increase with increasing calcination temperature for all samples. No significant differences are observed in the crystallite dimensions of anatase on samples WO3/TiO2 with the only exception of the sample with the highest tungsten loading (9%; w/w) where smaller crystallites have been measured comparatively to the other W-containing samples. The mean pore radius and anatase phase are preserved even at 800°C for sample W9Ti. These results demonstrate that WO3 hinders the sintering process to higher calcination temperatures. W9Ti is thus more suited to stabilize the anatase phase and preserves the surface characteristics. Catalyst W9Ti has been used for further investigations. To investigate the effect of V loading on morphological and catalytic properties of the catalyst, two different loadings of V2O5 have been prepared (3 and 8%; w/w) V2O5 on W9Ti. The morphological data of Table 1 indicates that vanadia affects both the initial sintering of TiO2 and the anatase to rutile transformation which are faster especially at high vanadia loadings and high calcination temperatures. At 400°C, V8 exhibits higher surface area than V3. This is probably due to the high amount of vanadia alkoxide used in the preparation of V8 catalyst comparatively to that of V3. Higher amount of organic residues thus remains on the titania surface after calcination at this low temperature, which leads to a product with lower cristallinity and consequently with higher surface area. However, the increasing in the calcination temperature over 400°C leads to the dramatical decrease of the surface area of V8 comparatively to that of V3 (Table 1), and high amount of rutile (57%) is already formed at 600°C. At the same temperature V2O5 crystallites (2θ=26.18–20.31–31.06°) appear (Fig. 2b ). This is consistent with the well-known promoting effect of vanadia on both the TiO2 sintering and the anatase to rutile transformation. As the calcination temperature is further increased above 600°C, the crystalline V2O5 content is diminished and is not present at 800°C which indicates that most of the vanadia is incorporated into the titania support as V x Ti1−x O2 (rutile) [7]. On V3, no V2O5 crystallites, even before the total transformation of the titania anatase into rutile, have been observed, probably because vanadia was highly dispersed as isolated VO x species. However, WO3 crystalline has been detected at 800°C on V3 catalyst (Fig. 2a). The presence of WO3 without V2O5 crystallites on Ti support at high calcination temperatures on both V3 and V8 catalysts suggests that titania interacts more strongly with vanadia than with tungsten [8]. Low intensity of rutile and WO3 crystallites peaks on V8 at 800°C have been observed comparatively to those of V3. This could be due to the destruction of the surface structure of titania because of the modification of rutile structure and the loss of its crystallinity, promoted by high vanadia loading. 3.2 Thermal analysis The samples (∼15mg) were heated in flowing air (100ml/min) from ambient temperature to 1000°C at a rate of 5°C/min. The thermoanalytical results of the samples (Ti, W9Ti, V3W9Ti, V8W9Ti) are illustrated in Figs. 3 and 4 . DTA curves for all samples show endothermal peaks in temperature range (104–108°C) originated mainly from the evaporation of water (desorption of physical water, dehydroxylation) which was already present in the samples, followed by two exothermal peaks at ∼(127–134°C) and at ∼(298–309°C) with shoulders at ∼(219–228°C), respectively, due to the oxidation of organic residues and formation of CO2. It is worth noting to mention that the sample A is still completely amorphous after this oxidation process for all samples (not shown). The exothermal peaks located at (469, 482, 446 and 442°C) for the four samples (TiO2, W9Ti, V3W9Ti and V8W9Ti), respectively, reflect the crystallization of titania anatase. The oxidation of organic residues and the crystallization of titania anatase are accompanied with a weight loss in all cases. On samples Ti and W9Ti, the anatase peak intensity is higher than that of CO2 peak (Fig. 3a and b), possibly because inorganic precursor for WO3 is used in different tungsten loadings and has more significant effect on the formation of a strong anatase crystallites, which was confirmed by XRD. When vanadia is introduced, the inverse occurs (Fig. 4a and b), especially in case V8 where the intensity of anatase peak is lower than that of all other samples. The CO2 peak in case V8 is also much larger, probably because vanadia is generated from an alkoxide which increases the amount of organic residues, which need larger window of temperature to be oxidized. By adding vanadia to W9Ti, the appearance of anatase peak shift to lower temperatures (446°C for V3 and 442°C for V8). A very weak and broad exothermal DTA signal which has a maximum at ∼600°C observed on V8 indicates a slight crystallization of V2O5, followed by a weak and broad endothermal peak at ∼695°C, corresponding to the vanadia melting. This agrees with our results obtained by XRD where only small crystallites of V2O5 have been detected on V8 calcined at 600°C which disappear fastly over this temperature. On V3 catalyst, no V2O5 crystallization has been observed and only a very weak endothermal DTA peak at 673°C has been detected. This behavior of both catalysts could be due as reported in literature by mean of XPS analysis [7], to the strong interaction between vanadia and titania support which leads to formation of V(IV) ions situated in the substitution points of Ti(IV) ions in TiO2 anatase lattice. Thus only weak population of V(V) species is enable to grow. Heat treatment may promote diffusion of V(IV) into titania crystal structure generating substitutional defects which induce formation of rutile phase. Thus, the endothermal peaks corresponding to the melting of vanadia crystallites which should be observed by DTA analysis on both V3 and V8 are left and are replaced by a very weak DTA signal at 673 and 695°C, respectively. On samples V3 and V8, a slight increasing in the weight (5 and 3%, respectively) is observed over 500°C, probably because of the oxidation of vanadia, which confirms our supposition that vanadia is still present in a partly reduced state even with high V loading. An explicit and precise evaluation of the content of V(IV) and V(V) in the ternary V-W/Ti catalyst is not the aim of the present paper. However, in the literature, the role and the presence of V(IV) on TiO2-supported systems have been the object of long debate. While several authors on the basis of EXAFS, TPR and XPS data [9,10] concluded that pentavalent vanadium is the only component of the overlayer on TiO2, other authors showed the presence of nonnegligible amounts of vanadium(IV) [11–13], but their quantitative evaluation is however not easy to attempt. Previous studies have shown that the alkoxide route leads to the formation of V(IV) [14,15] which agree with our observations. 3.3 Catalytic activity measurements The results of the catalytic tests in the reduction of (NO+NO2) by NH3 performed over V3 and V8 samples are shown in Fig. 5 . The reaction stoichiometry in typical SCR conditions are the following [15]: (R1) 4NH 3+4NO+O 2→4N 2+6H 2 O (R2) 4NH 3+2NO 2+O 2→3N 2+6H 2 O The reaction between NO and ammonia can also proceed in a different way, giving rise to the unwanted product N2O (R3) 4NH 3+4NO+3O 2→4N 2 O+6H 2 O Ammonia can also be oxidized by oxygen instead of NO through one of the following ways: (R4) 2NH 3+ 3 2 O 2→N 2+3H 2 O (R5) 2NH 3+2O 2→N 2 O+3H 2 O (R6) 2NH 3+ 5 2 O 2→2NO+3H 2 O (R7) 4NH 3+7O 2→4NO 2+6H 2 O The reaction parameters were kept the same for SCR reaction and ammonia oxidation experiments to facilitate combination of the two studies in drawing conclusions for the side reactions. The conversion of NO x and the N2 selectivity were calculated as X NO x =1− [NO x] out [NO x] in and S N 2 = [N 2] [N 2]+[N 2 O] respectively. The moles of N2 can be determined from the following atomic nitrogen balance: N 2,out = 1 2 ([NO x] in −[NO x] out )+ 1 2 ([NH 3] in −[NH 3] out )−[N 2 O] out The results of the steady-state reaction on V3 and V8 calcined at 500°C as a function of temperature show that V3 catalyst exhibits a significant activity at 150°C (87%) which increases upon increasing the temperature up to 300°C (97%) (Fig. 5a). Below 325°C, the amount of N2O produced is weak (Fig. 6a ), resulting in a high nitrogen selectivity. Over 325°C, NO x conversion slightly decreases and reaches 75% at 500°C and the N2 selectivity remains high up to 500°C. On V8 catalyst, the NO x conversion increases abruptly with temperature, reaching 100% conversion in temperature range (250–325°C). At a temperature lower than 225°C, its activity is significantly weaker than that of V3, this low reactivity explains the low formation of N2O during the SCR reaction (Fig. 6b). The selectivity to nitrogen remains high up to 325°C before dropping. Over 325°C, NO x conversion dramatically decreases and high amount of N2O is produced due probably to the greater relative importance of the side reactions. Over 450°C, N2O amount further decreases. N2O may be formed from oxidation of ammonia by O2 (R5) or from oxidation by NO+O2 (R3). The question is, which reaction is prevailing over each catalyst. Comparing experiments carried out with and without NO x , have shown that N2O is formed through different ways. In fact in case V3, the amount of nitrous oxide produced in SCR reaction is weak in all working temperature and exhibits a maximum of 22ppm at 325°C (Fig. 6a). In ammonia oxidation, only 6ppm of N2O have been formed at the same temperature (Fig. 7c ). The sum of the selectivity for the standard SCR reaction and for N2O formation is lower than 100% in case V3, the missing difference is attributed to the ammonia oxidation into N2 (R4). In case V8, SCR reaction produces considerable amount of N2O which reaches 186ppm at 450°C (Fig. 6b). High amount of N2O was also produced during NH3 oxidation reaching 128ppm as a maximum at 425°C and 125ppm at 450°C (Fig. 7d). The small difference in the N2O formed during both reactions (SCR and NH3 oxidation) indicates that during the SCR reaction, N2O is mainly formed according to reaction R5. It is interesting to note that in spite of the relatively low surface area of V8 (22m2/g), comparatively to that of V3 (77m2/g), its activity reaches 100% in temperature range (250–325°C), which indicates the presence of highly active vanadia on titania support. However, the strong decrease in the activity over 325°C suggests the presence of microcrystalline vanadia which is known to promote ammonia oxidation. During ammonia oxidation, higher selectivity to NO than to N2O (not shown) was measured in temperature range (275–500°C) over V3, on the contrary of V8 where high amount of N2O was produced comparatively to NO which decreases again over 400°C. No adsorption of NO has been observed over both V3 and V8 catalysts under the reaction conditions, this suggests that the selective reduction of NO over both catalysts occur by an Eley–Rideal mechanism. The decrease of N2O amount observed at high temperature over V3 could be due to its decomposition by way [15] N 2 O→N 2+ 1 2 O 2 In case V8, N2O could also be oxidised to NO by way [16] N 2 O+ 1 2 O 2→NO, which explains the high amount of NO formed at high temperatures during ammonia oxidation. This is probably due to transition metal oxides as V–W/Ti used in our case which could also be active as catalyst for N2O decomposition as reported by Ramanujachary and Swamy [17]. Similar experiments (SCR and ammonia oxidation) have been carried out on V3 and V8 catalysts without WO3. The results have shown a lower activity of both catalysts over the whole temperature range and a high selectivity to N2O and NO which indicates the effect of WO3 on the stability of titania upon addition of vanadia. But this point will be discussed in the forthcoming paper. 4 Discussion The results in Table 1 and Figs. 1 and 2 show that WO3 has an influence on the crystallite growth process, providing thermal stability by inhibiting initial sintering process. The presence of large amounts of tungsten (∼9%; w/w) are essential to preserve the structural and morphological properties of W/Ti samples upon addition of vanadia. Up to 500°C, all samples are monophasic and consist of the anatase polymorphic form of TiO2. By increasing the calcination temperature and in the presence of vanadia, the TiO2 anatase support exhibited a simultaneous loss in surface area and the increase of mean pore radius. Formation of crystalline WO3 for sample with 9% (w/w) tungsten was observed at a high calcination temperature. However, only small V2O5 crystallites are formed at 600°C for sample with high vanadia loading (V8), and disappear fastly at higher calcination temperature. Additional structural information come from the calculations of V and W concentrations which show that above the theoretical monolayer, crystalline V2O5 and WO3 are not formed as it is usually observed for V2O5-WO3/TiO2 catalysts. In our case this occurs only when W and V concentrations are higher than those corresponding to three monolayers. With our TG/DTA and XRD results we found only a very weak evidence for a clear formation of crystalline vanadia in sample V8. This characteristic feature differs from the one reported in literature [16] where crystalline vanadia has been well detected at high vanadia content. This behavior could be due to the sol–gel method which leads to a well dispersion of V on Ti support due to a strong V–Ti electrostatic interactions involving these two oxides [16], on the contrary of other methods where crystalline V2O5 is formed even at low vanadium content [5]. It thus seems that alkoxide route leads to immobilized vanadia layers with a higher degree of disorder and the formation of crystalline domains is strongly lowered. These results suggest the presence of a solid state solution of vanadium in anatase [8] where the V(IV) species are stabilized by interaction with titania support and further stabilization occurs at high calcination temperatures by their localisation in titania rutile lattice [7]. Some previous findings have shown that the presence of crystalline V2O5 appears to be essential for the formation of V x Ti1−x O2 (rutile) from the supported vanadia phase on the TiO2 anatase [18]. Kozlowski et al. showed that the monolayer of surface vanadia species was first converted into crystalline V2O5 prior to the formation of V x Ti1−x O2 rutile [19]. However, in our case, V3 calcined at high temperature which was in excess of monolayer did not show any V2O5 crystallites before the transformation into rutile. Furthermore, in case V8, high amount of rutile (57%) was formed at 600°C and very small crystallites of V2O5 have been observed at the same temperature which disappear rapidly. These results indicate that the solid state reaction between vanadia and titania anatase to form rutile outweights the V2O5 crystallites formation. We therefore conclude that it is not necessary to have the rutile after the formation of crystalline V2O5 on titania support. Both V3 and V8 catalysts exhibit high reactivity in the selective catalytic reduction of NO x . More significant changes in activity occurred on sample with high vanadia content. In fact, total NO x conversion was observed at 250°C on catalyst V8 and preserved only up to 325°C. Over 325°C, its SCR activity was lower than that of V3 because part of ammonia was consumed in side reactions (R5) leaving less ammonia to react in the standard SCR reaction which leads to the increase in NO concentration. In case V3, N2 was not formed only by SCR reaction but also by ammonia oxidation which explains the slight decrease in SCR activity due to consumption of the reducing agent and the increase in the selectivity to nitrogen observed over 325°C. Over V3, very low amount of N2O was formed during the SCR reaction which was found to result mainly from the unwanted SCR reaction, while over V8, N2O was formed mainly through direct oxidation of ammonia and on the contrary of V3, the N2O amount was considerable. This indicates the different nature of active sites present over both catalysts. Several previous findings have shown that the polymeric metavanadate species which are formed in the case of high vanadia loading, are more reactive than those of monomeric species [20]. These agree with our results which show higher reactivity of V8 catalyst comparatively to V3, indicating the presence of high fraction of polymeric vanadia. However, the dramatic decrease in the NO x reduction occurring upon increasing the working temperature indicates the presence of microcrystalline V2O5 particles which are known to promote ammonia oxidation. Low vanadia loading leads to well dispersion of vanadia on Ti support, which improves the selectivity to N2 [21]. With high vanadia loading, segregation into bulk V2O5 takes place decreasing the interaction with titania and results in a significant change of its catalytic performances. From these results, we can conclude that V3 catalyst has the widest temperature window for high NO x conversion and N2 selectivity than V8. 5 Conclusions The results presented above show that the state of V2O5-WO3/TiO2 catalyst is strongly dependent on calcination temperature and V2O5 content. High vanadia loading decreases the temperature required for conversion of titania anatase into rutile. It has been observed that crystallites of V2O5 and WO3 are formed when their concentrations are greater than those corresponding to three monolayers and that the anatase to rutile transformation did not occur necessary after V2O5 crystallites formation. This suggests the existence of high electronic interactions between V and Ti species due probably to the alkoxid route used for the preparation of the catalysts in our case. Vanadia content strongly influences the catalytic behavior of V-W/Ti catalyst. Indeed, the well dispersed and isolated vanadium oxide species were found to be weakly active for the SCR reaction but with a high selectivity to N2. Increasing vanadia loadings leads to the sintering of the TiO2 support and to aggregation of isolated vanadium ions which favours the activity in the SCR reaction but only in a narrow temperature window and promotes the undesired ammonia oxidation at high temperatures. References [1] H. Bosch F. Janssen Catal. Today 2 1988 369 [2] P. Forzatti L. Lietti Heter. Chem. Rev. 3 1996 33 [3] R.A. Spurr H. Myers Anal. Chem. 31 1978 2481 [4] D.C. Vermaire P.C. van Berge J. Catal. 116 1989 309 [5] G.C. Bond S.F. Tahir Appl. Catal. 71 1991 1 31 [6] L. Alemany L. Lietti J. Catal. 155 1995 117 130 [7] M.A. Banares L.J. Alemany M. Carmen Jimenez J. Sol. State Chem. 124 1996 69 76 [8] A.A. Altynnikov G.A. Zenkovets V.F. Anufrienko React. Kinet. Catal. Lett. 66 1 1999 85 90 [9] H. Eckerdt I.E. Wachs J. Phys. Chem. 93 1989 6796 [10] H. Eckerdt G. Deo I.E. Wachs A.M. Hirt Colloids Surf. 45 1990 347 [11] M. Turco G. Bagnasco L. Lisi P. Ciambelli J. Therm. Anal. 38 1992 2631 [12] E. Pereira L.A. Gambaro H. Thomas J. Trans. Met. Chem. 5 1980 139 [13] S.L.T. Andersson Catal. Lett. 7 1990 351 [14] N.V. Economidis D.A. Pena P.G. Smirniotis Appl. Catal. B 23 1999 123 134 [15] G. Busca L. Lietti G. Ramis F. Berti Appl. Catal. B 18 1998 1 36 [16] M. Schneider M. Maciejewski S. Tschudin A. Wokaun A. Baiker J. Catal. 149 1994 326 343 [17] K.V. Ramanujachary C.S. Swamy J. Catal. 93 1985 279 287 [18] R.Y. Saleh I.E. Wachs S.S. Chan C.C. Chersich J. Catal. 98 1986 102 114 [19] R. Kozlowski R.F. Pettifer J.M. Thomas J. Phys. Chem. 87 1983 5176 [20] L. Lietti P. Forzatti J. Catal. 147 1994 241 249 [21] M.C. Paganini L. Dell’Acqua E. Giamello L. Lietti P. Forzatti G. Busca J. Catal. 166 1997 195",
      "scopus-id": "0346906970",
      "coredata": {
        "eid": "1-s2.0-S1381116903005545",
        "dc:description": "Titania-supported tungsten and vanadia oxides with different W and V loadings and calcined at different temperatures have been prepared by the sol–gel method and characterized. Large amount of tungsten (9%; w/w) provides thermal stability to WO3/TiO2 systems upon addition of vanadia. It is found that WO3 and V2O5 crystallites are formed when their concentrations are higher than those corresponding to three monolayers. DTA analyses have shown that the presence of V2O5 crystallites is not essential for the transformation of titania anatase into rutile. High reactivity in limited temperature range (225–350°C) has been observed for the catalyst with 8% (w/w) V2O5 with a high formation of N2O amount during the SCR reaction. The catalyst with 3% (w/w) V2O5 exhibits a slight lower reactivity but with a high selectivity to N2 preserved in all working temperature.",
        "openArchiveArticle": "false",
        "prism:coverDate": "2004-02-02",
        "openaccessUserLicense": null,
        "prism:aggregationType": "Journal",
        "prism:url": "https://api.elsevier.com/content/article/pii/S1381116903005545",
        "dc:creator": [
          {
            "@_fa": "true",
            "$": "Djerad, S."
          },
          {
            "@_fa": "true",
            "$": "Tifouti, L."
          },
          {
            "@_fa": "true",
            "$": "Crocoll, M."
          },
          {
            "@_fa": "true",
            "$": "Weisweiler, W."
          }
        ],
        "link": [
          {
            "@_fa": "true",
            "@rel": "self",
            "@href": "https://api.elsevier.com/content/article/pii/S1381116903005545"
          },
          {
            "@_fa": "true",
            "@rel": "scidir",
            "@href": "https://www.sciencedirect.com/science/article/pii/S1381116903005545"
          }
        ],
        "dc:format": "application/json",
        "openaccessType": null,
        "pii": "S1381-1169(03)00554-5",
        "prism:volume": "208",
        "prism:publisher": "Elsevier B.V.",
        "dc:title": "Effect of vanadia and tungsten loadings on the physical and chemical characteristics of V2O5-WO3/TiO2 catalysts",
        "prism:copyright": "Copyright © 2003 Elsevier B.V. All rights reserved.",
        "openaccess": "0",
        "prism:issn": "13811169",
        "prism:issueIdentifier": "1-2",
        "dcterms:subject": [
          {
            "@_fa": "true",
            "$": "Titania"
          },
          {
            "@_fa": "true",
            "$": "Vanadium oxide"
          },
          {
            "@_fa": "true",
            "$": "Catalyst characterization"
          },
          {
            "@_fa": "true",
            "$": "Monolayers"
          },
          {
            "@_fa": "true",
            "$": "SCR reaction"
          }
        ],
        "openaccessArticle": "false",
        "prism:publicationName": "Journal of Molecular Catalysis A: Chemical",
        "prism:number": "1-2",
        "openaccessSponsorType": null,
        "prism:pageRange": "257-265",
        "prism:endingPage": "265",
        "pubType": "fla",
        "prism:coverDisplayDate": "2 February 2004",
        "prism:doi": "10.1016/j.molcata.2003.07.016",
        "prism:startingPage": "257",
        "dc:identifier": "doi:10.1016/j.molcata.2003.07.016",
        "openaccessSponsorName": null
      },
      "objects": {
        "object": [
          {
            "@category": "thumbnail",
            "@height": "40",
            "@width": "139",
            "@_fa": "true",
            "$": "https://api.elsevier.com/content/object/eid/1-s2.0-S1381116903005545-si9.gif?httpAccept=%2A%2F%2A",
            "@multimediatype": "GIF image file",
            "@type": "ALTIMG",
            "@size": "934",
            "@ref": "si9",
            "@mimetype": "image/gif"
          },
          {
            "@category": "thumbnail",
            "@height": "14",
            "@width": "207",
            "@_fa": "true",
            "$": "https://api.elsevier.com/content/object/eid/1-s2.0-S1381116903005545-si8.gif?httpAccept=%2A%2F%2A",
            "@multimediatype": "GIF image file",
            "@type": "ALTIMG",
            "@size": "809",
            "@ref": "si8",
            "@mimetype": "image/gif"
          },
          {
            "@category": "thumbnail",
            "@height": "20",
            "@width": "202",
            "@_fa": "true",
            "$": "https://api.elsevier.com/content/object/eid/1-s2.0-S1381116903005545-si7.gif?httpAccept=%2A%2F%2A",
            "@multimediatype": "GIF image file",
            "@type": "ALTIMG",
            "@size": "859",
            "@ref": "si7",
            "@mimetype": "image/gif"
          },
          {
            "@category": "thumbnail",
            "@height": "13",
            "@width": "199",
            "@_fa": "true",
            "$": "https://api.elsevier.com/content/object/eid/1-s2.0-S1381116903005545-si6.gif?httpAccept=%2A%2F%2A",
            "@multimediatype": "GIF image file",
            "@type": "ALTIMG",
            "@size": "776",
            "@ref": "si6",
            "@mimetype": "image/gif"
          },
          {
            "@category": "thumbnail",
            "@height": "20",
            "@width": "189",
            "@_fa": "true",
            "$": "https://api.elsevier.com/content/object/eid/1-s2.0-S1381116903005545-si5.gif?httpAccept=%2A%2F%2A",
            "@multimediatype": "GIF image file",
            "@type": "ALTIMG",
            "@size": "812",
            "@ref": "si5",
            "@mimetype": "image/gif"
          },
          {
            "@category": "thumbnail",
            "@height": "14",
            "@width": "259",
            "@_fa": "true",
            "$": "https://api.elsevier.com/content/object/eid/1-s2.0-S1381116903005545-si4.gif?httpAccept=%2A%2F%2A",
            "@multimediatype": "GIF image file",
            "@type": "ALTIMG",
            "@size": "963",
            "@ref": "si4",
            "@mimetype": "image/gif"
          },
          {
            "@category": "thumbnail",
            "@height": "14",
            "@width": "245",
            "@_fa": "true",
            "$": "https://api.elsevier.com/content/object/eid/1-s2.0-S1381116903005545-si3.gif?httpAccept=%2A%2F%2A",
            "@multimediatype": "GIF image file",
            "@type": "ALTIMG",
            "@size": "930",
            "@ref": "si3",
            "@mimetype": "image/gif"
          },
          {
            "@category": "thumbnail",
            "@height": "14",
            "@width": "239",
            "@_fa": "true",
            "$": "https://api.elsevier.com/content/object/eid/1-s2.0-S1381116903005545-si2.gif?httpAccept=%2A%2F%2A",
            "@multimediatype": "GIF image file",
            "@type": "ALTIMG",
            "@size": "878",
            "@ref": "si2",
            "@mimetype": "image/gif"
          },
          {
            "@category": "thumbnail",
            "@height": "20",
            "@width": "131",
            "@_fa": "true",
            "$": "https://api.elsevier.com/content/object/eid/1-s2.0-S1381116903005545-si13.gif?httpAccept=%2A%2F%2A",
            "@multimediatype": "GIF image file",
            "@type": "ALTIMG",
            "@size": "613",
            "@ref": "si13",
            "@mimetype": "image/gif"
          },
          {
            "@category": "thumbnail",
            "@height": "20",
            "@width": "122",
            "@_fa": "true",
            "$": "https://api.elsevier.com/content/object/eid/1-s2.0-S1381116903005545-si12.gif?httpAccept=%2A%2F%2A",
            "@multimediatype": "GIF image file",
            "@type": "ALTIMG",
            "@size": "574",
            "@ref": "si12",
            "@mimetype": "image/gif"
          },
          {
            "@category": "thumbnail",
            "@height": "20",
            "@width": "446",
            "@_fa": "true",
            "$": "https://api.elsevier.com/content/object/eid/1-s2.0-S1381116903005545-si11.gif?httpAccept=%2A%2F%2A",
            "@multimediatype": "GIF image file",
            "@type": "ALTIMG",
            "@size": "1798",
            "@ref": "si11",
            "@mimetype": "image/gif"
          },
          {
            "@category": "thumbnail",
            "@height": "40",
            "@width": "134",
            "@_fa": "true",
            "$": "https://api.elsevier.com/content/object/eid/1-s2.0-S1381116903005545-si10.gif?httpAccept=%2A%2F%2A",
            "@multimediatype": "GIF image file",
            "@type": "ALTIMG",
            "@size": "878",
            "@ref": "si10",
            "@mimetype": "image/gif"
          },
          {
            "@category": "thumbnail",
            "@height": "39",
            "@width": "263",
            "@_fa": "true",
            "$": "https://api.elsevier.com/content/object/eid/1-s2.0-S1381116903005545-si1.gif?httpAccept=%2A%2F%2A",
            "@multimediatype": "GIF image file",
            "@type": "ALTIMG",
            "@size": "1412",
            "@ref": "si1",
            "@mimetype": "image/gif"
          },
          {
            "@category": "thumbnail",
            "@height": "93",
            "@width": "64",
            "@_fa": "true",
            "$": "https://api.elsevier.com/content/object/eid/1-s2.0-S1381116903005545-fx1.sml?httpAccept=%2A%2F%2A",
            "@multimediatype": "GIF image file",
            "@type": "IMAGE-THUMBNAIL",
            "@size": "916",
            "@ref": "fx1",
            "@mimetype": "image/gif"
          },
          {
            "@category": "standard",
            "@height": "376",
            "@width": "259",
            "@_fa": "true",
            "$": "https://api.elsevier.com/content/object/eid/1-s2.0-S1381116903005545-fx1.gif?httpAccept=%2A%2F%2A",
            "@multimediatype": "GIF image file",
            "@type": "IMAGE-DOWNSAMPLED",
            "@size": "6101",
            "@ref": "fx1",
            "@mimetype": "image/gif"
          },
          {
            "@category": "thumbnail",
            "@height": "93",
            "@width": "68",
            "@_fa": "true",
            "$": "https://api.elsevier.com/content/object/eid/1-s2.0-S1381116903005545-gr1.sml?httpAccept=%2A%2F%2A",
            "@multimediatype": "GIF image file",
            "@type": "IMAGE-THUMBNAIL",
            "@size": "1177",
            "@ref": "gr1",
            "@mimetype": "image/gif"
          },
          {
            "@category": "standard",
            "@height": "787",
            "@width": "576",
            "@_fa": "true",
            "$": "https://api.elsevier.com/content/object/eid/1-s2.0-S1381116903005545-gr1.gif?httpAccept=%2A%2F%2A",
            "@multimediatype": "GIF image file",
            "@type": "IMAGE-DOWNSAMPLED",
            "@size": "28763",
            "@ref": "gr1",
            "@mimetype": "image/gif"
          },
          {
            "@category": "thumbnail",
            "@height": "93",
            "@width": "32",
            "@_fa": "true",
            "$": "https://api.elsevier.com/content/object/eid/1-s2.0-S1381116903005545-gr2.sml?httpAccept=%2A%2F%2A",
            "@multimediatype": "GIF image file",
            "@type": "IMAGE-THUMBNAIL",
            "@size": "685",
            "@ref": "gr2",
            "@mimetype": "image/gif"
          },
          {
            "@category": "standard",
            "@height": "742",
            "@width": "256",
            "@_fa": "true",
            "$": "https://api.elsevier.com/content/object/eid/1-s2.0-S1381116903005545-gr2.gif?httpAccept=%2A%2F%2A",
            "@multimediatype": "GIF image file",
            "@type": "IMAGE-DOWNSAMPLED",
            "@size": "13804",
            "@ref": "gr2",
            "@mimetype": "image/gif"
          },
          {
            "@category": "thumbnail",
            "@height": "93",
            "@width": "37",
            "@_fa": "true",
            "$": "https://api.elsevier.com/content/object/eid/1-s2.0-S1381116903005545-gr3.sml?httpAccept=%2A%2F%2A",
            "@multimediatype": "GIF image file",
            "@type": "IMAGE-THUMBNAIL",
            "@size": "1611",
            "@ref": "gr3",
            "@mimetype": "image/gif"
          },
          {
            "@category": "standard",
            "@height": "464",
            "@width": "185",
            "@_fa": "true",
            "$": "https://api.elsevier.com/content/object/eid/1-s2.0-S1381116903005545-gr3.gif?httpAccept=%2A%2F%2A",
            "@multimediatype": "GIF image file",
            "@type": "IMAGE-DOWNSAMPLED",
            "@size": "10549",
            "@ref": "gr3",
            "@mimetype": "image/gif"
          },
          {
            "@category": "thumbnail",
            "@height": "77",
            "@width": "125",
            "@_fa": "true",
            "$": "https://api.elsevier.com/content/object/eid/1-s2.0-S1381116903005545-gr4.sml?httpAccept=%2A%2F%2A",
            "@multimediatype": "GIF image file",
            "@type": "IMAGE-THUMBNAIL",
            "@size": "2535",
            "@ref": "gr4",
            "@mimetype": "image/gif"
          },
          {
            "@category": "standard",
            "@height": "269",
            "@width": "438",
            "@_fa": "true",
            "$": "https://api.elsevier.com/content/object/eid/1-s2.0-S1381116903005545-gr4.gif?httpAccept=%2A%2F%2A",
            "@multimediatype": "GIF image file",
            "@type": "IMAGE-DOWNSAMPLED",
            "@size": "12359",
            "@ref": "gr4",
            "@mimetype": "image/gif"
          },
          {
            "@category": "thumbnail",
            "@height": "84",
            "@width": "125",
            "@_fa": "true",
            "$": "https://api.elsevier.com/content/object/eid/1-s2.0-S1381116903005545-gr5.sml?httpAccept=%2A%2F%2A",
            "@multimediatype": "GIF image file",
            "@type": "IMAGE-THUMBNAIL",
            "@size": "2344",
            "@ref": "gr5",
            "@mimetype": "image/gif"
          },
          {
            "@category": "standard",
            "@height": "281",
            "@width": "416",
            "@_fa": "true",
            "$": "https://api.elsevier.com/content/object/eid/1-s2.0-S1381116903005545-gr5.gif?httpAccept=%2A%2F%2A",
            "@multimediatype": "GIF image file",
            "@type": "IMAGE-DOWNSAMPLED",
            "@size": "9818",
            "@ref": "gr5",
            "@mimetype": "image/gif"
          },
          {
            "@category": "thumbnail",
            "@height": "94",
            "@width": "74",
            "@_fa": "true",
            "$": "https://api.elsevier.com/content/object/eid/1-s2.0-S1381116903005545-gr6.sml?httpAccept=%2A%2F%2A",
            "@multimediatype": "GIF image file",
            "@type": "IMAGE-THUMBNAIL",
            "@size": "1888",
            "@ref": "gr6",
            "@mimetype": "image/gif"
          },
          {
            "@category": "standard",
            "@height": "210",
            "@width": "166",
            "@_fa": "true",
            "$": "https://api.elsevier.com/content/object/eid/1-s2.0-S1381116903005545-gr6.gif?httpAccept=%2A%2F%2A",
            "@multimediatype": "GIF image file",
            "@type": "IMAGE-DOWNSAMPLED",
            "@size": "4447",
            "@ref": "gr6",
            "@mimetype": "image/gif"
          },
          {
            "@category": "thumbnail",
            "@height": "94",
            "@width": "74",
            "@_fa": "true",
            "$": "https://api.elsevier.com/content/object/eid/1-s2.0-S1381116903005545-gr7.sml?httpAccept=%2A%2F%2A",
            "@multimediatype": "GIF image file",
            "@type": "IMAGE-THUMBNAIL",
            "@size": "2113",
            "@ref": "gr7",
            "@mimetype": "image/gif"
          },
          {
            "@category": "standard",
            "@height": "243",
            "@width": "192",
            "@_fa": "true",
            "$": "https://api.elsevier.com/content/object/eid/1-s2.0-S1381116903005545-gr7.gif?httpAccept=%2A%2F%2A",
            "@multimediatype": "GIF image file",
            "@type": "IMAGE-DOWNSAMPLED",
            "@size": "6196",
            "@ref": "gr7",
            "@mimetype": "image/gif"
          }
        ]
      },
      "link": {
        "@rel": "abstract",
        "@href": "https://api.elsevier.com/content/abstract/scopus_id/0346906970"
      }
    }
  }
}