{
  "metadata": {
    "title": "Host (nanocavity of zeolite Y)-guest (ruthenium(III) salophen complex) nanocomposite materials: An efficient and reusable catalyst for shape-selective epoxidation of linear alkenes with sodium periodate",
    "authors": "; ; ",
    "journal": "Journal of Molecular Catalysis A: Chemical",
    "date": "2013-10-31",
    "doi": "10.1016/j.molcata.2013.04.034",
    "abstract": "",
    "uri": "https://api.elsevier.com/content/article/pii/S1381116913001829",
    "pii": "S1381116913001829"
  },
  "fulltext": {
    "full-text-retrieval-response": {
      "scopus-eid": "2-s2.0-84878334392",
      "originalText": "serial JL 271358 291210 291744 291790 291809 31 Journal of Molecular Catalysis A: Chemical JOURNALMOLECULARCATALYSISACHEMICAL 2013-05-09 2013-05-09 2013-07-29T20:43:43 1-s2.0-S1381116913001829 S1381-1169(13)00182-9 S1381116913001829 10.1016/j.molcata.2013.04.034 S300 S300.1 FULL-TEXT 1-s2.0-S1381116913X00081 2015-05-15T05:56:33.63776-04:00 0 0 20131001 20131031 2013 2013-05-09T00:00:00Z articleinfo crossmark dco dateupdated tomb dateloaded datesearch indexeddate volumelist yearnav absattachment articletitlenorm authfirstinitialnorm authfirstsurnamenorm cid cids contenttype copyright dateloadedtxt docsubtype doctype doi eid ewtransactionid hubeid issn issnnorm itemstage itemtransactionid itemweight openaccess openarchive pg pgfirst pglast pii piinorm pubdateend pubdatestart pubdatetxt pubyr sectiontitle sortorder srctitle srctitlenorm srctype subheadings suppl volfirst volissue webpdf webpdfpagecount figure table body acknowledge affil articletitle auth authfirstini authfull authkeywords authlast highlightsabst primabst ref specialabst alllist content subj ssids 1381-1169 13811169 false 377 377 C Volume 377 14 92 101 92 101 201310 October 2013 2013-10-01 2013-10-31 2013 Regular Papers article fla Copyright © 2013 Elsevier B.V. All rights reserved. HOSTNANOCAVITYZEOLITEYGUESTRUTHENIUMIIISALOPHENCOMPLEXNANOCOMPOSITEMATERIALSEFFICIENTREUSABLECATALYSTFORSHAPESELECTIVEEPOXIDATIONLINEARALKENESSODIUMPERIODATE MOOSAVIFAR M 1 Introduction 2 Experimental 2.1 Instrumental 2.2 Synthesis and purification of zeolite-encapsulated [Ru(salophen)Cl] 2.2.1 Preparation of Ru-exchange zeolite, RuY 2.2.2 Preparation of zeolite-encapsulated Ru(III) salophen (ZERS) 2.3 General procedure for oxidation reactions catalyzed by ZERS under MS or US irradiation 3 Results and discussion 3.1 Preparation and characterization of zeolite-encapsulated ruthenium salophen (ZERS) 3.2 Effect of solvent on the epoxidation reactions 3.3 Effect of catalyst amount on the epoxidation of cyclooctene with NaIO4 3.4 Epoxidation of alkenes with NaIO4 in the presence ZERS under magnetic stirring 3.5 Epoxidation of alkenes with NaIO4 in the presence of zeolite-encapsulated ruthenium-salophen (ZERS) under ultrasonic irradiation 3.6 Shape-selectivity in the epoxidation of linear alkene in the presence of ZERS 3.7 Catalyst recovery and reuse in the epoxidation of cyclooctene epoxidation 4 Conclusion Acknowledgement References SALAMA 2009 159 165 T JIN 2006 23 30 C AHMED 2009 877 883 A POLTOWICZ 2006 235 242 J KONER 1998 593 594 S MAURYA 2007 227 237 M SRINIVAS 2003 121 132 D BALKUS 1996 159 173 K MIRKHANI 2007 49 57 V XAVIER 2004 251 259 K MCMORN 2004 108 122 P OGUNWUMI 1997 901 902 S SABATER 1997 1285 1286 M JACOB 1998 353 364 C DESHPANDE 1999 261 269 S SEELAN 2000 163 171 S MAURYA 2003 97 105 M MAURYA 2007 225 235 M FERREIRA 2000 391 401 R SALAMA 2006 251 259 T JACOB 1998 465 474 C ZANJANCHI 2001 193 198 M ZAKHAROV 1985 389 393 A MOGHADAM 2009 157 163 M MOGHADAM 2009 68 75 M HABER 2004 153 159 J MIRKHANI 2005 251 255 V NASRESFAHANI 2006 2720 2724 M NASRESFAHANI 2008 244 251 M MIRKHANI 2008 375 383 V KATSUKI 1995 189 214 T KATSUKI 1996 87 107 T DALTON 1998 75 91 C CANALI 1999 85 93 L FRAILE 1998 47 57 J MAURYA 2002 201 209 M HECKEL 2002 913 926 A ANNIS 1999 4147 4154 D ZHANG 2005 1209 1211 H XIANG 2002 2696 2697 S CHOUDARY 2000 417 421 B BALEIZAO 2003 199 207 C KIM 1999 139 143 G DE 1995 2105 2108 B KIM 2000 537 547 G MINUTOLO 1996 2293 2302 F CANALI 1999 155 168 L REGAR 2000 6929 6934 S KURESHY 1997 153 160 R JOSEPH 2002 289 299 T LI 2008 134 139 G BENNUR 2001 111 118 T CHEN 2006 969 973 P MASON 2002 17 T PRACTICALSONOCHEMISTRY HATEFI 2009 66 71 M HATEFI 2010 2953 2958 M MOGHADAM 2011 1019 1029 M MOOSAVIFARX2013X92 MOOSAVIFARX2013X92X101 MOOSAVIFARX2013X92XM MOOSAVIFARX2013X92X101XM item S1381-1169(13)00182-9 S1381116913001829 1-s2.0-S1381116913001829 10.1016/j.molcata.2013.04.034 271358 2013-08-09T12:29:23.424533-04:00 2013-10-01 2013-10-31 1-s2.0-S1381116913001829-main.pdf https://s3.amazonaws.com/prod-ucs-content-store-us-east/content/pii:S1381116913001829/MAIN/application/pdf/becfbc27bb7e767bf035ae5cc56ee1d1/main.pdf https://s3-eu-west-1.amazonaws.com/prod-ucs-content-store-eu-west/content/pii:S1381116913001829/MAIN/application/pdf/becfbc27bb7e767bf035ae5cc56ee1d1/main.pdf main.pdf pdf true 2081113 MAIN 10 1-s2.0-S1381116913001829-main_1.png https://s3-eu-west-1.amazonaws.com/prod-ucs-content-store-eu-west/content/pii:S1381116913001829/PREVIEW/image/png/c7a39c2d7d154984bead55600b851a7d/main_1.png https://s3.amazonaws.com/prod-ucs-content-store-us-east/content/pii:S1381116913001829/PREVIEW/image/png/c7a39c2d7d154984bead55600b851a7d/main_1.png main_1.png png 57858 849 656 IMAGE-WEB-PDF 1 1-s2.0-S1381116913001829-gr8_lrg.jpg https://s3.amazonaws.com/prod-ucs-content-store-us-east/content/pii:S1381116913001829/gr8/HIGHRES/image/jpeg/30fbad40f1781d20e23f59f01a998a3b/gr8_lrg.jpg https://s3-eu-west-1.amazonaws.com/prod-ucs-content-store-eu-west/content/pii:S1381116913001829/gr8/HIGHRES/image/jpeg/30fbad40f1781d20e23f59f01a998a3b/gr8_lrg.jpg gr8 gr8_lrg.jpg jpg 129332 1152 1686 IMAGE-HIGH-RES 1-s2.0-S1381116913001829-gr6_lrg.jpg https://s3.amazonaws.com/prod-ucs-content-store-us-east/content/pii:S1381116913001829/gr6/HIGHRES/image/jpeg/9dcd945210dfa28a6c6cbbc5a7c3872d/gr6_lrg.jpg https://s3-eu-west-1.amazonaws.com/prod-ucs-content-store-eu-west/content/pii:S1381116913001829/gr6/HIGHRES/image/jpeg/9dcd945210dfa28a6c6cbbc5a7c3872d/gr6_lrg.jpg gr6 gr6_lrg.jpg jpg 113466 865 900 IMAGE-HIGH-RES 1-s2.0-S1381116913001829-gr5_lrg.jpg https://s3.amazonaws.com/prod-ucs-content-store-us-east/content/pii:S1381116913001829/gr5/HIGHRES/image/jpeg/ccf0331d75fe65f70a1e3af53a01e61a/gr5_lrg.jpg https://s3-eu-west-1.amazonaws.com/prod-ucs-content-store-eu-west/content/pii:S1381116913001829/gr5/HIGHRES/image/jpeg/ccf0331d75fe65f70a1e3af53a01e61a/gr5_lrg.jpg gr5 gr5_lrg.jpg jpg 236259 1194 900 IMAGE-HIGH-RES 1-s2.0-S1381116913001829-gr3_lrg.jpg https://s3.amazonaws.com/prod-ucs-content-store-us-east/content/pii:S1381116913001829/gr3/HIGHRES/image/jpeg/e0547dcbfff49c44ff894ec99f26f041/gr3_lrg.jpg https://s3-eu-west-1.amazonaws.com/prod-ucs-content-store-eu-west/content/pii:S1381116913001829/gr3/HIGHRES/image/jpeg/e0547dcbfff49c44ff894ec99f26f041/gr3_lrg.jpg gr3 gr3_lrg.jpg jpg 470532 2295 3318 IMAGE-HIGH-RES 1-s2.0-S1381116913001829-gr2_lrg.jpg https://s3.amazonaws.com/prod-ucs-content-store-us-east/content/pii:S1381116913001829/gr2/HIGHRES/image/jpeg/03cbfbdeff3d4d98e41f109762e84cb1/gr2_lrg.jpg https://s3-eu-west-1.amazonaws.com/prod-ucs-content-store-eu-west/content/pii:S1381116913001829/gr2/HIGHRES/image/jpeg/03cbfbdeff3d4d98e41f109762e84cb1/gr2_lrg.jpg gr2 gr2_lrg.jpg jpg 300276 3141 1668 IMAGE-HIGH-RES 1-s2.0-S1381116913001829-gr1_lrg.jpg https://s3.amazonaws.com/prod-ucs-content-store-us-east/content/pii:S1381116913001829/gr1/HIGHRES/image/jpeg/6dd5c4ebf6afff298925c9a53b3f0ed5/gr1_lrg.jpg https://s3-eu-west-1.amazonaws.com/prod-ucs-content-store-eu-west/content/pii:S1381116913001829/gr1/HIGHRES/image/jpeg/6dd5c4ebf6afff298925c9a53b3f0ed5/gr1_lrg.jpg gr1 gr1_lrg.jpg jpg 170582 1638 1667 IMAGE-HIGH-RES 1-s2.0-S1381116913001829-sc2_lrg.jpg https://s3.amazonaws.com/prod-ucs-content-store-us-east/content/pii:S1381116913001829/sc2/HIGHRES/image/jpeg/210945f5565ca6f593f18a9ecda6737c/sc2_lrg.jpg https://s3-eu-west-1.amazonaws.com/prod-ucs-content-store-eu-west/content/pii:S1381116913001829/sc2/HIGHRES/image/jpeg/210945f5565ca6f593f18a9ecda6737c/sc2_lrg.jpg sc2 sc2_lrg.jpg jpg 263362 2451 2167 IMAGE-HIGH-RES 1-s2.0-S1381116913001829-fx12_lrg.jpg https://s3.amazonaws.com/prod-ucs-content-store-us-east/content/pii:S1381116913001829/fx12/HIGHRES/image/jpeg/56f0b28641c30c07bafe334829a27084/fx12_lrg.jpg https://s3-eu-west-1.amazonaws.com/prod-ucs-content-store-eu-west/content/pii:S1381116913001829/fx12/HIGHRES/image/jpeg/56f0b28641c30c07bafe334829a27084/fx12_lrg.jpg fx12 fx12_lrg.jpg jpg 35604 164 2213 IMAGE-HIGH-RES 1-s2.0-S1381116913001829-fx11_lrg.jpg https://s3.amazonaws.com/prod-ucs-content-store-us-east/content/pii:S1381116913001829/fx11/HIGHRES/image/jpeg/cd19024b007b846c74d5e755a8760f1b/fx11_lrg.jpg https://s3-eu-west-1.amazonaws.com/prod-ucs-content-store-eu-west/content/pii:S1381116913001829/fx11/HIGHRES/image/jpeg/cd19024b007b846c74d5e755a8760f1b/fx11_lrg.jpg fx11 fx11_lrg.jpg jpg 38027 215 2213 IMAGE-HIGH-RES 1-s2.0-S1381116913001829-fx10_lrg.jpg https://s3.amazonaws.com/prod-ucs-content-store-us-east/content/pii:S1381116913001829/fx10/HIGHRES/image/jpeg/f8c45997aafb79dc1a3099d261e79711/fx10_lrg.jpg https://s3-eu-west-1.amazonaws.com/prod-ucs-content-store-eu-west/content/pii:S1381116913001829/fx10/HIGHRES/image/jpeg/f8c45997aafb79dc1a3099d261e79711/fx10_lrg.jpg fx10 fx10_lrg.jpg jpg 37105 220 2213 IMAGE-HIGH-RES 1-s2.0-S1381116913001829-fx9_lrg.jpg https://s3.amazonaws.com/prod-ucs-content-store-us-east/content/pii:S1381116913001829/fx9/HIGHRES/image/jpeg/c9d37fb6206f972f1705cf1ad570987c/fx9_lrg.jpg https://s3-eu-west-1.amazonaws.com/prod-ucs-content-store-eu-west/content/pii:S1381116913001829/fx9/HIGHRES/image/jpeg/c9d37fb6206f972f1705cf1ad570987c/fx9_lrg.jpg fx9 fx9_lrg.jpg jpg 39456 244 2213 IMAGE-HIGH-RES 1-s2.0-S1381116913001829-fx8_lrg.jpg https://s3.amazonaws.com/prod-ucs-content-store-us-east/content/pii:S1381116913001829/fx8/HIGHRES/image/jpeg/39740053d5858f36fdfa64462d5b770b/fx8_lrg.jpg https://s3-eu-west-1.amazonaws.com/prod-ucs-content-store-eu-west/content/pii:S1381116913001829/fx8/HIGHRES/image/jpeg/39740053d5858f36fdfa64462d5b770b/fx8_lrg.jpg fx8 fx8_lrg.jpg jpg 41767 287 2213 IMAGE-HIGH-RES 1-s2.0-S1381116913001829-fx7_lrg.jpg https://s3.amazonaws.com/prod-ucs-content-store-us-east/content/pii:S1381116913001829/fx7/HIGHRES/image/jpeg/19dbd15610d59ef224f63679291c8b7a/fx7_lrg.jpg https://s3-eu-west-1.amazonaws.com/prod-ucs-content-store-eu-west/content/pii:S1381116913001829/fx7/HIGHRES/image/jpeg/19dbd15610d59ef224f63679291c8b7a/fx7_lrg.jpg fx7 fx7_lrg.jpg jpg 37410 886 770 IMAGE-HIGH-RES 1-s2.0-S1381116913001829-fx6_lrg.jpg https://s3.amazonaws.com/prod-ucs-content-store-us-east/content/pii:S1381116913001829/fx6/HIGHRES/image/jpeg/656301d8995b08e83c0b52e42021b0fa/fx6_lrg.jpg https://s3-eu-west-1.amazonaws.com/prod-ucs-content-store-eu-west/content/pii:S1381116913001829/fx6/HIGHRES/image/jpeg/656301d8995b08e83c0b52e42021b0fa/fx6_lrg.jpg fx6 fx6_lrg.jpg jpg 76923 886 1501 IMAGE-HIGH-RES 1-s2.0-S1381116913001829-fx5_lrg.jpg https://s3.amazonaws.com/prod-ucs-content-store-us-east/content/pii:S1381116913001829/fx5/HIGHRES/image/jpeg/91dd4061e8d46648b8f6934d372ae285/fx5_lrg.jpg https://s3-eu-west-1.amazonaws.com/prod-ucs-content-store-eu-west/content/pii:S1381116913001829/fx5/HIGHRES/image/jpeg/91dd4061e8d46648b8f6934d372ae285/fx5_lrg.jpg fx5 fx5_lrg.jpg jpg 63936 886 1562 IMAGE-HIGH-RES 1-s2.0-S1381116913001829-fx4_lrg.jpg https://s3.amazonaws.com/prod-ucs-content-store-us-east/content/pii:S1381116913001829/fx4/HIGHRES/image/jpeg/565a50f255f548eed3d42241943beaca/fx4_lrg.jpg https://s3-eu-west-1.amazonaws.com/prod-ucs-content-store-eu-west/content/pii:S1381116913001829/fx4/HIGHRES/image/jpeg/565a50f255f548eed3d42241943beaca/fx4_lrg.jpg fx4 fx4_lrg.jpg jpg 35321 886 1016 IMAGE-HIGH-RES 1-s2.0-S1381116913001829-fx3_lrg.jpg https://s3.amazonaws.com/prod-ucs-content-store-us-east/content/pii:S1381116913001829/fx3/HIGHRES/image/jpeg/868f7ceba52549dc1eb30993d36fc4a9/fx3_lrg.jpg https://s3-eu-west-1.amazonaws.com/prod-ucs-content-store-eu-west/content/pii:S1381116913001829/fx3/HIGHRES/image/jpeg/868f7ceba52549dc1eb30993d36fc4a9/fx3_lrg.jpg fx3 fx3_lrg.jpg jpg 34752 886 791 IMAGE-HIGH-RES 1-s2.0-S1381116913001829-fx2_lrg.jpg https://s3.amazonaws.com/prod-ucs-content-store-us-east/content/pii:S1381116913001829/fx2/HIGHRES/image/jpeg/6e4a171d567695114d21e6f14f1c8046/fx2_lrg.jpg https://s3-eu-west-1.amazonaws.com/prod-ucs-content-store-eu-west/content/pii:S1381116913001829/fx2/HIGHRES/image/jpeg/6e4a171d567695114d21e6f14f1c8046/fx2_lrg.jpg fx2 fx2_lrg.jpg jpg 32790 886 1062 IMAGE-HIGH-RES 1-s2.0-S1381116913001829-fx1_lrg.jpg https://s3.amazonaws.com/prod-ucs-content-store-us-east/content/pii:S1381116913001829/fx1/HIGHRES/image/jpeg/243c5d8f4165095b45479da45b901ffc/fx1_lrg.jpg https://s3-eu-west-1.amazonaws.com/prod-ucs-content-store-eu-west/content/pii:S1381116913001829/fx1/HIGHRES/image/jpeg/243c5d8f4165095b45479da45b901ffc/fx1_lrg.jpg fx1 true fx1_lrg.jpg jpg 77410 655 2213 IMAGE-HIGH-RES 1-s2.0-S1381116913001829-gr7_lrg.jpg https://s3.amazonaws.com/prod-ucs-content-store-us-east/content/pii:S1381116913001829/gr7/HIGHRES/image/jpeg/ea96b4e7495a162407542aa210caf5a9/gr7_lrg.jpg https://s3-eu-west-1.amazonaws.com/prod-ucs-content-store-eu-west/content/pii:S1381116913001829/gr7/HIGHRES/image/jpeg/ea96b4e7495a162407542aa210caf5a9/gr7_lrg.jpg gr7 gr7_lrg.jpg jpg 91216 1358 1667 IMAGE-HIGH-RES 1-s2.0-S1381116913001829-gr4_lrg.jpg https://s3.amazonaws.com/prod-ucs-content-store-us-east/content/pii:S1381116913001829/gr4/HIGHRES/image/jpeg/a380a5cded6dd5897dcc0efd1c09e9d9/gr4_lrg.jpg https://s3-eu-west-1.amazonaws.com/prod-ucs-content-store-eu-west/content/pii:S1381116913001829/gr4/HIGHRES/image/jpeg/a380a5cded6dd5897dcc0efd1c09e9d9/gr4_lrg.jpg gr4 gr4_lrg.jpg jpg 256662 4108 1594 IMAGE-HIGH-RES 1-s2.0-S1381116913001829-sc1_lrg.jpg https://s3.amazonaws.com/prod-ucs-content-store-us-east/content/pii:S1381116913001829/sc1/HIGHRES/image/jpeg/80168f180f39771c2a9fb7f22c819201/sc1_lrg.jpg https://s3-eu-west-1.amazonaws.com/prod-ucs-content-store-eu-west/content/pii:S1381116913001829/sc1/HIGHRES/image/jpeg/80168f180f39771c2a9fb7f22c819201/sc1_lrg.jpg sc1 sc1_lrg.jpg jpg 32116 319 1078 IMAGE-HIGH-RES 1-s2.0-S1381116913001829-gr8.jpg https://s3.amazonaws.com/prod-ucs-content-store-us-east/content/pii:S1381116913001829/gr8/DOWNSAMPLED/image/jpeg/f0a4bd9337537161f6bfced9f4035746/gr8.jpg https://s3-eu-west-1.amazonaws.com/prod-ucs-content-store-eu-west/content/pii:S1381116913001829/gr8/DOWNSAMPLED/image/jpeg/f0a4bd9337537161f6bfced9f4035746/gr8.jpg gr8 gr8.jpg jpg 21106 260 381 IMAGE-DOWNSAMPLED 1-s2.0-S1381116913001829-gr6.jpg https://s3.amazonaws.com/prod-ucs-content-store-us-east/content/pii:S1381116913001829/gr6/DOWNSAMPLED/image/jpeg/7c4fc15b2a7d71d3c699ca827e9b9ede/gr6.jpg https://s3-eu-west-1.amazonaws.com/prod-ucs-content-store-eu-west/content/pii:S1381116913001829/gr6/DOWNSAMPLED/image/jpeg/7c4fc15b2a7d71d3c699ca827e9b9ede/gr6.jpg gr6 gr6.jpg jpg 30752 326 339 IMAGE-DOWNSAMPLED 1-s2.0-S1381116913001829-gr5.jpg https://s3.amazonaws.com/prod-ucs-content-store-us-east/content/pii:S1381116913001829/gr5/DOWNSAMPLED/image/jpeg/c6aa5c959fbabd3f5b63d520351880b7/gr5.jpg https://s3-eu-west-1.amazonaws.com/prod-ucs-content-store-eu-west/content/pii:S1381116913001829/gr5/DOWNSAMPLED/image/jpeg/c6aa5c959fbabd3f5b63d520351880b7/gr5.jpg gr5 gr5.jpg jpg 56670 450 339 IMAGE-DOWNSAMPLED 1-s2.0-S1381116913001829-gr3.jpg https://s3.amazonaws.com/prod-ucs-content-store-us-east/content/pii:S1381116913001829/gr3/DOWNSAMPLED/image/jpeg/c5c1d018cd15b1108fd2cff2daa6cf90/gr3.jpg https://s3-eu-west-1.amazonaws.com/prod-ucs-content-store-eu-west/content/pii:S1381116913001829/gr3/DOWNSAMPLED/image/jpeg/c5c1d018cd15b1108fd2cff2daa6cf90/gr3.jpg gr3 gr3.jpg jpg 63802 518 749 IMAGE-DOWNSAMPLED 1-s2.0-S1381116913001829-gr2.jpg https://s3.amazonaws.com/prod-ucs-content-store-us-east/content/pii:S1381116913001829/gr2/DOWNSAMPLED/image/jpeg/7637ee4e5315c5f5afa49d234b727b0a/gr2.jpg https://s3-eu-west-1.amazonaws.com/prod-ucs-content-store-eu-west/content/pii:S1381116913001829/gr2/DOWNSAMPLED/image/jpeg/7637ee4e5315c5f5afa49d234b727b0a/gr2.jpg gr2 gr2.jpg jpg 45415 708 376 IMAGE-DOWNSAMPLED 1-s2.0-S1381116913001829-gr1.jpg https://s3.amazonaws.com/prod-ucs-content-store-us-east/content/pii:S1381116913001829/gr1/DOWNSAMPLED/image/jpeg/b78dad6b2635fe1d2c214ced40246126/gr1.jpg https://s3-eu-west-1.amazonaws.com/prod-ucs-content-store-eu-west/content/pii:S1381116913001829/gr1/DOWNSAMPLED/image/jpeg/b78dad6b2635fe1d2c214ced40246126/gr1.jpg gr1 gr1.jpg jpg 26938 369 376 IMAGE-DOWNSAMPLED 1-s2.0-S1381116913001829-sc2.jpg https://s3.amazonaws.com/prod-ucs-content-store-us-east/content/pii:S1381116913001829/sc2/DOWNSAMPLED/image/jpeg/26db9fc81c7684f5c361d38c619275cf/sc2.jpg https://s3-eu-west-1.amazonaws.com/prod-ucs-content-store-eu-west/content/pii:S1381116913001829/sc2/DOWNSAMPLED/image/jpeg/26db9fc81c7684f5c361d38c619275cf/sc2.jpg sc2 sc2.jpg jpg 45844 553 489 IMAGE-DOWNSAMPLED 1-s2.0-S1381116913001829-fx12.jpg https://s3.amazonaws.com/prod-ucs-content-store-us-east/content/pii:S1381116913001829/fx12/DOWNSAMPLED/image/jpeg/59e1b423659719874550ea5addd204ae/fx12.jpg https://s3-eu-west-1.amazonaws.com/prod-ucs-content-store-eu-west/content/pii:S1381116913001829/fx12/DOWNSAMPLED/image/jpeg/59e1b423659719874550ea5addd204ae/fx12.jpg fx12 fx12.jpg jpg 5068 37 500 IMAGE-DOWNSAMPLED 1-s2.0-S1381116913001829-fx11.jpg https://s3.amazonaws.com/prod-ucs-content-store-us-east/content/pii:S1381116913001829/fx11/DOWNSAMPLED/image/jpeg/0693b21ee399bbceb5140c19c642588e/fx11.jpg https://s3-eu-west-1.amazonaws.com/prod-ucs-content-store-eu-west/content/pii:S1381116913001829/fx11/DOWNSAMPLED/image/jpeg/0693b21ee399bbceb5140c19c642588e/fx11.jpg fx11 fx11.jpg jpg 5295 49 500 IMAGE-DOWNSAMPLED 1-s2.0-S1381116913001829-fx10.jpg https://s3.amazonaws.com/prod-ucs-content-store-us-east/content/pii:S1381116913001829/fx10/DOWNSAMPLED/image/jpeg/954d43f6684deafa9a70c21eccbc4b20/fx10.jpg https://s3-eu-west-1.amazonaws.com/prod-ucs-content-store-eu-west/content/pii:S1381116913001829/fx10/DOWNSAMPLED/image/jpeg/954d43f6684deafa9a70c21eccbc4b20/fx10.jpg fx10 fx10.jpg jpg 5291 50 500 IMAGE-DOWNSAMPLED 1-s2.0-S1381116913001829-fx9.jpg https://s3.amazonaws.com/prod-ucs-content-store-us-east/content/pii:S1381116913001829/fx9/DOWNSAMPLED/image/jpeg/abb94892605f98bf8ae4431583835054/fx9.jpg https://s3-eu-west-1.amazonaws.com/prod-ucs-content-store-eu-west/content/pii:S1381116913001829/fx9/DOWNSAMPLED/image/jpeg/abb94892605f98bf8ae4431583835054/fx9.jpg fx9 fx9.jpg jpg 5381 55 500 IMAGE-DOWNSAMPLED 1-s2.0-S1381116913001829-fx8.jpg https://s3.amazonaws.com/prod-ucs-content-store-us-east/content/pii:S1381116913001829/fx8/DOWNSAMPLED/image/jpeg/1bf93dda1558fac1c7aba3714341aed5/fx8.jpg https://s3-eu-west-1.amazonaws.com/prod-ucs-content-store-eu-west/content/pii:S1381116913001829/fx8/DOWNSAMPLED/image/jpeg/1bf93dda1558fac1c7aba3714341aed5/fx8.jpg fx8 fx8.jpg jpg 5707 65 500 IMAGE-DOWNSAMPLED 1-s2.0-S1381116913001829-fx7.jpg https://s3.amazonaws.com/prod-ucs-content-store-us-east/content/pii:S1381116913001829/fx7/DOWNSAMPLED/image/jpeg/23dc7efe44a18dd26a493f868a5633af/fx7.jpg https://s3-eu-west-1.amazonaws.com/prod-ucs-content-store-eu-west/content/pii:S1381116913001829/fx7/DOWNSAMPLED/image/jpeg/23dc7efe44a18dd26a493f868a5633af/fx7.jpg fx7 fx7.jpg jpg 4943 200 174 IMAGE-DOWNSAMPLED 1-s2.0-S1381116913001829-fx6.jpg https://s3.amazonaws.com/prod-ucs-content-store-us-east/content/pii:S1381116913001829/fx6/DOWNSAMPLED/image/jpeg/e5167dfb79c7bb16761c059e7095bf69/fx6.jpg https://s3-eu-west-1.amazonaws.com/prod-ucs-content-store-eu-west/content/pii:S1381116913001829/fx6/DOWNSAMPLED/image/jpeg/e5167dfb79c7bb16761c059e7095bf69/fx6.jpg fx6 fx6.jpg jpg 9798 200 339 IMAGE-DOWNSAMPLED 1-s2.0-S1381116913001829-fx5.jpg https://s3.amazonaws.com/prod-ucs-content-store-us-east/content/pii:S1381116913001829/fx5/DOWNSAMPLED/image/jpeg/d2edc2eb88d3fa2d3d83b3fd25fb94aa/fx5.jpg https://s3-eu-west-1.amazonaws.com/prod-ucs-content-store-eu-west/content/pii:S1381116913001829/fx5/DOWNSAMPLED/image/jpeg/d2edc2eb88d3fa2d3d83b3fd25fb94aa/fx5.jpg fx5 fx5.jpg jpg 8250 200 353 IMAGE-DOWNSAMPLED 1-s2.0-S1381116913001829-fx4.jpg https://s3.amazonaws.com/prod-ucs-content-store-us-east/content/pii:S1381116913001829/fx4/DOWNSAMPLED/image/jpeg/8c64612f9a99836a73bdfaae577a3f6c/fx4.jpg https://s3-eu-west-1.amazonaws.com/prod-ucs-content-store-eu-west/content/pii:S1381116913001829/fx4/DOWNSAMPLED/image/jpeg/8c64612f9a99836a73bdfaae577a3f6c/fx4.jpg fx4 fx4.jpg jpg 4463 200 229 IMAGE-DOWNSAMPLED 1-s2.0-S1381116913001829-fx3.jpg https://s3.amazonaws.com/prod-ucs-content-store-us-east/content/pii:S1381116913001829/fx3/DOWNSAMPLED/image/jpeg/ff30da1c92005998747a7c59ff0f1065/fx3.jpg https://s3-eu-west-1.amazonaws.com/prod-ucs-content-store-eu-west/content/pii:S1381116913001829/fx3/DOWNSAMPLED/image/jpeg/ff30da1c92005998747a7c59ff0f1065/fx3.jpg fx3 fx3.jpg jpg 4667 199 178 IMAGE-DOWNSAMPLED 1-s2.0-S1381116913001829-fx2.jpg https://s3.amazonaws.com/prod-ucs-content-store-us-east/content/pii:S1381116913001829/fx2/DOWNSAMPLED/image/jpeg/c5acbdf7b6dbee886625868455148910/fx2.jpg https://s3-eu-west-1.amazonaws.com/prod-ucs-content-store-eu-west/content/pii:S1381116913001829/fx2/DOWNSAMPLED/image/jpeg/c5acbdf7b6dbee886625868455148910/fx2.jpg fx2 fx2.jpg jpg 4126 200 240 IMAGE-DOWNSAMPLED 1-s2.0-S1381116913001829-fx1.jpg https://s3.amazonaws.com/prod-ucs-content-store-us-east/content/pii:S1381116913001829/fx1/DOWNSAMPLED/image/jpeg/a28ffe617f1508e93369353963f7d503/fx1.jpg https://s3-eu-west-1.amazonaws.com/prod-ucs-content-store-eu-west/content/pii:S1381116913001829/fx1/DOWNSAMPLED/image/jpeg/a28ffe617f1508e93369353963f7d503/fx1.jpg fx1 true fx1.jpg jpg 10717 148 500 IMAGE-DOWNSAMPLED 1-s2.0-S1381116913001829-gr7.jpg https://s3.amazonaws.com/prod-ucs-content-store-us-east/content/pii:S1381116913001829/gr7/DOWNSAMPLED/image/jpeg/b8ab35b8a871a2a9cb4fab6840524a80/gr7.jpg https://s3-eu-west-1.amazonaws.com/prod-ucs-content-store-eu-west/content/pii:S1381116913001829/gr7/DOWNSAMPLED/image/jpeg/b8ab35b8a871a2a9cb4fab6840524a80/gr7.jpg gr7 gr7.jpg jpg 10445 306 376 IMAGE-DOWNSAMPLED 1-s2.0-S1381116913001829-gr4.jpg https://s3.amazonaws.com/prod-ucs-content-store-us-east/content/pii:S1381116913001829/gr4/DOWNSAMPLED/image/jpeg/50f706a92e9122dc213ac45613e8df66/gr4.jpg https://s3-eu-west-1.amazonaws.com/prod-ucs-content-store-eu-west/content/pii:S1381116913001829/gr4/DOWNSAMPLED/image/jpeg/50f706a92e9122dc213ac45613e8df66/gr4.jpg gr4 gr4.jpg jpg 28616 928 360 IMAGE-DOWNSAMPLED 1-s2.0-S1381116913001829-sc1.jpg https://s3.amazonaws.com/prod-ucs-content-store-us-east/content/pii:S1381116913001829/sc1/DOWNSAMPLED/image/jpeg/3af997603a6e2f5774bc2dbe18c37b1d/sc1.jpg https://s3-eu-west-1.amazonaws.com/prod-ucs-content-store-eu-west/content/pii:S1381116913001829/sc1/DOWNSAMPLED/image/jpeg/3af997603a6e2f5774bc2dbe18c37b1d/sc1.jpg sc1 sc1.jpg jpg 4400 72 243 IMAGE-DOWNSAMPLED 1-s2.0-S1381116913001829-gr8.sml https://s3.amazonaws.com/prod-ucs-content-store-us-east/content/pii:S1381116913001829/gr8/THUMBNAIL/image/gif/3e9d063af677138016826c38986bf264/gr8.sml https://s3-eu-west-1.amazonaws.com/prod-ucs-content-store-eu-west/content/pii:S1381116913001829/gr8/THUMBNAIL/image/gif/3e9d063af677138016826c38986bf264/gr8.sml gr8 gr8.sml sml 4170 150 219 IMAGE-THUMBNAIL 1-s2.0-S1381116913001829-gr6.sml https://s3.amazonaws.com/prod-ucs-content-store-us-east/content/pii:S1381116913001829/gr6/THUMBNAIL/image/gif/84efd547b770f8fa505b7d6885e349ad/gr6.sml https://s3-eu-west-1.amazonaws.com/prod-ucs-content-store-eu-west/content/pii:S1381116913001829/gr6/THUMBNAIL/image/gif/84efd547b770f8fa505b7d6885e349ad/gr6.sml gr6 gr6.sml sml 7827 163 170 IMAGE-THUMBNAIL 1-s2.0-S1381116913001829-gr5.sml https://s3.amazonaws.com/prod-ucs-content-store-us-east/content/pii:S1381116913001829/gr5/THUMBNAIL/image/gif/edfc71bb6b2d7423a4e510ec439ef0eb/gr5.sml https://s3-eu-west-1.amazonaws.com/prod-ucs-content-store-eu-west/content/pii:S1381116913001829/gr5/THUMBNAIL/image/gif/edfc71bb6b2d7423a4e510ec439ef0eb/gr5.sml gr5 gr5.sml sml 7463 163 123 IMAGE-THUMBNAIL 1-s2.0-S1381116913001829-gr3.sml https://s3.amazonaws.com/prod-ucs-content-store-us-east/content/pii:S1381116913001829/gr3/THUMBNAIL/image/gif/853d6f9fa74a3e79e74ad7cfd900d75b/gr3.sml https://s3-eu-west-1.amazonaws.com/prod-ucs-content-store-eu-west/content/pii:S1381116913001829/gr3/THUMBNAIL/image/gif/853d6f9fa74a3e79e74ad7cfd900d75b/gr3.sml gr3 gr3.sml sml 4177 151 219 IMAGE-THUMBNAIL 1-s2.0-S1381116913001829-gr2.sml https://s3.amazonaws.com/prod-ucs-content-store-us-east/content/pii:S1381116913001829/gr2/THUMBNAIL/image/gif/b453797683e65a4066b0a902b00b7f62/gr2.sml https://s3-eu-west-1.amazonaws.com/prod-ucs-content-store-eu-west/content/pii:S1381116913001829/gr2/THUMBNAIL/image/gif/b453797683e65a4066b0a902b00b7f62/gr2.sml gr2 gr2.sml sml 1904 164 87 IMAGE-THUMBNAIL 1-s2.0-S1381116913001829-gr1.sml https://s3.amazonaws.com/prod-ucs-content-store-us-east/content/pii:S1381116913001829/gr1/THUMBNAIL/image/gif/c363fd119ba0fc4c4e72f479b435211e/gr1.sml https://s3-eu-west-1.amazonaws.com/prod-ucs-content-store-eu-west/content/pii:S1381116913001829/gr1/THUMBNAIL/image/gif/c363fd119ba0fc4c4e72f479b435211e/gr1.sml gr1 gr1.sml sml 4131 164 167 IMAGE-THUMBNAIL 1-s2.0-S1381116913001829-sc2.sml https://s3.amazonaws.com/prod-ucs-content-store-us-east/content/pii:S1381116913001829/sc2/THUMBNAIL/image/gif/ddf581ff022ec4c92e0fb59900606a9a/sc2.sml https://s3-eu-west-1.amazonaws.com/prod-ucs-content-store-eu-west/content/pii:S1381116913001829/sc2/THUMBNAIL/image/gif/ddf581ff022ec4c92e0fb59900606a9a/sc2.sml sc2 sc2.sml sml 2530 164 145 IMAGE-THUMBNAIL 1-s2.0-S1381116913001829-fx12.sml https://s3.amazonaws.com/prod-ucs-content-store-us-east/content/pii:S1381116913001829/fx12/THUMBNAIL/image/gif/ab1faeaf0342e709ab5390351640d570/fx12.sml https://s3-eu-west-1.amazonaws.com/prod-ucs-content-store-eu-west/content/pii:S1381116913001829/fx12/THUMBNAIL/image/gif/ab1faeaf0342e709ab5390351640d570/fx12.sml fx12 fx12.sml sml 1425 16 219 IMAGE-THUMBNAIL 1-s2.0-S1381116913001829-fx11.sml https://s3.amazonaws.com/prod-ucs-content-store-us-east/content/pii:S1381116913001829/fx11/THUMBNAIL/image/gif/ab1168f1f04a321f72c7ce991c091152/fx11.sml https://s3-eu-west-1.amazonaws.com/prod-ucs-content-store-eu-west/content/pii:S1381116913001829/fx11/THUMBNAIL/image/gif/ab1168f1f04a321f72c7ce991c091152/fx11.sml fx11 fx11.sml sml 1464 21 219 IMAGE-THUMBNAIL 1-s2.0-S1381116913001829-fx10.sml https://s3.amazonaws.com/prod-ucs-content-store-us-east/content/pii:S1381116913001829/fx10/THUMBNAIL/image/gif/a74d032fffa83fff876d4ca9862e4992/fx10.sml https://s3-eu-west-1.amazonaws.com/prod-ucs-content-store-eu-west/content/pii:S1381116913001829/fx10/THUMBNAIL/image/gif/a74d032fffa83fff876d4ca9862e4992/fx10.sml fx10 fx10.sml sml 1440 22 219 IMAGE-THUMBNAIL 1-s2.0-S1381116913001829-fx9.sml https://s3.amazonaws.com/prod-ucs-content-store-us-east/content/pii:S1381116913001829/fx9/THUMBNAIL/image/gif/2048b8e373a6c0914b04fe745571bb3d/fx9.sml https://s3-eu-west-1.amazonaws.com/prod-ucs-content-store-eu-west/content/pii:S1381116913001829/fx9/THUMBNAIL/image/gif/2048b8e373a6c0914b04fe745571bb3d/fx9.sml fx9 fx9.sml sml 1529 24 219 IMAGE-THUMBNAIL 1-s2.0-S1381116913001829-fx8.sml https://s3.amazonaws.com/prod-ucs-content-store-us-east/content/pii:S1381116913001829/fx8/THUMBNAIL/image/gif/9efcfbe17e008436c81328a84bfa9a3d/fx8.sml https://s3-eu-west-1.amazonaws.com/prod-ucs-content-store-eu-west/content/pii:S1381116913001829/fx8/THUMBNAIL/image/gif/9efcfbe17e008436c81328a84bfa9a3d/fx8.sml fx8 fx8.sml sml 1555 28 219 IMAGE-THUMBNAIL 1-s2.0-S1381116913001829-fx7.sml https://s3.amazonaws.com/prod-ucs-content-store-us-east/content/pii:S1381116913001829/fx7/THUMBNAIL/image/gif/75d39fc6e211e2302e47ebe8781d2a11/fx7.sml https://s3-eu-west-1.amazonaws.com/prod-ucs-content-store-eu-west/content/pii:S1381116913001829/fx7/THUMBNAIL/image/gif/75d39fc6e211e2302e47ebe8781d2a11/fx7.sml fx7 fx7.sml sml 2900 163 142 IMAGE-THUMBNAIL 1-s2.0-S1381116913001829-fx6.sml https://s3.amazonaws.com/prod-ucs-content-store-us-east/content/pii:S1381116913001829/fx6/THUMBNAIL/image/gif/0a3d25705316ba6bed974424a1afa923/fx6.sml https://s3-eu-west-1.amazonaws.com/prod-ucs-content-store-eu-west/content/pii:S1381116913001829/fx6/THUMBNAIL/image/gif/0a3d25705316ba6bed974424a1afa923/fx6.sml fx6 fx6.sml sml 4084 129 219 IMAGE-THUMBNAIL 1-s2.0-S1381116913001829-fx5.sml https://s3.amazonaws.com/prod-ucs-content-store-us-east/content/pii:S1381116913001829/fx5/THUMBNAIL/image/gif/a59a8c416e7343b0db8ea98c49aff6ab/fx5.sml https://s3-eu-west-1.amazonaws.com/prod-ucs-content-store-eu-west/content/pii:S1381116913001829/fx5/THUMBNAIL/image/gif/a59a8c416e7343b0db8ea98c49aff6ab/fx5.sml fx5 fx5.sml sml 3047 124 219 IMAGE-THUMBNAIL 1-s2.0-S1381116913001829-fx4.sml https://s3.amazonaws.com/prod-ucs-content-store-us-east/content/pii:S1381116913001829/fx4/THUMBNAIL/image/gif/93c588066d0abbe01e87c00883fc6bd4/fx4.sml https://s3-eu-west-1.amazonaws.com/prod-ucs-content-store-eu-west/content/pii:S1381116913001829/fx4/THUMBNAIL/image/gif/93c588066d0abbe01e87c00883fc6bd4/fx4.sml fx4 fx4.sml sml 2970 164 188 IMAGE-THUMBNAIL 1-s2.0-S1381116913001829-fx3.sml https://s3.amazonaws.com/prod-ucs-content-store-us-east/content/pii:S1381116913001829/fx3/THUMBNAIL/image/gif/13e25ec403925f3930ae0d8e7f4e1dfb/fx3.sml https://s3-eu-west-1.amazonaws.com/prod-ucs-content-store-eu-west/content/pii:S1381116913001829/fx3/THUMBNAIL/image/gif/13e25ec403925f3930ae0d8e7f4e1dfb/fx3.sml fx3 fx3.sml sml 2930 164 146 IMAGE-THUMBNAIL 1-s2.0-S1381116913001829-fx2.sml https://s3.amazonaws.com/prod-ucs-content-store-us-east/content/pii:S1381116913001829/fx2/THUMBNAIL/image/gif/7e9b05fba4fa3f18991c3a240da95b0e/fx2.sml https://s3-eu-west-1.amazonaws.com/prod-ucs-content-store-eu-west/content/pii:S1381116913001829/fx2/THUMBNAIL/image/gif/7e9b05fba4fa3f18991c3a240da95b0e/fx2.sml fx2 fx2.sml sml 3035 164 196 IMAGE-THUMBNAIL 1-s2.0-S1381116913001829-fx1.sml https://s3.amazonaws.com/prod-ucs-content-store-us-east/content/pii:S1381116913001829/fx1/THUMBNAIL/image/gif/9a5f425c27ab1494b750651903d6607c/fx1.sml https://s3-eu-west-1.amazonaws.com/prod-ucs-content-store-eu-west/content/pii:S1381116913001829/fx1/THUMBNAIL/image/gif/9a5f425c27ab1494b750651903d6607c/fx1.sml fx1 true fx1.sml sml 2367 65 219 IMAGE-THUMBNAIL 1-s2.0-S1381116913001829-gr7.sml https://s3.amazonaws.com/prod-ucs-content-store-us-east/content/pii:S1381116913001829/gr7/THUMBNAIL/image/gif/dc0b14639743ea4b560fd7b50179f52a/gr7.sml https://s3-eu-west-1.amazonaws.com/prod-ucs-content-store-eu-west/content/pii:S1381116913001829/gr7/THUMBNAIL/image/gif/dc0b14639743ea4b560fd7b50179f52a/gr7.sml gr7 gr7.sml sml 2929 164 201 IMAGE-THUMBNAIL 1-s2.0-S1381116913001829-gr4.sml https://s3.amazonaws.com/prod-ucs-content-store-us-east/content/pii:S1381116913001829/gr4/THUMBNAIL/image/gif/3a42cd887a6a94f42fcf3e8181a3b1f4/gr4.sml https://s3-eu-west-1.amazonaws.com/prod-ucs-content-store-eu-west/content/pii:S1381116913001829/gr4/THUMBNAIL/image/gif/3a42cd887a6a94f42fcf3e8181a3b1f4/gr4.sml gr4 gr4.sml sml 1924 162 63 IMAGE-THUMBNAIL 1-s2.0-S1381116913001829-sc1.sml https://s3.amazonaws.com/prod-ucs-content-store-us-east/content/pii:S1381116913001829/sc1/THUMBNAIL/image/gif/40ed202a73b366dfdfba176fe3215965/sc1.sml https://s3-eu-west-1.amazonaws.com/prod-ucs-content-store-eu-west/content/pii:S1381116913001829/sc1/THUMBNAIL/image/gif/40ed202a73b366dfdfba176fe3215965/sc1.sml sc1 sc1.sml sml 2359 65 219 IMAGE-THUMBNAIL MOLCAA 8753 S1381-1169(13)00182-9 10.1016/j.molcata.2013.04.034 Elsevier B.V. Fig. 1 XRD patterns of (a) ZERS and (b) NaY zeolite. Fig. 2 FT-IR spectrum of (A) NaY zeolite; (B) RuY zeolite and (C) ZERS. Fig. 3 DR FT-IR spectrum of: (A) Salophen-NaY zeolite; (B) ZERS; (C) RuY zeolite and (D) NaY zeolite. Fig. 4 UV–vis spectrum of (A) salophen-NaY zeolite; (B) Ru(salophen)Cl and (C) ZERS. Fig. 5 SEM micrographs of (a) NaY zeolite and (b) ZERS. Fig. 6 TEM micrograph of ZERS. Fig. 7 UV–vis spectrum of recovered ZERS. Fig. 8 DR FT-IR spectrum of recovered ZERS. Scheme 1 Oxidation of alkenes with NaIO4 catalyzed by zeolite-encapsulated Ru(salophen)Cl (ZERS). Scheme 2 The preparation route for ZERS. Table 1 Si/Al ratio, specific surface area, pore volume, unit cell dimension, analytical data and unit cell formula of the samples. Sample Ru (%) Si (%) Al (%) Na (%) C (%) H (%) N (%) Si/Al ratio Unit cell formula Surface area (cm2/g) Pore volume (cm3/g) Unit cell dimensions (Å) NaY – 24.78 9.74 8.52 – – – 2.45 Na56[AlO2)57(SiO2)137] 599.5 0.302 24.81 RuY 10.78 31.44 9.85 1.5 – – – 3.085 Na10Ru16[(AlO2)56(SiO2)165] 354.29 0.275 24.81 ZERS 1.9 33.59 11.32 2.085 4.6 1.6 0.5 2.97 145.70 0.077 24.82 Table 2 The effect of solvent on the epoxidation of cyclooctene with NaIO4 catalyzed by ZERS at room temperature. a Entry Solvent Epoxide yield after 5h b 1 CH3CN/H2O 100 2 CH3COCH3/H2O 8 3 CH3OH/H2O 2 4 CH2Cl2/H2O 2 5 CH3CH2OH/H2O 1 6 CHCl3/H2O 0 7 CH3COOCH2CH3/H2O 15 a Reaction conditions: cyclooctene (0.5mmol), NaIO4 (1mmol), catalyst (600mg, 0.01mmol), solvent (5ml), H2O (2.5ml). b GC yield (in all cases, the epoxide selectivity was 100%). Table 3 The effect of catalyst loading on the epoxidation of cyclooctene with NaIO4 catalyzed by ZERS at room temperature. a Entry Catalyst amount (mg) Epoxide yield after 5h b 1 0 7 2 200 15 3 300 20 4 400 70 5 500 78 6 600 100 7 650 100 a Reaction conditions: cyclooctene (0.5mmol), NaIO4 (1mmol), catalyst, CH3CN (5ml), H2O (2.5ml). b GC yield (In all cases, the epoxide selectivity was 100%). Table 4 Epoxidation of alkenes with NaIO4 catalyzed by ZERS under magnetic stirring. a Entry Substrate Conversion (%) b Epoxide selectivity (%) Time (h) TOF (h−1) 1 100 100 8.5 5.88 2 100 100 8 6.25 3 100 100 5 10.00 4 98 75 c 10 4.65 5 98 100 9 5.45 6 100 48 d 5.5 4.36 a Reaction conditions: alkene (0.5mmol), NaIO4 (1mmol), ZERS (600mg, 0.01mmol), CH3CN/H2O (5/2.5ml). b GC yield. c The by-product is benzaldehyde. d The by-products are 22% verbenol and 30% verbenone. Table 5 Epoxidation of alkenes with NaIO4 catalyzed by ZERS under ultrasonic irradiation. a Entry Substrate Conversion (%) b Epoxide selectivity (%) Time (min) TOF (h−1) 1 100 100 45 66.67 2 100 100 30 100 3 100 72 c 35 61.71 4 95 100 70 39.49 5 92 90 d 90 27.6 a Reaction conditions: alkene (0.5mmol), NaIO4 (1mmol), ZERS (600mg, 0.01mmol), CH3CN/H2O (5/2.5ml). b GC yield. c The by-products are 28% benzaldehyde. d Verbenol and verbenone were produced as by-products. Table 6 Epoxidation of linear alkenes with NaIO4 catalyzed by ZERS under magnetic stirring. a Entry Substrate Conversion (%) b Epoxide selectivity (%) Time (h) TOF (h−1) 1 77 100 9 4.28 2 59 100 7 4.21 3 87 86 8.5 4.40 4 38 100 10.5 1.81 5 14 88 14 0.43 a Reaction conditions: alkene (0.5mmol), NaIO4 (1mmol), ZERS (600mg, 0.01mmol), CH3CN/H2O (5/2.5ml). b GC yield. Table 7 Epoxidation of linear alkenes with NaIO4 catalyzed by ZERS under ultrasonic irradiation. a Entry Substrate Conversion (%) b Epoxide selectivity (%) Time (min) TOF (h−1) 1 99 100 75 39.60 2 98 100 120 24.50 3 85 92 90 28.33 4 92 100 90 30.67 5 45 100 135 10.00 a Reaction conditions: alkene (0.5mmol), NaIO4 (1mmol), ZERS (600mg, 0.01mmol), CH3CN/H2O (5/2.5ml). b GC yield. Table 8 The results obtained in the reusability of ZERS catalyst and the ruthenium leached in the epoxidation of cyclooctene with sodium periodate with magnetic stirring and under ultrasonic irradiation. a Run MS US Time (h) Yield (%) b Ru leached (%) c Time (min) Yield (%) b Ru leached (%) c 1 5 100 0.9 30 100 1.2 2 6 95 0.5 45 98 0.8 3 6 76 0 45 81 0 4 6 32 0 45 35 0 a Reaction conditions: alkene (0.5mmol), NaIO4 (1mmol), ZERS (600mg, 0.01mmol), CH3CN/H2O (5/2.5ml). b GC yield (in all cases, the epoxide selectivity was 100%). c Determined by ICP. Table 9 Comparison of the obtained results by this catalytic system with our previously reported heterogeneous ruthenium salophen catalysts. a Entry Substrate TOF (h−1) ZERS [Ru(salophen)-PSI] [Ru(salophen)-SiIm] [Ru(salophen)-Amine-PS] 1 6.25 6.67 6.67 2.52–3.02 2 10.25 4.70 6.33 2.44–2.95 3 4.65 6.67 6.53 2.33–2.73 4 4.28 1.35 1.83 0.81–1.05 a The reaction conditions are similar and all reactions were carried out at room temperature in CH3CN/H2O and using NaIO4 as oxidant. Host (nanocavity of zeolite Y)-guest (ruthenium(III) salophen complex) nanocomposite materials: An efficient and reusable catalyst for shape-selective epoxidation of linear alkenes with sodium periodate Maryam Moosavifar a Shahram Tangestaninejad b ⁎ Majid Moghadam b ⁎ Valiollah Mirkhani b Iraj Mohammadpoor-Baltork b a Department of Chemistry, Faculty of Science, University of Maragheh, Maragheh 55181-83111, Iran Department of Chemistry, Faculty of Science, University of Maragheh Maragheh 55181-83111 Iran b Department of Chemistry, Catalysis Division, University of Isfahan, Isfahan 81746-73441, Iran Department of Chemistry, Catalysis Division, University of Isfahan Isfahan 81746-73441 Iran ⁎ Corresponding authors. Tel.: +98 311 7932705; fax: +98 311 6689732. Graphical abstract Zeolite-encapsulated ruthenium(III) salophen (ZERS) was prepared by flexible ligand method and characterized by diffuse reflectance FT-IR and UV–vis spectroscopic methods, X-ray diffraction, BET, SEM, TEM and elemental analysis. The amount of Ru-salophen in the zeolite supercages was 0.018mmol/g of encapsulated zeolite. This catalyst was used for efficient and selective epoxidation of different alkenes with NaIO4 under magnetic stirring and ultrasonic irradiation conditions. This catalyst also showed a good shape-selectivity in the epoxidation of linear alkenes. This heterogeneous catalyst was reused several times without significant loss of its catalytic activity. Keywords Ruthenium salophen Zeolite Y Sodium periodate Epoxidation Reusable catalyst 1 Introduction Transition metal complexes have been extensively used for homogeneous oxidation of organic substrates [1–3]. However, the recovery and recycling of these catalysts are difficult because of degradation of the organic ligands, and dimerization of the transition metal complexes. In comparison with the homogeneous catalysts, heterogeneous systems present many advantages such as easy separation and recovery of the catalyst from reaction media, higher stability of the catalytic species and catalyst protection against destruction [4]. There are several strategies for heterogenization of homogeneous catalysts such as polymerization of homogeneous catalysts, immobilization of homogeneous catalysts via covalent bonding either directly (grafting) or through a spacer ligand (tethering), and finally physical entrapment of metallocomplexes into nanopores and nanocages of inert supports bearing suitable pore sizes and well-defined structure such as zeolites. These supporting methods enhance the stability and reactivity of homogeneous catalysts [5–8]. Among them, the latest method has gained considerable attention in comparison with conventional heterogeneous catalysts due to the negligible leaching of metal ions [8–10]. Encapsulation is one of the most often used methods for homogeneous catalysts immobilization, and is an effective way to mimic the homogeneous catalysis. This method does not change the chemical properties of the immobilized catalyst except for the steric confinement of porous supports [11]. Encapsulation of transition metal complexes in the nanopores of molecular sieves mainly depends on the sizes of both complex and pores of the support. The matching of these two sites is very important to prevent the leaching of immobilized catalysts during the reaction. Zeolites are a class of excellent candidates for the encapsulation of homogeneous catalysts [12–17]. Upon encapsulation in nanocage of zeolites, complexes may lose some of their degrees of freedom and accept exclusive geometry which may differ from homogeneous counterparts and therefore, special characteristics such as size/shape-selectivity can be attained [1,4,18,19]. There are three major approaches for encapsulation of metallocomplexes into the nanocages of zeolite (ship-in-a-bottle): (i) flexible ligand method [4,10,20,21], (ii) template synthesis method [22–24], and (iii) zeolite synthesis method [25,26]. In the flexible ligand method, the ligand can easily diffuse through the nanocavities of the zeolite due to sufficient flexibility but upon the complexation with metal ion, becomes too large and rigid to pass through the zeolite channels and therefore entrapped in the cages of zeolite [4,20]. In the last two decades, Schiff base ligands have received more attention, mainly because of their extensive applications in the fields of synthesis and catalysis [27–34]. In order to increase the catalyst stability, their complexes (salen or salophen) have been immobilized on different supports and their catalytic activity has been investigated in organic synthesis [35–49]. In continuation of our previous works on the encapsulation of catalysts in the supercages of zeolites [9,24,25], here, we report the preparation, physico-chemical characterization and application of zeolite-encapsulated [Ru(salophen)Cl] (ZERS) in the epoxidation of alkenes with NaIO4 under magnetic stirring and ultrasonic irradiation conditions (Scheme 1 ). 2 Experimental All solvents and reagents were commercial grade and purchased from Merck, Fluka and Aldrich. Alkenes were passed through a column containing active alumina to remove the peroxidic impurities. The NaY zeolite was obtained from Sigma–Aldrich chemical company. 2.1 Instrumental All reactions under magnetic stirring were carried out at room temperature in a 25ml glass reactor. Reactions under ultrasonic irradiation were carried out in a 20ml glass reactor. Sonication was carried out by a UP 400S ultrasonic processor with 24kHz frequency equipped with a 3mm wide and 140mm long probe, which was immersed directly into the reaction mixture. The total volume of the solution was 10ml. The temperature reached to 40°C during sonication. Gas chromatography analyses (GC) were carried out on a Shimadzu GC-16A instrument using a 2m column packed with silicon DC-200 or Carbowax 20m. In these analyses, n-decane was used as internal standard. X-ray powder diffraction (XRD) patterns were recorded on an Advanced Bruker D8 diffractometer using Cu-Kα radiation and a graphite monochromatic with scan speed 16°/min. The diffuse reflectance FT-IR and FT-IR spectra were recorded in the range 400–4000cm−1 by a Jasco 6300 spectrometer using KBr pellets. Scanning electron micrographs (SEM) of catalyst and parent zeolite were recorded on a Philips XL30 microscope. Transmission electron micrograph (TEM) was recorded on a Zeiss CEM 902A microscope. Specific surface area measurements were performed on a Quantachrome NOVA 2200 apparatus with nitrogen as the adsorption gas at 77K. The solid state UV–vis spectra were recorded by a Shimadzu UV-265 instrument using optical grade BaSO4 as reference. The salophen ligand was prepared according to the literature [50]. 2.2 Synthesis and purification of zeolite-encapsulated [Ru(salophen)Cl] 2.2.1 Preparation of Ru-exchange zeolite, RuY In a typical procedure, to a solution of ruthenium(III) chloride (0.915g, 7mmol) in deionized water (200ml) was added NaY zeolite (5g) and stirred at 313K for 24h. After then, the zeolite was filtered, washed thoroughly with distilled water and dried at 373K overnight. 2.2.2 Preparation of zeolite-encapsulated Ru(III) salophen (ZERS) ZRES catalyst was synthesized by “flexible ligand method”. In a typical procedure, RuY (1g) and H2 salophen ligand (3g) were mixed and heated under vacuum in an oil bath at 413–418K for 24h. The ligand was melted and reacted with metal to form the metal complex. After cooling, the solid was purified by Soxhlet extraction with ethanol for removal of metal complex on the surface, and dried at 353K. The purified sample was treated with 0.01M NaCl for 5h to remove the uncomplexed metal ions from the zeolite lattice. Finally, the catalyst was filtered and washed with hot water. The colored powder dried at 423K for 6h (Scheme 2 ). 2.3 General procedure for oxidation reactions catalyzed by ZERS under MS or US irradiation A solution of NaIO4 (1mmol) in H2O (2.5ml) was added to a mixture of alkene (0.5mmol), ZERS (600mg, 0.01mmol) in CH3CN (5ml). The reaction mixture was stirred at room temperature or exposed to US irradiation. The progress of the reaction was monitored by GC. After completion of the reaction, the catalyst was filtered and thoroughly washed with Et2O (20ml). The filtrates were purified on a silica-gel plate or a silica-gel column. The identity of the products was confirmed by IR and 1H NMR spectral data. 3 Results and discussion 3.1 Preparation and characterization of zeolite-encapsulated ruthenium salophen (ZERS) The synthesis of zeolite-encapsulated ruthenium(III) salophen (ZERS) was carried out by flexible ligand method [9]. In this method, ligand is a flexible spice, but upon the complexation with metal ion, it becomes too rigid and large to exit from the nanocavity of zeolite. The crude material was treated with Soxhelt extraction with ethanol to remove the excess ligand and surface adsorbed complexes. The remaining uncomplexed metal ions were removed from the zeolite by re-exchanging with aqueous 0.01M NaCl solution. Upon formation of ruthenium(III) salophen cations into zeolite cages, the originally white zeolite turns to green. The color of the obtained material unchanged after the purification with Soxhlet extraction which confirmed the incorporation of ruthenium(III) salophen into NaY zeolite [10]. The ruthenium content of the catalyst was determined by XRF and ICP methods. The XRD pattern of the catalyst indicated that the ZERS has crystallinity almost identical to that of the parent NaY zeolite except with a slight change in the intensity of the peaks (Fig. 1 ). This fact proved that the framework and crystallinity of the zeolite remained unchanged upon encapsulation of ruthenium(III) salophen into the supercages of zeolite, and confirmed that the catalyst has been distributed in the zeolite. Reflections in regions of (220), (311) and (331) are related to the location of cations. Upon the encapsulation of ruthenium(III) salophen in the cages of zeolite, the order of relative peak intensities changes from (331)>(220)>(311) to (331)>(311)>(220) which confirms that by substitution of the Ru3+ ions at the location of Na+ ions, a rearrangement occurs during the complexation [51]. The FT-IR spectra of NaY zeolite, RuY zeolite and ZERS are shown in Fig. 2 . In these spectra, the bands in the range 450–1200cm−1 are attributed to the strong zeolite lattice vibration and bands in 3200–3600cm−1 are due to lattice water molecules and surface hydroxylic groups. The FT-IR bands of Ru(salophen) are weak due to its low concentration and were overlapped by the framework vibrations of the zeolite matrix. In the FT-IR spectra of ZERS, the bands at 500–1000cm−1 (out-of-plane bending vibration of aromatic ring), 1462 (CC bond stretching) are good indication for formation of Ru(salophen) in the zeolite cages. The stretching vibration of CN bond in the salophen ligand is masked by the band at 1631cm−1 (attributed to water vibration bands) [52]. Further information about the formation of metallocomplex and non-metallated material was obtained by diffuse reflectance FT-IR spectra of salophen-NaY zeolite and ZERS (Fig. 3A and B). The DR FT-IR spectrum of the non-metallated material exhibits the characteristic band of the CN (sym.) group at 1609cm−1. This band is shifted to lower frequencies by 20cm−1 in the FT-IR spectrum of ZERS due to the coordination of the imine nitrogens. The bands at 1495 and 1489cm−1 are attributed to CN (asym.) stretching vibration in the salophen-NaY zeolite and ZERS, respectively. In both compounds, the bands below 1000cm−1 are assigned to out-of-plane bending vibration of the aromatic rings. These bands are not observed in the DR FT-IR spectra of RuY zeolite and NaY zeolite (Fig. 3C and D). These observations indicated the presence of Ru(salophen) in the zeolite cavities. The UV–vis spectra of Salophen-NaY zeolite, Ru(salophen)Cl and ZERS were recorded in the range of 300–600nm. In this region, the salophen ligand showed a sharp peak and a shoulder at 338 and 390nm, respectively (Fig. 4A). In the Ru(salophen)Cl these two absorption peaks were also appeared at 338 and 390nm which was attributed to π–π* and n–π* transitions (Fig. 4B). The same peaks present in the UV–vis spectra of ZERS (Fig. 4C). This confirmed the formation of metallocomplex within the zeolite cages [4,53]. The scanning electron micrograph (SEM) of the NaY zeolite is identical to that of ZERS which confirmed that metallocomplex has been formed inside the nanocavity of zeolite not on the external surface (Fig. 5 ). The transmission electron micrograph (TEM) of ZERS is shown in Fig. 6 . The appearance of dark dots in the TEM image is an evidence for the formation of metallocomplex into supercages of zeolite. Surface area, pore volume, unit cell formula, unit cell dimension, analytical data and Si/Al ratio of NaY, RuY and ZERS are given in Table 1 . The content of Ru(salophen) in the synthesized sample, measured based on the Ru content of the ZERS by XRF and ICP methods, was obtained 0.018mmol/g of the supported catalyst. Decreasing the surface area and pore volume for RuY in comparison with the parent zeolite indicated that the small cations (Na) have been replaced with large cations (Ru). Insertion of Ru(salophen) considerably reduces the surface area and the pore volume of the zeolite which confirmed the formation of metallocomplex in the zeolite cavities and not on the external surface. Elemental analysis and XRF data proved that 3 complexes are present per 40 supercages in the unit cell (7.5% of supercages have been occupied by ruthenium complex). On the other hand, some ruthenium ions remained unreacted. These free cations are not able to catalyze the epoxidation reactions. The unit cell dimensions of ZERS are as same as the parent zeolite which shows that the zeolite structure remains unchanged during the formation of Ru(salophen) inside the cavities. 3.2 Effect of solvent on the epoxidation reactions In order to choose the reaction media, the effect of different solvents on epoxidation of cyclooctene was investigated. Among the mixture of acetonitrile, methanol, ethanol, acetone, dichloromethane, chloroform and ethyl acetate with water, the 2:1 mixture of acetonitrile/water was chosen as the reaction media due to the higher epoxidation yield. In the other solvents, the yield of reaction is very negligible. Acetonitrile can uniform the different phases and therefore, raise the mass transportation and increase the reaction yields (Table 2 ). 3.3 Effect of catalyst amount on the epoxidation of cyclooctene with NaIO4 In order to choose the optimum amount of catalyst, the epoxidation of cyclooctene (0.5mmol) with sodium periodate (1mmol) was performed in the presence of different amounts of ZERS catalyst. The best result was observed in the presence of 600mg (0.01mmol) catalyst. The results are shown in Table 3 . It is noteworthy that in the presence of RuY zeolite, only 23% of cycloctene oxide was detected under the same reaction conditions. This means that the catalytic activity of ZERS is due to the presence of Ru(salophen) in the zeolite cages and when the Ru coordinates to the salophen ligand a good catalytic activity is obtained. 3.4 Epoxidation of alkenes with NaIO4 in the presence ZERS under magnetic stirring Epoxidation of alkenes with sodium periodate in the presence of ZERS under magnetic stirring gave the corresponding epoxides in aqueous acetonitrile at room temperature (Table 4 ). In this catalytic system, cyclopentene, cyclohexene, cyclooctene, α-pinene, styrene and indene were completely oxidized. Except for styrene and α-pinene, in all cases the epoxides were obtained with 100% selectivity. Epoxidation of styrene was produced styrene oxide in 75% yield and 25% benzaldehyde was also detected. In the epoxidation of α-pinene, the yield of epoxide was 48%, and verbenol (22%) and verbenone (30%) were produced as by-products (Table 4). 3.5 Epoxidation of alkenes with NaIO4 in the presence of zeolite-encapsulated ruthenium-salophen (ZERS) under ultrasonic irradiation The most successful applications of ultrasound have been found in the field of heterogeneous chemistry involving solids and metals. This is due to the mechanical impact of ultrasound on solid surfaces. In conventional chemistry there are several problems associated with reactions involving solids or metals: small surface area of the solid/metal may limit reactivity, penetration of reactants into deeper areas is not possible, oxide layers or impurities can cover the surface, reactants/products have to diffuse onto and from the surface and reaction products can act as deposit on the surface and prevent further reactions. The mechanical effects of ultrasound offer an opportunity to overcome the following types of problem associated with conventional solid/metal reactions: breakup of the surface structure allows penetration of reactants and/or release of materials from surface, degradation of large solid particles due to shear forces induced by shock waves and microstreaming leads to reduction of particle size and increase of surface area and accelerated motion of suspended particles leads to better mass transfer [54]. Therefore, epoxidation of alkenes with NaIO4 in the presence of ZERS under ultrasonic irradiation was also investigated and the corresponding epoxides were obtained in excellent yield in aqueous acetonitrile. Under ultrasonic irradiation, the reaction times reduced and the yield of reactions enhanced that related to breaking-up the agglomerates and increasing the penetration of substrate to the zeolite cavities [25]. On the other hand, ultrasonic irradiation (US) can also be used to influence the selectivity and yield of reactions. A good example of increasing the selectivity under US irradiation was observed in the epoxidation of α-pinene in which 90% α-pinene oxide and 4% verbenol and 6% verbenone were produced (Table 5 ). In order to investigate the effect of ultrasonic irradiation, the size of catalysts were determined by particle size distribution technique before and after sonication. The results showed that the ultrasonic waves break-up the agglomerates. It seems that a part of ultrasonic irradiation effect is due to this phenomenon. On the other hand, ultrasonic irradiation increases the penetration of substrate to the zeolite cavities, and this lead to shorter reaction times as well as to higher product yields. 3.6 Shape-selectivity in the epoxidation of linear alkene in the presence of ZERS Epoxidation of linear alkenes with NaIO4 in the presence of ZERS was investigated under magnetic stirring and ultrasonic irradiation (Tables 6 and 7 ). The results showed by increasing the hydrocarbon chain, the epoxide yield decreases and the reaction times become longer. It seems that catalyst structure is sensitive to chain length and showed a good selectivity toward linear alkenes. As the chain length increases the mobility of alkene reduces, and therefore, accessibility of active site will be difficult and consequently the epoxide yield decreases. Another noteworthy effect of US irradiation was observed in the epoxidation of linear alkenes. The results showed that US waves increases the penetration of linear alkenes toward zeolite cavity and therefore, in shorter times higher epoxide yields were obtained (Table 7). 3.7 Catalyst recovery and reuse in the epoxidation of cyclooctene epoxidation The reusability of ZERS catalyst was tested in the epoxidation of cyclooctene as a model substrate. At the end of each reaction, the catalyst was filtered, washed with acetonitrile and dried at 100°C for 2h. After three consecutive runs under MS and US, the catalytic activity is preserved which showed the ruthenium salophen is still present into nanocavities of zeolite (Table 8 ). This point was proved by comparison of UV–vis and DR FT-IR spectra of fresh and recovered catalyst which suggested that the catalyst is still present within the nanocavities of zeolite (Figs. 7 and 8 ). The decreasing the catalytic activity may be due to the blocking the zeolite canals which prevents the entering the alkenes to the zeolite cavities. The amount of Ru, which was detected in the filtrates in first two runs, was low and after 3rd run no ruthenium was detected in the filtrates. The catalytic behavior of the separated liquid was also tested by addition of fresh cyclooctene and sodium periodate to the filtrates after each run. Execution of the oxidation reaction under the same reaction conditions, as with catalyst, showed that the obtained results were the same as the result of blank experiments. The results obtained by this catalytic system were compared with our previously reported systems using supported ruthenium salophen catalysts [55–57]. The results, which are summarized in Table 9 , show that the nature of the support has a significant effect on the catalytic activity. It seems that in these catalytic systems the support particles size, donating atom and the isolation of catalytic active sites have significant effect on the catalytic activity. For example, the silica supported Ru(salophen)Cl showed a higher catalytic activity due to its smaller particle size in comparison with polystyrene microspheres supported catalyst. In the case of polystyrene-bound Ru(salophen)Cl, the [Ru(salophen)-PSI] bearing imidazole as coordinating ligand is in more reactive than [Ru(salophen)-Amine-PS] in which the coordinating ligands are aromatic amines. This is due to the more electron donating nature of the imidazole in comparison with aromatic amines. In the case of zeolite encapsulated ruthenium salophen, the catalytic active sites are located in the zeolite cavities and are dispersed within the support matrix. Although, the isolation of catalytic active sites increases the catalytic activity, but the penetration of the substrate to the zeolite cavities is more difficult in comparison with the others. However, the encapsulation of metallocomplex in the zeolite cavities leads to a shape and size selectivity in the epoxidation reaction. 4 Conclusion Ru(III)-salophen has been encapsulated within the supercage of NaY zeolite by flexible ligand method. In this case, due to similarity of nanocage size with Ru(III)-salophen dimension, only one complex replace in one supercage, so, due to the isolation of active sites the efficiency of catalyst increased. The encapsulated complex was characterized by UV–vis and FT-IR, DR FT-IR spectroscopic techniques, SEM, TEM, XRD, BET and elemental analysis that confirmed the incorporation of Ru-salophen complex within the supercages of NaY zeolite. This catalyst was used as an efficient and reusable catalyst in the alkene epoxidation with NaIO4 both under magnetic stirring and ultrasonic irradiation conditions. Moreover, ultrasonic irradiation increased the catalytic activity and higher product yields were attained in shorter reaction times. The prepared catalyst was also used for efficient shape-selective epoxidation of linear alkenes. Finally, the catalyst was reused several times. Acknowledgement We are thankful to the Center of Excellence of Chemistry of University of Isfahan (CECUI) for financial support of this work. References [1] T.M. Salama I.O. Ali A.I. Hanafy W.M. Al-Meligy Mater. Chem. Phys. 113 2009 159 165 [2] C. Jin W. Fan Y. Jia B. Fan J. Ma R. Li J. Mol. Catal. A: Chem. 249 2006 23 30 [3] A.H. Ahmed A.G. Mostafa Mater. Sci. Eng. C 29 2009 877 883 [4] J. Połtowicz K. Pamin E. Tabor J. Haber A. Adamski Z. Sojka Appl. Catal. A: Gen. 299 2006 235 242 [5] S. Koner Chem. Commun. 1998 593 594 [6] M.R. Maurya A.K. Chandrakar S. Chand J. Mol. Catal. A: Chem. 263 2007 227 237 [7] D. Srinivas S. Sivasanker Catal. Surv. Asia 7 2003 121 132 [8] K.J. Balkus Jr. A.K. Khanmamedova K.M. Dixon F. Bedioui Appl. Catal. A 143 1996 159 173 [9] V. Mirkhani M. Moghadam S. Tangestaninejad B. Bahramian A. Mallekpoor-Shalamzari Appl. Catal. A: Gen. 321 2007 49 57 [10] K.O. Xavier J. Chacko K.K. Mohammed Yusuff Appl. Catal. A: Gen. 258 2004 251 259 [11] P. McMorn G.J. Hutching Chem. Soc. Rev. 33 2004 108 122 [12] S.B. Ogunwumi T. Bein Chem. Commun. 1997 901 902 [13] M.J. Sabater A. Corma A. Domenech V. Forness H. Garcia Chem. Commun. 1997 1285 1286 [14] C.R. Jacob S.P. Varkey P. Ratnasamy Appl. Catal. A: Gen. 168 1998 353 364 [15] S. Deshpande D. Srinivas P. Ratnasamy J. Catal. 188 1999 261 269 [16] S. Seelan A.K. Sinha D. Srinivas S. Sivasanker J. Mol. Catal. A: Chem. 157 2000 163 171 [17] M.R. Maurya M. Kumar S.J.J. Titinchi H.S. Abbo S. Chand Catal. Lett. 86 2003 97 105 [18] M.R. Maurya A.K. Chandrakar S. Chand J. Mol. Catal. A: Chem. 270 2007 225 235 [19] R. Ferreira M. Silva C. Freire B. de Castro J.L. Figueiredo Microporous Mesoporous Mater. 38 2000 391 401 [20] T.M. Salama A.H. Ahmed Z.M. El-Bahy Microporous Mesoporous Mater. 89 2006 251 259 [21] C.R. Jacob S.P. Varkey P. Ratnasamy Microporous Mesoporous Mater. 22 1998 465 474 [22] M.A. Zanjanchi K. Tabatabaeian M. Moosavifar J. Incl. Phenom. 40 2001 193 198 [23] A.N. Zakharov B.V. Romanovsk J. Incl. Phenom. 3 1985 389 393 [24] M. Moghadam S. Tangestaninejad V. Mirkhani I. Mohammadpoor-Baltork M. Moosavifar Appl. Catal. A: Gen. 358 2009 157 163 [25] M. Moghadam S. Tangestaninejad V. Mirkhani I. Mohammadpoor-Baltork M. Moosavifar J. Mol. Catal. A: Chem. 302 2009 68 75 [26] J. Haber K. Pamin J. Poltowicz J. Mol. Catal. A: Chem. 224 2004 153 159 [27] V. Mirkhani S. Tangestaninejad M. Moghadam I. Mohammadpoor-Baltork H. Kargar J. Mol. Catal. A: Chem. 242 2005 251 255 [28] M. Nasr-Esfahani M. Moghadam S. Tangestaninejad V. Mirkhani A.R. Momeni Bioorg. Med. Chem. 14 2006 2720 2724 [29] M. Nasr-Esfahani M. Moghadam G. Valipour J. Iran. Chem. Soc. 5 2008 244 251 [30] V. Mirkhani M. Moghadam S. Tangestaninejad B. Bahramian J. Iran. Chem. Soc. 5 2008 375 383 [31] T. Katsuki Coord. Chem. Rev. 140 1995 189 214 [32] T. Katsuki J. Mol. Catal. A: Chem. 113 1996 87 107 [33] C.T. Dalton K.M. Ryan V.M. Wall C. Bousquet D.G. Gilheany Top. Catal. 5 1998 75 91 [34] L. Canali D.C. Sherrington Chem. Soc. Rev. 28 1999 85 93 [35] J.M. Fraile J.I. Garcia J. Massam J.A. Mayoral J. Mol. Catal. A: Chem. 136 1998 47 57 [36] M.R. Maurya S.J.J. Titinchi S. Chand J. Mol. Catal. A: Chem. 180 2002 201 209 [37] A. Heckel D. Seebach Helv. Chim. Acta 85 2002 913 926 [38] D.A. Annis E.N. Jacobsen J. Am. Chem. Soc. 121 1999 4147 4154 [39] H. Zhang S. Xiang C. Li Chem. Commun. 2005 1209 1211 [40] S. Xiang Y. Zhang Q. Xin C. Li Chem. Commun. 2002 2696 2697 [41] B.M. Choudary M.L. Kantam B. Bharathi P. Sreekanth F. Figueras J. Mol. Catal. A: Chem. 159 2000 417 421 [42] C. Baleizao B. Gigante H. Garcia A. Corma J. Catal. 215 2003 199 207 [43] G.-J. Kim S.-H. Kim Catal. Lett. 57 1999 139 143 [44] B.B. De B.B. Lohray S. Sivaram P.K. Dhal Tetrahedron: Asymm 6 1995 2105 2108 [45] G. Kim D.W. Park Catal. Today 63 2000 537 547 [46] F. Minutolo D. Pini A. Petri P. Salvador Tetrahedron: Asymm 7 1996 2293 2302 [47] L. Canali D.C. Sherrington H. Deleuze React. Funct. Polym. 40 1999 155 168 [48] S.T. Regar K.D. Janda J. Am. Chem. Soc. 122 2000 6929 6934 [49] R.I. Kureshy N.H. Khan S.H.R. Abdi P. Lyer React. Funct. Polym. 34 1997 153 160 [50] T. Joseph D.P. Sawant C.S. Gopinath S.B. Halligudi J. Mol. Catal. A: Chem. 184 2002 289 299 [51] G. Li L. Chen J. Bao T. Li F. Mei Appl. Catal. A: Gen. 346 2008 134 139 [52] T.H. Bennur D. Srinivas P. Ratnasamy Microporous Mesoporous Mater. 48 2001 111 118 [53] P. Chen B. Fan M. Song C. Jin J. Ma R. Li Catal. Commun. 7 2006 969 973 [54] T. Mason D. Peters Practical Sonochemistry 2nd ed. 2002 Horwood Publishing Chichester 17 [55] M. Hatefi M. Moghadam I. Sheikhshoaei V. Mirkhani S. Tangestaninejad I. Mohammadpoor-Baltork H. Kargar Appl. Catal. A: Gen. 370 2009 66 71 [56] M. Hatefi M. Moghadam V. Mirkhani I. Sheikhshoaei Polyhedron 29 2010 2953 2958 [57] M. Moghadam V. Mirkhani S. Tangestaninejad I. Mohammadpoor-Baltork H. Kargar I. Sheikhshoaei M. Hatefi J. Iran. Chem. Soc. 8 2011 1019 1029",
      "scopus-id": "84878334392",
      "coredata": {
        "eid": "1-s2.0-S1381116913001829",
        "dc:description": "Zeolite-encapsulated ruthenium(III) salophen (ZERS) was prepared by flexible ligand method and characterized by diffuse reflectance FT-IR and UV–vis spectroscopic methods, X-ray diffraction, BET, SEM, TEM and elemental analysis. The amount of Ru-salophen in the zeolite supercages was 0.018mmol/g of encapsulated zeolite. This catalyst was used for efficient and selective epoxidation of different alkenes with NaIO4 under magnetic stirring and ultrasonic irradiation conditions. This catalyst also showed a good shape-selectivity in the epoxidation of linear alkenes. This heterogeneous catalyst was reused several times without significant loss of its catalytic activity.",
        "openArchiveArticle": "false",
        "prism:coverDate": "2013-10-31",
        "openaccessUserLicense": null,
        "prism:aggregationType": "Journal",
        "prism:url": "https://api.elsevier.com/content/article/pii/S1381116913001829",
        "dc:creator": [
          {
            "@_fa": "true",
            "$": "Moosavifar, Maryam"
          },
          {
            "@_fa": "true",
            "$": "Tangestaninejad, Shahram"
          },
          {
            "@_fa": "true",
            "$": "Moghadam, Majid"
          },
          {
            "@_fa": "true",
            "$": "Mirkhani, Valiollah"
          },
          {
            "@_fa": "true",
            "$": "Mohammadpoor-Baltork, Iraj"
          }
        ],
        "link": [
          {
            "@_fa": "true",
            "@rel": "self",
            "@href": "https://api.elsevier.com/content/article/pii/S1381116913001829"
          },
          {
            "@_fa": "true",
            "@rel": "scidir",
            "@href": "https://www.sciencedirect.com/science/article/pii/S1381116913001829"
          }
        ],
        "dc:format": "application/json",
        "openaccessType": null,
        "pii": "S1381-1169(13)00182-9",
        "prism:volume": "377",
        "prism:publisher": "Elsevier B.V.",
        "dc:title": "Host (nanocavity of zeolite Y)-guest (ruthenium(III) salophen complex) nanocomposite materials: An efficient and reusable catalyst for shape-selective epoxidation of linear alkenes with sodium periodate",
        "prism:copyright": "Copyright © 2013 Elsevier B.V. All rights reserved.",
        "openaccess": "0",
        "prism:issn": "13811169",
        "dcterms:subject": [
          {
            "@_fa": "true",
            "$": "Ruthenium salophen"
          },
          {
            "@_fa": "true",
            "$": "Zeolite Y"
          },
          {
            "@_fa": "true",
            "$": "Sodium periodate"
          },
          {
            "@_fa": "true",
            "$": "Epoxidation"
          },
          {
            "@_fa": "true",
            "$": "Reusable catalyst"
          }
        ],
        "openaccessArticle": "false",
        "prism:publicationName": "Journal of Molecular Catalysis A: Chemical",
        "openaccessSponsorType": null,
        "prism:pageRange": "92-101",
        "prism:endingPage": "101",
        "pubType": "fla",
        "prism:coverDisplayDate": "October 2013",
        "prism:doi": "10.1016/j.molcata.2013.04.034",
        "prism:startingPage": "92",
        "dc:identifier": "doi:10.1016/j.molcata.2013.04.034",
        "openaccessSponsorName": null
      },
      "objects": {
        "object": [
          {
            "@category": "high",
            "@height": "1152",
            "@width": "1686",
            "@_fa": "true",
            "$": "https://api.elsevier.com/content/object/eid/1-s2.0-S1381116913001829-gr8_lrg.jpg?httpAccept=%2A%2F%2A",
            "@multimediatype": "JPEG image file",
            "@type": "IMAGE-HIGH-RES",
            "@size": "129332",
            "@ref": "gr8",
            "@mimetype": "image/jpeg"
          },
          {
            "@category": "high",
            "@height": "865",
            "@width": "900",
            "@_fa": "true",
            "$": "https://api.elsevier.com/content/object/eid/1-s2.0-S1381116913001829-gr6_lrg.jpg?httpAccept=%2A%2F%2A",
            "@multimediatype": "JPEG image file",
            "@type": "IMAGE-HIGH-RES",
            "@size": "113466",
            "@ref": "gr6",
            "@mimetype": "image/jpeg"
          },
          {
            "@category": "high",
            "@height": "1194",
            "@width": "900",
            "@_fa": "true",
            "$": "https://api.elsevier.com/content/object/eid/1-s2.0-S1381116913001829-gr5_lrg.jpg?httpAccept=%2A%2F%2A",
            "@multimediatype": "JPEG image file",
            "@type": "IMAGE-HIGH-RES",
            "@size": "236259",
            "@ref": "gr5",
            "@mimetype": "image/jpeg"
          },
          {
            "@category": "high",
            "@height": "2295",
            "@width": "3318",
            "@_fa": "true",
            "$": "https://api.elsevier.com/content/object/eid/1-s2.0-S1381116913001829-gr3_lrg.jpg?httpAccept=%2A%2F%2A",
            "@multimediatype": "JPEG image file",
            "@type": "IMAGE-HIGH-RES",
            "@size": "470532",
            "@ref": "gr3",
            "@mimetype": "image/jpeg"
          },
          {
            "@category": "high",
            "@height": "3141",
            "@width": "1668",
            "@_fa": "true",
            "$": "https://api.elsevier.com/content/object/eid/1-s2.0-S1381116913001829-gr2_lrg.jpg?httpAccept=%2A%2F%2A",
            "@multimediatype": "JPEG image file",
            "@type": "IMAGE-HIGH-RES",
            "@size": "300276",
            "@ref": "gr2",
            "@mimetype": "image/jpeg"
          },
          {
            "@category": "high",
            "@height": "1638",
            "@width": "1667",
            "@_fa": "true",
            "$": "https://api.elsevier.com/content/object/eid/1-s2.0-S1381116913001829-gr1_lrg.jpg?httpAccept=%2A%2F%2A",
            "@multimediatype": "JPEG image file",
            "@type": "IMAGE-HIGH-RES",
            "@size": "170582",
            "@ref": "gr1",
            "@mimetype": "image/jpeg"
          },
          {
            "@category": "high",
            "@height": "2451",
            "@width": "2167",
            "@_fa": "true",
            "$": "https://api.elsevier.com/content/object/eid/1-s2.0-S1381116913001829-sc2_lrg.jpg?httpAccept=%2A%2F%2A",
            "@multimediatype": "JPEG image file",
            "@type": "IMAGE-HIGH-RES",
            "@size": "263362",
            "@ref": "sc2",
            "@mimetype": "image/jpeg"
          },
          {
            "@category": "high",
            "@height": "164",
            "@width": "2213",
            "@_fa": "true",
            "$": "https://api.elsevier.com/content/object/eid/1-s2.0-S1381116913001829-fx12_lrg.jpg?httpAccept=%2A%2F%2A",
            "@multimediatype": "JPEG image file",
            "@type": "IMAGE-HIGH-RES",
            "@size": "35604",
            "@ref": "fx12",
            "@mimetype": "image/jpeg"
          },
          {
            "@category": "high",
            "@height": "215",
            "@width": "2213",
            "@_fa": "true",
            "$": "https://api.elsevier.com/content/object/eid/1-s2.0-S1381116913001829-fx11_lrg.jpg?httpAccept=%2A%2F%2A",
            "@multimediatype": "JPEG image file",
            "@type": "IMAGE-HIGH-RES",
            "@size": "38027",
            "@ref": "fx11",
            "@mimetype": "image/jpeg"
          },
          {
            "@category": "high",
            "@height": "220",
            "@width": "2213",
            "@_fa": "true",
            "$": "https://api.elsevier.com/content/object/eid/1-s2.0-S1381116913001829-fx10_lrg.jpg?httpAccept=%2A%2F%2A",
            "@multimediatype": "JPEG image file",
            "@type": "IMAGE-HIGH-RES",
            "@size": "37105",
            "@ref": "fx10",
            "@mimetype": "image/jpeg"
          },
          {
            "@category": "high",
            "@height": "244",
            "@width": "2213",
            "@_fa": "true",
            "$": "https://api.elsevier.com/content/object/eid/1-s2.0-S1381116913001829-fx9_lrg.jpg?httpAccept=%2A%2F%2A",
            "@multimediatype": "JPEG image file",
            "@type": "IMAGE-HIGH-RES",
            "@size": "39456",
            "@ref": "fx9",
            "@mimetype": "image/jpeg"
          },
          {
            "@category": "high",
            "@height": "287",
            "@width": "2213",
            "@_fa": "true",
            "$": "https://api.elsevier.com/content/object/eid/1-s2.0-S1381116913001829-fx8_lrg.jpg?httpAccept=%2A%2F%2A",
            "@multimediatype": "JPEG image file",
            "@type": "IMAGE-HIGH-RES",
            "@size": "41767",
            "@ref": "fx8",
            "@mimetype": "image/jpeg"
          },
          {
            "@category": "high",
            "@height": "886",
            "@width": "770",
            "@_fa": "true",
            "$": "https://api.elsevier.com/content/object/eid/1-s2.0-S1381116913001829-fx7_lrg.jpg?httpAccept=%2A%2F%2A",
            "@multimediatype": "JPEG image file",
            "@type": "IMAGE-HIGH-RES",
            "@size": "37410",
            "@ref": "fx7",
            "@mimetype": "image/jpeg"
          },
          {
            "@category": "high",
            "@height": "886",
            "@width": "1501",
            "@_fa": "true",
            "$": "https://api.elsevier.com/content/object/eid/1-s2.0-S1381116913001829-fx6_lrg.jpg?httpAccept=%2A%2F%2A",
            "@multimediatype": "JPEG image file",
            "@type": "IMAGE-HIGH-RES",
            "@size": "76923",
            "@ref": "fx6",
            "@mimetype": "image/jpeg"
          },
          {
            "@category": "high",
            "@height": "886",
            "@width": "1562",
            "@_fa": "true",
            "$": "https://api.elsevier.com/content/object/eid/1-s2.0-S1381116913001829-fx5_lrg.jpg?httpAccept=%2A%2F%2A",
            "@multimediatype": "JPEG image file",
            "@type": "IMAGE-HIGH-RES",
            "@size": "63936",
            "@ref": "fx5",
            "@mimetype": "image/jpeg"
          },
          {
            "@category": "high",
            "@height": "886",
            "@width": "1016",
            "@_fa": "true",
            "$": "https://api.elsevier.com/content/object/eid/1-s2.0-S1381116913001829-fx4_lrg.jpg?httpAccept=%2A%2F%2A",
            "@multimediatype": "JPEG image file",
            "@type": "IMAGE-HIGH-RES",
            "@size": "35321",
            "@ref": "fx4",
            "@mimetype": "image/jpeg"
          },
          {
            "@category": "high",
            "@height": "886",
            "@width": "791",
            "@_fa": "true",
            "$": "https://api.elsevier.com/content/object/eid/1-s2.0-S1381116913001829-fx3_lrg.jpg?httpAccept=%2A%2F%2A",
            "@multimediatype": "JPEG image file",
            "@type": "IMAGE-HIGH-RES",
            "@size": "34752",
            "@ref": "fx3",
            "@mimetype": "image/jpeg"
          },
          {
            "@category": "high",
            "@height": "886",
            "@width": "1062",
            "@_fa": "true",
            "$": "https://api.elsevier.com/content/object/eid/1-s2.0-S1381116913001829-fx2_lrg.jpg?httpAccept=%2A%2F%2A",
            "@multimediatype": "JPEG image file",
            "@type": "IMAGE-HIGH-RES",
            "@size": "32790",
            "@ref": "fx2",
            "@mimetype": "image/jpeg"
          },
          {
            "@category": "high",
            "@height": "655",
            "@width": "2213",
            "@_fa": "true",
            "$": "https://api.elsevier.com/content/object/eid/1-s2.0-S1381116913001829-fx1_lrg.jpg?httpAccept=%2A%2F%2A",
            "@multimediatype": "JPEG image file",
            "@type": "IMAGE-HIGH-RES",
            "@size": "77410",
            "@ref": "fx1",
            "@mimetype": "image/jpeg"
          },
          {
            "@category": "high",
            "@height": "1358",
            "@width": "1667",
            "@_fa": "true",
            "$": "https://api.elsevier.com/content/object/eid/1-s2.0-S1381116913001829-gr7_lrg.jpg?httpAccept=%2A%2F%2A",
            "@multimediatype": "JPEG image file",
            "@type": "IMAGE-HIGH-RES",
            "@size": "91216",
            "@ref": "gr7",
            "@mimetype": "image/jpeg"
          },
          {
            "@category": "high",
            "@height": "4108",
            "@width": "1594",
            "@_fa": "true",
            "$": "https://api.elsevier.com/content/object/eid/1-s2.0-S1381116913001829-gr4_lrg.jpg?httpAccept=%2A%2F%2A",
            "@multimediatype": "JPEG image file",
            "@type": "IMAGE-HIGH-RES",
            "@size": "256662",
            "@ref": "gr4",
            "@mimetype": "image/jpeg"
          },
          {
            "@category": "high",
            "@height": "319",
            "@width": "1078",
            "@_fa": "true",
            "$": "https://api.elsevier.com/content/object/eid/1-s2.0-S1381116913001829-sc1_lrg.jpg?httpAccept=%2A%2F%2A",
            "@multimediatype": "JPEG image file",
            "@type": "IMAGE-HIGH-RES",
            "@size": "32116",
            "@ref": "sc1",
            "@mimetype": "image/jpeg"
          },
          {
            "@category": "standard",
            "@height": "260",
            "@width": "381",
            "@_fa": "true",
            "$": "https://api.elsevier.com/content/object/eid/1-s2.0-S1381116913001829-gr8.jpg?httpAccept=%2A%2F%2A",
            "@multimediatype": "JPEG image file",
            "@type": "IMAGE-DOWNSAMPLED",
            "@size": "21106",
            "@ref": "gr8",
            "@mimetype": "image/jpeg"
          },
          {
            "@category": "standard",
            "@height": "326",
            "@width": "339",
            "@_fa": "true",
            "$": "https://api.elsevier.com/content/object/eid/1-s2.0-S1381116913001829-gr6.jpg?httpAccept=%2A%2F%2A",
            "@multimediatype": "JPEG image file",
            "@type": "IMAGE-DOWNSAMPLED",
            "@size": "30752",
            "@ref": "gr6",
            "@mimetype": "image/jpeg"
          },
          {
            "@category": "standard",
            "@height": "450",
            "@width": "339",
            "@_fa": "true",
            "$": "https://api.elsevier.com/content/object/eid/1-s2.0-S1381116913001829-gr5.jpg?httpAccept=%2A%2F%2A",
            "@multimediatype": "JPEG image file",
            "@type": "IMAGE-DOWNSAMPLED",
            "@size": "56670",
            "@ref": "gr5",
            "@mimetype": "image/jpeg"
          },
          {
            "@category": "standard",
            "@height": "518",
            "@width": "749",
            "@_fa": "true",
            "$": "https://api.elsevier.com/content/object/eid/1-s2.0-S1381116913001829-gr3.jpg?httpAccept=%2A%2F%2A",
            "@multimediatype": "JPEG image file",
            "@type": "IMAGE-DOWNSAMPLED",
            "@size": "63802",
            "@ref": "gr3",
            "@mimetype": "image/jpeg"
          },
          {
            "@category": "standard",
            "@height": "708",
            "@width": "376",
            "@_fa": "true",
            "$": "https://api.elsevier.com/content/object/eid/1-s2.0-S1381116913001829-gr2.jpg?httpAccept=%2A%2F%2A",
            "@multimediatype": "JPEG image file",
            "@type": "IMAGE-DOWNSAMPLED",
            "@size": "45415",
            "@ref": "gr2",
            "@mimetype": "image/jpeg"
          },
          {
            "@category": "standard",
            "@height": "369",
            "@width": "376",
            "@_fa": "true",
            "$": "https://api.elsevier.com/content/object/eid/1-s2.0-S1381116913001829-gr1.jpg?httpAccept=%2A%2F%2A",
            "@multimediatype": "JPEG image file",
            "@type": "IMAGE-DOWNSAMPLED",
            "@size": "26938",
            "@ref": "gr1",
            "@mimetype": "image/jpeg"
          },
          {
            "@category": "standard",
            "@height": "553",
            "@width": "489",
            "@_fa": "true",
            "$": "https://api.elsevier.com/content/object/eid/1-s2.0-S1381116913001829-sc2.jpg?httpAccept=%2A%2F%2A",
            "@multimediatype": "JPEG image file",
            "@type": "IMAGE-DOWNSAMPLED",
            "@size": "45844",
            "@ref": "sc2",
            "@mimetype": "image/jpeg"
          },
          {
            "@category": "standard",
            "@height": "37",
            "@width": "500",
            "@_fa": "true",
            "$": "https://api.elsevier.com/content/object/eid/1-s2.0-S1381116913001829-fx12.jpg?httpAccept=%2A%2F%2A",
            "@multimediatype": "JPEG image file",
            "@type": "IMAGE-DOWNSAMPLED",
            "@size": "5068",
            "@ref": "fx12",
            "@mimetype": "image/jpeg"
          },
          {
            "@category": "standard",
            "@height": "49",
            "@width": "500",
            "@_fa": "true",
            "$": "https://api.elsevier.com/content/object/eid/1-s2.0-S1381116913001829-fx11.jpg?httpAccept=%2A%2F%2A",
            "@multimediatype": "JPEG image file",
            "@type": "IMAGE-DOWNSAMPLED",
            "@size": "5295",
            "@ref": "fx11",
            "@mimetype": "image/jpeg"
          },
          {
            "@category": "standard",
            "@height": "50",
            "@width": "500",
            "@_fa": "true",
            "$": "https://api.elsevier.com/content/object/eid/1-s2.0-S1381116913001829-fx10.jpg?httpAccept=%2A%2F%2A",
            "@multimediatype": "JPEG image file",
            "@type": "IMAGE-DOWNSAMPLED",
            "@size": "5291",
            "@ref": "fx10",
            "@mimetype": "image/jpeg"
          },
          {
            "@category": "standard",
            "@height": "55",
            "@width": "500",
            "@_fa": "true",
            "$": "https://api.elsevier.com/content/object/eid/1-s2.0-S1381116913001829-fx9.jpg?httpAccept=%2A%2F%2A",
            "@multimediatype": "JPEG image file",
            "@type": "IMAGE-DOWNSAMPLED",
            "@size": "5381",
            "@ref": "fx9",
            "@mimetype": "image/jpeg"
          },
          {
            "@category": "standard",
            "@height": "65",
            "@width": "500",
            "@_fa": "true",
            "$": "https://api.elsevier.com/content/object/eid/1-s2.0-S1381116913001829-fx8.jpg?httpAccept=%2A%2F%2A",
            "@multimediatype": "JPEG image file",
            "@type": "IMAGE-DOWNSAMPLED",
            "@size": "5707",
            "@ref": "fx8",
            "@mimetype": "image/jpeg"
          },
          {
            "@category": "standard",
            "@height": "200",
            "@width": "174",
            "@_fa": "true",
            "$": "https://api.elsevier.com/content/object/eid/1-s2.0-S1381116913001829-fx7.jpg?httpAccept=%2A%2F%2A",
            "@multimediatype": "JPEG image file",
            "@type": "IMAGE-DOWNSAMPLED",
            "@size": "4943",
            "@ref": "fx7",
            "@mimetype": "image/jpeg"
          },
          {
            "@category": "standard",
            "@height": "200",
            "@width": "339",
            "@_fa": "true",
            "$": "https://api.elsevier.com/content/object/eid/1-s2.0-S1381116913001829-fx6.jpg?httpAccept=%2A%2F%2A",
            "@multimediatype": "JPEG image file",
            "@type": "IMAGE-DOWNSAMPLED",
            "@size": "9798",
            "@ref": "fx6",
            "@mimetype": "image/jpeg"
          },
          {
            "@category": "standard",
            "@height": "200",
            "@width": "353",
            "@_fa": "true",
            "$": "https://api.elsevier.com/content/object/eid/1-s2.0-S1381116913001829-fx5.jpg?httpAccept=%2A%2F%2A",
            "@multimediatype": "JPEG image file",
            "@type": "IMAGE-DOWNSAMPLED",
            "@size": "8250",
            "@ref": "fx5",
            "@mimetype": "image/jpeg"
          },
          {
            "@category": "standard",
            "@height": "200",
            "@width": "229",
            "@_fa": "true",
            "$": "https://api.elsevier.com/content/object/eid/1-s2.0-S1381116913001829-fx4.jpg?httpAccept=%2A%2F%2A",
            "@multimediatype": "JPEG image file",
            "@type": "IMAGE-DOWNSAMPLED",
            "@size": "4463",
            "@ref": "fx4",
            "@mimetype": "image/jpeg"
          },
          {
            "@category": "standard",
            "@height": "199",
            "@width": "178",
            "@_fa": "true",
            "$": "https://api.elsevier.com/content/object/eid/1-s2.0-S1381116913001829-fx3.jpg?httpAccept=%2A%2F%2A",
            "@multimediatype": "JPEG image file",
            "@type": "IMAGE-DOWNSAMPLED",
            "@size": "4667",
            "@ref": "fx3",
            "@mimetype": "image/jpeg"
          },
          {
            "@category": "standard",
            "@height": "200",
            "@width": "240",
            "@_fa": "true",
            "$": "https://api.elsevier.com/content/object/eid/1-s2.0-S1381116913001829-fx2.jpg?httpAccept=%2A%2F%2A",
            "@multimediatype": "JPEG image file",
            "@type": "IMAGE-DOWNSAMPLED",
            "@size": "4126",
            "@ref": "fx2",
            "@mimetype": "image/jpeg"
          },
          {
            "@category": "standard",
            "@height": "148",
            "@width": "500",
            "@_fa": "true",
            "$": "https://api.elsevier.com/content/object/eid/1-s2.0-S1381116913001829-fx1.jpg?httpAccept=%2A%2F%2A",
            "@multimediatype": "JPEG image file",
            "@type": "IMAGE-DOWNSAMPLED",
            "@size": "10717",
            "@ref": "fx1",
            "@mimetype": "image/jpeg"
          },
          {
            "@category": "standard",
            "@height": "306",
            "@width": "376",
            "@_fa": "true",
            "$": "https://api.elsevier.com/content/object/eid/1-s2.0-S1381116913001829-gr7.jpg?httpAccept=%2A%2F%2A",
            "@multimediatype": "JPEG image file",
            "@type": "IMAGE-DOWNSAMPLED",
            "@size": "10445",
            "@ref": "gr7",
            "@mimetype": "image/jpeg"
          },
          {
            "@category": "standard",
            "@height": "928",
            "@width": "360",
            "@_fa": "true",
            "$": "https://api.elsevier.com/content/object/eid/1-s2.0-S1381116913001829-gr4.jpg?httpAccept=%2A%2F%2A",
            "@multimediatype": "JPEG image file",
            "@type": "IMAGE-DOWNSAMPLED",
            "@size": "28616",
            "@ref": "gr4",
            "@mimetype": "image/jpeg"
          },
          {
            "@category": "standard",
            "@height": "72",
            "@width": "243",
            "@_fa": "true",
            "$": "https://api.elsevier.com/content/object/eid/1-s2.0-S1381116913001829-sc1.jpg?httpAccept=%2A%2F%2A",
            "@multimediatype": "JPEG image file",
            "@type": "IMAGE-DOWNSAMPLED",
            "@size": "4400",
            "@ref": "sc1",
            "@mimetype": "image/jpeg"
          },
          {
            "@category": "thumbnail",
            "@height": "150",
            "@width": "219",
            "@_fa": "true",
            "$": "https://api.elsevier.com/content/object/eid/1-s2.0-S1381116913001829-gr8.sml?httpAccept=%2A%2F%2A",
            "@multimediatype": "GIF image file",
            "@type": "IMAGE-THUMBNAIL",
            "@size": "4170",
            "@ref": "gr8",
            "@mimetype": "image/gif"
          },
          {
            "@category": "thumbnail",
            "@height": "163",
            "@width": "170",
            "@_fa": "true",
            "$": "https://api.elsevier.com/content/object/eid/1-s2.0-S1381116913001829-gr6.sml?httpAccept=%2A%2F%2A",
            "@multimediatype": "GIF image file",
            "@type": "IMAGE-THUMBNAIL",
            "@size": "7827",
            "@ref": "gr6",
            "@mimetype": "image/gif"
          },
          {
            "@category": "thumbnail",
            "@height": "163",
            "@width": "123",
            "@_fa": "true",
            "$": "https://api.elsevier.com/content/object/eid/1-s2.0-S1381116913001829-gr5.sml?httpAccept=%2A%2F%2A",
            "@multimediatype": "GIF image file",
            "@type": "IMAGE-THUMBNAIL",
            "@size": "7463",
            "@ref": "gr5",
            "@mimetype": "image/gif"
          },
          {
            "@category": "thumbnail",
            "@height": "151",
            "@width": "219",
            "@_fa": "true",
            "$": "https://api.elsevier.com/content/object/eid/1-s2.0-S1381116913001829-gr3.sml?httpAccept=%2A%2F%2A",
            "@multimediatype": "GIF image file",
            "@type": "IMAGE-THUMBNAIL",
            "@size": "4177",
            "@ref": "gr3",
            "@mimetype": "image/gif"
          },
          {
            "@category": "thumbnail",
            "@height": "164",
            "@width": "87",
            "@_fa": "true",
            "$": "https://api.elsevier.com/content/object/eid/1-s2.0-S1381116913001829-gr2.sml?httpAccept=%2A%2F%2A",
            "@multimediatype": "GIF image file",
            "@type": "IMAGE-THUMBNAIL",
            "@size": "1904",
            "@ref": "gr2",
            "@mimetype": "image/gif"
          },
          {
            "@category": "thumbnail",
            "@height": "164",
            "@width": "167",
            "@_fa": "true",
            "$": "https://api.elsevier.com/content/object/eid/1-s2.0-S1381116913001829-gr1.sml?httpAccept=%2A%2F%2A",
            "@multimediatype": "GIF image file",
            "@type": "IMAGE-THUMBNAIL",
            "@size": "4131",
            "@ref": "gr1",
            "@mimetype": "image/gif"
          },
          {
            "@category": "thumbnail",
            "@height": "164",
            "@width": "145",
            "@_fa": "true",
            "$": "https://api.elsevier.com/content/object/eid/1-s2.0-S1381116913001829-sc2.sml?httpAccept=%2A%2F%2A",
            "@multimediatype": "GIF image file",
            "@type": "IMAGE-THUMBNAIL",
            "@size": "2530",
            "@ref": "sc2",
            "@mimetype": "image/gif"
          },
          {
            "@category": "thumbnail",
            "@height": "16",
            "@width": "219",
            "@_fa": "true",
            "$": "https://api.elsevier.com/content/object/eid/1-s2.0-S1381116913001829-fx12.sml?httpAccept=%2A%2F%2A",
            "@multimediatype": "GIF image file",
            "@type": "IMAGE-THUMBNAIL",
            "@size": "1425",
            "@ref": "fx12",
            "@mimetype": "image/gif"
          },
          {
            "@category": "thumbnail",
            "@height": "21",
            "@width": "219",
            "@_fa": "true",
            "$": "https://api.elsevier.com/content/object/eid/1-s2.0-S1381116913001829-fx11.sml?httpAccept=%2A%2F%2A",
            "@multimediatype": "GIF image file",
            "@type": "IMAGE-THUMBNAIL",
            "@size": "1464",
            "@ref": "fx11",
            "@mimetype": "image/gif"
          },
          {
            "@category": "thumbnail",
            "@height": "22",
            "@width": "219",
            "@_fa": "true",
            "$": "https://api.elsevier.com/content/object/eid/1-s2.0-S1381116913001829-fx10.sml?httpAccept=%2A%2F%2A",
            "@multimediatype": "GIF image file",
            "@type": "IMAGE-THUMBNAIL",
            "@size": "1440",
            "@ref": "fx10",
            "@mimetype": "image/gif"
          },
          {
            "@category": "thumbnail",
            "@height": "24",
            "@width": "219",
            "@_fa": "true",
            "$": "https://api.elsevier.com/content/object/eid/1-s2.0-S1381116913001829-fx9.sml?httpAccept=%2A%2F%2A",
            "@multimediatype": "GIF image file",
            "@type": "IMAGE-THUMBNAIL",
            "@size": "1529",
            "@ref": "fx9",
            "@mimetype": "image/gif"
          },
          {
            "@category": "thumbnail",
            "@height": "28",
            "@width": "219",
            "@_fa": "true",
            "$": "https://api.elsevier.com/content/object/eid/1-s2.0-S1381116913001829-fx8.sml?httpAccept=%2A%2F%2A",
            "@multimediatype": "GIF image file",
            "@type": "IMAGE-THUMBNAIL",
            "@size": "1555",
            "@ref": "fx8",
            "@mimetype": "image/gif"
          },
          {
            "@category": "thumbnail",
            "@height": "163",
            "@width": "142",
            "@_fa": "true",
            "$": "https://api.elsevier.com/content/object/eid/1-s2.0-S1381116913001829-fx7.sml?httpAccept=%2A%2F%2A",
            "@multimediatype": "GIF image file",
            "@type": "IMAGE-THUMBNAIL",
            "@size": "2900",
            "@ref": "fx7",
            "@mimetype": "image/gif"
          },
          {
            "@category": "thumbnail",
            "@height": "129",
            "@width": "219",
            "@_fa": "true",
            "$": "https://api.elsevier.com/content/object/eid/1-s2.0-S1381116913001829-fx6.sml?httpAccept=%2A%2F%2A",
            "@multimediatype": "GIF image file",
            "@type": "IMAGE-THUMBNAIL",
            "@size": "4084",
            "@ref": "fx6",
            "@mimetype": "image/gif"
          },
          {
            "@category": "thumbnail",
            "@height": "124",
            "@width": "219",
            "@_fa": "true",
            "$": "https://api.elsevier.com/content/object/eid/1-s2.0-S1381116913001829-fx5.sml?httpAccept=%2A%2F%2A",
            "@multimediatype": "GIF image file",
            "@type": "IMAGE-THUMBNAIL",
            "@size": "3047",
            "@ref": "fx5",
            "@mimetype": "image/gif"
          },
          {
            "@category": "thumbnail",
            "@height": "164",
            "@width": "188",
            "@_fa": "true",
            "$": "https://api.elsevier.com/content/object/eid/1-s2.0-S1381116913001829-fx4.sml?httpAccept=%2A%2F%2A",
            "@multimediatype": "GIF image file",
            "@type": "IMAGE-THUMBNAIL",
            "@size": "2970",
            "@ref": "fx4",
            "@mimetype": "image/gif"
          },
          {
            "@category": "thumbnail",
            "@height": "164",
            "@width": "146",
            "@_fa": "true",
            "$": "https://api.elsevier.com/content/object/eid/1-s2.0-S1381116913001829-fx3.sml?httpAccept=%2A%2F%2A",
            "@multimediatype": "GIF image file",
            "@type": "IMAGE-THUMBNAIL",
            "@size": "2930",
            "@ref": "fx3",
            "@mimetype": "image/gif"
          },
          {
            "@category": "thumbnail",
            "@height": "164",
            "@width": "196",
            "@_fa": "true",
            "$": "https://api.elsevier.com/content/object/eid/1-s2.0-S1381116913001829-fx2.sml?httpAccept=%2A%2F%2A",
            "@multimediatype": "GIF image file",
            "@type": "IMAGE-THUMBNAIL",
            "@size": "3035",
            "@ref": "fx2",
            "@mimetype": "image/gif"
          },
          {
            "@category": "thumbnail",
            "@height": "65",
            "@width": "219",
            "@_fa": "true",
            "$": "https://api.elsevier.com/content/object/eid/1-s2.0-S1381116913001829-fx1.sml?httpAccept=%2A%2F%2A",
            "@multimediatype": "GIF image file",
            "@type": "IMAGE-THUMBNAIL",
            "@size": "2367",
            "@ref": "fx1",
            "@mimetype": "image/gif"
          },
          {
            "@category": "thumbnail",
            "@height": "164",
            "@width": "201",
            "@_fa": "true",
            "$": "https://api.elsevier.com/content/object/eid/1-s2.0-S1381116913001829-gr7.sml?httpAccept=%2A%2F%2A",
            "@multimediatype": "GIF image file",
            "@type": "IMAGE-THUMBNAIL",
            "@size": "2929",
            "@ref": "gr7",
            "@mimetype": "image/gif"
          },
          {
            "@category": "thumbnail",
            "@height": "162",
            "@width": "63",
            "@_fa": "true",
            "$": "https://api.elsevier.com/content/object/eid/1-s2.0-S1381116913001829-gr4.sml?httpAccept=%2A%2F%2A",
            "@multimediatype": "GIF image file",
            "@type": "IMAGE-THUMBNAIL",
            "@size": "1924",
            "@ref": "gr4",
            "@mimetype": "image/gif"
          },
          {
            "@category": "thumbnail",
            "@height": "65",
            "@width": "219",
            "@_fa": "true",
            "$": "https://api.elsevier.com/content/object/eid/1-s2.0-S1381116913001829-sc1.sml?httpAccept=%2A%2F%2A",
            "@multimediatype": "GIF image file",
            "@type": "IMAGE-THUMBNAIL",
            "@size": "2359",
            "@ref": "sc1",
            "@mimetype": "image/gif"
          }
        ]
      },
      "link": {
        "@rel": "abstract",
        "@href": "https://api.elsevier.com/content/abstract/scopus_id/84878334392"
      }
    }
  }
}