{
  "metadata": {
    "title": "Effects of precursor and support variation in the performance of uranium oxide catalysts for CO oxidation and selective reduction of NO",
    "authors": "; ; ",
    "journal": "Journal of Molecular Catalysis A: Chemical",
    "date": "2006-02-15",
    "doi": "10.1016/j.molcata.2005.09.030",
    "abstract": "",
    "uri": "https://api.elsevier.com/content/article/pii/S1381116905006813",
    "pii": "S1381116905006813"
  },
  "fulltext": {
    "full-text-retrieval-response": {
      "scopus-eid": "2-s2.0-31544431986",
      "originalText": "serial JL 271358 291210 291744 291790 291809 31 Journal of Molecular Catalysis A: Chemical JOURNALMOLECULARCATALYSISACHEMICAL 2005-10-24 2005-10-24 2010-03-29T20:21:43 1-s2.0-S1381116905006813 S1381-1169(05)00681-3 S1381116905006813 10.1016/j.molcata.2005.09.030 S300 S300.1 FULL-TEXT 1-s2.0-S1381116905X02266 2015-05-15T05:56:33.000448-04:00 0 0 20060215 2006 2005-10-24T00:00:00Z articleinfo crossmark dco dateupdated tomb dateloaded datesearch indexeddate issuelist volumelist yearnav absattachment articletitlenorm authfirstinitialnorm authfirstsurnamenorm cid cids contenttype copyright dateloadedtxt docsubtype doctype doi eid ewtransactionid hubeid issfirst issn issnnorm itemstage itemtransactionid itemweight openaccess openarchive pg pgfirst pglast pii piinorm pubdatestart pubdatetxt pubyr sortorder srctitle srctitlenorm srctype subheadings volfirst volissue webpdf webpdfpagecount figure body mmlmath acknowledge affil articletitle auth authfirstini authfull authkeywords authlast footnotes primabst ref specialabst alllist content subj ssids 1381-1169 13811169 245 245 1 2 1 2 Volume 245, Issues 1–2 11 62 68 62 68 20060215 15 February 2006 2006-02-15 2006 article fla Copyright © 2005 Elsevier B.V. All rights reserved. EFFECTSPRECURSORSUPPORTVARIATIONINPERFORMANCEURANIUMOXIDECATALYSTSFORCOOXIDATIONSELECTIVEREDUCTIONNO CAMPBELL T 1 Introduction 2 Experimental 3 Results 4 Discussion 5 Conclusions Acknowledgements References CORBERAN 1984 546 V CORBERAN 1985 62 V STEENHOFDEJONG 1972 401 J STEENHOFDEJONG 1973 127 J COLLETTE 1987 1263 H HUTCHINGS 1996 341 G NOZAKI 1972 3473 F NOZAKI 1972 F NOZAKI 1975 2674 F COLLETTE 1986 326 H POLLINGTON 1999 725 S ZHANG 2002 2406 Z KUMAR 2003 547 D KUMAR 2003 157 D TISMANEANU 2001 229 R CAMPBELL 2005 2885 T ATTARD 1995 366 G FIDDY 1999 851 S SCHERRER 1918 98 P DOLLIMORE 1964 109 D ZVESDINSKAYA 1993 197 I BOUDART 1984 M KINETICSHETEROGENEOUSCATALYTICREACTIONS FORNASIERO 2000 326 P FORNASIERO 2000 339 P CAMPBELLX2006X62 CAMPBELLX2006X62X68 CAMPBELLX2006X62XT CAMPBELLX2006X62X68XT item S1381-1169(05)00681-3 S1381116905006813 1-s2.0-S1381116905006813 10.1016/j.molcata.2005.09.030 271358 2010-10-08T06:14:47.667849-04:00 2006-02-15 1-s2.0-S1381116905006813-main.pdf https://s3.amazonaws.com/prod-ucs-content-store-us-east/content/pii:S1381116905006813/MAIN/application/pdf/39b39628e2434eded4c36111952b9c40/main.pdf https://s3-eu-west-1.amazonaws.com/prod-ucs-content-store-eu-west/content/pii:S1381116905006813/MAIN/application/pdf/39b39628e2434eded4c36111952b9c40/main.pdf main.pdf pdf true 449613 MAIN 7 1-s2.0-S1381116905006813-main_1.png https://s3.amazonaws.com/prod-ucs-content-store-us-east/content/pii:S1381116905006813/PREVIEW/image/png/6b9ba65e4f9320f74de24b297216b213/main_1.png https://s3-eu-west-1.amazonaws.com/prod-ucs-content-store-eu-west/content/pii:S1381116905006813/PREVIEW/image/png/6b9ba65e4f9320f74de24b297216b213/main_1.png main_1.png png 70259 849 656 IMAGE-WEB-PDF 1 1-s2.0-S1381116905006813-si4.gif https://s3.amazonaws.com/prod-ucs-content-store-us-east/content/pii:S1381116905006813/STRIPIN/image/gif/b157fd02bf24b284fa10b8942b71e5f6/si4.gif https://s3-eu-west-1.amazonaws.com/prod-ucs-content-store-eu-west/content/pii:S1381116905006813/STRIPIN/image/gif/b157fd02bf24b284fa10b8942b71e5f6/si4.gif si4 si4.gif gif 616 16 157 ALTIMG 1-s2.0-S1381116905006813-si3.gif https://s3.amazonaws.com/prod-ucs-content-store-us-east/content/pii:S1381116905006813/STRIPIN/image/gif/ea1b1897fdf62ad585d6112cf9dd62a0/si3.gif https://s3-eu-west-1.amazonaws.com/prod-ucs-content-store-eu-west/content/pii:S1381116905006813/STRIPIN/image/gif/ea1b1897fdf62ad585d6112cf9dd62a0/si3.gif si3 si3.gif gif 646 16 165 ALTIMG 1-s2.0-S1381116905006813-si2.gif https://s3.amazonaws.com/prod-ucs-content-store-us-east/content/pii:S1381116905006813/STRIPIN/image/gif/bb7d18be5bd0fe6a9dbbca93317f2c15/si2.gif https://s3-eu-west-1.amazonaws.com/prod-ucs-content-store-eu-west/content/pii:S1381116905006813/STRIPIN/image/gif/bb7d18be5bd0fe6a9dbbca93317f2c15/si2.gif si2 si2.gif gif 542 19 121 ALTIMG 1-s2.0-S1381116905006813-si1.gif https://s3.amazonaws.com/prod-ucs-content-store-us-east/content/pii:S1381116905006813/STRIPIN/image/gif/4d5d8e4da68186982848e22033d13ee7/si1.gif https://s3-eu-west-1.amazonaws.com/prod-ucs-content-store-eu-west/content/pii:S1381116905006813/STRIPIN/image/gif/4d5d8e4da68186982848e22033d13ee7/si1.gif si1 si1.gif gif 408 19 87 ALTIMG 1-s2.0-S1381116905006813-gr3.jpg https://s3.amazonaws.com/prod-ucs-content-store-us-east/content/pii:S1381116905006813/gr3/DOWNSAMPLED/image/jpeg/35845e6d50677739dd785431f941762b/gr3.jpg https://s3-eu-west-1.amazonaws.com/prod-ucs-content-store-eu-west/content/pii:S1381116905006813/gr3/DOWNSAMPLED/image/jpeg/35845e6d50677739dd785431f941762b/gr3.jpg gr3 gr3.jpg jpg 20945 425 353 IMAGE-DOWNSAMPLED 1-s2.0-S1381116905006813-gr3.sml https://s3.amazonaws.com/prod-ucs-content-store-us-east/content/pii:S1381116905006813/gr3/THUMBNAIL/image/gif/8c34634db24b425e710d9b254392bb8d/gr3.sml https://s3-eu-west-1.amazonaws.com/prod-ucs-content-store-eu-west/content/pii:S1381116905006813/gr3/THUMBNAIL/image/gif/8c34634db24b425e710d9b254392bb8d/gr3.sml gr3 gr3.sml sml 1674 93 77 IMAGE-THUMBNAIL 1-s2.0-S1381116905006813-gr12.jpg https://s3.amazonaws.com/prod-ucs-content-store-us-east/content/pii:S1381116905006813/gr12/DOWNSAMPLED/image/jpeg/fdd23241a30b0fbe07851be889c98c44/gr12.jpg https://s3-eu-west-1.amazonaws.com/prod-ucs-content-store-eu-west/content/pii:S1381116905006813/gr12/DOWNSAMPLED/image/jpeg/fdd23241a30b0fbe07851be889c98c44/gr12.jpg gr12 gr12.jpg jpg 14874 254 355 IMAGE-DOWNSAMPLED 1-s2.0-S1381116905006813-gr12.sml https://s3.amazonaws.com/prod-ucs-content-store-us-east/content/pii:S1381116905006813/gr12/THUMBNAIL/image/gif/da48a097c8b9b3470ceca66b06b39960/gr12.sml https://s3-eu-west-1.amazonaws.com/prod-ucs-content-store-eu-west/content/pii:S1381116905006813/gr12/THUMBNAIL/image/gif/da48a097c8b9b3470ceca66b06b39960/gr12.sml gr12 gr12.sml sml 2100 89 125 IMAGE-THUMBNAIL 1-s2.0-S1381116905006813-gr2.jpg https://s3.amazonaws.com/prod-ucs-content-store-us-east/content/pii:S1381116905006813/gr2/DOWNSAMPLED/image/jpeg/836281edfaab0d8247fcbb21e37bb9b5/gr2.jpg https://s3-eu-west-1.amazonaws.com/prod-ucs-content-store-eu-west/content/pii:S1381116905006813/gr2/DOWNSAMPLED/image/jpeg/836281edfaab0d8247fcbb21e37bb9b5/gr2.jpg gr2 gr2.jpg jpg 35260 340 334 IMAGE-DOWNSAMPLED 1-s2.0-S1381116905006813-gr2.sml https://s3.amazonaws.com/prod-ucs-content-store-us-east/content/pii:S1381116905006813/gr2/THUMBNAIL/image/gif/ab12db5c94b125934822fd5572905c2c/gr2.sml https://s3-eu-west-1.amazonaws.com/prod-ucs-content-store-eu-west/content/pii:S1381116905006813/gr2/THUMBNAIL/image/gif/ab12db5c94b125934822fd5572905c2c/gr2.sml gr2 gr2.sml sml 3227 94 92 IMAGE-THUMBNAIL 1-s2.0-S1381116905006813-gr6.jpg https://s3.amazonaws.com/prod-ucs-content-store-us-east/content/pii:S1381116905006813/gr6/DOWNSAMPLED/image/jpeg/2638d1aa074e0054c7f243099840775c/gr6.jpg https://s3-eu-west-1.amazonaws.com/prod-ucs-content-store-eu-west/content/pii:S1381116905006813/gr6/DOWNSAMPLED/image/jpeg/2638d1aa074e0054c7f243099840775c/gr6.jpg gr6 gr6.jpg jpg 32725 426 330 IMAGE-DOWNSAMPLED 1-s2.0-S1381116905006813-gr6.sml https://s3.amazonaws.com/prod-ucs-content-store-us-east/content/pii:S1381116905006813/gr6/THUMBNAIL/image/gif/27565a904c624fac52f1b2169e0f14fb/gr6.sml https://s3-eu-west-1.amazonaws.com/prod-ucs-content-store-eu-west/content/pii:S1381116905006813/gr6/THUMBNAIL/image/gif/27565a904c624fac52f1b2169e0f14fb/gr6.sml gr6 gr6.sml sml 2652 93 72 IMAGE-THUMBNAIL 1-s2.0-S1381116905006813-gr9.jpg https://s3.amazonaws.com/prod-ucs-content-store-us-east/content/pii:S1381116905006813/gr9/DOWNSAMPLED/image/jpeg/d50e92d6156d4ecaa6e0515c7fb6a809/gr9.jpg https://s3-eu-west-1.amazonaws.com/prod-ucs-content-store-eu-west/content/pii:S1381116905006813/gr9/DOWNSAMPLED/image/jpeg/d50e92d6156d4ecaa6e0515c7fb6a809/gr9.jpg gr9 gr9.jpg jpg 12995 335 351 IMAGE-DOWNSAMPLED 1-s2.0-S1381116905006813-gr9.sml https://s3.amazonaws.com/prod-ucs-content-store-us-east/content/pii:S1381116905006813/gr9/THUMBNAIL/image/gif/90a201ebb5ebb2d2bae5adcb093627ef/gr9.sml https://s3-eu-west-1.amazonaws.com/prod-ucs-content-store-eu-west/content/pii:S1381116905006813/gr9/THUMBNAIL/image/gif/90a201ebb5ebb2d2bae5adcb093627ef/gr9.sml gr9 gr9.sml sml 1710 94 98 IMAGE-THUMBNAIL 1-s2.0-S1381116905006813-gr4.jpg https://s3.amazonaws.com/prod-ucs-content-store-us-east/content/pii:S1381116905006813/gr4/DOWNSAMPLED/image/jpeg/7688f0759a858b8c44bb894a9ad2f566/gr4.jpg https://s3-eu-west-1.amazonaws.com/prod-ucs-content-store-eu-west/content/pii:S1381116905006813/gr4/DOWNSAMPLED/image/jpeg/7688f0759a858b8c44bb894a9ad2f566/gr4.jpg gr4 gr4.jpg jpg 14948 285 345 IMAGE-DOWNSAMPLED 1-s2.0-S1381116905006813-gr4.sml https://s3.amazonaws.com/prod-ucs-content-store-us-east/content/pii:S1381116905006813/gr4/THUMBNAIL/image/gif/01a5694d26ec5f20fe5b2dbd67363ca5/gr4.sml https://s3-eu-west-1.amazonaws.com/prod-ucs-content-store-eu-west/content/pii:S1381116905006813/gr4/THUMBNAIL/image/gif/01a5694d26ec5f20fe5b2dbd67363ca5/gr4.sml gr4 gr4.sml sml 1949 93 113 IMAGE-THUMBNAIL 1-s2.0-S1381116905006813-gr11.jpg https://s3.amazonaws.com/prod-ucs-content-store-us-east/content/pii:S1381116905006813/gr11/DOWNSAMPLED/image/jpeg/492f2eb8b6b7509cf4431df1a14b235b/gr11.jpg https://s3-eu-west-1.amazonaws.com/prod-ucs-content-store-eu-west/content/pii:S1381116905006813/gr11/DOWNSAMPLED/image/jpeg/492f2eb8b6b7509cf4431df1a14b235b/gr11.jpg gr11 gr11.jpg jpg 24511 363 617 IMAGE-DOWNSAMPLED 1-s2.0-S1381116905006813-gr11.sml https://s3.amazonaws.com/prod-ucs-content-store-us-east/content/pii:S1381116905006813/gr11/THUMBNAIL/image/gif/e3cea97fc2d28d0b17164401d22ad121/gr11.sml https://s3-eu-west-1.amazonaws.com/prod-ucs-content-store-eu-west/content/pii:S1381116905006813/gr11/THUMBNAIL/image/gif/e3cea97fc2d28d0b17164401d22ad121/gr11.sml gr11 gr11.sml sml 1754 74 125 IMAGE-THUMBNAIL 1-s2.0-S1381116905006813-gr1.jpg https://s3.amazonaws.com/prod-ucs-content-store-us-east/content/pii:S1381116905006813/gr1/DOWNSAMPLED/image/jpeg/ac9414f0e6e65b11b8f529470b76c8f9/gr1.jpg https://s3-eu-west-1.amazonaws.com/prod-ucs-content-store-eu-west/content/pii:S1381116905006813/gr1/DOWNSAMPLED/image/jpeg/ac9414f0e6e65b11b8f529470b76c8f9/gr1.jpg gr1 gr1.jpg jpg 44720 323 354 IMAGE-DOWNSAMPLED 1-s2.0-S1381116905006813-gr1.sml https://s3.amazonaws.com/prod-ucs-content-store-us-east/content/pii:S1381116905006813/gr1/THUMBNAIL/image/gif/ec7eddf5c2b60da687fac8f055801d72/gr1.sml https://s3-eu-west-1.amazonaws.com/prod-ucs-content-store-eu-west/content/pii:S1381116905006813/gr1/THUMBNAIL/image/gif/ec7eddf5c2b60da687fac8f055801d72/gr1.sml gr1 gr1.sml sml 3923 93 102 IMAGE-THUMBNAIL 1-s2.0-S1381116905006813-gr5.jpg https://s3.amazonaws.com/prod-ucs-content-store-us-east/content/pii:S1381116905006813/gr5/DOWNSAMPLED/image/jpeg/df154907595d772a3578fac91a14f891/gr5.jpg https://s3-eu-west-1.amazonaws.com/prod-ucs-content-store-eu-west/content/pii:S1381116905006813/gr5/DOWNSAMPLED/image/jpeg/df154907595d772a3578fac91a14f891/gr5.jpg gr5 gr5.jpg jpg 27161 401 330 IMAGE-DOWNSAMPLED 1-s2.0-S1381116905006813-gr5.sml https://s3.amazonaws.com/prod-ucs-content-store-us-east/content/pii:S1381116905006813/gr5/THUMBNAIL/image/gif/57bd262c6dc62e392cc38f547e6784e5/gr5.sml https://s3-eu-west-1.amazonaws.com/prod-ucs-content-store-eu-west/content/pii:S1381116905006813/gr5/THUMBNAIL/image/gif/57bd262c6dc62e392cc38f547e6784e5/gr5.sml gr5 gr5.sml sml 2316 94 77 IMAGE-THUMBNAIL 1-s2.0-S1381116905006813-gr8.jpg https://s3.amazonaws.com/prod-ucs-content-store-us-east/content/pii:S1381116905006813/gr8/DOWNSAMPLED/image/jpeg/aae71bec8480135b0eac106ec1a6b881/gr8.jpg https://s3-eu-west-1.amazonaws.com/prod-ucs-content-store-eu-west/content/pii:S1381116905006813/gr8/DOWNSAMPLED/image/jpeg/aae71bec8480135b0eac106ec1a6b881/gr8.jpg gr8 gr8.jpg jpg 13491 254 343 IMAGE-DOWNSAMPLED 1-s2.0-S1381116905006813-gr8.sml https://s3.amazonaws.com/prod-ucs-content-store-us-east/content/pii:S1381116905006813/gr8/THUMBNAIL/image/gif/0c173a65a26d94fa7a5113e4e4ba050f/gr8.sml https://s3-eu-west-1.amazonaws.com/prod-ucs-content-store-eu-west/content/pii:S1381116905006813/gr8/THUMBNAIL/image/gif/0c173a65a26d94fa7a5113e4e4ba050f/gr8.sml gr8 gr8.sml sml 2011 92 125 IMAGE-THUMBNAIL 1-s2.0-S1381116905006813-gr10.jpg https://s3.amazonaws.com/prod-ucs-content-store-us-east/content/pii:S1381116905006813/gr10/DOWNSAMPLED/image/jpeg/aff24e9dbb644449b60c03cb136374e2/gr10.jpg https://s3-eu-west-1.amazonaws.com/prod-ucs-content-store-eu-west/content/pii:S1381116905006813/gr10/DOWNSAMPLED/image/jpeg/aff24e9dbb644449b60c03cb136374e2/gr10.jpg gr10 gr10.jpg jpg 16309 410 339 IMAGE-DOWNSAMPLED 1-s2.0-S1381116905006813-gr10.sml https://s3.amazonaws.com/prod-ucs-content-store-us-east/content/pii:S1381116905006813/gr10/THUMBNAIL/image/gif/93c5ebab804b35452bb2489304a45567/gr10.sml https://s3-eu-west-1.amazonaws.com/prod-ucs-content-store-eu-west/content/pii:S1381116905006813/gr10/THUMBNAIL/image/gif/93c5ebab804b35452bb2489304a45567/gr10.sml gr10 gr10.sml sml 1584 93 77 IMAGE-THUMBNAIL 1-s2.0-S1381116905006813-gr7.jpg https://s3.amazonaws.com/prod-ucs-content-store-us-east/content/pii:S1381116905006813/gr7/DOWNSAMPLED/image/jpeg/a0dfbde475943f14ccea2b2a8020957f/gr7.jpg https://s3-eu-west-1.amazonaws.com/prod-ucs-content-store-eu-west/content/pii:S1381116905006813/gr7/DOWNSAMPLED/image/jpeg/a0dfbde475943f14ccea2b2a8020957f/gr7.jpg gr7 gr7.jpg jpg 13747 323 355 IMAGE-DOWNSAMPLED 1-s2.0-S1381116905006813-gr7.sml https://s3.amazonaws.com/prod-ucs-content-store-us-east/content/pii:S1381116905006813/gr7/THUMBNAIL/image/gif/66065cd11b669acfae7ec67034831ce5/gr7.sml https://s3-eu-west-1.amazonaws.com/prod-ucs-content-store-eu-west/content/pii:S1381116905006813/gr7/THUMBNAIL/image/gif/66065cd11b669acfae7ec67034831ce5/gr7.sml gr7 gr7.sml sml 1728 93 102 IMAGE-THUMBNAIL 1-s2.0-S1381116905006813-fx1.jpg https://s3.amazonaws.com/prod-ucs-content-store-us-east/content/pii:S1381116905006813/fx1/DOWNSAMPLED/image/jpeg/d9670dd34acc741fbb827ad0cb792c13/fx1.jpg https://s3-eu-west-1.amazonaws.com/prod-ucs-content-store-eu-west/content/pii:S1381116905006813/fx1/DOWNSAMPLED/image/jpeg/d9670dd34acc741fbb827ad0cb792c13/fx1.jpg fx1 true fx1.jpg jpg 22203 240 262 IMAGE-DOWNSAMPLED 1-s2.0-S1381116905006813-fx1.sml https://s3.amazonaws.com/prod-ucs-content-store-us-east/content/pii:S1381116905006813/fx1/THUMBNAIL/image/gif/7eada736c772f6aa1bae41d1df95c369/fx1.sml https://s3-eu-west-1.amazonaws.com/prod-ucs-content-store-eu-west/content/pii:S1381116905006813/fx1/THUMBNAIL/image/gif/7eada736c772f6aa1bae41d1df95c369/fx1.sml fx1 true fx1.sml sml 1942 93 102 IMAGE-THUMBNAIL 1-s2.0-S1381116905006813-gr13.gif https://s3.amazonaws.com/prod-ucs-content-store-us-east/content/pii:S1381116905006813/gr13/DOWNSAMPLED/image/gif/0896451ec61d098a8c9cfcad21e76feb/gr13.gif https://s3-eu-west-1.amazonaws.com/prod-ucs-content-store-eu-west/content/pii:S1381116905006813/gr13/DOWNSAMPLED/image/gif/0896451ec61d098a8c9cfcad21e76feb/gr13.gif gr13 gr13.gif gif 4458 408 345 IMAGE-DOWNSAMPLED 1-s2.0-S1381116905006813-gr13.sml https://s3.amazonaws.com/prod-ucs-content-store-us-east/content/pii:S1381116905006813/gr13/THUMBNAIL/image/gif/f79d6eefe3422863db5aad49913d8694/gr13.sml https://s3-eu-west-1.amazonaws.com/prod-ucs-content-store-eu-west/content/pii:S1381116905006813/gr13/THUMBNAIL/image/gif/f79d6eefe3422863db5aad49913d8694/gr13.sml gr13 gr13.sml sml 698 93 79 IMAGE-THUMBNAIL MOLCAA 5545 S1381-1169(05)00681-3 10.1016/j.molcata.2005.09.030 Elsevier B.V. Fig. 1 CO conversion as a function of temperature for a range of supported uranium oxide catalysts, varying by precursor, support and pre-calcination, under a net oxidising (10mlmin−1 5% CO, 5mlmin−1 O2, 5mlmin−1 He: O2/CO=10: GHSV=20,000h−1) feedstock, and a linear heating ramp of 10Kmin−1. Fig. 2 %NO conversion achieved over 30wt.% uranyl nitrate derived, H1-SiO2 (black), ES70 (dark grey) γ-Al2O3 (light grey) supported catalysts. Ordinal text labels denote pre-treatment applied: no pre-calcination, pre-calcination in air to 723K/3h, and 1073K/3h. Reaction conditions: 10mlmin−1 5% NO/He+10mlmin−1 5% CO/He: GHSV=20,000h−1; linear heating ramp of 10Kmin−1. Fig. 3 Selectivity toward N2 and N2O production during NO reduction by CO for the most active uranium oxide system (unit/h1/nc) compared to that derived from a 2wt.% Pt/Al2O3 standard catalyst. (a) N2 selectivity (unit/h1/nc); (b) N2O selectivity (unit/h1/nc); (c) N2 selectivity (Pt/Al2O3); (d) N2O selectivity (Pt/Al2O3). Fig. 4 Variation in the temperature at which 25% NO conversion is achieved (T 25%) over UCl4/Al2O3 catalysts, under a 10mlmin−1 5% NO/He+10mlmin−1 5% CO/He (GHSV=20,000h−1) feedstock and a linear heating ramp of 10Kmin−1, as a function of pre-calcination temperature. Fig. 5 Ex situ pore size distributions for differently pre-treated H1-SiO2 samples: (A) as prepared (BET=870m2 g−1); (B) unloaded, after calcination in air at 1073K/3h (BET=590m2 g−1); (C) after loading with 30wt.% uranyl nitrate, no pre-treatment (BET=313m2 g−1): filled circles; unit/h1/1073 post CO/NO reaction to 873K (BET=195m2g−1): open circles; unit/h1/nc post CO/NO reaction to 873K/3h (BET=221m2g−1). Fig. 6 Powder X-ray ray diffraction (PXRD) pattern from uranyl nitrate/H1-SiO2 catalyst (calcined at 873K) derived at room temperature after NO reduction by CO to 873K. Fig. 7 The dependence upon uranium loading of the net activity of the H1-SiO2 supported uranyl nitrate based catalysts (uncalcined) for NO reduction by CO. Reaction conditions: 10mlmin−1 5% NO/He+10mlmin−1 5% CO/He: GHSV=20,000h−1; linear heating ramp of 10Kmin−1. Fig. 8 Comparison of the temperature at which 50% NO is achieved for uranyl nitrate derived, H1-SiO2 supported catalysts (unit/h1/nc, open circles) against that derived from a 2wt.% Pt/Al2O3 catalyst (filled circles), as a function of contact time (s-1). Fig. 9 Representative Arrhenius plots for CO oxidation and NO reduction over differing H1-SiO2 supported uranium catalysts: (a) unit/h1/1073; (b) unit/h1/nc. Fig. 10 Variation of ln(ν) with E (a), derived from Arrhenius analysis of the CO and NO conversion over all the catalysts investigated. Filled circles, NO reduction; open circles, CO oxidation. Fig. 11 (a) ln(k 723/BET) vs. PXRD derived U5O11 average crystallite thicknesses for NO reduction by CO derived from differing precursors and pre-treatments. Filled circles, H1-SiO2; open circles, ES70; triangles, γ-Al2O3. Catalysts derived from (a) uranyl nitrate and (b) UCl4. Fig. 12 Rates of reaction vs. NO/CO ratio during NO reduction by CO over the uncalcined uranyl nitrate/H1-SiO2 catalyst. Open circles, NO variation; filled circles, CO variation. Fig. 13 Variation of the net E (a) derived for NO reduction by CO as a function of ex situ UO2.2 (logarithmic axis) domain size for all catalysts studied: open circles are uncalcined systems (nc) with UCl4 as precursor. Effects of precursor and support variation in the performance of uranium oxide catalysts for CO oxidation and selective reduction of NO Tom Campbell a 1 Mark A. Newton a 2 Vicky Boyd b Darren F. Lee b John Evans a ⁎ a School of Chemistry, University of Southampton, Highfield, Southampton, Hants SO17 1BJ, UK b British Nuclear Fuels Plc, Nuclear Sciences and Technology Services, Preston, Lancashire PR4 0XJ, UK ⁎ Corresponding author. Tel.: +44 2380 593307; fax: +44 2380 593781. 1 Present address: Johnson Matthey Plc, Royston, Hertfordshire, UK. 2 Present address: ESRF, BP220, Grenoble F-38043, France. Graphical abstract Conditioning uranium oxide catalysts in mesoporous silica under the feedstocks CO/O2/He or CO/NO/He, avoids extrusion and results in superior catalysts The rate for selective reduction of NO by CO over is proportional to [NO]0[CO]1.4. The most active systems are highly dispersed where increased E (a) values are more than compensated site availability. Uranium oxide catalysts supported upon γ-Al2O3 and amorphous and mesoporous silica have been tested for CO/O2 and NO/CO conversions. Pre-calcination is deleterious to catalysts on a mesoporous support due to extrusion of the active uranium phase into poorly dispersed uranium oxide particles. Developing the catalysts under CO/O2/He or CO/NO/He avoids extrusion and results in superior mesoporous catalysts (from uranyl nitrate precursor) which are comparable to Pt/Al2O3 catalysts. Chloride is found generally to be deleterious to catalyst performance. The exception to this in UCl4/γ-Al2O3 calcined at 873K for CO/O2. In this system, the total activity is correlated to the level of chlorine retention and average uranium phase crystallite size within the catalyst. The net rate expression for selective reduction of NO by CO over the best mesoporous catalyst is zero order in NO and proportional to [CO]1.4 in contrast to bulk U3O8 where the net rate depends upon [NO]. The activation energy (E (a)) and pre-exponential factors (ν) are highly correlated both to each other and the net dispersion of the UO2.2 phase recovered after catalysis; the most active systems are highly dispersed where the E (a) values are more than compensated for by higher values of ν. Keywords Mesoporous Silica Uranium Oxides NO reduction 1 Introduction Uranium oxide based materials are active for a wide range of total and selective oxidation processes [1–10]. These include efficient catalysts for NO x removal processes, showing a net activity comparable to Pt based catalysts and improved selectivity to NO in the region of light-off. Mesoporous dispersants possess significantly higher surface areas upon which an active phase may be deposited, and have been applied for uranium oxide catalysts [11–13]. Thus far, detailed catalytic information regarding NO reduction and CO oxidation by uranium catalysts has not been presented. Previous investigations utilising amorphous supports have consistently shown that silica provides poorer catalysts [8,9] to Al2O3 or TiO2. The support structure may affect how these materials maintain an active phase [14]. The uranium catalysts supported on the mesoporous silica H1-SiO2, synthesised by templating with non-ionic surfactants as in the method due to Attard et al. [15], show sufficient thermal stability to survive calcination to 1073K with its tertiary structure largely intact. However, such calcination leads to an extrusion of U3O8 from within the pores. There are significant variations in the manner in which the U3O8 phase develops depending upon the support used. This results in both a considerable variation in the average size of the supported particles and in the preferred polymorphs of U3O8. In mesoporous silica, a hexagonal phase of U3O8 forms first but is then superceded by the orthorhombic form. On amorphous silica or γ-alumina only the hexagonal form of U3O8 is generally observed [14]. An exception to this is presented by catalysts derived from UCl4/γ-alumina, where formation of orthorhombic U3O8 is evident. In this report, we investigate the effects of these structural variations on CO oxidation by O2 and NO. 2 Experimental Catalysts prepared in the manner previously described [14] were pre-treated and calcined in a microreactor [16]. This reactor utilises a 20–30mg sample charge held in place by quartz wool plugs and permits the insertion of a 0.5mm diameter type k thermocouple directly into the bed (∼5mm long). Sample heating to 873K may be achieved using this configuration. Where calcinations have been made to 1073K microreactor measurements were made ex situ to the calcination. Gases are admitted under mass flow control and the composition of the feedstock measured downstream of the catalyst bed using a quadropole mass spectrometer station interfaced to the reactor via a stainless steel capillary. Once loaded into the reactor, samples were thoroughly purged in a He flow prior to exposure to the reactive feedstocks. For CO oxidation experiments, the reactive feedstock comprised a mixture of 5% CO/He and 5% O2/He to yield a CO:O2 ratio of 1:1, with a total flow rate of 20mlmin−1 (GHSV=20,000h−1). NO reduction experiments utilised 5% NO/He and 5% CO/He gas mixtures over a range of NO:CO space velocities (ca. 8800–180,000h−1). Typically, the performance of these catalysts was then tested by heating the sample to 873K at 10Kmin−1 whilst continually monitoring the exit feedstock composition by mass spectrometry. The supported uranium systems were also tested against a more standard 2wt.% Pt/Al2O3 catalyst (type 4, Johnson-Matthey) using the same weight of catalyst and gas flows. Individual catalysts and pre-treatment are identified as follows: ucl or unit index the precursor used (UCl4 or uranyl nitrate, UO2(NO3)2·6H2O, respectively); al, si, or h1, index the support material (Degussa Alon C alumina, Grace ES700 silica, and H1-SiO2 mesoporous silica, respectively); lastly nc, or a temperature value detail pre-calcination temperatures (nc=no pre-calcination). For example unit/h1/873 refers to a catalysts derived from uranyl nitrate, supported upon H1-SiO2, and subjected to a pre-calcination at 873K. Based upon a previous study of NO x abatement using uranium nitrate derived catalysts supported upon the same γ-alumina [10] (Alon C, Degussa, 100m2g−1), all catalysts were made to yield a nominal loading of 30wt.% U. Only in the case of uranyl nitrate on H1-SiO2 supports was the dependence of catalytic performance upon U loading investigated more closely in the range 0wt.%<U<47.5wt.%. PXRD data was collected as previously described [14] and UO x crystallite sizes derived using the Scherrer formula [17]. 3 Results Catalytic activity for CO oxidation was displayed by a wide range of the materials synthesised (Fig. 1 ). A silica supported catalyst of comparable activity to the more usual alumina supported variants was formed from uranyl nitrate on the mesoporous silica without any pre-calcination. This same material proved to be the most active one found for NO reduction by CO (Fig. 2 ). For Cl free systems, the removal of any pre-calcination step resulted generally in a lower “light-off” temperatures and more active catalysts, the effect being most significant for NO reduction by CO. The net selectivity to N2O and N2 obtained from the catalyst found to be the most active (uncalcined 30wt.% uranyl nitrate/H1-SiO2) is comparable to that derived from the standard Pt/Al2O3 catalyst, particularly in the temperature region of reaction light-off (Fig. 3 ). Pre-calcination was beneficial for one of the most active materials (UCl4/Al2O3) for CO oxidation (Fig. 1), and there was also a significant variation in activity as a function of pre-calcination temperature for the CO/NO reaction (Fig. 4 ). Pre-calcination of this uranium material on the non-porous alumina at 873K results in an optimal catalyst for CO removal. This corresponds to the minimum temperature required for chlorine removal and the onset of U3O8 crystallites (of ∼20nm domain size) [14]. The structural aspects of the active most active mesoporus material were investigated further. The pore size distribution (Dollimore-Heal method [18] (Fig. 5 )) and surface area of the as-made H1-SiO2 support (A) are both reduced after pre-calcination of the unloaded mesoporous support to 1073K (B). Loading the H1-SiO2 with 30wt. % uranyl nitrate (C) caused larger reduction in both pore diameter and surface area, consistent with there being an internal coating of the mesopores. The two other pore size distributions were derived ex situ after reaction under the 2.5% CO/2.5% NO/95% He. One is derived from a catalyst pre-calcined to 1073K prior to catalytic study and results in a poor catalyst (Fig. 1); the second, uncalcined catalyst was the most active uranium catalyst. Whether pre-calcined to 1073K or allowed to evolve under the reactive feedstock to 873K, the pore size distributions derived ex situ were extremely similar, with an average pore diameter of 28Å. So the large variations in catalytic activity are not due to any changes in the mesoporous structures. Fig. 6 shows a powder X-ray diffraction pattern from a 30wt.% uranyl nitrate/H1-SiO2 catalyst pre-calcined to 873K and then reacted to 873K under the CO/NO feedstock. This pattern differs from any measured pre-catalysis [14] or in similar previous studies [10]. The uranium present post reaction is not as U3O8 or U4O9, but this pattern most closely resembles is U5O11 (UO2.2) [19,20]. The activity of this chlorine-free UO x supported on H1-SiO2 shows a broad maximum between 20 and 30wt.% loadings (Fig. 7 ) with a T 50% ∼200K lower than that of pure U3O8 (47.5wt.% U). At loadings lower than 20wt.% catalytic performance gradually deteriorates, both in terms of overall activity and of selectivity (not shown); at loadings of 5wt.% U or less, increasingly significant contributions from support materials resulted in increasing proportion of N2O being formed. A direct comparison with the standard Pt/Al2O3 catalyst (Fig. 8 ) shows that the uranyl nitrate based system is the rather less active across the range of contact times investigated. However, over most of the range of contact times, the differential is small (ca. 25K). Only at the shortest contact times tested did the conversion performance of the Pt catalyst become significantly the better, such that below a contact time of 0.05s−1 (GHSV=72,000h−1) the difference in T 50% between the systems increases to ∼75K at 0.02s−1. Estimates of the apparent activation energy (E (a)) and pre-exponential factor (ν) for both catalytic reactions were made from Arrhenius plots of the CO or NO conversion curves in regions of low conversion (<20%) (Fig. 9 ). By way of reference, the performance of bulk U3O8 was also measured for both reactions and analysed for kinetic parameters in the same way. The values of E (a) and ν were highly correlated: the most active systems yielded the highest activation energies (Fig. 10 ). This compensation effect [21] afforded the most active catalysts the highest values of ν. The errors associated with E (a) and ν are estimated as ca. ±10% and ±20%, respectively, so the relationship between these two kinetic parameters for CO oxidation and NO reduction can be regarded as very similar. The relationship between the rate constant at 723K for NO reduction by CO per unit area and the domain size of the UO2.2 was investigated for the uranyl nitrate (Fig. 11a) and UCl4 (Fig. 11b) derived catalysts on the three types of support. The performance of bulk U3O8 for NO reduction is also indicated. The most active system for this conversion, unit/h1/nc, outperformed the conventionally preferred alumina based systems. The generally deleterious effect of Cl on the amorphous and mesoporous SiO2 can clearly be seen, especially where no pre-calcination step has been undertaken. In terms of the best catalysts derived from the UCl4 precursor, the situation is now inverted with the alumina based systems, calcined up to 873K, showing the highest activity. The order of NO reduction with respect to CO and NO was investigated for the unit/h1/nc catalyst (Fig. 12 ). These results afforded the total rate expression for this reaction of: (1) r = k [ CO ] 1.4 which compares to that derived previously for the same reaction catalysed by bulk U3O8 [8]: (2) r = k [ CO ] [ NO ] 0.4 The net order in both cases is the same but in the mesoporous case the total order is now determined solely by the CO component. 4 Discussion The ability of supported uranium oxide catalysts to facilitate the catalytic oxidation of CO and the selective reduction of NO varies greatly with support, precursor and preparative methodology. In the case of the H1-SiO2 supported catalysts, the methods of catalyst pre-treatment appear to dominate. Silicas have been considered as poor dispersants for an active phase [4,8–10], but by avoiding a pre-calcination stage in the preparation, silicas become considerably superior supports than alumina. The increased activity of these systems is maintained even when they are reacted to 873K. The principal reason for this appears to be that this protocol maintains a lower oxidation number of the uranium and avoids large scale sintering of the supported UO x phase, thereby maintaining high dispersion and activity (Fig. 11a). Avoidance of pre-calcination also allows containment of the supported uranium oxide within the mesopores of the silica. Developing the catalyst under the reactive feedstock (CO/O2/He or CO/NO/He), overcomes the problem of active phase extrusion [14]. However, avoiding the pre-calcination step in alumina supported catalysts also results in small UO x domain sizes but fails to elicit superior performance. For the uranyl nitrate/H1-SiO2 catalyst the rate of NO reduction by CO is independent of [NO], unlike for bulk U3O8 [8]. Hence in this mesoporous catalyst dissociation of NO has been made relatively easier. In terms of surface species, the formation of N2O can occur in two ways: the disproportionation of two molecularly adsorbed NO species, i.e.: (3) 2 N O ( a ) → N 2 O ( g ) + O ( a ) or the reaction of an adsorbed NO molecule with an adsorbed nitrogen species left from a previous dissociation event, i.e.: (4) N ( a ) + N O ( a ) → N 2 O ( g ) If NO dissociation has been facilitated so no molecular surface NO species adsorbed at defect sites on the oxide surface exist for an appreciable time, N2O formation may only now occur via an Eley-Rideal type interaction of a gas phase NO molecule with an adsorbed N atom before the latter has the chance to find a second N(a) species with which to recombinatively desorb as N2. The high selectivity to N2 formation indicates the recombination is the faster process under the conditions studied. The ex situ diffraction characterisation of samples after catalysis indicate a lower oxygen content than U3O8 and the presence of a phase of uranium oxide not previously seen on alumina supported catalysts, namely UO2.2 [10]. The stoichiometry of this phase is consistent with the range proposed by Wells et al. [10] for the active phase of uranium oxide present supported on γ-Al2O3 (i.e. UO x , 2< x <2.25). In situ XRD in these alumina based systems, however, only showed the presence U3O8 and UO2 during NO reduction by CO. This lower oxygen content in this study may be expected to facilitate the dissociation of adsorbed NO. The compensation effect between ln(ν) and E (a) is essentially identical for both CO oxidation and NO reduction, indicating that the rate of dissociation of the oxidant species has become facile enough so that no term containing [NO] or [O2] is present in the rate expression. The E (a) values therefore pertain to the abstraction of surface framework oxygen from the active phase by CO. Per site therefore, the most active systems possess the least reducible supported uranium oxide phases. These E (a) values for the NO/CO reaction correlate with the logarithm of the UO2.2 domain size (Fig. 13 ) and with the pre-exponential factor. Thus increasing the crystallite size of the UO2.2 may ease the loss of oxygen at a particular site, but these sites will be of reduced availability. The three cases that deviate most from this general observation (open circles in Fig. 13) have UCl4 as the precursor and no pre-calcination step. In the alumina case, which has been investigated in most detail with regard to levels of Cl retained after calcination, we can see that the activity maximum in these systems (for CO oxidation and NO reduction) corresponds to the situation wherein the complete loss of Cl from the system has occurred but a relatively small average U3O8 crystallite size is retained; calcination in excess of this temperature (873K) resulting in ever larger, more poorly dispersed and less reactive systems [14]. The high activity of the ucl/al/873 system occurs at the confluence of these two factors. Chlorine retention appears to interfere with the active sites formed by small U3O8 particles. A similar result has been previously reported regarding the activity of Rh/ceria/zirconia catalysts [22,23]. Chlorine retention, promoted by low temperature pre-treatment, was shown, in that case, to lead to a decreased vacancy population and activity, similar to the pattern reported here. In terms of the E (a) for CO abstracting oxygen from the uranium oxide phase, the deleterious affect of Cl is not significant outside of the three examples where no pre-calcination has been employed. Our previous work [14] has shown that Cl removal (at least from the alumina based systems) starts to proceed at the lowest calcination temperature (723K) and is completed by 873K. Moreover, thermogravimetric analyses, coupled with mass spectrometry, indicate that all major weight loss events have occurred by ca. 700–750K for all these supports. So after pre-calcination (at 723, 873, and 1023K) chlorine retention will be relatively low. However, Fig. 11b clearly shows that for the net rate constant for NO reduction by CO, nine of the systems (out of 12) derived from Cl precursors show an activity similar to or less than that of bulk U3O8; in the Cl-free system this applies to five cases (out of 12). The presence of Cl in the catalyst precursor can have a residual effect even after it has been largely removed. Lastly, it is clear that, over a wide range of contact times the most active catalysts in this study are almost as efficient as the Pt/Al2O3 in activity terms for NO removal. Fifty percent conversion is achieved at only marginally higher temperatures above contact times of 0.1s (by ∼25K) than for the reference Pt catalyst. This differential does increase at higher space velocities. 5 Conclusions Considerable enhancements in the performance of uranium oxide catalysts for both CO oxidation and selective NO removal by CO may be obtained by effective containment of the active phase within a mesoporous silica support. Activating the as-deposited system under the reactive feedstock itself provides a means of achieving this. A uranyl nitrate derived system using the mesoporous silica H1-SiO2 maintains performance to 873K, and out-performs analogous Al2O3 based catalysts. This system also shows a performance comparable to that obtained from a typical catalyst based upon Pt/Al2O3 over a wide range of contact times. The kinetics of the CO/NO reaction are modified (relative to bulk U3O8 case) in the most active catalysts. Any dependency of NO reduction by CO upon gas phase NO concentration is absent in these supported systems. Moreover, the most active systems for both reactions are found to display the highest activation energies (for abstraction of oxygen by CO). Both activation energy and ln(ν) vary logarithmically with crystallite size and are therefore closely correlated to dispersion. However, this is more than compensated for by large increases in pre-exponential factor, pointing to the effectiveness of the increased surface area of the mesoporous support in increasing the frequency of occurrence of active sites. The incorporation of Cl in the catalyst formulation is generally deleterious to the performance of silica based. However, in one Al2O3 supported case (for CO oxidation) the use of a UCl4 precursor does result in a catalyst that is of comparable activity to even the best uranyl nitrate based system. This promotion coincides with the complete removal of Cl from this just prior to sintering of the U3O8 phase to relatively large and inactive particles. Acknowledgements BNFL and the EPSRC are thanked for funding a PhD studentship to TJC and the EPSRC are for postdoctoral funding to MAN. We are also extremely grateful to Professor G.C. Allen and Dr. K.R. Hallam (University of Bristol Interface Analysis Centre) for their advice in interpreting the ex situ PXRD data. References [1] V. Corberan A. Corma G. Kremenic Ind. Eng. Chem. Prod. Res. Dev. 24 1984 546 V. Corberan A. Corma G. Kremenic Ind. Eng. Chem. Prod. Res. Dev. 24 1985 62 [2] J.L. Callahan, B. Gertissier, US Patent 308,151 (1965) J.L. Callahan, B. Gertissier, US Patent 198,750 (1967). [3] J.C. Steenhof de Jong C.H.E. Guffens H.F.S. Van der Baan J. Catal. 26 1972 401 J.C. Steenhof de Jong C.H.E. Guffens H.F.S. Van der Baan J. Catal. 31 1973 127 [4] H. Collette V. Deremince-Mathieu Z. Gabelica J.B. Nagy E.G. Derouane J.J. Verbist J. Chem. Soc. Faraday Trans. 83 1987 1263 [5] G.J. Hutchings C.S. Heneghan I.D. Hudson S.H. Taylor Nature 384 1996 341 [6] F. Nozaki K. Ohki Bull. Chem. Soc. Jpn. 45 1972 3473 [7] F. Nozaki M. Kobayashi S. Yoshida Nippon Kagaku Kaishi 26 1972 [8] F. Nozaki F. Matsukawa Y. Mano Bull. Chem. Soc. Jpn. 48 1975 2674 [9] H. Collette S. Maroie J. Riga J.J. Verbist Z. Gabelica J.B. Nagy E.G. Derouane J. Catal. 98 1986 326 [10] S.D. Pollington A.F. Lee T.L. Overton P.J. Sears P.B. Wells S. Hawley I.D. Hudson D.F. Lee V. Ruddick Chem. Commun. 1999 725 [11] Z.T. Zhang M. Konduru S. Dai S.H. Overbury Chem. Commun. 2002 2406 [12] (a) D. Kumar G.K. Dey N.M. Gupta Phys. Chem. Chem. Phys. 5 2003 547 (b) D. Kumar S. Bera A.K. Tripathi G.K. Dey N.M. Gupta Micropor. Mesopor. Mater. 66 2003 157 [13] R. Tismaneanu B. Ray R. Khalfin R. Semiat M.S. Eisen J. Mol. Catal. A 171 2001 229 [14] T. Campbell M.A. Newton V. Boyd D.F. Lee J. Evans J. Phys. Chem. B 109 2005 2885 [15] G.S. Attard J.C. Glyde C.G. Göltner Nature 378 1995 366 [16] S.G. Fiddy M.A. Newton A.J. Dent G. Salvini J.M. Corker S. Turin T. Campbell J. Evans Chem. Commun. 1999 851 [17] P. Scherrer Nachr. Göttinger Gessell. 1918 98 [18] D. Dollimore G.R. Heal J. Appl. Chem. 1964 109 [19] I. Zvesdinskaya L. Dubrivinskiy Dokl. Acad. Sci. USSR Earth Sci. Sec. 319 1993 197 (English translation) [20] G.C. Allen, K.R. Hallam, Private communication. [21] For instance M. Boudart G. Djega-Mariadassu Kinetics of Heterogeneous Catalytic Reactions 1984 Princeton University Press Princeton p. 124 [22] P. Fornasiero N. Hickey J. Kaspar C. Dossi D. Gava M. Graziani J. Catal. 189 2000 326 [23] P. Fornasiero N. Hickey J. Kaspar T. Montini M. Graziani J. Catal. 189 2000 339",
      "scopus-id": "31544431986",
      "coredata": {
        "eid": "1-s2.0-S1381116905006813",
        "dc:description": "Uranium oxide catalysts supported upon γ-Al2O3 and amorphous and mesoporous silica have been tested for CO/O2 and NO/CO conversions. Pre-calcination is deleterious to catalysts on a mesoporous support due to extrusion of the active uranium phase into poorly dispersed uranium oxide particles. Developing the catalysts under CO/O2/He or CO/NO/He avoids extrusion and results in superior mesoporous catalysts (from uranyl nitrate precursor) which are comparable to Pt/Al2O3 catalysts. Chloride is found generally to be deleterious to catalyst performance. The exception to this in UCl4/γ-Al2O3 calcined at 873K for CO/O2. In this system, the total activity is correlated to the level of chlorine retention and average uranium phase crystallite size within the catalyst. The net rate expression for selective reduction of NO by CO over the best mesoporous catalyst is zero order in NO and proportional to [CO]1.4 in contrast to bulk U3O8 where the net rate depends upon [NO]. The activation energy (E (a)) and pre-exponential factors (ν) are highly correlated both to each other and the net dispersion of the UO2.2 phase recovered after catalysis; the most active systems are highly dispersed where the E (a) values are more than compensated for by higher values of ν.",
        "openArchiveArticle": "false",
        "prism:coverDate": "2006-02-15",
        "openaccessUserLicense": null,
        "prism:aggregationType": "Journal",
        "prism:url": "https://api.elsevier.com/content/article/pii/S1381116905006813",
        "dc:creator": [
          {
            "@_fa": "true",
            "$": "Campbell, Tom"
          },
          {
            "@_fa": "true",
            "$": "Newton, Mark A."
          },
          {
            "@_fa": "true",
            "$": "Boyd, Vicky"
          },
          {
            "@_fa": "true",
            "$": "Lee, Darren F."
          },
          {
            "@_fa": "true",
            "$": "Evans, John"
          }
        ],
        "link": [
          {
            "@_fa": "true",
            "@rel": "self",
            "@href": "https://api.elsevier.com/content/article/pii/S1381116905006813"
          },
          {
            "@_fa": "true",
            "@rel": "scidir",
            "@href": "https://www.sciencedirect.com/science/article/pii/S1381116905006813"
          }
        ],
        "dc:format": "application/json",
        "openaccessType": null,
        "pii": "S1381-1169(05)00681-3",
        "prism:volume": "245",
        "prism:publisher": "Elsevier B.V.",
        "dc:title": "Effects of precursor and support variation in the performance of uranium oxide catalysts for CO oxidation and selective reduction of NO",
        "prism:copyright": "Copyright © 2005 Elsevier B.V. All rights reserved.",
        "openaccess": "0",
        "prism:issn": "13811169",
        "prism:issueIdentifier": "1-2",
        "dcterms:subject": [
          {
            "@_fa": "true",
            "$": "Mesoporous"
          },
          {
            "@_fa": "true",
            "$": "Silica"
          },
          {
            "@_fa": "true",
            "$": "Uranium"
          },
          {
            "@_fa": "true",
            "$": "Oxides"
          },
          {
            "@_fa": "true",
            "$": "NO reduction"
          }
        ],
        "openaccessArticle": "false",
        "prism:publicationName": "Journal of Molecular Catalysis A: Chemical",
        "prism:number": "1-2",
        "openaccessSponsorType": null,
        "prism:pageRange": "62-68",
        "prism:endingPage": "68",
        "pubType": "fla",
        "prism:coverDisplayDate": "15 February 2006",
        "prism:doi": "10.1016/j.molcata.2005.09.030",
        "prism:startingPage": "62",
        "dc:identifier": "doi:10.1016/j.molcata.2005.09.030",
        "openaccessSponsorName": null
      },
      "objects": {
        "object": [
          {
            "@category": "thumbnail",
            "@height": "16",
            "@width": "157",
            "@_fa": "true",
            "$": "https://api.elsevier.com/content/object/eid/1-s2.0-S1381116905006813-si4.gif?httpAccept=%2A%2F%2A",
            "@multimediatype": "GIF image file",
            "@type": "ALTIMG",
            "@size": "616",
            "@ref": "si4",
            "@mimetype": "image/gif"
          },
          {
            "@category": "thumbnail",
            "@height": "16",
            "@width": "165",
            "@_fa": "true",
            "$": "https://api.elsevier.com/content/object/eid/1-s2.0-S1381116905006813-si3.gif?httpAccept=%2A%2F%2A",
            "@multimediatype": "GIF image file",
            "@type": "ALTIMG",
            "@size": "646",
            "@ref": "si3",
            "@mimetype": "image/gif"
          },
          {
            "@category": "thumbnail",
            "@height": "19",
            "@width": "121",
            "@_fa": "true",
            "$": "https://api.elsevier.com/content/object/eid/1-s2.0-S1381116905006813-si2.gif?httpAccept=%2A%2F%2A",
            "@multimediatype": "GIF image file",
            "@type": "ALTIMG",
            "@size": "542",
            "@ref": "si2",
            "@mimetype": "image/gif"
          },
          {
            "@category": "thumbnail",
            "@height": "19",
            "@width": "87",
            "@_fa": "true",
            "$": "https://api.elsevier.com/content/object/eid/1-s2.0-S1381116905006813-si1.gif?httpAccept=%2A%2F%2A",
            "@multimediatype": "GIF image file",
            "@type": "ALTIMG",
            "@size": "408",
            "@ref": "si1",
            "@mimetype": "image/gif"
          },
          {
            "@category": "standard",
            "@height": "425",
            "@width": "353",
            "@_fa": "true",
            "$": "https://api.elsevier.com/content/object/eid/1-s2.0-S1381116905006813-gr3.jpg?httpAccept=%2A%2F%2A",
            "@multimediatype": "JPEG image file",
            "@type": "IMAGE-DOWNSAMPLED",
            "@size": "20945",
            "@ref": "gr3",
            "@mimetype": "image/jpeg"
          },
          {
            "@category": "thumbnail",
            "@height": "93",
            "@width": "77",
            "@_fa": "true",
            "$": "https://api.elsevier.com/content/object/eid/1-s2.0-S1381116905006813-gr3.sml?httpAccept=%2A%2F%2A",
            "@multimediatype": "GIF image file",
            "@type": "IMAGE-THUMBNAIL",
            "@size": "1674",
            "@ref": "gr3",
            "@mimetype": "image/gif"
          },
          {
            "@category": "standard",
            "@height": "254",
            "@width": "355",
            "@_fa": "true",
            "$": "https://api.elsevier.com/content/object/eid/1-s2.0-S1381116905006813-gr12.jpg?httpAccept=%2A%2F%2A",
            "@multimediatype": "JPEG image file",
            "@type": "IMAGE-DOWNSAMPLED",
            "@size": "14874",
            "@ref": "gr12",
            "@mimetype": "image/jpeg"
          },
          {
            "@category": "thumbnail",
            "@height": "89",
            "@width": "125",
            "@_fa": "true",
            "$": "https://api.elsevier.com/content/object/eid/1-s2.0-S1381116905006813-gr12.sml?httpAccept=%2A%2F%2A",
            "@multimediatype": "GIF image file",
            "@type": "IMAGE-THUMBNAIL",
            "@size": "2100",
            "@ref": "gr12",
            "@mimetype": "image/gif"
          },
          {
            "@category": "standard",
            "@height": "340",
            "@width": "334",
            "@_fa": "true",
            "$": "https://api.elsevier.com/content/object/eid/1-s2.0-S1381116905006813-gr2.jpg?httpAccept=%2A%2F%2A",
            "@multimediatype": "JPEG image file",
            "@type": "IMAGE-DOWNSAMPLED",
            "@size": "35260",
            "@ref": "gr2",
            "@mimetype": "image/jpeg"
          },
          {
            "@category": "thumbnail",
            "@height": "94",
            "@width": "92",
            "@_fa": "true",
            "$": "https://api.elsevier.com/content/object/eid/1-s2.0-S1381116905006813-gr2.sml?httpAccept=%2A%2F%2A",
            "@multimediatype": "GIF image file",
            "@type": "IMAGE-THUMBNAIL",
            "@size": "3227",
            "@ref": "gr2",
            "@mimetype": "image/gif"
          },
          {
            "@category": "standard",
            "@height": "426",
            "@width": "330",
            "@_fa": "true",
            "$": "https://api.elsevier.com/content/object/eid/1-s2.0-S1381116905006813-gr6.jpg?httpAccept=%2A%2F%2A",
            "@multimediatype": "JPEG image file",
            "@type": "IMAGE-DOWNSAMPLED",
            "@size": "32725",
            "@ref": "gr6",
            "@mimetype": "image/jpeg"
          },
          {
            "@category": "thumbnail",
            "@height": "93",
            "@width": "72",
            "@_fa": "true",
            "$": "https://api.elsevier.com/content/object/eid/1-s2.0-S1381116905006813-gr6.sml?httpAccept=%2A%2F%2A",
            "@multimediatype": "GIF image file",
            "@type": "IMAGE-THUMBNAIL",
            "@size": "2652",
            "@ref": "gr6",
            "@mimetype": "image/gif"
          },
          {
            "@category": "standard",
            "@height": "335",
            "@width": "351",
            "@_fa": "true",
            "$": "https://api.elsevier.com/content/object/eid/1-s2.0-S1381116905006813-gr9.jpg?httpAccept=%2A%2F%2A",
            "@multimediatype": "JPEG image file",
            "@type": "IMAGE-DOWNSAMPLED",
            "@size": "12995",
            "@ref": "gr9",
            "@mimetype": "image/jpeg"
          },
          {
            "@category": "thumbnail",
            "@height": "94",
            "@width": "98",
            "@_fa": "true",
            "$": "https://api.elsevier.com/content/object/eid/1-s2.0-S1381116905006813-gr9.sml?httpAccept=%2A%2F%2A",
            "@multimediatype": "GIF image file",
            "@type": "IMAGE-THUMBNAIL",
            "@size": "1710",
            "@ref": "gr9",
            "@mimetype": "image/gif"
          },
          {
            "@category": "standard",
            "@height": "285",
            "@width": "345",
            "@_fa": "true",
            "$": "https://api.elsevier.com/content/object/eid/1-s2.0-S1381116905006813-gr4.jpg?httpAccept=%2A%2F%2A",
            "@multimediatype": "JPEG image file",
            "@type": "IMAGE-DOWNSAMPLED",
            "@size": "14948",
            "@ref": "gr4",
            "@mimetype": "image/jpeg"
          },
          {
            "@category": "thumbnail",
            "@height": "93",
            "@width": "113",
            "@_fa": "true",
            "$": "https://api.elsevier.com/content/object/eid/1-s2.0-S1381116905006813-gr4.sml?httpAccept=%2A%2F%2A",
            "@multimediatype": "GIF image file",
            "@type": "IMAGE-THUMBNAIL",
            "@size": "1949",
            "@ref": "gr4",
            "@mimetype": "image/gif"
          },
          {
            "@category": "standard",
            "@height": "363",
            "@width": "617",
            "@_fa": "true",
            "$": "https://api.elsevier.com/content/object/eid/1-s2.0-S1381116905006813-gr11.jpg?httpAccept=%2A%2F%2A",
            "@multimediatype": "JPEG image file",
            "@type": "IMAGE-DOWNSAMPLED",
            "@size": "24511",
            "@ref": "gr11",
            "@mimetype": "image/jpeg"
          },
          {
            "@category": "thumbnail",
            "@height": "74",
            "@width": "125",
            "@_fa": "true",
            "$": "https://api.elsevier.com/content/object/eid/1-s2.0-S1381116905006813-gr11.sml?httpAccept=%2A%2F%2A",
            "@multimediatype": "GIF image file",
            "@type": "IMAGE-THUMBNAIL",
            "@size": "1754",
            "@ref": "gr11",
            "@mimetype": "image/gif"
          },
          {
            "@category": "standard",
            "@height": "323",
            "@width": "354",
            "@_fa": "true",
            "$": "https://api.elsevier.com/content/object/eid/1-s2.0-S1381116905006813-gr1.jpg?httpAccept=%2A%2F%2A",
            "@multimediatype": "JPEG image file",
            "@type": "IMAGE-DOWNSAMPLED",
            "@size": "44720",
            "@ref": "gr1",
            "@mimetype": "image/jpeg"
          },
          {
            "@category": "thumbnail",
            "@height": "93",
            "@width": "102",
            "@_fa": "true",
            "$": "https://api.elsevier.com/content/object/eid/1-s2.0-S1381116905006813-gr1.sml?httpAccept=%2A%2F%2A",
            "@multimediatype": "GIF image file",
            "@type": "IMAGE-THUMBNAIL",
            "@size": "3923",
            "@ref": "gr1",
            "@mimetype": "image/gif"
          },
          {
            "@category": "standard",
            "@height": "401",
            "@width": "330",
            "@_fa": "true",
            "$": "https://api.elsevier.com/content/object/eid/1-s2.0-S1381116905006813-gr5.jpg?httpAccept=%2A%2F%2A",
            "@multimediatype": "JPEG image file",
            "@type": "IMAGE-DOWNSAMPLED",
            "@size": "27161",
            "@ref": "gr5",
            "@mimetype": "image/jpeg"
          },
          {
            "@category": "thumbnail",
            "@height": "94",
            "@width": "77",
            "@_fa": "true",
            "$": "https://api.elsevier.com/content/object/eid/1-s2.0-S1381116905006813-gr5.sml?httpAccept=%2A%2F%2A",
            "@multimediatype": "GIF image file",
            "@type": "IMAGE-THUMBNAIL",
            "@size": "2316",
            "@ref": "gr5",
            "@mimetype": "image/gif"
          },
          {
            "@category": "standard",
            "@height": "254",
            "@width": "343",
            "@_fa": "true",
            "$": "https://api.elsevier.com/content/object/eid/1-s2.0-S1381116905006813-gr8.jpg?httpAccept=%2A%2F%2A",
            "@multimediatype": "JPEG image file",
            "@type": "IMAGE-DOWNSAMPLED",
            "@size": "13491",
            "@ref": "gr8",
            "@mimetype": "image/jpeg"
          },
          {
            "@category": "thumbnail",
            "@height": "92",
            "@width": "125",
            "@_fa": "true",
            "$": "https://api.elsevier.com/content/object/eid/1-s2.0-S1381116905006813-gr8.sml?httpAccept=%2A%2F%2A",
            "@multimediatype": "GIF image file",
            "@type": "IMAGE-THUMBNAIL",
            "@size": "2011",
            "@ref": "gr8",
            "@mimetype": "image/gif"
          },
          {
            "@category": "standard",
            "@height": "410",
            "@width": "339",
            "@_fa": "true",
            "$": "https://api.elsevier.com/content/object/eid/1-s2.0-S1381116905006813-gr10.jpg?httpAccept=%2A%2F%2A",
            "@multimediatype": "JPEG image file",
            "@type": "IMAGE-DOWNSAMPLED",
            "@size": "16309",
            "@ref": "gr10",
            "@mimetype": "image/jpeg"
          },
          {
            "@category": "thumbnail",
            "@height": "93",
            "@width": "77",
            "@_fa": "true",
            "$": "https://api.elsevier.com/content/object/eid/1-s2.0-S1381116905006813-gr10.sml?httpAccept=%2A%2F%2A",
            "@multimediatype": "GIF image file",
            "@type": "IMAGE-THUMBNAIL",
            "@size": "1584",
            "@ref": "gr10",
            "@mimetype": "image/gif"
          },
          {
            "@category": "standard",
            "@height": "323",
            "@width": "355",
            "@_fa": "true",
            "$": "https://api.elsevier.com/content/object/eid/1-s2.0-S1381116905006813-gr7.jpg?httpAccept=%2A%2F%2A",
            "@multimediatype": "JPEG image file",
            "@type": "IMAGE-DOWNSAMPLED",
            "@size": "13747",
            "@ref": "gr7",
            "@mimetype": "image/jpeg"
          },
          {
            "@category": "thumbnail",
            "@height": "93",
            "@width": "102",
            "@_fa": "true",
            "$": "https://api.elsevier.com/content/object/eid/1-s2.0-S1381116905006813-gr7.sml?httpAccept=%2A%2F%2A",
            "@multimediatype": "GIF image file",
            "@type": "IMAGE-THUMBNAIL",
            "@size": "1728",
            "@ref": "gr7",
            "@mimetype": "image/gif"
          },
          {
            "@category": "standard",
            "@height": "240",
            "@width": "262",
            "@_fa": "true",
            "$": "https://api.elsevier.com/content/object/eid/1-s2.0-S1381116905006813-fx1.jpg?httpAccept=%2A%2F%2A",
            "@multimediatype": "JPEG image file",
            "@type": "IMAGE-DOWNSAMPLED",
            "@size": "22203",
            "@ref": "fx1",
            "@mimetype": "image/jpeg"
          },
          {
            "@category": "thumbnail",
            "@height": "93",
            "@width": "102",
            "@_fa": "true",
            "$": "https://api.elsevier.com/content/object/eid/1-s2.0-S1381116905006813-fx1.sml?httpAccept=%2A%2F%2A",
            "@multimediatype": "GIF image file",
            "@type": "IMAGE-THUMBNAIL",
            "@size": "1942",
            "@ref": "fx1",
            "@mimetype": "image/gif"
          },
          {
            "@category": "standard",
            "@height": "408",
            "@width": "345",
            "@_fa": "true",
            "$": "https://api.elsevier.com/content/object/eid/1-s2.0-S1381116905006813-gr13.gif?httpAccept=%2A%2F%2A",
            "@multimediatype": "GIF image file",
            "@type": "IMAGE-DOWNSAMPLED",
            "@size": "4458",
            "@ref": "gr13",
            "@mimetype": "image/gif"
          },
          {
            "@category": "thumbnail",
            "@height": "93",
            "@width": "79",
            "@_fa": "true",
            "$": "https://api.elsevier.com/content/object/eid/1-s2.0-S1381116905006813-gr13.sml?httpAccept=%2A%2F%2A",
            "@multimediatype": "GIF image file",
            "@type": "IMAGE-THUMBNAIL",
            "@size": "698",
            "@ref": "gr13",
            "@mimetype": "image/gif"
          }
        ]
      },
      "link": {
        "@rel": "abstract",
        "@href": "https://api.elsevier.com/content/abstract/scopus_id/31544431986"
      }
    }
  }
}