{
  "metadata": {
    "title": "MgAl<ce:inf loc=post>2</ce:inf>O<ce:inf loc=post>4</ce:inf> spinel particles prepared by metal–chitosan complexation route and used as catalyst support for direct decomposition of methane",
    "authors": "; ; ",
    "journal": "Journal of Molecular Catalysis A: Chemical",
    "date": "2013-04-30",
    "doi": "10.1016/j.molcata.2012.12.007",
    "abstract": "",
    "uri": "https://api.elsevier.com/content/article/pii/S138111691200413X",
    "pii": "S138111691200413X"
  },
  "fulltext": {
    "full-text-retrieval-response": {
      "scopus-eid": "2-s2.0-84875141372",
      "originalText": "serial JL 271358 291210 291744 291790 291809 31 Journal of Molecular Catalysis A: Chemical JOURNALMOLECULARCATALYSISACHEMICAL 2012-12-20 2012-12-20 2013-02-26T13:37:50 1-s2.0-S138111691200413X S1381-1169(12)00413-X S138111691200413X 10.1016/j.molcata.2012.12.007 S300 S300.1 FULL-TEXT 1-s2.0-S1381116913X00020 2015-05-15T05:56:33.607047-04:00 0 0 20130401 20130430 2013 2012-12-20T00:00:00Z articleinfo crossmark dco dateupdated tomb dateloaded datesearch indexeddate volumelist yearnav absattachment articletitlenorm authfirstinitialnorm authfirstsurnamenorm cid cids contenttype copyright dateloadedtxt docsubtype doctype doi eid ewtransactionid hubeid issn issnnorm itemstage itemtransactionid itemweight openaccess openarchive pg pgfirst pglast pii piinorm pubdateend pubdatestart pubdatetxt pubyr sortorder srctitle srctitlenorm srctype subheadings suppl volfirst volissue webpdf webpdfpagecount figure table body affil articletitle auth authfirstini authfull authkeywords authlast primabst ref specialabst alllist content subj ssids 1381-1169 13811169 false 370 370 C Volume 370 6 22 27 22 27 201304 April 2013 2013-04-01 2013-04-30 2013 article fla Copyright © 2012 Elsevier B.V. All rights reserved. MGAL2O4SPINELPARTICLESPREPAREDBYMETALCHITOSANCOMPLEXATIONROUTEUSEDCATALYSTSUPPORTFORDIRECTDECOMPOSITIONMETHANE NUERNBERG G 1 Introduction 2 Experimental 2.1 Synthesis of MgAl2O4 support 2.2 Preparation of the catalyst 2.3 Catalytic tests 2.4 Characterization 3 Results and discussion 3.1 Catalyst characterization 3.2 Catalyst performance 3.3 Characterization of deposited carbons 4 Conclusions References ECHEGOYEN 2007 150 157 Y XIANG 2009 405 409 X MOLINER 2008 1719 1728 R SUELVES 2005 1555 1567 I CHEN 2004 179 186 J ERMAKOVA 2000 61 70 M LI 2000 1188 1194 Y WANG 2004 20273 20277 H ALMEIDA 2006 328 335 R TAKENAKA 2004 520 531 S NUERNBERG 2012 409 414 G TAKENAKA 2003 79 87 S CHAI 2009 294 299 S LI 2006 412 424 Y NUERNBERG 2011 465 469 G KUDUS 2011 2784 2788 M SPIESS 2004 35 45 F CHOUDHARY 2001 9 18 T OTSUKA 2000 261 268 K CHEN 2008 148 154 J ASHOK 2007 809 814 J SARASWAT 2011 13352 13360 S SUELVES 2009 35 42 I ASHOK 2008 4809 4818 J RIVAS 2008 265 275 M TAKENAKA 2001 101 110 S KIM 2000 109 113 W LI 2001 481 489 J PING 2001 1417 1430 L SEHESTED 2004 432 443 J GADALLA 1988 3049 3062 A FOLETTO 2006 531 534 E NUERNBERG 2012 211 214 G CULLITY 2001 B ELEMENTSXRAYDIFFRACTION RUCKENSTEIN 2001 99 105 E TOMISHIGE 1999 91 103 K PARK 2010 5673 5680 D OZDEMIR 2010 12147 12160 H FIGUEIREDO 1989 J CATALISEHETEROGENEA ZANGOUEI 2010 97 102 M SIANGPIAO 2007 1656 1664 C RUCKENSTEIN 2001 99 105 E VILLACAMPA 2003 363 383 J CHEN 2006 1808 1820 C WU 2009 1591 1595 C GALLEGO 2010 365 371 G NUERNBERG 2013 G SPRINGERLINKCARBONNANOSTRUCTURES FIGUEIREDO 2010 9795 9800 J HSIEH 2009 685 693 C ZHOU 2007 210 216 M GUEVARA 2010 3509 3521 J SINHA 1990 10845 10847 K NUERNBERGX2013X22 NUERNBERGX2013X22X27 NUERNBERGX2013X22XG NUERNBERGX2013X22X27XG item S1381-1169(12)00413-X S138111691200413X 1-s2.0-S138111691200413X 10.1016/j.molcata.2012.12.007 271358 2013-02-26T09:39:39.889526-05:00 2013-04-01 2013-04-30 1-s2.0-S138111691200413X-main.pdf https://s3.amazonaws.com/prod-ucs-content-store-us-east/content/pii:S138111691200413X/MAIN/application/pdf/526995c32b5470a4139d7f5700387289/main.pdf https://s3-eu-west-1.amazonaws.com/prod-ucs-content-store-eu-west/content/pii:S138111691200413X/MAIN/application/pdf/526995c32b5470a4139d7f5700387289/main.pdf main.pdf pdf true 631237 MAIN 6 1-s2.0-S138111691200413X-main_1.png https://s3-eu-west-1.amazonaws.com/prod-ucs-content-store-eu-west/content/pii:S138111691200413X/PREVIEW/image/png/c27e9c36e8d1785d96854259406640ba/main_1.png https://s3.amazonaws.com/prod-ucs-content-store-us-east/content/pii:S138111691200413X/PREVIEW/image/png/c27e9c36e8d1785d96854259406640ba/main_1.png main_1.png png 61692 849 656 IMAGE-WEB-PDF 1 1-s2.0-S138111691200413X-fx1_lrg.jpg https://s3.amazonaws.com/prod-ucs-content-store-us-east/content/pii:S138111691200413X/fx1/HIGHRES/image/jpeg/bb31c1917298101077ea601c30aadaf3/fx1_lrg.jpg https://s3-eu-west-1.amazonaws.com/prod-ucs-content-store-eu-west/content/pii:S138111691200413X/fx1/HIGHRES/image/jpeg/bb31c1917298101077ea601c30aadaf3/fx1_lrg.jpg fx1 true fx1_lrg.jpg jpg 188350 886 2018 IMAGE-HIGH-RES 1-s2.0-S138111691200413X-gr5_lrg.jpg https://s3.amazonaws.com/prod-ucs-content-store-us-east/content/pii:S138111691200413X/gr5/HIGHRES/image/jpeg/7584d7693b3cb2d4f02252188fe0ddc4/gr5_lrg.jpg https://s3-eu-west-1.amazonaws.com/prod-ucs-content-store-eu-west/content/pii:S138111691200413X/gr5/HIGHRES/image/jpeg/7584d7693b3cb2d4f02252188fe0ddc4/gr5_lrg.jpg gr5 gr5_lrg.jpg jpg 591163 2175 2897 IMAGE-HIGH-RES 1-s2.0-S138111691200413X-gr4_lrg.jpg https://s3.amazonaws.com/prod-ucs-content-store-us-east/content/pii:S138111691200413X/gr4/HIGHRES/image/jpeg/acd147d3e9b7b5cec55a1a1b88b79d21/gr4_lrg.jpg https://s3-eu-west-1.amazonaws.com/prod-ucs-content-store-eu-west/content/pii:S138111691200413X/gr4/HIGHRES/image/jpeg/acd147d3e9b7b5cec55a1a1b88b79d21/gr4_lrg.jpg gr4 gr4_lrg.jpg jpg 193229 1301 1665 IMAGE-HIGH-RES 1-s2.0-S138111691200413X-gr1_lrg.jpg https://s3.amazonaws.com/prod-ucs-content-store-us-east/content/pii:S138111691200413X/gr1/HIGHRES/image/jpeg/f9bedbf46b289aaac6ede5a583260321/gr1_lrg.jpg https://s3-eu-west-1.amazonaws.com/prod-ucs-content-store-eu-west/content/pii:S138111691200413X/gr1/HIGHRES/image/jpeg/f9bedbf46b289aaac6ede5a583260321/gr1_lrg.jpg gr1 gr1_lrg.jpg jpg 113895 1218 1500 IMAGE-HIGH-RES 1-s2.0-S138111691200413X-gr6_lrg.jpg https://s3.amazonaws.com/prod-ucs-content-store-us-east/content/pii:S138111691200413X/gr6/HIGHRES/image/jpeg/7d9c930b3ce8062c205be805ed5020e7/gr6_lrg.jpg https://s3-eu-west-1.amazonaws.com/prod-ucs-content-store-eu-west/content/pii:S138111691200413X/gr6/HIGHRES/image/jpeg/7d9c930b3ce8062c205be805ed5020e7/gr6_lrg.jpg gr6 gr6_lrg.jpg jpg 186271 1342 1250 IMAGE-HIGH-RES 1-s2.0-S138111691200413X-gr3_lrg.jpg https://s3.amazonaws.com/prod-ucs-content-store-us-east/content/pii:S138111691200413X/gr3/HIGHRES/image/jpeg/cd937b547984a8c59cb22ad9761624f1/gr3_lrg.jpg https://s3-eu-west-1.amazonaws.com/prod-ucs-content-store-eu-west/content/pii:S138111691200413X/gr3/HIGHRES/image/jpeg/cd937b547984a8c59cb22ad9761624f1/gr3_lrg.jpg gr3 gr3_lrg.jpg jpg 173972 1192 1500 IMAGE-HIGH-RES 1-s2.0-S138111691200413X-gr2_lrg.jpg https://s3.amazonaws.com/prod-ucs-content-store-us-east/content/pii:S138111691200413X/gr2/HIGHRES/image/jpeg/bb3320eca32e608ed9ef296623eb9ff8/gr2_lrg.jpg https://s3-eu-west-1.amazonaws.com/prod-ucs-content-store-eu-west/content/pii:S138111691200413X/gr2/HIGHRES/image/jpeg/bb3320eca32e608ed9ef296623eb9ff8/gr2_lrg.jpg gr2 gr2_lrg.jpg jpg 327061 2616 1667 IMAGE-HIGH-RES 1-s2.0-S138111691200413X-fx1.jpg https://s3.amazonaws.com/prod-ucs-content-store-us-east/content/pii:S138111691200413X/fx1/DOWNSAMPLED/image/jpeg/bdb1733126b3105a54ef47141a39e47e/fx1.jpg https://s3-eu-west-1.amazonaws.com/prod-ucs-content-store-eu-west/content/pii:S138111691200413X/fx1/DOWNSAMPLED/image/jpeg/bdb1733126b3105a54ef47141a39e47e/fx1.jpg fx1 true fx1.jpg jpg 23749 200 456 IMAGE-DOWNSAMPLED 1-s2.0-S138111691200413X-gr5.jpg https://s3.amazonaws.com/prod-ucs-content-store-us-east/content/pii:S138111691200413X/gr5/DOWNSAMPLED/image/jpeg/64c4558766f842001a9bef85765d0352/gr5.jpg https://s3-eu-west-1.amazonaws.com/prod-ucs-content-store-eu-west/content/pii:S138111691200413X/gr5/DOWNSAMPLED/image/jpeg/64c4558766f842001a9bef85765d0352/gr5.jpg gr5 gr5.jpg jpg 69393 491 654 IMAGE-DOWNSAMPLED 1-s2.0-S138111691200413X-gr4.jpg https://s3.amazonaws.com/prod-ucs-content-store-us-east/content/pii:S138111691200413X/gr4/DOWNSAMPLED/image/jpeg/55b88fabff3ca72f20f43add807024c0/gr4.jpg https://s3-eu-west-1.amazonaws.com/prod-ucs-content-store-eu-west/content/pii:S138111691200413X/gr4/DOWNSAMPLED/image/jpeg/55b88fabff3ca72f20f43add807024c0/gr4.jpg gr4 gr4.jpg jpg 35975 294 376 IMAGE-DOWNSAMPLED 1-s2.0-S138111691200413X-gr1.jpg https://s3.amazonaws.com/prod-ucs-content-store-us-east/content/pii:S138111691200413X/gr1/DOWNSAMPLED/image/jpeg/557cc736f38fa4cffb3cc4122baa3bd7/gr1.jpg https://s3-eu-west-1.amazonaws.com/prod-ucs-content-store-eu-west/content/pii:S138111691200413X/gr1/DOWNSAMPLED/image/jpeg/557cc736f38fa4cffb3cc4122baa3bd7/gr1.jpg gr1 gr1.jpg jpg 26808 275 339 IMAGE-DOWNSAMPLED 1-s2.0-S138111691200413X-gr6.jpg https://s3.amazonaws.com/prod-ucs-content-store-us-east/content/pii:S138111691200413X/gr6/DOWNSAMPLED/image/jpeg/019c71b374a0d4807e3a4c660074f762/gr6.jpg https://s3-eu-west-1.amazonaws.com/prod-ucs-content-store-eu-west/content/pii:S138111691200413X/gr6/DOWNSAMPLED/image/jpeg/019c71b374a0d4807e3a4c660074f762/gr6.jpg gr6 gr6.jpg jpg 21247 303 282 IMAGE-DOWNSAMPLED 1-s2.0-S138111691200413X-gr3.jpg https://s3.amazonaws.com/prod-ucs-content-store-us-east/content/pii:S138111691200413X/gr3/DOWNSAMPLED/image/jpeg/9fa9ca4fb16401cf7527581b6ee23e09/gr3.jpg https://s3-eu-west-1.amazonaws.com/prod-ucs-content-store-eu-west/content/pii:S138111691200413X/gr3/DOWNSAMPLED/image/jpeg/9fa9ca4fb16401cf7527581b6ee23e09/gr3.jpg gr3 gr3.jpg jpg 21581 269 339 IMAGE-DOWNSAMPLED 1-s2.0-S138111691200413X-gr2.jpg https://s3.amazonaws.com/prod-ucs-content-store-us-east/content/pii:S138111691200413X/gr2/DOWNSAMPLED/image/jpeg/0b8e12151c7936689c0470593922d027/gr2.jpg https://s3-eu-west-1.amazonaws.com/prod-ucs-content-store-eu-west/content/pii:S138111691200413X/gr2/DOWNSAMPLED/image/jpeg/0b8e12151c7936689c0470593922d027/gr2.jpg gr2 gr2.jpg jpg 38671 590 376 IMAGE-DOWNSAMPLED 1-s2.0-S138111691200413X-fx1.sml https://s3.amazonaws.com/prod-ucs-content-store-us-east/content/pii:S138111691200413X/fx1/THUMBNAIL/image/gif/fdd1ab19090d6719537d6062d4e90fa9/fx1.sml https://s3-eu-west-1.amazonaws.com/prod-ucs-content-store-eu-west/content/pii:S138111691200413X/fx1/THUMBNAIL/image/gif/fdd1ab19090d6719537d6062d4e90fa9/fx1.sml fx1 true fx1.sml sml 4387 96 219 IMAGE-THUMBNAIL 1-s2.0-S138111691200413X-gr5.sml https://s3.amazonaws.com/prod-ucs-content-store-us-east/content/pii:S138111691200413X/gr5/THUMBNAIL/image/gif/0eec753cb98178590207f5b9893760e6/gr5.sml https://s3-eu-west-1.amazonaws.com/prod-ucs-content-store-eu-west/content/pii:S138111691200413X/gr5/THUMBNAIL/image/gif/0eec753cb98178590207f5b9893760e6/gr5.sml gr5 gr5.sml sml 8219 164 218 IMAGE-THUMBNAIL 1-s2.0-S138111691200413X-gr4.sml https://s3.amazonaws.com/prod-ucs-content-store-us-east/content/pii:S138111691200413X/gr4/THUMBNAIL/image/gif/172a0c2c8a18e0c08373ee87f1a1619a/gr4.sml https://s3-eu-west-1.amazonaws.com/prod-ucs-content-store-eu-west/content/pii:S138111691200413X/gr4/THUMBNAIL/image/gif/172a0c2c8a18e0c08373ee87f1a1619a/gr4.sml gr4 gr4.sml sml 4336 164 210 IMAGE-THUMBNAIL 1-s2.0-S138111691200413X-gr1.sml https://s3.amazonaws.com/prod-ucs-content-store-us-east/content/pii:S138111691200413X/gr1/THUMBNAIL/image/gif/e63db14904759e90439eb1b04cb2115d/gr1.sml https://s3-eu-west-1.amazonaws.com/prod-ucs-content-store-eu-west/content/pii:S138111691200413X/gr1/THUMBNAIL/image/gif/e63db14904759e90439eb1b04cb2115d/gr1.sml gr1 gr1.sml sml 3285 164 202 IMAGE-THUMBNAIL 1-s2.0-S138111691200413X-gr6.sml https://s3.amazonaws.com/prod-ucs-content-store-us-east/content/pii:S138111691200413X/gr6/THUMBNAIL/image/gif/5a82b57771f1e8cf45d51d2d6014d36b/gr6.sml https://s3-eu-west-1.amazonaws.com/prod-ucs-content-store-eu-west/content/pii:S138111691200413X/gr6/THUMBNAIL/image/gif/5a82b57771f1e8cf45d51d2d6014d36b/gr6.sml gr6 gr6.sml sml 4829 163 152 IMAGE-THUMBNAIL 1-s2.0-S138111691200413X-gr3.sml https://s3.amazonaws.com/prod-ucs-content-store-us-east/content/pii:S138111691200413X/gr3/THUMBNAIL/image/gif/a205fc1ae6b5bff09b834550d76ab506/gr3.sml https://s3-eu-west-1.amazonaws.com/prod-ucs-content-store-eu-west/content/pii:S138111691200413X/gr3/THUMBNAIL/image/gif/a205fc1ae6b5bff09b834550d76ab506/gr3.sml gr3 gr3.sml sml 5151 164 206 IMAGE-THUMBNAIL 1-s2.0-S138111691200413X-gr2.sml https://s3.amazonaws.com/prod-ucs-content-store-us-east/content/pii:S138111691200413X/gr2/THUMBNAIL/image/gif/f58327d5d09d835517fe90c26f187c1e/gr2.sml https://s3-eu-west-1.amazonaws.com/prod-ucs-content-store-eu-west/content/pii:S138111691200413X/gr2/THUMBNAIL/image/gif/f58327d5d09d835517fe90c26f187c1e/gr2.sml gr2 gr2.sml sml 3437 163 104 IMAGE-THUMBNAIL MOLCAA 8614 S1381-1169(12)00413-X 10.1016/j.molcata.2012.12.007 Elsevier B.V. Fig. 1 Diffractograms of the support and catalyst, and reference MgAl2O4 (JCPDS Card No. 77-1203). Fig. 2 (a) TPR analysis, (b) nitrogen adsorption–desorption isotherms and (insert) pore size distribution of Ni/MgAl2O4 catalyst. Fig. 3 Methane decomposition over Ni/MgAl2O4 catalyst at reduction temperature of 700°C, with different reaction temperatures (550 and 700°C) and reduction times (1 and 2h). Fig. 4 Methane decomposition over Ni/MgAl2O4 catalyst at reaction temperature of 550°C, under different conditions of reduction temperature (550 and 700°C) and time (1 and 2h). Fig. 5 SEM micrograph of multi-walled nanotubes formed by methane decomposition over NiMgAl2O4 (a) after reaction at 550°C and reduction at 700°C/1h, and TEM micrographs of the same catalyst after reaction at 550°C and reduction, (b) at 550°C/1h and (c) at 700°C/2h. Fig. 6 Raman spectra for the carbon deposited over the sample after catalytic decomposition under different experimental conditions: (a) reaction at 550°C and reduction at 550°C/2h, (b) reaction at 550°C and reduction at 700°C/2h, (c) reaction at 550°C and reduction at 550°C/1h, (d) reaction at 700°C and reduction at 700°C/1h and, (e) reaction at 550°C and reduction at 700°C/1h. Table 1 Mass loss of the Ni/MgAl2O4 sample after methane decomposition under different experimental conditions. Entry Operational conditions TGA T R a (°C) T Red a (°C)/time (h) Mass loss (%) Temperature (°C) 1 550 700/1 10 607 2 550 700/2 3–43 406–640 3 700 700/1 30 583 4 700 700/2 19 583 5 550 550/1 29 613 6 550 550/2 37 609 a T R, reaction temperature; T Red, reduction temperature. Table 2 Relative intensity of the D band to the G band (I D/I G) in Raman spectra for carbon nanofibers applying different operational conditions. Operational conditions T R a (°C) T Red a (°C)/time (h) I D/I G ratio 550 700/1 0.91 550 700/2 0.88 700 700/1 0.48 550 550/1 1.15 550 550/2 0.84 a T R, reaction temperature; T Red, reduction temperature. MgAl2O4 spinel particles prepared by metal–chitosan complexation route and used as catalyst support for direct decomposition of methane Giselle B. Nuernberg a Edson L. Foletto b ⁎ Luiz F.D. Probst a Neftalí L.V. Carreño c Marcelo A. Moreira d a Department of Chemistry, Federal University of Santa Catarina, 88040-900 Florianópolis, Brazil b Department of Chemical Engineering, Federal University of Santa Maria, 97150-900 Santa Maria, Brazil c Technology Development Center, Federal University of Pelotas, 96010-900 Pelotas, Brazil d Department of Soil and Natural Resources, State University of Santa Catarina, 88520-000 Lages, Brazil ⁎ Corresponding author. Tel.: +55 55 3220 8448; fax: +55 55 3220 8030. Graphical abstract Highlights ► MgAl2O4 spinel prepared by metal–chitosan complexation route was used as catalyst support. ► The Ni/MgAl2O4 was evaluated as a catalyst in the methane decomposition reaction. ► In the methane decomposition, carbon byproduct was mainly deposited as multi-walled nanotubes. Magnesium aluminate particles were prepared from biopolymer (chitosan) and Al–Mg solutions by the metal–chitosan complexation method. The MgAl2O4 spinel obtained was used to prepare a Ni catalyst support. The Ni/MgAl2O4 (20% Ni, w/w) was evaluated as a catalyst in the methane decomposition reaction. The influence of the reaction temperature and the catalyst reduction temperature and time on the methane decomposition, as well as on the properties of the carbon produced, was investigated. The materials were characterized using XRD, SEM, TEM, TPR, TGA and Raman spectroscopy analyses. It was observed that the catalytic behavior was dependent on the reaction operating conditions employed. Under the operating conditions used in this study the carbon byproduct is mainly deposited as multi-walled nanotubes (MWNTs). Keywords Methane decomposition MgAl2O4 Metal–chitosan complexation Carbon nanotubes MWNTs 1 Introduction Methane decomposition (CH4 →C+2H2) has attracted attention in recent years because it produces pure CO and CO2-free hydrogen [1–5]. In addition, this reaction process also results in the generation of very important carbon materials as byproducts (carbon nanotubes and nanofibers), which have gained considerable attention due to their excellent properties and potential applications [6–9]. The structure of the nanocarbon formed may be affected by a series of parameters including the type of catalytic support [10], concentration of methane in the feed [11], reaction temperature of methane decomposition [12], amount of catalyst [13], textural properties and size of the catalyst particles [14], metal catalyst reduction temperature and time [15], catalyst calcination temperature [16] and methane flow rate [17]. Among the various direct decomposition catalysts, it is well known that Ni is one of the most effective [18,19]. This metal has been supported over different materials (Al2O3, TiO2, ZrO2, MgO, SiO2, MgO·SiO2, H+-ZSM-5, USY, MCM-22, MCM-41, NiCuAl, LaNiO3) and the effect of these supports on the methane decomposition reaction has been examined [20–26]. Herein, we report a simple and versatile procedure for the synthesis of metal oxide particles (MgAl2O4) with high surface area and large pore volume containing mainly mesopores. The method consists of obtaining a hybrid compound of aluminum–magnesium hydroxides and the biopolymer chitosan. Through the polymer elimination by thermal treatment a porous MgAl2O4 particle is obtained. This material has received a great deal of attention as a technologically important material on account of its attractive properties such as high melting point (2135°C), high resistance to chemical attack, good mechanical strength from room temperature to high temperatures, low dielectric constant, excellent optical properties, and low thermal expansion [27–29]. Due to its resistance to sintering, magnesium aluminate spinel has been used recently as a catalyst support for the steam reforming of methane [30–32]. However, a review of the results reported in the literature shows that the use of this material as a metal support for the direct decomposition of methane is scarce. We have recently shown that magnesium aluminate spinel (MgAl2O4) could be used as a metal support for this specific reaction promoting decomposition of CH4 in low temperatures for this reaction, as well as support Al2O3, SiO2 and MgO, fairly studied in literature, and the formation of carbon nanotubes with high degree of graphitization deposited on the surface of this material after the tests [11,15]. In this context, the spinel has been synthesized through the hydrolysis of metallic alkoxides of Mg2+ and Al3+ with further calcination. Our studies have revealed that the reduction temperature for the metal/catalysts as well as the concentration of methane in the feed have significant effects on the methane decomposition and quality of the CNTs obtained. The focus of this study was firstly to obtain MgAl2O4 via the metal–chitosan complexation method and subsequently to produce the Ni–MgAl2O4 catalyst by wet impregnation with an aqueous solution of nickel salt. The behavior of catalyst was evaluated under different conditions of reaction temperature and reduction temperature and time, in the direct decomposition of methane. Similar work was done by our research group in an article published recently [11], using the same catalyst, but prepared by sol–gel method. The characterization of the deposited carbon after the catalytic tests was carried out and the results are reported herein. 2 Experimental 2.1 Synthesis of MgAl2O4 support The synthesis procedure used in this study was similar to that developed previously by Nuernberg et al. [33]. For the synthesis of the support by the metal–chitosan complexation route, 5g of chitosan polymer [(C6H11O4N) n ] (Purifarma) were dissolved in 167mL of acetic acid solution (5, v/v), 5.21g of Mg(NO)3·6H2O were dissolved in 6mL distilled water and 21.35g of Al(NO3)3·9H2O were dissolved in 50mL distilled water. The Mg and Al aqueous solutions were then added to the polymer solution with magnetic stirring. The chitosan monomer to Mg and Al molar ratio was 1.5:1.0:1.4. The Mg–Al–chitosan solution was added dropwise with a peristaltic pump to a NH4OH solution (50%, v/v) under vigorous stirring. After adding the solutions, the system was kept under stirring for 3h to complete the gelification process. The gel spheres were separated from the solution and further dried at ambient temperature for 48h. This material was calcined in an oxidizing atmosphere (air) at 700°C, for 4h, to form the spinel phase. This material was employed as a support in the preparation of the nickel catalyst. 2.2 Preparation of the catalyst To obtain the Ni catalyst supported on MgAl2O4, nickel was impregnated through wet impregnations with aqueous solutions of nickel nitrate hexahydrate, where the nominal content of nickel in the catalyst was kept at 20% (by weight). The impregnation was carried out at 80°C. The samples were then dried in a drying oven for 16h, followed by calcination at 700°C for 5h in air. 2.3 Catalytic tests The CH4 decomposition reaction was carried out in a quartz-tube fixed-bed flow reactor (9mm i.d.) heated by an electric furnace. Prior to the reactions, the catalysts (100mg) were reduced in situ in a H2 stream at 550°C or 700°C for 1h or 2h, with a heating rate of 10°Cmin−1. The experiments were conducted under atmospheric pressure at 550 and 700°C. The reaction gas was composed of N2 and CH4 at a molar ratio of 7:1 (N2:CH4) [11]. The total flow rate of the reaction gas was 80mLmin−1. The reactant and the product gases were analyzed with a Shimadzu GC-8A gas chromatograph, equipped with a thermal conductivity detector, a Porapak-Q column and a 5A molecular sieve column with Ar as the carrier gas. In this study, the catalytic activity was evaluated in terms of methane conversion. 2.4 Characterization Samples were characterized by X-ray diffraction (XRD) on a Siemens D-5000 (Karlsruhe, Germany) instrument, using Cu Kα radiation and monochromated graphite. The N2 adsorption–desorption isotherm measurements were carried out at 77K using an Autosorb 1C (Quantachrome) apparatus. Specific surface area and pore volume were determined at the equilibrium points P/P 0 in the ranges of 0.05–0.35 and 0.1–0.99, respectively, by the BET method. Temperature-programmed reduction (TPR) analysis was performed to determine the reducible species present at the surface of the catalyst and the temperature at which these species are reduced by H2. TPR was carried out with a Micromeritics Chemisorb 2705 analyzer, using 50mg of catalyst and a temperature ramp from 25 to 1000°C at 10°Cmin−1. A 30mLmin−1 flow of 5% H2/N2 was used. The thermogravimetric analysis (TGA) was carried out in a Shimadzu TGA-50 analyzer under an air flow of 50mLmin−1 with heating from room temperature to approximately 900°C at a heating rate of 10°Cmin−1. The morphology of the carbon-containing materials was examined by Scanning Electron Microscopy (SEM) using a Philips XL30 scanning microscope operating at an accelerating voltage of 20kV. Transmission Electron Microscopy (TEM), with a JEM-1011 microscope operating at an accelerating voltage of 120kV and Raman spectroscopy obtained on a Raman spectrometer (Renishaw – RGH22) with an Ar laser at a wavelength of 514.5nm were also used for the characterization of the materials obtained in this study. 3 Results and discussion 3.1 Catalyst characterization Fig. 1 shows the X-ray diffractograms of the support (obtained at 700°C) as well as the sample containing nickel after calcination at 700°C. According to the XRD patterns, all of the diffraction peaks can be perfectly indexed to cubic spinel-structured MgAl2O4 (JCPDS Card No. 77-1203). The XRD pattern for the Ni/MgAl2O4 catalyst also verified that the NiO crystalline phase interacted with MgAl2O4. The average size of the MgAl2O4 crystallite was determined through the Scherrer equation [34]: D = K·λ/(h 1/2·cos θ), where D is the average crystallite size, K the Scherrer constant (0.9), λ the wavelength of incident X-rays (0.15405nm), h 1/2 the peak width at half height and θ corresponds to the peak position (in this work, 2θ =36.89°). O crystallite size of the support before and after impregnation with nickel was 7.20 and 18.30nm, respectively. The increase of the crystallite size of support after impregnation with nickel occurs probably due to calcination of the Ni/MgAl2O4 catalyst at 700°C for 5h, promoting agglomeration and sinterization on the support particles [35,36]. The crystallite size of the nickel oxide also was determined from Scherrer equation (in 2θ =43.29°), with value of 4.30nm. The surface area and total pore volume of the support were 168.3m2 g−1 and 0.311cm3 g−1, respectively. Fig. 2a shows the TPR curve for the Ni/MgAl2O4 catalyst. Three peaks can be observed at around 450, 700 and 900°C. The first peak can be attributed to NiO reduction weakly interacted with MgAl2O4, the second peak to the reduction of Ni strongly interacted with MgAl2O4 spinel, and the third peak to the reduction of spinel (Ni,Mg)Al2O4 [37,38]. The nitrogen adsorption–desorption isotherms and pore size distribution for the catalyst are shown in Fig. 2b. According to the IUPAC classification, the isotherms in Fig. 2b are of type V, representing predominantly mesoporous structure characteristics (20Å< d <500Å). In addition, a small volume of macropores extends above 500Å. The porous structure was confirmed by analysis of the pore size distribution (see insert in Fig. 2b), which shows the spectrum for the pore diameter with defined maxima in the mesoporous region. The pore size distribution curve displays a wide unimodal distribution with an average pore size of around 177Å. It was found that the BET surface area and total pore volume were 28.2m2 g−1 and 0.125cm3 g−1, respectively. It was observed that the surface area and pore volume decreased drastically after nickel introduction, probably due to the second calcination of the catalyst and the amount of Ni (20% by weight) added to support causing blockage of the support pores by NiO [39,40]. 3.2 Catalyst performance In order to evaluate the catalytic performance of the Ni/MgAl2O4 sample, the methane decomposition reaction was carried out. Fig. 3 shows the catalyst behavior at a reduction temperature of 700°C, with different reaction temperatures (550 and 700°C) and reduction times (1 and 2h). According to the results, it can be observed that under all the conditions tested a high initial catalytic decomposition occurs followed by a rapid and gradual decrease in catalytic activity. In all of the tests, a total loss of activity was observed, except when the catalyst was submitted to the reaction process at 550°C with thermal reduction for 1h. It should be noted that this condition might have favored the reduction of reducible species leaving the active phase more available for catalytic activity. Additionally, the time until the complete deactivation of the catalyst became longer, which may also be related to the growth of the carbon filaments (as CNTs) on the catalyst surface causing the separation of the metal from the support surface, leading to a greater exposure to active sites and promoting a slower blocking of the active surface [39,41]. This finding is in agreement with the results of the TGA, Raman and TEM analysis. Fig. 4 shows the catalyst behavior at a reaction temperature of 550°C, under different conditions of reduction temperature (550 and 700°C) and time (1 and 2h). It can be seen that when the catalyst was submitted to the reduction process at 700°C for 1h, it does not show a loss of catalytic activity. This condition provided higher methane conversion values and the catalyst was more stable when compared with all other conditions. This behavior is probably due to a more efficient reduction of the active sites and/or growth of the carbon filaments, as previously postulated [39,41]. For the other tests, it was noted that there was a total loss of catalytic activity before 180min of the reaction. This may be due to a partial reduction of the active sites of the catalyst (550°C/1h), as can be seen from the TPR results (Fig. 2a), where the reduced species of Ni reduced these working conditions, are weakly interacted with the support. For the catalyst under the condition of 700°C/2h, it is speculated that the higher catalytic activity observed at the beginning of the reaction, may have been promoted by the most efficient reduction of active sites, however, there was a rapid loss of catalytic activity caused by catalyst sintering in the reduction procedure, leading to the active phase being less accessible to the flow of reagent which passes through the reactor bed and thus the reagent molecules are not converted into carbon and hydrogen products. This would result in the catalyst having a shorter lifetime [42]. 3.3 Characterization of deposited carbons TGA is a very powerful technique for determining the quality of the synthesized CNTs which is related to differences in the oxidation stability and degree of graphitization. It appears that various types of carbon, such as amorphous carbon and CNTs, have different oxidation temperatures and can be distinguished using the TGA technique [43,44]. The results for mass loss determined from the thermogravimetric curves (not shown here) of the Ni/MgAl2O4 catalyst after the catalytic tests under the different operational conditions applied in this study are shown in Table 1 . The TGA analysis of the Ni/MgAl2O4 catalyst after the catalytic tests at 550 and 700°C showed a mass loss in the region of 583–640°C for all operational conditions tested in this study, as shown in Table 1. The mass loss of the sample within the temperature range of 500–650°C corresponds to the thermal oxidation of MWNTs, this variation depending on the content of metal catalyst (since it was not removed from the material before the TGA analysis and then could catalyze the process) and carbonaceous materials, as amorphous carbon, present in the nanotube [22,45]. It can also be noted that only for the conditions of a reaction temperature of 550°C and reduction at 700°C for 2h (entry 2) did mass loss occur below 500°C. Under these operational conditions there was a mass loss of 3wt.% at 406°C, which can be attributed to the burning of amorphous carbon [46,47]. This small weight loss indicates that the amount of amorphous carbon present is low. The SEM and TEM micrographs of the carbonaceous materials produced after the catalytic decomposition of methane are shown in Fig. 5 . The SEM image presented in Fig. 5a shows the catalyst surface covered with carbon agglomerates. The TEM micrographs (Figs. 5b and c) obtained after the methane decomposition revealed the presence of multi-walled carbon nanotubes with a filamentous structure, as reported by many researches [9,20,22,47,48]. For all of the operational conditions employed in this study, in general, the outer diameter of the nanotubes ranged from 20 to 35nm, while the inner diameters remained practically unchanged (around 5nm). For the carbon nanotubes formed under the operational conditions of reaction at 550°C and reduction at 700°C/2h (Fig. 5c), for example, the outer and inner diameters for the MWCNTs were estimated to be ca. 25 and 5nm, respectively. The images in Fig. 5b and c also show some black points which may be attributed to the nanoparticles of Ni and/or amorphous carbon, which were involved and deposited on the walls of the carbon nanotubes. Similar behavior has been observed by Hsieh et al. [49], Zhou et al. [50] and Guevara et al. [51], employing metal and bimetal catalysts of Pt, Pt–Ni(Fe,Co) and Ni–Ce, respectively, and by Gallego et al. [46] using LaNiO3-type perovskite as a catalyst. Fig. 6 shows the Raman spectra for the carbon deposited during methane decomposition under different experimental conditions over the Ni/MgAl2O4 catalyst. For all Raman spectra, two bands were observed at 1350cm−1 (D band) and 1580cm−1 (G band). The G band can be attributed to the in-plane C–C stretching vibrations of graphite layers and the D band to the structural disorder of graphite [10,52]. From the Raman spectra in Fig. 6, the ratio between the D and G bands was calculated (I D/I G), and this can express the graphitization of carbon nanotubes or degree of disorder in the structure, which is related to the quality of the carbon nanotubes [46]. The graphitization degree of carbon nanotubes is higher for smaller I D/I G values. The values for the relative intensity of the D band to the G band (I D/I G) in the Raman spectra for the carbon nanotubes obtained under different operational conditions are shown in Table 2 . The sample with the lowest I D/I G value (I D/I G =0.48) was that obtained at a reaction temperature of 700°C, indicating that the graphitic order of the carbon nanotubes is higher on applying higher reaction temperatures. Similar results have been observed by Takenaka et al. [10]. In general, all of the operational conditions used in this study led to I D/I G values below 1.15, indicating that the carbon nanotubes are quite well graphitized, corroborating the results obtained by Gallego et al. [46]. This is confirmed by the oxidation temperature observed in the TGA (shown in Table 1). As observed in the TEM images (Fig. 5), MWCNTs were formed in the decomposition of methane under the operational conditions applied. Thus, the improvement of the graphitic order revealed by the Raman spectra in Fig. 5 can be attributed to the formation of these MWCNTs. 4 Conclusions The MgAl2O4 spinel was successfully prepared via the metal–chitosan complexation route. The synthesized material showed the formation of a spinel phase with a good specific surface area and porosity due to the temperature conditions used. The Ni/MgAl2O4 catalyst was prepared from the MgAl2O4 spinel obtained and used as a catalyst in methane decomposition. It was observed that the catalytic performance, activity and stability are dependent on the operational conditions employed. According to the results, the best conditions for methane decomposition were a reduced temperature of 700°C for 1h and a reaction temperature of 550°C. The results showed that the growth of MWCNTs is favored using the Ni catalyst supported on MgAl2O4 obtained via the metal–chitosan complexation route. The MWCNTs had inner and outer diameters in nanometric scale. References [1] Y. Echegoyen I. Suelves M.J. Lazaro R. Moliner J.M. Palacios J. Power Sources 169 2007 150 157 [2] X. Xiang L. Zhang H.I. Hima F. Li D.G. Evans Appl. Clay Sci. 42 2009 405 409 [3] R. Moliner Y. Echeyoyen I. Suelves M.J. Lazaro J.M. Palacios Int. J. Hydrogen Energy 33 2008 1719 1728 [4] I. Suelves M.J. Lazaro R. Moliner B.M. Corbella J.M. Palacios Int. J. Hydrogen Energy 30 2005 1555 1567 [5] J.L. Chen Y.D. Li Z.Q. Li X.X. Zhang Appl. Catal. A 269 2004 179 186 [6] M.A. Ermakova D. Yu Ermakov G.G. Kuvshinov Appl. Catal. A: Gen. 201 2000 61 70 [7] Y. Li J. Chen Y. Qin L. Chang Energy Fuels 14 2000 1188 1194 [8] H. Wang R.T.K. Baker J. Phys. Chem. B 108 2004 20273 20277 [9] R.M. Almeida H.V. Fajardo D.Z. Mezalira G.B. Nuernberg L.K. Noda L.F.D. Probst N.L.V. Carreño J. Mol. Catal. A: Chem. 259 2006 328 335 [10] S. Takenaka M. Serizawa K. Otsuka J. Catal. 222 2004 520 531 [11] G.D.B. Nuernberg E.L. Foletto C.E.M. Campos H.V. Fajardo N.L.V. Carreño L.F.D. Probst J. Power Sources 208 2012 409 414 [12] S. Takenaka S. Kobayashi H. Ogihara K. Otsuka J. Catal. 217 2003 79 87 [13] S.P. Chai W.M. Yeoh K.Y. Lee A.R. Mohamed J. Alloys Compd. 488 2009 294 299 [14] Y. Li B. Zhang X. Xie J. Liu Y. Xu W. Shen J. Catal. 235 2006 412 424 [15] G.D.B. Nuernberg H.V. Fajardo E.L. Foletto S.M.H. Probst N.L.V. Carreño L.F.D. Probst J. Barrault Catal. Today 176 2011 465 469 [16] M.H.A. Kudus H.M. Akil H. Mohamad L.E. Loon J. Alloys Compd. 509 2011 2784 2788 [17] F.J. Spiess S.L. Suib K. Irie Y. Hayashi H. Matsumoto Catal. Today 89 2004 35 45 [18] T.V. Choudhary C. Sivadinarayana A. Chusuei A. Klinghoffer D.W. Goodman J. Catal. 199 2001 9 18 [19] K. Otsuka S. Kobayashi S. Takenaka Appl. Catal. A: Gen. 190 2000 261 268 [20] J. Chen Y. Qiao Y. Li Appl. Catal. A: Gen. 337 2008 148 154 [21] J. Ashok S.N. Kumar A. Venugopal V.D. Kumari M. Subrahmanyam J. Power Sources 164 2007 809 814 [22] S.K. Saraswat S.S. Pant Int. J. Hydrogen Energy 36 2011 13352 13360 [23] I. Suelves J.L. Pinilla M.J. Lázaro J.M. Palacios J. Power Sources 192 2009 35 42 [24] J. Ashok G. Raju P.S. Reddy M. Subrahmanyam A. Venugopal Int. J. Hydrogen Energy 33 2008 4809 4818 [25] M.E. Rivas C.E. Hori J.L.G. Fierro M.R. Goldwasser A.G. Constant J. Power Sources 184 2008 265 275 [26] S. Takenaka H. Ogihara I. Yamanaka K. Otsuka Appl. Catal. A 217 2001 101 110 [27] W. Kim F. Saito Powder Technol. 113 2000 109 113 [28] J.G. Li T. Ikegami Y. Yajima J.H. Lee T. Mori Y. Yajima Ceram. Int. 27 2001 481 489 [29] L.R. Ping A.M. Azad T.W. Dung Mater. Res. Bull. 36 2001 1417 1430 [30] J. Sehested J.A.P. Gelten I.N. Remediakis H. Bengaard J.K. Norskov J. Catal. 223 2004 432 443 [31] A.M. Gadalla B. Bower Chem. Eng. Sci. 43 1988 3049 3062 [32] E.L. Foletto R.W. Alves S.L. Jahn J. Power Sources 161 2006 531 534 [33] G.D.B. Nuernberg E.L. Foletto L.F.D. Probst C.E.M. Campos N.L.V. Carreño M.A. Moreira Chem. Eng. J. 193–194 2012 211 214 [34] B.D. Cullity S.R. Stock Elements of X-Ray Diffraction 3rd ed. 2001 Prentice-Hall Inc. New Jersey [35] E. Ruckenstein H.Y. Wang Catal. Lett. 73 2-4 2001 99 105 [36] K. Tomishige Y.-G. Chen K. Fujimoto J. Catal. 181 1 1999 91 103 [37] D.S. Park Z. Li H. Devianto H. Lee Int. J. Hydrogen Energy 35 2010 5673 5680 [38] H. Ozdemir M.A.F. Oksuzomer M.A. Gurkaynak Int. J. Hydrogen Energy 35 2010 12147 12160 [39] J.L. Figueiredo F.R. Ribeiro Catálise Heterogênea 1989 Fundação Calouste Gulbenkian Lisboa [40] M. Zangouei A.Z. Moghaddam M. Arasteh Chem. Eng. Res. Bull. 14 2010 97 102 [41] C. Siang-Piao H.S.Z. Sharif R.M. Abdul Diamond Relat. Mater. 16 2007 1656 1664 [42] E. Ruckenstein H.Y. Wang Catal. Lett. 73 2–4 2001 99 105 [43] J.I. Villacampa C. Royo E. Romeo J.A. Montoya P.D. Angel A. Monzón Appl. Catal. A: Gen. 252 2003 363 383 [44] C.M. Chen Y.M. Dai J.G. Huang J.M. Jehng Carbon 44 2006 1808 1820 [45] C. Wu J. Xu J. Li G. Dong L. Guan Physica E 41 2009 1591 1595 [46] G.S. Gallego J. Barrault C.B. Dupeyrat F. Mondragón Catal. Today 149 2010 365 371 [47] G.B. Nuernberg L.F.D. Probst M.A. Moreira C.E.M. Campos Springer Link, Carbon Nanostructures vol. 3 2013 E-Publishing, Inc. Berlin pp. 49–63 [48] J.L. Figueiredo J.J.M. Órfão A.F. Cunha Int. J. Hydrogen Energy 35 2010 9795 9800 [49] C. Hsieh J. Lin J. Wei Int. J. Hydrogen Energy 34 2009 685 693 [50] M. Zhou G. Lin H. Zhang Chin. J. Catal. 28 2007 210 216 [51] J.C. Guevara J.A. Wang L.F. Chen M.A. Valenzuela P. Salas A.G. Ruiz J.A. Toledo M.A.C. Jácome C.A. Chavez O. Novaro Int. J. Hydrogen Energy 35 2010 3509 3521 [52] K. Sinha J. Menendez Phys. Rev. B 41 1990 10845 10847",
      "scopus-id": "84875141372",
      "coredata": {
        "eid": "1-s2.0-S138111691200413X",
        "dc:description": "Magnesium aluminate particles were prepared from biopolymer (chitosan) and Al–Mg solutions by the metal–chitosan complexation method. The MgAl2O4 spinel obtained was used to prepare a Ni catalyst support. The Ni/MgAl2O4 (20% Ni, w/w) was evaluated as a catalyst in the methane decomposition reaction. The influence of the reaction temperature and the catalyst reduction temperature and time on the methane decomposition, as well as on the properties of the carbon produced, was investigated. The materials were characterized using XRD, SEM, TEM, TPR, TGA and Raman spectroscopy analyses. It was observed that the catalytic behavior was dependent on the reaction operating conditions employed. Under the operating conditions used in this study the carbon byproduct is mainly deposited as multi-walled nanotubes (MWNTs).",
        "openArchiveArticle": "false",
        "prism:coverDate": "2013-04-30",
        "openaccessUserLicense": null,
        "prism:aggregationType": "Journal",
        "prism:url": "https://api.elsevier.com/content/article/pii/S138111691200413X",
        "dc:creator": [
          {
            "@_fa": "true",
            "$": "Nuernberg, Giselle B."
          },
          {
            "@_fa": "true",
            "$": "Foletto, Edson L."
          },
          {
            "@_fa": "true",
            "$": "Probst, Luiz F.D."
          },
          {
            "@_fa": "true",
            "$": "Carreño, Neftalí L.V."
          },
          {
            "@_fa": "true",
            "$": "Moreira, Marcelo A."
          }
        ],
        "link": [
          {
            "@_fa": "true",
            "@rel": "self",
            "@href": "https://api.elsevier.com/content/article/pii/S138111691200413X"
          },
          {
            "@_fa": "true",
            "@rel": "scidir",
            "@href": "https://www.sciencedirect.com/science/article/pii/S138111691200413X"
          }
        ],
        "dc:format": "application/json",
        "openaccessType": null,
        "pii": "S1381-1169(12)00413-X",
        "prism:volume": "370",
        "prism:publisher": "Elsevier B.V.",
        "dc:title": "MgAl2O4 spinel particles prepared by metal–chitosan complexation route and used as catalyst support for direct decomposition of methane",
        "prism:copyright": "Copyright © 2012 Elsevier B.V. All rights reserved.",
        "openaccess": "0",
        "prism:issn": "13811169",
        "dcterms:subject": [
          {
            "@_fa": "true",
            "$": "Methane decomposition"
          },
          {
            "@_fa": "true",
            "$": "MgAl2O4"
          },
          {
            "@_fa": "true",
            "$": "Metal–chitosan complexation"
          },
          {
            "@_fa": "true",
            "$": "Carbon nanotubes"
          },
          {
            "@_fa": "true",
            "$": "MWNTs"
          }
        ],
        "openaccessArticle": "false",
        "prism:publicationName": "Journal of Molecular Catalysis A: Chemical",
        "openaccessSponsorType": null,
        "prism:pageRange": "22-27",
        "prism:endingPage": "27",
        "pubType": "fla",
        "prism:coverDisplayDate": "April 2013",
        "prism:doi": "10.1016/j.molcata.2012.12.007",
        "prism:startingPage": "22",
        "dc:identifier": "doi:10.1016/j.molcata.2012.12.007",
        "openaccessSponsorName": null
      },
      "objects": {
        "object": [
          {
            "@category": "high",
            "@height": "886",
            "@width": "2018",
            "@_fa": "true",
            "$": "https://api.elsevier.com/content/object/eid/1-s2.0-S138111691200413X-fx1_lrg.jpg?httpAccept=%2A%2F%2A",
            "@multimediatype": "JPEG image file",
            "@type": "IMAGE-HIGH-RES",
            "@size": "188350",
            "@ref": "fx1",
            "@mimetype": "image/jpeg"
          },
          {
            "@category": "high",
            "@height": "2175",
            "@width": "2897",
            "@_fa": "true",
            "$": "https://api.elsevier.com/content/object/eid/1-s2.0-S138111691200413X-gr5_lrg.jpg?httpAccept=%2A%2F%2A",
            "@multimediatype": "JPEG image file",
            "@type": "IMAGE-HIGH-RES",
            "@size": "591163",
            "@ref": "gr5",
            "@mimetype": "image/jpeg"
          },
          {
            "@category": "high",
            "@height": "1301",
            "@width": "1665",
            "@_fa": "true",
            "$": "https://api.elsevier.com/content/object/eid/1-s2.0-S138111691200413X-gr4_lrg.jpg?httpAccept=%2A%2F%2A",
            "@multimediatype": "JPEG image file",
            "@type": "IMAGE-HIGH-RES",
            "@size": "193229",
            "@ref": "gr4",
            "@mimetype": "image/jpeg"
          },
          {
            "@category": "high",
            "@height": "1218",
            "@width": "1500",
            "@_fa": "true",
            "$": "https://api.elsevier.com/content/object/eid/1-s2.0-S138111691200413X-gr1_lrg.jpg?httpAccept=%2A%2F%2A",
            "@multimediatype": "JPEG image file",
            "@type": "IMAGE-HIGH-RES",
            "@size": "113895",
            "@ref": "gr1",
            "@mimetype": "image/jpeg"
          },
          {
            "@category": "high",
            "@height": "1342",
            "@width": "1250",
            "@_fa": "true",
            "$": "https://api.elsevier.com/content/object/eid/1-s2.0-S138111691200413X-gr6_lrg.jpg?httpAccept=%2A%2F%2A",
            "@multimediatype": "JPEG image file",
            "@type": "IMAGE-HIGH-RES",
            "@size": "186271",
            "@ref": "gr6",
            "@mimetype": "image/jpeg"
          },
          {
            "@category": "high",
            "@height": "1192",
            "@width": "1500",
            "@_fa": "true",
            "$": "https://api.elsevier.com/content/object/eid/1-s2.0-S138111691200413X-gr3_lrg.jpg?httpAccept=%2A%2F%2A",
            "@multimediatype": "JPEG image file",
            "@type": "IMAGE-HIGH-RES",
            "@size": "173972",
            "@ref": "gr3",
            "@mimetype": "image/jpeg"
          },
          {
            "@category": "high",
            "@height": "2616",
            "@width": "1667",
            "@_fa": "true",
            "$": "https://api.elsevier.com/content/object/eid/1-s2.0-S138111691200413X-gr2_lrg.jpg?httpAccept=%2A%2F%2A",
            "@multimediatype": "JPEG image file",
            "@type": "IMAGE-HIGH-RES",
            "@size": "327061",
            "@ref": "gr2",
            "@mimetype": "image/jpeg"
          },
          {
            "@category": "standard",
            "@height": "200",
            "@width": "456",
            "@_fa": "true",
            "$": "https://api.elsevier.com/content/object/eid/1-s2.0-S138111691200413X-fx1.jpg?httpAccept=%2A%2F%2A",
            "@multimediatype": "JPEG image file",
            "@type": "IMAGE-DOWNSAMPLED",
            "@size": "23749",
            "@ref": "fx1",
            "@mimetype": "image/jpeg"
          },
          {
            "@category": "standard",
            "@height": "491",
            "@width": "654",
            "@_fa": "true",
            "$": "https://api.elsevier.com/content/object/eid/1-s2.0-S138111691200413X-gr5.jpg?httpAccept=%2A%2F%2A",
            "@multimediatype": "JPEG image file",
            "@type": "IMAGE-DOWNSAMPLED",
            "@size": "69393",
            "@ref": "gr5",
            "@mimetype": "image/jpeg"
          },
          {
            "@category": "standard",
            "@height": "294",
            "@width": "376",
            "@_fa": "true",
            "$": "https://api.elsevier.com/content/object/eid/1-s2.0-S138111691200413X-gr4.jpg?httpAccept=%2A%2F%2A",
            "@multimediatype": "JPEG image file",
            "@type": "IMAGE-DOWNSAMPLED",
            "@size": "35975",
            "@ref": "gr4",
            "@mimetype": "image/jpeg"
          },
          {
            "@category": "standard",
            "@height": "275",
            "@width": "339",
            "@_fa": "true",
            "$": "https://api.elsevier.com/content/object/eid/1-s2.0-S138111691200413X-gr1.jpg?httpAccept=%2A%2F%2A",
            "@multimediatype": "JPEG image file",
            "@type": "IMAGE-DOWNSAMPLED",
            "@size": "26808",
            "@ref": "gr1",
            "@mimetype": "image/jpeg"
          },
          {
            "@category": "standard",
            "@height": "303",
            "@width": "282",
            "@_fa": "true",
            "$": "https://api.elsevier.com/content/object/eid/1-s2.0-S138111691200413X-gr6.jpg?httpAccept=%2A%2F%2A",
            "@multimediatype": "JPEG image file",
            "@type": "IMAGE-DOWNSAMPLED",
            "@size": "21247",
            "@ref": "gr6",
            "@mimetype": "image/jpeg"
          },
          {
            "@category": "standard",
            "@height": "269",
            "@width": "339",
            "@_fa": "true",
            "$": "https://api.elsevier.com/content/object/eid/1-s2.0-S138111691200413X-gr3.jpg?httpAccept=%2A%2F%2A",
            "@multimediatype": "JPEG image file",
            "@type": "IMAGE-DOWNSAMPLED",
            "@size": "21581",
            "@ref": "gr3",
            "@mimetype": "image/jpeg"
          },
          {
            "@category": "standard",
            "@height": "590",
            "@width": "376",
            "@_fa": "true",
            "$": "https://api.elsevier.com/content/object/eid/1-s2.0-S138111691200413X-gr2.jpg?httpAccept=%2A%2F%2A",
            "@multimediatype": "JPEG image file",
            "@type": "IMAGE-DOWNSAMPLED",
            "@size": "38671",
            "@ref": "gr2",
            "@mimetype": "image/jpeg"
          },
          {
            "@category": "thumbnail",
            "@height": "96",
            "@width": "219",
            "@_fa": "true",
            "$": "https://api.elsevier.com/content/object/eid/1-s2.0-S138111691200413X-fx1.sml?httpAccept=%2A%2F%2A",
            "@multimediatype": "GIF image file",
            "@type": "IMAGE-THUMBNAIL",
            "@size": "4387",
            "@ref": "fx1",
            "@mimetype": "image/gif"
          },
          {
            "@category": "thumbnail",
            "@height": "164",
            "@width": "218",
            "@_fa": "true",
            "$": "https://api.elsevier.com/content/object/eid/1-s2.0-S138111691200413X-gr5.sml?httpAccept=%2A%2F%2A",
            "@multimediatype": "GIF image file",
            "@type": "IMAGE-THUMBNAIL",
            "@size": "8219",
            "@ref": "gr5",
            "@mimetype": "image/gif"
          },
          {
            "@category": "thumbnail",
            "@height": "164",
            "@width": "210",
            "@_fa": "true",
            "$": "https://api.elsevier.com/content/object/eid/1-s2.0-S138111691200413X-gr4.sml?httpAccept=%2A%2F%2A",
            "@multimediatype": "GIF image file",
            "@type": "IMAGE-THUMBNAIL",
            "@size": "4336",
            "@ref": "gr4",
            "@mimetype": "image/gif"
          },
          {
            "@category": "thumbnail",
            "@height": "164",
            "@width": "202",
            "@_fa": "true",
            "$": "https://api.elsevier.com/content/object/eid/1-s2.0-S138111691200413X-gr1.sml?httpAccept=%2A%2F%2A",
            "@multimediatype": "GIF image file",
            "@type": "IMAGE-THUMBNAIL",
            "@size": "3285",
            "@ref": "gr1",
            "@mimetype": "image/gif"
          },
          {
            "@category": "thumbnail",
            "@height": "163",
            "@width": "152",
            "@_fa": "true",
            "$": "https://api.elsevier.com/content/object/eid/1-s2.0-S138111691200413X-gr6.sml?httpAccept=%2A%2F%2A",
            "@multimediatype": "GIF image file",
            "@type": "IMAGE-THUMBNAIL",
            "@size": "4829",
            "@ref": "gr6",
            "@mimetype": "image/gif"
          },
          {
            "@category": "thumbnail",
            "@height": "164",
            "@width": "206",
            "@_fa": "true",
            "$": "https://api.elsevier.com/content/object/eid/1-s2.0-S138111691200413X-gr3.sml?httpAccept=%2A%2F%2A",
            "@multimediatype": "GIF image file",
            "@type": "IMAGE-THUMBNAIL",
            "@size": "5151",
            "@ref": "gr3",
            "@mimetype": "image/gif"
          },
          {
            "@category": "thumbnail",
            "@height": "163",
            "@width": "104",
            "@_fa": "true",
            "$": "https://api.elsevier.com/content/object/eid/1-s2.0-S138111691200413X-gr2.sml?httpAccept=%2A%2F%2A",
            "@multimediatype": "GIF image file",
            "@type": "IMAGE-THUMBNAIL",
            "@size": "3437",
            "@ref": "gr2",
            "@mimetype": "image/gif"
          }
        ]
      },
      "link": {
        "@rel": "abstract",
        "@href": "https://api.elsevier.com/content/abstract/scopus_id/84875141372"
      }
    }
  }
}