{
  "metadata": {
    "title": "(Ferrocenylpyrazolyl)zinc(II) acetate complexes as initiators and catalysts for the ring opening polymerization of ϵ-caprolacton.",
    "authors": "; ; ",
    "journal": "Journal of Molecular Catalysis A: Chemical",
    "date": "2015-09-30",
    "doi": "10.1016/j.molcata.2015.05.021",
    "abstract": "",
    "uri": "https://api.elsevier.com/content/article/pii/S1381116915002058",
    "pii": "S1381116915002058"
  },
  "fulltext": {
    "full-text-retrieval-response": {
      "scopus-eid": "2-s2.0-84935891763",
      "originalText": "serial JL 271358 291210 291744 291790 291809 31 Journal of Molecular Catalysis A: Chemical JOURNALMOLECULARCATALYSISACHEMICAL 2015-05-30 2015-05-30 2015-06-17 2015-06-17 2019-10-29T10:48:39 1-s2.0-S1381116915002058 S1381-1169(15)00205-8 S1381116915002058 10.1016/j.molcata.2015.05.021 S300 S300.2 FULL-TEXT 1-s2.0-S1381116915X00082 2019-10-31T15:33:58.897112Z 0 0 20150901 20150930 2015 2015-05-30T15:33:22.956448Z absattachment articleinfo articletitlenorm authfirstinitialnorm authfirstsurnamenorm cid cids contenttype copyright crossmark dateloaded dateloadedtxt datesearch datesort dateupdated dco docsubtype doctype doi eid ewtransactionid hubeid indexeddate issn issnnorm itemstage itemtransactionid itemweight openaccess openarchive pg pgfirst pglast pii piinorm pubdateend pubdatestart pubdatetxt pubyr sectiontitle sortorder srctitle srctitlenorm srctype ssids alllist content subj subheadings suppl tomb volfirst volissue volumelist webpdf webpdfpagecount yearnav figure table e-component body mmlmath acknowledge affil appendices articletitle auth authfirstini authfull authkeywords authlast dedication highlightsabst primabst pubtype ref specialabst 1381-1169 13811169 true 406 406 C Volume 406 27 185 193 185 193 201509 September 2015 2015-09-01 2015-09-30 2015 Regular Papers article fla Copyright © 2015 Elsevier B.V. All rights reserved. FERROCENYLPYRAZOLYLZINCIIACETATECOMPLEXESINITIATORSCATALYSTSFORRINGOPENINGPOLYMERIZATIONCAPROLACTON OBUAH C 1 Introduction 2 Experimental 2.1 Materials and methods 2.2 Syntheses of complexes 2.2.1 Synthesis of (3-ferrocenylpyrazolyl-methylenepyridine)zinc(II) acetate (1) 2.2.2 Synthesis of (3-ferrocenyl-5-methylpyrazolyl-methylenepyridine)zinc(II) acetate (2) 2.2.3 Synthesis of (3-ferrocenylpyrazolyl-ethylamine)zinc(II) acetate (3) 2.2.4 Synthesis of (3-ferrocenyl-5-methylpyrazolyl-ethylamine)zinc(II) acetate (4) 2.3 General procedure for ring open polymerization of ϵ-caprolactone 2.4 Electrochemical analysis of polymers 3 Result and discussion 3.1 Syntheses of ligands and complexes 3.2 Catalysis 3.2.1 Solvent free ring-opening polymerization of ϵ-caprolactone 3.2.2 ROP of caprolactone with complexes 1-4 and butan-1-ol 3.2.3 Solution ring-opening polymerization of ϵ-caprolactone with complexes 1–4 4 Conclusions Acknowledgements Appendix A Supplementary data References MIDDLETON 2000 2335 2346 J LABETA 2009 3484 3504 M UHRICH 1999 3181 3198 K MOONEY 1994 203 210 D ALAAEDDINE 2009 1469 1475 A HORMNIRUN 2004 2688 2689 P WANG 2012 6729 6731 Y SPASSKY 1996 2627 2637 N OVITT 2002 1316 1326 T RADANO 2000 1552 1553 C DU 2009 1058 1066 H TANG 2004 965 970 Z PANG 2008 3126 3136 X STRIDSBERG 2002 41 65 K LAHCINI 2004 4547 4549 M TULLO 2000 13 15 A CHEN 2010 201 207 W POIRIER 2012 2998 3013 V OKEEFE 2002 4384 4393 B DOBRZYNSKI 2002 2595 2908 P KRICHELDORF 1993 1665 1669 H KO 2001 7973 7977 B CHISHOLM 2003 406 412s M BECHTOLD 2001 8641 8648 K YAKOVENKO 2015 1083 1093 M LABET 2009 3484 3504 M DENG 1999 1401 1408 X KRICHELDORF 2000 55 65 H KOWALSKI 1998 567 572 A DUDA 2000 41 53 A PIAO 2003 2331 2336 L CHEN 2010 3564 3572 P BHUNORA 2011 133 145 S MOTALATIMOL 2006 69 80 S BHAWLUXIMON 2000 31 38 A CHAMBERLAIN 2001 3229 3238 B RIETH 2002 15239 15248 L OJWACH 2010 1947 1964 S BURCKHARDT 1995 5415 5425 U GU 2010 2726 2731 X BRODERICK 2009 4701 4706 E GREGSON 2006 7410 7411 C BRODERICK 2011 9278 9281 E OBUAH 2014 8940 8950 C OBUAH 2015 154 164 C PATTI 2006 1824 1830 A NIENZU 1991 524 527 K XIE 2008 1367 1374 Y OTTO 2007 3950 3962 D OTTO 2008 1121 1134 D ROSE 2015 61 73 W OJWACH 2013 10735 10745 S BHAWLUXIMON 2006 60 68 A MOTALATIMOL 2008 5571 5576 S OBUAHX2015X185 OBUAHX2015X185X193 OBUAHX2015X185XC OBUAHX2015X185X193XC 2017-06-17T00:00:00Z http://creativecommons.org/licenses/by-nc-nd/4.0/ item S1381-1169(15)00205-8 S1381116915002058 1-s2.0-S1381116915002058 10.1016/j.molcata.2015.05.021 271358 2019-10-31T15:33:58.897112Z 2015-09-01 2015-09-30 1-s2.0-S1381116915002058-main.pdf https://s3.amazonaws.com/prod-ucs-content-store-us-east/content/pii:S1381116915002058/MAIN/application/pdf/b76eb90a9c00f8f41bda477a3785d851/main.pdf main.pdf pdf true 606050 MAIN 9 1-s2.0-S1381116915002058-main_1.png https://s3.amazonaws.com/prod-ucs-content-store-us-east/content/pii:S1381116915002058/PREVIEW/image/png/e63b09b3434329fdb35574406df28919/main_1.png main_1.png png 57578 849 656 IMAGE-WEB-PDF 1 1-s2.0-S1381116915002058-fx1.sml https://s3.amazonaws.com/prod-ucs-content-store-us-east/content/pii:S1381116915002058/fx1/THUMBNAIL/image/gif/c70ef3f9bb8dea2e7606c1b3bacdfca8/fx1.sml fx1 true fx1.sml sml 3351 88 219 IMAGE-THUMBNAIL 1-s2.0-S1381116915002058-gr1.sml https://s3.amazonaws.com/prod-ucs-content-store-us-east/content/pii:S1381116915002058/gr1/THUMBNAIL/image/gif/330c1ff8db4ad13fe3d5cbe0a6187792/gr1.sml gr1 gr1.sml sml 10308 140 219 IMAGE-THUMBNAIL 1-s2.0-S1381116915002058-gr2.sml https://s3.amazonaws.com/prod-ucs-content-store-us-east/content/pii:S1381116915002058/gr2/THUMBNAIL/image/gif/75bf3921118f6aec2748d36e0c1cfbf2/gr2.sml gr2 gr2.sml sml 11325 124 219 IMAGE-THUMBNAIL 1-s2.0-S1381116915002058-gr3.sml https://s3.amazonaws.com/prod-ucs-content-store-us-east/content/pii:S1381116915002058/gr3/THUMBNAIL/image/gif/47c3101489c9e671f5c93fe45d7eb8ce/gr3.sml gr3 gr3.sml sml 11957 123 219 IMAGE-THUMBNAIL 1-s2.0-S1381116915002058-gr4.sml https://s3.amazonaws.com/prod-ucs-content-store-us-east/content/pii:S1381116915002058/gr4/THUMBNAIL/image/gif/5973ef105d00126d9ca2063c2b92447c/gr4.sml gr4 gr4.sml sml 16430 127 219 IMAGE-THUMBNAIL 1-s2.0-S1381116915002058-gr5.sml https://s3.amazonaws.com/prod-ucs-content-store-us-east/content/pii:S1381116915002058/gr5/THUMBNAIL/image/gif/fdf68eb497ccb6fd62d996c9f71dce99/gr5.sml gr5 gr5.sml sml 16700 158 219 IMAGE-THUMBNAIL 1-s2.0-S1381116915002058-sc1.sml https://s3.amazonaws.com/prod-ucs-content-store-us-east/content/pii:S1381116915002058/sc1/THUMBNAIL/image/gif/4a547197582929c464e284e528c3be7c/sc1.sml sc1 sc1.sml sml 13950 163 154 IMAGE-THUMBNAIL 1-s2.0-S1381116915002058-sc2.sml https://s3.amazonaws.com/prod-ucs-content-store-us-east/content/pii:S1381116915002058/sc2/THUMBNAIL/image/gif/de586cda62f10fc45945a2fa31d7d4c1/sc2.sml sc2 sc2.sml sml 16094 163 154 IMAGE-THUMBNAIL 1-s2.0-S1381116915002058-fx1.jpg https://s3.amazonaws.com/prod-ucs-content-store-us-east/content/pii:S1381116915002058/fx1/DOWNSAMPLED/image/jpeg/13458a42b1e68ec67e3a7264774919f7/fx1.jpg fx1 true fx1.jpg jpg 13993 200 500 IMAGE-DOWNSAMPLED 1-s2.0-S1381116915002058-gr1.jpg https://s3.amazonaws.com/prod-ucs-content-store-us-east/content/pii:S1381116915002058/gr1/DOWNSAMPLED/image/jpeg/84365d239d89c06d647a1b38f380173b/gr1.jpg gr1 gr1.jpg jpg 47888 481 753 IMAGE-DOWNSAMPLED 1-s2.0-S1381116915002058-gr2.jpg https://s3.amazonaws.com/prod-ucs-content-store-us-east/content/pii:S1381116915002058/gr2/DOWNSAMPLED/image/jpeg/c9481dd1609d2ac0311b2d181e138f9d/gr2.jpg gr2 gr2.jpg jpg 55268 425 753 IMAGE-DOWNSAMPLED 1-s2.0-S1381116915002058-gr3.jpg https://s3.amazonaws.com/prod-ucs-content-store-us-east/content/pii:S1381116915002058/gr3/DOWNSAMPLED/image/jpeg/33e702e499dc8bd790333d31b814af4e/gr3.jpg gr3 gr3.jpg jpg 60316 316 565 IMAGE-DOWNSAMPLED 1-s2.0-S1381116915002058-gr4.jpg https://s3.amazonaws.com/prod-ucs-content-store-us-east/content/pii:S1381116915002058/gr4/DOWNSAMPLED/image/jpeg/50d319ad3b0fb2c641a99c9eca2ec7e5/gr4.jpg gr4 gr4.jpg jpg 61848 306 527 IMAGE-DOWNSAMPLED 1-s2.0-S1381116915002058-gr5.jpg https://s3.amazonaws.com/prod-ucs-content-store-us-east/content/pii:S1381116915002058/gr5/DOWNSAMPLED/image/jpeg/6b302b79089163d82a7e64de02bed34b/gr5.jpg gr5 gr5.jpg jpg 61331 380 527 IMAGE-DOWNSAMPLED 1-s2.0-S1381116915002058-sc1.jpg https://s3.amazonaws.com/prod-ucs-content-store-us-east/content/pii:S1381116915002058/sc1/DOWNSAMPLED/image/jpeg/f8fc143f9931edd4d4e94aa909916e1e/sc1.jpg sc1 sc1.jpg jpg 60311 519 489 IMAGE-DOWNSAMPLED 1-s2.0-S1381116915002058-sc2.jpg https://s3.amazonaws.com/prod-ucs-content-store-us-east/content/pii:S1381116915002058/sc2/DOWNSAMPLED/image/jpeg/b75f670f7cfa41e898aae19d29a7176a/sc2.jpg sc2 sc2.jpg jpg 61442 519 489 IMAGE-DOWNSAMPLED 1-s2.0-S1381116915002058-fx1_lrg.jpg https://s3.amazonaws.com/prod-ucs-content-store-us-east/content/pii:S1381116915002058/fx1/HIGHRES/image/jpeg/0f1d11c31a0580dcd590a39a949c3bf7/fx1_lrg.jpg fx1 true fx1_lrg.jpg jpg 97368 886 2213 IMAGE-HIGH-RES 1-s2.0-S1381116915002058-gr1_lrg.jpg https://s3.amazonaws.com/prod-ucs-content-store-us-east/content/pii:S1381116915002058/gr1/HIGHRES/image/jpeg/351ced93e3ef599fd252716ecf062a1e/gr1_lrg.jpg gr1 gr1_lrg.jpg jpg 346435 2131 3333 IMAGE-HIGH-RES 1-s2.0-S1381116915002058-gr2_lrg.jpg https://s3.amazonaws.com/prod-ucs-content-store-us-east/content/pii:S1381116915002058/gr2/HIGHRES/image/jpeg/5d38427f1e38ea3c55cecb90c27e7273/gr2_lrg.jpg gr2 gr2_lrg.jpg jpg 388683 1882 3334 IMAGE-HIGH-RES 1-s2.0-S1381116915002058-gr3_lrg.jpg https://s3.amazonaws.com/prod-ucs-content-store-us-east/content/pii:S1381116915002058/gr3/HIGHRES/image/jpeg/d5c16e32ee7c5898952c1ed57d898a1d/gr3_lrg.jpg gr3 gr3_lrg.jpg jpg 309459 1400 2500 IMAGE-HIGH-RES 1-s2.0-S1381116915002058-gr4_lrg.jpg https://s3.amazonaws.com/prod-ucs-content-store-us-east/content/pii:S1381116915002058/gr4/HIGHRES/image/jpeg/d4e0c90064223d0dc5b8f6260b6c61c4/gr4_lrg.jpg gr4 gr4_lrg.jpg jpg 321187 1353 2333 IMAGE-HIGH-RES 1-s2.0-S1381116915002058-gr5_lrg.jpg https://s3.amazonaws.com/prod-ucs-content-store-us-east/content/pii:S1381116915002058/gr5/HIGHRES/image/jpeg/6d743631ec42657ab125148153e4afb7/gr5_lrg.jpg gr5 gr5_lrg.jpg jpg 323953 1682 2333 IMAGE-HIGH-RES 1-s2.0-S1381116915002058-sc1_lrg.jpg https://s3.amazonaws.com/prod-ucs-content-store-us-east/content/pii:S1381116915002058/sc1/HIGHRES/image/jpeg/a3de3bc3de95c49a526edccff44eb851/sc1_lrg.jpg sc1 sc1_lrg.jpg jpg 971170 4598 4333 IMAGE-HIGH-RES 1-s2.0-S1381116915002058-sc2_lrg.jpg https://s3.amazonaws.com/prod-ucs-content-store-us-east/content/pii:S1381116915002058/sc2/HIGHRES/image/jpeg/c5abdbf050a4b765e3048457e659f9d7/sc2_lrg.jpg sc2 sc2_lrg.jpg jpg 883346 4595 4333 IMAGE-HIGH-RES 1-s2.0-S1381116915002058-mmc1.docx https://s3.amazonaws.com/prod-ucs-content-store-us-east/content/pii:S1381116915002058/mmc1/MAIN/application/msword/a8c74fcc63ecb402c867f4e4f5f7c199/mmc1.docx mmc1 mmc1.docx docx 1226843 APPLICATION 1-s2.0-S1381116915002058-si1.gif https://s3.amazonaws.com/prod-ucs-content-store-us-east/content/pii:S1381116915002058/STRIPIN/image/gif/a189a5b1a73367ab27ce8511b21af0ac/si1.gif si1 si1.gif gif 190 16 21 ALTIMG 1-s2.0-S1381116915002058-si2.gif https://s3.amazonaws.com/prod-ucs-content-store-us-east/content/pii:S1381116915002058/STRIPIN/image/gif/28d1894c10b6f0b1f27de2a4868d7d19/si2.gif si2 si2.gif gif 200 16 24 ALTIMG 1-s2.0-S1381116915002058-si3.gif https://s3.amazonaws.com/prod-ucs-content-store-us-east/content/pii:S1381116915002058/STRIPIN/image/gif/0e518dfe505fb741ff7aeea41268cd4a/si3.gif si3 si3.gif gif 831 32 179 ALTIMG 1-s2.0-S1381116915002058-si4.gif https://s3.amazonaws.com/prod-ucs-content-store-us-east/content/pii:S1381116915002058/STRIPIN/image/gif/5c9c674d4ca0300790768b53c9b21ab0/si4.gif si4 si4.gif gif 820 40 129 ALTIMG 1-s2.0-S1381116915002058-si5.gif https://s3.amazonaws.com/prod-ucs-content-store-us-east/content/pii:S1381116915002058/STRIPIN/image/gif/97382263b8dbb8c5875fff90c5cbd4a3/si5.gif si5 si5.gif gif 866 40 130 ALTIMG MOLCAA 9507 S1381-1169(15)00205-8 10.1016/j.molcata.2015.05.021 Elsevier B.V. Scheme 1 Synthesis of zinc complexes 1 and 2. Scheme 2 Synthesis of zinc complexes 3 and 4. Fig. 1 Expansion of the MALDI-TOF MS spectrum of PCL, synthesized using complex 1, [CL]/[C]=100, 110°C, (A) H-[O(CH2)5CO]32-O(CH2)5C(O)O-Na and (B) Na-[O(CH2)5CO]32-O(CH2)5C(O)O-Na. Fig. 2 Expansion of the MALDI-TOF MS spectrum of PCL, synthesized using complex 4, [CL]/[C]=100, 110°C, (A) H-[O(CH2)5CO]24-O(CH2)5C(O)-L2, (B) H-[O(CH2)5CO]26-O(CH2)5C(O)O-Na, (C) Na-[O(CH2)5CO]26-O(CH2)5C(O)O-Na, and D: Na-[O(CH2)5CO]24-O(CH2)5C(O)-L2. Fig. 3 Plot of ln([CL]o/([CL]t) versus time for ofbulk ROP ofϵ-CL performed at 110°C using complexes 1, 2, 3, and 4 at[CL]/[C]=100. Fig. 4 Plot of ln([CL]o/([CL]t) versus time for of bulk ROP of ϵ-CL performed at 110°C using complexes 1, 2, 3, and 4 at [CL]/[C]=800. Fig. 5 Determination of kp for bulk ROP of ϵ-CL performed at 110°C using complexes 1, 2, 3, and 4. Table 1 Ring opening polymerization of ϵ-CL using complexes 1–4. a Entry Complex [CL]/[C] Time(h) Conv. (%) b Mn c (gmol−1) PDI c (Mw/Mn) 1 1 100 22 95.6 1570 1.25 2 1 200 48 97.0 1660 1.28 3 1 800 69 88.4 1550 1.12 4 2 100 22 88.2 1670 1.20 5 2 200 48 94.2 1750 1.29 6 2 800 69 78.8 1500 1.26 7 3 100 22 93.5 2750 1.55 8 3 200 48 91.6 2580 1.84 9 3 800 69 77.0 1740 1.22 10 4 100 12 96.4 2630 1.50 11 4 200 25 94.6 2550 1.61 12 4 800 69 82.5 1540 1.23 a Bulk polymerization, 10mmol ϵ-CL, 110°C, [CL]/[C]=100. b Determined using 1H NMR spectroscopy. c Molecular weight obtained from GPC using polystyrene standards×0.56 (correction factor). Table 2 Ring opening polymerization of ϵ-CL using complexes 1–4. a Entry Complex [CL] Time(h) Conv. (%) b Mn c (gmol−1) PDI c (Mw/Mn) 1 1 1 M 27 95.1 16950 1.36 2 2 1 M 35 97.9 9780 1.47 3 3 1 M 35 94.9 7190 1.54 4 4 1 M 22 92.6 5060 1.49 5 1 2 M 31 94.7 7650 1.51 6 2 2 M 31 89.9 6770 1.44 7 3 2 M 31 95.6 6180 1.47 8 4 2 M 21 100 6640 1.51 a Bulk polymerization, 10mmol ϵ-CL, 110°C, [CL]/[C]=100. b Determined using 1H NMR spectroscopy. c Molecular weight obtained from GPC using polystyrene standards×0.56 (correction factor). Editor’s choice paper (Ferrocenylpyrazolyl)zinc(II) acetate complexes as initiators and catalysts for the ring opening polymerization of ϵ-caprolacton. Dedicated to Professor Cedric Holzapfel on the occasion of his 80th birthday; October 3, 2015. Collins Obuah a Yemanlall Lochee a Orpah Zinyemba a Johan H.L. Jordaan b Daniel P. Otto b James Darkwa a ⁎ a Department of Chemistry, University of Johannesburg, Auckland Park Kingsway Campus, Auckland Park, 2006, Johannesburg, South Africa Department of Chemistry University of Johannesburg Auckland Park Kingsway Campus Auckland Park Johannesburg 2006 South Africa b Focus Area Chemical Resource Beneficiation, Catalysis and Synthesis group North-West University, Potchefstroom, 2531, South Africa Focus Area Chemical Resource Beneficiation Catalysis and Synthesis group North-West University Potchefstroom 2531 South Africa ⁎ Corresponding author. Graphical abstract The reaction of Zn(OAc)2 with 3-ferrocenylpyrazol-1-ylmethylenepyridine (L1), 3-ferrocenyl-5-methylpyrazol-1-ylmethylenepyridine (L2), 3-ferrocenylpyrazol-1-ylethylamine (L3) and 3-ferrocenyl-5-pyrazol-1-ylethylamine (L4) afford the corresponding zinc complexes [Zn(CH3COO)2(L1)] (1), [Zn(CH3COO)2(L2)] (2), [Zn(CH3COO)2(L3)] (3), and [Zn(CH3COO)2(L4)] (4). These zinc complexes behave as catalysts or initiators for the ring opening polymerization of ϵ-caprolactone, depending on the nature of the ligands, to produce polymers that are capped with α,ω-dihydroxy, hydroxyl or ferrocenylpyrazolylethylamino end groups. Complexes 1 and 2 were found to act as catalysts when the [CL]/[C] ratios were varied from 100 to 800 to produce PCL with α,ω-dihydroxy and nearly the same molecular weight. Complexes 3 and 4 on the other hand act as initiators to produce a mixture of PCL that have polymers with ferrocenylpyrazolylethylamino and a hydroxyl as end groups as the major component of the mixture and minor species with α,ω-dihydroxy end group. Keywords (Ferrocenylpyrazolyl)zinc(II) acetate ϵ-Caprolactone Ring opening polymerization Catalysts Initiators 1 Introduction Aliphatic polyesters, possessing remarkable mechanical properties, biodegradability, bioabsorbability and biocompatibility, have attracted great interest in the last two decades [1]. These polymers are material that have promoted major advances in the biomedical and pharmaceutical fields for applications such as suture materials, prostheses, and controlled drug releasing devices [2]. Polycaprolactone, (PCL) is an attractive material because of its valuable properties which include high permeability, lack of toxicity to living organisms, biodegradability, ability to blend with various commercial polymers or biopolymers over a wide composition range, and a relatively long half-life [18]. Polyesters are generally prepared by the ring-opening polymerization (ROP) of the corresponding lactones; consequently a series of initiators or catalysts based on Al [3], Sn [4], Fe [5], Li [6], Y [7], lanthanides [8] have been developed to improve the ring-opening polymerization of cyclic esters which is the ‘doorway’ to accessing these polyesters. Most of these initiators or catalysts are metal alkoxides or metal carboxylates supported by different ligand systems. To date stannous 2-ethylhexanoate is the only compound that is utilised for the industrial production of biomaterials via the ring-opening polymerization process [9]. The major drawback with this tin catalyst is its toxicity; resulting in the synthesised polyesters having to undergo several purification processes in an effort to remove traces of tin in the polymer. There is, therefore, a need to develop bio-friendly initiators or catalysts. Such a development should result in reduction in cost of production since the purification process of polymers after synthesis would be less rigorous. In recent years, catalysts or initiators based on calcium [10], magnesium [11], and zinc [12] have received extensive attention because these elements can be metabolised in vivo. These metals are supported on ligands that facilitate the ring opening process. Ligand design is therefore crucial as both activity and occurrence transesterification reactions in lactone polymerization are dependent on electronic and steric bulk around the metal centre. Nitrogen donor ligands, namely Schiff’s bases [13] and β-diiminate [14], have been used extensively to modify the electrophilicity of the metal centres for ring-opening polymerization. Another group of nitrogen-donor ligands that is receiving attention are ligands with pyrazolyl functional group have been used to prepare several metal catalysts [15]. The use of pyrazolyl ligands in preparing catalysts result in highly electrophilic metal centres owing to the weaker σ-donating ability of pyrazoles; a property that is crucial in the development of ROP initiators or catalysts. Ferrocenyl-based ligands have also received extensive attention in preparing metal complexes in the recent years owing to their ease of functionalization [16]. There have been a few reports on the use of ferrocenyl-based ligands in the ring-opening polymerisation of cyclic esters [17]. The interest of having a ferrocenyl ligand emanates from having redox control on the activity. We have recently combined the attributes of pyrazoles and ferrocene to prepare a number of new late transition metal complexes that are good catalysts for a number of olefin and cyclic esters transformations [19,20]. We report a unique case where bio-friendly zinc acetate, supported on ferrocenylpyrazolyl-based ligands, act as either catalyst or initiator to produce poly(caprolactones) that have end groups dictated by the nature of the ferrocenylpyrazolyl ligand. 2 Experimental 2.1 Materials and methods Unless otherwise stated, all syntheses were carried out under nitrogen atmosphere using standard Schlenk technique. Polymerization was carried out using a 50mL parallel reactor. All organic solvents were dried and purified by distillation over standard reagents under nitrogen prior to use. Compounds L1 [19], L2 [19], L3 [20], L4 [20], 3-ferrocenylpyrazole [21], and 3-ferrocenyl-5-methylpyrazole [21] were synthesized according to literature procedures. Zinc acetate, ferrocene, ethyl formate, ethyl acetate and ϵ-caprolactone (ϵ-CL) were used as received from Sigma–Aldrich. Infrared (IR) spectra complexes were recorded on a Bruker Tensor 27 equipped with a diamond ATR. Elemental analyses were performed on a Vario Elementar III microcube CHN analyzer. The mass spectrometry unit at the University of Stellenbosch performed the ESI–MS spectra on a Waters API Qualtro micro spectrophotometer. NMR spectra were recorded on a Bruker 400MHz instrument (1H at 400MHz and 13C{1H} at 100MHz). The chemical shifts are reported in δ (ppm) and referenced to the residual proton and carbon signals 7.24ppm and 77.0ppm, respectively, of CDCl3 NMR solvent. MALDI spectral data were collected with a Bruker AutoFLEX III Smartbeam TOF/TOF Mass spectrometer. The instrument was operated in positive ion mode using an m/z range of 500–10,000. The voltages of the ion sources were set at 19 and 16.7kV for ion sources 1 and 2, respectively, while the lens was set at 8.50kV. The reflectors 1 and 2 voltages were set at 21 and 9.7kV respectively. The spectra were acquired using 2,5-dihydroxybenzoic acid as the MALDI matrix, using a 337nm nitrogen laser. Gel permeation chromatography (GPC) was performed using a Hewlett–Packard 1100 series chromatograph and this setup was previously successfully employed [22] (Hewlett Packard, Waldbronn, Germany). The chromatograph was interfaced with a DAWN DSP multi-angle laser light scattering (MALLS) (Wyatt Corp., Santa Barbara, CA) and refractive index (RI) detector for absolute molecular weight determination. Samples were prepared at ∼20mg/mL of which 100μL was injected onto the GPC columns. Isocratic conditions were used with distilled THF as eluent at a flow rate of 1mL/min and a 0.5μm inline filter preceded connection of the pump to a series of GPC columns that covered a wide molecular weight range to ensure resolution (Agilent PLgel™ 10μm with pore size 105 Å, Agilent PLgel MIXED-C™ and a Phenomenex Phenogel™ 5μm with a pore size of 100Å). The specific refractive increment dn/dc was determined online as previously described in literature and was determined at 0.077±0.002 for the samples reported here. The number average molecular weight ( M ¯ n ), weight average molecular weight ( M ¯ w ) and polydispersity index (PDI) were calculated using ASTRA™ 4.73 (Wyatt Corp., Santa Barbara). Sample solutions were filtered via a syringe through 0.45μm PTFE syringe filters before being subjected to analysis. Energy Dispersive X-ray (EDS) analysis data were collected on an Oxford instrument X max coupled with a Tescan Vega3 Scanning Electron Microscope mega 3L MH, at 20keV and working distance of 15mm. 2.2 Syntheses of complexes 2.2.1 Synthesis of (3-ferrocenylpyrazolyl-methylenepyridine)zinc(II) acetate (1) To a MeOH solution (20mL) of zinc acetate (53.21mg, 0.29mmol) was added a MeOH solution of L1 (100mg, 0.29mmol) and the resulting solution was stirred for 12h. The solvents were then removed in vacuo and the resulting sticky crude orange product was purified by recrystallization from CH2Cl2 and diethyl ether to obtain an orange solid and which was then dried in vacuo. Yield = 0.14g (90%). 1H NMR (CDCl3) δ: 2.03 (s, 3H, OAc); 4.05 (s, 5H, η5- C5H5); 4.18 (s, 2H, η5-C5H4); 4.206 (s, 2H, η5-C5H4); 4.42 (s, 2H, η5 C5H4)iso; 4.73 (s, 2H, η5-C5H4)iso; 5.51 (s, 2H, CH2)iso; 5.65 (s, 2H, CH2); 6.37 (s, 1H, pz-H); 6.44 (s, 1H, pz-H)iso; 7.10 (d, 1H, JHH = 7.6Hz, py); 7.28 (t, 1H, JHH = 5.2Hz, py); 7.41 (s, 1H, pz); 7.46 (t, 1H, JHH = 7.2Hz, py); 7.71 (t, 1H, JHH = 7.2Hz, py); 7.89 (t, 1H, JHH = 7.2Hz, py); 8.67 (t, 1H, JHH = 7.2Hz, py); 8.85 (t, 1H, JHH = 7.2Hz, py). 13C{1H} NMR (CDCl3) δ: 22.4; 55.2; 57.4; 66.5; 68.1; 68.4; 69.0; 69.4; 69.5; 103.9; 105.8; 120.9; 121.3; 122.3; 122.5; 130.8; 137.0; 139.4; 149.2; 149.3; 151.9; 157.2; 157.9; 179.7. IR (Diamond ATR, cm−1): 1609 υ(CO) carbonyl. HRMS (ESI) m/z = C33H28FeN3O4Zn Calcd 651.8712. Found [M+H]+ =651.1450 (100%). Anal. Calcd for C33H27FeN3O4Zn: C, 60.90; H, 4.18; N, 6.46%. Found: C, 59.68; H, 4.10; N, 6.23%. Complexes 2-4 were prepared following the same procedure as described for complex 1, using the appropriate reagents. 2.2.2 Synthesis of (3-ferrocenyl-5-methylpyrazolyl-methylenepyridine)zinc(II) acetate (2) Zinc acetate (50.04mg, 0.30mmol) and L2 (107.41mg, 0.30mmol) were reacted to obtain a light orange solid. Yield=0.14g (85%). 1H NMR (CDCl3) δ: 2.02 (s, 3H, OAc); 2.25 (s, 3H, CH3); 2.45 (s, 3H, CH3)iso; 4.05 (s, 5H, η5-C5H5); 4.14 (s, 2H, η5-C5H4); 4.25 (s, 2H, η5-C5H4)iso; 4.45 (s, 2H, η5-C5H4); 4.70 (s, 2H, η5-C5H4)iso; 5.45 (s, 2H, CH2); 5.54 (s, 2H, CH2)iso; 6.16 (s, 1H, pz-H); 6.21 (s, 1H, pz-H)iso; 6.91 (d, 1H, JHH = 8.0Hz, py); 7.36 (d, 1H, JHH = 8.0Hz, py); 7.48 (t, 1H, JHH = 5.2Hz, py); 7.67 (t, 1H, JHH = 8.0Hz, py); 7.88 (d, 1H, JHH = 4.8Hz, py); 8.65 (d, 1H, JHH = 4.8Hz, py); 8.95 (d, 1H, JHH = 4.8Hz, py); 13C{1H} NMR (CDCl3) δ:11.1; 13.5; 23.0; 54.6; 55.0; 66.4; 67.9; 68.0; 68.3; 68.9; 69.4; 69.5; 103.8; 105.5; 120.7;120.8;122.2; 122.3; 137.0; 139.7; 142.4; 148.3; 149.1; 149.3; 150.0; 157.5; 158.2; 179.2. IR (Diamond ATR, cm−1): 1606 υ(CO) carbonyl. HRMS (ESI) m/z =C34H30FeN3O4Zn Calcd 665.8712. Found [M+H]+ =665.2350 (100%). Anal. Calcd for C34H29FeN3O4Zn: C, 61.42; H, 4.40; N, 6.32%. Found: C, 61.08; H, 4.45; N, 5.96%. 2.2.3 Synthesis of (3-ferrocenylpyrazolyl-ethylamine)zinc(II) acetate (3) Zinc acetate (55.04mg, 0.30 mmol) and L3 (85.54mg, 0.30 mmol) were reacted to a brown solid. Yield=0.12g (87%). 1H NMR (CDCl3) δ: 3.46 (t, 2H, JHH =6.8Hz, CH2); 4.00 (s, 5H, η 5-C5H4); 4.14 (t, 2H, JHH =6.0Hz, CH2); 4.25 (s, 2H, η5-C5H4); 4.47 (s, 2H, η5-C5H4)iso; 4.66 (s, 2H, η5-C5H4); 4.90 (s, 2H, η5-C5H4) iso; 6.30 (s, 1H, pz-H); 6.36 (s, 1H, pz-H)iso; 7.42 (d, 6H, JHH =6.0Hz, bz); 7.76 (s, 1H, pz-H); 8.06 (s, 4H, bz). 13C{1H} NMR (CDCl3): 23.0; 41.5; 47.6; 50.8; 51.2; 66.9; 67.3; 69.2; 69.7; 104.1; 106.9; 133.0; 140.3; 144.2; 153.8; 179.8. IR (Diamond ATR, cm−1): 1600 υ(CO) carbonyl. HRMS (ESI) m/z =C29H28FeN3O4Zn Calcd, 603.800. Found [M+H]+ =603.1970 (100%). Anal. Calcd for C29H27FeN3O4Zn: C, 57.78; H, 4.51; N, 6.97%. Found: C, 57.69; H, 4.44; N, 5.19%. 2.2.4 Synthesis of (3-ferrocenyl-5-methylpyrazolyl-ethylamine)zinc(II) acetate (4) Zinc acetate (64.21mg, 0.35 mmol) and L4 (108.21mg, 0.35 mmol) were reacted to a brown solid. Yield=0.14g (84%). 1H NMR (CDCl3) δ: 2.05 (s, 3H, CH3); 2.42 (s, 3H, CH3)iso; 3.47 (t, 4H, JHH =6.0Hz, CH2); 4.00 (s, 5H, η5-C5H4); 4.15 (s, 2H, η5-C5H4); 4.26 (s, 2H, η5-C5H4)iso; 4.50 (t, 2H, CH2); 4.4.88 (s, 2H, η5-C5H4); 6.18 (s, 1H, pz-H); 7.42 (d, 6H, JHH =6.0Hz, bz); 8.06 (s, 4H, bz). 13C{1H} NMR (CDCl3): δ 11.3; 12.8; 23.0; 41.1; 41.4; 47.0; 47.4; 67.4; 69.2; 69.8; 104.6; 106.9; 141.7; 144.8; 150.2; 152.7; 179.5. IR (Diamond ATR, cm−1): 1601 υ(CO) carbonyl. HRMS (ESI) m/z =C30H30FeN3O4Zn Calcd, 617.8201. Found [M+H]+ =617.5432 (100%). Anal. Calcd for C30H29FeN3O4Zn: C, 58.42; H, 4.74; N, 6.81%. Found: C, 58.01; H, 4.96; N, 6.67%. 2.3 General procedure for ring open polymerization of ϵ-caprolactone Solvent free method: ϵ-CL (1.14g, 0.01mol) and the required amount of zinc complex, depending on the ratio of [monomer]:[complex] ([CL]/[C]) used, were weighed into a Radley's parallel reactor tube and stirred at 110°C. The polymerization of ϵ-CL was carried out in bulk with [CL]/[C] ratios of 100:1, 200:1 400:1 and 800:1. After the required reaction time, the reaction mixture was quenched by rapid cooling to room temperature and the crude product was analyzed by 1H NMR spectroscopy in CDCl3. The percentage conversion of ϵ-CL into PCL was determined from the proton intensities of the methylene protons of ϵ-CL and PCL that appear in the region 4.2-4.0ppm. The polymers were purified by first dissolving the crude product in CH2Cl2, followed by the addition of cold methanol. A white precipitate was subsequently formed, and this was isolated by filtration and dried in vacuo. The number of repeat units in the purified PCL samples was determined by 1H NMR spectrum from the ratio of the proton intensities of C H 2O of the PCL (δ (ppm)=4.019−4.053ppm) main chain and C H 2OH as end group (δ (ppm)=3.611−3.644). 2.4 Electrochemical analysis of polymers The electrochemical cell use for the analysis consists of a three-electrode cell, namely a glassy carbon working electrode (geometric area=0.071cm2), a Ag/AgCl (3M KCl) reference electrode, and a platinum wire as the counter electrode. The measurements were performed using concentrations of samples 1.0mM, in the presence of 0.1M tetra-n-ethylammonium perchlorate (supporting electrolyte) in dry acetonitrile under argon atmosphere at room temperature. The glassy carbon electrode was polished on a Buehler-felt pad using alumina (0.05μm) and then washed with millipore water, sonicated for 5min in millipore water and finally rinsed with a buffer solution at pH 9.2. This was performed to ensure that there were no contaminants on the electrode surface before the electrochemical measurements. 3 Result and discussion 3.1 Syntheses of ligands and complexes Compounds L1-L4 were synthesized as reported in literature [19,20]. These compounds were used as ligands to synthesize the zinc complexes 1-4 in a 1:1 ratio between zinc acetate and the respective ligands as shown in Schemes 1 and 2 , . The zinc complexes were obtained as orange solids after recrystallization in CH2Cl2 and diethyl ether with yields between 84 and 90%. All complexes are stable in air and no special pre-cautions were taken in their storage. 1H NMR spectra of the zinc complexes showed significant shifts downfield compared to their corresponding ligands as well as the presence of methyl proton signals from the acetate which appeared between 1.95ppm and 2.03ppm. Furthermore, the structural isomerism observed in the ligands was also found in the zinc complexes. A typical spectrum is that of complex 1 (Fig. S1). IR spectra of the complexes 1-4 show the presence of sharp carbonyl stretching frequencies between 1600 and 1625cm−1. These frequencies are higher compared to the carbonyl of the acetate in the zinc precursor which appears at 1547cm−1. Mass spectra of 1-4 showed 100% m/z of [M+H]+, which indicate the presence of the expected zinc complexes. Elemental analyses of the zinc complexes were consistent with the structures proposed in Schemes 1 and 2, and also confirm the purity of the (ferrocenylpyrazoly)zinc(II) acetate complexes. In solution there were strong indications that all four zinc complexes undergo some isomerization; although we were unable to isolate any of the structural isomers. This isomerization could be monitored by 1H NMR spectroscopy. For example freshly prepared sample of 4 (Fig. S2) showed a 1H NMR spectrum where the CH3 protons of acetate group integrate for 6 protons at 1.95ppm, to indicate binding of two acetate ligands. Also there is one peak which represents the pyrazolyl proton at 6.17ppm. After 1h in solution (Fig. S3) the spectrum of complex 4 the integration of the proton of the acetate group has increased to approximately 9 protons; and there were two proton peaks at 6.17ppm and 6.18ppm representing pyrazolyl protons. After 2h, the intensities of the new peaks increased (Fig. S4) and by 5h there was no further increase in the intensities of the new peaks, suggesting equilibrium had been reached in the isomerization process. Attempts to grow crystals of either isomer were unsuccessful as prolonged stay in solution (ca. 4 weeks) invariably resulted in the decomposition of the complexes and only crystals of ferrocenylpyrazolyl ligands were obtained. 3.2 Catalysis 3.2.1 Solvent free ring-opening polymerization of ϵ-caprolactone Initial polymerization studies of ϵ-caprolactone (ϵ-CL) were conducted at 110°C using the complexes 1-4 with a monomer to complex ratio of 100:1 without a solvent. Table 1 (entries 1, 4, 7 and 10) show that all the zinc complexes catalyzed the ring-opening polymerization (ROP) of ϵ-CL with different activities. Complex 4 was found to be the most active while complex 2 was the least active. The molecular weight (M n) and polydispersity indices (PDI) of the purified polymers were determined by GPC. Varying the monomer to complex ratio from 100 to 800 did not result in significant changes in the molecular weight and the PDIs of the polymers produced with complexes 1 and 2 (Table 2 , entries 1–6). For complexes 3 and 4, a decrease in molecular weight of the polymers was observed (Table 2, entries 7–12) and only slight variations were observed in the PDIs as the monomer to zinc complex ratio was increased. It is noteworthy that all the GPC traces showed monomodal distribution. Ojwach et al. [23] have recently reported zinc and copper acetate complexes supported by (pyrazol-1-ylmethyl)pyridine as catalysts for the ring-opening polymerization of ϵ-CL. Having a ferrocenyl instead of methyl group on the pyrazole increases the rate of reaction comparing the zinc complexes for the Ojwach catalysts and ours. For instance, Ojwach et al. reported that 94% conversion in 48h for their zinc catalysts whereas complex 2 showed 88% conversion in 22h (Table 1, entry 4) under similar conditions. In addition, our reported PDI for the PCL from complex 2 is 1.20 (Table 1, entry 4) compared to 3.23 reported by Ojwach et al. The lower PDI value can be attributed to the shorter reaction time thus less transesterification reactions. We obtained molecular weights (2900gmol−1) that are comparable to those obtained by Ojwach et al., therefore the overall effect of having ferrocenyl group instead of methyl group on the pyrazole appears to produce the right electrophilicity of the zinc centre thus resulting in a more active catalyst. Analogous (ferrocenylpyrazolyl)zinc(II) benzoates have been recently reported as catalysts for the ring opening polymerization of ϵ-CL [20]. The only difference between these zinc benzoate complexes and current one lies in the acetate. Comparison of the activities of complexes 1-4 to those of the zinc benzoates complexes reported in the literature [20] show that the acetates have better activity. For example, the (ferrocenylpyrazolyl)zinc(II) benzoates [20] required 20–69h to reach 90% conversion whereas the acetate complexes needed only 12–22h to attain similar conversions for (Table 1). Furthermore, the PCL samples from the zinc acetate complexes showed lower PDI (1.12–1.84) compared to the zinc benzoate complexes (1.20–9.57) [20]. MALDI-TOF MS was used to further characterize the PCLs obtained with all the zinc complexes. Typical MALDI-TOF MS spectra of PCL obtained with complex 1 ([CL]/[C]=100) are shown in Fig. 1 and Fig. S5. The MALDI-TOF MS data confirms that there is only one species, that is, a α,ω-dihydroxy-PCL; suggesting that no ligands from that zinc complex capped the polymer. Furthermore, the α,ω-dihydroxy-PCL were also observed in the MALDI-TOF mass spectra of the PCL obtained from complex 2 ([CL]/[C]=100) and varying the [CL]/[C] for complexes 1 and 2 showed the same PCL species. Conversely, MALDI-TOF MS for the purified PCL from complex 4 ([CL]/[C]=100) showed that there are two PCL species (Fig. 2 and Fig. S6). The major PCL species has the ferrocenyl-pyrazolyl-ethylamino and a hydroxyl as end groups and while a minor species with α,ω-dihydroxy-end group in PCL was identified, which suggests that there are two modes of initiation using complex 4. The MALDI-TOF mass spectra of the PCL samples from complex 3 ([CL]/[C]=100) showed similar PCL composition as found for complex 4. Varying the [CL]/[C] ratio from 100 to 800 for complexes 3 and 4 did not change the composition of the PCL. There was no evidence in the MALDI-TOF analysis for the formation of cyclic products in the ring opening polymerization; suggesting that there were no transesterification reactions. 1H NMR spectra also confirmed the presence of (ferrocenylpyrazolyl) ethylamino end group PCL from complexes 3 and 4. A typical PCL spectrum showing signals for t ligand L2 in the region 6.0–6.1ppm for the pyrazolyl proton and 4.0–4.6ppm for the ferrocenyl protons is Fig. S7. No signals were, however, observed in the same regions for the PCL obtained from complexes 1 and 2. To further confirm the presence of the (ferrocenylpyrazolyl)ethylamino end group, two further experiments, namely cyclic voltammetry and Energy dispersive X-ray (EDX) were performed on the PCLs obtained with complexes 1-4. The presence of the ferrocenyl moiety in the PCL samples shows quasi-reversible one electron redox potential, evident in the ΔE values between 130 and 141mV. A typical voltammogram is shown in Fig. S8 for PCL produced with complex 3 ([CL]/[C]=100) with redox potential of 141mV. This redox potential is high compared to that of the free ligand (L3) which is 87.0mV [24]. The Energy Dispersive X-ray (EDX) result, which is a qualitative analysis, shows the presence of the Fe atom in the ferrocenyl unit and oxygen which forms the backbone of the polymer. There was no evidence of zinc present in the polymer for this analysis, indicative of the purity of the polymer. A typical spectrum of a PCL sample from complex 3 is Fig. S9a thus confirming the incorporation of ligand L3 in the polymer. Fig. S9b shows the EDX result of PCL synthesized with complex 2. The figure also confirms the result obtained from the MALDI-TOF MS that there is no ligand end group for polymers obtained with complex 2. Having two modes of initiation for complexes 3 and 4 is not surprising because a primary amine is known to initiate the ring-opening polymerization of ϵ-CL in the presence of a Lewis acid such as stannous 2-ethylhexnoate (Sn(Oct)2) [25]. The initiation step is similar to when alcohol is used as a co-initiator in conjunction with Sn(Oct)2 as catalyst. A plausible reason for dual initiation modes of complexes 3 and 4 is that the amine-zinc bond is weak enough to allow insertion. This is further confirmed by the complexes not being very stable in solution. The complexes eventually decompose to form the corresponding ligand and zinc acetate (vide supra). However, this phenomenon was not observed in the analogous (ferrocenylpyrazolyl)zinc(II) benzoates, suggesting that the latter zinc complexes are much more stable than the zinc acetate complexes [20]. It is noteworthy that there is no ϵ-CL insertion in complexes 1 and 2, as the pyridyl nitrogen is a stronger σ–donor and thus binds more strongly. The kinetics of the ϵ-CL bulk ROP were investigated for complexes 1-4 by monitoring the reactions using 1H NMR spectroscopy. Sampling was performed at regular time intervals and the percentages conversions of ϵ-CL to PCL were determined. The rate of propagation (R p) for the ring-opening polymerization of cyclic esters at a given temperature is given by; R P = − d [ M ] t dt = K P [ I ] o [ M ] t The pseudo-first order kinetics with respect to the monomer for ring-opening polymerization is defined by the following equation where [M]o is the initial monomer concentration, [M]t is the monomer concentration at time t, and [I]o is the initial initiator concentration. ln ( [ M ] o [ M ] t ) = K P I o t For a given M/I value, the [I]o is constant and thus k p[I]o is substituted by k app to give the following equation. ln ( [ M ] o [ M ] t ) = K app t From the plot of ln([M]o/[M]t) versus time, the values of k app are obtained and k p can be obtained from a plot of k app (1/t ln([M]o/[M] t )) against [I]o, assuming a first order reaction with respect to the initiator or catalyst. The kinetics investigation with 1-4 (Figs. 3, S10, S11, and Fig. 4 ) revealed the polymerization was pseudo-first order with respect to ϵ-CL for all zinc complexes. The induction period observed for complexes 1 and 2 is attributed to the formation of the active species between the zinc complex and the trace amount of water in the complexes since MALDI-TOF MS data shows formation of α,ω-dihydroxy-PCL. Similar observations were made for analogous (ferrocenylpyrazolyl)zinc(II) benzoates complexes [20]. The order of the reaction with respect to complexes 1-4 and the overall rate of polymerization also were determined. A plot of 1/t ln[CL]o/[CL]t (k app) against number of moles of complex gave a linear relationship; consistent with a pseudo first order dependency with respect to the complexes (Fig. 5 ). Similar observations were made for zinc carboxylate with pyrazolyl ligands [20,23]. For complexes 4 and 1, the overall rate constants of polymerization (k p) were evaluated to be 2.17×10−7 and 1.06×10−7 h−1 mol−1 respectively (Fig. 5). It is notable that complexes 1 and 4 show the highest k p values in the two types of ancillary ligands system investigated in this report. This accounts for their high catalytic activities. The k app and k p values for the remaining complexes are summarized in Table S1. From the kinetic studies, the activities of the complexes can be arranged in the order of 4 > 1 > 2 > 3. Since complexes 1 and 2 have a different mode of initiation compared to complexes 3 and 4, the catalytic activities have to be explained within each set of ligand system. In considering the pyridyl based ligands, complex 1 was found to be more active than complex 2 and this feature can be explained by both electronic and steric factors. In terms of steric factor, ϵ-CL should have less difficulty in approaching the metal centre of complexes 1 as there is less steric crowding and the extra methyl group on the pyrazole increases the electron density around the zinc center in complex 2 making it less electrophilic. In the case of amine based ligands, that is complexes 3 and 4, complex 4 was found to be more active than complex 3. The difference in activity of these complexes does not seem to be governed by electronic and steric factors but rather by the stability and solubility of the complexes as the initiation of the polymerization involves insertion of ϵ-CL into the zinc-nitrogen (amine) bond. From the stability studies, it was found that complex 3 is more stable than complex 4, thus a weaker zinc-nitrogen bond in the latter favors faster ϵ-CL insertion. The additional methyl group in complex 4 increases its solubility and thus more available for insertion. 3.2.2 ROP of caprolactone with complexes 1-4 and butan-1-ol Since complexes 1-2 gave only α,ω-dihydroxy-PCL, attempts to control the molecular weight by adding quantitative amounts of alcohol was also made. Experiments were conducted using butan-1-ol at [CL]/[nBuOH]=50 and [CL]/[C]=800. Shorter polymerization times were required under the aforementioned conditions, for instance, complex 1 in the presence of nBuOH, reached 77% conversion in 36h whereas only 69h were required to reach 88% conversion for complex 1. Furthermore, molecular weights of the PCL samples obtained, were similar or lower compared to those obtained in experiments without the addition of alcohol. MALDI-TOF MS showed bi-modal distributions suggesting that both water and butan-1-ol initiate ring-opening polymerization of ϵ-CL (Fig. S12). Polymerization was conducted with complexes 3 and 4 in the presence of nBuOH under the same conditions. Similar results were obtained as those obtained with complexes 1–2 suggesting that there is no ϵ-CL in the zinc-amine bond in the presence of nBuOH (Fig. S13). 3.2.3 Solution ring-opening polymerization of ϵ-caprolactone with complexes 1–4 Solution polymerization of ϵ-CL was performed in toluene at monomer concentration 1M and 2M using complexes 1–4 (Table 2) to investigate whether the transesterification reactions that were observed in the solvent free method causing low molecular weights can be suppressed. The trend in the catalytic activity in the presence of toluene as solvent (1M) was identical to what was observed in the bulk process that is, 4 > 1 > 2 > 3 at the same [CL]/[C] ratio. From the GPC results, it can be deduced that higher molecular weights can be obtained from solution ring-opening polymerization compared to the solvent free experiments. A plausible explanation is that in solution ring-opening polymerization, the system is dilute and the growing polymer chain stays away from the active center thus reducing side reactions. The polydispersity indices recorded for the solution polymerization ranged from 1.36 to 1.54 which is almost the same as recorded for complexes 3 and 4 in the solvent free method however complexes 1 and 2 showed lower PDIs. From complex 1 to 4 (Table 2), the trend observed in the molecular weight is the reverse when compared to bulk polymerization. In bulk polymerization it was complex 4 that gave the highest molecular weight whereas complex 1 that gave the lowest molecular weight. The reverse was observed for solution polymerization. The time required to achieve high conversion is considerably lower in the solvent free experiment compared to the results shown in Table 2. For example, with complex 4 in the solvent free method, 12h were required to reach 97% conversion whereas with toluene at 1M monomer concentration, 22h were needed to reach a similar conversion (Table 2, entry 4). In addition solution polymerization in toluene at 2M monomer concentration was slightly faster than 1M monomer concentration. For example, for complex 4, 100% conversion was obtained in 21h for 2M, whereas 97% conversion was obtained in 22h for 1M. Kinetic studies (Fig. S14 and S15) were also performed and results indicate that only complex 4 showed a significant change in the k app compared to the bulk experiment. 4 Conclusions A series of (ferrocenylpyrazolyl)zinc(II) acetate complexes were synthesized, characterized and used for ring-opening polymerization of ϵ-caprolactone. All complexes were found to be active for the ring-opening polymerization of ϵ-caprolactone. Complexes 1 and 2 acted as catalysts whilst 3 and 4 acted as initiators. There was monomer insertion in the zinc-amine bond in relation to complexes 3 and 4 in the initiation step whereas complex 1 and 2 behave as catalysts. The PCL produced using complexes 1 and 2 mainly had α,ω-dihydroxy end groups while those of complexes 3 and 4 were ferrocenylpyrazolylamine capped. Solution polymerization in toluene gave better molecular weight polymers than the solvent free method. Acknowledgements We gratefully acknowledge funding for this project from the National Research Foundation (South Africa) and the University of Johannesburg. Appendix A Supplementary data Supplementary data associated with this article can be found, in the online version, at http://dx.doi.org/10.1016/j.molcata.2015.05.021. Appendix A Supplementary data The following are Supplementary data to this article: References [1] (a) J.C. Middleton A.J. Tipton Biomaterials 21 2000 2335 2346 [2] M. Labeta W. Thielemans Chem. Soc. Rev. 38 2009 3484 3504 [3] (a) K.E. Uhrich S.M. Cannizzaro R.S. Langer K.M. Shakesheff Chem. Rev. 99 1999 3181 3198 (b) D.J. Mooney G. Organ J.P. Vacanti R. Langer Cell Transplant 2 1994 203 210 [4] (a) A. Alaaeddine C.M. Thomas T. Roisnel J.F. Carpentier Organometallics 28 2009 1469 1475 (b) P. Hormnirun E.L. Marshall V.C. Gibson A.J.P. White D.J. Williams J. Am. Chem. Soc. 126 2004 2688 2689 (c) Y. Wang Y.H. Ma Chem. Commun. 48 2012 6729 6731 (d) N. Spassky M. Wisniewski C. Pluta A.L. Borgne Macromol. Chem. Phys. 197 1996 2627 2637 (e) T.M. Ovitt G.W. Coates J. Am. Chem. Soc. 124 2002 1316 1326 (f) C.P. Radano G.L. Baker M.R. Smith J. Am. Chem. Soc. 122 2000 1552 1553 (g) H. Du A.H. Velders P.J. Dijkstra Z. Zhong X. Chen J. Feijen Macromolecules 42 2009 1058 1066 (h) Z.H. Tang X.S. Chen X. Pang Y.K. Yang X.F. Zhang X.B. Jing Biomacromolecules 5 2004 965 970 (i) X. Pang H. Du X. Chen X. Wang X. Jing Chem. Eur. J. 14 2008 3126 3136 [5] (a) K.M. Stridsberg M. Ryner A.C. Albertsson Adv. Polym. Sci. 157 2002 41 65 (b) M. Lahcini P.M. Castro M. Kalmi M. Leskelä T. Repo Organometallics 23 2004 4547 4549 (c) A. Tullo Chem. Eng. News 3 2000 13 15 (d) W. Chen H.C. Yang R. Wang R. Cheng F.H. Meng W.X. Wei Z.Y. Zhong Macromolecules 43 2010 201 207 (e) V. Poirier T. Roisnel S. Sinbandhit M. Bochmann J.F. Carpentier Y. Sarazin Chem. Eur. J. 18 2012 2998 3013 [6] (a) B.J. O’Keefe L.E. Breyfogle M.A. Hillmyer W.B. Tolman J. Am. Chem. Soc. 124 2002 4384 4393 (b) P. Dobrzynski J. Kasperczyk M. Janeczek M. Bero Polymer 43 2002 2595 2908 [7] (a) H.R. Kricheldorf Makromol. Chem. 194 1993 1665 1669 (b) B.T. Ko C.C. Lin J. Am. Chem. Soc. 123 2001 7973 7977 (c) M.H. Chisholm C.C. Lin J.C. Galluccia B.T. Ko Dalton Trans. 2003 406 412s [8] (a) K. Bechtold M.A. Hillmyer W.B. Tolman Macromolecules 4 2001 8641 8648 (b) M.V. Yakovenko N. Yu. Udilova T.A. Glukhova A.V. Cherkasov G.K. Fukinab A.A. Trifonov New J. Chem. 39 2015 1083 1093 [9] (a) M. Labet W. Thielemans Chem. Soc. Rev. 38 2009 3484 3504 (b) X. Deng M. Yuan C. Xiong X. Li J. Appl. Polym. Sci. 73 1999 1401 1408 [10] (a) H.R. Kricheldorf Macromol. Symp. 153 2000 55 65 (b) A. Kowalski A. Duda S. Penczek Macromol. Rapid Commun. 19 1998 567 572 (c) A. Duda S. Penczek A. Kowalski J. Libiszowski Macromol. Symp. 153 2000 41 53 [11] L. Piao M. Deng X. Chen L. Jiang X. Jing Polymer 44 2003 2331 2336 [12] P.S. Chen Y.C. Liu C.H. Lin B.T. Ko J. Polym. Sci. Part A: Polym. Chem. 48 2010 3564 3572 [13] S. Bhunora J. Mugo A. Bhaw-Luximon S. Mapolie J. van Wyk J. Darkwa E. Nordlander Appl. Organomet. Chem. 25 2011 133 145 [14] (a) S. Motala-Timol A. Bhaw-Luximon D. Jhurry Macromol. Symp. 231 2006 69 80 (b) A. Bhaw-Luximon D. Jhurry N. Spassky Polym. Bull. 44 2000 31 38 [15] (a) B.M. Chamberlain M. Cheng D.R. Moore T.M. Ovitt E.B. Lobkovsky G.W. Coates J. Am. Chem. Soc. 123 2001 3229 3238 (b) L.R. Rieth D.R. Moore E.B. Lobkovsky G.W. Coates J. Am. Chem. Soc. 124 2002 15239 15248 [16] S.O. Ojwach J. Darkwa Inorg. Chim. Acta 363 2010 1947 1964 [17] (a) U. Burckhardt L. Hintermann A. Schnyder A. Togni Organometallics 14 1995 5415 5425 (b) X.Y. Gu X.Z. Han Y.M. Yao Y. Zhang Q. Shen J. Organomet. Chem. 695 2010 2726 2731 (c) E.M. Broderick P.L. Diaconescu Inorg. Chem. 48 2009 4701 4706 [18] (a) C.K.A. Gregson V.C. Gibson N.J. Long E.L. Marshall P.J. Oxford A.J.P. White J. Am. Chem. Soc. 128 2006 7410 7411 (b) E.M. Broderick N. Guo C.S. Vogel C. Xu J. Sutter J.T. Miller K. Meyer P. Mehrkhodavandi P.L. Diaconescu J. Am. Chem. Soc. 133 2011 9278 9281 [19] C. Obuah A. Munyaneza I.A. Guzei J. Darkwa Dalton Trans. 43 2014 8940 8950 [20] C. Obuah Y. Lochee J.H.L. Jordaan D.P. Otto T. Nyokong J. Darkwa Polyhedron 90 2015 154 164 [21] (a) A. Patti S. Pedotti Tetrahedron: Asymmetry 17 2006 1824 1830 (b) K. Nienzu J. Serwatowski S. Trofimenko Inorg. Chem. 30 1991 524 527 (c) Y.-S. Xie X.-H. Pan B.-X. Zhao J.-T. Liu D.S. Shin J.-H. Zhang L.-W. Zheng J. Zhao J.-Y. Miao J. Organomet. Chem. 693 2008 1367 1374 [22] (a) D.P. Otto H.C.M. Vosloo W. Liebenberg M.M. de Villiers J. Appl. Polym. Sci. 107 2007 3950 3962 (b) D.P. Otto H.C.M. Vosloo W. Liebenberg M.M. de Villiers Eur. J. Pharm. Biopharm. 69 2008 1121 1134 (c) W.E. Rose D.P. Otto M.E. Aucamp Z. Miller M.M. de Villiers Pharm. Res. 32 2015 61 73 (2014) [23] S.O. Ojwach T.T. Okemwa N.W. Attandoh B. Omondi Dalton Trans. 42 2013 10735 10745 [24] C. Obuah, Johan H. L. Jordaan, J. Darkwa, unpublished results [25] (a) A. Bhaw-Luximon D. Jhurry S. Motala-Timol Y. Lochee Macromol. Symp. 231 2006 60 68 (b) S. Motala-Timol D. Jhurry J. Zhou A. Bhaw-Luximon G. Mohun H. Ritter Macromolecules 41 2008 5571 5576",
      "scopus-id": "84935891763",
      "coredata": {
        "eid": "1-s2.0-S1381116915002058",
        "dc:description": "The reaction of Zn(OAc)2 with 3-ferrocenylpyrazol-1-ylmethylenepyridine (L1), 3-ferrocenyl-5-methylpyrazol-1-ylmethylenepyridine (L2), 3-ferrocenylpyrazol-1-ylethylamine (L3) and 3-ferrocenyl-5-pyrazol-1-ylethylamine (L4) afford the corresponding zinc complexes [Zn(CH3COO)2(L1)] (1), [Zn(CH3COO)2(L2)] (2), [Zn(CH3COO)2(L3)] (3), and [Zn(CH3COO)2(L4)] (4). These zinc complexes behave as catalysts or initiators for the ring opening polymerization of ϵ-caprolactone, depending on the nature of the ligands, to produce polymers that are capped with α,ω-dihydroxy, hydroxyl or ferrocenylpyrazolylethylamino end groups. Complexes 1 and 2 were found to act as catalysts when the [CL]/[C] ratios were varied from 100 to 800 to produce PCL with α,ω-dihydroxy and nearly the same molecular weight. Complexes 3 and 4 on the other hand act as initiators to produce a mixture of PCL that have polymers with ferrocenylpyrazolylethylamino and a hydroxyl as end groups as the major component of the mixture and minor species with α,ω-dihydroxy end group.",
        "openArchiveArticle": "false",
        "prism:coverDate": "2015-09-30",
        "openaccessUserLicense": null,
        "prism:aggregationType": "Journal",
        "prism:url": "https://api.elsevier.com/content/article/pii/S1381116915002058",
        "dc:creator": [
          {
            "@_fa": "true",
            "$": "Obuah, Collins"
          },
          {
            "@_fa": "true",
            "$": "Lochee, Yemanlall"
          },
          {
            "@_fa": "true",
            "$": "Zinyemba, Orpah"
          },
          {
            "@_fa": "true",
            "$": "Jordaan, Johan H.L."
          },
          {
            "@_fa": "true",
            "$": "Otto, Daniel P."
          },
          {
            "@_fa": "true",
            "$": "Darkwa, James"
          }
        ],
        "link": [
          {
            "@_fa": "true",
            "@rel": "self",
            "@href": "https://api.elsevier.com/content/article/pii/S1381116915002058"
          },
          {
            "@_fa": "true",
            "@rel": "scidir",
            "@href": "https://www.sciencedirect.com/science/article/pii/S1381116915002058"
          }
        ],
        "dc:format": "application/json",
        "openaccessType": null,
        "pii": "S1381-1169(15)00205-8",
        "prism:volume": "406",
        "prism:publisher": "Elsevier B.V.",
        "dc:title": "(Ferrocenylpyrazolyl)zinc(II) acetate complexes as initiators and catalysts for the ring opening polymerization of ϵ-caprolacton.",
        "prism:copyright": "Copyright © 2015 Elsevier B.V. All rights reserved.",
        "openaccess": "0",
        "prism:issn": "13811169",
        "dcterms:subject": [
          {
            "@_fa": "true",
            "$": "(Ferrocenylpyrazolyl)zinc(II) acetate"
          },
          {
            "@_fa": "true",
            "$": "ϵ-Caprolactone"
          },
          {
            "@_fa": "true",
            "$": "Ring opening polymerization"
          },
          {
            "@_fa": "true",
            "$": "Catalysts"
          },
          {
            "@_fa": "true",
            "$": "Initiators"
          }
        ],
        "openaccessArticle": "false",
        "prism:publicationName": "Journal of Molecular Catalysis A: Chemical",
        "openaccessSponsorType": null,
        "prism:pageRange": "185-193",
        "prism:endingPage": "193",
        "pubType": "fla",
        "prism:coverDisplayDate": "September 2015",
        "prism:doi": "10.1016/j.molcata.2015.05.021",
        "prism:startingPage": "185",
        "dc:identifier": "doi:10.1016/j.molcata.2015.05.021",
        "openaccessSponsorName": null
      },
      "objects": {
        "object": [
          {
            "@category": "thumbnail",
            "@height": "88",
            "@width": "219",
            "@_fa": "true",
            "$": "https://api.elsevier.com/content/object/eid/1-s2.0-S1381116915002058-fx1.sml?httpAccept=%2A%2F%2A",
            "@multimediatype": "GIF image file",
            "@type": "IMAGE-THUMBNAIL",
            "@size": "3351",
            "@ref": "fx1",
            "@mimetype": "image/gif"
          },
          {
            "@category": "thumbnail",
            "@height": "140",
            "@width": "219",
            "@_fa": "true",
            "$": "https://api.elsevier.com/content/object/eid/1-s2.0-S1381116915002058-gr1.sml?httpAccept=%2A%2F%2A",
            "@multimediatype": "GIF image file",
            "@type": "IMAGE-THUMBNAIL",
            "@size": "10308",
            "@ref": "gr1",
            "@mimetype": "image/gif"
          },
          {
            "@category": "thumbnail",
            "@height": "124",
            "@width": "219",
            "@_fa": "true",
            "$": "https://api.elsevier.com/content/object/eid/1-s2.0-S1381116915002058-gr2.sml?httpAccept=%2A%2F%2A",
            "@multimediatype": "GIF image file",
            "@type": "IMAGE-THUMBNAIL",
            "@size": "11325",
            "@ref": "gr2",
            "@mimetype": "image/gif"
          },
          {
            "@category": "thumbnail",
            "@height": "123",
            "@width": "219",
            "@_fa": "true",
            "$": "https://api.elsevier.com/content/object/eid/1-s2.0-S1381116915002058-gr3.sml?httpAccept=%2A%2F%2A",
            "@multimediatype": "GIF image file",
            "@type": "IMAGE-THUMBNAIL",
            "@size": "11957",
            "@ref": "gr3",
            "@mimetype": "image/gif"
          },
          {
            "@category": "thumbnail",
            "@height": "127",
            "@width": "219",
            "@_fa": "true",
            "$": "https://api.elsevier.com/content/object/eid/1-s2.0-S1381116915002058-gr4.sml?httpAccept=%2A%2F%2A",
            "@multimediatype": "GIF image file",
            "@type": "IMAGE-THUMBNAIL",
            "@size": "16430",
            "@ref": "gr4",
            "@mimetype": "image/gif"
          },
          {
            "@category": "thumbnail",
            "@height": "158",
            "@width": "219",
            "@_fa": "true",
            "$": "https://api.elsevier.com/content/object/eid/1-s2.0-S1381116915002058-gr5.sml?httpAccept=%2A%2F%2A",
            "@multimediatype": "GIF image file",
            "@type": "IMAGE-THUMBNAIL",
            "@size": "16700",
            "@ref": "gr5",
            "@mimetype": "image/gif"
          },
          {
            "@category": "thumbnail",
            "@height": "163",
            "@width": "154",
            "@_fa": "true",
            "$": "https://api.elsevier.com/content/object/eid/1-s2.0-S1381116915002058-sc1.sml?httpAccept=%2A%2F%2A",
            "@multimediatype": "GIF image file",
            "@type": "IMAGE-THUMBNAIL",
            "@size": "13950",
            "@ref": "sc1",
            "@mimetype": "image/gif"
          },
          {
            "@category": "thumbnail",
            "@height": "163",
            "@width": "154",
            "@_fa": "true",
            "$": "https://api.elsevier.com/content/object/eid/1-s2.0-S1381116915002058-sc2.sml?httpAccept=%2A%2F%2A",
            "@multimediatype": "GIF image file",
            "@type": "IMAGE-THUMBNAIL",
            "@size": "16094",
            "@ref": "sc2",
            "@mimetype": "image/gif"
          },
          {
            "@category": "standard",
            "@height": "200",
            "@width": "500",
            "@_fa": "true",
            "$": "https://api.elsevier.com/content/object/eid/1-s2.0-S1381116915002058-fx1.jpg?httpAccept=%2A%2F%2A",
            "@multimediatype": "JPEG image file",
            "@type": "IMAGE-DOWNSAMPLED",
            "@size": "13993",
            "@ref": "fx1",
            "@mimetype": "image/jpeg"
          },
          {
            "@category": "standard",
            "@height": "481",
            "@width": "753",
            "@_fa": "true",
            "$": "https://api.elsevier.com/content/object/eid/1-s2.0-S1381116915002058-gr1.jpg?httpAccept=%2A%2F%2A",
            "@multimediatype": "JPEG image file",
            "@type": "IMAGE-DOWNSAMPLED",
            "@size": "47888",
            "@ref": "gr1",
            "@mimetype": "image/jpeg"
          },
          {
            "@category": "standard",
            "@height": "425",
            "@width": "753",
            "@_fa": "true",
            "$": "https://api.elsevier.com/content/object/eid/1-s2.0-S1381116915002058-gr2.jpg?httpAccept=%2A%2F%2A",
            "@multimediatype": "JPEG image file",
            "@type": "IMAGE-DOWNSAMPLED",
            "@size": "55268",
            "@ref": "gr2",
            "@mimetype": "image/jpeg"
          },
          {
            "@category": "standard",
            "@height": "316",
            "@width": "565",
            "@_fa": "true",
            "$": "https://api.elsevier.com/content/object/eid/1-s2.0-S1381116915002058-gr3.jpg?httpAccept=%2A%2F%2A",
            "@multimediatype": "JPEG image file",
            "@type": "IMAGE-DOWNSAMPLED",
            "@size": "60316",
            "@ref": "gr3",
            "@mimetype": "image/jpeg"
          },
          {
            "@category": "standard",
            "@height": "306",
            "@width": "527",
            "@_fa": "true",
            "$": "https://api.elsevier.com/content/object/eid/1-s2.0-S1381116915002058-gr4.jpg?httpAccept=%2A%2F%2A",
            "@multimediatype": "JPEG image file",
            "@type": "IMAGE-DOWNSAMPLED",
            "@size": "61848",
            "@ref": "gr4",
            "@mimetype": "image/jpeg"
          },
          {
            "@category": "standard",
            "@height": "380",
            "@width": "527",
            "@_fa": "true",
            "$": "https://api.elsevier.com/content/object/eid/1-s2.0-S1381116915002058-gr5.jpg?httpAccept=%2A%2F%2A",
            "@multimediatype": "JPEG image file",
            "@type": "IMAGE-DOWNSAMPLED",
            "@size": "61331",
            "@ref": "gr5",
            "@mimetype": "image/jpeg"
          },
          {
            "@category": "standard",
            "@height": "519",
            "@width": "489",
            "@_fa": "true",
            "$": "https://api.elsevier.com/content/object/eid/1-s2.0-S1381116915002058-sc1.jpg?httpAccept=%2A%2F%2A",
            "@multimediatype": "JPEG image file",
            "@type": "IMAGE-DOWNSAMPLED",
            "@size": "60311",
            "@ref": "sc1",
            "@mimetype": "image/jpeg"
          },
          {
            "@category": "standard",
            "@height": "519",
            "@width": "489",
            "@_fa": "true",
            "$": "https://api.elsevier.com/content/object/eid/1-s2.0-S1381116915002058-sc2.jpg?httpAccept=%2A%2F%2A",
            "@multimediatype": "JPEG image file",
            "@type": "IMAGE-DOWNSAMPLED",
            "@size": "61442",
            "@ref": "sc2",
            "@mimetype": "image/jpeg"
          },
          {
            "@category": "high",
            "@height": "886",
            "@width": "2213",
            "@_fa": "true",
            "$": "https://api.elsevier.com/content/object/eid/1-s2.0-S1381116915002058-fx1_lrg.jpg?httpAccept=%2A%2F%2A",
            "@multimediatype": "JPEG image file",
            "@type": "IMAGE-HIGH-RES",
            "@size": "97368",
            "@ref": "fx1",
            "@mimetype": "image/jpeg"
          },
          {
            "@category": "high",
            "@height": "2131",
            "@width": "3333",
            "@_fa": "true",
            "$": "https://api.elsevier.com/content/object/eid/1-s2.0-S1381116915002058-gr1_lrg.jpg?httpAccept=%2A%2F%2A",
            "@multimediatype": "JPEG image file",
            "@type": "IMAGE-HIGH-RES",
            "@size": "346435",
            "@ref": "gr1",
            "@mimetype": "image/jpeg"
          },
          {
            "@category": "high",
            "@height": "1882",
            "@width": "3334",
            "@_fa": "true",
            "$": "https://api.elsevier.com/content/object/eid/1-s2.0-S1381116915002058-gr2_lrg.jpg?httpAccept=%2A%2F%2A",
            "@multimediatype": "JPEG image file",
            "@type": "IMAGE-HIGH-RES",
            "@size": "388683",
            "@ref": "gr2",
            "@mimetype": "image/jpeg"
          },
          {
            "@category": "high",
            "@height": "1400",
            "@width": "2500",
            "@_fa": "true",
            "$": "https://api.elsevier.com/content/object/eid/1-s2.0-S1381116915002058-gr3_lrg.jpg?httpAccept=%2A%2F%2A",
            "@multimediatype": "JPEG image file",
            "@type": "IMAGE-HIGH-RES",
            "@size": "309459",
            "@ref": "gr3",
            "@mimetype": "image/jpeg"
          },
          {
            "@category": "high",
            "@height": "1353",
            "@width": "2333",
            "@_fa": "true",
            "$": "https://api.elsevier.com/content/object/eid/1-s2.0-S1381116915002058-gr4_lrg.jpg?httpAccept=%2A%2F%2A",
            "@multimediatype": "JPEG image file",
            "@type": "IMAGE-HIGH-RES",
            "@size": "321187",
            "@ref": "gr4",
            "@mimetype": "image/jpeg"
          },
          {
            "@category": "high",
            "@height": "1682",
            "@width": "2333",
            "@_fa": "true",
            "$": "https://api.elsevier.com/content/object/eid/1-s2.0-S1381116915002058-gr5_lrg.jpg?httpAccept=%2A%2F%2A",
            "@multimediatype": "JPEG image file",
            "@type": "IMAGE-HIGH-RES",
            "@size": "323953",
            "@ref": "gr5",
            "@mimetype": "image/jpeg"
          },
          {
            "@category": "high",
            "@height": "4598",
            "@width": "4333",
            "@_fa": "true",
            "$": "https://api.elsevier.com/content/object/eid/1-s2.0-S1381116915002058-sc1_lrg.jpg?httpAccept=%2A%2F%2A",
            "@multimediatype": "JPEG image file",
            "@type": "IMAGE-HIGH-RES",
            "@size": "971170",
            "@ref": "sc1",
            "@mimetype": "image/jpeg"
          },
          {
            "@category": "high",
            "@height": "4595",
            "@width": "4333",
            "@_fa": "true",
            "$": "https://api.elsevier.com/content/object/eid/1-s2.0-S1381116915002058-sc2_lrg.jpg?httpAccept=%2A%2F%2A",
            "@multimediatype": "JPEG image file",
            "@type": "IMAGE-HIGH-RES",
            "@size": "883346",
            "@ref": "sc2",
            "@mimetype": "image/jpeg"
          },
          {
            "@category": "standard",
            "@_fa": "true",
            "$": "https://api.elsevier.com/content/object/eid/1-s2.0-S1381116915002058-mmc1.docx?httpAccept=%2A%2F%2A",
            "@multimediatype": "Microsoft Word file",
            "@type": "APPLICATION",
            "@size": "1226843",
            "@ref": "mmc1",
            "@mimetype": "application/word"
          },
          {
            "@category": "thumbnail",
            "@height": "16",
            "@width": "21",
            "@_fa": "true",
            "$": "https://api.elsevier.com/content/object/eid/1-s2.0-S1381116915002058-si1.gif?httpAccept=%2A%2F%2A",
            "@multimediatype": "GIF image file",
            "@type": "ALTIMG",
            "@size": "190",
            "@ref": "si1",
            "@mimetype": "image/gif"
          },
          {
            "@category": "thumbnail",
            "@height": "16",
            "@width": "24",
            "@_fa": "true",
            "$": "https://api.elsevier.com/content/object/eid/1-s2.0-S1381116915002058-si2.gif?httpAccept=%2A%2F%2A",
            "@multimediatype": "GIF image file",
            "@type": "ALTIMG",
            "@size": "200",
            "@ref": "si2",
            "@mimetype": "image/gif"
          },
          {
            "@category": "thumbnail",
            "@height": "32",
            "@width": "179",
            "@_fa": "true",
            "$": "https://api.elsevier.com/content/object/eid/1-s2.0-S1381116915002058-si3.gif?httpAccept=%2A%2F%2A",
            "@multimediatype": "GIF image file",
            "@type": "ALTIMG",
            "@size": "831",
            "@ref": "si3",
            "@mimetype": "image/gif"
          },
          {
            "@category": "thumbnail",
            "@height": "40",
            "@width": "129",
            "@_fa": "true",
            "$": "https://api.elsevier.com/content/object/eid/1-s2.0-S1381116915002058-si4.gif?httpAccept=%2A%2F%2A",
            "@multimediatype": "GIF image file",
            "@type": "ALTIMG",
            "@size": "820",
            "@ref": "si4",
            "@mimetype": "image/gif"
          },
          {
            "@category": "thumbnail",
            "@height": "40",
            "@width": "130",
            "@_fa": "true",
            "$": "https://api.elsevier.com/content/object/eid/1-s2.0-S1381116915002058-si5.gif?httpAccept=%2A%2F%2A",
            "@multimediatype": "GIF image file",
            "@type": "ALTIMG",
            "@size": "866",
            "@ref": "si5",
            "@mimetype": "image/gif"
          }
        ]
      },
      "link": {
        "@rel": "abstract",
        "@href": "https://api.elsevier.com/content/abstract/scopus_id/84935891763"
      }
    }
  }
}