{
  "metadata": {
    "title": "Application of (phosphine)gold(I) carboxylates, sulfonates and related compounds as highly efficient catalysts for the hydration of alkynes",
    "authors": "; ; ",
    "journal": "Journal of Molecular Catalysis A: Chemical",
    "date": "2004-04-02",
    "doi": "10.1016/j.molcata.2003.11.011",
    "abstract": "",
    "uri": "https://api.elsevier.com/content/article/pii/S1381116903007647",
    "pii": "S1381116903007647"
  },
  "fulltext": {
    "full-text-retrieval-response": {
      "scopus-eid": "2-s2.0-1242272793",
      "originalText": "serial JL 271358 291210 291744 291790 291809 31 Journal of Molecular Catalysis A: Chemical JOURNALMOLECULARCATALYSISACHEMICAL 2003-12-14 2003-12-14 2010-03-28T13:36:59 1-s2.0-S1381116903007647 S1381-1169(03)00764-7 S1381116903007647 10.1016/j.molcata.2003.11.011 S300 S300.1 FULL-TEXT 1-s2.0-S1381116900X01823 2015-05-15T05:56:32.920819-04:00 0 0 20040402 2004 2003-12-14T00:00:00Z articleinfo crossmark dco dateupdated tomb dateloaded datesearch indexeddate issuelist volumelist yearnav absattachment articletitlenorm authfirstinitialnorm authfirstsurnamenorm cid cids contenttype copyright dateloadedtxt docsubtype doctype doi eid ewtransactionid hubeid issfirst issn issnnorm itemstage itemtransactionid itemweight openaccess openarchive pg pgfirst pglast pii piinorm pubdatestart pubdatetxt pubyr sortorder srctitle srctitlenorm srctype subheadings volfirst volissue webpdf webpdfpagecount figure table body acknowledge affil articletitle auth authfirstini authfull authkeywords authlast primabst ref specialabst alllist content subj ssids 1381-1169 13811169 212 212 1 2 1 2 Volume 212, Issues 1–2 6 35 42 35 42 20040402 2 April 2004 2004-04-02 2004 converted-article fla Copyright © 2003 Elsevier B.V. All rights reserved. APPLICATIONPHOSPHINEGOLDICARBOXYLATESSULFONATESRELATEDCOMPOUNDSHIGHLYEFFICIENTCATALYSTSFORHYDRATIONALKYNES ROEMBKE P 1 Introduction 2 Experiments 2.1 Materials 2.2 Synthesis of (triphenylphosphine)gold(I) pentafluoropropionate (1) 2.3 Synthesis of (triphenylphosphine)gold(I)-p-tolylsulfonate (4) 2.4 Synthesis of (triphenylphosphine)silver(I) pentafluoropropionate (7) 2.5 Synthesis of (triphenylphosphine)silver(I)-p-tolylsulfonate (ethanol) (8) 2.6 Addition of water to 3-hexyne 2.7 Addition of water to phenylacetylene 2.8 Addition of water to cyclopentylacetylene 2.9 Addition of acetic acid to 3-hexyne 3 Results and discussion 4 Conclusion Acknowledgements References SCHROHE 1875 367 A BAYER 1882 2705 A PERKIN 1884 170 W TSUCHIMOTO 2000 1777 T IZUMI 1997 371 Y KOZHEVNIKOV 1998 171 I DRENTH 1960 1002 W ALLEN 1982 775 A KUTSCHEROFF 1884 13 M THOMAS 1938 718 R REICHERT 1923 1553 J HINTON 1930 1553 H KILLIAN 1934 1384 D TOKUNAGA 1998 2867 M SUZUKI 2001 735 T TOKUNAGA 2001 11917 M GROTJAHN 2001 3884 D HARPERN 1961 4097 J HARPERN 1966 5142 J KHAN 1990 299 T JAMES 1969 863 B BLUM 1992 153 J HISCOX 1990 1997 W BAIDOSSI 1997 669 W FRANCISCO 2001 4237 L KUKUDA 1991 3729 Y FUKUDA 1991 2013 Y IMI 1987 3127 K MEIER 1993 31 I TELES 1998 1415 J THOMPSON 1998 111 D THOMPSON 1999 12 D BOND 1999 319 G BOND 2001 117 G DYKER 2000 4237 G HUTCHINGS 2002 11 G HASHMI 2003 3 A ITO 1986 6405 Y KOMIYA 1996 131 S SOLOSHONOK 1994 1091 V PARKES 1974 453 J HASHMI 2002 19 A HASHMI 2001 3769 A ASAO 2002 12650 N HASHMI 2000 11553 A HOFFMANNRODER 2001 2537 A HASHMI 2000 2285 A DANKWARDT 2001 5809 J FUKUDA 1987 297 Y MULLER 1998 675 T LOK 1996 3289 R HASHMI 2003 4339 A HUTCHINGS 1986 215 G NKOSI 1991 378 B SCHMIDBAUR 1990 11 H MIZUSHIMA 2002 4563 E BAENZIGER 1976 962 N ANGERMAIER 1994 371 K ALSAADY 1985 191 A SCHMIDBAUR 1992 1725 H ROEMBKE 2002 605 P ROEMBKE 2003 168 P ROEMBKE 2003 123 P ROEMBKEX2004X35 ROEMBKEX2004X35X42 ROEMBKEX2004X35XP ROEMBKEX2004X35X42XP item S1381-1169(03)00764-7 S1381116903007647 1-s2.0-S1381116903007647 10.1016/j.molcata.2003.11.011 271358 2010-10-15T16:13:34.400668-04:00 2004-04-02 1-s2.0-S1381116903007647-main.pdf https://s3.amazonaws.com/prod-ucs-content-store-us-east/content/pii:S1381116903007647/MAIN/application/pdf/be37e039b8385cd036205c6c3b418a9b/main.pdf https://s3-eu-west-1.amazonaws.com/prod-ucs-content-store-eu-west/content/pii:S1381116903007647/MAIN/application/pdf/be37e039b8385cd036205c6c3b418a9b/main.pdf main.pdf pdf true 113014 MAIN 8 1-s2.0-S1381116903007647-main_1.png https://s3.amazonaws.com/prod-ucs-content-store-us-east/content/pii:S1381116903007647/PREVIEW/image/png/f5b5089172b535a524b67e8a553a4455/main_1.png https://s3-eu-west-1.amazonaws.com/prod-ucs-content-store-eu-west/content/pii:S1381116903007647/PREVIEW/image/png/f5b5089172b535a524b67e8a553a4455/main_1.png main_1.png png 75475 849 656 IMAGE-WEB-PDF 1 1-s2.0-S1381116903007647-si9.gif https://s3.amazonaws.com/prod-ucs-content-store-us-east/content/pii:S1381116903007647/STRIPIN/image/gif/30a6913e1cd16c33450125f5f316712b/si10.gif https://s3-eu-west-1.amazonaws.com/prod-ucs-content-store-eu-west/content/pii:S1381116903007647/STRIPIN/image/gif/30a6913e1cd16c33450125f5f316712b/si10.gif si9 si9.gif gif 149 14 20 ALTIMG 1-s2.0-S1381116903007647-si8.gif https://s3.amazonaws.com/prod-ucs-content-store-us-east/content/pii:S1381116903007647/STRIPIN/image/gif/26279c348d01439d170399e9865190e0/si11.gif https://s3-eu-west-1.amazonaws.com/prod-ucs-content-store-eu-west/content/pii:S1381116903007647/STRIPIN/image/gif/26279c348d01439d170399e9865190e0/si11.gif si8 si8.gif gif 181 14 24 ALTIMG 1-s2.0-S1381116903007647-si7.gif https://s3.amazonaws.com/prod-ucs-content-store-us-east/content/pii:S1381116903007647/STRIPIN/image/gif/a1269cefeae33a539f4fda12c9b3515d/si6.gif https://s3-eu-west-1.amazonaws.com/prod-ucs-content-store-eu-west/content/pii:S1381116903007647/STRIPIN/image/gif/a1269cefeae33a539f4fda12c9b3515d/si6.gif si7 si7.gif gif 351 16 75 ALTIMG 1-s2.0-S1381116903007647-si6.gif https://s3.amazonaws.com/prod-ucs-content-store-us-east/content/pii:S1381116903007647/STRIPIN/image/gif/a1269cefeae33a539f4fda12c9b3515d/si6.gif https://s3-eu-west-1.amazonaws.com/prod-ucs-content-store-eu-west/content/pii:S1381116903007647/STRIPIN/image/gif/a1269cefeae33a539f4fda12c9b3515d/si6.gif si6 si6.gif gif 351 16 75 ALTIMG 1-s2.0-S1381116903007647-si5.gif https://s3.amazonaws.com/prod-ucs-content-store-us-east/content/pii:S1381116903007647/STRIPIN/image/gif/30a6913e1cd16c33450125f5f316712b/si10.gif https://s3-eu-west-1.amazonaws.com/prod-ucs-content-store-eu-west/content/pii:S1381116903007647/STRIPIN/image/gif/30a6913e1cd16c33450125f5f316712b/si10.gif si5 si5.gif gif 149 14 20 ALTIMG 1-s2.0-S1381116903007647-si4.gif https://s3.amazonaws.com/prod-ucs-content-store-us-east/content/pii:S1381116903007647/STRIPIN/image/gif/21716a4011736f73f9c45548988d97ad/si4.gif https://s3-eu-west-1.amazonaws.com/prod-ucs-content-store-eu-west/content/pii:S1381116903007647/STRIPIN/image/gif/21716a4011736f73f9c45548988d97ad/si4.gif si4 si4.gif gif 184 14 23 ALTIMG 1-s2.0-S1381116903007647-si3.gif https://s3.amazonaws.com/prod-ucs-content-store-us-east/content/pii:S1381116903007647/STRIPIN/image/gif/30a6913e1cd16c33450125f5f316712b/si10.gif https://s3-eu-west-1.amazonaws.com/prod-ucs-content-store-eu-west/content/pii:S1381116903007647/STRIPIN/image/gif/30a6913e1cd16c33450125f5f316712b/si10.gif si3 si3.gif gif 149 14 20 ALTIMG 1-s2.0-S1381116903007647-si22.gif https://s3.amazonaws.com/prod-ucs-content-store-us-east/content/pii:S1381116903007647/STRIPIN/image/gif/30a6913e1cd16c33450125f5f316712b/si10.gif https://s3-eu-west-1.amazonaws.com/prod-ucs-content-store-eu-west/content/pii:S1381116903007647/STRIPIN/image/gif/30a6913e1cd16c33450125f5f316712b/si10.gif si22 si22.gif gif 149 14 20 ALTIMG 1-s2.0-S1381116903007647-si21.gif https://s3.amazonaws.com/prod-ucs-content-store-us-east/content/pii:S1381116903007647/STRIPIN/image/gif/26279c348d01439d170399e9865190e0/si11.gif https://s3-eu-west-1.amazonaws.com/prod-ucs-content-store-eu-west/content/pii:S1381116903007647/STRIPIN/image/gif/26279c348d01439d170399e9865190e0/si11.gif si21 si21.gif gif 181 14 24 ALTIMG 1-s2.0-S1381116903007647-si20.gif https://s3.amazonaws.com/prod-ucs-content-store-us-east/content/pii:S1381116903007647/STRIPIN/image/gif/30a6913e1cd16c33450125f5f316712b/si10.gif https://s3-eu-west-1.amazonaws.com/prod-ucs-content-store-eu-west/content/pii:S1381116903007647/STRIPIN/image/gif/30a6913e1cd16c33450125f5f316712b/si10.gif si20 si20.gif gif 149 14 20 ALTIMG 1-s2.0-S1381116903007647-si2.gif https://s3.amazonaws.com/prod-ucs-content-store-us-east/content/pii:S1381116903007647/STRIPIN/image/gif/f5e3af9466b3a6889be4a563a36dff45/si13.gif https://s3-eu-west-1.amazonaws.com/prod-ucs-content-store-eu-west/content/pii:S1381116903007647/STRIPIN/image/gif/f5e3af9466b3a6889be4a563a36dff45/si13.gif si2 si2.gif gif 192 14 25 ALTIMG 1-s2.0-S1381116903007647-si19.gif https://s3.amazonaws.com/prod-ucs-content-store-us-east/content/pii:S1381116903007647/STRIPIN/image/gif/30a6913e1cd16c33450125f5f316712b/si10.gif https://s3-eu-west-1.amazonaws.com/prod-ucs-content-store-eu-west/content/pii:S1381116903007647/STRIPIN/image/gif/30a6913e1cd16c33450125f5f316712b/si10.gif si19 si19.gif gif 149 14 20 ALTIMG 1-s2.0-S1381116903007647-si18.gif https://s3.amazonaws.com/prod-ucs-content-store-us-east/content/pii:S1381116903007647/STRIPIN/image/gif/26279c348d01439d170399e9865190e0/si11.gif https://s3-eu-west-1.amazonaws.com/prod-ucs-content-store-eu-west/content/pii:S1381116903007647/STRIPIN/image/gif/26279c348d01439d170399e9865190e0/si11.gif si18 si18.gif gif 181 14 24 ALTIMG 1-s2.0-S1381116903007647-si17.gif https://s3.amazonaws.com/prod-ucs-content-store-us-east/content/pii:S1381116903007647/STRIPIN/image/gif/30a6913e1cd16c33450125f5f316712b/si10.gif https://s3-eu-west-1.amazonaws.com/prod-ucs-content-store-eu-west/content/pii:S1381116903007647/STRIPIN/image/gif/30a6913e1cd16c33450125f5f316712b/si10.gif si17 si17.gif gif 149 14 20 ALTIMG 1-s2.0-S1381116903007647-si16.gif https://s3.amazonaws.com/prod-ucs-content-store-us-east/content/pii:S1381116903007647/STRIPIN/image/gif/f5e3af9466b3a6889be4a563a36dff45/si13.gif https://s3-eu-west-1.amazonaws.com/prod-ucs-content-store-eu-west/content/pii:S1381116903007647/STRIPIN/image/gif/f5e3af9466b3a6889be4a563a36dff45/si13.gif si16 si16.gif gif 192 14 25 ALTIMG 1-s2.0-S1381116903007647-si15.gif https://s3.amazonaws.com/prod-ucs-content-store-us-east/content/pii:S1381116903007647/STRIPIN/image/gif/30a6913e1cd16c33450125f5f316712b/si10.gif https://s3-eu-west-1.amazonaws.com/prod-ucs-content-store-eu-west/content/pii:S1381116903007647/STRIPIN/image/gif/30a6913e1cd16c33450125f5f316712b/si10.gif si15 si15.gif gif 149 14 20 ALTIMG 1-s2.0-S1381116903007647-si14.gif https://s3.amazonaws.com/prod-ucs-content-store-us-east/content/pii:S1381116903007647/STRIPIN/image/gif/30a6913e1cd16c33450125f5f316712b/si10.gif https://s3-eu-west-1.amazonaws.com/prod-ucs-content-store-eu-west/content/pii:S1381116903007647/STRIPIN/image/gif/30a6913e1cd16c33450125f5f316712b/si10.gif si14 si14.gif gif 149 14 20 ALTIMG 1-s2.0-S1381116903007647-si13.gif https://s3.amazonaws.com/prod-ucs-content-store-us-east/content/pii:S1381116903007647/STRIPIN/image/gif/f5e3af9466b3a6889be4a563a36dff45/si13.gif https://s3-eu-west-1.amazonaws.com/prod-ucs-content-store-eu-west/content/pii:S1381116903007647/STRIPIN/image/gif/f5e3af9466b3a6889be4a563a36dff45/si13.gif si13 si13.gif gif 192 14 25 ALTIMG 1-s2.0-S1381116903007647-si12.gif https://s3.amazonaws.com/prod-ucs-content-store-us-east/content/pii:S1381116903007647/STRIPIN/image/gif/30a6913e1cd16c33450125f5f316712b/si10.gif https://s3-eu-west-1.amazonaws.com/prod-ucs-content-store-eu-west/content/pii:S1381116903007647/STRIPIN/image/gif/30a6913e1cd16c33450125f5f316712b/si10.gif si12 si12.gif gif 149 14 20 ALTIMG 1-s2.0-S1381116903007647-si11.gif https://s3.amazonaws.com/prod-ucs-content-store-us-east/content/pii:S1381116903007647/STRIPIN/image/gif/26279c348d01439d170399e9865190e0/si11.gif https://s3-eu-west-1.amazonaws.com/prod-ucs-content-store-eu-west/content/pii:S1381116903007647/STRIPIN/image/gif/26279c348d01439d170399e9865190e0/si11.gif si11 si11.gif gif 181 14 24 ALTIMG 1-s2.0-S1381116903007647-si10.gif https://s3.amazonaws.com/prod-ucs-content-store-us-east/content/pii:S1381116903007647/STRIPIN/image/gif/30a6913e1cd16c33450125f5f316712b/si10.gif https://s3-eu-west-1.amazonaws.com/prod-ucs-content-store-eu-west/content/pii:S1381116903007647/STRIPIN/image/gif/30a6913e1cd16c33450125f5f316712b/si10.gif si10 si10.gif gif 149 14 20 ALTIMG 1-s2.0-S1381116903007647-si1.gif https://s3.amazonaws.com/prod-ucs-content-store-us-east/content/pii:S1381116903007647/STRIPIN/image/gif/30a6913e1cd16c33450125f5f316712b/si10.gif https://s3-eu-west-1.amazonaws.com/prod-ucs-content-store-eu-west/content/pii:S1381116903007647/STRIPIN/image/gif/30a6913e1cd16c33450125f5f316712b/si10.gif si1 si1.gif gif 149 14 20 ALTIMG 1-s2.0-S1381116903007647-fx1.sml https://s3.amazonaws.com/prod-ucs-content-store-us-east/content/pii:S1381116903007647/fx1/THUMBNAIL/image/gif/c7d4d1b7c9fd0908c1c2dd726b89554d/fx1.sml https://s3-eu-west-1.amazonaws.com/prod-ucs-content-store-eu-west/content/pii:S1381116903007647/fx1/THUMBNAIL/image/gif/c7d4d1b7c9fd0908c1c2dd726b89554d/fx1.sml fx1 true fx1.sml sml 570 42 125 IMAGE-THUMBNAIL 1-s2.0-S1381116903007647-fx1.gif https://s3.amazonaws.com/prod-ucs-content-store-us-east/content/pii:S1381116903007647/fx1/DOWNSAMPLED/image/gif/6c183a420dda96da1da6e18b8c9145c7/fx1.gif https://s3-eu-west-1.amazonaws.com/prod-ucs-content-store-eu-west/content/pii:S1381116903007647/fx1/DOWNSAMPLED/image/gif/6c183a420dda96da1da6e18b8c9145c7/fx1.gif fx1 true fx1.gif gif 3216 143 423 IMAGE-DOWNSAMPLED 1-s2.0-S1381116903007647-sc1.sml https://s3.amazonaws.com/prod-ucs-content-store-us-east/content/pii:S1381116903007647/sc1/THUMBNAIL/image/gif/78b5ad66b805b38cce12c680e7490708/sc1.sml https://s3-eu-west-1.amazonaws.com/prod-ucs-content-store-eu-west/content/pii:S1381116903007647/sc1/THUMBNAIL/image/gif/78b5ad66b805b38cce12c680e7490708/sc1.sml sc1 sc1.sml sml 1181 21 125 IMAGE-THUMBNAIL 1-s2.0-S1381116903007647-sc1.gif https://s3.amazonaws.com/prod-ucs-content-store-us-east/content/pii:S1381116903007647/sc1/DOWNSAMPLED/image/gif/5453f5f14008198687a1e050da29faa7/sc1.gif https://s3-eu-west-1.amazonaws.com/prod-ucs-content-store-eu-west/content/pii:S1381116903007647/sc1/DOWNSAMPLED/image/gif/5453f5f14008198687a1e050da29faa7/sc1.gif sc1 sc1.gif gif 2267 55 328 IMAGE-DOWNSAMPLED 1-s2.0-S1381116903007647-gr1.sml https://s3.amazonaws.com/prod-ucs-content-store-us-east/content/pii:S1381116903007647/gr1/THUMBNAIL/image/gif/9fadd8ab375666f9a75d0cac2c7690c6/gr1.sml https://s3-eu-west-1.amazonaws.com/prod-ucs-content-store-eu-west/content/pii:S1381116903007647/gr1/THUMBNAIL/image/gif/9fadd8ab375666f9a75d0cac2c7690c6/gr1.sml gr1 gr1.sml sml 1629 92 79 IMAGE-THUMBNAIL 1-s2.0-S1381116903007647-gr1.gif https://s3.amazonaws.com/prod-ucs-content-store-us-east/content/pii:S1381116903007647/gr1/DOWNSAMPLED/image/gif/9cd671f2149ee4b0cc478b1f8cadf600/gr1.gif https://s3-eu-west-1.amazonaws.com/prod-ucs-content-store-eu-west/content/pii:S1381116903007647/gr1/DOWNSAMPLED/image/gif/9cd671f2149ee4b0cc478b1f8cadf600/gr1.gif gr1 gr1.gif gif 4585 255 219 IMAGE-DOWNSAMPLED 1-s2.0-S1381116903007647-sc2.sml https://s3.amazonaws.com/prod-ucs-content-store-us-east/content/pii:S1381116903007647/sc2/THUMBNAIL/image/gif/c29b75951aacdf2d6b8b66ed8c47b785/sc2.sml https://s3-eu-west-1.amazonaws.com/prod-ucs-content-store-eu-west/content/pii:S1381116903007647/sc2/THUMBNAIL/image/gif/c29b75951aacdf2d6b8b66ed8c47b785/sc2.sml sc2 sc2.sml sml 1227 31 125 IMAGE-THUMBNAIL 1-s2.0-S1381116903007647-sc2.gif https://s3.amazonaws.com/prod-ucs-content-store-us-east/content/pii:S1381116903007647/sc2/DOWNSAMPLED/image/gif/04b53e2dc6a5f2d3890f3b8129e62363/sc2.gif https://s3-eu-west-1.amazonaws.com/prod-ucs-content-store-eu-west/content/pii:S1381116903007647/sc2/DOWNSAMPLED/image/gif/04b53e2dc6a5f2d3890f3b8129e62363/sc2.gif sc2 sc2.gif gif 2332 80 325 IMAGE-DOWNSAMPLED 1-s2.0-S1381116903007647-gr2.sml https://s3.amazonaws.com/prod-ucs-content-store-us-east/content/pii:S1381116903007647/gr2/THUMBNAIL/image/gif/0260215274b52f4a489d652b348b7c6a/gr2.sml https://s3-eu-west-1.amazonaws.com/prod-ucs-content-store-eu-west/content/pii:S1381116903007647/gr2/THUMBNAIL/image/gif/0260215274b52f4a489d652b348b7c6a/gr2.sml gr2 gr2.sml sml 3476 71 125 IMAGE-THUMBNAIL 1-s2.0-S1381116903007647-gr2.jpg https://s3.amazonaws.com/prod-ucs-content-store-us-east/content/pii:S1381116903007647/gr2/DOWNSAMPLED/image/jpeg/1c819f4d70bac17feda475560ebfd92c/gr2.jpg https://s3-eu-west-1.amazonaws.com/prod-ucs-content-store-eu-west/content/pii:S1381116903007647/gr2/DOWNSAMPLED/image/jpeg/1c819f4d70bac17feda475560ebfd92c/gr2.jpg gr2 gr2.jpg jpg 94200 353 618 IMAGE-DOWNSAMPLED 1-s2.0-S1381116903007647-sc3.sml https://s3.amazonaws.com/prod-ucs-content-store-us-east/content/pii:S1381116903007647/sc3/THUMBNAIL/image/gif/864f0a2f1a1d3376dc111b77e2d5b179/sc3.sml https://s3-eu-west-1.amazonaws.com/prod-ucs-content-store-eu-west/content/pii:S1381116903007647/sc3/THUMBNAIL/image/gif/864f0a2f1a1d3376dc111b77e2d5b179/sc3.sml sc3 sc3.sml sml 1935 81 125 IMAGE-THUMBNAIL 1-s2.0-S1381116903007647-sc3.gif https://s3.amazonaws.com/prod-ucs-content-store-us-east/content/pii:S1381116903007647/sc3/DOWNSAMPLED/image/gif/9d30c4dd160018442338d87dbe4b5a97/sc3.gif https://s3-eu-west-1.amazonaws.com/prod-ucs-content-store-eu-west/content/pii:S1381116903007647/sc3/DOWNSAMPLED/image/gif/9d30c4dd160018442338d87dbe4b5a97/sc3.gif sc3 sc3.gif gif 4911 191 295 IMAGE-DOWNSAMPLED MOLCAA 4415 S1381-1169(03)00764-7 10.1016/j.molcata.2003.11.011 Elsevier B.V. Scheme 1 Catalytic hydration of 3-hexyne. Fig. 1 Comparison of the structural motifs found in complexes (Ph3P)AuOS(O)2-p-tol (4) and (Ph3P)AgOS(O)2-p-tol (8). Scheme 2 Products of the hydration of 3-hexyne in aqueous methanol as solvent. Fig. 2 Influence of the co-catalyst concentration on the reaction rate. Scheme 3 Proposed mechanism for the addition of MeOH to propyne [9a]. Table 1 Hydration of 3-hexyne in the presence of various catalysts a Catalyst mol% Catalyst referred to 3-hexyne Time (h) Yield (%) b TOF (h−1) (Ph3P)AuOC(O)C2F5 (1) 0.134 1.8 51.2 213 [(p-Tol)3P]AuOC(O)C2F5 (2) 0.137 2 43.2 163 (Me3P)AuOC(O)C2F5 (3) 0.095 2 18.8 c 99 c (Ph3P)AuOS(O)2-p-tol (4) 0.132 4 82.1 155 (Ph3P)AuOS(O)2Et (5) 0.146 1.5 35.0 160 (Ph3P)AuSS(O)2-p-tol (6) 0.129 48 0.12 0.02 (Ph3P)AgOC(O)C2F5 (7) 0.156 48 – – (Ph3P)AgOS(O)2-p-tol·EtOH (8) 0.167 48 – – a Reaction conditions: 1.0g of 3-hexyne (12.05mmol); 870mg of H2O (4eqiv.); 5.25mol% BF3·Et2O; 5ml of THF; 45°C. b Determined using gas chromatography (diethyleneglycol-di-n-butylether as the internal standard). c After a few minutes decomposition to elemental gold occurred. Table 2 Temperature and solvent dependence of the hydration of 3-hexyne catalyzed by (Ph3P)AuOC(O)C2F5 (1) a Entry Temperature (°C) Solvent (5ml) Time (h) Yield (%) b TOF (h−1) 1 22 THF 2 13.9 28 2 30 THF 2 34.7 70 3 45 THF 1.8 51.2 213 4 45 MeOH 0.8 86.8 790 5 60 THF 1 56.6 424 6 60 MeOH 0.2 55.5 2078 7 70 MeOH 0.1 52.1 3900 a Reaction conditions: 1.0g of 3-hexyne (12.05mmol); 870mg of H2O (4eqiv.); 5.25mol% BF3·Et2O; 10 of mg (Ph3P)AuOC(O)C2F5 (1, 0.134mol%). b Determined using gas chromatography (diethyleneglycol-di-n-butylether as the internal standard). Table 3 Influence of the co-catalyst concentration on the reaction rate a Entry Co-catalyst Time (h) Yield (%) b TOF (h−1) mg mol% 1 (Without catalyst) 90 (BF3·Et2O) 5.25 24 – – 2 – – 24 – – 3 7 (BF3·Et2O) 0.41 2 0.1 0.38 4 15 (BF3·Et2O) 0.88 2 0.3 1.1 5 30 (BF3·Et2O) 1.75 2 18.7 70.8 6 45 (BF3·Et2O) 2.6 2 27 102 7 90 (BF3·Et2O) 5.25 2 42 159 8 180 (BF3·Et2O) 10.5 2 42.4 160 a Reaction conditions: 1.0g of 3-hexyne (12.05mmol); 870mg of H2O (4eqiv.); 10mg of (Ph3P)AuOS(O)2-p-tol (4, 0.132mol%); 5ml of THF; 45°C. b Determined using gas chromatography (diethyleneglycol-di-n-butylether as internal standard). Table 4 Influence of the substrate on the reaction rate and the regioselectivity Substrate Time (h) Yield (%) TOF (h−1) Markovnikov addition (%) 3-Hexyne 4 82.1 155 – Phenylacetylene 4 6.4 12.0 98.8 Cyclopentylacetylene 4 7.1 13.6 99.6 Application of (phosphine)gold(I) carboxylates, sulfonates and related compounds as highly efficient catalysts for the hydration of alkynes Patric Roembke a Hubert Schmidbaur a ∗ Stephanie Cronje b Helgard Raubenheimer b a Anorganisch-Chemisches Institut, Technische Universität München, Lichtenbergstrasse 4, D-85747 Garching, Germany b Department of Chemistry, University of Stellenbosch, Private Bag X1, Matieland, Stellenbosch, South Africa * Corresponding author. Tel.: +49-8-9289-13124; fax: +49-8-9289-13125. A series of six gold(I) complexes LAuX (L=Ph3P, X=CO2C2F5, SO3-p-tol, SO3Et, SSO2-p-tol; L=Me3P, (p-tol)3P, X=CO2C2F5) have been used as highly active catalysts for the hydration of 3-hexyne forming 3-hexanone in the presence of BF3·Et2O as a co-catalyst. Similar silver(I) complexes have also been investigated in this regard and an explanation for their lack of activity is given in this paper. The catalytic activity of a series of six gold(I) complexes LAuX (L=Ph3P, X=CO2C2F5, SO3-p-tol, SO3Et, SSO2-p-tol; L=Me3P, (p-tol)3P, X=CO2C2F5), as well as the silver(I) complexes Ph3PAgOC(O)C2F5 and Ph3PAgOS(O)2-p-tol·EtOH, regarding the hydration of 3-hexyne forming 3-hexanone in the presence of BF3·Et2O as a co-catalyst has been investigated. It could be shown that all the gold compounds are catalytically active with (Ph3P)AuOC(O)C2F5 (1) being the most active. Using 1, hydration of 3-hexyne takes place at room temperature and turnover frequencies (TOFs) as high as 3900h−1 can be reached without any notable catalyst deterioration (MeOH as solvent, 70°C). The silver complexes on the other hand did not furnish 3-hexanone under reaction conditions. This observation is explained with silver being the stronger acceptor compared to gold which can be derived from the crystal structures of representative examples. An optimization of the co-catalyst concentration showed that with increasing concentration the reaction rate increases significantly reaching saturation at approximately 5mol%. This indicates that the Lewis acid BF3·Et2O plays a role in several steps of the catalytic cycle. 1 was also successfully employed as a catalyst to react acetic acid with 3-hexyne forming 3-hexene-3-acetate but due to water being present in the glacial acetic acid 3-hexanone was also formed. Keywords Gold Silver Sulfonate complexes Carboxylate complexes Catalysis Hydration Alkynes 1 Introduction One of the most straightforward ways to generate compounds with carbonoxygen bonds is the hydration of unsaturated organic compounds. An efficient hydration process is not only environmentally benign but also economically attractive. Especially the synthesis of carbonyl compounds by addition of water to alkynes has been extensively studied [1]. It has long been known that water can be added quite easily to activated electron-rich alkynes such as alkynylethers or alkynylthioethers in the presence of an acid catalyst [2]. However, simple alkynes are not readily hydrated even in the presence of a co-catalyst (typically toxic mercury(II) salts) [3]. Several transition metal catalysts containing RuII,III [4], RhI [5], PtII [6], AuIII [7] and other metals [8] have also been employed in the past, but only with limited success. The best results were obtained for the hydration of 3-pentyn-1-ol in the presence of [cis-PtCl2(tpps)2] (tpps=P(m-C6H4SO3Na)3) with an initial turnover frequency (TOF) of 550h−1 and an overall TOF of not more than approximately 100h−1 [6c]. In 1998, Teles et al. have shown that certain (phosphine)gold(I) complexes of the type (R3P)Au+X− are extremely efficient catalysts for the addition of methanol to alkynes in the presence of Brønsted or Lewis acidic co-catalysts [9a]. In their patent application [9b], the authors also briefly mentioned the addition of water to propargyl alcohol, but quoted only low yields. These new results have been an incentive for extensive research in gold catalysis [10], a topic which had been neglected for a long time, as gold was often thought of as “catalytically dead” [11]. Very recently, Tanaka and co-workers found (triphenylphosphine)gold(I) sulfate to be a very active catalytic system for the hydration of 1-octyne. Conversion into 2-octanone proceeds in high yields and with turnover frequencies of approximately 3500h−1. Since the catalyst deteriorates under the standard reaction conditions (70°C; MeOH as solvent), the addition of additives such as carbon monoxide is necessary to stabilize the system. With this precaution higher yields and reaction rates (TOF=15,600h−1) have been achieved [12]. In the light of this encouraging progress, we initiated a search for a catalyst which is stable under standard reaction conditions which could serve in an environmentally and economically benign process without gaseous additives. In the present report it is demonstrated that (phosphine)gold(I) carboxylates and (phosphine)gold(I) sulfonates are highly active and reusable catalysts for the addition of water to non-activated alkynes. The addition of acetic acid to those substrates was also successful. 2 Experiments 2.1 Materials Syntheses of the catalysts were carried out in an atmosphere of dry nitrogen. Glassware was oven-dried, evacuated and flushed with nitrogen. Solvents were dried, distilled and stored under a nitrogen atmosphere. Standard equipment was used throughout. The glass apparatus was protected against light by an aluminum foil wrapper. Silver pentafluoropropionate and all tertiary phosphines are commercially available. (Phosphine)gold(I) chlorides [13] and silver sulfonates [14] were prepared according to literature procedures. The synthesis as well as structural and spectroscopic data for the catalysts used has recently been published elsewhere [15]. Therefore, only four representative examples are described in detail here. 2.2 Synthesis of (triphenylphosphine)gold(I) pentafluoropropionate (1) A solution of (Ph3P)AuCl (300mg, 0.60mmol) in dichloromethane (10ml) was added to a suspension of F5C2COOAg (200mg, 0.74mmol) in the same volume of the same solvent at −78°C with stirring and under protection against incandescent light. The mixture was stirred for 3h and subsequently filtered. The product was precipitated from the filtrate by addition of pentane, collected by filtration and recrystallized from dichloromethane (320mg, 85% yield), mp 134°C (decomposition). NMR (CD2Cl2, 20°C), 1 H : 6.68–7.12, m, Ph. 13 C { 1 H }: 128.4, d, J=67.7Hz, C (ipso); 129.8, d, J=12.3Hz, C (meta); 132.7, d, J=2.3Hz, C (para); 134.6, d, J=13.1Hz, C (ortho). 19 F { 1 H }: −6.3, t, 3J FF =112 Hz, CF3; −42.7, q, 3J FF =112 Hz, CF2. 31 P { 1 H }: 27.5, s. MS (FAB): m/z 1081, 10% [(Ph3PAu)2OCOC2F5]+; 721, 18% [(Ph3P)2Au]+; 459, 100% [Ph3PAu]+. C21H15AuO2PF5 (619.27) calcd. C 40.5, H 2.4; found C 40.8, H 2.5. 2.3 Synthesis of (triphenylphosphine)gold(I)-p-tolylsulfonate (4) A suspension of silver p-tolylsulfonate (300mg, 1.1mmol) in dichloromethane (20ml) was treated with a solution of Ph3PAuCl (500mg, 1.0mmol) in CH2Cl2 (10ml) at 20°C for 3h with stirring. The AgCl precipitate was filtered off and the product precipitated from the clear filtrate by addition of pentane. The product was filtered, washed with toluene and crystallized from CH2Cl2/pentane at −30°C; colorless rods containing dichloromethane, 490mg (78% yield), mp 162°C with decomposition. NMR (CDCl3, 20°C), 1 H : 7.9–7.1, m, 19H, C6H5/C6H4; 2.41, s, 3H, Me; 5.3, s, 2H, CH2Cl2. 31 P { 1 H }: 27.9, s. 13 C { 1 H }: 134.1, d, J=14.0Hz; 132.2, s; 129.3, d, J=12.3Hz; 127.6, d, J=64.9Hz for o, p, m, ipso in C6H5; 141.7, 139.2, 129.0, and 126.5, all s for ipso, o, m, and p in C6H4; 53.3, s for CH2Cl2, 21.3, s for Me. IR (KBr): 1261, 1184, 1146, 1100, 954cm−1 (ν(SO3R)). MS (FAB): m/z 721, 11% [(Ph3P)2Au]+; 631, 3% [M+1]+; 459, 100% [(Ph3P)Au]+; 262, 6% [Ph3P]+. C26H24AuCl2O3PS (715.35) calcd. C 43.6, H 3.4, S 4.5; found C 44.1, H 3.3, S 4.4. 2.4 Synthesis of (triphenylphosphine)silver(I) pentafluoropropionate (7) A suspension of C2F5CO2Ag (250mg, 0.93mmol) in 10ml of dichloromethane was treated with a solution of Ph3P (240mg, 0.93mmol) in the same volume of the same solvent at room temperature. A clear solution was obtained, the volume of which was reduced to ca. 5ml in a vacuum. Addition of cold pentane (−70°C) gave a colorless precipitate which was recrystallized from dichloromethane/pentane, yield 450mg (91%), mp 208°C. NMR (CDCl3, 20°C), 1 H : 7.38–7.56, m, Ph. 13 C { 1 H }: 163.2, t, J 25.5Hz, CO2; CF2 and CF3 were not detected; 128.9, d, J=37.4Hz; 129.3, d, J=10.1Hz; 131.5, s; 133.9, d, J=17.0Hz (for C ipso, meta, para, and ortho, respectively). 31 P { 1 H }: 15.4, s. IR (KBr): 1653cm−1 (ν(CO)). MS (FAB): m/z 631, 31.1% [L2Ag]+; 385, 3.0% [LAgO]+; 369, 100% [LAg]+; 262, 47.5% [L]+. C21H15AgO2PF5 (533.17) calcd. C 47.3, H 2.8, P 5.8; found C 47.3, H 2.7, P 6.2. 2.5 Synthesis of (triphenylphosphine)silver(I)-p-tolylsulfonate (ethanol) (8) 4-MeC6H4SO3Ag (290mg, 1.04mmol) was suspended in a mixture of dichloromethane and ethanol (10ml each) at room temperature and treated with Ph3P (270mg, 1.04mmol) for 2h with stirring to give an almost clear colorless solution. Small amounts of residue were filtered off and the volume of the filtrate was reduced to a few ml. The product was precipitated by addition of pentane, filtered, washed with pentane and diethylether, and dried in a vacuum, yield 430mg (76%), mp 124°C (with decomposition). Single crystals can be grown from pentane/ethanol at −30°C. NMR (CDCl3, 20°C), 1 H : 6.87–7.96, m, 19H, Ph and C6H4; 3.55, q, 2H, J=7.4Hz, CH2; 2.14, s, 3H, 4-Me; 1.16, t, 3H, Me. 31 P { 1 H }: 14.2, s. MS (FAB): m/z 910, 5.4% [(Ph3P)2Ag2SO3C6H4Me]+; 631, 16.3% [(Ph3P)2Ag]+; 369, 100% [Ph3PAg]+; 262, 26.4% [Ph3P]+. C27H28AgO4PS (587.40) calcd. C 55.2, H 4.8, S 5.5; found C 55.4, H 4.6, S 5.7. 2.6 Addition of water to 3-hexyne In a typical procedure, a solution of 3-hexyne (1.00g, 12.05mmol) in 5ml of THF (or MeOH) was mixed with water (870mg, 48.2mmol, 4eqiv.) and BF3·Et2O (90mg, 5.25mol%). The mixture was heated to the reaction temperature and the reaction was started by adding a gold catalyst, for example, Ph3PAuOC(O)C2F5 (1, 10mg, 0.016mol, 0.134mol%). At regular intervals, small samples were taken and analyzed by gas chromatography. 2.7 Addition of water to phenylacetylene One gram of phenylacetylene (9.79mmol) was dissolved in THF (5ml) and treated with water (720mg, 39.16mmol, 4eqiv.) in a small flask. After heating the reaction mixture to 45°C in a water bath BF3·Et2O (73mg, 5.25mol%) and (triphenylphosphine)gold(I)-p-tolylsulfonate (8.3mg, 0.132mol%) were added to start the catalysis. The reaction mixture was analyzed in regular intervals using gas chromatography. 2.8 Addition of water to cyclopentylacetylene Five hundred milligrams of cyclopentylacetylene (4.60mmol) were dissolved in THF (5ml) and treated with water (340mg, 18.80mmol, 4eqiv.) in a small flask. After heating the reaction mixture to 45°C in a water bath, BF3·Et2O (34mg, 5.25mol%) and (triphenylphosphine)gold(I)-p-tolylsulfonate (4.0mg, 0.132mol%) were added to start the reaction. The mixture was analyzed in regular intervals using gas chromatography. 2.9 Addition of acetic acid to 3-hexyne A small flask was charged with 3-hexyne (1.00g, 12.05mmol), THF (5ml), glacial acetic acid (3.61g, 5eqiv.) and BF3·Et2O (90mg, 5.25mol%). The mixture was heated to 60°C and the reaction was started by adding (triphenylphosphine)gold(I) pentafluoropropionate (10mg, 0.016mmol, 0.134mol%). After a reaction time of 1h, an excess of cold (−60°C) pentane was added in order to precipitate the gold catalyst and to stop the reaction. After filtration, the mixture was analyzed using gas chromatography. 3 Results and discussion In preliminary experiments, the complexes Ph3PAuOC(O)C2F5 (1), (p-tol)3PAuOC(O)C2F5 (2), Me3PAuOC(O)C2F5 (3), Ph3PAuOS(O)2-p-tol (4), Ph3PAuOS(O)2Et (5), Ph3PAuSS(O)2-p-tol (6), Ph3PAgOC(O)C2F5 (7), and Ph3PAgOS(O)2-p-tol·EtOH (8) were chosen for a study of their catalytic properties and applied to the reaction of water with 3-hexyne in THF in the presence of BF3·Et2O as a co-catalyst at 45°C (Scheme 1 ). The structural and spectroscopic data for complexes 1–8 have recently been discussed elsewhere [15]. The results of the catalysis experiments are summarized in Table 1 . It appears that the nature of the anions is a very important factor with respect to the catalytic activity, as already observed by Teles et al. for the addition of alcohols to alkynes in the presence of gold(I) catalysts [9]. The activity of the compounds is strongly related to the “hardness” of the anions, since the LAu+ cation (L=ligand) is likely to be the catalytically active species [9a]. This cation coordinates to the alkyne in the first step of the catalytic cycle, thus rendering it more susceptible for a nucleophilic attack. Therefore, it is not surprising that (Ph3P)AuSS(O)2-p-tol (6) containing the softer p-tolylthiosulfonate anion furnishes only traces of 3-hexanone after 48h, whereas (Ph3P)AuOS(O)2-p-tol (4) containing the harder p-tolylsulfonate anion yields more than 80% of the ketone product after only 4h of reaction time (TOF=155h−1). Even better results were obtained using (Ph3P)AuOS(O)2Et (5) which leads to a TOF of 160h−1. The most active compound however turned out to be (Ph3P)AuOC(O)C2F5 (1) containing the extremely hard pentafluoropropionate anion, giving rise to a turnover frequency of 213h−1. As far as the phosphine ligands are concerned, the activity increases as poor phosphinedonors are employed. Therefore, compound 1 containing triphenylphosphine is more active than compounds 2 (TOF=163h−1) and 3 (TOF=99h−1) containing the more strongly donating ligands tri-p-tolylphosphine and trimethylphosphine, respectively. Even better results are therefore to be expected using very electron-poor donors such as triphenylphosphite (PhO)3P, but their complexes with sulfonate or carboxylate counterions are not stable under the reaction conditions and therefore catalyst deterioration occurs very quickly. These observations again resemble the results obtained by Teles et al. for the addition of alcohols to alkynes using gold(I) sulfate complexes and sulfuric acid as the catalytic system [9a]. Under the same reaction conditions as applied for analogous gold compounds the silver complexes (Ph3P)AgOC(O)C2F5 (7) and (Ph3P)AgOS(O)2-p-tol (8) showed no catalytic activity. An explanation for this phenomena can be based on the comparison of the crystal structures of compounds 4 and 8 (Fig. 1 ) which have already been published [15a,c]. The mode of dimerization found in (Ph3P)AgOS(O)2-p-tol (8) reflects the high acceptor character of the silver atoms in these sulfonate complexes which leads not only to strong binding of an extra oxygen atom of a neighboring molecule but also to a fixation of an ethanol solvent molecule [15c]. For the corresponding gold complexes, no such acceptor properties are discernible. In crystals of (Ph3P)AuOS(O)2-p-tol (4), the monomers are only weakly associated via aurophilic contacts and no solvent is accepted in the coordination sphere of the metal atoms [15a]. The low catalytic reactivity of LAgX as compared to LAuX complexes, e.g. in the addition of nucleophiles to alkynes, is readily explained by the much stronger ligand binding at the silver atoms. The proposed active [LAg]+ species are therefore much less abundant in the corresponding dissociation equilibria than the [LAu]+ species [15a,c,16]. High [LAg]+ activity is to be expected only in cases with counterions X− devoid of any donor capacity and in the complete absence of donor solvent molecules. The corresponding gold systems are much less sensitive to the nature of X− and of the solvent owing to the strongly reduced acceptor properties of the metal atom. As (Ph3P)AuOC(O)C2F5 (1) turned out to be the most active catalyst among the complexes investigated, this compound was subsequently used for an investigation of the influence of the reaction temperature on the activity. The reaction of 3-hexyne with water in the presence of BF3·Et2O was again used as a model system. Since the results of Tanaka and co-workers indicated that the reaction rate in their catalytic system improves significantly by using methanol instead of THF as a solvent [12], experiments with both solvents were carried out at different temperatures. The results of these investigations are given in Table 2 . The results indicate that (Ph3P)AuOC(O)C2F5 (1) is a very active catalyst for hydration reactions of non-activated alkynes. The reaction takes place even at room temperature (Table 2, entry 1). It is not surprising that the activity increases significantly with increasing reaction temperatures, and for THF as a solvent the activity rises from 28h−1 at room temperature up to 424h−1 at 60°C. As already presumed, even higher reaction rates are observed using methanol instead of THF as a solvent. Thus, the TOF can be raised up to 3900h−1 at 70°C without any detectable catalyst deterioration. The catalyst can be recycled and reused. Even after five catalytic cycles, the activity stays the same within the precision range of the measurements. The turnover number after five cycles was approximately 3400, but it should be possible to increase this value even further. However, using methanol as a solvent gives rise to the formation of a small amount of 3-methoxy-3-hexene as a byproduct due to the addition of methanol to the triple bond (Scheme 2 ). In another set of experiments, the addition of water (870mg, 4eqiv.) to 3-hexyne (1.00g, 12.05mmol) in THF (5ml) at 45°C in the presence of (triphenylphosphine)gold(I)-p-tolylsulfonate (4, 10mg, 0.132mol%) as the catalyst was optimized in respect of the co-catalyst (BF3·Et2O) concentration. The results are summarized in Table 3 . It is interesting to note that neither without catalyst nor without co-catalyst any reaction is observed. Moreover, it appears that with increasing co-catalyst concentration the reaction rate increases significantly reaching saturation at approximately 5mol% (referring to 3-hexyne; Table 3, entry 7). Using even higher concentrations of BF3·Et2O does not lead to a further increase of the reaction rate. A visualization of these results is given in Fig. 2 . These results indicate that the co-catalyst is not only needed to remove the counterions of the gold complexes, thus forming the catalytically active cationic species, but should also play an important role in other steps of the catalytic cycle of the reaction. In the mechanism proposed by Teles et al. [9a], it has been proposed that organogold intermediates E and F are formed during the addition of methanol to propyne (Scheme 3 ), and it is likely that the addition of water to an alkyne should proceed similarly. As BF3·Et2O forms HF upon hydrolysis under the reaction conditions, it is likely that the hydrofluoric acid produced in this process also accelerates the cleavage of the goldcarbon bonds of the reaction intermediates. The regioselectivity and the influence of the substrate on the reaction rate were investigated using unsymmetrically substituted alkynes. Phenylacetylene and cyclopentylacetylene were reacted with water (4eqiv.) under the same conditions as described above (45°C, 5.25mol% BF3·Et2O, 5ml of THF) using (triphenylphosphine)gold(I)-p-tolylsulfonate (4, 0.132mol%) as a catalyst. The results show that in both cases Markovnikov addition is strongly favored (Table 4 ). It also appears that the substrate has a great influence on the reaction rates. Phenylacetylene and cyclopentylacetylene react more than one order of magnitude slower as compared to 3-hexyne. Using (triphenylphosphine)gold(I) pentafluoropropionate (1, 10mg, 0.016mmol, 0.134mol%) as a catalyst it was possible to add acetic acid (3.61g, 5eqiv.) to 3-hexyne (1.00g, 12.05mmol). The reaction of glacial acetic acid with 3-hexyne was carried out at 60°C in 5ml of THF and in the presence of BF3·Et2O as a co-catalyst (5.25mol%). After 1h reaction time, both 3-hexanone (yield 12.3%) and 3-hexene-3-acetate (yield 6.2%) could be detected using gas chromatography. Not surprisingly water present in small amounts in glacial acetic acid reacts preferentially due to its stronger nucleophilic character as compared to acetic acid. Addition of two molecules of acetic acid to the triple bond was not observed. If the same quantities of acetic acid, 3-hexyne and BF3·Et2O are mixed and heated to 60°C without adding a gold catalyst no reaction occurs at all. 4 Conclusion It could be shown that (phosphine)gold(I) carboxylates and sulfonates are highly active catalysts for hydration reactions of non-activated alkynes. Analogous silver(I) complexes are not active in this respect due to the fact that silver(I) cations are much stronger acceptors for their ligands and counterions as compared to gold(I) cations. (Triphenylphosphine)gold(I) pentafluoropropionate (1), the most active of the compounds investigated catalyzes the addition of water to 3-hexyne even at room temperature. The complex 1 can also be used at 70°C. Under these conditions, turnover frequencies as high as 3900h−1 are reached without the need for protective gaseous additives such as carbon monoxide to prevent catalyst deterioration. The catalyst was successfully recycled and reused five times without any notable loss of activity. For the reaction of 3-hexyne with water, the co-catalyst concentration was optimized. The results indicate that the co-catalyst serves more than one purpose in the catalytic cycle. Again, using 1 as a catalyst, it was possible to add acetic acid to 3-hexyne to give 3-hexene-3-acetate. With water present in glacial acetic acid, 3-hexanone is also formed. The results call for further investigations in order to finally reach a level which is acceptable as an environmentally as well as economically benign process for industrial applications. Acknowledgements The work was supported by Volkswagenstiftung, Fonds der Chemischen Industrie, Deutsche Forschungsgemeinschaft, Degussa AG and Heraeus GmbH. References [1] (a) P.F. Hudrlik, A.M. Hudrlik, in: S. Patai (Ed.), The Chemistry of the Carbon–Carbon Triple Bond. Part 1, Wiley, New York, 1978, p. 199 (b) G.H. Schmid, in: S. Patai (Ed.), The Chemistry of the Carbon–Carbon Triple Bond. Part 1, Wiley, New York, 1978, p. 275 (c) J. March, Advanced Organic Chemistry, Wiley, New York, 1992, p. 762 (d) A Schrohe Chem. Ber. 8 1875 367 (e) A Bayer Chem. Ber. 15 1882 2705 (f) W.H Perkin Jr. J. Chem. Soc. 45 1884 170 (g) T Tsuchimoto T Joya E Shirakawa Y Kawakami Synlett 12 2000 1777 (h) Y Izumi Catal. Today 33 1997 371 (i) I.V Kozhevnikov Chem. Rev. 98 1998 171 [2] (a) W Drenth H Hogeveen Recl. Trav. Chim. Pays-Bas 79 1960 1002 (b) A.D Allen Y Chiang A.J Kresge T.T Tidwell J. Org. Chem. 47 1982 775 and references therein [3] (a) V. Jäger, H.G. Viehe, Methoden d. Organic Chemistry, vol. 5/2a, 4th ed., Houben-Weyl, 1977, p. 726 (b) M Kutscheroff Chem. Ber. 17 1884 13 (c) R.J Thomas K.N Campbell G.F Hennion J. Am. Chem. Soc. 60 1938 718 (d) J.S Reichert J.H Bailey J.A Niewland J. Am. Chem. Soc. 45 1923 1553 (e) H.D Hinton J.A Niewland J. Am. Chem. Soc. 52 1930 1553 (f) D.B Killian G.F Hennion J.A Niewland J. Am. Chem. Soc. 56 1934 1384 (g) M. Basetti, B. Floris, J. Chem. Soc., Perkin Trans. II (1988) 227. [4] (a) M Tokunaga Y Wakatsuki Angew. Chem. Int. Ed. 37 1998 2867 (b) T Suzuki M Tokunaga Y Wakatsuki Org. Lett. 3 2001 735 (c) M Tokunaga T Suzuki N Koga T Fukushima A Horiuchi Y Wakatsuki J. Am. Chem. Soc. 123 2001 11917 (d) D.B Grotjahn C.D Incarvito A.L Rheingold Angew. Chem. Int. Ed. 40 2001 3884 (e) J Harpern B.R James A.L.W Kemp J. Am. Chem. Soc. 83 1961 4097 (f) J Harpern B.R James A.L.W Kemp J. Am. Chem. Soc. 88 1966 5142 (g) T Khan S.B Halligudi S Shukla J. Mol. Catal. 58 1990 299 [5] (a) B.R James G.L Rempel J. Am. Chem. Soc. 91 1969 863 (b) J Blum H Huminer H Alper J. Mol. Catal. 75 1992 153 [6] (a) W Hiscox P.W Jennings Organometallics 9 1990 1997 (b) W Baidossi M Lahav J Blum J. Org. Chem. 62 1997 669 (c) L.W Francisco D.A Moreno J.D Atwood Organometallics 20 2001 4237 [7] (a) Y Kukuda K Utimoto J. Org. Chem. 56 1991 3729 (b) Y Fukuda K Utimoto Bull. Chem. Soc. Jpn. 64 1991 2013 [8] (a) K Imi K Imai K Utimoto Tetrahedron Lett. 28 1987 3127 (b) I.K Meier J.A Marsella J. Mol. Catal. 78 1993 31 [9] (a) J.H Teles S Brode M Chabanas Angew. Chem. Int. Ed. 37 1998 1415 (b) J.H. Teles, M. Schulz, WO-A1 9721648 (1997), to BASF AG. [10] (a) R.O.C. Norman, W.J.E. Parr, C.B. Thomas, J. Chem. Soc., Perkin Trans. I (1976) 1983 (b) D Thompson Gold Bull. 31 1998 111 (c) D Thompson Gold Bull. 32 1999 12 (d) G.C Bond D.T Thompson Catal. Rev. 41 1999 319 (e) G.C Bond Gold Bull. 34 2001 117 (f) G Dyker Angew. Chem. Int. Ed. 39 2000 4237 (g) G.J Hutchings Catal. Today 72 2002 11 (h) A.S.K Hashmi Gold Bull. 36 2003 3 (i) Y Ito M Sawamura T Hayashi J. Am. Chem. Soc. 108 1986 6405 (j) S Komiya T Sone Y Usui M Hirano A Fukuoda Gold Bull. 29 1996 131 (k) V.A Soloshonok T Hayashi Tetrahedron Asymmetry 6 1994 1091 (l) J.E Parkes A.I Balch J. Organomet. Chem. 71 1974 453 (m) A.S.K Hashmi T.M Frost J.W Bats Catal. Today 72 2002 19 (n) A.S.K Hashmi T.M Frost J.W Bats Org. Lett. 3 2001 3769 (o) N Asao K Takahashi S Lee T Kasahara Y Yamamoto J. Am. Chem. Soc. 124 2002 12650 (p) A.S.K Hashmi T.M Frost J.W Bats J. Am. Chem. Soc. 122 2000 11553 (q) A Hoffmann-Röder N Krause Org. Lett. 3 2001 2537 (r) A.S.K Hashmi L Schwarz J.H Choi T.M Frost Angew. Chem. Int. Ed. 39 2000 2285 (s) J Dankwardt Tetrahedron Lett. 42 2001 5809 (t) Y Fukuda K Utimoto H Nozaki Heterocycles 25 1987 297 (u) T.E Müller M Beller Chem. Rev. 98 1998 675 (v) R Lok R.E Leone A.J Williams J. Org. Chem. 61 1996 3289 (w) A.S.K Hashmi L Ding J.W Bats P Fischer W Frey Chem. Eur. J. 9 2003 4339 (x) G.J Hutchings R Joffe Appl. Cat. 20 1986 215 (y) B Nkosi M.D Adams N.J Coville G.J Hutchings J. Catal. 128 1991 378 [11] (a) H. Schmidbaur (Ed.), Gold: Progress in Chemistry, Biochemistry and Technology, Wiley, Chichester, 1999 (b) H Schmidbaur Gold Bull. 23 1990 11 [12] E Mizushima K Sato T Hayashi M Tanaka Angew. Chem. Int. Ed. 41 2002 4563 [13] (a) N.C Baenziger W.E Bennet D.M Soboroff Acta Crystallogr. B 32 1976 962 (b) K Angermaier E Zeller H Schmidbaur J. Organomet. Chem. 472 1994 371 (c) A.K Al-Sa’ady C.A McAuliffe R.V Parish J.A Sandbank Inorg. Synth. 23 1985 191 (d) H Schmidbaur B Brachthäuser S Gamper A Schier O Steigelmann Z. Naturforsch. 47b 1992 1725 [14] Imta, Junichi, Saito, Junji, Ueda, Takashi, Jpn. Kokai Koho, JKXXAF JP 05213854 A2 19930824 (1993), to Mitsui Petrochemical Ind., Japan. [15] (a) P. Roembke, A. Schier, H. Schmidbaur, J. Chem. Soc., Dalton Trans. (2001) 2482 (b) P Roembke A Schier H Schmidbaur Z. Naturforsch. 57b 2002 605 (c) P Roembke A Schier H Schmidbaur Z. Naturforsch. 58b 2003 168 (d) P Roembke A Schier F Wiesbrock H Schmidbaur Inorg. Chim. Acta 347 2003 123 (e) P. Roembke, A. Schier, H. Schmidbaur, S. Cronje, H. Raubenheimer, Inorg. Chim. Acta, 357 (2004) 237. [16] M. Preisenberger, A. Schier, H. Schmidbaur, J. Chem. Soc., Dalton Trans. (1999) 1645.",
      "scopus-id": "1242272793",
      "coredata": {
        "eid": "1-s2.0-S1381116903007647",
        "dc:description": "The catalytic activity of a series of six gold(I) complexes LAuX (L=Ph3P, X=CO2C2F5, SO3-p-tol, SO3Et, SSO2-p-tol; L=Me3P, (p-tol)3P, X=CO2C2F5), as well as the silver(I) complexes Ph3PAgOC(O)C2F5 and Ph3PAgOS(O)2-p-tol·EtOH, regarding the hydration of 3-hexyne forming 3-hexanone in the presence of BF3·Et2O as a co-catalyst has been investigated. It could be shown that all the gold compounds are catalytically active with (Ph3P)AuOC(O)C2F5 (1) being the most active. Using 1, hydration of 3-hexyne takes place at room temperature and turnover frequencies (TOFs) as high as 3900h−1 can be reached without any notable catalyst deterioration (MeOH as solvent, 70°C). The silver complexes on the other hand did not furnish 3-hexanone under reaction conditions. This observation is explained with silver being the stronger acceptor compared to gold which can be derived from the crystal structures of representative examples. An optimization of the co-catalyst concentration showed that with increasing concentration the reaction rate increases significantly reaching saturation at approximately 5mol%. This indicates that the Lewis acid BF3·Et2O plays a role in several steps of the catalytic cycle. 1 was also successfully employed as a catalyst to react acetic acid with 3-hexyne forming 3-hexene-3-acetate but due to water being present in the glacial acetic acid 3-hexanone was also formed.",
        "openArchiveArticle": "false",
        "prism:coverDate": "2004-04-02",
        "openaccessUserLicense": null,
        "prism:aggregationType": "Journal",
        "prism:url": "https://api.elsevier.com/content/article/pii/S1381116903007647",
        "dc:creator": [
          {
            "@_fa": "true",
            "$": "Roembke, Patric"
          },
          {
            "@_fa": "true",
            "$": "Schmidbaur, Hubert"
          },
          {
            "@_fa": "true",
            "$": "Cronje, Stephanie"
          },
          {
            "@_fa": "true",
            "$": "Raubenheimer, Helgard"
          }
        ],
        "link": [
          {
            "@_fa": "true",
            "@rel": "self",
            "@href": "https://api.elsevier.com/content/article/pii/S1381116903007647"
          },
          {
            "@_fa": "true",
            "@rel": "scidir",
            "@href": "https://www.sciencedirect.com/science/article/pii/S1381116903007647"
          }
        ],
        "dc:format": "application/json",
        "openaccessType": null,
        "pii": "S1381-1169(03)00764-7",
        "prism:volume": "212",
        "prism:publisher": "Elsevier B.V.",
        "dc:title": "Application of (phosphine)gold(I) carboxylates, sulfonates and related compounds as highly efficient catalysts for the hydration of alkynes",
        "prism:copyright": "Copyright © 2003 Elsevier B.V. All rights reserved.",
        "openaccess": "0",
        "prism:issn": "13811169",
        "prism:issueIdentifier": "1-2",
        "dcterms:subject": [
          {
            "@_fa": "true",
            "$": "Gold"
          },
          {
            "@_fa": "true",
            "$": "Silver"
          },
          {
            "@_fa": "true",
            "$": "Sulfonate complexes"
          },
          {
            "@_fa": "true",
            "$": "Carboxylate complexes"
          },
          {
            "@_fa": "true",
            "$": "Catalysis"
          },
          {
            "@_fa": "true",
            "$": "Hydration"
          },
          {
            "@_fa": "true",
            "$": "Alkynes"
          }
        ],
        "openaccessArticle": "false",
        "prism:publicationName": "Journal of Molecular Catalysis A: Chemical",
        "prism:number": "1-2",
        "openaccessSponsorType": null,
        "prism:pageRange": "35-42",
        "prism:endingPage": "42",
        "pubType": "fla",
        "prism:coverDisplayDate": "2 April 2004",
        "prism:doi": "10.1016/j.molcata.2003.11.011",
        "prism:startingPage": "35",
        "dc:identifier": "doi:10.1016/j.molcata.2003.11.011",
        "openaccessSponsorName": null
      },
      "objects": {
        "object": [
          {
            "@category": "thumbnail",
            "@height": "14",
            "@width": "20",
            "@_fa": "true",
            "$": "https://api.elsevier.com/content/object/eid/1-s2.0-S1381116903007647-si9.gif?httpAccept=%2A%2F%2A",
            "@multimediatype": "GIF image file",
            "@type": "ALTIMG",
            "@size": "149",
            "@ref": "si9",
            "@mimetype": "image/gif"
          },
          {
            "@category": "thumbnail",
            "@height": "14",
            "@width": "24",
            "@_fa": "true",
            "$": "https://api.elsevier.com/content/object/eid/1-s2.0-S1381116903007647-si8.gif?httpAccept=%2A%2F%2A",
            "@multimediatype": "GIF image file",
            "@type": "ALTIMG",
            "@size": "181",
            "@ref": "si8",
            "@mimetype": "image/gif"
          },
          {
            "@category": "thumbnail",
            "@height": "16",
            "@width": "75",
            "@_fa": "true",
            "$": "https://api.elsevier.com/content/object/eid/1-s2.0-S1381116903007647-si7.gif?httpAccept=%2A%2F%2A",
            "@multimediatype": "GIF image file",
            "@type": "ALTIMG",
            "@size": "351",
            "@ref": "si7",
            "@mimetype": "image/gif"
          },
          {
            "@category": "thumbnail",
            "@height": "16",
            "@width": "75",
            "@_fa": "true",
            "$": "https://api.elsevier.com/content/object/eid/1-s2.0-S1381116903007647-si6.gif?httpAccept=%2A%2F%2A",
            "@multimediatype": "GIF image file",
            "@type": "ALTIMG",
            "@size": "351",
            "@ref": "si6",
            "@mimetype": "image/gif"
          },
          {
            "@category": "thumbnail",
            "@height": "14",
            "@width": "20",
            "@_fa": "true",
            "$": "https://api.elsevier.com/content/object/eid/1-s2.0-S1381116903007647-si5.gif?httpAccept=%2A%2F%2A",
            "@multimediatype": "GIF image file",
            "@type": "ALTIMG",
            "@size": "149",
            "@ref": "si5",
            "@mimetype": "image/gif"
          },
          {
            "@category": "thumbnail",
            "@height": "14",
            "@width": "23",
            "@_fa": "true",
            "$": "https://api.elsevier.com/content/object/eid/1-s2.0-S1381116903007647-si4.gif?httpAccept=%2A%2F%2A",
            "@multimediatype": "GIF image file",
            "@type": "ALTIMG",
            "@size": "184",
            "@ref": "si4",
            "@mimetype": "image/gif"
          },
          {
            "@category": "thumbnail",
            "@height": "14",
            "@width": "20",
            "@_fa": "true",
            "$": "https://api.elsevier.com/content/object/eid/1-s2.0-S1381116903007647-si3.gif?httpAccept=%2A%2F%2A",
            "@multimediatype": "GIF image file",
            "@type": "ALTIMG",
            "@size": "149",
            "@ref": "si3",
            "@mimetype": "image/gif"
          },
          {
            "@category": "thumbnail",
            "@height": "14",
            "@width": "20",
            "@_fa": "true",
            "$": "https://api.elsevier.com/content/object/eid/1-s2.0-S1381116903007647-si22.gif?httpAccept=%2A%2F%2A",
            "@multimediatype": "GIF image file",
            "@type": "ALTIMG",
            "@size": "149",
            "@ref": "si22",
            "@mimetype": "image/gif"
          },
          {
            "@category": "thumbnail",
            "@height": "14",
            "@width": "24",
            "@_fa": "true",
            "$": "https://api.elsevier.com/content/object/eid/1-s2.0-S1381116903007647-si21.gif?httpAccept=%2A%2F%2A",
            "@multimediatype": "GIF image file",
            "@type": "ALTIMG",
            "@size": "181",
            "@ref": "si21",
            "@mimetype": "image/gif"
          },
          {
            "@category": "thumbnail",
            "@height": "14",
            "@width": "20",
            "@_fa": "true",
            "$": "https://api.elsevier.com/content/object/eid/1-s2.0-S1381116903007647-si20.gif?httpAccept=%2A%2F%2A",
            "@multimediatype": "GIF image file",
            "@type": "ALTIMG",
            "@size": "149",
            "@ref": "si20",
            "@mimetype": "image/gif"
          },
          {
            "@category": "thumbnail",
            "@height": "14",
            "@width": "25",
            "@_fa": "true",
            "$": "https://api.elsevier.com/content/object/eid/1-s2.0-S1381116903007647-si2.gif?httpAccept=%2A%2F%2A",
            "@multimediatype": "GIF image file",
            "@type": "ALTIMG",
            "@size": "192",
            "@ref": "si2",
            "@mimetype": "image/gif"
          },
          {
            "@category": "thumbnail",
            "@height": "14",
            "@width": "20",
            "@_fa": "true",
            "$": "https://api.elsevier.com/content/object/eid/1-s2.0-S1381116903007647-si19.gif?httpAccept=%2A%2F%2A",
            "@multimediatype": "GIF image file",
            "@type": "ALTIMG",
            "@size": "149",
            "@ref": "si19",
            "@mimetype": "image/gif"
          },
          {
            "@category": "thumbnail",
            "@height": "14",
            "@width": "24",
            "@_fa": "true",
            "$": "https://api.elsevier.com/content/object/eid/1-s2.0-S1381116903007647-si18.gif?httpAccept=%2A%2F%2A",
            "@multimediatype": "GIF image file",
            "@type": "ALTIMG",
            "@size": "181",
            "@ref": "si18",
            "@mimetype": "image/gif"
          },
          {
            "@category": "thumbnail",
            "@height": "14",
            "@width": "20",
            "@_fa": "true",
            "$": "https://api.elsevier.com/content/object/eid/1-s2.0-S1381116903007647-si17.gif?httpAccept=%2A%2F%2A",
            "@multimediatype": "GIF image file",
            "@type": "ALTIMG",
            "@size": "149",
            "@ref": "si17",
            "@mimetype": "image/gif"
          },
          {
            "@category": "thumbnail",
            "@height": "14",
            "@width": "25",
            "@_fa": "true",
            "$": "https://api.elsevier.com/content/object/eid/1-s2.0-S1381116903007647-si16.gif?httpAccept=%2A%2F%2A",
            "@multimediatype": "GIF image file",
            "@type": "ALTIMG",
            "@size": "192",
            "@ref": "si16",
            "@mimetype": "image/gif"
          },
          {
            "@category": "thumbnail",
            "@height": "14",
            "@width": "20",
            "@_fa": "true",
            "$": "https://api.elsevier.com/content/object/eid/1-s2.0-S1381116903007647-si15.gif?httpAccept=%2A%2F%2A",
            "@multimediatype": "GIF image file",
            "@type": "ALTIMG",
            "@size": "149",
            "@ref": "si15",
            "@mimetype": "image/gif"
          },
          {
            "@category": "thumbnail",
            "@height": "14",
            "@width": "20",
            "@_fa": "true",
            "$": "https://api.elsevier.com/content/object/eid/1-s2.0-S1381116903007647-si14.gif?httpAccept=%2A%2F%2A",
            "@multimediatype": "GIF image file",
            "@type": "ALTIMG",
            "@size": "149",
            "@ref": "si14",
            "@mimetype": "image/gif"
          },
          {
            "@category": "thumbnail",
            "@height": "14",
            "@width": "25",
            "@_fa": "true",
            "$": "https://api.elsevier.com/content/object/eid/1-s2.0-S1381116903007647-si13.gif?httpAccept=%2A%2F%2A",
            "@multimediatype": "GIF image file",
            "@type": "ALTIMG",
            "@size": "192",
            "@ref": "si13",
            "@mimetype": "image/gif"
          },
          {
            "@category": "thumbnail",
            "@height": "14",
            "@width": "20",
            "@_fa": "true",
            "$": "https://api.elsevier.com/content/object/eid/1-s2.0-S1381116903007647-si12.gif?httpAccept=%2A%2F%2A",
            "@multimediatype": "GIF image file",
            "@type": "ALTIMG",
            "@size": "149",
            "@ref": "si12",
            "@mimetype": "image/gif"
          },
          {
            "@category": "thumbnail",
            "@height": "14",
            "@width": "24",
            "@_fa": "true",
            "$": "https://api.elsevier.com/content/object/eid/1-s2.0-S1381116903007647-si11.gif?httpAccept=%2A%2F%2A",
            "@multimediatype": "GIF image file",
            "@type": "ALTIMG",
            "@size": "181",
            "@ref": "si11",
            "@mimetype": "image/gif"
          },
          {
            "@category": "thumbnail",
            "@height": "14",
            "@width": "20",
            "@_fa": "true",
            "$": "https://api.elsevier.com/content/object/eid/1-s2.0-S1381116903007647-si10.gif?httpAccept=%2A%2F%2A",
            "@multimediatype": "GIF image file",
            "@type": "ALTIMG",
            "@size": "149",
            "@ref": "si10",
            "@mimetype": "image/gif"
          },
          {
            "@category": "thumbnail",
            "@height": "14",
            "@width": "20",
            "@_fa": "true",
            "$": "https://api.elsevier.com/content/object/eid/1-s2.0-S1381116903007647-si1.gif?httpAccept=%2A%2F%2A",
            "@multimediatype": "GIF image file",
            "@type": "ALTIMG",
            "@size": "149",
            "@ref": "si1",
            "@mimetype": "image/gif"
          },
          {
            "@category": "thumbnail",
            "@height": "42",
            "@width": "125",
            "@_fa": "true",
            "$": "https://api.elsevier.com/content/object/eid/1-s2.0-S1381116903007647-fx1.sml?httpAccept=%2A%2F%2A",
            "@multimediatype": "GIF image file",
            "@type": "IMAGE-THUMBNAIL",
            "@size": "570",
            "@ref": "fx1",
            "@mimetype": "image/gif"
          },
          {
            "@category": "standard",
            "@height": "143",
            "@width": "423",
            "@_fa": "true",
            "$": "https://api.elsevier.com/content/object/eid/1-s2.0-S1381116903007647-fx1.gif?httpAccept=%2A%2F%2A",
            "@multimediatype": "GIF image file",
            "@type": "IMAGE-DOWNSAMPLED",
            "@size": "3216",
            "@ref": "fx1",
            "@mimetype": "image/gif"
          },
          {
            "@category": "thumbnail",
            "@height": "21",
            "@width": "125",
            "@_fa": "true",
            "$": "https://api.elsevier.com/content/object/eid/1-s2.0-S1381116903007647-sc1.sml?httpAccept=%2A%2F%2A",
            "@multimediatype": "GIF image file",
            "@type": "IMAGE-THUMBNAIL",
            "@size": "1181",
            "@ref": "sc1",
            "@mimetype": "image/gif"
          },
          {
            "@category": "standard",
            "@height": "55",
            "@width": "328",
            "@_fa": "true",
            "$": "https://api.elsevier.com/content/object/eid/1-s2.0-S1381116903007647-sc1.gif?httpAccept=%2A%2F%2A",
            "@multimediatype": "GIF image file",
            "@type": "IMAGE-DOWNSAMPLED",
            "@size": "2267",
            "@ref": "sc1",
            "@mimetype": "image/gif"
          },
          {
            "@category": "thumbnail",
            "@height": "92",
            "@width": "79",
            "@_fa": "true",
            "$": "https://api.elsevier.com/content/object/eid/1-s2.0-S1381116903007647-gr1.sml?httpAccept=%2A%2F%2A",
            "@multimediatype": "GIF image file",
            "@type": "IMAGE-THUMBNAIL",
            "@size": "1629",
            "@ref": "gr1",
            "@mimetype": "image/gif"
          },
          {
            "@category": "standard",
            "@height": "255",
            "@width": "219",
            "@_fa": "true",
            "$": "https://api.elsevier.com/content/object/eid/1-s2.0-S1381116903007647-gr1.gif?httpAccept=%2A%2F%2A",
            "@multimediatype": "GIF image file",
            "@type": "IMAGE-DOWNSAMPLED",
            "@size": "4585",
            "@ref": "gr1",
            "@mimetype": "image/gif"
          },
          {
            "@category": "thumbnail",
            "@height": "31",
            "@width": "125",
            "@_fa": "true",
            "$": "https://api.elsevier.com/content/object/eid/1-s2.0-S1381116903007647-sc2.sml?httpAccept=%2A%2F%2A",
            "@multimediatype": "GIF image file",
            "@type": "IMAGE-THUMBNAIL",
            "@size": "1227",
            "@ref": "sc2",
            "@mimetype": "image/gif"
          },
          {
            "@category": "standard",
            "@height": "80",
            "@width": "325",
            "@_fa": "true",
            "$": "https://api.elsevier.com/content/object/eid/1-s2.0-S1381116903007647-sc2.gif?httpAccept=%2A%2F%2A",
            "@multimediatype": "GIF image file",
            "@type": "IMAGE-DOWNSAMPLED",
            "@size": "2332",
            "@ref": "sc2",
            "@mimetype": "image/gif"
          },
          {
            "@category": "thumbnail",
            "@height": "71",
            "@width": "125",
            "@_fa": "true",
            "$": "https://api.elsevier.com/content/object/eid/1-s2.0-S1381116903007647-gr2.sml?httpAccept=%2A%2F%2A",
            "@multimediatype": "GIF image file",
            "@type": "IMAGE-THUMBNAIL",
            "@size": "3476",
            "@ref": "gr2",
            "@mimetype": "image/gif"
          },
          {
            "@category": "standard",
            "@height": "353",
            "@width": "618",
            "@_fa": "true",
            "$": "https://api.elsevier.com/content/object/eid/1-s2.0-S1381116903007647-gr2.jpg?httpAccept=%2A%2F%2A",
            "@multimediatype": "JPEG image file",
            "@type": "IMAGE-DOWNSAMPLED",
            "@size": "94200",
            "@ref": "gr2",
            "@mimetype": "image/jpeg"
          },
          {
            "@category": "thumbnail",
            "@height": "81",
            "@width": "125",
            "@_fa": "true",
            "$": "https://api.elsevier.com/content/object/eid/1-s2.0-S1381116903007647-sc3.sml?httpAccept=%2A%2F%2A",
            "@multimediatype": "GIF image file",
            "@type": "IMAGE-THUMBNAIL",
            "@size": "1935",
            "@ref": "sc3",
            "@mimetype": "image/gif"
          },
          {
            "@category": "standard",
            "@height": "191",
            "@width": "295",
            "@_fa": "true",
            "$": "https://api.elsevier.com/content/object/eid/1-s2.0-S1381116903007647-sc3.gif?httpAccept=%2A%2F%2A",
            "@multimediatype": "GIF image file",
            "@type": "IMAGE-DOWNSAMPLED",
            "@size": "4911",
            "@ref": "sc3",
            "@mimetype": "image/gif"
          }
        ]
      },
      "link": {
        "@rel": "abstract",
        "@href": "https://api.elsevier.com/content/abstract/scopus_id/1242272793"
      }
    }
  }
}