{
  "metadata": {
    "title": "Mechanistic aspects for the direct oxidative esterification of aldehydes with alcohols over Pd catalyst: A computational study",
    "authors": "; ; ",
    "journal": "Journal of Molecular Catalysis A: Chemical",
    "date": "2012-06-30",
    "doi": "10.1016/j.molcata.2012.03.012",
    "abstract": "",
    "uri": "https://api.elsevier.com/content/article/pii/S1381116912000908",
    "pii": "S1381116912000908"
  },
  "fulltext": {
    "full-text-retrieval-response": {
      "scopus-eid": "2-s2.0-84860287729",
      "originalText": "serial JL 271358 291210 291744 291790 291809 31 Journal of Molecular Catalysis A: Chemical JOURNALMOLECULARCATALYSISACHEMICAL 2012-03-21 2012-03-21 2022-05-11T18:58:23 1-s2.0-S1381116912000908 S1381-1169(12)00090-8 S1381116912000908 10.1016/j.molcata.2012.03.012 S300 S300.2 FULL-TEXT 1-s2.0-S1381116912X00049 2022-05-11T21:51:52.193374Z 0 0 20120601 20120630 2012 2012-03-21T00:00:00Z absattachment articleinfo articletitlenorm authfirstinitialnorm authfirstsurnamenorm cid cids contenttype copyright crossmark dateloaded dateloadedtxt datesearch datesort dateupdated dco docsubtype doctype doi eid ewtransactionid hubeid indexeddate issn issnnorm itemstage itemtransactionid itemweight openaccess openarchive pg pgfirst pglast pii piinorm pubdateend pubdatestart pubdatetxt pubyr sectiontitle sortorder srctitle srctitlenorm srctype ssids alllist content subj subheadings suppl tomb volfirst volissue volumelist webpdf webpdfpagecount yearnav figure table body mmlmath acknowledge affil articletitle auth authfirstini authfull authkeywords authlast grantnumber grantsponsor primabst ref specialabst 1381-1169 13811169 false 358 358 C Volume 358 23 166 175 166 175 201206 June 2012 2012-06-01 2012-06-30 2012 Regular Papers article fla Copyright © 2012 Elsevier B.V. All rights reserved. MECHANISTICASPECTSFORDIRECTOXIDATIVEESTERIFICATIONALDEHYDESALCOHOLSOVERPDCATALYSTACOMPUTATIONALSTUDY YAO X 1 Introduction 2 Computational details 3 Results and discussion 3.1 (a) Reaction of the methoxyl with aldehyde carbonyl of MAL 3.2 (b) Reaction of the methoxyl with unsaturated CC bond of MAL 3.3 (c) Hydrogen addition to the CO bond of MAL 3.4 (d) Hydrogen addition to the CC bond 3.5 (e) Hydrogen elimination of the CHO group 3.6 (f) Hydrogen elimination of the CC bond 4 Conclusions Acknowledgments References MCDONALD 1989 1213 1215 C OKIMOTO 1998 218 219 M WUTS 1986 3995 3998 P CONNOR 1987 3235 3236 B MURAHASHI 1987 4319 4327 S WILLIAM 1988 5087 5090 D ESPENSON 1999 1191 1196 J GOPINATH 2003 2944 2947 R GOPINATH 2002 5123 5126 R YOO 2007 1033 1035 W KIYOOKA 2005 4639 4642 S NOONAN 2008 4003 4006 C KIM 2005 125 131 H PILLAI 2004 161 165 U LICHTENBERGER 2007 4902 4906 J UBAGOPEREZ 2007 158 163 R ENACHE 2006 362 365 D DIAO 2009 35 42 Y TAMARU 1983 1286 1292 Y KIYOOKA 2007 12695 12701 S WATARI 1998 1665 1669 N KUMAR 2002 V ZHANG 2003 5793 5801 W EFREMENKO 2000 445 451 I BERTHIER 2001 26 33 G GUIRADOLOPEZ 2000 13188 13195 R BARRETEAU 2000 395 402 C GAO 2008 2264 2270 F POON 2004 035401 H BERTIN 2006 243 248 V MORKEL 2005 146 156 M PACCHIONI 1987 2658 2664 G SHETH 2003 2009 2017 P MORIN 2003 2995 3002 C MITTENDORFER 2003 12287 12295 F PALLASSANA 2002 289 305 V STRAUB 2002 14195 14201 B FERREIRA 2008 1964 1967 J LAHTI 2007 3774 3777 M WANG 1991 13298 13307 Y VALCARCEL 2005 33 39 A ZHENG 2004 71 78 T CHEN 1995 248 262 J MITSUI 2003 5 11 T WATSON 2001 4889 4894 G GIORDANO 2004 163 168 L JUNG 2007 852 857 S BERKOWITZ 1994 2744 2765 J YAMAMATSU 2010 124 131 S YAOX2012X166 YAOX2012X166X175 YAOX2012X166XX YAOX2012X166X175XX 0 item S1381-1169(12)00090-8 S1381116912000908 1-s2.0-S1381116912000908 10.1016/j.molcata.2012.03.012 271358 2022-05-11T21:51:52.193374Z 2012-06-01 2012-06-30 1-s2.0-S1381116912000908-main.pdf https://s3-eu-west-1.amazonaws.com/prod-ucs-content-store-eu-west/content/pii:S1381116912000908/MAIN/application/pdf/e16e02fabd6f3af8fa0e097daa83f8f9/main.pdf main.pdf pdf true 1861494 MAIN 10 1-s2.0-S1381116912000908-main_1.png https://s3-eu-west-1.amazonaws.com/prod-ucs-content-store-eu-west/content/pii:S1381116912000908/PREVIEW/image/png/718beacc560472f0e50e40cf37229499/main_1.png main_1.png png 63724 849 656 IMAGE-WEB-PDF 1 1-s2.0-S1381116912000908-fx1.jpg https://s3-eu-west-1.amazonaws.com/prod-ucs-content-store-eu-west/content/pii:S1381116912000908/fx1/DOWNSAMPLED/image/jpeg/9e8819ca4069699607826101214cd2cb/fx1.jpg fx1 true fx1.jpg jpg 23896 200 420 IMAGE-DOWNSAMPLED 1-s2.0-S1381116912000908-gr1.jpg https://s3-eu-west-1.amazonaws.com/prod-ucs-content-store-eu-west/content/pii:S1381116912000908/gr1/THUMBNAIL/image/jpeg/0b137e1284e0d9aba136124c1f5ce387/gr1.jpg gr1 gr1.jpg jpg 38130 209 489 IMAGE-DOWNSAMPLED 1-s2.0-S1381116912000908-gr10.jpg https://s3-eu-west-1.amazonaws.com/prod-ucs-content-store-eu-west/content/pii:S1381116912000908/gr10/MAIN/image/jpeg/c4daa55e0c77440c2a6d6b422fef7739/gr10.jpg gr10 gr10.jpg jpg 52801 281 602 IMAGE-DOWNSAMPLED 1-s2.0-S1381116912000908-gr11.jpg https://s3-eu-west-1.amazonaws.com/prod-ucs-content-store-eu-west/content/pii:S1381116912000908/gr11/THUMBNAIL/image/jpeg/611dd1048c8a2d5d1e5e8cc614cc466f/gr11.jpg gr11 gr11.jpg jpg 51750 281 602 IMAGE-DOWNSAMPLED 1-s2.0-S1381116912000908-gr2.jpg https://s3-eu-west-1.amazonaws.com/prod-ucs-content-store-eu-west/content/pii:S1381116912000908/gr2/DOWNSAMPLED/image/jpeg/ccc2d1e1dd38e962f8d93c6164485eb8/gr2.jpg gr2 gr2.jpg jpg 26701 239 376 IMAGE-DOWNSAMPLED 1-s2.0-S1381116912000908-gr3.jpg https://s3-eu-west-1.amazonaws.com/prod-ucs-content-store-eu-west/content/pii:S1381116912000908/gr3/HIGHRES/image/jpeg/e83e65fe48696c4fd71d6e0f06dc3b64/gr3.jpg gr3 gr3.jpg jpg 54291 335 602 IMAGE-DOWNSAMPLED 1-s2.0-S1381116912000908-gr4.jpg https://s3-eu-west-1.amazonaws.com/prod-ucs-content-store-eu-west/content/pii:S1381116912000908/gr4/DOWNSAMPLED/image/jpeg/5f38bf626cc45fe5df6e832c1cd7a887/gr4.jpg gr4 gr4.jpg jpg 66344 395 602 IMAGE-DOWNSAMPLED 1-s2.0-S1381116912000908-gr5.jpg https://s3-eu-west-1.amazonaws.com/prod-ucs-content-store-eu-west/content/pii:S1381116912000908/gr5/DOWNSAMPLED/image/jpeg/83f5a50f7a16ff1ed0142be859251dcc/gr5.jpg gr5 gr5.jpg jpg 29402 246 376 IMAGE-DOWNSAMPLED 1-s2.0-S1381116912000908-gr6.jpg https://s3-eu-west-1.amazonaws.com/prod-ucs-content-store-eu-west/content/pii:S1381116912000908/gr6/DOWNSAMPLED/image/jpeg/88d6dc5e8a65334ebe80f3cd8614aa79/gr6.jpg gr6 gr6.jpg jpg 43294 285 489 IMAGE-DOWNSAMPLED 1-s2.0-S1381116912000908-gr7.jpg https://s3-eu-west-1.amazonaws.com/prod-ucs-content-store-eu-west/content/pii:S1381116912000908/gr7/HEAD-TAIL/image/jpeg/160082a89a848dbfdc7c823e18891b03/gr7.jpg gr7 gr7.jpg jpg 26469 213 376 IMAGE-DOWNSAMPLED 1-s2.0-S1381116912000908-gr8.jpg https://s3-eu-west-1.amazonaws.com/prod-ucs-content-store-eu-west/content/pii:S1381116912000908/gr8/DOWNSAMPLED/image/jpeg/1711ec9aa87078d0bb3c39c443c2473c/gr8.jpg gr8 gr8.jpg jpg 50818 262 602 IMAGE-DOWNSAMPLED 1-s2.0-S1381116912000908-gr9.jpg https://s3-eu-west-1.amazonaws.com/prod-ucs-content-store-eu-west/content/pii:S1381116912000908/gr9/STRIPIN/image/jpeg/3f3293e6936351b2479aecb7175cf044/gr9.jpg gr9 gr9.jpg jpg 54899 282 602 IMAGE-DOWNSAMPLED 1-s2.0-S1381116912000908-sc1.jpg https://s3-eu-west-1.amazonaws.com/prod-ucs-content-store-eu-west/content/pii:S1381116912000908/sc1/DOWNSAMPLED/image/jpeg/de26832909dcd600dbbb1ff8600202ed/sc1.jpg sc1 sc1.jpg jpg 4551 63 368 IMAGE-DOWNSAMPLED 1-s2.0-S1381116912000908-sc2.jpg https://s3-eu-west-1.amazonaws.com/prod-ucs-content-store-eu-west/content/pii:S1381116912000908/sc2/DOWNSAMPLED/image/jpeg/abdfb2e41cb8a6ddbc29da3835c85201/sc2.jpg sc2 sc2.jpg jpg 41701 519 678 IMAGE-DOWNSAMPLED 1-s2.0-S1381116912000908-sc3.jpg https://s3-eu-west-1.amazonaws.com/prod-ucs-content-store-eu-west/content/pii:S1381116912000908/sc3/STRIPIN/image/jpeg/df7cb7c70ac2c0615a76381a74e69f38/sc3.jpg sc3 sc3.jpg jpg 17789 187 489 IMAGE-DOWNSAMPLED 1-s2.0-S1381116912000908-sc4.jpg https://s3-eu-west-1.amazonaws.com/prod-ucs-content-store-eu-west/content/pii:S1381116912000908/sc4/DOWNSAMPLED/image/jpeg/8a7b9e4804ce7f24b899bdad277c2b15/sc4.jpg sc4 sc4.jpg jpg 20505 269 489 IMAGE-DOWNSAMPLED 1-s2.0-S1381116912000908-fx1.sml https://s3-eu-west-1.amazonaws.com/prod-ucs-content-store-eu-west/content/pii:S1381116912000908/fx1/THUMBNAIL/image/gif/7eec79c8fde8610ccf32f4b1f53c5ea6/fx1.sml fx1 true fx1.sml sml 7959 104 219 IMAGE-THUMBNAIL 1-s2.0-S1381116912000908-gr1.sml https://s3-eu-west-1.amazonaws.com/prod-ucs-content-store-eu-west/content/pii:S1381116912000908/gr1/THUMBNAIL/image/gif/8cac82704310928d4f835aaa283bc5fe/gr1.sml gr1 gr1.sml sml 10241 94 219 IMAGE-THUMBNAIL 1-s2.0-S1381116912000908-gr10.sml https://s3-eu-west-1.amazonaws.com/prod-ucs-content-store-eu-west/content/pii:S1381116912000908/gr10/THUMBNAIL/image/gif/ee0d5b7a9ea37ea0895c5199d60fec3a/gr10.sml gr10 gr10.sml sml 8260 102 219 IMAGE-THUMBNAIL 1-s2.0-S1381116912000908-gr11.sml https://s3-eu-west-1.amazonaws.com/prod-ucs-content-store-eu-west/content/pii:S1381116912000908/gr11/THUMBNAIL/image/gif/7141c8d2df8872c3258541ed50586e57/gr11.sml gr11 gr11.sml sml 8146 102 219 IMAGE-THUMBNAIL 1-s2.0-S1381116912000908-gr2.sml https://s3-eu-west-1.amazonaws.com/prod-ucs-content-store-eu-west/content/pii:S1381116912000908/gr2/HIGHRES/image/gif/2dd592117096f3ca5741418bca13d2f5/gr2.sml gr2 gr2.sml sml 8913 139 219 IMAGE-THUMBNAIL 1-s2.0-S1381116912000908-gr3.sml https://s3-eu-west-1.amazonaws.com/prod-ucs-content-store-eu-west/content/pii:S1381116912000908/gr3/THUMBNAIL/image/gif/01c46a82c56b5f4caf8803175cd06403/gr3.sml gr3 gr3.sml sml 8134 122 219 IMAGE-THUMBNAIL 1-s2.0-S1381116912000908-gr4.sml https://s3-eu-west-1.amazonaws.com/prod-ucs-content-store-eu-west/content/pii:S1381116912000908/gr4/THUMBNAIL/image/gif/d31d07b02388f0df45124a49f7b3f7dc/gr4.sml gr4 gr4.sml sml 10079 144 219 IMAGE-THUMBNAIL 1-s2.0-S1381116912000908-gr5.sml https://s3-eu-west-1.amazonaws.com/prod-ucs-content-store-eu-west/content/pii:S1381116912000908/gr5/THUMBNAIL/image/gif/2bd073fd4062892dddab881d12dd715c/gr5.sml gr5 gr5.sml sml 9691 143 219 IMAGE-THUMBNAIL 1-s2.0-S1381116912000908-gr6.sml https://s3-eu-west-1.amazonaws.com/prod-ucs-content-store-eu-west/content/pii:S1381116912000908/gr6/THUMBNAIL/image/gif/49f3960211c340fd9369c7bd364bd0b0/gr6.sml gr6 gr6.sml sml 9405 128 219 IMAGE-THUMBNAIL 1-s2.0-S1381116912000908-gr7.sml https://s3-eu-west-1.amazonaws.com/prod-ucs-content-store-eu-west/content/pii:S1381116912000908/gr7/THUMBNAIL/image/gif/1d1167cb2530ad916fe904d7ba2545a1/gr7.sml gr7 gr7.sml sml 8691 124 219 IMAGE-THUMBNAIL 1-s2.0-S1381116912000908-gr8.sml https://s3-eu-west-1.amazonaws.com/prod-ucs-content-store-eu-west/content/pii:S1381116912000908/gr8/HIGHRES/image/gif/1b4f62004c94a7da8dfb0bf0ad5cdbee/gr8.sml gr8 gr8.sml sml 8017 95 219 IMAGE-THUMBNAIL 1-s2.0-S1381116912000908-gr9.sml https://s3-eu-west-1.amazonaws.com/prod-ucs-content-store-eu-west/content/pii:S1381116912000908/gr9/DOWNSAMPLED/image/gif/5353cf10fe268a2d8d8d2a61223fd596/gr9.sml gr9 gr9.sml sml 8645 103 219 IMAGE-THUMBNAIL 1-s2.0-S1381116912000908-sc1.sml https://s3-eu-west-1.amazonaws.com/prod-ucs-content-store-eu-west/content/pii:S1381116912000908/sc1/STRIPIN/image/gif/ba3ea41af9a3f03df92cb3e7ed3050b2/sc1.sml sc1 sc1.sml sml 2003 37 219 IMAGE-THUMBNAIL 1-s2.0-S1381116912000908-sc2.sml https://s3-eu-west-1.amazonaws.com/prod-ucs-content-store-eu-west/content/pii:S1381116912000908/sc2/DOWNSAMPLED/image/gif/f74221ff199323771d7ffc172fa940aa/sc2.sml sc2 sc2.sml sml 4953 164 214 IMAGE-THUMBNAIL 1-s2.0-S1381116912000908-sc3.sml https://s3-eu-west-1.amazonaws.com/prod-ucs-content-store-eu-west/content/pii:S1381116912000908/sc3/THUMBNAIL/image/gif/8ebd9b78f856acf69870acee105b0fb9/sc3.sml sc3 sc3.sml sml 3923 84 219 IMAGE-THUMBNAIL 1-s2.0-S1381116912000908-sc4.sml https://s3-eu-west-1.amazonaws.com/prod-ucs-content-store-eu-west/content/pii:S1381116912000908/sc4/THUMBNAIL/image/gif/792227c054c45a9fd8541db017461288/sc4.sml sc4 sc4.sml sml 4208 120 219 IMAGE-THUMBNAIL 1-s2.0-S1381116912000908-fx1_lrg.jpg https://s3-eu-west-1.amazonaws.com/prod-ucs-content-store-eu-west/content/pii:S1381116912000908/HIGHRES/image/jpeg/1934c7b244fed66f0fb70e79ab274c16/fx1_lrg.jpg fx1 true fx1_lrg.jpg jpg 182122 886 1860 IMAGE-HIGH-RES 1-s2.0-S1381116912000908-gr1_lrg.jpg https://s3-eu-west-1.amazonaws.com/prod-ucs-content-store-eu-west/content/pii:S1381116912000908/HIGHRES/image/jpeg/1a0bbbbdcb7107b707d7cfb254f21394/gr1_lrg.jpg gr1 gr1_lrg.jpg jpg 549046 926 2167 IMAGE-HIGH-RES 1-s2.0-S1381116912000908-gr10_lrg.jpg https://s3-eu-west-1.amazonaws.com/prod-ucs-content-store-eu-west/content/pii:S1381116912000908/HIGHRES/image/jpeg/a459f486af5cb9f589a616c42c92ae4f/gr10_lrg.jpg gr10 gr10_lrg.jpg jpg 502906 1247 2667 IMAGE-HIGH-RES 1-s2.0-S1381116912000908-gr11_lrg.jpg https://s3-eu-west-1.amazonaws.com/prod-ucs-content-store-eu-west/content/pii:S1381116912000908/HIGHRES/image/jpeg/facf682bd70c4d364a9ddbb5b2c5cd9c/gr11_lrg.jpg gr11 gr11_lrg.jpg jpg 489257 1247 2667 IMAGE-HIGH-RES 1-s2.0-S1381116912000908-gr2_lrg.jpg https://s3-eu-west-1.amazonaws.com/prod-ucs-content-store-eu-west/content/pii:S1381116912000908/HIGHRES/image/jpeg/5434471af42fcbe742f3bbf7afa7bbc9/gr2_lrg.jpg gr2 gr2_lrg.jpg jpg 251727 1059 1667 IMAGE-HIGH-RES 1-s2.0-S1381116912000908-gr3_lrg.jpg https://s3-eu-west-1.amazonaws.com/prod-ucs-content-store-eu-west/content/pii:S1381116912000908/HIGHRES/image/jpeg/8391af277fde15c9a00ee188e71ad783/gr3_lrg.jpg gr3 gr3_lrg.jpg jpg 527522 1485 2667 IMAGE-HIGH-RES 1-s2.0-S1381116912000908-gr4_lrg.jpg https://s3-eu-west-1.amazonaws.com/prod-ucs-content-store-eu-west/content/pii:S1381116912000908/HIGHRES/image/jpeg/c567053e2935ec3d10acd61a92cbdb97/gr4_lrg.jpg gr4 gr4_lrg.jpg jpg 629114 1750 2667 IMAGE-HIGH-RES 1-s2.0-S1381116912000908-gr5_lrg.jpg https://s3-eu-west-1.amazonaws.com/prod-ucs-content-store-eu-west/content/pii:S1381116912000908/THUMBNAIL/image/jpeg/290dc3e3a93bc913ac3f47400fdf3ceb/gr5_lrg.jpg gr5 gr5_lrg.jpg jpg 267645 1090 1667 IMAGE-HIGH-RES 1-s2.0-S1381116912000908-gr6_lrg.jpg https://s3-eu-west-1.amazonaws.com/prod-ucs-content-store-eu-west/content/pii:S1381116912000908/HIGHRES/image/jpeg/24d734b8c6b67cd220716b697cc3485a/gr6_lrg.jpg gr6 gr6_lrg.jpg jpg 376624 1263 2167 IMAGE-HIGH-RES 1-s2.0-S1381116912000908-gr7_lrg.jpg https://s3-eu-west-1.amazonaws.com/prod-ucs-content-store-eu-west/content/pii:S1381116912000908/HIGHRES/image/jpeg/21044bd744fc43f702f0e74e7aa276cc/gr7_lrg.jpg gr7 gr7_lrg.jpg jpg 247136 946 1667 IMAGE-HIGH-RES 1-s2.0-S1381116912000908-gr8_lrg.jpg https://s3-eu-west-1.amazonaws.com/prod-ucs-content-store-eu-west/content/pii:S1381116912000908/THUMBNAIL/image/jpeg/4598a4cfb8163bddefd11cf5feb057af/gr8_lrg.jpg gr8 gr8_lrg.jpg jpg 468735 1162 2667 IMAGE-HIGH-RES 1-s2.0-S1381116912000908-gr9_lrg.jpg https://s3-eu-west-1.amazonaws.com/prod-ucs-content-store-eu-west/content/pii:S1381116912000908/HIGHRES/image/jpeg/79a359f1210c3186789c13577159bc74/gr9_lrg.jpg gr9 gr9_lrg.jpg jpg 512512 1249 2667 IMAGE-HIGH-RES 1-s2.0-S1381116912000908-sc1_lrg.jpg https://s3-eu-west-1.amazonaws.com/prod-ucs-content-store-eu-west/content/pii:S1381116912000908/HIGHRES/image/jpeg/a8f1c891379566c31b36308067647578/sc1_lrg.jpg sc1 sc1_lrg.jpg jpg 34555 277 1629 IMAGE-HIGH-RES 1-s2.0-S1381116912000908-sc2_lrg.jpg https://s3-eu-west-1.amazonaws.com/prod-ucs-content-store-eu-west/content/pii:S1381116912000908/HIGHRES/image/jpeg/6589feb8659909e22167e942d83ea6b9/sc2_lrg.jpg sc2 sc2_lrg.jpg jpg 369401 2296 3000 IMAGE-HIGH-RES 1-s2.0-S1381116912000908-sc3_lrg.jpg https://s3-eu-west-1.amazonaws.com/prod-ucs-content-store-eu-west/content/pii:S1381116912000908/MAIN/image/jpeg/fe956d1b1311a21193ba74ee308d7da3/sc3_lrg.jpg sc3 sc3_lrg.jpg jpg 143523 829 2167 IMAGE-HIGH-RES 1-s2.0-S1381116912000908-sc4_lrg.jpg https://s3-eu-west-1.amazonaws.com/prod-ucs-content-store-eu-west/content/pii:S1381116912000908/HIGHRES/image/jpeg/151cda71280d287eb08af08d9865ec23/sc4_lrg.jpg sc4 sc4_lrg.jpg jpg 173468 1190 2167 IMAGE-HIGH-RES 1-s2.0-S1381116912000908-si1.gif https://s3-eu-west-1.amazonaws.com/prod-ucs-content-store-eu-west/content/pii:S1381116912000908/STRIPIN/image/gif/582b8282e8b8e369457638862041bf8a/si1.gif si1 si1.gif gif 724 13 241 ALTIMG MOLCAA 8388 S1381-1169(12)00090-8 10.1016/j.molcata.2012.03.012 Elsevier B.V. Fig. 1 The adsorbed structures of methanol and MAL on Pd20 cluster. Fig. 2 Energy diagram for the dissociation of methanol on Pd surface. The geometries of the reactant, transition state and product are also represented. Fig. 3 Energy diagram for the attack of the methoxyl on the aldehyde carbonyl of MAL and the direct hydrogen elimination of INT1(a). The geometries of the transition states and intermediates are also represented. Fig. 4 Energy diagram for the formation and first hydrogen elimination of hemiacetal. The geometries of the transition states and intermediates are also represented. Fig. 5 Energy diagram for the second hydrogen elimination of hemiacetal to give MMA. The geometries of the transition states and intermediates are also represented. Fig. 6 Energy diagram for the attack of the methoxyl on the CC bond of MAL. The geometries of the transition states and intermediates are also represented. Fig. 7 Energy diagram for the H addition after the attack of the methoxyl on the CC bond of MAL in path (b). Fig. 8 Energy diagram for the hydrogen addition to the CO bond of MAL. The geometries of the transition states and intermediates are also represented. Fig. 9 Energy diagram for the hydrogen addition to the CC bond of MAL. The geometries of the transition states and intermediates are also represented. Fig. 10 Energy diagram for the direct hydrogen elimination of MAL and the following attack of methoxyl to form MMA. The geometries of the transition states and intermediates are also represented. Fig. 11 Energy diagram for the direct hydrogen elimination of CC bond in MAL and the following attack of methoxyl. The geometries of the transition states and intermediates are also represented. Scheme 1 The oxidative esterification of aldehydes with alcohols to corresponding esters. Scheme 2 The dissociation of methanol and the attacks of the methoxyl on MAL with the activation/reaction energy (kJ/mol) of each step in parenthesis. Scheme 3 The hydrogen addition reactions of MAL with the activation/reaction energy (kJ/mol) of each step in parenthesis. Scheme 4 The hydrogen elimination reactions of MAL and the following attacks of the methoxyl with the activation/reaction energy (kJ/mol) of each step in parenthesis. Table 1 The structural properties of methanol, MAL, produced methoxyl and hydrogen on Pd (100) calculated using density functional theory. Distances Methanol d(PdO)/Å 2.636 d(PdH)/Å 2.597 MAL d(PdO)/Å 2.423 d(PdC)/Å 2.311, 2.332, 2.201 P(m) Methoxyl d(PdO)/Å 2.127, 2.257 Hydrogen d(PdH)/Å 1.692, 1.731 Table 2 The calculated energies of activation (ΔE ‡, kJ/mol) and reaction (ΔE, kJ/mol). Elementary step ΔE ‡ ΔE R(m)→TS(m)→P(m) 66.5 41.1 R1→TS1(a)→INT1(a) 42.9 34.6 INT1(a)→TS′(a)→INT1′(a) 37.8 3.3 INT1′(a)→TS2(a)→P(a)I 33.5 −113.9 INT2(a)→TS3(a)→INT3(a) 79.6 1.9 INT3(a)→TS″(a)→INT3″(a) 17.9 −5.2 INT3″(a)→TS4(a)→INT4(a) 34.5 −51.2 INT5(a)→TS5(a)→P(a)II 7.5 −45.5 R1→TS1(b)→INT1(b) 63.0 1.4 INT1(b)→TS2(b)→P(b)I 62.6 10.2 INT2(b)→TS3(b)→P(b)II 48.1 −8.8 R1(c)→TS1(c)→INT1(c) 45.6 −5.3 INT2(c)→TS2(c)→P(c) 104.1 37.5 R1(d)→TS1(d)→INT1(d) 58.7 −48.9 INT2(d)→TS2(d)→P(d) 64.5 13.1 R1(e)→TS1(e)→INT1(e) 45.5 −44.6 INT2(e)→TS2(e)→P(e) 41.0 −35.2 R1(f)→TS1(f)→INT1(f) 84.2 32.8 INT2(f)→TS2(f)→P(f) 67.7 −35.8 Mechanistic aspects for the direct oxidative esterification of aldehydes with alcohols over Pd catalyst: A computational study Xiaoqian Yao a Yanyan Diao a Xiaomin Liu a Yong-Wang Li b Kun Dong a Suojiang Zhang a ⁎ a Beijing Key Laboratory of Ionic Liquids Clean Process, Key Laboratory of Green Process and Engineering, State Key Laboratory of Multiphase Complex System, Institute of Process Engineering, Chinese Academy of Sciences, Beijing 100190, PR China b State Key Laboratory of Coal Conversion, Institute of Coal Chemistry, Chinese Academy of Sciences, Taiyuan 030001, PR China ⁎ Corresponding author. Tel.: +86 010 82627080; fax: +86 010 82627080. Graphical abstract Oxidative esterification reaction: The detailed transformation mechanism of methacrolein with methanol to methyl methacrylate over Pd was obtained by density functional theory (DFT) calculation. On the basis of the computed activation parameters the hydrogen elimination of MAL following CO reaction with methoxyl is an energetically favorable pathway. The formation of unsaturated alcohol and saturated aldehyde are also competitive. Highlights ► The detailed transformation mechanism of methacrolein with methanol to methyl methacrylate over Pd20 cluster was investigated by density functional theory (DFT). ► The structures and relative energies of intermediates/transition states were calculated. ► The hydrogen elimination of MAL following acyl group reaction with methoxyl appears to be an energetically favorable pathway. The detailed transformation mechanism of methacrolein with methanol to methyl methacrylate over Pd was investigated by density functional theory (DFT) calculation as an attempt to gain more insight into the oxidative esterification reaction. The entire catalytic cycle and reaction energies are computed for various possible paths over Pd20 cluster. It is found that the hydrogen elimination of MAL following acyl group reaction with methoxyl appears to be an energetically favorable pathway in catalyst cycle. The formation of unsaturated alcohol by H addition, and that of saturated aldehyde through the CC addition by methoxyl and H are also competitive. The formation of hemiacetal intermediate is not necessary for the production of MMA. Keywords Oxidative esterification Methyl methacrylate Pd Catalysis DFT 1 Introduction The direct transformation of aldehydes to esters under mild conditions is a useful catalytic process in organic synthesis. The conventional synthesis process of esters involves oxidation and esterification two-step reactions of alcohols along with formation of toxic wastes and byproducts [1]. From the viewpoint of green chemistry, the direct transformation of aldehydes with alcohols is a more environmentally friendly procedure. The oxidative esterification reactions of aldehydes to esters have been achieved in a variety of ways, electrochemical oxidation [2], or through the use of metal oxidants and transition metals [3–8]. Recently, such transformations also have been achieved with catalyst such as V2O5, IrCl(cod)]2, etc. [9–12]. Although several methods have been reported for the direct preparation of aldehydes to esters, those processes usually require a large amount of reagents, extremes of temperature, lengthy reaction times, poisonous and polluting reagents, etc. Pd catalysts are used extensively in selective oxidation or oxygenation reaction [13–17]. A synthesis process for direct methyl esterification of aldehydes with alcohols to corresponding esters with the Pb, Mg-doped Al2O3-supported Pd crystal as catalyst has been developed in our laboratory, and the reactions produce water as only by-product [18] (Scheme 1 ). The reactions were found to be highly stereoselective to provide the esters in good yields, and it is also interesting to found that metal Pb had positive effect on reaction rate acceleration and selectivity enhancement in the presence of oxygen or not. In the previous research works, a possible oxidative esterification mechanism was proposed [6,19,20]. The reaction providing esters of aldehydes with alcohols was considered to proceed through the oxidative addition of metal species on the oxygen–hydrogen bond of alcohol to give an alkoxide. The attack of the resulting alkoxy group on the aldehyde carbonyl coordinated to the metal took place to afford a metal-bound hemiacetal intermediate, which undergoes further dehydrogenation (β-hydrogen elimination as an oxidation process) in delivering the ester. With assumption of the formation of intermediate hemiacetal, the oxidative condensation of aldehydes with alcohols can be performed to afford esters. However, relationships between the catalytic activity and structures of catalyst surfaces have not been well understood, and to our knowledge, little information on the detailed mechanism is known from the theoretical point of view. In the last few years, the developments of computational chemistry have made the investigations of realistic catalytic systems with theoretical approach feasible and reliable. The metallic systems Pd have been the focus of many studies because they play a great role in heterogeneous catalysis. Various theoretical researches have been carried out on Pd clusters with different size and Pd surfaces under various conditions [21–27]. The adsorption structures, energies and characters of representative molecules on Pd, such as alcohol [28,29], CO, O2 [30–32], as well as unsaturated hydrocarbons (ethylene [33], benzene [34], butadiene [35], etc.), have been covered with a large range of theoretical approaches. There are also reactivity and path investigations for different reactions, such as dissociation of H2, O2 and hydrogenolysis of compound on the Pd clusters and surfaces [36–39], and these studies show importance in confirm or discard hypothesis concerning structure and reactivity. The detailed direct transformation mechanism of methyl methacrylate (MMA) by methacrolein (MAL) with methanol on Pd catalyst was investigated by DFT calculation in this work as an attempt to gain more insight into the oxidative esterification mechanism and reactivity. MMA is important industry material used in manufacture of polymethyl methacrylate acrylic and polyvinyl chloride, and its synthesis has been carried out in our past experimental work [18]. As a small part of whole researches, what we did in this work is to model main line of reaction mechanism without oxygen. We hope that these results are useful and provide basis for works on influence of catalyst and reaction mechanism with oxygen. We have explored alternative paths and computed the activation energies of the various possible elementary steps, i.e., the activation of methanol to supply adsorbed methoxyl and co-product hydrogen structures, the attack of methoxy group and hydrogen on the different sites of MAL, the hydrogen eliminations of MAL following by reactions with methoxyl, the formation of possible intermediates including hemiacetal, the supposed subsequent β-hydrogen elimination to afford MMA, and the formation of by-product including saturated aldehyde and unsaturated alcohol found in our experiment works [18]. The structures of intermediates and transition states involved in these processes were determined, and the relative energies of these species were calculated. The different reaction paths were examined to discern which steps are feasible and appear to be an energetically favorable in catalytic cycle. We are interested mainly in the qualitative trends that can provide helpful information on the understanding of the elementary steps of direct methyl esterification for MMA. 2 Computational details Structure optimizations and energy calculations were carried out with the doubled numerical basis set with d-polarization functions and the generalized gradient corrected functional by Perdew and Wang (PW91) [40]. The mesh size in medium quality for the numerical integration was used, and the tolerances of energy, gradient and displacement convergence were 2×10−5 au, 4×10−3 au/Å and 5×10−3 Å, and the real space cutoff of atomic orbital was set at 4.0Å. Complete linear synchronous transit and quadratic synchronous transit (LST/QST) calculations were performed to determine the structures of transition states, confirmed by additional calculations of the intrinsic reaction path. The corresponding frequencies were computed at the same level in order to check the obtained stationary points to be ground states (minimum structures) with only real frequencies, or to be transition states (maximum structures or saddle points) with only one imaginary frequency displaying the desired displacements orientation and connection. The bare cluster calculations were performed spin unrestricted as past theory investigation [36]. The most favorable spin multiplicity of the cluster and cluster-adsorbate were determined by performing a series of calculations with different spin states to find the lowest energy state. The discussions are based on the energies of activation (ΔE ‡) and reaction (ΔE), and the ZPE corrections have been taken into account for all the cited energies. All calculations were carried out with the DMol program package in the Materials Studio of Accelrys Inc. In the theoretical calculations there are two major strategies commonly used to model a surface, the cluster approaches and the periodic supercell. For Pd, both of clusters and periodic supercell model were used widely. The cluster model approach is thought to capture the essential features and to be able to predict local properties such as geometries and vibrational frequencies quite well [41]. The calculations performed using clusters models of the Pd surfaces, such as Pd22 cluster exhibiting Pd (111) surface for CO adsorption [31], Pd18 and Pd19 cluster models of the Pd (111) surface for hydrogenolysis of acetate [36], appear to be reasonable and compare fairly well with periodic slab calculation results. A 20-metal-atom Pd (12, 8) cluster model was used in our calculations, and it is composed of two metal layers and mainly exhibits Pd (100) surface. The top layer of the cluster was allowed to relax with the adsorbed molecule and group, while the bottom layer was constrained to the bulk interatomic distances. In the text, R is used to for reactants, P for products, INT for intermediates, and TS for the transition states, respectively. 3 Results and discussion The conformation and characters of adsorbed complexes including unsaturated hydrocarbons and alcohol over Pd clusters or surfaces were objectives of some previous theoretical studies as mentioned above, and various coordination structures were proposed and discussed [31–33]. In our test calculations, different adsorption conformations for methacrolein (MAL) and methanol on Pd20 cluster were investigated and compared. The adsorption character is not object of our investigation in this work, so only two kinds of energy minimum adsorption modes (as shown in Fig. 1 ), η 2 for methanol and η 4 for MAL, were chosen for the reaction path calculations. The structural data of PdH and PdO bonds in optimized modes are given in Table 1 . The conformations are corresponding with past theoretical results of similar molecules [28,36,42], and the calculated binding energy, −69kJ/mol for methanol and −140kJ/mol for MAL, also appear to be a reasonable estimate (the binding energy was calculated by following equation [35]: Δ E bind = E ads − E reactant − E surface . Based on the adsorption structure of methanol in Fig. 1, the calculations for the initiating OH bond breaking reaction of methanol to form surface-bound methoxyl and hydrogen were carried out. The methanol on Pd surface is thought to dissociate into methoxy species and adsorbed atomic hydrogen [29,43]. The hydrogen is supposed to exist as PdH form that was investigated by the previous experimental and theoretical works, and our calculation results are consistent with their findings [44–47]. The formations of methoxy group and hydrogen in the reaction process were also confirmed by our experimental IR spectra results. The results of all calculations will be given as energies diagrams on which are represented the geometries of the intermediates (INT) and transition states (TS). The potential energy surface along the breakage of methanol is computed, and the transition state TS(m) connecting methanol (R(m)) and P(m) was located and shown in Fig. 2 . No matter for methoxyl, or hydrogen, there are various possible adsorption modes. In our calculations, the structures with bridge adsorption modes for both of them are more stable with low energy. Actually, the bridge adsorption of hydrogen on Pd surface has been investigated in detail by theory works [45,46]. The O⋯H and Pd⋯H distances in TS(m) are 1.780 and 1.621Å, respectively. The activation energy of this step is 66.5kJ/mol, and the reaction to the product P(m) with surface-bound methoxyl and PdH bond is endergonic by 41.1kJ/mol. The distances of PdH and PdO in P(m) were given in Table 1. In the presence of resulting methoxy group and hydrogen, surface-bound MAL can undergo a number of different possible reaction pathways. These include the attack of methoxy group, hydrogen addition and the hydrogen eliminations of MAL: (a) the attack of the methoxyl on the aldehyde carbonyl of MAL; (b) the attack of the methoxyl on the unsaturated CC bond; (c) hydrogen addition to the CO bond of MAL; (d) hydrogen addition to the CC bond; (e) hydrogen elimination of aldehyde carbonyl of MAL; (f) hydrogen elimination of CC bond. In this work, we computed all the possible paths for comparison, and these paths are investigated in the form of surface-bound MAL with successive adsorption of methoxyl or hydrogen in the neighborhood. In the actual circumstances, a catalytic cycle will include adsorptions, desorption and reactions. It is very hard to give a detailed description and comparison for all the actions while some pathways probably involve three or four free radicals (two hydrogens and two methoxyls). So, the adsorption processes and energies for methoxyl or hydrogen will not be considered in this work. Only the reaction pathways and energies will be discussed with the assumptions of successive adsorptions of radicals and molecules. The initial starting structure for each step is determined based on its distance along the linear path between the reaction site of MAL and methoxyl (or hydrogen), and the adsorption mode is expected to be the most favorable for the taking place of reaction. 3.1 (a) Reaction of the methoxyl with aldehyde carbonyl of MAL The methoxy group would probably react with two sites of MAL, aldehyde carbonyl and CC bond. The two calculated possible routes of methoxyl with different intermediates and products are shown in Scheme 2 . The route along the attack of methoxy group to aldehyde carbonyl was computed firstly, and energies diagrams of two possible pathways for the route are shown in Figs. 3 and 4 , respectively. Following the LST/QST procedure, the transition state labeled TS1(a) connecting the initiating reactant R1(a) that is with an adsorbed methoxy nearby MAL and intermediate INT1(a) was located and showed in Fig. 3. The OC distance between methoxy O and carbonyl C of TS1(a) is 2.643Å. The activation energy of this elementary step is 42.9kJ/mol, and the reaction is endergonic by 34.6kJ/mol. As for INT1(a), it could be actually regarded as an adsorbed analogous hemiacetal radical structure, and a further hydrogen addition will lead the formation of the complete hemiacetal intermediate which probably to undergo hydrogen elimination to afford MMA. However, the reiterated hydrogen addition and elimination process inspire us to consider the direct hydrogen elimination mechanism of INT1(a) at same time. So, both of hydrogen addition and elimination of INT1(a) were computed. The hydrogen addition path shown in Fig. 4 to form hemiacetal is discussed firstly, while the direct hydrogen elimination path is shown in Fig. 3 together with the attacking step of methoxyl as a continuous energy process. To simplify the hydrogen addition calculation, it is reasonable to use directly an intermediate INT2(a) which is INT1(a) with one more absorbed hydrogen close to the carbonyl C without considering the process of methanol breakage once again, and this structure also enables the H to transfer within the shortest distance. Since the adsorption of one more H will lead the discontiguous energy change, energies for the elementary steps are given independently in Fig. 4 and the corresponding value of reactant INT2(a) is set to 0.0kJ/mol. The reaction pathway connecting INT2(a) and INT3(a) (hemiacetal) was searched and shown in Fig. 4, and the transition state TS3(a) was located. The O⋯H and Pd⋯H distances in TS3(a) are 1.478 and 1.774Å, respectively, and the calculated barrier is 79.6kJ/mol. The hydrogen elimination of hemiacetal to form MMA would be along with two possible pathways, the reverse reaction of the hydrogen addition (with 75.0kJ/mol activation energy as shown in Fig. 4) and β-hydrogen elimination. In order to permit the hemiacetal β-hydrogen elimination leading to the formation of MMA, a conformation displacement of β-hydrogen in INT3(a) with change of stretch direction is required (shown in Fig. 4). This displacement needs a rotating of β-hydrogen to shorten the distance to the Pd surface. This step takes activation energy of 17.9kJ/mol, and the energy decreasing along with this conformation change is very small (−5.2kJ/mol). Starting from conformation changed product INT3″(a), the β-hydrogen elimination will cost 34.5kJ/mol activation energy, and give an adsorbed INT4(a) structure. A transition structure for this step was found with C⋯H and Pd⋯H distances being 2.009 and 1.657Å, respectively. The further hydrogen elimination of INT4(a) will lead to the formation of final product MMA, and the reaction path is shown separately in Fig. 5 for the energy discontinuousness. The activation energy (7.5kJ/mol) for second H elimination is much smaller than that of first. As for the direct β-hydrogen elimination of INT1(a) to produce MMA, a similar conformation displacement of β-hydrogen with hemiacetal is required (as shown in Fig. 3) in order to permit the reaction. This step takes activation energy of 37.8kJ/mol, and the energy increases 3.3kJ/mol. Starting from conformation changed product INT1′(a), the β-hydrogen elimination would lead to the formation of P(a)I with the adsorbed MMA. The reaction steps and energies are also shown in Fig. 3. A transition structure was found with C⋯H and Pd⋯H distances being 1.526 and 1.739Å, respectively. The activation energy cost for this step is 33.5kJ/mol, and it is exergonic. Comparing with the direct β-hydrogen elimination of hemiacetal radical, the formation and hydrogen elimination of hemiacetal takes more activation energy (79.6kJ/mol) and would be more difficult to take place. 3.2 (b) Reaction of the methoxyl with unsaturated CC bond of MAL Following the other possible pathway (b) of MAL shown in Scheme 2, the potential energy surface along the methoxyl reaction with unsaturated CC bond is also computed. The structure R1 in Fig. 3 is also starting points for the path (b), and the optimized structures of the involved species with energies are shown in Fig. 6 . The corresponding transition state TS1(b) for the attack of methoxyl to CC bond was located, and the C⋯O distances in the TS1(b) are 2.433Å. This step has a higher activation energy barrier of 63.0kJ/mol than methoxyl reaction with carbonyl, and the reaction energy is 1.4kJ/mol. A similar hydrogen elimination reaction of INT1(b) was considered for the same possibility as the hydrogen elimination in pathway (a). One hydrogen losing will lead to an unsaturated 3-methoxyl-methacrolein compound. The energy process was computed, while the involved optimized structures and the energies are shown in Fig. 6. The unsaturated aldehyde compound is not with energy advantage in its formation comparing with the product of hydrogen addition, and also not object product unlike MMA. These possible steps are also shown in Scheme 2. One more hydrogen addition of the INT1(b) will lead to the formation of the a 2-methyl-3-methoxyl-propylaldehyde compound through saturation of CC bond. Several test optimized calculations were carried out to search the adsorbed position of hydrogen that should be with minimum energy and favorable for taking place of reaction. Initiated with a structure INT2(b) with an adsorbed H on the most possible position beside CC bond, the hydrogen addition reaction was investigated and shown in Fig. 7 . The C⋯H and Pd⋯H distances in located transition state TS3(b) are 2.047 and 1.690Å, respectively. The possible final by-product propylaldehyde compound was obtained by this reaction. This step has an activation energy cost of 48.1kJ/mol and is exergonic (−8.8kJ/mol). 3.3 (c) Hydrogen addition to the CO bond of MAL The hydrogen addition to the CO bond of MAL will lead to formation of unsaturated alcohol. Following the proposed pathways in Scheme 3 , the potential energy surface along hydrogenation of CO bond was computed. Like explained above, since formation and adsorption process of H is not taken into account in this step, the energies for each elementary step are given independently and the corresponding value of reactant for each step is set to 0.0kJ/mol. As explained above, several possible structures were optimized to search the adsorbed position of hydrogen that should be favorable for hydrogen reaction with aldehyde carbonyl. The energy diagram for the reaction path is shown in Fig. 8 . The hydrogen reaction with nucleophilic O of CO bond will be prior comparing with C, and this assumption is confirmed by our test calculation (it will cost 101.6kJ/mol activation energy for hydrogen reaction with C). The hydrogen transformation process to O of CO bond from Pd surface was computed, and the transition state TS1(c) was found with 45.6kJ/mol activation energy. The O⋯H and Pd⋯H distances in TS1(c) are 1.610 and 1.659Å, respectively. The next step along this path is one more H transfer to aldehyde carbonyl which leads to the formation of alcohol coordinated to the Pd surface. The O⋯H and Pd⋯H distances of the transition state TS2(c) are 2.087 and 1.560Å, respectively. The computed activation energy of one more hydrogen addition is 104.1kJ/mol. This is a really high energy comparing with other step in catalytic cycle. The reaction is endergonic by 37.5kJ/mol. 3.4 (d) Hydrogen addition to the CC bond The other H addition possibilities of MAL is to saturate the CC bond. The reaction calculations are following the path shown in Scheme 3, and involving structures with energies are shown in Fig. 9 . After carrying out a potential energy surface search initiated from a selected optimized structure with hydrogen on the most favorable position, we located an authentic transition state for the first hydrogen transformation process. The Pd⋯H distance between surface Pd and H of TS1(d) is 2.012Å, while the C⋯H distance is 1.547Å. The activation energy of this elementary step is 58.7kJ/mol, and the reaction is exergonic by −48.9kJ/mol. Based on the structure INT2(d) with one more hydrogen adsorbing near by the CC bond, the H attacking step to unsaturate C was computed, and transition state TS2(d) was located. The C⋯H and Pd⋯H in TS2(d) distances are 2.073 and 1.681Å, respectively. As shown in Fig. 9, the activation energy for the hydrogen transformation reaction is 64.5kJ/mol. The by-product saturated aldehyde will form by this pathway. 3.5 (e) Hydrogen elimination of the CHO group There is the possibility of hydrogen elimination for MAL to give different radical structures, then the radicals and methoxyl combining together to form products. The hydrogen elimination of CHO for MAL will give a CH2 C(CH3)CO acyl group. The pathway (e) along this reaction coordinate was computed, and the involved optimized structures with energies are shown in Fig. 10 . A potential energy surface search was carried out for the hydrogen elimination in MAL, we located an authentic transition state TS1(e) with 45.5kJ/mol activation energy. The Pd⋯H distance between surface Pd and H of TS1(e) is 1.680Å, while the C⋯H distance is 1.700Å. Based on the structure INT2(e) with adsorbing methoxyl near by the CH2 C(CH3)CO radical, the reaction between two radicals was computed, and transition state TS2(e) was found. The C⋯O distance between methoxy O and carbonyl C in TS2(e) is 2.544Å. As shown in Fig. 10, the activation energy for the methoxyl attacking reaction is 41.0kJ/mol. The final product MMA will form by this pathway shown in Scheme 4 . Comparing with the above attack reaction of methoxyl on CC bond with hydrogen elimination, the highest energy step of this path will cost 45.5kJ/mol activation energy and is competitive. 3.6 (f) Hydrogen elimination of the CC bond The hydrogen elimination of CC for MAL will give a CHC(CH3)CHO group. The optimized structures of the involved species for path(f) with energies are computed and shown in Fig. 11 . The corresponding transition state TS1(f) for the hydrogen elimination of CC double bond was found. The C⋯H and Pd⋯H in TS1(f) distances are 2.088 and 1.668Å, respectively. This step has a relative high activation energy barrier of 84.2kJ/mol, and the reaction energy is 32.8kJ/mol. The following reaction of intermediate with methoxyl will lead to formation of an unsaturated 3-methoxyl-methacrolein compound as path(b). The corresponding transition state TS2(f) for the attack of methoxyl to CC bond was located, and the C⋯O distances in the TS2(f) are 2.141Å. The activation energy of this elementary step is 67.7kJ/mol, and the reaction is exergonic by −35.8kJ/mol. Several above paths with different intermediates for oxidative esterification of MAL to MMA would be analyzed here. The computed energies of activation and reaction for the individual steps are listed in Table 2 . The cleavage of methanol is starting and essential step of MMA catalytic cycle. The activation energy for break of OH structure in methanol on Pd cluster is 66.5kJ/mol, while the computed bond dissociation energy of OH bond in CH3OH is 451.7kJ/mol (The BDE was calculated by following equation: BDE (R1–R2)=[E (R1)+ E (R2)]− E (R1–R2), and the experimental value is 104.2±0.9kcal/mol (435.8kJ/mol) [48]). Obviously, one of the critical roles of Pd catalyst is promoting the formation of methoxyl and initiate whole catalytic cycle. In several possible radical attacking paths, route (a) and (b) start with the attack of methoxyl, while other routes start with the addition or elimination of hydrogen. On the basis of the computed data, these pathways were compared and discussed to find a favored route. As shown in Scheme 2, in the path (a), the reaction of CO group with methoxyl needs lower activation energy (42.9kJ/mol) than that of unsaturated CC bond (63.0kJ/mol) in the path (b) at the beginning of reaction cycle. In the following steps of formed analogous hemiacetal radical structure in path (a), the further hydrogenation of aldehyde carbonyl to form exact hemiacetal intermediate will cost higher activation energy (79.6kJ/mol) than direct β-hydrogen elimination (33.5kJ/mol). Although a conformation change is needed firstly, the direct hydrogen elimination of the hemiacetal radical is the favorable pathway to give MMA. It is interesting to see from Fig. 3 that the total energy of the TS increases in a stepwise manner along the reaction coordinate while the reaction process is endothermic in pathway(a). The attack of methoxyl on CO group in pathway(a) is more difficult from a thermodynamic point of view. The attack of methoxyl on unsaturated CC bond in route (b) will probably lead to the formation of propylaldehyde compound. The following further H addition, or H elimination of its intermediate are with activation energies more than 50kJ/mol, while TS2(b) is with 64.0kJ/mol relative energy comparing with starting point. Based on the energy data of two hydrogen addition pathways (c) and (d) shown in Scheme 3, it could be seen that the reaction of CO group with hydrogen will be more feasible with lower activating energy cost (45.6kJ/mol) than that of CC bond (58.7kJ/mol). The second H transformations are more difficult in both case of CO and CC bond with unsaturated alcohol or saturated aldehyde as final product. In general, the reactions of CO are found to be prior to that of CC bond in catalyst cycle by calculations. As for the two kinds of hydrogen elimination reactions of MAL pathways (e) and (f), the hydrogen elimination of CHO have obvious advantage with 45.5kJ/mol activation energy. It is more important that the following attack of methoxyl on acyl group costs a low energy to form the MMA. Comparing the above different pathways, it could be found that attack of methoxyl, the hydrogen addition and elimination of CHO group have the similar energy barriers for the first step among all the paths investigated, and would be competitive in the beginning of catalyst reaction. However, the energy barrier for further hydrogenation of CO in path(c) to give the unsaturated alcohol is 104.1kJ/mol, which is the largest among all the paths computed and larger than the allover barrier (72.4kJ/mol) of the path(a) for methoxyl reaction with CO bond. As the rate-determining step of path(c), the second hydrogen addition of CO will be difficult to take place. In general, the path(e) for the direct hydrogen elimination of CHO in MAL is with an energy advantage. On the basis of comparisons for these energy barriers, one could expect that the hydrogen elimination of MAL following methoxyl reaction with CO will be a favored reaction pathway, which will lead to the formation of MMA, while the completely formation of hemiacetal intermediate is less possible. Our analysis is confirmed by the reaction kinetics results of the direct methyl esterification reaction for MMA [49]. It is found that acyl group formed by decomposition of aldehyde and methoxy group are coupled to form MMA based on the reaction kinetic researches. Actually, there are not very big energy differences found for these pathways, so it will be advantageous to get ideal product by changing the reaction condition and modifying the catalyst. The further theory and experimental investigations into the scope, mechanism, and synthetic application of oxidative esterification reactions are currently carried out in our laboratory, including influences of oxygen and PdPb catalyst. 4 Conclusions The detailed reaction mechanisms for oxidative esterification process of methacrolein (MAL) with methanol to methyl methacrylate (MMA) on a Pd20 model cluster have been investigated at the density functional level of theory. There are several possible mechanisms for the reaction of MAL, some of them are the attack routes of the methoxyl, while the others are the hydrogen addition or elimination routes of unsaturated groups in MAL. On the basis of calculated thermodynamic data of the entirely catalytic cycle, the direct hydrogen elimination of MAL then reacting with methoxyl would be the most important pathway, which is responsible for the direct formation of MMA as the principal product. Detailed reaction coordinate calculations were also used to isolate the transition states for elementary reactions in the formation processes of unsaturated alcohol and saturated aldehyde as final products. The stepwise formation of unsaturated alcohol by H addition, and that of saturated aldehyde through the CC double bond addition by methoxyl and H are also competitive. Acknowledgments This work was supported by the National Basic Research Program of China (2009CB219902) and National Natural Scientific Fund of China (21073194, 20903098). References [1] C. McDonald H. Holcomb K. Kennedy E. Kirkpatrick T. Leathers P. Vanemon J. Org. Chem. 54 1989 1213 1215 [2] M. Okimoto T. Chiba J. Org. Chem. 53 1998 218 219 [3] P.G.M. Wuts C.L. Bergh Tetrahedron Lett. 27 1986 3995 3998 [4] B. Connor G. Just Tetrahedron Lett. 28 1987 3235 3236 [5] S. Murahashi T. Naota K. Ito Y. Maeda H. Taki J. Org. Chem. 52 1987 4319 4327 [6] D.R. William F.D. Klingler E.E. Allen F.W. Lichtenthaler Tetrahedron Lett. 29 1988 5087 5090 [7] J.H. Espenson Z. Zuolin T.H. Zauche J. Org. Chem. 64 1999 1191 1196 [8] R. Gopinath B. Barkakaty B. Talukdar B.K. Patel J. Org. Chem. 68 2003 2944 2947 [9] R. Gopinath A.R. Paital B.K. Patel Tetrahedron Lett. 43 2002 5123 5126 [10] W. Yoo C. Li Tetrahedron Lett. 48 2007 1033 1035 [11] S. Kiyooka M. Ueno E. Ishii Tetrahedron Lett. 46 2005 4639 4642 [12] C. Noonan L. Baragwanath S.J. Connon Tetrahedron Lett. 49 2008 4003 4006 [13] H.S. Kim T.W. Kimb H.L. Koh S.H. Lee B.R. Min Appl. Catal. A 280 2005 125 131 [14] U.R. Pillai E. Sahle-Demessie Green Chem. 6 2004 161 165 [15] J. Lichtenberger D. Lee E. Iglesia Phys. Chem. Chem. Phys. 9 2007 4902 4906 [16] R. Ubago-Pérez F. Carrasco-Marín C. Moreno-Castilla Catal. Today 123 2007 158 163 [17] D.I. Enache J.K. Edwards P. Landon B. Solsona-Espriu A.F. Carley A.A. Herzing M. Watanabe C.J. Kiely D.W. Knight G.J. Hutchings Science 311 2006 362 365 [18] Y. Diao R. Yan S. Zhang P. Yang Z. Li L. Wang H. Dong J. Mol. Catal. A: Chem. 303 2009 35 42 [19] Y. Tamaru Y. Yamada K. Inoue Y. Yamamoto Z. Yoshida J. Org. Chem. 48 1983 1286 1292 [20] S. Kiyooka Y. Wada M. Ueno T. Yokoyama R. Yokoyama Tetrahedron 63 2007 12695 12701 [21] N. Watari S. Ohnishi Phys. Rev. B 58 1998 1665 1669 [22] V. Kumar Y. Kawazoe Phys. Rev. B 66 2002 144413-1–11 [23] W.Q. Zhang Q.F. Ge L. Wang C. J. Chem. Phys. 118 2003 5793 5801 [24] I. Efremenko M. Sheintuch J. Mol. Catal. A: Chem. 160 2000 445 451 [25] G. Berthier M. Defranceschi R. Montagnani O. Salvetti Int. J. Quantum Chem. 82 2001 26 33 [26] R. Guirado-Lopez M.C. Desjonqueres D. Spanjaard Phys. Rev. B 62 2000 13188 13195 [27] C. Barreteau M.C. Desjonqueres D. Spanjaard Eur. Phys. J. D 11 2000 395 402 [28] F. Gao Y. Wang L. Burkholder C. Hirschmugl D.K. Saldin H.C. Poon D. Sholl J. James W.T. Tysoe Surf. Sci. 602 2008 2264 2270 [29] H.C. Poon M. Weinert D.K. Saldin D. Stacchiola T. Zheng W.T. Tysoe Phys. Rev. B 69 2004 035401 [30] V. Bertin E. Agacino R. López-Rendon E. Poulain J. Mol. Struct. Theochem. 796 2006 243 248 [31] M. Morkel H. Unterhalt T. Klüner G. Rupprechter H.-J. Freund Surf. Sci. 586 2005 146 156 [32] G. Pacchioni J. Koutecki J. Phys. Chem. 91 1987 2658 2664 [33] P.A. Sheth M. Neurock C.M. Smith J. Phys. Chem. B 107 2003 2009 2017 [34] C. Morin D. Simon P. Sautet J. Phys. Chem. B 107 2003 2995 3002 [35] F. Mittendorfer C. Thomazeau P. Raybaud H. Toulhoat J. Phys. Chem. B 107 2003 12287 12295 [36] V. Pallassana M. Neurock J. Catal. 209 2002 289 305 [37] B.F. Straub J. Am. Chem. Soc. 124 2002 14195 14201 [38] J.V. Ferreira A.C. Pavão Surf. Sci. 602 2008 1964 1967 [39] M. Lahti N. Nivalainen A. Puisto M. Alatalo Surf. Sci. 601 2007 3774 3777 [40] Y. Wang J.P. Perdew Phys. Rev. B 44 1991 13298 13307 [41] A. Valcárcel A. Clotet J.M. Ricart F. Illas Chem. Phys. 309 2005 33 39 [42] T. Zheng D. Stacchiola H.C. Poon D.K. Saldin W.T. Tysoe Surf. Sci. 564 2004 71 78 [43] J.J. Chen S.C. Jiang Y. Zhou B.R. Chakraborty N. Winograd Surf. Sci. 328 1995 248 262 [44] T. Mitsui M.K. Rose E. Fomin D.F. Ogletree M. Salmeron Surf. Sci. 540 2003 5 11 [45] G.W. Watson R.P.K. Wells D.J. Willock G.J. Hutchings J. Phys. Chem. B 105 2001 4889 4894 [46] L. Giordano L. Di Piazza M.I. Trioni F. Montalenti Chem. Phys. Lett. 400 2004 163 168 [47] S.C. Jung M.H. Kang Surf. Sci. 601 2007 852 857 [48] J. Berkowitz G.B. Ellison D. Gutman J. Phys. Chem. 98 1994 2744 2765 [49] S. Yamamatsu T. Yamaguchi K. Yokota O. Nagano M. Chono A. Aoshima Catal. Surv. Asia 14 2010 124 131",
      "scopus-id": "84860287729",
      "coredata": {
        "eid": "1-s2.0-S1381116912000908",
        "dc:description": "The detailed transformation mechanism of methacrolein with methanol to methyl methacrylate over Pd was investigated by density functional theory (DFT) calculation as an attempt to gain more insight into the oxidative esterification reaction. The entire catalytic cycle and reaction energies are computed for various possible paths over Pd20 cluster. It is found that the hydrogen elimination of MAL following acyl group reaction with methoxyl appears to be an energetically favorable pathway in catalyst cycle. The formation of unsaturated alcohol by H addition, and that of saturated aldehyde through the CC addition by methoxyl and H are also competitive. The formation of hemiacetal intermediate is not necessary for the production of MMA.",
        "openArchiveArticle": "false",
        "prism:coverDate": "2012-06-30",
        "openaccessUserLicense": null,
        "prism:aggregationType": "Journal",
        "prism:url": "https://api.elsevier.com/content/article/pii/S1381116912000908",
        "dc:creator": [
          {
            "@_fa": "true",
            "$": "Yao, Xiaoqian"
          },
          {
            "@_fa": "true",
            "$": "Diao, Yanyan"
          },
          {
            "@_fa": "true",
            "$": "Liu, Xiaomin"
          },
          {
            "@_fa": "true",
            "$": "Li, Yong-Wang"
          },
          {
            "@_fa": "true",
            "$": "Dong, Kun"
          },
          {
            "@_fa": "true",
            "$": "Zhang, Suojiang"
          }
        ],
        "link": [
          {
            "@_fa": "true",
            "@rel": "self",
            "@href": "https://api.elsevier.com/content/article/pii/S1381116912000908"
          },
          {
            "@_fa": "true",
            "@rel": "scidir",
            "@href": "https://www.sciencedirect.com/science/article/pii/S1381116912000908"
          }
        ],
        "dc:format": "application/json",
        "openaccessType": null,
        "pii": "S1381-1169(12)00090-8",
        "prism:volume": "358",
        "prism:publisher": "Elsevier B.V.",
        "dc:title": "Mechanistic aspects for the direct oxidative esterification of aldehydes with alcohols over Pd catalyst: A computational study",
        "prism:copyright": "Copyright © 2012 Elsevier B.V. All rights reserved.",
        "openaccess": "0",
        "prism:issn": "13811169",
        "dcterms:subject": [
          {
            "@_fa": "true",
            "$": "Oxidative esterification"
          },
          {
            "@_fa": "true",
            "$": "Methyl methacrylate"
          },
          {
            "@_fa": "true",
            "$": "Pd"
          },
          {
            "@_fa": "true",
            "$": "Catalysis"
          },
          {
            "@_fa": "true",
            "$": "DFT"
          }
        ],
        "openaccessArticle": "false",
        "prism:publicationName": "Journal of Molecular Catalysis A: Chemical",
        "openaccessSponsorType": null,
        "prism:pageRange": "166-175",
        "prism:endingPage": "175",
        "pubType": "fla",
        "prism:coverDisplayDate": "June 2012",
        "prism:doi": "10.1016/j.molcata.2012.03.012",
        "prism:startingPage": "166",
        "dc:identifier": "doi:10.1016/j.molcata.2012.03.012",
        "openaccessSponsorName": null
      },
      "objects": {
        "object": [
          {
            "@category": "standard",
            "@height": "200",
            "@width": "420",
            "@_fa": "true",
            "$": "https://api.elsevier.com/content/object/eid/1-s2.0-S1381116912000908-fx1.jpg?httpAccept=%2A%2F%2A",
            "@multimediatype": "JPEG image file",
            "@type": "IMAGE-DOWNSAMPLED",
            "@size": "23896",
            "@ref": "fx1",
            "@mimetype": "image/jpeg"
          },
          {
            "@category": "standard",
            "@height": "209",
            "@width": "489",
            "@_fa": "true",
            "$": "https://api.elsevier.com/content/object/eid/1-s2.0-S1381116912000908-gr1.jpg?httpAccept=%2A%2F%2A",
            "@multimediatype": "JPEG image file",
            "@type": "IMAGE-DOWNSAMPLED",
            "@size": "38130",
            "@ref": "gr1",
            "@mimetype": "image/jpeg"
          },
          {
            "@category": "standard",
            "@height": "281",
            "@width": "602",
            "@_fa": "true",
            "$": "https://api.elsevier.com/content/object/eid/1-s2.0-S1381116912000908-gr10.jpg?httpAccept=%2A%2F%2A",
            "@multimediatype": "JPEG image file",
            "@type": "IMAGE-DOWNSAMPLED",
            "@size": "52801",
            "@ref": "gr10",
            "@mimetype": "image/jpeg"
          },
          {
            "@category": "standard",
            "@height": "281",
            "@width": "602",
            "@_fa": "true",
            "$": "https://api.elsevier.com/content/object/eid/1-s2.0-S1381116912000908-gr11.jpg?httpAccept=%2A%2F%2A",
            "@multimediatype": "JPEG image file",
            "@type": "IMAGE-DOWNSAMPLED",
            "@size": "51750",
            "@ref": "gr11",
            "@mimetype": "image/jpeg"
          },
          {
            "@category": "standard",
            "@height": "239",
            "@width": "376",
            "@_fa": "true",
            "$": "https://api.elsevier.com/content/object/eid/1-s2.0-S1381116912000908-gr2.jpg?httpAccept=%2A%2F%2A",
            "@multimediatype": "JPEG image file",
            "@type": "IMAGE-DOWNSAMPLED",
            "@size": "26701",
            "@ref": "gr2",
            "@mimetype": "image/jpeg"
          },
          {
            "@category": "standard",
            "@height": "335",
            "@width": "602",
            "@_fa": "true",
            "$": "https://api.elsevier.com/content/object/eid/1-s2.0-S1381116912000908-gr3.jpg?httpAccept=%2A%2F%2A",
            "@multimediatype": "JPEG image file",
            "@type": "IMAGE-DOWNSAMPLED",
            "@size": "54291",
            "@ref": "gr3",
            "@mimetype": "image/jpeg"
          },
          {
            "@category": "standard",
            "@height": "395",
            "@width": "602",
            "@_fa": "true",
            "$": "https://api.elsevier.com/content/object/eid/1-s2.0-S1381116912000908-gr4.jpg?httpAccept=%2A%2F%2A",
            "@multimediatype": "JPEG image file",
            "@type": "IMAGE-DOWNSAMPLED",
            "@size": "66344",
            "@ref": "gr4",
            "@mimetype": "image/jpeg"
          },
          {
            "@category": "standard",
            "@height": "246",
            "@width": "376",
            "@_fa": "true",
            "$": "https://api.elsevier.com/content/object/eid/1-s2.0-S1381116912000908-gr5.jpg?httpAccept=%2A%2F%2A",
            "@multimediatype": "JPEG image file",
            "@type": "IMAGE-DOWNSAMPLED",
            "@size": "29402",
            "@ref": "gr5",
            "@mimetype": "image/jpeg"
          },
          {
            "@category": "standard",
            "@height": "285",
            "@width": "489",
            "@_fa": "true",
            "$": "https://api.elsevier.com/content/object/eid/1-s2.0-S1381116912000908-gr6.jpg?httpAccept=%2A%2F%2A",
            "@multimediatype": "JPEG image file",
            "@type": "IMAGE-DOWNSAMPLED",
            "@size": "43294",
            "@ref": "gr6",
            "@mimetype": "image/jpeg"
          },
          {
            "@category": "standard",
            "@height": "213",
            "@width": "376",
            "@_fa": "true",
            "$": "https://api.elsevier.com/content/object/eid/1-s2.0-S1381116912000908-gr7.jpg?httpAccept=%2A%2F%2A",
            "@multimediatype": "JPEG image file",
            "@type": "IMAGE-DOWNSAMPLED",
            "@size": "26469",
            "@ref": "gr7",
            "@mimetype": "image/jpeg"
          },
          {
            "@category": "standard",
            "@height": "262",
            "@width": "602",
            "@_fa": "true",
            "$": "https://api.elsevier.com/content/object/eid/1-s2.0-S1381116912000908-gr8.jpg?httpAccept=%2A%2F%2A",
            "@multimediatype": "JPEG image file",
            "@type": "IMAGE-DOWNSAMPLED",
            "@size": "50818",
            "@ref": "gr8",
            "@mimetype": "image/jpeg"
          },
          {
            "@category": "standard",
            "@height": "282",
            "@width": "602",
            "@_fa": "true",
            "$": "https://api.elsevier.com/content/object/eid/1-s2.0-S1381116912000908-gr9.jpg?httpAccept=%2A%2F%2A",
            "@multimediatype": "JPEG image file",
            "@type": "IMAGE-DOWNSAMPLED",
            "@size": "54899",
            "@ref": "gr9",
            "@mimetype": "image/jpeg"
          },
          {
            "@category": "standard",
            "@height": "63",
            "@width": "368",
            "@_fa": "true",
            "$": "https://api.elsevier.com/content/object/eid/1-s2.0-S1381116912000908-sc1.jpg?httpAccept=%2A%2F%2A",
            "@multimediatype": "JPEG image file",
            "@type": "IMAGE-DOWNSAMPLED",
            "@size": "4551",
            "@ref": "sc1",
            "@mimetype": "image/jpeg"
          },
          {
            "@category": "standard",
            "@height": "519",
            "@width": "678",
            "@_fa": "true",
            "$": "https://api.elsevier.com/content/object/eid/1-s2.0-S1381116912000908-sc2.jpg?httpAccept=%2A%2F%2A",
            "@multimediatype": "JPEG image file",
            "@type": "IMAGE-DOWNSAMPLED",
            "@size": "41701",
            "@ref": "sc2",
            "@mimetype": "image/jpeg"
          },
          {
            "@category": "standard",
            "@height": "187",
            "@width": "489",
            "@_fa": "true",
            "$": "https://api.elsevier.com/content/object/eid/1-s2.0-S1381116912000908-sc3.jpg?httpAccept=%2A%2F%2A",
            "@multimediatype": "JPEG image file",
            "@type": "IMAGE-DOWNSAMPLED",
            "@size": "17789",
            "@ref": "sc3",
            "@mimetype": "image/jpeg"
          },
          {
            "@category": "standard",
            "@height": "269",
            "@width": "489",
            "@_fa": "true",
            "$": "https://api.elsevier.com/content/object/eid/1-s2.0-S1381116912000908-sc4.jpg?httpAccept=%2A%2F%2A",
            "@multimediatype": "JPEG image file",
            "@type": "IMAGE-DOWNSAMPLED",
            "@size": "20505",
            "@ref": "sc4",
            "@mimetype": "image/jpeg"
          },
          {
            "@category": "thumbnail",
            "@height": "104",
            "@width": "219",
            "@_fa": "true",
            "$": "https://api.elsevier.com/content/object/eid/1-s2.0-S1381116912000908-fx1.sml?httpAccept=%2A%2F%2A",
            "@multimediatype": "GIF image file",
            "@type": "IMAGE-THUMBNAIL",
            "@size": "7959",
            "@ref": "fx1",
            "@mimetype": "image/gif"
          },
          {
            "@category": "thumbnail",
            "@height": "94",
            "@width": "219",
            "@_fa": "true",
            "$": "https://api.elsevier.com/content/object/eid/1-s2.0-S1381116912000908-gr1.sml?httpAccept=%2A%2F%2A",
            "@multimediatype": "GIF image file",
            "@type": "IMAGE-THUMBNAIL",
            "@size": "10241",
            "@ref": "gr1",
            "@mimetype": "image/gif"
          },
          {
            "@category": "thumbnail",
            "@height": "102",
            "@width": "219",
            "@_fa": "true",
            "$": "https://api.elsevier.com/content/object/eid/1-s2.0-S1381116912000908-gr10.sml?httpAccept=%2A%2F%2A",
            "@multimediatype": "GIF image file",
            "@type": "IMAGE-THUMBNAIL",
            "@size": "8260",
            "@ref": "gr10",
            "@mimetype": "image/gif"
          },
          {
            "@category": "thumbnail",
            "@height": "102",
            "@width": "219",
            "@_fa": "true",
            "$": "https://api.elsevier.com/content/object/eid/1-s2.0-S1381116912000908-gr11.sml?httpAccept=%2A%2F%2A",
            "@multimediatype": "GIF image file",
            "@type": "IMAGE-THUMBNAIL",
            "@size": "8146",
            "@ref": "gr11",
            "@mimetype": "image/gif"
          },
          {
            "@category": "thumbnail",
            "@height": "139",
            "@width": "219",
            "@_fa": "true",
            "$": "https://api.elsevier.com/content/object/eid/1-s2.0-S1381116912000908-gr2.sml?httpAccept=%2A%2F%2A",
            "@multimediatype": "GIF image file",
            "@type": "IMAGE-THUMBNAIL",
            "@size": "8913",
            "@ref": "gr2",
            "@mimetype": "image/gif"
          },
          {
            "@category": "thumbnail",
            "@height": "122",
            "@width": "219",
            "@_fa": "true",
            "$": "https://api.elsevier.com/content/object/eid/1-s2.0-S1381116912000908-gr3.sml?httpAccept=%2A%2F%2A",
            "@multimediatype": "GIF image file",
            "@type": "IMAGE-THUMBNAIL",
            "@size": "8134",
            "@ref": "gr3",
            "@mimetype": "image/gif"
          },
          {
            "@category": "thumbnail",
            "@height": "144",
            "@width": "219",
            "@_fa": "true",
            "$": "https://api.elsevier.com/content/object/eid/1-s2.0-S1381116912000908-gr4.sml?httpAccept=%2A%2F%2A",
            "@multimediatype": "GIF image file",
            "@type": "IMAGE-THUMBNAIL",
            "@size": "10079",
            "@ref": "gr4",
            "@mimetype": "image/gif"
          },
          {
            "@category": "thumbnail",
            "@height": "143",
            "@width": "219",
            "@_fa": "true",
            "$": "https://api.elsevier.com/content/object/eid/1-s2.0-S1381116912000908-gr5.sml?httpAccept=%2A%2F%2A",
            "@multimediatype": "GIF image file",
            "@type": "IMAGE-THUMBNAIL",
            "@size": "9691",
            "@ref": "gr5",
            "@mimetype": "image/gif"
          },
          {
            "@category": "thumbnail",
            "@height": "128",
            "@width": "219",
            "@_fa": "true",
            "$": "https://api.elsevier.com/content/object/eid/1-s2.0-S1381116912000908-gr6.sml?httpAccept=%2A%2F%2A",
            "@multimediatype": "GIF image file",
            "@type": "IMAGE-THUMBNAIL",
            "@size": "9405",
            "@ref": "gr6",
            "@mimetype": "image/gif"
          },
          {
            "@category": "thumbnail",
            "@height": "124",
            "@width": "219",
            "@_fa": "true",
            "$": "https://api.elsevier.com/content/object/eid/1-s2.0-S1381116912000908-gr7.sml?httpAccept=%2A%2F%2A",
            "@multimediatype": "GIF image file",
            "@type": "IMAGE-THUMBNAIL",
            "@size": "8691",
            "@ref": "gr7",
            "@mimetype": "image/gif"
          },
          {
            "@category": "thumbnail",
            "@height": "95",
            "@width": "219",
            "@_fa": "true",
            "$": "https://api.elsevier.com/content/object/eid/1-s2.0-S1381116912000908-gr8.sml?httpAccept=%2A%2F%2A",
            "@multimediatype": "GIF image file",
            "@type": "IMAGE-THUMBNAIL",
            "@size": "8017",
            "@ref": "gr8",
            "@mimetype": "image/gif"
          },
          {
            "@category": "thumbnail",
            "@height": "103",
            "@width": "219",
            "@_fa": "true",
            "$": "https://api.elsevier.com/content/object/eid/1-s2.0-S1381116912000908-gr9.sml?httpAccept=%2A%2F%2A",
            "@multimediatype": "GIF image file",
            "@type": "IMAGE-THUMBNAIL",
            "@size": "8645",
            "@ref": "gr9",
            "@mimetype": "image/gif"
          },
          {
            "@category": "thumbnail",
            "@height": "37",
            "@width": "219",
            "@_fa": "true",
            "$": "https://api.elsevier.com/content/object/eid/1-s2.0-S1381116912000908-sc1.sml?httpAccept=%2A%2F%2A",
            "@multimediatype": "GIF image file",
            "@type": "IMAGE-THUMBNAIL",
            "@size": "2003",
            "@ref": "sc1",
            "@mimetype": "image/gif"
          },
          {
            "@category": "thumbnail",
            "@height": "164",
            "@width": "214",
            "@_fa": "true",
            "$": "https://api.elsevier.com/content/object/eid/1-s2.0-S1381116912000908-sc2.sml?httpAccept=%2A%2F%2A",
            "@multimediatype": "GIF image file",
            "@type": "IMAGE-THUMBNAIL",
            "@size": "4953",
            "@ref": "sc2",
            "@mimetype": "image/gif"
          },
          {
            "@category": "thumbnail",
            "@height": "84",
            "@width": "219",
            "@_fa": "true",
            "$": "https://api.elsevier.com/content/object/eid/1-s2.0-S1381116912000908-sc3.sml?httpAccept=%2A%2F%2A",
            "@multimediatype": "GIF image file",
            "@type": "IMAGE-THUMBNAIL",
            "@size": "3923",
            "@ref": "sc3",
            "@mimetype": "image/gif"
          },
          {
            "@category": "thumbnail",
            "@height": "120",
            "@width": "219",
            "@_fa": "true",
            "$": "https://api.elsevier.com/content/object/eid/1-s2.0-S1381116912000908-sc4.sml?httpAccept=%2A%2F%2A",
            "@multimediatype": "GIF image file",
            "@type": "IMAGE-THUMBNAIL",
            "@size": "4208",
            "@ref": "sc4",
            "@mimetype": "image/gif"
          },
          {
            "@category": "high",
            "@height": "886",
            "@width": "1860",
            "@_fa": "true",
            "$": "https://api.elsevier.com/content/object/eid/1-s2.0-S1381116912000908-fx1_lrg.jpg?httpAccept=%2A%2F%2A",
            "@multimediatype": "JPEG image file",
            "@type": "IMAGE-HIGH-RES",
            "@size": "182122",
            "@ref": "fx1",
            "@mimetype": "image/jpeg"
          },
          {
            "@category": "high",
            "@height": "926",
            "@width": "2167",
            "@_fa": "true",
            "$": "https://api.elsevier.com/content/object/eid/1-s2.0-S1381116912000908-gr1_lrg.jpg?httpAccept=%2A%2F%2A",
            "@multimediatype": "JPEG image file",
            "@type": "IMAGE-HIGH-RES",
            "@size": "549046",
            "@ref": "gr1",
            "@mimetype": "image/jpeg"
          },
          {
            "@category": "high",
            "@height": "1247",
            "@width": "2667",
            "@_fa": "true",
            "$": "https://api.elsevier.com/content/object/eid/1-s2.0-S1381116912000908-gr10_lrg.jpg?httpAccept=%2A%2F%2A",
            "@multimediatype": "JPEG image file",
            "@type": "IMAGE-HIGH-RES",
            "@size": "502906",
            "@ref": "gr10",
            "@mimetype": "image/jpeg"
          },
          {
            "@category": "high",
            "@height": "1247",
            "@width": "2667",
            "@_fa": "true",
            "$": "https://api.elsevier.com/content/object/eid/1-s2.0-S1381116912000908-gr11_lrg.jpg?httpAccept=%2A%2F%2A",
            "@multimediatype": "JPEG image file",
            "@type": "IMAGE-HIGH-RES",
            "@size": "489257",
            "@ref": "gr11",
            "@mimetype": "image/jpeg"
          },
          {
            "@category": "high",
            "@height": "1059",
            "@width": "1667",
            "@_fa": "true",
            "$": "https://api.elsevier.com/content/object/eid/1-s2.0-S1381116912000908-gr2_lrg.jpg?httpAccept=%2A%2F%2A",
            "@multimediatype": "JPEG image file",
            "@type": "IMAGE-HIGH-RES",
            "@size": "251727",
            "@ref": "gr2",
            "@mimetype": "image/jpeg"
          },
          {
            "@category": "high",
            "@height": "1485",
            "@width": "2667",
            "@_fa": "true",
            "$": "https://api.elsevier.com/content/object/eid/1-s2.0-S1381116912000908-gr3_lrg.jpg?httpAccept=%2A%2F%2A",
            "@multimediatype": "JPEG image file",
            "@type": "IMAGE-HIGH-RES",
            "@size": "527522",
            "@ref": "gr3",
            "@mimetype": "image/jpeg"
          },
          {
            "@category": "high",
            "@height": "1750",
            "@width": "2667",
            "@_fa": "true",
            "$": "https://api.elsevier.com/content/object/eid/1-s2.0-S1381116912000908-gr4_lrg.jpg?httpAccept=%2A%2F%2A",
            "@multimediatype": "JPEG image file",
            "@type": "IMAGE-HIGH-RES",
            "@size": "629114",
            "@ref": "gr4",
            "@mimetype": "image/jpeg"
          },
          {
            "@category": "high",
            "@height": "1090",
            "@width": "1667",
            "@_fa": "true",
            "$": "https://api.elsevier.com/content/object/eid/1-s2.0-S1381116912000908-gr5_lrg.jpg?httpAccept=%2A%2F%2A",
            "@multimediatype": "JPEG image file",
            "@type": "IMAGE-HIGH-RES",
            "@size": "267645",
            "@ref": "gr5",
            "@mimetype": "image/jpeg"
          },
          {
            "@category": "high",
            "@height": "1263",
            "@width": "2167",
            "@_fa": "true",
            "$": "https://api.elsevier.com/content/object/eid/1-s2.0-S1381116912000908-gr6_lrg.jpg?httpAccept=%2A%2F%2A",
            "@multimediatype": "JPEG image file",
            "@type": "IMAGE-HIGH-RES",
            "@size": "376624",
            "@ref": "gr6",
            "@mimetype": "image/jpeg"
          },
          {
            "@category": "high",
            "@height": "946",
            "@width": "1667",
            "@_fa": "true",
            "$": "https://api.elsevier.com/content/object/eid/1-s2.0-S1381116912000908-gr7_lrg.jpg?httpAccept=%2A%2F%2A",
            "@multimediatype": "JPEG image file",
            "@type": "IMAGE-HIGH-RES",
            "@size": "247136",
            "@ref": "gr7",
            "@mimetype": "image/jpeg"
          },
          {
            "@category": "high",
            "@height": "1162",
            "@width": "2667",
            "@_fa": "true",
            "$": "https://api.elsevier.com/content/object/eid/1-s2.0-S1381116912000908-gr8_lrg.jpg?httpAccept=%2A%2F%2A",
            "@multimediatype": "JPEG image file",
            "@type": "IMAGE-HIGH-RES",
            "@size": "468735",
            "@ref": "gr8",
            "@mimetype": "image/jpeg"
          },
          {
            "@category": "high",
            "@height": "1249",
            "@width": "2667",
            "@_fa": "true",
            "$": "https://api.elsevier.com/content/object/eid/1-s2.0-S1381116912000908-gr9_lrg.jpg?httpAccept=%2A%2F%2A",
            "@multimediatype": "JPEG image file",
            "@type": "IMAGE-HIGH-RES",
            "@size": "512512",
            "@ref": "gr9",
            "@mimetype": "image/jpeg"
          },
          {
            "@category": "high",
            "@height": "277",
            "@width": "1629",
            "@_fa": "true",
            "$": "https://api.elsevier.com/content/object/eid/1-s2.0-S1381116912000908-sc1_lrg.jpg?httpAccept=%2A%2F%2A",
            "@multimediatype": "JPEG image file",
            "@type": "IMAGE-HIGH-RES",
            "@size": "34555",
            "@ref": "sc1",
            "@mimetype": "image/jpeg"
          },
          {
            "@category": "high",
            "@height": "2296",
            "@width": "3000",
            "@_fa": "true",
            "$": "https://api.elsevier.com/content/object/eid/1-s2.0-S1381116912000908-sc2_lrg.jpg?httpAccept=%2A%2F%2A",
            "@multimediatype": "JPEG image file",
            "@type": "IMAGE-HIGH-RES",
            "@size": "369401",
            "@ref": "sc2",
            "@mimetype": "image/jpeg"
          },
          {
            "@category": "high",
            "@height": "829",
            "@width": "2167",
            "@_fa": "true",
            "$": "https://api.elsevier.com/content/object/eid/1-s2.0-S1381116912000908-sc3_lrg.jpg?httpAccept=%2A%2F%2A",
            "@multimediatype": "JPEG image file",
            "@type": "IMAGE-HIGH-RES",
            "@size": "143523",
            "@ref": "sc3",
            "@mimetype": "image/jpeg"
          },
          {
            "@category": "high",
            "@height": "1190",
            "@width": "2167",
            "@_fa": "true",
            "$": "https://api.elsevier.com/content/object/eid/1-s2.0-S1381116912000908-sc4_lrg.jpg?httpAccept=%2A%2F%2A",
            "@multimediatype": "JPEG image file",
            "@type": "IMAGE-HIGH-RES",
            "@size": "173468",
            "@ref": "sc4",
            "@mimetype": "image/jpeg"
          },
          {
            "@category": "thumbnail",
            "@height": "13",
            "@width": "241",
            "@_fa": "true",
            "$": "https://api.elsevier.com/content/object/eid/1-s2.0-S1381116912000908-si1.gif?httpAccept=%2A%2F%2A",
            "@multimediatype": "GIF image file",
            "@type": "ALTIMG",
            "@size": "724",
            "@ref": "si1",
            "@mimetype": "image/gif"
          }
        ]
      },
      "link": {
        "@rel": "abstract",
        "@href": "https://api.elsevier.com/content/abstract/scopus_id/84860287729"
      }
    }
  }
}