{
  "metadata": {
    "title": "Coupled oxidative carbonylation of bisphenol-A and phenol into phenylcarbonate-ended polycarbonate precursors over a homogeneous Pd–Ce redox catalyst",
    "authors": "; ; ",
    "journal": "Journal of Molecular Catalysis A: Chemical",
    "date": "2002-06-17",
    "doi": "10.1016/S1381-1169(02)00011-0",
    "abstract": "",
    "uri": "https://api.elsevier.com/content/article/pii/S1381116902000110",
    "pii": "S1381116902000110"
  },
  "fulltext": {
    "full-text-retrieval-response": {
      "scopus-eid": "2-s2.0-0037124938",
      "originalText": "serial JL 271358 291210 291744 291790 291809 31 Journal of Molecular Catalysis A: Chemical JOURNALMOLECULARCATALYSISACHEMICAL 2002-01-25 2002-01-25 2010-04-18T17:18:08 1-s2.0-S1381116902000110 S1381-1169(02)00011-0 S1381116902000110 10.1016/S1381-1169(02)00011-0 S300 S300.1 FULL-TEXT 1-s2.0-S1381116900X01513 2015-05-15T05:56:33.301439-04:00 0 0 20020617 2002 2002-01-25T00:00:00Z articleinfo crossmark dco dateupdated tomb dateloaded datesearch indexeddate issuelist volumelist yearnav articletitlenorm authfirstinitialnorm authfirstsurnamenorm cid cids contenttype copyright dateloadedtxt docsubtype doctype doi eid ewtransactionid hubeid issfirst issn issnnorm itemstage itemtransactionid itemweight openaccess openarchive pg pgfirst pglast pii piinorm pubdatestart pubdatetxt pubyr sortorder srctitle srctitlenorm srctype subheadings volfirst volissue webpdf webpdfpagecount figure table body acknowledge affil articletitle auth authfirstini authfull authkeywords authlast primabst ref alllist content subj ssids 1381-1169 13811169 184 184 1 2 1 2 Volume 184, Issues 1–2 5 39 49 39 49 20020617 17 June 2002 2002-06-17 2002 converted-article fla Copyright © 2002 Elsevier Science B.V. All rights reserved. COUPLEDOXIDATIVECARBONYLATIONBISPHENOLAPHENOLPHENYLCARBONATEENDEDPOLYCARBONATEPRECURSORSOVERAHOMOGENEOUSPDCEREDOXCATALYST KIM W 1 Introduction 2 Experimental 2.1 Reaction procedures 2.2 Product analyses 3 Results and discussion 3.1 HPLC chromatograms and FT-IR analysis of the polycarbonate oligomers 3.2 The coupled oxidative carbonylation of BPA and phenol as a novel reaction scheme for polycarbonate oligomers 3.3 Effect of solvent on the coupled oxidative carbonylation 3.4 Effect of base on the coupled oxidative carbonylation 3.5 Effect of organic co-catalyst on the coupled oxidative carbonylation 3.6 Effect of dehydration on the coupled oxidative carbonylation 3.7 Effect of molar ratio of phenol to bisphenol-A 4 Conclusions Acknowledgements References TUNDO 1988 1565 P FU 1997 293 Z KIM 1999 83 W KIM 1999 307 W KIM 2000 403 W LOSEV 1963 662 I TURSKA 1970 415 E KIM 1992 2118 Y GOYAL 1999 3237 M GOYAL 2000 2289 M ISHII 2001 376 H HALLGREN 1979 135 J HALLGREN 1981 135 J HEUMANN 1994 542 A MOISEEV 1996 77 I TAKAGI 1998 L1 M VAVASORI 1999 109 A GOYAL 1999 147 M ISHII 1999 289 H SONG 2000 243 H MORK 1992 435 C BAILLY 1986 776 C KUBOTA 1996 27 Y GRENNBERG 1993 1790 H KIMX2002X39 KIMX2002X39X49 KIMX2002X39XW KIMX2002X39X49XW item S1381-1169(02)00011-0 S1381116902000110 1-s2.0-S1381116902000110 10.1016/S1381-1169(02)00011-0 271358 2010-10-03T19:44:47.710612-04:00 2002-06-17 1-s2.0-S1381116902000110-main.pdf https://s3.amazonaws.com/prod-ucs-content-store-us-east/content/pii:S1381116902000110/MAIN/application/pdf/c89cb2c492b79f40eb0d2fc6d5dc8565/main.pdf https://s3-eu-west-1.amazonaws.com/prod-ucs-content-store-eu-west/content/pii:S1381116902000110/MAIN/application/pdf/c89cb2c492b79f40eb0d2fc6d5dc8565/main.pdf main.pdf pdf true 236951 MAIN 11 1-s2.0-S1381116902000110-main_1.png https://s3.amazonaws.com/prod-ucs-content-store-us-east/content/pii:S1381116902000110/PREVIEW/image/png/cc4219a3a5c51c25120b38e77f915582/main_1.png https://s3-eu-west-1.amazonaws.com/prod-ucs-content-store-eu-west/content/pii:S1381116902000110/PREVIEW/image/png/cc4219a3a5c51c25120b38e77f915582/main_1.png main_1.png png 62016 849 656 IMAGE-WEB-PDF 1 1-s2.0-S1381116902000110-si7.gif https://s3.amazonaws.com/prod-ucs-content-store-us-east/content/pii:S1381116902000110/STRIPIN/image/gif/c12fdec8b0875299afc39e5c90ced97e/si7.gif https://s3-eu-west-1.amazonaws.com/prod-ucs-content-store-eu-west/content/pii:S1381116902000110/STRIPIN/image/gif/c12fdec8b0875299afc39e5c90ced97e/si7.gif si7 si7.gif gif 1074 17 239 ALTIMG 1-s2.0-S1381116902000110-si6.gif https://s3.amazonaws.com/prod-ucs-content-store-us-east/content/pii:S1381116902000110/STRIPIN/image/gif/2033c991babd3bd720642d8f7e7e23b8/si6.gif https://s3-eu-west-1.amazonaws.com/prod-ucs-content-store-eu-west/content/pii:S1381116902000110/STRIPIN/image/gif/2033c991babd3bd720642d8f7e7e23b8/si6.gif si6 si6.gif gif 1424 20 331 ALTIMG 1-s2.0-S1381116902000110-si5.gif https://s3.amazonaws.com/prod-ucs-content-store-us-east/content/pii:S1381116902000110/STRIPIN/image/gif/0be3cf1411c3263837d6f740583e5920/si5.gif https://s3-eu-west-1.amazonaws.com/prod-ucs-content-store-eu-west/content/pii:S1381116902000110/STRIPIN/image/gif/0be3cf1411c3263837d6f740583e5920/si5.gif si5 si5.gif gif 1291 20 319 ALTIMG 1-s2.0-S1381116902000110-si4.gif https://s3.amazonaws.com/prod-ucs-content-store-us-east/content/pii:S1381116902000110/STRIPIN/image/gif/b85fcf2a381faf195e26815b6ce4ec38/si4.gif https://s3-eu-west-1.amazonaws.com/prod-ucs-content-store-eu-west/content/pii:S1381116902000110/STRIPIN/image/gif/b85fcf2a381faf195e26815b6ce4ec38/si4.gif si4 si4.gif gif 1327 20 309 ALTIMG 1-s2.0-S1381116902000110-si3.gif https://s3.amazonaws.com/prod-ucs-content-store-us-east/content/pii:S1381116902000110/STRIPIN/image/gif/463e17c32c8bc28e2bfff0d2f804a4d4/si3.gif https://s3-eu-west-1.amazonaws.com/prod-ucs-content-store-eu-west/content/pii:S1381116902000110/STRIPIN/image/gif/463e17c32c8bc28e2bfff0d2f804a4d4/si3.gif si3 si3.gif gif 2240 1403 995 ALTIMG 1-s2.0-S1381116902000110-si2.gif https://s3.amazonaws.com/prod-ucs-content-store-us-east/content/pii:S1381116902000110/STRIPIN/image/gif/547c549472250ea95773d8a92ee86453/si2.gif https://s3-eu-west-1.amazonaws.com/prod-ucs-content-store-eu-west/content/pii:S1381116902000110/STRIPIN/image/gif/547c549472250ea95773d8a92ee86453/si2.gif si2 si2.gif gif 860 17 189 ALTIMG 1-s2.0-S1381116902000110-si1.gif https://s3.amazonaws.com/prod-ucs-content-store-us-east/content/pii:S1381116902000110/STRIPIN/image/gif/eaf1ec5266433d74a989b0e24c19e68a/si1.gif https://s3-eu-west-1.amazonaws.com/prod-ucs-content-store-eu-west/content/pii:S1381116902000110/STRIPIN/image/gif/eaf1ec5266433d74a989b0e24c19e68a/si1.gif si1 si1.gif gif 521 13 100 ALTIMG 1-s2.0-S1381116902000110-fx1.sml https://s3.amazonaws.com/prod-ucs-content-store-us-east/content/pii:S1381116902000110/fx1/THUMBNAIL/image/gif/2849502b8e901b5b77921746e1d6950b/fx1.sml https://s3-eu-west-1.amazonaws.com/prod-ucs-content-store-eu-west/content/pii:S1381116902000110/fx1/THUMBNAIL/image/gif/2849502b8e901b5b77921746e1d6950b/fx1.sml fx1 fx1.sml sml 702 27 125 IMAGE-THUMBNAIL 1-s2.0-S1381116902000110-fx1.gif https://s3.amazonaws.com/prod-ucs-content-store-us-east/content/pii:S1381116902000110/fx1/DOWNSAMPLED/image/gif/728e5d5b56f23f297fe0cdd2d81bb444/fx1.gif https://s3-eu-west-1.amazonaws.com/prod-ucs-content-store-eu-west/content/pii:S1381116902000110/fx1/DOWNSAMPLED/image/gif/728e5d5b56f23f297fe0cdd2d81bb444/fx1.gif fx1 fx1.gif gif 7031 132 606 IMAGE-DOWNSAMPLED 1-s2.0-S1381116902000110-gr1.sml https://s3.amazonaws.com/prod-ucs-content-store-us-east/content/pii:S1381116902000110/gr1/THUMBNAIL/image/gif/2252ce95ad409541c01b194150e1b2f9/gr1.sml https://s3-eu-west-1.amazonaws.com/prod-ucs-content-store-eu-west/content/pii:S1381116902000110/gr1/THUMBNAIL/image/gif/2252ce95ad409541c01b194150e1b2f9/gr1.sml gr1 gr1.sml sml 1464 92 54 IMAGE-THUMBNAIL 1-s2.0-S1381116902000110-gr1.jpg https://s3.amazonaws.com/prod-ucs-content-store-us-east/content/pii:S1381116902000110/gr1/DOWNSAMPLED/image/jpeg/17b6b2852e23f80f296d0dc08cb87b3d/gr1.jpg https://s3-eu-west-1.amazonaws.com/prod-ucs-content-store-eu-west/content/pii:S1381116902000110/gr1/DOWNSAMPLED/image/jpeg/17b6b2852e23f80f296d0dc08cb87b3d/gr1.jpg gr1 gr1.jpg jpg 73425 570 333 IMAGE-DOWNSAMPLED 1-s2.0-S1381116902000110-gr2.sml https://s3.amazonaws.com/prod-ucs-content-store-us-east/content/pii:S1381116902000110/gr2/THUMBNAIL/image/gif/9f89a6f6a2b9b1dfa9e9ecb8d54690e2/gr2.sml https://s3-eu-west-1.amazonaws.com/prod-ucs-content-store-eu-west/content/pii:S1381116902000110/gr2/THUMBNAIL/image/gif/9f89a6f6a2b9b1dfa9e9ecb8d54690e2/gr2.sml gr2 gr2.sml sml 1559 94 55 IMAGE-THUMBNAIL 1-s2.0-S1381116902000110-gr2.gif https://s3.amazonaws.com/prod-ucs-content-store-us-east/content/pii:S1381116902000110/gr2/DOWNSAMPLED/image/gif/d08640a3ee044d99d401f1ba47e700f7/gr2.gif https://s3-eu-west-1.amazonaws.com/prod-ucs-content-store-eu-west/content/pii:S1381116902000110/gr2/DOWNSAMPLED/image/gif/d08640a3ee044d99d401f1ba47e700f7/gr2.gif gr2 gr2.gif gif 17223 452 265 IMAGE-DOWNSAMPLED 1-s2.0-S1381116902000110-fx2.sml https://s3.amazonaws.com/prod-ucs-content-store-us-east/content/pii:S1381116902000110/fx2/THUMBNAIL/image/gif/c0ab36b6672340ab309c862d5af0c226/fx2.sml https://s3-eu-west-1.amazonaws.com/prod-ucs-content-store-eu-west/content/pii:S1381116902000110/fx2/THUMBNAIL/image/gif/c0ab36b6672340ab309c862d5af0c226/fx2.sml fx2 fx2.sml sml 378 13 125 IMAGE-THUMBNAIL 1-s2.0-S1381116902000110-fx2.gif https://s3.amazonaws.com/prod-ucs-content-store-us-east/content/pii:S1381116902000110/fx2/DOWNSAMPLED/image/gif/5a41420aea3ff702b39c4867337b6a65/fx2.gif https://s3-eu-west-1.amazonaws.com/prod-ucs-content-store-eu-west/content/pii:S1381116902000110/fx2/DOWNSAMPLED/image/gif/5a41420aea3ff702b39c4867337b6a65/fx2.gif fx2 fx2.gif gif 1791 46 426 IMAGE-DOWNSAMPLED 1-s2.0-S1381116902000110-gr3.sml https://s3.amazonaws.com/prod-ucs-content-store-us-east/content/pii:S1381116902000110/gr3/THUMBNAIL/image/gif/53e8e412dfe4c8573babb77f86b01827/gr3.sml https://s3-eu-west-1.amazonaws.com/prod-ucs-content-store-eu-west/content/pii:S1381116902000110/gr3/THUMBNAIL/image/gif/53e8e412dfe4c8573babb77f86b01827/gr3.sml gr3 gr3.sml sml 1665 93 90 IMAGE-THUMBNAIL 1-s2.0-S1381116902000110-gr3.gif https://s3.amazonaws.com/prod-ucs-content-store-us-east/content/pii:S1381116902000110/gr3/DOWNSAMPLED/image/gif/1bb665bad6a48d330a102df4b23cb672/gr3.gif https://s3-eu-west-1.amazonaws.com/prod-ucs-content-store-eu-west/content/pii:S1381116902000110/gr3/DOWNSAMPLED/image/gif/1bb665bad6a48d330a102df4b23cb672/gr3.gif gr3 gr3.gif gif 29958 678 657 IMAGE-DOWNSAMPLED 1-s2.0-S1381116902000110-gr4.sml https://s3.amazonaws.com/prod-ucs-content-store-us-east/content/pii:S1381116902000110/gr4/THUMBNAIL/image/gif/75a232e293c3e0b062271cf6361af278/gr4.sml https://s3-eu-west-1.amazonaws.com/prod-ucs-content-store-eu-west/content/pii:S1381116902000110/gr4/THUMBNAIL/image/gif/75a232e293c3e0b062271cf6361af278/gr4.sml gr4 gr4.sml sml 1048 93 53 IMAGE-THUMBNAIL 1-s2.0-S1381116902000110-gr4.gif https://s3.amazonaws.com/prod-ucs-content-store-us-east/content/pii:S1381116902000110/gr4/DOWNSAMPLED/image/gif/c0f8e1b4745a93ba155def559dba5643/gr4.gif https://s3-eu-west-1.amazonaws.com/prod-ucs-content-store-eu-west/content/pii:S1381116902000110/gr4/DOWNSAMPLED/image/gif/c0f8e1b4745a93ba155def559dba5643/gr4.gif gr4 gr4.gif gif 14701 597 339 IMAGE-DOWNSAMPLED MOLCAA 3529 S1381-1169(02)00011-0 10.1016/S1381-1169(02)00011-0 Elsevier Science B.V. Fig. 1 Liquid chromatograms for the products obtained from the reactions of bisphenol-A with DPC (A), BPA with CO/O2 (B) and BPA with phenol and CO/O2 (C). Fig. 2 Typical FT-IR spectra for the reactants and products. Authentic phenol (a), authentic BPA (b), authentic DPC (c), a typical product mixture of the reaction between BPA and DPC (d), that of the oxidative carbonylation of BPA alone (e), and that of the coupled oxidative carbonylation of BPA and phenol (f). Fig. 3 Dehydration effects on the coupled oxidative carbonylation of BPA and phenol. Pd(OAc)2, 0.06mmol; Ce(OAc)3H2O, 0.30mmol; benzoquinone, 1.50mmol; TBAB, 1.50mmol; THF, 30ml; BPA, 30mmol; phenol, 30mmol; CO pressure, 5MPa; O2 pressure, 0.5MPa; temperature, 373K; time, 4h; 3A molecular sieve used. Point alone denotes after 10h reaction. Fig. 4 Effects of the amount of phenol on the coupled oxidative carbonylation of BPA and phenol. Pd(OAc)2, 0.06mmol; Ce(OAc)3H2O, 0.30mmol; benzoquinone, 1.50mmol; TBAB, 1.50mmol; THF, 30ml; BPA, 30mmol; CO pressure, 5MPa; O2 pressure, 0.5MPa; temperature, 373K; time, 4h; 3A molecular sieve, 4g. Table 1 The effect of solvent on the coupled oxidative carbonylation of BPA and phenol a Run Solvent Conversion of BPA (%) Product distribution (wt.%) MpC/DH b MpC(1) MpC(2) DH(1) DH(2) n≥3 By-products 1 3-Pentanone 25.5 4.9 0 8.3 0 0 86.8 1.18 2 Methylene chloride 38.3 21.2 Trace 47.0 2.8 0 29.0 0.87 3 THF 45.2 22.3 3.1 53.6 6.9 0.9 13.2 0.82 4 Chlorobenzene 29.2 17.1 Trace 38.1 Trace 0 44.8 0.90 5 Anisole 24.6 21.0 Trace 52.7 Trace 0 26.3 0.80 6 Toluene 37.9 19.3 Trace 42.1 Trace 0 38.6 0.92 7 Benzene 26.8 15.5 Trace 43.0 Trace 0 41.5 0.72 8 Cyclohexane c 67.0 16.6 3.1 35.0 6.3 1.4 37.6 0.93 a Pd(OAc)2, 0.06mmol; Ce(OAc)3·H2O, 0.30mmol; benzoquinone, 1.50mmol; Bu4NBr, 1.50mmol; solvent, 30ml; BPA, 30mmol; phenol, 30mmol; CO pressure, 5MPa; O2 pressure, 0.5MPa; temperature, 373K; time, 4h. b The molar ratio of total MpC to total DH. c The values of products-rich phase from phase-separated products with solvent-rich phase after 4h reaction. Table 2 The effect of base (halide salt and mineral) on the coupled oxidative carbonylation of BPA and phenol a Run Base Conversion of BPA (%) Product distribution (wt.%) MpC/DH b MpC(1) MpC(2) DH(1) DH(2) n≥3 By-products 1 TBAB 45.2 22.3 3.1 53.6 6.9 0.9 13.2 0.82 2 TBAC 24.2 18.9 Trace 51.2 Trace 0 29.9 0.74 3 TBAI 46.0 4.4 0 4.0 0 0 91.9 2.20 4 TBPB 36.7 22.6 2.7 58.6 5.6 Trace 10.5 0.77 5 NaOAc·3H2O 36.1 4.1 0 10.0 0 0 85.9 0.82 6 K2CO3 25.8 4.2 0 5.7 0 0 90.1 1.47 a Pd(OAc)2, 0.06mmol; Ce(OAc)3·H2O, 0.30mmol; benzoquinone, 1.50mmol; base, 1.50mmol; THF, 30ml; BPA, 30mmol; phenol, 30mmol; CO pressure, 5MPa; O2 pressure, 0.5MPa; temperature, 373K; time, 4h. TBAB, tetrabutylammonium bromide; TBAC, tetrabutylammonium chloride; TBAI, tetrabutylammonium iodide; TBPB, tetrabutylphosphonium bromide. b The molar ratio of total MpC to total DH. Table 3 The effect of base (anmine compound as Lewis base) on the coupled oxidative carbonylation of BPA and phenol a Run Base pK a b Conversion of BPA (%) Product distribution (wt.%) MpC/DH c MpC(1) MpC(2) DH(1) DH(2) n≥3 By-products 1 BEMP >15 55.0 5.1 0 5.8 Trace 0 89.1 1.75 2 DBU 11.9 2.0 0 0 Trace 0 0 99+ – 3 TBA 10.9 11.9 12.4 0 28.2 Trace 0 59.4 0.88 4 TEA 10.75 21.6 15.2 Trace 39.5 Trace 0 45.3 0.77 5 TMED 9.15 25.7 9.8 0 20.2 Trace 0 70.0 0.97 6 DABCO 8.2 34.7 4.2 0 13.3 0 0 82.5 0.63 7 2,6-Lutidine 6.6 21.0 0 0 Trace 0 0 99+ – 8 Pyridine 5.2 21.2 0 0 Trace 0 0 99+ – a Pd(OAc)2, 0.06mmol; Ce(OAc)3·H2O, 0.30mmol; benzoquinone, 1.50mmol; base, 1.50mmol; THF, 30ml; BPA, 30mmol; phenol, 30mmol; CO pressure, 5MPa; O2 pressure, 0.5MPa; temperature, 373K; time, 4h. BEMP, 2-t-butylimino-2-diethylamino-1,3-dimethylperhydro-1,3,2-diazaphosphorine; DBU, 1,8-diazabicyclo[5,4,0] undec-7-ene; TBA, tributyl amine; TEA, triethyl amine; TMED, N,N,N′,N′-tetramethylethylene diamine; DABCO, 1,4-diazabicyclo[2,2,2] octane. b The pK a values were taken from [43]. c The molar ratio of total MpC to total DH. Table 4 The effect of organic co-catalysts on the coupled oxidative carbonylation of BPA and phenol a Run Organic co-catalyst (E o, in V) b Conversion of BPA (%) Product distribution (wt.%) MpC/DH c MpC(1) MpC(2) DH(1) DH(2) n≥3 By-products 1 1,4-Hydroquinone 34.6 22.2 2.3 56.8 5.2 Trace 13.5 0.77 2 1,4-Benzoquinone (0.699) 45.2 22.3 3.1 53.6 6.9 0.9 13.2 0.82 3 1,2-Naphthoquinone (0.56) 51.2 13.2 3.5 35.0 3.4 Trace 44.9 0.80 4 9,10-Anthraquinone (0.13) 44.7 13.4 1.7 40.1 3.5 Trace 41.3 0.67 5 Quinoline 27.3 12.2 Trace 29.4 Trace 0 58.4 0.83 a Pd(OAc)2, 0.06mmol; Ce(OAc)3·H2O, 0.30mmol; organic cocatalyst, 1.50mmol; TBAB, 1.50mmol; THF, 30ml; BPA, 30mmol; phenol, 30mmol; CO pressure, 5MPa; O2 pressure, 0.5MPa; temperature, 373K; time, 4h. b Reduction potential of quinones at 198K [44]. c The molar ratio of total MpC to total DH. Coupled oxidative carbonylation of bisphenol-A and phenol into phenylcarbonate-ended polycarbonate precursors over a homogeneous Pd–Ce redox catalyst Won Bae Kim a Kuang Ho Park b Jae Sung Lee a ∗ a Department of Chemical Engineering and School of Environmental Science and Engineering, Pohang University of Science and Technology (POSTECH), San 31 Hyoja-dong, Pohang 790-784, South Korea b Chemical Process and Catalysis Research Institute, LG Chemical Ltd., 104-1 Moonji-dong, Yusong-gu, Taejon 305-380, South Korea * Corresponding author. Tel.: +82-54-279-2266; fax: +82-54-279-5799 A coupled oxidative carbonylation of bisphenol-A and phenol was investigated using a redox catalytic system of palladium acetate and cerium acetate as a novel scheme for a direct synthesis of phenylcarbonate-ended polycarbonate precursors amenable to polycondensation in a current phosgene-free polycarbonate process. Reaction variables such as solvents, bases and organic co-catalysts were examined in our novel scheme. Removal of water co-produced with desired products and adjustment of the reactants molar ratio of phenol to bisphenol-A appeared to be most critical for highly selective formation of the desired phenylcarbonate-ended precursors in one-step. Keywords Polycarbonate precursor Phosgene-free synthesis Coupled carbonylation Bisphenol-A Phenol Pd–Ce redox catalyst 1 Introduction Polycarbonate has been produced by the interfacial polycondensation of bisphenol-A (BPA) and phosgene. The major drawbacks of the conventional phosgene process are environmental and safety problems involved in using highly toxic phosgene as the reagent and copious amounts of methylenechloride as the solvent [1,2]. For this reason, phosgene-free processes for polycarbonate have been proposed that employ BPA and diphenyl carbonate (DPC) with the latter synthesized also in a phosgene-free process [3–8]. Thus the current commercial phosgene-free process consists of prepolymerization of BPA and DPC into reactive polycarbonate precursors followed by polycondensation of the precursors using melt transesterification [9–15] or solid state polymerization [2]. Although well-developed into commercialization, the phosgene-free DPC process is a complicated one involving multiple reaction steps, some of which are under severe equilibrium constraints [3,5]. Therefore, there have been some efforts to develop a phosgene-free polycarbonate process without employing the expensive DPC as an intermediate. One such a route is a direct oxidative carbonylation of BPA into polycarbonate oligomers [16–21] in a similar manner employed for an oxidative carbonylation of phenol to DPC [22–39]. The oxidative carbonylation of BPA could be a promising method of phosgene-free polycarbonate synthesis because it converts CO and BPA directly to polycarbonate oligomers as prepolymers. The direct insertion of carbon monoxide to the para-position of BPA was reported two decades ago [16,17]. Recently, the successful syntheses of polycarbonate oligomers by the direct oxidative carbonylation of BPA have been reported with homogeneous Pd catalysts [18–21] which have been found effective through the extensive works in the direct synthesis of DPC from phenol and CO [22–39]. However, the oligomers produced from the oxidative carbonylation of BPA by reaction (1) are end-uncapped oligomers and those phenolic end groups made the polymers extremely unstable [13,40]. Due to their end group functionalities, the di-hydroxy-ended prepolymer (denoted as DH(n)) should require a multi-step processing of pressurized carbonylation [19] in order to obtain high molecular weight polycarbonate or additional functionalization of the DHs with DPC into phenylcarbonate-ended polycarbonate precursors [21] prior to polycondensation step. In the subsequent polycondensation step of current commercial phosgene-free polycarbonate process, mono-phenylcarbonate-ended oligomers (denoted as MpC(n), where n is the number of repeating unit) are precursors as prepolymer for obtaining high molecular weight polycarbonate. We discovered that addition of phenol into the reaction system of BPA carbonylation, resulted in a successful one-step synthesis of MpCs from CO [41] as shown in reaction (2). This reaction, to our best knowledge, has never been studied before and has a great practical implication in phosgene-free syntheses of polycarbonate. This coupled carbonylation of BPA and phenol involves two nucleophiles of phenoxy and bisphenoxy anions, and therefore it requires more controlled reaction conditions than the individual carbonylation of phenol or BPA. In this work, effects of catalytic reaction variables are investigated to elucidate the reaction characteristics of the novel reaction scheme with a homogeneous Pd acetate–Ce acetate redox system. 2 Experimental 2.1 Reaction procedures For the coupled oxidative carbonylation of BPA and phenol, the reaction system and procedure were employed as those generally used for the oxidative carbonylation of phenol [39]. Charged into a 100cm3 autoclave (Parr) were Pd acetate as a main catalyst, Ce acetate as an inorganic co-catalyst and a quinone as an organic co-catalyst to reoxidize reduced palladium and cerium, a base to activate phenols, a solvent, BPA and phenol. After purging the reactor with O2 three times, 5MPa of CO and 0.5MPa of O2 were charged successively and the reaction temperature was adjusted to 373K. The reaction was quenched after a desired reaction time by cooling the reactor with ice water. All chemicals were purchased from Aldrich. 2.2 Product analyses Reaction products were analyzed by high performance liquid chromatography (HPLC), gas chromatography (GC) and gas chromatography–mass spectrometer (GC–MS) in order to identify and quantify the polycarbonate precursors and by-products. We adopted the methods of Bailly et al. [42] and Kim et al. [13] in separation and identification of polycarbonate oligomers by HPLC under similar analysis conditions. The HPLC analyses were carried out by a reverse phase method on a Waters 2690 Separation Module equipped with an auto-sampler. As an UV detector, Waters 2487 Dual λ Absorbance detector was used at the wavelength of UV 240nm. The reverse phase LC column was Waters Lichrosorb®RP18 Analytical Column (5μm particle size, 4.6 mm×250 mm). A mobile phase flow rate of 1mlmin−1 was adjusted with a gradient mode of acetonitrile and water from 65:35 to isocratic of acetonitrile. The reaction samples were diluted to 50 times with acetonitrile and 5μl was injected by an automatic injector. The Millenium32 software was used for data reduction and integration. We have combined GC and GC–MS analyses with HPLC to identify and quantify UV-insensitive and/or light molecules such as phenol, DPC and by-products. HP 5890II gas chromatograph equipped with a flame ionization detector (FID) and a GC–MS of HP 5890-HP 5972 MSD were used. Products were separated by an HP PONA capillary column (50 m×0.2 mm×0.5 μm) for GC and GC–MS analyses. For the characterization of carbonate linkages of the polycarbonate precursors, FT-IR was performed on a Perkin Elmer 1800. The product solution after reaction was wetted on a thin KBr wafer and scanned from 500 to 4000cm−1 of infrared wavenumber. 3 Results and discussion 3.1 HPLC chromatograms and FT-IR analysis of the polycarbonate oligomers Fig. 1 shows typical HPLC spectra of polycarbonate oligomers which could be obtained from various reactions such as a melt-transesterification of BPA with DPC (A), an oxidative carbonylation of BPA alone (B) and the coupled oxidative carbonylation of both BPA and phenol (C) proposed here. We used the HPLC spectrum of the oligomer mixture of the Fig. 1A as our reference, which was prepared from a conventional melt-transesterification of BPA and DPC with K2CO3 catalyst, and compared it with the spectra of products obtained from our coupled oxidative carbonylation of BPA and phenol. As shown in Fig. 1A, there exist three kinds of oligomers with respect to their end group functionality. The oligomer with mono-phenylcarbonate-ended on one side and hydroxy (of phenolic)-ended on the other side was denoted as MpC(n) with n being the number of repeating unit of BPA carbonate. Di-hydroxy-ended oligomer on both sides and di-phenylcarbonate-ended oligomers were denoted as DH(n) and DpC(n), respectively. Fig. 1B shows polycarbonate oligomers of DH(n) and by-products obtained from the direct oxidative carbonylation of BPA alone. DHs were the sole type of products of polycarbonate precursors in this reaction while other types of precursors like MpCs were not produced. DHs with n up to 3 were detected together with some by-products. The by-products consisted of o,p-isomers of BPA and acetate-, salicylic acid- and o-phenylene carbonate-type ended derivatives of bisphenols as determined from analysis of GC–MS. The latter two were also reported as major by-products in the oxidative carbonylation of BPA alone [18,19]. Furthermore, bisphenol-F, brominated and phenoxy BPA were also found in trace amounts in some analyses. When additional phenol was introduced in the system of the oxidative carbonylation of BPA, the desired products of MpCs were synthesized successfully as presented in Fig. 1C. The DH type products were also present as in the case of the carbonylation of BPA alone, but the by-products were less in most cases as shown by the smaller HPLC peaks at ca. 11 and 5–7min of eluant times. In Fig. 2 , the polycarbonate precursors were analyzed by FT-IR including the authentic reactants. The spectrum (f) for the products of our coupled carbonylation of BPA and phenol showed a stronger stretching band at ca. 1774cm−1 attributed to the carbonyl of a linear carbonate which was also found in authentic DPC (c) than that for the carbonylation of BPA alone (e) under the same reaction condition except the presence of phenol. It could be attributed to additional existence of linear carbonate linkages in MpCs, compared with the reaction mixture of (e) which did not produce the MpCs. Under our optimized Pd(OAc)2–Ce(OAc)3 system, we rarely detected the band at the frequency of ca. 1836cm−1 due to cyclic carbonyl stretching in o-phenylene carbonate type BPA as reported in [18]. 3.2 The coupled oxidative carbonylation of BPA and phenol as a novel reaction scheme for polycarbonate oligomers The Pd(OAc)2–Ce(OAc)3 was found to be the best homogeneous redox catalytic system by us in synthesizing the DPC [39]. Therefore, we carried out some preliminary experiments for our new reaction (2) using Pd(OAc)2–Ce(OAc)3 as the catalytic redox system. In oxidative carbonylation of BPA alone, only DH type oligomers were formed with DH(1) dominating. Oxidative carbonylation of phenol itself gave DPC as expected. The reaction of BPA and DPC under our carbonylation condition resulted in the formation of MpCs while the formation of DHs was not seemingly influenced. In the coupled oxidative carbonylation of both BPA and phenol, a substantially greater amount of MpCs was formed for the same initial amount of BPA. The formation of DHs, however, was reduced. These results suggest that the in situ formation of DPC and subsequent transesterification of this DPC with BPA take place in the coupled oxidative carbonylation of BPA and phenol [41]. Compared to the oxidative carbonylation of BPA alone (reaction (1)), the conversion of BPA was not changed but the by-products were reduced significantly when phenol was introduced into the coupled oxidative carbonylation system with BPA. More importantly, MpC(n) was produced in an amount corresponding to a half the weight-selectivity of DH(n). The amounts of two products are similar in moles when equimolar amount of BPA and phenol are used. Thus the reaction (2) could be employed as a novel reaction scheme to produce reactive polycarbonate precursors although the DHs are produced as well in a large amount [41]. Our new catalytic system of the coupled oxidative carbonylation gives a few positive synergetic effects on the activities of BPA and phenol. It increases the turnover rates of both BPA and phenol conversions comparing to the individual oxidative carbonylation of BPA or phenol under the same reaction condition. Furthermore, a reduced amount of by-products is formed [41]. 3.3 Effect of solvent on the coupled oxidative carbonylation Methylene chloride is frequently used as a solvent in old phosgene-based and new phosgene-free polycarbonate synthesis processes. It is desired to replace it with other environmentally benign and more efficient solvents because it causes a serious environmental pollution as a volatile organic compound. Table 1 shows effect of various solvents on the coupled carbonylation of BPA and phenol. The solvents are sorted in descending order of their ‘dielectric constants’ which are compatible with their polarities. The solvent properties play an important role in solubility of reactants, products and catalyst systems. Also it changes the charge distribution in reactant molecules at the transition state by its polarity. The Table 1 did not show any consistent trend in activity and selectivity on our coupled carbonylation of BPA and phenol with respect to the magnitude of dielectric constants of the solvents tested. However, it is expected that solubility of reactants, CO, O2 and catalytic system in the solvents has contributed to the observed effect. There were significant differences in catalytic efficiency and product distribution in different solvents. Phenyl salicylate-ended BPA was a major by-product when tetrahydrofuran (THF) was used as solvent, but o-phenylene carbonate-ended and phenyl acetate-ended BPA were also included in the other solvents. The BPA conversion was highest with the least amount of by-products in THF except cyclohexane system which showed the highest BPA conversion, but mediocre MpC selectivity and phase-separation. THF showed the better activity and selectivity than the methylene chloride. Thus, hereafter THF is the solvent of our choice for the coupled oxidative carbonylation of BPA and phenol over Pd–Ce redox catalysts. Reactivity of THF itself under the catalytic system was not observed from GC–MS analysis of the reaction mixture after reaction. Also it dissolved the reactants and catalytic system completely, to make a homogeneous reaction system. 3.4 Effect of base on the coupled oxidative carbonylation For the individual oxidative carbonylation of phenol or BPA, a base is essential to produce phenoxy anions which could attack Pd complex as nucleophiles. Frequently-used bases are tertiary amines, pyridines, mineral bases, and quaternary ammonium halides. Quaternary ammonium halides were efficient for this system even with a small amount because they had a sufficient basicity to ionize the phenols and a low nucleophilicity to Pd complex. Also they might play a role of a ‘phase transfer catalyst’ in the system although this effect has not been fully established [22]. Reactivity of the carbonylation with these quarternary ammonium halides depended on the kinds of alkyl and halide [22,23]. Table 2 shows the effect of quaternary halide salts as bases on our system of the coupled oxidative carbonylation of BPA and phenol. The bases tested here are ionic compounds with ion-pair. We observed tetrabutylammonium bromide (TBAB) and tetrabutylphosphonium bromide (TBPB) gave the best result in BPA conversion and selectivity for oxidative carbonylation to MpC as well as DH with the least by-products formation in agreement with the oxidative carbonylation of phenol into DPC [36,37]. Tetrabutylammonium chloride (TBAC) showed a comparable selectivity to carbonylated products, but resulted in higher by-products formation and lower BPA conversions than TBAB and TBPB. However, mineral bases showed poor selectivity for MpC and DH because they produced enormous amounts of by-products consisting of o,p-isomers of BPA from isomerization of BPA. It might be attributed to their weaker basicity to activate bisphenol but that is still strong enough to isomerize BPA itself in our reaction conditions. A base with high basicity and low nucleophilicity is required for facile ionization of phenol to phenoxide ion while itself is not competing with phenoxide ion for nucleophillic attack toward the Pd complex [37]. Because of the presence of a non-bonding electron pair on nitrogen, amines are Lewis bases. Table 3 shows some Lewis bases of amine compounds with their basicity. Only the tertiary amines in the range of pK a 9–11 gave fairly good MpC selectivities. Note that phenols have a pK a value of ca. 10. The low and extremely high basicity showed poor selectivity to coupled carbonylation products. This could be explained by two factors. One is basicity of an appropriate strength to activate BPA and phenol simultaneously. The other is a geometric effect such that the bases should not hinder the electrostatic attraction between phenols and bases. Most non-selective bases produced enormous amounts of by-products including o,p-isomer of BPA as well as phenyl salicylate-, o-phenylene carbonate- and phenyl acetate-ended BPA. The different activity of bases having similar structure could be attributed to the difference in their basic strength, nucleophilicity toward Pd, steric hindrance, and stability under the reaction condition [37]. In our coupled carbonylation of BPA and phenol, TBAB or TBPB are effective to activate phenol and BPA simultaneously in agreement with results obtained in the oxidative carbonylation of phenol alone. The mineral bases and Lewis bases of amine compounds are not effective in the coupled oxidative carbonylation of BPA and phenol in spite of their basic strengths. 3.5 Effect of organic co-catalyst on the coupled oxidative carbonylation Quinones, which are readily produced by oxidation of dihydroxybenzenes, are easily reduced, forming again the dihydroxy derivatives. For example, the redox reaction between 1,4-benzoquinone (BQ) and 1,4-hydroquinone (HQ) is reversible as follows [44]. (3) The electrical potential of this cell reaction is given by the Nernst equation at 25°C and depends on acidity of reaction media and molar concentrations of BQ and HQ [44]. A role of quinones in our system is to assist the oxidation of reduced Pd and/or Ce during the catalytic cycle through electron transfer like the reaction (3). Of course Ce acetate is also able to oxidize the Pd, but Ce alone without organic cocatalysts such as benzoquinone is not sufficient to oxidize the reduced Pd fast enough into active Pd species to sustain redox cycle of Pd without deactivation. Table 4 showed the effects of quinones as electron transfer agents to accelerate the redox cycle of Pd–Ce in our reaction condition. We observed that benzoquinone was the best organic cocatalyst with the highest activity and the least formation of by-products. Hydroquinone also showed a good selectivity but a lower BPA conversion than benzoquinone. The quinones having a heterocyclic structure seemed to promote the side reactions although BPA conversions were not significantly different from that with BQ. Goyal et al. [37] suggested that the organic co-catalyst helped mostly the reoxidation of reduced Cu that was formed during the reoxidation of reduced Pd. They reported that hydroquinone and benzoquinone were best among other quinones due to their strong oxidation potential and less steric hindrance in the oxidative carbonylation of phenol alone. As a mechanism of Pd reoxidation by an organic cocatalyst, Vavasori and Toniolo [36] and Grennberg et al. [45] suggested a direct oxidation of Pd0 by combining with benzoquinone as a ligand to form a Pd0-benzoquinone complex, which was subject to a redox scheme to form Pd+2 and hydroquinone. 3.6 Effect of dehydration on the coupled oxidative carbonylation A dehydrating agent such as molecular sieves could shift the chemical equilibrium of BPA and phenol conversions in the forward reaction by removing water co-produced with the oxidative carbonylation products. We investigated how removal of the water from the reaction mixture would affect our coupled oxidative carbonylation, especially with respect to the selective formation of the desired MpCs. The molecular sieve 3A was activated with a flow of air at 400°C for 4h and stored in an oven at 120°C. We added the molecular sieve into the reactor without exposure to the atmosphere. When up to 4g of an activated 3A molecular sieve was introduced into the reaction system, the conversions were linearly increased by 20% more for BPA and 10% more for phenol compared to the case without the molecular sieve as shown in Fig. 3 A. The mole ratio of total MpC to total DH was also increased from 0.81 to 1.10, indicating the forward shifting of equilibrium by removing water molecules from the reaction system promoted more the formation of MpC than that of DH. However insignificant increases of the reaction rates and a small change of the products distribution was observed with more than 4g of the dehydrating agent. This might be caused by a kinetic limitation, because the conversion of BPA and the ratio of MpC/DH increased up to 72% and 1.20, respectively, after an extended reaction time of 10h. The selectivity of MpC(1) remained almost invariant with the molecular sieve loadings, but the DH(1) selectivity was decreased. The formation of heavier oligomers of n≥2 was slightly increased. Also, the amount of by-products was reduced significantly from 13 to 7%. The amount of by-products derived from phenol reaction was also reduced or remained invariant compared to the case without the molecular sieves. From the pattern of products profile in Fig. 3C, it could be observed that the increase in phenol conversion results in increased formation of MpC(1). Removing co-produced H2O demonstrated the positive effects on our coupled oxidative carbonylation; BPA conversion and selectivity for the desired MpCs increased while selectivities for undesired DHs and by-products decreased. 3.7 Effect of molar ratio of phenol to bisphenol-A The reactant molar ratio of phenol to BPA (PhOH/BPA) is a critical variable to control the selective formation of MpCs. The effect of PhOH/BPA was investigated in a range of 0.01–2.0 for a fixed amount of BPA (30mmol) on our coupled oxidative carbonylation with the chosen system of Pd acetate–Ce acetate–benzoquinone–Bu4NBr–THF. As shown in Fig. 4 , conversion of BPA increased for PhOH/BPA values of up to 1.0 and then decreased for higher ratios. The decrease might be caused by competition of phenol with BPA for the fixed amount of catalyst sites in the system. However, note that the value of MpC/DH increased almost linearly up to 1.8 as PhOH/BPA increased. Thus, as more phenol is introduced, formation of MpCs is more favored over the formation of DHs and by-products as shown in Fig. 4B. In the coupled oxidative carbonylation of BPA and phenol, there are four kinds reactions occurring simultaneously [41]. (4-1) BPA+CO+ 1 2 O 2+BPA⇌DH(1)+H 2 O (4-2) PhOH+CO+ 1 2 O 2+PhOH⇌DPC+H 2 O (4-3) BPA+CO+ 1 2 O 2+PhOH⇌MpC(1)+H 2 O (4-4) BPA+DPC⇌MpC(1)+PhOH Reactions (4-1) and (4-2) are the individual oxidative carbonylations of BPA and phenol respectively that are well known to occur with Pd redox catalytic systems. However, in our coupled oxidative carbonylation of BPA and phenol, the dual nucleophilic attacks of bisphenoxy and phenoxy ions are probable in a single catalytic cycle of Pd, that leads to the phenoxy-carbonylation of BPA with phenol and CO as presented in the reaction (4-3). The reaction (4-4) is the transesterification of BPA and DPC produced in situ in the reaction (4-2) and is the main source of MpCs in our reaction system [41]. Increased amounts of phenol would drive the reactions (4-2)–(4-4) in the forward direction although the effect is partly neutralized for reaction (4-4) because its reverse reaction is also promoted by excess phenol. Oxidative carbonylation of phenol should be more difficult than that of BPA in terms of their equilibrium conversions. Therefore an excess amount of phenol is essential to obtain the desired MpCs selectively with least formation of DHs under our coupled oxidative carbonylation condition. However, in the reaction stoichiometry, only one mole of phenol would be sufficient for n moles of initial BPA, with n being repeating unit of MpC type oligomers, if the complete conversion of BPA is achieved. 4 Conclusions A novel coupled oxidative carbonylation of bisphenol-A and phenol was proposed as a one-step reaction to synthesize the polycarbonate precursors of phenylcarbonate-ended bisphenol-A oligomers. The catalytic activity and selectivity to the desired precursors were significantly affected by reaction variables such as solvent, base, organic cocatalyst under the homogeneous catalytic redox system of palladium acetate and cerium acetate. The most efficient catalytic reaction system consisted of THF as a solvent, TBAB as a base, and benzoquinone as an organic cocatalyst. In our coupled oxidative carbonylation of bisphenol-A and phenol, the phenylcarbonate-ended precursors were synthesized via a transesterification of bisphenol-A and DPC produced in situ from the oxidative carbonylation of phenol. Removal of co-produced water and adjusting the molar feed ratio of phenol to bisphenol-A appeared to be most critical variables to increase the conversion of bisphenol-A as well as to achieve the highly selective formation of the desired polycarbonate precursors. Acknowledgements This research has been supported by LG Chem. Ltd. through the BK 21 Program and the Research Center for Catalytic Technology (RCCT) of Pohang University of Science and Technology (POSTECH). References [1] S.K. Sikdar, CHEMTECH, February 1987, p. 112. [2] K. Komiya, S. Fukuoka, M. Aminaka, K. Hasegawa, H. Hachiya, H. Okamoto, T. Watanabe, H. Yoneda, I. Fukawa, T. Dozono, in: P.T. Anastas, T.C. Williamson (Eds.), Green Chemistry: Designing Chemistry for the Environment, ACS, Washington, 1996, p. 20. [3] P. Tundo F. Trotta G. Moraglio F. Ligorati Ind. Eng. Chem. Res. 27 1988 1565 [4] Z.-H. Fu Y. Ono J. Mol. Catal. A 118 1997 293 [5] W.B. Kim J.S. Lee Catal. Lett. 59 1999 83 [6] W.B. Kim J.S. Lee J. Catal. 185 1999 307 [7] W.B. Kim Y.G. Kim J.S. Lee Appl. Catal. A 194–195 2000 403 [8] G.E. Harrison, A.J. Dennis, M. Sharif, US Patent 5426207 (1995), to Davy R&D. [9] I.P. Losev O.V. Smirnova Y.V. Smurova Polym. Sci. USSR 5 1963 662 [10] U. Curtius, L. Bottoenbruch, H. Schnell, US Patent 3442854 (1969), to Bayer AG. [11] E. Turska A.M. Wrobel Polymer 11 1970 415 [12] H. Yamana, T. Kuni, T. Furusawa, H. Nakai, Y. Hiro, US Patent 3888826 (1975), to Mitsubishi Gas Chem. [13] Y. Kim K.Y. Choi T.A. Chamberlin Ind. Eng. Chem. Res. 31 1992 2118 [14] T. Yamamoto, Y. Oshino, Y. Fukuda, T. Kanno, T. Kuwana, US Patent 5418314 (1995), to Daicel Chemical. [15] M. Yokoyama, K. Takakura, J. Takano, US Patent 5391691 (1995), to Mitsubishi Petrochemical. [16] J.E. Hallgren, US Patent 4201721 (1980), to General Electric. [17] A.J. Chalk, US Patent 4187242 (1980), to General Electric. [18] M. Goyal R. Nagahata J. Sugiyama M. Asai M. Ueda K. Takeuchi Polymer 40 1999 3237 [19] M. Goyal R. Nagahata J. Sugiyama M. Asai M. Ueda K. Takeuchi Polymer 41 2000 2289 [20] H. Ishii M. Goyal M. Ueda K. Takeuchi M. Asai Macromol. Rapid Commun. 22 2001 376 [21] R.V. Chaudhari, A.A. Kelkar, S.P. Gupte, B.M. Ghanage, M.S. Qureshi, B. Moasser, E.J. Pressman, S. Sivaram, C.V. Avadhari, S. Kanagasabapathy, US Patent 6222002 (2001), to General Electric. [22] J.E. Hallgren R.O. Mathews J. Orgnometal. Chem. 175 1979 135 [23] J.E. Hallgren G.M. Lucas R.O. Mathews J. Organometal. Chem. 204 1981 135 [24] D.A. Bolon, T.B. Gorczyca, J.E. Hallgren, US Patent 4533504 (1985), to General Electric. [25] T.C.-T. Chang, General Electric, EP 0350697 A2 (1990). [26] R.P. Joyce, J.A. King, E.J. Pressman, US Patent 5231210 (1993), to General Electric. [27] A. Heumann K.J. Jens M. Reglier Prog. Inorg. Chem. 42 1994 542 [28] H. Kezuka, F. Okuda, US Patent 5336803 (1994), to Idemitsu Kosan. [29] M. Mizukami, K. Hayashi, K. Iura, T. Kawaki, US Patent 5380907 (1995), to Mitsubishi Gas Chem. [30] J.A. King, P.D. Mackenzie, E.J. Pressman, US Patent 5399734 (1995), to General Electric. [31] H. Iwane, H. Miyagi, S. Imada, S. Seo, T. Yoneyama, Mitsubishi Chem., US Patent 5543547 (1996). [32] H.-J. Buysch, C. Hesse, J. Rechner, R. Schomacker, P. Wagner, D. Kaufmann, US Patent 5498742 (1996), to Bayer AG. [33] I.I. Moiseev M.N. Vargaftik T.V. Chernysheva T.A. Stromnova A.E. Gekhman G.A. Tsirkov A.M. Makhlina J. Mol. Catal. A 108 1996 77 [34] M. Takagi H. Miyagi T. Yoneyama Y. Ohgomori J. Mol. Catal. A 129 1998 L1 [35] M. Takagi, K. Kujira, T. Yoneyama, Y. Ohgomori, US Patent 5726340 (1998), to Mitsubishi Chem. [36] A. Vavasori L. Toniolo J. Mol. Catal. A 139 1999 109 [37] M. Goyal R. Nagahata J. Sugiyama M. Asai M. Ueda K. Takeuchi J. Mol. Catal. A 137 1999 147 [38] H. Ishii M. Goyal M. Ueda K. Takeuchi M. Asai J. Mol. Catal. A 148 1999 289 [39] H.Y. Song E.D. Park J.S. Lee J. Mol. Catal. A 154 2000 243 [40] C.O. Mork D.B. Priddy J. Appl. Polym. Sci. 45 1992 435 [41] W.B. Kim, J.S. Lee, Chem. Lett, Oct. 2001, p. 1044. [42] C. Bailly D. Daoust R. Legras J.P. Mercier M. de Valck Polymer 27 1986 776 [43] Y. Kubota K. Takeuchi T. Hanaoka Y. Sugi Catal. Today 31 1996 27 [44] A. Streitwieser, C.H. Heathcock, E.M. Kosower, Introduction to Organic Chemistry, Macmillan, New York, 1992, p. 1035. [45] H. Grennberg A. Gogoll J.-E. Backvall Organometallics 12 1993 1790",
      "scopus-id": "0037124938",
      "coredata": {
        "eid": "1-s2.0-S1381116902000110",
        "dc:description": "A coupled oxidative carbonylation of bisphenol-A and phenol was investigated using a redox catalytic system of palladium acetate and cerium acetate as a novel scheme for a direct synthesis of phenylcarbonate-ended polycarbonate precursors amenable to polycondensation in a current phosgene-free polycarbonate process. Reaction variables such as solvents, bases and organic co-catalysts were examined in our novel scheme. Removal of water co-produced with desired products and adjustment of the reactants molar ratio of phenol to bisphenol-A appeared to be most critical for highly selective formation of the desired phenylcarbonate-ended precursors in one-step.",
        "openArchiveArticle": "false",
        "prism:coverDate": "2002-06-17",
        "openaccessUserLicense": null,
        "prism:aggregationType": "Journal",
        "prism:url": "https://api.elsevier.com/content/article/pii/S1381116902000110",
        "dc:creator": [
          {
            "@_fa": "true",
            "$": "Kim, Won Bae"
          },
          {
            "@_fa": "true",
            "$": "Park, Kuang Ho"
          },
          {
            "@_fa": "true",
            "$": "Lee, Jae Sung"
          }
        ],
        "link": [
          {
            "@_fa": "true",
            "@rel": "self",
            "@href": "https://api.elsevier.com/content/article/pii/S1381116902000110"
          },
          {
            "@_fa": "true",
            "@rel": "scidir",
            "@href": "https://www.sciencedirect.com/science/article/pii/S1381116902000110"
          }
        ],
        "dc:format": "application/json",
        "openaccessType": null,
        "pii": "S1381-1169(02)00011-0",
        "prism:volume": "184",
        "prism:publisher": "Elsevier Science B.V.",
        "dc:title": "Coupled oxidative carbonylation of bisphenol-A and phenol into phenylcarbonate-ended polycarbonate precursors over a homogeneous Pd–Ce redox catalyst",
        "prism:copyright": "Copyright © 2002 Elsevier Science B.V. All rights reserved.",
        "openaccess": "0",
        "prism:issn": "13811169",
        "prism:issueIdentifier": "1-2",
        "dcterms:subject": [
          {
            "@_fa": "true",
            "$": "Polycarbonate precursor"
          },
          {
            "@_fa": "true",
            "$": "Phosgene-free synthesis"
          },
          {
            "@_fa": "true",
            "$": "Coupled carbonylation"
          },
          {
            "@_fa": "true",
            "$": "Bisphenol-A"
          },
          {
            "@_fa": "true",
            "$": "Phenol"
          },
          {
            "@_fa": "true",
            "$": "Pd–Ce redox catalyst"
          }
        ],
        "openaccessArticle": "false",
        "prism:publicationName": "Journal of Molecular Catalysis A: Chemical",
        "prism:number": "1-2",
        "openaccessSponsorType": null,
        "prism:pageRange": "39-49",
        "prism:endingPage": "49",
        "pubType": "fla",
        "prism:coverDisplayDate": "17 June 2002",
        "prism:doi": "10.1016/S1381-1169(02)00011-0",
        "prism:startingPage": "39",
        "dc:identifier": "doi:10.1016/S1381-1169(02)00011-0",
        "openaccessSponsorName": null
      },
      "objects": {
        "object": [
          {
            "@category": "thumbnail",
            "@height": "17",
            "@width": "239",
            "@_fa": "true",
            "$": "https://api.elsevier.com/content/object/eid/1-s2.0-S1381116902000110-si7.gif?httpAccept=%2A%2F%2A",
            "@multimediatype": "GIF image file",
            "@type": "ALTIMG",
            "@size": "1074",
            "@ref": "si7",
            "@mimetype": "image/gif"
          },
          {
            "@category": "thumbnail",
            "@height": "20",
            "@width": "331",
            "@_fa": "true",
            "$": "https://api.elsevier.com/content/object/eid/1-s2.0-S1381116902000110-si6.gif?httpAccept=%2A%2F%2A",
            "@multimediatype": "GIF image file",
            "@type": "ALTIMG",
            "@size": "1424",
            "@ref": "si6",
            "@mimetype": "image/gif"
          },
          {
            "@category": "thumbnail",
            "@height": "20",
            "@width": "319",
            "@_fa": "true",
            "$": "https://api.elsevier.com/content/object/eid/1-s2.0-S1381116902000110-si5.gif?httpAccept=%2A%2F%2A",
            "@multimediatype": "GIF image file",
            "@type": "ALTIMG",
            "@size": "1291",
            "@ref": "si5",
            "@mimetype": "image/gif"
          },
          {
            "@category": "thumbnail",
            "@height": "20",
            "@width": "309",
            "@_fa": "true",
            "$": "https://api.elsevier.com/content/object/eid/1-s2.0-S1381116902000110-si4.gif?httpAccept=%2A%2F%2A",
            "@multimediatype": "GIF image file",
            "@type": "ALTIMG",
            "@size": "1327",
            "@ref": "si4",
            "@mimetype": "image/gif"
          },
          {
            "@category": "thumbnail",
            "@height": "1403",
            "@width": "995",
            "@_fa": "true",
            "$": "https://api.elsevier.com/content/object/eid/1-s2.0-S1381116902000110-si3.gif?httpAccept=%2A%2F%2A",
            "@multimediatype": "GIF image file",
            "@type": "ALTIMG",
            "@size": "2240",
            "@ref": "si3",
            "@mimetype": "image/gif"
          },
          {
            "@category": "thumbnail",
            "@height": "17",
            "@width": "189",
            "@_fa": "true",
            "$": "https://api.elsevier.com/content/object/eid/1-s2.0-S1381116902000110-si2.gif?httpAccept=%2A%2F%2A",
            "@multimediatype": "GIF image file",
            "@type": "ALTIMG",
            "@size": "860",
            "@ref": "si2",
            "@mimetype": "image/gif"
          },
          {
            "@category": "thumbnail",
            "@height": "13",
            "@width": "100",
            "@_fa": "true",
            "$": "https://api.elsevier.com/content/object/eid/1-s2.0-S1381116902000110-si1.gif?httpAccept=%2A%2F%2A",
            "@multimediatype": "GIF image file",
            "@type": "ALTIMG",
            "@size": "521",
            "@ref": "si1",
            "@mimetype": "image/gif"
          },
          {
            "@category": "thumbnail",
            "@height": "27",
            "@width": "125",
            "@_fa": "true",
            "$": "https://api.elsevier.com/content/object/eid/1-s2.0-S1381116902000110-fx1.sml?httpAccept=%2A%2F%2A",
            "@multimediatype": "GIF image file",
            "@type": "IMAGE-THUMBNAIL",
            "@size": "702",
            "@ref": "fx1",
            "@mimetype": "image/gif"
          },
          {
            "@category": "standard",
            "@height": "132",
            "@width": "606",
            "@_fa": "true",
            "$": "https://api.elsevier.com/content/object/eid/1-s2.0-S1381116902000110-fx1.gif?httpAccept=%2A%2F%2A",
            "@multimediatype": "GIF image file",
            "@type": "IMAGE-DOWNSAMPLED",
            "@size": "7031",
            "@ref": "fx1",
            "@mimetype": "image/gif"
          },
          {
            "@category": "thumbnail",
            "@height": "92",
            "@width": "54",
            "@_fa": "true",
            "$": "https://api.elsevier.com/content/object/eid/1-s2.0-S1381116902000110-gr1.sml?httpAccept=%2A%2F%2A",
            "@multimediatype": "GIF image file",
            "@type": "IMAGE-THUMBNAIL",
            "@size": "1464",
            "@ref": "gr1",
            "@mimetype": "image/gif"
          },
          {
            "@category": "standard",
            "@height": "570",
            "@width": "333",
            "@_fa": "true",
            "$": "https://api.elsevier.com/content/object/eid/1-s2.0-S1381116902000110-gr1.jpg?httpAccept=%2A%2F%2A",
            "@multimediatype": "JPEG image file",
            "@type": "IMAGE-DOWNSAMPLED",
            "@size": "73425",
            "@ref": "gr1",
            "@mimetype": "image/jpeg"
          },
          {
            "@category": "thumbnail",
            "@height": "94",
            "@width": "55",
            "@_fa": "true",
            "$": "https://api.elsevier.com/content/object/eid/1-s2.0-S1381116902000110-gr2.sml?httpAccept=%2A%2F%2A",
            "@multimediatype": "GIF image file",
            "@type": "IMAGE-THUMBNAIL",
            "@size": "1559",
            "@ref": "gr2",
            "@mimetype": "image/gif"
          },
          {
            "@category": "standard",
            "@height": "452",
            "@width": "265",
            "@_fa": "true",
            "$": "https://api.elsevier.com/content/object/eid/1-s2.0-S1381116902000110-gr2.gif?httpAccept=%2A%2F%2A",
            "@multimediatype": "GIF image file",
            "@type": "IMAGE-DOWNSAMPLED",
            "@size": "17223",
            "@ref": "gr2",
            "@mimetype": "image/gif"
          },
          {
            "@category": "thumbnail",
            "@height": "13",
            "@width": "125",
            "@_fa": "true",
            "$": "https://api.elsevier.com/content/object/eid/1-s2.0-S1381116902000110-fx2.sml?httpAccept=%2A%2F%2A",
            "@multimediatype": "GIF image file",
            "@type": "IMAGE-THUMBNAIL",
            "@size": "378",
            "@ref": "fx2",
            "@mimetype": "image/gif"
          },
          {
            "@category": "standard",
            "@height": "46",
            "@width": "426",
            "@_fa": "true",
            "$": "https://api.elsevier.com/content/object/eid/1-s2.0-S1381116902000110-fx2.gif?httpAccept=%2A%2F%2A",
            "@multimediatype": "GIF image file",
            "@type": "IMAGE-DOWNSAMPLED",
            "@size": "1791",
            "@ref": "fx2",
            "@mimetype": "image/gif"
          },
          {
            "@category": "thumbnail",
            "@height": "93",
            "@width": "90",
            "@_fa": "true",
            "$": "https://api.elsevier.com/content/object/eid/1-s2.0-S1381116902000110-gr3.sml?httpAccept=%2A%2F%2A",
            "@multimediatype": "GIF image file",
            "@type": "IMAGE-THUMBNAIL",
            "@size": "1665",
            "@ref": "gr3",
            "@mimetype": "image/gif"
          },
          {
            "@category": "standard",
            "@height": "678",
            "@width": "657",
            "@_fa": "true",
            "$": "https://api.elsevier.com/content/object/eid/1-s2.0-S1381116902000110-gr3.gif?httpAccept=%2A%2F%2A",
            "@multimediatype": "GIF image file",
            "@type": "IMAGE-DOWNSAMPLED",
            "@size": "29958",
            "@ref": "gr3",
            "@mimetype": "image/gif"
          },
          {
            "@category": "thumbnail",
            "@height": "93",
            "@width": "53",
            "@_fa": "true",
            "$": "https://api.elsevier.com/content/object/eid/1-s2.0-S1381116902000110-gr4.sml?httpAccept=%2A%2F%2A",
            "@multimediatype": "GIF image file",
            "@type": "IMAGE-THUMBNAIL",
            "@size": "1048",
            "@ref": "gr4",
            "@mimetype": "image/gif"
          },
          {
            "@category": "standard",
            "@height": "597",
            "@width": "339",
            "@_fa": "true",
            "$": "https://api.elsevier.com/content/object/eid/1-s2.0-S1381116902000110-gr4.gif?httpAccept=%2A%2F%2A",
            "@multimediatype": "GIF image file",
            "@type": "IMAGE-DOWNSAMPLED",
            "@size": "14701",
            "@ref": "gr4",
            "@mimetype": "image/gif"
          }
        ]
      },
      "link": {
        "@rel": "abstract",
        "@href": "https://api.elsevier.com/content/abstract/scopus_id/0037124938"
      }
    }
  }
}