{
  "metadata": {
    "title": "The molecular approach to supported catalysts synthesis: state of the art and future challenges",
    "authors": "; ",
    "journal": "Journal of Molecular Catalysis A: Chemical",
    "date": "2000-11-20",
    "doi": "10.1016/S1381-1169(00)00318-6",
    "abstract": "",
    "uri": "https://api.elsevier.com/content/article/pii/S1381116900003186",
    "pii": "S1381116900003186"
  },
  "fulltext": {
    "full-text-retrieval-response": {
      "scopus-eid": "2-s2.0-0034693692",
      "originalText": "serial JL 271358 291210 291744 291790 291809 31 Journal of Molecular Catalysis A: Chemical JOURNALMOLECULARCATALYSISACHEMICAL 2000-10-26 2000-10-26 2010-04-18T20:21:34 1-s2.0-S1381116900003186 S1381-1169(00)00318-6 S1381116900003186 10.1016/S1381-1169(00)00318-6 S300 S300.1 FULL-TEXT 1-s2.0-S1381116900X01276 2015-05-15T05:55:31.049811-04:00 0 0 20001120 2000 2000-10-26T00:00:00Z articleinfo crossmark dco dateupdated tomb dateloaded datesearch indexeddate issuelist volumelist yearnav articletitlenorm authfirstinitialnorm authfirstsurnamenorm cid cids confabbr confeditor contenttype copyright dateloadedtxt docsubtype doctype doi eid ewtransactionid hubeid issfirst issn issnnorm itemstage itemtransactionid itemweight openaccess openarchive pg pgfirst pglast pii piinorm pubdatestart pubdatetxt pubyr sortorder srctitle srctitlenorm srctype subheadings vol volfirst volissue webpdf webpdfpagecount figure body affil articletitle auth authfirstini authfull authkeywords authlast footnotes primabst ref alllist content subj ssids 1381-1169 13811169 162 162 1 2 1 2 Volume 162, Issues 1–2 2 5 18 5 18 20001120 20 November 2000 2000-11-20 2000 In honour of Prof. H. Knozinger on the occasion of his 65th Knozinger S.I. G. Mestl converted-article fla Copyright © 2000 Elsevier Science B.V. All rights reserved. MOLECULARAPPROACHSUPPORTEDCATALYSTSSYNTHESISSTATEARTFUTURECHALLENGES LAMBERT J 1 Introduction 2 The structure of support oxide surfaces: the example of γ-alumina 3 Transition metal speciation in precursor solution 4 A quick review of TMC/oxide support adsorption mechanisms 4.1 Metal adsorption: strong versus weak, or specific versus non-specific? 4.2 Identification of surface sites in site adsorption mechanisms 5 Slow reactions that alter metal speciation at the interface 6 Is it worth the trouble? Memory effects in further steps of catalysts synthesis 7 Conclusion References MORTERRA 1996 497 C DECANIO 1994 76 E KNOZINGER 1978 31 H TSYGANENKO 1996 4843 A BUSCA 1991 167 G PERI 1965 220 J RELLER 1989 91 A ALVAREZ 1998 1725 L MORTERRA 1994 1812 C COSTER 1994 6201 D YEGANEH 1999 1179 M HACHIYA 1984 23 K OKAMOTO 1988 7102 Y SOHLBERG 1999 10999 K BERGAOUI 1999 2897 L SHELIMOV 1999 545 B PREETZ 1996 977 W CHE 1988 1369 M CHE 1993 31 M LEPETIT 1996 147 C LAMBERT 1997 91 J BRUNELLE 1978 1211 J SPANOS 1990 301 N KARAKONSTANTIS 1992 1318 L KARAKONSTANTIS 1996 295 L KARAKONSTANTIS 1996 306 L MANG 1993 239 T SPIELBAUER 1993 460 D OHMINE 1999 741 I LEMIEUX 1996 373 R FOKKINK 1990 118 L BARGAR 1996 3541 J LAMBERT 1997 10347 J SHELIMOV 1999 462 B BERGAOUI 1995 2155 L TOWLE 1999 312 S CLAUSE 1992 4709 O KERMAREC 1994 12008 M CARRIER 1997 10137 X CARRIER 1999 311 X BROWN 1999 77 G SHELIMOV 2000 91 B LAMBERT 2000 1043 J SCHEITHAUER 1998 3019 M LAMBERTX2000X5 LAMBERTX2000X5X18 LAMBERTX2000X5XJ LAMBERTX2000X5X18XJ item S1381-1169(00)00318-6 S1381116900003186 1-s2.0-S1381116900003186 10.1016/S1381-1169(00)00318-6 271358 2010-09-30T18:13:07.652819-04:00 2000-11-20 1-s2.0-S1381116900003186-main.pdf https://s3.amazonaws.com/prod-ucs-content-store-us-east/content/pii:S1381116900003186/MAIN/application/pdf/058f6baf3b056c8cd1280bc44bd18a82/main.pdf https://s3-eu-west-1.amazonaws.com/prod-ucs-content-store-eu-west/content/pii:S1381116900003186/MAIN/application/pdf/058f6baf3b056c8cd1280bc44bd18a82/main.pdf main.pdf pdf true 654608 MAIN 14 1-s2.0-S1381116900003186-main_1.png https://s3.amazonaws.com/prod-ucs-content-store-us-east/content/pii:S1381116900003186/PREVIEW/image/png/98ec443e3394f9c48a5870fc98bcd926/main_1.png https://s3-eu-west-1.amazonaws.com/prod-ucs-content-store-eu-west/content/pii:S1381116900003186/PREVIEW/image/png/98ec443e3394f9c48a5870fc98bcd926/main_1.png main_1.png png 58943 849 656 IMAGE-WEB-PDF 1 1-s2.0-S1381116900003186-si9.gif https://s3.amazonaws.com/prod-ucs-content-store-us-east/content/pii:S1381116900003186/STRIPIN/image/gif/14060e474362f653d770c4f177623302/si9.gif https://s3-eu-west-1.amazonaws.com/prod-ucs-content-store-eu-west/content/pii:S1381116900003186/STRIPIN/image/gif/14060e474362f653d770c4f177623302/si9.gif si9 si9.gif gif 281 15 39 ALTIMG 1-s2.0-S1381116900003186-si8.gif https://s3.amazonaws.com/prod-ucs-content-store-us-east/content/pii:S1381116900003186/STRIPIN/image/gif/4e31f5e1fc267f2f782bd756a33ef535/si8.gif https://s3-eu-west-1.amazonaws.com/prod-ucs-content-store-eu-west/content/pii:S1381116900003186/STRIPIN/image/gif/4e31f5e1fc267f2f782bd756a33ef535/si8.gif si8 si8.gif gif 1512 21 327 ALTIMG 1-s2.0-S1381116900003186-si7.gif https://s3.amazonaws.com/prod-ucs-content-store-us-east/content/pii:S1381116900003186/STRIPIN/image/gif/6082d80e4cd4ad2cdddec5dbefd6cda0/si7.gif https://s3-eu-west-1.amazonaws.com/prod-ucs-content-store-eu-west/content/pii:S1381116900003186/STRIPIN/image/gif/6082d80e4cd4ad2cdddec5dbefd6cda0/si7.gif si7 si7.gif gif 1298 21 298 ALTIMG 1-s2.0-S1381116900003186-si6.gif https://s3.amazonaws.com/prod-ucs-content-store-us-east/content/pii:S1381116900003186/STRIPIN/image/gif/37fd9efa2170cd0eda6443f7b66dcc2f/si6.gif https://s3-eu-west-1.amazonaws.com/prod-ucs-content-store-eu-west/content/pii:S1381116900003186/STRIPIN/image/gif/37fd9efa2170cd0eda6443f7b66dcc2f/si6.gif si6 si6.gif gif 1452 18 344 ALTIMG 1-s2.0-S1381116900003186-si5.gif https://s3.amazonaws.com/prod-ucs-content-store-us-east/content/pii:S1381116900003186/STRIPIN/image/gif/dfe12780d633a5209977522ffb9c5cbb/si5.gif https://s3-eu-west-1.amazonaws.com/prod-ucs-content-store-eu-west/content/pii:S1381116900003186/STRIPIN/image/gif/dfe12780d633a5209977522ffb9c5cbb/si5.gif si5 si5.gif gif 1254 20 315 ALTIMG 1-s2.0-S1381116900003186-si4.gif https://s3.amazonaws.com/prod-ucs-content-store-us-east/content/pii:S1381116900003186/STRIPIN/image/gif/d1581ae573dc21798884a7092269beb6/si2.gif https://s3-eu-west-1.amazonaws.com/prod-ucs-content-store-eu-west/content/pii:S1381116900003186/STRIPIN/image/gif/d1581ae573dc21798884a7092269beb6/si2.gif si4 si4.gif gif 443 15 77 ALTIMG 1-s2.0-S1381116900003186-si3.gif https://s3.amazonaws.com/prod-ucs-content-store-us-east/content/pii:S1381116900003186/STRIPIN/image/gif/c870dc648ee77f8fb8d4092c05ea4b7e/si3.gif https://s3-eu-west-1.amazonaws.com/prod-ucs-content-store-eu-west/content/pii:S1381116900003186/STRIPIN/image/gif/c870dc648ee77f8fb8d4092c05ea4b7e/si3.gif si3 si3.gif gif 401 15 65 ALTIMG 1-s2.0-S1381116900003186-si2.gif https://s3.amazonaws.com/prod-ucs-content-store-us-east/content/pii:S1381116900003186/STRIPIN/image/gif/d1581ae573dc21798884a7092269beb6/si2.gif https://s3-eu-west-1.amazonaws.com/prod-ucs-content-store-eu-west/content/pii:S1381116900003186/STRIPIN/image/gif/d1581ae573dc21798884a7092269beb6/si2.gif si2 si2.gif gif 443 15 77 ALTIMG 1-s2.0-S1381116900003186-si17.gif https://s3.amazonaws.com/prod-ucs-content-store-us-east/content/pii:S1381116900003186/STRIPIN/image/gif/4aeb40296b95d7178171f1b12c481bf6/si17.gif https://s3-eu-west-1.amazonaws.com/prod-ucs-content-store-eu-west/content/pii:S1381116900003186/STRIPIN/image/gif/4aeb40296b95d7178171f1b12c481bf6/si17.gif si17 si17.gif gif 651 18 145 ALTIMG 1-s2.0-S1381116900003186-si16.gif https://s3.amazonaws.com/prod-ucs-content-store-us-east/content/pii:S1381116900003186/STRIPIN/image/gif/6ca2d89f661492da6ddd48462f0fc4cd/si16.gif https://s3-eu-west-1.amazonaws.com/prod-ucs-content-store-eu-west/content/pii:S1381116900003186/STRIPIN/image/gif/6ca2d89f661492da6ddd48462f0fc4cd/si16.gif si16 si16.gif gif 1306 21 324 ALTIMG 1-s2.0-S1381116900003186-si15.gif https://s3.amazonaws.com/prod-ucs-content-store-us-east/content/pii:S1381116900003186/STRIPIN/image/gif/ed8020aa32ab68029da0d16b30355324/si15.gif https://s3-eu-west-1.amazonaws.com/prod-ucs-content-store-eu-west/content/pii:S1381116900003186/STRIPIN/image/gif/ed8020aa32ab68029da0d16b30355324/si15.gif si15 si15.gif gif 128 14 11 ALTIMG 1-s2.0-S1381116900003186-si14.gif https://s3.amazonaws.com/prod-ucs-content-store-us-east/content/pii:S1381116900003186/STRIPIN/image/gif/14060e474362f653d770c4f177623302/si9.gif https://s3-eu-west-1.amazonaws.com/prod-ucs-content-store-eu-west/content/pii:S1381116900003186/STRIPIN/image/gif/14060e474362f653d770c4f177623302/si9.gif si14 si14.gif gif 281 15 39 ALTIMG 1-s2.0-S1381116900003186-si13.gif https://s3.amazonaws.com/prod-ucs-content-store-us-east/content/pii:S1381116900003186/STRIPIN/image/gif/d853ff66f36fc7532122edf8cc1ec688/si13.gif https://s3-eu-west-1.amazonaws.com/prod-ucs-content-store-eu-west/content/pii:S1381116900003186/STRIPIN/image/gif/d853ff66f36fc7532122edf8cc1ec688/si13.gif si13 si13.gif gif 2442 23 563 ALTIMG 1-s2.0-S1381116900003186-si12.gif https://s3.amazonaws.com/prod-ucs-content-store-us-east/content/pii:S1381116900003186/STRIPIN/image/gif/641878add593008cd5fef3bf73aa7a31/si12.gif https://s3-eu-west-1.amazonaws.com/prod-ucs-content-store-eu-west/content/pii:S1381116900003186/STRIPIN/image/gif/641878add593008cd5fef3bf73aa7a31/si12.gif si12 si12.gif gif 1876 21 416 ALTIMG 1-s2.0-S1381116900003186-si11.gif https://s3.amazonaws.com/prod-ucs-content-store-us-east/content/pii:S1381116900003186/STRIPIN/image/gif/69897b064429df5d7922eb8a2776665a/si11.gif https://s3-eu-west-1.amazonaws.com/prod-ucs-content-store-eu-west/content/pii:S1381116900003186/STRIPIN/image/gif/69897b064429df5d7922eb8a2776665a/si11.gif si11 si11.gif gif 1943 20 435 ALTIMG 1-s2.0-S1381116900003186-si10.gif https://s3.amazonaws.com/prod-ucs-content-store-us-east/content/pii:S1381116900003186/STRIPIN/image/gif/a4cc5152cbb9fe489f258608fa8683e8/si10.gif https://s3-eu-west-1.amazonaws.com/prod-ucs-content-store-eu-west/content/pii:S1381116900003186/STRIPIN/image/gif/a4cc5152cbb9fe489f258608fa8683e8/si10.gif si10 si10.gif gif 71 2 5 ALTIMG 1-s2.0-S1381116900003186-si1.gif https://s3.amazonaws.com/prod-ucs-content-store-us-east/content/pii:S1381116900003186/STRIPIN/image/gif/d1581ae573dc21798884a7092269beb6/si2.gif https://s3-eu-west-1.amazonaws.com/prod-ucs-content-store-eu-west/content/pii:S1381116900003186/STRIPIN/image/gif/d1581ae573dc21798884a7092269beb6/si2.gif si1 si1.gif gif 443 15 77 ALTIMG 1-s2.0-S1381116900003186-gr1.sml https://s3.amazonaws.com/prod-ucs-content-store-us-east/content/pii:S1381116900003186/gr1/THUMBNAIL/image/gif/9d072f1f7694276e5590f62446c2c7ab/gr1.sml https://s3-eu-west-1.amazonaws.com/prod-ucs-content-store-eu-west/content/pii:S1381116900003186/gr1/THUMBNAIL/image/gif/9d072f1f7694276e5590f62446c2c7ab/gr1.sml gr1 gr1.sml sml 1301 34 125 IMAGE-THUMBNAIL 1-s2.0-S1381116900003186-gr1.jpg https://s3.amazonaws.com/prod-ucs-content-store-us-east/content/pii:S1381116900003186/gr1/DOWNSAMPLED/image/jpeg/f76107f2ce9c1966be036cd375087905/gr1.jpg https://s3-eu-west-1.amazonaws.com/prod-ucs-content-store-eu-west/content/pii:S1381116900003186/gr1/DOWNSAMPLED/image/jpeg/f76107f2ce9c1966be036cd375087905/gr1.jpg gr1 gr1.jpg jpg 43524 182 678 IMAGE-DOWNSAMPLED 1-s2.0-S1381116900003186-gr2.sml https://s3.amazonaws.com/prod-ucs-content-store-us-east/content/pii:S1381116900003186/gr2/THUMBNAIL/image/gif/2e4fea8c29531de781e5bcef9b1ca1ce/gr2.sml https://s3-eu-west-1.amazonaws.com/prod-ucs-content-store-eu-west/content/pii:S1381116900003186/gr2/THUMBNAIL/image/gif/2e4fea8c29531de781e5bcef9b1ca1ce/gr2.sml gr2 gr2.sml sml 1905 61 125 IMAGE-THUMBNAIL 1-s2.0-S1381116900003186-gr2.jpg https://s3.amazonaws.com/prod-ucs-content-store-us-east/content/pii:S1381116900003186/gr2/DOWNSAMPLED/image/jpeg/14ecbf1afe17c318e546b968a0ff9717/gr2.jpg https://s3-eu-west-1.amazonaws.com/prod-ucs-content-store-eu-west/content/pii:S1381116900003186/gr2/DOWNSAMPLED/image/jpeg/14ecbf1afe17c318e546b968a0ff9717/gr2.jpg gr2 gr2.jpg jpg 48922 305 621 IMAGE-DOWNSAMPLED 1-s2.0-S1381116900003186-gr3.sml https://s3.amazonaws.com/prod-ucs-content-store-us-east/content/pii:S1381116900003186/gr3/THUMBNAIL/image/gif/17640f5b25dc1a3f35e5127d416dd461/gr3.sml https://s3-eu-west-1.amazonaws.com/prod-ucs-content-store-eu-west/content/pii:S1381116900003186/gr3/THUMBNAIL/image/gif/17640f5b25dc1a3f35e5127d416dd461/gr3.sml gr3 gr3.sml sml 1329 37 125 IMAGE-THUMBNAIL 1-s2.0-S1381116900003186-gr3.jpg https://s3.amazonaws.com/prod-ucs-content-store-us-east/content/pii:S1381116900003186/gr3/DOWNSAMPLED/image/jpeg/c2f1aaf0814e32bc222ee38d0a03df69/gr3.jpg https://s3-eu-west-1.amazonaws.com/prod-ucs-content-store-eu-west/content/pii:S1381116900003186/gr3/DOWNSAMPLED/image/jpeg/c2f1aaf0814e32bc222ee38d0a03df69/gr3.jpg gr3 gr3.jpg jpg 19110 132 452 IMAGE-DOWNSAMPLED 1-s2.0-S1381116900003186-gr4.sml https://s3.amazonaws.com/prod-ucs-content-store-us-east/content/pii:S1381116900003186/gr4/THUMBNAIL/image/gif/069026d56c3505802604112d493792c9/gr4.sml https://s3-eu-west-1.amazonaws.com/prod-ucs-content-store-eu-west/content/pii:S1381116900003186/gr4/THUMBNAIL/image/gif/069026d56c3505802604112d493792c9/gr4.sml gr4 gr4.sml sml 2406 93 125 IMAGE-THUMBNAIL 1-s2.0-S1381116900003186-gr4.jpg https://s3.amazonaws.com/prod-ucs-content-store-us-east/content/pii:S1381116900003186/gr4/DOWNSAMPLED/image/jpeg/061d5621645183758a282e672483f388/gr4.jpg https://s3-eu-west-1.amazonaws.com/prod-ucs-content-store-eu-west/content/pii:S1381116900003186/gr4/DOWNSAMPLED/image/jpeg/061d5621645183758a282e672483f388/gr4.jpg gr4 gr4.jpg jpg 59917 459 617 IMAGE-DOWNSAMPLED 1-s2.0-S1381116900003186-gr5.sml https://s3.amazonaws.com/prod-ucs-content-store-us-east/content/pii:S1381116900003186/gr5/THUMBNAIL/image/gif/c464ef701e65ea42ada6d1c7d2d1ae23/gr5.sml https://s3-eu-west-1.amazonaws.com/prod-ucs-content-store-eu-west/content/pii:S1381116900003186/gr5/THUMBNAIL/image/gif/c464ef701e65ea42ada6d1c7d2d1ae23/gr5.sml gr5 gr5.sml sml 2390 83 125 IMAGE-THUMBNAIL 1-s2.0-S1381116900003186-gr5.jpg https://s3.amazonaws.com/prod-ucs-content-store-us-east/content/pii:S1381116900003186/gr5/DOWNSAMPLED/image/jpeg/f6986f1f096b866ca945a0939ed37f57/gr5.jpg https://s3-eu-west-1.amazonaws.com/prod-ucs-content-store-eu-west/content/pii:S1381116900003186/gr5/DOWNSAMPLED/image/jpeg/f6986f1f096b866ca945a0939ed37f57/gr5.jpg gr5 gr5.jpg jpg 35590 300 452 IMAGE-DOWNSAMPLED 1-s2.0-S1381116900003186-gr6.sml https://s3.amazonaws.com/prod-ucs-content-store-us-east/content/pii:S1381116900003186/gr6/THUMBNAIL/image/gif/6ac465560169d745d52995f8e244f1ff/gr6.sml https://s3-eu-west-1.amazonaws.com/prod-ucs-content-store-eu-west/content/pii:S1381116900003186/gr6/THUMBNAIL/image/gif/6ac465560169d745d52995f8e244f1ff/gr6.sml gr6 gr6.sml sml 2771 91 125 IMAGE-THUMBNAIL 1-s2.0-S1381116900003186-gr6.jpg https://s3.amazonaws.com/prod-ucs-content-store-us-east/content/pii:S1381116900003186/gr6/DOWNSAMPLED/image/jpeg/dcb29fc4f7c44e195c8c91ca889e325d/gr6.jpg https://s3-eu-west-1.amazonaws.com/prod-ucs-content-store-eu-west/content/pii:S1381116900003186/gr6/DOWNSAMPLED/image/jpeg/dcb29fc4f7c44e195c8c91ca889e325d/gr6.jpg gr6 gr6.jpg jpg 39855 329 452 IMAGE-DOWNSAMPLED 1-s2.0-S1381116900003186-fx1.sml https://s3.amazonaws.com/prod-ucs-content-store-us-east/content/pii:S1381116900003186/fx1/THUMBNAIL/image/gif/585e95484703c00fa730d204deaa966a/fx1.sml https://s3-eu-west-1.amazonaws.com/prod-ucs-content-store-eu-west/content/pii:S1381116900003186/fx1/THUMBNAIL/image/gif/585e95484703c00fa730d204deaa966a/fx1.sml fx1 fx1.sml sml 833 38 125 IMAGE-THUMBNAIL 1-s2.0-S1381116900003186-fx1.jpg https://s3.amazonaws.com/prod-ucs-content-store-us-east/content/pii:S1381116900003186/fx1/DOWNSAMPLED/image/jpeg/5a6f726c279ff8c54acd0d68d5c54c13/fx1.jpg https://s3-eu-west-1.amazonaws.com/prod-ucs-content-store-eu-west/content/pii:S1381116900003186/fx1/DOWNSAMPLED/image/jpeg/5a6f726c279ff8c54acd0d68d5c54c13/fx1.jpg fx1 fx1.jpg jpg 4458 79 257 IMAGE-DOWNSAMPLED 1-s2.0-S1381116900003186-gr7.sml https://s3.amazonaws.com/prod-ucs-content-store-us-east/content/pii:S1381116900003186/gr7/THUMBNAIL/image/gif/dddb13dc9151b9bef3b89c45913fb1ff/gr7.sml https://s3-eu-west-1.amazonaws.com/prod-ucs-content-store-eu-west/content/pii:S1381116900003186/gr7/THUMBNAIL/image/gif/dddb13dc9151b9bef3b89c45913fb1ff/gr7.sml gr7 gr7.sml sml 1506 93 79 IMAGE-THUMBNAIL 1-s2.0-S1381116900003186-gr7.jpg https://s3.amazonaws.com/prod-ucs-content-store-us-east/content/pii:S1381116900003186/gr7/DOWNSAMPLED/image/jpeg/c51ccc4243e21ea6414569483aac30bc/gr7.jpg https://s3-eu-west-1.amazonaws.com/prod-ucs-content-store-eu-west/content/pii:S1381116900003186/gr7/DOWNSAMPLED/image/jpeg/c51ccc4243e21ea6414569483aac30bc/gr7.jpg gr7 gr7.jpg jpg 68063 724 617 IMAGE-DOWNSAMPLED 1-s2.0-S1381116900003186-gr8.sml https://s3.amazonaws.com/prod-ucs-content-store-us-east/content/pii:S1381116900003186/gr8/THUMBNAIL/image/gif/0694f7e3f051d68691e95acdd3d71e71/gr8.sml https://s3-eu-west-1.amazonaws.com/prod-ucs-content-store-eu-west/content/pii:S1381116900003186/gr8/THUMBNAIL/image/gif/0694f7e3f051d68691e95acdd3d71e71/gr8.sml gr8 gr8.sml sml 2038 93 83 IMAGE-THUMBNAIL 1-s2.0-S1381116900003186-gr8.jpg https://s3.amazonaws.com/prod-ucs-content-store-us-east/content/pii:S1381116900003186/gr8/DOWNSAMPLED/image/jpeg/fd82260f33143dddc779cf423bcba0f3/gr8.jpg https://s3-eu-west-1.amazonaws.com/prod-ucs-content-store-eu-west/content/pii:S1381116900003186/gr8/DOWNSAMPLED/image/jpeg/fd82260f33143dddc779cf423bcba0f3/gr8.jpg gr8 gr8.jpg jpg 89544 691 617 IMAGE-DOWNSAMPLED 1-s2.0-S1381116900003186-gr9.sml https://s3.amazonaws.com/prod-ucs-content-store-us-east/content/pii:S1381116900003186/gr9/THUMBNAIL/image/gif/c7826e6490b7e279caa4c3789c88cb30/gr9.sml https://s3-eu-west-1.amazonaws.com/prod-ucs-content-store-eu-west/content/pii:S1381116900003186/gr9/THUMBNAIL/image/gif/c7826e6490b7e279caa4c3789c88cb30/gr9.sml gr9 gr9.sml sml 2288 93 125 IMAGE-THUMBNAIL 1-s2.0-S1381116900003186-gr9.jpg https://s3.amazonaws.com/prod-ucs-content-store-us-east/content/pii:S1381116900003186/gr9/DOWNSAMPLED/image/jpeg/d9056b455e8f1ff3c1388ab09d5ce351/gr9.jpg https://s3-eu-west-1.amazonaws.com/prod-ucs-content-store-eu-west/content/pii:S1381116900003186/gr9/DOWNSAMPLED/image/jpeg/d9056b455e8f1ff3c1388ab09d5ce351/gr9.jpg gr9 gr9.jpg jpg 25685 290 391 IMAGE-DOWNSAMPLED 1-s2.0-S1381116900003186-gr10.sml https://s3.amazonaws.com/prod-ucs-content-store-us-east/content/pii:S1381116900003186/gr10/THUMBNAIL/image/gif/f1e583fcffda82afa040e0a11ce0d584/gr10.sml https://s3-eu-west-1.amazonaws.com/prod-ucs-content-store-eu-west/content/pii:S1381116900003186/gr10/THUMBNAIL/image/gif/f1e583fcffda82afa040e0a11ce0d584/gr10.sml gr10 gr10.sml sml 2797 85 125 IMAGE-THUMBNAIL 1-s2.0-S1381116900003186-gr10.jpg https://s3.amazonaws.com/prod-ucs-content-store-us-east/content/pii:S1381116900003186/gr10/DOWNSAMPLED/image/jpeg/64b9f4e951a90876e4e02495c0c85c3c/gr10.jpg https://s3-eu-west-1.amazonaws.com/prod-ucs-content-store-eu-west/content/pii:S1381116900003186/gr10/DOWNSAMPLED/image/jpeg/64b9f4e951a90876e4e02495c0c85c3c/gr10.jpg gr10 gr10.jpg jpg 22780 210 310 IMAGE-DOWNSAMPLED 1-s2.0-S1381116900003186-gr11.sml https://s3.amazonaws.com/prod-ucs-content-store-us-east/content/pii:S1381116900003186/gr11/THUMBNAIL/image/gif/fc46aa245ec74920802344467f8a773e/gr11.sml https://s3-eu-west-1.amazonaws.com/prod-ucs-content-store-eu-west/content/pii:S1381116900003186/gr11/THUMBNAIL/image/gif/fc46aa245ec74920802344467f8a773e/gr11.sml gr11 gr11.sml sml 2634 94 107 IMAGE-THUMBNAIL 1-s2.0-S1381116900003186-gr11.jpg https://s3.amazonaws.com/prod-ucs-content-store-us-east/content/pii:S1381116900003186/gr11/DOWNSAMPLED/image/jpeg/69bad2493fb52971a18c7f1ab746ddfe/gr11.jpg https://s3-eu-west-1.amazonaws.com/prod-ucs-content-store-eu-west/content/pii:S1381116900003186/gr11/DOWNSAMPLED/image/jpeg/69bad2493fb52971a18c7f1ab746ddfe/gr11.jpg gr11 gr11.jpg jpg 46543 357 408 IMAGE-DOWNSAMPLED MOLCAA 2804 S1381-1169(00)00318-6 10.1016/S1381-1169(00)00318-6 Elsevier Science B.V. Fig. 1 Relevant configurations for surface hydroxyls on the surface of γ-alumina in the model of: (a) Knözinger and Ratnasamy (K–R, [3]); (b) Tsyganenko and Mardilovich (T–M, [4]). Proposed assignments for ν OH stretching frequencies are also given. Fig. 2 Relevant configurations for surface hydroxyls on the surface of γ-alumina in the model of Busca–Lorenzelli (B–L, [5]), with proposed ν OH assignments. Fig. 3 (a) Dipole–dipole coupling between surface hydroxyls of γ-alumina in Peri’s model [6]; (b) a configuration presenting geminal OHs in the T–M model ((110) face, D-layer), where dipole–dipole coupling was considered to be negligible. Fig. 4 New hydroxyl configurations that could occur if five-coordinated Als are present on the alumina surface (see text). Fig. 5 Electrostatic adsorption, as represented by the double-layer model: (a) graphical illustration of the surface layer and the diffuse layer (full circles, cations in solution; empty circles, anions in solution); (b) a close-up view of a cation in the diffuse layer, as seen at the molecular level [25]; (c) evolution of electrostatic potential and ionic concentrations in the diffuse layer, as a function of the distance x to the surface. The cationic charge excess of the diffuse layer is shaded. Fig. 6 The triple-layer model of adsorption, integrating electrostatic and specific adsorption. Full circles, cations; empty circles, anions in solution. The surface plane (0), the Stern layer (β) and the front of the diffuse layer (d) are indicated: (a) specific adsorption without overcompensation (excess of cations in diffuse layer); (b) specific adsorption with overcompensation (excess of anions in diffuse layer); (c) molecular interpretation of specifically adsorbed metal ions in the Stern layer [25]. Fig. 7 The pattern of hydrogen bonding between [Ni(H2O)6]2+and crown ether 18-C-6 (from [37]): an analogue of specifically adsorbed ions on oxide surfaces? Fig. 8 The structure of [Pb(H2O) x ]2+adsorbed on α-alumina by formation of an outer-sphere complex, after Bargar et al. [38]. Fig. 9 Successive adsorption of monotungstate and [PtCl6]2−on γ-alumina [50]. Fig. 10 Adsorption of metatungstate on γ-alumina [51]. Fig. 11 Adsorption of paratungstate on γ-alumina [51]; application of the triple-layer model. The molecular approach to supported catalysts synthesis: state of the art and future challenges J.-F. Lambert * M. Che 1 Laboratoire de Réactivité de Surface (UMR 7609-CNRS) Tour 54, Université Pierre et Marie Curie, 4, Place Jussieu, 75252 Paris Cedex 05, France * Corresponding author. Fax: +33-144-27-60-33 1 Member of the Institut Universitaire de France, France. This contribution addresses some of the molecular-level aspects of classical supported metal catalysts preparation procedures. While the problems selected here have been chosen for their fundamental and practical relevance, important studies due to Knözinger and coworkers will be quoted in each case, and this short review may thus be regarded as a homage to their early activity in the field. We first briefly discuss the state of current knowledge on the surface species exposed at oxide surfaces, based on the particular case of γ-alumina. While considerable uncertainty remains as to the precise interpretations of spectroscopic data (especially in the presence of an aqueous phase), a concerted research effort might allow a molecular-level mapping of adsorption sites as a function of operating conditions. We then present the main mechanisms that may be operative in the establishment of metal-support interaction at the oxide–water interface, again with emphasis on the molecular interpretations. The distinction between strong and weak interactions is found not to be very helpful, while distinctions between selective and non-selective, or reversible/irreversible interactions, are more justified at the molecular level. Although our knowledge of these interactions is still lacunary, recent developments raise the hope of important progress in the near future. Molecular characterization during the later steps of catalyst preparation (thermal activation, calcination, reduction) is much less advanced. However, examples are presented in which the mechanism of initial metal-support interaction (established during the deposition step) has a demonstrated, lasting influence on all further steps of catalyst synthesis, suggesting the practical interest of these studies for fine-tuning of catalysts properties. Altogether, it appears that the molecular-level characterization of supported metal catalysts preparation is a realistic research program in the middle term. Keywords Supported catalysts Synthesis Interfaces Oxide–water Adsorption mechanisms Metals Transition metal complexes Metal deposition on surfaces Alumina 1 Introduction In the field of heterogeneous catalysis, much effort is directed at obtaining molecular-level identification of adsorbed species on the finished catalyst and reactive intermediates during the catalytic act, and with good reason. In contrast, the preparation of the catalytic materials themselves has long been regarded as purely technical know-how: in fact, it hardly deserved to be called a ‘synthesis’, a term which implies at least the identification of the chemical reactions that are taking place- and there can be many of them in the successive steps of preparation, typically involving such unit operations as initial deposition from a transition metal complex (TMC) solution onto the support, followed by drying, calcination, and final reduction or sulfidation. It is somewhat paradoxical that the newest strategies for catalysts synthesis, such as sol–gel methods or chemical vapor deposition, are often better understood than ‘classical’ preparation procedures starting from metal deposition from an aqueous solution. However, we feel that the time is now ripe for a molecular understanding of unit operations in catalyst synthesis, with the prospect of a chemical control of final catalyst properties. As we will see, the chemistry that takes place when an oxide powder is dipped into a water solution of TMCs is far from simple, and we will encounter many open questions, but sufficient progress has already been made to hope they will eventually be solved. We will successively treat both partners involved in the first unit operation of metal deposition, the oxide surface (Section 2) and the TMC solution (Section 3), very briefly discussing the extent of our current knowledge on their molecular characterization. We will then consider in some more detail what happens when both are contacted; in other words, we will address the molecular basis for the establishment of the metal-support interaction (Sections 4 and 5). In the final section (Section 7), we will examine the relevance of an identification of the deposition mechanisms for controlling technologically important properties of the finished catalysts. 2 The structure of support oxide surfaces: the example of γ-alumina In general, in studies on supported catalysts, little attention is paid to the starting structure of the oxides used as catalysts supports, either because the question is thought to be already solved, or because it is felt to be too complicated. Our opinion is that, although specific identifications have been proposed for some surface groups, there is still much uncertainty on the nature of the ‘molecular landscape’ on support surfaces at the nanometric level. To support this contention, we will present a brief overview of the state of the art concerning the surface of γ-alumina, one of the most common supports. There is general consensus that the adsorptive and reactive properties of alumina surfaces are governed by surface hydroxyls, i.e. OH species. Vibrational spectroscopy in the mid-IR region has been used for over 40 years in the hope of identifying them and the subject has already been reviewed [1] (another technique of interest would be 1H NMR, but it has not been widely applied so far) [2]. The OH stretching region indeed shows much structure, evidencing at least five [3] and maybe up to nine [4] separate components. Several attempts have been made to propose specific assignments of the main OH stretching bands of γ-alumina. Historically, the most influential model is due to Knözinger and Ratnasamy [3], and will later be referred to as the K–R model. We will also discuss the models of Tsyganenko–Mardilovich (T–M) [4], and Busca–Lorenzelli (B–L) [5]. All of these are based on the supposition that the basic surface structure consists in cleavage planes of an underlying spinel lattice, the dangling bonds of which are saturated by OH groups. They differ in the number of configurations that they retain as distinct for OH groups, and the features of these configurations they assume to be relevant for determining the value of the OH stretching frequency (ν OH). Fig. 1 illustrates the surface configurations that were considered in the K–R and T–M models, together with the corresponding Al2O3 ν OH assignments. In both models, surface OHs are distinguished according to their own coordination number, i.e. the number of Al3+ions they are bound to (which seems fairly reasonable), and also according to the coordination number of the latter Al3+ions. Thus, it could be said that the range of vision of the spectroscopic probe (IR of OHs) spans the first neighbors of the hydroxyls (OH–Al), and to a certain degree, their second neighbors (number of anions surrounding the Al3+ions, OH–Al–X, irrespective of whether X is an oxide ion or another OH). Even though the K–R and T–M models are based on the same assumptions, they propose somewhat different assignments for the different ν OH. Fig. 2 shows the relevant surface configurations in the B–L model. Here, third neighbors are included in the picture to some extent, because, for some configurations, it is considered important to determine if the Al3+ions are adjacent or not to a lacunary cationic site — such sites must be present at least in the bulk, according to the stoichiometry of Al2O3; in other words, OH–Al–X–Al is distinguished from OH–Al–X–□. This distinction is not made for OHs in coordination number 1, 2 and 3 (types II and III in the K–R model), maybe because there would be too many possibilities; incidentally, the high structural diversity of these species could explain why the corresponding bands are much broader. The implicit hypotheses made in all three models are not limited to the number of neighbors that must be included in the description of a given surface configuration around OH. Another basic assumption is the neglect of dipole–dipole coupling, which, in opposition, was considered to be the dominant factor in the now superseded model of Peri ([6], and Fig. 3 a in the present paper). In fact, the paper of Tsyganenko–Mardilovich [4] underlines that geminal OH pairs (HO–Al–OH) must be found on some faces (see Fig. 3b), but states that dipole–dipole coupling may be safely ignored even then, although without strong justification. More important, and already mentioned, is the fact that the unperturbed spinel lattice is supposed to extend up to the very surface. This hypothesis is explicitly stated in ref. [4]. Indeed, Reller and Cocke [7] have observed on one specific γ-alumina fringe patterns compatible with spinel microcrystals preferentially exposing (110) planes, but the crystallites are too small for selected area electron diffraction. Thus, so far, there is no incontrovertible direct evidence for alumina surfaces having perfect structures of spinel faces. At the contrary, there are some indications that the core structure may be significantly altered at the surface; this is the conclusion reached from molecular dynamics simulations of the equilibrium structure of small alumina particles [8]. Even on the sole basis of IR spectroscopy, Morterra et al. [9] concluded that one of the prominent OH species, actually the most reactive one, was ascribable to a ‘crystallographically defective configuration’, whose structure was, however, left unspecified. It might be argued that the degree of crystallinity of the surface layer(s) is not of fundamental importance since the assignments proposed for OH stretching vibrations only depend on local structures in the vicinity of the hydroxyls, which might very well be the same on crystalline and amorphized surfaces. Unfortunately, this is not a foregone conclusion: perturbed surface layers could also contain some new OH configurations, not considered in spinel-based surface models, such as OHs borne by five-coordinated Al3+ions (Fig. 4 ). Indeed, five-coordinated Al must be present in some cases since it has been detected in γ-alumina by 27 AlNMR [8,10]. More systematic studies, combining IR with CP-MAS and REDOR 27 AlNMR , possibly also with 1 HNMR , are needed to solve this problem. The question of surface amorphization, or at least of a strong modification with respect to regular crystal faces, has sometimes been treated, but rather as a possible consequence of Al–OH condensation after thermal treatments at elevated temperatures [4]. The field of application relevant for the present paper involves, instead, alumina in contact with bulk aqueous solutions. Here too, very strong reorganization may occur: alumina is in equilibrium with its dissolution products, and dissolution of surface species most likely involves as a first step the hydrolysis of some Alsurface–O–Albulk bonds, with the formation of new OH species. Here, in situ observation of surface OH species is extremely difficult because classical vibrational spectroscopy fails at these so-called ‘buried’ interfaces, although the new SFG technique raises some hope for the future [11]. If the identification of individual surface hydroxyls is so imprecise, it should be no surprise that our knowledge of their mutual disposition is even fuzzier. Yet, it seems that the adsorption of many molecules or ions on alumina requires groups of two or more OHs ([12,13] — see also Section 4); therefore, in order to identify adsorption sites and predict adsorption capacities, it would be useful to understand exactly what kind of OHs may form such groupings and how many of them are expected on a given surface. The obtention of such an understanding may be considered as a long-term research program, although some speculations on the matter can already be found sometimes in the literature. We are, thus, left with the inescapable conclusion that the question of surface groups identification in alumina is far from being solved, and will probably keep on giving rise to much controversy in the forthcoming years. In fact, recent results have even complicated the problem, for instance by raising the question of interstitial OHs created by dissociative water adsorption [14]. We are, thus, in great need of a concerted research effort combining molecular modeling, spectroscopic investigations (1H and 27 AlNMR ) under well-controlled conditions and the use of reference compounds containing well-defined hydroxyl groups: an interesting possibility in this respect would be the [Al13O4(OH)24+x (H2O)12−x ]7+ polycations immobilized in the interlayer space of pillared clays, which apparently present homogeneous ‘type IIB’ hydroxyls [15]. While we have used the case of alumina as an illustrative example, similar remarks could be made for other oxide supports, most noticeably for amorphous silicas [16]. 3 Transition metal speciation in precursor solution Metal deposition involves the interaction of two partners: the oxide surface and the TMC solution. Very often, the TMC chosen as precursor is a simple one; for instance, if a nickel nitrate solution is used, nickel will overwhelmingly be present as the hexaaqua complex, [Ni(H2O)6]2+. Even in less trivial cases, metal speciation, i.e. its distribution between the different possible chemical species, is generally well understood in homogeneous solutions, and quite accurate equilibrium constants for most speciation reactions are available. There are some exceptions: for instance, in a recent study of Pt deposition on alumina from hexachloroplatinic acid solutions [17], it was found necessary to determine first the equilibrium constants for the following reactions: (1) [PtCl 6]2−+H 2 O⇌[PtCl 5(H 2 O)]−+Cl − (2) [PtCl 5(H 2 O)]−+H 2 O⇌[PtCl 4(H 2 O)2]+Cl − … (these insertions of water ligands are called ‘aquation’ reactions), and (3) [PtCl 5(H 2 O)]−⇌[PtCl 5(OH)]2−+H + (4) [PtCl 4(H 2 O)2]⇌[PtCl 4(H 2 O)(OH)]−+H + … (acid–base reactions), before understanding the deposition process itself. This is because aquation of hexachloroplatinic acid had been little studied, and only before the advent of 195 Pt NMR, the only technique that allows easy measurements of equilibria — in contrast with interhalogen substitution reactions, which are known in much more detail [18]. In fact, there is no insurmountable problem preventing the detailed understanding of such simple systems. When this has not yet been achieved, it may be because they are (or look), in fact, too simple to attract the attention of specialists in coordination chemistry. 4 A quick review of TMC/oxide support adsorption mechanisms We may come now to the chemistry that is taking place during the deposition of TMCs. First, we have to establish a clear terminological distinction between preparation procedures (such as incipient wetness impregnation, equilibrium deposition followed by filtration…) which refer to the sequence of steps (unit operations) applied and controlled at the macroscopic level, and adsorption mechanisms, which are identified at the molecular level and will be discussed below. The different mechanisms for adsorption of charged species (including TMCs) from an aqueous solution onto an oxide support have long been known [19], and their systematization in the field of supported catalysts preparation was attempted by Che et al. using the concept of interfacial coordination chemistry [20–23]. We refer to some recent review papers [24,25] for a detailed presentation of this idea; only the most relevant features of the three main adsorption mechanisms will be recalled here. In an often quoted paper, written some 20 years ago [26], Brunelle popularized the notion of a pH dependent surface charge for oxides in contact with a water solution. He underlined that as a consequence of the existence of amphoteric surface groups, the same oxide can electrostatically retain anions at low pH values, and cations at high pHs. The resulting electrostatic adsorption is formalized in the frame of the double layer theory (see Fig. 5 ) — the first layer is just the surface of the oxide, which bears positive or negative charge according to whether it is protonated or deprotonated, and the second, or diffuse layer, is the region of the solution where ion concentrations are significantly affected by the electric potential (φ(x)) generated by the surface charge (σ). It is misleading to write a ‘chemical equilibrium’ corresponding to electrostatic adsorption, because no bonds are made or broken (see Section 4.1 for a further discussion, however). The idea of a pH-dependent electrostatic adsorption was an important progress to understand metal precursors adsorption and has been widely accepted ever since, but other well-established results of colloid chemistry have not made their way into the mainstream of heterogeneous catalysis so easily. In particular, colloid chemists have recognized for decades that pure electrostatic adsorption cannot account for most systems of practical interest. In consequence, they developed the so-called ‘triple-layer’ models, wherein a part of the adsorbed ions are held at a fixed distance to the surface by some kind of specific adsorption; the latter is also called site adsorption because it is localized in a plane situated some distance away from the surface, the ‘Stern layer’, in opposition to the non-localized electrostatic interaction to which it is superimposed. Surprisingly, little attention has been given to the precise nature of this specific adsorption (although hydrogen bonding immediately comes to mind) but its occurrence is proved by an ample body of data. Beyond the plane of specific adsorption extends a diffuse layer; two quite different cases may be considered, as illustrated in Fig. 6 , taking a negatively charged surface plane to fix ideas. In Fig. 6a, the amount of specifically adsorbed cations is insufficient for compensation of the negative surface charge, and the diffuse layer again contains an excess of cations. In Fig. 6b, in opposition, the cation density in the Stern layer is high enough to produce charge overcompensation, with the seemingly counterintuitive result that anions, i.e., ions of the same charge as the surface plane, are held in the diffuse layer. One way of writing an equilibrium of specific adsorption would be (5) Here, the star represents a localized surface site whose nature is generally unknown, and the dotted line represents some also unknown, but supposedly noncovalent, interaction. In the field of supported catalysts, the first clear instance of specific adsorption with charge overcompensation was provided by Spanos et al. [27] for the heptamolybdate/alumina system; it was later shown that similar phenomena occur in polytungstate/alumina systems as well [28–30]. At the same time, Knözinger et al. [31,32] have also applied triple layer adsorption models to the adsorption of hexachloroplatinate and palladium(II) tetraammine on alumina, even attempting to evaluate equilibrium constants for the specific adsorption reactions, and thus, predict interfacial speciation. In spite of these successes, it seems that the triple layer has not gained widespread recognition as yet. More intimate than specific adsorption is another mechanism called inner-sphere adsorption by colloid chemists, in which some of the original ligands of the transition metal in solution are replaced by surface groups. This is easily written as a chemical equilibrium (in fact, it is a simple ligand exchange reaction as considered in classical coordination chemistry), e.g. (6) 2(S–OH)+[M(H 2 O)6]2+→[(S–OH)2 M(H 2 O)4]2++2H 2 O where (S–OH) is a surface hydroxyl group. Because this reaction is the simplest one can write in the frame of valence bond theory, it is often proposed speculatively when no better evidence is available. It is generally called ‘grafting’ in heterogeneous catalysis, rather than ligand exchange, by analogy with the modification of oxide surfaces with organic moieties which was known earlier and also implies the formation of covalent bonds. In many cases (at least when the matter has been studied in detail), there is reason to believe that inner-sphere adsorption is coupled with deprotonation of the implied surface groups: (7) 2(S–OH)+[M(H 2 O)6]2+→[(S–O)2 M(H 2 O)4]+2H 3 O + where (S–O) stands for a surface S–O− group formed by deprotonation of (S–OH) 4.1 Metal adsorption: strong versus weak, or specific versus non-specific? Research papers whose main focus is not on the preparation of the catalytic systems are often satisfied with classifying initial metal adsorption as ‘strong’ or ‘weak’. It may seem straightforward to quantify this distinction on the basis of the adsorption energy, i.e. the ΔG° of the adsorption reaction. When considered more closely, this program raises many problems, however. For instance, is electrostatic interaction weak or strong? A counterion in the double layer at a distance x from the surface plane has an electrostatic energy of ZFφ(x), where Z is the ion charge and F is the Faraday (96,500 coulomb/mole). Taking a (rather high) value of φ°=200mV, the adsorption energy of counterions in the double layer, as defined above, would be anywhere between 0 and −40kJ/mole, which seems imprecise but could be averaged to a rather weak value. However, it is obvious that removing all of the counterions from the diffuse layer is physically impossible, as this would lead to a huge uncompensated electric charge on the surface. The solution to that paradox is that, as already mentioned, a chemical equilibrium cannot be written if electrostatic adsorption is considered alone, but only in conjunction with the surface charge buildup reaction, e.g. (8) 2(S–OH)+[M(H 2 O)6]2+ free +2X −→2(S–O −)+[M(H 2 O)6]2+ diffuse layer +2HX where X− is OH− or maybe the anion introduced together with the metal complex, if it is basic. Values of ΔG° for the above reaction may be quite negative because they include the contribution from an acid–base reaction (deprotonation here, or protonation when one considers positive charge buildup). Electrostatic adsorption would then have to be considered as strong, and it is certainly true that electrostatically adsorbed ions will not desorb to any appreciable extent if washed with pure water (i.e., the reverse of reaction (8) will not or hardly occur). On the other hand, if the system is contacted with a solution containing other ions of the same charge, say B2+, extensive displacement of [M(H2O)6]2+ will take place, because in this simple model [M(H2O)6]2+ and B2+ have exactly the same electrostatic energy, namely 2Fφ(x). ‘Specific adsorption’, as defined above, involves rather weak forces — in principle. For instance, a typical H-bond (in water) has an energy of 15kJ/mole [33], but in many instances several H-bonds act cooperatively, providing both the specificity of the adsorption and a more negative ΔG ads. Thus, TMC-surface bonding in Eq. (5) above could consist in the formation of several H-bonds between metal ligands and surface species, resulting in ΔH ads in the order of −30 to −45kJ/mole. As regards the entropy variation (ΔS ads) on adsorption by H-bond formation, this is an extremely complicated question, as is amply proved by biochemical studies [34], and we will, therefore, not venture to propose a precise estimate for ΔG ads. Consider now the third adsorption mechanism, i.e. inner-sphere adsorption. Some experimental measurements of ΔG ads have been reported, although there are rather few of them. Their obtention needs tedious work to determine the precise stoichiometry of the reaction (cf. Eqs. (6) and (7) above), and to unravel intrinsic thermodynamic values (concerning the substitution reaction proper) from superimposed electrostatic effects. Published values are not very negative, in the −20 to −30kJ/mole range [12,35]. In fact, as underlined by Che [23], the surface groups of oxide ligands may be classified in the spectrochemical series as weak-field ligands, even weaker than water; thus, the crystal field stabilization energies (see [36], Chapter IX, for example) decrease on adsorption, with the result that the enthalpy difference in reaction (6) may well be unfavorable. In one case, where the matter was studied precisely (not concerning a transition metal complex, but [Pb(H2O) x ]2+on TiO2 and Fe2O3), it turned out that inner-sphere metal adsorption was indeed entropy-driven, having both ΔH ads and ΔS ads positive [35]. Once again, the reasons for this entropy increase are far from understood, and their discussion will not be attempted here. The point we want to stress is that all three adsorption mechanisms (electrostatic, specific adsorption, and inner-sphere/grafting) may imply adsorption energies of the same order of magnitude, so that there is no mechanistic basis for a distinction between strong and weak adsorption. There are, however, definite and important distinctions concerning: (1) specificity, which is nonexistent for electrostatic adsorption, but high for inner-sphere adsorption, and also for outer-sphere complex formation — this is of course why the latter is called ‘specific adsorption’ by colloid chemists; (2) reversibility: desorbing electrostatically adsorbed metal complexes requires providing ions of the same charge to compensate the charge of the surface, and desorbing grafted metal complexes may require providing protons; thus, metals adsorbed along these two mechanisms will not be removed by the usual procedure of washing with distilled water. On the other hand, outer-sphere adsorbed metal complexes have no such requirements for desorption nor do they seem to have a high activation energy (ΔG ≠) and they will probably not be retained by the surface when the system is submitted to a washing treatment. In other words, a molecular understanding of adsorption mechanisms is required in order to predict the likely effect of a simple elementary step in the catalyst preparation procedure. 4.2 Identification of surface sites in site adsorption mechanisms Both outer sphere and inner sphere adsorption have been termed site adsorption mechanisms, because their specificity can only be explained by a localized interaction of the adsorbed ion or molecule with a precise type of surface species, or a group of surface species, that constitute the adsorption site. The identification of adsorption sites is not a trifling question, as it will determine the maximum density of adsorbed metal ions, and most probably, their further reactivity. Thus, as already mentioned, outer sphere TMC-surface bonding in Eq. (5) above could consist in the formation of several H-bonds implying the coordinated water molecules in the TMC as H-bond donors, and some surface groups of the oxide as H-bond acceptors. Analogs have been known from the field of supramolecular chemistry [37]. Fig. 7 shows how [Ni(H2O)6]2+ is specifically bound to a crown-ether through four hydrogen bonds from the protons of the aqua ligands to the ether oxygens in the cycle. It is easy to imagine the corresponding species on an oxide surface, since similar arrays of H-bond acceptor groups may probably be found among the many hydroxyls and oxide ions that are exposed at the surface. It is much harder to obtain conclusive spectroscopic evidence for the existence of such outer-sphere complexes. One of the few instances where a precise structure was proposed for a metal complex specifically adsorbed on an oxide surface is to be found in the work of Bargar et al. [38] for [Pb(H2O) x ]2+on α-Al2O3 (0001). To obtain a candidate structure for adsorbed lead (Fig. 8 ), a single crystal of alumina exposing a well-defined face had to be used, and the surface sensitive GI-XAFS spectroscopy had to be applied, which is definitely not routine work. It is easier to characterize spectroscopically inner-sphere adsorption than outer-sphere adsorption, since the immediate environment of the adsorbed metal is more deeply perturbed in the former case. Several spectroscopic probes have been used to that purpose according to the system under consideration, for instance UV–VIS spectroscopy of d–d transitions in Ni(II)/oxides [39], 195 Pt NMR for [PtCl6]/Al2O3 [40], or EPR for Cu(II)/oxides [41], to quote only a few recent studies from our research group. Most of the time, the composition of the coordination sphere of the adsorbed complex can be determined with reasonable certainty, establishing the reality of inner-sphere adsorption and maybe its stoichiometry. Local spectroscopic probes of the metal center hardly extend beyond the coordination sphere, and therefore, it is difficult to determine the precise nature of the surface groups that act as ligands: if they are OH groups, then what kind of OHs, and how are they disposed with respect to each other? As in the case of outer-sphere adsorption, the very few instances where inner-sphere adsorption sites have been tentatively identified concern model systems, e.g. in the [Co(H2O) x ]2+/α-Al2O3 (1 1 ̄ 02) system, where the cobalt ion was proposed to be coordinated to no less than four surface groups: one μ3-oxide ion, one bridging (μ2) OH, and one terminal OH [42]. 5 Slow reactions that alter metal speciation at the interface The processes that have been considered so far in Section 4 are definitely adsorption reactions, in that the TMC maintains a recognizable identity throughout. However, it often occurs that new mixed phases (containing the metal as well as elements derived from the support) are detected after the deposition step, the best-known case being constituted by nickel phyllosilicates in the synthesis of Ni/SiO2 [43,44]. More generally, mixed molecular species may be formed without giving rise to a separate solid phase; they are of course more difficult to evidence in this case, and this is the reason why, for instance, the formation of the heteropolyanion [Mo6Al(OH)6O18]3− by simple contact of heptamolybdate solutions with alumina was not evidenced until 1997 [45], in spite of much previous work on such systems (a review of the work carried out until 1988 may be found in [46]). The mechanism of mixed species formation is not yet fully characterized. It involves reaction in the aqueous phase of [Mo7O24]6− with [Al(H2O)6]3+ ions formed by dissolution of the aluminic material. Carrier et al. [47] have shown that advantage can be taken of the slow kinetics of heteropolyanion formation to control molybdenum speciation: leaving the molybdate solution/alumina mixture to equilibrate for several hours will result in total conversion of Mo into [Mo6Al(OH)6O18]3−, while stopping the reaction immediately after contact by freeze-drying will leave it as the original [Mo7O24]6−. Not unexpectedly, the two systems obtained in this way will behave quite differently later on: after calcination at 400°C, [Mo6Al(OH)6O18]3−/Al2O3 shows large crystals of MoO3, while Mo species in the calcined sample from [Mo7O24]6−/Al2O3 remain well dispersed. Two lessons can be drawn from this example: (i) it is worthwhile to study the kinetics of interfacial reactions at the oxide–water interface [25], because their understanding during the deposition step may provide new tools to control the properties of the finished catalyst; (ii) catalysis scientists have something to learn from geochemists, who have been studying such problems for a long time [48]. Another example of the importance of interfacial kinetics is the [PtCl6]2−/Al2O3 system, where the initial adsorption of chloroplatinatic species can be rationalized in a triple layer model; if, however, the system is aged for 10–20h at room temperature (or less at higher temperatures), inner sphere adsorption slowly becomes predominant [17,40,49]. 6 Is it worth the trouble? Memory effects in further steps of catalysts synthesis An objection that is often raised towards in-depth studies of the metal deposition step is that they may have some fundamental interest, but little practical relevance since further treatments of the catalyst prior to its use involves thermal activation at rather high temperature, which is likely to force all catalytic systems with the same composition into the same equilibrium state, irrespective of their previous history. This objection cannot be brushed aside and is likely to be justified in some cases… but certainly not all. A complete answer would have to take into account all phenomena that occur during drying, calcination, reduction… at the same molecular level as was done for the initial metal deposition. Unfortunately, we are not able to systematically fulfill this program at the present time, because the molecular identification of species formed during thermal treatments of catalysts is still in its infancy. Our claim for the existence of memory effects in the synthesis of supported catalysts then has to rely on specific examples where controlled changes in the metal deposition mechanism translates into variations of the finished catalyst. The reader who is familiar with industrial catalyst preparation will probably not be surprised that such instances can indeed be found, because careful examination of the preparation procedures (when possible!) often reveals that a number of empirical recipes have to be applied in order to obtain a high-performance final catalyst. This suggests that the system may remember for a long time the initial preparation conditions. We will now briefly describe some specific examples providing strong evidence for this contention. Recent work from our laboratory indicates that thermal transformations of adsorbed chloroplatinic species are strongly dependent on the nature of their initial interaction with the support. When the adsorption mechanism is electrostatic and/or outer sphere, such as happens on silica, self-reduction can occur even under an oxidizing atmosphere along (9) [Pt IV Cl 6]2−+2H +→Pt II Cl 2+2HCl+Cl 2 (10) Pt II Cl 2→Pt 0+Cl 2 Because the high mobility of the intermediate PtCl2 allows the coalescence of molecularly dispersed species into large particles, the catalyst after the calcination step will contain metallic Pt of very low dispersion, which will not be improved by further reduction under H2 [50]. On the other hand, when the chloroplatinates are adsorbed by an inner sphere mechanism as on γ-alumina (cf. Section 5 above), the grafted [(AlOH)2PtIVCl4] species are, for some as yet unknown reason, immune to self-reduction. Reduction to the metallic state, thus, does not occur before contact with H2, and it then gives Pt particles of much higher dispersion. However, treatment of the alumina surface with aqueous HCl prior to chloroplatinate deposition can inhibit platinum grafting, so that the thermal behavior of the [PtCl6]2−/chlorinated Al2O3 system is more reminiscent of [PtCl6]2−/SiO2 than of [PtCl6]2−/untreated Al2O3. A more intricate case is that of the bimetallic [PtCl6]2−WO x /Al2O3 system. We have studied a synthesis procedure in which the alumina surface is first modified by tungstate deposition, followed by washing, drying, chloroplatinate deposition, a second drying step and thermal treatments [51,52]. The sequence of events occurring during these successive steps was found to strongly depend on the nature of the initial tungstate salt used for deposition, and on their deposition mechanism: • Monotungstate (WO4)2−was adsorbed in small amounts by an inner-sphere mechanism. The adsorption sites were apparently the same as those active for chloroplatinate grafting, so that there was some amount of competition between both species (Fig. 9 ). However, only a small fraction of potential [PtCl6]2−adsorption sites were blocked, and the amount of Pt that did adsorb behaved much in the same way as on the untreated Al2O3 surface. • Metatungstate (H2W12O40)6− was mostly electrostatically adsorbed and remained mobile on the surface. It could, however, effectively screen the Pt adsorption sites because of its high negative charge, preventing Pt grafting during deposition and even later (Fig. 10 ). As a result, [PtCl6]2−self-reduction was not prevented and metallic Pt was already present after the calcination step. Therefore, it could activate hydrogen at low temperatures in the final H2 reduction, catalyzing tungsten reduction, and giving rise to a SMSI effect (Pt decoration with WO x suboxides). • Paratungstate (H2W12O42)10− adsorbed specifically, probably as outer-sphere complexes, and with charge overcompensation (cf. Section 4). The diffuse layer then contained the initial counterions of the tungstates, which were NH4 + and could not be removed by the washing procedure; thus, a good part of the platinic species reacted to form large crystals of (NH4)2PtCl6 (Fig. 11 ). This phase underwent self-reduction even more easily than in the previous case, with similar consequences but a much higher average size for Pt0 particles. These contrasted evolutions will be discussed in more depth in forthcoming papers, together with their consequences on the adsorption of small molecules and the catalytic activity. The brief summary presented here is sufficient to provide an idea of the cascade of events that take place as a consequence of initially different adsorption mechanisms. Let it be mentioned that experiments were performed to isolate the effect of tungsten loading from that of tungsten speciation, and that the latter was found to be predominant. The reader may find it worthwhile to compare the latter results with those recently published by Knözinger et al. on the WO x /ZrO2 system [53]. 7 Conclusion The overview presented above was meant to give a feeling of the current state of the art as regards the first steps of supported catalysts preparation by classical procedures. While we generally have sufficient knowledge of the molecular speciation of metal precursors in the starting solution (with a few exceptions), the same cannot be said for the state of the support oxide surfaces, for which many important questions are still unanswered. As regards the molecular description of the interaction between metal precursors and oxide surfaces, the extent of our ignorance is still greater. However, a good understanding of the types of reaction that can occur at this water–oxide interface has already been developed in the field of coordination chemistry, and a requirement for further progress is that this understanding find its way into the mainstream of catalysis research. The instances of precise molecular identification of adsorbed metal complexes are still scarce, but the recent appearance of such models is cause for hope. We now have the conceptual framework and characterization techniques necessary to achieve this goal, if we start working on it. As regards the further transformations of the adsorbed species during later stages of catalyst preparation (thermal treatments), the molecular-level understanding of metal speciation is a more distant prospect, but it is not impossible. We have to realize that the chemistry involved is more complicated than might be thought at first sight, and an incentive to study that chemistry is the identification of instances where the initial nature of the metal–oxide interaction is remembered throughout the preparation procedure, and plays a key role in determining technologically important properties of the finished catalyst. References [1] C. Morterra G. Magnacca Catal. Today 27 1996 497 [2] E.C. DeCanio J.C. Edwards J.W. Bruno J. Catal. 148 1994 76 [3] H. Knözinger P. Ratnasamy Catal. Rev.-Sci. Eng. 17 1978 31 [4] A.A. Tsyganenko P.P. Mardilovich J. Chem. Soc., Faraday Trans. 92 1996 4843 [5] G. Busca V. Lorenzelli V.S. Escribano R. Guidetti J. Catal. 131 1991 167 [6] J.B. Peri J. Phys. Chem. 69 1965 220 [7] A. Reller D.L. Cocke Catal. Lett. 2 1989 91 [8] L.J. Alvarez A.L. Blumenfeld J.J. Fripiat J. Chem. Phys. 108 1998 1725 [9] C. Morterra V. Bolis G. Magnacca Langmuir 10 1994 1812 [10] D. Coster A.L. Blumenfeld J.J. Fripiat J. Phys. Chem. 98 1994 6201 [11] M.S. Yeganeh S.M. Dougal H.S. Pink Phys. Rev. Lett. 83 1999 1179 [12] K. Hachiya M. Sasaki Y. Saruta N. Mikami T. Yasunaga J. Phys. Chem. 88 1984 23 [13] Y. Okamoto T. Imanaka J. Phys. Chem. 92 1988 7102 [14] K. Sohlberg S.J. Pennycook S.T. Pantelides J. Am. Chem. Soc. 121 1999 10999 [15] L. Bergaoui I. Mrad J.-F. Lambert A. Ghorbel J. Phys. Chem. B 103 1999 2897 [16] S. Boujday, J.-F. Lambert, M. Che, in preparation. [17] B. Shelimov J.-F. Lambert M. Che B. Didillon J. Am. Chem. Soc. 121 1999 545 [18] W. Preetz G. Peters D. Bublitz Chem. Rev. 96 1996 977 [19] W. Stumm, Chemistry of the Solid–Water Interface: Process at the Mineral–Water Interface and Particle–Water Interface in Natural Systems, Wiley, New York, 1992. [20] M. Che, L. Bonneviot, in: T. Inui (Ed.), Stud. Surf. Sci. Catal. 44 (1988) 147. [21] M. Che L. Bonneviot Pure Appl. Chem. 60 1988 1369 [22] M. Che, O. Clause, L. Bonneviot, in: M.J. Phillips, M. Ternan (Eds.), Proceedings of the Ninth International Congress of Catalysts, Vol. 4, Calgary, 1988. The Chemical Institute of Canada, Ottawa, 1989, p. 750. [23] M. Che Stud. Surf. Sci. Catal. 75 A 1993 31 [24] C. Lepetit M. Che J. Mol. Catal. 100 1996 147 [25] J.-F. Lambert M. Che Stud. Surf. Sci. Catal. 109 1997 91 [26] J.P. Brunelle Pure Appl. Chem. 50 1978 1211 [27] N. Spanos L. Vordonis C. Kordulis A. Lycourghiotis J. Catal. 124 1990 301 [28] L. Karakonstantis C. Kordulis A. Lycourghiotis Langmuir 8 1992 1318 [29] L. Karakonstantis K. Bourikas A. Lycourghiotis J. Catal. 162 1996 295 [30] L. Karakonstantis H. Matralis C. Kordulis A. Lycourghiotis J. Catal. 162 1996 306 [31] T. Mang B. Breitscheidel P. Polanek H. Knözinger Appl. Catal. A: 106 1993 239 [32] D. Spielbauer H. Zeilinger H. Knözinger Langmuir 9 1993 460 [33] I. Ohmine S. Saito Acc. Chem. Res. 32 1999 741 [34] R.U. Lemieux Acc. Chem. Res. 29 1996 373 [35] L.G.J. Fokkink A.D. Keizer J. Lyklema J. Coll. Interface Sci. 135 1990 118 [36] J.E. Huheey, Inorganic Chemistry. Principles of Structure and Reactivity, Harper & Row, New York, 1983. [37] J.W. Steed, B.J. McCool, P.C. Junk, J. Chem. Soc. Dalton Trans. (1998) 3417. [38] J.R. Bargar S.N. Towle G.E. Brown G.A. Parks Jr. Geochim. Cosmochim. Acta 60 1996 3541 [39] J.-F. Lambert M. Hoogland M. Che J. Phys. Chem. B 101 1997 10347 [40] B. Shelimov J.-F. Lambert M. Che B. Didillon J. Catal. 185 1999 462 [41] L. Bergaoui J.-F. Lambert H. Suquet M. Che J. Phys. Chem. 99 1995 2155 [42] S.N. Towle J.R. Bargar G.A. Parks Jr. J. Coll. Interface Sci. 217 1999 312 [43] O. Clause M. Kermarec L. Bonneviot F. Villain M. Che J. Am. Chem. Soc. 114 1992 4709 [44] M. Kermarec J.Y. Carriat P. Burattin M. Che A. Decarreau J. Phys. Chem. 98 1994 12008 [45] X. Carrier J.-F. Lambert M. Che J. Am. Chem. Soc. 119 1997 10137 [46] H. Knözinger, in: M.J. Phillips, M. Ternan (Eds.), Proceedings of the Ninth International Congress of Catalysts, Vol. 5, Calgary, 1988. The Chemical Institute of Canada, Ottawa, 1989, p. 20. [47] X. Carrier J.-F. Lambert M. Che Stud. Surf. Sci. Catal. 121 1999 311 [48] G.E.J. Brown V.E. Henrich W.H. Casey D.L. Clark C. Eggleston A. Felmy D.W. Goodman M. Grätzel G. Maciel M.I. McCarthy K.H. Nealson D.A. Sverjensky M.F. Toney J.M. Zachara Chem. Rev. 99 1999 77 [49] B. Shelimov J.-F. Lambert M. Che L.B. Didillon J. Mol. Catal. 158 2000 91 [50] J.-F. Lambert E. Marceau B. Shelima J. Lehman V. Le Bel de Perguilly X. Carrier S. Boujday H. Pennot M. Che Stud. Surf. Sci. Catal. 130 B 2000 1043 [51] V. Le Bel de Penguilly, Ph.D. Thesis, Université Pierre et Marie Curie, Paris, 1998. [52] V. Le Bel de Penguilly, J.-F. Lambert, M. Che, B. Didillon, in preparation. [53] M. Scheithauer R.K. Grasselli H. Knözinger Langmuir 14 1998 3019",
      "scopus-id": "0034693692",
      "coredata": {
        "eid": "1-s2.0-S1381116900003186",
        "dc:description": "This contribution addresses some of the molecular-level aspects of classical supported metal catalysts preparation procedures. While the problems selected here have been chosen for their fundamental and practical relevance, important studies due to Knözinger and coworkers will be quoted in each case, and this short review may thus be regarded as a homage to their early activity in the field. We first briefly discuss the state of current knowledge on the surface species exposed at oxide surfaces, based on the particular case of γ-alumina. While considerable uncertainty remains as to the precise interpretations of spectroscopic data (especially in the presence of an aqueous phase), a concerted research effort might allow a molecular-level mapping of adsorption sites as a function of operating conditions. We then present the main mechanisms that may be operative in the establishment of metal-support interaction at the oxide–water interface, again with emphasis on the molecular interpretations. The distinction between strong and weak interactions is found not to be very helpful, while distinctions between selective and non-selective, or reversible/irreversible interactions, are more justified at the molecular level. Although our knowledge of these interactions is still lacunary, recent developments raise the hope of important progress in the near future. Molecular characterization during the later steps of catalyst preparation (thermal activation, calcination, reduction) is much less advanced. However, examples are presented in which the mechanism of initial metal-support interaction (established during the deposition step) has a demonstrated, lasting influence on all further steps of catalyst synthesis, suggesting the practical interest of these studies for fine-tuning of catalysts properties. Altogether, it appears that the molecular-level characterization of supported metal catalysts preparation is a realistic research program in the middle term.",
        "openArchiveArticle": "false",
        "prism:coverDate": "2000-11-20",
        "openaccessUserLicense": null,
        "prism:aggregationType": "Journal",
        "prism:url": "https://api.elsevier.com/content/article/pii/S1381116900003186",
        "dc:creator": [
          {
            "@_fa": "true",
            "$": "Lambert, J.-F."
          },
          {
            "@_fa": "true",
            "$": "Che, M."
          }
        ],
        "link": [
          {
            "@_fa": "true",
            "@rel": "self",
            "@href": "https://api.elsevier.com/content/article/pii/S1381116900003186"
          },
          {
            "@_fa": "true",
            "@rel": "scidir",
            "@href": "https://www.sciencedirect.com/science/article/pii/S1381116900003186"
          }
        ],
        "dc:format": "application/json",
        "openaccessType": null,
        "pii": "S1381-1169(00)00318-6",
        "prism:volume": "162",
        "prism:publisher": "Elsevier Science B.V.",
        "dc:title": "The molecular approach to supported catalysts synthesis: state of the art and future challenges",
        "prism:copyright": "Copyright © 2000 Elsevier Science B.V. All rights reserved.",
        "prism:issueName": "In honour of Prof. H. Knozinger on the occasion of his 65th",
        "openaccess": "0",
        "prism:issn": "13811169",
        "prism:issueIdentifier": "1-2",
        "dcterms:subject": [
          {
            "@_fa": "true",
            "$": "Supported catalysts"
          },
          {
            "@_fa": "true",
            "$": "Synthesis"
          },
          {
            "@_fa": "true",
            "$": "Interfaces"
          },
          {
            "@_fa": "true",
            "$": "Oxide–water"
          },
          {
            "@_fa": "true",
            "$": "Adsorption mechanisms"
          },
          {
            "@_fa": "true",
            "$": "Metals"
          },
          {
            "@_fa": "true",
            "$": "Transition metal complexes"
          },
          {
            "@_fa": "true",
            "$": "Metal deposition on surfaces"
          },
          {
            "@_fa": "true",
            "$": "Alumina"
          }
        ],
        "openaccessArticle": "false",
        "prism:publicationName": "Journal of Molecular Catalysis A: Chemical",
        "prism:number": "1-2",
        "openaccessSponsorType": null,
        "prism:pageRange": "5-18",
        "prism:endingPage": "18",
        "pubType": "fla",
        "prism:coverDisplayDate": "20 November 2000",
        "prism:doi": "10.1016/S1381-1169(00)00318-6",
        "prism:startingPage": "5",
        "dc:identifier": "doi:10.1016/S1381-1169(00)00318-6",
        "openaccessSponsorName": null
      },
      "objects": {
        "object": [
          {
            "@category": "thumbnail",
            "@height": "15",
            "@width": "39",
            "@_fa": "true",
            "$": "https://api.elsevier.com/content/object/eid/1-s2.0-S1381116900003186-si9.gif?httpAccept=%2A%2F%2A",
            "@multimediatype": "GIF image file",
            "@type": "ALTIMG",
            "@size": "281",
            "@ref": "si9",
            "@mimetype": "image/gif"
          },
          {
            "@category": "thumbnail",
            "@height": "21",
            "@width": "327",
            "@_fa": "true",
            "$": "https://api.elsevier.com/content/object/eid/1-s2.0-S1381116900003186-si8.gif?httpAccept=%2A%2F%2A",
            "@multimediatype": "GIF image file",
            "@type": "ALTIMG",
            "@size": "1512",
            "@ref": "si8",
            "@mimetype": "image/gif"
          },
          {
            "@category": "thumbnail",
            "@height": "21",
            "@width": "298",
            "@_fa": "true",
            "$": "https://api.elsevier.com/content/object/eid/1-s2.0-S1381116900003186-si7.gif?httpAccept=%2A%2F%2A",
            "@multimediatype": "GIF image file",
            "@type": "ALTIMG",
            "@size": "1298",
            "@ref": "si7",
            "@mimetype": "image/gif"
          },
          {
            "@category": "thumbnail",
            "@height": "18",
            "@width": "344",
            "@_fa": "true",
            "$": "https://api.elsevier.com/content/object/eid/1-s2.0-S1381116900003186-si6.gif?httpAccept=%2A%2F%2A",
            "@multimediatype": "GIF image file",
            "@type": "ALTIMG",
            "@size": "1452",
            "@ref": "si6",
            "@mimetype": "image/gif"
          },
          {
            "@category": "thumbnail",
            "@height": "20",
            "@width": "315",
            "@_fa": "true",
            "$": "https://api.elsevier.com/content/object/eid/1-s2.0-S1381116900003186-si5.gif?httpAccept=%2A%2F%2A",
            "@multimediatype": "GIF image file",
            "@type": "ALTIMG",
            "@size": "1254",
            "@ref": "si5",
            "@mimetype": "image/gif"
          },
          {
            "@category": "thumbnail",
            "@height": "15",
            "@width": "77",
            "@_fa": "true",
            "$": "https://api.elsevier.com/content/object/eid/1-s2.0-S1381116900003186-si4.gif?httpAccept=%2A%2F%2A",
            "@multimediatype": "GIF image file",
            "@type": "ALTIMG",
            "@size": "443",
            "@ref": "si4",
            "@mimetype": "image/gif"
          },
          {
            "@category": "thumbnail",
            "@height": "15",
            "@width": "65",
            "@_fa": "true",
            "$": "https://api.elsevier.com/content/object/eid/1-s2.0-S1381116900003186-si3.gif?httpAccept=%2A%2F%2A",
            "@multimediatype": "GIF image file",
            "@type": "ALTIMG",
            "@size": "401",
            "@ref": "si3",
            "@mimetype": "image/gif"
          },
          {
            "@category": "thumbnail",
            "@height": "15",
            "@width": "77",
            "@_fa": "true",
            "$": "https://api.elsevier.com/content/object/eid/1-s2.0-S1381116900003186-si2.gif?httpAccept=%2A%2F%2A",
            "@multimediatype": "GIF image file",
            "@type": "ALTIMG",
            "@size": "443",
            "@ref": "si2",
            "@mimetype": "image/gif"
          },
          {
            "@category": "thumbnail",
            "@height": "18",
            "@width": "145",
            "@_fa": "true",
            "$": "https://api.elsevier.com/content/object/eid/1-s2.0-S1381116900003186-si17.gif?httpAccept=%2A%2F%2A",
            "@multimediatype": "GIF image file",
            "@type": "ALTIMG",
            "@size": "651",
            "@ref": "si17",
            "@mimetype": "image/gif"
          },
          {
            "@category": "thumbnail",
            "@height": "21",
            "@width": "324",
            "@_fa": "true",
            "$": "https://api.elsevier.com/content/object/eid/1-s2.0-S1381116900003186-si16.gif?httpAccept=%2A%2F%2A",
            "@multimediatype": "GIF image file",
            "@type": "ALTIMG",
            "@size": "1306",
            "@ref": "si16",
            "@mimetype": "image/gif"
          },
          {
            "@category": "thumbnail",
            "@height": "14",
            "@width": "11",
            "@_fa": "true",
            "$": "https://api.elsevier.com/content/object/eid/1-s2.0-S1381116900003186-si15.gif?httpAccept=%2A%2F%2A",
            "@multimediatype": "GIF image file",
            "@type": "ALTIMG",
            "@size": "128",
            "@ref": "si15",
            "@mimetype": "image/gif"
          },
          {
            "@category": "thumbnail",
            "@height": "15",
            "@width": "39",
            "@_fa": "true",
            "$": "https://api.elsevier.com/content/object/eid/1-s2.0-S1381116900003186-si14.gif?httpAccept=%2A%2F%2A",
            "@multimediatype": "GIF image file",
            "@type": "ALTIMG",
            "@size": "281",
            "@ref": "si14",
            "@mimetype": "image/gif"
          },
          {
            "@category": "thumbnail",
            "@height": "23",
            "@width": "563",
            "@_fa": "true",
            "$": "https://api.elsevier.com/content/object/eid/1-s2.0-S1381116900003186-si13.gif?httpAccept=%2A%2F%2A",
            "@multimediatype": "GIF image file",
            "@type": "ALTIMG",
            "@size": "2442",
            "@ref": "si13",
            "@mimetype": "image/gif"
          },
          {
            "@category": "thumbnail",
            "@height": "21",
            "@width": "416",
            "@_fa": "true",
            "$": "https://api.elsevier.com/content/object/eid/1-s2.0-S1381116900003186-si12.gif?httpAccept=%2A%2F%2A",
            "@multimediatype": "GIF image file",
            "@type": "ALTIMG",
            "@size": "1876",
            "@ref": "si12",
            "@mimetype": "image/gif"
          },
          {
            "@category": "thumbnail",
            "@height": "20",
            "@width": "435",
            "@_fa": "true",
            "$": "https://api.elsevier.com/content/object/eid/1-s2.0-S1381116900003186-si11.gif?httpAccept=%2A%2F%2A",
            "@multimediatype": "GIF image file",
            "@type": "ALTIMG",
            "@size": "1943",
            "@ref": "si11",
            "@mimetype": "image/gif"
          },
          {
            "@category": "thumbnail",
            "@height": "2",
            "@width": "5",
            "@_fa": "true",
            "$": "https://api.elsevier.com/content/object/eid/1-s2.0-S1381116900003186-si10.gif?httpAccept=%2A%2F%2A",
            "@multimediatype": "GIF image file",
            "@type": "ALTIMG",
            "@size": "71",
            "@ref": "si10",
            "@mimetype": "image/gif"
          },
          {
            "@category": "thumbnail",
            "@height": "15",
            "@width": "77",
            "@_fa": "true",
            "$": "https://api.elsevier.com/content/object/eid/1-s2.0-S1381116900003186-si1.gif?httpAccept=%2A%2F%2A",
            "@multimediatype": "GIF image file",
            "@type": "ALTIMG",
            "@size": "443",
            "@ref": "si1",
            "@mimetype": "image/gif"
          },
          {
            "@category": "thumbnail",
            "@height": "34",
            "@width": "125",
            "@_fa": "true",
            "$": "https://api.elsevier.com/content/object/eid/1-s2.0-S1381116900003186-gr1.sml?httpAccept=%2A%2F%2A",
            "@multimediatype": "GIF image file",
            "@type": "IMAGE-THUMBNAIL",
            "@size": "1301",
            "@ref": "gr1",
            "@mimetype": "image/gif"
          },
          {
            "@category": "standard",
            "@height": "182",
            "@width": "678",
            "@_fa": "true",
            "$": "https://api.elsevier.com/content/object/eid/1-s2.0-S1381116900003186-gr1.jpg?httpAccept=%2A%2F%2A",
            "@multimediatype": "JPEG image file",
            "@type": "IMAGE-DOWNSAMPLED",
            "@size": "43524",
            "@ref": "gr1",
            "@mimetype": "image/jpeg"
          },
          {
            "@category": "thumbnail",
            "@height": "61",
            "@width": "125",
            "@_fa": "true",
            "$": "https://api.elsevier.com/content/object/eid/1-s2.0-S1381116900003186-gr2.sml?httpAccept=%2A%2F%2A",
            "@multimediatype": "GIF image file",
            "@type": "IMAGE-THUMBNAIL",
            "@size": "1905",
            "@ref": "gr2",
            "@mimetype": "image/gif"
          },
          {
            "@category": "standard",
            "@height": "305",
            "@width": "621",
            "@_fa": "true",
            "$": "https://api.elsevier.com/content/object/eid/1-s2.0-S1381116900003186-gr2.jpg?httpAccept=%2A%2F%2A",
            "@multimediatype": "JPEG image file",
            "@type": "IMAGE-DOWNSAMPLED",
            "@size": "48922",
            "@ref": "gr2",
            "@mimetype": "image/jpeg"
          },
          {
            "@category": "thumbnail",
            "@height": "37",
            "@width": "125",
            "@_fa": "true",
            "$": "https://api.elsevier.com/content/object/eid/1-s2.0-S1381116900003186-gr3.sml?httpAccept=%2A%2F%2A",
            "@multimediatype": "GIF image file",
            "@type": "IMAGE-THUMBNAIL",
            "@size": "1329",
            "@ref": "gr3",
            "@mimetype": "image/gif"
          },
          {
            "@category": "standard",
            "@height": "132",
            "@width": "452",
            "@_fa": "true",
            "$": "https://api.elsevier.com/content/object/eid/1-s2.0-S1381116900003186-gr3.jpg?httpAccept=%2A%2F%2A",
            "@multimediatype": "JPEG image file",
            "@type": "IMAGE-DOWNSAMPLED",
            "@size": "19110",
            "@ref": "gr3",
            "@mimetype": "image/jpeg"
          },
          {
            "@category": "thumbnail",
            "@height": "93",
            "@width": "125",
            "@_fa": "true",
            "$": "https://api.elsevier.com/content/object/eid/1-s2.0-S1381116900003186-gr4.sml?httpAccept=%2A%2F%2A",
            "@multimediatype": "GIF image file",
            "@type": "IMAGE-THUMBNAIL",
            "@size": "2406",
            "@ref": "gr4",
            "@mimetype": "image/gif"
          },
          {
            "@category": "standard",
            "@height": "459",
            "@width": "617",
            "@_fa": "true",
            "$": "https://api.elsevier.com/content/object/eid/1-s2.0-S1381116900003186-gr4.jpg?httpAccept=%2A%2F%2A",
            "@multimediatype": "JPEG image file",
            "@type": "IMAGE-DOWNSAMPLED",
            "@size": "59917",
            "@ref": "gr4",
            "@mimetype": "image/jpeg"
          },
          {
            "@category": "thumbnail",
            "@height": "83",
            "@width": "125",
            "@_fa": "true",
            "$": "https://api.elsevier.com/content/object/eid/1-s2.0-S1381116900003186-gr5.sml?httpAccept=%2A%2F%2A",
            "@multimediatype": "GIF image file",
            "@type": "IMAGE-THUMBNAIL",
            "@size": "2390",
            "@ref": "gr5",
            "@mimetype": "image/gif"
          },
          {
            "@category": "standard",
            "@height": "300",
            "@width": "452",
            "@_fa": "true",
            "$": "https://api.elsevier.com/content/object/eid/1-s2.0-S1381116900003186-gr5.jpg?httpAccept=%2A%2F%2A",
            "@multimediatype": "JPEG image file",
            "@type": "IMAGE-DOWNSAMPLED",
            "@size": "35590",
            "@ref": "gr5",
            "@mimetype": "image/jpeg"
          },
          {
            "@category": "thumbnail",
            "@height": "91",
            "@width": "125",
            "@_fa": "true",
            "$": "https://api.elsevier.com/content/object/eid/1-s2.0-S1381116900003186-gr6.sml?httpAccept=%2A%2F%2A",
            "@multimediatype": "GIF image file",
            "@type": "IMAGE-THUMBNAIL",
            "@size": "2771",
            "@ref": "gr6",
            "@mimetype": "image/gif"
          },
          {
            "@category": "standard",
            "@height": "329",
            "@width": "452",
            "@_fa": "true",
            "$": "https://api.elsevier.com/content/object/eid/1-s2.0-S1381116900003186-gr6.jpg?httpAccept=%2A%2F%2A",
            "@multimediatype": "JPEG image file",
            "@type": "IMAGE-DOWNSAMPLED",
            "@size": "39855",
            "@ref": "gr6",
            "@mimetype": "image/jpeg"
          },
          {
            "@category": "thumbnail",
            "@height": "38",
            "@width": "125",
            "@_fa": "true",
            "$": "https://api.elsevier.com/content/object/eid/1-s2.0-S1381116900003186-fx1.sml?httpAccept=%2A%2F%2A",
            "@multimediatype": "GIF image file",
            "@type": "IMAGE-THUMBNAIL",
            "@size": "833",
            "@ref": "fx1",
            "@mimetype": "image/gif"
          },
          {
            "@category": "standard",
            "@height": "79",
            "@width": "257",
            "@_fa": "true",
            "$": "https://api.elsevier.com/content/object/eid/1-s2.0-S1381116900003186-fx1.jpg?httpAccept=%2A%2F%2A",
            "@multimediatype": "JPEG image file",
            "@type": "IMAGE-DOWNSAMPLED",
            "@size": "4458",
            "@ref": "fx1",
            "@mimetype": "image/jpeg"
          },
          {
            "@category": "thumbnail",
            "@height": "93",
            "@width": "79",
            "@_fa": "true",
            "$": "https://api.elsevier.com/content/object/eid/1-s2.0-S1381116900003186-gr7.sml?httpAccept=%2A%2F%2A",
            "@multimediatype": "GIF image file",
            "@type": "IMAGE-THUMBNAIL",
            "@size": "1506",
            "@ref": "gr7",
            "@mimetype": "image/gif"
          },
          {
            "@category": "standard",
            "@height": "724",
            "@width": "617",
            "@_fa": "true",
            "$": "https://api.elsevier.com/content/object/eid/1-s2.0-S1381116900003186-gr7.jpg?httpAccept=%2A%2F%2A",
            "@multimediatype": "JPEG image file",
            "@type": "IMAGE-DOWNSAMPLED",
            "@size": "68063",
            "@ref": "gr7",
            "@mimetype": "image/jpeg"
          },
          {
            "@category": "thumbnail",
            "@height": "93",
            "@width": "83",
            "@_fa": "true",
            "$": "https://api.elsevier.com/content/object/eid/1-s2.0-S1381116900003186-gr8.sml?httpAccept=%2A%2F%2A",
            "@multimediatype": "GIF image file",
            "@type": "IMAGE-THUMBNAIL",
            "@size": "2038",
            "@ref": "gr8",
            "@mimetype": "image/gif"
          },
          {
            "@category": "standard",
            "@height": "691",
            "@width": "617",
            "@_fa": "true",
            "$": "https://api.elsevier.com/content/object/eid/1-s2.0-S1381116900003186-gr8.jpg?httpAccept=%2A%2F%2A",
            "@multimediatype": "JPEG image file",
            "@type": "IMAGE-DOWNSAMPLED",
            "@size": "89544",
            "@ref": "gr8",
            "@mimetype": "image/jpeg"
          },
          {
            "@category": "thumbnail",
            "@height": "93",
            "@width": "125",
            "@_fa": "true",
            "$": "https://api.elsevier.com/content/object/eid/1-s2.0-S1381116900003186-gr9.sml?httpAccept=%2A%2F%2A",
            "@multimediatype": "GIF image file",
            "@type": "IMAGE-THUMBNAIL",
            "@size": "2288",
            "@ref": "gr9",
            "@mimetype": "image/gif"
          },
          {
            "@category": "standard",
            "@height": "290",
            "@width": "391",
            "@_fa": "true",
            "$": "https://api.elsevier.com/content/object/eid/1-s2.0-S1381116900003186-gr9.jpg?httpAccept=%2A%2F%2A",
            "@multimediatype": "JPEG image file",
            "@type": "IMAGE-DOWNSAMPLED",
            "@size": "25685",
            "@ref": "gr9",
            "@mimetype": "image/jpeg"
          },
          {
            "@category": "thumbnail",
            "@height": "85",
            "@width": "125",
            "@_fa": "true",
            "$": "https://api.elsevier.com/content/object/eid/1-s2.0-S1381116900003186-gr10.sml?httpAccept=%2A%2F%2A",
            "@multimediatype": "GIF image file",
            "@type": "IMAGE-THUMBNAIL",
            "@size": "2797",
            "@ref": "gr10",
            "@mimetype": "image/gif"
          },
          {
            "@category": "standard",
            "@height": "210",
            "@width": "310",
            "@_fa": "true",
            "$": "https://api.elsevier.com/content/object/eid/1-s2.0-S1381116900003186-gr10.jpg?httpAccept=%2A%2F%2A",
            "@multimediatype": "JPEG image file",
            "@type": "IMAGE-DOWNSAMPLED",
            "@size": "22780",
            "@ref": "gr10",
            "@mimetype": "image/jpeg"
          },
          {
            "@category": "thumbnail",
            "@height": "94",
            "@width": "107",
            "@_fa": "true",
            "$": "https://api.elsevier.com/content/object/eid/1-s2.0-S1381116900003186-gr11.sml?httpAccept=%2A%2F%2A",
            "@multimediatype": "GIF image file",
            "@type": "IMAGE-THUMBNAIL",
            "@size": "2634",
            "@ref": "gr11",
            "@mimetype": "image/gif"
          },
          {
            "@category": "standard",
            "@height": "357",
            "@width": "408",
            "@_fa": "true",
            "$": "https://api.elsevier.com/content/object/eid/1-s2.0-S1381116900003186-gr11.jpg?httpAccept=%2A%2F%2A",
            "@multimediatype": "JPEG image file",
            "@type": "IMAGE-DOWNSAMPLED",
            "@size": "46543",
            "@ref": "gr11",
            "@mimetype": "image/jpeg"
          }
        ]
      },
      "link": {
        "@rel": "abstract",
        "@href": "https://api.elsevier.com/content/abstract/scopus_id/0034693692"
      }
    }
  }
}