{
  "metadata": {
    "title": "Platinum catalyst on polysiloxane microspheres with N-chelating groups",
    "authors": "; ; ",
    "journal": "Journal of Molecular Catalysis A: Chemical",
    "date": "2016-12-01",
    "doi": "10.1016/j.molcata.2016.09.016",
    "abstract": "",
    "uri": "https://api.elsevier.com/content/article/pii/S1381116916303880",
    "pii": "S1381116916303880"
  },
  "fulltext": {
    "full-text-retrieval-response": {
      "scopus-eid": "2-s2.0-84988421053",
      "originalText": "serial JL 271358 291210 291744 291790 291809 31 Journal of Molecular Catalysis A: Chemical JOURNALMOLECULARCATALYSISACHEMICAL 2016-09-14 2016-09-14 2016-09-20 2016-09-20 2018-07-14T07:35:07 1-s2.0-S1381116916303880 S1381-1169(16)30388-0 S1381116916303880 10.1016/j.molcata.2016.09.016 S300 S300.3 FULL-TEXT 1-s2.0-S1381116916X00106 2025-07-16T16:48:29.225658Z 0 0 20161201 2016 2016-09-14T15:54:58.641428Z absattachment articleinfo articletitlenorm authfirstinitialnorm authfirstsurnamenorm cid cids contenttype copyright crossmark dateloaded dateloadedtxt datesearch datesort dateupdated dco docsubtype doctype doi eid ewtransactionid hubeid indexeddate issn issnnorm itemstage itemtransactionid itemweight openaccess openarchive pg pgfirst pglast pii piinorm pubdatestart pubdatetxt pubyr sortorder srctitle srctitlenorm srctype ssids alllist content subj subheadings suppl tomb volfirst volissue volumelist webpdf webpdfpagecount yearnav figure table e-component body acknowledge affil appendices articletitle auth authfirstini authfull authkeywords authlast grantnumber grantsponsor highlightsabst primabst ref specialabst 1381-1169 13811169 true 424 424 C Volume 424 47 402 411 402 411 20161201 1 December 2016 2016-12-01 2016 article fla © 2016 Elsevier B.V. All rights reserved. PLATINUMCATALYSTPOLYSILOXANEMICROSPHERESNCHELATINGGROUPS POSPIECH P 1 Introduction 2 Experimental 2.1 Chemicals 2.2 Analytical methods 2.2.1 Transmission electron microscopy 2.2.2 Gas chromatography 2.3 Synthesis of cross-linked polysiloxane microspheres (M1) 2.4 Synthesis of magnetic cross-linked polysiloxane microspheres (M2) 2.5 Preparation of 3-(2-aminoethyl)aminopropyl functionalized microspheres (M1N, M2N) 2.5.1 M1N microspheres 2.5.2 M2N microspheres 2.6 Immobilization of platinum onto microspheres 2.6.1 M1N_Pt 2.6.2 M2N_Pt 2.7 Reduction of Pt(II) complex (M1N_Ptr) 2.8 Studies of hydrosilylation 2.8.1 Dimethylphenylstyrylsilane 2.8.2 Dimethylphenyl(1-phenylvinyl)silane 2.8.3 Bis-(1,2-dimethylphenylsilyl)ethylbenzene 2.9 Studies of cinnamaldehyde hydrogenation 3 Results and discussion 3.1 Synthesis of magnetic microspheres 3.2 Modification of microspheres 3.3 Structural studies of platinum immobilized on microspheres 3.4 Studies of the hydrosilylation reaction 3.5 Studies of the hydrogenation reaction 3.5.1 Substrate conversion 3.5.2 Analysis of products 4 Conclusions Acknowledgement Appendix A Supplementary data References NAKAJIMA 2015 20603 20616 Y NEROZZI 2012 236 241 F KIJENSKI 2000 L1 L4 J TROEGEL 2011 1440 1459 D MARCINIEC 2009 B HYDROSILYLATIONACOMPREHENSIVEREVIEWRECENTADVANCES SAUDAN 2007 1309 1319 L WEISSERMEL 1997 K INDUSTRIALORGANICCHEMISTRY JONES 2000 R SILICONCONTAININGPOLYMERSSCIENCETECHNOLOGYSYNTHESISAPPLICATIONS MERGET 2000 364 370 R CHALLA 1983 1 16 G MCNAMARA 2002 3275 3300 C BENAGLIA 2003 3401 3430 M BERGBREITER 2014 260 265 D ZHAO 2009 49 75 G INSOLUBLERESINSUPPORTEDCATALYSTSRECOVERABLERECYCLABLECATALYSTS CHATT 1969 9 14 J CYPRYK 2010 30 38 M DONG 2015 8623 8629 Z YANG 2012 404 410 H WANG 2013 95 101 J CHEN 2009 20 29 Y XUEPING 2011 5701 Z ZHAO 2015 188 194 H HUANG 2015 128 133 Y ZHOU 2010 518 524 L FORTUNIAK 2015 83 91 W MIZERSKA 2015 855 864 U MIZERSKA 2015 507 514 U LASKA 2007 68 75 U POSPIECH 2016 399 407 P FORTUNIAK 2013 3156 3165 W ZHOU 2002 289 292 J ELNAHHAL 2000 142 146 I GRAF 2009 2849 2860 N ADAMS 1967 1272 1274 D ZHANG 2002 217 223 L WYSOKINSKI 2007 37 48 R SHI 2013 101 105 J STRZELEC 2015 10 K TIAN 2016 703 707 Z WU 2016 75 82 Q POSPIECHX2016X402 POSPIECHX2016X402X411 POSPIECHX2016X402XP POSPIECHX2016X402X411XP 2018-09-20T00:00:00.000Z http://creativecommons.org/licenses/by-nc-nd/4.0/ © 2016 Elsevier B.V. All rights reserved. item S1381-1169(16)30388-0 S1381116916303880 1-s2.0-S1381116916303880 10.1016/j.molcata.2016.09.016 271358 2018-07-15T01:14:56.06043Z 2016-12-01 1-s2.0-S1381116916303880-main.pdf https://s3-eu-west-1.amazonaws.com/prod-ucs-content-store-eu-west/content/pii:S1381116916303880/MAIN/application/pdf/d4583fd4c97a99de73a3921973e8e43f/main.pdf https://s3.amazonaws.com/prod-ucs-content-store-us-east/content/pii:S1381116916303880/MAIN/application/pdf/d4583fd4c97a99de73a3921973e8e43f/main.pdf main.pdf pdf true 2709096 MAIN 10 1-s2.0-S1381116916303880-main_1.png https://s3-eu-west-1.amazonaws.com/prod-ucs-content-store-eu-west/content/pii:S1381116916303880/PREVIEW/image/png/5d13f2dde353979bde97ff7c7af7d8a2/main_1.png https://s3.amazonaws.com/prod-ucs-content-store-us-east/content/pii:S1381116916303880/PREVIEW/image/png/5d13f2dde353979bde97ff7c7af7d8a2/main_1.png main_1.png png 57101 849 656 IMAGE-WEB-PDF 1 1-s2.0-S1381116916303880-fx1.sml https://s3-eu-west-1.amazonaws.com/prod-ucs-content-store-eu-west/content/pii:S1381116916303880/fx1/THUMBNAIL/image/gif/a1bac2d004af521e6ed85b16618e258e/fx1.sml https://s3.amazonaws.com/prod-ucs-content-store-us-east/content/pii:S1381116916303880/fx1/THUMBNAIL/image/gif/a1bac2d004af521e6ed85b16618e258e/fx1.sml fx1 true fx1.sml sml 5210 88 219 IMAGE-THUMBNAIL 1-s2.0-S1381116916303880-gr1.sml https://s3-eu-west-1.amazonaws.com/prod-ucs-content-store-eu-west/content/pii:S1381116916303880/gr1/THUMBNAIL/image/gif/96c288ab87938e41c94786de40ea6dd3/gr1.sml https://s3.amazonaws.com/prod-ucs-content-store-us-east/content/pii:S1381116916303880/gr1/THUMBNAIL/image/gif/96c288ab87938e41c94786de40ea6dd3/gr1.sml gr1 gr1.sml sml 5608 111 219 IMAGE-THUMBNAIL 1-s2.0-S1381116916303880-gr2.sml https://s3-eu-west-1.amazonaws.com/prod-ucs-content-store-eu-west/content/pii:S1381116916303880/gr2/THUMBNAIL/image/gif/aa86b0a247dadb030ba3b865aebb12e5/gr2.sml https://s3.amazonaws.com/prod-ucs-content-store-us-east/content/pii:S1381116916303880/gr2/THUMBNAIL/image/gif/aa86b0a247dadb030ba3b865aebb12e5/gr2.sml gr2 gr2.sml sml 9210 164 112 IMAGE-THUMBNAIL 1-s2.0-S1381116916303880-gr3.sml https://s3-eu-west-1.amazonaws.com/prod-ucs-content-store-eu-west/content/pii:S1381116916303880/gr3/THUMBNAIL/image/gif/96b7644a87a45c395ca4bd1ec57ce9cc/gr3.sml https://s3.amazonaws.com/prod-ucs-content-store-us-east/content/pii:S1381116916303880/gr3/THUMBNAIL/image/gif/96b7644a87a45c395ca4bd1ec57ce9cc/gr3.sml gr3 gr3.sml sml 6135 114 219 IMAGE-THUMBNAIL 1-s2.0-S1381116916303880-gr4.sml https://s3-eu-west-1.amazonaws.com/prod-ucs-content-store-eu-west/content/pii:S1381116916303880/gr4/THUMBNAIL/image/gif/71fbf27a132d95dabfd9272a4c2d4f61/gr4.sml https://s3.amazonaws.com/prod-ucs-content-store-us-east/content/pii:S1381116916303880/gr4/THUMBNAIL/image/gif/71fbf27a132d95dabfd9272a4c2d4f61/gr4.sml gr4 gr4.sml sml 19427 164 146 IMAGE-THUMBNAIL 1-s2.0-S1381116916303880-gr5.sml https://s3-eu-west-1.amazonaws.com/prod-ucs-content-store-eu-west/content/pii:S1381116916303880/gr5/THUMBNAIL/image/gif/20d397109c44b0c91ce33b38ab5fbfd7/gr5.sml https://s3.amazonaws.com/prod-ucs-content-store-us-east/content/pii:S1381116916303880/gr5/THUMBNAIL/image/gif/20d397109c44b0c91ce33b38ab5fbfd7/gr5.sml gr5 gr5.sml sml 4671 164 142 IMAGE-THUMBNAIL 1-s2.0-S1381116916303880-gr6.sml https://s3-eu-west-1.amazonaws.com/prod-ucs-content-store-eu-west/content/pii:S1381116916303880/gr6/THUMBNAIL/image/gif/052ad919504177a41cc37bfe21598d48/gr6.sml https://s3.amazonaws.com/prod-ucs-content-store-us-east/content/pii:S1381116916303880/gr6/THUMBNAIL/image/gif/052ad919504177a41cc37bfe21598d48/gr6.sml gr6 gr6.sml sml 3894 163 77 IMAGE-THUMBNAIL 1-s2.0-S1381116916303880-gr7.sml https://s3-eu-west-1.amazonaws.com/prod-ucs-content-store-eu-west/content/pii:S1381116916303880/gr7/THUMBNAIL/image/gif/5ae894451820430ac055f6ba78ac1ec9/gr7.sml https://s3.amazonaws.com/prod-ucs-content-store-us-east/content/pii:S1381116916303880/gr7/THUMBNAIL/image/gif/5ae894451820430ac055f6ba78ac1ec9/gr7.sml gr7 gr7.sml sml 5352 76 219 IMAGE-THUMBNAIL 1-s2.0-S1381116916303880-gr8.sml https://s3-eu-west-1.amazonaws.com/prod-ucs-content-store-eu-west/content/pii:S1381116916303880/gr8/THUMBNAIL/image/gif/aefdac903c23b5e92f7d236d9b092ba4/gr8.sml https://s3.amazonaws.com/prod-ucs-content-store-us-east/content/pii:S1381116916303880/gr8/THUMBNAIL/image/gif/aefdac903c23b5e92f7d236d9b092ba4/gr8.sml gr8 gr8.sml sml 6041 150 219 IMAGE-THUMBNAIL 1-s2.0-S1381116916303880-sc1.sml https://s3-eu-west-1.amazonaws.com/prod-ucs-content-store-eu-west/content/pii:S1381116916303880/sc1/THUMBNAIL/image/gif/7de2a6c82da8dbc3017f503eae730360/sc1.sml https://s3.amazonaws.com/prod-ucs-content-store-us-east/content/pii:S1381116916303880/sc1/THUMBNAIL/image/gif/7de2a6c82da8dbc3017f503eae730360/sc1.sml sc1 sc1.sml sml 3807 111 219 IMAGE-THUMBNAIL 1-s2.0-S1381116916303880-sc2.sml https://s3-eu-west-1.amazonaws.com/prod-ucs-content-store-eu-west/content/pii:S1381116916303880/sc2/THUMBNAIL/image/gif/f2bd0c47bcf2ee1a9c99732226108654/sc2.sml https://s3.amazonaws.com/prod-ucs-content-store-us-east/content/pii:S1381116916303880/sc2/THUMBNAIL/image/gif/f2bd0c47bcf2ee1a9c99732226108654/sc2.sml sc2 sc2.sml sml 2734 146 219 IMAGE-THUMBNAIL 1-s2.0-S1381116916303880-sc3.sml https://s3-eu-west-1.amazonaws.com/prod-ucs-content-store-eu-west/content/pii:S1381116916303880/sc3/THUMBNAIL/image/gif/6ed55781c2d3177396cb03f5e20ad461/sc3.sml https://s3.amazonaws.com/prod-ucs-content-store-us-east/content/pii:S1381116916303880/sc3/THUMBNAIL/image/gif/6ed55781c2d3177396cb03f5e20ad461/sc3.sml sc3 sc3.sml sml 3076 110 219 IMAGE-THUMBNAIL 1-s2.0-S1381116916303880-sc4.sml https://s3-eu-west-1.amazonaws.com/prod-ucs-content-store-eu-west/content/pii:S1381116916303880/sc4/THUMBNAIL/image/gif/3a5c930b6123c13e79f9e3a33e1ddcc5/sc4.sml https://s3.amazonaws.com/prod-ucs-content-store-us-east/content/pii:S1381116916303880/sc4/THUMBNAIL/image/gif/3a5c930b6123c13e79f9e3a33e1ddcc5/sc4.sml sc4 sc4.sml sml 4084 151 219 IMAGE-THUMBNAIL 1-s2.0-S1381116916303880-fx1.jpg https://s3-eu-west-1.amazonaws.com/prod-ucs-content-store-eu-west/content/pii:S1381116916303880/fx1/DOWNSAMPLED/image/jpeg/36ad16b88cbcde73533606082daf78e1/fx1.jpg https://s3.amazonaws.com/prod-ucs-content-store-us-east/content/pii:S1381116916303880/fx1/DOWNSAMPLED/image/jpeg/36ad16b88cbcde73533606082daf78e1/fx1.jpg fx1 true fx1.jpg jpg 19928 200 500 IMAGE-DOWNSAMPLED 1-s2.0-S1381116916303880-gr1.jpg https://s3-eu-west-1.amazonaws.com/prod-ucs-content-store-eu-west/content/pii:S1381116916303880/gr1/DOWNSAMPLED/image/jpeg/5163227a4735858411903f63cf3084dd/gr1.jpg https://s3.amazonaws.com/prod-ucs-content-store-us-east/content/pii:S1381116916303880/gr1/DOWNSAMPLED/image/jpeg/5163227a4735858411903f63cf3084dd/gr1.jpg gr1 gr1.jpg jpg 48633 362 715 IMAGE-DOWNSAMPLED 1-s2.0-S1381116916303880-gr2.jpg https://s3-eu-west-1.amazonaws.com/prod-ucs-content-store-eu-west/content/pii:S1381116916303880/gr2/DOWNSAMPLED/image/jpeg/59b8fbe733abf4e884d8f489c3e92a45/gr2.jpg https://s3.amazonaws.com/prod-ucs-content-store-us-east/content/pii:S1381116916303880/gr2/DOWNSAMPLED/image/jpeg/59b8fbe733abf4e884d8f489c3e92a45/gr2.jpg gr2 gr2.jpg jpg 46370 551 376 IMAGE-DOWNSAMPLED 1-s2.0-S1381116916303880-gr3.jpg https://s3-eu-west-1.amazonaws.com/prod-ucs-content-store-eu-west/content/pii:S1381116916303880/gr3/DOWNSAMPLED/image/jpeg/8c1dcd4b190bd6eb19bbf6a41ed4d336/gr3.jpg https://s3.amazonaws.com/prod-ucs-content-store-us-east/content/pii:S1381116916303880/gr3/DOWNSAMPLED/image/jpeg/8c1dcd4b190bd6eb19bbf6a41ed4d336/gr3.jpg gr3 gr3.jpg jpg 46011 342 659 IMAGE-DOWNSAMPLED 1-s2.0-S1381116916303880-gr4.jpg https://s3-eu-west-1.amazonaws.com/prod-ucs-content-store-eu-west/content/pii:S1381116916303880/gr4/DOWNSAMPLED/image/jpeg/260cf2f0edf27091cb74860411792f64/gr4.jpg https://s3.amazonaws.com/prod-ucs-content-store-us-east/content/pii:S1381116916303880/gr4/DOWNSAMPLED/image/jpeg/260cf2f0edf27091cb74860411792f64/gr4.jpg gr4 gr4.jpg jpg 78212 421 376 IMAGE-DOWNSAMPLED 1-s2.0-S1381116916303880-gr5.jpg https://s3-eu-west-1.amazonaws.com/prod-ucs-content-store-eu-west/content/pii:S1381116916303880/gr5/DOWNSAMPLED/image/jpeg/9aa16877097487a2d1c4a5b1ac15c4d4/gr5.jpg https://s3.amazonaws.com/prod-ucs-content-store-us-east/content/pii:S1381116916303880/gr5/DOWNSAMPLED/image/jpeg/9aa16877097487a2d1c4a5b1ac15c4d4/gr5.jpg gr5 gr5.jpg jpg 26873 434 376 IMAGE-DOWNSAMPLED 1-s2.0-S1381116916303880-gr6.jpg https://s3-eu-west-1.amazonaws.com/prod-ucs-content-store-eu-west/content/pii:S1381116916303880/gr6/DOWNSAMPLED/image/jpeg/3054e7b1838636f29301a6f75a3292ea/gr6.jpg https://s3.amazonaws.com/prod-ucs-content-store-us-east/content/pii:S1381116916303880/gr6/DOWNSAMPLED/image/jpeg/3054e7b1838636f29301a6f75a3292ea/gr6.jpg gr6 gr6.jpg jpg 58670 797 376 IMAGE-DOWNSAMPLED 1-s2.0-S1381116916303880-gr7.jpg https://s3-eu-west-1.amazonaws.com/prod-ucs-content-store-eu-west/content/pii:S1381116916303880/gr7/DOWNSAMPLED/image/jpeg/437f857f78ff247deb3962b7080eb97d/gr7.jpg https://s3.amazonaws.com/prod-ucs-content-store-us-east/content/pii:S1381116916303880/gr7/DOWNSAMPLED/image/jpeg/437f857f78ff247deb3962b7080eb97d/gr7.jpg gr7 gr7.jpg jpg 43606 235 678 IMAGE-DOWNSAMPLED 1-s2.0-S1381116916303880-gr8.jpg https://s3-eu-west-1.amazonaws.com/prod-ucs-content-store-eu-west/content/pii:S1381116916303880/gr8/DOWNSAMPLED/image/jpeg/089b732b91ef57df9d936db656784a23/gr8.jpg https://s3.amazonaws.com/prod-ucs-content-store-us-east/content/pii:S1381116916303880/gr8/DOWNSAMPLED/image/jpeg/089b732b91ef57df9d936db656784a23/gr8.jpg gr8 gr8.jpg jpg 21012 257 376 IMAGE-DOWNSAMPLED 1-s2.0-S1381116916303880-sc1.jpg https://s3-eu-west-1.amazonaws.com/prod-ucs-content-store-eu-west/content/pii:S1381116916303880/sc1/DOWNSAMPLED/image/jpeg/3085732343025843b655975631d93bb2/sc1.jpg https://s3.amazonaws.com/prod-ucs-content-store-us-east/content/pii:S1381116916303880/sc1/DOWNSAMPLED/image/jpeg/3085732343025843b655975631d93bb2/sc1.jpg sc1 sc1.jpg jpg 24536 323 640 IMAGE-DOWNSAMPLED 1-s2.0-S1381116916303880-sc2.jpg https://s3-eu-west-1.amazonaws.com/prod-ucs-content-store-eu-west/content/pii:S1381116916303880/sc2/DOWNSAMPLED/image/jpeg/2cd2ad005d74017fcd4d1f649981800b/sc2.jpg https://s3.amazonaws.com/prod-ucs-content-store-us-east/content/pii:S1381116916303880/sc2/DOWNSAMPLED/image/jpeg/2cd2ad005d74017fcd4d1f649981800b/sc2.jpg sc2 sc2.jpg jpg 15343 401 602 IMAGE-DOWNSAMPLED 1-s2.0-S1381116916303880-sc3.jpg https://s3-eu-west-1.amazonaws.com/prod-ucs-content-store-eu-west/content/pii:S1381116916303880/sc3/DOWNSAMPLED/image/jpeg/7eb6c34c25ca20d8650670e1db38a420/sc3.jpg https://s3.amazonaws.com/prod-ucs-content-store-us-east/content/pii:S1381116916303880/sc3/DOWNSAMPLED/image/jpeg/7eb6c34c25ca20d8650670e1db38a420/sc3.jpg sc3 sc3.jpg jpg 24627 361 715 IMAGE-DOWNSAMPLED 1-s2.0-S1381116916303880-sc4.jpg https://s3-eu-west-1.amazonaws.com/prod-ucs-content-store-eu-west/content/pii:S1381116916303880/sc4/DOWNSAMPLED/image/jpeg/1ac9e8ecfa118adc75370cd9e3e81a90/sc4.jpg https://s3.amazonaws.com/prod-ucs-content-store-us-east/content/pii:S1381116916303880/sc4/DOWNSAMPLED/image/jpeg/1ac9e8ecfa118adc75370cd9e3e81a90/sc4.jpg sc4 sc4.jpg jpg 38036 518 753 IMAGE-DOWNSAMPLED 1-s2.0-S1381116916303880-fx1_lrg.jpg https://s3-eu-west-1.amazonaws.com/prod-ucs-content-store-eu-west/content/pii:S1381116916303880/fx1/HIGHRES/image/jpeg/b5e819e7acbb7105758cf2b354401861/fx1_lrg.jpg https://s3.amazonaws.com/prod-ucs-content-store-us-east/content/pii:S1381116916303880/fx1/HIGHRES/image/jpeg/b5e819e7acbb7105758cf2b354401861/fx1_lrg.jpg fx1 true fx1_lrg.jpg jpg 133541 886 2213 IMAGE-HIGH-RES 1-s2.0-S1381116916303880-gr1_lrg.jpg https://s3-eu-west-1.amazonaws.com/prod-ucs-content-store-eu-west/content/pii:S1381116916303880/gr1/HIGHRES/image/jpeg/4424d82f8dfb8a4597eaa6fb4e924db7/gr1_lrg.jpg https://s3.amazonaws.com/prod-ucs-content-store-us-east/content/pii:S1381116916303880/gr1/HIGHRES/image/jpeg/4424d82f8dfb8a4597eaa6fb4e924db7/gr1_lrg.jpg gr1 gr1_lrg.jpg jpg 392020 1604 3167 IMAGE-HIGH-RES 1-s2.0-S1381116916303880-gr2_lrg.jpg https://s3-eu-west-1.amazonaws.com/prod-ucs-content-store-eu-west/content/pii:S1381116916303880/gr2/HIGHRES/image/jpeg/a4768b42817bece6cc2eff385185b42b/gr2_lrg.jpg https://s3.amazonaws.com/prod-ucs-content-store-us-east/content/pii:S1381116916303880/gr2/HIGHRES/image/jpeg/a4768b42817bece6cc2eff385185b42b/gr2_lrg.jpg gr2 gr2_lrg.jpg jpg 930372 2444 1667 IMAGE-HIGH-RES 1-s2.0-S1381116916303880-gr3_lrg.jpg https://s3-eu-west-1.amazonaws.com/prod-ucs-content-store-eu-west/content/pii:S1381116916303880/gr3/HIGHRES/image/jpeg/c1b036f3ab33003c8fda1f5426d35f4b/gr3_lrg.jpg https://s3.amazonaws.com/prod-ucs-content-store-us-east/content/pii:S1381116916303880/gr3/HIGHRES/image/jpeg/c1b036f3ab33003c8fda1f5426d35f4b/gr3_lrg.jpg gr3 gr3_lrg.jpg jpg 369048 1514 2917 IMAGE-HIGH-RES 1-s2.0-S1381116916303880-gr4_lrg.jpg https://s3-eu-west-1.amazonaws.com/prod-ucs-content-store-eu-west/content/pii:S1381116916303880/gr4/HIGHRES/image/jpeg/e41ad0fc0703c24794acba1e2e0ae55c/gr4_lrg.jpg https://s3.amazonaws.com/prod-ucs-content-store-us-east/content/pii:S1381116916303880/gr4/HIGHRES/image/jpeg/e41ad0fc0703c24794acba1e2e0ae55c/gr4_lrg.jpg gr4 gr4_lrg.jpg jpg 1103944 1868 1667 IMAGE-HIGH-RES 1-s2.0-S1381116916303880-gr5_lrg.jpg https://s3-eu-west-1.amazonaws.com/prod-ucs-content-store-eu-west/content/pii:S1381116916303880/gr5/HIGHRES/image/jpeg/ba90e8804a4ee175617fade8153a2f8b/gr5_lrg.jpg https://s3.amazonaws.com/prod-ucs-content-store-us-east/content/pii:S1381116916303880/gr5/HIGHRES/image/jpeg/ba90e8804a4ee175617fade8153a2f8b/gr5_lrg.jpg gr5 gr5_lrg.jpg jpg 237991 1924 1667 IMAGE-HIGH-RES 1-s2.0-S1381116916303880-gr6_lrg.jpg https://s3-eu-west-1.amazonaws.com/prod-ucs-content-store-eu-west/content/pii:S1381116916303880/gr6/HIGHRES/image/jpeg/4b58bb336979bfbabbd73f7f7f18188e/gr6_lrg.jpg https://s3.amazonaws.com/prod-ucs-content-store-us-east/content/pii:S1381116916303880/gr6/HIGHRES/image/jpeg/4b58bb336979bfbabbd73f7f7f18188e/gr6_lrg.jpg gr6 gr6_lrg.jpg jpg 470832 3535 1667 IMAGE-HIGH-RES 1-s2.0-S1381116916303880-gr7_lrg.jpg https://s3-eu-west-1.amazonaws.com/prod-ucs-content-store-eu-west/content/pii:S1381116916303880/gr7/HIGHRES/image/jpeg/cfda2035e5ea0ed3213fa4691ac1cf0c/gr7_lrg.jpg https://s3.amazonaws.com/prod-ucs-content-store-us-east/content/pii:S1381116916303880/gr7/HIGHRES/image/jpeg/cfda2035e5ea0ed3213fa4691ac1cf0c/gr7_lrg.jpg gr7 gr7_lrg.jpg jpg 325812 1042 3000 IMAGE-HIGH-RES 1-s2.0-S1381116916303880-gr8_lrg.jpg https://s3-eu-west-1.amazonaws.com/prod-ucs-content-store-eu-west/content/pii:S1381116916303880/gr8/HIGHRES/image/jpeg/a551ee634897c52a414412d9de4f4ea4/gr8_lrg.jpg https://s3.amazonaws.com/prod-ucs-content-store-us-east/content/pii:S1381116916303880/gr8/HIGHRES/image/jpeg/a551ee634897c52a414412d9de4f4ea4/gr8_lrg.jpg gr8 gr8_lrg.jpg jpg 143725 1139 1667 IMAGE-HIGH-RES 1-s2.0-S1381116916303880-sc1_lrg.jpg https://s3-eu-west-1.amazonaws.com/prod-ucs-content-store-eu-west/content/pii:S1381116916303880/sc1/HIGHRES/image/jpeg/08d041fdd5af658c1553cb6098983a8c/sc1_lrg.jpg https://s3.amazonaws.com/prod-ucs-content-store-us-east/content/pii:S1381116916303880/sc1/HIGHRES/image/jpeg/08d041fdd5af658c1553cb6098983a8c/sc1_lrg.jpg sc1 sc1_lrg.jpg jpg 181787 1431 2833 IMAGE-HIGH-RES 1-s2.0-S1381116916303880-sc2_lrg.jpg https://s3-eu-west-1.amazonaws.com/prod-ucs-content-store-eu-west/content/pii:S1381116916303880/sc2/HIGHRES/image/jpeg/2ab6545d2a62f08971dd5518a904ed86/sc2_lrg.jpg https://s3.amazonaws.com/prod-ucs-content-store-us-east/content/pii:S1381116916303880/sc2/HIGHRES/image/jpeg/2ab6545d2a62f08971dd5518a904ed86/sc2_lrg.jpg sc2 sc2_lrg.jpg jpg 130428 1778 2667 IMAGE-HIGH-RES 1-s2.0-S1381116916303880-sc3_lrg.jpg https://s3-eu-west-1.amazonaws.com/prod-ucs-content-store-eu-west/content/pii:S1381116916303880/sc3/HIGHRES/image/jpeg/ba5303e987a0bd4218d554d372a3270c/sc3_lrg.jpg https://s3.amazonaws.com/prod-ucs-content-store-us-east/content/pii:S1381116916303880/sc3/HIGHRES/image/jpeg/ba5303e987a0bd4218d554d372a3270c/sc3_lrg.jpg sc3 sc3_lrg.jpg jpg 190192 1597 3167 IMAGE-HIGH-RES 1-s2.0-S1381116916303880-sc4_lrg.jpg https://s3-eu-west-1.amazonaws.com/prod-ucs-content-store-eu-west/content/pii:S1381116916303880/sc4/HIGHRES/image/jpeg/dbd3e103238bd3f44f41a532805f94ce/sc4_lrg.jpg https://s3.amazonaws.com/prod-ucs-content-store-us-east/content/pii:S1381116916303880/sc4/HIGHRES/image/jpeg/dbd3e103238bd3f44f41a532805f94ce/sc4_lrg.jpg sc4 sc4_lrg.jpg jpg 282399 2292 3333 IMAGE-HIGH-RES 1-s2.0-S1381116916303880-mmc1.docx https://s3-eu-west-1.amazonaws.com/prod-ucs-content-store-eu-west/content/pii:S1381116916303880/mmc1/MAIN/application/msword/c7669c36902eefeac4041fbd008016d8/mmc1.docx https://s3.amazonaws.com/prod-ucs-content-store-us-east/content/pii:S1381116916303880/mmc1/MAIN/application/msword/c7669c36902eefeac4041fbd008016d8/mmc1.docx mmc1 mmc1.docx docx 353957 APPLICATION MOLCAA 10040 S1381-1169(16)30388-0 10.1016/j.molcata.2016.09.016 Elsevier B.V. Fig. 1 29Si MAS NMR spectra of microspheres. Fig. 1 Fig. 2 HAADF-STEM image of the investigated area and EDX spectra from the area of the particles. Fig. 2 Fig. 3 13C MAS NMR spectra of microspheres. Fig. 3 Fig. 4 SEM photograms. Fig. 4 Fig. 5 XPS spectra N 1s of M1N_Pt before and after 5 cycles of the hydrosilylation reaction and for M2N_Pt before the reaction. Fig. 5 Fig. 6 Hydrosilylation runs. Fig. 6 Fig. 7 Cinnamaldehyde hydrogenation runs. Fig. 7 Fig. 8 Conversion of cinnamaldehyde and increase of products in time for M1N_Pt catalyst. Fig. 8 Scheme 1 Modification of microspheres by N-(2-aminoethyl)-3-aminopropylmethyldimethoxysilane and immobilization of platinum. Scheme 1 Scheme 2 Hydrosilylation reaction. Scheme 2 Scheme 3 hydrogenation reaction. Scheme 3 Scheme 4 The proposed mechanism of cinnamaldehyde hydrogenation. Scheme 4 Table 1 Conversion of dimethylphenylsilane and selectivity in catalytic runs in the hydrosilylation reaction. Table 1 catalyst Cycle Complex [g] (mol of Pt) Conversion [%] TON Dimethylphenyl (1-phenylvinyl)silane [%] trans dimethylphenylstyrylsilane [%] consecutive addition [%] M1N_Pt 1 0.0501 (2.12×10−5) 39.8 a 28 35.1 64.9 0.0 3 94.6 66 33.8 66.2 0.0 5 99.4 69 30.4 64.3 0.0 M1N_Pt after reduction 1 0.05(2.14×10−5) 85.0 b 58.0 29.3 64.8 5.9 3 97.1 66.2 31.4 68.6 3.5 5 100.0 68.2 28.8 64.6 6.6 M2N_Pt 1 0.0507 (2.15×10−5) 23.9 a 16.2 33.4 66.6 0.0 3 95.8 65.0 33.7 66.3 0.0 5 100.0 67.9 30.6 63.7 5.7 7 100.0 67.9 28.6 65.1 6.3 10 100.0 67.9 29.3 64.0 6.8 K2PtCl2 1 0.008 (1.93×10−5) 100.0 a 67.9 51.5 46.9 1.6 Karstedt 1 0.0017 (1.8×10−6) 97.2 c 787.4 27.6 66.4 6.0 a After 22h. b After 360min. c After 5min. Table 2 Conversion of cinnamaldehyde and selectivity in catalytic runs in the hydrogenation reaction. Table 2 catalyst Cycle Complex [g] (mmol of Pt) Conversion [%] TON Hydrocinnamaldehyde [%] cinnamyl alcohol [%] γ-Phenylpropanol [%] M1N_Pt 1 0.0575 (0.0279) 100.0 * 710.6 57.9 0.00 42.1 2 100.0 55.6 0.00 44.4 3 100.0 58.00 0.00 42.00 4 0.0466 (0.0226) 98.7 59.4 0.00 40.6 5 99.6 876.8 61.9 0.00 38.1 M2N_Pt 1 0.0992 (0.0421) 30.3 ** 354.3 89.0 0.00 11.0 2 45.2 77.1 1.9 21.0 3 51.4 77.0 2.1 20.9 4 0.089 (0.0377) 80.6 77.7 1.8 20.5 5 70.3 823.0 78.0 2.0 20.0 K2PtCl2 1 0.0103 (0.0248) 84.7 ** 678.0 52.2 13.7 34.1 Karstedt catalyst 1 0.0331 (0.017) 92.8 * 1085.6 35.28 38.46 26.26 * After 120min. ** After 360min. Platinum catalyst on polysiloxane microspheres with N-chelating groups Piotr Pospiech a ⁎ Julian Chojnowski a Urszula Mizerska a Grzegorz Cempura b a Centre of Molecular and Macromolecular Studies, Polish Academy of Sciences, Lodz, Poland Centre of Molecular and Macromolecular Studies Polish Academy of Sciences Lodz Poland b AGH University of Science and Technology, Faculty of Metals Engineering and Industrial Computer Science, Kraków, Poland AGH University of Science and Technology Faculty of Metals Engineering and Industrial Computer Science Kraków Poland ⁎ Corresponding author at: Centre of Molecular and Macromolecular Studies, Department of the Engineering of Polymer Materials, Sienkiewicza 112, 90-363 Lodz, Poland. Centre of Molecular and Macromolecular Studies Polish Academy of Sciences Lodz Poland Graphical abstract Elastic and durable, magnetic and non-magnetic polysiloxane microspheres containing a large number of SiOH groups were obtained by a simple and cheap emulsion process. N-chelating ligands were grafted on these microspheres by the condensation of their silanol groups with N-(2-aminoethyl)-3-aminopropylmethyldimethoxysilane. A platinum catalyst was immobilized on these microspheres. At every stage of the microspheres modification they were characterized by spectroscopy methods as well as by SEM microscopy. The catalyst appears only in the form of Pt(II) complex. The Pt(0) form was obtained by reducing this complex using sodium borohydride. The catalytic activity of the obtained catalysts was compared using model reactions, which were the hydrosilylation of phenylacetylene and hydrogenation of cinnamaldehyde. In both of these reactions the new platinum catalysts were recycled several times with the retention of their high catalytic activity. The hydrogenation of cinnamaldehyde leads to two products hydrocinnamaldehyde (HCA) and 3-phenyl-1-propanol (PP). The comparison of the rate of formation of the products with the rate of HCA and cinnamyl alcohol (CA) hydrogenation indicates that neither HCA nor CA are intermediate in the main pathway of the formation of PP. Keywords Polysiloxane microspheres Heterogeneous Pt catalysis Cinnamaldehyde hydrogenation Hydrosilylation, 1 Introduction The transition metal catalysts such as complexes of palladium, platinum, rhodium or ruthenium, play an important role in many industrial processes. Among them, platinum catalysts have been commonly used for years. In these catalysts platinum can exist in an oxidation state 0, II and IV. All these forms are used in many organic syntheses in both industrial processes and research laboratories. Platinum is well-known as the catalyst of isomerization, cyclization, dehalogenation, hydrogenation and continues to be number one in hydrosilylation [1–3]. The last two reactions are particularly important. Hydrosilylation is one of the basic reactions in organosilicon chemistry making the synthesis of great number of organosilicon compounds relevant to modern technology and medicine possible [4,5]. Hydrogenation, in turn, is a very important reaction in manufacturing oil, fats pharmaceuticals and petrochemical products [6,7]. There are, at least, two main problems in the use of platinum catalysts, one is their allergic and carcinogenic action and the other is their price [8,9]. That is why a lot of research has been done in industrial and academic laboratories to improve the activity, selectivity, recoverability and recyclability of platinum catalysts. One way to achieve these goals is the immobilization of a homogenous catalyst on solid support also known as heterogenization. In parallel, scientists continue to explore a design of new ligands to obtain more active and selective catalysts. Polymers are often considered as catalyst carriers because they allow to achieve the two aforementioned goals, being supports with well-defined structure and containing functional groups used as ligands [10–13]. Considering forms of polymer topology a cross-linked network seems to be the best choice for a catalyst carrier [14]. Bidentate nitrogen ligands are attractive for the application in transition metal catalysts, such as a platinum complex, because of a high affinity of nitrogen to these metals [15]. Polysiloxanes used as support for these catalysts give many advantages. The flexibility and mobility of polysiloxane chain allow to adjust its conformation to environment thus giving reactants a better access to catalytic centres. They are also easily modified by the introduction of functional groups which can work as ligands for transition metals [8,16]. The polymer microspheres are a suitable form for catalyst carriers because the shape of particles, their size and chemical structure give them valuable hydrodynamic properties and the ease of isolation from a reaction mixture. Among spherical particles used as catalyst supports the most common are TiO2, Al2O3 and Fe3O4, coated silica or modified silica alone [17–21] while among the polymer particles the most often explored are polystyrene and chitosan [22–24]. Many works were devoted to composite microspheres whose construction allows to improve their thermal resistance and give them magnetic or hydrophobic-hydrophilic properties. Microspheres exclusively built from polysiloxane chains are a new interesting material which may find many uses [25–27]. The ability for an easy modification on their synthesis level e.g. forming magnetic particles, smooth introduction of functional groups and the aforementioned properties of polysiloxanes provide an attractive multi-purpose material which can be successfully used as catalyst carriers. We describe here the synthesis of magnetic or non-magnetic polysiloxane microspheres, their modification by commercially available and cheap 3-(2-amino-ethylamino)propylmethyldimethoxysilane and immobilization of platinum on them. We demonstrated that the obtained Pt(0) and Pt(II) complexes heterogenized on these microspheres are efficient and reusable catalysts in hydrogenation and hydrosilylation reactions. 2 Experimental 2.1 Chemicals Toluene, acetone, ethanol, polyvinyl alcohol (Mn 7.2×104) and dioxane (POCh, analytical grade), cinnamaldehyde (Aldrich, 99%), cinnamyl alcohol (Aldrich, 98%), hydrocinnamylaldehyde (TCI, >93%), dimethylphenylsilane (Fluorochem, 98%), phenylacetylene (ABCR, 98%), potassium tetrachloroplatinate(II) (ABCR, 99.9%), N-(2-aminoethyl)-3-aminopropylmethyldimethoxysilane (ABCR, 97%), undecane (Aldrich, >99%) were used as received. Iron (III) chloride, Iron(II) chloride, hydrochloric acid (solution 38%) and ammonium hydroxide (solution 25%) (Chempur, analytical grade) were used as received. Polyhydromethylsiloxane (PHMS) was purchased in ABCR under name HMS 991, Mn 4.7×103 g/mol as confirmed by SEC. 1,3-Divinyltetramethyldisiloxane (ABCR, 97%). Pt(0) Karstedt catalyst containing 20w/w% Pt was kindly offered by Momentive Performance Materials GmbH Leverkusen. Magnetite nanoparticles were obtained by coprecipitation of Fe2+/Fe3+ in an alkaline solution using known method [28]. 2.2 Analytical methods 29Si and 13C MAS NMR spectroscopy, Scanning Electron Microscopy, FIR, XPS spectroscopy and Elemental Analysis were precisely described earlier [29] 2.2.1 Transmission electron microscopy Transmission electron microscopy (TEM) and scanning-transmission electron microscopy (STEM) analyses were conducted using thin foils utilizing FEI Tecnai G2 20 TWIN microscope equipped with EDS of EDAX. In order to make TEM images of the crosssection of microspheres they were embedded in Araldite 502 (epoxide resin) and cut with an ultramicrotome (Power Tome XL, Boeckeler Instruments, Inc.). 2.2.2 Gas chromatography Gas chromatographic analysis was performed on a Hewlett Packard 5890 II apparatus (TCD detector) equipped with a HP-50+ column (30m×0.53mm×1μm) using helium as a carrier gas. Temperature program for hydrogenation: the column was kept at 60°C for 4min, then heated to 240°C at a rate of 12°C/min. Temperature program for hydrosilylation: the column was kept at 60°C for 2min, then heated to 150°C at a rate of 5°C/min and then heated to 280°C at a rate of 10°C/min. 2.3 Synthesis of cross-linked polysiloxane microspheres (M1) The preparation of polysiloxane microspheres was precisely described earlier [29]. Regular microspheres, of diameters ranging from 3.5 to 30μm (mean value 14.7μm), were analyzed by 29Si and 13C MAS NMR, elemental analysis and SEM. They contained 5.1mmol/g SiOH. 29Si MAS NMR (δ in ppm at maximum): −67.3 MeSi(OSi)3; −57.4 MeSi(OH)(OSi)2; −37.8 MeSi(H)(OSi)2; −21.0 MeSi(CH2)(OSi)2; +7.2 Me2 Si(CH2)(OSi) and Me3 SiO. 13C MAS NMR (δ in ppm at maximum): −3.5, −0.9, +0.6 CH3; +8.5 CH2. Elemental analysis in wt%: C-24.03%, H-7.1. 2.4 Synthesis of magnetic cross-linked polysiloxane microspheres (M2) The preparation of polysiloxane microspheres was carried out according to the procedure similar to that described previously [30]. The suspension of iron oxide nanoparticles in isopropanol was added to the mixture before emulsification. The exact description of the synthesis was placed in Supporting information. The microspheres (6.4g–82.8% yield) with diameters in the range of 4.2 to 52.5μm (mean 18.9μm) were acquired. They were analyzed by 29Si and 13C MAS NMR, IR, elemental analysis and SEM. They contained 3.8mmol/g SiOH. 29Si MAS NMR (δ in ppm at maximum): −67.8 MeSi(OSi)3; −58.5 MeSi(OH)(OSi)2; − 38.5 MeSi(H)(OSi)2; −21.4 MeSi(CH2)(OSi)2; +5.9 Me2 Si(CH2)(OSi) and Me3 SiO. 13C MAS NMR (δ in ppm at maximum): −5.2, −3.6, −2.2, −1.0 CH3; +6.6 CH2, +23.5 C-CH3, +74.2 CH. Elemental analysis in wt%: C-23.64, H-5.61 2.5 Preparation of 3-(2-aminoethyl)aminopropyl functionalized microspheres (M1N, M2N) The microspheres with pendant aminoethylamino groups were obtained by condensation reaction of silanol groups in microspheres with N-(2-aminoethyl)-3-aminopropylmethyldimethoxysilane. The reaction was carried out using the procedure similar to that described in Ref. [30]. Microspheres (M1-8.12g, M2-1.54g) were suspended in the toluene (20 and 10mL respectively) and the methoxysilane (10 and 2mL respectively) was slowly added by syringe to the stirred mixture and the stirring was continued for 48h. The microspheres were separated and repeatedly washed with toluene, dried in vacuum and analyzed. The [3-(2-aminoethyl)aminopropyl]siloxane groups replaced almost completely the initial hydroxyl groups, as shown by 29Si MAS NMR. 2.5.1 M1N microspheres 29Si MAS NMR (δ in ppm at maximum): −69.2 MeSi(OSi)3; −60.9 MeSi(OH)(OSi)2; −23.8 MeSi(CH2)(OSi)2; +5.6 Me2 Si(CH2)(OSi) and Me3 SiO. 13C MAS NMR (δ in ppm at maximum): −4.4, −2.8 CH3; +7.1, +13.1 Si-CH2, +21.0 C-CH2-C, 39.6H2N-CH2, 50.7 NH-CH2, OCH3. 2.5.2 M2N microspheres 29Si MAS NMR (δ in ppm at maximum): −69.5 MeSi(OSi)3; −60.7 MeSi(OH)(OSi)2; −23.9 MeSi(CH2)(OSi)2; +5.2 Me2 Si(CH2)(OSi) and Me3 SiO. 13C MAS NMR (δ in ppm at maximum): −5.2, −3.7 CH3; +6.1, +11.9 Si-CH2, +20.7 C-CH2-C, 38.3 H2N-CH2, 49.6 NH-CH2, OCH3, Elemental analysis M1N (in wt.%): C 32.95, H 8.08, N 7.19; M2N (in wt.%): C 31.00, H 7.83, N 4.48. 2.6 Immobilization of platinum onto microspheres The M1N and M2N microspheres were dispersed in dioxane/phosphate buffer mixture and solution of platinum salt K2PtCl4 (0.103g) in phosphate buffer (pH-7.2) (7mL), was added dropwise. The proportion of mol(Pt)/mol(ligands) has been used as 1/6. The suspension was shaken for tens hours at room temperature. The obtained platinum complexes immobilized on microspheres (M1N_Pt and M2N_Pt) were isolated from the solution by filtration, washed successively with several solvents (water, acetone, toluene) and then dried under vacuum. The complexes M1N_Pt and M2N_Pt were light grey and brown in colour respectively. These complexes were characterized by 29Si and 13C MAS-NMR spectroscopy, FIR, SEM, XRF and XPS. 2.6.1 M1N_Pt 29Si MAS NMR (δ in ppm at maximum): −69.2 MeSi(OSi)3; −59.9 MeSi(OH)(OSi)2; −23.4 MeSi(CH2)(OSi)2; +5.8 Me2 Si(CH2)(OSi) and Me3SiO. 13C MAS NMR (δ in ppm at maximum): −3.3, CH3; +6.9, +12.4 Si-CH2, +19.9 C-CH2-C, +40.2 H2N-CH2, +44.1 OCH3, +50.6 NH-CH2; FIR (incm−1 at maximum): 350 Pt-Cl; 267, 243, 208 Pt-N; Elemental analysis (in wt.%): C 20.53, H 6.2, N 4.67. 2.6.2 M2N_Pt 29Si MAS NMR (δ in ppm at maximum): −67.0 MeSi(OSi)3; −58.8 MeSi(OH)(OSi)2; −21.5 MeSi(CH2)(OSi)2; +7.9 Me2 Si(CH2)(OSi) and Me3SiO. 13C MAS NMR (δ in ppm at maximum): −2.3, CH3; +8.8, +14.6 Si-CH2, +22.1, +28.5 C-CH2-C, +42.6 H2N-CH2, +50.8 NH-CH2, +76.6 CH2, FIR (in cm−1 at maximum): 339 Pt-Cl; 259, 240, 208 Pt-N. Elemental analysis (in wt.%): C 24.18, H 6.78, N 3.42. 2.7 Reduction of Pt(II) complex (M1N_Ptr) M1N_Pt catalyst was reduced to convert Pt(II) complex into Pt(0) similar to the procedure described in Ref. [31]. M1N_Pt (0.1g) was dispersed in ethanol (1mL), then mixed with NaBH4 (0.1g) in deionized water (7mL) and shaken at room temperature for two days. The resulting product was filtered, washed with water and EtOH respectively and dried under vacuum to obtain the dark grey platinum(0) complex. 2.8 Studies of hydrosilylation Phenylacetylene (0.16mL, 1.5mmol), dimethylphenylsilane (0.23mL, 1.5mmol), toluene (0.5mL) and undecane (0.07mL) were placed in a screw cap vial and then Pt complex containing ca. 0.02mmol Pt was added. The reaction mixture was heated to 100°C with a mild shaking. Samples were withdrawn at certain time intervals and analyzed by gas chromatography using undecane as the internal standard. The conversion was determined based on the amount of consumed phenylacetylene. After the reaction the mixture was cooled down and the catalyst was separated by sedimentation, washed by acetone, dried and used for the next reaction cycle. The products were isolated by distillation under reduced pressure and characterized by 1H, 13C and 29Si NMR. 2.8.1 Dimethylphenylstyrylsilane 1H (500MHz, CDCl3): δ 0.69 (s, −CH 3), 6.85, 6.88 (d, CH-Si), 7.21, 7.25 (d, CH-Ph), 7.48-7.85 (m, phenyl); 13C (500MHz, CDCl3, δ in ppm at maximum): −2.46 (-CH3), 126.38, 126.57, 127.93, 128.38, 128.61 (C arom), 133.84 ( CH-Si) 133.94 (Si-Carom),138.13 (Si-C arom), 138.45 (C arom C), 145.39 (CH-Ph); 29Si (500MHz, CDCl3, δ in ppm at maximum): −10.0 2.8.2 Dimethylphenyl(1-phenylvinyl)silane 1H (500MHz, CDCl3): δ 0.62 (s, CH 3), 5.88 (s,CH 2), 6.20 (s, CH 2), 7.34-7.77 (m, phenyl); 13C (500MHz, CDCl3, δ in ppm at maximum): −2.08 (-CH3), 126.68, 127.10, 128.09, 128.32 (Carom), 129.04 (CH2), 134.14 (Si-Carom), 138.44 (Si-C arom), 144.33 (C-C arom), 151.17 ( C(Si)-C); 29Si (500MHz, CDCl3, δ in ppm at maximum): −7.9 2.8.3 Bis-(1,2-dimethylphenylsilyl)ethylbenzene 1H (500MHz, CDCl3): δ 0.29 (s, CH 3), 0.41 (s, −CH-), 0.51 (s, −CH 2-), 6.87–7.74 (m, phenyl); 13C (500MHz, CDCl3, δ in ppm at maximum): 0.38 (-CH3), 125.87, 126.70, 127.80, 128.92 (Carom), 134.05, 134.49 (Si-Carom), 139.16, 139.85 (Si-C arom), 149.08 (C-C arom); 29Si (500MHz, CDCl3, δ in ppm at maximum): −10.5 Ph(CH3)2Si-CHPh-, 14.6 Ph(CH3)2Si-CH2- 2.9 Studies of cinnamaldehyde hydrogenation The hydrogenation reactions were carried out in Autoclave Engineers B030SS using the procedure similar to that described in Ref. [29]. The exact description of the synthesis was placed in Supporting information. 3 Results and discussion 3.1 Synthesis of magnetic microspheres We developed a method of synthesis of all-polysiloxane microspheres having magnetic properties and containing an easy to modification SiOH groups. The method is based on cross-linking of polyhydromethylsiloxane in aqueous emulsion [30]. Magnetic properties of these microspheres were gained by the introduction of iron oxide nanoparticles produced according to a published method [28]. They were added to the PHMS/DVTMDS mixture before its emulsification using the previously described procedure [30]. We observed that the incorporation of magnetite into microspheres slightly influenced the SiH/SiOH ratio. The analysis of the 29Si MAS NMR spectrum (Fig. 1 ) indicated that in the standard method of the preparation of non-magnetic microspheres a large number of SiOH was produced (5.1mmol/g) whereas the addition of Fe3O4 caused a moderate decrease of SiOH (3.8mmol/g). The TEM investigations, of the microsphere cross-section showed that the iron in the microspheres appeared in the form of particle clusters (Fig. 2 ). The SEM photograms indicated that the shape and surface structure of the microspheres were not changed after the introduction of magnetite (Fig. 4). 3.2 Modification of microspheres The presence of reactive silanol groups on the microspheres gives a broad possibility of the functionalization of these particles by organofunctional chloro- or alkoxysilanes. The microspheres with N-chelating ligands were obtained by the condensation of silanol groups on the spheres with N-(2-aminoethyl)-3-aminopropylmethyldimethoxysilane (Scheme 1 ). The reaction was carried out in the suspension of microspheres in toluene with an excess of the silane reagent. The analysis of the 29Si MAS NMR spectrum indicated that most of hydroxyl functions on polysiloxane were consumed. During the reaction we observed a disappearance of remaining SiH groups by their dehydrogenative condensation with the silanol groups (Fig. 1). The structure of the obtained product was also confirmed by 13C MAS NMR spectrum (Fig. 3 ). The amount of the ligands bonded to microspheres, determined by elemental analysis, was 2.56mmol per gram for native microspheres and 1.74mmol per gram for their magnetic form. 3.3 Structural studies of platinum immobilized on microspheres Platinum complex immobilized on the microspheres using bidentate nitrogen ligands was very conveniently synthesized by reacting the previously modified microspheres (M1N, M2N) with potassium chloroplatinate (Scheme 1). The obtained complexes were characterized by standard analytical techniques. The 29Si MAS NMR spectrum was not changed after the immobilization of platinum but widening of carbon signals neighbouring with N atoms was observed in 13C MAS NMR spectrum (Figs. 1 and 3), which was an effect of platinum bonding to the nitrogen ligand. SEM photographs (Fig. 4 ) gave us information that the surface of microspheres was not changed after the modification and immobilization of platinum. We suppose that platinum is distributed in the whole microsphere volume. The detailed information about M1N_Pt and M2N_Pt complex structure was provided by XPS and FIR analysis. In both cases the analysis of the XPS spectra (Table A in supp. inf.) confirmed that platinum occurred only in the form of Pt(II). Binding energies observed for Cl, C, O and Si were in accordance with earlier data [16,32] (Table A supp. inf.) In both complexes binding energies observed for N pointed to the presence of the NH4 + structure or hydrogen bonds [33,34] (Fig. 5 ). The analysis O1s XPS (signal BE 533.5, Table A, Fig. A in supp. inf.) indicates the presence of water which suggests the existence of hydrogen bonds. It is also confirmed by a simple simulation DFT (Scheme A supp. inf.), which proves that the structure in which platinum is coordinated to nitrogen by a hydrogen bonded molecule of water is more stable. A far IR spectroscopy confirmed existence of Pt-N and Pt-Cl bonds. The characteristic bands with maxima around 330cm−1 belonged to Pt-Cl and the bands at 208, 235, 260cm−1 originated from Pt-N [35–37] (Fig. C supp. inf.). 3.4 Studies of the hydrosilylation reaction The hydrosilylation is the most important reaction in silicone industry and the platinum catalysts are most commonly used. Hence the choice of model reaction was obvious. Hydrosilylation of dimethylphenylsilane with phenylacetylene can give a whole range of products and therefore may be used for the examining of the catalyst selectivity (Scheme 2 ). Activity and selectivity of the reaction was determined by the GC analysis of samples withdrawn from the reaction system. After the reaction, the catalyst was separated from the mixture, washed with acetone, dried and reused. Catalytic activities of M1N_Pt, M2N_Pt and M1N_Pt after reduction of platinum to Pt(0) (M1N_PtR) were compared to those of K2PtCl4 and Karstedt complexes. The activity of M1N_Pt and M2N_Pt complexes significantly increased in consecutive cycles (Fig. 6 , Table 1). Instead, M1N_PtR was active at a high level in all cycles (Fig. 6). These changes of activities were not related to the oxidation state of platinum which was confirmed by Pt XPS analysis of the catalysts before and after five cycles of the reaction (Table A supp. inf.). The reason for this strange behaviour was probably the formation of the hydrogen bonds between water and nitrogen as mentioned above (see also supp. inf., Scheme A). These structures can be created during the immobilization process and are less active. Additionally, annealing of the catalyst at a temperature above 100°C under vacuum for a several hours also increases the activity of the hydrosilylation reaction (Fig. B supp. inf.), as this operation removes water from the complex. However, after the formation of the final structure of complex the activity remains constant (Fig. 6, Table 1 and Table B in supp. inf.). The SEM-EDX analysis determined a loss of platinum for subsequent cycles, and showed a gradual loss of platinum during subsequent cycles of the reaction (∼20% after 5 cycles). The greatest loss was observed in the case of the catalyst M2N_Ptr (>40% after five cycles). The catalytic activity of the heterogenized platinum complex was comparable to that of K2PtCl4. On the other hand the homogeneous Karstedt catalyst was much more active than the others. The use of phenylacetylene as the reactant in the hydrosilylation provides information about the selectivity of the adopted platinum complex. In this reaction at least four main products may be formed: dimethylphenylstyrylsilane (cis and trans form), dimethylphenyl(1-phenylvinyl)silane and a product of the consecutive addition to olefin bond. The ratio of trans dimethylphenylstyrylsilane to dimethylphenyl(1-phenylvinyl)silane was about 70:30 for all the three used catalysts. In the cases of M2N_Ptr catalyst we also observed the formation of the consecutive addition product (Scheme 2, Table 1) which is in accordance with the results obtained for Karstedt catalyst. We also observed the consecutive addition product using M2N_Pt catalyst but only in the last two cycles, which may indicate a gradual reduction of platinum in subsequent cycles. The selectivity of the studied heterogenized catalysts is different from that observed for K2PtCl4 and Karstedt catalysts where the ratio of the obtained α and β-(Z) products of the addition is about 50:50. 3.5 Studies of the hydrogenation reaction 3.5.1 Substrate conversion The commonly used hydrogenation reaction of cinnamaldehyde was chosen as the second model catalytic reaction for the testing of activity and selectivity of the platinum heterogenized on microspheres (Scheme 3 ). The catalyst activity was compared to that of K2PtCl4 and Karstedt catalyst. The reaction was performed under the fixed conditions and the conversion and ratio of the products was compared in five cycles of the reaction. In the case of M1N_Pt catalyst the full conversion of cinnamaldehyde in the experimental runs was achieved in 60–90min (Fig. 7 ). The rate of substrate conversion in the subsequent cycles slowly decreased which could be caused by gradual leaching of the platinum from the complex. Moreover, the catalytic activity of heterogenized platinum complex was comparable to those operating in the presence of K2PtCl4 or Karstedt catalyst, see Table 2 . The opposite effect appeared when M2N_Pt catalyst was used. In any of the five cycles of reaction after 6h the full conversion of cinnamaldehyde was not achieved. In all the five cycles after a 120min conversion was only at the level of about 25–35%, although the rate of reaction gradually increased in subsequent cycles. 3.5.2 Analysis of products Hydrogenation of cinnamaldehyde is a commonly used model for testing various catalysts, because it provides information about the regioselectivity in the hydrogenation of olefinic and carbonyl functional groups. In this reaction three main products may be formed: hydrocinnamaldehyde (HCA), cinnamyl alcohol (CA), and γ-phenylpropanol (PP). Yields of these products depend on the type of catalyst, catalyst support, co-catalyst and reaction conditions [38–41]. Using our platinum catalysts in the cinnamaldehyde hydrogenation reaction we observed two major products HCA and PP. The chemoselectivity of reactions was not changed with consecutive cycles (Table 2). The ratio of the HCA:PP was as 60:40 for the M1N_Pt catalyst and 77:21 for the M2N_Pt catalyst. In the case of M2N_Pt catalyst the formation of a small amount of cinnamyl alcohol (c.a. 2%) was observed after 6h. The reaction selectivity using K2PtCl4 or Karstedt catalyst was significantly different from that using platinum on microspheres. The formation of products was followed together with the conversion of cinamaldehyde. PP was expected to arise as a consecutive product of the transformation of HCA and/or CA (Scheme 3). However, the kinetic runs displayed in Fig. 8 clearly showed that PP and HCA are formed in parallel. A very rapid transformation of CA into PP was excluded (see Fig. D in sup. inf.). Therefore the most of PP is formed directly from cinnamaldehyde without the intermediacy of CA and HCA according to the mechanistic pathway analogous to that found for the hydrogenation of cinnamaldehyde catalysed by palladium [29]. The key intermediate in this mechanism is complex III (Scheme 4 ), which may be transformed to PP or HCA. 4 Conclusions Magnetic and non-magnetic polysiloxanes microspheres obtained by the emulsion process of PHMS and containing a large number of SiOH groups may be efficiently functionalized by reactions of N-(2-aminoethyl)-3-aminopropylmethyldimethoxysilane with the SiOH groups. The nitrogen chelating groups pendant to polysiloxanes chain on these microspheres may serve as ligands for the effective formation of platinum complexes. This new Platinum(II) catalyst, immobilized on the polysiloxane microspheres, shows a high catalytic activity in hydrosilylation and hydrogenation reactions. This complex is stable under the reaction conditions and may be reused. The Pt(0) form of this catalyst, which may be generated by reducing the Pt(II) complex with sodium borohydride, is also a stable and effective catalyst. The Pt(II) and Pt(0) catalysts showed excellent conversion and recyclability in the hydrosilylation of dimethylphenylsilane and Pt(II) in the hydrogenation of cinnamaldehyde. The selectivity towards the formation of β(Z) substituted compound is achieved in the hydrosilylation process. A fairly high yield of hydrocinnamaldehyde may be obtained in the hydrogenation of cinnamaldehyde. The complex with Pt(0) form was more active but less selective than platinum (II). The influence of the presence of iron nanoparticles is observed. The magnetic complex is slightly less active in the hydrogenation process than the platinum on microspheres without iron. Acknowledgement The research was supported by NSC (National Science Centre), Grant no. 2012/07/N/ST5/01980. Appendix A Supplementary data Supplementary data associated with this article can be found, in the online version, at http://dx.doi.org/10.1016/j.molcata.2016.09.016. Appendix A Supplementary data The following is Supplementary data to this article: References [1] Y. Nakajima S. Shimada RSC Adv. 5 2015 20603 20616 [2] F. Nerozzi Platinum Met. Rev. 56 2012 236 241 [3] J. Kijeński P. Winiarek Appl. Catal. A 193 2000 L1 L4 [4] D. Troegel J. Stohrer Coord. Chem. Rev. 255 2011 1440 1459 [5] B. Marciniec Hydrosilylation. A Comprehensive Review on Recent Advances 2009 Springer Netherlands [6] L.A. Saudan Acc. Chem. Res. 40 2007 1309 1319 [7] K. Weissermel H.-J. Arpe Industrial Organic Chemistry 3rd completely revised edition 1997 Wiley-VCH Verlag GmbH Weinheim, Germany [8] R.G. Jones W. Ando J. Chojnowski Silicon-Containing Polymers. The Science and Technology of Their Synthesis and Applications 2000 Kluwer Academic Publishers Dordrecht [9] R. Merget R. Kulzer A. Dierkes-Globisch R. Breitstadt A. Gebler A. Kniffka S. Artelt H.-P. Koenig F. Alt R. Vormberg X. Baur G. Schultze-Werninghaus J. Allergy Clin. Immunol. 105 2000 364 370 [10] G. Challa J. Mol. Catal. 21 1983 1 16 [11] C.A. McNamara M.J. Dixon M. Bradley Chem. Rev. 102 2002 3275 3300 [12] M. Benaglia A. Puglisi F. Cozzi Chem. Rev. 103 2003 3401 3430 [13] D.E. Bergbreiter ACS Macro Lett. 3 2014 260 265 [14] G. Zhao Z. Chai Insoluble Resin-Supported Catalysts, Recoverable and Recyclable Catalysts 2009 John Wiley & Sons Ltd 49 75 [15] J.F.R.S. Chatt Platinum Met. Rev. 13 1969 9 14 [16] M. Cypryk P. Pospiech K. Strzelec K. Wasikowska J.W. Sobczak J. Mol. Catal. A: Chem. 319 2010 30 38 [17] Z. Dong G. Yu X. Le New J. Chem. 39 2015 8623 8629 [18] H. Yang S. Li X. Wang F. Zhang X. Zhong Z. Dong J. Ma J. Mol. Catal. A: Chem. 363–364 2012 404 410 [19] J. Wang Z.-H. Hu Y.-X. Miao W.-C. Li Gold Bull. 47 2013 95 101 [20] Y.-H. Chen L.-L. Chen N.-C. Shang J. Hazard. Mater. 172 2009 20 29 [21] Z. Xueping J. Wanquan Z. Yufeng X. Shouhu P. Chao Z. Luhang G. Xinglong Nanotechnology 22 2011 5701 [22] H. Zhao J. Xu T. Wang Appl. Catal. A 502 2015 188 194 [23] Y. Huang L. Yang M. Huang J. Wang L. Xu W. Li H. Zhou X. Sun H. Xing H. Liu Particuology 22 2015 128 133 [24] L. Zhou J. Xu X. Liang Z. Liu J. Hazard. Mater. 182 2010 518 524 [25] W. Fortuniak J. Chojnowski S. Slomkowski A. Nyczyk-Malinowska P. Pospiech U. Mizerska Mater. Chem. Phys. 155 2015 83 91 [26] U. Mizerska W. Fortuniak P. Pospiech A. Sobczak J. Chojnowski S. Slomkowski Polym. Adv. Technol. 26 2015 855 864 [27] U. Mizerska W. Fortuniak P. Pospiech J. Chojnowski S. Slomkowski J. Inorg. Organomet. Polym. Mater. 25 2015 507 514 [28] U. Laska C.G. Frost P.K. Plucinski G.J. Price Catal. Lett. 122 2007 68 75 [29] P. Pospiech J. Chojnowski U. Mizerska T. Makowski K. Strzelec N. Sienkiewicz Appl. Organomet. Chem. 30 2016 399 407 [30] W. Fortuniak J. Chojnowski S. Slomkowski P. Pospiech J. Kurjata Polymer 54 2013 3156 3165 [31] J.M. Zhou R.X. Zhou J.Y. Mo S.F. Zhao X.M. Zheng J. Mol. Catal. A: Chem. 178 2002 289 292 [32] NIST X-ray Photoelectron Spectroscopy Database, v. 3.4, (2008). [33] I.M. El Nahhal M.M. Chehimi C. Cordier G. Dodin J. NonCryst. Solids 275 2000 142 146 [34] N. Graf E. Yegen T. Gross A. Lippitz W. Weigel S. Krakert A. Terfort W.E.S. Unger Surf. Sci. 603 2009 2849 2860 [35] D.M. Adams P.J. Chandler R.G. Churchill J. Chem. Soc. A 1967 1272 1274 [36] L. Zhang H. Wei Y. Zhang Z. Guo L. Zhu Spectrochim. Acta A 58 2002 217 223 [37] R. Wysokiński K. Hernik R. Szostak D. Michalska Chem. Phys. 333 2007 37 48 [38] J. Shi R. Nie P. Chen Z. Hou Catal. Commun. 41 2013 101 105 [39] K. Strzelec N. Bączek Open Chem. 13 2015 10 [40] Z. Tian Q. Li J. Hou Y. Li S. Ai Catal. Sci. Technol. 6 2016 703 707 [41] Q. Wu C. Zhang B. Zhang X. Li Z. Ying T. Liu W. Lin Y. Yu H. Cheng F. Zhao J. Colloid Interface Sci. 463 2016 75 82",
      "scopus-id": "84988421053",
      "coredata": {
        "eid": "1-s2.0-S1381116916303880",
        "dc:description": "Elastic and durable, magnetic and non-magnetic polysiloxane microspheres containing a large number of SiOH groups were obtained by a simple and cheap emulsion process. N-chelating ligands were grafted on these microspheres by the condensation of their silanol groups with N-(2-aminoethyl)-3-aminopropylmethyldimethoxysilane. A platinum catalyst was immobilized on these microspheres. At every stage of the microspheres modification they were characterized by spectroscopy methods as well as by SEM microscopy. The catalyst appears only in the form of Pt(II) complex. The Pt(0) form was obtained by reducing this complex using sodium borohydride. The catalytic activity of the obtained catalysts was compared using model reactions, which were the hydrosilylation of phenylacetylene and hydrogenation of cinnamaldehyde. In both of these reactions the new platinum catalysts were recycled several times with the retention of their high catalytic activity. The hydrogenation of cinnamaldehyde leads to two products hydrocinnamaldehyde (HCA) and 3-phenyl-1-propanol (PP). The comparison of the rate of formation of the products with the rate of HCA and cinnamyl alcohol (CA) hydrogenation indicates that neither HCA nor CA are intermediate in the main pathway of the formation of PP.",
        "openArchiveArticle": "false",
        "prism:coverDate": "2016-12-01",
        "openaccessUserLicense": null,
        "prism:aggregationType": "Journal",
        "prism:url": "https://api.elsevier.com/content/article/pii/S1381116916303880",
        "dc:creator": [
          {
            "@_fa": "true",
            "$": "Pospiech, Piotr"
          },
          {
            "@_fa": "true",
            "$": "Chojnowski, Julian"
          },
          {
            "@_fa": "true",
            "$": "Mizerska, Urszula"
          },
          {
            "@_fa": "true",
            "$": "Cempura, Grzegorz"
          }
        ],
        "link": [
          {
            "@_fa": "true",
            "@rel": "self",
            "@href": "https://api.elsevier.com/content/article/pii/S1381116916303880"
          },
          {
            "@_fa": "true",
            "@rel": "scidir",
            "@href": "https://www.sciencedirect.com/science/article/pii/S1381116916303880"
          }
        ],
        "dc:format": "application/json",
        "openaccessType": null,
        "pii": "S1381-1169(16)30388-0",
        "prism:volume": "424",
        "prism:publisher": "Elsevier B.V.",
        "dc:title": "Platinum catalyst on polysiloxane microspheres with N-chelating groups",
        "prism:copyright": "© 2016 Elsevier B.V. All rights reserved.",
        "openaccess": "0",
        "prism:issn": "13811169",
        "dcterms:subject": [
          {
            "@_fa": "true",
            "$": "Polysiloxane microspheres"
          },
          {
            "@_fa": "true",
            "$": "Heterogeneous Pt catalysis"
          },
          {
            "@_fa": "true",
            "$": "Cinnamaldehyde hydrogenation"
          },
          {
            "@_fa": "true",
            "$": "Hydrosilylation,"
          }
        ],
        "openaccessArticle": "false",
        "prism:publicationName": "Journal of Molecular Catalysis A: Chemical",
        "openaccessSponsorType": null,
        "prism:pageRange": "402-411",
        "prism:endingPage": "411",
        "pubType": "fla",
        "prism:coverDisplayDate": "1 December 2016",
        "prism:doi": "10.1016/j.molcata.2016.09.016",
        "prism:startingPage": "402",
        "dc:identifier": "doi:10.1016/j.molcata.2016.09.016",
        "openaccessSponsorName": null
      },
      "objects": {
        "object": [
          {
            "@category": "thumbnail",
            "@height": "88",
            "@width": "219",
            "@_fa": "true",
            "$": "https://api.elsevier.com/content/object/eid/1-s2.0-S1381116916303880-fx1.sml?httpAccept=%2A%2F%2A",
            "@multimediatype": "GIF image file",
            "@type": "IMAGE-THUMBNAIL",
            "@size": "5210",
            "@ref": "fx1",
            "@mimetype": "image/gif"
          },
          {
            "@category": "thumbnail",
            "@height": "111",
            "@width": "219",
            "@_fa": "true",
            "$": "https://api.elsevier.com/content/object/eid/1-s2.0-S1381116916303880-gr1.sml?httpAccept=%2A%2F%2A",
            "@multimediatype": "GIF image file",
            "@type": "IMAGE-THUMBNAIL",
            "@size": "5608",
            "@ref": "gr1",
            "@mimetype": "image/gif"
          },
          {
            "@category": "thumbnail",
            "@height": "164",
            "@width": "112",
            "@_fa": "true",
            "$": "https://api.elsevier.com/content/object/eid/1-s2.0-S1381116916303880-gr2.sml?httpAccept=%2A%2F%2A",
            "@multimediatype": "GIF image file",
            "@type": "IMAGE-THUMBNAIL",
            "@size": "9210",
            "@ref": "gr2",
            "@mimetype": "image/gif"
          },
          {
            "@category": "thumbnail",
            "@height": "114",
            "@width": "219",
            "@_fa": "true",
            "$": "https://api.elsevier.com/content/object/eid/1-s2.0-S1381116916303880-gr3.sml?httpAccept=%2A%2F%2A",
            "@multimediatype": "GIF image file",
            "@type": "IMAGE-THUMBNAIL",
            "@size": "6135",
            "@ref": "gr3",
            "@mimetype": "image/gif"
          },
          {
            "@category": "thumbnail",
            "@height": "164",
            "@width": "146",
            "@_fa": "true",
            "$": "https://api.elsevier.com/content/object/eid/1-s2.0-S1381116916303880-gr4.sml?httpAccept=%2A%2F%2A",
            "@multimediatype": "GIF image file",
            "@type": "IMAGE-THUMBNAIL",
            "@size": "19427",
            "@ref": "gr4",
            "@mimetype": "image/gif"
          },
          {
            "@category": "thumbnail",
            "@height": "164",
            "@width": "142",
            "@_fa": "true",
            "$": "https://api.elsevier.com/content/object/eid/1-s2.0-S1381116916303880-gr5.sml?httpAccept=%2A%2F%2A",
            "@multimediatype": "GIF image file",
            "@type": "IMAGE-THUMBNAIL",
            "@size": "4671",
            "@ref": "gr5",
            "@mimetype": "image/gif"
          },
          {
            "@category": "thumbnail",
            "@height": "163",
            "@width": "77",
            "@_fa": "true",
            "$": "https://api.elsevier.com/content/object/eid/1-s2.0-S1381116916303880-gr6.sml?httpAccept=%2A%2F%2A",
            "@multimediatype": "GIF image file",
            "@type": "IMAGE-THUMBNAIL",
            "@size": "3894",
            "@ref": "gr6",
            "@mimetype": "image/gif"
          },
          {
            "@category": "thumbnail",
            "@height": "76",
            "@width": "219",
            "@_fa": "true",
            "$": "https://api.elsevier.com/content/object/eid/1-s2.0-S1381116916303880-gr7.sml?httpAccept=%2A%2F%2A",
            "@multimediatype": "GIF image file",
            "@type": "IMAGE-THUMBNAIL",
            "@size": "5352",
            "@ref": "gr7",
            "@mimetype": "image/gif"
          },
          {
            "@category": "thumbnail",
            "@height": "150",
            "@width": "219",
            "@_fa": "true",
            "$": "https://api.elsevier.com/content/object/eid/1-s2.0-S1381116916303880-gr8.sml?httpAccept=%2A%2F%2A",
            "@multimediatype": "GIF image file",
            "@type": "IMAGE-THUMBNAIL",
            "@size": "6041",
            "@ref": "gr8",
            "@mimetype": "image/gif"
          },
          {
            "@category": "thumbnail",
            "@height": "111",
            "@width": "219",
            "@_fa": "true",
            "$": "https://api.elsevier.com/content/object/eid/1-s2.0-S1381116916303880-sc1.sml?httpAccept=%2A%2F%2A",
            "@multimediatype": "GIF image file",
            "@type": "IMAGE-THUMBNAIL",
            "@size": "3807",
            "@ref": "sc1",
            "@mimetype": "image/gif"
          },
          {
            "@category": "thumbnail",
            "@height": "146",
            "@width": "219",
            "@_fa": "true",
            "$": "https://api.elsevier.com/content/object/eid/1-s2.0-S1381116916303880-sc2.sml?httpAccept=%2A%2F%2A",
            "@multimediatype": "GIF image file",
            "@type": "IMAGE-THUMBNAIL",
            "@size": "2734",
            "@ref": "sc2",
            "@mimetype": "image/gif"
          },
          {
            "@category": "thumbnail",
            "@height": "110",
            "@width": "219",
            "@_fa": "true",
            "$": "https://api.elsevier.com/content/object/eid/1-s2.0-S1381116916303880-sc3.sml?httpAccept=%2A%2F%2A",
            "@multimediatype": "GIF image file",
            "@type": "IMAGE-THUMBNAIL",
            "@size": "3076",
            "@ref": "sc3",
            "@mimetype": "image/gif"
          },
          {
            "@category": "thumbnail",
            "@height": "151",
            "@width": "219",
            "@_fa": "true",
            "$": "https://api.elsevier.com/content/object/eid/1-s2.0-S1381116916303880-sc4.sml?httpAccept=%2A%2F%2A",
            "@multimediatype": "GIF image file",
            "@type": "IMAGE-THUMBNAIL",
            "@size": "4084",
            "@ref": "sc4",
            "@mimetype": "image/gif"
          },
          {
            "@category": "standard",
            "@height": "200",
            "@width": "500",
            "@_fa": "true",
            "$": "https://api.elsevier.com/content/object/eid/1-s2.0-S1381116916303880-fx1.jpg?httpAccept=%2A%2F%2A",
            "@multimediatype": "JPEG image file",
            "@type": "IMAGE-DOWNSAMPLED",
            "@size": "19928",
            "@ref": "fx1",
            "@mimetype": "image/jpeg"
          },
          {
            "@category": "standard",
            "@height": "362",
            "@width": "715",
            "@_fa": "true",
            "$": "https://api.elsevier.com/content/object/eid/1-s2.0-S1381116916303880-gr1.jpg?httpAccept=%2A%2F%2A",
            "@multimediatype": "JPEG image file",
            "@type": "IMAGE-DOWNSAMPLED",
            "@size": "48633",
            "@ref": "gr1",
            "@mimetype": "image/jpeg"
          },
          {
            "@category": "standard",
            "@height": "551",
            "@width": "376",
            "@_fa": "true",
            "$": "https://api.elsevier.com/content/object/eid/1-s2.0-S1381116916303880-gr2.jpg?httpAccept=%2A%2F%2A",
            "@multimediatype": "JPEG image file",
            "@type": "IMAGE-DOWNSAMPLED",
            "@size": "46370",
            "@ref": "gr2",
            "@mimetype": "image/jpeg"
          },
          {
            "@category": "standard",
            "@height": "342",
            "@width": "659",
            "@_fa": "true",
            "$": "https://api.elsevier.com/content/object/eid/1-s2.0-S1381116916303880-gr3.jpg?httpAccept=%2A%2F%2A",
            "@multimediatype": "JPEG image file",
            "@type": "IMAGE-DOWNSAMPLED",
            "@size": "46011",
            "@ref": "gr3",
            "@mimetype": "image/jpeg"
          },
          {
            "@category": "standard",
            "@height": "421",
            "@width": "376",
            "@_fa": "true",
            "$": "https://api.elsevier.com/content/object/eid/1-s2.0-S1381116916303880-gr4.jpg?httpAccept=%2A%2F%2A",
            "@multimediatype": "JPEG image file",
            "@type": "IMAGE-DOWNSAMPLED",
            "@size": "78212",
            "@ref": "gr4",
            "@mimetype": "image/jpeg"
          },
          {
            "@category": "standard",
            "@height": "434",
            "@width": "376",
            "@_fa": "true",
            "$": "https://api.elsevier.com/content/object/eid/1-s2.0-S1381116916303880-gr5.jpg?httpAccept=%2A%2F%2A",
            "@multimediatype": "JPEG image file",
            "@type": "IMAGE-DOWNSAMPLED",
            "@size": "26873",
            "@ref": "gr5",
            "@mimetype": "image/jpeg"
          },
          {
            "@category": "standard",
            "@height": "797",
            "@width": "376",
            "@_fa": "true",
            "$": "https://api.elsevier.com/content/object/eid/1-s2.0-S1381116916303880-gr6.jpg?httpAccept=%2A%2F%2A",
            "@multimediatype": "JPEG image file",
            "@type": "IMAGE-DOWNSAMPLED",
            "@size": "58670",
            "@ref": "gr6",
            "@mimetype": "image/jpeg"
          },
          {
            "@category": "standard",
            "@height": "235",
            "@width": "678",
            "@_fa": "true",
            "$": "https://api.elsevier.com/content/object/eid/1-s2.0-S1381116916303880-gr7.jpg?httpAccept=%2A%2F%2A",
            "@multimediatype": "JPEG image file",
            "@type": "IMAGE-DOWNSAMPLED",
            "@size": "43606",
            "@ref": "gr7",
            "@mimetype": "image/jpeg"
          },
          {
            "@category": "standard",
            "@height": "257",
            "@width": "376",
            "@_fa": "true",
            "$": "https://api.elsevier.com/content/object/eid/1-s2.0-S1381116916303880-gr8.jpg?httpAccept=%2A%2F%2A",
            "@multimediatype": "JPEG image file",
            "@type": "IMAGE-DOWNSAMPLED",
            "@size": "21012",
            "@ref": "gr8",
            "@mimetype": "image/jpeg"
          },
          {
            "@category": "standard",
            "@height": "323",
            "@width": "640",
            "@_fa": "true",
            "$": "https://api.elsevier.com/content/object/eid/1-s2.0-S1381116916303880-sc1.jpg?httpAccept=%2A%2F%2A",
            "@multimediatype": "JPEG image file",
            "@type": "IMAGE-DOWNSAMPLED",
            "@size": "24536",
            "@ref": "sc1",
            "@mimetype": "image/jpeg"
          },
          {
            "@category": "standard",
            "@height": "401",
            "@width": "602",
            "@_fa": "true",
            "$": "https://api.elsevier.com/content/object/eid/1-s2.0-S1381116916303880-sc2.jpg?httpAccept=%2A%2F%2A",
            "@multimediatype": "JPEG image file",
            "@type": "IMAGE-DOWNSAMPLED",
            "@size": "15343",
            "@ref": "sc2",
            "@mimetype": "image/jpeg"
          },
          {
            "@category": "standard",
            "@height": "361",
            "@width": "715",
            "@_fa": "true",
            "$": "https://api.elsevier.com/content/object/eid/1-s2.0-S1381116916303880-sc3.jpg?httpAccept=%2A%2F%2A",
            "@multimediatype": "JPEG image file",
            "@type": "IMAGE-DOWNSAMPLED",
            "@size": "24627",
            "@ref": "sc3",
            "@mimetype": "image/jpeg"
          },
          {
            "@category": "standard",
            "@height": "518",
            "@width": "753",
            "@_fa": "true",
            "$": "https://api.elsevier.com/content/object/eid/1-s2.0-S1381116916303880-sc4.jpg?httpAccept=%2A%2F%2A",
            "@multimediatype": "JPEG image file",
            "@type": "IMAGE-DOWNSAMPLED",
            "@size": "38036",
            "@ref": "sc4",
            "@mimetype": "image/jpeg"
          },
          {
            "@category": "high",
            "@height": "886",
            "@width": "2213",
            "@_fa": "true",
            "$": "https://api.elsevier.com/content/object/eid/1-s2.0-S1381116916303880-fx1_lrg.jpg?httpAccept=%2A%2F%2A",
            "@multimediatype": "JPEG image file",
            "@type": "IMAGE-HIGH-RES",
            "@size": "133541",
            "@ref": "fx1",
            "@mimetype": "image/jpeg"
          },
          {
            "@category": "high",
            "@height": "1604",
            "@width": "3167",
            "@_fa": "true",
            "$": "https://api.elsevier.com/content/object/eid/1-s2.0-S1381116916303880-gr1_lrg.jpg?httpAccept=%2A%2F%2A",
            "@multimediatype": "JPEG image file",
            "@type": "IMAGE-HIGH-RES",
            "@size": "392020",
            "@ref": "gr1",
            "@mimetype": "image/jpeg"
          },
          {
            "@category": "high",
            "@height": "2444",
            "@width": "1667",
            "@_fa": "true",
            "$": "https://api.elsevier.com/content/object/eid/1-s2.0-S1381116916303880-gr2_lrg.jpg?httpAccept=%2A%2F%2A",
            "@multimediatype": "JPEG image file",
            "@type": "IMAGE-HIGH-RES",
            "@size": "930372",
            "@ref": "gr2",
            "@mimetype": "image/jpeg"
          },
          {
            "@category": "high",
            "@height": "1514",
            "@width": "2917",
            "@_fa": "true",
            "$": "https://api.elsevier.com/content/object/eid/1-s2.0-S1381116916303880-gr3_lrg.jpg?httpAccept=%2A%2F%2A",
            "@multimediatype": "JPEG image file",
            "@type": "IMAGE-HIGH-RES",
            "@size": "369048",
            "@ref": "gr3",
            "@mimetype": "image/jpeg"
          },
          {
            "@category": "high",
            "@height": "1868",
            "@width": "1667",
            "@_fa": "true",
            "$": "https://api.elsevier.com/content/object/eid/1-s2.0-S1381116916303880-gr4_lrg.jpg?httpAccept=%2A%2F%2A",
            "@multimediatype": "JPEG image file",
            "@type": "IMAGE-HIGH-RES",
            "@size": "1103944",
            "@ref": "gr4",
            "@mimetype": "image/jpeg"
          },
          {
            "@category": "high",
            "@height": "1924",
            "@width": "1667",
            "@_fa": "true",
            "$": "https://api.elsevier.com/content/object/eid/1-s2.0-S1381116916303880-gr5_lrg.jpg?httpAccept=%2A%2F%2A",
            "@multimediatype": "JPEG image file",
            "@type": "IMAGE-HIGH-RES",
            "@size": "237991",
            "@ref": "gr5",
            "@mimetype": "image/jpeg"
          },
          {
            "@category": "high",
            "@height": "3535",
            "@width": "1667",
            "@_fa": "true",
            "$": "https://api.elsevier.com/content/object/eid/1-s2.0-S1381116916303880-gr6_lrg.jpg?httpAccept=%2A%2F%2A",
            "@multimediatype": "JPEG image file",
            "@type": "IMAGE-HIGH-RES",
            "@size": "470832",
            "@ref": "gr6",
            "@mimetype": "image/jpeg"
          },
          {
            "@category": "high",
            "@height": "1042",
            "@width": "3000",
            "@_fa": "true",
            "$": "https://api.elsevier.com/content/object/eid/1-s2.0-S1381116916303880-gr7_lrg.jpg?httpAccept=%2A%2F%2A",
            "@multimediatype": "JPEG image file",
            "@type": "IMAGE-HIGH-RES",
            "@size": "325812",
            "@ref": "gr7",
            "@mimetype": "image/jpeg"
          },
          {
            "@category": "high",
            "@height": "1139",
            "@width": "1667",
            "@_fa": "true",
            "$": "https://api.elsevier.com/content/object/eid/1-s2.0-S1381116916303880-gr8_lrg.jpg?httpAccept=%2A%2F%2A",
            "@multimediatype": "JPEG image file",
            "@type": "IMAGE-HIGH-RES",
            "@size": "143725",
            "@ref": "gr8",
            "@mimetype": "image/jpeg"
          },
          {
            "@category": "high",
            "@height": "1431",
            "@width": "2833",
            "@_fa": "true",
            "$": "https://api.elsevier.com/content/object/eid/1-s2.0-S1381116916303880-sc1_lrg.jpg?httpAccept=%2A%2F%2A",
            "@multimediatype": "JPEG image file",
            "@type": "IMAGE-HIGH-RES",
            "@size": "181787",
            "@ref": "sc1",
            "@mimetype": "image/jpeg"
          },
          {
            "@category": "high",
            "@height": "1778",
            "@width": "2667",
            "@_fa": "true",
            "$": "https://api.elsevier.com/content/object/eid/1-s2.0-S1381116916303880-sc2_lrg.jpg?httpAccept=%2A%2F%2A",
            "@multimediatype": "JPEG image file",
            "@type": "IMAGE-HIGH-RES",
            "@size": "130428",
            "@ref": "sc2",
            "@mimetype": "image/jpeg"
          },
          {
            "@category": "high",
            "@height": "1597",
            "@width": "3167",
            "@_fa": "true",
            "$": "https://api.elsevier.com/content/object/eid/1-s2.0-S1381116916303880-sc3_lrg.jpg?httpAccept=%2A%2F%2A",
            "@multimediatype": "JPEG image file",
            "@type": "IMAGE-HIGH-RES",
            "@size": "190192",
            "@ref": "sc3",
            "@mimetype": "image/jpeg"
          },
          {
            "@category": "high",
            "@height": "2292",
            "@width": "3333",
            "@_fa": "true",
            "$": "https://api.elsevier.com/content/object/eid/1-s2.0-S1381116916303880-sc4_lrg.jpg?httpAccept=%2A%2F%2A",
            "@multimediatype": "JPEG image file",
            "@type": "IMAGE-HIGH-RES",
            "@size": "282399",
            "@ref": "sc4",
            "@mimetype": "image/jpeg"
          },
          {
            "@category": "standard",
            "@_fa": "true",
            "$": "https://api.elsevier.com/content/object/eid/1-s2.0-S1381116916303880-mmc1.docx?httpAccept=%2A%2F%2A",
            "@multimediatype": "Microsoft Word file",
            "@type": "APPLICATION",
            "@size": "353957",
            "@ref": "mmc1",
            "@mimetype": "application/word"
          }
        ]
      },
      "link": {
        "@rel": "abstract",
        "@href": "https://api.elsevier.com/content/abstract/scopus_id/84988421053"
      }
    }
  }
}