{
  "metadata": {
    "title": "Silver nanoparticles stabilized by a polyaminocyclodextrin as catalysts for the reduction of nitroaromatic compounds",
    "authors": "; ; ",
    "journal": "Journal of Molecular Catalysis A: Chemical",
    "date": "2015-11-30",
    "doi": "10.1016/j.molcata.2015.07.031",
    "abstract": "",
    "uri": "https://api.elsevier.com/content/article/pii/S138111691530042X",
    "pii": "S138111691530042X"
  },
  "fulltext": {
    "full-text-retrieval-response": {
      "scopus-eid": "2-s2.0-84940197146",
      "originalText": "serial JL 271358 291210 291744 291790 291809 31 Journal of Molecular Catalysis A: Chemical JOURNALMOLECULARCATALYSISACHEMICAL 2015-08-01 2015-08-01 2015-08-27 2015-08-27 2025-08-22T22:55:52 1-s2.0-S138111691530042X S1381-1169(15)30042-X S138111691530042X 10.1016/j.molcata.2015.07.031 S300 S300.3 FULL-TEXT 1-s2.0-S1381116915X00100 2025-08-22T22:47:37.538093Z 0 0 20151101 20151130 2015 2015-08-01T16:38:27.884666Z absattachment articleinfo articletitlenorm authfirstinitialnorm authfirstsurnamenorm cid cids contenttype copyright crossmark dateloaded dateloadedtxt datesearch datesort dateupdated dco docsubtype doctype doi eid ewtransactionid hubeid indexeddate issn issnnorm itemstage itemtransactionid itemweight openaccess openarchive pg pgfirst pglast pii piinorm pubdateend pubdatestart pubdatetxt pubyr sectiontitle sortorder srctitle srctitlenorm srctype ssids alllist content subj subheadings suppl tomb volfirst volissue volumelist webpdf webpdfpagecount yearnav figure table e-component body mmlmath acknowledge affil appendices articletitle auth authfirstini authfull authkeywords authlast highlightsabst primabst ref specialabst 1381-1169 13811169 true 408 408 C Volume 408 31 250 261 250 261 201511 November 2015 2015-11-01 2015-11-30 2015 Regular Papers article fla Copyright © 2015 Elsevier B.V. All rights are reserved, including those for text and data mining, AI training, and similar technologies. SILVERNANOPARTICLESSTABILIZEDBYAPOLYAMINOCYCLODEXTRINCATALYSTSFORREDUCTIONNITROAROMATICCOMPOUNDS RUSSO M 1 Introduction 2 Results and discussion 2.1 Synthesis of the NP catalysts 2.2 Structural and morphological investigation of the NP catalysts 2.3 Kinetic study of the nitroarene reduction 3 Conclusions 4 Experimental 4.1 Materials 4.2 Instrumentation 4.3 Synthesis of Ag-NPs 4.4 Kinetics Acknowledgments Appendix A Supplementary data References PRADHAN 2002 247 257 N ESUMI 2002 402 405 K ESUMI 2004 237 243 K ENDO 2005 602 609 T BANKURA 2012 1159 1165 K YANG 2012 3766 3774 G EISING 2011 11860 11866 R AI 2013 374 377 L PYNE 2013 1 8 S SAHA 2010 2885 2893 S YE 2004 2915 2920 H ZHENG 2002 1252 1255 J HAYAKAWA 2003 5517 5521 K PANDE 2007 10806 10813 S HUANG 2004 14 18 Y GOPALAN 2010 487 494 P ANDRADE 2014 289 297 P LOGANATHAN 2013 5238 5253 B LIU 1999 4304 4305 J LIU 2000 3000 3002 J LIU 2002 5981 5983 J GUO 2014 275 286 Y LI 2008 413 417 X LOMEO 2012 32 39 P GANGULA 2011 15268 15274 A ZENG 2010 30 35 J BINGWA 2015 1 7 N LOMEO 2003 1584 1590 P LOMEO 2007 9163 9171 P LOMEO 2004 9099 9111 P KIM 2015 678 685 B JIANG 2008 4300 4309 X ZHU 2015 37 43 Y VALENTINI 2015 248 255 F SALADINO 2013 10 15 M CAPONETTI 2010 101 107 E SZEJTLI 1998 1743 1753 J WUNDER 2010 8814 8820 S GAO 2007 3720 3722 Y BLOSI 2014 1401 1409 M SIGNORI 2010 17772 17779 A VASENTHKUMAR 2008 82 84 K ZHANG 2007 772 781 J LIN 2014 32 41 F RODRIGUEZACOSTA 2014 J GUELLA 2007 18744 18750 G ZHOU 2008 953 956 Q JANA 2006 41 48 S NARAYANAN 2011 10737 10740 K LI 2010 1806 1812 X LU 1989 1439 1445 T SCHNEIDER 1998 1755 1785 H BONORA 1985 367 369 G TEE 1990 3603 3609 O LOMEO 2002 6039 6045 P LOMEO 2009 2037 2042 P LOMEO 2009 10413 10417 P DANNA 2001 6823 6827 F KOPPEL 1972 4814 4820 D PROVENCHER 1979 201 209 S PROVENCHER 1982 213 227 S RUSSOX2015X250 RUSSOX2015X250X261 RUSSOX2015X250XM RUSSOX2015X250X261XM 2017-08-27T00:00:00Z http://creativecommons.org/licenses/by-nc-nd/4.0/ https://doi.org/10.15223/policy-017 https://doi.org/10.15223/policy-037 https://doi.org/10.15223/policy-012 https://doi.org/10.15223/policy-029 https://doi.org/10.15223/policy-004 item S1381-1169(15)30042-X S138111691530042X 1-s2.0-S138111691530042X 10.1016/j.molcata.2015.07.031 271358 2025-08-22T22:47:37.538093Z 2015-11-01 2015-11-30 1-s2.0-S138111691530042X-main.pdf https://s3-eu-west-1.amazonaws.com/prod-ucs-content-store-eu-west/content/pii:S138111691530042X/MAIN/application/pdf/aaf8dee6e942b68e2a6968bd78d5c4ac/main.pdf main.pdf pdf true 1883403 MAIN 12 1-s2.0-S138111691530042X-main_1.png https://s3-eu-west-1.amazonaws.com/prod-ucs-content-store-eu-west/content/pii:S138111691530042X/PREVIEW/image/png/fea56a3884f862e14b69b33ec5c5cc44/main_1.png main_1.png png 62724 928 656 IMAGE-WEB-PDF 1 1-s2.0-S138111691530042X-fx1.jpg https://s3-eu-west-1.amazonaws.com/prod-ucs-content-store-eu-west/content/pii:S138111691530042X/fx1/DOWNSAMPLED/image/jpeg/41a6621995d664b3cadb1dd1b4c0ba8a/fx1.jpg fx1 true fx1.jpg jpg 24830 200 500 IMAGE-DOWNSAMPLED 1-s2.0-S138111691530042X-gr1.jpg https://s3-eu-west-1.amazonaws.com/prod-ucs-content-store-eu-west/content/pii:S138111691530042X/gr1/DOWNSAMPLED/image/jpeg/f8c6464f892b64919d98db5e9eb792d9/gr1.jpg gr1 gr1.jpg jpg 2969 68 94 IMAGE-DOWNSAMPLED 1-s2.0-S138111691530042X-gr2.jpg https://s3-eu-west-1.amazonaws.com/prod-ucs-content-store-eu-west/content/pii:S138111691530042X/gr2/DOWNSAMPLED/image/jpeg/ae9c441d239f6f9e6606045f1440f9ec/gr2.jpg gr2 gr2.jpg jpg 2008 67 56 IMAGE-DOWNSAMPLED 1-s2.0-S138111691530042X-gr3.jpg https://s3-eu-west-1.amazonaws.com/prod-ucs-content-store-eu-west/content/pii:S138111691530042X/gr3/DOWNSAMPLED/image/jpeg/195480c9640320e6f4608a5d8eb343af/gr3.jpg gr3 gr3.jpg jpg 4212 90 127 IMAGE-DOWNSAMPLED 1-s2.0-S138111691530042X-gr4.jpg https://s3-eu-west-1.amazonaws.com/prod-ucs-content-store-eu-west/content/pii:S138111691530042X/gr4/DOWNSAMPLED/image/jpeg/2976f7f838f28489ae58af5b35c97af2/gr4.jpg gr4 gr4.jpg jpg 11808 176 255 IMAGE-DOWNSAMPLED 1-s2.0-S138111691530042X-gr5.jpg https://s3-eu-west-1.amazonaws.com/prod-ucs-content-store-eu-west/content/pii:S138111691530042X/gr5/DOWNSAMPLED/image/jpeg/b5ebfba96299ca890c3eb43ad70c4139/gr5.jpg gr5 gr5.jpg jpg 6406 111 255 IMAGE-DOWNSAMPLED 1-s2.0-S138111691530042X-gr6.jpg https://s3-eu-west-1.amazonaws.com/prod-ucs-content-store-eu-west/content/pii:S138111691530042X/gr6/DOWNSAMPLED/image/jpeg/7ec9a0d4f3487157ab223f429c5fe585/gr6.jpg gr6 gr6.jpg jpg 4455 118 141 IMAGE-DOWNSAMPLED 1-s2.0-S138111691530042X-gr7.jpg https://s3-eu-west-1.amazonaws.com/prod-ucs-content-store-eu-west/content/pii:S138111691530042X/gr7/DOWNSAMPLED/image/jpeg/ae458266fa4df6fdd1a156361e16c6db/gr7.jpg gr7 gr7.jpg jpg 3524 112 141 IMAGE-DOWNSAMPLED 1-s2.0-S138111691530042X-gr8.jpg https://s3-eu-west-1.amazonaws.com/prod-ucs-content-store-eu-west/content/pii:S138111691530042X/gr8/DOWNSAMPLED/image/jpeg/8859bd8801fe066c7a6001b8209c60e3/gr8.jpg gr8 gr8.jpg jpg 11608 163 254 IMAGE-DOWNSAMPLED 1-s2.0-S138111691530042X-gr9.jpg https://s3-eu-west-1.amazonaws.com/prod-ucs-content-store-eu-west/content/pii:S138111691530042X/gr9/DOWNSAMPLED/image/jpeg/6b35e5cb1fa39b9f78241bf7f8a6e6c8/gr9.jpg gr9 gr9.jpg jpg 3572 118 141 IMAGE-DOWNSAMPLED 1-s2.0-S138111691530042X-sc1.jpg https://s3-eu-west-1.amazonaws.com/prod-ucs-content-store-eu-west/content/pii:S138111691530042X/sc1/DOWNSAMPLED/image/jpeg/883a434e317c78d4d03b58d864842435/sc1.jpg sc1 sc1.jpg jpg 1462 38 69 IMAGE-DOWNSAMPLED 1-s2.0-S138111691530042X-sc2.jpg https://s3-eu-west-1.amazonaws.com/prod-ucs-content-store-eu-west/content/pii:S138111691530042X/sc2/DOWNSAMPLED/image/jpeg/7aed635f546bd0e6fe601dfac9576d63/sc2.jpg sc2 sc2.jpg jpg 2656 45 123 IMAGE-DOWNSAMPLED 1-s2.0-S138111691530042X-sc3.jpg https://s3-eu-west-1.amazonaws.com/prod-ucs-content-store-eu-west/content/pii:S138111691530042X/sc3/DOWNSAMPLED/image/jpeg/6993fd84af71281e0a1a91e93d656110/sc3.jpg sc3 sc3.jpg jpg 8562 115 226 IMAGE-DOWNSAMPLED 1-s2.0-S138111691530042X-sc4.jpg https://s3-eu-west-1.amazonaws.com/prod-ucs-content-store-eu-west/content/pii:S138111691530042X/sc4/DOWNSAMPLED/image/jpeg/c6d07c411b3528d8bd3cc45f474a3548/sc4.jpg sc4 sc4.jpg jpg 2430 47 174 IMAGE-DOWNSAMPLED 1-s2.0-S138111691530042X-sc5.jpg https://s3-eu-west-1.amazonaws.com/prod-ucs-content-store-eu-west/content/pii:S138111691530042X/sc5/DOWNSAMPLED/image/jpeg/a44bfbbe5a819da9f7e0c82712a42d8b/sc5.jpg sc5 sc5.jpg jpg 9252 171 191 IMAGE-DOWNSAMPLED 1-s2.0-S138111691530042X-fx1.sml https://s3-eu-west-1.amazonaws.com/prod-ucs-content-store-eu-west/content/pii:S138111691530042X/fx1/THUMBNAIL/image/gif/6596445a20f343583551e986b449f7e8/fx1.sml fx1 true fx1.sml sml 7348 88 219 IMAGE-THUMBNAIL 1-s2.0-S138111691530042X-gr1.sml https://s3-eu-west-1.amazonaws.com/prod-ucs-content-store-eu-west/content/pii:S138111691530042X/gr1/THUMBNAIL/image/gif/93212122fca33225c435209dff37b5e5/gr1.sml gr1 gr1.sml sml 8702 159 219 IMAGE-THUMBNAIL 1-s2.0-S138111691530042X-gr2.sml https://s3-eu-west-1.amazonaws.com/prod-ucs-content-store-eu-west/content/pii:S138111691530042X/gr2/THUMBNAIL/image/gif/76074f87031199ba796c3aa549544165/gr2.sml gr2 gr2.sml sml 6506 178 149 IMAGE-THUMBNAIL 1-s2.0-S138111691530042X-gr3.sml https://s3-eu-west-1.amazonaws.com/prod-ucs-content-store-eu-west/content/pii:S138111691530042X/gr3/THUMBNAIL/image/gif/4587a4b6ead64fba89074180a4b5ef73/gr3.sml gr3 gr3.sml sml 8755 154 219 IMAGE-THUMBNAIL 1-s2.0-S138111691530042X-gr4.sml https://s3-eu-west-1.amazonaws.com/prod-ucs-content-store-eu-west/content/pii:S138111691530042X/gr4/THUMBNAIL/image/gif/87f0ab512afc722d5c648ad97d1c6ed3/gr4.sml gr4 gr4.sml sml 16754 151 219 IMAGE-THUMBNAIL 1-s2.0-S138111691530042X-gr5.sml https://s3-eu-west-1.amazonaws.com/prod-ucs-content-store-eu-west/content/pii:S138111691530042X/gr5/PUBMED/image/gif/b8560e9eb68d7e83e0b3d403a925f178/gr5.sml gr5 gr5.sml sml 4381 95 219 IMAGE-THUMBNAIL 1-s2.0-S138111691530042X-gr6.sml https://s3-eu-west-1.amazonaws.com/prod-ucs-content-store-eu-west/content/pii:S138111691530042X/gr6/THUMBNAIL/image/gif/f4567e3b4cab039e776087d51d0d7d1d/gr6.sml gr6 gr6.sml sml 6142 164 196 IMAGE-THUMBNAIL 1-s2.0-S138111691530042X-gr7.sml https://s3-eu-west-1.amazonaws.com/prod-ucs-content-store-eu-west/content/pii:S138111691530042X/gr7/THUMBNAIL/image/gif/d0d352bb4f998583f82dc7d89f07dbee/gr7.sml gr7 gr7.sml sml 5421 164 207 IMAGE-THUMBNAIL 1-s2.0-S138111691530042X-gr8.sml https://s3-eu-west-1.amazonaws.com/prod-ucs-content-store-eu-west/content/pii:S138111691530042X/gr8/THUMBNAIL/image/gif/d282f233845ceaed767560c6a55f1779/gr8.sml gr8 gr8.sml sml 7488 141 219 IMAGE-THUMBNAIL 1-s2.0-S138111691530042X-gr9.sml https://s3-eu-west-1.amazonaws.com/prod-ucs-content-store-eu-west/content/pii:S138111691530042X/gr9/THUMBNAIL/image/gif/b3f2ca5656abbf7cd46a5433ab23829d/gr9.sml gr9 gr9.sml sml 4513 164 196 IMAGE-THUMBNAIL 1-s2.0-S138111691530042X-sc1.sml https://s3-eu-west-1.amazonaws.com/prod-ucs-content-store-eu-west/content/pii:S138111691530042X/sc1/THUMBNAIL/image/gif/e6c104ccc7834cc36d538fe187e1a058/sc1.sml sc1 sc1.sml sml 4808 103 185 IMAGE-THUMBNAIL 1-s2.0-S138111691530042X-sc2.sml https://s3-eu-west-1.amazonaws.com/prod-ucs-content-store-eu-west/content/pii:S138111691530042X/sc2/THUMBNAIL/image/gif/d1cec8a799b54601eba440a1556d8675/sc2.sml sc2 sc2.sml sml 4814 80 219 IMAGE-THUMBNAIL 1-s2.0-S138111691530042X-sc3.sml https://s3-eu-west-1.amazonaws.com/prod-ucs-content-store-eu-west/content/pii:S138111691530042X/sc3/THUMBNAIL/image/gif/096a6ca0190912bd4091026a6851c6b9/sc3.sml sc3 sc3.sml sml 8205 112 219 IMAGE-THUMBNAIL 1-s2.0-S138111691530042X-sc4.sml https://s3-eu-west-1.amazonaws.com/prod-ucs-content-store-eu-west/content/pii:S138111691530042X/sc4/THUMBNAIL/image/gif/9e44ebdc60eedc1d31f4e4c62b2f174e/sc4.sml sc4 sc4.sml sml 2920 60 219 IMAGE-THUMBNAIL 1-s2.0-S138111691530042X-sc5.sml https://s3-eu-west-1.amazonaws.com/prod-ucs-content-store-eu-west/content/pii:S138111691530042X/sc5/THUMBNAIL/image/gif/7bebb9cfbb8c0b28c54e071568750647/sc5.sml sc5 sc5.sml sml 6190 163 182 IMAGE-THUMBNAIL 1-s2.0-S138111691530042X-fx1_lrg.jpg https://s3-eu-west-1.amazonaws.com/prod-ucs-content-store-eu-west/content/pii:S138111691530042X/HIGHRES/image/jpeg/5800ac5b224cb6653ad9681417d88741/fx1_lrg.jpg fx1 true fx1_lrg.jpg jpg 96009 531 1328 IMAGE-HIGH-RES 1-s2.0-S138111691530042X-gr1_lrg.jpg https://s3-eu-west-1.amazonaws.com/prod-ucs-content-store-eu-west/content/pii:S138111691530042X/HIGHRES/image/jpeg/625fa32010450deafaf2310db8924394/gr1_lrg.jpg gr1 gr1_lrg.jpg jpg 11403 183 252 IMAGE-HIGH-RES 1-s2.0-S138111691530042X-gr2_lrg.jpg https://s3-eu-west-1.amazonaws.com/prod-ucs-content-store-eu-west/content/pii:S138111691530042X/HIGHRES/image/jpeg/ba89c2d9fc5197af165194a68a8567a6/gr2_lrg.jpg gr2 gr2_lrg.jpg jpg 7045 178 149 IMAGE-HIGH-RES 1-s2.0-S138111691530042X-gr3_lrg.jpg https://s3-eu-west-1.amazonaws.com/prod-ucs-content-store-eu-west/content/pii:S138111691530042X/HIGHRES/image/jpeg/c6fd402d52b7cada46ad75f5ecd4738b/gr3_lrg.jpg gr3 gr3_lrg.jpg jpg 17828 239 339 IMAGE-HIGH-RES 1-s2.0-S138111691530042X-gr4_lrg.jpg https://s3-eu-west-1.amazonaws.com/prod-ucs-content-store-eu-west/content/pii:S138111691530042X/HIGHRES/image/jpeg/b9f83259fd05a206cb6587e49feb5306/gr4_lrg.jpg gr4 gr4_lrg.jpg jpg 73297 468 678 IMAGE-HIGH-RES 1-s2.0-S138111691530042X-gr5_lrg.jpg https://s3-eu-west-1.amazonaws.com/prod-ucs-content-store-eu-west/content/pii:S138111691530042X/HIGHRES/image/jpeg/95eef5b953fdc505e562e0b42a90de83/gr5_lrg.jpg gr5 gr5_lrg.jpg jpg 29374 294 678 IMAGE-HIGH-RES 1-s2.0-S138111691530042X-gr6_lrg.jpg https://s3-eu-west-1.amazonaws.com/prod-ucs-content-store-eu-west/content/pii:S138111691530042X/HIGHRES/image/jpeg/53ca790a1d10dca88983c97ed3926f96/gr6_lrg.jpg gr6 gr6_lrg.jpg jpg 18696 314 376 IMAGE-HIGH-RES 1-s2.0-S138111691530042X-gr7_lrg.jpg https://s3-eu-west-1.amazonaws.com/prod-ucs-content-store-eu-west/content/pii:S138111691530042X/HIGHRES/image/jpeg/6c200a00db5f7871dc6a3ba8dc5dce17/gr7_lrg.jpg gr7 gr7_lrg.jpg jpg 14161 298 376 IMAGE-HIGH-RES 1-s2.0-S138111691530042X-gr8_lrg.jpg https://s3-eu-west-1.amazonaws.com/prod-ucs-content-store-eu-west/content/pii:S138111691530042X/THUMBNAIL/image/jpeg/a27b5a4a89c6c7b2f02de51180a17245/gr8_lrg.jpg gr8 gr8_lrg.jpg jpg 53770 434 676 IMAGE-HIGH-RES 1-s2.0-S138111691530042X-gr9_lrg.jpg https://s3-eu-west-1.amazonaws.com/prod-ucs-content-store-eu-west/content/pii:S138111691530042X/HIGHRES/image/jpeg/2d21a65458eb9442c145597edd0b499a/gr9_lrg.jpg gr9 gr9_lrg.jpg jpg 13903 315 376 IMAGE-HIGH-RES 1-s2.0-S138111691530042X-sc1_lrg.jpg https://s3-eu-west-1.amazonaws.com/prod-ucs-content-store-eu-west/content/pii:S138111691530042X/DOWNSAMPLED/image/jpeg/5c88e5ed15d268879a3adf1d73b4d662/sc1_lrg.jpg sc1 sc1_lrg.jpg jpg 5068 103 185 IMAGE-HIGH-RES 1-s2.0-S138111691530042X-sc2_lrg.jpg https://s3-eu-west-1.amazonaws.com/prod-ucs-content-store-eu-west/content/pii:S138111691530042X/HIGHRES/image/jpeg/06aa299a12837ae0eca4c2342441d562/sc2_lrg.jpg sc2 sc2_lrg.jpg jpg 10014 120 329 IMAGE-HIGH-RES 1-s2.0-S138111691530042X-sc3_lrg.jpg https://s3-eu-west-1.amazonaws.com/prod-ucs-content-store-eu-west/content/pii:S138111691530042X/HIGHRES/image/jpeg/d9be05354444924fb9fb14b7b01022ae/sc3_lrg.jpg sc3 sc3_lrg.jpg jpg 45805 307 602 IMAGE-HIGH-RES 1-s2.0-S138111691530042X-sc4_lrg.jpg https://s3-eu-west-1.amazonaws.com/prod-ucs-content-store-eu-west/content/pii:S138111691530042X/THUMBNAIL/image/jpeg/861c65ab240e855bd2d43ffa494e0117/sc4_lrg.jpg sc4 sc4_lrg.jpg jpg 9431 126 462 IMAGE-HIGH-RES 1-s2.0-S138111691530042X-sc5_lrg.jpg https://s3-eu-west-1.amazonaws.com/prod-ucs-content-store-eu-west/content/pii:S138111691530042X/MAIN/image/jpeg/b386e1d02b416dfb93488b575f8a5198/sc5_lrg.jpg sc5 sc5_lrg.jpg jpg 39799 457 509 IMAGE-HIGH-RES 1-s2.0-S138111691530042X-mmc1.docx https://s3-eu-west-1.amazonaws.com/prod-ucs-content-store-eu-west/content/pii:S138111691530042X/mmc1/MAIN/application/vnd.openxmlformats-officedocument.wordprocessingml.document/d3e3f639fc7885e8ee2eeb8de7bcd1d3/mmc1.docx mmc1 mmc1.docx docx 3367931 APPLICATION 1-s2.0-S138111691530042X-si1.gif https://s3-eu-west-1.amazonaws.com/prod-ucs-content-store-eu-west/content/pii:S138111691530042X/STRIPIN/image/gif/416c74a8d58a234041e7a1929eeae569/si1.gif si1 si1.gif gif 2428 43 576 ALTIMG 1-s2.0-S138111691530042X-si2.gif https://s3-eu-west-1.amazonaws.com/prod-ucs-content-store-eu-west/content/pii:S138111691530042X/STRIPIN/image/gif/5127bebb60abc47408244a76f5708f3b/si2.gif si2 si2.gif gif 2033 42 405 ALTIMG 1-s2.0-S138111691530042X-si3.gif https://s3-eu-west-1.amazonaws.com/prod-ucs-content-store-eu-west/content/pii:S138111691530042X/STRIPIN/image/gif/fb9cec9f20adafdb2b4edb5f1f4f8b71/si3.gif si3 si3.gif gif 5066 101 590 ALTIMG 1-s2.0-S138111691530042X-si4.gif https://s3-eu-west-1.amazonaws.com/prod-ucs-content-store-eu-west/content/pii:S138111691530042X/STRIPIN/image/gif/943a199ada6f9636d96f6159a8c56e73/si4.gif si4 si4.gif gif 3195 47 591 ALTIMG 1-s2.0-S138111691530042X-si5.gif https://s3-eu-west-1.amazonaws.com/prod-ucs-content-store-eu-west/content/pii:S138111691530042X/STRIPIN/image/gif/ff1e6660198f22801217da068a74bcbb/si5.gif si5 si5.gif gif 2588 47 452 ALTIMG 1-s2.0-S138111691530042X-si6.gif https://s3-eu-west-1.amazonaws.com/prod-ucs-content-store-eu-west/content/pii:S138111691530042X/STRIPIN/image/gif/326d143b02c416ffac3f69b86a7c7a66/si6.gif si6 si6.gif gif 1489 43 289 ALTIMG 1-s2.0-S138111691530042X-si7.gif https://s3-eu-west-1.amazonaws.com/prod-ucs-content-store-eu-west/content/pii:S138111691530042X/STRIPIN/image/gif/ba38002ff366d10269165cd8db50a5cf/si7.gif si7 si7.gif gif 1507 43 265 ALTIMG 1-s2.0-S138111691530042X-si8.gif https://s3-eu-west-1.amazonaws.com/prod-ucs-content-store-eu-west/content/pii:S138111691530042X/STRIPIN/image/gif/0765b51a8db15c80d014544a86bd7de6/si8.gif si8 si8.gif gif 1165 42 222 ALTIMG MOLCAA 9582 S1381-1169(15)30042-X 10.1016/j.molcata.2015.07.031 Elsevier B.V. Scheme 1 Reduction of nitrobenzene to nitroaniline. Scheme 2 Synthesis of polyamino CDs. Scheme 3 Formation and modifications of AmCD-capped Ag-NPs. Scheme 4 Preliminary mechanistic scheme. Scheme 5 Final mechanistic scheme. Fig. 1 Nitroarene substrates. Fig. 2 Structure of AmCD. Fig. 3 Normalized UV–vis spectra for pristine Catalyst II and its dilutions. Fig. 4 TEM micrographs of Catalyst I (a and d), IIdilB (b and e) and IIred (c and f). Micrographs a, b and c acquired at a 50000×magnification; micrographs d, e and f acquired at a 150000×magnification. Fig. 5 FT-IR spectra of AmCD (….) and Ag NPs precipitate from Catalyst I (___). Fig. 6 Kinetic trace (squares) for the reaction of 1 (0.1mM) with NaBH4 (4.0mM) in the presence of catalyst II (50μM). Fig. 7 Dependence of the initial reaction rate (c1) vs. BH4- concentration for the reaction of 1 (0.1mM) in the presence of catalyst II (50μM). Fig. 8 Dependence of kobs/|BH4-| on CAg for Catalyst I (a) and Catalyst II (b). Fig. 9 Induction times ti for the reaction of 1 with Catalyst I at different concentrations. Table 1 ϵ values for the AmCD/Ag NP systems at the relevant λ max. |Ag+| (mM) 0.2 0.5 1.0 2.0 5.0 |AmCD| (mN) 0.4 No reaction n.d. 12420 n.d. n.d. 1.0 n.d. 4670 10020 n.d. n.d. 2.0 No reaction No reaction 5540 9240 Turbid 4.0 n.d. n.d. 440 5060 n.d. 10.0 n.d. n.d. No reaction n.d. Turbid Table 2 Values of k obs,0, k obs,1, K app,1 and K app,2. Sub. Catalyst I Catalyst II Eq. k obs,0 (s−1 M−1) k obs,1 (s−1 M−1) K app,1 (10−6 M−1) K app,2 (10−6 M−1) Eq. k obs,0 (s−1 M−1) k obs,1 (s−1 M−1) K app,1 (10−6 M−1) K app,2 (10−6 M−1) 1 (11) 36.2±1.4 1.30±0.07 8.4±0.8 n.d. (10) 62±3 2.0±1.0 3.9±0.4 0.8±0.4 2 (11) 29.0±0.4 0.40±0.03 5.1±0.2 n.d. (10) 65±2 (<0.2) 5.2±0.2 (<0.4) 3 (11) 36.0±2.0 0.88±0.09 10.0±1.8 n.d. (10) 23±2 0.6±0.4 2.0±0.2 0.5±0.3 4 (11) 26.7±1.1 1.00±0.05 9.8±1.2 n.d. (11) 11±2 2.4±0.1 0.8±0.2 n.d. 5 (11) 32.0±0.6 0.33±0.02 13.7±0.7 n.d. (10) 131±2 6.3±2.0 3.2±0.8 1.2±0.3 6 (11) 16.9±0.7 0.93±0.03 10.0±1.2 n.d. (11) 7±1 1.1±0.1 0.44±0.1 n.d. 7 – n.d. n.d. n.d. n.d. – n.d. n.d. n.d. n.d. 8 (11) 5.2±0.3 0.67±0.07 0.84±0.07 n.d. – n.d. n.d. n.d. n.d. Silver nanoparticles stabilized by a polyaminocyclodextrin as catalysts for the reduction of nitroaromatic compounds Marco Russo Francesco Armetta Serena Riela Delia Chillura Martino Paolo Lo Meo ⁎ Renato Noto Università degli Studi di Palermo, Dip. STEBICEF—V.le delle Scienze, Parco d’Orleans, Ed. 17., 90128 Palermo, Italy Università degli Studi di Palermo Dip. STEBICEF—V.le delle Scienze Parco d’Orleans, Ed. 17. Palermo 90128 Italy ⁎ Corresponding author. Graphical abstract Silver nanoparticles stabilized by means of poly-(6-N,N-dimethyl-propylenediamino)-(6-deoxy)-β-cyclodextrin were synthesized, characterized by different techniques (UV–vis spectroscopy, Dynamic Light Scattering, High Resolution Transmission Electron Microscopy, Fourier-transform IR Spectroscopy) and used as catalysts for the reduction of various nitrobenzene derivatives with sodium borohydride. The nanocomposites obtained appear to have an organized structure, with a metal core surrounded by a layer-structured coating shell. Kinetic data, rationalized in terms of a modified Langmuir–Hinshelwood model, evidenced a non-linear dependence of the reaction rate on the concentration of the catalyst. This was explained on the grounds of the catalytic activity of differently covered catalyst areas. Careful analysis of kinetic data, in particular the effect of the para substituent on the nitroarene structure and the trends of the induction period observed at the beginning of the reaction, provided with interesting insights on the reaction course, and brought us to critically reconsider several mechanistic ideas reported in previous literature. Keywords Polyaminocyclodextrin Nitroarene reduction Silver nanocomposite 1 Introduction The reduction of aromatic nitrocompounds is an important synthetic route leading, under the proper reaction conditions, to different nitrogen-containing derivatives [1]. In particular, the reduction to anilines (Scheme 1 ), which has also a great interest as an industrial process, is generally carried out with strong reducing agents or under harsh conditions. The most common protocols provide the use of LiAlH4, transition metals in strongly acidic media (Fe and conc. HCl is a typical industrial method), or catalytic hydrogenation. Unfortunately, these conditions may be unsuitable whenever particularly delicate functional groups are present in the molecule. Therefore, the availability of milder alternative methods has an undoubted appeal. In this context, the use of NaBH4 in the presence of noble metal nanoparticles (NPs) has attracted a certain interest [2,3]. The reduction of 4-nitrophenol or 4-nitroaniline (to 4-aminophenol and 1,4-diaminobenzene respectively) has been successfully carried out using NPs stabilized by various capping agents, including biopolymers such as dextran [4,5] or alginate [6–8], and PAMAM- or PPI-type dendrimers [3,9,10]. The latter class of auxiliaries is particularly interesting, because dendrimers provide a strictly defined micro-environment for the formation of the NP and for the actual nitroarene reduction process as well. Cyclodextrins (CDs), both native or chemically modified with suitable donor groups, constitute a class of alternative capping agents for the formation of metal NPs which have been occasionally employed [11,12]. The most known example is probably constituted by the heptakis-(6-thiol)-(6-deoxy)-βCD [13], which has been successfully used for the synthesis of Au or Ag NPs. Recently, some of us synthesized a new class of polyamino-cyclodextrin products [14], which have been tested as effective auxiliary agents for the preparation of Ag nanoparticles. The CD derivatives were obtained by a simple nucleophilic displacement reaction between the heptakis-(6-iodo)-(6-deoxy)-βCD and various polyamines (Scheme 2 ). However, due to the unavoidable occurrence of poly-substitution, the reaction affords mixtures of products bearing a different number of polyamino pendants [15]. As a matter of fact, the same polyamine unit may substitute more than one iodine on the same CD scaffold. The obtained materials, which are isolated as partial hydroiodides, have been fully characterized by means of Nuclear Magnetic Resonance, Electrospray Ionization Mass Spectrometry and potentiometric titration. The combined use of these techniques allowed to identify the different constituents of the mixtures, to determine the average number of polyamine pendants (n) and formal HI molecules (x) per CD unit, and to calculate the possible protonation or charge status as a function of the pH. Despite the nitroarene reduction catalyzed by metal NPs has been known for relatively long time, the actual mechanism of catalysis has not been satisfactorily understood, and even the kinetic features of the process are still debated. There is no general agreement about the kinetic order of the reaction, which is usually reported as first order in the nitroarene [3,6,10,12,16–18], but which has been also occasionally described as zeroth order [2,8]. Moreover, the possibility to apply this reaction to further nitroarene derivatives has never been explored in detail. Therefore, a systematic investigation and in general a critical reconsideration of the entire topic seemed interesting. In this context, we reasoned that the use of a cyclodextrin-capped Ag-NP system as the catalyst could be particularly intriguing. Indeed, CDs as auxiliary agents may provide both a suitable micro-environment for the formation and the stabilization of the NP, and a sort of receptor site on the catalyst surface, constituted by the CD cavity, able to bind and direct the nitroarene substrate. In the present work we investigated the reduction reaction of various nitroarene derivatives 1-8 (Fig. 1 ) with NaBH4 in the presence of two Ag-NP catalyst systems, obtained by using the poly-(6-N,N-dimethyl-propylenediamino)-(6-deoxy)-βCD (AmCD, Fig. 2 ) as the capping agent. The structural and morphological characterization of the Ag-NP systems chosen as catalysts was performed by means of combined UV–vis spectroscopy, Dynamic Light Scattering (DLS), High Resolution Transmission Electron Microscopy (HR-TEM) and FT-IR spectroscopy. These techniques allowed to get information on the size and polidispersity of the NP suspensions, as well as to investigate the morphology of the NPs. The chosen nitroarene substrates differ for the substituent at the para position with respect to the reactant nitro group. They were suitably selected to present significant variations in their molecular properties [19,20]. In particular, we considered the electrondonating effect, the possible charge status and the steric hindrance of the para substituent, as well as the intrinsic affinity of the substrate for the CD cavity. 2 Results and discussion 2.1 Synthesis of the NP catalysts According to previous work [14], AmCD-capped Ag-NPs can be obtained by reacting in the dark a solution of the [Ag(NH3)2]+ complex in the presence of a suitable amount of the auxiliary AmCD, with an excess of formaldehyde at 40°C for 90min. Noticeably, on the grounds of the analytical data reported elsewhere [14], AmCD bears on average 5.7 N,N-dimethyl-propylenediamino pendants and 4.0 formal HI molecules per CD unit. The formation of the NPs is evident by the appearance of the typical reddish color, due to the characteristic surface plasmon resonance (SPR) absorption band, usually centered between 400 and 450nm. In a series of preliminary experiments we explored the effect on the NP formation process from changing the concentrations of the reactants and their molar ratio, in particular: (i) by fixing the [Ag(NH3)2]+ concentration (1.0mM) and varying the AmCD (0.4–10.0mN; the normality of the AmCD solution is defined according to the average number of donor sites, namely 11.4, per CD unit); (ii) by fixing the AmCD (2 mN) and varying the [Ag(NH3)2]+ (0.2–5.0mM); (iii) by simultaneously varying both the reactants, while keeping constant their equivalent ratio (2:1 eq/eq, i.e., the same as in the starting [Ag(NH3)2]+ complex). The obtained systems were preliminarily characterized by UV–vis spectroscopy; the results obtained are summarized in Table 1 . The outcome of the NP formation process strictly depends on the AmCD/[Ag(NH3)2]+ equivalent ratio used. Nearly no reaction occurred with ratios larger than 4:1. In the other cases the systems showed an absorption band centered at 401±2nm, the intensity of which (expressed by the relevant molar extinction coefficient, ϵ) regularly increases on decreasing the equivalent ratio. Moreover, the same ratio heavily affects the stability of the system. Samples obtained with a 2:1 ratio are stable for several weeks, if kept in the dark at room temperature. By contrast, systems with a 0.4:1 ratio or prepared with the largest [Ag(NH3)2]+ concentrations, appear cloudy or turbid and form reddish-brown precipitates within few days (lower ratios were also explored, indeed, but resulted in the quick separation of part of the reduced Ag as the typical “silver mirror”). On the whole, these preliminary findings suggest that the auxiliary AmCD protects the silver ion towards its reduction under the conditions used. Data indicate that NP formation is hampered at the highest AmCD/[Ag(NH3)2]+ ratios, is partial for the ideal 2:1 value, and becomes almost complete at the lowest ratios. Of course, the presence of a minimum amount of AmCD is needed in order to ensure the actual formation and stabilization of the NP system. Therefore, it seems reasonable to hypothesize that NPs prepared with a 2:1 ratio are constituted by a metal core, surrounded by a shell of AmCD units complexing a certain amount of Ag+ ions by means of their the amine donor groups. The presence of a significant positive charge on the NP surface ensures the time stability of the system. On the other hand, in systems prepared at low (namely 0.4:1) ratios the NPs formed bear nearly no charge on their surface, and consequently may aggregate or coalesce. In order to confirm these hypotheses, we thoroughly investigated two particular representative NP systems, which were subsequently used as the catalysts for studying the nitroarene reduction reaction. These systems, indicated hereinafter as Catalysts I and II, were prepared at a 1mM [Ag(NH3)2]+ concentration, and AmCD concentrations as large as 0.4mN (Catalyst I) and 2mN (Catalyst II), which correspond to AmCD/Ag+ mole/mole ratios (ρ) as large as 0.035 and 0.175 respectively. Moreover, as it will be illustrated more in detail in Section 2.3, in order to perform the nitroarene reduction reaction Catalysts I and II are subjected to dilution (up to 1:750 v/v., i.e. 1.33μM) and subsequent interaction with NaBH4. This may cause deep modifications in the structure of the nanocomposite, as it can be evidenced by simple observations. After dilution 1:1 or 1:9 v/v of the preformed Catalyst II with water, a significant enlargement and decrease in intensity of the SPR band centered at 401nm, and the appearance of a new band at 567nm can be noticed in the normalized UV–vis spectra (Fig. 3 ). The corresponding color change is apparent even at naked eye. The observed behavior might account in principle for either an increase in NP average size, or concomitant changes in the polar character and/or the local refractive index of the coordination shell immediately surrounding the metal core [21]. Furthermore, the residual Ag+ possibly present at the NP surface (in particular in the case of Catalyst II) can be easily reduced to Ag0 by borohydride ion. As a matter of fact, addition of NaBH4 to a solution containing [Ag(NH3)2]+ and AmCD (at the same concentrations as in Catalyst II) instantaneously causes the formation of a turbid brown suspension, which precipitates down in few minutes. For these reasons, together with “as-prepared” Catalysts I and II, we subjected to characterization three further control systems, namely two dilutions 1:1 and 1:9 v/v of Catalyst II with water (indicated as IIdilA and IIdilB respectively), and a mixture 1:1 v/v between Catalyst II and a freshly prepared NaBH4 48.0mM solution (indicated as IIred). 2.2 Structural and morphological investigation of the NP catalysts The knowledge of NPs size and morphology is of outmost importance in order to rationalize their activity as catalysts [22]. These information are typically achieved by means of direct methods such as transmission electron microscopy (TEM), as well as by indirect scattering-based methods such as Dynamic Light Scattering (DLS). The latter one affords an evaluation of particle size in suspension, allowing to analyze a more statistically representative sample at the cost of lack in high resolution details about the morphology of nanoparticles. For our purposes, it is worth stressing here that TEM and DLS provide with complementary information about the structural organization of our systems: the former focuses on the metal core alone, whereas the latter looks at the entire nanocomposite, including its coating and hydration shell. As representative examples, TEM micrographs for Catalysts I and for control systems IIdilB and IIred are shown in Fig. 4 (further images are provided in the Supporting). The pristine Catalysts I and II show well defined, quite spherical, individual metal cores with a relatively low polydispersity and scarce tendency to aggregation. Statistical analysis of TEM images indicates unimodal diameters distributions centered at ca. 27 and 19nm respectively. Therefore, larger NPs are formed in the presence of a lesser amount of capping agent. Dilution does not seem to have significant effects on the dimensions of the pristine metal cores; however, a fair tendency to aggregation can be noticed, together with the appearance of a new population of small faint objects having an average diameter of ca. 3.6nm. Considerable modifications are apparent after treatment with NaBH4. TEM images show a large tendency to aggregation, together with modification of both the size and the morphology of the pristine metal cores and, most interestingly, the formation of new small sized cores. Statistical analysis of images reveals a completely different diameter distribution, with a maximum frequency centered at ca. 9.7nm. Different information are provided by DLS determinations. Data for “as-prepared” systems indicate the presence of smaller aggregates for Catalyst I than for Catalyst II, with average diameters as large as 86 and 149nm respectively. Sizes were evaluated by applying the CONTIN method (see Section 4 for details; representative DLS curves are reported in Supporting), and again show unimodal distributions. For the control systems IIdilA and IIdilB average diameters of 149 and 59nm respectively are found, indicating that significant dilution (namely 1:9 v/v) causes a noticeable decrease of the aggregate size. By contrast, once Catalyst II is treated with NaBH4, for the system IIred the aggregates in suspension grow dramatically in size, with an average value of the diameter of 464nm, and show high polydispersity. The latter result is in agreement with TEM evidence of NPs aggregation. It is interesting to notice that, on the grounds of TEM results, metal cores for Catalysts I and II may be estimated to possess on average 6×105 and 2×105 silver atoms respectively, and average surface areas as large as 2300 and 1100nm2, respectively. On the other hand, simple molecular models suggest that a single AmCD unit may cover an area on the NP surface, which can be roughly estimated as comprised between 3 and 7nm2 [23]. Keeping into account the actual composition of the systems, in particular the values of the aforementioned AmCD/Ag+ mole ratios ρ (Section 2.1), it can be calculated that only a minor fraction (less than 5%) of the AmCD present might actually come in direct contact with, and fully cover, the metal core. It must be also considered that the height of a single CD torus is reported to be 0.79nm [24]; therefore, a single AmCD layer cannot be much thicker than 1nm. Thus, everything considered, the whole of the TEM and DLS results can be explained as follows (Scheme 3 ). Pristine NP cores, formed after the slow formaldehyde reduction of silver ions embedded in a sort of Ag+·AmCD macroaggregate, are initially surrounded by a thick layer-structured coating, constituted by shells of AmCD units held together by various supramolecular interactions, including the mutual inclusion of the polyamine tails into the CD cavities and the complexation of residual Ag+ ions with the polyamines. This coating offers both a steric and an electrostatic barrier against the aggregation/coalescence of the NPs and, of course, is thicker for Catalyst II, prepared with the largest amount of AmCD. Dilution of the catalyst causes the progressive dissolution of the coating shells (as accounted for by the decreased size estimated by DLS), with formation of small Ag+·AmCD microaggregates (the faint objects observed in IIdilB), which act as seeds for the formation of new small Ag cores after treatment with NaBH4. The latter process may cause the deposition of further metal on the pristine cores, modifying their size and shape (as observed in IIred). The concomitant exhaustive reduction of Ag+ removes at the same time the electrostatic barrier, causing extensive aggregation. Further confirmation for the composite nature of our AgNP systems was achieved by means of FT-IR evidence. By subjecting a large amount of Catalyst I to centrifugation, a sample of Ag NPs was isolated and its IR spectrum (KBr) was recorded. Noticeably, owing to the strong intrinsic absorption due the nanosized Ag component, the sample disc results fairly opaque to IR radiation. After suitable correction, however, the resulting spectrum shows very intriguing features (Fig. 5 ). Comparison with the spectrum of free AmCD, reveals the presence in the composite of the signals expected for the organic capping agent. More in detail, we observe that the pristine large AmCD band at 3310cm−1, due to superimposition (because of extensive hydrogen bonding) of the OH and NH groups stretching, splits in two bands centered at 3470 and 3136cm−1 respectively. This indicates a neat discrimination between the two different groups, reasonably owing to the occurrence of the NAg interactions at the NP surface. The AmCD fingerprints at 1153, 1086, 1041 (CO stretching) and 943cm−1 (OH bending) attributable to the CD scaffold, are present in the spectrum of the composite with minor shifts, together with new bands at 998 and 839cm−1. The latter one, in particular, replaces the corresponding AmCD band centered at 756cm−1 which can be attributed to N-H wagging. Therefore, this large shift confirms the occurrence of strong NAg interactions at the primary CD rim. Finally, The spectrum of the composite shows the trivial CH stretching bands (3000–2800cm−1), and two strong bands at 1456 and 1385cm−1 due to carbonate ion (superimposed to the expected CH bending bands of the AmCD at 1466 and 1368cm−1), the presence of which can be easily explained as due to CO2 uptake by the quite alkaline NP solution. 2.3 Kinetic study of the nitroarene reduction In order to study the kinetics of the reduction reaction of nitroarenes 1-8 mediated by Ag-NPs, sample systems were prepared by mixing the proper amounts of stock solutions of the reactants and the catalyst (see Section 4), in such a way to have initial concentrations of the substrate and NaBH4 as large as 0.1mM and 4.0mM respectively, and a catalyst concentration ranging between 1.33 and 83.3μM. The latter concentration is expressed as the equivalent concentration of silver ion (C Ag) needed to obtain the amount of NPs introduced in the sample. The reducing agent, which is the last component introduced in the system immediately before starting the registration of the kinetic trace, is always used in large excess with respect to the nitroarene substrate. Kinetic experiments were performed at 313K, following by UV–vis spectrophotometry the disappearance of the absorption band of the substrate, at its λ max value. A typical kinetic trace is shown in Fig. 6 . In agreement with literature [2,17,25,26,27], a preliminary induction period is present. Subsequent data points monotonically decrease, till a plateau is almost abruptly reached. In striking contrast with previous literature, the decreasing branch of the kinetic trace cannot be satisfactorily fitted neither as the exponential decay expected for a first order process, nor as a simple straight line accounting for a zeroth-order process. Rather, experimental points appear tentatively adaptable at a first approximation by a parabolic trend. In a preliminary set of control experiments performed with 4-nitroaniline 1, we fixed the amount of catalyst (50μM) and suitably varied the borohydride concentration in the range 1.0–8.0mM. We verified that the initial reaction rate, as expressed by the first order coefficient (c 1) of the fitting parabolic curve, linearly increases with the reducing agent concentration within the range considered (Fig. 7 , see data in Supporting). According to previous reports [5,23,28], a curvilinear dependence of the initial rate vs. borohydride concentration would have been expected at much larger concentrations (>10mM). The kinetics of NPs catalyzed reactions has been frequently approached by means of the Langmuir-Hinshelwood model [7,18,25,29–31], providing the reversible association of the reactants on different sites of the catalyst surface. This, in particular, explains the curvilinear dependence of the initial reaction rate [5,28], which has been rationalized admitting a fast association pre-equilibrium between the catalyst and the BH4 − ion, followed by the transfer of a hydride ion onto the NP surface [7,25,32]. However, we preferred to develop a modified version of the model. In particular, we considered the Ag-NP catalyst surface divided in effective area cells a , each as large as the average surface covered by a single AmCD unit. Then, we hypothesized that the reaction product is formed in a rate-limiting step from a surface-substrate-borohydride ternary complex, deriving through a set of fast pre-equilibria (Scheme 4 ). It can be assumed that a cells have an actual concentration (C a ) proportional to C Ag according to the relationship C a = σ × C Ag, where σ is the ratio between the total surface for the NPs generated by one mole of silver ion, and the average surface which can be covered by one mole of AmCD units. From Scheme 4 the following differential kinetic expression can be written: (1) v = − d | ArN O 2 | dt = k | a × B H 4 − × ArN O 2 | = k K B R C a | B H 4 − | | A r N O 2 | 1 + K B | B H 4 − | + K R | A r N O 2 | + K B R | B H 4 − | | A r N O 2 | where K B, K R and K BR are the stability constants for the binary ( a ·ArNO2) and ( a ·BH4 −) complexes and the overall stability constant for the ternary ( a ·BH4 −·ArNO2) complex respectively; k is the kinetic constant for the rate determining step. Eq. (1) can be simplified by considering that the observed linear dependence of the reaction rate on |BH4 −| implies the algebraic condition: 1+KR |ArNO2|>> KB |BH4 −|+KBR |BH4 −||ArNO2|, then: (2) − d | A r N O 2 | d t = k K B R C a | B H 4 − | | A r N O 2 | 1 + K R | A r N O 2 | = k K B R σ C A g | B H 4 − | | A r N O 2 | 1 + K R | A r N O 2 | which is equivalent to the expression expected on the grounds of the original Langmuir–Hinshelwood model. It has to be pointed out [31] that an expression such as Eq. (2) is never approached as such, because it can be reduced to either a first order or a zeroth order expression, by imposing the conditions 1>> KR |ArNO2| or 1<< KR |ArNO2| respectively. Nevertheless, it can be integrated as: (3) t = t i +(1/k obs) (C0 -|ArNO2|)+(1/k obs K R) ln(C0 /|ArNO2|) where t i is the length of the induction period, C 0 the starting concentration of the substrate and k obs = k(K BR/K R)σC Ag|BH4 −|. The latter condition may be also written as k obs = kK B* σC Ag|BH4 −|, where K B* is the equilibrium constant for the association between the preformed ( a ·ArNO2) binary complex and BH4 −. Evidence for the occurrence of a strong association between nitroarenes and Ag-NPs, by Raman spectroscopy, has been already reported in literature [16,33]. The integrated Eq. (3) comprises both a zeroth-order (linear) and a first-order (logarithmic) term in the substrate. So, it can be suitably used to accomplish an excellent fitting the experimental kinetic traces, as shown in Fig. 6 [34]. The expression for kobs predicts a linear dependence of the reaction rate on both the concentrations of the reducing agent and the catalyst as well [18,35]. Surprisingly, however, experimental results showed for kobs a non-linear dependence on C Ag (Fig. 8 , the complete set of data is collected in the Supporting). In some cases, namely with Catalyst II and anionic substrates 2 (sodium N-4-nitrophenyl-glicinate), 3 (sodium N-methyl-N-4-nitrophenyl-glicinate) and 5 (sodium 4-nitrophenate), we even found non-monotonical trends. No reaction could be observed for substrate 7 (sodium 4-nitrobenzoate) with both catalysts, and for 8 (nitrobenzene) with Catalyst II. Keeping into account the characterization of the catalysts discussed in Section 2.2, the observed dependence of k obs on C Ag can be explained considering that, under the high dilution condition used, the catalyst should have lost most of its coating. Thus, we can hypothesize that the effective surface cells a may be present in the reaction system in three different conditions, namely naked, covered with one AmCD unit only, or covered with two (or even more) AmCD layers. Of course, differently covered a cells are each other in equilibrium and have different catalytic effectiveness. In particular, we can assume that doubly-covered (or even multiply-covered) cells should be catalytically inactive, because the reactants are likely to interact with the outer AmCD layer, so they cannot approach the catalytically active NP surface. This has been verified in a set of control experiments performed with 4-nitroaniline 1 and Catalyst I (50μM). As a matter of fact, by adding increasing amounts of AmCD, we noticed a progressive decrease in the reaction rate, until substantial inhibition was achieved for AmCD concentrations larger than 1.0mM. Therefore, we considered a more complex mechanistic scheme (Scheme 5 ), keeping also into account the possible host-guest binding equilibrium between the free AmCD and the nitroarene substrate. A similar inverse dependence of the reaction rate on the amount of capping agent has been reported for the reduction of nitrophenol with Au NPs stabilized with natural extracts of Breyhnia rhamnoides [16]. In principle, the reaction rate should depend on the concentrations of the possible active catalyst-substrate-borohydride ternary complexes, according to the expression: (4) v =k(0)|a ×ArNO2 ×BH4 −|+k(1)|(a ×AmCD)×ArNO2 ×BH4 −| = = k (0) K R(0) K B*(0)|a||ArNO2||BH4 −|+ k (1) K (1) K R(1) K B*(1)|a||AmCD||ArNO2||BH4 −| From Scheme 5, considering the mass balance on the surface cells and the equilibrium conditions, and applying few suitable simplifications, we can obtain the following kinetic equation: (5) v = − d | A r N O 2 | d t = k ( 0 ) | a × B H 4 − × ArNO 2 | + k ( 1 ) | ( a × A m C D ) × BH 4 − × ArNO 2 | = = [ ( k 0 K R ( 0 ) K B * ( 0 ) + k ( 1 ) K 1 K R ( 1 ) K B * ( 1 ) | A m C D | ) ⋅ σ C A g | BH 4 − | ] | A rNO 2 | ( 1 + K 1 | A m C D | + K 1 K 2 | A m C D | 2 ) + ( K R ( 0 ) + K 1 K R ( 1 ) | A m C D | + K 1 K 2 K R ( 2 ) | A m C D | 2 ) | A rNO 2 | In Eq. (5) the concentration of free AmCD is accounted. The total amount of AmCD in the system (C CD) is bound to C Ag by the relationship: C CD =ρ× C Ag, where ρ is the AmCD/[Ag(NH3)2]+ mole ratio defined above (Section 2.1). However, at a first approximation it may be assumed |AmCD| ≈ ρ× C Ag, i.e. the concentrations of the various complexes may be considered negligible with respect to free AmCD [36]. Then, the following final kinetic expression can be obtained: (6) v = − d | Ar N O 2 | d t = ( k 0 K R ( 0 ) K B * ( 0 ) + k ( 1 ) K 1 K R ( 1 ) K B * ( 1 ) ρ C A g ) σ C A g | B H 4 − | | A r N O 2 | ( 1 + K 1 ρ C A g + K 1 K 2 ρ 2 C A g 2 ) + ( K R ( 0 ) + K 1 K R ( 1 ) ρ C A g + K 1 K 2 K R ( 2 ) ρ 2 C A g 2 ) | Ar N O 2 | Despite its complicated appearance, Eq. (6) assumes to the same form as Eq. (2), and can be integrated in the same way to afford the final expression: (7) t = t i +(1/k obs)(C0 -|ArNO2|)+(1/k obs K app) ln(C0 /|ArNO2|) where: (8) k obs = C A g | B H 4 − | [ σ k ( 0 ) K B * ( 0 ) ] + [ σ k 1 K 1 ( K R ( 1 ) / K R ( 0 ) ) K B * ( 1 ) ] ρ C A g 1 + K 1 ( K R ( 1 ) / K R ( 0 ) ) ρ C A g + K 1 K 2 ( K R ( 2 ) / K R ( 0 ) ) ρ 2 C A g 2 and (9) K app = K R ( 0 ) + K 1 K R ( 1 ) ρ C A g + K 1 K 2 K R ( 2 ) ρ 2 C A g 2 1 + K 1 ρ C A g + K 1 K 2 ρ 2 C A g 2 Eq. (8) can be also written as: (10) k o b s | B H 4 − | = k o b s , 0 C A g + k o b s , 1 K a p p , 1 ρ C A g 2 1 + K a p p , 1 ρ C A g + K a p p , 1 K a p p , 2 ρ 2 C A g 2 where k obs,0 = σk 0 K B*(0), k obs,1 = σk 1 K B*(1), K app,1 = K 1(K R(1)/K R(0)) and K app,2 = K 2(K R(2)/K R(1)). Noticeably, k obs,0 and k obs,1 provide a quantitative estimation of the catalytic efficiency of the naked and the singly-covered NP surface respectively. The catalytic efficiency depends, in turn, on the morphological characteristics of the NPs (accounted for by σ), on the ability of the NP-substrate pre-complex to bind the reducing agent (accounted for by K B*(0) or K B*(1)) and on the intrinsic reactivity of the substrate onto the particular catalyst cell (accounted for by k 0 or k 1); K app,1 and K app,2 represent the conditional binding constants between the NP surface and the AmCD layers in the presence of the different substrates. Eq. (10) can adequately describe the non-monotonical k obs vs. C Ag trends observed with Catalyst II and anionic substrates. However, as long as data relevant to Catalyst I are considered, the use of Eq. (10) leads to unreliable K app,2 values, characterized by unacceptably large indeterminations. From an algebraic viewpoint, being the term K app,1 K app,2ρ2 C Ag 2 negligible with respect to 1+K app,1ρC Ag, a simplified form of Eq. (10) can be more suitably used: (11) k o b s | B H 4 − | = k o b s , 0 C A g + k o b s , 1 K a p p , 1 ρ C A g 2 1 + K a p p , 1 ρ C A g The results obtained in analyzing the apparent kinetic constants kobs for substrates 1-8 with either Eqs. (10) or (11) are summarized in Table 2 .We can notice that k obs,0 values spun over a much larger range for Catalyst II than for Catalyst I, indicating larger variations in reactivity between the various substrates, and therefore a larger selectivity for the catalyst. Moreover, larger K app,1 values are generally observed with Catalyst I than with Catalyst II. These differences among the two catalysts may be ascribed to the different amount of unreduced Ag+ ion present on the catalyst, which is likely to interact with the nitroarene substrate before the addition of borohydride. Then, after BH4 − is introduced to start the title reaction, it also reduces the residual Ag+. Thus, the consequent modifications in the morphology of the catalyst may be affected by the possible occurrence of significant Ag+-substrate interactions. This seems particularly evident in the case of anionic substrates, for which non-monotonical trends in k obs values vs. C Ag are observed. Analysis of data reported in Table 2 indicates that the presence of a strong electrondonating substituent at the para position with respect to the reacting nitro group, is an important requirement for the reaction to occur. As far as k obs,0 values are concerned, nitroanilines 1-4 and nitrophenate 5 appear significantly more reactive than nitroanisole 6 and nitrobenzene 8, whereas nitrobenzoate 7 is not reactive at all. This result might appear quite surprising, because the reduction reaction should imply either an electron transfer process [16,37] or the nucleophilic attack of a hydride species to the nitro group. The latter type of process is consistent with the hypothesis reported in literature that BH4 − transfers a hydride ion onto the NP surface [7,25,32]. In both cases the reaction should be unfavorably affected by electrondonating substituents. By contrast, the behavior observed indicates that the mechanistic course of the process provides the interaction of the nitroarene with an electrophilic species, which must be identified with the catalyst surface. Nitroanilines 1-4 give further insights on the role of the para substituent group. N-substituted derivatives 2-4 do not appear more reactive than parent nitroaniline 1, despite alkyl substituents on the N atom should enhance the overall electrondonating character of the group. Therefore, the presence of a negative charge on the ancillary chain bound to the N atom (substrates 2 and 3), or the occurrence of significant steric hindrances (substrate 4), play an unfavorable role. This probably reflects a more difficult approach of the anionic reducing agent to the nitroarene-catalyst pre-complex, and a lower stability of the reactive ternary complex. The reactivity of nitrophenate 5 with Catalyst II appears exceptionally high. This is probably due to peculiar modifications in the NP surface morphology, occurring as a consequence of particular Ag+-substrate interactions, as discussed previously. On passing to analyze k obs,1 values, we can immediately notice that the singly-covered surface cells appear by far less catalytically active than uncovered ones. More in detail, k obs,0/k obs,1 ratios range from 4.6 (substrate 4 with Catalyst II) up to 97 (substrate 5 with Catalyst I). A lesser activity for singly-covered cells is not a trivial finding, because it indicates that inclusion into the receptor-like cavity does not lead the nitroarene to approach more easily the catalytic surface. This, however, is in contrast with the fact that the organic molecule is correctly included with the nitro group directed towards the primary CD rim [19,20,38]. By considering data for Catalyst I, the lowest k obs,1 values are observed for substrates 2 (sodium N-(4-nitrophenyl)-glicinate) and 5 (sodium 4-nitrophenate). The former one is known to form a very stiff inclusion complex with native βCD [20], due to the occurrence of multiple hydrogen bonding with the secondary host rim. The same effect likely blocks this substrate quite rigidly within the AmCD cavity. By contrast, other substrates unable to undergo multiple hydrogen bonding form more flexible complexes [20], and consequently are able to slip down more easily onto the NP surface after inclusion. It is interesting to notice that even the parent nitrobenzene 8 appears relatively reactive onto the singly-covered catalyst. Finally, the scarce reactivity of 5 may be likely attributed to the occurrence of a strong hydrogen bond interaction of the anionic centre with the secondary host rim, which forces its average position far from the NP surface. A few considerations are due to the apparent binding constants K app present in Eqs. (9) and (7) and and to the conditional binding constants K app,1 and K app,2 present in (10), (Eqs. (8) and (11)). Kapp reflects the actual contribution from the first order term to the overall reaction kinetics. This contribution increases in importance as K app decreases; consequently, larger deviations are observed in the kinetic trace with respect to the ideal linear trend expected for a purely zeroth order process. Unlike a true binding constant, K app depends on the concentration of the catalyst according to Eq. (9). Observed values usually range between 4×104 up to 4×105 M−1, and frequently show bell-shaped trends as a function of C Ag, with few exceptions. However, these values are affected by very large indeterminations (up to 40 %), so that a detailed analysis would be a pointless exercise. On passing to K app,1 and K app,2, their values depend on both on the intrinsic affinity of the AmCD towards the naked or singly covered NP surface (irrespective of the substrate, as accounted for by K 1 and K 2 respectively), and on the different abilities of the naked, singly- or doubly-covered cells to bind the nitroarene (as accounted for by the ratios (K R1/K R0) and (K R2/K R1)). Therefore, large differences in K app,1 or K app,2 among different substrates have to reflect similar differences in the latter ratios. For instance, nitrobenzene 8 shows with Catalyst I a much smaller K app,1 value as compared to the other substrates. This clearly mirrors its much lesser affinity for the host cavity, consequent to the smaller value of its binding constant with native βCD [39] as compared with nitroanilines. The same argumentation can be applied to nitroanisole 6 with Catalyst II. However, it should be reminded that K app,1 values for Catalyst II are influenced by the deep modifications of the catalyst upon introduction of the reducing agent, as discussed previously. The outcome of the possible substrate-Ag+ interactions on such modifications is not easily predictable. Regarding K app,2, its estimation was possible only in few cases, but values appear quite lower as compared to Kapp,1 . It is worth stressing that K app,2 accounts for the interaction between superimposed layers of AmCD, which probably involves the inclusion of the diamine pendants of the outer layer into the cavities of the inner one. Therefore, data suggest that the latter interaction is significantly less effective. Finally, regarding induction times t i, for each substrate-catalyst combination examined we observed that values increase on decreasing the concentration of the catalyst (data for substrate 1 with Catalyst I are shown in Fig. 9 as a representative example). Induction times vary with both the substrate and the catalyst. Nitroanilines 1-4 show smaller values than nitrophenate 5 and nitroanisole 6, whereas nitrobenzene shows the largest values. At the largest NP concentrations, slightly shorter induction times are observed with catalyst I, with the exception of nitrophenate 5. The occurrence of an induction period has been justified in different ways. It was formerly admitted that the catalytic process can start only after a tiny layer of silver oxide possibly present on the NP surface had been reduced by BH4 – [2]. It has been alternatively proposed that induction times (viewed as the inverse of a sort of kinetic constant [25]) might be related to the diffusion of the reacting species onto the catalyst surface [17], or to the reconstruction of the NP surface [25]. Our results, however, seem to rule out these interpretations, because they cannot explain neither the observed dependence on the concentration of the catalyst and on the structure of the substrate as well, nor the fact that induction occurs also with Catalyst II, having a significant amount of Ag+ immediately reduced in situ by borohydride. On the other hand, it is well known that induction is typical for mechanisms involving free-radical species. Therefore, it might be tentatively interpreted as an indication that the nitroarene substrate undergoes single electron transfer processes leading to short-lived radical species, which are scavenged by the molecular O2 present in solution [40]. There is literature evidence that induction times for 4-nitrophenol reduction are suppressed by exclusion of O2 from the reaction system [27]. As a consequence, the target reaction cannot properly start unless all the O2 has been consumed by reaction with the excess borohydride. The latter process will be catalyzed by NPs and, as a consequence, its duration will depend on the concentration of the catalyst. On the other hand, it can be expected that the NP-substrate interaction will favor this process, with an increasing effect on increasing the electron-donating character of the substrate itself. 3 Conclusions Polyaminocyclodextrin-capped Ag NPs were synthesized and characterized by combined UV-vis, DLS and TEM techniques. Our systems appear constituted by a metal core surrounded by a layered coating shell, made by the AmCD units held together by supramolecular interactions such as tail-cavity mutual inclusion or complexation of the residual unreduced Ag+ ions. This shell offers both a steric and an electrostatic barrier to aggregation, but it is progressively dissolved upon dilution on the system. Then, possible treatment with NaBH4 causes both a modification of the size and shape of the pristine metal cores and the formation of new small cores. Two Ag-AmCD NP systems were used as catalysts for the reduction of nitroarene derivatives with sodium borohydride. The reaction shows a peculiar kinetic trend and an unexpected dependence of the apparent kinetic constants k obs on the concentration of the catalyst. On the grounds of a modified Langmuir-Hinselwood model, experimental data were rationalized by means of a complex mechanistic scheme, providing the possibility that the catalyst surface may be present in the reaction system partly naked, and partly covered with one or more AmCD layers. Data show that the reaction course is favorably affected by the presence of electron-donating groups on the substrate, indicating that the NP surface acts as an electrophile towards the nitro group. Nevertheless, the presence of negatively charged or bulky groups on the substrate has a slightly unfavorable outcome, probably due to a more difficult approach of the reducing agent. The AmCD-covered catalyst surface seems less active, because of the intrinsic stability of the substrate-AmCD inclusion complex. In the case of Catalyst II, which contains a significant amount of unreduced Ag+ ion, its morphology changes as BH4 − is introduced into the reaction system. The latter process may be significantly affected by the presence of the substrate. Finally, the trends for the induction period seem to provide evidence for the occurrence of free-radical pathways in the intimate mechanism of reduction of the nitro group. 4 Experimental 4.1 Materials All commercial (Aldrich, Fluka) reactants and materials were used as purchased, with no further purification. The nitroaniline derivatives 2-4 were prepared according to literature [19,20], by a nucleophilic aromatic displacement reaction between 4-nitrofluorobenzene and the proper amine. The poly-(6-N,N-dimethyl-propylenediamino)-(6-deoxy)-βCD AmCD [14] was synthesized by a nucleophilic displacement reaction between the heptakis-(6-iodo)-(6-deoxy)-βCD and a 20-fold excess of 3-(N,N-dimethylamino)-1-aminopropane (which functions as the solvent too), at 60°C for 48h. Its high-resolution ESI–MS spectrum gave the following signals: 990.4720 (C77H154N14O28·2HI·2H)++, 873.5507 (C77H154N14O28·H·Na)++, 862.5601 (C77H154N14O28·2H)++, 820.5090 (C72H140N12O28·H2O·2H)++, 811.5024 (C72H140N12O28·2H)++, 778.4575 (C67H126N10O28·2H2O·2H)++, 769.4513 (C67H126N10O28·H2O·2H)++, 760.4447 (C67H126N10O28·2H)++, 582.7033 (C77H154N14O28·2H·Na)+++, 575.3765 (C77H154N14O28·3H)+++, 547.3417 (C72H140N12O28·H2O·3H)+++, 541.3379 (C72H140N12O28·3H)+++. All other physical and spectroscopic data (m.p., IR, 1H NMR, 13C NMR) were consistent with literature. 4.2 Instrumentation ESI–MS mass spectra were recorded in positive mode on an AGILENT Technologies 6540 UHD Accurate Mass Q-TOF LC–MS apparatus (1kV nozzle voltage, 250V fragmentor voltage). UV–vis spectra were recorded on a Beckmann DU 800 spectrophotometer, equipped with a Peltier thermostatic apparatus, which was used also to perform the kinetic experiments. FT-IR spectra (2% in KBr) were acquired on a Bruker VERTEX 70 apparatus. TEM micrographs were acquired using a JEM-2100 (JEOL, Japan) electron microscope operating at 200kV accelerating voltage. A drop of each suspension was put onto a 3mm Cu grid “lacey carbon” for analysis and let the solvent to complete evaporation. DLS measurements have been carried out by using a 90 Plus Particle Size Analyzer (Brookhaven Instrument Corp., Holtsville, NY, USA) equipped with a BI-9000AT Digital Autocorrelator. The source was a He-Ne 632.8nm laser and the detector was a photomultiplier tube, both mounted on a turntable; measurements were performed at 90°. By using the software supplied by Brookhaven Institute, data were obtained directly as electric field self-correlation function, G(τ), versus decay time, τ. In order to check data reproducibility and the stability of the suspension, measurements have been repeated in triplicate on different freshly prepared samples. Electric field self-correlation functions have been analyzed to obtain diffusion coefficients, D. The scattering particle diameters, d, have been evaluated by means of the Stokes-Einstein equation: D = K BT/3πhd once provided the absolute temperature T, and the viscosity of the solution η. Owing to the low concentration of the systems, the latter can be assumed coincident with the one of the pure solvent, within the limits of experimental errors. The self-correlation function computed by using the Cumulant analysis [41], did not satisfactorily reproduce the experimental data, thus suggesting that the particles in suspension were polydisperse. Therefore, a more appropriate analysis was performed by means of the CONTIN method [42]. 4.3 Synthesis of Ag-NPs Ag-NP systems were prepared with a slight modification of reported procedure [14]: mother solutions of [Ag(NH3)2]+ 15mM and AmCD 6 mN were prepared in double-distilled water, previously degassed with a fine stream of Ar for 15min. Then, samples were prepared by mixing in a dark vial the proper amounts of water, [Ag(NH3)2]+ and AmCD solutions up to 14mL. The samples, kept under Ar atmosphere, were placed in an oil bath thermostated at 40°C, inoculated with 1mL of formaldehyde solution 33.4mM, and allowed to react for 90min. UV–vis spectra of the samples were recorded immediately after the reaction time. Catalysts I and II were carefully kept and stored in the dark before use. In order to collect a sample for FT-IR, 100mL of Catalyst I were subjected to centrifugation at 5000rpm for 15min, and the resulting solid residue was isolated and lyophilized (yield 14.3mg). 4.4 Kinetics Kinetic experiments were performed at 313K, according to the following procedure. In a quartz cuvette the proper amount of a stock solution of catalyst (1.0mM) was diluted in the proper amount of freshly double-distilled water (degassed with a fine stream of Ar for 15min), in such a way to have 2.65mL of solution; then, 100μL of a stock solution 3.0mM of the substrate were added, and the mixture was thermostated. A 48.0mM solution of NaBH4 was prepared just before use by dissolving a weighed amount in a volumetric flask; then 250μL were rapidly introduced in the cuvette, and the registration of the kinetic trace immediately started, following by UV–vis spectrophotometry the disappearance of the nitroarene substrate. Acknowledgments TEM micrographs were acquired at the Centro Grandi Apparecchiature - UniNetLab - Università di Palermo funded by P.O.R. Sicilia 2000-2006, Misura 3.15 Quota Regionale; Prof. Eugenio Caponetti and Dr. G. Nasillo are gratefully acknowledged for collaboration and useful discussion. Appendix A Supplementary data Supplementary data associated with this article can be found, in the online version, at http://dx.doi.org/10.1016/j.molcata.2015.07.031. Appendix A Supplementary data The following are Supplementary data to this article: References [1] G.W. Kabalka, R.S. Varma, Reduction of Nitro and Nitroso compounds in Comprehensive Organic Synthesis, Vol. 8, pag. 363-379, B.M. Trost and I. Fleming, Eds., Pergamon Press, Oxford (UK), 1991. [2] N. Pradhan A. Pal T. Pal Colloids Surf. A 196 2002 247 257 [3] (a) K. Esumi K. Miyamoto T. Yoshimura J. Colloid Interf. Sci. 254 2002 402 405 (b) K. Esumi R. Isono T. Yoshimura Langmuir 20 2004 237 243 (c) T. Endo T. Yoshimura K. Esumi J. Colloid Interf. Sci. 286 2005 602 609 [4] (a) K.P. Bankura D. Maity M.M.R. Mollick D. Mondal B. Bhowmick M.K. Bain A. Chakraborty J. Sarkar K. Acharya D. Chattopadhyay Carbohydr. Polym. 89 2012 1159 1165 (b) G. Yang Q. Lin C. Wang J. Li J. Zhou Y. Wang C. Wang J. Nanosci. Nanotechnol. 12 2012 3766 3774 [5] (c) R. Eising A.M. Signori S. Fort J.B. Domingos Langmuir 27 2011 11860 11866 [6] L. Ai J. Jang Biores. Technol. 132 2013 374 377 [7] S. Pyne S. Samanta A. Misra Solid State Sci. 26 2013 1 8 [8] S. Saha A. Pal S. Kundu S. Basu T. Pal Langmuir 26 2010 2885 2893 [9] (a) H. Ye R.W.J. Scott R.M. Crooks Langmuir 20 2004 2915 2920 (b) J. Zheng M.S. Stevenson R.S. Hikida P.G. Van Patten J. Phys. Chem. B 106 2002 1252 1255 [10] K. Hayakawa T. Yoshimura K. Esumi Langmuir 19 2003 5517 5521 [11] (a) S. Pande S.K. Ghosh S. Praharaj S. Painigrahi S. Basu S. Jana A. Pal T. Tsukuda T. Pal J. Phys. Chem. C 111 2007 10806 10813 (b) Y. Huang D. Li J. Li Chem. Phys. Lett. 389 2004 14 18 (c) P.R. Gopalan Int. J. Nanosci. 9 2010 487 494 (d) P.F. Andrade A. Fonseca de Faria D. Soares da Silva J.A. Bonacin M.C. d. Gonçavales Colloid. Surf. B 118 2014 289 297 [12] B.D. Loganathan A.B. Mandal RSC Adv. 3 2013 5238 5253 [13] (a) J. Liu S. Mendoza E. Román M.J. Lynn R. Xu A.E. Kaifer J. Am. Chem. Soc. 121 1999 4304 4305 (b) J. Liu W. Ong E. Román M.J. Lynn A.E. Kaifer Langmuir 16 2000 3000 3002 (c) J. Liu W. Ong A.E. Kaifer C. Peinador Langmuir 18 2002 5981 5983 (d) Y. Guo Y. Zhao H. Wu M. Fan Y. Wei S. Shuang C. Dong J. Incl. Phenom. Macrocycl. Chem. 78 2014 275 286 (e) X. Li Z. Qi K. Liang X. Bai J. Xu J. Liu J. Shen Catal. Lett. 124 2008 413 417 [14] P. Lo Meo F. D'Anna M. Gruttadauria S. Riela R. Noto Carbohyd. Res. 347 2012 32 39 [15] It is worth stressing here that the synthesis of AmCD from native βCD requires two steps only, and therefore is much more straightforward and cheaper than the syntheses reported in literature of other polyaminocyclodextrin derivatives, obtained as pure individual products and mainly employed for polynucleotide complexation and gene transfection. See for instance: [16] A. Gangula R. Podila M. Ramakrishna L. Karanam C. Janardhana A.M. Rao Langmuir 27 2011 15268 15274 [17] J. Zeng Q. Zhang J. Chen Y. Xia Nano Lett. 10 2010 30 35 [18] N. Bingwa R. Meijboom J. Mol. Catal. A 396 2015 1 7 [19] (a) P. Lo Meo F. D’Anna S. Riela M. Gruttadauria R. Noto Org. Biomol. Chem. 1 2003 1584 1590 (b) P. Lo Meo F. D’Anna S. Riela M. Gruttadauria R. Noto Tetrahedron 63 2007 9163 9171 [20] P. Lo Meo F. D'Anna M. Gruttadauria S. Riela R. Noto Tetrahedron 60 2004 9099 9111 [21] (a) K.G. Thomas, “Surface Plasmon Resonances in Nanostructured Materials” in Nanomaterials Chemistry, pag. 185-218, C.N.R. Rao, A. Müller and A.K. Cheetham Eds., Wiley-VCH, Weinheim (Germany), 2007. It is worth stressing that polarity or refractive index variations may in turn be the outcome of a ligand exchange at the NP surface. For instance, it has been recently shown that the position of the SPR is significantly shifted in presence of halide ions. See: (b) B.-H. Kim J.-S. Lee Mater. Chem. Phys. 149–150 2015 678 685 (c) X.C. Jiang A.B. Yu Langmuir 24 2008 4300 4309 [22] (a) Y. Zhu M. Shen Y. Xia M. Lu Catal. Commun. 64 2015 37 43 (b) F. Valentini D. Roscioli M. Carbone V. Conte B. Floris E.M. Bauer E. Caponetti D. Chillura-Martino Sens. Actuators B 212 2015 248 255 (c) M.L. Saladino D. Chillura Martino E. Kraleva E. Caponetti Catal. Commun. 36 2013 10 15 (d) E. Caponetti L. Pedone M.L. Saladino D. Chillura Martino G. Nasillo Micropor. Mesopor. Mater. 128 2010 101 107 [23] This estimation is based on the fact that the βCD torus alone is reported to have an average diameter of 1.54 nm (see ref. [20]), and that the length of a stretched diamine pendant chain can be estimated (MM2) as ca. 0.8 nm. [24] J. Szejtli Chem. Rev. 98 1998 1743 1753 [25] S. Wunder F. Polzer Y. Lu Y. Mei M. Ballauff J. Phys. Chem. C 114 2010 8814 8820 [26] Y. Gao X. Ding Z. Zheng X. Cheng Y. Peng Chem. Commun. 2007 3720 3722 [27] M. Blosi S. Albionetti S. Ortelli A.L. Costa M. Ortolani L. Dondi New J. Chem. 38 2014 1401 1409 [28] A.M. Signori K. de O. Santos R. Eising B.L. Albuquerque F.C. Giacomelli J.B. Domingos Langmuir 26 2010 17772 17779 [29] K. Vasenth Kumar K. Porkodi F. Roche Catal. Commun. 9 2008 82 84 [30] (a) J.S. Zhang W.N. Delgass T.S. Fisher J.P. Gore J. Power Sources 164 2007 772 781 (b) F. Lin R. Doong Appl. Catal. A 486 2014 32 41 [31] J.W. Rodriguez-Acosta M.A. Mueses F. Machuca-Martínez Int. J. Photoenergy 2014 10.1155/2014/817538 [32] G. Guella B. Patton A. Miotello J. Phys. Chem. C 111 2007 18744 18750 [33] Q. Zhou G. Qian Y. Li G. Zhao Y. Chao J. Zheng Thin Solid Films 516 2008 953 956 [34] Of course, the fitting analysis is carried out directly on spectrophotometric data. For this purpose, equation (3) is trivially modified by posing: C0 =(Abs0-Abs∞)/ϵArNO2 and |ArNO2|=(Abst-Abs∞)/ϵArNO2; where Abs0 and Abs∞ are the initial and final absorbances respectively, Abst is the absorbance at a given time t, and ϵArNO2 is the molar extinction coefficient of the substrate at the operational wavelength. Noticeably, Abs∞ keeps into account the possible contribution to the overall absorbance from the Ag-NP catalyst (the contribution from the aniline product is negligible). [35] (a) S. Jana S.K. Gosh S. Nath S. Pande S. Paharaj S. Panigrahi S. Basu T. Endo T. Pal Appl. Catal. A 313 2006 41 48 (b) K.B. Narayanan N. Sakthivel Biores. Technol. 102 2011 10737 10740 [36] The latter statement needs to be briefly justified. As a matter of fact, it has to be reminded that most of the AmCD units present in the system cannot interact with the NPs surface and are delivered into solution, as discussed previously. Delivered AmCD can form host-guest inclusion complexes with the nitroarene substrate. The molar fraction of units engaged in this process depends, in turn, on the binding constant KCD and on the analytical concentration of the substrate, and it can be calculated algebraically. Now, by assuming that the KCD values for nitroarenes 1-8 towards AmCD are similar to those found in the case of native βCD (see ref. [18] and [19]), it follows that the concentration of a possible (ArNO2·AmCD) inclusion complex is actually negligible with respect to free AmCD. [37] X. Li J. Wang Y. Zhang M. Li J. Liu Eur. J. Org. Chem. 2010 1806 1812 [38] (a) T.-X. Lü D.-B. Zhang S.-J. Dong J. Chem. Soc. Faraday Trans. 85 1989 1439 1445 (b) H.-J. Schneider F. Hacket V. Rüdiger H. Ikeda Chem. Rev. 98 1998 1755 1785 (c) G.M. Bonora R. Fornasier P. Scrimin U. Tonellato J. Chem. Soc. Perkin Trans. 2 1985 367 369 (d) O.S. Tee C. Mazza X.-X. Du J. Org. Chem. 55 1990 3603 3609 (e) P. Lo Meo F. D’Anna S. Riela M. Gruttadauria R. Noto Tetrahedron 58 2002 6039 6045 (f) P. Lo Meo F. D’Anna S. Riela M. Gruttadauria R. Noto Tetrahedron 65 2009 2037 2042 (g) P. Lo Meo F. D’Anna M. Gruttadauria S. Riela R. Noto Tetrahedron 65 2009 10413 10417 [39] F. D’Anna P. Lo Meo S. Riela M. Gruttadauria R. Noto Tetrahedron 57 2001 6823 6827 [40] It is worth noting that in our particular system, unfortunately, it is very hard to verify otherwise the occurrence of radical-involving mechanistic pathways. As a matter of fact, classical radical scavengers such as phenols or thiols cannot be employed because, being acidic species, they immediately decompose the BH4 − ion. [41] D.E.J. Koppel Chem. Phys. 57 1972 4814 4820 [42] (a) S.W. Provencher Macromol. Chem. 180 1979 201 209 (b) S.W. Provencher Comput. Phys. Commun. 27 1982 213 227",
      "scopus-id": "84940197146",
      "coredata": {
        "eid": "1-s2.0-S138111691530042X",
        "dc:description": "Silver nanoparticles stabilized by means of poly-(6-N,N-dimethyl-propylenediamino)-(6-deoxy)-β-cyclodextrin were synthesized, characterized by different techniques (UV–vis spectroscopy, Dynamic Light Scattering, High Resolution Transmission Electron Microscopy, Fourier-transform IR Spectroscopy) and used as catalysts for the reduction of various nitrobenzene derivatives with sodium borohydride. The nanocomposites obtained appear to have an organized structure, with a metal core surrounded by a layer-structured coating shell. Kinetic data, rationalized in terms of a modified Langmuir–Hinshelwood model, evidenced a non-linear dependence of the reaction rate on the concentration of the catalyst. This was explained on the grounds of the catalytic activity of differently covered catalyst areas. Careful analysis of kinetic data, in particular the effect of the para substituent on the nitroarene structure and the trends of the induction period observed at the beginning of the reaction, provided with interesting insights on the reaction course, and brought us to critically reconsider several mechanistic ideas reported in previous literature.",
        "openArchiveArticle": "false",
        "prism:coverDate": "2015-11-30",
        "openaccessUserLicense": null,
        "prism:aggregationType": "Journal",
        "prism:url": "https://api.elsevier.com/content/article/pii/S138111691530042X",
        "dc:creator": [
          {
            "@_fa": "true",
            "$": "Russo, Marco"
          },
          {
            "@_fa": "true",
            "$": "Armetta, Francesco"
          },
          {
            "@_fa": "true",
            "$": "Riela, Serena"
          },
          {
            "@_fa": "true",
            "$": "Chillura Martino, Delia"
          },
          {
            "@_fa": "true",
            "$": "Meo, Paolo Lo"
          },
          {
            "@_fa": "true",
            "$": "Noto, Renato"
          }
        ],
        "link": [
          {
            "@_fa": "true",
            "@rel": "self",
            "@href": "https://api.elsevier.com/content/article/pii/S138111691530042X"
          },
          {
            "@_fa": "true",
            "@rel": "scidir",
            "@href": "https://www.sciencedirect.com/science/article/pii/S138111691530042X"
          }
        ],
        "dc:format": "application/json",
        "openaccessType": null,
        "pii": "S1381-1169(15)30042-X",
        "prism:volume": "408",
        "prism:publisher": "Elsevier B.V. All rights are reserved, including those for text and data mining, AI training, and similar technologies.",
        "dc:title": "Silver nanoparticles stabilized by a polyaminocyclodextrin as catalysts for the reduction of nitroaromatic compounds",
        "prism:copyright": "Copyright © 2015 Elsevier B.V. All rights are reserved, including those for text and data mining, AI training, and similar technologies.",
        "openaccess": "0",
        "prism:issn": "13811169",
        "dcterms:subject": [
          {
            "@_fa": "true",
            "$": "Polyaminocyclodextrin"
          },
          {
            "@_fa": "true",
            "$": "Nitroarene reduction"
          },
          {
            "@_fa": "true",
            "$": "Silver nanocomposite"
          }
        ],
        "openaccessArticle": "false",
        "prism:publicationName": "Journal of Molecular Catalysis A: Chemical",
        "openaccessSponsorType": null,
        "prism:pageRange": "250-261",
        "prism:endingPage": "261",
        "pubType": "fla",
        "prism:coverDisplayDate": "November 2015",
        "prism:doi": "10.1016/j.molcata.2015.07.031",
        "prism:startingPage": "250",
        "dc:identifier": "doi:10.1016/j.molcata.2015.07.031",
        "openaccessSponsorName": null
      },
      "objects": {
        "object": [
          {
            "@category": "standard",
            "@height": "200",
            "@width": "500",
            "@_fa": "true",
            "$": "https://api.elsevier.com/content/object/eid/1-s2.0-S138111691530042X-fx1.jpg?httpAccept=%2A%2F%2A",
            "@multimediatype": "JPEG image file",
            "@type": "IMAGE-DOWNSAMPLED",
            "@size": "24830",
            "@ref": "fx1",
            "@mimetype": "image/jpeg"
          },
          {
            "@category": "standard",
            "@height": "68",
            "@width": "94",
            "@_fa": "true",
            "$": "https://api.elsevier.com/content/object/eid/1-s2.0-S138111691530042X-gr1.jpg?httpAccept=%2A%2F%2A",
            "@multimediatype": "JPEG image file",
            "@type": "IMAGE-DOWNSAMPLED",
            "@size": "2969",
            "@ref": "gr1",
            "@mimetype": "image/jpeg"
          },
          {
            "@category": "standard",
            "@height": "67",
            "@width": "56",
            "@_fa": "true",
            "$": "https://api.elsevier.com/content/object/eid/1-s2.0-S138111691530042X-gr2.jpg?httpAccept=%2A%2F%2A",
            "@multimediatype": "JPEG image file",
            "@type": "IMAGE-DOWNSAMPLED",
            "@size": "2008",
            "@ref": "gr2",
            "@mimetype": "image/jpeg"
          },
          {
            "@category": "standard",
            "@height": "90",
            "@width": "127",
            "@_fa": "true",
            "$": "https://api.elsevier.com/content/object/eid/1-s2.0-S138111691530042X-gr3.jpg?httpAccept=%2A%2F%2A",
            "@multimediatype": "JPEG image file",
            "@type": "IMAGE-DOWNSAMPLED",
            "@size": "4212",
            "@ref": "gr3",
            "@mimetype": "image/jpeg"
          },
          {
            "@category": "standard",
            "@height": "176",
            "@width": "255",
            "@_fa": "true",
            "$": "https://api.elsevier.com/content/object/eid/1-s2.0-S138111691530042X-gr4.jpg?httpAccept=%2A%2F%2A",
            "@multimediatype": "JPEG image file",
            "@type": "IMAGE-DOWNSAMPLED",
            "@size": "11808",
            "@ref": "gr4",
            "@mimetype": "image/jpeg"
          },
          {
            "@category": "standard",
            "@height": "111",
            "@width": "255",
            "@_fa": "true",
            "$": "https://api.elsevier.com/content/object/eid/1-s2.0-S138111691530042X-gr5.jpg?httpAccept=%2A%2F%2A",
            "@multimediatype": "JPEG image file",
            "@type": "IMAGE-DOWNSAMPLED",
            "@size": "6406",
            "@ref": "gr5",
            "@mimetype": "image/jpeg"
          },
          {
            "@category": "standard",
            "@height": "118",
            "@width": "141",
            "@_fa": "true",
            "$": "https://api.elsevier.com/content/object/eid/1-s2.0-S138111691530042X-gr6.jpg?httpAccept=%2A%2F%2A",
            "@multimediatype": "JPEG image file",
            "@type": "IMAGE-DOWNSAMPLED",
            "@size": "4455",
            "@ref": "gr6",
            "@mimetype": "image/jpeg"
          },
          {
            "@category": "standard",
            "@height": "112",
            "@width": "141",
            "@_fa": "true",
            "$": "https://api.elsevier.com/content/object/eid/1-s2.0-S138111691530042X-gr7.jpg?httpAccept=%2A%2F%2A",
            "@multimediatype": "JPEG image file",
            "@type": "IMAGE-DOWNSAMPLED",
            "@size": "3524",
            "@ref": "gr7",
            "@mimetype": "image/jpeg"
          },
          {
            "@category": "standard",
            "@height": "163",
            "@width": "254",
            "@_fa": "true",
            "$": "https://api.elsevier.com/content/object/eid/1-s2.0-S138111691530042X-gr8.jpg?httpAccept=%2A%2F%2A",
            "@multimediatype": "JPEG image file",
            "@type": "IMAGE-DOWNSAMPLED",
            "@size": "11608",
            "@ref": "gr8",
            "@mimetype": "image/jpeg"
          },
          {
            "@category": "standard",
            "@height": "118",
            "@width": "141",
            "@_fa": "true",
            "$": "https://api.elsevier.com/content/object/eid/1-s2.0-S138111691530042X-gr9.jpg?httpAccept=%2A%2F%2A",
            "@multimediatype": "JPEG image file",
            "@type": "IMAGE-DOWNSAMPLED",
            "@size": "3572",
            "@ref": "gr9",
            "@mimetype": "image/jpeg"
          },
          {
            "@category": "standard",
            "@height": "38",
            "@width": "69",
            "@_fa": "true",
            "$": "https://api.elsevier.com/content/object/eid/1-s2.0-S138111691530042X-sc1.jpg?httpAccept=%2A%2F%2A",
            "@multimediatype": "JPEG image file",
            "@type": "IMAGE-DOWNSAMPLED",
            "@size": "1462",
            "@ref": "sc1",
            "@mimetype": "image/jpeg"
          },
          {
            "@category": "standard",
            "@height": "45",
            "@width": "123",
            "@_fa": "true",
            "$": "https://api.elsevier.com/content/object/eid/1-s2.0-S138111691530042X-sc2.jpg?httpAccept=%2A%2F%2A",
            "@multimediatype": "JPEG image file",
            "@type": "IMAGE-DOWNSAMPLED",
            "@size": "2656",
            "@ref": "sc2",
            "@mimetype": "image/jpeg"
          },
          {
            "@category": "standard",
            "@height": "115",
            "@width": "226",
            "@_fa": "true",
            "$": "https://api.elsevier.com/content/object/eid/1-s2.0-S138111691530042X-sc3.jpg?httpAccept=%2A%2F%2A",
            "@multimediatype": "JPEG image file",
            "@type": "IMAGE-DOWNSAMPLED",
            "@size": "8562",
            "@ref": "sc3",
            "@mimetype": "image/jpeg"
          },
          {
            "@category": "standard",
            "@height": "47",
            "@width": "174",
            "@_fa": "true",
            "$": "https://api.elsevier.com/content/object/eid/1-s2.0-S138111691530042X-sc4.jpg?httpAccept=%2A%2F%2A",
            "@multimediatype": "JPEG image file",
            "@type": "IMAGE-DOWNSAMPLED",
            "@size": "2430",
            "@ref": "sc4",
            "@mimetype": "image/jpeg"
          },
          {
            "@category": "standard",
            "@height": "171",
            "@width": "191",
            "@_fa": "true",
            "$": "https://api.elsevier.com/content/object/eid/1-s2.0-S138111691530042X-sc5.jpg?httpAccept=%2A%2F%2A",
            "@multimediatype": "JPEG image file",
            "@type": "IMAGE-DOWNSAMPLED",
            "@size": "9252",
            "@ref": "sc5",
            "@mimetype": "image/jpeg"
          },
          {
            "@category": "thumbnail",
            "@height": "88",
            "@width": "219",
            "@_fa": "true",
            "$": "https://api.elsevier.com/content/object/eid/1-s2.0-S138111691530042X-fx1.sml?httpAccept=%2A%2F%2A",
            "@multimediatype": "GIF image file",
            "@type": "IMAGE-THUMBNAIL",
            "@size": "7348",
            "@ref": "fx1",
            "@mimetype": "image/gif"
          },
          {
            "@category": "thumbnail",
            "@height": "159",
            "@width": "219",
            "@_fa": "true",
            "$": "https://api.elsevier.com/content/object/eid/1-s2.0-S138111691530042X-gr1.sml?httpAccept=%2A%2F%2A",
            "@multimediatype": "GIF image file",
            "@type": "IMAGE-THUMBNAIL",
            "@size": "8702",
            "@ref": "gr1",
            "@mimetype": "image/gif"
          },
          {
            "@category": "thumbnail",
            "@height": "178",
            "@width": "149",
            "@_fa": "true",
            "$": "https://api.elsevier.com/content/object/eid/1-s2.0-S138111691530042X-gr2.sml?httpAccept=%2A%2F%2A",
            "@multimediatype": "GIF image file",
            "@type": "IMAGE-THUMBNAIL",
            "@size": "6506",
            "@ref": "gr2",
            "@mimetype": "image/gif"
          },
          {
            "@category": "thumbnail",
            "@height": "154",
            "@width": "219",
            "@_fa": "true",
            "$": "https://api.elsevier.com/content/object/eid/1-s2.0-S138111691530042X-gr3.sml?httpAccept=%2A%2F%2A",
            "@multimediatype": "GIF image file",
            "@type": "IMAGE-THUMBNAIL",
            "@size": "8755",
            "@ref": "gr3",
            "@mimetype": "image/gif"
          },
          {
            "@category": "thumbnail",
            "@height": "151",
            "@width": "219",
            "@_fa": "true",
            "$": "https://api.elsevier.com/content/object/eid/1-s2.0-S138111691530042X-gr4.sml?httpAccept=%2A%2F%2A",
            "@multimediatype": "GIF image file",
            "@type": "IMAGE-THUMBNAIL",
            "@size": "16754",
            "@ref": "gr4",
            "@mimetype": "image/gif"
          },
          {
            "@category": "thumbnail",
            "@height": "95",
            "@width": "219",
            "@_fa": "true",
            "$": "https://api.elsevier.com/content/object/eid/1-s2.0-S138111691530042X-gr5.sml?httpAccept=%2A%2F%2A",
            "@multimediatype": "GIF image file",
            "@type": "IMAGE-THUMBNAIL",
            "@size": "4381",
            "@ref": "gr5",
            "@mimetype": "image/gif"
          },
          {
            "@category": "thumbnail",
            "@height": "164",
            "@width": "196",
            "@_fa": "true",
            "$": "https://api.elsevier.com/content/object/eid/1-s2.0-S138111691530042X-gr6.sml?httpAccept=%2A%2F%2A",
            "@multimediatype": "GIF image file",
            "@type": "IMAGE-THUMBNAIL",
            "@size": "6142",
            "@ref": "gr6",
            "@mimetype": "image/gif"
          },
          {
            "@category": "thumbnail",
            "@height": "164",
            "@width": "207",
            "@_fa": "true",
            "$": "https://api.elsevier.com/content/object/eid/1-s2.0-S138111691530042X-gr7.sml?httpAccept=%2A%2F%2A",
            "@multimediatype": "GIF image file",
            "@type": "IMAGE-THUMBNAIL",
            "@size": "5421",
            "@ref": "gr7",
            "@mimetype": "image/gif"
          },
          {
            "@category": "thumbnail",
            "@height": "141",
            "@width": "219",
            "@_fa": "true",
            "$": "https://api.elsevier.com/content/object/eid/1-s2.0-S138111691530042X-gr8.sml?httpAccept=%2A%2F%2A",
            "@multimediatype": "GIF image file",
            "@type": "IMAGE-THUMBNAIL",
            "@size": "7488",
            "@ref": "gr8",
            "@mimetype": "image/gif"
          },
          {
            "@category": "thumbnail",
            "@height": "164",
            "@width": "196",
            "@_fa": "true",
            "$": "https://api.elsevier.com/content/object/eid/1-s2.0-S138111691530042X-gr9.sml?httpAccept=%2A%2F%2A",
            "@multimediatype": "GIF image file",
            "@type": "IMAGE-THUMBNAIL",
            "@size": "4513",
            "@ref": "gr9",
            "@mimetype": "image/gif"
          },
          {
            "@category": "thumbnail",
            "@height": "103",
            "@width": "185",
            "@_fa": "true",
            "$": "https://api.elsevier.com/content/object/eid/1-s2.0-S138111691530042X-sc1.sml?httpAccept=%2A%2F%2A",
            "@multimediatype": "GIF image file",
            "@type": "IMAGE-THUMBNAIL",
            "@size": "4808",
            "@ref": "sc1",
            "@mimetype": "image/gif"
          },
          {
            "@category": "thumbnail",
            "@height": "80",
            "@width": "219",
            "@_fa": "true",
            "$": "https://api.elsevier.com/content/object/eid/1-s2.0-S138111691530042X-sc2.sml?httpAccept=%2A%2F%2A",
            "@multimediatype": "GIF image file",
            "@type": "IMAGE-THUMBNAIL",
            "@size": "4814",
            "@ref": "sc2",
            "@mimetype": "image/gif"
          },
          {
            "@category": "thumbnail",
            "@height": "112",
            "@width": "219",
            "@_fa": "true",
            "$": "https://api.elsevier.com/content/object/eid/1-s2.0-S138111691530042X-sc3.sml?httpAccept=%2A%2F%2A",
            "@multimediatype": "GIF image file",
            "@type": "IMAGE-THUMBNAIL",
            "@size": "8205",
            "@ref": "sc3",
            "@mimetype": "image/gif"
          },
          {
            "@category": "thumbnail",
            "@height": "60",
            "@width": "219",
            "@_fa": "true",
            "$": "https://api.elsevier.com/content/object/eid/1-s2.0-S138111691530042X-sc4.sml?httpAccept=%2A%2F%2A",
            "@multimediatype": "GIF image file",
            "@type": "IMAGE-THUMBNAIL",
            "@size": "2920",
            "@ref": "sc4",
            "@mimetype": "image/gif"
          },
          {
            "@category": "thumbnail",
            "@height": "163",
            "@width": "182",
            "@_fa": "true",
            "$": "https://api.elsevier.com/content/object/eid/1-s2.0-S138111691530042X-sc5.sml?httpAccept=%2A%2F%2A",
            "@multimediatype": "GIF image file",
            "@type": "IMAGE-THUMBNAIL",
            "@size": "6190",
            "@ref": "sc5",
            "@mimetype": "image/gif"
          },
          {
            "@category": "high",
            "@height": "531",
            "@width": "1328",
            "@_fa": "true",
            "$": "https://api.elsevier.com/content/object/eid/1-s2.0-S138111691530042X-fx1_lrg.jpg?httpAccept=%2A%2F%2A",
            "@multimediatype": "JPEG image file",
            "@type": "IMAGE-HIGH-RES",
            "@size": "96009",
            "@ref": "fx1",
            "@mimetype": "image/jpeg"
          },
          {
            "@category": "high",
            "@height": "183",
            "@width": "252",
            "@_fa": "true",
            "$": "https://api.elsevier.com/content/object/eid/1-s2.0-S138111691530042X-gr1_lrg.jpg?httpAccept=%2A%2F%2A",
            "@multimediatype": "JPEG image file",
            "@type": "IMAGE-HIGH-RES",
            "@size": "11403",
            "@ref": "gr1",
            "@mimetype": "image/jpeg"
          },
          {
            "@category": "high",
            "@height": "178",
            "@width": "149",
            "@_fa": "true",
            "$": "https://api.elsevier.com/content/object/eid/1-s2.0-S138111691530042X-gr2_lrg.jpg?httpAccept=%2A%2F%2A",
            "@multimediatype": "JPEG image file",
            "@type": "IMAGE-HIGH-RES",
            "@size": "7045",
            "@ref": "gr2",
            "@mimetype": "image/jpeg"
          },
          {
            "@category": "high",
            "@height": "239",
            "@width": "339",
            "@_fa": "true",
            "$": "https://api.elsevier.com/content/object/eid/1-s2.0-S138111691530042X-gr3_lrg.jpg?httpAccept=%2A%2F%2A",
            "@multimediatype": "JPEG image file",
            "@type": "IMAGE-HIGH-RES",
            "@size": "17828",
            "@ref": "gr3",
            "@mimetype": "image/jpeg"
          },
          {
            "@category": "high",
            "@height": "468",
            "@width": "678",
            "@_fa": "true",
            "$": "https://api.elsevier.com/content/object/eid/1-s2.0-S138111691530042X-gr4_lrg.jpg?httpAccept=%2A%2F%2A",
            "@multimediatype": "JPEG image file",
            "@type": "IMAGE-HIGH-RES",
            "@size": "73297",
            "@ref": "gr4",
            "@mimetype": "image/jpeg"
          },
          {
            "@category": "high",
            "@height": "294",
            "@width": "678",
            "@_fa": "true",
            "$": "https://api.elsevier.com/content/object/eid/1-s2.0-S138111691530042X-gr5_lrg.jpg?httpAccept=%2A%2F%2A",
            "@multimediatype": "JPEG image file",
            "@type": "IMAGE-HIGH-RES",
            "@size": "29374",
            "@ref": "gr5",
            "@mimetype": "image/jpeg"
          },
          {
            "@category": "high",
            "@height": "314",
            "@width": "376",
            "@_fa": "true",
            "$": "https://api.elsevier.com/content/object/eid/1-s2.0-S138111691530042X-gr6_lrg.jpg?httpAccept=%2A%2F%2A",
            "@multimediatype": "JPEG image file",
            "@type": "IMAGE-HIGH-RES",
            "@size": "18696",
            "@ref": "gr6",
            "@mimetype": "image/jpeg"
          },
          {
            "@category": "high",
            "@height": "298",
            "@width": "376",
            "@_fa": "true",
            "$": "https://api.elsevier.com/content/object/eid/1-s2.0-S138111691530042X-gr7_lrg.jpg?httpAccept=%2A%2F%2A",
            "@multimediatype": "JPEG image file",
            "@type": "IMAGE-HIGH-RES",
            "@size": "14161",
            "@ref": "gr7",
            "@mimetype": "image/jpeg"
          },
          {
            "@category": "high",
            "@height": "434",
            "@width": "676",
            "@_fa": "true",
            "$": "https://api.elsevier.com/content/object/eid/1-s2.0-S138111691530042X-gr8_lrg.jpg?httpAccept=%2A%2F%2A",
            "@multimediatype": "JPEG image file",
            "@type": "IMAGE-HIGH-RES",
            "@size": "53770",
            "@ref": "gr8",
            "@mimetype": "image/jpeg"
          },
          {
            "@category": "high",
            "@height": "315",
            "@width": "376",
            "@_fa": "true",
            "$": "https://api.elsevier.com/content/object/eid/1-s2.0-S138111691530042X-gr9_lrg.jpg?httpAccept=%2A%2F%2A",
            "@multimediatype": "JPEG image file",
            "@type": "IMAGE-HIGH-RES",
            "@size": "13903",
            "@ref": "gr9",
            "@mimetype": "image/jpeg"
          },
          {
            "@category": "high",
            "@height": "103",
            "@width": "185",
            "@_fa": "true",
            "$": "https://api.elsevier.com/content/object/eid/1-s2.0-S138111691530042X-sc1_lrg.jpg?httpAccept=%2A%2F%2A",
            "@multimediatype": "JPEG image file",
            "@type": "IMAGE-HIGH-RES",
            "@size": "5068",
            "@ref": "sc1",
            "@mimetype": "image/jpeg"
          },
          {
            "@category": "high",
            "@height": "120",
            "@width": "329",
            "@_fa": "true",
            "$": "https://api.elsevier.com/content/object/eid/1-s2.0-S138111691530042X-sc2_lrg.jpg?httpAccept=%2A%2F%2A",
            "@multimediatype": "JPEG image file",
            "@type": "IMAGE-HIGH-RES",
            "@size": "10014",
            "@ref": "sc2",
            "@mimetype": "image/jpeg"
          },
          {
            "@category": "high",
            "@height": "307",
            "@width": "602",
            "@_fa": "true",
            "$": "https://api.elsevier.com/content/object/eid/1-s2.0-S138111691530042X-sc3_lrg.jpg?httpAccept=%2A%2F%2A",
            "@multimediatype": "JPEG image file",
            "@type": "IMAGE-HIGH-RES",
            "@size": "45805",
            "@ref": "sc3",
            "@mimetype": "image/jpeg"
          },
          {
            "@category": "high",
            "@height": "126",
            "@width": "462",
            "@_fa": "true",
            "$": "https://api.elsevier.com/content/object/eid/1-s2.0-S138111691530042X-sc4_lrg.jpg?httpAccept=%2A%2F%2A",
            "@multimediatype": "JPEG image file",
            "@type": "IMAGE-HIGH-RES",
            "@size": "9431",
            "@ref": "sc4",
            "@mimetype": "image/jpeg"
          },
          {
            "@category": "high",
            "@height": "457",
            "@width": "509",
            "@_fa": "true",
            "$": "https://api.elsevier.com/content/object/eid/1-s2.0-S138111691530042X-sc5_lrg.jpg?httpAccept=%2A%2F%2A",
            "@multimediatype": "JPEG image file",
            "@type": "IMAGE-HIGH-RES",
            "@size": "39799",
            "@ref": "sc5",
            "@mimetype": "image/jpeg"
          },
          {
            "@category": "standard",
            "@_fa": "true",
            "$": "https://api.elsevier.com/content/object/eid/1-s2.0-S138111691530042X-mmc1.docx?httpAccept=%2A%2F%2A",
            "@multimediatype": "Microsoft Word file",
            "@type": "APPLICATION",
            "@size": "3367931",
            "@ref": "mmc1",
            "@mimetype": "application/word"
          },
          {
            "@category": "thumbnail",
            "@height": "43",
            "@width": "576",
            "@_fa": "true",
            "$": "https://api.elsevier.com/content/object/eid/1-s2.0-S138111691530042X-si1.gif?httpAccept=%2A%2F%2A",
            "@multimediatype": "GIF image file",
            "@type": "ALTIMG",
            "@size": "2428",
            "@ref": "si1",
            "@mimetype": "image/gif"
          },
          {
            "@category": "thumbnail",
            "@height": "42",
            "@width": "405",
            "@_fa": "true",
            "$": "https://api.elsevier.com/content/object/eid/1-s2.0-S138111691530042X-si2.gif?httpAccept=%2A%2F%2A",
            "@multimediatype": "GIF image file",
            "@type": "ALTIMG",
            "@size": "2033",
            "@ref": "si2",
            "@mimetype": "image/gif"
          },
          {
            "@category": "thumbnail",
            "@height": "101",
            "@width": "590",
            "@_fa": "true",
            "$": "https://api.elsevier.com/content/object/eid/1-s2.0-S138111691530042X-si3.gif?httpAccept=%2A%2F%2A",
            "@multimediatype": "GIF image file",
            "@type": "ALTIMG",
            "@size": "5066",
            "@ref": "si3",
            "@mimetype": "image/gif"
          },
          {
            "@category": "thumbnail",
            "@height": "47",
            "@width": "591",
            "@_fa": "true",
            "$": "https://api.elsevier.com/content/object/eid/1-s2.0-S138111691530042X-si4.gif?httpAccept=%2A%2F%2A",
            "@multimediatype": "GIF image file",
            "@type": "ALTIMG",
            "@size": "3195",
            "@ref": "si4",
            "@mimetype": "image/gif"
          },
          {
            "@category": "thumbnail",
            "@height": "47",
            "@width": "452",
            "@_fa": "true",
            "$": "https://api.elsevier.com/content/object/eid/1-s2.0-S138111691530042X-si5.gif?httpAccept=%2A%2F%2A",
            "@multimediatype": "GIF image file",
            "@type": "ALTIMG",
            "@size": "2588",
            "@ref": "si5",
            "@mimetype": "image/gif"
          },
          {
            "@category": "thumbnail",
            "@height": "43",
            "@width": "289",
            "@_fa": "true",
            "$": "https://api.elsevier.com/content/object/eid/1-s2.0-S138111691530042X-si6.gif?httpAccept=%2A%2F%2A",
            "@multimediatype": "GIF image file",
            "@type": "ALTIMG",
            "@size": "1489",
            "@ref": "si6",
            "@mimetype": "image/gif"
          },
          {
            "@category": "thumbnail",
            "@height": "43",
            "@width": "265",
            "@_fa": "true",
            "$": "https://api.elsevier.com/content/object/eid/1-s2.0-S138111691530042X-si7.gif?httpAccept=%2A%2F%2A",
            "@multimediatype": "GIF image file",
            "@type": "ALTIMG",
            "@size": "1507",
            "@ref": "si7",
            "@mimetype": "image/gif"
          },
          {
            "@category": "thumbnail",
            "@height": "42",
            "@width": "222",
            "@_fa": "true",
            "$": "https://api.elsevier.com/content/object/eid/1-s2.0-S138111691530042X-si8.gif?httpAccept=%2A%2F%2A",
            "@multimediatype": "GIF image file",
            "@type": "ALTIMG",
            "@size": "1165",
            "@ref": "si8",
            "@mimetype": "image/gif"
          }
        ]
      },
      "link": {
        "@rel": "abstract",
        "@href": "https://api.elsevier.com/content/abstract/scopus_id/84940197146"
      }
    }
  }
}