{
  "metadata": {
    "title": "Catalyst precursors for ethylene polymerization based on novel mono- and bi-nuclear pyridylimine-type palladium(II) complexes with long straight chain alkyl substituents at the imino nitrogen",
    "authors": "; ",
    "journal": "Journal of Molecular Catalysis A: Chemical",
    "date": "2003-02-17",
    "doi": "10.1016/S1381-1169(02)00456-9",
    "abstract": "",
    "uri": "https://api.elsevier.com/content/article/pii/S1381116902004569",
    "pii": "S1381116902004569"
  },
  "fulltext": {
    "full-text-retrieval-response": {
      "scopus-eid": "2-s2.0-0042972858",
      "originalText": "serial JL 271358 291210 291744 291790 291809 31 Journal of Molecular Catalysis A: Chemical JOURNALMOLECULARCATALYSISACHEMICAL 2002-10-22 2002-10-22 2010-04-18T22:33:40 1-s2.0-S1381116902004569 S1381-1169(02)00456-9 S1381116902004569 10.1016/S1381-1169(02)00456-9 S300 S300.1 FULL-TEXT 1-s2.0-S1381116900X01628 2015-05-15T05:56:33.301439-04:00 0 0 20030217 2003 2002-10-22T00:00:00Z articleinfo crossmark dco dateupdated tomb dateloaded datesearch indexeddate issuelist volumelist yearnav absattachment articletitlenorm authfirstinitialnorm authfirstsurnamenorm cid cids contenttype copyright dateloadedtxt docsubtype doctype doi eid ewtransactionid hubeid issfirst issn issnnorm itemstage itemtransactionid itemweight openaccess openarchive pg pgfirst pglast pii piinorm pubdatestart pubdatetxt pubyr sortorder srctitle srctitlenorm srctype subheadings volfirst volissue webpdf webpdfpagecount figure table body acknowledge affil articletitle auth authfirstini authfull authkeywords authlast primabst ref specialabst alllist content subj ssids 1381-1169 13811169 193 193 1 2 1 2 Volume 193, Issues 1–2 6 33 40 33 40 20030217 17 February 2003 2003-02-17 2003 converted-article fla Copyright © 2002 Elsevier Science B.V. All rights reserved. CATALYSTPRECURSORSFORETHYLENEPOLYMERIZATIONBASEDNOVELMONOBINUCLEARPYRIDYLIMINETYPEPALLADIUMIICOMPLEXESLONGSTRAIGHTCHAINALKYLSUBSTITUENTSIMINONITROGEN CHEN R 1 Introduction 2 Experimental 2.1 General procedures 2.2 Materials 2.3 Synthesis of N-(dodecyl)pyridyl-2-methanimine (1a) 2.4 Synthesis of N,N′-(1,12-dodecanediyl)bis(pyridyl-2-methanimine) (2a) 2.5 Synthesis of (N-dodecyl-pyridyl-2-methanimine) palladium(II) dichloride (1b) 2.6 Synthesis of N,N′-(μ-1,12-dodecanediyl)bis{(pyridyl-2-methanimine)palladium(II) dichloride} (2b) 2.7 General procedure for ethylene polymerization 3 Results and discussion 3.1 Synthesis of ligands and complexes 3.2 Polymerization of ethylene 4 Conclusions Acknowledgements References JOHNSON 1995 6414 L KILLIAN 1996 11664 C GATES 2000 2320 D BRITOVSEK 1998 849 G BRUCE 1998 2523 M BRITOVSEK 1999 8728 G SMALL 1998 4049 B SMALL 1998 7143 B MENEGHETTI 1999 2734 S KOPPL 2000 45 A LAINE 2000 112 T HADDLETON 1999 2110 D LAVERY 1984 615 A MATSUBAYASHI 1973 215 G DESJARDIN 1998 2328 S CHENX2003X33 CHENX2003X33X40 CHENX2003X33XR CHENX2003X33X40XR item S1381-1169(02)00456-9 S1381116902004569 1-s2.0-S1381116902004569 10.1016/S1381-1169(02)00456-9 271358 2010-10-04T20:38:49.741195-04:00 2003-02-17 1-s2.0-S1381116902004569-main.pdf https://s3.amazonaws.com/prod-ucs-content-store-us-east/content/pii:S1381116902004569/MAIN/application/pdf/d5d7f27b7e36bc0fd38edf7a74d9af7c/main.pdf https://s3-eu-west-1.amazonaws.com/prod-ucs-content-store-eu-west/content/pii:S1381116902004569/MAIN/application/pdf/d5d7f27b7e36bc0fd38edf7a74d9af7c/main.pdf main.pdf pdf true 121227 MAIN 8 1-s2.0-S1381116902004569-main_1.png https://s3.amazonaws.com/prod-ucs-content-store-us-east/content/pii:S1381116902004569/PREVIEW/image/png/3837709ba0fc9d6811b6d51968a88022/main_1.png https://s3-eu-west-1.amazonaws.com/prod-ucs-content-store-eu-west/content/pii:S1381116902004569/PREVIEW/image/png/3837709ba0fc9d6811b6d51968a88022/main_1.png main_1.png png 59967 849 656 IMAGE-WEB-PDF 1 1-s2.0-S1381116902004569-si9.gif https://s3.amazonaws.com/prod-ucs-content-store-us-east/content/pii:S1381116902004569/STRIPIN/image/gif/30a6913e1cd16c33450125f5f316712b/si9.gif https://s3-eu-west-1.amazonaws.com/prod-ucs-content-store-eu-west/content/pii:S1381116902004569/STRIPIN/image/gif/30a6913e1cd16c33450125f5f316712b/si9.gif si9 si9.gif gif 149 14 20 ALTIMG 1-s2.0-S1381116902004569-si8.gif https://s3.amazonaws.com/prod-ucs-content-store-us-east/content/pii:S1381116902004569/STRIPIN/image/gif/f5e3af9466b3a6889be4a563a36dff45/si6.gif https://s3-eu-west-1.amazonaws.com/prod-ucs-content-store-eu-west/content/pii:S1381116902004569/STRIPIN/image/gif/f5e3af9466b3a6889be4a563a36dff45/si6.gif si8 si8.gif gif 192 14 25 ALTIMG 1-s2.0-S1381116902004569-si7.gif https://s3.amazonaws.com/prod-ucs-content-store-us-east/content/pii:S1381116902004569/STRIPIN/image/gif/30a6913e1cd16c33450125f5f316712b/si9.gif https://s3-eu-west-1.amazonaws.com/prod-ucs-content-store-eu-west/content/pii:S1381116902004569/STRIPIN/image/gif/30a6913e1cd16c33450125f5f316712b/si9.gif si7 si7.gif gif 149 14 20 ALTIMG 1-s2.0-S1381116902004569-si6.gif https://s3.amazonaws.com/prod-ucs-content-store-us-east/content/pii:S1381116902004569/STRIPIN/image/gif/f5e3af9466b3a6889be4a563a36dff45/si6.gif https://s3-eu-west-1.amazonaws.com/prod-ucs-content-store-eu-west/content/pii:S1381116902004569/STRIPIN/image/gif/f5e3af9466b3a6889be4a563a36dff45/si6.gif si6 si6.gif gif 192 14 25 ALTIMG 1-s2.0-S1381116902004569-si5.gif https://s3.amazonaws.com/prod-ucs-content-store-us-east/content/pii:S1381116902004569/STRIPIN/image/gif/30a6913e1cd16c33450125f5f316712b/si9.gif https://s3-eu-west-1.amazonaws.com/prod-ucs-content-store-eu-west/content/pii:S1381116902004569/STRIPIN/image/gif/30a6913e1cd16c33450125f5f316712b/si9.gif si5 si5.gif gif 149 14 20 ALTIMG 1-s2.0-S1381116902004569-si4.gif https://s3.amazonaws.com/prod-ucs-content-store-us-east/content/pii:S1381116902004569/STRIPIN/image/gif/f5e3af9466b3a6889be4a563a36dff45/si6.gif https://s3-eu-west-1.amazonaws.com/prod-ucs-content-store-eu-west/content/pii:S1381116902004569/STRIPIN/image/gif/f5e3af9466b3a6889be4a563a36dff45/si6.gif si4 si4.gif gif 192 14 25 ALTIMG 1-s2.0-S1381116902004569-si3.gif https://s3.amazonaws.com/prod-ucs-content-store-us-east/content/pii:S1381116902004569/STRIPIN/image/gif/30a6913e1cd16c33450125f5f316712b/si9.gif https://s3-eu-west-1.amazonaws.com/prod-ucs-content-store-eu-west/content/pii:S1381116902004569/STRIPIN/image/gif/30a6913e1cd16c33450125f5f316712b/si9.gif si3 si3.gif gif 149 14 20 ALTIMG 1-s2.0-S1381116902004569-si2.gif https://s3.amazonaws.com/prod-ucs-content-store-us-east/content/pii:S1381116902004569/STRIPIN/image/gif/f5e3af9466b3a6889be4a563a36dff45/si6.gif https://s3-eu-west-1.amazonaws.com/prod-ucs-content-store-eu-west/content/pii:S1381116902004569/STRIPIN/image/gif/f5e3af9466b3a6889be4a563a36dff45/si6.gif si2 si2.gif gif 192 14 25 ALTIMG 1-s2.0-S1381116902004569-si15.gif https://s3.amazonaws.com/prod-ucs-content-store-us-east/content/pii:S1381116902004569/STRIPIN/image/gif/f5e3af9466b3a6889be4a563a36dff45/si6.gif https://s3-eu-west-1.amazonaws.com/prod-ucs-content-store-eu-west/content/pii:S1381116902004569/STRIPIN/image/gif/f5e3af9466b3a6889be4a563a36dff45/si6.gif si15 si15.gif gif 192 14 25 ALTIMG 1-s2.0-S1381116902004569-si14.gif https://s3.amazonaws.com/prod-ucs-content-store-us-east/content/pii:S1381116902004569/STRIPIN/image/gif/30a6913e1cd16c33450125f5f316712b/si9.gif https://s3-eu-west-1.amazonaws.com/prod-ucs-content-store-eu-west/content/pii:S1381116902004569/STRIPIN/image/gif/30a6913e1cd16c33450125f5f316712b/si9.gif si14 si14.gif gif 149 14 20 ALTIMG 1-s2.0-S1381116902004569-si13.gif https://s3.amazonaws.com/prod-ucs-content-store-us-east/content/pii:S1381116902004569/STRIPIN/image/gif/f5e3af9466b3a6889be4a563a36dff45/si6.gif https://s3-eu-west-1.amazonaws.com/prod-ucs-content-store-eu-west/content/pii:S1381116902004569/STRIPIN/image/gif/f5e3af9466b3a6889be4a563a36dff45/si6.gif si13 si13.gif gif 192 14 25 ALTIMG 1-s2.0-S1381116902004569-si12.gif https://s3.amazonaws.com/prod-ucs-content-store-us-east/content/pii:S1381116902004569/STRIPIN/image/gif/f5e3af9466b3a6889be4a563a36dff45/si6.gif https://s3-eu-west-1.amazonaws.com/prod-ucs-content-store-eu-west/content/pii:S1381116902004569/STRIPIN/image/gif/f5e3af9466b3a6889be4a563a36dff45/si6.gif si12 si12.gif gif 192 14 25 ALTIMG 1-s2.0-S1381116902004569-si11.gif https://s3.amazonaws.com/prod-ucs-content-store-us-east/content/pii:S1381116902004569/STRIPIN/image/gif/30a6913e1cd16c33450125f5f316712b/si9.gif https://s3-eu-west-1.amazonaws.com/prod-ucs-content-store-eu-west/content/pii:S1381116902004569/STRIPIN/image/gif/30a6913e1cd16c33450125f5f316712b/si9.gif si11 si11.gif gif 149 14 20 ALTIMG 1-s2.0-S1381116902004569-si10.gif https://s3.amazonaws.com/prod-ucs-content-store-us-east/content/pii:S1381116902004569/STRIPIN/image/gif/f5e3af9466b3a6889be4a563a36dff45/si6.gif https://s3-eu-west-1.amazonaws.com/prod-ucs-content-store-eu-west/content/pii:S1381116902004569/STRIPIN/image/gif/f5e3af9466b3a6889be4a563a36dff45/si6.gif si10 si10.gif gif 192 14 25 ALTIMG 1-s2.0-S1381116902004569-si1.gif https://s3.amazonaws.com/prod-ucs-content-store-us-east/content/pii:S1381116902004569/STRIPIN/image/gif/30a6913e1cd16c33450125f5f316712b/si9.gif https://s3-eu-west-1.amazonaws.com/prod-ucs-content-store-eu-west/content/pii:S1381116902004569/STRIPIN/image/gif/30a6913e1cd16c33450125f5f316712b/si9.gif si1 si1.gif gif 149 14 20 ALTIMG 1-s2.0-S1381116902004569-fx1.sml https://s3.amazonaws.com/prod-ucs-content-store-us-east/content/pii:S1381116902004569/fx1/THUMBNAIL/image/gif/fac14933de3000720d8e7d443f00c3be/fx1.sml https://s3-eu-west-1.amazonaws.com/prod-ucs-content-store-eu-west/content/pii:S1381116902004569/fx1/THUMBNAIL/image/gif/fac14933de3000720d8e7d443f00c3be/fx1.sml fx1 true fx1.sml sml 800 52 125 IMAGE-THUMBNAIL 1-s2.0-S1381116902004569-fx1.gif https://s3.amazonaws.com/prod-ucs-content-store-us-east/content/pii:S1381116902004569/fx1/DOWNSAMPLED/image/gif/7e7926d673de1cafb957257a4aa26485/fx1.gif https://s3-eu-west-1.amazonaws.com/prod-ucs-content-store-eu-west/content/pii:S1381116902004569/fx1/DOWNSAMPLED/image/gif/7e7926d673de1cafb957257a4aa26485/fx1.gif fx1 true fx1.gif gif 9167 291 702 IMAGE-DOWNSAMPLED 1-s2.0-S1381116902004569-sc1.sml https://s3.amazonaws.com/prod-ucs-content-store-us-east/content/pii:S1381116902004569/sc1/THUMBNAIL/image/gif/fccd7b7902957fa9a17b0c102c72dbdb/sc1.sml https://s3-eu-west-1.amazonaws.com/prod-ucs-content-store-eu-west/content/pii:S1381116902004569/sc1/THUMBNAIL/image/gif/fccd7b7902957fa9a17b0c102c72dbdb/sc1.sml sc1 sc1.sml sml 620 94 53 IMAGE-THUMBNAIL 1-s2.0-S1381116902004569-sc1.gif https://s3.amazonaws.com/prod-ucs-content-store-us-east/content/pii:S1381116902004569/sc1/DOWNSAMPLED/image/gif/62d7e906b47ca736de9a8618016d7b1c/sc1.gif https://s3-eu-west-1.amazonaws.com/prod-ucs-content-store-eu-west/content/pii:S1381116902004569/sc1/DOWNSAMPLED/image/gif/62d7e906b47ca736de9a8618016d7b1c/sc1.gif sc1 sc1.gif gif 6632 503 285 IMAGE-DOWNSAMPLED 1-s2.0-S1381116902004569-sc2.sml https://s3.amazonaws.com/prod-ucs-content-store-us-east/content/pii:S1381116902004569/sc2/THUMBNAIL/image/gif/d450848946e66e157e676003fa144d2b/sc2.sml https://s3-eu-west-1.amazonaws.com/prod-ucs-content-store-eu-west/content/pii:S1381116902004569/sc2/THUMBNAIL/image/gif/d450848946e66e157e676003fa144d2b/sc2.sml sc2 sc2.sml sml 737 92 61 IMAGE-THUMBNAIL 1-s2.0-S1381116902004569-sc2.gif https://s3.amazonaws.com/prod-ucs-content-store-us-east/content/pii:S1381116902004569/sc2/DOWNSAMPLED/image/gif/59cca3a19f3443ff37382569ca49a310/sc2.gif https://s3-eu-west-1.amazonaws.com/prod-ucs-content-store-eu-west/content/pii:S1381116902004569/sc2/DOWNSAMPLED/image/gif/59cca3a19f3443ff37382569ca49a310/sc2.gif sc2 sc2.gif gif 7451 475 314 IMAGE-DOWNSAMPLED 1-s2.0-S1381116902004569-gr1.sml https://s3.amazonaws.com/prod-ucs-content-store-us-east/content/pii:S1381116902004569/gr1/THUMBNAIL/image/gif/9383d5d88a02b309d6dc689566699fb4/gr1.sml https://s3-eu-west-1.amazonaws.com/prod-ucs-content-store-eu-west/content/pii:S1381116902004569/gr1/THUMBNAIL/image/gif/9383d5d88a02b309d6dc689566699fb4/gr1.sml gr1 gr1.sml sml 2005 85 125 IMAGE-THUMBNAIL 1-s2.0-S1381116902004569-gr1.gif https://s3.amazonaws.com/prod-ucs-content-store-us-east/content/pii:S1381116902004569/gr1/DOWNSAMPLED/image/gif/10f9c141542763605fe9ad3973769e7e/gr1.gif https://s3-eu-west-1.amazonaws.com/prod-ucs-content-store-eu-west/content/pii:S1381116902004569/gr1/DOWNSAMPLED/image/gif/10f9c141542763605fe9ad3973769e7e/gr1.gif gr1 gr1.gif gif 25290 481 704 IMAGE-DOWNSAMPLED 1-s2.0-S1381116902004569-gr2.sml https://s3.amazonaws.com/prod-ucs-content-store-us-east/content/pii:S1381116902004569/gr2/THUMBNAIL/image/gif/524add24beed22c30fae9f1089da0c4a/gr2.sml https://s3-eu-west-1.amazonaws.com/prod-ucs-content-store-eu-west/content/pii:S1381116902004569/gr2/THUMBNAIL/image/gif/524add24beed22c30fae9f1089da0c4a/gr2.sml gr2 gr2.sml sml 948 93 99 IMAGE-THUMBNAIL 1-s2.0-S1381116902004569-gr2.gif https://s3.amazonaws.com/prod-ucs-content-store-us-east/content/pii:S1381116902004569/gr2/DOWNSAMPLED/image/gif/55ba92e467d93d9836263ec2c10c18cf/gr2.gif https://s3-eu-west-1.amazonaws.com/prod-ucs-content-store-eu-west/content/pii:S1381116902004569/gr2/DOWNSAMPLED/image/gif/55ba92e467d93d9836263ec2c10c18cf/gr2.gif gr2 gr2.gif gif 1412 136 145 IMAGE-DOWNSAMPLED 1-s2.0-S1381116902004569-sc3.sml https://s3.amazonaws.com/prod-ucs-content-store-us-east/content/pii:S1381116902004569/sc3/THUMBNAIL/image/gif/68476452f9176579a54414af48cd2474/sc3.sml https://s3-eu-west-1.amazonaws.com/prod-ucs-content-store-eu-west/content/pii:S1381116902004569/sc3/THUMBNAIL/image/gif/68476452f9176579a54414af48cd2474/sc3.sml sc3 sc3.sml sml 1034 94 124 IMAGE-THUMBNAIL 1-s2.0-S1381116902004569-sc3.gif https://s3.amazonaws.com/prod-ucs-content-store-us-east/content/pii:S1381116902004569/sc3/DOWNSAMPLED/image/gif/6049764d81dc1358ca2890b1f954ad21/sc3.gif https://s3-eu-west-1.amazonaws.com/prod-ucs-content-store-eu-west/content/pii:S1381116902004569/sc3/DOWNSAMPLED/image/gif/6049764d81dc1358ca2890b1f954ad21/sc3.gif sc3 sc3.gif gif 10869 520 688 IMAGE-DOWNSAMPLED MOLCAA 3776 S1381-1169(02)00456-9 10.1016/S1381-1169(02)00456-9 Elsevier Science B.V. Scheme 1 Synthesis of pyridylimine-type ligand 1a and its corresponding palladium(II) dichloride complex 1b. Scheme 2 Synthesis of pyridylimine-type ligand 2a and its corresponding palladium(II) dichloride complex 2b. Fig. 1 IR spectra of ligands and the corresponding palladium complexes. Fig. 2 Numbering scheme for pyridylimine group. Scheme 3 Proposed mechanism of ethylene polymerization. Table 1 1 H NMR spectral data for the ligands and complexes in CDCl3 Compound δ (ppm) H2 H3 H4 H5 H6 H7 1a 7.96 7.72 7.28 8.63 8.36 3.65 2a 7.96 7.74 7.31 8.62 8.37 3.66 1b 7.80 8.13 7.64 9.28 8.13 3.90 2b – – – – – – Table 2 13 C NMR spectral data for the ligands and complexes in CDCl3 Compound δ (ppm) C1 C2 C3 C4 C5 C6 C7 1a 154.8 121.1 136.4 124.5 149.4 161.6 61.6 2a 154.6 121.1 136.5 124.5 149.3 161.7 61.5 1b 155.1 126.2 139.9 127.7 151.0 166.6 60.5 2b – – – – – – – Table 3 Mono- and bi-nuclear palladium(II) complexes 1b and 2b as catalyst precursors for ethylene polymerization a Entry no. Precursor [MAO]/[Pd] Temperature (°C) Yield (g) Productivity (g PEmol−1 Pdatm−1 h−1) T m (°C) b M n × 10−5 c M w × 10−5 c M w/M n 1 1b 60 25 0.0639 270 135.88 3.35 7.09 2.12 2 1b 100 25 0.1817 760 138.02 3.84 8.08 2.11 3 1b 260 25 0.7314 3060 137.80 4.07 8.53 2.10 4 1b 1040 25 1.1236 4070 137.75 4.52 9.19 2.03 5 2b 50 25 0 0 – – – – 6 2b 100 25 0.714 3010 135.50 2.94 6.43 2.19 7 2b 260 25 0.137 580 137.83 4.58 11.2 2.45 8 2b 1050 25 0.148 620 138.52 5.12 11.7 2.28 9 2b 100 15 0.914 3850 137.25 5.31 10.3 1.93 10 2b 100 5 0.0045 20 137.76 – – – 11 2b 100 35 0.174 730 137.64 3.63 7.56 2.08 a Polymerizations conditions: [Pd]=0.016mmol, MAO as co-catalyst, 150ml toluene, and 5atm of ethylene, 3h. b Determined by differential scanning calorimetry (DSC). c Molecular weight data was determined by GPC vs. polystyrene standards. Catalyst precursors for ethylene polymerization based on novel mono- and bi-nuclear pyridylimine-type palladium(II) complexes with long straight chain alkyl substituents at the imino nitrogen Rui Chen Selwyn F Mapolie ∗ Chemistry Department, University of the Western Cape, Private Bag X17, Bellville 7535, South Africa * Corresponding author. The novel pyridylimine complexes of palladium, 1b and 2b were synthesized via the reaction of Cl2Pd(COD) with N-(dodecanyl)pyridyl-2-methanimine, 1a and N,N’-(1,12-dodecanediyl)bis(pyridyl-2-methanimine) 2a, respectively. Treatment with methylaluminoxane (MAO) yields active ethylene polymerization catalysts, which produce linear high-molecular weight polymers. The synthesis and characterization of novel mono- and bi-nuclear pyridylimine-type palladium(II) complexes with long chain alkyl groups attached to the imino nitrogen are described. These complexes were evaluated as catalyst precursors for ethylene polymerization under relatively mild reaction conditions. Unlike N-aryl substituted pyridylimine-type analogues, these complexes when activated with methylaluminoxane (MAO) were capable of producing highly linear polyethylene with high molecular weights, the values of which can be tuned from 6×105 to 1×106 by varying polymerization temperature and the ratio of Al to Pd. Keywords Palladium Pyridylimine Polyethylene Bi-nuclear catalysts Ethylene polymerization 1 Introduction Late transition metal-catalyzed olefin polymerization has received greater prominence over the recent years as a result of Brookhart’s report on Pd(II) and Ni(II) diimine catalyst systems, which were capable of polymerizing ethylene and other α-olefins to form high molecular weight polymers [1–3]. The key feature of their catalysts is the symmetrical presence of bulky ortho aryl substituents at the imino nitrogen atoms, which effectively block the axial coordination sites thus retarding the rate of chain termination. Reduced steric bulk results in a decrease in polymer molecular weight. For this class of catalysts, Pd(II)-based systems produce highly branched polymers from ethylene with up to 125 branches per 1000 carbon atoms. Analogous Ni(II) catalysts are also quite sensitive to polymerization conditions, e.g. ethylene pressure, ligand structure and temperature, and can thus be tuned to produce polyethylene ranging from high to low density. Subsequent to Brookhart’s initial work on Ni and Pd, he as well as Gibson discovered that iron and cobalt-based complexes bearing tridentate pyridine bis-imine ligands with bulky aryl groups were also capable of converting olefins to high molecular weight polymers (M w of polyethylene up to 1.83×105 at 1atm and 6.11×105 at 10atm) as well as co-polymers [4–8]. In the past year, other groups [9–11] have also reported on studies dealing with asymmetrical bidentate aryl-substituted pyridylimine-type catalysts. In these latter cases, it was found that only oligomerization of ethylene was possible with Ni(II) catalysts while Pd(II) analogues were found to be inactive. Evidently, there exists a very complex link between ligand architecture and catalyst activity as well as polymer properties. To understand this better, we have designed a novel bi-nuclear pyridylimine-type Pd(II) complex in which two diimine centers are linked via a C12 hydrocarbon bridge. Each of the termini of the hydrocarbon bridge is bound to the imino nitrogen of the two pyridylimine units. In addition, we have also synthesized a mono-nuclear derivative, in which a single pyridylimine unit interacts with one palladium center. These complexes have been evaluated in ethylene polymerization. Our findings are reported here. 2 Experimental 2.1 General procedures All manipulations involving air- and/or water-sensitive compounds were performed in a nitrogen-filled glove-box or under an atmosphere of purified dry nitrogen using standard Schlenk techniques. 1 H (200MHz) and 13 C NMR (50.3MHz) spectra were recorded on a Varian Gemini 2000 spectrometer with CDCl3 as solvent at room temperature (for ligands and mono-nuclear Pd(II) complex) or 1,2,4-trichlorobenzene as solvent at 100°C (for polymeric products, benzene-d6 as chemical shift δ reference). Elemental analyses were carried out by the micro-analytical services of the Chemistry Department at University of the Western Cape. IR spectra in the range of 4000–500cm−1 were recorded as liquid films or DRIFTS on a Perkin-Elmer Paragon 1000 P spectrophotometer. Melting points of polyethylene were determined by differential scanning calorimetry (DSC) using a Perkin-Elmer DSC-7 calorimeter operating at the rate of 10°C/min. For polymer molecular weights, gel permeation chromatography (GPC) was performed in 1,2,4-trichlorobenzene at 135°C using a Waters GPC 2000 equipped with Waters HT 3, 4, 5, and 6 columns and the curves were calibrated against polystyrene standards. 2.2 Materials Toluene, diethyl ether, and hexane were distilled from sodium/benzophenone under nitrogen. Dichloromethane was distilled from diphosphorus pentoxide under nitrogen. Dodecyl amine, 1,12-dodecanyl diamine, pyridine-2-carboxaldehyde, anhydrous magnesium sulfate and methylaluminoxane (MAO, 10% solution in toluene) were purchased from Aldrich and were used as received. (COD)PdCl2 was prepared according to a published procedure [12]. 2.3 Synthesis of N-(dodecyl)pyridyl-2-methanimine (1a) This compound was prepared using a procedure described by Haddleton and co-workers [13]. Dodecylamine (1.8mmol) was added dropwise to a stirred solution of pyridine-2-carboxaldehyde (1.8mmol) in diethyl ether (20ml) cooled in an ice bath. The reaction was allowed to proceed at room temperature. Anhydrous magnesium sulfate (3g) was added and the slurry stirred for 24h. The solution was filtered, the ether removed from the filtrate, and the crude residue extracted with hexane. The compound was obtained as a yellow oil after removal of hexane and drying in vacuum. Yield: 70%. Analytically calculated for C18H30N2: C 78.77%, H 11.02%, N 10.21%. Found: C 78.62%, H 11.14%, N 10.28%. 1 H NMR (CDCl3): δ 8.61 (1H, d, py-6); 8.36 (1H, d, imino-H); 7.98 (1H, d, py-3); 7.70 (1H, t, py-4); 7.32 (1H, m, py-5), 3.66 (t, 2H, =N–CH2); 1.70 (t, 2H, =NCH2CH2); 1.24 (brs, 18H, –(CH2)9–); 0.86 (t, 3H, CH3). 13 C NMR (CDCl3): δ 161.63, 154.77, 149.38, 136.45, 124.52, 124.15, 121.14, 61.56, 31.89, 30.71, 29.65, 29.61, 29.57, 29.42, 29.32, 27.33, 22.66, 14.07. 2.4 Synthesis of N,N′-(1,12-dodecanediyl)bis(pyridyl-2-methanimine) (2a) This was prepared using a similar procedure as for 1a with the exception that absolute ethanol replaced ether as solvent. The compound is a pale yellow solid. Yield: 56%. Analytically calculated for C24H34N4: C 76.15%, H 9.05%, N 14.80%. Found: C 76.28%, H 9.28%, N 14.65%; m.p. 64–66°C. 1 H NMR (CDCl3): δ 8.63 (2H, d, py-6); 8.37 (2H, d, imino-H); 8.00 (2H, d, py-3); 7.74 (2H, t, py-4); 7.31 (2H, m, py-5), 3.66 (t, 4H, =N–CH2); 1.83–1.68 (br m, 4H, =NCH2CH2); 1.26 (brs, 16H, –(CH2)8–). 13 C NMR (CDCl3): δ 161.57, 154.58, 149.33, 136.45, 124.52, 121.10, 61.56, 30.61, 29.51, 29.36, 27.26. 2.5 Synthesis of (N-dodecyl-pyridyl-2-methanimine) palladium(II) dichloride (1b) A solution of 1a (0.35mmol) in CH2Cl2 (2ml) was added dropwise to a stirred solution of (COD)PdCl2 (0.35mmol) dissolved in CH2Cl2 (20ml) at room temperature. The reaction mixture was stirred for 72h during which time a precipitate was observed. The pale yellow powder was isolated by filtration and washed with fresh CH2Cl2. Additional product can be obtained by reducing the volume of the filtrate. The pale yellow product can be re-crystallized from CH2Cl2 at −20°C giving microcrystals. Yield: 42%. Analytically Calculated for C18H30N2Cl2Pd: C 47.85%, H 6.69%, N 6.20%. Found: C 47.43%, H 6.56%, N 6.01%; m.p. 144–145°C. 1 H NMR (CD2Cl2): δ 9.26 (1H, d, py-6); 8.13 (2H, overlapping d, pyr-4+imino-H); 7.80 (1H, d, py-3); 7.64 (1H, t, py-5); 3.90 (t, 2H, =N–CH2); 1.90 (t, 2H, =NCH2CH2); 1.29 (brs, 18H, –(CH2)9–); 0.88 (br t, 3H, CH3). 13 C NMR (CD2Cl2): 167.29, 151.75, 140.68, 128.47, 126.98, 61.25, 32.32, 31.11, 30.03, 29.97, 29.91, 29.60, 27.00, 23.08, 14.25. 2.6 Synthesis of N,N′-(μ-1,12-dodecanediyl)bis{(pyridyl-2-methanimine)palladium(II) dichloride} (2b) The 1b (0.175mmol) dissolved in CH2Cl2 (2ml) was added dropwise into a stirred solution of (COD)PdCl2 (0.35mmol) in CH2Cl2 (20ml) at room temperature. A precipitate formed immediately and the reaction mixture was stirred overnight. A pale yellow powder was isolated by filtration, washed with fresh CH2Cl2, and dried under vacuum. Yield: 91%. Analytically Calculated for C24H34N4Pd2Cl4: C 39.31%, H 4.67%, N 7.64%. Found: C 39.36%, H 4.44%, N 7.42%; m.p. 268–273°C (dec.). 2.7 General procedure for ethylene polymerization A mechanically stirred stainless steel 300ml Parr autoclave was heated under vacuum for at least 1h at 70°C and cooled to room temperature prior to being charged with 150ml toluene, MAO, and catalyst precursor in a nitrogen-purged glove-box. After sealing the autoclave, it was removed from the glove-box and flushed with ethylene. The reaction mixture was heated to the desired reaction temperature; ethylene was introduced to a pressure of 5atm. The reactor pressure was maintained at 5atm throughout the polymerization. At the end of the polymerization, the unreacted ethylene was vented and the reaction quenched with ethanol. The polymer was collected, treated with a 1M solution of HCl for 48h to remove any palladium residues. After filtration, the polymer was washed with water followed by fresh ethanol, and then dried at 80°C under vacuum to constant weight. 3 Results and discussion 3.1 Synthesis of ligands and complexes The N-alkyl substituted mono- and bi- functional pyridylimines 1a and 2a were prepared by the condensation of pyridine-2-carboxaldehyde with the appropriate amine or diamine with removal of water using anhydrous magnesium sulfate (Schemes 1 and 2 ). Since, 1,12-diaminododecane is sparingly soluble in diethyl ether, absolute ethanol was used as solvent to maintain a homogeneous medium. Subsequent to the preparation of the ligands the Pd(II) dichloride complexes 1b and 2b were obtained from the reaction of the pyridylimine ligands with (1,5-cyclooctadiene)palladium(II) dichloride in dichloromethane at room temperature (also illustrated in Schemes 1 and 2). Some of the bi-nuclear Pd(II) complex 2b precipitated from solution during the initial 10min, although an extended reaction time was needed to optimize the yield. Complete characterization of 2b was not possible due to its lack of solubility in common organic solvents. Elemental analysis however showed the result for 2b to be in agreement with the calculated values based on our expected chemical formulation. IR spectra for the palladium complexes are as shown in Fig. 1 together with those of the corresponding ligands. In both the ligands 1a and 2a, three strong bands are apparent at ca. 1650, 1588, and 1568cm−1, assigned to CN vibration and pyridine-ring vibrations, respectively. While for both the Pd(II) complexes 1b and 2b, only a single absorption occurs at ca. 1600cm−1. Disappearance of CN absorptions in the IR spectra of complexes were reported by Lavery and Nelson [14], who ascribed this to be an infrared inactive CN vibration in the Pd(II) complexes. On the other hand, another plausible explanation could be a reduction in electron density in CN bond as a result of bonding of the diimine ligand to the metal center. This would lead to a lower ν (CN) value. 1 H and 13 C NMR data for the ligands and the mono-nuclear Pd(II) complex 1b are listed in Tables 1 and 2 . Comparison of ligand 1a with the corresponding complex 1b shows large downfield shifts of the protons attached to the carbons of the pyridylimine group (C3, C4 and C5, as shown in Fig. 2 ). The protons of the CH2 group attached to the imino functionality (C7) show a similar downfield shift. This reveals the existence of strong coordination of the pyridine nitrogen and the imine nitrogen to the palladium center. The slight shifts observed for H2 could be explained in terms of two opposite effects, viz. a low-field shift caused by the inductive effect and a high-field shift caused by the disappearance of the paramagnetic effect of the imine nitrogen atom upon coordination. This was previously found for pyridylimine complexes of tin [15]. Similar observed downfield shifts in the 13 C NMR spectrum of the complex 1b indicate that the imino-group carbon and the pyridine carbons are deshielded by coordination to palladium. 3.2 Polymerization of ethylene The precursors 1b and 2b were activated in situ in toluene by the addition of MAO and the polymerizations were performed at 5atm of ethylene pressure, affording solid polyethylene. Data for the ethylene polymerization are summarized in Table 3 . The polymers, obtained using these pyridylimine Pd(II) complexes with aliphatic chains attached to the imino nitrogen are highly linear polyethylene as determined by DSC (T m=135–137°C). This is in contrast to the branched ethylene oligomers produced in aryl-substituted pyridylimine nickel and palladium catalyst systems. The appearance of only one signal in the high temperature 1 H and 13 C NMR spectra of the polymerization products reinforced their linear nature. Moreover, significantly high molecular weight with M w values ranging from 6.43×105 (entry 6) to 1.17×106 (entry 8), were obtained as confirmed via high temperature GPC. This is comparable to polyethylene produced via some Group 4 metallocenes. The unimodal molecular weight distribution curves in the GPC plots indicate only one kind of active species in the polymerization reactions. Polydispersity indices for all these cases are around 2, similar to those reported for other late transition metal catalysts. It is worth noting that by changing the substituents on the imino nitrogen from aryl groups to long chain alkyl groups leads to a dramatic increase in the molecular weight and yielding only linear polyethylene. These results can be rationalized with the proposed reaction pathway as shown in Scheme 3 together with recent reported assumptions [2,3,16]. The alkyl–ethylene complex I is the catalyst resting state; ethylene insertion results in the formation of II that can be rapidly trapped by ethylene to reform I. Repeating this step leads to chain propagation. II can be β-hydride (β-H) isomerized, i.e. undergo reinsertion with opposite regiochemistry to produce a branched alkyl group III. Continuous β-H isomerization and reinsertion (chain-running) leads to chain branching. While, β-H elimination releases olefin to yield IV, leading to chain transfer. Based on this reaction pathway, the unique co-planar structure of the catalysts precursors 1b and 2b is likely to be a decisive factor affecting polymer molecular weight and microstructure. The long straight alkyl chain remaining in the same plane as the active center increases steric hindrance as compared to an angled aryl group. This causes an increase in the energy, which is needed to rotate the growing polymer chain about the CαCβ bond. The transfer of the β-H to the vacant site on the metal would thus be hindered leading to retardation of chain running and chain transfer processes. Therefore, the rate of chain propagation is far faster than chain running and chain transfer rates, permitting the formation of highly linear polyethylene with high molecular weight. Thus, in these olefin polymerization reactions, not only the nature of the metal center but also the ligand environments have a large influence on catalyst activity as well as polymer microstructure. In general 2b was found to produce higher molecular weight polyethylene compared to 1b. This is probably due to the fact that in 2b the alkyl chain linking the two diimine functionalities is less flexible than the alkyl chain of 1b. This as alluded to earlier would hinder chain transfer process. The dependence of catalyst productivity on the ratio of Al:Pd was found to be different for the pre-catalysts 1b and 2b. For example, polymerization productivity of 1b increased with an increase of the ratio Al:Pd ranging from 50 to 1100 (entries 1–4). While for 2b, the productivity initially showed a rapid increase to reach a maximum at an Al:Pd ratio of 100:1 (entry 6). Thereafter, the decrease in productivity with increasing Al:Pd ratio was more pronounced than was the case for 1b. The bi-nuclear complex was found to have lower polymerization productivity than the mono-nuclear complex at high Al:Pd ratios. The reason is not entirely clear although it would appear to be a result of the lower solubility of the bi-nuclear catalyst precursor species in toluene. The effect of the Al:Pd ratio on the molecular weight of polyethylene produced appears to be similar for both the mono-nuclear precursor 1b as well as the di-nuclear analogue 2b. The molecular weights of the polymers increased with an increase of Al:Pd ratio. This indicates that under our reaction conditions, MAO did not play a significant role in chain transfer of the growing polyethylene. In comparison with the mono-nuclear palladium catalyst system, the di-nuclear system seems to convert ethylene to higher molecular weight polymers at the same level of Al:Pd ratio, (Al/Pd≥260). This is probably due to greater resistance of the di-nuclear catalyst to β-H chain transfer as a result of steric factors. This is less important in the case of the mono-nuclear species with a slightly more flexible alkyl chain. No significant variation of the molecular weight distribution of the polymers was observed with increasing the ratio of Al:Pd. In almost all the cases, PDI values around 2 were obtained. We also investigated the effect of reaction temperature on the ethylene polymerization using the bi-nuclear catalyst precursor 2b, entry 6 and entries 9–11. Good productivities were achieved within the temperature range of 15–25°C. A rapid drop of catalytic activity at slightly higher temperatures (>35°C) was observed. This could be due to the decomposition of the temperature-sensitive active species as well as due to a decrease in ethylene concentration in toluene at high temperature. 4 Conclusions We have synthesized novel mono- and bi-nuclear pyridylimine palladium(II) complexes with long alkyl groups at the imino nitrogen and applied these as catalyst precursors in ethylene polymerization. The polymers produced here are highly linear polyethylene with high molecular weights, different from those prepared with recently reported N-aryl pyridylimine-type complexes. This has demonstrated that selection of suitable ligand structure allows us to tune polymer properties. The co-planar features of our complexes are deemed to favor chain propagation and retard chain transfer and chain running reactions. Polymerization productivities were found to be sensitive to temperature as well as the amount of the co-catalyst. Different trends are observed for mono- and bi-nuclear pre-catalysts, especially with regards to variation in the ratio of Al:Pd. The bi-nuclear Pd(II) complex display lower catalyst activity than the mono-nuclear analogue. A plausible suggestion is that this is a result of the difference in solubility of these catalyst species in toluene. This is the subject of an ongoing study. In addition, we are also studying the effect of spacer length in the di-nuclear system on catalyst activity. Acknowledgements We thank the National Research Foundation of South Africa, the Research Committee of the University of the Western Cape and SASOL Polymers for financial support. In addition, we would like to express our gratitude to Mr. Stefan De Goede, SASOL Polymers for his assistance with GPC measurements. References [1] L.K Johnson C.M Killian M Brookhart J. Am. Chem. Soc. 117 1995 6414 [2] C Killian D.J Tempel L.K Johnson M Brookhart J. Am. Chem. Soc. 118 1996 11664 [3] D.P Gates S.A Svejda E Oňate C.M Killian L.K Johnson P.S White M Brookhart Macromolecules 33 2000 2320 [4] G.J.P Britovsek V.C Gibson B.S Kimberley P.J Maddox S.J McTavish G.A Solan A.J.P White D.J Williams Chem. Commun. 7 1998 849 [5] M Bruce V.C Gibson C Redshaw G.A Solan A.J.P White D.J Williams Chem. Commun. 22 1998 2523 [6] G.J.P Britovsek M Bruce V.C Gibson B.S Kimberley P.J Maddox S Mastroianni S.J McTavish C Redshaw G.A Solan S Strömberg A.J.P White D.J Williams J. Am. Chem. Soc. 121 1999 8728 [7] B.L Small M Brookhart A.M.A Bennett J. Am. Chem. Soc. 120 1998 4049 [8] B.L Small M Brookhart J. Am. Chem. Soc. 120 1998 7143 [9] S.P Meneghetti P.J Lutz J Kress Organometallics 18 1999 2734 [10] A Köppl H.G Alt J. Mol. Catal. Part A. Chem. 154 2000 45 [11] T.V Laine U Piironen K Lappalainen M Klinga E Aitola M Leskelä J. Organomet. Chem. 606 2000 112 [12] L. Chatt, L.M. Vallarino, L.M. Venanzi, J. Chem. Soc. (1957) 3413. [13] D.M Haddleton M.C Crossman B.H Dana D.J Duncalf A.M Heming D Kukulj A.J Shooter Macromolecules 32 1999 2110 [14] A Lavery S.M Nelson J. Chem. Soc. Dalton Trans. 4 1984 615 [15] G Matsubayashi M Okunaka T Tanaka J. Organomet. Chem. 56 1973 215 [16] S.Y Desjardin A.A Way M.C Murray D Adirim M.C Baird Organometallics 17 1998 2328",
      "scopus-id": "0042972858",
      "coredata": {
        "eid": "1-s2.0-S1381116902004569",
        "dc:description": "The synthesis and characterization of novel mono- and bi-nuclear pyridylimine-type palladium(II) complexes with long chain alkyl groups attached to the imino nitrogen are described. These complexes were evaluated as catalyst precursors for ethylene polymerization under relatively mild reaction conditions. Unlike N-aryl substituted pyridylimine-type analogues, these complexes when activated with methylaluminoxane (MAO) were capable of producing highly linear polyethylene with high molecular weights, the values of which can be tuned from 6×105 to 1×106 by varying polymerization temperature and the ratio of Al to Pd.",
        "openArchiveArticle": "false",
        "prism:coverDate": "2003-02-17",
        "openaccessUserLicense": null,
        "prism:aggregationType": "Journal",
        "prism:url": "https://api.elsevier.com/content/article/pii/S1381116902004569",
        "dc:creator": [
          {
            "@_fa": "true",
            "$": "Chen, Rui"
          },
          {
            "@_fa": "true",
            "$": "Mapolie, Selwyn F"
          }
        ],
        "link": [
          {
            "@_fa": "true",
            "@rel": "self",
            "@href": "https://api.elsevier.com/content/article/pii/S1381116902004569"
          },
          {
            "@_fa": "true",
            "@rel": "scidir",
            "@href": "https://www.sciencedirect.com/science/article/pii/S1381116902004569"
          }
        ],
        "dc:format": "application/json",
        "openaccessType": null,
        "pii": "S1381-1169(02)00456-9",
        "prism:volume": "193",
        "prism:publisher": "Elsevier Science B.V.",
        "dc:title": "Catalyst precursors for ethylene polymerization based on novel mono- and bi-nuclear pyridylimine-type palladium(II) complexes with long straight chain alkyl substituents at the imino nitrogen",
        "prism:copyright": "Copyright © 2002 Elsevier Science B.V. All rights reserved.",
        "openaccess": "0",
        "prism:issn": "13811169",
        "prism:issueIdentifier": "1-2",
        "dcterms:subject": [
          {
            "@_fa": "true",
            "$": "Palladium"
          },
          {
            "@_fa": "true",
            "$": "Pyridylimine"
          },
          {
            "@_fa": "true",
            "$": "Polyethylene"
          },
          {
            "@_fa": "true",
            "$": "Bi-nuclear catalysts"
          },
          {
            "@_fa": "true",
            "$": "Ethylene polymerization"
          }
        ],
        "openaccessArticle": "false",
        "prism:publicationName": "Journal of Molecular Catalysis A: Chemical",
        "prism:number": "1-2",
        "openaccessSponsorType": null,
        "prism:pageRange": "33-40",
        "prism:endingPage": "40",
        "pubType": "fla",
        "prism:coverDisplayDate": "17 February 2003",
        "prism:doi": "10.1016/S1381-1169(02)00456-9",
        "prism:startingPage": "33",
        "dc:identifier": "doi:10.1016/S1381-1169(02)00456-9",
        "openaccessSponsorName": null
      },
      "objects": {
        "object": [
          {
            "@category": "thumbnail",
            "@height": "14",
            "@width": "20",
            "@_fa": "true",
            "$": "https://api.elsevier.com/content/object/eid/1-s2.0-S1381116902004569-si9.gif?httpAccept=%2A%2F%2A",
            "@multimediatype": "GIF image file",
            "@type": "ALTIMG",
            "@size": "149",
            "@ref": "si9",
            "@mimetype": "image/gif"
          },
          {
            "@category": "thumbnail",
            "@height": "14",
            "@width": "25",
            "@_fa": "true",
            "$": "https://api.elsevier.com/content/object/eid/1-s2.0-S1381116902004569-si8.gif?httpAccept=%2A%2F%2A",
            "@multimediatype": "GIF image file",
            "@type": "ALTIMG",
            "@size": "192",
            "@ref": "si8",
            "@mimetype": "image/gif"
          },
          {
            "@category": "thumbnail",
            "@height": "14",
            "@width": "20",
            "@_fa": "true",
            "$": "https://api.elsevier.com/content/object/eid/1-s2.0-S1381116902004569-si7.gif?httpAccept=%2A%2F%2A",
            "@multimediatype": "GIF image file",
            "@type": "ALTIMG",
            "@size": "149",
            "@ref": "si7",
            "@mimetype": "image/gif"
          },
          {
            "@category": "thumbnail",
            "@height": "14",
            "@width": "25",
            "@_fa": "true",
            "$": "https://api.elsevier.com/content/object/eid/1-s2.0-S1381116902004569-si6.gif?httpAccept=%2A%2F%2A",
            "@multimediatype": "GIF image file",
            "@type": "ALTIMG",
            "@size": "192",
            "@ref": "si6",
            "@mimetype": "image/gif"
          },
          {
            "@category": "thumbnail",
            "@height": "14",
            "@width": "20",
            "@_fa": "true",
            "$": "https://api.elsevier.com/content/object/eid/1-s2.0-S1381116902004569-si5.gif?httpAccept=%2A%2F%2A",
            "@multimediatype": "GIF image file",
            "@type": "ALTIMG",
            "@size": "149",
            "@ref": "si5",
            "@mimetype": "image/gif"
          },
          {
            "@category": "thumbnail",
            "@height": "14",
            "@width": "25",
            "@_fa": "true",
            "$": "https://api.elsevier.com/content/object/eid/1-s2.0-S1381116902004569-si4.gif?httpAccept=%2A%2F%2A",
            "@multimediatype": "GIF image file",
            "@type": "ALTIMG",
            "@size": "192",
            "@ref": "si4",
            "@mimetype": "image/gif"
          },
          {
            "@category": "thumbnail",
            "@height": "14",
            "@width": "20",
            "@_fa": "true",
            "$": "https://api.elsevier.com/content/object/eid/1-s2.0-S1381116902004569-si3.gif?httpAccept=%2A%2F%2A",
            "@multimediatype": "GIF image file",
            "@type": "ALTIMG",
            "@size": "149",
            "@ref": "si3",
            "@mimetype": "image/gif"
          },
          {
            "@category": "thumbnail",
            "@height": "14",
            "@width": "25",
            "@_fa": "true",
            "$": "https://api.elsevier.com/content/object/eid/1-s2.0-S1381116902004569-si2.gif?httpAccept=%2A%2F%2A",
            "@multimediatype": "GIF image file",
            "@type": "ALTIMG",
            "@size": "192",
            "@ref": "si2",
            "@mimetype": "image/gif"
          },
          {
            "@category": "thumbnail",
            "@height": "14",
            "@width": "25",
            "@_fa": "true",
            "$": "https://api.elsevier.com/content/object/eid/1-s2.0-S1381116902004569-si15.gif?httpAccept=%2A%2F%2A",
            "@multimediatype": "GIF image file",
            "@type": "ALTIMG",
            "@size": "192",
            "@ref": "si15",
            "@mimetype": "image/gif"
          },
          {
            "@category": "thumbnail",
            "@height": "14",
            "@width": "20",
            "@_fa": "true",
            "$": "https://api.elsevier.com/content/object/eid/1-s2.0-S1381116902004569-si14.gif?httpAccept=%2A%2F%2A",
            "@multimediatype": "GIF image file",
            "@type": "ALTIMG",
            "@size": "149",
            "@ref": "si14",
            "@mimetype": "image/gif"
          },
          {
            "@category": "thumbnail",
            "@height": "14",
            "@width": "25",
            "@_fa": "true",
            "$": "https://api.elsevier.com/content/object/eid/1-s2.0-S1381116902004569-si13.gif?httpAccept=%2A%2F%2A",
            "@multimediatype": "GIF image file",
            "@type": "ALTIMG",
            "@size": "192",
            "@ref": "si13",
            "@mimetype": "image/gif"
          },
          {
            "@category": "thumbnail",
            "@height": "14",
            "@width": "25",
            "@_fa": "true",
            "$": "https://api.elsevier.com/content/object/eid/1-s2.0-S1381116902004569-si12.gif?httpAccept=%2A%2F%2A",
            "@multimediatype": "GIF image file",
            "@type": "ALTIMG",
            "@size": "192",
            "@ref": "si12",
            "@mimetype": "image/gif"
          },
          {
            "@category": "thumbnail",
            "@height": "14",
            "@width": "20",
            "@_fa": "true",
            "$": "https://api.elsevier.com/content/object/eid/1-s2.0-S1381116902004569-si11.gif?httpAccept=%2A%2F%2A",
            "@multimediatype": "GIF image file",
            "@type": "ALTIMG",
            "@size": "149",
            "@ref": "si11",
            "@mimetype": "image/gif"
          },
          {
            "@category": "thumbnail",
            "@height": "14",
            "@width": "25",
            "@_fa": "true",
            "$": "https://api.elsevier.com/content/object/eid/1-s2.0-S1381116902004569-si10.gif?httpAccept=%2A%2F%2A",
            "@multimediatype": "GIF image file",
            "@type": "ALTIMG",
            "@size": "192",
            "@ref": "si10",
            "@mimetype": "image/gif"
          },
          {
            "@category": "thumbnail",
            "@height": "14",
            "@width": "20",
            "@_fa": "true",
            "$": "https://api.elsevier.com/content/object/eid/1-s2.0-S1381116902004569-si1.gif?httpAccept=%2A%2F%2A",
            "@multimediatype": "GIF image file",
            "@type": "ALTIMG",
            "@size": "149",
            "@ref": "si1",
            "@mimetype": "image/gif"
          },
          {
            "@category": "thumbnail",
            "@height": "52",
            "@width": "125",
            "@_fa": "true",
            "$": "https://api.elsevier.com/content/object/eid/1-s2.0-S1381116902004569-fx1.sml?httpAccept=%2A%2F%2A",
            "@multimediatype": "GIF image file",
            "@type": "IMAGE-THUMBNAIL",
            "@size": "800",
            "@ref": "fx1",
            "@mimetype": "image/gif"
          },
          {
            "@category": "standard",
            "@height": "291",
            "@width": "702",
            "@_fa": "true",
            "$": "https://api.elsevier.com/content/object/eid/1-s2.0-S1381116902004569-fx1.gif?httpAccept=%2A%2F%2A",
            "@multimediatype": "GIF image file",
            "@type": "IMAGE-DOWNSAMPLED",
            "@size": "9167",
            "@ref": "fx1",
            "@mimetype": "image/gif"
          },
          {
            "@category": "thumbnail",
            "@height": "94",
            "@width": "53",
            "@_fa": "true",
            "$": "https://api.elsevier.com/content/object/eid/1-s2.0-S1381116902004569-sc1.sml?httpAccept=%2A%2F%2A",
            "@multimediatype": "GIF image file",
            "@type": "IMAGE-THUMBNAIL",
            "@size": "620",
            "@ref": "sc1",
            "@mimetype": "image/gif"
          },
          {
            "@category": "standard",
            "@height": "503",
            "@width": "285",
            "@_fa": "true",
            "$": "https://api.elsevier.com/content/object/eid/1-s2.0-S1381116902004569-sc1.gif?httpAccept=%2A%2F%2A",
            "@multimediatype": "GIF image file",
            "@type": "IMAGE-DOWNSAMPLED",
            "@size": "6632",
            "@ref": "sc1",
            "@mimetype": "image/gif"
          },
          {
            "@category": "thumbnail",
            "@height": "92",
            "@width": "61",
            "@_fa": "true",
            "$": "https://api.elsevier.com/content/object/eid/1-s2.0-S1381116902004569-sc2.sml?httpAccept=%2A%2F%2A",
            "@multimediatype": "GIF image file",
            "@type": "IMAGE-THUMBNAIL",
            "@size": "737",
            "@ref": "sc2",
            "@mimetype": "image/gif"
          },
          {
            "@category": "standard",
            "@height": "475",
            "@width": "314",
            "@_fa": "true",
            "$": "https://api.elsevier.com/content/object/eid/1-s2.0-S1381116902004569-sc2.gif?httpAccept=%2A%2F%2A",
            "@multimediatype": "GIF image file",
            "@type": "IMAGE-DOWNSAMPLED",
            "@size": "7451",
            "@ref": "sc2",
            "@mimetype": "image/gif"
          },
          {
            "@category": "thumbnail",
            "@height": "85",
            "@width": "125",
            "@_fa": "true",
            "$": "https://api.elsevier.com/content/object/eid/1-s2.0-S1381116902004569-gr1.sml?httpAccept=%2A%2F%2A",
            "@multimediatype": "GIF image file",
            "@type": "IMAGE-THUMBNAIL",
            "@size": "2005",
            "@ref": "gr1",
            "@mimetype": "image/gif"
          },
          {
            "@category": "standard",
            "@height": "481",
            "@width": "704",
            "@_fa": "true",
            "$": "https://api.elsevier.com/content/object/eid/1-s2.0-S1381116902004569-gr1.gif?httpAccept=%2A%2F%2A",
            "@multimediatype": "GIF image file",
            "@type": "IMAGE-DOWNSAMPLED",
            "@size": "25290",
            "@ref": "gr1",
            "@mimetype": "image/gif"
          },
          {
            "@category": "thumbnail",
            "@height": "93",
            "@width": "99",
            "@_fa": "true",
            "$": "https://api.elsevier.com/content/object/eid/1-s2.0-S1381116902004569-gr2.sml?httpAccept=%2A%2F%2A",
            "@multimediatype": "GIF image file",
            "@type": "IMAGE-THUMBNAIL",
            "@size": "948",
            "@ref": "gr2",
            "@mimetype": "image/gif"
          },
          {
            "@category": "standard",
            "@height": "136",
            "@width": "145",
            "@_fa": "true",
            "$": "https://api.elsevier.com/content/object/eid/1-s2.0-S1381116902004569-gr2.gif?httpAccept=%2A%2F%2A",
            "@multimediatype": "GIF image file",
            "@type": "IMAGE-DOWNSAMPLED",
            "@size": "1412",
            "@ref": "gr2",
            "@mimetype": "image/gif"
          },
          {
            "@category": "thumbnail",
            "@height": "94",
            "@width": "124",
            "@_fa": "true",
            "$": "https://api.elsevier.com/content/object/eid/1-s2.0-S1381116902004569-sc3.sml?httpAccept=%2A%2F%2A",
            "@multimediatype": "GIF image file",
            "@type": "IMAGE-THUMBNAIL",
            "@size": "1034",
            "@ref": "sc3",
            "@mimetype": "image/gif"
          },
          {
            "@category": "standard",
            "@height": "520",
            "@width": "688",
            "@_fa": "true",
            "$": "https://api.elsevier.com/content/object/eid/1-s2.0-S1381116902004569-sc3.gif?httpAccept=%2A%2F%2A",
            "@multimediatype": "GIF image file",
            "@type": "IMAGE-DOWNSAMPLED",
            "@size": "10869",
            "@ref": "sc3",
            "@mimetype": "image/gif"
          }
        ]
      },
      "link": {
        "@rel": "abstract",
        "@href": "https://api.elsevier.com/content/abstract/scopus_id/0042972858"
      }
    }
  }
}