{
  "metadata": {
    "title": "Mesoporous VMCM-41: highly efficient and remarkable catalyst for selective oxidation of cyclohexane to cyclohexanol",
    "authors": "; ; ",
    "journal": "Journal of Molecular Catalysis A: Chemical",
    "date": "2004-12-01",
    "doi": "10.1016/j.molcata.2003.10.067",
    "abstract": "",
    "uri": "https://api.elsevier.com/content/article/pii/S1381116904005527",
    "pii": "S1381116904005527"
  },
  "fulltext": {
    "full-text-retrieval-response": {
      "scopus-eid": "2-s2.0-7444221162",
      "originalText": "serial JL 271358 291210 291744 291790 291809 31 Journal of Molecular Catalysis A: Chemical JOURNALMOLECULARCATALYSISACHEMICAL 2004-10-03 2004-10-03 2010-03-28T13:36:59 1-s2.0-S1381116904005527 S1381-1169(04)00552-7 S1381116904005527 10.1016/j.molcata.2003.10.067 S300 S300.2 FULL-TEXT 1-s2.0-S1381116900X02014 2015-05-15T05:56:32.920819-04:00 0 0 20041201 2004 2004-10-03T00:00:00Z articleinfo crossmark dco dateupdated tomb dateloaded datesearch indexeddate issuelist volumelist yearnav absattachment articletitlenorm authfirstinitialnorm authfirstsurnamenorm cid cids confdate confeditor confloc contenttype copyright dateloadedtxt docsubtype doctype doi eid ewtransactionid hubeid issfirst issn issnnorm itemstage itemtransactionid itemweight openaccess openarchive pg pgfirst pglast pii piinorm pubdatestart pubdatetxt pubyr sortorder srctitle srctitlenorm srctype subheadings vol volfirst volissue webpdf webpdfpagecount figure table body acknowledge affil articletitle auth authfirstini authfull authkeywords authlast primabst ref specialabst alllist content subj ssids 1381-1169 13811169 223 223 1 2 1 2 Volume 223, Issues 1–2 37 241 250 241 250 20041201 1 December 2004 2004-12-01 2004 Catalysis--A Cross Disciplinary Vision Hyderabad, India 26 August 2003 20030826 B.M. Choudary and B. Lucke article fla Copyright © 2004 Elsevier B.V. All rights reserved. MESOPOROUSVMCM41HIGHLYEFFICIENTREMARKABLECATALYSTFORSELECTIVEOXIDATIONCYCLOHEXANECYCLOHEXANOL DAPURKAR S 1 Introduction 2 Experimental 2.1 Starting materials 2.2 Synthesis of VMCM-41 2.3 Characterization 2.4 Reaction procedure 2.5 Washing studies 2.6 Recycling studies 2.7 Filtrate/quenching studies 3 Results and discussion 4 Conclusion Acknowledgment References FAITH 1957 W INDUSTRIALCHEMICALS BEREZIN 1968 I OXIDATIONCYCLOHEXANE CHANDALIA 1977 S OXIDATIONHYDROCARBONS MUSSER 1987 M ENCYCLOPEDIAINDUSTRIALCHEMISTRY PARSHALL 1992 G HOMOGENOUSCATALYSIS SCHUCHARDT 1999 1 U REDDY 1994 1059 K REDDY 1996 7 J SAKTHIVEL 2000 457 A BADAMALI 2000 153 S MAHALINGAM 1999 1141 R SAKTHIVEL 2001 155 A SAKTHIVEL 2002 73 A SAKTHIVEL 2002 134 A DAPURKAR 2003 1184 S SAKTHIVEL 2003 283 A MOHAPATRA 2002 1466 S SONAVANE 2003 142 S MOHAPATRA 2003 17 S MOHAPATRA 2002 8527 S MOHAPATRA 2003 1107 S MOHAPATRA 2003 57 S SAKTHIVEL 2001 67 72 A ADVANCESINENVIRONMENTALMATERIALSPOLLUTIONCONTROLMATERIALS DAPURKAR 2001 63 S SEN 1996 354 T CHASTEEN 1983 112 N KRESGE 1992 710 C SELVAM 2001 3237 P SHANNON 1969 925 R LIU 2000 3107 Z CHEN 1993 27 C PARK 1997 70 D PARK 1997 159 D CHAO 1997 6341 K RAO 1992 225 P MOUDRAKOVSKI 1994 10895 I LUAN 1996 19595 Z BLACK 1978 527 J BELKHIR 1998 1761 I OLDROYD 1998 3177 R RAO 1993 595 P RAO 1993 604 P MIMOUN 1983 3101 H POHORECKI 1992 2559 R POHORECKI 2001 1285 R ONOPCHENKO 1973 3729 A ONOPCHENKO 1975 3338 A MURAHASHI 1992 7913 S BRILL 1960 837 W PIRES 2000 231 E DAPURKARX2004X241 DAPURKARX2004X241X250 DAPURKARX2004X241XS DAPURKARX2004X241X250XS item S1381-1169(04)00552-7 S1381116904005527 1-s2.0-S1381116904005527 10.1016/j.molcata.2003.10.067 271358 2010-10-15T16:15:15.478744-04:00 2004-12-01 1-s2.0-S1381116904005527-main.pdf https://s3.amazonaws.com/prod-ucs-content-store-us-east/content/pii:S1381116904005527/MAIN/application/pdf/e8176a2d5e1075c96965ed32c83cfc33/main.pdf https://s3-eu-west-1.amazonaws.com/prod-ucs-content-store-eu-west/content/pii:S1381116904005527/MAIN/application/pdf/e8176a2d5e1075c96965ed32c83cfc33/main.pdf main.pdf pdf true 256194 MAIN 10 1-s2.0-S1381116904005527-main_1.png https://s3.amazonaws.com/prod-ucs-content-store-us-east/content/pii:S1381116904005527/PREVIEW/image/png/14c8e73dd1d83fc769626b77c469e424/main_1.png https://s3-eu-west-1.amazonaws.com/prod-ucs-content-store-eu-west/content/pii:S1381116904005527/PREVIEW/image/png/14c8e73dd1d83fc769626b77c469e424/main_1.png main_1.png png 64690 849 656 IMAGE-WEB-PDF 1 1-s2.0-S1381116904005527-gr1.sml https://s3.amazonaws.com/prod-ucs-content-store-us-east/content/pii:S1381116904005527/gr1/THUMBNAIL/image/gif/6cca51e5bddc4546c93026f2704359db/gr1.sml https://s3-eu-west-1.amazonaws.com/prod-ucs-content-store-eu-west/content/pii:S1381116904005527/gr1/THUMBNAIL/image/gif/6cca51e5bddc4546c93026f2704359db/gr1.sml gr1 gr1.sml sml 871 93 66 IMAGE-THUMBNAIL 1-s2.0-S1381116904005527-gr1.gif https://s3.amazonaws.com/prod-ucs-content-store-us-east/content/pii:S1381116904005527/gr1/DOWNSAMPLED/image/gif/87633626a67baa4cee64eaa1ad037313/gr1.gif https://s3-eu-west-1.amazonaws.com/prod-ucs-content-store-eu-west/content/pii:S1381116904005527/gr1/DOWNSAMPLED/image/gif/87633626a67baa4cee64eaa1ad037313/gr1.gif gr1 gr1.gif gif 12969 610 433 IMAGE-DOWNSAMPLED 1-s2.0-S1381116904005527-gr2.sml https://s3.amazonaws.com/prod-ucs-content-store-us-east/content/pii:S1381116904005527/gr2/THUMBNAIL/image/gif/8e9785dd579914e6a6e1f04206348bb5/gr2.sml https://s3-eu-west-1.amazonaws.com/prod-ucs-content-store-eu-west/content/pii:S1381116904005527/gr2/THUMBNAIL/image/gif/8e9785dd579914e6a6e1f04206348bb5/gr2.sml gr2 gr2.sml sml 1265 93 94 IMAGE-THUMBNAIL 1-s2.0-S1381116904005527-gr2.gif https://s3.amazonaws.com/prod-ucs-content-store-us-east/content/pii:S1381116904005527/gr2/DOWNSAMPLED/image/gif/271e48e5274c92bf2d5757c8a96a180a/gr2.gif https://s3-eu-west-1.amazonaws.com/prod-ucs-content-store-eu-west/content/pii:S1381116904005527/gr2/DOWNSAMPLED/image/gif/271e48e5274c92bf2d5757c8a96a180a/gr2.gif gr2 gr2.gif gif 5348 277 281 IMAGE-DOWNSAMPLED 1-s2.0-S1381116904005527-gr3.sml https://s3.amazonaws.com/prod-ucs-content-store-us-east/content/pii:S1381116904005527/gr3/THUMBNAIL/image/gif/85b173e86e219c4ce605a4c2c382a0f5/gr3.sml https://s3-eu-west-1.amazonaws.com/prod-ucs-content-store-eu-west/content/pii:S1381116904005527/gr3/THUMBNAIL/image/gif/85b173e86e219c4ce605a4c2c382a0f5/gr3.sml gr3 gr3.sml sml 1801 93 54 IMAGE-THUMBNAIL 1-s2.0-S1381116904005527-gr3.jpg https://s3.amazonaws.com/prod-ucs-content-store-us-east/content/pii:S1381116904005527/gr3/DOWNSAMPLED/image/jpeg/c818ed9162d2f277e779ca8b0f8fd8fc/gr3.jpg https://s3-eu-west-1.amazonaws.com/prod-ucs-content-store-eu-west/content/pii:S1381116904005527/gr3/DOWNSAMPLED/image/jpeg/c818ed9162d2f277e779ca8b0f8fd8fc/gr3.jpg gr3 gr3.jpg jpg 67571 582 339 IMAGE-DOWNSAMPLED 1-s2.0-S1381116904005527-gr4.sml https://s3.amazonaws.com/prod-ucs-content-store-us-east/content/pii:S1381116904005527/gr4/THUMBNAIL/image/gif/9cdce2b8354c00b6285b7540d0532aeb/gr4.sml https://s3-eu-west-1.amazonaws.com/prod-ucs-content-store-eu-west/content/pii:S1381116904005527/gr4/THUMBNAIL/image/gif/9cdce2b8354c00b6285b7540d0532aeb/gr4.sml gr4 gr4.sml sml 1013 92 53 IMAGE-THUMBNAIL 1-s2.0-S1381116904005527-gr4.gif https://s3.amazonaws.com/prod-ucs-content-store-us-east/content/pii:S1381116904005527/gr4/DOWNSAMPLED/image/gif/c4b29e6b45fb46f0357c007204df8cfa/gr4.gif https://s3-eu-west-1.amazonaws.com/prod-ucs-content-store-eu-west/content/pii:S1381116904005527/gr4/DOWNSAMPLED/image/gif/c4b29e6b45fb46f0357c007204df8cfa/gr4.gif gr4 gr4.gif gif 8838 407 234 IMAGE-DOWNSAMPLED 1-s2.0-S1381116904005527-gr5.sml https://s3.amazonaws.com/prod-ucs-content-store-us-east/content/pii:S1381116904005527/gr5/THUMBNAIL/image/gif/e2cd3c17990c701c561ecaddc912a377/gr5.sml https://s3-eu-west-1.amazonaws.com/prod-ucs-content-store-eu-west/content/pii:S1381116904005527/gr5/THUMBNAIL/image/gif/e2cd3c17990c701c561ecaddc912a377/gr5.sml gr5 gr5.sml sml 1707 94 112 IMAGE-THUMBNAIL 1-s2.0-S1381116904005527-gr5.gif https://s3.amazonaws.com/prod-ucs-content-store-us-east/content/pii:S1381116904005527/gr5/DOWNSAMPLED/image/gif/58f1aec1a1bf555ba08d393934ff61db/gr5.gif https://s3-eu-west-1.amazonaws.com/prod-ucs-content-store-eu-west/content/pii:S1381116904005527/gr5/DOWNSAMPLED/image/gif/58f1aec1a1bf555ba08d393934ff61db/gr5.gif gr5 gr5.gif gif 5021 209 250 IMAGE-DOWNSAMPLED 1-s2.0-S1381116904005527-gr6.sml https://s3.amazonaws.com/prod-ucs-content-store-us-east/content/pii:S1381116904005527/gr6/THUMBNAIL/image/gif/ca311b131e272d51809a05c5b8b17333/gr6.sml https://s3-eu-west-1.amazonaws.com/prod-ucs-content-store-eu-west/content/pii:S1381116904005527/gr6/THUMBNAIL/image/gif/ca311b131e272d51809a05c5b8b17333/gr6.sml gr6 gr6.sml sml 1446 93 97 IMAGE-THUMBNAIL 1-s2.0-S1381116904005527-gr6.gif https://s3.amazonaws.com/prod-ucs-content-store-us-east/content/pii:S1381116904005527/gr6/DOWNSAMPLED/image/gif/7db16255c7611c3b83ff7ac8505f43a5/gr6.gif https://s3-eu-west-1.amazonaws.com/prod-ucs-content-store-eu-west/content/pii:S1381116904005527/gr6/DOWNSAMPLED/image/gif/7db16255c7611c3b83ff7ac8505f43a5/gr6.gif gr6 gr6.gif gif 5641 257 268 IMAGE-DOWNSAMPLED 1-s2.0-S1381116904005527-gr7.sml https://s3.amazonaws.com/prod-ucs-content-store-us-east/content/pii:S1381116904005527/gr7/THUMBNAIL/image/gif/27ee720576cd06b658de05d7a26f5484/gr7.sml https://s3-eu-west-1.amazonaws.com/prod-ucs-content-store-eu-west/content/pii:S1381116904005527/gr7/THUMBNAIL/image/gif/27ee720576cd06b658de05d7a26f5484/gr7.sml gr7 gr7.sml sml 1398 93 95 IMAGE-THUMBNAIL 1-s2.0-S1381116904005527-gr7.gif https://s3.amazonaws.com/prod-ucs-content-store-us-east/content/pii:S1381116904005527/gr7/DOWNSAMPLED/image/gif/2380f03dd0225a7bd86b55e584a4d4e6/gr7.gif https://s3-eu-west-1.amazonaws.com/prod-ucs-content-store-eu-west/content/pii:S1381116904005527/gr7/DOWNSAMPLED/image/gif/2380f03dd0225a7bd86b55e584a4d4e6/gr7.gif gr7 gr7.gif gif 5557 244 250 IMAGE-DOWNSAMPLED 1-s2.0-S1381116904005527-gr8.sml https://s3.amazonaws.com/prod-ucs-content-store-us-east/content/pii:S1381116904005527/gr8/THUMBNAIL/image/gif/afe0e88cbe282ad2fac7154ca74d1cce/gr8.sml https://s3-eu-west-1.amazonaws.com/prod-ucs-content-store-eu-west/content/pii:S1381116904005527/gr8/THUMBNAIL/image/gif/afe0e88cbe282ad2fac7154ca74d1cce/gr8.sml gr8 gr8.sml sml 1537 94 97 IMAGE-THUMBNAIL 1-s2.0-S1381116904005527-gr8.gif https://s3.amazonaws.com/prod-ucs-content-store-us-east/content/pii:S1381116904005527/gr8/DOWNSAMPLED/image/gif/60ca7abbbdbb11127184a05a263b7461/gr8.gif https://s3-eu-west-1.amazonaws.com/prod-ucs-content-store-eu-west/content/pii:S1381116904005527/gr8/DOWNSAMPLED/image/gif/60ca7abbbdbb11127184a05a263b7461/gr8.gif gr8 gr8.gif gif 5897 243 252 IMAGE-DOWNSAMPLED 1-s2.0-S1381116904005527-gr9.sml https://s3.amazonaws.com/prod-ucs-content-store-us-east/content/pii:S1381116904005527/gr9/THUMBNAIL/image/gif/2523b19064ba4c7f2ba72aafc0b90f69/gr9.sml https://s3-eu-west-1.amazonaws.com/prod-ucs-content-store-eu-west/content/pii:S1381116904005527/gr9/THUMBNAIL/image/gif/2523b19064ba4c7f2ba72aafc0b90f69/gr9.sml gr9 gr9.sml sml 1398 93 96 IMAGE-THUMBNAIL 1-s2.0-S1381116904005527-gr9.gif https://s3.amazonaws.com/prod-ucs-content-store-us-east/content/pii:S1381116904005527/gr9/DOWNSAMPLED/image/gif/4269bf79d1ea930d7e2eacb355a69c4c/gr9.gif https://s3-eu-west-1.amazonaws.com/prod-ucs-content-store-eu-west/content/pii:S1381116904005527/gr9/DOWNSAMPLED/image/gif/4269bf79d1ea930d7e2eacb355a69c4c/gr9.gif gr9 gr9.gif gif 5467 252 259 IMAGE-DOWNSAMPLED 1-s2.0-S1381116904005527-gr10.sml https://s3.amazonaws.com/prod-ucs-content-store-us-east/content/pii:S1381116904005527/gr10/THUMBNAIL/image/gif/8c830e20b18114b707d984628800f1b6/gr10.sml https://s3-eu-west-1.amazonaws.com/prod-ucs-content-store-eu-west/content/pii:S1381116904005527/gr10/THUMBNAIL/image/gif/8c830e20b18114b707d984628800f1b6/gr10.sml gr10 gr10.sml sml 1309 93 96 IMAGE-THUMBNAIL 1-s2.0-S1381116904005527-gr10.gif https://s3.amazonaws.com/prod-ucs-content-store-us-east/content/pii:S1381116904005527/gr10/DOWNSAMPLED/image/gif/7a0c34191a31c6516737c18d722cee15/gr10.gif https://s3-eu-west-1.amazonaws.com/prod-ucs-content-store-eu-west/content/pii:S1381116904005527/gr10/DOWNSAMPLED/image/gif/7a0c34191a31c6516737c18d722cee15/gr10.gif gr10 gr10.gif gif 5340 251 260 IMAGE-DOWNSAMPLED 1-s2.0-S1381116904005527-gr11.sml https://s3.amazonaws.com/prod-ucs-content-store-us-east/content/pii:S1381116904005527/gr11/THUMBNAIL/image/gif/dfaef2b2be2fa2d069662c92ad463557/gr11.sml https://s3-eu-west-1.amazonaws.com/prod-ucs-content-store-eu-west/content/pii:S1381116904005527/gr11/THUMBNAIL/image/gif/dfaef2b2be2fa2d069662c92ad463557/gr11.sml gr11 gr11.sml sml 1298 93 95 IMAGE-THUMBNAIL 1-s2.0-S1381116904005527-gr11.gif https://s3.amazonaws.com/prod-ucs-content-store-us-east/content/pii:S1381116904005527/gr11/DOWNSAMPLED/image/gif/d70d4feaa737f84692cd76341ccf7cce/gr11.gif https://s3-eu-west-1.amazonaws.com/prod-ucs-content-store-eu-west/content/pii:S1381116904005527/gr11/DOWNSAMPLED/image/gif/d70d4feaa737f84692cd76341ccf7cce/gr11.gif gr11 gr11.gif gif 5826 268 274 IMAGE-DOWNSAMPLED 1-s2.0-S1381116904005527-sc1.sml https://s3.amazonaws.com/prod-ucs-content-store-us-east/content/pii:S1381116904005527/sc1/THUMBNAIL/image/gif/a867b94e0e250ed9c70d463811879b0b/sc1.sml https://s3-eu-west-1.amazonaws.com/prod-ucs-content-store-eu-west/content/pii:S1381116904005527/sc1/THUMBNAIL/image/gif/a867b94e0e250ed9c70d463811879b0b/sc1.sml sc1 sc1.sml sml 1301 93 125 IMAGE-THUMBNAIL 1-s2.0-S1381116904005527-sc1.gif https://s3.amazonaws.com/prod-ucs-content-store-us-east/content/pii:S1381116904005527/sc1/DOWNSAMPLED/image/gif/3908dca4c2b9934729fed479b4f21ff2/sc1.gif https://s3-eu-west-1.amazonaws.com/prod-ucs-content-store-eu-west/content/pii:S1381116904005527/sc1/DOWNSAMPLED/image/gif/3908dca4c2b9934729fed479b4f21ff2/sc1.gif sc1 sc1.gif gif 1937 133 179 IMAGE-DOWNSAMPLED 1-s2.0-S1381116904005527-sc2.sml https://s3.amazonaws.com/prod-ucs-content-store-us-east/content/pii:S1381116904005527/sc2/THUMBNAIL/image/gif/3b73ac1ef04e96ba3230bb2fa36439b7/sc2.sml https://s3-eu-west-1.amazonaws.com/prod-ucs-content-store-eu-west/content/pii:S1381116904005527/sc2/THUMBNAIL/image/gif/3b73ac1ef04e96ba3230bb2fa36439b7/sc2.sml sc2 sc2.sml sml 1170 94 95 IMAGE-THUMBNAIL 1-s2.0-S1381116904005527-sc2.gif https://s3.amazonaws.com/prod-ucs-content-store-us-east/content/pii:S1381116904005527/sc2/DOWNSAMPLED/image/gif/1509e7991bfb8073854df4753c2ed852/sc2.gif https://s3-eu-west-1.amazonaws.com/prod-ucs-content-store-eu-west/content/pii:S1381116904005527/sc2/DOWNSAMPLED/image/gif/1509e7991bfb8073854df4753c2ed852/sc2.gif sc2 sc2.gif gif 12082 473 480 IMAGE-DOWNSAMPLED 1-s2.0-S1381116904005527-sc3.sml https://s3.amazonaws.com/prod-ucs-content-store-us-east/content/pii:S1381116904005527/sc3/THUMBNAIL/image/gif/50873edea5b0bd11046c75ccd6aac6d1/sc3.sml https://s3-eu-west-1.amazonaws.com/prod-ucs-content-store-eu-west/content/pii:S1381116904005527/sc3/THUMBNAIL/image/gif/50873edea5b0bd11046c75ccd6aac6d1/sc3.sml sc3 sc3.sml sml 776 94 65 IMAGE-THUMBNAIL 1-s2.0-S1381116904005527-sc3.gif https://s3.amazonaws.com/prod-ucs-content-store-us-east/content/pii:S1381116904005527/sc3/DOWNSAMPLED/image/gif/73f3d0f8f2ec9a529ce2c168db88dafb/sc3.gif https://s3-eu-west-1.amazonaws.com/prod-ucs-content-store-eu-west/content/pii:S1381116904005527/sc3/DOWNSAMPLED/image/gif/73f3d0f8f2ec9a529ce2c168db88dafb/sc3.gif sc3 sc3.gif gif 8708 541 376 IMAGE-DOWNSAMPLED 1-s2.0-S1381116904005527-fx1.sml https://s3.amazonaws.com/prod-ucs-content-store-us-east/content/pii:S1381116904005527/fx1/THUMBNAIL/image/gif/7aa0ca094d066f962d29f03560fd5f91/fx1.sml https://s3-eu-west-1.amazonaws.com/prod-ucs-content-store-eu-west/content/pii:S1381116904005527/fx1/THUMBNAIL/image/gif/7aa0ca094d066f962d29f03560fd5f91/fx1.sml fx1 true fx1.sml sml 822 59 125 IMAGE-THUMBNAIL 1-s2.0-S1381116904005527-fx1.gif https://s3.amazonaws.com/prod-ucs-content-store-us-east/content/pii:S1381116904005527/fx1/DOWNSAMPLED/image/gif/2852aa03aebbdd18f85d021fb6b39e5b/fx1.gif https://s3-eu-west-1.amazonaws.com/prod-ucs-content-store-eu-west/content/pii:S1381116904005527/fx1/DOWNSAMPLED/image/gif/2852aa03aebbdd18f85d021fb6b39e5b/fx1.gif fx1 true fx1.gif gif 1780 111 235 IMAGE-DOWNSAMPLED MOLCAA 4802 S1381-1169(04)00552-7 10.1016/j.molcata.2003.10.067 Elsevier B.V. Fig. 1 EPR spectra at 300 and 77K of VMCM-41(50): (a) as-synthesized, (b) calcined, and (c) washed. Fig. 2 XRD spectra of VMCM-41(50): (a) calcined, (b) washed, (c) recycled, and (d) washed and recycled. Fig. 3 (a) TEM and (b) ED of VMCM-41. Fig. 4 29Si MAS-NMR spectra of as-synthesized: (a) MCM-41, (b) VMCM-41(100), (c) VMCM-41(50), and (d) VMCM-41(25). Fig. 5 DRUV-VIS spectra of VMCM-41: (a) calcined, (b) washed, (c) recycled, and (d) washed and recycled. Fig. 6 Effect of reaction time on the conversion and selectivity over VMCM-41 (reaction conditions: substrate:oxidant (H2O2) = 1:1; T = 373K; catalyst = 3.3wt.%). Fig. 7 Effect of reaction temperature on the conversion and selectivity over VMCM-41 (reaction conditions: substrate:oxidant (H2O2) = 1:1; t = 12h; catalyst = 3.3wt.%). Fig. 8 Effect of Si/V molar ratio on the conversion and selectivity over VMCM-41 (reaction conditions: substrate:oxidant (H2O2) = 1:1; T = 373K; t = 12h; catalyst = 3.3wt.%). Fig. 9 Effect of catalyst concentration on the conversion and selectivity over VMCM-41 (reaction conditions: substrate:oxidant (H2O2) = 1:1; T = 373K; t = 12h). Fig. 10 Effect of recycling of calcined VS-1 catalyst (reaction conditions: substrate:oxidant (H2O2) = 1:1; T = 373K; t = 12h; catalyst = 3.3wt.%). Fig. 11 Effect of recycling of calcined VMCM-41 catalyst (reaction conditions: substrate:oxidant (H2O2) = 1:1; T = 373K; t = 12h; catalyst = 3.3wt.%). Scheme 1 Scheme 2 Scheme 3 Table 1 XRD, ICP-AES, and N2 sorption data of various VMCM-41 samples Sample a a 0 (Å) (XRD) V-content b (wt.%) Pore volume (mlg−1) N2 sorption pore diameter (Å) Surface area (m2 g−1) SiMCM-41 40.84 – 0.91 27 1040 VMCM-41(200) 41.30 0.21 0.86 26 1012 VMCM-41(100) 43.62 0.32 0.81 27 980 VMCM-41(50) c 46.08 0.76 0.85 29 919 VMCM-41(50) d 46.02 0.65 – – – VMCM-41(50) e 45.95 0.63 0.71 27 846 VMCM-41(50) f 46.01 0.64 – – – VMCM-41(25) 48.02 1.23 0.69 24 892 a Numbers in parentheses indicate the nominal Si/V ratios. b ICP-AES. c Calcined sample. d Washed sample. e Recycled sample. f Washed and recycled. Table 2 Recycling study over calcined and washed VMCM-41 catalysts a Catalyst Conversion (wt.%) Selectivity (%) Cyclohexanol Cyclohexanone Cyclohexyl acetate Others Calcined VMCM-41 99.0 94.5 1.9 3.6 – First recycle 93.2 96.1 3.6 0.3 – Second recycle 92.0 92.4 6.3 1.3 – Third recycle 91.2 93.4 2.5 4.1 – Washed VMCM-41 93.4 90.0 4.5 5.5 – First recycle 89.8 95.0 2.1 2.9 – Second recycle 90.8 96.9 1.1 2.0 – Third recycle 90.1 93.8 2.2 4.0 – a Reaction conditions: substrate:oxidant (H2O2) = 1:1; catalyst = 3.3wt.%; T = 373K; t = 12h. Table 3 Influence of initiators on the oxidation of cyclohexane a Initiator Conversion (wt.%) Selectivity (%) Cyclohexanol Cyclohexanone Cyclohexyl acetate Others b MEK 99.0 94.5 1.9 3.6 – Cyclohexanone 65.2 64.2 30.2 1.9 3.7 Acetone 61.7 63.8 31.4 1.4 3.4 Acetaldehyde 42.9 89.5 8.6 0.9 1.0 a Reaction conditions: substrate:oxidant (H2O2) = 1:1; catalyst = 3.3wt.%; T = 373K; t = 12h. b Hexanoic acid and cyclohexene. Table 4 Oxidation of cyclohexane over VMCM-41 with different solvents a Solvents Conversion (wt.%) Selectivity (%) Cyclohexanol Cyclohexanone Cyclohexyl acetate Others b Acetic acid 99.0 94.5 1.9 3.6 – Methanol 38.9 98.6 – 0.2 1.2 1,4-Dioxan 34.3 98.2 – 0.4 1.4 Acetone 38.6 58.2 40.0 0.7 1.1 a Reaction conditions: substrate:oxidant (H2O2) = 1:1; catalyst = 3.3wt.%; T = 373K; t = 12h. b Hexanoic acid and cyclohexene. Table 5 Oxidation of cyclohexane over VMCM-41 with different oxidants a Oxidant Conversion (wt.%) Selectivity (%) Cyclohexanol Cyclohexanone Cyclohexyl acetate Others b H2O2 99.0 94.5 1.9 3.6 – O2 83.1 95.3 – 4.7 – Air 48.8 98.3 – 1.7 – TBHP 63.4 – 82.4 7.4 10.2 a Reaction conditions: substrate:oxidant = 1:1; catalyst = 3.3wt.%; T = 373K; t = 12h. b Hexanoic acid and cyclohexene. Mesoporous VMCM-41: highly efficient and remarkable catalyst for selective oxidation of cyclohexane to cyclohexanol S.E. Dapurkar A. Sakthivel P. Selvam * Solid State and Catalysis Laboratory, Department of Chemistry, Indian Institute of Technology-Bombay, Powai, Mumbai 400076, India * Corresponding author. Tel.: +91 22 2576 7155; fax: +91 22 2572 3480. Graphical abstract Mesoporous VMCM-41 is a very efficient and highly selective for the oxidation of cyclohexane to cyclohedanol under mild conditions, and that it also shows excellent recycling ability thus behaves truly as heterogeneous catalyst. Liquid phase oxidation of cyclohexane was carried out under milder reaction conditions over mesoporous VMCM-41 molecular sieve catalysts using aqueous hydrogen peroxide as oxidant, acetic acid as solvent, and methyl ethyl ketone as initiator. The catalysts showed high substrate conversion and excellent product (cyclohexanol) selectivity. Although the activity of the catalyst slightly decreased after first recycle, owing to leaching of small amount of non-framework vanadium ions, it, however, remained nearly same thereafter. This observation was further confirmed by washing experiments where the non-framework vanadium ions were removed upon ammonium acetate treatment. Further, the washed catalyst also showed an activity similar to that of the recycled catalyst. Thus, the recycled or washed VMCM-41 behaves truly as heterogeneous catalyst. This observation was complemented and confirmed by both filtrate and quenching studies. The effects of reaction time, temperature, Si/V molar ratio, and catalyst concentration on the catalyst performance were examined in order to optimize the conversion of cyclohexane and selectivity of cyclohexanol. However, the use of strong oxidizing agent, e.g., tertiary butyl hydroperoxide, resulted in the formation of cyclohexanone as the major product. In addition, the use of solvents like methanol, dioxan and acetone showed lower activity. Keywords Mesoporous VMCM-41 Selective oxidation Cyclohexane Cyclohexanol Cyclohexanone Cyclohexyl acetate 1 Introduction Selective oxidation reactions using heterogeneous catalysts are of growing importance for modern chemical industry. Among the numerous reactions, the oxidation products of cyclohexane, viz., cyclohexanol and cyclohexanone, are important intermediates in the production of adipic acid and caprolactam, which are used in the manufacture of nylon-6 and nylon-66 polymers [1–4]. They are, in general, produced on an industrial scale by the oxidation of cyclohexane or hydrogenation of phenol. On the other hand, there are several expensive and polluting processes have been employed using homogenous catalysts [5]. Hence, in recent years, attention has been focused on the development of transition metal containing molecular sieves based heterogeneous catalysts with oxygen or peroxides as non-polluting oxidants [6]. However, in most cases, extreme reaction conditions such as high pressure (2MPa) and high temperature (450K) in conjunction with low activity make the process less attractive. In addition, leaching of active metal ions has often been observed under the reaction conditions [6]. Thus, the oxidation of cyclohexane over environmental friendly heterogeneous catalysts under mild/moderate reaction conditions is a topic of great interest. In this regard, it is noteworthy here that vanadium-containing mesoporous MCM-41 molecular sieves, viz., VMCM-41, show promises for several oxidation reactions [7,8]. Therefore, in this investigation, an attempt has been made to explore the catalytic properties of mesoporous VMCM-41 materials under moderate reaction condition for the oxidation of cyclohexane. The present study on VMCM-41 is also in continuation of our work on various metal ions incorporated mesoporous silicate and aluminophosphate molecular sieves, viz., TiMCM-41 [9], AlMCM-41 [10], FeMCM-41 [11], CrMCM-41 [12], FeHMA [13], CoHMA [14], and TiHMA [15]. 2 Experimental 2.1 Starting materials The following chemicals were employed for the preparation of VMCM-41 and for the oxidation of cyclohexane. Fumed silica (SiO2; 99.8%; Aldrich), tetramethylammonium hydroxide (TMAOH; 25wt.%; Aldrich), cetyltrimethylammonium bromide (CTAB; 99%; Aldrich), vanadyl sulfate hydrate (VOSO4·3H2O; 99%; Aldrich), sulfuric acid (H2SO4; 98%; BDH), 2-propanol (99.7%; Merck), cyclohexane (99.5%; Merck), hydrogen peroxide (H2O2; 30%; Qualigens), tertiary butylhydroperoxide (TBHP; 70%; Lancaster), acetic acid (99.5%; Fischer), methyl ethyl ketone (MEK; 99%; SD), acetone (99.5%; SD), acetaldehyde (30%; SD). Authentic samples of cyclohexanol (98%; SD) and cyclohexanone (99%; Merck) were used for comparative analysis of the reaction products. All the reagents used in this study were in as-received form. 2.2 Synthesis of VMCM-41 Mesoporous VMCM-41 molecular sieves with different Si/V (molar) ratios of 25–200 were synthesized hydrothermally as per the procedure outlined elsewhere [7,16] with typical (molar) gel compositions of: SiO2:0.135(CTA)2O:0.13Na2O:0.075(TMA)2O:68H2O:(0.01–0.08)V2O5. Accordingly, dilute TMAOH was first added to fumed silica slowly and a homogeneous ‘Solution-X’ was obtained. Simultaneously, ‘Solution-Y’ was prepared by mixing dilute CTAB and NaOH and stirred for about 30min. Then, both the ‘Solution-X’ and ‘Solution-Y’ were then mixed together to get a clear gel. Finally, the vanadium precursor, viz., vanadyl sulfate hydrate, was added to the above gel and stirred for an hour. The pH of final gel was adjusted to 11.5 by addition of dilute H2SO4 and the resulting gel was transferred into Teflon-lined stainless steel autoclaves and kept in an air oven at 373K for 3 days for crystallization. The final solid product, designated as as-synthesized VMCM-41, obtained was filtrated and dried for overnight. The as-synthesized samples were then calcined at 823K for 2h in N2 with a flow rate of 50mlmin−1 and heating rate of 1Kmin−1 followed by 6h in air. Unless otherwise stated, the catalyst used in the present study was VMCM-41 with Si/V = 50. For a comparison, siliceous MCM-41 was prepared according to the procedure described earlier [17]. Likewise, microporous vanadium silicalite-1 (VS-1) was also prepared as per literature procedure [18] with a typical molar gel composition of: SiO2:0.165(TPA)2O:22H2O:0.01V2O5. 2.3 Characterization All the samples were systematically characterized by various analytical and spectroscopic techniques, viz., low angle powder X-ray diffraction (XRD; Rigaku), thermogravimetery-differentially thermal analysis (TG/DTA; Dupont 9900/2100), transmission electron microscopy (TEM; Philips CM 200 operated at 160kV), nitrogen sorption (Sorptomatic 1990), 51V and 29Si magic angle spinning nuclear magnetic resonance (51V and 29Si MAS-NMR; Varian 300X), Fourier transform-infrared (FT-IR; Nicolet Impact-400), diffuse reflectance ultraviolet-visible spectroscopy (DRUV-VIS; JASCO-V-570), electron paramagnetic resonance spectroscopy (EPR; Varian E-112), and inductively coupled plasma-atomic emission spectroscopy (ICP-AES; Labtam Plasma Lab 8440). 2.4 Reaction procedure The oxidation of cyclohexane (18mmol) was carried out using 50mg of the catalysts with 30% H2O2 (18mmol) as oxidant and acetic acid as solvent medium (10ml). The reaction was performed using methyl ethyl ketone (MEK; 5mmol) as initiator at 373K for 12h. Further, for the comparison, the reaction was also followed without MEK. After the reaction, the catalyst was separated and the solvent was neutralized with NaHCO3. Then, the products were extracted with diethyl ether and analyzed by gas chromatography (GC; Nucon 5700) using carbowax column. Further, the reaction products were confirmed by GC-MS (HEWLETT G1800A) with HP-5 capillary column. The reaction was also carried out employing various solvents such as methanol, 1,4-dioxan and acetone under the same reaction conditions. Furthermore, the effect of various oxidants, viz., air, oxygen, and TBHP, on the reaction was also investigated. 2.5 Washing studies In order to remove non-framework vanadium ions, if any, present in the mesoporous matrix, the calcined samples were treated with ammonium acetate solution (1M) as per the following procedure: about 100mg of the calcined catalyst was stirred with 30ml of ammonium acetate solution for 12h at room temperature. It was then filtered, washed, dried at 373K. The treated catalyst was recalcined at 723K for 6h, and the resulting samples are designated as washed catalyst. 2.6 Recycling studies To check the stability and recycling ability as well as leaching of vanadium ions from the VMCM-41 under reaction conditions, several recycling experiments were carried out for all the catalysts. The typical recycling procedure was as follows: after the initial reaction, the catalyst was separated from the reaction mixture and washed with acetone and dried at 353K followed by the activation at 823K for 6h in air. The reaction was then carried out on the recycled activated catalyst. 2.7 Filtrate/quenching studies The heterogeneous nature of the catalysts was tested by carrying out filtrate and quenching experiments. In the case of the former, the filtration was done by separating the catalyst from the reaction mixture at room temperature. The reaction was then followed on both filtrates as well as on the filtered catalyst. While in the case of the latter, the quenching experiments were performed by separating catalyst from the reaction mixture under the reaction conditions, the reaction was followed on the filtrate solution. 3 Results and discussion All the as-synthesized and calcined VMCM-41 samples were white in colour. Fig. 1 shows the EPR spectra of various vanadium samples. It can be seen from this figure that the absence of EPR signal for the as-synthesized, calcined and washed samples, both at room as well as liquid nitrogen temperatures, confirms the presence of V5+ in the VMCM-41 [16]. Although vanadyl sulfate was used for the preparation, the absence of V4+ in the VMCM-41 indicates that during the synthesis procedure V4+ may haven been oxidized to V5+ as aerial oxidation of V4+ to V5+ is known to occur rapidly in alkaline medium [19]. Fig. 2 depicts representative XRD patterns of the calcined, washed, recycled and washed recycled VMCM-41(50). As can be seen from this figure that the diffraction patterns are typical of mesoporous hexagonal MCM-41 structure [20,21]. Further, the diffraction profiles remain same even after the recycling and/or washing experiments suggesting the intactness of the structure. Table 1 summarizes the average unit cell parameter, vanadium contents, and N2 sorption data of various VMCM-41 samples. As expected, in all the cases, an increase in the d spacing (or a 0-vaules) compared to its siliceous analogue was noted. The observed expansion could, however, be attributed to the larger (crystal) radius of V5+ (0.495Å) than that of Si4+ (0.40Å) [22], and/or to the longer VO (1.8Å) bond distance as compared to SiO (1.6Å) [7]. On the other hand, the loss in vanadium for the washed sample shows a removal of non-framework vanadium ions from the matrix. Interestingly, the vanadium content in the VMCM-41 remains nearly the same even after recycling experiments suggesting that there is no further leaching of vanadium under reaction conditions. TG of as-synthesized VMCM-41 samples (not reproduced here) showed ∼40wt.% weight loss attributed to the removal of adsorbed water and surfactant molecules. On the other hand, the calcined sample shows a weight loss around 20wt.% (not reproduced here) due to the adsorbed water molecules. DTA gave the corresponding endothermic/exothermic transitions (also not reproduced here) characteristic of mesoporous MCM-41 materials [23]. Further, the N2 sorption data (see Table 1) on various vanadium samples supports the mesoporous nature of catalyst [20,21]. Fig. 3 presents the TEM of VMCM-41, which shows a regular hexagonal array of uniform channels typical of MCM-41 [21,24], along with an ED pattern which confirms the periodicity and high crystallinity of VMCM-41. This is highly consistent with XRD results. Fig. 4 shows 29Si MAS-NMR spectra of as-synthesized MCM-41 and VMCM-41. The spectra consist of two distinct signals, viz., −110.0ppm (Q4), −100.0ppm (Q3) along with a very week signal at −90.1ppm (Q2) corresponding to Si(OSi)4, Si(SiO)3(OH), and Si(OSi)2(OH)2, respectively [23,25]. It can be seen from this figure that the intensity of Q3 signal decreases as the vanadium concentration increases in the samples. This implies that there is an interaction between vanadium ions and hydroxyl groups in the silicate MCM-41 matrix, and as a consequence, the Q3 signal intensity decreases [26,27]. A similar observation was also noticed in the case of microporous molecular sieve materials [28,29]. Thus, during the synthesis, vanadyl ions (VO) may possibly be bonded to silanol groups (SiO) in the MCM-41 matrix so as to form mainly (SiO)3(VO) units (Scheme 1 ). 51V MAS-NMR of VMCM-41(50) shows a signal at ∼533ppm (not shown here), relative to VOCl3 as a reference, indicating that the presence of pentavalent vanadium in the tetrahedral framework of VMCM-41 [7,8]. However, the absence of signal around ∼300ppm indicates that no bulk vanadium oxide phase is present in the sample. DRUV-VIS spectra of various vanadium samples show two intense absorption maxima around 275nm ((π)t2 (d)e) and 340nm ((π)t1 (d)e) (Fig. 5 ). This is attributed to the charge transfer bands associated with O2− to V5+ in tetrahedral environment [16,27,30]. No band in visible region was noticed for the as-synthesized samples. Again, this observation supports the presence of V5+ in the matrix, which is in accordance with EPR studies. FT-IR spectra of various calcined vanadium sample shows bands at ∼1230, ∼1080, and ∼460cm−1, which are assigned to the symmetric stretching and bending of SiOSi vibration, respectively [23]. On the other hand, the diffuse band at ∼960cm−1 is attributed to defect sites (SiO), which normally appears in siliceous samples. However, the band is sharp in the case of VMCM-41 and increases vanadium content (not shown here) owing to the influence of VO group in the silicate framework [16]. Fig. 6 depicts the effect of reaction time on the cyclohexane reaction over calcined VMCM-41. It can be seen from this figure that the (cyclohexane) conversion increases with time, while (cyclohexanol) selectivity decreases, and that the optimum conversion and selectivity could be achieved at about 12h. It can also be noticed from this figure that, at the initial stages, a small amount of cyclohexyl acetate was observed along with cyclohexanol. The former increases slightly with time, which could possibly due to termination reaction between unreacted cyclohexyl and acetoxy radicals and/or by a possible reaction of cyclohexanol with excess acetic acid in the presence of VMCM-41 (see Schemes 2 and 3 ). Fig. 7 shows the effect of reaction temperature on cyclohexane reaction. In all cases, cyclohexanol was obtained as the major product, and only small amounts of other products, viz., cyclohexanone, cyclohexyl acetate, etc., were observed. Further, it can also be seen from the figure that the cyclohexane conversion increases with increase in reaction temperature, and that a maximum conversion was obtained at 373K. However, beyond this temperature, e.g., at 383K, a decrease in conversion and selectivity was observed, which could be attributed to a possible decomposition of H2O2 [6] as well as to the formation of cyclohexyl acetate by interaction of cyclohexyl and acetoxy radicals and/or due to the reaction between cyclohexanol with excess acetic acid (see Schemes 2 and 3). Fig. 8 shows the effect of vanadium content on the reaction. It can be seen from this figure that the (cyclohexane) conversion increases with vanadium content and that a maximum conversion was obtained for the Si/V ratio of 50. However, the observed decrease in conversion at higher vanadium content (Si/V = 25) could be due to the presence of excess amount of vanadium, which leads to competent interaction of metal oxo-species with both alkylperoxy species and cyclohexane [31], thus inhibiting the catalytic reaction. While cyclohexanol selectivity decreases as a consequence of the formation of ring-oxidized products such as hexanoic acid, which was identified using GC–MS. Fig. 9 presents the effect of catalyst concentration on the reaction. It can be seen form this figure that, as the catalyst concentration increases, the cyclohexane conversion increases. At the 3.3wt.% concentration, maximum substrate conversion and cyclohexanol selectivity was observed. However, above this concentration, a slight decrease in cyclohexane conversion and cyclohexanol selectivity was noticed. This could be attributed to the competent interaction of metal oxo-species in MCM-41 matrix with alkylperoxy species and cyclohexane [32]. Table 2 lists the results of recycling runs over calcined and washed VMCM-41 catalysts. In both the catalysts, cyclohexanol was obtained as the major product with small amounts of other products, viz., cyclohexanone and cyclohexyl acetate. It can also be seen from the table that the calcined catalyst showed high activity while a slight decrease in activity was noticed during the first run owing to the leaching of active vanadium ions under reaction condition. However, the activity is nearly the same in the subsequent cycles. Likewise, it is also interesting to note that the washed catalyst also showed a result similar to that of the recycled catalyst. The observation of loss of vanadium content upon recycling/washing is well supported by DRUV-VIS studies where a slight decrease in absorption band intensity was noted for the recyled/washed catalysts as compared to the calcined catalyst (Fig. 5a). However, the spectra remain nearly the same even after the treatment for the washed and recycled samples (Fig. 5b–d). On the other hand, filtrate and quenching studies carried out on washed catalyst shows no catalytic conversion of cyclohexane and furthermore, ICP-AES analysis yielded no evidence for any leached vanadium in the liquid phase, which is in accordance with literature [33]. Thus, the samples behave truly as heterogeneous catalysts. The cyclohexane reaction was also carried out over microporous VS-1 catalyst and the results are shown in Fig. 10 . It can be seen from this figure that the activity of VS-1 is quite low as compared to mesoporous VMCM-41 (Fig. 11 ). This could possibly due to the less diffusivity of cyclohexane molecule (kinetic diameter = 6Å) in the MFI pore channels (5.4Å) thereby the accessibility is restricted, which is in good agreement with an earlier report [34]. Further, it can also be noticed from this figure that VS-1 shows a decrease in conversion upon recycling, owing to leaching of active vanadium ions from the microporous matrix. On the other hand, in the absence of catalyst/initiator or in presence of vanadium free MCM-41 the reaction shows only ∼10% conversion while a continuous leaching of vanadium was observed for the V2O5 supported MCM-41 [16]. Thus, the high activity of various mesoporous vanadium catalysts is due to the stabilization of vanadium ions in the silicate framework of MCM-41 structure. Scheme 2 depicts the possible reaction pathway over the VMCM-41 catalyst. At first, acetic acid interacts with H2O2 leading to the formation of peroxy acetic acid 2a, which further reacts with vanadyl species 2b to produce vanadium peroxospecies 2c [34,35]. The latter than interacts with ketone (initiator) to produce a chelate complex of the type 2d followed by reaction of cyclohexane leads to cyclohexyl radical 2e. The cyclohexyl radical in turn reacts with peroxyacetic acid 2a, and H2O2 through chain transfer free radical reaction [36] to produce the desired product, viz., cyclohexanol (see Scheme 3). Table 3 presents the results of the influence of various initiators on the reaction. It is noteworthy here that the use of other initiators such as acetaldehyde, acetone and cyclohexanone lowers both the (substrate) conversion and (cyclohexanol) selectivity. On the other hand, the use of MEK resulted in a significant increase in conversion, which could be attributed to the reduction of the induction period [4,37,38] by use of unsymmetrical ketone (MEK) resulted in the formation of chelate complex (2d) may easily be cleaved into free radical and thus the initiation of the chain transfer by hydrogen abstraction with cyclohexane takes place [39]. Table 4 summarizes the influence of various solvents on the reaction. It can be seen from the table that a relatively lower conversion was obtained in the case of methanol, acetone and 1,4-dioxan due to possible partial decomposition of H2O2 under the reaction conditions. However, the observed higher catalytic activity in acetic acid can be attributed to the stabilization of H2O2 as peroxy acetic acid species 2a [6]. The reaction was also carried out with different oxidants, e.g., 70% TBHP, molecular O2 and air, and the results are listed in Table 5 . It can be seen from the table that the use of molecular O2 and air leads to a decrease in substrate conversion due to milder oxidizing nature as well as difficulty in activation [6]. Although, the use of TBHP decreases the conversion, it produces cyclohexanone as major product with considerable amount of cyclohexyl acetate and other ring oxidized products. The observed higher cyclohexanone selectivity may possibly be due to stronger oxidation efficiency of TBHP [39] thereby leading to secondary reaction, viz., oxidation of cyclohexanol to cyclohexanone, and other ring-oxidation reactions, e.g., hexanoic acid [40], which was confirmed by GC–MS analysis. 4 Conclusion In summary, it can be concluded that mesoporous VMCM-41 molecular sieve is a very efficient and highly selective catalyst for the cyclohexane oxidation under relatively mild reaction conditions. Among the various oxidants, H2O2 was found to be more suitable for the high substrate conversion and selective formation of cyclohexanol. Likewise, among the various initiators, MEK resulted in considerable increase in activity. Although small amounts of vanadium ions leach out at the initial stages of the reaction, like most other vanadium-based catalysts, however, in the case of VMCM-41, it was only the non-framework ions, which was washed out from the matrix. However, the remaining amount of vanadium ions in mesoporous VMCM-41 remain intact even after several recycling/washing treatments possibly due to the stabilization of vanadium ions in the mesoporous matrix. Thus, VMCM-41 behaves truly as heterogeneous catalyst. Acknowledgment We thank SAIF/RSIC, IIT-Bombay for EPR, TEM, ED, MAS-NMR and GC–MS measurements. References [1] W.L. Faith D.B. Keyes R.L. Clark Industrial Chemicals 2nd ed. 1957 Wiley New York [2] I.V. Berezin E.T. Denisov N.M. Emanuel Oxidation of Cyclohexane 1968 Pergamon Press New York [3] S..B. Chandalia Oxidation of Hydrocarbons 1st ed. 1977 Sevak Publications Bombay [4] M.T. Musser Encyclopedia of Industrial Chemistry 1987 VCH Weinheim [5] G.W. Parshall S.D. Ittel Homogenous Catalysis 1992 Wiley New York [6] U. Schuchardt D. Cardoso R. Sercheli R. Pereira R.S. da Cruz M.C. Guerreiro D. Mandelli E.V. Spimace E.L. Pires Appl. Catal. A 211 1999 1 and reference cited therein [7] K.M. Reddy I. Moudrakovski A. Sayari J. Chem. Soc., Chem. Commun. 1994 1059 [8] J.S. Reddy P. Liu A. Sayari Appl. Catal. A 148 1996 7 [9] P. Selvam, S.K. Badamali, R.J. Mahalingam, A. Sakthivel, in: Proceedings of the 16th North American Catalysis Society Meeting, Boston, 1999, p. PI-011. [10] A. Sakthivel S.K. Badamali P. Selvam Micropor. Mesopor. Mater. 39 2000 457 [11] S.K. Badamali A. Sakthivel P. Selvam Catal. Lett. 65 2000 153 [12] R.J. Mahalingam S.K. Badamali P. Selvam Chem. Lett. 1999 1141 A. Sakthivel S.E. Dapurkar P. Selvam Catal. Lett. 77 2001 155 A. Sakthivel S.K. Badamali P. Selvam Catal. Lett. 80 2002 73 A. Sakthivel P. Selvam J. Catal. 211 2002 134 S.E. Dapurkar A. Sakthivel P. Selvam New J. Chem. 27 2003 1184 A. Sakthivel S.E. Dapurkar P. Selvam Appl. Catal. A 246 2003 283 [13] S.K. Mohapatra B. Sahoo W. Keune P. Selvam Chem. Commun. 2002 1466 S.U. Sonavane S.K. Mohapatra R.V. Jayaram P. Selvam Chem. Lett. 32 2003 142 [14] S.K. Mohapatra P. Selvam Top. Catal 22 2003 17 S.K. Mohapatra S.U. Sonavane R.V. Jayaram P. Selvam Tetrahedron Lett. 43 2002 8527 S.K. Mohapatra S.U. Sonavane R.V. Jayaram P. Selvam Tetrahedron Lett. 44 2003 1107 [15] S.K. Mohapatra F. Hussain P. Selvam Catal. Commun. 4 2003 57 [16] A. Sakthivel S.E. Dapurkar P. Selvam T. White D. Sun Advances in Environmental Materials, Pollution Control Materials vol. I 2001 Materials Research Society Singapore 67 72 [17] S.E. Dapurkar S.K. Badamali P. Selvam Catal. Today 68 2001 63 [18] T. Sen P.R. Rajamohanan S. Ganapathy S. Sivasanker J. Catal. 163 1996 354 [19] N.D. Chasteen Struct. Bond. 53 1983 112 [20] C.T. Kresge M.E. Leonowicz W.T. Roth J.C. Vartuli J.S. Beck Nature 359 1992 710 [21] P. Selvam S.K. Bhatia C. Sonwane Ind. Eng. Chem. Res. 40 2001 3237 [22] R.D. Shannon C.T. Prewitt Acta Crystallogr. B 25 1969 925 [23] S.K. Badamali, Ph.D. Thesis, IIT-Bombay, 1999. [24] Z. Liu Y. Sakamoto T. Ohsuna K. Hiraga O. Terasaki C.H. Ko H.J. Shin R. Ryoo Angew. Chem. Int. Ed. 39 2000 3107 [25] C.-Y. Chen H.-X. Li M.E. Davis Micropor. Mater. 2 1993 27 [26] D.H. Park C.-F. Cheng J. Klinowski Bull. Kor. Chem. Soc. 18 1997 70 D.H. Park C.-F. Cheng J. Klinowski J. Mater. Chem. 7 1997 159 [27] K.J. Chao C.N. Wu H. Chang L.T. Lee S.F. Hu J. Phys. Chem. 101 1997 6341 [28] P.R.H.P. Rao A.V. Ramaswamy P. Ratnasamy J. Catal. 137 1992 225 [29] I. Moudrakovski A. Sayari C.I. Ratcliffe J.A. Ripmeester K.F. Preston J. Phys. Chem. 98 1994 10895 [30] Z. Luan J. Xu H. He J. Klinowski L. Keven J. Phys. Chem. 100 1996 19595 [31] J.F. Black J. Am. Chem. Soc. 100 1978 527 [32] I. Belkhir A. Germain F. Fajula E. Fache J. Chem. Soc., Faraday Trans. 94 1998 1761 [33] R.D. Oldroyd G. Sankar J.M. Thomas M. Hunnius W.F. Maier J. Chem. Soc., Faraday Trans. 94 1998 3177 [34] P.R.H.P. Rao A.A. Belhekar S.G. Hegde A.V. Ramaswamy P. Ratnasamy J. Catal. 141 1993 595 P.R.H.P. Rao A.V. Ramaswamy P. Ratnasamy J. Catal. 141 1993 604 [35] H. Mimoun L. Saussine E. Daire M. Postel J. Fischer R. Weiss J. Am. Chem. Soc. 105 1983 3101 [36] R. Pohorecki J. Baldyga W. Moniuk A. Krzysztoforski Z. Wokicik Chem. Eng. Sci. 47 1992 2559 R. Pohorecki J. Baldyga W. Moniuk W. Podogorska A. Zdrojkowski P.T. Wierzchowski Chem. Eng. Sci. 56 2001 1285 [37] A. Onopchenko J.G.D. Schulz J. Org. Chem. 38 1973 3729 A. Onopchenko J.G.D. Schulz J. Org. Chem. 40 1975 3338 [38] S.I. Murahashi Y. Oda T. Naota J. Am. Chem. Soc. 114 1992 7913 [39] W.F. Brill Ind. Eng. Chem. 52 1960 837 [40] E.L. Pires J.C. Magalhaes U. Schuchardt Appl. Catal. A 203 2000 231",
      "scopus-id": "7444221162",
      "coredata": {
        "eid": "1-s2.0-S1381116904005527",
        "dc:description": "Liquid phase oxidation of cyclohexane was carried out under milder reaction conditions over mesoporous VMCM-41 molecular sieve catalysts using aqueous hydrogen peroxide as oxidant, acetic acid as solvent, and methyl ethyl ketone as initiator. The catalysts showed high substrate conversion and excellent product (cyclohexanol) selectivity. Although the activity of the catalyst slightly decreased after first recycle, owing to leaching of small amount of non-framework vanadium ions, it, however, remained nearly same thereafter. This observation was further confirmed by washing experiments where the non-framework vanadium ions were removed upon ammonium acetate treatment. Further, the washed catalyst also showed an activity similar to that of the recycled catalyst. Thus, the recycled or washed VMCM-41 behaves truly as heterogeneous catalyst. This observation was complemented and confirmed by both filtrate and quenching studies. The effects of reaction time, temperature, Si/V molar ratio, and catalyst concentration on the catalyst performance were examined in order to optimize the conversion of cyclohexane and selectivity of cyclohexanol. However, the use of strong oxidizing agent, e.g., tertiary butyl hydroperoxide, resulted in the formation of cyclohexanone as the major product. In addition, the use of solvents like methanol, dioxan and acetone showed lower activity.",
        "openArchiveArticle": "false",
        "prism:coverDate": "2004-12-01",
        "openaccessUserLicense": null,
        "prism:aggregationType": "Journal",
        "prism:url": "https://api.elsevier.com/content/article/pii/S1381116904005527",
        "dc:creator": [
          {
            "@_fa": "true",
            "$": "Dapurkar, S.E."
          },
          {
            "@_fa": "true",
            "$": "Sakthivel, A."
          },
          {
            "@_fa": "true",
            "$": "Selvam, P."
          }
        ],
        "link": [
          {
            "@_fa": "true",
            "@rel": "self",
            "@href": "https://api.elsevier.com/content/article/pii/S1381116904005527"
          },
          {
            "@_fa": "true",
            "@rel": "scidir",
            "@href": "https://www.sciencedirect.com/science/article/pii/S1381116904005527"
          }
        ],
        "dc:format": "application/json",
        "openaccessType": null,
        "pii": "S1381-1169(04)00552-7",
        "prism:volume": "223",
        "prism:publisher": "Elsevier B.V.",
        "dc:title": "Mesoporous VMCM-41: highly efficient and remarkable catalyst for selective oxidation of cyclohexane to cyclohexanol",
        "prism:copyright": "Copyright © 2004 Elsevier B.V. All rights reserved.",
        "prism:issueName": "Catalysis--A Cross Disciplinary Vision",
        "openaccess": "0",
        "prism:issn": "13811169",
        "prism:issueIdentifier": "1-2",
        "dcterms:subject": [
          {
            "@_fa": "true",
            "$": "Mesoporous"
          },
          {
            "@_fa": "true",
            "$": "VMCM-41"
          },
          {
            "@_fa": "true",
            "$": "Selective oxidation"
          },
          {
            "@_fa": "true",
            "$": "Cyclohexane"
          },
          {
            "@_fa": "true",
            "$": "Cyclohexanol"
          },
          {
            "@_fa": "true",
            "$": "Cyclohexanone"
          },
          {
            "@_fa": "true",
            "$": "Cyclohexyl acetate"
          }
        ],
        "openaccessArticle": "false",
        "prism:publicationName": "Journal of Molecular Catalysis A: Chemical",
        "prism:number": "1-2",
        "openaccessSponsorType": null,
        "prism:pageRange": "241-250",
        "prism:endingPage": "250",
        "pubType": "fla",
        "prism:coverDisplayDate": "1 December 2004",
        "prism:doi": "10.1016/j.molcata.2003.10.067",
        "prism:startingPage": "241",
        "dc:identifier": "doi:10.1016/j.molcata.2003.10.067",
        "openaccessSponsorName": null
      },
      "objects": {
        "object": [
          {
            "@category": "thumbnail",
            "@height": "93",
            "@width": "66",
            "@_fa": "true",
            "$": "https://api.elsevier.com/content/object/eid/1-s2.0-S1381116904005527-gr1.sml?httpAccept=%2A%2F%2A",
            "@multimediatype": "GIF image file",
            "@type": "IMAGE-THUMBNAIL",
            "@size": "871",
            "@ref": "gr1",
            "@mimetype": "image/gif"
          },
          {
            "@category": "standard",
            "@height": "610",
            "@width": "433",
            "@_fa": "true",
            "$": "https://api.elsevier.com/content/object/eid/1-s2.0-S1381116904005527-gr1.gif?httpAccept=%2A%2F%2A",
            "@multimediatype": "GIF image file",
            "@type": "IMAGE-DOWNSAMPLED",
            "@size": "12969",
            "@ref": "gr1",
            "@mimetype": "image/gif"
          },
          {
            "@category": "thumbnail",
            "@height": "93",
            "@width": "94",
            "@_fa": "true",
            "$": "https://api.elsevier.com/content/object/eid/1-s2.0-S1381116904005527-gr2.sml?httpAccept=%2A%2F%2A",
            "@multimediatype": "GIF image file",
            "@type": "IMAGE-THUMBNAIL",
            "@size": "1265",
            "@ref": "gr2",
            "@mimetype": "image/gif"
          },
          {
            "@category": "standard",
            "@height": "277",
            "@width": "281",
            "@_fa": "true",
            "$": "https://api.elsevier.com/content/object/eid/1-s2.0-S1381116904005527-gr2.gif?httpAccept=%2A%2F%2A",
            "@multimediatype": "GIF image file",
            "@type": "IMAGE-DOWNSAMPLED",
            "@size": "5348",
            "@ref": "gr2",
            "@mimetype": "image/gif"
          },
          {
            "@category": "thumbnail",
            "@height": "93",
            "@width": "54",
            "@_fa": "true",
            "$": "https://api.elsevier.com/content/object/eid/1-s2.0-S1381116904005527-gr3.sml?httpAccept=%2A%2F%2A",
            "@multimediatype": "GIF image file",
            "@type": "IMAGE-THUMBNAIL",
            "@size": "1801",
            "@ref": "gr3",
            "@mimetype": "image/gif"
          },
          {
            "@category": "standard",
            "@height": "582",
            "@width": "339",
            "@_fa": "true",
            "$": "https://api.elsevier.com/content/object/eid/1-s2.0-S1381116904005527-gr3.jpg?httpAccept=%2A%2F%2A",
            "@multimediatype": "JPEG image file",
            "@type": "IMAGE-DOWNSAMPLED",
            "@size": "67571",
            "@ref": "gr3",
            "@mimetype": "image/jpeg"
          },
          {
            "@category": "thumbnail",
            "@height": "92",
            "@width": "53",
            "@_fa": "true",
            "$": "https://api.elsevier.com/content/object/eid/1-s2.0-S1381116904005527-gr4.sml?httpAccept=%2A%2F%2A",
            "@multimediatype": "GIF image file",
            "@type": "IMAGE-THUMBNAIL",
            "@size": "1013",
            "@ref": "gr4",
            "@mimetype": "image/gif"
          },
          {
            "@category": "standard",
            "@height": "407",
            "@width": "234",
            "@_fa": "true",
            "$": "https://api.elsevier.com/content/object/eid/1-s2.0-S1381116904005527-gr4.gif?httpAccept=%2A%2F%2A",
            "@multimediatype": "GIF image file",
            "@type": "IMAGE-DOWNSAMPLED",
            "@size": "8838",
            "@ref": "gr4",
            "@mimetype": "image/gif"
          },
          {
            "@category": "thumbnail",
            "@height": "94",
            "@width": "112",
            "@_fa": "true",
            "$": "https://api.elsevier.com/content/object/eid/1-s2.0-S1381116904005527-gr5.sml?httpAccept=%2A%2F%2A",
            "@multimediatype": "GIF image file",
            "@type": "IMAGE-THUMBNAIL",
            "@size": "1707",
            "@ref": "gr5",
            "@mimetype": "image/gif"
          },
          {
            "@category": "standard",
            "@height": "209",
            "@width": "250",
            "@_fa": "true",
            "$": "https://api.elsevier.com/content/object/eid/1-s2.0-S1381116904005527-gr5.gif?httpAccept=%2A%2F%2A",
            "@multimediatype": "GIF image file",
            "@type": "IMAGE-DOWNSAMPLED",
            "@size": "5021",
            "@ref": "gr5",
            "@mimetype": "image/gif"
          },
          {
            "@category": "thumbnail",
            "@height": "93",
            "@width": "97",
            "@_fa": "true",
            "$": "https://api.elsevier.com/content/object/eid/1-s2.0-S1381116904005527-gr6.sml?httpAccept=%2A%2F%2A",
            "@multimediatype": "GIF image file",
            "@type": "IMAGE-THUMBNAIL",
            "@size": "1446",
            "@ref": "gr6",
            "@mimetype": "image/gif"
          },
          {
            "@category": "standard",
            "@height": "257",
            "@width": "268",
            "@_fa": "true",
            "$": "https://api.elsevier.com/content/object/eid/1-s2.0-S1381116904005527-gr6.gif?httpAccept=%2A%2F%2A",
            "@multimediatype": "GIF image file",
            "@type": "IMAGE-DOWNSAMPLED",
            "@size": "5641",
            "@ref": "gr6",
            "@mimetype": "image/gif"
          },
          {
            "@category": "thumbnail",
            "@height": "93",
            "@width": "95",
            "@_fa": "true",
            "$": "https://api.elsevier.com/content/object/eid/1-s2.0-S1381116904005527-gr7.sml?httpAccept=%2A%2F%2A",
            "@multimediatype": "GIF image file",
            "@type": "IMAGE-THUMBNAIL",
            "@size": "1398",
            "@ref": "gr7",
            "@mimetype": "image/gif"
          },
          {
            "@category": "standard",
            "@height": "244",
            "@width": "250",
            "@_fa": "true",
            "$": "https://api.elsevier.com/content/object/eid/1-s2.0-S1381116904005527-gr7.gif?httpAccept=%2A%2F%2A",
            "@multimediatype": "GIF image file",
            "@type": "IMAGE-DOWNSAMPLED",
            "@size": "5557",
            "@ref": "gr7",
            "@mimetype": "image/gif"
          },
          {
            "@category": "thumbnail",
            "@height": "94",
            "@width": "97",
            "@_fa": "true",
            "$": "https://api.elsevier.com/content/object/eid/1-s2.0-S1381116904005527-gr8.sml?httpAccept=%2A%2F%2A",
            "@multimediatype": "GIF image file",
            "@type": "IMAGE-THUMBNAIL",
            "@size": "1537",
            "@ref": "gr8",
            "@mimetype": "image/gif"
          },
          {
            "@category": "standard",
            "@height": "243",
            "@width": "252",
            "@_fa": "true",
            "$": "https://api.elsevier.com/content/object/eid/1-s2.0-S1381116904005527-gr8.gif?httpAccept=%2A%2F%2A",
            "@multimediatype": "GIF image file",
            "@type": "IMAGE-DOWNSAMPLED",
            "@size": "5897",
            "@ref": "gr8",
            "@mimetype": "image/gif"
          },
          {
            "@category": "thumbnail",
            "@height": "93",
            "@width": "96",
            "@_fa": "true",
            "$": "https://api.elsevier.com/content/object/eid/1-s2.0-S1381116904005527-gr9.sml?httpAccept=%2A%2F%2A",
            "@multimediatype": "GIF image file",
            "@type": "IMAGE-THUMBNAIL",
            "@size": "1398",
            "@ref": "gr9",
            "@mimetype": "image/gif"
          },
          {
            "@category": "standard",
            "@height": "252",
            "@width": "259",
            "@_fa": "true",
            "$": "https://api.elsevier.com/content/object/eid/1-s2.0-S1381116904005527-gr9.gif?httpAccept=%2A%2F%2A",
            "@multimediatype": "GIF image file",
            "@type": "IMAGE-DOWNSAMPLED",
            "@size": "5467",
            "@ref": "gr9",
            "@mimetype": "image/gif"
          },
          {
            "@category": "thumbnail",
            "@height": "93",
            "@width": "96",
            "@_fa": "true",
            "$": "https://api.elsevier.com/content/object/eid/1-s2.0-S1381116904005527-gr10.sml?httpAccept=%2A%2F%2A",
            "@multimediatype": "GIF image file",
            "@type": "IMAGE-THUMBNAIL",
            "@size": "1309",
            "@ref": "gr10",
            "@mimetype": "image/gif"
          },
          {
            "@category": "standard",
            "@height": "251",
            "@width": "260",
            "@_fa": "true",
            "$": "https://api.elsevier.com/content/object/eid/1-s2.0-S1381116904005527-gr10.gif?httpAccept=%2A%2F%2A",
            "@multimediatype": "GIF image file",
            "@type": "IMAGE-DOWNSAMPLED",
            "@size": "5340",
            "@ref": "gr10",
            "@mimetype": "image/gif"
          },
          {
            "@category": "thumbnail",
            "@height": "93",
            "@width": "95",
            "@_fa": "true",
            "$": "https://api.elsevier.com/content/object/eid/1-s2.0-S1381116904005527-gr11.sml?httpAccept=%2A%2F%2A",
            "@multimediatype": "GIF image file",
            "@type": "IMAGE-THUMBNAIL",
            "@size": "1298",
            "@ref": "gr11",
            "@mimetype": "image/gif"
          },
          {
            "@category": "standard",
            "@height": "268",
            "@width": "274",
            "@_fa": "true",
            "$": "https://api.elsevier.com/content/object/eid/1-s2.0-S1381116904005527-gr11.gif?httpAccept=%2A%2F%2A",
            "@multimediatype": "GIF image file",
            "@type": "IMAGE-DOWNSAMPLED",
            "@size": "5826",
            "@ref": "gr11",
            "@mimetype": "image/gif"
          },
          {
            "@category": "thumbnail",
            "@height": "93",
            "@width": "125",
            "@_fa": "true",
            "$": "https://api.elsevier.com/content/object/eid/1-s2.0-S1381116904005527-sc1.sml?httpAccept=%2A%2F%2A",
            "@multimediatype": "GIF image file",
            "@type": "IMAGE-THUMBNAIL",
            "@size": "1301",
            "@ref": "sc1",
            "@mimetype": "image/gif"
          },
          {
            "@category": "standard",
            "@height": "133",
            "@width": "179",
            "@_fa": "true",
            "$": "https://api.elsevier.com/content/object/eid/1-s2.0-S1381116904005527-sc1.gif?httpAccept=%2A%2F%2A",
            "@multimediatype": "GIF image file",
            "@type": "IMAGE-DOWNSAMPLED",
            "@size": "1937",
            "@ref": "sc1",
            "@mimetype": "image/gif"
          },
          {
            "@category": "thumbnail",
            "@height": "94",
            "@width": "95",
            "@_fa": "true",
            "$": "https://api.elsevier.com/content/object/eid/1-s2.0-S1381116904005527-sc2.sml?httpAccept=%2A%2F%2A",
            "@multimediatype": "GIF image file",
            "@type": "IMAGE-THUMBNAIL",
            "@size": "1170",
            "@ref": "sc2",
            "@mimetype": "image/gif"
          },
          {
            "@category": "standard",
            "@height": "473",
            "@width": "480",
            "@_fa": "true",
            "$": "https://api.elsevier.com/content/object/eid/1-s2.0-S1381116904005527-sc2.gif?httpAccept=%2A%2F%2A",
            "@multimediatype": "GIF image file",
            "@type": "IMAGE-DOWNSAMPLED",
            "@size": "12082",
            "@ref": "sc2",
            "@mimetype": "image/gif"
          },
          {
            "@category": "thumbnail",
            "@height": "94",
            "@width": "65",
            "@_fa": "true",
            "$": "https://api.elsevier.com/content/object/eid/1-s2.0-S1381116904005527-sc3.sml?httpAccept=%2A%2F%2A",
            "@multimediatype": "GIF image file",
            "@type": "IMAGE-THUMBNAIL",
            "@size": "776",
            "@ref": "sc3",
            "@mimetype": "image/gif"
          },
          {
            "@category": "standard",
            "@height": "541",
            "@width": "376",
            "@_fa": "true",
            "$": "https://api.elsevier.com/content/object/eid/1-s2.0-S1381116904005527-sc3.gif?httpAccept=%2A%2F%2A",
            "@multimediatype": "GIF image file",
            "@type": "IMAGE-DOWNSAMPLED",
            "@size": "8708",
            "@ref": "sc3",
            "@mimetype": "image/gif"
          },
          {
            "@category": "thumbnail",
            "@height": "59",
            "@width": "125",
            "@_fa": "true",
            "$": "https://api.elsevier.com/content/object/eid/1-s2.0-S1381116904005527-fx1.sml?httpAccept=%2A%2F%2A",
            "@multimediatype": "GIF image file",
            "@type": "IMAGE-THUMBNAIL",
            "@size": "822",
            "@ref": "fx1",
            "@mimetype": "image/gif"
          },
          {
            "@category": "standard",
            "@height": "111",
            "@width": "235",
            "@_fa": "true",
            "$": "https://api.elsevier.com/content/object/eid/1-s2.0-S1381116904005527-fx1.gif?httpAccept=%2A%2F%2A",
            "@multimediatype": "GIF image file",
            "@type": "IMAGE-DOWNSAMPLED",
            "@size": "1780",
            "@ref": "fx1",
            "@mimetype": "image/gif"
          }
        ]
      },
      "link": {
        "@rel": "abstract",
        "@href": "https://api.elsevier.com/content/abstract/scopus_id/7444221162"
      }
    }
  }
}