{
  "metadata": {
    "title": "Catalytic reduction of nitrate and nitrite ions by hydrogen: investigation of the reaction mechanism over Pd and Pd–Cu catalysts",
    "authors": "; ; ",
    "journal": "Journal of Molecular Catalysis A: Chemical",
    "date": "2000-09-08",
    "doi": "10.1016/S1381-1169(00)00070-4",
    "abstract": "",
    "uri": "https://api.elsevier.com/content/article/pii/S1381116900000704",
    "pii": "S1381116900000704"
  },
  "fulltext": {
    "full-text-retrieval-response": {
      "scopus-eid": "2-s2.0-0034623221",
      "originalText": "serial JL 271358 291210 291744 291790 291809 31 Journal of Molecular Catalysis A: Chemical JOURNALMOLECULARCATALYSISACHEMICAL 2000-07-18 2000-07-18 2010-11-05T21:50:31 1-s2.0-S1381116900000704 S1381-1169(00)00070-4 S1381116900000704 10.1016/S1381-1169(00)00070-4 S300 S300.2 FULL-TEXT 1-s2.0-S1381116900X01215 2015-05-15T05:55:31.049811-04:00 0 0 20000908 2000 2000-07-18T00:00:00Z articleinfo crossmark dco dateupdated tomb dateloaded datesearch indexeddate issuelist volumelist yearnav articletitlenorm authfirstinitialnorm authfirstsurnamenorm cid cids contenttype copyright dateloadedtxt docsubtype doctype doi eid ewtransactionid hubeid issfirst issn issnnorm itemstage itemtransactionid itemweight openaccess openarchive pg pgfirst pglast pii piinorm pubdatestart pubdatetxt pubyr sortorder srctitle srctitlenorm srctype subheadings volfirst volissue webpdf webpdfpagecount figure table body acknowledge affil articletitle auth authfirstini authfull authkeywords authlast primabst ref alllist content subj ssids 1381-1169 13811169 158 158 1 1 Volume 158, Issue 1 27 237 249 237 249 20000908 8 September 2000 2000-09-08 2000 converted-article fla Copyright © 2000 Elsevier Science B.V. All rights reserved. CATALYTICREDUCTIONNITRATENITRITEIONSBYHYDROGENINVESTIGATIONREACTIONMECHANISMOVERPDPDCUCATALYSTS ILINITCH O 1 Introduction 2 Experimental 2.1 Preparation of catalysts and catalytic membranes 2.2 Characterization techniques 2.2.1 Analysis of the reaction and catalysts 2.2.2 Secondary ion mass spectroscopy (SIMS) 2.2.3 Thermal desorption spectroscopy (TDS) 3 Results 3.1 Catalytic reduction of NO3 − and NO2 − by H2 in water over γ-Al2O3-supported catalysts 3.2 Structure of Pd–Cu/Al2O3 catalysts 3.2.1 XRD study 3.2.2 SIMS investigation 3.3 Interaction of H2 with NO over Pd: TDS study 3.3.1 H2 adsorption 3.3.2 NO adsorption 3.3.3 Reaction H2+NOads 3.3.4 Reactions NH3+NOads and NH3+Oads 4 Discussion 4.1 Reduction of NO3 − and NO2 − by H2 over Pd/Al2O3 and Pd–Cu/Al2O3 catalysts 4.2 Investigation of the mechanism of NO3 − and NO2 − reduction by H2 4.2.1 The nature of hydrogen adsorbed over Pd 4.2.2 NO dissociation and NO+H2 interaction over Pd 4.2.3 Mechanism of NO reduction by H2 over Pd 4.2.4 Mechanism of NO3 − and NO2 − reduction by H2 over Pd and Pd–Cu catalysts 5 Conclusion Acknowledgements References VORLOP 1989 836 K ILINITCH 2000 137 145 O NEFEDOV 1983 V PHYSICALMETHODSINVESTIGATIONSOLIDSURFACES VERNER 1981 345 G ELECTRONICIONICSPECTROSCOPYSOLIDBODIES BETS 1986 24 G SPUTTERINGSOLIDBODIESBYIONICBOMBARDMENT OBUCHI 1982 235 A STUVE 1984 179 E MILUN 1987 466 M ALDAG 1971 260 A DEBAUGE 1995 15 Y SKODA 1994 159 F SKODA 1995 101 F NOSOVA 1994 131 L NOSOVA 1995 362 L RENOUPREZ 1996 1105 1114 A STUDSURFSCICATAL SUPPORTEDPDCUCATALYSTSPREPAREDBIMETALLICORGANOMETALLICCOMPLEXESRELATIONBETWEENSURFACECOMPOSITIONMEASUREDBYIONSCATTERINGREACTIVITY MIRKIN 1961 728 L ANALYSISPOLYCRYSTALSBYXRAYDIFFRACTION HOFFMAN 1980 148 S HUNT 1983 199 C WARNA 1994 5763 J HOROLD 1993 21 S KOBYLINSKI 1974 376 T PINTAR 1998 2280 A EGELHOFF 1982 397 W CHEMICALPHYSICSSOLIDSURFACEHETEROGENEOUSCATALYSIS YAMADA 1989 6880 T KUWAHARA 1987 490 Y ALDAG 1971 260 A REDHEAD 1962 203 P CONRAD 1974 435 H SCHWAHA 1977 383 K LANGEVELD 1983 179 A NOORDERMEER 1986 349 A HOMES 1990 179 D NEWTON 1991 45 M ROCHEFORT 1993 43 A GDOWSKI 1987 L147 G NYBERG 1989 923 C RAMSIER 1994 209 R TANAKA 1991 503 K GORODETSKII 1980 566 V PROCVIIINTCONGRCATALYSIS CHOLACH 1994 281 A LEONYLEON 1991 291 C ROCHEFORT 1993 43 A LEONYLEON 1991 269 C ILINITCHX2000X237 ILINITCHX2000X237X249 ILINITCHX2000X237XO ILINITCHX2000X237X249XO item S1381-1169(00)00070-4 S1381116900000704 1-s2.0-S1381116900000704 10.1016/S1381-1169(00)00070-4 271358 2010-11-30T03:52:16.414865-05:00 2000-09-08 1-s2.0-S1381116900000704-main.pdf https://s3.amazonaws.com/prod-ucs-content-store-us-east/content/pii:S1381116900000704/MAIN/application/pdf/9ddfbdbc9694e0ea21cf74da33c2b764/main.pdf https://s3-eu-west-1.amazonaws.com/prod-ucs-content-store-eu-west/content/pii:S1381116900000704/MAIN/application/pdf/9ddfbdbc9694e0ea21cf74da33c2b764/main.pdf main.pdf pdf true 305678 MAIN 13 1-s2.0-S1381116900000704-main_1.png https://s3.amazonaws.com/prod-ucs-content-store-us-east/content/pii:S1381116900000704/PREVIEW/image/png/bcac44abb4b77dd7ae1fe401e5d28a89/main_1.png https://s3-eu-west-1.amazonaws.com/prod-ucs-content-store-eu-west/content/pii:S1381116900000704/PREVIEW/image/png/bcac44abb4b77dd7ae1fe401e5d28a89/main_1.png main_1.png png 54335 849 656 IMAGE-WEB-PDF 1 1-s2.0-S1381116900000704-si9.gif https://s3.amazonaws.com/prod-ucs-content-store-us-east/content/pii:S1381116900000704/STRIPIN/image/gif/6cb3ccd6e41e639ff88cfa6cc1dc3df5/si9.gif https://s3-eu-west-1.amazonaws.com/prod-ucs-content-store-eu-west/content/pii:S1381116900000704/STRIPIN/image/gif/6cb3ccd6e41e639ff88cfa6cc1dc3df5/si9.gif si9 si9.gif gif 849 18 195 ALTIMG 1-s2.0-S1381116900000704-si8.gif https://s3.amazonaws.com/prod-ucs-content-store-us-east/content/pii:S1381116900000704/STRIPIN/image/gif/e3ae80a95e50df706e430a8267f829ae/si8.gif https://s3-eu-west-1.amazonaws.com/prod-ucs-content-store-eu-west/content/pii:S1381116900000704/STRIPIN/image/gif/e3ae80a95e50df706e430a8267f829ae/si8.gif si8 si8.gif gif 878 18 215 ALTIMG 1-s2.0-S1381116900000704-si7.gif https://s3.amazonaws.com/prod-ucs-content-store-us-east/content/pii:S1381116900000704/STRIPIN/image/gif/32c605627286053fc5b53b8b1159476d/si4.gif https://s3-eu-west-1.amazonaws.com/prod-ucs-content-store-eu-west/content/pii:S1381116900000704/STRIPIN/image/gif/32c605627286053fc5b53b8b1159476d/si4.gif si7 si7.gif gif 959 18 218 ALTIMG 1-s2.0-S1381116900000704-si6.gif https://s3.amazonaws.com/prod-ucs-content-store-us-east/content/pii:S1381116900000704/STRIPIN/image/gif/66b7fc916a670770fb0db4e36926751f/si6.gif https://s3-eu-west-1.amazonaws.com/prod-ucs-content-store-eu-west/content/pii:S1381116900000704/STRIPIN/image/gif/66b7fc916a670770fb0db4e36926751f/si6.gif si6 si6.gif gif 858 18 203 ALTIMG 1-s2.0-S1381116900000704-si5.gif https://s3.amazonaws.com/prod-ucs-content-store-us-east/content/pii:S1381116900000704/STRIPIN/image/gif/3930d49ddc60401b84381dea63213008/si5.gif https://s3-eu-west-1.amazonaws.com/prod-ucs-content-store-eu-west/content/pii:S1381116900000704/STRIPIN/image/gif/3930d49ddc60401b84381dea63213008/si5.gif si5 si5.gif gif 879 18 204 ALTIMG 1-s2.0-S1381116900000704-si4.gif https://s3.amazonaws.com/prod-ucs-content-store-us-east/content/pii:S1381116900000704/STRIPIN/image/gif/32c605627286053fc5b53b8b1159476d/si4.gif https://s3-eu-west-1.amazonaws.com/prod-ucs-content-store-eu-west/content/pii:S1381116900000704/STRIPIN/image/gif/32c605627286053fc5b53b8b1159476d/si4.gif si4 si4.gif gif 959 18 218 ALTIMG 1-s2.0-S1381116900000704-si3.gif https://s3.amazonaws.com/prod-ucs-content-store-us-east/content/pii:S1381116900000704/STRIPIN/image/gif/d8acc1dba33c9b40e70981ffbf3a4662/si3.gif https://s3-eu-west-1.amazonaws.com/prod-ucs-content-store-eu-west/content/pii:S1381116900000704/STRIPIN/image/gif/d8acc1dba33c9b40e70981ffbf3a4662/si3.gif si3 si3.gif gif 657 18 144 ALTIMG 1-s2.0-S1381116900000704-si27.gif https://s3.amazonaws.com/prod-ucs-content-store-us-east/content/pii:S1381116900000704/STRIPIN/image/gif/b81a88767e8a4d7cd0adeac9f700a5ca/si27.gif https://s3-eu-west-1.amazonaws.com/prod-ucs-content-store-eu-west/content/pii:S1381116900000704/STRIPIN/image/gif/b81a88767e8a4d7cd0adeac9f700a5ca/si27.gif si27 si27.gif gif 1062 18 253 ALTIMG 1-s2.0-S1381116900000704-si26.gif https://s3.amazonaws.com/prod-ucs-content-store-us-east/content/pii:S1381116900000704/STRIPIN/image/gif/53a91d5e35ff581a215cc0e245f8765f/si26.gif https://s3-eu-west-1.amazonaws.com/prod-ucs-content-store-eu-west/content/pii:S1381116900000704/STRIPIN/image/gif/53a91d5e35ff581a215cc0e245f8765f/si26.gif si26 si26.gif gif 915 19 238 ALTIMG 1-s2.0-S1381116900000704-si25.gif https://s3.amazonaws.com/prod-ucs-content-store-us-east/content/pii:S1381116900000704/STRIPIN/image/gif/7b9a6db320b0ec74043beaa8d2be02ff/si25.gif https://s3-eu-west-1.amazonaws.com/prod-ucs-content-store-eu-west/content/pii:S1381116900000704/STRIPIN/image/gif/7b9a6db320b0ec74043beaa8d2be02ff/si25.gif si25 si25.gif gif 870 18 193 ALTIMG 1-s2.0-S1381116900000704-si24.gif https://s3.amazonaws.com/prod-ucs-content-store-us-east/content/pii:S1381116900000704/STRIPIN/image/gif/0f9ea2af756e605b218cd7cf8fe62cc8/si24.gif https://s3-eu-west-1.amazonaws.com/prod-ucs-content-store-eu-west/content/pii:S1381116900000704/STRIPIN/image/gif/0f9ea2af756e605b218cd7cf8fe62cc8/si24.gif si24 si24.gif gif 1163 18 278 ALTIMG 1-s2.0-S1381116900000704-si23.gif https://s3.amazonaws.com/prod-ucs-content-store-us-east/content/pii:S1381116900000704/STRIPIN/image/gif/fb9b0b91b358f64aef548077333fa182/si23.gif https://s3-eu-west-1.amazonaws.com/prod-ucs-content-store-eu-west/content/pii:S1381116900000704/STRIPIN/image/gif/fb9b0b91b358f64aef548077333fa182/si23.gif si23 si23.gif gif 1151 18 264 ALTIMG 1-s2.0-S1381116900000704-si22.gif https://s3.amazonaws.com/prod-ucs-content-store-us-east/content/pii:S1381116900000704/STRIPIN/image/gif/6763aa85f16d747ebbdee9348a219f53/si22.gif https://s3-eu-west-1.amazonaws.com/prod-ucs-content-store-eu-west/content/pii:S1381116900000704/STRIPIN/image/gif/6763aa85f16d747ebbdee9348a219f53/si22.gif si22 si22.gif gif 1156 18 291 ALTIMG 1-s2.0-S1381116900000704-si21.gif https://s3.amazonaws.com/prod-ucs-content-store-us-east/content/pii:S1381116900000704/STRIPIN/image/gif/f9af62b2c5dcab7144879d9dfad76d23/si21.gif https://s3-eu-west-1.amazonaws.com/prod-ucs-content-store-eu-west/content/pii:S1381116900000704/STRIPIN/image/gif/f9af62b2c5dcab7144879d9dfad76d23/si21.gif si21 si21.gif gif 1063 18 252 ALTIMG 1-s2.0-S1381116900000704-si20.gif https://s3.amazonaws.com/prod-ucs-content-store-us-east/content/pii:S1381116900000704/STRIPIN/image/gif/ee339667955b49ca909788c0f22f8a44/si20.gif https://s3-eu-west-1.amazonaws.com/prod-ucs-content-store-eu-west/content/pii:S1381116900000704/STRIPIN/image/gif/ee339667955b49ca909788c0f22f8a44/si20.gif si20 si20.gif gif 975 18 230 ALTIMG 1-s2.0-S1381116900000704-si2.gif https://s3.amazonaws.com/prod-ucs-content-store-us-east/content/pii:S1381116900000704/STRIPIN/image/gif/890da752d386e8b96c7769ef671b1a20/si2.gif https://s3-eu-west-1.amazonaws.com/prod-ucs-content-store-eu-west/content/pii:S1381116900000704/STRIPIN/image/gif/890da752d386e8b96c7769ef671b1a20/si2.gif si2 si2.gif gif 556 38 79 ALTIMG 1-s2.0-S1381116900000704-si19.gif https://s3.amazonaws.com/prod-ucs-content-store-us-east/content/pii:S1381116900000704/STRIPIN/image/gif/212beba184221483accd79649af0ae36/si19.gif https://s3-eu-west-1.amazonaws.com/prod-ucs-content-store-eu-west/content/pii:S1381116900000704/STRIPIN/image/gif/212beba184221483accd79649af0ae36/si19.gif si19 si19.gif gif 1066 18 250 ALTIMG 1-s2.0-S1381116900000704-si18.gif https://s3.amazonaws.com/prod-ucs-content-store-us-east/content/pii:S1381116900000704/STRIPIN/image/gif/e47deeec52afe975d760aa165e29440d/si18.gif https://s3-eu-west-1.amazonaws.com/prod-ucs-content-store-eu-west/content/pii:S1381116900000704/STRIPIN/image/gif/e47deeec52afe975d760aa165e29440d/si18.gif si18 si18.gif gif 1082 18 244 ALTIMG 1-s2.0-S1381116900000704-si17.gif https://s3.amazonaws.com/prod-ucs-content-store-us-east/content/pii:S1381116900000704/STRIPIN/image/gif/2c92c57db75c117120fc1fd56fbda91b/si17.gif https://s3-eu-west-1.amazonaws.com/prod-ucs-content-store-eu-west/content/pii:S1381116900000704/STRIPIN/image/gif/2c92c57db75c117120fc1fd56fbda91b/si17.gif si17 si17.gif gif 1388 18 343 ALTIMG 1-s2.0-S1381116900000704-si16.gif https://s3.amazonaws.com/prod-ucs-content-store-us-east/content/pii:S1381116900000704/STRIPIN/image/gif/01c57a932f2b97856bb2696d41a96034/si16.gif https://s3-eu-west-1.amazonaws.com/prod-ucs-content-store-eu-west/content/pii:S1381116900000704/STRIPIN/image/gif/01c57a932f2b97856bb2696d41a96034/si16.gif si16 si16.gif gif 1119 18 272 ALTIMG 1-s2.0-S1381116900000704-si15.gif https://s3.amazonaws.com/prod-ucs-content-store-us-east/content/pii:S1381116900000704/STRIPIN/image/gif/40b130b3e4e25c81453e8c11bb56198a/si15.gif https://s3-eu-west-1.amazonaws.com/prod-ucs-content-store-eu-west/content/pii:S1381116900000704/STRIPIN/image/gif/40b130b3e4e25c81453e8c11bb56198a/si15.gif si15 si15.gif gif 1240 18 287 ALTIMG 1-s2.0-S1381116900000704-si14.gif https://s3.amazonaws.com/prod-ucs-content-store-us-east/content/pii:S1381116900000704/STRIPIN/image/gif/2e42cc63249e9370ab65f9a4110bcb2e/si14.gif https://s3-eu-west-1.amazonaws.com/prod-ucs-content-store-eu-west/content/pii:S1381116900000704/STRIPIN/image/gif/2e42cc63249e9370ab65f9a4110bcb2e/si14.gif si14 si14.gif gif 1028 18 258 ALTIMG 1-s2.0-S1381116900000704-si13.gif https://s3.amazonaws.com/prod-ucs-content-store-us-east/content/pii:S1381116900000704/STRIPIN/image/gif/639a69b39cf9bdafa4bc124c9542af0b/si13.gif https://s3-eu-west-1.amazonaws.com/prod-ucs-content-store-eu-west/content/pii:S1381116900000704/STRIPIN/image/gif/639a69b39cf9bdafa4bc124c9542af0b/si13.gif si13 si13.gif gif 1108 17 313 ALTIMG 1-s2.0-S1381116900000704-si12.gif https://s3.amazonaws.com/prod-ucs-content-store-us-east/content/pii:S1381116900000704/STRIPIN/image/gif/2f728f7cf58a8af02ac9c79923497949/si12.gif https://s3-eu-west-1.amazonaws.com/prod-ucs-content-store-eu-west/content/pii:S1381116900000704/STRIPIN/image/gif/2f728f7cf58a8af02ac9c79923497949/si12.gif si12 si12.gif gif 862 18 178 ALTIMG 1-s2.0-S1381116900000704-si11.gif https://s3.amazonaws.com/prod-ucs-content-store-us-east/content/pii:S1381116900000704/STRIPIN/image/gif/11adcbbeded368ffca168642484ffeef/si11.gif https://s3-eu-west-1.amazonaws.com/prod-ucs-content-store-eu-west/content/pii:S1381116900000704/STRIPIN/image/gif/11adcbbeded368ffca168642484ffeef/si11.gif si11 si11.gif gif 1070 18 265 ALTIMG 1-s2.0-S1381116900000704-si10.gif https://s3.amazonaws.com/prod-ucs-content-store-us-east/content/pii:S1381116900000704/STRIPIN/image/gif/276bfc056152cd8202b40299c224f72d/si10.gif https://s3-eu-west-1.amazonaws.com/prod-ucs-content-store-eu-west/content/pii:S1381116900000704/STRIPIN/image/gif/276bfc056152cd8202b40299c224f72d/si10.gif si10 si10.gif gif 766 18 170 ALTIMG 1-s2.0-S1381116900000704-si1.gif https://s3.amazonaws.com/prod-ucs-content-store-us-east/content/pii:S1381116900000704/STRIPIN/image/gif/ea8c73312fe4c5fb827172ece42061b2/si1.gif https://s3-eu-west-1.amazonaws.com/prod-ucs-content-store-eu-west/content/pii:S1381116900000704/STRIPIN/image/gif/ea8c73312fe4c5fb827172ece42061b2/si1.gif si1 si1.gif gif 672 18 127 ALTIMG 1-s2.0-S1381116900000704-gr1.gif https://s3.amazonaws.com/prod-ucs-content-store-us-east/content/pii:S1381116900000704/gr1/DOWNSAMPLED/image/gif/a58c20e4cbca1b899d6286816b19eb5d/gr1.gif https://s3-eu-west-1.amazonaws.com/prod-ucs-content-store-eu-west/content/pii:S1381116900000704/gr1/DOWNSAMPLED/image/gif/a58c20e4cbca1b899d6286816b19eb5d/gr1.gif gr1 gr1.gif gif 8129 279 273 IMAGE-DOWNSAMPLED 1-s2.0-S1381116900000704-gr1.sml https://s3.amazonaws.com/prod-ucs-content-store-us-east/content/pii:S1381116900000704/gr1/THUMBNAIL/image/gif/490d68401a512480b59ca4326aebf7fe/gr1.sml https://s3-eu-west-1.amazonaws.com/prod-ucs-content-store-eu-west/content/pii:S1381116900000704/gr1/THUMBNAIL/image/gif/490d68401a512480b59ca4326aebf7fe/gr1.sml gr1 gr1.sml sml 3431 163 160 IMAGE-THUMBNAIL 1-s2.0-S1381116900000704-gr1_lrg.gif https://s3.amazonaws.com/prod-ucs-content-store-us-east/content/pii:S1381116900000704/gr1/HIGHRES/image/gif/1e64f23ece6e2ca3585c4cda1d761b76/gr1_lrg.gif https://s3-eu-west-1.amazonaws.com/prod-ucs-content-store-eu-west/content/pii:S1381116900000704/gr1/HIGHRES/image/gif/1e64f23ece6e2ca3585c4cda1d761b76/gr1_lrg.gif gr1 gr1_lrg.gif gif 105679 2959 2899 IMAGE-HIGH-RES 1-s2.0-S1381116900000704-gr2.gif https://s3.amazonaws.com/prod-ucs-content-store-us-east/content/pii:S1381116900000704/gr2/DOWNSAMPLED/image/gif/7642e2d30ea239ddfd13e79377c00ccc/gr2.gif https://s3-eu-west-1.amazonaws.com/prod-ucs-content-store-eu-west/content/pii:S1381116900000704/gr2/DOWNSAMPLED/image/gif/7642e2d30ea239ddfd13e79377c00ccc/gr2.gif gr2 gr2.gif gif 6051 260 255 IMAGE-DOWNSAMPLED 1-s2.0-S1381116900000704-gr2.sml https://s3.amazonaws.com/prod-ucs-content-store-us-east/content/pii:S1381116900000704/gr2/THUMBNAIL/image/gif/dfae3753b6c90da554237499e145d569/gr2.sml https://s3-eu-west-1.amazonaws.com/prod-ucs-content-store-eu-west/content/pii:S1381116900000704/gr2/THUMBNAIL/image/gif/dfae3753b6c90da554237499e145d569/gr2.sml gr2 gr2.sml sml 2915 164 161 IMAGE-THUMBNAIL 1-s2.0-S1381116900000704-gr2_lrg.gif https://s3.amazonaws.com/prod-ucs-content-store-us-east/content/pii:S1381116900000704/gr2/HIGHRES/image/gif/daa46d66ac9d0d0be98a24847b81d217/gr2_lrg.gif https://s3-eu-west-1.amazonaws.com/prod-ucs-content-store-eu-west/content/pii:S1381116900000704/gr2/HIGHRES/image/gif/daa46d66ac9d0d0be98a24847b81d217/gr2_lrg.gif gr2 gr2_lrg.gif gif 73901 2755 2707 IMAGE-HIGH-RES 1-s2.0-S1381116900000704-gr3.gif https://s3.amazonaws.com/prod-ucs-content-store-us-east/content/pii:S1381116900000704/gr3/DOWNSAMPLED/image/gif/49f117e6a2fa45d0e7ec81dd6f8b9040/gr3.gif https://s3-eu-west-1.amazonaws.com/prod-ucs-content-store-eu-west/content/pii:S1381116900000704/gr3/DOWNSAMPLED/image/gif/49f117e6a2fa45d0e7ec81dd6f8b9040/gr3.gif gr3 gr3.gif gif 10274 322 292 IMAGE-DOWNSAMPLED 1-s2.0-S1381116900000704-gr3.sml https://s3.amazonaws.com/prod-ucs-content-store-us-east/content/pii:S1381116900000704/gr3/THUMBNAIL/image/gif/59e6f7f6dd98e79042214a3215f5862b/gr3.sml https://s3-eu-west-1.amazonaws.com/prod-ucs-content-store-eu-west/content/pii:S1381116900000704/gr3/THUMBNAIL/image/gif/59e6f7f6dd98e79042214a3215f5862b/gr3.sml gr3 gr3.sml sml 3809 163 148 IMAGE-THUMBNAIL 1-s2.0-S1381116900000704-gr3_lrg.gif https://s3.amazonaws.com/prod-ucs-content-store-us-east/content/pii:S1381116900000704/gr3/HIGHRES/image/gif/30bb19faa0e13d14a33283826e5ec2b1/gr3_lrg.gif https://s3-eu-west-1.amazonaws.com/prod-ucs-content-store-eu-west/content/pii:S1381116900000704/gr3/HIGHRES/image/gif/30bb19faa0e13d14a33283826e5ec2b1/gr3_lrg.gif gr3 gr3_lrg.gif gif 109076 3424 3102 IMAGE-HIGH-RES 1-s2.0-S1381116900000704-gr4.gif https://s3.amazonaws.com/prod-ucs-content-store-us-east/content/pii:S1381116900000704/gr4/DOWNSAMPLED/image/gif/35c98b6fc5818edafcb59f813c1309ea/gr4.gif https://s3-eu-west-1.amazonaws.com/prod-ucs-content-store-eu-west/content/pii:S1381116900000704/gr4/DOWNSAMPLED/image/gif/35c98b6fc5818edafcb59f813c1309ea/gr4.gif gr4 gr4.gif gif 7484 216 308 IMAGE-DOWNSAMPLED 1-s2.0-S1381116900000704-gr4.sml https://s3.amazonaws.com/prod-ucs-content-store-us-east/content/pii:S1381116900000704/gr4/THUMBNAIL/image/gif/c672aafca9c467b127ea16ae7a9ecff9/gr4.sml https://s3-eu-west-1.amazonaws.com/prod-ucs-content-store-eu-west/content/pii:S1381116900000704/gr4/THUMBNAIL/image/gif/c672aafca9c467b127ea16ae7a9ecff9/gr4.sml gr4 gr4.sml sml 4762 153 219 IMAGE-THUMBNAIL 1-s2.0-S1381116900000704-gr4_lrg.gif https://s3.amazonaws.com/prod-ucs-content-store-us-east/content/pii:S1381116900000704/gr4/HIGHRES/image/gif/7b3c082837b649d48ead2de0a350cc07/gr4_lrg.gif https://s3-eu-west-1.amazonaws.com/prod-ucs-content-store-eu-west/content/pii:S1381116900000704/gr4/HIGHRES/image/gif/7b3c082837b649d48ead2de0a350cc07/gr4_lrg.gif gr4 gr4_lrg.gif gif 71696 2286 3266 IMAGE-HIGH-RES 1-s2.0-S1381116900000704-gr5.gif https://s3.amazonaws.com/prod-ucs-content-store-us-east/content/pii:S1381116900000704/gr5/DOWNSAMPLED/image/gif/4944770c98e7d21c833074749c33f02c/gr5.gif https://s3-eu-west-1.amazonaws.com/prod-ucs-content-store-eu-west/content/pii:S1381116900000704/gr5/DOWNSAMPLED/image/gif/4944770c98e7d21c833074749c33f02c/gr5.gif gr5 gr5.gif gif 22392 406 643 IMAGE-DOWNSAMPLED 1-s2.0-S1381116900000704-gr5.sml https://s3.amazonaws.com/prod-ucs-content-store-us-east/content/pii:S1381116900000704/gr5/THUMBNAIL/image/gif/79f86934a3366b03e5c1aacc0f672ad9/gr5.sml https://s3-eu-west-1.amazonaws.com/prod-ucs-content-store-eu-west/content/pii:S1381116900000704/gr5/THUMBNAIL/image/gif/79f86934a3366b03e5c1aacc0f672ad9/gr5.sml gr5 gr5.sml sml 4677 138 219 IMAGE-THUMBNAIL 1-s2.0-S1381116900000704-gr5_lrg.gif https://s3.amazonaws.com/prod-ucs-content-store-us-east/content/pii:S1381116900000704/gr5/HIGHRES/image/gif/24d117e623c40f65d2953532119d5f31/gr5_lrg.gif https://s3-eu-west-1.amazonaws.com/prod-ucs-content-store-eu-west/content/pii:S1381116900000704/gr5/HIGHRES/image/gif/24d117e623c40f65d2953532119d5f31/gr5_lrg.gif gr5 gr5_lrg.gif gif 234519 4303 6823 IMAGE-HIGH-RES 1-s2.0-S1381116900000704-gr6.gif https://s3.amazonaws.com/prod-ucs-content-store-us-east/content/pii:S1381116900000704/gr6/DOWNSAMPLED/image/gif/9194bc764065502bb8c5c7eebf3ca090/gr6.gif https://s3-eu-west-1.amazonaws.com/prod-ucs-content-store-eu-west/content/pii:S1381116900000704/gr6/DOWNSAMPLED/image/gif/9194bc764065502bb8c5c7eebf3ca090/gr6.gif gr6 gr6.gif gif 16623 430 316 IMAGE-DOWNSAMPLED 1-s2.0-S1381116900000704-gr6.sml https://s3.amazonaws.com/prod-ucs-content-store-us-east/content/pii:S1381116900000704/gr6/THUMBNAIL/image/gif/0d0012767358c93ca6b19182300bcb3a/gr6.sml https://s3-eu-west-1.amazonaws.com/prod-ucs-content-store-eu-west/content/pii:S1381116900000704/gr6/THUMBNAIL/image/gif/0d0012767358c93ca6b19182300bcb3a/gr6.sml gr6 gr6.sml sml 3887 163 120 IMAGE-THUMBNAIL 1-s2.0-S1381116900000704-gr6_lrg.gif https://s3.amazonaws.com/prod-ucs-content-store-us-east/content/pii:S1381116900000704/gr6/HIGHRES/image/gif/1869b1b5a46167f009e6e55fe131fde0/gr6_lrg.gif https://s3-eu-west-1.amazonaws.com/prod-ucs-content-store-eu-west/content/pii:S1381116900000704/gr6/HIGHRES/image/gif/1869b1b5a46167f009e6e55fe131fde0/gr6_lrg.gif gr6 gr6_lrg.gif gif 176101 4561 3353 IMAGE-HIGH-RES 1-s2.0-S1381116900000704-gr7.gif https://s3.amazonaws.com/prod-ucs-content-store-us-east/content/pii:S1381116900000704/gr7/DOWNSAMPLED/image/gif/89457d783c5cde6d0fe6959f9d97ab27/gr7.gif https://s3-eu-west-1.amazonaws.com/prod-ucs-content-store-eu-west/content/pii:S1381116900000704/gr7/DOWNSAMPLED/image/gif/89457d783c5cde6d0fe6959f9d97ab27/gr7.gif gr7 gr7.gif gif 10519 237 326 IMAGE-DOWNSAMPLED 1-s2.0-S1381116900000704-gr7.sml https://s3.amazonaws.com/prod-ucs-content-store-us-east/content/pii:S1381116900000704/gr7/THUMBNAIL/image/gif/f6221458310959c22b8f9ebc0e8949f2/gr7.sml https://s3-eu-west-1.amazonaws.com/prod-ucs-content-store-eu-west/content/pii:S1381116900000704/gr7/THUMBNAIL/image/gif/f6221458310959c22b8f9ebc0e8949f2/gr7.sml gr7 gr7.sml sml 5810 160 219 IMAGE-THUMBNAIL 1-s2.0-S1381116900000704-gr7_lrg.gif https://s3.amazonaws.com/prod-ucs-content-store-us-east/content/pii:S1381116900000704/gr7/HIGHRES/image/gif/2cced258e596fef3ba66359f5feaf4bb/gr7_lrg.gif https://s3-eu-west-1.amazonaws.com/prod-ucs-content-store-eu-west/content/pii:S1381116900000704/gr7/HIGHRES/image/gif/2cced258e596fef3ba66359f5feaf4bb/gr7_lrg.gif gr7 gr7_lrg.gif gif 113941 2522 3462 IMAGE-HIGH-RES 1-s2.0-S1381116900000704-gr8.gif https://s3.amazonaws.com/prod-ucs-content-store-us-east/content/pii:S1381116900000704/gr8/DOWNSAMPLED/image/gif/a8773b3ec1597aff900d3f8de8c484c7/gr8.gif https://s3-eu-west-1.amazonaws.com/prod-ucs-content-store-eu-west/content/pii:S1381116900000704/gr8/DOWNSAMPLED/image/gif/a8773b3ec1597aff900d3f8de8c484c7/gr8.gif gr8 gr8.gif gif 12629 457 327 IMAGE-DOWNSAMPLED 1-s2.0-S1381116900000704-gr8.sml https://s3.amazonaws.com/prod-ucs-content-store-us-east/content/pii:S1381116900000704/gr8/THUMBNAIL/image/gif/130bf8404a389479dd52aa2060eb1bd7/gr8.sml https://s3-eu-west-1.amazonaws.com/prod-ucs-content-store-eu-west/content/pii:S1381116900000704/gr8/THUMBNAIL/image/gif/130bf8404a389479dd52aa2060eb1bd7/gr8.sml gr8 gr8.sml sml 2728 163 117 IMAGE-THUMBNAIL 1-s2.0-S1381116900000704-gr8_lrg.gif https://s3.amazonaws.com/prod-ucs-content-store-us-east/content/pii:S1381116900000704/gr8/HIGHRES/image/gif/34345beb30df24dd22ba75f372ddb69d/gr8_lrg.gif https://s3-eu-west-1.amazonaws.com/prod-ucs-content-store-eu-west/content/pii:S1381116900000704/gr8/HIGHRES/image/gif/34345beb30df24dd22ba75f372ddb69d/gr8_lrg.gif gr8 gr8_lrg.gif gif 137017 4849 3473 IMAGE-HIGH-RES MOLCAA 2599 S1381-1169(00)00070-4 10.1016/S1381-1169(00)00070-4 Elsevier Science B.V. Fig. 1 Activities of Pd/Al2O3, Cu/Al2O3 and Pd–Cu/Al2O3 catalysts (mean grain size 15 μm) in reduction of nitrate ions. Reaction conditions: temperature 298 K, P H2 =1 bar, C NO3 − =200 mg/l, pH=6.0. Fig. 2 Activities of Pd/Al2O3, Cu/Al2O3 and Pd–Cu/Al2O3 catalysts (mean grain size 15 μm) in reduction of nitrite ions. Reaction conditions: temperature 298 K, P H2 =1 bar, C NO2 − =50 mg/l, pH=6.0. Fig. 3 XRD patterns of the catalytic membrane: diffractogram of the ceramic membrane support; diffractogram of the catalytic membrane with Pd–Cu active component; differential pattern. Fig. 4 Relative intensities of the ionic currents 106Pd+/63Cu+ vs. depth of argon etching. Fig. 5 Series of desorption spectra after exposure of the Pd surface to H2 at 100 K (a) and 300 K (b). Fig. 6 Series of desorption spectra of NO, N2, N2O and O2 after exposure of the Pd surface to NO at 300 K. Fig. 7 Series of desorption spectra of NO, N2, N2O at P H2 =10−7 Torr after exposure of the Pd surface with NO pre-adsorbed at 300 K to the reaction with H2. Fig. 8 Desorption spectra of N2 from atomic nitrogen species formed on the Pd surface by (from bottom to top): (i) N2 plasma discharge; (ii) NO dissociative adsorption; (iii) NH3+NOads reaction at P NH3 =2×10−7 Torr, with NO exposure 2 L at 300 K; NH3+Oads reaction at P NH3 =1×10−8 Torr, with O2 exposure 2 L at 300 K; H2+NOads reaction at P H2 =1×10−7 Torr, with NO exposure 2.5 L at 300 K. Table 1 Selectivities of Pd/Al2O3 and Pd–Cu/Al2O3 catalysts (mean grain size 15 μm) in reduction of nitrate ions at various NO3 − conversions Reaction conditions: temperature 298 K, P H2 =1 bar, C NO3 − =200 mg/l, pH=6.0 Atomic ratio of metals in catalyst X NO3 − =25% X NO3 − =50% X NO3 − =75% X NO3 − =90% X NO3 − =95% S NO2 − (%) S NH4 − (%) S NO2 − (%) S NH4 − (%) S NO2 − (%) S NH4 − (%) S NO2 − (%) S NH4 − (%) S NO2 − (%) S NH4 − (%) Pd 0 29.0 0 66.0 0 68.0 0 81.0 0 87.0 Pd:Cu=1:0.33 23.2 11.6 12.5 21.0 5.2 25.0 1.6 31.8 0.9 32.3 Pd:Cu=1:0.8 22.3 8.6 18.2 10.3 14.0 19.5 7.1 23.9 5.0 24.8 Pd:Cu=1:2.25 38.0 10.3 43.2 13.4 31.0 17.0 22.9 21.8 17.8 24.3 Catalytic reduction of nitrate and nitrite ions by hydrogen: investigation of the reaction mechanism over Pd and Pd–Cu catalysts O.M Ilinitch a L.V Nosova a V.V Gorodetskii a V.P Ivanov a S.N Trukhan a E.N Gribov a S.V Bogdanov a F.P Cuperus b * a Boreskov Institute of Catalysis, Novosibirsk 630090, Russia b Stratingh Institute of Chemistry and Chemical Engineering, NL-9747 AG Groningen, Netherlands * Corresponding author The catalytic behavior of mono- and bimetallic catalysts with Pd and/or Cu supported over γ-Al2O3 in the reduction of aqueous nitrate and nitrite ions by hydrogen was investigated. The composition of the supported metal catalysts was analysed using secondary ion mass spectroscopy (SIMS) and X-ray diffraction (XRD) techniques. Surface enrichment of the bimetallic Pd–Cu particles in copper was revealed. Interactions of NO (possible intermediate in reduction of nitrate and nitrite ions) with H2 over Pd were studied by thermal desorption spectroscopy (TDS) under high-vacuum conditions. The molecular mechanism of NO3 − and NO2 − reduction by H2 as well as the role of Pd and Cu active sites are discussed. Keywords Catalytic reduction Metal catalyst Pd Pd–Cu 1 Introduction The catalytic reduction of nitrate and nitrite ions in water by hydrogen is being studied by several research groups as a potential means of purification for waters contaminated with the soluble salts of these ions. The substances, harmful at concentrations above 50 mg/l, are increasingly produced by agricultural and industrial activities in different regions of the world. The conversion of nitrate and nitrite ions into nitrogen achieved via catalytic reduction by hydrogen at ambient temperatures makes this reaction one of the most suitable ways for the production of drinking water in areas where the concentration of nitrates and/or nitrites exceeds the admissible limits. The results available in literature point out two main problems that need to be solved for the reactions to be successfully implemented on a large scale, viz. high intrinsic activity and selectivity of the catalyst, and diffusion limitations of the catalytic performance. Supported palladium and bimetallic palladium–copper catalysts proposed for these reactions by the German researchers [1,2] in addition to N2 yield ammonium, which concentration in drinking water should be kept at low level. The solution to the second of the abovementioned problems, that of the internal diffusion hindrance, is traditionally sought by using the fine catalyst powder in a slurry reactor. This paper continues our work on the reduction of nitrates and nitrites by hydrogen in a catalytic membrane reactor, where the latter is applied to facilitate the intraporous mass transfer. In the present study the mechanism of nitrate and nitrite ions reduction over Pd-containing catalysts was investigated in an attempt to improve an intrinsic activity and selectivity of the catalytically active component 2 Experimental 2.1 Preparation of catalysts and catalytic membranes The series of catalysts including γ-Al2O3-supported mono- (Pd and Cu) and bimetallic Pd–Cu samples was prepared via (co)impregnation of the support with aqueous solutions of copper nitrate and palladium hydrochloric acid, followed by drying, oxidation and reduction of the impregnated material in an aqueous solution of sodium borohydride (NaBH4) at room temperature. A detailed description of the preparation procedure can be found elsewhere [3]. The metal content was 4.1 wt.% for Pd/Al2O3 catalyst and 1.7 wt.% for Cu/Al2O3, while the bimetallic Pd–Cu/Al2O3 catalysts had the fixed palladium loading (ca. 5 wt.%) and a variable copper content (from ca. 1 up to 7 wt.%). The samples of catalytic membrane were prepared via the same procedure. The ceramic membrane developed at Boreskov Institute was employed at this stage as the catalyst support of a specific type. According to the atomic absorption spectroscopy analysis, the catalytic membrane contained 1.6 wt.% of palladium and 1.2 wt.% of copper. 2.2 Characterization techniques 2.2.1 Analysis of the reaction and catalysts Concentrations of NO3 − and NO2 − anions in catalytic experiments were monitored using a liquid ion chromatograph “Tsvet-3006” (Russia) with an electroconductivity detector. NH4 + cations were analyzed with an ion-selective electrode ELIT-51 (Russia) having 0.6–1400 mg/l linear concentration range. Dispersion and composition of metal particles in the catalysts and membrane were studied by X-ray diffraction (XRD) with an HZG-4C instrument (Freiberger Präzisionmechanik) in CuKα radiation. Metal loadings of the catalysts and the catalytic membrane were determined by atomic absorption spectroscopy (AAS 1N instrument, Carl Zejss-Jena). Other details of the analytical techniques employed in the present study can be found in Ref. [3]. 2.2.2 Secondary ion mass spectroscopy (SIMS) The method is based on the bombardment of a catalyst sample by the beam of high energy Ar+ ions with a mass-spectral analysis of secondary ions etched out from the sample. The vacuum apparatus equipped with an MC-7201 mass spectrometer (Russia) having a monopol mass analyser sensitive in the range of mass numbers 1–250 was employed. Residual gas pressure in the spectrometer (H2O, CO and CO2) did not exceed 3×10−6 Pa. The diameter of the primary ion beam incident at an angle of 45° to the normal of the holder surface was 2 mm, resulting in the area of argon bombardment ca. 5 mm2. The control programs ensured the review analysis of the entire mass spectrum and measurements of ion currents for up to16 masses during the argon bombardment of a sample. Preparation of the catalyst samples for SIMS study included their rubbing into the high-purity indium (99.999%) wire mesh holder. Argon ions with energy of 4 keV and current density of 0.12 or 0.63 A/m2 were used for the bombardment of the samples. The thickness of the layer etched out by the Ar+ bombardment Z (Å) was determined as suggested in Ref. [4]: Z=0.06JS(A/ρ)t where J is the current density for the primary ions Ar+ (μA/cm2); S the etching coefficient (ca. 2 for the bombardment of Al2O3 by Ar+ ions of 4 keV energy [5,6]); A=20.4, the average atomic mass of the target; ρ=3.7 g/cm3, the density of the catalyst samples. In the calculations the etching rate of the metal particles in the catalyst samples was taken to be equal to that of the Al2O3 matrix, since the total amount of the metals in the samples was less than 10% [6]. 2.2.3 Thermal desorption spectroscopy (TDS) The experiments were performed in an all-glass ultrahigh vacuum apparatus of 1.5 l volume and base pressure not exceeding 10−10 Torr (1 Torr=133.3 Pa). Palladium wire (99.99% purity) of 0.25 mm diameter with a geometric surface of 1 cm2 has been used. The gas phase composition was controlled by the omegatrone mass-spectrometer IPDO-2A (Russia). Prior to the thermodesorption experiments, the wire was cleaned of the traces of carbon, sulfur and other contaminations by subsequent cycles of Ar+ etching, annealing in oxygen and high-temperature annealing in vacuum according to Ref. [7]. The clean palladium surface prepared according to the above procedure was characterized by TDS spectra of H2, O2, NO and H2O that reproduced in detail those reported in the literature [7–10]. TDS spectra were recorded at a constant heating rate of 5 K/s. In order to rule out any contribution of the residual CO (m/e=28 amu) to N2, 15NO which produces 15N2 (m/e=30 amu) was used in the TDS experiments. The technique employed in the present study allowed quantitative analysis of the TDS spectra for H2, O2, N2, N2O and NO, and qualitative analysis of those for NH3 and H2O. 3 Results 3.1 Catalytic reduction of NO3 − and NO2 − by H2 in water over γ-Al2O3-supported catalysts In the experiments performed for the series of γ-Al2O3-supported mono- (Pd or Cu) and bimetallic Pd–Cu catalysts (slurry reactor, mean particle size ca. 15 μm) at the conditions where the reaction performance was not affected by the reactants' diffusion [3], the highest catalytic activity in the reduction of an aqueous solution of 200 mg/l NaNO3 was found for the sample with the atomic ratio Pd:Cu=1:0.8 (Fig. 1) . Note that the activity of this catalyst (expressed with respect to the total content of both Pd and Cu in a given sample) is ca. sevenfold higher than that of the Pd/Al2O3 sample. If one assigns the catalytic activity exclusively to palladium, the difference in the activity values becomes even more significant. Selectivities of these catalysts at various NO3 − conversions towards side products — NO2 − and NH4 + ions — are listed in Table 1 . As can be seen, Pd–Cu/Al2O3 catalysts are significantly superior to Pd/Al2O3 with respect to much lower selectivity towards NH4 +. Within the group of Pd–Cu/Al2O3 catalysts the selectivities for ammonium are about the same, with perhaps a minor decrease upon decreasing Pd:Cu ratio (i.e., the catalyst Pd:Cu=1:0.33 shows slightly higher selectivity for NH4 + than the other Pd–Cu samples more rich in copper). On the contrary, selectivities for NO2 − rise with decreasing Pd:Cu ratio. The reduction of NO2 − by H2 addition of copper, however, does not have any beneficial influence on the catalytic activity of palladium. Moreover, as can be seen from the experimental data shown in Fig. 2 , the catalytic activity (with respect to the total content of both Pd and Cu in a given sample) of the Pd–Cu/Al2O3 sample with the atomic ratio Pd:Cu=1:0.8 (the most active in the reduction of NO3 −) is much lower than that of Pd/Al2O3. Note that the activity values of Pd/Al2O3 and Pd–Cu/Al2O3 samples calculated with respect to the content of palladium alone are about the same — 0.33 and 0.27 mol NO2 − mol Pd−1 min−1, respectively. 3.2 Structure of Pd–Cu/Al2O3 catalysts Investigation of the supported catalysts by SIMS and XRD techniques was carried out to unravel the role of the metals (Pd and Cu) in the mechanism of reduction of nitrate and nitrite ions by hydrogen. 3.2.1 XRD study The XRD data are indicative of a small size of the metal particles formed in the supported mono- and bimetallic catalysts. No peaks of palladium, copper or of their combinations (alloys) known to form in the Pd–Cu system [11–13] were detected in the XRD spectra of the reduced Pd/Al2O3, Cu/Al2O3 and Pd–Cu/Al2O3 catalysts. This is most likely due to the pronounced line broadening typical of the nanosized metal particles, along with the overlapping of the resulting halo and the peaks of the γ-Al2O3 support. Note that the TEM investigation of the similarly prepared Cu/Al2O3 catalyst showed that the size of Cu particles did not exceed 1 nm [14]. Formation of metal particles not exceeding 3–4 nm in size for the supported Pd–Cu catalysts prepared via various techniques have been reported in several publications [15,16]. For the catalytic membrane containing Pd–Cu active component over the membrane support made of the natural silica–alumina mineral, XRD analysis points out the formation of nanosized bimetallic particles. Comparative analysis of XRD spectra for the membrane support and the catalytic membrane (Fig. 3) shows that the latter contains a superposition of the broad peak with the maximum at 2θ≈41° characteristic of nanosized metal clusters and sharp peaks belonging to the membrane support. Due to the apparently small size of the metal particles and close values of interplanar distances responsible for the strongest XRD reflexes in the crystal lattices of Pd, Cu and Pd–Cu alloys, the phase composition of the metal particles cannot be accurately determined. However, it is worth mentioning that XRD patterns of the metallic particles in the catalytic membrane are similar to those reported for the silica-supported Pd–Cu catalysts in Ref. [16], where formation of palladium–copper alloys has been suggested. The Scherrer's approach based on the XRD line broadening [17] was used to calculate the mean size of the metal particles in the catalytic membrane: d= λ βcosθ where λ is the wavelength of the X-ray source employed, β the semiwidth of the XRD peak of the metal particles, and θ the Bragg's angle of the peak. At λ=0.154 nm (CuKα radiation), β=180 min and θ=20.5° as it appears from the differential XRD pattern, the value d=3.2 nm was obtained. Thus, on the basis of our results and those existing in the literature it can be assumed that the bimetallic Pd–Cu particles with the crystalline domains not exceeding ca. 3 nm are apparently formed on the surface of γ-Al2O3 and ceramic membrane supports. 3.2.2 SIMS investigation SIMS investigation has been performed for the series of Pd–Cu/Al2O3 catalysts to analyse the surface composition of the individual metal particles deposited onto the support, as well as the concentration profile of the active component in the porous grain of the catalyst. The results are briefly summarised in Fig. 4 . While interpreting the data one should bear in mind that the spatial resolution of SIMS technique depends on the depth of ion etching [18,19]. Under our experimental conditions the depth resolution changes from angstroms (for the initial stages of etching) to ca. 100 Å for the depth of etching of 1 μm. Therefore the dependencies of the ratios of ion currents (I) vs. depth of Ar+ etching (Z) represented in Fig. 4, reflecting the integral composition of the catalytically active component along the catalyst grain, at low Z show the surface composition of the individual metal particles deposited on the support. As one can see from Fig. 4, the topmost layer of the metal particles (catalytically active component) for the Pd–Cu/Al2O3 catalysts with the ratios Pd:Cu=1:0.33 and 1:0.8 is strongly enriched with Cu compared to the integral bulk composition, while for the sample with the highest content of copper (Pd:Cu=1:2.25) the composition of the metal particles apparently is more homogeneous. With the exception of the latter catalyst, the ratio Pd:Cu in the surface layer of porous grains of the catalysts is the lowest on the outside of a grain, gradually increasing to reach the steady level at the grain depth of ca. 0.03 μm (Pd:Cu=1:0.8) to 0.1 μm (Pd:Cu=1:0.33). 3.3 Interaction of H2 with NO over Pd: TDS study The communications on investigations of the molecular mechanism of NO3 − and/or NO2 − reduction by hydrogen are not known to the authors of this paper. The only exception is Ref. [20] where the hypothetical mechanism, based on the assumption that NO is the key intermediate in these reactions over noble metal catalysts [21], was suggested. Although the above assumption still needs to be proved, in the present study it was accepted as a starting point for our experimental investigations related to the mechanism of interactions between NO and H2 over palladium. This metal was chosen as an object since it is known to be the most active amongst noble metal catalysts for the latter reaction [22]; besides, high activity and selectivity were reported for the supported palladium catalysts in the reduction of aqueous nitrite ions [2,23]. It is well known that the catalytic reaction between NO and H2 can yield nitrogen, ammonia and nitrous oxide. Nature of the catalytic metal, reaction conditions (temperature and reactants pressures), adsorption state of NO (molecular or dissociative) dictate the particular pathway of the reaction. Thus, a partial dissociation of nitric oxide molecules on Ru at 300 K is responsible for the selective nitrogen release in the course of NO reduction by H2, whereas on palladium and platinum NH3 and N2O are additionally formed [24]. A key step in the NO+H2 reaction on Pd and Pt is the dissociative adsorption of NO [24]. At temperatures above 400 K, the adsorbed atoms of oxygen Oads generated due to NO dissociation over the metal surface react readily with the layer of atomic adsorbed hydrogen Hads to form water molecules which evolve immediately into the gas phase [8]. Recombination of Nads at 500–600 K on the surface free of other species gives rise to the evolution of molecular nitrogen. Interaction of Nads with NOads produces N2O molecules; reaction between Nads and Hads in an excess of hydrogen at 460 K yields ammonia [25]. At lower temperatures, though, the atomized nitrogen species adsorbed over the surfaces of noble metals are quite inert. Thus, high stability of the Nads layer at 300 K over Pd(110) single crystal has been found in the studies where Nads was prepared via electron beam generated atomization of pre-adsorbed molecular nitrogen [26]. Thus, the problem of the low-temperature NO+H2 conversion reduces primarily to a search for the optimum conditions of Nads atoms formation from NO and for a prerequisite of the Nads recombination into N2 at ca. 300 K. In the present work, TDS was employed to monitor the interaction of H2 and NO over Pd. 3.3.1 H2 adsorption Hydrogen adsorption has been studied in the temperature range of 100–300 K at pressures from 2×10−9 to 1×10−7 Torr. Desorption spectra recorded for palladium exposed to 0.6–120 L (1 L=10−6 Torr s) at 100 K (Fig. 5a) show two peaks corresponding to a high-temperature β-state of hydrogen (T des=350 K) and to a low-temperature α-state (T des=160 K). At the initial stage of adsorption and exposure of 1 L hydrogen is seen to fill the metal surface at the tightly bound β-state with the coverage degree close to 0.4. After exposures in the range of 60–120 L, the loosely bound α-state appears, and the saturation coverage of Hads equal to 1 monolayer (θ H=1 ML) is reached [27]. Using the calculation procedure from Ref. [28] with the pre-exponential factor of the desorption rate constant γ=1013 s−1, we obtain the activation energy values for hydrogen desorption: E des α kcal/mol, E des β kcal/mol, in good agreement with Ref. [27]. If hydrogen is adsorbed at 300 K, the desorption spectrum contains, in addition to the peak of the β-state, the high-temperature βab peak at T des=620 K that belongs to the atomic hydrogen absorbed into the bulk of palladium (Fig. 5b). Hydrogen adsorption over palladium at the conditions studied is dissociative. In our experiments this was confirmed by the total isotopic equilibration achieved in the adsorption layer that was prepared via the adsorption of a nonequilibrium H2/D2 mixture (50% H2, 50% D2) at 300 K. These results are in a good agreement with the previous studies [27,29]. 3.3.2 NO adsorption At room temperature NO adsorbs intact on Pd [24], but at higher temperatures its adsorption is expected to be accompanied by dissociation of the molecules. Evidences for the dissociative adsorption of NO are provided by our desorption experiments. Fig. 6 shows a series of desorption spectra of NO and the products of its decomposition (N2, N2O, O2) obtained on Pd surface exposed to 0.3–1 L at 300 K. Nitric oxide gives a peak at 580 K at initial exposures. As NO exposure increases up to 3 L, the NO desorption spectrum exhibits a new peak at 420 K. At NO exposure of 0.2 L, N2, desorption peaks of O2 and N2O appear at 700, 880 and 580 K, respectively, indicating a high dissociation probability for NOads at higher temperatures. The increase in exposure up to 1 L gives rise to a simultaneous increase in the intensity of NO, N2O and N2 desorptions that occur at the same temperature of 580 K, and of the O2 peak at 880 K as well. Disappearance of the N2 high-temperature peak at 700 K observed at exposures higher than 0.4 L is due to the population of the corresponding adsorption sites with oxygen adatoms. 3.3.3 Reaction H2+NOads Fig. 7 shows a series of TD spectra recorded for H2, NO and products of their reaction on Pd surface. Hydrogen is admitted into the apparatus at a pressure of P H2 =10−7 Torr following the previous NO adsorption on the clean palladium surface at 0.3–2.5 L and 300 K. Desorption of NO upon Pd heating reveals two peaks — at 420 and 580 K. Two intensive peaks of N2 at 580 and 680 K and two peaks of N2O at 420 and 580 K appear due to a promoting action of hydrogen Hads layer on the dissociation of NOads molecules (compare Figs. 6 and 7). A dashed curve in Fig. 7 corresponds to the hydrogen desorption at T des=480 K. No oxygen desorption was observed under these reaction conditions. Oxygen adatoms formed via NO dissociation are removed readily by H2, which is accompanied by the accumulation of the tightly bound nitrogen adatoms on the vacant sites of palladium surface (the corresponding peak of nitrogen appears at 680 K). The evolution of N2O in the gas phase observed in the presence of hydrogen indicates that the following reaction apparently occurs upon heating: NOads+Nads→N2Ogas. 3.3.4 Reactions NH3+NOads and NH3+Oads Fig. 8 displays a series of TDS spectra for the molecular nitrogen formed by NOads decomposition, recombination of nitrogen from the layer of nitrogen adatoms Nads (the latter was produced by plasma discharge as in Ref. [30] and thereafter adsorbed over Pd), as well as for N2 produced by the reactions H2+NOads, NH3+NOads and NH3+Oads. The reaction NH3+NOads is being considered here since NH3 molecules that are formed in the reaction H2+NOads [25] and that do not dissociate over Pd [24], can further interact from the gas phase with pre-adsorbed molecular nitric oxide NOads yielding nitrogen molecules. The latter can influence nitrogen coverage of the surface in the system H2+NO/Pd. Two intensive peaks of N2 with the maximums at ca. 600 and 740 K resulting from the reaction NH3+NOads are clearly seen in Fig. 8. The same N2 desorption peaks (at ca. 600 and 740 K) appear in the TD spectrum due to the reaction of ammonia with the atomic surface oxygen species. In turn, the latter emerge via the surface decomposition of nitric oxide: NO→Nads+Oads. The data shown in Fig. 8 evidence that at least three different nitrogen surface species Nads can be formed over Pd, distinguished by the thermodesorption maxima at 420, 580–600 and 680–740 K. It is likely that the concentration of Nads and the strength of the Pd–N bond are the key factors determining the activity and selectivity in the H2+NO reaction over palladium. Fig. 8 also shows that recombination of Nads species is a relatively slow process at ambient temperatures. Nitrogen atoms that accumulate over Pd at these conditions can block the catalytic surface thus limiting the activity of palladium in the reaction between H2 and NO. 4 Discussion 4.1 Reduction of NO3 − and NO2 − by H2 over Pd/Al2O3 and Pd–Cu/Al2O3 catalysts Our experimental results, in agreement with the literature data [2,21], show that the Pd/Al2O3 catalyst possesses relatively low activity with high yield of ammonium in the reduction of NO3 − by H2 in aqueous solutions. Addition of copper, by itself a poor catalyst in this reaction, gives rise to a multifold increase in the catalytic activity and considerable decrease in the yield of ammonium for Pd–Cu catalysts. It can be assumed that copper is likely to form part of the bimetallic Pd–Cu active component in this reaction. However, in the reduction of NO2 − copper behaves as a diluent for palladium, which in the latter case seems to be the only catalytically active metal. It can be hypothesized further that these changes result from an additional route in the mechanism of NO3 − reduction that comes into play as soon as copper is introduced in the catalyst. The surface enrichment of the supported Pd–Cu particles in copper, registered for our catalysts and membranes in line with numerous observations reported in the literature [15,31–35], together with an increase in the catalytic activity obtained upon addition of copper to palladium also suggests that it is probably not the activation of hydrogen but that of NO3 − which is the rate-limiting step for the palladium-based catalysts. 4.2 Investigation of the mechanism of NO3 − and NO2 − reduction by H2 4.2.1 The nature of hydrogen adsorbed over Pd Of the Group VIII metals it is only palladium that reacts with hydrogen to form a stable hydride phase. The solubility of hydrogen in the bulk of palladium is abnormally high, and the three-dimensional phase of palladium hydride can be formed at various P H2 and temperature. Palladium hydride is likely to be formed in the course of H2 adsorption, which is evidenced by the TDS results presented in Fig. 5a–b. The dissociative state of hydrogen produced under adsorption at 300 K is characterized by the high-temperature β peak at 350 K (θ=0.4 ML), whereas hydrogen adsorption below room temperature results in the low-temperature α peak at 160 K. The latter only appears after large exposures at 100 K and exhibits near-zero-order desorption kinetics [9]. The α peak is associated with a near-surface hydrogen state and, therefore, can be assigned to the decomposition of surface hydride. According to Ref. [36], the hydride phase has an atomic ratio H/Pd≥0.6. Hence, the low-temperature formation of the surface hydride is caused by (i) high coverage θ H, (ii) slow hydrogen diffusion into the bulk. A high diffusion rate of hydrogen in Pd at 300 K (3.8×10−7 cm2 s−1, which corresponds to the movement speed of 2×10−4 mm/s) results in the appearance of the wide desorption βab peak at 620 K, in accordance with Refs. [29,36]. Hydrogen can also diffuse in the bulk of palladium in the course of the reaction between NO and H2. As evidenced by the HREELS study [37], the NO adlayer forces hydrogen atoms to move deeper into the substrate. Thus, the three characteristic TDS spectra for the H/Pd system (α, β and βab) are strongly dependent on the adsorption temperature and exposure, or the reaction conditions (i.e. temperature and partial pressures of the reactants). 4.2.2 NO dissociation and NO+H2 interaction over Pd The adsorption of NO on Pd at 300 K is predominantly molecular. It occurs via nitrogen binding to Pd. Upon heating, a portion of NO desorbs reversibly from Pd, but the residual NO dissociates releasing N2, O2 and N2O in addition to NO (Fig. 7). This implies that the thermal decomposition of NO occurs more readily on the polycrystalline palladium wire as compared with the flat Pd(111) and Pd(100) surfaces [24,38]. The fractional amount of NO dissociation on the polycrystalline surface upon heating is the largest at the lowest NO coverages, when only defect sites are populated with NOads. However, the dissociation probability diminishes steeply when the surface defect sites become populated with Oads atoms, and the high-temperature peak with T max=700 K disappears. When NO adsorbs dissociatively on Pd surface in the presence of hydrogen at 300 K, oxygen atoms thus formed are readily removed by hydrogen to form H2O, while the adsorbed atomic nitrogen species remain on the surface (in the equations below, square brackets symbolise the active surface centers): (1) H 2+2Pd[]→2Pd[H] Pd[NO]+Pd[]→Pd[N]+Pd[O] Pd[O]+2Pd[H]→3Pd[]+H 2 Pd[NO]+H 2→Pd[N]+H 2 O According to Ref. [39], if recombination of Nads is rapid under the reaction conditions, then only a slight accumulation of Nads would be attained. It has been also found in Ref. [39] that N2 desorption from the layer of atomic nitrogen is slow for Pd(100) surface, and the Nads layer is stable at temperatures below 600 K in vacuum. As shown in Fig. 8, the growth in the Nads coverage is apparently associated with the species desorbed at ca. 680 K. For the Nads+H2 reaction on Pd(100) at 400 K, the formation of NHads species — an intermediate in the reaction pathway leading to ammonia production — has been observed in Refs. [25,39]. 4.2.3 Mechanism of NO reduction by H2 over Pd In our study attention was focused at transformations of NO (the probable key intermediate in reduction of NO3 − and NO2 −) occurring over Pd and leading to the main reaction products — N2 and NH3. In the light of the present study and the data available in the literature, formation of nitrogen via the surface decomposition of NHads species as suggested in Ref. [20], i.e. 2NHads→N2+2Hads is unlikely to take place under conditions of NO3 − and/or NO2 − reduction over Pd. A similar reaction resulting in the simultaneous evolution of nitrogen and hydrogen in the gas phase can occur over Ir [40] and Rh [41] surfaces, but only at elevated temperatures. In accordance with the data existing in the literature [7], the present study shows that the main pathway of N2 formation in the course of reduction of nitrate and/or nitrite ions over Pd is likely to include the following sequence of elementary steps: (2) Pd[NO]+Pd[]→Pd[N]+Pd[O] Pd[O]+2Pd[H]→3Pd[]+H 2 O Pd[N]+Pd[N]→2Pd[]+N 2 Besides, no experimental evidence can be found for the formation of NHads species over Pd via direct interaction of NOads and 2Hads, suggested in [20], i.e. NOads+2Hads→NHads+OHads. As shown in the previous section, in the interaction of NO and H2 over Pd no immediate formation of any species containing both nitrogen and hydrogen was registered. Instead, interaction between NOads and Hads includes dissociation of NOads that produces Nads and Oads species, while NHads is formed via the surface reaction between Nads and Hads. 4.2.4 Mechanism of NO3 − and NO2 − reduction by H2 over Pd and Pd–Cu catalysts On the basis of the results obtained in this study and the literature data, the following mechanism of NO3 − and NO2 − reduction by hydrogen in aqueous solutions over Pd and bimetallic Pd–Cu catalysts can be proposed: (3) (1) H 2+2Pd[]→2Pd[H] (2) NO 3 −+Pd[H]→Pd[NO 2]+OH − (3) Pd[NO 2]⇔NO 2+Pd[] (4)2NO 2+2OH −→NO 2 −+NO 3 −+H 2 O (5) NO 2 −+Pd[H]→Pd[NO]+OH − (6) Pd[NO 2]+Pd[H]→Pd[NO]+Pd[OH] (7) NO 3 −+2Cu[]→[Cu 2 O] surf +NO 2 − (8)[Cu 2 O] surf +2Pd[H] spil →2Cu[]+2Pd[]+H 2 O (9) Pd[NO]+Pd[]→Pd[N]+Pd[O] (10) Pd[O]+2Pd[H]→3Pd[]+H 2 O (11) Pd[N]+Pd[N]→2Pd[]+N 2 (12) Pd[N]+Pd[H]→Pd[NH]+Pd[] (13) Pd[NH]+Pd[NH]→N 2+H 2+2Pd[] (14) Pd[NH]+Pd[H]⇔Pd[NH 2]+Pd[] (15) Pd[NH 2]+Pd[H]→Pd[NH 3]+Pd[] (16) Pd[NH 3]→NH 3+Pd[] (17) NH 3+H 2 O→NH 4 ++OH − (18) Pd[OH]+Pd[H]→H 2 O+2Pd[] In this mechanism an important role belongs to the active centers of copper which in addition to those of palladium apparently take part in the catalytic cycle of NO3 − reduction, increasing the overall reaction rate and decreasing the yield of NH4 + by-product as evidenced by the kinetic measurements with Pd/Al2O3 and Pd–Cu/Al2O3 catalysts. Upon interaction with NO3 − copper is likely to act as an oxygen scavenger, forming the surface oxide of the probable composition Cu2O(surf) [42] and reducing the nitrate ion to NO2 −. Besides, the atoms of metallic copper adjacent to the atoms of palladium could compete with Pd[H] species and Pd[ ] vacant sites participating in the reductions of the surface species Pd[NO2] and Pd[NO] suggested by stages (6) and (9). The surface copper oxide Cu2O(surf) thus formed is reduced back to the metallic state by hydrogen spilt-over from the adjacent Pd centers. Evidences of hydrogen transfer from palladium to copper via spillover have been found for Pd–Cu catalysts in Ref. [42]. Dissociative adsorption of hydrogen over Pd–Cu catalysts at the conditions of NO3 − reduction can only occur on palladium sites [43,44]. It seems likely that activation of NO3 − ion is slow for palladium, while it easily occurs over copper where nitrate ions are reduced to nitrites. This new route opened by copper is believed to account for the substantially higher activity of PdCu/Al2O3 catalysts in NO3 − reduction compared to that of Pd/Al2O3. In addition to the new reaction pathway opened by the copper centers, changes in the catalytic behavior of Pd–Cu catalysts may arise from the differences in the binding energies of the adsorbed species for mono- and bimetallic systems which may result from an electronic interaction between Pd and Cu [11,43]. With the exception of stages (7) and (8), the same sequence of equations can be suggested to describe the reaction mechanism over Pd catalyst. In this case the main difference between mechanism (3) and that proposed in Ref. [20] concerns the stages of nitrogen formation, which are supposed to follow the above-given scheme (2). Since the intrinsic catalytic activity of copper in reduction of NO2 − is low, it can be assumed that the reductive transformations of NO2 − mainly occur over palladium. 5 Conclusion The catalytic behavior of mono- and bimetallic catalysts with Pd and/or Cu supported over γ-Al2O3 in the reduction of aqueous nitrate and nitrite ions by hydrogen was investigated. Activity of the catalysts in the reduction of nitrates was found to reach maximum at the atomic ratio of the metals Pd:Cu≈1. In the reduction of nitrite ions over the same catalysts, maximum activity was registered for Pd/Al2O3 catalyst, with copper apparently playing the role of an inert diluent for palladium. The composition of the supported metal catalysts was analysed using SIMS and XRD techniques. Surface enrichment in copper of the nanosized bimetallic particles (catalytically active component) was revealed. Interactions of H2 and NO (probable intermediate in NO3 − and NO2 − reduction) over Pd were studied by the thermal desorption spectroscopy technique. Molecular mechanism of NO3 − and NO2 − reduction by H2 over Pd and Pd–Cu catalysts is proposed. Acknowledgements Financial support of the investigations related to this article provided by the Netherlands Organization for Scientific Research (Grant No. 047-010-100-96) and Russian Foundation for Basic Research (Grant No. 99-003-32433) is gratefully acknowledged. Sincere gratitude is addressed to Dr. B.E. Nieuwenhuys for the insightful discussions of mechanistic aspects of the reactions considered in the present study. References [1] K.-D. Vorlop, T. Tacke, M. Sell, U.S. Patent 4 990 266 (1989). [2] K.-D. Vorlop T. Tacke Chem.-Ing.-Tech. 61 1989 836 [3] O.M. Ilinitch F.P. Cuperus L.V. Nosova E.N. Gribov Catal. Today 56 2000 137 145 [4] V.I. Nefedov V.T. Cherepin Physical Methods of Investigation of Solid Surfaces 1983 Nauka Moscow (in Russian) [5] G. Verner Electronic and Ionic Spectroscopy of Solid Bodies 1981 Mir Moscow 345 (in Russian) [6] G. Bets G. Verner Sputtering of Solid Bodies by Ionic Bombardment 1986 Mir Moscow 24 (in Russian) [7] A. Obuchi S. Naito T. Onishi K. Tamaru Surf. Sci. 122 1982 235 [8] E.M. Stuve S.W. Jorgensen R.J. Madix Surf. Sci. 146 1984 179 [9] M. Milun P. Pervan K. Wandelt Surf. Sci. 189/190 1987 466 [10] A.W. Aldag L.D. Schmidt J. Catal. 22 1971 260 [11] Y. Debauge M. Abon J.C. Bertolini J. Massardier A. Rochefort Appl. Surf. Sci. 90 1995 15 [12] F. Skoda M.P. Astier G.M. Pajonk M. Primet Catal. Lett. 29 1994 159 [13] F. Skoda M.P. Astier G.M. Pajonk M. Primet React. Kinet. Catal. Lett. 55 1995 101 [14] L.N. Nosova V.I. Zaikovskii Yu.A. Ryndin React. Kinet. Catal. Lett. 53 1994 131 [15] L.V. Nosova V.I. Zajkovsky A.V. Kalinkin E.P. Talzi E.A. Paukshtis Yu.A. Ryndin Kinet. Katal. 36 1995 362 (in Russian) [16] A.J. Renouprez K. Lebas G. Bergeret J.L. Rousset P. Delichere Supported Pd–Cu catalysts prepared from bimetallic organo-metallic complexes: relation between surface composition measured by ion scattering and reactivity J.W. Hightower W.N. Delgass E. Iglesia A.T. Bell Stud. Surf. Sci. Catal. Vol. 101 1996 Elsevier Amsterdam 1105 1114 [17] L.I. Mirkin Analysis of Polycrystals by X-ray Diffraction 1961 Fizmatgiz Moscow 728 (in Russian) [18] S. Hoffman Surf. Interface Anal. 2 1980 148 [19] C.P. Hunt M.P. Seach Surf. Interface Anal. 5 1983 199 [20] J. Wärna I. Turunen T. Salmi T. Maunula Chem. Eng. Sci. 49 24B 1994 5763 [21] S. Hörold K.-D. Vorlop T. Tacke M. Sell Catal. Today 17 1993 21 [22] T.P. Kobylinski B.W. Taylor J. Catal. 33 1974 376 [23] A. Pintar G. Berčič J. Levec AIChE J. 44 1998 2280 [24] W.F. Egelhoff D.A. King D.P.N.Y. Woodruff The Chemical Physics of Solid Surface and Heterogeneous Catalysis Vol. 4 1982 Elsevier Amsterdam 397 [25] T. Yamada K. Tanaka J. Am. Chem. Soc. 111 1989 6880 [26] Y. Kuwahara M. Fujisawa M. Jo M. Onchi M. Nishijima Surf. Sci. 188 1987 490 [27] A.W. Aldag L.D. Schmidt J. Catal. 22 1971 260 [28] P.A. Redhead Vacuum 12 1962 203 [29] H. Conrad G. Ertl E.E. Latta Surf. Sci. 41 1974 435 [30] K. Schwaha E. Bechtold Surf. Sci. 66 1977 383 [31] A.D. Langeveld H.A.C.M. Hendrickx B.E. Nieuwenhuys Thin Solid Films 109 1983 179 [32] A. Noordermeer G.A. Kok B.E. Nieuwenhuys Surf. Sci. 172 1986 349 [33] D.J. Homes D.A. King C.J. Barnes Surf. Sci. 227 1990 179 [34] M.A. Newton S.M. Francis Y. Li D. Law M. Bowker Surf. Sci. 259 1991 45 [35] A. Rochefort M. Abon P. Delichère J.C. Bertolini Surf. Sci. 294 1993 43 [36] G.E. Gdowski T.E. Felter R.H. Stulen Surf. Sci. 181 1987 L147 [37] C. Nyberg P. Uvdal Surf. Sci 211/212 1989 923 [38] R.D. Ramsier Q. Gao H.N. Waltenburg K.W. Lee O.W. Nooij L. Lefferts J.T. Yates Jr. Surf. Sci. 320 1994 209 [39] K. Tanaka T. Yamada B.E. Nieuwenhuys Surf. Sci. 242 1991 503 [40] V.V. Gorodetskii V.A. Sobyanin Proc. VII Int. Congr. Catalysis 1980 Tokyo Press University of Tokyo, Tokyo 566 [41] A.R. Cholach M.F.H. van Tol B.E. Nieuwenhuys Surf. Sci. 320 1994 281 [42] C.A. Leon y Leon M.A. Vannice Appl. Catal. 69 1991 291 [43] A. Rochefort M. Abon P. Delichère J.C. Bertolini Surf. Sci. 294 1993 43 [44] C.A. Leon y Leon M.A. Vannice Appl. Catal. 69 1991 269",
      "scopus-id": "0034623221",
      "coredata": {
        "eid": "1-s2.0-S1381116900000704",
        "dc:description": "The catalytic behavior of mono- and bimetallic catalysts with Pd and/or Cu supported over γ-Al2O3 in the reduction of aqueous nitrate and nitrite ions by hydrogen was investigated. The composition of the supported metal catalysts was analysed using secondary ion mass spectroscopy (SIMS) and X-ray diffraction (XRD) techniques. Surface enrichment of the bimetallic Pd–Cu particles in copper was revealed. Interactions of NO (possible intermediate in reduction of nitrate and nitrite ions) with H2 over Pd were studied by thermal desorption spectroscopy (TDS) under high-vacuum conditions. The molecular mechanism of NO3 − and NO2 − reduction by H2 as well as the role of Pd and Cu active sites are discussed.",
        "openArchiveArticle": "false",
        "prism:coverDate": "2000-09-08",
        "openaccessUserLicense": null,
        "prism:aggregationType": "Journal",
        "prism:url": "https://api.elsevier.com/content/article/pii/S1381116900000704",
        "dc:creator": [
          {
            "@_fa": "true",
            "$": "Ilinitch, O.M"
          },
          {
            "@_fa": "true",
            "$": "Nosova, L.V"
          },
          {
            "@_fa": "true",
            "$": "Gorodetskii, V.V"
          },
          {
            "@_fa": "true",
            "$": "Ivanov, V.P"
          },
          {
            "@_fa": "true",
            "$": "Trukhan, S.N"
          },
          {
            "@_fa": "true",
            "$": "Gribov, E.N"
          },
          {
            "@_fa": "true",
            "$": "Bogdanov, S.V"
          },
          {
            "@_fa": "true",
            "$": "Cuperus, F.P"
          }
        ],
        "link": [
          {
            "@_fa": "true",
            "@rel": "self",
            "@href": "https://api.elsevier.com/content/article/pii/S1381116900000704"
          },
          {
            "@_fa": "true",
            "@rel": "scidir",
            "@href": "https://www.sciencedirect.com/science/article/pii/S1381116900000704"
          }
        ],
        "dc:format": "application/json",
        "openaccessType": null,
        "pii": "S1381-1169(00)00070-4",
        "prism:volume": "158",
        "prism:publisher": "Elsevier Science B.V.",
        "dc:title": "Catalytic reduction of nitrate and nitrite ions by hydrogen: investigation of the reaction mechanism over Pd and Pd–Cu catalysts",
        "prism:copyright": "Copyright © 2000 Elsevier Science B.V. All rights reserved.",
        "openaccess": "0",
        "prism:issn": "13811169",
        "prism:issueIdentifier": "1",
        "dcterms:subject": [
          {
            "@_fa": "true",
            "$": "Catalytic reduction"
          },
          {
            "@_fa": "true",
            "$": "Metal catalyst"
          },
          {
            "@_fa": "true",
            "$": "Pd"
          },
          {
            "@_fa": "true",
            "$": "Pd–Cu"
          }
        ],
        "openaccessArticle": "false",
        "prism:publicationName": "Journal of Molecular Catalysis A: Chemical",
        "prism:number": "1",
        "openaccessSponsorType": null,
        "prism:pageRange": "237-249",
        "prism:endingPage": "249",
        "pubType": "fla",
        "prism:coverDisplayDate": "8 September 2000",
        "prism:doi": "10.1016/S1381-1169(00)00070-4",
        "prism:startingPage": "237",
        "dc:identifier": "doi:10.1016/S1381-1169(00)00070-4",
        "openaccessSponsorName": null
      },
      "objects": {
        "object": [
          {
            "@category": "thumbnail",
            "@height": "18",
            "@width": "195",
            "@_fa": "true",
            "$": "https://api.elsevier.com/content/object/eid/1-s2.0-S1381116900000704-si9.gif?httpAccept=%2A%2F%2A",
            "@multimediatype": "GIF image file",
            "@type": "ALTIMG",
            "@size": "849",
            "@ref": "si9",
            "@mimetype": "image/gif"
          },
          {
            "@category": "thumbnail",
            "@height": "18",
            "@width": "215",
            "@_fa": "true",
            "$": "https://api.elsevier.com/content/object/eid/1-s2.0-S1381116900000704-si8.gif?httpAccept=%2A%2F%2A",
            "@multimediatype": "GIF image file",
            "@type": "ALTIMG",
            "@size": "878",
            "@ref": "si8",
            "@mimetype": "image/gif"
          },
          {
            "@category": "thumbnail",
            "@height": "18",
            "@width": "218",
            "@_fa": "true",
            "$": "https://api.elsevier.com/content/object/eid/1-s2.0-S1381116900000704-si7.gif?httpAccept=%2A%2F%2A",
            "@multimediatype": "GIF image file",
            "@type": "ALTIMG",
            "@size": "959",
            "@ref": "si7",
            "@mimetype": "image/gif"
          },
          {
            "@category": "thumbnail",
            "@height": "18",
            "@width": "203",
            "@_fa": "true",
            "$": "https://api.elsevier.com/content/object/eid/1-s2.0-S1381116900000704-si6.gif?httpAccept=%2A%2F%2A",
            "@multimediatype": "GIF image file",
            "@type": "ALTIMG",
            "@size": "858",
            "@ref": "si6",
            "@mimetype": "image/gif"
          },
          {
            "@category": "thumbnail",
            "@height": "18",
            "@width": "204",
            "@_fa": "true",
            "$": "https://api.elsevier.com/content/object/eid/1-s2.0-S1381116900000704-si5.gif?httpAccept=%2A%2F%2A",
            "@multimediatype": "GIF image file",
            "@type": "ALTIMG",
            "@size": "879",
            "@ref": "si5",
            "@mimetype": "image/gif"
          },
          {
            "@category": "thumbnail",
            "@height": "18",
            "@width": "218",
            "@_fa": "true",
            "$": "https://api.elsevier.com/content/object/eid/1-s2.0-S1381116900000704-si4.gif?httpAccept=%2A%2F%2A",
            "@multimediatype": "GIF image file",
            "@type": "ALTIMG",
            "@size": "959",
            "@ref": "si4",
            "@mimetype": "image/gif"
          },
          {
            "@category": "thumbnail",
            "@height": "18",
            "@width": "144",
            "@_fa": "true",
            "$": "https://api.elsevier.com/content/object/eid/1-s2.0-S1381116900000704-si3.gif?httpAccept=%2A%2F%2A",
            "@multimediatype": "GIF image file",
            "@type": "ALTIMG",
            "@size": "657",
            "@ref": "si3",
            "@mimetype": "image/gif"
          },
          {
            "@category": "thumbnail",
            "@height": "18",
            "@width": "253",
            "@_fa": "true",
            "$": "https://api.elsevier.com/content/object/eid/1-s2.0-S1381116900000704-si27.gif?httpAccept=%2A%2F%2A",
            "@multimediatype": "GIF image file",
            "@type": "ALTIMG",
            "@size": "1062",
            "@ref": "si27",
            "@mimetype": "image/gif"
          },
          {
            "@category": "thumbnail",
            "@height": "19",
            "@width": "238",
            "@_fa": "true",
            "$": "https://api.elsevier.com/content/object/eid/1-s2.0-S1381116900000704-si26.gif?httpAccept=%2A%2F%2A",
            "@multimediatype": "GIF image file",
            "@type": "ALTIMG",
            "@size": "915",
            "@ref": "si26",
            "@mimetype": "image/gif"
          },
          {
            "@category": "thumbnail",
            "@height": "18",
            "@width": "193",
            "@_fa": "true",
            "$": "https://api.elsevier.com/content/object/eid/1-s2.0-S1381116900000704-si25.gif?httpAccept=%2A%2F%2A",
            "@multimediatype": "GIF image file",
            "@type": "ALTIMG",
            "@size": "870",
            "@ref": "si25",
            "@mimetype": "image/gif"
          },
          {
            "@category": "thumbnail",
            "@height": "18",
            "@width": "278",
            "@_fa": "true",
            "$": "https://api.elsevier.com/content/object/eid/1-s2.0-S1381116900000704-si24.gif?httpAccept=%2A%2F%2A",
            "@multimediatype": "GIF image file",
            "@type": "ALTIMG",
            "@size": "1163",
            "@ref": "si24",
            "@mimetype": "image/gif"
          },
          {
            "@category": "thumbnail",
            "@height": "18",
            "@width": "264",
            "@_fa": "true",
            "$": "https://api.elsevier.com/content/object/eid/1-s2.0-S1381116900000704-si23.gif?httpAccept=%2A%2F%2A",
            "@multimediatype": "GIF image file",
            "@type": "ALTIMG",
            "@size": "1151",
            "@ref": "si23",
            "@mimetype": "image/gif"
          },
          {
            "@category": "thumbnail",
            "@height": "18",
            "@width": "291",
            "@_fa": "true",
            "$": "https://api.elsevier.com/content/object/eid/1-s2.0-S1381116900000704-si22.gif?httpAccept=%2A%2F%2A",
            "@multimediatype": "GIF image file",
            "@type": "ALTIMG",
            "@size": "1156",
            "@ref": "si22",
            "@mimetype": "image/gif"
          },
          {
            "@category": "thumbnail",
            "@height": "18",
            "@width": "252",
            "@_fa": "true",
            "$": "https://api.elsevier.com/content/object/eid/1-s2.0-S1381116900000704-si21.gif?httpAccept=%2A%2F%2A",
            "@multimediatype": "GIF image file",
            "@type": "ALTIMG",
            "@size": "1063",
            "@ref": "si21",
            "@mimetype": "image/gif"
          },
          {
            "@category": "thumbnail",
            "@height": "18",
            "@width": "230",
            "@_fa": "true",
            "$": "https://api.elsevier.com/content/object/eid/1-s2.0-S1381116900000704-si20.gif?httpAccept=%2A%2F%2A",
            "@multimediatype": "GIF image file",
            "@type": "ALTIMG",
            "@size": "975",
            "@ref": "si20",
            "@mimetype": "image/gif"
          },
          {
            "@category": "thumbnail",
            "@height": "38",
            "@width": "79",
            "@_fa": "true",
            "$": "https://api.elsevier.com/content/object/eid/1-s2.0-S1381116900000704-si2.gif?httpAccept=%2A%2F%2A",
            "@multimediatype": "GIF image file",
            "@type": "ALTIMG",
            "@size": "556",
            "@ref": "si2",
            "@mimetype": "image/gif"
          },
          {
            "@category": "thumbnail",
            "@height": "18",
            "@width": "250",
            "@_fa": "true",
            "$": "https://api.elsevier.com/content/object/eid/1-s2.0-S1381116900000704-si19.gif?httpAccept=%2A%2F%2A",
            "@multimediatype": "GIF image file",
            "@type": "ALTIMG",
            "@size": "1066",
            "@ref": "si19",
            "@mimetype": "image/gif"
          },
          {
            "@category": "thumbnail",
            "@height": "18",
            "@width": "244",
            "@_fa": "true",
            "$": "https://api.elsevier.com/content/object/eid/1-s2.0-S1381116900000704-si18.gif?httpAccept=%2A%2F%2A",
            "@multimediatype": "GIF image file",
            "@type": "ALTIMG",
            "@size": "1082",
            "@ref": "si18",
            "@mimetype": "image/gif"
          },
          {
            "@category": "thumbnail",
            "@height": "18",
            "@width": "343",
            "@_fa": "true",
            "$": "https://api.elsevier.com/content/object/eid/1-s2.0-S1381116900000704-si17.gif?httpAccept=%2A%2F%2A",
            "@multimediatype": "GIF image file",
            "@type": "ALTIMG",
            "@size": "1388",
            "@ref": "si17",
            "@mimetype": "image/gif"
          },
          {
            "@category": "thumbnail",
            "@height": "18",
            "@width": "272",
            "@_fa": "true",
            "$": "https://api.elsevier.com/content/object/eid/1-s2.0-S1381116900000704-si16.gif?httpAccept=%2A%2F%2A",
            "@multimediatype": "GIF image file",
            "@type": "ALTIMG",
            "@size": "1119",
            "@ref": "si16",
            "@mimetype": "image/gif"
          },
          {
            "@category": "thumbnail",
            "@height": "18",
            "@width": "287",
            "@_fa": "true",
            "$": "https://api.elsevier.com/content/object/eid/1-s2.0-S1381116900000704-si15.gif?httpAccept=%2A%2F%2A",
            "@multimediatype": "GIF image file",
            "@type": "ALTIMG",
            "@size": "1240",
            "@ref": "si15",
            "@mimetype": "image/gif"
          },
          {
            "@category": "thumbnail",
            "@height": "18",
            "@width": "258",
            "@_fa": "true",
            "$": "https://api.elsevier.com/content/object/eid/1-s2.0-S1381116900000704-si14.gif?httpAccept=%2A%2F%2A",
            "@multimediatype": "GIF image file",
            "@type": "ALTIMG",
            "@size": "1028",
            "@ref": "si14",
            "@mimetype": "image/gif"
          },
          {
            "@category": "thumbnail",
            "@height": "17",
            "@width": "313",
            "@_fa": "true",
            "$": "https://api.elsevier.com/content/object/eid/1-s2.0-S1381116900000704-si13.gif?httpAccept=%2A%2F%2A",
            "@multimediatype": "GIF image file",
            "@type": "ALTIMG",
            "@size": "1108",
            "@ref": "si13",
            "@mimetype": "image/gif"
          },
          {
            "@category": "thumbnail",
            "@height": "18",
            "@width": "178",
            "@_fa": "true",
            "$": "https://api.elsevier.com/content/object/eid/1-s2.0-S1381116900000704-si12.gif?httpAccept=%2A%2F%2A",
            "@multimediatype": "GIF image file",
            "@type": "ALTIMG",
            "@size": "862",
            "@ref": "si12",
            "@mimetype": "image/gif"
          },
          {
            "@category": "thumbnail",
            "@height": "18",
            "@width": "265",
            "@_fa": "true",
            "$": "https://api.elsevier.com/content/object/eid/1-s2.0-S1381116900000704-si11.gif?httpAccept=%2A%2F%2A",
            "@multimediatype": "GIF image file",
            "@type": "ALTIMG",
            "@size": "1070",
            "@ref": "si11",
            "@mimetype": "image/gif"
          },
          {
            "@category": "thumbnail",
            "@height": "18",
            "@width": "170",
            "@_fa": "true",
            "$": "https://api.elsevier.com/content/object/eid/1-s2.0-S1381116900000704-si10.gif?httpAccept=%2A%2F%2A",
            "@multimediatype": "GIF image file",
            "@type": "ALTIMG",
            "@size": "766",
            "@ref": "si10",
            "@mimetype": "image/gif"
          },
          {
            "@category": "thumbnail",
            "@height": "18",
            "@width": "127",
            "@_fa": "true",
            "$": "https://api.elsevier.com/content/object/eid/1-s2.0-S1381116900000704-si1.gif?httpAccept=%2A%2F%2A",
            "@multimediatype": "GIF image file",
            "@type": "ALTIMG",
            "@size": "672",
            "@ref": "si1",
            "@mimetype": "image/gif"
          },
          {
            "@category": "standard",
            "@height": "279",
            "@width": "273",
            "@_fa": "true",
            "$": "https://api.elsevier.com/content/object/eid/1-s2.0-S1381116900000704-gr1.gif?httpAccept=%2A%2F%2A",
            "@multimediatype": "GIF image file",
            "@type": "IMAGE-DOWNSAMPLED",
            "@size": "8129",
            "@ref": "gr1",
            "@mimetype": "image/gif"
          },
          {
            "@category": "thumbnail",
            "@height": "163",
            "@width": "160",
            "@_fa": "true",
            "$": "https://api.elsevier.com/content/object/eid/1-s2.0-S1381116900000704-gr1.sml?httpAccept=%2A%2F%2A",
            "@multimediatype": "GIF image file",
            "@type": "IMAGE-THUMBNAIL",
            "@size": "3431",
            "@ref": "gr1",
            "@mimetype": "image/gif"
          },
          {
            "@category": "high",
            "@height": "2959",
            "@width": "2899",
            "@_fa": "true",
            "$": "https://api.elsevier.com/content/object/eid/1-s2.0-S1381116900000704-gr1_lrg.gif?httpAccept=%2A%2F%2A",
            "@multimediatype": "GIF image file",
            "@type": "IMAGE-HIGH-RES",
            "@size": "105679",
            "@ref": "gr1",
            "@mimetype": "image/gif"
          },
          {
            "@category": "standard",
            "@height": "260",
            "@width": "255",
            "@_fa": "true",
            "$": "https://api.elsevier.com/content/object/eid/1-s2.0-S1381116900000704-gr2.gif?httpAccept=%2A%2F%2A",
            "@multimediatype": "GIF image file",
            "@type": "IMAGE-DOWNSAMPLED",
            "@size": "6051",
            "@ref": "gr2",
            "@mimetype": "image/gif"
          },
          {
            "@category": "thumbnail",
            "@height": "164",
            "@width": "161",
            "@_fa": "true",
            "$": "https://api.elsevier.com/content/object/eid/1-s2.0-S1381116900000704-gr2.sml?httpAccept=%2A%2F%2A",
            "@multimediatype": "GIF image file",
            "@type": "IMAGE-THUMBNAIL",
            "@size": "2915",
            "@ref": "gr2",
            "@mimetype": "image/gif"
          },
          {
            "@category": "high",
            "@height": "2755",
            "@width": "2707",
            "@_fa": "true",
            "$": "https://api.elsevier.com/content/object/eid/1-s2.0-S1381116900000704-gr2_lrg.gif?httpAccept=%2A%2F%2A",
            "@multimediatype": "GIF image file",
            "@type": "IMAGE-HIGH-RES",
            "@size": "73901",
            "@ref": "gr2",
            "@mimetype": "image/gif"
          },
          {
            "@category": "standard",
            "@height": "322",
            "@width": "292",
            "@_fa": "true",
            "$": "https://api.elsevier.com/content/object/eid/1-s2.0-S1381116900000704-gr3.gif?httpAccept=%2A%2F%2A",
            "@multimediatype": "GIF image file",
            "@type": "IMAGE-DOWNSAMPLED",
            "@size": "10274",
            "@ref": "gr3",
            "@mimetype": "image/gif"
          },
          {
            "@category": "thumbnail",
            "@height": "163",
            "@width": "148",
            "@_fa": "true",
            "$": "https://api.elsevier.com/content/object/eid/1-s2.0-S1381116900000704-gr3.sml?httpAccept=%2A%2F%2A",
            "@multimediatype": "GIF image file",
            "@type": "IMAGE-THUMBNAIL",
            "@size": "3809",
            "@ref": "gr3",
            "@mimetype": "image/gif"
          },
          {
            "@category": "high",
            "@height": "3424",
            "@width": "3102",
            "@_fa": "true",
            "$": "https://api.elsevier.com/content/object/eid/1-s2.0-S1381116900000704-gr3_lrg.gif?httpAccept=%2A%2F%2A",
            "@multimediatype": "GIF image file",
            "@type": "IMAGE-HIGH-RES",
            "@size": "109076",
            "@ref": "gr3",
            "@mimetype": "image/gif"
          },
          {
            "@category": "standard",
            "@height": "216",
            "@width": "308",
            "@_fa": "true",
            "$": "https://api.elsevier.com/content/object/eid/1-s2.0-S1381116900000704-gr4.gif?httpAccept=%2A%2F%2A",
            "@multimediatype": "GIF image file",
            "@type": "IMAGE-DOWNSAMPLED",
            "@size": "7484",
            "@ref": "gr4",
            "@mimetype": "image/gif"
          },
          {
            "@category": "thumbnail",
            "@height": "153",
            "@width": "219",
            "@_fa": "true",
            "$": "https://api.elsevier.com/content/object/eid/1-s2.0-S1381116900000704-gr4.sml?httpAccept=%2A%2F%2A",
            "@multimediatype": "GIF image file",
            "@type": "IMAGE-THUMBNAIL",
            "@size": "4762",
            "@ref": "gr4",
            "@mimetype": "image/gif"
          },
          {
            "@category": "high",
            "@height": "2286",
            "@width": "3266",
            "@_fa": "true",
            "$": "https://api.elsevier.com/content/object/eid/1-s2.0-S1381116900000704-gr4_lrg.gif?httpAccept=%2A%2F%2A",
            "@multimediatype": "GIF image file",
            "@type": "IMAGE-HIGH-RES",
            "@size": "71696",
            "@ref": "gr4",
            "@mimetype": "image/gif"
          },
          {
            "@category": "standard",
            "@height": "406",
            "@width": "643",
            "@_fa": "true",
            "$": "https://api.elsevier.com/content/object/eid/1-s2.0-S1381116900000704-gr5.gif?httpAccept=%2A%2F%2A",
            "@multimediatype": "GIF image file",
            "@type": "IMAGE-DOWNSAMPLED",
            "@size": "22392",
            "@ref": "gr5",
            "@mimetype": "image/gif"
          },
          {
            "@category": "thumbnail",
            "@height": "138",
            "@width": "219",
            "@_fa": "true",
            "$": "https://api.elsevier.com/content/object/eid/1-s2.0-S1381116900000704-gr5.sml?httpAccept=%2A%2F%2A",
            "@multimediatype": "GIF image file",
            "@type": "IMAGE-THUMBNAIL",
            "@size": "4677",
            "@ref": "gr5",
            "@mimetype": "image/gif"
          },
          {
            "@category": "high",
            "@height": "4303",
            "@width": "6823",
            "@_fa": "true",
            "$": "https://api.elsevier.com/content/object/eid/1-s2.0-S1381116900000704-gr5_lrg.gif?httpAccept=%2A%2F%2A",
            "@multimediatype": "GIF image file",
            "@type": "IMAGE-HIGH-RES",
            "@size": "234519",
            "@ref": "gr5",
            "@mimetype": "image/gif"
          },
          {
            "@category": "standard",
            "@height": "430",
            "@width": "316",
            "@_fa": "true",
            "$": "https://api.elsevier.com/content/object/eid/1-s2.0-S1381116900000704-gr6.gif?httpAccept=%2A%2F%2A",
            "@multimediatype": "GIF image file",
            "@type": "IMAGE-DOWNSAMPLED",
            "@size": "16623",
            "@ref": "gr6",
            "@mimetype": "image/gif"
          },
          {
            "@category": "thumbnail",
            "@height": "163",
            "@width": "120",
            "@_fa": "true",
            "$": "https://api.elsevier.com/content/object/eid/1-s2.0-S1381116900000704-gr6.sml?httpAccept=%2A%2F%2A",
            "@multimediatype": "GIF image file",
            "@type": "IMAGE-THUMBNAIL",
            "@size": "3887",
            "@ref": "gr6",
            "@mimetype": "image/gif"
          },
          {
            "@category": "high",
            "@height": "4561",
            "@width": "3353",
            "@_fa": "true",
            "$": "https://api.elsevier.com/content/object/eid/1-s2.0-S1381116900000704-gr6_lrg.gif?httpAccept=%2A%2F%2A",
            "@multimediatype": "GIF image file",
            "@type": "IMAGE-HIGH-RES",
            "@size": "176101",
            "@ref": "gr6",
            "@mimetype": "image/gif"
          },
          {
            "@category": "standard",
            "@height": "237",
            "@width": "326",
            "@_fa": "true",
            "$": "https://api.elsevier.com/content/object/eid/1-s2.0-S1381116900000704-gr7.gif?httpAccept=%2A%2F%2A",
            "@multimediatype": "GIF image file",
            "@type": "IMAGE-DOWNSAMPLED",
            "@size": "10519",
            "@ref": "gr7",
            "@mimetype": "image/gif"
          },
          {
            "@category": "thumbnail",
            "@height": "160",
            "@width": "219",
            "@_fa": "true",
            "$": "https://api.elsevier.com/content/object/eid/1-s2.0-S1381116900000704-gr7.sml?httpAccept=%2A%2F%2A",
            "@multimediatype": "GIF image file",
            "@type": "IMAGE-THUMBNAIL",
            "@size": "5810",
            "@ref": "gr7",
            "@mimetype": "image/gif"
          },
          {
            "@category": "high",
            "@height": "2522",
            "@width": "3462",
            "@_fa": "true",
            "$": "https://api.elsevier.com/content/object/eid/1-s2.0-S1381116900000704-gr7_lrg.gif?httpAccept=%2A%2F%2A",
            "@multimediatype": "GIF image file",
            "@type": "IMAGE-HIGH-RES",
            "@size": "113941",
            "@ref": "gr7",
            "@mimetype": "image/gif"
          },
          {
            "@category": "standard",
            "@height": "457",
            "@width": "327",
            "@_fa": "true",
            "$": "https://api.elsevier.com/content/object/eid/1-s2.0-S1381116900000704-gr8.gif?httpAccept=%2A%2F%2A",
            "@multimediatype": "GIF image file",
            "@type": "IMAGE-DOWNSAMPLED",
            "@size": "12629",
            "@ref": "gr8",
            "@mimetype": "image/gif"
          },
          {
            "@category": "thumbnail",
            "@height": "163",
            "@width": "117",
            "@_fa": "true",
            "$": "https://api.elsevier.com/content/object/eid/1-s2.0-S1381116900000704-gr8.sml?httpAccept=%2A%2F%2A",
            "@multimediatype": "GIF image file",
            "@type": "IMAGE-THUMBNAIL",
            "@size": "2728",
            "@ref": "gr8",
            "@mimetype": "image/gif"
          },
          {
            "@category": "high",
            "@height": "4849",
            "@width": "3473",
            "@_fa": "true",
            "$": "https://api.elsevier.com/content/object/eid/1-s2.0-S1381116900000704-gr8_lrg.gif?httpAccept=%2A%2F%2A",
            "@multimediatype": "GIF image file",
            "@type": "IMAGE-HIGH-RES",
            "@size": "137017",
            "@ref": "gr8",
            "@mimetype": "image/gif"
          }
        ]
      },
      "link": {
        "@rel": "abstract",
        "@href": "https://api.elsevier.com/content/abstract/scopus_id/0034623221"
      }
    }
  }
}