{
  "metadata": {
    "title": "Heterogeneous asymmetric reactions: Part 38. Enantioselective hydrogenation of fluoroketones on Pt–alumina catalyst",
    "authors": "; ; ",
    "journal": "Journal of Molecular Catalysis A: Chemical",
    "date": "2004-07-12",
    "doi": "10.1016/j.molcata.2004.03.019",
    "abstract": "",
    "uri": "https://api.elsevier.com/content/article/pii/S1381116904001645",
    "pii": "S1381116904001645"
  },
  "fulltext": {
    "full-text-retrieval-response": {
      "scopus-eid": "2-s2.0-2542456591",
      "originalText": "serial JL 271358 291210 291744 291790 291809 31 Journal of Molecular Catalysis A: Chemical JOURNALMOLECULARCATALYSISACHEMICAL 2004-05-06 2004-05-06 2010-03-28T13:36:59 1-s2.0-S1381116904001645 S1381-1169(04)00164-5 S1381116904001645 10.1016/j.molcata.2004.03.019 S300 S300.1 FULL-TEXT 1-s2.0-S1381116900X01896 2015-05-15T05:56:32.920819-04:00 0 0 20040712 2004 2004-05-06T00:00:00Z articleinfo crossmark dco dateupdated tomb dateloaded datesearch indexeddate issuelist volumelist yearnav absattachment articletitlenorm authfirstinitialnorm authfirstsurnamenorm cid cids confeditor contenttype copyright dateloadedtxt docsubtype doctype doi eid ewtransactionid hubeid issfirst issn issnnorm itemstage itemtransactionid itemweight openaccess openarchive pg pgfirst pglast pii piinorm pubdatestart pubdatetxt pubyr sortorder srctitle srctitlenorm srctype subheadings vol volfirst volissue webpdf webpdfpagecount figure table body acknowledge affil articletitle auth authfirstini authfull authkeywords authlast primabst ref specialabst alllist content subj ssids 1381-1169 13811169 216 216 2 2 Volume 216, Issue 2 5 181 187 181 187 20040712 12 July 2004 2004-07-12 2004 Heterogeneous Chiral Catalysis David Sholl and Andrew Gellman converted-article fla Copyright © 2004 Published by Elsevier B.V. HETEROGENEOUSASYMMETRICREACTIONS VARGA T 1 Introduction 2 Experimental 2.1 Materials 2.2 Hydrogenation 2.3 Analysis 2.4 NMR measurements 3 Results and discussion 3.1 Enantioselective hydrogenation of 2,2,2-trifluoroacetophenone (1) 3.2 Enantioselective hydrogenation of 4-(trifluoroacetyl)biphenyl (5) 3.3 NMR measurements 3.4 Interpretation of the enantioselective hydrogenation of trifluoromethyl ketones 4 Conclusion Acknowledgements References STUDER 2003 45 M PIRKLE 1974 3904 W RAMACHANDRAN 1993 1725 P BUCCIARELLI 1983 897 M NOYORI 2001 40 R MALLAT 1997 95 T BALAZSIK 1999 149 K BODMER 1998 75 M VONARX 2000 161 M VONARX 2001 3089 M ZHANG 2001 125 J VARGAS 2002 489 A FUJISAWA 1998 4267 T REYES 2002 627 C AUGUSTINE 2003 69 R ZSIGMOND 2003 103 A TOROK 2000 3381 B SOKOLOVA 1973 1333 E BARTOK 2002 299 M BARTOK 2002 168 M DALE 1973 512 J SCHILLING 1980 4271 M BARTOK 2003 235 M MALLAT 1997 183 T BARTOK 2001 65 M BARTOK 2002 363 M VARGAX2004X181 VARGAX2004X181X187 VARGAX2004X181XT VARGAX2004X181X187XT item S1381-1169(04)00164-5 S1381116904001645 1-s2.0-S1381116904001645 10.1016/j.molcata.2004.03.019 271358 2010-10-15T16:14:15.884467-04:00 2004-07-12 1-s2.0-S1381116904001645-main.pdf https://s3.amazonaws.com/prod-ucs-content-store-us-east/content/pii:S1381116904001645/MAIN/application/pdf/ff2cf51d712770cb9b999fe7a8f29601/main.pdf https://s3-eu-west-1.amazonaws.com/prod-ucs-content-store-eu-west/content/pii:S1381116904001645/MAIN/application/pdf/ff2cf51d712770cb9b999fe7a8f29601/main.pdf main.pdf pdf true 342028 MAIN 7 1-s2.0-S1381116904001645-main_1.png https://s3.amazonaws.com/prod-ucs-content-store-us-east/content/pii:S1381116904001645/PREVIEW/image/png/282631e3eab899617b7b293400ede079/main_1.png https://s3-eu-west-1.amazonaws.com/prod-ucs-content-store-eu-west/content/pii:S1381116904001645/PREVIEW/image/png/282631e3eab899617b7b293400ede079/main_1.png main_1.png png 66824 849 656 IMAGE-WEB-PDF 1 1-s2.0-S1381116904001645-si6.gif https://s3.amazonaws.com/prod-ucs-content-store-us-east/content/pii:S1381116904001645/STRIPIN/image/gif/f5e3af9466b3a6889be4a563a36dff45/si6.gif https://s3-eu-west-1.amazonaws.com/prod-ucs-content-store-eu-west/content/pii:S1381116904001645/STRIPIN/image/gif/f5e3af9466b3a6889be4a563a36dff45/si6.gif si6 si6.gif gif 192 14 25 ALTIMG 1-s2.0-S1381116904001645-si5.gif https://s3.amazonaws.com/prod-ucs-content-store-us-east/content/pii:S1381116904001645/STRIPIN/image/gif/f5e3af9466b3a6889be4a563a36dff45/si6.gif https://s3-eu-west-1.amazonaws.com/prod-ucs-content-store-eu-west/content/pii:S1381116904001645/STRIPIN/image/gif/f5e3af9466b3a6889be4a563a36dff45/si6.gif si5 si5.gif gif 192 14 25 ALTIMG 1-s2.0-S1381116904001645-si4.gif https://s3.amazonaws.com/prod-ucs-content-store-us-east/content/pii:S1381116904001645/STRIPIN/image/gif/f5e3af9466b3a6889be4a563a36dff45/si6.gif https://s3-eu-west-1.amazonaws.com/prod-ucs-content-store-eu-west/content/pii:S1381116904001645/STRIPIN/image/gif/f5e3af9466b3a6889be4a563a36dff45/si6.gif si4 si4.gif gif 192 14 25 ALTIMG 1-s2.0-S1381116904001645-si3.gif https://s3.amazonaws.com/prod-ucs-content-store-us-east/content/pii:S1381116904001645/STRIPIN/image/gif/30a6913e1cd16c33450125f5f316712b/si2.gif https://s3-eu-west-1.amazonaws.com/prod-ucs-content-store-eu-west/content/pii:S1381116904001645/STRIPIN/image/gif/30a6913e1cd16c33450125f5f316712b/si2.gif si3 si3.gif gif 149 14 20 ALTIMG 1-s2.0-S1381116904001645-si2.gif https://s3.amazonaws.com/prod-ucs-content-store-us-east/content/pii:S1381116904001645/STRIPIN/image/gif/30a6913e1cd16c33450125f5f316712b/si2.gif https://s3-eu-west-1.amazonaws.com/prod-ucs-content-store-eu-west/content/pii:S1381116904001645/STRIPIN/image/gif/30a6913e1cd16c33450125f5f316712b/si2.gif si2 si2.gif gif 149 14 20 ALTIMG 1-s2.0-S1381116904001645-si1.gif https://s3.amazonaws.com/prod-ucs-content-store-us-east/content/pii:S1381116904001645/STRIPIN/image/gif/f5e3af9466b3a6889be4a563a36dff45/si6.gif https://s3-eu-west-1.amazonaws.com/prod-ucs-content-store-eu-west/content/pii:S1381116904001645/STRIPIN/image/gif/f5e3af9466b3a6889be4a563a36dff45/si6.gif si1 si1.gif gif 192 14 25 ALTIMG 1-s2.0-S1381116904001645-fx1.sml https://s3.amazonaws.com/prod-ucs-content-store-us-east/content/pii:S1381116904001645/fx1/THUMBNAIL/image/gif/bc0620d66205045bd93186dfaea304f8/fx1.sml https://s3-eu-west-1.amazonaws.com/prod-ucs-content-store-eu-west/content/pii:S1381116904001645/fx1/THUMBNAIL/image/gif/bc0620d66205045bd93186dfaea304f8/fx1.sml fx1 true fx1.sml sml 622 22 125 IMAGE-THUMBNAIL 1-s2.0-S1381116904001645-fx1.gif https://s3.amazonaws.com/prod-ucs-content-store-us-east/content/pii:S1381116904001645/fx1/DOWNSAMPLED/image/gif/39475dcb42652d0b1864a340fccedbea/fx1.gif https://s3-eu-west-1.amazonaws.com/prod-ucs-content-store-eu-west/content/pii:S1381116904001645/fx1/DOWNSAMPLED/image/gif/39475dcb42652d0b1864a340fccedbea/fx1.gif fx1 true fx1.gif gif 2897 66 376 IMAGE-DOWNSAMPLED 1-s2.0-S1381116904001645-sc1.sml https://s3.amazonaws.com/prod-ucs-content-store-us-east/content/pii:S1381116904001645/sc1/THUMBNAIL/image/gif/8194a394a33bd4e1ac5a6d6813047272/sc1.sml https://s3-eu-west-1.amazonaws.com/prod-ucs-content-store-eu-west/content/pii:S1381116904001645/sc1/THUMBNAIL/image/gif/8194a394a33bd4e1ac5a6d6813047272/sc1.sml sc1 sc1.sml sml 1329 24 125 IMAGE-THUMBNAIL 1-s2.0-S1381116904001645-sc1.gif https://s3.amazonaws.com/prod-ucs-content-store-us-east/content/pii:S1381116904001645/sc1/DOWNSAMPLED/image/gif/2a55607f2bdcc02dcd3ec8561121f25c/sc1.gif https://s3-eu-west-1.amazonaws.com/prod-ucs-content-store-eu-west/content/pii:S1381116904001645/sc1/DOWNSAMPLED/image/gif/2a55607f2bdcc02dcd3ec8561121f25c/sc1.gif sc1 sc1.gif gif 1660 34 179 IMAGE-DOWNSAMPLED 1-s2.0-S1381116904001645-gr1.sml https://s3.amazonaws.com/prod-ucs-content-store-us-east/content/pii:S1381116904001645/gr1/THUMBNAIL/image/gif/1e2d2448cd4934fd4c51c25537a7e4f6/gr1.sml https://s3-eu-west-1.amazonaws.com/prod-ucs-content-store-eu-west/content/pii:S1381116904001645/gr1/THUMBNAIL/image/gif/1e2d2448cd4934fd4c51c25537a7e4f6/gr1.sml gr1 gr1.sml sml 1960 91 106 IMAGE-THUMBNAIL 1-s2.0-S1381116904001645-gr1.gif https://s3.amazonaws.com/prod-ucs-content-store-us-east/content/pii:S1381116904001645/gr1/DOWNSAMPLED/image/gif/10887ee38b90f15c4d69c1bbfb4ac39a/gr1.gif https://s3-eu-west-1.amazonaws.com/prod-ucs-content-store-eu-west/content/pii:S1381116904001645/gr1/DOWNSAMPLED/image/gif/10887ee38b90f15c4d69c1bbfb4ac39a/gr1.gif gr1 gr1.gif gif 4016 175 203 IMAGE-DOWNSAMPLED 1-s2.0-S1381116904001645-gr2.sml https://s3.amazonaws.com/prod-ucs-content-store-us-east/content/pii:S1381116904001645/gr2/THUMBNAIL/image/gif/4c8ee3a809e2699828fded1f910d2a50/gr2.sml https://s3-eu-west-1.amazonaws.com/prod-ucs-content-store-eu-west/content/pii:S1381116904001645/gr2/THUMBNAIL/image/gif/4c8ee3a809e2699828fded1f910d2a50/gr2.sml gr2 gr2.sml sml 2438 93 91 IMAGE-THUMBNAIL 1-s2.0-S1381116904001645-gr2.jpg https://s3.amazonaws.com/prod-ucs-content-store-us-east/content/pii:S1381116904001645/gr2/DOWNSAMPLED/image/jpeg/dfffbc5f9b37e9a1f6290b2686539aa3/gr2.jpg https://s3-eu-west-1.amazonaws.com/prod-ucs-content-store-eu-west/content/pii:S1381116904001645/gr2/DOWNSAMPLED/image/jpeg/dfffbc5f9b37e9a1f6290b2686539aa3/gr2.jpg gr2 gr2.jpg jpg 29426 340 333 IMAGE-DOWNSAMPLED 1-s2.0-S1381116904001645-gr3.sml https://s3.amazonaws.com/prod-ucs-content-store-us-east/content/pii:S1381116904001645/gr3/THUMBNAIL/image/gif/31f1f9661c6ebc1628117ecd2111f2b4/gr3.sml https://s3-eu-west-1.amazonaws.com/prod-ucs-content-store-eu-west/content/pii:S1381116904001645/gr3/THUMBNAIL/image/gif/31f1f9661c6ebc1628117ecd2111f2b4/gr3.sml gr3 gr3.sml sml 2729 93 89 IMAGE-THUMBNAIL 1-s2.0-S1381116904001645-gr3.jpg https://s3.amazonaws.com/prod-ucs-content-store-us-east/content/pii:S1381116904001645/gr3/DOWNSAMPLED/image/jpeg/aaf0c45395dd58ca7a14641b807325ef/gr3.jpg https://s3-eu-west-1.amazonaws.com/prod-ucs-content-store-eu-west/content/pii:S1381116904001645/gr3/DOWNSAMPLED/image/jpeg/aaf0c45395dd58ca7a14641b807325ef/gr3.jpg gr3 gr3.jpg jpg 34799 339 323 IMAGE-DOWNSAMPLED 1-s2.0-S1381116904001645-gr4.sml https://s3.amazonaws.com/prod-ucs-content-store-us-east/content/pii:S1381116904001645/gr4/THUMBNAIL/image/gif/cf33f992ada7d502daf8297d1754e586/gr4.sml https://s3-eu-west-1.amazonaws.com/prod-ucs-content-store-eu-west/content/pii:S1381116904001645/gr4/THUMBNAIL/image/gif/cf33f992ada7d502daf8297d1754e586/gr4.sml gr4 gr4.sml sml 2237 94 113 IMAGE-THUMBNAIL 1-s2.0-S1381116904001645-gr4.jpg https://s3.amazonaws.com/prod-ucs-content-store-us-east/content/pii:S1381116904001645/gr4/DOWNSAMPLED/image/jpeg/243af22cd7a2b8ae9a68c8712fbfba93/gr4.jpg https://s3-eu-west-1.amazonaws.com/prod-ucs-content-store-eu-west/content/pii:S1381116904001645/gr4/DOWNSAMPLED/image/jpeg/243af22cd7a2b8ae9a68c8712fbfba93/gr4.jpg gr4 gr4.jpg jpg 19149 298 360 IMAGE-DOWNSAMPLED 1-s2.0-S1381116904001645-gr5.sml https://s3.amazonaws.com/prod-ucs-content-store-us-east/content/pii:S1381116904001645/gr5/THUMBNAIL/image/gif/93419c505376e1957628e43442768efd/gr5.sml https://s3-eu-west-1.amazonaws.com/prod-ucs-content-store-eu-west/content/pii:S1381116904001645/gr5/THUMBNAIL/image/gif/93419c505376e1957628e43442768efd/gr5.sml gr5 gr5.sml sml 2272 93 94 IMAGE-THUMBNAIL 1-s2.0-S1381116904001645-gr5.jpg https://s3.amazonaws.com/prod-ucs-content-store-us-east/content/pii:S1381116904001645/gr5/DOWNSAMPLED/image/jpeg/c6e26e8463cb0857842c18a9e47eaff0/gr5.jpg https://s3-eu-west-1.amazonaws.com/prod-ucs-content-store-eu-west/content/pii:S1381116904001645/gr5/DOWNSAMPLED/image/jpeg/c6e26e8463cb0857842c18a9e47eaff0/gr5.jpg gr5 gr5.jpg jpg 26371 345 347 IMAGE-DOWNSAMPLED 1-s2.0-S1381116904001645-gr6.sml https://s3.amazonaws.com/prod-ucs-content-store-us-east/content/pii:S1381116904001645/gr6/THUMBNAIL/image/gif/f456cd6f52b27d9510f4044d7de83b97/gr6.sml https://s3-eu-west-1.amazonaws.com/prod-ucs-content-store-eu-west/content/pii:S1381116904001645/gr6/THUMBNAIL/image/gif/f456cd6f52b27d9510f4044d7de83b97/gr6.sml gr6 gr6.sml sml 2204 84 125 IMAGE-THUMBNAIL 1-s2.0-S1381116904001645-gr6.gif https://s3.amazonaws.com/prod-ucs-content-store-us-east/content/pii:S1381116904001645/gr6/DOWNSAMPLED/image/gif/1bd8709ff3a6d2fa55ec63648a1fe327/gr6.gif https://s3-eu-west-1.amazonaws.com/prod-ucs-content-store-eu-west/content/pii:S1381116904001645/gr6/DOWNSAMPLED/image/gif/1bd8709ff3a6d2fa55ec63648a1fe327/gr6.gif gr6 gr6.gif gif 11643 298 444 IMAGE-DOWNSAMPLED 1-s2.0-S1381116904001645-gr7.sml https://s3.amazonaws.com/prod-ucs-content-store-us-east/content/pii:S1381116904001645/gr7/THUMBNAIL/image/gif/e543353e2823090c639e29b02378b9fd/gr7.sml https://s3-eu-west-1.amazonaws.com/prod-ucs-content-store-eu-west/content/pii:S1381116904001645/gr7/THUMBNAIL/image/gif/e543353e2823090c639e29b02378b9fd/gr7.sml gr7 gr7.sml sml 2188 91 125 IMAGE-THUMBNAIL 1-s2.0-S1381116904001645-gr7.gif https://s3.amazonaws.com/prod-ucs-content-store-us-east/content/pii:S1381116904001645/gr7/DOWNSAMPLED/image/gif/75c18ae3bbdfb560345b8eb94b840764/gr7.gif https://s3-eu-west-1.amazonaws.com/prod-ucs-content-store-eu-west/content/pii:S1381116904001645/gr7/DOWNSAMPLED/image/gif/75c18ae3bbdfb560345b8eb94b840764/gr7.gif gr7 gr7.gif gif 7228 258 355 IMAGE-DOWNSAMPLED 1-s2.0-S1381116904001645-gr8.sml https://s3.amazonaws.com/prod-ucs-content-store-us-east/content/pii:S1381116904001645/gr8/THUMBNAIL/image/gif/6262d9ed97a4913b149770a029a7bfb2/gr8.sml https://s3-eu-west-1.amazonaws.com/prod-ucs-content-store-eu-west/content/pii:S1381116904001645/gr8/THUMBNAIL/image/gif/6262d9ed97a4913b149770a029a7bfb2/gr8.sml gr8 gr8.sml sml 1626 37 125 IMAGE-THUMBNAIL 1-s2.0-S1381116904001645-gr8.gif https://s3.amazonaws.com/prod-ucs-content-store-us-east/content/pii:S1381116904001645/gr8/DOWNSAMPLED/image/gif/2e40ae75ef6f0df3f15e669497f8ea9d/gr8.gif https://s3-eu-west-1.amazonaws.com/prod-ucs-content-store-eu-west/content/pii:S1381116904001645/gr8/DOWNSAMPLED/image/gif/2e40ae75ef6f0df3f15e669497f8ea9d/gr8.gif gr8 gr8.gif gif 4940 114 383 IMAGE-DOWNSAMPLED MOLCAA 4574 S1381-1169(04)00164-5 10.1016/j.molcata.2004.03.019 Scheme 1 Fig. 1 Structure of investigated fluorinated ketones. Fig. 2 Enantioselective hydrogenation of trifluoroacetophenone (1): the effect of temperature (standard conditions, ∗2ml toluene+0.8μl TFA). Fig. 3 Enantioselective hydrogenation of trifluoroacetophenone (1): the effect of CD concentration (standard conditions). Fig. 4 Enantioselective hydrogenation of trifluoroacetophenone (1): the effect of conversion on ee (standard conditions). Fig. 5 Racemic and enantioselective hydrogenation of 1 and 5: the effect of substrate structure on rate (standard conditions). Fig. 6 J-modulated 13 C NMR spectra of 4-(trifluoroacetyl)biphenyl (5, bottom) and its zwitterionic adducts with quinuclidine (top). Fig. 7 Proposed adsorbed adduct complexes between DHCD + EtPy (A, B, C) and structure of oxonium cation (D) (Ac: acetyl; lactoyl: MeCH(OH)CO; pyruvoyl: MeC(O)C(O)). Fig. 8 Proposed adsorbed adduct complexes between DHCD + trifluoromethyl ketones with TFA additive (A) and without TFA (B) in toluene (X: H, Ph). Table 1 Enantiomeric excesses in the hydrogenation of fluoroketones over CD modified Pt–alumina in toluene a Substrate (Fig. 1) H2 pressure (bar) Time (h) Conversion (%) ee (%) 1 1 0.5 60 50 1 10 1 100 24 2 1–50 1–5 No reaction – 3 1–50 1–5 No reaction – 4 1 2 No reaction – 5 10 0.5 100 18 5 1 1 100 24 6 1 3.5 10 15 6 20 1 5 5 6 10 18 88 0 7 1–5 20 No reaction – 7 25–50 1 No reaction – 7 110 18 67 b – 8 1 5.5 50 11 a Experimental conditions: 25–45mg E4759, 2–5ml toluene, 298K, 2mg CD, 1mmol substrate. b Some unidentified compounds were formed. Table 2 Enantioselective hydrogenation of trifluoroacetophenone (1) over cinchonidine (CD) modified Pt–alumina a Entry TFA (μl) H2 pressure (bar) Time (h) Conversion (%) ee (%) 1 b,c 0 1 0.5 55 50 2 b,c 0 3 0.5 100 40 3 b,c 0 5 0.5 100 48 4 b,c 0 10 0.5 100 24 5 b,c 0 15 0.5 100 25 6 2.5 10 1 15 62 7 5 5 1 5 70 8 d 5 10 1 8.5 60 9 15 10 1 18 83 10 25 10 1 15 78 11 d 25 10 1 18 64 12 e 5 10 1 11 85 13 5 10 2 36 77 14 5 10 3 50 80 15 5 10 8 100 84 a Experimental conditions: 42–45mg E4759, 5ml toluene, 273K, 2mg CD, 0.25ml (1). b 298K. c 0.3mg CD. d 5mg CD. e 258K. Table 3 Enantioselective hydrogenation of trifluoroacetylbiphenyl (5) over cinchonidine (CD) modified Pt–alumina a Entry Temperature (K) H2 pressure (bar) TFA (μl) Time (h) Conversion (%) ee (%) 1 298 10 0 0.5 100 18 2 298 10 5 1 24 55 3 298 20 5 1 38 47 4 273 10 5 5 33 66 5 273 20 5 2 18 67 6 273 30 5 2 13 65 7 b 273 20 5 3 30 41 8 c 283 8 0 2 91 38 9 c 273 10 5 2 47 52 10 d 273 10 1000 5 50 33 11 273 10 1000 4 30 0 a Experimental conditions: see in Table 2; 0.46g (5). b Solvent: toluene+10μl H2O. c Solvent: toluene/AcOH (1/1). d Solvent: AcOH. ☆ Part 37: G. Szöllősi, P. Forgó, M. Bartók, Chirality (2003), Supplement 15, 82. Heterogeneous asymmetric reactions Part 38. Enantioselective hydrogenation of fluoroketones on Pt–alumina catalyst Tibor Varga a Károly Felföldi b Péter Forgó b Mihály Bartók a b ∗ a Organic Catalysis Research Group of the Hungarian Academy of Sciences, Dóm tér 8, H-6720 Szeged, Hungary b Department of Organic Chemistry, University of Szeged, Dóm tér 8, H-6720 Szeged, Hungary * Corresponding author. Fax: +36-62-544-200. We investigated the enantioselective heterogeneous hydrogenation of some fluoroketones, e.g. 4-(trifluoroacetyl)biphenyl (max. 67% ee), on modified Pt–alumina catalyst. The structure of the intermediate complex depends on whether hydrogenation is performed with or without trifluoroacetic acid. The enantioselective heterogeneous hydrogenation of 2,2,2-trifluoroacetophenone (1), 4-(trifluoroacetyl)biphenyl (5) and other fluoroketones (2–4, 6–8) on modified (by cinchonidine) Pt–alumina (E4759) in toluene solution with and without trifluoroacetic acid (TFA) has been investigated. The effects of the modifier concentration (0–10mmol/l), hydrogen pressure (1–50bar), temperature (263–301K) and conversion on the reaction rate and the enantioselectivity (ee) were studied. The achieved ee was 85% in case of 1, however 67% ee was achieved in case of 5. It has been proposed that the compounds responsible for chiral induction are the intermediate complexes, the structure of which depends on whether hydrogenation is performed with or without TFA. Keywords Hydrogenation Enantioselective Platinum–alumina Fluoroketones Cinchonidine Intermediate complexes 1 Introduction Pt/Al2O3 modified by cinchona alkaloids is a suitable system for the enantioselective hydrogenation of so-called activated ketones (including trifluoromethyl ketones). The significance of the subject is demonstrated by the great number of pertinent reviews (the most recent of which was published this year [1]). Optically active, fluor-containing alcohols are highly valued compounds both in the pharmaceutical and agricultural industries. Moreover, some have been successfully utilized as precursors of liquid crystalline compounds. Enantiomers of chiral trifluoromethyl alcohols may be prepared by resolving racemates [2], by chiral chemical reagents [3], by microbiological methods [4] and by reduction on homogeneous chiral transition metal catalysts [5]. The first time heterogeneous cinchona-modified Pt/Al2O3 catalyst system was applied for the preparation of chiral trifluoromethyl alcohols was the enantioselective hydrogenation of 2,2,2-trifluoroacetophenone and the corresponding alcohol was obtained in an ee of 50–60% [6–8]. Later the optimization of experimental conditions enabled the achievement of 74% [9] and 92% ee [10] (Scheme 1 ). When using polymer-stabilized nanoclusters, ee could not be increased over 30% even after the optimization of experimental conditions [11]. In a recently published work, Baiker and coworkers [12] report that, by theoretical calculations, “a correlation between the carbonyl orbital energy and the hydrogenation rate has been found”, which can also be applied to trifluoroacetophenones [12]. Enantioselective reduction of 5 has been attained biologically [13]. Reduction by baker’s yeast produces (R)-alcohol in high (96% ee) enantioselectivity, whereas reduction with Geotrichum candidium acetone powder yields the corresponding (S)-alcohol in excellent (99% ee) enantioselectivity. Knowing the advantages of heterogeneous enantioselective catalysis (for the sake of the same advantages, catalytically active metal complexes are also heterogenized [14–16]), it seemed promising to study the hydrogenation of 5 under such conditions. This manuscript presents the results of the hydrogenation of trifluoroacetophenone and other fluor-containing aromatic ketones (Fig. 1 ), comparing the latter ones to the hydrogenation of 2,2,2-trifluoroacetophenone (1). As hydrogenation of certain compounds did not take place or ee was very low under the applied experimental conditions (Table 1 ), the compounds discussed in detail in our manuscript are 1 and 4-(trifluoroacetyl)biphenyl (5). Elucidation of the reasons underlying the low reaction rate and observed ee in the case of compounds 2–4 and 6–8 necessitate further extensive studies. In the course of our studies on compounds 1 and 5, special attention was paid to the rate and selectivity of the hydrogenation reaction, bearing in mind our earlier observations [17] as well as the latest results of Baiker and coworkers [10,18]. 2 Experimental 2.1 Materials AcOH, toluene, naphtalene, biphenyl, ferrocene, (R)-(−)-α-methoxy-α-(trifluoromethyl)phenylacetyl chloride and cinchonidine (CD) were purchased from Fluka. Trifluoroacetic acid (TFA), trifluoroacetic anhydride, quinuclidine, 1,4-diazabicyclo[2.2.2]octane (Dabco) and substrates 1, 6, 7, 8 were Aldrich products. These chemicals—except 1—were used as-received. 1 was distilled before use to attain 99.5% purity. The substrates 2–5 were synthetized by Friedel–Crafts reaction, according to literature [4,19]. The substrates were purified by filtration through silica gel 60 (Fluka). Pretreated 5% (w/w) Engelhard platinum–alumina catalyst (E4759) was used [20,21]. 2.2 Hydrogenation Hydrogenation was performed in an atmospheric batch reactor and in a Berghof Bar 45 autoclave. The catalytic system including the catalyst and 2–5ml of solvent was purged three times with hydrogen after prehydrogenation (30min) of the catalyst. The calculated amount of modifier and 1–2mmol of substrate were introduced and stirred (1000–1200rpm) in the presence of hydrogen for the required reaction time. Standard conditions were: 25–30mg E4759, and 2ml toluene (at 1bar H2 pressure), 42–45mg E4759 and 5ml toluene (at H2 pressure > 1bar), 293–298K, 0.5mmol/l CD, 1bar H2 pressure, 1000–1200rpm, 1mmol or 2mmol substrate. 2.3 Analysis The conversion and ee were calculated using GC data. In the hydrogenation reactions with the presence of CD, always the (R)-enantiomer was formed in excess. The identification of the product and the enantiomeric excesses [ee (%) = ([R] – [S]) × 100/([R] + [S])] were monitored by gas chromatography (HP 5890 GC-FID, using 30m long Cyclodex-B capillary column, uncertainty ±2%). The enantiomeric excesses in case of 5 were determined by the Mosher esters method [22]. The product was reacted with (R)-(−)-α-methoxy-α-(trifluoromethyl)phenylacetyl chloride after work-up of the hydrogenation reaction mixture. The ester–methyne signal (R,S-6.29ppm; R,R-6.37ppm) in the 1 H NMR spectrum was used to determine the enantiomeric ratio, the values were obtained through routine integration processes. The major enantiomer was determined by measurement of the optical rotation [13] (S-enantiomer: [α]D 23+29.7 (c 0.54, CHCl3)). 2.4 NMR measurements Bruker Avance DRX500 NMR spectrometer was used in all experiments operating at 11.7T magnetic field strength (500.13MHz 1 H NMR and 125.77MHz 13 C NMR frequency). Samples of approximately 20mg of the carbonyl compounds (1, 5) were prepared in 0.6ml acetone (d6) solution and the quinuclidine or Dabco was added in a five times higher molar excess [23], then the solution was transferred to a 5mm NMR tube. J-modulated 13 C NMR spectra were recorded at room temperature in approximately 12h long experiments. 3 Results and discussion The initial aim of these experiments was to study the enantioselective hydrogenation of 1 under mild experimental conditions (H2 pressure 1bar, low temperature, minimal CD concentration), just like in the case of ethyl pyruvate (EtPy) [21], hoping that optimization will allow the realization of high ee. Preliminary results, however, indicated that the behavior of the two systems (EtPy, 1) are quite different (lower reaction rates in AcOH than those measured for EtPy hydrogenation; low ee in other solvents). Observations made in the course of EtPy hydrogenation in acids of various strengths [17] were also made use of. Because the highest ee was obtained using TFA as additive, most of the experiments on both 1 and 5 were performed in a solvent mixture containing toluene+TFA. 3.1 Enantioselective hydrogenation of 2,2,2-trifluoroacetophenone (1) Some characteristic results of the experiments in toluene are summarized in Figs. 2–4 . The figures show the effects of catalyst quantity, the concentration of compound 1 and temperature on the rate of hydrogenation and on ee (Figs. 2 and 3), furthermore the effect of the progress of conversion on ee (Fig. 4). The results allow the following conclusions to be drawn. The data of preliminary experiments show that under standard experimental conditions, in the presence of catalyst in excess quantities (30mg), at temperature range of 273–293K and at values of 1000–1200rpm hydrogenation takes place within the kinetic range. It has been verified [7,8] that higher ee values are attainable mainly in apolar and mildly polar solvents. The interaction between 1 and CD, which is responsible for ee, is presumably inhibited probably because of the competition of CD and 1 during adsorption. The data presented here—in agreement with the results in Fig. 2—make it obvious that the rate of hydrogenation depends on temperature, whereas ee hardly changes. It is also shown in Fig. 2 that, under identical experimental conditions, the addition of TFA greatly reduces reaction rates. According to the experimental data presented in Fig. 3, a moderate CD concentration (0.5mmol/l) was advantageous for ee, unlike the case of EtPy where the highest ee could be attained at 0.1mmol/l CD in toluene [24] and at 0.01mmol/l CD in AcOH [21], under similarly mild conditions. An additional difference can be observed in the rate acceleration of the hydrogenation of EtPy and 1. The reaction rate acceleration on the modified catalyst is 10–20-fold for EtPy, but only 2–3-fold for 1. As regards changes in reaction rate and enantioselectivity as a function of percentage conversion, according to Baiker et al.’s studies in dichlorobenzene and toluene [6,25] both ee and rate increased during the initial period of the reaction, below 10–20% conversion. By the evidence of the data displayed in Fig. 4, no such initial period could be observed under the standard conditions studied. Data on the dependence of enantioselectivity on hydrogen pressure, TFA concentration and percentage conversion are summarized in Table 2 . According to these measurements, increasing hydrogen pressure under identical conditions did not favor an increase in ee (entries 1–5). When TFA was added, however, hydrogen pressure was increased over 1bar because of the slow reaction at 1bar. For this reason hydrogenation in the presence of the additive TFA was mostly carried out at a hydrogen pressure of 10bar. The experiments suggest that to attain higher ee values, optimal TFA concentration is necessary, which in our case is 5–15μl/5ml toluene. As regards optimal TFA concentration, the data in [10], TFA/CD = 9.6mol/mol and TFA/React. = 9.6mol/mol may lead to some confusion; the correct value is probably TFA/CD = 9.6mol/mol. In the case of TFA/5 = 9.6mol/mol the reaction was very slow and racemic mixture was formed. As shown by the data in Table 2, TFA significantly increases ee, in accordance with results published earlier [10,17]. Under these experimental conditions the progress of conversion had a favorable effect on ee (entries 13–15). 3.2 Enantioselective hydrogenation of 4-(trifluoroacetyl)biphenyl (5) Enantioselective hydrogenation of 5 under the conditions of heterogeneous catalysis is not mentioned in the literature. In the case of 1, from the solvents checked toluene was found to be a good solvent; however, high ee can only be attained in the presence of TFA as additive. Therefore the majority of measurements involving 5 were performed in a solvent mixture of toluene+TFA, under the conditions found optimal for 1 (H2 pressure > 1bar, 5μl TFA). The results are summarized in Fig. 5 and Table 3 . Examination of the rates of hydrogenation reactions revealed that, unexpectedly, racemic hydrogenation is significantly faster for 5 than for 1, whereas enantioselective hydrogenation proceeds at identical rates. The value of ee attained under identical experimental conditions is 53% for 1 but only 24% for 5. Interpretation of these data necessitates further studies. The data in Table 3 allow to conclude that (i) the highest ee is 67%, in the attainment of which the additive TFA and low temperature (273K) play a determinant role at hydrogen pressures of 10–30bar; (ii) under similar conditions, at 298K ee is nearly 20% lower; (iii) ee is increased and reaction rate is decreased by TFA. 3.3 NMR measurements The zwitterionic adducts were studied by NMR spectroscopy. 1 as well as 5 were used as strong electrophile agents and adducts were created with tertiary amines quinuclidine and Dabco in acetone solution. Since the adduct formation is an equilibrium process, the amine molar amount was five times higher than that of the carbonyl compound. The interaction was monitored by the chemical shift change of the carbonyl signal in the 13 C NMR spectrum (Fig. 6 ). The carbonyl signal has a quartet multiplet structure due to the heteronuclear coupling to three fluor atoms in the methyl group with a chemical shift of 181.2ppm in 1 and 180.7ppm in 5. The decrease in the chemical shift can be attributed to the presence of the zwitterionic form. 1-Dabco adduct was reported earlier [23] and was not studied here. As the adduct forms a 87.7ppm upfield shift takes place to 93.5ppm in case 1 and quinuclidine. Similar tendency was observed when 5 was used to produce the adduct, a 87.2ppm upfield shift was detected. The same upfield shift was recorded when Dabco was used as a substrate. These considerable changes in the carbonyl chemical shift confirm unambiguously the presence of the zwitterionic form when both 1 and 5 were used as electrophile agents. 3.4 Interpretation of the enantioselective hydrogenation of trifluoromethyl ketones The majority of authors assume (see [1] and the references cited therein) that chiral induction of heterogeneous catalytical enantioselective hydrogenation of activated ketones takes place on the chirally modified platinum surface (adsorption model). In the case of EtPy hydrogenation, the adsorption model gives an identical explanation for the chemical events taking place in the two different solvents; the only difference is the structure of the intermediate complex. In AcOH, EtPy is bonded to the protonated quinuclidine via a hydrogen bond (Fig. 7A ), whereas in toluene, half-hydrogenated EtPy is bonded to the nitrogen of the quinuclidine, also via hydrogen bond (Fig. 7B ). Moreover, we assumed that in AcOH the stabilization of the intermediate is also promoted by the oxonium cations (Fig. 7D ) and their dendrimers generated on the surface under these conditions [21,26]. Besides, it cannot be excluded that the reaction mechanism in toluene is entirely different from that operating in AcOH. In toluene we proposed [24,27] that the modifier and the substrate (in the present case, EtPy) participate in the formation of the surface complex as ligands of the surface Pt atoms (Fig. 7C ). These “ligands” bind to Pt via their unbonded electron pairs. As regards studies aimed at the interpretation of the enantioselective hydrogenation of trifluoroacetyl ketones, considerably fewer works have been published in the literature on these than on EtPy. The results published by Baiker et al. [8–10,12,18] and our own experimental observations ([7,17], this work) are all that can be referred to. On this basis it appears that there is a significant difference between the mechanism of the enantioselective hydrogenation of this type of compound in toluene and that in toluene+TFA. For the interpretation of hydrogenation in the presence of TFA, a certain kind of explanation for the acid effect was made possible by earlier NMR studies [17]. The recently published results of Baiker and coworkers [18] in the field of theoretical calculations and IR-spectroscopic analysis, however, not only supplemented certain statements in [17] but also led to the formulation of a novel reaction mechanism, which is also in agreement with our experimental data, inasmuch as it gives a reasonable interpretation of the chemistry in the presence of TFA additive. According to this reaction mechanism, the structure of the surface complex responsible for chiral induction has the characteristics of structure A outlined in Fig. 8 . The structure of the surface complex forming in the course of enantioselective hydrogenation in the absence of acids should naturally be significantly different from structure A in Fig. 8. Based on our present knowledge, the intermediate complexes proposed for the interpretation of EtPy hydrogenation (Fig. 7B and C ) cannot be excluded either. The results of the NMR studies presented in this paper, however, prompted us to put forth again the surface complex earlier proposed by us for the hydrogenation of EtPy in the presence of the chiral modifier β-isocinchonine (β-ICN) [28]. This surface complex is shown as structure B in Fig. 8. In this intermediate, the nucleophilic N of the quinuclidine skeleton of DHCD interacts with the electrophilic carbon atom of the carbonyl group of the trifluoromethyl ketone. The presence of a B-like intermediate is supported not only by the reactions of aldehydes and ketones with primary and secondary amines, also utilized by the organic chemical industry, but also by the zwitterionic adducts resulting from the reaction between the compounds studied here (trifluoromethyl ketones) and tertiary amines [23]. The NMR studies of strongly electrophilic ketones and tertiary amine, presented here (see Section 3.3) also convincingly prove the formation of adducts of the zwitterionic type. By the way, compounds containing this type of bond are also found among natural alkaloids [29]. 4 Conclusion Results so far published on the enantioselective hydrogenation of fluoroketones, a group of activated ketones on chiral Pt–alumina catalysts have shown that the Orito reaction [30] is also suitable for the preparation of chiral alcohols containing trifluoromethyl groups. The available information suggests that the compounds responsible for chiral induction are different intermediates, the structure of which depends mostly on the acidic or non-acidic nature of the hydrogenation medium. In the presence of TFA, there is competition between the proton and the electrophilic carbon atom of the carbonyl group of the trifluoromethyl ketone for the unbonded electron pair of the nucleophilic nitrogen atom of the quinuclidine skeleton of CD. The results show that the winner is the proton. In toluene (in the absence of TFA) there is no such competitor; the intermediate will therefore have a different structure. Further tasks are to attempt the identification of the intermediate adducts in solution by suitable MS methods and to study the effect of the stability of zwitterion-like intermediates on enantioselectivity. Acknowledgements Financial support by the Hungarian Nation Science Foundation (OTKA Grant TS 044690 and T 042466) is highly appreciated. References [1] M Studer H.-U Blaser Ch Exner Adv. Synth. Catal. 345 2003 45 [2] W.H Pirkle M.S Hoekstra J. Org. Chem. 39 1974 3904 [3] P.V Ramachandran A.V Teodorevic H.C Brown Tetrahedron 49 1993 1725 [4] M Bucciarelli A Formi I Moretti G Torre Synthesis 11 1983 897 [5] R Noyori R Ohkuma Angew. Chem. Int. Ed. 40 2001 40 [6] T Mallat M Bodmer A Baiker Catal. Lett. 44 1997 95 [7] K Balázsik B Török K Felföldi M Bartók Ultrason. Sonochem. 5 1999 149 [8] M Bodmer T Mallat A Baiker Chem. Ind. 75 1998 75 [9] M von Arx T Mallat A Baiker J. Catal. 193 2000 161 [10] M von Arx T Mallat A Baiker Tetrahedron: Asymmetry 12 2001 3089 [11] J Zhang X Yan H Liu J. Mol. Catal. A: Chem. 175 2001 125 [12] A Vargas T Bürgi M von Arx R Hess A Baiker J. Catal. 209 2002 489 [13] T Fujisawa Y Onogawa A Sato T Mitsuya M Shimizu Tetrahedron 54 1998 4267 [14] D.E. De Vos, I.F.J. Vankelecom, P.A. Jacobs (Eds.), Chiral Catalyst Immobilization and Recycling, Wiley-VCH, Weinheim, 2000. [15] C Reyes Y Gao A Zsigmond P Goel N Mahata S.K Tanielyan R.L Augustine Chem. Ind. 89 2002 627 R.L Augustine S.K Tanielyan N Mahata Y Gao A Zsigmond H Yang Appl. Catal., A: Gen. 256 2003 69 [16] Á Zsigmond K Bogár F Notheisz J. Catal. 213 2003 103 [17] B Török K Balázsik K Felföldi M Bartók Stud. Surf. Sci. Catal. 130 2000 3381 [18] M. von Arx, T. Bürgi, T. Mallat, A. Baiker, Chem. Eur. J. (2002) 1430. [19] E.B Sokolova G.P Chlykin T.A Malikova Zh. Obshch. Khim. 43 1973 1333 [20] M Bartók Gy Szöllősi K Balázsik T Bartók J. Mol. Catal., A: Chem. 177 2002 299 [21] M Bartók K Balázsik Gy Szöllősi T Bartók J. Catal. 205 2002 168 [22] J.A Dale H.S Mosher J. Am. Chem. Soc. 95 1973 512 [23] M.L.M Schilling H.D Roth W.C Herndon J. Am. Chem. Soc. 102 1980 4271 [24] M Bartók K Balázsik T Bartók Z Kele Catal. Lett. 87 2003 235 [25] T Mallat Z Bodnar B Minder K Borszeky A Baiker J. Catal. 168 1997 183 [26] M Bartók P.T Szabó T Bartók Gy Szöllősi K Balázsik Rapid Commun. Mass Spectrom. 15 2001 65 [27] M Bartók K Balázsik F Notheisz React. Kinet. Catal. Lett. 77 2002 363 [28] M. Bartók, M. Sutyinszki, K. Felföldi, Gy. Szöllősi, Chem. Commun. (2002) 1130. [29] L.H. Briggs, R.C. Cambie, B.J. Candy, G.M. O’Donovan, R.H. Russell, R.N. Seelye, J. Chem. Soc. (1965) 2492. [30] Y. Orito, S. Imai, S. Niva, J. Chem. Soc. Jpn. (1979) 1118 Y. Orito, S. Imai, S. Niva, J. Chem. Soc. Jpn. (1980) 670.",
      "scopus-id": "2542456591",
      "coredata": {
        "eid": "1-s2.0-S1381116904001645",
        "dc:description": "The enantioselective heterogeneous hydrogenation of 2,2,2-trifluoroacetophenone (1), 4-(trifluoroacetyl)biphenyl (5) and other fluoroketones (2–4, 6–8) on modified (by cinchonidine) Pt–alumina (E4759) in toluene solution with and without trifluoroacetic acid (TFA) has been investigated. The effects of the modifier concentration (0–10mmol/l), hydrogen pressure (1–50bar), temperature (263–301K) and conversion on the reaction rate and the enantioselectivity (ee) were studied. The achieved ee was 85% in case of 1, however 67% ee was achieved in case of 5. It has been proposed that the compounds responsible for chiral induction are the intermediate complexes, the structure of which depends on whether hydrogenation is performed with or without TFA.",
        "openArchiveArticle": "false",
        "prism:coverDate": "2004-07-12",
        "openaccessUserLicense": null,
        "prism:aggregationType": "Journal",
        "prism:url": "https://api.elsevier.com/content/article/pii/S1381116904001645",
        "dc:creator": [
          {
            "@_fa": "true",
            "$": "Varga, Tibor"
          },
          {
            "@_fa": "true",
            "$": "Felföldi, Károly"
          },
          {
            "@_fa": "true",
            "$": "Forgó, Péter"
          },
          {
            "@_fa": "true",
            "$": "Bartók, Mihály"
          }
        ],
        "link": [
          {
            "@_fa": "true",
            "@rel": "self",
            "@href": "https://api.elsevier.com/content/article/pii/S1381116904001645"
          },
          {
            "@_fa": "true",
            "@rel": "scidir",
            "@href": "https://www.sciencedirect.com/science/article/pii/S1381116904001645"
          }
        ],
        "dc:format": "application/json",
        "openaccessType": null,
        "pii": "S1381-1169(04)00164-5",
        "prism:volume": "216",
        "prism:publisher": "Published by Elsevier B.V.",
        "dc:title": "Heterogeneous asymmetric reactions Part 38. Enantioselective hydrogenation of fluoroketones on Pt–alumina catalyst",
        "prism:copyright": "Copyright © 2004 Published by Elsevier B.V.",
        "prism:issueName": "Heterogeneous Chiral Catalysis",
        "openaccess": "0",
        "prism:issn": "13811169",
        "prism:issueIdentifier": "2",
        "dcterms:subject": [
          {
            "@_fa": "true",
            "$": "Hydrogenation"
          },
          {
            "@_fa": "true",
            "$": "Enantioselective"
          },
          {
            "@_fa": "true",
            "$": "Platinum–alumina"
          },
          {
            "@_fa": "true",
            "$": "Fluoroketones"
          },
          {
            "@_fa": "true",
            "$": "Cinchonidine"
          },
          {
            "@_fa": "true",
            "$": "Intermediate complexes"
          }
        ],
        "openaccessArticle": "false",
        "prism:publicationName": "Journal of Molecular Catalysis A: Chemical",
        "prism:number": "2",
        "openaccessSponsorType": null,
        "prism:pageRange": "181-187",
        "prism:endingPage": "187",
        "pubType": "fla",
        "prism:coverDisplayDate": "12 July 2004",
        "prism:doi": "10.1016/j.molcata.2004.03.019",
        "prism:startingPage": "181",
        "dc:identifier": "doi:10.1016/j.molcata.2004.03.019",
        "openaccessSponsorName": null
      },
      "objects": {
        "object": [
          {
            "@category": "thumbnail",
            "@height": "14",
            "@width": "25",
            "@_fa": "true",
            "$": "https://api.elsevier.com/content/object/eid/1-s2.0-S1381116904001645-si6.gif?httpAccept=%2A%2F%2A",
            "@multimediatype": "GIF image file",
            "@type": "ALTIMG",
            "@size": "192",
            "@ref": "si6",
            "@mimetype": "image/gif"
          },
          {
            "@category": "thumbnail",
            "@height": "14",
            "@width": "25",
            "@_fa": "true",
            "$": "https://api.elsevier.com/content/object/eid/1-s2.0-S1381116904001645-si5.gif?httpAccept=%2A%2F%2A",
            "@multimediatype": "GIF image file",
            "@type": "ALTIMG",
            "@size": "192",
            "@ref": "si5",
            "@mimetype": "image/gif"
          },
          {
            "@category": "thumbnail",
            "@height": "14",
            "@width": "25",
            "@_fa": "true",
            "$": "https://api.elsevier.com/content/object/eid/1-s2.0-S1381116904001645-si4.gif?httpAccept=%2A%2F%2A",
            "@multimediatype": "GIF image file",
            "@type": "ALTIMG",
            "@size": "192",
            "@ref": "si4",
            "@mimetype": "image/gif"
          },
          {
            "@category": "thumbnail",
            "@height": "14",
            "@width": "20",
            "@_fa": "true",
            "$": "https://api.elsevier.com/content/object/eid/1-s2.0-S1381116904001645-si3.gif?httpAccept=%2A%2F%2A",
            "@multimediatype": "GIF image file",
            "@type": "ALTIMG",
            "@size": "149",
            "@ref": "si3",
            "@mimetype": "image/gif"
          },
          {
            "@category": "thumbnail",
            "@height": "14",
            "@width": "20",
            "@_fa": "true",
            "$": "https://api.elsevier.com/content/object/eid/1-s2.0-S1381116904001645-si2.gif?httpAccept=%2A%2F%2A",
            "@multimediatype": "GIF image file",
            "@type": "ALTIMG",
            "@size": "149",
            "@ref": "si2",
            "@mimetype": "image/gif"
          },
          {
            "@category": "thumbnail",
            "@height": "14",
            "@width": "25",
            "@_fa": "true",
            "$": "https://api.elsevier.com/content/object/eid/1-s2.0-S1381116904001645-si1.gif?httpAccept=%2A%2F%2A",
            "@multimediatype": "GIF image file",
            "@type": "ALTIMG",
            "@size": "192",
            "@ref": "si1",
            "@mimetype": "image/gif"
          },
          {
            "@category": "thumbnail",
            "@height": "22",
            "@width": "125",
            "@_fa": "true",
            "$": "https://api.elsevier.com/content/object/eid/1-s2.0-S1381116904001645-fx1.sml?httpAccept=%2A%2F%2A",
            "@multimediatype": "GIF image file",
            "@type": "IMAGE-THUMBNAIL",
            "@size": "622",
            "@ref": "fx1",
            "@mimetype": "image/gif"
          },
          {
            "@category": "standard",
            "@height": "66",
            "@width": "376",
            "@_fa": "true",
            "$": "https://api.elsevier.com/content/object/eid/1-s2.0-S1381116904001645-fx1.gif?httpAccept=%2A%2F%2A",
            "@multimediatype": "GIF image file",
            "@type": "IMAGE-DOWNSAMPLED",
            "@size": "2897",
            "@ref": "fx1",
            "@mimetype": "image/gif"
          },
          {
            "@category": "thumbnail",
            "@height": "24",
            "@width": "125",
            "@_fa": "true",
            "$": "https://api.elsevier.com/content/object/eid/1-s2.0-S1381116904001645-sc1.sml?httpAccept=%2A%2F%2A",
            "@multimediatype": "GIF image file",
            "@type": "IMAGE-THUMBNAIL",
            "@size": "1329",
            "@ref": "sc1",
            "@mimetype": "image/gif"
          },
          {
            "@category": "standard",
            "@height": "34",
            "@width": "179",
            "@_fa": "true",
            "$": "https://api.elsevier.com/content/object/eid/1-s2.0-S1381116904001645-sc1.gif?httpAccept=%2A%2F%2A",
            "@multimediatype": "GIF image file",
            "@type": "IMAGE-DOWNSAMPLED",
            "@size": "1660",
            "@ref": "sc1",
            "@mimetype": "image/gif"
          },
          {
            "@category": "thumbnail",
            "@height": "91",
            "@width": "106",
            "@_fa": "true",
            "$": "https://api.elsevier.com/content/object/eid/1-s2.0-S1381116904001645-gr1.sml?httpAccept=%2A%2F%2A",
            "@multimediatype": "GIF image file",
            "@type": "IMAGE-THUMBNAIL",
            "@size": "1960",
            "@ref": "gr1",
            "@mimetype": "image/gif"
          },
          {
            "@category": "standard",
            "@height": "175",
            "@width": "203",
            "@_fa": "true",
            "$": "https://api.elsevier.com/content/object/eid/1-s2.0-S1381116904001645-gr1.gif?httpAccept=%2A%2F%2A",
            "@multimediatype": "GIF image file",
            "@type": "IMAGE-DOWNSAMPLED",
            "@size": "4016",
            "@ref": "gr1",
            "@mimetype": "image/gif"
          },
          {
            "@category": "thumbnail",
            "@height": "93",
            "@width": "91",
            "@_fa": "true",
            "$": "https://api.elsevier.com/content/object/eid/1-s2.0-S1381116904001645-gr2.sml?httpAccept=%2A%2F%2A",
            "@multimediatype": "GIF image file",
            "@type": "IMAGE-THUMBNAIL",
            "@size": "2438",
            "@ref": "gr2",
            "@mimetype": "image/gif"
          },
          {
            "@category": "standard",
            "@height": "340",
            "@width": "333",
            "@_fa": "true",
            "$": "https://api.elsevier.com/content/object/eid/1-s2.0-S1381116904001645-gr2.jpg?httpAccept=%2A%2F%2A",
            "@multimediatype": "JPEG image file",
            "@type": "IMAGE-DOWNSAMPLED",
            "@size": "29426",
            "@ref": "gr2",
            "@mimetype": "image/jpeg"
          },
          {
            "@category": "thumbnail",
            "@height": "93",
            "@width": "89",
            "@_fa": "true",
            "$": "https://api.elsevier.com/content/object/eid/1-s2.0-S1381116904001645-gr3.sml?httpAccept=%2A%2F%2A",
            "@multimediatype": "GIF image file",
            "@type": "IMAGE-THUMBNAIL",
            "@size": "2729",
            "@ref": "gr3",
            "@mimetype": "image/gif"
          },
          {
            "@category": "standard",
            "@height": "339",
            "@width": "323",
            "@_fa": "true",
            "$": "https://api.elsevier.com/content/object/eid/1-s2.0-S1381116904001645-gr3.jpg?httpAccept=%2A%2F%2A",
            "@multimediatype": "JPEG image file",
            "@type": "IMAGE-DOWNSAMPLED",
            "@size": "34799",
            "@ref": "gr3",
            "@mimetype": "image/jpeg"
          },
          {
            "@category": "thumbnail",
            "@height": "94",
            "@width": "113",
            "@_fa": "true",
            "$": "https://api.elsevier.com/content/object/eid/1-s2.0-S1381116904001645-gr4.sml?httpAccept=%2A%2F%2A",
            "@multimediatype": "GIF image file",
            "@type": "IMAGE-THUMBNAIL",
            "@size": "2237",
            "@ref": "gr4",
            "@mimetype": "image/gif"
          },
          {
            "@category": "standard",
            "@height": "298",
            "@width": "360",
            "@_fa": "true",
            "$": "https://api.elsevier.com/content/object/eid/1-s2.0-S1381116904001645-gr4.jpg?httpAccept=%2A%2F%2A",
            "@multimediatype": "JPEG image file",
            "@type": "IMAGE-DOWNSAMPLED",
            "@size": "19149",
            "@ref": "gr4",
            "@mimetype": "image/jpeg"
          },
          {
            "@category": "thumbnail",
            "@height": "93",
            "@width": "94",
            "@_fa": "true",
            "$": "https://api.elsevier.com/content/object/eid/1-s2.0-S1381116904001645-gr5.sml?httpAccept=%2A%2F%2A",
            "@multimediatype": "GIF image file",
            "@type": "IMAGE-THUMBNAIL",
            "@size": "2272",
            "@ref": "gr5",
            "@mimetype": "image/gif"
          },
          {
            "@category": "standard",
            "@height": "345",
            "@width": "347",
            "@_fa": "true",
            "$": "https://api.elsevier.com/content/object/eid/1-s2.0-S1381116904001645-gr5.jpg?httpAccept=%2A%2F%2A",
            "@multimediatype": "JPEG image file",
            "@type": "IMAGE-DOWNSAMPLED",
            "@size": "26371",
            "@ref": "gr5",
            "@mimetype": "image/jpeg"
          },
          {
            "@category": "thumbnail",
            "@height": "84",
            "@width": "125",
            "@_fa": "true",
            "$": "https://api.elsevier.com/content/object/eid/1-s2.0-S1381116904001645-gr6.sml?httpAccept=%2A%2F%2A",
            "@multimediatype": "GIF image file",
            "@type": "IMAGE-THUMBNAIL",
            "@size": "2204",
            "@ref": "gr6",
            "@mimetype": "image/gif"
          },
          {
            "@category": "standard",
            "@height": "298",
            "@width": "444",
            "@_fa": "true",
            "$": "https://api.elsevier.com/content/object/eid/1-s2.0-S1381116904001645-gr6.gif?httpAccept=%2A%2F%2A",
            "@multimediatype": "GIF image file",
            "@type": "IMAGE-DOWNSAMPLED",
            "@size": "11643",
            "@ref": "gr6",
            "@mimetype": "image/gif"
          },
          {
            "@category": "thumbnail",
            "@height": "91",
            "@width": "125",
            "@_fa": "true",
            "$": "https://api.elsevier.com/content/object/eid/1-s2.0-S1381116904001645-gr7.sml?httpAccept=%2A%2F%2A",
            "@multimediatype": "GIF image file",
            "@type": "IMAGE-THUMBNAIL",
            "@size": "2188",
            "@ref": "gr7",
            "@mimetype": "image/gif"
          },
          {
            "@category": "standard",
            "@height": "258",
            "@width": "355",
            "@_fa": "true",
            "$": "https://api.elsevier.com/content/object/eid/1-s2.0-S1381116904001645-gr7.gif?httpAccept=%2A%2F%2A",
            "@multimediatype": "GIF image file",
            "@type": "IMAGE-DOWNSAMPLED",
            "@size": "7228",
            "@ref": "gr7",
            "@mimetype": "image/gif"
          },
          {
            "@category": "thumbnail",
            "@height": "37",
            "@width": "125",
            "@_fa": "true",
            "$": "https://api.elsevier.com/content/object/eid/1-s2.0-S1381116904001645-gr8.sml?httpAccept=%2A%2F%2A",
            "@multimediatype": "GIF image file",
            "@type": "IMAGE-THUMBNAIL",
            "@size": "1626",
            "@ref": "gr8",
            "@mimetype": "image/gif"
          },
          {
            "@category": "standard",
            "@height": "114",
            "@width": "383",
            "@_fa": "true",
            "$": "https://api.elsevier.com/content/object/eid/1-s2.0-S1381116904001645-gr8.gif?httpAccept=%2A%2F%2A",
            "@multimediatype": "GIF image file",
            "@type": "IMAGE-DOWNSAMPLED",
            "@size": "4940",
            "@ref": "gr8",
            "@mimetype": "image/gif"
          }
        ]
      },
      "link": {
        "@rel": "abstract",
        "@href": "https://api.elsevier.com/content/abstract/scopus_id/2542456591"
      }
    }
  }
}