{
  "metadata": {
    "title": "Selective hydrogenation of phenylacetylene over a nano-Pd/α-Al<ce:inf loc=post>2</ce:inf>O<ce:inf loc=post>3</ce:inf> catalyst",
    "authors": "; ; ",
    "journal": "Journal of Molecular Catalysis A: Chemical",
    "date": "2014-01-31",
    "doi": "10.1016/j.molcata.2013.10.008",
    "abstract": "",
    "uri": "https://api.elsevier.com/content/article/pii/S1381116913003804",
    "pii": "S1381116913003804"
  },
  "fulltext": {
    "full-text-retrieval-response": {
      "scopus-eid": "2-s2.0-84887106132",
      "originalText": "serial JL 271358 291210 291744 291790 291809 31 Journal of Molecular Catalysis A: Chemical JOURNALMOLECULARCATALYSISACHEMICAL 2013-10-19 2013-10-19 2013-11-24T12:45:58 1-s2.0-S1381116913003804 S1381-1169(13)00380-4 S1381116913003804 10.1016/j.molcata.2013.10.008 S300 S300.1 FULL-TEXT 1-s2.0-S1381116913X00123 2015-05-15T05:56:33.63776-04:00 0 0 20140101 20140131 2014 2013-10-19T00:00:00Z articleinfo crossmark dco dateupdated tomb dateloaded datesearch indexeddate volumelist yearnav absattachment articletitlenorm authfirstinitialnorm authfirstsurnamenorm cid cids contenttype copyright dateloadedtxt docsubtype doctype doi eid ewtransactionid hubeid issn issnnorm itemstage itemtransactionid itemweight openaccess openarchive pg pgfirst pglast pii piinorm pubdateend pubdatestart pubdatetxt pubyr sortorder srctitle srctitlenorm srctype subheadings suppl volfirst volissue webpdf webpdfpagecount figure table body mmlmath acknowledge affil articletitle auth authfirstini authfull authkeywords authlast highlightsabst primabst ref specialabst alllist content subj ssids 1381-1169 13811169 true 381 381 C Volume 381 11 61 69 61 69 201401 January 2014 2014-01-01 2014-01-31 2014 article fla Copyright © 2013 Elsevier B.V. All rights reserved. SELECTIVEHYDROGENATIONPHENYLACETYLENEOVERANANOPDAL2O3CATALYST HU J 1 Introduction 2 Experimental 2.1 Catalyst preparation 2.1.1 Preparation of Pd nanoparticles 2.1.2 Preparation of α-Al2O3 2.1.3 Preparation of nano-Pd/α-Al2O3 2.2 Catalyst characterization 2.3 Catalyst test 3 Results and discussion 3.1 Physicochemical characterization 3.2 Catalytic performance 4 Conclusion Acknowledgements References HOSSAIN 2012 308 321 M CAVANI 1995 219 239 F WILHITE 2002 3345 3350 B STUDT 2008 1320 1322 F BRIDIER 2010 8412 8419 B ARMBRUSTER 2012 690 693 M VILE 2012 8620 8623 G BAUTISTA 1988 205 213 F CHEN 2012 3604 3611 X PELLEGATTA 2002 55 61 J LEITMANNOVA 2010 34 39 E DURACZYNSKA 2009 166 172 D LI 2012 4934 4941 C LI 2012 69 75 C DUCA 1996 269 284 D DOMINGUEZDOMINGUEZ 2006 74 81 S RUTA 2008 17814 17819 M NIKOLAEV 2009 182 189 S NIKOLAEV 2010 288 292 S LOPEZ 2012 1379 1391 N WU 2013 168 197 B SHAO 2010 1555 1558 Z REDON 2011 31 42 R DOMINGUEZDOMINGUEZ 2008 87 95 S WEERACHAWANASAK 2009 199 205 P WEERACHAWANASAK 2008 133 139 P MCKENNA 2012 632 638 F SARKANY 2003 283 292 A PANPRANOT 2007 29 35 J AHN 2007 151 157 I MARINASTORGA 2005 67 74 N MASTALIR 2007 170 178 A TIENGCHAD 2011 910 916 N NACHIANGMAI 2011 1149 1155 C DOMINGUEZDOMINGUEZ 2008 3827 3834 S WONGWARANON 2008 553 558 N RASE 2000 133 H HANDBOOKCOMMERCIALCATALYSTSHETEROGENEOUSCATALYSTS MAHATA 2000 262 270 N ZHOU 2011 2198 2206 Z BOUDART 1984 26 M KINETICSHETEROGENEOUSCATALYTICREACTIONS BERGER 2010 113 120 D GIRI 2011 624 630 N MIGUELGARCIA 2012 2 9 I CHEN 2013 2620 2626 C TERANISHI 1998 594 600 T WANG 2009 947 953 S GAIKWAD 2006 3669 3675 A NEMAMCHA 2009 713 717 A SHI 2010 661 665 L BOITIAUX 1983 41 51 J RUTA 2008 13635 13641 M MOLNAR 2001 185 221 A BENEDETTI 1991 215 224 A BORODZINSKI 2008 379 469 A HUX2014X61 HUX2014X61X69 HUX2014X61XJ HUX2014X61X69XJ item S1381-1169(13)00380-4 S1381116913003804 1-s2.0-S1381116913003804 10.1016/j.molcata.2013.10.008 271358 2013-11-24T08:22:48.196064-05:00 2014-01-01 2014-01-31 1-s2.0-S1381116913003804-main.pdf https://s3.amazonaws.com/prod-ucs-content-store-us-east/content/pii:S1381116913003804/MAIN/application/pdf/e99da258c3b8dc46727c4f3831a9dfb7/main.pdf https://s3-eu-west-1.amazonaws.com/prod-ucs-content-store-eu-west/content/pii:S1381116913003804/MAIN/application/pdf/e99da258c3b8dc46727c4f3831a9dfb7/main.pdf main.pdf pdf true 3007584 MAIN 9 1-s2.0-S1381116913003804-main_1.png https://s3-eu-west-1.amazonaws.com/prod-ucs-content-store-eu-west/content/pii:S1381116913003804/PREVIEW/image/png/04629a22abb3e388270bdcb4a003339c/main_1.png https://s3.amazonaws.com/prod-ucs-content-store-us-east/content/pii:S1381116913003804/PREVIEW/image/png/04629a22abb3e388270bdcb4a003339c/main_1.png main_1.png png 60209 849 656 IMAGE-WEB-PDF 1 1-s2.0-S1381116913003804-si3.gif https://s3.amazonaws.com/prod-ucs-content-store-us-east/content/pii:S1381116913003804/STRIPIN/image/gif/c6cc948d44a5a56b621ac85152e8d7a8/si3.gif https://s3-eu-west-1.amazonaws.com/prod-ucs-content-store-eu-west/content/pii:S1381116913003804/STRIPIN/image/gif/c6cc948d44a5a56b621ac85152e8d7a8/si3.gif si3 si3.gif gif 788 34 186 ALTIMG 1-s2.0-S1381116913003804-si2.gif https://s3.amazonaws.com/prod-ucs-content-store-us-east/content/pii:S1381116913003804/STRIPIN/image/gif/64cb6949884dc398050c2f3fe8915996/si2.gif https://s3-eu-west-1.amazonaws.com/prod-ucs-content-store-eu-west/content/pii:S1381116913003804/STRIPIN/image/gif/64cb6949884dc398050c2f3fe8915996/si2.gif si2 si2.gif gif 604 37 98 ALTIMG 1-s2.0-S1381116913003804-si1.gif https://s3.amazonaws.com/prod-ucs-content-store-us-east/content/pii:S1381116913003804/STRIPIN/image/gif/3b4739701f7ea6fcf60cde010613c40e/si1.gif https://s3-eu-west-1.amazonaws.com/prod-ucs-content-store-eu-west/content/pii:S1381116913003804/STRIPIN/image/gif/3b4739701f7ea6fcf60cde010613c40e/si1.gif si1 si1.gif gif 649 34 135 ALTIMG 1-s2.0-S1381116913003804-gr9_lrg.jpg https://s3.amazonaws.com/prod-ucs-content-store-us-east/content/pii:S1381116913003804/gr9/HIGHRES/image/jpeg/04658bc09bfc41808735d2b6022a2472/gr9_lrg.jpg https://s3-eu-west-1.amazonaws.com/prod-ucs-content-store-eu-west/content/pii:S1381116913003804/gr9/HIGHRES/image/jpeg/04658bc09bfc41808735d2b6022a2472/gr9_lrg.jpg gr9 gr9_lrg.jpg jpg 208131 1165 1333 IMAGE-HIGH-RES 1-s2.0-S1381116913003804-gr8_lrg.jpg https://s3.amazonaws.com/prod-ucs-content-store-us-east/content/pii:S1381116913003804/gr8/HIGHRES/image/jpeg/9f46efb264a5416a87645d92d9915f13/gr8_lrg.jpg https://s3-eu-west-1.amazonaws.com/prod-ucs-content-store-eu-west/content/pii:S1381116913003804/gr8/HIGHRES/image/jpeg/9f46efb264a5416a87645d92d9915f13/gr8_lrg.jpg gr8 gr8_lrg.jpg jpg 194975 1169 1333 IMAGE-HIGH-RES 1-s2.0-S1381116913003804-gr7_lrg.jpg https://s3.amazonaws.com/prod-ucs-content-store-us-east/content/pii:S1381116913003804/gr7/HIGHRES/image/jpeg/40b9f17da3c67d57e2d68278e20d09f7/gr7_lrg.jpg https://s3-eu-west-1.amazonaws.com/prod-ucs-content-store-eu-west/content/pii:S1381116913003804/gr7/HIGHRES/image/jpeg/40b9f17da3c67d57e2d68278e20d09f7/gr7_lrg.jpg gr7 gr7_lrg.jpg jpg 218873 1242 1417 IMAGE-HIGH-RES 1-s2.0-S1381116913003804-gr6_lrg.jpg https://s3.amazonaws.com/prod-ucs-content-store-us-east/content/pii:S1381116913003804/gr6/HIGHRES/image/jpeg/e6f5d0f94ddd441114e65c23bb2be8f7/gr6_lrg.jpg https://s3-eu-west-1.amazonaws.com/prod-ucs-content-store-eu-west/content/pii:S1381116913003804/gr6/HIGHRES/image/jpeg/e6f5d0f94ddd441114e65c23bb2be8f7/gr6_lrg.jpg gr6 gr6_lrg.jpg jpg 224837 1350 1548 IMAGE-HIGH-RES 1-s2.0-S1381116913003804-gr5_lrg.jpg https://s3.amazonaws.com/prod-ucs-content-store-us-east/content/pii:S1381116913003804/gr5/HIGHRES/image/jpeg/5484086ce128b7219102f51bd21e14da/gr5_lrg.jpg https://s3-eu-west-1.amazonaws.com/prod-ucs-content-store-eu-west/content/pii:S1381116913003804/gr5/HIGHRES/image/jpeg/5484086ce128b7219102f51bd21e14da/gr5_lrg.jpg gr5 gr5_lrg.jpg jpg 2019829 4333 2167 IMAGE-HIGH-RES 1-s2.0-S1381116913003804-gr4_lrg.jpg https://s3.amazonaws.com/prod-ucs-content-store-us-east/content/pii:S1381116913003804/gr4/HIGHRES/image/jpeg/e6be967453e388ff3fc3ddf8c814f888/gr4_lrg.jpg https://s3-eu-west-1.amazonaws.com/prod-ucs-content-store-eu-west/content/pii:S1381116913003804/gr4/HIGHRES/image/jpeg/e6be967453e388ff3fc3ddf8c814f888/gr4_lrg.jpg gr4 gr4_lrg.jpg jpg 1524399 2137 2667 IMAGE-HIGH-RES 1-s2.0-S1381116913003804-gr3_lrg.jpg https://s3.amazonaws.com/prod-ucs-content-store-us-east/content/pii:S1381116913003804/gr3/HIGHRES/image/jpeg/04d834617e37a00c19d461249c6b8890/gr3_lrg.jpg https://s3-eu-west-1.amazonaws.com/prod-ucs-content-store-eu-west/content/pii:S1381116913003804/gr3/HIGHRES/image/jpeg/04d834617e37a00c19d461249c6b8890/gr3_lrg.jpg gr3 gr3_lrg.jpg jpg 178029 1436 1542 IMAGE-HIGH-RES 1-s2.0-S1381116913003804-gr2_lrg.jpg https://s3.amazonaws.com/prod-ucs-content-store-us-east/content/pii:S1381116913003804/gr2/HIGHRES/image/jpeg/e3ce41b0d94d0e9f8880b00ab279cfd0/gr2_lrg.jpg https://s3-eu-west-1.amazonaws.com/prod-ucs-content-store-eu-west/content/pii:S1381116913003804/gr2/HIGHRES/image/jpeg/e3ce41b0d94d0e9f8880b00ab279cfd0/gr2_lrg.jpg gr2 gr2_lrg.jpg jpg 878850 2053 2500 IMAGE-HIGH-RES 1-s2.0-S1381116913003804-gr12_lrg.jpg https://s3.amazonaws.com/prod-ucs-content-store-us-east/content/pii:S1381116913003804/gr12/HIGHRES/image/jpeg/6afe45e3eea1f4a915d87dd2b3289fd8/gr12_lrg.jpg https://s3-eu-west-1.amazonaws.com/prod-ucs-content-store-eu-west/content/pii:S1381116913003804/gr12/HIGHRES/image/jpeg/6afe45e3eea1f4a915d87dd2b3289fd8/gr12_lrg.jpg gr12 gr12_lrg.jpg jpg 308878 1136 1417 IMAGE-HIGH-RES 1-s2.0-S1381116913003804-gr11_lrg.jpg https://s3.amazonaws.com/prod-ucs-content-store-us-east/content/pii:S1381116913003804/gr11/HIGHRES/image/jpeg/1a1b644d64a0b1ed1fdedeefc1dbc122/gr11_lrg.jpg https://s3-eu-west-1.amazonaws.com/prod-ucs-content-store-eu-west/content/pii:S1381116913003804/gr11/HIGHRES/image/jpeg/1a1b644d64a0b1ed1fdedeefc1dbc122/gr11_lrg.jpg gr11 gr11_lrg.jpg jpg 760032 1241 1416 IMAGE-HIGH-RES 1-s2.0-S1381116913003804-gr10_lrg.jpg https://s3.amazonaws.com/prod-ucs-content-store-us-east/content/pii:S1381116913003804/gr10/HIGHRES/image/jpeg/c4e2061549e294161d017f0b928b7039/gr10_lrg.jpg https://s3-eu-west-1.amazonaws.com/prod-ucs-content-store-eu-west/content/pii:S1381116913003804/gr10/HIGHRES/image/jpeg/c4e2061549e294161d017f0b928b7039/gr10_lrg.jpg gr10 gr10_lrg.jpg jpg 113920 1388 1333 IMAGE-HIGH-RES 1-s2.0-S1381116913003804-gr1_lrg.jpg https://s3.amazonaws.com/prod-ucs-content-store-us-east/content/pii:S1381116913003804/gr1/HIGHRES/image/jpeg/0473c405d88bb077b3dc47ebc4e87266/gr1_lrg.jpg https://s3-eu-west-1.amazonaws.com/prod-ucs-content-store-eu-west/content/pii:S1381116913003804/gr1/HIGHRES/image/jpeg/0473c405d88bb077b3dc47ebc4e87266/gr1_lrg.jpg gr1 gr1_lrg.jpg jpg 179177 1429 1558 IMAGE-HIGH-RES 1-s2.0-S1381116913003804-fx1_lrg.jpg https://s3.amazonaws.com/prod-ucs-content-store-us-east/content/pii:S1381116913003804/fx1/HIGHRES/image/jpeg/26c6b4e6997d71e815137a2273e40439/fx1_lrg.jpg https://s3-eu-west-1.amazonaws.com/prod-ucs-content-store-eu-west/content/pii:S1381116913003804/fx1/HIGHRES/image/jpeg/26c6b4e6997d71e815137a2273e40439/fx1_lrg.jpg fx1 true fx1_lrg.jpg jpg 243848 886 1996 IMAGE-HIGH-RES 1-s2.0-S1381116913003804-gr9.jpg https://s3.amazonaws.com/prod-ucs-content-store-us-east/content/pii:S1381116913003804/gr9/DOWNSAMPLED/image/jpeg/ba77fb70158f833a5a2459637c937c2f/gr9.jpg https://s3-eu-west-1.amazonaws.com/prod-ucs-content-store-eu-west/content/pii:S1381116913003804/gr9/DOWNSAMPLED/image/jpeg/ba77fb70158f833a5a2459637c937c2f/gr9.jpg gr9 gr9.jpg jpg 23826 263 301 IMAGE-DOWNSAMPLED 1-s2.0-S1381116913003804-gr8.jpg https://s3.amazonaws.com/prod-ucs-content-store-us-east/content/pii:S1381116913003804/gr8/DOWNSAMPLED/image/jpeg/6beea2b139150b4a13d41d9142ab7788/gr8.jpg https://s3-eu-west-1.amazonaws.com/prod-ucs-content-store-eu-west/content/pii:S1381116913003804/gr8/DOWNSAMPLED/image/jpeg/6beea2b139150b4a13d41d9142ab7788/gr8.jpg gr8 gr8.jpg jpg 23331 264 301 IMAGE-DOWNSAMPLED 1-s2.0-S1381116913003804-gr7.jpg https://s3.amazonaws.com/prod-ucs-content-store-us-east/content/pii:S1381116913003804/gr7/DOWNSAMPLED/image/jpeg/c284b8c65721b570345ebd076056d512/gr7.jpg https://s3-eu-west-1.amazonaws.com/prod-ucs-content-store-eu-west/content/pii:S1381116913003804/gr7/DOWNSAMPLED/image/jpeg/c284b8c65721b570345ebd076056d512/gr7.jpg gr7 gr7.jpg jpg 25338 280 320 IMAGE-DOWNSAMPLED 1-s2.0-S1381116913003804-gr6.jpg https://s3.amazonaws.com/prod-ucs-content-store-us-east/content/pii:S1381116913003804/gr6/DOWNSAMPLED/image/jpeg/44ce8573fad64a14b02586bb60666766/gr6.jpg https://s3-eu-west-1.amazonaws.com/prod-ucs-content-store-eu-west/content/pii:S1381116913003804/gr6/DOWNSAMPLED/image/jpeg/44ce8573fad64a14b02586bb60666766/gr6.jpg gr6 gr6.jpg jpg 27952 304 349 IMAGE-DOWNSAMPLED 1-s2.0-S1381116913003804-gr5.jpg https://s3.amazonaws.com/prod-ucs-content-store-us-east/content/pii:S1381116913003804/gr5/DOWNSAMPLED/image/jpeg/73912db3003f8c34c1dbc787bd8b55fa/gr5.jpg https://s3-eu-west-1.amazonaws.com/prod-ucs-content-store-eu-west/content/pii:S1381116913003804/gr5/DOWNSAMPLED/image/jpeg/73912db3003f8c34c1dbc787bd8b55fa/gr5.jpg gr5 gr5.jpg jpg 161335 978 489 IMAGE-DOWNSAMPLED 1-s2.0-S1381116913003804-gr4.jpg https://s3.amazonaws.com/prod-ucs-content-store-us-east/content/pii:S1381116913003804/gr4/DOWNSAMPLED/image/jpeg/83845fc135ee742be03e55b06e39871e/gr4.jpg https://s3-eu-west-1.amazonaws.com/prod-ucs-content-store-eu-west/content/pii:S1381116913003804/gr4/DOWNSAMPLED/image/jpeg/83845fc135ee742be03e55b06e39871e/gr4.jpg gr4 gr4.jpg jpg 125766 482 602 IMAGE-DOWNSAMPLED 1-s2.0-S1381116913003804-gr3.jpg https://s3.amazonaws.com/prod-ucs-content-store-us-east/content/pii:S1381116913003804/gr3/DOWNSAMPLED/image/jpeg/ee90e7ea09646a9628f2146303d9c16d/gr3.jpg https://s3-eu-west-1.amazonaws.com/prod-ucs-content-store-eu-west/content/pii:S1381116913003804/gr3/DOWNSAMPLED/image/jpeg/ee90e7ea09646a9628f2146303d9c16d/gr3.jpg gr3 gr3.jpg jpg 20619 324 348 IMAGE-DOWNSAMPLED 1-s2.0-S1381116913003804-gr2.jpg https://s3.amazonaws.com/prod-ucs-content-store-us-east/content/pii:S1381116913003804/gr2/DOWNSAMPLED/image/jpeg/71912397e3edb676dc0114b0814055c7/gr2.jpg https://s3-eu-west-1.amazonaws.com/prod-ucs-content-store-eu-west/content/pii:S1381116913003804/gr2/DOWNSAMPLED/image/jpeg/71912397e3edb676dc0114b0814055c7/gr2.jpg gr2 gr2.jpg jpg 77535 464 565 IMAGE-DOWNSAMPLED 1-s2.0-S1381116913003804-gr12.jpg https://s3.amazonaws.com/prod-ucs-content-store-us-east/content/pii:S1381116913003804/gr12/DOWNSAMPLED/image/jpeg/10522f4655e9f0b2dd79b480cfc67018/gr12.jpg https://s3-eu-west-1.amazonaws.com/prod-ucs-content-store-eu-west/content/pii:S1381116913003804/gr12/DOWNSAMPLED/image/jpeg/10522f4655e9f0b2dd79b480cfc67018/gr12.jpg gr12 gr12.jpg jpg 35241 257 320 IMAGE-DOWNSAMPLED 1-s2.0-S1381116913003804-gr11.jpg https://s3.amazonaws.com/prod-ucs-content-store-us-east/content/pii:S1381116913003804/gr11/DOWNSAMPLED/image/jpeg/0c2ea1f79513e4ff8ed21f2e2ac4421a/gr11.jpg https://s3-eu-west-1.amazonaws.com/prod-ucs-content-store-eu-west/content/pii:S1381116913003804/gr11/DOWNSAMPLED/image/jpeg/0c2ea1f79513e4ff8ed21f2e2ac4421a/gr11.jpg gr11 gr11.jpg jpg 40825 280 320 IMAGE-DOWNSAMPLED 1-s2.0-S1381116913003804-gr10.jpg https://s3.amazonaws.com/prod-ucs-content-store-us-east/content/pii:S1381116913003804/gr10/DOWNSAMPLED/image/jpeg/98736f8e908c8a7440a43b2c9be334c7/gr10.jpg https://s3-eu-west-1.amazonaws.com/prod-ucs-content-store-eu-west/content/pii:S1381116913003804/gr10/DOWNSAMPLED/image/jpeg/98736f8e908c8a7440a43b2c9be334c7/gr10.jpg gr10 gr10.jpg jpg 16217 313 301 IMAGE-DOWNSAMPLED 1-s2.0-S1381116913003804-gr1.jpg https://s3.amazonaws.com/prod-ucs-content-store-us-east/content/pii:S1381116913003804/gr1/DOWNSAMPLED/image/jpeg/965d8b1c12336c8eac4bf03270927160/gr1.jpg https://s3-eu-west-1.amazonaws.com/prod-ucs-content-store-eu-west/content/pii:S1381116913003804/gr1/DOWNSAMPLED/image/jpeg/965d8b1c12336c8eac4bf03270927160/gr1.jpg gr1 gr1.jpg jpg 19740 323 352 IMAGE-DOWNSAMPLED 1-s2.0-S1381116913003804-fx1.jpg https://s3.amazonaws.com/prod-ucs-content-store-us-east/content/pii:S1381116913003804/fx1/DOWNSAMPLED/image/jpeg/1c5a79d4ee2ece6e8cac72f5f37acd02/fx1.jpg https://s3-eu-west-1.amazonaws.com/prod-ucs-content-store-eu-west/content/pii:S1381116913003804/fx1/DOWNSAMPLED/image/jpeg/1c5a79d4ee2ece6e8cac72f5f37acd02/fx1.jpg fx1 true fx1.jpg jpg 25225 200 451 IMAGE-DOWNSAMPLED 1-s2.0-S1381116913003804-gr9.sml https://s3.amazonaws.com/prod-ucs-content-store-us-east/content/pii:S1381116913003804/gr9/THUMBNAIL/image/gif/79231af6a0813e99f31876c1d24b8781/gr9.sml https://s3-eu-west-1.amazonaws.com/prod-ucs-content-store-eu-west/content/pii:S1381116913003804/gr9/THUMBNAIL/image/gif/79231af6a0813e99f31876c1d24b8781/gr9.sml gr9 gr9.sml sml 5816 163 187 IMAGE-THUMBNAIL 1-s2.0-S1381116913003804-gr8.sml https://s3.amazonaws.com/prod-ucs-content-store-us-east/content/pii:S1381116913003804/gr8/THUMBNAIL/image/gif/41bd75b260554fb587bca9c3b58e0c41/gr8.sml https://s3-eu-west-1.amazonaws.com/prod-ucs-content-store-eu-west/content/pii:S1381116913003804/gr8/THUMBNAIL/image/gif/41bd75b260554fb587bca9c3b58e0c41/gr8.sml gr8 gr8.sml sml 5645 164 187 IMAGE-THUMBNAIL 1-s2.0-S1381116913003804-gr7.sml https://s3.amazonaws.com/prod-ucs-content-store-us-east/content/pii:S1381116913003804/gr7/THUMBNAIL/image/gif/50cd77cb9c93d7b6c473c8aae087b8ca/gr7.sml https://s3-eu-west-1.amazonaws.com/prod-ucs-content-store-eu-west/content/pii:S1381116913003804/gr7/THUMBNAIL/image/gif/50cd77cb9c93d7b6c473c8aae087b8ca/gr7.sml gr7 gr7.sml sml 5793 164 187 IMAGE-THUMBNAIL 1-s2.0-S1381116913003804-gr6.sml https://s3.amazonaws.com/prod-ucs-content-store-us-east/content/pii:S1381116913003804/gr6/THUMBNAIL/image/gif/670a91975d82f224c0c2298c67aea39c/gr6.sml https://s3-eu-west-1.amazonaws.com/prod-ucs-content-store-eu-west/content/pii:S1381116913003804/gr6/THUMBNAIL/image/gif/670a91975d82f224c0c2298c67aea39c/gr6.sml gr6 gr6.sml sml 5271 164 188 IMAGE-THUMBNAIL 1-s2.0-S1381116913003804-gr5.sml https://s3.amazonaws.com/prod-ucs-content-store-us-east/content/pii:S1381116913003804/gr5/THUMBNAIL/image/gif/da780eb9e612db3e37e9ceb135554be3/gr5.sml https://s3-eu-west-1.amazonaws.com/prod-ucs-content-store-eu-west/content/pii:S1381116913003804/gr5/THUMBNAIL/image/gif/da780eb9e612db3e37e9ceb135554be3/gr5.sml gr5 gr5.sml sml 5069 164 82 IMAGE-THUMBNAIL 1-s2.0-S1381116913003804-gr4.sml https://s3.amazonaws.com/prod-ucs-content-store-us-east/content/pii:S1381116913003804/gr4/THUMBNAIL/image/gif/2ea90edf8d1a3f93ead8c8396384d276/gr4.sml https://s3-eu-west-1.amazonaws.com/prod-ucs-content-store-eu-west/content/pii:S1381116913003804/gr4/THUMBNAIL/image/gif/2ea90edf8d1a3f93ead8c8396384d276/gr4.sml gr4 gr4.sml sml 15981 163 204 IMAGE-THUMBNAIL 1-s2.0-S1381116913003804-gr3.sml https://s3.amazonaws.com/prod-ucs-content-store-us-east/content/pii:S1381116913003804/gr3/THUMBNAIL/image/gif/0402d1676004fc71a8c3647aaace625f/gr3.sml https://s3-eu-west-1.amazonaws.com/prod-ucs-content-store-eu-west/content/pii:S1381116913003804/gr3/THUMBNAIL/image/gif/0402d1676004fc71a8c3647aaace625f/gr3.sml gr3 gr3.sml sml 4226 164 176 IMAGE-THUMBNAIL 1-s2.0-S1381116913003804-gr2.sml https://s3.amazonaws.com/prod-ucs-content-store-us-east/content/pii:S1381116913003804/gr2/THUMBNAIL/image/gif/d7d88afae063f8a263f3b93f8dcbb263/gr2.sml https://s3-eu-west-1.amazonaws.com/prod-ucs-content-store-eu-west/content/pii:S1381116913003804/gr2/THUMBNAIL/image/gif/d7d88afae063f8a263f3b93f8dcbb263/gr2.sml gr2 gr2.sml sml 13214 164 200 IMAGE-THUMBNAIL 1-s2.0-S1381116913003804-gr12.sml https://s3.amazonaws.com/prod-ucs-content-store-us-east/content/pii:S1381116913003804/gr12/THUMBNAIL/image/gif/991a9876a467b6cacd5330b9fa2ea4f7/gr12.sml https://s3-eu-west-1.amazonaws.com/prod-ucs-content-store-eu-west/content/pii:S1381116913003804/gr12/THUMBNAIL/image/gif/991a9876a467b6cacd5330b9fa2ea4f7/gr12.sml gr12 gr12.sml sml 10128 164 204 IMAGE-THUMBNAIL 1-s2.0-S1381116913003804-gr11.sml https://s3.amazonaws.com/prod-ucs-content-store-us-east/content/pii:S1381116913003804/gr11/THUMBNAIL/image/gif/5e15e07d4b82a7e9350a9f552e98f21d/gr11.sml https://s3-eu-west-1.amazonaws.com/prod-ucs-content-store-eu-west/content/pii:S1381116913003804/gr11/THUMBNAIL/image/gif/5e15e07d4b82a7e9350a9f552e98f21d/gr11.sml gr11 gr11.sml sml 10446 164 187 IMAGE-THUMBNAIL 1-s2.0-S1381116913003804-gr10.sml https://s3.amazonaws.com/prod-ucs-content-store-us-east/content/pii:S1381116913003804/gr10/THUMBNAIL/image/gif/676ee9166adfb52453cf55b308fd19a6/gr10.sml https://s3-eu-west-1.amazonaws.com/prod-ucs-content-store-eu-west/content/pii:S1381116913003804/gr10/THUMBNAIL/image/gif/676ee9166adfb52453cf55b308fd19a6/gr10.sml gr10 gr10.sml sml 3429 163 157 IMAGE-THUMBNAIL 1-s2.0-S1381116913003804-gr1.sml https://s3.amazonaws.com/prod-ucs-content-store-us-east/content/pii:S1381116913003804/gr1/THUMBNAIL/image/gif/827261c87a37a0ec80543f07fe019258/gr1.sml https://s3-eu-west-1.amazonaws.com/prod-ucs-content-store-eu-west/content/pii:S1381116913003804/gr1/THUMBNAIL/image/gif/827261c87a37a0ec80543f07fe019258/gr1.sml gr1 gr1.sml sml 4483 164 179 IMAGE-THUMBNAIL 1-s2.0-S1381116913003804-fx1.sml https://s3.amazonaws.com/prod-ucs-content-store-us-east/content/pii:S1381116913003804/fx1/THUMBNAIL/image/gif/3bc2c044abbe91a4f349ad57a6dd598a/fx1.sml https://s3-eu-west-1.amazonaws.com/prod-ucs-content-store-eu-west/content/pii:S1381116913003804/fx1/THUMBNAIL/image/gif/3bc2c044abbe91a4f349ad57a6dd598a/fx1.sml fx1 true fx1.sml sml 7653 97 219 IMAGE-THUMBNAIL MOLCAA 8900 S1381-1169(13)00380-4 10.1016/j.molcata.2013.10.008 Elsevier B.V. Fig. 1 XRD patterns of Al2O3 and the catalyst: (a) γ-Al2O3, (b) α-Al2O3 and (c) P80E0.8N2 (reduced). Fig. 2 HRTEM images of the reduced P80E0.8N2 catalyst (a, c, d) and its EDS spectrum (b). Fig. 3 FT-IR spectra of (a) PVP and (b) P100E0.8N2 after washing with ethanol and water. Fig. 4 HRTEM images and the corresponding histograms of the Pd particle size distribution of Pd colloids and supported catalysts (reduced): (a) Pd(P20E0.8N2) colloid, (b) P20E0.8N2, (c) Pd(P80E0.8N2) colloid, and (d) P80E0.8N2. Fig. 5 HRTEM images of various catalysts (reduced) and the corresponding histograms of the Pd particle size distribution: (a) P80E0.4N0, (b) P80E0.4N1, (c) P80E0.4N2, (d) P80E0.4N3, (e) P20E0.8N2, (f) P60E0.8N2, (g) P80E0.8N2, (h) P100E0.8N2, (i) P80E0N2 and (j) P80E1N2. Fig. 6 UV–vis spectra of various solutions: (a) H2PdCl4 in ethanol-water, (b) Pd(P80E0.4N0) colloid after 3h of reduction, (c) Pd(P80E0.4N1) colloid after 3h of reduction, and (d) Pd(P80E0.4N2) colloid after 3h of reduction. Fig. 7 Comparison of nano-Pd/α-Al2O3 catalysts prepared with different [NaBH4]/[Pd] molar ratios in the selective hydrogenation of phenylacetylene. Fig. 8 Comparison of nano-Pd/α-Al2O3 catalysts prepared with different [PVP]/[Pd] molar ratios in the selective hydrogenation of phenylacetylene. Fig. 9 Comparison of nano-Pd/α-Al2O3 catalysts prepared with different C2H5OH contents in the selective hydrogenation of phenylacetylene. Fig. 10 Variations of TOF and selectivity to styrene with the Pd particle size of catalyst. Fig. 11 Reusability of P80E0.8N2 in 5 cycles of reaction. Fig. 12 HRTEM images of P80E0.8N2 after 5 cycles of reaction. Table 1 Textual properties of the support and the catalyst. Sample BET surface area (m2/g) Pore volume (cm3/g) Pore diameter (nm) γ-Al2O3 116.9 0.23 6.6 α-Al2O3 14.9 0.05 23.7 P80E0.8N2 14.3 0.05 18.8 Table 2 CO chemisorption and HRTEM characterization results of various catalysts. Sample Pd a (wt.%) Particle size d CO (nm) Particle size d TEM (nm) Dispersion D CO (%) Dispersion D TEM (%) Metallic surface area (m2/gPd) P80E0.4N0 0.43 12.1 15.0±4.6 9.3 6.0 41.4 P80E0.4N1 0.46 6.6 7.0±1.3 17.0 12.9 75.7 P80E0.4N2 0.47 4.0 4.6±0.7 27.7 19.6 123.4 P80E0.4N3 0.47 4.2 4.7±0.8 26.5 19.1 118.0 P20E0.8N2 0.47 7.6 8.4±1.5 14.7 10.7 65.5 P60E0.8N2 0.46 5.2 6.4±1.0 21.7 14.1 96.7 P80E0.8N2 0.47 3.8 4.4±1.0 29.8 20.5 132.8 P100E0.8N2 0.47 5.4 6.6±1.3 20.9 13.6 93.1 P80E0N2 0.48 5.1 6.0±0.9 22.0 15.0 98.0 P80E1N2 0.47 8.4 9.4±2.2 13.2 9.6 58.8 aPd content, determined by ICP. Table 3 Catalytic activities of various catalysts in the selective hydrogenation of phenylacetylene. Sample Initial rate a (×10−5 mol/(gcat.s)) TOF b (s−1) P80E0.4N0 4.50 11.8 P80E0.4N1 5.87 8.0 P80E0.4N2 7.77 6.4 P80E0.4N3 7.35 6.3 P20E0.8N2 5.69 8.8 P60E0.8N2 6.76 7.2 P80E0.8N2 7.24 5.5 P100E0.8N2 6.61 7.2 P80E0N2 7.95 8.0 P80E1N2 6.41 11.0 a Based on conversion data obtained at 8min of reaction time. b Based on CO chemisorption results. Selective hydrogenation of phenylacetylene over a nano-Pd/α-Al2O3 catalyst Jiawei Hu a Zhiming Zhou a ⁎ Rui Zhang b Li Li c Zhenmin Cheng a a State Key Laboratory of Chemical Engineering, East China University of Science and Technology, Shanghai 200237, China State Key Laboratory of Chemical Engineering, East China University of Science and Technology Shanghai 200237 China b Engineering Research Center of Large Scale Reactor Engineering and Technology, Ministry of Education, East China University of Science and Technology, Shanghai 200237, China Engineering Research Center of Large Scale Reactor Engineering and Technology, Ministry of Education, East China University of Science and Technology Shanghai 200237 China c Chemical Engineering Research Center, East China University of Science and Technology, Shanghai 200237, China Chemical Engineering Research Center, East China University of Science and Technology Shanghai 200237 China ⁎ Corresponding author. Tel.: +86 21 64252230; fax: +86 21 64253528. Graphical abstract Selective hydrogenation of phenylacetylene is an important reaction for increasing the purity of the styrene monomer. In this study a series of supported nano-Pd/α-Al2O3 catalysts were prepared and applied to the selective hydrogenation of phenylacetylene. The preparation procedure consisted of two steps: synthesis of colloidal Pd nanoparticles by a reduction-by-solvent method, followed by impregnation onto α-Al2O3. In the first step, NaBH4 was used as a reducing agent to reduce Pd2+ ions in the C2H5OH/H2O solvent system, and polyvinylpyrrolidone (PVP) was used as a protecting agent to stabilize Pd nanoparticles. The prepared colloids and catalysts were characterized by N2 physisorption, CO chemisorption, XRD, UV–vis, FT-IR, ICP and HRTEM techniques. It was found that the amounts of NaBH4, C2H5OH and PVP had effects on the Pd particle size, which in turn influenced the catalyst performance. The selective hydrogenation of phenylacetylene was sensitive to the structure of the nano-Pd/α-Al2O3 catalysts. In the case where the Pd particle size varied from 3.8 to 6.6nm, the specific activity and the selectivity to styrene increased with increasing particle size, but when the particle size increased in the range of 6.6–12.1nm, the specific activity increased slowly and the selectivity to styrene decreased gradually. Nano-Pd/α-Al2O3 can be reused several times without loss of activity and selectivity and no distinct variation in the Pd particle size was observed, indicating its good stability in the selective hydrogenation of phenylacetylene. Keywords Pd nanoparticles Reduction-by-solvent Selective hydrogenation Phenylacetylene Catalyst 1 Introduction Styrene as an important monomer has been widely used for producing polystyrene and synthetic rubbers such as ABS and SB latex [1]. With the increasing demand for the styrene-related products, the annual output of styrene in the world is continuously growing, reaching about 28 million tons at 2012. Nowadays, styrene is mainly produced by two technologies, viz. dehydrogenation of ethylbenzene and epoxidation of propylene with ethylbenzene hydroperoxide [2]. However, phenylacetylene is produced when excessive dehydrogenation of ethylbenzene occurs [3]. A small amount of phenylacetylene in styrene is very difficult to separate from styrene due to their similar properties and the presence of trace phenylacetylene in styrene will poison the catalyst used in the polymerization process [4]. At present, the most effective way to remove phenylacetylene from styrene is the selective hydrogenation of phenylacetylene. Supported precious and non-precious metal catalysts have been used in the selective hydrogenation of alkynes by many researchers. Although non-precious metal catalysts have attracted increasing interests in recent years due to low cost and good selectivity [5–8], supported precious metal catalysts are still the most widely used catalysts for the selective hydrogenation of alkynes in industry. The precious metals employed include Ni [9,10], Rh [11,12], Ru [13,14], Pt [4,15], Pd [16–18], Au [19,20], etc., and of particular interest is Pd metal owing to its excellent performance in the selective hydrogenation of alkynes [21]. More recently, Pd nanoparticles (NPs) with high catalytic activity and controlled particle size have received much attention [22]. Pd NPs can be obtained by reduction of Pd2+ ions in solution, and in this technique, the reduction method becomes very important in controlling the Pd particle size. Shao et al. [23] prepared Pd/SiO2-Al2O3 catalysts by a method that made use of the CO reduction deposition of PdCl2 on SiO2-Al2O3 support at room temperature in a mixture of ethanol and water. More Pd NPs were expected to be formed on the support by prolonging treatment with CO. Redón et al. [24] synthesized Pd NPs in different solvents with different reduction methods, including the solvent itself, photoreduction, chemical reduction with sodium borohydride or sodium citrate, and ultrasonic reduction, and found that the chemical reduction method gave rise to the smallest Pd NPs. However, to date only few studies have been reported on the size control of Pd NPs in the selective hydrogenation of phenylacetylene and on how the particle size affects the activity and selectivity of catalyst [25,26]. The support is another factor influencing the catalyst performance. The supports that have been investigated in the selective hydrogenation of alkynes include TiO2 [26–28], SiO2 [29–31], mesoporous molecular sieves such as MCM-41 and SBA-15 [25,32–35], and carbon materials [36]. Weerachawanasak et al. [27] prepared two types of Pd catalysts supported on micro- and nano-sized TiO2 by the incipient wetness impregnation method, and revealed that reduction of the catalysts by H2 at 500°C led to strong metal-support interaction for the nano-sized TiO2 supported catalyst and in turn to high catalytic performance in the selective hydrogenation of phenylacetylene, but not for the micro-sized TiO2 supported one. Panpranot et al. [30] prepared sol–gel-derived nano-SiO2 supported Pd catalysts by ion-exchange method, and found that the Pd/SiO2 catalyst with palladium silicide formation showed superior catalytic performance to the commercial SiO2 supported catalyst. The improved performance of the novel catalyst was mainly ascribed to the formation of palladium silicide on the catalyst that made Pd electron deficient, which in turn led to an inhibition of styrene on the Pd surface [30]. Domínguez-Domínguez et al. [25] developed a novel method, by which MCM-41 and Al-MCM-41 were synthesized in the presence of Pd NPs, to prepare Pd/MCM-41 and Pd/Al-MCM-41 catalysts, and the performance of the resulting catalysts was much greater than that of Pd NPs in the homogeneous phase. Despite the fact that the aforementioned catalysts exhibited good performance in the selective hydrogenation of phenylacetylene, the most widely used catalyst in industry is Pd/Al2O3 [37]. Unfortunately, few investigations have been performed on Pd/Al2O3 catalysts [25,38]. In this respect, it is necessary to study the structure–performance relationship of Pd/Al2O3 in order to rationally design and prepare high performance catalysts. In this study, we proposed a two-step technique to prepare nano-Pd/α-Al2O3 catalysts. First, colloidal Pd NPs were synthesized by reduction of palladium precursors with the aid of sodium borohydride (NaBH4) and polyvinylpyrrolidone (PVP) in C2H5OH/H2O solvent system, and second, the resulting Pd NPs were deposited on the α-Al2O3 support by impregnation method. The as-prepared catalysts were detailedly characterized and tested for the catalytic performance in the liquid-phase selective hydrogenation of phenylacetylene. The main aim of this work is: (1) to investigate the effects of C2H5OH, NaBH4 and PVP on the Pd particle size; and (2) to elucidate the structure–performance relationship of Pd/Al2O3 in the selective hydrogenation of phenylacetylene. 2 Experimental 2.1 Catalyst preparation 2.1.1 Preparation of Pd nanoparticles The Pd NPs were synthesized by a reduction-by-solvent method, with the C2H5OH/H2O mixed solution as the solvent, NaBH4 as the reducing agent to reduce Pd2+ ions, and PVP (M W =58000) as the protecting agent to stabilize Pd NPs. In a typical synthesis, a certain amount of PVP (the molar ratio of PVP in monomer unit to Pd ranged from 20 to 100) was added into a mixture of V 1 mL of C2H5OH and V 2 mL of H2O (V 1 + V 2 =70mL, V 1/(V 1 + V 2)=0–1) at room temperature under vigorous stirring. After complete dissolution of PVP, 24mL of H2PdCl4 solution (2mmol/L) was added and stirred for 3min. Finally, a certain volume of NaBH4 solution (25mmol/L, the molar ratio of NaBH4 to Pd ranged from 0 to 3) was added into the above solution and stirred for 3h. 2.1.2 Preparation of α-Al2O3 Because of its lower specific surface area and lower acidity than other transition Al2O3 such as γ-Al2O3 or θ-Al2O3 [38], α-Al2O3 can prevent acid-catalyzed polymerization of alkenes [39], which makes α-Al2O3 more suitable for the selective hydrogenation of alkynes. Our preliminary experiments (not shown here), which compared Pd/γ-Al2O3 with Pd/α-Al2O3 (both prepared by incipient wetness impregnation) in the selective hydrogenation of phenylacetylene, also demonstrated that Pd/α-Al2O3 had better catalytic performance than Pd/γ-Al2O3. Therefore, α-Al2O3 was used as the catalyst support in this work. The α-Al2O3 support was simply obtained by calcination of γ-Al2O3 (Alfa-Aesar 43266, c.a. 40μm) at 1200°C (with a heating ramp of 5°C/min) for 3h in a muffle furnace. 2.1.3 Preparation of nano-Pd/α-Al2O3 The catalyst was prepared by impregnation of α-Al2O3 with the aqueous solution of Pd NPs. First, a predetermined amount of α-Al2O3 was added into an aqueous solution of Pd NPs as synthesized above (0.5wt.% of theoretical Pd loading for all the catalysts in this study) at room temperature under vigorous stirring for 2 days, and then, the solid was filtered and continuously washed with absolute ethanol and deionized water for several times. Finally, the solid particles were dried at 110°C for 12h, followed by calcination at 450°C (with a heating ramp of 2°C/min) in air for 3h in order to enhance the interaction between Pd metal and α-Al2O3. For simplicity, the as-prepared catalyst is denoted by P x E y N z , where x, y and z represent the molar ratio of PVP in monomer unit to Pd, the volume fraction of C2H5OH in the mixture of C2H5OH and H2O, and the molar ratio of NaBH4 to Pd, respectively. 2.2 Catalyst characterization The Brunauer–Emmet–Teller (BET) surface area and pore volume of samples were obtained from N2 physisorption data collected at −196°C on a Micrometrics ASAP 2010 instrument. The crystalline structure of samples was characterized by X-ray diffraction (XRD) of a Rigaku D/Max 2550 VB/PC diffractometer using Cu Kα radiation (λ =1.5406Å, 40kV, and 100mA), and the data were collected from 10° to 80° (2θ) with a step size of 0.02°. The reduction of Pd2+ ions to Pd NPs was evidenced by ultraviolet–visible (UV–vis) spectra with a Perkin-Elmer Lambda 35 spectrophotometer. Fourier-transformed infrared (FT-IR) spectra of samples, measured over the range of 4000–400cm−1 at a resolution of 4cm−1 by a Bruker Equinox-55 spectrometer, were used to determine the presence or absence of PVP in the catalyst. The actual Pd loading of the prepared catalysts was determined by inductively coupled plasma-optical emission spectroscopy (ICP-OES, Varian 710ES). Before analysis the samples were treated with aqua regia to dissolve all Pd. The metal dispersion of catalysts was determined by the CO-pulse chemisorption technique using a Micromeritics AutoChem 2920 apparatus. The chemisorption stoichiometry of CO/Pd was assumed to be 1. The weighed catalysts were reduced in a mixture of 10% H2/Ar (100mL/min) at 400°C for 2h, followed by a switch to He (100mL/min) at 400°C for 20min to remove adsorbed H2. When the catalysts were cooled to 35°C in He, CO pulses were injected into the quartz reactor, and the signal was monitored by a thermal conductivity detector (TCD). According to the CO-pulse chemisorption technique, the mean Pd particle size (d CO) was calculated from the measured dispersion value (D CO) by the following equation [40,41]: (1) d CO = 112 D CO ( % ) , nm The micro-morphology of catalyst was analyzed by high-resolution transmission electron microscopy (HRTEM) using a JEOL JEM-2100 electron microscope operating at 200kV. The samples were prepared by dispersing the ground catalysts in ethanol under ultrasound for 30min. A drop of the suspension was then transferred onto a carbon-coated cooper grid, followed by drying at room temperature. The mean Pd particle size (d TEM) based on the HRTEM analysis was calculated by [25]: (2) d TEM = ∑ n i d i ∑ n i where n i (n i >100) is the number of particles with a diameter of d i. Assuming a spherical geometry for the Pd particle, the corresponding metal dispersion (D TEM) was given by [42]: (3) D TEM ≈ 0.9 d TEM ( nm ) × 100 % 2.3 Catalyst test Before chemical reactions the nano-Pd/α-Al2O3 catalysts were reduced in a fixed-bed reactor by flowing a mixture of 50% H2/N2 at 400°C (with a heating ramp of 5°C/min) for 2h. After the catalysts were cooled to room temperature, they were withdrawn from the fixed-bed reactor for the catalytic reactions. The selective hydrogenation of phenylacetylene over nano-Pd/α-Al2O3 was conducted in a 300mL glass reactor equipped with a magnetic stirrer (Parr 5101). First, 87.6mL of ethanol (solvent), 6.85mL of phenylacetylene (reactant), 5.7mL of n-octane (internal standard) and 0.3g of the reduced catalyst were added into the reactor; second, the reactor was heated to 50°C (by circulating hot water through the jacket) with mild stirring under N2 protection, and then it was purged several times with H2 in the absence of stirring; and third, the reaction was started up at 50°C and 0.1MPa under vigorous stirring (the stirring rate used in this study was 1000rpm, under which the external mass transfer limitations were eliminated). The reactor was operated in a semi-batch mode with H2 continuously entering the reactor, and the reaction product was withdrawn at regular intervals and analyzed by a gas chromatograph (HP-6890) equipped with a DB-Wax capillary column (30m×0.32mm×0.5μm) and a flame ionization detector. The temperatures at the injector and the detector were 150 and 200°C, respectively. The oven temperature program was as follows: start at 60°C (hold for 4min), ramp at 5°C/min to 150°C, and finally hold at 150°C for 2min. The turnover frequency (TOF) and the selectivity to styrene were used to evaluate and compare the catalytic performance of different catalysts. 3 Results and discussion 3.1 Physicochemical characterization Fig. 1 shows the XRD patterns of the support and the catalyst. The catalyst support (Fig. 1b) obtained by calcination of γ-Al2O3 (Fig. 1a, JCPDS 10-0425) at 1200°C exhibits diffraction peaks belonging to the α-Al2O3 phase (JCPDS 10-0173). Taking the P80E0.8N2 catalyst as an example, its diffraction peaks (Fig. 1c) are almost identical to those of the support, and no peaks assigned to Pd species are detected, which is mostly caused by the low Pd loading that is below the detection limit of the XRD technique. The presence of Pd in the catalyst is clearly evidenced by HRTEM and EDS analysis. As shown in Fig. 2b, there exists palladium species in P80E0.8N2 according to the EDS analysis. In addition, the distance of 2.25Å between the adjacent lattice fringes (Fig. 2d) agrees well with the (111) lattice spacing of cubic metallic palladium NPs [43]. Note that Cu and C presented in the EDS spectrum are attributed to copper grids and carbon film, respectively. The textural properties of the support and the P80E0.8N2 catalyst are listed in Table 1 . As expected, the BET surface area and pore volume of α-Al2O3 are much smaller than those of γ-Al2O3, owing to collapse of the pore structure and loss of internal surface area produced by the irreversible phase transition. The BET surface area and pore volume of α-Al2O3 are almost equal to those of P80E0.8N2, but the average pore diameter of the former is little larger than that of the latter, indicating partial blockage of pores in the catalyst. Fig. 3 shows the FT-IR spectra of PVP and the P100E0.8N2 catalyst after washing with ethanol and water. The characteristic peaks belonging to PVP (Fig. 3a) include: the CN stretching vibration peak centered at 1290cm−1, the ring CC stretching vibration at 1460cm−1, the CO vibration at 1650cm−1, the ring CH vibration in the region of 2800–3000cm−1 and the OH stretching vibration in the region of 3180−3450cm−1 [44]. It should be noted that very small peaks assigned to PVP are present for P100E0.8N2 (Fig. 3b), implying that a trace amount of PVP still exist even after washing treatment, owing to the interaction between PVP and Pd [45]. However, the effect of trace PVP on the activity and selectivity of the catalyst can be neglected, considering the competitive adsorption between PVP and phenylacetylene and the relatively much smaller amount of PVP in comparison with phenylacetylene [46]. In addition, a weak OH stretching vibration was detected for P100E0.8N2 due to a small amount of H2O adsorbed in the P100E0.8N2 catalyst. Fig. 4 shows the HRTEM images of Pd(P20E0.8N2) and Pd(P80E0.8N2) colloids as well as the corresponding supported catalysts P20E0.8N2 and P80E0.8N2. The inserted histograms display the Pd particle size distribution of each sample. A comparison between Fig. 4a and b or between Fig. 4c and d clearly indicates that the particle size (d TEM) of the Pd colloid is smaller than that of the supported catalyst, which is mainly due to growth of Pd particles during the calcination process [25]. However, a comparison between reduced and unreduced catalysts (not shown here) shows nearly no variation in the Pd particle size, indicating the negligible effect of the H2 reduction treatment at 400°C on the Pd particle size. Fig. 5 shows the HRTEM images of various catalysts and the corresponding histograms of the Pd particle size distribution. The mean Pd particle sizes and the metal dispersions determined from CO chemisorption and HRTEM analyses are summarized in Table 2 . The effect of NaBH4 on the Pd particle size of catalyst can be seen by comparing P80E0.4N0, P80E0.4N1, P80E0.4N2 and P80E0.4N3 catalysts (see Figs. 5a–d and Table 2). With an increase in the molar ratio of NaBH4 to Pd ([NaBH4]/[Pd]), the Pd particle size first decreases and then remains constant. This trend results mainly from different reduction capabilities of NaBH4 and C2H5OH. It is well known that NaBH4 is a strong reducing agent, but C2H5OH also has the capability of reducing metal ions, as proposed by Redón et al. [24]: (4) CH3CH2OH→CH3CHO+2H+ +2e− (5) Pd2+ +2e− →Pd0 In addition, Teranishi and Miyake [47] used three kinds of alcohol as reducing agents to prepare Pd NPs with the mean particle size of 2–5nm under reflux, and found that the reduction rate followed the order of methanol>ethanol>1-propanol. Wang and Tseng [48] prepared monodispersed Pt NPs by reducing H2PtCl6 with ethanol at 95°C. Note that heating is normally required for reducing metal ions to NPs when only alcohols are used as the reducing agents. However, in the present study, the reduction process is carried out at room temperature, which inevitably results in a slow reduction rate of Pd2+ ions if only ethanol is used, and it is very difficult to control the Pd particle size when the reduction rate is slow. This is the reason that P80E0.4N0 has a broad Pd particle size distribution and some particles even have a diameter of around 29nm (Fig. 5a). In contrast, NaBH4 is a strong reducing agent and the presence of NaBH4 vastly facilitates the reduction of Pd2+, and consequently small and uniform particle size distribution is obtained under the coupling effects of C2H5OH and NaBH4 (Figs. 5b–d). The effect of the [NaBH4]/[Pd] ratio on reduction of Pd2+ ions can be further disclosed by using UV–vis spectroscopy. As shown in Fig. 6 , the H2PdCl4 in a mixture of ethanol and water (sample a) exhibits a maximum at 420nm, which is assigned to the Pd2+ ions [23,49]. As the [NaBH4]/[Pd] ratio increases (samples b–d), the absorbance at 420nm decreases or even disappears for the Pd(P80E0.4N2) colloid obtained after 3h of reduction. Meanwhile, a broad shoulder at around 380–400nm appears, and the absorbance in this region increases with the increased [NaBH4]/[Pd] ratio, indicating the formation of Pd NPs [49]. It should be noted that ethanol makes a weak reduction of Pd2+ at room temperature (sample b) and the presence of NaBH4 leads to a rapid reduction of Pd2+ (sample b vs. sample c), but a further increase in the [NaBH4]/[Pd] ratio only causes a slight increase in the absorbance (sample c vs. sample d). In fact, the Pd(P80E0.4N3) colloid (not shown here) displays an identical UV–vis spectrum to Pd(P80E0.4N2), implying that all the Pd2+ ions in the solution have been reduced to metallic Pd when the [NaBH4]/[Pd] ratio is 2. The results obtained by UV–vis spectral analysis agrees well with those derived from the HRTEM analysis. The molar ratio of PVP to Pd ([PVP]/[Pd]) is another factor influencing the Pd particle size of catalyst, and this effect can be seen by comparison of P20E0.8N2, P60E0.8N2, P80E0.8N2 and P100E0.8N2 (see Figs. 5e–h as well as Table 2). With the increase of the [PVP]/[Pd] ratio from 20 to 80, the mean Pd particle size (d CO) decreases from 7.6nm to 3.8nm, but further increasing this ratio to 100 results in an increase in the Pd particle size (5.4nm). This result is mainly ascribed to the protective effect of PVP on Pd particles. Being a protective polymer for metallic NPs, PVP can adsorb on the surface of Pd particles in the solvent via the coordination of the CO group with the Pd atoms, which in turn prevents the synthesized Pd particles from aggregation [47,50]. The concentration of PVP at low [PVP]/[Pd] ratio (such as 20) is insufficient to cover the Pd particle surface and, as a result, leads to particle aggregation and large Pd NPs [48]. With the increase of the [PVP]/[Pd] ratio, the coverage of PVP on the Pd particle surface increases, giving rise to the improved protective effect and hence small Pd NPs. When the [PVP]/[Pd] ratio is 80, the optimal coverage of PVP on the Pd particle surface is probably attained, and the smallest Pd NPs are therefore obtained in the given solvent. However, when the [PVP]/[Pd] ratio is further increased up to 100, the coalescence of Pd NPs occurs due to the formation of bridges between PVP macromolecule chains [51], which accounts for the increased Pd particle size. The influence of the C2H5OH concentration on Pd particle size of catalyst is studied by comparing P80E0N2, P80E0.4N2, P80E0.8N2 and P80E1N2 (see Fig. 5i, c, g and j as well as Table 2). It is found that the Pd particle size first decreases and then increases with the increase of the C2H5OH concentration. As discussed above, C2H5OH is a weak reducing agent, which can reduce Pd2+ at a slow reduction rate. Thus, for a given [NaBH4]/[Pd] ratio, the increase of the C2H5OH concentration in the solvent mixture is presumed to favor the formation of smaller Pd NPs. However, at higher C2H5OH concentration, the inhomogeneous dispersion of H2PdCl4 in solution takes place because H2PdCl4 is much less soluble in C2H5OH, which leads to the formation of larger Pd NPs [47]. Therefore, a minimum in the Pd particle size is observed with the increased C2H5OH concentration. 3.2 Catalytic performance The initial reaction rates and the corresponding TOF values for various catalysts are listed in Table 3 . These data are calculated from experimental results obtained at 8min of reaction time when the conversion of phenylacetylene is lower than 20%. For each catalyst, the experiments were repeated twice with similar results (relative error of the repeated experiments ≤5%), indicating the good reproducibility. The catalytic performances of these catalysts are further compared by plotting the selectivity to styrene against the conversion of phenylacetylene, as shown in Figs. 7–9 . For P80E0.4N0, P80E0.4N1, P80E0.4N2 and P80E0.4N3 catalysts used to study the effect of the [NaBH4]/[Pd] ratio, it can be observed that the TOF value (Table 3) and the selectivity to styrene at almost complete conversion of phenylacetylene (Fig. 7) depend on the Pd particle size (Table 2). It seems that higher specific activity and selectivity could be obtained with larger particle size, and lower specific activity and selectivity with smaller particle size. Similar results are also obtained for P20E0.8N2, P60E0.8N2, P80E0.8N2 and P100E0.8N2 with regard to the effect of the [PVP]/[Pd] ratio (Fig. 8), and for P80E0N2, P80E0.4N2, P80E0.8N2 and P80E1N2 with regard to the effect of the C2H5OH concentration (Fig. 9). Nevertheless, if all TOF (or selectivity to styrene) data are plotted against the Pd particle size, an interesting phenomenon is observed. As shown in Fig. 10 , the TOF value increases with increasing Pd particle size over the whole range investigated (3.8–12.1nm), but the increase becomes gentle when the particle size is above 6.6nm. However, there exists a maximum value in the selectivity curve, which is about 60% (at total conversion) at 6.6nm of Pd particle size. When the Pd particle size is larger than 6.6nm, the selectivity to styrene gradually decreases, demonstrating that the selectivity of over-hydrogenation (formation of ethylbenzene) is increased. The variations of the specific activity and the selectivity to styrene with the Pd particle size clearly indicate that the selective hydrogenation of phenylacetylene is sensitive to the structure of the nano-Pd/α-Al2O3 catalyst. The structure-sensitive characteristic of this reaction was also reported by other researchers. Domínguez-Domínguez et al. [25] found that the TOF values increased with increasing Pd particle size between 3 and 13nm. Panpranot et al. [30] pointed out that the TOF values decreased by an order of magnitude when the Pd particle size was smaller than 3–5nm. In an early study on the hydrogenation of 1-butyne over Pd/Al2O3, Boitiaux et al. [52] found that the TOF values increased with an increase in the Pd particle size from 0.4 to 4.2nm, but remained constant when the particle size varied from 4.2 to 11.2nm. Recently, Ruta et al. [53] reported that the TOF values of acetylene selective hydrogenation over Pd/CNFs increased with the Pd particle size from 8 to 11nm, but were unchanged from 11 to 13nm. These investigations showed that increasing Pd particle size led to an increase in the specific activity especially over catalysts with small Pd particle size. The variation of the specific activity with the Pd particle size is believed to be caused by electronic and geometric effects [54]. The strong complexation of the highly unsaturated phenylacetylene to Pd atoms with low coordination numbers on small Pd NPs is unfavorable for achieving high specific activity in the selective hydrogenation of phenylacetylene. With regard to the selectivity, Weerachawanasak et al. [26] found that the selectivity to styrene over Pd/TiO2 catalysts decreased with decreasing the Pd particle size in the range of 3.2–5.9nm, agreeing with the present study (3.8–6.6nm), which was ascribed to the longer residence time of styrene on smaller Pd particles. With a further increase in the Pd particle size from 6.6 to 12.1nm, the selectivity to styrene, however, decreases slowly, which is probably caused by the formation of β-PdH phase [54]. The β-PdH phase is believed to contribute to the over-hydrogenation of alkynes, and the probability of formation of this phase is known to increase with increasing the Pd particle size [54–56]. In the end, the reusability of nano-Pd/α-Al2O3 in the selective hydrogenation of phenylacetylene is evaluated. Five consecutive cycles were performed using the P80E0.8N2 catalyst under the same reaction conditions as mentioned in Section 2.3. For each cycle, the product after 28min of reaction was used for analysis and comparison. As shown in Fig. 11 , both activity and selectivity remain very well in 5 cycles. Fig. 12 shows the Pd particle size of the used catalyst, and it is clear that no distinct variation in the Pd particle size occurs in comparison with the original catalyst (Fig. 5g). In addition, the Pd loading of the used catalyst after 5 cycles is still 0.47wt.% (determined by ICP), the same as the original value, indicating no Pd leaching from the catalyst during the cyclic operation. All these results demonstrate the good stability of the nano-Pd/α-Al2O3 catalyst in the selective hydrogenation of phenylacetylene. 4 Conclusion In this work, colloidal Pd NPs were first synthesized by reduction of palladium precursors with the aid of NaBH4 and PVP in C2H5OH/H2O solvent system, and then deposited on α-Al2O3 by impregnation to give the corresponding supported nano-Pd/α-Al2O3 catalysts, which were finally applied to the selective hydrogenation of phenylacetylene. A series of catalysts were prepared by adjusting the amounts of NaBH4, PVP and C2H5OH used. It was found that with an increase in the molar ratio of NaBH4 to Pd, the Pd particle size first decreased and then remained constant, and with an increase in the molar ratio of PVP in monomer unit to Pd or an increase in the C2H5OH concentration, the Pd particle size first decreased and then increased. The effects of the amounts of NaBH4, PVP and C2H5OH on the Pd particle size resulted in different catalytic performances of the catalysts. The specific activity and the selectivity to styrene depended on the Pd particle size, implying the structure-sensitive characteristic of the selective hydrogenation of phenylacetylene over the nano-Pd/α-Al2O3 catalysts. Reusability tests showed that the catalysts can be used repeatedly without notable deactivation related to Pd leaching or agglomeration under the reaction conditions used. Acknowledgements Financial supports from the National Natural Science Foundation of China (No. 21276076), the Program for New Century Excellent Talents in University (No. NCET-13-0801), the Fundamental Research Funds for the Central Universities (No. 222201313011) and the “111” project (B08021) are greatly acknowledged. References [1] M.M. Hossain L. Atanda N. Al-Yassir S. Al-Khattaf Chem. Eng. J. 207–208 2012 308 321 [2] F. Cavani F. Trifirò Appl. Catal. A: Gen. 133 1995 219 239 [3] B.R. Maurer, M. Galobardes, Selective hydrogenation of phenylacetylene in the presence of styrene, U.S. Patent 4,822,936 (1989). [4] B.A. Wilhite M.J. McCready A. Varma Ind. Eng. Chem. Res. 41 2002 3345 3350 [5] F. Studt F. Abild-Pedersen T. Bligaard R.Z. Sørensen C.H. Christensen J.K. Nørskov Science 320 2008 1320 1322 [6] B. Bridier N. López J. Pérez-Ramírez Dalton Trans. 39 2010 8412 8419 [7] M. Armbrüster K. Kovnir M. Friedrich D. Teschner G. Wowsnick M. Hahne P. Gille L. Szentmiklósi M. Feuerbacher M. Heggen F. Girgsdies D. Rosenthal R. Schlögl Yu. Grin Nat. Mater. 11 2012 690 693 [8] G. Vilé B. Bridier J. Wichert J. Pérez-Ramírez Angew. Chem. Int. Ed. 51 2012 8620 8623 [9] F.M. Bautista J.M. Campelo A. Garcia D. Luna J.M. Marinas R.A. Quiros A.A. Romero Catal. Lett. 52 1988 205 213 [10] X. Chen M. Li J.C. Guan X.K. Wang C.T. Williams C.H. Liang Ind. Eng. Chem. Res. 51 2012 3604 3611 [11] J.L. Pellegatta C. Blandy V. Collière R. Choukroun B. Chaudret P. Cheng K. Philippot J. Mol. Catal. A: Chem. 78 2002 55 61 [12] E. Leitmannová J. Svoboda J. Sedláček J. Vohlídal P. Kačer L. Červený Appl. Catal. A: Gen 372 2010 34 39 [13] D. Duraczynska E.M. Serwicka A. Drelinkiewicz Z. Olejniczak Appl. Catal. A: Gen. 371 2009 166 172 [14] C. Li Z.F. Shao M. Pang C.T. Williams X.F. Zhang C.H. Liang Ind. Eng. Chem. Res. 51 2012 4934 4941 [15] C. Li Z.F. Shao M. Pang C.T. Williamsb C.H. Liang Catal. Today 9 2012 69 75 [16] D. Duca F. Frusteri A. Parmaliana G. Deganello Appl. Catal. A: Gen. 146 1996 269 284 [17] S. Domínguez-Domínguez Á. Berenguer-Murcia D. Cazorla-Amorós Á. Linares-Solano J. Catal. 243 2006 74 81 [18] M. Ruta G. Laurenczy P.J. Dyson L. Kiwi-Minsker J. Phys. Chem. C 112 2008 17814 17819 [19] S.A. Nikolaev V.V. Smirnov Gold Bull. 42 2009 182 189 [20] S.A. Nikolaev N.A. Permyakov V.V. Smirnov A.Yu. Vasil’kov S.N. Lanin Kinet. Catal. 51 2010 288 292 [21] N. López C. Vargas-Fuentes Chem. Commun. 48 2012 1379 1391 [22] B.H. Wu N.F. Zheng Nano Today 8 2013 168 197 [23] Z.F. Shao C. Li X. Chen M. Pang X.K. Wang C.H. Liang ChemCatChem 2 2010 1555 1558 [24] R. Redón S.K. Rendón-Lara A.L. Fernández-Osorio V.M. Ugalde-Saldivar Rev. Adv. Mater. Sci. 27 2011 31 42 [25] S. Domínguez-Domínguez Á. Berenguer-Murcia Á. Linares-Solano D. Cazorla-Amorós J. Catal. 257 2008 87 95 [26] P. Weerachawanasak O. Mekasuwandumrong M. Arai S.I. Fujita P. Praserthdama J. Panpranot J. Catal. 262 2009 199 205 [27] P. Weerachawanasak P. Praserthdam M. Arai J. Panpranot J. Mol. Catal. A: Chem. 279 2008 133 139 [28] F.M. McKenna L. Mantarosie R.P.K. Wells C. Hardacre J.A. Anderson Catal. Sci. Technol. 2 2012 632 638 [29] A. Sárkány A. Beck A. Horváth Zs. Révay L. Guczi Appl. Catal. A: Gen. 253 2003 283 292 [30] J. Panpranot K. Phandinthong T. Sirikajorn M. Arai P. Praserthdam J. Mol. Catal. A: Chem. 261 2007 29 35 [31] I.Y. Ahn J.H. Lee S.S. Kum S.H. Moon Catal. Today 123 2007 151 157 [32] N. Marín-Astorga G. Pecchi J.L.G. Fierro P. Reyes J. Mol. Catal. A: Chem. 231 2005 67 74 [33] Á. Mastalir B. Rác Z. Király Á. Molnár J. Mol. Catal. A: Chem. 264 2007 170 178 [34] N. Tiengchad O. Mekasuwandumrong C. Na-Chiangmai P. Weerachawanasak J. Panpranot Catal. Commun. 12 2011 910 916 [35] C. Na-Chiangmai N. Tiengchad P. Kittisakmontree O. Mekasuwandumrong J. Powell J. Panpranot Catal. Lett. 141 2011 1149 1155 [36] S. Domínguez-Domínguez Á. Berenguer-Murcia B.K. Pradhan Á. Linares-Solano D. Cazorla-Amorós J. Phys. Chem. C 112 2008 3827 3834 [37] S.Q. Liang, L.M. Sun, L.G. Lv, Y. Qian, Y.D. Zheng, J. Wu, T.H. Wang, X.Y. Li, Selectivity hydrogenation catalyst and the preparation thereof, U.S. Patent 8,211,823 B2 (2012). [38] N. Wongwaranon O. Mekasuwandumrong P. Praserthdam J. Panpranot Catal. Today 131 2008 553 558 [39] H.F. Rase Handbook of Commercial Catalysts: Heterogeneous Catalysts 2000 CRC Press Boca Raton, FL 133 [40] N. Mahata V. Vishwanathan J. Catal. 196 2000 262 270 [41] Z.M. Zhou T.Y. Zeng Z.M. Cheng W.K. Yuan AIChE J. 57 2011 2198 2206 [42] M. Boudart Kinetics of Heterogeneous Catalytic Reactions 1984 Princeton University Press Princeton, NJ 26 (ch. 1) [43] D. Berger G.A. Trăistaru B.Ş. Vasile I. Jitaru C. Matei UPB Sci. Bull. B 1 2010 113 120 [44] N. Giri R.K. Natarajan S. Gunasekaran S. Shreemathi Arch. Appl. Sci. Res. 3 2011 624 630 [45] I. Miguel-García Á. Berenguer-Murcia T. García D. Cazorla-Amorós Catal. Today 187 2012 2 9 [46] C.H. Chen E.S. Zhan N. Ta Y. Li W.J. Shen Catal. Sci. Technol. 3 2013 2620 2626 [47] T. Teranishi M. Miyake Chem. Mater. 10 1998 594 600 [48] S.R. Wang W.J. Tseng J. Nanopart. Res. 11 2009 947 953 [49] A.V. Gaikwad G. Rothenberg Phys. Chem. Chem. Phys. 8 2006 3669 3675 [50] A. Nemamcha H. Moumeni J.L. Rehspringer Phys. Procedia 2 2009 713 717 [51] L.L. Shi K.Z. Liu X.H. Zou M.S. Jin Z.H. Suo Chin. J. Catal. 31 2010 661 665 [52] J.P. Boitiaux J. Cosyns S. Vasudevan Appl. Catal. 6 1983 41 51 [53] M. Ruta N. Semagina L. Kiwi-Minsker J. Phys. Chem. C 112 2008 13635 13641 [54] Á. Molnár A. Sárkány M. Varga J. Mol. Catal. A: Chem. 173 2001 185 221 [55] A. Benedetti G. Fagherazzi F. Pinna G. Rampazzo M. Selva G. Strukul Catal. Lett. 10 1991 215 224 [56] A. Borodziński G.C. Bond Catal. Rev. Sci. Eng. 50 2008 379 469",
      "scopus-id": "84887106132",
      "coredata": {
        "eid": "1-s2.0-S1381116913003804",
        "dc:description": "Selective hydrogenation of phenylacetylene is an important reaction for increasing the purity of the styrene monomer. In this study a series of supported nano-Pd/α-Al2O3 catalysts were prepared and applied to the selective hydrogenation of phenylacetylene. The preparation procedure consisted of two steps: synthesis of colloidal Pd nanoparticles by a reduction-by-solvent method, followed by impregnation onto α-Al2O3. In the first step, NaBH4 was used as a reducing agent to reduce Pd2+ ions in the C2H5OH/H2O solvent system, and polyvinylpyrrolidone (PVP) was used as a protecting agent to stabilize Pd nanoparticles. The prepared colloids and catalysts were characterized by N2 physisorption, CO chemisorption, XRD, UV–vis, FT-IR, ICP and HRTEM techniques. It was found that the amounts of NaBH4, C2H5OH and PVP had effects on the Pd particle size, which in turn influenced the catalyst performance. The selective hydrogenation of phenylacetylene was sensitive to the structure of the nano-Pd/α-Al2O3 catalysts. In the case where the Pd particle size varied from 3.8 to 6.6nm, the specific activity and the selectivity to styrene increased with increasing particle size, but when the particle size increased in the range of 6.6–12.1nm, the specific activity increased slowly and the selectivity to styrene decreased gradually. Nano-Pd/α-Al2O3 can be reused several times without loss of activity and selectivity and no distinct variation in the Pd particle size was observed, indicating its good stability in the selective hydrogenation of phenylacetylene.",
        "openArchiveArticle": "false",
        "prism:coverDate": "2014-01-31",
        "openaccessUserLicense": null,
        "prism:aggregationType": "Journal",
        "prism:url": "https://api.elsevier.com/content/article/pii/S1381116913003804",
        "dc:creator": [
          {
            "@_fa": "true",
            "$": "Hu, Jiawei"
          },
          {
            "@_fa": "true",
            "$": "Zhou, Zhiming"
          },
          {
            "@_fa": "true",
            "$": "Zhang, Rui"
          },
          {
            "@_fa": "true",
            "$": "Li, Li"
          },
          {
            "@_fa": "true",
            "$": "Cheng, Zhenmin"
          }
        ],
        "link": [
          {
            "@_fa": "true",
            "@rel": "self",
            "@href": "https://api.elsevier.com/content/article/pii/S1381116913003804"
          },
          {
            "@_fa": "true",
            "@rel": "scidir",
            "@href": "https://www.sciencedirect.com/science/article/pii/S1381116913003804"
          }
        ],
        "dc:format": "application/json",
        "openaccessType": null,
        "pii": "S1381-1169(13)00380-4",
        "prism:volume": "381",
        "prism:publisher": "Elsevier B.V.",
        "dc:title": "Selective hydrogenation of phenylacetylene over a nano-Pd/α-Al2O3 catalyst",
        "prism:copyright": "Copyright © 2013 Elsevier B.V. All rights reserved.",
        "openaccess": "0",
        "prism:issn": "13811169",
        "dcterms:subject": [
          {
            "@_fa": "true",
            "$": "Pd nanoparticles"
          },
          {
            "@_fa": "true",
            "$": "Reduction-by-solvent"
          },
          {
            "@_fa": "true",
            "$": "Selective hydrogenation"
          },
          {
            "@_fa": "true",
            "$": "Phenylacetylene"
          },
          {
            "@_fa": "true",
            "$": "Catalyst"
          }
        ],
        "openaccessArticle": "false",
        "prism:publicationName": "Journal of Molecular Catalysis A: Chemical",
        "openaccessSponsorType": null,
        "prism:pageRange": "61-69",
        "prism:endingPage": "69",
        "pubType": "fla",
        "prism:coverDisplayDate": "January 2014",
        "prism:doi": "10.1016/j.molcata.2013.10.008",
        "prism:startingPage": "61",
        "dc:identifier": "doi:10.1016/j.molcata.2013.10.008",
        "openaccessSponsorName": null
      },
      "objects": {
        "object": [
          {
            "@category": "thumbnail",
            "@height": "34",
            "@width": "186",
            "@_fa": "true",
            "$": "https://api.elsevier.com/content/object/eid/1-s2.0-S1381116913003804-si3.gif?httpAccept=%2A%2F%2A",
            "@multimediatype": "GIF image file",
            "@type": "ALTIMG",
            "@size": "788",
            "@ref": "si3",
            "@mimetype": "image/gif"
          },
          {
            "@category": "thumbnail",
            "@height": "37",
            "@width": "98",
            "@_fa": "true",
            "$": "https://api.elsevier.com/content/object/eid/1-s2.0-S1381116913003804-si2.gif?httpAccept=%2A%2F%2A",
            "@multimediatype": "GIF image file",
            "@type": "ALTIMG",
            "@size": "604",
            "@ref": "si2",
            "@mimetype": "image/gif"
          },
          {
            "@category": "thumbnail",
            "@height": "34",
            "@width": "135",
            "@_fa": "true",
            "$": "https://api.elsevier.com/content/object/eid/1-s2.0-S1381116913003804-si1.gif?httpAccept=%2A%2F%2A",
            "@multimediatype": "GIF image file",
            "@type": "ALTIMG",
            "@size": "649",
            "@ref": "si1",
            "@mimetype": "image/gif"
          },
          {
            "@category": "high",
            "@height": "1165",
            "@width": "1333",
            "@_fa": "true",
            "$": "https://api.elsevier.com/content/object/eid/1-s2.0-S1381116913003804-gr9_lrg.jpg?httpAccept=%2A%2F%2A",
            "@multimediatype": "JPEG image file",
            "@type": "IMAGE-HIGH-RES",
            "@size": "208131",
            "@ref": "gr9",
            "@mimetype": "image/jpeg"
          },
          {
            "@category": "high",
            "@height": "1169",
            "@width": "1333",
            "@_fa": "true",
            "$": "https://api.elsevier.com/content/object/eid/1-s2.0-S1381116913003804-gr8_lrg.jpg?httpAccept=%2A%2F%2A",
            "@multimediatype": "JPEG image file",
            "@type": "IMAGE-HIGH-RES",
            "@size": "194975",
            "@ref": "gr8",
            "@mimetype": "image/jpeg"
          },
          {
            "@category": "high",
            "@height": "1242",
            "@width": "1417",
            "@_fa": "true",
            "$": "https://api.elsevier.com/content/object/eid/1-s2.0-S1381116913003804-gr7_lrg.jpg?httpAccept=%2A%2F%2A",
            "@multimediatype": "JPEG image file",
            "@type": "IMAGE-HIGH-RES",
            "@size": "218873",
            "@ref": "gr7",
            "@mimetype": "image/jpeg"
          },
          {
            "@category": "high",
            "@height": "1350",
            "@width": "1548",
            "@_fa": "true",
            "$": "https://api.elsevier.com/content/object/eid/1-s2.0-S1381116913003804-gr6_lrg.jpg?httpAccept=%2A%2F%2A",
            "@multimediatype": "JPEG image file",
            "@type": "IMAGE-HIGH-RES",
            "@size": "224837",
            "@ref": "gr6",
            "@mimetype": "image/jpeg"
          },
          {
            "@category": "high",
            "@height": "4333",
            "@width": "2167",
            "@_fa": "true",
            "$": "https://api.elsevier.com/content/object/eid/1-s2.0-S1381116913003804-gr5_lrg.jpg?httpAccept=%2A%2F%2A",
            "@multimediatype": "JPEG image file",
            "@type": "IMAGE-HIGH-RES",
            "@size": "2019829",
            "@ref": "gr5",
            "@mimetype": "image/jpeg"
          },
          {
            "@category": "high",
            "@height": "2137",
            "@width": "2667",
            "@_fa": "true",
            "$": "https://api.elsevier.com/content/object/eid/1-s2.0-S1381116913003804-gr4_lrg.jpg?httpAccept=%2A%2F%2A",
            "@multimediatype": "JPEG image file",
            "@type": "IMAGE-HIGH-RES",
            "@size": "1524399",
            "@ref": "gr4",
            "@mimetype": "image/jpeg"
          },
          {
            "@category": "high",
            "@height": "1436",
            "@width": "1542",
            "@_fa": "true",
            "$": "https://api.elsevier.com/content/object/eid/1-s2.0-S1381116913003804-gr3_lrg.jpg?httpAccept=%2A%2F%2A",
            "@multimediatype": "JPEG image file",
            "@type": "IMAGE-HIGH-RES",
            "@size": "178029",
            "@ref": "gr3",
            "@mimetype": "image/jpeg"
          },
          {
            "@category": "high",
            "@height": "2053",
            "@width": "2500",
            "@_fa": "true",
            "$": "https://api.elsevier.com/content/object/eid/1-s2.0-S1381116913003804-gr2_lrg.jpg?httpAccept=%2A%2F%2A",
            "@multimediatype": "JPEG image file",
            "@type": "IMAGE-HIGH-RES",
            "@size": "878850",
            "@ref": "gr2",
            "@mimetype": "image/jpeg"
          },
          {
            "@category": "high",
            "@height": "1136",
            "@width": "1417",
            "@_fa": "true",
            "$": "https://api.elsevier.com/content/object/eid/1-s2.0-S1381116913003804-gr12_lrg.jpg?httpAccept=%2A%2F%2A",
            "@multimediatype": "JPEG image file",
            "@type": "IMAGE-HIGH-RES",
            "@size": "308878",
            "@ref": "gr12",
            "@mimetype": "image/jpeg"
          },
          {
            "@category": "high",
            "@height": "1241",
            "@width": "1416",
            "@_fa": "true",
            "$": "https://api.elsevier.com/content/object/eid/1-s2.0-S1381116913003804-gr11_lrg.jpg?httpAccept=%2A%2F%2A",
            "@multimediatype": "JPEG image file",
            "@type": "IMAGE-HIGH-RES",
            "@size": "760032",
            "@ref": "gr11",
            "@mimetype": "image/jpeg"
          },
          {
            "@category": "high",
            "@height": "1388",
            "@width": "1333",
            "@_fa": "true",
            "$": "https://api.elsevier.com/content/object/eid/1-s2.0-S1381116913003804-gr10_lrg.jpg?httpAccept=%2A%2F%2A",
            "@multimediatype": "JPEG image file",
            "@type": "IMAGE-HIGH-RES",
            "@size": "113920",
            "@ref": "gr10",
            "@mimetype": "image/jpeg"
          },
          {
            "@category": "high",
            "@height": "1429",
            "@width": "1558",
            "@_fa": "true",
            "$": "https://api.elsevier.com/content/object/eid/1-s2.0-S1381116913003804-gr1_lrg.jpg?httpAccept=%2A%2F%2A",
            "@multimediatype": "JPEG image file",
            "@type": "IMAGE-HIGH-RES",
            "@size": "179177",
            "@ref": "gr1",
            "@mimetype": "image/jpeg"
          },
          {
            "@category": "high",
            "@height": "886",
            "@width": "1996",
            "@_fa": "true",
            "$": "https://api.elsevier.com/content/object/eid/1-s2.0-S1381116913003804-fx1_lrg.jpg?httpAccept=%2A%2F%2A",
            "@multimediatype": "JPEG image file",
            "@type": "IMAGE-HIGH-RES",
            "@size": "243848",
            "@ref": "fx1",
            "@mimetype": "image/jpeg"
          },
          {
            "@category": "standard",
            "@height": "263",
            "@width": "301",
            "@_fa": "true",
            "$": "https://api.elsevier.com/content/object/eid/1-s2.0-S1381116913003804-gr9.jpg?httpAccept=%2A%2F%2A",
            "@multimediatype": "JPEG image file",
            "@type": "IMAGE-DOWNSAMPLED",
            "@size": "23826",
            "@ref": "gr9",
            "@mimetype": "image/jpeg"
          },
          {
            "@category": "standard",
            "@height": "264",
            "@width": "301",
            "@_fa": "true",
            "$": "https://api.elsevier.com/content/object/eid/1-s2.0-S1381116913003804-gr8.jpg?httpAccept=%2A%2F%2A",
            "@multimediatype": "JPEG image file",
            "@type": "IMAGE-DOWNSAMPLED",
            "@size": "23331",
            "@ref": "gr8",
            "@mimetype": "image/jpeg"
          },
          {
            "@category": "standard",
            "@height": "280",
            "@width": "320",
            "@_fa": "true",
            "$": "https://api.elsevier.com/content/object/eid/1-s2.0-S1381116913003804-gr7.jpg?httpAccept=%2A%2F%2A",
            "@multimediatype": "JPEG image file",
            "@type": "IMAGE-DOWNSAMPLED",
            "@size": "25338",
            "@ref": "gr7",
            "@mimetype": "image/jpeg"
          },
          {
            "@category": "standard",
            "@height": "304",
            "@width": "349",
            "@_fa": "true",
            "$": "https://api.elsevier.com/content/object/eid/1-s2.0-S1381116913003804-gr6.jpg?httpAccept=%2A%2F%2A",
            "@multimediatype": "JPEG image file",
            "@type": "IMAGE-DOWNSAMPLED",
            "@size": "27952",
            "@ref": "gr6",
            "@mimetype": "image/jpeg"
          },
          {
            "@category": "standard",
            "@height": "978",
            "@width": "489",
            "@_fa": "true",
            "$": "https://api.elsevier.com/content/object/eid/1-s2.0-S1381116913003804-gr5.jpg?httpAccept=%2A%2F%2A",
            "@multimediatype": "JPEG image file",
            "@type": "IMAGE-DOWNSAMPLED",
            "@size": "161335",
            "@ref": "gr5",
            "@mimetype": "image/jpeg"
          },
          {
            "@category": "standard",
            "@height": "482",
            "@width": "602",
            "@_fa": "true",
            "$": "https://api.elsevier.com/content/object/eid/1-s2.0-S1381116913003804-gr4.jpg?httpAccept=%2A%2F%2A",
            "@multimediatype": "JPEG image file",
            "@type": "IMAGE-DOWNSAMPLED",
            "@size": "125766",
            "@ref": "gr4",
            "@mimetype": "image/jpeg"
          },
          {
            "@category": "standard",
            "@height": "324",
            "@width": "348",
            "@_fa": "true",
            "$": "https://api.elsevier.com/content/object/eid/1-s2.0-S1381116913003804-gr3.jpg?httpAccept=%2A%2F%2A",
            "@multimediatype": "JPEG image file",
            "@type": "IMAGE-DOWNSAMPLED",
            "@size": "20619",
            "@ref": "gr3",
            "@mimetype": "image/jpeg"
          },
          {
            "@category": "standard",
            "@height": "464",
            "@width": "565",
            "@_fa": "true",
            "$": "https://api.elsevier.com/content/object/eid/1-s2.0-S1381116913003804-gr2.jpg?httpAccept=%2A%2F%2A",
            "@multimediatype": "JPEG image file",
            "@type": "IMAGE-DOWNSAMPLED",
            "@size": "77535",
            "@ref": "gr2",
            "@mimetype": "image/jpeg"
          },
          {
            "@category": "standard",
            "@height": "257",
            "@width": "320",
            "@_fa": "true",
            "$": "https://api.elsevier.com/content/object/eid/1-s2.0-S1381116913003804-gr12.jpg?httpAccept=%2A%2F%2A",
            "@multimediatype": "JPEG image file",
            "@type": "IMAGE-DOWNSAMPLED",
            "@size": "35241",
            "@ref": "gr12",
            "@mimetype": "image/jpeg"
          },
          {
            "@category": "standard",
            "@height": "280",
            "@width": "320",
            "@_fa": "true",
            "$": "https://api.elsevier.com/content/object/eid/1-s2.0-S1381116913003804-gr11.jpg?httpAccept=%2A%2F%2A",
            "@multimediatype": "JPEG image file",
            "@type": "IMAGE-DOWNSAMPLED",
            "@size": "40825",
            "@ref": "gr11",
            "@mimetype": "image/jpeg"
          },
          {
            "@category": "standard",
            "@height": "313",
            "@width": "301",
            "@_fa": "true",
            "$": "https://api.elsevier.com/content/object/eid/1-s2.0-S1381116913003804-gr10.jpg?httpAccept=%2A%2F%2A",
            "@multimediatype": "JPEG image file",
            "@type": "IMAGE-DOWNSAMPLED",
            "@size": "16217",
            "@ref": "gr10",
            "@mimetype": "image/jpeg"
          },
          {
            "@category": "standard",
            "@height": "323",
            "@width": "352",
            "@_fa": "true",
            "$": "https://api.elsevier.com/content/object/eid/1-s2.0-S1381116913003804-gr1.jpg?httpAccept=%2A%2F%2A",
            "@multimediatype": "JPEG image file",
            "@type": "IMAGE-DOWNSAMPLED",
            "@size": "19740",
            "@ref": "gr1",
            "@mimetype": "image/jpeg"
          },
          {
            "@category": "standard",
            "@height": "200",
            "@width": "451",
            "@_fa": "true",
            "$": "https://api.elsevier.com/content/object/eid/1-s2.0-S1381116913003804-fx1.jpg?httpAccept=%2A%2F%2A",
            "@multimediatype": "JPEG image file",
            "@type": "IMAGE-DOWNSAMPLED",
            "@size": "25225",
            "@ref": "fx1",
            "@mimetype": "image/jpeg"
          },
          {
            "@category": "thumbnail",
            "@height": "163",
            "@width": "187",
            "@_fa": "true",
            "$": "https://api.elsevier.com/content/object/eid/1-s2.0-S1381116913003804-gr9.sml?httpAccept=%2A%2F%2A",
            "@multimediatype": "GIF image file",
            "@type": "IMAGE-THUMBNAIL",
            "@size": "5816",
            "@ref": "gr9",
            "@mimetype": "image/gif"
          },
          {
            "@category": "thumbnail",
            "@height": "164",
            "@width": "187",
            "@_fa": "true",
            "$": "https://api.elsevier.com/content/object/eid/1-s2.0-S1381116913003804-gr8.sml?httpAccept=%2A%2F%2A",
            "@multimediatype": "GIF image file",
            "@type": "IMAGE-THUMBNAIL",
            "@size": "5645",
            "@ref": "gr8",
            "@mimetype": "image/gif"
          },
          {
            "@category": "thumbnail",
            "@height": "164",
            "@width": "187",
            "@_fa": "true",
            "$": "https://api.elsevier.com/content/object/eid/1-s2.0-S1381116913003804-gr7.sml?httpAccept=%2A%2F%2A",
            "@multimediatype": "GIF image file",
            "@type": "IMAGE-THUMBNAIL",
            "@size": "5793",
            "@ref": "gr7",
            "@mimetype": "image/gif"
          },
          {
            "@category": "thumbnail",
            "@height": "164",
            "@width": "188",
            "@_fa": "true",
            "$": "https://api.elsevier.com/content/object/eid/1-s2.0-S1381116913003804-gr6.sml?httpAccept=%2A%2F%2A",
            "@multimediatype": "GIF image file",
            "@type": "IMAGE-THUMBNAIL",
            "@size": "5271",
            "@ref": "gr6",
            "@mimetype": "image/gif"
          },
          {
            "@category": "thumbnail",
            "@height": "164",
            "@width": "82",
            "@_fa": "true",
            "$": "https://api.elsevier.com/content/object/eid/1-s2.0-S1381116913003804-gr5.sml?httpAccept=%2A%2F%2A",
            "@multimediatype": "GIF image file",
            "@type": "IMAGE-THUMBNAIL",
            "@size": "5069",
            "@ref": "gr5",
            "@mimetype": "image/gif"
          },
          {
            "@category": "thumbnail",
            "@height": "163",
            "@width": "204",
            "@_fa": "true",
            "$": "https://api.elsevier.com/content/object/eid/1-s2.0-S1381116913003804-gr4.sml?httpAccept=%2A%2F%2A",
            "@multimediatype": "GIF image file",
            "@type": "IMAGE-THUMBNAIL",
            "@size": "15981",
            "@ref": "gr4",
            "@mimetype": "image/gif"
          },
          {
            "@category": "thumbnail",
            "@height": "164",
            "@width": "176",
            "@_fa": "true",
            "$": "https://api.elsevier.com/content/object/eid/1-s2.0-S1381116913003804-gr3.sml?httpAccept=%2A%2F%2A",
            "@multimediatype": "GIF image file",
            "@type": "IMAGE-THUMBNAIL",
            "@size": "4226",
            "@ref": "gr3",
            "@mimetype": "image/gif"
          },
          {
            "@category": "thumbnail",
            "@height": "164",
            "@width": "200",
            "@_fa": "true",
            "$": "https://api.elsevier.com/content/object/eid/1-s2.0-S1381116913003804-gr2.sml?httpAccept=%2A%2F%2A",
            "@multimediatype": "GIF image file",
            "@type": "IMAGE-THUMBNAIL",
            "@size": "13214",
            "@ref": "gr2",
            "@mimetype": "image/gif"
          },
          {
            "@category": "thumbnail",
            "@height": "164",
            "@width": "204",
            "@_fa": "true",
            "$": "https://api.elsevier.com/content/object/eid/1-s2.0-S1381116913003804-gr12.sml?httpAccept=%2A%2F%2A",
            "@multimediatype": "GIF image file",
            "@type": "IMAGE-THUMBNAIL",
            "@size": "10128",
            "@ref": "gr12",
            "@mimetype": "image/gif"
          },
          {
            "@category": "thumbnail",
            "@height": "164",
            "@width": "187",
            "@_fa": "true",
            "$": "https://api.elsevier.com/content/object/eid/1-s2.0-S1381116913003804-gr11.sml?httpAccept=%2A%2F%2A",
            "@multimediatype": "GIF image file",
            "@type": "IMAGE-THUMBNAIL",
            "@size": "10446",
            "@ref": "gr11",
            "@mimetype": "image/gif"
          },
          {
            "@category": "thumbnail",
            "@height": "163",
            "@width": "157",
            "@_fa": "true",
            "$": "https://api.elsevier.com/content/object/eid/1-s2.0-S1381116913003804-gr10.sml?httpAccept=%2A%2F%2A",
            "@multimediatype": "GIF image file",
            "@type": "IMAGE-THUMBNAIL",
            "@size": "3429",
            "@ref": "gr10",
            "@mimetype": "image/gif"
          },
          {
            "@category": "thumbnail",
            "@height": "164",
            "@width": "179",
            "@_fa": "true",
            "$": "https://api.elsevier.com/content/object/eid/1-s2.0-S1381116913003804-gr1.sml?httpAccept=%2A%2F%2A",
            "@multimediatype": "GIF image file",
            "@type": "IMAGE-THUMBNAIL",
            "@size": "4483",
            "@ref": "gr1",
            "@mimetype": "image/gif"
          },
          {
            "@category": "thumbnail",
            "@height": "97",
            "@width": "219",
            "@_fa": "true",
            "$": "https://api.elsevier.com/content/object/eid/1-s2.0-S1381116913003804-fx1.sml?httpAccept=%2A%2F%2A",
            "@multimediatype": "GIF image file",
            "@type": "IMAGE-THUMBNAIL",
            "@size": "7653",
            "@ref": "fx1",
            "@mimetype": "image/gif"
          }
        ]
      },
      "link": {
        "@rel": "abstract",
        "@href": "https://api.elsevier.com/content/abstract/scopus_id/84887106132"
      }
    }
  }
}