{
  "metadata": {
    "title": "K-10 montmorillonite: An efficient and reusable catalyst for the aerobic C<ce:glyph name=sbnd></ce:glyph>C bond cleavage of α-substituted ketones",
    "authors": "; ; ",
    "journal": "Journal of Molecular Catalysis A: Chemical",
    "date": "2012-11-30",
    "doi": "10.1016/j.molcata.2012.07.022",
    "abstract": "",
    "uri": "https://api.elsevier.com/content/article/pii/S138111691200235X",
    "pii": "S138111691200235X"
  },
  "fulltext": {
    "full-text-retrieval-response": {
      "scopus-eid": "2-s2.0-84866008228",
      "originalText": "serial JL 271358 291210 291744 291790 291809 31 Journal of Molecular Catalysis A: Chemical JOURNALMOLECULARCATALYSISACHEMICAL 2012-08-08 2012-08-08 2012-09-07T04:19:01 1-s2.0-S138111691200235X S1381-1169(12)00235-X S138111691200235X 10.1016/j.molcata.2012.07.022 S300 S300.1 FULL-TEXT 1-s2.0-S1381116912X00086 2015-05-15T05:56:33.607047-04:00 0 0 20121101 20121130 2012 2012-08-08T00:00:00Z articleinfo crossmark dco dateupdated tomb dateloaded datesearch indexeddate volumelist yearnav absattachment articletitlenorm authfirstinitialnorm authfirstsurnamenorm cid cids contenttype copyright dateloadedtxt docsubtype doctype doi eid ewtransactionid hubeid issn issnnorm itemstage itemtransactionid itemweight openaccess openarchive pg pgfirst pglast pii piinorm pubdateend pubdatestart pubdatetxt pubyr sectiontitle sortorder srctitle srctitlenorm srctype subheadings suppl volfirst volissue webpdf webpdfpagecount figure table e-component body acknowledge affil appendices articletitle auth authfirstini authfull authkeywords authlast primabst ref specialabst alllist content subj ssids 1381-1169 13811169 false 363 364 363 364 C Volumes 363–364 59 437 445 437 445 201211 November 2012 2012-11-01 2012-11-30 2012 Regular Papers article fla Copyright © 2012 Elsevier B.V. All rights reserved. K10MONTMORILLONITEEFFICIENTREUSABLECATALYSTFORAEROBICCCBONDCLEAVAGESUBSTITUTEDKETONES ELYOUNSSI I 1 Introduction 2 Experimental 2.1 Chemicals 2.2 Preparation of synthetic montmorillonite 2.3 Characterization techniques 2.4 Catalytic tests 3 Results and discussion 3.1 Characterization of the materials 3.1.1 Structural and morphological studies 3.1.2 Ammonia chemisorption 3.2 Reactivity 3.2.1 Oxidation of 2-methylcyclohexanone 3.2.1.1 Effect of catalyst amount and effect of substrate amount 3.2.1.2 Effect of solvent 3.2.1.3 Effect of temperature and acidity 3.2.2 Catalyst regeneration 3.2.3 Change in the chemical composition after recycling 3.2.4 Oxidation of other α-substituted ketones 4 Discussion 5 Conclusion Acknowledgements Appendix A Supplementary data References LAROCK 1999 R COMPREHENSIVEORGANICTRANSFORMATIONS KERVINEN 2003 9 19 K SURESH 2000 3958 3997 A SHIMIZU 2000 425 434 A FLORESCA 1993 2196 2200 R ATLAMSANI 1993 79 81 A ELAAKEL 2004 171 182 L CORNELIUS 1994 155 161 A HUANG 2008 1143 1147 T WORRALL 1986 W CLAYSCERAMICRAWMATERIALS DEER 1996 W INTRODUCTIONROCKFORMINGMINERALS KLOPROGGE 2006 640 646 J WEAVER 1973 C CHEMISTRYCLAYMINERALS HART 2004 315 321 M VACCARI 1998 53 71 A CSERI 1995 141 155 T CATIVIELA 1993 223 228 C CHOUDARY 1999 2859 2862 B CRISOSTOMO 2005 2829 2832 F KAWABATA 2003 9205 9208 T BIGI 1999 1033 1035 F TAYLOR 1977 467 E HUNIG 1957 2833 2840 S ROUDIER 1984 4375 4378 J LABIAD 1989 143 144 B FISHMAN 1981 137 138 D ONAKA 1993 117 120 M REINHOLDT 2001 2831 2841 M DECHATEAUBOURG 1993 293 298 P SHELDON 1998 493 495 R BAKANDRITSOS 2006 1112 1117 A MILONE 2010 3242 3249 C SING 1985 603 619 K FLESSNER 2001 247 256 U VENNAT 2010 9 15 M CAVANI 2011 118 124 F STEPHENSON 1992 80 95 R BELKHIR 1998 1761 1764 I ATLAMSANI 1993 5663 5665 A ELAAKEL 2001 2218 2219 L BREEN 1997 5324 5331 C KOMADEL 2006 263 288 P HANDBOOKCLAYSCIENCEDEVELOPMENTINCLAYSCIENCE ACIDACTIVATIONCLAYMINERALS ITO 1983 1133 1135 S SWEARINGEN 2004 5598 5603 C JAKOB 2009 3549 3555 A DANHARDI 2009 10857 10859 M ELYOUNSSIX2012X437 ELYOUNSSIX2012X437X445 ELYOUNSSIX2012X437XI ELYOUNSSIX2012X437X445XI item S1381-1169(12)00235-X S138111691200235X 1-s2.0-S138111691200235X 10.1016/j.molcata.2012.07.022 271358 2012-09-07T01:02:52.200942-04:00 2012-11-01 2012-11-30 1-s2.0-S138111691200235X-main.pdf https://s3.amazonaws.com/prod-ucs-content-store-us-east/content/pii:S138111691200235X/MAIN/application/pdf/0abeddbaac3608c62b508eb76e5dc4ac/main.pdf https://s3-eu-west-1.amazonaws.com/prod-ucs-content-store-eu-west/content/pii:S138111691200235X/MAIN/application/pdf/0abeddbaac3608c62b508eb76e5dc4ac/main.pdf main.pdf pdf true 1229449 MAIN 9 1-s2.0-S138111691200235X-main_1.png https://s3.amazonaws.com/prod-ucs-content-store-us-east/content/pii:S138111691200235X/PREVIEW/image/png/fdf934ae4c41da315b9d8b6bea71fe0f/main_1.png https://s3-eu-west-1.amazonaws.com/prod-ucs-content-store-eu-west/content/pii:S138111691200235X/PREVIEW/image/png/fdf934ae4c41da315b9d8b6bea71fe0f/main_1.png main_1.png png 58469 849 656 IMAGE-WEB-PDF 1 1-s2.0-S138111691200235X-mmc1.doc https://s3.amazonaws.com/prod-ucs-content-store-us-east/content/pii:S138111691200235X/mmc1/MAIN/application/msword/f2710cbe5b725fc6bbe1224f4fbcce91/mmc1.doc https://s3-eu-west-1.amazonaws.com/prod-ucs-content-store-eu-west/content/pii:S138111691200235X/mmc1/MAIN/application/msword/f2710cbe5b725fc6bbe1224f4fbcce91/mmc1.doc mmc1 mmc1.doc doc 96768 APPLICATION 1-s2.0-S138111691200235X-sc1.jpg https://s3.amazonaws.com/prod-ucs-content-store-us-east/content/pii:S138111691200235X/sc1/DOWNSAMPLED/image/jpeg/21561b7a2f879bb83c493ae3399dc7a5/sc1.jpg https://s3-eu-west-1.amazonaws.com/prod-ucs-content-store-eu-west/content/pii:S138111691200235X/sc1/DOWNSAMPLED/image/jpeg/21561b7a2f879bb83c493ae3399dc7a5/sc1.jpg sc1 sc1.jpg jpg 5193 90 320 IMAGE-DOWNSAMPLED 1-s2.0-S138111691200235X-sc1.sml https://s3.amazonaws.com/prod-ucs-content-store-us-east/content/pii:S138111691200235X/sc1/THUMBNAIL/image/gif/f7f2bea5c847c2983b0ef1ea104e7775/sc1.sml https://s3-eu-west-1.amazonaws.com/prod-ucs-content-store-eu-west/content/pii:S138111691200235X/sc1/THUMBNAIL/image/gif/f7f2bea5c847c2983b0ef1ea104e7775/sc1.sml sc1 sc1.sml sml 2087 62 219 IMAGE-THUMBNAIL 1-s2.0-S138111691200235X-sc1_lrg.jpg https://s3.amazonaws.com/prod-ucs-content-store-us-east/content/pii:S138111691200235X/sc1/HIGHRES/image/jpeg/36fae80127b70ed18ade1d97d2507efb/sc1_lrg.jpg https://s3-eu-west-1.amazonaws.com/prod-ucs-content-store-eu-west/content/pii:S138111691200235X/sc1/HIGHRES/image/jpeg/36fae80127b70ed18ade1d97d2507efb/sc1_lrg.jpg sc1 sc1_lrg.jpg jpg 41017 400 1418 IMAGE-HIGH-RES 1-s2.0-S138111691200235X-gr1.jpg https://s3.amazonaws.com/prod-ucs-content-store-us-east/content/pii:S138111691200235X/gr1/DOWNSAMPLED/image/jpeg/d702845fc25c28d604c0bb0492ee6852/gr1.jpg https://s3-eu-west-1.amazonaws.com/prod-ucs-content-store-eu-west/content/pii:S138111691200235X/gr1/DOWNSAMPLED/image/jpeg/d702845fc25c28d604c0bb0492ee6852/gr1.jpg gr1 gr1.jpg jpg 24120 382 330 IMAGE-DOWNSAMPLED 1-s2.0-S138111691200235X-gr1.sml https://s3.amazonaws.com/prod-ucs-content-store-us-east/content/pii:S138111691200235X/gr1/THUMBNAIL/image/gif/3dbaa4eb9e38e0d0bff3d5aac7f23451/gr1.sml https://s3-eu-west-1.amazonaws.com/prod-ucs-content-store-eu-west/content/pii:S138111691200235X/gr1/THUMBNAIL/image/gif/3dbaa4eb9e38e0d0bff3d5aac7f23451/gr1.sml gr1 gr1.sml sml 3762 163 141 IMAGE-THUMBNAIL 1-s2.0-S138111691200235X-gr1_lrg.jpg https://s3.amazonaws.com/prod-ucs-content-store-us-east/content/pii:S138111691200235X/gr1/HIGHRES/image/jpeg/36b4b0d6051a467183f03455b11f2e85/gr1_lrg.jpg https://s3-eu-west-1.amazonaws.com/prod-ucs-content-store-eu-west/content/pii:S138111691200235X/gr1/HIGHRES/image/jpeg/36b4b0d6051a467183f03455b11f2e85/gr1_lrg.jpg gr1 gr1_lrg.jpg jpg 201240 1693 1461 IMAGE-HIGH-RES 1-s2.0-S138111691200235X-gr3.jpg https://s3.amazonaws.com/prod-ucs-content-store-us-east/content/pii:S138111691200235X/gr3/DOWNSAMPLED/image/jpeg/d1969ed2148d3482eab8f77a2087890e/gr3.jpg https://s3-eu-west-1.amazonaws.com/prod-ucs-content-store-eu-west/content/pii:S138111691200235X/gr3/DOWNSAMPLED/image/jpeg/d1969ed2148d3482eab8f77a2087890e/gr3.jpg gr3 gr3.jpg jpg 23797 460 376 IMAGE-DOWNSAMPLED 1-s2.0-S138111691200235X-gr3.sml https://s3.amazonaws.com/prod-ucs-content-store-us-east/content/pii:S138111691200235X/gr3/THUMBNAIL/image/gif/9c7ec863bea7833f2dd4e0a8849ba6d7/gr3.sml https://s3-eu-west-1.amazonaws.com/prod-ucs-content-store-eu-west/content/pii:S138111691200235X/gr3/THUMBNAIL/image/gif/9c7ec863bea7833f2dd4e0a8849ba6d7/gr3.sml gr3 gr3.sml sml 3114 164 134 IMAGE-THUMBNAIL 1-s2.0-S138111691200235X-gr3_lrg.jpg https://s3.amazonaws.com/prod-ucs-content-store-us-east/content/pii:S138111691200235X/gr3/HIGHRES/image/jpeg/06dad0ce272e6b5de3c6c80bf2453609/gr3_lrg.jpg https://s3-eu-west-1.amazonaws.com/prod-ucs-content-store-eu-west/content/pii:S138111691200235X/gr3/HIGHRES/image/jpeg/06dad0ce272e6b5de3c6c80bf2453609/gr3_lrg.jpg gr3 gr3_lrg.jpg jpg 192096 2038 1667 IMAGE-HIGH-RES 1-s2.0-S138111691200235X-gr4.jpg https://s3.amazonaws.com/prod-ucs-content-store-us-east/content/pii:S138111691200235X/gr4/DOWNSAMPLED/image/jpeg/dd2941a3e2f6c86d2d45b384ae14081f/gr4.jpg https://s3-eu-west-1.amazonaws.com/prod-ucs-content-store-eu-west/content/pii:S138111691200235X/gr4/DOWNSAMPLED/image/jpeg/dd2941a3e2f6c86d2d45b384ae14081f/gr4.jpg gr4 gr4.jpg jpg 26878 477 339 IMAGE-DOWNSAMPLED 1-s2.0-S138111691200235X-gr4.sml https://s3.amazonaws.com/prod-ucs-content-store-us-east/content/pii:S138111691200235X/gr4/THUMBNAIL/image/gif/9e3b5f47dc7dce592c7d77187d6f5860/gr4.sml https://s3-eu-west-1.amazonaws.com/prod-ucs-content-store-eu-west/content/pii:S138111691200235X/gr4/THUMBNAIL/image/gif/9e3b5f47dc7dce592c7d77187d6f5860/gr4.sml gr4 gr4.sml sml 2929 163 116 IMAGE-THUMBNAIL 1-s2.0-S138111691200235X-gr4_lrg.jpg https://s3.amazonaws.com/prod-ucs-content-store-us-east/content/pii:S138111691200235X/gr4/HIGHRES/image/jpeg/6072882c7954907508844ead6a17d2e4/gr4_lrg.jpg https://s3-eu-west-1.amazonaws.com/prod-ucs-content-store-eu-west/content/pii:S138111691200235X/gr4/HIGHRES/image/jpeg/6072882c7954907508844ead6a17d2e4/gr4_lrg.jpg gr4 gr4_lrg.jpg jpg 211938 2109 1500 IMAGE-HIGH-RES 1-s2.0-S138111691200235X-gr6.jpg https://s3.amazonaws.com/prod-ucs-content-store-us-east/content/pii:S138111691200235X/gr6/DOWNSAMPLED/image/jpeg/64b177c27be7d7b434a0e08487671435/gr6.jpg https://s3-eu-west-1.amazonaws.com/prod-ucs-content-store-eu-west/content/pii:S138111691200235X/gr6/DOWNSAMPLED/image/jpeg/64b177c27be7d7b434a0e08487671435/gr6.jpg gr6 gr6.jpg jpg 14927 272 336 IMAGE-DOWNSAMPLED 1-s2.0-S138111691200235X-gr6.sml https://s3.amazonaws.com/prod-ucs-content-store-us-east/content/pii:S138111691200235X/gr6/THUMBNAIL/image/gif/69c636f5d641f5f3ddfa80bd86b7781c/gr6.sml https://s3-eu-west-1.amazonaws.com/prod-ucs-content-store-eu-west/content/pii:S138111691200235X/gr6/THUMBNAIL/image/gif/69c636f5d641f5f3ddfa80bd86b7781c/gr6.sml gr6 gr6.sml sml 7521 163 202 IMAGE-THUMBNAIL 1-s2.0-S138111691200235X-gr6_lrg.jpg https://s3.amazonaws.com/prod-ucs-content-store-us-east/content/pii:S138111691200235X/gr6/HIGHRES/image/jpeg/8e52602ed317aa9ba61844984cda3747/gr6_lrg.jpg https://s3-eu-west-1.amazonaws.com/prod-ucs-content-store-eu-west/content/pii:S138111691200235X/gr6/HIGHRES/image/jpeg/8e52602ed317aa9ba61844984cda3747/gr6_lrg.jpg gr6 gr6_lrg.jpg jpg 98607 1205 1489 IMAGE-HIGH-RES 1-s2.0-S138111691200235X-gr7.jpg https://s3.amazonaws.com/prod-ucs-content-store-us-east/content/pii:S138111691200235X/gr7/DOWNSAMPLED/image/jpeg/5f5a07552ca12e9bf7a6b57bddaef4d4/gr7.jpg https://s3-eu-west-1.amazonaws.com/prod-ucs-content-store-eu-west/content/pii:S138111691200235X/gr7/DOWNSAMPLED/image/jpeg/5f5a07552ca12e9bf7a6b57bddaef4d4/gr7.jpg gr7 gr7.jpg jpg 14511 254 341 IMAGE-DOWNSAMPLED 1-s2.0-S138111691200235X-gr7.sml https://s3.amazonaws.com/prod-ucs-content-store-us-east/content/pii:S138111691200235X/gr7/THUMBNAIL/image/gif/96288001ff078d336598d4c4dd55d212/gr7.sml https://s3-eu-west-1.amazonaws.com/prod-ucs-content-store-eu-west/content/pii:S138111691200235X/gr7/THUMBNAIL/image/gif/96288001ff078d336598d4c4dd55d212/gr7.sml gr7 gr7.sml sml 4024 163 219 IMAGE-THUMBNAIL 1-s2.0-S138111691200235X-gr7_lrg.jpg https://s3.amazonaws.com/prod-ucs-content-store-us-east/content/pii:S138111691200235X/gr7/HIGHRES/image/jpeg/d1831934a3f982e764d013a88b74c972/gr7_lrg.jpg https://s3-eu-west-1.amazonaws.com/prod-ucs-content-store-eu-west/content/pii:S138111691200235X/gr7/HIGHRES/image/jpeg/d1831934a3f982e764d013a88b74c972/gr7_lrg.jpg gr7 gr7_lrg.jpg jpg 112846 1122 1509 IMAGE-HIGH-RES 1-s2.0-S138111691200235X-fx2.jpg https://s3.amazonaws.com/prod-ucs-content-store-us-east/content/pii:S138111691200235X/fx2/DOWNSAMPLED/image/jpeg/bc4501bed74a14d186149f0520013270/fx2.jpg https://s3-eu-west-1.amazonaws.com/prod-ucs-content-store-eu-west/content/pii:S138111691200235X/fx2/DOWNSAMPLED/image/jpeg/bc4501bed74a14d186149f0520013270/fx2.jpg fx2 fx2.jpg jpg 2550 95 106 IMAGE-DOWNSAMPLED 1-s2.0-S138111691200235X-fx2.sml https://s3.amazonaws.com/prod-ucs-content-store-us-east/content/pii:S138111691200235X/fx2/THUMBNAIL/image/gif/d85d904e69babf521a7673280f6c55f8/fx2.sml https://s3-eu-west-1.amazonaws.com/prod-ucs-content-store-eu-west/content/pii:S138111691200235X/fx2/THUMBNAIL/image/gif/d85d904e69babf521a7673280f6c55f8/fx2.sml fx2 fx2.sml sml 3039 164 184 IMAGE-THUMBNAIL 1-s2.0-S138111691200235X-fx2_lrg.jpg https://s3.amazonaws.com/prod-ucs-content-store-us-east/content/pii:S138111691200235X/fx2/HIGHRES/image/jpeg/acb71e7b1719932872a90c77417366a9/fx2_lrg.jpg https://s3-eu-west-1.amazonaws.com/prod-ucs-content-store-eu-west/content/pii:S138111691200235X/fx2/HIGHRES/image/jpeg/acb71e7b1719932872a90c77417366a9/fx2_lrg.jpg fx2 fx2_lrg.jpg jpg 18837 420 471 IMAGE-HIGH-RES 1-s2.0-S138111691200235X-fx3.jpg https://s3.amazonaws.com/prod-ucs-content-store-us-east/content/pii:S138111691200235X/fx3/DOWNSAMPLED/image/jpeg/3e58dd47a198783a461b5ad7194948d9/fx3.jpg https://s3-eu-west-1.amazonaws.com/prod-ucs-content-store-eu-west/content/pii:S138111691200235X/fx3/DOWNSAMPLED/image/jpeg/3e58dd47a198783a461b5ad7194948d9/fx3.jpg fx3 fx3.jpg jpg 3542 146 156 IMAGE-DOWNSAMPLED 1-s2.0-S138111691200235X-fx3.sml https://s3.amazonaws.com/prod-ucs-content-store-us-east/content/pii:S138111691200235X/fx3/THUMBNAIL/image/gif/b41ed8a7ec7cfb78ebebae738f41cdfd/fx3.sml https://s3-eu-west-1.amazonaws.com/prod-ucs-content-store-eu-west/content/pii:S138111691200235X/fx3/THUMBNAIL/image/gif/b41ed8a7ec7cfb78ebebae738f41cdfd/fx3.sml fx3 fx3.sml sml 2512 163 175 IMAGE-THUMBNAIL 1-s2.0-S138111691200235X-fx3_lrg.jpg https://s3.amazonaws.com/prod-ucs-content-store-us-east/content/pii:S138111691200235X/fx3/HIGHRES/image/jpeg/53dfda9fc006828561340def29a16d7d/fx3_lrg.jpg https://s3-eu-west-1.amazonaws.com/prod-ucs-content-store-eu-west/content/pii:S138111691200235X/fx3/HIGHRES/image/jpeg/53dfda9fc006828561340def29a16d7d/fx3_lrg.jpg fx3 fx3_lrg.jpg jpg 29773 648 694 IMAGE-HIGH-RES 1-s2.0-S138111691200235X-fx4.jpg https://s3.amazonaws.com/prod-ucs-content-store-us-east/content/pii:S138111691200235X/fx4/DOWNSAMPLED/image/jpeg/508e404d37406dde84d2f81fe41efdb8/fx4.jpg https://s3-eu-west-1.amazonaws.com/prod-ucs-content-store-eu-west/content/pii:S138111691200235X/fx4/DOWNSAMPLED/image/jpeg/508e404d37406dde84d2f81fe41efdb8/fx4.jpg fx4 fx4.jpg jpg 1795 85 78 IMAGE-DOWNSAMPLED 1-s2.0-S138111691200235X-fx4.sml https://s3.amazonaws.com/prod-ucs-content-store-us-east/content/pii:S138111691200235X/fx4/THUMBNAIL/image/gif/14ea6a2973f3d4ed9b9d2ff342ffb58b/fx4.sml https://s3-eu-west-1.amazonaws.com/prod-ucs-content-store-eu-west/content/pii:S138111691200235X/fx4/THUMBNAIL/image/gif/14ea6a2973f3d4ed9b9d2ff342ffb58b/fx4.sml fx4 fx4.sml sml 2504 163 149 IMAGE-THUMBNAIL 1-s2.0-S138111691200235X-fx4_lrg.jpg https://s3.amazonaws.com/prod-ucs-content-store-us-east/content/pii:S138111691200235X/fx4/HIGHRES/image/jpeg/6255fbe48cc4e11e5b2b7c931fab6994/fx4_lrg.jpg https://s3-eu-west-1.amazonaws.com/prod-ucs-content-store-eu-west/content/pii:S138111691200235X/fx4/HIGHRES/image/jpeg/6255fbe48cc4e11e5b2b7c931fab6994/fx4_lrg.jpg fx4 fx4_lrg.jpg jpg 11527 380 347 IMAGE-HIGH-RES 1-s2.0-S138111691200235X-fx5.jpg https://s3.amazonaws.com/prod-ucs-content-store-us-east/content/pii:S138111691200235X/fx5/DOWNSAMPLED/image/jpeg/9718fd746d591d03d08c1488a7566506/fx5.jpg https://s3-eu-west-1.amazonaws.com/prod-ucs-content-store-eu-west/content/pii:S138111691200235X/fx5/DOWNSAMPLED/image/jpeg/9718fd746d591d03d08c1488a7566506/fx5.jpg fx5 fx5.jpg jpg 2980 99 157 IMAGE-DOWNSAMPLED 1-s2.0-S138111691200235X-fx5.sml https://s3.amazonaws.com/prod-ucs-content-store-us-east/content/pii:S138111691200235X/fx5/THUMBNAIL/image/gif/9ee914781fbb05b56dd0c30949c6c7ff/fx5.sml https://s3-eu-west-1.amazonaws.com/prod-ucs-content-store-eu-west/content/pii:S138111691200235X/fx5/THUMBNAIL/image/gif/9ee914781fbb05b56dd0c30949c6c7ff/fx5.sml fx5 fx5.sml sml 2733 138 219 IMAGE-THUMBNAIL 1-s2.0-S138111691200235X-fx5_lrg.jpg https://s3.amazonaws.com/prod-ucs-content-store-us-east/content/pii:S138111691200235X/fx5/HIGHRES/image/jpeg/264ab61bb25bf0ca4ef7bc859c2bc04e/fx5_lrg.jpg https://s3-eu-west-1.amazonaws.com/prod-ucs-content-store-eu-west/content/pii:S138111691200235X/fx5/HIGHRES/image/jpeg/264ab61bb25bf0ca4ef7bc859c2bc04e/fx5_lrg.jpg fx5 fx5_lrg.jpg jpg 23452 438 695 IMAGE-HIGH-RES 1-s2.0-S138111691200235X-fx6.jpg https://s3.amazonaws.com/prod-ucs-content-store-us-east/content/pii:S138111691200235X/fx6/DOWNSAMPLED/image/jpeg/f89a8d69bfe4a35e7386bc716f7643d7/fx6.jpg https://s3-eu-west-1.amazonaws.com/prod-ucs-content-store-eu-west/content/pii:S138111691200235X/fx6/DOWNSAMPLED/image/jpeg/f89a8d69bfe4a35e7386bc716f7643d7/fx6.jpg fx6 fx6.jpg jpg 1771 85 69 IMAGE-DOWNSAMPLED 1-s2.0-S138111691200235X-fx6.sml https://s3.amazonaws.com/prod-ucs-content-store-us-east/content/pii:S138111691200235X/fx6/THUMBNAIL/image/gif/18da92879ce0cfc183d17d69b3f2652e/fx6.sml https://s3-eu-west-1.amazonaws.com/prod-ucs-content-store-eu-west/content/pii:S138111691200235X/fx6/THUMBNAIL/image/gif/18da92879ce0cfc183d17d69b3f2652e/fx6.sml fx6 fx6.sml sml 2513 163 132 IMAGE-THUMBNAIL 1-s2.0-S138111691200235X-fx6_lrg.jpg https://s3.amazonaws.com/prod-ucs-content-store-us-east/content/pii:S138111691200235X/fx6/HIGHRES/image/jpeg/6b824c92d7c3e55061ffbf441ad62e79/fx6_lrg.jpg https://s3-eu-west-1.amazonaws.com/prod-ucs-content-store-eu-west/content/pii:S138111691200235X/fx6/HIGHRES/image/jpeg/6b824c92d7c3e55061ffbf441ad62e79/fx6_lrg.jpg fx6 fx6_lrg.jpg jpg 12185 380 307 IMAGE-HIGH-RES 1-s2.0-S138111691200235X-fx7.jpg https://s3.amazonaws.com/prod-ucs-content-store-us-east/content/pii:S138111691200235X/fx7/DOWNSAMPLED/image/jpeg/441f7192720ecaee3be73ac1a24b72d4/fx7.jpg https://s3-eu-west-1.amazonaws.com/prod-ucs-content-store-eu-west/content/pii:S138111691200235X/fx7/DOWNSAMPLED/image/jpeg/441f7192720ecaee3be73ac1a24b72d4/fx7.jpg fx7 fx7.jpg jpg 3012 99 157 IMAGE-DOWNSAMPLED 1-s2.0-S138111691200235X-fx7.sml https://s3.amazonaws.com/prod-ucs-content-store-us-east/content/pii:S138111691200235X/fx7/THUMBNAIL/image/gif/4ab57cf5414f3baf7e6d3639678d556c/fx7.sml https://s3-eu-west-1.amazonaws.com/prod-ucs-content-store-eu-west/content/pii:S138111691200235X/fx7/THUMBNAIL/image/gif/4ab57cf5414f3baf7e6d3639678d556c/fx7.sml fx7 fx7.sml sml 2705 138 219 IMAGE-THUMBNAIL 1-s2.0-S138111691200235X-fx7_lrg.jpg https://s3.amazonaws.com/prod-ucs-content-store-us-east/content/pii:S138111691200235X/fx7/HIGHRES/image/jpeg/0d70ee4f04d100240fc90674d6eef075/fx7_lrg.jpg https://s3-eu-west-1.amazonaws.com/prod-ucs-content-store-eu-west/content/pii:S138111691200235X/fx7/HIGHRES/image/jpeg/0d70ee4f04d100240fc90674d6eef075/fx7_lrg.jpg fx7 fx7_lrg.jpg jpg 22965 438 695 IMAGE-HIGH-RES 1-s2.0-S138111691200235X-gr2.jpg https://s3.amazonaws.com/prod-ucs-content-store-us-east/content/pii:S138111691200235X/gr2/DOWNSAMPLED/image/jpeg/08cefac5eab40afa2cedac0b0b8bbb15/gr2.jpg https://s3-eu-west-1.amazonaws.com/prod-ucs-content-store-eu-west/content/pii:S138111691200235X/gr2/DOWNSAMPLED/image/jpeg/08cefac5eab40afa2cedac0b0b8bbb15/gr2.jpg gr2 gr2.jpg jpg 124589 452 602 IMAGE-DOWNSAMPLED 1-s2.0-S138111691200235X-gr2.sml https://s3.amazonaws.com/prod-ucs-content-store-us-east/content/pii:S138111691200235X/gr2/THUMBNAIL/image/gif/f1fb563c4861947ae5f670d1540480a4/gr2.sml https://s3-eu-west-1.amazonaws.com/prod-ucs-content-store-eu-west/content/pii:S138111691200235X/gr2/THUMBNAIL/image/gif/f1fb563c4861947ae5f670d1540480a4/gr2.sml gr2 gr2.sml sml 16983 164 218 IMAGE-THUMBNAIL 1-s2.0-S138111691200235X-gr2_lrg.jpg https://s3.amazonaws.com/prod-ucs-content-store-us-east/content/pii:S138111691200235X/gr2/HIGHRES/image/jpeg/eee174a656bd3f23c20f46d5ecfa847d/gr2_lrg.jpg https://s3-eu-west-1.amazonaws.com/prod-ucs-content-store-eu-west/content/pii:S138111691200235X/gr2/HIGHRES/image/jpeg/eee174a656bd3f23c20f46d5ecfa847d/gr2_lrg.jpg gr2 gr2_lrg.jpg jpg 1602838 2001 2667 IMAGE-HIGH-RES 1-s2.0-S138111691200235X-gr5.jpg https://s3.amazonaws.com/prod-ucs-content-store-us-east/content/pii:S138111691200235X/gr5/DOWNSAMPLED/image/jpeg/b3573e709c2b2669cc9121d3c3f646c4/gr5.jpg https://s3-eu-west-1.amazonaws.com/prod-ucs-content-store-eu-west/content/pii:S138111691200235X/gr5/DOWNSAMPLED/image/jpeg/b3573e709c2b2669cc9121d3c3f646c4/gr5.jpg gr5 gr5.jpg jpg 22069 248 339 IMAGE-DOWNSAMPLED 1-s2.0-S138111691200235X-gr5.sml https://s3.amazonaws.com/prod-ucs-content-store-us-east/content/pii:S138111691200235X/gr5/THUMBNAIL/image/gif/ffca2f7635d5bc4b97be5cc912f4d01c/gr5.sml https://s3-eu-west-1.amazonaws.com/prod-ucs-content-store-eu-west/content/pii:S138111691200235X/gr5/THUMBNAIL/image/gif/ffca2f7635d5bc4b97be5cc912f4d01c/gr5.sml gr5 gr5.sml sml 3372 160 219 IMAGE-THUMBNAIL 1-s2.0-S138111691200235X-gr5_lrg.jpg https://s3.amazonaws.com/prod-ucs-content-store-us-east/content/pii:S138111691200235X/gr5/HIGHRES/image/jpeg/5ebf66a15744979e21d5a5ecdf3d3b31/gr5_lrg.jpg https://s3-eu-west-1.amazonaws.com/prod-ucs-content-store-eu-west/content/pii:S138111691200235X/gr5/HIGHRES/image/jpeg/5ebf66a15744979e21d5a5ecdf3d3b31/gr5_lrg.jpg gr5 gr5_lrg.jpg jpg 119485 1097 1500 IMAGE-HIGH-RES 1-s2.0-S138111691200235X-fx1.jpg https://s3.amazonaws.com/prod-ucs-content-store-us-east/content/pii:S138111691200235X/fx1/DOWNSAMPLED/image/jpeg/2abe399d7005f1b546369c70b1b53110/fx1.jpg https://s3-eu-west-1.amazonaws.com/prod-ucs-content-store-eu-west/content/pii:S138111691200235X/fx1/DOWNSAMPLED/image/jpeg/2abe399d7005f1b546369c70b1b53110/fx1.jpg fx1 true fx1.jpg jpg 14860 200 408 IMAGE-DOWNSAMPLED 1-s2.0-S138111691200235X-fx1.sml https://s3.amazonaws.com/prod-ucs-content-store-us-east/content/pii:S138111691200235X/fx1/THUMBNAIL/image/gif/e2dacf2d9eeb36c2109d94ab15085613/fx1.sml https://s3-eu-west-1.amazonaws.com/prod-ucs-content-store-eu-west/content/pii:S138111691200235X/fx1/THUMBNAIL/image/gif/e2dacf2d9eeb36c2109d94ab15085613/fx1.sml fx1 true fx1.sml sml 4066 107 219 IMAGE-THUMBNAIL 1-s2.0-S138111691200235X-fx1_lrg.jpg https://s3.amazonaws.com/prod-ucs-content-store-us-east/content/pii:S138111691200235X/fx1/HIGHRES/image/jpeg/168d3165c7b4f5729104f86924dfc422/fx1_lrg.jpg https://s3-eu-west-1.amazonaws.com/prod-ucs-content-store-eu-west/content/pii:S138111691200235X/fx1/HIGHRES/image/jpeg/168d3165c7b4f5729104f86924dfc422/fx1_lrg.jpg fx1 fx1_lrg.jpg jpg 103867 886 1806 IMAGE-HIGH-RES MOLCAA 8484 S1381-1169(12)00235-X 10.1016/j.molcata.2012.07.022 Elsevier B.V. Fig. 1 X-ray diffraction patterns for: (a) uncalcined K-10MT, (b) K-10MT after catalysis test (corresponding to Table 2, entry 3) and (c) synthetic montmorillonite S-MMT: ★: quartz (JCPDS no. 01-078-1252). Inset: enlargement of the (060) reflection. Fig. 2 SEM-FEG images of (a) dried K-10MT and (b) S-MMT and TEM images of (c) dried K-10MT (inset: numerical electron diffraction pattern) and (d) K-10MT after catalysis test (corresponding to Table 2, entry 3). Fig. 3 NH3 chemisorption isotherms at 373K for (a) K-10MT and (b) S-MMT: ♢, first isotherm; ■, second isotherm. Fig. 4 (a) Effect of the catalyst mass on the conversion of 2-methylcyclohexanone. Conditions: substrate (5mmol), AcOH/H2O (4.5mL/0.5mL), H2SO4 (0.37mmol), t =24h, T =70°C, P(O2)=0.1MPa and (b) effect of the 2-methylcyclohexanone amount with 0.2g of catalyst at the same reaction conditions. Fig. 5 O2 consumption at 70°C for different solvents using K10-MT for the catalytic oxidation of 2-methylcyclohexanone in (△) water, (□) AcOH and different AcOH/H2O mixtures: (○) 3mL/2mL; (▴) 4mL/1mL; (●) 4.5mL/0.5mL. Fig. 6 Recycling of K-10MT catalyst in the oxidation of 2-methylcyclohexanone by dioxygen. Conditions: substrate (5mmol, 0.6mL), AcOH/H2O (4.5mL/0.5mL), H2SO4 (0.37mmol), K-10MT (0.2g), t =24h, p (O2)=0.1MPa. Fig. 7 Variations of the relative metal contents (M/M 0) determined by XRF for K-10MT powder vs the number of runs: □, Si; ♦, Ca; ●, Al; ◀, K; ▾, Ti; ▵, Fe. Scheme 1 Heterogeneous oxidation of 2-methylcyclohexanone, with dioxygen and catalyzed by commercial K-10MT and synthetic montmorillonite S-MMT. Table 1 Specific surface areas and number of total acid sites determined by ammonia chemisorption at 373K. Sample S BET, m2 g−1 Number of acid sites, mmolg−1 Number of acid sites, μmolm−2 K-10MT 269 0.23 0.85 S-MMT 132 0.34 2.57 Table 2 Oxidation of 2-methylcyclohexanone with K-10MT and S-MMT. Entry Catalyst Solvent (mL) mmol O2 Conversion (%) 6-Oxoheptanoic acid yield (%) 1 a K-10MT CH3OH (5) 0.53 10 8 2 AcOH/H2O (4.5/0.5) 2.65 53 51 3 b AcOH/H2O (4.5/0.5) 3.50 70 68 4 a S-MMT CH3OH (5) 0 – – 5 AcOH/H2O (4.5/0.5) 0 – – 6 b AcOH/H2O (4.5/0.5) 0 – – Conditions: substrate (5mmol, 0.6mL), catalyst (0.2g), t =24h, 70°C, p (O2)=0.1MPa. a Reaction carried out at 60°C. b Test carried out with 0.37mmol H2SO4. Table 3 Effect of solvent on the oxidation reaction of 2-methylcyclohexanone. Entry Solvent (mL) mmol O2 Conversion (%) 6-Oxoheptanoic acid yield (%) 1 CH3CN (5) 0.41 8 7 2 a CH3OH (5) 2.50 50 48 3 H2O (5) 1.10 22 19 4 AcOH/H2O (3/2) 1.60 32 30 5 AcOH/H2O (4/1) 2.97 59 57 6 b AcOH (5) 4.00 80 77 7 – 2.00 40 38 Conditions: substrate (5mmol, 0.6mL), K-10MT (0.2g), H2SO4 (0.37mmol), t =24h, 70°C, p (O2)=0.1MPa. a Reaction carried out at 60°C. b Reaction time 30h. Table 4 Effect of temperature and acidity in the oxidation reaction of 2-methylcyclohexanone. Entry Temperature (°C) mmol sulfuric acid mmol O2 Conversion (%) 6-Oxoheptanoic acid yield (%) 1 r.t. 0.37 0.52 10 8 2 40 0.37 1.35 27 26 3 70 – 2.65 53 51 4 70 0.18 3.00 60 58 5 70 0.37 3.50 70 68 6 70 0.55 3.50 70 68 7 70 0 a 1.65 33 30 8 60 0 a,b 0.60 12 10 9 c 70 0 a,b – 12 10 Conditions: substrate (5mmol, 0.6mL), AcOH/H2O (4.5mL/0.5mL), K-10MT (0.2g), t =24h, p (O2)=0.1MPa. a Reaction carried out with a K-10MT sample (1.0g) first treated with H2SO4 (1.85mmol) in water (25mL) for 5h at 96°C, recovered by filtration and dried at 100°C for 12h. b Reaction carried out in methanol. c In methanol under reflux conditions. Table 5 X-ray fluorescence analyses of the fresh and recovered catalysts. Run % (w/w) SiO2 Al2O3 Fe2O3 TiO2 CaO K2O 0 82.67 13.93 1.61 0.32 0.10 1.36 1 83.37 13.30 1.54 0.32 0.09 1.38 2 83.69 12.99 1.53 0.32 0.09 1.38 3 83.99 12.70 1.52 0.32 0.08 1.39 4 84.15 12.55 1.50 0.33 0.08 1.39 5 84.19 12.51 1.50 0.33 0.08 1.39 Conditions: substrate (5mmol, 0.6mL), AcOH/H2O (4.5mL/0.5mL), H2SO4 (0.37mmol), K-10MT (0.2g), t =24h, p (O2)=0.1MPa. Table 6 Catalytic oxidation of α-substituted ketones by the catalytic system K-10MT/AcOH-H2O/H2SO4/O2. Entry α-Substituted ketones mmol O2 Conversion (%) Product and yield (%) 1 1.85 37 2 a 2.50 50 3 a 1.30 26 Conditions: substrate (5mmol), K-10MT (0.2g), AcOH/H2O (4.5mL/0.5mL), H2SO4 (0.37mmol), t =24h, 70°C, p (O2)=0.1MPa. a Conversions and yields were determined by GC analysis after the in situ esterification of the crude mixture with methanol using methyl heptanoate as internal standard. K-10 montmorillonite: An efficient and reusable catalyst for the aerobic CC bond cleavage of α-substituted ketones Iman El Younssi a Tarik Rhadfi a c Ahmed Atlamsani a ⁎ Jean-Paul Quisefit b Frédéric Herbst c Khalid Draoui a a Université Abdelmalek ESSAADI, Faculté des Sciences Tétouan, Laboratoire des Matériaux et des Systèmes Interfaciaux, P.B. 2121, 93000 Tétouan, Morocco b LISA, Unité Mixte de Recherche Université Paris Diderot, Université Paris Est Créteil Val de Marne et CNRS UMR 7583, Faculté des Sciences et Technologie, 61 avenue du Général de Gaulle, 94010 Créteil Cedex, France c ITODYS, Université Paris Diderot, CNRS UMR 7086, 15 rue Jean-Antoine de Baïf, 75205 Paris Cedex 13, France ⁎ Corresponding author. Tel.: +212 539 97 24 23; fax: +212 539 99 45 00. Graphical abstract Highlights ► The aerobic CC bond cleavage of cyclic ketones with dioxygen using clays catalysts. ► Commercial K-10 clay is compared to a transition metal-free synthetic montmorillonite. ► K-10 montmorillonite can be recycled 5 times without noticeable loss in activity. A commercially available acid-activated montmorillonite clay catalyst, K10 montmorillonite, was tested for the catalytic oxidation of cyclic ketones in the presence of molecular oxygen under mild conditions (343K and atmospheric pressure). K10 montmorillonite catalyzed the oxidative cleavage of CC bonds in 2-methylcyclohexanone, 2-phenylcyclohexanone, 2-hydroxylcyclohexanone and 1,2-cyclohexanedione with good activity and excellent selectivity toward the formation of the corresponding ketoacids and diacids. The effects of acidity, amount of catalyst, temperature and solvent on the catalytic activity were investigated. Furthermore, this catalyst was reusable without any appreciable loss in activity and selectivity. Keywords K-10 montmorillonite Dioxygen α-Substituted ketones Oxidative cleavage 1 Introduction The oxidative cleavage of cyclic ketones and their substituted derivatives is the main pathway for the synthesis of diacids and ketoacids on both the laboratory and industrial scales [1]. Due to ever-growing environmental concerns, there is a strong need for the establishment of promising catalytic protocols using molecular oxygen as an oxidizing non-toxic agent [2]. For that reason, many transition metal-catalyzed aerobic processes, both homogeneous and heterogeneous, have been developed. The conversion of cyclohexanone or of cyclohexanol–cyclohexanone mixtures (KA oil) to adipic acid, one of the starting materials of Nylon® 6-6, is the most important application of this reaction [3]. Nitric acid is used as the oxidant in current processes, thereby leading to pollution with the formation of side-products such as NO x and N2O [4]. Similarly, laboratory-scale experiments based on stoichiometric oxidants like Pb(OAc)4, NaIO4, etc. [1,5] result in the formation of large amounts of solid toxic wastes which are not easily recyclable. The use of such oxidants have also some drawbacks that include corrosion, loss of catalyst, environmental issues and formation of unwanted side products along with the desired one reducing the yield of the latter. Efforts have therefore been made to develop homogeneous catalysts [6] and eco-friendly heterogeneous catalysts for the synthesis of industrially important ketoacids. In this context, we have demonstrated that Nafion® supported vanadium oxo species [7] catalyze efficiently the aerobic cleavage of CC bonds in some α-ketols with good yields and can be recycled. The clay catalysts and montmorillonite in particular, have received considerable attention for different organic syntheses because of their environmental harmlessness, low cost, high selectivity, reusability and operational simplicity [8]. The reactions catalyzed by montmorillonite are generally carried out under mild conditions, the separation of the spent catalyst is achieved by filtration, and the product is recovered by mere evaporation of the solvent. Furthermore, the montmorillonite catalysts can be regenerated easily and reused [9]. Montmorillonite is classified as a 2:1 clay, which means that one octahedral sheet is sandwiched between two silica tetrahedral sheets, and belongs to a highly disordered group of smectites [10]. Water molecules are readily absorbed by montmorillonite, forming hydration shells around the interlayer cations rather than continuous sheets [11]. The cation exchange capacity (CEC) is defined as the maximum amount of any one cation that can be taken up by a given clay [10]. Montmorillonite, as smectites in general, has a high cation exchange capacity, which ranges from 70 to 130mequiv. per 100g [12]. Most of the exchange capacity (80%) is due to substitution within the structure, but a smaller amount (20%) is due to the charges at the edges of the sheets [13]. Acid-activated clays are efficient and relatively inexpensive solid acid catalysts for liquid phase processes [14]. There is, therefore, a great variety in the type and activity of acid treated clays. Despite the discovery of many new inorganic mesoporous molecular sieves on which solid acids can be based, activated clays remain one of the most important and widely used classes of mesoporous solid acid catalyst available in industry [15]. One commercial example is K-10 montmorillonite, which is obtained from the natural montmorillonite by treatment with mineral acids at 96–98°C. The natural montmorillonite structure is progressively destroyed, resulting in a loss of crystallinity but a significant increase in surface area and acidity in comparison to the natural clay [16]. K-10 montmorillonite clay has been widely used as catalyst in a large variety of organic reactions [17–21] and it has also received considerable attention in different areas of organic synthesis [22–27]. In the present study, we report the aerobic cleavage of CC bonds in α-substituted ketones catalyzed by K-10 montmorillonite (referred to as K-10MT). Most experimental parameters such as the addition of organic and inorganic acids, amount of catalyst, temperature and solvent nature were systematically studied. The results are compared to those obtained with a synthetic transition-metal free montmorillonite. 2 Experimental 2.1 Chemicals Aerosil silica (Degussa), magnesium acetate (Prolabo, 98%), boehmite alumina (Sassol, Pural SB-1), sodium acetate (Proanalysi, ≥99%), acetic acid (Riedel de Haën, ≥99%), acetonitrile (Riedel de Haën, ≥99.5%), methanol (Riedel de Haën, ≥99.8%), sulfuric acid (Solvachim, 98%), fluorhydric acid (VWR, 40%), heptanoic acid (Aldrich, ≥97%), 2-methylcyclohexanone (Aldrich, 99%), 2-phenylcyclohexanone (Aldrich, 99%), 2-hydroxycyclohexanone (Aldrich, 99%), 1,2-cyclohexanedione (Acros, 98%) were used as received without any further purification. The K-10 montmorillonite (K-10MT) used in this work was purchased from Aldrich with a surface area (S BET) of 269m2 g−1. The composition (wt.%) of K-10MT determined by X-ray fluorescence (XRF) was: 82.67% SiO2, 13.93% Al2O3, 1.61% Fe2O3, 0.32% TiO2, 0.10% CaO and 1.36% K2O. The calculated cation exchange capacity was 0.8mequiv./g clay. 2.2 Preparation of synthetic montmorillonite In order to evaluate the possible activity of a transition-metal free montmorillonite, a Mg containing synthetic clay, denoted S-MMT, was prepared according to a procedure previously reported by Reinholdt et al. [28]. Briefly, a transition-metal free sample was synthesized in an acidic fluoride medium (caution should be taken when using HF which can cause severe burns to tissue and is lethal) using a Teflon-lined stainless steel autoclave under hydrothermal conditions with the following molar gel composition: 1SiO2:0.2Al2O3:0.1MgO:0.05Na2O:0.05HF:96H2O After 72h reaction time at 493K, the autoclave was allowed to cool and the white precipitate was filtered. The pH of the filtrate was 4.2. The solid was thoroughly washed using Milli-Q® water and finally dried at 333K for 12h. 2.3 Characterization techniques X-ray diffraction patterns were obtained with a Panalytical X’Pert Pro diffractometer equipped with a X’Celerator detector using Fe-filtered Co-Kα radiation. The data were collected at room temperature with a 0.017° step size in 2θ (scan step time=25s), from 2θ =5 to 110°. The crystalline phase was identified by comparison with ICSD reference files. X-ray fluorescence analyses were carried out using a Panalytical Minipal 4 spectrometer equipped with a rhodium anode X-ray tube. The classical preparation method, with approximately 5g of the solid, was not used. An original method based on the analysis of thin layers [29] and adapted to the geometry of the spectrometer (the analytical area of the Minipal 4 is exactly centered on the sample holder and corresponds to a diameter of 8mm) was developed. Briefly, the intensity was first calibrated by depositing 15μL of a known solution (1g/L) of iron or calcium salt on polycarbonate thin membranes (uncertainties less than 1%). For the other elements, a deposit of a very small quantity of a geological powder material (CMR GH-CRPG) was deposited on a second polycarbonate film from a suspension in cyclohexane. For this standard material, the concentrations of all the elements under study are very well known and allow, comparatively to the response for pure iron or calcium deposits, to determine the sensitivity of other elements such as potassium, silicon, aluminum or magnesium. The sensitivity for all elements of interest is thus obtained. A few hundred of micrograms of the montmorillonite sample was deposited exactly in the same manner as for the geological material. Owing to the principle of thin layer analysis, the intensity is directly proportional to the mass of the analyzed element in the analytical area and allows to quantitatively analyze all the deposited powder. We consequently obtain the elemental mass of all the elements of interest in the montmorillonite sample. SEM-FEG images were obtained using a Zeiss SUPRA 40 FESEM that is completely controlled from a computer workstation. The electron source is a thermal field emission gun (Schottky type). Images are created using the SMARTSEM software. Prior to analysis, the samples were coated with a 5nm carbon layer using a Cressington 208 carbon high vacuum carbon coater. TEM experiments were performed using a Jeol JEM 100CXII transmission electron microscope operating at 100kV. One drop of an ethanolic suspension of the as-produced particles was deposited on the carbon membrane of the microscope grid for the observations. Adsorption and desorption nitrogen isotherms were obtained at 77K using a Micromeritics ASAP 2020 apparatus. The samples were outgassed at 423K and 0.1Pa for 12h before measurements. Specific surface area (S BET) values were obtained using the Brunauer–Emmett–Teller equation with relative pressures in the range 0.05–0.20. NH3 chemisorption experiments were realized with a Belsorp apparatus. Samples were first outgassed at 423K and 10Pa for 12h before measurements. The total number of acid sites (Lewis and Brönsted) was determined using the following method. A first isotherm corresponding to physically and chemically adsorbed ammonia was obtained at 373K. Then outgassing at 423K for 3h was performed and a second ammonia adsorption experiment performed at 373K gave a second isotherm. This second isotherm corresponds to physically only adsorbed ammonia. The difference between the first and the second isotherm is the total chemisorbed amount (the total acidity). 2.4 Catalytic tests All catalytic tests were carried out using Schlenk techniques (20mL) which was attached to a vacuum line with a manometer and a gas inlet. Prior to each catalytic test, the clay was dried at 373K for 2h. In a typical experiment, the Schlenk was charged with the solvent (5.0mL; solvent: CH3CN, H2O, CH3OH, CH3COOH or a mixture of CH3COOH and H2O) and K-10MT (0.20g). In some tests H2SO4 (0–0.37mmol) was also added. The substrate (5.0mmol) was then added and the vessel was immersed in an oil bath preheated at 70°C. O2 was introduced at atmospheric pressure and the mixture was stirred magnetically for 24h. Three parallel catalytic experiments were carried out for each test. Dioxygen uptake was determined using a thermostated (70°C) gas burette system connected to the reactor. The addition of heptanoic acid as an internal standard at the beginning of the experiment permitted to quantitatively analyze the products using a Shimadzu GC-17A gas chromatograph equipped with a TRA-5 column (30m×0.25mm internal diameter) and a flame ionization detector. GC conditions: initial temperature, 80°C for 10min; ramp rate, 10°Cmin−1; final temperature, 220°C; injection temperature, 220°C; detector temperature, 250°C; carrier gas, He at 25mLmin−1. Absolute errors were estimated to be about 5%. After catalysis test, the catalyst was recovered following the recommendations proposed by Sheldon [30]: the solid was filtered at the reaction temperature, i.e. 70°C, washed three times with distilled water and dried at 373K for 12h. The powders were characterized by X-ray diffraction (XRD) and transmission electron microscopy (TEM). The recovered catalyst was also used for recycling experiments. 3 Results and discussion 3.1 Characterization of the materials 3.1.1 Structural and morphological studies The X-ray diffraction patterns of the K-10MT and synthetic montmorillonites are presented in Fig. 1 a and c, respectively. They exhibit characteristic reflections usually observed for smectites [28,31]. The basal spacing (d 001) for K-10MT and the synthetic montmorillonite are 10.3 and 14.5Å, respectively. The d 001 inter-reticular distance of a synthetic material natural montmorillonite under a relative humidity of 80% has been reported by Reinholdt et al. to be about 15Å [28]. Because of the swelling properties of smectites, the position of the (001) reflexion depends on the water content of the material which in turn depends on the relative humidity of the atmosphere in which the materials have been stored. The different (001) positions observed for K-10MT and S-MMT could thus be explained by different water amounts in the interlamellar space of the clay mineral. The basal spacing d 001 of montmorillonite K-10MT “with K as predominant exchangeable cations” is 10.3Å in agreement with zero-layer hydration state. The synthetic montmorillonite under high humidity conditions and in presence of Na+ exchangeable cation shows the increase in the basal spacing corresponding to the two layers hydration state (d 001 =14.5Å). Moreover, the (001) peak is clearly broader for S-MMT than for K-10MT which can be explained considering: (i) a higher crystallization state for K-10MT than for S-MMT and/or (ii) smaller crystallite sizes for S-MMT (this latter point is in agreement with the SEM-FEG observations, vide infra). The two samples exhibit a peak at about 73° attributed to the (060) reflection of dioctahedral phyllosilicates [28]. It is well known that for dioctahedral smectites, i.e. containing vacancies in the octahedral layer, the (060) reflection is expected at 1.49Å, whereas for trioctahedral materials, this reflection is at 1.52Å [28,31]. For S-MMT d 060 is 1.49Å whereas for K-10MT, it is 1.50Å. Both values are indicative of dioctahedral smectites. Note that for K-10MT, peaks corresponding to quartz (JCPDS no. 01-078-1252) are also unambiguously identified; this has already been observed by other authors [31,32]. The SEM-FEG micrographs of samples K-10MT and S-MMT are presented in Fig. 2 a and b, respectively. They show clearly the lamellar nature of the materials. The S-MMT clay exhibits a more divided state than K-10MT and is made of crumpled platelets as reported previously by Reinholdt et al. [28]. The TEM image displayed in Fig. 2c shows also the lamellar nature of the K-10MT montmorillonite. The d 001 value, determined with the numerical electron diffraction pattern, is found to be 10.1Å and is in excellent agreement with the value determined by X-ray diffraction. The clays were also characterized using physisorption techniques. Both materials exhibit type II isotherms according to the IUPAC classification [33] with a H3 hysteresis type, usually obtained for aggregates of platy particles or adsorbents containing slit-shaped pores (Fig. S1, Supplementary materials). The C BET constants found for K-10MT and S-MMT are 111 and 264, respectively. The significant higher C BET value for S-MMT than for K-10MT can indicate the existence of microporosity for the former. The specific surface areas, determined using the BET method, are 269 and 132m2 g−1 for K-10MT and S-MMT, respectively. The important difference in the S BET values can be explained taking into account that the commercial K-10MT sample has been activated by mineral acids which leads to a loss of crystallinity but a significant increase in surface area compared to the natural clay [16]. Conversely, even if S-MMT has been prepared in a highly acidic fluoride medium, it has not undergone a post-treatment which can alter its textural properties. 3.1.2 Ammonia chemisorption Ammonia chemisorption has been carried out at 373K in order to evaluate the acidic properties of the two samples. The obtained isotherms are presented in Fig. 3 and the number of total (Lewis and Brønsted) acid sites is given for the two samples in Table 1 . The values (expressed in mmolg−1) obtained here are close to that reported by Flessner et al. for similar solids [34]. However, when normalized to the specific surface area value, S-MMT displays a higher number of acid sites per unit surface area than K-10MT. This result could be explained considering that: (i) S-MMT has been synthesized in a highly acidic fluoride medium and (ii) protons can readily exchange with other cations present in the inter-lamellar space. 3.2 Reactivity 3.2.1 Oxidation of 2-methylcyclohexanone We have first studied the oxidative cleavage of carboncarbon bonds in α-substituted ketones using commercial K-10MT and synthetic montmorillonite S-MMT as heterogeneous catalysts and dioxygen as a clean oxidant. While K-10MT contains iron and titanium cationic species, S-MMT is transition-metal free (see Sections 2.1 and 2.2). Initially, the oxidation of 2-methylcyclohexanone, 1 , to 6-oxoheptanoic acid, 2 , was chosen in order to investigate the catalytic activity, selectivity, and stability of the clays (Scheme 1 ). Note that test experiments realized under the same conditions, but in the absence of a catalyst, showed that the ketoacid cannot be obtained. The catalytic results obtained with the two sets of catalysts, K-10MT and S-MMT are presented in Table 2 . In methanol, the data clearly show that K-10MT is an efficient catalyst contrary to S-MMT, since no conversion is observed with the latter. Nevertheless, a moderate yield is obtained with K-10MT if no acid is added in the reaction medium indicating that the intrinsic acidity of the clay is not sufficient to induce appreciable conversion of the substrate. The improvement of the catalytic activity with the addition of acids is well known [6,7,35,36]. Several reasons have been proposed: (i) the oxidation reaction proceeds first via the formation of the enol tautomer from the cyclic ketone, which is enhanced in the presence of protons [6,7,35,36], (ii) peracetic acid could be generated in situ from acetic acid, the former acting as an oxidant [36] and (iii) the protonation of the cyclohexanone may facilitate its dissolution as far as water is used as the solvent [36] (the solubility of 2-methylcyclohexanone is about 2g per 100mL at 20°C [37]). For instance, previous results obtained with the homogeneous system Cu(NO3)2·3H2O/O2/AcOH/H2O at 60°C have shown that the highest 2-methylcyclohexanone conversion and highest ketoacid yield were obtained for the AcOH/H2O=4.5/0.5mL/mL composition [6]. Recently, Cavani et al. have also shown the dramatic influence of acetic acid used as a co-solvent for the oxidation of cyclohexanone into adipic acid in the presence of H3+n [PMo12−n V n O40]·aq (n =1 and 2) polyoxometalates: the highest conversion was observed for an equivolumetric mixture of water and acetic acid [36]. Moreover it was shown that, in presence of acetic acid, besides the redox mechanism, a radical-chain auto-oxidation mechanism prevailed when a very low catalyst/cyclohexanone was used. For K-10MT, the use of a water/acetic acid mixed solvent also allowed to increase considerably the conversion and the yield toward the ketoacid (see Table 2, entry 2). The catalytic activity could be further increased adding a small amount of sulfuric acid (see Table 2, entry 3). The results displayed in Table 2 also show that the transition metal-free S-MMT is inactive toward the oxidation of 2-methylcyclohexanone, indicating that if acidity is needed, transition metal species are mandatory. 3.2.1.1 Effect of catalyst amount and effect of substrate amount Fig. 4 a shows the effect of the amount of K-10MT catalyst on the conversion of 2-methylcyclohexanone, using a mixed water/acetic acid (4.5/0.5mL/mL) solvent in the presence of a small amount of H2SO4. The amount of K-10MT catalyst was increased from 0 to 0.7g. In the absence of catalyst, the ketoacid could not be obtained. The conversion of the ketone increased with the amount of catalyst, reaching a maximum of 70% for 0.2g. This point can be explained by the increase in the number of acid and redox sites available for oxidation reaction. Further increase in catalyst amount, beyond 0.2g, resulted in a decrease of the conversion of the substrate. Cavani et al. have recently reported that in the presence of acetic acid, two overlapping reaction mechanisms can account for the product distributions: a redox mechanism (predominant in absence of acetic acid) and a radical auto-oxidation one (favored in the presence of acetic acid and low catalyst amounts) [36]. In our work, the decrease in ketone conversion could be explained by chain-termination effects as reported previously for Co-containing molecular sieves for the liquid phase oxidation of cyclohexane to adipic acid [38]. The effect of the initial amount of 2-methylcyclohexanone was investigated on the conversion in the range of 1.25–8.75mmol, at 70°C, by keeping the same amount of catalyst (0.2g). As shown in Fig. 4b, the conversion increased with increase in quantity of 2-methylcyclohexanone reaching a maximum of 70% for 5mmol. In the following, all the catalysis tests were thus performed using 0.2g of solid montmorillonite and 5mmol of substrate. 3.2.1.2 Effect of solvent Preliminary studies with other catalytic systems have emphasized the important role of the solvent [6,39,40]. In this study, the effect of the solvent is also clear: after 24h, the conversion reaches only 8% in acetonitrile whereas it is 22% in aqueous media (Table 3 , entries 1 and 3). With pure methanol, higher values (50%) were obtained (Table 3, entry 2). It is difficult to explain the effect of solvent on the basis of their dipole moments or their dielectric constants, but, whatever the solvent used, excellent selectivities toward 6-oxoheptanoic acid were observed, between 86 and 97%. We believe that the solvent effect could be explained by the fact that the solubility of dioxygen differs from one solvent to another. Probably, when the mole fraction of dioxygen increase the catalytic activity increases. Moreover, X-ray fluorescence analyses have shown that iron and titanium are present in K-10MT whereas the synthetic montmorillonite is transition metal free (vide supra). Thus, the active species could correspond to Fe(II) and/or Fe(III) species and/or Ti(IV). We think that the mixed solvent AcOH/H2O (4.5mL/0.5mL) facilitates the reduction rate of M n+ (M=Fe or Ti) and increases the solubility of dioxygen. By-products such as cyclopentanone are identified, but they are always produced in very low yield. Note that without solvent, a moderate activity (38% yield) is observed but higher than with water (Table 3, entries 3 and 7). It is a very interesting result regarding environmental concerns because the exclusion of pollutants from an unselective preparation method is always preferable to subsequent treatment. In this context, the goal of modern organic synthesis is to develop efficient catalytic methods that can produce compounds with atom economy and environmental advantages. With pure acetic acid (Table 3, entry 6) the conversion of 2-methylcyclohexanone can reach up to 80% but a longer reaction time is necessary (30h). This is explained by an observed induction time (about 6h) before reaction starts (see Fig. 5 ). Based on previous studies [39,40] realized with homogeneous catalytic systems, mixtures of water and acetic acid were also evaluated. The best result (Table 2, entry 3) has been obtained for the AcOH/H2O=4.5/0.5v/v composition with a 68% yield for 6-oxoheptanoic acid after 24h. Indeed, even if the initial rate is higher for the AcOH/H2O=4/1 (v/v) composition than for the latter (see Fig. 5), the final conversion after 24h is substantially lower. In the following, the tests have been carried out with the AcOH/H2O=4.5/0.5 (v/v) mixed solvent. 3.2.1.3 Effect of temperature and acidity We have further studied the role of the temperature and the acidity on the conversion of compounds 1 to 2 . In this way, we realized the oxidation reaction at room temperature (Table 4 , entry 1), at 40°C (Table 4, entry 2) and at 70°C (Table 4, entry 5). The yield in ketoacid was gradually increased from 8 to 68% after 24h. Moreover, previous work has shown the dramatic influence of the Brønsted acidity on the catalytic activity. For instance, the remarkable efficiency of HPA-n, i.e. H3+n [PMo12−n V n O40]·aq, was explained by the combination of their intrinsic Brønsted acidity together with their redox properties [39,40]. In order to obtain higher conversions, the acidity of the catalytic system was further increased via the addition of H2SO4 into the reaction mixture. It seems clear that its presence enhances the catalytic activity in the reaction of oxidative cleavage of 2-methylcyclohexanone (see entries 3–5 in Table 4). Note that a further addition in sulfuric acid (entry 6, Table 4) did not allow to improve the product yield. It is noteworthy that for a K-10 MT sample first treated ex situ with sulfuric acid, a decreased conversion was observed compared to what is obtained for a test performed with K-10MT and the joint addition of sulfuric acid (see Table 4, entry 7 compared to Table 4, entries 3 and 5 and see Table 4, entries 8 and 9 compared to Table 3, entry 2). This could be explained considering that the pre-treatment of K-10MT performed in acidic aqueous medium has led to a partial depletion in some cations within the octahedral sheet (please see XRF results below). Consequently, the number of protons in the interlamellar space was reduced because they balance the net negative charge on the layer which arises from isomorphous substitution in the octahedral sheet [41]. Using clay catalysts, the question of structural stability always arises. Structural evolution of recovered catalyst at the end of the reaction (carried in the presence of H2SO4 at 70°C) was monitored with X-ray diffraction (Fig. 1b) and transmission electron microscopy (Fig. 2d). As shown in Fig. 1b, the addition of sulfuric acid at 70°C to the reaction mixture did not modify the basic structural characteristics of K-10MT, since the original characteristic peaks of the clay are still present. TEM image (Fig. 2d) reveals that the recovered catalyst is still laminated like the fresh clay (Fig. 2c and d). This observation is in good agreement with the X-ray diffraction results. The results given above by XRD and TEM indicate that K-10MT was not degraded under the chosen reaction conditions. 3.2.2 Catalyst regeneration The clay obtained after the catalytic test corresponding to Table 2, entry 3 was separated at the reaction temperature from the reaction mixture by filtration and washed four times with distilled water. The resulting clay was dried at 373K for 10h, grounded into a fine powder and used again to study its activity for the oxidation reaction. Fig. 6 shows that the clay can be recycled several times without any appreciable loss in activity and selectivity (the small observed variations are within the experimental error). 3.2.3 Change in the chemical composition after recycling As it is well known [41,42], acid-activation often results in substantial changes of the montmorillonite clay such as the removal of octahedral cations or the modification of specific surface areas and pore volumes. The XRF chemical analyses (wt.%) of the fresh clay and recovered catalysts are given in Table 5 . The variations of the relative content of metals (M/M 0) in the K-10MT with number of runs are given in Fig. 7 in which M 0 and M are the wt.% of the oxide elements in the fresh clay and recovered catalysts samples. Different behaviors are observed depending on the nature of the element. The relative contents of the leached elements in the K-10MT decrease in the order of Ca2+, Al3+, Fe3+, Si4+, K+ and Ti4+ with the increase in number of run. There is a marked decrease in the Ca element and, to a lesser extent, in the Fe and Al elements, together with a relative increase of the Si, Ti and K elements. Similar observations have been made by Breen et al. for various smectites treated with different combinations of acid concentrations, temperatures and reaction times [41]. These results can be explained considering that the K+ cations between 2:1 layers of montmorillonite and the Si4+, Ti4+ cations at tetrahedral sites of smectite are not extracted from the framework by the addition of sulfuric acid in the reaction mixture. By opposition there is a partial leaching of iron and aluminum under the reacting conditions for the first four tests. After four tests, their amounts in the solid material are nearly constants. It is well known that iron(III) salts can catalyze the oxidative cleavage of cyclic ketones [43]. We thus can suspect the contribution of solvated iron species to the global catalytic activity in the first four runs. However, more importantly, the performances of the catalyst after 5 runs are the same than that of the fresh catalyst whereas the metal leaching in solution, if any, is negligible (see Figs. 6 and 7). This indicates that K-10MT can be considered as a true heterogeneous catalyst. 3.2.4 Oxidation of other α-substituted ketones Encouraged by the remarkable results obtained with the above reaction conditions, and in order to show the scope and possible generalization of this new protocol, we used this catalytic system, K-10MT/AcOH-H2O/H2SO4/O2 for the oxidation of other α-substituted ketones (Table 6 ). 2-Phenylcyclohexanone produces mainly 5-benzoyl valeric acid (entry 1). Treatment of 2-hydroxylcyclohexanone gives adipic acid in good yield with excellent selectivity (Table 6, entry 2). Dimethyl adipate was actually obtained as a result of the in situ esterification of the crude mixture with methanol. Adipic acid can also been obtained from 1,2-cyclohexanedione but with a lower yield (Table 6, entry 3). In both cases, very low yields of dimetyl glutarate and dimethyl succinate derivatives were obtained. 4 Discussion This paper describes the aerobic oxidative CC bond cleavage of α-substituted ketones using montmorillonites as bifunctional catalysts, i.e. both solid and redox catalysts. Two materials were considered: a commercial montmorillonite, K-10MT, and a synthetic product, denoted S-MMT. Both solids exhibit comparable acidic properties as evidenced by NH3 chemisorption at 373K. Nevertheless, no conversion of the α-substituted ketone was observed with S-MMT showing the fundamental role of transition metal species in the reaction pathway. Montmorillonite is a 2:1 layered aluminosilicate with an octahedral sheet (predominantly aluminate) sandwiched by two tetrahedral layers (predominantly silicate). Due to the isomorphous substitution of Al3+ within the octahedral layer by divalent cations such as Mg2+ or Fe2+ and of Si4+ by Al3+ in the tetrahedral layer, the resulting charge deficit is balanced by the incorporation of exchangeable cations in the interlamellar space. X-ray fluorescence analyses have shown that iron and titanium are present in K-10MT whereas the synthetic montmorillonite is transition metal free. Iron(III) has been shown to be active toward the aerobic oxidative CC bond cleavage of α-substituted ketones [43]. The dimension of the hexagonal cavity in the tetrahedral layer is about 5Å [44]. To the best of our knowledge, no data has been reported concerning the kinetic diameter of 2-methylcyclohexanone but for cyclohexane and trimethylbenzene, these diameters are 6.0 and 7.3Å, respectively [45]. Thus, it appears that the physical access of the substrate to the octahedral layer is restricted. However, even if Milone et al. [32] have shown by X-ray fluorescence that Fe cations were mainly located in the octahedral sheet for K-10 montmorillonite, the ion-exchange reaction of a native sample (Fe amount: 2.0wt.%) with a NaCl aqueous solution yielded a material with a reduction of the iron amount (Fe amount: 1.7wt.%) as seen by X-ray fluorescence. Although it is a small diminution (0.3wt.%), it indicates that some Fe cations could be located inside the interlamellar space of the clay and could thus be available for catalysis. To date, titanium(IV) has not been reported as an efficient catalyst for such a reaction, but its participation in the catalytic cycle cannot be discarded. TiO2 solids are well known to activate dioxygen under photocatalytic conditions [46]. Thus, in this work, the active species could correspond to Fe(II) and/or Fe(III) species intercalated between the clay layers and/or Ti(IV) species which are located in the tetrahedral sheet. 5 Conclusion In summary, we have successfully developed a simple and efficient method for the synthesis of ketoacids or diacids derivatives from various α-substituted ketones using cheap and readily available K-10MT as catalyst using molecular oxygen as oxygen source. The main features of this procedure are the appreciable yields of products, the clean reaction profiles (i.e. the good selectivities) and the availability of the reagents at low cost and enhanced rates which makes it a useful and attractive process. The simple experimental and product isolation procedures as well as the easy recovery and reuse of the catalyst are expected to play an important role in the development of this new method. Moreover, these results open the way for the use of this inexpensive material in other applications. Even if acidity is a necessary condition to allow the formation of the enol and the subsequent CC bond oxidative cleavage, the presence of transition metals species is also a prerequisite. Indeed, with a transition metal-free synthetic montmorillonite prepared by hydrothermal synthesis, no conversion was observed. Future efforts will be directed to the preparation of transition metal (such as copper, iron, titanium or vanadium) containing synthetic montmorillonites via cation exchange procedures and to the evaluation of their catalytic properties. Further research will also develop toward elucidating the catalytic oxidation mechanism. Acknowledgements I. El Younssi thanks the Ministère de l’éducation nationale, de l’enseignement supérieur, de la formation des cadres et de la recherche scientifique of Morocco for the allocation grant. T. Rhadfi gratefully acknowledges the Agence Universitaire de la Francophonie and the CNRST for financial support. Thanks are due to Drs. J.-Y. Piquemal and L. Sicard for constructive discussions, for correcting the manuscript and for physicochemical analysis facilities, and to reviewers for valuable comments. Appendix A Supplementary data Supplementary data associated with this article can be found, in the online version, at http://dx.doi.org/10.1016/j.molcata.2012.07.022. Appendix A Supplementary data The following is the supplementary data to this article: References [1] R.C. Larock Comprehensive Organic Transformations second ed. 1999 Wiley New York pp. 1664–1669 [2] K. Kervinen H. Korpi M. Leskelä T. Repo J. Mol. Catal. A: Chem. 203 2003 9 19 [3] A.K. Suresh M.M. Sharma T. Sridhar Ind. Eng. Chem. Res. 39 2000 3958 3997 [4] A. Shimizu K. Tanaka M. Fujimori Chemosphere: Global Change Sci. 2 2000 425 434 [5] R. Floresca M. Kurihara D.S. Watt A. Demir J. Org. Chem. 58 1993 2196 2200 [6] A. Atlamsani J.-M. Brégeault Synthesis 1993 79 81 [7] L. El Aakel F. Launay J.-M. Brégeault A. Atlamsani J. Mol. Catal. A: Chem. 212 2004 171 182 [8] A. Cornelius P. Laszlo Synlett 1994 155 161 [9] T.-K. Huang R. Wang L. Shi X.-X. Lu Catal. Commun. 9 2008 1143 1147 [10] W.E. Worrall Clays and Ceramic Raw Materials second ed. 1986 Elsevier Scientific London [11] W.A. Deer R.A. Howie J. Zussman An Introduction to the Rock-Forming Minerals second ed. 1996 Addison-Wesley-Longman Ltd. Harlow [12] J.T. Kloprogge E. Mahmutagic R.L. Frost J. Colloids Interface Sci. 296 2006 640 646 [13] C.E. Weaver L.D. Pollard The Chemistry of Clay Minerals 1973 Elsevier Scientific Amsterdam [14] M.P. Hart D.R. Brown J. Mol. Catal. A: Chem. 212 2004 315 321 [15] A. Vaccari Catal. Today 41 1998 53 71 [16] T. Cseri S. Békassy F. Figueras E. Cseke L.C. de Menorval R. Dutartre Appl. Catal. A: Gen. 132 1995 141 155 [17] C. Cativiela F. Figueras J.M. Fraile J.I. Garcia J.A. Mayoral Tetrahedron: Asymm. 4 1993 223 228 [18] B.M. Choudary N.S. Chowdari M.L. Kantam R. Kannan Tetrahedron Lett. 40 1999 2859 2862 [19] F.P.R. Crisóstomo R. Carrillo T. Martín V.S. Martín Tetrahedron Lett. 46 2005 2829 2832 [20] T. Kawabata T. Mizugaki K. Ebitani K. Kaneda Tetrahedron Lett. 44 2003 9205 9208 [21] F. Bigi L. Chesini R. Maggi G. Sartori J. Org. Chem. 64 1999 1033 1035 [22] E.C. Taylor C.-S. ChiangeTaylor Synthesis 1977 467 [23] S. Hunig E. Benzing E. Lucke Chem. Ber. 90 1957 2833 2840 [24] J.-F. Roudier A. Foucaud Tetrahedron Lett. 25 1984 4375 4378 [25] B. Labiad D. Villamin Synthesis 1989 143 144 [26] D. Fishman J.T. Klug A. Shani Synthesis 1981 137 138 [27] M. Onaka T. Shinoda Y. Izumi R. Nolen Chem. Lett. 1993 117 120 [28] M. Reinholdt J. Miehé-Brendlé L. Delmotte M.-H. Tuilier R. le Dred R. Cortès A.-M. Flank Eur. J. Inorg. Chem. 2001 2831 2841 [29] P. de Chateaubourg J.-P. Quisefit S. Garivait E. Steiner C. Goyon Analusis 21 1993 293 298 [30] R.A. Sheldon M. Wallau I.W.C.E. Arends U. Schuchardt Acc. Chem. Res. 31 1998 493 495 [31] A. Bakandritsos A. Simopoulos D. Petridis Nanotechnology 17 2006 1112 1117 [32] C. Milone M. Dhanagopal S. Santangelo M. Lanza S. Galvagno G. Messina Ind. Eng. Chem. Res. 49 2010 3242 3249 [33] K.S.W. Sing D.H. Everett R.A.W. Haul L. Moscou R.A. Pierotti J. Rouquerol T. Siemieniewska Pure Appl. Chem. 57 1985 603 619 [34] U. Flessner D.J. Jones J. Rozière J. Zajac L. Storaro M. Lenarda M. Pavan A. Jiménez-López E. Rodríguez-Castellón M. Trombetta G. Busca J. Mol. Catal. A: Chem. 168 2001 247 256 [35] M. Vennat J.-M. Brégeault Appl. Catal. A: Gen. 386 2010 9 15 [36] F. Cavani L. Ferroni A. Frattini C. Lucarelli A. Mazzini K. Raabova S. Alini P. Accorinti P. Babini Appl. Catal. A: Gen. 391 2011 118 124 [37] R.M. Stephenson J. Chem. Eng. Data 37 1992 80 95 [38] I. Belkhir A. Germain F. Fajula E. Fache J. Chem. Soc. Faraday Trans. 94 1998 1761 1764 [39] A. Atlamsani J.-M. Brégeault M. Ziyad J. Org. Chem. 58 1993 5663 5665 [40] L. El Aakel F. Launay A. Atlamsani J.-M. Brégeault Chem. Commun. 2001 2218 2219 [41] C. Breen F. Deeba Zahor J. Madejová P. Komadel J. Phys. Chem. B 101 1997 5324 5331 [42] P. Komadel J. Madejová Acid activation of clay minerals F. Bergaya B.K.G. Theng G. Lagaly Handbook of Clay Science. Development in Clay Science vol. 1 2006 Elsevier Ltd. 263 288 [43] S. Ito M. Matsumoto J. Org. Chem. 48 1983 1133 1135 [44] C. Swearingen J. Wu J. Stucki A. Fitch Environ. Sci. Technol. 38 2004 5598 5603 [45] A. Jakob V. Valtchev M. Soulard D. Faye Langmuir 25 2009 3549 3555 [46] M. Dan-Hardi C. Serre T. Frot L. Rozes G. Maurin C. Sanchez G. Férey J. Am. Chem. Soc. 131 2009 10857 10859",
      "scopus-id": "84866008228",
      "coredata": {
        "eid": "1-s2.0-S138111691200235X",
        "dc:description": "A commercially available acid-activated montmorillonite clay catalyst, K10 montmorillonite, was tested for the catalytic oxidation of cyclic ketones in the presence of molecular oxygen under mild conditions (343K and atmospheric pressure). K10 montmorillonite catalyzed the oxidative cleavage of CC bonds in 2-methylcyclohexanone, 2-phenylcyclohexanone, 2-hydroxylcyclohexanone and 1,2-cyclohexanedione with good activity and excellent selectivity toward the formation of the corresponding ketoacids and diacids. The effects of acidity, amount of catalyst, temperature and solvent on the catalytic activity were investigated. Furthermore, this catalyst was reusable without any appreciable loss in activity and selectivity.",
        "openArchiveArticle": "false",
        "prism:coverDate": "2012-11-30",
        "openaccessUserLicense": null,
        "prism:aggregationType": "Journal",
        "prism:url": "https://api.elsevier.com/content/article/pii/S138111691200235X",
        "dc:creator": [
          {
            "@_fa": "true",
            "$": "El Younssi, Iman"
          },
          {
            "@_fa": "true",
            "$": "Rhadfi, Tarik"
          },
          {
            "@_fa": "true",
            "$": "Atlamsani, Ahmed"
          },
          {
            "@_fa": "true",
            "$": "Quisefit, Jean-Paul"
          },
          {
            "@_fa": "true",
            "$": "Herbst, Frédéric"
          },
          {
            "@_fa": "true",
            "$": "Draoui, Khalid"
          }
        ],
        "link": [
          {
            "@_fa": "true",
            "@rel": "self",
            "@href": "https://api.elsevier.com/content/article/pii/S138111691200235X"
          },
          {
            "@_fa": "true",
            "@rel": "scidir",
            "@href": "https://www.sciencedirect.com/science/article/pii/S138111691200235X"
          }
        ],
        "dc:format": "application/json",
        "openaccessType": null,
        "pii": "S1381-1169(12)00235-X",
        "prism:volume": "363",
        "prism:publisher": "Elsevier B.V.",
        "dc:title": "K-10 montmorillonite: An efficient and reusable catalyst for the aerobic CC bond cleavage of α-substituted ketones",
        "prism:copyright": "Copyright © 2012 Elsevier B.V. All rights reserved.",
        "openaccess": "0",
        "prism:issn": "13811169",
        "dcterms:subject": [
          {
            "@_fa": "true",
            "$": "K-10 montmorillonite"
          },
          {
            "@_fa": "true",
            "$": "Dioxygen"
          },
          {
            "@_fa": "true",
            "$": "α-Substituted ketones"
          },
          {
            "@_fa": "true",
            "$": "Oxidative cleavage"
          }
        ],
        "openaccessArticle": "false",
        "prism:publicationName": "Journal of Molecular Catalysis A: Chemical",
        "openaccessSponsorType": null,
        "prism:pageRange": "437-445",
        "prism:endingPage": "445",
        "pubType": "fla",
        "prism:coverDisplayDate": "November 2012",
        "prism:doi": "10.1016/j.molcata.2012.07.022",
        "prism:startingPage": "437",
        "dc:identifier": "doi:10.1016/j.molcata.2012.07.022",
        "openaccessSponsorName": null
      },
      "objects": {
        "object": [
          {
            "@category": "standard",
            "@_fa": "true",
            "$": "https://api.elsevier.com/content/object/eid/1-s2.0-S138111691200235X-mmc1.doc?httpAccept=%2A%2F%2A",
            "@multimediatype": "Microsoft Word file",
            "@type": "APPLICATION",
            "@size": "96768",
            "@ref": "mmc1",
            "@mimetype": "application/word"
          },
          {
            "@category": "standard",
            "@height": "90",
            "@width": "320",
            "@_fa": "true",
            "$": "https://api.elsevier.com/content/object/eid/1-s2.0-S138111691200235X-sc1.jpg?httpAccept=%2A%2F%2A",
            "@multimediatype": "JPEG image file",
            "@type": "IMAGE-DOWNSAMPLED",
            "@size": "5193",
            "@ref": "sc1",
            "@mimetype": "image/jpeg"
          },
          {
            "@category": "thumbnail",
            "@height": "62",
            "@width": "219",
            "@_fa": "true",
            "$": "https://api.elsevier.com/content/object/eid/1-s2.0-S138111691200235X-sc1.sml?httpAccept=%2A%2F%2A",
            "@multimediatype": "GIF image file",
            "@type": "IMAGE-THUMBNAIL",
            "@size": "2087",
            "@ref": "sc1",
            "@mimetype": "image/gif"
          },
          {
            "@category": "high",
            "@height": "400",
            "@width": "1418",
            "@_fa": "true",
            "$": "https://api.elsevier.com/content/object/eid/1-s2.0-S138111691200235X-sc1_lrg.jpg?httpAccept=%2A%2F%2A",
            "@multimediatype": "JPEG image file",
            "@type": "IMAGE-HIGH-RES",
            "@size": "41017",
            "@ref": "sc1",
            "@mimetype": "image/jpeg"
          },
          {
            "@category": "standard",
            "@height": "382",
            "@width": "330",
            "@_fa": "true",
            "$": "https://api.elsevier.com/content/object/eid/1-s2.0-S138111691200235X-gr1.jpg?httpAccept=%2A%2F%2A",
            "@multimediatype": "JPEG image file",
            "@type": "IMAGE-DOWNSAMPLED",
            "@size": "24120",
            "@ref": "gr1",
            "@mimetype": "image/jpeg"
          },
          {
            "@category": "thumbnail",
            "@height": "163",
            "@width": "141",
            "@_fa": "true",
            "$": "https://api.elsevier.com/content/object/eid/1-s2.0-S138111691200235X-gr1.sml?httpAccept=%2A%2F%2A",
            "@multimediatype": "GIF image file",
            "@type": "IMAGE-THUMBNAIL",
            "@size": "3762",
            "@ref": "gr1",
            "@mimetype": "image/gif"
          },
          {
            "@category": "high",
            "@height": "1693",
            "@width": "1461",
            "@_fa": "true",
            "$": "https://api.elsevier.com/content/object/eid/1-s2.0-S138111691200235X-gr1_lrg.jpg?httpAccept=%2A%2F%2A",
            "@multimediatype": "JPEG image file",
            "@type": "IMAGE-HIGH-RES",
            "@size": "201240",
            "@ref": "gr1",
            "@mimetype": "image/jpeg"
          },
          {
            "@category": "standard",
            "@height": "460",
            "@width": "376",
            "@_fa": "true",
            "$": "https://api.elsevier.com/content/object/eid/1-s2.0-S138111691200235X-gr3.jpg?httpAccept=%2A%2F%2A",
            "@multimediatype": "JPEG image file",
            "@type": "IMAGE-DOWNSAMPLED",
            "@size": "23797",
            "@ref": "gr3",
            "@mimetype": "image/jpeg"
          },
          {
            "@category": "thumbnail",
            "@height": "164",
            "@width": "134",
            "@_fa": "true",
            "$": "https://api.elsevier.com/content/object/eid/1-s2.0-S138111691200235X-gr3.sml?httpAccept=%2A%2F%2A",
            "@multimediatype": "GIF image file",
            "@type": "IMAGE-THUMBNAIL",
            "@size": "3114",
            "@ref": "gr3",
            "@mimetype": "image/gif"
          },
          {
            "@category": "high",
            "@height": "2038",
            "@width": "1667",
            "@_fa": "true",
            "$": "https://api.elsevier.com/content/object/eid/1-s2.0-S138111691200235X-gr3_lrg.jpg?httpAccept=%2A%2F%2A",
            "@multimediatype": "JPEG image file",
            "@type": "IMAGE-HIGH-RES",
            "@size": "192096",
            "@ref": "gr3",
            "@mimetype": "image/jpeg"
          },
          {
            "@category": "standard",
            "@height": "477",
            "@width": "339",
            "@_fa": "true",
            "$": "https://api.elsevier.com/content/object/eid/1-s2.0-S138111691200235X-gr4.jpg?httpAccept=%2A%2F%2A",
            "@multimediatype": "JPEG image file",
            "@type": "IMAGE-DOWNSAMPLED",
            "@size": "26878",
            "@ref": "gr4",
            "@mimetype": "image/jpeg"
          },
          {
            "@category": "thumbnail",
            "@height": "163",
            "@width": "116",
            "@_fa": "true",
            "$": "https://api.elsevier.com/content/object/eid/1-s2.0-S138111691200235X-gr4.sml?httpAccept=%2A%2F%2A",
            "@multimediatype": "GIF image file",
            "@type": "IMAGE-THUMBNAIL",
            "@size": "2929",
            "@ref": "gr4",
            "@mimetype": "image/gif"
          },
          {
            "@category": "high",
            "@height": "2109",
            "@width": "1500",
            "@_fa": "true",
            "$": "https://api.elsevier.com/content/object/eid/1-s2.0-S138111691200235X-gr4_lrg.jpg?httpAccept=%2A%2F%2A",
            "@multimediatype": "JPEG image file",
            "@type": "IMAGE-HIGH-RES",
            "@size": "211938",
            "@ref": "gr4",
            "@mimetype": "image/jpeg"
          },
          {
            "@category": "standard",
            "@height": "272",
            "@width": "336",
            "@_fa": "true",
            "$": "https://api.elsevier.com/content/object/eid/1-s2.0-S138111691200235X-gr6.jpg?httpAccept=%2A%2F%2A",
            "@multimediatype": "JPEG image file",
            "@type": "IMAGE-DOWNSAMPLED",
            "@size": "14927",
            "@ref": "gr6",
            "@mimetype": "image/jpeg"
          },
          {
            "@category": "thumbnail",
            "@height": "163",
            "@width": "202",
            "@_fa": "true",
            "$": "https://api.elsevier.com/content/object/eid/1-s2.0-S138111691200235X-gr6.sml?httpAccept=%2A%2F%2A",
            "@multimediatype": "GIF image file",
            "@type": "IMAGE-THUMBNAIL",
            "@size": "7521",
            "@ref": "gr6",
            "@mimetype": "image/gif"
          },
          {
            "@category": "high",
            "@height": "1205",
            "@width": "1489",
            "@_fa": "true",
            "$": "https://api.elsevier.com/content/object/eid/1-s2.0-S138111691200235X-gr6_lrg.jpg?httpAccept=%2A%2F%2A",
            "@multimediatype": "JPEG image file",
            "@type": "IMAGE-HIGH-RES",
            "@size": "98607",
            "@ref": "gr6",
            "@mimetype": "image/jpeg"
          },
          {
            "@category": "standard",
            "@height": "254",
            "@width": "341",
            "@_fa": "true",
            "$": "https://api.elsevier.com/content/object/eid/1-s2.0-S138111691200235X-gr7.jpg?httpAccept=%2A%2F%2A",
            "@multimediatype": "JPEG image file",
            "@type": "IMAGE-DOWNSAMPLED",
            "@size": "14511",
            "@ref": "gr7",
            "@mimetype": "image/jpeg"
          },
          {
            "@category": "thumbnail",
            "@height": "163",
            "@width": "219",
            "@_fa": "true",
            "$": "https://api.elsevier.com/content/object/eid/1-s2.0-S138111691200235X-gr7.sml?httpAccept=%2A%2F%2A",
            "@multimediatype": "GIF image file",
            "@type": "IMAGE-THUMBNAIL",
            "@size": "4024",
            "@ref": "gr7",
            "@mimetype": "image/gif"
          },
          {
            "@category": "high",
            "@height": "1122",
            "@width": "1509",
            "@_fa": "true",
            "$": "https://api.elsevier.com/content/object/eid/1-s2.0-S138111691200235X-gr7_lrg.jpg?httpAccept=%2A%2F%2A",
            "@multimediatype": "JPEG image file",
            "@type": "IMAGE-HIGH-RES",
            "@size": "112846",
            "@ref": "gr7",
            "@mimetype": "image/jpeg"
          },
          {
            "@category": "standard",
            "@height": "95",
            "@width": "106",
            "@_fa": "true",
            "$": "https://api.elsevier.com/content/object/eid/1-s2.0-S138111691200235X-fx2.jpg?httpAccept=%2A%2F%2A",
            "@multimediatype": "JPEG image file",
            "@type": "IMAGE-DOWNSAMPLED",
            "@size": "2550",
            "@ref": "fx2",
            "@mimetype": "image/jpeg"
          },
          {
            "@category": "thumbnail",
            "@height": "164",
            "@width": "184",
            "@_fa": "true",
            "$": "https://api.elsevier.com/content/object/eid/1-s2.0-S138111691200235X-fx2.sml?httpAccept=%2A%2F%2A",
            "@multimediatype": "GIF image file",
            "@type": "IMAGE-THUMBNAIL",
            "@size": "3039",
            "@ref": "fx2",
            "@mimetype": "image/gif"
          },
          {
            "@category": "high",
            "@height": "420",
            "@width": "471",
            "@_fa": "true",
            "$": "https://api.elsevier.com/content/object/eid/1-s2.0-S138111691200235X-fx2_lrg.jpg?httpAccept=%2A%2F%2A",
            "@multimediatype": "JPEG image file",
            "@type": "IMAGE-HIGH-RES",
            "@size": "18837",
            "@ref": "fx2",
            "@mimetype": "image/jpeg"
          },
          {
            "@category": "standard",
            "@height": "146",
            "@width": "156",
            "@_fa": "true",
            "$": "https://api.elsevier.com/content/object/eid/1-s2.0-S138111691200235X-fx3.jpg?httpAccept=%2A%2F%2A",
            "@multimediatype": "JPEG image file",
            "@type": "IMAGE-DOWNSAMPLED",
            "@size": "3542",
            "@ref": "fx3",
            "@mimetype": "image/jpeg"
          },
          {
            "@category": "thumbnail",
            "@height": "163",
            "@width": "175",
            "@_fa": "true",
            "$": "https://api.elsevier.com/content/object/eid/1-s2.0-S138111691200235X-fx3.sml?httpAccept=%2A%2F%2A",
            "@multimediatype": "GIF image file",
            "@type": "IMAGE-THUMBNAIL",
            "@size": "2512",
            "@ref": "fx3",
            "@mimetype": "image/gif"
          },
          {
            "@category": "high",
            "@height": "648",
            "@width": "694",
            "@_fa": "true",
            "$": "https://api.elsevier.com/content/object/eid/1-s2.0-S138111691200235X-fx3_lrg.jpg?httpAccept=%2A%2F%2A",
            "@multimediatype": "JPEG image file",
            "@type": "IMAGE-HIGH-RES",
            "@size": "29773",
            "@ref": "fx3",
            "@mimetype": "image/jpeg"
          },
          {
            "@category": "standard",
            "@height": "85",
            "@width": "78",
            "@_fa": "true",
            "$": "https://api.elsevier.com/content/object/eid/1-s2.0-S138111691200235X-fx4.jpg?httpAccept=%2A%2F%2A",
            "@multimediatype": "JPEG image file",
            "@type": "IMAGE-DOWNSAMPLED",
            "@size": "1795",
            "@ref": "fx4",
            "@mimetype": "image/jpeg"
          },
          {
            "@category": "thumbnail",
            "@height": "163",
            "@width": "149",
            "@_fa": "true",
            "$": "https://api.elsevier.com/content/object/eid/1-s2.0-S138111691200235X-fx4.sml?httpAccept=%2A%2F%2A",
            "@multimediatype": "GIF image file",
            "@type": "IMAGE-THUMBNAIL",
            "@size": "2504",
            "@ref": "fx4",
            "@mimetype": "image/gif"
          },
          {
            "@category": "high",
            "@height": "380",
            "@width": "347",
            "@_fa": "true",
            "$": "https://api.elsevier.com/content/object/eid/1-s2.0-S138111691200235X-fx4_lrg.jpg?httpAccept=%2A%2F%2A",
            "@multimediatype": "JPEG image file",
            "@type": "IMAGE-HIGH-RES",
            "@size": "11527",
            "@ref": "fx4",
            "@mimetype": "image/jpeg"
          },
          {
            "@category": "standard",
            "@height": "99",
            "@width": "157",
            "@_fa": "true",
            "$": "https://api.elsevier.com/content/object/eid/1-s2.0-S138111691200235X-fx5.jpg?httpAccept=%2A%2F%2A",
            "@multimediatype": "JPEG image file",
            "@type": "IMAGE-DOWNSAMPLED",
            "@size": "2980",
            "@ref": "fx5",
            "@mimetype": "image/jpeg"
          },
          {
            "@category": "thumbnail",
            "@height": "138",
            "@width": "219",
            "@_fa": "true",
            "$": "https://api.elsevier.com/content/object/eid/1-s2.0-S138111691200235X-fx5.sml?httpAccept=%2A%2F%2A",
            "@multimediatype": "GIF image file",
            "@type": "IMAGE-THUMBNAIL",
            "@size": "2733",
            "@ref": "fx5",
            "@mimetype": "image/gif"
          },
          {
            "@category": "high",
            "@height": "438",
            "@width": "695",
            "@_fa": "true",
            "$": "https://api.elsevier.com/content/object/eid/1-s2.0-S138111691200235X-fx5_lrg.jpg?httpAccept=%2A%2F%2A",
            "@multimediatype": "JPEG image file",
            "@type": "IMAGE-HIGH-RES",
            "@size": "23452",
            "@ref": "fx5",
            "@mimetype": "image/jpeg"
          },
          {
            "@category": "standard",
            "@height": "85",
            "@width": "69",
            "@_fa": "true",
            "$": "https://api.elsevier.com/content/object/eid/1-s2.0-S138111691200235X-fx6.jpg?httpAccept=%2A%2F%2A",
            "@multimediatype": "JPEG image file",
            "@type": "IMAGE-DOWNSAMPLED",
            "@size": "1771",
            "@ref": "fx6",
            "@mimetype": "image/jpeg"
          },
          {
            "@category": "thumbnail",
            "@height": "163",
            "@width": "132",
            "@_fa": "true",
            "$": "https://api.elsevier.com/content/object/eid/1-s2.0-S138111691200235X-fx6.sml?httpAccept=%2A%2F%2A",
            "@multimediatype": "GIF image file",
            "@type": "IMAGE-THUMBNAIL",
            "@size": "2513",
            "@ref": "fx6",
            "@mimetype": "image/gif"
          },
          {
            "@category": "high",
            "@height": "380",
            "@width": "307",
            "@_fa": "true",
            "$": "https://api.elsevier.com/content/object/eid/1-s2.0-S138111691200235X-fx6_lrg.jpg?httpAccept=%2A%2F%2A",
            "@multimediatype": "JPEG image file",
            "@type": "IMAGE-HIGH-RES",
            "@size": "12185",
            "@ref": "fx6",
            "@mimetype": "image/jpeg"
          },
          {
            "@category": "standard",
            "@height": "99",
            "@width": "157",
            "@_fa": "true",
            "$": "https://api.elsevier.com/content/object/eid/1-s2.0-S138111691200235X-fx7.jpg?httpAccept=%2A%2F%2A",
            "@multimediatype": "JPEG image file",
            "@type": "IMAGE-DOWNSAMPLED",
            "@size": "3012",
            "@ref": "fx7",
            "@mimetype": "image/jpeg"
          },
          {
            "@category": "thumbnail",
            "@height": "138",
            "@width": "219",
            "@_fa": "true",
            "$": "https://api.elsevier.com/content/object/eid/1-s2.0-S138111691200235X-fx7.sml?httpAccept=%2A%2F%2A",
            "@multimediatype": "GIF image file",
            "@type": "IMAGE-THUMBNAIL",
            "@size": "2705",
            "@ref": "fx7",
            "@mimetype": "image/gif"
          },
          {
            "@category": "high",
            "@height": "438",
            "@width": "695",
            "@_fa": "true",
            "$": "https://api.elsevier.com/content/object/eid/1-s2.0-S138111691200235X-fx7_lrg.jpg?httpAccept=%2A%2F%2A",
            "@multimediatype": "JPEG image file",
            "@type": "IMAGE-HIGH-RES",
            "@size": "22965",
            "@ref": "fx7",
            "@mimetype": "image/jpeg"
          },
          {
            "@category": "standard",
            "@height": "452",
            "@width": "602",
            "@_fa": "true",
            "$": "https://api.elsevier.com/content/object/eid/1-s2.0-S138111691200235X-gr2.jpg?httpAccept=%2A%2F%2A",
            "@multimediatype": "JPEG image file",
            "@type": "IMAGE-DOWNSAMPLED",
            "@size": "124589",
            "@ref": "gr2",
            "@mimetype": "image/jpeg"
          },
          {
            "@category": "thumbnail",
            "@height": "164",
            "@width": "218",
            "@_fa": "true",
            "$": "https://api.elsevier.com/content/object/eid/1-s2.0-S138111691200235X-gr2.sml?httpAccept=%2A%2F%2A",
            "@multimediatype": "GIF image file",
            "@type": "IMAGE-THUMBNAIL",
            "@size": "16983",
            "@ref": "gr2",
            "@mimetype": "image/gif"
          },
          {
            "@category": "high",
            "@height": "2001",
            "@width": "2667",
            "@_fa": "true",
            "$": "https://api.elsevier.com/content/object/eid/1-s2.0-S138111691200235X-gr2_lrg.jpg?httpAccept=%2A%2F%2A",
            "@multimediatype": "JPEG image file",
            "@type": "IMAGE-HIGH-RES",
            "@size": "1602838",
            "@ref": "gr2",
            "@mimetype": "image/jpeg"
          },
          {
            "@category": "standard",
            "@height": "248",
            "@width": "339",
            "@_fa": "true",
            "$": "https://api.elsevier.com/content/object/eid/1-s2.0-S138111691200235X-gr5.jpg?httpAccept=%2A%2F%2A",
            "@multimediatype": "JPEG image file",
            "@type": "IMAGE-DOWNSAMPLED",
            "@size": "22069",
            "@ref": "gr5",
            "@mimetype": "image/jpeg"
          },
          {
            "@category": "thumbnail",
            "@height": "160",
            "@width": "219",
            "@_fa": "true",
            "$": "https://api.elsevier.com/content/object/eid/1-s2.0-S138111691200235X-gr5.sml?httpAccept=%2A%2F%2A",
            "@multimediatype": "GIF image file",
            "@type": "IMAGE-THUMBNAIL",
            "@size": "3372",
            "@ref": "gr5",
            "@mimetype": "image/gif"
          },
          {
            "@category": "high",
            "@height": "1097",
            "@width": "1500",
            "@_fa": "true",
            "$": "https://api.elsevier.com/content/object/eid/1-s2.0-S138111691200235X-gr5_lrg.jpg?httpAccept=%2A%2F%2A",
            "@multimediatype": "JPEG image file",
            "@type": "IMAGE-HIGH-RES",
            "@size": "119485",
            "@ref": "gr5",
            "@mimetype": "image/jpeg"
          },
          {
            "@category": "standard",
            "@height": "200",
            "@width": "408",
            "@_fa": "true",
            "$": "https://api.elsevier.com/content/object/eid/1-s2.0-S138111691200235X-fx1.jpg?httpAccept=%2A%2F%2A",
            "@multimediatype": "JPEG image file",
            "@type": "IMAGE-DOWNSAMPLED",
            "@size": "14860",
            "@ref": "fx1",
            "@mimetype": "image/jpeg"
          },
          {
            "@category": "thumbnail",
            "@height": "107",
            "@width": "219",
            "@_fa": "true",
            "$": "https://api.elsevier.com/content/object/eid/1-s2.0-S138111691200235X-fx1.sml?httpAccept=%2A%2F%2A",
            "@multimediatype": "GIF image file",
            "@type": "IMAGE-THUMBNAIL",
            "@size": "4066",
            "@ref": "fx1",
            "@mimetype": "image/gif"
          },
          {
            "@category": "high",
            "@height": "886",
            "@width": "1806",
            "@_fa": "true",
            "$": "https://api.elsevier.com/content/object/eid/1-s2.0-S138111691200235X-fx1_lrg.jpg?httpAccept=%2A%2F%2A",
            "@multimediatype": "JPEG image file",
            "@type": "IMAGE-HIGH-RES",
            "@size": "103867",
            "@ref": "fx1",
            "@mimetype": "image/jpeg"
          }
        ]
      },
      "link": {
        "@rel": "abstract",
        "@href": "https://api.elsevier.com/content/abstract/scopus_id/84866008228"
      }
    }
  }
}