{
  "metadata": {
    "title": "Reductive dehalogenation of aryl halides over palladium catalysts deposited on SBA-15 type molecular sieve modified with amine donor groups",
    "authors": "; ; ",
    "journal": "Journal of Molecular Catalysis A: Chemical",
    "date": "2011-05-03",
    "doi": "10.1016/j.molcata.2011.04.001",
    "abstract": "",
    "uri": "https://api.elsevier.com/content/article/pii/S1381116911001439",
    "pii": "S1381116911001439"
  },
  "fulltext": {
    "full-text-retrieval-response": {
      "scopus-eid": "2-s2.0-79956188204",
      "originalText": "serial JL 271358 291210 291744 291790 291809 31 Journal of Molecular Catalysis A: Chemical JOURNALMOLECULARCATALYSISACHEMICAL 2011-04-13 2011-04-13 2011-05-17T22:14:23 1-s2.0-S1381116911001439 S1381-1169(11)00143-9 S1381116911001439 10.1016/j.molcata.2011.04.001 S300 S300.1 FULL-TEXT 1-s2.0-S1381116911X00079 2022-06-21T04:35:59.694688Z 0 0 20110503 2011 2011-04-13T00:00:00Z articleinfo crossmark dco dateupdated tomb dateloaded datesearch indexeddate issuelist volumelist yearnav absattachment articletitlenorm authfirstinitialnorm authfirstsurnamenorm cid cids contenttype copyright dateloadedtxt docsubtype doctype doi eid ewtransactionid hubeid issfirst issn issnnorm itemstage itemtransactionid itemweight openaccess openarchive pg pgfirst pglast pii piinorm pubdatestart pubdatetxt pubyr sectiontitle sortorder srctitle srctitlenorm srctype subheadings volfirst volissue webpdf webpdfpagecount figure table body acknowledge affil articletitle auth authfirstini authfull authkeywords authlast footnotes primabst ref specialabst alllist content subj ssids 1381-1169 13811169 341 341 1 2 1 2 Volume 341, Issues 1–2 17 97 102 97 102 20110503 3 May 2011 2011-05-03 2011 Regular papers article fla Copyright © 2011 Elsevier B.V. All rights reserved. REDUCTIVEDEHALOGENATIONARYLHALIDESOVERPALLADIUMCATALYSTSDEPOSITEDSBA15TYPEMOLECULARSIEVEMODIFIEDAMINEDONORGROUPS STEPNICKA P 1 Introduction 2 Results and discussion 2.1 Preparation of the catalysts 2.2 Catalytic tests 3 Conclusions 4 Experimental 4.1 Materials and methods 4.2 Preparation of the catalysts 4.3 Catalytic tests Acknowledgements References VICIU 2001 3607 M DESMARETS 2002 1554 C KUHL 2003 341 S CUCULLU 1999 1299 M NARISADA 1989 5308 M STILES 1994 5381 M VCELAK 1994 1645 J LASSOVA 1998 3538 L CZAKOOVA 2001 277 M KHURANA 2008 1052 J FLETCHER 2009 1343 A ALONSO 1999 4441 F ALONSO 2004 171 F MOGLIE 2006 94 Y YAMASHITA 1985 2709 J HARA 1999 845 R MASSICOT 2000 4765 F JURVILLIERS 2001 744 X PARK 2002 451 C MURTHY 2005 149 K LIPSHUTZ 2001 313 B YAKOVLEV 2000 231 V SELVAM 2004 251 P SELVAM 2004 3071 P ARAMENDIA 2000 465 M BALTZLY 1946 261 R CORTESE 1977 3491 N CELLIER 2003 7191 P SAJIKI 2002 7247 H UKISU 1997 135 Y NAKAO 2005 163 R FUJITA 2002 2964 K OKAMOTO 1981 1265 T UKISU 1998 273 Y CREYGHTON 1995 275 E GHATTAS 2003 40 A DEMEL 2009 28 J DEMEL 2009 442 J DEMEL 2010 13 J LI 2005 681 P SUJANDI 2007 1446 ZHAO 1998 6024 D STEPNICKAX2011X97 STEPNICKAX2011X97X102 STEPNICKAX2011X97XP STEPNICKAX2011X97X102XP 2022-06-10T13:23:05.594Z http://vtw.elsevier.com/data/voc/AddOnTypes/50.7/aggregated-refined Ministry of Education, Youth and Sports of the Czech Republic MSM0021620857 MŠMT Ministerstvo Školství, Mládeže a Tělovýchovy http://data.elsevier.com/vocabulary/SciValFunders/501100001823 http://sws.geonames.org/3077311/ Czech Science Foundation 104/09/0561 GA ČR Grantová Agentura České Republiky http://data.elsevier.com/vocabulary/SciValFunders/501100001824 http://sws.geonames.org/3077311/ This work was financially supported by the Czech Science Foundation (project no. 104/09/0561) and by the Ministry of Education, Youth and Sports of the Czech Republic (project no. MSM0021620857). item S1381-1169(11)00143-9 S1381116911001439 1-s2.0-S1381116911001439 10.1016/j.molcata.2011.04.001 271358 2011-05-19T13:17:39.731347-04:00 2011-05-03 1-s2.0-S1381116911001439-main.pdf https://s3.amazonaws.com/prod-ucs-content-store-us-east/content/pii:S1381116911001439/MAIN/application/pdf/de3e5d62396a2291423b3731a88aedda/main.pdf https://s3-eu-west-1.amazonaws.com/prod-ucs-content-store-eu-west/content/pii:S1381116911001439/MAIN/application/pdf/de3e5d62396a2291423b3731a88aedda/main.pdf main.pdf pdf true 255871 MAIN 6 1-s2.0-S1381116911001439-main_1.png https://s3.amazonaws.com/prod-ucs-content-store-us-east/content/pii:S1381116911001439/PREVIEW/image/png/a86157b6daffd16c2e32d016ac719496/main_1.png https://s3-eu-west-1.amazonaws.com/prod-ucs-content-store-eu-west/content/pii:S1381116911001439/PREVIEW/image/png/a86157b6daffd16c2e32d016ac719496/main_1.png main_1.png png 60830 849 656 IMAGE-WEB-PDF 1 1-s2.0-S1381116911001439-fx1.jpg https://s3.amazonaws.com/prod-ucs-content-store-us-east/content/pii:S1381116911001439/fx1/DOWNSAMPLED/image/jpeg/c1515ea63f195fd0665f0d781470970b/fx1.jpg https://s3-eu-west-1.amazonaws.com/prod-ucs-content-store-eu-west/content/pii:S1381116911001439/fx1/DOWNSAMPLED/image/jpeg/c1515ea63f195fd0665f0d781470970b/fx1.jpg fx1 true fx1.jpg jpg 15253 200 500 IMAGE-DOWNSAMPLED 1-s2.0-S1381116911001439-fx1.sml https://s3.amazonaws.com/prod-ucs-content-store-us-east/content/pii:S1381116911001439/fx1/THUMBNAIL/image/gif/2a1f79f2cf13bcbfed6b0f1fe4329453/fx1.sml https://s3-eu-west-1.amazonaws.com/prod-ucs-content-store-eu-west/content/pii:S1381116911001439/fx1/THUMBNAIL/image/gif/2a1f79f2cf13bcbfed6b0f1fe4329453/fx1.sml fx1 true fx1.sml sml 3061 88 219 IMAGE-THUMBNAIL 1-s2.0-S1381116911001439-fx1_lrg.jpg https://s3.amazonaws.com/prod-ucs-content-store-us-east/content/pii:S1381116911001439/fx1/HIGHRES/image/jpeg/a3cc9d71faa0484d036546056fe06617/fx1_lrg.jpg https://s3-eu-west-1.amazonaws.com/prod-ucs-content-store-eu-west/content/pii:S1381116911001439/fx1/HIGHRES/image/jpeg/a3cc9d71faa0484d036546056fe06617/fx1_lrg.jpg fx1 fx1_lrg.jpg jpg 121485 886 2213 IMAGE-HIGH-RES 1-s2.0-S1381116911001439-gr1.gif https://s3.amazonaws.com/prod-ucs-content-store-us-east/content/pii:S1381116911001439/gr1/DOWNSAMPLED/image/gif/4afd9a41e3b15c86909b87a64a6007fc/gr1.gif https://s3-eu-west-1.amazonaws.com/prod-ucs-content-store-eu-west/content/pii:S1381116911001439/gr1/DOWNSAMPLED/image/gif/4afd9a41e3b15c86909b87a64a6007fc/gr1.gif gr1 gr1.gif gif 5008 248 375 IMAGE-DOWNSAMPLED 1-s2.0-S1381116911001439-gr1.sml https://s3.amazonaws.com/prod-ucs-content-store-us-east/content/pii:S1381116911001439/gr1/THUMBNAIL/image/gif/15b757cc7b9343bde69a2d72986950bd/gr1.sml https://s3-eu-west-1.amazonaws.com/prod-ucs-content-store-eu-west/content/pii:S1381116911001439/gr1/THUMBNAIL/image/gif/15b757cc7b9343bde69a2d72986950bd/gr1.sml gr1 gr1.sml sml 2384 145 219 IMAGE-THUMBNAIL 1-s2.0-S1381116911001439-gr1_lrg.gif https://s3.amazonaws.com/prod-ucs-content-store-us-east/content/pii:S1381116911001439/gr1/HIGHRES/image/gif/63d93b57ebbee2d4aeedaa7153a0bbe4/gr1_lrg.gif https://s3-eu-west-1.amazonaws.com/prod-ucs-content-store-eu-west/content/pii:S1381116911001439/gr1/HIGHRES/image/gif/63d93b57ebbee2d4aeedaa7153a0bbe4/gr1_lrg.gif gr1 gr1_lrg.gif gif 56362 2644 3990 IMAGE-HIGH-RES 1-s2.0-S1381116911001439-gr2.gif https://s3.amazonaws.com/prod-ucs-content-store-us-east/content/pii:S1381116911001439/gr2/DOWNSAMPLED/image/gif/18b5f4ace76ae57e55bc4c14e3d16f64/gr2.gif https://s3-eu-west-1.amazonaws.com/prod-ucs-content-store-eu-west/content/pii:S1381116911001439/gr2/DOWNSAMPLED/image/gif/18b5f4ace76ae57e55bc4c14e3d16f64/gr2.gif gr2 gr2.gif gif 4418 263 345 IMAGE-DOWNSAMPLED 1-s2.0-S1381116911001439-gr2.sml https://s3.amazonaws.com/prod-ucs-content-store-us-east/content/pii:S1381116911001439/gr2/THUMBNAIL/image/gif/b8f32a659e2244d25161917aa68023d8/gr2.sml https://s3-eu-west-1.amazonaws.com/prod-ucs-content-store-eu-west/content/pii:S1381116911001439/gr2/THUMBNAIL/image/gif/b8f32a659e2244d25161917aa68023d8/gr2.sml gr2 gr2.sml sml 2277 164 215 IMAGE-THUMBNAIL 1-s2.0-S1381116911001439-gr2_lrg.gif https://s3.amazonaws.com/prod-ucs-content-store-us-east/content/pii:S1381116911001439/gr2/HIGHRES/image/gif/823ff1cd65ec5f99216c93dc1051725f/gr2_lrg.gif https://s3-eu-west-1.amazonaws.com/prod-ucs-content-store-eu-west/content/pii:S1381116911001439/gr2/HIGHRES/image/gif/823ff1cd65ec5f99216c93dc1051725f/gr2_lrg.gif gr2 gr2_lrg.gif gif 52926 2798 3669 IMAGE-HIGH-RES 1-s2.0-S1381116911001439-gr3.gif https://s3.amazonaws.com/prod-ucs-content-store-us-east/content/pii:S1381116911001439/gr3/DOWNSAMPLED/image/gif/e527942559adf3c259bc84750ca75b4c/gr3.gif https://s3-eu-west-1.amazonaws.com/prod-ucs-content-store-eu-west/content/pii:S1381116911001439/gr3/DOWNSAMPLED/image/gif/e527942559adf3c259bc84750ca75b4c/gr3.gif gr3 gr3.gif gif 4967 272 357 IMAGE-DOWNSAMPLED 1-s2.0-S1381116911001439-gr3.sml https://s3.amazonaws.com/prod-ucs-content-store-us-east/content/pii:S1381116911001439/gr3/THUMBNAIL/image/gif/33b27ecfcf9abde4c2dc2a7437363059/gr3.sml https://s3-eu-west-1.amazonaws.com/prod-ucs-content-store-eu-west/content/pii:S1381116911001439/gr3/THUMBNAIL/image/gif/33b27ecfcf9abde4c2dc2a7437363059/gr3.sml gr3 gr3.sml sml 2376 164 215 IMAGE-THUMBNAIL 1-s2.0-S1381116911001439-gr3_lrg.gif https://s3.amazonaws.com/prod-ucs-content-store-us-east/content/pii:S1381116911001439/gr3/HIGHRES/image/gif/0d6bcfedea708c4f1a448eab373951fe/gr3_lrg.gif https://s3-eu-west-1.amazonaws.com/prod-ucs-content-store-eu-west/content/pii:S1381116911001439/gr3/HIGHRES/image/gif/0d6bcfedea708c4f1a448eab373951fe/gr3_lrg.gif gr3 gr3_lrg.gif gif 58698 2890 3800 IMAGE-HIGH-RES 1-s2.0-S1381116911001439-gr4.gif https://s3.amazonaws.com/prod-ucs-content-store-us-east/content/pii:S1381116911001439/gr4/DOWNSAMPLED/image/gif/487f2bdb6a91e8421c8429fa05bff3f4/gr4.gif https://s3-eu-west-1.amazonaws.com/prod-ucs-content-store-eu-west/content/pii:S1381116911001439/gr4/DOWNSAMPLED/image/gif/487f2bdb6a91e8421c8429fa05bff3f4/gr4.gif gr4 gr4.gif gif 7852 248 356 IMAGE-DOWNSAMPLED 1-s2.0-S1381116911001439-gr4.sml https://s3.amazonaws.com/prod-ucs-content-store-us-east/content/pii:S1381116911001439/gr4/THUMBNAIL/image/gif/e110b4d9775919b1653003b67bf50939/gr4.sml https://s3-eu-west-1.amazonaws.com/prod-ucs-content-store-eu-west/content/pii:S1381116911001439/gr4/THUMBNAIL/image/gif/e110b4d9775919b1653003b67bf50939/gr4.sml gr4 gr4.sml sml 3834 153 219 IMAGE-THUMBNAIL 1-s2.0-S1381116911001439-gr4_lrg.gif https://s3.amazonaws.com/prod-ucs-content-store-us-east/content/pii:S1381116911001439/gr4/HIGHRES/image/gif/3abdf7fd84bb7f41675c4edb98a081b1/gr4_lrg.gif https://s3-eu-west-1.amazonaws.com/prod-ucs-content-store-eu-west/content/pii:S1381116911001439/gr4/HIGHRES/image/gif/3abdf7fd84bb7f41675c4edb98a081b1/gr4_lrg.gif gr4 gr4_lrg.gif gif 82681 2642 3790 IMAGE-HIGH-RES 1-s2.0-S1381116911001439-gr5.gif https://s3.amazonaws.com/prod-ucs-content-store-us-east/content/pii:S1381116911001439/gr5/DOWNSAMPLED/image/gif/35212cee1d734a4363f0cb04443f4638/gr5.gif https://s3-eu-west-1.amazonaws.com/prod-ucs-content-store-eu-west/content/pii:S1381116911001439/gr5/DOWNSAMPLED/image/gif/35212cee1d734a4363f0cb04443f4638/gr5.gif gr5 gr5.gif gif 7163 271 363 IMAGE-DOWNSAMPLED 1-s2.0-S1381116911001439-gr5.sml https://s3.amazonaws.com/prod-ucs-content-store-us-east/content/pii:S1381116911001439/gr5/THUMBNAIL/image/gif/4723e721c3935336c0f18e973da1e56e/gr5.sml https://s3-eu-west-1.amazonaws.com/prod-ucs-content-store-eu-west/content/pii:S1381116911001439/gr5/THUMBNAIL/image/gif/4723e721c3935336c0f18e973da1e56e/gr5.sml gr5 gr5.sml sml 3315 164 219 IMAGE-THUMBNAIL 1-s2.0-S1381116911001439-gr5_lrg.gif https://s3.amazonaws.com/prod-ucs-content-store-us-east/content/pii:S1381116911001439/gr5/HIGHRES/image/gif/594e4b995a0a4c3e1b9b9bb579592186/gr5_lrg.gif https://s3-eu-west-1.amazonaws.com/prod-ucs-content-store-eu-west/content/pii:S1381116911001439/gr5/HIGHRES/image/gif/594e4b995a0a4c3e1b9b9bb579592186/gr5_lrg.gif gr5 gr5_lrg.gif gif 76234 2884 3860 IMAGE-HIGH-RES 1-s2.0-S1381116911001439-gr6.gif https://s3.amazonaws.com/prod-ucs-content-store-us-east/content/pii:S1381116911001439/gr6/DOWNSAMPLED/image/gif/79aa3c1c4b5a5779236968cbb36ba016/gr6.gif https://s3-eu-west-1.amazonaws.com/prod-ucs-content-store-eu-west/content/pii:S1381116911001439/gr6/DOWNSAMPLED/image/gif/79aa3c1c4b5a5779236968cbb36ba016/gr6.gif gr6 gr6.gif gif 5035 258 375 IMAGE-DOWNSAMPLED 1-s2.0-S1381116911001439-gr6.sml https://s3.amazonaws.com/prod-ucs-content-store-us-east/content/pii:S1381116911001439/gr6/THUMBNAIL/image/gif/f14947fc2e020d979e4353a8035995f3/gr6.sml https://s3-eu-west-1.amazonaws.com/prod-ucs-content-store-eu-west/content/pii:S1381116911001439/gr6/THUMBNAIL/image/gif/f14947fc2e020d979e4353a8035995f3/gr6.sml gr6 gr6.sml sml 2440 150 219 IMAGE-THUMBNAIL 1-s2.0-S1381116911001439-gr6_lrg.gif https://s3.amazonaws.com/prod-ucs-content-store-us-east/content/pii:S1381116911001439/gr6/HIGHRES/image/gif/bab3a555d698193b8f11fff33f981165/gr6_lrg.gif https://s3-eu-west-1.amazonaws.com/prod-ucs-content-store-eu-west/content/pii:S1381116911001439/gr6/HIGHRES/image/gif/bab3a555d698193b8f11fff33f981165/gr6_lrg.gif gr6 gr6_lrg.gif gif 59179 2740 3988 IMAGE-HIGH-RES 1-s2.0-S1381116911001439-gr7.gif https://s3.amazonaws.com/prod-ucs-content-store-us-east/content/pii:S1381116911001439/gr7/DOWNSAMPLED/image/gif/f1e11fa16bc5e23ac2612cae93321542/gr7.gif https://s3-eu-west-1.amazonaws.com/prod-ucs-content-store-eu-west/content/pii:S1381116911001439/gr7/DOWNSAMPLED/image/gif/f1e11fa16bc5e23ac2612cae93321542/gr7.gif gr7 gr7.gif gif 7228 244 348 IMAGE-DOWNSAMPLED 1-s2.0-S1381116911001439-gr7.sml https://s3.amazonaws.com/prod-ucs-content-store-us-east/content/pii:S1381116911001439/gr7/THUMBNAIL/image/gif/257a5eb0a05400e314f8353a7a6020ca/gr7.sml https://s3-eu-west-1.amazonaws.com/prod-ucs-content-store-eu-west/content/pii:S1381116911001439/gr7/THUMBNAIL/image/gif/257a5eb0a05400e314f8353a7a6020ca/gr7.sml gr7 gr7.sml sml 3683 153 219 IMAGE-THUMBNAIL 1-s2.0-S1381116911001439-gr7_lrg.gif https://s3.amazonaws.com/prod-ucs-content-store-us-east/content/pii:S1381116911001439/gr7/HIGHRES/image/gif/3c33f151de1ca6ae26f11347383da52d/gr7_lrg.gif https://s3-eu-west-1.amazonaws.com/prod-ucs-content-store-eu-west/content/pii:S1381116911001439/gr7/HIGHRES/image/gif/3c33f151de1ca6ae26f11347383da52d/gr7_lrg.gif gr7 gr7_lrg.gif gif 87781 2596 3706 IMAGE-HIGH-RES 1-s2.0-S1381116911001439-sc1.jpg https://s3.amazonaws.com/prod-ucs-content-store-us-east/content/pii:S1381116911001439/sc1/DOWNSAMPLED/image/jpeg/97f1ae53535212f5de29a46a8b77ad75/sc1.jpg https://s3-eu-west-1.amazonaws.com/prod-ucs-content-store-eu-west/content/pii:S1381116911001439/sc1/DOWNSAMPLED/image/jpeg/97f1ae53535212f5de29a46a8b77ad75/sc1.jpg sc1 sc1.jpg jpg 17166 473 186 IMAGE-DOWNSAMPLED 1-s2.0-S1381116911001439-sc1.sml https://s3.amazonaws.com/prod-ucs-content-store-us-east/content/pii:S1381116911001439/sc1/THUMBNAIL/image/gif/4ff15684ac3cbd2b14c00d8788d00ebe/sc1.sml https://s3-eu-west-1.amazonaws.com/prod-ucs-content-store-eu-west/content/pii:S1381116911001439/sc1/THUMBNAIL/image/gif/4ff15684ac3cbd2b14c00d8788d00ebe/sc1.sml sc1 sc1.sml sml 2332 163 64 IMAGE-THUMBNAIL 1-s2.0-S1381116911001439-sc1_lrg.jpg https://s3.amazonaws.com/prod-ucs-content-store-us-east/content/pii:S1381116911001439/sc1/HIGHRES/image/jpeg/85cfd212153a55f66a07c9ba20d0f6a3/sc1_lrg.jpg https://s3-eu-west-1.amazonaws.com/prod-ucs-content-store-eu-west/content/pii:S1381116911001439/sc1/HIGHRES/image/jpeg/85cfd212153a55f66a07c9ba20d0f6a3/sc1_lrg.jpg sc1 sc1_lrg.jpg jpg 139784 2097 824 IMAGE-HIGH-RES 1-s2.0-S1381116911001439-sc2.jpg https://s3.amazonaws.com/prod-ucs-content-store-us-east/content/pii:S1381116911001439/sc2/DOWNSAMPLED/image/jpeg/a61f6c58f54cf92ca799e49f4af55e4b/sc2.jpg https://s3-eu-west-1.amazonaws.com/prod-ucs-content-store-eu-west/content/pii:S1381116911001439/sc2/DOWNSAMPLED/image/jpeg/a61f6c58f54cf92ca799e49f4af55e4b/sc2.jpg sc2 sc2.jpg jpg 4894 52 304 IMAGE-DOWNSAMPLED 1-s2.0-S1381116911001439-sc2.sml https://s3.amazonaws.com/prod-ucs-content-store-us-east/content/pii:S1381116911001439/sc2/THUMBNAIL/image/gif/bd1a103cfb5616e761662d47b4acc654/sc2.sml https://s3-eu-west-1.amazonaws.com/prod-ucs-content-store-eu-west/content/pii:S1381116911001439/sc2/THUMBNAIL/image/gif/bd1a103cfb5616e761662d47b4acc654/sc2.sml sc2 sc2.sml sml 2152 37 219 IMAGE-THUMBNAIL 1-s2.0-S1381116911001439-sc2_lrg.jpg https://s3.amazonaws.com/prod-ucs-content-store-us-east/content/pii:S1381116911001439/sc2/HIGHRES/image/jpeg/aacd755b8ea0238510a7064a8c295e36/sc2_lrg.jpg https://s3-eu-west-1.amazonaws.com/prod-ucs-content-store-eu-west/content/pii:S1381116911001439/sc2/HIGHRES/image/jpeg/aacd755b8ea0238510a7064a8c295e36/sc2_lrg.jpg sc2 sc2_lrg.jpg jpg 36133 229 1349 IMAGE-HIGH-RES MOLCAA 8106 S1381-1169(11)00143-9 10.1016/j.molcata.2011.04.001 Elsevier B.V. Fig. 1 Changes in the amount of incorporated 3-chloropropyl groups (expressed as w Cl; open circles) and BET surface areas (filled circles) of material 1 with the reaction time. Fig. 2 X-ray diffraction patterns of material 1 obtained after one (dotted line), three (dashed line) or seven days (solid line) of the solvothermal treatment. Fig. 3 Comparison of X-ray diffractions patterns of material 1 (dotted line), material 2a (dashed line), and catalyst 3a (solid line). Fig. 4 Nitrogen adsorption–desorption isotherms for materials 1 (●), 2a (▴), and 3a (■). The isotherms of 2a and 3a are onset by 300 and 600cm3 g−1, respectively, to avoid overlaps (filled symbols=adsorption, empty symbols=desorption). Fig. 5 Kinetic profiles for dehalogenation of 4-bromo- (filled symbols) and 4-iodotoluene (empty symbols) over 3a (circles) and 3b (triangles). Conditions: 0.5mol.% Pd, 5equiv. HCO2H, 80°C. Fig. 6 Influence of the Pd loading on the conversion and turnover numbers. Fig. 7 Powder X-ray diffraction patterns in the region of Pd (111) diffraction as recorded for fresh catalyst 3a (A) and the catalyst recovered from dehalogenation experiments with 4-bromotoluene (B: five runs of 12h each, C: one run for 24h) and 4-iodotoluene (D: one run for 24h). Conditions: 1mmol substrate, 0.5mol.% Pd, 5equiv. HCO2H, 5mL triethylamine, 80°C. Note: The diffractograms are onset along the y-axis to avoid overlaps. Scheme 1 Preparation of materials 1–3. Scheme 2 General scheme of the reductive dehalogenation reaction (X=halide). Table 1 Analytical data and textural parameters for materials and catalysts 1–3. a Material/catalyst Pd content (mmolg−1) Cl content (mmolg−1) N content (mmolg−1) BET surface area (m2 g−1) BJH void volume (cm3 g−1) BJH pore diameter (nm) 1 n.a. 0.72 n.a. 668 0.80 6.4 2a n.a. 0.24 1.11 443 0.84 7.3 2b n.a. 0.14 1.36 477 0.79 6.9 3a 0.56 0.22 0.98 397 0.71 7.3 3b 0.11 0.17 1.36 491 0.79 6.9 a n.a.=not applicable. Table 2 Optimisation of the reactions conditions in the dehalogenation of 4-bromotoluene as the model substrate. a Entry Pd loading [mol.%] Amount of HCOOH [equiv.] T [°C] Conversion [%] 1 0.2 5 80 28 2 0.5 5 80 46 3 1.0 5 80 81 4 2.0 5 80 94 5 5.0 5 80 90 6 0.5 1 80 10 7 0.5 2 80 25 8 0.5 5 80 42 9 0.5 10 80 33 10 0.5 20 80 36 11 0.5 5 60 4 12 0.5 5 65 11 13 0.5 5 70 19 14 0.5 5 75 32 15 0.5 5 80 47 a The reaction time was 12h in all experiments. Table 3 Reactivity of catalyst 3a towards different haloaromatic compounds. a Substrate Conversion [%] b Substrate Conversion [%] b 2-Bromotoluene 6 (27/62) 4-Bromotoluene 12 (28/80 c ) 3-Bromotoluene 5 (39/91) 4-Bromoanisole 4 (21/55) 1-Bromo-4-chlorobenzene 16 (33/69) 1-Iodo-4-chlorobenzene 87 (95/n.d.) 4-Bromoacetophenone 78 (86/n.d.) 4-Chloroacetophenone 6 (28/53) 4-Bromobenzonitrile 97 (n.d.) 4-Chlorobenzonitrile 18 (n.d.) a Conditions: 1mmol of substrate in 5mL of triethylamine, 5equiv. HCO2H, 0.5mol.% Pd catalyst, 80°C. b Conversion after 2h (conversions achieved after 6/12hours are given in parentheses if not specified otherwise). n.d.=not determined. c Conversion after 24h. Table 4 Recyclation tests with catalyst 3a. a Catalytic run Conversion [%] Pd in the liquid phase [ppm] Fraction of total Pd [%] 1 69 4.1 3.0 2 82 1.1 0.8 3 86 1.4 1.0 4 100 3.8 2.8 5 100 1.1 0.8 a Conditions: dehalogenation of 4-bromotoluene (1.0mmol), 0.5mol.% Pd (catalyst 3a), 5equiv. HCO2H, 5mL triethylamine, 80°C/12h. Reductive dehalogenation of aryl halides over palladium catalysts deposited on SBA-15 type molecular sieve modified with amine donor groups Petr Štěpnička a ⁎ Miloslav Semler a b Jan Demel a b 1 Arnošt Zukal b Jiří Čejka b a Department of Inorganic Chemistry, Faculty of Science, Charles University in Prague, Hlavova 2030, 128 40 Prague, Czech Republic b J. Heyrovský Institute of Physical Chemistry, Academy of Sciences of the Czech Republic, v.v.i., Dolejškova 3, 182 23 Prague, Czech Republic ⁎ Corresponding author. Fax: +420 221 951 253. 1 Present address: Institute of Inorganic Chemistry, Academy of Sciences of the Czech Republic, v.v.i., Řež, Czech Republic. Graphical abstract Bromo- and iodobenzenes can be efficiently reductively dehalogenated with triethylammonium formate in the presence of a Pd catalyst deposited on SBA-15 type molecular sieve bearing N-[2-(diethylamino)ethyl]-3-aminopropyl donor groups at the surface. The corresponding chlorobenzenes are dehalogenated with at considerably slower rates while flurobenzenes do not react. This allows for selective dehalogenations of multiply halogenated substrates. Highlights ► Pd catalysts deposited on SBA-15 type support modified with amine groups. ► Catalysts for reductive dehalogenation of haloarenes with formate as the H-source. ► Recyclable and efficient catalysts allowing for selective halogen removal. Supported palladium catalysts prepared from palladium(II) acetate and SBA-15 type molecular sieve modified with N-[2-(diethylamino)ethyl]-3-aminopropyl donor groups efficiently catalyse reductive dehalogenation of various bromo- and iodobenzenes with in situ formed triethylammonium formate as the hydrogen source. Since the corresponding chlorobenzenes react at considerably lower rates while fluorobenzenes remain unaffected, the catalytic system can be utilised for selective dehalogenations of multiply halogenated substrates. Compared with Pd/C tested earlier [N.A. Cortese, R.F. Heck, J. Org. Chem. 42 (1977) 3491], the catalysts deposited over modified SBA-15 are more reactive. Besides, they exert rather minor leaching of the metal component (8.4% during five consecutive runs with 0.5mol.% Pd with respect to the substrate) and maintain their high activity during repeated use. Keywords Heterogeneous catalysts Supported catalysts Palladium Dehalogenation Hydrogen transfer 1 Introduction Halogenated aromatic hydrocarbons are valuable synthetic intermediates finding manifold use in common laboratory praxis and in chemical industry. Their massive use and improper disposal led to global contamination of the environment and, consequently, stimulated interest in processes leading to degradation of these chemically persistent pollutants. The methods utilised to decompose haloaromatic compounds are often based on reductive cleavage of the halogen–carbon bonds. Apart from their environmental significance, these methods hold considerable synthetic potential, particularly when allowing for selective modifications of multiply functionalised aromatic molecules. The dehalogenation reactions are typically performed with reagents combining low-valent transition metal compounds – either defined or generated in situ from suitable precursors (typically carbene [1] or phosphine [2] complexes) – and reducing agents such as hydrides [3], alkali metals [4], zinc metal [5], or Grignard reagents [6]. As practically more convenient alternatives, however, appear to be systems based on a combination of finely dispersed catalytically active metal and reducing agents. Typically, these reducing systems involve Ni or Pd as the metal component and various hydrogen sources. The systems based on Al–Ni nanoparticles/NaH/t-BuOH [7], silica-supported Ni/H2 [8], Ni over C with various H-sources [9] or D2 [10] and, mainly, various forms of supported Pd catalysts (e.g., Pd over MCM-41 [11], Pd over PM2 with formate or 2-propanol [12], Pd over C with H2 [13], D2 [10], N2H4·HCl [14], NEt3/MeOH [15], or 2-propanol/alkali metal hydroxide [16] as the hydrogen source, Pd on polystyrene–poly(ethylene glycol) resin/formate [17]) can serve as typical examples. Systems exploiting unsupported [18] or supported rhodium [16,19] particles, deposited platinum/H2 [20], or a mixed metal Pd–Rh/H2 system [21] have been reported, too. Recently, we have prepared a series of palladium catalysts supported by siliceous materials modified with various aminoalkyl groups at the surface and demonstrated the superiority of the N-[2-(diethylamino)ethyl]-3-aminopropyl donor group [22]. The generally good catalytic performance of these catalysts in C–C bond forming reactions (Suzuki-Miyaura, Heck, and Sonogashira [22,23]) led us to explore their catalytic potential also in other Pd-catalysed reactions. Considering the applications of deposited palladium catalysts mentioned above, we decided to test our catalysts in reductive dehalogenation of aryl halides. In this contribution, we describe reductive dehalogenation of several model substrates with triethylammonium formate (HCO2H/NEt3) [13b] in the presence of Pd catalysts supported by SBA-15 type molecular sieve functionalised with the N-[2-(diethylamino)ethyl]-3-aminopropyl groups. 2 Results and discussion 2.1 Preparation of the catalysts The support required for the preparation of the catalysts was obtained in two steps (Scheme 1 ). At first, all-siliceous SBA-15 type mesoporous molecular sieve modified with 3-chloropropyl groups in the walls (material 1) was prepared by acid-induced co-condensation of sodium silicate and (3-chloropropyl)triethoxysilane (ca. 8mol.% of total Si in the reaction mixture) in the presence of a non-ionic polar, triblock alkene-oxide copolymer Pluronic P123 as the structure directing agent [24]. While trying to optimise the synthesis of material 1, we found that the key properties of this support, namely the amount of incorporated modifying groups (chlorine content) and textural properties, change greatly with the duration of hydrothermal treatment (Fig. 1 ). As the optimal reaction time we chose seven days (at 90°C under autogenous pressure). During this time the chlorine content, reflecting the amount of anchored 3-chloropropyl groups, modestly increased while prolonged reaction times led to its sharp drop. A similar though less pronounced trend was noted also for BET surface areas. The surface areas of material 1 increased during the first ca. 5 days, then levelled-off (till ca. 15 days) and, finally, decreased. It appears likely that extended reaction times lead to a (partial) deterioration of the support, which is reflected by a decrease in the amount of chlorine and the BET surface areas. The powder X-ray diffraction patterns of material 1 prepared over different periods of the hydrothermal treatment (Fig. 2 ) all showed a strong diffraction peak above 2θ =1° and a pair of relatively weaker peaks in the range of 2θ =1.3–1.8°. The patterns observed for individual samples did not differ much from each other and, above all, they confirmed that the structure of pristine SBA-15 [25] remained largely unaffected upon the incorporation of the modifying groups. In the next step, support 1 was reacted with an excess of 2-(N,N-diethylamino)ethylamine in dry toluene (at 100°C for 24h) and the resulting material was converted to a free amine form by treatment with ammonia in a water–ethanol mixture [22]. Comparison of the analytical data obtained for supports resulting from two independent runs revealed the amination step to be rather sensitive to the reaction conditions. Based on the residual chlorine content, 67% of the 3-chloropropyl groups reacted in material 2a (nitrogen content: 1.11mmolg−1), while the data for material 2b suggested ca. 81% conversion (nitrogen content: 1.36mmolg−1). As the last step, the amine-modified sieves were metalated with palladium(II) acetate. Support 2a was used for the preparation of a metal-saturated catalyst 3a via treatment with an excess of palladium(II) acetate (1mmol Pd per 1g of the support, reaction in dichloromethane) and subsequent removal of some loosely bound metal precursor by Soxhlet extraction. Material 2b was treated with only 0.1mmol Pd(OAc)2 per 1g of the solid support to give catalyst 3b. According to elemental analysis, only 56% of the starting palladium(II) acetate was deposited in material 3a (Pd: 0.56mmolg−1; molar Pd:N ratio=1:1.8) while, in the case of 3b, the metal component was deposited quantitatively (Pd: 0.11mmolg−1; molar Pd:N ratio=1:12). Powder X-ray diffraction patterns confirmed that the mesoporous structure of the supports remains virtually unaffected during the amination and metalation steps (Fig. 3 ). The nitrogen adsorption isotherms for materials 1–3 revealed favourable textural characteristics (Table 1 ) as it is typical for well-ordered mesoporous structure of this kind. The isotherms (Fig. 4 ) showed an increase in the adsorbed amount of nitrogen in the p/p 0 range ca. 0.65–0.75, being characteristic for mesoporous molecular sieves with narrow pore size distributions. The calculated textural parameters (Table 1) indicate a considerable decrease in the BET surface areas upon amination. Although the subsequent metalation had a less pronounced effect, the BET surface areas determined for catalyst 3a and 3b still differed considerably reflecting the amount of deposited palladium (cf. 491m2 g−1 for 3b and 397m2 g−1 for the metal-saturated material 3a; relative difference ca. 20%). On the other hand, all materials showed similar void volumes (0.7–0.8cm3 g−1) and pore diameters (around 7nm). Finally, it should be noted, that the data available do not offer any evidence for a particular mode of interaction between the anchored palladium and the surface, and for the role (coordination) of the nitrogen groups. 2.2 Catalytic tests For an initial catalytic testing in reductive dehalogenation (Scheme 2 ) we chose a complete series of 4-halotoluenes as simple model substrates. Initial attempts to combine our catalysts with 2-propanol/NaOH as a conventional hydrogen source were unsuccessful. The dehalogenation reaction did not proceed even with the more reactive halides (bromide and iodide) while the siliceous support was completely destroyed. Stimulated by the work of Cortese and Heck [13b], we then decided to test our catalysts in combination with triethylammonium formate generated in situ from formic acid and an excess of triethylamine. Activity of the catalysts was thus studied in dehalogenation of 4-halotoluenes in a mixture of triethylamine and formic acid (5equiv. HCO2H with respect to the substrate) with 0.5mol.% Pd at 80°C. The reactions with 4-fluoro- and 4-chlorotoluene did not proceed appreciably within 24h. On the other hand, those employing the more reactive 4-bromo- and 4-iodotoluene showed good conversions with 4-iodotoluene being expectedly faster dehalogenated than the bromo derivative with both catalysts (Fig. 5 ). Notably, the catalysts showed significant differences in their relative activities: whereas the metal saturated catalyst 3a performed rather similarly with both substrates, particularly at the later stages of the reaction, its less metalated counterpart 3b showed considerably different reactivity towards bromo and iodotoluene (I≫Br). In the next step, the reaction conditions were optimised with catalyst 3a by changing the amounts of the metal catalyst and the reducing agent (triethylammonium formate, which is generated in situ from HCO2H and NEt3), and the reaction temperature. The results summarised in Table 2 expectedly revealed the conversion to increase with the metal loading up to 90% for 5mol.% of the metal catalyst (Table 2, entries 1–5) while the overall turnover numbers decreased (TONs; Fig. 6 ). As a compromise, we chose 0.5mol.% metal loading (i.e., 0.5mol.% of Pd with respect to substrate) for all other experiments. Changing the amount of the reducing agent (Table 2, entries 6–10) revealed a clear optimum corresponding to 5molar equivalents of the acid with respect to the substrate (i.e., 5mmol per 1mmol of substrate in 5mL of triethylamine as the solvent). With higher amounts of the acid the reaction proceeded still quite well. In contrast, the use of 2 or only 1equiv. of HCO2H resulted in considerably lower conversions. Finally, changing the reaction temperature (Table 2, entries 11–15) showed a very strong influence (approximately exponential) of this reaction parameter on the conversion. For instance, increasing the temperature from 60 to 80°C resulted in a more than ten-fold increase in the conversion (4→47%). Applying the optimised reaction conditions (catalyst 3a, 0.5mol.% Pd, 5equiv. HCO2H, 80°C), dehalogenation of several halide substrates was tested. The results collected in Table 3 show that extended reaction times (12 or 24h) are required for achieving satisfactory conversions with bromobenzenes bearing electron-donating substituents (2-, 3- and 4-Me, 4-MeO; deactivated substrates). In contrast, electron-withdrawing substituents facilitate the halogen removal, which is reflected by very good conversions at considerably shorter reaction times (cf. the data for 4-bromoacetophenone and 4-bromobenzonitrile) [26]. However, this activation is not sufficient to allow for an efficient reductive dehalogenation of aryl chlorides (Table 3). Apart from the mentioned substrates, two asymmetric 1,4-dihalobenzenes were included in testing to examine the possibility of selective dehalogenation of multiply halogenated arenes. Both 1-bromo-4-chlorobenzene and 1-iodo-4-chlorobenzene reacted selectively at the site bearing the more reactive (heavier) halogen. For the former compound, a 69% conversion to chlorobenzene was achieved within 24h. The latter, more reactive substrate was deiodinated almost completely within 2h. Products resulting from chlorine loss (i.e., bromo- or iodobenzene) were not detected by GC analysis. In order to assess the possibility of catalyst recycling, another series of experiments was carried out using catalyst 3a and 4-bromotoluene as the substrate. The data presented in Table 4 clearly demonstrate favourable properties of this catalyst as it not only remained active (the conversion substantially increased upon repeated use!) but also did not suffer from any massive leaching of the deposited metal (max. 3% of total palladium per one catalytic run, cumulative loss ca. 8.4% in five runs). Notably, the amount of leached-out metal did not increase much when the reaction time was prolonged. For instance, the reaction with catalyst 3a and 4-bromo- and 4-iodotoluene proceeded with 80% and 84% conversions, respectively, with only 4.3% and 3.2% of total palladium in the liquid phase after 24h. The data obtained during the recyclation experiments further indicate that the catalyst develops during the reaction and repeated use. It appears likely that palladium(II) initially deposited is reduced (with formate) to form active Pd(0) species. X-ray powder diffraction measurements (Fig. 7 ) revealed no differences in the region of low diffraction angles (2θ <5°), thus suggesting that the structure of the support remains unaffected during the dehalogenation reaction. However, they clearly implicated a formation of palladium metal particles. All materials recovered after dehalogenation experiments exerted broad diffraction line around 2θ =40° corresponding to (111) diffraction of palladium metal [27], while fresh catalyst 3a (measured prior to catalytic use) did not show any detectable peak in this region. 3 Conclusions Deposited palladium catalysts prepared from palladium(II) acetate and SBA-15 type molecular sieve bearing N-[2-(diethylamino)ethyl]-3-aminopropyl donor groups at the surface as the support efficiently promote reductive dehalogenation of bromo- and iodobenzenes with triethylammonium formate. The corresponding chlorobenzenes react at considerably slower rates while fluorobenzenes remain unaffected. Such different reaction rates allow for selective dehalogenations of multiply halogenated substrates. Compared to the commonly used Pd/C, the tested catalysts are more active. In addition, they exert practically negligible leaching of the metal component (8.4% during five consecutive runs at 0.5mol.% Pd loading) and remain active during repeated use (at least for five consecutive runs). 4 Experimental 4.1 Materials and methods Tri-block copolymer poly(ethylene oxide)20(propylene oxide)70(ethylene oxide)20 (Pluronic P123, Aldrich), Na2SiO3·9H2O (Aldrich), HCl (35%, Lach-Ner), (3-chloropropyl)triethoxysilane (Aldrich), 2-(N,N-diethylamino)ethylamine (Aldrich), palladium acetate (Aldrich), p-fluorotoluene (Aldrich), p-chlorotoluene (Fluka), p-bromotoluene (Fluka), p-iodotoluene (Aldrich), 2-propanol (Penta), triethylamine (Acros), dioxane (Riedel-de Haën), mesitylene (Fluka), formic acid (Lachema), sodium hydroxide (Lach-Ner) were used as received. Toluene (Lach-Ner) was dried by standing over sodium metal and distilled. Dichloromethane (Lach-Ner) was dried over anhydrous K2CO3 and distilled. X-ray powder diffractograms were recorded with a Bruker D8 X-ray instrument using graphite-monochromatized Cu Kα radiation (λ =1.5412Å) and a position-sensitive detector Våntec-1 in Bragg–Brentano arrangement. Adsorption isotherms of N2 were determined with a Micromeritics 2020 instrument at −196°C. Prior to the measurement, the samples were degassed by heating to 130°C and then evacuated till a pressure of 1mPa was attained (at least for 24h). The content of palladium was determined by optical emission spectroscopy with inductively coupled plasma (ICP-OES) on an IRIS Interpid II instrument (Thermo Electron) using axial plasma and an ultrasonic nebuliser CETAC U-5000AT+ (plasma power: 1150W, pressure in the nebuliser: 25.0psi, auxiliary gas flow: 1mLmin−1, sample uptake: 2.40mLmin−1, wavelength used for spectrophotometric analysis: 324.270nm). The samples were dissolved in a mixture of concentrated HNO3 and HF (2:3, both Suprapure, Merck; 50°C/15min) and the solutions were diluted with redistilled water. C, H, N, and Cl were determined by a conventional combustion analysis. 4.2 Preparation of the catalysts Material 1. Commercial copolymer P123 (10.0g) and Na2SiO3·9H2O (27.35g, 96.23mmol) were dissolved in demineralised water (256mL) by stirring in a polyethylene flask at room temperature overnight. Concentrated aqueous HCl was added (65mL 35%, ca. 740mmol) and the resulting mixture was heated in a bath kept at 45°C and stirred at 400rpm. After 30min, neat (3-chloropropyl)triethoxysilane (1.96g, 8.14mmol; 7.6% of total Si) was introduced and stirring was continued at 45°C for 1h. Then, the reaction mixture was transferred to a pre-heated oven and allowed to react at 90°C for seven days. The separated product was filtered off, washed thoroughly with distilled water (until the washings were neutral) and ethanol, and dried in the air. The crude product was Soxhlet extracted with ethanol over 24h and dried in the air to afford 1 as a fine white powder. Powder X-ray diffraction (2θ/°): 1.04 (s), 1.64 (w), 1.81 (w). Elemental analysis (mmolg−1): C 7.37, H 26.0, Cl 0.72. Material 2a. An oven-dried reaction flask was charged with material 1 (6.5g) and a stirring bar, and flushed with argon. Dry toluene (140mL) and 2-(N,N-diethylamino)ethylamine (2.4mL, 17mmol) were introduced successively and the resulting mixture was stirred at 100°C for 24h. The solid was collected on a glass frit, washed with ethanol and dried in the air. The intermediate was suspended in a mixture of ethanol (100mL) and aqueous ammonia (25mL 25%) and the suspension was stirred at room temperature for 2.5h. The solid was filtered off, washed with water until the washings were neutral and then with ethanol and, finally, dried in the air to give material 2a as a white powdery solid. Powder X-ray diffraction (2θ/°): 0.94 (s), 1.52 (m), 1.71 (m). Elemental analysis (mmolg−1): C 7.09, H 20.0, N 1.11, Cl 0.24. Material 2b was prepared in exactly the same manner. Elemental analysis (mmolg−1): C 9.43, H 27.5, N 1.36, Cl 0.14. Catalyst 3a. An oven-dried flask was charged with material 2a (4.9g), flushed with argon and sealed with a septum. Palladium(II) acetate (1.101g, 4.9mmol; 1.0mmol per 1g of the support) was dissolved in dry dichloromethane (10mL) and the solution was filtered through a 0.45μm PTFE syringe filter directly to the solid support. The resulting slurry was diluted with dichloromethane (40mL) and stirred under argon for 2h. The solid was filtered off, extracted with dichloromethane in a Soxhlet apparatus for 24h to remove loosely bonded palladium(II) acetate and, finally, dried in the air, affording catalyst 3a as a grey-orange powder. Powder X-ray diffraction (2θ/°): 0.88 (s), 1.49 (w), 1.70 (w). Elemental analysis (mmolg−1): C 8.03, H 20.6, N 0.98, Cl 0.22, Pd 0.56. Catalyst 3b was obtained similarly starting from material 2b (4.8g) and palladium(II) acetate (108mg, 3mmol; 0.10mmol per 1g of the support) in dichloromethane (10+40mL). The product was filtered off, washed with dichloromethane (250mL) and dried in the air to give 3b as a yellowish powder. Powder X-ray diffraction (2θ/°): 0.88 (s), 1.46 (w), 1.66 (w). Elemental analysis (mmolg−1): C 9.01, H 25.8, N 1.36, Cl 0.17, Pd 0.11. 4.3 Catalytic tests Catalytic tests were performed with a Heidolph Synthesis I device allowing for 16 parallel reactions. The reaction vessel was charged with aryl halide (1.0mmol), triethylamine (solvent; 4.0mL), formic acid (5.0mmol), mesitylene (1.0mmol; internal standard) and an appropriate amount of catalyst. For tests with alcoholate reducing system, the reaction mixture consisted of aryl halide (1.0mmol), NaOH (2.0mmol), 2-propanol (5.0mL), mesitylene (1.0mmol; internal standard) and catalyst 3a (0.5mol.% Pd). The reactions were monitored by withdrawing small aliquots of the liquid phase, which were centrifuged at 4000rpm for 10min and then analysed with Agilent 6850 gas chromatograph equipped with a DB-5 column (0.18mm diameter×20m, 0.18μm film thickness) and a FID detector. Acknowledgements This work was financially supported by the Czech Science Foundation (project no. 104/09/0561) and by the Ministry of Education, Youth and Sports of the Czech Republic (project no. MSM0021620857). References [1] (a) M.S. Viciu G.A. Grasa S.P. Nolan Organometallics 20 2001 3607 (b) C. Desmarets S. Kuhl R. Schneider Y. Fort Organometallics 21 2002 1554 (c) S. Kuhl R. Schneider Y. Fort Adv. Synth. Catal. 345 2003 341 [2] M.E. Cucullu S.P. Nolan T.R. Belderrain R.H. Grubbs Organometallics 18 1999 1299 [3] (a) M. Narisada I. Horibe F. Watanabe K. Takeda J. Org. Chem. 54 1989 5308 (b) M. Stiles J. Org. Chem. 59 1994 5381 (c) J. Včelák J. Hetflejš Collect. Czech. Chem. Commun. 59 1994 1645 (d) L. Lassová H.K. Lee T.S.A. Hor J. Org. Chem. 63 1998 3538 (e) M. Czakóová J. Hetflejš J. Včelák React. Kinet. Catal. Lett. 72 2001 277 (f) J.M. Khurana S. Kumar B. Nand Can. J. Chem. 86 2008 1052 (g) A.E.D. Fletcher J.D. Hyatt K.M. Ok D. O’Hare Green Chem. 11 2009 1343 [4] (a) F. Alonso G. Radivoy M. Yus Tetrahedron 55 1999 4441 (b) F. Alonso Y. Moglie G. Radivoy C. Vitale M. Yus Appl. Catal. A 271 2004 171 (c) Y. Moglie F. Alonso C. Vitale M. Yus G. Radivoy Appl. Catal. A 313 2006 94 [5] J. Yamashita Y. Inoue T. Kondo H. Hashimoto Bull. Chem. Soc. Jpn. 58 1985 2709 [6] R. Hara K. Sato W.-H. Sun T. Takahashi Chem. Commun. 1999 845 [7] (a) F. Massicot R. Schneider Y. Fort S. Illy-Cherrey O. Tillement Tetrahedron 56 2000 4765 (b) X. Jurvilliers R. Schneider Y. Fort J. Ghanbaja Appl. Organomet. Chem. 15 2001 744 [8] (a) C. Park C. Menini J.L. Valverde M.A. Keane J. Catal. 211 2002 451 (b) K.V. Murthy P.M. Patterson M.A. Keane J. Mol. Catal. A: Chem. 225 2005 149 [9] B.H. Lipshutz Adv. Synth. Catal. 343 2001 313 [10] V.A. Yakovlev V.V. Terskikh V.I. Simagina V.A. Likholobov J. Mol. Catal. A 153 2000 231 and references therein [11] (a) P. Selvam S.K. Mohapatra S.U. Sonavane R.V. Jayaram Appl. Catal. B 49 2004 251 (b) P. Selvam S.U. Sonavane S.K. Mohapatra R.V. Jayaram Tetrahedron Lett. 45 2004 3071 [12] M.A. Aramendía V. Borau I.M. García C. Jiménez A. Marinas J.M. Marinas F.J. Urbano C. R. Acad. Sci. Paris, Ser. IIc Chim. 3 2000 465 [13] (a) R. Baltzly A.P. Phillips J. Am. Chem. Soc. 68 1946 261 (b) N.A. Cortese R.F. Heck J. Org. Chem. 42 1977 3491 [14] P.P. Cellier J.-F. Spindler M. Taillefer H.-J. Cristau Tetrahedron Lett. 44 2003 7191 [15] H. Sajiki A. Kume K. Hattori K. Hirota Tetrahedron Lett. 43 2002 7247 [16] Y. Ukisu T. Miyadera J. Mol. Catal. A: Chem. 125 1997 135 [17] R. Nakao H. Rhee Y. Uozumi Org. Lett. 7 2005 163 [18] (a) K. Fujita M. Owaki R. Yamaguchi Chem. Commun. 2002 2964 (b) T. Okamoto S. Oka Bull. Chem. Soc. Jpn. 54 1981 1265 [19] Y. Ukisu S. Kameoka T. Miyadera Appl. Catal. B 18 1998 273 [20] E.J. Creyghton M.H.W. Burgers J.C. Jansen H. van Bekkum Appl. Catal. A: Gen. 128 1995 275 [21] A. Ghattas R. Abu-Reziq D. Avnir J. Blum Green Chem. 5 2003 40 [22] (a) J. Demel Sujandi S.-E. Park J. Čejka P. Štěpnička J. Mol. Catal. A: Chem. 302 2009 28 (b) J. Demel M. Lamač J. Čejka P. Štěpnička ChemSusChem 2 2009 442 (c) J. Demel J. Čejka P. Štěpnička J. Mol. Catal. A: Chem. 329 2010 13 [23] For a related catalyst, see: P.-H. Li L. Wang Adv. Synth. Catal. 348 2005 681 [24] Sujandi S.-E. Park Stud. Surf. Sci. Catal. 170 2007 1446 [25] D. Zhao Q. Huo J. Feng B.F. Chmelka G.D. Stucky J. Am. Chem. Soc. 120 1998 6024 [26] One referee suggested that the relatively higher conversion may be in this case also due to a stronger interaction of these substrates with Pd [27] PDF card 5-0681: Palladium, cubic, space group Fm-3m (no. 225), a =3.8898Å at 26°C; h k l 111, d =2.246Å, relative intensity=100, 2θ ≈40° at Cu Kα.",
      "scopus-id": "79956188204",
      "coredata": {
        "eid": "1-s2.0-S1381116911001439",
        "dc:description": "Supported palladium catalysts prepared from palladium(II) acetate and SBA-15 type molecular sieve modified with N-[2-(diethylamino)ethyl]-3-aminopropyl donor groups efficiently catalyse reductive dehalogenation of various bromo- and iodobenzenes with in situ formed triethylammonium formate as the hydrogen source. Since the corresponding chlorobenzenes react at considerably lower rates while fluorobenzenes remain unaffected, the catalytic system can be utilised for selective dehalogenations of multiply halogenated substrates. Compared with Pd/C tested earlier [N.A. Cortese, R.F. Heck, J. Org. Chem. 42 (1977) 3491], the catalysts deposited over modified SBA-15 are more reactive. Besides, they exert rather minor leaching of the metal component (8.4% during five consecutive runs with 0.5mol.% Pd with respect to the substrate) and maintain their high activity during repeated use.",
        "openArchiveArticle": "false",
        "prism:coverDate": "2011-05-03",
        "openaccessUserLicense": null,
        "prism:aggregationType": "Journal",
        "prism:url": "https://api.elsevier.com/content/article/pii/S1381116911001439",
        "dc:creator": [
          {
            "@_fa": "true",
            "$": "Štěpnička, Petr"
          },
          {
            "@_fa": "true",
            "$": "Semler, Miloslav"
          },
          {
            "@_fa": "true",
            "$": "Demel, Jan"
          },
          {
            "@_fa": "true",
            "$": "Zukal, Arnošt"
          },
          {
            "@_fa": "true",
            "$": "Čejka, Jiří"
          }
        ],
        "link": [
          {
            "@_fa": "true",
            "@rel": "self",
            "@href": "https://api.elsevier.com/content/article/pii/S1381116911001439"
          },
          {
            "@_fa": "true",
            "@rel": "scidir",
            "@href": "https://www.sciencedirect.com/science/article/pii/S1381116911001439"
          }
        ],
        "dc:format": "application/json",
        "openaccessType": null,
        "pii": "S1381-1169(11)00143-9",
        "prism:volume": "341",
        "prism:publisher": "Elsevier B.V.",
        "dc:title": "Reductive dehalogenation of aryl halides over palladium catalysts deposited on SBA-15 type molecular sieve modified with amine donor groups",
        "prism:copyright": "Copyright © 2011 Elsevier B.V. All rights reserved.",
        "openaccess": "0",
        "prism:issn": "13811169",
        "prism:issueIdentifier": "1-2",
        "dcterms:subject": [
          {
            "@_fa": "true",
            "$": "Heterogeneous catalysts"
          },
          {
            "@_fa": "true",
            "$": "Supported catalysts"
          },
          {
            "@_fa": "true",
            "$": "Palladium"
          },
          {
            "@_fa": "true",
            "$": "Dehalogenation"
          },
          {
            "@_fa": "true",
            "$": "Hydrogen transfer"
          }
        ],
        "openaccessArticle": "false",
        "prism:publicationName": "Journal of Molecular Catalysis A: Chemical",
        "prism:number": "1-2",
        "openaccessSponsorType": null,
        "prism:pageRange": "97-102",
        "prism:endingPage": "102",
        "pubType": "fla",
        "prism:coverDisplayDate": "3 May 2011",
        "prism:doi": "10.1016/j.molcata.2011.04.001",
        "prism:startingPage": "97",
        "dc:identifier": "doi:10.1016/j.molcata.2011.04.001",
        "openaccessSponsorName": null
      },
      "objects": {
        "object": [
          {
            "@category": "standard",
            "@height": "200",
            "@width": "500",
            "@_fa": "true",
            "$": "https://api.elsevier.com/content/object/eid/1-s2.0-S1381116911001439-fx1.jpg?httpAccept=%2A%2F%2A",
            "@multimediatype": "JPEG image file",
            "@type": "IMAGE-DOWNSAMPLED",
            "@size": "15253",
            "@ref": "fx1",
            "@mimetype": "image/jpeg"
          },
          {
            "@category": "thumbnail",
            "@height": "88",
            "@width": "219",
            "@_fa": "true",
            "$": "https://api.elsevier.com/content/object/eid/1-s2.0-S1381116911001439-fx1.sml?httpAccept=%2A%2F%2A",
            "@multimediatype": "GIF image file",
            "@type": "IMAGE-THUMBNAIL",
            "@size": "3061",
            "@ref": "fx1",
            "@mimetype": "image/gif"
          },
          {
            "@category": "high",
            "@height": "886",
            "@width": "2213",
            "@_fa": "true",
            "$": "https://api.elsevier.com/content/object/eid/1-s2.0-S1381116911001439-fx1_lrg.jpg?httpAccept=%2A%2F%2A",
            "@multimediatype": "JPEG image file",
            "@type": "IMAGE-HIGH-RES",
            "@size": "121485",
            "@ref": "fx1",
            "@mimetype": "image/jpeg"
          },
          {
            "@category": "standard",
            "@height": "248",
            "@width": "375",
            "@_fa": "true",
            "$": "https://api.elsevier.com/content/object/eid/1-s2.0-S1381116911001439-gr1.gif?httpAccept=%2A%2F%2A",
            "@multimediatype": "GIF image file",
            "@type": "IMAGE-DOWNSAMPLED",
            "@size": "5008",
            "@ref": "gr1",
            "@mimetype": "image/gif"
          },
          {
            "@category": "thumbnail",
            "@height": "145",
            "@width": "219",
            "@_fa": "true",
            "$": "https://api.elsevier.com/content/object/eid/1-s2.0-S1381116911001439-gr1.sml?httpAccept=%2A%2F%2A",
            "@multimediatype": "GIF image file",
            "@type": "IMAGE-THUMBNAIL",
            "@size": "2384",
            "@ref": "gr1",
            "@mimetype": "image/gif"
          },
          {
            "@category": "high",
            "@height": "2644",
            "@width": "3990",
            "@_fa": "true",
            "$": "https://api.elsevier.com/content/object/eid/1-s2.0-S1381116911001439-gr1_lrg.gif?httpAccept=%2A%2F%2A",
            "@multimediatype": "GIF image file",
            "@type": "IMAGE-HIGH-RES",
            "@size": "56362",
            "@ref": "gr1",
            "@mimetype": "image/gif"
          },
          {
            "@category": "standard",
            "@height": "263",
            "@width": "345",
            "@_fa": "true",
            "$": "https://api.elsevier.com/content/object/eid/1-s2.0-S1381116911001439-gr2.gif?httpAccept=%2A%2F%2A",
            "@multimediatype": "GIF image file",
            "@type": "IMAGE-DOWNSAMPLED",
            "@size": "4418",
            "@ref": "gr2",
            "@mimetype": "image/gif"
          },
          {
            "@category": "thumbnail",
            "@height": "164",
            "@width": "215",
            "@_fa": "true",
            "$": "https://api.elsevier.com/content/object/eid/1-s2.0-S1381116911001439-gr2.sml?httpAccept=%2A%2F%2A",
            "@multimediatype": "GIF image file",
            "@type": "IMAGE-THUMBNAIL",
            "@size": "2277",
            "@ref": "gr2",
            "@mimetype": "image/gif"
          },
          {
            "@category": "high",
            "@height": "2798",
            "@width": "3669",
            "@_fa": "true",
            "$": "https://api.elsevier.com/content/object/eid/1-s2.0-S1381116911001439-gr2_lrg.gif?httpAccept=%2A%2F%2A",
            "@multimediatype": "GIF image file",
            "@type": "IMAGE-HIGH-RES",
            "@size": "52926",
            "@ref": "gr2",
            "@mimetype": "image/gif"
          },
          {
            "@category": "standard",
            "@height": "272",
            "@width": "357",
            "@_fa": "true",
            "$": "https://api.elsevier.com/content/object/eid/1-s2.0-S1381116911001439-gr3.gif?httpAccept=%2A%2F%2A",
            "@multimediatype": "GIF image file",
            "@type": "IMAGE-DOWNSAMPLED",
            "@size": "4967",
            "@ref": "gr3",
            "@mimetype": "image/gif"
          },
          {
            "@category": "thumbnail",
            "@height": "164",
            "@width": "215",
            "@_fa": "true",
            "$": "https://api.elsevier.com/content/object/eid/1-s2.0-S1381116911001439-gr3.sml?httpAccept=%2A%2F%2A",
            "@multimediatype": "GIF image file",
            "@type": "IMAGE-THUMBNAIL",
            "@size": "2376",
            "@ref": "gr3",
            "@mimetype": "image/gif"
          },
          {
            "@category": "high",
            "@height": "2890",
            "@width": "3800",
            "@_fa": "true",
            "$": "https://api.elsevier.com/content/object/eid/1-s2.0-S1381116911001439-gr3_lrg.gif?httpAccept=%2A%2F%2A",
            "@multimediatype": "GIF image file",
            "@type": "IMAGE-HIGH-RES",
            "@size": "58698",
            "@ref": "gr3",
            "@mimetype": "image/gif"
          },
          {
            "@category": "standard",
            "@height": "248",
            "@width": "356",
            "@_fa": "true",
            "$": "https://api.elsevier.com/content/object/eid/1-s2.0-S1381116911001439-gr4.gif?httpAccept=%2A%2F%2A",
            "@multimediatype": "GIF image file",
            "@type": "IMAGE-DOWNSAMPLED",
            "@size": "7852",
            "@ref": "gr4",
            "@mimetype": "image/gif"
          },
          {
            "@category": "thumbnail",
            "@height": "153",
            "@width": "219",
            "@_fa": "true",
            "$": "https://api.elsevier.com/content/object/eid/1-s2.0-S1381116911001439-gr4.sml?httpAccept=%2A%2F%2A",
            "@multimediatype": "GIF image file",
            "@type": "IMAGE-THUMBNAIL",
            "@size": "3834",
            "@ref": "gr4",
            "@mimetype": "image/gif"
          },
          {
            "@category": "high",
            "@height": "2642",
            "@width": "3790",
            "@_fa": "true",
            "$": "https://api.elsevier.com/content/object/eid/1-s2.0-S1381116911001439-gr4_lrg.gif?httpAccept=%2A%2F%2A",
            "@multimediatype": "GIF image file",
            "@type": "IMAGE-HIGH-RES",
            "@size": "82681",
            "@ref": "gr4",
            "@mimetype": "image/gif"
          },
          {
            "@category": "standard",
            "@height": "271",
            "@width": "363",
            "@_fa": "true",
            "$": "https://api.elsevier.com/content/object/eid/1-s2.0-S1381116911001439-gr5.gif?httpAccept=%2A%2F%2A",
            "@multimediatype": "GIF image file",
            "@type": "IMAGE-DOWNSAMPLED",
            "@size": "7163",
            "@ref": "gr5",
            "@mimetype": "image/gif"
          },
          {
            "@category": "thumbnail",
            "@height": "164",
            "@width": "219",
            "@_fa": "true",
            "$": "https://api.elsevier.com/content/object/eid/1-s2.0-S1381116911001439-gr5.sml?httpAccept=%2A%2F%2A",
            "@multimediatype": "GIF image file",
            "@type": "IMAGE-THUMBNAIL",
            "@size": "3315",
            "@ref": "gr5",
            "@mimetype": "image/gif"
          },
          {
            "@category": "high",
            "@height": "2884",
            "@width": "3860",
            "@_fa": "true",
            "$": "https://api.elsevier.com/content/object/eid/1-s2.0-S1381116911001439-gr5_lrg.gif?httpAccept=%2A%2F%2A",
            "@multimediatype": "GIF image file",
            "@type": "IMAGE-HIGH-RES",
            "@size": "76234",
            "@ref": "gr5",
            "@mimetype": "image/gif"
          },
          {
            "@category": "standard",
            "@height": "258",
            "@width": "375",
            "@_fa": "true",
            "$": "https://api.elsevier.com/content/object/eid/1-s2.0-S1381116911001439-gr6.gif?httpAccept=%2A%2F%2A",
            "@multimediatype": "GIF image file",
            "@type": "IMAGE-DOWNSAMPLED",
            "@size": "5035",
            "@ref": "gr6",
            "@mimetype": "image/gif"
          },
          {
            "@category": "thumbnail",
            "@height": "150",
            "@width": "219",
            "@_fa": "true",
            "$": "https://api.elsevier.com/content/object/eid/1-s2.0-S1381116911001439-gr6.sml?httpAccept=%2A%2F%2A",
            "@multimediatype": "GIF image file",
            "@type": "IMAGE-THUMBNAIL",
            "@size": "2440",
            "@ref": "gr6",
            "@mimetype": "image/gif"
          },
          {
            "@category": "high",
            "@height": "2740",
            "@width": "3988",
            "@_fa": "true",
            "$": "https://api.elsevier.com/content/object/eid/1-s2.0-S1381116911001439-gr6_lrg.gif?httpAccept=%2A%2F%2A",
            "@multimediatype": "GIF image file",
            "@type": "IMAGE-HIGH-RES",
            "@size": "59179",
            "@ref": "gr6",
            "@mimetype": "image/gif"
          },
          {
            "@category": "standard",
            "@height": "244",
            "@width": "348",
            "@_fa": "true",
            "$": "https://api.elsevier.com/content/object/eid/1-s2.0-S1381116911001439-gr7.gif?httpAccept=%2A%2F%2A",
            "@multimediatype": "GIF image file",
            "@type": "IMAGE-DOWNSAMPLED",
            "@size": "7228",
            "@ref": "gr7",
            "@mimetype": "image/gif"
          },
          {
            "@category": "thumbnail",
            "@height": "153",
            "@width": "219",
            "@_fa": "true",
            "$": "https://api.elsevier.com/content/object/eid/1-s2.0-S1381116911001439-gr7.sml?httpAccept=%2A%2F%2A",
            "@multimediatype": "GIF image file",
            "@type": "IMAGE-THUMBNAIL",
            "@size": "3683",
            "@ref": "gr7",
            "@mimetype": "image/gif"
          },
          {
            "@category": "high",
            "@height": "2596",
            "@width": "3706",
            "@_fa": "true",
            "$": "https://api.elsevier.com/content/object/eid/1-s2.0-S1381116911001439-gr7_lrg.gif?httpAccept=%2A%2F%2A",
            "@multimediatype": "GIF image file",
            "@type": "IMAGE-HIGH-RES",
            "@size": "87781",
            "@ref": "gr7",
            "@mimetype": "image/gif"
          },
          {
            "@category": "standard",
            "@height": "473",
            "@width": "186",
            "@_fa": "true",
            "$": "https://api.elsevier.com/content/object/eid/1-s2.0-S1381116911001439-sc1.jpg?httpAccept=%2A%2F%2A",
            "@multimediatype": "JPEG image file",
            "@type": "IMAGE-DOWNSAMPLED",
            "@size": "17166",
            "@ref": "sc1",
            "@mimetype": "image/jpeg"
          },
          {
            "@category": "thumbnail",
            "@height": "163",
            "@width": "64",
            "@_fa": "true",
            "$": "https://api.elsevier.com/content/object/eid/1-s2.0-S1381116911001439-sc1.sml?httpAccept=%2A%2F%2A",
            "@multimediatype": "GIF image file",
            "@type": "IMAGE-THUMBNAIL",
            "@size": "2332",
            "@ref": "sc1",
            "@mimetype": "image/gif"
          },
          {
            "@category": "high",
            "@height": "2097",
            "@width": "824",
            "@_fa": "true",
            "$": "https://api.elsevier.com/content/object/eid/1-s2.0-S1381116911001439-sc1_lrg.jpg?httpAccept=%2A%2F%2A",
            "@multimediatype": "JPEG image file",
            "@type": "IMAGE-HIGH-RES",
            "@size": "139784",
            "@ref": "sc1",
            "@mimetype": "image/jpeg"
          },
          {
            "@category": "standard",
            "@height": "52",
            "@width": "304",
            "@_fa": "true",
            "$": "https://api.elsevier.com/content/object/eid/1-s2.0-S1381116911001439-sc2.jpg?httpAccept=%2A%2F%2A",
            "@multimediatype": "JPEG image file",
            "@type": "IMAGE-DOWNSAMPLED",
            "@size": "4894",
            "@ref": "sc2",
            "@mimetype": "image/jpeg"
          },
          {
            "@category": "thumbnail",
            "@height": "37",
            "@width": "219",
            "@_fa": "true",
            "$": "https://api.elsevier.com/content/object/eid/1-s2.0-S1381116911001439-sc2.sml?httpAccept=%2A%2F%2A",
            "@multimediatype": "GIF image file",
            "@type": "IMAGE-THUMBNAIL",
            "@size": "2152",
            "@ref": "sc2",
            "@mimetype": "image/gif"
          },
          {
            "@category": "high",
            "@height": "229",
            "@width": "1349",
            "@_fa": "true",
            "$": "https://api.elsevier.com/content/object/eid/1-s2.0-S1381116911001439-sc2_lrg.jpg?httpAccept=%2A%2F%2A",
            "@multimediatype": "JPEG image file",
            "@type": "IMAGE-HIGH-RES",
            "@size": "36133",
            "@ref": "sc2",
            "@mimetype": "image/jpeg"
          }
        ]
      },
      "link": {
        "@rel": "abstract",
        "@href": "https://api.elsevier.com/content/abstract/scopus_id/79956188204"
      }
    }
  }
}