{
  "metadata": {
    "title": "Ring-opening polymerization of various cyclic esters by Al complex catalysts containing a series of phenoxy-imine ligands: Effect of the imino substituents for the catalytic activity",
    "authors": "; ; ",
    "journal": "Journal of Molecular Catalysis A: Chemical",
    "date": "2008-09-17",
    "doi": "10.1016/j.molcata.2008.06.009",
    "abstract": "",
    "uri": "https://api.elsevier.com/content/article/pii/S1381116908002835",
    "pii": "S1381116908002835"
  },
  "fulltext": {
    "full-text-retrieval-response": {
      "scopus-eid": "2-s2.0-52049103342",
      "originalText": "serial JL 271358 291210 291744 291790 291809 31 Journal of Molecular Catalysis A: Chemical JOURNALMOLECULARCATALYSISACHEMICAL 2008-06-27 2008-06-27 2010-03-29T10:57:16 1-s2.0-S1381116908002835 S1381-1169(08)00283-5 S1381116908002835 10.1016/j.molcata.2008.06.009 S300 S300.1 FULL-TEXT 1-s2.0-S1381116908X00111 2015-05-15T05:56:33.307883-04:00 0 0 20080917 2008 2008-06-27T00:00:00Z articleinfo crossmark dco dateupdated tomb dateloaded datesearch indexeddate issuelist volumelist yearnav absattachment articletitlenorm authfirstinitialnorm authfirstsurnamenorm cid cids contenttype copyright dateloadedtxt docsubtype doctype doi eid ewtransactionid hubeid issfirst issn issnnorm itemstage itemtransactionid itemweight openaccess openarchive pg pgfirst pglast pii piinorm pubdatestart pubdatetxt pubyr sectiontitle sortorder srctitle srctitlenorm srctype subheadings volfirst volissue webpdf webpdfpagecount figure table e-component body mmlmath acknowledge affil appendices articletitle auth authfirstini authfull authkeywords authlast primabst ref specialabst alllist content subj ssids 1381-1169 13811169 292 292 1 2 1 2 Volume 292, Issues 1–2 12 67 75 67 75 20080917 17 September 2008 2008-09-17 2008 Regular papers article fla Copyright © 2008 Elsevier B.V. All rights reserved. RINGOPENINGPOLYMERIZATIONVARIOUSCYCLICESTERSBYALCOMPLEXCATALYSTSCONTAININGASERIESPHENOXYIMINELIGANDSEFFECTIMINOSUBSTITUENTSFORCATALYTICACTIVITY IWASA N 1 Introduction 2 Results and discussion 2.1 Synthesis of Me2Al[-2- t Bu-{(2,4,6-R′3C6H2)NCH}C6H3] (R′=Me, t Bu) 2.2 Ring-opening polymerization of ɛ-caprolactone 2.3 Ring-opening polymerization (ROP) of δ-valerolactone and rac-lactide 2.4 Attempted ring-opening polymerizations of β-butyrolactone and γ-butyrolactone 2.5 Concluding remarks 3 Experimental 3.1 General procedures 3.2 Synthesis of Me2Al[O-2-tBu-6-{(2,4,6-Me3C6H2)NCH}C6H3] (1g) 3.3 Synthesis of Me2Al[O-2-tBu-6-{(2,4,6-tBu3C6H2)NCH}C6H3] (1h) 3.4 Ring-opening polymerization (ROP) of ɛ-caprolactone (CL) 3.5 Ring-opening polymerization (ROP) of δ-valerolactone (VL) 3.6 Ring-opening polymerization (ROP) of rac-lactide (LC) 3.7 Crystallographic analysis Acknowledgements Appendix A Supplementary data References MECERREYES 1999 D OKEEFE 2001 2215 B STRIDSBERG 2002 41 K ALBERTSSON 2003 1466 A DECHYCABARET 2004 6147 O TROFIMOFF 1987 991 L SPASSKY 1996 2627 N MONTAUDO 1996 6461 G WISNIEWSKI 1997 1227 M KOWALSKI 1998 2114 A CAMERON 1999 616 P OVITT 1999 4072 T BHAWLUXIMON 2000 31 A RADANO 2000 1552 C OVITT 2000 4686 T HUANG 2001 356 C CHISHOLM 2001 885 M NOMURA 2002 5938 N OVITT 2002 1316 T CHAKRABORTY 2003 769 D KO 1999 8296 B TADEN 2000 441 I CHAKRABORTY 2002 1438 D HSUEH 2002 5763 M YU 2002 6450 R ZHENG 2003 7439 G ALCAZARROMAN 2003 3082 L CHEN 2004 7968 C LEWINSKY 2004 1939 J NOMURA 2005 5363 N AMGOUNE 2005 6279 A MAJOUMOMBE 2005 91 F COX 1992 95 M BIODEGRADABLEPOLYMERSPLASTICS DOI 1992 139 Y BIODEGRADABLEPOLYMERSPLASTICS OKADA 2002 87 M ATWOOD 1996 63 D QIAN 1998 3070 B RADZEWICH 1998 9384 C CAMERON 1999 1883 P MUNOZHERNANDEZ 2000 4416 M LIU 2000 109 S CAMERON 2001 1472 P HILL 2001 71 M REDSHAW 2001 2016 C CAMERON 2002 415 P CHAKRABORTY 2002 13 D LEWINSKI 2003 3773 J LEWINSKI 2004 5789 J DAGORNE 2003 3732 S BRAUNE 2003 64 W ZHU 2007 1481 H YAO 2008 2486 W MARUOKA 1988 3588 K MARUOKA 1989 6431 K MARUOKA 1993 3943 K MARUOKA 1994 4131 K SAITO 1997 1585 S IWASA 2008 1148 N MATSUI 2001 6847 S MITANI 2002 3327 M MITANI 2003 4293 M TERAO 2006 8584 H DUDA 1990 1640 A MCLAIN 1992 174 S PASCH 1995 24 H KRICHELDORF 1998 283 H DUDA 1998 2114 A KOWALSKI 2000 1964 A CHEN 2001 5076 H SAVE 2002 889 M DITTRICH 1971 109 W DUDA 1995 5981 A SPASSKY 2000 2432 N JHURRY 2001 67 D CAYUELA 2006 1338 J WATKIN 1996 D CHEMICALCRYSTALLOGRAPHYLABORATORY IWASAX2008X67 IWASAX2008X67X75 IWASAX2008X67XN IWASAX2008X67X75XN item S1381-1169(08)00283-5 S1381116908002835 1-s2.0-S1381116908002835 10.1016/j.molcata.2008.06.009 271358 2010-10-11T07:05:36.538426-04:00 2008-09-17 1-s2.0-S1381116908002835-main.pdf https://s3.amazonaws.com/prod-ucs-content-store-us-east/content/pii:S1381116908002835/MAIN/application/pdf/ae613a2be793a4976b3ff94b247cdfaa/main.pdf https://s3-eu-west-1.amazonaws.com/prod-ucs-content-store-eu-west/content/pii:S1381116908002835/MAIN/application/pdf/ae613a2be793a4976b3ff94b247cdfaa/main.pdf main.pdf pdf true 710547 MAIN 9 1-s2.0-S1381116908002835-main_1.png https://s3.amazonaws.com/prod-ucs-content-store-us-east/content/pii:S1381116908002835/PREVIEW/image/png/33d6a66473e0c7caaeae4a241fa98030/main_1.png https://s3-eu-west-1.amazonaws.com/prod-ucs-content-store-eu-west/content/pii:S1381116908002835/PREVIEW/image/png/33d6a66473e0c7caaeae4a241fa98030/main_1.png main_1.png png 85359 849 656 IMAGE-WEB-PDF 1 1-s2.0-S1381116908002835-si1.gif https://s3.amazonaws.com/prod-ucs-content-store-us-east/content/pii:S1381116908002835/STRIPIN/image/gif/9eeca23fd4c990353610c27c109ad181/si1.gif https://s3-eu-west-1.amazonaws.com/prod-ucs-content-store-eu-west/content/pii:S1381116908002835/STRIPIN/image/gif/9eeca23fd4c990353610c27c109ad181/si1.gif si1 si1.gif gif 458 14 98 ALTIMG 1-s2.0-S1381116908002835-mmc1.pdf https://s3.amazonaws.com/prod-ucs-content-store-us-east/content/pii:S1381116908002835/mmc1/MAIN/application/pdf/7810f3230f23a1a6c746b3231ec40577/mmc1.pdf https://s3-eu-west-1.amazonaws.com/prod-ucs-content-store-eu-west/content/pii:S1381116908002835/mmc1/MAIN/application/pdf/7810f3230f23a1a6c746b3231ec40577/mmc1.pdf mmc1 mmc1.pdf pdf true 166512 APPLICATION 1-s2.0-S1381116908002835-sc1.jpg https://s3.amazonaws.com/prod-ucs-content-store-us-east/content/pii:S1381116908002835/sc1/DOWNSAMPLED/image/jpeg/369276b3bacebd4e3d0301bfa50d5df9/sc1.jpg https://s3-eu-west-1.amazonaws.com/prod-ucs-content-store-eu-west/content/pii:S1381116908002835/sc1/DOWNSAMPLED/image/jpeg/369276b3bacebd4e3d0301bfa50d5df9/sc1.jpg sc1 sc1.jpg jpg 52441 447 375 IMAGE-DOWNSAMPLED 1-s2.0-S1381116908002835-sc1.sml https://s3.amazonaws.com/prod-ucs-content-store-us-east/content/pii:S1381116908002835/sc1/THUMBNAIL/image/gif/29679c54ec88601301acdd4c708fa97a/sc1.sml https://s3-eu-west-1.amazonaws.com/prod-ucs-content-store-eu-west/content/pii:S1381116908002835/sc1/THUMBNAIL/image/gif/29679c54ec88601301acdd4c708fa97a/sc1.sml sc1 sc1.sml sml 1302 93 78 IMAGE-THUMBNAIL 1-s2.0-S1381116908002835-sc2.jpg https://s3.amazonaws.com/prod-ucs-content-store-us-east/content/pii:S1381116908002835/sc2/DOWNSAMPLED/image/jpeg/3257ea10a7851a18e3d33f0e9e172ee8/sc2.jpg https://s3-eu-west-1.amazonaws.com/prod-ucs-content-store-eu-west/content/pii:S1381116908002835/sc2/DOWNSAMPLED/image/jpeg/3257ea10a7851a18e3d33f0e9e172ee8/sc2.jpg sc2 sc2.jpg jpg 11793 153 465 IMAGE-DOWNSAMPLED 1-s2.0-S1381116908002835-sc2.sml https://s3.amazonaws.com/prod-ucs-content-store-us-east/content/pii:S1381116908002835/sc2/THUMBNAIL/image/gif/dff5dcaac924cc6c91a13b87d9497974/sc2.sml https://s3-eu-west-1.amazonaws.com/prod-ucs-content-store-eu-west/content/pii:S1381116908002835/sc2/THUMBNAIL/image/gif/dff5dcaac924cc6c91a13b87d9497974/sc2.sml sc2 sc2.sml sml 702 41 125 IMAGE-THUMBNAIL 1-s2.0-S1381116908002835-gr1.jpg https://s3.amazonaws.com/prod-ucs-content-store-us-east/content/pii:S1381116908002835/gr1/DOWNSAMPLED/image/jpeg/db0ae5ee4ab3b1161e2ddb9ca293ab61/gr1.jpg https://s3-eu-west-1.amazonaws.com/prod-ucs-content-store-eu-west/content/pii:S1381116908002835/gr1/DOWNSAMPLED/image/jpeg/db0ae5ee4ab3b1161e2ddb9ca293ab61/gr1.jpg gr1 gr1.jpg jpg 38392 251 564 IMAGE-DOWNSAMPLED 1-s2.0-S1381116908002835-gr1.sml https://s3.amazonaws.com/prod-ucs-content-store-us-east/content/pii:S1381116908002835/gr1/THUMBNAIL/image/gif/0e2c9ed89449c51935ab63889e6c88c2/gr1.sml https://s3-eu-west-1.amazonaws.com/prod-ucs-content-store-eu-west/content/pii:S1381116908002835/gr1/THUMBNAIL/image/gif/0e2c9ed89449c51935ab63889e6c88c2/gr1.sml gr1 gr1.sml sml 1315 56 125 IMAGE-THUMBNAIL 1-s2.0-S1381116908002835-gr2.jpg https://s3.amazonaws.com/prod-ucs-content-store-us-east/content/pii:S1381116908002835/gr2/DOWNSAMPLED/image/jpeg/7a728ab55b9d59ec594b2c3f213f3de0/gr2.jpg https://s3-eu-west-1.amazonaws.com/prod-ucs-content-store-eu-west/content/pii:S1381116908002835/gr2/DOWNSAMPLED/image/jpeg/7a728ab55b9d59ec594b2c3f213f3de0/gr2.jpg gr2 gr2.jpg jpg 48593 651 470 IMAGE-DOWNSAMPLED 1-s2.0-S1381116908002835-gr2.sml https://s3.amazonaws.com/prod-ucs-content-store-us-east/content/pii:S1381116908002835/gr2/THUMBNAIL/image/gif/a284dd4c34de58679b10d817c251eb4f/gr2.sml https://s3-eu-west-1.amazonaws.com/prod-ucs-content-store-eu-west/content/pii:S1381116908002835/gr2/THUMBNAIL/image/gif/a284dd4c34de58679b10d817c251eb4f/gr2.sml gr2 gr2.sml sml 1043 93 67 IMAGE-THUMBNAIL 1-s2.0-S1381116908002835-gr3.jpg https://s3.amazonaws.com/prod-ucs-content-store-us-east/content/pii:S1381116908002835/gr3/DOWNSAMPLED/image/jpeg/5c793b33e56b30b0c0f97b7448941c09/gr3.jpg https://s3-eu-west-1.amazonaws.com/prod-ucs-content-store-eu-west/content/pii:S1381116908002835/gr3/DOWNSAMPLED/image/jpeg/5c793b33e56b30b0c0f97b7448941c09/gr3.jpg gr3 gr3.jpg jpg 20620 224 282 IMAGE-DOWNSAMPLED 1-s2.0-S1381116908002835-gr3.sml https://s3.amazonaws.com/prod-ucs-content-store-us-east/content/pii:S1381116908002835/gr3/THUMBNAIL/image/gif/73e80195a39b79ca7403cc4356072108/gr3.sml https://s3-eu-west-1.amazonaws.com/prod-ucs-content-store-eu-west/content/pii:S1381116908002835/gr3/THUMBNAIL/image/gif/73e80195a39b79ca7403cc4356072108/gr3.sml gr3 gr3.sml sml 1006 93 117 IMAGE-THUMBNAIL 1-s2.0-S1381116908002835-gr4.jpg https://s3.amazonaws.com/prod-ucs-content-store-us-east/content/pii:S1381116908002835/gr4/DOWNSAMPLED/image/jpeg/2a2c1ba2d36f46f36ef30fddde83790c/gr4.jpg https://s3-eu-west-1.amazonaws.com/prod-ucs-content-store-eu-west/content/pii:S1381116908002835/gr4/DOWNSAMPLED/image/jpeg/2a2c1ba2d36f46f36ef30fddde83790c/gr4.jpg gr4 gr4.jpg jpg 23197 178 282 IMAGE-DOWNSAMPLED 1-s2.0-S1381116908002835-gr4.sml https://s3.amazonaws.com/prod-ucs-content-store-us-east/content/pii:S1381116908002835/gr4/THUMBNAIL/image/gif/5ed41d45babeffdc5316b73355720a5b/gr4.sml https://s3-eu-west-1.amazonaws.com/prod-ucs-content-store-eu-west/content/pii:S1381116908002835/gr4/THUMBNAIL/image/gif/5ed41d45babeffdc5316b73355720a5b/gr4.sml gr4 gr4.sml sml 1254 79 125 IMAGE-THUMBNAIL 1-s2.0-S1381116908002835-gr5.jpg https://s3.amazonaws.com/prod-ucs-content-store-us-east/content/pii:S1381116908002835/gr5/DOWNSAMPLED/image/jpeg/ae15986626d0fcd5150c232e7d37ae79/gr5.jpg https://s3-eu-west-1.amazonaws.com/prod-ucs-content-store-eu-west/content/pii:S1381116908002835/gr5/DOWNSAMPLED/image/jpeg/ae15986626d0fcd5150c232e7d37ae79/gr5.jpg gr5 gr5.jpg jpg 64423 546 602 IMAGE-DOWNSAMPLED 1-s2.0-S1381116908002835-gr5.sml https://s3.amazonaws.com/prod-ucs-content-store-us-east/content/pii:S1381116908002835/gr5/THUMBNAIL/image/gif/1e74796ba997633425dc1f63d04d2c9b/gr5.sml https://s3-eu-west-1.amazonaws.com/prod-ucs-content-store-eu-west/content/pii:S1381116908002835/gr5/THUMBNAIL/image/gif/1e74796ba997633425dc1f63d04d2c9b/gr5.sml gr5 gr5.sml sml 1515 93 103 IMAGE-THUMBNAIL 1-s2.0-S1381116908002835-fx1.jpg https://s3.amazonaws.com/prod-ucs-content-store-us-east/content/pii:S1381116908002835/fx1/DOWNSAMPLED/image/jpeg/14f340ea1527ef7fad1d918d771f7576/fx1.jpg https://s3-eu-west-1.amazonaws.com/prod-ucs-content-store-eu-west/content/pii:S1381116908002835/fx1/DOWNSAMPLED/image/jpeg/14f340ea1527ef7fad1d918d771f7576/fx1.jpg fx1 true fx1.jpg jpg 28598 162 357 IMAGE-DOWNSAMPLED 1-s2.0-S1381116908002835-fx1.sml https://s3.amazonaws.com/prod-ucs-content-store-us-east/content/pii:S1381116908002835/fx1/THUMBNAIL/image/gif/24e957b51f5eced49240a2921dba9f7a/fx1.sml https://s3-eu-west-1.amazonaws.com/prod-ucs-content-store-eu-west/content/pii:S1381116908002835/fx1/THUMBNAIL/image/gif/24e957b51f5eced49240a2921dba9f7a/fx1.sml fx1 true fx1.sml sml 2742 57 125 IMAGE-THUMBNAIL MOLCAA 7205 S1381-1169(08)00283-5 10.1016/j.molcata.2008.06.009 Elsevier B.V. Fig. 1 ORTEP drawing for Me2Al[O-2- t Bu-6-{(2,4,6-Me3C6H2)NCH}C6H3] (1g). Thermal ellipsoids are drawn at the 50% probability level and H atoms are omitted for clarity. Selected bond distance (Å): Al(1)–O(1) 1.7748(19), Al(1)–N(1) 1.965(2), Al(1)–C(1) 1.953(2), Al(1)–C(2) 1.956(2), N(1)–C(9) 1.296 (2), N(1)–C(14) 1.452 (2). Selected bond angles (°): O(1)–Al(1)–N(1) 93.37(8), C(1)–Al(1)–C(2) 117.58(12), Al(1)–O(1)–C(3) 129.37(16), Al(1)–N(1)–C(9) 121.45(16), Al(1)–N(1)–C(14) 119.84(13), O(1)–Al(1)–C(1) 111.75(10), O(1)–Al(1)–C(2) 110.76(11), N(1)–Al(1)–C(1) 110.45(10), N(1)–Al(1)–C(2) 110.30(11). Fig. 2 (a) 1H NMR spectrum (in C6D6 at 25°C) for poly(CL) (run 13 in Table 1, CL=ɛ-caprolactone), M n(NMR) =4.42×104. (b) 1H NMR spectrum (in C6D6 at 25°C) for poly(VL) (run 33 in Table 3), M n(NMR) =3.10×104. Peak marked with * is due to a resonance ascribed to impurities. Fig. 3 Time course plots of log[VL]/[VL]0. [VL]=concentration of δ-valerolactone (VL) in mmol/mL. Detailed conditions are described in Table 4. Fig. 4 Plots of M n and M w/M n values for poly(CL) vs. TON for ring-opening polymerization of δ-valerolactone (VL) catalyzed by Me2Al[O-2- t Bu-6-{(C6F5)NCH}C6H3] (1i) in toluene. Detailed conditions are described in Table 4. Fig. 5 1H NMR spectra (in CDCl3 at 25°C) of the methine region of the resultant poly(LC) using Me2Al[O-2- t Bu-6-{RNCH}C6H3] [R=cyclohexyl (1b, top left, run 43), phenyl (1d, center left, run 44), 2,6-Me2C6H3 (1e, bottom left, run 45), 2,6- i Pr2C6H3 (1f, center right, run 46 in Table 4), C6F5 (1i, bottom right, run 49)]. Scheme 1 Scheme 2 Table 1 Ring-opening polymerization of ɛ-caprolactone (CL) by Me2Al[O-2- t Bu-6-(RNCH)C6H3] (1a–i) [R= t Bu (1a), cyclohexyl (1b), adamantyl (1c), C6H5 (1d), 2,6-Me2C6H3 (1e), 2,6- i Pr2C6H3 (1f), 2,4,6-Me3C6H2 (1g), 2,4,6- t Bu3C6H2 (1h), C6F5 (1i)] a Run Complex (R) Al (μmol) Time (min) Yield (mg(%)) TON b M n c ×10−4 M w/M n c N d (μmol) 1 e 1a ( t Bu) 20 60 46 (8) 20 1.64 1.10 5.0 2 e 1b (cyclohexyl) 20 60 156 (28) 70 2.07 1.19 13.5 3 e 1c (adamantyl) 20 60 Trace – – – – 4 e 1d (C6H5) 20 60 258 (45) 113 2.83 1.38 16.3 5 e 1e (2,6-Me2C6H3) 20 30 413 (74) 185 4.84 1.64 15.2 6 e 1f (2,6- i Pr2C6H3) 20 60 472 (84) 209 4.35 1.61 19.4 7 e 1f (2,6- i Pr2C6H3) 20 30 192 (34) 85 2.87 1.24 11.9 8 1g (2,4,6-Me3C6H2) 20 60 499 (89) 223 4.92 1.93 18.1 9 1g (2,4,6-Me3C6H2) 20 30 171 (31) 78 2.03 1.35 15.0 10 1h (2,4,6- t Bu3C6H2) 20 30 524 (94) 235 7.66 1.58 12.2 11 1h (2,4,6- t Bu3C6H2) 10 30 375 (66) 330 10.6 1.68 5.9 12 e 1i (C6F5) 20 30 551 (99) 248 5.60 1.64 17.6 13 e , f 1i (C6F5) 20 30 550 (98) 245 7.56 1.66 13.0 14 e 1i (C6F5) 10 30 481 (86) 430 9.34 1.64 9.2 a Conditions: Al 10 or 20μmol, n BuOH 1.0equiv. to Al (in toluene 50μL), CL 5.0mmol, 60°C. b TON=(molar amount of CL reacted)/(molar amount of Al). c GPC data in THF vs. polystyrene standards. d Estimated number of polymer chain (μmol)=polymer yield (mg)/{0.56× M n(GPC)} [12]. e Cited from our preliminary article [8]. f PhCH2OH was used in place of n BuOH [M n =4.42×104 estimated by 1H NMR spectrum]. Table 2 Effect of temperature in ring-opening polymerization of ɛ-caprolactone (CL) by Me2Al[O-2- t Bu-6-(RNCH)C6H3] [R=2,6-Me2C6H3 (1e), 2,6- i Pr2C6H3 (1f), 2,4,6- t Bu3C6H2 (1h), C6F5 (1i)] a Run Complex (R) Al (μmol) Temperature (°C) Time (min) Yield (mg(%)) TON b M n c ×10−4 M w/M n c N d (μmol) 6 e 1f (2,6- i Pr2C6H3) 20 60 60 472 (84) 209 4.35 1.61 19.4 15 e 1f (2,6- i Pr2C6H3) 20 50 60 198 (35) 88 2.58 1.27 13.7 5 e 1e (2,6-Me2C6H3) 20 60 30 413 (74) 185 4.84 1.64 15.2 16 e 1e (2,6-Me2C6H3) 20 50 60 449 (80) 200 5.39 1.74 14.9 10 1h (2,4,6- t Bu3C6H2) 20 60 30 524 (94) 235 7.66 1.58 12.2 17 1h (2,4,6- t Bu3C6H2) 20 50 30 457 (82) 205 7.15 1.57 11.4 18 1h (2,4,6- t Bu3C6H2) 20 40 30 274 (50) 125 4.86 1.46 10.1 12 e 1i (C6F5) 20 60 30 551 (99) 248 5.60 1.64 17.6 19 e 1i (C6F5) 20 50 30 480 (86) 215 5.27 1.40 16.3 20 1i (C6F5) 20 40 30 331 (59) 148 4.33 1.28 13.7 11 1h (2,4,6- t Bu3C6H2) 10 60 30 375 (66) 330 10.6 1.68 5.9 21 1h (2,4,6- t Bu3C6H2) 10 50 30 179 (32) 160 5.79 1.47 5.5 22 1h (2,4,6- t Bu3C6H2) 10 40 30 Trace – – – – 14 e 1i (C6F5) 10 60 30 481 (86) 430 9.34 1.64 9.2 23 1i (C6F5) 10 50 30 228 (41) 205 5.58 1.39 7.3 24 1i (C6F5) 10 40 30 45 (8) 40 1.62 1.10 5.0 a Conditions: Al 10, 20μmol, n BuOH 1.0equiv. to Al (in toluene 50μL), CL 5.0mmol. b TON=(molar amount of CL reacted)/(molar amount of Al). c GPC data in THF vs. polystyrene standards. d Estimated number of polymer chain (μmol)=polymer yield (mg)/{0.56× M n(GPC)} [12]. e Cited from our preliminary article [8]. Table 3 Ring-opening polymerization of δ-valerolactone (VL) by Me2Al[O-2- t Bu-6-(RNCH)C6H3] (1a–f,h,i) [R= t Bu (1a), cyclohexyl (1b), adamantyl (1c), C6H5 (1d), 2,6-Me2C6H3 (1e), 2,6- i Pr2C6H3 (1f), 2,4,6- t Bu3C6H2 (1h), C6F5 (1i)] a Run Complex (R) Al (μmol) Time (min) Yield (mg(%)) TON b M n c ×10−4 M w/M n c 25 1a ( t Bu) 20 60 Trace – – – 26 1b (cyclohexyl) 20 60 Trace – – – 27 1c (adamantyl) 20 60 Trace – – – 28 1d (C6H5) 20 30 264 (53) 133 1.30 1.21 29 1e (2,6-Me2C6H3) 20 30 430 (86) 215 1.95 1.37 30 1f (2,6- i Pr2C6H3) 20 30 355 (71) 178 1.61 1.33 31 1h (2,4,6- t Bu3C6H2) 20 30 411 (82) 205 1.72 1.30 32 1i (C6F5) 20 30 462 (92) 230 1.94 1.38 33 d 1i (C6F5) 20 30 452 (90) 225 2.01 1.32 34 1e (2,6-Me2C6H3) 10 30 349 (70) 350 1.93 1.21 35 1h (2,4,6- t Bu3C6H2) 10 30 234 (47) 235 1.39 1.24 36 1i (C6F5) 10 30 453 (90) 450 2.54 1.39 a Conditions: Al 10, 20μmol (in toluene 85μmol), n BuOH 1.0equiv. to Al, VL 5.0mmol, 60°C. b TON=(molar amount of VL reacted)/(molar amount of Al). c GPC data in THF vs. polystyrene standards. d PhCH2OH was used in place of n BuOH [M n =3.10×104 estimated by 1H NMR spectrum]. Table 4 Ring-opening polymerization of δ-valerolactone (VL) by Me2Al[O-2- t Bu-6-{(C6F5)NCH}C6H3] (1i) in toluene a Run Time (min) Yield (mg(%)) TON b M n c ×10−4 M w/M n c 37 30 199 (40) 100 0.77 1.14 38 45 309 (62) 155 1.06 1.13 39 60 367 (73) 183 1.16 1.15 40 75 417 (83) 208 1.33 1.17 a Conditions: Al 20μmol (in toluene 100μL), n-butanol 1.0equiv. to Al (in toluene 85μL), VL 5.0mmol, toluene 4.35mL, initial conc. VL=1.0mmol/mL, 50°C. b TON=(molar amount of VL reacted)/(molar amount of Al). c GPC data in THF vs. polystyrene standard. Table 5 Ring-opening polymerization of rac-lactide (LC) using Me2Al[O-2- t Bu-6-(RNCH)C6H3] (1a–f,h,i) [R= t Bu (1a), cyclohexyl (1b), adamantyl (1c), C6H5 (1d), 2,6-Me2C6H3 (1e), 2,6- i Pr2C6H3 (1f), 2,4,6- t Bu3C6H2 (1h), C6F5 (1i)] a Run Complex (R) Temperature (°C) Time (min) Yield (mg(%)) TON b M n c ×10−4 M w/M n c N d (μmol) 41 1a ( t Bu) 80 24 27 (4) 4 – e – e – 42 1c (adamantyl) 80 24 36 (5) 5 – e – e – 43 1b (cyclohexyl) 80 24 517 (72) 72 1.71 1.22 52.1 44 1d (C6H5) 80 24 140 (19) 19 1.08 1.11 22.3 45 1e (2,6-Me2C6H3) 80 24 333 (46) 46 1.69 1.15 34.0 46 1f (2,6- i Pr2C6H3) 80 24 168 (23) 23 1.35 1.10 21.5 47 1h (2,4,6- t Bu3C6H2) 80 24 657 (91) 91 2.37 1.18 47.8 48 1h (2,4,6- t Bu3C6H2) 80 8 164 (24) 24 1.43 1.08 19.8 49 1i (C6F5) 80 24 668 (94) 94 2.13 1.30 54.1 50 1i (C6F5) 80 8 264 (36) 36 1.3 1.09 35.0 51 1h (2,4,6- t Bu3C6H2) 70 24 77 (11) 11 1.09 1.14 12.2 52 1i (C6F5) 70 24 33 (5) 5 0.7 1.20 8.1 a Conditions: Al 50μmol (in toluene 85μL), n BuOH 1.0equiv. to Al, LC 5.0mmol, initial conc. of LC=1.0mmol/mL, toluene 4.9mL. b TON=(molar amount of LC reacted)/(molar amount of Al). c GPC data in THF vs. polystyrene standards. d Estimated number of polymer chain (μmol)=polymer yield (mg)/{0.58× M n(GPC)} [12]. e Resultant polymer was insoluble in THF. Ring-opening polymerization of various cyclic esters by Al complex catalysts containing a series of phenoxy-imine ligands: Effect of the imino substituents for the catalytic activity Naruhito Iwasa a b Michiya Fujiki a Kotohiro Nomura a ⁎ a Graduate School of Materials Science, Nara Institute of Science and Technology (NAIST), 8916-5 Takayama, Ikoma, Nara 630-0101, Japan b Research Laboratories, Daiso Co., Ltd., 9 Otakasu, Amagasaki, Hyogo 660-0842, Japan ⁎ Corresponding author. Fax: +81 743 72 6049. Graphical abstract Ring-opening polymerizations of ɛ-caprolactone (CL), δ-valerolactone (VL), rac-lactide using Me2Al[O-2- t Bu-6-(RNCH)C6H3] (R= t Bu, cyclohexyl, adamantyl, C6H5, 2,6-Me2C6H3, 2,6- i Pr2C6H3, 2,4,6-Me3C6H2, 2,4,6- t Bu3C6H2, C6F5) have been explored in the presence of n BuOH. The imino substituents strongly affect toward both the activity and the catalyst efficiency; the C6F5 analogue was most effective and the polymerizations of CL and VL proceeded in a living manner. Ring-opening polymerizations (ROPs) of various cyclic esters [ɛ-caprolactone (CL), δ-valerolactone (VL), rac-lactide (LC)] using a series of Al complexes containing phenoxy-imine ligands of type, Me2Al[O-2- t Bu-6-(RNCH)C6H3], [R= t Bu (1a), cyclohexyl (1b), adamantyl (1c), C6H5 (1d), 2,6-Me2C6H3 (1e), 2,6- i Pr2C6H3 (1f), 2,4,6-Me3C6H2 (1g), 2,4,6- t Bu3C6H2 (1h), C6F5 (1i)], have been explored in the presence of n BuOH. Synthesis and identification of 1g and 1h including structural analysis of 1g by X-ray crystallography have also been explored. Both the catalytic activity and the catalyst efficiency in the ROPs were found to be highly affected by the imino substituents (R) employed. The 2,4,6- t Bu3C6H2 analogue (1h) showed the notable catalytic activity in spite of its low catalyst efficiency in the ROP of CL, and the C6F5 analogue (1i) was most effective in terms of both the activity and the efficiency. The C6F5 analogue (1i) also showed the highest catalytic activity for the ROP of VL, and the polymerization proceeded in a living manner. The C6F5 analogue also showed relatively high catalytic activity in the ROP of LC, but the resultant polymer had no stereo-regularity. Although the Al complexes containing alkyl substituents (1a–c) exhibited low or negligible catalytic activities in the ROPs of CL and VL, the cyclohexyl analogue (1b) showed moderate catalytic activity for the ROP of LC. Attempts for the ROP of β-butyrolactone (β-BL) and γ-butyrolactone (γ-BL) using 1e,h,i- n BuOH catalyst systems afforded negligible amount of polymers under the similar conditions. Keywords Al complex Ring-opening polymerization Lactone Lactide 1 Introduction Organoaluminum compounds, especially Al alkoxides have been known to be initiators for ring-opening polymerization (ROP) of cyclic esters [1] such as lactides [2], lactones [2j,n,3]. These aliphatic polyesters possess promising characteristics as biodegradable and bioassimilable materials not only due to their practical biodegradability, but also due to their biocompatibility for medical and pharmaceutical applications [4]. Design of monomeric or dimeric Al complex catalysts for the efficient polymerization thus attracts considerable attention [5]. Although it is known that an introduction of extremely bulky aryloxide ligands to aluminum generates monomeric Lewis acid catalysts that can be used in various organic reactions [6], reports concerning ligand effect toward the catalytic activity in the ROP of cyclic esters using a series of ‘isolated’ Al complexes were rare. We recently reported a study for ring-opening polymerization (ROP) of ɛ-caprolactone (CL) using various Al complexes containing a series of phenoxy-imine ligands of type, Me2Al[O-2-R1-6-(R2NCH)C6H3], [R1 =Me, t Bu; R2 = t Bu, cyclohexyl, adamantyl, C6H5, 2,6-Me2C6H3, 2,6- i Pr2C6H3, C6F5], in the presence of n BuOH (1.0equiv.) [7,8]. We demonstrated that the imino substituent (R2) rather than the aryloxo substituent (R1) strongly affected the catalytic activity (turnover number, TON) in the ROP. The activity increased in the order: R2 =C6F5 ≫2,6-Me2C6H3 >2,6- i Pr2C6H3 >C6H5 >cyclohexyl> t Bu≫adamantyl, and the ROP using the C6F5 analogue proceeded in a living manner with high initiation efficiency [8]. This fact is an interesting contrast to a previous assumption that the electrophilicity of the metal center in the ROP of lactones is much less important [3g,i]. In contrast, the observed facts are analogous to the facts that the catalytic activity, molecular weight for the resultant polymers, and the polymerization behavior for ethylene (and/or propylene) polymerization using various zirconium complexes containing a series of bis(phenoxy)imine ligands were highly affected by the substituents on both the phenoxy and the imino groups [9,10]. In this paper, we thus conducted ROP of various cyclic esters [ɛ-caprolactone (CL), δ-valerolactone (VL), rac-lactide (LC), β-butyrolactone (β-BL) and γ-butyrolactone (γ-BL)] using Me2Al[O-2- t Bu-6-(RNCH)C6H3], [1, R= t Bu (a), cyclohexyl (b), adamantyl (c), C6H5 (d), 2,6-Me2C6H3 (e), 2,6- i Pr2C6H3 (f), 2,4,6-Me3C6H2 (g), 2,4,6- t BuC6H2 (h), C6F5 (i)] upon the presence of n BuOH (1.0equiv.). In order to explore effect of the aromatic substituents in the imino group, we prepared and identified the 2,4,6-Me3C6H2 analogue (1g) and the 2,4,6- t Bu3C6H2 analogue (1h) in the present study including the structure analysis for 1g by X-ray crystallography. Through these experiments, we tried to explore the ligand effect, especially effect of the aromatic substituent in the imino ligand, as well as monomers toward the catalytic activity in the ROP of various cyclic esters (Scheme 1 ). 2 Results and discussion 2.1 Synthesis of Me2Al[-2- t Bu-{(2,4,6-R′3C6H2)NCH}C6H3] (R′=Me, t Bu) Various Al complexes containing a series of phenoxy-imine ligands of the type, Me2Al[O-2- t Bu-6-(RNCH)C6H3] [1, R= t Bu (a), cyclohexyl (b), adamantyl (c), C6H5 (d), 2,6-Me2C6H3 (e), 2,6- i Pr2C6H3 (f), C6F5 (i)], were prepared according to our previous reports [7,8]. In order to explore effect of the aromatic substituents in the imino group toward the catalytic activity, as described above, the 2,4,6- t Bu3C6H2 analogue (1h) has been chosen, because a mixed catalyst system consisting of AlEt3, 2-{(2,4,6- t Bu3C6H2)NCH}C6H4OH (2equiv. to Al), and PhCH2OH (1equiv. to Al) was known to exhibit high catalytic activity for ROP of CL [3j]. The 2,4,6-Me3C6H2 analogue (1g) and the 2,4,6- t Bu3C6H2 analogue (1h) were prepared by the analogous procedures (Scheme 2 ) and were identified based on 1H, 13C NMR spectra and elemental analysis. The structure of 1g was determined by X-ray crystallography (Fig. 1 ) [11], and the structure showed that 1g folds a distorted tetrahedral geometry around the Al metal center. This can be seen from the bond angles for C(1)–Al–C(2) [117.58(12)°], O(1)–Al–C(1) [111.75(10)°], O(1)–Al–C(2) [110.76(11)°], although the O(1)–Al–N(1) bond angle is somewhat small [93.37(8)°]. The Al–N bond distance [1.965(2)Å] is somewhat short but within the range of those in the series of Me2Al[O-2- t Bu-6-(RNCH)C6H3] [1a–d,f,g,i: 1.965–1.9896Å] [7,8]. The Al–O bond distance [1.7748(19)Å] is also close to those in the other Al complexes [1a–d,f,g,i; 1.7592–1.7792Å]. 2.2 Ring-opening polymerization of ɛ-caprolactone Ring-opening polymerizations (ROPs) of ɛ-caprolactone (CL) were conducted at 60°C in the presence of Me2Al[O-2- t Bu-6-(RNCH)C6H3] (1a–i) upon the addition of n BuOH (1.0equiv. to Al), and the results are summarized in Table 1 . The results in our previous report by 1a–f,i [8] conducted under the same conditions are also placed for comparison. As demonstrated previously, presence of n BuOH (1.0equiv. to Al) was prerequisite and the polymerization did not take place in the absence of n BuOH [7,8]. The catalytic activity [TON values, TON=CL consumed (μmol)/Al (μmol), TON after 60min at 60°C, Al 20μmol, initial molar ratio of [CL]/[Al]=250] in the ROP of CL with a series of Me2Al[O-2- t Bu-6-(RNCH)C6H3] increased in the order: R=C6F5 [1i, TON>248 (or 430, Al 10μmol) after 30min, run 12 (run 14)]>2,4,6- t Bu3C6H2 [1h, TON>235 (or 330, Al 10μmol) after 30min, run 10 (run 11)]≫2,6-Me2C6H3 (1e, 185 after 30min, run 5)>2,4,6-Me3C6H2 (1g, 223, run 8)>2,6- i Pr2C6H3 (1f, 209, run 6)>C6H5 (1d, 113, run 4). The Al complexes containing alkyl substituents in the imino group showed low catalytic activities (runs 1–3), as reported previously [7,8]. The ROP by both the C6F5 analogue (1i) and the 2,4,6- t Bu3C6H2 analogue (1h) completed even after 30min (Al 20μmol, 60°C, runs 10 and 12), and the C6F5 analogue (1i) showed the higher activity than the 2,4,6- t Bu3C6H2 analogue (1h) when the ROP was conducted under low Al concentration conditions (Al 10μmol, run 14). The ROP by 1i in the presence of PhCH2OH in place of n BuOH was also conducted and the resultant ring-opened polymer contained polymer chain end derived from PhCH2OH (Fig. 2a). The M n value (4.42×104) estimated by the 1H NMR spectrum was very close to the exact value (4.23×104, run 13) calculated, corrected based on the M n values by the GPC measurement versus polystyrene standards [12]. The result thus suggests that the ROP was initiated with Al-OR via coordination insertion mechanism as proposed [1,13]. Moreover, the catalyst efficiency for the ROP by 1i in the presence of PhCH2OH was estimated based on both the exact M n value corrected by the value measured by GPC [12] and the polymer yields. The calculated value of 65% (run 13) was lower than that by the 1i- n BuOH system (88%, run 12), and the results thus clearly explain the fact that the M n value in the resultant ring-opened polymer by the 1i-PhCH2OH system was higher than that by the 1i- n BuOH system due to the difference in the catalyst efficiency. The catalyst efficiencies were thus estimated [based on N values (in μmol) vs. Al used (μmol)] in all polymerization runs at 60°C according to the above procedure (Table 1, runs 1–10, 12), and the Al complexes containing alkyl substituents and 2,4,6- t Bu3C6H2 in the imino group were found to be low (runs 1–3, 10, rather low N values). Note that the observed activity (TON value) by the 2,4,6- t Bu3C6H2 analogue (1h) estimated based on the polymer yield was almost equal to the C6F5 analogue (1i, run 12, 88%), whereas 1h showed the low efficiency (run 10, 61%). The results thus suggest that the actual propagation rate by 1h should be higher than that by 1i. As shown in Table 2 , the observed activities (by 1e,f,h,i) decreased upon decreasing the polymerization temperature (from 60 to 50, 40°C), and no significant differences in the order toward the activity in the ROP using Al complexes with a series of the aromatic substituents in the imino group were seen. The C6F5 analogue (1i, run 19, 86%) thus showed the highest catalytic activity (TON values) among these Al complexes when the ROPs were conducted at 50°C. Rather notable differences in the TON values were seen between the C6F5 analogue (1i) and the 2,4,6- t Bu3C6H2 analogue (1h), when the ROPs were performed under low Al concentration conditions (10μmol, runs 11, 14, 21–24); the polymerization by 1h did not proceed or exhibited negligible activity at 40°C. The observed differences, especially the tendency in the ROPs using 1h is due to the low catalyst efficiency under these conditions. Therefore, the C6F5 analogue is concluded to be suited as the catalyst precursor in terms of both the catalytic activity and the catalyst efficiency. As reported previously, the ROP of CL by 1i proceeded in a living manner with high initiation efficiency under optimized conditions, affording the ring-opened polymer with narrow molecular weight distributions [8]. 2.3 Ring-opening polymerization (ROP) of δ-valerolactone and rac-lactide ROPs of δ-valerolactone (VL) using Me2Al[O-2- t Bu-6-(RNCH)C6H3] (1a–f,h,i)- n BuOH (1.0equiv. to Al) catalyst systems were conducted under the similar conditions for the ROPs of CL, and the results are summarized in Table 3 . The polymerizations did not proceed or exhibited negligible catalytic activities, when the Al complexes containing alkyl substituents in the imino group [R= t Bu, cyclohexyl, adamantyl (1a–c)] were employed. In contrast, as seen in the ROPs of CL, the ROPs proceeded with high catalytic activities, when the Al complexes containing aromatic substituents in the imino group (1d–f,h,i) were employed as the catalyst precursors. The activity [TON values, TON after 60min at 60°C, Al 20μmol, initial molar ratio of [VL]/[Al]=250] using a series of Me2Al[O-2- t Bu-6-(RN=CH)C6H3] increased in the order: R=C6F5 [1i, TON=230 (or 450, Al 10μmol), run 32 (run 36)]>2,6-Me2C6H3 [1e, 215 (or 350, Al 10μmol), run 29 (run 34)]>2,4,6- t Bu3C6H2 [1h, 205 (or 235, Al 10μmol) run 31 (run 35)]>2,6- i Pr2C6H3 (1f, 178, run 30)>C6H5 (1d, 133, run 28). The observed trend concerning effect of the aromatic substituent toward the activity in the ROP of VL was similar to that in the ROP of CL, except that the 2,6-Me2C6H3 analogue (1e) showed the higher activity than the 2,4,6- t Bu3C6H2 analogue (1h); the C6F5 analogue (1i) showed the highest activity and the ROP reached to completion even if the polymerization was performed with low Al concentration conditions (Al 10μmol, run 36). The ROP using the C6F5 analogue (1i) was conducted upon PhCH2OH instead of n BuOH, and the resultant ring-opened polymer possessed polymer chain end derived from PhCH2OH confirmed by 1H NMR spectrum (Fig. 2b). Moreover, the M n value [M n(NMR) =3.10×104], which was estimated by the 1H NMR spectrum based on methylene protons at the polymer chain end derived from PhCH2OH, was relatively close to the theoretical value [M n(calcd) =2.26×104] calculated based on VL/Al molar ratio (and 90% yield). The catalyst efficiency (73%, run 33) for the ROP by 1i-PhCH2OH catalyst system was estimated based on these M n values [M n(calcd)/M n(NMR)], and the result would suggest that the present ROP was initiated with Al-OR via coordination insertion mechanism as proposed [1,13]. The ROPs of VL using the C6F5 analogue (1i)- n BuOH catalyst system were conducted in toluene at 50°C, and the results are summarized in Table 4 . The ROP proceeded at significant rate at beginning and the rate gradually decreased upon consumption of VL. As shown in Fig. 3 , the rates were first order dependent upon the VL concentration, suggesting that the ROP proceeded without deactivation. The M n values in the resultant polymer increased linearly upon increasing the TON values (polymer yields) consistently with low M w/M n values (M w/M n =1.13–1.17, Fig. 4 ). These results clearly indicate that the ROP by the C6F5 analogue (1i) proceeds in a living manner, as seen in the ROP of CL. Taking into account these results, we would also conclude that the ROP of VL by 1i- n BuOH (and PhCH2OH) catalysts system proceeded without side reaction like transesterification [14]. Ring-opening polymerizations (ROPs) of rac-lactide (LC) using 1a–f,h,i were conducted at 80°C in the presence of n BuOH, and the results are summarized in Table 5 . The catalytic activity [TON values, TON after 24h at 80°C, Al 50μmol, initial molar ratio of [LC]/[Al]=100] in the ROP of LC using a series of Me2Al[O-2- t Bu-6-(RNCH)C6H3] increased in the order: R=C6F5 [1i, TON=94 (36 after 8h), run 49 (run 50)]>2,4,6- t Bu3C6H2 [1h, 91 (24 after 8h), run 47 (run 48)]>cyclohexyl (1b, 72, run 43)>2,6-Me2C6H3 (1e, 46, run 45)>2,6- i Pr2C6H3 (1f, 23, run 46)>C6H5 (1d, 19, run 44)≫adamantyl (1c, 5, run 42), t Bu (1b, 4, run 41). The ROPs using the 2,4,6- t Bu3C6H2 analogue (1h), the C6F5 analogue (1i) were also conducted at 70°C in the presence of n BuOH, but the observed activities (runs 51, 52) were significantly lower than those performed at 80°C (runs 47, 49). Both the activity and the catalyst efficiency by 1i seemed to be more sensitive to temperature than those by 1h. Although the Al complexes containing alkyl substituent in the imino group (1a–c) were not efficient for the ROP of both CL and VL, the cyclohexyl analogue (1b) was found to be effective for the ROP of LC (run 43). The activity of both the tert-butyl analogue (1a) and the adamantyl analogue (1c) were significantly lower than that by 1b probably due to the steric bulk. The moderate catalytic activity by 1b would be caused by an electronic effect of alkyl substituent, because the catalytic activity by the phenyl analogue (1d) possessing the same steric bulk was about quarter of that by 1b (run 44). The results thus suggest that the nucleophilicity of O n Bu would be enhanced by placing electron-releasing group as the imino substituent. 1H NMR spectra of methine region of the resultant poly(LC) indicated that the resultant polymers prepared by the Al complexes (1a–f,h,i)- n BuOH catalyst systems had no tacticity (stereo regularity), and atactic polymers were thus collected (Fig. 5 ). 2.4 Attempted ring-opening polymerizations of β-butyrolactone and γ-butyrolactone Ring-opening polymerizations (ROPs) of β-butyrolactone and γ-butyrolactone using the Me2Al[O-2-tBu-6-(RNCH)C6H3] (1e,h,i)- n BuOH catalyst systems were attempted under bulk (neat) conditions at 80°C for 24h (Al 50μmol, monomer/Al molar ratio=100). However, the attempted ROPs gave negligible amount of polymers under these conditions. These results thus suggest that the present catalytic systems are limited to be effective for cyclic esters consisting of six or seven membered ring. 2.5 Concluding remarks We have conducted ring-opening polymerization of ɛ-caprolactone (CL), δ-valerolactone (VL), and rac-lactide (LC) using a series of Al complexes containing phenoxy-imine ligands of type, Me2Al[O-2- t Bu-6-(RNCH)C6H3] [1, R= t Bu (a), cyclohexyl (b), adamantyl (c), C6H5 (d), 2,6-Me2C6H3 (e), 2,6- i Pr2C6H3 (f), 2,4,6-Me3C6H2 (g), 2,4,6- t BuC6H2 (h), C6F5 (i)] upon the presence of n BuOH (1.0equiv.). It turned out that the imino substituent strongly affect toward both the catalytic activity and the catalyst efficiency, and the C6F5 analogue (1i) is a suitable catalyst precursor for the ROPs. The polymerization of CL and VL by 1i proceeded in a living manner. The 2,4,6- t Bu3C6H2 analogue (1h) also exhibited remarkable catalytic activities for ROPs of CL and VL, but the catalyst efficiency of 1h was apparently lower than 1i. Both the C6F5 analogue (1i) and the 2,4,6- t Bu3C6H2 analogue (1h) also showed moderate catalyst activity in the ROP of LC, but the resultant polymer possessed no stereo regularity (atactic). The attempts for polymerization of β-butyrolactone and γ-butyrolactone afforded negligible amount of polymers, suggesting that the present catalyst systems are limited to be effective for cyclic esters consisting of six or seven membered ring. Our present study in this project focuses on more details for the ROPs using the C6F5 analogue, Me2Al[O-2- t Bu-6-{(C6F5)NCH}C6H3] (1i), including not only synthesis of various Al complexes containing a series of fluorinated aromatic substituents as the imino substituent, but also isolation of the initiating species for the ROP. These results will be introduced in the near future. 3 Experimental 3.1 General procedures All experiments were carried out under a nitrogen atmosphere in a Vacuum Atmospheres drybox or using standard Schlenk techniques. Anhydrous-grade n-hexane, toluene (Kanto Kagaku Co., Ltd.) were transferred into a bottle containing molecular sieves (a mixture of 3A 1/16, 4A 1/8, and 13X 1/16) in the drybox under N2 stream, and were passed through a short alumina column under N2 stream before use. All chemicals used were of reagent grade and were purified by the standard purification procedures. Reagent-grade AlMe3 in n-hexane (Kanto Kagaku Co. Ltd.) were stored in the drybox and were used as received. Various salicylaldimines (imino-phenols) containing different substituent on the imino groups, 2- t Bu-6-(RNCH)C6H3OH [R= t Bu, cyclohexyl, adamantyl, Ph, 2,6-Me2C6H3, 2,6- i Pr2C6H3, 2,4,6- t Bu3C6H2, C6F5] were prepared according to the reported procedures [9]. Syntheses of Al complexes (1a–f,i) were referred to our previous report [7,8]. Elemental analyses were performed by using a PE2400II Series (PerkinElmer Co.). All 1H, and 13C NMR spectra were recorded on a JEOL JNM-LA400 spectrometer (399.65MHz for 1H, 100.40MHz for 13C). All spectra were obtained in the solvent indicated at 25°C unless otherwise noted, and chemical shifts are given in ppm and are referenced to SiMe4 (δ 0.00, 1H, 13C). Molecular weights and the molecular weight distributions of resultant polymers were measured by gel-permeation chromatography (GPC). GPC were performed at 40°C on a Shimazu SCL-10A using a RID-10A detector (Shimazu Co. Ltd.) in THF (containing 0.03wt.% 2,6-di-tert-butyl-p-cresol, flow rate 1.0mL/min). GPC columns (ShimPAC GPC-806, 804 and 802, 30cm×8.0mm ϕ, spherical porous gel made of styrene/divinylbenzene copolymer, ranging from <102 to 2×107 MW) were calibrated versus polystyrene standard samples. 3.2 Synthesis of Me2Al[O-2-tBu-6-{(2,4,6-Me3C6H2)NCH}C6H3] (1g) Into a stirred solution containing 2- t Bu-6-{(2,4,6-Me3C6H2)NCH}C6H3OH (1.41g, 4.00mmol) in n-hexane (10.0mL), AlMe3 (1.1M n-hexane solution, 4.67mL, 4.20mmol Al) was added dropwise over 10min period at −20°C. The solution was allowed to warm to room temperature and was stirred for 3h (Scheme 2). The mixture was then concentrated in vacuo, and the resultant solid was dissolved in a minimum amount of n-hexane. The chilled solution (−20°C) afforded colorless microcrystals of 1g (1.39g, 99% yield). 1H NMR (C6D6): δ −0.28 (s, 6H, AlMe2), 1.56 (s, 9H, t Bu), 1.98 (s, 6H, Me), 2.05 (s, 3H, Me), 6.59–6.67 (m, 4H, aromatic), 7.31 (s, 1H, CHN), 7.42 (d, J =7Hz, 1H, aromatic). 13C NMR (C6D6): δ −8.6, 18.4, 20.7, 29.5, 35.4, 117.3, 119.8, 129.7, 131.4, 133.7, 135.0, 136.8, 141.8, 142.7, 164.8, 174.8. Anal. calcd for C22H31AlNO: C, 75.18; H, 8.60; N, 3.99. Found: C, 75.34; H, 8.76; N, 3.97. 3.3 Synthesis of Me2Al[O-2-tBu-6-{(2,4,6-tBu3C6H2)NCH}C6H3] (1h) Into a stirred solution containing 2- t Bu-6-{(2,4,6- t Bu3C6H2)NCH}C6H3OH (0.905g, 2.15mmol) in n-hexane (3.0mL), AlMe3 (1.1M n-hexane solution, 1.62g, 2.37mmol Al) was added dropwise over 10min period at −20°C. The solution was allowed to warm to room temperature and was stirred for 3h (Scheme 2). Removal of the solvent from the mixture by using a rotary evaporator in vacuo gave complex 1h (0.88g, 85.8% yield) as yellow powder. 1H NMR (C6D6): δ −0.18 (s, 6H, AlMe2), 1.26 (s, 9H, t Bu), 1.42 (s, 18H, t Bu), 1.55 (s, 9H, t Bu), 6.59 (t, J =7.72Hz, 1H, aromatic), 6.72 (d, J =8.08Hz, 1H, aromatic), 7.39 (d, J =7.32Hz, 1H, aromatic), 7.59 (s, 1H, aromatic), 7.90 (s, 1H, CHN). 13C NMR (C6D6): δ −6.7, 29.6, 31.3, 34.4, 34.8, 35.4, 37.6, 117.8, 120.2, 125.1, 133.0, 134.8, 142.3, 143.5, 143.7, 148.5, 164.7, 177.1. Anal. calcd for C31H48AlNO: C, 77.94; H, 10.13; N, 2.93. Found: C, 77.60; H, 10.27; N, 3.02. 3.4 Ring-opening polymerization (ROP) of ɛ-caprolactone (CL) Typical polymerization procedures (Table 1, run 11) are as follows. Into a sealed Schlenk tube containing a toluene solution containing 1i (0.010mmol/0.085mL of toluene), n BuOH (0.010mmol) was added in the drybox at room temperature. The solution was stirred for 10min, and the solution was then added ɛ-caprolactone (5.0mmol). The reaction mixture was then placed into an oil bath preheated at 60°C, and the solution was stirred for the prescribed time (30min). The polymerization mixture was then quenched by adding methanol (1.0mL), and the resultant solution was then poured into methanol (400mL). The ring-opened polymer was then collected as the methanol insoluble white precipitates; the resultant polymer was then collected onto a filter paper and was dried in vacuo. 1H NMR (CDCl3): δ 1.33 (m, 2H), 1.51–1.63 (m, 4H), 2.25 (t, 2H), 4.00 (t, 2H). 13C NMR (CDCl3): δ 24.5, 25.5, 28.3, 34.1, 64.1, 173.5 (CO). 3.5 Ring-opening polymerization (ROP) of δ-valerolactone (VL) Typical polymerization procedures (Table 3, run 32) are as follows. Into a sealed Schlenk tube containing a toluene solution containing 1i (0.020mmol/0.085mL of toluene), n BuOH (0.020mmol) was added in the drybox at room temperature. The solution was stirred for 10min, and the solution was then added δ-valerolactone (5.0mmol). The reaction mixture was then placed into an oil bath preheated at 60°C, and the solution was stirred for the prescribed time (30min). The polymerization mixture was then quenched by adding methanol (1.0mL), and the resultant solution was then poured into methanol (400mL). The ring-opened polymer was then collected as the methanol insoluble white precipitates; the resultant polymer was then collected onto a filter paper and was dried in vacuo. 1H NMR (C6D6): δ 1.39–1.59 (m, 4H), 2.07 (t, 2H), 3.95 (t, 2H). 13C NMR (CDCl3): δ 21.7, 28.4, 33.7, 63.8, 64.1, 172.6 (CO). 3.6 Ring-opening polymerization (ROP) of rac-lactide (LC) Typical polymerization procedures (Table 5, run 43) are as follows. Into a sealed Schlenk tube containing a toluene solution containing 1b (0.050mmol/0.085mL of toluene), n BuOH (0.050mmol) was added in the drybox at room temperature. The solution was stirred for 10min, and the solution was then added toluene (4.9mL), rac-lactide (5.0mmol). The reaction mixture was then placed into an oil bath preheated at 60°C, and the solution was stirred for the prescribed time (24h). The polymerization mixture was then quenched by adding methanol (1.0mL), and the resultant solution was then poured into cold methanol (300mL). The ring-opened polymer was then collected as the methanol insoluble white precipitates; the resultant polymer was then collected onto a filter paper and was dried in vacuo. 1H NMR (CDCl3): δ 1.54–1.58 (m, 6H), 5.13–5.24 (m, 2H). 13C NMR (CDCl3): δ 16.6–16.7 (m, CH3), 69.0–69.2 (m, CCH3), 169.1–169.6 (m, CO). 3.7 Crystallographic analysis The crystallographic analysis for Me2Al[O-2- t Bu-6-{(2,4,6-Me3C6H2)NCH}C6H3] (1g) was made on a Rigaku RAXIS-RAPID imaging plate diffractometer with graphite-monochromated Mo Kα radiation. All structures were solved by direct methods and expanded using Fourier techniques [15], and the non-hydrogen atoms were refined anisotropically. Hydrogen atoms were included but not refined. All calculations were performed using the Crystal Structure crystallographic software package [16]. The selected crystal collection parameters: crystal color, habit=red, block; formula=C22H30AlNO; crystal system, space group=triclinic, Pna21 (#33); a =8.8176(4)Å; b =25.7758(9)Å; c =9.3767(3)Å; V =2131.15(14)Å3; Z =4; D calcd =1.095g/cm3; F 000 =760.00; no. of reflections measured=20,121; no. of observations (I >2.00σ (I))=2213; R 1 =0.0342; w R 2 = 0.0956 ; goodness of fit=1.000. The crystallographic data (including CIF files) for 1g was also deposited in Cambridge Crystallographic Data Centre as CCDC 687433. The data can be obtained free of charge via http://www.ccdc.cam.ac.uk/conts/retrieving.html or e-mail deposit@ccdc.cam.ac.uk. Detailed analysis results such as CIF file, the structure report including crystal data and crystallographic parameters are shown in Supplementary Material. Acknowledgements N.I. and K.N. express their thanks to Daiso Co., Ltd. for support, and to Mr. Shohei Katao (NAIST) for structural analysis. Appendix A Supplementary data Supplementary data associated with this article can be found, in the online version, at doi:10.1016/j.molcata.2008.06.009. Appendix A Supplementary data CIF file, the structure report including crystal data and crystallographic parameters for structural analysis for Me2Al[O-2-tBu-6-{(2,4,6-Me3C6H2)NCH}C6H3] (1g). The crystallographic data (including CIF files) for 1g was also deposited in Cambridge Crystallographic Data Centre as CCDC 687433. The data can be obtained free of charge via http://www.ccdc.cam.ac.uk/conts/retrieving.html or e-mail deposit@ccdc.cam.ac.uk. References [1] For recent reviewing article: (a) D. Mecerreyes R. Jerome P. Dubois Adv. Polym. Sci. 147 1 1999 (b) B.J. O’Keefe M.A. Hillmyer W.B. Tolman J. Chem. Soc. Dalton Trans. 2001 2215 (c) K.M. Stridsberg M. Ryner A.C. Albertsson Adv. Polym. Sci. 157 2002 41 (d) A.-C. Albertsson I. Varma Biomacromolecules 4 2003 1466 (e) O. Dechy-Cabaret B. Martin-Vaca D. Bourissou Chem. Rev. 104 2004 6147 [2] Examples for polymerization of lactide by Al: (a) L. Trofimoff T. Aida S. Inoue Chem. Lett. 1987 991 (b) N. Spassky M. Wisniewski C. Pluta A. Le Borgne Macromol. Chem. Phys. 197 1996 2627 (c) G. Montaudo M.S. Montaudo C. Puglisi F. Samperi N. Spassky A. LeBorgne M. Wisniewski Macromolecules 29 1996 6461 (d) M. Wisniewski A. LeBorgne N. Spassky Macromol. Chem. Phys. 198 1997 1227 (e) A. Kowalski A. Duda S. Penczek Macromolecules 31 1998 2114 (f) P.A. Cameron D. Jhurry V.C. Gibson A.J.P. White D.J. Williams S. Williams Macromol. Rapid Commun. 20 1999 616 (g) T.M. Ovitt G.W. Coates J. Am. Chem. Soc. 121 1999 4072 (h) A. Bhaw-Luximon D. Jhurry N. Spassky Polym. Bull. 44 2000 31 (i) C.P. Radano G.L. Baker M.R. Smith J. Am. Chem. Soc. 122 2000 1552 (j) T.M. Ovitt G.W. Coates J. Polym. Sci., Part A: Polym. Chem. 38 2000 4686 (k) C.-H. Huang F.-C. Wang B.-T. Ko T.-L. Yu C.-C. Lin Macromolecules 34 2001 356 (l) M.H. Chisholm D. Navarro-Llobet W.J. Simonsick Jr. Macromolecules 34 2001 885 (m) N. Nomura R. Ishii M. Akakura K. Aoi J. Am. Chem. Soc. 124 2002 5938 (n) T.M. Ovitt G.W. Coates J. Am. Chem. Soc. 124 2002 1316 (o) D. Chakraborty E.Y.-X. Chen Organometallics 22 2003 769 [3] Examples for ROP of lactones, etc.: (a) B.-T. Ko C.-C. Lin Macromolecules 32 1999 8296 (b) I. Taden H.-C. Kang W. Massa T.P. Spaniol J. Okuda Eur. J. Inorg. Chem. 2000 441 (c) D. Chakraborty E.Y.-X. Chen Organometallics 21 2002 1438 (d) M.-L. Hsueh B.-H. Huang C.-C. Lin Macromolecules 35 2002 5763 (e) R.-C. Yu C.-H. Hung J.-H. Huang H.-Y. Lee J.-T. Chen Inorg. Chem. 41 2002 6450 (f) G. Zheng H.D.H. Stöver Macromolecules 36 2003 7439 (g) L.M. Alcazar-Roman B.J. O’Keefe M.A. Hillmyer W.B. Tolman Dalton Trans. 2003 3082 (h) C.-T. Chen C.-A. Huang B.-H. Huang Macromolecules 37 2004 7968 (i) J. Lewinsky P. Horeglad E. Tratkiewicz W. Grzenda J. Lipkowski E. Kolodziejczyk Macromol. Rapid Commun. 25 2004 1939 (j) N. Nomura T. Aoyama R. Ishii T. Kondo Macromolecules 38 2005 5363 (k) A. Amgoune L. Lavanant C.M. Thomas Y. Chi R. Welter S. Dagorne J.-F. Carpentier Organometallics 24 2005 6279 (l) F. Majoumo-Mbe E. Smolensky P. Lönnecke S. Shpasser M.S. Eisen E. Hey-Hawkins J. Mol. Catal. A 240 2005 91 [4] (a) M.K. Cox M. Vert J. Feijen A. Albertsson G. Scott E. Chiellini Biodegradable Polymers and Plastics 1992 The Royal Society of Chemistry Cambridge, UK 95 (b) Y. Doi Y. Kumagai N. Tanahashi K. Mukai M. Vert J. Feijen A. Albertsson G. Scott E. Chiellini Biodegradable Polymers and Plastics 1992 The Royal Society of Chemistry Cambridge, UK 139 (c) M. Okada Prog. Polym. Sci. 27 2002 87 [5] (a) D.A. Atwood J.A. Jegier D. Rutherford Inorg. Chem. 35 1996 63 (b) B. Qian D.L. Ward M.R. Smith III Organometallics 17 1998 3070 (c) C.E. Radzewich M.P. Coles R.F. Jordan J. Am. Chem. Soc. 120 1998 9384 (d) P.A. Cameron V.C. Gibson C. Redshaw J.A. Segal M.D. Bruce A.J.P. White D.J. Williams Chem. Commun. 1999 1883 (e) M.-A. Muñoz-Hernández T.S. Keiser B. Patrick D.A. Atwood Organometallics 19 2000 4416 (f) S. Liu M.-A. Munoz-Hernandez D.A. Atwood J. Organomet. Chem. 596 2000 109 (g) P.A. Cameron V.C. Gibson C. Redshaw J.A. Segal G.A. Solan J. Chem. Soc., Dalton Trans. 2001 1472 (h) M.S. Hill A.R. Hutchison T.S. Keiser S. Parkin M.A. VanAelstyn D.A. Atwood J. Organomet. Chem. 628 2001 71 (i) C. Redshaw M.R.J. Elsegood Chem. Commun. 2001 2016 (j) P.A. Cameron V.C. Gibson C. Redshaw J.A. Segal A.J.P. White D.J. Williams J. Chem. Soc., Dalton Trans. 2002 415 (k) D. Chakraborty E.Y.-X. Chen Macromolecules 35 2002 13 (l) J. Lewiński J. Zachara K.B. Starowieyski Z. Ochal I. Justyniak T. Kopec P. Stolarzewicz M. Dranka Organometallics 22 2003 3773 (m) J. Lewinski P. Horeglad M. Dranka I. Justyniak Inorg. Chem. 43 2004 5789 (n) S. Dagorne L. Lavanant R. Welter C. Chassenieux P. Haquette G. Jaouen Organometallics 22 2003 3732 (o) W. Braune J. Okuda Angew. Chem. Int. Ed. 42 2003 64 (p) H. Zhu E.Y.-X. Chen Inorg. Chem. 46 2007 1481 (q) W. Yao Y. Mu A. Gao Q. Su Y. Liu Y. Zhang Polymer 49 2008 2486 [6] (a) K. Maruoka T. Itoh M. Sakurai K. Nonoshita H. Yamamoto J. Am. Chem. Soc. 110 1988 3588 (b) K. Maruoka T. Ooi H. Yamamoto J. Am. Chem. Soc. 111 1989 6431 (c) K. Maruoka A.B. Conception N. Murase M. Oishi N. Hirayama H. Yamamoto J. Am. Chem. Soc. 115 1993 3943 (d) K. Maruoka H. Imoto S. Saito H. Yamamoto J. Am. Chem. Soc. 116 1994 4131 (e) S. Saito H. Yamamoto J. Chem. Soc., Chem. Commun. 1997 1585 [7] N. Iwasa J. Liu K. Nomura Catal. Commun. 9 2008 1148 [8] J. Liu, N. Iwasa, K. Nomura, Dalton Trans., in press. [9] Syntheses of various salicylaldimines, and Ti, Zr, V complexes containing bis(phenoxy-imine) ligands: T. Fujita, Y. Tohi, M. Mitani, European patent EP 0874005A1 (1998). [10] (a) S. Matsui M. Mitani J. Saito Y. Tohi H. Makio N. Matsukawa Y. Takagi K. Tsuru M. Nitabaru T. Nakano H. Tanaka N. Kashiwa T. Fujita J. Am. Chem. Soc. 123 2001 6847 (b) M. Mitani J. Mohri Y. Yoshida J. Saito S. Ishii K. Tsuru S. Matsui R. Furuyama T. Nakano H. Tanaka S. Kojoh T. Matsugi N. Kashiwa T. Fujita J. Am. Chem. Soc. 124 2002 3327 (c) M. Mitani R. Furuyama J. Mohri J. Saito S. Ishii H. Terao T. Nakano H. Tanaka T. Fujita J. Am. Chem. Soc. 125 2003 4293 (d) H. Terao S. Ishii J. Saito S. Matsuura M. Mitani N. Nagai H. Tanaka T. Fujita Macromolecules 39 2006 8584 [11] CIF file, the structure report including crystal data and crystallographic parameters are shown in the Supplementary Material. [12] Reports concerning comparison between exact number average molecular weights and Mn values by GPC vs. polystyrene standards: (a) A. Duda Z. Florjanczyk A. Hofman S. Slomkowski S. Penczek Macromolecules 23 1990 1640 (b) S.J. McLain N.E. Drysdale Polym. Prep. (Am. Chem. Soc., Div. Polym. Chem.) 33 1992 174 (c) H. Pasch K. Rhode J. Chromatogr. A 699 1995 24 (d) H.R. Kricheldorf S. Eggerstedt Macromol. Chem. Phys. 199 1998 283 (e) A. Duda A. Kowalski S. Penczek Macromolecules 31 1998 2114 (f) A. Kowalski J. Libiszowski A. Duda S. Penczek Macromolecules 33 2000 1964 (g) H.-L. Chen B.-T. Ko B.-H. Huang C.-C. Lin Organometallics 20 2001 5076 (h) M. Save M. Schappacher A. Soum Macromol. Chem. Phys. 203 2002 889 (i) H.R. Kricheldorf, S. Rost, Polymer 46 (2005) 3248. In this paper, the exact M n values for ring-opened poly (CL)s and poly (LC)s were corrected from the M n values by GPC vs. polystyrene standards according to the following equation; M n(PCL) =0.56× M n(GPC vs. polystyrene standards) [12e,h]. M n(PLC) =0.58× M n(GPC vs. polystyrene standards) [11e,h]. [13] W. Dittrich R.C. Shultz Angew. Macromol. Chem. 15 1971 109 [14] Selected reports concerning transesterification in the ROP of cl, dl-lactide: (a) A. Duda S. Penczek Macromolecules 28 1995 5981 (b) N. Spassky V. Simic M.S. Montaudo L.G. Hubert-Pfalzgraf Macromol. Chem. Phys. 201 2000 2432 (c) D. Jhurry A. Bhaw-Luximon N. Spassky Macromol. Symp. 175 2001 67 (d) J. Cayuela V. Bounor-Legaré P. Cassagnau A. Michel Macromolecules 39 2006 1338 [15] DIRDIF94: P.T. Beurskens, G. Admiraal, G. Beurskens, W.P. Bosman, R. de Delder, R. Israel, J.M.M. Smits. The DIRDIF94 program system, Technical report of crystallography laboratory, Univ. of Nijmegen, Netherlands, 1994. [16] (a) Crystal Structure 3.6.0: Crystal Structure Analysis Package, Rigaku and Rigaku/MSC (2000–2004) 9009 New Trails Dr. The Woodlands, TX 77381, USA. (b) CRYSTALS Issue 10: D.J. Watkin C.K. Prout J.R. Carruthers P.W. Betteridge Chemical Crystallography Laboratory 1996 Oxford UK",
      "scopus-id": "52049103342",
      "coredata": {
        "eid": "1-s2.0-S1381116908002835",
        "dc:description": "Ring-opening polymerizations (ROPs) of various cyclic esters [ɛ-caprolactone (CL), δ-valerolactone (VL), rac-lactide (LC)] using a series of Al complexes containing phenoxy-imine ligands of type, Me2Al[O-2- t Bu-6-(RNCH)C6H3], [R= t Bu (1a), cyclohexyl (1b), adamantyl (1c), C6H5 (1d), 2,6-Me2C6H3 (1e), 2,6- i Pr2C6H3 (1f), 2,4,6-Me3C6H2 (1g), 2,4,6- t Bu3C6H2 (1h), C6F5 (1i)], have been explored in the presence of n BuOH. Synthesis and identification of 1g and 1h including structural analysis of 1g by X-ray crystallography have also been explored. Both the catalytic activity and the catalyst efficiency in the ROPs were found to be highly affected by the imino substituents (R) employed. The 2,4,6- t Bu3C6H2 analogue (1h) showed the notable catalytic activity in spite of its low catalyst efficiency in the ROP of CL, and the C6F5 analogue (1i) was most effective in terms of both the activity and the efficiency. The C6F5 analogue (1i) also showed the highest catalytic activity for the ROP of VL, and the polymerization proceeded in a living manner. The C6F5 analogue also showed relatively high catalytic activity in the ROP of LC, but the resultant polymer had no stereo-regularity. Although the Al complexes containing alkyl substituents (1a–c) exhibited low or negligible catalytic activities in the ROPs of CL and VL, the cyclohexyl analogue (1b) showed moderate catalytic activity for the ROP of LC. Attempts for the ROP of β-butyrolactone (β-BL) and γ-butyrolactone (γ-BL) using 1e,h,i- n BuOH catalyst systems afforded negligible amount of polymers under the similar conditions.",
        "openArchiveArticle": "false",
        "prism:coverDate": "2008-09-17",
        "openaccessUserLicense": null,
        "prism:aggregationType": "Journal",
        "prism:url": "https://api.elsevier.com/content/article/pii/S1381116908002835",
        "dc:creator": [
          {
            "@_fa": "true",
            "$": "Iwasa, Naruhito"
          },
          {
            "@_fa": "true",
            "$": "Fujiki, Michiya"
          },
          {
            "@_fa": "true",
            "$": "Nomura, Kotohiro"
          }
        ],
        "link": [
          {
            "@_fa": "true",
            "@rel": "self",
            "@href": "https://api.elsevier.com/content/article/pii/S1381116908002835"
          },
          {
            "@_fa": "true",
            "@rel": "scidir",
            "@href": "https://www.sciencedirect.com/science/article/pii/S1381116908002835"
          }
        ],
        "dc:format": "application/json",
        "openaccessType": null,
        "pii": "S1381-1169(08)00283-5",
        "prism:volume": "292",
        "prism:publisher": "Elsevier B.V.",
        "dc:title": "Ring-opening polymerization of various cyclic esters by Al complex catalysts containing a series of phenoxy-imine ligands: Effect of the imino substituents for the catalytic activity",
        "prism:copyright": "Copyright © 2008 Elsevier B.V. All rights reserved.",
        "openaccess": "0",
        "prism:issn": "13811169",
        "prism:issueIdentifier": "1-2",
        "dcterms:subject": [
          {
            "@_fa": "true",
            "$": "Al complex"
          },
          {
            "@_fa": "true",
            "$": "Ring-opening polymerization"
          },
          {
            "@_fa": "true",
            "$": "Lactone"
          },
          {
            "@_fa": "true",
            "$": "Lactide"
          }
        ],
        "openaccessArticle": "false",
        "prism:publicationName": "Journal of Molecular Catalysis A: Chemical",
        "prism:number": "1-2",
        "openaccessSponsorType": null,
        "prism:pageRange": "67-75",
        "prism:endingPage": "75",
        "pubType": "fla",
        "prism:coverDisplayDate": "17 September 2008",
        "prism:doi": "10.1016/j.molcata.2008.06.009",
        "prism:startingPage": "67",
        "dc:identifier": "doi:10.1016/j.molcata.2008.06.009",
        "openaccessSponsorName": null
      },
      "objects": {
        "object": [
          {
            "@category": "thumbnail",
            "@height": "14",
            "@width": "98",
            "@_fa": "true",
            "$": "https://api.elsevier.com/content/object/eid/1-s2.0-S1381116908002835-si1.gif?httpAccept=%2A%2F%2A",
            "@multimediatype": "GIF image file",
            "@type": "ALTIMG",
            "@size": "458",
            "@ref": "si1",
            "@mimetype": "image/gif"
          },
          {
            "@category": "standard",
            "@_fa": "true",
            "$": "https://api.elsevier.com/content/object/eid/1-s2.0-S1381116908002835-mmc1.pdf?httpAccept=%2A%2F%2A",
            "@multimediatype": "Acrobat PDF file",
            "@type": "APPLICATION",
            "@size": "166512",
            "@ref": "mmc1",
            "@mimetype": "application/pdf"
          },
          {
            "@category": "standard",
            "@height": "447",
            "@width": "375",
            "@_fa": "true",
            "$": "https://api.elsevier.com/content/object/eid/1-s2.0-S1381116908002835-sc1.jpg?httpAccept=%2A%2F%2A",
            "@multimediatype": "JPEG image file",
            "@type": "IMAGE-DOWNSAMPLED",
            "@size": "52441",
            "@ref": "sc1",
            "@mimetype": "image/jpeg"
          },
          {
            "@category": "thumbnail",
            "@height": "93",
            "@width": "78",
            "@_fa": "true",
            "$": "https://api.elsevier.com/content/object/eid/1-s2.0-S1381116908002835-sc1.sml?httpAccept=%2A%2F%2A",
            "@multimediatype": "GIF image file",
            "@type": "IMAGE-THUMBNAIL",
            "@size": "1302",
            "@ref": "sc1",
            "@mimetype": "image/gif"
          },
          {
            "@category": "standard",
            "@height": "153",
            "@width": "465",
            "@_fa": "true",
            "$": "https://api.elsevier.com/content/object/eid/1-s2.0-S1381116908002835-sc2.jpg?httpAccept=%2A%2F%2A",
            "@multimediatype": "JPEG image file",
            "@type": "IMAGE-DOWNSAMPLED",
            "@size": "11793",
            "@ref": "sc2",
            "@mimetype": "image/jpeg"
          },
          {
            "@category": "thumbnail",
            "@height": "41",
            "@width": "125",
            "@_fa": "true",
            "$": "https://api.elsevier.com/content/object/eid/1-s2.0-S1381116908002835-sc2.sml?httpAccept=%2A%2F%2A",
            "@multimediatype": "GIF image file",
            "@type": "IMAGE-THUMBNAIL",
            "@size": "702",
            "@ref": "sc2",
            "@mimetype": "image/gif"
          },
          {
            "@category": "standard",
            "@height": "251",
            "@width": "564",
            "@_fa": "true",
            "$": "https://api.elsevier.com/content/object/eid/1-s2.0-S1381116908002835-gr1.jpg?httpAccept=%2A%2F%2A",
            "@multimediatype": "JPEG image file",
            "@type": "IMAGE-DOWNSAMPLED",
            "@size": "38392",
            "@ref": "gr1",
            "@mimetype": "image/jpeg"
          },
          {
            "@category": "thumbnail",
            "@height": "56",
            "@width": "125",
            "@_fa": "true",
            "$": "https://api.elsevier.com/content/object/eid/1-s2.0-S1381116908002835-gr1.sml?httpAccept=%2A%2F%2A",
            "@multimediatype": "GIF image file",
            "@type": "IMAGE-THUMBNAIL",
            "@size": "1315",
            "@ref": "gr1",
            "@mimetype": "image/gif"
          },
          {
            "@category": "standard",
            "@height": "651",
            "@width": "470",
            "@_fa": "true",
            "$": "https://api.elsevier.com/content/object/eid/1-s2.0-S1381116908002835-gr2.jpg?httpAccept=%2A%2F%2A",
            "@multimediatype": "JPEG image file",
            "@type": "IMAGE-DOWNSAMPLED",
            "@size": "48593",
            "@ref": "gr2",
            "@mimetype": "image/jpeg"
          },
          {
            "@category": "thumbnail",
            "@height": "93",
            "@width": "67",
            "@_fa": "true",
            "$": "https://api.elsevier.com/content/object/eid/1-s2.0-S1381116908002835-gr2.sml?httpAccept=%2A%2F%2A",
            "@multimediatype": "GIF image file",
            "@type": "IMAGE-THUMBNAIL",
            "@size": "1043",
            "@ref": "gr2",
            "@mimetype": "image/gif"
          },
          {
            "@category": "standard",
            "@height": "224",
            "@width": "282",
            "@_fa": "true",
            "$": "https://api.elsevier.com/content/object/eid/1-s2.0-S1381116908002835-gr3.jpg?httpAccept=%2A%2F%2A",
            "@multimediatype": "JPEG image file",
            "@type": "IMAGE-DOWNSAMPLED",
            "@size": "20620",
            "@ref": "gr3",
            "@mimetype": "image/jpeg"
          },
          {
            "@category": "thumbnail",
            "@height": "93",
            "@width": "117",
            "@_fa": "true",
            "$": "https://api.elsevier.com/content/object/eid/1-s2.0-S1381116908002835-gr3.sml?httpAccept=%2A%2F%2A",
            "@multimediatype": "GIF image file",
            "@type": "IMAGE-THUMBNAIL",
            "@size": "1006",
            "@ref": "gr3",
            "@mimetype": "image/gif"
          },
          {
            "@category": "standard",
            "@height": "178",
            "@width": "282",
            "@_fa": "true",
            "$": "https://api.elsevier.com/content/object/eid/1-s2.0-S1381116908002835-gr4.jpg?httpAccept=%2A%2F%2A",
            "@multimediatype": "JPEG image file",
            "@type": "IMAGE-DOWNSAMPLED",
            "@size": "23197",
            "@ref": "gr4",
            "@mimetype": "image/jpeg"
          },
          {
            "@category": "thumbnail",
            "@height": "79",
            "@width": "125",
            "@_fa": "true",
            "$": "https://api.elsevier.com/content/object/eid/1-s2.0-S1381116908002835-gr4.sml?httpAccept=%2A%2F%2A",
            "@multimediatype": "GIF image file",
            "@type": "IMAGE-THUMBNAIL",
            "@size": "1254",
            "@ref": "gr4",
            "@mimetype": "image/gif"
          },
          {
            "@category": "standard",
            "@height": "546",
            "@width": "602",
            "@_fa": "true",
            "$": "https://api.elsevier.com/content/object/eid/1-s2.0-S1381116908002835-gr5.jpg?httpAccept=%2A%2F%2A",
            "@multimediatype": "JPEG image file",
            "@type": "IMAGE-DOWNSAMPLED",
            "@size": "64423",
            "@ref": "gr5",
            "@mimetype": "image/jpeg"
          },
          {
            "@category": "thumbnail",
            "@height": "93",
            "@width": "103",
            "@_fa": "true",
            "$": "https://api.elsevier.com/content/object/eid/1-s2.0-S1381116908002835-gr5.sml?httpAccept=%2A%2F%2A",
            "@multimediatype": "GIF image file",
            "@type": "IMAGE-THUMBNAIL",
            "@size": "1515",
            "@ref": "gr5",
            "@mimetype": "image/gif"
          },
          {
            "@category": "standard",
            "@height": "162",
            "@width": "357",
            "@_fa": "true",
            "$": "https://api.elsevier.com/content/object/eid/1-s2.0-S1381116908002835-fx1.jpg?httpAccept=%2A%2F%2A",
            "@multimediatype": "JPEG image file",
            "@type": "IMAGE-DOWNSAMPLED",
            "@size": "28598",
            "@ref": "fx1",
            "@mimetype": "image/jpeg"
          },
          {
            "@category": "thumbnail",
            "@height": "57",
            "@width": "125",
            "@_fa": "true",
            "$": "https://api.elsevier.com/content/object/eid/1-s2.0-S1381116908002835-fx1.sml?httpAccept=%2A%2F%2A",
            "@multimediatype": "GIF image file",
            "@type": "IMAGE-THUMBNAIL",
            "@size": "2742",
            "@ref": "fx1",
            "@mimetype": "image/gif"
          }
        ]
      },
      "link": {
        "@rel": "abstract",
        "@href": "https://api.elsevier.com/content/abstract/scopus_id/52049103342"
      }
    }
  }
}