{
  "metadata": {
    "title": "Synthesis of novel palladium–carbene complexes as efficient catalysts for amination of aryl chlorides in ionic liquid",
    "authors": "; ; ",
    "journal": "Journal of Molecular Catalysis A: Chemical",
    "date": "2004-11-15",
    "doi": "10.1016/j.molcata.2004.07.024",
    "abstract": "",
    "uri": "https://api.elsevier.com/content/article/pii/S1381116904005746",
    "pii": "S1381116904005746"
  },
  "fulltext": {
    "full-text-retrieval-response": {
      "scopus-eid": "2-s2.0-5144232203",
      "originalText": "serial JL 271358 291210 291744 291790 291809 31 Journal of Molecular Catalysis A: Chemical JOURNALMOLECULARCATALYSISACHEMICAL 2004-09-25 2004-09-25 2010-03-28T13:36:59 1-s2.0-S1381116904005746 S1381-1169(04)00574-6 S1381116904005746 10.1016/j.molcata.2004.07.024 S300 S300.2 FULL-TEXT 1-s2.0-S1381116900X01999 2015-05-15T05:56:32.920819-04:00 0 0 20041115 2004 2004-09-25T00:00:00Z articleinfo crossmark dco dateupdated tomb dateloaded datesearch indexeddate issuelist volumelist yearnav absattachment articletitlenorm authfirstinitialnorm authfirstsurnamenorm cid cids contenttype copyright dateloadedtxt docsubtype doctype doi eid ewtransactionid hubeid issfirst issn issnnorm itemstage itemtransactionid itemweight openaccess openarchive pg pgfirst pglast pii piinorm pubdatestart pubdatetxt pubyr sortorder srctitle srctitlenorm srctype subheadings volfirst volissue webpdf webpdfpagecount figure table body mmlmath acknowledge affil articletitle auth authfirstini authfull authkeywords authlast primabst pubtype ref specialabst alllist content subj ssids 1381-1169 13811169 222 222 1 2 1 2 Volume 222, Issues 1–2 12 97 102 97 102 20041115 15 November 2004 2004-11-15 2004 article sco Copyright © 2004 Elsevier B.V. All rights reserved. SYNTHESISNOVELPALLADIUMCARBENECOMPLEXESEFFICIENTCATALYSTSFORAMINATIONARYLCHLORIDESINIONICLIQUID OZDEMIR I 1 Introduction 2 Experimental 2.1 Preparations 1-butyl-3-methyl-4,5-dihydroimidazolium iodide 2.2 General procedure for the preparation of the palladium–carbene complex, 2, 3 2.3 PdCl2[ CN { C H 2 C 6 H 2 ( O M e ) 3 − 3 , 4 , 5 } C H 2 C H 2 N ⎴ {CH2C6H2(OMe)3-3,4,5}2] (2a) 2.4 PdCl2 [ C N { C H 2 C 6 H 2 M e 3 - 2 , 4 , 6 } C H 2 C H 2 N ⎴ {CH2C6H2Me3-2,4,6}2] (2b) 2.5 PdCl2 [ C N { C H 2 C H 2 O M e } C 6 H 4 N ⎴ {CH2CH2OMe}2] (3a) 2.6 PdCl2 [ C N { C H 2 C H 2 P h } C 6 H 4 N ⎴ {CH2CH2Ph}2] (3b) 2.7 PdCl2 [ C N { C H 2 C H 2 O M e } C 6 H 4 N ⎴ {CH2CH2Ph}2] (3c) 2.8 General procedure for amination of aryl chlorides 3 Results and discussion 4 Conclusion Acknowledgements References CETINKAYA 1974 1827 B LAPPERT 1988 185 M BOURISSOU 2000 39 D HERRMANN 2002 1290 W HERRMANN 1995 2371 W WESKAMP 1999 348 T MCGUINNESS 2001 4029 D MCGUINNESS 2001 8317 D BOHM 2000 186 V ZHANG 1999 3804 C MCGUINNESS 2000 741 D YANG 2001 1511 C CETINKAYA 1997 L1 B OZDEMIR 2001 27 I CETINKAYA 2002 31 B CETINKAYA 1997 153 B BIELOWSKI 2000 2903 C CHATTERJEE 2000 3783 A GARBER 2000 8168 S WESKAMP 1998 2490 T RANDT 2001 430 S GESSLER 2000 9973 S SCHUSTER 1997 2036 M ARMSTRONG 1998 371 S TRNKA 2001 18 T WESKAMP 1998 2490 T WESKAMP 1999 2416 T WESKAMP 1999 362 T SCHOLL 1999 2247 M CETINKAYA 2001 519 B CETINKAYA 2003 2323 B BELFIELD 1999 13285 A FROST 1998 2615 C CHO 1997 8331 Y BROWN 1999 1219 G IBATA 1987 1187 T KOTSKI 2000 116 H WOLFE 1998 805 J HARTWIG 19982046 J YANG 1999 125 B GRUSHIN 1994 1047 V VICIU 2002 2229 M LI 2001 8677 G LI 2001 1513 G WOLFE 2000 1158 J STAUFFER 2000 1423 S HARTWIG 1999 5575 J WOLFE 1999 2413 J OLD 1998 9722 D HAMANN 1998 7369 B WELTON 1999 2071 T WASSERSCHEID 2000 3772 P SHELDON 2001 2399 R GORDON 2001 101 C MAGNA 2003 4418 L COLE 2002 5962 A PENG 2001 5917 J FREEMANTLE 1998 32 M GURBUZ 2004 23 N DUBREUIL 2002 185 J HERRMANN 1996 772 W MAGILL 2001 546 A NIELSEN 2002 116 D OZDEMIR 2004 109 I SECKIN 2003 223 T GURBUZ 2003 776 N HERRMANN 1997 2162 W OZDEMIRX2004X97 OZDEMIRX2004X97X102 OZDEMIRX2004X97XI OZDEMIRX2004X97X102XI item S1381-1169(04)00574-6 S1381116904005746 1-s2.0-S1381116904005746 10.1016/j.molcata.2004.07.024 271358 2010-10-15T16:15:09.649563-04:00 2004-11-15 1-s2.0-S1381116904005746-main.pdf https://s3.amazonaws.com/prod-ucs-content-store-us-east/content/pii:S1381116904005746/MAIN/application/pdf/26d6e83142963931d6c0345b17b90c27/main.pdf https://s3-eu-west-1.amazonaws.com/prod-ucs-content-store-eu-west/content/pii:S1381116904005746/MAIN/application/pdf/26d6e83142963931d6c0345b17b90c27/main.pdf main.pdf pdf true 117544 MAIN 6 1-s2.0-S1381116904005746-main_1.png https://s3.amazonaws.com/prod-ucs-content-store-us-east/content/pii:S1381116904005746/PREVIEW/image/png/25e5939310036c2de9f6134d4a2ab39a/main_1.png https://s3-eu-west-1.amazonaws.com/prod-ucs-content-store-eu-west/content/pii:S1381116904005746/PREVIEW/image/png/25e5939310036c2de9f6134d4a2ab39a/main_1.png main_1.png png 64661 849 656 IMAGE-WEB-PDF 1 1-s2.0-S1381116904005746-si5.gif https://s3.amazonaws.com/prod-ucs-content-store-us-east/content/pii:S1381116904005746/STRIPIN/image/gif/d6b1f9fbdc788463d1d9e118340b9009/si3.gif https://s3-eu-west-1.amazonaws.com/prod-ucs-content-store-eu-west/content/pii:S1381116904005746/STRIPIN/image/gif/d6b1f9fbdc788463d1d9e118340b9009/si3.gif si5 si5.gif gif 1005 21 192 ALTIMG 1-s2.0-S1381116904005746-si4.gif https://s3.amazonaws.com/prod-ucs-content-store-us-east/content/pii:S1381116904005746/STRIPIN/image/gif/a94453c5e62d97cffb30d4c161286317/si4.gif https://s3-eu-west-1.amazonaws.com/prod-ucs-content-store-eu-west/content/pii:S1381116904005746/STRIPIN/image/gif/a94453c5e62d97cffb30d4c161286317/si4.gif si4 si4.gif gif 936 21 176 ALTIMG 1-s2.0-S1381116904005746-si3.gif https://s3.amazonaws.com/prod-ucs-content-store-us-east/content/pii:S1381116904005746/STRIPIN/image/gif/d6b1f9fbdc788463d1d9e118340b9009/si3.gif https://s3-eu-west-1.amazonaws.com/prod-ucs-content-store-eu-west/content/pii:S1381116904005746/STRIPIN/image/gif/d6b1f9fbdc788463d1d9e118340b9009/si3.gif si3 si3.gif gif 1005 21 192 ALTIMG 1-s2.0-S1381116904005746-si2.gif https://s3.amazonaws.com/prod-ucs-content-store-us-east/content/pii:S1381116904005746/STRIPIN/image/gif/0a4e59066d754597955c071efc36034e/si2.gif https://s3-eu-west-1.amazonaws.com/prod-ucs-content-store-eu-west/content/pii:S1381116904005746/STRIPIN/image/gif/0a4e59066d754597955c071efc36034e/si2.gif si2 si2.gif gif 1217 21 272 ALTIMG 1-s2.0-S1381116904005746-si1.gif https://s3.amazonaws.com/prod-ucs-content-store-us-east/content/pii:S1381116904005746/STRIPIN/image/gif/d92bbf06eec97f0fd5da39c435ca0549/si1.gif https://s3-eu-west-1.amazonaws.com/prod-ucs-content-store-eu-west/content/pii:S1381116904005746/STRIPIN/image/gif/d92bbf06eec97f0fd5da39c435ca0549/si1.gif si1 si1.gif gif 1410 22 295 ALTIMG 1-s2.0-S1381116904005746-sc1.sml https://s3.amazonaws.com/prod-ucs-content-store-us-east/content/pii:S1381116904005746/sc1/THUMBNAIL/image/gif/ad20ef909b5dd3fafbf60a243a6c196a/sc1.sml https://s3-eu-west-1.amazonaws.com/prod-ucs-content-store-eu-west/content/pii:S1381116904005746/sc1/THUMBNAIL/image/gif/ad20ef909b5dd3fafbf60a243a6c196a/sc1.sml sc1 sc1.sml sml 560 20 125 IMAGE-THUMBNAIL 1-s2.0-S1381116904005746-sc1.gif https://s3.amazonaws.com/prod-ucs-content-store-us-east/content/pii:S1381116904005746/sc1/DOWNSAMPLED/image/gif/32cbebb31fac1a710ec7b449626273e2/sc1.gif https://s3-eu-west-1.amazonaws.com/prod-ucs-content-store-eu-west/content/pii:S1381116904005746/sc1/DOWNSAMPLED/image/gif/32cbebb31fac1a710ec7b449626273e2/sc1.gif sc1 sc1.gif gif 1634 46 287 IMAGE-DOWNSAMPLED 1-s2.0-S1381116904005746-sc2.sml https://s3.amazonaws.com/prod-ucs-content-store-us-east/content/pii:S1381116904005746/sc2/THUMBNAIL/image/gif/8d0a47d71ec91c529321d53b76ea680f/sc2.sml https://s3-eu-west-1.amazonaws.com/prod-ucs-content-store-eu-west/content/pii:S1381116904005746/sc2/THUMBNAIL/image/gif/8d0a47d71ec91c529321d53b76ea680f/sc2.sml sc2 sc2.sml sml 1300 80 125 IMAGE-THUMBNAIL 1-s2.0-S1381116904005746-sc2.gif https://s3.amazonaws.com/prod-ucs-content-store-us-east/content/pii:S1381116904005746/sc2/DOWNSAMPLED/image/gif/278469b2ac452e19036d91abe576fe19/sc2.gif https://s3-eu-west-1.amazonaws.com/prod-ucs-content-store-eu-west/content/pii:S1381116904005746/sc2/DOWNSAMPLED/image/gif/278469b2ac452e19036d91abe576fe19/sc2.gif sc2 sc2.gif gif 6527 239 374 IMAGE-DOWNSAMPLED 1-s2.0-S1381116904005746-fx3.sml https://s3.amazonaws.com/prod-ucs-content-store-us-east/content/pii:S1381116904005746/fx3/THUMBNAIL/image/gif/e21b42558cdc855fd53ea845e602801b/fx3.sml https://s3-eu-west-1.amazonaws.com/prod-ucs-content-store-eu-west/content/pii:S1381116904005746/fx3/THUMBNAIL/image/gif/e21b42558cdc855fd53ea845e602801b/fx3.sml fx3 fx3.sml sml 942 49 125 IMAGE-THUMBNAIL 1-s2.0-S1381116904005746-fx3.gif https://s3.amazonaws.com/prod-ucs-content-store-us-east/content/pii:S1381116904005746/fx3/DOWNSAMPLED/image/gif/5029721b8abce1a1462fcacb97b8593d/fx3.gif https://s3-eu-west-1.amazonaws.com/prod-ucs-content-store-eu-west/content/pii:S1381116904005746/fx3/DOWNSAMPLED/image/gif/5029721b8abce1a1462fcacb97b8593d/fx3.gif fx3 fx3.gif gif 650 34 87 IMAGE-DOWNSAMPLED 1-s2.0-S1381116904005746-fx5.sml https://s3.amazonaws.com/prod-ucs-content-store-us-east/content/pii:S1381116904005746/fx5/THUMBNAIL/image/gif/29c17ce3e8c298d8e80c61546ceaffce/fx5.sml https://s3-eu-west-1.amazonaws.com/prod-ucs-content-store-eu-west/content/pii:S1381116904005746/fx5/THUMBNAIL/image/gif/29c17ce3e8c298d8e80c61546ceaffce/fx5.sml fx5 fx5.sml sml 1354 89 125 IMAGE-THUMBNAIL 1-s2.0-S1381116904005746-fx5.gif https://s3.amazonaws.com/prod-ucs-content-store-us-east/content/pii:S1381116904005746/fx5/DOWNSAMPLED/image/gif/e6b8b25f89d88563285117751d38b35e/fx5.gif https://s3-eu-west-1.amazonaws.com/prod-ucs-content-store-eu-west/content/pii:S1381116904005746/fx5/DOWNSAMPLED/image/gif/e6b8b25f89d88563285117751d38b35e/fx5.gif fx5 fx5.gif gif 933 61 86 IMAGE-DOWNSAMPLED 1-s2.0-S1381116904005746-fx10.sml https://s3.amazonaws.com/prod-ucs-content-store-us-east/content/pii:S1381116904005746/fx10/THUMBNAIL/image/gif/98849c5ff4c5a825a40226df09f43d9b/fx10.sml https://s3-eu-west-1.amazonaws.com/prod-ucs-content-store-eu-west/content/pii:S1381116904005746/fx10/THUMBNAIL/image/gif/98849c5ff4c5a825a40226df09f43d9b/fx10.sml fx10 fx10.sml sml 1003 48 125 IMAGE-THUMBNAIL 1-s2.0-S1381116904005746-fx10.gif https://s3.amazonaws.com/prod-ucs-content-store-us-east/content/pii:S1381116904005746/fx10/DOWNSAMPLED/image/gif/edc8e9addadc1513e0877f381260e357/fx10.gif https://s3-eu-west-1.amazonaws.com/prod-ucs-content-store-eu-west/content/pii:S1381116904005746/fx10/DOWNSAMPLED/image/gif/edc8e9addadc1513e0877f381260e357/fx10.gif fx10 fx10.gif gif 1187 57 147 IMAGE-DOWNSAMPLED 1-s2.0-S1381116904005746-fx6.sml https://s3.amazonaws.com/prod-ucs-content-store-us-east/content/pii:S1381116904005746/fx6/THUMBNAIL/image/gif/0b775ff4345570a05a88cdccee8ffb3d/fx6.sml https://s3-eu-west-1.amazonaws.com/prod-ucs-content-store-eu-west/content/pii:S1381116904005746/fx6/THUMBNAIL/image/gif/0b775ff4345570a05a88cdccee8ffb3d/fx6.sml fx6 fx6.sml sml 1063 64 125 IMAGE-THUMBNAIL 1-s2.0-S1381116904005746-fx6.gif https://s3.amazonaws.com/prod-ucs-content-store-us-east/content/pii:S1381116904005746/fx6/DOWNSAMPLED/image/gif/b81f744a8ef6f699846d4bd692957f31/fx6.gif https://s3-eu-west-1.amazonaws.com/prod-ucs-content-store-eu-west/content/pii:S1381116904005746/fx6/DOWNSAMPLED/image/gif/b81f744a8ef6f699846d4bd692957f31/fx6.gif fx6 fx6.gif gif 600 36 70 IMAGE-DOWNSAMPLED 1-s2.0-S1381116904005746-fx11.sml https://s3.amazonaws.com/prod-ucs-content-store-us-east/content/pii:S1381116904005746/fx11/THUMBNAIL/image/gif/564b1d82c560cedb8ee5b477c4903bd0/fx11.sml https://s3-eu-west-1.amazonaws.com/prod-ucs-content-store-eu-west/content/pii:S1381116904005746/fx11/THUMBNAIL/image/gif/564b1d82c560cedb8ee5b477c4903bd0/fx11.sml fx11 fx11.sml sml 898 31 125 IMAGE-THUMBNAIL 1-s2.0-S1381116904005746-fx11.gif https://s3.amazonaws.com/prod-ucs-content-store-us-east/content/pii:S1381116904005746/fx11/DOWNSAMPLED/image/gif/291affb18bc892f113edef6fbfe309b4/fx11.gif https://s3-eu-west-1.amazonaws.com/prod-ucs-content-store-eu-west/content/pii:S1381116904005746/fx11/DOWNSAMPLED/image/gif/291affb18bc892f113edef6fbfe309b4/fx11.gif fx11 fx11.gif gif 1008 36 147 IMAGE-DOWNSAMPLED 1-s2.0-S1381116904005746-fx7.sml https://s3.amazonaws.com/prod-ucs-content-store-us-east/content/pii:S1381116904005746/fx7/THUMBNAIL/image/gif/ae3cf25ab5672dbf781aae6530ad0c46/fx7.sml https://s3-eu-west-1.amazonaws.com/prod-ucs-content-store-eu-west/content/pii:S1381116904005746/fx7/THUMBNAIL/image/gif/ae3cf25ab5672dbf781aae6530ad0c46/fx7.sml fx7 fx7.sml sml 806 64 125 IMAGE-THUMBNAIL 1-s2.0-S1381116904005746-fx7.gif https://s3.amazonaws.com/prod-ucs-content-store-us-east/content/pii:S1381116904005746/fx7/DOWNSAMPLED/image/gif/7d20ea2d27bcbcea59c61ce5c24cf43e/fx7.gif https://s3-eu-west-1.amazonaws.com/prod-ucs-content-store-eu-west/content/pii:S1381116904005746/fx7/DOWNSAMPLED/image/gif/7d20ea2d27bcbcea59c61ce5c24cf43e/fx7.gif fx7 fx7.gif gif 395 33 64 IMAGE-DOWNSAMPLED 1-s2.0-S1381116904005746-fx12.sml https://s3.amazonaws.com/prod-ucs-content-store-us-east/content/pii:S1381116904005746/fx12/THUMBNAIL/image/gif/44369cbb64022a6ba7af2b4f3d4b9277/fx12.sml https://s3-eu-west-1.amazonaws.com/prod-ucs-content-store-eu-west/content/pii:S1381116904005746/fx12/THUMBNAIL/image/gif/44369cbb64022a6ba7af2b4f3d4b9277/fx12.sml fx12 fx12.sml sml 785 31 125 IMAGE-THUMBNAIL 1-s2.0-S1381116904005746-fx12.gif https://s3.amazonaws.com/prod-ucs-content-store-us-east/content/pii:S1381116904005746/fx12/DOWNSAMPLED/image/gif/daeef49914c3d7ad0e7a195d3105b967/fx12.gif https://s3-eu-west-1.amazonaws.com/prod-ucs-content-store-eu-west/content/pii:S1381116904005746/fx12/DOWNSAMPLED/image/gif/daeef49914c3d7ad0e7a195d3105b967/fx12.gif fx12 fx12.gif gif 867 36 146 IMAGE-DOWNSAMPLED 1-s2.0-S1381116904005746-fx8.sml https://s3.amazonaws.com/prod-ucs-content-store-us-east/content/pii:S1381116904005746/fx8/THUMBNAIL/image/gif/a165ac2d89969c313f9619bce505c850/fx8.sml https://s3-eu-west-1.amazonaws.com/prod-ucs-content-store-eu-west/content/pii:S1381116904005746/fx8/THUMBNAIL/image/gif/a165ac2d89969c313f9619bce505c850/fx8.sml fx8 fx8.sml sml 889 75 125 IMAGE-THUMBNAIL 1-s2.0-S1381116904005746-fx8.gif https://s3.amazonaws.com/prod-ucs-content-store-us-east/content/pii:S1381116904005746/fx8/DOWNSAMPLED/image/gif/101ddbb2cff486b88479f5f81335452b/fx8.gif https://s3-eu-west-1.amazonaws.com/prod-ucs-content-store-eu-west/content/pii:S1381116904005746/fx8/DOWNSAMPLED/image/gif/101ddbb2cff486b88479f5f81335452b/fx8.gif fx8 fx8.gif gif 392 35 58 IMAGE-DOWNSAMPLED 1-s2.0-S1381116904005746-fx13.sml https://s3.amazonaws.com/prod-ucs-content-store-us-east/content/pii:S1381116904005746/fx13/THUMBNAIL/image/gif/98973c2c86124a8c0d783bf8fbd1947d/fx13.sml https://s3-eu-west-1.amazonaws.com/prod-ucs-content-store-eu-west/content/pii:S1381116904005746/fx13/THUMBNAIL/image/gif/98973c2c86124a8c0d783bf8fbd1947d/fx13.sml fx13 fx13.sml sml 835 32 125 IMAGE-THUMBNAIL 1-s2.0-S1381116904005746-fx13.gif https://s3.amazonaws.com/prod-ucs-content-store-us-east/content/pii:S1381116904005746/fx13/DOWNSAMPLED/image/gif/0003216baafbb08bc6f24af398a5950a/fx13.gif https://s3-eu-west-1.amazonaws.com/prod-ucs-content-store-eu-west/content/pii:S1381116904005746/fx13/DOWNSAMPLED/image/gif/0003216baafbb08bc6f24af398a5950a/fx13.gif fx13 fx13.gif gif 811 35 135 IMAGE-DOWNSAMPLED 1-s2.0-S1381116904005746-fx4.sml https://s3.amazonaws.com/prod-ucs-content-store-us-east/content/pii:S1381116904005746/fx4/THUMBNAIL/image/gif/32523ce33312b0d599183933ac587ba8/fx4.sml https://s3-eu-west-1.amazonaws.com/prod-ucs-content-store-eu-west/content/pii:S1381116904005746/fx4/THUMBNAIL/image/gif/32523ce33312b0d599183933ac587ba8/fx4.sml fx4 fx4.sml sml 968 53 125 IMAGE-THUMBNAIL 1-s2.0-S1381116904005746-fx4.gif https://s3.amazonaws.com/prod-ucs-content-store-us-east/content/pii:S1381116904005746/fx4/DOWNSAMPLED/image/gif/1b380793c1966ae9a4d2f2a4ecb4f309/fx4.gif https://s3-eu-west-1.amazonaws.com/prod-ucs-content-store-eu-west/content/pii:S1381116904005746/fx4/DOWNSAMPLED/image/gif/1b380793c1966ae9a4d2f2a4ecb4f309/fx4.gif fx4 fx4.gif gif 632 35 83 IMAGE-DOWNSAMPLED 1-s2.0-S1381116904005746-fx9.sml https://s3.amazonaws.com/prod-ucs-content-store-us-east/content/pii:S1381116904005746/fx9/THUMBNAIL/image/gif/3ae36c87d0e1d98e02c9610aad2d0d35/fx9.sml https://s3-eu-west-1.amazonaws.com/prod-ucs-content-store-eu-west/content/pii:S1381116904005746/fx9/THUMBNAIL/image/gif/3ae36c87d0e1d98e02c9610aad2d0d35/fx9.sml fx9 fx9.sml sml 1364 88 125 IMAGE-THUMBNAIL 1-s2.0-S1381116904005746-fx9.gif https://s3.amazonaws.com/prod-ucs-content-store-us-east/content/pii:S1381116904005746/fx9/DOWNSAMPLED/image/gif/cbcd984c6130368708e4ed8ea5e28413/fx9.gif https://s3-eu-west-1.amazonaws.com/prod-ucs-content-store-eu-west/content/pii:S1381116904005746/fx9/DOWNSAMPLED/image/gif/cbcd984c6130368708e4ed8ea5e28413/fx9.gif fx9 fx9.gif gif 768 53 75 IMAGE-DOWNSAMPLED 1-s2.0-S1381116904005746-fx14.sml https://s3.amazonaws.com/prod-ucs-content-store-us-east/content/pii:S1381116904005746/fx14/THUMBNAIL/image/gif/955f192e6602be82f302c798235df301/fx14.sml https://s3-eu-west-1.amazonaws.com/prod-ucs-content-store-eu-west/content/pii:S1381116904005746/fx14/THUMBNAIL/image/gif/955f192e6602be82f302c798235df301/fx14.sml fx14 fx14.sml sml 1021 50 125 IMAGE-THUMBNAIL 1-s2.0-S1381116904005746-fx14.gif https://s3.amazonaws.com/prod-ucs-content-store-us-east/content/pii:S1381116904005746/fx14/DOWNSAMPLED/image/gif/868948c5b110c5a12e6ddc8f839adb2e/fx14.gif https://s3-eu-west-1.amazonaws.com/prod-ucs-content-store-eu-west/content/pii:S1381116904005746/fx14/DOWNSAMPLED/image/gif/868948c5b110c5a12e6ddc8f839adb2e/fx14.gif fx14 fx14.gif gif 1204 59 147 IMAGE-DOWNSAMPLED 1-s2.0-S1381116904005746-fx1.sml https://s3.amazonaws.com/prod-ucs-content-store-us-east/content/pii:S1381116904005746/fx1/THUMBNAIL/image/gif/3bb531caa8e68603ff0c22ade9df3950/fx1.sml https://s3-eu-west-1.amazonaws.com/prod-ucs-content-store-eu-west/content/pii:S1381116904005746/fx1/THUMBNAIL/image/gif/3bb531caa8e68603ff0c22ade9df3950/fx1.sml fx1 true fx1.sml sml 499 20 125 IMAGE-THUMBNAIL 1-s2.0-S1381116904005746-fx1.gif https://s3.amazonaws.com/prod-ucs-content-store-us-east/content/pii:S1381116904005746/fx1/DOWNSAMPLED/image/gif/c62403a1317ff7b7362b199605370e26/fx1.gif https://s3-eu-west-1.amazonaws.com/prod-ucs-content-store-eu-west/content/pii:S1381116904005746/fx1/DOWNSAMPLED/image/gif/c62403a1317ff7b7362b199605370e26/fx1.gif fx1 true fx1.gif gif 1842 53 337 IMAGE-DOWNSAMPLED 1-s2.0-S1381116904005746-fx2.sml https://s3.amazonaws.com/prod-ucs-content-store-us-east/content/pii:S1381116904005746/fx2/THUMBNAIL/image/gif/e1e8c8b773922a3583d44b7be12a3864/fx2.sml https://s3-eu-west-1.amazonaws.com/prod-ucs-content-store-eu-west/content/pii:S1381116904005746/fx2/THUMBNAIL/image/gif/e1e8c8b773922a3583d44b7be12a3864/fx2.sml fx2 fx2.sml sml 857 93 81 IMAGE-THUMBNAIL 1-s2.0-S1381116904005746-fx2.gif https://s3.amazonaws.com/prod-ucs-content-store-us-east/content/pii:S1381116904005746/fx2/DOWNSAMPLED/image/gif/826a3214d83fdfc9d70232aa3b2b4854/fx2.gif https://s3-eu-west-1.amazonaws.com/prod-ucs-content-store-eu-west/content/pii:S1381116904005746/fx2/DOWNSAMPLED/image/gif/826a3214d83fdfc9d70232aa3b2b4854/fx2.gif fx2 fx2.gif gif 1238 135 117 IMAGE-DOWNSAMPLED MOLCAA 4824 S1381-1169(04)00574-6 10.1016/j.molcata.2004.07.024 Elsevier B.V. Scheme 1 Scheme 2 Table 1 Selected analytical data for the new palladium–carbene complexes (2,3) Complex Isolated yield (%) mp (°C) ν (NCN) (cm−1) 13C NMR Pd–Ccarb. δ (ppm) 2a 89 222.0–222.5 1463 199.1 2b 83 299.5–300.0 1448 198.9 3a 76 229.0–229.5 1477 183.4 3b 85 295.0–295.5 1478 182.7 3c 87 250.0–251.0 1475 187.6 Table 2 Amination of aryl chlorides with palladium–carbene complexes a Entry Catalyst Arylchlorides Amines Products Yield (%) b c 1 2a 94 2 2b ″ ″ ″ 91 3 3a ″ ″ ″ 95 4 3b ″ ″ ″ 90 5 3c ″ ″ ″ 91 6 2b 83 7 3a ″ ″ ″ 89 8 3b ″ ″ ″ 92 9 3c ″ ″ ″ 79 10 2a 94 11 3a ″ ″ ″ 89 12 3b ″ ″ ″ 87 13 3c ″ ″ ″ 84 14 2a 92 15 2b ″ ″ ″ 94 16 3a ″ ″ ″ 89 17 3b ″ ″ ″ 83 18 3c ″ ″ ″ 86 19 2a 86 20 2b ″ ″ ″ 76 21 3b ″ ″ ″ 74 a Reaction conditions: 1.0mmol of p-R-C6H4Cl, 1.2mmol of primary amines, 1.2mmol KOt Bu, 1mol% Pd catalyst, ionic liquid (1.5mL). b Isolated yield (purity of yield checked by NMR). c All reactions were monitored by TLC. Short communication Synthesis of novel palladium–carbene complexes as efficient catalysts for amination of aryl chlorides in ionic liquid İsmail Özdemir a * Serpil Demir a Yetkin Gök a Engin Çetinkaya b Bekir Çetinkaya b a Chemistry Department, Faculty Science and Letters, Inönü University, 44069 Malatya, Türkiye b Department of Chemistry, Ege University, 35100 Bornova-İzmir, Türkiye * Corresponding author. Tel.: +90 422 3410010; fax: +90 422 3410037. The synthesis and characterization of [PdCl2(N-heterocyclic carbene)2] (2, 3), an air and moisture-stable complexes are reported. Amination of aryl halides in 1-methy-3-butyl-imidazolidinium tetrafluoroborate in the presence of palladium–carbene complexes as catalysts are described. Aryl chlorides undergo smooth nucleophilic substitution reactions with primary amines in ionic liquid to afford the corresponding arylamines in excellent yields under mild conditions. Graphical abstract The synthesis and characterization of [PdCl2(carbene)2] complexes are reported and their used as catalysts for amination of aryl halides in ionic liquid. Keywords Amination N-heterocyclic carbene Palladium complexes Imidazolidinylidine Ionic liquid 1 Introduction The advancement of modern organic synthesis necessitates the wide use of catalytic reactions, which make it possible to simplify the synthesis of different target molecules, avoiding the use of toxic reagents and considerably lowering the number of steps and thus minimizing the operation costs. One of the biggest challenges for modern organic chemists is the employment of the most efficient catalytic method for a specific part in a synthesis strategy. Significant improvements of catalyst performance have recently been brought benefits to fine chemistry via simple substitution of a phosphine ligand by a nucleophilic heterocyclic diaminocarbene, such as an imidazol-2-ylidene ligand. Interested in N-heterocyclic carbene (NHC) ligands has continued to grow given the beneficial effects they often have on homogeneous catalysis. Nucleophilic carbenes have been shown to behave as phosphine mimics [1] and N-heterocyclic carbenes of type 1,3-imidazolinylidene are now currently used in transition metal chemistry as ancillary ligands [2]. This is largely due to their recently revealed ability to create specific catalytic activity [3,4] and attempts are currently made to modify the coordination sphere of the metal with the hope to find an even better application profile. Illustrative examples are found in various catalytic reactions with palladium catalysts in cross-coupling or Heck and Suzuki reactions [5,6] and ruthenium catalysts for the formation of furans, cyclopropanation [7,8] alkene metathesis [9,10] and cycloisomerisation [11]. Nucleophilic aromatic substitution has become a very useful and diverse synthetic route for introducing amine functionality onto a benzene ring [12]. Classical methods for the synthesis of arylamines typically require a large excess of base, highly polar solvents such as DMF, DMSO at high temperatures with highly activated aryl halides [13] and under high pressure conditions [14]. The Buchwald–Hartwig amination of aryl halides has emerged as a powerful technique for the formation of N-substituted anilines (Scheme 1 ) [15]. A major recent focus in coupling chemistry has been on the development of catalysts that are able to active aryl chloride substrates since these tend to be cheaper and more readily available than their bromide and iodide counterparts, factors that make them particularly relevant to the industrial sector. Unfortunately the comparatively high CCl bond strength makes their activation by oxidative-addition comparatively difficult [16]. While there are now many reports on the use of aryl chlorides in amination [17] in most cases the catalysts employed need to be used in relatively high loading. Therefore the advantages associated with the use of aryl chlorides may be negated by the high cost of the catalyst systems and the need to remove palladium residues from the products down to the ppm level for use in fine chemicals. In recent years, ionic liquids have emerged as a set of green solvents with unique properties such as tunable polarity, high thermal stability, and immiscibility with a number of organic solvents, negligible vapor pressure and recyclability [18]. Their high polarity and the ability to solubilise both inorganic and organic compounds can result in enhanced rates of chemical processes and can provide higher selectivities compared to conventional solvents. Accordingly they are emerging as novel replacements for volatile organic solvents in organic synthesis. They are particularly promising, as solvents for various reactions [19,20]. Moreover, ionic liquids are simple and inexpensive to prepare and easy to recycle and their properties can be fine-tuned by changing the anion or alkyl group attached to cation. The ionic liquids could be an alternative to organic solvents for catalyzed synthesis in environmentally-friendly reaction media because of their negligible vapour pressure and excellent solubility properties and chemical and thermal stabilities [18]. But, their intriguing aspect is the possibility to alter their physical and chemical properties by varying their structure, with respect to the choice of organic cations (e.g. tetraalkylammonium, 1-alkyl-3-methylimidazolinium cations) and anions (e.g. BF4 −, PF6 −, Tf2N− anions), and the alkyl substituents in the cation. Thus, ionic liquid have been described as ‘designer solvents’ [21]. In view of the emerging importance of imidazolidinium based ionic liquid, 1, as novel reaction media, we wish to explore the use of ionic liquids as promoters and recyclable solvents systems for the synthesis of arylamines under mild conditions. The catalyst system was chosen owing to (i) the high activity of molecular catalyst in the homogeneously catalyzed conversation of deactivated aryl chlorides, (ii) its stability under the reaction conditions commonly employed for the amination of aryl chlorides. 2 Experimental Manipulations were prepared with standard Schlenk techniques under an inert atmosphere of nitrogen with previously dried solvents. The 1,3-bis(alkyl)imidazolidinium and benzimidazlonium chlorides was prepared according to known methods [22]. Infrared spectra were recorded as KBr pellets in the range 400–4000cm−1 on a ATI UNICAM 2000 spectrometer. 1H NMR (300MHz) and 13C NMR (75.5MHz) were recorded on a Bruker AM 300 WB FT spectrometer with chemical shifts referenced to residual solvent CDCl3. Microanalyses were performed by the TÜBITAK analyses center. 2.1 Preparations 1-butyl-3-methyl-4,5-dihydroimidazolium iodide The 1-butyl-3-methyl-4,5-dihydroimidazolium iodide was prepared from 1-butylimidazolidine (22.30g, 176.90mmol) and methyl iodide (25.54g, 179.90mmol) at ambient temperature in toluene(120mL). The ionic liquid layer was separated by the toluene in a separatory funnel, washed twice with diethylether and dried under vacuum. Yield 47.2g (99%). The product is liquid at room temperature. 1H NMR (δ, CDCl3): 0.80 [t, J 6.9, 3H, NCH2CH2CH2CH 3]; 1.38 [m, 2H, NCH2CH2CH 2CH3]; 1.92 [quin., J 7.6Hz, 2H, NCH2CH 2CH2CH3]; 3.50 [t, J 7.5Hz, 2H, NCH 2CH2CH2CH3]; 3.32 [s, 3H, NCH3]; 3.01 and 3.19 [t, J 5.1Hz, 4H, NCH 2CH 2N]; 9.07 [s, 1H, NCHN]. The ionic liquid 1 were synthesized according to literature [23]. The novel 1-butyl-3-methyl-4,5-dihydroimidazolium tetrafluoroborate was obtained from 1-butyl-3-methyl-4,5-dihydroimidazolium iodide (45g, 167.82mmol) with NH4BF4 (17.60g, 167.87mmol) in anhydrous methylene chloride. Yield 36.35g (95%), d = 1.315g/mL, This ionic liquid soluble in methanol, water, chloroform, dimethylformamide. 1H NMR (δ, CDCl3): 0.82 [t, J 6.9Hz, 3H, CH2CH2CH2CH 3]; 1.39 [m, 2H, NCH2CH2CH 2CH3]; 1.93 [quin., J 7.6Hz, 2H, NCH2CH 2CH2CH3]; 3.63 [t, J 7.5Hz, 2H, NCH 2CH2CH2CH3]; 3.38 [s, 3H, NCH 3]; 3.03 and 3.21 [t, J 5.1Hz, 4H, NCH 2CH 2N]; 9.61 [s, 1H, 2-CH]. 13C {H} NMR (δ, CDCl3): 156.8 [NCHN]; 45.8, 46.5 [NCH2 CH2N]; 47.7 [NCH2CH2CH2CH3]; 31.4 [NCH2 CH2CH2CH3]; 19.9 [NCH2CH2 CH2CH3]; 13.7 [NCH2CH2CH2 CH3]; 33.2 [NCH3]. Anal. cal. for C8H17N2BF4; C: 42.14, H: 7.51, N: 12.28; found C: 42.22, H: 7.69, N: 12.45. ν (NCN) = 1648cm−1. 2.2 General procedure for the preparation of the palladium–carbene complex, 2, 3 A stirred DMSO solution (10mL) of 1,3-bis(alkyl)imidazolidinium and benzimidazolinium chloride (2mmol) and Pd(OAc)2 (1mmol) was heated 60°C for 3h and then at 110°C for a further 2h, during which time the reaction solution from being initially orange. The remaining DMSO was then removed in vacuo to give a pale yellow solids, 2, 3. Recrystallization from CH2Cl2/Et2O. The crystals were filtered, washed with diethyl ether (3 × 10ml) and dried under vacuum. 2.3 PdCl2[ CN { C H 2 C 6 H 2 ( O M e ) 3 − 3 , 4 , 5 } C H 2 C H 2 N ⎴ {CH2C6H2(OMe)3-3,4,5}2] (2a) Yield 0.92g (89%) 1H NMR (δ, CDCl3): 3.32 [s, 8H, NCH 2CH 2N]; 6.76 [s, 8H, CH2C6 H 2(OMe)3-3,4,5]; 5.11 [s, 8H, CH 2C6H2(OMe)3-3,4,5]; 3.74 and 3.76 [s, 36H, CH2C6H2(OMe)3-3,4,5]. 13C {H} NMR (δ, CDCl3): 199.1[C carb.]; 48.5 [NCH2 CH2N]; 106.7, 132.8, 138.7 and 154.7 [CH2 C 6H2(OMe)3-3,4,5]; 54.9 [CH2C6H2(OMe)3-3,4,5]; 57.1 and 61.5 [CH2C6H2(OMe)3-3,4,5]. Anal. cal. for C46H60N4O12PdCl2; C: 53.21, H: 5.82, N: 5.39; found C: 53.27, H: 5.79, N: 5.44. ν (NCN) = 1463cm−1. 2.4 PdCl2 [ C N { C H 2 C 6 H 2 M e 3 - 2 , 4 , 6 } C H 2 C H 2 N ⎴ {CH2C6H2Me3-2,4,6}2] (2b) Yield 0.70g (83%) 1H NMR (δ, CDCl3): 2.99 [s, 8H, NCH 2CH 2N)]; 6.76 [s, 8H, CH2C6 H 2(Me)3-2,4,6]; 5.33 [s, 8H, CH 2C6H2(Me)3-2,4,6]; 2.16 and 2.38 [s, 36H, CH2C6H2(Me)3-2,4,6]. 13C {H} NMR (δ, CDCl3): 198.9[C carb.]; 47.5 [NCH2 CH2N]; 129.3, 129.6, 137.9 and 138.8 [CH2 C 6H2(Me)3-2,4,6]; 48.8 [CH2C6H2(Me)3-2,4,6]; 21.2 and 21.3 [CH2C6H2(Me)3-2,4,6]. Anal. cal. for C46H60N4PdCl2; C: 65.28, H: 7.14, N: 6.62; found C: 65.33, H: 7.16, N: 6.67. ν (NCN) = 1448cm−1. 2.5 PdCl2 [ C N { C H 2 C H 2 O M e } C 6 H 4 N ⎴ {CH2CH2OMe}2] (3a) Yield 0.49g (76%) 1H NMR (δ, CDCl3): 7.30 and 7.56 [m, 8H, NC6 H 4N]; 4.22 [t, J 5.9Hz, 8H, NCH 2CH2OCH3]; 5.06 [t, J 5.9Hz, 8H, NCH2CH 2OCH3]; 3.41 [s, 12H, NCH2CH2OCH 3]. 13C{H} NMR (δ, CDCl3): 183.4 [C carb.]; 112.1, 124.1 and 136.2 [NC 6H4N]; 48.8 [NCH2CH2OCH3]; 72.8 [NCH2 CH2OCH3]; 59.9 [NCH2CH2OCH3]. Anal. cal. for C26H36N4O4PdCl2; C: 48.35; H: 5.62; N: 8.67; found C: 48.37; H: 5.65; N: 8.70. ν (NCN) = 1477cm−1. 2.6 PdCl2 [ C N { C H 2 C H 2 P h } C 6 H 4 N ⎴ {CH2CH2Ph}2] (3b) Yield 0.70g (85%) 1H NMR (δ, CDCl3): 7.08 and 7.19 [m, 8H, NC6 H 4N]; 3.50 [dd, J 6.78Hz, 8H, NCH 2CH2C6H5]; 5.05 [dd, J 6.78Hz, 8H, NCH2CH 2C6H5]; 6.94 [m, 20H, NCH2CH2C6 H 5]. 13C{H} NMR (δ, CDCl3): 182.7[C carb.]; 111.3, 123.7, 135.4 and 135.5 [NC 6H4N]; 37.01 [NCH2CH2C6H5]; 50.4 [NCH2 CH2C6H5]; 123.6, 127.8, 129.7, 130.1, 139.7 and 148.0 [NCH2CH2 C 6H5]. Anal. cal. for C46H44N4PdCl2; C: 66.55; H: 5.34; N: 6.75; found C: 66.53; H: 5.36; N: 6.73. ν (NCN) = 1477cm−1. 2.7 PdCl2 [ C N { C H 2 C H 2 O M e } C 6 H 4 N ⎴ {CH2CH2Ph}2] (3c) Yield 0.64g (87%) 1H NMR (δ, CDCl3): 7.23 and 7.47 [m, 8H, NC6 H 4N]; 3.95 [m, 4H, NCH 2CH2OCH3]; 4.98 [m, 8H, NCH2CH 2OCH3 and NCH2CH 2C6H5]; 3.18 [s, 6H, NCH2CH2OCH 3]; 3.44 [m, 4H, NCH 2CH2C6H5]; 7.1 [m, 10H, NCH2CH2C6 H 5]. 13C{H} NMR (δ, CDCl3): 187.6[C carb.]; 116.9, 117.3, 128.8, 134.5, 134.6 and 134.8 [NC 6H4N]; 54.8 [NCH2CH2OCH3]; 77.31 [NCH2 CH2OCH3]; 64.6 [NCH2CH2OCH3]; 41.5 [NCH2CH2C6H5]; 67.4 [NCH2 CH2C6H5]; 115.9, 132.6, 134.6, 140.07, 144.2 and 144.4 [NCH2CH2 C 6H5]. Anal. cal. for C36H40N4O2PdCl2; C: 58.58; H: 5.46; N: 7.59; found C: 58.62; H: 5.40; N: 7.63. ν (NCN) = 1475cm−1. 2.8 General procedure for amination of aryl chlorides A mixture of aryl chlorides (1mmol), KOt Bu (1.2mmol) and primary amines (1.2mmol), palladium carbene (1mmol%) in 1-methyl-3-butyl-imidazolidinium tetrafluoroborate (1.5mL) was stirred at 50°C for 4h. After completion of reaction as indicated by TLC, the reaction mixture was washed with Et2O (3 × 15mL). The combined ether extracts were concentrated in vacuo and resulting product was directly charged onto a small silica gel column and eluted with a mixture of ethyl acetate: n-hexane (1:10) to afford pure arylamine. The ionic liquid is extracted with methylene dichloride and dried under vacuum to eliminate traces of the solvent and the rest of viscous ionic liquid was thoroughly washed with ether and reused in subsequent reactions without further purification. 3 Results and discussion The 1,3-bis(alkyl)imidazolidinium and benzimidazolinium chlorides was prepared according to known methods. The reaction of azolinium salts, with the Pd(OAc)2 complex proceeded smoothly was heated 60°C for 3h and then at 110°C for a further 2h, during which time the reaction give the PdCl2(1,3-dialkyl-imidazolinylidene)2, 2, or PdCl2(1,3-dialkyl-benzimidazolinylidene)2, complexes 3 as crystalline solids in 76–89% yields (Scheme 2 , Table 1 ). Complexes 2, 3, which are very stable in the solid state have been characterized by analytical and spectroscopic techniques (Table 1). Palladium complexes exhibit a characteristic ν (NCN) band (Table 1) typically at 1448–1477cm−1 [7,8,11]. 13C chemical shifts, which provide a useful diagnostic tool for metal carbene complexes, show that Ccarb is substantially deshielded. Values of δ(13Ccarb) are in the range 182–199ppm and are similar to those found in other carbene complexes. These new complexes show typical spectroscopic signatures which are in line with those recently reported for other PdCl2(N-heterocyclic carbene)2 complexes [24]. Recently, we have developed improved procedures Heck and Suzuki reactions of aryl chlorides making use of novel ligands 1,3-bis(2,4,6-trimethylbenzyl)imidazolium chloride [22], 1-alkylimidazoline, α-bis(imine) [25]. There is growing interest in room temperature ionic liquids as potential green solvents for a broad variety of solutes, ranging from weakly polar to polar ones. The melting points of ionic compounds depend on the nature of the cations and anions involved, with packing inefficiency being conductive to lower melting points. As a results, certain cations, such as the imidazolium and N,N′-dialkylimidazolium cations have been extensively studied [18,19]. The 1-butyl-3-methyl-4,5-dihydroimidazolinium tetrafluoroborate (1) is liquid at room temperature. We report here the amination of chloroarenes reaction performed in ionic liquid, 1, in the presence of palladium–carbene complexes. The coupling of activated and deactivated aryl halogenides and primary amines proceeds in high yields and quite rapidly even with a low catalyst loading. The treatment of 2,4,6-trimethylaniline with p-chloroanisole in 1-methyl-3-butyl-imidazolidinium tetrafluoroborate, 1, ionic liquid resulted in the formation of (p-methoxyphenyl)(2,4,6-trimethylphenyl)amine in 94% yield. As shown in Table 2 primary cyclic aliphatic and aromatic amines can be coupled to a variety of aryl chlorides. In general, good to excellent yields are obtained in the presence of 1mol% of palladium–carbene complexes (2 or 3) in ionic liquid at 50°C. This method is even effective with sterically hindered amine (Table 2, entry 1, 3, and 19). The experimental procedure is very simple and convenient and in addition, this method did not require any aqueous work-up thereby avoiding the generation of toxic waste. Lately, non-aqueous ionic liquids have been attracting attention for the application of many homogeneous reactions to biphasic systems. Therefore the imidazolium cation are largely the most widely investigated [18]. We think that palladium–carbene complexes dissociated in reaction medium giving rise to the reaction with 1-butyl-3-methyl-4,5-dihydroimidazolium tetrafluoroborate with KO t Bu and new formed carbene. And thus carbene reacted with the dissociated palladium and could form novel carbene complexes [26]. Since the products were weakly soluble in the ionic liquid, they were easily separated by simple extraction with ether. The rest of the viscous ionic liquid was thoroughly washed with ether and recycled in subsequent reactions. Second and third reactions using recovered ionic liquid afforded similar yields to those obtained in the first run. 4 Conclusion We report the synthesis and aryl amination reactivity of an air stable N-heterocyclic-palladium complexes (2, 3). Non-activated aryl chlorides react with sterically hindered amines in very good yields to give corresponding anilines. Also ionic liquid is proved to be a useful and novel reaction media for aromatic amination, avoiding the use of highly polar organic solvents such as DMSO or DMF and high temperature reaction conditions playing the dual role of solvent and promoter. The use of an easily accessible and recyclable ionic liquid makes this procedure convenient, economic and user friendly. Investigations focusing on the reactivity profile of 2 or 3 and related palladium complexes, their efficacy as catalysts in cross-coupling reactions are ongoing in our laboratories. Acknowledgements We thank to Inönü University Research Fund (BAP 2002/23), Technological and Scientific Research Council of Türkiye TÜBİTAK (TÜBITAK COST D17) for financial support of this work. References [1] B. Çetinkaya P.H. Dixneuf M.F. Lappert J. Chem. Soc., Dalton Trans. 1974 1827 M.F. Lappert J. Organomet. Chem. 358 1988 185 [2] D. Bourissou O. Guerret F.P. Gabbaï G. Bertrand Chem. Rev. 100 2000 39 [3] W.A. Herrmann Angew. Chem. Int. Ed. Engl. 41 2002 1290 [4] W.A. Herrmann N. Elison J. Fischer C. Köcher G.R.J. Artus Angew. Chem. Int. Ed. Engl. 34 1995 2371 T. Weskamp V.P.W. Böhm W.A. Herrmann J. Organomet. Chem. 585 1999 348 D.S. McGuinness N. Saendig B.F. Yates K.J. Cavell J. Am. Chem. Soc. 123 2001 4029 D.S. McGuinness K.J. Cavell K.F. Yates B.W. Skelton B.H. White J. Am. Chem. Soc. 123 2001 8317 [5] V.P.W. Böhm C.W.K. Gstöttmayr T. Weskamp W.A. Herrmann J. Organomet. Chem. 595 2000 186 C. Zhang J. Huang M.L. Trudell S.P. Nolan J. Org. Chem. 64 1999 3804 D.S. McGuinness K.J. Cavell Organometallics 19 2000 741 [6] C. Yang H.M. Lee S.P. Nolan Org. Lett. 3 2001 1511 [7] B. Çetinkaya İ. Özdemir C. Bruneau P.H. Dixneuf J. Mol. Catal. A 118 1997 L1 İ. Özdemir B. Yiğit B. Çetinkaya D. Ülkü M.N. Tahir C. Arıcı J. Organomet. Chem. 633 2001 27 B. Çetinkaya T. Seçkin N. Gürbüz İ. Özdemir J. Mol. Catal. A 184 2002 31 [8] B. Çetinkaya İ. Özdemir P.H. Dixeuf J. Organomet. Chem. 534 1997 153 [9] C.W. Bielowski R.H. Grubbs Angew. Chem. Int. Ed. Engl. 39 2000 2903 A.K. Chatterjee J.P. Morgan M. Scholl R.H. Grubbs J. Am. Chem. Soc. 122 2000 3783 S.B. Garber J.S. Kingsbury B.L. Gray A.H. Hoveyda J. Am. Chem. Soc. 122 2000 8168 T. Weskamp W.C. Chattenmann M. Spiegler W.A. Herrmann Angew. Chem. Int. Ed. Engl. 37 1998 2490 [10] S. Randt S. Gessler H. Wakamutsu S. Blechert Synlett 2001 430 S. Gessler R. Randl S. Blechert Tetrahedron Lett. 41 2000 9973 M. Schuster S. Blechert Angew. Chem. Int. Ed. Engl. 36 1997 2036 S.K. Armstrong J. Chem. Soc. Perkin Trans. 1 1998 371 T.M. Trnka R.H. Grubbs Acc. Chem. Res. 34 2001 18 T. Weskamp W.C. Schattenmann M. Spiegler W.A. Herrmann Angew. Chem. Int. Ed. Engl. 37 1998 2490 T. Weskamp F.J. Kohl W. Hieringer D. Gleich W.A. Herrmann Angew. Chem. Int. Ed. Engl. 38 1999 2416 T. Weskamp F.J. Kohl W.A. Herrmann J. Organomet. Chem. 582 1999 362 M. Scholl T.M. Trnka J.P. Morgan R.H. Grubbs Tetrahedron Lett. 40 1999 2247 [11] B. çetinkaya S. Demir İ. özdemir L. Toupet D. Sémeril C. Bruneau P.H. Dixneuf New J. Chem. 25 2001 519 B. çetinkaya S. Demir İ. Özdemir L. Toupet D. Sémeril C. Bruneau P.H. Dixneuf Chem. Eur. J. 9 2003 2323 [12] A.J. Belfield G.R. Brown Tetrahedron 55 1999 13285 C.G. Frost P. Mendonca J. Chem. Soc., Perkin Trans. 1 1998 2615 [13] Y.H. Cho J.C. Park Tetrahedron Lett. 38 1997 8331 G.R. Brown A.J. Foubister P.D. Ratcliffe Tetrahedron Lett. 40 1999 1219 [14] T. Ibata Y. Isogami J. Toyoda Chem. Lett. 1987 1187 H. Kotski H. Sakai T. Shinohara Synlett 2000 116 [15] J.P. Wolfe S. Wagaw J.-F. Marcoux S.L. Buchwald Acc. Chem. Res. 31 1998 805 J.F. Hartwig Angew. Chem. Int. Ed. Engl. 37 19982046 B.H. Yang S.L. Buchwald J. Organomet. Chem. 576 1999 125 [16] V.V. Grushin H. Alper Chem. Rev. 94 1994 1047 [17] M.S. Viciu R.M. Kissling E.D. Stevens S.P. Nolan Org. Lett. 4 2002 2229 G.Y. Li G. Zheng A.F. Noonan J. Org. Chem. 66 2001 8677 G.Y. Li Angew. Chem. Int. Ed. Engl. 40 2001 1513 J.P. Wolfe H. Tomori Y.P. Sadighi S.L. Buchwald J. Org. Chem. 65 2000 1158 S.R. Stauffer S. Lee J.P. Stambuli S.I. Hauck J.F. Hartwig Org. Lett. 2 2000 1423 J.F. Hartwig M. Kawatsura S.I. Hauk K.H. Shaughnessy L.M. Alcazar-Roman J. Org. Chem. 64 1999 5575 J.P. Wolfe S.L. Buchwald Angew. Chem. Int. Ed. Engl. 38 1999 2413 D.W. Old J.P. Wolfe S.L. Buchwald J. Am. Chem. Soc. 120 1998 9722 B.C. Hamann J.F. Hartwig J. Am. Chem. Soc. 120 1998 7369 [18] T. Welton Chem. Rev. 99 1999 2071 P. Wasserscheid W. Keim Angew. Chem. Int. Ed. Engl. 39 2000 3772 [19] R. Sheldon Chem. Commun. 2001 2399 C.M. Gordon Appl. Catal. A: Gen. 222 2001 101 [20] L. Magna Y. Chauvin G.P. Niccolai J.M. Basset Organometallics 22 2003 4418 A.C. Cole J.L. Jensen I. Ntai K.L.T. Tran K.J. Weaver D.C. Forbes J.H. Davis J. Am. Chem. Soc. 124 2002 5962 J. Peng Y. Deng Tetrahedron Lett. 42 2001 5917 [21] M. Freemantle Chem. Eng. News. 76 1998 32 [22] N. Gürbüz İ. Özdemir S. Demir B. Çetinkaya J. Mol. Catal. A 209 2004 23 [23] J.F. Dubreuil K. Bourahla M. Rahmouni J.P. Bazureau J. Hamelin Catal. Commun. 3 2002 185 [24] W.A. Herrmann M. Elison J. Fischer C. Köcher G.R.J. Artus Chem. Eur. J. 2 7 1996 772 A.M. Magill D.S. McGuinness K.J. Cavell G.J.P. Britovsek V.C. Gibson A.J.P. White D.J. Williams A.H. White B.W. Skelton J. Organomet. Chem. 617–618 2001 546 D.J. Nielsen K.J. Cavell B.W. Skelton A.H. White Inorg. Chim. Acta 327 2002 116 [25] İ. Özdemir S. Demir B. Çetinkaya J. Mol. Catal. A 208 2004 109 T. Seçkin S. Köytepe S. Demir İ. Özdemir B. Çetinkaya J. Inorg. Organometal. Polym. 13 4 2003 223 N. Gurbuz İ. Özdemir B. Çetinkaya T. Seçkin Appl. Organometal. Chem. 17 2003 776 [26] W.A. Herrmann C. Köcher Angew. Chem. Int. Ed. Engl. 36 1997 2162",
      "scopus-id": "5144232203",
      "coredata": {
        "eid": "1-s2.0-S1381116904005746",
        "dc:description": "The synthesis and characterization of [PdCl2(N-heterocyclic carbene)2] (2, 3), an air and moisture-stable complexes are reported. Amination of aryl halides in 1-methy-3-butyl-imidazolidinium tetrafluoroborate in the presence of palladium–carbene complexes as catalysts are described. Aryl chlorides undergo smooth nucleophilic substitution reactions with primary amines in ionic liquid to afford the corresponding arylamines in excellent yields under mild conditions.",
        "openArchiveArticle": "false",
        "prism:coverDate": "2004-11-15",
        "openaccessUserLicense": null,
        "prism:aggregationType": "Journal",
        "prism:url": "https://api.elsevier.com/content/article/pii/S1381116904005746",
        "dc:creator": [
          {
            "@_fa": "true",
            "$": "Özdemir, İsmail"
          },
          {
            "@_fa": "true",
            "$": "Demir, Serpil"
          },
          {
            "@_fa": "true",
            "$": "Gök, Yetkin"
          },
          {
            "@_fa": "true",
            "$": "Çetinkaya, Engin"
          },
          {
            "@_fa": "true",
            "$": "Çetinkaya, Bekir"
          }
        ],
        "link": [
          {
            "@_fa": "true",
            "@rel": "self",
            "@href": "https://api.elsevier.com/content/article/pii/S1381116904005746"
          },
          {
            "@_fa": "true",
            "@rel": "scidir",
            "@href": "https://www.sciencedirect.com/science/article/pii/S1381116904005746"
          }
        ],
        "dc:format": "application/json",
        "openaccessType": null,
        "pii": "S1381-1169(04)00574-6",
        "prism:volume": "222",
        "prism:publisher": "Elsevier B.V.",
        "dc:title": "Synthesis of novel palladium–carbene complexes as efficient catalysts for amination of aryl chlorides in ionic liquid",
        "prism:copyright": "Copyright © 2004 Elsevier B.V. All rights reserved.",
        "openaccess": "0",
        "prism:issn": "13811169",
        "prism:issueIdentifier": "1-2",
        "dcterms:subject": [
          {
            "@_fa": "true",
            "$": "Amination"
          },
          {
            "@_fa": "true",
            "$": "N-heterocyclic carbene"
          },
          {
            "@_fa": "true",
            "$": "Palladium complexes"
          },
          {
            "@_fa": "true",
            "$": "Imidazolidinylidine"
          },
          {
            "@_fa": "true",
            "$": "Ionic liquid"
          }
        ],
        "openaccessArticle": "false",
        "prism:publicationName": "Journal of Molecular Catalysis A: Chemical",
        "prism:number": "1-2",
        "openaccessSponsorType": null,
        "prism:pageRange": "97-102",
        "prism:endingPage": "102",
        "pubType": "sco",
        "prism:coverDisplayDate": "15 November 2004",
        "prism:doi": "10.1016/j.molcata.2004.07.024",
        "prism:startingPage": "97",
        "dc:identifier": "doi:10.1016/j.molcata.2004.07.024",
        "openaccessSponsorName": null
      },
      "objects": {
        "object": [
          {
            "@category": "thumbnail",
            "@height": "21",
            "@width": "192",
            "@_fa": "true",
            "$": "https://api.elsevier.com/content/object/eid/1-s2.0-S1381116904005746-si5.gif?httpAccept=%2A%2F%2A",
            "@multimediatype": "GIF image file",
            "@type": "ALTIMG",
            "@size": "1005",
            "@ref": "si5",
            "@mimetype": "image/gif"
          },
          {
            "@category": "thumbnail",
            "@height": "21",
            "@width": "176",
            "@_fa": "true",
            "$": "https://api.elsevier.com/content/object/eid/1-s2.0-S1381116904005746-si4.gif?httpAccept=%2A%2F%2A",
            "@multimediatype": "GIF image file",
            "@type": "ALTIMG",
            "@size": "936",
            "@ref": "si4",
            "@mimetype": "image/gif"
          },
          {
            "@category": "thumbnail",
            "@height": "21",
            "@width": "192",
            "@_fa": "true",
            "$": "https://api.elsevier.com/content/object/eid/1-s2.0-S1381116904005746-si3.gif?httpAccept=%2A%2F%2A",
            "@multimediatype": "GIF image file",
            "@type": "ALTIMG",
            "@size": "1005",
            "@ref": "si3",
            "@mimetype": "image/gif"
          },
          {
            "@category": "thumbnail",
            "@height": "21",
            "@width": "272",
            "@_fa": "true",
            "$": "https://api.elsevier.com/content/object/eid/1-s2.0-S1381116904005746-si2.gif?httpAccept=%2A%2F%2A",
            "@multimediatype": "GIF image file",
            "@type": "ALTIMG",
            "@size": "1217",
            "@ref": "si2",
            "@mimetype": "image/gif"
          },
          {
            "@category": "thumbnail",
            "@height": "22",
            "@width": "295",
            "@_fa": "true",
            "$": "https://api.elsevier.com/content/object/eid/1-s2.0-S1381116904005746-si1.gif?httpAccept=%2A%2F%2A",
            "@multimediatype": "GIF image file",
            "@type": "ALTIMG",
            "@size": "1410",
            "@ref": "si1",
            "@mimetype": "image/gif"
          },
          {
            "@category": "thumbnail",
            "@height": "20",
            "@width": "125",
            "@_fa": "true",
            "$": "https://api.elsevier.com/content/object/eid/1-s2.0-S1381116904005746-sc1.sml?httpAccept=%2A%2F%2A",
            "@multimediatype": "GIF image file",
            "@type": "IMAGE-THUMBNAIL",
            "@size": "560",
            "@ref": "sc1",
            "@mimetype": "image/gif"
          },
          {
            "@category": "standard",
            "@height": "46",
            "@width": "287",
            "@_fa": "true",
            "$": "https://api.elsevier.com/content/object/eid/1-s2.0-S1381116904005746-sc1.gif?httpAccept=%2A%2F%2A",
            "@multimediatype": "GIF image file",
            "@type": "IMAGE-DOWNSAMPLED",
            "@size": "1634",
            "@ref": "sc1",
            "@mimetype": "image/gif"
          },
          {
            "@category": "thumbnail",
            "@height": "80",
            "@width": "125",
            "@_fa": "true",
            "$": "https://api.elsevier.com/content/object/eid/1-s2.0-S1381116904005746-sc2.sml?httpAccept=%2A%2F%2A",
            "@multimediatype": "GIF image file",
            "@type": "IMAGE-THUMBNAIL",
            "@size": "1300",
            "@ref": "sc2",
            "@mimetype": "image/gif"
          },
          {
            "@category": "standard",
            "@height": "239",
            "@width": "374",
            "@_fa": "true",
            "$": "https://api.elsevier.com/content/object/eid/1-s2.0-S1381116904005746-sc2.gif?httpAccept=%2A%2F%2A",
            "@multimediatype": "GIF image file",
            "@type": "IMAGE-DOWNSAMPLED",
            "@size": "6527",
            "@ref": "sc2",
            "@mimetype": "image/gif"
          },
          {
            "@category": "thumbnail",
            "@height": "49",
            "@width": "125",
            "@_fa": "true",
            "$": "https://api.elsevier.com/content/object/eid/1-s2.0-S1381116904005746-fx3.sml?httpAccept=%2A%2F%2A",
            "@multimediatype": "GIF image file",
            "@type": "IMAGE-THUMBNAIL",
            "@size": "942",
            "@ref": "fx3",
            "@mimetype": "image/gif"
          },
          {
            "@category": "standard",
            "@height": "34",
            "@width": "87",
            "@_fa": "true",
            "$": "https://api.elsevier.com/content/object/eid/1-s2.0-S1381116904005746-fx3.gif?httpAccept=%2A%2F%2A",
            "@multimediatype": "GIF image file",
            "@type": "IMAGE-DOWNSAMPLED",
            "@size": "650",
            "@ref": "fx3",
            "@mimetype": "image/gif"
          },
          {
            "@category": "thumbnail",
            "@height": "89",
            "@width": "125",
            "@_fa": "true",
            "$": "https://api.elsevier.com/content/object/eid/1-s2.0-S1381116904005746-fx5.sml?httpAccept=%2A%2F%2A",
            "@multimediatype": "GIF image file",
            "@type": "IMAGE-THUMBNAIL",
            "@size": "1354",
            "@ref": "fx5",
            "@mimetype": "image/gif"
          },
          {
            "@category": "standard",
            "@height": "61",
            "@width": "86",
            "@_fa": "true",
            "$": "https://api.elsevier.com/content/object/eid/1-s2.0-S1381116904005746-fx5.gif?httpAccept=%2A%2F%2A",
            "@multimediatype": "GIF image file",
            "@type": "IMAGE-DOWNSAMPLED",
            "@size": "933",
            "@ref": "fx5",
            "@mimetype": "image/gif"
          },
          {
            "@category": "thumbnail",
            "@height": "48",
            "@width": "125",
            "@_fa": "true",
            "$": "https://api.elsevier.com/content/object/eid/1-s2.0-S1381116904005746-fx10.sml?httpAccept=%2A%2F%2A",
            "@multimediatype": "GIF image file",
            "@type": "IMAGE-THUMBNAIL",
            "@size": "1003",
            "@ref": "fx10",
            "@mimetype": "image/gif"
          },
          {
            "@category": "standard",
            "@height": "57",
            "@width": "147",
            "@_fa": "true",
            "$": "https://api.elsevier.com/content/object/eid/1-s2.0-S1381116904005746-fx10.gif?httpAccept=%2A%2F%2A",
            "@multimediatype": "GIF image file",
            "@type": "IMAGE-DOWNSAMPLED",
            "@size": "1187",
            "@ref": "fx10",
            "@mimetype": "image/gif"
          },
          {
            "@category": "thumbnail",
            "@height": "64",
            "@width": "125",
            "@_fa": "true",
            "$": "https://api.elsevier.com/content/object/eid/1-s2.0-S1381116904005746-fx6.sml?httpAccept=%2A%2F%2A",
            "@multimediatype": "GIF image file",
            "@type": "IMAGE-THUMBNAIL",
            "@size": "1063",
            "@ref": "fx6",
            "@mimetype": "image/gif"
          },
          {
            "@category": "standard",
            "@height": "36",
            "@width": "70",
            "@_fa": "true",
            "$": "https://api.elsevier.com/content/object/eid/1-s2.0-S1381116904005746-fx6.gif?httpAccept=%2A%2F%2A",
            "@multimediatype": "GIF image file",
            "@type": "IMAGE-DOWNSAMPLED",
            "@size": "600",
            "@ref": "fx6",
            "@mimetype": "image/gif"
          },
          {
            "@category": "thumbnail",
            "@height": "31",
            "@width": "125",
            "@_fa": "true",
            "$": "https://api.elsevier.com/content/object/eid/1-s2.0-S1381116904005746-fx11.sml?httpAccept=%2A%2F%2A",
            "@multimediatype": "GIF image file",
            "@type": "IMAGE-THUMBNAIL",
            "@size": "898",
            "@ref": "fx11",
            "@mimetype": "image/gif"
          },
          {
            "@category": "standard",
            "@height": "36",
            "@width": "147",
            "@_fa": "true",
            "$": "https://api.elsevier.com/content/object/eid/1-s2.0-S1381116904005746-fx11.gif?httpAccept=%2A%2F%2A",
            "@multimediatype": "GIF image file",
            "@type": "IMAGE-DOWNSAMPLED",
            "@size": "1008",
            "@ref": "fx11",
            "@mimetype": "image/gif"
          },
          {
            "@category": "thumbnail",
            "@height": "64",
            "@width": "125",
            "@_fa": "true",
            "$": "https://api.elsevier.com/content/object/eid/1-s2.0-S1381116904005746-fx7.sml?httpAccept=%2A%2F%2A",
            "@multimediatype": "GIF image file",
            "@type": "IMAGE-THUMBNAIL",
            "@size": "806",
            "@ref": "fx7",
            "@mimetype": "image/gif"
          },
          {
            "@category": "standard",
            "@height": "33",
            "@width": "64",
            "@_fa": "true",
            "$": "https://api.elsevier.com/content/object/eid/1-s2.0-S1381116904005746-fx7.gif?httpAccept=%2A%2F%2A",
            "@multimediatype": "GIF image file",
            "@type": "IMAGE-DOWNSAMPLED",
            "@size": "395",
            "@ref": "fx7",
            "@mimetype": "image/gif"
          },
          {
            "@category": "thumbnail",
            "@height": "31",
            "@width": "125",
            "@_fa": "true",
            "$": "https://api.elsevier.com/content/object/eid/1-s2.0-S1381116904005746-fx12.sml?httpAccept=%2A%2F%2A",
            "@multimediatype": "GIF image file",
            "@type": "IMAGE-THUMBNAIL",
            "@size": "785",
            "@ref": "fx12",
            "@mimetype": "image/gif"
          },
          {
            "@category": "standard",
            "@height": "36",
            "@width": "146",
            "@_fa": "true",
            "$": "https://api.elsevier.com/content/object/eid/1-s2.0-S1381116904005746-fx12.gif?httpAccept=%2A%2F%2A",
            "@multimediatype": "GIF image file",
            "@type": "IMAGE-DOWNSAMPLED",
            "@size": "867",
            "@ref": "fx12",
            "@mimetype": "image/gif"
          },
          {
            "@category": "thumbnail",
            "@height": "75",
            "@width": "125",
            "@_fa": "true",
            "$": "https://api.elsevier.com/content/object/eid/1-s2.0-S1381116904005746-fx8.sml?httpAccept=%2A%2F%2A",
            "@multimediatype": "GIF image file",
            "@type": "IMAGE-THUMBNAIL",
            "@size": "889",
            "@ref": "fx8",
            "@mimetype": "image/gif"
          },
          {
            "@category": "standard",
            "@height": "35",
            "@width": "58",
            "@_fa": "true",
            "$": "https://api.elsevier.com/content/object/eid/1-s2.0-S1381116904005746-fx8.gif?httpAccept=%2A%2F%2A",
            "@multimediatype": "GIF image file",
            "@type": "IMAGE-DOWNSAMPLED",
            "@size": "392",
            "@ref": "fx8",
            "@mimetype": "image/gif"
          },
          {
            "@category": "thumbnail",
            "@height": "32",
            "@width": "125",
            "@_fa": "true",
            "$": "https://api.elsevier.com/content/object/eid/1-s2.0-S1381116904005746-fx13.sml?httpAccept=%2A%2F%2A",
            "@multimediatype": "GIF image file",
            "@type": "IMAGE-THUMBNAIL",
            "@size": "835",
            "@ref": "fx13",
            "@mimetype": "image/gif"
          },
          {
            "@category": "standard",
            "@height": "35",
            "@width": "135",
            "@_fa": "true",
            "$": "https://api.elsevier.com/content/object/eid/1-s2.0-S1381116904005746-fx13.gif?httpAccept=%2A%2F%2A",
            "@multimediatype": "GIF image file",
            "@type": "IMAGE-DOWNSAMPLED",
            "@size": "811",
            "@ref": "fx13",
            "@mimetype": "image/gif"
          },
          {
            "@category": "thumbnail",
            "@height": "53",
            "@width": "125",
            "@_fa": "true",
            "$": "https://api.elsevier.com/content/object/eid/1-s2.0-S1381116904005746-fx4.sml?httpAccept=%2A%2F%2A",
            "@multimediatype": "GIF image file",
            "@type": "IMAGE-THUMBNAIL",
            "@size": "968",
            "@ref": "fx4",
            "@mimetype": "image/gif"
          },
          {
            "@category": "standard",
            "@height": "35",
            "@width": "83",
            "@_fa": "true",
            "$": "https://api.elsevier.com/content/object/eid/1-s2.0-S1381116904005746-fx4.gif?httpAccept=%2A%2F%2A",
            "@multimediatype": "GIF image file",
            "@type": "IMAGE-DOWNSAMPLED",
            "@size": "632",
            "@ref": "fx4",
            "@mimetype": "image/gif"
          },
          {
            "@category": "thumbnail",
            "@height": "88",
            "@width": "125",
            "@_fa": "true",
            "$": "https://api.elsevier.com/content/object/eid/1-s2.0-S1381116904005746-fx9.sml?httpAccept=%2A%2F%2A",
            "@multimediatype": "GIF image file",
            "@type": "IMAGE-THUMBNAIL",
            "@size": "1364",
            "@ref": "fx9",
            "@mimetype": "image/gif"
          },
          {
            "@category": "standard",
            "@height": "53",
            "@width": "75",
            "@_fa": "true",
            "$": "https://api.elsevier.com/content/object/eid/1-s2.0-S1381116904005746-fx9.gif?httpAccept=%2A%2F%2A",
            "@multimediatype": "GIF image file",
            "@type": "IMAGE-DOWNSAMPLED",
            "@size": "768",
            "@ref": "fx9",
            "@mimetype": "image/gif"
          },
          {
            "@category": "thumbnail",
            "@height": "50",
            "@width": "125",
            "@_fa": "true",
            "$": "https://api.elsevier.com/content/object/eid/1-s2.0-S1381116904005746-fx14.sml?httpAccept=%2A%2F%2A",
            "@multimediatype": "GIF image file",
            "@type": "IMAGE-THUMBNAIL",
            "@size": "1021",
            "@ref": "fx14",
            "@mimetype": "image/gif"
          },
          {
            "@category": "standard",
            "@height": "59",
            "@width": "147",
            "@_fa": "true",
            "$": "https://api.elsevier.com/content/object/eid/1-s2.0-S1381116904005746-fx14.gif?httpAccept=%2A%2F%2A",
            "@multimediatype": "GIF image file",
            "@type": "IMAGE-DOWNSAMPLED",
            "@size": "1204",
            "@ref": "fx14",
            "@mimetype": "image/gif"
          },
          {
            "@category": "thumbnail",
            "@height": "20",
            "@width": "125",
            "@_fa": "true",
            "$": "https://api.elsevier.com/content/object/eid/1-s2.0-S1381116904005746-fx1.sml?httpAccept=%2A%2F%2A",
            "@multimediatype": "GIF image file",
            "@type": "IMAGE-THUMBNAIL",
            "@size": "499",
            "@ref": "fx1",
            "@mimetype": "image/gif"
          },
          {
            "@category": "standard",
            "@height": "53",
            "@width": "337",
            "@_fa": "true",
            "$": "https://api.elsevier.com/content/object/eid/1-s2.0-S1381116904005746-fx1.gif?httpAccept=%2A%2F%2A",
            "@multimediatype": "GIF image file",
            "@type": "IMAGE-DOWNSAMPLED",
            "@size": "1842",
            "@ref": "fx1",
            "@mimetype": "image/gif"
          },
          {
            "@category": "thumbnail",
            "@height": "93",
            "@width": "81",
            "@_fa": "true",
            "$": "https://api.elsevier.com/content/object/eid/1-s2.0-S1381116904005746-fx2.sml?httpAccept=%2A%2F%2A",
            "@multimediatype": "GIF image file",
            "@type": "IMAGE-THUMBNAIL",
            "@size": "857",
            "@ref": "fx2",
            "@mimetype": "image/gif"
          },
          {
            "@category": "standard",
            "@height": "135",
            "@width": "117",
            "@_fa": "true",
            "$": "https://api.elsevier.com/content/object/eid/1-s2.0-S1381116904005746-fx2.gif?httpAccept=%2A%2F%2A",
            "@multimediatype": "GIF image file",
            "@type": "IMAGE-DOWNSAMPLED",
            "@size": "1238",
            "@ref": "fx2",
            "@mimetype": "image/gif"
          }
        ]
      },
      "link": {
        "@rel": "abstract",
        "@href": "https://api.elsevier.com/content/abstract/scopus_id/5144232203"
      }
    }
  }
}