{
  "metadata": {
    "title": "Mo-based Keggin heteropolyacids as catalysts in the green and selective oxidation of diphenyl sulfide",
    "authors": "; ; ",
    "journal": "Journal of Molecular Catalysis A: Chemical",
    "date": "2013-07-31",
    "doi": "10.1016/j.molcata.2013.03.002",
    "abstract": "",
    "uri": "https://api.elsevier.com/content/article/pii/S1381116913001039",
    "pii": "S1381116913001039"
  },
  "fulltext": {
    "full-text-retrieval-response": {
      "scopus-eid": "2-s2.0-84876934819",
      "originalText": "serial JL 271358 291210 291744 291790 291809 31 Journal of Molecular Catalysis A: Chemical JOURNALMOLECULARCATALYSISACHEMICAL 2013-03-14 2013-03-14 2013-04-27T00:23:05 1-s2.0-S1381116913001039 S1381-1169(13)00103-9 S1381116913001039 10.1016/j.molcata.2013.03.002 S300 S300.1 FULL-TEXT 1-s2.0-S1381116913X00056 2015-05-15T05:56:33.63776-04:00 0 0 20130701 20130731 2013 2013-03-14T00:00:00Z articleinfo crossmark dco dateupdated tomb dateloaded datesearch indexeddate volumelist yearnav absattachment articletitlenorm authfirstinitialnorm authfirstsurnamenorm cid cids contenttype copyright dateloadedtxt docsubtype doctype doi eid ewtransactionid hubeid issn issnnorm itemstage itemtransactionid itemweight openaccess openarchive pg pgfirst pglast pii piinorm pubdateend pubdatestart pubdatetxt pubyr sortorder srctitle srctitlenorm srctype subheadings suppl volfirst volissue webpdf webpdfpagecount figure table body acknowledge affil articletitle auth authfirstini authfull authkeywords authlast highlightsabst primabst ref specialabst alllist content subj ssids 1381-1169 13811169 false 373 373 C Volume 373 21 142 150 142 150 201307 July 2013 2013-07-01 2013-07-31 2013 article fla Copyright © 2013 Elsevier B.V. Published by Elsevier B.V. All rights reserved. MOBASEDKEGGINHETEROPOLYACIDSCATALYSTSINGREENSELECTIVEOXIDATIONDIPHENYLSULFIDE PALERMO V 1 Introduction 2 Experimental 2.1 Catalyst preparation 2.1.1 Silica preparation via sol–gel technique 2.1.2 Preparation of functionalized silica 2.1.3 Synthesis of heteropolyacids 2.1.4 Preparation of silica-supported catalysts 2.2 Catalyst characterization 2.2.1 Quantitative element analysis 2.2.2 UV–visible spectroscopy 2.2.3 Textural properties 2.2.4 Fourier transform infrared spectroscopy 2.2.5 Potentiometric titration 2.3 Catalytic activity test 2.3.1 General 2.3.2 Heterogeneous reactions 3 Results and discussion 3.1 Characterization of catalysts 3.2 Catalytic test 4 Conclusions Acknowledgments References TOROK 1997 L17 L25 B KEGGIN 1934 75 100 J ROMANELLI 2004 163 170 G ROMANELLI 2005 209 215 G HU 1993 437 448 C SATHICQ 2008 1441 1444 A VAZQUEZ 2000 223 232 P VAZQUEZ 2002 233 240 P KAPUSTIN 1991 896 898 G VAZQUEZ 1999 205 215 P PIZZIO 1998 283 294 L PIZZIO 1997 318 326 L BONADIES 1996 7129 7130 F KACZOROWSKA 2005 8315 8327 K PALERMO 2011 181 195 V TROST 1978 363 382 B CARRENO 1995 1717 1760 M KARIMI 2005 625 628 B ROCCHICCIOLIDELTCHEFF 1990 292 310 C TARLANI 2006 32 38 A VILLABRILLE 2004 101 111 P FUCHS 2008 181 186 V ROCCHICCIOLIDELTCHEFF 1983 207 216 C PIZZIO 2006 153 160 L CASUSCELLI 2004 115 122 S PALERMO 2009 3258 3268 V MACIUCA 2008 33 A PALERMOX2013X142 PALERMOX2013X142X150 PALERMOX2013X142XV PALERMOX2013X142X150XV item S1381-1169(13)00103-9 S1381116913001039 1-s2.0-S1381116913001039 10.1016/j.molcata.2013.03.002 271358 2013-04-27T03:11:23.885704-04:00 2013-07-01 2013-07-31 1-s2.0-S1381116913001039-main.pdf https://s3.amazonaws.com/prod-ucs-content-store-us-east/content/pii:S1381116913001039/MAIN/application/pdf/38b88ec8c5e42b42d2ae26114bf2828f/main.pdf https://s3-eu-west-1.amazonaws.com/prod-ucs-content-store-eu-west/content/pii:S1381116913001039/MAIN/application/pdf/38b88ec8c5e42b42d2ae26114bf2828f/main.pdf main.pdf pdf true 888274 MAIN 9 1-s2.0-S1381116913001039-main_1.png https://s3.amazonaws.com/prod-ucs-content-store-us-east/content/pii:S1381116913001039/PREVIEW/image/png/239923eb22a8744d5e3fce99e3a97930/main_1.png https://s3-eu-west-1.amazonaws.com/prod-ucs-content-store-eu-west/content/pii:S1381116913001039/PREVIEW/image/png/239923eb22a8744d5e3fce99e3a97930/main_1.png main_1.png png 60405 849 656 IMAGE-WEB-PDF 1 1-s2.0-S1381116913001039-fx1_lrg.jpg https://s3.amazonaws.com/prod-ucs-content-store-us-east/content/pii:S1381116913001039/fx1/HIGHRES/image/jpeg/247453d97aea03e0c6508c94b5e3c2ee/fx1_lrg.jpg https://s3-eu-west-1.amazonaws.com/prod-ucs-content-store-eu-west/content/pii:S1381116913001039/fx1/HIGHRES/image/jpeg/247453d97aea03e0c6508c94b5e3c2ee/fx1_lrg.jpg fx1 true fx1_lrg.jpg jpg 162006 886 1398 IMAGE-HIGH-RES 1-s2.0-S1381116913001039-sc3_lrg.jpg https://s3.amazonaws.com/prod-ucs-content-store-us-east/content/pii:S1381116913001039/sc3/HIGHRES/image/jpeg/6cceacbd6823631f32c0494ae9f14197/sc3_lrg.jpg https://s3-eu-west-1.amazonaws.com/prod-ucs-content-store-eu-west/content/pii:S1381116913001039/sc3/HIGHRES/image/jpeg/6cceacbd6823631f32c0494ae9f14197/sc3_lrg.jpg sc3 sc3_lrg.jpg jpg 58105 728 1250 IMAGE-HIGH-RES 1-s2.0-S1381116913001039-sc2_lrg.jpg https://s3.amazonaws.com/prod-ucs-content-store-us-east/content/pii:S1381116913001039/sc2/HIGHRES/image/jpeg/6fb2ece5cb360c6fef6a7539d26536f1/sc2_lrg.jpg https://s3-eu-west-1.amazonaws.com/prod-ucs-content-store-eu-west/content/pii:S1381116913001039/sc2/HIGHRES/image/jpeg/6fb2ece5cb360c6fef6a7539d26536f1/sc2_lrg.jpg sc2 sc2_lrg.jpg jpg 114978 417 2925 IMAGE-HIGH-RES 1-s2.0-S1381116913001039-sc1_lrg.jpg https://s3.amazonaws.com/prod-ucs-content-store-us-east/content/pii:S1381116913001039/sc1/HIGHRES/image/jpeg/6da0594a3824f75f8b077eb947b56784/sc1_lrg.jpg https://s3-eu-west-1.amazonaws.com/prod-ucs-content-store-eu-west/content/pii:S1381116913001039/sc1/HIGHRES/image/jpeg/6da0594a3824f75f8b077eb947b56784/sc1_lrg.jpg sc1 sc1_lrg.jpg jpg 124806 955 2508 IMAGE-HIGH-RES 1-s2.0-S1381116913001039-gr6_lrg.jpg https://s3.amazonaws.com/prod-ucs-content-store-us-east/content/pii:S1381116913001039/gr6/HIGHRES/image/jpeg/546ad5495513b265ecbad5e381f10288/gr6_lrg.jpg https://s3-eu-west-1.amazonaws.com/prod-ucs-content-store-eu-west/content/pii:S1381116913001039/gr6/HIGHRES/image/jpeg/546ad5495513b265ecbad5e381f10288/gr6_lrg.jpg gr6 gr6_lrg.jpg jpg 99674 1091 1583 IMAGE-HIGH-RES 1-s2.0-S1381116913001039-gr5_lrg.jpg https://s3.amazonaws.com/prod-ucs-content-store-us-east/content/pii:S1381116913001039/gr5/HIGHRES/image/jpeg/9cd92ee149c71ef1b16c40f98aeadcd0/gr5_lrg.jpg https://s3-eu-west-1.amazonaws.com/prod-ucs-content-store-eu-west/content/pii:S1381116913001039/gr5/HIGHRES/image/jpeg/9cd92ee149c71ef1b16c40f98aeadcd0/gr5_lrg.jpg gr5 gr5_lrg.jpg jpg 254284 2260 1591 IMAGE-HIGH-RES 1-s2.0-S1381116913001039-gr4_lrg.jpg https://s3.amazonaws.com/prod-ucs-content-store-us-east/content/pii:S1381116913001039/gr4/HIGHRES/image/jpeg/530e62c1f3c4c9d585635591f08ee6a5/gr4_lrg.jpg https://s3-eu-west-1.amazonaws.com/prod-ucs-content-store-eu-west/content/pii:S1381116913001039/gr4/HIGHRES/image/jpeg/530e62c1f3c4c9d585635591f08ee6a5/gr4_lrg.jpg gr4 gr4_lrg.jpg jpg 191017 1158 1583 IMAGE-HIGH-RES 1-s2.0-S1381116913001039-gr3_lrg.jpg https://s3.amazonaws.com/prod-ucs-content-store-us-east/content/pii:S1381116913001039/gr3/HIGHRES/image/jpeg/a187216b58a603aa474de78ec384f2f6/gr3_lrg.jpg https://s3-eu-west-1.amazonaws.com/prod-ucs-content-store-eu-west/content/pii:S1381116913001039/gr3/HIGHRES/image/jpeg/a187216b58a603aa474de78ec384f2f6/gr3_lrg.jpg gr3 gr3_lrg.jpg jpg 384009 2446 2938 IMAGE-HIGH-RES 1-s2.0-S1381116913001039-gr2_lrg.jpg https://s3.amazonaws.com/prod-ucs-content-store-us-east/content/pii:S1381116913001039/gr2/HIGHRES/image/jpeg/1cd52e7b2dd94ef07ff8688066ccbe97/gr2_lrg.jpg https://s3-eu-west-1.amazonaws.com/prod-ucs-content-store-eu-west/content/pii:S1381116913001039/gr2/HIGHRES/image/jpeg/1cd52e7b2dd94ef07ff8688066ccbe97/gr2_lrg.jpg gr2 gr2_lrg.jpg jpg 160810 1174 1667 IMAGE-HIGH-RES 1-s2.0-S1381116913001039-gr1_lrg.jpg https://s3.amazonaws.com/prod-ucs-content-store-us-east/content/pii:S1381116913001039/gr1/HIGHRES/image/jpeg/be87555376c368cb4dcb134f9dc76153/gr1_lrg.jpg https://s3-eu-west-1.amazonaws.com/prod-ucs-content-store-eu-west/content/pii:S1381116913001039/gr1/HIGHRES/image/jpeg/be87555376c368cb4dcb134f9dc76153/gr1_lrg.jpg gr1 gr1_lrg.jpg jpg 199924 2078 1429 IMAGE-HIGH-RES 1-s2.0-S1381116913001039-fx1.jpg https://s3.amazonaws.com/prod-ucs-content-store-us-east/content/pii:S1381116913001039/fx1/DOWNSAMPLED/image/jpeg/f5d6cc49ad7fadcc2f6328bb277b096d/fx1.jpg https://s3-eu-west-1.amazonaws.com/prod-ucs-content-store-eu-west/content/pii:S1381116913001039/fx1/DOWNSAMPLED/image/jpeg/f5d6cc49ad7fadcc2f6328bb277b096d/fx1.jpg fx1 true fx1.jpg jpg 18003 200 315 IMAGE-DOWNSAMPLED 1-s2.0-S1381116913001039-sc3.jpg https://s3.amazonaws.com/prod-ucs-content-store-us-east/content/pii:S1381116913001039/sc3/DOWNSAMPLED/image/jpeg/da1f80f3e5a22f947602f3a0102b1454/sc3.jpg https://s3-eu-west-1.amazonaws.com/prod-ucs-content-store-eu-west/content/pii:S1381116913001039/sc3/DOWNSAMPLED/image/jpeg/da1f80f3e5a22f947602f3a0102b1454/sc3.jpg sc3 sc3.jpg jpg 15954 164 282 IMAGE-DOWNSAMPLED 1-s2.0-S1381116913001039-sc2.jpg https://s3.amazonaws.com/prod-ucs-content-store-us-east/content/pii:S1381116913001039/sc2/DOWNSAMPLED/image/jpeg/085f667e1edb6f3280bfa032cb915acc/sc2.jpg https://s3-eu-west-1.amazonaws.com/prod-ucs-content-store-eu-west/content/pii:S1381116913001039/sc2/DOWNSAMPLED/image/jpeg/085f667e1edb6f3280bfa032cb915acc/sc2.jpg sc2 sc2.jpg jpg 16791 94 661 IMAGE-DOWNSAMPLED 1-s2.0-S1381116913001039-sc1.jpg https://s3.amazonaws.com/prod-ucs-content-store-us-east/content/pii:S1381116913001039/sc1/DOWNSAMPLED/image/jpeg/e8dc12393dadc29fe86db29579f5df75/sc1.jpg https://s3-eu-west-1.amazonaws.com/prod-ucs-content-store-eu-west/content/pii:S1381116913001039/sc1/DOWNSAMPLED/image/jpeg/e8dc12393dadc29fe86db29579f5df75/sc1.jpg sc1 sc1.jpg jpg 19386 216 566 IMAGE-DOWNSAMPLED 1-s2.0-S1381116913001039-gr6.jpg https://s3.amazonaws.com/prod-ucs-content-store-us-east/content/pii:S1381116913001039/gr6/DOWNSAMPLED/image/jpeg/ded0d4ff4c0527c306d630f2f1fe6868/gr6.jpg https://s3-eu-west-1.amazonaws.com/prod-ucs-content-store-eu-west/content/pii:S1381116913001039/gr6/DOWNSAMPLED/image/jpeg/ded0d4ff4c0527c306d630f2f1fe6868/gr6.jpg gr6 gr6.jpg jpg 12320 246 357 IMAGE-DOWNSAMPLED 1-s2.0-S1381116913001039-gr5.jpg https://s3.amazonaws.com/prod-ucs-content-store-us-east/content/pii:S1381116913001039/gr5/DOWNSAMPLED/image/jpeg/e038e652721e53e361c5287c332fa18f/gr5.jpg https://s3-eu-west-1.amazonaws.com/prod-ucs-content-store-eu-west/content/pii:S1381116913001039/gr5/DOWNSAMPLED/image/jpeg/e038e652721e53e361c5287c332fa18f/gr5.jpg gr5 gr5.jpg jpg 30083 510 359 IMAGE-DOWNSAMPLED 1-s2.0-S1381116913001039-gr4.jpg https://s3.amazonaws.com/prod-ucs-content-store-us-east/content/pii:S1381116913001039/gr4/DOWNSAMPLED/image/jpeg/be143c3a57f470ab5bbf00fa24abc8e0/gr4.jpg https://s3-eu-west-1.amazonaws.com/prod-ucs-content-store-eu-west/content/pii:S1381116913001039/gr4/DOWNSAMPLED/image/jpeg/be143c3a57f470ab5bbf00fa24abc8e0/gr4.jpg gr4 gr4.jpg jpg 20880 261 357 IMAGE-DOWNSAMPLED 1-s2.0-S1381116913001039-gr3.jpg https://s3.amazonaws.com/prod-ucs-content-store-us-east/content/pii:S1381116913001039/gr3/DOWNSAMPLED/image/jpeg/0a0c1b7442ec69c4e2ca930e5dfc61b9/gr3.jpg https://s3-eu-west-1.amazonaws.com/prod-ucs-content-store-eu-west/content/pii:S1381116913001039/gr3/DOWNSAMPLED/image/jpeg/0a0c1b7442ec69c4e2ca930e5dfc61b9/gr3.jpg gr3 gr3.jpg jpg 43505 552 663 IMAGE-DOWNSAMPLED 1-s2.0-S1381116913001039-gr2.jpg https://s3.amazonaws.com/prod-ucs-content-store-us-east/content/pii:S1381116913001039/gr2/DOWNSAMPLED/image/jpeg/52b2757ab15f6fc839e7421a4accaead/gr2.jpg https://s3-eu-west-1.amazonaws.com/prod-ucs-content-store-eu-west/content/pii:S1381116913001039/gr2/DOWNSAMPLED/image/jpeg/52b2757ab15f6fc839e7421a4accaead/gr2.jpg gr2 gr2.jpg jpg 19983 265 376 IMAGE-DOWNSAMPLED 1-s2.0-S1381116913001039-gr1.jpg https://s3.amazonaws.com/prod-ucs-content-store-us-east/content/pii:S1381116913001039/gr1/DOWNSAMPLED/image/jpeg/742a878e05bd700d696c4b805cdf15aa/gr1.jpg https://s3-eu-west-1.amazonaws.com/prod-ucs-content-store-eu-west/content/pii:S1381116913001039/gr1/DOWNSAMPLED/image/jpeg/742a878e05bd700d696c4b805cdf15aa/gr1.jpg gr1 gr1.jpg jpg 23523 468 322 IMAGE-DOWNSAMPLED 1-s2.0-S1381116913001039-fx1.sml https://s3.amazonaws.com/prod-ucs-content-store-us-east/content/pii:S1381116913001039/fx1/THUMBNAIL/image/gif/ed3384a52ac4d116d4b786ecb0879db3/fx1.sml https://s3-eu-west-1.amazonaws.com/prod-ucs-content-store-eu-west/content/pii:S1381116913001039/fx1/THUMBNAIL/image/gif/ed3384a52ac4d116d4b786ecb0879db3/fx1.sml fx1 true fx1.sml sml 9717 139 219 IMAGE-THUMBNAIL 1-s2.0-S1381116913001039-sc3.sml https://s3.amazonaws.com/prod-ucs-content-store-us-east/content/pii:S1381116913001039/sc3/THUMBNAIL/image/gif/9cb5af4caa6f64271010f5a1b7b213b2/sc3.sml https://s3-eu-west-1.amazonaws.com/prod-ucs-content-store-eu-west/content/pii:S1381116913001039/sc3/THUMBNAIL/image/gif/9cb5af4caa6f64271010f5a1b7b213b2/sc3.sml sc3 sc3.sml sml 2052 128 219 IMAGE-THUMBNAIL 1-s2.0-S1381116913001039-sc2.sml https://s3.amazonaws.com/prod-ucs-content-store-us-east/content/pii:S1381116913001039/sc2/THUMBNAIL/image/gif/782af283226e3860e0f91f0cd9fb74d9/sc2.sml https://s3-eu-west-1.amazonaws.com/prod-ucs-content-store-eu-west/content/pii:S1381116913001039/sc2/THUMBNAIL/image/gif/782af283226e3860e0f91f0cd9fb74d9/sc2.sml sc2 sc2.sml sml 1027 31 219 IMAGE-THUMBNAIL 1-s2.0-S1381116913001039-sc1.sml https://s3.amazonaws.com/prod-ucs-content-store-us-east/content/pii:S1381116913001039/sc1/THUMBNAIL/image/gif/7c65608001b65bf5276a08e2fa8d932d/sc1.sml https://s3-eu-west-1.amazonaws.com/prod-ucs-content-store-eu-west/content/pii:S1381116913001039/sc1/THUMBNAIL/image/gif/7c65608001b65bf5276a08e2fa8d932d/sc1.sml sc1 sc1.sml sml 1496 83 219 IMAGE-THUMBNAIL 1-s2.0-S1381116913001039-gr6.sml https://s3.amazonaws.com/prod-ucs-content-store-us-east/content/pii:S1381116913001039/gr6/THUMBNAIL/image/gif/4d2ee97b1fe3189b3a6ea91d40d52d18/gr6.sml https://s3-eu-west-1.amazonaws.com/prod-ucs-content-store-eu-west/content/pii:S1381116913001039/gr6/THUMBNAIL/image/gif/4d2ee97b1fe3189b3a6ea91d40d52d18/gr6.sml gr6 gr6.sml sml 3658 151 219 IMAGE-THUMBNAIL 1-s2.0-S1381116913001039-gr5.sml https://s3.amazonaws.com/prod-ucs-content-store-us-east/content/pii:S1381116913001039/gr5/THUMBNAIL/image/gif/29396323d859f2f1f0352eaea6bcf539/gr5.sml https://s3-eu-west-1.amazonaws.com/prod-ucs-content-store-eu-west/content/pii:S1381116913001039/gr5/THUMBNAIL/image/gif/29396323d859f2f1f0352eaea6bcf539/gr5.sml gr5 gr5.sml sml 3362 163 115 IMAGE-THUMBNAIL 1-s2.0-S1381116913001039-gr4.sml https://s3.amazonaws.com/prod-ucs-content-store-us-east/content/pii:S1381116913001039/gr4/THUMBNAIL/image/gif/229dc37f18a8df20b5f5f7f245c8cee5/gr4.sml https://s3-eu-west-1.amazonaws.com/prod-ucs-content-store-eu-west/content/pii:S1381116913001039/gr4/THUMBNAIL/image/gif/229dc37f18a8df20b5f5f7f245c8cee5/gr4.sml gr4 gr4.sml sml 5194 160 219 IMAGE-THUMBNAIL 1-s2.0-S1381116913001039-gr3.sml https://s3.amazonaws.com/prod-ucs-content-store-us-east/content/pii:S1381116913001039/gr3/THUMBNAIL/image/gif/7deafa727f62b3adbbed3cf07fb2bcf2/gr3.sml https://s3-eu-west-1.amazonaws.com/prod-ucs-content-store-eu-west/content/pii:S1381116913001039/gr3/THUMBNAIL/image/gif/7deafa727f62b3adbbed3cf07fb2bcf2/gr3.sml gr3 gr3.sml sml 4232 164 197 IMAGE-THUMBNAIL 1-s2.0-S1381116913001039-gr2.sml https://s3.amazonaws.com/prod-ucs-content-store-us-east/content/pii:S1381116913001039/gr2/THUMBNAIL/image/gif/2d7a1c21bd90ee0132fa388e0efa510a/gr2.sml https://s3-eu-west-1.amazonaws.com/prod-ucs-content-store-eu-west/content/pii:S1381116913001039/gr2/THUMBNAIL/image/gif/2d7a1c21bd90ee0132fa388e0efa510a/gr2.sml gr2 gr2.sml sml 5205 154 219 IMAGE-THUMBNAIL 1-s2.0-S1381116913001039-gr1.sml https://s3.amazonaws.com/prod-ucs-content-store-us-east/content/pii:S1381116913001039/gr1/THUMBNAIL/image/gif/fedfa58dc8129b2789bb8c830c8d42fc/gr1.sml https://s3-eu-west-1.amazonaws.com/prod-ucs-content-store-eu-west/content/pii:S1381116913001039/gr1/THUMBNAIL/image/gif/fedfa58dc8129b2789bb8c830c8d42fc/gr1.sml gr1 gr1.sml sml 3440 163 112 IMAGE-THUMBNAIL MOLCAA 8694 S1381-1169(13)00103-9 10.1016/j.molcata.2013.03.002 Elsevier B.V. Fig. 1 FTIR spectrum of bulk HPA. Fig. 2 FTIR spectrum of supported PMoY. Fig. 3 Potentiometric titration curves of bulk HPA. (a) MPA and PMoB; (b) PMoBi; (c) PMoLa; (d) PMoY bulk and supported (PMoY–S and PMo–NH2–S). Fig. 4 UV–visible spectra of solutions after contact with the solid. Fig. 5 (a) Sulfide conversion vs. time, at 25°C, using different HPA supported on functionalized silica. (b) Sulfone selectivity vs. time, at 50°C, using different HPA supported on functionalized silica. Fig. 6 Use and reuse of PMoY–NH2–S, at 50°C, for sulfide conversion vs. time. Scheme 1 Heterogeneization of HPA. Scheme 2 Selective oxidation of diphenyl sulfide. Scheme 3 Plausible activation of hydrogen peroxide for HPA. Table 1 Atomic properties of phosphomolybdic acid doping metals. Entry Metal Atomic mass Van der Waals radius (Å) Ionic radius (Å) Covalent radius (Å) Electronegativity 1 Mo 95.94 1.39 0.62 1.45 1.8 2 B 10.81 0.98 0.20 0.82 2.0 3 Y 88.91 1.80 0.93 1.48 1.2 4 La 138.91 1.87 1.15 1.69 1.1 5 Bi 208.98 1.70 1.20 1.70 1.9 Table 2 Elemental analysis by ICP-AES. Entry HPA theoretical formula Experimental (ICP-AES) Theoretical 1 H3PMo12O40·13H2O Mo 55.98 Mo 50.70 2 H6PMo11BO40·14H2O Mo 52.89 Mo 53.50 B 0.54 B 0.88 3 H6PMo11BiO40·12H2O Mo 48.91 Mo 47.45 Bi 9.69 Bi 9.36 4 H6PMo11LaO40·6H2O Mo 53.32 Mo 52.60 La 7.02 La 8.53 5 H6PMo11YO40·12H2O Mo 51.80 Mo 51.95 Y 4.36 Y 6.49 Table 3 FTIR bands of bulk synthesized HPA. Entry HPA POa MoOd MoOb Mo MoOc Mo 1 PMoB 1066 963 868 785 2 PMoBi 1064 965 871 789 3 PMoLa 1062 961 900 808 4 PMoY 1063 961 900, 876 a 803 a This band is split in two. Table 4 Textural properties of catalysts. Entry Sample S BET (m2/g) Pore volume (cm3/g) Pore size (Å) 1 S 292 0.13 18.3 2 PMoB–S 21 0.01 22.2 3 PMoBi–S 318 0.15 18.7 4 PMoLa–S 392 0.18 18.9 5 PMoY–S 287 0.13 18.7 6 NH2–S – – – 7 PMoB–NH2–S 4.8 – – 8 PMoBi–NH2–S 4.4 – – 9 PMoLa–NH2–S 4.4 – – 10 PMoY–NH2–S 4.7 – – (–) Experimental error. Table 5 Color of impregnated catalysts and impregnated solutions. Entry Supported catalyst Color of supported catalyst Solution after impregnation 1 PMoB–S Green Dark green 2 PMoBi–S Blue Dark green 3 PMoLa–S White Green 4 PMoY–S Green Yellowish green 5 PMoB–NH2–S Bluish white Colorless 6 PMoBi–NH2–S Light blue Colorless 7 PMoLa–NH2–S White Colorless 8 PMoY–NH2–S Bluish white Colorless Table 6 Acid strength (E i) of the catalysts. Entry E i (mV) 1 S 74 2 NH2–S −1 3 HPA MPA PMoB PMoBi PMoLa PMoY 4 Bulk 826 806 823 711 850 5 HPA–S 444 478 313 168 343 6 HPA–NH2–S 67 36 27 45 79 Table 7 Selective oxidation of diphenyl sulfide to diphenyl sulfoxide employing different synthesized HPA catalysis in homogeneous conditions. a Entry Catalyst Sulfide conversion (%) b Sulfoxide selectivity (%) b Sulfone selectivity (%) b 1 None 5 100 – 2 MPA 58 89 11 3 PMoB 64 100 – 4 PMoBi 68 90 10 5 PMoLa 73 94 6 6 PMoY 60 100 – a Reactions were performed by reacting sulfide 1 mmol and 35% (w/v) H2O2 (0.15mL, 1.5 mmol) in ethanol 96% (4mL) for 7h. Catalyst, 12mg and temperature, 25°C. b The conversion and selectivity (%) were determined by GC analysis. Table 8 Selective oxidation of diphenyl sulfide to diphenyl sulfone employing different synthesized HPA catalysis in homogeneous conditions. a Entry Catalyst Sulfide conversion (%) b Sulfoxide selectivity (%) b Sulfone selectivity (%) b 1 MPA 73 90 10 100 c 30 70 100 d 0 100 2 PMoB 62 58 42 100 c 33 67 100 d 0 100 3 PMoBi 100 100 0 100 c 15 85 100 d 0 100 4 PMoLa 77 84 16 100 c 38 62 100 d 9 91 5 PMoY 76 37 63 100 c 23 77 100 d 0 100 a Reactions were performed by reacting sulfide 1 mmol and 35% (w/v) H2O2 (0.7mL, 7.0 mmol) in ethanol 96% (4mL) for 0.5h. Catalyst, 12mg and temperature, 50°C. b The conversion and selectivity (%) were determined by GC analysis. c Reaction time 4h. d Reaction time 8h. Table 9 Selective oxidation of diphenyl sulfide to diphenyl sulfoxide employing the different synthesized HPA supported on silica. a Entry Catalyst Sulfide conversion (%) b Sulfoxide selectivity (%) b Sulfone Selectivity (%) b 1 PMoB–S 69 94 6 2 PMoBi–S 50 90 10 3 PMoY–S 79 95 5 4 PMoY–S c 45 95 5 a Reactions were performed by reacting sulfide 1 mmol and 35% (w/v) H2O2 (0.15mL, 1.5 mmol) in ethanol 96% (4mL) for 10h. Catalyst, 50mg and temperature, 25°C. b The conversion and selectivity (%) were determined by GC analysis. c Catalyst reuse. Mo-based Keggin heteropolyacids as catalysts in the green and selective oxidation of diphenyl sulfide Valeria Palermo Gustavo P. Romanelli Patricia G. Vázquez * Centre of Research and Development of Applied Sciences “Dr. Jorge J. Ronco” (CINDECA), CONICET-CCT-La Plata, National University of La Plata (UNLP), 47 N° 257, B1900AJK La Plata, Argentina Centre of Research and Development of Applied Sciences “Dr. Jorge J. Ronco” (CINDECA) CONICET-CCT-La Plata, National University of La Plata (UNLP) 47 N° 257, B1900AJK La Plata Argentina * Corresponding author. Tel.: +54 221 4210711; fax: +54 221 4210711. Graphical abstract Heteropolyacids are used as redox catalysts due to their bifunctional properties. Some advantages over conventional catalysts, such as selectivity, easy isolation and reuse, are worth noting. In homogeneous conditions their isolation and recycling can be harder, so that they are supported for their use as heterogeneous catalysts. In this work, we compare the catalytic activity of different heteropolyacids with Keggin structure, supported on pure and functionalized silica (with 3-aminopropyltrimethoxysilane). H6PMo11BO40, H6PMo11BiO40, H6PMo11LaO40, and H6PMo11YO40 were synthesized, supported and characterized by several physicochemical techniques. Highly selective results were obtained in the selective oxidation of diphenyl sulfide to diphenyl sulfoxide or diphenyl sulfone. Besides, these catalysts can be reused. The above-mentioned reaction is useful due to the importance of these compounds as intermediates in the synthesis of biologically significant molecules. Keywords Green selective oxidation Diphenyl sulfide Supported heteropolyacid Keggin heteropolyacid 1 Introduction Heteropolyacids are well-known compounds with complex structural characteristics. Besides their relatively high acid strength, they have particularly favorable technological features such as easy recovery and environmentally safe handling. On the order hand, there is a special interest in those that form a basic Keggin-type structure [1,2]. The growing demand for new functional materials to be used in advanced nanoscale technologies makes the control of the wide range of properties of transition metal compounds an increasingly attractive goal. In this respect, by varying the environment of transition metal complexes, the guest–host interactions involved is an efficient means to finely tune their properties [3]. One of the most striking abilities of polyoxoanion building blocks, particularly for lacunary polyoxoanion clusters, is that they can act as multidentate inorganic ligands to accommodate transition-metal or rare-earth cations between the polyoxoanion clusters [4]. Heteropolyacid (HPA) compounds with Keggin structure are polynuclear complexes principally constituted by a close-packed framework of 12 molybdenum-oxygen octahedral MoO6 surrounding a central PO4 tetrahedron [3]. They operate either as multielectron oxidants or strong acids, with an acid strength higher than that of classical acids [4]; their properties can be controlled by the substitution of the central heteroatom and addenda or transition-metal substituted atoms without changing the fundamental structure [5]. The HPA can be used to replace the conventional inorganic and organic acids in many liquid-phase reactions [6]. In relation to the fundamental importance of ubiquitous protonate water (the aqueous acids) in chemical and biological systems, these HPAs are very important [7,8]. Heteropolycompounds have been supported on different materials with high surface area in order to increase the activity of such compounds in surface heterogeneous reactions [9–12]. Even though the catalysts in homogeneous conditions are effective for organic compound oxidation, their isolation and reuse are difficult. Due to the need to obtain catalysts for green processes, the use of recycled catalysts is required for reducing the catalytic cost. In recent years, inorganic/organic hybrid materials have attracted great interest as they can easily integrate the special function of organic and inorganic components. The hybrid matrix may be a polymer chain or an inorganic polymeric network, and a composite inorganic/polymer host. Based on the interaction among the different components or phases in hybrid systems, these hybrid materials can be divided into two major classes: the first is made up of the so-called physically mixed hybrids with weak interactions such as hydrogen bonding, van der Waals force or weak static effects between the organic and inorganic phases, and the second is formed by chemically bonded hybrids with covalent bonds linking the organic and inorganic parts [13,14]. The motivation for the utilization of Bi, La, Y and B as doped elements of heteropolyacids is due to different reasons in each case. From our first studies on Keggin structures we have always tried to obtain different properties in one compound. In this research we use Bi and Mo together because of their very good activity in oxidation reactions [15]. In relation to La it is interesting to obtain a heteropolyoxocompound with high-quality interaction between silica and lantane oxide, that is, with good dispersion. Yttrium, rarely found in nature, usually occurs in two states. The use of yttrium is still growing, in fact due to its good properties to produce catalysts. Finally, B is very similar to Al, an element that we studied and reported in different papers (see our references), but in this case we are trying to improve our results. On the other hand, H2O2 is one of the oxidants frequently used in fine chemicals synthesis, as an option to the conventional ones, due to its effective oxygen content, low cost, safety in storage and operation. The use of H2O2 leads to a cleaner technology because its reaction produces only H2O as by-product [13]. The selective catalysis of sulfides to sulfoxides and sulfones has been a challenge for many years, owing to the importance of these compounds as intermediates in organic synthesis and their potential fungicidal activity. There are several reagents available for these key transformations, but they are conventionally achieved using stoichiometric amounts of both organic and inorganic reagents, for example, nitric acid and chromic acid, among others [6]. However, these reagents cause environmental pollution and corrosion problems, which can be avoided by using catalysts based on supported HPA. Sulfoxides are important as an activating group in organic synthesis; they have been utilized extensively in carbon bond-forming reactions as building block [16], especially as chiral auxiliaries [17], and they play key roles in the activation of enzymes [18]. The use of sulfones in organic synthesis has become a classic strategy in the synthesis of many complex molecules. The influence of silica-supported molybdenum catalysts on the reaction mechanisms, and also on the improvement of the required parameters for specific reactions of economic importance, has been studied. The decrease of acid catalytic activity with the formation of heteropoly blue (Mo(VI)→Mo(V)) in electrophilic reactions has also been investigated [1]. Studies about MoO3 catalysts supported on silica showed the presence of phosphosilicic acid and its primary catalytic role in such a system [19]. The general objective of this work is the synthesis and characterization of different HPAs with Keggin structure from molybdophosphoric acid (MPA), where Mo is the addenda atom and different B, Bi, La and Y elements incorporate into the primary structure. These HPAs were supported on silica and functionalized silica (with 3-aminopropyltrimethoxysilane), using an equilibrium impregnation technique in all cases. The impregnation step consists of different experimental conditions in order to obtain an active stabilized phase on the supports during reaction in a liquid medium. A detailed analysis of the nature of species present both in solids and in impregnating solutions was carried out. Also, the synthesized catalysts were tested in the selective diphenyl sulfide oxidation, using H2O2 as oxidant and ethanol as solvent, to determine the redox characteristics of the obtained catalysts. In addition, these results were compared with those provided by different techniques such as FTIR and potentiometric tritation, among others. 2 Experimental 2.1 Catalyst preparation 2.1.1 Silica preparation via sol–gel technique Tetraethoxysilane (TEOS) (102mL), absolute ethanol (99%) (42mL), and glacial acetic acid (30mL), in a molar ratio equal to 1:1.6:1.1, were mixed in a glove box under nitrogen atmosphere at room temperature. The mixture was removed from the controlled atmosphere and another part of absolute ethanol (90mL) was added, and then sol–gelation took place. Finally, wet gel was aged in the same medium until dry silica particles were obtained. These particles were dried at 40°C and this solid was named S. 2.1.2 Preparation of functionalized silica The S solid (4g) was refluxed with toluene (128mL) for 1h. Then, 3-aminopropyltrimethoxysilane (APS) (6.40mL) was added and stirred under reflux conditions for 24h (Scheme 1 ). The solid was filtered, washed in a Soxhlet apparatus with diethyl ether and dichloromethane and dried at 40°C according to Ref. [20]. The solid was named NH2–S. 2.1.3 Synthesis of heteropolyacids H6PMo11BO40 (PMoB), H6PMo11BiO40 (PMoBi), H6PMo11LaO40 (PMoLa), and H6PMo11YO40 (PMoY) were prepared by the hydrothermal synthesis method [21]. The following HPA synthesis procedure was used: a stoichiometric mixture of MoO3, the corresponding metal oxide, as raw precursor in each case, and H3PO4 (85%, w/v) was suspended in 120mL of distilled water. The mixture was stirred for 3h at 75°C. After cooling down to room temperature and removal of insolubles, the heteropolyacid solution was evaporated and dried at 40°C. Colorful crystals were obtained. 2.1.4 Preparation of silica-supported catalysts Catalysts were obtained by the equilibrium adsorption technique. The impregnated solutions were prepared by dissolution of the corresponding HPA (150mg) in absolute ethanol (3.50mL), obtaining 23% (w/w) in the final catalyst for each HPA. The HPA amounts added were: PMoB: 0.086 mmol; PMoBi: 0.077 mmol; PMoLa: 0.080 mmol, and PMoY: 0.082 mmol. The first step in the impregnation technique was to contact the HPA solution with the support, S and/or NH2–S (500mg), with H2O (0.50mL). The impregnated solids were left without stirring for 24h, to help the diffusion of HPA into the supports. Then they were shaken for 24h. Finally, the impregnating solutions were separated from the solids and dried at 20°C for 12h. The nomenclature of the new catalysts is: - when S was used as support, they were named PMoB–S, PMoBi–S, PMoLa–S, and PMoY–S; - when NH2–S was used as support, they were named PMoB–NH2–S, PMoBi–NH2–S, PMoLa–NH2–S, and PMoY–NH2–S. On the other hand, and with the only objective of comparing the catalytic behavior, PMoY was impregnated on NH2–S using H2O2 (35%, w/v) instead of water. The catalyst obtained was labeled PMoY–NH2–S(P). This test was made to confirm that water or hydrogen peroxide does not produce any changes in the catalytic behavior of the final material. The modifications of the amount of HPA in each case were evaluated by quantitative element analysis and acidic properties. 2.2 Catalyst characterization 2.2.1 Quantitative element analysis The composition of experimental bulk HPA was determined by means of the inductively coupled plasma atomic emission spectroscopy (ICP-AES) technique using a Shimadsu 1000 III. 2.2.2 UV–visible spectroscopy Subsequent to the contact with the support, the impregnated solution was analyzed by ultraviolet spectroscopy (UV), using a Perkin Elmer Lambda 35 UV–vis double beam spectrophotometer, in the range 200–1100nm. 2.2.3 Textural properties The specific surface area (S BET), pore volume, and the mean pore diameter of the supported catalysts were determined by nitrogen adsorption/desorption technique using Micromeritics ASAP 2020 equipment at liquid-nitrogen temperature. The sample was previously degassed at 100°C for 1h. 2.2.4 Fourier transform infrared spectroscopy Thermo Nicolet IR.200 equipment was employed, using pellets with BrK, and a measuring range of 400–4000cm−1. 2.2.5 Potentiometric titration Catalyst acidity was determined by means of potentiometric titration of a suspension of the solid in acetonitrile, using a solution of n-butylamine in acetonitrile (0.025N) in a Metrohm 794 Basic Titrino apparatus with a double junction electrode. 2.3 Catalytic activity test 2.3.1 General All reagents were purchased from Merck and Aldrich and used without further purification. All yields refer to isolated products after purification. Products were characterized by spectroscopy data (1H NMR). The NMR spectra were recorded on Bruker 200MHz equipment. The NMR spectra were measured in CDCl3 relative to TMS (0.00ppm). The organic phase was dried on anhydrous Na2SO4 and filtered for its analysis by gas chromatography using Varian Scan 3400 cx equipment. The product distribution was quantified by a Shimadzu C-R34. Reactions were monitored by thin layer chromatography (TLC) analyses. Homogeneous reactions: (a) Bulk HPA (12mg), diphenyl sulfide (Aldrich, 1mmol, 186mg), and ethanol (Soria, 4mL) were stirred at 25°C. Then aqueous H2O2, 35% (w/v) (1.5 mmol, 0.15mL), was added. The progress of the reaction was monitored by TLC. After the end point of reaction, it was treated with dichloromethane and water (2×3mL). The organic phase was dried on anhydrous Na2SO4 and concentrated to obtain diphenyl sulfoxide. (b) Diphenyl sulfone was obtained using bulk HPA (12mg), diphenyl sulfide (Aldrich, 1 mmol, 186mg), 35% (w/v) H2O2 (7.5 mmol, 0.75mL), and ethanol (Soria, 4mL) at 50°C. 2.3.2 Heterogeneous reactions (a) Supported catalyst (50mg), diphenyl sulfide (Aldrich, 1 mmol, 186mg), and ethanol (Soria, 4mL) were stirred at 25°C. Then 35% (w/v) H2O2 (1.5 mmol, 0.15mL) was added. The progress of the reaction was monitored by TLC. After the reaction end point, the catalyst was recovered by centrifugation and washed with dichloromethane. The reaction mixture was treated with dichloromethane and water (2×3mL). The organic phase was dried on anhydrous Na2SO4 and concentrated to obtain diphenyl sulfoxide.(b) Equally, diphenyl sulfone was obtained using 0.75mL of H2O2 35% (w/v) at 50°C. The performance of the catalysts was evaluated quantitatively by the conversion of diphenyl sulfide (Conv.%), and the selectivity of diphenyl sulfoxide and diphenyl sulfone (Sel.%). 3 Results and discussion 3.1 Characterization of catalysts Many heteropolycompounds with Keggin structure present high acidity. Therefore, they can be used to catalyze attractive reactions. For example, they can be used to replace classical acids, such as sulfuric acid, with some advantages, such as a lower corrosion and a lower production of wastes, thus leading to eco-efficient processes [22]. In the Keggin structure there are four oxygen types: Oa surrounds the central tetrahedral P, and links P and Mo together; Ob connects MoO6 octahedra by the corners; Oc shares the octahedra edges; and terminal oxygen Od is bonded to only one Mo atom. Each Keggin anion [XM12O40]3− can be inscribed into a sphere of center X and radius close to 0.52nm [23] (radius=mean of the 12X–Od distances, and X=P in our case). M atoms are located at the corners of an octahedron cube, which are just moved from centers of the side of the associated cube. Although the [PMo12O40]3− anion is compact, it can accommodate heteroatoms that differ greatly in size of M (Mo in our case) shown by the range of covalent radius for atoms such as 0.82Å (B) to 1.70Å (Bi). Then, PMoB, PMoBi, PMoLa, and PMoY can present interesting characteristics as catalysts since they can have Lewis and/or Brønsted acidity. To the best of our knowledge, their real structure has been characterized by different techniques. Table 1 shows the atomic properties of Mo, B, Bi, La, and Y as elements, which were used to replace one Mo atom in the Keggin primary or secondary structures [24]. Taking into account the atomic mass, it could be supposed that Y incorporation produces less structural modifications in the Keggin primary structure (for example, bond between O or Mo addenda), given that both Mo and Y have similar atomic mass (Table 1, entries 1 and 3). The extreme behavior is presented by B and Bi (Table 1, entries 2 and 5); they show values of 10.81, almost nine times smaller than Mo, and Bi, with 208.98, is twice higher than Mo. With respect to the ionic radius (Table 1) it might be said that 3 B atoms are necessary to replace one Mo, if not just one La can take the place of one Mo. This supposes a strong effect on the bond that is opposite to the electronegativity of doping metals. In this regard, Bi and B have electronegativity similar to that of Mo, while La and Y present similar values. The above-mentioned properties are very important in the preparation of HPA as redox catalysts since the identification of the species present in the impregnating solutions is particularly significant. For this reason, the elemental analysis of synthesized HPA by ICP-AES was performed and is summarized in Table 2 . This confirmed that one of the Mo atoms was replaced by the corresponding elements and it is possible to obtain doped HPA. The experimental values are in accordance with the theoretical values (calculated for hydrated HPA, whose hydration number was obtained by TGA). Then, with other characterization techniques, we could compare these values and conclude about the nature of the present species. Fig. 1 shows the FTIR spectra of the all synthesized bulk HPAs. The main characteristic features of the H3PMo12O40 (MPA) spectrum (marked lines in the figure) are bands at 1064cm−1 (POa), 964cm−1 (MoOd), 871cm−1 (MoOb Mo), 784cm−1 (MoOc Mo) [19]. When another atom is introduced in the MPA structure, the same characteristic bands appear in the spectra, which confirm the Keggin primary structure, but the difference in length of the bonds could be introducing defects into the original spectrum of MPA. Here it is important to consider the atomic properties of B, Bi, La and Y. However, small displacements take place in some bands (Table 3 ), in particular PMoLa and PMoY in relation to 964cm−1 (MoOd) and 871cm−1 (MoOb Mo) bonds of the H3PMo12O40 spectrum. It is possible that La, with an atomic mass of 138.91, introduces a steric factor in the MoOb bond, in addition to the small electronegativity of Mo, modifying the MoOd bond. In relation to PMoY, for the previously mentioned bonds, the atomic mass is very close to that of Mo, but the electronegativity is smaller than that of Mo (1.2) although the splitting shown for MoOb Mo could be due to different reasons during the incorporation of Y into the primary structure. They are usually attributed to vibrations of the bridges between “inter” (MoOb Mo) and “intra” (MoOc Mo) groups (Mo3O13). Therefore, for the assignment of each of the bands to two vibration bridges it would be reasonable to consider these two groups as pairs of vibrations of bridge building. Nevertheless, in order to simplify, the two frequencies for a vibration-isolated bridge could be considered, although this is not completely exact. For a better definition of the species resulting from the interaction of both heteropolyacids with the impregnated support in equilibrium, they were characterized by FTIR. In the spectra of supported HPA some acid bands are overlapped to those of the support. The characteristic spectrum of silica shows bands at 1000, 800, and 470cm−1; there are other bands at 3400 and 1620cm−1 attributed to the stretching and bending of OH groups, respectively [7]. In relation to functionalized silica, the main differences are: the NH stretching band (3300–2600cm−1) broad peak overlapped with the silanol stretching bands of silica and CH2 groups. The small shoulders at the 3000–2750cm−1 region can be assigned to CH stretching of APS. Also, the functionalizing agent used in the grafting process presents a strong band at the 1110–1050cm−1 region attributed to SiOC aliphatic groups, which is observed as a transmittance increase of the silica band in the functionalized support. In addition, the APS band at 790cm−1 is present without overlapping and a transmittance increase at 550cm−1 can be seen on the silica band [25]. The FTIR spectra of bulk PMoY and supported on S and S-NH2 are shown in Fig. 2 to compare the active phase–support interaction. PMoY–S shows masking in the 1100cm−1 zone, the band at 951 and 794cm−1 as an increase in intensity and a nonoverlapping band at 869cm−1. This last band indicates a good interaction between silanols of silica and HPA protons. During the impregnation, an electrostatic interaction is generated, and the HPAs maintain the primary structure. However, when water is incorporated to the support, the Keggin structure can undergo changes and the band at 1100cm−1 (POa) could be split into two bands. N2 adsorption tests were used to make a textural characterization of the catalysts, and the results (S BET (m2/g), pore volume (cm3/g), and pore size (Å)) are listed in Table 4 . For different types of silica impregnation, the textural characterization results show that impregnation causes a sharp decrease in microporosity, and therefore, in the support surface area, as in PMoB–S (Table 4, entry 2). This is due to a strong HPA diffusion during the impregnation and a small interaction with the support surface. For PMoY–S (Table 4, entry 5), the value of S BET is very similar to that of silica (287m2/g); the value obtained for PMoBi–S (Table 4, entry 3) is higher than that of the support. This could be because of the formation of HPA clusters on the surface, without diffusion into the silica. When NH2–S is used as support, the S BET values of the catalysts are higher than those of functionalized silica. This indicates that there is a big HPA interaction between NH2 groups and HPA proton. Anyway, these values are small and very close to those of pure Keggin heteropolyacids, conceivably for the reasons previously mentioned. In this point, we reported values of different supports (near 4m2/g), with the objective of obtaining a comparative grade. Before studying the acidic properties, the colors of solids and solutions were determined and are listed in Table 5 . The supports are white in both cases. But impregnated catalysts present different coloration for each HPA. This property is close to the internal redox reaction of HPA when Mo is an addenda atom and is indicative of the interaction between HPA and the surface. For example, after the contact with S, the solution has the same color as bulk HPA, but when the HPAs were supported on functionalized silica, after the impregnation the solutions were colorless. To color solids, a potentiometric method was developed; the measured potential difference is mainly determined by the acidic environment that is around the electrode membrane [3]. In this method, the measured potential difference is mainly determined by the acidic environment around the electrode membrane. The measured electrode potential is an indicator of the surface acidic properties of the dispersed solid particles. An aliphatic amine, such as n-butylamine, with a basic dissociation constant of 10−6, allows the potentiometric titration of strong acids. It was suggested that the initial electrode potential (E i) indicates the maximum strength of the acid sites, and the value of meq. amine/g solid where the plateau is reached indicates the total number of acid sites present in the titrated solid [26]. Acidity of the HPA is purely Brønsted in nature. The potentiometric curves obtained by titration with n-butylamine of the bulk HPA are presented in Fig. 3 . MPA, PMoBi, PMoB and PMoY show very strong acid sites, whereas PMoLa does not have any acid site; its acid strength is much lower than that of the other HPAs. The acid strength of the HPA is related to proton mobility, which in part depends on the negative charge distribution in the heteropolyanion oxygens [4]. In addition, all the supported HPAs do not present acid sites, and the acid strength is lower than that determined for bulk HPA; as an example the curves obtained for PMoY–S and PMoY–NH2–S, in comparison with the corresponding bulk PMoY, are presented in Fig. 3d. The acid strengths of bulk and supported HPAs are included in Table 6 . With regard to acidity measurements of supported HPAs, they present a higher acid strength than the support (74 and −1mV for S and NH2–S, respectively) but the number of acid sites is almost none. This behavior is related to the different interaction of HPA with silica, which was observed from the adsorption isotherms of both HPAs on the support [10]. During the contact between the solution and S, a proton transfer to the silanol groups and an electrostatic interaction of the [PMo11MO40]3− anion with the protonated silanols take place. In short, the protons are less anchored to the support for the HPA–S catalyst than for HPA–NH2–S, due to the weak interaction of HPA and low adsorbed concentration [8]. The supported HPAs present a decrease of the acid strength and the acid sites due to the interaction with the silica. This effect is stronger when functionalized silica is used (Table 6). Fig. 4 shows UV–visible spectra of the solutions between the HPA solution and the support after 72h. The band attributed to oxygen-metal transfers at 210–230nm can be seen in all the spectra. Also in S impregnation, another band that extends from 240 up to 545nm is observed. In S-supported catalysts the band near 600nm is assigned to the heteropoly blue of Mo species, and this HPA structure changes the color of both the solid and the solution. In addition, this indicates Mo in octahedral position in the Keggin structure. The HPA solution has different colors after the contact with silica and functionalized silica, and it is possible that the initial species no longer exist, which is indicative of very interesting redox properties for their performance as catalysts. 3.2 Catalytic test Initially, the catalytic performance of the different bulk synthesized heteropolyacids was evaluated in a homogeneous oxidation reaction. The oxidation of diphenyl sulfide with aqueous hydrogen peroxide (35%, w/v) was selected as the model reaction (Scheme 2 ). Ethanol was chosen as reaction solvent because it gives a homogeneous phase with the reagents and it is a nontoxic and safe solvent. We first screened the selective oxidation of diphenyl sulfide to diphenyl sulfoxide using the different catalysts (Table 7 ). The blank experiment was performed in the absence of the catalyst using an almost stoichiometric amount of aqueous H2O2 (35%, w/v; 0.15mL, 1.5 mmol). Under these conditions, the reaction conversion was very low (5% for 7h), at 25°C (Table 7, entry 1), but when the HPA is added, the conversion increases to values close to 60%. Under these conditions, PMoB and PMoY showed the best performance. When PMoB was used (Table 7, entry 3), a conversion of 64% was observed at 7h, with 100% of sulfoxide selectivity. Similarly, PMoY showed a conversion and selectivity of 60% and 100%, respectively, in this time period (Table 7, entry 6). Under the same reaction conditions, commercial MPA only gives a sulfoxide selectivity of 89% (Table 7, entry 2). In all experiments performed, the new synthesized catalyst showed more activity and selectivity in the diphenyl sulfide oxidation to sulfoxide than the corresponding commercial MPA. Similarly, we performed the selective oxidation of diphenyl sulfide to diphenyl sulfone using an excess of H2O2 (35%, w/v; 0.7mL, 7mmol) at 50°C. Under these conditions it is possible to obtain diphenyl sulfone selectively and the results at different reaction times are summarized in Table 8 . PMoY presented the best performance in short reaction times. When this catalyst is used (Table 8, entry 5), a conversion of 76% is observed at 0.5h with a 63% of sulfone selectivity. All the catalysts, except PMoLa, showed 100% of sulfone selectivity after 8h (Table 8, entries 1–5). Even though the HPAs show a good performance in this reaction, the bulk HPAs are completely soluble in the reaction medium, and their isolation and reuse are difficult. In order to carry out the reaction in heterogeneous conditions, some more active HPAs were supported on silica. Table 9 lists the results obtained using PMoB, PMoBi and PMoY supported on silica (PMoB–S, PMoBi–S, and PMoY–S) in the selective diphenyl sulfide oxidation to diphenyl sulfoxide at 25°C. Silica-supported MPA was studied previously in the selective oxidation of sulfide to sulfones [27]. The yttrium catalyst supported on silica (PMoY) shows the best performance. When this catalyst is used under the selective diphenyl sulfide oxidation to sulfoxide conditions, a conversion of 79% is observed at 10h, with a 95% of sulfoxide selectivity (Table 9, entry 3). After the reaction ended, the catalyst was isolated by centrifugation and reused under the same conditions. However, a lower conversion than in the first use was obtained (Table 9, entry 4), due to the leaching of HPA from the silica support in the reaction media. To avoid the leaching of HPA, amino-functionalized silica was used as support. These catalysts were tested in the diphenyl sulfide oxidation at 25°C employing a nearly stoichiometric amount of aqueous 35% H2O2 (0.15mL, 1.5mmol), for 1 mmol of substrate. Fig. 5 a shows diphenyl sulfide conversion as a function of time of three representative catalysts: PMoB–NH2–S, PMoBi–NH2–S, and PMoY–NH2–S. In the three cases, the catalytic activity decreases compared with the use of bulk catalyst; these catalysts have the advantage of being insoluble in the mixture reaction. The reaction time required for reaching the maximum conversion was 20h, after that, sulfide conversion remained constant. The best two catalysts for the reaction performed were PMoY–NH2–S and PMoB–NH2–S, contrary to the use of PMoBi–NH2–S that gives lower conversion. For example, PMoY–NH2–S showed the best performance (52%, 20h) and PMoBi–NH2–S gave only 27% at 10h (Fig. 5a). With regard to the selectivity toward diphenyl sulfoxide, the three catalysts presented similar results. The highest values are achieved at 20h of reaction, and selectivity decreases due to diphenyl sulfone formation (Fig. 5b). With the objective of obtaining diphenyl sulfone selectivity, the catalytic activity of selected HPAs was tested at 50°C using an excess of aqueous H2O2. The best activity was obtained for PMoB–NH2–S and PMoY–NH2–S, in short times (results not shown). In addition, PMoY–NH2–S presented the best performance for diphenyl sulfone selectivity. Due to the need to obtain a catalyst for green processes, the use of a recycled catalyst is required for reducing the catalytic cost. PMoY–NH2–S was selected to prove reusability under the same reaction conditions. When the reaction was completed, the catalyst (insoluble) was filtered, dried in vacuum (20°C), and reused. The catalyst was used and reused for three cycles with similar activity. Fig. 6 presents the conversion of diphenyl sulfide as a time function for the use and reuses, and no appreciable loss of activity is shown after three cycles. The catalyst prepared using hydrogen peroxide during the impregnation, PMoY–NH2–S(P), was tested in the diphenyl sulfide oxidation to diphenyl sulfone at 50°C using an excess of aqueous H2O2. The results are similar to that obtained with PMoY–NH2–S under the same conditions: 100% sulfide conversion is reached at 4h, for both catalysts. However, sulfone selectivity is slightly higher for PMoY–NH2–S than for PMoY–NH2–S(P) at 4h (53% and 35%, respectively), 100% of selectivity being achieved at 12h for both catalysts. PMoY–NH2–S(P) was reused and no appreciable loss of activity is shown after three cycles, as in the case where PMoY–NH2–S was employed. A plausible mechanism of this reaction involves the formation of peroxo-molibdate species and the subsequent nucleophilic attack of the sulfur atom in the sulfide on the peroxo species. Indeed, it is known that thioethers are oxidized to sulfoxides by electrophilic oxidants. Mechanistically, it is believed that the electrophilicity of the peroxide oxygen of H2O2 is increased by an oxometal group (MOd) in the HPA (Scheme 3 ) [28]. 4 Conclusions Four new HPAs with Keggin structure, based on MPA, were synthesized and their structure was investigated by diverse techniques. These Keggin-type HPAs were used as catalysts in the diphenyl sulfide oxidation to diphenyl sulfoxide or diphenyl sulfone, with the eco-friendly H2O2 as oxidant. The replacement of one Mo by another atom in the Keggin structure enhances the catalytic activity of HPA with respect to commercial MPA, due to different properties of the doping atoms, such as electronegativity. With the purpose of recovering the catalyst more easily after the reaction and developing a green process, the HPAs were supported on silica and amino-functionalized silica, by the equilibrium adsorption technique. The supported HPAs on amino-functionalized silica were reused without loss of their catalytic activity after three reaction cycles. This indicates the HPA is strongly attached to this support. The main advantages of this procedure are the operational simplicity, the cleanness of reaction, and the very good yields attained. This process can be extended to other aryl-alkyl sulfides. Using an excess of aqueous H2O2, the reaction is highly selective and proceeds in high yield to sulfone, providing an excellent synthesis method of such compounds. PMoY, chosen for its performance in the reaction system, was impregnated on NH2–S using H2O2 (PMoY–NH2–S(P)) and was tested in the diphenyl sulfide oxidation to sulfone, just to compare the behavior of HPA during impregnation. Although the results from the studied reaction do not show a great improvement, this new method of impregnation is being investigated by our group. Acknowledgments The authors thank E. Soto and D. Peña for their experimental contribution for the measurements of S BET and, GC respectively; and CONICET and UNLP for their financial support. References [1] B. Török Á. Molnár N. Balogh I. Kiricsi I. Pálinkó L.I. Horváth Appl. Catal. A: Gen. 158 1997 L17 L25 [2] J.F. Keggin Proc. R. Soc. Lond. A 144 1934 75 100 [3] G. Romanelli P. Vázquez N. Quaranta L. Pizzio J. Autino M. Blanco C. Cáceres Appl. Catal. A: Gen. 261 2004 163 170 [4] G.P. Romanelli J.C. Autino M.N. Blanco L.R. Pizzio Appl. Catal. A: Gen. 295 2005 209 215 [5] C. Hu M. Hashimoto T. Okuhara M. Misono J. Catal. 143 1993 437 448 [6] A.G. Sathicq G.P. Romanelli V. Palermo P.G. Vázquez H.J. Thomas Tetrahedron Lett. 49 2008 1441 1444 [7] P. Vázquez L. Pizzio C. Cáceres M. Blanco H. Thomas E. Alesso L. Finkielsztein B. Lantaño G. Moltrasio J. Aguirre J. Mol. Catal. A: Chem. 161 2000 223 232 [8] P. Vazquez L. Pizzio G. Romanelli J. Autino C. Cáceres M. Blanco Appl. Catal. A: Gen. 235 2002 233 240 [9] G.I. Kapustin T.R. Brueva A.L. Klyachko M.N. Timofeeva S.M. Kulikov I.V. Kozhevnikov Kinet. Katal. 31 1991 896 898 [10] P.G. Vázquez M.N. Blanco C.V. Cáceres Catal. Lett. 60 1999 205 215 [11] L.R. Pizzio C.V. Cáceres M.N. Blanco Appl. Catal. A: Gen. 167 1998 283 294 [12] L.R. Pizzio C.V. Cáceres M.N. Blanco J. Colloid Interface Sci. 190 1997 318 326 [13] F. Bonadies F. De Angelis L. Locati A. Scettri Tetrahedron Lett. 37 1996 7129 7130 [14] K. Kaczorowska Z. Kolarska K. Mitka P. Kowalski Tetrahedron 61 2005 8315 8327 [15] V. Palermo A.G. Sathicq P.G. Vázquez H.J. Thomas G.P. Romanelli React. Kinet. Mech. Catal. 104 2011 181 195 [16] B.M. Trost Chem. Rev. 78 1978 363 382 [17] M.C. Carreño Chem. Rev. 95 1995 1717 1760 [18] B. Karimi M. Ghoreishi-Nezhard J.H. Clark Org. Lett. 7 2005 625 628 [19] C. Rocchiccioli-Deltcheff M. Amirouche M. Che J.M. Tatibouët M. Fournier J. Catal. 125 1990 292 310 [20] A. Tarlani M. Abedini A. Nemati M. Khabaz M.M. Amini J. Colloid Interface Sci. 303 2006 32 38 [21] P. Villabrille G. Romanelli P. Vázquez C. Cáceres Appl. Catal. A: Gen. 270 2004 101 111 [22] V.M. Fuchs L.R. Pizzio M.N. Blanco Catal. Today 133–135 2008 181 186 [23] C. Rocchiccioli-Deltcheff M. Fournier R. Franck R. Thouvenot Inorg. Chem. 22 1983 207 216 [24] http://www.lenntech.com/espanol/tabla-periodica.htm (November 2012). [25] L. Pizzio G. Romanelli P. Vázquez J. Autino M. Blanco C. Cáceres Appl. Cat. A: Gen. 308 2006 153 160 [26] S.G. Casuscelli M.E. Crivello C.F. Perez G. Ghione E.R. Herrero L.R. Pizzio P.G. Vázquez C.V. Cáceres M.N. Blanco Appl. Catal. A: Gen. 274 2004 115 122 [27] V. Palermo G.P. Romanelli P.G. Vázquez Phosphorus, Sulfur Silicon Relat. Elem. 184 2009 3258 3268 [28] A.L. Maciuca C.E. Ciocan E. Dumitriu F. Fajula V. Hulea Catal. Today 138 2008 33",
      "scopus-id": "84876934819",
      "coredata": {
        "eid": "1-s2.0-S1381116913001039",
        "dc:description": "Heteropolyacids are used as redox catalysts due to their bifunctional properties. Some advantages over conventional catalysts, such as selectivity, easy isolation and reuse, are worth noting. In homogeneous conditions their isolation and recycling can be harder, so that they are supported for their use as heterogeneous catalysts. In this work, we compare the catalytic activity of different heteropolyacids with Keggin structure, supported on pure and functionalized silica (with 3-aminopropyltrimethoxysilane). H6PMo11BO40, H6PMo11BiO40, H6PMo11LaO40, and H6PMo11YO40 were synthesized, supported and characterized by several physicochemical techniques. Highly selective results were obtained in the selective oxidation of diphenyl sulfide to diphenyl sulfoxide or diphenyl sulfone. Besides, these catalysts can be reused. The above-mentioned reaction is useful due to the importance of these compounds as intermediates in the synthesis of biologically significant molecules.",
        "openArchiveArticle": "false",
        "prism:coverDate": "2013-07-31",
        "openaccessUserLicense": null,
        "prism:aggregationType": "Journal",
        "prism:url": "https://api.elsevier.com/content/article/pii/S1381116913001039",
        "dc:creator": [
          {
            "@_fa": "true",
            "$": "Palermo, Valeria"
          },
          {
            "@_fa": "true",
            "$": "Romanelli, Gustavo P."
          },
          {
            "@_fa": "true",
            "$": "Vázquez, Patricia G."
          }
        ],
        "link": [
          {
            "@_fa": "true",
            "@rel": "self",
            "@href": "https://api.elsevier.com/content/article/pii/S1381116913001039"
          },
          {
            "@_fa": "true",
            "@rel": "scidir",
            "@href": "https://www.sciencedirect.com/science/article/pii/S1381116913001039"
          }
        ],
        "dc:format": "application/json",
        "openaccessType": null,
        "pii": "S1381-1169(13)00103-9",
        "prism:volume": "373",
        "prism:publisher": "Elsevier B.V. Published by Elsevier B.V.",
        "dc:title": "Mo-based Keggin heteropolyacids as catalysts in the green and selective oxidation of diphenyl sulfide",
        "prism:copyright": "Copyright © 2013 Elsevier B.V. Published by Elsevier B.V. All rights reserved.",
        "openaccess": "0",
        "prism:issn": "13811169",
        "dcterms:subject": [
          {
            "@_fa": "true",
            "$": "Green selective oxidation"
          },
          {
            "@_fa": "true",
            "$": "Diphenyl sulfide"
          },
          {
            "@_fa": "true",
            "$": "Supported heteropolyacid"
          },
          {
            "@_fa": "true",
            "$": "Keggin heteropolyacid"
          }
        ],
        "openaccessArticle": "false",
        "prism:publicationName": "Journal of Molecular Catalysis A: Chemical",
        "openaccessSponsorType": null,
        "prism:pageRange": "142-150",
        "prism:endingPage": "150",
        "pubType": "fla",
        "prism:coverDisplayDate": "July 2013",
        "prism:doi": "10.1016/j.molcata.2013.03.002",
        "prism:startingPage": "142",
        "dc:identifier": "doi:10.1016/j.molcata.2013.03.002",
        "openaccessSponsorName": null
      },
      "objects": {
        "object": [
          {
            "@category": "high",
            "@height": "886",
            "@width": "1398",
            "@_fa": "true",
            "$": "https://api.elsevier.com/content/object/eid/1-s2.0-S1381116913001039-fx1_lrg.jpg?httpAccept=%2A%2F%2A",
            "@multimediatype": "JPEG image file",
            "@type": "IMAGE-HIGH-RES",
            "@size": "162006",
            "@ref": "fx1",
            "@mimetype": "image/jpeg"
          },
          {
            "@category": "high",
            "@height": "728",
            "@width": "1250",
            "@_fa": "true",
            "$": "https://api.elsevier.com/content/object/eid/1-s2.0-S1381116913001039-sc3_lrg.jpg?httpAccept=%2A%2F%2A",
            "@multimediatype": "JPEG image file",
            "@type": "IMAGE-HIGH-RES",
            "@size": "58105",
            "@ref": "sc3",
            "@mimetype": "image/jpeg"
          },
          {
            "@category": "high",
            "@height": "417",
            "@width": "2925",
            "@_fa": "true",
            "$": "https://api.elsevier.com/content/object/eid/1-s2.0-S1381116913001039-sc2_lrg.jpg?httpAccept=%2A%2F%2A",
            "@multimediatype": "JPEG image file",
            "@type": "IMAGE-HIGH-RES",
            "@size": "114978",
            "@ref": "sc2",
            "@mimetype": "image/jpeg"
          },
          {
            "@category": "high",
            "@height": "955",
            "@width": "2508",
            "@_fa": "true",
            "$": "https://api.elsevier.com/content/object/eid/1-s2.0-S1381116913001039-sc1_lrg.jpg?httpAccept=%2A%2F%2A",
            "@multimediatype": "JPEG image file",
            "@type": "IMAGE-HIGH-RES",
            "@size": "124806",
            "@ref": "sc1",
            "@mimetype": "image/jpeg"
          },
          {
            "@category": "high",
            "@height": "1091",
            "@width": "1583",
            "@_fa": "true",
            "$": "https://api.elsevier.com/content/object/eid/1-s2.0-S1381116913001039-gr6_lrg.jpg?httpAccept=%2A%2F%2A",
            "@multimediatype": "JPEG image file",
            "@type": "IMAGE-HIGH-RES",
            "@size": "99674",
            "@ref": "gr6",
            "@mimetype": "image/jpeg"
          },
          {
            "@category": "high",
            "@height": "2260",
            "@width": "1591",
            "@_fa": "true",
            "$": "https://api.elsevier.com/content/object/eid/1-s2.0-S1381116913001039-gr5_lrg.jpg?httpAccept=%2A%2F%2A",
            "@multimediatype": "JPEG image file",
            "@type": "IMAGE-HIGH-RES",
            "@size": "254284",
            "@ref": "gr5",
            "@mimetype": "image/jpeg"
          },
          {
            "@category": "high",
            "@height": "1158",
            "@width": "1583",
            "@_fa": "true",
            "$": "https://api.elsevier.com/content/object/eid/1-s2.0-S1381116913001039-gr4_lrg.jpg?httpAccept=%2A%2F%2A",
            "@multimediatype": "JPEG image file",
            "@type": "IMAGE-HIGH-RES",
            "@size": "191017",
            "@ref": "gr4",
            "@mimetype": "image/jpeg"
          },
          {
            "@category": "high",
            "@height": "2446",
            "@width": "2938",
            "@_fa": "true",
            "$": "https://api.elsevier.com/content/object/eid/1-s2.0-S1381116913001039-gr3_lrg.jpg?httpAccept=%2A%2F%2A",
            "@multimediatype": "JPEG image file",
            "@type": "IMAGE-HIGH-RES",
            "@size": "384009",
            "@ref": "gr3",
            "@mimetype": "image/jpeg"
          },
          {
            "@category": "high",
            "@height": "1174",
            "@width": "1667",
            "@_fa": "true",
            "$": "https://api.elsevier.com/content/object/eid/1-s2.0-S1381116913001039-gr2_lrg.jpg?httpAccept=%2A%2F%2A",
            "@multimediatype": "JPEG image file",
            "@type": "IMAGE-HIGH-RES",
            "@size": "160810",
            "@ref": "gr2",
            "@mimetype": "image/jpeg"
          },
          {
            "@category": "high",
            "@height": "2078",
            "@width": "1429",
            "@_fa": "true",
            "$": "https://api.elsevier.com/content/object/eid/1-s2.0-S1381116913001039-gr1_lrg.jpg?httpAccept=%2A%2F%2A",
            "@multimediatype": "JPEG image file",
            "@type": "IMAGE-HIGH-RES",
            "@size": "199924",
            "@ref": "gr1",
            "@mimetype": "image/jpeg"
          },
          {
            "@category": "standard",
            "@height": "200",
            "@width": "315",
            "@_fa": "true",
            "$": "https://api.elsevier.com/content/object/eid/1-s2.0-S1381116913001039-fx1.jpg?httpAccept=%2A%2F%2A",
            "@multimediatype": "JPEG image file",
            "@type": "IMAGE-DOWNSAMPLED",
            "@size": "18003",
            "@ref": "fx1",
            "@mimetype": "image/jpeg"
          },
          {
            "@category": "standard",
            "@height": "164",
            "@width": "282",
            "@_fa": "true",
            "$": "https://api.elsevier.com/content/object/eid/1-s2.0-S1381116913001039-sc3.jpg?httpAccept=%2A%2F%2A",
            "@multimediatype": "JPEG image file",
            "@type": "IMAGE-DOWNSAMPLED",
            "@size": "15954",
            "@ref": "sc3",
            "@mimetype": "image/jpeg"
          },
          {
            "@category": "standard",
            "@height": "94",
            "@width": "661",
            "@_fa": "true",
            "$": "https://api.elsevier.com/content/object/eid/1-s2.0-S1381116913001039-sc2.jpg?httpAccept=%2A%2F%2A",
            "@multimediatype": "JPEG image file",
            "@type": "IMAGE-DOWNSAMPLED",
            "@size": "16791",
            "@ref": "sc2",
            "@mimetype": "image/jpeg"
          },
          {
            "@category": "standard",
            "@height": "216",
            "@width": "566",
            "@_fa": "true",
            "$": "https://api.elsevier.com/content/object/eid/1-s2.0-S1381116913001039-sc1.jpg?httpAccept=%2A%2F%2A",
            "@multimediatype": "JPEG image file",
            "@type": "IMAGE-DOWNSAMPLED",
            "@size": "19386",
            "@ref": "sc1",
            "@mimetype": "image/jpeg"
          },
          {
            "@category": "standard",
            "@height": "246",
            "@width": "357",
            "@_fa": "true",
            "$": "https://api.elsevier.com/content/object/eid/1-s2.0-S1381116913001039-gr6.jpg?httpAccept=%2A%2F%2A",
            "@multimediatype": "JPEG image file",
            "@type": "IMAGE-DOWNSAMPLED",
            "@size": "12320",
            "@ref": "gr6",
            "@mimetype": "image/jpeg"
          },
          {
            "@category": "standard",
            "@height": "510",
            "@width": "359",
            "@_fa": "true",
            "$": "https://api.elsevier.com/content/object/eid/1-s2.0-S1381116913001039-gr5.jpg?httpAccept=%2A%2F%2A",
            "@multimediatype": "JPEG image file",
            "@type": "IMAGE-DOWNSAMPLED",
            "@size": "30083",
            "@ref": "gr5",
            "@mimetype": "image/jpeg"
          },
          {
            "@category": "standard",
            "@height": "261",
            "@width": "357",
            "@_fa": "true",
            "$": "https://api.elsevier.com/content/object/eid/1-s2.0-S1381116913001039-gr4.jpg?httpAccept=%2A%2F%2A",
            "@multimediatype": "JPEG image file",
            "@type": "IMAGE-DOWNSAMPLED",
            "@size": "20880",
            "@ref": "gr4",
            "@mimetype": "image/jpeg"
          },
          {
            "@category": "standard",
            "@height": "552",
            "@width": "663",
            "@_fa": "true",
            "$": "https://api.elsevier.com/content/object/eid/1-s2.0-S1381116913001039-gr3.jpg?httpAccept=%2A%2F%2A",
            "@multimediatype": "JPEG image file",
            "@type": "IMAGE-DOWNSAMPLED",
            "@size": "43505",
            "@ref": "gr3",
            "@mimetype": "image/jpeg"
          },
          {
            "@category": "standard",
            "@height": "265",
            "@width": "376",
            "@_fa": "true",
            "$": "https://api.elsevier.com/content/object/eid/1-s2.0-S1381116913001039-gr2.jpg?httpAccept=%2A%2F%2A",
            "@multimediatype": "JPEG image file",
            "@type": "IMAGE-DOWNSAMPLED",
            "@size": "19983",
            "@ref": "gr2",
            "@mimetype": "image/jpeg"
          },
          {
            "@category": "standard",
            "@height": "468",
            "@width": "322",
            "@_fa": "true",
            "$": "https://api.elsevier.com/content/object/eid/1-s2.0-S1381116913001039-gr1.jpg?httpAccept=%2A%2F%2A",
            "@multimediatype": "JPEG image file",
            "@type": "IMAGE-DOWNSAMPLED",
            "@size": "23523",
            "@ref": "gr1",
            "@mimetype": "image/jpeg"
          },
          {
            "@category": "thumbnail",
            "@height": "139",
            "@width": "219",
            "@_fa": "true",
            "$": "https://api.elsevier.com/content/object/eid/1-s2.0-S1381116913001039-fx1.sml?httpAccept=%2A%2F%2A",
            "@multimediatype": "GIF image file",
            "@type": "IMAGE-THUMBNAIL",
            "@size": "9717",
            "@ref": "fx1",
            "@mimetype": "image/gif"
          },
          {
            "@category": "thumbnail",
            "@height": "128",
            "@width": "219",
            "@_fa": "true",
            "$": "https://api.elsevier.com/content/object/eid/1-s2.0-S1381116913001039-sc3.sml?httpAccept=%2A%2F%2A",
            "@multimediatype": "GIF image file",
            "@type": "IMAGE-THUMBNAIL",
            "@size": "2052",
            "@ref": "sc3",
            "@mimetype": "image/gif"
          },
          {
            "@category": "thumbnail",
            "@height": "31",
            "@width": "219",
            "@_fa": "true",
            "$": "https://api.elsevier.com/content/object/eid/1-s2.0-S1381116913001039-sc2.sml?httpAccept=%2A%2F%2A",
            "@multimediatype": "GIF image file",
            "@type": "IMAGE-THUMBNAIL",
            "@size": "1027",
            "@ref": "sc2",
            "@mimetype": "image/gif"
          },
          {
            "@category": "thumbnail",
            "@height": "83",
            "@width": "219",
            "@_fa": "true",
            "$": "https://api.elsevier.com/content/object/eid/1-s2.0-S1381116913001039-sc1.sml?httpAccept=%2A%2F%2A",
            "@multimediatype": "GIF image file",
            "@type": "IMAGE-THUMBNAIL",
            "@size": "1496",
            "@ref": "sc1",
            "@mimetype": "image/gif"
          },
          {
            "@category": "thumbnail",
            "@height": "151",
            "@width": "219",
            "@_fa": "true",
            "$": "https://api.elsevier.com/content/object/eid/1-s2.0-S1381116913001039-gr6.sml?httpAccept=%2A%2F%2A",
            "@multimediatype": "GIF image file",
            "@type": "IMAGE-THUMBNAIL",
            "@size": "3658",
            "@ref": "gr6",
            "@mimetype": "image/gif"
          },
          {
            "@category": "thumbnail",
            "@height": "163",
            "@width": "115",
            "@_fa": "true",
            "$": "https://api.elsevier.com/content/object/eid/1-s2.0-S1381116913001039-gr5.sml?httpAccept=%2A%2F%2A",
            "@multimediatype": "GIF image file",
            "@type": "IMAGE-THUMBNAIL",
            "@size": "3362",
            "@ref": "gr5",
            "@mimetype": "image/gif"
          },
          {
            "@category": "thumbnail",
            "@height": "160",
            "@width": "219",
            "@_fa": "true",
            "$": "https://api.elsevier.com/content/object/eid/1-s2.0-S1381116913001039-gr4.sml?httpAccept=%2A%2F%2A",
            "@multimediatype": "GIF image file",
            "@type": "IMAGE-THUMBNAIL",
            "@size": "5194",
            "@ref": "gr4",
            "@mimetype": "image/gif"
          },
          {
            "@category": "thumbnail",
            "@height": "164",
            "@width": "197",
            "@_fa": "true",
            "$": "https://api.elsevier.com/content/object/eid/1-s2.0-S1381116913001039-gr3.sml?httpAccept=%2A%2F%2A",
            "@multimediatype": "GIF image file",
            "@type": "IMAGE-THUMBNAIL",
            "@size": "4232",
            "@ref": "gr3",
            "@mimetype": "image/gif"
          },
          {
            "@category": "thumbnail",
            "@height": "154",
            "@width": "219",
            "@_fa": "true",
            "$": "https://api.elsevier.com/content/object/eid/1-s2.0-S1381116913001039-gr2.sml?httpAccept=%2A%2F%2A",
            "@multimediatype": "GIF image file",
            "@type": "IMAGE-THUMBNAIL",
            "@size": "5205",
            "@ref": "gr2",
            "@mimetype": "image/gif"
          },
          {
            "@category": "thumbnail",
            "@height": "163",
            "@width": "112",
            "@_fa": "true",
            "$": "https://api.elsevier.com/content/object/eid/1-s2.0-S1381116913001039-gr1.sml?httpAccept=%2A%2F%2A",
            "@multimediatype": "GIF image file",
            "@type": "IMAGE-THUMBNAIL",
            "@size": "3440",
            "@ref": "gr1",
            "@mimetype": "image/gif"
          }
        ]
      },
      "link": {
        "@rel": "abstract",
        "@href": "https://api.elsevier.com/content/abstract/scopus_id/84876934819"
      }
    }
  }
}