{
  "metadata": {
    "title": "Carbon-supported metal-modified lacunary tungstosilicic polyoxometallates used as catalysts in the selective oxidation of sulfides",
    "authors": "; ; ",
    "journal": "Journal of Molecular Catalysis A: Chemical",
    "date": "2015-07-31",
    "doi": "10.1016/j.molcata.2015.02.021",
    "abstract": "",
    "uri": "https://api.elsevier.com/content/article/pii/S1381116915000783",
    "pii": "S1381116915000783"
  },
  "fulltext": {
    "full-text-retrieval-response": {
      "scopus-eid": "2-s2.0-84925990045",
      "originalText": "serial JL 271358 291210 291744 291790 291809 31 Journal of Molecular Catalysis A: Chemical JOURNALMOLECULARCATALYSISACHEMICAL 2015-02-26 2015-02-26 2015-04-22T20:49:40 1-s2.0-S1381116915000783 S1381-1169(15)00078-3 S1381116915000783 10.1016/j.molcata.2015.02.021 S300 S300.1 FULL-TEXT 1-s2.0-S1381116915X00069 2015-05-15T05:56:33.63776-04:00 0 0 20150701 20150731 2015 2015-02-26T02:07:15.101886Z absattachment articleinfo articletitlenorm authfirstinitialnorm authfirstsurnamenorm cid cids contenttype copyright crossmark dateloaded dateloadedtxt datesearch datesort dateupdated dco docsubtype doctype doi eid ewtransactionid hubeid indexeddate issn issnnorm itemstage itemtransactionid itemweight openaccess openarchive pg pgfirst pglast pii piinorm pubdateend pubdatestart pubdatetxt pubyr sectiontitle sortorder srctitle srctitlenorm srctype ssids alllist content subj subheadings suppl tomb volfirst volissue volumelist webpdf webpdfpagecount yearnav figure table body mmlmath acknowledge affil articletitle auth authfirstini authfull authkeywords authlast grantsponsor highlightsabst primabst ref specialabst 1381-1169 13811169 true 403 403 C Volume 403 6 27 36 27 36 201507 July 2015 2015-07-01 2015-07-31 2015 Regular Papers article fla Copyright © 2015 Elsevier B.V. All rights reserved. CARBONSUPPORTEDMETALMODIFIEDLACUNARYTUNGSTOSILICICPOLYOXOMETALLATESUSEDCATALYSTSINSELECTIVEOXIDATIONSULFIDES FRENZEL R 1 Introduction 2 Experimental 2.1 Catalyst synthesis 2.1.1 Transition metal-modified lacunary tungstosilicic polyoxometallate (TMPOM) synthesis 2.1.2 Supported catalyst synthesis 2.2 Catalyst characterization 2.2.1 FT-IR spectroscopy 2.2.2 X-ray diffraction 2.2.3 SEM analysis 2.2.4 Isopropanol decomposition 2.2.5 Temperature programmed reduction 2.3 Catalytic test 2.3.1 General remarks 2.3.2 Sample analysis 2.3.3 General procedure for the oxidation of sulfide to sulfoxide 2.3.4 General procedure for the oxidation of sulfide to sulfone 2.3.5 Electronic densities of sulfur atom determination 2.3.6 Electronic impact mass spectra of the representative compounds 3 Results and discussion 3.1 Catalyst characterization 3.2 Catalytic activity 3.2.1 Effect of the nature of the transition metal on the catalytic activity of SiW11MC samples 3.2.2 Effect of the solvent on the reaction activity 3.2.3 Effect of the reaction conditions on the selectivity 3.2.4 Reaction chemoselectivity 3.2.5 Sulfide reactivity study 4 Conclusions Acknowledgements References KIM 2004 2237 2243 S CHOUDHARY 2006 479 482 D HASANINEJAD 2010 307 316 A YADAV 2005 117 137 G KOZHEVNIKOV 2007 86 92 I MISONO 2000 1305 1311 M PIZZIO 2003 125 139 L ROMANELLI 2007 544 549 G PALERMO 2013 1375 1383 V TUNDO 2008 667 670 P PALERMO 2011 181 195 V SANCHEZ 2014 172 180 L SIMOES 1999 461 468 M ELLIS 2002 227 235 S FRENZEL 2015 123 132 R LIU 2010 2533 2536 F FERNANDEZ 2003 3651 3706 I KHENKIN 2002 4198 4199 A VAZDASILVA 2005 391 399 M ISABELZHU 2001 420 434 Y GREGORI 2008 124 127 F MOKHTARY 2012 863 868 M ZAKAVI 2012 35 38 S ROSTAMI 2013 833 838 A JAFARI 2012 3150 3155 H KON 2013 4918 4921 Y RAHIMIZADEH 2010 59 64 M TEZE 1990 85 96 A TEZE 1977 2151 2154 A TEZE 1990 96 104 A PIZZIO 1996 165 176 L VITURRO 1995 3 8 H ROCCHICCIOLIDELTCHEFF 1974 857 860 C ABOTSI 1990 79 84 G GAMELAS 1999 165 173 J SOHN 1991 349 360 J CHIMIENTI 2001 7 19 M PIZZIO 2003 265 277 L PALERMO 2013 142 150 V MACIUCA 2008 33 37 A ISHII 1988 3581 3593 Y SHAABANI 2007 1112 1116 A MACIUCA 2008 33 37 A CHELLAMANI 2006 260 267 A LINDSAYSMITH 2006 114 122 J PALERMO 2014 1 10 V ROMANELLI 2011 726 730 G CARRARO 2013 7914 7916 M CARRARO 2006 3671 3674 M YAMAURA 2013 76 80 T YAMADA 2004 4087 4096 Y KASAI 2006 4176 4184 J FRENZELX2015X27 FRENZELX2015X27X36 FRENZELX2015X27XR FRENZELX2015X27X36XR item S1381-1169(15)00078-3 S1381116915000783 1-s2.0-S1381116915000783 10.1016/j.molcata.2015.02.021 271358 2015-04-22T20:11:24.110583-04:00 2015-07-01 2015-07-31 1-s2.0-S1381116915000783-main.pdf https://s3.amazonaws.com/prod-ucs-content-store-us-east/content/pii:S1381116915000783/MAIN/application/pdf/8f0613a879de2c2878b2e8a1bc7696ce/main.pdf https://s3-eu-west-1.amazonaws.com/prod-ucs-content-store-eu-west/content/pii:S1381116915000783/MAIN/application/pdf/8f0613a879de2c2878b2e8a1bc7696ce/main.pdf main.pdf pdf true 1402279 MAIN 10 1-s2.0-S1381116915000783-main_1.png https://s3.amazonaws.com/prod-ucs-content-store-us-east/content/pii:S1381116915000783/PREVIEW/image/png/4e89908056ffbaf352dc4cea213ee00a/main_1.png https://s3-eu-west-1.amazonaws.com/prod-ucs-content-store-eu-west/content/pii:S1381116915000783/PREVIEW/image/png/4e89908056ffbaf352dc4cea213ee00a/main_1.png main_1.png png 58778 849 656 IMAGE-WEB-PDF 1 1-s2.0-S1381116915000783-si4.gif https://s3.amazonaws.com/prod-ucs-content-store-us-east/content/pii:S1381116915000783/STRIPIN/image/gif/59cf919a7602ded9debe6b9bb20fa840/si4.gif https://s3-eu-west-1.amazonaws.com/prod-ucs-content-store-eu-west/content/pii:S1381116915000783/STRIPIN/image/gif/59cf919a7602ded9debe6b9bb20fa840/si4.gif si4 si4.gif gif 358 16 73 ALTIMG 1-s2.0-S1381116915000783-si3.gif https://s3.amazonaws.com/prod-ucs-content-store-us-east/content/pii:S1381116915000783/STRIPIN/image/gif/59cf919a7602ded9debe6b9bb20fa840/si4.gif https://s3-eu-west-1.amazonaws.com/prod-ucs-content-store-eu-west/content/pii:S1381116915000783/STRIPIN/image/gif/59cf919a7602ded9debe6b9bb20fa840/si4.gif si3 si3.gif gif 358 16 73 ALTIMG 1-s2.0-S1381116915000783-si2.gif https://s3.amazonaws.com/prod-ucs-content-store-us-east/content/pii:S1381116915000783/STRIPIN/image/gif/59cf919a7602ded9debe6b9bb20fa840/si4.gif https://s3-eu-west-1.amazonaws.com/prod-ucs-content-store-eu-west/content/pii:S1381116915000783/STRIPIN/image/gif/59cf919a7602ded9debe6b9bb20fa840/si4.gif si2 si2.gif gif 358 16 73 ALTIMG 1-s2.0-S1381116915000783-si1.gif https://s3.amazonaws.com/prod-ucs-content-store-us-east/content/pii:S1381116915000783/STRIPIN/image/gif/59cf919a7602ded9debe6b9bb20fa840/si4.gif https://s3-eu-west-1.amazonaws.com/prod-ucs-content-store-eu-west/content/pii:S1381116915000783/STRIPIN/image/gif/59cf919a7602ded9debe6b9bb20fa840/si4.gif si1 si1.gif gif 358 16 73 ALTIMG 1-s2.0-S1381116915000783-sc3_lrg.jpg https://s3.amazonaws.com/prod-ucs-content-store-us-east/content/pii:S1381116915000783/sc3/HIGHRES/image/jpeg/519e59b621183b3975701cb81124076b/sc3_lrg.jpg https://s3-eu-west-1.amazonaws.com/prod-ucs-content-store-eu-west/content/pii:S1381116915000783/sc3/HIGHRES/image/jpeg/519e59b621183b3975701cb81124076b/sc3_lrg.jpg sc3 sc3_lrg.jpg jpg 142190 1276 1639 IMAGE-HIGH-RES 1-s2.0-S1381116915000783-sc2_lrg.jpg https://s3.amazonaws.com/prod-ucs-content-store-us-east/content/pii:S1381116915000783/sc2/HIGHRES/image/jpeg/b3f5ec39ded0981b72ca45b489812468/sc2_lrg.jpg https://s3-eu-west-1.amazonaws.com/prod-ucs-content-store-eu-west/content/pii:S1381116915000783/sc2/HIGHRES/image/jpeg/b3f5ec39ded0981b72ca45b489812468/sc2_lrg.jpg sc2 sc2_lrg.jpg jpg 299718 1745 2333 IMAGE-HIGH-RES 1-s2.0-S1381116915000783-sc1_lrg.jpg https://s3.amazonaws.com/prod-ucs-content-store-us-east/content/pii:S1381116915000783/sc1/HIGHRES/image/jpeg/5f395a18e978bb5bb25240b5efbb4dfb/sc1_lrg.jpg https://s3-eu-west-1.amazonaws.com/prod-ucs-content-store-eu-west/content/pii:S1381116915000783/sc1/HIGHRES/image/jpeg/5f395a18e978bb5bb25240b5efbb4dfb/sc1_lrg.jpg sc1 sc1_lrg.jpg jpg 37084 247 1274 IMAGE-HIGH-RES 1-s2.0-S1381116915000783-gr5_lrg.jpg https://s3.amazonaws.com/prod-ucs-content-store-us-east/content/pii:S1381116915000783/gr5/HIGHRES/image/jpeg/603f5507207d5d5b5771036e14b7ad7f/gr5_lrg.jpg https://s3-eu-west-1.amazonaws.com/prod-ucs-content-store-eu-west/content/pii:S1381116915000783/gr5/HIGHRES/image/jpeg/603f5507207d5d5b5771036e14b7ad7f/gr5_lrg.jpg gr5 gr5_lrg.jpg jpg 174668 1295 1635 IMAGE-HIGH-RES 1-s2.0-S1381116915000783-gr4_lrg.jpg https://s3.amazonaws.com/prod-ucs-content-store-us-east/content/pii:S1381116915000783/gr4/HIGHRES/image/jpeg/035a1380d0b2739c6308bbaf1c33d34c/gr4_lrg.jpg https://s3-eu-west-1.amazonaws.com/prod-ucs-content-store-eu-west/content/pii:S1381116915000783/gr4/HIGHRES/image/jpeg/035a1380d0b2739c6308bbaf1c33d34c/gr4_lrg.jpg gr4 gr4_lrg.jpg jpg 217758 1789 2222 IMAGE-HIGH-RES 1-s2.0-S1381116915000783-gr3_lrg.jpg https://s3.amazonaws.com/prod-ucs-content-store-us-east/content/pii:S1381116915000783/gr3/HIGHRES/image/jpeg/92634016b2ec0bf5a396e34f2e9e1d2e/gr3_lrg.jpg https://s3-eu-west-1.amazonaws.com/prod-ucs-content-store-eu-west/content/pii:S1381116915000783/gr3/HIGHRES/image/jpeg/92634016b2ec0bf5a396e34f2e9e1d2e/gr3_lrg.jpg gr3 gr3_lrg.jpg jpg 257804 1782 2382 IMAGE-HIGH-RES 1-s2.0-S1381116915000783-gr2_lrg.jpg https://s3.amazonaws.com/prod-ucs-content-store-us-east/content/pii:S1381116915000783/gr2/HIGHRES/image/jpeg/620cbe4005cd68cfb7ef40739599e9cc/gr2_lrg.jpg https://s3-eu-west-1.amazonaws.com/prod-ucs-content-store-eu-west/content/pii:S1381116915000783/gr2/HIGHRES/image/jpeg/620cbe4005cd68cfb7ef40739599e9cc/gr2_lrg.jpg gr2 gr2_lrg.jpg jpg 98073 998 844 IMAGE-HIGH-RES 1-s2.0-S1381116915000783-gr1_lrg.jpg https://s3.amazonaws.com/prod-ucs-content-store-us-east/content/pii:S1381116915000783/gr1/HIGHRES/image/jpeg/a39177f52f6052952c81a413400a65b1/gr1_lrg.jpg https://s3-eu-west-1.amazonaws.com/prod-ucs-content-store-eu-west/content/pii:S1381116915000783/gr1/HIGHRES/image/jpeg/a39177f52f6052952c81a413400a65b1/gr1_lrg.jpg gr1 gr1_lrg.jpg jpg 33887 271 1000 IMAGE-HIGH-RES 1-s2.0-S1381116915000783-fx9_lrg.jpg https://s3.amazonaws.com/prod-ucs-content-store-us-east/content/pii:S1381116915000783/fx9/HIGHRES/image/jpeg/6fe8bb3819bc2d452499bf0c94b72f8f/fx9_lrg.jpg https://s3-eu-west-1.amazonaws.com/prod-ucs-content-store-eu-west/content/pii:S1381116915000783/fx9/HIGHRES/image/jpeg/6fe8bb3819bc2d452499bf0c94b72f8f/fx9_lrg.jpg fx9 fx9_lrg.jpg jpg 11878 99 418 IMAGE-HIGH-RES 1-s2.0-S1381116915000783-fx8_lrg.jpg https://s3.amazonaws.com/prod-ucs-content-store-us-east/content/pii:S1381116915000783/fx8/HIGHRES/image/jpeg/c10ea516d8bfa19015daee6f22a9e9e3/fx8_lrg.jpg https://s3-eu-west-1.amazonaws.com/prod-ucs-content-store-eu-west/content/pii:S1381116915000783/fx8/HIGHRES/image/jpeg/c10ea516d8bfa19015daee6f22a9e9e3/fx8_lrg.jpg fx8 fx8_lrg.jpg jpg 16984 176 419 IMAGE-HIGH-RES 1-s2.0-S1381116915000783-fx7_lrg.jpg https://s3.amazonaws.com/prod-ucs-content-store-us-east/content/pii:S1381116915000783/fx7/HIGHRES/image/jpeg/062170d6cef11dc062d1a307b85dd0d9/fx7_lrg.jpg https://s3-eu-west-1.amazonaws.com/prod-ucs-content-store-eu-west/content/pii:S1381116915000783/fx7/HIGHRES/image/jpeg/062170d6cef11dc062d1a307b85dd0d9/fx7_lrg.jpg fx7 fx7_lrg.jpg jpg 18183 266 367 IMAGE-HIGH-RES 1-s2.0-S1381116915000783-fx6_lrg.jpg https://s3.amazonaws.com/prod-ucs-content-store-us-east/content/pii:S1381116915000783/fx6/HIGHRES/image/jpeg/df905cb4ee1dce426d995de528a485ba/fx6_lrg.jpg https://s3-eu-west-1.amazonaws.com/prod-ucs-content-store-eu-west/content/pii:S1381116915000783/fx6/HIGHRES/image/jpeg/df905cb4ee1dce426d995de528a485ba/fx6_lrg.jpg fx6 fx6_lrg.jpg jpg 14951 190 356 IMAGE-HIGH-RES 1-s2.0-S1381116915000783-fx5_lrg.jpg https://s3.amazonaws.com/prod-ucs-content-store-us-east/content/pii:S1381116915000783/fx5/HIGHRES/image/jpeg/6b6a1e58c08b1d9e890b72f009dd93ab/fx5_lrg.jpg https://s3-eu-west-1.amazonaws.com/prod-ucs-content-store-eu-west/content/pii:S1381116915000783/fx5/HIGHRES/image/jpeg/6b6a1e58c08b1d9e890b72f009dd93ab/fx5_lrg.jpg fx5 fx5_lrg.jpg jpg 14718 190 322 IMAGE-HIGH-RES 1-s2.0-S1381116915000783-fx4_lrg.jpg https://s3.amazonaws.com/prod-ucs-content-store-us-east/content/pii:S1381116915000783/fx4/HIGHRES/image/jpeg/e5500358fe7d367f3831a225f08d3fba/fx4_lrg.jpg https://s3-eu-west-1.amazonaws.com/prod-ucs-content-store-eu-west/content/pii:S1381116915000783/fx4/HIGHRES/image/jpeg/e5500358fe7d367f3831a225f08d3fba/fx4_lrg.jpg fx4 fx4_lrg.jpg jpg 16481 213 381 IMAGE-HIGH-RES 1-s2.0-S1381116915000783-fx3_lrg.jpg https://s3.amazonaws.com/prod-ucs-content-store-us-east/content/pii:S1381116915000783/fx3/HIGHRES/image/jpeg/7537e3f13b22da4c6a95969a1d503ce1/fx3_lrg.jpg https://s3-eu-west-1.amazonaws.com/prod-ucs-content-store-eu-west/content/pii:S1381116915000783/fx3/HIGHRES/image/jpeg/7537e3f13b22da4c6a95969a1d503ce1/fx3_lrg.jpg fx3 fx3_lrg.jpg jpg 19925 250 315 IMAGE-HIGH-RES 1-s2.0-S1381116915000783-fx2_lrg.jpg https://s3.amazonaws.com/prod-ucs-content-store-us-east/content/pii:S1381116915000783/fx2/HIGHRES/image/jpeg/27b13e147392b00bd4e33fd596840eed/fx2_lrg.jpg https://s3-eu-west-1.amazonaws.com/prod-ucs-content-store-eu-west/content/pii:S1381116915000783/fx2/HIGHRES/image/jpeg/27b13e147392b00bd4e33fd596840eed/fx2_lrg.jpg fx2 fx2_lrg.jpg jpg 17106 190 315 IMAGE-HIGH-RES 1-s2.0-S1381116915000783-fx13_lrg.jpg https://s3.amazonaws.com/prod-ucs-content-store-us-east/content/pii:S1381116915000783/fx13/HIGHRES/image/jpeg/cfa2223280931c3d45511c21aa180ea1/fx13_lrg.jpg https://s3-eu-west-1.amazonaws.com/prod-ucs-content-store-eu-west/content/pii:S1381116915000783/fx13/HIGHRES/image/jpeg/cfa2223280931c3d45511c21aa180ea1/fx13_lrg.jpg fx13 fx13_lrg.jpg jpg 23471 266 534 IMAGE-HIGH-RES 1-s2.0-S1381116915000783-fx12_lrg.jpg https://s3.amazonaws.com/prod-ucs-content-store-us-east/content/pii:S1381116915000783/fx12/HIGHRES/image/jpeg/6498e0436fba5ec8b0e0436106ec4cfd/fx12_lrg.jpg https://s3-eu-west-1.amazonaws.com/prod-ucs-content-store-eu-west/content/pii:S1381116915000783/fx12/HIGHRES/image/jpeg/6498e0436fba5ec8b0e0436106ec4cfd/fx12_lrg.jpg fx12 fx12_lrg.jpg jpg 22644 456 326 IMAGE-HIGH-RES 1-s2.0-S1381116915000783-fx11_lrg.jpg https://s3.amazonaws.com/prod-ucs-content-store-us-east/content/pii:S1381116915000783/fx11/HIGHRES/image/jpeg/fb3726f28be8a34c298df46ca4e4b79f/fx11_lrg.jpg https://s3-eu-west-1.amazonaws.com/prod-ucs-content-store-eu-west/content/pii:S1381116915000783/fx11/HIGHRES/image/jpeg/fb3726f28be8a34c298df46ca4e4b79f/fx11_lrg.jpg fx11 fx11_lrg.jpg jpg 16357 203 397 IMAGE-HIGH-RES 1-s2.0-S1381116915000783-fx10_lrg.jpg https://s3.amazonaws.com/prod-ucs-content-store-us-east/content/pii:S1381116915000783/fx10/HIGHRES/image/jpeg/f5bc896893de1a5b7f1a710792871bef/fx10_lrg.jpg https://s3-eu-west-1.amazonaws.com/prod-ucs-content-store-eu-west/content/pii:S1381116915000783/fx10/HIGHRES/image/jpeg/f5bc896893de1a5b7f1a710792871bef/fx10_lrg.jpg fx10 fx10_lrg.jpg jpg 17388 184 361 IMAGE-HIGH-RES 1-s2.0-S1381116915000783-fx1_lrg.jpg https://s3.amazonaws.com/prod-ucs-content-store-us-east/content/pii:S1381116915000783/fx1/HIGHRES/image/jpeg/70bfb350d40d9d78be68cae71d3a020b/fx1_lrg.jpg https://s3-eu-west-1.amazonaws.com/prod-ucs-content-store-eu-west/content/pii:S1381116915000783/fx1/HIGHRES/image/jpeg/70bfb350d40d9d78be68cae71d3a020b/fx1_lrg.jpg fx1 true fx1_lrg.jpg jpg 198139 886 2213 IMAGE-HIGH-RES 1-s2.0-S1381116915000783-sc3.jpg https://s3.amazonaws.com/prod-ucs-content-store-us-east/content/pii:S1381116915000783/sc3/DOWNSAMPLED/image/jpeg/fb01b65468be6f8a16b411f090f1ca38/sc3.jpg https://s3-eu-west-1.amazonaws.com/prod-ucs-content-store-eu-west/content/pii:S1381116915000783/sc3/DOWNSAMPLED/image/jpeg/fb01b65468be6f8a16b411f090f1ca38/sc3.jpg sc3 sc3.jpg jpg 44187 480 617 IMAGE-DOWNSAMPLED 1-s2.0-S1381116915000783-sc2.jpg https://s3.amazonaws.com/prod-ucs-content-store-us-east/content/pii:S1381116915000783/sc2/DOWNSAMPLED/image/jpeg/ab43b8be22028118fcc0769c46be2845/sc2.jpg https://s3-eu-west-1.amazonaws.com/prod-ucs-content-store-eu-west/content/pii:S1381116915000783/sc2/DOWNSAMPLED/image/jpeg/ab43b8be22028118fcc0769c46be2845/sc2.jpg sc2 sc2.jpg jpg 41800 394 527 IMAGE-DOWNSAMPLED 1-s2.0-S1381116915000783-sc1.jpg https://s3.amazonaws.com/prod-ucs-content-store-us-east/content/pii:S1381116915000783/sc1/DOWNSAMPLED/image/jpeg/e067551ddf387d46254caa50133e525f/sc1.jpg https://s3-eu-west-1.amazonaws.com/prod-ucs-content-store-eu-west/content/pii:S1381116915000783/sc1/DOWNSAMPLED/image/jpeg/e067551ddf387d46254caa50133e525f/sc1.jpg sc1 sc1.jpg jpg 12335 93 479 IMAGE-DOWNSAMPLED 1-s2.0-S1381116915000783-gr5.jpg https://s3.amazonaws.com/prod-ucs-content-store-us-east/content/pii:S1381116915000783/gr5/DOWNSAMPLED/image/jpeg/e20fd045efde46fc578be17f0c5a0bc9/gr5.jpg https://s3-eu-west-1.amazonaws.com/prod-ucs-content-store-eu-west/content/pii:S1381116915000783/gr5/DOWNSAMPLED/image/jpeg/e20fd045efde46fc578be17f0c5a0bc9/gr5.jpg gr5 gr5.jpg jpg 26525 292 369 IMAGE-DOWNSAMPLED 1-s2.0-S1381116915000783-gr4.jpg https://s3.amazonaws.com/prod-ucs-content-store-us-east/content/pii:S1381116915000783/gr4/DOWNSAMPLED/image/jpeg/0c3be5fb238f45b72fe39ea5df6f79d0/gr4.jpg https://s3-eu-west-1.amazonaws.com/prod-ucs-content-store-eu-west/content/pii:S1381116915000783/gr4/DOWNSAMPLED/image/jpeg/0c3be5fb238f45b72fe39ea5df6f79d0/gr4.jpg gr4 gr4.jpg jpg 33728 404 502 IMAGE-DOWNSAMPLED 1-s2.0-S1381116915000783-gr3.jpg https://s3.amazonaws.com/prod-ucs-content-store-us-east/content/pii:S1381116915000783/gr3/DOWNSAMPLED/image/jpeg/3c948f32ef0058c0793183354dfef7d6/gr3.jpg https://s3-eu-west-1.amazonaws.com/prod-ucs-content-store-eu-west/content/pii:S1381116915000783/gr3/DOWNSAMPLED/image/jpeg/3c948f32ef0058c0793183354dfef7d6/gr3.jpg gr3 gr3.jpg jpg 38646 402 538 IMAGE-DOWNSAMPLED 1-s2.0-S1381116915000783-gr2.jpg https://s3.amazonaws.com/prod-ucs-content-store-us-east/content/pii:S1381116915000783/gr2/DOWNSAMPLED/image/jpeg/b447567f62bcbb453b455c8611c6900d/gr2.jpg https://s3-eu-west-1.amazonaws.com/prod-ucs-content-store-eu-west/content/pii:S1381116915000783/gr2/DOWNSAMPLED/image/jpeg/b447567f62bcbb453b455c8611c6900d/gr2.jpg gr2 gr2.jpg jpg 29653 375 317 IMAGE-DOWNSAMPLED 1-s2.0-S1381116915000783-gr1.jpg https://s3.amazonaws.com/prod-ucs-content-store-us-east/content/pii:S1381116915000783/gr1/DOWNSAMPLED/image/jpeg/a3cc8c9365e33679c4929b08138a8f27/gr1.jpg https://s3-eu-west-1.amazonaws.com/prod-ucs-content-store-eu-west/content/pii:S1381116915000783/gr1/DOWNSAMPLED/image/jpeg/a3cc8c9365e33679c4929b08138a8f27/gr1.jpg gr1 gr1.jpg jpg 11657 102 376 IMAGE-DOWNSAMPLED 1-s2.0-S1381116915000783-fx9.jpg https://s3.amazonaws.com/prod-ucs-content-store-us-east/content/pii:S1381116915000783/fx9/DOWNSAMPLED/image/jpeg/99378e42f79760a7c922894345acc4be/fx9.jpg https://s3-eu-west-1.amazonaws.com/prod-ucs-content-store-eu-west/content/pii:S1381116915000783/fx9/DOWNSAMPLED/image/jpeg/99378e42f79760a7c922894345acc4be/fx9.jpg fx9 fx9.jpg jpg 6441 37 157 IMAGE-DOWNSAMPLED 1-s2.0-S1381116915000783-fx8.jpg https://s3.amazonaws.com/prod-ucs-content-store-us-east/content/pii:S1381116915000783/fx8/DOWNSAMPLED/image/jpeg/aa7a03f785216a254f5ce38f33f38b7b/fx8.jpg https://s3-eu-west-1.amazonaws.com/prod-ucs-content-store-eu-west/content/pii:S1381116915000783/fx8/DOWNSAMPLED/image/jpeg/aa7a03f785216a254f5ce38f33f38b7b/fx8.jpg fx8 fx8.jpg jpg 8559 66 157 IMAGE-DOWNSAMPLED 1-s2.0-S1381116915000783-fx7.jpg https://s3.amazonaws.com/prod-ucs-content-store-us-east/content/pii:S1381116915000783/fx7/DOWNSAMPLED/image/jpeg/54e3e36aa476f77a39cd485cb5083a08/fx7.jpg https://s3-eu-west-1.amazonaws.com/prod-ucs-content-store-eu-west/content/pii:S1381116915000783/fx7/DOWNSAMPLED/image/jpeg/54e3e36aa476f77a39cd485cb5083a08/fx7.jpg fx7 fx7.jpg jpg 9155 100 138 IMAGE-DOWNSAMPLED 1-s2.0-S1381116915000783-fx6.jpg https://s3.amazonaws.com/prod-ucs-content-store-us-east/content/pii:S1381116915000783/fx6/DOWNSAMPLED/image/jpeg/e06f9625b923b878ece1765d02c80722/fx6.jpg https://s3-eu-west-1.amazonaws.com/prod-ucs-content-store-eu-west/content/pii:S1381116915000783/fx6/DOWNSAMPLED/image/jpeg/e06f9625b923b878ece1765d02c80722/fx6.jpg fx6 fx6.jpg jpg 8071 72 134 IMAGE-DOWNSAMPLED 1-s2.0-S1381116915000783-fx5.jpg https://s3.amazonaws.com/prod-ucs-content-store-us-east/content/pii:S1381116915000783/fx5/DOWNSAMPLED/image/jpeg/ee2aeee106ff6feaa161420dc9a029cd/fx5.jpg https://s3-eu-west-1.amazonaws.com/prod-ucs-content-store-eu-west/content/pii:S1381116915000783/fx5/DOWNSAMPLED/image/jpeg/ee2aeee106ff6feaa161420dc9a029cd/fx5.jpg fx5 fx5.jpg jpg 7977 71 121 IMAGE-DOWNSAMPLED 1-s2.0-S1381116915000783-fx4.jpg https://s3.amazonaws.com/prod-ucs-content-store-us-east/content/pii:S1381116915000783/fx4/DOWNSAMPLED/image/jpeg/a2eca551d6b2967c212996d74b753147/fx4.jpg https://s3-eu-west-1.amazonaws.com/prod-ucs-content-store-eu-west/content/pii:S1381116915000783/fx4/DOWNSAMPLED/image/jpeg/a2eca551d6b2967c212996d74b753147/fx4.jpg fx4 fx4.jpg jpg 8364 80 143 IMAGE-DOWNSAMPLED 1-s2.0-S1381116915000783-fx3.jpg https://s3.amazonaws.com/prod-ucs-content-store-us-east/content/pii:S1381116915000783/fx3/DOWNSAMPLED/image/jpeg/c55bc2a1e6a0d272a96ceda3382ac457/fx3.jpg https://s3-eu-west-1.amazonaws.com/prod-ucs-content-store-eu-west/content/pii:S1381116915000783/fx3/DOWNSAMPLED/image/jpeg/c55bc2a1e6a0d272a96ceda3382ac457/fx3.jpg fx3 fx3.jpg jpg 10228 94 118 IMAGE-DOWNSAMPLED 1-s2.0-S1381116915000783-fx2.jpg https://s3.amazonaws.com/prod-ucs-content-store-us-east/content/pii:S1381116915000783/fx2/DOWNSAMPLED/image/jpeg/b2fba46e52d974ba5c23aafc66e221ae/fx2.jpg https://s3-eu-west-1.amazonaws.com/prod-ucs-content-store-eu-west/content/pii:S1381116915000783/fx2/DOWNSAMPLED/image/jpeg/b2fba46e52d974ba5c23aafc66e221ae/fx2.jpg fx2 fx2.jpg jpg 9227 71 118 IMAGE-DOWNSAMPLED 1-s2.0-S1381116915000783-fx13.jpg https://s3.amazonaws.com/prod-ucs-content-store-us-east/content/pii:S1381116915000783/fx13/DOWNSAMPLED/image/jpeg/b28b9fd129073b8322879ca6a35e373c/fx13.jpg https://s3-eu-west-1.amazonaws.com/prod-ucs-content-store-eu-west/content/pii:S1381116915000783/fx13/DOWNSAMPLED/image/jpeg/b28b9fd129073b8322879ca6a35e373c/fx13.jpg fx13 fx13.jpg jpg 9817 100 201 IMAGE-DOWNSAMPLED 1-s2.0-S1381116915000783-fx12.jpg https://s3.amazonaws.com/prod-ucs-content-store-us-east/content/pii:S1381116915000783/fx12/DOWNSAMPLED/image/jpeg/40a41ce0b1f0c2cce850abf415ee3de3/fx12.jpg https://s3-eu-west-1.amazonaws.com/prod-ucs-content-store-eu-west/content/pii:S1381116915000783/fx12/DOWNSAMPLED/image/jpeg/40a41ce0b1f0c2cce850abf415ee3de3/fx12.jpg fx12 fx12.jpg jpg 10688 171 122 IMAGE-DOWNSAMPLED 1-s2.0-S1381116915000783-fx11.jpg https://s3.amazonaws.com/prod-ucs-content-store-us-east/content/pii:S1381116915000783/fx11/DOWNSAMPLED/image/jpeg/26847cd3b2b75306b9b718f90f29c4bf/fx11.jpg https://s3-eu-west-1.amazonaws.com/prod-ucs-content-store-eu-west/content/pii:S1381116915000783/fx11/DOWNSAMPLED/image/jpeg/26847cd3b2b75306b9b718f90f29c4bf/fx11.jpg fx11 fx11.jpg jpg 8493 76 149 IMAGE-DOWNSAMPLED 1-s2.0-S1381116915000783-fx10.jpg https://s3.amazonaws.com/prod-ucs-content-store-us-east/content/pii:S1381116915000783/fx10/DOWNSAMPLED/image/jpeg/72ff074e32af86e346c05d4ea17cee26/fx10.jpg https://s3-eu-west-1.amazonaws.com/prod-ucs-content-store-eu-west/content/pii:S1381116915000783/fx10/DOWNSAMPLED/image/jpeg/72ff074e32af86e346c05d4ea17cee26/fx10.jpg fx10 fx10.jpg jpg 8891 69 135 IMAGE-DOWNSAMPLED 1-s2.0-S1381116915000783-fx1.jpg https://s3.amazonaws.com/prod-ucs-content-store-us-east/content/pii:S1381116915000783/fx1/DOWNSAMPLED/image/jpeg/3f576b864101b28299249778b4265d1d/fx1.jpg https://s3-eu-west-1.amazonaws.com/prod-ucs-content-store-eu-west/content/pii:S1381116915000783/fx1/DOWNSAMPLED/image/jpeg/3f576b864101b28299249778b4265d1d/fx1.jpg fx1 true fx1.jpg jpg 18168 200 500 IMAGE-DOWNSAMPLED 1-s2.0-S1381116915000783-sc3.sml https://s3.amazonaws.com/prod-ucs-content-store-us-east/content/pii:S1381116915000783/sc3/THUMBNAIL/image/gif/0d3c11c6f019ba082bfccbc75ce3c21e/sc3.sml https://s3-eu-west-1.amazonaws.com/prod-ucs-content-store-eu-west/content/pii:S1381116915000783/sc3/THUMBNAIL/image/gif/0d3c11c6f019ba082bfccbc75ce3c21e/sc3.sml sc3 sc3.sml sml 2633 163 210 IMAGE-THUMBNAIL 1-s2.0-S1381116915000783-sc2.sml https://s3.amazonaws.com/prod-ucs-content-store-us-east/content/pii:S1381116915000783/sc2/THUMBNAIL/image/gif/1b0642b5794277645293591d52e12ee4/sc2.sml https://s3-eu-west-1.amazonaws.com/prod-ucs-content-store-eu-west/content/pii:S1381116915000783/sc2/THUMBNAIL/image/gif/1b0642b5794277645293591d52e12ee4/sc2.sml sc2 sc2.sml sml 4874 164 219 IMAGE-THUMBNAIL 1-s2.0-S1381116915000783-sc1.sml https://s3.amazonaws.com/prod-ucs-content-store-us-east/content/pii:S1381116915000783/sc1/THUMBNAIL/image/gif/6d606931573c103daff2f461893258af/sc1.sml https://s3-eu-west-1.amazonaws.com/prod-ucs-content-store-eu-west/content/pii:S1381116915000783/sc1/THUMBNAIL/image/gif/6d606931573c103daff2f461893258af/sc1.sml sc1 sc1.sml sml 1122 42 219 IMAGE-THUMBNAIL 1-s2.0-S1381116915000783-gr5.sml https://s3.amazonaws.com/prod-ucs-content-store-us-east/content/pii:S1381116915000783/gr5/THUMBNAIL/image/gif/82156e96da98a6d8a2f419b9c7f98715/gr5.sml https://s3-eu-west-1.amazonaws.com/prod-ucs-content-store-eu-west/content/pii:S1381116915000783/gr5/THUMBNAIL/image/gif/82156e96da98a6d8a2f419b9c7f98715/gr5.sml gr5 gr5.sml sml 4510 164 207 IMAGE-THUMBNAIL 1-s2.0-S1381116915000783-gr4.sml https://s3.amazonaws.com/prod-ucs-content-store-us-east/content/pii:S1381116915000783/gr4/THUMBNAIL/image/gif/925b46be6641d71191fdf3817379f568/gr4.sml https://s3-eu-west-1.amazonaws.com/prod-ucs-content-store-eu-west/content/pii:S1381116915000783/gr4/THUMBNAIL/image/gif/925b46be6641d71191fdf3817379f568/gr4.sml gr4 gr4.sml sml 5248 164 204 IMAGE-THUMBNAIL 1-s2.0-S1381116915000783-gr3.sml https://s3.amazonaws.com/prod-ucs-content-store-us-east/content/pii:S1381116915000783/gr3/THUMBNAIL/image/gif/765cf0775f79b7f5deac4c27eba1955c/gr3.sml https://s3-eu-west-1.amazonaws.com/prod-ucs-content-store-eu-west/content/pii:S1381116915000783/gr3/THUMBNAIL/image/gif/765cf0775f79b7f5deac4c27eba1955c/gr3.sml gr3 gr3.sml sml 5940 164 219 IMAGE-THUMBNAIL 1-s2.0-S1381116915000783-gr2.sml https://s3.amazonaws.com/prod-ucs-content-store-us-east/content/pii:S1381116915000783/gr2/THUMBNAIL/image/gif/a6eaa91d50bb6af6651e682747134982/gr2.sml https://s3-eu-west-1.amazonaws.com/prod-ucs-content-store-eu-west/content/pii:S1381116915000783/gr2/THUMBNAIL/image/gif/a6eaa91d50bb6af6651e682747134982/gr2.sml gr2 gr2.sml sml 3468 163 138 IMAGE-THUMBNAIL 1-s2.0-S1381116915000783-gr1.sml https://s3.amazonaws.com/prod-ucs-content-store-us-east/content/pii:S1381116915000783/gr1/THUMBNAIL/image/gif/b6a401796a804bec07f4d0544e452ce0/gr1.sml https://s3-eu-west-1.amazonaws.com/prod-ucs-content-store-eu-west/content/pii:S1381116915000783/gr1/THUMBNAIL/image/gif/b6a401796a804bec07f4d0544e452ce0/gr1.sml gr1 gr1.sml sml 1490 59 219 IMAGE-THUMBNAIL 1-s2.0-S1381116915000783-fx9.sml https://s3.amazonaws.com/prod-ucs-content-store-us-east/content/pii:S1381116915000783/fx9/THUMBNAIL/image/gif/8acb4e140d92072f6821efaa0d439ba0/fx9.sml https://s3-eu-west-1.amazonaws.com/prod-ucs-content-store-eu-west/content/pii:S1381116915000783/fx9/THUMBNAIL/image/gif/8acb4e140d92072f6821efaa0d439ba0/fx9.sml fx9 fx9.sml sml 1249 52 219 IMAGE-THUMBNAIL 1-s2.0-S1381116915000783-fx8.sml https://s3.amazonaws.com/prod-ucs-content-store-us-east/content/pii:S1381116915000783/fx8/THUMBNAIL/image/gif/ea88da892c3e946d69f05924c0594b79/fx8.sml https://s3-eu-west-1.amazonaws.com/prod-ucs-content-store-eu-west/content/pii:S1381116915000783/fx8/THUMBNAIL/image/gif/ea88da892c3e946d69f05924c0594b79/fx8.sml fx8 fx8.sml sml 2027 92 219 IMAGE-THUMBNAIL 1-s2.0-S1381116915000783-fx7.sml https://s3.amazonaws.com/prod-ucs-content-store-us-east/content/pii:S1381116915000783/fx7/THUMBNAIL/image/gif/9be4d7b54659bd1785d934292474239c/fx7.sml https://s3-eu-west-1.amazonaws.com/prod-ucs-content-store-eu-west/content/pii:S1381116915000783/fx7/THUMBNAIL/image/gif/9be4d7b54659bd1785d934292474239c/fx7.sml fx7 fx7.sml sml 2479 159 219 IMAGE-THUMBNAIL 1-s2.0-S1381116915000783-fx6.sml https://s3.amazonaws.com/prod-ucs-content-store-us-east/content/pii:S1381116915000783/fx6/THUMBNAIL/image/gif/12e7d22d30152f2b04358e1b169c6238/fx6.sml https://s3-eu-west-1.amazonaws.com/prod-ucs-content-store-eu-west/content/pii:S1381116915000783/fx6/THUMBNAIL/image/gif/12e7d22d30152f2b04358e1b169c6238/fx6.sml fx6 fx6.sml sml 2118 117 219 IMAGE-THUMBNAIL 1-s2.0-S1381116915000783-fx5.sml https://s3.amazonaws.com/prod-ucs-content-store-us-east/content/pii:S1381116915000783/fx5/THUMBNAIL/image/gif/56a9cb58d58defea922d67298086097e/fx5.sml https://s3-eu-west-1.amazonaws.com/prod-ucs-content-store-eu-west/content/pii:S1381116915000783/fx5/THUMBNAIL/image/gif/56a9cb58d58defea922d67298086097e/fx5.sml fx5 fx5.sml sml 2406 129 219 IMAGE-THUMBNAIL 1-s2.0-S1381116915000783-fx4.sml https://s3.amazonaws.com/prod-ucs-content-store-us-east/content/pii:S1381116915000783/fx4/THUMBNAIL/image/gif/68a09d9ada31c5cb90952e1ed2ea99f7/fx4.sml https://s3-eu-west-1.amazonaws.com/prod-ucs-content-store-eu-west/content/pii:S1381116915000783/fx4/THUMBNAIL/image/gif/68a09d9ada31c5cb90952e1ed2ea99f7/fx4.sml fx4 fx4.sml sml 2309 122 219 IMAGE-THUMBNAIL 1-s2.0-S1381116915000783-fx3.sml https://s3.amazonaws.com/prod-ucs-content-store-us-east/content/pii:S1381116915000783/fx3/THUMBNAIL/image/gif/c254f1478fbd77df3e5f3f0df1a134ae/fx3.sml https://s3-eu-west-1.amazonaws.com/prod-ucs-content-store-eu-west/content/pii:S1381116915000783/fx3/THUMBNAIL/image/gif/c254f1478fbd77df3e5f3f0df1a134ae/fx3.sml fx3 fx3.sml sml 2982 163 206 IMAGE-THUMBNAIL 1-s2.0-S1381116915000783-fx2.sml https://s3.amazonaws.com/prod-ucs-content-store-us-east/content/pii:S1381116915000783/fx2/THUMBNAIL/image/gif/353657537b31f3637e130008ac628ab4/fx2.sml https://s3-eu-west-1.amazonaws.com/prod-ucs-content-store-eu-west/content/pii:S1381116915000783/fx2/THUMBNAIL/image/gif/353657537b31f3637e130008ac628ab4/fx2.sml fx2 fx2.sml sml 2735 132 219 IMAGE-THUMBNAIL 1-s2.0-S1381116915000783-fx13.sml https://s3.amazonaws.com/prod-ucs-content-store-us-east/content/pii:S1381116915000783/fx13/THUMBNAIL/image/gif/d70a7fa289c1592978e2c676399987f9/fx13.sml https://s3-eu-west-1.amazonaws.com/prod-ucs-content-store-eu-west/content/pii:S1381116915000783/fx13/THUMBNAIL/image/gif/d70a7fa289c1592978e2c676399987f9/fx13.sml fx13 fx13.sml sml 2208 109 219 IMAGE-THUMBNAIL 1-s2.0-S1381116915000783-fx12.sml https://s3.amazonaws.com/prod-ucs-content-store-us-east/content/pii:S1381116915000783/fx12/THUMBNAIL/image/gif/2605bdcfc8bc051f948c7be913fbff42/fx12.sml https://s3-eu-west-1.amazonaws.com/prod-ucs-content-store-eu-west/content/pii:S1381116915000783/fx12/THUMBNAIL/image/gif/2605bdcfc8bc051f948c7be913fbff42/fx12.sml fx12 fx12.sml sml 1865 164 117 IMAGE-THUMBNAIL 1-s2.0-S1381116915000783-fx11.sml https://s3.amazonaws.com/prod-ucs-content-store-us-east/content/pii:S1381116915000783/fx11/THUMBNAIL/image/gif/9eb97f50ef3796d19dd0e3f291d71901/fx11.sml https://s3-eu-west-1.amazonaws.com/prod-ucs-content-store-eu-west/content/pii:S1381116915000783/fx11/THUMBNAIL/image/gif/9eb97f50ef3796d19dd0e3f291d71901/fx11.sml fx11 fx11.sml sml 2189 112 219 IMAGE-THUMBNAIL 1-s2.0-S1381116915000783-fx10.sml https://s3.amazonaws.com/prod-ucs-content-store-us-east/content/pii:S1381116915000783/fx10/THUMBNAIL/image/gif/c97d1ba67bfd15660b0f24d7a47c8cd8/fx10.sml https://s3-eu-west-1.amazonaws.com/prod-ucs-content-store-eu-west/content/pii:S1381116915000783/fx10/THUMBNAIL/image/gif/c97d1ba67bfd15660b0f24d7a47c8cd8/fx10.sml fx10 fx10.sml sml 2645 112 219 IMAGE-THUMBNAIL 1-s2.0-S1381116915000783-fx1.sml https://s3.amazonaws.com/prod-ucs-content-store-us-east/content/pii:S1381116915000783/fx1/THUMBNAIL/image/gif/c1a206e96917cc8d3b1379cda98f26d6/fx1.sml https://s3-eu-west-1.amazonaws.com/prod-ucs-content-store-eu-west/content/pii:S1381116915000783/fx1/THUMBNAIL/image/gif/c1a206e96917cc8d3b1379cda98f26d6/fx1.sml fx1 true fx1.sml sml 4615 88 219 IMAGE-THUMBNAIL MOLCAA 9437 S1381-1169(15)00078-3 10.1016/j.molcata.2015.02.021 Elsevier B.V. Scheme1 Selective oxidation de sulfide to sulfoxide or sulfone. Scheme 2 Proposed mechanism for the oxidation of metil p-tolyl sulfide to the corresponding sulfoxide and sulfone with aqueous hydrogen peroxide in the presence of polyoxometalates. Reaction condition for the selective oxidation of sulphide to sulfone: 1mmol de sulfide, 1mL of 35 % p/V H2O2, 100mg catalyst of SiW11MnC, 9mL of acetonitrile, 50°C, stir. Scheme 3 Chemoselectivity in the sulfoxide synthesis. Reaction condition: 1 mmol de sulfide, 1 mmol of the second substrate (see the corresponding equation in the scheme), 0.2 mL of 35 % p/V H2O2, 100 mg catalyst of SiW11MnC, 9 mL of acetonitrile, at 20 °C, after 7 h. Fig. 1 Bioactives sulfoxides and sulfones. Fig. 2 FT-IR spectra of the Na8SiW11O39 (a) transition metal-modified lacunary tungstosilicic polyoxometallates salt Na6[SiW11O39M]6−, with M=Mn2+ (b), Fe2+ (c), Cu2+ (d), or Co2+ (e). Fig. 3 TPR patterns of Na8SiW11O39 (a) and of lacunary tungstosilicic polyoxometallates salt Na6[SiW11O39M]6−, with M=Mn2+ (b), Fe2+ (c), Cu2+ (d), or Co2+ (e). Fig. 4 TPR patterns of SiW11MnC (a), SiW11FeC (b), SiW11CuC (c), SiW11CoC (d), and the carbon support. Fig. 5 Reaction time for 100% conversion of sulfide vs. Qs (charge on sulfur atom in the corresponding sulfide)a. Table 1 Conversion and selectivity of the SiW11MC samples in the methyl p-tolyl sulfide. Entry Catalyst CSPROP (s−1) Conversion (%) Sulfoxide selectivity (%) Sulfone selectivity (%) 1 None – 10 100 – 2 SiW11MnC 0.24 100 20 80 3 SiW11FeC 0.20 95 25 75 5 SiW11CuC 0.14 85 30 70 5 SiW11CoC 0.12 83 35 65 Experimental conditions: 100mg catalyst, 1mmol of methyl p-tolyl sulfide, 10mmol of H2O2 (35% w/v) and 9mL of acetonitrile; reaction for 60min at 40°C. CSPROP =mol propene/mol SiW11M.s. Table 2 Screening of solvent and catalyst reuse in methyl p-tolyl sulfide oxidation at 40°C. Entry Solvent Conversion (%) Conversion (%)first reuse 1 Ethanol 100 75 2 Acetonitrile 100 100 (100,100) a 3 Toluene b 55 54 Experimental conditions: 100mg catalyst of SiW11MnC, 1mmol of methyl p-tolyl sulfide, 10mmol of H2O2 (35% w/v) and 9mL solvent; reaction for 60min at 40°C. a Second and third reuse. b Two phases were observed due to aqueous hydrogen peroxide insolubility in toluene. Table 3 Optimization of the reaction conditions for the selective synthesis of sulfoxide and sulfone. Entry H2O2 (mL) Time (h) Temp.(°C) Conversion (%) Sulfoxide selectivity (%) Sulfone Selectivity (%) 1 0.1 a 10 20 15 100 – 2 0.1 10 20 70 95 5 3 0.2 7 20 100 91 9 4 0.5 5 20 100 51 49 5 1 4 20 100 32 68 6 1 1 40 100 20 80 7 1 2 50 100 2 98 8 1 3 50 100 0 100 Experimental conditions: 100mg catalyst of SiW11MnC, 1mmol of methyl p-tolyl sulfide, and 9mL of acetonitrile. a Without catalyst. Table 4 Oxidation of sulfide (1.0mmol) to the corresponding sulfoxide and sulfones using H2O2 35% p/V in the presence of SiWMnC as catalyst. Entry Substrate Qs Yields (%) sulfoxide/time (h) Yields (%) sulfone/time (h) 1 91(24) 93(4) 2 87(30) 92(4) 3 92(7) 90(3) 4 90(6) 94(3) 5 85(6) 93(3) 6 89(6) 92(3) 7 80(4) 85(2) 8 81(3) 90(2) 9 77(4) 82(3) 10 77(9) 84(3) 11 81(9) 84(3) 12 59(20) 71(3) Reaction condition for the selective oxidation of sulfide to sulfoxide: 1mmol de sulfide, 0.2mL of 35% p/V H2O2, 100mg catalyst of SiW11MnC, 9mL of acetonitrile, 20°C, stir. Carbon-supported metal-modified lacunary tungstosilicic polyoxometallates used as catalysts in the selective oxidation of sulfides Romina Frenzel Ángel G. Sathicq Mirta N. Blanco Gustavo P. Romanelli ⁎ Luis R. Pizzio ⁎ Centro de Investigación y Desarrollo en Ciencias Aplicadas “Dr. Jorge J. Ronco” (CINDECA), CCT-La Plata-CONICET, Departamento de Química, Facultad de Ciencias Exactas, Universidad Nacional de La Plata, 47°N 257, B1900AJK La Plata, Argentina Centro de Investigación y Desarrollo en Ciencias Aplicadas “Dr. Jorge J. Ronco” (CINDECA), CCT-La Plata-CONICET, Departamento de Química, Facultad de Ciencias Exactas, Universidad Nacional de La Plata 47°N 257 La Plata B1900AJK Argentina ⁎ Corresponding authors. Graphical abstract Lacunary tungstosilicic polyoxometallates modified with transition metal ions [SiW11O39M(H2O)]6−, where M=Mn2+, Fe2+, Co2+or Cu2+, were synthesized and supported on activated carbon to obtain the SiW11MC catalysts. The samples were characterized by FT-IR, XRD, N2 adsorption–desorption measurements, and the acidic properties were determined using the isopropanol dehydration test reaction. The activity and selectivity of the catalysts were evaluated in the selective oxidation of a series of sulfides to sulfoxides or sulfone. The reaction was carried out in acetonitrile as solvent using H2O2 35% p/V as a clean oxidant. The conversion values decreased in the following order: SiW11MnC>SiW11FeC>SiW11CuC>SiW11CoC. The catalysts were reused without appreciable loss of their catalytic activity. It was found that the activity of the catalysts decreases in parallel with the increment in the reduction temperature values. The most easily reducible catalyst displayed the highest conversion values. We found a convenient and selective procedure for oxidizing sulfides to sulfoxides or sulfones using aqueous hydrogen peroxide and a catalytic amount of lacunary tungstosilicic polyoxometallates supported on carbon at low temperatures (20–50°C) in a reasonably short reaction time. Keywords Supported metal-substituted polyoxometallates Carbon Sulfide oxidation Hydrogen peroxide 1 Introduction The development of new catalytic systems for selective organic synthesis is one of the challenging tasks in Organic Chemistry. In recent years, the search of ecofriendly benign chemical methodologies has received much attention from Chemistry Communities, because they are essential for the conservation of the global ecosystem. From this viewpoint, in the last two decades, very useful procedures involving catalysis and hydrogen peroxide, as oxidant, have been developed. They promote the efficient organic substrate oxidation, due to their low cost, effective oxygen content, safety in storage and operation, and mainly the ecofriendly character of hydrogen peroxide [1–3]. Catalysis using heteropolyacids and related compounds is a field of increasing importance worldwide. Numerous developments are being carried out in industrial processes and basic research. Heteropolyacids present a very strong acidity and redox properties, which can be changed by varying the chemical composition of the heteropolyanion. Different transformations catalyzed by heteropolyacids in heterogeneous and homogeneous phases have been reviewed [4–7]. Recently, our research group has used Keggin and Wells–Dawson heteropolyacids/aqueous hydrogen peroxide systems, in a series of oxidation processes, including phenol [8], alcohol [9], amine [10], sulfide [11], and 1,4-dihydropyridine [12] oxidation. Transition metal-modified lacunary heteropolycompounds with Keggin structure, obtained by modification of the [PW11O39]7− lacunary phase with ions of the transition metals Ni(II), Fe(III), Co(II), Zn(II), Mn(II) or Cu(II) have been used as catalysts in the oxidation of cyclohexane with aqueous H2O2 [13], in methyl isobutyrate and cyclohexene with oxygen [14], and in the oxidation of 2-(methylthio)-benzothiazole with aqueous H2O2 [15]. However, transition metal-modified lacunary heteropolycompounds with Keggin structure, obtained by modification of the [SiW11O39]8− lacunary phase with ions of the transition metals, have been little studied in catalytic oxidation processes. Meanwhile, sulfoxides and sulfones are important intermediates in organic chemistry due to their application in basic and applied research, especially because they are versatile intermediates for the preparation of biologically important products [16], including therapeutic agents such as antiulcer, antibacterial, antifungal, antiatherosclerotic, antihypertensive and cardiotonic agents as well as psychotropics and vasodilators [3,17,18]. Omeprazole and dapsone are two typical examples of the extensive application in the pharmaceutical industry. Omeprazole (one of the most widely prescribed drugs internationally) is a proton pump inhibitor used in the treatment of dyspepsia, peptic ulcer disease, and gastroesophageal and laryngopharyngeal reflux [19], and dapsone, an antibacterial most commonly used for the treatment of leprae infections and in the treatment of malaria [20] (Fig. 1 ). The most appropriate method for the preparation of sulfoxide and sulfone compounds is the selective oxidation of the corresponding sulfide. In general, the system formed by the oxidant/catalyst is the same for the selective oxidation of sulfides to sulfoxides as that of sulfones. The only change is often the more drastic reaction conditions required for obtaining sulfones. Hydrogen peroxide may be used as an electrophilic reagent for the direct selective oxidation of sulfides to sulfoxides or sulfones. However, the rate of reaction can be greatly improved by the use of a catalyst [3]. Some of the most recent catalysts are: silica–vanadia [21], oxalic acid dihydrate [22], metalloporphyrin [23], p-toluenesulfonic acid [24], sulfamic acid [25], titanosilicates [26], heteropolyacids [27], and many others. The objective of this paper is to study both the use of carbon-supported transition metal-modified lacunary tungstosilicic polyoxometallates as catalysts in the selective oxidation of sulfides to sulfoxides or sulfones (Scheme 1 ) and the effect of the metal introduced in the heteropolyacid structure, on the activity and selectivity on the reaction test. A relation between the substrate structure and conversion rate was also found. 2 Experimental 2.1 Catalyst synthesis 2.1.1 Transition metal-modified lacunary tungstosilicic polyoxometallate (TMPOM) synthesis The TMPOM ions [SiW11O39M]6−, (M=Mn2+, Fe2+, Cu2+, and Co2+) were synthetized according to the literature data [28–30]. An aqueous solution of H4SiW12O40·23H2O was alkalinized with aqueous NaHCO3 solution up to a pH value of 5.0–5.5, which resulted in the formation of the lacunary heteropolyanion [SiW11O39]8−. In order to introduce the transition metal ion into the octahedral lacuna, the obtained solution of [SiW11O39]8− and an aqueous solution of the transition metal salt were mixed and stirred at 60–90°C. The sodium salts of the lacunary heteropolycompounds were obtained by solvent evaporation and recrystallization from water. They were dried at 70°C before their characterization by thermal and physicochemical techniques. 2.1.2 Supported catalyst synthesis The support used was a commercial activated carbon ground to a mean particle size of 1mm, previously washed with 0.1N solutions of NaOH and HCl, and then treated with a HNO3 30% solution under heating to reflux for 2h. It has a surface area of 806m2/g, and a mean pore diameter below 2nm. The carbon was impregnated using the incipient wetness method, with [SiW11O39M]6− water solutions (0.14M), in order to add 1.0 10−4 mmol of the lacunary heteropolycompounds per gram of carbon. The catalysts were kept at room temperature till dryness and then thermally treated at 70°C for 24h. They will be named SiW11MC (M=Mn2+, Fe2+, Cu2+, and Co2+). A fraction of the solids obtained was washed with ethanol, acetonitrile or toluene, for 24h. For this leaching experiment, 1g of solid was placed in contact with 4mL of solvent at 20°C under constant stirring for a selected time. The tungsten concentration in the solutions, after leaching, was determined by atomic absorption spectrometry. The calibration curve method was used, with standards prepared in the laboratory. An IL Model 457 spectrophotometer, with single channel and double beam, and monochromator with a 330mm focal distance, was used. The light source was a hollow monocathode lamp. The analysis was carried out at wavelength 254.9nm, bandwidth 0.3nm, lamp current 15mA, phototube amplification 800V, burner height 4mm, and acetylene–nitrousoxide flame (11:14). 2.2 Catalyst characterization 2.2.1 FT-IR spectroscopy Fourier transform infrared spectroscopy (FT-IR) of [SiW11O39M]6− sodium salts and catalysts dried at 70°C for 24h was obtained in the 400–4000cm−1 wavenumber range using Bruker IFS 66 FT-IR spectrometer. 2.2.2 X-ray diffraction X-ray diffraction (XRD) patterns were recorded on the same samples that had been analyzed by FT-IR. The equipment used to this end was Philips PW-1732 with built-in recorder, using Cu Kα radiation, nickel filter, 30mA and 40kV in the high-voltage source, and scanning angle between 5 and 60° of 2θ at a scanning rate of 1°/min. 2.2.3 SEM analysis The distribution of [SiW11O39M]6− anions along the width of the carbon granules was measured with a Philips Model 505 scanning electron microscope with an energy dispersive X-ray analysis (EDAX) system, following a technique previously reported [31,32]. 2.2.4 Isopropanol decomposition The isopropanol dehydration test reaction was carried out in a conventional flow fixed-bed reactor at atmospheric pressure and 180°C. The gas carrier was helium and the isopropanol volumetric flow was 0.126cm3/min in a total flow of 50cm3/min. The reaction products were quantified by gas chromatography, using a thermal conductivity detector. The specific isopropanol conversion (CSPROP) was calculated under differential conversion conditions (conversions lower than 10%) and expressed as mol propene/mol SiW11M.s. 2.2.5 Temperature programmed reduction Temperature programmed reduction (TPR) of the samples dried at 70°C (100mg, 60–100 mesh) was obtained using a mixture of H2 (5%) in Ar flowing at 90mL/min. The heating rate was kept at 10°C/min until reaching a temperature of 1000°C. The amount of H2 consumed during reduction was determined using a thermal conductivity detector. 2.3 Catalytic test 2.3.1 General remarks All reagents were purchased from Merck and Aldrich and used without further purification. The product distribution was quantified by GC analysis and reactions were also monitored by thin layer chromatography analyses. The products were characterized by the determination of the mass spectra. All yields refer to isolated products after purification. 2.3.2 Sample analysis Samples were withdrawn from the organic phase at 15-min intervals. Each volume sample was approximately 20μL and it was diluted with 1–2mL of acetonitrile, the concentrations were calculated for the determination of the corresponding areas. The capillary column was a 30m Chromopack CP Sil 8CB, 0.32mm in diameter. 2.3.3 General procedure for the oxidation of sulfide to sulfoxide A solution of sulfide (1mmol) and catalyst (100mg), in acetonitrile (9mL), was added to H2O2 35% (w/v) (2mmol). The mixture was stirred at 20°C for a time period (see Tables 1 and 2 ). The solvent was evaporated and then H2O (5mL) was added. The substrate was extracted with toluene (2×mL) and dried with anhydrous Na2SO4; filtration and evaporation afforded the corresponding sulfoxides. The solid crude sulfoxides were purified by recrystallization to afford the pure sulfoxides. 2.3.4 General procedure for the oxidation of sulfide to sulfone A solution of sulfide (1mmol) and catalyst (100mg), in acetonitrile (9mL), was added to H2O2 35% (w/v) (10mmol). The mixture was stirred at 50°C for a time period (see Tables 1 and 2). The solvent was evaporated and then H2O (5mL) was added. The substrate was extracted with toluene (2×mL) and dried with anhydrous Na2SO4; filtration and evaporation afforded the corresponding sulfoxides. The crude solids were purified by recrystallization to afford the pure sulfones. 2.3.5 Electronic densities of sulfur atom determination The densities of the sulfur atoms in the sulfide were determined after optimization of their conformation. The conformations of the compounds were drawn by means of the “model build” modulus available in HyperChem 5.0. Each molecular structure was firstly preoptimized with the Molecular Mechanics Force Field (MM+) procedure, and the resulting geometry was further refined by for Peer Review only means of the semiempirical method PM3 (Parametric Method-3). A gradient norm limit of 0.01kcalÅ−1 was chosen. 2.3.6 Electronic impact mass spectra of the representative compounds Diphenyl sulfoxide: EIMS, m/z (relative intensity): 202 (M+, 83%), 185 (18%), 154 (73%), 109 (90%), 97 (48%), 77 (78%), 65 (59%), 51 (100%), 39 (32%). Diphenyl sulfone: EIMS, m/z (relative intensity): 218 (M+, 36%), 153 (7%), 125 (100%), 97 (12%), 77 (37%), 51 (23%). Di-n-butyl sulfoxide: EIMS, m/z (relative intensity): 162 (M+, 5%), 145 (11%), 106 (32%), 89 (45%), 57 (58%), 41 (98%), 29 (100%). Benzyl phenyl sulfoxide: EIMS, m/z (relative intensity): 216 (M+) (10%), 182 (16%), 165 (2%), 125 (5%), 91 (100%), 77 (11%), 65 (18%). Di-n-butyl sulfone: EIMS, m/z (relative intensity):178 (M+, 3%), 149 (2%), 123 (32%), 81 (4%), 57 (100%), 41 (52%), 29 (56%). Ethyl phenyl sulfone: EIMS, m/z (relative intensity): 170 (M+, 28%), 142 (18%), 141 (23%), 125 (8%), 94 (56%), 78 (71%), 77 (100%), 51 (55%). Benzyl phenyl sulfone: EIMS, m/z (relative intensity): 232 (M+, 4%), 167 (2%), 165 (2%), 152 (15%), 91 (100%), 77 (11%), 65 (17%), 51 (13%). Di-benzyl sulfone: EIMS, m/z (relative intensity): 182 (M+, 10%), 91 (100%), 65 (24%), 39 (11%). Phenyl methyl sulfone: EIMS, m/z (relative intensity): 156 (M+, 29%), 141 (27%), 94 (33%), 77 (100%), 51 (8%), 39 (9%). Methyl p-tolyl sulfone: EIMS, m/z (relative intensity): 170 (M+, 28%), 155 (30%), 107 (22%), 91 (100%), 77 (7%), 65 (22%), 39 (11%). 1,1-Dioxide-2,3,4,5-tetrahydrothiofene (sulfolane): EIMS, m/z (relative intensity): 120 (M+, 44%), 92 (14%), 56 (85%), 55 (69%), 41 (100%), 28 (60%). Phenyl vinyl sulfone: EIMS, m/z (relative intensity): 168 (M+, 18%), 125 (100%), 77 (64%), 51 (27%), 27 (6%). 4,4′-Diaminodiphenyl sulfone (dapsone): EIMS, m/z (relative intensity): 248 (M+, 83%), 184 (8%), 140 (62%), 108 (100%), 92 (37%), 65 (48%), 39 (18%). 2-(Methylthio)-benzothiazole sulfoxide: EIMS, m/z (relative intensity): 197 (62%) M+.; 182 (78); 153 (60); 151 (100); 150 (64); 134 (42%); 123 (15); 108 (25); 90 (26); 50 (30); 39 (98). 2-(Methylthio)-benzothiazole sulfone: EIMS, m/z (relative intensity): m/z (I%): 197 (18) M+.; 150 (100); 134 (42); 108 (20); 90 (25); 50 (24); 39 (74). 3 Results and discussion 3.1 Catalyst characterization The characteristics of XRD patterns of SiW11MC samples were similar to those of the original carbon, so neither the diffraction lines of the Na6[SiW11O39M] salts, nor those of other crystalline phases were detected. On the other hand, according to the results obtained by energy dispersive X-ray analysis (EDAX), a uniform distribution of the modified lacunary Keggin anions along the width of the carbon particles was obtained. This indicates that the species present onto the support surface are highly dispersed as a noncrystalline form, owing to the interaction with the support. The FT-IR spectrum of Na8[SiW11O39] showed the main bands of the lacunar anion placed at 1008, 959, 882, 869, 794, and 720cm−1 (Fig. 2 a). The spectrum of Na5[SiW11O39Mn] (Fig. 2b) displayed bands at 1002, 959, 899, 810, 701, and 541cm−1. They are in agreement with those reported by Rocchiccioli-Deltcheff et al. [33] and are considered typical of the transition metal-modified lacunary heteropolycompounds [33]. The FT-IR spectra of the other Na6[SiW11O39M] salts (M=Fe2+, Cu2+, or Co2+) displayed the same features. On the other hand, the FT-IR spectra of the SiW11MC (M=Mn2+, Fe2+, Cu2+, and Co2+) showed the characteristic bands of the [SiW11O39M]6− anion superimposed to those of the carbon used as support. These results confirm that the structure of the metal-modified lacunary heteropolycompounds remains unaltered after the interaction with carbon that takes place during the impregnation. According to the DTA studies, the thermal decomposition of sodium [SiW11O39M]6− takes place at temperatures in the range 450–490°C. The exothermic peaks assigned to Na6[SiW11O39Mn] and Na6[SiW11O39Fe] decomposition were observed at 485 and 478°C, respectively. These salts are thermally slightly more stable than Na6[SiW11O39Cu] and Na6[SiW11O39Co], which showed the exothermic peak at 469 and 458°C, respectively. The dehydration of the salts occurs at temperatures below 150°C. Their DTA diagrams showed a broad endothermic peak with a maximum at 60–70°C, which was reflected in the TGA diagram as the appearance of continuous weight loss. In the DTA diagrams of the SiW11MC samples, an endothermic peak with a maximum at around 70°C was observed. It was similar to that displayed by the support and ascribed to water evolution. A wide exothermic signal with a maximum in the range 470–500°C, assigned to [SiW11O39M]6− decomposition, was observed. The decomposition temperature of transition metal-modified lacunary tungstosilicic polyoxometallates was slightly enhanced as a result of their interaction with the functional groups present on the support surface [34]. The TPR pattern of Na8SiW11O39 showed two peaks with maxima at 691 and 917°C (Fig. 3 ). They appeared at temperatures higher than the decomposition temperature of the [SiW11O39]8− anion and were assigned to the reduction of the species resulting from lacunary anion decomposition. The same peaks, shifted to higher temperatures, were present in the patterns of Na6[SiW11O39Mn] (711 and 917°C), Na6[SiW11O39Fe] (722 and 935°C), Na6[SiW11O39Cu] (731 and 948°C), and Na6[SiW11O39Co] (742 and 972°C). Due to the introduction of M in the octahedral lacuna, the reduction of the species resulting from N6[SiW11O39M] decomposition takes place at slightly higher temperatures. These species may be the constituent oxides of the decomposed salts. Gamelas et al. [35] have found WO3 as the main component of the decomposition products of potassium salts of transition metal-modified lacunary heteropolycompounds. On the other hand, the TPR patterns of the SiW11MnC, SiW11FeC, SiW11CuC, and SiW11CoC samples (Fig. 4 ) showed a strong and wide peak with a maximum in the range 660–720°C, overlapping the wide band of the support (480–750°C). Taking into account the DTA results, they appeared at temperature values higher than the decomposition temperature of the [SiW11O39M]6− anion in the SiW11MC samples. We can suggest that as result of the interaction of the transition metal-modified lacunary tungstosilicic polyoxometallates with the functional groups present on the support surface, the reduction of [SiW11O39M]6− anion decomposition products takes place almost at the same temperature and only reduction peak in the TGR patterns was displayed. For these samples, the reduction temperature ( TPR SiW 11 MC ) slightly increased according to the following order: SiW11MnC (662°C)<SiW11FeC (681°C)<SiW11CuC (697°C)<SiW11CoC (711°C). Isopropanol dehydration proceeds quickly on acidic sites [36] and has been used [37,38] as a test reaction for comparing the acidity of different catalysts. At temperatures lower than 300°C, isopropanol decomposition can form either propene and water (dehydration) or acetone and hydrogen (dehydrogenation). The results of isopropanol dehydration (CSPROP) catalyzed by SiW11MC samples are shown in Table 1. We found that isopropanol decomposes to propene and only traces of diisopropylether were detected by means of GCMS. According to these results, the acidy of the samples decreases in the following order: SiW11MnC>SiW11FeC>SiW11CuC>SiW11CoC. 3.2 Catalytic activity 3.2.1 Effect of the nature of the transition metal on the catalytic activity of SiW11MC samples Table 1 shows the obtained results for methyl p-tolyl sulfide conversion and selectivity to the corresponding sulfoxide and sulfone using the prepared transition metal-modified lacunary tungstosilicic polyoxometallates supported on carbon (SiW11MnC, SiW11FeC, SiW11CuC and SiW11CoC). The experimental conditions were: 100mg of catalyst, 1mmol of substrate, 10mmol of H2O2 (35% (w/v)) and 9mL of acetonitrile; reaction time and temperature of 60min and 40°C, respectively. In these conditions, the corresponding sulfoxide and sulfone were obtained with a high selectivity (98–99%), free of other secondary products. The blank experiment was performed in the absence of the catalyst using an excess of aqueous H2O2 (35% (w/v), 10mmol), and acetonitrile (9mL) as reaction solvent. Under these conditions, the reaction conversion was very low (10% at 60min and 40°C, Table 1 entry 1). The complete conversion of methyl p-tolyl sulfide was obtained in 60min using SiW11MnC as catalyst (Table 1, entry 2). The conversion values reached using the other SiW11MC samples were slightly lower (Table 1, entries 2–5) and decreased in the following order: SiW11MnC>SiW11FeC>SiW11CuC>SiW11CoC. This order was opposite to that found for the TPR SiW 11 MC values. In other words, the activity of the catalysts decreases in parallel with the increment of the TPR SiW 11 MC values. So, the most easily reducible catalyst displayed the highest conversion values. Palermo et al. reported [39] that the oxidation of diphenyl sulfide catalyzed by Mo-based Keggin heteropolyacids takes place through the formation of peroxo-molybdate species and the subsequent nucleophilic attack of the sulfur atom in the sulfide on the peroxo species. Maciuca et al. suggested that the electrophilicity of the peroxide oxygen of H2O2 is increased by an oxometal group (MO) in the heteropolycompound [40]. Additionally, the influence of acidity on the formation rate of peroxo complexes has been reported [41] as well as the fact that the selective oxidation of sulfides to sulfoxides or sulfones in the presence of aqueous H2O2 is promoted by Brönsted acidity [42]. Taking into account that the acidity of the SiW11MC samples decreases in the same way as the catalytic activity and previous reports [41,42], we can suggest that both the easiness of reduction and the acidity strongly affect the catalytic activity of the SiW11MC samples. On the other hand, the selectivity of the catalysts to sulfone was sensitive to the type of cation used in the modification of the lacunary tungstosilicic polyoxometallate and it decreased in parallel with the conversion decrease (80%, 75%, 70% and 65%, respectively, for sulfone production). The possible mechanism for the oxidation of methyl p-tolyl sulfide to the corresponding sulfoxide or sulfone using H2O2 in the presence of SIW11MC catalysts is outlined in Scheme 3. The interaction of hydrogen peroxide with transition metal-modified lacunary tungstosilicic polyoxometallate generates an electrophilic intermediate (peroxo oxygen/TMPOM), which produces an electrophilic attack on the sulfur atom in the sulfide, generating the corresponding sulfoxide (Scheme 2 ). The mechanism for the oxidation of the sulfoxide to the corresponding sulfone is different. First, it involves the formation of a TMPOM-sulfoxide intermediate through the nucleophilic attack on the tungsten atom in the TMPOM by the oxygen of the sulfoxide, and then the nucleophilic attack of the sulfur atom in TMPOM-sulfoxide by H2O2 via an SN2 mechanism [43–45] (Scheme 2). The selective oxidation of methyl-p-tolyl sulfide to the corresponding sulfoxide, in homogeneous and heterogeneous system, using aqueous hydrogen peroxide, catalyzed by heteropolyacids or related compounds such as: H4PMo11VO40 [46], H5PMo11Al0.5V0.5O40 [8], PyHPMo11VO40 [47], [TBA]4[Al4(H2O)10(β-AsW9O33H2)2]4 [48], [TBA]4[γ-SiW10O36(PhPO)2] [49], [TBA]4[γ-HPW10V2O40] [50], H3[PW12O40]-polyacrylamide based ammonium salt [51], and [γ-1,2-H2SiW10V2O40] [52], were reported in the literature. In all the above mentioned examples, the reaction yields were high and very similar to those obtained using the methodology reported in this work. However, our SIW11MC catalysts have some advantages for example: easy preparation, no moisture sensitive and very low toxicity of the catalyst. Additionally, they could be used and easily recycled several times, without appreciable loss of their catalytic activity. 3.2.2 Effect of the solvent on the reaction activity Then, with the most active catalyst, SiW11MnC, we decided to study the effect of solvent and catalyst reusability for the oxidation of methyl p-tolyl sulfide (Table 2). The reaction was attempted with different solvents, such as ethanol, acetonitrile, and toluene. Complete subtract conversion was obtained using ethanol and acetonitrile (Table 2, entries 1 and 2). However, when toluene was used as solvent, two phases were observed due to aqueous hydrogen peroxide insolubility in toluene, and methyl p-tolyl sulfide conversion was significantly lower (Table 2, entry 3). The catalyst was recovered by filtration, washed with the reaction solvent, dried in vacuum at 40°C and reused. The conversion remained practically constant when acetonitrile or toluene was used as solvent. However, in the case of ethanol, the conversion was remarkably lower (Table 2, entry 1). This was in agreement with the leaching experiments that showed that only when the catalysts were extracted with ethanol, an important loss of the [SiW11O39Mn]6− lacunary anion (almost 22% of the original amount) took place. For the SiW11MnC catalyst, an additional test was performed in order to evaluate the possible catalyst solubilization. The sample was refluxed in acetonitrile at 40°C for 2h, filtered and dried in vacuum till constant weight. The activity of the so-treated catalyst was the same as that of the fresh catalyst. The refluxed acetonitrile was used as solvent for attempting the reaction without adding the catalyst. After 1h, a conversion similar to that of the blank experiment (10%), was obtained. 3.2.3 Effect of the reaction conditions on the selectivity The reaction conditions were optimized using methyl p-tolyl sulfide as substrate at 20°C. The results of the study of the oxidation reaction of methyl p-tolyl sulfide with the use of SiW11MnC as catalyst are summarized in Table 3 . A conversion of 15% was obtained in the absence of the catalyst at 20°C, in a time period of 10h using 10mmol of 35% (w/v) hydrogen peroxide (Table 3, entry 1). However, when SiW11MnC catalyst was added (Table 3, entry 2), the reaction took place efficiently obtaining a conversion of 75% with a 95% selectivity of the corresponding sulfoxide in 10h. Then, the effect of H2O2 amount on conversion and selectivity was studied using four different H2O2 amounts: 1, 2, 5 and 10mmol (Table 3, entries 2–5). When 2, 5 and 10mmol were used, a conversion of 100% was obtained in 7, 5 and 4h, respectively; however, sulfoxide selectivity was very good only when 2mmol of H2O2 was used (conversion 100%, sulfoxide selectivity 91%), (Table 3, entry 3). This condition was considered as a optimal for the selective synthesis of sulfoxides. In order to continue with the study of the reaction optimization, the effect of temperature on the conversion and selectivity of methyl p-tolyl sulfide was analyzed using H2O2 in excess (10mmol) (Table 3, entries 5–8). As can be observed, at 20°C, the reaction reached 100% of methyl p-tolyl sulfide conversion, but the selectivity to sulfone was only 68% (Table 3, entry 5). An increase of the reaction temperature improved the selectivity to sulfone values. For example, at 50°C and for 3h, 100% selectivity to methyl p-tolyl sulfone was achieved (Table 3, entry 8). Once the reaction conditions for the selective oxidation of sulfides to sulfoxides and sulfones had been optimized, the reaction was extended to other different substrates. Diaryl (Table 4 , entries 1, 2 and 12), aryl–alkyl (Table 4, entries 3–6 and 10), dialkyl (Table 4, entries 7 and 8) and more complex sulfides (Table 4, entries 9, 11) were used as starting materials. In Table 4, the third column shows the results obtained for the selective oxidation of these sulfides to the corresponding sulfoxides. All the reactions were run within a reasonable short reaction time and the sulfoxides were obtained in excellent yields (92–59%), and only traces of sulfones and other secondary products were detected. Therefore, the reaction condition is selective to the transformation of sulfides to sulfoxides. For example, in Table 4 (entries 5 and 10), it can be seen that the hydroxyl and the formyl groups were not significantly affected under these reaction conditions. On the other hand, the sulfide 4,4′-diamino-diphenyl sulfide (Table 4, entry 12) can be oxidized to the corresponding sulfoxide or sulfone under the suitable reaction conditions with good yields. For this substrate, low amounts of several secondary unidentified compounds were detected by TLC. The optimized conditions were: 1mmol of sulfide, 0.2mL of 35% p/V H2O2, 100mg of SiW11MnC catalyst, 9mL of acetonitrile, 20ºC, during a time period depending on the substrate structure. The procedure allows obtaining dapsone (a leader drug for leprae) with good yields (71%, Table 4, entry 12). Finally, the selective oxidation of sulfide to the corresponding sulfone was obtained with excellent yields (Table 4), in short time periods (2–4h) by increasing the reaction temperature from 20 to 50°C. 3.2.4 Reaction chemoselectivity In order to determine the chemoselectivity of the SiW11MnC catalyst under the previously mentioned reaction conditions, some competitive reactions were studied. Thus, the competitive oxidation of sulfides in the presence of benzylic alcohol, benzaldehyde, benzonitrile, cyclohexene and methyl- p-tolyl sulfoxide was checked (Scheme 3). These experiments show that the method is applicable for the chemoselective oxidation of sulfides to sulfoxides in the presence of the previously mentioned functional groups and can be considered as a useful practical method for the oxidation of sulfides to sulfoxides without appreciable oxidation of other functional groups. The optimal reaction conditions for the chemoselective oxidation of sulfides were: 1mmol of sulfide, 1mmol of the other substrate, 0.2mL of 35% p/V H2O2, 100mg of SiW11MnC catalyst, 9mL of acetonitrile, 20°C, after 7h under continuous stirring. 3.2.5 Sulfide reactivity study Recently, we found that there is a relationship between sulfide oxidation facility and the sulfur atom charge obtained by a computational method [46]. For this reason, we explored again the reactivity of the different sulfides tested in the present work, using a semi-empirical method. The relationship between the electron densities of the sulfur atoms, which were estimated by Hyperchem release 5, and the oxidative facility of the sulfur-containing compounds was analyzed. The electron densities on the sulfur atom of the 12 sulfides, which varied between −0.078 and 0.168, are shown in Fig. 5 . Fig. 5 shows a relationship between the substrate reactivity, evaluated as the reaction time for a 100% conversion of sulfide, and the electron densities on the sulfur atom. From the results obtained, it could be observed that dialkyl sulfides (−0.031, −0.047 and −0.078) are more reactive than alkyl–aryl sulfides (0.076–0.097), and alkyl–aryl sulfides are more reactive than diaryl sulfides (0.165 and 0.220). This different reactivity is associated with the electronic density on the sulfur, since a higher electronic density on this atom facilitates the electrophilic attack of the electrophilic intermediate peroxo oxygen/TMPOM. Finally, in order to explore a possible reaction mechanism, an additional experiment was performed using a radical inhibitor such as t-butanol. The experimental conditions were: 1mmol of methyl p-tolyl sulfide, 0.2mL of H2O2 (35% w/v), 100mg of SiW11MnC, 8mL of acetonitrile and 1mL of t-butanol; reaction for 7h at 20°C. In these conditions, the conversion of methyl p-tolyl sulfide (100%) and the selectivity of sulfoxide (91%) obtained were similar to those reached without a radical inhibitor. This result indicates that the reaction does not take place via a free radical path and it is in agreement with the suggested mechanism. 4 Conclusions The sodium salts of metal-modified lacunary tungstosilicic polyoxometallates [SiW11O39M(H2O)]6−, where M=Mn2+, Fe2+, Co2+or Cu2+, were successfully prepared and supported on activated carbon to obtain the SiW11MC catalysts. The [SiW11O39M]6− anions are the main species present in SiW11MC materials and they are uniformly distributed along the width of the carbon particles. As a result of their interaction with the support surface groups, the [SiW11O39M]6− anion temperature decomposition was slightly enhanced. The activity and selectivity of the catalysts were evaluated in the selective oxidation of methyl p-tolyl sulfide to the corresponding sulfoxides or sulfones. The reaction was carried out in acetonitrile as solvent using H2O2 35% p/V as a clean oxidant. The conversion values decreased in the following order: SiW11MnC>SiW11FeC>SiW11CuC>SiW11CoC, and it was found that the activity of the catalysts decreases in parallel with the increment in the reduction temperature ( TPR SiW 11 MC ) values. The most easily reducible catalyst displayed the highest conversion values. In this research, we found a convenient and selective procedure for oxidizing sulfides to sulfoxides, using 35% (w/v) aqueous hydrogen peroxide and a catalytic amount of lacunary tungstosilicic polyoxometallates supported on carbon. The reaction for sulfoxide preparation was carried out at room temperature (20°C), in a reasonably short reaction time. Meanwhile, the selective oxidation of sulfides to sulfones required a temperature of 50°C and aqueous hydrogen peroxide in excess. Under this condition, excellent yields of sulfone were obtained. The different reactivity of sulfides is associated with the electronic density on the sulfur atom, since a higher electronic density on this atom facilitates the attack by the electrophilic form of the hydrogen peroxide/catalyst system. Using carbon-supported lacunary tungstosilicic polyoxometallates as catalysts, the heterogeneous liquid-phase sulfoxidation of methyl p-tolyl sulfide takes place without significant loss of the active phase, facilitating the separation and reuse. The use of aqueous hydrogen peroxide gives only water as a byproduct, contributing to the field of clean technologies. Acknowledgements The authors thank Agencia Nacional de Promoción Científica y Tecnológica, CONICET and Universidad Nacional de La Plata (Argentina) for the financial support and L. Osiglio, D. Peña and N. Firpo for their collaboration in the experimental measurements. References [1] S.S. Kim G. Rajagopal Synth. Commun. 34 2004 2237 2243 [2] D. Choudhary S. Paul R. Gupta J.H. Clark Green Chem. 8 2006 479 482 [3] A. Hasaninejad M. Zolfigol G. Chehardoli M. Mokhlesi J. Serb. Chem. Soc. 75 2010 307 316 [4] G. Yadav Catal. Surv. Asia 9 2005 117 137 [5] I.V. Kozhevnikov J. Mol. Catal. A: Chem. 262 2007 86 92 [6] M. Misono I. Ono G. Koyano A. Aoshima M. Misono I. Ono G. Koyano A. Aoshimam Pure Appl. Chem. 72 2000 1305 1311 [7] L.R. Pizzio P.G. Vázquez C.V. Cáceres M.N. Blanco Appl. Catal. A: Gen. 256 2003 125 139 [8] G. Romanelli D. Bennardi V. Palermo P. Vázquez P. Tundo Lett. Org. Chem. 4 2007 544 549 [9] V. Palermo P. Villabrille P. Vázquez P. Tundo C. Cáceres G. Romanelli J. Chem. Sci. 125 2013 1375 1383 [10] P. Tundo G. Romanelli P. Vázquez P. Loris F. Aricó Synlett 7 2008 667 670 [11] V. Palermo A. Sathicq P. Vázquez H. Thomas G. Romanelli React. Kinet. Mech. Catal. 104 2011 181 195 [12] L. Sánchez G. Sathicq G. Baronetti H. Thomas G. Romanelli Catal. Lett. 144 2014 172 180 [13] M.M.Q. Simoes C.M.M. Conceiao J.A.F. Gamelas P.M.D.N. Domínguez A.M.V. Cavaleiro J.A.S. Cavaleiro A.J.V. Ferrer-Correira R.A.W. Johnstone J. Mol. Catal. A: Chem. 144 1999 461 468 [14] S. Ellis I.V. Kozhevnikov J. Mol. Catal. A: Chem. 187 2002 227 235 [15] R. Frenzel G.P. Romanelli M.N. Blanco L.R. Pizzio J. Chem. Sci. 127 2015 123 132 [16] F. Liu Z. Fu Y. Liu C. Lu Y. Wu F. Xie Z. Ye X. Zhon D. Yin Ind. Eng. Chem. Res. 49 2010 2533 2536 [17] I. Fernández N. Khiar Chem. Rev. 103 2003 3651 3706 [18] A.M. Khenkin R. Neumann J. Am. Chem. Soc. 124 2002 4198 4199 [19] M. Vaz-Da-Silva A.I. Loureiro T. Nunes J. Maia S. Tavares A. Falcão P. Silveira L. Almeida P. Soares-Da-Silva Clin. Drug Invest. 25 2005 391 399 [20] Y. Isabel Zhu M.J. Stiller J. Am. Acad. Dermatol. 45 2001 420 434 [21] F. Gregori I. Nobili F. Bigi R. Maggi G. Predieri G. Sartori J. Mol. Catal. A: Chem. 286 2008 124 127 [22] M. Mokhtary M. Qandalee M.R. Niaki E-J. Chem. 9 2012 863 868 [23] S. Zakavi A. Abasi A.R. Pourali S. Talebzadeh Bull. Kor. Chem. Soc. 33 2012 35 38 [24] A. Rostami F. Hassanian A. Ghorbani-Choghamarani S. Saadati Phosphorus Sulfur Silicon Relat. Elem. 188 2013 833 838 [25] H. Jafari A. Rostami F. Ahmad-Jangi A. Ghorbani-Choghamarani Synth. Commun. 42 2012 3150 3155 [26] Y. Kon T. Yokoi M. Yoshioka Y. Uesaka H. Kujira K. Sato T. Tatsumi Tetrahedron Lett. 54 2013 4918 4921 [27] M. Rahimizadeh G. Rajabzadeh S. Khatami H. Eshghi A. Shiri J. Mol. Catal. A: Chem. 323 2010 59 64 [28] A. Tézé G. Hervé Inorg. Synth. 27 1990 85 96 [29] A. Tézé G. Hervé J. Inorg. Nucl. Chem. 39 1977 2151 2154 [30] A. Tézé G. Hervé Inorg. Synth. 27 1990 96 104 [31] L.R. Pizzio P.G. Vázquez C.V. Cáceres M.N. Blanco Adsorpt. Sci. Technol. 13 1996 165 176 [32] H. Viturro R. Bonetto L.R. Pizzio P.G. Vázquez M. Sánchez G. Alvarez X-ray Spectrom. 24 1995 3 8 [33] C. Rocchiccioli-Deltcheff R. Thouvenot C.R. Acad. Sci. Paris 278 1974 857 860 [34] G.K.M. Abotsi A.W. Scaroni Carbon 28 1990 79 84 [35] J.A. Gamelas F.A.S. Couto M.C.N. Trovão A.M.V. Cavaleiro J.A.S. Cavaleiro J.D. Pedrosa de Jesús Thermochim. Acta 326 1999 165 173 [36] J.R. Sohn H.J. Jang J. Mol. Catal. 64 1991 349 360 [37] M.E. Chimienti L.R. Pizzio C.V. Cáceres M.N. Blanco Appl. Catal. A: Gen. 208 2001 7 19 [38] L.R. Pizzio M.N. Blanco App. Catal. A: Gen. 255 2003 265 277 [39] V. Palermo G.P. Romanelli P.G. Vazquez J. Mol. Catal. A: Chem. 373 2013 142 150 [40] A.L. Maciuca C.E. Ciocan E. Dumitriu F. Fajula V. Hulea Catal. Today 138 2008 33 37 [41] Y. Ishii K. Yamawaki T. Ura H. Yamada T. Yoshida M. Ogawa J. Org. Chem. 53 1988 3581 3593 [42] A. Shaabani A.H. Rezayan Catal. Comm. 8 2007 1112 1116 [43] A.L. Maciuca C.E. Ciocan E. Dumitriu F. Fajula V. Hulea Catal. Today 138 2008 33 37 [44] A. Chellamani S. Harikengaram J. Mol. Catal. A: Chem. 247 2006 260 267 [45] J.R. Lindsay Smith B.C. Gilbert A. Mairata i Payeras J. Murray T.R. Lowdon J. Oakes R. Pons i Prats P.H. Walton J. Mol. Catal. A: Chem. 251 2006 114 122 [46] V. Palermo A. Sathicq P. Vázquez G. Romanelli Phosphorus Sulfur Silicon Relat. Elem. 189 2014 1 10 [47] G. Romanelli P. Villabrille C. Cáceres P. Vázquez P. Tundo Catal.Commun. 12 2011 726 730 [48] M. Carraro S. Bassil-Bassen A. Soraru S. Berardi A. Suchopar U. Kortz M. Bonchio Chem. Commun. 49 2013 7914 7916 [49] M. Carraro L. Sandei A. Sartorel G. Scorrano M. Bonchio Org. Lett. 8 17 2006 3671 3674 [50] T. Yamaura K. Kamata K. Yamaguchi N. Mizuno Catal. Today 203 2013 76 80 [51] Y. Yamada H. Tabata M. Ichinohe H. Takahashi S. Ikegami Tetrahedron 60 2004 4087 4096 [52] J. Kasai Y. Nakagawa S. Uchida K. Yamaguchi N. Mizuno Chem.: Eur. J. 12 2006 4176 4184",
      "scopus-id": "84925990045",
      "coredata": {
        "eid": "1-s2.0-S1381116915000783",
        "dc:description": "Lacunary tungstosilicic polyoxometallates modified with transition metal ions [SiW11O39M(H2O)]6−, where M=Mn2+, Fe2+, Co2+or Cu2+, were synthesized and supported on activated carbon to obtain the SiW11MC catalysts. The samples were characterized by FT-IR, XRD, N2 adsorption–desorption measurements, and the acidic properties were determined using the isopropanol dehydration test reaction. The activity and selectivity of the catalysts were evaluated in the selective oxidation of a series of sulfides to sulfoxides or sulfone. The reaction was carried out in acetonitrile as solvent using H2O2 35% p/V as a clean oxidant. The conversion values decreased in the following order: SiW11MnC>SiW11FeC>SiW11CuC>SiW11CoC. The catalysts were reused without appreciable loss of their catalytic activity. It was found that the activity of the catalysts decreases in parallel with the increment in the reduction temperature values. The most easily reducible catalyst displayed the highest conversion values. We found a convenient and selective procedure for oxidizing sulfides to sulfoxides or sulfones using aqueous hydrogen peroxide and a catalytic amount of lacunary tungstosilicic polyoxometallates supported on carbon at low temperatures (20–50°C) in a reasonably short reaction time.",
        "openArchiveArticle": "false",
        "prism:coverDate": "2015-07-31",
        "openaccessUserLicense": null,
        "prism:aggregationType": "Journal",
        "prism:url": "https://api.elsevier.com/content/article/pii/S1381116915000783",
        "dc:creator": [
          {
            "@_fa": "true",
            "$": "Frenzel, Romina"
          },
          {
            "@_fa": "true",
            "$": "Sathicq, Ángel G."
          },
          {
            "@_fa": "true",
            "$": "Blanco, Mirta N."
          },
          {
            "@_fa": "true",
            "$": "Romanelli, Gustavo P."
          },
          {
            "@_fa": "true",
            "$": "Pizzio, Luis R."
          }
        ],
        "link": [
          {
            "@_fa": "true",
            "@rel": "self",
            "@href": "https://api.elsevier.com/content/article/pii/S1381116915000783"
          },
          {
            "@_fa": "true",
            "@rel": "scidir",
            "@href": "https://www.sciencedirect.com/science/article/pii/S1381116915000783"
          }
        ],
        "dc:format": "application/json",
        "openaccessType": null,
        "pii": "S1381-1169(15)00078-3",
        "prism:volume": "403",
        "prism:publisher": "Elsevier B.V.",
        "dc:title": "Carbon-supported metal-modified lacunary tungstosilicic polyoxometallates used as catalysts in the selective oxidation of sulfides",
        "prism:copyright": "Copyright © 2015 Elsevier B.V. All rights reserved.",
        "openaccess": "0",
        "prism:issn": "13811169",
        "dcterms:subject": [
          {
            "@_fa": "true",
            "$": "Supported metal-substituted polyoxometallates"
          },
          {
            "@_fa": "true",
            "$": "Carbon"
          },
          {
            "@_fa": "true",
            "$": "Sulfide oxidation"
          },
          {
            "@_fa": "true",
            "$": "Hydrogen peroxide"
          }
        ],
        "openaccessArticle": "false",
        "prism:publicationName": "Journal of Molecular Catalysis A: Chemical",
        "openaccessSponsorType": null,
        "prism:pageRange": "27-36",
        "prism:endingPage": "36",
        "pubType": "fla",
        "prism:coverDisplayDate": "July 2015",
        "prism:doi": "10.1016/j.molcata.2015.02.021",
        "prism:startingPage": "27",
        "dc:identifier": "doi:10.1016/j.molcata.2015.02.021",
        "openaccessSponsorName": null
      },
      "objects": {
        "object": [
          {
            "@category": "thumbnail",
            "@height": "16",
            "@width": "73",
            "@_fa": "true",
            "$": "https://api.elsevier.com/content/object/eid/1-s2.0-S1381116915000783-si4.gif?httpAccept=%2A%2F%2A",
            "@multimediatype": "GIF image file",
            "@type": "ALTIMG",
            "@size": "358",
            "@ref": "si4",
            "@mimetype": "image/gif"
          },
          {
            "@category": "thumbnail",
            "@height": "16",
            "@width": "73",
            "@_fa": "true",
            "$": "https://api.elsevier.com/content/object/eid/1-s2.0-S1381116915000783-si3.gif?httpAccept=%2A%2F%2A",
            "@multimediatype": "GIF image file",
            "@type": "ALTIMG",
            "@size": "358",
            "@ref": "si3",
            "@mimetype": "image/gif"
          },
          {
            "@category": "thumbnail",
            "@height": "16",
            "@width": "73",
            "@_fa": "true",
            "$": "https://api.elsevier.com/content/object/eid/1-s2.0-S1381116915000783-si2.gif?httpAccept=%2A%2F%2A",
            "@multimediatype": "GIF image file",
            "@type": "ALTIMG",
            "@size": "358",
            "@ref": "si2",
            "@mimetype": "image/gif"
          },
          {
            "@category": "thumbnail",
            "@height": "16",
            "@width": "73",
            "@_fa": "true",
            "$": "https://api.elsevier.com/content/object/eid/1-s2.0-S1381116915000783-si1.gif?httpAccept=%2A%2F%2A",
            "@multimediatype": "GIF image file",
            "@type": "ALTIMG",
            "@size": "358",
            "@ref": "si1",
            "@mimetype": "image/gif"
          },
          {
            "@category": "high",
            "@height": "1276",
            "@width": "1639",
            "@_fa": "true",
            "$": "https://api.elsevier.com/content/object/eid/1-s2.0-S1381116915000783-sc3_lrg.jpg?httpAccept=%2A%2F%2A",
            "@multimediatype": "JPEG image file",
            "@type": "IMAGE-HIGH-RES",
            "@size": "142190",
            "@ref": "sc3",
            "@mimetype": "image/jpeg"
          },
          {
            "@category": "high",
            "@height": "1745",
            "@width": "2333",
            "@_fa": "true",
            "$": "https://api.elsevier.com/content/object/eid/1-s2.0-S1381116915000783-sc2_lrg.jpg?httpAccept=%2A%2F%2A",
            "@multimediatype": "JPEG image file",
            "@type": "IMAGE-HIGH-RES",
            "@size": "299718",
            "@ref": "sc2",
            "@mimetype": "image/jpeg"
          },
          {
            "@category": "high",
            "@height": "247",
            "@width": "1274",
            "@_fa": "true",
            "$": "https://api.elsevier.com/content/object/eid/1-s2.0-S1381116915000783-sc1_lrg.jpg?httpAccept=%2A%2F%2A",
            "@multimediatype": "JPEG image file",
            "@type": "IMAGE-HIGH-RES",
            "@size": "37084",
            "@ref": "sc1",
            "@mimetype": "image/jpeg"
          },
          {
            "@category": "high",
            "@height": "1295",
            "@width": "1635",
            "@_fa": "true",
            "$": "https://api.elsevier.com/content/object/eid/1-s2.0-S1381116915000783-gr5_lrg.jpg?httpAccept=%2A%2F%2A",
            "@multimediatype": "JPEG image file",
            "@type": "IMAGE-HIGH-RES",
            "@size": "174668",
            "@ref": "gr5",
            "@mimetype": "image/jpeg"
          },
          {
            "@category": "high",
            "@height": "1789",
            "@width": "2222",
            "@_fa": "true",
            "$": "https://api.elsevier.com/content/object/eid/1-s2.0-S1381116915000783-gr4_lrg.jpg?httpAccept=%2A%2F%2A",
            "@multimediatype": "JPEG image file",
            "@type": "IMAGE-HIGH-RES",
            "@size": "217758",
            "@ref": "gr4",
            "@mimetype": "image/jpeg"
          },
          {
            "@category": "high",
            "@height": "1782",
            "@width": "2382",
            "@_fa": "true",
            "$": "https://api.elsevier.com/content/object/eid/1-s2.0-S1381116915000783-gr3_lrg.jpg?httpAccept=%2A%2F%2A",
            "@multimediatype": "JPEG image file",
            "@type": "IMAGE-HIGH-RES",
            "@size": "257804",
            "@ref": "gr3",
            "@mimetype": "image/jpeg"
          },
          {
            "@category": "high",
            "@height": "998",
            "@width": "844",
            "@_fa": "true",
            "$": "https://api.elsevier.com/content/object/eid/1-s2.0-S1381116915000783-gr2_lrg.jpg?httpAccept=%2A%2F%2A",
            "@multimediatype": "JPEG image file",
            "@type": "IMAGE-HIGH-RES",
            "@size": "98073",
            "@ref": "gr2",
            "@mimetype": "image/jpeg"
          },
          {
            "@category": "high",
            "@height": "271",
            "@width": "1000",
            "@_fa": "true",
            "$": "https://api.elsevier.com/content/object/eid/1-s2.0-S1381116915000783-gr1_lrg.jpg?httpAccept=%2A%2F%2A",
            "@multimediatype": "JPEG image file",
            "@type": "IMAGE-HIGH-RES",
            "@size": "33887",
            "@ref": "gr1",
            "@mimetype": "image/jpeg"
          },
          {
            "@category": "high",
            "@height": "99",
            "@width": "418",
            "@_fa": "true",
            "$": "https://api.elsevier.com/content/object/eid/1-s2.0-S1381116915000783-fx9_lrg.jpg?httpAccept=%2A%2F%2A",
            "@multimediatype": "JPEG image file",
            "@type": "IMAGE-HIGH-RES",
            "@size": "11878",
            "@ref": "fx9",
            "@mimetype": "image/jpeg"
          },
          {
            "@category": "high",
            "@height": "176",
            "@width": "419",
            "@_fa": "true",
            "$": "https://api.elsevier.com/content/object/eid/1-s2.0-S1381116915000783-fx8_lrg.jpg?httpAccept=%2A%2F%2A",
            "@multimediatype": "JPEG image file",
            "@type": "IMAGE-HIGH-RES",
            "@size": "16984",
            "@ref": "fx8",
            "@mimetype": "image/jpeg"
          },
          {
            "@category": "high",
            "@height": "266",
            "@width": "367",
            "@_fa": "true",
            "$": "https://api.elsevier.com/content/object/eid/1-s2.0-S1381116915000783-fx7_lrg.jpg?httpAccept=%2A%2F%2A",
            "@multimediatype": "JPEG image file",
            "@type": "IMAGE-HIGH-RES",
            "@size": "18183",
            "@ref": "fx7",
            "@mimetype": "image/jpeg"
          },
          {
            "@category": "high",
            "@height": "190",
            "@width": "356",
            "@_fa": "true",
            "$": "https://api.elsevier.com/content/object/eid/1-s2.0-S1381116915000783-fx6_lrg.jpg?httpAccept=%2A%2F%2A",
            "@multimediatype": "JPEG image file",
            "@type": "IMAGE-HIGH-RES",
            "@size": "14951",
            "@ref": "fx6",
            "@mimetype": "image/jpeg"
          },
          {
            "@category": "high",
            "@height": "190",
            "@width": "322",
            "@_fa": "true",
            "$": "https://api.elsevier.com/content/object/eid/1-s2.0-S1381116915000783-fx5_lrg.jpg?httpAccept=%2A%2F%2A",
            "@multimediatype": "JPEG image file",
            "@type": "IMAGE-HIGH-RES",
            "@size": "14718",
            "@ref": "fx5",
            "@mimetype": "image/jpeg"
          },
          {
            "@category": "high",
            "@height": "213",
            "@width": "381",
            "@_fa": "true",
            "$": "https://api.elsevier.com/content/object/eid/1-s2.0-S1381116915000783-fx4_lrg.jpg?httpAccept=%2A%2F%2A",
            "@multimediatype": "JPEG image file",
            "@type": "IMAGE-HIGH-RES",
            "@size": "16481",
            "@ref": "fx4",
            "@mimetype": "image/jpeg"
          },
          {
            "@category": "high",
            "@height": "250",
            "@width": "315",
            "@_fa": "true",
            "$": "https://api.elsevier.com/content/object/eid/1-s2.0-S1381116915000783-fx3_lrg.jpg?httpAccept=%2A%2F%2A",
            "@multimediatype": "JPEG image file",
            "@type": "IMAGE-HIGH-RES",
            "@size": "19925",
            "@ref": "fx3",
            "@mimetype": "image/jpeg"
          },
          {
            "@category": "high",
            "@height": "190",
            "@width": "315",
            "@_fa": "true",
            "$": "https://api.elsevier.com/content/object/eid/1-s2.0-S1381116915000783-fx2_lrg.jpg?httpAccept=%2A%2F%2A",
            "@multimediatype": "JPEG image file",
            "@type": "IMAGE-HIGH-RES",
            "@size": "17106",
            "@ref": "fx2",
            "@mimetype": "image/jpeg"
          },
          {
            "@category": "high",
            "@height": "266",
            "@width": "534",
            "@_fa": "true",
            "$": "https://api.elsevier.com/content/object/eid/1-s2.0-S1381116915000783-fx13_lrg.jpg?httpAccept=%2A%2F%2A",
            "@multimediatype": "JPEG image file",
            "@type": "IMAGE-HIGH-RES",
            "@size": "23471",
            "@ref": "fx13",
            "@mimetype": "image/jpeg"
          },
          {
            "@category": "high",
            "@height": "456",
            "@width": "326",
            "@_fa": "true",
            "$": "https://api.elsevier.com/content/object/eid/1-s2.0-S1381116915000783-fx12_lrg.jpg?httpAccept=%2A%2F%2A",
            "@multimediatype": "JPEG image file",
            "@type": "IMAGE-HIGH-RES",
            "@size": "22644",
            "@ref": "fx12",
            "@mimetype": "image/jpeg"
          },
          {
            "@category": "high",
            "@height": "203",
            "@width": "397",
            "@_fa": "true",
            "$": "https://api.elsevier.com/content/object/eid/1-s2.0-S1381116915000783-fx11_lrg.jpg?httpAccept=%2A%2F%2A",
            "@multimediatype": "JPEG image file",
            "@type": "IMAGE-HIGH-RES",
            "@size": "16357",
            "@ref": "fx11",
            "@mimetype": "image/jpeg"
          },
          {
            "@category": "high",
            "@height": "184",
            "@width": "361",
            "@_fa": "true",
            "$": "https://api.elsevier.com/content/object/eid/1-s2.0-S1381116915000783-fx10_lrg.jpg?httpAccept=%2A%2F%2A",
            "@multimediatype": "JPEG image file",
            "@type": "IMAGE-HIGH-RES",
            "@size": "17388",
            "@ref": "fx10",
            "@mimetype": "image/jpeg"
          },
          {
            "@category": "high",
            "@height": "886",
            "@width": "2213",
            "@_fa": "true",
            "$": "https://api.elsevier.com/content/object/eid/1-s2.0-S1381116915000783-fx1_lrg.jpg?httpAccept=%2A%2F%2A",
            "@multimediatype": "JPEG image file",
            "@type": "IMAGE-HIGH-RES",
            "@size": "198139",
            "@ref": "fx1",
            "@mimetype": "image/jpeg"
          },
          {
            "@category": "standard",
            "@height": "480",
            "@width": "617",
            "@_fa": "true",
            "$": "https://api.elsevier.com/content/object/eid/1-s2.0-S1381116915000783-sc3.jpg?httpAccept=%2A%2F%2A",
            "@multimediatype": "JPEG image file",
            "@type": "IMAGE-DOWNSAMPLED",
            "@size": "44187",
            "@ref": "sc3",
            "@mimetype": "image/jpeg"
          },
          {
            "@category": "standard",
            "@height": "394",
            "@width": "527",
            "@_fa": "true",
            "$": "https://api.elsevier.com/content/object/eid/1-s2.0-S1381116915000783-sc2.jpg?httpAccept=%2A%2F%2A",
            "@multimediatype": "JPEG image file",
            "@type": "IMAGE-DOWNSAMPLED",
            "@size": "41800",
            "@ref": "sc2",
            "@mimetype": "image/jpeg"
          },
          {
            "@category": "standard",
            "@height": "93",
            "@width": "479",
            "@_fa": "true",
            "$": "https://api.elsevier.com/content/object/eid/1-s2.0-S1381116915000783-sc1.jpg?httpAccept=%2A%2F%2A",
            "@multimediatype": "JPEG image file",
            "@type": "IMAGE-DOWNSAMPLED",
            "@size": "12335",
            "@ref": "sc1",
            "@mimetype": "image/jpeg"
          },
          {
            "@category": "standard",
            "@height": "292",
            "@width": "369",
            "@_fa": "true",
            "$": "https://api.elsevier.com/content/object/eid/1-s2.0-S1381116915000783-gr5.jpg?httpAccept=%2A%2F%2A",
            "@multimediatype": "JPEG image file",
            "@type": "IMAGE-DOWNSAMPLED",
            "@size": "26525",
            "@ref": "gr5",
            "@mimetype": "image/jpeg"
          },
          {
            "@category": "standard",
            "@height": "404",
            "@width": "502",
            "@_fa": "true",
            "$": "https://api.elsevier.com/content/object/eid/1-s2.0-S1381116915000783-gr4.jpg?httpAccept=%2A%2F%2A",
            "@multimediatype": "JPEG image file",
            "@type": "IMAGE-DOWNSAMPLED",
            "@size": "33728",
            "@ref": "gr4",
            "@mimetype": "image/jpeg"
          },
          {
            "@category": "standard",
            "@height": "402",
            "@width": "538",
            "@_fa": "true",
            "$": "https://api.elsevier.com/content/object/eid/1-s2.0-S1381116915000783-gr3.jpg?httpAccept=%2A%2F%2A",
            "@multimediatype": "JPEG image file",
            "@type": "IMAGE-DOWNSAMPLED",
            "@size": "38646",
            "@ref": "gr3",
            "@mimetype": "image/jpeg"
          },
          {
            "@category": "standard",
            "@height": "375",
            "@width": "317",
            "@_fa": "true",
            "$": "https://api.elsevier.com/content/object/eid/1-s2.0-S1381116915000783-gr2.jpg?httpAccept=%2A%2F%2A",
            "@multimediatype": "JPEG image file",
            "@type": "IMAGE-DOWNSAMPLED",
            "@size": "29653",
            "@ref": "gr2",
            "@mimetype": "image/jpeg"
          },
          {
            "@category": "standard",
            "@height": "102",
            "@width": "376",
            "@_fa": "true",
            "$": "https://api.elsevier.com/content/object/eid/1-s2.0-S1381116915000783-gr1.jpg?httpAccept=%2A%2F%2A",
            "@multimediatype": "JPEG image file",
            "@type": "IMAGE-DOWNSAMPLED",
            "@size": "11657",
            "@ref": "gr1",
            "@mimetype": "image/jpeg"
          },
          {
            "@category": "standard",
            "@height": "37",
            "@width": "157",
            "@_fa": "true",
            "$": "https://api.elsevier.com/content/object/eid/1-s2.0-S1381116915000783-fx9.jpg?httpAccept=%2A%2F%2A",
            "@multimediatype": "JPEG image file",
            "@type": "IMAGE-DOWNSAMPLED",
            "@size": "6441",
            "@ref": "fx9",
            "@mimetype": "image/jpeg"
          },
          {
            "@category": "standard",
            "@height": "66",
            "@width": "157",
            "@_fa": "true",
            "$": "https://api.elsevier.com/content/object/eid/1-s2.0-S1381116915000783-fx8.jpg?httpAccept=%2A%2F%2A",
            "@multimediatype": "JPEG image file",
            "@type": "IMAGE-DOWNSAMPLED",
            "@size": "8559",
            "@ref": "fx8",
            "@mimetype": "image/jpeg"
          },
          {
            "@category": "standard",
            "@height": "100",
            "@width": "138",
            "@_fa": "true",
            "$": "https://api.elsevier.com/content/object/eid/1-s2.0-S1381116915000783-fx7.jpg?httpAccept=%2A%2F%2A",
            "@multimediatype": "JPEG image file",
            "@type": "IMAGE-DOWNSAMPLED",
            "@size": "9155",
            "@ref": "fx7",
            "@mimetype": "image/jpeg"
          },
          {
            "@category": "standard",
            "@height": "72",
            "@width": "134",
            "@_fa": "true",
            "$": "https://api.elsevier.com/content/object/eid/1-s2.0-S1381116915000783-fx6.jpg?httpAccept=%2A%2F%2A",
            "@multimediatype": "JPEG image file",
            "@type": "IMAGE-DOWNSAMPLED",
            "@size": "8071",
            "@ref": "fx6",
            "@mimetype": "image/jpeg"
          },
          {
            "@category": "standard",
            "@height": "71",
            "@width": "121",
            "@_fa": "true",
            "$": "https://api.elsevier.com/content/object/eid/1-s2.0-S1381116915000783-fx5.jpg?httpAccept=%2A%2F%2A",
            "@multimediatype": "JPEG image file",
            "@type": "IMAGE-DOWNSAMPLED",
            "@size": "7977",
            "@ref": "fx5",
            "@mimetype": "image/jpeg"
          },
          {
            "@category": "standard",
            "@height": "80",
            "@width": "143",
            "@_fa": "true",
            "$": "https://api.elsevier.com/content/object/eid/1-s2.0-S1381116915000783-fx4.jpg?httpAccept=%2A%2F%2A",
            "@multimediatype": "JPEG image file",
            "@type": "IMAGE-DOWNSAMPLED",
            "@size": "8364",
            "@ref": "fx4",
            "@mimetype": "image/jpeg"
          },
          {
            "@category": "standard",
            "@height": "94",
            "@width": "118",
            "@_fa": "true",
            "$": "https://api.elsevier.com/content/object/eid/1-s2.0-S1381116915000783-fx3.jpg?httpAccept=%2A%2F%2A",
            "@multimediatype": "JPEG image file",
            "@type": "IMAGE-DOWNSAMPLED",
            "@size": "10228",
            "@ref": "fx3",
            "@mimetype": "image/jpeg"
          },
          {
            "@category": "standard",
            "@height": "71",
            "@width": "118",
            "@_fa": "true",
            "$": "https://api.elsevier.com/content/object/eid/1-s2.0-S1381116915000783-fx2.jpg?httpAccept=%2A%2F%2A",
            "@multimediatype": "JPEG image file",
            "@type": "IMAGE-DOWNSAMPLED",
            "@size": "9227",
            "@ref": "fx2",
            "@mimetype": "image/jpeg"
          },
          {
            "@category": "standard",
            "@height": "100",
            "@width": "201",
            "@_fa": "true",
            "$": "https://api.elsevier.com/content/object/eid/1-s2.0-S1381116915000783-fx13.jpg?httpAccept=%2A%2F%2A",
            "@multimediatype": "JPEG image file",
            "@type": "IMAGE-DOWNSAMPLED",
            "@size": "9817",
            "@ref": "fx13",
            "@mimetype": "image/jpeg"
          },
          {
            "@category": "standard",
            "@height": "171",
            "@width": "122",
            "@_fa": "true",
            "$": "https://api.elsevier.com/content/object/eid/1-s2.0-S1381116915000783-fx12.jpg?httpAccept=%2A%2F%2A",
            "@multimediatype": "JPEG image file",
            "@type": "IMAGE-DOWNSAMPLED",
            "@size": "10688",
            "@ref": "fx12",
            "@mimetype": "image/jpeg"
          },
          {
            "@category": "standard",
            "@height": "76",
            "@width": "149",
            "@_fa": "true",
            "$": "https://api.elsevier.com/content/object/eid/1-s2.0-S1381116915000783-fx11.jpg?httpAccept=%2A%2F%2A",
            "@multimediatype": "JPEG image file",
            "@type": "IMAGE-DOWNSAMPLED",
            "@size": "8493",
            "@ref": "fx11",
            "@mimetype": "image/jpeg"
          },
          {
            "@category": "standard",
            "@height": "69",
            "@width": "135",
            "@_fa": "true",
            "$": "https://api.elsevier.com/content/object/eid/1-s2.0-S1381116915000783-fx10.jpg?httpAccept=%2A%2F%2A",
            "@multimediatype": "JPEG image file",
            "@type": "IMAGE-DOWNSAMPLED",
            "@size": "8891",
            "@ref": "fx10",
            "@mimetype": "image/jpeg"
          },
          {
            "@category": "standard",
            "@height": "200",
            "@width": "500",
            "@_fa": "true",
            "$": "https://api.elsevier.com/content/object/eid/1-s2.0-S1381116915000783-fx1.jpg?httpAccept=%2A%2F%2A",
            "@multimediatype": "JPEG image file",
            "@type": "IMAGE-DOWNSAMPLED",
            "@size": "18168",
            "@ref": "fx1",
            "@mimetype": "image/jpeg"
          },
          {
            "@category": "thumbnail",
            "@height": "163",
            "@width": "210",
            "@_fa": "true",
            "$": "https://api.elsevier.com/content/object/eid/1-s2.0-S1381116915000783-sc3.sml?httpAccept=%2A%2F%2A",
            "@multimediatype": "GIF image file",
            "@type": "IMAGE-THUMBNAIL",
            "@size": "2633",
            "@ref": "sc3",
            "@mimetype": "image/gif"
          },
          {
            "@category": "thumbnail",
            "@height": "164",
            "@width": "219",
            "@_fa": "true",
            "$": "https://api.elsevier.com/content/object/eid/1-s2.0-S1381116915000783-sc2.sml?httpAccept=%2A%2F%2A",
            "@multimediatype": "GIF image file",
            "@type": "IMAGE-THUMBNAIL",
            "@size": "4874",
            "@ref": "sc2",
            "@mimetype": "image/gif"
          },
          {
            "@category": "thumbnail",
            "@height": "42",
            "@width": "219",
            "@_fa": "true",
            "$": "https://api.elsevier.com/content/object/eid/1-s2.0-S1381116915000783-sc1.sml?httpAccept=%2A%2F%2A",
            "@multimediatype": "GIF image file",
            "@type": "IMAGE-THUMBNAIL",
            "@size": "1122",
            "@ref": "sc1",
            "@mimetype": "image/gif"
          },
          {
            "@category": "thumbnail",
            "@height": "164",
            "@width": "207",
            "@_fa": "true",
            "$": "https://api.elsevier.com/content/object/eid/1-s2.0-S1381116915000783-gr5.sml?httpAccept=%2A%2F%2A",
            "@multimediatype": "GIF image file",
            "@type": "IMAGE-THUMBNAIL",
            "@size": "4510",
            "@ref": "gr5",
            "@mimetype": "image/gif"
          },
          {
            "@category": "thumbnail",
            "@height": "164",
            "@width": "204",
            "@_fa": "true",
            "$": "https://api.elsevier.com/content/object/eid/1-s2.0-S1381116915000783-gr4.sml?httpAccept=%2A%2F%2A",
            "@multimediatype": "GIF image file",
            "@type": "IMAGE-THUMBNAIL",
            "@size": "5248",
            "@ref": "gr4",
            "@mimetype": "image/gif"
          },
          {
            "@category": "thumbnail",
            "@height": "164",
            "@width": "219",
            "@_fa": "true",
            "$": "https://api.elsevier.com/content/object/eid/1-s2.0-S1381116915000783-gr3.sml?httpAccept=%2A%2F%2A",
            "@multimediatype": "GIF image file",
            "@type": "IMAGE-THUMBNAIL",
            "@size": "5940",
            "@ref": "gr3",
            "@mimetype": "image/gif"
          },
          {
            "@category": "thumbnail",
            "@height": "163",
            "@width": "138",
            "@_fa": "true",
            "$": "https://api.elsevier.com/content/object/eid/1-s2.0-S1381116915000783-gr2.sml?httpAccept=%2A%2F%2A",
            "@multimediatype": "GIF image file",
            "@type": "IMAGE-THUMBNAIL",
            "@size": "3468",
            "@ref": "gr2",
            "@mimetype": "image/gif"
          },
          {
            "@category": "thumbnail",
            "@height": "59",
            "@width": "219",
            "@_fa": "true",
            "$": "https://api.elsevier.com/content/object/eid/1-s2.0-S1381116915000783-gr1.sml?httpAccept=%2A%2F%2A",
            "@multimediatype": "GIF image file",
            "@type": "IMAGE-THUMBNAIL",
            "@size": "1490",
            "@ref": "gr1",
            "@mimetype": "image/gif"
          },
          {
            "@category": "thumbnail",
            "@height": "52",
            "@width": "219",
            "@_fa": "true",
            "$": "https://api.elsevier.com/content/object/eid/1-s2.0-S1381116915000783-fx9.sml?httpAccept=%2A%2F%2A",
            "@multimediatype": "GIF image file",
            "@type": "IMAGE-THUMBNAIL",
            "@size": "1249",
            "@ref": "fx9",
            "@mimetype": "image/gif"
          },
          {
            "@category": "thumbnail",
            "@height": "92",
            "@width": "219",
            "@_fa": "true",
            "$": "https://api.elsevier.com/content/object/eid/1-s2.0-S1381116915000783-fx8.sml?httpAccept=%2A%2F%2A",
            "@multimediatype": "GIF image file",
            "@type": "IMAGE-THUMBNAIL",
            "@size": "2027",
            "@ref": "fx8",
            "@mimetype": "image/gif"
          },
          {
            "@category": "thumbnail",
            "@height": "159",
            "@width": "219",
            "@_fa": "true",
            "$": "https://api.elsevier.com/content/object/eid/1-s2.0-S1381116915000783-fx7.sml?httpAccept=%2A%2F%2A",
            "@multimediatype": "GIF image file",
            "@type": "IMAGE-THUMBNAIL",
            "@size": "2479",
            "@ref": "fx7",
            "@mimetype": "image/gif"
          },
          {
            "@category": "thumbnail",
            "@height": "117",
            "@width": "219",
            "@_fa": "true",
            "$": "https://api.elsevier.com/content/object/eid/1-s2.0-S1381116915000783-fx6.sml?httpAccept=%2A%2F%2A",
            "@multimediatype": "GIF image file",
            "@type": "IMAGE-THUMBNAIL",
            "@size": "2118",
            "@ref": "fx6",
            "@mimetype": "image/gif"
          },
          {
            "@category": "thumbnail",
            "@height": "129",
            "@width": "219",
            "@_fa": "true",
            "$": "https://api.elsevier.com/content/object/eid/1-s2.0-S1381116915000783-fx5.sml?httpAccept=%2A%2F%2A",
            "@multimediatype": "GIF image file",
            "@type": "IMAGE-THUMBNAIL",
            "@size": "2406",
            "@ref": "fx5",
            "@mimetype": "image/gif"
          },
          {
            "@category": "thumbnail",
            "@height": "122",
            "@width": "219",
            "@_fa": "true",
            "$": "https://api.elsevier.com/content/object/eid/1-s2.0-S1381116915000783-fx4.sml?httpAccept=%2A%2F%2A",
            "@multimediatype": "GIF image file",
            "@type": "IMAGE-THUMBNAIL",
            "@size": "2309",
            "@ref": "fx4",
            "@mimetype": "image/gif"
          },
          {
            "@category": "thumbnail",
            "@height": "163",
            "@width": "206",
            "@_fa": "true",
            "$": "https://api.elsevier.com/content/object/eid/1-s2.0-S1381116915000783-fx3.sml?httpAccept=%2A%2F%2A",
            "@multimediatype": "GIF image file",
            "@type": "IMAGE-THUMBNAIL",
            "@size": "2982",
            "@ref": "fx3",
            "@mimetype": "image/gif"
          },
          {
            "@category": "thumbnail",
            "@height": "132",
            "@width": "219",
            "@_fa": "true",
            "$": "https://api.elsevier.com/content/object/eid/1-s2.0-S1381116915000783-fx2.sml?httpAccept=%2A%2F%2A",
            "@multimediatype": "GIF image file",
            "@type": "IMAGE-THUMBNAIL",
            "@size": "2735",
            "@ref": "fx2",
            "@mimetype": "image/gif"
          },
          {
            "@category": "thumbnail",
            "@height": "109",
            "@width": "219",
            "@_fa": "true",
            "$": "https://api.elsevier.com/content/object/eid/1-s2.0-S1381116915000783-fx13.sml?httpAccept=%2A%2F%2A",
            "@multimediatype": "GIF image file",
            "@type": "IMAGE-THUMBNAIL",
            "@size": "2208",
            "@ref": "fx13",
            "@mimetype": "image/gif"
          },
          {
            "@category": "thumbnail",
            "@height": "164",
            "@width": "117",
            "@_fa": "true",
            "$": "https://api.elsevier.com/content/object/eid/1-s2.0-S1381116915000783-fx12.sml?httpAccept=%2A%2F%2A",
            "@multimediatype": "GIF image file",
            "@type": "IMAGE-THUMBNAIL",
            "@size": "1865",
            "@ref": "fx12",
            "@mimetype": "image/gif"
          },
          {
            "@category": "thumbnail",
            "@height": "112",
            "@width": "219",
            "@_fa": "true",
            "$": "https://api.elsevier.com/content/object/eid/1-s2.0-S1381116915000783-fx11.sml?httpAccept=%2A%2F%2A",
            "@multimediatype": "GIF image file",
            "@type": "IMAGE-THUMBNAIL",
            "@size": "2189",
            "@ref": "fx11",
            "@mimetype": "image/gif"
          },
          {
            "@category": "thumbnail",
            "@height": "112",
            "@width": "219",
            "@_fa": "true",
            "$": "https://api.elsevier.com/content/object/eid/1-s2.0-S1381116915000783-fx10.sml?httpAccept=%2A%2F%2A",
            "@multimediatype": "GIF image file",
            "@type": "IMAGE-THUMBNAIL",
            "@size": "2645",
            "@ref": "fx10",
            "@mimetype": "image/gif"
          },
          {
            "@category": "thumbnail",
            "@height": "88",
            "@width": "219",
            "@_fa": "true",
            "$": "https://api.elsevier.com/content/object/eid/1-s2.0-S1381116915000783-fx1.sml?httpAccept=%2A%2F%2A",
            "@multimediatype": "GIF image file",
            "@type": "IMAGE-THUMBNAIL",
            "@size": "4615",
            "@ref": "fx1",
            "@mimetype": "image/gif"
          }
        ]
      },
      "link": {
        "@rel": "abstract",
        "@href": "https://api.elsevier.com/content/abstract/scopus_id/84925990045"
      }
    }
  }
}