{
  "metadata": {
    "title": "High-resolution XPS and DFT investigations into Al-modified Phillips CrO<ce:italic><ce:inf loc=post>x</ce:inf></ce:italic>/SiO<ce:inf loc=post>2</ce:inf> catalysts",
    "authors": "; ; ",
    "journal": "Journal of Molecular Catalysis A: Chemical",
    "date": "2015-05-15",
    "doi": "10.1016/j.molcata.2015.01.020",
    "abstract": "",
    "uri": "https://api.elsevier.com/content/article/pii/S1381116915000242",
    "pii": "S1381116915000242"
  },
  "fulltext": {
    "full-text-retrieval-response": {
      "scopus-eid": "2-s2.0-84924067782",
      "originalText": "serial JL 271358 291210 291744 291790 291809 31 Journal of Molecular Catalysis A: Chemical JOURNALMOLECULARCATALYSISACHEMICAL 2015-02-01 2015-02-01 2015-03-25T12:26:29 1-s2.0-S1381116915000242 S1381-1169(15)00024-2 S1381116915000242 10.1016/j.molcata.2015.01.020 S300 S300.1 FULL-TEXT 1-s2.0-S1381116915X00045 2015-05-15T05:56:33.63776-04:00 0 0 20150515 2015 2015-02-01T23:00:41.010479Z absattachment articleinfo articletitlenorm authfirstinitialnorm authfirstsurnamenorm cid cids contenttype copyright crossmark dateloaded dateloadedtxt datesearch datesort dateupdated dco docsubtype doctype doi eid ewtransactionid hubeid indexeddate issn issnnorm itemstage itemtransactionid itemweight openaccess openarchive pg pgfirst pglast pii piinorm pubdatestart pubdatetxt pubyr sectiontitle sortorder srctitle srctitlenorm srctype ssids alllist content subj subheadings suppl tomb volfirst volissue volumelist webpdf webpdfpagecount yearnav figure table e-component body acknowledge affil appendices articletitle auth authfirstini authfull authkeywords authlast footnotes grantnumber grantsponsor grantsponsorid highlightsabst primabst ref specialabst 1381-1169 13811169 true 401 401 C Volume 401 3 1 12 1 12 20150515 15 May 2015 2015-05-15 2015 Regular Papers article fla Copyright © 2015 Elsevier B.V. All rights reserved. HIGHRESOLUTIONXPSDFTINVESTIGATIONSALMODIFIEDPHILLIPSCROXSIO2CATALYSTS MA Y 1 Introduction 2 Experimental and computational 2.1 Catalysts 2.2 High-resolution XPS characterization of catalysts 2.3 Ethylene polymerization and characterization of polymers 2.4 Computational details 2.4.1 Computational method 2.4.2 Cluster models 3 Results and discussion 3.1 High-resolution XPS study on the effects of Al-modification and calcination temperature 3.2 Effect of Al-modification on polymerization activity and MW of polymer 3.3 DFT calculation of Al-modification effects on polymerization activity 3.4 DFT calculation of Al-modification effects on the microstructures of polymer chains 4 Conclusions Acknowledgments Appendix A Supplementary data References CHENG 2013 135 202 R MCDANIEL 2014 109 116 M MCDANIEL 2008 3733 3792 M HANDBOOKHETEROGENEOUSCATALYSIS GROPPO 2005 115 184 E MCDANIEL 2010 123 606 M WECKHUYSEN 1999 215 221 B LIU 2014 127 192 Z ESPELID 2000 125 139 O GROPPO 2006 172 181 E REBENSTORF 1991 59 71 B MCDANIEL 1982 37 47 M MATTA 2012 346 350 A ZHAO 2014 1753 1766 N ZHAO 2014 1434 1445 N ZHONG 2012 1 12 L LIU 2013 1172 1183 Z LIU 2012 7538 7549 Z QIU 2012 48 55 P QIU 2011 2144 2148 P DEMMELMAIER 2009 44 56 C ESTEPHANE 2010 4451 4458 J CHENG 2010 103 115 R LIU 2001 227 240 B FANG 2005 131 138 Y FRISCH 2004 M GAUSSIAN03REVISIONE01 BECKE 1993 5648 A LEE 1988 785 C HAY 1985 299 310 P ROY 2008 1029 1031 L GONZALEZ 1989 2154 2161 C GONZALEZ 1990 5523 5527 C REED 1988 899 926 A CAO 2010 50 60 X ESPELID 2000 125 139 O ESPELID 2001 49 54 O ESPELID 2002 366 374 O PERI 1976 227 239 J LIU 2004 165 173 B MCDANIEL 1985 47 98 M MARSDEN 1994 193 200 C ZHONG 2012 872 881 L KISSIN 2008 5315 5329 Y ZHANG 2013 254 266 S GHIOTTI 1988 61 77 G EMRICH 1997 1511 1513 R RUDDICK 1998 2991 2994 V HARVEY 1998 95 99 J LIU 2011 8131 8141 Z COSSEE 1964 80 88 P MAX2015X1 MAX2015X1X12 MAX2015X1XY MAX2015X1X12XY item S1381-1169(15)00024-2 S1381116915000242 1-s2.0-S1381116915000242 10.1016/j.molcata.2015.01.020 271358 2015-03-25T11:02:30.134964-04:00 2015-05-15 1-s2.0-S1381116915000242-main.pdf https://s3.amazonaws.com/prod-ucs-content-store-us-east/content/pii:S1381116915000242/MAIN/application/pdf/1812071b7fee38e8e0343f3986f68b6f/main.pdf https://s3-eu-west-1.amazonaws.com/prod-ucs-content-store-eu-west/content/pii:S1381116915000242/MAIN/application/pdf/1812071b7fee38e8e0343f3986f68b6f/main.pdf main.pdf pdf true 1559109 MAIN 12 1-s2.0-S1381116915000242-main_1.png https://s3-eu-west-1.amazonaws.com/prod-ucs-content-store-eu-west/content/pii:S1381116915000242/PREVIEW/image/png/a17482557d1a7b1e924e3bc63fbe2951/main_1.png https://s3.amazonaws.com/prod-ucs-content-store-us-east/content/pii:S1381116915000242/PREVIEW/image/png/a17482557d1a7b1e924e3bc63fbe2951/main_1.png main_1.png png 58552 849 656 IMAGE-WEB-PDF 1 1-s2.0-S1381116915000242-sc3_lrg.jpg https://s3.amazonaws.com/prod-ucs-content-store-us-east/content/pii:S1381116915000242/sc3/HIGHRES/image/jpeg/e8cb21380adf4f9e07a5f0b012244b06/sc3_lrg.jpg https://s3-eu-west-1.amazonaws.com/prod-ucs-content-store-eu-west/content/pii:S1381116915000242/sc3/HIGHRES/image/jpeg/e8cb21380adf4f9e07a5f0b012244b06/sc3_lrg.jpg sc3 sc3_lrg.jpg jpg 133522 831 2833 IMAGE-HIGH-RES 1-s2.0-S1381116915000242-sc2_lrg.jpg https://s3.amazonaws.com/prod-ucs-content-store-us-east/content/pii:S1381116915000242/sc2/HIGHRES/image/jpeg/927af90795893585b25066589d2699f4/sc2_lrg.jpg https://s3-eu-west-1.amazonaws.com/prod-ucs-content-store-eu-west/content/pii:S1381116915000242/sc2/HIGHRES/image/jpeg/927af90795893585b25066589d2699f4/sc2_lrg.jpg sc2 sc2_lrg.jpg jpg 131243 1051 2500 IMAGE-HIGH-RES 1-s2.0-S1381116915000242-sc1_lrg.jpg https://s3.amazonaws.com/prod-ucs-content-store-us-east/content/pii:S1381116915000242/sc1/HIGHRES/image/jpeg/f2a54036ac1b7c2f8e28cc7258a85703/sc1_lrg.jpg https://s3-eu-west-1.amazonaws.com/prod-ucs-content-store-eu-west/content/pii:S1381116915000242/sc1/HIGHRES/image/jpeg/f2a54036ac1b7c2f8e28cc7258a85703/sc1_lrg.jpg sc1 sc1_lrg.jpg jpg 280501 1700 2500 IMAGE-HIGH-RES 1-s2.0-S1381116915000242-gr5_lrg.jpg https://s3.amazonaws.com/prod-ucs-content-store-us-east/content/pii:S1381116915000242/gr5/HIGHRES/image/jpeg/a278c79d4f85a329eddf7e729354e778/gr5_lrg.jpg https://s3-eu-west-1.amazonaws.com/prod-ucs-content-store-eu-west/content/pii:S1381116915000242/gr5/HIGHRES/image/jpeg/a278c79d4f85a329eddf7e729354e778/gr5_lrg.jpg gr5 gr5_lrg.jpg jpg 516290 2022 2333 IMAGE-HIGH-RES 1-s2.0-S1381116915000242-gr4_lrg.jpg https://s3.amazonaws.com/prod-ucs-content-store-us-east/content/pii:S1381116915000242/gr4/HIGHRES/image/jpeg/766083ab3b5094341aa6bc329965589f/gr4_lrg.jpg https://s3-eu-west-1.amazonaws.com/prod-ucs-content-store-eu-west/content/pii:S1381116915000242/gr4/HIGHRES/image/jpeg/766083ab3b5094341aa6bc329965589f/gr4_lrg.jpg gr4 gr4_lrg.jpg jpg 519653 1970 2333 IMAGE-HIGH-RES 1-s2.0-S1381116915000242-gr3_lrg.jpg https://s3.amazonaws.com/prod-ucs-content-store-us-east/content/pii:S1381116915000242/gr3/HIGHRES/image/jpeg/76654348e549cd8d7f4916168571a05e/gr3_lrg.jpg https://s3-eu-west-1.amazonaws.com/prod-ucs-content-store-eu-west/content/pii:S1381116915000242/gr3/HIGHRES/image/jpeg/76654348e549cd8d7f4916168571a05e/gr3_lrg.jpg gr3 gr3_lrg.jpg jpg 332201 1825 2250 IMAGE-HIGH-RES 1-s2.0-S1381116915000242-gr2_lrg.jpg https://s3.amazonaws.com/prod-ucs-content-store-us-east/content/pii:S1381116915000242/gr2/HIGHRES/image/jpeg/d8264ed7518053c449ed9e21ca013558/gr2_lrg.jpg https://s3-eu-west-1.amazonaws.com/prod-ucs-content-store-eu-west/content/pii:S1381116915000242/gr2/HIGHRES/image/jpeg/d8264ed7518053c449ed9e21ca013558/gr2_lrg.jpg gr2 gr2_lrg.jpg jpg 176339 1297 1708 IMAGE-HIGH-RES 1-s2.0-S1381116915000242-gr1_lrg.jpg https://s3.amazonaws.com/prod-ucs-content-store-us-east/content/pii:S1381116915000242/gr1/HIGHRES/image/jpeg/8c5d8d5ce9c22322a028163538e511f0/gr1_lrg.jpg https://s3-eu-west-1.amazonaws.com/prod-ucs-content-store-eu-west/content/pii:S1381116915000242/gr1/HIGHRES/image/jpeg/8c5d8d5ce9c22322a028163538e511f0/gr1_lrg.jpg gr1 gr1_lrg.jpg jpg 174280 1306 1667 IMAGE-HIGH-RES 1-s2.0-S1381116915000242-fx1_lrg.jpg https://s3.amazonaws.com/prod-ucs-content-store-us-east/content/pii:S1381116915000242/fx1/HIGHRES/image/jpeg/c211586fdd50d5ebd192f69a843c49cd/fx1_lrg.jpg https://s3-eu-west-1.amazonaws.com/prod-ucs-content-store-eu-west/content/pii:S1381116915000242/fx1/HIGHRES/image/jpeg/c211586fdd50d5ebd192f69a843c49cd/fx1_lrg.jpg fx1 true fx1_lrg.jpg jpg 207897 886 2213 IMAGE-HIGH-RES 1-s2.0-S1381116915000242-sc3.jpg https://s3.amazonaws.com/prod-ucs-content-store-us-east/content/pii:S1381116915000242/sc3/DOWNSAMPLED/image/jpeg/cc2a88a2476b129204e65d8c1e7baa2f/sc3.jpg https://s3-eu-west-1.amazonaws.com/prod-ucs-content-store-eu-west/content/pii:S1381116915000242/sc3/DOWNSAMPLED/image/jpeg/cc2a88a2476b129204e65d8c1e7baa2f/sc3.jpg sc3 sc3.jpg jpg 16105 188 640 IMAGE-DOWNSAMPLED 1-s2.0-S1381116915000242-sc2.jpg https://s3.amazonaws.com/prod-ucs-content-store-us-east/content/pii:S1381116915000242/sc2/DOWNSAMPLED/image/jpeg/0249bbf5da64a974b99a4ec2ac29807f/sc2.jpg https://s3-eu-west-1.amazonaws.com/prod-ucs-content-store-eu-west/content/pii:S1381116915000242/sc2/DOWNSAMPLED/image/jpeg/0249bbf5da64a974b99a4ec2ac29807f/sc2.jpg sc2 sc2.jpg jpg 16009 238 565 IMAGE-DOWNSAMPLED 1-s2.0-S1381116915000242-sc1.jpg https://s3.amazonaws.com/prod-ucs-content-store-us-east/content/pii:S1381116915000242/sc1/DOWNSAMPLED/image/jpeg/dfa1c8ecc7dd32916ab7996875844ab3/sc1.jpg https://s3-eu-west-1.amazonaws.com/prod-ucs-content-store-eu-west/content/pii:S1381116915000242/sc1/DOWNSAMPLED/image/jpeg/dfa1c8ecc7dd32916ab7996875844ab3/sc1.jpg sc1 sc1.jpg jpg 31630 384 565 IMAGE-DOWNSAMPLED 1-s2.0-S1381116915000242-gr5.jpg https://s3.amazonaws.com/prod-ucs-content-store-us-east/content/pii:S1381116915000242/gr5/DOWNSAMPLED/image/jpeg/90ab88e5a6fc4640212062c6e1ce33bd/gr5.jpg https://s3-eu-west-1.amazonaws.com/prod-ucs-content-store-eu-west/content/pii:S1381116915000242/gr5/DOWNSAMPLED/image/jpeg/90ab88e5a6fc4640212062c6e1ce33bd/gr5.jpg gr5 gr5.jpg jpg 60300 457 527 IMAGE-DOWNSAMPLED 1-s2.0-S1381116915000242-gr4.jpg https://s3.amazonaws.com/prod-ucs-content-store-us-east/content/pii:S1381116915000242/gr4/DOWNSAMPLED/image/jpeg/cefe15f055f1a8b42251a78bc2cba196/gr4.jpg https://s3-eu-west-1.amazonaws.com/prod-ucs-content-store-eu-west/content/pii:S1381116915000242/gr4/DOWNSAMPLED/image/jpeg/cefe15f055f1a8b42251a78bc2cba196/gr4.jpg gr4 gr4.jpg jpg 58275 445 527 IMAGE-DOWNSAMPLED 1-s2.0-S1381116915000242-gr3.jpg https://s3.amazonaws.com/prod-ucs-content-store-us-east/content/pii:S1381116915000242/gr3/DOWNSAMPLED/image/jpeg/9ec4685083ab41189e36fa3bf5d9c682/gr3.jpg https://s3-eu-west-1.amazonaws.com/prod-ucs-content-store-eu-west/content/pii:S1381116915000242/gr3/DOWNSAMPLED/image/jpeg/9ec4685083ab41189e36fa3bf5d9c682/gr3.jpg gr3 gr3.jpg jpg 38230 412 508 IMAGE-DOWNSAMPLED 1-s2.0-S1381116915000242-gr2.jpg https://s3.amazonaws.com/prod-ucs-content-store-us-east/content/pii:S1381116915000242/gr2/DOWNSAMPLED/image/jpeg/24eaa9aeaff64ee537bdd6dd54624c14/gr2.jpg https://s3-eu-west-1.amazonaws.com/prod-ucs-content-store-eu-west/content/pii:S1381116915000242/gr2/DOWNSAMPLED/image/jpeg/24eaa9aeaff64ee537bdd6dd54624c14/gr2.jpg gr2 gr2.jpg jpg 20183 293 386 IMAGE-DOWNSAMPLED 1-s2.0-S1381116915000242-gr1.jpg https://s3.amazonaws.com/prod-ucs-content-store-us-east/content/pii:S1381116915000242/gr1/DOWNSAMPLED/image/jpeg/79fdc76c0f8b9de250de3c15864c2b69/gr1.jpg https://s3-eu-west-1.amazonaws.com/prod-ucs-content-store-eu-west/content/pii:S1381116915000242/gr1/DOWNSAMPLED/image/jpeg/79fdc76c0f8b9de250de3c15864c2b69/gr1.jpg gr1 gr1.jpg jpg 21198 295 376 IMAGE-DOWNSAMPLED 1-s2.0-S1381116915000242-fx1.jpg https://s3.amazonaws.com/prod-ucs-content-store-us-east/content/pii:S1381116915000242/fx1/DOWNSAMPLED/image/jpeg/57e1e7c85eeb0cb5d5752de6a2a6a526/fx1.jpg https://s3-eu-west-1.amazonaws.com/prod-ucs-content-store-eu-west/content/pii:S1381116915000242/fx1/DOWNSAMPLED/image/jpeg/57e1e7c85eeb0cb5d5752de6a2a6a526/fx1.jpg fx1 true fx1.jpg jpg 24848 200 500 IMAGE-DOWNSAMPLED 1-s2.0-S1381116915000242-sc3.sml https://s3.amazonaws.com/prod-ucs-content-store-us-east/content/pii:S1381116915000242/sc3/THUMBNAIL/image/gif/09168b1eca7070f312b7618562dd21bd/sc3.sml https://s3-eu-west-1.amazonaws.com/prod-ucs-content-store-eu-west/content/pii:S1381116915000242/sc3/THUMBNAIL/image/gif/09168b1eca7070f312b7618562dd21bd/sc3.sml sc3 sc3.sml sml 2215 64 219 IMAGE-THUMBNAIL 1-s2.0-S1381116915000242-sc2.sml https://s3.amazonaws.com/prod-ucs-content-store-us-east/content/pii:S1381116915000242/sc2/THUMBNAIL/image/gif/99bbfe70af7f8a7125b05e12e2f5fdcf/sc2.sml https://s3-eu-west-1.amazonaws.com/prod-ucs-content-store-eu-west/content/pii:S1381116915000242/sc2/THUMBNAIL/image/gif/99bbfe70af7f8a7125b05e12e2f5fdcf/sc2.sml sc2 sc2.sml sml 2597 92 219 IMAGE-THUMBNAIL 1-s2.0-S1381116915000242-sc1.sml https://s3.amazonaws.com/prod-ucs-content-store-us-east/content/pii:S1381116915000242/sc1/THUMBNAIL/image/gif/c217a42b724b65fa9b6014399377f60e/sc1.sml https://s3-eu-west-1.amazonaws.com/prod-ucs-content-store-eu-west/content/pii:S1381116915000242/sc1/THUMBNAIL/image/gif/c217a42b724b65fa9b6014399377f60e/sc1.sml sc1 sc1.sml sml 4591 149 219 IMAGE-THUMBNAIL 1-s2.0-S1381116915000242-gr5.sml https://s3.amazonaws.com/prod-ucs-content-store-us-east/content/pii:S1381116915000242/gr5/THUMBNAIL/image/gif/a2d57213db45badeabfc6537581f9fa3/gr5.sml https://s3-eu-west-1.amazonaws.com/prod-ucs-content-store-eu-west/content/pii:S1381116915000242/gr5/THUMBNAIL/image/gif/a2d57213db45badeabfc6537581f9fa3/gr5.sml gr5 gr5.sml sml 10871 164 189 IMAGE-THUMBNAIL 1-s2.0-S1381116915000242-gr4.sml https://s3.amazonaws.com/prod-ucs-content-store-us-east/content/pii:S1381116915000242/gr4/THUMBNAIL/image/gif/fbe9c1c19a92236c1c8f580bac689f99/gr4.sml https://s3-eu-west-1.amazonaws.com/prod-ucs-content-store-eu-west/content/pii:S1381116915000242/gr4/THUMBNAIL/image/gif/fbe9c1c19a92236c1c8f580bac689f99/gr4.sml gr4 gr4.sml sml 11456 164 194 IMAGE-THUMBNAIL 1-s2.0-S1381116915000242-gr3.sml https://s3.amazonaws.com/prod-ucs-content-store-us-east/content/pii:S1381116915000242/gr3/THUMBNAIL/image/gif/7063ac6d935c07279a62341f79c053af/gr3.sml https://s3-eu-west-1.amazonaws.com/prod-ucs-content-store-eu-west/content/pii:S1381116915000242/gr3/THUMBNAIL/image/gif/7063ac6d935c07279a62341f79c053af/gr3.sml gr3 gr3.sml sml 5158 164 202 IMAGE-THUMBNAIL 1-s2.0-S1381116915000242-gr2.sml https://s3.amazonaws.com/prod-ucs-content-store-us-east/content/pii:S1381116915000242/gr2/THUMBNAIL/image/gif/f440b8152e3eda68c811160b7331bf48/gr2.sml https://s3-eu-west-1.amazonaws.com/prod-ucs-content-store-eu-west/content/pii:S1381116915000242/gr2/THUMBNAIL/image/gif/f440b8152e3eda68c811160b7331bf48/gr2.sml gr2 gr2.sml sml 4678 164 216 IMAGE-THUMBNAIL 1-s2.0-S1381116915000242-gr1.sml https://s3.amazonaws.com/prod-ucs-content-store-us-east/content/pii:S1381116915000242/gr1/THUMBNAIL/image/gif/30d6744b7b59245581067dfe3359fc91/gr1.sml https://s3-eu-west-1.amazonaws.com/prod-ucs-content-store-eu-west/content/pii:S1381116915000242/gr1/THUMBNAIL/image/gif/30d6744b7b59245581067dfe3359fc91/gr1.sml gr1 gr1.sml sml 4745 164 209 IMAGE-THUMBNAIL 1-s2.0-S1381116915000242-fx1.sml https://s3.amazonaws.com/prod-ucs-content-store-us-east/content/pii:S1381116915000242/fx1/THUMBNAIL/image/gif/087f339cb76af0659867c077181c4f17/fx1.sml https://s3-eu-west-1.amazonaws.com/prod-ucs-content-store-eu-west/content/pii:S1381116915000242/fx1/THUMBNAIL/image/gif/087f339cb76af0659867c077181c4f17/fx1.sml fx1 true fx1.sml sml 4149 88 219 IMAGE-THUMBNAIL 1-s2.0-S1381116915000242-mmc1.doc https://s3.amazonaws.com/prod-ucs-content-store-us-east/content/pii:S1381116915000242/mmc1/MAIN/application/msword/40b92575545450b3608c54a6031372eb/mmc1.doc https://s3-eu-west-1.amazonaws.com/prod-ucs-content-store-eu-west/content/pii:S1381116915000242/mmc1/MAIN/application/msword/40b92575545450b3608c54a6031372eb/mmc1.doc mmc1 mmc1.doc doc 2122752 APPLICATION MOLCAA 9403 S1381-1169(15)00024-2 10.1016/j.molcata.2015.01.020 Elsevier B.V. Scheme 1 Mononuclear cluster models for Cr(VI) sites (A0, B0, and C0 with Al/Cr ratio of 0:1, 1:1 and 2:1, respectively) and Cr(II) sites (A1, B1, and C1 with Al/Cr ratio of 0:1, 1:1 and 2:1, respectively) of Phillips catalysts. Scheme 2 Route for ethylene reduction of silica-supported chromates and chain initiation pathway on cluster models for Phillips catalyst through metallacycle mechanism. (X = A, Al:Cr=0:1; B, Al:Cr=1:1; C, Al:Cr=2:1.) Scheme 3 Proposed chain propagation (X4 → X5y → X6y → X7y → X8y, X = A, Al:Cr=0:1; B, Al:Cr=1:1; C, Al:Cr=2:1; y = a. R=H; b. R=butyl) and transfer (X7y → X9y) pathway on cluster models for Phillips catalyst through Cossee mechanism and β-hydride transfer, respectively. Fig. 1 Ethylene polymerization kinetics curves of catalysts (a) Phillips catalyst Cr/SiO2 calcined at 600°C and (b) Al-modified Phillips catalyst Cr/Al-SiO2 calcined at 600°C. (Polymerization conditions: catalyst amount, 160mg; polymerization temperature, 85°C; polymerization time, 60min; ethylene pressure, 0.15MPa; solvent, n-heptane (70mL); cocatalyst TiBA in n-heptane (1M), Al/Cr molar ratio=2.5.) Fig. 2 GPC curves of HDPE obtained from the Al-free and Al-modified Phillips catalysts: (a) Al-free Phillips catalyst Cr/SiO2 calcined at 600°C and (b) Al-modified Phillips catalyst Cr/Al-SiO2 calcined at 600°C. Fig. 3 Potential energy profiles calculated for chain initiation reaction on Al-modified Phillips catalyst model C1, with coordinated double ethylene-Cr(II) complex C2, transition state TS[C2-C3] and product C3 referring to spin crossover. The black line showed energies on triplet surface; the red line showed energies on quintet surface; the solid line showed the true reaction pathway. MECP was denoted as a green point. The calculated energies relative to 3C1 corrected for the corresponding number of ethylene number were given in kcal/mol. Energy barriers were indicated in italics, and heat absorption was shown in parentheses. (For interpretation of the references to color in this figure legend, the reader is referred to the web version of this article.) Fig. 4 Frontier molecular orbitals of 5X1 (X = A, B, C): (top) LUMO; (bottom) HOMO. Fig. 5 Frontier molecular orbitals of X4 (X = A, B, C): (top) LUMO; (bottom) HOMO. Table 1 Characteristics and preparation conditions of the Phillips catalysts. Cat. Temp. (°C) S BET (m2/g) P vol (mL/g) P diam (nm) Cr (wt.%) Al (wt.%) PhA-1 650 505 2.34 186 1.0 0.00 PhA-2 650 510 2.23 175 1.1 2.28 PhA-3 650 484 2.04 169 1.1 3.34 PhB-1 820 505 2.34 186 1.0 0.00 PhB-2 820 510 2.23 175 1.1 2.28 PhB-3 820 484 2.04 169 1.1 3.34 Table 2 XPS data from multiple fitting of Cr 2p spectra with XPS acquisition time at 10min. Cat. Act. Temp. (°C) Al (wt.%) XPS BE (eV) FWHM (eV) Assignment of Cr species Cont. (%) PhA-1 650 0 580.60 4.90 Cr(VI) 100 PhA-2 650 2.28 580.52 5.40 Cr(VI) 100 PhA-3 650 3.34 580.18 4.90 Cr(VI) 100 PhB-1 820 0 580.79 5.80 Cr(VI) 100 PhB-2 820 2.28 580.57 6.29 Cr(VI) 100 PhB-3 820 3.34 580.30 5.90 Cr(VI) 100 Table 3 Ethylene homopolymerization on various catalysts and properties of corresponding HDPE. Cat. Polymerization HDPE polymer Cocat. Al/Cr Activity (kg PE/mol Cr h) Tm (°C) MW (×105) Mw/Mn Cr/SiO2 a TiBA 2.5 131.6 131.06 3.28 23.8 Cr/Al-SiO2 a TiBA 2.5 156.6 131.03 2.50 24.1 a Cr/SiO2 and Cr/Al-SiO2 samples were thermally-activated at 600°C. Polymerization conditions: catalyst amount, 160mg; polymerization temperature, 85°C; polymerization time, 60min; ethylene pressure, 0.15MPa; solvent, n-heptane (70mL); cocatalyst TiBA in n-heptane (1M), Al/Cr molar ratio=2.5. Table 4 Geometry parameters and Natural Bond Orbital (NBO) charge for Cr(VI) site models and Cr(II) site models. a Models rCr-O1 rCr-O2 ∠O1-Cr-O2 Charge of Cr A0 1.75 1.75 102.87 +0.826 B0 1.75 1.74 103.92 +0.811 C0 1.74 1.74 105.05 +0.795 A1 1.83 1.83 111.66 +1.172 B1 1.83 1.82 113.66 +1.124 C1 1.82 1.82 115.66 +1.079 a Unit: Bond length (r) in Å, bond angles (∠) in degrees. Grounds spin state: singlet for A0, B0 and C0, quintet for A1, B1 and C1. Table 5 Energy barrier for chain initiation reaction on various models of Phillips catalysts. a Models Without spin crossover With spin crossover from quintet to triplet Triplet Quintet A (Al:Cr=0:1) 6.34 42.41 22.19 B (Al:Cr=1:1) 7.77 40.75 20.24 C (Al:Cr=2:1) 7.82 41.19 20.94 a Unit: Energy barrier in kcal/mol. Table 6 Energy barriers (kcal/mol) for chain propagation and transfer reactions on various models of Phillips catalysts. Models First insertion(ethylene or co-monomer) a Second insertion(ethylene) b β-H shift to ethylene c Δ(E transfer − E propagation) d C2H4 1-C6H12 C2H4 1-C6H12 C2H4 1-C6H12 C2H4 1-C6H12 A 21.52 23.07 21.92 21.55 29.74 28.44 7.82 6.89 B 23.63 26.59 24.05 24.53 31.76 30.54 7.71 6.02 C 25.74 28.90 26.12 28.58 33.56 32.43 7.44 3.85 a X5y → X6y in Scheme 3. b X7y → X8y in Scheme 3. c X7y → X9y in Scheme 3. d Δ(E transfer − E propagation) equals to the energy barrier difference between β-H shift to ethylene and second insertion. High-resolution XPS and DFT investigations into Al-modified Phillips CrO x /SiO2 catalysts Yue Ma a 1 Lisong Wang a 1 Zhen Liu a Ruihua Cheng a ⁎ Lei Zhong a Yun Yang a Xuelian He a Yuwei Fang b Minoru Terano b Boping Liu a ⁎ a State Key Lab of Chemical Engineering, East China University of Science and Technology, Meilong Road 130, Shanghai 200237, PR China State Key Lab of Chemical Engineering East China University of Science and Technology Meilong Road 130 Shanghai Shanghai 200237 PR China b School of Materials Science, Japan Advanced Institute of Science and Technology, 1-1 Asahidai, Tatsunokuti, Ishikawa 923-1292, Japan School of Materials Science Japan Advanced Institute of Science and Technology 1-1 Asahidai Tatsunokuti Ishikawa 923-1292 Japan ⁎ Corresponding authors. Tel.: +86 21 64253627; fax: +86 21 64253627. 1 The author made the same contribution in this work. Graphical abstract The effects of Al-modification on the physico-chemical nature of surface chromate species and ethylene polymerization mechanisms over Phillips CrO x /SiO2 catalyst were studied by high-resolution XPS, ethylene polymerization and DFT method. In this work, the effects of Al-modification on Phillips catalysts were investigated by high-resolution X-ray photoelectron spectroscopy (XPS) and the performance in ethylene polymerization reactions. Density functional theory (DFT) method was used to achieve a deeper mechanistic understanding. The decreased Cr 2p binding energies (BE), related with an increase in electron density of chromium by Al-modification, have been confirmed by the DFT calculation. The ethylene polymerization activity over the Al-modified Phillips catalyst was increased. The molecular weight (MW) of polymer was decreased with the expansion of molecular weight distribution (MWD) to low MW side, which was in agreement with the decreased energy barrier difference between the chain transfer and chain propagation in DFT calculation. The initiation step undergoing a metallacycle reaction pathway was found through a spin crossover from the quintet energy surface via a minimum energy crossing point (MECP) to the triplet energy surface. Modeling results indicated that the promotion effect on polymerization activity from Al-modification for Phillips catalyst was mainly originated from the chain initiation reaction with lowered energy barrier for Al-modified Cr active sites. Improved environmental stress-crack resistance (ESCR) of polymer derived from the Al-modified catalyst could be expected from the less short chain branches (SCBs) distribution in the low MW side. Keywords Phillips CrO x /SiO2 catalyst Al-modification X-ray photoelectron spectroscopy Density functional theory Spin-crossover 1 Introduction Phillips CrO x /SiO2 catalyst has been long among the most widely used industrial polyethylene catalysts since its discovery by Hogan and Banks in the early 1950s [1,2]. Currently, its high-density polyethylene (HDPE) products account for about 40% of the global market [3]. The majority of HDPE produced by Phillips catalysts are applied to manufacture blow-molded hollow containers and extruded pipes, owing to the peculiar structural characteristics of ultra-broad molecular weight distribution (MWD) and long-chain branching in contrast to the HDPE products by Ziegler-Natta and metallocene catalysts. In the long course of development during the last half century, this successful commercial catalyst has attracted great deal of both industrial and academic research interests [4–11]. But the contribution in academic studies has been advanced more slowly than the progress of industrial application. Despite recent significant progress in mechanistic understanding, precise relationships between catalyst structures and its resulting polymer properties have not yet been achieved. Conventional Phillips polymerization catalyst is prepared by impregnating an aqueous solution of chromium compound, usually Cr(III) acetate, onto high-surface-area amorphous silica carrier and then calcining in a non-reducing atmosphere like dry air or oxygen to activate the catalyst (500–900°C). In the period of thermal activation, chromium species is stably anchored and highly dispersed on the extensive silica–gel surface by reacting with its hydroxyl groups to form complex surface Cr(VI) species, the precursors of the real active sites. The molecular structures of the precursors of Cr active sites, the polymerization kinetics and the properties of polymer product are extremely sensitive to any small change in the preparation conditions, such as modifying silica support or changing calcination procedure. For this reason, great effort has been made to modify the original Phillips CrO x /SiO2 catalyst chemically by introducing titanium, aluminum, fluoride, etc. [6,12,13]. Although the oxidation state of the active site, the exact polymerization mechanism and the molecular structure of the catalyst still remained controversial, the development and commercialization of a number of modified Phillips catalysts have never stopped aiming at fulfilling various requirements of different polymer grades. In order to improve the branching control ability of Phillips catalyst for polyethylene, a series of hybrid Phillips catalyst modified by a second metal oxide were also reported by Matta et al. [14]. More recently, we reported a series of bimetallic catalysts modified from the traditional UCC S-2 catalyst for making polyethylene and ethylene/1-hexene copolymers with bimodal molecular weight distribution together with improved short-chain-branch distribution [15,16]. Al-modified Phillips catalyst serves as one kind of important industrial polyethylene catalysts. However, this distinctive commercial Al-modified Phillips catalyst has not been widely investigated yet. Actually, there are only a few papers about the modification of Phillips catalysts with aluminum compounds, and most of them are early patent applications. Al-modification is usually accomplished by surface impregnation method. Small amounts of aluminum compound like aluminum alkoxides, alkyl aluminum alkoxides, alkyl aluminum, alkyl or aryl aluminum halides and aryl aluminum are introduced to the pre-dried silica–gel before or after or even simultaneously with the impregnation of chromium but prior to the calcination step. As a consequence, an aluminum coating (perhaps Al2O3 layer) could be obtained in the simplest method and therefore chromium is allowed to link to the aluminum in the following thermal activation process at high temperatures. The first systematical study on the influence of Al-modification with different Al source and Al content on the ethylene polymerization over Phillips catalyst was carried out by Reker et al. [17]. It was found that Al-modification resulted in an increase in polymerization activity and a higher polymer melting index (MI). Similar conclusions were also reported in subsequent related patents [18–25]. Besides, enhancement of environmental stress-crack resistance (ESCR) was also claimed for products from Al-modified catalyst [24,25]. Furthermore, McDaniel [6] reported that the MWD of polymers made with Al-modified Phillips catalyst activated at 500°C was much similar to that produced by Al-free catalyst except for the presence of a small low MW fraction. It was suggested that those Cr sites which were closely associated with aluminum mainly produce low MW polymer. In summary, the promotion effect of polymerization activity, expansion of MWD of polymer to lower MW region, and enhanced ESCR property could occur due to the Al-modification for the Phillips catalyst. However, no investigation has ever been reported into explaining the mechanism of these Al-modification effects at the molecular level. In recent decades, an efficient approach combining experimental techniques with quantum chemical calculation has been rapidly developed and thus makes it feasible to study both the catalytic mechanism and energetics of olefin polymerization and/or oligomerization reactions [8]. Models of heterogeneous Phillips catalysts for ethylene polymerization, acetylene cyclotrimerization, and homogeneous catalysts for ethylene oligomerization have been studied in our precious work [26–30]. Based on the spectroscopic characterization and molecular modeling, Demmelmaier et al. [31] studied the chromasiloxane ring size effect in Phillips catalyst and claimed that the 6-membered chromasiloxane rings showed high polymerization rate. Moreover, multi-technique approach was adopted by Estephane et al. [32] to study a spin flip reaction from Cp2Cr to Cp2Cr(CO) adduct. The ground spin states according to different density functional theory (DFT) functionals agreed with the paramagnetic NMR observation of spin flip from the paramagnetic reagent (triplet state) to the diamagnetic product (singlet state). More recently, we have made an endeavor to adopt high resolution X-ray photoelectron spectroscopy (XPS) and DFT method in studying the effects of Ti-modification of Phillips catalyst [33] on the polymerization activity and microstructure of corresponding polymer. DFT calculation substantiated the electron-withdrawing effect of Ti-modification on surface Cr(VI) species, coinciding with XPS observation that the binding energy (BE) value of the Cr 2p core level increased with the increase in Ti contents. To the best of our knowledge, no molecular modeling investigation of Al-modification on Phillips catalyst has been reported up to now. In this work, high-resolution XPS characterization was carried out to investigate the variation in the electronic environment on the surface chromate species induced by Al-modification on the Phillips catalyst. Additionally, DFT method was used at molecular level understanding the promotion effects of Al-modification with respect to the increased polymerization activity, extension of MWD to lower MW region, and enhancement of ESCR. The combined theoretical and experimental probe into the effects of Al-modification on the Phillips catalyst aimed at a deeper insight into the mechanistic understanding of the effects of Al-modification. 2 Experimental and computational 2.1 Catalysts Six industrial Phillips catalysts with or without Al-modification were all donated from PQ Corp., USA. Taking the confidential reason into consideration, only a simplified introduction of the preparation procedures of these catalysts was given. Surface impregnation method is utilized for Al-modification of Phillips catalyst in this work [22]. For Al-modified samples, a dichloromethane solution of aluminum acetylacetonate was impregnated onto the silica support (Grade MS-3050 silica–gel with BET surface area of 480–550m2/g, pore volumes of 3.0mL/g, average pore diameter of 24nm, average particle size of 90μm, pre-dried at 300°C) for 4h at room temperature, and then dried at 120°C for 6h followed by calcination at 550°C for 4h in a quartz fluidized bed at highly purified air atmosphere. And then, the obtained aluminum-modified silica was further impregnated with an aqueous solution of chromium acetate for 4h at room temperature followed by drying at 120°C for 6h. Finally, the dried Al-modified chromium samples were thermally-activated at given calcination temperatures for 4h. Two different calcination temperatures, 650 and 820°C, were employed to study the activation temperature effect at equivalent surface aluminum concentrations. Al-free catalyst samples were the traditional Phillips catalysts skipping the foregoing impregnation of Al-compound. Thereby all catalyst samples with different final calcination temperatures and Al contents were classified into two series: PhA-1 (0wt.% Al), PhA-2 (2.28wt.% Al), and PhA-3 (3.34wt.% Al) activated at 650°C, and PhB-1 (0wt.% Al), PhB-2 (2.28wt.% Al), PhB-3 (3.34wt.% Al) activated at 820°C. In fact, the Al-free PhA-1 and PhB-1 samples were just the same catalysts marked as Ph-3 and Ph-6, respectively, in our previous publication [33]. The aluminum and chromium content, and the textural properties including BET surface area, pore volume, and average pore diameter of the catalysts, which were measured at −196°C using N2 after evacuating the catalysts at 300°C for 1h, were listed in Table 1 . Two Phillips catalysts without or with Al-modification, named as Cr/SiO2 and Cr/Al-SiO2, were prepared in our laboratory for comparison according to the same procedure mentioned-above. The two catalysts were thermally-activated at 600°C. The Cr and Al loading were 1wt.% and 2.28wt.%, respectively. 2.2 High-resolution XPS characterization of catalysts High-resolution XPS characterization was performed on a Physical Electronics PerkinElmer Model Phi-5600 ESCA spectrometer using a monochromated Al Kα radiation X-ray source (E =1486.6eV) operated at 300W. Before entering the XPS apparatus, all samples were put into a vacuum transfer vessel (Phi Model 04-110, PerkinElmer Co., Ltd.) in a glove box, which could be connected to the sample introduction chamber on the XPS instrument for sample transfer without atmospheric exposure. All binding energies (BE) were referred to the Si 2p peak of silica–gel at 103.3eV for the charging effect correction [34]. For determining the BE and quantitative analysis, multiplet fittings of the peaks of Cr 2p XPS spectra were implemented using Gaussian–Lorentzian method. More details could be found in Refs. [34,35]. 2.3 Ethylene polymerization and characterization of polymers Two Cr/SiO2 and Cr/Al-SiO2 catalyst samples prepared in our laboratory were utilized for a comparison of the kinetic behavior of ethylene polymerization. The polymerization was carried out in a three-neck flask, which was placed at a thermostatic bath keeping at 85°C. One small ampoule tube with 160±5mg catalyst, which was previously weighed and sealed in nitrogen at a glove box, was carefully transferred to the flask. The reactor system was heated and vacuumed for 0.5h, and then 70mL n-heptane was added followed by introducing a certain amount of tri-isobutyl aluminum (TiBA, Al/Cr molar ratios=2.5). Ethylene passed through three columns containing activated 13X, copper and 4A molecular sieves in sequence to remove traces of water and O2 and was then introduced up to the total pressure of 0.15MPa into the preheated flask. The polymerization was initiated after opening the sealed catalyst tube. The real-time ethylene consumption was continuously monitored by an on-line mass flowmeter (Brooks Instrument 0150E). After 1h, the polymerization was stopped, and the reaction product was transported to 100mL ethanol/HCl solution as terminating agent. The obtained polymer was washed and dried in vacuum at 60°C for 6h before weighed. The molecular weight (MW) and molecular weight distribution (MWD) of the polyethylene were obtained using a PL220 high-temperature chromatography unit with trichlorobenzene (TCB) as the solvent at a flow rate of 1mL/min at 160°C. 2,6-di-tert-Butyl-4-methylphenol (BHT) at a concentration of 0.025g/L was used as a stabilizer in the TCB. The polymer was dissolved to the concentration of 1mg/mL in stabilized TCB by heating at 160°C for 5h with continuous, gentle agitation. The differential scanning calorimeter (DSC) experiments were performed on TA Q200 under N2 atmosphere. The melting point temperature (Tm) program was that the temperature was up to 150°C with 10°C/min and kept for 5min then cooled down to 40°C to eliminate the heat history. Finally the temperature was up to 150°C again at the heating rate of 10°C/min and the DSC curves were collected. 2.4 Computational details 2.4.1 Computational method All the theoretical calculations were performed with the Gaussian 03 software package [36] using UB3LYP hybrid DFT method, which included three-parameter gradient-corrected exchange functional of Becke [37] in combination with the nonlocal correlation functional of Lee et al. [38]. The basis set employed was the LANL2TZ(f) (a triple-ξ quality basis set, the Hay–Wadt relativistic effective core potential (RECP) as implemented in LANL2DZ [39] associated with revised basis set [40]) for Cr and the 6-311G(d, p) basis set for the rest main group atoms including C, H, O, Si and Al. Such combination of basis sets has been adopted in order to perform efficient and accurate calculations. The stationary structures were optimized without any symmetry constraints. Harmonic vibrational analysis was carried out at the same level of theory for structural optimization to confirm that transition states had only one imaginary frequency while stationary points (reactant and product) had no imaginary frequency. The intrinsic reaction coordinate (IRC) calculations [41,42] were performed to verify the connections between the transition states and the corresponding minimums. The NBO program implemented in Gaussian 03 was used to obtain natural populations of atoms to study the chemical bonding characteristics [43]. All energies reported referred to Gibbs free energy corrections to the total electronic energies at gas phase, 298.15K and 1 atmospheric pressure. 2.4.2 Cluster models Six mononuclear chromium cluster models were proposed for the DFT calculation as presented in Scheme 1 . After calcination of catalyst, chromium is considered to be present as Cr(VI)O x,surf species with two oxygen linking to the silica surface, dominantly in the type of chromate at low Cr loading. Moreover, Cr(II)O x,surf species is believed to be the main chromium active site precursor of pre-reduced Phillips catalyst. Hence, based on the efficiency of simplified heterogeneous cluster models of Phillips catalyst adopted in the literatures [33,43–47], mononuclear chromium(VI) model (denoted as A0 in Scheme 1) and mononuclear chromium(II) model (denoted as A1 in Scheme 1) were employed as calcined Cr(VI) site and pre-reduced Cr(II) site models, respectively, for the Al-free Phillips catalyst. To the best of our knowledge, no Al-modified Phillips catalyst models have ever been proposed before. After all, reaction of aluminum compound with surface OH possibly generates Si–O–Al linkages [48] and the following impregnation of chromium would form Cr–O–Al linkages. Several 6-membered ring cluster models containing Mo–O–Al bridge have been established for MoO x /Al2O3 catalyst in our previous work [44] and successfully elucidated the influences of Mo oxidation state and surface hydroxyl on the polymerization activity. As the structure of precursor site and polymerization kinetics are similar for chromium based catalyst and molybdenum based catalyst, calcined sites of Al-modified Phillips catalyst could similarly be designated as hexa-valent Cr cluster models B0 and C0 with Al/Cr ratio of 1:1 and 2:1, respectively. Correspondingly, pre-reduced active site precursors could be designated as divalent Cr cluster models B1 and C1 with Al/Cr ratio of 1:1 and 2:1, respectively. Generally, three kinds of surface Cr site models were established marked as A, B, and C, taking into account all the possible Al-modification environments on the Phillips catalyst in our theoretical calculations. 3 Results and discussion 3.1 High-resolution XPS study on the effects of Al-modification and calcination temperature In this part of work, all six PhA and PhB Phillips catalyst samples with 0, 2.28, and 3.34wt.% Al contents at two different calcination temperatures of 650 and 820°C, respectively, were characterized by high-resolution XPS measurement. The XPS spectra of Cr 2p core level for all samples in dependence on XPS acquisition time from 10 to 30 and 120min were all shown in Figs. S1 and S2 in the Supporting Information. All spectra consisted of two main doublet features corresponding to Cr 2p3/2 and Cr 2p1/2 photoelectrons. The BE values of Cr 2p3/2 level around 580 and 577eV were assigned to be Cr(VI)O x,surf and Cr(III)O x,surf species, respectively [35]. The information (corresponding BE, FWHM values) of the Cr 2p3/2 core level, assignment and atomic percentage of different oxidation states of surface Cr species for all catalyst samples versus XPS acquisition time obtained after peak deconvolution and multiplet fitting are tabulated in Tables 2 and S1 in the Supporting Information. As shown in Table 2, the XPS data obtained at acquisition time of 10min could identify the original physico-chemical natures of surface chromate species [33,49] with negligible photo-reduction of surface chromate species induced by soft X-ray irradiation during XPS measurement. For catalysts PhA-1, PhA-2, and PhA-3 calcined at 650°C, it was found that the BE values for chromate species were gradually decreased from 580.60 to 580.52 and 580.18eV with increasing Al content from 0 to 3.34wt.%. For catalysts PhB-1, PhB-2 and PhB-3 calcined at 820°C, the BE values for chromate species were also gradually decreased from 580.79 to 580.57 and 580.30eV with increasing Al content from 0 to 3.34wt.%. Such BE data obtained in 10min XPS measurement illuminated two aspects of electronic effects of Al-modification. Firstly, no significant shifting of Cr 2p peak to lower BE value was detected within 10min, demonstrating only Cr(VI)O x,surf species existed on the original Phillips catalyst surface whether with or without Al-modification. Secondly, the slight decrease tendency of BE value implied that the electron-deficiency of surface chromate species decreased along with an increase in Al content for the Al-modified Phillips catalysts, probably owing to the lower electro negativity of aluminum atoms. However, it is interesting to note that the latter seems to be contradictory to the promotion effect of Al-modification on polymerization activity as mentioned before because increasing the electron density on chromium atom generally leads to an decrease in polymerization rate, as reported by McDaniel [50] and Marsden [51]. On the other hand, it might imply that the promotion effect from Al-modification could be derived from different mechanism compared with the promotion effect from Ti-modification for the Phillips catalyst as demonstrated in our previous report [33]. For PhA catalysts series which were calcined at 650°C, FWHM first increased from 4.90 (PhA-1) to 5.40eV (PhA-2) and then deceased back to 4.90eV (PhA-3), indicating a broader distribution of surface chromate species by modest Al-modification while the high Al content would conversely restrain such effect. As expected, for the PhB catalyst series calcined at a higher temperature of 820°C, FWHM first increased from 5.80 to 6.29eV and then decreased to 5.90eV with Al loading from 0 to 2.28 and 3.34wt.%, respectively. After Al-modification, the BE value for chromate species was decreased, while the case for Ti-modified catalyst was just on the opposite situation. Our previous XPS study found that Ti-modification led to an increase in the BE value for chromate species [33]. As the corresponding polymerization activities were similarly increased for both Al-modified and Ti-modified Phillips catalysts, further mechanistic investigation should be performed in order to make this issue clearer. When XPS acquisition time was prolonged to 30 and 120min, it was found that partial labile Cr(VI)O x,surf species could be converted into Cr(III)O x,surf species due to the photo-reduction from the soft X-ray irradiation during XPS measurement. Table S1 in the Supporting Information listed all 30 and 120min XPS characterization data, from which the photo stability of the surface chromate species versus Al-modification could be observed. The photo stability of surface chromate species during XPS measurement was enhanced by Al-modification and the formation of Cr(III)O x,surf species from the reduction of Cr(VI)O x,surf species was accordingly retarded by Al-modification during XPS acquisition. The effect of calcination temperature on catalyst physico-chemical property could be elucidated by comparing BE values of the PhA series activated at 650°C with those of the PhB series activated at 820°C. When the calcination temperature increasing from 650 to 820°C, the Cr 2p3/2 BE values of the Cr(VI)O x,surf species on Al-free catalysts increased from 580.60eV for PhA-1 to 580.79eV for PhB-1. And the corresponding FWHM broadened from 4.90 to 5.80eV, as shown in Table 2. It was the direct evidence for increased electron-deficiency of chromium center and broadened distribution of surface chromate species, which could be ascribed to the removal of more electron-donating surface residual hydroxyl groups and the increase in surface tension due to dehydroxylation at higher calcination temperatures [49]. Moreover, similar phenomenon has also been observed between the sample pairs of PhA-2 and PhB-2, PhA-3 and PhB-3, after Al-modification. It was suggested that the Al-modification could not release the temperature effect on the electronic property of the chromate species on Phillips catalyst. That is to say, the higher calcination temperature leads to the higher electron-deficiency of the surface chromate species regardless of the presence of Al. In general, XPS measurement clearly signified that Al-modification enhanced the photo stability of surface chromate species and accordingly retard the formation of Cr(III)O x,surf species from the reduction of Cr(VI)O x,surf species during XPS acquisition. However, the observed decreased BE values showed an increase in electron density of chromium center by Al-modification for the Phillips catalyst. This effect was presumably attributed to the lower electro negativity of the surrounding aluminum atoms. 3.2 Effect of Al-modification on polymerization activity and MW of polymer In this work, the Al-free Phillips catalyst Cr/SiO2 and Al-modified Phillips catalyst Cr/Al-SiO2 were used for ethylene homo-polymerization in the presence of TiBA cocatalyst at Al/Cr molar ratio=2.5 (cocatalyst is not needed in industry, but it is necessary in laboratory experiment to shorten the induction period of reducing Cr(VI) into a lower valence state under the atmospheric pressure and also to remove the traces of O2 and moisture) [52]. Kinetics behaviors for the Cr/SiO2 and Cr/Al-SiO2 shown in Fig. 1 were in two different types like the typical kinetic curves of ethylene homopolymerization reactions: (a) the Al-modified Phillips catalyst led to higher activity and faster decay and (b) the traditional Phillips catalyst showed relatively lower activity but slower decay [53,54]. The catalytic activity was increased from 131.6kg PE/molCr h (Cr/SiO2) to 156.6kg PE/molCr h (Cr/Al-SiO2) after Al-modification as shown in Table 3 . More importantly, the real-time kinetics curves of catalysts, Cr/SiO2 and Cr/Al-SiO2, illustrated that Al-modified Phillips catalyst underwent a longer induction time. The observed longer induction time might be explained from the increased electron density of Cr(VI) sites after Al-modification, which is evidently adverse to not only the coordination of ethylene molecules to chromium sites but also the further electron exchange between the coordinated ethylene and chromium center. The melting point temperatures (Tm) of polymer products from both catalysts were similar at about 131°C. Additionally, a decline of the MW of HDPE product from 328,000g/mol (Cr/SiO2) to 250,000g/mol (Cr/Al-SiO2) was noticed after Al-modification. So it was speculated that the Al-modification plausibly promote the formation of the low MW fraction which was consistent with the differences of the molecular weight distributions between the products by the Al-modified and Al-free Phillips catalysts as shown in Fig. 2 . The MW of the polymer obtained from Cr/Al-SiO2 was shifted to the lower MW region. Deeper mechanistic understanding on the effects of Al-modification will be demonstrated by the following DFT study. 3.3 DFT calculation of Al-modification effects on polymerization activity Phillips catalyst is a kind of “metal-alkyl-free” polymerization catalyst. The activation could be accomplished by self-alkylation without a metal alkyl co-catalyst. After contacting with reductant (mostly using C2H4 in industry), the Cr(VI)O x,surf species of prepared catalyst precursors are expected to be reduced to Cr(II)O x,surf analogs for initiating further ethylene polymerization. The hexa-valent chromate precursors (Cr(VI)O x,surf sites) were modeled by three mononuclear chromium cluster models (denoted as A0, B0, C0 presented in Scheme 1) with 0, 1, or 2Cr-O-Al bridges, respectively. The pre-reduced divalent chromium species (Cr(II)O x,surf sites) after reduction step were similarly modeled by three clusters denoted as A1, B1, and C1 presented in Scheme 1. On the basis of these cluster models, a systematic DFT investigation on Al-modification to Phillips catalyst with respect to corresponding promotion of polymerization activity, extension of MWD to lower MW region and enhancement of ESCR was put into practice. Firstly, the promotion effect on polymerization activity from Al-modification for the Phillips catalyst was studied. The reduction of chromate species, chain initiation on reduced divalent chromium sites and chain propagation on active sites were generally figured as the determining factors of the activity of Phillips catalyst. Geometry parameters and Natural Bond Orbital (NBO) charge for Cr(VI) site models and Cr(II) site models are listed in Table 4 . The most pronounced difference of geometry parameters was found in terms of ∠O1-Cr-O2 angle. For the Cr(VI) site models, this bond angle increased from A0 to B0 and C0. While in the case of the reduced Cr(II) site models, it also opened from A1 to B1 and C1. The wider ∠O1-Cr-O2 indicated that the Al-modified cluster was more strained. Apart from the O1-Cr-O2 bond angle, the bond lengths of CrO differed by about 0.01Å in the Cr–O–Al moiety compared with slightly longer CrO bond in the Cr–O–Si moiety. The key point to note was the significant decreasing NBO charge on Cr(VI) and on Cr(II). The decrease in NBO charge value on chromium for cluster models B and C involving aluminum atoms demonstrated an increase in electron density of Cr site with Al-modification, which was consistent with the decrease in BE value of surface chromate species after Al-modification by XPS characterization as mentioned before. This consistency was also a direct evidence for the validity and reasonableness of our proposed cluster models for our DFT calculations. Obviously, since the increase in electron density of chromium on Cr(VI) sites after Al-modification hindered not only the coordination of ethylene but also the electron transfer from coordinated ethylene to Cr(VI) sites, reduction of Cr(VI)O x,surf species for Al-modified catalyst would be more difficult than that for the Al-free one. According to our previous study on Cr(II)/SiO2 active site precursors in Phillips polymerization catalysts, the reaction route for the reduction of silica-supported Cr(VI) species into Cr(II) species either by ethylene or Al-alkyl cocatalyst is proposed in Scheme 2 in the initial period of ethylene polymerization [26]. The issue of how an initial monoalkylchromium structure may be generated, without any external alkylation agent to supply the first starting polymer chain, has been proven difficult to be clarified despite its importance to our basic understanding of the Phillips catalyst. The crucial initiation mechanism involving the first CrH or CrC bond formation has stimulated a great debate, among which metallacycle initiation mechanism has gained wider acceptance in recent years. FTIR spectroscopy evidence of the occurrence of metallacycle intermediate species during ethylene polymerization on the Cr(II)/SiO2 Phillips catalyst was observed using in-situ FTIR measurement by Groopo et al. [11]. Likewise, chromacyclopentane was also proposed as intermediate species as reported by Ghiotti et al. [55], Emrich et al. [56], and Ruddick and Badyal [57]. From theoretical aspect, Espelid and Børve [45–47] reported metallacycle mechanism might be the most plausible initiation mechanism according to the lowest energy barrier. Hence, in this section the DFT calculation of chain initiation step was carried out undergoing a metallacycle pathway as illustrated in Scheme 2. Global abbreviation X signified the labeling of three proposed Al-involved or Al-free cluster models (X = A, Al:Cr=0:1; X= B, Al:Cr=1:1; X =C, Al:Cr=2:1). According to metallacycle initiation mechanism, coordination of two ethylene molecules to the reduced Cr(II) active center (X1 in Scheme 2) took place to give a coordinated bis-ethylene-Cr(II) π-complex (X2 in Scheme 2) leading to the formation of a chromacyclopentane species (X3 in Scheme 2). Geometry optimization of each structure for three kinds of cluster models was conducted under all possible spin states to identify the ground spin state. The DFT calculation at B3LYP level showed that the ground spin state of X1 and X2 with divalent chromium was quintet while the ground spin state of the oxidative cyclic addition product X3 with tetravalent chromium was triplet. In this case, the chain initiation possibly involved a spin crossover between a triplet surface and a quintet surface. In theoretical studies of organometallic reactions, the limitation of calculation at a single spin state is one reason why computational calculation usually gives ambiguous results which are not consistent with experimental conclusions. Fortunately, Harvey et al. [58] has developed a DFT method to locate the crucial minimum energy crossing point (MECP) involved in such issue and this technique was adopted in our previous publication [59]. Consequently, we have studied the spin crossover phenomenon by locating MECPs between two different potential energy surfaces in order to compare the reactivity on cluster models A, B, and C with or without Al-modification over the Phillips catalyst. Calculation results of the chain initiation pathways for A, the Al-free Phillips catalyst model, on triplet and quintet surfaces are shown in Table 5 and Fig. S3 in the Supporting Information. All geometry optimizations were carried out on the following stationary points: the triplet and quintet active sites ( 3A1 and 5A1, the superscript number representing corresponding spin multiplicity employed during DFT calculation), π-complexes ( 3A2 and 5A2), MECPs on the way to the formation of five-member ring, five-member ring products ( 3A3 and 5A3) and two transition states ( 3TS[A2-A3] and 5TS[A2-A3]) leading from π-complexes to the oxidative coupling products. Energy differences were related to 3A1 and corrected with the corresponding number of ethylene molecules. On the triplet energy surface, starting from a reduced 3A1 cluster, two ethylene monomers coordinated to it giving a π-complex 3A2. This coordination step was obvious exoergic by 12.45kcal/mol ( 3A1 → 3A2). A chromacyclopentane structure 3A3 was subsequently yielded from π-complex overcoming an energy barrier of 6.34kcal/mol ( 3TS[A2-A3]). On the other hand, on the quintet surface, coordination of two ethylene was slightly exoergic by 2.75kcal/mol ( 5A1 → 5A2) and the energy barrier for the formation of five-member ring structure was calculated to be 42.41kcal/mol ( 5TS[A2-A3]). Obviously, DFT calculation results on the triplet and quintet energy surface were remarkably different in the energetic behavior. The lower energy quintet reactant 5A1 and 5A2 with four unpaired d-electrons in chromium were more stable than the triplet analog with two unpaired d-electrons in chromium. Conversely, the quintet product 5A3 and corresponding transition state 5TS[A2-A3] presented higher in energy than 3A3 and 3TS[A2-A3]. Consequently, due to the different ground spin states of stationary points along the reaction pathway, spin crossover should occur to the formation of 3A3 from π-complex 5A2. It seemed to us worthwhile to take advantage of MECP technique to identify the triplet–quintet crossing point on the pathway to the formation of chromacyclopentane. A-MECP was precisely located and computed at −10.73kcal/mol on either triplet or quintet state. The total energy barrier including the binding energy of ethylene coordination and the energetic barrier of metallacycle formation should be 22.19kcal/mol. Calculation results of the two Al-modified cluster models B and C were shown in Table 5, Fig. S4 (in the Supporting Information) and Fig. 3 . Energetic behaviors calculated were similar to those of model A. Likewise, taking spin crossover between the quintet and triplet surfaces into account, MECPs were found at −5.47kcal/mol (B-MECP) and −9.54kcal/mol (C-MECP) and the energy barriers for chain initiation on model B and C were 19.95kcal/mol and 18.50kcal/mol, respectively, both of which were lower than that for model A indicating a decreasing of energy barrier for chain initiation after Al-modification over the Phillips catalyst. In addition, it was also found that the coordination of two ethylene molecules to the Cr(II) site was endoergic by 0.29kcal/mol ( 5B1 → 5B2) and 2.44kcal/mol ( 5C1 → 5C2) on model B and C, respectively. And for model A this coordination step was exoergic by 2.75kcal/mol ( 5A1 → 5A2). As discussed before, the wider the ∠O1-Cr-O2 angle opened, the greater the strain on the reduced Cr(II) site would be. As a result, coordination of ethylene monomers to the reduced Cr(II) sites B1 and C1 would be disfavored because of the steric hindrance effect. It was interesting to contrast the above calculation results till now for the formation of chromacyclopentane(VI) from oxidative coupling of two ethylene molecules, standing for chain initiation pathway undergoing the metallacycle mechanism, on the two different spin states. For three cluster models A, B, and C, the energy barrier gradually increased when the reaction took place on the triplet surface, whereas it dramatically decreased in sequence on the quintet surface. The two contradictory conclusions were finally explained by introducing spin crossover. The plausible reaction pathways were figured out by locating MECPs between the triplet and quintet energy surfaces. Therefore the energy barrier, obtained considering spin crossover, was computed much lower on Al-modified site models B and C in contrast to Al-free site model A. So Al-modification to Phillips catalyst was proven to facilitate the chain initiation reaction on reduced Cr(II) sites by DFT calculations, where the promotion effect on polymerization activity for the Al-modified Phillips catalyst might be derived from. The frontier molecular orbitals of Cr(II) sites on various Phillips catalyst cluster models were analyzed in order to explain the difference in energetic behavior of the chain initiation reaction. Fig. 4 illustrated the frontier orbitals of Cr(II) sites 5X1 (X = A, B, C). The LUMOs (the lowest unoccupied molecular orbital) of 5A1, 5B1, and 5C1 in the top row, which accepted the donation of electrons from π-bonding orbital of the ethylene monomer, were found almost the same. The bottom row showed the HOMOs (the highest occupied molecular orbital) of 5A1, 5B1, and 5C1. Higher electron density around oxygen atoms adjacent to Cr(II) on Al-modified models 5B1 and 5C1 could be recognized, which could increase the in-phase overlap of HOMO with the empty π* anti-bonding orbital of the ethylene monomer. As we know, the larger the overlap population, the easier the activation of ethylene molecule and the interaction between Cr and the incoming ethylene. Hence, the calculated lower energy barriers for chain initiation reaction on Al-modified Phillips catalyst models was well elucidated by comparing the frontier orbitals of 5A1 with 5B1 and 5C1. As one of the most commonly accepted propagation mechanism of transition metal-catalyzed olefin polymerization system, especially suitable for the Ziegler–Natta catalyst, Cossee–Arlman mechanism [60] is also generally accepted for CrO x /SiO2 system. An ethylene molecule π-coordinated to the chromium active site followed by inserting into the Cr-alkyl bond and thus the alkyl chain was extended by one monomer unit. Therefore, Cosse–Arlman mechanism was employed to study chain propagation (denoted as X4 → X5y → X6y → X7y → X8y in Scheme 3 ) on the three cluster models by DFT method. Global abbreviation y signified the labeling of substrate, ethylene or 1-butene or 1-hexene (y = a, R=H, ethylene homopolymerization; y = b, R=butyl, copolymerization with 1-hexene). The initial monoalkylchromium(III) structure was simplified as a tricoordinated chromium-methyl species X4. The energy barriers computed for chain propagation reaction (X5a → X6a and X7a → X8a) proceeding on the three proposed cluster models of the Phillips catalysts are presented in Table 6 . The energy barrier for the formation of chromium-propyl species from A5a to A6a through the first ethylene insertion step was 21.52kcal/mol on Al-free cluster A, yet the corresponding energy barriers on Al-modified cluster B and cluster C increased to 23.63 and 25.74kcal/mol, respectively. Chromium-pentyl species could be formed still undergoing the Cossee propagation path through the coordination and subsequent insertion of a second ethylene from X7a to X8a with energy barriers of 24.05kcal/mol on cluster B and 26.12kcal/mol on cluster C, both of which were also higher than that on cluster A (21.92kcal/mol). Such tendency indicated that chain propagation step was even more difficult after Al-modification for the Phillips catalysts. Fig. 5 illustrates the frontier orbitals of X4 (X = A, B, C). The top row showed the LUMOs of A4, B4 and C4. In A4, there was an obvious empty d orbital which can accept π electrons of the incoming ethylene, and thus facilitated the insertion of the ethylene into CrC bond. While such empty d orbital of Cr in B4 became unobvious and consequently the π donation was weakened. In the case of C4, the in-phase overlap and out-phase overlap of LUMO with the π orbital of ethylene were totally equal. Therefore, the π electrons of the incoming ethylene could not availably be transferred to the 3d xy orbital of Cr. Although the HOMOs of X4 exhibited similar tendency as those of X1, the interaction between ethylene and methylchromium was not just determined by such π* back donation, but dominantly by the donation of π electron from ethylene to the empty d orbital of Cr center. Therefore, for chain propagation from X4 to X5, Al-free Phillips catalyst model was energetically much more favorable than the Al-modified models. In summary, the NBO charge value on chromium calculated by DFT method demonstrated that the electron density of chromium sites increased after Al-modification, which was consistent with experimental observation of the decrease in BE value of surface chromate species after Al-modification by high resolution XPS characterization as discussed before. Considering the spin crossover between the triplet and quintet energy surfaces, Al-modification to Phillips catalyst was then proven to obviously facilitate chain initiation on the reduced Cr(II) sites undergoing the metallacycle mechanism and it was thought to be the crucial reason for the promotion effect on polymerization activity. Yet Al-modification seemed to be unfavorable for chain propagation reaction for the Phillips catalyst. 3.4 DFT calculation of Al-modification effects on the microstructures of polymer chains In this section, DFT investigation was carried out on the effect of Al-modification on the microstructures of polymer chains. Generally, the MWD is suggested to be dependent with the ratio of chain transfer rate to chain propagation rate. As Espelid and Børve [45–47] found that direct hydrogen transfer to Cr center was too difficult due to the weak Cr-hydride bond which meant hydrogen transfer preferred to occur to the incoming next monomer. Herein, chain transfer (see X7y → X9y in Scheme 3) was accomplished by β-hydride transfer to an incoming next ethylene monomer yielding polymer chain containing one methyl and one terminal vinyl ends. X7a could undergo agostic-assisted β-hydride transfer from Cβ in the Cr-CH2 α-CH2 β-CH3 γ fragment to the coordinated ethylene to yield X9a with a coordinated 1-propylene which was liberated simultaneously. Similarly, further competing propagation and chain transfer reaction could endure likewise along with the polymerization time until deactivation of the active site. The energy barriers are presented in Table 6 as computed for competing chain propagation reaction (X7a → X8a) and chain transfer reaction (X7a → X9a) proceeding on the three proposed cluster models. The energy barrier for the formation of chromium-pentyl species gradually increased with increase of Al-contents. On the other hand, after the coordination of the second ethylene, chain transfer via β-H shift from Cr-CH2CH2CH3 fragment to the second coordinated ethylene showed increasing energy barriers. The energy barrier difference between the second monomer insertion and β-hydride transfer on the three cluster models are illustrated in Table 6, denoted as “Δ”. It was found that the energy barrier differences was more decreased in Al-modified site models B and C. Such tendency qualitatively indicated an increased low MW fraction of polyethylene and therefore the MWD would be broadened to the lower MW region, which was consistent with the experimental evidence shown in Table 3 [6]. Meanwhile the unfavorable chain transfer after Al-modification could be also ascribed to the increase in the electron density on the chromium atom to diminish the driving force for agostic β-hydride coordination which was consistent with the XPS results. Most commercial grades of HDPE are actually copolymers of ethylene and other α-olefins involving 1-butene and 1-hexene. The short chain branches (SCBs) distribution alongside the polymer chain was thought as one of the most important factor influencing polymer properties. Whether the promoted ESCR by Al-modification is derived from some kind of better branching behavior or not is still uncertain. To handle this problem, in this section, 1,2-insertion of 1-hexene, in addition to two competing reactions subsequent second extra ethylene insertion and β-hydride transfer on the three site models with 0:1, 1:1, and 2:1 Al/Cr atomic ratios were studied by DFT method. The results are illustrated in Scheme 3 and summarized in Table 6. The energy barrier calculated for comonomer insertion into Cr-methyl moiety (X5y→X6y, Scheme 3, y = b, R=butyl) for model A was 23.07kcal/mol, higher than that required to overcome for the ethylene monomer insertion. This trend indicated that copolymerization with 1-hexene showed lower activity than homopolymerization, which was also confirmed by McDaniel [4] and our previous DFT work [33]. Compared with Al-free site model A, energy barriers for 1-hexene insertion were found much increased for Al-modified site models. Notice that, the incorporation of 1-hexene was inhibited by the sites which were associated with aluminum. Considering such Al-modified sites tend to produce lower MW polyethylene, less branches into the lower MW region and consequently improved the natural tendency of the distribution from traditional Phillips Cr/silica catalysts and concentrated the more short chain branches into the higher MW side, which was considered to be favorable for the ESCR property of the copolymers. From structure X6b formed through insertion of comonomer 1-hexene, one more short branch of the linear polyethylene backbone would be generated from the coordination and further insertion of an ethylene molecule into the growing chain (see X7y→X8y in Scheme 3, y = b). For Al-free site model A, lower energy barrier for ethylene insertion was found after the insertion of 1-hexene in contrast to that for the case of homopolymerization. It was nevertheless noteworthy that, for Al-modified catalyst site models the energy barrier for this reaction was higher after incorporation of 1-hexene in contrast to homopolymerization, which implied higher sensitivity for Al-modified sites to steric hindrance due to the R group. On the other hand, the π-complex X7b could undergo agostic-assisted β-hydride transfer to coordinated ethylene from the tertiary carbon introduced by comonomer insertion simultaneously (see X7y→X9y in Scheme 3, y = b). For site model A, the energy barrier for such tertiary hydride transfer was 28.44kcal/mol (A7b→A9b) after insertion of 1-hexene, lower than that required for secondary hydride transfer after ethylene insertion (29.74kcal/mol, A7a→A9a). Similarly, for Al-modified site models B and C, chain transfer proceeded with β-hydride shift after comonomer insertion also showed lower energy barrier than homopolymerization. Such increased chain transfer rate tendency might be a consequence of increased level of tertiary hydrides when active sites accepted comonomer insertion. In order to obtain the information of SCBs distribution in polymer chains obtained by copolymerization with 1-hexene, the difference in energy barriers between extra ethylene insertion (X7b→X8b in Scheme 3) and alternative chain transfer (X7b→X9b in Scheme 3) was also calculated as in homopolymerization. After adding comonomer, the difference in energy barriers between further ethylene insertion and tertiary β-hydrogen transfer in each model all decreased, but it decreased more in Al-modified site model B and C than Al-free site model A (see Table 6, column “Δ”). That meant the tertiary β-hydrogen transfer after the incorporation of 1-hexene into polymer chains grown on Al-modified Cr sites was accelerated, especially for Cr sites directly linked to two aluminum atoms. Taking the aforementioned observation of preference for producing lower MW polyethylene on Al-modified sites into account, much less short chain branches would be generated in the lower MW fraction due to the obviously stimulated chain transfer after comonomer insertion, leaving the inserted comonomer at the chain end. Hence, again, it was proven that less SCBs should be placed in the lower MW side of the MW distribution. Such improvement of less SCBs in the lower MW region was regarded as an efficient way to enhance polymer properties including ESCR in industrial applications. So, the experimental observation that ESCR of polyethylene made by Al-modified Phillips catalyst was much higher than that by Al-free Phillips catalyst was theoretically explained well through DFT calculation results on the basis of the three types of site models A, B and C. 4 Conclusions In this work, a systematic investigation on the effects of Al-modification on the Phillips catalyst with respect to corresponding promotion of polymerization activity, extension of MWD to lower MW region and enhancement of ESCR property was performed through theoretical calculation by DFT method on polymerization mechanism in combination with experimental high-resolution XPS characterization on the physico-chemical nature of surface Cr species and ethylene polymerization reactions. The XPS studies signified that Al-modification enhanced the photo stability of surface chromate species and therefore restricted the formation of Cr(III)O x,surf species resulted from reduction of Cr(VI)O x,surf species during XPS measurement. However, the observed decreased BE values showed a decrease in electron-deficiency (or an increase in electron density) of surface chromate species by Al-modification. The ethylene polymerization activity of the Al-modified Phillips catalyst was increased and the molecular weight (MW) of polymer was lower with the expansion of molecular weight distribution (MWD) to the low MW side. A deeper theoretical mechanism has been elucidated through employing the DFT method by investigating energetic behaviors of chain initiation, propagation and transfer proceeding on the three established cluster models with 0:1, 1:1, and 2:1 Al/Cr atomic ratios representing Phillips catalysts without or with Al-modification. Initiation reaction undergoing a metallacycle mechanism was calculated to proceed from the quintet potential energy surface via a minimum energy crossing point to the triplet potential energy surface and such spin crossover was proven by locating MECPs along the reaction pathways. Corresponding computation results confirmed that Al-associated active sites tended to decrease the energy barrier for chain initiation step when taking spin crossover into account, indicating Al-modification favored to initiate olefin polymerization on Cr(II) centers. Although both chain propagation and transfer in homopolymerization were found to be unfavorable after Al-modification, the difference in energy barriers between such two competing reactions decreased due to Al-modification, suggesting low MW polymer was preferred to produce on chromium sites containing CrOAl bond, giving rise to an expansion of MWD to the low MW side. Al-modified catalyst enhanced ESCR property of polymer due to putting less SCBs into the low MW side of the distribution in two ways: (i) retarding the incorporation of comonomer in the low MW polymer; and (ii) increasing chain transfer rate after the incorporation of comonomer. It is still not known whether the observed increase in activity is also a consequence of an increase in the number of active sites by the Al-modification. More investigation will be done in order to get closer to a complete understanding on this issue in the further work. Acknowledgments This work is financially supported by the National Natural Science Foundation of China (No. 20774025, No. 21104019 and No. 21274040), the Research Program of the State Key Laboratory of Chemical Engineering, the Fundamental Research Funds for the Central Universities and the Program of Introducing Talents of Discipline to Universities (B08021). We thank Prof. J.N. Harvey and Prof. T.J. Dudley for their kind suggestions to locate the minimum-energy crossing points (MECP) between two different potential energy surfaces and also PQ Corporation (USA) for the kind donation of the Phillips catalysts with or without Al-modification. Appendix A Supplementary data Supplementary data associated with this article can be found, in the online version, at http://dx.doi.org/10.1016/j.molcata.2015.01.020. Appendix A Supplementary data The following are Supplementary data to this article: References [1] J.P. Hogan, R.L. Banks, US 2825 721 (1958). [2] R. Cheng Z. Liu L. Zhong X. He P. Qiu M. Terano M. Eisen S. Scott B. Liu Adv. Polym. Sci. 257 2013 135 202 [3] M.P. McDaniel E.D. Schwerdtfeger M.D. Jensen J. Catal. 314 2014 109 116 [4] M.P. McDaniel Handbook of Heterogeneous Catalysis 2008 Wiley-VCH Weinheim 3733 3792 [5] E. Groppo C. Lamberti S. Bordiga G. Spoto A. Zecchina Chem. Rev. 105 2005 115 184 [6] M.P. McDaniel Adv. Catal. 53 2010 123 606 [7] B.M. Weckhuysen R.A. Schoonheydt Catal. Today 51 1999 215 221 [8] Z. Liu X. He R. Cheng M.S. Eisen M. Terano S.L. Scott B. Liu Adv. Chem. Eng. 2014 127 192 [9] G. Busca, Polymerization Catalysts and Heterogenized Homogeneous Catalysts (2014) 421–428. [10] Ø. Espelid K.J. Børve J. Catal. 195 2000 125 139 [11] E. Groppo C. Lamberti S. Bordiga G. Spoto A. Zecchina J. Catal. 240 2006 172 181 [12] B. Rebenstorf J. Mol. Catal. 66 1991 59 71 [13] M.P. McDaniel J. Catal. 76 1982 37 47 [14] A. Matta Y. Zeng T. Taniike M. Terano Macromol. React. Eng. 6 2012 346 350 [15] N. Zhao R. Cheng X. He Z. Liu B. Liu Macromol. Chem. Phys. 215 2014 1753 1766 [16] N. Zhao R. Cheng X. He Z. Liu B. Liu R. Zhang Y. Gao E. Zou S. Wang Macromol. Chem. Phys. 215 2014 1434 1445 [17] L.J. Rekers, S.J. Katzen, J.H. Krekeler, US 3984 351 (1976). [18] H. Frielingsdorf, W. Gruber, H. Mueller-Tamm, G. Merz, L. Gonsior, DE 2604 548 (1977). [19] A.N. Speca, US 4119 773 (1978). [20] L.J.M.A. van de Leemput, US 4146 695 (1979). [21] L.J.M.A. van de Leemput, US 4209 603 (1980). [22] L.J. Rekers, S.J. Katzen, J.H. Krekeler, US 4260 706 (1981). [23] L.J. Rekers, A.N. Speca, US 4276 399 (1981). [24] L.J. Rekers, R.J. French, H.W. Mayhew, US 4356 294 (1982). [25] L.J. Rekers, S.J. Katzen, EP 0291 824 (1988). [26] L. Zhong M.Y. Lee Z. Liu Y.J. Wanglee B.P. Liu S.L. Scott J. Catal. 293 2012 1 12 [27] Z. Liu R. Cheng X. He B. Liu ACS Catal. 3 2013 1172 1183 [28] Z. Liu R. Cheng X. He X. Wu B. Liu J. Phys. Chem. 116 2012 7538 7549 [29] P. Qiu R. Cheng Z. Liu B. Liu B. Tumanskii M.S. Eisen J. Organomet. Chem. 699 2012 48 55 [30] P. Qiu R. Cheng B. Liu B. Tumanskii R.J. Batrice M. Botoshansky M.S. Eisen Organometallics 30 2011 2144 2148 [31] C.A. Demmelmaier R.E. White J.A. van Bokhoven S.L. Scott J. Catal. 262 2009 44 56 [32] J. Estephane E. Groppo J.G. Vitillo A. Damin D. Gianolio C. Lamberti S. Bordiga E.A. Quadrelli J.M. Basset G. Kervern L. Emsley G. Pintacuda A. Zecchina J. Phy. Chem. C 114 2010 4451 4458 [33] R. Cheng C. Xu Z. Liu Q. Dong X. He Y. Fang M. Terano Y. Hu T.J. Pullukat B. Liu J. Catal. 273 2010 103 115 [34] B. Liu M. Terano J. Mol. Catal. A: Chem. 172 2001 227 240 [35] Y. Fang B. Liu M. Terano Appl. Catal. A: Gen. 279 2005 131 138 [36] M.J. Frisch G.W. Trucks H.B. Schlegel G.E. Scuseria M.A. Robb J.R. Cheeseman J.A. Montgomery Jr. T. Vreven K.N. Kudin J.C. Burant J.M. Millam S.S. Iyengar J. Tomasi V. Barone B. Mennucci M. Cossi G. Scalmani N. Rega G.A. Petersson H. Nakatsuji M. Hada M. Ehara K. Toyota R. Fukuda J. Hasegawa M. Ishida T. Nakajima Y. Honda O. Kitao H. Nakai M. Klene X. Li J.E. Knox H.P. Hratchian J.B. Cross V. Bakken C. Adamo J. Jaramillo R. Gomperts R.E. Stratmann O. Yazyev A.J. Austin R. Cammi C. Pomelli J.W. Ochterski P.Y. Ayala K. Morokuma G.A. Voth P. Salvador J.J. Dannenberg V.G. Zakrzewski S. Dapprich A.D. Daniels M.C. Strain O. Farkas D.K. Malick A.D. Rabuck K. Raghavachari J.B. Foresman J.V. Ortiz Q. Cui A.G. Baboul S. Clifford J. Cioslowski B.B. Stefanov G. Liu A. Liashenko P. Piskorz I. Komaromi R.L. Martin D.J. Fox T. Keith M.A. Al-Laham C.Y. Peng A. Nanayakkara M. Challacombe P.M.W. Gill B. Johnson W. Chen M.W. Wong C. Gonzalez J.A. Pople Gaussian 03 Revision E.01 2004 Gaussian, Inc. Wallingford, CT [37] A.D. Becke J. Chem. Phys. 98 1993 5648 [38] C. Lee W. Yang R.G. Parr Phys. Rev. B 37 1988 785 [39] P.J. Hay W.R. Wadt J. Chem. Phys. 82 1985 299 310 [40] L.E. Roy P.J. Hay R.L. Martin J. Chem. 4 2008 1029 1031 [41] C. Gonzalez H.B. Schlegel J. Chem. Phys. 90 1989 2154 2161 [42] C. Gonzalez H.B. Schlegel J. Phys. Chem. 94 1990 5523 5527 [43] A.E. Reed L.A. Curtiss F. Weinhold Chem. Rev. 88 1988 899 926 [44] X. Cao R. Cheng Z. Liu L. Wang Q. Dong X. He B. Liu J. Mol. Catal. A: Chem. 321 2010 50 60 [45] O. Espelid K.J. Børve J. Catal. 195 2000 125 139 [46] O. Espelid K.J. Børve Catal. Lett. 75 2001 49 54 [47] O. Espelid K.J. Børve J. Catal. 205 2002 366 374 [48] J.B. Peri J. Catal. 41 1976 227 239 [49] B. Liu Y. Fang M. Terano J. Mol. Catal. A: Chem. 219 2004 165 173 [50] M.P. McDaniel Adv. Catal. 33 1985 47 98 [51] C.E. Marsden Plast. Rubber Compos. Process. Appl. 21 1994 193 200 [52] L. Zhong Z. Liu R. Cheng S. Tang P. Qiu X. He M. Terano B. Liu Chem. Cat. Chem. 4 2012 872 881 [53] Y.V. Kissin A.J. Brandolini J.L. Garlick J. Polym. Sci. Part A: Polym. Chem. 46 2008 5315 5329 [54] S. Zhang R. Cheng Q. Dong X. He Q. Wang Y. Tang Y. Yu K. Xie J. Da M. Terano B. Liu Macromol. React. Eng. 7 2013 254 266 [55] G. Ghiotti E. Garrone A. Zecchina J. Mol. Catal. 46 1988 61 77 [56] R. Emrich O. Heinemann P.W. Jolly C. Krueger G.P.J. Verhovnik Organometallics 16 1997 1511 1513 [57] V.J. Ruddick J.P.S. Badyal J. Phys. Chem. B 102 1998 2991 2994 [58] J.N. Harvey M. Aschi H. Schwarz W. Koch Theor. Chem. Acc. 99 1998 95 99 [59] Z. Liu L. Zhong Y. Yang R. Cheng B. Liu J. Phys. Chem. A 115 2011 8131 8141 [60] P. Cossee J. Catal. 3 1964 80 88",
      "scopus-id": "84924067782",
      "coredata": {
        "eid": "1-s2.0-S1381116915000242",
        "dc:description": "In this work, the effects of Al-modification on Phillips catalysts were investigated by high-resolution X-ray photoelectron spectroscopy (XPS) and the performance in ethylene polymerization reactions. Density functional theory (DFT) method was used to achieve a deeper mechanistic understanding. The decreased Cr 2p binding energies (BE), related with an increase in electron density of chromium by Al-modification, have been confirmed by the DFT calculation. The ethylene polymerization activity over the Al-modified Phillips catalyst was increased. The molecular weight (MW) of polymer was decreased with the expansion of molecular weight distribution (MWD) to low MW side, which was in agreement with the decreased energy barrier difference between the chain transfer and chain propagation in DFT calculation. The initiation step undergoing a metallacycle reaction pathway was found through a spin crossover from the quintet energy surface via a minimum energy crossing point (MECP) to the triplet energy surface. Modeling results indicated that the promotion effect on polymerization activity from Al-modification for Phillips catalyst was mainly originated from the chain initiation reaction with lowered energy barrier for Al-modified Cr active sites. Improved environmental stress-crack resistance (ESCR) of polymer derived from the Al-modified catalyst could be expected from the less short chain branches (SCBs) distribution in the low MW side.",
        "openArchiveArticle": "false",
        "prism:coverDate": "2015-05-15",
        "openaccessUserLicense": null,
        "prism:aggregationType": "Journal",
        "prism:url": "https://api.elsevier.com/content/article/pii/S1381116915000242",
        "dc:creator": [
          {
            "@_fa": "true",
            "$": "Ma, Yue"
          },
          {
            "@_fa": "true",
            "$": "Wang, Lisong"
          },
          {
            "@_fa": "true",
            "$": "Liu, Zhen"
          },
          {
            "@_fa": "true",
            "$": "Cheng, Ruihua"
          },
          {
            "@_fa": "true",
            "$": "Zhong, Lei"
          },
          {
            "@_fa": "true",
            "$": "Yang, Yun"
          },
          {
            "@_fa": "true",
            "$": "He, Xuelian"
          },
          {
            "@_fa": "true",
            "$": "Fang, Yuwei"
          },
          {
            "@_fa": "true",
            "$": "Terano, Minoru"
          },
          {
            "@_fa": "true",
            "$": "Liu, Boping"
          }
        ],
        "link": [
          {
            "@_fa": "true",
            "@rel": "self",
            "@href": "https://api.elsevier.com/content/article/pii/S1381116915000242"
          },
          {
            "@_fa": "true",
            "@rel": "scidir",
            "@href": "https://www.sciencedirect.com/science/article/pii/S1381116915000242"
          }
        ],
        "dc:format": "application/json",
        "openaccessType": null,
        "pii": "S1381-1169(15)00024-2",
        "prism:volume": "401",
        "prism:publisher": "Elsevier B.V.",
        "dc:title": "High-resolution XPS and DFT investigations into Al-modified Phillips CrO x /SiO2 catalysts",
        "prism:copyright": "Copyright © 2015 Elsevier B.V. All rights reserved.",
        "openaccess": "0",
        "prism:issn": "13811169",
        "dcterms:subject": [
          {
            "@_fa": "true",
            "$": "Phillips CrO x /SiO2 catalyst"
          },
          {
            "@_fa": "true",
            "$": "Al-modification"
          },
          {
            "@_fa": "true",
            "$": "X-ray photoelectron spectroscopy"
          },
          {
            "@_fa": "true",
            "$": "Density functional theory"
          },
          {
            "@_fa": "true",
            "$": "Spin-crossover"
          }
        ],
        "openaccessArticle": "false",
        "prism:publicationName": "Journal of Molecular Catalysis A: Chemical",
        "openaccessSponsorType": null,
        "prism:pageRange": "1-12",
        "prism:endingPage": "12",
        "pubType": "fla",
        "prism:coverDisplayDate": "15 May 2015",
        "prism:doi": "10.1016/j.molcata.2015.01.020",
        "prism:startingPage": "1",
        "dc:identifier": "doi:10.1016/j.molcata.2015.01.020",
        "openaccessSponsorName": null
      },
      "objects": {
        "object": [
          {
            "@category": "high",
            "@height": "831",
            "@width": "2833",
            "@_fa": "true",
            "$": "https://api.elsevier.com/content/object/eid/1-s2.0-S1381116915000242-sc3_lrg.jpg?httpAccept=%2A%2F%2A",
            "@multimediatype": "JPEG image file",
            "@type": "IMAGE-HIGH-RES",
            "@size": "133522",
            "@ref": "sc3",
            "@mimetype": "image/jpeg"
          },
          {
            "@category": "high",
            "@height": "1051",
            "@width": "2500",
            "@_fa": "true",
            "$": "https://api.elsevier.com/content/object/eid/1-s2.0-S1381116915000242-sc2_lrg.jpg?httpAccept=%2A%2F%2A",
            "@multimediatype": "JPEG image file",
            "@type": "IMAGE-HIGH-RES",
            "@size": "131243",
            "@ref": "sc2",
            "@mimetype": "image/jpeg"
          },
          {
            "@category": "high",
            "@height": "1700",
            "@width": "2500",
            "@_fa": "true",
            "$": "https://api.elsevier.com/content/object/eid/1-s2.0-S1381116915000242-sc1_lrg.jpg?httpAccept=%2A%2F%2A",
            "@multimediatype": "JPEG image file",
            "@type": "IMAGE-HIGH-RES",
            "@size": "280501",
            "@ref": "sc1",
            "@mimetype": "image/jpeg"
          },
          {
            "@category": "high",
            "@height": "2022",
            "@width": "2333",
            "@_fa": "true",
            "$": "https://api.elsevier.com/content/object/eid/1-s2.0-S1381116915000242-gr5_lrg.jpg?httpAccept=%2A%2F%2A",
            "@multimediatype": "JPEG image file",
            "@type": "IMAGE-HIGH-RES",
            "@size": "516290",
            "@ref": "gr5",
            "@mimetype": "image/jpeg"
          },
          {
            "@category": "high",
            "@height": "1970",
            "@width": "2333",
            "@_fa": "true",
            "$": "https://api.elsevier.com/content/object/eid/1-s2.0-S1381116915000242-gr4_lrg.jpg?httpAccept=%2A%2F%2A",
            "@multimediatype": "JPEG image file",
            "@type": "IMAGE-HIGH-RES",
            "@size": "519653",
            "@ref": "gr4",
            "@mimetype": "image/jpeg"
          },
          {
            "@category": "high",
            "@height": "1825",
            "@width": "2250",
            "@_fa": "true",
            "$": "https://api.elsevier.com/content/object/eid/1-s2.0-S1381116915000242-gr3_lrg.jpg?httpAccept=%2A%2F%2A",
            "@multimediatype": "JPEG image file",
            "@type": "IMAGE-HIGH-RES",
            "@size": "332201",
            "@ref": "gr3",
            "@mimetype": "image/jpeg"
          },
          {
            "@category": "high",
            "@height": "1297",
            "@width": "1708",
            "@_fa": "true",
            "$": "https://api.elsevier.com/content/object/eid/1-s2.0-S1381116915000242-gr2_lrg.jpg?httpAccept=%2A%2F%2A",
            "@multimediatype": "JPEG image file",
            "@type": "IMAGE-HIGH-RES",
            "@size": "176339",
            "@ref": "gr2",
            "@mimetype": "image/jpeg"
          },
          {
            "@category": "high",
            "@height": "1306",
            "@width": "1667",
            "@_fa": "true",
            "$": "https://api.elsevier.com/content/object/eid/1-s2.0-S1381116915000242-gr1_lrg.jpg?httpAccept=%2A%2F%2A",
            "@multimediatype": "JPEG image file",
            "@type": "IMAGE-HIGH-RES",
            "@size": "174280",
            "@ref": "gr1",
            "@mimetype": "image/jpeg"
          },
          {
            "@category": "high",
            "@height": "886",
            "@width": "2213",
            "@_fa": "true",
            "$": "https://api.elsevier.com/content/object/eid/1-s2.0-S1381116915000242-fx1_lrg.jpg?httpAccept=%2A%2F%2A",
            "@multimediatype": "JPEG image file",
            "@type": "IMAGE-HIGH-RES",
            "@size": "207897",
            "@ref": "fx1",
            "@mimetype": "image/jpeg"
          },
          {
            "@category": "standard",
            "@height": "188",
            "@width": "640",
            "@_fa": "true",
            "$": "https://api.elsevier.com/content/object/eid/1-s2.0-S1381116915000242-sc3.jpg?httpAccept=%2A%2F%2A",
            "@multimediatype": "JPEG image file",
            "@type": "IMAGE-DOWNSAMPLED",
            "@size": "16105",
            "@ref": "sc3",
            "@mimetype": "image/jpeg"
          },
          {
            "@category": "standard",
            "@height": "238",
            "@width": "565",
            "@_fa": "true",
            "$": "https://api.elsevier.com/content/object/eid/1-s2.0-S1381116915000242-sc2.jpg?httpAccept=%2A%2F%2A",
            "@multimediatype": "JPEG image file",
            "@type": "IMAGE-DOWNSAMPLED",
            "@size": "16009",
            "@ref": "sc2",
            "@mimetype": "image/jpeg"
          },
          {
            "@category": "standard",
            "@height": "384",
            "@width": "565",
            "@_fa": "true",
            "$": "https://api.elsevier.com/content/object/eid/1-s2.0-S1381116915000242-sc1.jpg?httpAccept=%2A%2F%2A",
            "@multimediatype": "JPEG image file",
            "@type": "IMAGE-DOWNSAMPLED",
            "@size": "31630",
            "@ref": "sc1",
            "@mimetype": "image/jpeg"
          },
          {
            "@category": "standard",
            "@height": "457",
            "@width": "527",
            "@_fa": "true",
            "$": "https://api.elsevier.com/content/object/eid/1-s2.0-S1381116915000242-gr5.jpg?httpAccept=%2A%2F%2A",
            "@multimediatype": "JPEG image file",
            "@type": "IMAGE-DOWNSAMPLED",
            "@size": "60300",
            "@ref": "gr5",
            "@mimetype": "image/jpeg"
          },
          {
            "@category": "standard",
            "@height": "445",
            "@width": "527",
            "@_fa": "true",
            "$": "https://api.elsevier.com/content/object/eid/1-s2.0-S1381116915000242-gr4.jpg?httpAccept=%2A%2F%2A",
            "@multimediatype": "JPEG image file",
            "@type": "IMAGE-DOWNSAMPLED",
            "@size": "58275",
            "@ref": "gr4",
            "@mimetype": "image/jpeg"
          },
          {
            "@category": "standard",
            "@height": "412",
            "@width": "508",
            "@_fa": "true",
            "$": "https://api.elsevier.com/content/object/eid/1-s2.0-S1381116915000242-gr3.jpg?httpAccept=%2A%2F%2A",
            "@multimediatype": "JPEG image file",
            "@type": "IMAGE-DOWNSAMPLED",
            "@size": "38230",
            "@ref": "gr3",
            "@mimetype": "image/jpeg"
          },
          {
            "@category": "standard",
            "@height": "293",
            "@width": "386",
            "@_fa": "true",
            "$": "https://api.elsevier.com/content/object/eid/1-s2.0-S1381116915000242-gr2.jpg?httpAccept=%2A%2F%2A",
            "@multimediatype": "JPEG image file",
            "@type": "IMAGE-DOWNSAMPLED",
            "@size": "20183",
            "@ref": "gr2",
            "@mimetype": "image/jpeg"
          },
          {
            "@category": "standard",
            "@height": "295",
            "@width": "376",
            "@_fa": "true",
            "$": "https://api.elsevier.com/content/object/eid/1-s2.0-S1381116915000242-gr1.jpg?httpAccept=%2A%2F%2A",
            "@multimediatype": "JPEG image file",
            "@type": "IMAGE-DOWNSAMPLED",
            "@size": "21198",
            "@ref": "gr1",
            "@mimetype": "image/jpeg"
          },
          {
            "@category": "standard",
            "@height": "200",
            "@width": "500",
            "@_fa": "true",
            "$": "https://api.elsevier.com/content/object/eid/1-s2.0-S1381116915000242-fx1.jpg?httpAccept=%2A%2F%2A",
            "@multimediatype": "JPEG image file",
            "@type": "IMAGE-DOWNSAMPLED",
            "@size": "24848",
            "@ref": "fx1",
            "@mimetype": "image/jpeg"
          },
          {
            "@category": "thumbnail",
            "@height": "64",
            "@width": "219",
            "@_fa": "true",
            "$": "https://api.elsevier.com/content/object/eid/1-s2.0-S1381116915000242-sc3.sml?httpAccept=%2A%2F%2A",
            "@multimediatype": "GIF image file",
            "@type": "IMAGE-THUMBNAIL",
            "@size": "2215",
            "@ref": "sc3",
            "@mimetype": "image/gif"
          },
          {
            "@category": "thumbnail",
            "@height": "92",
            "@width": "219",
            "@_fa": "true",
            "$": "https://api.elsevier.com/content/object/eid/1-s2.0-S1381116915000242-sc2.sml?httpAccept=%2A%2F%2A",
            "@multimediatype": "GIF image file",
            "@type": "IMAGE-THUMBNAIL",
            "@size": "2597",
            "@ref": "sc2",
            "@mimetype": "image/gif"
          },
          {
            "@category": "thumbnail",
            "@height": "149",
            "@width": "219",
            "@_fa": "true",
            "$": "https://api.elsevier.com/content/object/eid/1-s2.0-S1381116915000242-sc1.sml?httpAccept=%2A%2F%2A",
            "@multimediatype": "GIF image file",
            "@type": "IMAGE-THUMBNAIL",
            "@size": "4591",
            "@ref": "sc1",
            "@mimetype": "image/gif"
          },
          {
            "@category": "thumbnail",
            "@height": "164",
            "@width": "189",
            "@_fa": "true",
            "$": "https://api.elsevier.com/content/object/eid/1-s2.0-S1381116915000242-gr5.sml?httpAccept=%2A%2F%2A",
            "@multimediatype": "GIF image file",
            "@type": "IMAGE-THUMBNAIL",
            "@size": "10871",
            "@ref": "gr5",
            "@mimetype": "image/gif"
          },
          {
            "@category": "thumbnail",
            "@height": "164",
            "@width": "194",
            "@_fa": "true",
            "$": "https://api.elsevier.com/content/object/eid/1-s2.0-S1381116915000242-gr4.sml?httpAccept=%2A%2F%2A",
            "@multimediatype": "GIF image file",
            "@type": "IMAGE-THUMBNAIL",
            "@size": "11456",
            "@ref": "gr4",
            "@mimetype": "image/gif"
          },
          {
            "@category": "thumbnail",
            "@height": "164",
            "@width": "202",
            "@_fa": "true",
            "$": "https://api.elsevier.com/content/object/eid/1-s2.0-S1381116915000242-gr3.sml?httpAccept=%2A%2F%2A",
            "@multimediatype": "GIF image file",
            "@type": "IMAGE-THUMBNAIL",
            "@size": "5158",
            "@ref": "gr3",
            "@mimetype": "image/gif"
          },
          {
            "@category": "thumbnail",
            "@height": "164",
            "@width": "216",
            "@_fa": "true",
            "$": "https://api.elsevier.com/content/object/eid/1-s2.0-S1381116915000242-gr2.sml?httpAccept=%2A%2F%2A",
            "@multimediatype": "GIF image file",
            "@type": "IMAGE-THUMBNAIL",
            "@size": "4678",
            "@ref": "gr2",
            "@mimetype": "image/gif"
          },
          {
            "@category": "thumbnail",
            "@height": "164",
            "@width": "209",
            "@_fa": "true",
            "$": "https://api.elsevier.com/content/object/eid/1-s2.0-S1381116915000242-gr1.sml?httpAccept=%2A%2F%2A",
            "@multimediatype": "GIF image file",
            "@type": "IMAGE-THUMBNAIL",
            "@size": "4745",
            "@ref": "gr1",
            "@mimetype": "image/gif"
          },
          {
            "@category": "thumbnail",
            "@height": "88",
            "@width": "219",
            "@_fa": "true",
            "$": "https://api.elsevier.com/content/object/eid/1-s2.0-S1381116915000242-fx1.sml?httpAccept=%2A%2F%2A",
            "@multimediatype": "GIF image file",
            "@type": "IMAGE-THUMBNAIL",
            "@size": "4149",
            "@ref": "fx1",
            "@mimetype": "image/gif"
          },
          {
            "@category": "standard",
            "@_fa": "true",
            "$": "https://api.elsevier.com/content/object/eid/1-s2.0-S1381116915000242-mmc1.doc?httpAccept=%2A%2F%2A",
            "@multimediatype": "Microsoft Word file",
            "@type": "APPLICATION",
            "@size": "2122752",
            "@ref": "mmc1",
            "@mimetype": "application/word"
          }
        ]
      },
      "link": {
        "@rel": "abstract",
        "@href": "https://api.elsevier.com/content/abstract/scopus_id/84924067782"
      }
    }
  }
}