{
  "metadata": {
    "title": "Silver nanostructure-decorated hierarchical titanium dioxide nanoflowers for SERS and photocatalytic applications",
    "authors": "; ; ",
    "journal": "Catalysis Communications",
    "date": "2023-05-31",
    "doi": "10.1016/j.catcom.2023.106672",
    "abstract": "",
    "uri": "https://api.elsevier.com/content/article/pii/S1566736723000742",
    "pii": "S1566736723000742"
  },
  "fulltext": {
    "full-text-retrieval-response": {
      "scopus-eid": "2-s2.0-85152681890",
      "originalText": "serial JL 272180 291210 291744 291809 31 90 Catalysis Communications CATALYSISCOMMUNICATIONS 2023-04-17 2023-04-17 2023-04-19 2023-04-19 2023-07-03T15:57:47 1-s2.0-S1566736723000742 S1566-7367(23)00074-2 S1566736723000742 10.1016/j.catcom.2023.106672 S300 S300.1 FULL-TEXT 1-s2.0-S1566736723X00041 2024-05-24T08:20:11.211545Z 0 0 20230501 20230531 2023 2023-04-17T15:15:57.607313Z absattachment articleinfo articlenumber articletitlenorm authfirstinitialnorm authfirstsurnamenorm cid cids contenttype copyright crossmark dateloaded dateloadedtxt datesearch datesort dateupdated dco docsubtype doctype doi eid ewtransactionid fundingbodyid hubeid indexeddate issn issnnorm itemstage itemtransactionid itemweight oauserlicense openaccess openarchive pg pgfirst pii piinorm pubdateend pubdatestart pubdatetxt pubyr sortorder sponsoredaccesstype srctitle srctitlenorm srctype ssids alllist content oa subj subheadings suppl tomb volfirst volissue volumelist webpdf webpdfpagecount yearnav figure e-component body mmlmath acknowledge affil appendices articletitle auth authfirstini authfull authkeywords authlast grantnumber grantsponsor highlightsabst primabst ref specialabst 1566-7367 15667367 UNLIMITED NONE true 178 178 C Volume 178 2 106672 106672 106672 202305 May 2023 2023-05-01 2023-05-31 2023 article fla © 2023 The Authors. Published by Elsevier B.V. SILVERNANOSTRUCTUREDECORATEDHIERARCHICALTITANIUMDIOXIDENANOFLOWERSFORSERSPHOTOCATALYTICAPPLICATIONS SERGINAY N 1 Introduction 2 Experimental section 2.1 Materials 2.2 Preparation of TNFs, TNF@PLDOPA, and TNF@PLDOPA@Ag nanosystems 2.3 Characterization of nanosystems 2.4 SERS activity tests 2.5 Catalytic activity tests 3 Results and discussion 3.1 Characterization of nanosystems 3.2 SERS activity tests 3.3 Catalytic activity tests 4 Conclusions Notes CRediT authorship contribution statement Acknowledgments Appendix A Supplementary data References FLEISCHMANN 1974 163 166 M LOMBARDI 2009 734 742 J DEMIREL 2018 5314 5335 G DING 2017 4042 4076 S HAN 2017 4847 4861 X YILMAZ 2015 5669 5676 M YILMAZ 2017 918 924 M WANG 2019 5856 5862 X WANG 2017 Y YANG 2015 287 292 L LI 2010 392 395 J CECCHINI 2013 165 171 M FELIDJ 2003 3095 3097 N HAYNES 2001 5599 5611 C YILMAZ 2014 5563 5570 M WEI 2013 3863 3868 W DOHERTY 2010 19913 19919 M AKIN 2014 4894 4900 M ZHANG 2008 2348 2355 B GARCIAVIDAL 1996 1163 1166 F YILMAZ 2019 M MAZLUMOGLU 2021 13396 13404 H JIANG 2022 L RAJARAMAN 2020 T LUO 2017 23265 23286 C GUO 2019 Q WATEGAONKAR 2020 S LIU 2019 42 48 Y MALI 2013 S LI 2018 670 676 S LAMBERTI 2016 193 197 A YANG 2019 483 492 X PARALE 2020 4939 4946 V GAO 2016 156 164 R NI 2017 J YAO 2016 206 211 H BABU 2016 265 269 B SU 2016 159 168 J PRAVEENKUMAR 2016 201 208 D CHEN 2016 191 198 Y SUN 2013 966 968 Z LI 2012 4634 4667 Y LUI 2013 12255 12262 G ZHOU 2013 11242 11251 J MIAO 2002 717 720 Z YOSHITAKE 2002 1023 1029 H ZHOU 2013 11242 11251 J KHAN 2002 2243 2245 S TANAKA 2013 79 85 A TIAN 2004 1810 1811 Y VARLEY 2011 2343 2347 J YOUNGBLOOD 2009 1966 1973 W GUVEN 2011 740 748 B YILMAZ 2016 12638 12641 M CALIS 2021 B YILMAZ 2018 515 521 M TURAN 2021 H POLYLDOPAMEDIATEDBIMETALLICCORESHELLNANOSTRUCTURESGOLDSILVEREMPLOYMENTINSERSCATALYTICACTIVITYCELLVIABILITY SERGINAY 2022 N BAKIRCI 2017 48 52 G LI 2019 1321 1326 Y HU 2017 1156 1162 Y TAKCI 2022 D YILMAZ 2020 A YILMAZ 2020 126 133 A YILMAZ 2021 M PENG 2021 Y MAZLUMOGLU 2021 13396 13404 H TIAN 2020 16990 16999 Y HWANG 2022 54550 54557 C LI 2022 X MA 2020 H ALI 2018 325 335 T LIANG 2017 1 10 H YU 2016 11870 11874 B SERGINAYX2023X106672 SERGINAYX2023X106672XN Full 2023-04-16T12:01:19Z Author http://creativecommons.org/licenses/by-nc-nd/4.0/ This is an open access article under the CC BY-NC-ND license. © 2023 The Authors. Published by Elsevier B.V. 2023-04-21T08:31:29.843Z http://vtw.elsevier.com/data/voc/AddOnTypes/50.7/aggregated-refined Ataturk University Atatürk Üniversitesi http://data.elsevier.com/vocabulary/SciValFunders/501100004951 http://sws.geonames.org/298795/ AU-BAP FAB-2021-9405 DAYTAM East Anatolia High Technology Application and Research Center This work was supported by Ataturk University Scientific Research Project Coordination Unit (AU-BAP, No: FAB-2021-9405 ). The authors also kindly acknowledge the East Anatolia High Technology Application and Research Center (DAYTAM) at Ataturk University for providing laboratory spaces and characterization devices. This work was supported by Ataturk University Scientific Research Project Coordination Unit (AU-BAP, No: FAB-2021-9405). The authors also kindly acknowledge the East Anatolia High Technology Application and Research Center (DAYTAM) at Ataturk University for providing laboratory spaces and characterization devices. item S1566-7367(23)00074-2 S1566736723000742 1-s2.0-S1566736723000742 10.1016/j.catcom.2023.106672 272180 2023-07-03T15:19:24.378463Z 2023-05-01 2023-05-31 UNLIMITED NONE 1-s2.0-S1566736723000742-main.pdf https://s3-eu-west-1.amazonaws.com/prod-ucs-content-store-eu-west/content/pii:S1566736723000742/MAIN/application/pdf/4287c1ffddd79d6e35e8fa53ff44eec8/main.pdf main.pdf pdf true 6358166 MAIN 10 1-s2.0-S1566736723000742-main_1.png https://s3-eu-west-1.amazonaws.com/prod-ucs-content-store-eu-west/content/pii:S1566736723000742/PREVIEW/image/png/156b94226737d7d7c3bfd2ea21f2bd37/main_1.png main_1.png png 61641 849 656 IMAGE-WEB-PDF 1 1-s2.0-S1566736723000742-gr7.jpg https://s3-eu-west-1.amazonaws.com/prod-ucs-content-store-eu-west/content/pii:S1566736723000742/gr7/DOWNSAMPLED/image/jpeg/bbf633087208e2b9d1bc67956d65bfb5/gr7.jpg gr7 gr7.jpg jpg 103713 688 568 IMAGE-DOWNSAMPLED 1-s2.0-S1566736723000742-gr6.jpg https://s3-eu-west-1.amazonaws.com/prod-ucs-content-store-eu-west/content/pii:S1566736723000742/gr6/DOWNSAMPLED/image/jpeg/3fad8e9e19bbfae73e4c66b06c05edb3/gr6.jpg gr6 gr6.jpg jpg 78138 287 729 IMAGE-DOWNSAMPLED 1-s2.0-S1566736723000742-gr5.jpg https://s3-eu-west-1.amazonaws.com/prod-ucs-content-store-eu-west/content/pii:S1566736723000742/gr5/DOWNSAMPLED/image/jpeg/58af020bfe322c11e13a17b82d5a9672/gr5.jpg gr5 gr5.jpg jpg 57299 309 802 IMAGE-DOWNSAMPLED 1-s2.0-S1566736723000742-gr4.jpg https://s3-eu-west-1.amazonaws.com/prod-ucs-content-store-eu-west/content/pii:S1566736723000742/gr4/DOWNSAMPLED/image/jpeg/664a46d4fdf5c6ae0e3bd9bc07586eb9/gr4.jpg gr4 gr4.jpg jpg 88928 566 757 IMAGE-DOWNSAMPLED 1-s2.0-S1566736723000742-gr3.jpg https://s3-eu-west-1.amazonaws.com/prod-ucs-content-store-eu-west/content/pii:S1566736723000742/gr3/DOWNSAMPLED/image/jpeg/c9a07202457663b1a52624f8e093ad83/gr3.jpg gr3 gr3.jpg jpg 65097 292 800 IMAGE-DOWNSAMPLED 1-s2.0-S1566736723000742-gr2.jpg https://s3-eu-west-1.amazonaws.com/prod-ucs-content-store-eu-west/content/pii:S1566736723000742/gr2/DOWNSAMPLED/image/jpeg/184936eb7a98951f5cc62f3ff68a632e/gr2.jpg gr2 gr2.jpg jpg 138486 591 619 IMAGE-DOWNSAMPLED 1-s2.0-S1566736723000742-ga1.jpg https://s3-eu-west-1.amazonaws.com/prod-ucs-content-store-eu-west/content/pii:S1566736723000742/ga1/DOWNSAMPLED/image/jpeg/77dd4885982fb1d86e13236febb131b6/ga1.jpg ga1 true ga1.jpg jpg 15593 200 301 IMAGE-DOWNSAMPLED 1-s2.0-S1566736723000742-gr1.jpg https://s3-eu-west-1.amazonaws.com/prod-ucs-content-store-eu-west/content/pii:S1566736723000742/gr1/DOWNSAMPLED/image/jpeg/9eca2262299621630088a69005f9b81e/gr1.jpg gr1 gr1.jpg jpg 139738 760 533 IMAGE-DOWNSAMPLED 1-s2.0-S1566736723000742-gr7.sml https://s3-eu-west-1.amazonaws.com/prod-ucs-content-store-eu-west/content/pii:S1566736723000742/gr7/THUMBNAIL/image/gif/39159b4a85d8192b4e7ebfc19825ba43/gr7.sml gr7 gr7.sml sml 8791 164 135 IMAGE-THUMBNAIL 1-s2.0-S1566736723000742-gr6.sml https://s3-eu-west-1.amazonaws.com/prod-ucs-content-store-eu-west/content/pii:S1566736723000742/gr6/THUMBNAIL/image/gif/f3a7a1ea4b5b01d0e23639e2964a7339/gr6.sml gr6 gr6.sml sml 10498 86 219 IMAGE-THUMBNAIL 1-s2.0-S1566736723000742-gr5.sml https://s3-eu-west-1.amazonaws.com/prod-ucs-content-store-eu-west/content/pii:S1566736723000742/gr5/THUMBNAIL/image/gif/d3a78addbd5e60627a976c4d90fb84fc/gr5.sml gr5 gr5.sml sml 5709 84 219 IMAGE-THUMBNAIL 1-s2.0-S1566736723000742-gr4.sml https://s3-eu-west-1.amazonaws.com/prod-ucs-content-store-eu-west/content/pii:S1566736723000742/gr4/THUMBNAIL/image/gif/80c99c98925b087d4bb06179c705fe7c/gr4.sml gr4 gr4.sml sml 12367 164 219 IMAGE-THUMBNAIL 1-s2.0-S1566736723000742-gr3.sml https://s3-eu-west-1.amazonaws.com/prod-ucs-content-store-eu-west/content/pii:S1566736723000742/gr3/THUMBNAIL/image/gif/a8444fe451869923a5e322943bbc2d62/gr3.sml gr3 gr3.sml sml 7247 80 219 IMAGE-THUMBNAIL 1-s2.0-S1566736723000742-gr2.sml https://s3-eu-west-1.amazonaws.com/prod-ucs-content-store-eu-west/content/pii:S1566736723000742/gr2/THUMBNAIL/image/gif/7a3c0894202896a0b4c02040bf3bcc00/gr2.sml gr2 gr2.sml sml 19279 163 171 IMAGE-THUMBNAIL 1-s2.0-S1566736723000742-ga1.sml https://s3-eu-west-1.amazonaws.com/prod-ucs-content-store-eu-west/content/pii:S1566736723000742/ga1/THUMBNAIL/image/gif/2ee7e24b2dba4159108d9469a39232fb/ga1.sml ga1 true ga1.sml sml 8613 146 219 IMAGE-THUMBNAIL 1-s2.0-S1566736723000742-gr1.sml https://s3-eu-west-1.amazonaws.com/prod-ucs-content-store-eu-west/content/pii:S1566736723000742/gr1/THUMBNAIL/image/gif/f4a009b70f97a554afcada8f267c72ed/gr1.sml gr1 gr1.sml sml 14457 164 115 IMAGE-THUMBNAIL 1-s2.0-S1566736723000742-gr7_lrg.jpg https://s3-eu-west-1.amazonaws.com/prod-ucs-content-store-eu-west/content/pii:S1566736723000742/HIGHRES/image/jpeg/47000c5dffbae3b13e52c4d367ce9089/gr7_lrg.jpg gr7 gr7_lrg.jpg jpg 717676 3050 2517 IMAGE-HIGH-RES 1-s2.0-S1566736723000742-gr6_lrg.jpg https://s3-eu-west-1.amazonaws.com/prod-ucs-content-store-eu-west/content/pii:S1566736723000742/HIGHRES/image/jpeg/e19a4dfcaaac36f6e2e7dcc4cd0581f2/gr6_lrg.jpg gr6 gr6_lrg.jpg jpg 769032 1271 3228 IMAGE-HIGH-RES 1-s2.0-S1566736723000742-gr5_lrg.jpg https://s3-eu-west-1.amazonaws.com/prod-ucs-content-store-eu-west/content/pii:S1566736723000742/HIGHRES/image/jpeg/35c8ceec977e1909ba33454b077c2452/gr5_lrg.jpg gr5 gr5_lrg.jpg jpg 451760 1367 3549 IMAGE-HIGH-RES 1-s2.0-S1566736723000742-gr4_lrg.jpg https://s3-eu-west-1.amazonaws.com/prod-ucs-content-store-eu-west/content/pii:S1566736723000742/HIGHRES/image/jpeg/fe8b41822bd0d3c8bd4688e4cf0245bf/gr4_lrg.jpg gr4 gr4_lrg.jpg jpg 777993 2504 3351 IMAGE-HIGH-RES 1-s2.0-S1566736723000742-gr3_lrg.jpg https://s3-eu-west-1.amazonaws.com/prod-ucs-content-store-eu-west/content/pii:S1566736723000742/HIGHRES/image/jpeg/5277d032f6da42055126d56b630cec25/gr3_lrg.jpg gr3 gr3_lrg.jpg jpg 585315 1295 3543 IMAGE-HIGH-RES 1-s2.0-S1566736723000742-gr2_lrg.jpg https://s3-eu-west-1.amazonaws.com/prod-ucs-content-store-eu-west/content/pii:S1566736723000742/HIGHRES/image/jpeg/ea9695fc87191ee7183b9430c3649cb4/gr2_lrg.jpg gr2 gr2_lrg.jpg jpg 641144 1571 1645 IMAGE-HIGH-RES 1-s2.0-S1566736723000742-ga1_lrg.jpg https://s3-eu-west-1.amazonaws.com/prod-ucs-content-store-eu-west/content/pii:S1566736723000742/HIGHRES/image/jpeg/662414b3f6e2bd6f50931d05a87ee3b5/ga1_lrg.jpg ga1 true ga1_lrg.jpg jpg 156240 886 1332 IMAGE-HIGH-RES 1-s2.0-S1566736723000742-gr1_lrg.jpg https://s3-eu-west-1.amazonaws.com/prod-ucs-content-store-eu-west/content/pii:S1566736723000742/HIGHRES/image/jpeg/0b6ad53666381af9fef4ce5ac02a89d8/gr1_lrg.jpg gr1 gr1_lrg.jpg jpg 774345 2021 1417 IMAGE-HIGH-RES 1-s2.0-S1566736723000742-mmc1.docx https://s3-eu-west-1.amazonaws.com/prod-ucs-content-store-eu-west/content/pii:S1566736723000742/mmc1/MAIN/application/vnd.openxmlformats-officedocument.wordprocessingml.document/b73cebffd75dfcfbcd495b7e8968c5c4/mmc1.docx mmc1 mmc1.docx docx 531902 APPLICATION 1-s2.0-S1566736723000742-si1.svg https://s3-eu-west-1.amazonaws.com/prod-ucs-content-store-eu-west/content/pii:S1566736723000742/image/svg+xml/ee41075473f2a902badb9a16fbe8d9bb/si1.svg si1 si1.svg svg 10276 ALTIMG 1-s2.0-S1566736723000742-si2.svg https://s3-eu-west-1.amazonaws.com/prod-ucs-content-store-eu-west/content/pii:S1566736723000742/image/svg+xml/b6c1797da018a0fa8246da011ee40f44/si2.svg si2 si2.svg svg 5328 ALTIMG 1-s2.0-S1566736723000742-am.pdf https://s3-eu-west-1.amazonaws.com/prod-ucs-content-store-eu-west/content/egi:10W1MW34XL8/MAIN/application/pdf/0260c6e01f819591818b2a30ae086d92/am.pdf am am.pdf pdf false 808203 AAM-PDF CATCOM 106672 106672 S1566-7367(23)00074-2 10.1016/j.catcom.2023.106672 The Authors Fig. 1 TEM and SEM images of TNFs (a and c) and TNF@PLDOPA NPs (b and d) at different magnifications. Red arrows indicate the thin film of the PLDOPA. (For interpretation of the references to color in this figure legend, the reader is referred to the web version of this article.) Fig. 1 Fig. 2 TEM and SEM images of TNF@PLDOPA@Ag-1 (a), TNF@PLDOPA@Ag-2 (b), and TNF@PLDOPA@Ag-3 (c) at different magnifications. Optic images in the insets represent the color of each nanosystem suspension. Fig. 2 Fig. 3 XRD and UV–vis absorption spectra of different nanosystems. Fig. 3 Fig. 4 SERS spectra collected from each TNF@PLDOPA@Ag nanosystems (a), the relevant histogram for normalized spectra according to peak maxima at 1328 cm−1 (b) and, (c) distribution of electric field for TNF@PLDOPA@Ag-3 nanosystem indicating the emergence of SPRs. The concentration of DTNB is fixed as 10−5 M. Scale bar is 100 nm. Fig. 4 Fig. 5 SERS spectra collected from the TNF@PLDOPA@Ag-3 nanosystem for different concentrations of DTNB (a) and the corresponding chart for normalized SERS signal intensities (b). Fig. 5 Fig. 6 Reproducibility obtained from 20 SERS spectra from the randomly selected spots of the TNF@PLDOPA@Ag-3 sample (a) and the intensity histogram of the dominant peak at 1328 cm-1 (b). The red line shows the average intensity of the corresponding band maxima. (For interpretation of the references to color in this figure legend, the reader is referred to the web version of this article.) Fig. 6 Fig. 7 UV–vis absorption spectra showing the degradation of MG for TNF (a), TNF@PLDOPA(b), TNF@PLDOPA@Ag-1 (c), TNF@PLDOPA@Ag-2 (d), TNF@PLDOPA@Ag-3 (e), the degradation rate of MG (f) for each nanosystem and the scheme of the photocatalytic action of TNF@PLDOPA@Ag under solar light (g). Fig. 7 Silver nanostructure-decorated hierarchical titanium dioxide nanoflowers for SERS and photocatalytic applications Nuray Serginay Methodology Validation Investigation Data curation Writing – review & editing Visualization a Hayrunnisa Mazlumoglu Methodology Writing – review & editing Project administration Funding acquisition a Asli Yilmaz Methodology Investigation Data curation Project administration Funding acquisition b Mehmet Yilmaz Conceptualization Methodology Validation Investigation Resources Data curation Visualization Supervision Project administration Funding acquisition Formal analysis Software Writing – original draft Writing – review & editing a c ⁎ a Department of Chemical Engineering, Ataturk University, 25240 Erzurum, Turkey Department of Chemical Engineering Ataturk University Erzurum 25240 Turkey Department of Chemical Engineering, Ataturk University, 25240 Erzurum, Turkey b Department of Molecular Biology and Genetics, Ataturk University, 25240 Erzurum, Turkey Department of Molecular Biology and Genetics Ataturk University Erzurum 25240 Turkey Department of Molecular Biology and Genetics, Ataturk University, 25240 Erzurum, Turkey c Department of Nanoscience and Nanoengineering, Ataturk University, 25240 Erzurum, Turkey Department of Nanoscience and Nanoengineering Ataturk University Erzurum 25240 Turkey Department of Nanoscience and Nanoengineering, Ataturk University, 25240 Erzurum, Turkey ⁎ Corresponding author at: Department of Chemical Engineering, Ataturk University, 25240 Erzurum, Turkey. Department of Chemical Engineering Ataturk University Erzurum 25240 Turkey In this study, we propose the synthesis of silver (Ag) nanoparticle decorated TiO2 nanoflowers (TNFs) using a polymeric conformal thin film of 3,4-dihydroxyphenyl-L-alanine (PLDOPA). The size, as well as interparticle distance of the decorated Ag nanostructures, were tuned by simply changing the number of supplied Ag ions. The resultant nanocomposite system (TNF@PLDOPA@Ag) showed unique SERS activity with high reproducibility and an enhancement factor of 4.2 × 107. Also, as an ideal photocatalytic system, the TNF@PLDOPA@Ag enabled the catalytic degradation of malachite green under visible light irradiation. Graphical abstract Unlabelled Image Keywords Titanium dioxide nanoflowers Surface-enhanced Raman scattering (SERS) Catalytic activity Silver nanostructures Poly(L-DOPA) Data availability No data was used for the research described in the article. 1 Introduction Since it was discovered by the Fleischmann group in 1974 [1], surface-enhanced Raman scattering (SERS) has gained significant interest as a powerful vibrational spectroscopic technique and has been employed in the detection of various biological and chemical molecules [2–7]. SERS represents unique advantages in terms of high sensitivity, desired selectivity, and non-destructive bio−/chemical information with fingerprint spectra [8–10]. Although there has been no consensus on the exact mechanism of the SERS effect, two main theories are commonly accepted by researchers: Electromagnetic mechanism (EM) and chemical mechanism (CM) [3,7]. EM is the major contributor to the SERS effect and is mainly attributed to the increase in the electric field due to the excitation of localized surface plasmon resonances (SPRs) of the SERS-active system. Therefore, EM entails closely-arranged plasmonic nanostructures of coinage metals such as gold or silver [10]. CM originates with the creation of the charge complexes between the SERS-active substrate and analyte. Various simple and innovative approaches have been developed to fabricate robust and dependable SERS platforms. In most cases, the colloidal nanostructures of gold and silver are the main method for the fabrication of SERS platforms. However, the uncontrolled aggregation of nanostructures disrupts the reproducibility of SERS signals and limits their employment in practical applications [11,12]. Alternatively, to overcome the major drawbacks of the colloidal approaches, spatial arrangement of plasmonic nanostructures has been proposed via highly sophisticated nanofabrication methods including electron beam lithography, oblique angle deposition, focused ion beam lithography, and, nanosphere lithography [13–15]. The platforms fabricated through these methods could create high SERS enhancement factors (EFs) with sufficient reproducibility due to the generations of hot spots, propagation of SPRs, and light entrapment [16–18]. However, these techniques require highly complicated and quite expensive devices that produce substrates in limited quantities for reasonable periods [19]. Therefore, in the light of theoretical and experimental studies, precise control over the size, distribution, and interparticle distance of plasmonic nanosystems with 3D morphology has an essential role in the fabrication of sensitive, reliable, and robust SERS platforms [2,18,20–22]. Titanium dioxide (TiO2) is one of the most widely used oxide semiconductor materials as a result of its unique properties including satisfying chemical and biological stability, strong oxidizing capability, chemical inertness, low toxicity, low cost, and earth abundance [23–26]. Providing undoubted advantages, TiO2 has been employed in many applications including photocatalytic reactions, solar cells, decompositions of hazardous substances, supercapacitors, lithium-ion batteries, and gas sensors [22,27–34]. Over the past decade, TiO2 systems have been fabricated in the form of micro/nanoparticles, nanorods, nanobelts, nanotubes, nanoplates, and hierarchical morphologies [35–43]. Among these morphologies, three-dimensional (3D) hierarchical nano/microstructures represent significant advantages over 2D or 1D systems in terms of extraordinary shape with large surface area, high adsorption of the analyte, high chemical functionality with abundant active sites, and enhanced light scattering within the structure [35,43,44]. Various fabrication strategies such as hydrothermal methods, sol–gel and chemical vapor deposition have been employed in the preparation of TiO2-based 3D hierarchical structures [27,35,43,45–47]. Compared with other approaches, hydrothermal synthesis offers valuable benefits including simplicity, low-cost, good control over the particle size, and distribution to fabricate highly ordered single-crystalline TiO2 [35,43,47]. However, despite its all advantages, the employment of TiO2 is dramatically limited due to the fast recombination of the electron-hole pairs and its large band gap (for anatase phase band gap is around 3.2 eV). This issue dictates the usage of the only ultraviolet (UV) portion solar spectrum [23]. To overcome this limitation many approaches such as coupling organic dyes, doping with non-metallic materials, and combining with metal nanostructures have been proposed [31,48–52]. Of these approaches, the combination with plasmonic metals significantly could improve the nature of TiO2 due to the extraordinary electronic and optical properties of metal nanostructures [47,53]. Metallic nanostructure with flexible localized SPRs may offer some benefits in various practical applications such as SERS and photocatalysts. Despite some reports on the fabrication of plasmonic metal decorated TiO2-based 3D hierarchical structures, the fabrication of these systems via a well-defined, flexible, low-cost, and high-throughput method is highly demanded in practical applications. In this study, we propose silver nanostructure decorated TiO2-based 3D hierarchical structures as a robust, low-cost, and dependable SERS platform and photocatalyst to overcome some limitations related to these applications. For this, firstly, TiO2 nanoflowers (TNFs) were fabricated through a well-defined hydrothermal synthesis. Afterward, a conformal thin polymeric film of 3,4-dihydroxyphenyl-L-alanine (PLDOPA) via oxidative polymerization was deposited onto the TNFs. Having abundant functional surface groups including catechol and amine PLDOPA is easily deposited on various materials and reduce various metal ions and stabilize the resultant metal nanostructures [18,21,22,54–56]. The metal nanostructure decoration was created through the addition of Ag ions into the PLDOPA-coated TNFs (TNF@PLDOPA). The change in the silver ions supply enabled the control of the nanoparticles' size and their interparticle distances. The decoration of Ag nanoparticles onto the TNF@PLDOPA (TNF@PLDOPA@Ag) remarkably enhanced SERS and photocatalytic activities. 2 Experimental section 2.1 Materials Titanium (IV)-butoxide (TBT), acetic acid (HAc), ethanol, 3,4-Dihydroxy-L-phenylalanine (L-DOPA), Tris-Buffer, silver nitrate, malachite green (MG), methylene blue (MB) and 5,5′-dithiobis-(2-nitrobenzoic acid) (DTNB) were obtained from Sigma-Aldrich. All chemicals were in ACS grade purity and used as received. Deionized (DI) water (conductivity:0.05 μS/cm) was used in all experimental procedures. 2.2 Preparation of TNFs, TNF@PLDOPA, and TNF@PLDOPA@Ag nanosystems Firstly, we fabricated TNFs through the solvothermal method similar to a previous report [43]. Briefly, 1 mL of TBT was added to a proper amount of (30 mL) HAc and mixed under a magnetic stirring (300 rpm) for 10 min. Then, the mixture of TBT and HAc was then transferred into a Teflon-lined stainless steel reactor (50 mL) and kept at 140 °C for 12 h. The powder sample was collected through a centrifuge (4000 rpm for 20 min) and washed with ethyl alcohol and DI water several times. The collected powder was dried at 70 °C overnight. In the final step, the collected powder was annealed at 700 °C for 1 h in a furnace to produce the TNFs. TNF@PLDOPA nanosystem was synthesized by mixing 12 mg of TNFs and 12 mg of L-DOPA in 6 mL of 10 mM Tris-Buffer solution at pH 8.5. The suspension was magnetically stirred for 3 h at 300 rpm. The oxidative polymerization of L-DOPA resulted in the change of color of the suspension from milky white to dark grey. The PLDOPA deposition film was terminated via centrifugation (4000 rpm for 15 min). The collected TNF@PLDOPA nanosystem was redistributed in DI water stored at ambient conditions until further usage. For the decoration of the Ag nanostructures, TNF@PLDOPA NPs were combined with Ag ions. Herein, PLDOPA film plays a crucial role in both reduction of Ag ions and the adsorption of the Ag nanoparticles onto the TNF@PLDOPA. PLDOPA having a vast number of amine and catechol functional groups can reduce plasmonic metal ions as well as deposit resultant nanoparticles with high efficiency [22,55,57,58]. For this, 2 mL of as-prepared TNF@PLDOPA NP suspension (0.2 mg·mL−1) was combined with the desired amount of a 10 mM silver nitrate solution. To manipulate the size and number density of the decorated Ag nanoparticles, the volume of silver nitrate solution was selected as 0.08, 0.16, and 0.8 mL, and silver nanostructure decorated NP systems were denoted as TNF@PLDOPA@Ag-1, TNF@PLDOPA@Ag-2, and TNF@PLDOPA@Ag-3, respectively. After 60 min of decoration time, the TNF@PLDOPA@Ag nanosystem was obtained through centrifugation (4000 rpm for 15 min). The final material was redispersed in DI water and the suspension was kept at ambient conditions in the dark until the next step. 2.3 Characterization of nanosystems The optical characteristics of fabricated nanosystems were investigated through a Shimadzu UV-1800 (Japan) ultraviolet-visible (UV–vis) spectrophotometry. Analyses of the size and morphology of NPs were performed via a Zeiss Sigma 300 (Germany) scanning electron microscope (SEM) and a Hitachi HighTech HT7700 (Japan) transmission electron microscope (TEM). A Rigaku Ultima-IV x-ray diffractometer (XRD) was used to determine the crystal structures of each nanosystem. The elemental contents of nanostructures were measured through a Zeiss Evo 50 (USA) energy-dispersive x-ray (EDX) analysis instrument. The average particle size of Ag nanostructures and PLDOPA layer thickness on TNFs were evaluated by analyzing at least 100 measurements via ImageJ software. 2.4 SERS activity tests To determine the SERS activities, we employed DTNB as a Raman reporter molecule. DTNB could easily create a metal-thiol bond onto the silver nanostructures. For this, a proper amount of TNF@PLDOPA@Ag NP suspension (2 mg/mL, 1 mL) was mixed with DTNB in ethanol (1 mL) at different concentrations (10−5–10−11 M). The suspension was kept overnight under mild magnetic stirring at ambient conditions. The suspension was centrifuged at 4000 rpm for 15 min to discard the unbound DTNB molecules and the DTNB-functionalized TNF@PLDOPA@Ag NPs were resuspended in DI water. For SERS measurement a droplet of each sample was dropped on the Al foil and then allowed to dry in a hood. The SERS performance of each sample was determined by employing a Micro Raman Microscope (WITech alpha 300R) system. Raman measurements were collected in the following experimental parameters: laser wavelength:785 nm, spectral range:200–2000 cm−1, laser power:10 mW, acquisition time:10 s, spot size:1.7 μm, and ×50 objective. To demonstrate the reproducibility of the proposed nanosystem, 10 spectra were obtained from different spots of the sample. Also, for the quantification of the SERS activities, enhancement factor (EF) analysis is performed similarly to our earlier reports. Lastly, we performed some theoretical models by employing the commercial COMSOL software to unravel the origin of SERS activity. These models represent valuable insights by providing the distribution of electric field and relevant hot spots which contribute to the SERS activity. The COMSOL model shows the distribution of the electric field and relevant hot spots which contribute to the enhancement of SERS activity. In this model, we created a 2D model of the TNF@PLDOPA@Ag nanosystem in different sizes of silver nanostructures with various interparticle distances. 2.5 Catalytic activity tests Catalytic activities of TNF, TNF@PLDOPA, and TNF@PLDOPA@Ag nanostructures were performed by examining the photocatalytic degradation of malachite green (MG) under daylight. Briefly, 1.5 mL of NP suspension (0.2 mg/mL) was combined with a desired amount of MG stock solution to obtain a 10−5 M final concentration. The mixture was kept in the dark for 10 min for the adsorption equilibrium. The degradation of MG was measured by analyzing UV–vis spectra of the suspension at specified intervals. We employed the pseudo-first-order reaction model to evaluate the photodegradation nature of MG and determine the reaction rate constants. 3 Results and discussion 3.1 Characterization of nanosystems Firstly, we examined the morphology of TNF and TNF@PLDOPA nanosystems via detailed TEM and SEM images. Some representative TEM and SEM images at different magnifications were shown in Fig. 1 . For the case of TNFs, ImageJ analysis showed that the diameter of NFs ranged from 0.8 to 1.7 μm and the average size was found to be 1.4 μm (Fig. 1a and c). Also, we noticed abundantly sea urchin-like nanospikes in the TNFs in 3D interconnected porous structure which increase their surface area and may provide crucial contributions in SERS and photocatalytic activities. The oxidative polymerization of L-DOPA changed the color of the suspension from milky white to dark grey (insets in Fig. 1). A distinctive and conformal thin layer film of PLDOPA was observed on the TNFs (Fig. 1b and d). The film thickness of the PLDOPA ranged from 2 to 16 nm and the average thickness was calculated to be 7.8 nm (see Fig. S1). However, no remarkable change was observed in the 3D and porous structure of TNF upon uniform PLDOPA deposition. After the decoration of Ag nanoparticles onto the TNF@PLDOPA nanosystems via the reduction of Ag ions, the original 3D morphology and size of the TNFs were preserved substantially. The TEM and SEM images summarized in Fig. 2 demonstrate the final structures of TNF@PLDOPA@Ag nanosystems. Upon deposition of Ag nanoparticles, the color of the nanosuspension instantly turned brownish-yellow or dark brown depending on the number of supplied Ag ions (see insets in Fig. 2). When a low amount of Ag ions was supplied (TNF@PLDOPA@Ag-1), we observed nanostructures with dominantly spherical morphology (Fig. 1a). We detected relatively lower-size Ag nanostructures with very narrow size distribution. Size distribution evaluation for the TNF@PLDOPA@Ag-1 NP system revealed that Ag nanostructures were in the range of 5 to 35 nm and the average size was found to be 17 nm (Fig. S2a). It was noticed that for this case Ag nanoparticles are well-separated and the average distance between adjacent nanoparticles was much more than their diameter. As the number of added Ag ions increased, the number density and size of nanoparticles increased as well. The further increase in the deposited Ag (TNF@PLDOPA@Ag-2) resulted in higher nanostructure size and lower interparticle distance (Fig. 2b). The size of the Ag nanoparticles was in the range of 5–55 nm and their average size was 24 nm (Fig. S2b). The further deposition of silver ions (TNF@PLDOPA@Ag-3, Fig. 2c) led to the emergence larger size of nanosystems. The size of the Ag nanosystems ranged from 5 to 65 nm and their average size was found to be 30 nm (Fig. S2c). Also, we performed some measurements to determine the interparticle distance between the adjacent nanostructures, and the average distance was found to be 20 nm which was lower than the diameter of the silver nanostructures. These densely decorated silver nanostructures with high porosity in 3D TNF structures would provide unique advantages and performances as a robust, flexible, and easy-to-tune SERS substrate and photocatalyst. To evaluate the Ag content in the TNF@PLDOPA@Ag nanosystem, we collected EDX spectra (Fig. S3) and elemental content for each material. As the number of the Ag ions increased, the content of the Ag increased accordingly indicating the higher deposition of Ag as nanostructures. The elemental content of silver was determined to be 1.7, 1.9, and 2.1% for TNF@PLDOPA@Ag-1, TNF@PLDOPA@Ag-2, and TNF@PLDOPA@Ag-3, respectively. Considering TEM and SEM images and the relevant EDX spectra, we can state that the TNF@PLDOPA@Ag NP system in a hierarchical 3D morphology was successfully fabricated via a bioinspired conformal PLDOPA thin layer. Also, the number density and the size of the resultant Ag nanoparticles could be tuned by changing the initial Ag ion concentration. It is obvious that PLDOPA thin film, having abundant amine and catechol functional groups, played an essential role in both reduction of Ag ions and the adsorbtion of Ag nanostructures with high efficiency without utilizing any seed system or reducing agent [18,22,54–59]. In addition to EM images, we employed spectroscopic analyses such as UV–vis absorption and XRD (Fig. 3 ) to evaluate further characterization of NP systems. In XRD patterns TNF and TNF@PLDOPA NP systems (Fig. 3a), almost all the prominent diffraction peaks (shown in each spectrum) were assigned to the TiO2 anatase phase (JCPDS 44–1294) indicating the sufficient transformation of phase after annealing procedure [60]. The major peaks with high intensity at 25.5o, 37.9 o, 47.9 o, 53.9 o, 55.3 o, and 62.8 o are assigned to (101), (004), (200), (105), (211), and (204) planes for anatase phase of TiO2 and shows the high crystallinity of the samples [61]. We detected very weak peaks assigned to the presence of the trace amount of the rutile phase. Herein, it must be noted that the anatase phase is the most preferred one due to its ease of production and higher photocatalytic activity [47,62]. After the decoration of Ag nanoparticles onto the TNF@PLDOPA nanosystem, peaks associated with two additional peaks were noticed at 27.9° and 32.1° which are assigned to (110) and (111) planes of Ag2O (JCPDS 76–1393). As the content of the Ag ions was increased, the relative peak intensity of Ag to TiO2 increased, showing the higher deposition of Ag nanostructures. Herein, it must be noted that the XRD peaks associated with elemental Ag were covered by TiO2-originated peaks. From UV–vis absorption spectra (Fig. 3b), no optical absorption was observed for TNF and TNF@PLDOPA NP systems in the visible region. However, a strong absorption maximum was detected UV region at 345 and 325 nm for TNF and TNF@PLDOPA, respectively. It seems that the deposition of PLDOPA thin film led to a slight blue shift [22,55,57,58]. However, for the cases of TNF@PLDOPA@Ag nanosystems, a distinctive absorption maximum was noticed in the visible range due to the presence of the silver nanostructures. Silver nanostructures could create a high SPR activity and resultant absorption maxima [63–65]. The absorption maxima were found to be at 442, 440, and 452 nm for TNF@PLDOPA@Ag-1, TNF@PLDOPA@Ag-2, and TNF@PLDOPA@Ag-3, respectively. The detected weak blue shift and then strong red shift in the spectrum maxima can be attributed to various parameters including particle size, distribution, and number density of Ag nanostructures. This result is highly compatible with earlier findings and supports the TEM images, EDX data, and XRD spectra. Through the detailed NP characterization data, we could fabricate TNF@PLDOPA@Ag NP systems in desired 3D hierarchical morphology in a well-controlled manner by manipulating the synthesis parameters. In the following sections, this low-cost, easy-to-tune, flexible, and robust nanosystems would be utilized as a SERS substrate and photocatalytic system. 3.2 SERS activity tests When the plasmonic nanostructured material such as gold or silver have interparticle distances lower than their size, the excitation of SPRs leads to an enhancement in local electric field distribution and robust SERS performance as a result of EM enhancement [15,18,21,22,54]. Also, 3D hierarchical morphology with an increased surface area creates improved interaction of target molecules and Raman active hot spots. In addition, the hybrid system consisting of Ag nanostructures and TiO2 may provide unique characteristics in reflecting and scattering and induce photo-induced charge transfer [66]. Therefore, we propose a TNF@PLDOPA@Ag NP system with 3D hierarchical morphology and well-controlled Ag nanostructures as a competitive SERS substrate for various practical applications. In this context, we functionalized the surface of the silver nanostructures with DTNB molecules via the thiol-metal bond, and for each nanosystem, representative SERS spectra were shown in Fig. 4a. For all nanosystems, distinctive SERS signals of DTNB with a highly acceptable signal-to-noise ratio were obtained and the prominent Raman peaks were highly compatible with similar studies. Some of these peaks were assigned as follows: 1328 cm−1: nitro stretch (NO2) mode, 1564 cm−1: the aromatic ring stretching mode, 1148 cm−1: CH3 rocking, and, 1072 cm−1: CN stretching, and CN bending [53,65]. Despite the lower deposition of silver nanostructures and high interparticle distance (higher than their size), the TNF@PLDOPA@Ag-1 NP system could create significant SERS activity. It seems that the isolated plasmonic metal nanoparticles remarkably enhanced the electric field since they were well-separated onto the 3D hierarchical TNFs. The further increase in added Ag ions led to the higher deposition of Ag nanoparticles and SERS activity (Fig. 4a and b). The higher activity of the TNF@PLDOPA@Ag-3 compared with TNF@PLDOPA@Ag-2 is attributed to the increased size of Ag nanoparticles with lower interparticle distance. It must be noted that for the case of TNF@PLDOPA@Ag-3 interparticle distance was lower than the average size of the silver nanoparticles. Various experimental and theoretical studies depicted that closely arranged plasmonic nanosystems could form intense electric field enhancement and robust SERS activity with an EF of 106 [15,18,20,21]. However, for the well-separated and isolated plasmonic nanosystems, the increase in the electric field is limited with an EF of 103. For further analysis, we created some COMSOL models to evaluate the mechanism of the SERS performance. In this model, we aimed to configure a nanostructured system similar to the TNF@PLDOPA@Ag-3 with Ag nanoparticles with fixed size (30 nm) and different interparticle distances (Fig. 4c). The model demonstrated that for the case of longer interparticle distance, the nanostructures provided lower electric field enhancement similar to isolated nanoparticles. However, as the interparticle distance approaches the lower than the size of the nanostructure, a dramatic increase was detected in the electric field. Also, we observed that the 3D hierarchical morphology of the proposed may provide additional SERS activity due to light-entrapment and tip-focusing effect [15,18,21]. Also, for quantification of SERS activity, we calculated the EF values similar to our earlier studies [6,7,15,18,21,67]. For this, we employed Eq. (1) to obtain EFs by using the dominant peak of DTNB at 1564 cm−1. (1) EF = N bulk / N SERS x I bulk / I SERS In this formula, ISERS and Ibulk stand for the Raman peak intensities of DTNB-functionalized SERS platforms and bulk DTNB, respectively. In addition, NSERS and Nbulk indicate the number of DTNB molecules for the SERS platform and bulk, respectively. The EFs for TNF@PLDOPA@Ag-1, TNF@PLDOPA@Ag-2 and TNF@PLDOPA@Ag-3 were 1.2 × 107, 2.3 × 107 and 4.2 × 107, respectively. These EFs are highly comparable or higher than similar noble metal decorated TiO2 nanocomposites as the SERS system [68–70] (see Table S1). The calculated EFs for the proposed nanosystem prove the high performance of the TNF@PLDOPA@Ag nanosystems as a sensitive, strong, and dependable SERS substrate for practical applications. To determine the sensitivity of TNF@PLDOPA@Ag nanosystems, the SERS spectra in different concentrations (10−5 - 10−11 M) of DTNB fuctionalized-TNF@PLDOPA@Ag-3 were collected. The representative spectra for each concentration and their normalized intensity according to the band at 1328 cm−1 were presented in Fig. 5 . The nanosystem showed a concentration-dependent SERS activity for this concentration range. Even at the lowest concentration (10−11 M), a Raman signal with an acceptable signal-to-noise ratio (∼3) was obtained showing the high sensitivity of the fabricated SERS system. In most cases, the lower reproducibility of the SERS platforms emerges as a major drawback and inhibits their employment in various applications. Therefore, to evaluate the reproducibility tests of the TNF@PLDOPA@Ag, we obtained 20 SERS spectra from the randomly selected spots of the TNF@PLDOPA@Ag-3 sample (Fig. 6 ). The collected spectra showed high reproducibility in terms of the peak position and intensity. The relative standard deviation (RSD) according to the major band at 1328 cm−1 was detected as 0.12 indicating the highly reasonable reproducibility of the TNF@PLDOPA@Ag nanosystem as a dependable SERS platform. 3.3 Catalytic activity tests After identifying their characterization and SERS activities, the photocatalytic performances of 3D hierarchical TNF-based nanosystems were examined via photocatalytic degradation of MG under day-light irradiation. For this, UV–vis absorption spectra were collected to monitor the degradation at stated time intervals. The UV–vis spectra obtained at different time intervals and the kinetic trace of concentration for each nanocomposite system were provided in Fig. 7 . For the cases of TNF and, TNF@PLDOPA, we detected significantly lower photocatalytic activity (Fig. 7a and b). Within 3 h of daylight exposure, degradation ratios were calculated to be 27% and 61% for TNF and, TNF@PLDOPA NP systems, respectively (see Fig. S4). The increase in photocatalytic performance is attributed to the conformal thin layer deposition of PLDOPA and its light absorption in the wide range of the solar spectrum [59]. The employment of the TNF@PLDOPA@Ag nanosystems significantly enhanced the photocatalytic activity. After only 1.5 h of irradiation, 69%, 87%, and 89% of MG were degraded (see Fig. S4) in the presence of TNF@PLDOPA@Ag-1, TNF@PLDOPA@Ag-2, and TNF@PLDOPA@Ag-3 as the photocatalyst, respectively (Fig. 7c-e). It seems that the decoration of Ag nanoparticles on the PLDOPA-deposited hierarchical TNF nanosystem provided a proper design in terms of 3D morphology, porosity as well as composition. Also as the content of the Ag nanoparticles increased, the photocatalytic activity was increased accordingly indicating the important role of the plasmonic metal in the degradation of the MG [22,71]. However, when the same experimental procedure was performed in the dark, only about a 10% decrease was detected in absorption intensity for a 6 h of application due to the lower adsorption effect (Fig. S5). For the quantification, we performed some analyses to evaluate the MG degradation kinetic data using a pseudo-first-order model according to the formula given below: (2) ln C t / C 0 = kt Herein, C0, Ct, and k show the initial and time-dependent concentration of MG, and the rate constant for the first-order model, respectively. By utilizing Eq. (2), the values of k were calculated from the slope of ln(Ct/C0) vs. time (Fig. 7f). The rate constants were determined as 0.31, 0.47, 0.49, 1.40, and 1.47 h−1 for TNF, TNF@PLDOPA, TNF@PLDOPA@Ag-1, TNF@PLDOPA@Ag-2, and TNF@PLDOPA@Ag-3, respectively. These values are remarkably higher than the similar composite of TiO2/noble metal nanosystems (see Table S2). Upon irradiation of daylight, the photoinduced electrons are transferred from the conduction band (CB) of TiO2 to the Ag nanoparticles due to the lower Fermi level of Ag, promoting electron/hole pairs (see Fig. 7g) [72–74]. This phenomenon results in the creation of more electron-hole pairs and the production of radicals such as superoxide and hydroxide. These as-prepared radicals are active and strong oxidizers and can degrade molecules such as MG. 4 Conclusions In summary, we fabricated a flexible, low-cost, and easy-to-tune strategy to fabricate a silver nanostructure decorated hierarchical 3D TiO2 nanoflower system via the hydrothermal method and the following PLDOPA conformal film deposition via oxidative polymerization of L-DOPA. PLDOPA performed an essential role in both reduction of Ag ions as well as the adsorption of the resultant Ag nanoparticles. The size, number density, and interparticle distance of Ag nanoparticles were tuned in a well-defined manner by changing the number of Ag ions. The size and interparticle distance of the plasmonic metal have a dominant effect on SERS activities. For the optimized TNF@PLDOPA@Ag, a significantly high SERS activity by using DTNB as a Raman reporter molecule was detected with an EF of 4.2 × 107 and robust reproducibility with an RSD value of 0.12. Similar to SERS, photocatalytic tests indicated the prominent effect of the size and number density of the Ag nanoparticles in the activity of the proposed system. TNF@PLDOPA@Ag system enabled the catalytic degradation of malachite green under visible light irradiation with an apparent rate constant of 1.47 h−1. We envision that robust, dependable, flexible, and low-cost TNF@PLDOPA@Ag nanocomposite could be utilized in many diverse applications including biosensors, antibacterial systems, and self-cleaning materials. Notes The authors declare no competing financial interest. CRediT authorship contribution statement Nuray Serginay: Methodology, Validation, Investigation, Data curation, Writing – review & editing, Visualization. Hayrunnisa Mazlumoglu: Methodology, Writing – review & editing, Project administration, Funding acquisition. Asli Yilmaz: Methodology, Investigation, Data curation, Project administration, Funding acquisition. Mehmet Yilmaz: Conceptualization, Methodology, Validation, Investigation, Resources, Data curation, Visualization, Supervision, Project administration, Funding acquisition, Formal analysis, Software, Writing - original draft, Writing - review & editing. Declaration of Competing Interest The authors declare that they have no known competing financial interests or personal relationships that could have appeared to influence the work reported in this paper. Acknowledgments This work was supported by Ataturk University Scientific Research Project Coordination Unit (AU-BAP, No: FAB-2021-9405). The authors also kindly acknowledge the East Anatolia High Technology Application and Research Center (DAYTAM) at Ataturk University for providing laboratory spaces and characterization devices. Appendix A Supplementary data Supplementary material Image 1 Appendix A Supplementary data Supplementary data to this article can be found online at https://doi.org/10.1016/j.catcom.2023.106672. References [1] M. Fleischmann P.J. Hendra A.J. McQuillan Raman spectra of pyridine adsorbed at a silver electrode Chem. Phys. Lett. 26 1974 163 166 10.1016/0009-2614(74)85388-1 M. Fleischmann, P.J. Hendra, A.J. McQuillan, Raman spectra of pyridine adsorbed at a silver electrode, Chem. Phys. Lett. 26 (1974) 163–166. doi:10.1016/0009-2614(74)85388-1. [2] J.R. Lombardi R.L. Birke A unified view of surface-enhanced raman scattering Acc. Chem. Res. 42 2009 734 742 10.1021/ar800249y J.R. Lombardi, R.L. Birke, A unified view of surface-enhanced raman scattering, Acc. Chem. Res. 42 (2009) 734–742. doi:10.1021/ar800249y. [3] G. Demirel H. Usta M. Yilmaz M. Celik H.A. Alidagi F. Buyukserin Surface-enhanced Raman spectroscopy (SERS): An adventure from plasmonic metals to organic semiconductors as SERS platforms J. Mater. Chem. C 6 2018 5314 5335 10.1039/c8tc01168k G. Demirel, H. Usta, M. Yilmaz, M. Celik, H.A. Alidagi, F. Buyukserin, Surface-enhanced Raman spectroscopy (SERS): An adventure from plasmonic metals to organic semiconductors as SERS platforms, J. Mater. Chem. C. 6 (2018) 5314–5335. doi:10.1039/c8tc01168k. [4] S.Y. Ding E.M. You Z.Q. Tian M. Moskovits Electromagnetic theories of surface-enhanced Raman spectroscopy Chem. Soc. Rev. 46 2017 4042 4076 10.1039/c7cs00238f S.Y. Ding, E.M. You, Z.Q. Tian, M. Moskovits, Electromagnetic theories of surface-enhanced Raman spectroscopy, Chem. Soc. Rev. 46 (2017) 4042–4076. doi:10.1039/c7cs00238f. [5] X.X. Han W. Ji B. Zhao Y. Ozaki Semiconductor-enhanced Raman scattering: active nanomaterials and applications Nanoscale. 9 2017 4847 4861 10.1039/c6nr08693d X.X. Han, W. Ji, B. Zhao, Y. Ozaki, Semiconductor-enhanced Raman scattering: Active nanomaterials and applications, Nanoscale. 9 (2017) 4847–4861. doi:10.1039/c6nr08693d. [6] M. Yilmaz M. Ozdemir H. Erdogan U. Tamer U. Sen A. Facchetti H. Usta G. Demirel Micro-/nanostructured highly crystalline organic semiconductor films for surface-enhanced Raman spectroscopy applications Adv. Funct. Mater. 25 2015 5669 5676 10.1002/adfm.201502151 M. Yilmaz, M. Ozdemir, H. Erdogan, U. Tamer, U. Sen, A. Facchetti, H. Usta, G. Demirel, Micro-/Nanostructured Highly Crystalline Organic Semiconductor Films for Surface-Enhanced Raman Spectroscopy Applications, Adv. Funct. Mater. 25 (2015) 5669–5676. doi:10.1002/adfm.201502151. [7] M. Yilmaz E. Babur M. Ozdemir R.L. Gieseking Y. Dede U. Tamer G.C. Schatz A. Facchetti H. Usta G. Demirel Nanostructured organic semiconductor films for molecular detection with surface-enhanced Raman spectroscopy Nat. Mater. 16 2017 918 924 10.1038/nmat4957 M. Yilmaz, E. Babur, M. Ozdemir, R.L. Gieseking, Y. Dede, U. Tamer, G.C. Schatz, A. Facchetti, H. Usta, G. Demirel, Nanostructured organic semiconductor films for molecular detection with surface-enhanced Raman spectroscopy, Nat. Mater. 16 (2017) 918–924. doi:10.1038/nmat4957. [8] X. Wang W. Shi S. Wang H. Zhao J. Lin Z. Yang M. Chen L. Guo Two-dimensional amorphous TiO2 nanosheets enabling high-efficiency photoinduced charge transfer for excellent SERS activity J. Am. Chem. Soc. 141 2019 5856 5862 10.1021/jacs.9b00029 X. Wang, W. Shi, S. Wang, H. Zhao, J. Lin, Z. Yang, M. Chen, L. Guo, Two-Dimensional Amorphous TiO2 Nanosheets Enabling High-Efficiency Photoinduced Charge Transfer for Excellent SERS Activity, J. Am. Chem. Soc. 141 (2019) 5856–5862. doi:10.1021/jacs.9b00029. [9] Y. Wang C. Yan L. Chen Y. Zhang J. Yang Controllable charge transfer in Ag-TiO2 composite structure for SERS application Nanomaterials. 7 2017 10.3390/nano7070159 Y. Wang, C. Yan, L. Chen, Y. Zhang, J. Yang, Controllable charge transfer in Ag-TiO2 composite structure for SERS application, Nanomaterials. 7 (2017). doi:10.3390/nano7070159. [10] L. Yang M. Gong X. Jiang D. Yin X. Qin B. Zhao W. Ruan Investigation on SERS of different phase structure TiO2 nanoparticles J. Raman Spectrosc. 46 2015 287 292 10.1002/jrs.4645 L. Yang, M. Gong, X. Jiang, D. Yin, X. Qin, B. Zhao, W. Ruan, Investigation on SERS of different phase structure TiO2 nanoparticles, J. Raman Spectrosc. 46 (2015) 287–292. doi:10.1002/jrs.4645. [11] J.F. Li Y.F. Huang Y. Ding Z.L. Yang S.B. Li X.S. Zhou F.R. Fan W. Zhang Z.Y. Zhou D.Y. Wu B. Ren Z.L. Wang Z.Q. Tian Shell-isolated nanoparticle-enhanced Raman spectroscopy Nature. 464 2010 392 395 10.1038/nature08907 J.F. Li, Y.F. Huang, Y. Ding, Z.L. Yang, S.B. Li, X.S. Zhou, F.R. Fan, W. Zhang, Z.Y. Zhou, D.Y. Wu, B. Ren, Z.L. Wang, Z.Q. Tian, Shell-isolated nanoparticle-enhanced Raman spectroscopy, Nature. 464 (2010) 392–395. doi:10.1038/nature08907. [12] M.P. Cecchini V.A. Turek J. Paget A.A. Kornyshev J.B. Edel Self-assembled nanoparticle arrays for multiphase trace analyte detection Nat. Mater. 12 2013 165 171 10.1038/nmat3488 M.P. Cecchini, V.A. Turek, J. Paget, A.A. Kornyshev, J.B. Edel, Self-assembled nanoparticle arrays for multiphase trace analyte detection, Nat. Mater. 12 (2013) 165–171. doi:10.1038/nmat3488. [13] N. Félidj J. Aubard G. Lévi J.R. Krenn A. Hohenau G. Schider A. Leitner F.R. Aussenegg Optimized surface-enhanced Raman scattering on gold nanoparticle arrays Appl. Phys. Lett. 82 2003 3095 3097 10.1063/1.1571979 N. Félidj, J. Aubard, G. Lévi, J.R. Krenn, A. Hohenau, G. Schider, A. Leitner, F.R. Aussenegg, Optimized surface-enhanced Raman scattering on gold nanoparticle arrays, Appl. Phys. Lett. 82 (2003) 3095–3097. doi:10.1063/1.1571979. [14] C.L. Haynes R.P. Van Duyne Nanosphere lithography: a versatile nanofabrication tool for studies of size-dependent nanoparticle optics J. Phys. Chem. B 105 2001 5599 5611 10.1021/jp010657m C.L. Haynes, R.P. Van Duyne, Nanosphere lithography: A versatile nanofabrication tool for studies of size-dependent nanoparticle optics, J. Phys. Chem. B. 105 (2001) 5599–5611. doi:10.1021/jp010657m. [15] M. Yilmaz E. Senlik E. Biskin M.S. Yavuz U. Tamer G. Demirel Combining 3-D plasmonic gold nanorod arrays with colloidal nanoparticles as a versatile concept for reliable, sensitive, and selective molecular detection by SERS Phys. Chem. Chem. Phys. 16 2014 5563 5570 10.1039/c3cp55087g M. Yilmaz, E. Senlik, E. Biskin, M.S. Yavuz, U. Tamer, G. Demirel, Combining 3-D plasmonic gold nanorod arrays with colloidal nanoparticles as a versatile concept for reliable, sensitive, and selective molecular detection by SERS, Phys. Chem. Chem. Phys. 16 (2014) 5563–5570. doi:10.1039/c3cp55087g. [16] W. Wei K. Chen G. Ge Strongly coupled nanorod vertical arrays for plasmonic sensing Adv. Mater. 25 2013 3863 3868 10.1002/adma.201301181 W. Wei, K. Chen, G. Ge, Strongly coupled nanorod vertical arrays for plasmonic sensing, Adv. Mater. 25 (2013) 3863–3868. doi:10.1002/adma.201301181. [17] M.D. Doherty A. Murphy J. McPhillips R.J. Pollard P. Dawson Wavelength dependence of raman enhancement from gold nanorod arrays: quantitative experiment and modeling of a hot spot dominated system J. Phys. Chem. C 114 2010 19913 19919 10.1021/jp107063x M.D. Doherty, A. Murphy, J. McPhillips, R.J. Pollard, P. Dawson, Wavelength dependence of raman enhancement from gold nanorod arrays: Quantitative experiment and modeling of a hot spot dominated system, J. Phys. Chem. C. 114 (2010) 19913–19919. doi:10.1021/jp107063x. [18] M.S. Akin M. Yilmaz E. Babur B. Ozdemir H. Erdogan U. Tamer G. Demirel Large area uniform deposition of silver nanoparticles through bio-inspired polydopamine coating on silicon nanowire arrays for practical SERS applications J. Mater. Chem. B 2 2014 4894 4900 10.1039/c4tb00616j M.S. Akin, M. Yilmaz, E. Babur, B. Ozdemir, H. Erdogan, U. Tamer, G. Demirel, Large area uniform deposition of silver nanoparticles through bio-inspired polydopamine coating on silicon nanowire arrays for practical SERS applications, J. Mater. Chem. B. 2 (2014) 4894–4900. doi:10.1039/c4tb00616j. [19] B. Zhang H. Wang L. Lu K. Ai G. Zhang X. Cheng Large-area silver-coated silicon nanowire arrays for molecular sensing using surface-enhanced raman spectroscopy Adv. Funct. Mater. 18 2008 2348 2355 10.1002/adfm.200800153 B. Zhang, H. Wang, L. Lu, K. Ai, G. Zhang, X. Cheng, Large-area silver-coated silicon nanowire arrays for molecular sensing using surface-enhanced raman spectroscopy, Adv. Funct. Mater. 18 (2008) 2348–2355. doi:10.1002/adfm.200800153. [20] F.J. García-Vidal J.B. Pendry Collective theory for surface enhanced raman scattering Phys. Rev. Lett. 77 1996 1163 1166 10.1103/PhysRevLett.77.1163 F.J. García-Vidal, J.B. Pendry, Collective theory for surface enhanced raman scattering, Phys. Rev. Lett. 77 (1996) 1163–1166. doi:10.1103/PhysRevLett.77.1163. [21] M. Yilmaz Silver-nanoparticle-decorated gold nanorod arrays via bioinspired polydopamine coating as surface-enhanced Raman spectroscopy (SERS) platforms Coatings. 9 2019 10.3390/COATINGS9030198 M. Yilmaz, Silver-nanoparticle-decorated gold nanorod arrays via bioinspired polydopamine coating as surface-enhanced Raman spectroscopy (SERS) platforms, Coatings. 9 (2019). doi:10.3390/COATINGS9030198. [22] H. Mazlumoglu M. Yilmaz Silver nanoparticle-decorated titanium dioxide nanowire systemsviabioinspired poly(l-DOPA) thin film as a surface-enhanced Raman spectroscopy (SERS) platform, and photocatalyst Phys. Chem. Chem. Phys. 23 2021 13396 13404 10.1039/d1cp01322j H. Mazlumoglu, M. Yilmaz, Silver nanoparticle-decorated titanium dioxide nanowire systemsviabioinspired poly(l-DOPA) thin film as a surface-enhanced Raman spectroscopy (SERS) platform, and photocatalyst, Phys. Chem. Chem. Phys. 23 (2021) 13396–13404. doi:10.1039/d1cp01322j. [23] L. Jiang S. Zhou J. Yang H. Wang H. Yu H. Chen Y. Zhao X. Yuan W. Chu H. Li Near-infrared light responsive TiO2 for efficient solar energy utilization Adv. Funct. Mater. 32 2022 10.1002/adfm.202108977 L. Jiang, S. Zhou, J. Yang, H. Wang, H. Yu, H. Chen, Y. Zhao, X. Yuan, W. Chu, H. Li, Near-Infrared Light Responsive TiO2 for Efficient Solar Energy Utilization, Adv. Funct. Mater. 32 (2022). doi:10.1002/adfm.202108977. [24] T.S. Rajaraman S.P. Parikh V.G. Gandhi Black TiO2: a review of its properties and conflicting trends Chem. Eng. J. 389 2020 10.1016/j.cej.2019.123918 T.S. Rajaraman, S.P. Parikh, V.G. Gandhi, Black TiO2: A review of its properties and conflicting trends, Chem. Eng. J. 389 (2020). doi:10.1016/j.cej.2019.123918. [25] C. Luo X. Ren Z. Dai Y. Zhang X. Qi C. Pan Present perspectives of advanced characterization techniques in TiO2-based Photocatalysts ACS Appl. Mater. Interfaces 9 2017 23265 23286 10.1021/acsami.7b00496 C. Luo, X. Ren, Z. Dai, Y. Zhang, X. Qi, C. Pan, Present Perspectives of Advanced Characterization Techniques in TiO2-Based Photocatalysts, ACS Appl. Mater. Interfaces. 9 (2017) 23265–23286. doi:10.1021/acsami.7b00496. [26] Q. Guo C. Zhou Z. Ma X. Yang Fundamentals of TiO2 Photocatalysis: concepts, mechanisms, and challenges Adv. Mater. 31 2019 10.1002/adma.201901997 Q. Guo, C. Zhou, Z. Ma, X. Yang, Fundamentals of TiO2 Photocatalysis: Concepts, Mechanisms, and Challenges, Adv. Mater. 31 (2019). doi:10.1002/adma.201901997. [27] S.B. Wategaonkar R.P. Pawar V.G. Parale K.S. Pakhare B.M. Sargar R.K. Mane Synthesis and characterizations of 3D TiO2 Nanoflowers thin film: hydrothermal method Macromol. Symp. 393 2020 10.1002/masy.202000040 S.B. Wategaonkar, R.P. Pawar, V.G. Parale, K.S. Pakhare, B.M. Sargar, R.K. Mane, Synthesis and Characterizations of 3D TiO2 Nanoflowers Thin Film: Hydrothermal Method, Macromol. Symp. 393 (2020). doi:10.1002/masy.202000040. [28] Y.Y. Liu K.B. Chen H. Chen Y.H. Wu X.Y. Ye X. Bi B.X. Lei W. Sun Z.F. Sun One-step hydrothermal fabrication of three dimensional anatase hierarchical hyacinth-like TiO2 arrays for dye-sensitized solar cells Thin Solid Films 683 2019 42 48 10.1016/j.tsf.2019.05.030 Y.Y. Liu, K.B. Chen, H. Chen, Y.H. Wu, X.Y. Ye, X. Bi, B.X. Lei, W. Sun, Z.F. Sun, One-step hydrothermal fabrication of three dimensional anatase hierarchical hyacinth-like TiO2 arrays for dye-sensitized solar cells, Thin Solid Films. 683 (2019) 42–48. doi:10.1016/j.tsf.2019.05.030. [29] S.S. Mali H. Kim C.S. Shim P.S. Patil J.H. Kim C.K. Hong Surfactant free most probable TiO2 nanostructures via hydrothermal and its dye sensitized solar cell properties Sci. Rep. 3 2013 10.1038/srep03004 S.S. Mali, H. Kim, C.S. Shim, P.S. Patil, J.H. Kim, C.K. Hong, Surfactant free most probable TiO2 nanostructures via hydrothermal and its dye sensitized solar cell properties, Sci. Rep. 3 (2013). doi:10.1038/srep03004. [30] S. Li H. Jiang K. Yang Z. Zhang S. Li N. Luo Q. Liu R. Wei Three-dimensional hierarchical graphene/TiO2 composite as high-performance electrode for supercapacitor J. Alloys Compd. 746 2018 670 676 10.1016/j.jallcom.2018.02.210 S. Li, H. Jiang, K. Yang, Z. Zhang, S. Li, N. Luo, Q. Liu, R. Wei, Three-dimensional hierarchical graphene/TiO2 composite as high-performance electrode for supercapacitor, J. Alloys Compd. 746 (2018) 670–676. doi:10.1016/j.jallcom.2018.02.210. [31] A. Lamberti C.F. Pirri TiO2 nanotube array as biocompatible electrode in view of implantable supercapacitors J. Energy Storage. 8 2016 193 197 10.1016/j.est.2016.08.007 A. lLamberti, C.F. Pirri, TiO2 nanotube array as biocompatible electrode in view of implantable supercapacitors, J. Energy Storage. 8 (2016) 193–197. doi:10.1016/j.est.2016.08.007. [32] X. Yang H. Fu L. Zhang X. An S. Xiong X. Jiang A. Yu Enhanced gas sensing performance based on the fabrication of polycrystalline ag@TiO2 core-shell nanowires Sensors Actuators B Chem. 286 2019 483 492 10.1016/j.snb.2019.01.096 X. Yang, H. Fu, L. Zhang, X. An, S. Xiong, X. Jiang, A. Yu, Enhanced gas sensing performance based on the fabrication of polycrystalline Ag@TiO2 core-shell nanowires, Sensors Actuators, B Chem. 286 (2019) 483–492. doi:10.1016/j.snb.2019.01.096. [33] V.G. Parale T. Kim K.Y. Lee V.D. Phadtare R.P. Dhavale H.N.R. Jung H.H. Park Hydrophobic TiO2–SiO2 composite aerogels synthesized via in situ epoxy-ring opening polymerization and sol-gel process for enhanced degradation activity Ceram. Int. 46 2020 4939 4946 10.1016/j.ceramint.2019.10.231 V.G. Parale, T. Kim, K.Y. Lee, V.D. Phadtare, R.P. Dhavale, H.N.R. Jung, H.H. Park, Hydrophobic TiO2–SiO2 composite aerogels synthesized via in situ epoxy-ring opening polymerization and sol-gel process for enhanced degradation activity, Ceram. Int. 46 (2020) 4939–4946. doi:10.1016/j.ceramint.2019.10.231. [34] R. Gao Z. Jiao Y. Wang L. Xu S. Xia H. Zhang Eco-friendly synthesis of rutile TiO2 nanostructures with controlled morphology for efficient lithium-ion batteries Chem. Eng. J. 304 2016 156 164 10.1016/j.cej.2016.06.051 R. Gao, Z. Jiao, Y. Wang, L. Xu, S. Xia, H. Zhang, Eco-friendly synthesis of rutile TiO2 nanostructures with controlled morphology for efficient lithium-ion batteries, Chem. Eng. J. 304 (2016) 156–164. doi:10.1016/j.cej.2016.06.051. [35] J. Ni J. Gao X. Geng D. He X. Guo Controllable synthesis of TiO2 nanoflowers and their morphology-dependent photocatalytic activities Appl. Phys. A Mater. Sci. Process. 123 2017 10.1007/s00339-017-0824-6 J. Ni, J. Gao, X. Geng, D. He, X. Guo, Controllable synthesis of TiO2 nanoflowers and their morphology-dependent photocatalytic activities, Appl. Phys. A Mater. Sci. Process. 123 (2017). doi:10.1007/s00339-017-0824-6. [36] H. Yao W. Fu L. Liu X. Li D. Ding P. Su S. Feng H. Yang Hierarchical photoanode of rutile TiO2 nanorods coupled with anatase TiO2 nanosheets array for photoelectrochemical application J. Alloys Compd. 680 2016 206 211 10.1016/j.jallcom.2016.04.133 H. Yao, W. Fu, L. Liu, X. Li, D. Ding, P. Su, S. Feng, H. Yang, Hierarchical photoanode of rutile TiO2 nanorods coupled with anatase TiO2 nanosheets array for photoelectrochemical application, J. Alloys Compd. 680 (2016) 206–211. doi:10.1016/j.jallcom.2016.04.133. [37] B. Babu K. Mallikarjuna C.V. Reddy J. Park Facile synthesis of cu@TiO2 core shell nanowires for efficient photocatalysis Mater. Lett. 176 2016 265 269 10.1016/j.matlet.2016.04.146 B. Babu, K. Mallikarjuna, C.V. Reddy, J. Park, Facile synthesis of Cu@TiO2 core shell nanowires for efficient photocatalysis, Mater. Lett. 176 (2016) 265–269. doi:10.1016/j.matlet.2016.04.146. [38] J. Su L. Zhu P. Geng G. Chen Self-assembly graphitic carbon nitride quantum dots anchored on TiO2 nanotube arrays: An efficient heterojunction for pollutants degradation under solar light J. Hazard. Mater. 316 2016 159 168 10.1016/j.jhazmat.2016.05.004 J. Su, L. Zhu, P. Geng, G. Chen, Self-assembly graphitic carbon nitride quantum dots anchored on TiO2 nanotube arrays: An efficient heterojunction for pollutants degradation under solar light, J. Hazard. Mater. 316 (2016) 159–168. doi:10.1016/j.jhazmat.2016.05.004. [39] D. Praveen Kumar N. Lakshmana Reddy M. Karthikeyan N. Chinnaiah V. Bramhaiah V. Durga Kumari M.V. Shankar Synergistic effect of nanocavities in anatase TiO2 nanobelts for photocatalytic degradation of methyl orange dye in aqueous solution J. Colloid Interface Sci. 477 2016 201 208 10.1016/j.jcis.2016.05.014 D. Praveen Kumar, N. Lakshmana Reddy, M. Karthikeyan, N. Chinnaiah, V. Bramhaiah, V. Durga Kumari, M. V. Shankar, Synergistic effect of nanocavities in anatase TiO2 nanobelts for photocatalytic degradation of methyl orange dye in aqueous solution, J. Colloid Interface Sci. 477 (2016) 201–208. doi:10.1016/j.jcis.2016.05.014. [40] Y. Chen Y. Xu S. Jiao X. Wang L. Li Z. Fang G. Pang S. Feng Synthesis of blue anatase TiO2 nanoplates with {001} facets and in situ noble metal anchoring Dyes Pigments 129 2016 191 198 10.1016/j.dyepig.2016.02.017 Y. Chen, Y. Xu, S. Jiao, X. Wang, L. Li, Z. Fang, G. Pang, S. Feng, Synthesis of blue anatase TiO2 nanoplates with {001} facets and in situ noble metal anchoring, Dye. Pigment. 129 (2016) 191–198. doi:10.1016/j.dyepig.2016.02.017. [41] Z. Sun J.H. Kim Y. Zhao D. Attard S.X. Dou Morphology-controllable 1D-3D nanostructured TiO2 bilayer photoanodes for dye-sensitized solar cells Chem. Commun. 49 2013 966 968 10.1039/c2cc37212f Z. Sun, J.H. Kim, Y. Zhao, D. Attard, S.X. Dou, Morphology-controllable 1D-3D nanostructured TiO2 bilayer photoanodes for dye-sensitized solar cells, Chem. Commun. 49 (2013) 966–968. doi:10.1039/c2cc37212f. [42] Y. Li Z.Y. Fu B.L. Su Hierarchically structured porous materials for energy conversion and storage Adv. Funct. Mater. 22 2012 4634 4667 10.1002/adfm.201200591 Y. Li, Z.Y. Fu, B.L. Su, Hierarchically structured porous materials for energy conversion and storage, Adv. Funct. Mater. 22 (2012) 4634–4667. doi:10.1002/adfm.201200591. [43] G. Lui J.Y. Liao A. Duan Z. Zhang M. Fowler A. Yu Graphene-wrapped hierarchical TiO2 nanoflower composites with enhanced photocatalytic performance J. Mater. Chem. A 1 2013 12255 12262 10.1039/c3ta12329d G. Lui, J.Y. Liao, A. Duan, Z. Zhang, M. Fowler, A. Yu, Graphene-wrapped hierarchical TiO2 nanoflower composites with enhanced photocatalytic performance, J. Mater. Chem. A. 1 (2013) 12255–12262. doi:10.1039/c3ta12329d. [44] J. Zhou G. Tian Y. Chen J.Q. Wang X. Cao Y. Shi K. Pan H. Fu Synthesis of hierarchical TiO2 nanoflower with anatase-rutile heterojunction as Ag support for efficient visible-light photocatalytic activity Dalt. Trans. 42 2013 11242 11251 10.1039/c3dt51293b J. Zhou, G. Tian, Y. Chen, J.Q. Wang, X. Cao, Y. Shi, K. Pan, H. Fu, Synthesis of hierarchical TiO2 nanoflower with anatase-rutile heterojunction as Ag support for efficient visible-light photocatalytic activity, Dalt. Trans. 42 (2013) 11242–11251. doi:10.1039/c3dt51293b. [45] Z. Miao D. Xu J. Ouyang G. Guo X. Zhao Y. Tang Electrochemically induced sol-gel preparation of single-crystalline TiO2 nanowires Nano Lett. 2 2002 717 720 10.1021/nl025541w Z. Miao, D. Xu, J. Ouyang, G. Guo, X. Zhao, Y. Tang, Electrochemically Induced Sol-Gel Preparation of Single-Crystalline TiO2 Nanowires, Nano Lett. 2 (2002) 717–720. doi:10.1021/nl025541w. [46] H. Yoshitake T. Sugihara T. Tatsumi Preparation of wormhole-like mesoporous TiO2 with an extremely large surface area and stabilization of its surface by chemical vapor deposition Chem. Mater. 14 2002 1023 1029 10.1021/cm010539b H. Yoshitake, T. Sugihara, T. Tatsumi, Preparation of wormhole-like mesoporous TiO2 with an extremely large surface area and stabilization of its surface by chemical vapor deposition, Chem. Mater. 14 (2002) 1023–1029. doi:10.1021/cm010539b. [47] J. Zhou G. Tian Y. Chen J.Q. Wang X. Cao Y. Shi K. Pan H. Fu Synthesis of hierarchical TiO2 nanoflower with anatase-rutile heterojunction as Ag support for efficient visible-light photocatalytic activity Dalt. Trans. 42 2013 11242 11251 10.1039/c3dt51293b J. Zhou, G. Tian, Y. Chen, J.Q. Wang, X. Cao, Y. Shi, K. Pan, H. Fu, Synthesis of hierarchical TiO2 nanoflower with anatase-rutile heterojunction as Ag support for efficient visible-light photocatalytic activity, Dalt. Trans. 42 (2013) 11242–11251. doi:10.1039/c3dt51293b. [48] S.U.M. Khan M. Al-Shahry W.B. Ingler Efficient photochemical water splitting by a chemically modified n-TiO2 Science (80-. ) 297 2002 2243 2245 10.1126/science.1075035 S.U.M. Khan, M. Al-Shahry, W.B. Ingler, Efficient photochemical water splitting by a chemically modified n-TiO2, Science (80-. ). 297 (2002) 2243–2245. doi:10.1126/science.1075035. [49] A. Tanaka S. Sakaguchi K. Hashimoto H. Kominami Preparation of Au/TiO2 with metal cocatalysts exhibiting strong surface plasmon resonance effective for photoinduced hydrogen formation under irradiation of visible light ACS Catal. 3 2013 79 85 10.1021/cs3006499 A. Tanaka, S. Sakaguchi, K. Hashimoto, H. Kominami, Preparation of Au/TiO2 with metal cocatalysts exhibiting strong surface plasmon resonance effective for photoinduced hydrogen formation under irradiation of visible light, ACS Catal. 3 (2013) 79–85. doi:10.1021/cs3006499. [50] Y. Tian T. Tatsuma Plasmon-induced photoelectrochemistry at metal nanoparticles supported on nanoporous TiO2 Chem. Commun. 2004 1810 1811 10.1039/b405061d Y. Tian, T. Tatsuma, Plasmon-induced photoelectrochemistry at metal nanoparticles supported on nanoporous TiO2, Chem. Commun. (2004) 1810–1811. doi:10.1039/b405061d. [51] J.B. Varley A. Janotti C.G. Van De Walle Mechanism of visible-light photocatalysis in nitrogen-doped TiO2 Adv. Mater. 23 2011 2343 2347 10.1002/adma.201003603 J.B. Varley, A. Janotti, C.G. Van De Walle, Mechanism of visible-light photocatalysis in nitrogen-doped TiO2, Adv. Mater. 23 (2011) 2343–2347. doi:10.1002/adma.201003603. [52] W.J. Youngblood S.H. Anna Lee K. Maeda T.E. Mallouk Visible light water splitting using dye-sensitized oxide semiconductors Acc. Chem. Res. 42 2009 1966 1973 10.1021/ar9002398 W.J. Youngblood, S.H. Anna Lee, K. Maeda, T.E. Mallouk, Visible light water splitting using dye-sensitized oxide semiconductors, Acc. Chem. Res. 42 (2009) 1966–1973. doi:10.1021/ar9002398. [53] B. Guven N. Basaran-Akgul E. Temur U. Tamer I.H. Boyaci SERS-based sandwich immunoassay using antibody coated magnetic nanoparticles for Escherichia coli enumeration Analyst. 136 2011 740 748 10.1039/c0an00473a B. Guven, N. Basaran-Akgul, E. Temur, U. Tamer, I.H. Boyaci, SERS-based sandwich immunoassay using antibody coated magnetic nanoparticles for Escherichia coli enumeration, Analyst. 136 (2011) 740–748. doi:10.1039/c0an00473a. [54] M. Yilmaz G. Bakirci H. Erdogan U. Tamer G. Demirel The fabrication of plasmonic nanoparticle-containing multilayer films via a bio-inspired polydopamine coating RSC Adv. 6 2016 12638 12641 10.1039/c5ra22416k M. Yilmaz, G. Bakirci, H. Erdogan, U. Tamer, G. Demirel, The fabrication of plasmonic nanoparticle-containing multilayer films via a bio-inspired polydopamine coating, RSC Adv. 6 (2016) 12638–12641. doi:10.1039/c5ra22416k. [55] B. Calis M. Yilmaz Fabrication of gold nanostructure decorated polystyrene hybrid nanosystems via poly(L-DOPA) and their applications in surface-enhanced Raman spectroscopy (SERS), and catalytic activity Colloids Surfaces A Physicochem. Eng. Asp. 622 2021 10.1016/j.colsurfa.2021.126654 B. Calis, M. Yilmaz, Fabrication of gold nanostructure decorated polystyrene hybrid nanosystems via poly(L-DOPA) and their applications in surface-enhanced Raman Spectroscopy (SERS), and catalytic activity, Colloids Surfaces A Physicochem. Eng. Asp. 622 (2021). doi:10.1016/j.colsurfa.2021.126654. [56] M. Yılmaz 3D and plasmonic nanoparticle decorated catalytic system via bio-inspired polydopamine coating: cigar filter case study Hacettepe J. Biol. Chem. 4 2018 515 521 10.15671/hjbc.2018.259 M. Yılmaz, 3D and Plasmonic Nanoparticle Decorated Catalytic System via Bio-inspired Polydopamine Coating: Cigar Filter Case Study, Hacettepe J. Biol. Chem. 4 (2018) 515–521. doi:10.15671/hjbc.2018.259. [57] H. Turan B. Calis A. Dizaji Poly (L-DOPA)-mediated bimetallic core− shell nanostructures of gold and silver and their employment in SERS, catalytic activity, and cell viability 2021 Iopscience.Iop.Org accessed December 17, 2022 https://iopscience.iop.org/article/10.1088/1361-6528/abf9c7/meta H. Turan, B. Calis, A. Dizaji, … S.T.-, U. 2021, Poly (L-DOPA)-mediated bimetallic core− shell nanostructures of gold and silver and their employment in SERS, catalytic activity, and cell viability, Iopscience.Iop.Org. (n.d.). https://iopscience.iop.org/article/10.1088/1361-6528/abf9c7/meta (accessed December 17, 2022). [58] N. Serginay A.N. Dizaji H. Mazlumoglu E. Karatas A. Yilmaz M. Yilmaz Antibacterial activity and cytotoxicity of bioinspired poly(L-DOPA)-mediated silver nanostructure-decorated titanium dioxide nanowires Colloids Surfaces A Physicochem. Eng. Asp. 639 2022 10.1016/j.colsurfa.2022.128350 N. Serginay, A.N. Dizaji, H. Mazlumoglu, E. Karatas, A. Yilmaz, M. Yilmaz, Antibacterial activity and cytotoxicity of bioinspired poly(L-DOPA)-mediated silver nanostructure-decorated titanium dioxide nanowires, Colloids Surfaces A Physicochem. Eng. Asp. 639 (2022). doi:10.1016/j.colsurfa.2022.128350. [59] G. Bakirci M. Yilmaz E. Babur D. Ozden G. Demirel Understanding the effect of polydopamine coating on catalytic reduction reactions Catal. Commun. 91 2017 48 52 10.1016/j.catcom.2016.12.018 G. Bakirci, M. Yilmaz, E. Babur, D. Ozden, G. Demirel, Understanding the effect of polydopamine coating on catalytic reduction reactions, Catal. Commun. 91 (2017) 48–52. doi:10.1016/j.catcom.2016.12.018. [60] Y. Li L. Cai H. Wu Q. Huang Y. Du S. Liu Z. Sheng C. Chen Highly efficient synthesis of environmentally friendly Ag-modified TiO2 nanoflowers to enhance photocatalytic performance J. Wuhan Univ. Technol. Mater. Sci. Ed. 34 2019 1321 1326 10.1007/s11595-019-2195-7 Y. Li, L. Cai, H. Wu, Q. Huang, Y. Du, S. Liu, Z. Sheng, C. Chen, Highly Efficient Synthesis of Environmentally Friendly Ag-modified TiO2 Nanoflowers to Enhance Photocatalytic Performance, J. Wuhan Univ. Technol. Mater. Sci. Ed. 34 (2019) 1321–1326. doi:10.1007/s11595-019-2195-7. [61] Y. Hu J. Fan E. Liu H. Li X. Hu Fabrication and enhanced photoactivities of plasmonic Ag/TiO2 nano-flower films J. Nanosci. Nanotechnol. 17 2017 1156 1162 10.1166/jnn.2017.12675 Y. Hu, J. Fan, E. Liu, H. Li, X. Hu, Fabrication and enhanced photoactivities of plasmonic Ag/TiO2 nano-flower films, J. Nanosci. Nanotechnol. 17 (2017) 1156–1162. doi:10.1166/jnn.2017.12675. [62] D.K. Takci Synthesis, characterization and dielectric properties of rutile TiO2 nanoflowers J. Cryst. Growth 578 2022 10.1016/j.jcrysgro.2021.126442 D.K. Takci, Synthesis, characterization and dielectric properties of rutile TiO2 nanoflowers, J. Cryst. Growth. 578 (2022). doi:10.1016/j.jcrysgro.2021.126442. [63] A. Yilmaz M. Yilmaz Bimetallic core–shell nanoparticles of gold and silver via bioinspired polydopamine layer as surface-enhanced raman spectroscopy (SERS) platform Nanomaterials. 10 2020 10.3390/nano10040688 A. Yilmaz, M. Yilmaz, Bimetallic core–shell nanoparticles of gold and silver via bioinspired polydopamine layer as surface-enhanced raman spectroscopy (SERS) platform, Nanomaterials. 10 (2020). doi:10.3390/nano10040688. [64] A. Yilmaz The employment of a conformal polydopamine thin layer reduces the cytotoxicity silver nanoparticles Turkish J. Zool. 44 2020 126 133 10.3906/zoo-1912-38 A. Yilmaz, The employment of a conformal polydopamine thin layer reduces the cytotoxicity silver nanoparticles, Turkish J. Zool. 44 (2020) 126–133. doi:10.3906/zoo-1912-38. [65] M. Yilmaz A. Yilmaz A. Karaman F. Aysin O. Aksakal Monitoring chemically and green-synthesized silver nanoparticles in maize seedlings via surface-enhanced Raman spectroscopy (SERS) and their phytotoxicity evaluation Talanta. 225 2021 10.1016/j.talanta.2020.121952 M. Yilmaz, A. Yilmaz, A. Karaman, F. Aysin, O. Aksakal, Monitoring chemically and green-synthesized silver nanoparticles in maize seedlings via surface-enhanced Raman spectroscopy (SERS) and their phytotoxicity evaluation, Talanta. 225 (2021). doi:10.1016/j.talanta.2020.121952. [66] Y. Peng C. Lin L. Long T. Masaki M. Tang L. Yang J. Liu Z. Huang Z. Li X. Luo J.R. Lombardi Y. Yang Charge-transfer resonance and electromagnetic enhancement synergistically enabling MXenes with excellent SERS sensitivity for SARS-CoV-2 S protein detection Nano-Micro Lett. 13 2021 10.1007/s40820-020-00565-4 Y. Peng, C. Lin, L. Long, T. Masaki, M. Tang, L. Yang, J. Liu, Z. Huang, Z. Li, X. Luo, J.R. Lombardi, Y. Yang, Charge-Transfer Resonance and Electromagnetic Enhancement Synergistically Enabling MXenes with Excellent SERS Sensitivity for SARS-CoV-2 S Protein Detection, Nano-Micro Lett. 13 (2021). doi:10.1007/s40820-020-00565-4. [67] H. Mazlumoglu M. Yilmaz Silver nanoparticle-decorated titanium dioxide nanowire systemsviabioinspired poly(l-DOPA) thin film as a surface-enhanced Raman spectroscopy (SERS) platform, and photocatalyst Phys. Chem. Chem. Phys. 23 2021 13396 13404 10.1039/d1cp01322j H. Mazlumoglu, M. Yilmaz, Silver nanoparticle-decorated titanium dioxide nanowire systemsviabioinspired poly(l-DOPA) thin film as a surface-enhanced Raman spectroscopy (SERS) platform, and photocatalyst, Phys. Chem. Chem. Phys. 23 (2021) 13396–13404. doi:10.1039/d1cp01322j. [68] Y. Tian H. Liu Y. Chen C. Gu G. Wei T. Jiang Quantitative SERS-based detection and elimination of mixed hazardous additives in food mediated by the intrinsic Raman signal of TiO2and magnetic enrichment ACS Sustain. Chem. Eng. 8 2020 16990 16999 10.1021/acssuschemeng.0c07447 Y. Tian, H. Liu, Y. Chen, C. Gu, G. Wei, T. Jiang, Quantitative SERS-Based Detection and Elimination of Mixed Hazardous Additives in Food Mediated by the Intrinsic Raman Signal of TiO2and Magnetic Enrichment, ACS Sustain. Chem. Eng. 8 (2020) 16990–16999. doi:10.1021/acssuschemeng.0c07447. [69] C.S.H. Hwang S. Lee S. Lee H. Kim T. Kang D. Lee K.H. Jeong Highly adsorptive au-TiO2Nanocomposites for the SERS face mask allow the machine-learning-based quantitative assay of SARS-CoV-2 in artificial breath aerosols ACS Appl. Mater. Interfaces 14 2022 54550 54557 10.1021/acsami.2c16446 C.S.H. Hwang, S. Lee, S. Lee, H. Kim, T. Kang, D. Lee, K.H. Jeong, Highly Adsorptive Au-TiO2Nanocomposites for the SERS Face Mask Allow the Machine-Learning-Based Quantitative Assay of SARS-CoV-2 in Artificial Breath Aerosols, ACS Appl. Mater. Interfaces. 14 (2022) 54550–54557. doi:10.1021/acsami.2c16446. [70] X. Li H. Liu C. Gu J. Zhang T. Jiang PDMS/TiO2/ag hybrid substrate with intrinsic signal and clean surface for recyclable and quantitative SERS sensing Sensors Actuators B Chem. 351 2022 10.1016/j.snb.2021.130886 X. Li, H. Liu, C. Gu, J. Zhang, T. Jiang, PDMS/TiO2/Ag hybrid substrate with intrinsic signal and clean surface for recyclable and quantitative SERS sensing, Sensors Actuators B Chem. 351 (2022). doi:10.1016/j.snb.2021.130886. [71] H. Ma W. Zheng X. Yan S. Li K. Zhang G. Liu L. Jiang Polydopamine-induced fabrication of ag-TiO2 hollow nanospheres and their application in visible-light photocatalysis Colloids Surfaces A Physicochem. Eng. Asp. 586 2020 10.1016/j.colsurfa.2019.124283 H. Ma, W. Zheng, X. Yan, S. Li, K. Zhang, G. Liu, L. Jiang, Polydopamine-induced fabrication of Ag-TiO2 hollow nanospheres and their application in visible-light photocatalysis, Colloids Surfaces A Physicochem. Eng. Asp. 586 (2020). doi:10.1016/j.colsurfa.2019.124283. [72] T. Ali A. Ahmed U. Alam I. Uddin P. Tripathi M. Muneer Enhanced photocatalytic and antibacterial activities of ag-doped TiO2 nanoparticles under visible light Mater. Chem. Phys. 212 2018 325 335 10.1016/j.matchemphys.2018.03.052 T. Ali, A. Ahmed, U. Alam, I. Uddin, P. Tripathi, M. Muneer, Enhanced photocatalytic and antibacterial activities of Ag-doped TiO2 nanoparticles under visible light, Mater. Chem. Phys. 212 (2018) 325–335. doi:10.1016/j.matchemphys.2018.03.052. [73] H. Liang Z. Jia H. Zhang X. Wang J. Wang Photocatalysis oxidation activity regulation of Ag/TiO 2 composites evaluated by the selective oxidation of Rhodamine B Appl. Surf. Sci. 422 2017 1 10 10.1016/j.apsusc.2017.05.211 H. Liang, Z. Jia, H. Zhang, X. Wang, J. Wang, Photocatalysis oxidation activity regulation of Ag/TiO 2 composites evaluated by the selective oxidation of Rhodamine B, Appl. Surf. Sci. 422 (2017) 1–10. doi:10.1016/j.apsusc.2017.05.211. [74] B. Yu Y. Zhou P. Li W. Tu P. Li L. Tang J. Ye Z. Zou Photocatalytic reduction of CO2 over Ag/TiO2 nanocomposites prepared with a simple and rapid silver mirror method Nanoscale. 8 2016 11870 11874 10.1039/c6nr02547a B. Yu, Y. Zhou, P. Li, W. Tu, P. Li, L. Tang, J. Ye, Z. Zou, Photocatalytic reduction of CO2 over Ag/TiO2 nanocomposites prepared with a simple and rapid silver mirror method, Nanoscale. 8 (2016) 11870–11874. doi:10.1039/c6nr02547a.",
      "scopus-id": "85152681890",
      "coredata": {
        "eid": "1-s2.0-S1566736723000742",
        "dc:description": "In this study, we propose the synthesis of silver (Ag) nanoparticle decorated TiO2 nanoflowers (TNFs) using a polymeric conformal thin film of 3,4-dihydroxyphenyl-L-alanine (PLDOPA). The size, as well as interparticle distance of the decorated Ag nanostructures, were tuned by simply changing the number of supplied Ag ions. The resultant nanocomposite system (TNF@PLDOPA@Ag) showed unique SERS activity with high reproducibility and an enhancement factor of 4.2 × 107. Also, as an ideal photocatalytic system, the TNF@PLDOPA@Ag enabled the catalytic degradation of malachite green under visible light irradiation.",
        "openArchiveArticle": "false",
        "prism:coverDate": "2023-05-31",
        "openaccessUserLicense": "http://creativecommons.org/licenses/by-nc-nd/4.0/",
        "prism:aggregationType": "Journal",
        "prism:url": "https://api.elsevier.com/content/article/pii/S1566736723000742",
        "dc:creator": [
          {
            "@_fa": "true",
            "$": "Serginay, Nuray"
          },
          {
            "@_fa": "true",
            "$": "Mazlumoglu, Hayrunnisa"
          },
          {
            "@_fa": "true",
            "$": "Yilmaz, Asli"
          },
          {
            "@_fa": "true",
            "$": "Yilmaz, Mehmet"
          }
        ],
        "link": [
          {
            "@_fa": "true",
            "@rel": "self",
            "@href": "https://api.elsevier.com/content/article/pii/S1566736723000742"
          },
          {
            "@_fa": "true",
            "@rel": "scidir",
            "@href": "https://www.sciencedirect.com/science/article/pii/S1566736723000742"
          }
        ],
        "dc:format": "application/json",
        "openaccessType": "Full",
        "pii": "S1566-7367(23)00074-2",
        "prism:volume": "178",
        "articleNumber": "106672",
        "prism:publisher": "The Authors. Published by Elsevier B.V.",
        "dc:title": "Silver nanostructure-decorated hierarchical titanium dioxide nanoflowers for SERS and photocatalytic applications",
        "prism:copyright": "© 2023 The Authors. Published by Elsevier B.V.",
        "openaccess": "1",
        "prism:issn": "15667367",
        "dcterms:subject": [
          {
            "@_fa": "true",
            "$": "Titanium dioxide nanoflowers"
          },
          {
            "@_fa": "true",
            "$": "Surface-enhanced Raman scattering (SERS)"
          },
          {
            "@_fa": "true",
            "$": "Catalytic activity"
          },
          {
            "@_fa": "true",
            "$": "Silver nanostructures"
          },
          {
            "@_fa": "true",
            "$": "Poly(L-DOPA)"
          }
        ],
        "openaccessArticle": "true",
        "prism:publicationName": "Catalysis Communications",
        "openaccessSponsorType": "Author",
        "prism:pageRange": "106672",
        "pubType": "fla",
        "prism:coverDisplayDate": "May 2023",
        "prism:doi": "10.1016/j.catcom.2023.106672",
        "prism:startingPage": "106672",
        "dc:identifier": "doi:10.1016/j.catcom.2023.106672",
        "openaccessSponsorName": null
      },
      "objects": {
        "object": [
          {
            "@category": "standard",
            "@height": "688",
            "@width": "568",
            "@_fa": "true",
            "$": "https://api.elsevier.com/content/object/eid/1-s2.0-S1566736723000742-gr7.jpg?httpAccept=%2A%2F%2A",
            "@multimediatype": "JPEG image file",
            "@type": "IMAGE-DOWNSAMPLED",
            "@size": "103713",
            "@ref": "gr7",
            "@mimetype": "image/jpeg"
          },
          {
            "@category": "standard",
            "@height": "287",
            "@width": "729",
            "@_fa": "true",
            "$": "https://api.elsevier.com/content/object/eid/1-s2.0-S1566736723000742-gr6.jpg?httpAccept=%2A%2F%2A",
            "@multimediatype": "JPEG image file",
            "@type": "IMAGE-DOWNSAMPLED",
            "@size": "78138",
            "@ref": "gr6",
            "@mimetype": "image/jpeg"
          },
          {
            "@category": "standard",
            "@height": "309",
            "@width": "802",
            "@_fa": "true",
            "$": "https://api.elsevier.com/content/object/eid/1-s2.0-S1566736723000742-gr5.jpg?httpAccept=%2A%2F%2A",
            "@multimediatype": "JPEG image file",
            "@type": "IMAGE-DOWNSAMPLED",
            "@size": "57299",
            "@ref": "gr5",
            "@mimetype": "image/jpeg"
          },
          {
            "@category": "standard",
            "@height": "566",
            "@width": "757",
            "@_fa": "true",
            "$": "https://api.elsevier.com/content/object/eid/1-s2.0-S1566736723000742-gr4.jpg?httpAccept=%2A%2F%2A",
            "@multimediatype": "JPEG image file",
            "@type": "IMAGE-DOWNSAMPLED",
            "@size": "88928",
            "@ref": "gr4",
            "@mimetype": "image/jpeg"
          },
          {
            "@category": "standard",
            "@height": "292",
            "@width": "800",
            "@_fa": "true",
            "$": "https://api.elsevier.com/content/object/eid/1-s2.0-S1566736723000742-gr3.jpg?httpAccept=%2A%2F%2A",
            "@multimediatype": "JPEG image file",
            "@type": "IMAGE-DOWNSAMPLED",
            "@size": "65097",
            "@ref": "gr3",
            "@mimetype": "image/jpeg"
          },
          {
            "@category": "standard",
            "@height": "591",
            "@width": "619",
            "@_fa": "true",
            "$": "https://api.elsevier.com/content/object/eid/1-s2.0-S1566736723000742-gr2.jpg?httpAccept=%2A%2F%2A",
            "@multimediatype": "JPEG image file",
            "@type": "IMAGE-DOWNSAMPLED",
            "@size": "138486",
            "@ref": "gr2",
            "@mimetype": "image/jpeg"
          },
          {
            "@category": "standard",
            "@height": "200",
            "@width": "301",
            "@_fa": "true",
            "$": "https://api.elsevier.com/content/object/eid/1-s2.0-S1566736723000742-ga1.jpg?httpAccept=%2A%2F%2A",
            "@multimediatype": "JPEG image file",
            "@type": "IMAGE-DOWNSAMPLED",
            "@size": "15593",
            "@ref": "ga1",
            "@mimetype": "image/jpeg"
          },
          {
            "@category": "standard",
            "@height": "760",
            "@width": "533",
            "@_fa": "true",
            "$": "https://api.elsevier.com/content/object/eid/1-s2.0-S1566736723000742-gr1.jpg?httpAccept=%2A%2F%2A",
            "@multimediatype": "JPEG image file",
            "@type": "IMAGE-DOWNSAMPLED",
            "@size": "139738",
            "@ref": "gr1",
            "@mimetype": "image/jpeg"
          },
          {
            "@category": "thumbnail",
            "@height": "164",
            "@width": "135",
            "@_fa": "true",
            "$": "https://api.elsevier.com/content/object/eid/1-s2.0-S1566736723000742-gr7.sml?httpAccept=%2A%2F%2A",
            "@multimediatype": "GIF image file",
            "@type": "IMAGE-THUMBNAIL",
            "@size": "8791",
            "@ref": "gr7",
            "@mimetype": "image/gif"
          },
          {
            "@category": "thumbnail",
            "@height": "86",
            "@width": "219",
            "@_fa": "true",
            "$": "https://api.elsevier.com/content/object/eid/1-s2.0-S1566736723000742-gr6.sml?httpAccept=%2A%2F%2A",
            "@multimediatype": "GIF image file",
            "@type": "IMAGE-THUMBNAIL",
            "@size": "10498",
            "@ref": "gr6",
            "@mimetype": "image/gif"
          },
          {
            "@category": "thumbnail",
            "@height": "84",
            "@width": "219",
            "@_fa": "true",
            "$": "https://api.elsevier.com/content/object/eid/1-s2.0-S1566736723000742-gr5.sml?httpAccept=%2A%2F%2A",
            "@multimediatype": "GIF image file",
            "@type": "IMAGE-THUMBNAIL",
            "@size": "5709",
            "@ref": "gr5",
            "@mimetype": "image/gif"
          },
          {
            "@category": "thumbnail",
            "@height": "164",
            "@width": "219",
            "@_fa": "true",
            "$": "https://api.elsevier.com/content/object/eid/1-s2.0-S1566736723000742-gr4.sml?httpAccept=%2A%2F%2A",
            "@multimediatype": "GIF image file",
            "@type": "IMAGE-THUMBNAIL",
            "@size": "12367",
            "@ref": "gr4",
            "@mimetype": "image/gif"
          },
          {
            "@category": "thumbnail",
            "@height": "80",
            "@width": "219",
            "@_fa": "true",
            "$": "https://api.elsevier.com/content/object/eid/1-s2.0-S1566736723000742-gr3.sml?httpAccept=%2A%2F%2A",
            "@multimediatype": "GIF image file",
            "@type": "IMAGE-THUMBNAIL",
            "@size": "7247",
            "@ref": "gr3",
            "@mimetype": "image/gif"
          },
          {
            "@category": "thumbnail",
            "@height": "163",
            "@width": "171",
            "@_fa": "true",
            "$": "https://api.elsevier.com/content/object/eid/1-s2.0-S1566736723000742-gr2.sml?httpAccept=%2A%2F%2A",
            "@multimediatype": "GIF image file",
            "@type": "IMAGE-THUMBNAIL",
            "@size": "19279",
            "@ref": "gr2",
            "@mimetype": "image/gif"
          },
          {
            "@category": "thumbnail",
            "@height": "146",
            "@width": "219",
            "@_fa": "true",
            "$": "https://api.elsevier.com/content/object/eid/1-s2.0-S1566736723000742-ga1.sml?httpAccept=%2A%2F%2A",
            "@multimediatype": "GIF image file",
            "@type": "IMAGE-THUMBNAIL",
            "@size": "8613",
            "@ref": "ga1",
            "@mimetype": "image/gif"
          },
          {
            "@category": "thumbnail",
            "@height": "164",
            "@width": "115",
            "@_fa": "true",
            "$": "https://api.elsevier.com/content/object/eid/1-s2.0-S1566736723000742-gr1.sml?httpAccept=%2A%2F%2A",
            "@multimediatype": "GIF image file",
            "@type": "IMAGE-THUMBNAIL",
            "@size": "14457",
            "@ref": "gr1",
            "@mimetype": "image/gif"
          },
          {
            "@category": "high",
            "@height": "3050",
            "@width": "2517",
            "@_fa": "true",
            "$": "https://api.elsevier.com/content/object/eid/1-s2.0-S1566736723000742-gr7_lrg.jpg?httpAccept=%2A%2F%2A",
            "@multimediatype": "JPEG image file",
            "@type": "IMAGE-HIGH-RES",
            "@size": "717676",
            "@ref": "gr7",
            "@mimetype": "image/jpeg"
          },
          {
            "@category": "high",
            "@height": "1271",
            "@width": "3228",
            "@_fa": "true",
            "$": "https://api.elsevier.com/content/object/eid/1-s2.0-S1566736723000742-gr6_lrg.jpg?httpAccept=%2A%2F%2A",
            "@multimediatype": "JPEG image file",
            "@type": "IMAGE-HIGH-RES",
            "@size": "769032",
            "@ref": "gr6",
            "@mimetype": "image/jpeg"
          },
          {
            "@category": "high",
            "@height": "1367",
            "@width": "3549",
            "@_fa": "true",
            "$": "https://api.elsevier.com/content/object/eid/1-s2.0-S1566736723000742-gr5_lrg.jpg?httpAccept=%2A%2F%2A",
            "@multimediatype": "JPEG image file",
            "@type": "IMAGE-HIGH-RES",
            "@size": "451760",
            "@ref": "gr5",
            "@mimetype": "image/jpeg"
          },
          {
            "@category": "high",
            "@height": "2504",
            "@width": "3351",
            "@_fa": "true",
            "$": "https://api.elsevier.com/content/object/eid/1-s2.0-S1566736723000742-gr4_lrg.jpg?httpAccept=%2A%2F%2A",
            "@multimediatype": "JPEG image file",
            "@type": "IMAGE-HIGH-RES",
            "@size": "777993",
            "@ref": "gr4",
            "@mimetype": "image/jpeg"
          },
          {
            "@category": "high",
            "@height": "1295",
            "@width": "3543",
            "@_fa": "true",
            "$": "https://api.elsevier.com/content/object/eid/1-s2.0-S1566736723000742-gr3_lrg.jpg?httpAccept=%2A%2F%2A",
            "@multimediatype": "JPEG image file",
            "@type": "IMAGE-HIGH-RES",
            "@size": "585315",
            "@ref": "gr3",
            "@mimetype": "image/jpeg"
          },
          {
            "@category": "high",
            "@height": "1571",
            "@width": "1645",
            "@_fa": "true",
            "$": "https://api.elsevier.com/content/object/eid/1-s2.0-S1566736723000742-gr2_lrg.jpg?httpAccept=%2A%2F%2A",
            "@multimediatype": "JPEG image file",
            "@type": "IMAGE-HIGH-RES",
            "@size": "641144",
            "@ref": "gr2",
            "@mimetype": "image/jpeg"
          },
          {
            "@category": "high",
            "@height": "886",
            "@width": "1332",
            "@_fa": "true",
            "$": "https://api.elsevier.com/content/object/eid/1-s2.0-S1566736723000742-ga1_lrg.jpg?httpAccept=%2A%2F%2A",
            "@multimediatype": "JPEG image file",
            "@type": "IMAGE-HIGH-RES",
            "@size": "156240",
            "@ref": "ga1",
            "@mimetype": "image/jpeg"
          },
          {
            "@category": "high",
            "@height": "2021",
            "@width": "1417",
            "@_fa": "true",
            "$": "https://api.elsevier.com/content/object/eid/1-s2.0-S1566736723000742-gr1_lrg.jpg?httpAccept=%2A%2F%2A",
            "@multimediatype": "JPEG image file",
            "@type": "IMAGE-HIGH-RES",
            "@size": "774345",
            "@ref": "gr1",
            "@mimetype": "image/jpeg"
          },
          {
            "@category": "standard",
            "@_fa": "true",
            "$": "https://api.elsevier.com/content/object/eid/1-s2.0-S1566736723000742-mmc1.docx?httpAccept=%2A%2F%2A",
            "@multimediatype": "Microsoft Word file",
            "@type": "APPLICATION",
            "@size": "531902",
            "@ref": "mmc1",
            "@mimetype": "application/word"
          },
          {
            "@category": "thumbnail",
            "@_fa": "true",
            "$": "https://api.elsevier.com/content/object/eid/1-s2.0-S1566736723000742-si1.svg?httpAccept=%2A%2F%2A",
            "@multimediatype": "Scalable Vector Graphics file",
            "@type": "ALTIMG",
            "@size": "10276",
            "@ref": "si1",
            "@mimetype": "image/svg+xml"
          },
          {
            "@category": "thumbnail",
            "@_fa": "true",
            "$": "https://api.elsevier.com/content/object/eid/1-s2.0-S1566736723000742-si2.svg?httpAccept=%2A%2F%2A",
            "@multimediatype": "Scalable Vector Graphics file",
            "@type": "ALTIMG",
            "@size": "5328",
            "@ref": "si2",
            "@mimetype": "image/svg+xml"
          },
          {
            "@category": "standard",
            "@_fa": "true",
            "$": "https://api.elsevier.com/content/object/eid/1-s2.0-S1566736723000742-am.pdf?httpAccept=%2A%2F%2A",
            "@multimediatype": "Acrobat PDF file",
            "@type": "AAM-PDF",
            "@size": "808203",
            "@ref": "am",
            "@mimetype": "application/pdf"
          }
        ]
      },
      "link": {
        "@rel": "abstract",
        "@href": "https://api.elsevier.com/content/abstract/scopus_id/85152681890"
      }
    }
  }
}