{
  "metadata": {
    "title": "Surface chemistry of MXene quantum dots: Virus mechanism-inspired mini-lab for catalysis",
    "authors": "; ; ",
    "journal": "Chinese Journal of Catalysis",
    "date": "2022-11-30",
    "doi": "10.1016/S1872-2067(22)64167-6",
    "abstract": "",
    "uri": "https://api.elsevier.com/content/article/pii/S1872206722641676",
    "pii": "S1872206722641676"
  },
  "fulltext": {
    "full-text-retrieval-response": {
      "scopus-eid": "2-s2.0-85140234857",
      "originalText": "serial JL 273538 291210 291744 291809 31 Chinese Journal of Catalysis CHINESEJOURNALCATALYSIS 2022-10-20 2022-10-20 2022-10-20 2022-10-20 2022-10-20T15:56:57 1-s2.0-S1872206722641676 S1872-2067(22)64167-6 S1872206722641676 10.1016/S1872-2067(22)64167-6 S300 S300.1 FULL-TEXT 1-s2.0-S1872206722X00119 2022-10-27T04:02:03.412661Z 0 0 20221101 20221130 2022 2022-10-20T16:11:59.057775Z absattachment articleinfo articletitlenorm authfirstinitialnorm authfirstsurnamenorm cid cids contenttype copyright crossmark dateloaded dateloadedtxt datesearch datesort dateupdated dco docsubtype doctype doi eid ewtransactionid hubeid indexeddate issfirst issn issnnorm issuelist itemstage itemtransactionid itemweight openaccess openarchive pg pgfirst pglast pii piinorm pubdateend pubdatestart pubdatetxt pubyr sortorder srctitle srctitlenorm srctype ssids alllist content subj subheadings tomb volfirst volissue volumelist webpdf webpdfpagecount yearnav figure table body affil articletitle auth authfirstini authfull authkeywords authlast grantnumber grantsponsor primabst pubtype ref specialabst vitae 1872-2067 18722067 true 43 43 11 11 Volume 43, Issue 11 18 2913 2935 2913 2935 202211 November 2022 2022-11-01 2022-11-30 2022 article rev Copyright © 2022 Dalian Institute of Chemical Physics, the Chinese Academy of Sciences. Published by Elsevier B.V. All rights reserved. SURFACECHEMISTRYMXENEQUANTUMDOTSVIRUSMECHANISMINSPIREDMINILABFORCATALYSIS LIU Y 1 Introduction 2 Mechanism of catalysis 2.1 Electrocatalysis 2.2 Photocatalysis 2.3 Photoelectrocatalysis 3 Controllable synthesis of functional groups in MQDs 4 Design principles of Single site chemistry in MQDs 4.1 Importance of functional groups 4.2 Importance of surface defects 4.3 Importance of support 5 Modification strategy of unit point chemistry in MQDs 5.1 Heteroatomic doping 5.2 Coordination effect 5.3 Crosslinked carrier 5.4 Functional groups substitution 5.5 Constructing heterojunction 6 Deeply understanding the catalytic mechanism of MQDs 6.1 Ex-situ characterization of MQDs 6.2 In-situ characterization techniques 6.3 Density functional calculation 7 Conclusions and outlook References THOMAS 2005 6456 6482 J QIAO 2011 634 641 B ZHANG 2016 2988 2993 W WANG 2021 1269 1286 Y SONG 2022 391 422 K TOUMEY 2009 783 784 C DONG 2022 485 493 C SONG 2022 121591 K SU 2021 13235 13244 Y BAI 2013 2678 2683 C HEATH 1995 1315 1316 J WITSCHI 2000 3 15 H ERTL 2013 52 60 G ERTL 2008 3524 3535 G ERTL 1980 201 223 G HAYES 1987 353 363 P XIAOZHONG 2012 106 111 H ARQUER 2021 eaaz8541 F OWEN 2015 615 616 J LIU 2022 158 Y ZHANG 2010 6084 6089 W TANG 2020 847 860 Z ZOU 2022 2972 2990 J ZHOU 2021 860 871 H GAO 2021 2004129 L LU 2020 344 363 M WANG 2018 3380 3387 S LING 2016 1600180 C DING 2020 143987 B KANG 2021 6089 6108 Z RAMALINGAM 2019 e1903841 V JIANG 2022 136119 B TANG 2020 12990 12998 Y LIM 2020 16140 16155 K HUANG 2020 113727 J YOON 2019 1903443 Y PANG 2019 9610 9616 S LE 2019 16879 16888 T KUANG 2019 8 20 P JIANG 2019 1368 1373 Y YUAN 2018 8976 8982 W YOON 2018 20869 20877 Y LI 2018 512 518 S SEH 2016 589 594 Z NAGUIB 2011 4248 4253 M HALIM 2016 406 417 J JIN 2020 2000797 Z ZHAO 2019 4086 4093 D ZHANG 2018 985 992 J SANG 2016 9193 9200 X WANG 2021 2003069 P LIU Y PEACOCK 2021 899 909 T CHEN 2019 131 137 X ZENG 2019 1806500 Z YANG 2017 274 281 L QIN 2020 17791 17799 J YANG 2022 542 L HE 2020 119006 F DU 2020 100719 X TANG 2020 2000637 R SONG 2022 e202200946 Y ZHANG 2020 29 55 C XUE 2017 1604847 Q SHEN 2021 27013 27018 M LI 2020 894 899 Y NATU 2020 616 630 V LI 2018 6115 6119 T YANG 2018 15491 15495 S LIAN 2017 1 8 P LI 2017 1602725 J ZHAO 2022 393 402 Z YU 2017 17859 17864 X CHANG 2022 3134 3145 B YUAN 2021 125027 Z LIN 2021 481 488 S LAI 2021 161 173 C HAN 2021 1134 1144 X WANG 2020 40176 40185 H YANG 2019 78 87 X LI 2019 41440 41447 Y LI 2021 3 14 K ZHANG 2022 471 W LIANG 2021 265 272 J LIU 2020 2179 2195 J SUJITH 2022 5074 5086 M XIA 2021 887 894 C FENG 2022 211 218 Y LI 2020 277 284 W ZHAO 2019 1635 1638 M FEI 2018 63 72 H LIU 2019 104023 Y FENG 2019 7047 7057 T JIN 2020 21885 21889 S LI 2022 99 108 D MURALI 2021 34648 34657 G CHENG 2021 2102091 R ZHANG 2021 2008447 H HUANG 2021 130074 D FENG 2020 8320 8327 Y AI 2021 8192 8199 F IBRAGIMOVA 2022 2896 2906 R RONG 2021 1999 2009 J GUAN 2019 14123 14133 Q XU 2019 90 101 Q XU 2020 6648 6651 Q YAN 2021 109720 F GAO 2017 494 500 G ZHANG 2021 2007113 M ZHOU 2022 2204388 S PENG 2022 4116 4125 W LI 2018 1800676 W WU 2022 8531 8539 T LUKATSKAYA 2015 1500589 M ANASORI 2017 16098 B GAO 2022 1860 1869 Y HUANG 2018 18479 18486 B DENG 2021 1659 1666 Z XIE 2013 235441 Y CHENG Y CODECO 2022 8832 8838 C KENMOE 2022 921 S ZOU 2022 509 515 X RAFIEERAD 2021 2106786 A KAMYSBAYEV 2020 979 983 V MA 2021 5085 G YAN R WRAPP 2020 1260 1263 D XU 2021 213824 Z LEE 2022 605 W MEFFORD 2021 67 73 J FAVARO 2017 8960 8970 M YAN 2018 2373 Z ZUO 2022 2103383 S GRIMAUD 2016 16189 A GOHL 2020 287 291 D CHENG 2019 15629 15636 Y ZHOU 2022 2201518 X DINH 2019 107 114 C HE 2021 5443 5450 L LIU 2019 16439 16444 Y TIAN 2021 279 294 L WANG 2020 1907091 C ZHAN 2020 411 418 G LIUX2022X2913 LIUX2022X2913X2935 LIUX2022X2913XY LIUX2022X2913X2935XY 2024-10-20T00:00:00.000Z 2024-10-20T00:00:00.000Z http://creativecommons.org/licenses/by-nc-nd/4.0/ 0 2022-10-27T04:01:23.843Z http://vtw.elsevier.com/data/voc/AddOnTypes/50.7/aggregated-refined National Natural Science Foundation of China 51872115 51932003 NSFC National Natural Science Foundation of China http://data.elsevier.com/vocabulary/SciValFunders/501100001809 http://sws.geonames.org/1814991/ Department of Science and Technology of Jilin Province 20200801001GH Department of Science and Technology of Jilin Province http://data.elsevier.com/vocabulary/SciValFunders/501100011789 http://sws.geonames.org/1814991/ This work was supported by the National Natural Science Foundation of China ( 51872115 , 51932003 ), and 2020 International Cooperation Project of the Department of Science and Technology of Jilin Province ( 20200801001GH ). item S1872-2067(22)64167-6 S1872206722641676 1-s2.0-S1872206722641676 10.1016/S1872-2067(22)64167-6 273538 2022-10-20T15:11:59.057775Z 2022-11-01 2022-11-30 1-s2.0-S1872206722641676-main.pdf https://s3-eu-west-1.amazonaws.com/prod-ucs-content-store-eu-west/content/pii:S1872206722641676/MAIN/application/pdf/89e4037565a01a5da997e528c755be8a/main.pdf main.pdf pdf true 5235310 MAIN 23 1-s2.0-S1872206722641676-main_1.png https://s3-eu-west-1.amazonaws.com/prod-ucs-content-store-eu-west/content/pii:S1872206722641676/PREVIEW/image/png/7ffb76ed404095a561fe2838f9e7033d/main_1.png main_1.png png 51744 849 656 IMAGE-WEB-PDF 1 1-s2.0-S1872206722641676-fx1.jpg https://s3-eu-west-1.amazonaws.com/prod-ucs-content-store-eu-west/content/pii:S1872206722641676/fx1/DOWNSAMPLED/image/jpeg/bdba0656d192ad7f0ae5963a29745ec4/fx1.jpg fx1 true fx1.jpg jpg 28790 226 301 IMAGE-DOWNSAMPLED 1-s2.0-S1872206722641676-fx2.jpg https://s3-eu-west-1.amazonaws.com/prod-ucs-content-store-eu-west/content/pii:S1872206722641676/fx2/DOWNSAMPLED/image/jpeg/873cc53f8035e08e452da6169e2e3b21/fx2.jpg fx2 fx2.jpg jpg 5153 146 116 IMAGE-DOWNSAMPLED 1-s2.0-S1872206722641676-fx3.jpg https://s3-eu-west-1.amazonaws.com/prod-ucs-content-store-eu-west/content/pii:S1872206722641676/fx3/DOWNSAMPLED/image/jpeg/0a80eb2a8a3fab06ecee7b96435d43c6/fx3.jpg fx3 fx3.jpg jpg 5863 150 105 IMAGE-DOWNSAMPLED 1-s2.0-S1872206722641676-gr1.jpg https://s3-eu-west-1.amazonaws.com/prod-ucs-content-store-eu-west/content/pii:S1872206722641676/gr1/DOWNSAMPLED/image/jpeg/e2f095e04483f1911aeda7b1d469d856/gr1.jpg gr1 gr1.jpg jpg 47656 305 369 IMAGE-DOWNSAMPLED 1-s2.0-S1872206722641676-gr10.jpg https://s3-eu-west-1.amazonaws.com/prod-ucs-content-store-eu-west/content/pii:S1872206722641676/gr10/DOWNSAMPLED/image/jpeg/3b8786f296438b17463e378328863640/gr10.jpg gr10 gr10.jpg jpg 140784 521 494 IMAGE-DOWNSAMPLED 1-s2.0-S1872206722641676-gr11.jpg https://s3-eu-west-1.amazonaws.com/prod-ucs-content-store-eu-west/content/pii:S1872206722641676/gr11/DOWNSAMPLED/image/jpeg/7e42ef5bf936ac9fdc338bf3fc707ded/gr11.jpg gr11 gr11.jpg jpg 149492 468 616 IMAGE-DOWNSAMPLED 1-s2.0-S1872206722641676-gr12.jpg https://s3-eu-west-1.amazonaws.com/prod-ucs-content-store-eu-west/content/pii:S1872206722641676/gr12/DOWNSAMPLED/image/jpeg/a2a5401be9c7a76ef3ba9c41cf558e1d/gr12.jpg gr12 gr12.jpg jpg 157250 532 624 IMAGE-DOWNSAMPLED 1-s2.0-S1872206722641676-gr13.jpg https://s3-eu-west-1.amazonaws.com/prod-ucs-content-store-eu-west/content/pii:S1872206722641676/gr13/DOWNSAMPLED/image/jpeg/b6575cd99045a8f9263fde09e3bae19e/gr13.jpg gr13 gr13.jpg jpg 124595 487 619 IMAGE-DOWNSAMPLED 1-s2.0-S1872206722641676-gr14.jpg https://s3-eu-west-1.amazonaws.com/prod-ucs-content-store-eu-west/content/pii:S1872206722641676/gr14/DOWNSAMPLED/image/jpeg/696d5362b0633bd564f1e8781867d581/gr14.jpg gr14 gr14.jpg jpg 129361 429 615 IMAGE-DOWNSAMPLED 1-s2.0-S1872206722641676-gr15.jpg https://s3-eu-west-1.amazonaws.com/prod-ucs-content-store-eu-west/content/pii:S1872206722641676/gr15/DOWNSAMPLED/image/jpeg/2d03c025399cebf0b3e1f7285ab9ee53/gr15.jpg gr15 gr15.jpg jpg 58087 441 508 IMAGE-DOWNSAMPLED 1-s2.0-S1872206722641676-gr16.jpg https://s3-eu-west-1.amazonaws.com/prod-ucs-content-store-eu-west/content/pii:S1872206722641676/gr16/DOWNSAMPLED/image/jpeg/871d7b007345c6a90c6638c4626d34f6/gr16.jpg gr16 gr16.jpg jpg 71572 330 369 IMAGE-DOWNSAMPLED 1-s2.0-S1872206722641676-gr17.jpg https://s3-eu-west-1.amazonaws.com/prod-ucs-content-store-eu-west/content/pii:S1872206722641676/gr17/DOWNSAMPLED/image/jpeg/923ff7fa6ca87c052ec499ec21680122/gr17.jpg gr17 gr17.jpg jpg 100400 356 593 IMAGE-DOWNSAMPLED 1-s2.0-S1872206722641676-gr18.jpg https://s3-eu-west-1.amazonaws.com/prod-ucs-content-store-eu-west/content/pii:S1872206722641676/gr18/PUBMED/image/jpeg/be8461141bdeed16819b086ffb1e5d1d/gr18.jpg gr18 gr18.jpg jpg 201674 668 656 IMAGE-DOWNSAMPLED 1-s2.0-S1872206722641676-gr19.jpg https://s3-eu-west-1.amazonaws.com/prod-ucs-content-store-eu-west/content/pii:S1872206722641676/gr19/DOWNSAMPLED/image/jpeg/ff19ff3ff9332ff3362c0ce3a317c257/gr19.jpg gr19 gr19.jpg jpg 126847 440 606 IMAGE-DOWNSAMPLED 1-s2.0-S1872206722641676-gr2.jpg https://s3-eu-west-1.amazonaws.com/prod-ucs-content-store-eu-west/content/pii:S1872206722641676/gr2/DOWNSAMPLED/image/jpeg/c5b1f2605113c974ccaa689eaf1ecff3/gr2.jpg gr2 gr2.jpg jpg 17639 122 374 IMAGE-DOWNSAMPLED 1-s2.0-S1872206722641676-gr20.jpg https://s3-eu-west-1.amazonaws.com/prod-ucs-content-store-eu-west/content/pii:S1872206722641676/gr20/DOWNSAMPLED/image/jpeg/024ba615e8376c04df98f2bdc8ef8e92/gr20.jpg gr20 gr20.jpg jpg 21234 261 256 IMAGE-DOWNSAMPLED 1-s2.0-S1872206722641676-gr3.jpg https://s3-eu-west-1.amazonaws.com/prod-ucs-content-store-eu-west/content/pii:S1872206722641676/gr3/DOWNSAMPLED/image/jpeg/aa4b0a6511b89e0b53f1a838c77705c0/gr3.jpg gr3 gr3.jpg jpg 34964 173 476 IMAGE-DOWNSAMPLED 1-s2.0-S1872206722641676-gr4.jpg https://s3-eu-west-1.amazonaws.com/prod-ucs-content-store-eu-west/content/pii:S1872206722641676/gr4/DOWNSAMPLED/image/jpeg/04d4cd3b4682985ef5cceadaeb928ae9/gr4.jpg gr4 gr4.jpg jpg 115306 434 427 IMAGE-DOWNSAMPLED 1-s2.0-S1872206722641676-gr5.jpg https://s3-eu-west-1.amazonaws.com/prod-ucs-content-store-eu-west/content/pii:S1872206722641676/gr5/DOWNSAMPLED/image/jpeg/54d8b8ac166a7f86922ac45622941d73/gr5.jpg gr5 gr5.jpg jpg 21355 218 370 IMAGE-DOWNSAMPLED 1-s2.0-S1872206722641676-gr6.jpg https://s3-eu-west-1.amazonaws.com/prod-ucs-content-store-eu-west/content/pii:S1872206722641676/gr6/DOWNSAMPLED/image/jpeg/f03cfc827356d2acb18c52cfb971815a/gr6.jpg gr6 gr6.jpg jpg 152456 545 575 IMAGE-DOWNSAMPLED 1-s2.0-S1872206722641676-gr7.jpg https://s3-eu-west-1.amazonaws.com/prod-ucs-content-store-eu-west/content/pii:S1872206722641676/gr7/DOWNSAMPLED/image/jpeg/60b1d6c8d2ac2106817b17d66692021b/gr7.jpg gr7 gr7.jpg jpg 126088 539 557 IMAGE-DOWNSAMPLED 1-s2.0-S1872206722641676-gr8.jpg https://s3-eu-west-1.amazonaws.com/prod-ucs-content-store-eu-west/content/pii:S1872206722641676/gr8/DOWNSAMPLED/image/jpeg/813995aa0244968f9acab4b0921deeca/gr8.jpg gr8 gr8.jpg jpg 81629 355 486 IMAGE-DOWNSAMPLED 1-s2.0-S1872206722641676-gr9.jpg https://s3-eu-west-1.amazonaws.com/prod-ucs-content-store-eu-west/content/pii:S1872206722641676/gr9/DOWNSAMPLED/image/jpeg/87211a2f31bdf68ee1f7fc07226cfdfa/gr9.jpg gr9 gr9.jpg jpg 104501 462 611 IMAGE-DOWNSAMPLED 1-s2.0-S1872206722641676-fx1.sml https://s3-eu-west-1.amazonaws.com/prod-ucs-content-store-eu-west/content/pii:S1872206722641676/fx1/THUMBNAIL/image/gif/d7b36e36ec7987df54138907cdb0513e/fx1.sml fx1 true fx1.sml sml 28363 164 219 IMAGE-THUMBNAIL 1-s2.0-S1872206722641676-fx2.sml https://s3-eu-west-1.amazonaws.com/prod-ucs-content-store-eu-west/content/pii:S1872206722641676/fx2/THUMBNAIL/image/gif/4017c3d501b971276a494b3c3fe8d253/fx2.sml fx2 fx2.sml sml 13406 164 130 IMAGE-THUMBNAIL 1-s2.0-S1872206722641676-fx3.sml https://s3-eu-west-1.amazonaws.com/prod-ucs-content-store-eu-west/content/pii:S1872206722641676/fx3/THUMBNAIL/image/gif/592ee6c6824b1ffdcb76fb2c55d2bd5b/fx3.sml fx3 fx3.sml sml 14294 164 115 IMAGE-THUMBNAIL 1-s2.0-S1872206722641676-gr1.sml https://s3-eu-west-1.amazonaws.com/prod-ucs-content-store-eu-west/content/pii:S1872206722641676/gr1/THUMBNAIL/image/gif/5056df20939f6e624d9f7b91d45b69ef/gr1.sml gr1 gr1.sml sml 19297 164 198 IMAGE-THUMBNAIL 1-s2.0-S1872206722641676-gr10.sml https://s3-eu-west-1.amazonaws.com/prod-ucs-content-store-eu-west/content/pii:S1872206722641676/gr10/THUMBNAIL/image/gif/3e3eeb06d78967ebf3a14bd0255750e3/gr10.sml gr10 gr10.sml sml 16180 163 155 IMAGE-THUMBNAIL 1-s2.0-S1872206722641676-gr11.sml https://s3-eu-west-1.amazonaws.com/prod-ucs-content-store-eu-west/content/pii:S1872206722641676/gr11/THUMBNAIL/image/gif/9d58b789cef180c357e3d1d9342f2064/gr11.sml gr11 gr11.sml sml 24593 164 215 IMAGE-THUMBNAIL 1-s2.0-S1872206722641676-gr12.sml https://s3-eu-west-1.amazonaws.com/prod-ucs-content-store-eu-west/content/pii:S1872206722641676/gr12/THUMBNAIL/image/gif/a9fce52a5f188392e61a1055639c53c0/gr12.sml gr12 gr12.sml sml 21330 164 192 IMAGE-THUMBNAIL 1-s2.0-S1872206722641676-gr13.sml https://s3-eu-west-1.amazonaws.com/prod-ucs-content-store-eu-west/content/pii:S1872206722641676/gr13/THUMBNAIL/image/gif/88d51f960f3b2a8f861d0411aac11a68/gr13.sml gr13 gr13.sml sml 18038 164 208 IMAGE-THUMBNAIL 1-s2.0-S1872206722641676-gr14.sml https://s3-eu-west-1.amazonaws.com/prod-ucs-content-store-eu-west/content/pii:S1872206722641676/gr14/THUMBNAIL/image/gif/8d7d11de5e32f4b826e6743e9e2197aa/gr14.sml gr14 gr14.sml sml 24605 153 219 IMAGE-THUMBNAIL 1-s2.0-S1872206722641676-gr15.sml https://s3-eu-west-1.amazonaws.com/prod-ucs-content-store-eu-west/content/pii:S1872206722641676/gr15/THUMBNAIL/image/gif/c7f6d11247aa2139502069349d049221/gr15.sml gr15 gr15.sml sml 11323 164 189 IMAGE-THUMBNAIL 1-s2.0-S1872206722641676-gr16.sml https://s3-eu-west-1.amazonaws.com/prod-ucs-content-store-eu-west/content/pii:S1872206722641676/gr16/THUMBNAIL/image/gif/fcd16ad49f702e9e0f17972311456a57/gr16.sml gr16 gr16.sml sml 24901 164 183 IMAGE-THUMBNAIL 1-s2.0-S1872206722641676-gr17.sml https://s3-eu-west-1.amazonaws.com/prod-ucs-content-store-eu-west/content/pii:S1872206722641676/gr17/THUMBNAIL/image/gif/cb7b091e167ef2c0746dae493a411d9b/gr17.sml gr17 gr17.sml sml 15329 132 219 IMAGE-THUMBNAIL 1-s2.0-S1872206722641676-gr18.sml https://s3-eu-west-1.amazonaws.com/prod-ucs-content-store-eu-west/content/pii:S1872206722641676/gr18/THUMBNAIL/image/gif/8f6d31a9c66a69f1958067504204b69a/gr18.sml gr18 gr18.sml sml 16516 164 161 IMAGE-THUMBNAIL 1-s2.0-S1872206722641676-gr19.sml https://s3-eu-west-1.amazonaws.com/prod-ucs-content-store-eu-west/content/pii:S1872206722641676/gr19/HEAD-ONLY/image/gif/e624a9868669cad67b8819129611f41d/gr19.sml gr19 gr19.sml sml 18865 159 219 IMAGE-THUMBNAIL 1-s2.0-S1872206722641676-gr2.sml https://s3-eu-west-1.amazonaws.com/prod-ucs-content-store-eu-west/content/pii:S1872206722641676/gr2/THUMBNAIL/image/gif/0729726020ec42739dbebe4c1bb01aec/gr2.sml gr2 gr2.sml sml 9624 71 219 IMAGE-THUMBNAIL 1-s2.0-S1872206722641676-gr20.sml https://s3-eu-west-1.amazonaws.com/prod-ucs-content-store-eu-west/content/pii:S1872206722641676/gr20/THUMBNAIL/image/gif/be6810c6c2add4b6b23e7dca3aebbd17/gr20.sml gr20 gr20.sml sml 12194 163 160 IMAGE-THUMBNAIL 1-s2.0-S1872206722641676-gr3.sml https://s3-eu-west-1.amazonaws.com/prod-ucs-content-store-eu-west/content/pii:S1872206722641676/gr3/THUMBNAIL/image/gif/06fd649021811ec88790dac66eb25097/gr3.sml gr3 gr3.sml sml 10368 80 219 IMAGE-THUMBNAIL 1-s2.0-S1872206722641676-gr4.sml https://s3-eu-west-1.amazonaws.com/prod-ucs-content-store-eu-west/content/pii:S1872206722641676/gr4/THUMBNAIL/image/gif/7064c645a8e4de372968a6fee4db7301/gr4.sml gr4 gr4.sml sml 17575 164 161 IMAGE-THUMBNAIL 1-s2.0-S1872206722641676-gr5.sml https://s3-eu-west-1.amazonaws.com/prod-ucs-content-store-eu-west/content/pii:S1872206722641676/gr5/THUMBNAIL/image/gif/9a6f8be049fc28db1ad43e012f4cfe18/gr5.sml gr5 gr5.sml sml 7172 129 219 IMAGE-THUMBNAIL 1-s2.0-S1872206722641676-gr6.sml https://s3-eu-west-1.amazonaws.com/prod-ucs-content-store-eu-west/content/pii:S1872206722641676/gr6/THUMBNAIL/image/gif/3d17f5fbbfe9644f2e7b1c64953289d8/gr6.sml gr6 gr6.sml sml 16559 164 173 IMAGE-THUMBNAIL 1-s2.0-S1872206722641676-gr7.sml https://s3-eu-west-1.amazonaws.com/prod-ucs-content-store-eu-west/content/pii:S1872206722641676/gr7/THUMBNAIL/image/gif/ca7ae3ad65c69f6ca50f83c52549d411/gr7.sml gr7 gr7.sml sml 16457 164 169 IMAGE-THUMBNAIL 1-s2.0-S1872206722641676-gr8.sml https://s3-eu-west-1.amazonaws.com/prod-ucs-content-store-eu-west/content/pii:S1872206722641676/gr8/THUMBNAIL/image/gif/5560ec4191720049093941bdaa715409/gr8.sml gr8 gr8.sml sml 23177 160 219 IMAGE-THUMBNAIL 1-s2.0-S1872206722641676-gr9.sml https://s3-eu-west-1.amazonaws.com/prod-ucs-content-store-eu-west/content/pii:S1872206722641676/gr9/THUMBNAIL/image/gif/459a9f3df0a13542706bd325e5f0aa7b/gr9.sml gr9 gr9.sml sml 17005 164 217 IMAGE-THUMBNAIL 1-s2.0-S1872206722641676-fx1_lrg.jpg https://s3-eu-west-1.amazonaws.com/prod-ucs-content-store-eu-west/content/pii:S1872206722641676/HIGHRES/image/jpeg/d9ed7c992bd528d4fafe76881d47ac93/fx1_lrg.jpg fx1 true fx1_lrg.jpg jpg 140842 600 800 IMAGE-HIGH-RES 1-s2.0-S1872206722641676-fx2_lrg.jpg https://s3-eu-west-1.amazonaws.com/prod-ucs-content-store-eu-west/content/pii:S1872206722641676/HIGHRES/image/jpeg/c4eea3654714d98ff95f1649309baf72/fx2_lrg.jpg fx2 fx2_lrg.jpg jpg 21428 389 309 IMAGE-HIGH-RES 1-s2.0-S1872206722641676-fx3_lrg.jpg https://s3-eu-west-1.amazonaws.com/prod-ucs-content-store-eu-west/content/pii:S1872206722641676/HIGHRES/image/jpeg/70ec848658543e4489d9af7050162d62/fx3_lrg.jpg fx3 fx3_lrg.jpg jpg 26187 399 280 IMAGE-HIGH-RES 1-s2.0-S1872206722641676-gr1_lrg.jpg https://s3-eu-west-1.amazonaws.com/prod-ucs-content-store-eu-west/content/pii:S1872206722641676/MAIN/image/jpeg/0c072dfef68d5e51c64af218f739d01b/gr1_lrg.jpg gr1 gr1_lrg.jpg jpg 226461 813 982 IMAGE-HIGH-RES 1-s2.0-S1872206722641676-gr10_lrg.jpg https://s3-eu-west-1.amazonaws.com/prod-ucs-content-store-eu-west/content/pii:S1872206722641676/HIGHRES/image/jpeg/877e959097bcaf4415552379935cdfd9/gr10_lrg.jpg gr10 gr10_lrg.jpg jpg 561272 1385 1314 IMAGE-HIGH-RES 1-s2.0-S1872206722641676-gr11_lrg.jpg https://s3-eu-west-1.amazonaws.com/prod-ucs-content-store-eu-west/content/pii:S1872206722641676/HIGHRES/image/jpeg/f33ed2def34c6fb3df69f3ff90a81093/gr11_lrg.jpg gr11 gr11_lrg.jpg jpg 680671 1245 1637 IMAGE-HIGH-RES 1-s2.0-S1872206722641676-gr12_lrg.jpg https://s3-eu-west-1.amazonaws.com/prod-ucs-content-store-eu-west/content/pii:S1872206722641676/HIGHRES/image/jpeg/8ac0a27ae1f32f011633f60c7c8e2a34/gr12_lrg.jpg gr12 gr12_lrg.jpg jpg 674454 1414 1657 IMAGE-HIGH-RES 1-s2.0-S1872206722641676-gr13_lrg.jpg https://s3-eu-west-1.amazonaws.com/prod-ucs-content-store-eu-west/content/pii:S1872206722641676/HIGHRES/image/jpeg/24aafb2c1df03185f35f3eeb0257ab78/gr13_lrg.jpg gr13 gr13_lrg.jpg jpg 529635 1294 1646 IMAGE-HIGH-RES 1-s2.0-S1872206722641676-gr14_lrg.jpg https://s3-eu-west-1.amazonaws.com/prod-ucs-content-store-eu-west/content/pii:S1872206722641676/HIGHRES/image/jpeg/0ab3297331e5e50efd1a7d8ca0742d49/gr14_lrg.jpg gr14 gr14_lrg.jpg jpg 625643 1140 1633 IMAGE-HIGH-RES 1-s2.0-S1872206722641676-gr15_lrg.jpg https://s3-eu-west-1.amazonaws.com/prod-ucs-content-store-eu-west/content/pii:S1872206722641676/HIGHRES/image/jpeg/0d5e80d2f100415ef2abcc16e6f8433c/gr15_lrg.jpg gr15 gr15_lrg.jpg jpg 245149 1172 1350 IMAGE-HIGH-RES 1-s2.0-S1872206722641676-gr16_lrg.jpg https://s3-eu-west-1.amazonaws.com/prod-ucs-content-store-eu-west/content/pii:S1872206722641676/HIGHRES/image/jpeg/f36e59d46d9ff39bd0ef1bebb2b4410a/gr16_lrg.jpg gr16 gr16_lrg.jpg jpg 328857 878 981 IMAGE-HIGH-RES 1-s2.0-S1872206722641676-gr17_lrg.jpg https://s3-eu-west-1.amazonaws.com/prod-ucs-content-store-eu-west/content/pii:S1872206722641676/HIGHRES/image/jpeg/cbcc20dd0374e959f64d26caa72e19ef/gr17_lrg.jpg gr17 gr17_lrg.jpg jpg 402153 946 1575 IMAGE-HIGH-RES 1-s2.0-S1872206722641676-gr18_lrg.jpg https://s3-eu-west-1.amazonaws.com/prod-ucs-content-store-eu-west/content/pii:S1872206722641676/HIGHRES/image/jpeg/7edcd4d4124e6d54b72ff3ba1b746856/gr18_lrg.jpg gr18 gr18_lrg.jpg jpg 819712 1775 1743 IMAGE-HIGH-RES 1-s2.0-S1872206722641676-gr19_lrg.jpg https://s3-eu-west-1.amazonaws.com/prod-ucs-content-store-eu-west/content/pii:S1872206722641676/HIGHRES/image/jpeg/51a83f4fe9fafab89347cd342be7e9a4/gr19_lrg.jpg gr19 gr19_lrg.jpg jpg 566760 1168 1610 IMAGE-HIGH-RES 1-s2.0-S1872206722641676-gr2_lrg.jpg https://s3-eu-west-1.amazonaws.com/prod-ucs-content-store-eu-west/content/pii:S1872206722641676/HIGHRES/image/jpeg/70da87e40e9d6f65b77a1ef47cac2070/gr2_lrg.jpg gr2 gr2_lrg.jpg jpg 75670 323 993 IMAGE-HIGH-RES 1-s2.0-S1872206722641676-gr20_lrg.jpg https://s3-eu-west-1.amazonaws.com/prod-ucs-content-store-eu-west/content/pii:S1872206722641676/HIGHRES/image/jpeg/d5c94084cd6e046c140bf10f0a454ed1/gr20_lrg.jpg gr20 gr20_lrg.jpg jpg 90208 695 681 IMAGE-HIGH-RES 1-s2.0-S1872206722641676-gr3_lrg.jpg https://s3-eu-west-1.amazonaws.com/prod-ucs-content-store-eu-west/content/pii:S1872206722641676/HIGHRES/image/jpeg/b8484798c13ceab3ea6258a42aab5d81/gr3_lrg.jpg gr3 gr3_lrg.jpg jpg 166000 460 1266 IMAGE-HIGH-RES 1-s2.0-S1872206722641676-gr4_lrg.jpg https://s3-eu-west-1.amazonaws.com/prod-ucs-content-store-eu-west/content/pii:S1872206722641676/HIGHRES/image/jpeg/fdccff6d659cd2688c59a8f333f167e2/gr4_lrg.jpg gr4 gr4_lrg.jpg jpg 527686 1155 1136 IMAGE-HIGH-RES 1-s2.0-S1872206722641676-gr5_lrg.jpg https://s3-eu-west-1.amazonaws.com/prod-ucs-content-store-eu-west/content/pii:S1872206722641676/HIGHRES/image/jpeg/cac2677f6362745ef7d97940122f296b/gr5_lrg.jpg gr5 gr5_lrg.jpg jpg 88276 580 984 IMAGE-HIGH-RES 1-s2.0-S1872206722641676-gr6_lrg.jpg https://s3-eu-west-1.amazonaws.com/prod-ucs-content-store-eu-west/content/pii:S1872206722641676/HIGHRES/image/jpeg/e7aab44b2fd5a1261ed4a92100950d6a/gr6_lrg.jpg gr6 gr6_lrg.jpg jpg 621569 1448 1528 IMAGE-HIGH-RES 1-s2.0-S1872206722641676-gr7_lrg.jpg https://s3-eu-west-1.amazonaws.com/prod-ucs-content-store-eu-west/content/pii:S1872206722641676/HIGHRES/image/jpeg/17a36608c13805f3297049d647137235/gr7_lrg.jpg gr7 gr7_lrg.jpg jpg 563289 1433 1481 IMAGE-HIGH-RES 1-s2.0-S1872206722641676-gr8_lrg.jpg https://s3-eu-west-1.amazonaws.com/prod-ucs-content-store-eu-west/content/pii:S1872206722641676/HIGHRES/image/jpeg/c269e479cffcdf0b09d3c37b45bf6d7a/gr8_lrg.jpg gr8 gr8_lrg.jpg jpg 440947 944 1292 IMAGE-HIGH-RES 1-s2.0-S1872206722641676-gr9_lrg.jpg https://s3-eu-west-1.amazonaws.com/prod-ucs-content-store-eu-west/content/pii:S1872206722641676/HIGHRES/image/jpeg/5838f9d8a8a62e65b3daccfb39838d4d/gr9_lrg.jpg gr9 gr9_lrg.jpg jpg 468633 1227 1624 IMAGE-HIGH-RES CHNJC 64167 S1872-2067(22)64167-6 10.1016/S1872-2067(22)64167-6 Dalian Institute of Chemical Physics, the Chinese Academy of Sciences Fig. 1 (a,b) Comparison of the structures between carbon materials quantum dots and MQDs. (c) Functional groups of MQDs for specific functionalization. (d) The structure of novel coronavirus SARS-CoV-2. Reprinted with permission from Ref. [22]. Copyright 2020, Nature Publishing Group. Fig. 2 Modification of surface functional groups of MQDs at single site catalyst (SSC). Fig. 3 (a) Schematic diagram of MXene and MQDs. (b) Comparison of HER overpotentials at current density of 10 mA cm−2 between different metal-based MXene and MQDs. Fig. 4 (a) Mechanistic illustration of NRR and free energy on the Ti-edge of bare MXene, and F, OH position of Ti3C2F2, Ti3C2(OH)2. (b) NH3 yield for the different catalysts. Reprinted with permission from Ref. [47]. Copyright 2020, Wiley. (c) STEM image of Ti3C2 MQDs with defects. (d) Charge density difference of Ti3C2 MQDs. (e,f) Adsorption energy of O2, LiO2 molecules in optimized MQDs structure. (g–i) Charge density difference of Ti3C2 MQDs and adsorption energy of O2, LiO2 molecules. Reprinted with permission from Ref. [51]. Copyright 2021, Wiley. (j) Charge density difference of Ti2CT x MQDs/Cu2O heterogenous structure. (k) Functional groups evolution. Reprinted with permission from Ref. [52]. Copyright 2022, Wiley. Fig. 5 (a) Energy band structure of 2D MXene and 0D MQDs. (b) Photocatalytic mechanism diagram of MQDs. Fig. 6 Design of heterogeneous structure between semiconductor photocatalyst and MQDs. (a) Ti3C2 MQDs as electrons donors in Ti3C2-QD/Ni-MOF heterojunctions. Reprinted with permission from Ref. [57]. Copyright 2020, ACS. (b) Ti3C2 MQDs as electrons acceptors in Ti3C2-QDs/ZnIn2S4/Ti Flower-like heterojunction. Reprinted with permission from Ref. [58]. Copyright 2020, MDPI. (c) Z-Scheme heterostructure of BiVO4@ZnIn2S4/Ti3C2 MQDs composites. Reprinted with permission from Ref. [60]. Copyright 2020, Elsevier. (d–f) S-Scheme heterostructure of TiO2/C3N4/Ti3C2 MQDs composites. Reprinted with permission from Ref. [59]. Copyright 2020, Elsevier. (g) Photoelectrocatalytic mechanism of Co-MQDs. Reprinted with permission from Ref. [61]. Copyright 2020, Wiley. (h) Photoelectrocatalytic mechanism of MQDs as reservoirs of HTL. Reprinted with permission from Ref. [62]. Copyright 2022, Wiley. Fig. 7 Synthesis of Ti3C2T x MQDs with −F, −OH, −O and −NH2 groups (a) and the FTIR spectra of Ti3C2T x MQDs (c). Reprinted with permission from Ref. [64]. Copyright 2017, Wiley. Synthesis of Ti3C2T x MQDs with −F, −OH, −O groups (b) and the FTIR spectra of Ti3C2T x MQDs (d). Reprinted with permission from Ref. [58]. Copyright 2021, MDPI. Synthesis of Ti3C2Cl2 MQDs with −Cl groups (e) and the FTIR of Ti3C2Cl2 MQDs (f). Reprinted with permission from Ref. [72]. Copyright 2022, Elsevier. Synthesis of Ti3C2 MQDs with O–containing groups (g) and the XPS spectra of Ti3C2 MQDs (h). Reprinted with permission from Ref. [73]. Copyright 2017, RSC. Fig. 8 (a) Schematic illustration of and HRTEM image of Ru@CDs. (b) Schematic illustration of and HRTEM image of Ru@PC. (c) Schematic illustration of and HRTEM image of Ru@P-AC. Reprinted with permission from Ref. [89]. Copyright 2020, RSC. (d) Overpotential summarization of Ru and different support, 5 wt% Ru/C catalysts based on Ref. [89]. (e) HRTEM images of N-CDs@Co. Inset: Schematic illustration of N-CDs@Co. Reprinted with permission from Ref. [93]. Copyright 2019, ACS. (f) Overpotential summarization of different CD-based catalysts-based Ref. [93] in 0.5 mol L–1 H2SO4, 1 mol L–1 KOH, respectively. Fig. 9 (a) HAADF-STEM image of Ti3C2 MQDs with edge defects and grain boundary. (b) HAADF-STEM of Ti3C2 MXene nanosheets (MNS). (c) EPR spectra of MQDs/N-C, MNS/N-C and single MQDs/N-C. Reprinted with permission from Ref. [51]. Copyright 2021, Wiley-VCH. (d) Synthesis route of Ti n O2n−1 QDs with oxygen vacancies. (e) EPR spectra of OV-Ti n O2n−1 QDs@porous carbon nanosheets. (f) Adsorption energies of Li2S4 on the surface of Ti n O2n−1 QDs with and without OVs, inset Fig. is crystal structure of Ti3C5 QDs. Reprinted with permission from Ref. [98]. Copyright 2021, Wiley-VCH. (g) Mechanism of defect induced FL. (h) Time-dependent FL intensity of MQDs after adding Ni2+. Reprinted with permission from Ref. [101]. Copyright 2021, ACS. Fig. 10 Total density of states (TDOS) and electronic band structures of Ti8C4O8 (a) and Ti8C4O6P2 (b). Local density of states (LDOS) of Ti8C4O8 (c) and Ti8C4O6P2 (d). (e) Schematic diagram of O 2p orbital orientation vary from O 2px to O 2pz after P doping; Dissociation barrier of H2O and release barrier of H of Ti8C4O8 (f) and Ti8C4O6P2 (g). Reprinted with permission from Ref. [27]. Copyright 2018, Wiley. (h) Mechanistic illustration of hybrid orbital between H and O in V2CO2. (i) Mechanism of hybrid orbital between H and O in V2CO2 after introducing metal atom. (j–l) Difference charge density of V2CO2 after introducing transition metal under the same Ni coverage of 12.5 ML%. (m) Difference charge density of V2CO2 with 16.7 ML% coverage. (n) Gibbs free energy of H adsorption ΔG H at T 0 sites (12.5% ML) as a function of strain. Reprinted with permission from Ref. [28]. Copyright 2016, Wiley. Fig. 11 (a) TEM image of LDH/MQDs. (b) Geometric structure model of LDH/MQD composite. (c) HRTEM image of LDH/MQDs. (d) LSV curves of different catalysts for ORR and OER. Reprinted with permission from Ref. [78]. Copyright 2021, Wiley. (e) TEM image of MoS2 QDs @ Ti3C2MQDs @ MWCNTs. (f,g) LSV curves of different catalysts for ORR and MOR. Reprinted with permission from Ref. [80]. Copyright 2019, Elsevier. (h) Structural schematics of Ti2C MQDs/Cu2O/Cu foam electrocatalyst. (i) LSV curves of Ti2C MQDs/Cu2O/Cu foam for HER reaction. Reprinted with permission from Ref. [52]. Copyright 2022, Wiley. Fig. 12 (a) Self-crosslinked mechanism of graphene QDs. (b) Morphology of self-crosslinked process; TEM image of GQDs-NH2 and SEM images of freeze-dried Ir/GQDs-NH2. Reprinted with permission from Ref. [87]. Copyright 2021, Springer. (c) TEM image of Ru@CQDs, inset: size distribution of the Ru particle. (d) TEM image of Ru@CQDs. (e) LSV curves of different Ru-based catalysts. Reprinted with permission from Ref. [112]. Copyright 2018, Wiley. (f) Model of Pt nanoparticles. (g) Terraces population of (100), (111), and step sites of Pt nanoparticles as a function of Pt particle sizes. Reprinted with permission from Ref. [113]. Copyright 2022, ACS. (h–j) Computational model of bare M2C, Ti2CO2 and Mo2CO2 MXene. Reprinted with permission from Ref. [29]. Copyright 2020, Elsevier. Fig. 13 (a) Atomic force microscope (AFM) image of Ti2CT x MXene nanosheets. (b) Structure models of Ti2CT x with the different amount fluorine atoms. (c) LSV curves of Ti2CT x before and after removing −F groups. Reprinted with permission from Ref. [43]. Copyright 2018, Elsevier. (d) Volcano curves of exchange current (i 0) as a function of the average Gibbs free energy (ΔG a H*). Reprinted with permission from Ref. [108]. Copyright 2017, ACS. (e) Bader charge of V3CNO2−2x (OH)2x at different −OH coverage. (f) Gibbs free energy of hydrogen adsorption on the surface of M3CNO2–2x (OH)2x at different −OH coverage. Reprinted with permission from Ref. [117]. Copyright 2017, Elsevier. (g) Partial density of states (PDOS) of Ti2CT2 with different functional groups. Reprinted with permission from Ref. [119]. Copyright 2013, APS. (h) Gibbs free energy calculation of Ti3C2 MQDs with different functional groups. Reprinted with permission from Ref. [47]. Copyright 2020, Wiley. Fig. 14 (a) TEM image of Ti3C2 MQDs/Cu nanocomposite. (Inset: Inverse Fourier Transform of interface between MQDs and Cu). (b) DOS of Cu side, MQDs side and MQDs/Cu. (c) Charge density difference of MQDs/Cu. (d) NH3 yield of Cu, MQDs and MQDs/Cu electrocatalyst. Reprinted with permission from Ref. [120]. Copyright 2022, Wiley. (e,f) TEM images of WO3/TQDs. (g,h) TEM images of WO3/TQDs/In2S3. (i) UV-vis diffuse reflectance spectroscopy of different catalysts. (j) Photocatalytic activity of different catalysts. (k) Schematic illustration of WO3/TQDs/In2S3. Reprinted with permission from Ref. [75]. Copyright 2021, Elsevier. Fig. 15 Summarizing the characterization techniques of surface functional groups. Reprinted with permission from Ref. [47,72,101,107,124]. Copyright 2020, Wiley & Copyright 2021, ACS & Copyright 2021, Wiley & Copyright 2021, Elsevier & Copyright 2021, Elsevier, respectively. Fig. 16 (a) Atomic-resolution HAADF images of Cl-terminated layered Ti3C2 MXene. Insets: the enlarged views of the atomic positions correspond to crystal structure of the right, and the atomic-scale EDS maps. Reprinted with permission from Ref. [125]. Copyright 2021, Springer Nature. (b) HAADF image of Ti3C2Br2 MXene sheets. (c) Line scan profile of elemental analysis. Reprinted with permission from Ref. [126]. Copyright 2020, AAAS. (d) HAADF-STEM image of Ti3C2 MQDs clusters. (e) HAADF-STEM and TEM images of single Ti3C2 MQDs. Reprinted with permission from Ref. [51]. Copyright 2021, Wiley. Fig. 17 In-situ/operando characterization technique of CF-O and CF-FeSO catalysts. (a) In-situ/operando Raman spectroscopy electrochemical cell. (b) Raman spectroscopy of CF-O. (c) Raman spectroscopy of CF-FeSO. (d) In-situ/operando NEXAFS electrochemical cell. (e) Co-K edge XANES spectrum. (f) Co L-edge NEXAFS spectrum. Reprinted with permission from Ref. [130]. Copyright 2022, Springer Nature. Fig. 18 (a) Morphology of β-CoOOH particles at different voltage (Scale bars: 500 nm). (b) Variation of CoO layers with the change of voltage. (c) Line scan of nanoparticles height (top) and the relationship of height-voltage (bottom). (d) Operando STXM equipment. (e) STXM-XAS spectra of Co LIII-edge. (f) Steady-state voltage-dependent phase images of β-Co(OH)2 nanoparticles. Scale bar, 1 μm. Reprinted with permission from Ref. [131]. Copyright 2021, Springer Nature. (g) In-situ APXPS equipment. (h) APXPS spectra of Co2p 3/2. Reprinted with permission from Ref. [132]. Copyright 2017, ACS. (i) Operando XRD patterns of the NiCeO x H y catalyst under different potentials. Reprinted with permission from Ref. [133]. Copyright 2018, Nature Publishing Group. Fig. 19 Energy band structure of Ti2C MXene (a), Ti2CO2 (b), and Ti2C(OH)2 (c). (d) Surface Pourbaix diagrams of Ti2C. (e) Stability of Ti2C with different O* and OH* species. Reprinted with permission from Ref. [108]. Copyright 2016, ACS. (f) Interface structure model of Cr2CO2. (g) Gibbs free energy of Cr2CO2 at different H coverage. Reprinted with permission from Ref. [137]. Copyright 2019, ACS. (h–j) Structure models of NC, MoC, and MoC@NC. (k) HER free energy diagram of NC, MoC, and MoC@NC. Reprinted with permission from Ref. [138]. Copyright 2022, Wiley-VCH. (l) HER activation energy calculation of catalysts. Reprinted with permission from Ref. [139]. Copyright 2018, Springer Nature. Fig. 20 The challenges of MQDs. Table 1 The controllable synthesis and applications of MQDs. MQDs Type of groups Synthesis Catalytic applications Ref. Ti3C2T x −O, –OH, –F Hydrothermal Water oxidation [62] Ti3C2(OH)2 −OH Alkalization treatment Electrocatalytic N2 reduction [47] Ti3C2T x −O, –OH, –F, –Cl Cell-crushing Photocatalytic HER [58] Ti2CT x −O, –OH, –Cl Acid treatment Electrocatalytic HER [52] Ti3C2T x −O, –OH, –F hydrothermal Photocatalytic N2 photofixation [74] Ti3C2T x −O, –OH, –F, –Cl Sonication Electrocatalytic HER [32] V2CT x −O, –OH, –F Sonication Electrocatalytic HER [32] Nb2CT x −O, –OH, –F, –Cl Sonication Electrocatalytic HER [32] Ti3C2T x −O, –OH, –F, –Cl Sonication Photocatalytic Cr4+ reduction, BPA oxidation [75] Ti3C2T x −O, –OH, –F Solvothermal Li-O2 Batteries [51] Ti3C2T x −O, –OH, –F, –NH2 Sonication Photocatalytic H2O2 production [76] Ti3C2T x −O, –OH, –F, –Cl Sonication Photocatalytic TC degradation [77] Ti3C2T x −O, –OH, –F Hydrothermal Zinc–air batteries [78] Ti3C2T x −O, –OH, –F Reflux Photocatalytic NO [79] Ti3C2T x −O, –OH, –F Hydrothermal Photocatalytic N2 reduction [57] Ti3C2T x −O, –OH, –F Hydrothermal Photocatalytic CO2 reduction [59] Ti3C2T x −O, –OH, –F Hydrothermal Photocatalytic water splitting [60] Ti3C2T x −O, –OH, –F Hydrothermal Electrocatalytic ORR, MOR [80] Ti3C2T x −O, –OH, –F Hydrothermal Photocatalytic HER [81] Ti3C2T x −O, –OH, –F Hydrothermal Photocatalytic CO2 reduction [55] Available online 20 October 2022 This work was supported by the National Natural Science Foundation of China (51872115, 51932003), and 2020 International Cooperation Project of the Department of Science and Technology of Jilin Province (20200801001GH). Review Surface chemistry of MXene quantum dots: Virus mechanism-inspired mini-lab for catalysis Yuhua Liu Wei Zhang * Weitao Zheng # Key Laboratory of Automobile Materials MOE, and School of Materials Science & Engineering, and Jilin Provincial International Cooperation Key Laboratory of High-Efficiency Clean Energy Materials, and Electron Microscopy Center, and International Center of Future Science, Jilin University, Changchun 130012, Jilin, China Key Laboratory of Automobile Materials MOE and School of Materials Science & Engineering and Jilin Provincial International Cooperation Key Laboratory of High-Efficiency Clean Energy Materials and Electron Microscopy Center and International Center of Future Science Jilin University Changchun Jilin 130012 China Key Laboratory of Automobile Materials MOE, and School of Materials Science & Engineering, and Jilin Provincial International Cooperation Key Laboratory of High-Efficiency Clean Energy Materials, and Electron Microscopy Center, and International Center of Future Science, Jilin University, Changchun 130012, Jilin, China * Corresponding author. Tel/Fax: +86-431-85167218 Tel/Fax: +86-431-85167218 # Corresponding author. Tel/Fax: +86-431-85168246 Tel/Fax: +86-431-85168246 Scientific research is currently more interdisciplinary. Researchers have parsed the surface structure of virus, constructed the interaction model of virus-receptors, offering the clues for studying efficient targeted drugs. Likewise, catalysis is also highly relevant to modern human life. Exploring the surface structure and physicochemical properties of catalysts is of great significance for the design of efficient catalysts. Great progresses have been made for endowing specific physicochemical properties of catalysts through controlling the size of materials and coordination chemistry of active sites, particularly at nanometer scale since Sir John Meurig Thomas and Tao Zhang's early ground-breaking contribution, with casting on a very surface issue. Herein, functional regulation renders the emerging MXene quantum dots (MQDs) excel in contrast to the typical carbon-based quantum dots. In fact, similar to the interaction of virus-receptors model, the surface functional groups decorated MQDs provide a mini-lab to afford a variety of adjustments, involved with the type modification and electronic structure tuning of groups as well as their arrangement, together with the interaction between the groups and active materials/support, ultimately for packaging or designing high-activity catalysts. Graphical Abstract XXX Keywords Surface chemistry Functional group Structure characterization MXene Quantum dot 1 Introduction In top-down styles, single site heterogeneous catalyst (SSHC) initiated by Sir John Meurig Thomas affords to modify the structure of active site centers, where each single sites meet the same energy (the interaction of active site-reactant), leading to a high catalytic selectivity [1]. In 2011, the emergence of single atoms (SAs) broke out this idealization, and the exploration of interaction between SAs and coordinatively unsaturated support becomes one of the central issues [2]. As the smallest functional materials, SAs can achieve chemical catalysis and physical manipulation, uncovering a newly-discovered fertile area [3–5]. This is perfect feedback to Richard Feynman's saying (Nobel Laureate, 1965) “There is Plenty of Room at the Bottom” in 1959, revealing the possibility to manipulate and control of matter at the nanoscale [6]. Such breakthrough inheriting regulation of the coordination environment and electronic structure of active sites in SSHC. Obviously, engineering the active sites offers unlimited possibility for guiding the design of catalysts towards expected properties. For the catalytic activity, however, the fully exposed Pd metal clusters are superior to Pd SAs, representing atomic dispersion shall not always beneficial to a catalytic reaction [7]. Invertedly for the extremely smaller (top-down), a slight bottom-up of extending to dual-atoms, tri-atoms, and even clusters [8,9], as well as constructing the exposed planes toward the desired activities enables shaping and maximizing the reactivity and atom utilization. Demonstrably, these pioneering views showed that controlling the size of materials, and the charge structure of active sites have profound impact on their catalytic activity. It is worth mentioning that the reduction of size increases the contact areas of catalyst with reaction environment, inducing a high surface reactivity per unit mass [10,11]. Thus, the surface chemistry of catalyst affects the adsorption and desorption of reactants, intermediates and products. Such relationship of surface − reaction activity is traced back to explore the reaction mechanism of ammonia synthesis (invented by Fritz Haber, Nobel Laureate 1918) [12], that is, the decisive step lies in the interaction of N2 with the catalyst surface to promote N≡N cleavage (improved by Carl Bosch, Nobel Laureate 1931) [13–16]. This is consistent with “the theory of surface adsorption chemical bond” in heterogeneous catalysis proposed by Dayu Zhang in 1960 [17], with which the adsorption heat and number of active centers determine the activity of catalyst. Reducing the size of bulk materials to the nanoscale of 2–10 nm, the fundamental changes occur for the physicochemical properties, e.g., quantum confinement effects and small size effect [18–20], thereby affecting the catalytic activity. The development of semiconductor quantum dots has witnessed from carbon materials to MXene, including carbon nanodots (CNDs), carbon quantum dots (CQDs), graphene quantum dots (GQDs), carbonized polymer dots (CPDs), and MXene quantum dots (MQDs). In MQDs, MXene with long-range ordered MX atom arrangement obtained by selectively etching “A” atom layers from the MAX (M: transition metal, X: carbides, nitrides or carbonitrides, A: IIIA metal). In addition, the surface functional groups of QDs play a decisive role in catalytic reactions. Nevertheless, the construction of crystal lattice far exceeds the simplicity of carbon, bring more expected tremendous performance change as translational-symmetry interior and termination (Figs. 1(a) and (b) ) [21]. Currently, more efforts are made to explore the surface chemistry of 2D MXene for improving their catalytic activity. Controlling the type, contents of functional groups favor for selecting favorable catalytic sites; also constructing 2D MXene-based heterostructure enables maximizing the number of active sites, where the negative groups play an important role in hierarchical structure [23–26]. Moreover, as density functional theory (DFT) also shows, as the surface groups sites of 2D MXene can be decorated by heteroatoms, it can tune effectively the interaction between reactants and active site [27–29]. As such surface chemistry provides the opportunities to tailor the interaction of surface-environment, it is particularly important for the MQDs with high surface energy. However, there are seldom reports concerning with such engineering strategy in MQDs (Fig. 1(c)). Such nanotechnology is similar to study the interaction between the raised coronal spike glycoprotein at coronavirus outer layer (Fig. 1(d)) and surface receptor of angiotensin-converting enzyme 2 (ACE2), for further developing the delicate drugs and therapy antibody that inhibits their contact, which is an exciting progress [22]. Herein, as single site chemical species of MQDs, surface functional groups can serve as a mini-lab, providing plenty of room to design MQDs-based catalysts (Fig. 2 ). 2 Mechanism of catalysis 2.1 Electrocatalysis Currently, MXene has been widely used in electrocatalytic hydrogen evolution reaction (HER), oxygen evolution reaction (OER), oxygen reduction reaction (ORR) and nitrogen reduction reaction (NRR) [24,30,31]. The surface functional sites of MXene as adsorption and desorption location of reactants and products, plays an important role in catalytic reaction. However, compared to 2D MXene nanosheets and 1D nanowires, 0D MQDs possess unique surface effect, size effect and edge effect, endowing excellent catalytic activity (Fig. 3(a) ). Most research shows that 0D MQDs provide abundant edge active sites, affording the properties superior to 2D counterparts (Fig. 3(b)) [32–44]. In different electrocatalytic reactions, it depends on the binding energy required for the thermodynamic rate-determining step in order to identify the real active sites in functional groups. Usually, the surface of MXene will be covered by preparation–derived electronegative groups, such as −F, −OH, −Cl, etc. [45,46]. Jin et al. [47] calculated the free energy of Ti-edge, Ti atoms in perfect plane, −OH and −F (Fig. 4(a) ). It shows that higher active Ti-edge sites and −OH groups are favorable for NRR; the bare Ti-edge and −F groups provide good HER activity. Thus, the DFT results guide for the synthesis of Ti3C2OH MQDs with abundant Ti-edge sites, which, together with −OH, promote the adsorption and activation of N2 molecules. As a result, it contributes to excellent NRR performance, and the yield of NH3 is far higher than 2D Ti3C2T x MXene and Ti3C2F2 (Fig. 4(b)). Furthermore, 2D Ti2C MXene with abundant −F terminal has shown higher HER activity, which is consistent with the DFT result [43]. Except for the surface functional group as active sites, constructing surface defects in MQDs can also promote the electrocatalytic reaction. The defect sites with high activation energy are beneficial to adjust the adsorption of reactant. It is noticed that Ti-edges are almost inert during electrocatalytic HER [48–50]. However, compared to 2D MXene nanosheet, the introduction of defects (grain boundary, edge defects) in MQDs contributes to optimize local unsaturated coordination state of active sites and low coordinated Ti/C atoms. As a result, the variation of electronic structure of catalysts is induced, leading to a favorable rearrangement of electrons (Figs. 4(c), (d), and (g)). Thus, the adsorption energy of O2 and LiO2, and overall electrocatalytic reaction kinetics were enhanced tremendously for Li-O2 batteries (Figs. 4(e), (f), (h), and (i)) [51]. Moreover, designing MQDs-based heterostructure catalyst helps to integrate the advantages of different components, and the interface interaction between phases can facilitate high-effective electrons transfer for the promising stability of catalytic reaction. For example, Liu et al. [52] synthesized Ti2CT x MQDs/Cu2O/Cu foam heterostructure by self-assemble method. The presence of Cu2O not only promotes the distribution of MQDs, but also the excellent interface charge transfer enhances charge transfer efficiency (Fig. 4(j)). Finally, the abundant oxygen functional groups were produced via spontaneous substitution in MQDs as catalytic active sites, and thereof outstanding HER performance and stability is achieved (Fig. 4(k)). The activity of MQDs is superior to 2D Ti2CT x MXene nanosheet, ascribed to the abundant edge effect and heterogeneous interface of 0D MQDs. In summary, the electrocatalytic mechanism of MQDs is mainly correlated to the adsorption and desorption of reactants (H2O, H3O+, N2, O2, CH4), products (H2, H2O2, NH3), occurring at the active sites of MQDs. Parsing the interaction between active sites and reactants/products is similar to the study of receptor binding domain of the new coronavirus S protein, protecting the interaction of new coronavirus from infecting human cells (e.g., coronavirus-ACE2) [53], identifying the structure of active sites for an optimal design. Some strategies such as controlling the types of surface functional groups, constructing MQDs-based heterostructure, introducing surface defects, etc. have been used to improved electrode reaction process. Currently, it is the fertile land for the electrocatalytic application of MQDs, more mechanism remains to be explored. 2.2 Photocatalysis Compared to 2D MXene nanosheet, the energy level splitting of 0D MQDs near the Femi level is due to quantum confinement effect, leading to the controllable bandgap (Fig. 5(a) ). Thus, it improves the utilization of visible light, enabling that the photocatalytic activity can be effectively regulated [54,55]. To improve poor activity of semiconductors photocatalyst, the introduction of MQDs as co-catalyst is an effective strategy. Moreover, as an excellent photocatalyst, there are some factors needs to be considered [56]: (1) Broad spectral response range for producing more photogenerated electrons. (2) Suitable energy band position for avoiding recombination of photogenerated carriers. (3) Long-term stability. (4) Strong redox ability. Therefore, on the one hand, the photoluminescence behavior of MQDs helps to enhance light adsorption range, on the other hand, construct heterogeneous junction based on the energy level position of MQDs and catalyst, as it can effectively increase the extraction of photogenerated electrons, contributing to fast surface redox reactions (Fig. 5(b)). Currently, a variety of possible mechanisms have been proposed for construction of MQDs-based heterojunction catalysts. When the photocatalyst is irradiated by simulated solar light, the photocatalyst absorbs photons, and then electrons are excited from valence band (VB) of the catalyst to the conduction band (CB), while leaving holes in the VB. Also, the unstable photons are prone to easily spontaneous transit back to the VB, and recombine with holes, thereby reducing the lifetime of photogenerated carriers. Ascribed to the abundant surface functional groups of MQDs, it is easily offered to combine with other semiconductor photocatalysts. Thus, it is important for optimizing interfacial charge transfer between the heterojunctions to promote photocatalytic activity. Moreover, the position of CB and VB can be calculated on the basis on the spectral data of different materials, which contributes to simulate the migration path of electron-hole pairs, and understand the reaction mechanism. For example, Fig. 6(a) show the energy band structure of Ti3C2 MQDs and Ni-MOF [57]. The internal electric field (IEF) is generated at the interface, which promotes the transfer of electrons and holes. Also, MQDs not only act as electron donors for Ni-MOF, avoiding the recombination of photogenerated electron-hole pairs in MQDs, enhancing the NRR, but also promoting the process of oxidation reaction from SO3 2– to SO4 2–. Conversely, the MQDs as electrons acceptors, constructing Schottky junction barrier is another effectively strategy for enhancing extraction of photogenerated electron (Fig. 6(b)) [58]. In addition, the Z-Scheme (Fig. 6(c)) and S-Scheme (Figs. 6(d)–(f)) heterojunction photocatalysts are also designed for improving the separation of electron-hole pairs [59,60]. For either two phase or three-phase interfaces, the charge redistribution induced bending of the band edge and formatting an IEF at the interfaces, until their Fermi levels reached the equilibrium. However, most research concentrates on the design of energy band structure in MQDs-based co-catalysts, whereas the impact of surface chemistry is neglected on the light response and redox activity. Therefore, it is necessary to explore more surface modification strategy of MQDs in photocatalytic reaction. 2.3 Photoelectrocatalysis Compared to the electrocatalysis and photocatalysis, the photoelectrocatalysis integrates the advantages of light drive and electric drive. The catalytic reaction is conducted in the simple photoelectrochemical devices. However, their mechanisms are similar. It is need to strictly control light adsorption ability, photogenerated carriers’ separation and surface redox sites. Different from the construction of heterostructure photocatalysis, the introduction of metal cobalt-nanoparticle leads to formation of Co-Ti3C2 MQD Janus-structured, and thereof induces the electron transfer from Co to MQDs (Fig. 6(g)). It not only contributes to promote the broad optical response range and strong light harvesting efficiency of MQD, but also forms Schottky junction that can effectively avoid the photogenerated electron–hole pairs recombination, thereby leading to fast water oxidation dynamics [61]. Furthermore, the MQDs can also couple with photoanode of hole transfer layer (HTL), serve as the reservoirs of photogenerated charges, improving the photogenerated carriers’ separation (Fig. 6(h)) [62]. However, there are seldom research on photoelectrocatalysis of MQDs, and more reaction mechanism remains to be explored. 3 Controllable synthesis of functional groups in MQDs The researchers analyzed the interaction domains between viruses and human proteins for tailoring targeted drugs and disrupt the interaction. Inspired by such scenario, the surface groups of MQDs were customized to synthesize efficient catalytic active sites for chemical reactions. The surface functional groups of MQDs (e.g., −O, −OH, −Cl, −Br, −F, −NH2) plays an important role in different catalytic reaction, including the adsorption of reactants, and control the interaction of heterogeneous interface. Therefore, its controllable synthesis is required. At present, there are some articles addressing the synthesis of MQDs with specific functional groups (Table 1 ). The type of functional groups relates to the choice of etchant, added inorganic ions, and subsequent processing during the preparation of 2D MXene. Currently, the precursor material of MQDs is usually 2D MXene, thus the functional groups of MQDs depend on the 2D counterpart. The preparation of 2D MXene is mainly divided into fluorine-containing and fluorine-free routes, leading to the −F groups on surface of MQDs. The fluorine-containing etchants includes HF acid and NH4F2, while the HCl + LiF etchant can introduce two groups of −F and −Cl [63]. Furthermore, the etch routes of water–contains will introduce abundant oxygen groups (–O, −OH), with the contents of −O higher than −OH. Currently, the presence of −F is beneficial to promote the proton adsorption kinetics, and induced excellent HER performance [43]. Therefore, the MQDs with the mixed of −F, −O and −OH groups can be prepared via hydrothermal, solvothermal, mechanical ultrasound, and microwave irradiation methods (Figs. 7(a) and (b) ). The Fourier Transform Infrared spectroscopy (FTIR) confirms the formation of functional groups (Figs. 7(c) and (d)) [58,64]. However, considering the characteristics of safe and environmentally friendly, F-free routes such as Lewis acidic etching (e.g., ZnCl2, CuCl2) [65,66], alkaline etching (e.g., NaOH, TMAOH) [67–69], enable obtaining the MXene completely covered by −Cl or −OH groups. Moreover, the electrochemical etching is also another strategy, and the groups relate to the electrolyte [37]. In addition, for determining the role of single group in catalysis, the alkalinization and annealing is applied to obtain −OH and −O groups, respectively [40,43,70,71]. For example, the Ti3C2Cl2 MXene was prepared by Lewis acidic etching (CdCl2), and then the QDs-Ti3C2Cl2 was synthesized via hydrothermal routes (Figs. 7(e) and (f)) [72]. Such single groups contribute to explore the real catalytic active sites. Therefore, controlling the surface groups of MQDs by adjusting the surface functional groups of 2D MXene requires complex steps, and there are many factors to be controlled, which is not conducive to obtaining high-quality MQDs (purity, crystallinity, atomic arrangement, and defects). In contrast, the single functional groups obtained during the preparation of quantum dots have been reported. Simultaneously, the substitution reaction of functional groups also occurs. For instance, the −OH groups terminated Ti3C2 MQDs can be synthesized via alkalization of NaOH and mechanical shearing. The −F groups of MXene via HF etching were substituted by −OH in this process [47]. Similarly, the −Cl groups can also be substituted by −O groups during electrochemical reaction process, which relate to the electronegativity of groups [52]. Moreover, for avoiding the F-containing etching, Xu et al. [73] prepared Ti3C2 MQDs with −O and −OH by sonication route. The interaction of tetrabutylammonium hydroxide (TBAOH) and Al atomic layer induced the successful exfoliation of MXene, and further bath sonication promotes the formation of MQDs (Fig. 7(g)), and the X-ray photoelectron spectroscopy (XPS) shows the presence of O-containing groups (Fig. 7(h)). The catalytic activity of O-containing groups can be clearly researched due to no other effects of functional groups. Therefore, the surface functional groups can be effectively controlled by muti-steps or simple routes, which contribute to the detailed research for different catalytic reaction. 4 Design principles of Single site chemistry in MQDs Since 2017, it has witnessed the soaring development of 2D MXene derived MQDs, however, remains to be exploratory stage in their synthesis and application. Different from the formation of surface functional groups at carbon quantum dots, the groups of MQDs are originated from the electronegative groups (–F, −Cl, −O, and −OH) adsorbed on the highly active M–terminals during the etching of the “A” layers of MAX phase [82]. Thus, the catalytic performance of MQDs is inseparable from their parent MXenes. Furthermore, various types of functional groups are not conducive to figure out the real catalytic active sites. Understanding the role of specific groups is of great significance for identifying real catalytic active sites, illustrating the reaction mechanism, and revealing the real catalytic process. Currently, identifying the role of CDs, and designing of active sites of CDs-based catalysts has been gradually mature. However, MQDs as an emerging nanomaterial, there is seldom report on the single site modification methods in catalytic field. As a result, we discuss the design principle of MQDs learned from CD-based catalyst. 4.1 Importance of functional groups Researchers have identified many randomly arranged spike proteins on the surface of each new coronavirus particle (virion), meaning they are the key to the fusion of the virus and human cells. In parallel to such importance, surface functional groups may offer their practical application as an important component of MQDs. In the functional CQDs, GQDs and CPDs, benefited from surface defects (functional groups) and abundant edge sites, many works have demonstrated that the surface groups of CDs play important roles in electrocatalysis [83–85]. However, as the advantage of functional groups lies at not just a matter of size, it affords more unique properties from the chemistry to nanoscience. For example, the free-standing silicon nanoparticles with chiral achieved by the synergy effects between the surface functional groups of tryptophan and Si [86], highlighting the importance of ligand chemistry. Furthermore, at the nanoscale, the GQDs with −NH2 functional groups has the nontoxic and environmentally friendly merits, acting as the carbon support to anchor single atoms [87]. The strong chelation effect between the metal cations and −NH2 avoid the aggregation of metal atoms, and limit the growth and size of single atoms by spatial confinement [88]. Reunion of noble metal Ru is the main reason for the decline of electrocatalytic activity. Li et al. [89] reported three support of Ru nanoparticles. Benefiting from the strong interaction between functional groups of CDs and d orbitals of Ru, the aggregation of Ru is limited, leading to high crystallinity of Ru@CDs (Fig. 8(a) ). On the contrary, the Ru@Porphyra (PC) and Ru@activated carbon (AC) shows obvious aggregation (Figs. 8(b) and (c)), contributing to the poor catalytic activity (Fig. 8(d)). Meanwhile, the surface groups further promote the inter-connection of QDs, or splicing/self-cross-linking into a layered conductive network, offering abundant edges and terminations, maximizing the interaction between electrolytes, reactants and electrons [90–92]. Furthermore, the presence of small size QDs can limit the morphology by the interaction of QDs-metal, leading to optimized interfaces. For example, the Co nanoparticles are encapsulated by N-CD, enable the controlled growth of uniform Co morphology and avoid the oxidation of Co2+ [93]. The TEM image clearly shows the existence of the carbon shell (Fig. 8(e)). Such confinement effect makes the cobalt catalysis the maximized activity (Fig. 8(f)). Simultaneously, the small size of QDs is factually a pool of more anchored sites to increase the loadings of single atoms. Under the same interaction, the QDs with O-containing functional groups as the tethered sites to anchor transition metal single atoms, achieving high catalytic selectivity and activity [94]. It is worth mentioning that when QDs are used as a functional carrier, the electronic metal-support interaction (EMSI) promotes electrons redistribution at interface, accelerating the reaction process, which is similar to the well-known strong metal-support interaction (SMSI) [95]. In contrast, the surface functional groups of MQDs provides favorable catalytic activity. Thus, it is needed to consider controlling both the types of surface functional group and the degree of oxidation of surface oxygen functional groups of MQDs, and further modifying the functional groups to reduce the catalytic reaction energy barrier [96,97]. Additionally, as MQDs as the emerging disciplines of nanomaterials, the unique surface advantage provides more possibility and promises for designing high-performance catalyst. 4.2 Importance of surface defects For electrocatalysis, surface defects can improve local unsaturated coordination state of active sites. Thus, it helps to control electronic structure, reduce the binding energy between catalyst surface and reactants, thereby enhancing the oxide reaction kineties. For example, Wang et al. [51] synthesizes Ti3C2 MQDs clusters offered with rich crystal defects. Compared to layered MXene, 0D MQDs shows abundant edge defects and grain boundary (Figs. 9(a) and (b) ). Such defects can be confirmed by electron paramagnetic resonance spectra (EPR) (Fig. 9(c)). Experiments combined with DFT calculations indicate that this crystal defect-controlled catalytic center provides a fundamental role in inducing charge density delocalization, regulating Li x O y intermediate adsorption, and reducing redox energy barriers. In another example, the H2O2 oxidation promote the production of Ti n O2n−1 quantum dots abundant with oxygen vacancies (Figs. 9(d) and (e)) [98]. It regulates the adsorption and conversion of Li2S4 (Fig. 9(f)), and thus improving the stability and long-Life of Li-S batteries. However, the application of surface defects of MQDs in other electrocatalytic reaction (e.g., HER, OER, ORR) remains to be achieved. For photocatalysis, the light response range and photogenerated electrons-hole pairs separation ability determines reaction rate. Research shows that the functional modification can induce fluorescence quenching by the interaction between groups (e.g., metal ions), thereof avoiding the carrier's recombination [99,100]. Moreover, the effect of surface defects in MQDs on the photoluminescence properties is mainly attributed to the recombination pathway variation of excitons (Fig. 9(g)), and it is beneficial to the overall photocatalytic reaction. Such mechanism can explain that photo-excited electrons may first relax to the defect energy level, leading to a change in the dynamic direction of the excitons, and thereof resulting in non-radiative transitions. As a result, the luminescent capability of quantum dots will be weakened. Ai et al. [101] studied amino-functionalized Ti3C2 MQDs, and the interaction between −NH2 and oxygen-containing groups induced bright blue fluorescence (FL). The FL mechanism is found to be attributed to surface defects and size effects. And then, the introduction of Ni2+ contributed to the FL quenching (Fig. 9(h)). It provides an idea that help to design excellent photocatalysts with high extraction rate of photogenerated electrons. In the wet chemical etching process of MXene, the research has shown that MXenes enable producing different types of surface defects (metal vacancies, or C/N vacancies), which due to the differences of chemical environment (pH, type of functional group, applied voltage) [102]. However, there are seldom reports on the application of surface defects of MQDs in photocatalysis, and the formation mechanism of surface defect remains to be further identified. 4.3 Importance of support The metal-free carbon is not an ideal choice of catalyst, but their excellent conductivity is the first choice for preparing composites. In contrast, CQDs with amounts of edge sites can act as the active sites to promote the adsorption and desorption of reactants and productions. Similar to carbon-based QDs, MQDs can also serve as ideal support due to abundant surface functional groups. However, the difference lies in the functional groups of MQDs such as −O, −OH possess favorable catalytic activity for NRR and HER. However, the high surface energy of quantum dots is prone to induce several aggregations. The strong interface coupling between QDs and support (e.g., graphene, nanosheets, MOF, nanowires) can enhance the electron transfer, toward achieving highly catalytic performance [90,103]. Moreover, designing the heterostructure of MQD-support requires to consider the interaction mechanism, including electron transfer path, interface reaction kinetics and the coordination state of groups and the surface of support. 5 Modification strategy of unit point chemistry in MQDs Controlling the electronic structure and physiochemistry properties of MQDs contributes to improve catalytic activity. Research on MQDs in catalysis remains in a booming stage. Therefore, there are seldom reports on design methods of MQDs-based catalyst. Herein, we summarize the present five design strategies, which reveals underlying mechanisms for improving activity depending on both experiments and theory, which can be divided into heteroatomic doping, coordination effect, crosslinked carrier, functional groups substitution and constructing heterojunction. 5.1 Heteroatomic doping Some non-metal atoms (e.g., N, S, Cl and P) has been regarded as ideal dopants for adjusting photoluminescence behavior of MQDs, thereby improving spectral response range and light stability [104–107], which is beneficial to achieve good photocatalytic performance. However, the application of such unique optical properties in the field of photocatalysis remains to be further verified. Moreover, DFT calculation shows that non-metallic P atoms doping helps to narrow the band gap of 2D MXene, thereby improving conductivity (Figs. 10(a)–(d) ). And, the introduction of P atoms also affects the overlap of O 2px orbital and H-1s orbital, facilitating the interaction of O–H (Fig. 10(e)), and accelerating the dissociation processes of H2O molecule and the release of H atoms (Figs. 10(f), (g)). Thus, compared to 2D MXene, 0D MQDs possess broader bandgap due to quantum confinement effect, and such optimization of electronic structure can be applied to electrocatalysis. Furthermore, DFT and experiment shows that the oxygen groups of MXene as real catalytic active sites provide excellent HER performance [40,108]. Also, metal atoms (e.g., Fe, Co, Ni and Mn) can act as dopants to further improve HER activity by controlling the single sites (functional group) activity. The interaction between H and O atoms will be weaken via the electrons transfer of metal-O (Figs. 10(h), (i)). Furthermore, the electronic density near the active sites is related to the electronegative of metal. For example, Ni (1.92) > Co (1.88) > Fe (1.83), the difference charge density (Figs. 10(j)–(m)) shows that the number of electrons transported is different from metal to oxygen, thereby affecting the Gibbs free energy of H atoms. Also, the adsorption position of reactants, and the coverage rate of H atoms can also be considered (Fig. 10(n)). In summary, since there are no reports concerning the effect of heteroatomic doping on catalysis performance in MQDs, we summarize the typical theoretical aspects, contributing to guide the design of MQDs-based catalysts. 5.2 Coordination effect MQDs possess high surface energy due to size effect. Thus, in order to efficiently stabilize quantum dots, and avoid self-aggregation during synthesis and catalysis, the selection of supports is crucial. Currently, different dimensional nanomaterials are frequently selected as support, such as 3D porous metal foam, 2D nanosheets, 1D nanowires. Usually, the selectivity of support needs to meet high conductivity, acid or alkaline solution resistant, and provide excellent interfacial contact with MQDs for promoting efficient interfacial charge transfer capability. For example, the prepared Ti3C2 MQDs by Han et al. [78] are dispersed 2D NiFe layered double hydroxide nanosheet (Figs. 11(a), (c) ), benefited from the electronically coupled of Ni, Fe ions and oxygen functional groups on the surface of MQDs (Fig. 11(b)). The interface charge transfer induced the valence state change, thereby enhancing the electronic conductivity of NiFe LDH. Compared to 0D MQDs, NiFe LDH/MQDs shows excellent OER and ORR performance (Fig. 11(d)). Meanwhile, the presence of 3D porous nitrogen-doped graphene further facilitates mass/ion transport, and exposes more active sites. Moreover, 1D nanowires provides short ions/electrons transmission distance. The Ti3C2 MQDs and MoS2 MQDs were dispersed in the multiwall carbon nanotubes (Fig. 11(e)), and the introduction of QDs induced well-defined interface, thereby promoting the fast charge and ion transfer during ORR and methanol oxidation reaction (Figs. 11(f), (g)) [80]. Different from 2D and 1D nanomaterials, 3D porous structure metal foam not only meets the aforementioned advantages, but also conducive to fully wetting the electrolyte, and releasing the gas-phase products timely, thus promoting highly-efficient HER activity (Figs. 11(h) and (i)) [52]. Therefore, when designing MQDs-based catalyst, it is necessary to consider the coordination effect of MQDs, which has great promotion effect on final performance. 5.3 Crosslinked carrier MXene has been regarded as an ideal carrier due to their tunable band gap, high specific surface area, excellent electronic conductivity and carrier mobility, and high mechanical stability [49,109–111]. Compared to 2D MXene, the unique advantages of MQDs as carrier are that the size of MQDs can be applied to limit the growth of single atoms, nanoparticles, leading to the excellent dispersion. However, such strategy has not been reported so far. In contrast, the carbon-based QDs has been widely studied. In CDs-based catalysts, the self-crosslinked carbon network can be formed via surface functional groups interaction (e.g., −COOH, =O, −NH2), for anchoring single atoms, nanoparticles (Figs. 12(a) and (b) ) [87]. The interaction between functional groups and metal nanoparticles can also limit the aggregation and growth of particles, promising the stability of the reaction process (Figs. 12(c)–(e)) [112]. Such strategy has been wildly popularized. However, there is almost no activity for the CDs with different surface functional groups, which is a flexible support. In contrast, the internal structure of MQDs is complicate. Compositional diversity determines the different structures, resulting in different physicochemical properties. Also, many articles shows that MQDs with different groups terminal provide outstanding electrocatalytic activity [47,52]. In addition, when reducing the size of MXene, the exposed crystal planes may vary, thereof inducing the different catalytic performance of MQDs. For example, DFT calculation shows that the binding energy of Pt-OHad in the surface of Pt nanoparticles will change with size, contributing to the variation of intrinsic activity in different sites (edge, step, terrace) (Fig. 12(f)). And, the activity of Pt (111) and Pt (100) in the real catalytic active sites (terrace sites) are also different (Fig. 12(g)) [113]. Therefore, the functional groups of MQDs can exist in different positions, also leading to the activity difference. For instance, DFT calculation shows that the oxygen can adsorb on the four possible positions (top, fcc, hcp, and bridge) (Fig. 12(h)) [29], and the preferential adsorption sites of oxygen functional groups depend on the detailed MXene compositions. For instance, the O atoms prefer to adsorb on the fcc sites on both sides for Ti2CO2. Whereas for Mo2CO2, the most stable sites are hcp sites, which induced the difference of binding energy between H and O (Figs. 12(i) and (j)). As a result, MQDs-based nanocomposites will exhibit different catalytic performance after self-crosslinking carriers. Currently, such design strategy remains to be achieved. 5.4 Functional groups substitution As well-known, fluorine groups are not conductive to the electrochemical storage process [69,114,115]. However, −F groups are beneficial to catalytic reaction. Li et al. [43] showed that the rich fluorine groups benefit to promote the proton adsorption kinetics and reduce the charge transfer resistance in acid condition, compared to the alkalized MXene during catalytic reaction, the −OH groups show the poor activity (Fig. 13(a) ), DFT calculation indicates that the presence of −F groups can lower Gibbs free energy of H, and the −O and −OH groups also affect the activity of Ti2CF2 (Figs. 13(b) and (c)). Furthermore, the preparation of F-free MXenes is safe and environmentally friendly, but unlocking the catalytic activity of oxygen-containing groups is a key issue. A post-processing such as alkalizing and annealing treatment can obtain −OH terminated and −O terminated MXenes, respectively. It was experimentally found that −O groups have better electrochemical reaction compared with −OH, due to the O sites of basal plane beneficial to immediate adsorption and desorption based on the DFT calculation [40,116]. The above conclusion can be supported by DFT, and Ti2CO2 possess the optimal electrocatalytic hydrogen production in many MXene materials (Fig. 13(d)) [108]. Additionally, the −OH and −O groups are mixed in practical cases. The charge distribution near the O active site effects on the catalytic activity, and the Bader charge and Gibbs free energy calculation reveals the moderate coverage of −OH helps weakening the oxidation of −O groups by controlling the amount of charge near O sites (Figs. 13(e) and (f)), thereby reducing the interaction between the O sites and H atoms, regulating towards the excellent HER performance [117,118]. More importantly, the excellent conductivity of catalyst is a necessity but not sufficient condition for high catalytic activity. The DFT calculation revealed the existence of functional groups not only have effects on the magnetic properties, but also the conductivity of MXenes, proved by the orbital hybridization near the Fermi level. For example, Ti2CO2 possess strong hybridization of Ti 3d-C 2p and Ti 3d-O 2p, leading to a semiconducting property, and all other functional MXene showed a metallic behavior due to the strong orbital hybridization of Ti 3d and O 2p near the Fermi level (Fig. 13(g)). Thus, it is important for calculating of Fermi level [N(EF)] to pinpoint the surface chemistry of layered materials [119]. Moreover, the functional catalysts can be tailored on the basis of the surface functional groups. The above research demonstrates that functional MXene possess excellent catalytic activity. Combined with the development of carbon materials quantum dots in the field of catalysis, the MQDs with different surface functional groups are expected to find better performance. Nevertheless, few studies have concentrated on the competitive advantages of surface functional groups of MQDs in photocatalytic and electrocatalytic reactions. Given that the key role of functional groups on the surface of MXene, and the unique physiochemical properties of MQDs, the functional groups are expected to achieve a maximize utilization. Such advantage has been demonstrated in the MQDs. Jin et al. [47] calculated the activate ability of bare Ti-edge, −F groups, −OH groups for N2 molecules, showing that the abundant −OH groups provide adequate electrons to active N≡N. N2 reduction reaction (NRR) and HER is a pair of competitive reactions, where the −O and −F groups are favorable HER sites (Fig. 13(h)). Thus, it gives theoretical guiding for designing high-performance MQDs-based catalysts for NRR and HER. Also, to maximize the utilization of favorable oxygen-containing groups for HER, the spontaneous functional group evolution is expected from −Cl to −O group in the alkalization condition, toward unlocking excellent HER kinetic process (Fig. 4(k)) [52]. Therefore, compared to carbon materials quantum dots, MQDs provides better intrinsic catalytic performance. 5.5 Constructing heterojunction Constructing heterojunction structure is an effective strategy to improve catalyst activity via integrating different components. Also, the surface reconstruction will generate new crystalline phases, thereby forming new heterojunction. They can induce the electrons redistribution at interface, achieving synergy effects in electrocatalysis. And, the negatively charged surface functional groups plays an important role in nanocomposites. For example, Cheng et al. [120] prepared Ti3C2T x MQDs/Cu heterostructure by electrostatic adsorption (groups and Cu2+) and chemical reduction method for NRR. TEM image indicates that MQDs are uniformly distributed on the surface of Cu nanosheets (Fig. 14(a) ). Compared to the DOS of pure MQDs and Cu side, the higher occupied states of two-phase interface near the Femi level contributes to promote adsorption and activation of N2 molecules (Fig. 14(b)). Moreover, charge difference density can also confirm the abundant electrons accumulated on the interface (Fig. 14(c)). Finally, the synergy effects of MQDs and Cu provides excellent electrocatalytic activity (Fig. 14(d)). Such enhanced strategy can be extended to other electrocatalytic applications. In addition, in photocatalytic reaction, the position of VB and CB (bandgap value) affects the absorption capacity from the ultraviolet to visible region, and the capacity of photogenerated carrier separation. And, the photogenerated carriers’ recombination is a main reason that reduces photocatalytic efficiency, while constructing heterogeneous interface can help to reverse the recombination via inhibiting photogenerated electron backflow. Currently, such reports focus most on the MQDs as co-catalysts to modulate the band structure by forming Schottky junction, S-Scheme and Z-Scheme photocatalysts, leading to broad the spectral response range of the catalysts. Also, as of reducing the recombination of photogenerated carriers, it helps to enhance the redox reactions on the surface of the co-catalysts. The surface of MQDs possess plentiful active functional groups. Thus, as co-catalyst, it not only improves the carrier's recombination behavior, but also enhances surface redox reaction. Yuan et al. [75] synthesized WO3/TQDs/In2S3 Z-scheme heterojunctions composite (Figs. 14(e)–(h)). The Ti3C2T x MQDs as co-catalyst helps to enhance light-trapping ability for producing more photogenerated carriers (Fig. 14(i)), and provides the photocatalytic activity of 3–4 times higher than WO3/In2S3 heterojunctions (Fig. 14(j)). As a result, the schematic diagram of the mechanism shows that the energy level matching between MQDs and photocatalyst is important for effectively avoid photogenerated carriers’ recombination (Fig. 14(k)). Except for synergy effects, the interface-induced stress-strain effect on catalytic activity also needs to be studied. As an emerging semiconductor nanomaterial with unique physicochemical properties, the forming mechanism and evolution process of MQDs-based heterogeneous interface remains to be explored by means of in-situ characterization techniques. 6 Deeply understanding the catalytic mechanism of MQDs 6.1 Ex-situ characterization of MQDs Exploring the limitations of characterization techniques is crucial for deeply understanding the catalytic mechanism of MQDs, e.g., structural and morphology characterizations. Identifying the structure of surface functional groups (active sites) in MQDs contributes to explore catalytic reaction kinetics step and mechanism. Currently, the structural characterization of MQDs consists mainly of Raman spectra, FTIR, UV spectra, XPS and energy dispersive spectroscopy (EDS), utilized to detect the detailed chemistry issues (Fig. 15 ). While the advanced structure characterization technique such as X-ray absorption spectra (XAS) should be considered to study the changes of electronic structure and bonding configuration of surface functional groups at the adsorbed layer, helping to explore the reaction mechanism of heterogeneous catalysis [121–123]. Moreover, the surface chemistry of atomic resolution needs to be achieved by means of modern TEM/scanning transmission electron microscopy (STEM), especially in Aberration-correction TEM (AC-TEM). In the 2D MXene, the surface metal atoms, −Cl and −Br functional groups can be characterized by atomically resolved HAADF-STEM, combined with the lattice resolved EDS to identifying local structure and compositions (Figs. 16(a)–(c) ) [125,126]. While the surface oxygen atoms, C toms are difficult to be detected due to lower atomic number. Furthermore, the small-size and luminescent MQDs, or some MQDs-based heterostructure catalysts are sensitive to electron beam, contributes to inability to observe the surface configuration and morphology at a high-current probe. In 2021, Wang et al. [51] reported the HAADF-STEM of Ti3C2 MQDs clusters (Fig. 16(d)) and single Ti3C2 MQDs (Fig. 16(e)), and the Ti3C2 MQDs clusters with different orientation shows clearly grain boundaries and edge defects. This is a great leap for the characterization techniques of MQDs [51]. Interestingly, using the cryo-electron microscopy (Cryo-EM) to parse virus structures at a few angstroms’ resolution inspires us to resolve this deficiency, which enables direct observation of electron beam-sensitive samples with a high spatial resolution. For example, the electron microscopy structure of ACE2 and 2019-nCoVS was identified by Cryo-EM at an angstrom-resolution of 2.9 and 3.5 Å, respectively [127,128]. Such major breakthrough provides a critical direction for drug development. 6.2 In-situ characterization techniques Monitoring the surface variation of catalyst is important for revealing the real catalytic active sites during catalysis. Although surface science techniques have made a rapid development, the visualization (the type, arrangement of atoms) of surface termination and the surface structure decorated by heteroatoms in MQDs, and the visualization of dynamic evolution of active sites of the MQDs-based catalyst, remains a challenge. Currently, there is no application of in-situ techniques in the MQDs-based catalysts for exploring the structure-activity correlation of catalysts, but such unique merits have been presented in other systems [129]. For example, Lee et al. [130] designed the in-situ/operando XAS and Raman spectroscopy experiments, for identifying the intermediate-spin state of Co, and the Fe-CoOOH active phase after electrochemical reconstruction, presenting the real state of CF-FeSO catalyst, enables the fast OER reaction. Figs. 17(a) and 17(d) shows the customized electrochemical cell of Raman and XAS, respectively. The result indicates that the CoO phase of CF-O in 1 mol L–1 KOH will change with applied voltages, resulting in poor phase CoO2 (Fig. 17(b)). However, the highly active CoOOH phase of CF-FeSO was reserved after introducing the Fe and S elements (Fig. 17(c)). Moreover, the oxidation state of Co can also be further confirmed by in-situ/operando XAS, and the XAFS result shows the same valence state as Raman spectrum (Figs. 17(e) and (f)). Therefore, such in-situ characterization technique is very important for identifying the phase transition process during catalytic reaction. In addition, the combination of in-situ/operando scanning probe and X-ray microscopy techniques morphology represent a groundbreaking progress, and it enables directly observing the dynamic catalytic process, showing the morphology and structure of catalyst during reaction. In 2021 [131], the morphology of β-Co(OH)2 nanoparticles at the different voltage were recorded by electrochemical atomic force microscopy (~10 nm spatial resolution). At the different catalytic voltage, the hydroxide intercalation, the interlayer water and protons release induced the phase transform from α-CoO2H1.5·0.5H2O to β-CoOOH particles (Fig. 18(a) ), resulting in the shrinkage and expansion of the β-Co(OH)2 nanoparticles (Fig. 18(b)), which can also be seen from the height map (Fig. 18(c)). Additionally, the operando scanning transmission X-ray microscopy (STXM) was used to characterize the Co oxidation state (Fig. 18(d)) (~50 nm resolution), and Figs. 18(e) and (f) shows that voltage-dependent Co valence, which is correlated to the final OER active phase. Furthermore, the operando X-ray diffraction pattern (Figs. 18(g) and (h)), and operando ambient-pressure X-ray photoelectron spectroscopy (APXPS) (Fig. 18(i)) [132,133] can also be used to monitor the surface oxidation state and local atomic-structure transformation of the active sites, contributing to understanding the reaction mechanism, especially in catalysts whose catalytic active sites are transformed via surface reconstruction. Apart from the above mentioned in-situ technique, other characterization such as FTIR [134], in situ liquid cell TEM [135] or quasi-in situ identical location TEM [136] are used to evaluate variation of catalysts during electrochemical reaction. 6.3 Density functional calculation DFT is necessary to reveal real catalytic active site, simulate real reaction path, and judge the rate-determining step, especially in muti-steps reactions. It needs to establish crystal structure model, control external conditions (e.g., temperature, pressure, pH, voltage), and consider appropriately some assumptions and approximations. Therefore, DFT cannot reflect real working conditions, but it is benefited to search for experimental boundary conditions, and guide the design of experiment, avoiding detours. It is well known that the overpotential is an import parameter for evaluating the performance of catalysts. The surface functional groups of MQD as catalytic active sites offers excellent HER, OER, and NRR activities. Thus, the type, contents of groups, and pHs of electrolyte are crucial in DFT consideration. For example, Gao et al. [108] simulated these factors in the MXene (Ti2C, V2C, Nb2C, Ti3C2, Nb4C3), thereby exploring their electrocatalytic HER potential. The type of groups (bare, −O, −OH) apparent affect the conductivity, the exposure of metal atoms offers abundant electrons, enables MXene is metallic (Fig. 19(a) ). However, the electrons transfer of metal-group affect the energy structure (Figs. 19(b) and (c)), impacting on the electrons transfer during catalytic reaction. Moreover, the surface state of catalysts correlates to the voltage and pH values of electrolyte, affecting the catalytic activity. The Pourbaix diagrams are constructed based on the thermodynamically most stable surface state under the relevant USHE and pH values, which shows the oxidation of −OH groups at different applied potential and pHs, determined the relationship between the type of group and pH, potential at standard conditions (Fig. 19(d)). Also, the stability of catalysts can also be calculated (Fig. 19(e)). Such theoretical calculation contributes to screening the conditions and design of optimal catalysts. Sometimes, the dimension of catalysts needs to be considered for promising the gas product timely release, e.g., 3D porous materials, and the amount of gas affect the adsorption of reactant and the stability of catalysts. For instance, Cheng et al. [137] constructed water-solid interface model of Cr2CO2 MXene, and studied the effect of H2O molecules and concentration of protons on the Gibbs free energy (Figs. 19(f) and (g)). The result indicates that the high coverage of H promotes the HER stability of Cr2CO2. Furthermore, the catalytic reaction mechanism often calculated by using transition state search method, mainly involved the reaction barriers in every step. It helps to understand the position of adsorption and desorption of reactants and product, respectively, further determining the catalytic active sites, and rate-determining step of catalysis. Zhou et al. [138] reported the HER performance of MoC Quantum Dots@N- Doped-Carbon. DFT calculation shows the Gibbs free energy of different sample and position, for illustrating the real catalytic active sites. The different structural model has been shown in Figs. 19(h)–(j). The result indicates the excellent catalytic activity is a statistical result of active sites, depending on the interaction of MoC QDs and N-C (Fig. 19(k)). In another instance, the Cu-Ni-based electrocatalyst was studied for understanding the origin of the high catalytic activity [139]. It helps to analyze the roles of every phase, i.e., the Ni helps stabilize the H of Cu surface, and Cr2O3 species promotes the adsorption of H2O and OH. And, the first step (water dissociation) as determining step in neutral water accelerates the overall reaction (Fig. 19(l)). 7 Conclusions and outlook To summarize, initialized from the characteristics of single-atom catalysis and single-site heterogeneous catalysis, we propose the single site chemistry of MQDs, that is the surface functional groups with redox activity as mini-lab, conducts surface modification, including design principles, design strategy, and gives the characterization limitation of MQDs. Therefore, through comparing the role of the surface functional groups of carbon material quantum dots and MQDs, the application prospect of the emerging MQDs is debuting in the field of catalysis. As electrocatalytic activity sites, the surface functional groups play a key role on the performance, and the heteroatoms (transition metal, and non-metal atoms) decoration can further adjust the activity, including the modification of M site, X site, and T site. As co-catalyst, the surface functional groups and energy band structure of MQDs determined the photocatalytic activity and photogenerated carriers’ recombination capability. Thus, it is necessary for constructing MQDs-based heterostructures. Further research is needed to explore the effect of the type of functional groups on regulating the band structure of MQDs and photocatalytic activity. Furthermore, the surface functional groups of MQDs can form layered conductive network with spatial confinement by self-crosslinking and van der Waals interaction, achieving uniform and atomic-level dispersion of active metals and metal semiconductors. Two-dimensional materials derived quantum dots such as CQDs, MoS2 QDs, BP QDs, MQDs etc. [140–144] has aroused great interest due to their excellent electronic conductivity, large surface areas and unique quantum confinement effect, especially in catalysis. However, compared to other QDs, MQDs possess diverse composition, and thereof leading to the diversity of structures, further determining a variety of catalytic performances. Moreover, the surface functional groups can serve as catalytic active sites, which is controllable and modifiable. Such flexible, environmentally friendly and low-cost makes it ideal candidates for noble-metal-free catalysts, and there is lots of space to be achieved for the promising MQDs. Finally, we provide insights into the confronting challenges (Fig. 20 ). (1) Diversity of composition and synthesis. At present, most research focused on the Ti3C2 MQDs. Although the Nb2C MQDs, Ti2C MQDs and V2C MQDs have been synthesized, no reports are found for the application on the catalysis. And, as the “M” metal represents IIIA and IVA elements, more single metal MQDs or dual metal MQDs remains to be prepared for further exploring their physiochemistry properties and catalytic application. Such design of structure and composition helps to achieve excellent performance. (2) The synthesis of fluorine-free MQDs or precursors of MQDs (2D MXene) should be popularized for safe and environmentally friendly application, such as electrochemical etching, molten salts method, and alkaline treatment. Moreover, controlling the surface functional groups of MQDs is of great significance to achieve specific catalytic activities. Especially, the activity of single groups contributes to illustrate the real catalytic active sites, and reveal real catalytic process. (3) Exploring the growth mechanism. The surface functional groups of MQDs are crucial for catalysis. To synthesis MQDs with high purity and excellent structure (desired size, structure, arrangement of functional groups), it is necessary to control the synthesis conditions (e.g., reaction temperature, pressure, and time) and the effect of impurity. And, it is noticed that MQDs are easily oxidized during preparation. Such precise control contributes to analysis of the formation mechanism of MQDs and subsequent characterization. (4) Characterization techniques of MQDs. The surface functional groups with negativity are easily combined with metal ions, which not only can adjust the catalytic activity of MQDs, but also limit the aggregation and growth of metals. The advanced characterization and in-situ techniques should be introduced to explore the interaction mechanism between MQDs and metal, or other heterostructure catalysts, the dynamic variation of active sites, and the structure evolution during catalytic reaction. (5) The aggregation of MQDs during synthesis and catalytic reaction is a major challenge, leading to the difficulty of resolving the surface physicochemical properties of MQDs. Thus, exploring the dispersion of MQDs should focus on the different organic solvent (e.g., ethanol, N, N-dimethylformamide (DMF), dimethyl sulfoxide (DMSO)), due to the easily oxidation of MQDs in water solution. Moreover, it is also noticed that the stability of MQDs under high electrons beam irradiation can be resolved by means of Cryo-EM, which helps to guide the structure design of high-efficient catalysis. (6) It is important for achieving diverse applications in catalysis, including electrocatalytic carbon dioxide reduction, methanol oxidation, and studying their in-depth mechanism to explore the surface chemistry (the role of single functional group, the interactions between functional groups) of MQDs. Currently, MQDs are used as co-catalysts for enhancing the extraction of photogenerated electrons, but there are seldom reports on the effect of surface chemistry on semiconductor behavior and photocatalytic reaction mechanism of MQDs, and the photocatalytic activity of MQDs. In addition, the introduction of single atoms into MQDs is also a direction worth studying based on the surface functional groups. At present, the medical research shows the interaction has been destroyed by the new crown vaccine as an antibody between spike glycoprotein on the surface of the coronavirus and ACE2, meaning that the war without gunpowder has achieved an initial victory. Therefore, the study of the type, arrangement, and physicochemical properties of the surface functional groups of MQDs will also soon succeed, which provides unlimited opportunities for exploring new MQDs, designing high-reactivity MQDs-based catalysts. References 1 J.M. Thomas R. Raja D.W. Lewis Angew. Chem. Int. Ed. 44 2005 6456 6482 J. M. Thomas, R. Raja, D. W. Lewis, Angew. Chem. Int. Ed., 2005, 44, 6456–6482. 2 B.T. Qiao A.Q. Wang X.F. Yang L.F. Allard Z. Jiang Y.T. Cui J.Y. Liu J. Li T. Zhang Nat. Chem. 3 2011 634 641 B. T. Qiao, A. Q. Wang, X. F. Yang, L. F. Allard, Z. Jiang, Y. T. Cui, J. Y. Liu, J. Li, T. Zhang, Nat. Chem., 2011, 3, 634–641. 3 W. Zhang W. Zheng Adv. Funct. Mater. 26 2016 2988 2993 W. Zhang, W. Zheng, Adv. Funct. Mater., 2016, 26, 2988–2993. 4 Y. Wang X. Huang Z. Wei Chin. J. Catal. 42 2021 1269 1286 Y. Wang, X. Huang, Z. Wei, Chin. J. Catal., 2021, 42, 1269–1286. 5 K. Song Y. Feng W. Zhang W. Zheng J. Energy Chem. 67 2022 391 422 K. Song, Y. Feng, W. Zhang, W. Zheng, J. Energy Chem., 2022, 67, 391–422. 6 C. Toumey Nat. Nanotechnol. 4 2009 783 784 C. Toumey, Nat. Nanotechnol., 2009, 4, 783–784. 7 C. Dong Z. Gao Y. Li M. Peng M. Wang Y. Xu C. Li M. Xu Y. Deng X. Qin F. Huang X. Wei Y.-G. Wang H. Liu W. Zhou D. Ma Nat. Catal. 5 2022 485 493 C. Dong, Z. Gao, Y. Li, M. Peng, M. Wang, Y. Xu, C. Li, M. Xu, Y. Deng, X. Qin, F. Huang, X. Wei, Y.-G. Wang, H. Liu, W. Zhou, D. Ma, Nat. Catal., 2022, 5, 485–493. 8 K. Song Y. Feng X. Zhou T. Qin X. Zou Y. Qi Z. Chen J. Rao Z. Wang N. Yue X. Ge W. Zhang W. Zheng Appl. Catal. B 316 2022 121591 K. Song, Y. Feng, X. Zhou, T. Qin, X. Zou, Y. Qi, Z. Chen, J. Rao, Z. Wang, N. Yue, X. Ge, W. Zhang, W. Zheng, Appl. Catal. B, 2022, 316, 121591. 9 Y.-M. Su Z. Wang C.-H. Tung D. Sun S. Schein J. Am. Chem. Soc. 143 2021 13235 13244 Y.-M. Su, Z. Wang, C.-H. Tung, D. Sun, S. Schein, J. Am. Chem. Soc., 2021, 143, 13235–13244. 10 C. Bai M. Liu Angew. Chem. Int. Ed. 52 2013 2678 2683 C. Bai, M. Liu, Angew. Chem. Int. Ed., 2013, 52, 2678–2683. 11 J.R. Heath Science 270 1995 1315 1316 J. R. Heath, Science, 1995, 270, 1315–1316. 12 H. Witschi Toxicology 149 2000 3 15 H. Witschi, Toxicology, 2000, 149, 3–15. 13 G. Ertl Angew. Chem. Int. Ed. 52 2013 52 60 G. Ertl, Angew. Chem. Int. Ed., 2013, 52, 52–60. 14 G. Ertl Angew. Chem. Int. Ed. 47 2008 3524 3535 G. Ertl, Angew. Chem. Int. Ed., 2008, 47, 3524–3535. 15 G. Ertl Catal. Rev.-Sci. Eng. 21 1980 201 223 G. Ertl, Catal. Rev.-Sci. Eng., 1980, 21, 201–223. 16 P. Hayes J. Economic History 47 1987 353 363 P. Hayes, J. Economic History, 1987, 47, 353–363. 17 H. Xiao-zhong Studies in Dialectics of Nature 28 2012 106 111 H. Xiao-zhong, Studies in Dialectics of Nature, 2012, 28, 106–111. 18 F.P.G.d. Arquer D.V. Talapin V.I. Klimov Y. Arakawa M. Bayer E.H. Sargent Science 373 2021 eaaz8541 F. P. G. d. Arquer, D. V. Talapin, V. I. Klimov, Y. Arakawa, M. Bayer, E. H. Sargent, Science, 2021, 373, eaaz8541. 19 J. Owen Science 347 2015 615 616 J. Owen, Science, 2015, 347, 615–616. 20 Y. Liu W. Zhang W. Zheng Nano-Micro Lett. 14 2022 158 Y. Liu, W. Zhang, W. Zheng, Nano-Micro Lett., 2022, 14, 158. 21 W. Zhang A. Trunschke R. Schlögl D. Su Angew. Chem. Int. Ed. 49 2010 6084 6089 W. Zhang, A. Trunschke, R. Schlögl, D. Su, Angew. Chem. Int. Ed., 2010, 49, 6084–6089. 22 Z. Tang N. Kong X. Zhang Y. Liu P. Hu S. Mou P. Liljeström J. Shi W. Tan J.S. Kim Y. Cao R. Langer K.W. Leong O.C. Farokhzad W. Tao Nat. Rev. Mater. 5 2020 847 860 Z. Tang, N. Kong, X. Zhang, Y. Liu, P. Hu, S. Mou, P. Liljeström, J. Shi, W. Tan, J. S. Kim, Y. Cao, R. Langer, K. W. Leong, O. C. Farokhzad, W. Tao, Nat. Rev. Mater., 2020, 5, 847–860. 23 J. Zou J. Wu Y. Wang F. Deng J. Jiang Y. Zhang S. Liu N. Li H. Zhang J. Yu T. Zhai H.N. Alshareef Chem. Soc. Rev. 51 2022 2972 2990 J. Zou, J. Wu, Y. Wang, F. Deng, J. Jiang, Y. Zhang, S. Liu, N. Li, H. Zhang, J. Yu, T. Zhai, H. N. Alshareef, Chem. Soc. Rev., 2022, 51, 2972–2990. 24 H. Zhou Z. Chen A.V. López E.D. López E. Lam A. Tsoukalou E. Willinger D.A. Kuznetsov D. Mance A. Kierzkowska F. Donat P.M. Abdala A. Comas-Vives C. Copéret A. Fedorov C.R. Müller Nat. Catal. 4 2021 860 871 H. Zhou, Z. Chen, A. V. López, E. D. López, E. Lam, A. Tsoukalou, E. Willinger, D. A. Kuznetsov, D. Mance, A. Kierzkowska, F. Donat, P. M. Abdala, A. Comas-Vives, C. Copéret, A. Fedorov, C. R. Müller, Nat. Catal., 2021, 4, 860–871. 25 L. Gao W. Bao A.V. Kuklin S. Mei H. Zhang H. Agren Adv. Mater. 33 2021 2004129 L. Gao, W. Bao, A. V. Kuklin, S. Mei, H. Zhang, H. Agren, Adv. Mater., 2021, 33, 2004129. 26 M. Lu W. Han H. Li W. Zhang B. Zhang J. Energy Chem. 48 2020 344 363 M. Lu, W. Han, H. Li, W. Zhang, B. Zhang, J. Energy Chem., 2020, 48, 344–363. 27 S. Wang L. Chen Y. Wu Q. Zhang ChemPhysChem 19 2018 3380 3387 S. Wang, L. Chen, Y. Wu, Q. Zhang, ChemPhysChem, 2018, 19, 3380–3387. 28 C. Ling L. Shi Y. Ouyang Q. Chen J. Wang Adv. Sci. 3 2016 1600180 C. Ling, L. Shi, Y. Ouyang, Q. Chen, J. Wang, Adv. Sci., 2016, 3, 1600180. 29 B. Ding W.-J. Ong J. Jiang X. Chen N. Li Appl. Surf. Sci. 500 2020 143987 B. Ding, W.-J. Ong, J. Jiang, X. Chen, N. Li, Appl. Surf. Sci., 2020, 500, 143987. 30 Z. Kang M.A. Khan Y. Gong R. Javed Y. Xu D. Ye H. Zhao J. Zhang J. Mater. Chem. A 9 2021 6089 6108 Z. Kang, M. A. Khan, Y. Gong, R. Javed, Y. Xu, D. Ye, H. Zhao, J. Zhang, J. Mater. Chem. A, 2021, 9, 6089–6108. 31 V. Ramalingam P. Varadhan H.C. Fu H. Kim D. Zhang S. Chen L. Song D. Ma Y. Wang H.N. Alshareef J.H. He Adv. Mater. 31 2019 e1903841 V. Ramalingam, P. Varadhan, H. C. Fu, H. Kim, D. Zhang, S. Chen, L. Song, D. Ma, Y. Wang, H. N. Alshareef, J. H. He, Adv. Mater., 2019, 31, e1903841. 32 B. Jiang T. Yang T. Wang C. Chen M. Yang X. Yang J. Zhang Z. Kou Chem. Eng. J. 442 2022 136119 B. Jiang, T. Yang, T. Wang, C. Chen, M. Yang, X. Yang, J. Zhang, Z. Kou, Chem. Eng. J., 2022, 442, 136119. 33 Y. Tang C. Yang M. Sheng X. Yin W. Que ACS Sustainable Chem. Eng. 8 2020 12990 12998 Y. Tang, C. Yang, M. Sheng, X. Yin, W. Que, ACS Sustainable Chem. Eng., 2020, 8, 12990–12998. 34 K.R.G. Lim A.D. Hoko L.R. Johnson X. Meng M. Lin G.S. Subramanian B. Anasori Y. Gogotsi A. Vojvodic Z.W. Seh ACS Nano 14 2020 16140 16155 K. R. G. Lim, A. D. Hoko, L. R. Johnson, X. Meng, M. Lin, G. S. Subramanian, B. Anasori, Y. Gogotsi, A. Vojvodic, Z. W. Seh, ACS Nano, 2020, 14, 16140–16155. 35 J.-J. Huang X.-Q. Liu F.-F. Meng L.-Q. He J.-X. Wang J.-C. Wu X.-H. Lu Y.-X. Tong P.-P. Fang J. Electroanal. Chem. 856 2020 113727 J.-J. Huang, X.-Q. Liu, F.-F. Meng, L.-Q. He, J.-X. Wang, J.-C. Wu, X.-H. Lu, Y.-X. Tong, P.-P. Fang, J. Electroanal. Chem., 2020, 856, 113727. 36 Y. Yoon A.P. Tiwari M. Choi T.G. Novak W. Song H. Chang T. Zyung S.S. Lee S. Jeon K.-S. An Adv. Funct. Mater. 29 2019 1903443 Y. Yoon, A. P. Tiwari, M. Choi, T. G. Novak, W. Song, H. Chang, T. Zyung, S. S. Lee, S. Jeon, K.-S. An, Adv. Funct. Mater., 2019, 29, 1903443. 37 S.Y. Pang Y.T. Wong S. Yuan Y. Liu M.K. Tsang Z. Yang H. Huang W.T. Wong J. Hao J. Am. Chem. Soc. 141 2019 9610 9616 S. Y. Pang, Y. T. Wong, S. Yuan, Y. Liu, M. K. Tsang, Z. Yang, H. Huang, W. T. Wong, J. Hao, J. Am. Chem. Soc., 2019, 141, 9610–9616. 38 T.A. Le Q.V. Bui N.Q. Tran Y. Cho Y. Hong Y. Kawazoe H. Lee ACS Sustainable Chem. Eng. 7 2019 16879 16888 T. A. Le, Q. V. Bui, N. Q. Tran, Y. Cho, Y. Hong, Y. Kawazoe, H. Lee, ACS Sustainable Chem. Eng., 2019, 7, 16879–16888. 39 P. Kuang M. He B. Zhu J. Yu K. Fan M. Jaroniec J. Catal. 375 2019 8 20 P. Kuang, M. He, B. Zhu, J. Yu, K. Fan, M. Jaroniec, J. Catal., 2019, 375, 8–20. 40 Y. Jiang T. Sun X. Xie W. Jiang J. Li B. Tian C. Su ChemSusChem 12 2019 1368 1373 Y. Jiang, T. Sun, X. Xie, W. Jiang, J. Li, B. Tian, C. Su, ChemSusChem, 2019, 12, 1368–1373. 41 W. Yuan L. Cheng Y. An H. Wu N. Yao X. Fan X. Guo ACS Sustainable Chem. Eng. 6 2018 8976 8982 W. Yuan, L. Cheng, Y. An, H. Wu, N. Yao, X. Fan, X. Guo, ACS Sustainable Chem. Eng., 2018, 6, 8976–8982. 42 Y. Yoon A.P. Tiwari M. Lee M. Choi W. Song J. Im T. Zyung H.-K. Jung S.S. Lee S. Jeon K.-S. An J. Mater. Chem. A 6 2018 20869 20877 Y. Yoon, A. P. Tiwari, M. Lee, M. Choi, W. Song, J. Im, T. Zyung, H.-K. Jung, S. S. Lee, S. Jeon, K.-S. An, J. Mater. Chem. A, 2018, 6, 20869–20877. 43 S. Li P. Tuo J. Xie X. Zhang J. Xu J. Bao B. Pan Y. Xie Nano Energy 47 2018 512 518 S. Li, P. Tuo, J. Xie, X. Zhang, J. Xu, J. Bao, B. Pan, Y. Xie, Nano Energy, 2018, 47, 512–518. 44 Z.W. Seh K.D. Fredrickson B. Anasori J. Kibsgaard A.L. Strickler M.R. Lukatskaya Y. Gogotsi T.F. Jaramillo A. Vojvodic ACS Energy Lett. 1 2016 589 594 Z. W. Seh, K. D. Fredrickson, B. Anasori, J. Kibsgaard, A. L. Strickler, M. R. Lukatskaya, Y. Gogotsi, T. F. Jaramillo, A. Vojvodic, ACS Energy Lett., 2016, 1, 589–594. 45 M. Naguib M. Kurtoglu V. Presser J. Lu J. Niu M. Heon L. Hultman Y. Gogotsi M.W. Barsoum Adv. Mater. 23 2011 4248 4253 M. Naguib, M. Kurtoglu, V. Presser, J. Lu, J. Niu, M. Heon, L. Hultman, Y. Gogotsi, M. W. Barsoum, Adv. Mater., 2011, 23, 4248–4253. 46 J. Halim K.M. Cook M. Naguib P. Eklund Y. Gogotsi J. Rosen M.W. Barsoum Appl. Surf. Sci. 362 2016 406 417 J. Halim, K. M. Cook, M. Naguib, P. Eklund, Y. Gogotsi, J. Rosen, M. W. Barsoum, Appl. Surf. Sci., 2016, 362, 406–417. 47 Z. Jin C. Liu Z. Liu J. Han Y. Fang Y. Han Y. Niu Y. Wu C. Sun Y. Xu Adv. Energy Mater. 10 2020 2000797 Z. Jin, C. Liu, Z. Liu, J. Han, Y. Fang, Y. Han, Y. Niu, Y. Wu, C. Sun, Y. Xu, Adv. Energy Mater., 2020, 10, 2000797. 48 D. Zhao Z. Chen W. Yang S. Liu X. Zhang Y. Yu W.-C. Cheong L. Zheng F. Ren G. Ying X. Cao D. Wang Q. Peng G. Wang C. Chen J. Am. Chem. Soc. 141 2019 4086 4093 D. Zhao, Z. Chen, W. Yang, S. Liu, X. Zhang, Y. Yu, W.-C. Cheong, L. Zheng, F. Ren, G. Ying, X. Cao, D. Wang, Q. Peng, G. Wang, C. Chen, J. Am. Chem. Soc., 2019, 141, 4086–4093. 49 J. Zhang Y. Zhao X. Guo C. Chen C.-L. Dong R.-S. Liu C.-P. Han Y. Li Y. Gogotsi G. Wang Nat. Catal. 1 2018 985 992 J. Zhang, Y. Zhao, X. Guo, C. Chen, C.-L. Dong, R.-S. Liu, C.-P. Han, Y. Li, Y. Gogotsi, G. Wang, Nat. Catal., 2018, 1, 985–992. 50 X. Sang Y. Xie M.-W. Lin M. Alhabeb K.L. Van Aken Y. Gogotsi P.R.C. Kent K. Xiao R.R. Unocic ACS Nano 10 2016 9193 9200 X. Sang, Y. Xie, M.-W. Lin, M. Alhabeb, K. L. Van Aken, Y. Gogotsi, P. R. C. Kent, K. Xiao, R. R. Unocic, ACS Nano, 2016, 10, 9193–9200. 51 P. Wang D. Zhao X. Hui Z. Qian P. Zhang Y. Ren Y. Lin Z. Zhang L. Yin Adv. Energy Mater. 11 2021 2003069 P. Wang, D. Zhao, X. Hui, Z. Qian, P. Zhang, Y. Ren, Y. Lin, Z. Zhang, L. Yin, Adv. Energy Mater., 2021, 11, 2003069. 52 Y. Liu X. Zhang W. Zhang X. Ge Y. Wang X. Zou X. Zhou W. Zheng Energy Environ. Mater. DOI: 10.1002/eem1002.12438 2022 Y. Liu, X. Zhang, W. Zhang, X. Ge, Y. Wang, X. Zou, X. Zhou, W. Zheng, Energy Environ. Mater., 2022, DOI: 10.1002/eem1002.12438. 53 T.P. Peacock D.H. Goldhill J. Zhou L. Baillon R. Frise O.C. Swann R. Kugathasan R. Penn J.C. Brown R.Y. Sanchez-David L. Braga M.K. Williamson J.A. Hassard E. Staller B. Hanley M. Osborn M. Giacca A.D. Davidson D.A. Matthews W.S. Barclay Nat. Microbiology 6 2021 899 909 T. P. Peacock, D. H. Goldhill, J. Zhou, L. Baillon, R. Frise, O. C. Swann, R. Kugathasan, R. Penn, J. C. Brown, R. Y. Sanchez-David, L. Braga, M. K. Williamson, J. A. Hassard, E. Staller, B. Hanley, M. Osborn, M. Giacca, A. D. Davidson, D. A. Matthews, W. S. Barclay, Nat. Microbiology, 2021, 6, 899–909. 54 X. Chen J. Li G. Pan W. Xu J. Zhu D. Zhou D. Li C. Chen G. Lu H. Song Sensors Actuat. B 289 2019 131 137 X. Chen, J. Li, G. Pan, W. Xu, J. Zhu, D. Zhou, D. Li, C. Chen, G. Lu, H. Song, Sensors Actuat. B, 2019, 289, 131–137. 55 Z. Zeng Y. Yan J. Chen P. Zan Q. Tian P. Chen Adv. Funct. Mater. 29 2019 1806500 Z. Zeng, Y. Yan, J. Chen, P. Zan, Q. Tian, P. Chen, Adv. Funct. Mater., 2019, 29, 1806500. 56 L. Yang G. Dong D.L. Jacobs Y. Wang L. Zang C. Wang J. Catal. 352 2017 274 281 L. Yang, G. Dong, D. L. Jacobs, Y. Wang, L. Zang, C. Wang, J. Catal., 2017, 352, 274–281. 57 J. Qin B. Liu K.-H. Lam S. Song X. Li X. Hu ACS Sustainable Chem. Eng. 8 2020 17791 17799 J. Qin, B. Liu, K.-H. Lam, S. Song, X. Li, X. Hu, ACS Sustainable Chem. Eng., 2020, 8, 17791–17799. 58 L. Yang Z. Chen X. Wang M. Jin Nanomaterials 12 2022 542 L. Yang, Z. Chen, X. Wang, M. Jin, Nanomaterials, 2022, 12, 542. 59 F. He B. Zhu B. Cheng J. Yu W. Ho W. Macyk Appl. Catal. B 272 2020 119006 F. He, B. Zhu, B. Cheng, J. Yu, W. Ho, W. Macyk, Appl. Catal. B, 2020, 272, 119006. 60 X. Du T. Zhao Z. Xiu Z. Xing Z. Li K. Pan S. Yang W. Zhou Appl. Mater. Today 20 2020 100719 X. Du, T. Zhao, Z. Xiu, Z. Xing, Z. Li, K. Pan, S. Yang, W. Zhou, Appl. Mater. Today, 2020, 20, 100719. 61 R. Tang S. Zhou C. Li R. Chen L. Zhang Z. Zhang L. Yin Adv. Funct. Mater. 30 2020 2000637 R. Tang, S. Zhou, C. Li, R. Chen, L. Zhang, Z. Zhang, L. Yin, Adv. Funct. Mater., 2020, 30, 2000637. 62 Y. Song X. Zhang Y. Zhang P. Zhai Z. Li D. Jin J. Cao C. Wang B. Zhang J. Gao L. Sun J. Hou Angew. Chem. Int. Ed. 61 2022 e202200946 Y. Song, X. Zhang, Y. Zhang, P. Zhai, Z. Li, D. Jin, J. Cao, C. Wang, B. Zhang, J. Gao, L. Sun, J. Hou, Angew. Chem. Int. Ed., 2022, 61, e202200946. 63 C. Zhang Y. Ma X. Zhang S. Abdolhosseinzadeh H. Sheng W. Lan A. Pakdel J. Heier F. Nüesch Energy Environ. Mater. 3 2020 29 55 C. Zhang, Y. Ma, X. Zhang, S. Abdolhosseinzadeh, H. Sheng, W. Lan, A. Pakdel, J. Heier, F. Nüesch, Energy Environ. Mater., 2020, 3, 29–55. 64 Q. Xue H. Zhang M. Zhu Z. Pei H. Li Z. Wang Y. Huang Y. Huang Q. Deng J. Zhou S. Du Q. Huang C. Zhi Adv. Mater. 29 2017 1604847 Q. Xue, H. Zhang, M. Zhu, Z. Pei, H. Li, Z. Wang, Y. Huang, Y. Huang, Q. Deng, J. Zhou, S. Du, Q. Huang, C. Zhi, Adv. Mater., 2017, 29, 1604847. 65 M. Shen W. Jiang K. Liang S. Zhao R. Tang L. Zhang J.-Q. Wang Angew. Chem. Int. Ed. 60 2021 27013 27018 M. Shen, W. Jiang, K. Liang, S. Zhao, R. Tang, L. Zhang, J.-Q. Wang, Angew. Chem. Int. Ed., 2021, 60, 27013–27018. 66 Y. Li H. Shao Z. Lin J. Lu L. Liu B. Duployer P.O.A. Persson P. Eklund L. Hultman M. Li K. Chen X.H. Zha S. Du P. Rozier Z. Chai E. Raymundo-Pinero P.L. Taberna P. Simon Q. Huang Nat. Mater. 19 2020 894 899 Y. Li, H. Shao, Z. Lin, J. Lu, L. Liu, B. Duployer, P. O. A. Persson, P. Eklund, L. Hultman, M. Li, K. Chen, X. H. Zha, S. Du, P. Rozier, Z. Chai, E. Raymundo-Pinero, P. L. Taberna, P. Simon, Q. Huang, Nat. Mater., 2020, 19, 894–899. 67 V. Natu R. Pai M. Sokol M. Carey V. Kalra M.W. Barsoum Chem 6 2020 616 630 V. Natu, R. Pai, M. Sokol, M. Carey, V. Kalra, M. W. Barsoum, Chem, 2020, 6, 616–630. 68 T. Li L. Yao Q. Liu J. Gu R. Luo J. Li X. Yan W. Wang P. Liu B. Chen W. Zhang W. Abbas R. Naz D. Zhang Angew. Chem. Int. Ed. 57 2018 6115 6119 T. Li, L. Yao, Q. Liu, J. Gu, R. Luo, J. Li, X. Yan, W. Wang, P. Liu, B. Chen, W. Zhang, W. Abbas, R. Naz, D. Zhang, Angew. Chem. Int. Ed., 2018, 57, 6115–6119. 69 S. Yang P. Zhang F. Wang A.G. Ricciardulli M.R. Lohe P.W.M. Blom X. Feng Angew. Chem. Int. Ed. 57 2018 15491 15495 S. Yang, P. Zhang, F. Wang, A. G. Ricciardulli, M. R. Lohe, P. W. M. Blom, X. Feng, Angew. Chem. Int. Ed., 2018, 57, 15491–15495. 70 P. Lian Y. Dong Z.-S. Wu S. Zheng X. Wang W. Sen C. Sun J. Qin X. Shi X. Bao Nano Energy 40 2017 1 8 P. Lian, Y. Dong, Z.-S. Wu, S. Zheng, X. Wang, W. Sen, C. Sun, J. Qin, X. Shi, X. Bao, Nano Energy, 2017, 40, 1–8. 71 J. Li X. Yuan C. Lin Y. Yang L. Xu X. Du J. Xie J. Lin J. Sun Adv. Energy Mater. 7 2017 1602725 J. Li, X. Yuan, C. Lin, Y. Yang, L. Xu, X. Du, J. Xie, J. Lin, J. Sun, Adv. Energy Mater., 2017, 7, 1602725. 72 Z. Zhao X. Wu C. Luo Y. Wang W. Chen J. Colloid Interface Sci. 609 2022 393 402 Z. Zhao, X. Wu, C. Luo, Y. Wang, W. Chen, J. Colloid Interface Sci., 2022, 609, 393–402. 73 X. Yu X. Cai H. Cui S.-W. Lee X.-F. Yu B. Liu Nanoscale 9 2017 17859 17864 X. Yu, X. Cai, H. Cui, S.-W. Lee, X.-F. Yu, B. Liu, Nanoscale, 2017, 9, 17859–17864. 74 B. Chang Y. Guo H. Liu L. Li B. Yang J. Mater. Chem. A 10 2022 3134 3145 B. Chang, Y. Guo, H. Liu, L. Li, B. Yang, J. Mater. Chem. A, 2022, 10, 3134–3145. 75 Z. Yuan H. Huang N. Li D. Chen Q. Xu H. Li J. He J. Lu J. Hazard. Mater. 409 2021 125027 Z. Yuan, H. Huang, N. Li, D. Chen, Q. Xu, H. Li, J. He, J. Lu, J. Hazard. Mater., 2021, 409, 125027. 76 S. Lin N. Zhang F. Wang J. Lei L. Zhou Y. Liu J. Zhang ACS Sustainable Chemistry & Engineering 9 2021 481 488 S. Lin, N. Zhang, F. Wang, J. Lei, L. Zhou, Y. Liu and J. Zhang, ACS Sustainable Chemistry & Engineering, 2021, 9, 481-488. 77 C. Lai Z. An H. Yi X. Huo L. Qin X. Liu B. Li M. Zhang S. Liu L. Li Y. Fu X. Zhou Z. Wang N. An X. Shi J. Colloid Interface Sci. 600 2021 161 173 C. Lai, Z. An, H. Yi, X. Huo, L. Qin, X. Liu, B. Li, M. Zhang, S. Liu, L. Li, Y. Fu, X. Zhou, Z. Wang, N. An, X. Shi, J. Colloid Interface Sci., 2021, 600, 161–173. 78 X. Han N. Li P. Xiong M.G. Jung Y. Kang Q. Dou Q. Liu J.Y. Lee H.S. Park InfoMat 3 2021 1134 1144 X. Han, N. Li, P. Xiong, M. G. Jung, Y. Kang, Q. Dou, Q. Liu, J. Y. Lee, H. S. Park, InfoMat, 2021, 3, 1134–1144. 79 H. Wang R. Zhao H. Hu X. Fan D. Zhang D. Wang ACS Appl. Mater. Interfaces 12 2020 40176 40185 H. Wang, R. Zhao, H. Hu, X. Fan, D. Zhang, D. Wang, ACS Appl. Mater. Interfaces, 2020, 12, 40176–40185. 80 X. Yang Q. Jia F. Duan B. Hu M. Wang L. He Y. Song Z. Zhang Appl. Surf. Sci. 464 2019 78 87 X. Yang, Q. Jia, F. Duan, B. Hu, M. Wang, L. He, Y. Song, Z. Zhang, Appl. Surf. Sci., 2019, 464, 78–87. 81 Y. Li L. Ding Y. Guo Z. Liang H. Cui J. Tian ACS Appl Mater Interfaces 11 2019 41440 41447 Y. Li, L. Ding, Y. Guo, Z. Liang, H. Cui, J. Tian, ACS Appl Mater Interfaces, 2019, 11, 41440–41447. 82 K. Li S. Zhang Y. Li J. Fan K. Lv Chin. J. Catal. 42 2021 3 14 K. Li, S. Zhang, Y. Li, J. Fan, K. Lv, Chin. J. Catal., 2021, 42, 3–14. 83 W. Zhang H. Xu F. Xie X. Ma B. Niu M. Chen H. Zhang Y. Zhang D. Long Nat. Commun. 13 2022 471 W. Zhang, H. Xu, F. Xie, X. Ma, B. Niu, M. Chen, H. Zhang, Y. Zhang, D. Long, Nat. Commun., 2022, 13, 471. 84 J. Liang Y. Liu Z. Si G. Wei D. Weng F. Kang Carbon 178 2021 265 272 J. Liang, Y. Liu, Z. Si, G. Wei, D. Weng, F. Kang, Carbon, 2021, 178, 265–272. 85 J. Liu R. Li B. Yang ACS Central Sci. 6 2020 2179 2195 J. Liu, R. Li, B. Yang, ACS Central Sci., 2020, 6, 2179–2195. 86 M. Sujith E.K. Vishnu S. Sappati M.S. Oliyantakath Hassan V. Vijayan K.G. Thomas J. Am. Chem. Soc. 144 2022 5074 5086 M. Sujith, E. K. Vishnu, S. Sappati, M. S. Oliyantakath Hassan, V. Vijayan, K. G. Thomas, J. Am. Chem. Soc., 2022, 144, 5074–5086. 87 C. Xia Y. Qiu Y. Xia P. Zhu G. King X. Zhang Z. Wu J.Y. Kim D.A. Cullen D. Zheng P. Li M. Shakouri E. Heredia P. Cui H.N. Alshareef Y. Hu H. Wang Nat. Chem. 13 2021 887 894 C. Xia, Y. Qiu, Y. Xia, P. Zhu, G. King, X. Zhang, Z. Wu, J. Y. Kim, D. A. Cullen, D. Zheng, P. Li, M. Shakouri, E. Heredia, P. Cui, H. N. Alshareef, Y. Hu, H. Wang, Nat. Chem., 2021, 13, 887–894. 88 Y. Feng K. Song W. Zhang X. Zhou S.J. Yoo J.-G. Kim S. Qiao Y. Qi X. Zou Z. Chen T. Qin N. Yue Z. Wang D. Li W. Zheng J. Energy Chem. 70 2022 211 218 Y. Feng, K. Song, W. Zhang, X. Zhou, S. J. Yoo, J.-G. Kim, S. Qiao, Y. Qi, X. Zou, Z. Chen, T. Qin, N. Yue, Z. Wang, D. Li, W. Zheng, J. Energy Chem., 2022, 70, 211–218. 89 W. Li Z. Wei B. Wang Y. Liu H. Song Z. Tang B. Yang S. Lu Mater. Chem. Front. 4 2020 277 284 W. Li, Z. Wei, B. Wang, Y. Liu, H. Song, Z. Tang, B. Yang, S. Lu, Mater. Chem. Front., 2020, 4, 277–284. 90 M. Zhao J. Zhang H. Xiao T. Hu J. Jia H. Wu Chem. Commun. 55 2019 1635 1638 M. Zhao, J. Zhang, H. Xiao, T. Hu, J. Jia, H. Wu, Chem. Commun., 2019, 55, 1635–1638. 91 H. Fei J. Dong Y. Feng C.S. Allen C. Wan B. Volosskiy M. Li Z. Zhao Y. Wang H. Sun P. An W. Chen Z. Guo C. Lee D. Chen I. Shakir M. Liu T. Hu Y. Li A.I. Kirkl X. Duan Y. Huang Nat. Catal. 1 2018 63 72 H. Fei, J. Dong, Y. Feng, C. S. Allen, C. Wan, B. Volosskiy, M. Li, Z. Zhao, Y. Wang, H. Sun, P. An, W. Chen, Z. Guo, C. Lee, D. Chen, I. Shakir, M. Liu, T. Hu, Y. Li, A. I. Kirkl, X. Duan, Y. Huang, Nat. Catal., 2018, 1, 63–72. 92 Y. Liu Y. Yang Z. Peng Z. Liu Z. Chen L. Shang S. Lu T. Zhang Nano Energy 65 2019 104023 Y. Liu, Y. Yang, Z. Peng, Z. Liu, Z. Chen, L. Shang, S. Lu, T. Zhang, Nano Energy, 2019, 65, 104023. 93 T. Feng Q. Zeng S. Lu M. Yang S. Tao Y. Chen Y. Zhao B. Yang ACS Sustainable Chem. Eng. 7 2019 7047 7057 T. Feng, Q. Zeng, S. Lu, M. Yang, S. Tao, Y. Chen, Y. Zhao, B. Yang, ACS Sustainable Chem. Eng., 2019, 7, 7047–7057. 94 S. Jin Y. Ni Z. Hao K. Zhang Y. Lu Z. Yan Y. Wei Y.R. Lu T.S. Chan J. Chen Angew. Chem. Int. Ed. 59 2020 21885 21889 S. Jin, Y. Ni, Z. Hao, K. Zhang, Y. Lu, Z. Yan, Y. Wei, Y. R. Lu, T. S. Chan, J. Chen, Angew. Chem. Int. Ed., 2020, 59, 21885–21889. 95 D. Li F. Xu X. Tang S. Dai T. Pu X. Liu P. Tian F. Xuan Z. Xu I.E. Wachs M. Zhu Nat. Catal. 5 2022 99 108 D. Li, F. Xu, X. Tang, S. Dai, T. Pu, X. Liu, P. Tian, F. Xuan, Z. Xu, I. E. Wachs, M. Zhu, Nat. Catal., 2022, 5, 99–108. 96 G. Murali J.K.R. Modigunta S. Park S. Lee H. Lee J. Yeon H. Kim Y.H. Park S.Y. Park J.R. Durrant H. Cha T.K. An I. In ACS Appl. Mater. Interfaces 13 2021 34648 34657 G. Murali, J. K. R. Modigunta, S. Park, S. Lee, H. Lee, J. Yeon, H. Kim, Y. H. Park, S. Y. Park, J. R. Durrant, H. Cha, T. K. An, I. In, ACS Appl. Mater. Interfaces, 2021, 13, 34648–34657. 97 R. Cheng Y. Xiang R. Guo L. Li G. Zou C. Fu H. Hou X. Ji Small 17 2021 2102091 R. Cheng, Y. Xiang, R. Guo, L. Li, G. Zou, C. Fu, H. Hou, X. Ji, Small, 2021, 17, 2102091. 98 H. Zhang L. Yang P. Zhang C. Lu D. Sha B. Yan W. He M. Zhou W. Zhang L. Pan Z. Sun Adv. Mater. 33 2021 2008447 H. Zhang, L. Yang, P. Zhang, C. Lu, D. Sha, B. Yan, W. He, M. Zhou, W. Zhang, L. Pan, Z. Sun, Adv. Mater., 2021, 33, 2008447. 99 D. Huang Y. Wu F. Ai X. Zhou G. Zhu Sensors Actuat. B 342 2021 130074 D. Huang, Y. Wu, F. Ai, X. Zhou, G. Zhu, Sensors Actuat. B, 2021, 342, 130074. 100 Y. Feng F. Zhou Q. Deng C. Peng Ceram. Int. 46 2020 8320 8327 Y. Feng, F. Zhou, Q. Deng, C. Peng, Ceram. Int., 2020, 46, 8320–8327. 101 F. Ai C. Fu G. Cheng H. Zhang Y. Feng X. Yan X. Zheng ACS Appl. Nano Mater. 4 2021 8192 8199 F. Ai, C. Fu, G. Cheng, H. Zhang, Y. Feng, X. Yan, X. Zheng, ACS Appl. Nano Mater., 2021, 4, 8192–8199. 102 R. Ibragimova P. Rinke H.-P. Komsa Chem. Mater. 34 2022 2896 2906 R. Ibragimova, P. Rinke, H.-P. Komsa, Chem. Mater., 2022, 34, 2896–2906. 103 J. Rong Z. Wang J. Lv M. Fan R. Chong Z. Chang Chin. J. Catal. 42 2021 1999 2009 J. Rong, Z. Wang, J. Lv, M. Fan, R. Chong, Z. Chang, Chin. J. Catal., 2021, 42, 1999–2009. 104 Q. Guan J. Ma W. Yang R. Zhang X. Zhang X. Dong Y. Fan L. Cai Y. Cao Y. Zhang N. Li Q. Xu Nanoscale 11 2019 14123 14133 Q. Guan, J. Ma, W. Yang, R. Zhang, X. Zhang, X. Dong, Y. Fan, L. Cai, Y. Cao, Y. Zhang, N. Li, Q. Xu, Nanoscale, 2019, 11, 14123–14133. 105 Q. Xu W. Yang Y. Wen S. Liu Z. Liu W.-J. Ong N. Li Appl. Mater. Today 16 2019 90 101 Q. Xu, W. Yang, Y. Wen, S. Liu, Z. Liu, W.-J. Ong, N. Li, Appl. Mater. Today, 2019, 16, 90–101. 106 Q. Xu J. Ma W. Khan X. Zeng N. Li Y. Cao X. Zhao M. Xu Chem. Commun. 56 2020 6648 6651 Q. Xu, J. Ma, W. Khan, X. Zeng, N. Li, Y. Cao, X. Zhao, M. Xu, Chem. Commun., 2020, 56, 6648–6651. 107 F. Yan J. Sun Y. Zang Z. Sun H. Zhang J. Xu X. Wang Dyes Pigm. 195 2021 109720 F. Yan, J. Sun, Y. Zang, Z. Sun, H. Zhang, J. Xu, X. Wang, Dyes Pigm., 2021, 195, 109720. 108 G. Gao A.P. O'Mullane A. Du ACS Catal. 7 2017 494 500 G. Gao, A. P. O'Mullane, A. Du, ACS Catal., 2017, 7, 494–500. 109 M. Zhang C. Lai B. Li S. Liu D. Huang F. Xu X. Liu L. Qin Y. Fu L. Li H. Yi L. Chen Small 17 2021 2007113 M. Zhang, C. Lai, B. Li, S. Liu, D. Huang, F. Xu, X. Liu, L. Qin, Y. Fu, L. Li, H. Yi, L. Chen, Small, 2021, 17, 2007113. 110 S. Zhou Y. Zhao R. Shi Y. Wang A. Ashok F. Héraly T. Zhang J. Yuan Adv. Mater. 34 2022 2204388 S. Zhou, Y. Zhao, R. Shi, Y. Wang, A. Ashok, F. Héraly, T. Zhang, J. Yuan, Adv. Mater., 2022, 34, 2204388. 111 W. Peng J. Han Y.-R. Lu M. Luo T.-S. Chan M. Peng Y. Tan ACS Nano 16 2022 4116 4125 W. Peng, J. Han, Y.-R. Lu, M. Luo, T.-S. Chan, M. Peng, Y. Tan, ACS Nano, 2022, 16, 4116–4125. 112 W. Li Y. Liu M. Wu X. Feng S.A.T. Redfern Y. Shang X. Yong T. Feng K. Wu Z. Liu B. Li Z. Chen J.S. Tse S. Lu B. Yang Adv. Mater. 30 2018 1800676 W. Li, Y. Liu, M. Wu, X. Feng, S. A. T. Redfern, Y. Shang, X. Yong, T. Feng, K. Wu, Z. Liu, B. Li, Z. Chen, J. S. Tse, S. Lu, B. Yang, Adv. Mater., 2018, 30, 1800676. 113 T. Wu M.-Y. Han Z.J. Xu ACS Nano 16 2022 8531 8539 T. Wu, M.-Y. Han, Z. J. Xu, ACS Nano, 2022, 16, 8531–8539. 114 M.R. Lukatskaya S.-M. Bak X. Yu X.-Q. Yang M.W. Barsoum Y. Gogotsi Adv. Energy Mater. 5 2015 1500589 M. R. Lukatskaya, S.-M. Bak, X. Yu, X.-Q. Yang, M. W. Barsoum, Y. Gogotsi, Adv. Energy Mater., 2015, 5, 1500589. 115 B. Anasori M.R. Lukatskaya Y. Gogotsi Nat. Rev. Mater. 2 2017 16098 B. Anasori, M. R. Lukatskaya, Y. Gogotsi, Nat. Rev. Mater., 2017, 2, 16098. 116 Y. Gao S. Zhang X. Sun W. Zhao H. Zhuo G. Zhuang S. Wang Z. Yao S. Deng X. Zhong Z. Wei J.-g. Wang Chin. J. Catal. 43 2022 1860 1869 Y. Gao, S. Zhang, X. Sun, W. Zhao, H. Zhuo, G. Zhuang, S. Wang, Z. Yao, S. Deng, X. Zhong, Z. Wei, J.-g. Wang, Chin. J. Catal., 2022, 43, 1860–1869. 117 B. Huang N. Zhou X. Chen W.J. Ong N. Li Chem. Eur. J. 24 2018 18479 18486 B. Huang, N. Zhou, X. Chen, W. J. Ong, N. Li, Chem. Eur. J., 2018, 24, 18479–18486. 118 Z. Deng X. Zheng M. Deng L. Li L. Jing Z. Wei Chin. J. Catal. 42 2021 1659 1666 Z. Deng, X. Zheng, M. Deng, L. Li, L. Jing, Z. Wei, Chin. J. Catal., 2021, 42, 1659–1666. 119 Y. Xie P.R.C. Kent Phys. Rev. B 87 2013 235441 Y. Xie, P. R. C. Kent, Phys. Rev. B, 2013, 87, 235441. 120 Y. Cheng X. Li P. Shen Y. Guo K. Chu Energy Environ. Mater. DOI: 10.1002/eem2.12268 2022 Y. Cheng, X. Li, P. Shen, Y. Guo, K. Chu, Energy Environ. Mater., 2022, DOI: 10.1002/eem2.12268. 121 C.F.S. Codeço A.Y. Klyushin E.A. Carbonio A. Knop-Gericke R. Schlögl T. Jones T.C.R. Rocha Phys. Chem. Chem. Phys. 24 2022 8832 8838 C. F. S. Codeço, A. Y. Klyushin, E. A. Carbonio, A. Knop-Gericke, R. Schlögl, T. Jones, T. C. R. Rocha, Phys. Chem. Chem. Phys., 2022, 24, 8832–8838. 122 S. Kenmoe D.H. Douma A.T. Raji B. M'Passi-Mabiala T. Götsch F. Girgsdies A. Knop-Gericke R. Schlögl E. Spohr Nanomaterials 12 2022 921 S. Kenmoe, D. H. Douma, A. T. Raji, B. M'Passi-Mabiala, T. Götsch, F. Girgsdies, A. Knop-Gericke, R. Schlögl, E. Spohr, Nanomaterials, 2022, 12, 921. 123 X. Zou W. Zhang X. Zhou K. Song X. Ge W. Zheng J. Energy Chem. 72 2022 509 515 X. Zou, W. Zhang, X. Zhou, K. Song, X. Ge, W. Zheng, J. Energy Chem., 2022, 72, 509–515. 124 A. Rafieerad W. Yan K.N. Alagarsamy A. Srivastava N. Sareen R.C. Arora S. Dhingra Adv. Funct. Mater. 31 2021 2106786 A. Rafieerad, W. Yan, K. N. Alagarsamy, A. Srivastava, N. Sareen, R. C. Arora, S. Dhingra, Adv. Funct. Mater., 2021, 31, 2106786. 125 V. Kamysbayev A.S. Filatov H. Hu X. Rui F. Lagunas D. Wang R.F. Klie D.V. Talapin Science 369 2020 979 983 V. Kamysbayev, A. S. Filatov, H. Hu, X. Rui, F. Lagunas, D. Wang, R. F. Klie, D. V. Talapin, Science, 2020, 369, 979–983. 126 G. Ma H. Shao J. Xu Y. Liu Q. Huang P.-L. Taberna P. Simon Z. Lin Nat. Commun. 12 2021 5085 G. Ma, H. Shao, J. Xu, Y. Liu, Q. Huang, P.-L. Taberna, P. Simon, Z. Lin, Nat. Commun., 2021, 12, 5085. 127 R. Yan Y. Zhang Y. Li L. Xia Q. Zhou bioRxiv DOI: 10.1101/2020.1102.1117.951848 2020 R. Yan, Y. Zhang, Y. Li, L. Xia, Q. Zhou, bioRxiv, 2020, DOI: 10.1101/2020.1102.1117.951848. 128 D. Wrapp N. Wang K.S. Corbett J.A. Goldsmith C.-L. Hsieh O. Abiona B.S. Graham J.S. McLellan Science 367 2020 1260 1263 D. Wrapp, N. Wang, K. S. Corbett, J. A. Goldsmith, C.-L. Hsieh, O. Abiona, B. S. Graham, J. S. McLellan, Science, 2020, 367, 1260–1263. 129 Z. Xu Z. Liang W. Guo R. Zou Coord. Chem. Rev. 436 2021 213824 Z. Xu, Z. Liang, W. Guo, R. Zou, Coord. Chem. Rev., 2021, 436, 213824. 130 W.H. Lee M.H. Han Y.-J. Ko B.K. Min K.H. Chae H.-S. Oh Nat. Commun. 13 2022 605 W. H. Lee, M. H. Han, Y.-J. Ko, B. K. Min, K. H. Chae, H.-S. Oh, Nat. Commun., 2022, 13, 605. 131 J.T. Mefford A.R. Akbashev M. Kang C.L. Bentley W.E. Gent H.D. Deng D.H. Alsem Y.-S. Yu N.J. Salmon D.A. Shapiro P.R. Unwin W.C. Chueh Nature 593 2021 67 73 J. T. Mefford, A. R. Akbashev, M. Kang, C. L. Bentley, W. E. Gent, H. D. Deng, D. H. Alsem, Y.-S. Yu, N. J. Salmon, D. A. Shapiro, P. R. Unwin, W. C. Chueh, Nature, 2021, 593, 67–73. 132 M. Favaro J. Yang S. Nappini E. Magnano F.M. Toma E.J. Crumlin J. Yano I.D. Sharp J. Am. Chem. Soc. 139 2017 8960 8970 M. Favaro, J. Yang, S. Nappini, E. Magnano, F. M. Toma, E. J. Crumlin, J. Yano, I. D. Sharp, J. Am. Chem. Soc., 2017, 139, 8960–8970. 133 Z. Yan H. Sun X. Chen H. Liu Y. Zhao H. Li W. Xie F. Cheng J. Chen Nat. Commun. 9 2018 2373 Z. Yan, H. Sun, X. Chen, H. Liu, Y. Zhao, H. Li, W. Xie, F. Cheng, J. Chen, Nat. Commun., 2018, 9, 2373. 134 S. Zuo Z.-P. Wu H. Zhang X.W. Lou Adv. Energy Mater. 12 2022 2103383 S. Zuo, Z.-P. Wu, H. Zhang, X. W. Lou, Adv. Energy Mater., 2022, 12, 2103383. 135 A. Grimaud A. Demortière M. Saubanère W. Dachraoui M. Duchamp M.-L. Doublet J.-M. Tarascon Nat. Energy 2 2016 16189 A. Grimaud, A. Demortière, M. Saubanère, W. Dachraoui, M. Duchamp, M.-L. Doublet, J.-M. Tarascon, Nat. Energy, 2016, 2, 16189. 136 D. Göhl A. Garg P. Paciok K.J.J. Mayrhofer M. Heggen Y. Shao-Horn R.E. Dunin-Borkowski Y. Román-Leshkov M. Ledendecker Nat. Mater. 19 2020 287 291 D. Göhl, A. Garg, P. Paciok, K. J. J. Mayrhofer, M. Heggen, Y. Shao-Horn, R. E. Dunin-Borkowski, Y. Román-Leshkov, M. Ledendecker, Nat. Mater., 2020, 19, 287–291. 137 Y. Cheng L. Wang Y. Li Y. Song Y. Zhang J. Phys. Chem. C 123 2019 15629 15636 Y. Cheng, L. Wang, Y. Li, Y. Song, Y. Zhang, J. Phys. Chem. C, 2019, 123, 15629–15636. 138 X. Zhou Y. Tian J. Luo B. Jin Z. Wu X. Ning L. Zhan X. Fan T. Zhou S. Zhang X. Zhou Adv. Funct. Mater. 32 2022 2201518 X. Zhou, Y. Tian, J. Luo, B. Jin, Z. Wu, X. Ning, L. Zhan, X. Fan, T. Zhou, S. Zhang, X. Zhou, Adv. Funct. Mater., 2022, 32, 2201518. 139 C.-T. Dinh A. Jain F.P.G. de Arquer P. De Luna J. Li N. Wang X. Zheng J. Cai B.Z. Gregory O. Voznyy B. Zhang M. Liu D. Sinton E.J. Crumlin E.H. Sargent Nat. Energy 4 2019 107 114 C.-T. Dinh, A. Jain, F. P. G. de Arquer, P. De Luna, J. Li, N. Wang, X. Zheng, J. Cai, B. Z. Gregory, O. Voznyy, B. Zhang, M. Liu, D. Sinton, E. J. Crumlin, E. H. Sargent, Nat. Energy, 2019, 4, 107–114. 140 L. He J. Wu Y. Zhu Y. Wang Y. Mei Ind. Eng. Chem. Res. 60 2021 5443 5450 L. He, J. Wu, Y. Zhu, Y. Wang, Y. Mei, Ind. Eng. Chem. Res., 2021, 60, 5443–5450. 141 Y.-T. Liu D. Li J. Yu B. Ding Angew. Chem. Int. Ed. 58 2019 16439 16444 Y.-T. Liu, D. Li, J. Yu, B. Ding, Angew. Chem. Int. Ed., 2019, 58, 16439–16444. 142 L. Tian Z. Li P. Wang X. Zhai X. Wang T. Li J. Energy Chem. 55 2021 279 294 L. Tian, Z. Li, P. Wang, X. Zhai, X. Wang, T. Li, J. Energy Chem., 2021, 55, 279–294. 143 C. Wang J. Gao J.-G. Zhao D.-J. Yan X.-D. Zhu Small 16 2020 1907091 C. Wang, J. Gao, J.-G. Zhao, D.-J. Yan, X.-D. Zhu, Small, 2020, 16, 1907091. 144 G. Zhan J. Zhang Y. Wang C. Yu J. Wu J. Cui X. Shu Y. Qin H. Zheng J. Sun J. Yan Y. Zhang C.S. Tiwary Y. Wu J. Colloid Interface Sci. 566 2020 411 418 G. Zhan, J. Zhang, Y. Wang, C. Yu, J. Wu, J. Cui, X. Shu, Y. Qin, H. Zheng, J. Sun, J. Yan, Y. Zhang, C. S. Tiwary, Y. Wu, J. Colloid Interface Sci., 2020, 566, 411–418. Wei Zhang (Jilin University) obtained his Ph.D. degree at the Institute of Metal Research Chinese Academy of Sciences in 2004. Then He held positions in NIMS-Japan, Samsung AIT-South Korea, Fritz-Haber Institute of MPG-Germany, DTU-Denmark and CIC Energigune-Spain. He was awarded Ikerbasque Research Professor in 2016. In 2014, he became a full professor at Jilin University and has been selected as Tang Auchin Scholar Leading Professor since 2020; Now he serves as the Director of the Electron Microscopy Center of Jilin University. His current research focuses on surface and interface of advanced energy materials and catalysts. Prof. Zhang was invited as a member of the editorial board of Communications Chemistry at Nature Publishing Group. Weitao Zheng (Jilin University) is Cheung Kong Distinguished Professor and Vice President of Jilin University. He obtained his Ph.D. degree at Jilin University in 1990. After that, he held positions at the Royal Institute of Sweden, Linköping University, Chiba Institute of Technology, and Nanyang University of Technology. His current research focuses on energy materials, functional thin films, and catalysts. Prof. Zheng was invited as an editorial board member of Applied Surface Science and Vacuum.",
      "scopus-id": "85140234857",
      "coredata": {
        "eid": "1-s2.0-S1872206722641676",
        "dc:description": "Scientific research is currently more interdisciplinary. Researchers have parsed the surface structure of virus, constructed the interaction model of virus-receptors, offering the clues for studying efficient targeted drugs. Likewise, catalysis is also highly relevant to modern human life. Exploring the surface structure and physicochemical properties of catalysts is of great significance for the design of efficient catalysts. Great progresses have been made for endowing specific physicochemical properties of catalysts through controlling the size of materials and coordination chemistry of active sites, particularly at nanometer scale since Sir John Meurig Thomas and Tao Zhang's early ground-breaking contribution, with casting on a very surface issue. Herein, functional regulation renders the emerging MXene quantum dots (MQDs) excel in contrast to the typical carbon-based quantum dots. In fact, similar to the interaction of virus-receptors model, the surface functional groups decorated MQDs provide a mini-lab to afford a variety of adjustments, involved with the type modification and electronic structure tuning of groups as well as their arrangement, together with the interaction between the groups and active materials/support, ultimately for packaging or designing high-activity catalysts.",
        "openArchiveArticle": "false",
        "prism:coverDate": "2022-11-30",
        "openaccessUserLicense": null,
        "prism:aggregationType": "Journal",
        "prism:url": "https://api.elsevier.com/content/article/pii/S1872206722641676",
        "dc:creator": [
          {
            "@_fa": "true",
            "$": "Liu, Yuhua"
          },
          {
            "@_fa": "true",
            "$": "Zhang, Wei"
          },
          {
            "@_fa": "true",
            "$": "Zheng, Weitao"
          }
        ],
        "link": [
          {
            "@_fa": "true",
            "@rel": "self",
            "@href": "https://api.elsevier.com/content/article/pii/S1872206722641676"
          },
          {
            "@_fa": "true",
            "@rel": "scidir",
            "@href": "https://www.sciencedirect.com/science/article/pii/S1872206722641676"
          }
        ],
        "dc:format": "application/json",
        "openaccessType": null,
        "pii": "S1872-2067(22)64167-6",
        "prism:volume": "43",
        "prism:publisher": "Dalian Institute of Chemical Physics, the Chinese Academy of Sciences. Published by Elsevier B.V.",
        "dc:title": "Surface chemistry of MXene quantum dots: Virus mechanism-inspired mini-lab for catalysis",
        "prism:copyright": "Copyright © 2022 Dalian Institute of Chemical Physics, the Chinese Academy of Sciences. Published by Elsevier B.V. All rights reserved.",
        "openaccess": "0",
        "prism:issn": "18722067",
        "prism:issueIdentifier": "11",
        "dcterms:subject": [
          {
            "@_fa": "true",
            "$": "Surface chemistry"
          },
          {
            "@_fa": "true",
            "$": "Functional group"
          },
          {
            "@_fa": "true",
            "$": "Structure characterization"
          },
          {
            "@_fa": "true",
            "$": "MXene"
          },
          {
            "@_fa": "true",
            "$": "Quantum dot"
          }
        ],
        "openaccessArticle": "false",
        "prism:publicationName": "Chinese Journal of Catalysis",
        "prism:number": "11",
        "openaccessSponsorType": null,
        "prism:pageRange": "2913-2935",
        "prism:endingPage": "2935",
        "pubType": "rev",
        "prism:coverDisplayDate": "November 2022",
        "prism:doi": "10.1016/S1872-2067(22)64167-6",
        "prism:startingPage": "2913",
        "dc:identifier": "doi:10.1016/S1872-2067(22)64167-6",
        "openaccessSponsorName": null
      },
      "objects": {
        "object": [
          {
            "@category": "standard",
            "@height": "226",
            "@width": "301",
            "@_fa": "true",
            "$": "https://api.elsevier.com/content/object/eid/1-s2.0-S1872206722641676-fx1.jpg?httpAccept=%2A%2F%2A",
            "@multimediatype": "JPEG image file",
            "@type": "IMAGE-DOWNSAMPLED",
            "@size": "28790",
            "@ref": "fx1",
            "@mimetype": "image/jpeg"
          },
          {
            "@category": "standard",
            "@height": "146",
            "@width": "116",
            "@_fa": "true",
            "$": "https://api.elsevier.com/content/object/eid/1-s2.0-S1872206722641676-fx2.jpg?httpAccept=%2A%2F%2A",
            "@multimediatype": "JPEG image file",
            "@type": "IMAGE-DOWNSAMPLED",
            "@size": "5153",
            "@ref": "fx2",
            "@mimetype": "image/jpeg"
          },
          {
            "@category": "standard",
            "@height": "150",
            "@width": "105",
            "@_fa": "true",
            "$": "https://api.elsevier.com/content/object/eid/1-s2.0-S1872206722641676-fx3.jpg?httpAccept=%2A%2F%2A",
            "@multimediatype": "JPEG image file",
            "@type": "IMAGE-DOWNSAMPLED",
            "@size": "5863",
            "@ref": "fx3",
            "@mimetype": "image/jpeg"
          },
          {
            "@category": "standard",
            "@height": "305",
            "@width": "369",
            "@_fa": "true",
            "$": "https://api.elsevier.com/content/object/eid/1-s2.0-S1872206722641676-gr1.jpg?httpAccept=%2A%2F%2A",
            "@multimediatype": "JPEG image file",
            "@type": "IMAGE-DOWNSAMPLED",
            "@size": "47656",
            "@ref": "gr1",
            "@mimetype": "image/jpeg"
          },
          {
            "@category": "standard",
            "@height": "521",
            "@width": "494",
            "@_fa": "true",
            "$": "https://api.elsevier.com/content/object/eid/1-s2.0-S1872206722641676-gr10.jpg?httpAccept=%2A%2F%2A",
            "@multimediatype": "JPEG image file",
            "@type": "IMAGE-DOWNSAMPLED",
            "@size": "140784",
            "@ref": "gr10",
            "@mimetype": "image/jpeg"
          },
          {
            "@category": "standard",
            "@height": "468",
            "@width": "616",
            "@_fa": "true",
            "$": "https://api.elsevier.com/content/object/eid/1-s2.0-S1872206722641676-gr11.jpg?httpAccept=%2A%2F%2A",
            "@multimediatype": "JPEG image file",
            "@type": "IMAGE-DOWNSAMPLED",
            "@size": "149492",
            "@ref": "gr11",
            "@mimetype": "image/jpeg"
          },
          {
            "@category": "standard",
            "@height": "532",
            "@width": "624",
            "@_fa": "true",
            "$": "https://api.elsevier.com/content/object/eid/1-s2.0-S1872206722641676-gr12.jpg?httpAccept=%2A%2F%2A",
            "@multimediatype": "JPEG image file",
            "@type": "IMAGE-DOWNSAMPLED",
            "@size": "157250",
            "@ref": "gr12",
            "@mimetype": "image/jpeg"
          },
          {
            "@category": "standard",
            "@height": "487",
            "@width": "619",
            "@_fa": "true",
            "$": "https://api.elsevier.com/content/object/eid/1-s2.0-S1872206722641676-gr13.jpg?httpAccept=%2A%2F%2A",
            "@multimediatype": "JPEG image file",
            "@type": "IMAGE-DOWNSAMPLED",
            "@size": "124595",
            "@ref": "gr13",
            "@mimetype": "image/jpeg"
          },
          {
            "@category": "standard",
            "@height": "429",
            "@width": "615",
            "@_fa": "true",
            "$": "https://api.elsevier.com/content/object/eid/1-s2.0-S1872206722641676-gr14.jpg?httpAccept=%2A%2F%2A",
            "@multimediatype": "JPEG image file",
            "@type": "IMAGE-DOWNSAMPLED",
            "@size": "129361",
            "@ref": "gr14",
            "@mimetype": "image/jpeg"
          },
          {
            "@category": "standard",
            "@height": "441",
            "@width": "508",
            "@_fa": "true",
            "$": "https://api.elsevier.com/content/object/eid/1-s2.0-S1872206722641676-gr15.jpg?httpAccept=%2A%2F%2A",
            "@multimediatype": "JPEG image file",
            "@type": "IMAGE-DOWNSAMPLED",
            "@size": "58087",
            "@ref": "gr15",
            "@mimetype": "image/jpeg"
          },
          {
            "@category": "standard",
            "@height": "330",
            "@width": "369",
            "@_fa": "true",
            "$": "https://api.elsevier.com/content/object/eid/1-s2.0-S1872206722641676-gr16.jpg?httpAccept=%2A%2F%2A",
            "@multimediatype": "JPEG image file",
            "@type": "IMAGE-DOWNSAMPLED",
            "@size": "71572",
            "@ref": "gr16",
            "@mimetype": "image/jpeg"
          },
          {
            "@category": "standard",
            "@height": "356",
            "@width": "593",
            "@_fa": "true",
            "$": "https://api.elsevier.com/content/object/eid/1-s2.0-S1872206722641676-gr17.jpg?httpAccept=%2A%2F%2A",
            "@multimediatype": "JPEG image file",
            "@type": "IMAGE-DOWNSAMPLED",
            "@size": "100400",
            "@ref": "gr17",
            "@mimetype": "image/jpeg"
          },
          {
            "@category": "standard",
            "@height": "668",
            "@width": "656",
            "@_fa": "true",
            "$": "https://api.elsevier.com/content/object/eid/1-s2.0-S1872206722641676-gr18.jpg?httpAccept=%2A%2F%2A",
            "@multimediatype": "JPEG image file",
            "@type": "IMAGE-DOWNSAMPLED",
            "@size": "201674",
            "@ref": "gr18",
            "@mimetype": "image/jpeg"
          },
          {
            "@category": "standard",
            "@height": "440",
            "@width": "606",
            "@_fa": "true",
            "$": "https://api.elsevier.com/content/object/eid/1-s2.0-S1872206722641676-gr19.jpg?httpAccept=%2A%2F%2A",
            "@multimediatype": "JPEG image file",
            "@type": "IMAGE-DOWNSAMPLED",
            "@size": "126847",
            "@ref": "gr19",
            "@mimetype": "image/jpeg"
          },
          {
            "@category": "standard",
            "@height": "122",
            "@width": "374",
            "@_fa": "true",
            "$": "https://api.elsevier.com/content/object/eid/1-s2.0-S1872206722641676-gr2.jpg?httpAccept=%2A%2F%2A",
            "@multimediatype": "JPEG image file",
            "@type": "IMAGE-DOWNSAMPLED",
            "@size": "17639",
            "@ref": "gr2",
            "@mimetype": "image/jpeg"
          },
          {
            "@category": "standard",
            "@height": "261",
            "@width": "256",
            "@_fa": "true",
            "$": "https://api.elsevier.com/content/object/eid/1-s2.0-S1872206722641676-gr20.jpg?httpAccept=%2A%2F%2A",
            "@multimediatype": "JPEG image file",
            "@type": "IMAGE-DOWNSAMPLED",
            "@size": "21234",
            "@ref": "gr20",
            "@mimetype": "image/jpeg"
          },
          {
            "@category": "standard",
            "@height": "173",
            "@width": "476",
            "@_fa": "true",
            "$": "https://api.elsevier.com/content/object/eid/1-s2.0-S1872206722641676-gr3.jpg?httpAccept=%2A%2F%2A",
            "@multimediatype": "JPEG image file",
            "@type": "IMAGE-DOWNSAMPLED",
            "@size": "34964",
            "@ref": "gr3",
            "@mimetype": "image/jpeg"
          },
          {
            "@category": "standard",
            "@height": "434",
            "@width": "427",
            "@_fa": "true",
            "$": "https://api.elsevier.com/content/object/eid/1-s2.0-S1872206722641676-gr4.jpg?httpAccept=%2A%2F%2A",
            "@multimediatype": "JPEG image file",
            "@type": "IMAGE-DOWNSAMPLED",
            "@size": "115306",
            "@ref": "gr4",
            "@mimetype": "image/jpeg"
          },
          {
            "@category": "standard",
            "@height": "218",
            "@width": "370",
            "@_fa": "true",
            "$": "https://api.elsevier.com/content/object/eid/1-s2.0-S1872206722641676-gr5.jpg?httpAccept=%2A%2F%2A",
            "@multimediatype": "JPEG image file",
            "@type": "IMAGE-DOWNSAMPLED",
            "@size": "21355",
            "@ref": "gr5",
            "@mimetype": "image/jpeg"
          },
          {
            "@category": "standard",
            "@height": "545",
            "@width": "575",
            "@_fa": "true",
            "$": "https://api.elsevier.com/content/object/eid/1-s2.0-S1872206722641676-gr6.jpg?httpAccept=%2A%2F%2A",
            "@multimediatype": "JPEG image file",
            "@type": "IMAGE-DOWNSAMPLED",
            "@size": "152456",
            "@ref": "gr6",
            "@mimetype": "image/jpeg"
          },
          {
            "@category": "standard",
            "@height": "539",
            "@width": "557",
            "@_fa": "true",
            "$": "https://api.elsevier.com/content/object/eid/1-s2.0-S1872206722641676-gr7.jpg?httpAccept=%2A%2F%2A",
            "@multimediatype": "JPEG image file",
            "@type": "IMAGE-DOWNSAMPLED",
            "@size": "126088",
            "@ref": "gr7",
            "@mimetype": "image/jpeg"
          },
          {
            "@category": "standard",
            "@height": "355",
            "@width": "486",
            "@_fa": "true",
            "$": "https://api.elsevier.com/content/object/eid/1-s2.0-S1872206722641676-gr8.jpg?httpAccept=%2A%2F%2A",
            "@multimediatype": "JPEG image file",
            "@type": "IMAGE-DOWNSAMPLED",
            "@size": "81629",
            "@ref": "gr8",
            "@mimetype": "image/jpeg"
          },
          {
            "@category": "standard",
            "@height": "462",
            "@width": "611",
            "@_fa": "true",
            "$": "https://api.elsevier.com/content/object/eid/1-s2.0-S1872206722641676-gr9.jpg?httpAccept=%2A%2F%2A",
            "@multimediatype": "JPEG image file",
            "@type": "IMAGE-DOWNSAMPLED",
            "@size": "104501",
            "@ref": "gr9",
            "@mimetype": "image/jpeg"
          },
          {
            "@category": "thumbnail",
            "@height": "164",
            "@width": "219",
            "@_fa": "true",
            "$": "https://api.elsevier.com/content/object/eid/1-s2.0-S1872206722641676-fx1.sml?httpAccept=%2A%2F%2A",
            "@multimediatype": "GIF image file",
            "@type": "IMAGE-THUMBNAIL",
            "@size": "28363",
            "@ref": "fx1",
            "@mimetype": "image/gif"
          },
          {
            "@category": "thumbnail",
            "@height": "164",
            "@width": "130",
            "@_fa": "true",
            "$": "https://api.elsevier.com/content/object/eid/1-s2.0-S1872206722641676-fx2.sml?httpAccept=%2A%2F%2A",
            "@multimediatype": "GIF image file",
            "@type": "IMAGE-THUMBNAIL",
            "@size": "13406",
            "@ref": "fx2",
            "@mimetype": "image/gif"
          },
          {
            "@category": "thumbnail",
            "@height": "164",
            "@width": "115",
            "@_fa": "true",
            "$": "https://api.elsevier.com/content/object/eid/1-s2.0-S1872206722641676-fx3.sml?httpAccept=%2A%2F%2A",
            "@multimediatype": "GIF image file",
            "@type": "IMAGE-THUMBNAIL",
            "@size": "14294",
            "@ref": "fx3",
            "@mimetype": "image/gif"
          },
          {
            "@category": "thumbnail",
            "@height": "164",
            "@width": "198",
            "@_fa": "true",
            "$": "https://api.elsevier.com/content/object/eid/1-s2.0-S1872206722641676-gr1.sml?httpAccept=%2A%2F%2A",
            "@multimediatype": "GIF image file",
            "@type": "IMAGE-THUMBNAIL",
            "@size": "19297",
            "@ref": "gr1",
            "@mimetype": "image/gif"
          },
          {
            "@category": "thumbnail",
            "@height": "163",
            "@width": "155",
            "@_fa": "true",
            "$": "https://api.elsevier.com/content/object/eid/1-s2.0-S1872206722641676-gr10.sml?httpAccept=%2A%2F%2A",
            "@multimediatype": "GIF image file",
            "@type": "IMAGE-THUMBNAIL",
            "@size": "16180",
            "@ref": "gr10",
            "@mimetype": "image/gif"
          },
          {
            "@category": "thumbnail",
            "@height": "164",
            "@width": "215",
            "@_fa": "true",
            "$": "https://api.elsevier.com/content/object/eid/1-s2.0-S1872206722641676-gr11.sml?httpAccept=%2A%2F%2A",
            "@multimediatype": "GIF image file",
            "@type": "IMAGE-THUMBNAIL",
            "@size": "24593",
            "@ref": "gr11",
            "@mimetype": "image/gif"
          },
          {
            "@category": "thumbnail",
            "@height": "164",
            "@width": "192",
            "@_fa": "true",
            "$": "https://api.elsevier.com/content/object/eid/1-s2.0-S1872206722641676-gr12.sml?httpAccept=%2A%2F%2A",
            "@multimediatype": "GIF image file",
            "@type": "IMAGE-THUMBNAIL",
            "@size": "21330",
            "@ref": "gr12",
            "@mimetype": "image/gif"
          },
          {
            "@category": "thumbnail",
            "@height": "164",
            "@width": "208",
            "@_fa": "true",
            "$": "https://api.elsevier.com/content/object/eid/1-s2.0-S1872206722641676-gr13.sml?httpAccept=%2A%2F%2A",
            "@multimediatype": "GIF image file",
            "@type": "IMAGE-THUMBNAIL",
            "@size": "18038",
            "@ref": "gr13",
            "@mimetype": "image/gif"
          },
          {
            "@category": "thumbnail",
            "@height": "153",
            "@width": "219",
            "@_fa": "true",
            "$": "https://api.elsevier.com/content/object/eid/1-s2.0-S1872206722641676-gr14.sml?httpAccept=%2A%2F%2A",
            "@multimediatype": "GIF image file",
            "@type": "IMAGE-THUMBNAIL",
            "@size": "24605",
            "@ref": "gr14",
            "@mimetype": "image/gif"
          },
          {
            "@category": "thumbnail",
            "@height": "164",
            "@width": "189",
            "@_fa": "true",
            "$": "https://api.elsevier.com/content/object/eid/1-s2.0-S1872206722641676-gr15.sml?httpAccept=%2A%2F%2A",
            "@multimediatype": "GIF image file",
            "@type": "IMAGE-THUMBNAIL",
            "@size": "11323",
            "@ref": "gr15",
            "@mimetype": "image/gif"
          },
          {
            "@category": "thumbnail",
            "@height": "164",
            "@width": "183",
            "@_fa": "true",
            "$": "https://api.elsevier.com/content/object/eid/1-s2.0-S1872206722641676-gr16.sml?httpAccept=%2A%2F%2A",
            "@multimediatype": "GIF image file",
            "@type": "IMAGE-THUMBNAIL",
            "@size": "24901",
            "@ref": "gr16",
            "@mimetype": "image/gif"
          },
          {
            "@category": "thumbnail",
            "@height": "132",
            "@width": "219",
            "@_fa": "true",
            "$": "https://api.elsevier.com/content/object/eid/1-s2.0-S1872206722641676-gr17.sml?httpAccept=%2A%2F%2A",
            "@multimediatype": "GIF image file",
            "@type": "IMAGE-THUMBNAIL",
            "@size": "15329",
            "@ref": "gr17",
            "@mimetype": "image/gif"
          },
          {
            "@category": "thumbnail",
            "@height": "164",
            "@width": "161",
            "@_fa": "true",
            "$": "https://api.elsevier.com/content/object/eid/1-s2.0-S1872206722641676-gr18.sml?httpAccept=%2A%2F%2A",
            "@multimediatype": "GIF image file",
            "@type": "IMAGE-THUMBNAIL",
            "@size": "16516",
            "@ref": "gr18",
            "@mimetype": "image/gif"
          },
          {
            "@category": "thumbnail",
            "@height": "159",
            "@width": "219",
            "@_fa": "true",
            "$": "https://api.elsevier.com/content/object/eid/1-s2.0-S1872206722641676-gr19.sml?httpAccept=%2A%2F%2A",
            "@multimediatype": "GIF image file",
            "@type": "IMAGE-THUMBNAIL",
            "@size": "18865",
            "@ref": "gr19",
            "@mimetype": "image/gif"
          },
          {
            "@category": "thumbnail",
            "@height": "71",
            "@width": "219",
            "@_fa": "true",
            "$": "https://api.elsevier.com/content/object/eid/1-s2.0-S1872206722641676-gr2.sml?httpAccept=%2A%2F%2A",
            "@multimediatype": "GIF image file",
            "@type": "IMAGE-THUMBNAIL",
            "@size": "9624",
            "@ref": "gr2",
            "@mimetype": "image/gif"
          },
          {
            "@category": "thumbnail",
            "@height": "163",
            "@width": "160",
            "@_fa": "true",
            "$": "https://api.elsevier.com/content/object/eid/1-s2.0-S1872206722641676-gr20.sml?httpAccept=%2A%2F%2A",
            "@multimediatype": "GIF image file",
            "@type": "IMAGE-THUMBNAIL",
            "@size": "12194",
            "@ref": "gr20",
            "@mimetype": "image/gif"
          },
          {
            "@category": "thumbnail",
            "@height": "80",
            "@width": "219",
            "@_fa": "true",
            "$": "https://api.elsevier.com/content/object/eid/1-s2.0-S1872206722641676-gr3.sml?httpAccept=%2A%2F%2A",
            "@multimediatype": "GIF image file",
            "@type": "IMAGE-THUMBNAIL",
            "@size": "10368",
            "@ref": "gr3",
            "@mimetype": "image/gif"
          },
          {
            "@category": "thumbnail",
            "@height": "164",
            "@width": "161",
            "@_fa": "true",
            "$": "https://api.elsevier.com/content/object/eid/1-s2.0-S1872206722641676-gr4.sml?httpAccept=%2A%2F%2A",
            "@multimediatype": "GIF image file",
            "@type": "IMAGE-THUMBNAIL",
            "@size": "17575",
            "@ref": "gr4",
            "@mimetype": "image/gif"
          },
          {
            "@category": "thumbnail",
            "@height": "129",
            "@width": "219",
            "@_fa": "true",
            "$": "https://api.elsevier.com/content/object/eid/1-s2.0-S1872206722641676-gr5.sml?httpAccept=%2A%2F%2A",
            "@multimediatype": "GIF image file",
            "@type": "IMAGE-THUMBNAIL",
            "@size": "7172",
            "@ref": "gr5",
            "@mimetype": "image/gif"
          },
          {
            "@category": "thumbnail",
            "@height": "164",
            "@width": "173",
            "@_fa": "true",
            "$": "https://api.elsevier.com/content/object/eid/1-s2.0-S1872206722641676-gr6.sml?httpAccept=%2A%2F%2A",
            "@multimediatype": "GIF image file",
            "@type": "IMAGE-THUMBNAIL",
            "@size": "16559",
            "@ref": "gr6",
            "@mimetype": "image/gif"
          },
          {
            "@category": "thumbnail",
            "@height": "164",
            "@width": "169",
            "@_fa": "true",
            "$": "https://api.elsevier.com/content/object/eid/1-s2.0-S1872206722641676-gr7.sml?httpAccept=%2A%2F%2A",
            "@multimediatype": "GIF image file",
            "@type": "IMAGE-THUMBNAIL",
            "@size": "16457",
            "@ref": "gr7",
            "@mimetype": "image/gif"
          },
          {
            "@category": "thumbnail",
            "@height": "160",
            "@width": "219",
            "@_fa": "true",
            "$": "https://api.elsevier.com/content/object/eid/1-s2.0-S1872206722641676-gr8.sml?httpAccept=%2A%2F%2A",
            "@multimediatype": "GIF image file",
            "@type": "IMAGE-THUMBNAIL",
            "@size": "23177",
            "@ref": "gr8",
            "@mimetype": "image/gif"
          },
          {
            "@category": "thumbnail",
            "@height": "164",
            "@width": "217",
            "@_fa": "true",
            "$": "https://api.elsevier.com/content/object/eid/1-s2.0-S1872206722641676-gr9.sml?httpAccept=%2A%2F%2A",
            "@multimediatype": "GIF image file",
            "@type": "IMAGE-THUMBNAIL",
            "@size": "17005",
            "@ref": "gr9",
            "@mimetype": "image/gif"
          },
          {
            "@category": "high",
            "@height": "600",
            "@width": "800",
            "@_fa": "true",
            "$": "https://api.elsevier.com/content/object/eid/1-s2.0-S1872206722641676-fx1_lrg.jpg?httpAccept=%2A%2F%2A",
            "@multimediatype": "JPEG image file",
            "@type": "IMAGE-HIGH-RES",
            "@size": "140842",
            "@ref": "fx1",
            "@mimetype": "image/jpeg"
          },
          {
            "@category": "high",
            "@height": "389",
            "@width": "309",
            "@_fa": "true",
            "$": "https://api.elsevier.com/content/object/eid/1-s2.0-S1872206722641676-fx2_lrg.jpg?httpAccept=%2A%2F%2A",
            "@multimediatype": "JPEG image file",
            "@type": "IMAGE-HIGH-RES",
            "@size": "21428",
            "@ref": "fx2",
            "@mimetype": "image/jpeg"
          },
          {
            "@category": "high",
            "@height": "399",
            "@width": "280",
            "@_fa": "true",
            "$": "https://api.elsevier.com/content/object/eid/1-s2.0-S1872206722641676-fx3_lrg.jpg?httpAccept=%2A%2F%2A",
            "@multimediatype": "JPEG image file",
            "@type": "IMAGE-HIGH-RES",
            "@size": "26187",
            "@ref": "fx3",
            "@mimetype": "image/jpeg"
          },
          {
            "@category": "high",
            "@height": "813",
            "@width": "982",
            "@_fa": "true",
            "$": "https://api.elsevier.com/content/object/eid/1-s2.0-S1872206722641676-gr1_lrg.jpg?httpAccept=%2A%2F%2A",
            "@multimediatype": "JPEG image file",
            "@type": "IMAGE-HIGH-RES",
            "@size": "226461",
            "@ref": "gr1",
            "@mimetype": "image/jpeg"
          },
          {
            "@category": "high",
            "@height": "1385",
            "@width": "1314",
            "@_fa": "true",
            "$": "https://api.elsevier.com/content/object/eid/1-s2.0-S1872206722641676-gr10_lrg.jpg?httpAccept=%2A%2F%2A",
            "@multimediatype": "JPEG image file",
            "@type": "IMAGE-HIGH-RES",
            "@size": "561272",
            "@ref": "gr10",
            "@mimetype": "image/jpeg"
          },
          {
            "@category": "high",
            "@height": "1245",
            "@width": "1637",
            "@_fa": "true",
            "$": "https://api.elsevier.com/content/object/eid/1-s2.0-S1872206722641676-gr11_lrg.jpg?httpAccept=%2A%2F%2A",
            "@multimediatype": "JPEG image file",
            "@type": "IMAGE-HIGH-RES",
            "@size": "680671",
            "@ref": "gr11",
            "@mimetype": "image/jpeg"
          },
          {
            "@category": "high",
            "@height": "1414",
            "@width": "1657",
            "@_fa": "true",
            "$": "https://api.elsevier.com/content/object/eid/1-s2.0-S1872206722641676-gr12_lrg.jpg?httpAccept=%2A%2F%2A",
            "@multimediatype": "JPEG image file",
            "@type": "IMAGE-HIGH-RES",
            "@size": "674454",
            "@ref": "gr12",
            "@mimetype": "image/jpeg"
          },
          {
            "@category": "high",
            "@height": "1294",
            "@width": "1646",
            "@_fa": "true",
            "$": "https://api.elsevier.com/content/object/eid/1-s2.0-S1872206722641676-gr13_lrg.jpg?httpAccept=%2A%2F%2A",
            "@multimediatype": "JPEG image file",
            "@type": "IMAGE-HIGH-RES",
            "@size": "529635",
            "@ref": "gr13",
            "@mimetype": "image/jpeg"
          },
          {
            "@category": "high",
            "@height": "1140",
            "@width": "1633",
            "@_fa": "true",
            "$": "https://api.elsevier.com/content/object/eid/1-s2.0-S1872206722641676-gr14_lrg.jpg?httpAccept=%2A%2F%2A",
            "@multimediatype": "JPEG image file",
            "@type": "IMAGE-HIGH-RES",
            "@size": "625643",
            "@ref": "gr14",
            "@mimetype": "image/jpeg"
          },
          {
            "@category": "high",
            "@height": "1172",
            "@width": "1350",
            "@_fa": "true",
            "$": "https://api.elsevier.com/content/object/eid/1-s2.0-S1872206722641676-gr15_lrg.jpg?httpAccept=%2A%2F%2A",
            "@multimediatype": "JPEG image file",
            "@type": "IMAGE-HIGH-RES",
            "@size": "245149",
            "@ref": "gr15",
            "@mimetype": "image/jpeg"
          },
          {
            "@category": "high",
            "@height": "878",
            "@width": "981",
            "@_fa": "true",
            "$": "https://api.elsevier.com/content/object/eid/1-s2.0-S1872206722641676-gr16_lrg.jpg?httpAccept=%2A%2F%2A",
            "@multimediatype": "JPEG image file",
            "@type": "IMAGE-HIGH-RES",
            "@size": "328857",
            "@ref": "gr16",
            "@mimetype": "image/jpeg"
          },
          {
            "@category": "high",
            "@height": "946",
            "@width": "1575",
            "@_fa": "true",
            "$": "https://api.elsevier.com/content/object/eid/1-s2.0-S1872206722641676-gr17_lrg.jpg?httpAccept=%2A%2F%2A",
            "@multimediatype": "JPEG image file",
            "@type": "IMAGE-HIGH-RES",
            "@size": "402153",
            "@ref": "gr17",
            "@mimetype": "image/jpeg"
          },
          {
            "@category": "high",
            "@height": "1775",
            "@width": "1743",
            "@_fa": "true",
            "$": "https://api.elsevier.com/content/object/eid/1-s2.0-S1872206722641676-gr18_lrg.jpg?httpAccept=%2A%2F%2A",
            "@multimediatype": "JPEG image file",
            "@type": "IMAGE-HIGH-RES",
            "@size": "819712",
            "@ref": "gr18",
            "@mimetype": "image/jpeg"
          },
          {
            "@category": "high",
            "@height": "1168",
            "@width": "1610",
            "@_fa": "true",
            "$": "https://api.elsevier.com/content/object/eid/1-s2.0-S1872206722641676-gr19_lrg.jpg?httpAccept=%2A%2F%2A",
            "@multimediatype": "JPEG image file",
            "@type": "IMAGE-HIGH-RES",
            "@size": "566760",
            "@ref": "gr19",
            "@mimetype": "image/jpeg"
          },
          {
            "@category": "high",
            "@height": "323",
            "@width": "993",
            "@_fa": "true",
            "$": "https://api.elsevier.com/content/object/eid/1-s2.0-S1872206722641676-gr2_lrg.jpg?httpAccept=%2A%2F%2A",
            "@multimediatype": "JPEG image file",
            "@type": "IMAGE-HIGH-RES",
            "@size": "75670",
            "@ref": "gr2",
            "@mimetype": "image/jpeg"
          },
          {
            "@category": "high",
            "@height": "695",
            "@width": "681",
            "@_fa": "true",
            "$": "https://api.elsevier.com/content/object/eid/1-s2.0-S1872206722641676-gr20_lrg.jpg?httpAccept=%2A%2F%2A",
            "@multimediatype": "JPEG image file",
            "@type": "IMAGE-HIGH-RES",
            "@size": "90208",
            "@ref": "gr20",
            "@mimetype": "image/jpeg"
          },
          {
            "@category": "high",
            "@height": "460",
            "@width": "1266",
            "@_fa": "true",
            "$": "https://api.elsevier.com/content/object/eid/1-s2.0-S1872206722641676-gr3_lrg.jpg?httpAccept=%2A%2F%2A",
            "@multimediatype": "JPEG image file",
            "@type": "IMAGE-HIGH-RES",
            "@size": "166000",
            "@ref": "gr3",
            "@mimetype": "image/jpeg"
          },
          {
            "@category": "high",
            "@height": "1155",
            "@width": "1136",
            "@_fa": "true",
            "$": "https://api.elsevier.com/content/object/eid/1-s2.0-S1872206722641676-gr4_lrg.jpg?httpAccept=%2A%2F%2A",
            "@multimediatype": "JPEG image file",
            "@type": "IMAGE-HIGH-RES",
            "@size": "527686",
            "@ref": "gr4",
            "@mimetype": "image/jpeg"
          },
          {
            "@category": "high",
            "@height": "580",
            "@width": "984",
            "@_fa": "true",
            "$": "https://api.elsevier.com/content/object/eid/1-s2.0-S1872206722641676-gr5_lrg.jpg?httpAccept=%2A%2F%2A",
            "@multimediatype": "JPEG image file",
            "@type": "IMAGE-HIGH-RES",
            "@size": "88276",
            "@ref": "gr5",
            "@mimetype": "image/jpeg"
          },
          {
            "@category": "high",
            "@height": "1448",
            "@width": "1528",
            "@_fa": "true",
            "$": "https://api.elsevier.com/content/object/eid/1-s2.0-S1872206722641676-gr6_lrg.jpg?httpAccept=%2A%2F%2A",
            "@multimediatype": "JPEG image file",
            "@type": "IMAGE-HIGH-RES",
            "@size": "621569",
            "@ref": "gr6",
            "@mimetype": "image/jpeg"
          },
          {
            "@category": "high",
            "@height": "1433",
            "@width": "1481",
            "@_fa": "true",
            "$": "https://api.elsevier.com/content/object/eid/1-s2.0-S1872206722641676-gr7_lrg.jpg?httpAccept=%2A%2F%2A",
            "@multimediatype": "JPEG image file",
            "@type": "IMAGE-HIGH-RES",
            "@size": "563289",
            "@ref": "gr7",
            "@mimetype": "image/jpeg"
          },
          {
            "@category": "high",
            "@height": "944",
            "@width": "1292",
            "@_fa": "true",
            "$": "https://api.elsevier.com/content/object/eid/1-s2.0-S1872206722641676-gr8_lrg.jpg?httpAccept=%2A%2F%2A",
            "@multimediatype": "JPEG image file",
            "@type": "IMAGE-HIGH-RES",
            "@size": "440947",
            "@ref": "gr8",
            "@mimetype": "image/jpeg"
          },
          {
            "@category": "high",
            "@height": "1227",
            "@width": "1624",
            "@_fa": "true",
            "$": "https://api.elsevier.com/content/object/eid/1-s2.0-S1872206722641676-gr9_lrg.jpg?httpAccept=%2A%2F%2A",
            "@multimediatype": "JPEG image file",
            "@type": "IMAGE-HIGH-RES",
            "@size": "468633",
            "@ref": "gr9",
            "@mimetype": "image/jpeg"
          }
        ]
      },
      "link": {
        "@rel": "abstract",
        "@href": "https://api.elsevier.com/content/abstract/scopus_id/85140234857"
      }
    }
  }
}