{
  "metadata": {
    "title": "Design and applications of hollow-structured nanomaterials for photocatalytic H<ce:inf loc=post>2</ce:inf> evolution and CO<ce:inf loc=post>2</ce:inf> reduction",
    "authors": "; ; ",
    "journal": "Chinese Journal of Catalysis",
    "date": "2022-03-31",
    "doi": "10.1016/S1872-2067(21)63863-9",
    "abstract": "",
    "uri": "https://api.elsevier.com/content/article/pii/S1872206721638639",
    "pii": "S1872206721638639"
  },
  "fulltext": {
    "full-text-retrieval-response": {
      "scopus-eid": "2-s2.0-85123872471",
      "originalText": "serial JL 273538 291210 291744 291809 31 Chinese Journal of Catalysis CHINESEJOURNALCATALYSIS 2022-02-02 2022-02-02 2022-02-02 2022-02-02 2022-03-22T19:56:55 1-s2.0-S1872206721638639 S1872-2067(21)63863-9 S1872206721638639 10.1016/S1872-2067(21)63863-9 S300 S300.3 FULL-TEXT 1-s2.0-S1872206722X0003X 2022-03-22T20:22:30.91802Z 0 0 20220301 20220331 2022 2022-02-02T22:41:57.606179Z absattachment articleinfo articletitlenorm authfirstinitialnorm authfirstsurnamenorm cid cids contenttype copyright crossmark dateloaded dateloadedtxt datesearch datesort dateupdated dco docsubtype doctype doi eid ewtransactionid hubeid indexeddate issfirst issn issnnorm issuelist itemstage itemtransactionid itemweight openaccess openarchive pg pgfirst pglast pii piinorm pubdateend pubdatestart pubdatetxt pubyr sortorder srctitle srctitlenorm srctype ssids alllist content subj subheadings tomb volfirst volissue volumelist webpdf webpdfpagecount yearnav figure table body affil articletitle auth authfirstini authfull authkeywords authlast primabst pubtype ref specialabst 1872-2067 18722067 true 43 43 3 3 Volume 43, Issue 3 12 679 707 679 707 202203 March 2022 2022-03-01 2022-03-31 2022 article rev Copyright © 2022 Dalian Institute of Chemical Physics, the Chinese Academy of Sciences. Published by Elsevier B.V. All rights reserved. DESIGNAPPLICATIONSHOLLOWSTRUCTUREDNANOMATERIALSFORPHOTOCATALYTICH2EVOLUTIONCO2REDUCTION LI X 1 Introduction 2 Synthesis strategies of hollow-structured materials 2.1 Hard-template method 2.2 Soft-template method 2.3 Self-template method 2.3.1 Controlled etching 2.3.2 Diffusion-regrowth 2.3.3 Heterogenous contraction 3 Synthetic methods of typical single-component hollow photocatalysts 3.1 Hollow CdS 3.2 Hollow ZnxCd1–xS 3.3 Hollow g-C3N4 3.4 Hollow TiO2 3.5 Hollow CeO2 materials 4 The fabrication and mechanism investigation of complex hollow heterostructures in photocatalytic hydrogen generation 4.1 Hollow noble metal-free cocatalyst-based heterojunctions for photocatalysis 4.1 Typical hollow host photocatalyst-based hierarchical systems for photocatalysis 5 The application of hollow structures in photocatalytic CO2 reduction process 6 Summary and future perspectives Conflicts of interest References YUAN 2017 603 631 Y YANG 2020 9268 9275 R LIU 2020 14181 14189 Y REDDY 2017 6981 6991 D WANG 2019 1900586 S LI 2016 7485 7527 K FUJISHIMA 1972 37 38 A WANG 2019 17675 17702 J WANG 2016 5865 5872 Z HU 2020 4712 4725 H MAO 2018 2857 2869 M KRIVEC 2013 9088 9094 M ALIKHAN 2020 118557 J WANG 2020 118183 Y SPANU 2018 198 205 D LIU 2020 124869 X ZHANG 2018 126 130 Y LI 2018 16 24 L RELI 2015 8530 8538 M MA 2017 183 191 D HSU 2014 16524 16533 M LI 2021 129231 C GRABOWSKA 2016 97 126 E YU 2018 4347 4354 J LIU 2007 2269 2272 J ZHUGE 2021 148234 K HUI 2021 6369 6379 C BANERJEE 2020 111085 R MANCHALA 2021 255 266 S SUN 2021 148542 B ZHAO 2020 147016 S PEI 2019 151869 L RAN 2017 9882 9885 J ZHANG 2021 632 640 Q WANG 2021 2006952 M LI 2020 764 773 C WANG 2021 66 76 C ZHANG 2021 129157 J JIANG 2020 5197 5206 X ZHANG 2021 175401 175412 X CHEN 2021 126119 Y YANG 2020 157754 X YUAN 2021 3042 3045 H WANG 2020 145830 W LIN 2019 22506 22512 G LI 2016 72659 72669 C ZHANG 2021 119636 G ESMAT 2020 119755 M ZHU 2019 413 423 Y ZHANG 2019 371 379 Z REN 2020 31 40 D GE 2019 160 167 J LI 2019 434 445 Z WANG 2019 1801993 J LU 2016 7399 7409 Q CAI 2019 1804903 Z LIU 2019 1803291 D XIAO 2019 1801369 M QIN 2020 119254 Y PAN 2019 92 99 J REN 2019 289 319 Y DAI 2018 194 201 D XU 2021 107 114 H SHAHVARANFARD 2020 38211 38221 F BABU 2020 10824 10834 P LEI 2019 301 309 J JIA 2019 26169 26180 X NGUYEN 2019 22962 22971 N SONG 2020 332 343 N SUN 2020 22749 22755 K LI 2020 123354 S AI 2020 123130 Z ZHU 2019 15984 15990 M ZHU 2019 814 822 Y HAN 2017 1691 1696 M MAO 2017 12427 12435 Z BI 2016 31497 31506 G ZHU 2020 118945 T CAO 2019 117997 R HAN 2015 23274 23282 C HAN 2015 31 40 C XIAO 2019 352 361 N WANG 2017 219 228 X YI 2017 477 483 S DAI 2017 429 436 D WANG 2018 12315 12321 X DU 2017 12012 12015 H WANG 2017 17349 17356 Y ZENG 2018 47 55 D LI 2018 15 24 X YUE 2015 16941 16947 Q CAO 2015 8708 8711 S PANNERI 2017 212 221 S HUANG 2020 7177 7183 L YUAN 2015 1680 1689 J BALA 2015 20288 20296 S WANG 2015 20727 20735 M CARUSO 1998 1111 1114 F LAI 2012 5604 5618 X STOBER 1968 62 69 W PRIETO 2016 14056 14119 G LOU 2008 3987 4019 X DECHER 1997 1232 1237 G WENG 2018 10168 10175 W WANG 2017 290 299 J ZHAO 2016 342001 Y WANG 2018 1800592 Z LI 2019 1801104 B YU 2017 293 301 L HU 2012 984 988 M YU 2018 1800939 L NAI 2017 1703870 J SHEN 2015 6694 L ZHOU 2012 745 748 L LIU 2017 1700874 S XIA 2019 1902459 Y ZHU 2019 178 185 C ZHONG 2019 117967 W YE 2019 117897 L ZHANG 2019 51 54 H HU 2020 118131 Y XIAO 2019 118382 R WANG 2015 302 305 H LI 2019 5649 5655 Y YIN 2018 464 472 C YONG 2009 3621 3638 Z LIN 2008 7363 7370 G HUANG 2010 200033232 J WU 2004 5192 5195 D LUO 2012 1813 1821 M LIU 2020 1057 1062 Y LI 2020 122350 X WANG 2016 1 13 H LI 2019 143769 H LI 2019 5649 5655 Y ZHANG 2020 2004561 P CHEN 2017 24116 24125 J WANG 2015 7546 7552 X LIN 2015 153 158 C QIU 2018 234 241 J LI 2013 882 889 Q XUE 2018 783 794 W JIN 2019 2676 2682 Z YAO 2016 248 256 L HUANG 2020 118651 D LI 2020 8405 8417 H ZHANG 2019 303 311 C ZHANG 2018 309 316 C LIU 2017 738 748 C LIU 2016 6822 6829 G HAN 2016 2745 2751 Q LI 2018 126 136 Q YE 2015 6973 6979 C ZHAO 2018 247 256 S ZHENG 2016 11512 11516 D SUN 2019 2840 2851 Y CHEN 2015 10521 10524 Y PENG 2018 22215 22225 W DONG 2017 100 103 Y GAO 2012 3687 3692 J TAHIR 2013 13949 13955 M MOHAMADALOSFUR 2018 145707 F ALMADANAT 2021 107 O QI 2016 522 530 L ZIARATI 2018 177 183 A LIU 2010 831 843 G LIU 2014 9559 9612 G SHIRAISHI 2008 157 170 Y LIM 2020 5651 5655 J ZHANG 2018 132 140 D NIU 2020 124602 Z WU 2018 4429 4438 R LI 2012 11864 11867 W NGUYEN 2016 266 271 D ZHANG 2017 4336 4343 C WANG 2019 17675 17702 J ZHAO 2021 18 29 W WEN 2018 71 714 X YANG 2020 124100 X LI 2021 2000063 Q CHEN 2009 1334 1338 G LIU 2013 192 195 S FANG 2015 458 467 S DONG 2020 104579 J LOPEZ 2015 45 54 C CHEN 2019 143771 X MENG 2017 53 64 X PARK 2019 16038 16042 J CELEBI 2021 157908 N CHANG 2021 126351 N LI 2020 118618 P PATNAIK 2020 519 535 S CHEN 2020 104895 Z WU 2021 129274 T YU 2020 145371 T XU 2017 22877 22886 H LI 2021 9351 9359 W SONG 2021 126151 Y QIU 2017 2684 2688 B WANG 2018 15145 15148 S LI 2020 125474 X ZHANG 2020 8255 8261 G FU 2018 2767 2779 J JIANG 2019 26898 26908 L ZENG 2017 4624 4631 D YANG 2018 1 10 S WANG 2019 76 86 Y XIN 2016 6640 6696 L LIN 2020 118742 Z WANG 2019 1903404 S LIU 2017 1700874 S LIU 2016 1694 1701 Y LI 2019 158 168 W ZHANG 2020 146035 Y SONG 2017 1700495 S HE 2019 1084 1090 J FENG 2020 146013 N JIANG 2020 119235 C ZHENG 2019 1357 1364 N WANG 2016 29511 29521 M ZHANG 2021 120213 E CAO 2016 42 49 B JIANG 2017 24 Q LI 2016 890 895 A SUN 2018 1804368 Q XING 2017 1702244 M LI 2016 13734 13738 A WANG 2017 518 525 Z JIANG 2017 209 215 Z LIN 2018 36 48 L LIANG 2019 566 575 M BIE 2019 1902868 C ZHU 2019 461 469 S BANITALEBIDEHKORDI 2020 465 473 A LI 2019 476 484 Y ZHAO 2021 231 243 J GAO 2015 1515 1519 M MAIMAITIZI 2020 144083 H HE 2019 1084 1090 J WEI 2019 11149 11155 C LI 2021 213946 Z ZHANG 2018 8540 8544 Y NAZEMI 2019 103886 M LIX2022X679 LIX2022X679X707 LIX2022X679XX LIX2022X679X707XX 2024-02-02T00:00:00.000Z 2024-02-02T00:00:00.000Z http://creativecommons.org/licenses/by-nc-nd/4.0/ 0 item S1872-2067(21)63863-9 S1872206721638639 1-s2.0-S1872206721638639 10.1016/S1872-2067(21)63863-9 273538 2022-03-22T20:22:30.91802Z 2022-03-01 2022-03-31 1-s2.0-S1872206721638639-main.pdf https://s3-eu-west-1.amazonaws.com/prod-ucs-content-store-eu-west/content/pii:S1872206721638639/MAIN/application/pdf/31d0e3a2e8b19a4fc1e5180f42465307/main.pdf main.pdf pdf true 12284637 MAIN 29 1-s2.0-S1872206721638639-main_1.png https://s3-eu-west-1.amazonaws.com/prod-ucs-content-store-eu-west/content/pii:S1872206721638639/PREVIEW/image/png/3b99183490be32dd3d5b42a13b81b8bb/main_1.png main_1.png png 52862 849 656 IMAGE-WEB-PDF 1 1-s2.0-S1872206721638639-fx1.jpg https://s3-eu-west-1.amazonaws.com/prod-ucs-content-store-eu-west/content/pii:S1872206721638639/fx1/DOWNSAMPLED/image/jpeg/dac5cd656b6274bebcb3ebdabbe307bc/fx1.jpg fx1 fx1.jpg jpg 4985 122 70 IMAGE-DOWNSAMPLED 1-s2.0-S1872206721638639-fx10.jpg https://s3-eu-west-1.amazonaws.com/prod-ucs-content-store-eu-west/content/pii:S1872206721638639/fx10/DOWNSAMPLED/image/jpeg/26d1c1e688fe134030752210d1ffe068/fx10.jpg fx10 fx10.jpg jpg 6938 119 66 IMAGE-DOWNSAMPLED 1-s2.0-S1872206721638639-fx11.jpg https://s3-eu-west-1.amazonaws.com/prod-ucs-content-store-eu-west/content/pii:S1872206721638639/fx11/DOWNSAMPLED/image/jpeg/d4b00399ea55a30b28f7b16a5d272c53/fx11.jpg fx11 fx11.jpg jpg 5377 120 66 IMAGE-DOWNSAMPLED 1-s2.0-S1872206721638639-fx12.jpg https://s3-eu-west-1.amazonaws.com/prod-ucs-content-store-eu-west/content/pii:S1872206721638639/fx12/DOWNSAMPLED/image/jpeg/af567a07bcde097abd2c3733b4876d13/fx12.jpg fx12 fx12.jpg jpg 5010 122 66 IMAGE-DOWNSAMPLED 1-s2.0-S1872206721638639-fx13.jpg https://s3-eu-west-1.amazonaws.com/prod-ucs-content-store-eu-west/content/pii:S1872206721638639/fx13/DOWNSAMPLED/image/jpeg/96806ecb8df3bbf0b1fe0107e9b6c8f0/fx13.jpg fx13 fx13.jpg jpg 4507 111 75 IMAGE-DOWNSAMPLED 1-s2.0-S1872206721638639-fx14.jpg https://s3-eu-west-1.amazonaws.com/prod-ucs-content-store-eu-west/content/pii:S1872206721638639/fx14/DOWNSAMPLED/image/jpeg/27c954cb319cf3ae5a904cad6c633f39/fx14.jpg fx14 fx14.jpg jpg 4174 122 67 IMAGE-DOWNSAMPLED 1-s2.0-S1872206721638639-fx15.jpg https://s3-eu-west-1.amazonaws.com/prod-ucs-content-store-eu-west/content/pii:S1872206721638639/fx15/DOWNSAMPLED/image/jpeg/2838d40e9788b3256ca1d63b7cd9a4a3/fx15.jpg fx15 fx15.jpg jpg 4759 112 71 IMAGE-DOWNSAMPLED 1-s2.0-S1872206721638639-fx16.jpg https://s3-eu-west-1.amazonaws.com/prod-ucs-content-store-eu-west/content/pii:S1872206721638639/fx16/DOWNSAMPLED/image/jpeg/39d95d54e9aa0fb6f464532229749442/fx16.jpg fx16 fx16.jpg jpg 2645 68 75 IMAGE-DOWNSAMPLED 1-s2.0-S1872206721638639-fx17.jpg https://s3-eu-west-1.amazonaws.com/prod-ucs-content-store-eu-west/content/pii:S1872206721638639/fx17/DOWNSAMPLED/image/jpeg/c9d909c762c7186e7a4e797064ccdbb2/fx17.jpg fx17 fx17.jpg jpg 4898 129 70 IMAGE-DOWNSAMPLED 1-s2.0-S1872206721638639-fx18.jpg https://s3-eu-west-1.amazonaws.com/prod-ucs-content-store-eu-west/content/pii:S1872206721638639/fx18/DOWNSAMPLED/image/jpeg/7bf9a85c8999c9d550a36c7fc647e4c0/fx18.jpg fx18 fx18.jpg jpg 5002 131 71 IMAGE-DOWNSAMPLED 1-s2.0-S1872206721638639-fx19.jpg https://s3-eu-west-1.amazonaws.com/prod-ucs-content-store-eu-west/content/pii:S1872206721638639/fx19/DOWNSAMPLED/image/jpeg/6b2df282d714731d36bf51566836710a/fx19.jpg fx19 fx19.jpg jpg 2516 84 81 IMAGE-DOWNSAMPLED 1-s2.0-S1872206721638639-fx2.jpg https://s3-eu-west-1.amazonaws.com/prod-ucs-content-store-eu-west/content/pii:S1872206721638639/fx2/DOWNSAMPLED/image/jpeg/fe58c7c2632a074da8c5cc0f5f6418ef/fx2.jpg fx2 fx2.jpg jpg 2369 76 70 IMAGE-DOWNSAMPLED 1-s2.0-S1872206721638639-fx20.jpg https://s3-eu-west-1.amazonaws.com/prod-ucs-content-store-eu-west/content/pii:S1872206721638639/fx20/DOWNSAMPLED/image/jpeg/9ec7692c77714a460e8609807c75f516/fx20.jpg fx20 fx20.jpg jpg 4277 118 63 IMAGE-DOWNSAMPLED 1-s2.0-S1872206721638639-fx21.jpg https://s3-eu-west-1.amazonaws.com/prod-ucs-content-store-eu-west/content/pii:S1872206721638639/fx21/DOWNSAMPLED/image/jpeg/a3f56306b55890c1305369017032b6a0/fx21.jpg fx21 fx21.jpg jpg 3416 96 64 IMAGE-DOWNSAMPLED 1-s2.0-S1872206721638639-fx22.jpg https://s3-eu-west-1.amazonaws.com/prod-ucs-content-store-eu-west/content/pii:S1872206721638639/fx22/DOWNSAMPLED/image/jpeg/90661d4faf6f1b184f551588326d8e7c/fx22.jpg fx22 fx22.jpg jpg 4287 82 64 IMAGE-DOWNSAMPLED 1-s2.0-S1872206721638639-fx23.jpg https://s3-eu-west-1.amazonaws.com/prod-ucs-content-store-eu-west/content/pii:S1872206721638639/fx23/DOWNSAMPLED/image/jpeg/a1558c41eada3dfa7712c521d69f564d/fx23.jpg fx23 fx23.jpg jpg 5035 121 64 IMAGE-DOWNSAMPLED 1-s2.0-S1872206721638639-fx24.jpg https://s3-eu-west-1.amazonaws.com/prod-ucs-content-store-eu-west/content/pii:S1872206721638639/fx24/DOWNSAMPLED/image/jpeg/a7fb1e6075f064736882c8ab7761f40c/fx24.jpg fx24 fx24.jpg jpg 2449 60 62 IMAGE-DOWNSAMPLED 1-s2.0-S1872206721638639-fx25.jpg https://s3-eu-west-1.amazonaws.com/prod-ucs-content-store-eu-west/content/pii:S1872206721638639/fx25/DOWNSAMPLED/image/jpeg/337c6675125d98b1150bfdb3b179478c/fx25.jpg fx25 fx25.jpg jpg 5078 129 67 IMAGE-DOWNSAMPLED 1-s2.0-S1872206721638639-fx26.jpg https://s3-eu-west-1.amazonaws.com/prod-ucs-content-store-eu-west/content/pii:S1872206721638639/fx26/DOWNSAMPLED/image/jpeg/2105d4764176cff63950be0000289609/fx26.jpg fx26 fx26.jpg jpg 5808 125 67 IMAGE-DOWNSAMPLED 1-s2.0-S1872206721638639-fx27.jpg https://s3-eu-west-1.amazonaws.com/prod-ucs-content-store-eu-west/content/pii:S1872206721638639/fx27/DOWNSAMPLED/image/jpeg/fdbccb3928bd1d956933e0eace4963e5/fx27.jpg fx27 fx27.jpg jpg 5839 148 70 IMAGE-DOWNSAMPLED 1-s2.0-S1872206721638639-fx28.jpg https://s3-eu-west-1.amazonaws.com/prod-ucs-content-store-eu-west/content/pii:S1872206721638639/fx28/DOWNSAMPLED/image/jpeg/f080c0e94b9430995894b68b80d30ef1/fx28.jpg fx28 fx28.jpg jpg 4805 112 67 IMAGE-DOWNSAMPLED 1-s2.0-S1872206721638639-fx29.jpg https://s3-eu-west-1.amazonaws.com/prod-ucs-content-store-eu-west/content/pii:S1872206721638639/fx29/DOWNSAMPLED/image/jpeg/3f8e266f47177f64ec4baf42fb584575/fx29.jpg fx29 fx29.jpg jpg 6218 140 67 IMAGE-DOWNSAMPLED 1-s2.0-S1872206721638639-fx3.jpg https://s3-eu-west-1.amazonaws.com/prod-ucs-content-store-eu-west/content/pii:S1872206721638639/fx3/DOWNSAMPLED/image/jpeg/a9c616cc0eb12a380221ae3281ac12d5/fx3.jpg fx3 fx3.jpg jpg 4342 120 69 IMAGE-DOWNSAMPLED 1-s2.0-S1872206721638639-fx30.jpg https://s3-eu-west-1.amazonaws.com/prod-ucs-content-store-eu-west/content/pii:S1872206721638639/fx30/DOWNSAMPLED/image/jpeg/5c58d6ace6eea69655b28af30c493bc3/fx30.jpg fx30 fx30.jpg jpg 4419 122 66 IMAGE-DOWNSAMPLED 1-s2.0-S1872206721638639-fx31.jpg https://s3-eu-west-1.amazonaws.com/prod-ucs-content-store-eu-west/content/pii:S1872206721638639/fx31/DOWNSAMPLED/image/jpeg/90ef684ee3687738ffde182219a5904e/fx31.jpg fx31 fx31.jpg jpg 5583 129 67 IMAGE-DOWNSAMPLED 1-s2.0-S1872206721638639-fx32.jpg https://s3-eu-west-1.amazonaws.com/prod-ucs-content-store-eu-west/content/pii:S1872206721638639/fx32/DOWNSAMPLED/image/jpeg/fa2911fc4b985ffdcc74ddc6ad765f91/fx32.jpg fx32 fx32.jpg jpg 2031 59 65 IMAGE-DOWNSAMPLED 1-s2.0-S1872206721638639-fx33.jpg https://s3-eu-west-1.amazonaws.com/prod-ucs-content-store-eu-west/content/pii:S1872206721638639/fx33/DOWNSAMPLED/image/jpeg/f26dd3da02ec184b1b08a03cb7017065/fx33.jpg fx33 fx33.jpg jpg 4734 108 63 IMAGE-DOWNSAMPLED 1-s2.0-S1872206721638639-fx34.jpg https://s3-eu-west-1.amazonaws.com/prod-ucs-content-store-eu-west/content/pii:S1872206721638639/fx34/DOWNSAMPLED/image/jpeg/11417f211c4b9e9c573204035e9c3ab9/fx34.jpg fx34 fx34.jpg jpg 3661 111 62 IMAGE-DOWNSAMPLED 1-s2.0-S1872206721638639-fx35.jpg https://s3-eu-west-1.amazonaws.com/prod-ucs-content-store-eu-west/content/pii:S1872206721638639/fx35/DOWNSAMPLED/image/jpeg/9322923aaf6a01a6f1c06956adf2cc30/fx35.jpg fx35 fx35.jpg jpg 3116 119 59 IMAGE-DOWNSAMPLED 1-s2.0-S1872206721638639-fx4.jpg https://s3-eu-west-1.amazonaws.com/prod-ucs-content-store-eu-west/content/pii:S1872206721638639/fx4/DOWNSAMPLED/image/jpeg/01f43ccf94910e44d25da486103dcf24/fx4.jpg fx4 fx4.jpg jpg 6062 121 70 IMAGE-DOWNSAMPLED 1-s2.0-S1872206721638639-fx5.jpg https://s3-eu-west-1.amazonaws.com/prod-ucs-content-store-eu-west/content/pii:S1872206721638639/fx5/DOWNSAMPLED/image/jpeg/ae35156c3245ee23fd056c88b8c44051/fx5.jpg fx5 fx5.jpg jpg 5001 129 66 IMAGE-DOWNSAMPLED 1-s2.0-S1872206721638639-fx6.jpg https://s3-eu-west-1.amazonaws.com/prod-ucs-content-store-eu-west/content/pii:S1872206721638639/fx6/DOWNSAMPLED/image/jpeg/87fb3d7bf8507b041046bfefa41592fd/fx6.jpg fx6 fx6.jpg jpg 3746 106 65 IMAGE-DOWNSAMPLED 1-s2.0-S1872206721638639-fx7.jpg https://s3-eu-west-1.amazonaws.com/prod-ucs-content-store-eu-west/content/pii:S1872206721638639/fx7/DOWNSAMPLED/image/jpeg/3a943e47e4b7cf6d8d883e7fdf4c04f4/fx7.jpg fx7 fx7.jpg jpg 5085 119 67 IMAGE-DOWNSAMPLED 1-s2.0-S1872206721638639-fx8.jpg https://s3-eu-west-1.amazonaws.com/prod-ucs-content-store-eu-west/content/pii:S1872206721638639/fx8/DOWNSAMPLED/image/jpeg/63fa8d491a94fd5371f6dbddf86c4371/fx8.jpg fx8 fx8.jpg jpg 5871 119 65 IMAGE-DOWNSAMPLED 1-s2.0-S1872206721638639-fx9.jpg https://s3-eu-west-1.amazonaws.com/prod-ucs-content-store-eu-west/content/pii:S1872206721638639/fx9/DOWNSAMPLED/image/jpeg/79e5c4d42c6336341253d8416ab16585/fx9.jpg fx9 fx9.jpg jpg 3789 137 66 IMAGE-DOWNSAMPLED 1-s2.0-S1872206721638639-gr1.jpg https://s3-eu-west-1.amazonaws.com/prod-ucs-content-store-eu-west/content/pii:S1872206721638639/gr1/DOWNSAMPLED/image/jpeg/be7a7ca2b244d3cb6a55eb27aec40802/gr1.jpg gr1 gr1.jpg jpg 16738 149 335 IMAGE-DOWNSAMPLED 1-s2.0-S1872206721638639-gr10.jpg https://s3-eu-west-1.amazonaws.com/prod-ucs-content-store-eu-west/content/pii:S1872206721638639/gr10/DOWNSAMPLED/image/jpeg/d85e4141fa335effeb42c3451a1a4830/gr10.jpg gr10 gr10.jpg jpg 25497 165 370 IMAGE-DOWNSAMPLED 1-s2.0-S1872206721638639-gr11.jpg https://s3-eu-west-1.amazonaws.com/prod-ucs-content-store-eu-west/content/pii:S1872206721638639/gr11/DOWNSAMPLED/image/jpeg/7d9319a7d75d32b2d4e2e9ce429f386d/gr11.jpg gr11 gr11.jpg jpg 25384 131 373 IMAGE-DOWNSAMPLED 1-s2.0-S1872206721638639-gr12.jpg https://s3-eu-west-1.amazonaws.com/prod-ucs-content-store-eu-west/content/pii:S1872206721638639/gr12/DOWNSAMPLED/image/jpeg/7d48bea4acb17b679055d2d54d535ffd/gr12.jpg gr12 gr12.jpg jpg 42698 198 582 IMAGE-DOWNSAMPLED 1-s2.0-S1872206721638639-gr13.jpg https://s3-eu-west-1.amazonaws.com/prod-ucs-content-store-eu-west/content/pii:S1872206721638639/gr13/DOWNSAMPLED/image/jpeg/31b41671e13d1c41fac43561439deff1/gr13.jpg gr13 gr13.jpg jpg 26748 169 371 IMAGE-DOWNSAMPLED 1-s2.0-S1872206721638639-gr14.jpg https://s3-eu-west-1.amazonaws.com/prod-ucs-content-store-eu-west/content/pii:S1872206721638639/gr14/DOWNSAMPLED/image/jpeg/c83052f0c2c20877cf03b341037f33fe/gr14.jpg gr14 gr14.jpg jpg 34091 229 367 IMAGE-DOWNSAMPLED 1-s2.0-S1872206721638639-gr15.jpg https://s3-eu-west-1.amazonaws.com/prod-ucs-content-store-eu-west/content/pii:S1872206721638639/gr15/DOWNSAMPLED/image/jpeg/dc66a18eb97c4bb6841361e65a86861e/gr15.jpg gr15 gr15.jpg jpg 35820 280 526 IMAGE-DOWNSAMPLED 1-s2.0-S1872206721638639-gr16.jpg https://s3-eu-west-1.amazonaws.com/prod-ucs-content-store-eu-west/content/pii:S1872206721638639/gr16/DOWNSAMPLED/image/jpeg/9cb19511430c511b4d039e67e48f34f7/gr16.jpg gr16 gr16.jpg jpg 86400 401 569 IMAGE-DOWNSAMPLED 1-s2.0-S1872206721638639-gr17.jpg https://s3-eu-west-1.amazonaws.com/prod-ucs-content-store-eu-west/content/pii:S1872206721638639/gr17/DOWNSAMPLED/image/jpeg/7dbe18560e1b8ed831c342dceeab53a4/gr17.jpg gr17 gr17.jpg jpg 109578 503 534 IMAGE-DOWNSAMPLED 1-s2.0-S1872206721638639-gr18.jpg https://s3-eu-west-1.amazonaws.com/prod-ucs-content-store-eu-west/content/pii:S1872206721638639/gr18/DOWNSAMPLED/image/jpeg/1eb31a7a364c45c028dc463e4d97fb22/gr18.jpg gr18 gr18.jpg jpg 81367 423 527 IMAGE-DOWNSAMPLED 1-s2.0-S1872206721638639-gr19.jpg https://s3-eu-west-1.amazonaws.com/prod-ucs-content-store-eu-west/content/pii:S1872206721638639/gr19/DOWNSAMPLED/image/jpeg/377f7366d03f4b698c0ce0dbea195776/gr19.jpg gr19 gr19.jpg jpg 38020 290 358 IMAGE-DOWNSAMPLED 1-s2.0-S1872206721638639-gr2.jpg https://s3-eu-west-1.amazonaws.com/prod-ucs-content-store-eu-west/content/pii:S1872206721638639/gr2/DOWNSAMPLED/image/jpeg/8c126bad186b3c3b5dc71bd3082a089c/gr2.jpg gr2 gr2.jpg jpg 25370 256 363 IMAGE-DOWNSAMPLED 1-s2.0-S1872206721638639-gr20.jpg https://s3-eu-west-1.amazonaws.com/prod-ucs-content-store-eu-west/content/pii:S1872206721638639/gr20/DOWNSAMPLED/image/jpeg/961b37ef1e5de348f777ad0f7ee324e9/gr20.jpg gr20 gr20.jpg jpg 58448 284 514 IMAGE-DOWNSAMPLED 1-s2.0-S1872206721638639-gr21.jpg https://s3-eu-west-1.amazonaws.com/prod-ucs-content-store-eu-west/content/pii:S1872206721638639/gr21/DOWNSAMPLED/image/jpeg/cac752c57e3fef958e50e27a09e51725/gr21.jpg gr21 gr21.jpg jpg 41377 256 534 IMAGE-DOWNSAMPLED 1-s2.0-S1872206721638639-gr22.jpg https://s3-eu-west-1.amazonaws.com/prod-ucs-content-store-eu-west/content/pii:S1872206721638639/gr22/DOWNSAMPLED/image/jpeg/ce34fbad9327cce52f47b6e5dcc42d21/gr22.jpg gr22 gr22.jpg jpg 55317 242 487 IMAGE-DOWNSAMPLED 1-s2.0-S1872206721638639-gr23.jpg https://s3-eu-west-1.amazonaws.com/prod-ucs-content-store-eu-west/content/pii:S1872206721638639/gr23/DOWNSAMPLED/image/jpeg/71f1f5579bf41b8e92fd826be48b94fd/gr23.jpg gr23 gr23.jpg jpg 74847 303 645 IMAGE-DOWNSAMPLED 1-s2.0-S1872206721638639-gr24.jpg https://s3-eu-west-1.amazonaws.com/prod-ucs-content-store-eu-west/content/pii:S1872206721638639/gr24/DOWNSAMPLED/image/jpeg/ea94b36dbcdc2c6ab03dca5fa3b35893/gr24.jpg gr24 gr24.jpg jpg 38305 244 363 IMAGE-DOWNSAMPLED 1-s2.0-S1872206721638639-gr25.jpg https://s3-eu-west-1.amazonaws.com/prod-ucs-content-store-eu-west/content/pii:S1872206721638639/gr25/DOWNSAMPLED/image/jpeg/c3c5fdcd4bda476aaa4ae5fe404cee03/gr25.jpg gr25 gr25.jpg jpg 68328 411 515 IMAGE-DOWNSAMPLED 1-s2.0-S1872206721638639-gr26.jpg https://s3-eu-west-1.amazonaws.com/prod-ucs-content-store-eu-west/content/pii:S1872206721638639/gr26/DOWNSAMPLED/image/jpeg/76cf198e6d3596dae1c21916eb3dd884/gr26.jpg gr26 gr26.jpg jpg 56882 293 576 IMAGE-DOWNSAMPLED 1-s2.0-S1872206721638639-gr27.jpg https://s3-eu-west-1.amazonaws.com/prod-ucs-content-store-eu-west/content/pii:S1872206721638639/gr27/DOWNSAMPLED/image/jpeg/9ebc30f4e44ac965ef2d1c232d216517/gr27.jpg gr27 gr27.jpg jpg 45759 263 480 IMAGE-DOWNSAMPLED 1-s2.0-S1872206721638639-gr28.jpg https://s3-eu-west-1.amazonaws.com/prod-ucs-content-store-eu-west/content/pii:S1872206721638639/gr28/DOWNSAMPLED/image/jpeg/71e5e64203e108ef66343bf81bde0e1a/gr28.jpg gr28 gr28.jpg jpg 55700 269 528 IMAGE-DOWNSAMPLED 1-s2.0-S1872206721638639-gr29.jpg https://s3-eu-west-1.amazonaws.com/prod-ucs-content-store-eu-west/content/pii:S1872206721638639/gr29/DOWNSAMPLED/image/jpeg/d4e574af986b1323d4da0170dc7d5b12/gr29.jpg gr29 gr29.jpg jpg 29694 196 369 IMAGE-DOWNSAMPLED 1-s2.0-S1872206721638639-gr3.jpg https://s3-eu-west-1.amazonaws.com/prod-ucs-content-store-eu-west/content/pii:S1872206721638639/gr3/DOWNSAMPLED/image/jpeg/68bff0727d8a0dd51849b2f4f558c988/gr3.jpg gr3 gr3.jpg jpg 41402 321 326 IMAGE-DOWNSAMPLED 1-s2.0-S1872206721638639-gr30.jpg https://s3-eu-west-1.amazonaws.com/prod-ucs-content-store-eu-west/content/pii:S1872206721638639/gr30/DOWNSAMPLED/image/jpeg/12550a4d0c806c74fd9a9a3a3ca69cad/gr30.jpg gr30 gr30.jpg jpg 68532 286 612 IMAGE-DOWNSAMPLED 1-s2.0-S1872206721638639-gr31.jpg https://s3-eu-west-1.amazonaws.com/prod-ucs-content-store-eu-west/content/pii:S1872206721638639/gr31/DOWNSAMPLED/image/jpeg/2e712c0665cd4d4122d0162bc9143346/gr31.jpg gr31 gr31.jpg jpg 95249 529 619 IMAGE-DOWNSAMPLED 1-s2.0-S1872206721638639-gr32.jpg https://s3-eu-west-1.amazonaws.com/prod-ucs-content-store-eu-west/content/pii:S1872206721638639/gr32/DOWNSAMPLED/image/jpeg/6d77b929175ee7a19f66aa801e9fd0c4/gr32.jpg gr32 gr32.jpg jpg 82668 279 643 IMAGE-DOWNSAMPLED 1-s2.0-S1872206721638639-gr33.jpg https://s3-eu-west-1.amazonaws.com/prod-ucs-content-store-eu-west/content/pii:S1872206721638639/gr33/DOWNSAMPLED/image/jpeg/e5de1b271acd8586cf218beb79eed8b8/gr33.jpg gr33 gr33.jpg jpg 40319 303 414 IMAGE-DOWNSAMPLED 1-s2.0-S1872206721638639-gr34.jpg https://s3-eu-west-1.amazonaws.com/prod-ucs-content-store-eu-west/content/pii:S1872206721638639/gr34/DOWNSAMPLED/image/jpeg/56277218d5b039a9038cdeddfcc7c459/gr34.jpg gr34 gr34.jpg jpg 35174 248 260 IMAGE-DOWNSAMPLED 1-s2.0-S1872206721638639-gr35.jpg https://s3-eu-west-1.amazonaws.com/prod-ucs-content-store-eu-west/content/pii:S1872206721638639/gr35/DOWNSAMPLED/image/jpeg/780ad52cb6c34dfa6dc4dacfa37c515f/gr35.jpg gr35 gr35.jpg jpg 29726 193 368 IMAGE-DOWNSAMPLED 1-s2.0-S1872206721638639-gr4.jpg https://s3-eu-west-1.amazonaws.com/prod-ucs-content-store-eu-west/content/pii:S1872206721638639/gr4/DOWNSAMPLED/image/jpeg/db682b82891b5d8bf2a992620881ab4c/gr4.jpg gr4 gr4.jpg jpg 32064 210 337 IMAGE-DOWNSAMPLED 1-s2.0-S1872206721638639-gr5.jpg https://s3-eu-west-1.amazonaws.com/prod-ucs-content-store-eu-west/content/pii:S1872206721638639/gr5/DOWNSAMPLED/image/jpeg/55ae7f423d2cde066946fffa6217011b/gr5.jpg gr5 gr5.jpg jpg 35106 248 362 IMAGE-DOWNSAMPLED 1-s2.0-S1872206721638639-gr6.jpg https://s3-eu-west-1.amazonaws.com/prod-ucs-content-store-eu-west/content/pii:S1872206721638639/gr6/DOWNSAMPLED/image/jpeg/ee5ea9f7345af7da8ce9e7909c807015/gr6.jpg gr6 gr6.jpg jpg 10755 69 349 IMAGE-DOWNSAMPLED 1-s2.0-S1872206721638639-gr7.jpg https://s3-eu-west-1.amazonaws.com/prod-ucs-content-store-eu-west/content/pii:S1872206721638639/gr7/DOWNSAMPLED/image/jpeg/daa5ad200adcc6d0855ce65eaba74ebc/gr7.jpg gr7 gr7.jpg jpg 29571 261 372 IMAGE-DOWNSAMPLED 1-s2.0-S1872206721638639-gr8.jpg https://s3-eu-west-1.amazonaws.com/prod-ucs-content-store-eu-west/content/pii:S1872206721638639/gr8/DOWNSAMPLED/image/jpeg/433849b718344238c787e4a153e23f34/gr8.jpg gr8 gr8.jpg jpg 23335 201 372 IMAGE-DOWNSAMPLED 1-s2.0-S1872206721638639-gr9.jpg https://s3-eu-west-1.amazonaws.com/prod-ucs-content-store-eu-west/content/pii:S1872206721638639/gr9/DOWNSAMPLED/image/jpeg/51a292dc11041aee52e602f9e1a53082/gr9.jpg gr9 gr9.jpg jpg 65302 229 774 IMAGE-DOWNSAMPLED 1-s2.0-S1872206721638639-grap.jpg https://s3-eu-west-1.amazonaws.com/prod-ucs-content-store-eu-west/content/pii:S1872206721638639/grap/DOWNSAMPLED/image/jpeg/b55c8cdaf310e521864f3322926fd634/grap.jpg grap true grap.jpg jpg 33661 245 258 IMAGE-DOWNSAMPLED 1-s2.0-S1872206721638639-fx1.sml https://s3-eu-west-1.amazonaws.com/prod-ucs-content-store-eu-west/content/pii:S1872206721638639/fx1/THUMBNAIL/image/gif/17e044fbc717a3923f3d74e9b3e56486/fx1.sml fx1 fx1.sml sml 28340 327 187 IMAGE-THUMBNAIL 1-s2.0-S1872206721638639-fx10.sml https://s3-eu-west-1.amazonaws.com/prod-ucs-content-store-eu-west/content/pii:S1872206721638639/fx10/THUMBNAIL/image/gif/aafae38eb96b50fce38e894948fe6a88/fx10.sml fx10 fx10.sml sml 45449 320 177 IMAGE-THUMBNAIL 1-s2.0-S1872206721638639-fx11.sml https://s3-eu-west-1.amazonaws.com/prod-ucs-content-store-eu-west/content/pii:S1872206721638639/fx11/THUMBNAIL/image/gif/54f0fda18593e59e0a1d58d554dcb33e/fx11.sml fx11 fx11.sml sml 32880 319 176 IMAGE-THUMBNAIL 1-s2.0-S1872206721638639-fx12.sml https://s3-eu-west-1.amazonaws.com/prod-ucs-content-store-eu-west/content/pii:S1872206721638639/fx12/THUMBNAIL/image/gif/ebdd4957be4cf28ec2c91c1459839e83/fx12.sml fx12 fx12.sml sml 38445 328 177 IMAGE-THUMBNAIL 1-s2.0-S1872206721638639-fx13.sml https://s3-eu-west-1.amazonaws.com/prod-ucs-content-store-eu-west/content/pii:S1872206721638639/fx13/THUMBNAIL/image/gif/a272ba6d8763cad26c19fe5a38774f92/fx13.sml fx13 fx13.sml sml 32320 297 201 IMAGE-THUMBNAIL 1-s2.0-S1872206721638639-fx14.sml https://s3-eu-west-1.amazonaws.com/prod-ucs-content-store-eu-west/content/pii:S1872206721638639/fx14/THUMBNAIL/image/gif/c3d23895dac25c6fc6522975418bb6f2/fx14.sml fx14 fx14.sml sml 29553 325 179 IMAGE-THUMBNAIL 1-s2.0-S1872206721638639-fx15.sml https://s3-eu-west-1.amazonaws.com/prod-ucs-content-store-eu-west/content/pii:S1872206721638639/fx15/THUMBNAIL/image/gif/04bdc5590e215080d387e9a3dd8e3db7/fx15.sml fx15 fx15.sml sml 39313 298 189 IMAGE-THUMBNAIL 1-s2.0-S1872206721638639-fx16.sml https://s3-eu-west-1.amazonaws.com/prod-ucs-content-store-eu-west/content/pii:S1872206721638639/fx16/THUMBNAIL/image/gif/77acac559c3515239e62a77f3f6f9c18/fx16.sml fx16 fx16.sml sml 27172 182 201 IMAGE-THUMBNAIL 1-s2.0-S1872206721638639-fx17.sml https://s3-eu-west-1.amazonaws.com/prod-ucs-content-store-eu-west/content/pii:S1872206721638639/fx17/THUMBNAIL/image/gif/0211a697d1dc54a92a1d4dd41780008f/fx17.sml fx17 fx17.sml sml 29322 346 188 IMAGE-THUMBNAIL 1-s2.0-S1872206721638639-fx18.sml https://s3-eu-west-1.amazonaws.com/prod-ucs-content-store-eu-west/content/pii:S1872206721638639/fx18/THUMBNAIL/image/gif/2d4fb5c37fe3eaabfe6011145843a697/fx18.sml fx18 fx18.sml sml 38276 350 190 IMAGE-THUMBNAIL 1-s2.0-S1872206721638639-fx19.sml https://s3-eu-west-1.amazonaws.com/prod-ucs-content-store-eu-west/content/pii:S1872206721638639/fx19/THUMBNAIL/image/gif/5615317d925ec3d9e0a26aed55eacf86/fx19.sml fx19 fx19.sml sml 20306 224 216 IMAGE-THUMBNAIL 1-s2.0-S1872206721638639-fx2.sml https://s3-eu-west-1.amazonaws.com/prod-ucs-content-store-eu-west/content/pii:S1872206721638639/fx2/THUMBNAIL/image/gif/0eb798827b69b0d448cddd8292f1cbdc/fx2.sml fx2 fx2.sml sml 20597 204 187 IMAGE-THUMBNAIL 1-s2.0-S1872206721638639-fx20.sml https://s3-eu-west-1.amazonaws.com/prod-ucs-content-store-eu-west/content/pii:S1872206721638639/fx20/THUMBNAIL/image/gif/7f840f9deb3df03deacb0f7ccecf70a9/fx20.sml fx20 fx20.sml sml 29348 317 169 IMAGE-THUMBNAIL 1-s2.0-S1872206721638639-fx21.sml https://s3-eu-west-1.amazonaws.com/prod-ucs-content-store-eu-west/content/pii:S1872206721638639/fx21/THUMBNAIL/image/gif/cfc890c9b4c751959cdd97c10c79464f/fx21.sml fx21 fx21.sml sml 19722 258 172 IMAGE-THUMBNAIL 1-s2.0-S1872206721638639-fx22.sml https://s3-eu-west-1.amazonaws.com/prod-ucs-content-store-eu-west/content/pii:S1872206721638639/fx22/THUMBNAIL/image/gif/db626dd1d16999a2c52a52f696432af8/fx22.sml fx22 fx22.sml sml 28227 219 171 IMAGE-THUMBNAIL 1-s2.0-S1872206721638639-fx23.sml https://s3-eu-west-1.amazonaws.com/prod-ucs-content-store-eu-west/content/pii:S1872206721638639/fx23/THUMBNAIL/image/gif/31f370d13173d559208dfe2c6364bb6a/fx23.sml fx23 fx23.sml sml 38195 326 172 IMAGE-THUMBNAIL 1-s2.0-S1872206721638639-fx24.sml https://s3-eu-west-1.amazonaws.com/prod-ucs-content-store-eu-west/content/pii:S1872206721638639/fx24/THUMBNAIL/image/gif/1506471e3cb2c0355e3c2191a2087095/fx24.sml fx24 fx24.sml sml 19301 160 165 IMAGE-THUMBNAIL 1-s2.0-S1872206721638639-fx25.sml https://s3-eu-west-1.amazonaws.com/prod-ucs-content-store-eu-west/content/pii:S1872206721638639/fx25/THUMBNAIL/image/gif/f783978a6d67675ae66eb59db6a6de68/fx25.sml fx25 fx25.sml sml 38266 343 178 IMAGE-THUMBNAIL 1-s2.0-S1872206721638639-fx26.sml https://s3-eu-west-1.amazonaws.com/prod-ucs-content-store-eu-west/content/pii:S1872206721638639/fx26/THUMBNAIL/image/gif/386131b984530bfaf0eb3e652b26a6c6/fx26.sml fx26 fx26.sml sml 36833 331 178 IMAGE-THUMBNAIL 1-s2.0-S1872206721638639-fx27.sml https://s3-eu-west-1.amazonaws.com/prod-ucs-content-store-eu-west/content/pii:S1872206721638639/fx27/THUMBNAIL/image/gif/128183facc59970406a189fe8290b1c4/fx27.sml fx27 fx27.sml sml 38442 394 186 IMAGE-THUMBNAIL 1-s2.0-S1872206721638639-fx28.sml https://s3-eu-west-1.amazonaws.com/prod-ucs-content-store-eu-west/content/pii:S1872206721638639/fx28/THUMBNAIL/image/gif/4ac707ea348aa36a8f753c44f326fcfa/fx28.sml fx28 fx28.sml sml 28492 297 178 IMAGE-THUMBNAIL 1-s2.0-S1872206721638639-fx29.sml https://s3-eu-west-1.amazonaws.com/prod-ucs-content-store-eu-west/content/pii:S1872206721638639/fx29/THUMBNAIL/image/gif/b8d8622b56a46c0a35a197c53a6a9bbd/fx29.sml fx29 fx29.sml sml 45058 373 178 IMAGE-THUMBNAIL 1-s2.0-S1872206721638639-fx3.sml https://s3-eu-west-1.amazonaws.com/prod-ucs-content-store-eu-west/content/pii:S1872206721638639/fx3/THUMBNAIL/image/gif/e64703e70762280b20e5143ac67b42aa/fx3.sml fx3 fx3.sml sml 38953 321 184 IMAGE-THUMBNAIL 1-s2.0-S1872206721638639-fx30.sml https://s3-eu-west-1.amazonaws.com/prod-ucs-content-store-eu-west/content/pii:S1872206721638639/fx30/THUMBNAIL/image/gif/b865cd5fcc89beb104bf1b5e915c0177/fx30.sml fx30 fx30.sml sml 38399 327 177 IMAGE-THUMBNAIL 1-s2.0-S1872206721638639-fx31.sml https://s3-eu-west-1.amazonaws.com/prod-ucs-content-store-eu-west/content/pii:S1872206721638639/fx31/THUMBNAIL/image/gif/5807f003b7684f912336ea25d6af5dc0/fx31.sml fx31 fx31.sml sml 35364 344 178 IMAGE-THUMBNAIL 1-s2.0-S1872206721638639-fx32.sml https://s3-eu-west-1.amazonaws.com/prod-ucs-content-store-eu-west/content/pii:S1872206721638639/fx32/THUMBNAIL/image/gif/29cdf031d4dd539b157fb611e68363df/fx32.sml fx32 fx32.sml sml 16078 156 173 IMAGE-THUMBNAIL 1-s2.0-S1872206721638639-fx33.sml https://s3-eu-west-1.amazonaws.com/prod-ucs-content-store-eu-west/content/pii:S1872206721638639/fx33/THUMBNAIL/image/gif/486ffd11373be6c1b9af590e2033f034/fx33.sml fx33 fx33.sml sml 38363 289 168 IMAGE-THUMBNAIL 1-s2.0-S1872206721638639-fx34.sml https://s3-eu-west-1.amazonaws.com/prod-ucs-content-store-eu-west/content/pii:S1872206721638639/fx34/THUMBNAIL/image/gif/8661f286bc1231d5c80354ffbabc7020/fx34.sml fx34 fx34.sml sml 24889 296 166 IMAGE-THUMBNAIL 1-s2.0-S1872206721638639-fx35.sml https://s3-eu-west-1.amazonaws.com/prod-ucs-content-store-eu-west/content/pii:S1872206721638639/fx35/THUMBNAIL/image/gif/f593b082c2b1867510d3abe8e9628c54/fx35.sml fx35 fx35.sml sml 22086 318 158 IMAGE-THUMBNAIL 1-s2.0-S1872206721638639-fx4.sml https://s3-eu-west-1.amazonaws.com/prod-ucs-content-store-eu-west/content/pii:S1872206721638639/fx4/THUMBNAIL/image/gif/49c20a932cd636bf6bd9a5e3c5bf4836/fx4.sml fx4 fx4.sml sml 38149 324 187 IMAGE-THUMBNAIL 1-s2.0-S1872206721638639-fx5.sml https://s3-eu-west-1.amazonaws.com/prod-ucs-content-store-eu-west/content/pii:S1872206721638639/fx5/THUMBNAIL/image/gif/a80c4f16398e6f5bacaf4b98427103ec/fx5.sml fx5 fx5.sml sml 34622 346 177 IMAGE-THUMBNAIL 1-s2.0-S1872206721638639-fx6.sml https://s3-eu-west-1.amazonaws.com/prod-ucs-content-store-eu-west/content/pii:S1872206721638639/fx6/THUMBNAIL/image/gif/f8099cf3b73e265e4f2d0c750d6ff76a/fx6.sml fx6 fx6.sml sml 25479 285 174 IMAGE-THUMBNAIL 1-s2.0-S1872206721638639-fx7.sml https://s3-eu-west-1.amazonaws.com/prod-ucs-content-store-eu-west/content/pii:S1872206721638639/fx7/THUMBNAIL/image/gif/085e58b34341f67ec7df741e33764e38/fx7.sml fx7 fx7.sml sml 36334 315 178 IMAGE-THUMBNAIL 1-s2.0-S1872206721638639-fx8.sml https://s3-eu-west-1.amazonaws.com/prod-ucs-content-store-eu-west/content/pii:S1872206721638639/fx8/THUMBNAIL/image/gif/2908cf919bf54d3ebe6ece3d27a7e852/fx8.sml fx8 fx8.sml sml 40476 317 173 IMAGE-THUMBNAIL 1-s2.0-S1872206721638639-fx9.sml https://s3-eu-west-1.amazonaws.com/prod-ucs-content-store-eu-west/content/pii:S1872206721638639/fx9/THUMBNAIL/image/gif/c2b4fd04b0c3d2fd3a30ceff5d574ae7/fx9.sml fx9 fx9.sml sml 29937 367 177 IMAGE-THUMBNAIL 1-s2.0-S1872206721638639-gr1.sml https://s3-eu-west-1.amazonaws.com/prod-ucs-content-store-eu-west/content/pii:S1872206721638639/gr1/THUMBNAIL/image/gif/a0031759b1a46e33cad2f4634aa06135/gr1.sml gr1 gr1.sml sml 6870 97 219 IMAGE-THUMBNAIL 1-s2.0-S1872206721638639-gr10.sml https://s3-eu-west-1.amazonaws.com/prod-ucs-content-store-eu-west/content/pii:S1872206721638639/gr10/THUMBNAIL/image/gif/3cf7c093a917ba4b7175bafdb9f08e85/gr10.sml gr10 gr10.sml sml 12909 97 219 IMAGE-THUMBNAIL 1-s2.0-S1872206721638639-gr11.sml https://s3-eu-west-1.amazonaws.com/prod-ucs-content-store-eu-west/content/pii:S1872206721638639/gr11/THUMBNAIL/image/gif/b53a44762a7542dc843fdd6e8dad56e7/gr11.sml gr11 gr11.sml sml 12053 77 219 IMAGE-THUMBNAIL 1-s2.0-S1872206721638639-gr12.sml https://s3-eu-west-1.amazonaws.com/prod-ucs-content-store-eu-west/content/pii:S1872206721638639/gr12/THUMBNAIL/image/gif/8ef0e2b8ec9b2b458b8f1beb14c39c18/gr12.sml gr12 gr12.sml sml 10570 74 219 IMAGE-THUMBNAIL 1-s2.0-S1872206721638639-gr13.sml https://s3-eu-west-1.amazonaws.com/prod-ucs-content-store-eu-west/content/pii:S1872206721638639/gr13/THUMBNAIL/image/gif/33b3f880b2196fbdf2c8fc8fa0ce5fba/gr13.sml gr13 gr13.sml sml 13317 100 219 IMAGE-THUMBNAIL 1-s2.0-S1872206721638639-gr14.sml https://s3-eu-west-1.amazonaws.com/prod-ucs-content-store-eu-west/content/pii:S1872206721638639/gr14/THUMBNAIL/image/gif/700e9af746deaec6982ec9acece0201a/gr14.sml gr14 gr14.sml sml 14020 137 219 IMAGE-THUMBNAIL 1-s2.0-S1872206721638639-gr15.sml https://s3-eu-west-1.amazonaws.com/prod-ucs-content-store-eu-west/content/pii:S1872206721638639/gr15/THUMBNAIL/image/gif/697e54e4f746e3816558dac89a5d0d88/gr15.sml gr15 gr15.sml sml 9276 116 219 IMAGE-THUMBNAIL 1-s2.0-S1872206721638639-gr16.sml https://s3-eu-west-1.amazonaws.com/prod-ucs-content-store-eu-west/content/pii:S1872206721638639/gr16/THUMBNAIL/image/gif/e41eda1716889737a672e4a1e93734d9/gr16.sml gr16 gr16.sml sml 19254 154 219 IMAGE-THUMBNAIL 1-s2.0-S1872206721638639-gr17.sml https://s3-eu-west-1.amazonaws.com/prod-ucs-content-store-eu-west/content/pii:S1872206721638639/gr17/THUMBNAIL/image/gif/69110c74715c3bbfd655f3b275485a88/gr17.sml gr17 gr17.sml sml 17441 164 174 IMAGE-THUMBNAIL 1-s2.0-S1872206721638639-gr18.sml https://s3-eu-west-1.amazonaws.com/prod-ucs-content-store-eu-west/content/pii:S1872206721638639/gr18/THUMBNAIL/image/gif/8cf1de96aab373ecacb010822e318e52/gr18.sml gr18 gr18.sml sml 15504 164 204 IMAGE-THUMBNAIL 1-s2.0-S1872206721638639-gr19.sml https://s3-eu-west-1.amazonaws.com/prod-ucs-content-store-eu-west/content/pii:S1872206721638639/gr19/THUMBNAIL/image/gif/2ddb8ae33193ec622ddcab62b28dab5d/gr19.sml gr19 gr19.sml sml 11789 164 202 IMAGE-THUMBNAIL 1-s2.0-S1872206721638639-gr2.sml https://s3-eu-west-1.amazonaws.com/prod-ucs-content-store-eu-west/content/pii:S1872206721638639/gr2/THUMBNAIL/image/gif/60346d33687b7864934d03f3915090f8/gr2.sml gr2 gr2.sml sml 8205 155 219 IMAGE-THUMBNAIL 1-s2.0-S1872206721638639-gr20.sml https://s3-eu-west-1.amazonaws.com/prod-ucs-content-store-eu-west/content/pii:S1872206721638639/gr20/THUMBNAIL/image/gif/8ac46ca244d8df701081080a0308b2cb/gr20.sml gr20 gr20.sml sml 15769 121 219 IMAGE-THUMBNAIL 1-s2.0-S1872206721638639-gr21.sml https://s3-eu-west-1.amazonaws.com/prod-ucs-content-store-eu-west/content/pii:S1872206721638639/gr21/THUMBNAIL/image/gif/15b49f1d98c6de849ac76f0e1e4d66ef/gr21.sml gr21 gr21.sml sml 9266 105 219 IMAGE-THUMBNAIL 1-s2.0-S1872206721638639-gr22.sml https://s3-eu-west-1.amazonaws.com/prod-ucs-content-store-eu-west/content/pii:S1872206721638639/gr22/THUMBNAIL/image/gif/2ecbccee07d5518ef70d304706ffafa9/gr22.sml gr22 gr22.sml sml 19300 109 219 IMAGE-THUMBNAIL 1-s2.0-S1872206721638639-gr23.sml https://s3-eu-west-1.amazonaws.com/prod-ucs-content-store-eu-west/content/pii:S1872206721638639/gr23/THUMBNAIL/image/gif/6dc189bc4af22459d8c989380bfa78c1/gr23.sml gr23 gr23.sml sml 12292 103 219 IMAGE-THUMBNAIL 1-s2.0-S1872206721638639-gr24.sml https://s3-eu-west-1.amazonaws.com/prod-ucs-content-store-eu-west/content/pii:S1872206721638639/gr24/THUMBNAIL/image/gif/dfddfe3e56c4831b9ddf4fb52bbdaf9d/gr24.sml gr24 gr24.sml sml 24504 147 219 IMAGE-THUMBNAIL 1-s2.0-S1872206721638639-gr25.sml https://s3-eu-west-1.amazonaws.com/prod-ucs-content-store-eu-west/content/pii:S1872206721638639/gr25/THUMBNAIL/image/gif/b20c4ae77707ca4a92943fc52cd88713/gr25.sml gr25 gr25.sml sml 14589 163 205 IMAGE-THUMBNAIL 1-s2.0-S1872206721638639-gr26.sml https://s3-eu-west-1.amazonaws.com/prod-ucs-content-store-eu-west/content/pii:S1872206721638639/gr26/THUMBNAIL/image/gif/b234844ff67c15edda1ff2ce421e4248/gr26.sml gr26 gr26.sml sml 11562 111 219 IMAGE-THUMBNAIL 1-s2.0-S1872206721638639-gr27.sml https://s3-eu-west-1.amazonaws.com/prod-ucs-content-store-eu-west/content/pii:S1872206721638639/gr27/THUMBNAIL/image/gif/346a05aeb12467eb80b66f8331ffaa74/gr27.sml gr27 gr27.sml sml 15210 120 219 IMAGE-THUMBNAIL 1-s2.0-S1872206721638639-gr28.sml https://s3-eu-west-1.amazonaws.com/prod-ucs-content-store-eu-west/content/pii:S1872206721638639/gr28/THUMBNAIL/image/gif/ba3108744e1be0ce24fe694dbd64686c/gr28.sml gr28 gr28.sml sml 15025 111 219 IMAGE-THUMBNAIL 1-s2.0-S1872206721638639-gr29.sml https://s3-eu-west-1.amazonaws.com/prod-ucs-content-store-eu-west/content/pii:S1872206721638639/gr29/THUMBNAIL/image/gif/cb61eb31950c706082c105f204fa90e1/gr29.sml gr29 gr29.sml sml 14911 116 219 IMAGE-THUMBNAIL 1-s2.0-S1872206721638639-gr3.sml https://s3-eu-west-1.amazonaws.com/prod-ucs-content-store-eu-west/content/pii:S1872206721638639/gr3/THUMBNAIL/image/gif/f2a58527b9dc112933fb3260ad6fbeb4/gr3.sml gr3 gr3.sml sml 19619 164 166 IMAGE-THUMBNAIL 1-s2.0-S1872206721638639-gr30.sml https://s3-eu-west-1.amazonaws.com/prod-ucs-content-store-eu-west/content/pii:S1872206721638639/gr30/THUMBNAIL/image/gif/5818291863324885b43e93d77dc71d1d/gr30.sml gr30 gr30.sml sml 12204 102 219 IMAGE-THUMBNAIL 1-s2.0-S1872206721638639-gr31.sml https://s3-eu-west-1.amazonaws.com/prod-ucs-content-store-eu-west/content/pii:S1872206721638639/gr31/THUMBNAIL/image/gif/9878a6af7ca8a8a6e2392512f57adeb1/gr31.sml gr31 gr31.sml sml 16134 164 192 IMAGE-THUMBNAIL 1-s2.0-S1872206721638639-gr32.sml https://s3-eu-west-1.amazonaws.com/prod-ucs-content-store-eu-west/content/pii:S1872206721638639/gr32/THUMBNAIL/image/gif/c969777b6513474de6975aa5a1b6abb0/gr32.sml gr32 gr32.sml sml 12111 95 219 IMAGE-THUMBNAIL 1-s2.0-S1872206721638639-gr33.sml https://s3-eu-west-1.amazonaws.com/prod-ucs-content-store-eu-west/content/pii:S1872206721638639/gr33/THUMBNAIL/image/gif/6b3367a5e4422fd1edf23f10a28e1bf5/gr33.sml gr33 gr33.sml sml 11182 160 219 IMAGE-THUMBNAIL 1-s2.0-S1872206721638639-gr34.sml https://s3-eu-west-1.amazonaws.com/prod-ucs-content-store-eu-west/content/pii:S1872206721638639/gr34/THUMBNAIL/image/gif/74fe89b2f1df2170846aa1eb635b5ede/gr34.sml gr34 gr34.sml sml 15257 163 171 IMAGE-THUMBNAIL 1-s2.0-S1872206721638639-gr35.sml https://s3-eu-west-1.amazonaws.com/prod-ucs-content-store-eu-west/content/pii:S1872206721638639/gr35/THUMBNAIL/image/gif/4ea5dc0942a5b0fc04227143183239d8/gr35.sml gr35 gr35.sml sml 12054 115 219 IMAGE-THUMBNAIL 1-s2.0-S1872206721638639-gr4.sml https://s3-eu-west-1.amazonaws.com/prod-ucs-content-store-eu-west/content/pii:S1872206721638639/gr4/THUMBNAIL/image/gif/3584338ccdf5315fd070bd0029228818/gr4.sml gr4 gr4.sml sml 14129 136 219 IMAGE-THUMBNAIL 1-s2.0-S1872206721638639-gr5.sml https://s3-eu-west-1.amazonaws.com/prod-ucs-content-store-eu-west/content/pii:S1872206721638639/gr5/THUMBNAIL/image/gif/48bf454fa8cc861c0515ed1f4c9c1a11/gr5.sml gr5 gr5.sml sml 18830 150 219 IMAGE-THUMBNAIL 1-s2.0-S1872206721638639-gr6.sml https://s3-eu-west-1.amazonaws.com/prod-ucs-content-store-eu-west/content/pii:S1872206721638639/gr6/THUMBNAIL/image/gif/50f65482c8187ae3ed4bf5d6b720948d/gr6.sml gr6 gr6.sml sml 4970 44 219 IMAGE-THUMBNAIL 1-s2.0-S1872206721638639-gr7.sml https://s3-eu-west-1.amazonaws.com/prod-ucs-content-store-eu-west/content/pii:S1872206721638639/gr7/THUMBNAIL/image/gif/939db458c009ddc63b1d7e5463c61153/gr7.sml gr7 gr7.sml sml 13614 153 219 IMAGE-THUMBNAIL 1-s2.0-S1872206721638639-gr8.sml https://s3-eu-west-1.amazonaws.com/prod-ucs-content-store-eu-west/content/pii:S1872206721638639/gr8/THUMBNAIL/image/gif/2d9334e0d9757f36e1874fa0d88f0950/gr8.sml gr8 gr8.sml sml 16231 118 219 IMAGE-THUMBNAIL 1-s2.0-S1872206721638639-gr9.sml https://s3-eu-west-1.amazonaws.com/prod-ucs-content-store-eu-west/content/pii:S1872206721638639/gr9/THUMBNAIL/image/gif/e97d3da70f6f6115a0d1d135f6eae6fe/gr9.sml gr9 gr9.sml sml 9097 65 219 IMAGE-THUMBNAIL 1-s2.0-S1872206721638639-grap.sml https://s3-eu-west-1.amazonaws.com/prod-ucs-content-store-eu-west/content/pii:S1872206721638639/grap/THUMBNAIL/image/gif/e882755a9c959d17291ab001185b7dda/grap.sml grap true grap.sml sml 15504 163 172 IMAGE-THUMBNAIL 1-s2.0-S1872206721638639-fx1_lrg.jpg https://s3-eu-west-1.amazonaws.com/prod-ucs-content-store-eu-west/content/pii:S1872206721638639/fx1/HIGHRES/image/jpeg/61f2482961e379d19682d03dbd6a4ba0/fx1_lrg.jpg fx1 fx1_lrg.jpg jpg 20952 327 187 IMAGE-HIGH-RES 1-s2.0-S1872206721638639-fx10_lrg.jpg https://s3-eu-west-1.amazonaws.com/prod-ucs-content-store-eu-west/content/pii:S1872206721638639/fx10/HIGHRES/image/jpeg/1752f29a7c3bf4ecab162752b26ad736/fx10_lrg.jpg fx10 fx10_lrg.jpg jpg 36202 320 177 IMAGE-HIGH-RES 1-s2.0-S1872206721638639-fx11_lrg.jpg https://s3-eu-west-1.amazonaws.com/prod-ucs-content-store-eu-west/content/pii:S1872206721638639/fx11/HIGHRES/image/jpeg/33c67261ad8ba1ab8d03f90123765e3b/fx11_lrg.jpg fx11 fx11_lrg.jpg jpg 23048 319 176 IMAGE-HIGH-RES 1-s2.0-S1872206721638639-fx12_lrg.jpg https://s3-eu-west-1.amazonaws.com/prod-ucs-content-store-eu-west/content/pii:S1872206721638639/fx12/HIGHRES/image/jpeg/283c1c45e8761a9d55b5da181150568c/fx12_lrg.jpg fx12 fx12_lrg.jpg jpg 24137 328 177 IMAGE-HIGH-RES 1-s2.0-S1872206721638639-fx13_lrg.jpg https://s3-eu-west-1.amazonaws.com/prod-ucs-content-store-eu-west/content/pii:S1872206721638639/fx13/HIGHRES/image/jpeg/712159dd97a818171da4c219544a2bed/fx13_lrg.jpg fx13 fx13_lrg.jpg jpg 18875 297 201 IMAGE-HIGH-RES 1-s2.0-S1872206721638639-fx14_lrg.jpg https://s3-eu-west-1.amazonaws.com/prod-ucs-content-store-eu-west/content/pii:S1872206721638639/fx14/HIGHRES/image/jpeg/dcd450dc5d66cce846aeffaba4a62877/fx14_lrg.jpg fx14 fx14_lrg.jpg jpg 16946 325 179 IMAGE-HIGH-RES 1-s2.0-S1872206721638639-fx15_lrg.jpg https://s3-eu-west-1.amazonaws.com/prod-ucs-content-store-eu-west/content/pii:S1872206721638639/fx15/HIGHRES/image/jpeg/a84381029113ffbb98e768f60c2c89aa/fx15_lrg.jpg fx15 fx15_lrg.jpg jpg 21506 298 189 IMAGE-HIGH-RES 1-s2.0-S1872206721638639-fx16_lrg.jpg https://s3-eu-west-1.amazonaws.com/prod-ucs-content-store-eu-west/content/pii:S1872206721638639/fx16/HIGHRES/image/jpeg/1f3f7cba603a0ed7ebe7ae79a557f0e3/fx16_lrg.jpg fx16 fx16_lrg.jpg jpg 11816 182 201 IMAGE-HIGH-RES 1-s2.0-S1872206721638639-fx17_lrg.jpg https://s3-eu-west-1.amazonaws.com/prod-ucs-content-store-eu-west/content/pii:S1872206721638639/fx17/HIGHRES/image/jpeg/e9b3d5dbd73067595ff6f7973374f58d/fx17_lrg.jpg fx17 fx17_lrg.jpg jpg 19507 346 188 IMAGE-HIGH-RES 1-s2.0-S1872206721638639-fx18_lrg.jpg https://s3-eu-west-1.amazonaws.com/prod-ucs-content-store-eu-west/content/pii:S1872206721638639/fx18/HIGHRES/image/jpeg/b6f5a942df0bfb7153fb454278615313/fx18_lrg.jpg fx18 fx18_lrg.jpg jpg 24371 350 190 IMAGE-HIGH-RES 1-s2.0-S1872206721638639-fx19_lrg.jpg https://s3-eu-west-1.amazonaws.com/prod-ucs-content-store-eu-west/content/pii:S1872206721638639/fx19/HIGHRES/image/jpeg/fdcc9b0da795e8130bd5468253a1fdd4/fx19_lrg.jpg fx19 fx19_lrg.jpg jpg 12108 224 216 IMAGE-HIGH-RES 1-s2.0-S1872206721638639-fx2_lrg.jpg https://s3-eu-west-1.amazonaws.com/prod-ucs-content-store-eu-west/content/pii:S1872206721638639/fx2/HIGHRES/image/jpeg/3c5a2ad5b4e80965bb1dccb68136093d/fx2_lrg.jpg fx2 fx2_lrg.jpg jpg 10798 204 187 IMAGE-HIGH-RES 1-s2.0-S1872206721638639-fx20_lrg.jpg https://s3-eu-west-1.amazonaws.com/prod-ucs-content-store-eu-west/content/pii:S1872206721638639/fx20/HIGHRES/image/jpeg/6a5b2468658c8a00be2f16bd3e17c557/fx20_lrg.jpg fx20 fx20_lrg.jpg jpg 20374 317 169 IMAGE-HIGH-RES 1-s2.0-S1872206721638639-fx21_lrg.jpg https://s3-eu-west-1.amazonaws.com/prod-ucs-content-store-eu-west/content/pii:S1872206721638639/fx21/HIGHRES/image/jpeg/0ee3c6cdb06b2ae8214f38f454087a0c/fx21_lrg.jpg fx21 fx21_lrg.jpg jpg 16181 258 172 IMAGE-HIGH-RES 1-s2.0-S1872206721638639-fx22_lrg.jpg https://s3-eu-west-1.amazonaws.com/prod-ucs-content-store-eu-west/content/pii:S1872206721638639/fx22/HIGHRES/image/jpeg/c80f38bf0e87287cb5a6846a25bf3554/fx22_lrg.jpg fx22 fx22_lrg.jpg jpg 22165 219 171 IMAGE-HIGH-RES 1-s2.0-S1872206721638639-fx23_lrg.jpg https://s3-eu-west-1.amazonaws.com/prod-ucs-content-store-eu-west/content/pii:S1872206721638639/fx23/HIGHRES/image/jpeg/980b01838b56c8531c626f7de63780b1/fx23_lrg.jpg fx23 fx23_lrg.jpg jpg 30015 326 172 IMAGE-HIGH-RES 1-s2.0-S1872206721638639-fx24_lrg.jpg https://s3-eu-west-1.amazonaws.com/prod-ucs-content-store-eu-west/content/pii:S1872206721638639/fx24/HIGHRES/image/jpeg/16012b52736cafdf42c87fb31b25fe28/fx24_lrg.jpg fx24 fx24_lrg.jpg jpg 10611 160 165 IMAGE-HIGH-RES 1-s2.0-S1872206721638639-fx25_lrg.jpg https://s3-eu-west-1.amazonaws.com/prod-ucs-content-store-eu-west/content/pii:S1872206721638639/fx25/HIGHRES/image/jpeg/c8bb6504a844a80e763bd8032dfa672c/fx25_lrg.jpg fx25 fx25_lrg.jpg jpg 21601 343 178 IMAGE-HIGH-RES 1-s2.0-S1872206721638639-fx26_lrg.jpg https://s3-eu-west-1.amazonaws.com/prod-ucs-content-store-eu-west/content/pii:S1872206721638639/fx26/HIGHRES/image/jpeg/90360e9648f62bb2820896a24101b111/fx26_lrg.jpg fx26 fx26_lrg.jpg jpg 25839 331 178 IMAGE-HIGH-RES 1-s2.0-S1872206721638639-fx27_lrg.jpg https://s3-eu-west-1.amazonaws.com/prod-ucs-content-store-eu-west/content/pii:S1872206721638639/fx27/HIGHRES/image/jpeg/a054c5d45f1e2054945578f8b479a9da/fx27_lrg.jpg fx27 fx27_lrg.jpg jpg 30560 394 186 IMAGE-HIGH-RES 1-s2.0-S1872206721638639-fx28_lrg.jpg https://s3-eu-west-1.amazonaws.com/prod-ucs-content-store-eu-west/content/pii:S1872206721638639/fx28/HIGHRES/image/jpeg/53c14a2cdb34bfb71b589597c4d0fb20/fx28_lrg.jpg fx28 fx28_lrg.jpg jpg 21374 297 178 IMAGE-HIGH-RES 1-s2.0-S1872206721638639-fx29_lrg.jpg https://s3-eu-west-1.amazonaws.com/prod-ucs-content-store-eu-west/content/pii:S1872206721638639/fx29/HIGHRES/image/jpeg/33fec1474a52191156fe750d6459d2f3/fx29_lrg.jpg fx29 fx29_lrg.jpg jpg 28256 373 178 IMAGE-HIGH-RES 1-s2.0-S1872206721638639-fx3_lrg.jpg https://s3-eu-west-1.amazonaws.com/prod-ucs-content-store-eu-west/content/pii:S1872206721638639/fx3/HIGHRES/image/jpeg/3d66cdef92ca2ccc0925e8ce866da996/fx3_lrg.jpg fx3 fx3_lrg.jpg jpg 18511 321 184 IMAGE-HIGH-RES 1-s2.0-S1872206721638639-fx30_lrg.jpg https://s3-eu-west-1.amazonaws.com/prod-ucs-content-store-eu-west/content/pii:S1872206721638639/fx30/HIGHRES/image/jpeg/c63146c70a68185fa6ef03221bf7c5e8/fx30_lrg.jpg fx30 fx30_lrg.jpg jpg 22488 327 177 IMAGE-HIGH-RES 1-s2.0-S1872206721638639-fx31_lrg.jpg https://s3-eu-west-1.amazonaws.com/prod-ucs-content-store-eu-west/content/pii:S1872206721638639/fx31/HIGHRES/image/jpeg/6b342a4d7e46e3bded6147d366d5bfe4/fx31_lrg.jpg fx31 fx31_lrg.jpg jpg 22289 344 178 IMAGE-HIGH-RES 1-s2.0-S1872206721638639-fx32_lrg.jpg https://s3-eu-west-1.amazonaws.com/prod-ucs-content-store-eu-west/content/pii:S1872206721638639/fx32/HIGHRES/image/jpeg/efb401306e11e4a4aa5f2b72f9ac1a79/fx32_lrg.jpg fx32 fx32_lrg.jpg jpg 9116 156 173 IMAGE-HIGH-RES 1-s2.0-S1872206721638639-fx33_lrg.jpg https://s3-eu-west-1.amazonaws.com/prod-ucs-content-store-eu-west/content/pii:S1872206721638639/fx33/HIGHRES/image/jpeg/dbcd75a0271f4cd59be79981384ecd80/fx33_lrg.jpg fx33 fx33_lrg.jpg jpg 22135 289 168 IMAGE-HIGH-RES 1-s2.0-S1872206721638639-fx34_lrg.jpg https://s3-eu-west-1.amazonaws.com/prod-ucs-content-store-eu-west/content/pii:S1872206721638639/fx34/HIGHRES/image/jpeg/52b34253d2e14b405be7fffea4d978ec/fx34_lrg.jpg fx34 fx34_lrg.jpg jpg 14901 296 166 IMAGE-HIGH-RES 1-s2.0-S1872206721638639-fx35_lrg.jpg https://s3-eu-west-1.amazonaws.com/prod-ucs-content-store-eu-west/content/pii:S1872206721638639/fx35/HIGHRES/image/jpeg/c99a80325f6e571a57a56edc7eadbfb4/fx35_lrg.jpg fx35 fx35_lrg.jpg jpg 15523 318 158 IMAGE-HIGH-RES 1-s2.0-S1872206721638639-fx4_lrg.jpg https://s3-eu-west-1.amazonaws.com/prod-ucs-content-store-eu-west/content/pii:S1872206721638639/fx4/HIGHRES/image/jpeg/9225b7bb323c15355f17e65c535e8e2e/fx4_lrg.jpg fx4 fx4_lrg.jpg jpg 29044 324 187 IMAGE-HIGH-RES 1-s2.0-S1872206721638639-fx5_lrg.jpg https://s3-eu-west-1.amazonaws.com/prod-ucs-content-store-eu-west/content/pii:S1872206721638639/fx5/HIGHRES/image/jpeg/8868173592bcf9b6f347cf19d31a2060/fx5_lrg.jpg fx5 fx5_lrg.jpg jpg 20939 346 177 IMAGE-HIGH-RES 1-s2.0-S1872206721638639-fx6_lrg.jpg https://s3-eu-west-1.amazonaws.com/prod-ucs-content-store-eu-west/content/pii:S1872206721638639/fx6/HIGHRES/image/jpeg/2b1af25b35ba57a3bc2a36f7ca2bd5dd/fx6_lrg.jpg fx6 fx6_lrg.jpg jpg 18622 285 174 IMAGE-HIGH-RES 1-s2.0-S1872206721638639-fx7_lrg.jpg https://s3-eu-west-1.amazonaws.com/prod-ucs-content-store-eu-west/content/pii:S1872206721638639/fx7/HIGHRES/image/jpeg/6a50246091a09dde9aff6a865bac38e1/fx7_lrg.jpg fx7 fx7_lrg.jpg jpg 21638 315 178 IMAGE-HIGH-RES 1-s2.0-S1872206721638639-fx8_lrg.jpg https://s3-eu-west-1.amazonaws.com/prod-ucs-content-store-eu-west/content/pii:S1872206721638639/fx8/HIGHRES/image/jpeg/ff54fdd6ba3a80f2757a2be645b89bee/fx8_lrg.jpg fx8 fx8_lrg.jpg jpg 29915 317 173 IMAGE-HIGH-RES 1-s2.0-S1872206721638639-fx9_lrg.jpg https://s3-eu-west-1.amazonaws.com/prod-ucs-content-store-eu-west/content/pii:S1872206721638639/fx9/HIGHRES/image/jpeg/e244f7d7ea0ca16601d26c8f3e191d2e/fx9_lrg.jpg fx9 fx9_lrg.jpg jpg 17313 367 177 IMAGE-HIGH-RES 1-s2.0-S1872206721638639-gr1_lrg.jpg https://s3-eu-west-1.amazonaws.com/prod-ucs-content-store-eu-west/content/pii:S1872206721638639/gr1/HIGHRES/image/jpeg/634bd91c9327a8592fcd5eaa86181bbf/gr1_lrg.jpg gr1 gr1_lrg.jpg jpg 64370 397 892 IMAGE-HIGH-RES 1-s2.0-S1872206721638639-gr10_lrg.jpg https://s3-eu-west-1.amazonaws.com/prod-ucs-content-store-eu-west/content/pii:S1872206721638639/gr10/HIGHRES/image/jpeg/cef80e9576bcff2fa8f6864bb15bc4f2/gr10_lrg.jpg gr10 gr10_lrg.jpg jpg 110049 438 984 IMAGE-HIGH-RES 1-s2.0-S1872206721638639-gr11_lrg.jpg https://s3-eu-west-1.amazonaws.com/prod-ucs-content-store-eu-west/content/pii:S1872206721638639/gr11/HIGHRES/image/jpeg/a96c669e1e6dc320155875d2e0692600/gr11_lrg.jpg gr11 gr11_lrg.jpg jpg 116424 349 992 IMAGE-HIGH-RES 1-s2.0-S1872206721638639-gr12_lrg.jpg https://s3-eu-west-1.amazonaws.com/prod-ucs-content-store-eu-west/content/pii:S1872206721638639/gr12/HIGHRES/image/jpeg/873694d50a47fbd81a82f398114cb992/gr12_lrg.jpg gr12 gr12_lrg.jpg jpg 170235 525 1547 IMAGE-HIGH-RES 1-s2.0-S1872206721638639-gr13_lrg.jpg https://s3-eu-west-1.amazonaws.com/prod-ucs-content-store-eu-west/content/pii:S1872206721638639/gr13/HIGHRES/image/jpeg/14615936a029a77ef857fa4048a04a79/gr13_lrg.jpg gr13 gr13_lrg.jpg jpg 115908 449 985 IMAGE-HIGH-RES 1-s2.0-S1872206721638639-gr14_lrg.jpg https://s3-eu-west-1.amazonaws.com/prod-ucs-content-store-eu-west/content/pii:S1872206721638639/gr14/HIGHRES/image/jpeg/91974d64ae70ac83778e2bb6a7aed42e/gr14_lrg.jpg gr14 gr14_lrg.jpg jpg 136011 610 976 IMAGE-HIGH-RES 1-s2.0-S1872206721638639-gr15_lrg.jpg https://s3-eu-west-1.amazonaws.com/prod-ucs-content-store-eu-west/content/pii:S1872206721638639/gr15/HIGHRES/image/jpeg/edcf8e3463ca4646998b549e995aa218/gr15_lrg.jpg gr15 gr15_lrg.jpg jpg 133230 743 1398 IMAGE-HIGH-RES 1-s2.0-S1872206721638639-gr16_lrg.jpg https://s3-eu-west-1.amazonaws.com/prod-ucs-content-store-eu-west/content/pii:S1872206721638639/gr16/HIGHRES/image/jpeg/64c2af384987b6945c61c14cd27ff30f/gr16_lrg.jpg gr16 gr16_lrg.jpg jpg 363833 1066 1513 IMAGE-HIGH-RES 1-s2.0-S1872206721638639-gr17_lrg.jpg https://s3-eu-west-1.amazonaws.com/prod-ucs-content-store-eu-west/content/pii:S1872206721638639/gr17/HIGHRES/image/jpeg/a52c7f52ed4751e2d701f5e5298989b8/gr17_lrg.jpg gr17 gr17_lrg.jpg jpg 435521 1336 1418 IMAGE-HIGH-RES 1-s2.0-S1872206721638639-gr18_lrg.jpg https://s3-eu-west-1.amazonaws.com/prod-ucs-content-store-eu-west/content/pii:S1872206721638639/gr18/HIGHRES/image/jpeg/48bc4a1cc522c2eff9daf19195041c7b/gr18_lrg.jpg gr18 gr18_lrg.jpg jpg 320407 1124 1401 IMAGE-HIGH-RES 1-s2.0-S1872206721638639-gr19_lrg.jpg https://s3-eu-west-1.amazonaws.com/prod-ucs-content-store-eu-west/content/pii:S1872206721638639/gr19/HIGHRES/image/jpeg/fad27b65dc6d768b0a18a4f7222750ff/gr19_lrg.jpg gr19 gr19_lrg.jpg jpg 142835 771 951 IMAGE-HIGH-RES 1-s2.0-S1872206721638639-gr2_lrg.jpg https://s3-eu-west-1.amazonaws.com/prod-ucs-content-store-eu-west/content/pii:S1872206721638639/gr2/HIGHRES/image/jpeg/3486ce4371b5901b760e7005a3d2d8eb/gr2_lrg.jpg gr2 gr2_lrg.jpg jpg 100479 682 966 IMAGE-HIGH-RES 1-s2.0-S1872206721638639-gr20_lrg.jpg https://s3-eu-west-1.amazonaws.com/prod-ucs-content-store-eu-west/content/pii:S1872206721638639/gr20/HIGHRES/image/jpeg/aaa27abf3c54df2c68829762a67bbc2c/gr20_lrg.jpg gr20 gr20_lrg.jpg jpg 231632 754 1367 IMAGE-HIGH-RES 1-s2.0-S1872206721638639-gr21_lrg.jpg https://s3-eu-west-1.amazonaws.com/prod-ucs-content-store-eu-west/content/pii:S1872206721638639/gr21/HIGHRES/image/jpeg/f7b5435741ea5ce3ff9a5b9b7206a1a2/gr21_lrg.jpg gr21 gr21_lrg.jpg jpg 163891 681 1418 IMAGE-HIGH-RES 1-s2.0-S1872206721638639-gr22_lrg.jpg https://s3-eu-west-1.amazonaws.com/prod-ucs-content-store-eu-west/content/pii:S1872206721638639/gr22/HIGHRES/image/jpeg/2a7f941dcb52cdd66d196f5eeb410e17/gr22_lrg.jpg gr22 gr22_lrg.jpg jpg 273293 642 1294 IMAGE-HIGH-RES 1-s2.0-S1872206721638639-gr23_lrg.jpg https://s3-eu-west-1.amazonaws.com/prod-ucs-content-store-eu-west/content/pii:S1872206721638639/gr23/HIGHRES/image/jpeg/8d82be1d0efe1b349642d19f4e51e727/gr23_lrg.jpg gr23 gr23_lrg.jpg jpg 300162 806 1713 IMAGE-HIGH-RES 1-s2.0-S1872206721638639-gr24_lrg.jpg https://s3-eu-west-1.amazonaws.com/prod-ucs-content-store-eu-west/content/pii:S1872206721638639/gr24/HIGHRES/image/jpeg/cefc1ea7a42c999f6cb50aa21286dab7/gr24_lrg.jpg gr24 gr24_lrg.jpg jpg 164944 649 964 IMAGE-HIGH-RES 1-s2.0-S1872206721638639-gr25_lrg.jpg https://s3-eu-west-1.amazonaws.com/prod-ucs-content-store-eu-west/content/pii:S1872206721638639/gr25/HIGHRES/image/jpeg/6803d781dde63552c9ca9021df71c208/gr25_lrg.jpg gr25 gr25_lrg.jpg jpg 282893 1091 1368 IMAGE-HIGH-RES 1-s2.0-S1872206721638639-gr26_lrg.jpg https://s3-eu-west-1.amazonaws.com/prod-ucs-content-store-eu-west/content/pii:S1872206721638639/gr26/HIGHRES/image/jpeg/4e5a3af2b2c2cfacaf047b911b483bd9/gr26_lrg.jpg gr26 gr26_lrg.jpg jpg 225933 779 1531 IMAGE-HIGH-RES 1-s2.0-S1872206721638639-gr27_lrg.jpg https://s3-eu-west-1.amazonaws.com/prod-ucs-content-store-eu-west/content/pii:S1872206721638639/gr27/HIGHRES/image/jpeg/3301e6d353a9bd91689eac59602c6fff/gr27_lrg.jpg gr27 gr27_lrg.jpg jpg 191946 698 1276 IMAGE-HIGH-RES 1-s2.0-S1872206721638639-gr28_lrg.jpg https://s3-eu-west-1.amazonaws.com/prod-ucs-content-store-eu-west/content/pii:S1872206721638639/gr28/HIGHRES/image/jpeg/d10d811d27519edf7513b30af4942cfa/gr28_lrg.jpg gr28 gr28_lrg.jpg jpg 221256 713 1402 IMAGE-HIGH-RES 1-s2.0-S1872206721638639-gr29_lrg.jpg https://s3-eu-west-1.amazonaws.com/prod-ucs-content-store-eu-west/content/pii:S1872206721638639/gr29/HIGHRES/image/jpeg/c6bffad1f729a201575884da87ee184e/gr29_lrg.jpg gr29 gr29_lrg.jpg jpg 136691 520 980 IMAGE-HIGH-RES 1-s2.0-S1872206721638639-gr3_lrg.jpg https://s3-eu-west-1.amazonaws.com/prod-ucs-content-store-eu-west/content/pii:S1872206721638639/gr3/HIGHRES/image/jpeg/9a5b8465dbb0a9a31280f83dfaad49ab/gr3_lrg.jpg gr3 gr3_lrg.jpg jpg 170816 855 867 IMAGE-HIGH-RES 1-s2.0-S1872206721638639-gr30_lrg.jpg https://s3-eu-west-1.amazonaws.com/prod-ucs-content-store-eu-west/content/pii:S1872206721638639/gr30/HIGHRES/image/jpeg/2d17b2d5170e09726187cd49c0bebd20/gr30_lrg.jpg gr30 gr30_lrg.jpg jpg 272338 761 1626 IMAGE-HIGH-RES 1-s2.0-S1872206721638639-gr31_lrg.jpg https://s3-eu-west-1.amazonaws.com/prod-ucs-content-store-eu-west/content/pii:S1872206721638639/gr31/HIGHRES/image/jpeg/2470433a875a8016e3aab5b39def96f4/gr31_lrg.jpg gr31 gr31_lrg.jpg jpg 398866 1405 1644 IMAGE-HIGH-RES 1-s2.0-S1872206721638639-gr32_lrg.jpg https://s3-eu-west-1.amazonaws.com/prod-ucs-content-store-eu-west/content/pii:S1872206721638639/gr32/HIGHRES/image/jpeg/e247cbd18866e576a8c184e3d94fe0e0/gr32_lrg.jpg gr32 gr32_lrg.jpg jpg 327052 741 1709 IMAGE-HIGH-RES 1-s2.0-S1872206721638639-gr33_lrg.jpg https://s3-eu-west-1.amazonaws.com/prod-ucs-content-store-eu-west/content/pii:S1872206721638639/gr33/HIGHRES/image/jpeg/58672d15ee6383aa71fb27229f628d5d/gr33_lrg.jpg gr33 gr33_lrg.jpg jpg 158115 805 1101 IMAGE-HIGH-RES 1-s2.0-S1872206721638639-gr34_lrg.jpg https://s3-eu-west-1.amazonaws.com/prod-ucs-content-store-eu-west/content/pii:S1872206721638639/gr34/HIGHRES/image/jpeg/339c704a3f5ad1eda31a3c2544b36432/gr34_lrg.jpg gr34 gr34_lrg.jpg jpg 139844 660 691 IMAGE-HIGH-RES 1-s2.0-S1872206721638639-gr35_lrg.jpg https://s3-eu-west-1.amazonaws.com/prod-ucs-content-store-eu-west/content/pii:S1872206721638639/gr35/HIGHRES/image/jpeg/bcfe5a490d95f3015538c71f09b19c3e/gr35_lrg.jpg gr35 gr35_lrg.jpg jpg 112273 512 978 IMAGE-HIGH-RES 1-s2.0-S1872206721638639-gr4_lrg.jpg https://s3-eu-west-1.amazonaws.com/prod-ucs-content-store-eu-west/content/pii:S1872206721638639/gr4/HIGHRES/image/jpeg/87ab9343dc263427480218ef135051af/gr4_lrg.jpg gr4 gr4_lrg.jpg jpg 121285 557 895 IMAGE-HIGH-RES 1-s2.0-S1872206721638639-gr5_lrg.jpg https://s3-eu-west-1.amazonaws.com/prod-ucs-content-store-eu-west/content/pii:S1872206721638639/gr5/HIGHRES/image/jpeg/8c48c36db915f6d8f4bd39c713c14993/gr5_lrg.jpg gr5 gr5_lrg.jpg jpg 159218 658 962 IMAGE-HIGH-RES 1-s2.0-S1872206721638639-gr6_lrg.jpg https://s3-eu-west-1.amazonaws.com/prod-ucs-content-store-eu-west/content/pii:S1872206721638639/gr6/HIGHRES/image/jpeg/a02fd9f171d7c1fea05304e27de2c685/gr6_lrg.jpg gr6 gr6_lrg.jpg jpg 39276 185 929 IMAGE-HIGH-RES 1-s2.0-S1872206721638639-gr7_lrg.jpg https://s3-eu-west-1.amazonaws.com/prod-ucs-content-store-eu-west/content/pii:S1872206721638639/gr7/HIGHRES/image/jpeg/80559407949cc068c86d7a1a5a3f3a90/gr7_lrg.jpg gr7 gr7_lrg.jpg jpg 120408 693 989 IMAGE-HIGH-RES 1-s2.0-S1872206721638639-gr8_lrg.jpg https://s3-eu-west-1.amazonaws.com/prod-ucs-content-store-eu-west/content/pii:S1872206721638639/gr8/HIGHRES/image/jpeg/a831845a206fc27dc8f620e651c1431b/gr8_lrg.jpg gr8 gr8_lrg.jpg jpg 99710 535 990 IMAGE-HIGH-RES 1-s2.0-S1872206721638639-gr9_lrg.jpg https://s3-eu-west-1.amazonaws.com/prod-ucs-content-store-eu-west/content/pii:S1872206721638639/gr9/HIGHRES/image/jpeg/c3d65e57dd64b1a46ca7eee1054a9ad2/gr9_lrg.jpg gr9 gr9_lrg.jpg jpg 299554 607 2056 IMAGE-HIGH-RES 1-s2.0-S1872206721638639-grap_lrg.jpg https://s3-eu-west-1.amazonaws.com/prod-ucs-content-store-eu-west/content/pii:S1872206721638639/grap/HIGHRES/image/jpeg/3ca9ee3f7247903e41356aafda09a9a4/grap_lrg.jpg grap true grap_lrg.jpg jpg 132438 651 685 IMAGE-HIGH-RES CHNJC 63863 S1872-2067(21)63863-9 10.1016/S1872-2067(21)63863-9 Dalian Institute of Chemical Physics, the Chinese Academy of Sciences Fig. 1 Illustration of the advantages of hollow-structured materials. Fig. 2 (a) Illustration of procedures for preparing inorganic and hybrid hollow spheres. (b) The scheme shown for PS latex particles. Reprinted with permission from Ref. [98]. Copyright 1998, American Association for the Advancement of Science. Fig. 3 SEM (a) and TEM (b) images of solid PB mesocrystals (average particle size: 110 nm) as the starting material. SEM (c) and TEM (d) images of the hollow PB mesocrystals (average particle size: 110 nm) synthesized by chemical etching. Inset images on the SEM and TEM images are (a,c) enlarged SEM images of one particle and (b,d) the corresponding selected-area electron diffraction (SAED) patterns of one particle. Reprinted with permission from Ref. [110]. Copyright 2012, Wiley-VCH GmbH. Fig. 4 Schematic illustration of the formation process of NiCo2S4 ball-in-ball hollow spheres. Stage I, surface NiCo2S4 formed by anion exchange method. Stage II, further diffusion of S2– and formation of NiCo2S4 on the inner NiCo-glycerate core. Stage III, completion of the anion exchange reaction. M2+ refers to metal cations, including Ni2+ and Co2+ ions. Reprinted with permission from Ref. [113]. Copyright 2015, Springer Nature. Fig. 5 TEM images of core-shell ZIF-8@ZIF-67 NPs annealed at 500 °C (a,e), 550 °C (b,f), 600 °C (c,g), and 800 °C (d,h). (i) Schematic of the formation process of NC@Co-NGC DSNCs. Reprinted with permission from Ref. [115]. Copyright 2017, Wiley-VCH GmbH. Fig. 6 Illustration of preparation of hollow CdS nanospheres. Reprinted with permission from Ref. [133]. Copyright 2016, Springer Nature B.V. Fig. 7 TEM images of the obtained products after reactions for 0.5, 2, and 4 h, and the corresponding schematic illustration of the formation process of CdS-H. Reprinted with permission from Ref. [135]. Copyright 2019, Royal Society of Chemistry. Fig. 8 (a) Schematic illustration of the two-step sulfidation approach for the fabrication of CdS frame-in-cage particles. (b) TEM images of Cd-PBA cubes. (c,d) Cd-PBA cube-in-CdS cage particles. (e) CdS frame-in-cage particles. Reprinted with permission from Ref. [136]. Copyright 2020, Wiley-VCH GmbH. Fig. 9 TEM (a) and HAADF-STEM and EDX mapping images (b) of Zn0.6Cd0.4S NPs. (c) Schematic illustration of the synthesis process of hollow ZnCdS cages. Reprinted with permission from Ref. [137]. Copyright 2017, Royal Society of Chemistry. Fig. 10 (a) TEM images of AA-[Zn(OH)4]2– composite nanospheres. (b) TEM images of ZnS composite nanospheres. (c) TEM images of DS-Zn0.46Cd0.54S hollow nanospheres. (d) Schematic illustration of the synthetic strategy of Zn x Cd1–x S double-shell hollow nanospheres. Reprinted with permission from Ref. [148]. Copyright 2018, Elsevier B.V. Fig. 11 (a,b) SEM images of the tubular g-C3N4 at different magnifications. (c) TEM image of tubular g-C3N4. (d) TEM image of single tube of tubular g-C3N4 (the inset is SAED pattern of tubular g-C3N4). From Ref. [161]. (e) Schematic illustration of the formation of the carbon nitride nanotubes. Reprinted with permission from Ref. [160]. Copyright 2013 and 2012, Royal Society of Chemistry. Fig. 12 Representative TEM images of particles obtained after processing times of 1 h (a), 2 h (b), 3 h (c), 4 h (d), 5 h (e), and 7 h (f). (g) Schematic of the particle formation and development of the hollow structure in the solvothermal process. The chemical conversion caused nonuniform development of tiny grains and empty spaces within the spheres, which enhanced the outward migration and relocation of the core grains toward the outer layer, resulting in the generation and development of a hollow structure. Reprinted with permission from Ref. [174]. Copyright 2016, Elsevier B.V. Fig. 13 TEM images showing the morphological evolution of sSiO2@TiO2 samples after hydrothermal treatment at 140 °C for 0 h (a), 1 h (b), 2 h (c), 5 h (d), 10 h (e), and 24 h (f,g). (h) SEM image of DHS-Ti. (i) SEM image showing a broken double-shelled structure. (j) Schematic illustration of the formation process of double-shelled TiO2 hollow spheres. Reprinted with permission from Ref. [175]. Copyright 2017, Wiley-VCH GmbH. Fig. 14 HRTEM and SAED images of CeO2 hollow structures: (a1,b1) polyhedron. (a2,b2) cube. (a3,b3) sphere. (c) Schematic illustration of the formation of CeO2 hollow structures by template-engaged coordinating etching of Cu2O nanocubes. Reprinted with permission from Ref. [183]. Copyright 2015, Elsevier B.V. Fig. 15 (a) Schematic illustration of the synthetic process of hierarchical Co9S8@ZnIn2S4 heterostructured cage: (I) sulfidation reaction and thermal treatment in argon atmosphere and (II) growth of ZnIn2S4 nanosheets (NSs). (b) TEM images of Co9S8@ ZnIn2S4 cages, (c) Photocatalytic H2 evolution performance of different samples. (d) EIS spectra of Co9S8@ZnIn2S4. Reprinted with permission from Ref. [200]. Copyright 2018, American Chemical Society. Fig. 16 TEM images of CoS x (a), Co9S8 (b), and 10Co9S8/ZCS (c). (d) Photocatalytic H2 activity of different samples under visible-light irradiation. ESR spectra of h+ (e) and e− (f) signal of Zn0.5Cd0.5S and 10Co9S8/ZCS photocatalysts at different irradiation times at room temperature. (g) Work functions of Zn0.5Cd0.5S and Co9S8 samples. (h) Proposed mechanism of photocatalytic hydrogen process over Co9S8/ZCS composite. Reprinted with permission from Ref. [201]. Copyright 2020, Elsevier B.V. Fig. 17 SEM (a) and TEM (b,c) images of the prepared 10%-Co9S8/ZnIn2S4 composite. (d) Schematic illustration of the fabrication process of hierarchical Co9S8/ZnIn2S4 tubular photocatalyst. (e) Amounts of H2 generated from the prepared samples in 5 h under visible-light irradiation. (f) Photocatalytic reduction of aqueous Cr(VI) by as-prepared samples under visible-light irradiation. (g) Schematic illustration of the transfer process of the photogenerated electrons and holes in the Co9S8/ZnIn2S4 heterostructure, and the photocatalytic mechanism for Cr(VI) reduction and H2 evolution under visible-light irradiation. Reprinted with permission from Ref. [202]. Copyright 2020,Wiley-VCH GmbH. Fig. 18 (a) The schematic illustration for the fabrication of CoS x /g-C3N4 composites. TEM images of hollow CoS x polyhedrons (b) and 2%CoS x /g-C3N4 composite (c). (d) Photocatalytic H2 generation rate of g-C3N4 and CoS x /g-C3N4 composites with different CoS x contents (1% to 10%) under visible-light (λ ≥ 400 nm) irradiation. Electrostatic potentials of the monolayer g-C3N4 surface (e) and the CoS (001) surface (f). (g) The 3D charge density difference for CoS/g-C3N4 composite model. The isosurface value is 0.0004 e/Å3. The yellow and cyan regions represent charge accumulation and depletion, respectively. (h) The possible mechanism for the photocatalytic H2 evolution over the CoS x /g-C3N4 composite photocatalyst. (i) The schemes of light path and photothermal effect in the hollow CoS x polyhedron. Reprinted with permission from Ref. [203]. Copyright 2018, American Chemical Society. Fig. 19 Electrostatic potentials for monolayer g-C3N4 (a) and CoNiS x (b). (c) Charge density difference of CoNiS x -CN model. The yellow regions represent charge accumulation, whereas the cyan regions represent charge depletion. (d) Calculated free-energy diagram of photocatalytic HER for the photocatalysts. Reprinted with permission from Ref. [204]. Copyright 2019, American Chemical Society. Fig. 20 (a) SEM (A, B, D, E, G, H, J and K) and TEM (C, F, I and L) images of MoSe2 nanospheres with different reaction times (M1: 1 h; M2: 6 h; M3: 12 h; M4: 36 h) at 180 °C. (b–d) The photocatalytic mechanism of MoSe2/CdSe heterostructure with different light irradiation wavelengths. Reprinted with permission from Ref. [207]. Copyright 2019, Elsevier B.V. Fig. 21 (a) TEM images of Co/NGC@ZIS cages. (b) Schematic illustration for the synthetic process of hierarchical Co/NGC@ZIS cages. I: growth of ZIF-67 on ZIF-8 particles. II: carbonization in N2 and acid etching. III: growth of ZnIn2S4 NSs. (c) Photocatalytic H2 evolution activities of Co/NGC, Co/NGC@ZIS, ZnIn2S4, and p-Co/NGC@ZIS. (d) H2 production rates of Co/NGC@ZIS with varied compositions, the solid counterparts of Co/NGC@ZIS-S and NGC@ZIS-S, and Co3O4/NGC@ZIS. (e) Illustration of the photocatalytic H2 evolution mechanism on Co/NGC@ZIS under visible-light irradiation. Reprinted with permission from Ref. [210]. Copyright 2019, Wiley-VCH GmbH. Fig. 22 TEM (a), magnified TEM (b,c) and HRTEM (d) images of MHMs. (e) EDS mapping of multi-shelled hollow Cu-CeO2 microspheres. Reprinted with permission from Ref. [213]. Copyright 2019, Elsevier B.V. (f,g) TEM images of Pd@void@Pt@CeO2 core@shell nanospheres. (h,i) TEM images of (Pt-enriched cage)@CeO2 core@shell nanospheres. Reprinted with permission from Ref. [215]. Copyright 2017, Wiley-VCH GmbH. Fig. 23 (a–c) TEM images of CeO2/ZnIn2S4. (d) Rates of photocatalytic dehydrogenation of PhCH2OH for H2 evolution and PhCHO production with different catalysts with a reaction time of 3 h. EPR spectra of DMPO-%O2– (e) and DMPO-%OH (f) over CeO2, ZnIn2S4, and CeO2/ZnIn2S4 under solar exposure. (g) Charge carrier flow mechanisms over Type II and direct Z-scheme heterojunctions for the CeO2/ZnIn2S4 composite. Reprinted with permission from Ref. [218]. Copyright 2020, Elsevier B.V. Fig. 24 (a) Schematic illustration of the synthetic procedures for CdS@ZnIn2S4 hollow cubes (direct Z-scheme heterojunction). FESEM (b) and TEM (c) images. Reprinted with permission from Ref. [221]. Copyright 2021, Elsevier B.V. Fig. 25 (a) TEM image of Pd@CdS/1%PdS. (b) An illustration of the preparation of Pd@CdS/PdS catalyst. (c) Time courses of H2 evolution over Pd@CdS/1%PdS. (d) Proposed charge transfer mechanism of the Pd@CdS/PdS catalyst. Reprinted with permission from Ref. [225]. Copyright 2018, Wiley-VCH GmbH. Fig. 26 (a) TEM image of Au@HCS@PdS. (b) Schematic illustration for the formation of Au@HCS@PdS photocatalyst. (c) The comparison of enhancement of hydrogen production with the optimal amount of cocatalysts. (d,e) Arrhenius plots obtained by fitting the rates of photocatalytic hydrogen and temperature. The apparent activation energies were calculated with the Arrhenius equation. (f) Schematic diagram of photocatalytic H2 evolution mechanism on Au@HCS@PdS composite under visible-light irradiation. Reprinted with permission from Ref. [132]. Copyright 2020, Elsevier B.V. Fig. 27 SEM (a) and TEM (b) images of HCNS/Pt samples. (c) TEM and HRTEM images of Co3O4/HCNS/Pt samples. (d) Time courses of photocatalytic evolution of H2 and O2 using Co3O4/HCNS/Pt (e) and (Co3O4+Pt)/HCNS (f) under UV irradiation (λ > 300 nm). Reprinted with permission from Ref. [155]. Copyright 2016, Wiley-VCH GmbH. Fig. 28 (a) TEM image of Pt/TiO2/CdS/Co3O4 hollow spheres. (b) schematic of the synthesis process of Pt/TiO2/CdS/Co3O4 composite hollow spheres; Illustration of the (c) structure and (d) reaction procedure of double-shelled hollow sphere photocatalyst. Schematic of (e) band structures in TiO2/CdS double-shelled hollow spheres and (f) activity energy reduction on the surface of photocatalyst with Pt and Co3O4 Co-catalyst. Reprinted with permission from Ref. [228]. Copyright 2017, Elsevier B.V. Fig. 29 (a,b) TEM images of CdG2. (c) Photocatalytic CO2 reduction performance of CdS, CdG1, CdG2, CdG3, and CdG5. (d) Schematic illustration of NG/CdS HS preparation process. Reprinted with permission from Ref. [232]. Copyright 2019, Wiley-VCH GmbH. Fig. 30 (a,b) TEM image of Au2.0@THS@CoO. (c) Illustrations of formation process of Au x @THS@CoO. (d) Comparison of the average formation rates of CH4 for THS, THS@CoO, and Au2.0@THS@CoO samples. (e) EPR spectra of Au2.0@THS@CoO in the presence of CO2 and N2 before and after simulated solar light irradiation. (f) In situ FTIR spectra of CO2 and H2O interaction with Au2.0@THS@CoO and THS in the dark and subsequently irradiated for different times. (g) The possible mechanism for photoreduction CO2 over Au x @THS@CoO. Reprinted with permission from Ref. [233]. Copyright 2019, Elsevier B.V. Fig. 31 (a) Schematic illustration of the formation process of NiCo2O4 hollow microspheres composed of nanosheets. TEM images of (b) NiCoG, (c) NiCo-OH and (d) NiCo2O4 hollow spheres. (e) EPR spectra of NiCo2O4 hollow spheres and NiCo2O4 nanoparticles. (f) CO2 adsorption isotherms of NiCo2O4 hollow spheres and NiCo2O4 nanoparticles at 273.15 K. (g) CO and H2 generation from the photocatalyst system under different reaction conditions and the percentages of the CO selectivity of different catalysts. (h) Time courses and stability tests of CO and H2 production over NiCo2O4 hollow spheres. Reprinted with permission from Ref. [235]. Copyright 2019, Elsevier B.V. Fig. 32 (a) TEM image of 120BB. (b,c) In situ FTIR spectra of CO2 and H2O reaction on 120BB. (d) In situ ESR spectra of 120BB in different situations. (e,f) Electron densities of BiOBr and BiOBr (OVs) by DFT calculation. (g) Proposed mechanism of CO2 photoreduction for BiOBr microspheres. Reprinted with permission from Ref. [236]. Copyright 2021, Elsevier B.V. Fig. 33 High-resolution XPS spectra of N 1s (a) and Pt 4f (b). (c) CO2 TPD curves for the HHBs, N-HHBs, and Pt/N-HHBs. (d) Photocatalytic mechanism scheme of Pt1/N0.25-HHBs under simulated sunlight irradiation. Reprinted with permission from Ref. [238]. Copyright 2020, Elsevier B.V. Fig. 34 An overview of hollow materials for energy conversion. Fig. 35 Development of hollow materials architecture. Table 1 The applications of CdS-based hollow structures in photocatalytic reactions. Hollow photocatalyst Morphology Photocatalytic reaction Performance (mmol h−1 g−1) AQY Year/Ref. Hollow CdS H2 evolution 3.14 — 2019 [124] CdS frame- in-cage particles H2 evolution 11.3 3.2% 2020 [136] Double- shelled CdS H2 evolution 250.1 — 2020 [131] Hollow CdS/Ni-Mo-S H2 evolution 838.17 — 2019 [134] Hollow CdS/Co9S8 H2 evolution 1061.3 — 2017 [199] Hollow CdS@g-C3N4 H2 evolution 4.39 3.22%420 nm 2018 [125] CdS@ZnIn2S4 hollow cubes H2 evolution 540.3 1.53% 400 nm 2021 [221] Pd@CdS/PdS H2 evolution 144.8 — 2018 [225] MnO x @CdS/CoP H2 evolution 238.4 μmol h−1(10 mg) — 2017 [226] Au@HCS@ PdS H2 evolution 16.35 41% 420 nm 2020 [132] Pt/TiO2/CdS/Co3O4 H2 evolution 2000 — 2017 [228] NG/CdS CO2 reduction CO (2.59) CH4 (0.33) 0.9% 420 nm 2019 [232] Table 2 The applications of Zn x Cd1–x S or ZnIn2S4-based hollow structures in photocatalytic reactions. Hollow structure Morphology Photocatalytic reaction Performance (mmol h−1 g−1) AQY (%) Year/Ref. Zn x Cd1–x S double-shell hollow nanospheres H2 evolution 4110 — 2018 [148] Hollow ZnCdS H2 evolution 5.68 — 2017 [137] Co9S8/ZCS H2 evolution 10.9 8.96 420 nm 2020 [201] Co9S8/ZCS H2 evolution 9.039 4.49 420 nm 2020 [202] Co9S8@ZnIn2S4 H2 evolution 6.250 — 2018 [200] Co/NGC@ ZnIn2S4 H2 evolution 11.270 5.07420 nm 2019 [210] MoSe2/CdSe H2 evolution O2 evolution 7.1200.348 27.2670 nm 2019 [207] Table 3 The applications of g-C3N4-based hollow structures in photocatalytic reactions. Hollow structure Morphology Photocatalytic reaction Performance AQY (%) Year/Ref. Co3O4/HCNS/Pt H2 evolution O2 evolution 0.3 μmol h−1 0.1 μmol h−1 (20 mg) — 2016 [155] PtNi/g-C3N4 H2 evolution 98.6 μmol h−1 (50 mg) 5.89420 nm 2018 [158] CoS x /g-C3N4 H2 evolution 629 μmol h−1 g−1 — 2018 [203] CoNiS x -CN H2 evolution 2366 μmol h−1 g−1 4.3420 nm 2019 [204] g-C3N4@HG H2 evolution 1.43 mmol h−1 g−1 3.56420 nm 2020 [188] Table 4 The applications of TiO2-based hollow structures in photocatalytic reactions. Hollow structure Morphology Photocatalytic reaction Performance (mmol h−1 g−1) AQY (%) Year/Ref. Co1.62Mo6S8/THS H2 evolution 44.43 4.88 365 nm 2020 [171] TiO2/NiO H2 evolution dye degradation 393 μmol h−1 g−1 88% within 100 min — 2015 [97] NiO/TiO2/C H2 evolution dye degradation 356 μmol h−1 g−1 RhB (94%) within 75 min MB (98%) within 100 min — 2016 [220] RuO2@TiO2@Pt H2 productionPollutant degradation 809 μmol h−1 g−1 RhB (98%); MO (80%) phenol (40%) — 2016 [222] Ag-I-RuO2-O-THS H2 evolution 300.2 μmol (5 h, 80 mg) — 2017 [223] Pt@TiO2@MnO x O2 evolution 31.22 mmol (14 h, 30 mg) 63.14 254 nm 2016 [224] Au x @THS@CoO CO2 reduction CH4 (13.3) — 2019 [233] Table 5 The applications of CeO2-based or other hollow structures in photocatalytic reactions. Hollow structures Morphology Photocatalytic reaction Performance (μmol h−1 g−1) AQY (%) Year/Ref. CeO2/ZnIn2S4 Benzaldehyde evolutionH2 evolution 664.1 1496.6 — 2020 [218] CeO2−x S x @CdS H2 evolution 1147.2 — 2019 [219] g-C3N4@CeO2 CO2 reduction CH4 (3.5 μmol g−1, 4 h)CH3OH (5.2 μmol g−1, 4 h)CO (16.8 μmol g−1, 4 h) 17.1525 nm 2019 [231] ZnO1−x /C CO2 reduction CO (μmol h−1 g−1, 4 h) 0.13 2018 [230] Available online 3 February 2022 This work was supported by National Key R&D Program of China (2019YFC1907602) and the National Natural Science Foundation of China (51572295, 21273285, 21003157). Review Design and applications of hollow-structured nanomaterials for photocatalytic H2 evolution and CO2 reduction Xuli Li a b Ning Li a b Yangqin Gao a b Lei Ge a b * a State Key Laboratory of Heavy Oil Processing, College of New Energy and Materials, China University of Petroleum Beijing, Beijing 102249, China State Key Laboratory of Heavy Oil Processing College of New Energy and Materials China University of Petroleum Beijing Beijing 102249 China State Key Laboratory of Heavy Oil Processing, College of New Energy and Materials, China University of Petroleum Beijing, Beijing 102249, China b Department of Materials Science and Engineering, College of New Energy and Materials, China University of Petroleum Beijing, Beijing 102249, China Department of Materials Science and Engineering College of New Energy and Materials China University of Petroleum Beijing Beijing 102249 China Department of Materials Science and Engineering, College of New Energy and Materials, China University of Petroleum Beijing, Beijing 102249, China * Corresponding author. Tel/Fax: +86-10-89739096 Tel/Fax: +86-10-89739096 Photocatalysis is considered a prospective way to alleviate the energy crisis and environmental pollution. It is therefore extremely important to design highly efficient photocatalysts for catalytic systems. In recent years, hollow-structured materials have attracted considerable interest for application in energy conversion fields owing to their large specific surface areas, improved light absorption, and shortened charge carrier transfer path. Because they contain inner and outer surfaces, hollow-structured materials can provide a superior platform for the deposition of other components. A number of hollow-structured hierarchical systems have been designed and fabricated in recent decades. It is important to rationally design and construct complex hierarchical structures. In this review, general preparation approaches for hollow-structured materials are presented, followed by a summary of the recent synthesis methods and mechanisms of typical hollow-structured materials for applications in the photocatalytic field. Complex hollow-structured hierarchical photocatalysts are classified into two types, hollow cocatalyst-based and hollow host photocatalyst-based, and the design principle and analysis of the photocatalytic reaction mechanism for photocatalytic H2 evolution and CO2 reduction are also introduced. The effects of hollow-structured materials have also been investigated. This review provides a reference for the rational construction of advanced, highly efficient photocatalytic materials. Graphical abstract The synthesis approaches and design principles of hollow-structured hierarchical photocatalysts are summarized. The photocatalytic mechanism analysis of photocatalytic H2 evolution and CO2 reduction is also presented to provide a reference for the rational design and investigation of highly efficient photocatalysts. Keywords Hollow structure Photocatalysis H2 evolution CO2 reduction Design principle 1 Introduction With the rapid growth of the global economy, increasing energy and environmental problems have appeared, such as energy shortages, global warming, and air contamination. It has been reported that reducing energy demand is a key mechanism for alleviating climate change, but such a reduction is not practical for economic growth, especially in lower-income areas [1–4]. Photocatalytic technology, including water pyrolysis, CO2 photoreduction, N2 conversion, and the degradation of pollutants, has attracted significant attention, especially photocatalytic water splitting driven by solar energy and photocatalytic CO2 reduction to obtain useful chemical products, both of which can convert solar energy into storable and transportable chemical energy [5,6]. Influenced by the work of the Fujishima-Honda pioneers in 1972 [7], a variety of semiconductor-based photocatalysts have been developed, including metal oxides (CeO2 [8–11], TiO2 [12–15], ZnO [16–21], perovskite oxide photocatalysts [22–25]), transition metal sulfides (CdS [26–29], Zn x Cd1–x S [30–33], ZnIn2S4 [34–36], Mn x Cd1–x S [37–39]), and nitrides (g-C3N4 [40–44], TiN [45,46]). However, pristine photocatalysts suffer from low energy conversion efficiency and weak stability, especially sulfides such as CdS and Zn x Cd1–x S, which can be ascribed to the fact that S2– is easily oxidized by the photogenerated holes in the valence band. Generally, the inferior activity is caused by the following factors: (1) insufficient light absorption, (2) the high recombination rate of photogenerated electron-hole pairs, and (3) sluggish surface reaction kinetics. A variety of strategies have been reported to promote the photocatalytic performance of semiconductor materials, such as morphology control, element doping, construction of junctions, and decoration of cocatalysts [47–53]. It is well known that performance is closely related to the structures of substances. Hollow-structured materials consist of inner cavities and well-defined boundary functional shells [54]. Their unique structures endow the materials with properties of low mass density, large reaction surface areas, and reduced charge transfer paths, which make them potential candidates in the catalysis and energy conversion fields. Nowadays, hollow nanostructures play a critical role in the structural control of materials [55–57], exhibiting the following advantages in the photocatalysis process (Fig. 1 ): (1) light can be multi-reflected in the inner cavities, which contributes to good light harvesting and utilization efficiency; (2) the large surface area can not only ensure sufficient contact between the photocatalysts and substrates but also supply additional reactive sites to participate in reactions; (3) compared to solid materials, the shells with their short charge carrier transfer paths are more beneficial for the fast separation of photoexcited electrons-holes, thereby inhibiting charge carrier recombination; and (4) the inner and outer surfaces can ensure reactions in spatially separate regions to accelerate the surface reaction kinetics and restrain the back recombination reaction [58]. Materials with hollow structures possess inner and outer double surfaces, which can provide an excellent platform for the deposition of other components. Therefore, hollow hierarchical photocatalysts have been developed through the construction of heterojunctions or loaded with cocatalysts to further enhance their catalytic activity. Heterojunction modification is a powerful approach to promote the separation and migration of electrons and holes by the arrangement of the energy levels of different semiconductors. Depending on the type of semiconductor, heterojunctions can be divided into p-n heterojunctions and Schottky junctions (metal-semiconductor contacts). The heterojunction is constructed according to the energy band matching, which can be classified as Type I, Type II, S-scheme, and Z-scheme heterojunctions [59–61]. Loading cocatalysts has proven to be an effective way to promote the photocatalytic performance of hollow structures [62,63]. The most common cocatalysts in photocatalysis include metals [40,44], alloys [64–68], transition metal phosphates [69–71], transition metal oxides [72–76], and hydroxides [77–79]. In general, metal or metalloid cocatalysts can improve the charge carrier separation and transfer efficiency owing to their lower work function or the construction of Schottky barriers. In our previous research, it was found that AuPd alloys and PtCo alloys possess higher electron capture capability and can stimulate electron transfer from g-C3N4 to the surfaces of alloy cocatalysts owing to their lower Fermi level [80,81]. Moreover, Xiao and co-workers [82] reported that PtPd alloy nanoparticles (NPs) can act as electron traps and provide reduction sites for photocatalytic hydrogen production. Transition metal phosphides (TMPs), including Ni2P, CoP, and MoP, have demonstrated metallic characteristics with lower overpotential for H2 evolution and fast electron transfer ability [83–89]. Analogously, when TMPs are combined with semiconductor-based photocatalysts, the photogenerated electrons tend to transfer to the TMs owing to the different Fermi levels [90]. Du et al. [91] found that MoP exhibited a flat plot in the UV-vis wavelength range, and the valence-band XPS spectrum commonly verified its metallic character. Moreover, the H2 generation rate of CdS increased after decorating it with MoP because of the efficient charge carrier separation and fast reaction kinetics. Cao and co-workers [92] successfully fabricated a metal-phosphide/CdS system, which exhibited superior photocatalytic H2 evolution activity using CoP, NiP, and Cu3P as cocatalysts. Metal-free cocatalysts with relatively narrow band gaps can form heterojunctions with semiconductors through energy band matching or differences in semiconductor types to promote the separation of photogenerated charge carriers [93,94]. For example, Yuan and co-workers [95] fabricated a p-n-type Co3O4/CdS heterojunction by a two-step solvothermal/hydrothermal method. The electron-hole separation of CdS was improved owing to the formation of a p-n junction, resulting in enhanced photocatalytic H2 activity and stability. The photocatalytic activity of TiO2 can also be significantly improved by coupling it with p-type Co3O4 or NiO [96,97]. Based on approaches for constructing complex hollow-structured materials, they can be summarized into two categories: (1) hollow photocatalyst-based materials, such as hollow heterojunction hybrids, hollow photocatalysts decorated with single or double cocatalysts, and hollow hybrids simultaneously decorated with reduction or oxidation cocatalysts on the inner and outer surfaces according to the direction of electron flow; and (2) hollow cocatalyst-based materials, including hollow cocatalysts incorporating other types of photocatalysts in a certain order. Herein, the synthesis strategies of hollow structures are summarized and divided into three categories: hard-templating, soft-templating, and self-templating methods. Although there are some reports on hollow structures, they mainly apply to the use of hollow materials in other fields such as electrocatalysis and supercapacitors. Moreover, many hollow-structured photocatalysts have been developed in recent years. Highly efficient photocatalysts play an important role in the photocatalytic field. However, there are few references regarding the application of hollow-structured materials to photocatalytic H2 and CO2 reduction from the aspects of synthesis approaches and mechanism investigation. Therefore, we summarize recent preparation approaches and synthesis mechanisms of typical single and complex hollow-structured photocatalysts to guide the design of high-performance catalytic materials. Moreover, it has been concluded the photocatalytic mechanism of complex hollow photocatalysts, including the characterization techniques and microstructure analysis methods, to reveal the enhanced photocatalytic activity. 2 Synthesis strategies of hollow-structured materials The synthesis approaches of hollow-structured materials have been rapidly developed since Caruso and co-workers fabricated hollow inorganic silica and inorganic-hybrid spheres in 1998 [98]. The synthesis strategies of hollow-structured materials can be divided into three categories: (1) the hard-template approach, (2) the soft-template approach, and (3) the self-template approach. In this section, we summarize these three strategies in combination with past classic cases and supplement the discussion with reports of hollow-structured materials in the last two years. This review provides a reference for the design of hollow architecture materials used in the photocatalytic field. 2.1 Hard-template method The hard-template method is generally deemed a straightforward way to construct hollow materials [99]. The process of preparing hollow objects is shown in Fig. 2(a) : (1) Selecting and preparing a suitable hard template as the core material, (2) covering the targeted shells on the hard template, and (3) removing the hard template with an appropriate method to obtain hollow structures. Sometimes, it is necessary to adjust the chemical compatibility by functionalizing the surface of the hard template. The final morphology of the material is strongly dependent on the hard-template shape. Therefore, it is important to choose an appropriate object to act as the template. Moreover, the core materials are mainly based on the inert rigid material. For example, hollow spherical materials commonly use colloidal SiO2 and polymer latex colloids as templates because of their tunable size, chemical stability, and simplicity of synthesis (Fig. 2(b)). The preparation of SiO2 is commonly based on the well-known Stöber process, which results in controlled hydrolysis and condensation [100], and polystyrene (PS) NPs can be synthesized by emulsifier-free emulsion polymerization. The formation of nonspherical hollow materials by the hard-templating method is difficult because of the absence of suitable nonspherical templates [101]. Here, we review several common conceptual strategies for covering shells on a hard template. There are various covering approaches to growing exterior shells, including layer-by-layer (LBL), direct chemical deposition, and nanocasting [102]. The LBL method is based on the fact that charged materials with opposite charges are consecutively adsorbed onto flat substrates by electrostatic attraction [103]. Caruso et al. [98] extended the methodology to prepare composite SiO2 nanoparticle-polymer multilayers on colloids, producing hollow-structured materials through selective removal of the core, providing new insight into the fabrication of inorganic and inorganic-hybrid hollow spheres. Direct chemical deposition refers to the direct deposition of the precursors of shell materials onto a hard template to form core-shell nanomaterials via chemical or physical interactions. Sometimes, thermal treatments are carried out to maintain a more intensive relationship between the core and shell. The final process is to remove the hard template to form the hollow structure. The removal of the hard template should be carried out using a suitable strategy such as chemical etching or calcination. However, for the same material, different removal methods likely influence the properties. It is worth mentioning that this method effectively prevents the collapse of the shells after template removal. In conclusion, the hard-template method is the simplest among the three common strategies in concept, is easy to scale up, and has wide applicability [104]. However, there are still some problems that need to be addressed, such as incompatibility issues between the core and shell materials, the energy consumption during template removal, the collapse of the hollow structures, and the absence of a variety of hollow structures [105,106]. 2.2 Soft-template method Soft templates, which mainly consist of polymer vesicles, emulsions, vesicles, polymer micelles, and gas bubbles, are another method used to fabricate hollow materials. Emulsions generally comprise a multiphase system in which an isolated liquid phase is dispersed in a continuous liquid phase; the formed liquid interface is then used as a soft template to fabricate hollow materials [107,108]. These soft templates are easily influenced by the synthesis parameters, including pH, temperature, and solvent. Therefore, it is important to precisely control certain reaction conditions to synthesize the hollow structures. Compared with hard templates, the removal of soft templates is milder. Washing with suitable solvents or evaporation can remove the soft templates, which protects the hollow morphology [101]. The formation mechanism of hollow materials is closely related to the template categories. In this section, we summarize several common approaches to using soft templates to build hollow structures, including emulsion-based, micelle/vesicle-based, and gas bubble-based template methods. 2.3 Self-template method Both methods mentioned above require the introduction of templates during the synthesis process. In contrast to template-assisted approaches, in the self-template process, the target materials are derived from template precursors. Therefore, the self-templating method is a relatively simple procedure with high reproducibility [109]. Self-templating synthetic procedures can be classified into two steps: (1) preparation of the template and (2) transformation of the synthetic template into hollow structures. The formation mechanism of the hollow materials is closely related to the template categories. In the following sections, we summarize several common approaches using self-templates to build hollow structures, including controlled etching, diffusion-regrowth, and heterogenous contraction. 2.3.1 Controlled etching In controlled etching, a specific solvent is chosen to dissolve the inner materials instead of the outer shells, resulting in hollow cavities. In contrast to hard templates, the core and shell are the same material. It is necessary to coat the template with a protective layer in the case of outer shell etching. For example, Hu and co-workers developed a novel strategy to fabricate hollow Prussian blue (PB) with PVP as the protective coating during a controlled chemical etching process (Figs. 3(a)–(d) ). The inner cavity was created by treating the material with HCl solution while retaining the original PB mesocrystals in the presence of PVP [110]. Interestingly, an extra precoating process is not needed if the materials have intrinsic inhomogeneity within the internal sections or they can grow an in situ passivation layer [111]. For instance, Lou et al. [112] explored the formation process of Ni-Fe-mixed diselenide nanocages. Solid Ni-Fe PBA nanocubes were used as self-templates, and hollow nanocages were obtained by treating with ammonia solution. They also found that the etching solvent and time were critical in the reaction process. 2.3.2 Diffusion-regrowth Diffusion-regrowth refers to the central mass diffusing toward the outer region while the outer mass diffuses toward the inner region, each at different diffusion rates, thereby producing hollow structures. As illustrated in Fig. 4 , the formation of hollow NiCo2S4 ball-in-ball spheres is divided into three stages. In the solvothermal reaction process, NiCo-glycerate solid spheres are used as both precursors and metal sources. Thioacetamide (TAA) releases S2– ions to form sulfides. First, a NiCo-glycerate@NiCo2S4 core-shell structure is formed by an anion exchange reaction. Then, the inner metal ions diffuse outward while the outer S2– ions diffuse inward and form a secondary NiCo2S4 shell. In the last stage, a unique hollow structure is obtained upon completion of the anion exchange reaction [113]. 2.3.3 Heterogenous contraction Another formation mechanism of hollow structures is as heterogeneous contraction, which mainly results from nonequilibrium heat treatment. During the annealing treatment process, the organic species is converted into other substances or gases, resulting in weight loss. At the same time, there are two opposing forces acting in opposite directions: a contraction force (F c) and an adhesion force (F a) [114]. Owing to the different directions and sizes of the two forces, a cavity forms during the heat treatment. As shown in Fig. 5 , when heating the core-shell ZIF-8@ZIF-67 crystals, ZIF-8 and ZIF-67 were converted into ZnO/carbon and CoO/carbon, respectively, at the first stage, and small molecules were released at the same time. The adhesion and contraction forces were generated from the rigid CoO/carbon shells and the ZIF-8 cores, respectively. Moreover, the adhesion force assumed a contraction force. To balance the mass loss, hollow cavities were formed in the inner cores. At 700–800 °C, CoO was reduced to metallic Co and nanosized Zn was evaporated, resulting in hollow double-shelled NC@Co-NGC nanocages. The hollow structure accelerated the reaction kinetics, resulting in superior electrocatalytic activity. 3 Synthetic methods of typical single-component hollow photocatalysts There is a close relationship between photocatalytic activity and microstructure, and hollow-structured photocatalysts in particular show great merit. Various methods have been developed to fabricate hollow photocatalysts. In this section, we provide a systematic review of the synthesis pathways of several typical hollow photocatalysts, including CdS, Zn x Cd1–x S, C3N4, TiO2, and CeO2. Moreover, several classical mechanisms of hollow structure formation have been proposed. Finally, we summarize recent reports on related materials and conclude with perspectives on the future trends and the development of advanced hollow materials. 3.1 Hollow CdS Cadmium sulfide (CdS) is considered a significant photocatalytic material owing to its superior characteristics such as an appropriate band gap for visible-light absorption and a suitable conduction band edge potential for photocatalytic reduction reactions [116–119]. However, the photocatalytic activity of pristine CdS is restricted by rapid charge carrier recombination and severe photocorrosion [120–122]. Tremendous efforts have been made to solve this problem over the years. A summary of CdS-based hollow structures is presented in Table 1 . It has been reported that the properties of photocatalysts are closely associated with their morphological features [123]. In particular, hollow-structured CdS has been widely investigated because of its larger surface area, which increases the number of active sites, its light multi-scattering within the interior cavity, which improves the light utilization efficiency, and its shorter charge carrier transport length, which suppresses charge recombination [124–126]. It is well known that hollow CdS can be fabricated by various approaches involving soft-, hard-, or self-template methods. In a previous report, soft-template assisting was applied to synthesize hollow CdS [127–129]. Luo et al. [130] prepared hollow CdS nanospheres using a gas bubble template method. Liu et al. synthesized double-shelled CdS hollow microspheres using a soft-template method, and glycerol-isopropanol emulsion microdroplets were used as the template to form Cd-glycerol precursors, which were subsequently transformed into CdS by reacting with S2– released from TAA. Moreover, single-shelled CdS can be obtained by controlling the reaction time owing to the Ostwald ripening effect [131]. In our previous study, hollow CdS nanospheres [132] were synthesized via a chemical precipitation method using SiO2 as the template to form a SiO2@CdS core-shell structure. Finally, the template was removed using a NaOH solution. In another work, Wang et al. [133] synthesized PS@CdS nanospheres using polystyrene (PS) NPs as templates by a sonochemical process, and the template was removed by etching and calcination (Fig. 6 ). Furthermore, the authors carried out a comparative study on hollow CdS obtained using two different template removal methods. It can be concluded that the template removal method affects the surface micromorphology and crystal structure, resulting in different photocatalytic performances of hollow CdS. Recently, hollow CdS nanostructures fabricated by a self-template approach have attracted considerable attention as this method can effectively avoid intricate template removal procedures. Li et al. [134] applied CdCO3 as a self-template, and cubic CdS/CdCO3 was synthesized by surface vulcanization. Hollow-structured CdS can be prepared by thorough vulcanization. Li and co-workers [135] also prepared hollow CdS nanoboxes by directly sulfurizing Cd-MOF-47 with thiourea based on hydrothermal treatment. As shown in Fig. 7 , S2– ions, which were released from the Cd-MOF, initially reacted with Cd2+ on the surface of the Cd-MOF, resulting in the formation of an outer CdS shell. After 4 h of reaction, the inner Cd2+ gradually dissolved and formed hollow voids. Lou et al. [136] presented a two-step sulfidation approach to fabricate CdS frame-in-cage particles, which used Cd-based Prussian blue analog (Cd-PBA) cubes as the self-template. As shown in Fig. 8 , they first synthesized solid Cd-PBA cubes. It can be seen that the CdS-PBA cubes were partly converted into CdS particles through the sulfidation reaction. In the sulfidation process, the surface of Cd-PBA was covered by PVP. Therefore, Cd2+ first reacted with S2– released from TAA, forming the structure of the Cd-PBA cube-in-CdS particle structure. Finally, CdS frame-in-cage particles with convex surfaces were transformed by a secondary sulfidation reaction. In the second sulfidation process, the internal CdS-PBA was converted into CdS particles, and the diffused ions reacted at the surfaces of the CdS cages, which increased the thickness of the shells and resulted in the CdS frame-in-cage particle structure. Moreover, the photocatalytic H2 evolution of CdS frame-in-cage particles was 13.6 mmol h−1 g−1, which surpassed that of CdS cubes (9.5 mmol h−1 g−1) and CdS cages (11.3 mmol h−1 g−1). These results indicate that the hollow structure is beneficial for hydrogen evolution. 3.2 Hollow ZnxCd1–xS Zn x Cd1–x S, a solid solution of ZnS and CdS, has drawn increasing attention in recent years because of its tunable band gap structure and suitable band edge potential [137,138]. Compared with CdS, the addition of Zn effectively reduces the usage of toxic Cd. Moreover, the photocatalytic H2 evolution performance can be improved by adjusting the value of x [139–143]. However, the development of the Zn x Cd1–x S component is limited by serious charge carrier recombination, resulting in poor photocatalytic performance [144–147]. An effective strategy to improve the photocatalytic performance is to tune the morphology and microstructure of Zn x Cd1–x S. Because hollow-structured materials have the advantages of large surface areas, an increased number of active sites, and short charge carrier transport paths, some investigations on hollow Zn x Cd1–x S have been reported. Li et al. [137] fabricated Zn1–x Cd x S dodecahedral cages via a simple sulfurization and cation-exchange process (Fig. 9 ). In this study, a zeolitic-imidazolate-framework-8 (ZIF-8) MOF and TAA were used as the Zn and sulfur sources, respectively. Hollow ZnS was obtained when S2– was released from the TAA and reacted with Zn-MOF. Because the solubility product constant of CdS is smaller than that of ZnS, hollow Zn1–x Cd x S cages can be fabricated through the ion exchange method, and the Zn/Cd ratio can be controlled by changing the amount of Cd added. As shown in Fig. 10 , Zhang et al. [148] presented a novel strategy to synthesize double-shell hollow-structured Zn x Cd1–x S via a hydrothermal method using hierarchically porous ZnS nanospheres as the template. In the formation process, the double-shell structure resulted from the solution-crystallization process, and the inner voids between the double shells could be controlled by adjusting the amount of Cd(Ac)2. We summarize the hollow ternary sulfide-based hollow structures for use as photocatalysis in Table 2 . 3.3 Hollow g-C3N4 Graphitic carbon nitride (g-C3N4) is a promising metal-free photocatalyst owing to the merits of extraordinary thermal stability, unique electronic structure, and low cost [149–151]. However, its practical application is limited by poor visible-light harvesting and fast photoinduced electron/hole recombination [152,153]. Therefore, it is important to find an effective strategy to improve the photocatalytic performance; constructing hollow structures has been certificated to be a feasible way to address these problems [154,155]. Hollow g-C3N4-based structures are summarized at Table 3 . Sun et al. [156] successfully constructed hollow C3N4 nanospheres by a thermal condensation method using SiO2 spheres as the hard template, which was subsequently removed by NH4HF2. In that work, the main use of hollow C3N4 nanospheres was to provide a large platform to decorate other catalysts, thus avoiding self-aggregation. Some studies focused on the construction of tubular C3N4 owing to its hollow and one-dimensional (1D) structure, endowing it with great potential in terms of oriented electron transfer [157]. For example, Huang [158] synthesized C3N4 with a tubular structure by thermal condensation using urea and thiourea as precursors. Wang et al. [159] also reported tubular g-C3N4 by directly heating a protonated melamine precursor. As displayed in Fig. 11 , Gao et al. [160] synthesized millimeter-long nanotubular g-C3N4 and proposed a possible rolling-up mechanism to explain the nanotubular forming process (Fig. 11(e)). Tahir et al. [161] proposed a facile approach to fabricating tubular C3N4 (Figs. 11(a)–(d)). The white powder was annealed after treating melamine with HNO3 in the presence of ethylene glycol. The formation of tubular C3N4 could be ascribed to the breakage of electrically neutral melamine and the existence of ethylene glycol to force polymerization. 3.4 Hollow TiO2 Titanium dioxide (TiO2) exhibits great potential in the field of photocatalysis owing to its environmental friendliness, chemical stability, and competitive production cost [162–164]. Previous reports have indicated that the structural features, covering surface area, particle size, and morphology are highly dependent on the superior physical and chemical properties, thus influencing the photocatalytic performance [165–169]. Table 4 summarizes the applications of TiO2-based hollow materials. Because of the superiority of hollow TiO2, with its large surface area, enhanced light absorption, low density, and good cavity structure, increasing attention has been focused on the construction of hollow-structured TiO2 [170]. Yue et al. [171] successfully synthesized hollow TiO2 using a simple hydrothermal method. Hollow TiO2 spheres were also obtained by a hard-template method using SiO2 as the template, which was finally etched by HF, and the TiO2 shell was formed through a kinetics-controlled coating method [172,173]. Kim et al. [174] reported a one-pot solvothermal approach to synthesize hollow TiO2 nanospheres. The evolution of hollow TiO2 was observed by exploring the change in morphology and structure based on materials with different processing times (Figs. 12(a)–(f) ). It has been demonstrated that the mechanism of hollow-structured formation mainly involves chemical conversion and Ostwald ripening. The chemical conversion mainly included the water generated from the etherifying reaction of ethanol, Ti(OH)4 obtained from the Ti precursor, and the dehydrolysis of Ti(OH)4. The chemical conversion was accompanied by Ostwald ripening, resulting in the formation of hollow TiO2. A schematic of the hollow TiO2 formation is shown in Fig. 12(g). Zhang et al. [175] developed a novel strategy to construct double-shell TiO2 hollow nanospheres, and the fabrication mechanism is demonstrated in this work. First, sSiO2@TiO2 was formed when TiO2 NSs were deposited onto solid SiO2 (sSiO2) (Fig. 13 ). Double-shelled hollow TiO2 (DHS-Ti) was successfully constructed owing to the re-deposition of silica species under the conditions of appropriate pH, temperature, and CTAB. Moreover, DHS-Ti showed a large surface area of 417.6 m2 g−1, which is higher than that of most pristine TiO2. 3.5 Hollow CeO2 materials Cerium oxide (CeO2) with a fluorite structure, one of the most popular rare and low-toxicity earth oxides, has shown great potential in energy conversion and photocatalysis owing to its attractive properties including relatively low cost, high chemical stability, and unique physical properties [176–179]. Notably, CeO2 possesses a unique 4f electronic structure [Xe] 4f 15d 16s 2 and can achieve facile conversion between Ce3+ and Ce4+ oxidation states, which is beneficial for generating strong connections with other materials [180]. Moreover, the rich oxygen defects and exceptional redox properties play a significant role in the surface adsorption of reactants and electron transfer, further promoting the photocatalytic performance. Despite the above merits, pure CeO2 still presents the disadvantages of a small specific surface area and narrow visible-light adsorption, resulting in low catalytic activity. The construction of hollow-structured materials is an effective way to address these problems. In Table 5 , we summarize the CeO2 based hollow structures and other types of hollow materials for photocatalytic applications. Chen et al. [181] fabricated hollow K-type CeO2 nanotubes via a reaction between solid Ce(OH)CO3 nanorods and a NaOH solution. The interior spaces of the K-Type CeO2 nanotubes were composed of segmented voids, whereas T-types were generated through hollowing. Owing to the similar morphologies of T-type and K-type CeO2 nanotubes, the formation mechanism of the K-type can be explored and ascribed to the Kirkendall effect by comparing the T-type and K-type synthesis processes. Hollow CeO2 nanospheres have also been synthesized by a self-templating approach; solid CeO2 nanospheres as the self-template were first synthesized and an FeSO4 solution acted as the etching agent [182]. In our group [183], we fabricated CeO2 hollow structures with a controllable morphology by a templating approach using shape-controlled Cu2O as the template. Cu2O templates with polyhedral, cubic, and spherical shapes were synthesized (Figs. 14(a,b) ). Cu+ as the soft acid is prone to react with soft bases S2O3 2– to form soluble [Cu(S2O3 2–) x ]2– 2x species. Simultaneously, OH− can react with Ce4+ to produce a Ce(OH)4 precipitate. Finally, hollow CeO2 with cubic polyhedral, cubic, and spherical particles was obtained by calcination of the as-prepared Ce(OH)4 samples (Fig. 14(c)). It should be noted that the concentration of CeCl3 must be precisely controlled in the system; otherwise, excessive water or ethanol will induce breakage of hollow nanocages. 4 The fabrication and mechanism investigation of complex hollow heterostructures in photocatalytic hydrogen generation 4.1 Hollow noble metal-free cocatalyst-based heterojunctions for photocatalysis To date, a variety of semiconductors have been developed. However, single photocatalysts still suffer from unsatisfactory photocatalytic performance, which mainly results from the severe recombination of photogenerated charge carriers and sluggish surface reaction kinetics. Loading suitable cocatalysts and constructing heterojunctions has been considered an effective way to reduce the reaction energy barriers and promote photocatalytic H2 evolution. Noble metals or alloys commonly work as cocatalysts [184–192]. However, the high cost and scarcity of noble metals restrict their widespread application. Therefore, the search for efficient non-noble metal cocatalysts has been a hot topic of research in this field. Recently, hollow-structured transition metal-based cocatalysts have attracted immense attention because they integrate the advantages of hollow structures and unique characteristics of transition metal-based materials. The general design strategy involves the growth of suitable semiconductor-based photocatalysts on hollow-structured transition metal-based cocatalysts. Co-based metal chalcogenides with unique optical and electrical characteristics have been used as cocatalysts in photocatalytic water splitting driven by solar energy [193–198]. For instance, CdS dots were embedded in hollow Co9S8 cubes using a one-pot hydrothermal strategy. Compared with pure CdS, the H2 production rate of hollow CdS/Co9S8 cubes improved to 1061.3 μmol h−1 g−1, which was 1.8 times that of solid CdS/Co9S8 [199]. As shown in Fig. 15 , Lou et al. [200] designed Co9S8/ZnIn2S4 heterostructured cages for photocatalytic hydrogen evolution. Fig. 15(a) shows the synthesis of the hollow Co9S8 nanocages. The authors used zeolitic-imidazolate- framework-67 (ZIF-67) as the precursor, followed by a sulfidation reaction and thermal treatment to produce Co9S8 cages. Finally, ultrathin ZnIn2S4 NSs were grown on the Co9S8 cages through a solvothermal process (Fig. 15(b)). The hollow Co9S8@ZnIn2S4 sample achieved outstanding photocatalytic H2 evolution activity (6250 μmol h−1 g−1), which can be ascribed to the unique hollow heterostructures, which promoted efficient charge separation and transfer. A control experiment using solid Co9S8@ZnIn2S4 NPs as the photocatalyst was carried out to demonstrate the advantage of using hollow structures for the hydrogen evolution reaction, and the results demonstrated inferior photocatalytic activity (Fig. 15(c)). Electrochemical impedance spectra showed that the Co9S8/ZnIn2S4 hybrid possessed a smaller semicircle than ZnIn2S4, indicating that the addition of Co9S8 can accelerate electron transfer (Fig. 15(d)). In our group [200], a Co9S8 hollow polyhedron sample was fabricated by combining the approaches of self-template and calcination (Figs. 16(a) and (b) ). Subsequently, Zn0.5Cd0.5S nanospheres were deposited on the surfaces of the hollow Co9S8 cocatalysts, which effectively avoided self-aggregation of the Zn0.5Cd0.5S nanospheres (Fig. 16(c)). Co9S8/Zn0.5Cd0.5S exhibited a remarkable H2 evolution rate of 10.9 mmol h−1 g−1 (Fig. 16(d)). Electron spin resonance (ESR) analysis was used to investigate the role of the cocatalyst. As shown in Figs. 16(e) and (f), compared with pristine Zn0.5Cd0.5S, the intensity of the ESR signal peaks decreased with the addition of the Co9S8/Zn0.5Cd0.5S hybrid, which indicated that the photogenerated electrons or holes could be captured by the cocatalysts. As shown in Fig. 16(g), Zn0.5Cd0.5S showed a positive photovoltage, which indicated that the positive charges were transferred to the surfaces of the photocatalysts. After decorating with Co9S8, the surface photovoltage spectroscopy (SPV) signal decreased, which can be ascribed to the positive holes of Zn0.5Cd0.5S on the valence band (VB) were trapped by Co9S8 and not to the upper electrode. The surface work function data were determined according to scanning Kelvin probe microscopy. As shown in Fig. 16(h), the Fermi level of Co9S8 was obviously lower than that of Zn0.5Cd0.5S, and the hot electrons of Zn0.5Cd0.5S transferred to Co9S8 until the Fermi level alignment. Meanwhile, an interfacial built-in electric field was established oriented from Zn0.5Cd0.5S to the Co9S8 species. Under visible-light irradiation, the photogenerated holes of Zn0.5Cd0.5S migrated to Co9S8 and were consumed by the sacrificial agent, effectively promoting photoexcited charge carrier separation. Meanwhile, self-oxidization of Zn0.5Cd0.5S was avoided, and the stability was exaggerated. In a similar study, Zhang and co-workers [202] reported hollow Co9S8/ZnIn2S4 tubes (Figs. 17(a)–(c) ). In contrast to Lou’s strategy, the authors selected Co(CO3)0.35Cl0.20(OH)1.10 nanorod bunches as the precursors to prepare 1D Co9S8 hollow nanotubes (Fig. 17(d)). Analogously, 2D ZnIn2S4 NSs were anchored on the surfaces of the hollow Co9S8 nanotubes, and the composite sample was used for visible-light hydrogen production and reduction of aqueous Cr(VI). The hollow structure can enhance light harvesting and mass transfer, which is beneficial for photocatalytic reactions compared to solid heterojunctions. Moreover, hollow Co9S8/ZnIn2S4 possesses a larger surface area compared to pristine ZnIn2S4, which could provide more active sites for H2 evolution. The hollow nanostructured sample presented an excellent H2 evolution rate of 9039 μmol h−1 g−1 and outstanding reduction activity of aqueous Cr(VI), surpassing that of pure ZnIn2S4 (Figs. 17(e,f)). The results demonstrated that enhanced photocatalytic hydrogen performance can be ascribed to suitable energy level matching, improved light absorption, and efficient separation of photogenerated electron-hole pairs (Fig. 17(g)). Yu et al. [202] proposed a new synthetic strategy for hollow CoS x /g-C3N4 nanocomposites, as illustrated in Fig. 18 . ZIF-67 and thioacetamide were dispersed in a g-C3N4 ethanol suspension and then transferred to a Teflon-lined stainless-steel autoclave at 120 °C for 5 h. In the synthesis process, the opposite zeta potentials of ZIF-67 and g-C3N4 ensured intimate contact via electrostatic attraction (Fig. 18(a)). Meanwhile, ZIF-67 was transformed into hollow CoS x , resulting in a CoS x /g-C3N4 composite (Figs. 18(b,c)). The unique hollow structure not only enlarged the contact area but also facilitated charge carrier transfer and photocatalytic reactions. The CoS x /g-C3N4 hollow sample presented a remarkable photocatalytic H2 generation rate of 629 µmol g−1 h−1, which was 52 times that of pure g-C3N4 (Fig. 18(d)). Density functional theory (DFT) computational calculations were performed to explore the electron transfer pathway. As shown in Figs. 18(e) and (f), the work functions of g-C3N4 (001) and CoS (001) were 4.68 and 4.91 eV, respectively. Therefore, the electrons will transfer from g-C3N4 to CoS owing to the difference in the Fermi energies. Furthermore, the transfer behavior of the charge carriers were validated by the 3D charge density difference (Fig. 18(g)). It can be observed that electrons accumulated at the CoS. The photocatalytic H2 mechanism is illustrated in Fig. 18(h). The electrons of C3N4 on the VB are excited to conduction band (CB), finally transferring to CoS as the H2 evolution active sites to reduce H+ to H2. Meanwhile, the holes in the VB were captured by the sacrificial agent. The hollow structure provided multiple reflections of light to enhance light harvesting. Moreover, the black color of CoS may be beneficial for mass transfer and H2 desorption (Fig. 18(i)). Jiang and co-workers [204] reported hollow bimetallic cobalt nickel sulfide (CoNiS x ) as a cocatalyst to couple with graphitic carbon nitride (g-C3N4). The synthetic approach was similar to that described in Yu’s report, in which additional Ni was added to the precursor. The H2 generation rate of the CoNiS x -CN composite was 2.366 μmol mg−1 h−1, which was 76 times that of pure g-C3N4. DFT calculations were used to explore the electron transfer behavior. As shown in Figs. 19(a,b) , the work functions of g-C3N4 and CoNiS x were calculated to be 4.76 and 4.84 eV, respectively. The electrons moved from g-C3N4 to CoNiS x because CoNiS x possessed a lower Fermi level compared with g-C3N4, which was demonstrated by the charge density difference shown in Fig. 19(c). It can be seen that the electrons accumulated around the surface of CoNiS x , and the region of g-C3N4 was charge depleted. ΔG H* is an important indicator of H2 evolution. The value of ΔG H*, which was approximately zero, suggests more suitable hydrogen binding on the surfaces of the photocatalysts. CoNiS x -CN displayed a smaller ΔC H* value compared to NiS x -CN or Co-CN, which suggests the benefits of the bimetallic cocatalyst (Fig. 19(d)). The authors also found that the larger specific surface area of CoNiS x -CN resulted in additional active sites for photocatalytic H2 generation. According to the above summaries, it can be deduced that hollow Co-based chalcogenides can use efficient cocatalysts to couple with suitable visible-light-induced photocatalysts, promoting photocatalytic hydrogen evolution activity. The effect of Co-based hollow chalcogenides can be ascribed to the following aspects: (1) The hollow structure effectively enhances solar light harvesting owing to the light multiple light reflections and scattering inside the cavity; (2) a larger specific surface area provides a platform to deposit other components and enriches the reaction active sites for photocatalytic H2 reaction; (3) smaller EIS is beneficial for charge carrier separation; (4) a lower Fermi level promotes electron transfer from typical photocatalysts to cocatalysts, promoting carrier separation and contributing to the photocatalytic hydrogen performance. MoSe2 shows great potential for whole-spectrum photocatalytic applications owing to its narrow band gap and very high anti-photocorrosion stability. Abundant heterostructures have been constructed to associate with MoSe2 to promote photocatalytic activity [38,205,206]. Recently, Wang and co-workers [206] presented a novel strategy to fabricate hollow-structured MoSe2/CdSe nanostructures for full-spectrum photocatalytic activity using a simple one-pot solvothermal reaction method. It was confirmed that the formation of the hollow structure was owing to the Kirkendall effect by adjusting the reaction time (Fig. 20(a) ). Moreover, the authors demonstrated the Z-scheme mechanism via DFT calculations. As shown in Figs. 20(b)–(d), the hot electrons transferred from MoSe2 to CdSe until the Fermi level aligned with each other. Meanwhile, an electric field at the interface was formed. Under visible-light irradiation, the photogenerated electrons of CdSe with downward band bending recombined with the photogenerated holes of MoSe2, and a Z-scheme mechanism was constructed. The authors also verified the Z-scheme mechanism based on XPS results. However, under NIR light irradiation, the Z-scheme could not be formed because only MoSe2 could be excited. Graphene (GR) has been used for water splitting and CO2 reduction [208]. However, monolayer GR suffers from inferior photoconductivity characteristics. Lin et al. [209] developed 2D graphene into hollow 3D graphene (HG) through chemical vapor deposition; subsequently, g-C3N4 was rooted in HG, forming hollow-structured g-C3N4@HG through a vacuum-filling thermal polymerization approach. The authors found that the transformation of graphene not only activated the carbon π electrons but also promoted electron transfer from g-C3N4 to HG, resulting in improved photocatalytic H2 evolution. Lou et al. [210] synthesized a novel hollow-structured Co/NGC@ZnIn2S4 heterostructure system (Figs. 21(a,b) shows the synthesis process of the Co/NGC hollow nanocages. The ZIF-8@ZIF-67 core-shell polyhedron was fabricated by an in situ growth method. Co/NGC nanocages were obtained using a high-temperature ZIF-8@ZIF-67 sample followed by acid leaching. The approach of using ZnIn2S4 NSs grown on Co/NGC cages was the same as the abovementioned hydrothermal process. A control experiment was carried out, as shown in Figs. 21(c,d). The hollow structure was beneficial to the reaction, and the reduction reaction mainly occurred on the Co particles. The results demonstrated that hollow Co@NGC is an efficient cocatalyst to promote charge separation and transfer. It also offered abundant catalytic active sites, which contributed to the outstanding photocatalytic H2 evolution activity (Fig. 21(e)). Co@NGC is rarely used as a cocatalyst in the photocatalytic hydrogen field; however, it has been used as a bifunctional electrocatalyst for ORR and OER or as an air electrode catalyst in Zn-air batteries. For instance, Qiu et al. [211] synthesized NC@Co-NGC double-shelled nanocages derived from core-shell ZIF-8@ZIF-67 metal-organic frameworks. The unique hollow structure can prevent metal corrosion and aggregation during the reactions and improve the crystallinity and electrical conductivity of carbon. NC@Co-NGC exhibited excellent electrocatalytic activity, comparable to that of Pt and RuO2 species in the ORR and OER reactions. Liu and co-workers presented a novel strategy to synthesize transition metal (Fe, Co, Ni) NPs encapsulated in nitrogen-doped carbon nanotubes (M/N-CNTs, M = Fe, Co, Ni). The Co/N-CNTs exhibited optimal catalytic activity and stability. In the synthesis process, CoCl2·6H2O and cyanamide were used as precursors and heated at a high temperature. Co/N-CNTs can be obtained by treatment with H2SO4 to remove the unstable and inactive sites [212]. The optimal Co/N-CNT hybrid exhibited superior bifunctional catalytic activity and excellent stability toward both the ORR and OER. The authors reported that the half-wave potential and the overpotential over Co/N-CNT were 0.86 and 0.39 V, respectively, values that were even better than those of state-of-the-art Pt/C and RuO2 catalysts. 4.1 Typical hollow host photocatalyst-based hierarchical systems for photocatalysis Coupling with other components is an effective strategy for improving photocatalytic activity. CeO2-based materials for photocatalytic applications can be mainly classified into three systems: 1) metal@CeO2 heterojunctions, 2) metal oxide@CeO2 heterojunctions, and 3) CeO2 coupled with CdS, g-C3N4, or some other compound photocatalyst. In the system of the metal@CeO2 core-shell heterojunction, the outer CeO2 shell generally protects the inner metal active center and prevents agglomeration. The strong connection between the metal and CeO2 provides a synergetic effect to enhance the catalytic activity. Li et al. [213] synthesized multi-shelled Cu-CeO2 hollow spheres by facile one-step aerosol spray pyrolysis (Figs. 22(a)–(e) ). The Cu species were highly dispersed in the hollow CeO2 and displayed an enlarged surface area. The Cu-CeO2 catalyst exhibited increased catalytic activity and good stability. Recently, Zhang and co-workers [214] fabricated CeO2 with three different morphologies to support Cu particles. Song et al. [215] reported a Pt-enriched@CeO2 hollow nanostructure using Pd@Ag@CeO2 nanospheres as the hard template (Figs. 22(f)–(i)). Pd@void@Pt@CeO2 intermediate products were obtained by the galvanic replacement reaction, which was triggered by mixing the K2PtCl4 and Pd@Ag@CeO2 templates. Finally, the hollow Pt-enriched@CeO2 nanostructure was fabricated by increasing the etching time and reaction temperature. (Pt-enriched cage) @CeO2 showed high catalytic reaction performance and excellent selectivity for cinnamaldehyde hydrogenation. He et al. [216] reported hollow Co3O4@CeO2 composite nanotubes, using hollow Co3O4 nanotubes as the template, coated with a CeO2 shell, which demonstrated efficient CO oxidation performance. Another system of CeO2@MnO2 hollow nanocomposite was fabricated [217], which was different from the design of the Co3O4@CeO2 nanostructure. In that work, Ce(OH)CO3 was first produced as the precursor; subsequently, CeO2@MnO2 was prepared by a hydrothermal approach followed by calcination. The as-prepared materials can be considered candidates for advanced composites; however, the above metal-based materials@CeO2 hollow structure has not been widely applied in photocatalytic hydrogen evolution or CO2 reduction reactions. Combining CeO2 with typical narrow band gap photocatalysts (CdS, ZnIn2S4, g-C3N4) is an effective strategy to extend the light adsorption range and promote charge carrier separation. The general approach is to use hollow-structured CeO2 as a platform for depositing another component. Jiang et al. [218] developed a hierarchical hollow CeO2/ZnIn2S4 nanorod hybrid system. CeO2 nanorods (NRs) were synthesized using the MOF-template method. Ce(NO3)3·6H2O was selected as the precursor and Ce source for Ce-MOF, which can be transformed into CeO2 NRs by calcination in air. Finally, CeO2/ZnIn2S4 was successfully produced via the hydrothermal method (Figs. 23(a)–(c) ). The interfacial built-in electric field accelerated the charge flow between CeO2 and the ZnIn2S4 species, decreasing the recombination of charge carriers and improving the photocatalytic rates of dehydrogenation of PhCH2OH for H2 evolution and PhCHO production (Fig. 23(d)). EPR technology was used to demonstrate the Z-scheme mechanism. It has been reported that the standard potentials of –OH/•OH and O2/•O2– are 1.89 eV (vs. NHE) and –0.33 eV (vs. NHE), respectively. In theory, the electrons and holes in the CB and VB of pristine CeO2 can react with O2 and H2O to generate •O2– and •OH radicals. However, the electrons in the CB of pristine ZnIn2S4 can only reduce O2 . into O2–. As shown in Figs. 23(e)–(f), the results of the signals over the pristine samples were consistent with the theory. As for CeO2/ZnIn2S4, the photogenerated electrons flowed from ZnIn2S4 to CeO2, and the photogenerated holes transferred from CeO2 to ZnIn2S4 according to the Type II mechanism. Thus, .OH radicals were not generated over CeO2/ZnIn2S4 under light irradiation. However, the •OH and •O2– radicals were present over CeO2/ZnIn2S4. In the Z-scheme mechanism, the photogenerated electrons of CeO2 on CB were transferred to the junction and recombined with the photogenerated holes of ZnIn2S4 on the VB. Meanwhile, the strong reductivity of electrons in the CB of ZnIn2S4 and the oxidizability of holes in the VB of CeO2 nanorods were retained, which was confirmed by the presence of obvious signals of •OH and •O2 − in the CeO2 /ZnIn2S4 hybrid (Figs. 23(e)–(g)). It has been reported that S-doped CeO2 hollow spheres coupled with CdS shells exhibit improved photocatalytic H2 generation activity under visible-light illumination with Na2S/Na2SO3 as the sacrificial agent [220]. The coating of the CdS shell can increase the sensitization of CeO2, and the hollow structure of CeO2 can increase the surface area. The photogenerated electrons are transferred from the CB of CeO2–x S x to CdS and reduce H+ to H2, whereas the photogenerated holes are quenched by Na2S/Na2SO3, promoting interfacial charge separation. Wang and co-workers [220] synthesized hollow carbon-incorporated NiO/TiO2 p-n heterojunctions for efficient visible-light photocatalysis using PS nanospheres as hard templates, followed by coating with TiO2 and NiO shells. PS nanospheres not only acted as a template but also provided a graphite carbon source. Recently, hollow-structured CdS@ZnIn2S4 cubes were prepared for pure water splitting under visible-light irradiation [221]. Fig. 24 shows the synthesis of hollow CdS@ZnIn2S4. First, hollow Ag2S cubes were prepared using AgCl as the template, combined with the anion exchange method. Similarly, hollow Ag2S cubes were converted into CdS via cation exchange between Ag+ and Cd2+. Finally, a hollow CdS@ZnIn2S4 hierarchical photocatalyst was obtained by directly growing ZnIn2S4 on the surface of CdS. The authors used X-ray absorption near-edge structure (XANES) and extended X-ray absorption fine structure (EXAFS) to explore the interfacial features of CdS@ZnIn2S4 by analyzing the local Zn atomic environment over CdS and CdS@ZnIn2S4. They confirmed strong interfacial interactions with the formation of Zn atoms in ZnIn2S4 and S atoms in CdS. Moreover, the Z-scheme was verified according to DFT calculations in terms of the energy band configuration. Interestingly, the authors directly confirmed the Z-scheme using SPVM technology. Compared with the hollow CdS cubes, CdS@ZnIn2S4 showed a more significant SPV signal, which indicated a photoinduced vectorial electron transfer path from ZnIn2S4 to CdS. The loading of reduction cocatalysts and oxidation cocatalysts on the same photocatalyst can achieve photogenerated electron and hole migration at the same time. However, the random decoration of the cocatalysts leads to a high carrier recombination probability in the migration process, resulting in low photocatalytic activity. The construction of hierarchical architectures with oxidative and reductive dual cocatalysts has attracted considerable attention. Hollow-structured photocatalysts possess inner and outer surfaces, which can accommodate deposited cocatalysts separately. Therefore, hollow-structured photocatalysts are excellent candidates for constructing hierarchical architectures with spatially separate dual cocatalyst decoration. The synthetic approaches for several primary hollow photocatalysts are summarized in Part II. In this section, emphasis is placed on the design of dual cocatalyst-decorated hollow nanostructures and photocatalytic mechanisms. Cao and co-workers [222] developed a novel strategy to fabricate RuO2@TiO2@Pt hollow spheres with a RuO2 oxidation cocatalyst and a Pt reduction cocatalyst deposited on the outer and inner surfaces, respectively, of hollow TiO2. Hollow TiO2 spheres were synthesized using the hard-template method with SiO2 as the template. The Pt NPs were first anchored on the SiO2 spheres by impregnation with an H4PtCl6 aqueous solution followed by H2 reduction. Subsequently, the TiO2 shell was coated on Pt@SiO2 to form TiO2@Pt@SiO2. RuCl3 was selected as the Ru resource for impregnation of the as-prepared sample followed by heat treatment. Finally, hollow-structured RuO2@TiO2@Pt was fabricated via NaOH etching. Compared to TiO2@Pt/RuO2 or Pt/RuO2@TiO2, RuO2@TiO2@Pt with dual cocatalysts showed the smallest electric resistance and highest photocurrent intensity, which can be ascribed to RuO2 and Pt being located at different positions. The photogenerated electrons were captured by Pt, and holes were collected by RuO2, resulting in a high carrier separation efficiency. Jiang and co-workers [223] presented a method to fabricate Ag and RuO2 on the inner and outer surfaces, respectively, of hollow TiO2 for photocatalytic hydrogen production. Gong et al. [224] synthesized Pt@TiO2@MnO x hollow spheres, with Pt and MnO x loaded on the inner and outer surfaces, respectively, of TiO2 shells for photocatalytic benzyl alcohol oxidation. Sun et al. [225] developed a novel strategy for a hollow Pd@CdS/PdS photocatalyst (Fig. 25(a) ). Fig. 25(b) shows the synthesis process. Pd encapsulated within zeolites (Pd@zeolites) was prepared by hydrothermal reactions and then coated with CdS shells. Zeolites can be removed using a NaOH solution to obtain a hollow structure. Finally, PdS species were deposited on the hollow Pd@CdS using Na2PdCl4 as the Pd resource to react with Na2S. The Pd@CdS@PdS sample showed an outstanding photocatalytic H2 generation rate of 144.8 mmol h−1 g−1, which exceeded the activity of single cocatalyst-decorated CdS (Pd@CdS, PdS@CdS) samples (Fig. 25(c)). PdS possessed a more positive VB potential than CdS; therefore, the photogenerated holes in the VB of CdS were transferred to PdS on the outer surface, which acted as an oxidation cocatalyst. Noble metal Pd species can generally act as reduction cocatalysts, implying that the photogenerated electrons tended to flow from CdS to the inner Pd and reduced water to H2. The opposite transfer direction of the photogenerated electron-hole pairs accelerated the charge carrier separation (Fig. 25(d)). In our group [132], a dual cocatalyst-decorated CdS hollow structure was designed and fabricated (Fig. 26(a) ). Fig. 26(b) presents the synthesis process of Au@HCS@PdS. Au was anchored on the SiO2 nanospheres via thermal reduction. Then, the Au@SiO2 core materials were coated with CdS shells composed of CdS NPs. Hollow Au@CdS can be obtained by the thermal reduction method. Finally, the PdS species was deposited on the surfaces of the hollow Au@CdS to fabricate hollow Au@CdS@PdS through an in situ deposition method just before the photocatalytic reaction. The hollow Au@CdS@PdS illustrated a superior H2 releasing rate of 16.35 mmol g−1 h−1, exceeding those of Au@CdS and CdS@PdS (Fig. 26(c)). The reaction rate was closely related to the apparent activation energies. It was found that the activation energy decreased after the decoration with dual cocatalysts, which indicates that the improved photocatalytic activity can be ascribed to the decreased reaction barriers (Figs. 26(d) and (e)). Moreover, to explore the electron transfer paths, SPV and ESR analyses were conducted. ESR was performed to explore the effect of the cocatalysts in the Au@HCS@PdS system by detecting the signal values of electrons and holes. 2,2,6,6-Tetramethyl-1-piperidinyloxy (TEMPO) functioned as a radical scavenger of e− and h+ to detect the number of free electrons and holes, respectively. Therefore, more signal changes in the photocatalysts indicated high separation efficiency. Compared with HCS, the signals of Au@HCS or HCS@PdS both decreased, which suggests that Au or PdS can capture photogenerated electrons or holes. Moreover, by combined with the SPV results, the roles of Au and PdS were confirmed. It was confirmed that Au and PdS can act as reduction active sites and oxidation active sites to capture the photoinduced electrons and holes, respectively, promoting the separation of photoexcited charge carriers and improving the photocatalytic H2 evolution performance. (Fig. 26(f)). Xing and co-workers [225] designed a noble metal-free cocatalyst-decorated hollow-structured MnO x @CdS/CoP system. Hollow CdS shells were synthesized using a hard-template method. MnO x NPs used as hole collectors were anchored on the inner surfaces of CdS. Meanwhile, CoP was deposited on the outer surfaces of CdS to trap photoinduced electrons. Compared with pristine CdS, the H2 evolution activity increased from 32.0 to 238.4 µmol h−1 over MnOx@CdS/CoP and showed good stability, surpassing the performance of MnO x @CdS/Pt photocatalysts. Wang et al. [155] successfully fabricated a hollow Pt/HCNS/Co3O4 system with Pt and a Co3O4 species as a reduction cocatalyst and oxidation cocatalyst, respectively, using a hard-template method for water splitting. As shown in Figs. 27(a)–(c) , Pt NPs approximately 3 nm were precisely deposited on the inner surfaces. Meanwhile, Co3O4 NPs of approximately 2 nm were loaded on the outer surfaces of the HCNS. After the rational dual modification, the rate of H2 evolution of Pt/HCNS/Co3O4 increased approximately 10 times that of pristine HCNS (0.3 µmol h−1 H2 and 0.1 µmol h−1 O2); it was also higher than that of Co3O4 and Pt cocatalysts on the outer surfaces of HCNS (Figs. 27(d)–(f)). The authors reported that the elaborate hollow structure design can facilitate multi-hole injection and contact between intermediate species. Moreover, the existence of dual cocatalysts prevented the reverse reaction, promoting H2 and O2 evolution. A Type II heterojunction is an effective way to improve water-splitting performance. Gong et al. developed [227] a new synthesis method for Pt@TiO2-In2O3@MnO x nanospheres for photo-oxidation reactions. Zhang et al. [228] presented a novel strategy for fabricating hollow structures with spatially separated cocatalysts based on a Type II heterojunction (Fig. 28(a) ). Double-shell hollow TiO2/CdS spheres were prepared based on the hard-templating method, where Pt and Co3O4 were separately anchored on the inner and outer surfaces of the TiO2/CdS heterojunction (Fig. 28(b)). The Pt/TiO2/CdS/Co3O4 hollow photocatalyst presented an excellent photocatalytic H2 evolution rate of 2000 μmol h−1 g−1, which was 540 times that of TiO2/CdS. The improved photocatalytic activity can be ascribed to the synergism between the built-in electric field and the spatially separated cocatalysts. As shown in Figs. 28(c)–(f), the built-in electric field was formed at the TiO2/CdS junction. The photoexcited electrons and holes were effectively separated and accumulated on the side of TiO2 and CdS under the influence of the built-in electric field. Moreover, the Pt and Co3O4 cocatalysts decreased the activity energy of the reduction and oxidation reactions of water splitting. Therefore, the electrons and holes were captured by Pt and Co3O4, which further accelerated the interface reaction rate. 5 The application of hollow structures in photocatalytic CO2 reduction process Jiang and co-workers [229] reported hollow structures consisting of Bi2WO6 quantum dots using ethylene glycol as a solvent through a one-pot solvethermal approach. The authors pointed out that the effect of ethylene glycol was not only to assemble the hollow structures but also suppress the agglomeration of Bi2WO6 quantum dots. Compared with bulk Bi2WO6, hollow Bi2WO6 presented better photocatalytic reduction activity of CO2, which can be ascribed to the higher CO2 adsorption capacity and efficient photogenerated charge carrier separation. Lin et al. [230] reported ZnO1–x /carbon dot composite hollow spheres for CO2 photocatalytic reduction under an entire UV-vis-NIR spectrum through a single-step aerosol process. The authors found more oxygen vacancy (OV) defects in the ZnO1–x /C composites than in pure ZnO according to the Raman and XPS results, and the presence of OVs can boost the electron transfer to the CB and promote the photocatalytic activity. Hollow heterostructured g-C3N4@CeO2 with OVs was fabricated by Guo et al. [231] for photocatalytic CO2 reduction. The unique hollow structure and the addition of L-cysteine in the synthesis process effectively improved the light utilization and enhanced the CO2 adsorption capacity. The Ce3+ signal is always coupled with the OV. The obvious EPR signal indicated the presence of OVs in the g-C3N4@CeO2 hybrid. The authors also found that the presence of OVs was beneficial for CO2 reduction. Bie and co-workers [232] presented a novel strategy for fabricating hollow-structured NG/CdS for photocatalytic CO2 reduction (Figs. 29(a) and (b) ). First, the CdS/SiO2 sample was synthesized using SiO2 spheres as the hard template. Nitrogen-doped graphene (NG) was grown in situ on the surface of CdS/SiO2 by chemical vapor deposition using pyridine as the feedstock. The hollow structure was then obtained by NaOH etching (Fig. 29(d)). This approach to fabricating heterojunctions ensured an intimate interface between CdS and NG through coordination between nitrogen and cadmium atoms, which was beneficial for the separation and transfer of carriers, and the hollow structure enhanced the utilization of light reflections. The authors also found that nitrogen atoms in monolayer NG were conducive to the adsorption and activation of CO2 molecules, and the thin shell reduced the recombination and diffusion length of charge carriers, which promoted the yield of CO and CH4 products (Fig. 29(c)). Zhu et al. [233] fabricated hollow Au x @THS@CoO with Au and CoO as the electron and hole collectors, respectively, which spatially decorated CoO and Au dual cocatalysts at the internal and external surfaces of TiO2 hollow spheres (Figs. 30(a)–(c) ). The optimal photocatalytic reduction of CO2 to CH4 over Au x @THS@CoO was 13.3 µmol h−1 g−1, which was 60 times that of THS (Fig. 30(d)). There was an obvious SPR adsorption peak centered at 554 nm, which indicates the presence of metallic Au. The authors used the ESR technique to determine the interaction between CO2 and the catalyst (Fig. 30(e)). In N2 atmosphere, the ESR signal was observed at g = 2.0, indicating the presence of oxygen defects over Au2.0@THS@CoO. However, the signal value decreased in CO2 atmosphere, which can be ascribed to the absorption of CO2 at the oxygen defect sites. Moreover, the signal peaks all decreased under light irradiation, which demonstrates that photocatalytic CO2 reduction over Au x @THS@CoO involves the surface oxygen defects of the TiO2 shell. In situ Fourier transform infrared spectroscopy (FTIR) spectra demonstrated that the CO2 − species and H2O acted as the active intermediate and electron or hole scavenger, respectively, in the reaction (Fig. 30(f)). Under visible-light irradiation, the electrons and holes were captured by CoO and Au, respectively, effectively promoting charge carrier separation (Fig. 30(g)). Dehkordi and co-workers [234] synthesized hollow hierarchical g-C3N4@TiO2 spheres using SiO2 and cyanamide as the hard template and precursor of carbon nitride, respectively. Hollow g-C3N4 (HCNS) was obtained by treatment with NH4HF2. TiO2 nanosheets were deposited on the surfaces of hollow HCNS@TiO2 spheres using a versatile kinetics-controlled coating method. Compared with pristine g-C3N4, HCNS and HCNS@TiO2 exhibited larger surface areas, which were conducive to higher CO2 adsorption capacity owing to the hollow structure. Moreover, the hollow structure can achieve multiple light reflections within the interior cavity, resulting in improved light harvesting. The obtained CO2 photoreduction efficiency of HCNS@TiO2 was 11.3 μmol gcat−1 h−1. The enhanced photocatalytic performance can be ascribed to improved light harvesting, multiple light reflections, and enhanced active sites. Li et al. [235] reported hollow-structured Co-based spinel microspheres for CO2 reduction using the self-template method, as illustrated in Fig. 31 . First, hollow NiCo-OH spheres were obtained by a hydrothermal reaction, followed by calcination in air to produce hollow microspheres decorated with 2D NiCo2O4 nanosheets (Figs. 31(a)–(d)). To demonstrate the influence of the unique hollow structure, the authors synthesized NiCo2O4 NPs. It had been found that NiCo2O4 hollow spheres showed larger BET surface areas, which are beneficial to CO2 adsorption and provide additional active sites. As shown in Fig. 31(e), the NiCo2O4 hollow spheres possesses additional OVs. The authors also reported that the presence of OVs can serve as active sites for trapping the photogenerated electrons for CO2 reduction. In the photocatalytic reaction, the NiCo2O4 hollow catalyst exhibited a superior CO generation rate of 15.4 µmol h−1 and good CO selectivity of 84.4%. Zhao and co-workers [236] synthesized hollow BiOBr microspheres using a solvothermal method, as shown in Fig. 32(a) . In situ FTIR was performed to investigate the process of CO2 photoreduction (Figs. 32(a)–(d)). It was found that the peaks of COOH* groups gradually decreased with increasing irradiation time, suggesting that the COOH* group is an important intermediate during the process of reducing CO2 to CO and CH4. It can be observed that OVs in the 120 BiOBr sample (120BB). The signal peak disappeared in the CO2 gas, which can be ascribed to the absorption of CO2 in the OVs. Interestingly, the authors observed that the signals of the OVs were enhanced under light irradiation, indicating that light irradiation was beneficial to the increase in OV concentration. Moreover, OVs may have an effect of lattice distortion in BiOBr and redistribute the charge, as determined by comparing the figure of electron density between BiOBr and BiOBr (OVs) (Figs. 32(e) and (f)). Fig. 32(g) shows the CO2 mechanism over BiOBr. The hollow structure can promote light harvesting because light can achieve multiple scattering and reflection in the hollow voids. Moreover, the unique hollow structure possesses larger surface areas to act as active sites for the CO2 reduction reaction. The thin shell can effectively shorten the transportant distance, which is beneficial for the separation of photogenerated charge carriers. the authors also reported that OVs contributed to the absorption and activation of CO2 molecules, thereby accelerating CO2 reduction. The optimal evolution rates of CO and CH4 over hollow BiOBr were 88.1 and 5.8 μmol g−1 h−1, respectively, values that are better than that of plate-like BiOBr. Bismuth oxychloride (BiOCl) has attracted significant attention owing to its unique characteristics such as good stability, non-photocorrosivity, and great potential in the application of wastewater treatment and water splitting [237]. Recently, Maimaitizi et al. [238] synthesized N and Pt co-doped hierarchical hollow BiOCl (HHBs) photocatalysts via an in situ hydrothermal approach, which was assembled using numerous NSs. The N and Pt co-doped HHBs showed excellent photocatalytic activity, including photocatalytic CO2 reduction and photodegradation of ciprofloxacin and rhodamine B (RhB). As shown in Figs. 33(a) and (b) , the binding energy of the N 1s and Pt 4f peaks at 399.82, 73.36, and 76.54 eV can be ascribed to the Bi–N bond and Pt0, indicating the co-doping of N and Pt on HHBs. The authors also reported improved absorption, which can be attributed to two reasons: (1) the hollow structure with porous architecture resulted in multiple reflections and (2) the N doping and the plasmon effect of Pt. The authors also adopted CO2-TPD to investigate CO2 adsorption performance. As shown in Fig. 33(c), compared with HHBs and N-HHBs, Pt/N-HHBs exhibited the largest peak area, which suggests the highest number of active sites. They carried out CO2 reduction experiments in a 0.1 M NaOH solution. The NaOH solution improved the solubility of CO2 via the formation of HCO3 − and CO3 2– species. It was found that there were no CH4 or CO products, which may have resulted from CH4 or CO being produced only through the photoreduction of CO2 molecules. Fig. 33(d) shows the photocatalytic mechanism of the Pt1/N0.25-HHBs. Under light irradiation, the photogenerated electrons are excited into the CB of the HHBs. The doping of N introduces an impurity energy level and improves the absorption range and photogenerated separation. The photogenerated electrons on the CB of BiOCl can be trapped by Pt, accelerating the separation of charge carriers. Finally, CO3 2– can react with the photogenerated electrons, producing methanol or ethanol. 6 Summary and future perspectives Photocatalytic H2 evolution and CO2 reduction have attracted considerable attention over the last few decades. Therefore, it is critical to design highly efficient photocatalysts. Hollow-structured materials exhibit excellent characteristics for photocatalysis, including enhanced light absorption, shortened charge carrier transfer paths, and large surface areas. In this review, we have summarized the general hollow material synthesis strategies including hard-templating, soft-templating, and self-templating methods (Fig. 34 ). Along with the rapid development of hollow materials, these materials experience various complex structures and morphologies. Synthesis approaches for recent typical photocatalysts (CdS, Zn x Cd1–x S, C3N4, TiO2, and CeO2) with hollow structures have been introduced. The construction of multicomponent materials has shown great potential for improving photocatalytic activity. Therefore, it is important to review the rational design of advanced photocatalysts. Based on the characteristics of hollow materials in photocatalysis, the following types of multicomponent hollow materials can be constructed (Fig. 35 ): (1) hollow cocatalysts to grow photocatalysts; (2) hollow host photocatalysts to decorate with single or (3) dual cocatalysts, including oxidation or reduction cocatalysts; and (4) construction of hollow heterojunctions or (5) hollow heterojunctions to decorate with oxidation and reduction dual cocatalysts. The design principle and advantages of advanced hollow photocatalysts and photocatalytic H2 and CO2 mechanisms have also been explored. Loading suitable oxidation or reduction cocatalysts can effectively separate the charge carriers spatially. It is mentioned that an intimate interface is necessary for fabricating multi-structure photocatalysts, which can ensure fast electron transfer. Moreover, SPV and ESR analysis and DFT calculations combined with experiments have been demonstrated to be new approaches to explore the photocatalytic mechanism in depth. Other applications of hollow structures include CO oxidation, supercapacitors, electrocatalysis, and N2 fixation. For instance, He and co-workers synthesized hollow mesoporous Co3O4-CeO2 nanotubes for catalytic CO oxidation [239]. First, they synthesized hollow Co3O4 nanotubes through a self-templating method, and then Co3O4 was coated with a CeO2 shell. When the CeO2 content was approximately 26.3 wt%, the Co3O4-CeO2 sample achieved 100% CO conversion at 145 °C. NiCo2O4/CeO2 hierarchical hollow spheres were successfully fabricated via a solvothermal approach combined with calcination in air, which exhibited a high specific capacitance and excellent cycling stability [240]. Recently, Li et al. [241] reviewed MOF-derived heterostructures for electrocatalysis, including hollow metal hydroxide heterostructures, hollow metal oxide heterostructures, hollow metal sulfides, metal phosphides, metal selenides, and others. The application of advanced electrocatalytic reactions over hollow materials involves the oxygen evolution reaction, hydrogen evolution reaction, oxygen reduction reaction, CO2 reduction reaction, and N2 reduction reaction. Zhang et al. [242] synthesized multi-shelled hollow Cr2O3 microspheres through a facile route for electrohydrogenation of N2 to NH3, which exhibited a high Faradaic efficiency (6.78%) and NH3 yield (25.3 µg h−1 mgcat−1) at –0.9 V. Nazemi and co-workers [243] fabricated hollow Au-Ag2O nanocages to convert N2 to NH3 in a pure water system using a photo(electro)chemical setup. The rate of N2 evolution reached 28.2 mg m−2 h−1, and the apparent quantum efficiency was 1.2% at 685 nm. Although some progress has been made in the field of energy conversion, many challenges still exist, and practical application of the developed hollow structures is still in the future. It is still necessary to try our best to promote the development of the field. For the fabrication of photocatalysts, economical, high-performance, stable, and environmentally friendly materials need to be considered for further large-scale applications. However, exploration of the photocatalytic mechanism is equally important. The investigation of the mechanism is not only beneficial to the design of highly efficient photocatalysts but also contributes to the development of characterization techniques and microstructure analysis. We hope that this review provides a reference for the fabrication of novel hollow materials and the exploration of photocatalytic H2 and CO2 reduction mechanisms in depth. Conflicts of interest The authors declare no conflict of interest. References 1 Y.J. Yuan Z.T. Yu D.Q. Chen Z.G. Zou Chem. Soc. Rev. 46 2017 603 631 Y. J. Yuan, Z. T. Yu, D. Q. Chen, Z. G. Zou, Chem. Soc. Rev., 2017, 46, 603–631. 2 R.Q. Yang Y.C. Ji L.W. Wang G.X. Song A.Z. Wang L.H. Ding N. Ren Y.W. Lv J. Zhang X. Yu ACS Appl. Nano Mater. 3 2020 9268 9275 R. Q. Yang, Y. C. Ji, L. W. Wang, G. X. Song, A. Z. Wang, L. H. Ding, N. Ren, Y. W. Lv, J. Zhang, X. Yu, ACS Appl. Nano Mater., 2020, 3, 9268–9275. 3 Y. Liu Y.H. Li X. Li Q. Zhang F. Peng ACS Nano 14 2020 14181 14189 Y. Liu, Y. H. Li, X. Li, Q. Zhang, F. Peng, ACS Nano, 2020, 14, 14181–14189. 4 D.A. Reddy H. Park S. Hong D.P. Kumar T.K. Kim J. Mater. Chem. A 5 2017 6981 6991 D. A. Reddy, H. Park, S. Hong, D. P. Kumar, T. K. Kim, J. Mater. Chem. A, 2017, 5, 6981–6991. 5 S. Wang Y. Wang S.Q. Zang X. Lou Small Methods 4 2019 1900586 S. Wang, Y. Wang, S. Q. Zang, X. Lou, Small Methods, 2019, 4, 1900586. 6 K. Li B. Peng T. Peng ACS Catal. 2016 7485 7527 K. Li, B. Peng, T. Peng, ACS Catal., 2016, 7485–7527. 7 A. Fujishima K. Honda Nature 238 1972 37 38 A. Fujishima, K. Honda, Nature, 1972, 238, 37–38. 8 J.D. Wang X. Xiao Y. Liu K.M. Pan H. Pang S.Z. Wei J. Mater. Chem. A 7 2019 17675 17702 J. D. Wang, X. Xiao, Y. Liu, K. M. Pan, H. Pang, S. Z. Wei, J. Mater. Chem. A, 2019, 7, 17675–17702. 9 Z.H. Wang H.F. Fu Z.W. Tian D.M. Han F.B. Gu Nanoscale 8 2016 5865 5872 Z. H. Wang, H. F. Fu, Z. W. Tian, D. M. Han, F. B. Gu, Nanoscale, 2016, 8, 5865–5872. 10 H. Hu J. Hu X. Wang J. Gan M. Su W. Ye W. Zhang X. Ma H. Wang Catal. Sci. Technol. 10 2020 4712 4725 H. Hu, J. Hu, X. Wang, J. Gan, M. Su, W. Ye, W. Zhang, X. Ma, H. Wang, Catal. Sci. Technol., 2020, 10, 4712–4725. 11 M. Mao Q. Zhang Y. Yang Y. Li H. Huang Z. Jiang Q. Hu X. Zhao Green Chem. 20 2018 2857 2869 M. Mao, Q. Zhang, Y. Yang, Y. Li, H. Huang, Z. Jiang, Q. Hu, X. Zhao, Green Chem., 2018, 20, 2857–2869. 12 M. Krivec K. Zagar L. Suhadolnik M. Ceh G. Drazic ACS Appl. Mater. Interfaces 5 2013 9088 9094 M. Krivec, K. Zagar, L. Suhadolnik, M. Ceh, G. Drazic, ACS Appl. Mater. Interfaces, 2013, 5, 9088–9094. 13 J. AliKhan M. Sayed N.S. Shah S. Khan Y. Zhang G. Boczkaj H.M. Khan D.D. Dionysiou Appl. Catal. B 265 2020 118557 J. AliKhan, M. Sayed, N. S. Shah, S. Khan, Y. Zhang, G. Boczkaj, H. M. Khan, D. D. Dionysiou, Appl. Catal. B, 2020, 265, 118557. 14 Y. Wang G. Shen Y. Zhang L. Pan X. Zhang J.-J. Zou Appl. Catal. B 260 2020 118183 Y. Wang, G. Shen, Y. Zhang, L. Pan, X. Zhang, J.-J. Zou, Appl. Catal. B, 2020, 260, 118183. 15 D. Spanu S. Recchia S. Mohajernia P. Schmuki M. Altomare Appl. Catal. B 237 2018 198 205 D. Spanu, S. Recchia, S. Mohajernia, P. Schmuki, M. Altomare, Appl. Catal. B, 2018, 237, 198–205. 16 X.C. Liu L. Liu Z.R. Yao Z.H. Yang H. Xu Colloids Surf. A 599 2020 124869 X. C. Liu, L. Liu, Z. R. Yao, Z. H. Yang, H. Xu, Colloids Surf. A, 2020, 599, 124869. 17 Y.H. Zhang B.B. Jiu F.L. Gong K. Lu N. Jiang H. Li Zhang J.L. Chen J. Phys. Chem. Solids 116 2018 126 130 Y. H. Zhang, B. B. Jiu, F. L. Gong, K. Lu, N. Jiang, H. Li Zhang, J. L. Chen, J. Phys. Chem. Solids, 2018, 116, 126–130. 18 L. Li S.Q. Sun Y.X. Wang C.Y. Wang J. Photochem. Photobiol. A 355 2018 16 24 L. Li, S. Q. Sun, Y. X. Wang, C. Y. Wang, J. Photochem. Photobiol. A, 2018, 355, 16–24. 19 M. Reli M. Edelmannova M. Sihor P. Praus L. Svoboda K.K. Mamulova H. Otoupalikova L. Čapek A. Hospodková L. Obalova K. Koci Int. J. Hydrogen Energy 40 2015 8530 8538 M. Reli, M. Edelmannova, M. Sihor, P. Praus, L. Svoboda, K. K. Mamulova, H. Otoupalikova,L. Čapek, A. Hospodková, L. Obalova, K. Koci, Int. J. Hydrogen Energy, 2015, 40, 8530–8538. 20 D.D. Ma J.W. Shi Y.J. Zou Z.Y. Fan X. Ji C.M. Niu L.Z. Wang Nano Energy 39 2017 183 191 D. D. Ma, J. W. Shi, Y. J. Zou, Z. Y. Fan, X. Ji, C. M. Niu, L. Z. Wang, Nano Energy, 2017, 39, 183–191. 21 M.H. Hsu C.J. Chang Int. J. Hydrogen Energy 39 2014 16524 16533 M. H. Hsu, C. J. Chang, Int. J. Hydrogen Energy, 2014, 39, 16524–16533. 22 C.Q. Li S.S. Yi Y. Liu Z.L. Niu Z.Y. Liu Chem. Eng. J. 417 2021 129231 C. Q. Li, S. S. Yi, Y. Liu, Z. L. Niu, Z. Y. Liu, Chem. Eng. J., 2021, 417, 129231. 23 E. Grabowska Appl. Catal. B 186 2016 97 126 E. Grabowska, Appl. Catal. B, 2016, 186, 97–126. 24 J.X. Yu Z.Q. Chen Q.Q. Chen Y. Wang H.J. Lin X. Hu L.H. Zhao Y.M. He Int. J. Hydrogen Energy 43 2018 4347 4354 J. X. Yu, Z. Q. Chen, Q. Q. Chen, Y. Wang, H. J. Lin, X. Hu, L. H. Zhao, Y. M. He, Int. J. Hydrogen Energy, 2018, 43, 4347–4354. 25 J.W. Liu G. Chen Z.H. Li Z.G. Zhang Int. J. Hydrogen Energy 32 2007 2269 2272 J. W. Liu, G. Chen, Z. H. Li, Z. G. Zhang, Int. J. Hydrogen Energy, 2007, 32, 2269–2272. 26 K. Zhuge Z. Chen Y. Yang J. Wang Y. Shi Z. Li Appl. Surf. Sci. 539 2021 148234 K. Zhuge, Z. Chen, Y. Yang, J. Wang, Y. Shi, Z. Li, Appl. Surf. Sci., 2021, 539,148234. 27 C. Hui W. Fan J. Liu Z. Jiang Y. Li Y. Zhang J. Zhang Int. J. Hydrogen Energy 46 2021 6369 6379 C. Hui, W. Fan, J. Liu, Z. Jiang, Y. Li, Y. Zhang, J. Zhang, Int. J. Hydrogen Energy, 2021, 46, 6369–6379. 28 R. Banerjee A. Pal D. Ghosh A.B. Ghosh M. Nandi P. Biswas Mater. Res. Bull. 134 2020 111085 R. Banerjee, A. Pal, D. Ghosh, A. B. Ghosh, M. Nandi, P. Biswas, Mater. Res. Bull., 2020, 134, 111085. 29 S. Manchala A. Gandamalla N.R. Vempuluru S. Muthukonda Venkatakrishnan V. Shanker J. Colloid Interface Sci. 583 2021 255 266 S. Manchala, A. Gandamalla, N. R. Vempuluru, S. Muthukonda Venkatakrishnan, V. Shanker, J. Colloid Interface Sci., 2021, 583, 255–266. 30 B. Sun J. Wu W. Wang H. Wang Y. Li Z. Guo Y. Geng H. Lin L. Wang Appl. Surf. Sci. 542 2021 148542 B. Sun, J. Wu, W. Wang, H. Wang, Y. Li, Z. Guo, Y. Geng, H. Lin, L. Wang, Appl. Surf. Sci., 2021, 542, 148542. 31 S. Zhao J. Xu M. Mao L. Li X. Li Appl. Surf. Sci. 528 2020 147016 S. Zhao, J. Xu, M. Mao, L. Li, X. Li, Appl. Surf. Sci., 2020, 528, 147016. 32 L. Pei J. Liu Y. Xu Y. Han J. Wu Z. Wang X. Zhang J. Alloys Compd. 809 2019 151869 L. Pei, J. Liu, Y. Xu, Y. Han, J. Wu, Z. Wang, X. Zhang, J. Alloys Compd., 2019, 809, 151869. 33 J. Ran X. Wang B. Zhu S. Qiao Chem. Commun. 53 2017 9882 9885 J. Ran, X. Wang, B. Zhu, S. Qiao, Chem. Commun., 2017, 53, 9882–9885. 34 Q. Zhang X. Wang J. Zhang L. Li W.L. Dai J. Colloid Interface Sci. 590 2021 632 640 Q. Zhang, X. Wang, J. Zhang, L. Li, W. L. Dai, J. Colloid Interface Sci., 2021, 590, 632–640. 35 M. Wang G. Zhang Z. Guan J. Yang Q. Li Small 17 2021 2006952 M. Wang, G. Zhang, Z. Guan, J. Yang, Q. Li, Small, 2021, 17, 2006952. 36 C. Li H. Che P. Huo Y. Yan H. Dong J. Colloid Interface Sci. 581 2020 764 773 C. Li, H. Che, P. Huo, Y. Yan, H. Dong, J. Colloid Interface Sci., 2020, 581, 764–773. 37 C. Wang X. Ma Z. Fu X. Hu E. Liu J. Colloid Interface Sci. 592 2021 66 76 C. Wang, X. Ma, Z. Fu, X. Hu, E. Liu, J. Colloid Interface Sci., 2021, 592, 66–76. 38 J.W. Zhang C.C. Cheng F.S. Xing C. Chen C.J. Huang Chem. Eng. J. 414 2021 129157 J. W. Zhang, C. C. Cheng, F. S. Xing, C. Chen, C. J. Huang, Chem. Eng. J., 2021, 414, 129157. 39 X.W. Jiang Q. Liu C.C. Cheng F.S. Xing C. Chen C.J. Huang Int. J. Hydrogen Energy 46 2020 5197 5206 X. W. Jiang, Q. Liu, C. C. Cheng, F. S. Xing, C. Chen, C. J. Huang, Int. J. Hydrogen Energy, 2020, 46, 5197–5206. 40 X. Zhang P. Yang S.P. Jiang Nanotechnology 32 2021 175401 175412 X. Zhang, P. Yang, S. P. Jiang, Nanotechnology, 2021, 32, 175401–175412. 41 Y. Chen Y. Liu Z. Ma Colloids Surf. A 614 2021 126119 Y. Chen, Y. Liu, Z. Ma, Colloids Surf. A, 2021, 614, 126119. 42 X. Yang Z. Tian Y.F. Chen H. Huang J. Hu B. Wen J. Alloys Compd. 859 2020 157754 X. Yang, Z. Tian, Y. F. Chen, H. Huang, J. Hu, B. Wen, J. Alloys Compd., 2020, 859, 157754 43 H.Y. Yuan J.Y. Bai B.B. Xu X.Y. Li S.Y. Xiao P.F. Liu X.L. Wang H.G. Yang Chem. Commun. 57 2021 3042 3045 H. Y. Yuan, J. Y. Bai, B. B. Xu, X. Y. Li, S. Y. Xiao, P. F. Liu, X. L. Wang, H. G. Yang, Chem. Commun., 2021,57, 3042–3045. 44 W. Wang J. Fang X. Huang Appl. Surf. Sci. 513 2020 145830 W. Wang, J. Fang, X. Huang, Appl. Surf. Sci., 2020, 513, 145830. 45 G.W. Lin Y.H. Huang W. Tseng F.H. Lu Ceram. Int. 45 2019 22506 22512 G. W. Lin, Y. H. Huang, W. Tseng, F. H. Lu, Ceram. Int., 2019, 45, 22506–22512. 46 C. Li W.Y. Yang L.M. Liu W.Z. Sun Q. Li RSC Adv. 6 2016 72659 72669 C. Li, W. Y. Yang, L. M. Liu, W. Z. Sun, Q. Li, RSC Adv., 2016, 6, 72659–72669. 47 G. Zhang Y. Xu C. He P. Zhang H. Mi Appl. Catal. B 283 2021 119636 G. Zhang, Y. Xu, C. He, P. Zhang, H. Mi, Appl. Catal. B, 2021, 283, 119636. 48 M. Esmat H. El-Hosainy R. Tahawy W. Jevasuwan Y. Ide Appl. Catal. B 285 2020 119755 M. Esmat, H. El-Hosainy, R. Tahawy, W. Jevasuwan, Y. Ide, Appl. Catal. B, 2020, 285, 119755. 49 Y. Zhu Z. Zhang N. Lu R. Hua B. Dong Chin. J. Catal. 40 2019 413 423 Y. Zhu, Z. Zhang, N. Lu, R. Hua, B. Dong, Chin. J. Catal., 2019, 40, 413–423. 50 Z.W. Zhang Q.H. Li X.Q. Qiao D.F. Hou D.S. Li Chin. J. Catal. 040 2019 371 379 Z. W. Zhang, Q. H. Li, X. Q. Qiao, D. F. Hou, D. S. Li, Chin. J. Catal., 2019, 040, 371–379. 51 D. Ren R. Shen Z. Jiang X. Lu X. Li Chin. J. Catal. 41 2020 31 40 D. Ren, R. Shen, Z. Jiang, X. Lu, X. Li, Chin. J. Catal., 2020, 41, 31–40. 52 J. Ge Y. Liu D. Jiang L. Zhang P. Du Chin. J. Catal. 40 2019 160 167 J. Ge, Y. Liu, D. Jiang, L. Zhang, P. Du, Chin. J. Catal., 2019, 40, 160–167. 53 Z. Li Y. Ma X. Hu E. Liu J. Fan Chin. J. Catal. 40 2019 434 445 Z. Li, Y. Ma, X. Hu, E. Liu, J. Fan, Chin. J. Catal., 2019, 40, 434–445. 54 J. Wang Y. Cui D. Wang Adv. Mater. 31 2019 1801993 J. Wang, Y. Cui, D. Wang, Adv. Mater. 2019, 31, 1801993. 55 Q. Lu F. Gao CrystEngComm 18 2016 7399 7409 Q. Lu, F. Gao, CrystEngComm, 2016, 18, 7399–7409. 56 Z.X. Cai Z.L. Wang J. Kim Y. Yamauchi Adv. Mater. 31 2019 1804903 Z. X. Cai, Z. L. Wang, J. Kim, Y. Yamauchi, Adv. Mater., 2019, 31, 1804903. 57 D. Liu J.W. Wan G.S. Pang Z.Y. Tang Adv. Mater. 31 2019 1803291 D. Liu, J. W. Wan, G. S. Pang, Z. Y. Tang, Adv. Mater., 2019, 31, 1803291. 58 M. Xiao Z.L. Wang M.Q. Lyu B. Luo S.C. Wang G. Liu H.M. Cheng L.Z. Wang Adv. Mater. 31 2019 1801369 M. Xiao, Z. L. Wang, M. Q. Lyu, B. Luo, S. C. Wang, G. Liu, H. M. Cheng, L. Z. Wang, Adv. Mater., 2019, 31, 1801369. 59 Y.Y. Qin H. Li J. Lu Y.H. Feng F.Y. Meng C.C. Ma Y.S. Yan M.J. Meng Appl. Catal. B 277 2020 119254 Y. Y. Qin, H. Li, J. Lu, Y. H. Feng, F. Y. Meng, C. C. Ma, Y. S. Yan, M. J. Meng, Appl. Catal. B, 2020, 277, 119254. 60 J. Pan Z. Dong B. Wang Z. Jiang C. Zhao J. Wang C. Song Y. Zheng C. Li Appl. Catal. B 242 2019 92 99 J. Pan, Z. Dong, B. Wang, Z. Jiang, C. Zhao, J. Wang, C. Song, Y. Zheng, C. Li, Appl. Catal. B, 2019, 242, 92–99. 61 Y. Ren D. Zeng W.J. Ong Chin. J. Catal. 40 2019 289 319 Y. Ren, D. Zeng, W. J. Ong, Chin. J. Catal., 2019, 40, 289–319. 62 D.S. Dai L. Wang N. Xiao S.S. Li H. Xu S. Liu B. Xu D. Lv Y.Q. Gao W.Y. Song L. Ge J. Liu Appl. Catal. B 233 2018 194 201 D. S. Dai, L. Wang, N. Xiao, S. S. Li, H. Xu, S. Liu, B. Xu, D. Lv, Y. Q. Gao, W. Y. Song, L. Ge, J. Liu, Appl. Catal. B, 2018, 233, 194–201. 63 H. Xu R. Xiao J. Huang Y. Jiang X. Yang Chin. J. Catal. 42 2021 107 114 H. Xu, R. Xiao, J. Huang, Y. Jiang, X. Yang, Chin. J. Catal., 2021, 42, 107–114. 64 F. Shahvaranfard P. Ghigna A. Minguzzi E. Wierzbicka M. Altomare ACS Appl. Mater. Interfaces 12 2020 38211 38221 F. Shahvaranfard, P. Ghigna, A. Minguzzi, E. Wierzbicka, M. Altomare, ACS Appl. Mater. Interfaces, 2020, 12, 38211–38221. 65 P. Babu B. Naik Inorg. Chem. 59 2020 10824 10834 P. Babu, B. Naik, Inorg. Chem., 2020, 59, 10824–10834. 66 J. Lei D. Spanu N. Denisov S. Recchia M. Altomare Chem. Asian J. 15 2019 301 309 J. Lei, D. Spanu, N. Denisov, S. Recchia, M. Altomare, Chem. Asian J., 2019, 15, 301–309. 67 X. Jia Q. Ba L. Huang P. Devaraji W. Chen X. Li L. Mao Int. J. Hydrogen Energy 44 2019 26169 26180 X. Jia, Q. Ba, L. Huang, P. Devaraji, W. Chen, X. Li, L. Mao, Int. J. Hydrogen Energy, 2019, 44, 26169–26180. 68 N.T. Nguyen S. Ozkan S. Hejazi N. Denisov P. Schmuki Int. J. Hydrogen Energy 44 2019 22962 22971 N. T. Nguyen, S. Ozkan, S. Hejazi, N. Denisov, P. Schmuki, Int. J. Hydrogen Energy, 2019, 44, 22962–22971. 69 N. Song E.H. Jiang X.T. Liu Y. Zuo G.B. Che C.B. Liu Y.S. Yan H.J. Dong J. Colloid Interface Sci. 584 2020 332 343 N. Song, E. H. Jiang, X. T. Liu,Y. Zuo, G. B. Che, C.B. Liu, Y. S.Yan, H. J. Dong, J. Colloid Interface Sci., 2020, 584, 332–343. 70 K. Sun M. Liu J. Pei D. Li C. Ding K. Wu H.L. Jiang Angew. Chem. Int. Ed. 59 2020 22749 22755 K. Sun, M. Liu, J. Pei, D. Li, C. Ding, K. Wu, H. L. Jiang, Angew. Chem. Int. Ed., 2020, 59, 22749–22755. 71 S. Li J. Tan Z. Jiang J. Wang Z. Li Chem. Eng. J. 384 2020 123354 S. Li, J. Tan, Z. Jiang, J. Wang, Z. Li, Chem. Eng. J., 2020, 384, 123354. 72 Z. Ai K. Zhang B. Chang Y. Shao X. Hao Chem. Eng. J 383 2020 123130 Z. Ai, K. Zhang, B. Chang, Y. Shao, X. Hao, Chem. Eng. J, 2020, 383, 123130. 73 M.M. Zhu C. Zhu D. Wu X. Wang H.B. Wang J. Gao H. Huang C.F. Shi Y. Liu Z.H. Kang Nanoscale 11 2019 15984 15990 M. M. Zhu, C. Zhu, D. Wu, X. Wang, H. B. Wang, J. Gao, H. Huang, C. F. Shi, Y. Liu, Z. H. Kang, Nanoscale, 2019, 11, 15984–15990. 74 Y. Zhu T. Wan X. Wen D. Chu Y. Jiang Appl. Catal. B 244 2019 814 822 Y. Zhu, T. Wan, X. Wen, D. Chu, Y. Jiang, Appl. Catal. B, 2019, 244, 814–822. 75 M. Han H. Wang S. Zhao L. Hu H. Huang Y. Liu Inorg. Chem. Front. 4 2017 1691 1696 M. Han, H. Wang, S. Zhao, L. Hu, H. Huang, Y. Liu, Inorg. Chem. Front., 2017, 4, 1691–1696. 76 Z.Y. Mao J.J. Chen Y.F. Yang D.J. Wang L.J. Bie B.D. Fahlman ACS Appl. Mater. Interfaces 9 2017 12427 12435 Z. Y. Mao, J. J. Chen, Y. F. Yang, D. J. Wang, L. J. Bie, B. D. Fahlman, ACS Appl. Mater. Interfaces, 2017, 9, 12427–12435. 77 G. Bi J. Wen L. Xin L. Wei J. Xie Y. Fang W. Zhang RSC Adv. 6 2016 31497 31506 G. Bi, J. Wen, L. Xin, L. Wei, J. Xie, Y. Fang, W. Zhang, RSC Adv., 2016, 6, 31497–31506. 78 T. Zhu Y. Liang Y. Wang J. Wang H. Han Appl. Catal. B 271 2020 118945 T. Zhu, Y. Liang, Y. Wang, J. Wang, H. Han, Appl. Catal. B, 2020, 271, 118945. 79 R. Cao H. Yang S. Zhang X. Xu Appl. Catal. B 258 2019 117997 R. Cao, H. Yang, S. Zhang, X. Xu, Appl. Catal. B, 2019, 258, 117997. 80 C. Han L. Yan J. Zhang G. Lei Y. Li C. Chen Y. Xin L. Wu S. Fang J. Mater. Chem. A 3 2015 23274 23282 C. Han, L. Yan, J. Zhang, G. Lei, Y. Li, C. Chen, Y. Xin, L. Wu, S. Fang, J. Mater. Chem. A, 2015, 3, 23274–23282. 81 C. Han L. Wu L. Ge Y. Li Z. Zhao Carbon 92 2015 31 40 C. Han, L. Wu, L. Ge, Y. Li, Z. Zhao, Carbon, 2015, 92, 31–40. 82 N. Xiao S. Li S. Liu B. Xu Y. Li Y. Gao L. Ge G. Lu Chin. J. Catal. 40 2019 352 361 N. Xiao, S. Li, S. Liu, B. Xu, Y. Li, Y. Gao, L. Ge, G. Lu, Chin. J. Catal., 2019, 40, 352–361. 83 X.J. Wang X.L. Li C. Liu F.T. Li Y.P. Li J. Zhao R.H. Liu G.D. Li Int. J. Hydrogen Energy 43 2017 219 228 X. J. Wang, X. L. Li, C. Liu, F. T. Li, Y. P. Li, J. Zhao, R. H. Liu, G. D. Li, Int. J. Hydrogen Energy, 2017, 43, 219–228. 84 S.S. Yi J.M. Yan B.R. Wulan S.J. Li K.H. Liu Q. Jiang Appl. Catal. B 200 2017 477 483 S. S. Yi, J. M. Yan, B. R. Wulan, S. J. Li, K. H. Liu, Q. Jiang, Appl. Catal. B, 2017, 200, 477–483. 85 D. Dai H. Xu L. Ge C. Han Y. Gao S. Li Y. Lu Appl. Catal. B 217 2017 429 436 D. Dai, H. Xu, L. Ge, C. Han, Y. Gao, S. Li, Y. Lu, Appl. Catal. B, 2017, 217, 429–436. 86 X.J. Wang X. Tian Y.J. Sun J.Y. Zhu F.T. Li H.Y. Mu J. Zhao Nanoscale 10 2018 12315 12321 X. J. Wang, X. Tian, Y. J. Sun, J. Y. Zhu, F. T. Li, H. Y. Mu, J. Zhao, Nanoscale, 2018, 10, 12315–12321. 87 H. Du X. Zhang Q. Tan R.M. Kong F. Qu Chem. Commun. 53 2017 12012 12015 H. Du, X. Zhang, Q. Tan, R. M. Kong, F. Qu, Chem. Commun., 2017, 53, 12012–12015. 88 Y. Wang T. Williams T. Gengenbach B. Kong D. Zhao H. Wang C. Selomulya Nanoscale 9 2017 17349 17356 Y. Wang, T. Williams, T. Gengenbach, B. Kong, D. Zhao, H. Wang, C. Selomulya, Nanoscale, 2017, 9, 17349–17356. 89 D. Zeng W. Xu W.-J. Ong J. Xu H. Ren Y. Chen H. Zheng D.-L. Peng Appl. Catal. B 221 2018 47 55 D. Zeng, W. Xu, W.-J. Ong, J. Xu, H. Ren, Y. Chen, H. Zheng, D.-L. Peng, Appl. Catal. B, 2018, 221, 47–55. 90 X.L. Li X.J. Wang J.Y. Zhu Y.P. Li J. Zhao F.T. Li Chem. Eng. J. 353 2018 15 24 X. L. Li, X. J. Wang, J.Y. Zhu, Y. P. Li, J. Zhao, F. T. Li, Chem. Eng. J., 2018, 353, 15–24. 91 Q.D. Yue Y.Y. Wan Z.J. Sun X.J. Wu Y.P. Yu P.W. Du J. Mater. Chem. A 3 2015 16941 16947 Q. D. Yue, Y. Y. Wan, Z. J. Sun, X. J. Wu, Y. P. Yu, P. W. Du, J. Mater. Chem. A, 2015, 3, 16941–16947. 92 S. Cao Y. Chen C.J. Wang X.J. Lv W.F. Fu Chem. Commun. 51 2015 8708 8711 S. Cao, Y. Chen, C. J. Wang, X. J. Lv, W. F. Fu, Chem. Commun., 2015, 51, 8708–8711. 93 S. Panneri P. Ganguly B.N. Nair A.P. Mohamed K.G.K. Warrier U.S. Kareesh Environ. Sci.: Nano 4 2017 212 221 S. Panneri, P. Ganguly, B. N. Nair, A. P. Mohamed, K. G. K. Warrier, U. S. Kareesh, Environ. Sci.: Nano, 2017, 4, 212–221 94 L. Huang B. Li B. Su Z. Xiong C. Zhang Y. Hou Z. Ding S. Wang J. Mater. Chem. A 8 2020 7177 7183 L. Huang, B. Li, B. Su, Z. Xiong, C. Zhang, Y. Hou, Z. Ding, S. Wang, J. Mater. Chem. A, 2020, 8, 7177–7183. 95 J. Yuan J. Wen Q. Gao S. Chen J. Li X. Li Y. Fang Dalton Trans. 44 2015 1680 1689 J. Yuan, J. Wen, Q. Gao, S. Chen, J. Li, X. Li, Y. Fang, Dalton Trans., 2015, 44, 1680–1689. 96 S. Bala I. Mondal A. Goswami U. Pal R. Mondal J. Mater. Chem. A 3 2015 20288 20296 S. Bala, I. Mondal, A. Goswami, U. Pal, R. Mondal, J. Mater. Chem. A, 2015, 3, 20288–20296. 97 M.G. Wang Y.M. Hu J. Han R. Guo H.X. Xiong Y.D. Yin J. Mater. Chem. A 3 2015 20727 20735 M. G. Wang, Y. M. Hu, J. Han, R. Guo, H. X. Xiong, Y. D. Yin, J. Mater. Chem. A, 2015, 3, 20727–20735. 98 F. Caruso R.A. Caruso H. Möhwald Science 282 1998 1111 1114 F. Caruso, R. A. Caruso, H. Möhwald, Science, 1998, 282, 1111–1114. 99 X. Lai J.E. Halperf W. Dan Energy Environ. Sci. 5 2012 5604 5618 X. Lai, J. E. Halperf, W. Dan, Energy Environ. Sci., 2012, 5, 5604–5618. 100 W. Stöber A. Fink E. Bohn J. Colloid Interface Sci. 26 1968 62 69 W. Stöber, A. Fink, E. Bohn, J. Colloid Interface Sci., 1968, 26, 62–69. 101 G. Prieto H. Tüysüz N. Duyckaerts J. Knossalla G.H. Wang F. Schüth Chem. Rev. 116 2016 14056 14119 G. Prieto, H. Tüysüz, N. Duyckaerts, J. Knossalla, G. H. Wang, F. Schüth, Chem. Rev. 2016, 116, 14056–14119. 102 X.W.D. Lou L.A. Archer Z. Yang Adv. Mater. 20 2008 3987 4019 X. W. D. Lou, L. A. Archer, Z. Yang, Adv. Mater. 2008, 20, 3987–4019. 103 G. Decher Science 277 1997 1232 1237 G. Decher, Science, 1997, 277, 1232–1237. 104 W.S. Weng J. Lin Y.C. Du X.F. Ge X.S. Zhou J.C. Bao J. Mater. Chem. A 6 2018 10168 10175 W. S. Weng, J. Lin, Y.C. Du, X. F. Ge, X. S. Zhou, J. C. Bao, J. Mater. Chem. A, 2018, 6, 10168–10175. 105 J. Wang K.Y. Ma J. Zhang F. Liu J.P. Cheng J. Colloid Interface Sci. 507 2017 290 299 J. Wang, K. Y. Ma, J. Zhang, F. Liu, J. P. Cheng, J. Colloid Interface Sci., 2017, 507, 290–299. 106 Y. Zhao M. Chen L. Wu Nanotechnology 27 2016 342001 Y. Zhao, M. Chen, L. Wu, Nanotechnology, 2016, 27, 342001. 107 Z.M. Wang R. Yu Adv. Mater. 31 2018 1800592 Z. M. Wang, R. Yu, Adv. Mater., 2018, 31, 1800592. 108 B. Li H.C. Zeng Adv. Mater. 31 2019 1801104 B. Li, H. C. Zeng, Adv. Mater., 2019, 31, 1801104. 109 L. Yu H.B. Wu X. Lou Acc. Chem. Res. 50 2017 293 301 L. Yu, H. B. Wu, X. Lou, Acc. Chem. Res. 2017, 50, 293–301. 110 M. Hu S. Furukawa R. Ohtani H. Sukegawa Y. Nemoto J. Reboul S. Kitagawa Y. Yamauchi Angew. Chem. Int. Ed. 51 2012 984 988 M. Hu, S. Furukawa, R. Ohtani, H. Sukegawa, Y. Nemoto, J. Reboul, S. Kitagawa, Y. Yamauchi, Angew. Chem. Int. Ed., 2012, 51, 984–988. 111 L. Yu X.Y. Yu X.W. Lou Adv. Mater. 30 2018 1800939 L. Yu, X. Y. Yu, X. W. Lou, Adv. Mater., 2018, 30, 1800939. 112 J.W. Nai Y. Lu L. Yu X. Wang X.W. Lou Adv. Mater. 29 2017 1703870 J. W. Nai, Y. Lu, L. Yu, X. Wang, X. W. Lou, Adv. Mater., 2017, 29, 1703870. 113 L. Shen L. Yu H.B. Wu X.Y. Yu X. Zhang X.W. Lou Nat Commun 6 2015 6694 L. Shen, L. Yu, H. B. Wu, X. Y. Yu, X. Zhang, X. W. Lou, Nat Commun, 2015, 6, 6694. 114 L. Zhou D. Zhao X.W. Lou Adv. Mater. 24 2012 745 748 L. Zhou, D. Zhao, X. W. Lou, Adv. Mater., 2012, 24, 745–748. 115 S. Liu Z. Wang S. Zhou F. Yu M. Yu C.Y. Chiang W. Zhou J. Zhao J. Qiu Adv Mater 29 2017 1700874 S. Liu, Z. Wang, S. Zhou, F. Yu, M. Yu, C. Y. Chiang, W. Zhou, J. Zhao, J. Qiu, Adv Mater, 2017, 29, 1700874. 116 Y. Xia B. Cheng J. Fan J. Yu G. Liu Small 15 2019 1902459 Y. Xia, B. Cheng, J. Fan, J. Yu, G. Liu, Small, 2019, 15, 1902459. 117 C. Zhu C. Liu Y. Fu J. Gao H. Huang Y. Liu Z. Kang Appl. Catal. B 242 2019 178 185 C. Zhu, C. Liu, Y. Fu, J. Gao, H. Huang, Y. Liu, Z. Kang, Appl. Catal. B, 2019, 242, 178–185. 118 W. Zhong S. Shen M. He D. Wang Z. Wang Z. Lin W. Tu J. Yu Appl. Catal. B 258 2019 117967 W. Zhong, S. Shen, M. He, D. Wang, Z. Wang, Z. Lin, W. Tu, J. Yu, Appl. Catal. B, 2019, 258, 117967. 119 L. Ye Z. Ma Y. Deng Y. Ye W. Li M. Kou H. Xie X. Zhikun Y. Zhou D. Xia P.K. Wong Appl. Catal. B 257 2019 117897 L. Ye, Z. Ma, Y. Deng, Y. Ye, W. Li, M. Kou, H. Xie, X. Zhikun, Y. Zhou, D. Xia, P. K. Wong, Appl. Catal. B, 2019, 257, 117897. 120 H.Q. Zhang Z.P. Cai W.T. Xu X.Y. Zhang M.L. Huang X.X. Wang Catal. Commun. 120 2019 51 54 H. Q. Zhang, Z. P. Cai, W. T. Xu, X. Y. Zhang, M. L. Huang, X. X. Wang, Catal. Commun., 2019, 120, 51–54. 121 Y. Hu X. Hao Z. Cui J. Zhou S. Chu Y. Wang Z. Zou Appl. Catal. B 260 2020 118131 Y. Hu, X. Hao, Z. Cui, J. Zhou, S. Chu, Y. Wang, Z. Zou, Appl. Catal. B, 2020, 260, 118131. 122 R. Xiao C. Zhao Z. Zou Z. Chen L. Tian H. Xu H. Tang Q. Liu Z. Lin X. Yang Appl. Catal. B 268 2019 118382 R. Xiao, C. Zhao, Z. Zou, Z. Chen, L. Tian, H. Xu, H. Tang, Q. Liu, Z. Lin, X. Yang, Appl. Catal. B, 2019, 268, 118382. 123 H. Wang J.T. Zheng X. Zheng Appl. Mech. Mater. 700 2015 302 305 H. Wang, J. T. Zheng, X. Zheng, Appl. Mech. Mater., 2015, 700, 302–305. 124 Y.L. Li T. Jin G. Ma Y. Li L. Fan X. Li Dalton Trans. 48 2019 5649 5655 Y. L. Li, T. Jin, G. Ma, Y. Li, L. Fan, X. Li, Dalton Trans., 2019, 48, 5649–5655. 125 C.C. Yin L.F. Cui T.T. Pu X.Y. Fang H.C. Shi S.F. Kang X.D. Zhang Appl. Surf. Sci. 456 2018 464 472 C. C.Yin, L. F. Cui, T. T. Pu, X. Y. Fang, H. C. Shi, S. F. Kang, X. D. Zhang, Appl. Surf. Sci., 2018, 456, 464–472. 126 Z. Yong J. Lei Adv. Mater. 21 2009 3621 3638 Z. Yong, J. Lei, Adv. Mater., 2009, 21, 3621–3638. 127 G. Lin J. Zheng R. Xu J. Phys. Chem. C 112 2008 7363 7370 G. Lin, J. Zheng, R. Xu, J. Phys. Chem. C, 2008, 112, 7363–7370. 128 J.X. Huang X. Yi B. Li Yu. Liu S.Y. Zhang Cheminform 31 2010 200033232 J. X. Huang, X. Yi, B. Li, Yu. Liu, S. Y. Zhang, Cheminform, 2010, 31, 200033232. 129 D. Wu X. Ge Z. Zhang M. Wang S. Zhang Langmuir 20 2004 5192 5195 D. Wu, X. Ge, Z. Zhang, M. Wang, S. Zhang, Langmuir, 2004, 20, 5192–5195. 130 M. Luo Y. Liu J. Hu H. Liu J. Li ACS Appl. Mater. Interfaces 4 2012 1813 1821 M. Luo, Y. Liu, J. Hu, H. Liu, J. Li, ACS Appl. Mater. Interfaces, 2012, 4, 1813–1821. 131 Y. Liu C. Huang T. Zhou J. Hu CrystEngComm 22 2020 1057 1062 Y. Liu, C. Huang, T. Zhou, J. Hu, CrystEngComm, 2020, 22, 1057–1062. 132 X.L. Li G.Q. Yang S.S. Li N. Xiao N. Li Y.Q. Gao D. Lv L. Ge Chem. Eng. J. 379 2020 122350 X. L. Li, G.Q. Yang, S. S. Li, N. Xiao, N. Li, Y. Q. Gao, D. Lv, L. Ge, Chem. Eng. J., 2020, 379, 122350. 133 H. Wang T. Jin X. Zheng B. Jiang C. Zhu X. Yuan J. Zheng M. Wu J. Nanopart. Res. 18 2016 1 13 H. Wang, T. Jin, X. Zheng, B. Jiang, C. Zhu, X. Yuan, J. Zheng, M. Wu, J. Nanopart. Res., 2016, 18, 1–13. 134 H. Li J. Pan W. Zhao C. Li Appl. Surf. Sci. 497 2019 143769 H. Li, J. Pan, W. Zhao, C. Li, Appl. Surf. Sci., 2019, 497, 143769. 135 Y.L. Li T. Jin G. Ma Y. Li L. Fan X. Li Dalton Trans. 48 2019 5649 5655 Y. L. Li, T. Jin, G. Ma, Y. Li, L. Fan, X. Li, Dalton Trans., 2019, 48, 5649–5655. 136 P. Zhang D.Y. Luan X.W. (David) Lou Adv. Mater. 32 2020 2004561 P. Zhang, D. Y. Luan, X. W. (David) Lou, Adv. Mater., 2020, 32, 2004561. 137 J. Chen J. Chen Y. Li J. Mater. Chem. A 5 2017 24116 24125 J. Chen, J. Chen, Y. Li, J. Mater. Chem. A, 2017, 5, 24116–24125. 138 X. Wang J. Chen X. Guan L. Guo Int. J. Hydrogen Energy 40 2015 7546 7552 X. Wang, J. Chen, X. Guan, L. Guo, Int. J. Hydrogen Energy, 2015, 40, 7546–7552. 139 C.F. Lin X.P. Chen S. Chen W.F. Shangguan Acta Phys.-Chim. Sin. 31 2015 153 158 C. F. Lin, X. P. Chen, S. Chen, W. F. Shangguan, Acta Phys.-Chim. Sin., 2015, 31, 153–158. 140 J. Qiu X.F. Zhang X. Zhang Y. Feng Y. Li L. Yang H. Lu J. Yao J. Hazard. Mater. 349 2018 234 241 J. Qiu, X. F. Zhang, X. Zhang, Y. Feng, Y. Li, L. Yang, H. Lu, J. Yao, J. Hazard. Mater., 2018, 349, 234–241. 141 Q. Li H. Meng P. Zhou Y. Zheng J. Wang J. Yu J.R. Gong ACS Catal. 3 2013 882 889 Q. Li, H. Meng, P. Zhou, Y. Zheng, J. Wang, J. Yu, J. R. Gong, ACS Catal. 2013, 3, 882–889 . 142 W. Xue X. Hu E. Liu J. Fan Appl. Surf. Sci. 447 2018 783 794 W. Xue, X. Hu, E. Liu, J. Fan, Appl. Surf. Sci., 2018, 447, 783–794. 143 Z. Jin T. Wei L. Lixue F. Li R. Tao L. Xu Dalton Trans. 48 2019 2676 2682 Z. Jin, T. Wei, L. Lixue, F. Li, R. Tao, L. Xu, Dalton Trans., 2019, 48, 2676–2682. 144 L. Yao D. Wei Y. Ni D. Yan C. Hu Nano Energy 26 2016 248 256 L. Yao, D. Wei, Y. Ni, D. Yan, C. Hu, Nano Energy, 2016, 26, 248–256. 145 D. Huang M. Wen C. Zhou Z. Li M. Cheng S. Chen W. Xue L. Lei Y. Yang W. Xiong W. Wang Appl. Catal. B 267 2020 118651 D. Huang, M. Wen, C. Zhou, Z. Li, M. Cheng, S. Chen, W. Xue, L. Lei, Y. Yang, W. Xiong, W. Wang, Appl. Catal. B, 2020, 267, 118651. 146 H. Li G. Wang X. Zhang Z. Jin Int. J. Hydrogen Energy 45 2020 8405 8417 H. Li, G. Wang, X. Zhang, Z. Jin, Int. J. Hydrogen Energy, 2020, 45, 8405–8417. 147 C. Zhang W. Wang M. Zhao J. Zhang Z. Zha S. Cheng H. Zheng H. Qian J. Colloid Interface Sci. 546 2019 303 311 C. Zhang, W. Wang, M. Zhao, J. Zhang, Z. Zha, S. Cheng, H. Zheng, H. Qian, J. Colloid Interface Sci., 2019, 546, 303–311. 148 C. Zhang H. Liu W. Wang H. Qian S. Cheng Y. Wang Z. Zha Y. Zhong Y. Hu Appl. Catal. B 239 2018 309 316 C. Zhang, H. Liu, W. Wang, H. Qian, S. Cheng, Y. Wang, Z. Zha, Y. Zhong, Y. Hu, Appl. Catal. B, 2018, 239, 309–316. 149 C. Liu H. Huang L. Ye S. Yu N. Tian X. Du T. Zhang Y. Zhang Nano Energy 2017 738 748 C. Liu, H. Huang, L. Ye, S. Yu, N. Tian, X. Du, T. Zhang, Y. Zhang, Nano Energy, 2017, 738–748. 150 G.G. Liu G.X. Zhao W. Zhou Y.Y. Liu H. Pang H. Zhang D. Hao X. Meng P. Li T. Kako J. Ye Adv. Funct. Mater. 26 2016 6822 6829 G. G. Liu, G. X. Zhao, W. Zhou, Y. Y. Liu, H. Pang, H. Zhang, D. Hao, X. Meng, P. Li, T. Kako, J. Ye, Adv. Funct. Mater., 2016, 26, 6822–6829. 151 Q. Han B. Wang J. Gao Z. Cheng Y. Zhao Z. Zhang L. Qu ACS Nano 10 2016 2745 2751 Q. Han, B. Wang, J. Gao, Z. Cheng, Y. Zhao, Z. Zhang, L. Qu, ACS Nano, 2016, 10, 2745–2751. 152 Q. Li Z. Sun H. Wang Z. Wu J. CO2 Util. 28 2018 126 136 Q. Li, Z. Sun, H. Wang, Z. Wu, J. CO2 Util., 2018, 28, 126–136. 153 C. Ye J. Li Z. Li X. Li X. Fan L. Zhang B. Chen C. Tung L. Wu ACS Catal. 5 2015 6973 6979 C. Ye, J. Li, Z. Li, X. Li, X. Fan, L. Zhang, B. Chen, C. Tung, L. Wu, ACS Catal., 2015, 5, 6973–6979. 154 S. Zhao Y. Zhang Y. Zhou Y. Wang X. Sheng Carbon 126 2018 247 256 S. Zhao, Y. Zhang, Y. Zhou, Y. Wang, X. Sheng, Carbon, 2018, 126, 247–256. 155 D.D. Zheng X.N. Cao X.C. Wang Angew. Chem. 55 2016 11512 11516 D. D. Zheng, X. N. Cao, X. C. Wang, Angew. Chem., 2016, 55, 11512–11516. 156 Y. Sun S. Shao Y. Wang W. Lu P. Zhang Q. Yao Int. J. Hydrogen Energy 45 2019 2840 2851 Y. Sun, S. Shao, Y. Wang, W. Lu, P. Zhang, Q. Yao, Int. J. Hydrogen Energy, 2019, 45, 2840–2851. 157 Y.M. Chen Z. Li W.X. Lou Angew. Chem., Int. Ed. 54 2015 10521 10524 Y. M. Chen, Z. Li, W. X. Lou, Angew. Chem., Int. Ed., 2015, 54, 10521–10524. 158 W. Peng S.S. Zhang Y.B. Shao J.H. Huang Int. J. Hydrogen Energy 43 2018 22215 22225 W. Peng, S. S. Zhang, Y. B. Shao, J. H. Huang, Int. J. Hydrogen Energy, 2018, 43, 22215–22225. 159 Y. Dong D. Wang H. Zhang Y. Chen W. Liu Y. Wang Mater. Lett. 196 2017 100 103 Y. Dong, D. Wang, H. Zhang, Y. Chen, W. Liu, Y. Wang, Mater. Lett., 2017, 196, 100–103. 160 J. Gao Y. Zhou Z. Li S. Yan N. Wang Z. Zou Nanoscale 4 2012 3687 3692 J. Gao, Y. Zhou, Z. Li, S. Yan, N. Wang, Z. Zou, Nanoscale, 2012, 4, 3687–3692. 161 M. Tahir C. Cao F.K. Butt F. Idrees N. Mahmood Z. Ali I. Aslam M. Tanveer M. Rizwan T. Mahmood J. Mater. Chem. A 1 2013 13949 13955 M. Tahir, C. Cao, F. K. Butt, F. Idrees, N. Mahmood, Z. Ali, I. Aslam, M. Tanveer, M. Rizwan, T. Mahmood, J. Mater. Chem. A, 2013, 1, 13949–13955. 162 F.K. Mohamad Alosfur N.J. Ridha M.H. Haji Jumali S. Radiman Nanotechnology 29 2018 145707 F. K. Mohamad Alosfur, N. J. Ridha, M. H. Haji Jumali, S. Radiman, Nanotechnology, 2018, 29, 145707. 163 O. Al-Madanat Y. Alsalka R. Dillert D.W. Bahnemann Catalysts 11 2021 107 O. Al-Madanat, Y. Alsalka, R. Dillert, D. W. Bahnemann, Catalysts, 2021, 11, 107. 164 L. Qi B. Cheng J. Yu W. Ho J. Hazard. Mater. 301 2016 522 530 L. Qi, B. Cheng, J. Yu, W. Ho, J. Hazard. Mater., 2016, 301, 522–530. 165 A. Ziarati A. Badiel R. Lugue Appl. Catal. B 238 2018 177 183 A. Ziarati, A. Badiel, R. Lugue, Appl. Catal. B, 2018, 238, 177–183. 166 G. Liu L. Wang H. Yang H.M. Cheng G.Q. Lu J. Mater. Chem. 20 2010 831 843 G. Liu, L. Wang, H. Yang, H. M. Cheng, G. Q. Lu, J. Mater. Chem., 2010, 20, 831–843 167 G. Liu H.G. Yang J. Pan Y.Q. Yang G.Q. Lu H.M. Cheng Chem. Rev. 114 2014 9559 9612 G. Liu, H. G. Yang, J. Pan, Y. Q. Yang, G. Q. Lu, H. M. Cheng, Chem. Rev., 2014, 114, 9559–9612. 168 Y. Shiraishi T. Hirai J. Photochem. Photobiol. C 9 2008 157 170 Y. Shiraishi, T. Hirai, J. Photochem. Photobiol. C, 2008, 9, 157–170. 169 J. Lim S.H. Kim R.A. Armengol O. Kasian P.P. Choi L.T. Stephenson B. Gault C. Scheu Angew. Chem., Int. Ed. 59 2020 5651 5655 J. Lim, S. H. Kim, R. A. Armengol, O. Kasian, P. P. Choi, L. T. Stephenson, B. Gault, C. Scheu, Angew. Chem., Int. Ed., 2020, 59, 5651–5655. 170 D.N. Zhang X.Y. Ma H.W. Zhang Y.L. Liao Q.J. Xiang Mater. Today Energy 10 2018 132 140 D. N. Zhang, X. Y. Ma, H. W. Zhang, Y. L. Liao, Q. J. Xiang, Mater. Today Energy, 2018, 10, 132–140. 171 Z.L. Niu S.S. Yi C.Q. Li Y. Liu Q.Q. Pang Z.Y. Liu X.Z. Yue Chem. Eng. J. 390 2020 124602 Z. L. Niu, S. S. Yi, C. Q. Li, Y. Liu, Q. Q. Pang, Z. Y. Liu, X. Z. Yue, Chem. Eng. J., 2020, 390, 124602. 172 R. Wu G.C. Fan L.P. Jiang J.J. Zhu ACS Appl. Mater. Interfaces 10 2018 4429 4438 R. Wu, G. C. Fan, L. P. Jiang, J. J. Zhu, ACS Appl. Mater. Interfaces, 2018, 10, 4429–4438. 173 W. Li J. Yang Z. Wu J. Wang B. Li S. Feng Y. Deng F. Zhang D. Zhao J. Am. Chem. Soc. 134 2012 11864 11867 W. Li, J. Yang, Z. Wu, J. Wang, B. Li, S. Feng, Y. Deng, F. Zhang, D. Zhao, J. Am. Chem. Soc., 2012, 134, 11864–11867. 174 D.T. Nguyen K.S. Kim Chem. Eng. J. 286 2016 266 271 D. T. Nguyen, K. S. Kim, Chem. Eng. J., 2016, 286, 266–271. 175 C. Zhang Y. Zhou Y. Zhang S. Zhao J. Fang X. Sheng T. Zhang H. Zhang Chem. Eur. J. 23 2017 4336 4343 C. Zhang, Y. Zhou, Y. Zhang, S. Zhao, J. Fang, X. Sheng, T. Zhang, H. Zhang, Chem. Eur. J., 2017, 23, 4336–4343. 176 J.D. Wang X. Xiao Y. Liu K.M. Pan H. Pang S.Z. Wei J. Mater. Chem. A 7 2019 17675 17702 J. D.Wang, X. Xiao, Y. Liu, K. M. Pan, H. Pang, S. Z. Wei, J. Mater. Chem. A, 2019, 7, 17675–17702. 177 W. Zhao T. She J. Zhang G. Wang D. Leung J. Mater. Sci. Nanotechnol. 85 2021 18 29 W. Zhao, T. She, J. Zhang, G. Wang, D. Leung, J. Mater. Sci. Nanotechnol., 2021, 85, 18–29. 178 X.J. Wen C.G. Niu L. Zhang C. Liang G.M. Zeng Appl. Catal. B 221 2018 71 714 X. J. Wen, C. G. Niu, L. Zhang, C. Liang, G. M. Zeng, Appl. Catal. B, 2018, 221, 71–714. 179 X.Y. Yang Y.M. Zhang Y.L. Wang C.L. Xin P. Zhang D. Liu B.B. Mamba K.K. Kefeni A.T. Kuvarega J.Z. Gui Chem. Eng. J. 387 2020 124100 X. Y. Yang, Y. M. Zhang, Y. L. Wang, C. L. Xin, P. Zhang, D. Liu, B. B. Mamba, K. K. Kefeni, A. T. Kuvarega, J. Z. Gui, Chem. Eng. J., 2020, 387, 124100. 180 Q.Q. Li L.P. Song Z. Liang M.Z. Sun T. Wu B.L. Huang Feng Luo Y.P. Du C.H. Yan Adv. Energy Sustainability Res. 2 2021 2000063 Q. Q. Li, L. P. Song, Z. Liang, M. Z. Sun, T. Wu, B. L. Huang, Feng Luo, Y. P. Du, C. H. Yan, Adv. Energy Sustainability Res., 2021, 2, 2000063. 181 G. Chen S. Sun X. Sun W. Fan T. You Inorg. Chem. 48 2009 1334 1338 G. Chen, S. Sun, X. Sun, W. Fan, T. You, Inorg. Chem., 2009, 48, 1334–1338. 182 S. Liu M. Xie X. Guo W. Ji Mater. Lett. 105 2013 192 195 S. Liu, M. Xie, X. Guo, W. Ji, Mater. Lett., 2013, 105, 192–195. 183 S. Fang Y. Xin L. Ge C. Han P. Qiu L. Wu Appl. Catal. B 179 2015 458 467 S. Fang, Y. Xin, L. Ge, C. Han, P. Qiu, L. Wu, Appl. Catal. B, 2015, 179, 458–467. 184 J.N. Dong J.Y. Huang A. Wang G.V. Biesold-McGee X.N. Zhang S.W. Gao S.C. Wang Y.K. Lai Z.Q. Lin Nano Energy 71 2020 104579 J. N. Dong, J. Y. Huang, A. Wang, G. V. Biesold-McGee, X. N. Zhang, S. W. Gao, S. C. Wang, Y. K. Lai, Z. Q. Lin, Nano Energy, 2020, 71, 104579. 185 C.R. López E.P. Melián J.A. Ortega Méndez D.E. Santiago J.M. Pona Rodríguez O. Gonzalez Díaz J. Photochem. Photobiol. A 2015 45 54 C. R. López, E. P. Melián, J. A. Ortega Méndez, D. E. Santiago, J. M. Pona Rodríguez, O. Gonzalez Díaz, J. Photochem. Photobiol. A, 2015, 45–54. 186 X. Chen W.W. Zhang L.X. Zhang L.P. Feng J.W. Wen J.J. Yang C.X. Zhang J. Jiang H. Wang Appl. Surf. Sci. 497 2019 143771 X. Chen, W. W. Zhang, L. X. Zhang, L. P. Feng, J. W. Wen, J. J. Yang, C. X. Zhang, J. Jiang, H. Wang, Appl. Surf. Sci., 2019, 497, 143771. 187 X. Meng Z. Li Z. Zhang J. Catal. 356 2017 53 64 X. Meng, Z. Li, Z. Zhang, J. Catal., 2017, 356, 53–64. 188 J. Park S. Lee H. Kim A. Cho S. Kim Y. Ye J. Han H. Lee J. Jang J. Lee J. Jang J. Lee Angew. Chem., Int. Ed. 58 2019 16038 16042 J. Park, S. Lee, H. Kim, A. Cho, S. Kim, Y. Ye, J. Han. H. Lee, J. Jang, J. Lee, J. Jang, J. Lee, Angew. Chem., Int. Ed., 2019, 58, 16038–16042. 189 N. Celebi M.Y. Aydin F. Soysal Y.O. Ciftci K. Salimi J. Alloys Compd. 860 2021 157908 N. Celebi, M. Y. Aydin, F. Soysal, Y. O.Ciftci, K. Salimi, J. Alloys Compd., 2021, 860, 157908. 190 N. Chang Y.R. Chen F. Xie Y.P. Liu H.T. Wang Colloids Surf. A 616 2021 126351 N. Chang, Y. R. Chen, F. Xie, Y. P. Liu, H. T. Wang, Colloids Surf. A, 2021, 616, 126351. 191 P. Li L. Liu W. An H. Wang W. Cui Appl. Catal. B 266 2020 118618 P. Li, L. Liu, W. An, H. Wang, W. Cui, Appl. Catal. B, 2020, 266, 118618. 192 S. Patnaik D.P. Sahoo K.M. Parida J Colloid Interface Sci. 560 2020 519 535 S. Patnaik, D. P. Sahoo, K. M. Parida, J Colloid Interface Sci., 2020, 560, 519–535. 193 Z. Chen J. Pan J. Mei Q. Yu P. Wang P. Wang J. Wang C. Song Y. Zheng C. Li J. Environ. Chem. Eng. 9 2020 104895 Z. Chen, J. Pan, J. Mei, Q. Yu, P. Wang, P. Wang, J. Wang, C. Song, Y. Zheng, C. Li, J. Environ. Chem. Eng., 2020, 9, 104895. 194 T.F. Wu J.F. Huang G. Cheng Y.W. Pang Mater. Lett. 292 2021 129274 T. F. Wu, J. F. Huang, G. Cheng, Y. W. Pang, Mater. Lett., 2021, 292, 129274. 195 T. Yu Z. Li Z. Lv X. Liu G. Wang G. Xie L. Jiang Appl. Surf. Sci. 509 2020 145371 T. Yu, Z. Li, Z. Lv, X. Liu, G. Wang, G. Xie, L. Jiang, Appl. Surf. Sci., 2020, 509, 145371. 196 H. Xu S. Li L. Ge C. Han Y. Gao D. Dai Int. J. Hydrogen Energy 42 2017 22877 22886 H. Xu, S. Li, L. Ge, C. Han, Y. Gao, D. Dai, Int. J. Hydrogen Energy, 2017, 42, 22877–22886. 197 W.B. Li K. Fang Y.G. Zhang Z.W. Chen L. Wang Y.Y. Bu Int. J. Hydrogen Energy 46 2021 9351 9359 W. B. Li, K. Fang, Y. G. Zhang, Z. W. Chen, L. Wang, Y. Y. Bu, Int. J. Hydrogen Energy, 2021, 46, 9351–9359. 198 Y.H. Song Z. Mo J.J. Fu X.N. Zhang X. She J.J. Yuan H.X. Chen J.C. Qian C.Q. Zhou Y.S. Wu W.S. Yang H.M. Li Colloids Surf. A 617 2021 126151 Y. H. Song, Z. Mo, J. J. Fu, X. N. Zhang, X. She, J. J. Yuan, H. X. Chen, J. C. Qian, C. Q. Zhou, Y. S. Wu, W. S. Yang, H. M. Li, Colloids Surf. A, 2021, 617, 126151. 199 B. Qiu Q. Zhu M. Du L. Fan P. Xing P. Zhang Angew. Chem. Int. Ed. 56 2017 2684 2688 B. Qiu, Q. Zhu, M. Du, L. Fan, P. Xing, P. Zhang, Angew. Chem. Int. Ed., 2017, 56, 2684–2688. 200 S. Wang B.Y. Guan X. Wang X.W.D. Lou J. Am. Chem. Soc. 140 2018 15145 15148 S. Wang, B. Y. Guan, X. Wang, X. W. D. Lou, J. Am. Chem. Soc., 2018, 140, 15145–15148. 201 X.L. Li R.B. He Y.J. Dai S.S. Li N. Xiao A.X. Wang Y.Q. Gao N. Li J.F. Gao L.H. Zhang L. Ge Chem. Eng. J. 400 2020 125474 X. L. Li, R. B. He, Y. J. Dai, S. S. Li, N. Xiao, A. X. Wang, Y. Q. Gao, N. Li, J. F. Gao, L. H. Zhang, L. Ge, Chem. Eng. J., 2020, 400, 125474. 202 G. Zhang D. Chen N. Li Q. Xu H. Li J. He J. Lu Angew. Chem., Int. Ed. 59 2020 8255 8261 G. Zhang, D. Chen, N. Li, Q. Xu, H. Li, J. He, J. Lu, Angew. Chem., Int. Ed., 2020, 59, 8255–8261. 203 J. Fu C. Bie B. Cheng C. Jiang J. Yu ACS Sustainable Chem. Eng. 6 2018 2767 2779 J. Fu, C. Bie, B. Cheng, C. Jiang, J. Yu, ACS Sustainable Chem. Eng., 2018, 6, 2767–2779. 204 L. Jiang K. Wang X. Wu G. Zhang S. Yin ACS Appl. Mater. Interfaces 11 2019 26898 26908 L. Jiang, K. Wang, X. Wu, G. Zhang, S. Yin, ACS Appl. Mater. Interfaces, 2019, 11, 26898–26908. 205 D. Zeng L. Xiao W.J. Ong P. Wu H. Zheng Y. Chen D.L. Peng ChemSusChem 10 2017 4624 4631 D. Zeng, L. Xiao, W. J. Ong, P. Wu, H. Zheng, Y. Chen, D. L. Peng, ChemSusChem, 2017, 10, 4624–4631. 206 S. Yang C. Shao X. Li X. Zhou X. Li J. Zhang R. Tao Y. Liu J. Colloid Interface Sci. 518 2018 1 10 S. Yang, C. Shao, X. Li, X. Zhou, X. Li, J. Zhang, R. Tao, Y. Liu, J. Colloid Interface Sci., 2018, 518, 1–10. 207 Y. Wang J. Zhao Z. Chen F. Zhang W. Guo H. Lin F. Qu Appl. Catal. B 244 2019 76 86 Y. Wang, J. Zhao, Z. Chen, F. Zhang, W. Guo, H. Lin, F. Qu, Appl. Catal. B, 2019, 244, 76–86. 208 L. Xin J. Yu S. Wageh A.A. Al-Ghamdi J. Xie Small 12 2016 6640 6696 L. Xin, J. Yu, S. Wageh, A. A. Al-Ghamdi, J. Xie, Small, 2016, 12, 6640–6696. 209 Z. Lin C. Shao S. Jiang C. Sun S. Song Appl. Catal. B 268 2020 118742 Z. Lin, C. Shao, S. Jiang, C. Sun, S. Song, Appl. Catal. B, 2020, 268, 118742. 210 S. Wang Y. Wang S.L. Zhang S.Q. Zang X.W.D. Lou Adv. Mater. 31 2019 1903404 S. Wang, Y. Wang, S. L. Zhang, S. Q. Zang, X. W. D. Lou, Adv. Mater., 2019, 31, 1903404. 211 S. Liu Z. Wang S. Zhou F. Yu M. Yu C.Y. Chiang W. Zhou J. Zhao J. Qiu Adv. Mater. 18 2017 1700874 S. Liu, Z. Wang, S. Zhou, F. Yu, M. Yu, C. Y. Chiang, W. Zhou, J. Zhao, J. Qiu, Adv. Mater., 2017, 18, 1700874. 212 Y. Liu H. Jiang Y. Zhu X. Yang C. Li J. Mater. Chem. A 4 2016 1694 1701 Y. Liu, H. Jiang, Y. Zhu, X. Yang, C. Li, J. Mater. Chem. A, 2016, 4, 1694–1701. 213 W. Li Y. Hu H. Jiang S. Yang C. Li Mater. Chem. Phys. 226 2019 158 168 W. Li, Y. Hu, H. Jiang, S. Yang, C. Li, Mater. Chem. Phys., 2019, 226, 158–168. 214 Y.D. Zhang L. Liang Z.Y. Chen J.J. Wen W. Zhong S.B. Zou M.L. Fu L.M. Chen D.Q. Ye Appl. Surf. Sci. 516 2020 146035 Y. D. Zhang, L. Liang, Z. Y. Chen, J. J. Wen, W. Zhong, S. B. Zou, M. L. Fu, L. M. Chen, D. Q. Ye, Appl. Surf. Sci., 2020, 516, 146035. 215 S. Song X. Liu J. Li J. Pan F. Wang Y. Xing X. Wang X. Liu H. Zhang Adv. Mater. 29 2017 1700495 S. Song, X. Liu, J. Li, J. Pan, F. Wang, Y. Xing, X. Wang, X. Liu, H. Zhang, Adv. Mater., 2017, 29, 1700495. 216 J. He D. Chen N. Li Q. Xu H. Li J. He J. Lu ChemSusChem 12 2019 1084 1090 J. He, D. Chen, N. Li, Q. Xu, H. Li, J. He, J. Lu, ChemSusChem, 2019, 12, 1084–1090. 217 N. Feng Z. Zhu P. Zhao L. Wang H. Wan G. Guan Appl. Surf. Sci. 515 2020 146013 N. Feng, Z. Zhu, P. Zhao, L. Wang, H. Wan, G. Guan, Appl. Surf. Sci., 2020, 515, 146013. 218 C. Jiang H. Wang Y. Wang H. Ji Appl. Catal., B 277 2020 119235 C. Jiang, H. Wang, Y. Wang, H. Ji, Appl. Catal., B, 2020, 277, 119235. 219 N.C. Zheng T.O. Yang Y.B. Chen Z. Wang D.Y. Chen Z.Q. Liu Catal. Sci. Technol. 9 2019 1357 1364 N. C. Zheng,T. O. Yang, Y. B. Chen, Z. Wang, D. Y. Chen, Z. Q. Liu, Catal. Sci. Technol., 2019, 9, 1357–1364. 220 M. Wang J. Han Y. Hu R. Guo Y. Yin ACS Appl. Mater. Interfaces 8 2016 29511 29521 M. Wang, J. Han, Y. Hu, R. Guo, Y. Yin, ACS Appl. Mater. Interfaces, 2016, 8, 29511–29521. 221 E. Zhang Q. Zhu J. Huang J. Liu G. Tan C. Sun T. Li S. Liu Y. Li H. Wang X. Wan Z. Wen F. Fan J. Zhang K. Ariga Appl. Catal. B 7 2021 120213 E. Zhang, Q. Zhu, J. Huang, J. Liu, G. Tan, C. Sun, T. Li, S. Liu, Y. Li, H. Wang, X. Wan, Z. Wen, F. Fan, J. Zhang, K. Ariga, Appl. Catal. B, 2021, 7, 120213. 222 B. Cao G.S. Li H.X. Li Appl. Catal. B 194 2016 42 49 B. Cao, G. S. Li, H. X. Li, Appl. Catal. B, 2016, 194, 42–49. 223 Q. Jiang L. Li J. Bi S. Liang M. Liu Nanomater. 7 2017 24 Q. Jiang, L. Li, J. Bi, S. Liang, M. Liu, Nanomater., 2017, 7, 24. 224 A. Li T. Wang X.X. Chang W.T. Cai P. Zhang J.J. Zhang J.L. Gong Chem. Sci. 7 2016 890 895 A. Li, T. Wang, X. X. Chang, W. T. Cai,P. Zhang, J. J. Zhang, J. L. Gong, Chem. Sci., 2016, 7,890–895. 225 Q. Sun N. Wang J. Yu J.C. Yu Adv. Mater. 30 2018 1804368 Q. Sun, N. Wang, J. Yu, J. C. Yu, Adv. Mater., 2018, 30, 1804368. 226 M. Xing B. Qiu M. Du Q. Zhu L. Wang J. Zhang Adv. Funct. Mater. 27 2017 1702244 M. Xing, B. Qiu, M. Du, Q. Zhu, L. Wang, J. Zhang, Adv. Funct. Mater., 2017, 27, 1702244. 227 A. Li X. Chang Z. Huang C. Li Y.J. Wei L. Zhang T. Wang J.L. Gong Angew. Chem. Int. Ed. 55 2016 13734 13738 A. Li, X. Chang, Z. Huang, C. Li, Y. J. Wei, L. Zhang, T. Wang, J. L. Gong, Angew. Chem. Int. Ed., 2016, 55, 13734–13738. 228 Z. Wang W. Wu Q. Xu G. Li S. Liu X. Jia Y. Qin Z.L. Wang Nano Energy 38 2017 518 525 Z. Wang, W. Wu, Q. Xu, G. Li, S. Liu, X. Jia, Y. Qin, Z. L. Wang, Nano Energy, 2017, 38, 518–525. 229 Z. Jiang X. Liang H. Zheng Y. Liu Z. Wang P. Wang X. Zhang X. Qin Y. Dai M.H. Whangbo B. Huang Appl. Catal. B 219 2017 209 215 Z. Jiang, X. Liang, H. Zheng, Y. Liu, Z. Wang, P. Wang, X. Zhang, X. Qin, Y. Dai, M. H. Whangbo, B. Huang, Appl. Catal. B, 2017, 219, 209–215. 230 L.Y. Lin S. Kavadiya B.B. Karakocak Y. Nie R. Raliya S.T. Wang M.Y. Berezin P. Biswas Appl. Catal. B 230 2018 36 48 L. Y. Lin, S. Kavadiya, B. B. Karakocak, Y. Nie, R. Raliya, S. T. Wang, M. Y. Berezin, P. Biswas, Appl. Catal. B, 2018, 230, 36–48. 231 M. Liang T. Borjigin Y. Zhang B. Liu H. Liu H. Guo Appl. Catal. B 243 2019 566 575 M. Liang, T. Borjigin, Y. Zhang, B. Liu, H. Liu, H. Guo, Appl. Catal. B, 2019, 243, 566–575. 232 C. Bie B. Zhu F. Xu L. Zhang J. Yu Adv. Mater. 31 2019 1902868 C. Bie, B. Zhu, F. Xu, L. Zhang, J. Yu, Adv. Mater., 2019, 31, 1902868. 233 S. Zhu W. Liao M. Zhang S. Liang Chem. Eng. J. 361 2019 461 469 S. Zhu, W. Liao, M. Zhang, S. Liang, Chem. Eng. J., 2019, 361, 461–469 234 A. Banitalebi Dehkordi A. Ziarati J.B. Ghasemi A. Badiei Sol. Energy 205 2020 465 473 A. Banitalebi Dehkordi, A. Ziarati, J. B. Ghasemi, A. Badiei, Sol. Energy, 2020, 205, 465–473. 235 Y.X. Li S.Y. Fan J.C. Mu Z.F. Yin H.F. Ma S.B. Wang J. Colloid Interface Sci. 552 2019 476 484 Y. X. Li, S. Y. Fan, J. C. Mu, Z. F. Yin, H. F. Ma, S. B. Wang, J. Colloid Interface Sci., 2019, 552, 476–484. 236 J.L. Zhao Z.R. Miao Y.F. Zhang G.Y. Wen L.H. Liu X.X. Wang X.Z. Cao B.Y. Wang J. Colloid Interface Sci. 593 2021 231 243 J. L. Zhao, Z. R. Miao, Y. F. Zhang, G. Y. Wen, L. H. Liu, X. X. Wang, X. Z. Cao, B. Y. Wang, J. Colloid Interface Sci., 2021, 593, 231–243. 237 M.C. Gao D.F. Zhang X.P. Pu M.T. Li Y.M. Yu J.J. Shim P.Q. Cai S. Kim H.J. Seo J. Am. Ceram. Soc. 98 2015 1515 1519 M. C. Gao, D. F. Zhang, X. P. Pu, M. T. Li, Y. M. Yu, J. J. Shim, P. Q. Cai, S. Kim, H. J. Seo, J. Am. Ceram. Soc., 2015, 98, 1515–1519. 238 H. Maimaitizi A. Abulizi K. Kadeer D. Talifu Y. Tursun Appl. Surf. Sci. 502 2020 144083 H. Maimaitizi, A. Abulizi, K. Kadeer, D. Talifu, Y. Tursun, Appl. Surf. Sci., 2020, 502, 144083. 239 J.Q. He D.Y. Chen N.J. Li Q.F. Xu H. Li J.H. He J.M. Lu ChemSusChem 12 2019 1084 1090 J. Q. He, D. Y. Chen, N. J. Li, Q. F. Xu, H. Li, J. H. He, J. M. Lu, ChemSusChem, 2019, 12, 1084–1090. 240 C.Z. Wei X. Zheng R. Li X.R. Wang Z.Y. Xaio L. Wang ChemistrySelect 4 2019 11149 11155 C. Z. Wei, X. Zheng, R. Li, X. R. Wang, Z. Y. Xaio, L. Wang, ChemistrySelect, 2019, 4, 11149–11155. 241 Z. Li M. Song W.Y. Zhu W.C. Zhuang X.H. Du L. Tian Coord. Chem. Rev. 439 2021 213946 Z. Li, M. Song, W. Y. Zhu, W. C. Zhuang, X. H. Du, L. Tian, Coord. Chem. Rev., 2021, 439, 213946. 242 Y. Zhang W.B. Qiu Y.J. Ma Y.L. Luo Z.Q. Tian G.W. Cui F.Y. Xie L. Chen T.S. Li X.P. Sun ACS Catal. 8 2018 8540 8544 Y. Zhang, W. B. Qiu, Y. J. Ma, Y. L. Luo, Z. Q. Tian, G. W. Cui, F. Y. Xie, L. Chen, T. S. Li, X. P. Sun, ACS Catal., 2018, 8, 8540–8544. 243 M. Nazemi M.A. El-Sayed Nano Energy 63 2019 103886 M. Nazemi, M. A. El-Sayed, Nano Energy, 2019, 63, 103886.",
      "scopus-id": "85123872471",
      "coredata": {
        "eid": "1-s2.0-S1872206721638639",
        "dc:description": "Photocatalysis is considered a prospective way to alleviate the energy crisis and environmental pollution. It is therefore extremely important to design highly efficient photocatalysts for catalytic systems. In recent years, hollow-structured materials have attracted considerable interest for application in energy conversion fields owing to their large specific surface areas, improved light absorption, and shortened charge carrier transfer path. Because they contain inner and outer surfaces, hollow-structured materials can provide a superior platform for the deposition of other components. A number of hollow-structured hierarchical systems have been designed and fabricated in recent decades. It is important to rationally design and construct complex hierarchical structures. In this review, general preparation approaches for hollow-structured materials are presented, followed by a summary of the recent synthesis methods and mechanisms of typical hollow-structured materials for applications in the photocatalytic field. Complex hollow-structured hierarchical photocatalysts are classified into two types, hollow cocatalyst-based and hollow host photocatalyst-based, and the design principle and analysis of the photocatalytic reaction mechanism for photocatalytic H2 evolution and CO2 reduction are also introduced. The effects of hollow-structured materials have also been investigated. This review provides a reference for the rational construction of advanced, highly efficient photocatalytic materials.",
        "openArchiveArticle": "false",
        "prism:coverDate": "2022-03-31",
        "openaccessUserLicense": null,
        "prism:aggregationType": "Journal",
        "prism:url": "https://api.elsevier.com/content/article/pii/S1872206721638639",
        "dc:creator": [
          {
            "@_fa": "true",
            "$": "Li, Xuli"
          },
          {
            "@_fa": "true",
            "$": "Li, Ning"
          },
          {
            "@_fa": "true",
            "$": "Gao, Yangqin"
          },
          {
            "@_fa": "true",
            "$": "Ge, Lei"
          }
        ],
        "link": [
          {
            "@_fa": "true",
            "@rel": "self",
            "@href": "https://api.elsevier.com/content/article/pii/S1872206721638639"
          },
          {
            "@_fa": "true",
            "@rel": "scidir",
            "@href": "https://www.sciencedirect.com/science/article/pii/S1872206721638639"
          }
        ],
        "dc:format": "application/json",
        "openaccessType": null,
        "pii": "S1872-2067(21)63863-9",
        "prism:volume": "43",
        "prism:publisher": "Dalian Institute of Chemical Physics, the Chinese Academy of Sciences. Published by Elsevier B.V.",
        "dc:title": "Design and applications of hollow-structured nanomaterials for photocatalytic H2 evolution and CO2 reduction",
        "prism:copyright": "Copyright © 2022 Dalian Institute of Chemical Physics, the Chinese Academy of Sciences. Published by Elsevier B.V. All rights reserved.",
        "openaccess": "0",
        "prism:issn": "18722067",
        "prism:issueIdentifier": "3",
        "dcterms:subject": [
          {
            "@_fa": "true",
            "$": "Hollow structure"
          },
          {
            "@_fa": "true",
            "$": "Photocatalysis"
          },
          {
            "@_fa": "true",
            "$": "H2 evolution"
          },
          {
            "@_fa": "true",
            "$": "CO2 reduction"
          },
          {
            "@_fa": "true",
            "$": "Design principle"
          }
        ],
        "openaccessArticle": "false",
        "prism:publicationName": "Chinese Journal of Catalysis",
        "prism:number": "3",
        "openaccessSponsorType": null,
        "prism:pageRange": "679-707",
        "prism:endingPage": "707",
        "pubType": "rev",
        "prism:coverDisplayDate": "March 2022",
        "prism:doi": "10.1016/S1872-2067(21)63863-9",
        "prism:startingPage": "679",
        "dc:identifier": "doi:10.1016/S1872-2067(21)63863-9",
        "openaccessSponsorName": null
      },
      "objects": {
        "object": [
          {
            "@category": "standard",
            "@height": "122",
            "@width": "70",
            "@_fa": "true",
            "$": "https://api.elsevier.com/content/object/eid/1-s2.0-S1872206721638639-fx1.jpg?httpAccept=%2A%2F%2A",
            "@multimediatype": "JPEG image file",
            "@type": "IMAGE-DOWNSAMPLED",
            "@size": "4985",
            "@ref": "fx1",
            "@mimetype": "image/jpeg"
          },
          {
            "@category": "standard",
            "@height": "119",
            "@width": "66",
            "@_fa": "true",
            "$": "https://api.elsevier.com/content/object/eid/1-s2.0-S1872206721638639-fx10.jpg?httpAccept=%2A%2F%2A",
            "@multimediatype": "JPEG image file",
            "@type": "IMAGE-DOWNSAMPLED",
            "@size": "6938",
            "@ref": "fx10",
            "@mimetype": "image/jpeg"
          },
          {
            "@category": "standard",
            "@height": "120",
            "@width": "66",
            "@_fa": "true",
            "$": "https://api.elsevier.com/content/object/eid/1-s2.0-S1872206721638639-fx11.jpg?httpAccept=%2A%2F%2A",
            "@multimediatype": "JPEG image file",
            "@type": "IMAGE-DOWNSAMPLED",
            "@size": "5377",
            "@ref": "fx11",
            "@mimetype": "image/jpeg"
          },
          {
            "@category": "standard",
            "@height": "122",
            "@width": "66",
            "@_fa": "true",
            "$": "https://api.elsevier.com/content/object/eid/1-s2.0-S1872206721638639-fx12.jpg?httpAccept=%2A%2F%2A",
            "@multimediatype": "JPEG image file",
            "@type": "IMAGE-DOWNSAMPLED",
            "@size": "5010",
            "@ref": "fx12",
            "@mimetype": "image/jpeg"
          },
          {
            "@category": "standard",
            "@height": "111",
            "@width": "75",
            "@_fa": "true",
            "$": "https://api.elsevier.com/content/object/eid/1-s2.0-S1872206721638639-fx13.jpg?httpAccept=%2A%2F%2A",
            "@multimediatype": "JPEG image file",
            "@type": "IMAGE-DOWNSAMPLED",
            "@size": "4507",
            "@ref": "fx13",
            "@mimetype": "image/jpeg"
          },
          {
            "@category": "standard",
            "@height": "122",
            "@width": "67",
            "@_fa": "true",
            "$": "https://api.elsevier.com/content/object/eid/1-s2.0-S1872206721638639-fx14.jpg?httpAccept=%2A%2F%2A",
            "@multimediatype": "JPEG image file",
            "@type": "IMAGE-DOWNSAMPLED",
            "@size": "4174",
            "@ref": "fx14",
            "@mimetype": "image/jpeg"
          },
          {
            "@category": "standard",
            "@height": "112",
            "@width": "71",
            "@_fa": "true",
            "$": "https://api.elsevier.com/content/object/eid/1-s2.0-S1872206721638639-fx15.jpg?httpAccept=%2A%2F%2A",
            "@multimediatype": "JPEG image file",
            "@type": "IMAGE-DOWNSAMPLED",
            "@size": "4759",
            "@ref": "fx15",
            "@mimetype": "image/jpeg"
          },
          {
            "@category": "standard",
            "@height": "68",
            "@width": "75",
            "@_fa": "true",
            "$": "https://api.elsevier.com/content/object/eid/1-s2.0-S1872206721638639-fx16.jpg?httpAccept=%2A%2F%2A",
            "@multimediatype": "JPEG image file",
            "@type": "IMAGE-DOWNSAMPLED",
            "@size": "2645",
            "@ref": "fx16",
            "@mimetype": "image/jpeg"
          },
          {
            "@category": "standard",
            "@height": "129",
            "@width": "70",
            "@_fa": "true",
            "$": "https://api.elsevier.com/content/object/eid/1-s2.0-S1872206721638639-fx17.jpg?httpAccept=%2A%2F%2A",
            "@multimediatype": "JPEG image file",
            "@type": "IMAGE-DOWNSAMPLED",
            "@size": "4898",
            "@ref": "fx17",
            "@mimetype": "image/jpeg"
          },
          {
            "@category": "standard",
            "@height": "131",
            "@width": "71",
            "@_fa": "true",
            "$": "https://api.elsevier.com/content/object/eid/1-s2.0-S1872206721638639-fx18.jpg?httpAccept=%2A%2F%2A",
            "@multimediatype": "JPEG image file",
            "@type": "IMAGE-DOWNSAMPLED",
            "@size": "5002",
            "@ref": "fx18",
            "@mimetype": "image/jpeg"
          },
          {
            "@category": "standard",
            "@height": "84",
            "@width": "81",
            "@_fa": "true",
            "$": "https://api.elsevier.com/content/object/eid/1-s2.0-S1872206721638639-fx19.jpg?httpAccept=%2A%2F%2A",
            "@multimediatype": "JPEG image file",
            "@type": "IMAGE-DOWNSAMPLED",
            "@size": "2516",
            "@ref": "fx19",
            "@mimetype": "image/jpeg"
          },
          {
            "@category": "standard",
            "@height": "76",
            "@width": "70",
            "@_fa": "true",
            "$": "https://api.elsevier.com/content/object/eid/1-s2.0-S1872206721638639-fx2.jpg?httpAccept=%2A%2F%2A",
            "@multimediatype": "JPEG image file",
            "@type": "IMAGE-DOWNSAMPLED",
            "@size": "2369",
            "@ref": "fx2",
            "@mimetype": "image/jpeg"
          },
          {
            "@category": "standard",
            "@height": "118",
            "@width": "63",
            "@_fa": "true",
            "$": "https://api.elsevier.com/content/object/eid/1-s2.0-S1872206721638639-fx20.jpg?httpAccept=%2A%2F%2A",
            "@multimediatype": "JPEG image file",
            "@type": "IMAGE-DOWNSAMPLED",
            "@size": "4277",
            "@ref": "fx20",
            "@mimetype": "image/jpeg"
          },
          {
            "@category": "standard",
            "@height": "96",
            "@width": "64",
            "@_fa": "true",
            "$": "https://api.elsevier.com/content/object/eid/1-s2.0-S1872206721638639-fx21.jpg?httpAccept=%2A%2F%2A",
            "@multimediatype": "JPEG image file",
            "@type": "IMAGE-DOWNSAMPLED",
            "@size": "3416",
            "@ref": "fx21",
            "@mimetype": "image/jpeg"
          },
          {
            "@category": "standard",
            "@height": "82",
            "@width": "64",
            "@_fa": "true",
            "$": "https://api.elsevier.com/content/object/eid/1-s2.0-S1872206721638639-fx22.jpg?httpAccept=%2A%2F%2A",
            "@multimediatype": "JPEG image file",
            "@type": "IMAGE-DOWNSAMPLED",
            "@size": "4287",
            "@ref": "fx22",
            "@mimetype": "image/jpeg"
          },
          {
            "@category": "standard",
            "@height": "121",
            "@width": "64",
            "@_fa": "true",
            "$": "https://api.elsevier.com/content/object/eid/1-s2.0-S1872206721638639-fx23.jpg?httpAccept=%2A%2F%2A",
            "@multimediatype": "JPEG image file",
            "@type": "IMAGE-DOWNSAMPLED",
            "@size": "5035",
            "@ref": "fx23",
            "@mimetype": "image/jpeg"
          },
          {
            "@category": "standard",
            "@height": "60",
            "@width": "62",
            "@_fa": "true",
            "$": "https://api.elsevier.com/content/object/eid/1-s2.0-S1872206721638639-fx24.jpg?httpAccept=%2A%2F%2A",
            "@multimediatype": "JPEG image file",
            "@type": "IMAGE-DOWNSAMPLED",
            "@size": "2449",
            "@ref": "fx24",
            "@mimetype": "image/jpeg"
          },
          {
            "@category": "standard",
            "@height": "129",
            "@width": "67",
            "@_fa": "true",
            "$": "https://api.elsevier.com/content/object/eid/1-s2.0-S1872206721638639-fx25.jpg?httpAccept=%2A%2F%2A",
            "@multimediatype": "JPEG image file",
            "@type": "IMAGE-DOWNSAMPLED",
            "@size": "5078",
            "@ref": "fx25",
            "@mimetype": "image/jpeg"
          },
          {
            "@category": "standard",
            "@height": "125",
            "@width": "67",
            "@_fa": "true",
            "$": "https://api.elsevier.com/content/object/eid/1-s2.0-S1872206721638639-fx26.jpg?httpAccept=%2A%2F%2A",
            "@multimediatype": "JPEG image file",
            "@type": "IMAGE-DOWNSAMPLED",
            "@size": "5808",
            "@ref": "fx26",
            "@mimetype": "image/jpeg"
          },
          {
            "@category": "standard",
            "@height": "148",
            "@width": "70",
            "@_fa": "true",
            "$": "https://api.elsevier.com/content/object/eid/1-s2.0-S1872206721638639-fx27.jpg?httpAccept=%2A%2F%2A",
            "@multimediatype": "JPEG image file",
            "@type": "IMAGE-DOWNSAMPLED",
            "@size": "5839",
            "@ref": "fx27",
            "@mimetype": "image/jpeg"
          },
          {
            "@category": "standard",
            "@height": "112",
            "@width": "67",
            "@_fa": "true",
            "$": "https://api.elsevier.com/content/object/eid/1-s2.0-S1872206721638639-fx28.jpg?httpAccept=%2A%2F%2A",
            "@multimediatype": "JPEG image file",
            "@type": "IMAGE-DOWNSAMPLED",
            "@size": "4805",
            "@ref": "fx28",
            "@mimetype": "image/jpeg"
          },
          {
            "@category": "standard",
            "@height": "140",
            "@width": "67",
            "@_fa": "true",
            "$": "https://api.elsevier.com/content/object/eid/1-s2.0-S1872206721638639-fx29.jpg?httpAccept=%2A%2F%2A",
            "@multimediatype": "JPEG image file",
            "@type": "IMAGE-DOWNSAMPLED",
            "@size": "6218",
            "@ref": "fx29",
            "@mimetype": "image/jpeg"
          },
          {
            "@category": "standard",
            "@height": "120",
            "@width": "69",
            "@_fa": "true",
            "$": "https://api.elsevier.com/content/object/eid/1-s2.0-S1872206721638639-fx3.jpg?httpAccept=%2A%2F%2A",
            "@multimediatype": "JPEG image file",
            "@type": "IMAGE-DOWNSAMPLED",
            "@size": "4342",
            "@ref": "fx3",
            "@mimetype": "image/jpeg"
          },
          {
            "@category": "standard",
            "@height": "122",
            "@width": "66",
            "@_fa": "true",
            "$": "https://api.elsevier.com/content/object/eid/1-s2.0-S1872206721638639-fx30.jpg?httpAccept=%2A%2F%2A",
            "@multimediatype": "JPEG image file",
            "@type": "IMAGE-DOWNSAMPLED",
            "@size": "4419",
            "@ref": "fx30",
            "@mimetype": "image/jpeg"
          },
          {
            "@category": "standard",
            "@height": "129",
            "@width": "67",
            "@_fa": "true",
            "$": "https://api.elsevier.com/content/object/eid/1-s2.0-S1872206721638639-fx31.jpg?httpAccept=%2A%2F%2A",
            "@multimediatype": "JPEG image file",
            "@type": "IMAGE-DOWNSAMPLED",
            "@size": "5583",
            "@ref": "fx31",
            "@mimetype": "image/jpeg"
          },
          {
            "@category": "standard",
            "@height": "59",
            "@width": "65",
            "@_fa": "true",
            "$": "https://api.elsevier.com/content/object/eid/1-s2.0-S1872206721638639-fx32.jpg?httpAccept=%2A%2F%2A",
            "@multimediatype": "JPEG image file",
            "@type": "IMAGE-DOWNSAMPLED",
            "@size": "2031",
            "@ref": "fx32",
            "@mimetype": "image/jpeg"
          },
          {
            "@category": "standard",
            "@height": "108",
            "@width": "63",
            "@_fa": "true",
            "$": "https://api.elsevier.com/content/object/eid/1-s2.0-S1872206721638639-fx33.jpg?httpAccept=%2A%2F%2A",
            "@multimediatype": "JPEG image file",
            "@type": "IMAGE-DOWNSAMPLED",
            "@size": "4734",
            "@ref": "fx33",
            "@mimetype": "image/jpeg"
          },
          {
            "@category": "standard",
            "@height": "111",
            "@width": "62",
            "@_fa": "true",
            "$": "https://api.elsevier.com/content/object/eid/1-s2.0-S1872206721638639-fx34.jpg?httpAccept=%2A%2F%2A",
            "@multimediatype": "JPEG image file",
            "@type": "IMAGE-DOWNSAMPLED",
            "@size": "3661",
            "@ref": "fx34",
            "@mimetype": "image/jpeg"
          },
          {
            "@category": "standard",
            "@height": "119",
            "@width": "59",
            "@_fa": "true",
            "$": "https://api.elsevier.com/content/object/eid/1-s2.0-S1872206721638639-fx35.jpg?httpAccept=%2A%2F%2A",
            "@multimediatype": "JPEG image file",
            "@type": "IMAGE-DOWNSAMPLED",
            "@size": "3116",
            "@ref": "fx35",
            "@mimetype": "image/jpeg"
          },
          {
            "@category": "standard",
            "@height": "121",
            "@width": "70",
            "@_fa": "true",
            "$": "https://api.elsevier.com/content/object/eid/1-s2.0-S1872206721638639-fx4.jpg?httpAccept=%2A%2F%2A",
            "@multimediatype": "JPEG image file",
            "@type": "IMAGE-DOWNSAMPLED",
            "@size": "6062",
            "@ref": "fx4",
            "@mimetype": "image/jpeg"
          },
          {
            "@category": "standard",
            "@height": "129",
            "@width": "66",
            "@_fa": "true",
            "$": "https://api.elsevier.com/content/object/eid/1-s2.0-S1872206721638639-fx5.jpg?httpAccept=%2A%2F%2A",
            "@multimediatype": "JPEG image file",
            "@type": "IMAGE-DOWNSAMPLED",
            "@size": "5001",
            "@ref": "fx5",
            "@mimetype": "image/jpeg"
          },
          {
            "@category": "standard",
            "@height": "106",
            "@width": "65",
            "@_fa": "true",
            "$": "https://api.elsevier.com/content/object/eid/1-s2.0-S1872206721638639-fx6.jpg?httpAccept=%2A%2F%2A",
            "@multimediatype": "JPEG image file",
            "@type": "IMAGE-DOWNSAMPLED",
            "@size": "3746",
            "@ref": "fx6",
            "@mimetype": "image/jpeg"
          },
          {
            "@category": "standard",
            "@height": "119",
            "@width": "67",
            "@_fa": "true",
            "$": "https://api.elsevier.com/content/object/eid/1-s2.0-S1872206721638639-fx7.jpg?httpAccept=%2A%2F%2A",
            "@multimediatype": "JPEG image file",
            "@type": "IMAGE-DOWNSAMPLED",
            "@size": "5085",
            "@ref": "fx7",
            "@mimetype": "image/jpeg"
          },
          {
            "@category": "standard",
            "@height": "119",
            "@width": "65",
            "@_fa": "true",
            "$": "https://api.elsevier.com/content/object/eid/1-s2.0-S1872206721638639-fx8.jpg?httpAccept=%2A%2F%2A",
            "@multimediatype": "JPEG image file",
            "@type": "IMAGE-DOWNSAMPLED",
            "@size": "5871",
            "@ref": "fx8",
            "@mimetype": "image/jpeg"
          },
          {
            "@category": "standard",
            "@height": "137",
            "@width": "66",
            "@_fa": "true",
            "$": "https://api.elsevier.com/content/object/eid/1-s2.0-S1872206721638639-fx9.jpg?httpAccept=%2A%2F%2A",
            "@multimediatype": "JPEG image file",
            "@type": "IMAGE-DOWNSAMPLED",
            "@size": "3789",
            "@ref": "fx9",
            "@mimetype": "image/jpeg"
          },
          {
            "@category": "standard",
            "@height": "149",
            "@width": "335",
            "@_fa": "true",
            "$": "https://api.elsevier.com/content/object/eid/1-s2.0-S1872206721638639-gr1.jpg?httpAccept=%2A%2F%2A",
            "@multimediatype": "JPEG image file",
            "@type": "IMAGE-DOWNSAMPLED",
            "@size": "16738",
            "@ref": "gr1",
            "@mimetype": "image/jpeg"
          },
          {
            "@category": "standard",
            "@height": "165",
            "@width": "370",
            "@_fa": "true",
            "$": "https://api.elsevier.com/content/object/eid/1-s2.0-S1872206721638639-gr10.jpg?httpAccept=%2A%2F%2A",
            "@multimediatype": "JPEG image file",
            "@type": "IMAGE-DOWNSAMPLED",
            "@size": "25497",
            "@ref": "gr10",
            "@mimetype": "image/jpeg"
          },
          {
            "@category": "standard",
            "@height": "131",
            "@width": "373",
            "@_fa": "true",
            "$": "https://api.elsevier.com/content/object/eid/1-s2.0-S1872206721638639-gr11.jpg?httpAccept=%2A%2F%2A",
            "@multimediatype": "JPEG image file",
            "@type": "IMAGE-DOWNSAMPLED",
            "@size": "25384",
            "@ref": "gr11",
            "@mimetype": "image/jpeg"
          },
          {
            "@category": "standard",
            "@height": "198",
            "@width": "582",
            "@_fa": "true",
            "$": "https://api.elsevier.com/content/object/eid/1-s2.0-S1872206721638639-gr12.jpg?httpAccept=%2A%2F%2A",
            "@multimediatype": "JPEG image file",
            "@type": "IMAGE-DOWNSAMPLED",
            "@size": "42698",
            "@ref": "gr12",
            "@mimetype": "image/jpeg"
          },
          {
            "@category": "standard",
            "@height": "169",
            "@width": "371",
            "@_fa": "true",
            "$": "https://api.elsevier.com/content/object/eid/1-s2.0-S1872206721638639-gr13.jpg?httpAccept=%2A%2F%2A",
            "@multimediatype": "JPEG image file",
            "@type": "IMAGE-DOWNSAMPLED",
            "@size": "26748",
            "@ref": "gr13",
            "@mimetype": "image/jpeg"
          },
          {
            "@category": "standard",
            "@height": "229",
            "@width": "367",
            "@_fa": "true",
            "$": "https://api.elsevier.com/content/object/eid/1-s2.0-S1872206721638639-gr14.jpg?httpAccept=%2A%2F%2A",
            "@multimediatype": "JPEG image file",
            "@type": "IMAGE-DOWNSAMPLED",
            "@size": "34091",
            "@ref": "gr14",
            "@mimetype": "image/jpeg"
          },
          {
            "@category": "standard",
            "@height": "280",
            "@width": "526",
            "@_fa": "true",
            "$": "https://api.elsevier.com/content/object/eid/1-s2.0-S1872206721638639-gr15.jpg?httpAccept=%2A%2F%2A",
            "@multimediatype": "JPEG image file",
            "@type": "IMAGE-DOWNSAMPLED",
            "@size": "35820",
            "@ref": "gr15",
            "@mimetype": "image/jpeg"
          },
          {
            "@category": "standard",
            "@height": "401",
            "@width": "569",
            "@_fa": "true",
            "$": "https://api.elsevier.com/content/object/eid/1-s2.0-S1872206721638639-gr16.jpg?httpAccept=%2A%2F%2A",
            "@multimediatype": "JPEG image file",
            "@type": "IMAGE-DOWNSAMPLED",
            "@size": "86400",
            "@ref": "gr16",
            "@mimetype": "image/jpeg"
          },
          {
            "@category": "standard",
            "@height": "503",
            "@width": "534",
            "@_fa": "true",
            "$": "https://api.elsevier.com/content/object/eid/1-s2.0-S1872206721638639-gr17.jpg?httpAccept=%2A%2F%2A",
            "@multimediatype": "JPEG image file",
            "@type": "IMAGE-DOWNSAMPLED",
            "@size": "109578",
            "@ref": "gr17",
            "@mimetype": "image/jpeg"
          },
          {
            "@category": "standard",
            "@height": "423",
            "@width": "527",
            "@_fa": "true",
            "$": "https://api.elsevier.com/content/object/eid/1-s2.0-S1872206721638639-gr18.jpg?httpAccept=%2A%2F%2A",
            "@multimediatype": "JPEG image file",
            "@type": "IMAGE-DOWNSAMPLED",
            "@size": "81367",
            "@ref": "gr18",
            "@mimetype": "image/jpeg"
          },
          {
            "@category": "standard",
            "@height": "290",
            "@width": "358",
            "@_fa": "true",
            "$": "https://api.elsevier.com/content/object/eid/1-s2.0-S1872206721638639-gr19.jpg?httpAccept=%2A%2F%2A",
            "@multimediatype": "JPEG image file",
            "@type": "IMAGE-DOWNSAMPLED",
            "@size": "38020",
            "@ref": "gr19",
            "@mimetype": "image/jpeg"
          },
          {
            "@category": "standard",
            "@height": "256",
            "@width": "363",
            "@_fa": "true",
            "$": "https://api.elsevier.com/content/object/eid/1-s2.0-S1872206721638639-gr2.jpg?httpAccept=%2A%2F%2A",
            "@multimediatype": "JPEG image file",
            "@type": "IMAGE-DOWNSAMPLED",
            "@size": "25370",
            "@ref": "gr2",
            "@mimetype": "image/jpeg"
          },
          {
            "@category": "standard",
            "@height": "284",
            "@width": "514",
            "@_fa": "true",
            "$": "https://api.elsevier.com/content/object/eid/1-s2.0-S1872206721638639-gr20.jpg?httpAccept=%2A%2F%2A",
            "@multimediatype": "JPEG image file",
            "@type": "IMAGE-DOWNSAMPLED",
            "@size": "58448",
            "@ref": "gr20",
            "@mimetype": "image/jpeg"
          },
          {
            "@category": "standard",
            "@height": "256",
            "@width": "534",
            "@_fa": "true",
            "$": "https://api.elsevier.com/content/object/eid/1-s2.0-S1872206721638639-gr21.jpg?httpAccept=%2A%2F%2A",
            "@multimediatype": "JPEG image file",
            "@type": "IMAGE-DOWNSAMPLED",
            "@size": "41377",
            "@ref": "gr21",
            "@mimetype": "image/jpeg"
          },
          {
            "@category": "standard",
            "@height": "242",
            "@width": "487",
            "@_fa": "true",
            "$": "https://api.elsevier.com/content/object/eid/1-s2.0-S1872206721638639-gr22.jpg?httpAccept=%2A%2F%2A",
            "@multimediatype": "JPEG image file",
            "@type": "IMAGE-DOWNSAMPLED",
            "@size": "55317",
            "@ref": "gr22",
            "@mimetype": "image/jpeg"
          },
          {
            "@category": "standard",
            "@height": "303",
            "@width": "645",
            "@_fa": "true",
            "$": "https://api.elsevier.com/content/object/eid/1-s2.0-S1872206721638639-gr23.jpg?httpAccept=%2A%2F%2A",
            "@multimediatype": "JPEG image file",
            "@type": "IMAGE-DOWNSAMPLED",
            "@size": "74847",
            "@ref": "gr23",
            "@mimetype": "image/jpeg"
          },
          {
            "@category": "standard",
            "@height": "244",
            "@width": "363",
            "@_fa": "true",
            "$": "https://api.elsevier.com/content/object/eid/1-s2.0-S1872206721638639-gr24.jpg?httpAccept=%2A%2F%2A",
            "@multimediatype": "JPEG image file",
            "@type": "IMAGE-DOWNSAMPLED",
            "@size": "38305",
            "@ref": "gr24",
            "@mimetype": "image/jpeg"
          },
          {
            "@category": "standard",
            "@height": "411",
            "@width": "515",
            "@_fa": "true",
            "$": "https://api.elsevier.com/content/object/eid/1-s2.0-S1872206721638639-gr25.jpg?httpAccept=%2A%2F%2A",
            "@multimediatype": "JPEG image file",
            "@type": "IMAGE-DOWNSAMPLED",
            "@size": "68328",
            "@ref": "gr25",
            "@mimetype": "image/jpeg"
          },
          {
            "@category": "standard",
            "@height": "293",
            "@width": "576",
            "@_fa": "true",
            "$": "https://api.elsevier.com/content/object/eid/1-s2.0-S1872206721638639-gr26.jpg?httpAccept=%2A%2F%2A",
            "@multimediatype": "JPEG image file",
            "@type": "IMAGE-DOWNSAMPLED",
            "@size": "56882",
            "@ref": "gr26",
            "@mimetype": "image/jpeg"
          },
          {
            "@category": "standard",
            "@height": "263",
            "@width": "480",
            "@_fa": "true",
            "$": "https://api.elsevier.com/content/object/eid/1-s2.0-S1872206721638639-gr27.jpg?httpAccept=%2A%2F%2A",
            "@multimediatype": "JPEG image file",
            "@type": "IMAGE-DOWNSAMPLED",
            "@size": "45759",
            "@ref": "gr27",
            "@mimetype": "image/jpeg"
          },
          {
            "@category": "standard",
            "@height": "269",
            "@width": "528",
            "@_fa": "true",
            "$": "https://api.elsevier.com/content/object/eid/1-s2.0-S1872206721638639-gr28.jpg?httpAccept=%2A%2F%2A",
            "@multimediatype": "JPEG image file",
            "@type": "IMAGE-DOWNSAMPLED",
            "@size": "55700",
            "@ref": "gr28",
            "@mimetype": "image/jpeg"
          },
          {
            "@category": "standard",
            "@height": "196",
            "@width": "369",
            "@_fa": "true",
            "$": "https://api.elsevier.com/content/object/eid/1-s2.0-S1872206721638639-gr29.jpg?httpAccept=%2A%2F%2A",
            "@multimediatype": "JPEG image file",
            "@type": "IMAGE-DOWNSAMPLED",
            "@size": "29694",
            "@ref": "gr29",
            "@mimetype": "image/jpeg"
          },
          {
            "@category": "standard",
            "@height": "321",
            "@width": "326",
            "@_fa": "true",
            "$": "https://api.elsevier.com/content/object/eid/1-s2.0-S1872206721638639-gr3.jpg?httpAccept=%2A%2F%2A",
            "@multimediatype": "JPEG image file",
            "@type": "IMAGE-DOWNSAMPLED",
            "@size": "41402",
            "@ref": "gr3",
            "@mimetype": "image/jpeg"
          },
          {
            "@category": "standard",
            "@height": "286",
            "@width": "612",
            "@_fa": "true",
            "$": "https://api.elsevier.com/content/object/eid/1-s2.0-S1872206721638639-gr30.jpg?httpAccept=%2A%2F%2A",
            "@multimediatype": "JPEG image file",
            "@type": "IMAGE-DOWNSAMPLED",
            "@size": "68532",
            "@ref": "gr30",
            "@mimetype": "image/jpeg"
          },
          {
            "@category": "standard",
            "@height": "529",
            "@width": "619",
            "@_fa": "true",
            "$": "https://api.elsevier.com/content/object/eid/1-s2.0-S1872206721638639-gr31.jpg?httpAccept=%2A%2F%2A",
            "@multimediatype": "JPEG image file",
            "@type": "IMAGE-DOWNSAMPLED",
            "@size": "95249",
            "@ref": "gr31",
            "@mimetype": "image/jpeg"
          },
          {
            "@category": "standard",
            "@height": "279",
            "@width": "643",
            "@_fa": "true",
            "$": "https://api.elsevier.com/content/object/eid/1-s2.0-S1872206721638639-gr32.jpg?httpAccept=%2A%2F%2A",
            "@multimediatype": "JPEG image file",
            "@type": "IMAGE-DOWNSAMPLED",
            "@size": "82668",
            "@ref": "gr32",
            "@mimetype": "image/jpeg"
          },
          {
            "@category": "standard",
            "@height": "303",
            "@width": "414",
            "@_fa": "true",
            "$": "https://api.elsevier.com/content/object/eid/1-s2.0-S1872206721638639-gr33.jpg?httpAccept=%2A%2F%2A",
            "@multimediatype": "JPEG image file",
            "@type": "IMAGE-DOWNSAMPLED",
            "@size": "40319",
            "@ref": "gr33",
            "@mimetype": "image/jpeg"
          },
          {
            "@category": "standard",
            "@height": "248",
            "@width": "260",
            "@_fa": "true",
            "$": "https://api.elsevier.com/content/object/eid/1-s2.0-S1872206721638639-gr34.jpg?httpAccept=%2A%2F%2A",
            "@multimediatype": "JPEG image file",
            "@type": "IMAGE-DOWNSAMPLED",
            "@size": "35174",
            "@ref": "gr34",
            "@mimetype": "image/jpeg"
          },
          {
            "@category": "standard",
            "@height": "193",
            "@width": "368",
            "@_fa": "true",
            "$": "https://api.elsevier.com/content/object/eid/1-s2.0-S1872206721638639-gr35.jpg?httpAccept=%2A%2F%2A",
            "@multimediatype": "JPEG image file",
            "@type": "IMAGE-DOWNSAMPLED",
            "@size": "29726",
            "@ref": "gr35",
            "@mimetype": "image/jpeg"
          },
          {
            "@category": "standard",
            "@height": "210",
            "@width": "337",
            "@_fa": "true",
            "$": "https://api.elsevier.com/content/object/eid/1-s2.0-S1872206721638639-gr4.jpg?httpAccept=%2A%2F%2A",
            "@multimediatype": "JPEG image file",
            "@type": "IMAGE-DOWNSAMPLED",
            "@size": "32064",
            "@ref": "gr4",
            "@mimetype": "image/jpeg"
          },
          {
            "@category": "standard",
            "@height": "248",
            "@width": "362",
            "@_fa": "true",
            "$": "https://api.elsevier.com/content/object/eid/1-s2.0-S1872206721638639-gr5.jpg?httpAccept=%2A%2F%2A",
            "@multimediatype": "JPEG image file",
            "@type": "IMAGE-DOWNSAMPLED",
            "@size": "35106",
            "@ref": "gr5",
            "@mimetype": "image/jpeg"
          },
          {
            "@category": "standard",
            "@height": "69",
            "@width": "349",
            "@_fa": "true",
            "$": "https://api.elsevier.com/content/object/eid/1-s2.0-S1872206721638639-gr6.jpg?httpAccept=%2A%2F%2A",
            "@multimediatype": "JPEG image file",
            "@type": "IMAGE-DOWNSAMPLED",
            "@size": "10755",
            "@ref": "gr6",
            "@mimetype": "image/jpeg"
          },
          {
            "@category": "standard",
            "@height": "261",
            "@width": "372",
            "@_fa": "true",
            "$": "https://api.elsevier.com/content/object/eid/1-s2.0-S1872206721638639-gr7.jpg?httpAccept=%2A%2F%2A",
            "@multimediatype": "JPEG image file",
            "@type": "IMAGE-DOWNSAMPLED",
            "@size": "29571",
            "@ref": "gr7",
            "@mimetype": "image/jpeg"
          },
          {
            "@category": "standard",
            "@height": "201",
            "@width": "372",
            "@_fa": "true",
            "$": "https://api.elsevier.com/content/object/eid/1-s2.0-S1872206721638639-gr8.jpg?httpAccept=%2A%2F%2A",
            "@multimediatype": "JPEG image file",
            "@type": "IMAGE-DOWNSAMPLED",
            "@size": "23335",
            "@ref": "gr8",
            "@mimetype": "image/jpeg"
          },
          {
            "@category": "standard",
            "@height": "229",
            "@width": "774",
            "@_fa": "true",
            "$": "https://api.elsevier.com/content/object/eid/1-s2.0-S1872206721638639-gr9.jpg?httpAccept=%2A%2F%2A",
            "@multimediatype": "JPEG image file",
            "@type": "IMAGE-DOWNSAMPLED",
            "@size": "65302",
            "@ref": "gr9",
            "@mimetype": "image/jpeg"
          },
          {
            "@category": "standard",
            "@height": "245",
            "@width": "258",
            "@_fa": "true",
            "$": "https://api.elsevier.com/content/object/eid/1-s2.0-S1872206721638639-grap.jpg?httpAccept=%2A%2F%2A",
            "@multimediatype": "JPEG image file",
            "@type": "IMAGE-DOWNSAMPLED",
            "@size": "33661",
            "@ref": "grap",
            "@mimetype": "image/jpeg"
          },
          {
            "@category": "thumbnail",
            "@height": "327",
            "@width": "187",
            "@_fa": "true",
            "$": "https://api.elsevier.com/content/object/eid/1-s2.0-S1872206721638639-fx1.sml?httpAccept=%2A%2F%2A",
            "@multimediatype": "GIF image file",
            "@type": "IMAGE-THUMBNAIL",
            "@size": "28340",
            "@ref": "fx1",
            "@mimetype": "image/gif"
          },
          {
            "@category": "thumbnail",
            "@height": "320",
            "@width": "177",
            "@_fa": "true",
            "$": "https://api.elsevier.com/content/object/eid/1-s2.0-S1872206721638639-fx10.sml?httpAccept=%2A%2F%2A",
            "@multimediatype": "GIF image file",
            "@type": "IMAGE-THUMBNAIL",
            "@size": "45449",
            "@ref": "fx10",
            "@mimetype": "image/gif"
          },
          {
            "@category": "thumbnail",
            "@height": "319",
            "@width": "176",
            "@_fa": "true",
            "$": "https://api.elsevier.com/content/object/eid/1-s2.0-S1872206721638639-fx11.sml?httpAccept=%2A%2F%2A",
            "@multimediatype": "GIF image file",
            "@type": "IMAGE-THUMBNAIL",
            "@size": "32880",
            "@ref": "fx11",
            "@mimetype": "image/gif"
          },
          {
            "@category": "thumbnail",
            "@height": "328",
            "@width": "177",
            "@_fa": "true",
            "$": "https://api.elsevier.com/content/object/eid/1-s2.0-S1872206721638639-fx12.sml?httpAccept=%2A%2F%2A",
            "@multimediatype": "GIF image file",
            "@type": "IMAGE-THUMBNAIL",
            "@size": "38445",
            "@ref": "fx12",
            "@mimetype": "image/gif"
          },
          {
            "@category": "thumbnail",
            "@height": "297",
            "@width": "201",
            "@_fa": "true",
            "$": "https://api.elsevier.com/content/object/eid/1-s2.0-S1872206721638639-fx13.sml?httpAccept=%2A%2F%2A",
            "@multimediatype": "GIF image file",
            "@type": "IMAGE-THUMBNAIL",
            "@size": "32320",
            "@ref": "fx13",
            "@mimetype": "image/gif"
          },
          {
            "@category": "thumbnail",
            "@height": "325",
            "@width": "179",
            "@_fa": "true",
            "$": "https://api.elsevier.com/content/object/eid/1-s2.0-S1872206721638639-fx14.sml?httpAccept=%2A%2F%2A",
            "@multimediatype": "GIF image file",
            "@type": "IMAGE-THUMBNAIL",
            "@size": "29553",
            "@ref": "fx14",
            "@mimetype": "image/gif"
          },
          {
            "@category": "thumbnail",
            "@height": "298",
            "@width": "189",
            "@_fa": "true",
            "$": "https://api.elsevier.com/content/object/eid/1-s2.0-S1872206721638639-fx15.sml?httpAccept=%2A%2F%2A",
            "@multimediatype": "GIF image file",
            "@type": "IMAGE-THUMBNAIL",
            "@size": "39313",
            "@ref": "fx15",
            "@mimetype": "image/gif"
          },
          {
            "@category": "thumbnail",
            "@height": "182",
            "@width": "201",
            "@_fa": "true",
            "$": "https://api.elsevier.com/content/object/eid/1-s2.0-S1872206721638639-fx16.sml?httpAccept=%2A%2F%2A",
            "@multimediatype": "GIF image file",
            "@type": "IMAGE-THUMBNAIL",
            "@size": "27172",
            "@ref": "fx16",
            "@mimetype": "image/gif"
          },
          {
            "@category": "thumbnail",
            "@height": "346",
            "@width": "188",
            "@_fa": "true",
            "$": "https://api.elsevier.com/content/object/eid/1-s2.0-S1872206721638639-fx17.sml?httpAccept=%2A%2F%2A",
            "@multimediatype": "GIF image file",
            "@type": "IMAGE-THUMBNAIL",
            "@size": "29322",
            "@ref": "fx17",
            "@mimetype": "image/gif"
          },
          {
            "@category": "thumbnail",
            "@height": "350",
            "@width": "190",
            "@_fa": "true",
            "$": "https://api.elsevier.com/content/object/eid/1-s2.0-S1872206721638639-fx18.sml?httpAccept=%2A%2F%2A",
            "@multimediatype": "GIF image file",
            "@type": "IMAGE-THUMBNAIL",
            "@size": "38276",
            "@ref": "fx18",
            "@mimetype": "image/gif"
          },
          {
            "@category": "thumbnail",
            "@height": "224",
            "@width": "216",
            "@_fa": "true",
            "$": "https://api.elsevier.com/content/object/eid/1-s2.0-S1872206721638639-fx19.sml?httpAccept=%2A%2F%2A",
            "@multimediatype": "GIF image file",
            "@type": "IMAGE-THUMBNAIL",
            "@size": "20306",
            "@ref": "fx19",
            "@mimetype": "image/gif"
          },
          {
            "@category": "thumbnail",
            "@height": "204",
            "@width": "187",
            "@_fa": "true",
            "$": "https://api.elsevier.com/content/object/eid/1-s2.0-S1872206721638639-fx2.sml?httpAccept=%2A%2F%2A",
            "@multimediatype": "GIF image file",
            "@type": "IMAGE-THUMBNAIL",
            "@size": "20597",
            "@ref": "fx2",
            "@mimetype": "image/gif"
          },
          {
            "@category": "thumbnail",
            "@height": "317",
            "@width": "169",
            "@_fa": "true",
            "$": "https://api.elsevier.com/content/object/eid/1-s2.0-S1872206721638639-fx20.sml?httpAccept=%2A%2F%2A",
            "@multimediatype": "GIF image file",
            "@type": "IMAGE-THUMBNAIL",
            "@size": "29348",
            "@ref": "fx20",
            "@mimetype": "image/gif"
          },
          {
            "@category": "thumbnail",
            "@height": "258",
            "@width": "172",
            "@_fa": "true",
            "$": "https://api.elsevier.com/content/object/eid/1-s2.0-S1872206721638639-fx21.sml?httpAccept=%2A%2F%2A",
            "@multimediatype": "GIF image file",
            "@type": "IMAGE-THUMBNAIL",
            "@size": "19722",
            "@ref": "fx21",
            "@mimetype": "image/gif"
          },
          {
            "@category": "thumbnail",
            "@height": "219",
            "@width": "171",
            "@_fa": "true",
            "$": "https://api.elsevier.com/content/object/eid/1-s2.0-S1872206721638639-fx22.sml?httpAccept=%2A%2F%2A",
            "@multimediatype": "GIF image file",
            "@type": "IMAGE-THUMBNAIL",
            "@size": "28227",
            "@ref": "fx22",
            "@mimetype": "image/gif"
          },
          {
            "@category": "thumbnail",
            "@height": "326",
            "@width": "172",
            "@_fa": "true",
            "$": "https://api.elsevier.com/content/object/eid/1-s2.0-S1872206721638639-fx23.sml?httpAccept=%2A%2F%2A",
            "@multimediatype": "GIF image file",
            "@type": "IMAGE-THUMBNAIL",
            "@size": "38195",
            "@ref": "fx23",
            "@mimetype": "image/gif"
          },
          {
            "@category": "thumbnail",
            "@height": "160",
            "@width": "165",
            "@_fa": "true",
            "$": "https://api.elsevier.com/content/object/eid/1-s2.0-S1872206721638639-fx24.sml?httpAccept=%2A%2F%2A",
            "@multimediatype": "GIF image file",
            "@type": "IMAGE-THUMBNAIL",
            "@size": "19301",
            "@ref": "fx24",
            "@mimetype": "image/gif"
          },
          {
            "@category": "thumbnail",
            "@height": "343",
            "@width": "178",
            "@_fa": "true",
            "$": "https://api.elsevier.com/content/object/eid/1-s2.0-S1872206721638639-fx25.sml?httpAccept=%2A%2F%2A",
            "@multimediatype": "GIF image file",
            "@type": "IMAGE-THUMBNAIL",
            "@size": "38266",
            "@ref": "fx25",
            "@mimetype": "image/gif"
          },
          {
            "@category": "thumbnail",
            "@height": "331",
            "@width": "178",
            "@_fa": "true",
            "$": "https://api.elsevier.com/content/object/eid/1-s2.0-S1872206721638639-fx26.sml?httpAccept=%2A%2F%2A",
            "@multimediatype": "GIF image file",
            "@type": "IMAGE-THUMBNAIL",
            "@size": "36833",
            "@ref": "fx26",
            "@mimetype": "image/gif"
          },
          {
            "@category": "thumbnail",
            "@height": "394",
            "@width": "186",
            "@_fa": "true",
            "$": "https://api.elsevier.com/content/object/eid/1-s2.0-S1872206721638639-fx27.sml?httpAccept=%2A%2F%2A",
            "@multimediatype": "GIF image file",
            "@type": "IMAGE-THUMBNAIL",
            "@size": "38442",
            "@ref": "fx27",
            "@mimetype": "image/gif"
          },
          {
            "@category": "thumbnail",
            "@height": "297",
            "@width": "178",
            "@_fa": "true",
            "$": "https://api.elsevier.com/content/object/eid/1-s2.0-S1872206721638639-fx28.sml?httpAccept=%2A%2F%2A",
            "@multimediatype": "GIF image file",
            "@type": "IMAGE-THUMBNAIL",
            "@size": "28492",
            "@ref": "fx28",
            "@mimetype": "image/gif"
          },
          {
            "@category": "thumbnail",
            "@height": "373",
            "@width": "178",
            "@_fa": "true",
            "$": "https://api.elsevier.com/content/object/eid/1-s2.0-S1872206721638639-fx29.sml?httpAccept=%2A%2F%2A",
            "@multimediatype": "GIF image file",
            "@type": "IMAGE-THUMBNAIL",
            "@size": "45058",
            "@ref": "fx29",
            "@mimetype": "image/gif"
          },
          {
            "@category": "thumbnail",
            "@height": "321",
            "@width": "184",
            "@_fa": "true",
            "$": "https://api.elsevier.com/content/object/eid/1-s2.0-S1872206721638639-fx3.sml?httpAccept=%2A%2F%2A",
            "@multimediatype": "GIF image file",
            "@type": "IMAGE-THUMBNAIL",
            "@size": "38953",
            "@ref": "fx3",
            "@mimetype": "image/gif"
          },
          {
            "@category": "thumbnail",
            "@height": "327",
            "@width": "177",
            "@_fa": "true",
            "$": "https://api.elsevier.com/content/object/eid/1-s2.0-S1872206721638639-fx30.sml?httpAccept=%2A%2F%2A",
            "@multimediatype": "GIF image file",
            "@type": "IMAGE-THUMBNAIL",
            "@size": "38399",
            "@ref": "fx30",
            "@mimetype": "image/gif"
          },
          {
            "@category": "thumbnail",
            "@height": "344",
            "@width": "178",
            "@_fa": "true",
            "$": "https://api.elsevier.com/content/object/eid/1-s2.0-S1872206721638639-fx31.sml?httpAccept=%2A%2F%2A",
            "@multimediatype": "GIF image file",
            "@type": "IMAGE-THUMBNAIL",
            "@size": "35364",
            "@ref": "fx31",
            "@mimetype": "image/gif"
          },
          {
            "@category": "thumbnail",
            "@height": "156",
            "@width": "173",
            "@_fa": "true",
            "$": "https://api.elsevier.com/content/object/eid/1-s2.0-S1872206721638639-fx32.sml?httpAccept=%2A%2F%2A",
            "@multimediatype": "GIF image file",
            "@type": "IMAGE-THUMBNAIL",
            "@size": "16078",
            "@ref": "fx32",
            "@mimetype": "image/gif"
          },
          {
            "@category": "thumbnail",
            "@height": "289",
            "@width": "168",
            "@_fa": "true",
            "$": "https://api.elsevier.com/content/object/eid/1-s2.0-S1872206721638639-fx33.sml?httpAccept=%2A%2F%2A",
            "@multimediatype": "GIF image file",
            "@type": "IMAGE-THUMBNAIL",
            "@size": "38363",
            "@ref": "fx33",
            "@mimetype": "image/gif"
          },
          {
            "@category": "thumbnail",
            "@height": "296",
            "@width": "166",
            "@_fa": "true",
            "$": "https://api.elsevier.com/content/object/eid/1-s2.0-S1872206721638639-fx34.sml?httpAccept=%2A%2F%2A",
            "@multimediatype": "GIF image file",
            "@type": "IMAGE-THUMBNAIL",
            "@size": "24889",
            "@ref": "fx34",
            "@mimetype": "image/gif"
          },
          {
            "@category": "thumbnail",
            "@height": "318",
            "@width": "158",
            "@_fa": "true",
            "$": "https://api.elsevier.com/content/object/eid/1-s2.0-S1872206721638639-fx35.sml?httpAccept=%2A%2F%2A",
            "@multimediatype": "GIF image file",
            "@type": "IMAGE-THUMBNAIL",
            "@size": "22086",
            "@ref": "fx35",
            "@mimetype": "image/gif"
          },
          {
            "@category": "thumbnail",
            "@height": "324",
            "@width": "187",
            "@_fa": "true",
            "$": "https://api.elsevier.com/content/object/eid/1-s2.0-S1872206721638639-fx4.sml?httpAccept=%2A%2F%2A",
            "@multimediatype": "GIF image file",
            "@type": "IMAGE-THUMBNAIL",
            "@size": "38149",
            "@ref": "fx4",
            "@mimetype": "image/gif"
          },
          {
            "@category": "thumbnail",
            "@height": "346",
            "@width": "177",
            "@_fa": "true",
            "$": "https://api.elsevier.com/content/object/eid/1-s2.0-S1872206721638639-fx5.sml?httpAccept=%2A%2F%2A",
            "@multimediatype": "GIF image file",
            "@type": "IMAGE-THUMBNAIL",
            "@size": "34622",
            "@ref": "fx5",
            "@mimetype": "image/gif"
          },
          {
            "@category": "thumbnail",
            "@height": "285",
            "@width": "174",
            "@_fa": "true",
            "$": "https://api.elsevier.com/content/object/eid/1-s2.0-S1872206721638639-fx6.sml?httpAccept=%2A%2F%2A",
            "@multimediatype": "GIF image file",
            "@type": "IMAGE-THUMBNAIL",
            "@size": "25479",
            "@ref": "fx6",
            "@mimetype": "image/gif"
          },
          {
            "@category": "thumbnail",
            "@height": "315",
            "@width": "178",
            "@_fa": "true",
            "$": "https://api.elsevier.com/content/object/eid/1-s2.0-S1872206721638639-fx7.sml?httpAccept=%2A%2F%2A",
            "@multimediatype": "GIF image file",
            "@type": "IMAGE-THUMBNAIL",
            "@size": "36334",
            "@ref": "fx7",
            "@mimetype": "image/gif"
          },
          {
            "@category": "thumbnail",
            "@height": "317",
            "@width": "173",
            "@_fa": "true",
            "$": "https://api.elsevier.com/content/object/eid/1-s2.0-S1872206721638639-fx8.sml?httpAccept=%2A%2F%2A",
            "@multimediatype": "GIF image file",
            "@type": "IMAGE-THUMBNAIL",
            "@size": "40476",
            "@ref": "fx8",
            "@mimetype": "image/gif"
          },
          {
            "@category": "thumbnail",
            "@height": "367",
            "@width": "177",
            "@_fa": "true",
            "$": "https://api.elsevier.com/content/object/eid/1-s2.0-S1872206721638639-fx9.sml?httpAccept=%2A%2F%2A",
            "@multimediatype": "GIF image file",
            "@type": "IMAGE-THUMBNAIL",
            "@size": "29937",
            "@ref": "fx9",
            "@mimetype": "image/gif"
          },
          {
            "@category": "thumbnail",
            "@height": "97",
            "@width": "219",
            "@_fa": "true",
            "$": "https://api.elsevier.com/content/object/eid/1-s2.0-S1872206721638639-gr1.sml?httpAccept=%2A%2F%2A",
            "@multimediatype": "GIF image file",
            "@type": "IMAGE-THUMBNAIL",
            "@size": "6870",
            "@ref": "gr1",
            "@mimetype": "image/gif"
          },
          {
            "@category": "thumbnail",
            "@height": "97",
            "@width": "219",
            "@_fa": "true",
            "$": "https://api.elsevier.com/content/object/eid/1-s2.0-S1872206721638639-gr10.sml?httpAccept=%2A%2F%2A",
            "@multimediatype": "GIF image file",
            "@type": "IMAGE-THUMBNAIL",
            "@size": "12909",
            "@ref": "gr10",
            "@mimetype": "image/gif"
          },
          {
            "@category": "thumbnail",
            "@height": "77",
            "@width": "219",
            "@_fa": "true",
            "$": "https://api.elsevier.com/content/object/eid/1-s2.0-S1872206721638639-gr11.sml?httpAccept=%2A%2F%2A",
            "@multimediatype": "GIF image file",
            "@type": "IMAGE-THUMBNAIL",
            "@size": "12053",
            "@ref": "gr11",
            "@mimetype": "image/gif"
          },
          {
            "@category": "thumbnail",
            "@height": "74",
            "@width": "219",
            "@_fa": "true",
            "$": "https://api.elsevier.com/content/object/eid/1-s2.0-S1872206721638639-gr12.sml?httpAccept=%2A%2F%2A",
            "@multimediatype": "GIF image file",
            "@type": "IMAGE-THUMBNAIL",
            "@size": "10570",
            "@ref": "gr12",
            "@mimetype": "image/gif"
          },
          {
            "@category": "thumbnail",
            "@height": "100",
            "@width": "219",
            "@_fa": "true",
            "$": "https://api.elsevier.com/content/object/eid/1-s2.0-S1872206721638639-gr13.sml?httpAccept=%2A%2F%2A",
            "@multimediatype": "GIF image file",
            "@type": "IMAGE-THUMBNAIL",
            "@size": "13317",
            "@ref": "gr13",
            "@mimetype": "image/gif"
          },
          {
            "@category": "thumbnail",
            "@height": "137",
            "@width": "219",
            "@_fa": "true",
            "$": "https://api.elsevier.com/content/object/eid/1-s2.0-S1872206721638639-gr14.sml?httpAccept=%2A%2F%2A",
            "@multimediatype": "GIF image file",
            "@type": "IMAGE-THUMBNAIL",
            "@size": "14020",
            "@ref": "gr14",
            "@mimetype": "image/gif"
          },
          {
            "@category": "thumbnail",
            "@height": "116",
            "@width": "219",
            "@_fa": "true",
            "$": "https://api.elsevier.com/content/object/eid/1-s2.0-S1872206721638639-gr15.sml?httpAccept=%2A%2F%2A",
            "@multimediatype": "GIF image file",
            "@type": "IMAGE-THUMBNAIL",
            "@size": "9276",
            "@ref": "gr15",
            "@mimetype": "image/gif"
          },
          {
            "@category": "thumbnail",
            "@height": "154",
            "@width": "219",
            "@_fa": "true",
            "$": "https://api.elsevier.com/content/object/eid/1-s2.0-S1872206721638639-gr16.sml?httpAccept=%2A%2F%2A",
            "@multimediatype": "GIF image file",
            "@type": "IMAGE-THUMBNAIL",
            "@size": "19254",
            "@ref": "gr16",
            "@mimetype": "image/gif"
          },
          {
            "@category": "thumbnail",
            "@height": "164",
            "@width": "174",
            "@_fa": "true",
            "$": "https://api.elsevier.com/content/object/eid/1-s2.0-S1872206721638639-gr17.sml?httpAccept=%2A%2F%2A",
            "@multimediatype": "GIF image file",
            "@type": "IMAGE-THUMBNAIL",
            "@size": "17441",
            "@ref": "gr17",
            "@mimetype": "image/gif"
          },
          {
            "@category": "thumbnail",
            "@height": "164",
            "@width": "204",
            "@_fa": "true",
            "$": "https://api.elsevier.com/content/object/eid/1-s2.0-S1872206721638639-gr18.sml?httpAccept=%2A%2F%2A",
            "@multimediatype": "GIF image file",
            "@type": "IMAGE-THUMBNAIL",
            "@size": "15504",
            "@ref": "gr18",
            "@mimetype": "image/gif"
          },
          {
            "@category": "thumbnail",
            "@height": "164",
            "@width": "202",
            "@_fa": "true",
            "$": "https://api.elsevier.com/content/object/eid/1-s2.0-S1872206721638639-gr19.sml?httpAccept=%2A%2F%2A",
            "@multimediatype": "GIF image file",
            "@type": "IMAGE-THUMBNAIL",
            "@size": "11789",
            "@ref": "gr19",
            "@mimetype": "image/gif"
          },
          {
            "@category": "thumbnail",
            "@height": "155",
            "@width": "219",
            "@_fa": "true",
            "$": "https://api.elsevier.com/content/object/eid/1-s2.0-S1872206721638639-gr2.sml?httpAccept=%2A%2F%2A",
            "@multimediatype": "GIF image file",
            "@type": "IMAGE-THUMBNAIL",
            "@size": "8205",
            "@ref": "gr2",
            "@mimetype": "image/gif"
          },
          {
            "@category": "thumbnail",
            "@height": "121",
            "@width": "219",
            "@_fa": "true",
            "$": "https://api.elsevier.com/content/object/eid/1-s2.0-S1872206721638639-gr20.sml?httpAccept=%2A%2F%2A",
            "@multimediatype": "GIF image file",
            "@type": "IMAGE-THUMBNAIL",
            "@size": "15769",
            "@ref": "gr20",
            "@mimetype": "image/gif"
          },
          {
            "@category": "thumbnail",
            "@height": "105",
            "@width": "219",
            "@_fa": "true",
            "$": "https://api.elsevier.com/content/object/eid/1-s2.0-S1872206721638639-gr21.sml?httpAccept=%2A%2F%2A",
            "@multimediatype": "GIF image file",
            "@type": "IMAGE-THUMBNAIL",
            "@size": "9266",
            "@ref": "gr21",
            "@mimetype": "image/gif"
          },
          {
            "@category": "thumbnail",
            "@height": "109",
            "@width": "219",
            "@_fa": "true",
            "$": "https://api.elsevier.com/content/object/eid/1-s2.0-S1872206721638639-gr22.sml?httpAccept=%2A%2F%2A",
            "@multimediatype": "GIF image file",
            "@type": "IMAGE-THUMBNAIL",
            "@size": "19300",
            "@ref": "gr22",
            "@mimetype": "image/gif"
          },
          {
            "@category": "thumbnail",
            "@height": "103",
            "@width": "219",
            "@_fa": "true",
            "$": "https://api.elsevier.com/content/object/eid/1-s2.0-S1872206721638639-gr23.sml?httpAccept=%2A%2F%2A",
            "@multimediatype": "GIF image file",
            "@type": "IMAGE-THUMBNAIL",
            "@size": "12292",
            "@ref": "gr23",
            "@mimetype": "image/gif"
          },
          {
            "@category": "thumbnail",
            "@height": "147",
            "@width": "219",
            "@_fa": "true",
            "$": "https://api.elsevier.com/content/object/eid/1-s2.0-S1872206721638639-gr24.sml?httpAccept=%2A%2F%2A",
            "@multimediatype": "GIF image file",
            "@type": "IMAGE-THUMBNAIL",
            "@size": "24504",
            "@ref": "gr24",
            "@mimetype": "image/gif"
          },
          {
            "@category": "thumbnail",
            "@height": "163",
            "@width": "205",
            "@_fa": "true",
            "$": "https://api.elsevier.com/content/object/eid/1-s2.0-S1872206721638639-gr25.sml?httpAccept=%2A%2F%2A",
            "@multimediatype": "GIF image file",
            "@type": "IMAGE-THUMBNAIL",
            "@size": "14589",
            "@ref": "gr25",
            "@mimetype": "image/gif"
          },
          {
            "@category": "thumbnail",
            "@height": "111",
            "@width": "219",
            "@_fa": "true",
            "$": "https://api.elsevier.com/content/object/eid/1-s2.0-S1872206721638639-gr26.sml?httpAccept=%2A%2F%2A",
            "@multimediatype": "GIF image file",
            "@type": "IMAGE-THUMBNAIL",
            "@size": "11562",
            "@ref": "gr26",
            "@mimetype": "image/gif"
          },
          {
            "@category": "thumbnail",
            "@height": "120",
            "@width": "219",
            "@_fa": "true",
            "$": "https://api.elsevier.com/content/object/eid/1-s2.0-S1872206721638639-gr27.sml?httpAccept=%2A%2F%2A",
            "@multimediatype": "GIF image file",
            "@type": "IMAGE-THUMBNAIL",
            "@size": "15210",
            "@ref": "gr27",
            "@mimetype": "image/gif"
          },
          {
            "@category": "thumbnail",
            "@height": "111",
            "@width": "219",
            "@_fa": "true",
            "$": "https://api.elsevier.com/content/object/eid/1-s2.0-S1872206721638639-gr28.sml?httpAccept=%2A%2F%2A",
            "@multimediatype": "GIF image file",
            "@type": "IMAGE-THUMBNAIL",
            "@size": "15025",
            "@ref": "gr28",
            "@mimetype": "image/gif"
          },
          {
            "@category": "thumbnail",
            "@height": "116",
            "@width": "219",
            "@_fa": "true",
            "$": "https://api.elsevier.com/content/object/eid/1-s2.0-S1872206721638639-gr29.sml?httpAccept=%2A%2F%2A",
            "@multimediatype": "GIF image file",
            "@type": "IMAGE-THUMBNAIL",
            "@size": "14911",
            "@ref": "gr29",
            "@mimetype": "image/gif"
          },
          {
            "@category": "thumbnail",
            "@height": "164",
            "@width": "166",
            "@_fa": "true",
            "$": "https://api.elsevier.com/content/object/eid/1-s2.0-S1872206721638639-gr3.sml?httpAccept=%2A%2F%2A",
            "@multimediatype": "GIF image file",
            "@type": "IMAGE-THUMBNAIL",
            "@size": "19619",
            "@ref": "gr3",
            "@mimetype": "image/gif"
          },
          {
            "@category": "thumbnail",
            "@height": "102",
            "@width": "219",
            "@_fa": "true",
            "$": "https://api.elsevier.com/content/object/eid/1-s2.0-S1872206721638639-gr30.sml?httpAccept=%2A%2F%2A",
            "@multimediatype": "GIF image file",
            "@type": "IMAGE-THUMBNAIL",
            "@size": "12204",
            "@ref": "gr30",
            "@mimetype": "image/gif"
          },
          {
            "@category": "thumbnail",
            "@height": "164",
            "@width": "192",
            "@_fa": "true",
            "$": "https://api.elsevier.com/content/object/eid/1-s2.0-S1872206721638639-gr31.sml?httpAccept=%2A%2F%2A",
            "@multimediatype": "GIF image file",
            "@type": "IMAGE-THUMBNAIL",
            "@size": "16134",
            "@ref": "gr31",
            "@mimetype": "image/gif"
          },
          {
            "@category": "thumbnail",
            "@height": "95",
            "@width": "219",
            "@_fa": "true",
            "$": "https://api.elsevier.com/content/object/eid/1-s2.0-S1872206721638639-gr32.sml?httpAccept=%2A%2F%2A",
            "@multimediatype": "GIF image file",
            "@type": "IMAGE-THUMBNAIL",
            "@size": "12111",
            "@ref": "gr32",
            "@mimetype": "image/gif"
          },
          {
            "@category": "thumbnail",
            "@height": "160",
            "@width": "219",
            "@_fa": "true",
            "$": "https://api.elsevier.com/content/object/eid/1-s2.0-S1872206721638639-gr33.sml?httpAccept=%2A%2F%2A",
            "@multimediatype": "GIF image file",
            "@type": "IMAGE-THUMBNAIL",
            "@size": "11182",
            "@ref": "gr33",
            "@mimetype": "image/gif"
          },
          {
            "@category": "thumbnail",
            "@height": "163",
            "@width": "171",
            "@_fa": "true",
            "$": "https://api.elsevier.com/content/object/eid/1-s2.0-S1872206721638639-gr34.sml?httpAccept=%2A%2F%2A",
            "@multimediatype": "GIF image file",
            "@type": "IMAGE-THUMBNAIL",
            "@size": "15257",
            "@ref": "gr34",
            "@mimetype": "image/gif"
          },
          {
            "@category": "thumbnail",
            "@height": "115",
            "@width": "219",
            "@_fa": "true",
            "$": "https://api.elsevier.com/content/object/eid/1-s2.0-S1872206721638639-gr35.sml?httpAccept=%2A%2F%2A",
            "@multimediatype": "GIF image file",
            "@type": "IMAGE-THUMBNAIL",
            "@size": "12054",
            "@ref": "gr35",
            "@mimetype": "image/gif"
          },
          {
            "@category": "thumbnail",
            "@height": "136",
            "@width": "219",
            "@_fa": "true",
            "$": "https://api.elsevier.com/content/object/eid/1-s2.0-S1872206721638639-gr4.sml?httpAccept=%2A%2F%2A",
            "@multimediatype": "GIF image file",
            "@type": "IMAGE-THUMBNAIL",
            "@size": "14129",
            "@ref": "gr4",
            "@mimetype": "image/gif"
          },
          {
            "@category": "thumbnail",
            "@height": "150",
            "@width": "219",
            "@_fa": "true",
            "$": "https://api.elsevier.com/content/object/eid/1-s2.0-S1872206721638639-gr5.sml?httpAccept=%2A%2F%2A",
            "@multimediatype": "GIF image file",
            "@type": "IMAGE-THUMBNAIL",
            "@size": "18830",
            "@ref": "gr5",
            "@mimetype": "image/gif"
          },
          {
            "@category": "thumbnail",
            "@height": "44",
            "@width": "219",
            "@_fa": "true",
            "$": "https://api.elsevier.com/content/object/eid/1-s2.0-S1872206721638639-gr6.sml?httpAccept=%2A%2F%2A",
            "@multimediatype": "GIF image file",
            "@type": "IMAGE-THUMBNAIL",
            "@size": "4970",
            "@ref": "gr6",
            "@mimetype": "image/gif"
          },
          {
            "@category": "thumbnail",
            "@height": "153",
            "@width": "219",
            "@_fa": "true",
            "$": "https://api.elsevier.com/content/object/eid/1-s2.0-S1872206721638639-gr7.sml?httpAccept=%2A%2F%2A",
            "@multimediatype": "GIF image file",
            "@type": "IMAGE-THUMBNAIL",
            "@size": "13614",
            "@ref": "gr7",
            "@mimetype": "image/gif"
          },
          {
            "@category": "thumbnail",
            "@height": "118",
            "@width": "219",
            "@_fa": "true",
            "$": "https://api.elsevier.com/content/object/eid/1-s2.0-S1872206721638639-gr8.sml?httpAccept=%2A%2F%2A",
            "@multimediatype": "GIF image file",
            "@type": "IMAGE-THUMBNAIL",
            "@size": "16231",
            "@ref": "gr8",
            "@mimetype": "image/gif"
          },
          {
            "@category": "thumbnail",
            "@height": "65",
            "@width": "219",
            "@_fa": "true",
            "$": "https://api.elsevier.com/content/object/eid/1-s2.0-S1872206721638639-gr9.sml?httpAccept=%2A%2F%2A",
            "@multimediatype": "GIF image file",
            "@type": "IMAGE-THUMBNAIL",
            "@size": "9097",
            "@ref": "gr9",
            "@mimetype": "image/gif"
          },
          {
            "@category": "thumbnail",
            "@height": "163",
            "@width": "172",
            "@_fa": "true",
            "$": "https://api.elsevier.com/content/object/eid/1-s2.0-S1872206721638639-grap.sml?httpAccept=%2A%2F%2A",
            "@multimediatype": "GIF image file",
            "@type": "IMAGE-THUMBNAIL",
            "@size": "15504",
            "@ref": "grap",
            "@mimetype": "image/gif"
          },
          {
            "@category": "high",
            "@height": "327",
            "@width": "187",
            "@_fa": "true",
            "$": "https://api.elsevier.com/content/object/eid/1-s2.0-S1872206721638639-fx1_lrg.jpg?httpAccept=%2A%2F%2A",
            "@multimediatype": "JPEG image file",
            "@type": "IMAGE-HIGH-RES",
            "@size": "20952",
            "@ref": "fx1",
            "@mimetype": "image/jpeg"
          },
          {
            "@category": "high",
            "@height": "320",
            "@width": "177",
            "@_fa": "true",
            "$": "https://api.elsevier.com/content/object/eid/1-s2.0-S1872206721638639-fx10_lrg.jpg?httpAccept=%2A%2F%2A",
            "@multimediatype": "JPEG image file",
            "@type": "IMAGE-HIGH-RES",
            "@size": "36202",
            "@ref": "fx10",
            "@mimetype": "image/jpeg"
          },
          {
            "@category": "high",
            "@height": "319",
            "@width": "176",
            "@_fa": "true",
            "$": "https://api.elsevier.com/content/object/eid/1-s2.0-S1872206721638639-fx11_lrg.jpg?httpAccept=%2A%2F%2A",
            "@multimediatype": "JPEG image file",
            "@type": "IMAGE-HIGH-RES",
            "@size": "23048",
            "@ref": "fx11",
            "@mimetype": "image/jpeg"
          },
          {
            "@category": "high",
            "@height": "328",
            "@width": "177",
            "@_fa": "true",
            "$": "https://api.elsevier.com/content/object/eid/1-s2.0-S1872206721638639-fx12_lrg.jpg?httpAccept=%2A%2F%2A",
            "@multimediatype": "JPEG image file",
            "@type": "IMAGE-HIGH-RES",
            "@size": "24137",
            "@ref": "fx12",
            "@mimetype": "image/jpeg"
          },
          {
            "@category": "high",
            "@height": "297",
            "@width": "201",
            "@_fa": "true",
            "$": "https://api.elsevier.com/content/object/eid/1-s2.0-S1872206721638639-fx13_lrg.jpg?httpAccept=%2A%2F%2A",
            "@multimediatype": "JPEG image file",
            "@type": "IMAGE-HIGH-RES",
            "@size": "18875",
            "@ref": "fx13",
            "@mimetype": "image/jpeg"
          },
          {
            "@category": "high",
            "@height": "325",
            "@width": "179",
            "@_fa": "true",
            "$": "https://api.elsevier.com/content/object/eid/1-s2.0-S1872206721638639-fx14_lrg.jpg?httpAccept=%2A%2F%2A",
            "@multimediatype": "JPEG image file",
            "@type": "IMAGE-HIGH-RES",
            "@size": "16946",
            "@ref": "fx14",
            "@mimetype": "image/jpeg"
          },
          {
            "@category": "high",
            "@height": "298",
            "@width": "189",
            "@_fa": "true",
            "$": "https://api.elsevier.com/content/object/eid/1-s2.0-S1872206721638639-fx15_lrg.jpg?httpAccept=%2A%2F%2A",
            "@multimediatype": "JPEG image file",
            "@type": "IMAGE-HIGH-RES",
            "@size": "21506",
            "@ref": "fx15",
            "@mimetype": "image/jpeg"
          },
          {
            "@category": "high",
            "@height": "182",
            "@width": "201",
            "@_fa": "true",
            "$": "https://api.elsevier.com/content/object/eid/1-s2.0-S1872206721638639-fx16_lrg.jpg?httpAccept=%2A%2F%2A",
            "@multimediatype": "JPEG image file",
            "@type": "IMAGE-HIGH-RES",
            "@size": "11816",
            "@ref": "fx16",
            "@mimetype": "image/jpeg"
          },
          {
            "@category": "high",
            "@height": "346",
            "@width": "188",
            "@_fa": "true",
            "$": "https://api.elsevier.com/content/object/eid/1-s2.0-S1872206721638639-fx17_lrg.jpg?httpAccept=%2A%2F%2A",
            "@multimediatype": "JPEG image file",
            "@type": "IMAGE-HIGH-RES",
            "@size": "19507",
            "@ref": "fx17",
            "@mimetype": "image/jpeg"
          },
          {
            "@category": "high",
            "@height": "350",
            "@width": "190",
            "@_fa": "true",
            "$": "https://api.elsevier.com/content/object/eid/1-s2.0-S1872206721638639-fx18_lrg.jpg?httpAccept=%2A%2F%2A",
            "@multimediatype": "JPEG image file",
            "@type": "IMAGE-HIGH-RES",
            "@size": "24371",
            "@ref": "fx18",
            "@mimetype": "image/jpeg"
          },
          {
            "@category": "high",
            "@height": "224",
            "@width": "216",
            "@_fa": "true",
            "$": "https://api.elsevier.com/content/object/eid/1-s2.0-S1872206721638639-fx19_lrg.jpg?httpAccept=%2A%2F%2A",
            "@multimediatype": "JPEG image file",
            "@type": "IMAGE-HIGH-RES",
            "@size": "12108",
            "@ref": "fx19",
            "@mimetype": "image/jpeg"
          },
          {
            "@category": "high",
            "@height": "204",
            "@width": "187",
            "@_fa": "true",
            "$": "https://api.elsevier.com/content/object/eid/1-s2.0-S1872206721638639-fx2_lrg.jpg?httpAccept=%2A%2F%2A",
            "@multimediatype": "JPEG image file",
            "@type": "IMAGE-HIGH-RES",
            "@size": "10798",
            "@ref": "fx2",
            "@mimetype": "image/jpeg"
          },
          {
            "@category": "high",
            "@height": "317",
            "@width": "169",
            "@_fa": "true",
            "$": "https://api.elsevier.com/content/object/eid/1-s2.0-S1872206721638639-fx20_lrg.jpg?httpAccept=%2A%2F%2A",
            "@multimediatype": "JPEG image file",
            "@type": "IMAGE-HIGH-RES",
            "@size": "20374",
            "@ref": "fx20",
            "@mimetype": "image/jpeg"
          },
          {
            "@category": "high",
            "@height": "258",
            "@width": "172",
            "@_fa": "true",
            "$": "https://api.elsevier.com/content/object/eid/1-s2.0-S1872206721638639-fx21_lrg.jpg?httpAccept=%2A%2F%2A",
            "@multimediatype": "JPEG image file",
            "@type": "IMAGE-HIGH-RES",
            "@size": "16181",
            "@ref": "fx21",
            "@mimetype": "image/jpeg"
          },
          {
            "@category": "high",
            "@height": "219",
            "@width": "171",
            "@_fa": "true",
            "$": "https://api.elsevier.com/content/object/eid/1-s2.0-S1872206721638639-fx22_lrg.jpg?httpAccept=%2A%2F%2A",
            "@multimediatype": "JPEG image file",
            "@type": "IMAGE-HIGH-RES",
            "@size": "22165",
            "@ref": "fx22",
            "@mimetype": "image/jpeg"
          },
          {
            "@category": "high",
            "@height": "326",
            "@width": "172",
            "@_fa": "true",
            "$": "https://api.elsevier.com/content/object/eid/1-s2.0-S1872206721638639-fx23_lrg.jpg?httpAccept=%2A%2F%2A",
            "@multimediatype": "JPEG image file",
            "@type": "IMAGE-HIGH-RES",
            "@size": "30015",
            "@ref": "fx23",
            "@mimetype": "image/jpeg"
          },
          {
            "@category": "high",
            "@height": "160",
            "@width": "165",
            "@_fa": "true",
            "$": "https://api.elsevier.com/content/object/eid/1-s2.0-S1872206721638639-fx24_lrg.jpg?httpAccept=%2A%2F%2A",
            "@multimediatype": "JPEG image file",
            "@type": "IMAGE-HIGH-RES",
            "@size": "10611",
            "@ref": "fx24",
            "@mimetype": "image/jpeg"
          },
          {
            "@category": "high",
            "@height": "343",
            "@width": "178",
            "@_fa": "true",
            "$": "https://api.elsevier.com/content/object/eid/1-s2.0-S1872206721638639-fx25_lrg.jpg?httpAccept=%2A%2F%2A",
            "@multimediatype": "JPEG image file",
            "@type": "IMAGE-HIGH-RES",
            "@size": "21601",
            "@ref": "fx25",
            "@mimetype": "image/jpeg"
          },
          {
            "@category": "high",
            "@height": "331",
            "@width": "178",
            "@_fa": "true",
            "$": "https://api.elsevier.com/content/object/eid/1-s2.0-S1872206721638639-fx26_lrg.jpg?httpAccept=%2A%2F%2A",
            "@multimediatype": "JPEG image file",
            "@type": "IMAGE-HIGH-RES",
            "@size": "25839",
            "@ref": "fx26",
            "@mimetype": "image/jpeg"
          },
          {
            "@category": "high",
            "@height": "394",
            "@width": "186",
            "@_fa": "true",
            "$": "https://api.elsevier.com/content/object/eid/1-s2.0-S1872206721638639-fx27_lrg.jpg?httpAccept=%2A%2F%2A",
            "@multimediatype": "JPEG image file",
            "@type": "IMAGE-HIGH-RES",
            "@size": "30560",
            "@ref": "fx27",
            "@mimetype": "image/jpeg"
          },
          {
            "@category": "high",
            "@height": "297",
            "@width": "178",
            "@_fa": "true",
            "$": "https://api.elsevier.com/content/object/eid/1-s2.0-S1872206721638639-fx28_lrg.jpg?httpAccept=%2A%2F%2A",
            "@multimediatype": "JPEG image file",
            "@type": "IMAGE-HIGH-RES",
            "@size": "21374",
            "@ref": "fx28",
            "@mimetype": "image/jpeg"
          },
          {
            "@category": "high",
            "@height": "373",
            "@width": "178",
            "@_fa": "true",
            "$": "https://api.elsevier.com/content/object/eid/1-s2.0-S1872206721638639-fx29_lrg.jpg?httpAccept=%2A%2F%2A",
            "@multimediatype": "JPEG image file",
            "@type": "IMAGE-HIGH-RES",
            "@size": "28256",
            "@ref": "fx29",
            "@mimetype": "image/jpeg"
          },
          {
            "@category": "high",
            "@height": "321",
            "@width": "184",
            "@_fa": "true",
            "$": "https://api.elsevier.com/content/object/eid/1-s2.0-S1872206721638639-fx3_lrg.jpg?httpAccept=%2A%2F%2A",
            "@multimediatype": "JPEG image file",
            "@type": "IMAGE-HIGH-RES",
            "@size": "18511",
            "@ref": "fx3",
            "@mimetype": "image/jpeg"
          },
          {
            "@category": "high",
            "@height": "327",
            "@width": "177",
            "@_fa": "true",
            "$": "https://api.elsevier.com/content/object/eid/1-s2.0-S1872206721638639-fx30_lrg.jpg?httpAccept=%2A%2F%2A",
            "@multimediatype": "JPEG image file",
            "@type": "IMAGE-HIGH-RES",
            "@size": "22488",
            "@ref": "fx30",
            "@mimetype": "image/jpeg"
          },
          {
            "@category": "high",
            "@height": "344",
            "@width": "178",
            "@_fa": "true",
            "$": "https://api.elsevier.com/content/object/eid/1-s2.0-S1872206721638639-fx31_lrg.jpg?httpAccept=%2A%2F%2A",
            "@multimediatype": "JPEG image file",
            "@type": "IMAGE-HIGH-RES",
            "@size": "22289",
            "@ref": "fx31",
            "@mimetype": "image/jpeg"
          },
          {
            "@category": "high",
            "@height": "156",
            "@width": "173",
            "@_fa": "true",
            "$": "https://api.elsevier.com/content/object/eid/1-s2.0-S1872206721638639-fx32_lrg.jpg?httpAccept=%2A%2F%2A",
            "@multimediatype": "JPEG image file",
            "@type": "IMAGE-HIGH-RES",
            "@size": "9116",
            "@ref": "fx32",
            "@mimetype": "image/jpeg"
          },
          {
            "@category": "high",
            "@height": "289",
            "@width": "168",
            "@_fa": "true",
            "$": "https://api.elsevier.com/content/object/eid/1-s2.0-S1872206721638639-fx33_lrg.jpg?httpAccept=%2A%2F%2A",
            "@multimediatype": "JPEG image file",
            "@type": "IMAGE-HIGH-RES",
            "@size": "22135",
            "@ref": "fx33",
            "@mimetype": "image/jpeg"
          },
          {
            "@category": "high",
            "@height": "296",
            "@width": "166",
            "@_fa": "true",
            "$": "https://api.elsevier.com/content/object/eid/1-s2.0-S1872206721638639-fx34_lrg.jpg?httpAccept=%2A%2F%2A",
            "@multimediatype": "JPEG image file",
            "@type": "IMAGE-HIGH-RES",
            "@size": "14901",
            "@ref": "fx34",
            "@mimetype": "image/jpeg"
          },
          {
            "@category": "high",
            "@height": "318",
            "@width": "158",
            "@_fa": "true",
            "$": "https://api.elsevier.com/content/object/eid/1-s2.0-S1872206721638639-fx35_lrg.jpg?httpAccept=%2A%2F%2A",
            "@multimediatype": "JPEG image file",
            "@type": "IMAGE-HIGH-RES",
            "@size": "15523",
            "@ref": "fx35",
            "@mimetype": "image/jpeg"
          },
          {
            "@category": "high",
            "@height": "324",
            "@width": "187",
            "@_fa": "true",
            "$": "https://api.elsevier.com/content/object/eid/1-s2.0-S1872206721638639-fx4_lrg.jpg?httpAccept=%2A%2F%2A",
            "@multimediatype": "JPEG image file",
            "@type": "IMAGE-HIGH-RES",
            "@size": "29044",
            "@ref": "fx4",
            "@mimetype": "image/jpeg"
          },
          {
            "@category": "high",
            "@height": "346",
            "@width": "177",
            "@_fa": "true",
            "$": "https://api.elsevier.com/content/object/eid/1-s2.0-S1872206721638639-fx5_lrg.jpg?httpAccept=%2A%2F%2A",
            "@multimediatype": "JPEG image file",
            "@type": "IMAGE-HIGH-RES",
            "@size": "20939",
            "@ref": "fx5",
            "@mimetype": "image/jpeg"
          },
          {
            "@category": "high",
            "@height": "285",
            "@width": "174",
            "@_fa": "true",
            "$": "https://api.elsevier.com/content/object/eid/1-s2.0-S1872206721638639-fx6_lrg.jpg?httpAccept=%2A%2F%2A",
            "@multimediatype": "JPEG image file",
            "@type": "IMAGE-HIGH-RES",
            "@size": "18622",
            "@ref": "fx6",
            "@mimetype": "image/jpeg"
          },
          {
            "@category": "high",
            "@height": "315",
            "@width": "178",
            "@_fa": "true",
            "$": "https://api.elsevier.com/content/object/eid/1-s2.0-S1872206721638639-fx7_lrg.jpg?httpAccept=%2A%2F%2A",
            "@multimediatype": "JPEG image file",
            "@type": "IMAGE-HIGH-RES",
            "@size": "21638",
            "@ref": "fx7",
            "@mimetype": "image/jpeg"
          },
          {
            "@category": "high",
            "@height": "317",
            "@width": "173",
            "@_fa": "true",
            "$": "https://api.elsevier.com/content/object/eid/1-s2.0-S1872206721638639-fx8_lrg.jpg?httpAccept=%2A%2F%2A",
            "@multimediatype": "JPEG image file",
            "@type": "IMAGE-HIGH-RES",
            "@size": "29915",
            "@ref": "fx8",
            "@mimetype": "image/jpeg"
          },
          {
            "@category": "high",
            "@height": "367",
            "@width": "177",
            "@_fa": "true",
            "$": "https://api.elsevier.com/content/object/eid/1-s2.0-S1872206721638639-fx9_lrg.jpg?httpAccept=%2A%2F%2A",
            "@multimediatype": "JPEG image file",
            "@type": "IMAGE-HIGH-RES",
            "@size": "17313",
            "@ref": "fx9",
            "@mimetype": "image/jpeg"
          },
          {
            "@category": "high",
            "@height": "397",
            "@width": "892",
            "@_fa": "true",
            "$": "https://api.elsevier.com/content/object/eid/1-s2.0-S1872206721638639-gr1_lrg.jpg?httpAccept=%2A%2F%2A",
            "@multimediatype": "JPEG image file",
            "@type": "IMAGE-HIGH-RES",
            "@size": "64370",
            "@ref": "gr1",
            "@mimetype": "image/jpeg"
          },
          {
            "@category": "high",
            "@height": "438",
            "@width": "984",
            "@_fa": "true",
            "$": "https://api.elsevier.com/content/object/eid/1-s2.0-S1872206721638639-gr10_lrg.jpg?httpAccept=%2A%2F%2A",
            "@multimediatype": "JPEG image file",
            "@type": "IMAGE-HIGH-RES",
            "@size": "110049",
            "@ref": "gr10",
            "@mimetype": "image/jpeg"
          },
          {
            "@category": "high",
            "@height": "349",
            "@width": "992",
            "@_fa": "true",
            "$": "https://api.elsevier.com/content/object/eid/1-s2.0-S1872206721638639-gr11_lrg.jpg?httpAccept=%2A%2F%2A",
            "@multimediatype": "JPEG image file",
            "@type": "IMAGE-HIGH-RES",
            "@size": "116424",
            "@ref": "gr11",
            "@mimetype": "image/jpeg"
          },
          {
            "@category": "high",
            "@height": "525",
            "@width": "1547",
            "@_fa": "true",
            "$": "https://api.elsevier.com/content/object/eid/1-s2.0-S1872206721638639-gr12_lrg.jpg?httpAccept=%2A%2F%2A",
            "@multimediatype": "JPEG image file",
            "@type": "IMAGE-HIGH-RES",
            "@size": "170235",
            "@ref": "gr12",
            "@mimetype": "image/jpeg"
          },
          {
            "@category": "high",
            "@height": "449",
            "@width": "985",
            "@_fa": "true",
            "$": "https://api.elsevier.com/content/object/eid/1-s2.0-S1872206721638639-gr13_lrg.jpg?httpAccept=%2A%2F%2A",
            "@multimediatype": "JPEG image file",
            "@type": "IMAGE-HIGH-RES",
            "@size": "115908",
            "@ref": "gr13",
            "@mimetype": "image/jpeg"
          },
          {
            "@category": "high",
            "@height": "610",
            "@width": "976",
            "@_fa": "true",
            "$": "https://api.elsevier.com/content/object/eid/1-s2.0-S1872206721638639-gr14_lrg.jpg?httpAccept=%2A%2F%2A",
            "@multimediatype": "JPEG image file",
            "@type": "IMAGE-HIGH-RES",
            "@size": "136011",
            "@ref": "gr14",
            "@mimetype": "image/jpeg"
          },
          {
            "@category": "high",
            "@height": "743",
            "@width": "1398",
            "@_fa": "true",
            "$": "https://api.elsevier.com/content/object/eid/1-s2.0-S1872206721638639-gr15_lrg.jpg?httpAccept=%2A%2F%2A",
            "@multimediatype": "JPEG image file",
            "@type": "IMAGE-HIGH-RES",
            "@size": "133230",
            "@ref": "gr15",
            "@mimetype": "image/jpeg"
          },
          {
            "@category": "high",
            "@height": "1066",
            "@width": "1513",
            "@_fa": "true",
            "$": "https://api.elsevier.com/content/object/eid/1-s2.0-S1872206721638639-gr16_lrg.jpg?httpAccept=%2A%2F%2A",
            "@multimediatype": "JPEG image file",
            "@type": "IMAGE-HIGH-RES",
            "@size": "363833",
            "@ref": "gr16",
            "@mimetype": "image/jpeg"
          },
          {
            "@category": "high",
            "@height": "1336",
            "@width": "1418",
            "@_fa": "true",
            "$": "https://api.elsevier.com/content/object/eid/1-s2.0-S1872206721638639-gr17_lrg.jpg?httpAccept=%2A%2F%2A",
            "@multimediatype": "JPEG image file",
            "@type": "IMAGE-HIGH-RES",
            "@size": "435521",
            "@ref": "gr17",
            "@mimetype": "image/jpeg"
          },
          {
            "@category": "high",
            "@height": "1124",
            "@width": "1401",
            "@_fa": "true",
            "$": "https://api.elsevier.com/content/object/eid/1-s2.0-S1872206721638639-gr18_lrg.jpg?httpAccept=%2A%2F%2A",
            "@multimediatype": "JPEG image file",
            "@type": "IMAGE-HIGH-RES",
            "@size": "320407",
            "@ref": "gr18",
            "@mimetype": "image/jpeg"
          },
          {
            "@category": "high",
            "@height": "771",
            "@width": "951",
            "@_fa": "true",
            "$": "https://api.elsevier.com/content/object/eid/1-s2.0-S1872206721638639-gr19_lrg.jpg?httpAccept=%2A%2F%2A",
            "@multimediatype": "JPEG image file",
            "@type": "IMAGE-HIGH-RES",
            "@size": "142835",
            "@ref": "gr19",
            "@mimetype": "image/jpeg"
          },
          {
            "@category": "high",
            "@height": "682",
            "@width": "966",
            "@_fa": "true",
            "$": "https://api.elsevier.com/content/object/eid/1-s2.0-S1872206721638639-gr2_lrg.jpg?httpAccept=%2A%2F%2A",
            "@multimediatype": "JPEG image file",
            "@type": "IMAGE-HIGH-RES",
            "@size": "100479",
            "@ref": "gr2",
            "@mimetype": "image/jpeg"
          },
          {
            "@category": "high",
            "@height": "754",
            "@width": "1367",
            "@_fa": "true",
            "$": "https://api.elsevier.com/content/object/eid/1-s2.0-S1872206721638639-gr20_lrg.jpg?httpAccept=%2A%2F%2A",
            "@multimediatype": "JPEG image file",
            "@type": "IMAGE-HIGH-RES",
            "@size": "231632",
            "@ref": "gr20",
            "@mimetype": "image/jpeg"
          },
          {
            "@category": "high",
            "@height": "681",
            "@width": "1418",
            "@_fa": "true",
            "$": "https://api.elsevier.com/content/object/eid/1-s2.0-S1872206721638639-gr21_lrg.jpg?httpAccept=%2A%2F%2A",
            "@multimediatype": "JPEG image file",
            "@type": "IMAGE-HIGH-RES",
            "@size": "163891",
            "@ref": "gr21",
            "@mimetype": "image/jpeg"
          },
          {
            "@category": "high",
            "@height": "642",
            "@width": "1294",
            "@_fa": "true",
            "$": "https://api.elsevier.com/content/object/eid/1-s2.0-S1872206721638639-gr22_lrg.jpg?httpAccept=%2A%2F%2A",
            "@multimediatype": "JPEG image file",
            "@type": "IMAGE-HIGH-RES",
            "@size": "273293",
            "@ref": "gr22",
            "@mimetype": "image/jpeg"
          },
          {
            "@category": "high",
            "@height": "806",
            "@width": "1713",
            "@_fa": "true",
            "$": "https://api.elsevier.com/content/object/eid/1-s2.0-S1872206721638639-gr23_lrg.jpg?httpAccept=%2A%2F%2A",
            "@multimediatype": "JPEG image file",
            "@type": "IMAGE-HIGH-RES",
            "@size": "300162",
            "@ref": "gr23",
            "@mimetype": "image/jpeg"
          },
          {
            "@category": "high",
            "@height": "649",
            "@width": "964",
            "@_fa": "true",
            "$": "https://api.elsevier.com/content/object/eid/1-s2.0-S1872206721638639-gr24_lrg.jpg?httpAccept=%2A%2F%2A",
            "@multimediatype": "JPEG image file",
            "@type": "IMAGE-HIGH-RES",
            "@size": "164944",
            "@ref": "gr24",
            "@mimetype": "image/jpeg"
          },
          {
            "@category": "high",
            "@height": "1091",
            "@width": "1368",
            "@_fa": "true",
            "$": "https://api.elsevier.com/content/object/eid/1-s2.0-S1872206721638639-gr25_lrg.jpg?httpAccept=%2A%2F%2A",
            "@multimediatype": "JPEG image file",
            "@type": "IMAGE-HIGH-RES",
            "@size": "282893",
            "@ref": "gr25",
            "@mimetype": "image/jpeg"
          },
          {
            "@category": "high",
            "@height": "779",
            "@width": "1531",
            "@_fa": "true",
            "$": "https://api.elsevier.com/content/object/eid/1-s2.0-S1872206721638639-gr26_lrg.jpg?httpAccept=%2A%2F%2A",
            "@multimediatype": "JPEG image file",
            "@type": "IMAGE-HIGH-RES",
            "@size": "225933",
            "@ref": "gr26",
            "@mimetype": "image/jpeg"
          },
          {
            "@category": "high",
            "@height": "698",
            "@width": "1276",
            "@_fa": "true",
            "$": "https://api.elsevier.com/content/object/eid/1-s2.0-S1872206721638639-gr27_lrg.jpg?httpAccept=%2A%2F%2A",
            "@multimediatype": "JPEG image file",
            "@type": "IMAGE-HIGH-RES",
            "@size": "191946",
            "@ref": "gr27",
            "@mimetype": "image/jpeg"
          },
          {
            "@category": "high",
            "@height": "713",
            "@width": "1402",
            "@_fa": "true",
            "$": "https://api.elsevier.com/content/object/eid/1-s2.0-S1872206721638639-gr28_lrg.jpg?httpAccept=%2A%2F%2A",
            "@multimediatype": "JPEG image file",
            "@type": "IMAGE-HIGH-RES",
            "@size": "221256",
            "@ref": "gr28",
            "@mimetype": "image/jpeg"
          },
          {
            "@category": "high",
            "@height": "520",
            "@width": "980",
            "@_fa": "true",
            "$": "https://api.elsevier.com/content/object/eid/1-s2.0-S1872206721638639-gr29_lrg.jpg?httpAccept=%2A%2F%2A",
            "@multimediatype": "JPEG image file",
            "@type": "IMAGE-HIGH-RES",
            "@size": "136691",
            "@ref": "gr29",
            "@mimetype": "image/jpeg"
          },
          {
            "@category": "high",
            "@height": "855",
            "@width": "867",
            "@_fa": "true",
            "$": "https://api.elsevier.com/content/object/eid/1-s2.0-S1872206721638639-gr3_lrg.jpg?httpAccept=%2A%2F%2A",
            "@multimediatype": "JPEG image file",
            "@type": "IMAGE-HIGH-RES",
            "@size": "170816",
            "@ref": "gr3",
            "@mimetype": "image/jpeg"
          },
          {
            "@category": "high",
            "@height": "761",
            "@width": "1626",
            "@_fa": "true",
            "$": "https://api.elsevier.com/content/object/eid/1-s2.0-S1872206721638639-gr30_lrg.jpg?httpAccept=%2A%2F%2A",
            "@multimediatype": "JPEG image file",
            "@type": "IMAGE-HIGH-RES",
            "@size": "272338",
            "@ref": "gr30",
            "@mimetype": "image/jpeg"
          },
          {
            "@category": "high",
            "@height": "1405",
            "@width": "1644",
            "@_fa": "true",
            "$": "https://api.elsevier.com/content/object/eid/1-s2.0-S1872206721638639-gr31_lrg.jpg?httpAccept=%2A%2F%2A",
            "@multimediatype": "JPEG image file",
            "@type": "IMAGE-HIGH-RES",
            "@size": "398866",
            "@ref": "gr31",
            "@mimetype": "image/jpeg"
          },
          {
            "@category": "high",
            "@height": "741",
            "@width": "1709",
            "@_fa": "true",
            "$": "https://api.elsevier.com/content/object/eid/1-s2.0-S1872206721638639-gr32_lrg.jpg?httpAccept=%2A%2F%2A",
            "@multimediatype": "JPEG image file",
            "@type": "IMAGE-HIGH-RES",
            "@size": "327052",
            "@ref": "gr32",
            "@mimetype": "image/jpeg"
          },
          {
            "@category": "high",
            "@height": "805",
            "@width": "1101",
            "@_fa": "true",
            "$": "https://api.elsevier.com/content/object/eid/1-s2.0-S1872206721638639-gr33_lrg.jpg?httpAccept=%2A%2F%2A",
            "@multimediatype": "JPEG image file",
            "@type": "IMAGE-HIGH-RES",
            "@size": "158115",
            "@ref": "gr33",
            "@mimetype": "image/jpeg"
          },
          {
            "@category": "high",
            "@height": "660",
            "@width": "691",
            "@_fa": "true",
            "$": "https://api.elsevier.com/content/object/eid/1-s2.0-S1872206721638639-gr34_lrg.jpg?httpAccept=%2A%2F%2A",
            "@multimediatype": "JPEG image file",
            "@type": "IMAGE-HIGH-RES",
            "@size": "139844",
            "@ref": "gr34",
            "@mimetype": "image/jpeg"
          },
          {
            "@category": "high",
            "@height": "512",
            "@width": "978",
            "@_fa": "true",
            "$": "https://api.elsevier.com/content/object/eid/1-s2.0-S1872206721638639-gr35_lrg.jpg?httpAccept=%2A%2F%2A",
            "@multimediatype": "JPEG image file",
            "@type": "IMAGE-HIGH-RES",
            "@size": "112273",
            "@ref": "gr35",
            "@mimetype": "image/jpeg"
          },
          {
            "@category": "high",
            "@height": "557",
            "@width": "895",
            "@_fa": "true",
            "$": "https://api.elsevier.com/content/object/eid/1-s2.0-S1872206721638639-gr4_lrg.jpg?httpAccept=%2A%2F%2A",
            "@multimediatype": "JPEG image file",
            "@type": "IMAGE-HIGH-RES",
            "@size": "121285",
            "@ref": "gr4",
            "@mimetype": "image/jpeg"
          },
          {
            "@category": "high",
            "@height": "658",
            "@width": "962",
            "@_fa": "true",
            "$": "https://api.elsevier.com/content/object/eid/1-s2.0-S1872206721638639-gr5_lrg.jpg?httpAccept=%2A%2F%2A",
            "@multimediatype": "JPEG image file",
            "@type": "IMAGE-HIGH-RES",
            "@size": "159218",
            "@ref": "gr5",
            "@mimetype": "image/jpeg"
          },
          {
            "@category": "high",
            "@height": "185",
            "@width": "929",
            "@_fa": "true",
            "$": "https://api.elsevier.com/content/object/eid/1-s2.0-S1872206721638639-gr6_lrg.jpg?httpAccept=%2A%2F%2A",
            "@multimediatype": "JPEG image file",
            "@type": "IMAGE-HIGH-RES",
            "@size": "39276",
            "@ref": "gr6",
            "@mimetype": "image/jpeg"
          },
          {
            "@category": "high",
            "@height": "693",
            "@width": "989",
            "@_fa": "true",
            "$": "https://api.elsevier.com/content/object/eid/1-s2.0-S1872206721638639-gr7_lrg.jpg?httpAccept=%2A%2F%2A",
            "@multimediatype": "JPEG image file",
            "@type": "IMAGE-HIGH-RES",
            "@size": "120408",
            "@ref": "gr7",
            "@mimetype": "image/jpeg"
          },
          {
            "@category": "high",
            "@height": "535",
            "@width": "990",
            "@_fa": "true",
            "$": "https://api.elsevier.com/content/object/eid/1-s2.0-S1872206721638639-gr8_lrg.jpg?httpAccept=%2A%2F%2A",
            "@multimediatype": "JPEG image file",
            "@type": "IMAGE-HIGH-RES",
            "@size": "99710",
            "@ref": "gr8",
            "@mimetype": "image/jpeg"
          },
          {
            "@category": "high",
            "@height": "607",
            "@width": "2056",
            "@_fa": "true",
            "$": "https://api.elsevier.com/content/object/eid/1-s2.0-S1872206721638639-gr9_lrg.jpg?httpAccept=%2A%2F%2A",
            "@multimediatype": "JPEG image file",
            "@type": "IMAGE-HIGH-RES",
            "@size": "299554",
            "@ref": "gr9",
            "@mimetype": "image/jpeg"
          },
          {
            "@category": "high",
            "@height": "651",
            "@width": "685",
            "@_fa": "true",
            "$": "https://api.elsevier.com/content/object/eid/1-s2.0-S1872206721638639-grap_lrg.jpg?httpAccept=%2A%2F%2A",
            "@multimediatype": "JPEG image file",
            "@type": "IMAGE-HIGH-RES",
            "@size": "132438",
            "@ref": "grap",
            "@mimetype": "image/jpeg"
          }
        ]
      },
      "link": {
        "@rel": "abstract",
        "@href": "https://api.elsevier.com/content/abstract/scopus_id/85123872471"
      }
    }
  }
}