{
  "metadata": {
    "title": "Recent advances of the catalysts for photoelectrocatalytic oxygen evolution and CO<ce:inf loc=post>2</ce:inf> reduction reactions",
    "authors": "; ; ",
    "journal": "Chinese Journal of Catalysis",
    "date": "2024-07-31",
    "doi": "10.1016/S1872-2067(24)60053-7",
    "abstract": "",
    "uri": "https://api.elsevier.com/content/article/pii/S1872206724600537",
    "pii": "S1872206724600537"
  },
  "fulltext": {
    "full-text-retrieval-response": {
      "scopus-eid": "2-s2.0-85198902842",
      "originalText": "serial JL 273538 291210 291744 291809 31 Chinese Journal of Catalysis CHINESEJOURNALCATALYSIS 2024-07-19 2024-07-19 2024-07-19 2024-07-19 2024-08-26T19:56:28 1-s2.0-S1872206724600537 S1872-2067(24)60053-7 S1872206724600537 10.1016/S1872-2067(24)60053-7 S300 S300.2 FULL-TEXT 1-s2.0-S1872206724X0008X 2024-08-26T19:15:09.066842Z 0 0 20240701 20240731 2024 2024-07-19T20:24:38.120495Z absattachment articleinfo articletitlenorm authfirstinitialnorm authfirstsurnamenorm cid cids contenttype copyright crossmark dateloaded dateloadedtxt datesearch datesort dateupdated dco docsubtype doctype doi eid ewtransactionid hubeid indexeddate issn issnnorm itemstage itemtransactionid itemweight openaccess openarchive pg pgfirst pglast pii piinorm pubdateend pubdatestart pubdatetxt pubyr sortorder srctitle srctitlenorm srctype ssids alllist content subj subheadings suppl tomb volfirst volissue volumelist webpdf webpdfpagecount yearnav figure table body mmlmath affil articletitle auth authfirstini authfull authkeywords authlast grantnumber grantsponsor primabst pubtype ref specialabst vitae 1872-2067 18722067 true 62 62 C Volume 62 3 53 107 53 107 202407 July 2024 2024-07-01 2024-07-31 2024 article rev Copyright © 2024 Dalian Institute of Chemical Physics, the Chinese Academy of Sciences. Published by Elsevier B.V. All rights are reserved, including those for text and data mining, AI training, and similar technologies. RECENTADVANCESCATALYSTSFORPHOTOELECTROCATALYTICOXYGENEVOLUTIONCO2REDUCTIONREACTIONS ZHU H 1 Introduction 2 Photoelectrocatalytic OER 2.1 Basic principles of PEC OER 2.2 Catalyst design principles for PEC OER 2.3 Synthesis methods of catalysts for PEC OER 2.4 Configuration of PEC OER 2.5 Evaluate the parameters of PEC OER performance 2.6 Classification of PEC catalysts suitable for OER 2.6.1 Metal oxide catalysts 2.6.2 Metal nitrides catalysts 2.6.3 Metal sulfide catalysts 2.6.4 Polymer-based catalysts 2.6.5 Carbon-based catalysts 2.6.6 MOF-based catalysts 3 Photoelectrocatalysis CO2 reduction reaction 3.1 Basic principles of PEC CO2 reduction reaction (PEC CO2RR) 3.2 Catalyst design principles for PEC CO2RR 3.3 Synthesis methods of catalysts for PEC OER 3.4 Configuration of PEC CO2RR 3.5 General parameters to evaluate the PEC CO2RR 3.6 Different catalysts for PEC CO2RR 3.6.1 Cu-based catalyst 3.6.2 Metal oxides/nitrides 3.6.3 Porphyrin-based catalysts 4 Advanced modification strategies for catalysts in PEC OER and CO2RR. 4.1 Doping 4.2 Manufacturing defect 4.3 Single or diatomic atoms 4.4 Heterojunctions 4.5 Microenvironmental modulation 5 Reaction step analysis of PEC OER and CO2RR based on theoretical analysis and in-situ characterization 5.1 Reaction step analysis of PEC OER and CO2RR based on DFT calculation 5.2 Reaction step analysis of PEC OER based on COMSOL simulations 5.3 Reaction step analysis of PEC OER based on machine learning 5.4 In-situ characterization of PEC OER and PEC CO2RR 6 Comparison between PEC technology and other catalytic technologies 6.1 Thermocatalysis 6.2 Photothermal catalysis 6.3 Enzyme-catalysed 6.4 Photoenzymatic catalysis 7 Conclusions and perspectives References FAN 2024 158 167 R LIU 2022 e202114160 Y ROSS 2019 648 658 M TAN 2022 4763 4785 X WANG 2022 702 708 X WANG 2023 2303052 Z XIN 2024 337 X YU 2024 123674 J ZHANG 2022 2987 3018 M ZHANG 2024 463 473 W ARMSTRONG 2016 15020 R STERN 2016 16043 P CHEN 2022 296 301 R ZHOU 2019 2842 2848 B LU 2023 6965 Y LIN 2023 12507 12593 F WEN 2021 2102353 Q ZHAO 2023 2203595 Y MAO 2023 1052 1061 J DONG 2023 15473 15481 P MA 2023 14163 14172 F LI 2023 e202300478 X TENG 2021 374 384 Z ZHAN 2023 32 66 Q XU 2023 2953 3003 H FARAJI 2019 59 95 M GUO 2020 118978 M ZHANG 2022 830 842 X WANG 2020 119171 A LIU 2022 2705 2715 Y CHENG 2021 12299 12306 C RAN 2018 1800128 J FENG 2022 2109074 Y ZENG 2021 2102765 H RUAN 2022 2200298 X WEI 2022 7320 7326 W CUI 2018 938 946 W LI 2022 2113002 K TAN 2021 2111740 M BAI 2018 296 336 S GAO 2020 119403 Y AKINOGLU 2021 7860 7878 E WANG 2020 119170 B LAN 2020 17676 17683 K DI 2019 1807576 J SONG 2023 197 206 P LV 2022 2210016 2210028 X CAO 2022 2206079 2206085 Y LI 2024 100299 W DI 2018 344 350 T MENG 2018 4729 4736 A WANG 2020 100279 Z XU 2018 1800911 F YAN 2020 119151 Z CAI 2023 248 295 M CHIA 2018 909 921 X SEH 2017 eaad4998 Z WANG 2023 108 153 X PAN 2022 121526 J GUO 2022 12000 12013 W XIONG 2023 1186 1193 P HILBRANDS 2023 25382 25391 A ARUNACHALAM 2023 5429 M LIU 2023 2208915 X ZHAO 2023 1943 Y ANDREI 2022 864 868 V ZHANG 2021 6969 B ZHAO 2023 2214470 Z ZHANG 2023 e202305123 B LAI 2022 20201 20206 X ZHOU 2023 e2300914 H HUANG 2022 12567 12583 H KE 2020 24 J TANG 2023 80 118 D LI 2022 2201070 D CHANG 2019 e1804710 X FU 2023 9540 9547 N CHEN 2022 121152 C JIN 2023 123150 L YANG 2023 e202308729 N WANG 2024 J XUE 2022 127 138 X YANG 2019 1369 1373 D ZHANG 2018 771 805 N YAO 2018 1800210 T LI 2019 3962 4179 X ZHENG 2019 7646 7659 Y NITOPI 2019 7610 7672 S HANDOKO 2018 922 934 A KEMPLER 2020 2528 2534 P ZHANG 2022 e2105204 W PAWAR 2022 120921 A LI 2020 4905 4915 H LIU 2021 1124 1132 G ZHANG 2020 2002105 H ARTZ 2018 434 504 J LEUNG 2019 354 365 J ROY 2021 1868 1876 S WANG 2020 223 250 L DONG 2019 1222 1230 Y CHEN 2018 413 420 L LI 2017 2132 2140 L LIN 2023 2209955 C SHUAI 2023 3968 3999 T CHEN 2023 4667 4674 R LIAO 2019 2080 2147 G ZHU 2023 139775 H ZHAO 2022 3912 3922 J LI 2021 18129 18137 C HUANG 2023 122313 C XIAO 2019 e1801369 M JIN 2021 119477 S AKHADE 2020 11370 11419 S YU 2019 2799 Z JIN 2019 e1902709 H ZHANG 2018 5423 5443 L GUO 2023 122035 S WANG 2023 122315 K YANG 2016 177 180 X SONG 2020 2196 2214 J SCHEUERMANN 2016 99 105 A XIE 2024 5712 5722 H WANG 2023 22071 22081 H LI 2023 e202309732 X SHAN 2021 5201 5211 J WANG 2023 7210 X CORBY 2021 1136 1155 S NIU 2019 1900399 F KIM 2019 1806938 J SELIM 2019 18791 18798 S HE 2020 119138 S GENG 2021 119409 Y PAN 2013 17996 18005 X WANG 2019 5192 5247 S TIAN 2019 1901287 Z GAO 2020 146506 X LI 2013 1432 R WANG 2022 127596 J SONG 2022 e202200946 Y SONG 2023 e202306420 Y ISMAIL 2021 12324 12335 A GAO 2023 2640 R WU 2023 2574 Z YOON 2021 4309 K CHENG 2021 2100553 Z CHEN 2015 8498 8501 S LI 2020 935 942 Z KIBRIA 2016 8388 8397 M VANKA 2018 6530 6537 S CHEN 2015 9595 9603 L ZENG 2021 1130 1135 G WANG 2016 4391 4399 Z LIU 2016 1327 1334 G XIAO 2020 932 940 Y PIHOSH 2023 2301327 Y HIGASHI 2019 2300 2304 T NANDAL 2021 4038 4047 V WANG 2020 3078 H GIRI 2019 1901236 B SONG 2017 6296 6301 J BHAT 2019 118102 S JING 2022 e2106807 J YAO 2019 7743 7750 H WU 2023 19856 19865 Q MOU 2023 e202309480 Y AHN 2023 2595 2602 H CHENG 2021 2100317 C LIU 2023 4344 F WANG 2022 e202212162 Y CHO 2021 431 438 H SOKOL 2018 944 951 K XIE 2023 25671 25682 S LIU 2022 133783 L PEI 2022 121865 H JIANG 2023 e202302575 W GENG 2023 2207227 D ZHANG 2019 14871 14876 H WANG 2020 4465 R YAN 2020 1185 1195 Y ZHENG 2021 91 H XIE 2023 2211008 G XIE 2022 2210420 G DENG 2019 1802856 Y CHAI 2024 2308989 L ZHANG 2023 122909 H LI 2022 e202116934 C PAN 2021 1433 1440 J YANG 2023 2205246 X YOON 2019 511 518 J DING 2023 1386 1394 J WANG 2023 e202218460 G GAO 2024 123348 Y XIA 2023 146516 S WANG 2021 4993 5061 G LIU 2023 122394 C RAHAMAN 2020 3536 3543 M MA 2023 202213145 X GUO 2022 e202205909 C XIA 2023 17253 17264 W ZI 2023 e202309351 X ZHOU 2023 987 995 B WANG 2021 6914 6949 B GAO 2020 8584 8686 W DAS 2020 2937 3004 S XIA 2023 27939 27949 M ZHENG 2024 12233 12242 K SUN 2016 6771 6775 X LI 2012 7231 7234 C SARFRAZ 2016 2842 2851 S YANG 2023 262 269 Y FANG 2020 7178 7183 Y ZHANG 2020 25970 25977 W LI 2021 11891 11897 F PAN 2018 412 420 L ROH 2022 8002 8006 I DENG 2019 10924 10929 X SHAN 2019 290 299 B DONG 2022 2671 2680 W DONG 2021 10099 10107 W PAN 2023 1013 Y CHU 2018 7869 7877 S LI 2019 923 928 C NIKOLOUDAKIS 2022 6965 7045 E LI 2022 878 892 X YANG 2019 3844 D WANG 2020 125255 B WEI 2023 e202305558 Z LIU 2023 154 185 H TAN 2024 Y CUI 2022 e202115219 T WANG 2023 460 472 W LI 2021 119463 C DONG 2024 123649 K CHEN 2019 1806312 Y DING 2022 e202209268 L LI 2023 e202313537 R OUYANG 2019 4923 4928 T ZHAO 2022 2203442 Y BAO 2024 123706 W DONG 2023 122464 Y SU 2023 122890 L WU 2023 2306097 L ZHANG 2023 6410 6419 S ZHENG 2024 2134 2143 L SU 2023 2303976 Y XIA 2023 25695 25704 H PEI 2024 2401122 H LI 2024 9124 9133 H SONG 2024 2403234 M ZHANG 2024 2556 Z WAN 2021 5589 W JI 2020 11900 11955 S CHEN 2018 1242 1264 Y XIE 2020 1044 1054 X LIU 2024 3088 3098 J ZHANG 2018 285 297 L ZHAO 2023 e202213067 B ZHANG 2021 20657 20669 X WANG 2021 2102957 T CHEN 2024 e202401168 J GUO 2024 2311766 P LI 2022 121166 H WEI 2023 243 253 Y LU 2024 124073 Z XIE 2023 122865 Z SHANG 2023 e202215213 B GAO 2023 2209654 Y MA 2022 7596 Z ZHAO 2023 403 412 Y LIU 2024 5333 5342 H REN 2024 2346 G YANG 2024 2897 2907 R CHAI 2022 3700 3709 H SHANG 2024 2267 2274 B LI 2020 3269 3306 C REN 2023 16584 16596 P SHAH 2022 e202114951 K YANG 2019 1808043 Z SUN 2023 2467 Y DIAO 2020 e1905679 J ZHANG 2023 807 817 H DENG 2023 11869 11881 A BAI 2023 10976 10986 S CAO 2023 e202303048 Y LI 2019 690 699 X WU 2023 143252 P SUN 2022 43946 43954 M WAN 2021 6111 6118 X WU 2021 102398 L SUN 2020 554 563 Y LI 2020 4377 4384 Z ZHANG 2023 2302754 L CHOUCHANE 2024 1480 1486 M ULISSI 2017 14621 Z GAO 2021 2108044 C WANG 2022 e2106776 Z VENUGOPAL 2021 18581 18591 A LANDAETA 2023 1638 1648 E LIU 2021 2010081 Y LI 2024 124096 X LIU 2023 23849 23858 S TACKETT 2019 381 386 B HU 2023 202214215 X ZHOU 2022 8430 8433 J KOSHY 2021 17472 17480 D BIAN 2023 e202304452 X HAO 2021 1903 1920 L ANDREI 2018 1801403 V GAO 2020 2000925 M GUO 2021 1343 S HAN 2022 138419 H LU 2022 127128 Y MA 2024 970 978 J OBRIEN 2018 3443 3451 P PORNRUNGROJ 2023 13709 13714 C PORNRUNGROJ 2023 952 960 C SORCAR 2019 2685 2696 S CHEN 2018 1704663 G YAO 2022 348 356 P LOU 2024 2730 X LI 2018 1800527 Z BORNSCHEUER 2012 185 194 U VANDERKAMP 2018 1177 M FU 2023 628 636 W CHEN 2024 R ERICKSON 2022 7850 E FU 2022 302 307 H FU 2022 13344 13355 Y YE 2023 206 212 Y LIU 2021 1166 1172 Z BLACK 2020 71 75 M BULLER 2023 eadh8615 R XU 2024 74 78 Y SILVI 2018 41 49 M BRIMIOULLE 2015 3872 3890 R ZHOU 2019 1586 1604 Q GROSSKOPF 2022 1626 1653 J EMMANUEL 2016 414 417 M KLEINMANS 2022 477 482 R SANDOVAL 2021 1735 1739 B BIEGASIEWICZ 2018 770 775 K ZHAO 2023 996 1004 B CHEN 2020 203 213 K PAGE 2021 97 102 C CHEN 2020 10506 10515 M ZHANG 2019 722 725 S CANDISH 2022 2907 2980 L MURRAY 2021 4055 4063 P HUANG 2022 586 593 X SUN 2023 35 42 S CHENG 2023 444 451 L JU 2024 S SUN 2022 715 720 N MITRAKA 2018 1800110 E LIU 2020 2000151 J NISHIYAMA 2021 304 307 H GONG 2022 2100473 R KARJULE 2021 2000265 N ZHUX2024X53 ZHUX2024X53X107 ZHUX2024X53XH ZHUX2024X53X107XH 2026-07-19T00:00:00.000Z 2026-07-19T00:00:00.000Z http://creativecommons.org/licenses/by-nc-nd/4.0/ 2024-07-27T20:57:41.091Z http://vtw.elsevier.com/data/voc/AddOnTypes/50.7/aggregated-refined Fundamental Research Funds for the Central Universities YJ2021156 Fundamental Research Funds for the Central Universities http://data.elsevier.com/vocabulary/SciValFunders/501100012226 http://sws.geonames.org/1814991/ National Natural Science Foundation of China 52373215 NSFC National Natural Science Foundation of China http://data.elsevier.com/vocabulary/SciValFunders/501100001809 http://sws.geonames.org/1814991/ Sichuan Science and Technology Program 2023NSFSC0086 Sichuan Provincial Science and Technology Support Program http://data.elsevier.com/vocabulary/SciValFunders/100012542 http://sws.geonames.org/1814991/ This work was supported by the National Natural Science Foundation of China (52373215), the Sichuan Science and Technology Program (2023NSFSC0086), and the Fundamental Research Funds for the Central Universities (YJ2021156). item S1872-2067(24)60053-7 S1872206724600537 1-s2.0-S1872206724600537 10.1016/S1872-2067(24)60053-7 273538 2024-08-26T19:15:09.066842Z 2024-07-01 2024-07-31 1-s2.0-S1872206724600537-main.pdf https://s3-eu-west-1.amazonaws.com/prod-ucs-content-store-eu-west/content/pii:S1872206724600537/MAIN/application/pdf/2698a144f5619d2e9acf36606cb8034d/main.pdf main.pdf pdf true 17403321 MAIN 55 1-s2.0-S1872206724600537-main_1.png https://s3-eu-west-1.amazonaws.com/prod-ucs-content-store-eu-west/content/pii:S1872206724600537/PREVIEW/image/png/3fb99c76417598cb0e55f78447cda5d6/main_1.png main_1.png png 51564 849 656 IMAGE-WEB-PDF 1 1-s2.0-S1872206724600537-fx1.jpg https://s3-eu-west-1.amazonaws.com/prod-ucs-content-store-eu-west/content/pii:S1872206724600537/fx1/DOWNSAMPLED/image/jpeg/adb283f0d207cbb4282ce6ea05722fc0/fx1.jpg fx1 true fx1.jpg jpg 17249 179 301 IMAGE-DOWNSAMPLED 1-s2.0-S1872206724600537-fx2.jpg https://s3-eu-west-1.amazonaws.com/prod-ucs-content-store-eu-west/content/pii:S1872206724600537/fx2/DOWNSAMPLED/image/jpeg/fe19a97ade0cc07eceb38bcd933c20b3/fx2.jpg fx2 fx2.jpg jpg 11104 249 178 IMAGE-DOWNSAMPLED 1-s2.0-S1872206724600537-gr1.jpg https://s3-eu-west-1.amazonaws.com/prod-ucs-content-store-eu-west/content/pii:S1872206724600537/gr1/DOWNSAMPLED/image/jpeg/f3d4ea6e73b65b04809bfb658d7cf86a/gr1.jpg gr1 gr1.jpg jpg 12782 156 159 IMAGE-DOWNSAMPLED 1-s2.0-S1872206724600537-gr10.jpg https://s3-eu-west-1.amazonaws.com/prod-ucs-content-store-eu-west/content/pii:S1872206724600537/gr10/MAIN/image/jpeg/35e05c0d24c0281cb79297afcfff8bca/gr10.jpg gr10 gr10.jpg jpg 49935 281 529 IMAGE-DOWNSAMPLED 1-s2.0-S1872206724600537-gr11.jpg https://s3-eu-west-1.amazonaws.com/prod-ucs-content-store-eu-west/content/pii:S1872206724600537/gr11/DOWNSAMPLED/image/jpeg/83e4d90c557a55a4e88bddc5674c4ce6/gr11.jpg gr11 gr11.jpg jpg 101386 554 559 IMAGE-DOWNSAMPLED 1-s2.0-S1872206724600537-gr12.jpg https://s3-eu-west-1.amazonaws.com/prod-ucs-content-store-eu-west/content/pii:S1872206724600537/gr12/DOWNSAMPLED/image/jpeg/8d5d8df3ef4e0f034b96114c9ceea962/gr12.jpg gr12 gr12.jpg jpg 137071 753 472 IMAGE-DOWNSAMPLED 1-s2.0-S1872206724600537-gr13.jpg https://s3-eu-west-1.amazonaws.com/prod-ucs-content-store-eu-west/content/pii:S1872206724600537/gr13/DOWNSAMPLED/image/jpeg/68170675ead092baa555e4a2889025a1/gr13.jpg gr13 gr13.jpg jpg 135589 663 668 IMAGE-DOWNSAMPLED 1-s2.0-S1872206724600537-gr14.jpg https://s3-eu-west-1.amazonaws.com/prod-ucs-content-store-eu-west/content/pii:S1872206724600537/gr14/DOWNSAMPLED/image/jpeg/53219ceed377f04c5c8050a04ad58260/gr14.jpg gr14 gr14.jpg jpg 98546 395 707 IMAGE-DOWNSAMPLED 1-s2.0-S1872206724600537-gr15.jpg https://s3-eu-west-1.amazonaws.com/prod-ucs-content-store-eu-west/content/pii:S1872206724600537/gr15/DOWNSAMPLED/image/jpeg/307da98d030c2b2fadc6602108205d91/gr15.jpg gr15 gr15.jpg jpg 143283 501 756 IMAGE-DOWNSAMPLED 1-s2.0-S1872206724600537-gr16.jpg https://s3-eu-west-1.amazonaws.com/prod-ucs-content-store-eu-west/content/pii:S1872206724600537/gr16/DOWNSAMPLED/image/jpeg/7065d6a05c082e47f06985bd4a3172d9/gr16.jpg gr16 gr16.jpg jpg 93935 372 662 IMAGE-DOWNSAMPLED 1-s2.0-S1872206724600537-gr17.jpg https://s3-eu-west-1.amazonaws.com/prod-ucs-content-store-eu-west/content/pii:S1872206724600537/gr17/DOWNSAMPLED/image/jpeg/d99e01385ff36c0185ad84d44e361ceb/gr17.jpg gr17 gr17.jpg jpg 10960 180 226 IMAGE-DOWNSAMPLED 1-s2.0-S1872206724600537-gr18.jpg https://s3-eu-west-1.amazonaws.com/prod-ucs-content-store-eu-west/content/pii:S1872206724600537/gr18/MAIN/image/jpeg/7a7a5f5adcec872278a647c14eb58573/gr18.jpg gr18 gr18.jpg jpg 7087 112 118 IMAGE-DOWNSAMPLED 1-s2.0-S1872206724600537-gr19.jpg https://s3-eu-west-1.amazonaws.com/prod-ucs-content-store-eu-west/content/pii:S1872206724600537/gr19/DOWNSAMPLED/image/jpeg/70a28bd02adb12b97501900c8269d410/gr19.jpg gr19 gr19.jpg jpg 77885 278 769 IMAGE-DOWNSAMPLED 1-s2.0-S1872206724600537-gr2.jpg https://s3-eu-west-1.amazonaws.com/prod-ucs-content-store-eu-west/content/pii:S1872206724600537/gr2/DOWNSAMPLED/image/jpeg/819d358d477f9c54841fde1691947d4d/gr2.jpg gr2 gr2.jpg jpg 201854 688 778 IMAGE-DOWNSAMPLED 1-s2.0-S1872206724600537-gr20.jpg https://s3-eu-west-1.amazonaws.com/prod-ucs-content-store-eu-west/content/pii:S1872206724600537/gr20/DOWNSAMPLED/image/jpeg/7e6391d959a2b0cb2dc2ab6b5c0c5449/gr20.jpg gr20 gr20.jpg jpg 93595 481 654 IMAGE-DOWNSAMPLED 1-s2.0-S1872206724600537-gr21.jpg https://s3-eu-west-1.amazonaws.com/prod-ucs-content-store-eu-west/content/pii:S1872206724600537/gr21/DOWNSAMPLED/image/jpeg/4ebd6470788a5cbb32f8571277dc34ce/gr21.jpg gr21 gr21.jpg jpg 158367 580 770 IMAGE-DOWNSAMPLED 1-s2.0-S1872206724600537-gr22.jpg https://s3-eu-west-1.amazonaws.com/prod-ucs-content-store-eu-west/content/pii:S1872206724600537/gr22/DOWNSAMPLED/image/jpeg/b9a3c502b4ef7c48698bf5617cf0e809/gr22.jpg gr22 gr22.jpg jpg 150568 529 756 IMAGE-DOWNSAMPLED 1-s2.0-S1872206724600537-gr23.jpg https://s3-eu-west-1.amazonaws.com/prod-ucs-content-store-eu-west/content/pii:S1872206724600537/gr23/DOWNSAMPLED/image/jpeg/32db6c478a880155694bd3df4e760a05/gr23.jpg gr23 gr23.jpg jpg 71392 232 664 IMAGE-DOWNSAMPLED 1-s2.0-S1872206724600537-gr24.jpg https://s3-eu-west-1.amazonaws.com/prod-ucs-content-store-eu-west/content/pii:S1872206724600537/gr24/DOWNSAMPLED/image/jpeg/7c85f050dc30bd0b92bdef49d6003c5d/gr24.jpg gr24 gr24.jpg jpg 117455 544 615 IMAGE-DOWNSAMPLED 1-s2.0-S1872206724600537-gr25.jpg https://s3-eu-west-1.amazonaws.com/prod-ucs-content-store-eu-west/content/pii:S1872206724600537/gr25/DOWNSAMPLED/image/jpeg/800e1ca0e1bfdec5461dbf60c86a599d/gr25.jpg gr25 gr25.jpg jpg 141804 651 755 IMAGE-DOWNSAMPLED 1-s2.0-S1872206724600537-gr26.jpg https://s3-eu-west-1.amazonaws.com/prod-ucs-content-store-eu-west/content/pii:S1872206724600537/gr26/DOWNSAMPLED/image/jpeg/be83d654b5d76e69fe098e4442961a28/gr26.jpg gr26 gr26.jpg jpg 132471 477 757 IMAGE-DOWNSAMPLED 1-s2.0-S1872206724600537-gr27.jpg https://s3-eu-west-1.amazonaws.com/prod-ucs-content-store-eu-west/content/pii:S1872206724600537/gr27/DOWNSAMPLED/image/jpeg/6a0ae924be70461cfb9113c03fe59c67/gr27.jpg gr27 gr27.jpg jpg 162078 648 731 IMAGE-DOWNSAMPLED 1-s2.0-S1872206724600537-gr28.jpg https://s3-eu-west-1.amazonaws.com/prod-ucs-content-store-eu-west/content/pii:S1872206724600537/gr28/DOWNSAMPLED/image/jpeg/90a9ddd48446398c02bf587543bd39ce/gr28.jpg gr28 gr28.jpg jpg 104734 315 676 IMAGE-DOWNSAMPLED 1-s2.0-S1872206724600537-gr29.jpg https://s3-eu-west-1.amazonaws.com/prod-ucs-content-store-eu-west/content/pii:S1872206724600537/gr29/DOWNSAMPLED/image/jpeg/47b765ba0a94f35fb257fc19b69f3688/gr29.jpg gr29 gr29.jpg jpg 139079 611 563 IMAGE-DOWNSAMPLED 1-s2.0-S1872206724600537-gr3.jpg https://s3-eu-west-1.amazonaws.com/prod-ucs-content-store-eu-west/content/pii:S1872206724600537/gr3/DOWNSAMPLED/image/jpeg/3b512df63b82a1d7e94133dd8bd141dc/gr3.jpg gr3 gr3.jpg jpg 90542 330 773 IMAGE-DOWNSAMPLED 1-s2.0-S1872206724600537-gr30.jpg https://s3-eu-west-1.amazonaws.com/prod-ucs-content-store-eu-west/content/pii:S1872206724600537/gr30/DOWNSAMPLED/image/jpeg/dbbedc41dcbbd72972ed8010661f2d9a/gr30.jpg gr30 gr30.jpg jpg 95820 354 630 IMAGE-DOWNSAMPLED 1-s2.0-S1872206724600537-gr31.jpg https://s3-eu-west-1.amazonaws.com/prod-ucs-content-store-eu-west/content/pii:S1872206724600537/gr31/DOWNSAMPLED/image/jpeg/9f6c85c565119743aa30763ec8c40f55/gr31.jpg gr31 gr31.jpg jpg 77721 273 728 IMAGE-DOWNSAMPLED 1-s2.0-S1872206724600537-gr32.jpg https://s3-eu-west-1.amazonaws.com/prod-ucs-content-store-eu-west/content/pii:S1872206724600537/gr32/DOWNSAMPLED/image/jpeg/3f7584dbd41886a9bcdf24b158c249be/gr32.jpg gr32 gr32.jpg jpg 164443 640 720 IMAGE-DOWNSAMPLED 1-s2.0-S1872206724600537-gr33.jpg https://s3-eu-west-1.amazonaws.com/prod-ucs-content-store-eu-west/content/pii:S1872206724600537/gr33/DOWNSAMPLED/image/jpeg/fdeb12287866c30ba243121de5b3229c/gr33.jpg gr33 gr33.jpg jpg 80098 289 759 IMAGE-DOWNSAMPLED 1-s2.0-S1872206724600537-gr34.jpg https://s3-eu-west-1.amazonaws.com/prod-ucs-content-store-eu-west/content/pii:S1872206724600537/gr34/DOWNSAMPLED/image/jpeg/56465733dc2ee6537e3300655e20c102/gr34.jpg gr34 gr34.jpg jpg 66778 429 373 IMAGE-DOWNSAMPLED 1-s2.0-S1872206724600537-gr35.jpg https://s3-eu-west-1.amazonaws.com/prod-ucs-content-store-eu-west/content/pii:S1872206724600537/gr35/DOWNSAMPLED/image/jpeg/36a4da016d9b6f68719ddcd836a32cae/gr35.jpg gr35 gr35.jpg jpg 75475 284 740 IMAGE-DOWNSAMPLED 1-s2.0-S1872206724600537-gr36.jpg https://s3-eu-west-1.amazonaws.com/prod-ucs-content-store-eu-west/content/pii:S1872206724600537/gr36/DOWNSAMPLED/image/jpeg/86fb8f3b808549c54e562d2cc1069ece/gr36.jpg gr36 gr36.jpg jpg 62538 293 697 IMAGE-DOWNSAMPLED 1-s2.0-S1872206724600537-gr37.jpg https://s3-eu-west-1.amazonaws.com/prod-ucs-content-store-eu-west/content/pii:S1872206724600537/gr37/DOWNSAMPLED/image/jpeg/d764657c6c02aca070dd0539cded0b11/gr37.jpg gr37 gr37.jpg jpg 91984 295 756 IMAGE-DOWNSAMPLED 1-s2.0-S1872206724600537-gr38.jpg https://s3-eu-west-1.amazonaws.com/prod-ucs-content-store-eu-west/content/pii:S1872206724600537/gr38/DOWNSAMPLED/image/jpeg/f2798deb6cbb9dd47e5d3a0719134b83/gr38.jpg gr38 gr38.jpg jpg 54613 240 709 IMAGE-DOWNSAMPLED 1-s2.0-S1872206724600537-gr39.jpg https://s3-eu-west-1.amazonaws.com/prod-ucs-content-store-eu-west/content/pii:S1872206724600537/gr39/DOWNSAMPLED/image/jpeg/9eb46492f0f3fe10af063c64f4f6f391/gr39.jpg gr39 gr39.jpg jpg 129685 414 719 IMAGE-DOWNSAMPLED 1-s2.0-S1872206724600537-gr4.jpg https://s3-eu-west-1.amazonaws.com/prod-ucs-content-store-eu-west/content/pii:S1872206724600537/gr4/DOWNSAMPLED/image/jpeg/951f634007be930fb3c691d33ff45b89/gr4.jpg gr4 gr4.jpg jpg 213740 782 752 IMAGE-DOWNSAMPLED 1-s2.0-S1872206724600537-gr40.jpg https://s3-eu-west-1.amazonaws.com/prod-ucs-content-store-eu-west/content/pii:S1872206724600537/gr40/DOWNSAMPLED/image/jpeg/087c083155428ee1d3c032557244fb41/gr40.jpg gr40 gr40.jpg jpg 79366 306 754 IMAGE-DOWNSAMPLED 1-s2.0-S1872206724600537-gr41.jpg https://s3-eu-west-1.amazonaws.com/prod-ucs-content-store-eu-west/content/pii:S1872206724600537/gr41/DOWNSAMPLED/image/jpeg/0f157604762f17ea4e4b302a8638d6cc/gr41.jpg gr41 gr41.jpg jpg 90056 427 643 IMAGE-DOWNSAMPLED 1-s2.0-S1872206724600537-gr42.jpg https://s3-eu-west-1.amazonaws.com/prod-ucs-content-store-eu-west/content/pii:S1872206724600537/gr42/DOWNSAMPLED/image/jpeg/7a6fe5e75f63f8b47cf1ff41fd1598d0/gr42.jpg gr42 gr42.jpg jpg 34415 212 374 IMAGE-DOWNSAMPLED 1-s2.0-S1872206724600537-gr43.jpg https://s3-eu-west-1.amazonaws.com/prod-ucs-content-store-eu-west/content/pii:S1872206724600537/gr43/DOWNSAMPLED/image/jpeg/fa4607a91a7caa2b3d78dac6f7d17009/gr43.jpg gr43 gr43.jpg jpg 73638 386 703 IMAGE-DOWNSAMPLED 1-s2.0-S1872206724600537-gr44.jpg https://s3-eu-west-1.amazonaws.com/prod-ucs-content-store-eu-west/content/pii:S1872206724600537/gr44/DOWNSAMPLED/image/jpeg/1fb8e9d454d0deb280178eb0d6a416d3/gr44.jpg gr44 gr44.jpg jpg 30308 219 365 IMAGE-DOWNSAMPLED 1-s2.0-S1872206724600537-gr5.jpg https://s3-eu-west-1.amazonaws.com/prod-ucs-content-store-eu-west/content/pii:S1872206724600537/gr5/DOWNSAMPLED/image/jpeg/414ec460bd6500bd065e8220595a825c/gr5.jpg gr5 gr5.jpg jpg 132363 532 639 IMAGE-DOWNSAMPLED 1-s2.0-S1872206724600537-gr6.jpg https://s3-eu-west-1.amazonaws.com/prod-ucs-content-store-eu-west/content/pii:S1872206724600537/gr6/DOWNSAMPLED/image/jpeg/2fbda69a8b966915b4b87d006a5b699b/gr6.jpg gr6 gr6.jpg jpg 86265 272 779 IMAGE-DOWNSAMPLED 1-s2.0-S1872206724600537-gr7.jpg https://s3-eu-west-1.amazonaws.com/prod-ucs-content-store-eu-west/content/pii:S1872206724600537/gr7/DOWNSAMPLED/image/jpeg/714b4d5752896d4f9607cbee0f36816d/gr7.jpg gr7 gr7.jpg jpg 141073 624 490 IMAGE-DOWNSAMPLED 1-s2.0-S1872206724600537-gr8.jpg https://s3-eu-west-1.amazonaws.com/prod-ucs-content-store-eu-west/content/pii:S1872206724600537/gr8/DOWNSAMPLED/image/jpeg/be366da1e2c598049f9d689a7c0fd5c1/gr8.jpg gr8 gr8.jpg jpg 80559 421 526 IMAGE-DOWNSAMPLED 1-s2.0-S1872206724600537-gr9.jpg https://s3-eu-west-1.amazonaws.com/prod-ucs-content-store-eu-west/content/pii:S1872206724600537/gr9/DOWNSAMPLED/image/jpeg/38d299137cc7ca13f748213b03f67ae0/gr9.jpg gr9 gr9.jpg jpg 137933 515 712 IMAGE-DOWNSAMPLED 1-s2.0-S1872206724600537-Sc1.jpg https://s3-eu-west-1.amazonaws.com/prod-ucs-content-store-eu-west/content/pii:S1872206724600537/Sc1/DOWNSAMPLED/image/jpeg/a4f2c01b64b7df6e2a784e0c13b73ea2/Sc1.jpg Sc1 Sc1.jpg jpg 30386 187 366 IMAGE-DOWNSAMPLED 1-s2.0-S1872206724600537-Sc2.jpg https://s3-eu-west-1.amazonaws.com/prod-ucs-content-store-eu-west/content/pii:S1872206724600537/Sc2/DOWNSAMPLED/image/jpeg/e7fd81a6073260c8d254eda2038e1e0f/Sc2.jpg Sc2 Sc2.jpg jpg 6205 130 130 IMAGE-DOWNSAMPLED 1-s2.0-S1872206724600537-fx1.sml https://s3-eu-west-1.amazonaws.com/prod-ucs-content-store-eu-west/content/pii:S1872206724600537/fx1/THUMBNAIL/image/gif/7fcb145da39f98926c47bd4520ce3f08/fx1.sml fx1 true fx1.sml sml 16499 130 219 IMAGE-THUMBNAIL 1-s2.0-S1872206724600537-fx2.sml https://s3-eu-west-1.amazonaws.com/prod-ucs-content-store-eu-west/content/pii:S1872206724600537/fx2/THUMBNAIL/image/gif/47966e9b77a5189e4071706182f91798/fx2.sml fx2 fx2.sml sml 11086 164 117 IMAGE-THUMBNAIL 1-s2.0-S1872206724600537-gr1.sml https://s3-eu-west-1.amazonaws.com/prod-ucs-content-store-eu-west/content/pii:S1872206724600537/gr1/THUMBNAIL/image/gif/39ecb69ad252c9c21dc9f26e3680c822/gr1.sml gr1 gr1.sml sml 11951 164 167 IMAGE-THUMBNAIL 1-s2.0-S1872206724600537-gr10.sml https://s3-eu-west-1.amazonaws.com/prod-ucs-content-store-eu-west/content/pii:S1872206724600537/gr10/THUMBNAIL/image/gif/a5c51e73719a153b8a0c7e2f8f3d2b3d/gr10.sml gr10 gr10.sml sml 11350 116 219 IMAGE-THUMBNAIL 1-s2.0-S1872206724600537-gr11.sml https://s3-eu-west-1.amazonaws.com/prod-ucs-content-store-eu-west/content/pii:S1872206724600537/gr11/THUMBNAIL/image/gif/190dc4ec2ee8c8227e059d4fd80a0ac2/gr11.sml gr11 gr11.sml sml 13442 163 165 IMAGE-THUMBNAIL 1-s2.0-S1872206724600537-gr12.sml https://s3-eu-west-1.amazonaws.com/prod-ucs-content-store-eu-west/content/pii:S1872206724600537/gr12/THUMBNAIL/image/gif/fc3a67e5251ab0e680ec5d2f0dd60ca7/gr12.sml gr12 gr12.sml sml 10931 163 102 IMAGE-THUMBNAIL 1-s2.0-S1872206724600537-gr13.sml https://s3-eu-west-1.amazonaws.com/prod-ucs-content-store-eu-west/content/pii:S1872206724600537/gr13/THUMBNAIL/image/gif/4af1c4f87655e80eab8f79680638d9b4/gr13.sml gr13 gr13.sml sml 12854 164 165 IMAGE-THUMBNAIL 1-s2.0-S1872206724600537-gr14.sml https://s3-eu-west-1.amazonaws.com/prod-ucs-content-store-eu-west/content/pii:S1872206724600537/gr14/THUMBNAIL/image/gif/c66fa8b0b5f76911ff05cb74b04e912f/gr14.sml gr14 gr14.sml sml 13682 122 219 IMAGE-THUMBNAIL 1-s2.0-S1872206724600537-gr15.sml https://s3-eu-west-1.amazonaws.com/prod-ucs-content-store-eu-west/content/pii:S1872206724600537/gr15/THUMBNAIL/image/gif/57cf9281b7d0992b109fce11894e83cd/gr15.sml gr15 gr15.sml sml 16692 145 219 IMAGE-THUMBNAIL 1-s2.0-S1872206724600537-gr16.sml https://s3-eu-west-1.amazonaws.com/prod-ucs-content-store-eu-west/content/pii:S1872206724600537/gr16/THUMBNAIL/image/gif/11a88a3cd0c0d6ccb5dd06c32a7c5f45/gr16.sml gr16 gr16.sml sml 13075 123 219 IMAGE-THUMBNAIL 1-s2.0-S1872206724600537-gr17.sml https://s3-eu-west-1.amazonaws.com/prod-ucs-content-store-eu-west/content/pii:S1872206724600537/gr17/THUMBNAIL/image/gif/a73bc269f524c615c44b52289b52e274/gr17.sml gr17 gr17.sml sml 11059 164 205 IMAGE-THUMBNAIL 1-s2.0-S1872206724600537-gr18.sml https://s3-eu-west-1.amazonaws.com/prod-ucs-content-store-eu-west/content/pii:S1872206724600537/gr18/THUMBNAIL/image/gif/5da776327fa51e7d9ee922e03bb782d9/gr18.sml gr18 gr18.sml sml 13012 164 173 IMAGE-THUMBNAIL 1-s2.0-S1872206724600537-gr19.sml https://s3-eu-west-1.amazonaws.com/prod-ucs-content-store-eu-west/content/pii:S1872206724600537/gr19/THUMBNAIL/image/gif/fe3dedcea41a616100297b7671583b9c/gr19.sml gr19 gr19.sml sml 9517 79 219 IMAGE-THUMBNAIL 1-s2.0-S1872206724600537-gr2.sml https://s3-eu-west-1.amazonaws.com/prod-ucs-content-store-eu-west/content/pii:S1872206724600537/gr2/THUMBNAIL/image/gif/5a606781ed4db4cca0e6c33d57e5b321/gr2.sml gr2 gr2.sml sml 18252 164 185 IMAGE-THUMBNAIL 1-s2.0-S1872206724600537-gr20.sml https://s3-eu-west-1.amazonaws.com/prod-ucs-content-store-eu-west/content/pii:S1872206724600537/gr20/THUMBNAIL/image/gif/36d9eb3a93c6735dd7c58fcefb5f2564/gr20.sml gr20 gr20.sml sml 13530 161 219 IMAGE-THUMBNAIL 1-s2.0-S1872206724600537-gr21.sml https://s3-eu-west-1.amazonaws.com/prod-ucs-content-store-eu-west/content/pii:S1872206724600537/gr21/THUMBNAIL/image/gif/08a84755692e7eb8bc0f6e6783174129/gr21.sml gr21 gr21.sml sml 19086 164 217 IMAGE-THUMBNAIL 1-s2.0-S1872206724600537-gr22.sml https://s3-eu-west-1.amazonaws.com/prod-ucs-content-store-eu-west/content/pii:S1872206724600537/gr22/THUMBNAIL/image/gif/e10fd55b70dfa7980596388f368e553e/gr22.sml gr22 gr22.sml sml 20676 153 219 IMAGE-THUMBNAIL 1-s2.0-S1872206724600537-gr23.sml https://s3-eu-west-1.amazonaws.com/prod-ucs-content-store-eu-west/content/pii:S1872206724600537/gr23/THUMBNAIL/image/gif/940a21bf19f78ac0def408238e523e1e/gr23.sml gr23 gr23.sml sml 11774 76 219 IMAGE-THUMBNAIL 1-s2.0-S1872206724600537-gr24.sml https://s3-eu-west-1.amazonaws.com/prod-ucs-content-store-eu-west/content/pii:S1872206724600537/gr24/THUMBNAIL/image/gif/c868c5bdabef0671af5d93a7d7e363f1/gr24.sml gr24 gr24.sml sml 16338 164 185 IMAGE-THUMBNAIL 1-s2.0-S1872206724600537-gr25.sml https://s3-eu-west-1.amazonaws.com/prod-ucs-content-store-eu-west/content/pii:S1872206724600537/gr25/THUMBNAIL/image/gif/7fa9b70d9e803fbdfc1bf9dedde71020/gr25.sml gr25 gr25.sml sml 15665 164 190 IMAGE-THUMBNAIL 1-s2.0-S1872206724600537-gr26.sml https://s3-eu-west-1.amazonaws.com/prod-ucs-content-store-eu-west/content/pii:S1872206724600537/gr26/THUMBNAIL/image/gif/8e089786ed404f1180db276eac60409c/gr26.sml gr26 gr26.sml sml 15992 138 219 IMAGE-THUMBNAIL 1-s2.0-S1872206724600537-gr27.sml https://s3-eu-west-1.amazonaws.com/prod-ucs-content-store-eu-west/content/pii:S1872206724600537/gr27/THUMBNAIL/image/gif/9fc6d21619db5cb25a8963f2558f31a9/gr27.sml gr27 gr27.sml sml 18847 164 185 IMAGE-THUMBNAIL 1-s2.0-S1872206724600537-gr28.sml https://s3-eu-west-1.amazonaws.com/prod-ucs-content-store-eu-west/content/pii:S1872206724600537/gr28/THUMBNAIL/image/gif/05864353d0ad37c1e011354abd0eca0c/gr28.sml gr28 gr28.sml sml 15691 102 219 IMAGE-THUMBNAIL 1-s2.0-S1872206724600537-gr29.sml https://s3-eu-west-1.amazonaws.com/prod-ucs-content-store-eu-west/content/pii:S1872206724600537/gr29/THUMBNAIL/image/gif/6b05bea92f8a4d4fd9d1f9d58c15f559/gr29.sml gr29 gr29.sml sml 14740 164 151 IMAGE-THUMBNAIL 1-s2.0-S1872206724600537-gr3.sml https://s3-eu-west-1.amazonaws.com/prod-ucs-content-store-eu-west/content/pii:S1872206724600537/gr3/THUMBNAIL/image/gif/a6a57418dd7fcd2c2dec5438f5a002a3/gr3.sml gr3 gr3.sml sml 10878 94 219 IMAGE-THUMBNAIL 1-s2.0-S1872206724600537-gr30.sml https://s3-eu-west-1.amazonaws.com/prod-ucs-content-store-eu-west/content/pii:S1872206724600537/gr30/THUMBNAIL/image/gif/e79dfff912ae6223db810b989e4cff10/gr30.sml gr30 gr30.sml sml 19249 123 219 IMAGE-THUMBNAIL 1-s2.0-S1872206724600537-gr31.sml https://s3-eu-west-1.amazonaws.com/prod-ucs-content-store-eu-west/content/pii:S1872206724600537/gr31/THUMBNAIL/image/gif/76d9fea6820a049923d34ac5cf9a3d3a/gr31.sml gr31 gr31.sml sml 12957 82 219 IMAGE-THUMBNAIL 1-s2.0-S1872206724600537-gr32.sml https://s3-eu-west-1.amazonaws.com/prod-ucs-content-store-eu-west/content/pii:S1872206724600537/gr32/THUMBNAIL/image/gif/0cde10a32566bb1a10036f724c704b71/gr32.sml gr32 gr32.sml sml 17041 164 184 IMAGE-THUMBNAIL 1-s2.0-S1872206724600537-gr33.sml https://s3-eu-west-1.amazonaws.com/prod-ucs-content-store-eu-west/content/pii:S1872206724600537/gr33/THUMBNAIL/image/gif/6d4f9c8b598f60598b563928f8d20e6b/gr33.sml gr33 gr33.sml sml 10127 83 219 IMAGE-THUMBNAIL 1-s2.0-S1872206724600537-gr34.sml https://s3-eu-west-1.amazonaws.com/prod-ucs-content-store-eu-west/content/pii:S1872206724600537/gr34/THUMBNAIL/image/gif/f5b4c904e2673f448867375539fc588c/gr34.sml gr34 gr34.sml sml 12055 163 142 IMAGE-THUMBNAIL 1-s2.0-S1872206724600537-gr35.sml https://s3-eu-west-1.amazonaws.com/prod-ucs-content-store-eu-west/content/pii:S1872206724600537/gr35/THUMBNAIL/image/gif/a90222af03e095016745c930b8320dba/gr35.sml gr35 gr35.sml sml 9947 84 219 IMAGE-THUMBNAIL 1-s2.0-S1872206724600537-gr36.sml https://s3-eu-west-1.amazonaws.com/prod-ucs-content-store-eu-west/content/pii:S1872206724600537/gr36/THUMBNAIL/image/gif/aaef169d3cb8461387a448f8862e00b9/gr36.sml gr36 gr36.sml sml 9507 92 219 IMAGE-THUMBNAIL 1-s2.0-S1872206724600537-gr37.sml https://s3-eu-west-1.amazonaws.com/prod-ucs-content-store-eu-west/content/pii:S1872206724600537/gr37/THUMBNAIL/image/gif/7f2ed07ffa7468bd3b5afba01aadee24/gr37.sml gr37 gr37.sml sml 13235 85 219 IMAGE-THUMBNAIL 1-s2.0-S1872206724600537-gr38.sml https://s3-eu-west-1.amazonaws.com/prod-ucs-content-store-eu-west/content/pii:S1872206724600537/gr38/THUMBNAIL/image/gif/006eba4f8b56e9784ebdac8d93811600/gr38.sml gr38 gr38.sml sml 9410 74 219 IMAGE-THUMBNAIL 1-s2.0-S1872206724600537-gr39.sml https://s3-eu-west-1.amazonaws.com/prod-ucs-content-store-eu-west/content/pii:S1872206724600537/gr39/THUMBNAIL/image/gif/74461cdbff902ceac1846df71fad867e/gr39.sml gr39 gr39.sml sml 16659 126 219 IMAGE-THUMBNAIL 1-s2.0-S1872206724600537-gr4.sml https://s3-eu-west-1.amazonaws.com/prod-ucs-content-store-eu-west/content/pii:S1872206724600537/gr4/THUMBNAIL/image/gif/66de22e5b102fea2d1e31f9b9691bedd/gr4.sml gr4 gr4.sml sml 15507 163 157 IMAGE-THUMBNAIL 1-s2.0-S1872206724600537-gr40.sml https://s3-eu-west-1.amazonaws.com/prod-ucs-content-store-eu-west/content/pii:S1872206724600537/gr40/THUMBNAIL/image/gif/953a4ec73f4fa5dd5f2f1413cff46ee4/gr40.sml gr40 gr40.sml sml 8984 89 219 IMAGE-THUMBNAIL 1-s2.0-S1872206724600537-gr41.sml https://s3-eu-west-1.amazonaws.com/prod-ucs-content-store-eu-west/content/pii:S1872206724600537/gr41/THUMBNAIL/image/gif/b26c56bebe95ad0a76d7ab9ce0cdf212/gr41.sml gr41 gr41.sml sml 15924 145 219 IMAGE-THUMBNAIL 1-s2.0-S1872206724600537-gr42.sml https://s3-eu-west-1.amazonaws.com/prod-ucs-content-store-eu-west/content/pii:S1872206724600537/gr42/THUMBNAIL/image/gif/6cc983c261c804a93b186889446b3a31/gr42.sml gr42 gr42.sml sml 14522 124 219 IMAGE-THUMBNAIL 1-s2.0-S1872206724600537-gr43.sml https://s3-eu-west-1.amazonaws.com/prod-ucs-content-store-eu-west/content/pii:S1872206724600537/gr43/THUMBNAIL/image/gif/b005ac26db418a2ef7707a002edae40f/gr43.sml gr43 gr43.sml sml 10287 120 219 IMAGE-THUMBNAIL 1-s2.0-S1872206724600537-gr44.sml https://s3-eu-west-1.amazonaws.com/prod-ucs-content-store-eu-west/content/pii:S1872206724600537/gr44/THUMBNAIL/image/gif/582b479177e9603741fc86cfb59bc7d3/gr44.sml gr44 gr44.sml sml 11622 131 219 IMAGE-THUMBNAIL 1-s2.0-S1872206724600537-gr5.sml https://s3-eu-west-1.amazonaws.com/prod-ucs-content-store-eu-west/content/pii:S1872206724600537/gr5/THUMBNAIL/image/gif/6aac0911be06332dbb2f6389ddc1e977/gr5.sml gr5 gr5.sml sml 19752 164 197 IMAGE-THUMBNAIL 1-s2.0-S1872206724600537-gr6.sml https://s3-eu-west-1.amazonaws.com/prod-ucs-content-store-eu-west/content/pii:S1872206724600537/gr6/THUMBNAIL/image/gif/028b42143a4830f6d7e6ed29471400fd/gr6.sml gr6 gr6.sml sml 11594 77 219 IMAGE-THUMBNAIL 1-s2.0-S1872206724600537-gr7.sml https://s3-eu-west-1.amazonaws.com/prod-ucs-content-store-eu-west/content/pii:S1872206724600537/gr7/THUMBNAIL/image/gif/2670dc86ec1f1b40bf8eace4fa22ea10/gr7.sml gr7 gr7.sml sml 13073 163 128 IMAGE-THUMBNAIL 1-s2.0-S1872206724600537-gr8.sml https://s3-eu-west-1.amazonaws.com/prod-ucs-content-store-eu-west/content/pii:S1872206724600537/gr8/THUMBNAIL/image/gif/97cab5076f0ae5a6ae4514196ff0d7ae/gr8.sml gr8 gr8.sml sml 15763 164 205 IMAGE-THUMBNAIL 1-s2.0-S1872206724600537-gr9.sml https://s3-eu-west-1.amazonaws.com/prod-ucs-content-store-eu-west/content/pii:S1872206724600537/gr9/THUMBNAIL/image/gif/05d672795d3f796faea52bdd8783d880/gr9.sml gr9 gr9.sml sml 19117 158 219 IMAGE-THUMBNAIL 1-s2.0-S1872206724600537-Sc1.sml https://s3-eu-west-1.amazonaws.com/prod-ucs-content-store-eu-west/content/pii:S1872206724600537/Sc1/THUMBNAIL/image/gif/32e18316e9623bc79c274d3ea6fa2ec7/Sc1.sml Sc1 Sc1.sml sml 11833 112 219 IMAGE-THUMBNAIL 1-s2.0-S1872206724600537-Sc2.sml https://s3-eu-west-1.amazonaws.com/prod-ucs-content-store-eu-west/content/pii:S1872206724600537/Sc2/THUMBNAIL/image/gif/0cb7ee4ca7df1b7309a713ae583184ef/Sc2.sml Sc2 Sc2.sml sml 7087 164 164 IMAGE-THUMBNAIL 1-s2.0-S1872206724600537-fx1_lrg.jpg https://s3-eu-west-1.amazonaws.com/prod-ucs-content-store-eu-west/content/pii:S1872206724600537/HIGHRES/image/jpeg/f205b258c32f19dbe8edbc61feb039c5/fx1_lrg.jpg fx1 true fx1_lrg.jpg jpg 74553 475 800 IMAGE-HIGH-RES 1-s2.0-S1872206724600537-fx2_lrg.jpg https://s3-eu-west-1.amazonaws.com/prod-ucs-content-store-eu-west/content/pii:S1872206724600537/HIGHRES/image/jpeg/dc4123ab5ee013667239c30c06e504df/fx2_lrg.jpg fx2 fx2_lrg.jpg jpg 50699 663 474 IMAGE-HIGH-RES 1-s2.0-S1872206724600537-gr1_lrg.jpg https://s3-eu-west-1.amazonaws.com/prod-ucs-content-store-eu-west/content/pii:S1872206724600537/HIGHRES/image/jpeg/94cea9c09ad3c6a4b75d967c7d5214a5/gr1_lrg.jpg gr1 gr1_lrg.jpg jpg 54017 415 423 IMAGE-HIGH-RES 1-s2.0-S1872206724600537-gr10_lrg.jpg https://s3-eu-west-1.amazonaws.com/prod-ucs-content-store-eu-west/content/pii:S1872206724600537/HIGHRES/image/jpeg/f9efa05809f2d23336f4d79c90bbc66c/gr10_lrg.jpg gr10 gr10_lrg.jpg jpg 218394 748 1407 IMAGE-HIGH-RES 1-s2.0-S1872206724600537-gr11_lrg.jpg https://s3-eu-west-1.amazonaws.com/prod-ucs-content-store-eu-west/content/pii:S1872206724600537/HIGHRES/image/jpeg/beb270df3967279bda3264c7f4c6d97d/gr11_lrg.jpg gr11 gr11_lrg.jpg jpg 428585 1471 1485 IMAGE-HIGH-RES 1-s2.0-S1872206724600537-gr12_lrg.jpg https://s3-eu-west-1.amazonaws.com/prod-ucs-content-store-eu-west/content/pii:S1872206724600537/HIGHRES/image/jpeg/f6ab16c3e253f01ae09461fc5a6b9ccd/gr12_lrg.jpg gr12 gr12_lrg.jpg jpg 591653 2001 1254 IMAGE-HIGH-RES 1-s2.0-S1872206724600537-gr13_lrg.jpg https://s3-eu-west-1.amazonaws.com/prod-ucs-content-store-eu-west/content/pii:S1872206724600537/HIGHRES/image/jpeg/267be6551347f5e5be376770b995e5cc/gr13_lrg.jpg gr13 gr13_lrg.jpg jpg 572210 1760 1774 IMAGE-HIGH-RES 1-s2.0-S1872206724600537-gr14_lrg.jpg https://s3-eu-west-1.amazonaws.com/prod-ucs-content-store-eu-west/content/pii:S1872206724600537/HIGHRES/image/jpeg/446b43a078ea03be09a768d85e3295d4/gr14_lrg.jpg gr14 gr14_lrg.jpg jpg 442639 1049 1877 IMAGE-HIGH-RES 1-s2.0-S1872206724600537-gr15_lrg.jpg https://s3-eu-west-1.amazonaws.com/prod-ucs-content-store-eu-west/content/pii:S1872206724600537/HIGHRES/image/jpeg/01e3d452d8bf9570e1f52bad93c4abfa/gr15_lrg.jpg gr15 gr15_lrg.jpg jpg 623335 1332 2008 IMAGE-HIGH-RES 1-s2.0-S1872206724600537-gr16_lrg.jpg https://s3-eu-west-1.amazonaws.com/prod-ucs-content-store-eu-west/content/pii:S1872206724600537/HIGHRES/image/jpeg/53b21f08455ef38528bc48b239535db0/gr16_lrg.jpg gr16 gr16_lrg.jpg jpg 398657 988 1760 IMAGE-HIGH-RES 1-s2.0-S1872206724600537-gr17_lrg.jpg https://s3-eu-west-1.amazonaws.com/prod-ucs-content-store-eu-west/content/pii:S1872206724600537/HIGHRES/image/jpeg/1ff17fa6247f773ee114680b94eb0cb5/gr17_lrg.jpg gr17 gr17_lrg.jpg jpg 43378 479 600 IMAGE-HIGH-RES 1-s2.0-S1872206724600537-gr18_lrg.jpg https://s3-eu-west-1.amazonaws.com/prod-ucs-content-store-eu-west/content/pii:S1872206724600537/HIGHRES/image/jpeg/04f87d4e599a8f17fb2737b046fe4b08/gr18_lrg.jpg gr18 gr18_lrg.jpg jpg 31356 299 315 IMAGE-HIGH-RES 1-s2.0-S1872206724600537-gr19_lrg.jpg https://s3-eu-west-1.amazonaws.com/prod-ucs-content-store-eu-west/content/pii:S1872206724600537/HIGHRES/image/jpeg/a32e8b9e0240e9563ee123611c8157dc/gr19_lrg.jpg gr19 gr19_lrg.jpg jpg 329139 740 2044 IMAGE-HIGH-RES 1-s2.0-S1872206724600537-gr2_lrg.jpg https://s3-eu-west-1.amazonaws.com/prod-ucs-content-store-eu-west/content/pii:S1872206724600537/HIGHRES/image/jpeg/f4de2f94a19befb39d6d93ebb85f64c7/gr2_lrg.jpg gr2 gr2_lrg.jpg jpg 894440 1829 2068 IMAGE-HIGH-RES 1-s2.0-S1872206724600537-gr20_lrg.jpg https://s3-eu-west-1.amazonaws.com/prod-ucs-content-store-eu-west/content/pii:S1872206724600537/HIGHRES/image/jpeg/c4e52390bee5d7b443dfd125640528d0/gr20_lrg.jpg gr20 gr20_lrg.jpg jpg 361557 1277 1737 IMAGE-HIGH-RES 1-s2.0-S1872206724600537-gr21_lrg.jpg https://s3-eu-west-1.amazonaws.com/prod-ucs-content-store-eu-west/content/pii:S1872206724600537/HIGHRES/image/jpeg/9767cce3873b563cda5c23e8c0d533b3/gr21_lrg.jpg gr21 gr21_lrg.jpg jpg 688250 1542 2046 IMAGE-HIGH-RES 1-s2.0-S1872206724600537-gr22_lrg.jpg https://s3-eu-west-1.amazonaws.com/prod-ucs-content-store-eu-west/content/pii:S1872206724600537/HIGHRES/image/jpeg/28204f3606512a39e16756c6e3c6cc29/gr22_lrg.jpg gr22 gr22_lrg.jpg jpg 718511 1405 2008 IMAGE-HIGH-RES 1-s2.0-S1872206724600537-gr23_lrg.jpg https://s3-eu-west-1.amazonaws.com/prod-ucs-content-store-eu-west/content/pii:S1872206724600537/HIGHRES/image/jpeg/791c660b8ba28b44f7abef18dadbd866/gr23_lrg.jpg gr23 gr23_lrg.jpg jpg 338717 615 1763 IMAGE-HIGH-RES 1-s2.0-S1872206724600537-gr24_lrg.jpg https://s3-eu-west-1.amazonaws.com/prod-ucs-content-store-eu-west/content/pii:S1872206724600537/HIGHRES/image/jpeg/39d65cab5082f9a82bef63d0b926b3ac/gr24_lrg.jpg gr24 gr24_lrg.jpg jpg 513785 1445 1633 IMAGE-HIGH-RES 1-s2.0-S1872206724600537-gr25_lrg.jpg https://s3-eu-west-1.amazonaws.com/prod-ucs-content-store-eu-west/content/pii:S1872206724600537/HIGHRES/image/jpeg/f08847b8ddb43f2737cd89a604d31548/gr25_lrg.jpg gr25 gr25_lrg.jpg jpg 631480 1730 2006 IMAGE-HIGH-RES 1-s2.0-S1872206724600537-gr26_lrg.jpg https://s3-eu-west-1.amazonaws.com/prod-ucs-content-store-eu-west/content/pii:S1872206724600537/HIGHRES/image/jpeg/4447626d15648fcf0f151a3a49135d02/gr26_lrg.jpg gr26 gr26_lrg.jpg jpg 614542 1267 2012 IMAGE-HIGH-RES 1-s2.0-S1872206724600537-gr27_lrg.jpg https://s3-eu-west-1.amazonaws.com/prod-ucs-content-store-eu-west/content/pii:S1872206724600537/HIGHRES/image/jpeg/30390354934564e4bd582d54937a9327/gr27_lrg.jpg gr27 gr27_lrg.jpg jpg 746051 1721 1942 IMAGE-HIGH-RES 1-s2.0-S1872206724600537-gr28_lrg.jpg https://s3-eu-west-1.amazonaws.com/prod-ucs-content-store-eu-west/content/pii:S1872206724600537/HIGHRES/image/jpeg/536522fbe745cc3a8f1f68929f8f2843/gr28_lrg.jpg gr28 gr28_lrg.jpg jpg 483687 836 1795 IMAGE-HIGH-RES 1-s2.0-S1872206724600537-gr29_lrg.jpg https://s3-eu-west-1.amazonaws.com/prod-ucs-content-store-eu-west/content/pii:S1872206724600537/HIGHRES/image/jpeg/2794adb8768031ae1fcf610006231732/gr29_lrg.jpg gr29 gr29_lrg.jpg jpg 605898 1623 1496 IMAGE-HIGH-RES 1-s2.0-S1872206724600537-gr3_lrg.jpg https://s3-eu-west-1.amazonaws.com/prod-ucs-content-store-eu-west/content/pii:S1872206724600537/HIGHRES/image/jpeg/405a2e4dc1c76ea3e8c5bee26adb7343/gr3_lrg.jpg gr3 gr3_lrg.jpg jpg 388867 877 2054 IMAGE-HIGH-RES 1-s2.0-S1872206724600537-gr30_lrg.jpg https://s3-eu-west-1.amazonaws.com/prod-ucs-content-store-eu-west/content/pii:S1872206724600537/HIGHRES/image/jpeg/22e0d587d8b7a171634f2139990e4137/gr30_lrg.jpg gr30 gr30_lrg.jpg jpg 459545 941 1675 IMAGE-HIGH-RES 1-s2.0-S1872206724600537-gr31_lrg.jpg https://s3-eu-west-1.amazonaws.com/prod-ucs-content-store-eu-west/content/pii:S1872206724600537/HIGHRES/image/jpeg/7a81e8a292d05ce053f98564731bdd86/gr31_lrg.jpg gr31 gr31_lrg.jpg jpg 374580 724 1933 IMAGE-HIGH-RES 1-s2.0-S1872206724600537-gr32_lrg.jpg https://s3-eu-west-1.amazonaws.com/prod-ucs-content-store-eu-west/content/pii:S1872206724600537/DOWNSAMPLED/image/jpeg/33e6cff3a209bf0cdabbad71ef9060a0/gr32_lrg.jpg gr32 gr32_lrg.jpg jpg 755082 1700 1912 IMAGE-HIGH-RES 1-s2.0-S1872206724600537-gr33_lrg.jpg https://s3-eu-west-1.amazonaws.com/prod-ucs-content-store-eu-west/content/pii:S1872206724600537/HIGHRES/image/jpeg/808d275df45fe868aacd4ea23fd91847/gr33_lrg.jpg gr33 gr33_lrg.jpg jpg 365655 768 2016 IMAGE-HIGH-RES 1-s2.0-S1872206724600537-gr34_lrg.jpg https://s3-eu-west-1.amazonaws.com/prod-ucs-content-store-eu-west/content/pii:S1872206724600537/HIGHRES/image/jpeg/53f5c87e6b4b83b243b3cf8e8506fade/gr34_lrg.jpg gr34 gr34_lrg.jpg jpg 303091 1142 992 IMAGE-HIGH-RES 1-s2.0-S1872206724600537-gr35_lrg.jpg https://s3-eu-west-1.amazonaws.com/prod-ucs-content-store-eu-west/content/pii:S1872206724600537/HIGHRES/image/jpeg/ea2b60a1670843e2ea947889feae8541/gr35_lrg.jpg gr35 gr35_lrg.jpg jpg 331029 754 1966 IMAGE-HIGH-RES 1-s2.0-S1872206724600537-gr36_lrg.jpg https://s3-eu-west-1.amazonaws.com/prod-ucs-content-store-eu-west/content/pii:S1872206724600537/HIGHRES/image/jpeg/6131584c9add29229df87b6f5d2c354f/gr36_lrg.jpg gr36 gr36_lrg.jpg jpg 280059 779 1853 IMAGE-HIGH-RES 1-s2.0-S1872206724600537-gr37_lrg.jpg https://s3-eu-west-1.amazonaws.com/prod-ucs-content-store-eu-west/content/pii:S1872206724600537/HIGHRES/image/jpeg/363d4656cf7c7c4fb53a9136d0a2e72c/gr37_lrg.jpg gr37 gr37_lrg.jpg jpg 449776 783 2009 IMAGE-HIGH-RES 1-s2.0-S1872206724600537-gr38_lrg.jpg https://s3-eu-west-1.amazonaws.com/prod-ucs-content-store-eu-west/content/pii:S1872206724600537/HIGHRES/image/jpeg/53d64ab15dfd54d985f009ebd031fa62/gr38_lrg.jpg gr38 gr38_lrg.jpg jpg 252696 638 1884 IMAGE-HIGH-RES 1-s2.0-S1872206724600537-gr39_lrg.jpg https://s3-eu-west-1.amazonaws.com/prod-ucs-content-store-eu-west/content/pii:S1872206724600537/HIGHRES/image/jpeg/12844be957cfa6da91485b247822241e/gr39_lrg.jpg gr39 gr39_lrg.jpg jpg 625194 1100 1911 IMAGE-HIGH-RES 1-s2.0-S1872206724600537-gr4_lrg.jpg https://s3-eu-west-1.amazonaws.com/prod-ucs-content-store-eu-west/content/pii:S1872206724600537/HIGHRES/image/jpeg/690a726c60d3f72c488210b09e79aa35/gr4_lrg.jpg gr4 gr4_lrg.jpg jpg 938282 2079 1998 IMAGE-HIGH-RES 1-s2.0-S1872206724600537-gr40_lrg.jpg https://s3-eu-west-1.amazonaws.com/prod-ucs-content-store-eu-west/content/pii:S1872206724600537/HIGHRES/image/jpeg/6e579b6103061fb4da8bc16bcd0ef37b/gr40_lrg.jpg gr40 gr40_lrg.jpg jpg 325804 814 2004 IMAGE-HIGH-RES 1-s2.0-S1872206724600537-gr41_lrg.jpg https://s3-eu-west-1.amazonaws.com/prod-ucs-content-store-eu-west/content/pii:S1872206724600537/HIGHRES/image/jpeg/01f647b72e404bb3ec9420f299410f7d/gr41_lrg.jpg gr41 gr41_lrg.jpg jpg 399340 1135 1709 IMAGE-HIGH-RES 1-s2.0-S1872206724600537-gr42_lrg.jpg https://s3-eu-west-1.amazonaws.com/prod-ucs-content-store-eu-west/content/pii:S1872206724600537/HIGHRES/image/jpeg/3705f9c66f634245beaae072f1a08796/gr42_lrg.jpg gr42 gr42_lrg.jpg jpg 159472 564 993 IMAGE-HIGH-RES 1-s2.0-S1872206724600537-gr43_lrg.jpg https://s3-eu-west-1.amazonaws.com/prod-ucs-content-store-eu-west/content/pii:S1872206724600537/HIGHRES/image/jpeg/2ab1483524d971f2c89df4196852d1b2/gr43_lrg.jpg gr43 gr43_lrg.jpg jpg 324131 1025 1868 IMAGE-HIGH-RES 1-s2.0-S1872206724600537-gr44_lrg.jpg https://s3-eu-west-1.amazonaws.com/prod-ucs-content-store-eu-west/content/pii:S1872206724600537/HIGHRES/image/jpeg/363142c8eaae1846c37f3488dde8d863/gr44_lrg.jpg gr44 gr44_lrg.jpg jpg 137645 581 970 IMAGE-HIGH-RES 1-s2.0-S1872206724600537-gr5_lrg.jpg https://s3-eu-west-1.amazonaws.com/prod-ucs-content-store-eu-west/content/pii:S1872206724600537/HIGHRES/image/jpeg/bda2a9b069bc9671a187668fc47520b0/gr5_lrg.jpg gr5 gr5_lrg.jpg jpg 570303 1414 1697 IMAGE-HIGH-RES 1-s2.0-S1872206724600537-gr6_lrg.jpg https://s3-eu-west-1.amazonaws.com/prod-ucs-content-store-eu-west/content/pii:S1872206724600537/HIGHRES/image/jpeg/04e651febef462b86576c13443010bd0/gr6_lrg.jpg gr6 gr6_lrg.jpg jpg 396183 723 2069 IMAGE-HIGH-RES 1-s2.0-S1872206724600537-gr7_lrg.jpg https://s3-eu-west-1.amazonaws.com/prod-ucs-content-store-eu-west/content/pii:S1872206724600537/HIGHRES/image/jpeg/31e99728afd811e7b1226a25aca8d9fd/gr7_lrg.jpg gr7 gr7_lrg.jpg jpg 579077 1657 1301 IMAGE-HIGH-RES 1-s2.0-S1872206724600537-gr8_lrg.jpg https://s3-eu-west-1.amazonaws.com/prod-ucs-content-store-eu-west/content/pii:S1872206724600537/HIGHRES/image/jpeg/715f30f53f76116e6529e07147322f9e/gr8_lrg.jpg gr8 gr8_lrg.jpg jpg 325047 1119 1399 IMAGE-HIGH-RES 1-s2.0-S1872206724600537-gr9_lrg.jpg https://s3-eu-west-1.amazonaws.com/prod-ucs-content-store-eu-west/content/pii:S1872206724600537/HIGHRES/image/jpeg/2dc1906042cb194763992e9229fd9ae0/gr9_lrg.jpg gr9 gr9_lrg.jpg jpg 612031 1369 1892 IMAGE-HIGH-RES 1-s2.0-S1872206724600537-Sc1_lrg.jpg https://s3-eu-west-1.amazonaws.com/prod-ucs-content-store-eu-west/content/pii:S1872206724600537/HIGHRES/image/jpeg/beb9f746469441e23deffd104e0859cb/Sc1_lrg.jpg Sc1 Sc1_lrg.jpg jpg 117610 496 972 IMAGE-HIGH-RES 1-s2.0-S1872206724600537-Sc2_lrg.jpg https://s3-eu-west-1.amazonaws.com/prod-ucs-content-store-eu-west/content/pii:S1872206724600537/HIGHRES/image/jpeg/c8f78e367e09d2f6d6086faf0c8ba5da/Sc2_lrg.jpg Sc2 Sc2_lrg.jpg jpg 25014 345 346 IMAGE-HIGH-RES 1-s2.0-S1872206724600537-si1.gif https://s3-eu-west-1.amazonaws.com/prod-ucs-content-store-eu-west/content/pii:S1872206724600537/STRIPIN/image/gif/a3d29777b01b18b5223825e1df20d548/si1.gif si1 si1.gif gif 597 46 223 ALTIMG 1-s2.0-S1872206724600537-si2.gif https://s3-eu-west-1.amazonaws.com/prod-ucs-content-store-eu-west/content/pii:S1872206724600537/STRIPIN/image/gif/151574581d7112e4058a07c59d4d9b7d/si2.gif si2 si2.gif gif 707 52 253 ALTIMG 1-s2.0-S1872206724600537-si3.gif https://s3-eu-west-1.amazonaws.com/prod-ucs-content-store-eu-west/content/pii:S1872206724600537/STRIPIN/image/gif/28338bfd3654400ca0d443b6f5d324b1/si3.gif si3 si3.gif gif 840 42 301 ALTIMG CHNJC 60053 S1872-2067(24)60053-7 10.1016/S1872-2067(24)60053-7 Dalian Institute of Chemical Physics, the Chinese Academy of Sciences Fig. 1 Classification of PEC catalysts for OER. Fig. 2 BiVO4-based catalysts for PEC OER. (a) Schematic diagram of PEC OER installation. (b,c) Chopped J-V curves of different photoanodes. (d) ABPE values of different photoanodes. (e) ABPE values of the NiFeOOH/MoO x /MQD/BiVO4 with other BiVO4-based photoanodes. (f, g) Illustrations of the charge transfer process for BiVO4 and NiFeOOH/MoO x /MQD/BiVO4. Reprinted with permission from Ref. [ 139 ]. Copyright 2022, John Wiley and Sons. (h) Schematic diagram of the preparation of photoanodes. (i) Chopped LSV curves of Co-agZIF-62/BiVO4 photoanodes with different cobalt-contents. (j) LSV curves of different photoanodes. (k) ABPE values, (l) IPCE values. (m,n) Mechanistic diagram of the charge transfer process occurring at different photoanodes. Reprinted with permission from Ref. [ 140 ]. Copyright 2023, John Wiley and Sons. Fig. 3 Fe2O3-based catalysts for PEC OER. (a) Schematic representation of the operando XAS experiment during PEC OER. (b) LSV of several FTO/Ni0.8Fe0.2OOH catalysts prepared with different number of cycles. (c) LSV of different photoanodes. The inset in each panel shows schematics of the working electrodes. Reprinted with permission from Ref. [ 141 ]. Copyright 2021, American Chemical Society. (d) Schematic illustration for the synthesis of SAs Pt: Fe2O3. (e) SEM image. (f) J-V curves of different samples. (g) ABPE value of SAs Pt: Fe2O3-Ov. Reprinted with permission from Ref. [ 142 ]. Copyright 2023, Nature Publishing Group. Fig. 4 Metal oxide-based catalysts for PEC OER. (a) Schematic illustration of the TQ-NiFe grown on the carbon cloth. (b) EDS maps. (c) PEC OER performance of the TQ-NiFe under dark and illumination. (d) Increased current densities for TQ-NiFe under irradiation. (e) Tafel plots for TQ-NiFe under dark. (f) Reaction activation energy of PEC OER for TQ-NiFe. Reprinted with permission from Ref. [ 143 ]. Copyright2023, Springer Nature. (g) Preparation process of different photoanodes. (h) LSV curves of different photoanodes under illumination in different solutions. (i) Charge separation efficiencies. (j) The formation energy for Sn-doping, Ge-doping, and Ge:Sn co-doping in Fe2O3. (k) DFT calculations of the atomic arrangement of Fe2O3 in different structures. (l) Gibbs free energy diagram for the formation of reaction intermediates from pure Fe2O3 and Ge-Fe2O3. Reprinted with permission from Ref. [ 144 ]. Copyright 2021, Springer Nature. Fig. 5 Ta3N5-based catalysts for PEC OER. SEM images of raw-Ta3N5 (a), TaCl5-Ta3N5 (b). Current-potential (j-E) curves of raw-Ta3N5, TaCl5-Ta3N, heated-Ta3N5, necked-Ta3N5 (c) and CoPi/necked-Ta3N5 electrode (d). Reprinted with permission from Ref. [ 152 ]. Copyright 2016, Royal Society of Chemistry. (e) HRTEM image of Ta3N5. (f) HRTEM image of the post treated Ta3N5(P). (g) LSV curves of pure Ta3N5, Ta3N5(P) photoanodes and the Ta3N5(P) photoanode under illumination. (h) Schematic structure of the synthesized Ta3N5 photoanodes system. (i) LSV curves of different samples; inset Figure illustrates the saturated photocurrent curve. Reprinted with permission from Ref. [ 153 ]. Copyright 2016, Royal Society of Chemistry. Fig. 6 Ta3N5-based catalysts for PEC OER. (a,b) HRTEM images of NiCoFe-Bi/gradient-Mg:Ta3N5/Nb. (c) J-V curves of different catalysts. (d) IPCE spectrum of the NiCoFe-Bi/gradient-Mg:Ta3N5/Nb photoanode. (e) ABPE of the photoanodes. Reprinted with permission from Ref. [ 154 ]. Copyright 2020, Springer Nature. (f) SEM image of Ta3N5-NRs/Ta3N5-thin film/GaN. (g,h) HRTEM images of FeNiCoO x /Ta3N5-NRs. (i) Schematic diagram of the prepared device and reaction mechanism. (j) J-Va curves of bis-CuInSe2 (dashed line: independent; solid line: behind the photoanode) and Ta3N5-NR. (k) Stochiometric (2:1) production of hydrogen and oxygen gases. Reprinted with permission from Ref. [ 155 ]. Copyright 2023, John Wiley and Sons. Fig. 7 Ta3N5-based catalysts for PEC OER. Photographic image (a), SEM image (b) of Ta3N5/GaN/Al2O3 thin film. (c) i-E curve obtained from NiFeO x /Ta3N5/GaN/Al2O3 photoanode. (d) Half-cell solar-to-hydrogen energy conversion efficiency of NiFeO x /Ta3N5/GaN/Al2O3 photoanode as a function of potential. (e) Half-cell solar-to-hydrogen energy conversion efficiency of NiFeO x /Ta3N5/GaN/Al2O3 photoanode as a function of potential. (f) Relationship between STH values and reaction times. Reprinted with permission from Ref. [ 156 ]. Copyright 2019, John Wiley and Sons. Structures and morphological properties of the Ta3N5-NRs and Ba:Ta3N5-NRs specimens. (g) XRD spectrum. SEM images of the Ba: Ta3N5-NRs (h–k). (l) J-V curves. (m) Half-cell solar-to-hydrogen (HC-STH) curves. (n) IPCE spectra. (o) Integrated photocurrent densities. Reprinted with permission from Ref. [ 157 ]. Copyright 2021, Royal Society of Chemistry. Fig. 8 CdIn2S4-based catalysts for PEC OER. (a) Schematic representation of the synthesis of VS-CdIn2S4. (b) SEM image of V s-CIS-500. (c) J-V plots measured under dark and illumination. (d) APBE values under dark and light conditions. (e) IPCE spectra under single wavelength reaction conditions. Reprinted with permission from Ref. [ 158 ]. Copyright 2020, Springer Nature. (f) SEM images of nanoflakes. (g) LSV curves of modified SnS2 under backlighting conditions. (h) IPCE curves of SnS2 with front and back lighting conditions. Reprinted with permission from Ref. [ 159 ]. Copyright 2019, John Wiley and Sons. Fig. 9 CdS-based catalysts for PEC OER. (a) Schematic representation of the conversion of CdS nfa to CdS@CdIn2S4 nfa. (b,c) SEM images of CdS@CdIn2S4 NFAs. (d) LSV under illumination. (e) Photoelectric conversion efficiencies of CdS NFAs and CdS@CdIn2S4 NFAs. Reprinted with permission from Ref. [ 160 ]. Copyright 2017, Royal Society of Chemistry. (f) Schematic illustration of TiO2/CdS/MoS2 synthesis. (g,h) SEM images of TiO2/CdS/MoS2 (i) LSV curves for different samples. (j) Stability testing of photoanodes. IPCE curves (k) and UV-vis absorbance spectra (l) of different samples. Reprinted with permission from Ref. [ 161 ]. Copyright 2019, Elsevier. Fig. 10 Polymers-based catalysts for PEC OER. (a) Chemical structures of PNDITCVT (PA) and PBDTTTPD (PD). (b) Energy levels of PA and PD, sacrificial oxidation potential and OER potential. (c) Schematic of FTO/mZnO/BHJ composite for PEC OER. (d) LSV scans (under intermittent illumination). (e) IPCE spectrum of FTO/mZnO/BHJ/PTAA/LI. (f) CA curve of FTO/mZnO/BHJ/LIO and FTO/mZnO/BHJ/PTAA/LI for PEC OER. Reprinted with permission from Ref. [ 170 ]. Copyright 2021, Springer Nature. Fig. 11 Polymers-based catalysts for PEC OER. (a) Schematic diagram of a PEC cell with an IO-TiO2|dpp|Pos-PSII photoanode connected to an IO-ITO|H2ase cathode (right). SEM image of the IO-TiO2 photoanode structure (left). (b) Solution UV-vis spectra of dpp and PSII. (c) The mode of carrier transfer between different materials and the associated redox potentials. (d) Chronoamperometry for the determination of the onset potential (Eonset) and limiting photocurrent for the IO-TiO2|dpp|Pos-PSII photoanode. (e) Photocurrent density (J) plotted as a function of E app determined by the stepped potential chronoamperometry in (d). Reprinted with permission from Ref. [ 171 ]. Copyright 2018, Springer Nature. Fig. 12 LDH-based catalysts for PEC OER. (a) SEM image of the InN/PM6. (b) XRD spectrum of InN and InN/PM6. (c) FT-IR spectrum of PM6 and InN/PM6. LSV curves (d) and ABPE curves (e) of different photoanodes. (f) EIS spectra of all photoanodes. Reprinted with permission from Ref. [ 172 ]. Copyright 2023, Royal Society of Chemistry. (g) Schematic representation of the synthesis of BV/P3HT-CuPc/LDH. (h,i) LSV curves of different photoanode under illumination in (h) KBi and (i) 0.5 mol L–1 Na2SO3. IPCE (j) and ABPE curves (k) of the different photoanode. Reprinted with permission from Ref. [ 174 ]. Copyright 2022, Elsevier. Fig. 13 Carbon-based catalysts for PEC OER. (a) Schematic representation of the synthesis of undoped and N, S co-doped GQDs. TEM (b) and HRTEM image (c). (d) HER and OER LSV curves of NS-GQD/graphene. Cathodic (e) and anodic electrochemical properties (f) of NS-GQD/ graphene in ethanol. (g) Electrocatalytic activity of HER and OER of NS-GQD/graphene. Reprinted with permission from Ref. [ 179 ]. Copyright 2020, American Chemical Society. (h) Schematic representation of the PEC OER of the material synthesised. (i) Energy band spectra of InSe/Gr. (j) PEC OER model for DFT simulation of InSe/Gr. (k) LSV curves of InSe/Gr after different illumination times. (l) Optical current density under dark and light conditions. Reprinted with permission from Ref. [ 180 ]. Copyright 2021, Springer Nature. Fig. 14 Carbon-based catalysts for PEC OER. (a) Schematic synthesis of n-Si/TiO2/NiO x /pGr. (b) Raman spectra for different samples. (c) Current density-potential (J-V) curves of the different photoanode. (d) V on and J 1.23 values for different photoanodes. (e) Representative OER polarization plots in 1 mol L–1 KOH of different samples. (f) Typical Nyquist plots measured for different photoanodes. Reprinted with permission from Ref. [ 181 ]. Copyright 2023, John Wiley and Sons. (g) Schematic procedure for the photoanode preparation. (h–j) SEM images of the representative n-Si/TiO2/NiO x /SLG/Ni photoanode. (k) J-V curves of different samples. (l) ABPE values of n-Si/TiO2/NiO x /SLG/Ni and n-Si/TiO2/NiO x /SLG/Ni without SLG. Reprinted with permission from Ref. [ 182 ]. Copyright 2022, John Wiley and Sons. Fig. 15 MOF-based catalysts for PEC OER. (a) The synthesis of core-shell Ov-BiVO4@NiFe-MOFs. J-V curves (b), ABPEs (c), IPCE (d) and EIS spectrum (e) of different photoanodes. Reprinted with permission from Ref.[ 187 ]. Copyright 2021, John Wiley and Sons. (f) Schematic flow diagram of the synthesis of different photoanodes. (g,h) LSV curves under light and dark conditions. ABPE values (i) and IPCE spectrum (j) (inset shows the APCE spectra) of different samples. Reprinted with permission from Ref. [ 188 ]. Copyright 2023, John Wiley and Sons. Fig. 16 MOF-based catalysts for PEC OER. (a) Schematic of TiO2 NR growth on FTO and photographs of different lengths of TiO2 NR grown by controlling the reaction time. (b) J-V curves of TiO2 NRs and MIL(125)-NH2/TiO2 NRs. (c) Photocurrent density of different samples. IPCE (d) and EIS spectrum (e) of TiO2 NRs and MIL(125)-NH2-TiO2 NRs. Reprinted with permission from Ref. [ 189 ]. Copyright 2019, Elsevier. (f) Schematic of the synthesis of core-shell Ti: analysis Fe2O3@CoFe-cMOFs photoanode. (g) LSV curves (1 mol L–1 KOH, pH 13.6), (h) ABPE, IPCE (i) and LSV curves (j) (0.2 mol L–1 Na2SO3) of different samples. Reprinted with permission from Ref. [ 59 ]. Copyright 2022, Elsevier. Fig. 17 The schematic diagram of the electrolysis device. Fig. 18 Classification of PEC catalysts for CO2RR. Fig. 19 (a) Schematic for the photoelectrochemical deposition of Cu onto n+p-Si. (b) n+p-Si μW and planar n+p-Si in the J ph-E curve, before (solid line) and after (dashed line) passing –1.00 C cm–2. LSV curves were recorded at –200 mV s–1. An electropolished Cu film (c), and a n+p-Si µW/Cu photocathode (d) under illumination. Reprinted with permission from Ref. [ 90 ]. Copyright 2020, American Chemical Society. (e) The array has a nanowire diameter of 400 nm and a length of 21 μm. (f) Schematic illustration showing the dopant layer and charge separation. (g) Diagram of the custom cell. (h) Mass loading dependence. Comparison of FE (i) and semilog plots (j) of j C2H4 between 40 μg cm–2 CuNPs on illuminated SiNWs and 69 μg cm–2 CuNPs. Reprinted with permission from Ref. [ 215 ]. Copyright 2022, American Chemical Society. Fig. 20 Cu-based catalysts for PEC CO2RR. (a) Charge transfer processes on the Cu2+-OH (aq) surface. (b) Schematic representation of the charge transfer within the system in the absence of Cu2+-OH (aq) catalyst in the reaction environment. (c) Chronoamperometry of Cu2O and Ag/Cu2O photocathodes. (d) J-t curves of Cu2O and Ag/Cu2O. (e) LSV curves for different photocathodes. (f) FE on Ag/Cu2O/ZS/FTO photocathode for PEC CO2RR. Reprinted with permission from Ref. [ 94 ]. Copyright 2021, Springer Nature. (g) Schematic of Cu-MOF/Cu2O in acetonitrile solution for PEC CO2RR. (h) FE of CO production for PEC CO2RR in dark and (i) solar-to-CO (STC) efficiencies. Reprintedwith permission from Ref. [ 216 ]. Copyright 2019, American Chemical Society. Fig. 21 GaN-based catalysts for PEC CO2RR. (a) Molecular structure of n-GaN nanowires and composites on silicon substrates. (b) SEM images of n-GaN nanowires grown on the substrate. (c) Relative energy levels in the composites, red arrows indicate the electron transfer paths under light conditions. (d) Schematic representation of Si|mesoTiO2|CotpyP photocathode. (e) Bias photocurrent densities of different samples in phosphate buffer after argon degassing under illumination conditions. (f) PEC CO2RR stability performance test, the small graph shows the FE efficiency for different products. Reprinted with permission from Ref. [ 217 ]. Copyright 2019, Springer Nature. (g) SEM images of Ag-modified GaN NWs grow on n-p silicon wafers and schematic representation of the synthesis process with AgX co-catalysts (X = Cl, Br, I). (h) Energy band diagram of AgX/GaN/Si photocathode. (i) TEM images of Ag/GaN NWs. (j) FE efficiencies and ratios of different gas products measured over 12 h at different potentials and light conditions. Reprinted with permission from Ref. [ 218 ]. Copyright 2022, American Chemical Society. Fig. 22 GaN-based catalysts for PEC CO2RR. (a) Schematic representation of the synthesis of CuS/GaN/Si on n+-p silicon wafers. LSV curves (b), FEHCOOH (c), and j HCOOH (d) of different catalysts. (e) PEC CO2 RR performance of CuS/GaN/Si in different reaction environments. Reprinted with permission from Ref. [ 219 ]. Copyright 2021, American Chemical Society. (f) Schematic diagram of a plant to produce formate from biomass material and CO2. (g) Schematic of Bi/GaN/Si for HCOO– production by PEC CO2RR. (h) SEM image and photograph of Bi/GaN/Si. (i) LSV curves, (j) FEs and jHCOO– at varied applied potentials over Bi/GaN/Si. Reprinted with permission from Ref. [ 220 ]. Copyright 2023, Springer Nature. Fig. 23 GaN-based catalysts for PEC CO2RR. (a) Schematic illustration of the structure. (b) SEM images display GaN nanowires vertically grown on a Pt-TiO2/GaN/n-p Si silicon substrate. (c) J-V curves of different samples. (d) FEs for CO and H2. Reprinted with permission from Ref. [ 221 ]. Copyright 2018, American Chemical Society. Schematic (e,f) and energy diagram (g) of Sn NP/GaN NW/Si for PEC CO2RR with different solutions. (h) The black curve is the J-V curve of Sn NP/GaN NW/Si measured under dark conditions. (i) FEs of different products of Sn-, Co-, and Ni-decorated GaN NW/Si. Reprinted with permission from Ref. [ 14 ]. Copyright 2019, Royal Society of Chemistry. Fig. 24 TiO2-based catalysts for PEC CO2RR. (a) Schematic representation of Si|mesoTiO2|CotpyP photocathode. TON for the CO2 reduction products (b) and Faradaic efficiencies for all products (c). (d) CPPE (J-t) traces of different photocathodes under continuous illumination and an hourly 2min dark chop. (e) LSVs of Si|mesoTiO2 and Si|mesoTiO2|CotpyP with chopped illumination. (f) Si|mesoTiO2|CotpyP and products of control experiments. Reprinted with permission from Ref. [ 97 ]. Copyright 2019, Springer Nature. (g) Schematic diagram of energy bands of amorphous silicon composites for PEC CO2RR. (h) PEC J-V curves of different photocathodes. Different product FEs after PEC CO2RR (i) a-Si/TiO2, (j) ST-4Au and (k) ST-7Au. Reprinted with permission from Ref. [ 222 ]. Copyright 2019, Royal Society of Chemistry. Fig. 25 Porphyrin-based catalysts for PEC CO2RR. (a) Schematic representation of photosynthesis and PEC CO2RR for chlorophyll and HNTM-Au-SA, respectively. (b) TEM image. (c) STEM image. (d) FT-EXAFS spectra of different samples, and Au foil at Au L3 edge. (e) The FT-EXAFS space-fitting curve of HNTM-Au-SA. (f) FEmax and product observed on each catalyst. (g) Calculated by DFT free energy of CO2 to CO. Reprinted with permission from Ref. [ 225 ]. Copyright 2019, Springer Nature. (h) Schematic representation of the synthesis process of Cu@porphyrin-COFs nanorods. FEs of total carbon-based products of PEC CO2 reduction on (i) [OH]-H2P-COF/CF; (j) Cu@[OH]-H2P-COF/CF. (k) Different photocathodes at –1.0 V. (l) Different reaction condition of CO2 reduction of Cu@[OH]-H2P-COF/CF photocathode. Reprinted with permission from Ref. [ 226 ]. Copyright 2020, Elsevier. Fig. 26 Porphyrin-based catalysts for PEC CO2RR. (a) Schematic diagram of different photocathodes. LSV curves (b), CO FEs (c) of different electrodes. (d) Chronoamperometric stability tests on Si/rGO-Co at –0.1 V vs. RHE. (e) The photocurrent densities and reaction stability in this work are compared to similar work that has been reported previously. Reprinted with permission from Ref. [ 227 ]. Copyright 2023, John Wiley and Sons. (f) Schematic illustration of the construction of Co-Bpy-COF and its Postsynthetic Modification to Co-Bpy-COF-Ru x . (g) LSV curves of different samples. (h) LSV curves of Co-Bpy-COF and Co-Bpy-COF-Ru1/2. Comparison of the PEC CO2RR performance: FECO (i), and TOF (j) at different potentials. Reprinted with permission from Ref. [ 164 ]. Copyright 2023, American Chemical Society. Fig. 27 Doping modification strategies for catalysts in PEC OER. (a) Schematic image of the synthetic Si-ZnAl-LDH process. (b) TEM image of Si-ZnAl-LDH nanosheet. (c,d) AFM results of ZnAl-LDH and Si-ZnAl-LDH. LSV curves (e), cdl results (f) and EIS curves (g) of different samples. (h) Long-term stability test of Si-ZnAl-LDH. Reprinted with permission from Ref. [ 239 ]. Copyright 2024, Elsevier. (i) Schematic diagram of the Mn-FeBTC/NIF synthesis process. (j) Schematic representation of the competitive reactions that occur on the substrate surface during electrosynthesis. LSV curves (k), Tafel slope (l), EIS curves (m), and C dl results (n) of different samples under different reaction conditions. Reprinted with permission from Ref. [ 240 ]. Copyright 2023, Elsevier. Fig. 28 Manufacturing defects for catalysts in PEC OER. (a1–a6) AC-STEM images of the BVO (a1–a3) and B(VO)1–δ (a4–a6) films. (b,c) Schematic illustration of the DMF post-treatment induced VO4 vacancy gradient in B(VO)1–δ and its gradient band structure. LSV curves (d), ABPE curves (e), IPCE curves (f) of BVO and B(VO)1–δ photoanodes. Reprinted with permission from Ref. [ 247 ]. Copyright 2024, John Wiley and Sons. (g) Surface photovoltage images different VO concentration of PbCrO4. The surface photovoltage images were calculated using contact potential difference (CPD) under dark and light conditions (CPDlight-CPDdark). (h) Wavelength-dependent surface photovoltage spectra. (i) Open-circuit potential (OCP) of O-rich and O-poor PbCrO4 under chopped light illumination. (j) Photovoltage (OCPdark-OCPlight) was determined from open-circuit potential tests. (k) LSV curves of optimal PbCrO4 photoanodes. (l) Statistics of photocurrent density from different VO concentrations. Reprinted with permission from Ref. [ 71 ]. Copyright 2023, John Wiley and Sons. Fig. 29 Single or diatomic strategies for catalysts in PEC OER. (a) HAADF-STEM image of Co-C3N4. (b) Co K-edge XANES spectra of Co-C3N4 and Co foils. LSV curves (c), IPCE curves (d), ABPE curves (e) and EIS results (f) of different photoanodes. Reprinted with permission from Ref. [ 257 ]. Copyright 2023, John Wiley and Sons. (g) Schematic illustration of the synthesis procedure for FeOOH/Ni-N4-O/BiVO4. J-V curves (h), ABPE curves (i), IPCE curves (j) of different photonodes. (k) Comparison of ABPE values in this work with previously reported research. Reprinted with permission from Ref. [ 258 ]. Copyright 2021, American Chemical Society. Fig. 30 Doping modification strategies for catalysts in PEC CO2RR. (a) Top and side views of the basic unit of the CoPor-N3 polymer structure. TEM image (b), High magnification AC-HAADF-STEM (c), HAADF-STEM (d1) and TEM-EDS (d2–d4) images of CoPor-N3 polymer. (e) FE(CO)/FE(H2) values of the CoPor-N3 polymer at different potentials. (f) FE(CO)/FE(H2) values of the CoPor-N3 polymer at different potentials with illumination. (g) Structural sketch and photoelectrocatalytic CO2RR and OER mechanisms of the CoPor-N3||NiCo-LDH/CuPc/BiVO4 (Double) cell. (h) FE(CO) of the CoPor-N3||NiCo-LDH/CuPc/BiVO4 (Double) cell at different potentials under illumination. Reprinted with permission from Ref. [ 259 ]. Copyright 2021, John Wiley and Sons. (i) Schematic illustration of the preparation of dual-atom catalyst. (j) Aberration-corrected HAADF-STEM image. The orange ellipse highlighted the Ir-Pd diatom. (k) The linear scanning profile along the region of the marked orange rectangles and the corresponding intensity of the atoms. (l) CO2 conversion and product selectivity of IrPd-In2O3 catalysts synthesised by different methods. (m) Effect of metal loading on the space-time yield (STY) of methanol over Ir1Pd1-In2O3 (CP-PD). Reprinted with permission from Ref. [ 260 ]. Copyright 2024, John Wiley and Sons Fig. 31 Heterojunction modification strategies for catalysts in PEC OER and CO2RR. (a) Schematic of the synthesis. HR-TEM images (b), and elemental mapping (c) of NiFeO x /BVO/BiVO4 photoanodes. (d) J-V curves with and without Na2SO3 (the dotted line is with 0.5 mol L–1 Na2SO3 solution). ABPE curves (e), and IPCE (f) of four BiVO4-based photoanodes. Reprinted with permission from Ref. [ 265 ]. Copyright 2023, Elsevier. (g) Schematic depiction of the assembly method of CoPc molecules on GO. (h) Selectivity of different products at different potentials under dark condition of CFP-GO/CoPc. (i) Selectivity of different products at different potentials under light illumination of STA-GO/CoPc. Reprinted with permission from Ref. [ 266 ]. Copyright 2023, John Wiley and Sons. Fig. 32 Microenvironmental modulation modification strategies for catalysts in PEC OER and CO2RR. (a) Schematic diagram of the Co-Sil/CTF-BTh/Gd-Fe2O3 catalyst by modulating the microenvironment to improve the catalytic activity of the system. Calculated charge transfer rate constant (K ct) (b), surface recombination rate constant (K rec) (c) of different Photoanodes at different applied potentials. LSV curves (d), chronoamperometry curves (e), ABPE curves (f) and IPCE curves (g) of of different Photoanodes. Reprinted with permission from Ref. [ 273 ]. Copyright 2022, American Chemical Society. (h) SMA fabrication and CF x coating. (i) Total photocurrent and product distribution at –0.7 V. CO and H2 were sampled every 10 min. (j) Reaction stability was tested at a constant photocurrent of 15 mA cm–2. (k) Performance comparison of different photocathodes for PEC CO2RR. Reprinted with permission from Ref. [ 274 ]. Copyright 2024, American Chemical Society. Fig. 33 Reaction step analysis of PEC OER based on theoretical analysis. Chemisorption models (a) and corresponding Gibbs free energies of BiVO4 (b), MQD/BiVO4 (c) and MoO x /MQD/BiVO4 (d). Reprinted with permission from Ref. [ 139 ]. Copyright 2022, John Wiley and Sons. (e) Charge density difference of Co-agZIF-62/NiO/BiVO4. Gibbs free energies of NiO/BiVO4 (f), Zn-agZIF-62/NiO/BiVO4 (g) and Co-agZIF-62/NiO/BiVO4 (h). Reprinted with permission from Ref. [ 140 ]. Copyright 2023, John Wiley and Sons. Fig. 34 Reaction step analysis of PEC CO2RR based on theoretical analysis. Free energies of PEC OER steps for CdIn2S4 (a) and for V s-CdIn2S4 (b). (c) Density of states of Vs-CdIn2S4 at different bias voltages. (d) Trend of charge transfer of Vs-CdIn2S4 under light conditions, yellow areas represent electron accumulation. Reprinted with permission from Ref. [ 158 ]. Copyright 2020, Springer Nature. (e) Free energies of PEC OER reaction steps occurring on Pt-O or Pt-O-Fe active sites in SAs Pt: Fe2O3. Reprinted with permission from Ref. [ 142 ]. Copyright 2023, Springer Nature. Fig. 35 Reaction step analysis of PEC CO2RR based on theoretical analysis. Key steps in the photocatalytic reduction of CO2 to CH4 by VS-CuIn5S8 (a) and pure CuIn5S8 (b). Reprinted with permission from Ref. [ 285 ]. Copyright 2019, Springer Nature. (c) Transition orbital of T1 state under illumination. (d) Schematic representation of the excited states of porphyrin-Au. (e) Electron transfer pathways under light (left) and dark (right) conditions. Reprinted with permission from Ref. [ 225 ]. Copyright 2019, Springer Nature. Side view of the optimised structures after CO2 adsorption on Pt(111) (f) and Ti3O6H6/Pt(111) (g) surfaces. (h) Differential charge density after adsorption of CO2 at the Ti3O6H6/Pt(111) interface. (i) Gibbs free energy diagrams for the reduction of CO2 on the surfaces of Pt(111) and Ti3O6H6/Pt(111) at 0 V. Reprinted with permission from Ref. [ 221 ]. Copyright 2018, American Chemical Society. Fig. 36 Reaction step analysis of PEC CO2RR based on theoretical analysis. (a) Free energy for CO2RR to CO of different samples. (b) PDOS plots of surface catalytic Ag sites Reprinted with permission from Ref. [ 218 ]. Copyright 2022, American Chemical Society. (c) Mechanistic diagram of the possible occurrence of PEC CO2RR on Co-Bpy-COF-Ru1/2. (d) Free energy curves for the conversion of CO2 to CO occurring on the surface of Co-Bpy-COF-Ru1/2 under darkness and light. Reprinted with permission from Ref. [ 227 ]. Copyright 2023, John Wiley and Sons. Differential charge density for the Sn13O26/GaN(101–0) system (e) and the *CO/Sn13O26/GaN(101–0) system (f). (g) The energy barrier for PEC CO2RR to make HCOOH at the interface of GaN NWs and Sn NPs. Reprinted with permission from Ref. [ 14 ]. Copyright 2019, Royal Society of Chemistry. Fig. 37 Reaction step analysis of PEC OER and CO2RR based on COMSOL simulations. COMSOL simulations on c-TiO2 (a), a-TiO2 (b) and a-B-TiO2 (c) under the field of electric force poling. The orange arrow indicates the polarization direction of the sample from un-poled to poling to fully poled. Reprintedwith permission from Ref. [ 286 ]. Copyright 2023, Elsevier. Effect of the inverse opal structure on light absorption of io-CBO 200, io-CBO 400, and Planar-CBO at 550 nm (d–f) and 750 nm (g–i) simulated by the COMSOL software, and all average electric field intensities at different wavelengths at x = 1.6 μm are summed up in (j). (d,g) io-CBO 200, (e,h) io-CBO 400, and (f,i) Planar-CBO. Reprinted with permission from Ref. [ 287 ]. Copyright 2022, American Chemical Society. Fig. 38 Reaction step analysis of PEC OER based on machine learning. (a) The introduction of AI and machine learning in materials science. Reprinted with permission from Ref. [ 295 ]. Copyright 2021, John Wiley and Sons. (b) The schematic illustration of the machine learning guided dopant selection towards efficient PEC process. Reprinted with permission from Ref. [ 296 ]. Copyright 2022, John Wiley and Sons. Fig. 39 In-situ characterizations of PEC OER and PEC CO2RR. (a) Schematic of the device used for Operando PEC-ATR-FTIR. (b) In situ IR spectra of the BiVO4/electrolyte interface measured during photocharging (electrolyte is borate buffer). (c) Comparison of in situ IR spectra after photocharging in borate buffered electrolyte and ultrapure water. Reprinted with permission from Ref. [ 297 ]. Copyright 2021, American Chemical Society. (d) In situ Raman spectroscopy of Ag/Cu2O electrodes during PEC CO2RR. (e) SERS spectra for the CO stretching. (f) The relationship between CO frequency and potential for different variations of open-circuit voltage. (g) In situ Raman spectroscopy of Ag/Cu2O/pentanethiol electrodes during PEC CO2RR. Reprinted with permission from Ref. [ 298 ]. Copyright 2023, American Chemical Society. Fig. 40 In-situ characterizations of PEC OER and PEC CO2RR. (a) Operando UV-vis spectra of ZnFe2O4 at different potentials. Reprinted with permission from Ref. [ 299 ]. Copyright 2021, John Wiley and Sons. (b) In-situ FTIR spectra of NiFe/CA/Fe-BiVO4. Reprinted with permission from Ref. [ 300 ]. Copyright 2024, Elsevier. In situ ATR-FTIR spectra measured on different photoanode surfaces in [H2O] 8 mol L–1 (c) and [D2O] 8 mol L–1 (d) conditions. Reprinted with permission from Ref. [ 301 ]. Copyright 2023, American Chemical Society. Fig. 41 Photothermal catalysis. (a) Schematic representation of CoFe x catalysts synthesised at different temperatures. Reprinted with permission from Ref. [ 318 ]. Copyright 2018, John Wiley and Sons. (b) Designed interfacial photothermal catalytic esterification principle. Reprinted with permission from Ref. [ 319 ]. Copyright 2022, Springer Nature. (c) Schematic diagram of the recovery process of spent LCO and photothermal catalytic polyester recycling. Reprinted with permission from Ref. [ 320 ]. Copyright 2024, Springer Nature. (d) Catalysts prepared from ZnCoAl-LDH nanosheets at different temperatures and CO hydrogenation selectivity in different wavelength ranges. Reprinted with permission from Ref. [ 321 ]. Copyright 2018, John Wiley and Sons. Fig. 42 Strategies for biocatalyst development. Reprinted with permission from Ref. [ 332 ]. Copyright 2023, Science Publishing Group. Fig. 43 Photoenzymatic catalysis. (a) Strategies for biocatalyst development. Reprinted with permission from Ref. [ 350 ]. Copyright 2023, Springer Nature. (b) Synergistic photoredox and pyridoxal radical biocatalysis. (c) Diastereo- and enantioselective biocatalytic synthesis of ncAAs with up to three contiguous stereogenic centers. (d) Enantiodivergent synthesis of L- and D-amino acids using an orthogonal set of engineered PLP enzymes. Reprinted with permission from Ref. [ 351 ]. Copyright 2023, Science Publishing Group. (e) RAP-catalysed diastereo- and enantiodivergent decarboxylative radical cyclization. Reprinted with permission from Ref. [ 352 ]. Copyright 2024, Springer Nature. (f) Comparison of enantio-induction of excited-state reactions with that of ground-state reactions. Reprinted with permission from Ref. [ 353 ]. Copyright 2022, Springer Nature. Fig. 44 Industrialised applications and future development trends of PEC OER and PEC CO2RR. Scheme 1 Advantages and disadvantages of photocatalysis and electrocatalysis. Realization of PEC by avoiding the disadvantages and integrating the advantages. Scheme 2 Classification of PEC catalysts for OER. Table 1 Pathways of PEC OER (under alkaline conditions) [93–100]. Number Reaction 1 4OH− → O2 + 2H2O + 4e− 2 M + OH− → MOH + e− 3 MOH + OH− → MO + H2O + e− 4 MO + OH− → MOOH + e− 5 MOOH + OH− → M + O2 + H2O + e− Table 2 Half reactions of CO2 reduction for possible processes along with the corresponding standard redox potential (25 °C, 1 atmosphere of gases and 1 mol L‒1 solutes in aqueous solution) [173–185]. Number Reaction E θ/V (vs. SHE) 1 CO2 + e− → CO2 − –1.900 2 CO2 + 2H+ + 2e− → CO + H2O –0.530 3 CO2 + H2O + 2e− → CO + 2OH− –1.347 4 CO2 + 2H+ + 2e− → HCOOH –0.610 5 CO2 + H2O + 2e− → HCOO− + OH− –1.491 6 CO2 + 4H+ + 4e− → HCOH + H2O –0.480 7 CO2 + 3H2O + 4e− → HCOH + 4OH− –1.311 8 CO2 + 6H+ + 6e− → CH3OH + H2O –0.380 9 CO2 + 5H2O + 6e− →CH3OH + 6OH− –1.225 10 CO2 + 6H2O + 8e− → CH4 + 8OH− –1.072 11 2CO2 + 12H+ + 12e− → C2H4 + 4H2O –0.340 12 2CO2 + 8H2O + 12e− → C2H4 + 12OH− –1.177 13 2CO2 + 14H+ + 14e− → C2H6 + 4H2O –0.270 Table 3 Onset potentials, photocurrent densities, electrolytes, ABPE and IPCE values for different catalysts. Catalyst Onset potential (VRHE) J photo at 1.23 V (mA cm−2) Electrolyte ABPE (%) IPCE (%) Ref. b-BiVO4/TiO2–x — 6.12 1 mol L‒1 Na2SO3 2.5 94.7 [135–138] NiFeOOH/MoO x /MQD/BiVO4 — 5.85 pH9.3-KBi 2.43 90 [139] Co-agZIF-62/NiO/MO — 5.34 pH9.5-KBi 1.67 90.8 [140] SAs Pt: Fe2O3 0.627 3.65 1 mol L‒1 KOH 0.68 38 [142] CdS-CdSe/MoS2/NiFe-LDH 0.243 10 at 1.229 VRHE 1 mol L‒1 KOH — 40 [143] NiFeO x @Ge-PH/PSC 0.39 4.6 1 mol L‒1 NaOH — — [144] necked-Ta3N5 — 6.1 1 mol L‒1 NaOH — 50 [152] Ni(OH) x /Fh/Ta3N5 (P) 0.55 6.8 1 mol L‒1 NaOH 2.5 90–100 [153] NiCoFe-bi/gradient-Mg: Ta3N5/Nb 0.4 7 1 mol L‒1 KOH 3.25 ± 0.05 85 [154] Ta3N5-TF/GaN/Al2O3 0.75 10.8 1 mol L‒1 KOH 1.5 90 [155] NiFeO x /Ta3N5/GaN/Al2O3 0.65 6.3 0.2 mol L‒1 KPi 1.15 66 [156] Ba: Ta3N5-NRs 0.6 5.5 0.5 mol L‒1 KH2PO4 0.76 48 [157] Vs-CdIn2S4 0.14 2.49 0.25 mol L‒1 Na2S 5.73 60 [158] SnS2 — 4.5 0.1 mol L‒1 KI + 1 mol L‒1 H2SO4 — ~100 [159] CdS@CdIn2S4 NFA 0.49 5.5 0.25 mol L‒1 Na2S/0.35 mol L‒1 Na2SO3 0.45 — [160] TiO2/CdS/MoS2 –0.09 3.25 at 1.229 VRHE 0.35 mol L‒1 Na2SO3, 0.25 mol L‒1 Na2S — 45 [161] FTO/mZnO/BHJ 0.7 3 0.1 mol L‒1 NaBi — >25 [170] InN/PM6/NiFe LDH — 3.21 0.1 mol L‒1 KOH 0.66 — [172] BV/P3HT-CuPc/LDH 0.23 5.54 0.5 mol L‒1 Na2SO3 1.36 60 [174] InSe/Gr 0.42 >10 0.2 mol L‒1 NaOH — — [180] n-Si/TiO2/NiO x /pGr 1.13 ± 0.01 8.08 ± 1.0 1 mol L‒1 KOH — — [181] n-Si/TiO2/NiO x /SLG 1.03 ± 0.01 21.1±0.96 1 mol L‒1 KOH 1.0 — [182] Ov-BiVO4@ NiFe-MOFs — 5.3 ± 0.15 0.5 mol L‒1 KBi 1.62 72.9 [187] BiVO4/CoFe MOF 0.79 3.92 1 mol L‒1 KPi 1.09 89 [188] MIL(125)-NH2/TiO2 ~0.4 1.63 1 mol L‒1 NaOH — 84.4 [189] Table 4 Product selectivity and other performance parameters of different catalysts in PEC CO2RR. Catalyst Electrolyte Potential Main carbon product FE (%) Ref. Ag/Cu2O/ZS/FTO 0.1 mol L‒1 KHCO3 −1.2 V vs. Fc+/Fc C2H4 60 [94] Cu2O-Derived Cu electrode 0.1 mol L‒1 KHCO3 0.35 V vs. RHE CO 45 [208] Cu2O-Derived Cu-In electrode 0.1 mol L‒1 KHCO3 −0.6 V vs. RHE CO 85 [209] CuNPs/SiNWs 0.1 mol L‒1 KHCO3 −0.55 V vs. RHE C2H4 25 ± 6 [215] Cu3(BTC)2/Cu2O/ITO MeCN/TBAPF6 −1.97 V vs. Fc+/Fc CO 95 [216] Si|n-GaN|-NPhN-Ru(CP)2+ 2-RuCt 50 mmol L‒1 NaHCO3 −0.25 V vs. RHE Formate 64 [217] AgBr/GaN/Si 0.1 mol L‒1 KHCO3 −0.4 V vs. RHE CO >80 [218] Cu/GaN/Si 0.1 mol L‒1 KHCO3 −1.0 V vs. RHE Formate 20.7 [219] NiOOH/α-Fe2O3 1 mol L‒1 KOH 0.8 V vs. RHE Formate 85 [220] Pt-TiO2/GaN/n-p Si 0.5 mol L‒1 KHCO3 0.47 V vs. RHE CO 78 [221] a-Si/TiO2/Au 0.1 mol L‒1 KHCO3 0.4 V vs. RHE CO 40 [222] HNTM-Au-SA 0.1 mol L‒1 KHCO3 −0.9 V vs. RHE CO 94.2 [225] Si/rGO-Co 0.1 mol L‒1 KHCO3 −0.1 V vs. RHE CO 82.8 [227] Available online 10 July 2024 This work was supported by the National Natural Science Foundation of China (52373215), the Sichuan Science and Technology Program (2023NSFSC0086), and the Fundamental Research Funds for the Central Universities (YJ2021156). Review Recent advances of the catalysts for photoelectrocatalytic oxygen evolution and CO2 reduction reactions Hong-Rui Zhu Hui-Min Xu Chen-Jin Huang Zhi-Jie Zhang Qi-Ni Zhan Ting-Yu Shuai Gao-Ren Li * College of Materials Science and Engineering, Sichuan University, Chengdu 610065, Sichuan, China College of Materials Science and Engineering Sichuan University Chengdu Sichuan 610065 China College of Materials Science and Engineering, Sichuan University, Chengdu 610065, Sichuan, China * Corresponding author. Increasing global energy consumption and environmental pollution make the use of new energy sources and environmentally friendly technologies essential to meet the diverse needs of industries. Photoelectrocatalysis is a promising method of utilising solar and electrical energy for various catalytic reactions with significant environmental and energy saving benefits. And photoelectrocatalytic (PEC) oxygen evolution reaction (OER) and CO2 reduction reaction (CO2RR) are two catalytic reactions with great potential for energy and environmental applications. PEC OER is critical for renewable energy technologies for water oxidation and other related oxidation reactions. PEC CO2RR converts carbon dioxide into high-value products via a catalyst, enabling the rational use of carbon dioxide and the reduction of greenhouse gas emissions. Both technologies are efficient, environmentally friendly, and sustainable. However, further research and optimisation are needed to promote the industrial application of both technologies for energy conversion and environmental protection. This paper reviews the research progress of PEC CO2RR and OER catalysts in recent years, including detailed descriptions of catalyst types, reaction mechanisms and performance tests. Finally, the paper considers the future trends and prospects of PEC technology, providing new insights into the technology and research directions for PEC OER and CO2RR catalysts. Graphical Abstract Photoelectrocatalysis (PEC) technology combines the features of photocatalytic and electrocatalytic technologies. Under the synergistic effect of photoelectricity, an oxygen evolution reaction occurs at the photoanode, i.e. oxygen is produced by splitting water through light and electric energy. On the surface of the photocathode, a CO2 reduction reaction occurs, resulting in different and high value-added products. This paper focuses on the facilitating role of PEC technology in these two catalytic reactions and its prospects for industrial application and research value. Keywords Photoelectrocatalysis Catalyst design Catalyst fabrication Oxygen evolution reaction CO2 reduction reaction 1 Introduction Soil, air, water, and fire are the four basic substances that make up the world, and they are essential for the development of human society and the use of energy. Humans can mine coal, oil and other fuels from the soil to generate electricity, as well as utilise wind and tidal energy. Fire was the earliest source of energy and heat used by mankind, and in modern times it has become the medium for most energy conversion, for example, by burning fossil fuels to generate electricity. After entering the 21st century, electric energy in the world as a major source of energy, applied to all aspects of human social production. With the rapid development of science and technology, mankind has been able to generate electricity through various energy conversion to meet the growing demand. With more and more in-depth research on electric energy, catalysis using electric energy has been widely used in various fields, such as electrocatalytic decomposition of water, reduction of CO2, conversion of small molecules and organic compounds, fuel cells, etc. [ 1–10 ]. However, in addition to the above four substances, there is another kind of energy that has been used since the birth of human society, and the utilization rate still cannot be effectively improved until today, and this energy is solar energy. With the gradual development of science and technology, light energy has also been gradually valued [ 11–25 ]. In 1905, Albert Einstein successfully explained the photoelectric effect and won the Nobel Prize in Physics in 1921, which provides theoretical basis for the mechanism of photoelectrocatalytic reactions. In 1967, Akira Fujishima discovered that when titanium oxide single crystals in water were irradiated with ultraviolet lamps, the water was decomposed into oxygen and hydrogen, thus triggering research into photolysis of water. This discovery successfully pioneered research in the field of photocatalysis and laid the cornerstone for the use of solar energy in catalysis, accelerated the research and use of solar energy by researchers. Solar energy has two main advantages: (1) solar energy is the most widely used of all renewable energy sources (i.e., wind, hydroelectric, tidal and ocean currents, geothermal, biomass and solar); (2) other pollutants such as CO, CO2, sulfide, and other pollutants are not produced [ 26–45 ]. Photocatalytic reactions using solar energy have been studied for nearly 50 years [ 46 ]. It has the characteristics of energy saving, environmental protection, and can be applied in many fields [ 47–49 ], with a large potential for development [ 50–54 ]. It should be noted that electrical energy is always a secondary energy source, which always requires other energy transformations, whereas light energy is a primary energy source, which means that it can be utilised directly without the need for transformations in other media [ 55 ]. However, current photocatalysts have various drawbacks that limit their large-scale industrialisation. Firstly, most photocatalysts perform well under ultraviolet light, and their performance decreases significantly under visible light, which is not in line with the original intention of using natural light for catalytic reactions. The use of UV light in industrial production will increase the production cost and technical difficulty. Secondly, up to now, the reaction conditions and performance evaluation standards of photocatalysis still cannot reach unity, such as the solution type, pH value and catalyst dosage of the reaction system. Most importantly, the reaction efficiency of most photocatalysts needs to be improved, and the light absorption capacity and catalytic activity of photocatalysts are still not able to meet the demands of industrial production. Electrocatalytic technology has a larger reaction efficiency compared to photocatalysis and has been used in many industrial applications [ 56,57 ]. Therefore, in the use of electrical energy for effective catalytic reactions, the moderate use of light energy to reduce the consumption of electrical energy will become the mainstream tendency of energy use in the future [ 58 ]. Photoelectrocatalysis technology combines the advantages of photocatalytic and electrocatalytic technologies to maximize the use of light and electrical energy [ 59–70 ]. It has attracted a lot of attention due to wide application prospects, low cost of use and environmental friendliness [ 71–80 ]. Compared to photocatalysis, the photoelectrocatalytic (PEC) reactions use sunlight irradiation to generate photogenerated electrons at the photoelectric electrode, which enhances reaction activity and catalytic efficiency [ 81–85 ]. Compared to electrocatalysis, PEC reactions significantly reduce the need for external energy injection, resulting in reduced energy consumption and environmental pollution [ 86–99 ]. In addition, PEC allows the use of catalysts that are unsuitable for photocatalysis due to energy band structure mismatch, under suitable applied voltage conditions (Scheme 1 ) [ 100–102 ]. PEC reactions cover a variety of processes, including OER, organic pollutant degradation, carbon dioxide reduction and nitrogen reduction for ammonia synthesis, depending on the reactant and reaction type. Among the various catalytic reactions, PEC OER and PEC CO2RR have significant research value and promising prospects as they achieve the dual goals of energy conversion and carbon resource utilization by utilizing clean energy [ 103 ]. Key determinants that influence PEC reaction systems include their light adsorption capacity, charge transport and transfer characteristics, and the availability of surface-active sites [ 104 ]. Addressing these challenges necessitates the design of high-performance and stable systems [ 89,105–115 ]. PEC OER, driven by solar and electrical energy, is a catalytic reaction that oxidizes water to produce oxygen [ 5,72 ]. Compared to conventional electrochemical oxygen evolution reactions, photoelectrocatalytic OER offers several advantages. Firstly, it harnesses renewable solar energy as an energy source, mitigating the reliance on fossil fuels and the associated environmental concerns. Secondly, photoelectrocatalytic OER reduces the need for external electrical energy supply, thereby minimizing energy losses and electrode corrosion commonly observed in traditional electrochemical reactions. Typical photoanode catalysts, such as BiVO4, TiO2, and Fe2O3, have been extensively studied to enhance the performance of PEC OER and drive further research in this field [ 26,105 ]. These PEC catalysts all have several characteristics: (1) Excellent light absorption, especially for the visible light range. (2) High carrier separation efficiency, which will make the photogenerated holes efficiently enter the reaction system and thus enhance the catalytic activity. (3) Well conductivity, which is the basic condition for the good catalytic activity of the PEC OER. (4) Excellent adsorption of the reactive species. PEC CO2 Reduction Reaction (CO2RR) is a catalytic reaction driven using solar and electrical energy to convert carbon dioxide into CO or other high-value products [ 116,117 ]. The PEC CO2RR reaction offers several advantages. Firstly, it can utilize renewable solar energy as an energy source to achieve resourceful use of CO2 and reduce greenhouse gas emissions, thereby combating climate change [ 118,119 ]. Secondly, PEC CO2RR can effectively utilize clean energy while reducing electrical energy consumption during the catalytic process. Furthermore, PEC CO2RR allows for the selective synthesis of various high-value products by adjusting the catalyst's composition and structure, including formic acid, ethylene, ethanol, and acetic acid. Previous research has demonstrated that copper-based catalysts possess exceptional CO2 adsorption properties and stability, resulting in high CO2 conversion efficiencies. Moreover, metal nitrides and porphyrin-based materials have been extensively investigated in PEC CO2RR reactions. Like the catalysts used for PEC OER, catalysts with excellent PEC CO2RR activity need to have the advantages of high photogenerated electron-hole pair separation efficiency, excellent electrical conductivity, and good light absorption. The difference is that PEC CO2RR needs to have good adsorption of CO2 to have higher selectivity in the electrolyte. From the catalyst point of view, traditional catalysts often have the disadvantages of being expensive (e.g., using precious metals such as Au, Ag, Cu, Pt, Pd, etc.), complicated synthesis methods, and low reaction efficiency. This leads to high production costs and complex technological routes for the industrial application of conventional catalysts, which is not conducive to meeting the challenges of future developments. Catalysts for PEC OER and CO2RR are characterised by simple synthesis methods, environmental friendliness, high reaction efficiency, stability, and recyclability. This is one of the more striking aspects in today's catalytic industry. When the production cost of PEC catalysts is controlled, large-scale industrial applications can be realised. Previous reviews have reported only PEC OER or PEC CO2RR, and few reviews have reported both PEC OER and PEC CO2RR. We believe that in a photoelectrocatalytic system, the photoanode can undergo an oxidation reaction while the photocathode can undergo a reduction reaction, and if the cathode and anode can be utilised at the same time, it will greatly improve the efficiency of the cathode and anode utilisation in the PEC system. Therefore, PEC OER and PEC CO2RR, which are two reactions with industrial applications, were selected among many reactions for review. In the photoelectrocatalytic system, the photoelectric anode can be used for PEC OER and the photoelectric cathode can be used for PEC CO2RR, which can maximise the use of photoelectrocatalytic technology in industrial production to achieve energy saving and environmental protection. In conclusion, investigating PEC CO2RR and OER holds immense scientific significance and application. By delving into the intricacies of catalysts and catalytic mechanisms inherent in diverse materials, novel avenues can be unveiled to address the imperatives of sustainable energy generation and environmental conservation. This review comprehensively covers recent research progress on PEC CO2RR and OER mechanisms. Finally, this review envisions the future development trends and prospects of PEC technology. It provides a quick and accessible way to understand the technology and offers a reference point for the study of PEC OER and CO2RR. 2 Photoelectrocatalytic OER 2.1 Basic principles of PEC OER During the PEC OER reaction, light excites the active sites on the catalyst surface, reducing the overpotential at high current densities and making industrialisation possible [ 120,121 ]. The reaction that occurs is the same as OER under electrocatalytic conditions, but the solar energy injects additional energy into the reaction, which lowers the energy potential barrier required for the reaction and will reduce the amount of electrical energy required for the reaction and lower the overpotential (Table 1 ), where Eq. (1) is the total reaction process for OER, and Eqs. (2)–(5) are stepwise reactions of the OER reaction process. The PEC OER also follows a four-electron path, which is the same as the electrocatalytic OER. As shown in Scheme 2 , the adsorption of active species is particularly important for the PEC OER reaction. And during the adsorption of active species, different decision steps are shown for different reaction systems. Currently, there are many known methods that can change the adsorption energy of PEC systems for active species, such as doping other elements, creating vacancies, forming amorphous states, and creating heterojunctions. The core elements of these methods are: (1) altering the band gap of the catalyst to make it easier for photogenerated electrons to spill over the surface of the catalyst; (2) changing the electrical conductivity of the catalyst to accelerate the migration rate of photogenerated carriers; (3) altering the d/p band center of the main adsorption site, which will facilitate the adsorption of intermediates; (4) changing the light absorption capacity of the catalyst surface, some systems will be covered with a layer of dye-sensitised material on the surface, which will greatly enhance the light absorption capacity of the system. It should be noted that the PEC OER process, when the light can provide enough energy, the system can break through the decisive beam step limitation of the catalytic process, and even break through the theoretical overpotential under some electrolyte systems. It is since in the PEC OER process, the active species are not only OH–, but also ·OH, photogenerated holes h+, etc., and the synergistic effect of these active species accelerates the catalytic reaction and improves the efficiency of the reaction. 2.2 Catalyst design principles for PEC OER In fact, for the OER reaction, both photocatalytic and electrocatalytic techniques have been used to carry out a lot of research work on it. Especially for electrocatalytic OER, many related reactions have been industrialised. However, the electrocatalytic OER process is still deeply plagued by the complex four-electron step, which makes it very difficult to reduce the high overpotential in OER reactions. Therefore, breaking through the energy limitation of the four-electron step by combining other catalytic methods (e.g., light, heat, and enzyme) to reduce the overpotential is the future development direction for exploring electrocatalytic OER. In addition, the industrialisation of electrocatalytic OER requires a high current density, and the energy of this high current density requires a large amount of energy source supply, which is detrimental to the industrialization of the production cost, and increases the risk of environmental pollution, which is not in line with the concept of “green chemistry” [ 122,123 ]. In contrast, the reaction steps of the photocatalytic OER process are like those of electrocatalytic OER, except that the active species in it is ·OH. Meanwhile, the evaluation criteria for the performance of photocatalytic OER are different from those of electrocatalytic systems. Photocatalytic OER is based on the detection of the reaction system by gas chromatography, to calculate the concentration of oxygen evolution, while comparing the apparent quantum efficiency as the evaluation criterion of catalytic activity. During the reaction process, the sacrificial agent needs to be added to formulate a homogeneous solution used to absorb the photogenerated electrons to ensure that they do not interfere with the OER process, allowing the photogenerated holes to combine with H2O to produce more ·OH. Meanwhile, the recombination of photogenerated electron-hole pairs is hindered to improve the photocatalytic OER activity. However, the rate of photogenerated holes production is too slow under light conditions, resulting in ·OH concentrations that are far from sufficient for application in practical production. In summary, although photocatalytic OER will greatly reduce the pollution caused to the environment, however, due to the incomplete technical conditions, its industrial production still needs a lot of research work to overcome the technical drawbacks of photocatalytic OER. In view of this, photoelectrocatalytic technology, which combines the advantages and overcomes the disadvantages of photocatalysis and electrocatalysis, has emerged. The purpose of using PEC technology is to be able to effectively reduce the consumption of electrical energy and reduce the energy consumption required for catalytic reactions [ 124,125 ]. Meanwhile, minimize the scale of use of fossil fuels in industrial production, thereby reducing the pollution caused to the environment. Therefore, the selection of materials with good photosensitivity and electrocatalytic activity at the same time became the focus of PEC OER. First, choosing materials with good photosensitivity helps to generate more photogenerated electrons, which improves the reaction activity and catalytic efficiency. However, materials with excellent photosensitivity and electrocatalytic activity are not common, so it is necessary to modify the materials to have excellent PEC OER performance. Examples include doping with other elements, creating vacancies or other defects, and compounding with other materials to form heterojunctions [ 71,126,127 ]. 2.3 Synthesis methods of catalysts for PEC OER The common synthesis methods of catalysts used for PEC OER are: impregnation, spin-coating, calcination sedimentation, and hydrothermal, etc. The impregnation method involves the impregnation of liquids containing active substances into various types of carriers. After the impregnation equilibrium is reached, the excess liquid is removed, and the target catalysts are finally obtained after subsequent treatments such as drying. Spin-coating is a widely used technique for preparing catalysts on substrates (FTO glass mainly). The principle is to drop a solution containing materials and solvents onto a rotating substrate and use the combined effect of centrifugal force and surface tension to make the solution synthesise catalysts on the substrate. Calcination is a heat treatment process, often occurring in tube furnaces or other apparatus where high temperature reactions can take place, which can be used to synthesise catalysts or change their structure and properties. Deposition methods refer to techniques used to deposit or coat catalyst materials onto a substrate or support material. These methods are crucial in creating catalysts with specific properties tailored for desired reactions. Deposition methods mainly include chemical vapour deposition, atomic layer deposition, electrodeposition, photodeposition, etc. Hydrothermal method mainly occurs in a sealed reactor, using water or other liquid reagents as solvents to synthesise catalysts under high temperature and pressure, the catalysts synthesised are often in powder form, and some catalysts on substrates are also synthesised by hydrothermal method. 2.4 Configuration of PEC OER In typical PEC water oxidation cell, there exist single electrolyzer and double electrolyzer. The common reaction system is a three-electrode system in which the working electrode is a photoanode, and common photoanode materials include hydroxyl oxide, BiVO4, α-Fe2O3, etc. While Pt electrode or graphite electrode is used as counter electrode in single electrolyzer, other photocathode materials are used as counter electrode in double electrolyzer. The reference electrode is commonly Hg/HgO or Ag/AgCl [ 85 ]. 2.5 Evaluate the parameters of PEC OER performance The common measurement methods in PEC OER studies include linear sweep voltammetry (LSV), chronoamperometry (i-t), or chrono-potentiometry (v-t) under dark or irradiated conditions, etc. Key parameters performance of PEC OER photoanodes include current density (j ph), overpotentials at different current densities, Tafel slope, impedance values, etc. In addition, the following parameters are used as important evaluation criteria, and we have also listed the relevant calculation formulas. STH efficiency is one of the important parameters commonly used to evaluate the performance of PEC OER. STH defines the overall solar conversion efficiency of a zero/self-biased two-electrode PEC OER cell and is commonly used as a benchmark for evaluating the performance of PEC OER cells. The definition of STH efficiency for PEC OER as shown in Eq. (1) [ 85 ]: (1) S T H = [ | J s c | × 1.23 ( V ) × ϕ F p ] A M 1.5 G where J sc (mA cm–2) is photocurrent density of the PEC OER, Ø F is the Faraday efficiency of electrochemical H2 evolution, and P (mW cm–2) is the incident light power density. The conversion efficiency of the photoelectrode is usually expressed thermodynamically using the applied bias photon current conversion efficiency (ABPE) (Eq. (2)) [ 85 ]. (2) A B P E = [ | J l i g h t | × ( 1.23 - V l i g h t ) p ] A M 1.5 G where J light is the measured photocurrent density and V light (vs. RHE) is the applied bias at this current density. Recently, the solar-to-chemical conversion efficiency (ISTC) of the photovoltaic electrode was presented by extracting (Eq. (3)) from the LSV results [ 85 ]. (3) I S T C = 1.23 ( V R H E ) × ϕ F V d a r k ( V R H E ) [ J p h o t o × V p h o t o p ] A M 1.5 G where Ø F is the Faradic efficiency of the electrochemical reaction assumed to be 100%, J photo (mA cm–2) = J light – J dark is the difference between light and dark photocurrent density, V dark is the applied voltage to attain the dark current density equals J photo, V photo (V) = V light – V dark is the photovoltage at a certain value of J photo, and P (mW cm–2) is the power density of the incident light. 2.6 Classification of PEC catalysts suitable for OER In the following, we will describe the classification of common materials used for PEC OER. Analyzed in terms of structural composition, common PEC OER catalysts can be classified into six types: oxides, nitrides, sulfide, polymers, carbon-based and MOF catalysts (Fig. 1 ) [ 73,86,128,129 ]. 2.6.1 Metal oxide catalysts The excellent photocatalytic and electrocatalytic properties of oxide materials and the existence of bandgap tunability make it possible to adjust the bandgap on the surface of inorganic materials by doping, forming defects, and synthesizing various kinds of heterojunctions, making it easier for electrons to jump from valence to conduction bands, thus enhancing the overall performance. Common oxide materials for PEC OER include TiO2, hydroxyl oxides, BiVO4, α-Fe2O3, etc. [ 35,130–134 ]. BiVO4, as an n-type photocatalyst, has excellent hole conductivity. The band gap of BiVO4 is ≈2.4 eV and absorbs light below 520 nm, resulting in a theoretical photocurrent density of ≈7.5 mA cm–2. The hole diffusion length of BiVO4, determined by time-resolved microwave conductivity (TRMC) analysis, is calculated to be 70 nm. It shows better hole conductivity compared to Fe2O3 (2–5 nm) but is shorter than WO3 (150–500 nm). BiVO4 is stable during water oxidation, does not undergo self-oxidation, and exhibits moderate stability in a neutral environment with pH range of 3–10 [ 135–138 ]. Song et al. [ 139 ] synthesized NiFeOOH/MoO x /MQD/BiVO4 photoanodes for PEC OER. The addition of MoO x /MQD as a hole transport layer slows down the charge complexation, promotes hole transport, accelerates the water splitting kinetics, and significantly improves the water oxidation activity of the PEC (Fig. 2(a) ). Fig. 2(b) shows that the NiFeOOH/MoO x /MQD/ BiVO4 photoanode has the highest photocurrent density among all the samples. Notably, the photocurrent densities of NiFeOOH/MoO x /MQD/BiVO4 photoanodes reached 3.82, 4.68, and 5.85 mA cm–2 at 0.6, 0.8, and 1.23 V vs. RHE, respectively (Figs. 2(b) and 2(c)) suggesting that the MoO x /MQD and NiFeOOH layers have a strong influence on porous. The ABPE of the prepared NiFeOOH/MoO x /MQD/BiVO4 photoanode reached recorded value of 2.43% at 0.58 V vs. RHE, higher than that of the previously reported photoanode (Figs. 2(d) and 2(e)). Figs. 2(f) and 2(g) show the carrier transfer process of the composites during the PEC OER process. The composites with co-catalysts have better performance since they could greatly accelerate the carrier transfer rate. Song and coworkers [ 140 ] constructed integrated Co-agZIF-62/NiO/MO photoanodes on semiconductor substrates with different metal oxides (MO: Fe2O3, WO3 and BiVO4). Co-based zeolite imidazolium salt skeleton, Co-ZIF-62, was synthesized using mechanochemical methods (Fig. 2(h)). The photocurrent density of the 10% Co-agZIF-62/BiVO4 photoanode was found to be the highest based on LSV curves (Fig. 2(i)). The appearance of a very small dark current in the chopped LSV curve suggests that the oxidative photocurrent is generated by migration of photogenerated electrons at the surface of the catalyst. (Fig. 2(j)). At 0.74 V vs. RHE, the Co-agZIF-62/NiO/BiVO4 photoanode achieved maximum ABPE up to 1.67% (Fig. 2(k)). Additionally, the IPCE value of BiVO4 loaded with Co-agZIF-62 showed a significant increase across the entire wavelength range, with IPCE values as high as 90.8% observed at 440 nm (Fig. 2(l)). At the same time, a possible explanation for this phenomenon was proposed, i.e., the acceleration of charge transfer after the introduction of NiO as a hole transport layer in the PEC system (Figs. 2(m) and (n)), the performance of the Co-agZIF-62/NiO/MO photoanode was significantly improved. α-Fe2O3 is a common catalysts used solar cell with a photoelectric conversion efficiency of up to 15.5%, which is currently a hot research topic both domestically and internationally. Ismail et al. [ 141 ] studied the interfacial reaction of α-Fe2O3/NiFeOOH using X-ray adsorption spectroscopy technology. The photoelectrochemical cell is arranged so that the incoming beam and emitted fluorescence enter and exit through the sample and silicon nitride window at an angle of approximately 45 degrees from the rear surface (Fig. 3(a) ). Fig. 3(b) shows that as the thickness of the film increases, the intensity of charge transfer waves increases, resulting in an increase in current density and a decrease in OER overpotential. Under 1.2 VRHE conditions, the gradient effect was further enhanced, causing many holes in FeOOH to aggregate and store, with only a very small number of holes escaping to NiFeOOH, resulting in a small photocurrent (Fig. 3(c)). Gao and coworkers introduced single platinum atom sites ligated with oxygen atom (Pt-O/Pt-O-Fe) sites into single-crystal α-Fe2O3 nanoflake photoanodes (SAs Pt: Fe2O3-Ov) [ 142 ]. The SAs Pt: Fe2O3 photoanode synthesis process is shown in Fig. 3(d). SEM images as shown in Fig. 3(e). The photocatalytic activity of the optimized SAs Pt: Fe2O3 Ov photoanode reached 3.65 and 5.30 mA cm–2 at 1.23 and 1.5 VRHE, and the polarization current conversion efficiency of Fe2O3 based photoanode reached 0.68% (Fig. 3(f)). By modifying SAs Pt: FeOV, its photoelectrochemical catalytic activity was significantly enhanced, with an APBEmax of 0.68% (Fig. 3(g)). For PEC OER NiFe layered double hydroxide has been reported in research work [ 143 ]. The prepared photoelectrode requires only a low potential of 1.001 V vs. RHE, compared to the photocurrent density of 10 mA cm–2 for the reversible hydrogen electrode, which is 228 mV lower than the theoretical water splitting potential (1.229 vs. RHE). Fig. 4(a) illustrates the synthesis process for the preparation of photoanode catalysts. The EDS image of TQ-NiFe in Fig. 4(b) confirms that all the elements are fully present on the surface of the material. As illustrated in Figs. 4(c) and (d), the current density of TQ-NiFe reached 10 mA cm–2 under light, which is lower than the theoretical potential (1.23 V vs. RHE). In addition, the Tafel slope of the TQ-NiFe catalyst was significantly reduced under light conditions, indicating that light can promote the catalytic activity of the catalyst (Fig. 4(e)). Fig. 4(f) illustrates the E a of TQ-NiFe extracted in the light is about 32.5 kJ mol–1, which is much lower than that of the dark reaction (79.9 kJ mol–1) and comparable to that of the noble metal catalyst (30.8 kJ mol–1). Yoon et al. [ 144 ] investigated the effect of Sn migration in germanium tin co doping system on its overall photovoltaic characteristics using Ge. The synthesis of pristine α-Fe2O3 and Ge-doped Fe2O3 (Ge-H) photoanodes is shown in Fig. 4(g). Fig. 4(h) shows the LSV curves in different solutions. The charge separation efficiency can be calculated based on the results of Fig. 4(h), and it indicates that the charge transfer efficiency of Ge-PH is the highest among all the samples (Fig. 4(i)). In addition, the formation energies of Sn-doped Fe2O3, Ge-doped Fe2O3 and Ge:Sn co-doped Fe2O3 were calculated as shown in Fig. 4(j). Fig. 4(k) indicates that Ge:Sn co-doped hematite undergoes greater symmetry breaking upon reorientation of the iron atoms, whereas the substitutional doping of a single Ge shows no distortion in atomic alignment. Fig. 4(l) illustrates the free energies calculated for every basic step, and the results demonstrate that an overpotential of 1.007 eV is obtained for undoped hematite, which is in general agreement with the theoretical results. In conclusion, metal oxides have great potential as photoelectrocatalytic materials for energy transition and environmental protection. By rationally designing the energy band structure and surface properties of the materials, metal oxides can achieve efficient light adsorption and photogenerated charge separation, promoting the photoelectrocatalytic reaction. Furthermore, the catalytic activity and selectivity of metal oxides can be further enhanced by introducing co-catalysts and optimizing carrier transport pathways. With further research and engineering improvements, metal oxides are expected to become commercially viable and sustainable for practical applications in renewable energy and green chemistry. 2.6.2 Metal nitrides catalysts Metal Nitrides are widely used in PEC because of their high photoelectric properties, and common nitrides are GaN, Ta3N5, etc. The diffusion length of Ta3N5 is ∼103 nm, indicating a long lifetime of photogenerated charges. In addition, Ta3N5 possesses excellent photocatalytic activity, suggesting that photogenerated carriers can be efficiently separated in Ta3N5 crystals. In addition, the excellent light adsorption ability of Ta3N5 has led to its extensive study, with solar energy conversion efficiencies of up to 15% under AM 1.5 G sunlight [ 121,145–151 ]. Li's group fabricated particulate Ta3N5 photoanodes using a bottom-up approach [ 152 ]. The top view of the SEM image shows that after treatment with TaCl5 solution (Fig. 5(b) ), the surface of the porous material Ta3N5 (Fig. 5(a)) is covered by an amorphous layer. However, after neck contraction, the photoelectrochemical properties of these samples vary greatly (Fig. 5(c)). The results indicate that both untreated Ta3N5 and TaCl5 exhibit smaller photoelectric properties. But on necked Ta3N5, its optical current increases from 9 to 1.56 mA cm–2. Adding CoPi and other co-catalysts to necked Ta3N5 can significantly improve its catalytic performance, with an optimal current of 6.1 mA cm–2 (vs. RHE). Liu and coworkers [ 153 ] demonstrated an efficient photoanode system Ni(OH) x /Fh/Ta3N5(P). Compared with RHE, the Ta3N5 photoanode performance of this device reaches 12.1 mA cm–2 under 1.23 V conditions, which has reached the theoretical upper limit of photocurrent under solar irradiation (12.9 mA cm–2). Fig. 5(e) and f are HRTEM images of Ta3N5 and Ta3N5 (P) photoanodes. The prepared nickel hydroxide/tantalum fluoride (P) is an ideal optoelectronic active material, and its current to potential curve is shown in Fig. 5(g). The synthesized Ni(OH) x /Fh/Ta3N5(P) has the best photovoltaic performance (Fig. 5(g)). The onset potential of the photocurrent of Ni(OH) x /Fh/Ta3N5 (P) was around 0.55 V and up to 6.8 mA cm–2 at 1.23 V. The method of integrating the Ta3N5 (P) photoanode system is shown in Fig. 5(h). In the range of 0.6–1.0 V, the photocurrent rapidly increases, ultimately obtaining a photocurrent of 12.1 mA cm–2 (Fig. 5(i)), which is close to the maximum performance of Ta3N5 under sunlight (12.9 mA cm–2). Xiao et al. [ 154 ] used gradient doped magnesium for energy band structure engineering and defect control in Ta3N5. The gradient-doped Mg-based Ta3N5 photoanode has a low metal potential of 0.4 V and a high applied bias photon current efficiency of 3.25 ± 0.05% vs. RHE. The HRTEM image in Fig. 6(a) shows that the lattice fringes of Ta3N5 do not change significantly after doping, and the clear lattice fringes in Fig. 6(b) indicate that the internal crystallinity of the grains is highly desirable. Fig. 6(c) indicates that the onset potential moves towards the cathode as the concentration of Mg doping gradually increases. The increase in the photocurrent density of Mg: Ta3N5 is not significant, but there is a significant increase in the filling factor of the J-V curve. Fig. 6(d) shows the wavelength dependence of NiCoFe-Bi/gradient-Mg: Ta3N5/Nb IPCE values measured at 1.0 V VRHE. NiCoFe-Bi/gradient-Mg:Ta3N5/Nb reaches a maximum ABPE of 3.31% (Fig. 6(e)). Hybrid Ta3N5 nanorods and films on transparent GaN/Al2O3 substrates were developed by Pihosh and coworkers [ 155 ]. The synthesized photoanodes achieved a current density of 10.8 mA cm–2 at a voltage of 1.23 V compared to reversible hydrogen electrodes under simulated AM 1.5G solar illumination. The SEM and HAADF-STEM images in Fig. 6(f) and (g) indicate the formation of Ta3N5-NR on Ta3N5-TF/GaN/Al2O3 substrate. The prepared samples were loaded with FeNiCoO x catalysts by photoelectrodeposition (PED) and dip-coating methods, and the surfaces of Ta3N5-NRs were covered with a layer of FeNiCoO x cocooning catalyst (Fig. 6(h)). Fig. 6(i) shows the schematic design of Ta3N5 photoanode and PEC-PV tandem devices in three-electrode and two-electrode configurations. The current potential (J-V a) characteristics of the Ta3N5 photoanode on optically and electrically optimised 150 nm thick Ta3N5-tf (Fig. 6(j)) indicate that the onset potential Von for water oxidation is 0.75 VRHE (corresponding to J = 0.8 mA cm–2). Above V on, J rises sharply with increasing Va, reaching 10.5 mA cm–2 at 1.23 VRHE. Fig. 6(k) illustrates that the average STH energy conversion efficiency for hydrogen and oxygen (stoichiometric ratio of 2:1) was 11.07% for nearly 7 h. Higashi and coworkers [ 156 ] synthesised transparent Ta3N5 on n-type GaN/sapphire substrates to improve PEC OER performance. As illustrated in Fig. 7(a) , the resulting film is reddish in color and highly transparent. Fig. 7(b) illustrates SEM images of a Ta3N5/GaN/Al2O3 film, indicating that the film has a nanocrystalline structure consisting of several hundred nanometer-sized Ta3N5 crystals. Fig. 7(c) shows the current-potential (i-E) curves of NiFeO x /Ta3N5/GaN/Al2O3 transparent photoanodes, indicating that the initial potential is about 0.65 V. Fig. 7(d) shows the half-cell solar-hydrogen conversion efficiency (HC-STH) curves for NiFeO x /Ta3N5/GaN/Al2O3 photoanodes, indicating that the maximum value of HC-STH was 1.15% at 0.94 V vs. RHE. Fig. 7(e) indicates that the photoanode produces a photocurrent at 600 nm, proving that the wavelength of the absorption edge of Ta3N5 is 600 nm. At a wavelength of 420 nm and a voltage of 1.2 V vs. RHE, the IPCE value was 66%, while at wavelengths of 500 and 580 nm, the IPCE values were 48% and 14%, respectively. It has been reported that the current-potential characteristics of Ta3N5-NR photoanodes have been evaluated by developing a detailed photovoltaic modeling [ 157 ]. The XRD spectra indicate that the diffraction peaks of both Ta3N5-NRs and Ba: Ta3N5-NRs samples are associated with monoclinic Ta3N5 (Fig. 7(g)). The SEM images in Figs. 7(h)–(k) show that the vertical alignment of Ta3N5 NR photoanodes remains unchanged after doping with Ba. The current-potential (J-V) curves obtained under chopped AM 1.5G simulated solar radiation show that the photocurrent density at 1.23 VRHE (J a) increases by 72% from 3.2 to 5.5 mA cm–2 after doping barium elements in Ta3N5-NRs photoanodes. However, the onset potential (V ON) at 0.6 VRHE was unchanged, and the fill factor (FF) decreased slightly from 30% to 23% (Fig. 7(l)). Fig. 7(m) shows that barium doping in Ta3N5-NRs photoanodes increases the value by 31%, thereby increasing the maximum HC-STH efficiency η max from 0.58% to 0.76%. Fig. 7(n) illustrates that the Ba:Ta3N5-NRs photoanode has a relatively high IPCE value of 40%–48% in the 550 nm wavelength range compared to the Ta3N5-NRs photoanode. Fig. 7(o) shows that the barium-doped sample exhibits a lower solar energy loss in OER activity at 1.23 VRHE compared to the undoped material. Metal nitrides have excellent light-absorbing properties and electron-transporting ability, which can efficiently absorb light energy and achieve photogenerated charge separation. In addition, the stability and catalytic activity of metal nitrides make them ideal photoelectrocatalytic materials with a large future. 2.6.3 Metal sulfide catalysts Sulfide materials have tunable properties that may enable abundant catalytic active sites for light adsorption, charge transfer and solar-chemical energy conversion. Wang and coworkers developed a three-dimensional plate geometry ternary metal sulfide (CdIn2S4) [ 158 ]. Fig. 8(a) presents schematic diagram of the synthesis process of CdIn2S4 with S defects. The SEM images of Vs-CIS-500 are shown in Fig. 8(b), and its geometry is plate-like. The J-V plot shows that at 1.23 V vs. RHE, the photocurrent density of Vs-CIS-500 reaches 6 times that of pure CdIn2S4 (Fig. 8(c)). Vs-CIS-500 shows extremely high photon adsorption values (Fig. 8(d)), reaching a maximum ABPE of 2.49% at 0.477 V vs. RHE. The IPCE value of the CdIn2S4 photoanode is significantly increased in the light range of 350–500 nm, and the light that produces a measurable photovoltage is truncated between 525–550 nm, while the Vs-CIS-500 photoanode extends up to ~650 nm (Fig. 8(e)). Giri's group [ 159 ] synthesized vertically aligned SnS2 nanoflakes with good catalytic activity directly on transparent conducting substrates using a callable space sublimation (CSS) method. The synthesized materials have different dss at different temperatures, only the sample with source-substrate separation (dss) = 10 and the best catalytic activity is shown here with SEM image as shown in Fig. 8(f). The PEC performance was measured by LSV in different electrolytes for comparison (Fig. 8(g)). Under AM1.5G light conditions at 1.23 VRHE, maximum photocurrents of 4.5 mA cm–2 were generated in phosphate buffer + 1 mol L–1 Na2SO3 and 2.6 mA cm–2 in 0.5 mol L–1 Na2SO4 without the use of Na2SO3 hole scavengers. The IPCE (Fig. 8(h)) measured in the light of 0.1 mol L–1 KI + 1 mol L–1 H2SO4 at a fixed voltage of 0.6 VRHE shows that the optimized SnS2 nanosheets have an excellent ability to absorb and generate photocurrents. Du's group [ 160 ] demonstrated that CdIn2S4 can improve the stability and uniform photocurrent of CdS photoelectrodes. Specifically, an architecture consisting of CdS nanosheet arrays (nfa) and CdIn2S4 coatings (CdS@CdIn2S4 NFA) was designed to overcome corrosion and enhance photocurrent. The result indicates that the photocurrent and durability are improved by about 4 and 10 times, respectively (Fig. 9(a) ). SEM images indicate that the prepared CdS NFA grew uniformly and directly contacted with the conducting glass substrate, and the product maintained an intact nfa morphology after cation exchange at 500 °C (Fig. 9(b)) and remained in close contact with the substrate (Fig. 9(c)). As indicated in Fig. 9(d), the photocurrent of CdS@CdIn2S4 NFA at 1 V vs. RHE reaches 5.5 mA cm–2, which is nearly twice as high as that of CdS NFA (2.7 mA cm–2) for both samples under 1 Sun AM1.5G illumination. The estimated photoelectric conversion efficiency is shown in Fig. 9(e). TiO2/CdS/MoS2 heterojunctions were prepared by Bhat et al. [ 161 ]. Fig. 9(f) illustrates schematic representation of the synthesized composites. Figs. 9(g) and (h) demonstrate SEM images of TiO2 NRs on FTO. Fig. 9(i) shows LSV of different samples under chopper illumination. The photocurrents of TiO2 and TiO2/CdS are 1.01 and 1.95 mA cm–2, respectively. And the maximum photocurrent density of TiO2/CdS/MoS2 at 0.9 V vs. RHE (0 V vs. Ag/AgCl) is 3.45 mA cm–2. The photocorrosion of CdS was inhibited by plating a thin layer of ZnS on TiO2/CdS/MoS2. The TiO2/CdS/MoS2 photoanode in Fig. 9(j) still maintains a good stability of the photocurrent density (0.2 mA cm–2) during the first 60 min. It is noteworthy that the IPCE spectra agree with the corresponding absorbance spectra (Figs. 9(k) and (l)). Metal sulfides possess good light-absorbing ability, capable of absorbing visible and near-infrared light. In addition, metal sulfides have good electron transport properties, which can effectively separate photo-excited electrons and holes, thus realizing efficient photogenerated charge separation. It means that sulfides have a broad research prospect in the field of PEC OER in the future. 2.6.4 Polymer-based catalysts Polymer materials are the class of organic materials with photovoltaic activity, which are widely used in the fields of organic light-emitting diodes (OLEDs), organic transistors (OFETs), organic solar cells (OPVs), and new energy devices. The low cost of synthesizing polymer materials makes them attractive for functional and structural modification, as well as for their flexibility and film-forming properties. This has led to their use in the preparation of flexible and stretchable photovoltaic devices, which has caught the attention of researchers [ 20,140,162–169 ]. Cho and coworkers report a non-fullerene electron acceptor (NFA)-based, all-polymer BHJ photoanode (FTO/mZnO/BHJ/ PTAA/LIO) for PEC OER [ 170 ]. The molecular structures of the selected PDs and polymer receptors (PAs) are presented in Fig. 10(a) , and their energy level distributions are illustrated in Fig. 10(b). To improve the stability of the system, a mesoporous zinc oxide (mZnO) layer was added to the ETL structure (Fig. 10(c)). The LSV curve in Fig. 10(d) indicates that FTO/pZnO/BHJ has a sacrificial Jph of 3.5 mA cm–2 at 1.23 VRHE, with a negative shift in the onset potential to 0.35 VRHE. The IPCE spectral values measured at 1.23 VRHE exceeded 25% and were in good agreement with the BHJ adsorption spectra (Fig. 10(e)). More importantly, the PTAA layer greatly improves the operational stability (Fig. 10(f)). Sokol et al. [ 171 ] reported for PEC OER an unbiased semi-artificial tandem composite catalyst that connects photosystem II to hydrogenase. SEM images indicate that the TiO2 macropores have a diameter of 750 nm (Fig. 11(a) left). The components of the synthesized photoanode are shown in Fig. 11(a) right. The adsorption spectra of the co-sensitized IO-TiO2 electrodes show adsorption of panchromatic light (Fig. 11(b)). The synthesized photoanodes were dye-sensitized by soaking IO-TiO2 in tetrahydrofuran (THF) solution overnight (Fig. 11(c)). The step-potential timer was used under UV-filtered simulated sunlight (Fig. 11(d)) with periodic illumination. The current onset potential was about –0.5 V vs. SHE. A potential-independent photocurrent (80 μA cm–2) appeared when E app > –0.2 V vs. SHE (Fig. 11(e)), which was attributed to water oxidation. Conjugated organic polymers such as PM6 can also be used as photocatalysts, and their favorable light adsorption effect provides excellent results when performing PEC OER [ 172 ]. As illustrated in Fig. 12(a) , the PM6 film is wrapped around the surface of the InN NRs to form a core-shell structure, and a part of PM6 is loaded on the top of the NRs to accelerate the photogenerated electron migration rate. Fig. 12(b) illustrates the XRD spectrum of the InN nanorods. The results indicated that PM6 has obvious amorphous structure and does not appear obvious, and the loading of PM6 film did not affect the InN crystal structure. Meanwhile, the FTIR spectrum of PM6 also illustrates the characteristic peak of C (Fig. 12(c)) [ 173 ]. The LSV curves in Fig. 12(d) demonstrate that the modified InN/PM6 photocurrent density is 3.21 mA cm–2 at the same potential, which is 26 times higher than the photocurrent density of pure InN nanorods. Fig. 12(e) displays the optimal ABPE value of 0.66% for InN/PM6 photoanodes at 0.74 V compared to Ag/AgCl, which is a 15-fold increase compared to pristine InN. Whereas the NiFe LDH co-catalyst loaded composites showed 8.97% ABPE value at 0.78 V. In addition, the InN/PM6/NiFe LDH has the lowest impedance, indicating the most efficient charge transfer (Fig. 12(f)). Peng et al. [ 174 ] used p-type polyhexylthiophene (P3HT) as a hole-transporting layer (HTL) to enhance the photoelectrocatalytic activity of the material. The BiVO4/P3HT-CuPc/LDH photocurrent density reached 5.54 mA cm–2 at 1.23 VRHE due to the modulation of HTL. This work introduced doped P3HT as HTL into nico layered double hydroxide (LDH)-modified BiVO4 (BV) films to prepare BV/P3HT-cupc/LDH photoanodes, which were synthesized as shown in Fig. 12(g). The photocurrent densities of BV/LDH and BV/P3HT/LDH modified with NiCo-LDH were 1.75 and 2.28 times higher than those of BV under light conditions, which is a large improvement (Fig. 12(h)). When reacting in Na2SO3 solution (Fig. 12(i)), the BV/P3HT/LDH and BV/P3HT-cupc /LDH photocurrents were significantly better than those of the pristine BV or BV/LDH, which fully reflected the effect of the modification of P3HT HTL. Both IPCE (Fig. 12(j)) and ABPE (Fig. 12(k)) of BV/P3HT-CuPc/LDH were remarkably strengthened with respect to BV/P3HT/LDH. The ABPEmax of BV/P3HT-CuPc/LDH at 0.65 V was 1.36%, which was shifted negatively by 0.02 V with respect to BV/P3HT/LDH (Fig. 12(j)). In conclusion, polymer-based catalysts are of high research value. Firstly, polymer catalysts have a wide range of light-absorbing ability and a wide range of applications. Some polymer catalysts exhibit stability and corrosion resistance, making them suitable for use in harsh conditions. Additionally, certain polymer catalysts are renewable and degradable, thereby reducing their impact on the environment. 2.6.5 Carbon-based catalysts Carbon-based materials, mainly graphene, are flexible and highly conductive. It is commonly used as a substrate for synthesizing composite materials or wrapping other catalysts to form heterojunctions [ 175–178 ]. Yan and coworkers [ 179 ] utilized naphthalene to synthesize undoped or doped heteroatom GQDs in a bottom-up manner (Fig. 13(a) ). Their method effectively reduced the production cost (Fig. 13(b)), with a lattice spacing of 0.21 nm (Fig. 13(c)). Fig. 13(d) displays the current response of the NS-GQD/graphene electrode during PEC OER under solar energy. The HER performance and OER performance of the photoelectrochemical process are significantly higher than that of the pure electrochemical process. When ethanol containing 0.1 mol L–1 KOH was used as the reaction solution, the photocurrent response that appeared at the cathode was due to the action of photoexcited electrons only and was not related to the HER (Fig. 13(e)). By reducing the Schottky barrier, the photogenerated electron hole migration from nanocrystalline GQDs to graphene results in a significant exponential increase in the photoelectrochemical luminescence current of the anode electrode (Fig. 13(f)). As illustrated in Fig. 13(g), the properties of the synthesised photoanodes HER and OER remained extremely stable after 20 h. Zheng et al. [ 180 ] reported a photoanode made of a single-layer InSe crystal encapsulated by a single layer of graphene. Photocurrent with a density of 10 mA cm–2 at 1.23 VRHE was achieved. The synthesis principle is shown in Fig. 13(h). As illustrated in Fig. 13(i), the calculated chemical potential of InSe/Gr is 4.6 eV (with respect to vacuum), which is considerably higher than OER efficiency of –4.9 eV at pH = 13. Moreover, the InSe/Gr heterogeneous structure allows OH– aggregation on the anode surface, with a calculated adsorption energy of –0.74 eV (Fig. 13(j)). The photocurrent-voltage characteristics of the synthesized devices were measured and are summarized in Figs. 13(k) and 13(l). Under illumination conditions, the LSV curve shows an oxidation onset potential of about 420 mV for OH–. The measured photocurrent density J was found to increase as a function of the illumination time t, and this yielded a large saturation current density J max > 10 mA cm–2 at 1.23 V vs. RHE. Xie's group [ 181 ] covered porous graphene (pGr) monolayers with NiO x thin films modeling electrocatalyst-modified n-Si substrates for PEC OER. The process of synthesizing composites as photoanodes is depicted in Fig. 14(a) . The pGr cover layer was shown to form a porous structure by Raman spectrum (Fig. 14(b)). From the current potential (J-V) curve of Fig. 14(c), the number of impacts of Gr has a significant impact on the PEC OER performance under different impact conditions. As indicated in Fig. 14(d), the photocurrent onset potential of the n-Si/TiO2/NiO x /pGr photoanode vs. RHE was 1.13 ± 0.01 V, and the photocurrent density (J 1.23) at 1.23 VRHE was 8.08 ± 1.0 mA cm–2. As shown in Fig. 14(e), the photocurrent onset potential of the n-Si/TiO2/NiO x /pGr photoanode vs. RHE was 1.13 ± 0.01 V, and the photocurrent density (J 1.23) at 1.23 VRHE was 8.08 ± 1.0 mA cm–2. Fig. 14(f) indicates that resistance value of n-TiO2/NiO x /pGr decreases significantly, while the resistance value of n-Si/TiO2/NiO x /pGr increases significantly. Xie et al. [ 182 ] proposed the construction of a sandwich structure with transition metal oxides/SLG/transition metals as the core to modify n-Si based photoelectrode materials. The synthesis of n-type Si/TiO2/NiO x /SLG/Ni is shown in Fig. 4(g). The synthesized photoanode SEM images are indicated in Figs. 14(h)–(j). The current density-potential (J-V) curve in Fig. 14(k) demonstrates that n-Si/TiO2/NiO x /SLG/Ni has higher performance than n-Si/TiO2/NiO x /Ni without SLG. Meanwhile, the maximum ABPE value of n-Si/TiO2/NiO x /SLG/Ni at 1.14 VRHE is 1.0% (Fig. 14(l)), which is 3.5 times higher than that of n-Si/TiO2/NiO x /Ni without SLG. In conclusion, carbon-based catalysts have abundant electronic states and energy level structures, which are favorable for the separation and migration of photogenerated charges. Carbon-based catalysts also have high conductivity and stability, which can effectively transport photogenerated charges and reduce the loss of electron-hole complexes and have a wide application potential as photoelectrocatalytic materials. 2.6.6 MOF-based catalysts MOF-based materials, as a class of mature crystalline materials, have better structural tunability than traditional crystalline materials. The abundance of metal nodes as well as functional tunability enables MOFs to be precisely designed to meet the demands of PEC [ 183–186 ]. Pan et al. [ 187 ] coated NiFe MOFs on the surface of oxygen rich defect BiVO4 (Ov BiVO4) and constructed a core-shell structure of NiFe MOFs with caffeic acid bridging groups (Fig. 15(a) ). At 1.23 VRHE, the photocurrent density of Ov-BiVO4@NiFe-MOFs is 5.3 ± 0.15 mA cm–2, which is much higher than other photoanode materials (Fig. 15(b)). The APBE curve showed that the maximum of Ov-BiVO4@NiFe-MOFs reaches 1.62% at 0.7 V vs. RHE, which is about 8 times that of BiVO4 (Fig. 15(c)). Compared to RHE, the APBE curve indicates that Ov-BiVO4@NiFe-MOFs can reach up to 1.62% at 0.7 V, which is more than 8 times higher than BiVO4. At 450 nm, the order of IPCE values from smallest to largest is BiVO4 (20.5%) < Ov-BiVO4 (28.4%) < Ov-BiVO4@NiFe-MOFs (72.9%), which indicates that the loading of oxygen vacancies and NiFe-MOFs is an effective way to enhance the photoelectrocatalytic activity of the system (Fig. 15(d)). At the same time, the electrochemical impedance followed a similar order (Fig. 15(e)). Yang et al. [ 188 ] improved the photogenerated electron transport efficiency by compounding CoFe MOF material on the BiVO4 surface. Fig. 15(f) shows a novel nanomaterial prepared on a fluorine doped oxide (FTO) substrate modified with binary metal organic framework materials (MOFs). Fig. 15(g) illustrates the LSV curves of the synthesized composites. The results demonstrate that the current density of BVO@CoFe MOF(NA) is 2.10 mA cm–2 at 1.23 VRHE, whereas the pure BVO is only 0.65 mA cm–2. This indicates that CoFe MOFs have a good synergistic effect in improving the reaction rate of water. LSV observations in the dark further confirmed this conclusion (Fig. 15(h)). According to the results in Fig. 15(i), BVO/CoFe MOF(NA) showed the ABPEmax is 1.09% and higher than the other synthesized photoanodes at 0.79 VRHE, which suggested that CoFe MOF (NA) optimized the catalytic activity of the system better than CoFe MOF (5-ana). The highest IPCE value of BVO/CoFe MOF (NA) is 89% near 400 nm (Fig. 15(j)). Lee's group [ 189 ] prepared MIL(125)-NH2/TiO2 nanocomposites using a hydrothermal method and studied their PEC OER activity. Fig. 16(a) indicated the synthesis of TiO2 NRs photoanodes by hydrothermal method and the synthesized photoanodes. The MIL(125)-NH2/TiO2 NRs exhibit a significantly high PEC performance of 1.63 mA cm–2 at 1.23 V vs. RHE (Fig. 16(b)). Fig. 16(c) indicated the photocurrent density of pristine TiO2 NRs and MIL(125)-NH2/TiO2 NRs. The measured ampere photocurrent showed that the synthesized photoanode maintains a high stability within 50 h. The highest IPCE value of MIL(125)-NH2/TiO2 NR reaches 84.4% at λ = 340 nm, which is close to 2.5 times more than that of pure TiO2 NR (Fig. 16(d)). The EIS spectra indicate that the impedance value of MIL(125)-NH2/TiO2 NR is lower than that of TiO2 NR, which demonstrates that the MIL(125)-NH2 coating greatly contributes to the carrier transfer capability of the composite (Fig. 16(e)). Pan et al. [ 59 ] used a metal organic framework compound (cMOFs) with good conductivity to coat Ti:Fe2O3. Core-shell Ti:Fe2O3@CoFe-cMOFs photoanodes were prepared by a ligand-driven self-assembly process using CA as a ligand (Fig. 16(f)). The photocurrent density was further increased to 3.3 mA cm–2 at 1.23 VRHE after plating bimetallic CoFe-cMOFs on the Ti:Fe2O3 surface, which was higher than the other two photoanodes (Fig. 16(g)). The ABPEmax value of Ti:Fe2O3@CoFe-cMOFs reached 0.34% at 1.05 VRHE (Fig. 16(h)). Fig. 16(i) shows the IPCEs values at 1.23 VRHE at 400 nm in the order of Ti:Fe2O3@CoFe-cMOFs (63.5%) > Ti:Fe2O3@Co-cMOFs (52.4%) > Ti:Fe2O3 (36.3%) from largest to smallest. Fig. 16(j) indicates that the current density of Ti:Fe2O3 at 1.23 VRHE is 2.8 mA cm–2 in Na2SO3 solution and 1.2 mA cm–2 without Na2SO3 solution. In summary, MOF-based catalysts have highly tunable structures and compositions, which enable MOF materials to be optimally designed for different photoelectrocatalytic reactions and to improve catalytic efficiency. In addition, MOF materials are rich in functional groups, which can regulate the electron transport and reaction routes in catalysis. MOF materials can also be doped, or surface modified to adjust the energy band structure and photovoltaic properties and broaden the range of light adsorption. 3 Photoelectrocatalysis CO2 reduction reaction 3.1 Basic principles of PEC CO2 reduction reaction (PEC CO2RR) Conventional thermocatalytic CO2 reduction is conducted at high temperature (at least 500 °C) and high pressure (10 bar). The photocatalytic, electrocatalytic and PEC CO2 reduction reaction (CO2RR) process using solar or electrical energy and catalyst to catalyze the conversion of CO2 [ 68,190,191 ]. Using solar-powered catalysts, carbon dioxide can be reduced and processed to CO or other high-value products [ 33,192,193 ]. However, the reduction of CO2 is still technically challenging due to the high dissociation energy of C=O of about 750 kJ mol–1 [ 194 ]. In industrial production, the products of the PEC CO2 reduction reaction have different values products. Currently, the products of PEC CO2 reduction reactions include mainly C1-like products (CO, CH4, CH3OH, HCOOH) and C2 and C2+ like products (C2H4, C2H6, C3H6, C2H5OH, etc.) as illustrated in Table 2 [ 41,117,164,195,196 ]. Currently, research on PEC reduction of CO2 is progressing rapidly, but the theoretical system required to utilize solar and electro energy in catalytic reactions for conversion to chemical compounds is not yet fully mature. Based on its excellent application background and industrial value, a large amount of research work exists to explore in depth the products and reaction mechanisms produced by PEC reduction of CO2, where SHE is the normal hydrogen electrode [ 197–201 ]. For example, PEC generation of CH4 requires more electrons and more energy than the generation of CO, which means that the reaction process is more difficult [ 14,202–204 ]. For CO2RR, the photocatalytic and electrocatalytic reactions proceed in the same way, and the reaction energy barriers required for the different products are essentially similar. During the PEC CO2RR reaction, CO2 is the first to bind to the active sites on the catalyst surface, and then a series of reaction energy barriers are overcome, resulting in different products. It should be noted that the beam-decision step in PEC CO2RR is a key step in the reaction process, which can reveal the mechanism of the reaction process and provide a reference for improving the catalytic activity of the system. However, CO2 uptake at the active site is also a very critical step, and only if the CO2 uptake is effective, the products can achieve high selectivity in the subsequent reaction steps, which also promotes the improvement of reaction stability. The reduction of CO2 has also been an important means to achieve the dual-carbon goal in recent years, which has attracted worldwide attention. However, this technology has still not been industrialised on a large scale worldwide due to the disadvantages of uncertainty in selectivity and products, and poor stability. Therefore, overcoming the above drawbacks to achieve industrialisation is the future trend. 3.2 Catalyst design principles for PEC CO2RR As far as CO2RR is concerned, the assays and activity evaluation criteria used for photocatalysis are not the same as for electrocatalysis. Photocatalytic CO2RR mainly uses gas chromatography to detect the yields of different products and thus calculate the apparent quantum efficiency to compare the catalytic activity. On the other hand, electrocatalysis mainly calculates the target selectivity after detecting the yields of different products by gas chromatography, and a high selectivity implies a high catalytic activity. Whether catalysts are used for photocatalytic or electrocatalytic CO2RR, high CO2 adsorption is required to ensure higher productivity or selectivity of subsequent products [ 205,206 ]. For photocatalysis, the CO2RR process requires many photogenerated electrons to participate in the reaction and a high separation efficiency of photogenerated electron-hole pairs to be maintained. Therefore, catalysts for photocatalytic CO2RR are mainly semiconductors and need to have a high light absorption capacity and a high photogenerated electron-hole pair separation efficiency. Representative catalysts include TiO2, sulfide, and carbon nitride-based materials, etc. For the electrocatalytic CO2RR process, the catalysts need to have a high electrical conductivity to be able to maintain high selectivity at low potentials. Therefore, the catalysts commonly used for electrocatalytic CO2RR are mainly noble metal or transition metal clusters/oxides/sulfides. Representative metal elements include Ag, Cu, Au, Ni, Fe, Ga, etc. The PEC CO2RR reaction detection method and activity evaluation criteria are similar to those of electrocatalytic CO2RR. The difference is that in the PEC CO2RR process, additional solar energy is applied to overcome the energy potential barriers required for the conversion to different products, so as to improve the reaction efficiency. And the photogenerated electrons on the catalyst surface by light also have a synergistic promotion effect, which can maintain the high conductivity and selectivity of the system. In summary, for catalysts used in PEC CO2RR, catalysts with good catalytic activity should have the following characteristics: (1) excellent electrical conductivity, capable of high carrier transfer rate during the reaction process; (2) excellent photosensitivity, capable of absorbing energy over a wide spectral range and maintaining a high photogenerated electron yield and separation efficiency of electron-hole pairs; (3) high stability, can maintain high catalytic activity under long time reaction conditions. 3.3 Synthesis methods of catalysts for PEC OER Catalysts for PEC CO2RR are synthesised by a variety of methods, including electrodeposition, physical vapour deposition (PVD), sol-gel synthesis, hydrothermal synthesis, chemical vapour deposition (CVD) and solution-based techniques such as drop-casting or spin-coating. Composite catalysts combining multiple materials are also common and are usually synthesised by co-electrodeposition, co-sputtering or in situ growth methods. The method of catalyst synthesis has an impact on factors such as selectivity, stability and compatibility with photoelectrochemical systems for a given CO2 reduction product, and therefore simple and high-yield methods need to be selected to enable large-scale industrial production. 3.4 Configuration of PEC CO2RR Typically, the PEC reduction of CO2 is measured in a three-electrode configuration, and the three electrodes are commonly used to evaluate the reaction efficiency of the photocathode. The common reaction equipment is an H-type electrolyzer or a two-compartment electrolyzer, and the common reference electrodes are Ag/AgCl or Hg/HgO electrodes. To prevent mixing of the cathode and anode electrolytes, the double chamber electrolytic cell is usually separated by a proton exchange membrane (Nafion, etc.) to avoid reverse oxidation of the products on the anode (Fig. 17 ) [ 207 ]. 3.5 General parameters to evaluate the PEC CO2RR Commonly used measurements of PEC CO2RR are by LSV, timed current (i-t) or timed potential (v-t) under dark or light conditions. Key indicators of the reaction results are Faraday efficiency (FE) for different products, CV curves, i-t curves, photocurrent densities and parameters indicating sample stability, etc. The FE to the product was calculated by quantifying the ratio of electrons in the PEC reaction that contributes to the production of the product with the following Eq. (4) [ 75 ]: (4) FE (A) = αn(A)F/Q where the reaction product is set to be A, α is the number of electrons required to reduce CO2 to produce a molecule of A, n(A) is the molar amount of A, F is Faraday's constant, and Q is the total charge that passes through the circuit in the process of producing n(A) moles of A. In addition, the algorithms for value of STH, IPCE and APBE for the PEC CO2RR reaction were similar to those for the PEC OER reaction [ 75 ]. 3.6 Different catalysts for PEC CO2RR We classified the catalysts commonly used for PEC CO2RR into three categories: Cu-based, metal oxides/nitrides, and porphyrins catalysis and summarized them (Fig. 18 ). 3.6.1 Cu-based catalyst Cu-based catalysts are widely used for electrocatalytic and PEC CO2RR due to their good electrical conductivity, tunable band gap, and good adsorption of intermediates for the CO2RR reaction process [ 208 ]. In industrial production, the cost of Cu is also much lower than that of various precious metals (e.g. Au, Ag, Pt, Pd), therefore Cu has broad application prospects in the future [ 209 ]. Since Cu-based materials have been reported in many literatures with a wide range of research directions, they are reviewed here in a separate subsection [ 210–214 ]. Kempler et al. [ 90 ] prepared a silicon-based photocathode by electrochemical deposition of Cu on the vertical side walls of micrometer fibers with aspect ratio. The synthesized catalytic system for the reaction is shown in Fig. 19(a) . Fig. 19(b) illustrated a comparison of the J-E behavior of the illuminated planar n+p-Si/Cu and n+p-Si μW/Cu electrodes in the plating cell prior to and after transferring a charge of –1.00 C cm–2 in the direction of the copper deposition, respectively. The partial current density behavior Jx -E of copper deposited on n+p-Si μW in catalyzing the generation of CO, CH4, and C2H4 consistently shifted toward a more positive potential, with the magnitude of the shift varying depending on the different reduction products (Fig. 19(c)). The n+p-Si μW/Cu electrodes were more active toward H2 than the Cu foils (Fig. 19(d)). Roh and coworkers demonstrated stable aqueous PEC CO2R by attaching copper nanoparticles (CuNPs) to np-SiNW photocathodes (Figs. 19(e) and (f)) [ 215 ]. The PEC CO2RR performance of this CuNP/SiNW array was tested under simulated light conditions (Fig. 19(g)). Fig. 19(h) illustrates the selectivity of the CO2RR gas products under different catalyst mass usage conditions. Figs. 19(i) and (j) indicated the activity of CuNP/SiNW against C2H4. The main product of CO2RR, FE(C2H4), reached more than 20% at –0.45 V vs. RHE and 25 ± 6% at –0.55 V vs. RHE (Fig. 19(i)), which was the highest value for wet side illuminated PEC CO2RR. The Tafel slope for the conversion of CO2RR to C2H4 by the CuNP/SiNW system was 93 ± 14 mV dec–1 (Fig. 19(j)), suggested that the single electron transfer carbon-carbon coupling step is the decisive step in the reaction process. Toma's group [ 94 ] provided a protection scheme by revealing the changes in the cuprous oxide (Cu2O) photoelectrode under reaction conditions. Since APXPS showed the presence of Cu2+-OH (aq) at the interface in the presence of light, which may disrupt the charge transfer from Cu2O to the catalyst, as shown in Fig. 20(a) . The photocurrent density presented by Ag/Cu2O in aqueous solution at 0.4 V vs. RHE is lower than that of pure Cu2O (Fig. 20(b)). On the other hand, when used AcCN, which prevents the disproportionation of Cu2O and thus prevents the formation of Cu2+-OH (aq) species (Fig. 20(c)), the Ag catalyst increased the initial photocurrent density of Cu2O at –1.2 V vs. Fc/Fc by a factor of about 1.8 (Fig. 20(d)). In addition, the formation of Cu2+-OH (aq) species was effectively prevented when using AcCN (Fig. 20(c)), and the Ag catalyst resulted in a significant increase in the initial photocurrent density of Cu2O at –1.2 V vs. Fc/Fc (Fig. 20(d)). These phenomena suggest that preventing the formation of Cu2+-OH (aq) species at the interface can accelerate the charge transfer at the solid/liquid interface and effectively prevent Cu2O from undergoing chemical transformation. In addition, the synergistic effect of the Ag catalyst and the heterogeneous structure of ZS on the modification of Cu2O resulted in a reductive photocurrent for the Ag/Cu2O/ ZS/FTO reaction, with current density of –1.3 mA cm–2 (Fig. 20(e)). The system selectively and sustainably produced C2H4 (FE ~60%) and H2 (FE ~40%) (Fig. 20(f)). Xiong's group [ 216 ] developed a facile method to coat the Cu2O cathode surface with a MOF material. Fig. 20(g) illustrates the photocathode contains a columnar Cu3(BTC)2 MOF structure on the surface of a Cu2O film. As indicated in Fig. 20(h), the CO generation rate of Cu3(BTC)2/Cu2O at applied potentials between –1.77 and –1.97 V vs. Fc/Fc+ was as high as ~95%. The Cu3(BTC)2/Cu2O/ITO photocathode achieved STC efficiency of 0.83% (Fig. 20(i)), which is comparable to the benchmark photocathode (0.87%). In summary, the special position and active center of the copper surface make it highly CO2 selective, which has good application prospects in the field of CO2 conversion and provides potential catalysts for the treatment of CO2 pollution. 3.6.2 Metal oxides/nitrides Metal oxides and nitrides, which combine high conductivity and high photosensitivity, are also widely used in PEC CO2RR. Shan and co-workers report the coupling of molecular p-n junction assemblies with single integrated semiconductor p-n junction-n-type GaN (n-GaN) nanowires on n+-p-p+ silicon (Si | n-GaN) for PEC CO2RR [ 217 ]. The structures of the synthesized composites are indicated in Figs. 21(a) and (c) and SEM images are shown in Fig. 21(b). The relative energy levels of the whole system are shown in Fig. 21(d). Photocathodes Si|n-GaN| -NPhN- Ru(CP)2+ 2-RuCt subjected to solar irradiation (AM 1.5G) in CO2-saturated NaHCO3 produced significant photocurrents vs. RHE (–0.40 to –0.80 V vs. RHE) over the range of the applied bias from 0 to –0.4 V (Fig. 21(e)). The photocathode continued to produce formic acid under solar irradiation (AM 1.5G), and the Faraday efficiency increased from 35% to 64%, indicating a relatively stable photocurrent (Fig. 21(f)). Coating a layer of silver catalyst on the surface of GaN nanowires using PEC deposition method in AgNO3 containing hydrothermal solution (Fig. 21(g)) [ 218 ]. The silver catalyst was transformed into AgX by repeated anodic oxidation and reduction in a KX electrolyte under sunlight irradiation (Fig. 21(h)). When the photocathode is under light conditions, the photogenerated carriers in the wafer spontaneously migrate to the surface of GaN NW and AgX (Fig. 21(i)). The AgBr/GaN/Si indicated excellent stability even when gaseous products were strongly generated at the strong potential of –1.0 VRHE over the time interval of 9 to 12 h (Fig. 21(j)). The photocathode consisting of GaN nanowires coated with cu on a silicon wafer by Dong et al. [ 219 ] can effectively reduce CO2 gas mixtures containing H2S to HCOOH (Fig. 22(a) ). The reductive photocurrent density of –0.9 mA cm–2 was measured at –1.0 VRHE with onset potential of –0.4 VRHE (Fig. 22(b)). The Cu-assisted catalyst deposited on a silicon substrate (Cu/Si) started to produce HCOOH at –0.4 VRHE and showed a maximum FEHCOOH of 20.7% at –1.0 VRHE (Fig. 22(c)). The maximum jHCOOH of Cu/GaN/Si was 7.07 mA cm–2 (Fig. 22(d)). The reaction showed a slight decrease in FEHCOOH and j HCOOH at –1.0 VRHE compared to the first reaction, probably due to the reduction of CuS to Cu (Fig. 22(e)). Pan and coworkers [ 220 ] used non-precious metal NiOOH/α-Fe2O3 and Bi/GaN/Si silicon wafers as photo-anode and photocathode, respectively (Fig. 22(f)). Arrays of GaN nanowires modified with biomaterials (called Bi/GaN/Si) were used on single crystal silicon wafers for PEC CO2RR (Fig. 22(g)). The SEM image (Fig. 22(h)) indicates that GaN is aligned perpendicularly to the Si substrate. The performance of Bi/GaN/Si was greater improved than GaN/Si, with an onset potential of 0.1 V. The photocurrent density produced at –0.8 V was as high as 22.1 mA cm–2 (Fig. 22(i)). The addition of Bi co-catalysts greatly improved the formate selectivity with a maximum selectivity of 85.2% (Fig. 22(j)). Mi's group found that in the CO2RR catalytic system, a novel active center, namely the metal/oxide surface, is introduced on its surface to automatically activate CO2 and stabilize it during CO2 reduction, thereby improving CO conversion efficiency [ 221 ]. The schematic design of Pt-TiO2/GaN/n-p Si was illustrated in Fig. 23(a) , and the SEM cross-section is shown in Fig. 23(b). Fig. 23(c) shows a comparison of the LSV curves. The photocurrent density reaches ∼120 mA cm–2 at –0.33 V when loaded with both Pt and TiO2 compared to bare Pt. Fig. 23(d) illustrates the FE of CO and H2 for the synthesised material with selected potentials between +0.47 V and +0.07 V. At the applied potential of +0.47 V, the FE of CO is as high as 78%. By adjusting the potential from +0.47 V to +0.07 V, the CO/H2 ratio can be adjusted over a wide range, contributing to the PEC CO2RR performance. Zhou and colleagues [ 14 ] report a unique GaN:Sn nanostructure integrated on planar silicon for PEC CO2RR formic acid production (Figs. 23(e) and 23(f)). Fig. 23(g) illustrates the bandgap diagrams for different materials, where both GaN and Si are n-type doped. As depicted in Fig. 23(h), the photocurrent density in pure silicon is very low due to high photogenerated electron and hole complexation in the potential range of +0.3 to –0.8 V. The photocurrent density in pure silicon is very low due to the high photogenerated electron and hole complexation. By adding GaN NWs, both the onset potential and current density are ideally improved. Among the three co-catalysts, only Sn NPs were able to effectively promote the formation of formic acid (Fig. 23(i)) with a catalytic efficiency of 76.9%, whereas the main product of the reaction of Co- and Ni-based co-catalysts was H2 accompanied by traces of CO (FE < 1%). Leung et al. [ 97 ] reported a precious metal-free molecular catalyst photocathode for CO2 reduction in water. The photohybrid system consists of a mesoporous titanium dioxide (meso TiO2) layer-modified p-silicon (Si) photocathode and an adsorbed cobalt catalyst (Fig. 24(a) ). With increasing H2O content, the number of cycles increased from 13 to 108 after 8 h of CPPE (Fig. 24(b)), and the selectivity increased from from 12% (9:1 MeCN:H2O) to 53% (7:3 MeCN:H2O). The photocurrent was very stable with a total Faraday efficiency of 77% (FECO = 48%) and a TONCO2 of 159 were achieved (Figs. 24(b)–(d)). In the optimal electrolyte solution (6:4 MeCN: H2O), LSV indicated that the cotpypp-functionalized photoelectrode displayed approximately twice the photocurrent and occurred ~120 mv earlier (Fig. 24(e)). The active site for CO2 reduction catalysis was finally identified as originating from CotpyP by multiple sets of controlled experiments in 6:4 MeCN:H2O solution (Fig. 24(f)). Li et al. [ 222 ] utilized the gold catalytic layer grown at grain boundaries and the amorphous silicon absorber modified on the surface of TiO2 to obtain a larger photogenerated voltage, thereby achieving higher photoelectric conversion efficiency. By adjusting the GB density of the Au layer, it is possible to obtain syngas with different carbon-to-hydrogen ratios with a wide range of PECs from –0.1 VRHE to plus 0.4 VRHE (Fig. 24(g)). Both the ST-4Au and ST-7Au samples produced high photocurrents of 6 mA cm–2 at –0.2 VRHE, with an early onset potential around 0.5 VRHE (Fig. 24(h)). For the a-Si/TiO2 electrode, the Faraday efficiency (FE) of H2 is close to 100% at all potentials and no CO is generated (Fig. 24(i)). In addition, by varying the applied voltage to the ST-4Au sample, which resulted in a high concentration of CO, the CO/H2 ratio ranged from 1:2 to 1:3.1 (Fig. 24(j)). On the ST-7Au electrode, a wide potential range of –0.1 to 0.3 VRHE produces a syngas with a CO/H2 ratio of 1: 1 (Fig. 24(k)). In conclusion, metal oxides/nitrides have been widely recognized for their high catalytic activity, high product selectivity and stability during PEC CO2RR reactions. In the future, metal oxides/nitrides can be used for industrial conversion of CO2 to produce high-value products. 3.6.3 Porphyrin-based catalysts Porphyrin molecules are widely used in the design and synthesis of many types of photovoltaic conversion materials because of their broad spectral adsorption range, highly conjugated rigid planes, flexible and easily tunable structures and functions, and high chemical stability. Porphyrin molecules have a flat π-conjugated structure, which allows them to absorb light in the visible and near-infrared regions. This strong light adsorption ability makes porphyrin materials have a wide range of applications in fields such as photoelectrocatalysis and photosensitive materials [ 223,224 ]. Yang's research team [ 225 ] uses copper to manufacture formic acid products and replaces the central magnesium of its chlorophyll with Au, Cu, or Co (Fig. 25(a) ). Fig. 25(b) showed the TEM images of the HNTM after immobilization of the corresponding metal atoms on the HNTM (HNTM-M-SA) (Fig. 25(c)). Fig. 25(d) illustrated the Fourier transform (FT) k3-weighted EXAFS spectra of HNTM-Au-SA at the Au L3 side. Compared with the reference samples, no significant Au-Au (2.1 and 2.7 Å), Au–H (0.9 Å) and Au–Cl (1.8 Å) coordination peaks were detected. They proposed a schematic model for HNTM-Au-SA in the inset of Fig. 25(e). A single gold atom is coordinated to four N atoms and anchored to the center of the porphyrin unit, ultimately forming the active site for the catalytic reaction. In addition, HNTM-M-SA consistently maintained the highest FEmax under visible light irradiation (Fig. 25(f)). As illustrated in Fig. 25(g), the activation of CO2 on both sides of the porphyrin planes may have a synergistic effect on HNTM-Au-SA. Wang and coworkers [ 226 ] designed and synthesized Cu@porphyrin-COFs nanorods materials using a solvothermal method, and then electrodeposited Cu nanowires onto free radical porphyrin-COFs on carbon fibers. Electrochemical deposition of Cu on porphyrin based COFs can effectively accelerate electron transfer speed and capture protons, thereby providing convenience for C–C coupling (Fig. 25(h)). Methanol (CH3OH) and ethane-1,1-diol(CH3CH(OH)2) were detected at an external voltage of –0.8 V (Fig. 25(i)). When using Cu@[OH]-H2P-COF/CF photocathodes in PEC batteries, the total formation rate of hydrocarbons (Fig. 25(j)) was significantly increased by nearly 3 times compared to [OH]-H2P-COF/CF photocathodes (Fig. 25(k)). The CO2 conversion efficiency of the Cu@[OH]-H2P-COF|KHCO3|Pt cell was about 5 times that of the EC plus PC at –1.0 V (Fig. 25(l)). Wei et al. [ 227 ] modified the internal structure of cobalt tetraphenylporphyrin (CoTPP) catalyst by annealing to improve the catalytic activity. Fig. 26(a) illustrates the synthesis of different photocathodes for PEC CO2RR by loading graphene on a silicon substrate and subsequently immobilizing CoTPP molecules. The LSV results in Fig. 26(b) showed that the photocurrent density rises rapidly above the starting potential. The partial current density increases significantly with the rise of negative potential, and the selectivity to CO. The highest selectivity for CO is achieved at –0.1 V (vs. RHE), which is 82.8%. The lowest PEC performance for Si/rGO/Co further suggests that the conducting graphene has a significant impact on the PEC performance of the promoted system (Fig. 26(c)). At voltage of –0.1 V (vs. RHE), with 75% selectivity for CO, the stable photocurrent was approximately 2.2 mA cm–2 and reacted stably for 16 h (Fig. 26(d)). The PEC performance and stability of Si/rGO-Co exceeded that of the PEC CO2RR catalyst (Fig. 26(e)). Huang's group [ 164 ] anchored the Ru(bpy)3Cl2 branched chain as a powerful photosensitive material to a covalent organic skeleton based on Co-porphyrin via a coordination reaction (Fig. 26(f)). The synthesized catalysts showed FECO up to 96.7% at –0.7 V (vs. RHE) and current density up to 16.27 mA cm–2 at –1.1 V (vs. RHE). LSV images showed that the current densities of Co-Bpy-COF-Ru1/2 and Co-Bpy-COF were higher than those measured in the corresponding electrolytes saturated with N2 (Fig. 26(g)), verifying the higher activity of CO2RR than that of the HER-responsive HER. Under light conditions, the onset potential of Co-Bpy-COF-Ru1/2 was more favorably oriented towards positive potentials vs. RHE, and the current density was increasingly high, up to 30 mA cm–2 at –1.2 V (Fig. 26(h)). The FECO of Co-Bpy-COF-Ru1/2 exceeded 80% in the potential range of –0.5 to –0.9 V, reaching FEmax of 96.7% at –0.7 V (Fig. 26(i)). Meanwhile, the TOFs of Co-Bpy-COF-Ru1/2 were also significantly increased under light conditions, reaching a maximum value of 933 h–1 at –1.1 V, which was much higher than that under dark conditions (681 h–1 at –1.1 V, Fig. 26(j)). In conclusion, porphyrin-based catalysts possess strong light adsorption ability and rich electronic state structure, making them widely used in photoelectrocatalysis. The structural tunability and coordination ability make the porphyrin materials have diverse functions and properties, which can be regulated to meet different needs, and have greater research value and broad research prospects. 4 Advanced modification strategies for catalysts in PEC OER and CO2RR. For catalysts employed in photoelectrochemical oxygen evolution reactions (PEC OER) and carbon dioxide reduction reactions (CO2RR), leveraging advanced modification strategies is crucial for enhancing their efficiency and selectivity. These strategies encompass various techniques such as doping [ 228 ], manufacturing defect [ 229 ], formation of single or diatomic atoms, creation of heterojunctions, microenvironmental modulation, and others. Collectively, these advanced methodologies hold significant promise for designing and developing highly efficient catalysts tailored for PEC OER and CO2RR, thereby playing a vital role in advancing sustainable energy conversion technologies. 4.1 Doping Doping is the introduction of small amounts of foreign atoms into a catalyst material to alter its physico-chemical properties [ 230–232 ]. The technique can adjust the reactivity, selectivity, stability, or other characteristics of the catalyst to achieve higher reaction efficiencies. Doping can be accomplished by a variety of methods such as impregnation, ion exchange or chemical vapour phase deposition. The usual doping methods are substitution doping and interstitial doping. Substitution doping is to replace the position of the target atom by entering the heteroatom into the lattice, while gap doping is to change the lattice parameter of the material by entering the heteroatom into the gap between the lattice, both of which are to change the electronic structure of the catalyst by changing the internal lattice structure of the material to change the electronic structure of the catalyst, the ligand environment, and other properties [ 233–238 ]. Bao and his colleagues [ 239 ] have prepared Si-doped ZnAl-LDH with photoresponsive properties. The synthesised catalysts enhanced the light absorption and photoresponsive effects. Fig. 27(a) indicates the schematic diagram of the synthesis process, where Si-doped LDH nanosheets were finally obtained by chemical exfoliation method of layering after the addition of SiCl4 on the surface of Zn-Al LDH. The morphology of Si-ZnAl-LDH is a spherical-like structure and its surface consists of thin nanosheets (Fig. 27(b)). Atomic force microscopy (AFM) images demonstrated similar edge heights for ZnAl-LDH nanosheets (Fig. 27(c)), while the edge heights of Si-ZnAl-LDH nanosheets (Fig. 27(d)) were not uniform. The LSV curves, EIS results, and C dl results all indicate the best PEC OER performance of the Si-doped LDH. It is since the doping of Si changes the carrier transfer efficiency of the system and effectively accelerates the separation of photogenerated electrons and holes, thus enhancing the catalytic activity of the system (Figs. 27(e)–(h)). This work provides a new idea and a feasible strategy for modifying the photoelectric properties of LDH materials. Similarly, Dong et al. [ 240 ] also enhanced the catalytic activity by doping Mn on the FeBTC/NIF surface to change the energy level structure of the catalyst, which enhanced the light absorption capacity and increased the carrier transfer rate. The catalytic activity enhancement was more obvious under light. This work also demonstrates that doping can effectively enhance the catalytic activity of the system by changing the properties of the catalyst such as the structure or electronic coordination environment. Fig. 27(i) demonstrates the synthesis process of the catalyst, and the Mn-FeBTC/NIF with a lamellar structure was obtained by the electrodeposition method. whereas the reaction process on the surface of the NIF when a constant voltage was applied during the deposition process is shown in Fig. 27(j). Similarly, the LSV curves, EIS results and C dl results indicate that the Mn-doped Mn(II)-FeBTC/NIF has the best OER performance. Whereas the OER performance of all samples was enhanced under light, Mn(II)-FeBTC/NIF still had the best PEC OER performance (Figs. 27(k)–(n)). It is demonstrated that doping can change the electron transfer efficiency of the whole system, accelerate the adsorption of intermediates, and enhance the catalytic activity. In conclusion, doping, as a common modification method, has been applied in numerous catalyst systems. Doping is widely used for its diverse methods and obvious effect on the enhancement of catalytic activity. 4.2 Manufacturing defect Manufacturing defects are defects or irregularities introduced into the lattice of a material during its synthesis. These defects can include vacancies, interstices, dislocations, and grain boundaries. Crystal defects can alter the forbidden band width, electronic structure, coordination environment and other properties of the catalyst, which is beneficial to the catalytic activity [ 241–246 ]. Peng's group [ 247 ] fabricated a gradient vacancy concentration from the surface of BiVO4 surface after a simple solvent-thermal treatment method via N,N-dimethylformamide (DMF), which not only improved the carrier transport but also established a favourable energy band structure and optimised the catalytic activity. Figs. 28 (a1)–(a6) shows AC-STEM images of BVO and B(VO)1–δ obtained by DMF treatment with different vacancy concentrations, and it is evident that the atomic arrangement of the initial conformation changed significantly after DMF post-treatment. The reconstitution process suggests that post-processing can lead to the removal or rearrangement of specific atoms, and depending on the treatment, a gradient-like change in vacancy concentration is formed. These results suggest that DMF post-treatment can effectively lead to the formation of vacancies within the lattice. The DMF post-treatment process leads to easier dissolution of surface VO4 3– and formation of VO4 vacancies with gradient features in the B(VO)1–δ film as Bi and V gradually decrease, as shown in Fig. 28(b). The gradient energy band structure of the B(VO)1–δ film was finally formed (Fig. 28(c)). The results of LSV, ABPE and IPCE curves all indicate that the catalytic activity of the B(VO)1–δ photoanode is stronger than that of the BVO, demonstrating that the vacancy gradient promotes charge separation and increases the photocurrent, enhancing the catalytic activity of the system (Figs. 28(d)–(f)). Li's group [ 71 ] also found the effect of vacancy concentration on photoelectrocatalytic activity. By modulating the concentration of oxygen vacancies in PbCrO4, they found that the oxygen vacancies could introduce different electronic energy levels, thus generating higher charge separation photovoltaic voltage, accelerating carrier transport and enhancing the catalytic activity. Li's group also found the effect of vacancy concentration on photoelectrocatalytic activity. By modulating the concentration of oxygen vacancies in PbCrO4, they found that the oxygen vacancies could introduce different electronic energy levels, thus generating higher charge separation photovoltaic voltage, accelerating carrier transport, and enhancing the catalytic activity. They characterised the energetic differences between O-rich and O-poor PbCrO4 by surface photovoltage microscopy (SPVM). The O-poor PbCrO4 exhibited a larger SPV than the O-rich PbCrO4 in different wavelength ranges (Figs. 28(g) and 28(h)). It is due to O-poor PbCrO4 has a slightly lower WFlight due to a higher concentration of oxygen vacancies and a higher WFdark due to a deeper surface capture state, and thus a higher SPV intensity, compared to O-rich PbCrO4. Fig. 28(i) indicates that the open-circuit voltage (OCP) of O-rich and O-poor PbCrO4 is lower in light conditions than in dark conditions, while O-poor PbCrO4 has a higher photovoltage than O-rich PbCrO4. The higher photovoltage of poor O PbCrO4 (203 mV) than rich O PbCrO4 (170 mV) is further demonstrated by the statistical photovoltage in Fig. 28(j). As illustrated in Fig. 28(k), under AM1.5G illumination, while the oxygen-depleted PbCrO4 photoanode produces a photocurrent density of 3.43 mA cm–2 at 1.23 V vs. RHE, which is about 2.5 times higher than that of the oxygen-enriched PbCrO4 photoanode. The increase in the photocurrent density indicates that the oxygen vacancies in oxygen-poor PbCrO4 produce deeper energy level populations, which is favourable to the photovoltage enhancement. In addition, the photocurrent densities of PbCrO4 photoanodes prepared under different annealing conditions ranging from oxygen-rich (100% O2) to oxygen-poor (0% O2) were gradually enhanced, which proved that the photocurrent densities were related to the concentration of oxygen vacancies. The similar trend of statistical photocurrent density and the corresponding J-V curves further confirmed the positive correlation between O-poor annealing and photocurrent density (Fig. 28(l)). Overall, crystal defects play a significant role in catalysis by enhancing surface reactivity, modifying surface chemistry, facilitating mass transport, and influencing electronic properties, ultimately leading to improved catalytic activity. 4.3 Single or diatomic atoms Single-atom catalysts are at the forefront and hotspot of catalytic science in recent years and have attracted much attention because of their maximum atom utilization efficiency and excellent performance. When the size of nanocrystals is reduced to clusters of atoms, single atoms, their energy level structure, and electronic structure undergoes a fundamental change. This unique structural property suggests that single-atom catalysts have a superior. It is due to this unique structural feature that the single-atom catalysts often show different activity, selectivity, and stability from the traditional nanocatalysts. On top of the single-atom research, the dual-atom research also came into being. By synthesizing two different single atoms, it is possible to achieve superior activity to that of single atom catalysts. Diatomic catalysts have also attracted the attention of researchers and have achieved greater research results in recent years. Single and diatomic catalysts can be used in the PEC process to precisely increase the atom utilisation, modify the electronic structure and increase the number of active sites, thus optimising activity and stability [ 248–256 ]. Bi's team [ 257 ] demonstrated that single atoms can increase the carrier transport rate and thus catalytic activity by synthesizing Co single atom-modified α-Fe2O3 photoanodes. Fig. 29(a) indicates typical atomic resolution high angle annular dark field scanning transmission electron microscopy (HAADF-STEM) image, which clearly shows that the Co atoms are dispersed on the C3N4 surface. Fig. 29(b) shows the Co k edge X-ray absorption near edge structure (XANES) spectrum of Co-C3N4. There is a distinct Fourier transform (FT) peak at 1.49 Å, which points to the Co–N bond with a coordination number of four. The LSV curves, ABPE curves, IPCE curves and EIS results show that the photoanodic performance of the loaded single atoms is significantly stronger than that of α-Fe2O3 (Figs. 29(c)–(f)). These results clearly show that photogenerated holes on Fe2O3 can be efficiently transferred to the C3N4 surface and subsequently to the monatomic Co active site during the PEC OER process. It is demonstrated that the Co single atom accelerates the carrier transfer and thus promotes the OER performance. Zhang et al. [ 258 ] proposed a multi-purpose coupling strategy by designing single-atom Ni-N4 sites covered on the BiVO4 surface, simultaneous coordination of atomically dispersed Ni-N4 sites with axial oxygen atoms (Ni-N4-O) (Fig. 29(g)). The results showed that Ni-N4 promotes the separation of photogenerated carriers, which improves the PEC activity of the system. The LSV curves, ABPE curves, and IPCE curves indicate that the photoanodic catalytic activity of the loaded monoatomic and co-catalysts is significantly stronger than that of pure BiVO4 (Figs. 29(h)–(j)). Among them, the ABPE value of FeOOH/Ni-N4-O/BiVO4 is even 2.66%, which is 5.43 times higher than that of pure BiVO4, higher than the previously reported work (Fig. 29(k)). These results indicate that the construction of single-atom Ni-N4-O groups promotes carrier transfer and lowers the reaction energy barrier, thus improving the catalytic activity. Wang et al. [ 259 ] developed a novel N'nn'-chelate ligand (N3)-coupled cobalt porphyrin (CoPor-N3) polymer, in which the synergistic interaction between the internal electron-rich N3 ligand and the Co-N4 monatomic site resulted in more electrons being gained in the Co center, the facilitates carrier transfer and improves the reduction of CO2 by the catalyst. Fig. 30(a) indicates schematic top and side view structures of cobalt porphyrin (CoPor-N3) polymers coupled with N3 chelating ligands. The TEM images showed that the morphology of the synthesised catalysts was flaky (Fig. 30(b)), Aberration-corrected high-angle annular dark field scanning transmission electron microscopy (AC-HAADF-STEM) images (Fig. 30(c)) showed the distribution of many Co atoms. The EDS mapping images show the elements of the synthesised materials were all displayed (Figs. 30(d1)–(d4)). FECO amply demonstrated that the CO selectivity of CoPor-N3 under light was significantly higher than that under dark conditions at the same potential, suggesting that the single atoms effectively enhanced carrier transfer and inhibited the complexation of photogenerated electron-hole pairs, facilitated CO2 reduction, and suppressed the effect of the competing reaction HER (Figs. 30(e) and (f)). In addition, they constructed a PEC cell by using CoPor-N3/CC as a photocathode and NiCo-LDH/CuPc/BiVO4/ FTO as a photoanode, as shown in Fig. 30(g). The FECO was compared, and the results showed that the dual-photoelectrode cell had a higher selectivity of CO than the single-photoelectrode cell at the same potential (Fig. 30(h)). It is demonstrated that the dual photoanode can optimise the light absorption capacity of the system, leading to more photogenerated electrons transferring to the monoatomic active site, thus promoting the PEC CO2RR performance. Chen and coworkers [ 260 ] precisely synthesised the diatomic Ir1Pd1 on In2O3 by photo-induced domain deposition. The synergistic effect of this diatomic structure significantly promotes CO2 conversion and methanol product selectivity with desirable stability. Fig. 30(i) illustrates the schematic of the synthesis process, after co-precipitation and then photodeposition the catalyst containing diatoms was finally obtained. High-magnification HAADF-STEM images showed that most of the active sites were mostly two neighbouring atoms (Fig. 30(j)). Line contours (Fig. 30(k)) were used to identify the atom types, and the measured distance between Pd-Ir atoms was about 0.25 nm, which is close to the length of the metal-metal bond in Ir or Pd nanoparticles, in combination with the distribution function and atomic number analyses, confirming the presence of Pd and Ir diatomic structures in the synthesised catalysts. Fig. 30(l) shows that in the PEC CO2RR process, a conversion of CO2 of 10.5% and a methanol selectivity of 97% were achieved, and that this selectivity and conversion reached a level that could be industrialized. It is demonstrated that single atoms can improve the separation of photogenerated electron-hole pairs and the adsorption of CO2, thus promoting the selectivity and stability of PEC CO2RR. When the metal loading was further increased, the STY value decreased significantly (Fig. 30(m)). This phenomenon is attributed to the formation of metal nanoparticles and the decrease in the content of loaded diatoms, where the higher the metal content is the lower the diatom content, leading to the decrease in conversion and selectivity. In conclusion, both single and dual atom catalysts can substantially increase the atom utilisation in the catalysts, increase the number of active sites, and increase the photogenerated electron transfer rate, thus optimising the catalytic activity of the system. The industrialisation of single and dual atom catalyst has broad prospect and research value in the future, especially when the synthesis method and cost are reduced, the single and diatomic catalysts are expected to achieve a blowout development in the future. 4.4 Heterojunctions Heterojunction is an interfacial region formed when two different materials encounter each other. Whether it is a conductor/semiconductor, a material of different dimensions, or other heterogeneous interfaces formed between different types of materials, they can be called heterojunctions. Heterojunctions can effectively enhance the carrier transfer rate, reduce electrical resistance, lower the adsorption energy of intermediates during catalytic reactions, separate photogenerated electron-hole pairs, etc. This series of favourable effects will improve the catalytic activity, selectivity, and stability of the system. We believe that if we imagine the carriers in a catalytic reaction as a car, the heterojunction is equivalent to a section of “highway”, which will greatly accelerate the transfer of carriers and thus enhance the catalytic activity of the reaction at the macroscopic level. Currently, the effect of heterojunction on the system in the catalytic reaction has attracted wide attention, and has a broad research prospect in the future, which is one of the feasible ways to achieve industrialization [ 237,241,261–264 ]. Xie et al. [ 265 ] synthesised NiFeO x /BVO/BiVO4 photoanodes with heterostructures by indicating in BiVO4 by electroplating and photodeposition methods. The experimental results show that the photocurrent density of NiFeO x /BVO/BiVO4 is significantly higher than that of pure BVO, which proves that the heterostructure can enhance the catalytic activity of the system effectively. Fig. 31(a) illustrates the synthesis process, where NiFeO x /BVO/BiVO4 photoanodes were finally synthesised by electroplating and photodeposition. The successful synthesis of BVO/BiVO4 is indicated by the lattice fringes in Fig. 31(b). The TEM-EDX images also clearly show the elemental composition of the NiFeO x /BVO/BiVO4 samples, indicating that NiFeO x was successfully deposited on the BVO/BiVO4 surface (Fig. 31(c)). The results of LSV curves, ABPE curves and IPCE curves show that the catalytic performance of the samples containing heterojunctions is higher than the activity of pure BiVO4. It means that the heterojunction can enhance the carrier transfer rate of the system, which has a greater effect on the catalytic activity of the system (Figs. 31(d)–(f)). Shang et al. [ 266 ] composed a photocathode by binding graphene to p-type silicon using an organic linker, protected by the addition of a TiO2 film, and subsequently anchoring cobalt phthalocyanine molecules to graphene oxide. The synthesised catalysts have ideal PEC CO2RR performance with peak CO selectivity of 86% and peak MeOH selectivity of 23%. This work presents a strategy for interfacing molecular catalysts with p-type semiconductors and suggests new ideas for the study of PEC CO2RR catalysts. Fig. 31(g) shows a schematic of the synthesis flow of the catalysts, where the GO/CoPc catalysts were assembled by non-covalent π–π stacking and then the CoPc molecules were assembled onto graphene oxide flakes by sonication in DMF solution. Under PEC conditions, the CO selectivity of STA-GO/CoPc was significantly higher than that of CFP-GO/CoPc at lower applied voltage, indicating that the heterojunction significantly improved the catalytic activity of the system at lower applied voltage. At higher applied voltages, CFP-GO/CoPc reached 23% peak selectivity for methanol under dark conditions. The peak selectivity of STA-GO/CoPc for methanol reached 6% under light conditions, although its onset potential was lower than that of CFP-GO/CoPc. However, it is possible that the reduced Co loading or the planar structure of the Si substrate does not efficiently capture photogenerated electrons at high potentials, resulting in a lower selectivity of STA-GO/CoPc for methanol than CFP-GO. In conclusion, this research work is the first successful integration of molecular catalysts on silicon used for PEC CO2 reduction to methanol provides feasible ideas and prospective research perspectives for molecular catalysts (Figs. 31(h) and (i)). In conclusion, heterojunction can increase the active sites and specific surface area, optimise the energy band structure, accelerate the carrier transport, and reduce the adsorption energy of intermediates on the active sites, thus enhancing the PEC activity of the system. Efficient and highly selective catalysts can be designed by researchers for a wide range of photoelectrocatalytic applications as a common modification method. 4.5 Microenvironmental modulation In catalytic reactions, the microenvironment is the local conditions surrounding the catalyst and reactants in the reaction system. It includes influences factor such as temperature, pressure, solvent composition, pH, reactants, use of surfactants, and reaction atmosphere. The kinetics, thermodynamics, stability, and selectivity of catalytic reactions can be effectively regulated by adjusting these influences. Specifically, regulating the microenvironment has the following benefits for catalytic reactions. Firstly, the selectivity is improved, which facilitates the formation of desired products while minimizing the generation of by-products from competing reactions. Second, reaction activity and selectivity are enhanced by promoting efficient mass transfer and facilitating favorable reactant-catalyst interactions. Third, the stability of the PEC catalyst was effectively promoted by extending the lifetime of the photogenerated carriers. In addition, microenvironmental conditioning permits precise control of the reaction pathway, making it possible to synthesize specific molecules with desired properties. Overall, optimizing the microenvironment in catalytic reactions can improve the efficiency, sustainability, and economic viability of chemical processes [ 267–272 ]. Jin's group [ 273 ] used a covalent triazine skeleton containing dithiophene (CTF-BTh) to modulate the microenvironment at the interface between Gd-doped hematite and cobalt silicate (Co-Sil) co-catalysts for efficient photoelectrocatalytic water oxidation. As shown in Fig. 32(a) , the reaction environment favorable to PEC CO2RR was created by modulating the microenvironment, which enhanced the carrier transfer rate and improved the product selectivity and stability. After the addition of Co-Sil co-catalyst and CTF-BTh, the inter-interfacial microenvironment was successfully regulated, which effectively accelerated the charge transfer rate and greatly inhibited the recombination of photogenerated electron-hole pairs (Figs. 32(b) and 32(c)). The LSV curves, chronoamperometry curves, ABPE curves and IPCE curves all showed that the catalytic activity of the photoanode was greatly improved by the addition of Co-Sil co-catalyst and CTF-BTh. It is since the addition of CTF-BTh passivates the surface and its abundant coordination bonds provide channels for charge flow, thus enhancing the oxidation state of Co. Meanwhile, the conjugated system of CTF-BTh is easy for electron delocalization and effectively inhibits the interfacial electron-hole complex. In addition, the modulation of the interfacial microenvironment can reduce the charge transfer resistance and increase the surface photovoltage. The synergistic effect of these modifications greatly improved the charge separation efficiency, charge transfer efficiency and catalytic activity of the system (Fig. 32(d)–(g)). Shang et al. [ 274 ] achieved improved CO2 reduction performance by designing the semiconductor/catalyst interface and modulating the electrode microenvironment for PEC, which is important for optimising the cascade reaction of CO2 reduction to methanol. They synthesized carbon nanotube/amine-substituted CoPc catalysts (CNT/CoPc-NH2) by preparing the surface of p-type silica carriers into micropillar arrays, which improved the light absorption capacity and catalytic activity. SMA structures with a column diameter of nanopillars were prepared by photolithography and dry etching and coated with a thin CF x layer using octafluorocyclobutane (C4F8) plasma (Fig. 32(h)). At an applied potential of –0.7 V, the methanol FE of the SMA-CF x -CNT/CoPc-NH2 photocathode was 21%, the CO FE was 37%, and the total photocurrent was 16.6 mA cm–2 (Fig. 32(i)). The system was tested for stability at a constant current of 15 mA cm–2 (Fig. 32(j)). The catalyst could still maintain high selectivity and stability within 50 h. When the reaction time was greater than 50 h, the stability of the catalyst gradually decreased with increasing time. The SMA-CF x -CNT/CoPc-NH2 photoelectrode optimised the overpotential due to the ideal photovoltage compared to the most efficient catalysts available (Fig. 32(k)). Overall, optimization of the microenvironment in catalytic reactions can improve the reaction efficiency, stability, and selectivity, and has broad application prospects. 5 Reaction step analysis of PEC OER and CO2RR based on theoretical analysis and in-situ characterization The main theoretical approaches to analyzing PEC reaction mechanisms include density functional theory (DFT) calculations, COMSOL simulations and machine learning. DFT calculations involve solving the quantum mechanical equations that control the behavior of electrons within a material, providing insights into the electronic structure, energetics, and reaction pathways of PEC systems. COMSOL Multiphysics is a powerful finite element analysis, solver, and simulation package for a variety of physics and engineering applications. Computational algorithms are used to simulate the behavior of PEC systems, enabling the prediction of material properties, reaction kinetics and reactions. Machine learning methods use algorithms to analyse large datasets of experimental and theoretical PEC data, extract patterns and correlations to predict reaction mechanisms, determine optimal reaction conditions, and design efficient PEC catalysts. These analytical methods provide complementary insights into the complex processes behind PEC reactions, facilitating the rational design and optimization of photoelectrode and PEC systems for renewable energy conversion and environmental applications. 5.1 Reaction step analysis of PEC OER and CO2RR based on DFT calculation DFT calculations can aid in identifying adsorption sites and configurations on the catalyst surface, revealing the interaction mechanism between the catalyst and reactants [ 60,275,276 ]. Calculation of reaction energy barriers and free energies on various catalyst surfaces can assess the catalytic activity and stability of catalysts, providing guidance for designing and optimizing efficient PEC OER catalysts. The OER process involves four basic reaction steps, which include different intermediate products (*OH, *O and *OOH, * denoting the active site of the catalyst) [ 124,125,277–280 ]. Song et al. [ 140 ] performed relevant theoretical calculation models based on different BiVO4-based photoanode. The results showed that the energy barrier of MoO x /MQD/BiVO4 is lower after the simultaneous introduction of MQD and MoO x on the BiVO4 surface (Fig. 33(a) ). The energy barrier for the conversion of MoO x /MQD/BiVO4 from *OH to *O can be plummeted to 0.63 eV at standard potential. The minimum free energy barriers of MoO x /MQD/BiVO4 indicate that simultaneous loading of MQD and MoO x can improve the PEC OER performance of the system (Figs. 33(b)–(d)) [ 139 ]. They also did DFT calculation analysis in another work, as shown in the constructed model (Fig. 33(e)). Theoretical calculations indicate that Co is the main active site for the PEC OER reaction, and the introduction of NiO between BiVO4 and Co-agzif-62 can induce a rapid charge transfer to Co-Ag Zif 62 for the PEC OER reaction (Figs. 33(f)–(h)). Chen's group [ 158 ] investigated the effect of surface sulfur vacancies on the PEC OER process and discussed the reaction mechanism utilizing DFT calculations. The maximum Gibbs free energy difference for pure CdIn2S4 (Fig. 34(a) , ΔG 3 = 2.418 V, η OER = 1.123 V) appears during the OOH* formation from O*, demonstrating that the adsorption of OOH* on CdIn2S4 is the reaction energy-determining step in the PEC OER process. Furthermore, although the potential determination process of Vs-CdIn2S4 remains unchanged, the Gibbs free energy decreases to 2.064 eV, resulting in η OER has significantly decreased. This phenomenon suggests that surface sulphur vacancies can reduce the formation energy of OOH* and thus the overpotential of the PEC OER (Fig. 34(b)). Fig. 34(c) indicates that the Fermi level and bandgap of Vs-CdIn2S4 under the bias voltage condition of 1.23 V do not change very much, further elucidating that the photon wells generated by the sulfur vacancies can enhance the PEC OER performance. To further elucidate the effect of trap states on the photogenerated electron transfer process in the PEC OER process, the sulphury vacancy-induced photogenerated electron jump from the mixed highest occupied molecular orbital (HOMO) state to the lowest unoccupied molecular orbital (LUMO) state has been studied. As illustrated in Fig. 34(d), the charge densities of the mixed HOMO states do not change much, while the charge densities of the mixed LUMO states show a very significant increase in the sulfur vacancies near the In and Cd atoms. This phenomenon indicates that more charge densities within the Fermi energy level are generated in the LUMO state, which is beneficial to enhance the catalytic activity of the material. Ismail et al. [ 141 ] calculated the thermodynamic free energy diagram of the PEC OER. The side-view structures of *OH, *O and *OOH absorbed on the surface of SAs Pt: Fe2O3 are shown in Fig. 34(e). The calculated data indicate the existence of two OER paths (first OER path: Pt-OH → PtOOH → PtOOH): Pt-OH → PtOFe → PtOOH → O2; and the second OER path: Pt-OH → PtO → PtOOH → O2 on the SAs Pt: Pt: Fe2O3 surface). In conclusion, the analysis of the PEC OER process using DFT calculations not only efficiently analyzes the active site, but also analyzes the reaction-determining step based on the change of ΔG, which is beneficial for a deeper understanding of PEC OER. The analysis of photoelectrocatalytic oxygen-analysis reactions (PEC OER) using DFT calculations has the advantages of atomic-level resolution, adsorption and reaction free energy calculations, electronic structure analysis, prediction of photoadsorption properties, and applicability to complex systems. These advantages can provide an in-depth understanding of the photoelectrocatalytic reaction mechanism and catalytic material properties and provide theoretical guidance for optimizing photoelectrocatalytic systems and designing efficient photoelectrocatalytic catalyst. Reaction step analysis is an important process to study CO2RR, and the effect of catalysts on CO2RR and the reaction mechanism can be explored in depth through the study of different intermediates and related ΔG [ 63,281–284 ]. Li et al. [ 285 ] synthesized S vacancy-containing CuIn5S8 materials with Cu-In double sites in order to achieve very high photocatalytic activity for CO2 reduction for CH4 production. Briefly, Cu and In atoms can act as dual active sites in VS-CuIn5S8 materials to form COOH* intermediates more efficiently (Figs. 35(a), (b) ). This phenomenon contributes to lowering the reaction energy barrier of VS-CuIn5S8 to improve catalytic activity. Yang et al. [ 225 ] investigated the PEC CO2RR mechanism of metal single-atom-porphyrin structures by using DFT calculations on them. Research has found that in the dark state, external electrons can only reach LUMO, so a high overpotential is necessary to generate a HOMO-LUMO energy gap (Fig. 35(c)). Moreover, the energy required for T1 state is obtained from the adsorption of light, without the need for electricity (Fig. 35(d)). The T1 state has an energy of 1.7 eV higher than the S0 state, resulting in a decrease in overpotential of approximately 130 mV (Fig. 35(e)). Figs. 35(f) and (g) display the optimized structures of pure Pt(111) and Ti3O6H6/Pt(111) surfaces for CO2 adsorption, respectively. In addition, differential charge density (DCD) was detected, as indicated in Fig. 35(h) [ 221 ]. The results indicated that many electrons were transferred from the interface to the CO2 molecules to form activated *CO2-anions, which ultimately enhanced the CO2 reduction activity. Fig. 29(i) indicated the Gibbs free energies obtained by DFT calculations for PEC CO2RR reduction on Pt(111) and Ti3O6H6/Pt(111). On pure Pt(111), the value of the free energy change (ΔG) for the CO2 activation to form the *COOH intermediate is 5.08 eV, which is the decisive step for the whole reaction process. Mi's group [ 218 ] analyzed the PEC CO2RR by DFT calculation. The calculated energy barrier for CO2RR conversion to CO for AgCl and AgBr is lower than that for Ag (Fig. 36(a) ) due to their different reaction energy barriers in the critical step of converting CO2 to *COOH intermediates. Meanwhile, the projected density of states (PDOS) of the surface silver species was calculated (Fig. 36(b)). The results indicate that the lower energy of the 4d state of the Ag element in AgBr and AgCl implies that these Ag+ bind strongly to the *COOH intermediates and form *COOH with a lower energy barrier, which can effectively facilitate the PEC CO2RR reaction. Wei et al. [ 227 ] conducted a theoretical study on the adsorption free energy of intermediate products in the CO2RR reaction using density functional theory, confirming that external light can effectively reduce the energy level of RDS during CO2 reduction. Reduction of CO2 adsorption form CO is mainly adsorption of CO2 and formation of *COOH and *CO through carrier transfer to form CO at the Co center site (Fig. 36(c)). Fig. 36(d) demonstrates that the generation of *COOH is the RDS of Co-Bpy-COF-Ru1/2. The energy barrier for formation of *COOH on the surface of Co-Bpy-COF-Ru1/2 decreases dramatically from 1.16 to 0.25 eV when under light conditions. This phenomenon was also demonstrated by the experimental results, i.e., FECO, j CO and TOF were higher under light conditions than under dark conditions, further revealing that visible light illumination conditions are an important influencing factor in enhancing the catalytic activity. Zhou et al. [ 14 ] have theoretically explained the synergistic effect of GaN NWs and Sn NPs by DFT calculations, thus promoting the catalytic activity of the system. The DCD is illustrated in Fig. 36(e). Charge density rearrangement occurs near the interfacial region, a phenomenon that suggests strong electronic coupling between the Sn NPs and GaN NW materials. The results showed that the presence of ionic Ga–O bonds and covalent Sn–N bonds between Sn NPs and GaN NWs altered the electronic structure at the interface to a certain extent, which may play a key role in the PEC CO2RR. In order to conduct a deeper investigation of the synergistic interaction between GaN NWs and Sn NPs, the CO2 adsorption around the Sn13O26/GaN(101‾0) interface was explored. As shown in Fig. 36(f), the presence of covalent and ionic bonds at the Sn13O26/GaN(101‾0) interface leads to the reduction of CO2 to *CO and *O. The total energy diagram for the reduction of CO2 to HCOOH and the corresponding fully relaxed conformation is shown in Fig. 36(g). During the reaction, *COOH is reduced to HCOOH in four steps by the active hydrogen produced by water splitting. In conclusion, DFT calculations can reveal the reaction mechanism of PEC CO2RR, including adsorption state, insertion reaction, and addition reaction. By calculating the energies and reaction paths of the intermediate states, the steps of electron transfer and chemical bond formation can be clarified, providing theoretical guidance for optimizing the PEC CO2RR reaction. Meanwhile, the product selectivity of PEC CO2RR can also be predicted, and the free energy of generation of each product can be calculated based on the various adsorption configurations on the catalyst surface, to predict the ratio of the main products and by-products. This helps to optimize the catalyst and reaction conditions to improve the selectivity of CO2RR. This can provide an in-depth understanding of the PEC CO2RR reaction mechanism and catalytic material properties and provide theoretical guidance for optimizing photoelectrocatalytic systems and designing efficient PEC CO2RR catalysts. 5.2 Reaction step analysis of PEC OER based on COMSOL simulations With COMSOL, researchers can simulate real-world systems, optimize their design and predict the performance of their products under different reaction conditions. It is widely used in the automotive, aerospace, electronics, energy, catalysis, and biomedical industries. It has a broad application prospect and high research value [ 22 ]. Wu et al. [ 286 ] enhanced the photoelectrocatalytic activity of the system by designing amorphous B-doped TiO2 and used COMSOL simulation to analyse the potential changes induced by potentiodynamic field polarization in the internal structure of different samples. As shown in Fig. 37(a) , the TiO2 crystal structure was assumed to be neatly arranged. Each 20 × 20 × 20 nm model is in the same state in the electric field. Figs. 37(b) and (c) both show the variation of lattice parameters in the disordered state and after B doping. The dipole orientation of all three structures is disordered and distributed in the direction of the electric field before and after polarization, respectively, and the electric field inside the material is strong after polarization. However, after removing the electric field, completely different dipole distributions are observed in the three models. Overall, i.e., a higher sustained residual polarisation-induced electric field leads to band bending and generates a stronger potential difference, which results in a faster separation of photogenerated electron-hole pairs and improved catalytic activit. These simulation results further validate that amorphous/crystalline heterojunction and oxygen vacancies can effectively modify the structure and electrical conductivity of TiO2, providing a theoretical basis and a feasible strategy for the study of TiO2 modification. Based on COMSOL simulations, Zhang's group [ 287 ] proposes to construct three-dimensional photonic crystal structures with feature sizes to synchronously modulate the light absorption and carrier collection properties of photoelectrodes to enhance the photoelectrode performance. Figs. 37(d)–(i) show the 2D optical models of different films. According to the formula describing the spatial distribution of light intensity, a larger electric field intensity indicates increased light transmission and reduced light absorption. Based on the COMSOL simulation results, they concluded that io-CBO 200 (feature size 200 nm) will exhibit stronger PEC performance for CO2 reduction, while Planar-CBO has the worst performance. It was also shown by testing the PEC CO2RR performance that io-CBO 200 exhibits a higher stability of about 2.67 times that of the thin film photocathode (Fig. 37(j)). This work demonstrates the enhancement of PEC CO2RR performance by fast carrier transfer from a theoretical point of view, which provides a feasible idea and strategy for the modification of the catalyst. In conclusion, com simulation explores the tuning of reaction conditions by realistically simulating the reaction environment of the system, thus providing theoretical ideas and feasible strategies for designing efficient catalysts. 5.3 Reaction step analysis of PEC OER based on machine learning Machine learning (ML) is a branch of artificial intelligence (AI) that enables computers to “self-learn” from training data and improve over time without explicit programming. Machine learning algorithms can detect patterns in data and learn from them to make predictive behaviors. Machine learning techniques can be used to filter out the best of hundreds or thousands of conditions that can be used to predict the optimal catalyst composition and structure, electrode morphology, and reaction conditions to improve efficiency and selectivity. The combination of machine learning and photoelectrocatalysis holds great promise for advancing renewable energy technologies and solving environmental challenges through the analysis of large datasets including material properties, reaction kinetics and experimental conditions [ 288–294 ]. Gao et al. [ 295 ] summarise the challenges and current advances in ML in materials science, categorising and highlighting design strategies. Although cross-cutting research in materials science related to machine learning shows strengths, there are still challenges that need to be properly addressed and deeply understood. To this end, the authors summarise strategies for applying ML to materials science: increasing the amount of data, ML processing of feature studies (enhancing feature analysis optimisation, exploring relationships between features, classifying features into different categories, identifying material feature attributes), development of specialised algorithms for materials science, optimising and evaluating learning models, and development of open-source materials packages and ML frameworks. Screening and prediction by machine learning can bring reference and guidance to catalyst development (Fig. 38(a) ). Wang and co-workers [ 296 ] report the application of ML to study key criteria for dopant selection to improve PEC performance in photoelectrodes. They used hematite Fe2O3 as a prototypical semiconductor candidate to train ML models using data obtained from 17 dopants, each containing five unique dopant concentrations. In the ML study, 10 intrinsic features (e.g. atomic number, ionic radius, chemical valence, etc.) and one processing feature (dopant concentration) were used as descriptors and six different algorithms were applied, including baseline linear regression (LR), random forests (RF), gradient boosting (GB), support vector regression (SVR), k-nearest-neighbour regression (KNN) and neural networks (NN). This work shows that machine learning (ML) is expected to provide predictable insights into dopant selection for high-performance PEC systems, which can reveal the correlation between many characteristics of the dopant and the performance of PECs with doped photoelectrodes (Fig. 38(b)). Overall, machine learning has broad application prospects and research value in the future, and can provide researchers with greater reference significance in screening and prediction, and the combination with photoelectrocatalysis holds great promise for advancing renewable energy technologies and solving environmental challenges. 5.4 In-situ characterization of PEC OER and PEC CO2RR Commonly used in-situ characterization methods include in-situ infrared, in-situ Raman, in-situ XPS, in-situ synchrotron radiation, etc. In-situ characterisation is dynamic, real-time and intuitive. It enables the study of catalytic reactions in a transient state, and the results are irreplaceable for the selection and design of catalysts. In addition, in-situ characterisation allows real-time observation of the process, structure and morphology of chemical reactions, and the acquisition of information such as reaction intermediates, which helps researchers to analyse the reaction mechanism, and thus promotes the further development of chemistry and materials science. Venugopal et al. [ 297 ] chose BiVO4 as a model photoanode to study the metal oxide/electrolyte interface using operational photoelectrochemical attenuated total reflection Fourier transform infrared spectrum (PEC-ATR-FTIR). Fig. 39(a) shows the device they developed to measure the PEC-ATR-FTIR spectra. In Fig. 39(b), the PEC-ATR-FTIR spectra are positively tilted with time during photocharging. It is due to the Drude absorption of free electrons into the infrared, which increases at low wavelengths. Therefore, the spectral slope increases with time and the concentration of photogenerated electrons in BiVO4 gradually increases during photocharging. Fig. 39(c) compares the spectra of BiVO4 after photocharging in borate buffered electrolyte and ultrapure water. The results show that the concentration of hydroxyl/water species at or near the surface increases with the course of photocharging. When an anodic potential is applied under light conditions, dissolution of Bi and V is observed, and the difference in the rate of dissolution of V/Bi under light alters the surface elemental content ratio and leads to the formation of a Bi enriched surface on the pristine bulk BiVO4. In addition, the spectrum results also indicate that the decrease in vanadium concentration is an interfacial process and occurs only at the BiVO4/water interface. Landaeta and co-workers [ 298 ] synthesised plasma dendritic electrodes of silver and cuprous oxide (Ag/Cu2O) and observed the conversion of CO2 to the value-added compound acetate in the PEC CO2RR process by in situ Raman spectrum and explored the changes in the surface of the catalyst and the reaction mechanism. Fig. 39(d) shows the trend of the spectra recorded from a CO2 saturated solution under LED illumination over time, with peaks occurring that are thought to correspond to functional groups or chemical bonds corresponding to those found in the literature. It is noteworthy that the peak corresponding to acetate changes significantly, which proves that the concentration of acetic acid gradually increases as the reaction proceeds. When potential of –0.4 V was applied, the bands of the Cu2O surface species disappeared, indicating rapid surface activation with the adsorption of CO2 molecules. Analysis of the intensity of the CO band during the reaction using surface-enhanced Raman scattering (SERS) spectroscopy (Fig. 39(e)) shows that the CO concentration on the surface of the catalyst increases rapidly at the beginning of the reaction, and then decreases and stabilises when it reaches the maximum value. The deconvolution of the *CO peak (Fig. 39(f)) indicates that at least two different interactions are detected at the electrode. With a gradual change in the applied potential, the intensity of the *CO band shifts to high frequencies and the low-frequency component disappears. The result demonstrates the important influence of Cu on the selectivity during the reaction. SERS detection of CO on Ag/Cu2O/pentanethiol electrodes showed that the addition of pentanethiol could favour the formation of acetate (Fig. 39(g)). In addition, formate and acetate signals were still detected even at low potentials, demonstrating that the PEC CO2RR activity at low potentials remained unaffected. It could be that photogenerated electrons reached the Cu2O surface to promote PEC CO2RR. Liu et al. [ 299 ] proposed the preparation of sub-nanometer alumina layers (~0.45 nm) by atomic layer deposition to enhance the turn-on voltage of nanowire-structured zinc ferrites. Through a series of in situ characterization means, the team explored the formation and distribution of surface states in zinc ferrites and their effect on the properties. Fig. 40(a) shows the operando UV-visible spectra measured in the absence of light in the range 350–750 nm, centered around 455 nm. It can be surmised that the high-valent iron cation (4-valent) intermediate state formed during the aqueous oxidation reaction may be this surface state. Ding's group [ 300 ] modified BiVO4 photoanodes by Fe doping and caffeic acid/nickel iron oxide (CA/NiFe) modification and detected the active species in the PEC reaction using in situ infrared spectrum. The results show that the characteristic absorption peaks attributed to the O2 –* and OOH* actives are significantly enhanced as the reaction proceeds. It indicates that under light conditions, water molecules adsorbed on the catalyst surface first pass through the photogenerated holes and then dissociate at the Fe and Ni active sites to produce OOH, which is subsequently transformed into active species (O2 – and ·O2 –) and finally into O2 (Fig. 40(b)). Liu et al. [ 301 ] investigated proton-coupled electron transfer (PCET) for water oxidation on five photoanodes and Ni1–x Fe x OOH-modified silicon (Si) by combining rate law analysis of H2O molecules with H/D kinetic isotope effect (KIE) and in situ spectroscopic studies. The PEC OER mechanism and limiting factors were explored, which in turn elucidated the reaction kinetics. For the α-Fe2O3 photoanode, it is shown that the ·OH adsorbed on the α-Fe2O3 surface is consumed during water oxidation (Fig. 40(c)). The result confirms the involvement of H2O molecules as direct reactants in the water oxidation on Ni1–x Fe x OOH/α-Fe2O3 photoanodes and verifies the mechanistic transition from sequential proton-electron transfer (SPET) to concerted proton-electron transfer (CPET) after Ni1–x Fe x OOH modification. The same ATR-FTIR measurements were carried out in CH3CN/D2O mixed electrolyte, which is consistent with the above mechanism. The signal peaks in Fig. 40(d) indicate that the asymmetric and symmetric telescopic vibrations of α-Fe2O3 and OD adsorbed on the Ni1–x Fe x OOH/α-Fe2O3 surface are related to the asymmetric and symmetric telescopic vibrations, which confirms that the hydrogen-bonded H2O molecules are consumed on the Ni1–x Fe x OOH/α-Fe2O3 surface. The infrared results show that pristine α-Fe2O3 can oxidise OH adsorbed by dissociatively adsorbed H2O, while Ni1–x Fe x OOH/α-Fe2O3 can oxidise hydrogen-bonded H2O molecules and adsorbed OH. This work demonstrates that Ni1–x Fe x OOH can modulate PCET, altering the PEC OER reaction mechanism at the surface, and elucidates an effective strategy to regulate PCET kinetics of water oxidation at semiconductor surfaces. 6 Comparison between PEC technology and other catalytic technologies Electrocatalysis, photocatalysis and photoelectrocatalysis have been described in the above section, however, other catalytic technologies are also relevant and used in industrial production. These include thermal catalysis and enzyme catalysis. The combination of photocatalysis and thermocatalysis has led to the development of photothermal catalysis, which has many similarities with enzymatic catalysis. In the next section, we will introduce thermal catalysis, enzyme catalysis and photothermal catalysis and compare them with PEC technology. 6.1 Thermocatalysis Thermal catalysed reaction is a kind of chemical reaction carried out at high temperatures, which uses a catalyst to lower the energy threshold of the reaction, thus increasing the rate and efficiency of the reaction. This reaction principle is widely used in the chemical industry, environmental protection, and energy fields, and has brought many conveniences and benefits to human production and life [ 302–307 ]. Thermal catalysts can change the reaction route of a reaction, allowing the rate and efficiency of the reaction to be increased. The principles of thermo-catalysed reactions are based on the theories of chemical kinetics and physical chemistry and include a variety of mechanisms such as surface catalysis, redox, and acid-base catalysis. Thermal catalysis technology can use catalysts to convert fuels such as natural gas and coal gas into liquid fuels or chemicals, increasing energy efficiency and reducing pollution emissions. In addition, thermocatalytic reactions can be used in the preparation of hydrogen, the synthesis of liquid fuels and the preparation of biomass fuels. These applications can improve energy sustainability and reduce energy costs, providing an effective solution to human energy needs. In conclusion, the principle and application of thermocatalytic reaction are very extensive, and it brings much convenience and benefits to human production and life. In the future, with the development of science and technology and the increasing demand of human beings for environment and resources, thermal catalysed reaction will have broader application prospects and more far-reaching significance. 6.2 Photothermal catalysis Photothermal catalysis is a new technology integrating photocatalysis and thermal catalysis proposed by scholars in recent years. Photothermal catalytic reaction can not only improve the efficiency of catalytic reaction, but also transform the low-density solar energy into high-density chemical energy [ 308–317 ]. Photothermal catalysis can be divided into three main categories: (1) thermally assisted photocatalytic reaction, mainly driven by light, the catalyst itself does not have thermal catalytic activity, and thermal energy helps to further reduce the apparent active energy of photocatalysis; (2) light-assisted thermocatalytic reaction, heat energy is the main driving force of the whole reaction, light radiation mainly plays the role of raising the local temperature, and photochemical effects may exist simultaneously; (3) photothermal coupled catalysis, where the heat released by the photothermal effect can promote the reaction process, and the photochemical effect enhances the apparent activity, and the synergistic effect of thermochemistry and photochemistry is not just a simple addition of the two reactions, but exceeds the sum of the photocatalytic and thermocatalytic activities. Zhang's group [ 318 ] prepared a series of novel CoFe-based catalysts (denoted as CoFe-x by H2 reduction of CoFeAl-LDH nanosheets at different temperatures and explored the photothermally catalysed CO2 hydrogenation performance under simulated solar excitation. Under the light condition, the synthesized catalysts showed a maximum CO2 conversion of 78.6%, a selectivity of 35.26% for C2+ and a good stability (Fig. 41(a) ). Yao et al. [ 319 ] combined carbon-based solid acids with interfacial solar heating to propose a new interfacial photothermal catalytic system with non-homogeneous catalysts to improve the conversion efficiency of the esterification reaction (Fig. 41(b)). Due to the heating effect of the interface of the SGA in the system in the presence of light, the resulting ethyl acetate will evaporate rapidly, which leads to a fast reaction, thus increasing the yield of EA. Lou and colleagues [ 320 ] converted aged spent lithium cobalt oxide (LCO) cells into a photothermal catalyst, and the catalyst could facilitate the recycling of waste polyester. Fig. 41(c) summaries the photothermal catalyst for upgrading waste LCO into waste polyester for up-cycling. With this technology, profit margins can be generated by converting waste or pollutants into high-value chemical products, and the profit margins generated can be doubled when the catalyst life is extended. With this technology, profit margins can be generated by converting waste or pollutants into high-value chemical products, and the profit margins generated can be doubled when the catalyst life is extended, demonstrating the promise and value of industrialising photothermal catalytic technology. With this technology, profit margins can be generated by converting waste or pollutants into high-value chemical products, and the profit margins generated can be doubled when the catalyst life is extended, demonstrating the promise and value of industrialising photothermal catalytic technology. Zhang's group [ 321 ] also successfully obtained a series of novel Co-containing photothermal catalysts by H2 reduction of ZnCoAl-LDH at different temperatures. The product selectivity of CO hydrogenation under photoluminescence can be tuned according to the reduction temperature (Fig. 41(d)), among which the Co-450 catalyst achieves the most excellent FTO performance, with C2+ products selectivity of 41.9%. 6.3 Enzyme-catalysed Enzymes are proteins that act as catalysts, initiating and accelerating these chemical reactions and ensuring that the results of these chemical reactions are consistent. Enzymatic reactions (also known as enzyme-catalysed) are chemical reactions catalysed by a special class of proteins called enzymes. Since the rate of non-catalytic reactions is particularly slow, catalysis of biochemical reactions in cells is extremely important. The mechanism of enzyme catalysis is very similar in principle to other types of chemical catalysis. Enzymes reduce the energy requirements to reach the highest energy transition state by providing alternative reaction routes and by stabilising intermediates [ 322–331 ]. Enzymes live in a very benign environment in living organisms, essentially in aqueous solution, with an approximate neutral pH, a low concentration of salts, and a temperature close to room temperature. These advantages offered by enzyme catalysis are what make it promising for future industrialisation. Enzyme-catalysed reaction has very high transferability, high production efficiency, can reduce the consumption of chemical reagents and organic solvents, and produce less waste and by-products, will not cause greater pollution to the environment, these enzyme-catalysed has the advantages of the future industrialisation of its prospects [ 332 ]. In recent years, biocatalysts have achieved rapid development and simplified design and synthesis routes as theoretical calculations and characterisation techniques have been investigated to meet the growing demand in catalysis. Current research strategies for biocatalysts include screening for natural diversity, directed design, redesign mechanisms, and calculations from a theoretical perspective (Fig. 42 ) [ 332 ]. Enzyme catalyst is also a kind of biocatalyst, these strategies can also be applied to the study of enzyme catalysts. Currently, enzyme catalysts are potentially valuable as mild, environmentally friendly catalysts with unique catalytic mechanisms and reaction conditions for large-scale industrialisation. 6.4 Photoenzymatic catalysis Photo-enzymatic catalysis is a combination of enzyme catalysis and photocatalysis, which integrates the diverse reactivity of visible light chemistry and the high selectivity of enzymes, solving to a certain extent the problems faced by visible light catalysis and enzyme catalysis respectively, and at the same time realising the highly efficient, sustainable, and green manufacturing of high value-added compounds through the integration of their respective advantages [ 333–349 ]. On the one hand, based on the active chemical intermediates generated by visible light catalysis under mild conditions, photo-enzyme catalysis is not only capable of utilising light regeneration cofactors to exert the natural activity of enzymes, but also triggering the unnatural reaction activity of enzymes to obtain new functions. On the other hand, by taking advantage of the high selectivity and directional evolvability of enzyme catalysis, photo-enzymatic catalysis is able to modulate light-triggered reactive intermediates, thus providing new solutions to the stereochemical control challenges in the field of photochemistry. Although photo-enzymatic catalysis is just emerging, the strategy has already shown great application prospects in synthetic sciences. At present, photo-enzymatic catalysis has been successfully used to catalyse important biochemical reactions such as carbon-carbon, carbon-nitrogen, carbon-oxygen, carbon-halogen bonding, etc., and has demonstrated its unique advantages in terms of catalytic activity, reaction selectivity, and substrate spectrum expansion. Sun et al. [ 350 ] established the enantiomeric decarboxylative alkylation of amino acids with α-heterocyclic olefins by a synergistic combination of ‘ene'-reductase (EREDs) and photoredox catalysis (Fig. 43(a) ). The scheme is extremely innovative with excellent chemical and enantioselectivity as well as a wide range of substrates. Overall, this synergistic approach provides an innovative mechanism for radical generation and extends the types of reactions that can be achieved asymmetrically using non-natural enzyme catalysis. As a family of enzymes with many members, pyridoxal 5′-phosphate (PLP)-dependent enzymes have diverse structures and functions and can catalyse C–C and C-heteroatom bonding reactions at the α, β, and γ positions of amino acids through a carbonyl-catalytic mechanism (Fig. 43(b)). Using a synergistic catalytic strategy of photoredox catalysis and pyridoxal 5'-phosphate (PLP) biocatalysis, Yang's group [ 351 ] developed a pyridoxal radical biocatalytic method to prepare valuable unnatural amino acids and construct unnatural amino acids with two or three stereocentres without the need for a protecting group (Figs. 43(c) and (d)). The experimental results proved the feasibility of their strategy, and it is worth mentioning that L-amino acids and D-amino acids can also be obtained by the photo-enzymatic catalysis technique. This synergistic catalytic strategy provides a new idea for the study of asymmetric catalytic radical intermediates. Yang's group [ 352 ] designed fatty acid photodecarboxylases to catalyse the formation of the C–C bond of unnatural photoredox radicals using strong oxidative excited state flavonoid quinone cofactors. Through genome mining, rational design and directed evolution, a series of radical photocyclases were developed to facilitate the cyclisation of decarboxylated radicals with excellent chemoselectivity, enantioselectivity and stereoselectivity (Fig. 43(e)). Chen and coworkers [ 353 ] integrated the three-linear state energy transfer, a typical photocatalytic mode, into proteins, and inserted functionally modified non-natural amino acids into proteins through genetic reprogramming to create artificial photoenzymes containing three-linear state photosensitisers, which successfully catalysed the intramolecular [ 2+2 ] photoexcited cycloaddition reaction of indole derivatives (Fig. 43(f)). This study extends the energy transfer reaction activity of artificial trilinear-state photoenzymes in supramolecular protein cavities and opens a valuable integrative approach to enantioselective photochemical synthesis that achieves goals that could not be achieved by the synthetic or biological domains alone. In conclusion, photocatalysis can be combined with other catalytic technologies to produce new technologies, such as photoelectrocatalysis, photothermal catalysis, and photo-enzymatic catalysis. This cross-disciplinary idea can be used in all aspects of catalysis, thus providing feasible strategies and future research prospects for solving the problems of high efficiency, environmental protection, and cost of catalysts. 7 Conclusions and perspectives Currently, electrocatalytic technology is well established for industrial and commercial applications [ 354,355 ], while the industrial application of photocatalytic technology still needs a lot of exploration to enhance the reaction efficiency. However, electrocatalytic technology requires a large amount of electrical energy to ensure the continuity of the reaction. The use of large quantities of electricity will inevitably involve the use of fuel or nuclear power generation to supply sufficient capacity, which not only increases production and technology costs, but also carries the risk of polluting the environment. The use of wind or water energy may change this situation, however, not all environments are suitable for generating electricity from these two energy sources. Whereas light energy is a primary energy source, the use of solar energy for photocatalytic reactions greatly reduces production costs and the risk of environmental pollution [ 356 ]. However, photocatalysis cannot be used on a large scale due to the difficulty of its industrialisation. Firstly, the evaluation standards of photocatalytic performance are not the same, such as the amount of catalyst, the concentration of reaction solution, the intensity of light, the range of wavelengths and so on, which is also the difficulty in evaluating the performance of photocatalysis. Secondly, the efficiency of photocatalysis is not satisfactory, mainly because the compound rate of photogenerated electron-hole pairs is too fast, which affects the catalytic activity and hinders its industrialisation. Finally, the large-scale use of photocatalysts requires high light absorption efficiency and, most importantly, high absorption efficiency of visible light to achieve industrial production. In summary, photocatalytic technology still needs a lot of research work before it can meet the challenge of industrialisation. In view of this, the use of photoelectrocatalytic technology to combine the technical characteristics of photocatalysis and electrocatalysis and improve the shortcomings of both will become the trend of catalytic technology in the future [ 357,358 ]. PEC technology with the advantages of environmental protection, energy saving and controllable material cost, the reaction process can be optimized, and large-scale industrial application is expected to be realized in the future. On the one hand, PEC technology can solve the shortcomings of photogenerated electron-hole pair compounding rate and long reaction time in photocatalysis; on the other hand, PEC technology can reduce the overpotential required for the reaction under high current density in electrocatalytic process, which saves electricity and improves the efficiency of the reaction at the same time. Meanwhile, the core advantage of PEC technology is that the reaction process is mild and has little pollution to the environment. The catalyst itself does not cause secondary pollution to the environment, which makes this technology has a broad application prospect in the future. Moreover, the economic benefits of PEC technology have been demonstrated in the literature, which makes the industrialization of PEC technology feasible in the future. This review focuses on the fact that PEC technology can be applied to CO2 reduction and water oxidation reactions, and on this basis the industrialisation of PEC technology can be promoted (Tables 3 and 4 ). For example, high-value organic products are prepared by PEC CO2RR. Through PEC oxidation technology or inverse reactions, other related reactions can be derived, such as urea oxidation (UOR), glycol oxidation (GOR) and oxygen reduction reaction (ORR) can be applied to industrial production, and ORR reactions can be applied to produce zinc-air batteries. All these applications have industrialisation value and prospects, creating economic benefits as well as achieving green environmental protection. In the future, PEC technology will be oriented towards intelligence, innovation, and environmental friendliness to meet the challenges of future industrialisation, thus achieving a “win-win” situation in terms of income generation and environmental protection (Fig. 44 ). We hope that this review will help others to understand the principles better and faster, commonly used materials, application prospects and development trends of PEC technology. Based on this review, we would like to provide reference and ideas for researchers to enrich their knowledge and viewpoints on PEC technology. In recent years, with the development of PEC technology, both experimental and application phases have achieved stage-by-stage results, especially the use of clean energy for chemical reaction process is highly favored by countries around the world. However, it still has problems to be solved as to how to improve the catalytic activity of PEC technology and realize industrialization. Based on this review and the referenced literature, we propose the problems and research priorities for the future development of PEC technology: (1) According to the current research results, the PEC activity of noble metal-based materials, such as Au, Ag, Pt, and Pd, is stronger than that of most of the elements, however, the noble metals are limited by their high mining cost and low storage capacity, which restrict their development in the field of PEC. In view of this, the future development of PEC is favorable through the mining and use of elements with abundant reserves, such as transition metal elements such as Fe, Co, NI, Cu, and Zn, rare earth elements such as Ce, Ga, and La, as well as carbon materials. These elements are abundantly stored in the earth, and the mining cost is relatively controllable, which is expected to realize industrialization and industrial application. For example, common materials such as GaN, α-Fe2O3, CeO2, BiVO4 and Cu2O are synthesized with simple methods and mild conditions, which are conducive to controlling the cost and realizing mass production. In addition, efforts should be made to develop catalysts with fast reaction kinetics, high selectivity, and good stability, and the synthesis methods should be selected with high yields so that mass production can be realized in industry. (2) Although the use of non-precious metal-based catalysts is beneficial to achieve cost control, however, the catalytic activity of non-precious metal-based catalysts is still inferior to that of precious metal catalysts, which requires the modification of non-precious metal-based catalysts to achieve efficient catalytic processes. For example, by modifying the inherent properties of crystals such as exposed crystal faces, crystal phases, and defects; compounding other materials to form heterojunctions; and forming single atoms on the surface. By using these methods, the catalytic activity of non-precious metal-based materials can be improved so that their performance is comparable to that of precious metal-based catalysts. However, the enhancement of catalytic activity is still a great challenge, so a lot of research and experiments are needed. (3) Although a great deal of work has been done on PEC, however, the reaction mechanism of the PEC process still needs to be explored in depth. Most of the reported work on the reaction mechanism of PEC is still based on pure photocatalysis and pure electrocatalysis, and the influence of the synergistic effect of PEC on the reaction process has not been deeply explored. For example, the influence of the synergistic effect of PEC on the results of overpotential, product selectivity, and reaction yield of the reaction process. This needs to be analyzed in depth from the perspectives of the microstructure of the material, the reaction mechanism, and the reaction energy barriers. (4) Observation of the reaction process is also important. So far, a large amount of work has demonstrated the effect of reaction intermediates on catalytic activity. For example, analyzing the physical phase of a reaction by in situ infrared spectroscopy or in situ Raman can help to understand the catalytic interfaces and active sites, and to monitor the changes in catalysts and intermediates, thus revealing the reaction mechanism. Other in situ techniques such as transmission electron microscopy (TEM), atomic force microscopy (AFM), scanning probe microscopy (SPM), and synchrotron radiation can probe the changes in the interface and structure of materials during catalytic reactions to better understand the conformational relationship between catalyst structure and activity. (5) External reaction conditions also influence the PEC reaction process, such as: pH value, model of the reaction apparatus, reaction temperature, gas pressure and flow rate, and error of the detection device. Although these effects have not been emphasized in the current research work, these factors still have a certain degree of influence on the PEC reaction, so it is important to pay attention to these factors and add these conditions as detailed as possible in the manuscript or SI to provide a reference for others. In conclusion, as a kind of catalytic technology that can save energy and protect the environment, PEC technology still has important research significance and broad application prospect in the face of energy crisis and environmental pollution in the world nowadays, although it faces the challenges of research and development and industrialized application. References 1 R. Fan C. Liu Z. Li H. Huang J. Feng Z. Li Z. Zou Nat. Sustain. 7 2024 158 167 R. Fan, C. Liu, Z. Li, H. Huang, J. Feng, Z. Li, Z. Zou, Nat. Sustain., 2024, 7, 158–167. 2 Y. Liu X. Liu A.R. Jadhav T. Yang Y. Hwang H. Wang L. Wang Y. Luo A. Kumar J. Lee H.T.D. Bui M. Gyu Kim H. Lee Angew. Chem. Int. Ed. 61 2022 e202114160 Y. Liu, X. Liu, A. R. Jadhav, T. Yang, Y. Hwang, H. Wang, L. Wang, Y. Luo, A. Kumar, J. Lee, H. T. D. Bui, M. Gyu Kim, H. Lee, Angew. Chem. Int. Ed., 2022, 61, e202114160. 3 M.B. Ross P. De Luna Y. Li C.-T. Dinh D. Kim P. Yang E.H. Sargent Nat. Catal. 2 2019 648 658 M. B. Ross, P. De Luna, Y. Li, C.-T. Dinh, D. Kim, P. Yang, E. H. Sargent, Nat. Catal., 2019, 2, 648–658. 4 X. Tan J. Nielsen Chem. Soc. Rev. 51 2022 4763 4785 X. Tan, J. Nielsen, Chem. Soc. Rev., 2022, 51, 4763–4785. 5 X. Wang S. Xi P. Huang Y. Du H. Zhong Q. Wang A. Borgna Y.W. Zhang Z. Wang H. Wang Z.G. Yu W.S.V. Lee J. Xue Nature 611 2022 702 708 X. Wang, S. Xi, P. Huang, Y. Du, H. Zhong, Q. Wang, A. Borgna, Y. W. Zhang, Z. Wang, H. Wang, Z. G. Yu, W. S. V. Lee, J. Xue, Nature, 2022, 611, 702–708. 6 Z. Wang Y. Zhou P. Qiu C. Xia W. Fang J. Jin L. Huang P. Deng Y. Su R. Crespo-Otero X. Tian B. You W. Guo D. Di Tommaso Y. Pang S. Ding B.Y. Xia Adv. Mater. 35 2023 2303052 Z. Wang, Y. Zhou, P. Qiu, C. Xia, W. Fang, J. Jin, L. Huang, P. Deng, Y. Su, R. Crespo-Otero, X. Tian, B. You, W. Guo, D. Di Tommaso, Y. Pang, S. Ding, B. Y. Xia, Adv. Mater., 2023, 35, 2303052. 7 X. Xin Y. Li Y. Zhang Y. Wang X. Chi Y. Wei C. Diao J. Su R. Wang P. Guo J. Yu J. Zhang A.J. Sobrido M.M. Titirici X. Li Nat. Commun. 15 2024 337 X. Xin, Y. Li, Y. Zhang, Y. Wang, X. Chi, Y. Wei, C. Diao, J. Su, R. Wang, P. Guo, J. Yu, J. Zhang, A. J. Sobrido, M. M. Titirici, X. Li, Nat. Commun., 2024, 15, 337. 8 J. Yu H. Zhong Q. Zhang C. Wu X. Zhang S. Li Y. Zhao H. An Y. Ma Z. Yu S. Xi X. Wang J. Xue Appl. Catal. B 344 2024 123674 J. Yu, H. Zhong, Q. Zhang, C. Wu, X. Zhang, S. Li, Y. Zhao, H. An, Y. Ma, Z. Yu, S. Xi, X. Wang, J. Xue, Appl. Catal. B, 2024, 344, 123674. 9 M. Zhang K. Zhang X. Ai X. Liang Q. Zhang H. Chen X. Zou Chin. J. Catal. 43 2022 2987 3018 M. Zhang, K. Zhang, X. Ai, X. Liang, Q. Zhang, H. Chen, X. Zou, Chin. J. Catal., 2022, 43, 2987–3018. 10 W. Zhang J. Zhang N. Wang K. Zhu C. Yang Y. Ai F. Wang Y. Tian Y. Ma Y. Ma X. Zhang L. Duan D. Chao F. Wang D. Zhao W. Li Nat. Sustain. 7 2024 463 473 W. Zhang, J. Zhang, N. Wang, K. Zhu, C. Yang, Y. Ai, F. Wang, Y. Tian, Y. Ma, Y. Ma, X. Zhang, L. Duan, D. Chao, F. Wang, D. Zhao, W. Li, Nat. Sustain., 2024, 7, 463–473. 11 R.C. Armstrong C. Wolfram K.P. de Jong R. Gross N.S. Lewis B. Boardman A.J. Ragauskas K. Ehrhardt-Martinez G. Crabtree M.V. Ramana Nat. Energy 1 2016 15020 R. C. Armstrong, C. Wolfram, K. P. de Jong, R. Gross, N. S. Lewis, B. Boardman, A. J. Ragauskas, K. Ehrhardt-Martinez, G. Crabtree, M. V. Ramana, Nat. Energy, 2016, 1, 15020. 12 P.C. Stern K.B. Janda M.A. Brown L. Steg E.L. Vine L. Lutzenhiser Nat. Energy 1 2016 16043 P. C. Stern, K. B. Janda, M. A. Brown, L. Steg, E. L. Vine, L. Lutzenhiser, Nat. Energy, 2016, 1, 16043. 13 R. Chen Z. Ren Y. Liang G. Zhang T. Dittrich R. Liu Y. Liu Y. Zhao S. Pang H. An C. Ni P. Zhou K. Han F. Fan C. Li Nature 610 2022 296 301 R. Chen, Z. Ren, Y. Liang, G. Zhang, T. Dittrich, R. Liu, Y. Liu, Y. Zhao, S. Pang, H. An, C. Ni, P. Zhou, K. Han, F. Fan, C. Li, Nature, 2022, 610, 296–301. 14 B. Zhou X. Kong S. Vanka S. Cheng N. Pant S. Chu P. Ghamari Y. Wang G. Botton H. Cuo Z. Mi Energy Environ. Sci. 12 2019 2842 2848 B. Zhou, X. Kong, S. Vanka, S. Cheng, N. Pant, S. Chu, P. Ghamari, Y. Wang, G. Botton, H. Cuo, Z. Mi, Energy Environ. Sci., 2019, 12, 2842–2848. 15 Y. Lu B. Li N. Xu Z. Zhou Y. Xiao Y. Jiang T. Li S. Hu Y. Gong Y. Cao Nat. Commun. 14 2023 6965 Y. Lu, B. Li, N. Xu, Z. Zhou, Y. Xiao, Y. Jiang, T. Li, S. Hu, Y. Gong, Y. Cao, Nat. Commun., 2023, 14, 6965. 16 F. Lin M. Li L. Zeng M. Luo S. Guo Chem. Rev. 123 2023 12507 12593 F. Lin, M. Li, L. Zeng, M. Luo, S. Guo, Chem. Rev., 2023, 123, 12507–12593. 17 Q. Wen K. Yang D. Huang G. Cheng X. Ai Y. Liu J. Fang H. Li L. Yu T. Zhai Adv. Energy Mater. 11 2021 2102353 Q. Wen, K. Yang, D. Huang, G. Cheng, X. Ai, Y. Liu, J. Fang, H. Li, L. Yu, T. Zhai, Adv. Energy Mater., 2021, 11, 2102353. 18 Y. Zhao Q. Wen D. Huang C. Jiao Y. Liu Y. Liu J. Fang M. Sun L. Yu Adv. Energy Mater. 13 2023 2203595 Y. Zhao, Q. Wen, D. Huang, C. Jiao, Y. Liu, Y. Liu, J. Fang, M. Sun, L. Yu, Adv. Energy Mater., 2023, 13, 2203595. 19 J. Mao H. Liu X. Cui Y. Zhang X. Meng Y. Zheng M. Chen Y. Pan Z. Zhao G. Hou J. Hu Y. Li G. Xu R. Huang L. Yu D. Deng Nat. Catal. 6 2023 1052 1061 J. Mao, H. Liu, X. Cui, Y. Zhang, X. Meng, Y. Zheng, M. Chen, Y. Pan, Z. Zhao, G. Hou, J. Hu, Y. Li, G. Xu, R. Huang, L. Yu, D. Deng, Nat. Catal., 2023, 6, 1052–1061. 20 P. Dong X. Xu R. Luo S. Yuan J. Zhou J. Lei J. Am. Chem. Soc. 145 2023 15473 15481 P. Dong, X. Xu, R. Luo, S. Yuan, J. Zhou, J. Lei, J. Am. Chem. Soc., 2023, 145, 15473–15481. 21 F. Ma Z. Li R. Hu Z. Wang J. Wang J. Li Y. Nie Z. Zheng X. Jiang ACS Catal. 13 2023 14163 14172 F. Ma, Z. Li, R. Hu, Z. Wang, J. Wang, J. Li, Y. Nie, Z. Zheng, X. Jiang, ACS Catal., 2023, 13, 14163–14172. 22 X. Li H. Zhang Q. Hu W. Zhou J. Shao X. Jiang C. Feng H. Yang C. He Angew. Chem. Int. Ed. 62 2023 e202300478 X. Li, H. Zhang, Q. Hu, W. Zhou, J. Shao, X. Jiang, C. Feng, H. Yang, C. He, Angew. Chem. Int. Ed., 2023, 62, e202300478. 23 Z. Teng Q. Zhang H. Yang K. Kato W. Yang Y.-R. Lu S. Liu C. Wang A. Yamakata C. Su B. Liu T. Ohno Nat. Catal. 4 2021 374 384 Z. Teng, Q. Zhang, H. Yang, K. Kato, W. Yang, Y.-R. Lu, S. Liu, C. Wang, A. Yamakata, C. Su, B. Liu, T. Ohno, Nat. Catal., 2021, 4, 374–384. 24 Q.-N. Zhan T.-Y. Shuai H.-M. Xu C.-J. Huang Z.-J. Zhang G.-R. Li Chin. J. Catal. 47 2023 32 66 Q.-N. Zhan, T.-Y. Shuai, H.-M. Xu, C.-J. Huang, Z.-J. Zhang, G.-R. Li, Chin. J. Catal., 2023, 47, 32–66. 25 H.-M. Xu C.-J. Huang T.-Y. Shuai Q.-N. Zhan Z.-J. Zhang W. Cai J. Chen G.-R. Li Sci. China Mater. 66 2023 2953 3003 H.-M. Xu, C.-J. Huang, T.-Y. Shuai, Q.-N. Zhan, Z.-J. Zhang, W. Cai, J. Chen, G.-R. Li, Sci. China Mater., 2023, 66, 2953–3003. 26 M. Faraji M. Yousefi S. Yousefzadeh M. Zirak N. Naseri T.H. Jeon W. Choi A.Z. Moshfegh Energy Environ. Sci. 12 2019 59 95 M. Faraji, M. Yousefi, S. Yousefzadeh, M. Zirak, N. Naseri, T. H. Jeon, W. Choi, A. Z. Moshfegh, Energy Environ. Sci., 2019, 12, 59–95. 27 M. Guo Z. Xing T. Zhao Y. Qiu B. Tao Z. Li W. Zhou Appl. Catal. B 272 2020 118978 M. Guo, Z. Xing, T. Zhao, Y. Qiu, B. Tao, Z. Li, W. Zhou, Appl. Catal. B, 2020, 272, 118978. 28 X. Zhang P. Ma C. Wang L. Gan X. Chen P. Zhang Y. Wang H. Li L. Wang X. Zhou K. Zheng Energy Environ. Sci. 15 2022 830 842 X. Zhang, P. Ma, C. Wang, L. Gan, X. Chen, P. Zhang, Y. Wang, H. Li, L. Wang, X. Zhou, K. Zheng, Energy Environ. Sci., 2022, 15, 830–842. 29 A. Wang Z. Zheng H. Wang Y. Chen C. Luo D. Liang B. Hu R. Qiu K. Yan Appl. Catal. B 277 2020 119171 A. Wang, Z. Zheng, H. Wang, Y. Chen, C. Luo, D. Liang, B. Hu, R. Qiu, K. Yan, Appl. Catal. B, 2020, 277, 119171. 30 Y. Liu W. Yang Q. Chen D.A. Cullen Z. Xie T. Lian J. Am. Chem. Soc. 144 2022 2705 2715 Y. Liu, W. Yang, Q. Chen, D. A. Cullen, Z. Xie, T. Lian, J. Am. Chem. Soc., 2022, 144, 2705–2715. 31 C. Cheng L. Mao J. Shi F. Xue S. Zong B. Zheng L. Guo J. Mater. Chem. A 9 2021 12299 12306 C. Cheng, L. Mao, J. Shi, F. Xue, S. Zong, B. Zheng, L. Guo, J. Mater. Chem. A, 2021, 9, 12299–12306. 32 J. Ran W. Guo H. Wang B. Zhu J. Yu S.Z. Qiao Adv. Mater. 30 2018 1800128 J. Ran, W. Guo, H. Wang, B. Zhu, J. Yu, S. Z. Qiao, Adv. Mater., 2018, 30, 1800128. 33 Y. Feng C. Wang P. Cui C. Li B. Zhang L. Gan S. Zhang X. Zhang X. Zhou Z. Sun K. Wang Y. Duan H. Li K. Zhou H. Huang A. Li C. Zhuang L. Wang Z. Zhang X. Han Adv. Mater. 34 2022 2109074 Y. Feng, C. Wang, P. Cui, C. Li, B. Zhang, L. Gan, S. Zhang, X. Zhang, X. Zhou, Z. Sun, K. Wang, Y. Duan, H. Li, K. Zhou, H. Huang, A. Li, C. Zhuang, L. Wang, Z. Zhang, X. Han, Adv. Mater., 2022, 34, 2109074. 34 H. Zeng Z. Li G. Li X. Cui M. Jin T. Xie L. Liu M. Jiang X. Zhong Y. Zhang H. Zhang K. Ba Z. Yan Y. Wang S. Song K. Huang S. Feng Adv. Energy Mater. 12 2021 2102765 H. Zeng, Z. Li, G. Li, X. Cui, M. Jin, T. Xie, L. Liu, M. Jiang, X. Zhong, Y. Zhang, H. Zhang, K. Ba, Z. Yan, Y. Wang, S. Song, K. Huang, S. Feng, Adv. Energy Mater., 2021, 12, 2102765. 35 X. Ruan X. Cui Y. Cui X. Fan Z. Li T. Xie K. Ba G. Jia H. Zhang L. Zhang W. Zhang X. Zhao J. Leng S. Jin D.J. Singh W. Zheng Adv. Energy Mater. 12 2022 2200298 X. Ruan, X. Cui, Y. Cui, X. Fan, Z. Li, T. Xie, K. Ba, G. Jia, H. Zhang, L. Zhang, W. Zhang, X. Zhao, J. Leng, S. Jin, D. J. Singh, W. Zheng, Adv. Energy Mater., 2022, 12, 2200298. 36 W. Wei F. Mazzotta I. Lieberwirth K. Landfester C.T.J. Ferguson K.A.I. Zhang J. Am. Chem. Soc. 144 2022 7320 7326 W. Wei, F. Mazzotta, I. Lieberwirth, K. Landfester, C. T. J. Ferguson, K. A. I. Zhang, J. Am. Chem. Soc., 2022, 144, 7320–7326. 37 W. Cui J. Li Y. Sun H. Wang G. Jiang S.C. Lee F. Dong Appl. Catal. B 237 2018 938 946 W. Cui, J. Li, Y. Sun, H. Wang, G. Jiang, S. C. Lee, F. Dong, Appl. Catal. B, 2018, 237, 938–946. 38 K. Li Y. Cai X. Yang S. Wang C. Teng Y. Tian Q. Min W. Zhu Adv. Funct. Mater. 32 2022 2113002 K. Li, Y. Cai, X. Yang, S. Wang, C. Teng, Y. Tian, Q. Min, W. Zhu, Adv. Funct. Mater., 2022, 32, 2113002. 39 M. Tan Y. Ma C. Yu Q. Luan J. Li C. Liu W. Dong Y. Su L. Qiao L. Gao Q. Lu Y. Bai Adv. Funct. Mater. 32 2021 2111740 M. Tan, Y. Ma, C. Yu, Q. Luan, J. Li, C. Liu, W. Dong, Y. Su, L. Qiao, L. Gao, Q. Lu, Y. Bai, Adv. Funct. Mater., 2021, 32, 2111740. 40 S. Bai N. Zhang C. Gao Y. Xiong Nano Energy 53 2018 296 336 S. Bai, N. Zhang, C. Gao, Y. Xiong, Nano Energy, 2018, 53, 296–336. 41 Y. Gao B. Xu M. Cherif H. Yu Q. Zhang F. Vidal X. Wang F. Ding Y. Sun D. Ma Y. Bi Z. Xu Appl. Catal. B 279 2020 119403 Y. Gao, B. Xu, M. Cherif, H. Yu, Q. Zhang, F. Vidal, X. Wang, F. Ding, Y. Sun, D. Ma, Y. Bi, Z. Xu, Appl. Catal. B, 2020, 279, 119403. 42 E.M. Akinoglu D.A. Hoogeveen C. Cao A.N. Simonov J.J. Jasieniak ACS Nano 15 2021 7860 7878 E. M. Akinoglu, D. A. Hoogeveen, C. Cao, A. N. Simonov, J. J. Jasieniak, ACS Nano, 2021, 15, 7860–7878. 43 B. Wang S.-Z. Yang H. Chen Q. Gao Y.-X. Weng W. Zhu G. Liu Y. Zhang Y. Ye H. Zhu H. Li J. Xia Appl. Catal. B 277 2020 119170 B. Wang, S.-Z. Yang, H. Chen, Q. Gao, Y.-X. Weng, W. Zhu, G. Liu, Y. Zhang, Y. Ye, H. Zhu, H. Li, J. Xia, Appl. Catal. B, 2020, 277, 119170. 44 K. Lan R. Wang Q. Wei Y. Wang A. Hong P. Feng D. Zhao Angew. Chem. Int. Ed. 59 2020 17676 17683 K. Lan, R. Wang, Q. Wei, Y. Wang, A. Hong, P. Feng, D. Zhao, Angew. Chem. Int. Ed., 2020, 59, 17676–17683. 45 J. Di J. Xia M.F. Chisholm J. Zhong C. Chen X. Cao F. Dong Z. Chi H. Chen Y.X. Weng J. Xiong S.Z. Yang H. Li Z. Liu S. Dai Adv. Mater. 31 2019 1807576 J. Di, J. Xia, M. F. Chisholm, J. Zhong, C. Chen, X. Cao, F. Dong, Z. Chi, H. Chen, Y. X. Weng, J. Xiong, S. Z. Yang, H. Li, Z. Liu, S. Dai, Adv. Mater., 2019, 31, 1807576. 46 P. Song J. Du X. Ma Y. Shi X. Fang D. Liu S. Wei Z. Liu Y. Cao B. Lin J. Di Y. Wang J. Cui T. Kong C. Gao Y. Xiong EcoEnergy 1 2023 197 206 P. Song, J. Du, X. Ma, Y. Shi, X. Fang, D. Liu, S. Wei, Z. Liu, Y. Cao, B. Lin, J. Di, Y. Wang, J. Cui, T. Kong, C. Gao, Y. Xiong, EcoEnergy, 2023, 1, 197–206. 47 X. Lv G. Li G. Zhang K. Feng J. Deng J. Zhong Chin. J. Struct. Chem. 41 2022 2210016 2210028 X, Lv, G, Li, G, Zhang, K, Feng, J, Deng, J. Zhong, Chin. J. Struct. Chem., 2022, 41, 2210016–2210028 48 Y. Cao H. Gou P. Zhu Z. Jin Chin. J. Struct. Chem. 41 2022 2206079 2206085 Y. Cao, H. Gou, P. Zhu, Z. Jin, Chin. J. Struct. Chem., 2022, 41, 2206079–2206085 49 W. Li Y. Wang L. Li X. Huang M. Liu B. Gui X. Lang C. Wang Chin. J. Struct. Chem. 43 2024 100299 W. Li, Y. Wang, L. Li, X. Huang, M. Liu, B. Gui, X. Lang, C. Wang, Chin. J. Struct. Chem., 2024, 43, 100299. 50 T. Di J. Zhang B. Cheng J. Yu J. Xu Sci. China Chem. 61 2018 344 350 T. Di, J. Zhang, B. Cheng, J. Yu, J. Xu, Sci. China Chem., 2018, 61, 344–350. 51 A. Meng S. Wu B. Cheng J. Yu J. Xu J. Mater. Chem. A 6 2018 4729 4736 A. Meng, S. Wu, B. Cheng, J. Yu, J. Xu, J. Mater. Chem. A, 2018, 6, 4729–4736. 52 Z. Wang J. Fan B. Cheng J. Yu J. Xu Mater. Today Phys. 15 2020 100279 Z. Wang, J. Fan, B. Cheng, J. Yu, J. Xu, Mater. Today Phys., 2020, 15, 100279. 53 F. Xu B. Zhu B. Cheng J. Yu J. Xu Adv. Opt. Mater. 6 2018 1800911 F. Xu, B. Zhu, B. Cheng, J. Yu, J. Xu, Adv. Opt. Mater., 2018, 6, 1800911. 54 Z. Yan W. Wang L. Du J. Zhu D.L. Phillips J. Xu Appl. Catal. B 275 2020 119151 Z. Yan, W. Wang, L. Du, J. Zhu, D. L. Phillips, J. Xu, Appl. Catal. B, 2020, 275, 119151. 55 M. Cai Y. Wei Y. Li X. Li S. Wang G. Shao P. Zhang EcoEnergy 1 2023 248 295 M. Cai, Y. Wei, Y. Li, X. Li, S. Wang, G. Shao, P. Zhang, EcoEnergy, 2023, 1, 248–295. 56 X. Chia M. Pumera Nat. Catal. 1 2018 909 921 X. Chia, M. Pumera, Nat. Catal., 2018, 1, 909–921. 57 Z.W. Seh J. Kibsgaard C.F. Dickens I. Chorkendorff J.K. Norskov T.F. Jaramillo Science 355 2017 eaad4998 Z. W. Seh, J. Kibsgaard, C. F. Dickens, I. Chorkendorff, J. K. Norskov,T. F. Jaramillo, Science, 2017, 355, eaad4998. 58 X. Wang B. Liu Y. Zhang T. Butburee K. Ostrikov S. Wang W. Huang EcoEnergy 1 2023 108 153 X. Wang, B. Liu, Y. Zhang, T. Butburee, K. Ostrikov, S. Wang, W. Huang, EcoEnergy, 2023, 1, 108–153. 59 J.-B. Pan X. Liu B.-H. Wang Y.-A. Chen H.-Y. Tan J. Ouyang W. Zhou S. Shen L. Chen C.-T. Au S.-F. Yin Appl. Catal. B 315 2022 121526 J.-B. Pan, X. Liu, B.-H. Wang, Y.-A. Chen, H.-Y. Tan, J. Ouyang, W. Zhou, S. Shen, L. Chen, C.-T. Au, S.-F. Yin, Appl. Catal. B, 2022, 315, 121526. 60 W. Guo H. Luo Z. Jiang D. Fang J. Chi W. Shangguan Z. Wang L. Wang A.F. Lee ACS Catal. 12 2022 12000 12013 W. Guo, H. Luo, Z. Jiang, D. Fang, J. Chi, W. Shangguan, Z. Wang, L. Wang, A. F. Lee, ACS Catal., 2022, 12, 12000–12013. 61 P. Xiong S.I. Ivlev E. Meggers Nat. Catal. 6 2023 1186 1193 P. Xiong, S. I. Ivlev, E. Meggers, Nat. Catal., 2023, 6, 1186–1193. 62 A.M. Hilbrands M.K. Goetz K.S. Choi J. Am. Chem. Soc. 145 2023 25382 25391 A. M. Hilbrands, M. K. Goetz, K. S. Choi, J. Am. Chem. Soc., 2023, 145, 25382–25391. 63 M. Arunachalam R.S. Kanase K. Zhu S.H. Kang Nat. Commun. 14 2023 5429 M. Arunachalam, R. S. Kanase, K. Zhu, S. H. Kang, Nat. Commun., 2023, 14, 5429. 64 X. Liu Q. Zhang S. Zhao Z. Wang Y. Liu Z. Zheng H. Cheng Y. Dai B. Huang P. Wang Adv. Mater. 35 2023 2208915 X. Liu, Q. Zhang, S. Zhao, Z. Wang, Y. Liu, Z. Zheng, H. Cheng, Y. Dai, B. Huang, P. Wang, Adv. Mater., 2023, 35, 2208915. 65 Y. Zhao M. Duan C. Deng J. Yang S. Yang Y. Zhang H. Sheng Y. Li C. Chen J. Zhao Nat. Commun. 14 2023 1943 Y. Zhao, M. Duan, C. Deng, J. Yang, S. Yang, Y. Zhang, H. Sheng, Y. Li, C. Chen, J. Zhao, Nat. Commun., 2023, 14, 1943. 66 V. Andrei R.A. Jagt M. Rahaman L. Lari V.K. Lazarov J.L. MacManus-Driscoll R.L.Z. Hoye E. Reisner Nat. Mater. 21 2022 864 868 V. Andrei, R. A. Jagt, M. Rahaman, L. Lari, V. K. Lazarov, J. L. MacManus-Driscoll, R. L. Z. Hoye, E. Reisner, Nat. Mater., 2022, 21, 864–868. 67 B. Zhang S. Yu Y. Dai X. Huang L. Chou G. Lu G. Dong Y. Bi Nat. Commun. 12 2021 6969 B. Zhang, S. Yu, Y. Dai, X. Huang, L. Chou, G. Lu, G. Dong, Y. Bi, Nat. Commun., 2021, 12, 6969. 68 Z. Zhao Z. Wang J. Zhang C. Shao K. Dai K. Fan C. Liang Adv. Funct. Mater. 33 2023 2214470 Z. Zhao, Z. Wang, J. Zhang, C. Shao, K. Dai, K. Fan, C. Liang, Adv. Funct. Mater., 2023, 33, 2214470. 69 B. Zhang Z. Fan Y. Chen C. Feng S. Li Y. Li Angew. Chem. Int. Ed. 62 2023 e202305123 B. Zhang, Z. Fan, Y. Chen, C. Feng, S. Li, Y. Li, Angew. Chem. Int. Ed., 2023, 62, e202305123. 70 X.L. Lai M. Chen Y. Wang J. Song H.C. Xu J. Am. Chem. Soc. 144 2022 20201 20206 X. L. Lai, M. Chen, Y. Wang, J. Song, H. C. Xu, J. Am. Chem. Soc., 2022, 144, 20201–20206. 71 H. Zhou D. Zhang H. Xie Y. Liu C. Meng P. Zhang F. Fan R. Li C. Li Adv. Mater. 35 2023 e2300914 H. Zhou, D. Zhang, H. Xie, Y. Liu, C. Meng, P. Zhang, F. Fan, R. Li, C. Li, Adv. Mater., 2023, 35, e2300914. 72 H. Huang K.A. Steiniger T.H. Lambert J. Am. Chem. Soc. 144 2022 12567 12583 H. Huang, K. A. Steiniger, T. H. Lambert, J. Am. Chem. Soc., 2022, 144, 12567–12583. 73 J. Ke F. He H. Wu S. Lyu J. Liu B. Yang Z. Li Q. Zhang J. Chen L. Lei Y. Hou K. Ostrikov Nanomicro Lett. 13 2020 24 J. Ke, F. He, H. Wu, S. Lyu, J. Liu, B. Yang, Z. Li, Q. Zhang, J. Chen, L. Lei, Y. Hou, K. Ostrikov, Nanomicro Lett., 2020, 13, 24. 74 D. Tang G. Lu Z. Shen Y. Hu L. Yao B. Li G. Zhao B. Peng X. Huang J. Energy Chem. 77 2023 80 118 D. Tang, G. Lu, Z. Shen, Y. Hu, L. Yao, B. Li, G. Zhao, B. Peng, X. Huang, J. Energy Chem., 2023, 77, 80–118. 75 D. Li K. Yang J. Lian J. Yan S. Liu Adv. Energy Mater. 12 2022 2201070 D. Li, K. Yang, J. Lian, J. Yan, S. Liu, Adv. Energy Mater., 2022, 12, 2201070. 76 X. Chang T. Wang P. Yang G. Zhang J. Gong Adv. Mater. 31 2019 e1804710 X. Chang, T. Wang, P. Yang, G. Zhang, J. Gong, Adv. Mater., 2019, 31, e1804710. 77 N. Fu X. Liang X. Wang T. Gan C. Ye Z. Li J.C. Liu Y. Li J. Am. Chem. Soc. 145 2023 9540 9547 N. Fu, X. Liang, X. Wang, T. Gan, C. Ye, Z. Li, J. C. Liu, Y. Li, J. Am. Chem. Soc., 2023, 145, 9540–9547. 78 C. Chen M. Yasugi L. Yu Z. Teng T. Ohno Appl. Catal. B 307 2022 121152 C. Chen, M. Yasugi, L. Yu, Z. Teng, T. Ohno, Appl. Catal. B, 2022, 307, 121152. 79 L. Jin M. Sun J. Yang Y. Huang Y. Liu Appl. Catal. B 339 2023 123150 L. Jin, M. Sun, J. Yang, Y. Huang, Y. Liu, Appl. Catal. B, 2023, 339, 123150. 80 N. Yang S. Zhang Y. Xiao Y. Qi Y. Bao P. Xu S. Jin F. Zhang Angew. Chem. Int. Ed. 62 2023 e202308729 N. Yang, S. Zhang, Y. Xiao, Y. Qi, Y. Bao, P. Xu, S. Jin, F. Zhang, Angew. Chem. Int. Ed., 2023, 62, e202308729. 81 J. Wang M.-I. Jamesh Q. Gao B. Han R. Sun H.-Y. Hsu C. Zhou Z. Cai Sci. China Mater. 2024 J. Wang, M.-I. Jamesh, Q. Gao, B. Han, R. Sun, H.-Y. Hsu, C. Zhou, Z. Cai, Sci. China Mater., 2024. 82 X. Xue C. Lu M. Luo T. Han Y. Liu Y. Ge W. Dong X. Xu Sci. China Mater. 66 2022 127 138 X. Xue, C. Lu, M. Luo, T. Han, Y. Liu, Y. Ge, W. Dong, X. Xu, Sci. China Mater., 2022, 66, 127–138. 83 D. Yang G. Wang X. Wang Sci. China Mater. 62 2019 1369 1373 D. Yang, G. Wang, X. Wang, Sci. China Mater., 2019, 62, 1369–1373. 84 N. Zhang R. Long C. Gao Y. Xiong Sci. China Mater. 61 2018 771 805 N. Zhang, R. Long, C. Gao, Y. Xiong, Sci. China Mater., 2018, 61, 771–805. 85 T. Yao X. An H. Han J.Q. Chen C. Li Adv. Energy Mater. 8 2018 1800210 T. Yao, X. An, H. Han, J. Q. Chen, C. Li, Adv. Energy Mater., 2018, 8, 1800210. 86 X. Li J. Yu M. Jaroniec X. Chen Chem. Rev. 119 2019 3962 4179 X. Li, J. Yu, M. Jaroniec, X. Chen, Chem. Rev., 2019, 119, 3962–4179. 87 Y. Zheng A. Vasileff X. Zhou Y. Jiao M. Jaroniec S.Z. Qiao J. Am. Chem. Soc. 141 2019 7646 7659 Y. Zheng, A. Vasileff, X. Zhou, Y. Jiao, M. Jaroniec, S. Z. Qiao, J. Am. Chem. Soc., 2019, 141, 7646–7659. 88 S. Nitopi E. Bertheussen S.B. Scott X. Liu A.K. Engstfeld S. Horch B. Seger I.E.L. Stephens K. Chan C. Hahn J.K. Norskov T.F. Jaramillo I. Chorkendorff Chem. Rev. 119 2019 7610 7672 S. Nitopi, E. Bertheussen, S. B. Scott, X. Liu, A. K. Engstfeld, S. Horch, B. Seger, I. E. L. Stephens, K. Chan, C. Hahn, J. K. Norskov, T. F. Jaramillo, I. Chorkendorff, Chem. Rev., 2019, 119, 7610–7672. 89 A.D. Handoko F. Wei Jenndy B.S. Yeo Z.W. Seh Nat. Catal. 1 2018 922 934 A. D. Handoko, F. Wei, Jenndy, B. S. Yeo, Z. W. Seh, Nat. Catal., 2018, 1, 922–934. 90 P.A. Kempler M.H. Richter W.-H. Cheng B.S. Brunschwig N.S. Lewis ACS Energy Lett. 5 2020 2528 2534 P. A. Kempler, M. H. Richter, W.-H. Cheng, B. S. Brunschwig, N. S. Lewis, ACS Energy Lett., 2020, 5, 2528–2534. 91 W. Zhang Z. Jin Z. Chen Adv. Sci. 9 2022 e2105204 W. Zhang, Z. Jin, Z. Chen, Adv. Sci., 2022, 9, e2105204. 92 A.U. Pawar U. Pal J.Y. Zheng C.W. Kim Y.S. Kang Appl. Catal. B 303 2022 120921 A. U. Pawar, U. Pal, J. Y. Zheng, C. W. Kim, Y. S. Kang, Appl. Catal. B, 2022, 303, 120921. 93 H. Li Y. Shi H. Shang W. Wang J. Lu A.A. Zakharov L. Hultman R.I.G. Uhrberg M. Syvajarvi R. Yakimova L. Zhang J. Sun ACS Nano 14 2020 4905 4915 H. Li, Y. Shi, H. Shang, W. Wang, J. Lu, A. A. Zakharov, L. Hultman, R. I. G. Uhrberg, M. Syvajarvi, R. Yakimova, L. Zhang, J. Sun, ACS Nano, 2020, 14, 4905–4915. 94 G. Liu F. Zheng J. Li G. Zeng Y. Ye D.M. Larson J. Yano E.J. Crumlin J.W. Ager L.-w. Wang F.M. Toma Nat. Energy 6 2021 1124 1132 G. Liu, F. Zheng, J. Li, G. Zeng, Y. Ye, D. M. Larson, J. Yano, E. J. Crumlin, J. W. Ager, L.-w. Wang, F. M. Toma, Nat. Energy, 2021, 6, 1124–1132. 95 H. Zhang Y. Chen H. Wang H. Wang W. Ma X. Zong C. Li Adv. Energy Mater. 10 2020 2002105 H. Zhang, Y. Chen, H. Wang, H. Wang, W. Ma, X. Zong, C. Li, Adv. Energy Mater., 2020, 10, 2002105. 96 J. Artz T.E. Muller K. Thenert J. Kleinekorte R. Meys A. Sternberg A. Bardow W. Leitner Chem. Rev. 118 2018 434 504 J. Artz, T. E. Muller, K. Thenert, J. Kleinekorte, R. Meys, A. Sternberg, A. Bardow, W. Leitner, Chem. Rev., 2018, 118, 434–504. 97 J.J. Leung J. Warnan K.H. Ly N. Heidary D.H. Nam M.F. Kuehnel E. Reisner Nat. Catal. 2 2019 354 365 J. J. Leung, J. Warnan, K. H. Ly, N. Heidary, D. H. Nam, M. F. Kuehnel, E. Reisner, Nat. Catal., 2019, 2, 354–365. 98 S. Roy M. Miller J. Warnan J.J. Leung C.D. Sahm E. Reisner ACS Catal. 11 2021 1868 1876 S. Roy, M. Miller, J. Warnan, J. J. Leung, C. D. Sahm, E. Reisner, ACS Catal., 2021, 11, 1868–1876. 99 L. Wang W. Si Y. Tong F. Hou D. Pergolesi J. Hou T. Lippert S.X. Dou J. Liang Carbon Energy 2 2020 223 250 L. Wang, W. Si, Y. Tong, F. Hou, D. Pergolesi, J. Hou, T. Lippert, S. X. Dou, J. Liang, Carbon Energy, 2020, 2, 223–250. 100 Y. Dong R. Nie J. Wang X. Yu P. Tu J. Chen H. Jing Chin. J. Catal. 40 2019 1222 1230 Y. Dong, R. Nie, J. Wang, X. Yu, P. Tu, J. Chen, H. Jing, Chin. J. Catal., 2019, 40, 1222–1230. 101 L. Chen Z. Wang P. Kang Chin. J. Catal. 39 2018 413 420 L. Chen, Z. Wang, P. Kang, Chin. J. Catal., 2018, 39, 413–420. 102 L. Li X. Zhao D. Pan G. Li Chin. J. Catal. 38 2017 2132 2140 L. Li, X. Zhao, D. Pan, G. Li, Chin. J. Catal., 2017, 38, 2132–2140. 103 C. Lin C. Dong S. Kim Y. Lu Y. Wang Z. Yu Y. Gu Z. Gu D.K. Lee K. Zhang J.H. Park Adv. Mater. 35 2023 2209955 C. Lin, C. Dong, S. Kim, Y. Lu, Y. Wang, Z. Yu, Y. Gu, Z. Gu, D. K. Lee, K. Zhang, J. H. Park, Adv. Mater., 2023, 35, 2209955. 104 T.Y. Shuai Q.N. Zhan H.M. Xu C.J. Huang Z.J. Zhang G.R. Li Chem. Commun. 59 2023 3968 3999 T. Y. Shuai, Q. N. Zhan, H. M. Xu, C. J. Huang, Z. J. Zhang, G. R. Li, Chem. Commun., 2023, 59, 3968–3999. 105 R. Chen D. Zhang Z. Wang D. Li L. Zhang X. Wang F. Fan C. Li J. Am. Chem. Soc. 145 2023 4667 4674 R. Chen, D. Zhang, Z. Wang, D. Li, L. Zhang, X. Wang, F. Fan, C. Li, J. Am. Chem. Soc., 2023, 145, 4667–4674. 106 G. Liao Y. Gong L. Zhang H. Gao G.-J. Yang B. Fang Energy Environ. Sci. 12 2019 2080 2147 G. Liao, Y. Gong, L. Zhang, H. Gao, G.-J. Yang, B. Fang, Energy Environ. Sci., 2019, 12, 2080–2147. 107 H. Zhu C. Zhang K. Xie X. Li G. Liao Chem. Eng. J. 453 2023 139775 H. Zhu, C. Zhang, K. Xie, X. Li, G. Liao, Chem. Eng. J., 2023, 453, 139775. 108 J.-W. Zhao H. Zhang C.-F. Li X. Zhou J.-Q. Wu F. Zeng J. Zhang G.-R. Li Energy Environ. Sci. 15 2022 3912 3922 J.-W. Zhao, H. Zhang, C.-F. Li, X. Zhou, J.-Q. Wu, F. Zeng, J. Zhang, G.-R. Li, Energy Environ. Sci., 2022, 15, 3912–3922. 109 C.F. Li J.W. Zhao L.J. Xie J.Q. Wu Q. Ren Y. Wang G.R. Li Angew. Chem. Int. Ed. 60 2021 18129 18137 C. F. Li, J. W. Zhao, L. J. Xie, J. Q. Wu, Q. Ren, Y. Wang, G. R. Li, Angew. Chem. Int. Ed., 2021, 60, 18129–18137. 110 C.-J. Huang H.-M. Xu T.-Y. Shuai Q.-N. Zhan Z.-J. Zhang G.-R. Li Appl. Catal. B 325 2023 122313 C.-J. Huang, H.-M. Xu, T.-Y. Shuai, Q.-N. Zhan, Z.-J. Zhang, G.-R. Li, Appl. Catal. B, 2023, 325, 122313. 111 M. Xiao Z. Wang M. Lyu B. Luo S. Wang G. Liu H.M. Cheng L. Wang Adv. Mater. 31 2019 e1801369 M. Xiao, Z. Wang, M. Lyu, B. Luo, S. Wang, G. Liu, H. M. Cheng, L. Wang, Adv. Mater., 2019, 31, e1801369. 112 S. Jin X. Ma J. Pan C. Zhu S.E. Saji J. Hu X. Xu L. Sun Z. Yin Appl. Catal. B 281 2021 119477 S. Jin, X. Ma, J. Pan, C. Zhu, S. E. Saji, J. Hu, X. Xu, L. Sun, Z. Yin, Appl. Catal. B, 2021, 281, 119477. 113 S.A. Akhade N. Singh O.Y. Gutierrez J. Lopez-Ruiz H. Wang J.D. Holladay Y. Liu A. Karkamkar R.S. Weber A.B. Padmaperuma M.S. Lee G.A. Whyatt M. Elliott J.E. Holladay J.L. Male J.A. Lercher R. Rousseau V.A. Glezakou Chem. Rev. 120 2020 11370 11419 S. A. Akhade, N. Singh, O. Y. Gutierrez, J. Lopez-Ruiz, H. Wang, J. D. Holladay, Y. Liu, A. Karkamkar, R. S. Weber, A. B. Padmaperuma, M. S. Lee, G. A. Whyatt, M. Elliott, J. E. Holladay, J. L. Male, J. A. Lercher, R. Rousseau, V. A. Glezakou, Chem. Rev., 2020, 120, 11370–11419. 114 Z.Y. Yu Y. Duan J.D. Liu Y. Chen X.K. Liu W. Liu T. Ma Y. Li X.S. Zheng T. Yao M.R. Gao J.F. Zhu B.J. Ye S.H. Yu Nat. Commun. 10 2019 2799 Z. Y. Yu, Y. Duan, J. D. Liu, Y. Chen, X. K. Liu, W. Liu, T. Ma, Y. Li, X. S. Zheng, T. Yao, M. R. Gao, J. F. Zhu, B. J. Ye, S. H. Yu, Nat. Commun., 2019, 10, 2799. 115 H. Jin L. Li X. Liu C. Tang W. Xu S. Chen L. Song Y. Zheng S.Z. Qiao Adv. Mater. 31 2019 e1902709 H. Jin, L. Li, X. Liu, C. Tang, W. Xu, S. Chen, L. Song, Y. Zheng, S. Z. Qiao, Adv. Mater., 2019, 31, e1902709. 116 L. Zhang Z.J. Zhao T. Wang J. Gong Chem. Soc. Rev. 47 2018 5423 5443 L. Zhang, Z. J. Zhao, T. Wang, J. Gong, Chem. Soc. Rev., 2018, 47, 5423–5443. 117 S.-T. Guo Z.-Y. Tang Y.-W. Du T. Liu T. Ouyang Z.-Q. Liu Appl. Catal. B 321 2023 122035 S.-T. Guo, Z.-Y. Tang, Y.-W. Du, T. Liu, T. Ouyang, Z.-Q. Liu, Appl. Catal. B, 2023, 321, 122035. 118 K. Wang Y. Liu J. Kang Y. Zhang Q. Wang L. Chen Q. Wang B. Liu M. Liu X. Qiu W. Li J. Li Appl. Catal. B 325 2023 122315 K. Wang, Y. Liu, J. Kang, Y. Zhang, Q. Wang, L. Chen, Q. Wang, B. Liu, M. Liu, X. Qiu, W. Li, J. Li, Appl. Catal. B, 2023, 325, 122315. 119 X. Yang E.A. Fugate Y. Mueanngern L.R. Baker ACS Catal. 7 2016 177 180 X. Yang, E. A. Fugate, Y. Mueanngern, L. R. Baker, ACS Catal., 2016, 7, 177–180. 120 J. Song C. Wei Z.F. Huang C. Liu L. Zeng X. Wang Z.J. Xu Chem. Soc. Rev. 49 2020 2196 2214 J. Song, C. Wei, Z. F. Huang, C. Liu, L. Zeng, X. Wang, Z. J. Xu, Chem. Soc. Rev., 2020, 49, 2196–2214. 121 A.G. Scheuermann J.P. Lawrence K.W. Kemp T. Ito A. Walsh C.E. Chidsey P.K. Hurley P.C. McIntyre Nat. Mater. 15 2016 99 105 A. G. Scheuermann, J. P. Lawrence, K. W. Kemp, T. Ito, A. Walsh, C. E. Chidsey, P. K. Hurley, P. C. McIntyre, Nat. Mater., 2016, 15, 99–105. 122 H. Xie Y. Song Y. Jiao L. Gao S. Shi C. Wang J. Hou ACS Nano 18 2024 5712 5722 H. Xie, Y. Song, Y. Jiao, L. Gao, S. Shi, C. Wang, J. Hou, ACS Nano, 2024, 18, 5712–5722. 123 H. Wang R.T. Gao N.T. Nguyen J. Bai S. Ren X. Liu X. Zhang L. Wang ACS Nano 17 2023 22071 22081 H. Wang, R. T. Gao, N. T. Nguyen, J. Bai, S. Ren, X. Liu, X. Zhang, L. Wang, ACS Nano, 2023, 17, 22071–22081. 124 X. Li C. Deng Y. Kong Q. Huo L. Mi J. Sun J. Cao J. Shao X. Chen W. Zhou M. Lv X. Chai H. Yang Q. Hu C. He Angew. Chem. Int. Ed. 62 2023 e202309732 X. Li, C. Deng, Y. Kong, Q. Huo, L. Mi, J. Sun, J. Cao, J. Shao, X. Chen, W. Zhou, M. Lv, X. Chai, H. Yang, Q. Hu, C. He, Angew. Chem. Int. Ed., 2023, 62, e202309732. 125 J. Shan C. Ye S. Chen T. Sun Y. Jiao L. Liu C. Zhu L. Song Y. Han M. Jaroniec Y. Zhu Y. Zheng S.Z. Qiao J. Am. Chem. Soc. 143 2021 5201 5211 J. Shan, C. Ye, S. Chen, T. Sun, Y. Jiao, L. Liu, C. Zhu, L. Song, Y. Han, M. Jaroniec, Y. Zhu, Y. Zheng, S. Z. Qiao, J. Am. Chem. Soc., 2021, 143, 5201–5211. 126 X. Wang L. Xu C. Li C. Zhang H. Yao R. Xu P. Cui X. Zheng M. Gu J. Lee H. Jiang M. Huang Nat. Commun. 14 2023 7210 X. Wang, L. Xu, C. Li, C. Zhang, H. Yao, R. Xu, P. Cui, X. Zheng, M. Gu, J. Lee, H. Jiang, M. Huang, Nat. Commun., 2023, 14, 7210. 127 S. Corby R.R. Rao L. Steier J.R. Durrant Nat. Rev. Mater. 6 2021 1136 1155 S. Corby, R. R. Rao, L. Steier, J. R. Durrant, Nat. Rev. Mater., 2021, 6, 1136–1155. 128 F. Niu D. Wang F. Li Y. Liu S. Shen T.J. Meyer Adv. Energy Mater. 10 2019 1900399 F. Niu, D. Wang, F. Li, Y. Liu, S. Shen, T. J. Meyer, Adv. Energy Mater., 2019, 10, 1900399. 129 J.H. Kim J.S. Lee Adv. Mater. 31 2019 1806938 J. H. Kim, J. S. Lee, Adv. Mater., 2019, 31, 1806938. 130 S. Selim E. Pastor M. Garcia-Tecedor M.R. Morris L. Francas M. Sachs B. Moss S. Corby C.A. Mesa S. Gimenez A. Kafizas A.A. Bakulin J.R. Durrant J. Am. Chem. Soc. 141 2019 18791 18798 S. Selim, E. Pastor, M. Garcia-Tecedor, M. R. Morris, L. Francas, M. Sachs, B. Moss, S. Corby, C. A. Mesa, S. Gimenez, A. Kafizas, A. A. Bakulin, J. R. Durrant, J. Am. Chem. Soc., 2019, 141, 18791–18798. 131 S. He C. Yan X.-Z. Chen Z. Wang T. Ouyang M.-L. Guo Z.-Q. Liu Appl. Catal. B 276 2020 119138 S. He, C. Yan, X.-Z. Chen, Z. Wang, T. Ouyang, M.-L. Guo, Z.-Q. Liu, Appl. Catal. B, 2020, 276, 119138. 132 Y. Geng D. Chen N. Li Q. Xu H. Li J. He J. Lu Appl. Catal. B 280 2021 119409 Y. Geng, D. Chen, N. Li, Q. Xu, H. Li, J. He, J. Lu, Appl. Catal. B, 2021, 280, 119409. 133 X. Pan Y.-J. Xu J. Phys. Chem. C 117 2013 17996 18005 X. Pan, Y.-J. Xu, J. Phys. Chem. C, 2013, 117, 17996–18005. 134 S. Wang G. Liu L. Wang Chem. Rev. 119 2019 5192 5247 S. Wang, G. Liu, L. Wang, Chem. Rev., 2019, 119, 5192–5247. 135 Z. Tian P. Zhang P. Qin D. Sun S. Zhang X. Guo W. Zhao D. Zhao F. Huang Adv. Energy Mater. 9 2019 1901287 Z. Tian, P. Zhang, P. Qin, D. Sun, S. Zhang, X. Guo, W. Zhao, D. Zhao, F. Huang, Adv. Energy Mater., 2019, 9, 1901287. 136 X. Gao C. Liang K. Gao X. Li J. Liu Q. Li Appl. Surf. Sci. 524 2020 146506 X. Gao, C. Liang, K. Gao, X. Li, J. Liu, Q. Li, Appl. Surf. Sci., 2020, 524, 146506. 137 R. Li F. Zhang D. Wang J. Yang M. Li J. Zhu X. Zhou H. Han C. Li Nat. Commun. 4 2013 1432 R. Li, F. Zhang, D. Wang, J. Yang, M. Li, J. Zhu, X. Zhou, H. Han, C. Li, Nat. Commun., 2013, 4, 1432. 138 J.T. Wang Y.L. Cai X.J. Liu X.D. Zhang F.Y. Cai H.L. Cao Z. Zhong Y.F. Li J. Lu J. Hazard. Mater. 424 2022 127596 J. T. Wang, Y. L. Cai, X. J. Liu, X. D. Zhang, F. Y. Cai, H. L. Cao, Z. Zhong, Y. F. Li, J. Lu, J. Hazard. Mater., 2022, 424, 127596. 139 Y. Song X. Zhang Y. Zhang P. Zhai Z. Li D. Jin J. Cao C. Wang B. Zhang J. Gao L. Sun J. Hou Angew. Chem. Int. Ed. 61 2022 e202200946 Y. Song, X. Zhang, Y. Zhang, P. Zhai, Z. Li, D. Jin, J. Cao, C. Wang, B. Zhang, J. Gao, L. Sun, J. Hou, Angew. Chem. Int. Ed., 2022, 61, e202200946. 140 Y. Song Y. Ren H. Cheng Y. Jiao S. Shi L. Gao H. Xie J. Gao L. Sun J. Hou Angew. Chem. Int. Ed. 62 2023 e202306420 Y. Song, Y. Ren, H. Cheng, Y. Jiao, S. Shi, L. Gao, H. Xie, J. Gao, L. Sun, J. Hou, Angew. Chem. Int. Ed., 2023, 62, e202306420. 141 A.S.M. Ismail I. Garcia-Torregrosa J.C. Vollenbroek L. Folkertsma J.G. Bomer T. Haarman M. Ghiasi M. Schellhorn M. Nachtegaal M. Odijk A. van den Berg B.M. Weckhuysen F.M.F. de Groot ACS Catal. 11 2021 12324 12335 A. S. M. Ismail, I. Garcia-Torregrosa, J. C. Vollenbroek, L. Folkertsma, J. G. Bomer, T. Haarman, M. Ghiasi, M. Schellhorn, M. Nachtegaal, M. Odijk, A. van den Berg, B. M. Weckhuysen, F. M. F. de Groot, ACS Catal., 2021, 11, 12324–12335. 142 R.T. Gao J. Zhang T. Nakajima J. He X. Liu X. Zhang L. Wang L. Wu Nat. Commun. 14 2023 2640 R. T. Gao, J. Zhang, T. Nakajima, J. He, X. Liu, X. Zhang, L. Wang, L. Wu, Nat. Commun., 2023, 14, 2640. 143 Z. Wu X. Liu H. Li Z. Sun M. Cao Z. Li C. Fang J. Zhou C. Cao J. Dong S. Zhao Z. Chen Nat. Commun. 14 2023 2574 Z. Wu, X. Liu, H. Li, Z. Sun, M. Cao, Z. Li, C. Fang, J. Zhou, C. Cao, J. Dong, S. Zhao, Z. Chen, Nat. Commun., 2023, 14, 2574. 144 K.Y. Yoon J. Park M. Jung S.G. Ji H. Lee J.H. Seo M.J. Kwak S. Il Seok J.H. Lee J.H. Jang Nat. Commun. 12 2021 4309 K. Y. Yoon, J. Park, M. Jung, S. G. Ji, H. Lee, J. H. Seo, M. J. Kwak, S. Il Seok, J. H. Lee, J. H. Jang, Nat. Commun., 2021, 12, 4309. 145 Z. Cheng W. Qi C.H. Pang T. Thomas T. Wu S. Liu M. Yang Adv. Funct. Mater. 31 2021 2100553 Z. Cheng, W. Qi, C. H. Pang, T. Thomas, T. Wu, S. Liu, M. Yang, Adv. Funct. Mater., 2021, 31, 2100553. 146 S. Chen Y. Qi T. Hisatomi Q. Ding T. Asai Z. Li S.S. Ma F. Zhang K. Domen C. Li Angew. Chem. Int. Ed. 54 2015 8498 8501 S. Chen, Y. Qi, T. Hisatomi, Q. Ding, T. Asai, Z. Li, S. S. Ma, F. Zhang, K. Domen, C. Li, Angew. Chem. Int. Ed., 2015, 54, 8498–8501. 147 Z. Li L. Zhang Y. Liu C. Shao Y. Gao F. Fan J. Wang J. Li J. Yan R. Li C. Li Angew. Chem. Int. Ed. 59 2020 935 942 Z. Li, L. Zhang, Y. Liu, C. Shao, Y. Gao, F. Fan, J. Wang, J. Li, J. Yan, R. Li, C. Li, Angew. Chem. Int. Ed., 2020, 59, 935–942. 148 M.G. Kibria R. Qiao W. Yang I. Boukahil X. Kong F.A. Chowdhury M.L. Trudeau W. Ji H. Guo F.J. Himpsel L. Vayssieres Z. Mi Adv. Mater. 28 2016 8388 8397 M. G. Kibria, R. Qiao, W. Yang, I. Boukahil, X. Kong, F. A. Chowdhury, M. L. Trudeau, W. Ji, H. Guo, F. J. Himpsel, L. Vayssieres, Z. Mi, Adv. Mater., 2016, 28, 8388–8397. 149 S. Vanka E. Arca S. Cheng K. Sun G.A. Botton G. Teeter Z. Mi Nano Lett. 18 2018 6530 6537 S. Vanka, E. Arca, S. Cheng, K. Sun, G. A. Botton, G. Teeter, Z. Mi, Nano Lett., 2018, 18, 6530–6537. 150 L. Chen J. Yang S. Klaus L.J. Lee R. Woods-Robinson J. Ma Y. Lum J.K. Cooper F.M. Toma L.W. Wang I.D. Sharp A.T. Bell J.W. Ager J. Am. Chem. Soc. 137 2015 9595 9603 L. Chen, J. Yang, S. Klaus, L. J. Lee, R. Woods-Robinson, J. Ma, Y. Lum, J. K. Cooper, F. M. Toma, L. W. Wang, I. D. Sharp, A. T. Bell, J. W. Ager, J. Am. Chem. Soc., 2015, 137, 9595–9603. 151 G. Zeng T.A. Pham S. Vanka G. Liu C. Song J.K. Cooper Z. Mi T. Ogitsu F.M. Toma Nat. Mater. 20 2021 1130 1135 G. Zeng, T. A. Pham, S. Vanka, G. Liu, C. Song, J. K. Cooper, Z. Mi, T. Ogitsu, F. M. Toma, Nat. Mater., 2021, 20, 1130–1135. 152 Z. Wang Y. Qi C. Ding D. Fan G. Liu Y. Zhao C. Li Chem. Sci. 7 2016 4391 4399 Z. Wang, Y. Qi, C. Ding, D. Fan, G. Liu, Y. Zhao, C. Li, Chem. Sci., 2016, 7, 4391–4399. 153 G. Liu S. Ye P. Yan F. Xiong P. Fu Z. Wang Z. Chen J. Shi C. Li Energy Environ. Sci. 9 2016 1327 1334 G. Liu, S. Ye, P. Yan, F. Xiong, P. Fu, Z. Wang, Z. Chen, J. Shi, C. Li, Energy Environ. Sci., 2016, 9, 1327–1334. 154 Y. Xiao C. Feng J. Fu F. Wang C. Li V.F. Kunzelmann C.-M. Jiang M. Nakabayashi N. Shibata I.D. Sharp K. Domen Y. Li Nat. Catal. 3 2020 932 940 Y. Xiao, C. Feng, J. Fu, F. Wang, C. Li, V. F. Kunzelmann, C.-M. Jiang, M. Nakabayashi, N. Shibata, I. D. Sharp, K. Domen, Y. Li, Nat. Catal., 2020, 3, 932–940. 155 Y. Pihosh V. Nandal T. Higashi R. Shoji R. Bekarevich H. Nishiyama T. Yamada V. Nicolosi T. Hisatomi H. Matsuzaki K. Seki K. Domen Adv. Energy Mater. 13 2023 2301327 Y. Pihosh, V. Nandal, T. Higashi, R. Shoji, R. Bekarevich, H. Nishiyama, T. Yamada, V. Nicolosi, T. Hisatomi, H. Matsuzaki, K. Seki, K. Domen, Adv. Energy Mater., 2023, 13, 2301327. 156 T. Higashi H. Nishiyama Y. Suzuki Y. Sasaki T. Hisatomi M. Katayama T. Minegishi K. Seki T. Yamada K. Domen Angew. Chem. Int. Ed. 58 2019 2300 2304 T. Higashi, H. Nishiyama, Y. Suzuki, Y. Sasaki, T. Hisatomi, M. Katayama, T. Minegishi, K. Seki, T. Yamada, K. Domen, Angew. Chem. Int. Ed., 2019, 58, 2300–2304. 157 V. Nandal Y. Pihosh T. Higashi T. Minegishi T. Yamada K. Seki M. Sugiyama K. Domen Energy Environ. Sci. 14 2021 4038 4047 V. Nandal, Y. Pihosh, T. Higashi, T. Minegishi, T. Yamada, K. Seki, M. Sugiyama, K. Domen, Energy Environ. Sci., 2021, 14, 4038–4047. 158 H. Wang Y. Xia H. Li X. Wang Y. Yu X. Jiao D. Chen Nat. Commun. 11 2020 3078 H. Wang, Y. Xia, H. Li, X. Wang, Y. Yu, X. Jiao, D. Chen, Nat. Commun., 2020, 11, 3078. 159 B. Giri M. Masroor T. Yan K. Kushnir A.D. Carl C. Doiron H. Zhang Y. Zhao A. McClelland G.A. Tompsett D. Wang R.L. Grimm L.V. Titova P.M. Rao Adv. Energy Mater. 9 2019 1901236 B. Giri, M. Masroor, T. Yan, K. Kushnir, A. D. Carl, C. Doiron, H. Zhang, Y. Zhao, A. McClelland, G. A. Tompsett, D. Wang, R. L. Grimm, L. V. Titova, P. M. Rao, Adv. Energy Mater., 2019, 9, 1901236. 160 J.P. Song P.F. Yin J. Mao S.Z. Qiao X.W. Du Nanoscale 9 2017 6296 6301 J. P. Song, P. F. Yin, J. Mao, S. Z. Qiao, X. W. Du, Nanoscale, 2017, 9, 6296–6301. 161 S.S.M. Bhat S.A. Pawar D. Potphode C.-K. Moon J.M. Suh C. Kim S. Choi D.S. Patil J.-J. Kim J.C. Shin H.W. Jang Appl. Catal. B 259 2019 118102 S. S. M. Bhat, S. A. Pawar, D. Potphode, C.-K. Moon, J. M. Suh, C. Kim, S. Choi, D. S. Patil, J.-J. Kim, J. C. Shin, H. W. Jang, Appl. Catal. B, 2019, 259, 118102. 162 J. Jing J. Yang W. Li Z. Wu Y. Zhu Adv. Mater. 34 2022 e2106807 J. Jing, J. Yang, W. Li, Z. Wu, Y. Zhu, Adv. Mater., 2022, 34, e2106807. 163 H. Yao Y. Cui D. Qian C.S. Ponseca Jr. A. Honarfar Y. Xu J. Xin Z. Chen L. Hong B. Gao R. Yu Y. Zu W. Ma P. Chabera T. Pullerits A. Yartsev F. Gao J. Hou J. Am. Chem. Soc. 141 2019 7743 7750 H. Yao, Y. Cui, D. Qian, C. S. Ponseca, Jr., A. Honarfar, Y. Xu, J. Xin, Z. Chen, L. Hong, B. Gao, R. Yu, Y. Zu, W. Ma, P. Chabera, T. Pullerits, A. Yartsev, F. Gao, J. Hou, J. Am. Chem. Soc., 2019, 141, 7743–7750. 164 Q.J. Wu D.H. Si S. Ye Y.L. Dong R. Cao Y.B. Huang J. Am. Chem. Soc. 145 2023 19856 19865 Q. J. Wu, D. H. Si, S. Ye, Y. L. Dong, R. Cao, Y. B. Huang, J. Am. Chem. Soc., 2023, 145, 19856–19865. 165 Y. Mou X. Wu C. Qin J. Chen Y. Zhao L. Jiang C. Zhang X. Yuan E. Huixiang Ang H. Wang Angew. Chem. Int. Ed. 62 2023 e202309480 Y. Mou, X. Wu, C. Qin, J. Chen, Y. Zhao, L. Jiang, C. Zhang, X. Yuan, E. Huixiang Ang, H. Wang, Angew. Chem. Int. Ed., 2023, 62, e202309480. 166 H.-J. Ahn K.-Y. Yoon M. Sung H. Yoo H. Ahn B.H. Lee J. Lee J.-H. Jang ACS Energy Lett. 8 2023 2595 2602 H.-J. Ahn, K.-Y. Yoon, M. Sung, H. Yoo, H. Ahn, B. H. Lee, J. Lee, J.-H. Jang, ACS Energy Lett., 2023, 8, 2595–2602. 167 C. Cheng B. He J. Fan B. Cheng S. Cao J. Yu Adv. Mater. 33 2021 2100317 C. Cheng, B. He, J. Fan, B. Cheng, S. Cao, J. Yu, Adv. Mater., 2021, 33, 2100317. 168 F. Liu P. Zhou Y. Hou H. Tan Y. Liang J. Liang Q. Zhang S. Guo M. Tong J. Ni Nat. Commun. 14 2023 4344 F. Liu, P. Zhou, Y. Hou, H. Tan, Y. Liang, J. Liang, Q. Zhang, S. Guo, M. Tong, J. Ni, Nat. Commun., 2023, 14, 4344. 169 Y.R. Wang H.M. Ding S.N. Sun J.W. Shi Y.L. Yang Q. Li Y. Chen S.L. Li Y.Q. Lan Angew. Chem. Int. Ed. 61 2022 e202212162 Y. R. Wang, H. M. Ding, S. N. Sun, J. W. Shi, Y. L. Yang, Q. Li, Y. Chen, S. L. Li, Y. Q. Lan, Angew. Chem. Int. Ed., 2022, 61, e202212162. 170 H.-H. Cho L. Yao J.-H. Yum Y. Liu F. Boudoire R.A. Wells N. Guijarro A. Sekar K. Sivula Nat. Catal. 4 2021 431 438 H.-H. Cho, L. Yao, J.-H. Yum, Y. Liu, F. Boudoire, R. A. Wells, N. Guijarro, A. Sekar, K. Sivula, Nat. Catal., 2021, 4, 431–438. 171 K.P. Sokol W.E. Robinson J. Warnan N. Kornienko M.M. Nowaczyk A. Ruff J.Z. Zhang E. Reisner Nat. Energy 3 2018 944 951 K. P. Sokol, W. E. Robinson, J. Warnan, N. Kornienko, M. M. Nowaczyk, A. Ruff, J. Z. Zhang, E. Reisner, Nat. Energy, 2018, 3, 944–951. 172 S. Xie J. Liang Q. Liu P. Liu J. Wang J. Li H. Wu W. Wang G. Li J. Mater. Chem. A 11 2023 25671 25682 S. Xie, J. Liang, Q. Liu, P. Liu, J. Wang, J. Li, H. Wu, W. Wang, G. Li, J. Mater. Chem. A, 2023, 11, 25671–25682. 173 L.T. Liu A.W.H. Chin P. Yu L.L.M. Poon M.X. Huang Chem. Eng. J. 433 2022 133783 L. T. Liu, A. W. H. Chin, P. Yu, L. L. M. Poon, M. X. Huang, Chem. Eng. J., 2022, 433, 133783. 174 H. Pei S. Xu Y. Zhang Y. Zhou R. Li T. Peng Appl. Catal. B 318 2022 121865 H. Pei, S. Xu, Y. Zhang, Y. Zhou, R. Li, T. Peng, Appl. Catal. B, 2022, 318, 121865. 175 W. Jiang L. Zhang C. Ni M. Shi Y. Zhao Y. Deng H. Chi R. Chen X. Wang R. Li C. Li Angew. Chem. Int. Ed. 62 2023 e202302575 W. Jiang, L. Zhang, C. Ni, M. Shi, Y. Zhao, Y. Deng, H. Chi, R. Chen, X. Wang, R. Li, C. Li, Angew. Chem. Int. Ed., 2023, 62, e202302575. 176 D. Geng Y. Huang S. Yuan Y. Jiang H. Ren S. Zhang Z. Liu J. Feng T. Wei Z. Fan Small 19 2023 2207227 D. Geng, Y. Huang, S. Yuan, Y. Jiang, H. Ren, S. Zhang, Z. Liu, J. Feng, T. Wei, Z. Fan, Small, 2023, 19, 2207227. 177 H. Zhang J. Li S. Xi Y. Du X. Hai J. Wang H. Xu G. Wu J. Zhang J. Lu J. Wang Angew. Chem. Int. Ed. 58 2019 14871 14876 H. Zhang, J. Li, S. Xi, Y. Du, X. Hai, J. Wang, H. Xu, G. Wu, J. Zhang, J. Lu, J. Wang, Angew. Chem. Int. Ed., 2019, 58, 14871–14876. 178 R. Wang M. Shi F. Xu Y. Qiu P. Zhang K. Shen Q. Zhao J. Yu Y. Zhang Nat. Commun. 11 2020 4465 R. Wang, M. Shi, F. Xu, Y. Qiu, P. Zhang, K. Shen, Q. Zhao, J. Yu, Y. Zhang, Nat. Commun., 2020, 11, 4465. 179 Y. Yan D. Zhai Y. Liu J. Gong J. Chen P. Zan Z. Zeng S. Li W. Huang P. Chen ACS Nano 14 2020 1185 1195 Y. Yan, D. Zhai, Y. Liu, J. Gong, J. Chen, P. Zan, Z. Zeng, S. Li, W. Huang, P. Chen, ACS Nano, 2020, 14, 1185–1195. 180 H. Zheng Y. Lu K.H. Ye J. Hu S. Liu J. Yan Y. Ye Y. Guo Z. Lin J. Cheng Y. Cao Nat. Commun. 12 2021 91 H. Zheng, Y. Lu, K. H. Ye, J. Hu, S. Liu, J. Yan, Y. Ye, Y. Guo, Z. Lin, J. Cheng, Y. Cao, Nat. Commun., 2021, 12, 91. 181 G. Xie X. Liu B. Guo T. Tan J.R. Gong Adv. Mater. 2023 2211008 G. Xie, X. Liu, B. Guo, T. Tan, J. R. Gong, Adv. Mater., 2023, 2211008. 182 G. Xie B. Guo J.R. Gong Adv. Funct. Mater. 33 2022 2210420 G. Xie, B. Guo, J. R. Gong, Adv. Funct. Mater., 2022, 33, 2210420. 183 Y. Deng B. Chi J. Li G. Wang L. Zheng X. Shi Z. Cui L. Du S. Liao K. Zang J. Luo Y. Hu X. Sun Adv. Energy Mater. 9 2019 1802856 Y. Deng, B. Chi, J. Li, G. Wang, L. Zheng, X. Shi, Z. Cui, L. Du, S. Liao, K. Zang, J. Luo, Y. Hu, X. Sun, Adv. Energy Mater., 2019, 9, 1802856. 184 L. Chai J. Song A. Kumar R. Miao Y. Sun X. Liu G. Yasin X. Li J. Pan Adv. Mater. 36 2024 2308989 L. Chai, J. Song, A. Kumar, R. Miao, Y. Sun, X. Liu, G. Yasin, X. Li, J. Pan, Adv. Mater., 2024, 36, 2308989. 185 H. Zhang S. Si G. Zhai Y. Li Y. Liu H. Cheng Z. Wang P. Wang Z. Zheng Y. Dai T.X. Liu B. Huang Appl. Catal. B 337 2023 122909 H. Zhang, S. Si, G. Zhai, Y. Li, Y. Liu, H. Cheng, Z. Wang, P. Wang, Z. Zheng, Y. Dai, T. X. Liu, B. Huang, Appl. Catal. B, 2023, 337, 122909. 186 C.F. Li L.J. Xie J.W. Zhao L.F. Gu H.B. Tang L. Zheng G.R. Li Angew. Chem. Int. Ed. 61 2022 e202116934 C. F. Li, L. J. Xie, J. W. Zhao, L. F. Gu, H. B. Tang, L. Zheng, G. R. Li, Angew. Chem. Int. Ed., 2022, 61, e202116934. 187 J.B. Pan B.H. Wang J.B. Wang H.Z. Ding W. Zhou X. Liu J.R. Zhang S. Shen J.K. Guo L. Chen C.T. Au L.L. Jiang S.F. Yin Angew. Chem. Int. Ed. 60 2021 1433 1440 J. B. Pan, B. H. Wang, J. B. Wang, H. Z. Ding, W. Zhou, X. Liu, J. R. Zhang, S. Shen, J. K. Guo, L. Chen, C. T. Au, L. L. Jiang, S. F. Yin, Angew. Chem. Int. Ed., 2021, 60, 1433–1440. 188 X.Y. Yang Z.W. Chen X.Z. Yue X. Du X.H. Hou L.Y. Zhang D.L. Chen S.S. Yi Small 19 2023 2205246 X. Y. Yang, Z. W. Chen, X. Z. Yue, X. Du, X. H. Hou, L. Y. Zhang, D. L. Chen, S. S. Yi, Small, 2023, 19, 2205246. 189 J.W. Yoon D.H. Kim J.-H. Kim H.W. Jang J.-H. Lee Appl. Catal. B 244 2019 511 518 J. W. Yoon, D. H. Kim, J.-H. Kim, H. W. Jang, J.-H. Lee, Appl. Catal. B, 2019, 244, 511–518. 190 J. Ding H. Bin Yang X.-L. Ma S. Liu W. Liu Q. Mao Y. Huang J. Li T. Zhang B. Liu Nat. Energy 8 2023 1386 1394 J. Ding, H. Bin Yang, X.-L. Ma, S. Liu, W. Liu, Q. Mao, Y. Huang, J. Li, T. Zhang, B. Liu, Nat. Energy, 2023, 8, 1386–1394. 191 G. Wang Y. Wu Z. Li Z. Lou Q. Chen Y. Li D. Wang J. Mao Angew. Chem. Int. Ed. 62 2023 e202218460 G. Wang, Y. Wu, Z. Li, Z. Lou, Q. Chen, Y. Li, D. Wang, J. Mao, Angew. Chem. Int. Ed., 2023, 62, e202218460. 192 Y. Gao M. Zhang Y. Jin M. Zhou Y. Mao J. Sun W. Wang Z. Song Appl. Catal. B 341 2024 123348 Y. Gao, M. Zhang, Y. Jin, M. Zhou, Y. Mao, J. Sun, W. Wang, Z. Song, Appl. Catal. B, 2024, 341, 123348. 193 S. Xia C. Wei Y. Zhai B. Ding J. Yu J. Yan Chem. Eng. J. 475 2023 146516 S. Xia, C. Wei, Y. Zhai, B. Ding, J. Yu, J. Yan, Chem. Eng. J., 2023, 475, 146516. 194 G. Wang J. Chen Y. Ding P. Cai L. Yi Y. Li C. Tu Y. Hou Z. Wen L. Dai Chem. Soc. Rev. 50 2021 4993 5061 G. Wang, J. Chen, Y. Ding, P. Cai, L. Yi, Y. Li, C. Tu, Y. Hou, Z. Wen, L. Dai, Chem. Soc. Rev., 2021, 50, 4993–5061. 195 C. Liu Y. Xiao W. Wan Y. Wei Y. Cao L. Hong Y. Wang J. Chen Q. Zhang H. Jing Appl. Catal. B 325 2023 122394 C. Liu, Y. Xiao, W. Wan, Y. Wei, Y. Cao, L. Hong, Y. Wang, J. Chen, Q. Zhang, H. Jing, Appl. Catal. B, 2023, 325, 122394. 196 M. Rahaman V. Andrei C. Pornrungroj D. Wright J.J. Baumberg E. Reisner Energy Environ. Sci. 13 2020 3536 3543 M. Rahaman, V. Andrei, C. Pornrungroj, D. Wright, J. J. Baumberg, E. Reisner, Energy Environ. Sci., 2020, 13, 3536–3543. 197 X. Ma Y. Zhang T. Fan D. Wei Z. Huang Z. Zhang Z. Zhang Y. Dong Q. Hong Z. Chen X. Yi Adv. Funct. Mater. 33 2023 202213145 X. Ma, Y. Zhang, T. Fan, D. Wei, Z. Huang, Z. Zhang, Z. Zhang, Y. Dong, Q. Hong, Z. Chen, X. Yi, Adv. Funct. Mater., 2023, 33, 202213145. 198 C. Guo Y. Guo Y. Shi X. Lan Y. Wang Y. Yu B. Zhang Angew. Chem. Int. Ed. 61 2022 e202205909 C. Guo, Y. Guo, Y. Shi, X. Lan, Y. Wang, Y. Yu, B. Zhang, Angew. Chem. Int. Ed., 2022, 61, e202205909. 199 W. Xia Y. Xie S. Jia S. Han R. Qi T. Chen X. Xing T. Yao D. Zhou X. Dong J. Zhai J. Li J. He D. Jiang Y. Yamauchi M. He H. Wu B. Han J. Am. Chem. Soc. 145 2023 17253 17264 W. Xia, Y. Xie, S. Jia, S. Han, R. Qi, T. Chen, X. Xing, T. Yao, D. Zhou, X. Dong, J. Zhai, J. Li, J. He, D. Jiang, Y. Yamauchi, M. He, H. Wu, B. Han, J. Am. Chem. Soc., 2023, 145, 17253–17264. 200 X. Zi Y. Zhou L. Zhu Q. Chen Y. Tan X. Wang M. Sayed E. Pensa R.A. Geioushy K. Liu J. Fu E. Cortes M. Liu Angew. Chem. Int. Ed. 62 2023 e202309351 X. Zi, Y. Zhou, L. Zhu, Q. Chen, Y. Tan, X. Wang, M. Sayed, E. Pensa, R. A. Geioushy, K. Liu, J. Fu, E. Cortes, M. Liu, Angew. Chem. Int. Ed., 2023, 62, e202309351. 201 B. Zhou Y. Ma P. Ou Z. Ye X.-Y. Li S. Vanka T. Ma H. Sun P. Wang P. Zhou J.K. Cooper Y. Xiao I.A. Navid J. Pan J. Song Z. Mi Nat. Catal. 6 2023 987 995 B. Zhou, Y. Ma, P. Ou, Z. Ye, X.-Y. Li, S. Vanka, T. Ma, H. Sun, P. Wang, P. Zhou, J. K. Cooper, Y. Xiao, I. A. Navid, J. Pan, J. Song, Z. Mi, Nat. Catal., 2023, 6, 987–995. 202 B. Wang G.M. Biesold M. Zhang Z. Lin Chem. Soc. Rev. 50 2021 6914 6949 B. Wang, G. M. Biesold, M. Zhang, Z. Lin, Chem. Soc. Rev., 2021, 50, 6914–6949. 203 W. Gao S. Liang R. Wang Q. Jiang Y. Zhang Q. Zheng B. Xie C.Y. Toe X. Zhu J. Wang L. Huang Y. Gao Z. Wang C. Jo Q. Wang L. Wang Y. Liu B. Louis J. Scott A.C. Roger R. Amal H. He S.E. Park Chem. Soc. Rev. 49 2020 8584 8686 W. Gao, S. Liang, R. Wang, Q. Jiang, Y. Zhang, Q. Zheng, B. Xie, C. Y. Toe, X. Zhu, J. Wang, L. Huang, Y. Gao, Z. Wang, C. Jo, Q. Wang, L. Wang, Y. Liu, B. Louis, J. Scott, A. C. Roger, R. Amal, H. He, S. E. Park, Chem. Soc. Rev., 2020, 49, 8584–8686. 204 S. Das J. Perez-Ramirez J. Gong N. Dewangan K. Hidajat B.C. Gates S. Kawi Chem. Soc. Rev. 49 2020 2937 3004 S. Das, J. Perez-Ramirez, J. Gong, N. Dewangan, K. Hidajat, B. C. Gates, S. Kawi, Chem. Soc. Rev., 2020, 49, 2937–3004. 205 M. Xia L. Pan Y. Liu J. Gao J. Li M. Mensi K. Sivula S.M. Zakeeruddin D. Ren M. Gratzel J. Am. Chem. Soc. 145 2023 27939 27949 M. Xia, L. Pan, Y. Liu, J. Gao, J. Li, M. Mensi, K. Sivula, S. M. Zakeeruddin, D. Ren, M. Gratzel, J. Am. Chem. Soc., 2023, 145, 27939–27949. 206 K. Zheng M. Wu J. Zhu W. Zhang S. Liu X. Zhang Y. Wu L. Li B. Li W. Liu J. Hu C. Liu J. Zhu Y. Pan M. Zhou Y. Sun Y. Xie J. Am. Chem. Soc. 146 2024 12233 12242 K. Zheng, M. Wu, J. Zhu, W. Zhang, S. Liu, X. Zhang, Y. Wu, L. Li, B. Li, W. Liu, J. Hu, C. Liu, J. Zhu, Y. Pan, M. Zhou, Y. Sun, Y. Xie, J. Am. Chem. Soc., 2024, 146, 12233–12242. 207 X. Sun Q. Zhu X. Kang H. Liu Q. Qian Z. Zhang B. Han Angew. Chem. Int. Ed. 55 2016 6771 6775 X. Sun, Q. Zhu, X. Kang, H. Liu, Q. Qian, Z. Zhang, B. Han, Angew. Chem. Int. Ed., 2016, 55, 6771–6775. 208 C.W. Li M.W. Kanan J. Am. Chem. Soc. 134 2012 7231 7234 C. W. Li, M. W. Kanan, J. Am. Chem. Soc., 2012, 134, 7231–7234. 209 S. Sarfraz A.T. Garcia-Esparza A. Jedidi L. Cavallo K. Takanabe ACS Catal. 6 2016 2842 2851 S. Sarfraz, A. T. Garcia-Esparza, A. Jedidi, L. Cavallo, K. Takanabe, ACS Catal., 2016, 6, 2842–2851. 210 Y. Yang S. Louisia S. Yu J. Jin I. Roh C. Chen M.V. Fonseca Guzman J. Feijoo P.C. Chen H. Wang C.J. Pollock X. Huang Y.T. Shao C. Wang D.A. Muller H.D. Abruna P. Yang Nature 614 2023 262 269 Y. Yang, S. Louisia, S. Yu, J. Jin, I. Roh, C. Chen, M. V. Fonseca Guzman, J. Feijoo, P. C. Chen, H. Wang, C. J. Pollock, X. Huang, Y. T. Shao, C. Wang, D. A. Muller, H. D. Abruna, P. Yang, Nature, 2023, 614, 262–269. 211 Y. Fang D. Luan Y. Chen S. Gao X.W.D. Lou Angew. Chem. Int. Ed. 59 2020 7178 7183 Y. Fang, D. Luan, Y. Chen, S. Gao, X. W. D. Lou, Angew. Chem. Int. Ed., 2020, 59, 7178–7183. 212 W. Zhang P. He C. Wang T. Ding T. Chen X. Liu L. Cao T. Huang X. Shen O.A. Usoltsev A.L. Bugaev Y. Lin T. Yao J. Mater. Chem. A 8 2020 25970 25977 W. Zhang, P. He, C. Wang, T. Ding, T. Chen, X. Liu, L. Cao, T. Huang, X. Shen, O. A. Usoltsev, A. L. Bugaev, Y. Lin, T. Yao, J. Mater. Chem. A, 2020, 8, 25970–25977. 213 F. Li G.F. Han J.P. Jeon T.J. Shin Z. Fu Y. Lu J.B. Baek ACS Nano 15 2021 11891 11897 F. Li, G. F. Han, J. P. Jeon, T. J. Shin, Z. Fu, Y. Lu, J. B. Baek, ACS Nano, 2021, 15, 11891–11897. 214 L. Pan J.H. Kim M.T. Mayer M.-K. Son A. Ummadisingu J.S. Lee A. Hagfeldt J. Luo M. Grätzel Nat. Catal. 1 2018 412 420 L. Pan, J. H. Kim, M. T. Mayer, M.-K. Son, A. Ummadisingu, J. S. Lee, A. Hagfeldt, J. Luo, M. Grätzel, Nat. Catal., 2018, 1, 412–420. 215 I. Roh S. Yu C.K. Lin S. Louisia S. Cestellos-Blanco P. Yang J. Am. Chem. Soc. 144 2022 8002 8006 I. Roh, S. Yu, C. K. Lin, S. Louisia, S. Cestellos-Blanco, P. Yang, J. Am. Chem. Soc., 2022, 144, 8002–8006. 216 X. Deng R. Li S. Wu L. Wang J. Hu J. Ma W. Jiang N. Zhang X. Zheng C. Gao L. Wang Q. Zhang J. Zhu Y. Xiong J. Am. Chem. Soc. 141 2019 10924 10929 X. Deng, R. Li, S. Wu, L. Wang, J. Hu, J. Ma, W. Jiang, N. Zhang, X. Zheng, C. Gao, L. Wang, Q. Zhang, J. Zhu, Y. Xiong, J. Am. Chem. Soc., 2019, 141, 10924–10929. 217 B. Shan S. Vanka T.-T. Li L. Troian-Gautier M.K. Brennaman Z. Mi T.J. Meyer Nat. Energy 4 2019 290 299 B. Shan, S. Vanka, T.-T. Li, L. Troian-Gautier, M. K. Brennaman, Z. Mi, T. J. Meyer, Nat. Energy, 2019, 4, 290–299. 218 W.J. Dong P. Zhou Y. Xiao I.A. Navid J.-L. Lee Z. Mi ACS Catal. 12 2022 2671 2680 W. J. Dong, P. Zhou, Y. Xiao, I. A. Navid, J.-L. Lee, Z. Mi, ACS Catal., 2022, 12, 2671–2680. 219 W.J. Dong I.A. Navid Y. Xiao J.W. Lim J.L. Lee Z. Mi J. Am. Chem. Soc. 143 2021 10099 10107 W. J. Dong, I. A. Navid, Y. Xiao, J. W. Lim, J. L. Lee, Z. Mi, J. Am. Chem. Soc., 2021, 143, 10099–10107. 220 Y. Pan H. Zhang B. Zhang F. Gong J. Feng H. Huang S. Vanka R. Fan Q. Cao M. Shen Z. Li Z. Zou R. Xiao S. Chu Nat. Commun. 14 2023 1013 Y. Pan, H. Zhang, B. Zhang, F. Gong, J. Feng, H. Huang, S. Vanka, R. Fan, Q. Cao, M. Shen, Z. Li, Z. Zou, R. Xiao, S. Chu, Nat. Commun., 2023, 14, 1013. 221 S. Chu P. Ou P. Ghamari S. Vanka B. Zhou I. Shih J. Song Z. Mi J. Am. Chem. Soc. 140 2018 7869 7877 S. Chu, P. Ou, P. Ghamari, S. Vanka, B. Zhou, I. Shih, J. Song, Z. Mi, J. Am. Chem. Soc., 2018, 140, 7869–7877. 222 C. Li T. Wang B. Liu M. Chen A. Li G. Zhang M. Du H. Wang S.F. Liu J. Gong Energy Environ. Sci. 12 2019 923 928 C. Li, T. Wang, B. Liu, M. Chen, A. Li, G. Zhang, M. Du, H. Wang, S. F. Liu, J. Gong, Energy Environ. Sci., 2019, 12, 923–928. 223 E. Nikoloudakis I. Lopez-Duarte G. Charalambidis K. Ladomenou M. Ince A.G. Coutsolelos Chem. Soc. Rev. 51 2022 6965 7045 E. Nikoloudakis, I. Lopez-Duarte, G. Charalambidis, K. Ladomenou, M. Ince, A. G. Coutsolelos, Chem. Soc. Rev., 2022, 51, 6965–7045. 224 X. Li H. Lei L. Xie N. Wang W. Zhang R. Cao Acc. Chem. Res. 55 2022 878 892 X. Li, H. Lei, L. Xie, N. Wang, W. Zhang, R. Cao, Acc. Chem. Res., 2022, 55, 878–892. 225 D. Yang H. Yu T. He S. Zuo X. Liu H. Yang B. Ni H. Li L. Gu D. Wang X. Wang Nat. Commun. 10 2019 3844 D. Yang, H. Yu, T. He, S. Zuo, X. Liu, H. Yang, B. Ni, H. Li, L. Gu, D. Wang, X. Wang, Nat. Commun., 2019, 10, 3844. 226 B. Wang F. Yang Y. Dong Y. Cao J. Wang B. Yang Y. Wei W. Wan J. Chen H. Jing Chem. Eng. J. 396 2020 125255 B. Wang, F. Yang, Y. Dong, Y. Cao, J. Wang, B. Yang, Y. Wei, W. Wan, J. Chen, H. Jing, Chem. Eng. J., 2020, 396, 125255. 227 Z. Wei Y. Su W. Pan J. Shen R. Fan W. Yang Z. Deng M. Shen Y. Peng Angew. Chem. Int. Ed. 62 2023 e202305558 Z. Wei, Y. Su, W. Pan, J. Shen, R. Fan, W. Yang, Z. Deng, M. Shen, Y. Peng, Angew. Chem. Int. Ed., 2023, 62, e202305558. 228 H. Liu J. Li J. Arbiol B. Yang P. Tang EcoEnergy 1 2023 154 185 H. Liu, J. Li, J. Arbiol, B. Yang, P. Tang, EcoEnergy, 2023, 1, 154–185. 229 Y. Tan Y. Zhao X. Chen S. Zhai X. Wang L. Su H. Yang W.Q. Deng G.W. Ho H. Wu EcoEnergy 2024 https://doi.org/10.1002/ece2.33 Y. Tan, Y. Zhao, X. Chen, S. Zhai, X. Wang, L. Su, H. Yang, W. Q. Deng, G. W. Ho, H. Wu, EcoEnergy, 2024. https://doi.org/10.1002/ece2.33 230 T. Cui Y.P. Wang T. Ye J. Wu Z. Chen J. Li Y. Lei D. Wang Y. Li Angew. Chem. Int. Ed. 61 2022 e202115219 T. Cui, Y. P. Wang, T. Ye, J. Wu, Z. Chen, J. Li, Y. Lei, D. Wang, Y. Li, Angew. Chem. Int. Ed., 2022, 61, e202115219. 231 W. Wang L. Du R. Xia R. Liang T. Zhou H.K. Lee Z. Yan H. Luo C. Shang D.L. Phillips Z. Guo Energy Environ. Sci. 16 2023 460 472 W. Wang, L. Du, R. Xia, R. Liang, T. Zhou, H. K. Lee, Z. Yan, H. Luo, C. Shang, D. L. Phillips, Z. Guo, Energy Environ. Sci., 2023, 16, 460–472. 232 C.-F. Li J.-W. Zhao L.-j. Xie J.-Q. Wu G.-R. Li Appl. Catal. B 282 2021 119463 C.-F. Li, J.-W. Zhao, L.-j. Xie, J.-Q. Wu, G.-R. Li, Appl. Catal. B, 2021, 282, 119463. 233 K. Dong D.T. Tran X. Li S. Prabhakaran D.H. Kim N.H. Kim J.H. Lee Appl. Catal. B 344 2024 123649 K. Dong, D. T. Tran, X. Li, S. Prabhakaran, D. H. Kim, N. H. Kim, J. H. Lee, Appl. Catal. B, 2024, 344, 123649. 234 Y. Chen Z. Li Y. Zhu D. Sun X. Liu L. Xu Y. Tang Adv. Mater. 31 2019 1806312 Y. Chen, Z. Li, Y. Zhu, D. Sun, X. Liu, L. Xu, Y. Tang, Adv. Mater., 2019, 31, 1806312. 235 L. Ding N. Zhu Y. Hu Z. Chen P. Song T. Sheng Z. Wu Y. Xiong Angew. Chem. Int. Ed. 61 2022 e202209268 L. Ding, N. Zhu, Y. Hu, Z. Chen, P. Song, T. Sheng, Z. Wu, Y. Xiong, Angew. Chem. Int. Ed., 2022, 61, e202209268. 236 R. Li T. Takata B. Zhang C. Feng Q. Wu C. Cui Z. Zhang K. Domen Y. Li Angew. Chem. Int. Ed. 62 2023 e202313537 R. Li, T. Takata, B. Zhang, C. Feng, Q. Wu, C. Cui, Z. Zhang, K. Domen, Y. Li, Angew. Chem. Int. Ed., 2023, 62, e202313537. 237 T. Ouyang Y.Q. Ye C.Y. Wu K. Xiao Z.Q. Liu Angew. Chem. Int. Ed. 58 2019 4923 4928 T. Ouyang, Y. Q. Ye, C. Y. Wu, K. Xiao, Z. Q. Liu, Angew. Chem. Int. Ed., 2019, 58, 4923–4928. 238 Y. Zhao Y. Guo X.F. Lu D. Luan X. Gu X.W.D. Lou Adv. Mater. 34 2022 2203442 Y. Zhao, Y. Guo, X. F. Lu, D. Luan, X. Gu, X. W. D. Lou, Adv. Mater., 2022, 34, 2203442. 239 W. Bao Y. Tang J. Yu W. Yan C. Wang Y. Li Z. Wang J. Yang L. Zhang F. Yu Appl. Catal. B 346 2024 123706 W. Bao, Y. Tang, J. Yu, W. Yan, C. Wang, Y. Li, Z. Wang, J. Yang, L. Zhang, F. Yu, Appl. Catal. B, 2024, 346, 123706. 240 Y.-W. Dong H.-J. Liu X. Wang F.-L. Wang X.-Y. Zhang Q.-X. Lv C.-Y. Liu Y.-M. Chai B. Dong Appl. Catal. B 328 2023 122464 Y.-W. Dong, H.-J. Liu, X. Wang, F.-L. Wang, X.-Y. Zhang, Q.-X. Lv, C.-Y. Liu, Y.-M. Chai, B. Dong, Appl. Catal. B, 2023, 328, 122464. 241 L. Su P. Wang M. Li Z. Zhao Y. Li S. Zhan Appl. Catal. B 335 2023 122890 L. Su, P. Wang, M. Li, Z. Zhao, Y. Li, S. Zhan, Appl. Catal. B, 2023, 335, 122890. 242 L. Wu M. Ning X. Xing Y. Wang F. Zhang G. Gao S. Song D. Wang C. Yuan L. Yu J. Bao S. Chen Z. Ren Adv. Mater. 35 2023 2306097 L. Wu, M. Ning, X. Xing, Y. Wang, F. Zhang, G. Gao, S. Song, D. Wang, C. Yuan, L. Yu, J. Bao, S. Chen, Z. Ren, Adv. Mater., 2023, 35, 2306097. 243 S. Zhang H. Li L. Wang J. Liu G. Liang K. Davey J. Ran S.Z. Qiao J. Am. Chem. Soc. 145 2023 6410 6419 S. Zhang, H. Li, L. Wang, J. Liu, G. Liang, K. Davey, J. Ran, S. Z. Qiao, J. Am. Chem. Soc., 2023, 145, 6410–6419. 244 L.-L. Zheng L. Tian L.-S. Zhang J. Yu Y. Chen Q. Fu X.-Z. Liu D.-S. Wu J.-P. Zou ACS Catal. 14 2024 2134 2143 L.-L. Zheng, L. Tian, L.-S. Zhang, J. Yu, Y. Chen, Q. Fu, X.-Z. Liu, D.-S. Wu, J.-P. Zou, ACS Catal., 2024, 14, 2134–2143. 245 Y. Su W. Yu L. Liao X. Xiong H. Chen L. Hu T. Lei J. Zhao D. Chen W. Mai Adv. Funct. Mater. 33 2023 2303976 Y. Su, W. Yu, L. Liao, X. Xiong, H. Chen, L. Hu, T. Lei, J. Zhao, D. Chen, W. Mai, Adv. Funct. Mater., 2023, 33, 2303976. 246 H. Xia R. Pang X. Dong Q. Liu J. Chen E. Wang J. Li J. Am. Chem. Soc. 145 2023 25695 25704 H. Xia, R. Pang, X. Dong, Q. Liu, J. Chen, E. Wang, J. Li, J. Am. Chem. Soc., 2023, 145, 25695–25704. 247 H. Pei L. Peng Z. Jiang Y. Zhang R. Li T. Peng Adv. Funct. Mater. 2024 2401122 H. Pei, L. Peng, Z. Jiang, Y. Zhang, R. Li, T. Peng, Adv. Funct. Mater., 2024, 2401122. 248 H. Li W. Wang S. Xue J. He C. Liu G. Gao S. Di S. Wang J. Wang Z. Yu L. Li J. Am. Chem. Soc. 146 2024 9124 9133 H. Li, W. Wang, S. Xue, J. He, C. Liu, G. Gao, S. Di, S. Wang, J. Wang, Z. Yu, L. Li, J. Am. Chem. Soc., 2024, 146, 9124–9133. 249 M. Song Y. Wu Z. Zhao M. Zheng C. Wang J. Lu Adv. Mater. 2024 2403234 M. Song, Y. Wu, Z. Zhao, M. Zheng, C. Wang, J. Lu, Adv. Mater., 2024, 2403234. 250 Z. Zhang Z. Zhang C. Chen R. Wang M. Xie S. Wan R. Zhang L. Cong H. Lu Y. Han W. Xing Z. Shi S. Feng Nat. Commun. 15 2024 2556 Z. Zhang, Z. Zhang, C. Chen, R. Wang, M. Xie, S. Wan, R. Zhang, L. Cong, H. Lu, Y. Han, W. Xing, Z. Shi, S. Feng, Nat. Commun., 2024, 15, 2556. 251 W. Wan Y. Zhao S. Wei C.A. Triana J. Li A. Arcifa C.S. Allen R. Cao G.R. Patzke Nat. Commun. 12 2021 5589 W. Wan, Y. Zhao, S. Wei, C. A. Triana, J. Li, A. Arcifa, C. S. Allen, R. Cao, G. R. Patzke, Nat. Commun., 2021, 12, 5589. 252 S. Ji Y. Chen X. Wang Z. Zhang D. Wang Y. Li Chem. Rev. 120 2020 11900 11955 S. Ji, Y. Chen, X. Wang, Z. Zhang, D. Wang, Y. Li, Chem. Rev., 2020, 120, 11900–11955. 253 Y. Chen S. Ji C. Chen Q. Peng D. Wang Y. Li Joule 2 2018 1242 1264 Y. Chen, S. Ji, C. Chen, Q. Peng, D. Wang, Y. Li, Joule, 2018, 2, 1242–1264. 254 X. Xie C. He B. Li Y. He D.A. Cullen E.C. Wegener A.J. Kropf U. Martinez Y. Cheng M.H. Engelhard M.E. Bowden M. Song T. Lemmon X.S. Li Z. Nie J. Liu D.J. Myers P. Zelenay G. Wang G. Wu V. Ramani Y. Shao Nat. Catal. 3 2020 1044 1054 X. Xie, C. He, B. Li, Y. He, D. A. Cullen, E. C. Wegener, A. J. Kropf, U. Martinez, Y. Cheng, M. H. Engelhard, M. E. Bowden, M. Song, T. Lemmon, X. S. Li, Z. Nie, J. Liu, D. J. Myers, P. Zelenay, G. Wang, G. Wu, V. Ramani, Y. Shao, Nat. Catal., 2020, 3, 1044–1054. 255 J. Liu T. Wang Z. Lin M. Liao S. Liu S. Wang Z. Cai H. Sun Y. Shen Y. Huang Q. Li Energy Environ. Sci. 17 2024 3088 3098 J. Liu, T. Wang, Z. Lin, M. Liao, S. Liu, S. Wang, Z. Cai, H. Sun, Y. Shen, Y. Huang, Q. Li, Energy Environ. Sci., 2024, 17, 3088–3098. 256 L. Zhang Y. Jia G. Gao X. Yan N. Chen J. Chen M.T. Soo B. Wood D. Yang A. Du X. Yao Chem 4 2018 285 297 L. Zhang, Y. Jia, G. Gao, X. Yan, N. Chen, J. Chen, M. T. Soo, B. Wood, D. Yang, A. Du, X. Yao, Chem, 2018, 4, 285–297. 257 B. Zhao X. Huang Y. Ding Y. Bi Angew. Chem. Int. Ed. 62 2023 e202213067 B. Zhao, X. Huang, Y. Ding, Y. Bi, Angew. Chem. Int. Ed., 2023, 62, e202213067. 258 X. Zhang P. Zhai Y. Zhang Y. Wu C. Wang L. Ran J. Gao Z. Li B. Zhang Z. Fan L. Sun J. Hou J. Am. Chem. Soc. 143 2021 20657 20669 X. Zhang, P. Zhai, Y. Zhang, Y. Wu, C. Wang, L. Ran, J. Gao, Z. Li, B. Zhang, Z. Fan, L. Sun, J. Hou, J. Am. Chem. Soc., 2021, 143, 20657–20669. 259 T. Wang L. Guo H. Pei S. Chen R. Li J. Zhang T. Peng Small 17 2021 2102957 T. Wang, L. Guo, H. Pei, S. Chen, R. Li, J. Zhang, T. Peng, Small, 2021, 17, 2102957. 260 J. Chen D. Zhang B. Liu K. Zheng Y. Li Y. Xu Z. Li X. Liu Angew. Chem. Int. Ed. 63 2024 e202401168 J. Chen, D. Zhang, B. Liu, K. Zheng, Y. Li, Y. Xu, Z. Li, X. Liu, Angew. Chem. Int. Ed., 2024, 63, e202401168. 261 P. Guo S. Cao W. Huang X. Lu W. Chen Y. Zhang Y. Wang X. Xin R. Zou S. Liu X. Li Adv. Mater. 36 2024 2311766 P. Guo, S. Cao, W. Huang, X. Lu, W. Chen, Y. Zhang, Y. Wang, X. Xin, R. Zou, S. Liu, X. Li, Adv. Mater., 2024, 36, 2311766. 262 H. Li H. Gong Z. Jin Appl. Catal. B 307 2022 121166 H. Li, H. Gong, Z. Jin, Appl. Catal. B, 2022, 307, 121166. 263 Y. Wei R. Duan Q. Zhang Y. Cao J. Wang B. Wang W. Wan C. Liu J. Chen H. Gao H. Jing Chin. J. Catal. 47 2023 243 253 Y. Wei, R. Duan, Q. Zhang, Y. Cao, J. Wang, B. Wang, W. Wan, C. Liu, J. Chen, H. Gao, H. Jing, Chin. J. Catal., 2023, 47, 243–253. 264 Z. Lu J. Wang P. Zhang W. Guo Y. Shen P. Liu J. Ji H. Du M. Zhao H. Liang J. Guo Appl. Catal. B 353 2024 124073 Z. Lu, J. Wang, P. Zhang, W. Guo, Y. Shen, P. Liu, J. Ji, H. Du, M. Zhao, H. Liang, J. Guo, Appl. Catal. B, 2024, 353, 124073. 265 Z. Xie D. Chen J. Zhai Y. Huang H. Ji Appl. Catal. B 334 2023 122865 Z. Xie, D. Chen, J. Zhai, Y. Huang, H. Ji, Appl. Catal. B, 2023, 334, 122865. 266 B. Shang C.L. Rooney D.J. Gallagher B.T. Wang A. Krayev H. Shema O. Leitner N.J. Harmon L. Xiao C. Sheehan S.R. Bottum E. Gross J.F. Cahoon T.E. Mallouk H. Wang Angew. Chem. Int. Ed. 62 2023 e202215213 B. Shang, C. L. Rooney, D. J. Gallagher, B. T. Wang, A. Krayev, H. Shema, O. Leitner, N. J. Harmon, L. Xiao, C. Sheehan, S. R. Bottum, E. Gross, J. F. Cahoon, T. E. Mallouk, H. Wang, Angew. Chem. Int. Ed., 2023, 62, e202215213. 267 Y. Gao B. Liu D. Wang Adv. Mater. 35 2023 2209654 Y. Gao, B. Liu, D. Wang, Adv. Mater., 2023, 35, 2209654. 268 Z. Ma Z. Yang W. Lai Q. Wang Y. Qiao H. Tao C. Lian M. Liu C. Ma A. Pan H. Huang Nat. Commun. 13 2022 7596 Z. Ma, Z. Yang, W. Lai, Q. Wang, Y. Qiao, H. Tao, C. Lian, M. Liu, C. Ma, A. Pan, H. Huang, Nat. Commun., 2022, 13, 7596. 269 Y. Zhao L. Hao A. Ozden S. Liu R.K. Miao P. Ou T. Alkayyali S. Zhang J. Ning Y. Liang Y. Xu M. Fan Y. Chen J.E. Huang K. Xie J. Zhang C.P. O’Brien F. Li E.H. Sargent D. Sinton Nature Synthesis 2 2023 403 412 Y. Zhao, L. Hao, A. Ozden, S. Liu, R. K. Miao, P. Ou, T. Alkayyali, S. Zhang, J. Ning, Y. Liang, Y. Xu, M. Fan, Y. Chen, J. E. Huang, K. Xie, J. Zhang, C. P. O’Brien, F. Li, E. H. Sargent, D. Sinton, Nature Synthesis, 2023, 2, 403–412. 270 H. Liu T. Yan S. Tan L. Sun Z. Zhang S. Hu S.H. Li X. Kang Y. Lei L. Jiang T. Hou L. Liu Q. Yu B. Liu J. Am. Chem. Soc. 146 2024 5333 5342 H. Liu, T. Yan, S. Tan, L. Sun, Z. Zhang, S. Hu, S. H. Li, X. Kang, Y. Lei, L. Jiang, T. Hou, L. Liu, Q. Yu, B. Liu, J. Am. Chem. Soc., 2024, 146, 5333–5342. 271 G. Ren M. Zhou P. Hu J.F. Chen H. Wang Nat. Commun. 15 2024 2346 G. Ren, M. Zhou, P. Hu, J. F. Chen, H. Wang, Nat. Commun., 2024, 15, 2346. 272 R. Yang M. Wu D. Huang Y. Yang Y. Liu L. Zhang F. Lai B. You J. Fang T. Liu Y. Liu T. Zhai Energy Environ. Sci. 17 2024 2897 2907 R. Yang, M. Wu, D. Huang, Y. Yang, Y. Liu, L. Zhang, F. Lai, B. You, J. Fang, T. Liu, Y. Liu, T. Zhai, Energy Environ. Sci., 2024, 17, 2897–2907. 273 H. Chai S. Wang X. Wang J. Ma J. Jin ACS Catal. 12 2022 3700 3709 H. Chai, S. Wang, X. Wang, J. Ma, J. Jin, ACS Catal., 2022, 12, 3700–3709. 274 B. Shang F. Zhao S. Suo Y. Gao C. Sheehan S. Jeon J. Li C.L. Rooney O. Leitner L. Xiao H. Fan M. Elimelech L. Wang G.J. Meyer E.A. Stach T.E. Mallouk T. Lian H. Wang J. Am. Chem. Soc. 146 2024 2267 2274 B. Shang, F. Zhao, S. Suo, Y. Gao, C. Sheehan, S. Jeon, J. Li, C. L. Rooney, O. Leitner, L. Xiao, H. Fan, M. Elimelech, L. Wang, G. J. Meyer, E. A. Stach, T. E. Mallouk, T. Lian, H. Wang, J. Am. Chem. Soc., 2024, 146, 2267–2274. 275 C. Li J. He Y. Xiao Y. Li J.-J. Delaunay Energy Environ. Sci. 13 2020 3269 3306 C. Li, J. He, Y. Xiao, Y. Li, J.-J. Delaunay, Energy Environ. Sci., 2020, 13, 3269–3306. 276 P. Ren T. Zhang N. Jain H.Y.V. Ching A. Jaworski G. Barcaro S. Monti J. Silvestre-Albero V. Celorrio L. Chouhan A. Rokicinska E. Debroye P. Kustrowski S. Van Doorslaer S. Van Aert S. Bals S. Das J. Am. Chem. Soc. 145 2023 16584 16596 P. Ren, T. Zhang, N. Jain, H. Y. V. Ching, A. Jaworski, G. Barcaro, S. Monti, J. Silvestre-Albero, V. Celorrio, L. Chouhan, A. Rokicinska, E. Debroye, P. Kustrowski, S. Van Doorslaer, S. Van Aert, S. Bals, S. Das, J. Am. Chem. Soc., 2023, 145, 16584–16596. 277 K. Shah R. Dai M. Mateen Z. Hassan Z. Zhuang C. Liu M. Israr W.C. Cheong B. Hu R. Tu C. Zhang X. Chen Q. Peng C. Chen Y. Li Angew. Chem. Int. Ed. 61 2022 e202114951 K. Shah, R. Dai, M. Mateen, Z. Hassan, Z. Zhuang, C. Liu, M. Israr, W. C. Cheong, B. Hu, R. Tu, C. Zhang, X. Chen, Q. Peng, C. Chen, Y. Li, Angew. Chem. Int. Ed., 2022, 61, e202114951. 278 Z. Yang C. Zhao Y. Qu H. Zhou F. Zhou J. Wang Y. Wu Y. Li Adv. Mater. 31 2019 1808043 Z. Yang, C. Zhao, Y. Qu, H. Zhou, F. Zhou, J. Wang, Y. Wu, Y. Li, Adv. Mater., 2019, 31, 1808043. 279 Y. Sun J. Wang S. Xi J. Shen S. Luo J. Ge S. Sun Y. Chen J.V. Hanna S. Li X. Wang Z.J. Xu Nat. Commun. 14 2023 2467 Y. Sun, J. Wang, S. Xi, J. Shen, S. Luo, J. Ge, S. Sun, Y. Chen, J. V. Hanna, S. Li, X. Wang, Z. J. Xu, Nat. Commun., 2023, 14, 2467. 280 J. Diao Y. Qiu S. Liu W. Wang K. Chen H. Li W. Yuan Y. Qu X. Guo Adv. Mater. 32 2020 e1905679 J. Diao, Y. Qiu, S. Liu, W. Wang, K. Chen, H. Li, W. Yuan, Y. Qu, X. Guo, Adv. Mater., 2020, 32, e1905679. 281 H. Zhang J. Gao D. Raciti A.S. Hall Nat. Catal. 6 2023 807 817 H. Zhang, J. Gao, D. Raciti, A. S. Hall, Nat. Catal., 2023, 6, 807–817. 282 A. Deng E. Zhao Q. Li Y. Sun Y. Liu S. Yang H. He Y. Xu W. Zhao H. Song Z. Xu Z. Chen ACS Nano 17 2023 11869 11881 A. Deng, E. Zhao, Q. Li, Y. Sun, Y. Liu, S. Yang, H. He, Y. Xu, W. Zhao, H. Song, Z. Xu, Z. Chen, ACS Nano, 2023, 17, 11869–11881. 283 S. Bai W. Jing G. He C. Liao F. Wang Y. Liu L. Guo ACS Nano 17 2023 10976 10986 S. Bai, W. Jing, G. He, C. Liao, F. Wang, Y. Liu, L. Guo, ACS Nano, 2023, 17, 10976–10986. 284 Y. Cao S. Chen S. Bo W. Fan J. Li C. Jia Z. Zhou Q. Liu L. Zheng F. Zhang Angew. Chem. Int. Ed. 62 2023 e202303048 Y. Cao, S. Chen, S. Bo, W. Fan, J. Li, C. Jia, Z. Zhou, Q. Liu, L. Zheng, F. Zhang, Angew. Chem. Int. Ed., 2023, 62, e202303048. 285 X. Li Y. Sun J. Xu Y. Shao J. Wu X. Xu Y. Pan H. Ju J. Zhu Y. Xie Nat. Energy 4 2019 690 699 X. Li, Y. Sun, J. Xu, Y. Shao, J. Wu, X. Xu, Y. Pan, H. Ju, J. Zhu, Y. Xie, Nat. Energy, 2019, 4, 690–699. 286 P. Wu H. Yelemulati S. Zhu B. Peng H. Li H. Ye J. Hou K. Wu Z. Liu Chem. Eng. J. 466 2023 143252 P. Wu, H. Yelemulati, S. Zhu, B. Peng, H. Li, H. Ye, J. Hou, K. Wu, Z. Liu, Chem. Eng. J., 2023, 466, 143252. 287 M. Sun W. Chen X. Jiang B. Liu B. Tan L. Luo M. Xie Z. Zhang ACS Appl Mater Interfaces 14 2022 43946 43954 M. Sun, W. Chen, X. Jiang, B. Liu, B. Tan, L. Luo, M. Xie, Z. Zhang, ACS Appl Mater Interfaces, 2022, 14, 43946–43954. 288 X. Wan Z. Zhang H. Niu Y. Yin C. Kuai J. Wang C. Shao Y. Guo J. Phys. Chem. Lett. 12 2021 6111 6118 X. Wan, Z. Zhang, H. Niu, Y. Yin, C. Kuai, J. Wang, C. Shao, Y. Guo, J. Phys. Chem. Lett., 2021, 12, 6111–6118. 289 L. Wu T. Guo T. Li iScience 24 2021 102398 L. Wu, T. Guo, T. Li, iScience, 2021, 24, 102398. 290 Y. Sun H. Liao J. Wang B. Chen S. Sun S.J.H. Ong S. Xi C. Diao Y. Du J.-O. Wang M.B.H. Breese S. Li H. Zhang Z.J. Xu Nat. Catal. 3 2020 554 563 Y. Sun, H. Liao, J. Wang, B. Chen, S. Sun, S. J. H. Ong, S. Xi, C. Diao, Y. Du, J.-O. Wang, M. B. H. Breese, S. Li, H. Zhang, Z. J. Xu, Nat. Catal., 2020, 3, 554–563. 291 Z. Li L.E.K. Achenie H. Xin ACS Catal. 10 2020 4377 4384 Z. Li, L. E. K. Achenie, H. Xin, ACS Catal., 2020, 10, 4377–4384. 292 L. Zhang X. Guo S. Zhang T. Frauenheim S. Huang Adv. Energy Mater. 14 2023 2302754 L. Zhang, X. Guo, S. Zhang, T. Frauenheim, S. Huang, Adv. Energy Mater., 2023, 14, 2302754. 293 M. Chouchane W. Yao A. Cronk M. Zhang Y.S. Meng ACS Energy Lett. 9 2024 1480 1486 M. Chouchane, W. Yao, A. Cronk, M. Zhang, Y. S. Meng, ACS Energy Lett., 2024, 9, 1480–1486. 294 Z.W. Ulissi A.J. Medford T. Bligaard J.K. Norskov Nat. Commun. 8 2017 14621 Z. W. Ulissi, A. J. Medford, T. Bligaard, J. K. Norskov, Nat. Commun., 2017, 8, 14621. 295 C. Gao X. Min M. Fang T. Tao X. Zheng Y. Liu X. Wu Z. Huang Adv. Funct. Mater. 32 2021 2108044 C. Gao, X. Min, M. Fang, T. Tao, X. Zheng, Y. Liu, X. Wu, Z. Huang, Adv. Funct. Mater., 2021, 32, 2108044. 296 Z. Wang Y. Gu L. Zheng J. Hou H. Zheng S. Sun L. Wang Adv. Mater. 34 2022 e2106776 Z. Wang, Y. Gu, L. Zheng, J. Hou, H. Zheng, S. Sun, L. Wang, Adv. Mater., 2022, 34, e2106776. 297 A. Venugopal R. Kas K. Hau W.A. Smith J. Am. Chem. Soc. 143 2021 18581 18591 A. Venugopal, R. Kas, K. Hau, W. A. Smith, J. Am. Chem. Soc., 2021, 143, 18581–18591. 298 E. Landaeta N.I. Kadosh Z.D. Schultz ACS Catal. 13 2023 1638 1648 E. Landaeta, N. I. Kadosh, Z. D. Schultz, ACS Catal., 2023, 13, 1638–1648. 299 Y. Liu M. Xia L. Yao M. Mensi D. Ren M. Grätzel K. Sivula N. Guijarro Adv. Funct. Mater. 31 2021 2010081 Y. Liu, M. Xia, L. Yao, M. Mensi, D. Ren, M. Grätzel, K. Sivula, N. Guijarro, Adv. Funct. Mater., 2021, 31, 2010081. 300 X. Li J. Wu C. Dong Y. Kou C. Hu J. Zang J. Zhu B. Ma Y. Li Y. Ding Appl. Catal. B 353 2024 124096 X. Li, J. Wu, C. Dong, Y. Kou, C. Hu, J. Zang, J. Zhu, B. Ma, Y. Li, Y. Ding, Appl. Catal. B, 2024, 353, 124096. 301 S. Liu L. Wu D. Tang J. Xue K. Dang H. He S. Bai H. Ji C. Chen Y. Zhang J. Zhao J. Am. Chem. Soc. 145 2023 23849 23858 S. Liu, L. Wu, D. Tang, J. Xue, K. Dang, H. He, S. Bai, H. Ji, C. Chen, Y. Zhang, J. Zhao, J. Am. Chem. Soc., 2023, 145, 23849–23858. 302 B.M. Tackett E. Gomez J.G. Chen Nat. Catal. 2 2019 381 386 B. M. Tackett, E. Gomez, J. G. Chen, Nat. Catal., 2019, 2, 381–386. 303 X. Hu X. Liu X. Hu C. Zhao Q. Guan W. Li Adv. Funct. Mater. 33 2023 202214215 X. Hu, X. Liu, X. Hu, C. Zhao, Q. Guan, W. Li, Adv. Funct. Mater., 2023, 33, 202214215. 304 J. Zhou J. Pan Y. Jin Z. Peng Z. Xu Q. Chen P. Ren X. Zhou K. Wu J. Am. Chem. Soc. 144 2022 8430 8433 J. Zhou, J. Pan, Y. Jin, Z. Peng, Z. Xu, Q. Chen, P. Ren, X. Zhou, K. Wu, J. Am. Chem. Soc., 2022, 144, 8430–8433. 305 D.M. Koshy S.S. Nathan A.S. Asundi A.M. Abdellah S.M. Dull D.A. Cullen D. Higgins Z. Bao S.F. Bent T.F. Jaramillo Angew. Chem. Int. Ed. 60 2021 17472 17480 D. M. Koshy, S. S. Nathan, A. S. Asundi, A. M. Abdellah, S. M. Dull, D. A. Cullen, D. Higgins, Z. Bao, S. F. Bent, T. F. Jaramillo, Angew. Chem. Int. Ed., 2021, 60, 17472–17480. 306 X. Bian Y. Zhao G.I.N. Waterhouse Y. Miao C. Zhou L.Z. Wu T. Zhang Angew. Chem. Int. Ed. 62 2023 e202304452 X. Bian, Y. Zhao, G. I. N. Waterhouse, Y. Miao, C. Zhou, L. Z. Wu, T. Zhang, Angew. Chem. Int. Ed., 2023, 62, e202304452. 307 L. Hao Q. Xia Q. Zhang J. Masa Z. Sun Chin. J. Catal. 42 2021 1903 1920 L. Hao, Q. Xia, Q. Zhang, J. Masa, Z. Sun, Chin. J. Catal., 2021, 42, 1903–1920. 308 V. Andrei R.L.Z. Hoye M. Crespo‐Quesada M. Bajada S. Ahmad M. De Volder R. Friend E. Reisner Adv. Energy Mater. 8 2018 1801403 V. Andrei, R. L. Z. Hoye, M. Crespo‐Quesada, M. Bajada, S. Ahmad, M. De Volder, R. Friend, E. Reisner, Adv. Energy Mater., 2018, 8, 1801403. 309 M. Gao C.K. Peh L. Zhu G. Yilmaz G.W. Ho Adv. Energy Mater. 10 2020 2000925 M. Gao, C. K. Peh, L. Zhu, G. Yilmaz, G. W. Ho, Adv. Energy Mater., 2020, 10, 2000925. 310 S. Guo X. Li J. Li B. Wei Nat. Commun. 12 2021 1343 S. Guo, X. Li, J. Li, B. Wei, Nat. Commun., 2021, 12, 1343. 311 H. Han K. Huang Y. Yao Z. Li X. Meng Chem. Eng. J. 450 2022 138419 H. Han, K. Huang, Y. Yao, Z. Li, X. Meng, Chem. Eng. J., 2022, 450, 138419. 312 Y. Lu H. Zhang D. Fan Z. Chen X. Yang J. Hazard. Mater. 423 2022 127128 Y. Lu, H. Zhang, D. Fan, Z. Chen, X. Yang, J. Hazard. Mater., 2022, 423, 127128. 313 J. Ma X. Mao C. Hu X. Wang W. Gong D. Liu R. Long A. Du H. Zhao Y. Xiong J. Am. Chem. Soc. 146 2024 970 978 J. Ma, X. Mao, C. Hu, X. Wang, W. Gong, D. Liu, R. Long, A. Du, H. Zhao, Y. Xiong, J. Am. Chem. Soc., 2024, 146, 970–978. 314 P.G. O’Brien K.K. Ghuman F.M. Ali A. Sandhel T.E. Wood J.Y.Y. Loh J. Jia D. Perovic C.V. Singh N.P. Kherani C.A. Mims G.A. Ozin Energy Environ. Sci. 11 2018 3443 3451 P. G. O’Brien, K. K. Ghuman, F. M. Ali, A. Sandhel, T. E. Wood, J. Y. Y. Loh, J. Jia, D. Perovic, C. V. Singh, N. P. Kherani, C. A. Mims, G. A. Ozin, Energy Environ. Sci., 2018, 11, 3443–3451. 315 C. Pornrungroj V. Andrei E. Reisner J. Am. Chem. Soc. 145 2023 13709 13714 C. Pornrungroj, V. Andrei, E. Reisner, J. Am. Chem. Soc., 2023, 145, 13709–13714. 316 C. Pornrungroj A.B. Mohamad Annuar Q. Wang M. Rahaman S. Bhattacharjee V. Andrei E. Reisner Nat. Water 1 2023 952 960 C. Pornrungroj, A. B. Mohamad Annuar, Q. Wang, M. Rahaman, S. Bhattacharjee, V. Andrei, E. Reisner, Nat. Water, 2023, 1, 952–960. 317 S. Sorcar Y. Hwang J. Lee H. Kim K.M. Grimes C.A. Grimes J.-W. Jung C.-H. Cho T. Majima M.R. Hoffmann S.-I. In Energy Environ. Sci. 12 2019 2685 2696 S. Sorcar, Y. Hwang, J. Lee, H. Kim, K. M. Grimes, C. A. Grimes, J.-W. Jung, C.-H. Cho, T. Majima, M. R. Hoffmann, S.-I. In, Energy Environ. Sci., 2019, 12, 2685–2696. 318 G. Chen R. Gao Y. Zhao Z. Li G.I.N. Waterhouse R. Shi J. Zhao M. Zhang L. Shang G. Sheng X. Zhang X. Wen L.Z. Wu C.H. Tung T. Zhang Adv. Mater. 30 2018 1704663 G. Chen, R. Gao, Y. Zhao, Z. Li, G. I. N. Waterhouse, R. Shi, J. Zhao, M. Zhang, L. Shang, G. Sheng, X. Zhang, X. Wen, L. Z. Wu, C. H. Tung, T. Zhang, Adv. Mater., 2018, 30, 1704663. 319 P. Yao H. Gong Z.-Y. Wu H. Fu B. Li B. Zhu J. Ji X. Wang N. Xu C. Tang H. Zhang J. Zhu Nat. Sustain. 5 2022 348 356 P. Yao, H. Gong, Z.-Y. Wu, H. Fu, B. Li, B. Zhu, J. Ji, X. Wang, N. Xu, C. Tang, H. Zhang, J. Zhu, Nat. Sustain., 2022, 5, 348–356. 320 X. Lou P. Yan B. Jiao Q. Li P. Xu L. Wang L. Zhang M. Cao G. Wang Z. Chen Q. Zhang J. Chen Nat. Commun. 15 2024 2730 X. Lou, P. Yan, B. Jiao, Q. Li, P. Xu, L. Wang, L. Zhang, M. Cao, G. Wang, Z. Chen, Q. Zhang, J. Chen, Nat. Commun., 2024, 15, 2730. 321 Z. Li J. Liu Y. Zhao G.I.N. Waterhouse G. Chen R. Shi X. Zhang X. Liu Y. Wei X.D. Wen L.Z. Wu C.H. Tung T. Zhang Adv. Mater. 30 2018 1800527 Z. Li, J. Liu, Y. Zhao, G. I. N. Waterhouse, G. Chen, R. Shi, X. Zhang, X. Liu, Y. Wei, X. D. Wen, L. Z. Wu, C. H. Tung, T. Zhang, Adv. Mater., 2018, 30, 1800527. 322 U.T. Bornscheuer G.W. Huisman R.J. Kazlauskas S. Lutz J.C. Moore K. Robins Nature 485 2012 185 194 U. T. Bornscheuer, G. W. Huisman, R. J. Kazlauskas, S. Lutz, J. C. Moore, K. Robins, Nature, 2012, 485, 185–194. 323 M.W. van der Kamp E.J. Prentice K.L. Kraakman M. Connolly A.J. Mulholland V.L. Arcus Nat. Commun. 9 2018 1177 M. W. van der Kamp, E. J. Prentice, K. L. Kraakman, M. Connolly, A. J. Mulholland, V. L. Arcus, Nat. Commun., 2018, 9, 1177. 324 W. Fu N.M. Neris Y. Fu Y. Zhao B. Krohn-Hansen P. Liu Y. Yang Nat. Catal. 6 2023 628 636 W. Fu, N. M. Neris, Y. Fu, Y. Zhao, B. Krohn-Hansen, P. Liu, Y. Yang, Nat. Catal., 2023, 6, 628–636. 325 R. Chen C. Ni J. Zhu F. Fan C. Li Nat. Protoc. 2024 https://doi.org/10.1038/s41596-024-00992-2 R. Chen, C. Ni, J. Zhu, F. Fan, C. Li, Nat. Protoc., 2024. https://doi.org/10.1038/s41596-024-00992-2 326 E. Erickson J.E. Gado L. Avilan F. Bratti R.K. Brizendine P.A. Cox R. Gill R. Graham D.J. Kim G. Konig W.E. Michener S. Poudel K.J. Ramirez T.J. Shakespeare M. Zahn E.S. Boyd C.M. Payne J.L. DuBois A.R. Pickford G.T. Beckham J.E. McGeehan Nat. Commun. 13 2022 7850 E. Erickson, J. E. Gado, L. Avilan, F. Bratti, R. K. Brizendine, P. A. Cox, R. Gill, R. Graham, D. J. Kim, G. Konig, W. E. Michener, S. Poudel, K. J. Ramirez, T. J. Shakespeare, M. Zahn, E. S. Boyd, C. M. Payne, J. L. DuBois, A. R. Pickford, G. T. Beckham, J. E. McGeehan, Nat. Commun., 2022, 13, 7850. 327 H. Fu J. Cao T. Qiao Y. Qi S.J. Charnock S. Garfinkle T.K. Hyster Nature 610 2022 302 307 H. Fu, J. Cao, T. Qiao, Y. Qi, S. J. Charnock, S. Garfinkle, T. K. Hyster, Nature, 2022, 610, 302–307. 328 Y. Fu H. Chen W. Fu M. Garcia-Borras Y. Yang P. Liu J. Am. Chem. Soc. 144 2022 13344 13355 Y. Fu, H. Chen, W. Fu, M. Garcia-Borras, Y. Yang, P. Liu, J. Am. Chem. Soc., 2022, 144, 13344–13355. 329 Y. Ye J. Cao D.G. Oblinsky D. Verma C.K. Prier G.D. Scholes T.K. Hyster Nat. Chem. 15 2023 206 212 Y. Ye, J. Cao, D. G. Oblinsky, D. Verma, C. K. Prier, G. D. Scholes, T. K. Hyster, Nat. Chem., 2023, 15, 206–212. 330 Z. Liu C. Calvo-Tusell A.Z. Zhou K. Chen M. Garcia-Borras F.H. Arnold Nat. Chem. 13 2021 1166 1172 Z. Liu, C. Calvo-Tusell, A. Z. Zhou, K. Chen, M. Garcia-Borras, F. H. Arnold, Nat. Chem., 2021, 13, 1166–1172. 331 M.J. Black K.F. Biegasiewicz A.J. Meichan D.G. Oblinsky B. Kudisch G.D. Scholes T.K. Hyster Nat. Chem. 12 2020 71 75 M. J. Black, K. F. Biegasiewicz, A. J. Meichan, D. G. Oblinsky, B. Kudisch, G. D. Scholes, T. K. Hyster, Nat. Chem., 2020, 12, 71–75. 332 R. Buller S. Lutz R.J. Kazlauskas R. Snajdrova J.C. Moore U.T. Bornscheuer Science 382 2023 eadh8615 R. Buller, S. Lutz, R. J. Kazlauskas, R. Snajdrova, J. C. Moore, U. T. Bornscheuer, Science, 2023, 382, eadh8615. 333 Y. Xu H. Chen L. Yu X. Peng J. Zhang Z. Xing Y. Bao A. Liu Y. Zhao C. Tian Y. Liang X. Huang Nature 625 2024 74 78 Y. Xu, H. Chen, L. Yu, X. Peng, J. Zhang, Z. Xing, Y. Bao, A. Liu, Y. Zhao, C. Tian, Y. Liang, X. Huang, Nature, 2024, 625, 74–78. 334 M. Silvi P. Melchiorre Nature 554 2018 41 49 M. Silvi, P. Melchiorre, Nature, 2018, 554, 41–49. 335 R. Brimioulle D. Lenhart M.M. Maturi T. Bach Angew. Chem. Int. Ed. 54 2015 3872 3890 R. Brimioulle, D. Lenhart, M. M. Maturi, T. Bach, Angew. Chem. Int. Ed., 2015, 54, 3872–3890. 336 Q.Q. Zhou Y.Q. Zou L.Q. Lu W.J. Xiao Angew. Chem. Int. Ed. 58 2019 1586 1604 Q. Q. Zhou, Y. Q. Zou, L. Q. Lu, W. J. Xiao, Angew. Chem. Int. Ed., 2019, 58, 1586–1604. 337 J. Grosskopf T. Kratz T. Rigotti T. Bach Chem. Rev. 122 2022 1626 1653 J. Grosskopf, T. Kratz, T. Rigotti, T. Bach, Chem. Rev., 2022, 122, 1626–1653. 338 M.A. Emmanuel N.R. Greenberg D.G. Oblinsky T.K. Hyster Nature 540 2016 414 417 M. A. Emmanuel, N. R. Greenberg, D. G. Oblinsky, T. K. Hyster, Nature, 2016, 540, 414–417. 339 R. Kleinmans T. Pinkert S. Dutta T.O. Paulisch H. Keum C.G. Daniliuc F. Glorius Nature 605 2022 477 482 R. Kleinmans, T. Pinkert, S. Dutta, T. O. Paulisch, H. Keum, C. G. Daniliuc, F. Glorius, Nature, 2022, 605, 477–482. 340 B.A. Sandoval P.D. Clayman D.G. Oblinsky S. Oh Y. Nakano M. Bird G.D. Scholes T.K. Hyster J. Am. Chem. Soc. 143 2021 1735 1739 B. A. Sandoval, P. D. Clayman, D. G. Oblinsky, S. Oh, Y. Nakano, M. Bird, G. D. Scholes, T. K. Hyster, J. Am. Chem. Soc., 2021, 143, 1735–1739. 341 K.F. Biegasiewicz S.J. Cooper M.A. Emmanuel D.C. Miller T.K. Hyster Nat. Chem. 10 2018 770 775 K. F. Biegasiewicz, S. J. Cooper, M. A. Emmanuel, D. C. Miller, T. K. Hyster, Nat. Chem., 2018, 10, 770–775. 342 B. Zhao J. Feng L. Yu Z. Xing B. Chen A. Liu F. Liu F. Shi Y. Zhao C. Tian B. Wang X. Huang Nat. Catal. 6 2023 996 1004 B. Zhao, J. Feng, L. Yu, Z. Xing, B. Chen, A. Liu, F. Liu, F. Shi, Y. Zhao, C. Tian, B. Wang, X. Huang, Nat. Catal., 2023, 6, 996–1004. 343 K. Chen F.H. Arnold Nat. Catal. 3 2020 203 213 K. Chen, F. H. Arnold, Nat. Catal., 2020, 3, 203–213. 344 C.G. Page S.J. Cooper J.S. DeHovitz D.G. Oblinsky K.F. Biegasiewicz A.H. Antropow K.W. Armbrust J.M. Ellis L.G. Hamann E.J. Horn K.M. Oberg G.D. Scholes T.K. Hyster J. Am. Chem. Soc. 143 2021 97 102 C. G. Page, S. J. Cooper, J. S. DeHovitz, D. G. Oblinsky, K. F. Biegasiewicz, A. H. Antropow, K. W. Armbrust, J. M. Ellis, L. G. Hamann, E. J. Horn, K. M. Oberg, G. D. Scholes, T. K. Hyster, J. Am. Chem. Soc., 2021, 143, 97–102. 345 M. Chen C.T. Liu Y. Tang J. Am. Chem. Soc. 142 2020 10506 10515 M. Chen, C. T. Liu, Y. Tang, J. Am. Chem. Soc., 2020, 142, 10506–10515. 346 S. Zhang D.J. Heyes L. Feng W. Sun L.O. Johannissen H. Liu C.W. Levy X. Li J. Yang X. Yu M. Lin S.J.O. Hardman R. Hoeven M. Sakuma S. Hay D. Leys Z. Rao A. Zhou Q. Cheng N.S. Scrutton Nature 574 2019 722 725 S. Zhang, D. J. Heyes, L. Feng, W. Sun, L. O. Johannissen, H. Liu, C. W. Levy, X. Li, J. Yang, X. Yu, M. Lin, S. J. O. Hardman, R. Hoeven, M. Sakuma, S. Hay, D. Leys, Z. Rao, A. Zhou, Q. Cheng, N. S. Scrutton, Nature, 2019, 574, 722–725. 347 L. Candish K.D. Collins G.C. Cook J.J. Douglas A. Gomez-Suarez A. Jolit S. Keess Chem. Rev. 122 2022 2907 2980 L. Candish, K. D. Collins, G. C. Cook, J. J. Douglas, A. Gomez-Suarez, A. Jolit, S. Keess, Chem. Rev., 2022, 122, 2907–2980. 348 P.R.D. Murray W.M.M. Bussink G.H.M. Davies F.W. van der Mei A.H. Antropow J.T. Edwards L.A. D’Agostino J.M. Ellis L.G. Hamann F. Romanov-Michailidis R.R. Knowles J. Am. Chem. Soc. 143 2021 4055 4063 P. R. D. Murray, W. M. M. Bussink, G. H. M. Davies, F. W. van der Mei, A. H. Antropow, J. T. Edwards, L. A. D’Agostino, J. M. Ellis, L. G. Hamann, F. Romanov-Michailidis, R. R. Knowles, J. Am. Chem. Soc., 2021, 143, 4055–4063. 349 X. Huang J. Feng J. Cui G. Jiang W. Harrison X. Zang J. Zhou B. Wang H. Zhao Nat. Catal. 5 2022 586 593 X. Huang, J. Feng, J. Cui, G. Jiang, W. Harrison, X. Zang, J. Zhou, B. Wang, H. Zhao, Nat. Catal., 2022, 5, 586–593. 350 S.-Z. Sun B.T. Nicholls D. Bain T. Qiao C.G. Page A.J. Musser T.K. Hyster Nat. Catal. 7 2023 35 42 S.-Z. Sun, B. T. Nicholls, D. Bain, T. Qiao, C. G. Page, A. J. Musser, T. K. Hyster, Nat. Catal., 2023, 7, 35–42. 351 L. Cheng D. Li B.K. Mai Z. Bo L. Cheng P. Liu Y. Yang Science 381 2023 444 451 L. Cheng, D. Li, B. K. Mai, Z. Bo, L. Cheng, P. Liu, Y. Yang, Science, 2023, 381, 444–451. 352 S. Ju D. Li B.K. Mai X. Liu A. Vallota-Eastman J. Wu D.L. Valentine P. Liu Y. Yang Nat. Chem. 2024 S. Ju, D. Li, B. K. Mai, X. Liu, A. Vallota-Eastman, J. Wu, D. L. Valentine, P. Liu, Y. Yang, Nat. Chem., 2024. 353 N. Sun J. Huang J. Qian T.P. Zhou J. Guo L. Tang W. Zhang Y. Deng W. Zhao G. Wu R.Z. Liao X. Chen F. Zhong Y. Wu Nature 611 2022 715 720 N. Sun, J. Huang, J. Qian, T. P. Zhou, J. Guo, L. Tang, W. Zhang, Y. Deng, W. Zhao, G. Wu, R. Z. Liao, X. Chen, F. Zhong, Y. Wu, Nature, 2022, 611, 715–720. 354 E. Mitraka M. Gryszel M. Vagin M.J. Jafari A. Singh M. Warczak M. Mitrakas M. Berggren T. Ederth I. Zozoulenko X. Crispin E.D. Głowacki Adv. Sustain. Syst. 3 2018 1800110 E. Mitraka, M. Gryszel, M. Vagin, M. J. Jafari, A. Singh, M. Warczak, M. Mitrakas, M. Berggren, T. Ederth, I. Zozoulenko, X. Crispin, E. D. Głowacki, Adv. Sustain. Syst., 2018, 3, 1800110. 355 J. Liu H. Wu F. Li X. Feng P. Zhang L. Gao Adv. Sustain. Syst. 4 2020 2000151 J. Liu, H. Wu, F. Li, X. Feng, P. Zhang, L. Gao, Adv. Sustain. Syst., 2020, 4, 2000151. 356 H. Nishiyama T. Yamada M. Nakabayashi Y. Maehara M. Yamaguchi Y. Kuromiya Y. Nagatsuma H. Tokudome S. Akiyama T. Watanabe R. Narushima S. Okunaka N. Shibata T. Takata T. Hisatomi K. Domen Nature 598 2021 304 307 H. Nishiyama, T. Yamada, M. Nakabayashi, Y. Maehara, M. Yamaguchi, Y. Kuromiya, Y. Nagatsuma, H. Tokudome, S. Akiyama, T. Watanabe, R. Narushima, S. Okunaka, N. Shibata, T. Takata, T. Hisatomi, K. Domen, Nature, 2021, 598, 304–307. 357 R. Gong D. Mitoraj D. Gao M. Mundszinger D. Sorsche U. Kaiser C. Streb R. Beranek S. Rau Adv. Sustain. Syst. 6 2022 2100473 R. Gong, D. Mitoraj, D. Gao, M. Mundszinger, D. Sorsche, U. Kaiser, C. Streb, R. Beranek, S. Rau, Adv. Sustain. Syst., 2022, 6, 2100473. 358 N. Karjule M. Rana M. Shalom J. Barrio J.J. Vilatela Adv. Sustain. Syst. 5 2021 2000265 N. Karjule, M. Rana, M. Shalom, J. Barrio, J. J. Vilatela, Adv. Sustain. Syst., 2021, 5, 2000265. Gao-Ren Li (College of Materials Science and Engineering, Sichuan University). Prof. Gao-Ren Li received his B.A. degree from East China University of Technology (China) in 2000, and Ph.D. degree from Sun Yat-sen University (China) in 2005. From September 2005 to September 2021, he worked in School of Chemistry, Sun Yat-sen University. Since October 2021, he has been working in College of Materials Science and Engineering, Sichuan University. His current research interests mainly focus on electrocatalysis, especially water splitting and electrochemical conversion of CO2.",
      "scopus-id": "85198902842",
      "coredata": {
        "eid": "1-s2.0-S1872206724600537",
        "dc:description": "Increasing global energy consumption and environmental pollution make the use of new energy sources and environmentally friendly technologies essential to meet the diverse needs of industries. Photoelectrocatalysis is a promising method of utilising solar and electrical energy for various catalytic reactions with significant environmental and energy saving benefits. And photoelectrocatalytic (PEC) oxygen evolution reaction (OER) and CO2 reduction reaction (CO2RR) are two catalytic reactions with great potential for energy and environmental applications. PEC OER is critical for renewable energy technologies for water oxidation and other related oxidation reactions. PEC CO2RR converts carbon dioxide into high-value products via a catalyst, enabling the rational use of carbon dioxide and the reduction of greenhouse gas emissions. Both technologies are efficient, environmentally friendly, and sustainable. However, further research and optimisation are needed to promote the industrial application of both technologies for energy conversion and environmental protection. This paper reviews the research progress of PEC CO2RR and OER catalysts in recent years, including detailed descriptions of catalyst types, reaction mechanisms and performance tests. Finally, the paper considers the future trends and prospects of PEC technology, providing new insights into the technology and research directions for PEC OER and CO2RR catalysts.",
        "openArchiveArticle": "false",
        "prism:coverDate": "2024-07-31",
        "openaccessUserLicense": null,
        "prism:aggregationType": "Journal",
        "prism:url": "https://api.elsevier.com/content/article/pii/S1872206724600537",
        "dc:creator": [
          {
            "@_fa": "true",
            "$": "Zhu, Hong-Rui"
          },
          {
            "@_fa": "true",
            "$": "Xu, Hui-Min"
          },
          {
            "@_fa": "true",
            "$": "Huang, Chen-Jin"
          },
          {
            "@_fa": "true",
            "$": "Zhang, Zhi-Jie"
          },
          {
            "@_fa": "true",
            "$": "Zhan, Qi-Ni"
          },
          {
            "@_fa": "true",
            "$": "Shuai, Ting-Yu"
          },
          {
            "@_fa": "true",
            "$": "Li, Gao-Ren"
          }
        ],
        "link": [
          {
            "@_fa": "true",
            "@rel": "self",
            "@href": "https://api.elsevier.com/content/article/pii/S1872206724600537"
          },
          {
            "@_fa": "true",
            "@rel": "scidir",
            "@href": "https://www.sciencedirect.com/science/article/pii/S1872206724600537"
          }
        ],
        "dc:format": "application/json",
        "openaccessType": null,
        "pii": "S1872-2067(24)60053-7",
        "prism:volume": "62",
        "prism:publisher": "Dalian Institute of Chemical Physics, the Chinese Academy of Sciences. Published by Elsevier B.V. All rights are reserved, including those for text and data mining, AI training, and similar technologies.",
        "dc:title": "Recent advances of the catalysts for photoelectrocatalytic oxygen evolution and CO2 reduction reactions",
        "prism:copyright": "Copyright © 2024 Dalian Institute of Chemical Physics, the Chinese Academy of Sciences. Published by Elsevier B.V. All rights are reserved, including those for text and data mining, AI training, and similar technologies.",
        "openaccess": "0",
        "prism:issn": "18722067",
        "dcterms:subject": [
          {
            "@_fa": "true",
            "$": "Photoelectrocatalysis"
          },
          {
            "@_fa": "true",
            "$": "Catalyst design"
          },
          {
            "@_fa": "true",
            "$": "Catalyst fabrication"
          },
          {
            "@_fa": "true",
            "$": "Oxygen evolution reaction"
          },
          {
            "@_fa": "true",
            "$": "CO2 reduction reaction"
          }
        ],
        "openaccessArticle": "false",
        "prism:publicationName": "Chinese Journal of Catalysis",
        "openaccessSponsorType": null,
        "prism:pageRange": "53-107",
        "prism:endingPage": "107",
        "pubType": "rev",
        "prism:coverDisplayDate": "July 2024",
        "prism:doi": "10.1016/S1872-2067(24)60053-7",
        "prism:startingPage": "53",
        "dc:identifier": "doi:10.1016/S1872-2067(24)60053-7",
        "openaccessSponsorName": null
      },
      "objects": {
        "object": [
          {
            "@category": "standard",
            "@height": "179",
            "@width": "301",
            "@_fa": "true",
            "$": "https://api.elsevier.com/content/object/eid/1-s2.0-S1872206724600537-fx1.jpg?httpAccept=%2A%2F%2A",
            "@multimediatype": "JPEG image file",
            "@type": "IMAGE-DOWNSAMPLED",
            "@size": "17249",
            "@ref": "fx1",
            "@mimetype": "image/jpeg"
          },
          {
            "@category": "standard",
            "@height": "249",
            "@width": "178",
            "@_fa": "true",
            "$": "https://api.elsevier.com/content/object/eid/1-s2.0-S1872206724600537-fx2.jpg?httpAccept=%2A%2F%2A",
            "@multimediatype": "JPEG image file",
            "@type": "IMAGE-DOWNSAMPLED",
            "@size": "11104",
            "@ref": "fx2",
            "@mimetype": "image/jpeg"
          },
          {
            "@category": "standard",
            "@height": "156",
            "@width": "159",
            "@_fa": "true",
            "$": "https://api.elsevier.com/content/object/eid/1-s2.0-S1872206724600537-gr1.jpg?httpAccept=%2A%2F%2A",
            "@multimediatype": "JPEG image file",
            "@type": "IMAGE-DOWNSAMPLED",
            "@size": "12782",
            "@ref": "gr1",
            "@mimetype": "image/jpeg"
          },
          {
            "@category": "standard",
            "@height": "281",
            "@width": "529",
            "@_fa": "true",
            "$": "https://api.elsevier.com/content/object/eid/1-s2.0-S1872206724600537-gr10.jpg?httpAccept=%2A%2F%2A",
            "@multimediatype": "JPEG image file",
            "@type": "IMAGE-DOWNSAMPLED",
            "@size": "49935",
            "@ref": "gr10",
            "@mimetype": "image/jpeg"
          },
          {
            "@category": "standard",
            "@height": "554",
            "@width": "559",
            "@_fa": "true",
            "$": "https://api.elsevier.com/content/object/eid/1-s2.0-S1872206724600537-gr11.jpg?httpAccept=%2A%2F%2A",
            "@multimediatype": "JPEG image file",
            "@type": "IMAGE-DOWNSAMPLED",
            "@size": "101386",
            "@ref": "gr11",
            "@mimetype": "image/jpeg"
          },
          {
            "@category": "standard",
            "@height": "753",
            "@width": "472",
            "@_fa": "true",
            "$": "https://api.elsevier.com/content/object/eid/1-s2.0-S1872206724600537-gr12.jpg?httpAccept=%2A%2F%2A",
            "@multimediatype": "JPEG image file",
            "@type": "IMAGE-DOWNSAMPLED",
            "@size": "137071",
            "@ref": "gr12",
            "@mimetype": "image/jpeg"
          },
          {
            "@category": "standard",
            "@height": "663",
            "@width": "668",
            "@_fa": "true",
            "$": "https://api.elsevier.com/content/object/eid/1-s2.0-S1872206724600537-gr13.jpg?httpAccept=%2A%2F%2A",
            "@multimediatype": "JPEG image file",
            "@type": "IMAGE-DOWNSAMPLED",
            "@size": "135589",
            "@ref": "gr13",
            "@mimetype": "image/jpeg"
          },
          {
            "@category": "standard",
            "@height": "395",
            "@width": "707",
            "@_fa": "true",
            "$": "https://api.elsevier.com/content/object/eid/1-s2.0-S1872206724600537-gr14.jpg?httpAccept=%2A%2F%2A",
            "@multimediatype": "JPEG image file",
            "@type": "IMAGE-DOWNSAMPLED",
            "@size": "98546",
            "@ref": "gr14",
            "@mimetype": "image/jpeg"
          },
          {
            "@category": "standard",
            "@height": "501",
            "@width": "756",
            "@_fa": "true",
            "$": "https://api.elsevier.com/content/object/eid/1-s2.0-S1872206724600537-gr15.jpg?httpAccept=%2A%2F%2A",
            "@multimediatype": "JPEG image file",
            "@type": "IMAGE-DOWNSAMPLED",
            "@size": "143283",
            "@ref": "gr15",
            "@mimetype": "image/jpeg"
          },
          {
            "@category": "standard",
            "@height": "372",
            "@width": "662",
            "@_fa": "true",
            "$": "https://api.elsevier.com/content/object/eid/1-s2.0-S1872206724600537-gr16.jpg?httpAccept=%2A%2F%2A",
            "@multimediatype": "JPEG image file",
            "@type": "IMAGE-DOWNSAMPLED",
            "@size": "93935",
            "@ref": "gr16",
            "@mimetype": "image/jpeg"
          },
          {
            "@category": "standard",
            "@height": "180",
            "@width": "226",
            "@_fa": "true",
            "$": "https://api.elsevier.com/content/object/eid/1-s2.0-S1872206724600537-gr17.jpg?httpAccept=%2A%2F%2A",
            "@multimediatype": "JPEG image file",
            "@type": "IMAGE-DOWNSAMPLED",
            "@size": "10960",
            "@ref": "gr17",
            "@mimetype": "image/jpeg"
          },
          {
            "@category": "standard",
            "@height": "112",
            "@width": "118",
            "@_fa": "true",
            "$": "https://api.elsevier.com/content/object/eid/1-s2.0-S1872206724600537-gr18.jpg?httpAccept=%2A%2F%2A",
            "@multimediatype": "JPEG image file",
            "@type": "IMAGE-DOWNSAMPLED",
            "@size": "7087",
            "@ref": "gr18",
            "@mimetype": "image/jpeg"
          },
          {
            "@category": "standard",
            "@height": "278",
            "@width": "769",
            "@_fa": "true",
            "$": "https://api.elsevier.com/content/object/eid/1-s2.0-S1872206724600537-gr19.jpg?httpAccept=%2A%2F%2A",
            "@multimediatype": "JPEG image file",
            "@type": "IMAGE-DOWNSAMPLED",
            "@size": "77885",
            "@ref": "gr19",
            "@mimetype": "image/jpeg"
          },
          {
            "@category": "standard",
            "@height": "688",
            "@width": "778",
            "@_fa": "true",
            "$": "https://api.elsevier.com/content/object/eid/1-s2.0-S1872206724600537-gr2.jpg?httpAccept=%2A%2F%2A",
            "@multimediatype": "JPEG image file",
            "@type": "IMAGE-DOWNSAMPLED",
            "@size": "201854",
            "@ref": "gr2",
            "@mimetype": "image/jpeg"
          },
          {
            "@category": "standard",
            "@height": "481",
            "@width": "654",
            "@_fa": "true",
            "$": "https://api.elsevier.com/content/object/eid/1-s2.0-S1872206724600537-gr20.jpg?httpAccept=%2A%2F%2A",
            "@multimediatype": "JPEG image file",
            "@type": "IMAGE-DOWNSAMPLED",
            "@size": "93595",
            "@ref": "gr20",
            "@mimetype": "image/jpeg"
          },
          {
            "@category": "standard",
            "@height": "580",
            "@width": "770",
            "@_fa": "true",
            "$": "https://api.elsevier.com/content/object/eid/1-s2.0-S1872206724600537-gr21.jpg?httpAccept=%2A%2F%2A",
            "@multimediatype": "JPEG image file",
            "@type": "IMAGE-DOWNSAMPLED",
            "@size": "158367",
            "@ref": "gr21",
            "@mimetype": "image/jpeg"
          },
          {
            "@category": "standard",
            "@height": "529",
            "@width": "756",
            "@_fa": "true",
            "$": "https://api.elsevier.com/content/object/eid/1-s2.0-S1872206724600537-gr22.jpg?httpAccept=%2A%2F%2A",
            "@multimediatype": "JPEG image file",
            "@type": "IMAGE-DOWNSAMPLED",
            "@size": "150568",
            "@ref": "gr22",
            "@mimetype": "image/jpeg"
          },
          {
            "@category": "standard",
            "@height": "232",
            "@width": "664",
            "@_fa": "true",
            "$": "https://api.elsevier.com/content/object/eid/1-s2.0-S1872206724600537-gr23.jpg?httpAccept=%2A%2F%2A",
            "@multimediatype": "JPEG image file",
            "@type": "IMAGE-DOWNSAMPLED",
            "@size": "71392",
            "@ref": "gr23",
            "@mimetype": "image/jpeg"
          },
          {
            "@category": "standard",
            "@height": "544",
            "@width": "615",
            "@_fa": "true",
            "$": "https://api.elsevier.com/content/object/eid/1-s2.0-S1872206724600537-gr24.jpg?httpAccept=%2A%2F%2A",
            "@multimediatype": "JPEG image file",
            "@type": "IMAGE-DOWNSAMPLED",
            "@size": "117455",
            "@ref": "gr24",
            "@mimetype": "image/jpeg"
          },
          {
            "@category": "standard",
            "@height": "651",
            "@width": "755",
            "@_fa": "true",
            "$": "https://api.elsevier.com/content/object/eid/1-s2.0-S1872206724600537-gr25.jpg?httpAccept=%2A%2F%2A",
            "@multimediatype": "JPEG image file",
            "@type": "IMAGE-DOWNSAMPLED",
            "@size": "141804",
            "@ref": "gr25",
            "@mimetype": "image/jpeg"
          },
          {
            "@category": "standard",
            "@height": "477",
            "@width": "757",
            "@_fa": "true",
            "$": "https://api.elsevier.com/content/object/eid/1-s2.0-S1872206724600537-gr26.jpg?httpAccept=%2A%2F%2A",
            "@multimediatype": "JPEG image file",
            "@type": "IMAGE-DOWNSAMPLED",
            "@size": "132471",
            "@ref": "gr26",
            "@mimetype": "image/jpeg"
          },
          {
            "@category": "standard",
            "@height": "648",
            "@width": "731",
            "@_fa": "true",
            "$": "https://api.elsevier.com/content/object/eid/1-s2.0-S1872206724600537-gr27.jpg?httpAccept=%2A%2F%2A",
            "@multimediatype": "JPEG image file",
            "@type": "IMAGE-DOWNSAMPLED",
            "@size": "162078",
            "@ref": "gr27",
            "@mimetype": "image/jpeg"
          },
          {
            "@category": "standard",
            "@height": "315",
            "@width": "676",
            "@_fa": "true",
            "$": "https://api.elsevier.com/content/object/eid/1-s2.0-S1872206724600537-gr28.jpg?httpAccept=%2A%2F%2A",
            "@multimediatype": "JPEG image file",
            "@type": "IMAGE-DOWNSAMPLED",
            "@size": "104734",
            "@ref": "gr28",
            "@mimetype": "image/jpeg"
          },
          {
            "@category": "standard",
            "@height": "611",
            "@width": "563",
            "@_fa": "true",
            "$": "https://api.elsevier.com/content/object/eid/1-s2.0-S1872206724600537-gr29.jpg?httpAccept=%2A%2F%2A",
            "@multimediatype": "JPEG image file",
            "@type": "IMAGE-DOWNSAMPLED",
            "@size": "139079",
            "@ref": "gr29",
            "@mimetype": "image/jpeg"
          },
          {
            "@category": "standard",
            "@height": "330",
            "@width": "773",
            "@_fa": "true",
            "$": "https://api.elsevier.com/content/object/eid/1-s2.0-S1872206724600537-gr3.jpg?httpAccept=%2A%2F%2A",
            "@multimediatype": "JPEG image file",
            "@type": "IMAGE-DOWNSAMPLED",
            "@size": "90542",
            "@ref": "gr3",
            "@mimetype": "image/jpeg"
          },
          {
            "@category": "standard",
            "@height": "354",
            "@width": "630",
            "@_fa": "true",
            "$": "https://api.elsevier.com/content/object/eid/1-s2.0-S1872206724600537-gr30.jpg?httpAccept=%2A%2F%2A",
            "@multimediatype": "JPEG image file",
            "@type": "IMAGE-DOWNSAMPLED",
            "@size": "95820",
            "@ref": "gr30",
            "@mimetype": "image/jpeg"
          },
          {
            "@category": "standard",
            "@height": "273",
            "@width": "728",
            "@_fa": "true",
            "$": "https://api.elsevier.com/content/object/eid/1-s2.0-S1872206724600537-gr31.jpg?httpAccept=%2A%2F%2A",
            "@multimediatype": "JPEG image file",
            "@type": "IMAGE-DOWNSAMPLED",
            "@size": "77721",
            "@ref": "gr31",
            "@mimetype": "image/jpeg"
          },
          {
            "@category": "standard",
            "@height": "640",
            "@width": "720",
            "@_fa": "true",
            "$": "https://api.elsevier.com/content/object/eid/1-s2.0-S1872206724600537-gr32.jpg?httpAccept=%2A%2F%2A",
            "@multimediatype": "JPEG image file",
            "@type": "IMAGE-DOWNSAMPLED",
            "@size": "164443",
            "@ref": "gr32",
            "@mimetype": "image/jpeg"
          },
          {
            "@category": "standard",
            "@height": "289",
            "@width": "759",
            "@_fa": "true",
            "$": "https://api.elsevier.com/content/object/eid/1-s2.0-S1872206724600537-gr33.jpg?httpAccept=%2A%2F%2A",
            "@multimediatype": "JPEG image file",
            "@type": "IMAGE-DOWNSAMPLED",
            "@size": "80098",
            "@ref": "gr33",
            "@mimetype": "image/jpeg"
          },
          {
            "@category": "standard",
            "@height": "429",
            "@width": "373",
            "@_fa": "true",
            "$": "https://api.elsevier.com/content/object/eid/1-s2.0-S1872206724600537-gr34.jpg?httpAccept=%2A%2F%2A",
            "@multimediatype": "JPEG image file",
            "@type": "IMAGE-DOWNSAMPLED",
            "@size": "66778",
            "@ref": "gr34",
            "@mimetype": "image/jpeg"
          },
          {
            "@category": "standard",
            "@height": "284",
            "@width": "740",
            "@_fa": "true",
            "$": "https://api.elsevier.com/content/object/eid/1-s2.0-S1872206724600537-gr35.jpg?httpAccept=%2A%2F%2A",
            "@multimediatype": "JPEG image file",
            "@type": "IMAGE-DOWNSAMPLED",
            "@size": "75475",
            "@ref": "gr35",
            "@mimetype": "image/jpeg"
          },
          {
            "@category": "standard",
            "@height": "293",
            "@width": "697",
            "@_fa": "true",
            "$": "https://api.elsevier.com/content/object/eid/1-s2.0-S1872206724600537-gr36.jpg?httpAccept=%2A%2F%2A",
            "@multimediatype": "JPEG image file",
            "@type": "IMAGE-DOWNSAMPLED",
            "@size": "62538",
            "@ref": "gr36",
            "@mimetype": "image/jpeg"
          },
          {
            "@category": "standard",
            "@height": "295",
            "@width": "756",
            "@_fa": "true",
            "$": "https://api.elsevier.com/content/object/eid/1-s2.0-S1872206724600537-gr37.jpg?httpAccept=%2A%2F%2A",
            "@multimediatype": "JPEG image file",
            "@type": "IMAGE-DOWNSAMPLED",
            "@size": "91984",
            "@ref": "gr37",
            "@mimetype": "image/jpeg"
          },
          {
            "@category": "standard",
            "@height": "240",
            "@width": "709",
            "@_fa": "true",
            "$": "https://api.elsevier.com/content/object/eid/1-s2.0-S1872206724600537-gr38.jpg?httpAccept=%2A%2F%2A",
            "@multimediatype": "JPEG image file",
            "@type": "IMAGE-DOWNSAMPLED",
            "@size": "54613",
            "@ref": "gr38",
            "@mimetype": "image/jpeg"
          },
          {
            "@category": "standard",
            "@height": "414",
            "@width": "719",
            "@_fa": "true",
            "$": "https://api.elsevier.com/content/object/eid/1-s2.0-S1872206724600537-gr39.jpg?httpAccept=%2A%2F%2A",
            "@multimediatype": "JPEG image file",
            "@type": "IMAGE-DOWNSAMPLED",
            "@size": "129685",
            "@ref": "gr39",
            "@mimetype": "image/jpeg"
          },
          {
            "@category": "standard",
            "@height": "782",
            "@width": "752",
            "@_fa": "true",
            "$": "https://api.elsevier.com/content/object/eid/1-s2.0-S1872206724600537-gr4.jpg?httpAccept=%2A%2F%2A",
            "@multimediatype": "JPEG image file",
            "@type": "IMAGE-DOWNSAMPLED",
            "@size": "213740",
            "@ref": "gr4",
            "@mimetype": "image/jpeg"
          },
          {
            "@category": "standard",
            "@height": "306",
            "@width": "754",
            "@_fa": "true",
            "$": "https://api.elsevier.com/content/object/eid/1-s2.0-S1872206724600537-gr40.jpg?httpAccept=%2A%2F%2A",
            "@multimediatype": "JPEG image file",
            "@type": "IMAGE-DOWNSAMPLED",
            "@size": "79366",
            "@ref": "gr40",
            "@mimetype": "image/jpeg"
          },
          {
            "@category": "standard",
            "@height": "427",
            "@width": "643",
            "@_fa": "true",
            "$": "https://api.elsevier.com/content/object/eid/1-s2.0-S1872206724600537-gr41.jpg?httpAccept=%2A%2F%2A",
            "@multimediatype": "JPEG image file",
            "@type": "IMAGE-DOWNSAMPLED",
            "@size": "90056",
            "@ref": "gr41",
            "@mimetype": "image/jpeg"
          },
          {
            "@category": "standard",
            "@height": "212",
            "@width": "374",
            "@_fa": "true",
            "$": "https://api.elsevier.com/content/object/eid/1-s2.0-S1872206724600537-gr42.jpg?httpAccept=%2A%2F%2A",
            "@multimediatype": "JPEG image file",
            "@type": "IMAGE-DOWNSAMPLED",
            "@size": "34415",
            "@ref": "gr42",
            "@mimetype": "image/jpeg"
          },
          {
            "@category": "standard",
            "@height": "386",
            "@width": "703",
            "@_fa": "true",
            "$": "https://api.elsevier.com/content/object/eid/1-s2.0-S1872206724600537-gr43.jpg?httpAccept=%2A%2F%2A",
            "@multimediatype": "JPEG image file",
            "@type": "IMAGE-DOWNSAMPLED",
            "@size": "73638",
            "@ref": "gr43",
            "@mimetype": "image/jpeg"
          },
          {
            "@category": "standard",
            "@height": "219",
            "@width": "365",
            "@_fa": "true",
            "$": "https://api.elsevier.com/content/object/eid/1-s2.0-S1872206724600537-gr44.jpg?httpAccept=%2A%2F%2A",
            "@multimediatype": "JPEG image file",
            "@type": "IMAGE-DOWNSAMPLED",
            "@size": "30308",
            "@ref": "gr44",
            "@mimetype": "image/jpeg"
          },
          {
            "@category": "standard",
            "@height": "532",
            "@width": "639",
            "@_fa": "true",
            "$": "https://api.elsevier.com/content/object/eid/1-s2.0-S1872206724600537-gr5.jpg?httpAccept=%2A%2F%2A",
            "@multimediatype": "JPEG image file",
            "@type": "IMAGE-DOWNSAMPLED",
            "@size": "132363",
            "@ref": "gr5",
            "@mimetype": "image/jpeg"
          },
          {
            "@category": "standard",
            "@height": "272",
            "@width": "779",
            "@_fa": "true",
            "$": "https://api.elsevier.com/content/object/eid/1-s2.0-S1872206724600537-gr6.jpg?httpAccept=%2A%2F%2A",
            "@multimediatype": "JPEG image file",
            "@type": "IMAGE-DOWNSAMPLED",
            "@size": "86265",
            "@ref": "gr6",
            "@mimetype": "image/jpeg"
          },
          {
            "@category": "standard",
            "@height": "624",
            "@width": "490",
            "@_fa": "true",
            "$": "https://api.elsevier.com/content/object/eid/1-s2.0-S1872206724600537-gr7.jpg?httpAccept=%2A%2F%2A",
            "@multimediatype": "JPEG image file",
            "@type": "IMAGE-DOWNSAMPLED",
            "@size": "141073",
            "@ref": "gr7",
            "@mimetype": "image/jpeg"
          },
          {
            "@category": "standard",
            "@height": "421",
            "@width": "526",
            "@_fa": "true",
            "$": "https://api.elsevier.com/content/object/eid/1-s2.0-S1872206724600537-gr8.jpg?httpAccept=%2A%2F%2A",
            "@multimediatype": "JPEG image file",
            "@type": "IMAGE-DOWNSAMPLED",
            "@size": "80559",
            "@ref": "gr8",
            "@mimetype": "image/jpeg"
          },
          {
            "@category": "standard",
            "@height": "515",
            "@width": "712",
            "@_fa": "true",
            "$": "https://api.elsevier.com/content/object/eid/1-s2.0-S1872206724600537-gr9.jpg?httpAccept=%2A%2F%2A",
            "@multimediatype": "JPEG image file",
            "@type": "IMAGE-DOWNSAMPLED",
            "@size": "137933",
            "@ref": "gr9",
            "@mimetype": "image/jpeg"
          },
          {
            "@category": "standard",
            "@height": "187",
            "@width": "366",
            "@_fa": "true",
            "$": "https://api.elsevier.com/content/object/eid/1-s2.0-S1872206724600537-Sc1.jpg?httpAccept=%2A%2F%2A",
            "@multimediatype": "JPEG image file",
            "@type": "IMAGE-DOWNSAMPLED",
            "@size": "30386",
            "@ref": "Sc1",
            "@mimetype": "image/jpeg"
          },
          {
            "@category": "standard",
            "@height": "130",
            "@width": "130",
            "@_fa": "true",
            "$": "https://api.elsevier.com/content/object/eid/1-s2.0-S1872206724600537-Sc2.jpg?httpAccept=%2A%2F%2A",
            "@multimediatype": "JPEG image file",
            "@type": "IMAGE-DOWNSAMPLED",
            "@size": "6205",
            "@ref": "Sc2",
            "@mimetype": "image/jpeg"
          },
          {
            "@category": "thumbnail",
            "@height": "130",
            "@width": "219",
            "@_fa": "true",
            "$": "https://api.elsevier.com/content/object/eid/1-s2.0-S1872206724600537-fx1.sml?httpAccept=%2A%2F%2A",
            "@multimediatype": "GIF image file",
            "@type": "IMAGE-THUMBNAIL",
            "@size": "16499",
            "@ref": "fx1",
            "@mimetype": "image/gif"
          },
          {
            "@category": "thumbnail",
            "@height": "164",
            "@width": "117",
            "@_fa": "true",
            "$": "https://api.elsevier.com/content/object/eid/1-s2.0-S1872206724600537-fx2.sml?httpAccept=%2A%2F%2A",
            "@multimediatype": "GIF image file",
            "@type": "IMAGE-THUMBNAIL",
            "@size": "11086",
            "@ref": "fx2",
            "@mimetype": "image/gif"
          },
          {
            "@category": "thumbnail",
            "@height": "164",
            "@width": "167",
            "@_fa": "true",
            "$": "https://api.elsevier.com/content/object/eid/1-s2.0-S1872206724600537-gr1.sml?httpAccept=%2A%2F%2A",
            "@multimediatype": "GIF image file",
            "@type": "IMAGE-THUMBNAIL",
            "@size": "11951",
            "@ref": "gr1",
            "@mimetype": "image/gif"
          },
          {
            "@category": "thumbnail",
            "@height": "116",
            "@width": "219",
            "@_fa": "true",
            "$": "https://api.elsevier.com/content/object/eid/1-s2.0-S1872206724600537-gr10.sml?httpAccept=%2A%2F%2A",
            "@multimediatype": "GIF image file",
            "@type": "IMAGE-THUMBNAIL",
            "@size": "11350",
            "@ref": "gr10",
            "@mimetype": "image/gif"
          },
          {
            "@category": "thumbnail",
            "@height": "163",
            "@width": "165",
            "@_fa": "true",
            "$": "https://api.elsevier.com/content/object/eid/1-s2.0-S1872206724600537-gr11.sml?httpAccept=%2A%2F%2A",
            "@multimediatype": "GIF image file",
            "@type": "IMAGE-THUMBNAIL",
            "@size": "13442",
            "@ref": "gr11",
            "@mimetype": "image/gif"
          },
          {
            "@category": "thumbnail",
            "@height": "163",
            "@width": "102",
            "@_fa": "true",
            "$": "https://api.elsevier.com/content/object/eid/1-s2.0-S1872206724600537-gr12.sml?httpAccept=%2A%2F%2A",
            "@multimediatype": "GIF image file",
            "@type": "IMAGE-THUMBNAIL",
            "@size": "10931",
            "@ref": "gr12",
            "@mimetype": "image/gif"
          },
          {
            "@category": "thumbnail",
            "@height": "164",
            "@width": "165",
            "@_fa": "true",
            "$": "https://api.elsevier.com/content/object/eid/1-s2.0-S1872206724600537-gr13.sml?httpAccept=%2A%2F%2A",
            "@multimediatype": "GIF image file",
            "@type": "IMAGE-THUMBNAIL",
            "@size": "12854",
            "@ref": "gr13",
            "@mimetype": "image/gif"
          },
          {
            "@category": "thumbnail",
            "@height": "122",
            "@width": "219",
            "@_fa": "true",
            "$": "https://api.elsevier.com/content/object/eid/1-s2.0-S1872206724600537-gr14.sml?httpAccept=%2A%2F%2A",
            "@multimediatype": "GIF image file",
            "@type": "IMAGE-THUMBNAIL",
            "@size": "13682",
            "@ref": "gr14",
            "@mimetype": "image/gif"
          },
          {
            "@category": "thumbnail",
            "@height": "145",
            "@width": "219",
            "@_fa": "true",
            "$": "https://api.elsevier.com/content/object/eid/1-s2.0-S1872206724600537-gr15.sml?httpAccept=%2A%2F%2A",
            "@multimediatype": "GIF image file",
            "@type": "IMAGE-THUMBNAIL",
            "@size": "16692",
            "@ref": "gr15",
            "@mimetype": "image/gif"
          },
          {
            "@category": "thumbnail",
            "@height": "123",
            "@width": "219",
            "@_fa": "true",
            "$": "https://api.elsevier.com/content/object/eid/1-s2.0-S1872206724600537-gr16.sml?httpAccept=%2A%2F%2A",
            "@multimediatype": "GIF image file",
            "@type": "IMAGE-THUMBNAIL",
            "@size": "13075",
            "@ref": "gr16",
            "@mimetype": "image/gif"
          },
          {
            "@category": "thumbnail",
            "@height": "164",
            "@width": "205",
            "@_fa": "true",
            "$": "https://api.elsevier.com/content/object/eid/1-s2.0-S1872206724600537-gr17.sml?httpAccept=%2A%2F%2A",
            "@multimediatype": "GIF image file",
            "@type": "IMAGE-THUMBNAIL",
            "@size": "11059",
            "@ref": "gr17",
            "@mimetype": "image/gif"
          },
          {
            "@category": "thumbnail",
            "@height": "164",
            "@width": "173",
            "@_fa": "true",
            "$": "https://api.elsevier.com/content/object/eid/1-s2.0-S1872206724600537-gr18.sml?httpAccept=%2A%2F%2A",
            "@multimediatype": "GIF image file",
            "@type": "IMAGE-THUMBNAIL",
            "@size": "13012",
            "@ref": "gr18",
            "@mimetype": "image/gif"
          },
          {
            "@category": "thumbnail",
            "@height": "79",
            "@width": "219",
            "@_fa": "true",
            "$": "https://api.elsevier.com/content/object/eid/1-s2.0-S1872206724600537-gr19.sml?httpAccept=%2A%2F%2A",
            "@multimediatype": "GIF image file",
            "@type": "IMAGE-THUMBNAIL",
            "@size": "9517",
            "@ref": "gr19",
            "@mimetype": "image/gif"
          },
          {
            "@category": "thumbnail",
            "@height": "164",
            "@width": "185",
            "@_fa": "true",
            "$": "https://api.elsevier.com/content/object/eid/1-s2.0-S1872206724600537-gr2.sml?httpAccept=%2A%2F%2A",
            "@multimediatype": "GIF image file",
            "@type": "IMAGE-THUMBNAIL",
            "@size": "18252",
            "@ref": "gr2",
            "@mimetype": "image/gif"
          },
          {
            "@category": "thumbnail",
            "@height": "161",
            "@width": "219",
            "@_fa": "true",
            "$": "https://api.elsevier.com/content/object/eid/1-s2.0-S1872206724600537-gr20.sml?httpAccept=%2A%2F%2A",
            "@multimediatype": "GIF image file",
            "@type": "IMAGE-THUMBNAIL",
            "@size": "13530",
            "@ref": "gr20",
            "@mimetype": "image/gif"
          },
          {
            "@category": "thumbnail",
            "@height": "164",
            "@width": "217",
            "@_fa": "true",
            "$": "https://api.elsevier.com/content/object/eid/1-s2.0-S1872206724600537-gr21.sml?httpAccept=%2A%2F%2A",
            "@multimediatype": "GIF image file",
            "@type": "IMAGE-THUMBNAIL",
            "@size": "19086",
            "@ref": "gr21",
            "@mimetype": "image/gif"
          },
          {
            "@category": "thumbnail",
            "@height": "153",
            "@width": "219",
            "@_fa": "true",
            "$": "https://api.elsevier.com/content/object/eid/1-s2.0-S1872206724600537-gr22.sml?httpAccept=%2A%2F%2A",
            "@multimediatype": "GIF image file",
            "@type": "IMAGE-THUMBNAIL",
            "@size": "20676",
            "@ref": "gr22",
            "@mimetype": "image/gif"
          },
          {
            "@category": "thumbnail",
            "@height": "76",
            "@width": "219",
            "@_fa": "true",
            "$": "https://api.elsevier.com/content/object/eid/1-s2.0-S1872206724600537-gr23.sml?httpAccept=%2A%2F%2A",
            "@multimediatype": "GIF image file",
            "@type": "IMAGE-THUMBNAIL",
            "@size": "11774",
            "@ref": "gr23",
            "@mimetype": "image/gif"
          },
          {
            "@category": "thumbnail",
            "@height": "164",
            "@width": "185",
            "@_fa": "true",
            "$": "https://api.elsevier.com/content/object/eid/1-s2.0-S1872206724600537-gr24.sml?httpAccept=%2A%2F%2A",
            "@multimediatype": "GIF image file",
            "@type": "IMAGE-THUMBNAIL",
            "@size": "16338",
            "@ref": "gr24",
            "@mimetype": "image/gif"
          },
          {
            "@category": "thumbnail",
            "@height": "164",
            "@width": "190",
            "@_fa": "true",
            "$": "https://api.elsevier.com/content/object/eid/1-s2.0-S1872206724600537-gr25.sml?httpAccept=%2A%2F%2A",
            "@multimediatype": "GIF image file",
            "@type": "IMAGE-THUMBNAIL",
            "@size": "15665",
            "@ref": "gr25",
            "@mimetype": "image/gif"
          },
          {
            "@category": "thumbnail",
            "@height": "138",
            "@width": "219",
            "@_fa": "true",
            "$": "https://api.elsevier.com/content/object/eid/1-s2.0-S1872206724600537-gr26.sml?httpAccept=%2A%2F%2A",
            "@multimediatype": "GIF image file",
            "@type": "IMAGE-THUMBNAIL",
            "@size": "15992",
            "@ref": "gr26",
            "@mimetype": "image/gif"
          },
          {
            "@category": "thumbnail",
            "@height": "164",
            "@width": "185",
            "@_fa": "true",
            "$": "https://api.elsevier.com/content/object/eid/1-s2.0-S1872206724600537-gr27.sml?httpAccept=%2A%2F%2A",
            "@multimediatype": "GIF image file",
            "@type": "IMAGE-THUMBNAIL",
            "@size": "18847",
            "@ref": "gr27",
            "@mimetype": "image/gif"
          },
          {
            "@category": "thumbnail",
            "@height": "102",
            "@width": "219",
            "@_fa": "true",
            "$": "https://api.elsevier.com/content/object/eid/1-s2.0-S1872206724600537-gr28.sml?httpAccept=%2A%2F%2A",
            "@multimediatype": "GIF image file",
            "@type": "IMAGE-THUMBNAIL",
            "@size": "15691",
            "@ref": "gr28",
            "@mimetype": "image/gif"
          },
          {
            "@category": "thumbnail",
            "@height": "164",
            "@width": "151",
            "@_fa": "true",
            "$": "https://api.elsevier.com/content/object/eid/1-s2.0-S1872206724600537-gr29.sml?httpAccept=%2A%2F%2A",
            "@multimediatype": "GIF image file",
            "@type": "IMAGE-THUMBNAIL",
            "@size": "14740",
            "@ref": "gr29",
            "@mimetype": "image/gif"
          },
          {
            "@category": "thumbnail",
            "@height": "94",
            "@width": "219",
            "@_fa": "true",
            "$": "https://api.elsevier.com/content/object/eid/1-s2.0-S1872206724600537-gr3.sml?httpAccept=%2A%2F%2A",
            "@multimediatype": "GIF image file",
            "@type": "IMAGE-THUMBNAIL",
            "@size": "10878",
            "@ref": "gr3",
            "@mimetype": "image/gif"
          },
          {
            "@category": "thumbnail",
            "@height": "123",
            "@width": "219",
            "@_fa": "true",
            "$": "https://api.elsevier.com/content/object/eid/1-s2.0-S1872206724600537-gr30.sml?httpAccept=%2A%2F%2A",
            "@multimediatype": "GIF image file",
            "@type": "IMAGE-THUMBNAIL",
            "@size": "19249",
            "@ref": "gr30",
            "@mimetype": "image/gif"
          },
          {
            "@category": "thumbnail",
            "@height": "82",
            "@width": "219",
            "@_fa": "true",
            "$": "https://api.elsevier.com/content/object/eid/1-s2.0-S1872206724600537-gr31.sml?httpAccept=%2A%2F%2A",
            "@multimediatype": "GIF image file",
            "@type": "IMAGE-THUMBNAIL",
            "@size": "12957",
            "@ref": "gr31",
            "@mimetype": "image/gif"
          },
          {
            "@category": "thumbnail",
            "@height": "164",
            "@width": "184",
            "@_fa": "true",
            "$": "https://api.elsevier.com/content/object/eid/1-s2.0-S1872206724600537-gr32.sml?httpAccept=%2A%2F%2A",
            "@multimediatype": "GIF image file",
            "@type": "IMAGE-THUMBNAIL",
            "@size": "17041",
            "@ref": "gr32",
            "@mimetype": "image/gif"
          },
          {
            "@category": "thumbnail",
            "@height": "83",
            "@width": "219",
            "@_fa": "true",
            "$": "https://api.elsevier.com/content/object/eid/1-s2.0-S1872206724600537-gr33.sml?httpAccept=%2A%2F%2A",
            "@multimediatype": "GIF image file",
            "@type": "IMAGE-THUMBNAIL",
            "@size": "10127",
            "@ref": "gr33",
            "@mimetype": "image/gif"
          },
          {
            "@category": "thumbnail",
            "@height": "163",
            "@width": "142",
            "@_fa": "true",
            "$": "https://api.elsevier.com/content/object/eid/1-s2.0-S1872206724600537-gr34.sml?httpAccept=%2A%2F%2A",
            "@multimediatype": "GIF image file",
            "@type": "IMAGE-THUMBNAIL",
            "@size": "12055",
            "@ref": "gr34",
            "@mimetype": "image/gif"
          },
          {
            "@category": "thumbnail",
            "@height": "84",
            "@width": "219",
            "@_fa": "true",
            "$": "https://api.elsevier.com/content/object/eid/1-s2.0-S1872206724600537-gr35.sml?httpAccept=%2A%2F%2A",
            "@multimediatype": "GIF image file",
            "@type": "IMAGE-THUMBNAIL",
            "@size": "9947",
            "@ref": "gr35",
            "@mimetype": "image/gif"
          },
          {
            "@category": "thumbnail",
            "@height": "92",
            "@width": "219",
            "@_fa": "true",
            "$": "https://api.elsevier.com/content/object/eid/1-s2.0-S1872206724600537-gr36.sml?httpAccept=%2A%2F%2A",
            "@multimediatype": "GIF image file",
            "@type": "IMAGE-THUMBNAIL",
            "@size": "9507",
            "@ref": "gr36",
            "@mimetype": "image/gif"
          },
          {
            "@category": "thumbnail",
            "@height": "85",
            "@width": "219",
            "@_fa": "true",
            "$": "https://api.elsevier.com/content/object/eid/1-s2.0-S1872206724600537-gr37.sml?httpAccept=%2A%2F%2A",
            "@multimediatype": "GIF image file",
            "@type": "IMAGE-THUMBNAIL",
            "@size": "13235",
            "@ref": "gr37",
            "@mimetype": "image/gif"
          },
          {
            "@category": "thumbnail",
            "@height": "74",
            "@width": "219",
            "@_fa": "true",
            "$": "https://api.elsevier.com/content/object/eid/1-s2.0-S1872206724600537-gr38.sml?httpAccept=%2A%2F%2A",
            "@multimediatype": "GIF image file",
            "@type": "IMAGE-THUMBNAIL",
            "@size": "9410",
            "@ref": "gr38",
            "@mimetype": "image/gif"
          },
          {
            "@category": "thumbnail",
            "@height": "126",
            "@width": "219",
            "@_fa": "true",
            "$": "https://api.elsevier.com/content/object/eid/1-s2.0-S1872206724600537-gr39.sml?httpAccept=%2A%2F%2A",
            "@multimediatype": "GIF image file",
            "@type": "IMAGE-THUMBNAIL",
            "@size": "16659",
            "@ref": "gr39",
            "@mimetype": "image/gif"
          },
          {
            "@category": "thumbnail",
            "@height": "163",
            "@width": "157",
            "@_fa": "true",
            "$": "https://api.elsevier.com/content/object/eid/1-s2.0-S1872206724600537-gr4.sml?httpAccept=%2A%2F%2A",
            "@multimediatype": "GIF image file",
            "@type": "IMAGE-THUMBNAIL",
            "@size": "15507",
            "@ref": "gr4",
            "@mimetype": "image/gif"
          },
          {
            "@category": "thumbnail",
            "@height": "89",
            "@width": "219",
            "@_fa": "true",
            "$": "https://api.elsevier.com/content/object/eid/1-s2.0-S1872206724600537-gr40.sml?httpAccept=%2A%2F%2A",
            "@multimediatype": "GIF image file",
            "@type": "IMAGE-THUMBNAIL",
            "@size": "8984",
            "@ref": "gr40",
            "@mimetype": "image/gif"
          },
          {
            "@category": "thumbnail",
            "@height": "145",
            "@width": "219",
            "@_fa": "true",
            "$": "https://api.elsevier.com/content/object/eid/1-s2.0-S1872206724600537-gr41.sml?httpAccept=%2A%2F%2A",
            "@multimediatype": "GIF image file",
            "@type": "IMAGE-THUMBNAIL",
            "@size": "15924",
            "@ref": "gr41",
            "@mimetype": "image/gif"
          },
          {
            "@category": "thumbnail",
            "@height": "124",
            "@width": "219",
            "@_fa": "true",
            "$": "https://api.elsevier.com/content/object/eid/1-s2.0-S1872206724600537-gr42.sml?httpAccept=%2A%2F%2A",
            "@multimediatype": "GIF image file",
            "@type": "IMAGE-THUMBNAIL",
            "@size": "14522",
            "@ref": "gr42",
            "@mimetype": "image/gif"
          },
          {
            "@category": "thumbnail",
            "@height": "120",
            "@width": "219",
            "@_fa": "true",
            "$": "https://api.elsevier.com/content/object/eid/1-s2.0-S1872206724600537-gr43.sml?httpAccept=%2A%2F%2A",
            "@multimediatype": "GIF image file",
            "@type": "IMAGE-THUMBNAIL",
            "@size": "10287",
            "@ref": "gr43",
            "@mimetype": "image/gif"
          },
          {
            "@category": "thumbnail",
            "@height": "131",
            "@width": "219",
            "@_fa": "true",
            "$": "https://api.elsevier.com/content/object/eid/1-s2.0-S1872206724600537-gr44.sml?httpAccept=%2A%2F%2A",
            "@multimediatype": "GIF image file",
            "@type": "IMAGE-THUMBNAIL",
            "@size": "11622",
            "@ref": "gr44",
            "@mimetype": "image/gif"
          },
          {
            "@category": "thumbnail",
            "@height": "164",
            "@width": "197",
            "@_fa": "true",
            "$": "https://api.elsevier.com/content/object/eid/1-s2.0-S1872206724600537-gr5.sml?httpAccept=%2A%2F%2A",
            "@multimediatype": "GIF image file",
            "@type": "IMAGE-THUMBNAIL",
            "@size": "19752",
            "@ref": "gr5",
            "@mimetype": "image/gif"
          },
          {
            "@category": "thumbnail",
            "@height": "77",
            "@width": "219",
            "@_fa": "true",
            "$": "https://api.elsevier.com/content/object/eid/1-s2.0-S1872206724600537-gr6.sml?httpAccept=%2A%2F%2A",
            "@multimediatype": "GIF image file",
            "@type": "IMAGE-THUMBNAIL",
            "@size": "11594",
            "@ref": "gr6",
            "@mimetype": "image/gif"
          },
          {
            "@category": "thumbnail",
            "@height": "163",
            "@width": "128",
            "@_fa": "true",
            "$": "https://api.elsevier.com/content/object/eid/1-s2.0-S1872206724600537-gr7.sml?httpAccept=%2A%2F%2A",
            "@multimediatype": "GIF image file",
            "@type": "IMAGE-THUMBNAIL",
            "@size": "13073",
            "@ref": "gr7",
            "@mimetype": "image/gif"
          },
          {
            "@category": "thumbnail",
            "@height": "164",
            "@width": "205",
            "@_fa": "true",
            "$": "https://api.elsevier.com/content/object/eid/1-s2.0-S1872206724600537-gr8.sml?httpAccept=%2A%2F%2A",
            "@multimediatype": "GIF image file",
            "@type": "IMAGE-THUMBNAIL",
            "@size": "15763",
            "@ref": "gr8",
            "@mimetype": "image/gif"
          },
          {
            "@category": "thumbnail",
            "@height": "158",
            "@width": "219",
            "@_fa": "true",
            "$": "https://api.elsevier.com/content/object/eid/1-s2.0-S1872206724600537-gr9.sml?httpAccept=%2A%2F%2A",
            "@multimediatype": "GIF image file",
            "@type": "IMAGE-THUMBNAIL",
            "@size": "19117",
            "@ref": "gr9",
            "@mimetype": "image/gif"
          },
          {
            "@category": "thumbnail",
            "@height": "112",
            "@width": "219",
            "@_fa": "true",
            "$": "https://api.elsevier.com/content/object/eid/1-s2.0-S1872206724600537-Sc1.sml?httpAccept=%2A%2F%2A",
            "@multimediatype": "GIF image file",
            "@type": "IMAGE-THUMBNAIL",
            "@size": "11833",
            "@ref": "Sc1",
            "@mimetype": "image/gif"
          },
          {
            "@category": "thumbnail",
            "@height": "164",
            "@width": "164",
            "@_fa": "true",
            "$": "https://api.elsevier.com/content/object/eid/1-s2.0-S1872206724600537-Sc2.sml?httpAccept=%2A%2F%2A",
            "@multimediatype": "GIF image file",
            "@type": "IMAGE-THUMBNAIL",
            "@size": "7087",
            "@ref": "Sc2",
            "@mimetype": "image/gif"
          },
          {
            "@category": "high",
            "@height": "475",
            "@width": "800",
            "@_fa": "true",
            "$": "https://api.elsevier.com/content/object/eid/1-s2.0-S1872206724600537-fx1_lrg.jpg?httpAccept=%2A%2F%2A",
            "@multimediatype": "JPEG image file",
            "@type": "IMAGE-HIGH-RES",
            "@size": "74553",
            "@ref": "fx1",
            "@mimetype": "image/jpeg"
          },
          {
            "@category": "high",
            "@height": "663",
            "@width": "474",
            "@_fa": "true",
            "$": "https://api.elsevier.com/content/object/eid/1-s2.0-S1872206724600537-fx2_lrg.jpg?httpAccept=%2A%2F%2A",
            "@multimediatype": "JPEG image file",
            "@type": "IMAGE-HIGH-RES",
            "@size": "50699",
            "@ref": "fx2",
            "@mimetype": "image/jpeg"
          },
          {
            "@category": "high",
            "@height": "415",
            "@width": "423",
            "@_fa": "true",
            "$": "https://api.elsevier.com/content/object/eid/1-s2.0-S1872206724600537-gr1_lrg.jpg?httpAccept=%2A%2F%2A",
            "@multimediatype": "JPEG image file",
            "@type": "IMAGE-HIGH-RES",
            "@size": "54017",
            "@ref": "gr1",
            "@mimetype": "image/jpeg"
          },
          {
            "@category": "high",
            "@height": "748",
            "@width": "1407",
            "@_fa": "true",
            "$": "https://api.elsevier.com/content/object/eid/1-s2.0-S1872206724600537-gr10_lrg.jpg?httpAccept=%2A%2F%2A",
            "@multimediatype": "JPEG image file",
            "@type": "IMAGE-HIGH-RES",
            "@size": "218394",
            "@ref": "gr10",
            "@mimetype": "image/jpeg"
          },
          {
            "@category": "high",
            "@height": "1471",
            "@width": "1485",
            "@_fa": "true",
            "$": "https://api.elsevier.com/content/object/eid/1-s2.0-S1872206724600537-gr11_lrg.jpg?httpAccept=%2A%2F%2A",
            "@multimediatype": "JPEG image file",
            "@type": "IMAGE-HIGH-RES",
            "@size": "428585",
            "@ref": "gr11",
            "@mimetype": "image/jpeg"
          },
          {
            "@category": "high",
            "@height": "2001",
            "@width": "1254",
            "@_fa": "true",
            "$": "https://api.elsevier.com/content/object/eid/1-s2.0-S1872206724600537-gr12_lrg.jpg?httpAccept=%2A%2F%2A",
            "@multimediatype": "JPEG image file",
            "@type": "IMAGE-HIGH-RES",
            "@size": "591653",
            "@ref": "gr12",
            "@mimetype": "image/jpeg"
          },
          {
            "@category": "high",
            "@height": "1760",
            "@width": "1774",
            "@_fa": "true",
            "$": "https://api.elsevier.com/content/object/eid/1-s2.0-S1872206724600537-gr13_lrg.jpg?httpAccept=%2A%2F%2A",
            "@multimediatype": "JPEG image file",
            "@type": "IMAGE-HIGH-RES",
            "@size": "572210",
            "@ref": "gr13",
            "@mimetype": "image/jpeg"
          },
          {
            "@category": "high",
            "@height": "1049",
            "@width": "1877",
            "@_fa": "true",
            "$": "https://api.elsevier.com/content/object/eid/1-s2.0-S1872206724600537-gr14_lrg.jpg?httpAccept=%2A%2F%2A",
            "@multimediatype": "JPEG image file",
            "@type": "IMAGE-HIGH-RES",
            "@size": "442639",
            "@ref": "gr14",
            "@mimetype": "image/jpeg"
          },
          {
            "@category": "high",
            "@height": "1332",
            "@width": "2008",
            "@_fa": "true",
            "$": "https://api.elsevier.com/content/object/eid/1-s2.0-S1872206724600537-gr15_lrg.jpg?httpAccept=%2A%2F%2A",
            "@multimediatype": "JPEG image file",
            "@type": "IMAGE-HIGH-RES",
            "@size": "623335",
            "@ref": "gr15",
            "@mimetype": "image/jpeg"
          },
          {
            "@category": "high",
            "@height": "988",
            "@width": "1760",
            "@_fa": "true",
            "$": "https://api.elsevier.com/content/object/eid/1-s2.0-S1872206724600537-gr16_lrg.jpg?httpAccept=%2A%2F%2A",
            "@multimediatype": "JPEG image file",
            "@type": "IMAGE-HIGH-RES",
            "@size": "398657",
            "@ref": "gr16",
            "@mimetype": "image/jpeg"
          },
          {
            "@category": "high",
            "@height": "479",
            "@width": "600",
            "@_fa": "true",
            "$": "https://api.elsevier.com/content/object/eid/1-s2.0-S1872206724600537-gr17_lrg.jpg?httpAccept=%2A%2F%2A",
            "@multimediatype": "JPEG image file",
            "@type": "IMAGE-HIGH-RES",
            "@size": "43378",
            "@ref": "gr17",
            "@mimetype": "image/jpeg"
          },
          {
            "@category": "high",
            "@height": "299",
            "@width": "315",
            "@_fa": "true",
            "$": "https://api.elsevier.com/content/object/eid/1-s2.0-S1872206724600537-gr18_lrg.jpg?httpAccept=%2A%2F%2A",
            "@multimediatype": "JPEG image file",
            "@type": "IMAGE-HIGH-RES",
            "@size": "31356",
            "@ref": "gr18",
            "@mimetype": "image/jpeg"
          },
          {
            "@category": "high",
            "@height": "740",
            "@width": "2044",
            "@_fa": "true",
            "$": "https://api.elsevier.com/content/object/eid/1-s2.0-S1872206724600537-gr19_lrg.jpg?httpAccept=%2A%2F%2A",
            "@multimediatype": "JPEG image file",
            "@type": "IMAGE-HIGH-RES",
            "@size": "329139",
            "@ref": "gr19",
            "@mimetype": "image/jpeg"
          },
          {
            "@category": "high",
            "@height": "1829",
            "@width": "2068",
            "@_fa": "true",
            "$": "https://api.elsevier.com/content/object/eid/1-s2.0-S1872206724600537-gr2_lrg.jpg?httpAccept=%2A%2F%2A",
            "@multimediatype": "JPEG image file",
            "@type": "IMAGE-HIGH-RES",
            "@size": "894440",
            "@ref": "gr2",
            "@mimetype": "image/jpeg"
          },
          {
            "@category": "high",
            "@height": "1277",
            "@width": "1737",
            "@_fa": "true",
            "$": "https://api.elsevier.com/content/object/eid/1-s2.0-S1872206724600537-gr20_lrg.jpg?httpAccept=%2A%2F%2A",
            "@multimediatype": "JPEG image file",
            "@type": "IMAGE-HIGH-RES",
            "@size": "361557",
            "@ref": "gr20",
            "@mimetype": "image/jpeg"
          },
          {
            "@category": "high",
            "@height": "1542",
            "@width": "2046",
            "@_fa": "true",
            "$": "https://api.elsevier.com/content/object/eid/1-s2.0-S1872206724600537-gr21_lrg.jpg?httpAccept=%2A%2F%2A",
            "@multimediatype": "JPEG image file",
            "@type": "IMAGE-HIGH-RES",
            "@size": "688250",
            "@ref": "gr21",
            "@mimetype": "image/jpeg"
          },
          {
            "@category": "high",
            "@height": "1405",
            "@width": "2008",
            "@_fa": "true",
            "$": "https://api.elsevier.com/content/object/eid/1-s2.0-S1872206724600537-gr22_lrg.jpg?httpAccept=%2A%2F%2A",
            "@multimediatype": "JPEG image file",
            "@type": "IMAGE-HIGH-RES",
            "@size": "718511",
            "@ref": "gr22",
            "@mimetype": "image/jpeg"
          },
          {
            "@category": "high",
            "@height": "615",
            "@width": "1763",
            "@_fa": "true",
            "$": "https://api.elsevier.com/content/object/eid/1-s2.0-S1872206724600537-gr23_lrg.jpg?httpAccept=%2A%2F%2A",
            "@multimediatype": "JPEG image file",
            "@type": "IMAGE-HIGH-RES",
            "@size": "338717",
            "@ref": "gr23",
            "@mimetype": "image/jpeg"
          },
          {
            "@category": "high",
            "@height": "1445",
            "@width": "1633",
            "@_fa": "true",
            "$": "https://api.elsevier.com/content/object/eid/1-s2.0-S1872206724600537-gr24_lrg.jpg?httpAccept=%2A%2F%2A",
            "@multimediatype": "JPEG image file",
            "@type": "IMAGE-HIGH-RES",
            "@size": "513785",
            "@ref": "gr24",
            "@mimetype": "image/jpeg"
          },
          {
            "@category": "high",
            "@height": "1730",
            "@width": "2006",
            "@_fa": "true",
            "$": "https://api.elsevier.com/content/object/eid/1-s2.0-S1872206724600537-gr25_lrg.jpg?httpAccept=%2A%2F%2A",
            "@multimediatype": "JPEG image file",
            "@type": "IMAGE-HIGH-RES",
            "@size": "631480",
            "@ref": "gr25",
            "@mimetype": "image/jpeg"
          },
          {
            "@category": "high",
            "@height": "1267",
            "@width": "2012",
            "@_fa": "true",
            "$": "https://api.elsevier.com/content/object/eid/1-s2.0-S1872206724600537-gr26_lrg.jpg?httpAccept=%2A%2F%2A",
            "@multimediatype": "JPEG image file",
            "@type": "IMAGE-HIGH-RES",
            "@size": "614542",
            "@ref": "gr26",
            "@mimetype": "image/jpeg"
          },
          {
            "@category": "high",
            "@height": "1721",
            "@width": "1942",
            "@_fa": "true",
            "$": "https://api.elsevier.com/content/object/eid/1-s2.0-S1872206724600537-gr27_lrg.jpg?httpAccept=%2A%2F%2A",
            "@multimediatype": "JPEG image file",
            "@type": "IMAGE-HIGH-RES",
            "@size": "746051",
            "@ref": "gr27",
            "@mimetype": "image/jpeg"
          },
          {
            "@category": "high",
            "@height": "836",
            "@width": "1795",
            "@_fa": "true",
            "$": "https://api.elsevier.com/content/object/eid/1-s2.0-S1872206724600537-gr28_lrg.jpg?httpAccept=%2A%2F%2A",
            "@multimediatype": "JPEG image file",
            "@type": "IMAGE-HIGH-RES",
            "@size": "483687",
            "@ref": "gr28",
            "@mimetype": "image/jpeg"
          },
          {
            "@category": "high",
            "@height": "1623",
            "@width": "1496",
            "@_fa": "true",
            "$": "https://api.elsevier.com/content/object/eid/1-s2.0-S1872206724600537-gr29_lrg.jpg?httpAccept=%2A%2F%2A",
            "@multimediatype": "JPEG image file",
            "@type": "IMAGE-HIGH-RES",
            "@size": "605898",
            "@ref": "gr29",
            "@mimetype": "image/jpeg"
          },
          {
            "@category": "high",
            "@height": "877",
            "@width": "2054",
            "@_fa": "true",
            "$": "https://api.elsevier.com/content/object/eid/1-s2.0-S1872206724600537-gr3_lrg.jpg?httpAccept=%2A%2F%2A",
            "@multimediatype": "JPEG image file",
            "@type": "IMAGE-HIGH-RES",
            "@size": "388867",
            "@ref": "gr3",
            "@mimetype": "image/jpeg"
          },
          {
            "@category": "high",
            "@height": "941",
            "@width": "1675",
            "@_fa": "true",
            "$": "https://api.elsevier.com/content/object/eid/1-s2.0-S1872206724600537-gr30_lrg.jpg?httpAccept=%2A%2F%2A",
            "@multimediatype": "JPEG image file",
            "@type": "IMAGE-HIGH-RES",
            "@size": "459545",
            "@ref": "gr30",
            "@mimetype": "image/jpeg"
          },
          {
            "@category": "high",
            "@height": "724",
            "@width": "1933",
            "@_fa": "true",
            "$": "https://api.elsevier.com/content/object/eid/1-s2.0-S1872206724600537-gr31_lrg.jpg?httpAccept=%2A%2F%2A",
            "@multimediatype": "JPEG image file",
            "@type": "IMAGE-HIGH-RES",
            "@size": "374580",
            "@ref": "gr31",
            "@mimetype": "image/jpeg"
          },
          {
            "@category": "high",
            "@height": "1700",
            "@width": "1912",
            "@_fa": "true",
            "$": "https://api.elsevier.com/content/object/eid/1-s2.0-S1872206724600537-gr32_lrg.jpg?httpAccept=%2A%2F%2A",
            "@multimediatype": "JPEG image file",
            "@type": "IMAGE-HIGH-RES",
            "@size": "755082",
            "@ref": "gr32",
            "@mimetype": "image/jpeg"
          },
          {
            "@category": "high",
            "@height": "768",
            "@width": "2016",
            "@_fa": "true",
            "$": "https://api.elsevier.com/content/object/eid/1-s2.0-S1872206724600537-gr33_lrg.jpg?httpAccept=%2A%2F%2A",
            "@multimediatype": "JPEG image file",
            "@type": "IMAGE-HIGH-RES",
            "@size": "365655",
            "@ref": "gr33",
            "@mimetype": "image/jpeg"
          },
          {
            "@category": "high",
            "@height": "1142",
            "@width": "992",
            "@_fa": "true",
            "$": "https://api.elsevier.com/content/object/eid/1-s2.0-S1872206724600537-gr34_lrg.jpg?httpAccept=%2A%2F%2A",
            "@multimediatype": "JPEG image file",
            "@type": "IMAGE-HIGH-RES",
            "@size": "303091",
            "@ref": "gr34",
            "@mimetype": "image/jpeg"
          },
          {
            "@category": "high",
            "@height": "754",
            "@width": "1966",
            "@_fa": "true",
            "$": "https://api.elsevier.com/content/object/eid/1-s2.0-S1872206724600537-gr35_lrg.jpg?httpAccept=%2A%2F%2A",
            "@multimediatype": "JPEG image file",
            "@type": "IMAGE-HIGH-RES",
            "@size": "331029",
            "@ref": "gr35",
            "@mimetype": "image/jpeg"
          },
          {
            "@category": "high",
            "@height": "779",
            "@width": "1853",
            "@_fa": "true",
            "$": "https://api.elsevier.com/content/object/eid/1-s2.0-S1872206724600537-gr36_lrg.jpg?httpAccept=%2A%2F%2A",
            "@multimediatype": "JPEG image file",
            "@type": "IMAGE-HIGH-RES",
            "@size": "280059",
            "@ref": "gr36",
            "@mimetype": "image/jpeg"
          },
          {
            "@category": "high",
            "@height": "783",
            "@width": "2009",
            "@_fa": "true",
            "$": "https://api.elsevier.com/content/object/eid/1-s2.0-S1872206724600537-gr37_lrg.jpg?httpAccept=%2A%2F%2A",
            "@multimediatype": "JPEG image file",
            "@type": "IMAGE-HIGH-RES",
            "@size": "449776",
            "@ref": "gr37",
            "@mimetype": "image/jpeg"
          },
          {
            "@category": "high",
            "@height": "638",
            "@width": "1884",
            "@_fa": "true",
            "$": "https://api.elsevier.com/content/object/eid/1-s2.0-S1872206724600537-gr38_lrg.jpg?httpAccept=%2A%2F%2A",
            "@multimediatype": "JPEG image file",
            "@type": "IMAGE-HIGH-RES",
            "@size": "252696",
            "@ref": "gr38",
            "@mimetype": "image/jpeg"
          },
          {
            "@category": "high",
            "@height": "1100",
            "@width": "1911",
            "@_fa": "true",
            "$": "https://api.elsevier.com/content/object/eid/1-s2.0-S1872206724600537-gr39_lrg.jpg?httpAccept=%2A%2F%2A",
            "@multimediatype": "JPEG image file",
            "@type": "IMAGE-HIGH-RES",
            "@size": "625194",
            "@ref": "gr39",
            "@mimetype": "image/jpeg"
          },
          {
            "@category": "high",
            "@height": "2079",
            "@width": "1998",
            "@_fa": "true",
            "$": "https://api.elsevier.com/content/object/eid/1-s2.0-S1872206724600537-gr4_lrg.jpg?httpAccept=%2A%2F%2A",
            "@multimediatype": "JPEG image file",
            "@type": "IMAGE-HIGH-RES",
            "@size": "938282",
            "@ref": "gr4",
            "@mimetype": "image/jpeg"
          },
          {
            "@category": "high",
            "@height": "814",
            "@width": "2004",
            "@_fa": "true",
            "$": "https://api.elsevier.com/content/object/eid/1-s2.0-S1872206724600537-gr40_lrg.jpg?httpAccept=%2A%2F%2A",
            "@multimediatype": "JPEG image file",
            "@type": "IMAGE-HIGH-RES",
            "@size": "325804",
            "@ref": "gr40",
            "@mimetype": "image/jpeg"
          },
          {
            "@category": "high",
            "@height": "1135",
            "@width": "1709",
            "@_fa": "true",
            "$": "https://api.elsevier.com/content/object/eid/1-s2.0-S1872206724600537-gr41_lrg.jpg?httpAccept=%2A%2F%2A",
            "@multimediatype": "JPEG image file",
            "@type": "IMAGE-HIGH-RES",
            "@size": "399340",
            "@ref": "gr41",
            "@mimetype": "image/jpeg"
          },
          {
            "@category": "high",
            "@height": "564",
            "@width": "993",
            "@_fa": "true",
            "$": "https://api.elsevier.com/content/object/eid/1-s2.0-S1872206724600537-gr42_lrg.jpg?httpAccept=%2A%2F%2A",
            "@multimediatype": "JPEG image file",
            "@type": "IMAGE-HIGH-RES",
            "@size": "159472",
            "@ref": "gr42",
            "@mimetype": "image/jpeg"
          },
          {
            "@category": "high",
            "@height": "1025",
            "@width": "1868",
            "@_fa": "true",
            "$": "https://api.elsevier.com/content/object/eid/1-s2.0-S1872206724600537-gr43_lrg.jpg?httpAccept=%2A%2F%2A",
            "@multimediatype": "JPEG image file",
            "@type": "IMAGE-HIGH-RES",
            "@size": "324131",
            "@ref": "gr43",
            "@mimetype": "image/jpeg"
          },
          {
            "@category": "high",
            "@height": "581",
            "@width": "970",
            "@_fa": "true",
            "$": "https://api.elsevier.com/content/object/eid/1-s2.0-S1872206724600537-gr44_lrg.jpg?httpAccept=%2A%2F%2A",
            "@multimediatype": "JPEG image file",
            "@type": "IMAGE-HIGH-RES",
            "@size": "137645",
            "@ref": "gr44",
            "@mimetype": "image/jpeg"
          },
          {
            "@category": "high",
            "@height": "1414",
            "@width": "1697",
            "@_fa": "true",
            "$": "https://api.elsevier.com/content/object/eid/1-s2.0-S1872206724600537-gr5_lrg.jpg?httpAccept=%2A%2F%2A",
            "@multimediatype": "JPEG image file",
            "@type": "IMAGE-HIGH-RES",
            "@size": "570303",
            "@ref": "gr5",
            "@mimetype": "image/jpeg"
          },
          {
            "@category": "high",
            "@height": "723",
            "@width": "2069",
            "@_fa": "true",
            "$": "https://api.elsevier.com/content/object/eid/1-s2.0-S1872206724600537-gr6_lrg.jpg?httpAccept=%2A%2F%2A",
            "@multimediatype": "JPEG image file",
            "@type": "IMAGE-HIGH-RES",
            "@size": "396183",
            "@ref": "gr6",
            "@mimetype": "image/jpeg"
          },
          {
            "@category": "high",
            "@height": "1657",
            "@width": "1301",
            "@_fa": "true",
            "$": "https://api.elsevier.com/content/object/eid/1-s2.0-S1872206724600537-gr7_lrg.jpg?httpAccept=%2A%2F%2A",
            "@multimediatype": "JPEG image file",
            "@type": "IMAGE-HIGH-RES",
            "@size": "579077",
            "@ref": "gr7",
            "@mimetype": "image/jpeg"
          },
          {
            "@category": "high",
            "@height": "1119",
            "@width": "1399",
            "@_fa": "true",
            "$": "https://api.elsevier.com/content/object/eid/1-s2.0-S1872206724600537-gr8_lrg.jpg?httpAccept=%2A%2F%2A",
            "@multimediatype": "JPEG image file",
            "@type": "IMAGE-HIGH-RES",
            "@size": "325047",
            "@ref": "gr8",
            "@mimetype": "image/jpeg"
          },
          {
            "@category": "high",
            "@height": "1369",
            "@width": "1892",
            "@_fa": "true",
            "$": "https://api.elsevier.com/content/object/eid/1-s2.0-S1872206724600537-gr9_lrg.jpg?httpAccept=%2A%2F%2A",
            "@multimediatype": "JPEG image file",
            "@type": "IMAGE-HIGH-RES",
            "@size": "612031",
            "@ref": "gr9",
            "@mimetype": "image/jpeg"
          },
          {
            "@category": "high",
            "@height": "496",
            "@width": "972",
            "@_fa": "true",
            "$": "https://api.elsevier.com/content/object/eid/1-s2.0-S1872206724600537-Sc1_lrg.jpg?httpAccept=%2A%2F%2A",
            "@multimediatype": "JPEG image file",
            "@type": "IMAGE-HIGH-RES",
            "@size": "117610",
            "@ref": "Sc1",
            "@mimetype": "image/jpeg"
          },
          {
            "@category": "high",
            "@height": "345",
            "@width": "346",
            "@_fa": "true",
            "$": "https://api.elsevier.com/content/object/eid/1-s2.0-S1872206724600537-Sc2_lrg.jpg?httpAccept=%2A%2F%2A",
            "@multimediatype": "JPEG image file",
            "@type": "IMAGE-HIGH-RES",
            "@size": "25014",
            "@ref": "Sc2",
            "@mimetype": "image/jpeg"
          },
          {
            "@category": "thumbnail",
            "@height": "46",
            "@width": "223",
            "@_fa": "true",
            "$": "https://api.elsevier.com/content/object/eid/1-s2.0-S1872206724600537-si1.gif?httpAccept=%2A%2F%2A",
            "@multimediatype": "GIF image file",
            "@type": "ALTIMG",
            "@size": "597",
            "@ref": "si1",
            "@mimetype": "image/gif"
          },
          {
            "@category": "thumbnail",
            "@height": "52",
            "@width": "253",
            "@_fa": "true",
            "$": "https://api.elsevier.com/content/object/eid/1-s2.0-S1872206724600537-si2.gif?httpAccept=%2A%2F%2A",
            "@multimediatype": "GIF image file",
            "@type": "ALTIMG",
            "@size": "707",
            "@ref": "si2",
            "@mimetype": "image/gif"
          },
          {
            "@category": "thumbnail",
            "@height": "42",
            "@width": "301",
            "@_fa": "true",
            "$": "https://api.elsevier.com/content/object/eid/1-s2.0-S1872206724600537-si3.gif?httpAccept=%2A%2F%2A",
            "@multimediatype": "GIF image file",
            "@type": "ALTIMG",
            "@size": "840",
            "@ref": "si3",
            "@mimetype": "image/gif"
          }
        ]
      },
      "link": {
        "@rel": "abstract",
        "@href": "https://api.elsevier.com/content/abstract/scopus_id/85198902842"
      }
    }
  }
}