{
  "metadata": {
    "title": "Metal-organic framework-derived cation regulation of metal sulfides for enhanced oxygen evolution activity",
    "authors": "; ; ",
    "journal": "Chinese Journal of Catalysis",
    "date": "2023-11-30",
    "doi": "10.1016/S1872-2067(23)64533-4",
    "abstract": "",
    "uri": "https://api.elsevier.com/content/article/pii/S1872206723645334",
    "pii": "S1872206723645334"
  },
  "fulltext": {
    "full-text-retrieval-response": {
      "scopus-eid": "2-s2.0-85177854978",
      "originalText": "serial JL 273538 291210 291744 291809 31 Chinese Journal of Catalysis CHINESEJOURNALCATALYSIS 2023-11-22 2023-11-22 2023-11-22 2023-11-22 2023-11-28T20:41:14 1-s2.0-S1872206723645334 S1872-2067(23)64533-4 S1872206723645334 10.1016/S1872-2067(23)64533-4 S300 S300.2 FULL-TEXT 1-s2.0-S1872206723X00114 2023-11-29T07:25:05.021276Z 0 0 20231101 20231130 2023 2023-11-22T17:23:16.518534Z absattachment articleinfo articletitlenorm authfirstinitialnorm authfirstsurnamenorm cid cids contenttype copyright crossmark dateloaded dateloadedtxt datesearch datesort dateupdated dco docsubtype doctype doi eid ewtransactionid hubeid indexeddate issn issnnorm itemstage itemtransactionid itemweight openaccess openarchive pg pgfirst pglast pii piinorm pubdateend pubdatestart pubdatetxt pubyr sortorder srctitle srctitlenorm srctype ssids alllist content subj subheadings suppl tomb volfirst volissue volumelist webpdf webpdfpagecount yearnav figure e-component body acknowledge affil appendices articletitle auth authfirstini authfull authkeywords authlast grantnumber grantsponsor primabst pubtype ref specialabst 1872-2067 18722067 true 54 54 C Volume 54 16 290 297 290 297 202311 November 2023 2023-11-01 2023-11-30 2023 article fla Copyright © 2023 Dalian Institute of Chemical Physics, the Chinese Academy of Sciences. Published by Elsevier B.V. All rights reserved. METALORGANICFRAMEWORKDERIVEDCATIONREGULATIONMETALSULFIDESFORENHANCEDOXYGENEVOLUTIONACTIVITY WAN K 1 Introduction 2 Experimental 2.1 Catalyst preparation 2.2 Physicochemical characterizations 2.3 Electrochemical measurements 2.4 Computational details 3 Results and discussion 4 Conclusions Electronic supporting information Acknowledgments Supplementary Material References ZUBAIR 2023 4799 4810 M QIAN 2022 2101186 Y SU 2023 7 49 H ZU 2022 2208 2217 L OVER 2021 8848 8871 H ZHANG 2022 885 893 Q GUO 2022 2200827 T ZHAO 2023 123027 R MEHDI 2023 2204403 M GAO 2021 2100834 R ZENG 2023 1811 S SHU 2022 3107 3115 X ZHANG 2016 1502489 W ROSSMEISL 2007 83 89 J ZHANG 2021 1253 1268 X LI 2021 14613 14621 X ZHAO 2020 1711 1716 C QIAO 2022 2354 2362 Y ZHANG 2022 2109108 J SANATI 2022 3119 3151 S SVANE 2022 e202201146 K RAO 2022 7622 7633 R LEE 2023 122269 S JIANG 2022 2203520 W ZHANG 2022 2200763 W WAN 2019 19889 19897 K TANG 2017 1077 1093 C ZHAO 2023 2207888 Y LI 2008 10372 10377 Y HUTTER 2014 15 25 M PERDEW 1996 3865 3868 J GRIMME 2010 154104 J SHANNON 1976 751 767 R WU 2019 763 772 T ZHANG 2016 12822 12826 K TAN 2017 260 266 A WAN 2015 566 571 K LONG 2017 541 548 G YU 2017 15838 15844 J LIU 2018 1167 1172 Y WAN 2019 1900315 K ZHANG 2016 333 337 B WANG 2023 2301706 H MEHMOOD 2023 12206 12213 R SU 2016 5893 5902 Y KONG 2019 2469 2472 W ZHANG 2014 3545 3553 L LI 2022 2201913 D ZHANG 2022 e202207217 N KIM 2020 1523 1530 S WYGANT 2018 2956 2966 B ZHANG 2016 14686 14693 G LI 2016 4006 4009 D WANG 2018 1801756 M GUO 2021 1287 1296 C XU 2021 1370 1378 Y WANX2023X290 WANX2023X290X297 WANX2023X290XK WANX2023X290X297XK 2025-11-22T00:00:00.000Z 2025-11-22T00:00:00.000Z http://creativecommons.org/licenses/by-nc-nd/4.0/ 2023-11-29T07:23:56.962Z http://vtw.elsevier.com/data/voc/AddOnTypes/50.7/aggregated-refined Science and Technology Program of Guangzhou 2023A04J1357 Guangzhou Municipal Science and Technology Program key projects http://data.elsevier.com/vocabulary/SciValFunders/501100004000 http://sws.geonames.org/1814991/ ERDF ERDF European Regional Development Fund http://data.elsevier.com/vocabulary/SciValFunders/501100008530 http://sws.geonames.org/6695072/ Hohhot Science and Technology Program 2023-JieBangGuaShuai-Gao-3 Ministry of Education, Sichuan University AEMD202204 China Postdoctoral Science Foundation 2022M711196 China Postdoctoral Science Foundation http://data.elsevier.com/vocabulary/SciValFunders/501100002858 http://sws.geonames.org/1814991/ Natural Science Foundation of Fujian Province 2023J01254 Natural Science Foundation of Fujian Province http://data.elsevier.com/vocabulary/SciValFunders/501100003392 http://sws.geonames.org/1814991/ Sichuan Science and Technology Program 2022ZYD0016 2023JDRC0013 Sichuan Province Science and Technology Support Program http://data.elsevier.com/vocabulary/SciValFunders/100012542 http://sws.geonames.org/1814991/ European Union CEX2021-001214-S EC European Commission http://data.elsevier.com/vocabulary/SciValFunders/501100000780 http://sws.geonames.org/6695072/ National Natural Science Foundation of China 21776120 21975081 22178126 22208110 22378270 NSFC National Natural Science Foundation of China http://data.elsevier.com/vocabulary/SciValFunders/501100001809 http://sws.geonames.org/1814991/ Research Fund Program of Guangdong Provincial Key Laboratory of Fuel Cell Technology FC202206 FC202218 MCIN/ AEI/10.13039/501100011033 PID2020-116093RB-C43 de Catalunya SGR 2021SGR00457 This work was supported by the National Natural Science Foundation of China ( 21975081, 22178126, 22208110, 21776120, 22378270 ), the Science and Technology Program of Guangzhou ( 2023A04J1357 ), the China Postdoctoral Science Foundation ( 2022M711196 ), the Open Project of Engineering Research Center of Alternative Energy Materials &amp; Devices, Ministry of Education, Sichuan University ( AEMD202204 ), the Sichuan Science and Technology Program ( 2022ZYD0016, 2023JDRC0013 ), the Hohhot Science and Technology Program ( 2023-JieBangGuaShuai-Gao-3 ), the Natural Science Foundation of Fujian Province, China ( 2023J01254 ), the Research Fund Program of Guangdong Provincial Key Laboratory of Fuel Cell Technology ( FC202206, FC202218 ). This work was jointly supported by the National Natural Science Foundation of China (21975081, 22178126, 22208110, 21776120, 22378270), the Science and Technology Program of Guangzhou (2023A04J1357), the China Postdoctoral Science Foundation (2022M711196), the Open Project of Engineering Research Center of Alternative Energy Materials &amp; Devices, Ministry of Education, Sichuan University (AEMD202204), the Sichuan Science and Technology Program (2022ZYD0016, 2023JDRC0013), Hohhot Science and Technology Program (2023-JieBangGuaShuai-Gao-3), Natural Science Foundation of Fujian Province, China (2023J01254), the Research Fund Program of Guangdong Provincial Key Laboratory of Fuel Cell Technology (FC202206, FC202218). The authors thank support from the project NANOGEN (PID2020-116093RB-C43), funded by MCIN/ AEI/10.13039/501100011033/ and by “ERDF A way of making Europe”, by the “European Union“. ICN2 is supported by the Severo Ochoa program from Spanish MCIN/AEI (CEX2021-001214-S) and is funded by the CERCA Programme/Generalitat de Catalunya, SGR 2021SGR00457. item S1872-2067(23)64533-4 S1872206723645334 1-s2.0-S1872206723645334 10.1016/S1872-2067(23)64533-4 273538 2023-11-29T00:59:41.506954Z 2023-11-01 2023-11-30 1-s2.0-S1872206723645334-main.pdf https://s3-eu-west-1.amazonaws.com/prod-ucs-content-store-eu-west/content/pii:S1872206723645334/MAIN/application/pdf/195edf870c48c24750276f032133161f/main.pdf main.pdf pdf true 4934637 MAIN 8 1-s2.0-S1872206723645334-main_1.png https://s3-eu-west-1.amazonaws.com/prod-ucs-content-store-eu-west/content/pii:S1872206723645334/PREVIEW/image/png/13804708f2fa2fa3944b06fa98ace6d9/main_1.png main_1.png png 53235 849 656 IMAGE-WEB-PDF 1 1-s2.0-S1872206723645334-fx1.jpg https://s3-eu-west-1.amazonaws.com/prod-ucs-content-store-eu-west/content/pii:S1872206723645334/fx1/HIGHRES/image/jpeg/a62f34bd1cef5ff0ea2e371ae8e5d0ad/fx1.jpg fx1 true fx1.jpg jpg 27403 244 280 IMAGE-DOWNSAMPLED 1-s2.0-S1872206723645334-gr1.jpg https://s3-eu-west-1.amazonaws.com/prod-ucs-content-store-eu-west/content/pii:S1872206723645334/gr1/DOWNSAMPLED/image/jpeg/ab72c400b7976353fd55f1eebf2c462c/gr1.jpg gr1 gr1.jpg jpg 39876 247 374 IMAGE-DOWNSAMPLED 1-s2.0-S1872206723645334-gr2.jpg https://s3-eu-west-1.amazonaws.com/prod-ucs-content-store-eu-west/content/pii:S1872206723645334/gr2/PUBMED/image/jpeg/b99b70c26bc5c96a3e147fffe8fbc8ab/gr2.jpg gr2 gr2.jpg jpg 66548 324 620 IMAGE-DOWNSAMPLED 1-s2.0-S1872206723645334-gr3.jpg https://s3-eu-west-1.amazonaws.com/prod-ucs-content-store-eu-west/content/pii:S1872206723645334/gr3/DOWNSAMPLED/image/jpeg/24096043d2a1d3a1f30c9081221c889b/gr3.jpg gr3 gr3.jpg jpg 53091 316 616 IMAGE-DOWNSAMPLED 1-s2.0-S1872206723645334-gr4.jpg https://s3-eu-west-1.amazonaws.com/prod-ucs-content-store-eu-west/content/pii:S1872206723645334/gr4/DOWNSAMPLED/image/jpeg/4507a875610baf221509fb77abe52040/gr4.jpg gr4 gr4.jpg jpg 76653 385 470 IMAGE-DOWNSAMPLED 1-s2.0-S1872206723645334-gr5.jpg https://s3-eu-west-1.amazonaws.com/prod-ucs-content-store-eu-west/content/pii:S1872206723645334/gr5/DOWNSAMPLED/image/jpeg/9e5d97f3a09913c0047a61fbd63e9380/gr5.jpg gr5 gr5.jpg jpg 18395 142 373 IMAGE-DOWNSAMPLED 1-s2.0-S1872206723645334-fx1.sml https://s3-eu-west-1.amazonaws.com/prod-ucs-content-store-eu-west/content/pii:S1872206723645334/fx1/THUMBNAIL/image/gif/5805f5d13bae69840154836467f44e46/fx1.sml fx1 true fx1.sml sml 10044 164 188 IMAGE-THUMBNAIL 1-s2.0-S1872206723645334-gr1.sml https://s3-eu-west-1.amazonaws.com/prod-ucs-content-store-eu-west/content/pii:S1872206723645334/gr1/DOWNSAMPLED/image/gif/d066d31ea3841a2a34754ac018b8a214/gr1.sml gr1 gr1.sml sml 23070 144 219 IMAGE-THUMBNAIL 1-s2.0-S1872206723645334-gr2.sml https://s3-eu-west-1.amazonaws.com/prod-ucs-content-store-eu-west/content/pii:S1872206723645334/gr2/THUMBNAIL/image/gif/a215c7ce1809ed06b97e03a8d2805e26/gr2.sml gr2 gr2.sml sml 9526 115 219 IMAGE-THUMBNAIL 1-s2.0-S1872206723645334-gr3.sml https://s3-eu-west-1.amazonaws.com/prod-ucs-content-store-eu-west/content/pii:S1872206723645334/gr3/THUMBNAIL/image/gif/ef4ee13d12bd66a44f7bb6183396ba54/gr3.sml gr3 gr3.sml sml 6989 112 219 IMAGE-THUMBNAIL 1-s2.0-S1872206723645334-gr4.sml https://s3-eu-west-1.amazonaws.com/prod-ucs-content-store-eu-west/content/pii:S1872206723645334/gr4/THUMBNAIL/image/gif/50b169763bb6a1e6483d1a883628be1a/gr4.sml gr4 gr4.sml sml 21385 164 200 IMAGE-THUMBNAIL 1-s2.0-S1872206723645334-gr5.sml https://s3-eu-west-1.amazonaws.com/prod-ucs-content-store-eu-west/content/pii:S1872206723645334/gr5/THUMBNAIL/image/gif/5aa11e36e67c5e9f1e8a60b6c51eaad0/gr5.sml gr5 gr5.sml sml 5470 83 219 IMAGE-THUMBNAIL 1-s2.0-S1872206723645334-fx1_lrg.jpg https://s3-eu-west-1.amazonaws.com/prod-ucs-content-store-eu-west/content/pii:S1872206723645334/HEAD-ONLY/image/jpeg/abd7abd45b06a8136756b3664ef7e641/fx1_lrg.jpg fx1 true fx1_lrg.jpg jpg 117108 651 746 IMAGE-HIGH-RES 1-s2.0-S1872206723645334-gr1_lrg.jpg https://s3-eu-west-1.amazonaws.com/prod-ucs-content-store-eu-west/content/pii:S1872206723645334/HIGHRES/image/jpeg/fc090c17de244157909cd6ebfc791925/gr1_lrg.jpg gr1 gr1_lrg.jpg jpg 230778 655 993 IMAGE-HIGH-RES 1-s2.0-S1872206723645334-gr2_lrg.jpg https://s3-eu-west-1.amazonaws.com/prod-ucs-content-store-eu-west/content/pii:S1872206723645334/HIGHRES/image/jpeg/55dc8303900647fe33c1967062b2941d/gr2_lrg.jpg gr2 gr2_lrg.jpg jpg 312685 862 1648 IMAGE-HIGH-RES 1-s2.0-S1872206723645334-gr3_lrg.jpg https://s3-eu-west-1.amazonaws.com/prod-ucs-content-store-eu-west/content/pii:S1872206723645334/HIGHRES/image/jpeg/805641935bad93d4a9740be8efbafdef/gr3_lrg.jpg gr3 gr3_lrg.jpg jpg 213783 839 1636 IMAGE-HIGH-RES 1-s2.0-S1872206723645334-gr4_lrg.jpg https://s3-eu-west-1.amazonaws.com/prod-ucs-content-store-eu-west/content/pii:S1872206723645334/HIGHRES/image/jpeg/42fc94e0c2447136a4582a8e2a342883/gr4_lrg.jpg gr4 gr4_lrg.jpg jpg 430749 1024 1250 IMAGE-HIGH-RES 1-s2.0-S1872206723645334-gr5_lrg.jpg https://s3-eu-west-1.amazonaws.com/prod-ucs-content-store-eu-west/content/pii:S1872206723645334/HIGHRES/image/jpeg/0147d6369bab80b4e88033906aa14622/gr5_lrg.jpg gr5 gr5_lrg.jpg jpg 68382 378 992 IMAGE-HIGH-RES 1-s2.0-S1872206723645334-mmc1.pdf https://s3-eu-west-1.amazonaws.com/prod-ucs-content-store-eu-west/content/pii:S1872206723645334/mmc1/FP/application/pdf/fb320eb73a3c6c4dcc2b8345b5f1c668/mmc1.pdf mmc1 mmc1.pdf pdf false 3133417 APPLICATION CHNJC 64533 S1872-2067(23)64533-4 10.1016/S1872-2067(23)64533-4 Dalian Institute of Chemical Physics, the Chinese Academy of Sciences Fig. 1 (a–c) TEM images of Ni-CoS/NC. (d) HAADF STEM image and EELS maps of Ni-CoS/NC. (e) XRD patterns of CoS/NC, Ni-CoS/NC, and NiS/NC (Insert are the enlarged diffraction peaks of the (100) plane). Fig. 2 Co 2p 3/2 and Ni 2p 3/2 peaks (a), S 2p peaks (b), Co 2p peaks (c) and fitting results, Ni 2p peaks (d) and fitting results. (e) Ratio of the metal valence states (M3+ and M2+) of CoS/NC and Ni-CoS/NC extracted from XPS results. (f) S 2p peaks and fitting results. Fig. 3 Cyclic voltammograms (a), overpotentials (b) at 10 mA cm−1, Tafel plots (c) of different catalysts. (d) Nyquist plots and fitting results at an applied potential of 1.53 V vs. RHE (Inset is the equivalent circuit, R s: resistance of electrolyte, R ct: charge transfer resistance, CPE: constant phase element). (e) C dl values. (f) Stability test of Ni-CoS/NC at 50 mA cm−2. Fig. 4 XRD patterns (a), S 2p peaks (b), and Co 2p 3/2 peaks (c) of Ni-CoS/NC before and after OER. (d) HAADF STEM image and corresponding EELS compositional maps obtained on the Ni-CoS/NC sample after OER. HRTEM image (e) of Ni-CoS/NC after OER and its corresponding indexed FFT patterns (f,g). Fig. 5 (a) The free energy diagrams of CoOOH and Co x Ni1–x OOH for the adsorption of different intermediates on Co site. (b) The free energy diagrams and structure models of NiOOH and Co x Ni1–x OOH for the adsorption of different intermediates on Ni site. Available online 15 November 2023 This work was supported by the National Natural Science Foundation of China (21975081, 22178126, 22208110, 21776120, 22378270), the Science and Technology Program of Guangzhou (2023A04J1357), the China Postdoctoral Science Foundation (2022M711196), the Open Project of Engineering Research Center of Alternative Energy Materials & Devices, Ministry of Education, Sichuan University (AEMD202204), the Sichuan Science and Technology Program (2022ZYD0016, 2023JDRC0013), the Hohhot Science and Technology Program (2023-JieBangGuaShuai-Gao-3), the Natural Science Foundation of Fujian Province, China (2023J01254), the Research Fund Program of Guangdong Provincial Key Laboratory of Fuel Cell Technology (FC202206, FC202218). Article Metal-organic framework-derived cation regulation of metal sulfides for enhanced oxygen evolution activity Kai Wan a b Jiangshui Luo c * Wenbo Liu a Ting Zhang d Jordi Arbiol d e * Xuan Zhang b Palaniappan Subramanian b Zhiyong Fu a * Jan Fransaer b * a Guangdong Provincial Key Laboratory of Fuel Cell Technology, School of Chemistry and Chemical Engineering, South China University of Technology, Guangzhou 510641, Guangdong, China Guangdong Provincial Key Laboratory of Fuel Cell Technology School of Chemistry and Chemical Engineering South China University of Technology Guangzhou Guangdong 510641 China Guangdong Provincial Key Laboratory of Fuel Cell Technology, School of Chemistry and Chemical Engineering, South China University of Technology, Guangzhou 510641, Guangdong, China b Department of Materials Engineering, KU Leuven, Leuven 3001, Belgium Department of Materials Engineering KU Leuven Leuven 3001 Belgium Department of Materials Engineering, KU Leuven, Leuven 3001, Belgium c Engineering Research Center of Alternative Energy Materials & Devices, Ministry of Education, College of Materials Science and Engineering, Sichuan University, Chengdu 610065, Sichuan, China Engineering Research Center of Alternative Energy Materials & Devices Ministry of Education College of Materials Science and Engineering Sichuan University Chengdu Sichuan 610065 China Engineering Research Center of Alternative Energy Materials & Devices, Ministry of Education, College of Materials Science and Engineering, Sichuan University, Chengdu 610065, Sichuan, China d Catalan Institute of Nanoscience and Nanotechnology (ICN2), CSIC and BIST, Campus UAB, Bellaterra, Barcelona 08193, Catalonia, Spain Catalan Institute of Nanoscience and Nanotechnology (ICN2) CSIC and BIST Campus UAB Bellaterra Barcelona Catalonia 08193 Spain Catalan Institute of Nanoscience and Nanotechnology (ICN2), CSIC and BIST, Campus UAB, Bellaterra, Barcelona 08193, Catalonia, Spain e ICREA, Pg. Lluís Companys 23, Barcelona08010, Catalonia, Spain ICREA Pg. Lluís Companys 23 Barcelona Catalonia 08010 Spain ICREA, Pg. Lluís Companys 23, Barcelona08010, Catalonia, Spain * Corresponding author Heteroatom doping serves as an important strategy to improve the oxygen evolution reaction (OER) activity of transition-metal compounds, while the investigation of intrinsic active sites and mechanisms remains insufficient. In this work, a facile cation regulation strategy is reported to boost the OER activity of metal sulfides via pyrolysis of the Ni-Co bimetallic metal-organic framework. The obtained Ni-substituted CoS nanoparticles on nitrogen-doped mesoporous carbon (Ni-CoS/NC) catalyst achieves a current density of 10 mA cm−2 at a small overpotential of 270 mV with a Tafel slope of 37 mV dec−1 in 1.0 mol L−1 KOH. Through a combination of spectroscopy study and theoretical computations, the activity origin is revealed at the atomic level. The Co x Ni1–x OOH serves as the real active site for the OER generated by the Ni-CoS/NC reconstruction under oxidation potential during OER. The Ni substitution results in a strong electronic interaction between the two metals, thus generating more negatively charged Co atoms and more positively charged Ni atoms in the electrocatalyst. The metal sites with regulated electronic structure exhibit enhanced surface adsorption of OOH* and reduce the OER overpotential. Meanwhile, the conductive porous carbon scaffold facilitates electron transfer, mass diffusion, and the accessibility of active sites. This work not only provides a feasible cation regulation strategy for the design of high-performance electrocatalysts for low-cost energy storage and conversion systems, but also yields fresh insight into the activity enhancement mechanisms and intrinsic active sites. Graphical Abstract Substitution of Co sites in CoOOH by Ni results in more negatively charged Co sites and more positively charged Ni sites, thus promoting the surface adsorption of OOH* and reducing the OER overpotential. Keywords Metal-organic framework Cation regulation Metal sulfide Metal oxyhydroxide Oxygen evolution reaction 1 Introduction The oxygen evolution reaction (OER) is critical for electrochemical energy storage and conversion technologies, including water splitting and metal-air batteries [1–3]. The OER process involves a consecutive four-electron transfer, thus resulting in sluggish kinetics. Usually, a high overpotential is required to drive the reaction, which severely limits energy conversion efficiency and practical catalyst stability. Precious metal-based materials (like IrO2 and RuO2 as the benchmark for OER) are scarce and expensive, which is a barrier to their large-scale application [4–6]. Hence it is highly desirable but challenging to design efficient and durable OER electrocatalysts using low-cost and earth-abundant elements. In the past decades, much effort has been devoted to exploring new low-cost, high-activity, and durable electrocatalysts for OER [7–9]. Among them, iron/cobalt/nickel-based oxides, hydroxides, chalcogenides, and phosphides are considered as promising candidates due to their relatively superior activity and stability [10–13]. However, the state-of-the-art electrocatalytic performance of these electrocatalysts still does not meet the required electrocatalytic performance needed for practical applications due to: (1) limited intrinsic activity, (2) a low density of active sites, and (3) poor electrical conductivity. Therefore, it is plausible to develop effective strategies to boost the OER performance by addressing the above-mentioned issues. It has been reported that the electrocatalytic activity of OER depends on the Gibbs free adsorption energies of OER intermediates (HO*, O*, and HOO*) on the surface of active sites, among which the formation of HOO* is typically the rate-determining step (RDS) [14–16]. To achieve higher electrocatalytic performance, multi-metal components have been introduced into the electrocatalyst to modulate the OER electrocatalytic activity [17,18]. The theoretical calculation and in-depth characterization of the multi-metal materials demonstrated that the strong electronic interaction between different metal species can contribute to enhanced electrocatalytic activity compared to single-metal counterparts [19–21]. Durrant and co-workers [22] investigated the doping effects of Mn, Co, Fe, and Zn in nickel oxides on the intrinsic activity of OER. It is found that the oxygen binding energetics are decreased from Mn- < Co- < Fe-< Zn-doped samples, which significantly affects the OER kinetics. However, most of the previous works focus on the doping effect on the main component, while the electrocatalytic activity changes of the doped metals are usually ignored. It should be noted that the doped metals are also an active component of the OER [23], which may yield a significant effect on the OER performance. In addition to metal compositions, the nanostructure of electrocatalysts also influences the electrochemical performance [24]. Hybridizing transition metal components with porous carbon is an effective approach to enhance the OER activity owing to abundant active sites and improved electrical conductivity [25–28]. To this end, it is highly desirable and challenging to develop hybrid electrocatalysts with multi-metal components to boost the OER performance and clarify the effect of each metal component on the enhancement of the OER activity. In line with the above understanding, an effective cation regulation strategy is proposed to tailor the electronic structure of multi-metal components for enhanced OER activity. The partial substitution of cobalt sites by nickel in CoS nanoparticles on nitrogen-doped mesoporous carbon (Ni-CoS/NC) is achieved by pyrolysis of bimetallic CoNi-based metal-organic framework (CoNi-MOF). MOFs with tunable metal sites and structures are interesting self-sacrificial templates for the synthesis of hybrid electrocatalysts. Electrochemical results confirm that the Ni-CoS/NC displays an improved OER electrocatalytic activity than the CoS/NC and NiS/NC in 1.0 mol L−1 KOH. The superior electrocatalytic activity is attributed to the high density of metal sites exposed on the surface and the regulated electronic structure due to the partial cation substitution. Spectroscopy characterization and theoretical calculations reveal that the Ni-substituted CoS undergoes a reconstruction to form amorphous Co x Ni1–x OOH during the OER, which serves as the real active site of the OER. The Ni substitution rendered more negatively charged Co atoms and more positively charged Ni atoms, thereby improving the adsorption of OOH* on the metal sites and decreasing the overpotential for OER. 2 Experimental 2.1 Catalyst preparation The bimetallic M(HBTC)(4,4′-bipy)·3DMF (M = Co and Ni) MOF was synthesized based on previous work [29]. For the CoNi-MOF, 2.910 g Co(NO3)2·6H2O, 0.582 g Ni(NO3)2·6H2O, 0.844 g trimesic acid (H3BTC), and 0.768 g 4,4-bipyridyl were dissolved in 80 mL N,N-dimethylformamide (DMF); then, the above solution was heated to 50 °C and kept for 72 h; finally, the obtained product was washed with DMF and ethanol, and dried at 60 °C overnight. The Co-MOF and Ni-MOF were prepared by the use of only one metal salt. The Ni-CoS/NC was synthesized through a high-temperature pyrolysis process. Typically, 0.72 g CoNi-MOF was ground with 1.92 g sulfur powder. Then, the mixture was pyrolyzed at 700 °C for 2 h in argon to obtain the Ni-CoS/NC. The CoS/NC and NiS/NC were obtained by the same procedure but using Co-MOF or Ni-MOF precursors. 2.2 Physicochemical characterizations X-ray diffraction (XRD) was performed on a Bruker AXS D8 diffractometer (Cu Kα radiation, λ = 0.15405 nm) with 2θ ranging from 5° to 80° (step size: 0.02°) at 40 kV. X-ray photoelectron spectroscopy (XPS) was collected with a PHI quantum-2000. Scanning electron microscopy (SEM, FEI Nova NanoSEM 450) was employed to observe the morphologies and microstructures. Transmission electron microscopy (TEM) and scanning transmission electron microscopy (STEM) were performed on an FEI Tecnai F20 field emission gun microscope (200 kV with a point-to-point resolution of 0.19 nm). Inductively coupled plasma optical emission spectroscopy (ICP-OES, Varian 720-ES) was used to determine the metal content. Nitrogen adsorption/desorption isotherms at 77 K (Micromeritics ASAP 2020, US) were used to investigate the pore structure of the samples. Before measuring, the samples were degassed at 100 °C for 12 h. The specific surface area was determined using the Brunauer-Emmett-Teller (BET) model, while the pore size distribution was analyzed using the Barrett-Joyner-Halenda (BJH) method. 2.3 Electrochemical measurements A BioLogic SP-200 Potentiostatic Electrochemical Workstation was used to characterize the electrochemical properties at room temperature (25 °C). 100 μL catalyst ink coated on carbon paper (1.0 cm × 0.5 cm, Toray 90) and dried at room temperature was used as the working electrode (catalyst loading: 1.0 mg cm−2). The catalyst ink was prepared by dispersing 5.0 mg catalyst in the mixed solution of 460 μL ethanol and 40 μL 5 wt% Nafion (Nafion® DE 520, Sigma-Aldrich) and sonicated for 30 min. To evaluate the electrocatalytic OER activity, the cyclic voltammetry (CV) was conducted in O2-saturated 1.0 mol L−1 KOH from 0.91 and 1.78 V vs. RHE at 10 mV s−1. The electrochemical impedance spectroscopy (EIS) was recorded in a frequency range from 100 kHz to 0.1 Hz with an amplitude of 5 mV (peak-to-peak) at an applied potential of 1.53 V vs. RHE. The electrical double-layer capacitance (C dl) was used to determine the electrochemical active surface area (ECSA). The CV was tested in the non-Faradaic range of 0.805 to 0.905 V vs. RHE at scan rates from 80 to 260 mV s−1. The C dl was extracted from the slope of the plot of half current densities versus scan rates at the electrode potential of 0.855 V vs. RHE. 2.4 Computational details The density functional theory (DFT) calculations were performed in the CP2K Quickstep code [30]. The Gaussian-type basis set was used to represent the Kohn-Sham orbitals and the plane-wave basis set was used to reexpand electron density in reciprocal space. The nonlocal exchange and correlation energies were described using the Perdew-Burke-Ernzerhof (PBE) functional [31]. To correct the dispersion energy, the Grimme D3 correction has been applied in all calculations [32]. 3 Results and discussion The Ni-CoS/NC sample is synthesized by a facile pyrolysis process. First, the CoNi-MOF was prepared by a solvothermal reaction between metal salts and organic linkers in DMF at 50 °C. SEM images and energy dispersive spectroscopy (EDS) mappings show that the CoNi-MOF exhibits a morphology of hexagon platelets with an uniform distribution of Co and Ni (Fig. S1). The CoNi-MOF exhibits the same XRD pattern as the mono-metal Co-MOF and its simulated pattern (Fig. S2). During the pyrolysis of CoNi-MOF and sulfur powders at 700 °C under argon, the sulfur atoms diffuse to and react with metal sites to form metal sulfides. Meanwhile, the ligands in MOF are converted into nitrogen-doped carbon, which serves as a scaffold to disperse and anchor the metal sulfides. The control samples (NiS/NC and CoS/NC) are also prepared by the same procedure except for the use of only one metal salt (Figs. S3 and S4). The nanostructure of the as-obtained Ni-CoS/NC is characterized by transmission electron microscopy (TEM). As shown in Figs. 1(a) and (b) , the Ni-CoS/NC sample consists of closely stacked irregular nanoparticles on a carbon scaffold. Meanwhile, there are some sheet-like nanostructures around these nanoparticles (Fig. 1(c)). The carbon layer prevents the aggregation of the sulfide nanoparticles at a high temperature and provides a conductive framework to connect these electrocatalytic active sites. The high-angle annular dark-field scanning transmission electron microscopy (HAADF-STEM) image in Fig. 1(d) shows that the nanoparticles exhibit a size below 20 nm. Electron energy loss spectroscopy (EELS) maps identify the existence of Co, Ni, S, N, O, and C in this sample (Fig. 1(d), and Fig. S5). The distribution of Co, Ni, and S nearly overlap with each other, suggesting uniform sulfurization and Ni-substitution. XRD is employed to reveal the crystal structure of the metal sulfides. The diffraction peaks at 2θ of 30.5°, 35.1°, 46.9°, and 54.2° correspond to the (100), (101), (102), and (110) planes of CoS, respectively (Fig. S4(b)). The diffraction peaks at 2θ of 29.9°, 33.5°, 34.4°, 45.5°, 53.2°, and 72.6° are assigned to the (100), (002), (101), (102), (110), and (202) planes of NiS, respectively (Fig. S4(c)). As compared in Fig. 1(e), the Ni-CoS/NC displays nearly the same diffraction peaks as CoS/NC with a tiny shift to lower angles. This reveals the distortion of the CoS lattice due to the partial substitution of Co cations by larger Ni cations [33–35]. The cobalt and/or nickel content of all samples lies between 36 wt% and 44 wt% as measured by ICP-OES (Fig. S6). The molar ratio of Co to Ni in Ni-CoS/NC is 3.06 to 1. N2 adsorption/desorption results reveal that both CoS/NC and Ni-CoS/NC exhibit type-IV isotherms, indicating their mesoporous structure (Fig. S7(a)) [36,37]. After Ni substitution, the specific surface area decreases from 121 m2 g−1 of CoS/NC to 107 m2 g−1 of Ni-CoS/NC, which is probably due to the increase in metal content. The Ni-CoS/NC displays a broader pore size distribution compared to CoS/NC with larger mesopores (Fig. S7(b)). The surface elemental composition and valence states of Ni-CoS/NC are investigated by XPS. The XPS survey spectrum shows that C, N, O, S, Co, and Ni are present in Ni-CoS/NC (Fig. S8 and Table S1). The oxygen probably originates from the surface oxidation of the metal sulfide and nitrogen-oxide species of the nitrogen-doped carbon [38]. The Co 2p 3/2 for Ni-CoS/NC shows a negative shift to lower binding energy than CoS/NC, while Ni 2p 3/2 for Ni-CoS/NC shows a positive shift to higher binding energy than NiS/NC (Fig. 2 (a)). Moreover, the binding energy of S 2p peaks is constant after Ni substitution (Fig. 2(b)), which is in contrast to a previous report [39]. These results reveal that there is a strong electronic interaction between Co and Ni, which highlights the crucial role of cation sites in varied electrocatalytic activity. Further deconvolution and interpretation of the Co 2p and Ni 2p XPS spectra provide more quantitative information on the change in valence states (Figs. 2(c)–(e) and Fig. S9). For the Co 2p 3/2 spectrum, the peaks at 778.5, 781.3, and 784.4 eV are assigned to Co3+, Co2+, and satellite peaks (referred to as “Sat.” in the figure) [40]. The peaks at 853.0, 855.7, and 861.4 eV were attributed to Ni2+, Ni3+, and satellite peaks of Ni 2p 3/2 [41]. As summarized in Fig. 2(c), the proportion of the high-valence species for Ni-CoS/NC increased from 38% to 56% after Ni substitution. The change of valence states is attributed to the altered local electron distribution derived from moderate Ni substitution, which will benefit the adsorption of reaction intermediates and ultimately lead to higher OER activity [42–44]. For the S 2p spectrum, the peaks at 163.9, 165.1, and 168.7 eV were attributed to S 2p 3/2, S 2p 3/1, and SO4 2– (Fig. 2(f) and Fig. S12) [45,46]. The peak at 161.9 eV was assigned to S-H [47]. The electrocatalytic OER activities of the catalysts are evaluated in 1.0 mol L−1 KOH. The Ni/Co metal ratios and pyrolysis temperatures are first. It is seen that the electrocatalyst with a Ni/Co metal ratio of 1:3 and pyrolyzed at 700 °C exhibits the best OER performance (Figs. S11 and S12). As expected, Ni-CoS/NC exhibits the highest OER electrocatalytic activity (Fig. 3 (a)). The Ni-CoS/NC material reaches a current density of 10 mA cm−2 at an overpotential (η) of 270 mV, which is smaller than that of CoS/NC (308 mV) and NiS/NC (322 mV) (Fig. 3(b)). A large current density of 50 and 100 mA cm−2 can be achieved at η of 320 and 350 mV, respectively, rendering the Ni-CoS/NC material one of the best transition metal-based OER electrocatalysts (Table S2), which also highlights the crucial role of cation sites on varied electrocatalytic activity. The Tafel slopes of the catalysts are calculated to study the OER kinetics (Fig. 3(c)). Ni-CoS/NC has a Tafel slope of 37 mV dec−1, which is much smaller than that of CoS/NC (48 mV dec−1) and NiS/NC (72 mV dec−1). Furthermore, EIS and the ECSA are measured. As shown in Fig. 3(d), Ni-CoS/NC exhibits a smaller charge transfer resistance (R ct) of 4.7 Ω than that of CoS/NC (9.2 Ω) and NiS/NC (22.1 Ω). This further confirms that Ni substitution enhances the charge transfer property of the Ni-CoS/NC catalyst, which may be attributed to the increased intrinsic activity. The electrical double-layer capacitance (C dl) is usually used to evaluate the ECSA of the materials, which can be extracted from the slope of current densities versus scan rates (Fig. 3(e); Fig. S13). The C dl of Ni-CoS/NC is near twice that of CoS/NC and NiS/NC, implying that more exposed active sites can be facilely accessed by the electrolyte. To exclude the effect of metal content and ECSA on the OER performance, the OER currents are further normalized to the mass of metals and C dl. It is seen that the OER performances show the same trends as the results in Fig. 3(a), which indicates that the metal content does not affect the electrocatalytic activity (Fig. S14). Finally, the stability of the Ni-CoS/NC catalysts is tested with chronopotentiometric, and potential cycling methods (Fig. 3(f), and Fig. S15). The Ni-CoS/NC catalyst shows excellent stability without any obvious degradation after 300 h at 50 mA cm−2 (Fig. 3(f)). It has been reported in previous work that the transition metal chalcogenides are not thermodynamically stable and can be partially or fully oxidized to the corresponding metal hydroxides or oxyhydroxides under oxidation potential in alkaline media [48–51]. To reveal the real active site of the OER, the Ni-CoS/NC catalyst is characterized after a stability test (Fig. 4 ). It is found that the diffraction peaks of Ni-CoS/NC disappeared from the XRD pattern and without any new diffraction peaks detected, suggesting the reconstruction of the catalyst during OER (Fig. 4(a)). There is no obvious S 2p XPS spectrum was detected after the OER, indicating the loss of sulfur from Ni-CoS/NC (Fig. 4(b)). It is seen that the binding energy of Co 2p 3/2 peak is located at 779.9 eV after the stability test, which correspond to the cobalt oxide/oxyhydroxide (Fig. 4(c)) [52–54]. The EELS maps further confirm the above-mentioned results. It is seen that there is a matrix composed of C and O that surrounds smaller nanostructures containing Ni and Co (Fig. 4(d)), indicating the possible formation of metal oxide/oxyhydroxides. And no signal of S was detected further confirming the loss of S after the stability test. The nanocrystal structure is further characterized by the high-resolution TEM (HRTEM) and its corresponding Fast Fourier transform (FFT) patterns. The magnified detail of the orange squared region in Fig. 4(e) and its corresponding FFT patterns are shown in Figs. 4(f) and (g). It is seen that the same selected region is in agreement with different possible crystal structures, including CoO(OH) (P63/mmc), NiO(OH) (P3m1), NiO(OH) (C1m1), and NiO(OH) (C12m1). Taking into account the EELS maps, FFT patterns, XPS spectra, and XRD patterns, the most probable structure would be amorphous Co x Ni1–x OOH. The amorphous Co x Ni1–x OOH electrocatalyst may exhibit abundant active sites and increased intrinsic activity due to its disordered structure [55,56]. To better understand the origin of the improved electrocatalytic performances after Ni substitution, DFT calculations are performed based on the four-electron pathway mechanism (Details in Supplemental material). The (100) surface of CoOOH, Ni-CoOOH, and NiOOH are allowed to adsorb the OER intermediates (O*, OH*, and OOH*) due to the lowest specific surface energy among all considered surfaces. All Ni–Co arrangements in a 2 × 2 × 1 supercell are considered in the Ni-substituted CoOOH models (Ni:Co = 1:3). The adsorption Gibbs free energy changes (ΔG) of each OER step at given potentials are shown in Fig. 5 . The step with the largest ΔG value is considered as the RDS. The adsorption of OOH* species, which prefers the bridge site of two Co atoms, is revealed to be the RDS step for the CoOOH, Co x Ni1–x OOH, and NiOOH models (Fig. 5 and Figs. S16-S18). For the formation of OOH* at the OER equilibrium potential (1.23 V vs. RHE), the energy barriers on Co site is 1.44 eV for CoOOH and 1.22 eV for Co x Ni1–x OOH (Fig. 5(a)), while the energy barriers on Ni site is 1.50 eV for NiOOH and 0.74 eV for Co x Ni1–x OOH (Fig. 5(b)). The reduced energy barrier on Ni-substituted CoOOH is ascribed to the enhanced interaction between OOH* and metal atoms. The Co atoms can withdraw electrons from the adjacent Ni atoms, which results in more negatively charged Co atoms and more positively charged Ni atoms (Fig. S19). These results confirm that Ni substitution can alter the electronic structure of the adjacent Co sites and itself, thus promoting the adsorption of OOH*, and reducing the OER overpotential, which is consistent with the experimental results. 4 Conclusions In summary, a MOF-derived cation regulation strategy was demonstrated to enhance the OER activity of metal sulfides. The pyrolysis of bimetallic MOF precursors generated Ni-substituted CoS nanoparticles on nitrogen-doped mesoporous carbon scaffolds. The Ni-CoS/NC displayed a high activity for OER with an overpotential of 270, 320, and 350 mV at 10, 50, and 100 mA cm−2, respectively, as well as outstanding stability for 300 hours. Post-OER characterizations of the electrocatalysts confirmed that the active sites are amorphous Co x Ni1-x OOH., which are generated from Ni-substituted CoS by electrochemical oxidation during the OER. The Co atoms can withdraw electrons from the adjacent Ni atoms thus optimizing intermediate adsorption-free energy on the metal sites to promote the OER activity. This work provides a new cation substitution strategy and improved mechanistic understanding of cation substitution of transition-metal compounds, which could lead to highly active and cost-effective electrocatalysts for a wide range of energy storage and conversion applications. Electronic supporting information Supporting information is available in the online version of this article. Acknowledgments This work was jointly supported by the National Natural Science Foundation of China (21975081, 22178126, 22208110, 21776120, 22378270), the Science and Technology Program of Guangzhou (2023A04J1357), the China Postdoctoral Science Foundation (2022M711196), the Open Project of Engineering Research Center of Alternative Energy Materials & Devices, Ministry of Education, Sichuan University (AEMD202204), the Sichuan Science and Technology Program (2022ZYD0016, 2023JDRC0013), Hohhot Science and Technology Program (2023-JieBangGuaShuai-Gao-3), Natural Science Foundation of Fujian Province, China (2023J01254), the Research Fund Program of Guangdong Provincial Key Laboratory of Fuel Cell Technology (FC202206, FC202218). The authors thank support from the project NANOGEN (PID2020-116093RB-C43), funded by MCIN/ AEI/10.13039/501100011033/ and by “ERDF A way of making Europe”, by the “European Union“. ICN2 is supported by the Severo Ochoa program from Spanish MCIN/AEI (CEX2021-001214-S) and is funded by the CERCA Programme/Generalitat de Catalunya, SGR 2021SGR00457. Supplementary Material Supplementary appendix References 1 M. Zubair P. Kumar M. Klingenhof B. Subhash J.A. Yuwono S. Cheong Y. Yao L. Thomsen P. Strasser R.D. Tilley N.M. Bedford ACS Catal. 13 2023 4799 4810 M. Zubair, P. Kumar, M. Klingenhof, B. Subhash, J. A. Yuwono, S. Cheong, Y. Yao, L. Thomsen, P. Strasser, R. D. Tilley, N. M. Bedford, ACS Catal., 2023, 13, 4799–4810. 2 Y. Qian J. Yu Y. Zhang F. Zhang Y. Kang C. Su H. Shi D.J. Kang H. Pang Small Methods 6 2022 2101186 Y. Qian, J. Yu, Y. Zhang, F. Zhang, Y. Kang, C. Su, H. Shi, D. J. Kang, H. Pang, Small Methods, 2022, 6, 2101186. 3 H. Su J. Jiang S. Song B. An N. Li Y. Gao L. Ge Chin. J. Catal. 44 2023 7 49 H. Su, J. Jiang, S. Song, B. An, N. Li, Y. Gao, L. Ge, Chin. J. Catal., 2023, 44, 7–49. 4 L. Zu X. Qian S. Zhao Q. Liang Y.E. Chen M. Liu B.J. Su K.H. Wu L. Qu L. Duan H. Zhan J.Y. Zhang C. Li W. Li J.Y. Juang J. Zhu D. Li A. Yu D. Zhao J. Am. Chem. Soc. 144 2022 2208 2217 L. Zu, X. Qian, S. Zhao, Q. Liang, Y. E. Chen, M. Liu, B. J. Su, K. H. Wu, L. Qu, L. Duan, H. Zhan, J. Y. Zhang, C. Li, W. Li, J. Y. Juang, J. Zhu, D. Li, A. Yu, D. Zhao, J. Am. Chem. Soc., 2022, 144, 2208–2217. 5 H. Over ACS Catal. 11 2021 8848 8871 H. Over, ACS Catal., 2021, 11, 8848–8871. 6 Q. Zhang H. Chen L. Yang X. Liang L. Shi Q. Feng Y. Zou G.D. Li X. Zou Chin. J. Catal. 43 2022 885 893 Q. Zhang, H. Chen, L. Yang, X. Liang, L. Shi, Q. Feng, Y. Zou, G. D. Li, X. Zou, Chin. J. Catal., 2022, 43, 885–893. 7 T.Q. Guo L.D. Li Z.C. Wang Adv. Energy Mater. 12 2022 2200827 T. Q. Guo, L. D. Li, Z. C. Wang, Adv. Energy Mater., 2022, 12, 2200827. 8 R. Zhao S. Xu D. Liu L. Wei S. Yang X. Yan Y. Chen Z. Zhou J. Su L. Guo C. Burda Appl. Catal. B 338 2023 123027 R. Zhao, S. Xu, D. Liu, L. Wei, S. Yang, X. Yan, Y. Chen, Z. Zhou, J. Su, L. Guo, C. Burda, Appl. Catal. B, 2023, 338, 123027. 9 M. Mehdi B.S. An H. Kim S. Lee C. Lee M. Seo M.W. Noh W.C. Cho C.H. Kim C.H. Choi B.H. Kim M. Kim H.S. Cho Adv. Energy Mater. 13 2023 2204403 M. Mehdi, B. S. An, H. Kim, S. Lee, C. Lee, M. Seo, M. W. Noh, W. C. Cho, C. H. Kim, C. H. Choi, B. H. Kim, M. Kim, H. S. Cho, Adv. Energy Mater., 2023, 13, 2204403. 10 R. Gao M. Deng Q. Yan Z. Fang L. Li H. Shen Z. Chen Small Methods 5 2021 2100834 R. Gao, M. Deng, Q. Yan, Z. Fang, L. Li, H. Shen, Z. Chen, Small Methods, 2021, 5, 2100834. 11 S.P. Zeng H. Shi T.Y. Dai Y. Liu Z. Wen G.F. Han T.H. Wang W. Zhang X.Y. Lang W.T. Zheng Q. Jiang Nat. Commun. 14 2023 1811 S. P. Zeng, H. Shi, T. Y. Dai, Y. Liu, Z. Wen, G. F. Han, T. H. Wang, W. Zhang, X. Y. Lang, W. T. Zheng, Q. Jiang, Nat. Commun., 2023, 14, 1811. 12 X. Shu M. Yang M. Liu H. Wang J. Zhang Chin. J. Catal. 43 2022 3107 3115 X. Shu, M. Yang, M. Liu, H. Wang, J. Zhang, Chin. J. Catal., 2022, 43, 3107–3115. 13 W. Zhang J. Qi K. Liu R. Cao Adv. Energy Mater. 6 2016 1502489 W. Zhang, J. Qi, K. Liu, R. Cao, Adv. Energy Mater., 2016, 6, 1502489. 14 J. Rossmeisl Z.W. Qu H. Zhu G.J. Kroes J.K. N⊘rskov J. Electroanal. Chem. 607 2007 83 89 J. Rossmeisl, Z. W. Qu, H. Zhu, G. J. Kroes, J. K. N⊘rskov, J. Electroanal. Chem., 2007, 607, 83–89. 15 X.P. Zhang H.Y. Wang H. Zheng W. Zhang R. Cao Chin. J. Catal. 42 2021 1253 1268 X. P. Zhang, H. Y. Wang, H. Zheng, W. Zhang, R. Cao, Chin. J. Catal., 2021, 42, 1253–1268. 16 X. Li X.P. Zhang M. Guo B. Lv K. Guo X. Jin W. Zhang Y.M. Lee S. Fukuzumi W. Nam R. Cao J. Am. Chem. Soc. 143 2021 14613 14621 X. Li, X. P. Zhang, M. Guo, B. Lv, K. Guo, X. Jin, W. Zhang, Y. M. Lee, S. Fukuzumi, W. Nam, R. Cao, J. Am. Chem. Soc., 2021, 143, 14613–14621. 17 C.X. Zhao B.Q. Li M. Zhao J.N. Liu L.D. Zhao X. Chen Q. Zhang Energy Environ. Sci. 13 2020 1711 1716 C. X. Zhao, B. Q. Li, M. Zhao, J. N. Liu, L. D. Zhao, X. Chen, Q. Zhang, Energy Environ. Sci., 2020, 13, 1711–1716. 18 Y. Qiao Y. Pan J. Zhang B. Wang T. Wu W. Fan Y. Cao R. Mehmood F. Zhang F. Zhang Chin. J. Catal. 43 2022 2354 2362 Y. Qiao, Y. Pan, J. Zhang, B. Wang, T. Wu, W. Fan, Y. Cao, R. Mehmood, F. Zhang, F. Zhang, Chin. J. Catal., 2022, 43, 2354–2362. 19 J. Zhang T. Quast W. He S. Dieckhofer J.R.C. Junqueira D. Ohl P. Wilde D. Jambrec Y.T. Chen W. Schuhmann Adv. Mater. 34 2022 2109108 J. Zhang, T. Quast, W. He, S. Dieckhofer, J. R. C. Junqueira, D. Ohl, P. Wilde, D. Jambrec, Y. T. Chen, W. Schuhmann, Adv. Mater., 2022, 34, 2109108. 20 S. Sanati A. Morsali H. Garcia Energy Environ. Sci. 15 2022 3119 3151 S. Sanati, A. Morsali, H. Garcia, Energy Environ. Sci., 2022, 15, 3119–3151. 21 K.L. Svane J. Rossmeisl Angew. Chem. Int. Ed. 61 2022 e202201146 K. L. Svane, J. Rossmeisl, Angew. Chem. Int. Ed., 2022, 61, e202201146. 22 R.R. Rao S. Corby A. Bucci M. Garcia-Tecedor C.A. Mesa J. Rossmeisl S. Gimenez J. Lloret-Fillol I.E.L. Stephens J.R. Durrant J. Am. Chem. Soc. 144 2022 7622 7633 R. R. Rao, S. Corby, A. Bucci, M. Garcia-Tecedor, C. A. Mesa, J. Rossmeisl, S. Gimenez, J. Lloret-Fillol, I. E. L. Stephens, J. R. Durrant, J. Am. Chem. Soc., 2022, 144, 7622–7633. 23 S.Y. Lee H.J. Oh M. Kim H.S. Cho Y.K. Lee Appl. Catal. B 324 2023 122269 S. Y. Lee, H. J. Oh, M. Kim, H. S. Cho, Y. K. Lee, Appl. Catal. B, 2023, 324, 122269. 24 W. Jiang A.Y. Faid B.F. Gomes I. Galkina L. Xia C.M.S. Lobo M. Desmau P. Borowski H. Hartmann A. Maljusch A. Besmehn C. Roth S. Sunde W. Lehnert M. Shviro Adv. Funct. Mater. 32 2022 2203520 W. Jiang, A. Y. Faid, B. F. Gomes, I. Galkina, L. Xia, C. M. S. Lobo, M. Desmau, P. Borowski, H. Hartmann, A. Maljusch, A. Besmehn, C. Roth, S. Sunde, W. Lehnert, M. Shviro, Adv. Funct. Mater., 2022, 32, 2203520. 25 W. Zhang C.H. Xu H. Zheng R. Li K. Zhou Adv. Funct. Mater. 32 2022 2200763 W. Zhang, C. H. Xu, H. Zheng, R. Li, K. Zhou, Adv. Funct. Mater., 2022, 32, 2200763. 26 K. Wan J.S. Luo X. Zhang C. Zhou J.W. Seo P. Subramanian J.W. Yan J. Fransaer J. Mater. Chem. A 7 2019 19889 19897 K. Wan, J. S. Luo, X. Zhang, C. Zhou, J. W. Seo, P. Subramanian, J. W. Yan, J. Fransaer, J. Mater. Chem. A, 2019, 7, 19889–19897. 27 C. Tang M.M. Titirici Q. Zhang J. Energy Chem. 26 2017 1077 1093 C. Tang, M. M. Titirici, Q. Zhang, J. Energy Chem., 2017, 26, 1077–1093. 28 Y. Zhao X.F. Lu Z.P. Wu Z. Pei D. Luan X.W.D. Lou Adv. Mater. 35 2023 2207888 Y. Zhao, X. F. Lu, Z. P. Wu, Z. Pei, D. Luan, X. W. D. Lou, Adv. Mater., 2023, 35, 2207888. 29 Y. Li L. Xie Y. Liu R. Yang X. Li Inorg. Chem. 47 2008 10372 10377 Y. Li, L. Xie, Y. Liu, R. Yang, X. Li, Inorg. Chem., 2008, 47, 10372–10377. 30 M.I.J. Hutter F. Schiffmann J. Vandevondele WIREs Comput. Mol. Sci. 4 2014 15 25 M. I. J. Hutter, F. Schiffmann, J. Vandevondele, WIREs Comput. Mol. Sci., 2014, 4, 15–25. 31 J.P. Perdew K. Burke M. Ernzerhof Phys. Rev. Lett. 77 1996 3865 3868 J. P. Perdew, K. Burke, M. Ernzerhof, Phys. Rev. Lett., 1996, 77, 3865–3868. 32 J.A.S. Grimme S. Ehrlich H. Krieg J. Chem. Phys. 132 2010 154104 J. A. S. Grimme, S. Ehrlich, H. Krieg, J. Chem. Phys., 2010, 132, 154104. 33 R.D. Shannon Acta Crystallogr. Sect. A 32 1976 751 767 R. D. Shannon, Acta Crystallogr. Sect. A, 1976, 32, 751–767. 34 T. Wu S. Sun J. Song S. Xi Y. Du B. Chen W.A. Sasangka H. Liao C.L. Gan G.G. Scherer L. Zeng H. Wang H. Li A. Grimaud Z.J. Xu Nat. Catal. 2 2019 763 772 T. Wu, S. Sun, J. Song, S. Xi, Y. Du, B. Chen, W. A. Sasangka, H. Liao, C. L. Gan, G. G. Scherer, L. Zeng, H. Wang, H. Li, A. Grimaud, Z. J. Xu, Nat. Catal., 2019, 2, 763–772. 35 K. Zhang M. Park L.M. Zhou G.H. Lee J. Shin Z. Hu S.L. Chou J. Chen Y.M. Kang Angew. Chem. Int. Ed. 55 2016 12822 12826 K. Zhang, M. Park, L. M. Zhou, G. H. Lee, J. Shin, Z. Hu, S. L. Chou, J. Chen, Y. M. Kang, Angew. Chem. Int. Ed., 2016, 55, 12822–12826. 36 A.D. Tan Y.F. Wang Z.Y. Fu P. Tsiakaras Z.X. Liang Appl. Catal. B 218 2017 260 266 A. D. Tan, Y. F. Wang, Z. Y. Fu, P. Tsiakaras, Z. X. Liang, Appl. Catal. B, 2017, 218, 260–266. 37 K. Wan G.F. Long M.Y. Liu L. Du Z.X. Liang P. Tsiakaras Appl. Catal. B 165 2015 566 571 K. Wan, G. F. Long, M. Y. Liu, L. Du, Z. X. Liang, P. Tsiakaras, Appl. Catal. B, 2015, 165, 566–571. 38 G.F. Long X.H. Li K. Wan Z.X. Liang J.H. Piao P. Tsiakaras Appl. Catal. B 203 2017 541 548 G. F. Long, X. H. Li, K. Wan, Z. X. Liang, J. H. Piao, P. Tsiakaras, Appl. Catal. B, 2017, 203, 541–548. 39 J. Yu G. Cheng W. Luo J. Mater. Chem. A 5 2017 15838 15844 J. Yu, G. Cheng, W. Luo, J. Mater. Chem. A, 2017, 5, 15838–15844. 40 Y. Liu J. Zhang Y. Li G. Yuan X. Niu X. Zhang Q. Wang ChemElectroChem 5 2018 1167 1172 Y. Liu, J. Zhang, Y. Li, G. Yuan, X. Niu, X. Zhang, Q. Wang, ChemElectroChem, 2018, 5, 1167–1172. 41 K. Wan J. Luo C. Zhou T. Zhang J. Arbiol X. Lu B.W. Mao X. Zhang J. Fransaer Adv. Funct. Mater. 29 2019 1900315 K. Wan, J. Luo, C. Zhou, T. Zhang, J. Arbiol, X. Lu, B. W. Mao, X. Zhang, J. Fransaer, Adv. Funct. Mater., 2019, 29, 1900315. 42 B. Zhang X. Zheng O. Voznyy R. Comin M. Bajdich M. Garcia-Melchor L. Han J. Xu M. Liu L. Zheng F.P. Garcia De Arquer C.T. Dinh F. Fan M. Yuan E. Yassitepe N. Chen T. Regier P. Liu Y. Li P. De Luna A. Janmohamed H.L. Xin H. Yang A. Vojvodic E.H. Sargent Science 352 2016 333 337 B. Zhang, X. Zheng, O. Voznyy, R. Comin, M. Bajdich, M. Garcia-Melchor, L. Han, J. Xu, M. Liu, L. Zheng, F. P. Garcia De Arquer, C. T. Dinh, F. Fan, M. Yuan, E. Yassitepe, N. Chen, T. Regier, P. Liu, Y. Li, P. De Luna, A. Janmohamed, H. L. Xin, H. Yang, A. Vojvodic, E. H. Sargent, Science, 2016, 352, 333–337. 43 H. Wang T. Zhai Y. Wu T. Zhou B. Zhou C. Shang Z. Guo Adv. Sci. 10 2023 2301706 H. Wang, T. Zhai, Y. Wu, T. Zhou, B. Zhou, C. Shang, Z. Guo, Adv. Sci., 2023, 10, 2301706. 44 R. Mehmood W. Fan X. Hu J. Li P. Liu Y. Zhang Z. Zhou J. Wang M. Liu F. Zhang J. Am. Chem. Soc. 145 2023 12206 12213 R. Mehmood, W. Fan, X. Hu, J. Li, P. Liu, Y. Zhang, Z. Zhou, J. Wang, M. Liu, F. Zhang, J. Am. Chem. Soc., 2023, 145, 12206–12213. 45 Y.Z. Su Z.Q. Yao F. Zhang H. Wang Z. Mics E. Canovas M. Bonn X.D. Zhuang X.L. Feng Adv. Funct. Mater. 26 2016 5893 5902 Y. Z. Su, Z. Q. Yao, F. Zhang, H. Wang, Z. Mics, E. Canovas, M. Bonn, X. D. Zhuang, X. L. Feng, Adv. Funct. Mater., 2016, 26, 5893–5902. 46 W. Kong X. Luan H. Du L. Xia F. Qu Chem. Commun. 55 2019 2469 2472 W. Kong, X. Luan, H. Du, L. Xia, F. Qu, Chem. Commun., 2019, 55, 2469–2472. 47 L. Zhang J. Niu M. Li Z. Xia J. Phys. Chem. C 118 2014 3545 3553 L. Zhang, J. Niu, M. Li, Z. Xia, J. Phys. Chem. C, 2014, 118, 3545–3553. 48 D. Li W. Wan Z. Wang H. Wu S. Wu T. Jiang G. Cai C. Jiang F. Ren Adv. Energy Mater. 12 2022 2201913 D. Li, W. Wan, Z. Wang, H. Wu, S. Wu, T. Jiang, G. Cai, C. Jiang, F. Ren, Adv. Energy Mater., 2022, 12, 2201913. 49 N. Zhang Y. Hu L. An Q. Li J. Yin J. Li R. Yang M. Lu S. Zhang P. Xi C.H. Yan Angew. Chem. Int. Ed. 61 2022 e202207217 N. Zhang, Y. Hu, L. An, Q. Li, J. Yin, J. Li, R. Yang, M. Lu, S. Zhang, P. Xi, C. H. Yan, Angew. Chem. Int. Ed., 2022, 61, e202207217. 50 S. Kim H. Mizuno M. Saruyama M. Sakamoto M. Haruta H. Kurata T. Yamada K. Domen T. Teranishi Chem. Sci. 11 2020 1523 1530 S. Kim, H. Mizuno, M. Saruyama, M. Sakamoto, M. Haruta, H. Kurata, T. Yamada, K. Domen, T. Teranishi, Chem. Sci., 2020, 11, 1523–1530. 51 B.R. Wygant K. Kawashima C.B. Mullins ACS Energy Lett. 3 2018 2956 2966 B. R. Wygant, K. Kawashima, C. B. Mullins, ACS Energy Lett., 2018, 3, 2956–2966. 52 G. Zhang G. Wang Y. Liu H. Liu J. Qu J. Li J. Am. Chem. Soc. 138 2016 14686 14693 G. Zhang, G. Wang, Y. Liu, H. Liu, J. Qu, J. Li, J. Am. Chem. Soc., 2016, 138, 14686–14693. 53 D. Li H. Baydoun C.N. Verani S.L. Brock J. Am. Chem. Soc. 138 2016 4006 4009 D. Li, H. Baydoun, C. N. Verani, S. L. Brock, J. Am. Chem. Soc., 2016, 138, 4006–4009. 54 M. Wang C.L. Dong Y.C. Huang Y. Li S. Shen Small 14 2018 1801756 M. Wang, C. L. Dong, Y. C. Huang, Y. Li, S. Shen, Small, 2018, 14, 1801756. 55 C. Guo Y. Shi S. Lu Y. Yu B. Zhang Chin. J. Catal. 42 2021 1287 1296 C. Guo, Y. Shi, S. Lu, Y. Yu, B. Zhang, Chin. J. Catal., 2021, 42, 1287–1296. 56 Y. Xu K. Ren R. Xu Chin. J. Catal. 42 2021 1370 1378 Y. Xu, K. Ren, R. Xu, Chin. J. Catal., 2021, 42, 1370–1378.",
      "scopus-id": "85177854978",
      "coredata": {
        "eid": "1-s2.0-S1872206723645334",
        "dc:description": "Heteroatom doping serves as an important strategy to improve the oxygen evolution reaction (OER) activity of transition-metal compounds, while the investigation of intrinsic active sites and mechanisms remains insufficient. In this work, a facile cation regulation strategy is reported to boost the OER activity of metal sulfides via pyrolysis of the Ni-Co bimetallic metal-organic framework. The obtained Ni-substituted CoS nanoparticles on nitrogen-doped mesoporous carbon (Ni-CoS/NC) catalyst achieves a current density of 10 mA cm−2 at a small overpotential of 270 mV with a Tafel slope of 37 mV dec−1 in 1.0 mol L−1 KOH. Through a combination of spectroscopy study and theoretical computations, the activity origin is revealed at the atomic level. The Co x Ni1–x OOH serves as the real active site for the OER generated by the Ni-CoS/NC reconstruction under oxidation potential during OER. The Ni substitution results in a strong electronic interaction between the two metals, thus generating more negatively charged Co atoms and more positively charged Ni atoms in the electrocatalyst. The metal sites with regulated electronic structure exhibit enhanced surface adsorption of OOH* and reduce the OER overpotential. Meanwhile, the conductive porous carbon scaffold facilitates electron transfer, mass diffusion, and the accessibility of active sites. This work not only provides a feasible cation regulation strategy for the design of high-performance electrocatalysts for low-cost energy storage and conversion systems, but also yields fresh insight into the activity enhancement mechanisms and intrinsic active sites.",
        "openArchiveArticle": "false",
        "prism:coverDate": "2023-11-30",
        "openaccessUserLicense": null,
        "prism:aggregationType": "Journal",
        "prism:url": "https://api.elsevier.com/content/article/pii/S1872206723645334",
        "dc:creator": [
          {
            "@_fa": "true",
            "$": "Wan, Kai"
          },
          {
            "@_fa": "true",
            "$": "Luo, Jiangshui"
          },
          {
            "@_fa": "true",
            "$": "Liu, Wenbo"
          },
          {
            "@_fa": "true",
            "$": "Zhang, Ting"
          },
          {
            "@_fa": "true",
            "$": "Arbiol, Jordi"
          },
          {
            "@_fa": "true",
            "$": "Zhang, Xuan"
          },
          {
            "@_fa": "true",
            "$": "Subramanian, Palaniappan"
          },
          {
            "@_fa": "true",
            "$": "Fu, Zhiyong"
          },
          {
            "@_fa": "true",
            "$": "Fransaer, Jan"
          }
        ],
        "link": [
          {
            "@_fa": "true",
            "@rel": "self",
            "@href": "https://api.elsevier.com/content/article/pii/S1872206723645334"
          },
          {
            "@_fa": "true",
            "@rel": "scidir",
            "@href": "https://www.sciencedirect.com/science/article/pii/S1872206723645334"
          }
        ],
        "dc:format": "application/json",
        "openaccessType": null,
        "pii": "S1872-2067(23)64533-4",
        "prism:volume": "54",
        "prism:publisher": "Dalian Institute of Chemical Physics, the Chinese Academy of Sciences. Published by Elsevier B.V.",
        "dc:title": "Metal-organic framework-derived cation regulation of metal sulfides for enhanced oxygen evolution activity",
        "prism:copyright": "Copyright © 2023 Dalian Institute of Chemical Physics, the Chinese Academy of Sciences. Published by Elsevier B.V. All rights reserved.",
        "openaccess": "0",
        "prism:issn": "18722067",
        "dcterms:subject": [
          {
            "@_fa": "true",
            "$": "Metal-organic framework"
          },
          {
            "@_fa": "true",
            "$": "Cation regulation"
          },
          {
            "@_fa": "true",
            "$": "Metal sulfide"
          },
          {
            "@_fa": "true",
            "$": "Metal oxyhydroxide"
          },
          {
            "@_fa": "true",
            "$": "Oxygen evolution reaction"
          }
        ],
        "openaccessArticle": "false",
        "prism:publicationName": "Chinese Journal of Catalysis",
        "openaccessSponsorType": null,
        "prism:pageRange": "290-297",
        "prism:endingPage": "297",
        "pubType": "fla",
        "prism:coverDisplayDate": "November 2023",
        "prism:doi": "10.1016/S1872-2067(23)64533-4",
        "prism:startingPage": "290",
        "dc:identifier": "doi:10.1016/S1872-2067(23)64533-4",
        "openaccessSponsorName": null
      },
      "objects": {
        "object": [
          {
            "@category": "standard",
            "@height": "244",
            "@width": "280",
            "@_fa": "true",
            "$": "https://api.elsevier.com/content/object/eid/1-s2.0-S1872206723645334-fx1.jpg?httpAccept=%2A%2F%2A",
            "@multimediatype": "JPEG image file",
            "@type": "IMAGE-DOWNSAMPLED",
            "@size": "27403",
            "@ref": "fx1",
            "@mimetype": "image/jpeg"
          },
          {
            "@category": "standard",
            "@height": "247",
            "@width": "374",
            "@_fa": "true",
            "$": "https://api.elsevier.com/content/object/eid/1-s2.0-S1872206723645334-gr1.jpg?httpAccept=%2A%2F%2A",
            "@multimediatype": "JPEG image file",
            "@type": "IMAGE-DOWNSAMPLED",
            "@size": "39876",
            "@ref": "gr1",
            "@mimetype": "image/jpeg"
          },
          {
            "@category": "standard",
            "@height": "324",
            "@width": "620",
            "@_fa": "true",
            "$": "https://api.elsevier.com/content/object/eid/1-s2.0-S1872206723645334-gr2.jpg?httpAccept=%2A%2F%2A",
            "@multimediatype": "JPEG image file",
            "@type": "IMAGE-DOWNSAMPLED",
            "@size": "66548",
            "@ref": "gr2",
            "@mimetype": "image/jpeg"
          },
          {
            "@category": "standard",
            "@height": "316",
            "@width": "616",
            "@_fa": "true",
            "$": "https://api.elsevier.com/content/object/eid/1-s2.0-S1872206723645334-gr3.jpg?httpAccept=%2A%2F%2A",
            "@multimediatype": "JPEG image file",
            "@type": "IMAGE-DOWNSAMPLED",
            "@size": "53091",
            "@ref": "gr3",
            "@mimetype": "image/jpeg"
          },
          {
            "@category": "standard",
            "@height": "385",
            "@width": "470",
            "@_fa": "true",
            "$": "https://api.elsevier.com/content/object/eid/1-s2.0-S1872206723645334-gr4.jpg?httpAccept=%2A%2F%2A",
            "@multimediatype": "JPEG image file",
            "@type": "IMAGE-DOWNSAMPLED",
            "@size": "76653",
            "@ref": "gr4",
            "@mimetype": "image/jpeg"
          },
          {
            "@category": "standard",
            "@height": "142",
            "@width": "373",
            "@_fa": "true",
            "$": "https://api.elsevier.com/content/object/eid/1-s2.0-S1872206723645334-gr5.jpg?httpAccept=%2A%2F%2A",
            "@multimediatype": "JPEG image file",
            "@type": "IMAGE-DOWNSAMPLED",
            "@size": "18395",
            "@ref": "gr5",
            "@mimetype": "image/jpeg"
          },
          {
            "@category": "thumbnail",
            "@height": "164",
            "@width": "188",
            "@_fa": "true",
            "$": "https://api.elsevier.com/content/object/eid/1-s2.0-S1872206723645334-fx1.sml?httpAccept=%2A%2F%2A",
            "@multimediatype": "GIF image file",
            "@type": "IMAGE-THUMBNAIL",
            "@size": "10044",
            "@ref": "fx1",
            "@mimetype": "image/gif"
          },
          {
            "@category": "thumbnail",
            "@height": "144",
            "@width": "219",
            "@_fa": "true",
            "$": "https://api.elsevier.com/content/object/eid/1-s2.0-S1872206723645334-gr1.sml?httpAccept=%2A%2F%2A",
            "@multimediatype": "GIF image file",
            "@type": "IMAGE-THUMBNAIL",
            "@size": "23070",
            "@ref": "gr1",
            "@mimetype": "image/gif"
          },
          {
            "@category": "thumbnail",
            "@height": "115",
            "@width": "219",
            "@_fa": "true",
            "$": "https://api.elsevier.com/content/object/eid/1-s2.0-S1872206723645334-gr2.sml?httpAccept=%2A%2F%2A",
            "@multimediatype": "GIF image file",
            "@type": "IMAGE-THUMBNAIL",
            "@size": "9526",
            "@ref": "gr2",
            "@mimetype": "image/gif"
          },
          {
            "@category": "thumbnail",
            "@height": "112",
            "@width": "219",
            "@_fa": "true",
            "$": "https://api.elsevier.com/content/object/eid/1-s2.0-S1872206723645334-gr3.sml?httpAccept=%2A%2F%2A",
            "@multimediatype": "GIF image file",
            "@type": "IMAGE-THUMBNAIL",
            "@size": "6989",
            "@ref": "gr3",
            "@mimetype": "image/gif"
          },
          {
            "@category": "thumbnail",
            "@height": "164",
            "@width": "200",
            "@_fa": "true",
            "$": "https://api.elsevier.com/content/object/eid/1-s2.0-S1872206723645334-gr4.sml?httpAccept=%2A%2F%2A",
            "@multimediatype": "GIF image file",
            "@type": "IMAGE-THUMBNAIL",
            "@size": "21385",
            "@ref": "gr4",
            "@mimetype": "image/gif"
          },
          {
            "@category": "thumbnail",
            "@height": "83",
            "@width": "219",
            "@_fa": "true",
            "$": "https://api.elsevier.com/content/object/eid/1-s2.0-S1872206723645334-gr5.sml?httpAccept=%2A%2F%2A",
            "@multimediatype": "GIF image file",
            "@type": "IMAGE-THUMBNAIL",
            "@size": "5470",
            "@ref": "gr5",
            "@mimetype": "image/gif"
          },
          {
            "@category": "high",
            "@height": "651",
            "@width": "746",
            "@_fa": "true",
            "$": "https://api.elsevier.com/content/object/eid/1-s2.0-S1872206723645334-fx1_lrg.jpg?httpAccept=%2A%2F%2A",
            "@multimediatype": "JPEG image file",
            "@type": "IMAGE-HIGH-RES",
            "@size": "117108",
            "@ref": "fx1",
            "@mimetype": "image/jpeg"
          },
          {
            "@category": "high",
            "@height": "655",
            "@width": "993",
            "@_fa": "true",
            "$": "https://api.elsevier.com/content/object/eid/1-s2.0-S1872206723645334-gr1_lrg.jpg?httpAccept=%2A%2F%2A",
            "@multimediatype": "JPEG image file",
            "@type": "IMAGE-HIGH-RES",
            "@size": "230778",
            "@ref": "gr1",
            "@mimetype": "image/jpeg"
          },
          {
            "@category": "high",
            "@height": "862",
            "@width": "1648",
            "@_fa": "true",
            "$": "https://api.elsevier.com/content/object/eid/1-s2.0-S1872206723645334-gr2_lrg.jpg?httpAccept=%2A%2F%2A",
            "@multimediatype": "JPEG image file",
            "@type": "IMAGE-HIGH-RES",
            "@size": "312685",
            "@ref": "gr2",
            "@mimetype": "image/jpeg"
          },
          {
            "@category": "high",
            "@height": "839",
            "@width": "1636",
            "@_fa": "true",
            "$": "https://api.elsevier.com/content/object/eid/1-s2.0-S1872206723645334-gr3_lrg.jpg?httpAccept=%2A%2F%2A",
            "@multimediatype": "JPEG image file",
            "@type": "IMAGE-HIGH-RES",
            "@size": "213783",
            "@ref": "gr3",
            "@mimetype": "image/jpeg"
          },
          {
            "@category": "high",
            "@height": "1024",
            "@width": "1250",
            "@_fa": "true",
            "$": "https://api.elsevier.com/content/object/eid/1-s2.0-S1872206723645334-gr4_lrg.jpg?httpAccept=%2A%2F%2A",
            "@multimediatype": "JPEG image file",
            "@type": "IMAGE-HIGH-RES",
            "@size": "430749",
            "@ref": "gr4",
            "@mimetype": "image/jpeg"
          },
          {
            "@category": "high",
            "@height": "378",
            "@width": "992",
            "@_fa": "true",
            "$": "https://api.elsevier.com/content/object/eid/1-s2.0-S1872206723645334-gr5_lrg.jpg?httpAccept=%2A%2F%2A",
            "@multimediatype": "JPEG image file",
            "@type": "IMAGE-HIGH-RES",
            "@size": "68382",
            "@ref": "gr5",
            "@mimetype": "image/jpeg"
          },
          {
            "@category": "standard",
            "@_fa": "true",
            "$": "https://api.elsevier.com/content/object/eid/1-s2.0-S1872206723645334-mmc1.pdf?httpAccept=%2A%2F%2A",
            "@multimediatype": "Acrobat PDF file",
            "@type": "APPLICATION",
            "@size": "3133417",
            "@ref": "mmc1",
            "@mimetype": "application/pdf"
          }
        ]
      },
      "link": {
        "@rel": "abstract",
        "@href": "https://api.elsevier.com/content/abstract/scopus_id/85177854978"
      }
    }
  }
}