{
  "metadata": {
    "title": "Photo-enhanced Co single-atom catalyst with a staggered <ce:italic>p</ce:italic>-<ce:italic>n</ce:italic> heterojunction: unraveling its high oxygen catalytic performance in zinc-air batteries and fuel cells",
    "authors": "; ; ",
    "journal": "Chinese Journal of Catalysis",
    "date": "2025-06-30",
    "doi": "10.1016/S1872-2067(25)64704-8",
    "abstract": "",
    "uri": "https://api.elsevier.com/content/article/pii/S1872206725647048",
    "pii": "S1872206725647048"
  },
  "fulltext": {
    "full-text-retrieval-response": {
      "scopus-eid": "2-s2.0-105009791647",
      "originalText": "serial JL 273538 291210 291744 291809 31 Chinese Journal of Catalysis CHINESEJOURNALCATALYSIS 2025-07-07 2025-07-07 2025-07-07 2025-07-07 2025-07-07T19:56:23 1-s2.0-S1872206725647048 S1872-2067(25)64704-8 S1872206725647048 10.1016/S1872-2067(25)64704-8 S300 S300.1 FULL-TEXT 1-s2.0-S1872206725X00073 2025-07-10T02:37:31.593231Z 0 0 20250601 20250630 2025 2025-07-07T20:17:41.360213Z absattachment articleinfo articletitlenorm authfirstinitialnorm authfirstsurnamenorm cid cids contenttype copyright crossmark dateloaded dateloadedtxt datesearch datesort dateupdated dco docsubtype doctype doi eid ewtransactionid hubeid indexeddate issn issnnorm itemstage itemtransactionid itemweight openaccess openarchive pg pgfirst pglast pii piinorm pubdateend pubdatestart pubdatetxt pubyr sortorder srctitle srctitlenorm srctype ssids alllist content subj subheadings suppl tomb volfirst volissue volumelist webpdf webpdfpagecount yearnav figure e-component body affil appendices articletitle auth authfirstini authfull authkeywords authlast grantnumber grantsponsor primabst pubtype ref specialabst 1872-2067 18722067 true 73 73 C Volume 73 25 311 321 311 321 202506 June 2025 2025-06-01 2025-06-30 2025 article fla Copyright © 2025 Dalian Institute of Chemical Physics, the Chinese Academy of Sciences. Published by Elsevier B.V. All rights are reserved, including those for text and data mining, AI training, and similar technologies. PHOTOENHANCEDCOSINGLEATOMCATALYSTASTAGGEREDPNHETEROJUNCTIONUNRAVELINGHIGHOXYGENCATALYTICPERFORMANCEINZINCAIRBATTERIESFUELCELLS WANG Z 1 Introduction 2 Experimental 2.1 Materials 2.2 The synthesis of g-C3N4@Co-N/MPC 2.3 Characterization 2.4 Photoelectrochemical performance testing 2.5 Photo enhanced Zn-air battery and fuel cell 3 Results and discussion 3.1 Physical and chemical characterization 3.2 Photo-enhanced ORR/OER electrocatalytic performance 3.3 Photoelectrochemical characterization and band structure analysis 3.4 Photo-enhanced zinc-air battery/fuel cell performance 4 Conclusions Electronic supporting information Supplementary Material References NAZIR 2024 138 G CHEN 2023 233116 S JAMADAR 2024 100283 A QIAO 2023 101398 L LI 2022 100090 J WONG 2025 101001 W PHOGAT 2025 465 485 P WANG 2025 122885 Y WANG 2020 52836 52844 X PAN 2023 100212 S TANG 2023 79 98 X DU 2020 18140 18144 D JIANG 2024 100267 Z ZHANG 2025 300 310 Y HU 2025 311 325 L LU 2023 215400 X YE 2024 2858 2887 C LIU 2022 2075 K ZHANG 2022 2202476 M LIANG 2022 2103097 S ZHAO 2023 216 224 L GAO 2022 832 838 H SONG 2024 38 81 N DONG 2019 8587 8596 F DONG 2024 32 42 X JIANG 2024 126813 P WANG 2020 2131 2139 Y ZHANG 2023 2370280 M ZHU 2024 100245 J ZHOU 2024 1835 1846 B LU 2024 1108 1121 T WANG 2023 2215003 J LUO 2023 18888 18897 X FU 2018 94 102 K WU 2024 178 189 W HU 2024 123737 S ZHOU 2024 1 8 X PARK 2018 140 148 J TIAN 2014 2125 2130 J LIU 2024 8478 8487 Z WU 2022 8531 8539 T XIAO 2024 2405830 K GAN 2021 14284 14292 G FLORESLASLUISA 2024 1381 J NGUYEN 2022 135781 T BINIAK 1997 1799 1810 S LI 2023 2210241 C ZHU 2020 188 195 Y WANG 2020 105128 F LI 2018 15591 15601 X SHI 2014 1484 1486 J RAVEL 2005 537 541 B ZABINSKY 1995 2995 3009 S FUNKE 2005 094110 H LI 2023 1505 1513 Z REISECKER 2023 2432 V HAM 2023 455 462 S CHEN 2018 66 73 Y HANKIN 2014 16176 16186 A HARRISON 2017 11638 S FU 2024 349 359 S ZHONG 2017 011023 Z TIAN 2023 1257 1264 L REN 2022 121096 R REN 2019 289 319 Y LI 2019 7870 7877 H YIN 2022 200021 Z WANGX2025X311 WANGX2025X311X321 WANGX2025X311XZ WANGX2025X311X321XZ 2027-07-07T00:00:00.000Z 2027-07-07T00:00:00.000Z http://creativecommons.org/licenses/by-nc-nd/4.0/ 2025-07-10T02:35:01.168Z http://vtw.elsevier.com/data/voc/AddOnTypes/50.7/aggregated-refined National Natural Science Foundation of China 21972017 NNSF National Natural Science Foundation of China http://data.elsevier.com/vocabulary/SciValFunders/501100001809 http://sws.geonames.org/1814991/ National Key Research and Development Program of China 2022YFE0138900 NKPs National Key Research and Development Program of China http://data.elsevier.com/vocabulary/SciValFunders/501100012166 http://sws.geonames.org/1814991/ Chenguang Program of Shanghai Education the Development Foundation SEDF Shanghai Education Development Foundation http://data.elsevier.com/vocabulary/SciValFunders/501100003024 http://sws.geonames.org/1814991/ Scientific and Technical Innovation Action Plan” Basic Research Field of Shanghai Science and Technology Committee 19JC1410500 Science and Technology Innovation Plan Of Shanghai Science and Technology Commission http://data.elsevier.com/vocabulary/SciValFunders/501100018625 http://sws.geonames.org/1814991/ Shanghai Sailing Program 22YF1400700 Shanghai Lingjun Program http://data.elsevier.com/vocabulary/SciValFunders/100015796 http://sws.geonames.org/1814991/ Shanghai Municipal Education Commission 22CGA37 Shanghai Municipal Education Commission http://data.elsevier.com/vocabulary/SciValFunders/501100003395 http://sws.geonames.org/1814991/ This work was supported by the National Key Research and Development Program of China (2022YFE0138900), the National Natural Science Foundation of China (21972017), the \\u201CScientific and Technical Innovation Action Plan\\u201D Basic Research Field of Shanghai Science and Technology Committee (19JC1410500), the Shanghai Sailing Program (22YF1400700), and the Chenguang Program of Shanghai Education the Development Foundation and Shanghai Municipal Education Commission (22CGA37). item S1872-2067(25)64704-8 S1872206725647048 1-s2.0-S1872206725647048 10.1016/S1872-2067(25)64704-8 273538 2025-07-07T19:17:41.360213Z 2025-06-01 2025-06-30 1-s2.0-S1872206725647048-main.pdf https://s3-eu-west-1.amazonaws.com/prod-ucs-content-store-eu-west/content/pii:S1872206725647048/MAIN/application/pdf/181d0134564d579cdd922b284c1eed63/main.pdf main.pdf pdf true 3335544 MAIN 11 1-s2.0-S1872206725647048-main_1.png https://s3-eu-west-1.amazonaws.com/prod-ucs-content-store-eu-west/content/pii:S1872206725647048/PREVIEW/image/png/52938842e4898bb06847c43c70de6f92/main_1.png main_1.png png 60387 928 656 IMAGE-WEB-PDF 1 1-s2.0-S1872206725647048-fx1.jpg https://s3-eu-west-1.amazonaws.com/prod-ucs-content-store-eu-west/content/pii:S1872206725647048/fx1/STATIC/image/jpeg/d8b15ebbb83268872972dc791acca2a1/fx1.jpg fx1 true fx1.jpg jpg 19123 143 301 IMAGE-DOWNSAMPLED 1-s2.0-S1872206725647048-gr1.jpg https://s3-eu-west-1.amazonaws.com/prod-ucs-content-store-eu-west/content/pii:S1872206725647048/gr1/DOWNSAMPLED/image/jpeg/afa906b7e199b9391684db7b8783540c/gr1.jpg gr1 gr1.jpg jpg 84499 366 522 IMAGE-DOWNSAMPLED 1-s2.0-S1872206725647048-gr2.jpg https://s3-eu-west-1.amazonaws.com/prod-ucs-content-store-eu-west/content/pii:S1872206725647048/gr2/DOWNSAMPLED/image/jpeg/cb8be3896137d4f9dd4e13b4264d35a2/gr2.jpg gr2 gr2.jpg jpg 140367 519 638 IMAGE-DOWNSAMPLED 1-s2.0-S1872206725647048-gr3.jpg https://s3-eu-west-1.amazonaws.com/prod-ucs-content-store-eu-west/content/pii:S1872206725647048/gr3/DOWNSAMPLED/image/jpeg/ee33bb9431c5d885c94e713ab5c53ccc/gr3.jpg gr3 gr3.jpg jpg 151748 536 687 IMAGE-DOWNSAMPLED 1-s2.0-S1872206725647048-gr4.jpg https://s3-eu-west-1.amazonaws.com/prod-ucs-content-store-eu-west/content/pii:S1872206725647048/gr4/DOWNSAMPLED/image/jpeg/6e4972b47f804670a5e7e9b599ff920d/gr4.jpg gr4 gr4.jpg jpg 60144 315 579 IMAGE-DOWNSAMPLED 1-s2.0-S1872206725647048-gr5.jpg https://s3-eu-west-1.amazonaws.com/prod-ucs-content-store-eu-west/content/pii:S1872206725647048/gr5/DOWNSAMPLED/image/jpeg/49f034d547c18dc6333da6685d1876c1/gr5.jpg gr5 gr5.jpg jpg 104402 456 609 IMAGE-DOWNSAMPLED 1-s2.0-S1872206725647048-fx1.sml https://s3-eu-west-1.amazonaws.com/prod-ucs-content-store-eu-west/content/pii:S1872206725647048/fx1/THUMBNAIL/image/gif/d97245ead501553ae3d59b96c36829ad/fx1.sml fx1 true fx1.sml sml 8685 104 219 IMAGE-THUMBNAIL 1-s2.0-S1872206725647048-gr1.sml https://s3-eu-west-1.amazonaws.com/prod-ucs-content-store-eu-west/content/pii:S1872206725647048/gr1/HIGHRES/image/gif/b66aefab1fcb27f4530a9a4cc0595333/gr1.sml gr1 gr1.sml sml 20973 154 219 IMAGE-THUMBNAIL 1-s2.0-S1872206725647048-gr2.sml https://s3-eu-west-1.amazonaws.com/prod-ucs-content-store-eu-west/content/pii:S1872206725647048/gr2/DOWNSAMPLED/image/gif/ed5460df927912c758d567792536975b/gr2.sml gr2 gr2.sml sml 15347 164 202 IMAGE-THUMBNAIL 1-s2.0-S1872206725647048-gr3.sml https://s3-eu-west-1.amazonaws.com/prod-ucs-content-store-eu-west/content/pii:S1872206725647048/gr3/THUMBNAIL/image/gif/376a95b7edc47e15f02e54dc64a9e309/gr3.sml gr3 gr3.sml sml 15156 164 210 IMAGE-THUMBNAIL 1-s2.0-S1872206725647048-gr4.sml https://s3-eu-west-1.amazonaws.com/prod-ucs-content-store-eu-west/content/pii:S1872206725647048/gr4/THUMBNAIL/image/gif/8ec7526d246b45640b32a45f7b33ddb7/gr4.sml gr4 gr4.sml sml 8886 119 219 IMAGE-THUMBNAIL 1-s2.0-S1872206725647048-gr5.sml https://s3-eu-west-1.amazonaws.com/prod-ucs-content-store-eu-west/content/pii:S1872206725647048/gr5/THUMBNAIL/image/gif/ef33a34e295c1d9f7b91f773c9009c25/gr5.sml gr5 gr5.sml sml 13735 164 219 IMAGE-THUMBNAIL 1-s2.0-S1872206725647048-fx1_lrg.jpg https://s3-eu-west-1.amazonaws.com/prod-ucs-content-store-eu-west/content/pii:S1872206725647048/HIGHRES/image/jpeg/ced3b577e283cd23387f671180262711/fx1_lrg.jpg fx1 true fx1_lrg.jpg jpg 172474 633 1333 IMAGE-HIGH-RES 1-s2.0-S1872206725647048-gr1_lrg.jpg https://s3-eu-west-1.amazonaws.com/prod-ucs-content-store-eu-west/content/pii:S1872206725647048/HIGHRES/image/jpeg/0a51e34c1a322a75d1811cf8aae45061/gr1_lrg.jpg gr1 gr1_lrg.jpg jpg 494179 973 1386 IMAGE-HIGH-RES 1-s2.0-S1872206725647048-gr2_lrg.jpg https://s3-eu-west-1.amazonaws.com/prod-ucs-content-store-eu-west/content/pii:S1872206725647048/HIGHRES/image/jpeg/cbf9e1a415f3e2e7e8227a20d396cc00/gr2_lrg.jpg gr2 gr2_lrg.jpg jpg 651549 1377 1694 IMAGE-HIGH-RES 1-s2.0-S1872206725647048-gr3_lrg.jpg https://s3-eu-west-1.amazonaws.com/prod-ucs-content-store-eu-west/content/pii:S1872206725647048/HIGHRES/image/jpeg/1a80d24eef0ba106428ea24a45e22eaa/gr3_lrg.jpg gr3 gr3_lrg.jpg jpg 669841 1422 1824 IMAGE-HIGH-RES 1-s2.0-S1872206725647048-gr4_lrg.jpg https://s3-eu-west-1.amazonaws.com/prod-ucs-content-store-eu-west/content/pii:S1872206725647048/PUBMED/image/jpeg/580bc3bfae6201de4497a01f5f23dcad/gr4_lrg.jpg gr4 gr4_lrg.jpg jpg 233565 836 1539 IMAGE-HIGH-RES 1-s2.0-S1872206725647048-gr5_lrg.jpg https://s3-eu-west-1.amazonaws.com/prod-ucs-content-store-eu-west/content/pii:S1872206725647048/HIGHRES/image/jpeg/6c59ef675fdf5f69b32bdb78f21f8de5/gr5_lrg.jpg gr5 gr5_lrg.jpg jpg 468036 1212 1619 IMAGE-HIGH-RES 1-s2.0-S1872206725647048-mmc1.pdf https://s3-eu-west-1.amazonaws.com/prod-ucs-content-store-eu-west/content/pii:S1872206725647048/mmc1/MAIN/application/pdf/2026ace0365465fac3fdc16573d18dbc/mmc1.pdf mmc1 mmc1.pdf pdf false 3970166 APPLICATION CHNJC 64704 S1872-2067(25)64704-8 10.1016/S1872-2067(25)64704-8 Dalian Institute of Chemical Physics, the Chinese Academy of Sciences Fig. 1 (a) Schematic diagram of the synthesis procedure of g-C3N4@Co-N/MPC. (b) SEM images of Co-N/MPC. (c) HAADF-STEM image of g-C3N4@Co-N/MPC. (d) Elemental mapping images. (e,f) TEM images of g-C3N4@Co-N/MPC. Fig. 2 Physical characterization of Co-N/MPC and g-C3N4@Co-N/MPC. (a) XRD pattern for Co-N/MPC and g-C3N4@Co-N/MPC. (b) Raman spectrum. XPS spectra of C 1s (c) and N 1s (d). (e) A comparison chart illustrating the nitrogen content across various types. (f) Co K-edge XANES spectra of g-C3N4@Co-N/MPC with reference spectra of Co foil, CoO and CoPc. (g) The Fourier transform of the Co K-edge EXAFS spectra for the g-C3N4@Co-N/MPC with reference spectra of Co foil, CoO and CoPc. (h) The WT spectra of Co K edge EXAFS for Co foil, CoO, CoPc and g-C3N4@Co-N/MPC. Fig. 3 (a) The ORR LSV polarization curves of g-C3N4, Co-N/MPC and g-C3N4@Co-N/MPC in O2-saturated 0.1 mol L–1 KOH electrolyte solution (1600 rpm) under light and darkness. (b) Comparison of E 1/2 and limit current density. (c) The corresponding Tafel slopes. (d) Percentages of H2O2 produced and the electron transfer numbers of g-C3N4@Co-N/MPC under light and darkness. (e) The OER LSV polarization curves of g-C3N4, Co-N/MPC and g-C3N4@Co-N/MPC in 1 mol L–1 KOH electrolyte solution (1600 rpm) under light and darkness. (f) The corresponding Tafel slopes. (g) Comparison of bifunctional OER and ORR activity of g-C3N4@Co-N/MPC with other catalysts. (h) Comparison of ΔE. (i) Double-layer capacity of g-C3N4@Co-N/MPC under light and darkness. Fig. 4 (a–c) Mott-Schottky plot of g-C3N4 (a), Co-N/MPC (b) and g-C3N4@Co-N/MPC (c). (d) UV-vis spectra. (e) Tauc plots. (f) Band structure diagram of g-C3N4@Co-N/MPC. Fig. 5 Testing a complete zinc-air battery with photocatalyst g-C3N4@Co-N/MPC under light and darkness. (a) Schematic diagram of a zinc air battery. (b) OCV curves. (c) Discharge polarization curve and the corresponding power density curve. (d) Specific capacity plot. (e) The rate discharge test. (f) Comparison of zinc-air battery performance with various catalysts. (g) Polarization voltage curves for charging and discharging at 10 mA cm–2 constant currents. (h) Discharge polarization curves and the corresponding power density curves of a fuel cell under illumination and darkness. Available online 20 June 2025 This work was supported by the National Key Research and Development Program of China (2022YFE0138900), the National Natural Science Foundation of China (21972017), the “Scientific and Technical Innovation Action Plan” Basic Research Field of Shanghai Science and Technology Committee (19JC1410500), the Shanghai Sailing Program (22YF1400700), and the Chenguang Program of Shanghai Education the Development Foundation and Shanghai Municipal Education Commission (22CGA37). Article Photo-enhanced Co single-atom catalyst with a staggered p-n heterojunction: unraveling its high oxygen catalytic performance in zinc-air batteries and fuel cells Zhaodi Wang a Yang Zhang a Junxuan Zhang c Nengneng Xu a * Tuo Lu a Biyan Zhuang a Guicheng Liu d * Woochul Yang c * Hao Lei e Binglun Tian e Jinli Qiao a b * a State Key Laboratory of Advanced Fiber Materials, College of Environmental Science and Engineering, Donghua University, Shanghai 201620, China State Key Laboratory of Advanced Fiber Materials College of Environmental Science and Engineering Donghua University Shanghai 201620 China State Key Laboratory of Advanced Fiber Materials, College of Environmental Science and Engineering, Donghua University, Shanghai 201620, China b Shanghai Institute of Pollution Control and Ecological Security, Shanghai 200092, China Shanghai Institute of Pollution Control and Ecological Security Shanghai 200092 China Shanghai Institute of Pollution Control and Ecological Security, Shanghai 200092, China c Department of Physics, Dongguk University, Seoul 04620, Republic of Korea Department of Physics Dongguk University Seoul 04620 Republic of Korea Department of Physics, Dongguk University, Seoul 04620, Republic of Korea d Beijing Laboratory of New Energy Storage Technology, School of Energy Power and Mechanical Engineering, North China Electric Power University, Beijing 102206, China Beijing Laboratory of New Energy Storage Technology School of Energy Power and Mechanical Engineering North China Electric Power University Beijing 102206 China Beijing Laboratory of New Energy Storage Technology, School of Energy Power and Mechanical Engineering, North China Electric Power University, Beijing 102206, China e HiTS (Shanghai) Hydrogen Power Technology Co., Ltd, Shanghai 200333, China HiTS (Shanghai) Hydrogen Power Technology Co., Ltd Shanghai 200333 China HiTS (Shanghai) Hydrogen Power Technology Co., Ltd, Shanghai 200333, China * Corresponding author. The sluggish kinetics of the oxygen reduction reaction (ORR) and high over potential of oxygen evolution reaction (OER) are big challenges in the development of high-performance zinc-air batteries (ZABs) and fuel cells. In this work, we report a rational design and a simple fabrication strategy of a photo-enhanced Co single-atom catalyst (SAC) comprising g-C3N4 coupled with cobalt-nitrogen-doped hierarchical mesoporous carbon (Co-N/MPC), forming a staggered p-n heterojunction that effectively improves charge separation and enhances electrocatalytic activity. The incorporation of Co SACs and g-C3N4 synergistically optimizes the photogenerated electron-hole pair separation, significantly boosting the intrinsic ORR-OER duplex activity. Under illumination, g-C3N4@Co-N/MPC exhibits an outstanding ORR half-wave potential (E 1/2) of 0.841 V (vs. RHE) in 0.1 mol L–1 KOH and a low OER overpotential of 497.4 mV (vs. RHE) at 10 mA cm–2 in 1 mol L–1 KOH. Notably, the catalyst achieves an exceptional peak power density of 850.7 mW cm–2 in ZABs and of 411 mW cm–2 even in H2-air fuel cell. In addition, g-C3N4@Co-N/MPC-based ZABs also show remarkable cycling stability exceeding 250 h. The advanced photo-induced charge separation at the p-n heterojunction facilitates faster electron transfer kinetics, and the mass transport owing to hierarchical mesoporous structure of Co-N-C, thereby reducing the overpotential and enhancing the overall energy conversion efficiency. This work provides a new perspective on designing next-generation of single-atom dispersed oxygen reaction catalysts, paving the way for high-performance photo-enhanced energy storage and conversion systems. Graphical Abstract The photo-enhanced Co single-atom catalyst with staggered p-n heterojunction architecture delivers exceptional peak power densities of 850.7 mW cm–2 in zinc-air batteries and 411 mW cm–2 in H2-air fuel cells. Keywords Co single-atom Hierarchical mesoporous carbon Photo-enhancement p-n Heterojunction Oxygen catalytic reaction 1 Introduction The continuous depletion of fossil fuels and the resulting environmental pollution have motivated researchers to seek clean and highly efficient technologies for energy storage and conversion [1–3]. Rechargeable zinc-air batteries (ZABs) hold great promise as a large-scale energy storage solution, owing to their high energy density (1084 Wh kg–1) [4,5], low cost and environmental sustainability. Similarly, fuel cells, particularly proton exchange membrane fuel cells (PEMFCs), have emerged as a key technology for clean energy conversion due to their high efficiency and zero-emission operation [6,7]. However, the widespread adoption of PEMFCs is hindered by the high cost and limited durability of platinum-based catalysts, especially for the oxygen reduction reaction (ORR) at the cathode [8]. Despite significant progress in the development of bifunctional catalysts in recent years, the sluggish kinetics of the ORR in fuel cells and high over potential of oxygen evolution reaction (OER) in ZABs pose significant challenges to long-term cycling stability and high efficiency [9,10]. In this regard, photo-enhanced bifunctional catalysts harness absorbed light energy to produce electron-hole pairs, with the resulting electrons and holes driving the ORR and OER, respectively, which helps reduce the overall overpotential [11–13]. Additionally, heterojunctions formed by photocatalysts play a critical role in minimizing electron-hole recombination, thus improving charge separation and enhancing transport efficiency [14,15]. Therefore, it is essential to develop a cost-effective, durable, and highly efficient bifunctional photo-electrocatalyst for the ORR and OER to significantly accelerate the electrochemical kinetics. Metal-nitrogen-doped carbon (M-N-C) catalysts have garnered significant attention with their advantages in active sites, modification, and conductive network [16–18]. In particular, Co-N-C single-atom catalysts (SACs) have exhibited promising duplex oxygen catalytic activity (for example, both for ORR and OER), attributed to their abundant and highly active Co-N x sites [19–22]. Nevertheless, Co-N-C catalysts based on traditional carbon supports still remind certain challenges: (1) uneven dispersion on the substrate, which reduces the effective number of active sites and limits catalytic activity; (2) leaching or detachment of Co atoms and particle growth and Ostwald ripening, leading to the aggregation of active sites and a decline in electrochemical surface area [23]; and (3) carbon support corrosion under electrochemical conditions, resulting in structural instability and performance decay [24,25]. Compared to traditional carbon black supports (e.g., Vulcan XC-72), hierarchical mesoporous carbon (MPC) offers several advantages as a support material for Co-N-C catalysts, enhancing their stability, activity, and durability in electrochemical applications such as fuel cells and metal-air batteries [26]. These advantages include that: (1) the high surface area enhances active sites dispersion and active site utilization, showing high electrochemically active surface area (ECSA) [27]; (2) the interconnected porous structure of MPC reduces the mobility mitigation of nanoparticle growth and Ostwald ripening [28]; (3) the hierarchical pore structure (micropores, mesopores, and macropores) facilitates mass transport and reactant diffusion, improving overall reaction kinetics [29,30]; and (4) the robust carbon framework with superior corrosion resistance minimizes structural collapse, exhibiting high structural stability. In addition, the interconnected carbon network provides an efficient electron transport pathway, reducing internal resistance and improving charge transfer during electrocatalysis [31,32]. Thus, utilizing MPC as support for synthesizing high-performance Co-N-C single-atom catalysts offers significant advantages [33,34]. On the other hand, graphitic carbon nitride (g-C3N4) serves as a cost-effective photocatalyst, featuring abundant covalent C-N bonds, a moderate bandgap, and high chemical stability [35]. The incorporation of g-C3N4 can greatly improve stability and performance by offering anchoring sites to inhibit Co aggregation, strengthening structural integrity, and facilitating electron-hole pair generation under illumination to accelerate the kinetics of both ORR and OER [36,37]. This approach not only maintains an optimal C/N ratio but also enhances the overall catalytic efficiency and durability of the Co-N/MPC system [38,39]. In this work, we successfully synthesized g-C3N4@Co-N/ MPC, a high-performance photo-enhanced bifunctional catalyst, via a high-energy ball-milling (HEBM) process, coupling g-C3N4 with Co-N/MPC. The well-defined porous structure of Co-N/MPC serves as an efficient charge and mass transport network, while the layered g-C3N4 significantly enhances light absorption and photogenerated charge separation. The formation of a staggered p-n heterojunction between g-C3N4 and Co-N/MPC facilitates efficient electron transfer, thereby minimizing electron-hole recombination and enhancing the catalytic kinetics of both ORR and OER. As a result, g-C3N4@Co-N/MPC achieves outstanding ORR/OER bifunctionality, characterized by a low overpotential (ΔE) of 0.8864 V. When integrated into zinc-air batteries, the catalyst exhibits an exceptional peak power density (850.7 mW cm–2), an excellent specific capacity (718.3 mAh gZn –1), and long-term durability over 250 h. Specifically, g-C3N4@Co-N/MPC also realizes a very high power density even in H2-air fuel cell. This study demonstrates a novel and scalable strategy for designing photo-enhanced bifunctional catalysts, advancing the development of highly stable and efficient zinc-air batteries and photo-enhanced fuel cells. 2 Experimental 2.1 Materials Cobalt (II) nitrate hexahydrate (Co(NO3)2·6H2O), SiO2 (PS = 500 nm), Potassium hydroxide (KOH) and Sodium hydroxide (NaOH) were obtained from Sinopharm Chemical Reagent Co., Ltd. PQ-7 (Polyquaternium-7,10%) was purchased from Shanghai YuanYe Biotechnology Co., Ltd. Hydrochloric acid (HCl), sulphuric acid (H2SO4) were obtained from Hu Shi Co., Ltd. 20% Pt/C and IrO2 were obtained from Johnson Matthey. 2.2 The synthesis of g-C3N4@Co-N/MPC The g-C3N4@Co-N/MPC was synthesized through the coupling of g-C3N4 and Co-N/MPC, as illustrated in Fig. 1(a) . g-C3N4 was generated via thermal processing of urea at 550 °C for 3 h with a heating rate of 3 °C min–1. And the Co-N/MPC was primarily synthesized using the hard template method. In detail, the precursor solution was prepared by mixing PQ-7(10 wt%), SiO2, Co(NO3)2·6H2O and 0.1 mol L–1 HCl in a mass ratio of 9:2:3:36, and was dried and subsequently heated to 800 °C for 60 min with a heating rate of 20 °C min–1 in a N2 atmosphere to achieve primary carbonization. Thereafter, the material underwent sequential alkaline (4 mol L–1 NaOH) and acid washing (0.5 mol L–1 H2SO4) processing to remove the nano-silica template and other residual impurities. Finally, the washed material was subjected to secondary carbonization, resulting in Co-N/MPC. The g-C3N4@Co-N/MPC was obtained by ball-milling a mixture of g-C3N4 with Co-N/MPC (the mass ratio of g-C3N4: Co-N/MPC = 0.3:1) at 300 rpm for 480 min. For comparison, g-C3N4@Co-N/MPC(0.1:1), g-C3N4@Co-N/MPC(0.2:1), and g-C3N4@Co-N/MPC(0.4:1) were prepared under the same conditions but with altered mass ratios of g-C3N4 to Co-N/MPC (0.1:1, 0.2:1 and 0.4:1, respectively). 2.3 Characterization To investigate the morphology and structure of the synthesized sample, Field-emission scanning electron microscopy (FESEM, S-4800), transmission electron microscope (TEM, 200 kV) and high-angle annular dark-field scanning TEM (HAADF-STEM) with the energy-dispersive X-ray spectroscopy (EDS) analysis capability were utilized. X-ray diffraction (XRD, Bruker D8) was used to identify the crystalline phases of the synthesized catalyst. The elemental analysis was characterized using X-ray photoelectron spectroscopy (XPS, Escalab 250Xi). The specific surface area and pore characteristics of the synthesized catalyst were measured using Brunauer-Emmett-Teller (BET). Raman spectroscopy (InVia-Reflex) was employed to analyze the chemical structure and defects. The X-ray absorption near-edge structure (XANES) spectroscopy was employed in identifying the oxidation states of the elements. The Fourier-transformed extended X-ray absorption fine structure (FT-EXAFS) spectra were applied to characterize the local environment and coordination structure of the Co site. Ultraviolet-visible (UV-vis) spectroscopy (UV3600) was conducted using a continuous light source in the range of 200–800 nm to generate characteristic absorption spectra of the sample. 2.4 Photoelectrochemical performance testing All photoelectrochemical tests were conducted using a CHI760D electrochemical workstation in a conventional three-electrode system. The catalyst ink was prepared by dispersing 2 mg of catalyst in a solution containing 400 μL of isopropanol and 100 μL of 0.1 wt% Nafion, followed by 40 min of ultrasonication. Subsequently, the ink was applied to a glassy carbon electrode (GCE) at a volume of 9.8 μL and allowed to dry, achieving a catalyst loading of 200 μg cm–2. This formed the working electrode (WE). Meanwhile, the platinum wire serves as the counter electrode and a saturated calomel electrode (SCE) acts as the reference electrode. For comparison, an ink formulated with commercial Pt/C (20 wt% Pt) and IrO2 were evaluated under identical conditions. Linear sweep voltammetry (LSV) tests and electrochemical impedance spectroscopy (EIS) measurements were performed using a rotating disk electrode (RDE). The ORR/OER tests were conducted at a scan rate of 5 mV s–1 and a rotation speed of 1600 rpm, under both illuminated and dark state. The ORR tests were evaluated in an O2-saturated 0.1 mol L–1 KOH electrolyte with the potential range from 0–1.1 V (vs. RHE), and the OER tests were carried out in 1.0 mol L–1 KOH from 1.1–1.9 V (vs. RHE), respectively. 2.5 Photo enhanced Zn-air battery and fuel cell The zinc-air battery with a homemade mode, where a polish zinc plate functions as the anode, a catalyst-loaded (g-C3N4@Co-N/MPC loading: 2 mg cm–2) carbon paper as the cathode (air electrode), and 6 M KOH as the electrolyte. All ZABs testing was conducted by LAND testing system under a xenon lamp (CEL-PE300L-3A) with 1-sunlight illumination. For the fuel cell, the anode (hydrogen electrode) and cathode (oxygen electrode) were prepared with catalyst loadings of 0.1 mgPt cm–2 and 2.0 mg cm–2, respectively, on a 2×2 cm2 electrode area (total area of 4 cm2). A Gore™ membrane with a thickness of 8 μm was used as the separator. The gas flow rates were set to 400 mL min–1 for hydrogen and 1000 mL min–1 for air. The operating temperature was maintained at 80 °C. The performance of the cells was evaluated under both illuminated and non-illuminated conditions using a xenon lamp (CEL-PE300L-3A) with 1-sunlight intensity. 3 Results and discussion 3.1 Physical and chemical characterization The synthesis procedure for g-C3N4@Co-N/MPC was illustrated in Fig. 1(a). The incorporation of PQ-7 molecules, enriched with quaternary ammonium groups, enables tunable nitrogen doping, facilitating the in-situ one-step synthesis of a hierarchical mesoporous nitrogen-doped carbon (MPC) framework. The calcination process is crucial for constructing a well-defined hierarchical mesoporous structure, while subsequent alkaline and acidic leaching steps ensure the complete removal of residual organic and inorganic species. This results in the formation of a cobalt-nitrogen-doped hierarchical mesoporous structure (Co-N/MPC) architecture with enhanced physicochemical stability and electrochemical properties. To further optimize catalytic performance, mechanochemical ball-milling is employed, leveraging high-energy shear forces to achieve uniform and intimate integration of g-C3N4 with Co-N/MPC, ultimately yielding the g-C3N4@Co-N/MPC catalyst. Fig. 1(b) and Figs. S1(a)–(c) reveal that Co-N/MPC exhibits a high density of hierarchically distributed pores with diameters ranging from 0.5 to 40 nm (Fig. S2), resulting in an exceptionally high specific surface area (SSA) of 891.304 m2 g–1. The multilayered lamellar structure of g-C3N4 (Figs. S1(d)–(f) provides abundant accessible interfaces, facilitating seamless integration with the porous carbon network (Fig. S3). Atomic-scale structural insights obtained via high-angle annular dark-field scanning transmission electron microscopy (HAADF-STEM, Fig. 1(c) confirm the uniform dispersion of atomically dispersed Co sites within the g-C3N4@Co-N/MPC framework. Furthermore, the TEM image (Fig. 1(e) reveals a well-preserved porous carbon architecture, where g-C3N4 layers are tightly interwoven with Co-N/MPC, exhibiting no discernible interfacial gaps-indicative of strong electronic and structural interactions. High-resolution TEM (HRTEM, Fig. 1(f) further corroborates the presence of well-defined graphitic lattice fringes, showing high structural stability as well as high electrical conductivity. Finally, elemental mapping via EDS (Fig. 1(d) demonstrates the homogeneous distribution of C, N, and Co, confirming the successful synthesis of the designed heterostructure. As illustrated in Fig. 2(a) , the XRD patterns of g-C3N4@Co-N/MPC closely resemble those of Co-N/MPC. Two broad diffraction peaks centered at 25° and 43° were observed, corresponding to the (002) and (103) reflections of graphitized carbon, respectively. This suggests an amorphous carbon structure without well-defined crystalline domains. Raman spectroscopy (Fig. 2(b) further corroborates this observation, with g-C3N4@Co-N/MPC exhibiting an I D/I G ratio of 1.07, comparable to that of Co-N/MPC (1.08), indicating that the degree of graphitization and defect density remains largely unchanged following g-C3N4 incorporation (Fig. S4) [40]. Additionally, N2 adsorption-desorption isotherms and pore size distribution analysis (Fig. S2) reveals that g-C3N4@Co-N/MPC retains a type-IV isotherm, indicative of a well-developed mesoporous network similar to that of Co-N/MPC. Despite this structural similarity, g-C3N4@Co-N/MPC exhibits a SSA of 584.95 m2 g–1, lower than that of Co-N/MPC. The reduction of SSA may stem from topological defect formation during the thermal treatment process, which is employed to remove residual heteroatoms from the carbon framework. By extending the “size effect” to pore size variation, it is clear that hierarchical porosity and interfacial interactions are more decisive for catalytic activity than SSA alone, as they optimize active site utilization, charge transfer, and mass transport dynamics [41,42]. The presence of significant carbon defects in g-C3N4@Co-N/MPC is further evidenced by the hysteresis loop observed in the N2 adsorption-desorption isotherm and the increased intensity of the D-band in the Raman spectrum [43,44]. To gain further insights into the chemical composition and electronic structure of the catalyst, XPS analysis was performed (Figs. 2(c), (d)). The high-resolution C 1s spectra of Co-N/MPC and g-C3N4@Co-N/MPC reveal four primary peaks at 284.8 eV (C-C), 286.4 eV (C-N/C=N), 288.4 eV (C=O), and 291 eV (π-π*), where the peak at 291 eV originates from aromatic ring vibrations, indicative of π-π interactions [45,46]. The N 1s spectrum (Fig. 2(d) further confirms the presence of five distinctive nitrogen species, including pyridinic N (398.6 eV), Co-N (399.6 eV), pyrrolic N (400.5 eV), graphitic N (401.2 eV), and oxidized N (403 eV). Notably, Fig. 2(e) and Table S1 reveal that the introduction of g-C3N4 leads to a higher prevalence of pyridinic N (27.63%), Co-N (17.89%) and graphitic N species (32.73%), which play a pivotal role in enhancing catalyst activity/stability and electronic conductivity, respectively [47]. In general, the presence of Co-N coordination centers, which exhibit higher stability relative to other metal-ligand structures, is crucial for sustaining high catalytic performance across a broad range of reaction conditions [48,49]. Additionally, the increased fraction of graphitic N enhances the electronic conductivity and thermal stability of the catalyst, further improving its electrocatalytic efficiency (Fig. S5) [50,51]. To elucidate the local coordination environment of cobalt species, XAFS spectroscopy was conducted. XANES analysis (Fig. 2(f) indicates that the oxidation state of Co in g-C3N4@Co-N/MPC closely aligns with that of CoPc, suggesting a Co valence state of approximately +2. Moreover, the Fourier transform of the k 3-weighted EXAFS spectra (Figs. 2(g), S6, S7 and Table S2) demonstrates a distinct Co-N peak at ~1.5 Å, confirming that Co atoms predominantly exhibit first-shell Co-N coordination. Quantitative EXAFS fitting further supports the presence of Co-N4 single-atom coordination sites, indicative of atomically dispersed Co centers [52,53]. To further probe the coordination environment of Co species, the wavelet transform (WT) spectra of Co K-edge EXAFS was conducted (Fig. 2(h). The WT contour plot shows a single intensity maximum at 6 Å–1, corresponding to Co-N coordination, with no additional features indicative of Co–Co bonding. This observation unequivocally confirms that g-C3N4@Co-N/MPC predominantly comprises atomically dispersed Co active sites, characteristic of a single-atom catalyst (SAC) structure and aligning well with the HAADF-STEM results [54,55]. 3.2 Photo-enhanced ORR/OER electrocatalytic performance The ORR activity of all catalysts was systematically evaluated under an O2-saturated 0.1 mol L–1 KOH electrolyte under both light and dark conditions. To further investigate the photo-electrocatalytic properties, Figs. 3(a), (b) and Table S3 show that g-C3N4@Co-N/MPC achieves a half-wave potential (E 1/2) of 0.841 V under illumination. These values are comparable to that of Co-N/MPC (0.847 V) and the 20% Pt/C+IrO2(1:1) catalyst mixture (0.845 V), and but significantly higher than their respective performances in dark conditions (Fig. S8 and Fig. S9(a). In addition, that g-C3N4@Co-N/MPC shows a higher limiting current density of 5.70 mA cm–2 than g-C3N4 (2.73 mA cm–2), Co-N/MPC (4.98 mA cm–2, Fig. 3(b) and other ratios samples (Fig. S9(a) under illumination. This finding highlights the synergistic effect between g-C3N4 and Co-N/MPC (Fig. 3(b), which plays a pivotal role in enhancing ORR performance. The high-performance of g-C3N4@Co-N/MPC also is further verified by its small ohmic resistance (R ohmic) of 1.83 Ω cm2, revealing the fast electron transfer pathway, and its small charge-transfer resistance (R ct: 4.84 Ω cm2) and low Tafel slope (69.7 mV dec–1, Fig. 3(c), and Fig. S9 (c), showing the quick reaction kinetic [56,57]. To elucidate the ORR reaction mechanism, the electron transfer number (n) was determined via LSV measurements at various rotation rates using the Koutechy-Levich (K-L) equation (Fig. S10) under both illumination and darkness. The calculated n is approximately 4, indicating a predominant 4e– pathway, which enables the direct conversion of O2 to OH–. Additionally, rotating ring-disk electrode (RRDE) testing (Fig. 3(d) demonstrates that the H2O2 yield remains negligibly low (< 0.2%) over a potential range of 0.2–0.8 V under illumination. This aligns well with the K-L analysis, further confirming the high selectivity of g-C3N4@Co-N/MPC for the 4e– ORR pathway. To evaluate the bifunctional catalytic activity, the OER performance of g-C3N4@Co-N/MPC was also assessed in 1 M KOH under illuminated and dark conditions. As shown in Fig. 3(e), g-C3N4@Co-N/MPC exhibits an low overpotential (η = Ej =10 – 1.23) of 497.4 mV at 10 mA cm–2 under illumination, which is close to that of 20% Pt/C+IrO2(1:1) benchmark catalyst (494.4 mV, Fig. S11 and Table S3) and is significantly lower than that of g-C3N4 (736.4 mV) and Co-N/MPC (621.4 mV). Notably, the overpotentials of all prepared catalysts under illumination were consistently lower than those measured in darkness (such as g-C3N4@Co-N/MPC(0.1:1) (583.4 mV), g-C3N4@ Co-N/MPC(0.2:1) (527.4 mV), and g-C3N4@Co-N/MPC(0.4:1) (532.4 mV), Fig. S12(a), confirming that light effectively enhances OER performance. Similar to ORR, g-C3N4@Co-N/MPC(0.3:1) possesses the lowest R ohmic (1.20 Ω cm2), R ct (19.58 Ω cm2) and Tafel slope (87.5 mV dec–1, Fig. 3(f) than that of other samples (Figs. S12(b) and S12(c), as well as Tables S3 and S5) and under illumination, confirming its superior charge transfer kinetics for the OER process and fast charge transfer at the three-phase interface. Notably, the OER performance of g-C3N4@Co-N/MPC also shows the great potential in recently reported catalysts (Fig. 3(g). To assess the bifunctional activity, the potential gap ΔE (E 10 – E 1/2) was employed as a key performance metric. As illustrated in Fig. 3(h), g-C3N4@Co-N/MPC exhibits a ΔE of 0.8864 V under illumination, which is lower than its dark-state value (0.9494 V) and marginally higher than that of 20% Pt/C+IrO2 (0.8794 V). This demonstrates its exceptional bifunctional catalytic performance. Additionally, double-layer capacitance (C dl) measurements were conducted to estimate the ECSA of all catalysts under light and dark conditions. As shown in Fig. 3(i), g-C3N4@Co-N/MPC exhibits the highest C dl (12.25 mF cm–2) under illumination, outperforming all other prepared catalysts (Fig. S13, Table S5). This suggests a higher density of electroactive sites, particularly from graphitic-N and Co-N4 coordination centers. Hence, the high ORR/OER catalytic performance may be ascribed to its hierarchically micro-mesoporous structure, which facilitates efficient mass transport and exposes a greater number of Co-N active sites, thereby promoting enhanced oxygen catalysis [58]. 3.3 Photoelectrochemical characterization and band structure analysis As shown in Fig. 4(a) , g-C3N4 have a positive slope, exhibiting an n-type semiconductor with E fb of –1.56 V (vs. Ag/AgCl). In contrast, Co-N/MPC, displaying a negative slope, is confirmed as a p-type semiconductor with an E fb of 1.61 V. The formation of a p-n heterojunction between g-C3N4 and Co-N/MPC is further substantiated by the inverted “V” shape observed in Fig. 4(c). Additionally, the valence band (VB) of Co-N/MPC and the conduction band (CB) of g-C3N4 exhibit a 0.2 V energy offset from their respective E fb values, indicating the presence of band bending at the interface [59,60]. Consequently, the CB and VB positions of g-C3N4 are determined to be –1.76 and 1.81 V, respectively [61]. Band bending at heterojunction interfaces generates a built-in electric field that drives carrier migration, suppresses recombination, and optimizes surface charge and active site environments, enhancing catalytic performance for photocatalytic and electrocatalytic applications [62,63]. To further investigate the optical properties of the synthesized materials, UV-vis absorption spectroscopy was performed (Fig. 4(d). Compared to Co-N/MPC, g-C3N4@Co-N/MPC exhibits a redshift in its absorption edge, indicative of bandgap narrowing due to the robust synergy mechanism between g-C3N4 and Co-N4 species [64]. This reduction in bandgap energy decreases the energy required for electron excitation from VB to CB, thereby facilitating the generation of additional electron-hole pairs. As well, g-C3N4@Co-N/MPC displays modified absorption characteristics in the 200–400 nm spectral region, suggesting an extended photon capture range that contributes to enhanced photo-electrocatalytic performance. Tauc plots (Fig. 4(e) reveal that the bandgap energies of g-C3N4, Co-N/MPC, and g-C3N4@Co-N/MPC are 3.00, 1.69, and 2.14 eV, respectively. As illustrated in Fig. 4(f), the resulting band structure diagram confirms the formation of a type-II p-n heterojunction, in which the energy bands of g-C3N4 and Co-N/MPC are arranged in a staggered configuration. Here, the CB of g-C3N4 is positioned at a lower energy level, while its VB resides at a higher energy level, whereas Co-N/MPC lies near the midpoint between the CB and VB of g-C3N4. Upon heterojunction formation, the energy level difference at the interface generates a built-in electric field, which drives charge carrier separation. Under illumination, incident photons with energy greater than or equal to E g excite electrons from the VB to the CB, leading to the formation of electron-hole pairs. The built-in electric field facilitates efficient electron-hole separation, directing photoexcited electrons from the CB of g-C3N4 to the Fermi level of Co-N/MPC, while holes migrate in the opposite direction [65,66]. The substantial increase in current density observed in g-C3N4@Co-N/MPC (Fig. S14) confirms that the engineered heterojunction structure effectively enhances light absorption efficiency. The efficient charge carrier separation minimizes electron-hole recombination, thereby increasing the availability of reactive charge carriers for surface electrocatalytic reactions [67]. This ultimately leads to enhanced catalytic activity for both ORR and OER reactions. 3.4 Photo-enhanced zinc-air battery/fuel cell performance To evaluate the practical applicability of g-C3N4@Co-N/MPC, a photo-enhanced zinc-air battery (ZAB) was assembled (Fig. 5(a) and systematically tested under both illuminated and dark states. In Fig. 5(b), the g-C3N4@Co-N/MPC-based ZAB achieves an open-circuit voltage (OCV) of 1.401 V under illumination, slightly exceeding its dark-state OCV of 1.395 V. Notably, a series of three connected ZABs is capable of powering a ~3 V “DHU” sign (Fig. 5(b), inset), demonstrating its potential for practical energy applications. The discharge polarization and power density curves (Fig. 5(c) reveal a peak power density of 722.5 mW cm–2 in darkness, which significantly increases to 850.7 mW cm–2 under illumination. This enhancement surpasses many reported ZABs (Fig. 5(f), Table S7), highlighting the photo-induced performance gains. Furthermore, Fig. 5(d) and Fig. S15 illustrate that the specific capacity and energy density of the g-C3N4@Co-N/MPC-based ZAB reach 718.3 mAh g–1 and 850.2 Wh kg–1 under illumination, respectively, markedly superior to its performance in darkness (609.2 mAh g–1 and 711.9 Wh kg–1). These results confirm that g-C3N4@Co-N/MPC significantly enhances energy storage potential and energy conversion efficiency under light irradiation. In addition, the rate discharge test (Fig. 5(e) further demonstrates that g-C3N4@Co-N/MPC-based ZAB exhibits a higher discharge voltage of 1.25 V at 50 mA cm–2 under illumination, surpassing its performance in darkness. Besides primary zinc-air battery, the g-C3N4@Co-N/MPC-based fuel cell also demonstrates a high power density with 411 mW cm–2 under illumination, which is sight higher than its performance in darkness (400 mW cm–2, Fig. 5(h). These results reveal high photo-enhanced ORR performance. To verify the photo-enhancement effect, the charge-discharge cycling stability was examined at 5 mA cm–2, alternating between illumination and darkness. As shown in Fig. S16, the voltage gap under illumination (0.74 V) is significantly lower than that in darkness (0.92 V). This reduction in voltage gap is attributed to the photoexcited charge carriers generated within the staggered p-n heterojunction, which effectively accelerate both the ORR during discharging and the OER during charging. More importantly, the long-term cycling performance (Fig. 5(g) demonstrates that the g-C3N4@Co-N/MPC-based ZABs maintains a stable cycling life exceeding 250 h, with a consistent voltage gap of ~0.8 V, underscoring its remarkable durability and electrochemical stability. These findings collectively confirm that the photo-enhanced ZABs exhibits superior performance, long-term operational stability, and enhanced catalytic activity, positioning g-C3N4@Co-N/MPC as a promising candidate for next-generation rechargeable metal-air batteries. 4 Conclusions In summary, we have successfully designed and synthesized a high-performance bifunctional photo-enhanced catalyst by integrating Co single-atom active sites within a g-C3N4@Co-N/MPC framework, forming a staggered p-n heterojunction. As a result, the catalyst exhibits exceptional bifunctional electrocatalytic performance, achieving a low ORR/OER overpotential gap (ΔE = 0.8864 V), a high ZAB peak power density (850.7 mW cm–2), and long-term stability exceeding 250 h. The remarkable photocatalytic enhancement observed in this study can be attributed to three key factors: (1) Increased number of active sites: the Co-N4 coordination centers act as highly efficient active sites, further enriched by N-doping and carbon defect engineering within the porous framework. (2) Hierarchical porosity ensures efficient mass transport, while the robust heterojunction structure enhances stability: the combination of hierarchical mesoporous structure and layered g-C3N4 facilitates efficient charge transport and minimizes recombination losses. (3) Extended light absorption and photoexcitation reduce reaction overpotentials by supplying additional energy. (4) The built-in electric field at the heterojunction interface promotes efficient charge separation, minimizing electron-hole recombination. This work offers a fundamental breakthrough in designing photo-enhanced bifunctional catalysts and their applications in metal-air batteries and fuel cells, bridging the gap between photocatalysis and electrocatalysis. Electronic supporting information Supporting information is available in the online version of this article. Supplementary Material Supplementary appendix References 1 G. Nazir A. Rehman J.H. Lee C.H. Kim J. Gautam K. Heo S. Hussain M. Ikram A.A. AlObaid S.-Y. Lee S.-J. Park Nano-Micro Lett. 16 2024 138 G. Nazir, A. Rehman, J. H. Lee, C. H. Kim, J. Gautam, K. Heo, S. Hussain, M. Ikram, A. A. AlObaid, S.-Y. Lee, S.-J. Park, Nano-Micro Lett., 2024, 16, 138. 2 S. Chen H. Ren Y. Qiu C. Luo Q. Zhao W. Yang J. Power Sources 573 2023 233116 S. Chen, H. Ren, Y. Qiu, C. Luo, Q. Zhao, W. Yang, J. Power Sources, 2023, 573, 233116. 3 A.S. Jamadar R. Sutar S. Patil R. Khandekar J.B. Yadav Mater. Rep. Energy 4 2024 100283 A. S. Jamadar, R. Sutar, S. Patil, R. Khandekar, J. B. Yadav, Mater. Rep. Energy, 2024, 4, 100283. 4 L. Qiao X. Wang R. Xu C. Zhang K. Chen K. Tong H. Wang S. Dai L. Chu M. Huang Mater. Today Energy 37 2023 101398 L. Qiao, X. Wang, R. Xu, C. Zhang, K. Chen, K. Tong, H. Wang, S. Dai, L. Chu, M. Huang, Mater. Today Energy, 2023, 37, 101398. 5 J. Li H. Xue N. Xu X. Zhang Y. Wang R. He H. Huang J. Qiao Mater. Rep. Energy 2 2022 100090 J. Li, H. Xue, N. Xu, X. Zhang, Y. Wang, R. He, H. Huang, J. Qiao, Mater. Rep. Energy, 2022, 2, 100090. 6 W.Y. Wong M.A.A. Abdul Rani K.S. Loh K.L. Lim L.J. Minggu Curr. Opin. Green Sustain. Chem. 52 2025 101001 W. Y. Wong, M. A. A. Abdul Rani, K. S. Loh, K. L. Lim, L. J. Minggu, Curr. Opin. Green Sustain. Chem., 2025, 52, 101001. 7 P. Phogat B. Chand Shreya R. Jha S. Singh Int. J. Hydrogen Energy 109 2025 465 485 P. Phogat, B. Chand, Shreya, R. Jha, S. Singh, Int. J. Hydrogen Energy, 2025, 109, 465–485. 8 Y. Wang S. Qin F. Ma C. Wang W. He B. Zhang H. Li Renewable Energy 246 2025 122885 Y. Wang, S. Qin, F. Ma, C. Wang, W. He, B. Zhang, H. Li, Renewable Energy, 2025, 246, 122885. 9 X. Wang L. Peng N. Xu M. Wu Y. Wang J. Guo S. Sun J. Qiao ACS Appl. Mater. Interfaces 12 2020 52836 52844 X. Wang, L. Peng, N. Xu, M. Wu, Y. Wang, J. Guo, S. Sun, J. Qiao, ACS Appl. Mater. Interfaces, 2020, 12, 52836–52844. 10 S. Pan Z. Ma W. Yang B. Dongyang H. Yang S. Lai F. Dong X. Yang Z. Lin Mater. Rep. Energy 3 2023 100212 S. Pan, Z. Ma, W. Yang, B. Dongyang, H. Yang, S. Lai, F. Dong, X. Yang, Z. Lin, Mater. Rep. Energy, 2023, 3, 100212. 11 X. Tang F. Li F. Li Y. Jiang C. Yu Chin. J. Catal. 52 2023 79 98 X. Tang, F. Li, F. Li, Y. Jiang, C. Yu, Chin. J. Catal., 2023, 52, 79–98. 12 D. Du S. Zhao Z. Zhu F. Li J. Chen Angew. Chem. Int. Ed. 59 2020 18140 18144 D. Du, S. Zhao, Z. Zhu, F. Li, J. Chen, Angew. Chem. Int. Ed., 2020, 59, 18140–18144. 13 Z. Jiang Z. Li Q. He S. Han Y. Liu H. Zhu X. Yuan Mater. Rep. Energy 4 2024 100267 Z. Jiang, Z. Li, Q. He, S. Han, Y. Liu, H. Zhu, X. Yuan, Mater. Rep. Energy, 2024, 4, 100267. 14 Y. Zhang N. Xu B. Gong X. Ye Y. Yang Z. Wang B. Zhuang M. Wang W. Yang G. Liu J.K. Lee J. Qiao Chin. J. Catal. 68 2025 300 310 Y. Zhang, N. Xu, B. Gong, X. Ye, Y. Yang, Z. Wang, B. Zhuang, M. Wang, W. Yang, G. Liu, J. K. Lee, J. Qiao, Chin. J. Catal., 2025, 68, 300–310. 15 L. Hu Y. Zhang Q. Lin F. Cao W. Mo S. Zhong H. Lin L. Xie L. Zhao S. Bai Chin. J. Catal. 68 2025 311 325 L. Hu, Y. Zhang, Q. Lin, F. Cao, W. Mo, S. Zhong, H. Lin, L. Xie, L. Zhao, S. Bai, Chin. J. Catal., 2025, 68, 311–325. 16 X. Lu P. Yang Y. Wan H. Zhang H. Xu L. Xiao R. Li Y. Li J. Zhang M. An Coord. Chem. Rev. 495 2023 215400 X. Lu, P. Yang, Y. Wan, H. Zhang, H. Xu, L. Xiao, R. Li, Y. Li, J. Zhang, M. An, Coord. Chem. Rev., 2023, 495, 215400. 17 C. Ye L. Zhang Y. Shen ACS Mater. Lett. 6 2024 2858 2887 C. Ye, L. Zhang, Y. Shen, ACS Mater. Lett., 2024, 6, 2858–2887. 18 K. Liu J. Fu Y. Lin T. Luo G. Ni H. Li Z. Lin M. Liu Nat. Commun. 13 2022 2075 K. Liu, J. Fu, Y. Lin, T. Luo, G. Ni, H. Li, Z. Lin, M. Liu, Nat. Commun., 2022, 13, 2075. 19 M. Zhang H. Li J. Chen F.-X. Ma L. Zhen Z. Wen C.-Y. Xu Small 18 2022 2202476 M. Zhang, H. Li, J. Chen, F.-X. Ma, L. Zhen, Z. Wen, C.-Y. Xu, Small, 2022, 18, 2202476. 20 S. Liang L.C. Zou L.J. Zheng F. Li X.X. Wang L.N. Song J.J. Xu Adv. Energy Mater. 12 2022 2103097 S. Liang, L. C. Zou, L. J. Zheng, F. Li, X. X. Wang, L. N. Song, J. J. Xu, Adv. Energy Mater., 2022, 12, 2103097. 21 L. Zhao Z. Zhang Z. Zhu P. Li J. Jiang T. Yang P. Xiong X. An X. Niu X. Qi J.-S. Chen R. Wu Chin. J. Catal. 51 2023 216 224 L. Zhao, Z. Zhang, Z. Zhu, P. Li, J. Jiang, T. Yang, P. Xiong, X. An, X. Niu, X. Qi, J.-S. Chen, R. Wu, Chin. J. Catal., 2023, 51, 216–224. 22 H. Gao K. Liu T. Luo Y. Chen J. Hu J. Fu M. Liu Chin. J. Catal. 43 2022 832 838 H. Gao, K. Liu, T. Luo, Y. Chen, J. Hu, J. Fu, M. Liu, Chin. J. Catal., 2022, 43, 832–838. 23 N. Song J. Jiang S. Hong Y. Wang C. Li H. Dong Chin. J. Catal. 59 2024 38 81 N. Song, J. Jiang, S. Hong, Y. Wang, C. Li, H. Dong, Chin. J. Catal., 2024, 59, 38–81. 24 F. Dong C. Liu M. Wu J. Guo K. Li J. Qiao ACS Sustainable Chem. Eng. 7 2019 8587 8596 F. Dong, C. Liu, M. Wu, J. Guo, K. Li, J. Qiao, ACS Sustainable Chem. Eng., 2019, 7, 8587–8596. 25 X. Dong X. Luo X. Yang M. Wang W. Xiao Y. Liu N. Xu W. Yang G. Liu J. Qiao J. Colloid Interface Sci. 672 2024 32 42 X. Dong, X. Luo, X. Yang, M. Wang, W. Xiao, Y. Liu, N. Xu, W. Yang, G. Liu, J. Qiao, J. Colloid Interface Sci., 2024, 672, 32–42. 26 P. Jiang Y. Wang Y. Li L. Dai N. Xu J. Qiao D. Ruan Sep. Purif. Technol. 341 2024 126813 P. Jiang, Y. Wang, Y. Li, L. Dai, N. Xu, J. Qiao, D. Ruan, Sep. Purif. Technol., 2024, 341, 126813. 27 Y. Wang B. Yu K. Liu X. Yang M. Liu T.-S. Chan X. Qiu J. Li W. Li J. Mater. Chem. A 8 2020 2131 2139 Y. Wang, B. Yu, K. Liu, X. Yang, M. Liu, T.-S. Chan, X. Qiu, J. Li, W. Li, J. Mater. Chem. A, 2020, 8, 2131–2139. 28 M. Zhang H. Li J. Chen F.X. Ma L. Zhen Z. Wen C.Y. Xu Adv. Funct. Mater. 33 2023 2370280 M. Zhang, H. Li, J. Chen, F. X. Ma, L. Zhen, Z. Wen, C. Y. Xu, Adv. Funct. Mater., 2023, 33, 2370280. 29 J. Zhu L. Huang F. Bao G. Chen K. Song Z. Wang H. Xia J. Gao Y. Song C. Zhu F. Lu T. Zheng M. Ji Mater. Rep. Energy 4 2024 100245 J. Zhu, L. Huang, F. Bao, G. Chen, K. Song, Z. Wang, H. Xia, J. Gao, Y. Song, C. Zhu, F. Lu, T. Zheng, M. Ji, Mater. Rep. Energy, 2024, 4, 100245. 30 B. Zhou N. Xu L. Wu D. Cai E.H. Yu J. Qiao Green Energy Environ. 9 2024 1835 1846 B. Zhou, N. Xu, L. Wu, D. Cai, E. H. Yu, J. Qiao, Green Energy Environ., 2024, 9, 1835–1846. 31 T. Lu N. Xu L. Guo B. Zhou L. Dai W. Yang G. Liu J.K. Lee J. Qiao Adv. Fiber Mater. 6 2024 1108 1121 T. Lu, N. Xu, L. Guo, B. Zhou, L. Dai, W. Yang, G. Liu, J. K. Lee, J. Qiao, Adv. Fiber Mater., 2024, 6, 1108–1121. 32 J. Wang W.H. Xuan Q. He J.X. Jiang Y.Y. Zhou Y. Nie Q. Liao M.H. Shao W. Ding Z.D. Wei J. Electrochem. 29 2023 2215003 J. Wang, W. H. Xuan, Q. He, J. X. Jiang, Y. Y. Zhou, Y. Nie, Q. Liao, M. H. Shao, W. Ding, Z. D. Wei, J. Electrochem., 2023, 29, 2215003. 33 X. Luo Z. Zheng B. Hou X. Xie C.C. Wang RSC Adv. 13 2023 18888 18897 X. Luo, Z. Zheng, B. Hou, X. Xie, C. C. Wang, RSC Adv., 2023, 13, 18888–18897. 34 K. Fu Y. Wang L. Mao X. Yang J. Jin S. Yang G. Li Chem. Eng. J. 351 2018 94 102 K. Fu, Y. Wang, L. Mao, X. Yang, J. Jin, S. Yang, G. Li, Chem. Eng. J., 2018, 351, 94–102. 35 W.-F. Wu J.-G. Fan Z.-H. Zhao J.-M. Pan J. Yang X. Yan Y. Zhan Chin. J. Catal. 60 2024 178 189 W.-F. Wu, J.-G. Fan, Z.-H. Zhao, J.-M. Pan, J. Yang, X. Yan, Y. Zhan, Chin. J. Catal., 2024, 60, 178–189. 36 S. Hu P. Qiao X. Liang G. Ba X. Zu H. Hu J. Ye D. Wang Appl. Catal. B 346 2024 123737 S. Hu, P. Qiao, X. Liang, G. Ba, X. Zu, H. Hu, J. Ye, D. Wang, Appl. Catal. B, 2024, 346, 123737. 37 X. Zhou D. Xu J. Huang S. Tong P. Qiao Z. Zhang Adv. Funct. Mater. 2418055 2024 1 8 X. Zhou, D. Xu, J. Huang, S. Tong, P. Qiao, Z. Zhang, Adv. Funct. Mater., 2024, 2418055, 1–8. 38 J.E. Park M.J. Kim M.S. Lim S.Y. Kang J.K. Kim S.H. Oh M. Her Y.H. Cho Y.E. Sung Appl. Catal. B 237 2018 140 148 J. E. Park, M. J. Kim, M. S. Lim, S. Y. Kang, J. K. Kim, S. H. Oh, M. Her, Y. H. Cho, Y. E. Sung, Appl. Catal. B, 2018, 237, 140–148. 39 J. Tian Q. Liu A.M. Asiri K.A. Alamry X. Sun ChemSusChem 7 2014 2125 2130 J. Tian, Q. Liu, A. M. Asiri, K. A. Alamry, X. Sun, ChemSusChem, 2014, 7, 2125–2130. 40 Z.G. Liu J. Zhao H. Yao X.X. He H. Zhang Y. Qiao X.Q. Wu L. Li S.L. Chou Chem. Sci. 15 2024 8478 8487 Z. G. Liu, J. Zhao, H. Yao, X. X. He, H. Zhang, Y. Qiao, X. Q. Wu, L. Li, S. L. Chou, Chem. Sci., 2024, 15, 8478–8487. 41 T. Wu M.Y. Han Z.J. Xu ACS Nano 16 2022 8531 8539 T. Wu, M. Y. Han, Z. J. Xu, ACS Nano, 2022, 16, 8531–8539. 42 K. Xiao X. Jiang S. Zeng J. Chen T. Hu K. Yuan Y. Chen Adv. Funct. Mater. 34 2024 2405830 K. Xiao, X. Jiang, S. Zeng, J. Chen, T. Hu, K. Yuan, Y. Chen, Adv. Funct. Mater., 2024, 34, 2405830. 43 G. Gan S. Fan X. Li J. Wang C. Bai X. Guo M. Tade S. Liu ACS Catal. 11 2021 14284 14292 G. Gan, S. Fan, X. Li, J. Wang, C. Bai, X. Guo, M. Tade, S. Liu, ACS Catal., 2021, 11, 14284–14292. 44 J.X. Flores-Lasluisa D. Cazorla-Amorós E. Morallón Nanomaterials 14 2024 1381 J. X. Flores-Lasluisa, D. Cazorla-Amorós, E. Morallón, Nanomaterials, 2024, 14, 1381. 45 T.H. Nguyen P.K.L. Tran D.T. Tran T.N. Pham N.H. Kim J.H. Lee Chem. Eng. J. 440 2022 135781 T. H. Nguyen, P. K. L. Tran, D. T. Tran, T. N. Pham, N. H. Kim, J. H. Lee, Chem. Eng. J., 2022, 440, 135781. 46 S. Biniak G. Szymański J. Siedlewski A. Świątkowski Carbon 35 1997 1799 1810 S. Biniak, G. Szymański, J. Siedlewski, A. Świątkowski, Carbon, 1997, 35, 1799–1810. 47 C.Y. Li R. Zhang X.J. Ba X.L. Jiang Y.Y. Yang J. Electrochem. 29 2023 2210241 C. Y. Li, R. Zhang, X. J. Ba, X. L. Jiang, Y. Y. Yang, J. Electrochem., 2023, 29, 2210241. 48 Y. Zhu Z. Zhang Z. Lei Y. Tan W. Wu S. Mu N. Cheng Carbon 167 2020 188 195 Y. Zhu, Z. Zhang, Z. Lei, Y. Tan, W. Wu, S. Mu, N. Cheng, Carbon, 2020, 167, 188–195. 49 F. Wang Y. Zhou S. Lin L. Yang Z. Hu D. Xie Nano Energy 78 2020 105128 F. Wang, Y. Zhou, S. Lin, L. Yang, Z. Hu, D. Xie, Nano Energy, 2020, 78, 105128. 50 X. Li F. Dong N. Xu T. Zhang K. Li J. Qiao ACS Appl. Mater. Interfaces 10 2018 15591 15601 X. Li, F. Dong, N. Xu, T. Zhang, K. Li, J. Qiao, ACS Appl. Mater. Interfaces, 2018, 10, 15591–15601. 51 J. Shi M. Fan J. Qiao Y. Liu Chem. Lett. 43 2014 1484 1486 J. Shi, M. Fan, J. Qiao, Y. Liu, Chem. Lett., 2014, 43, 1484–1486. 52 B. Ravel M. Newville J. Synchrotron Radiat. 12 2005 537 541 B. Ravel, M. Newville, J. Synchrotron Radiat., 2005, 12, 537–541. 53 S.I. Zabinsky J.J. Rehr A. Ankudinov R.C. Albers M.J. Eller Phys. Rev. B 52 1995 2995 3009 S. I. Zabinsky, J. J. Rehr, A. Ankudinov, R. C. Albers, M. J. Eller, Phys. Rev. B, 1995, 52, 2995–3009. 54 H. Funke A.C. Scheinost M. Chukalina Phys. Rev. B 71 2005 094110 H. Funke, A. C. Scheinost, M. Chukalina, Phys. Rev. B, 2005, 71, 094110. 55 Z. Li F. Liu C. Chen Y. Jiang P. Ni N. Song Y. Hu S. Xi M. Liang Y. Lu Nano Lett. 23 2023 1505 1513 Z. Li, F. Liu, C. Chen, Y. Jiang, P. Ni, N. Song, Y. Hu, S. Xi, M. Liang, Y. Lu, Nano Lett., 2023, 23, 1505–1513. 56 V. Reisecker F. Flatscher L. Porz C. Fincher J. Todt I. Hanghofer V. Hennige M. Linares-Moreau P. Falcaro S. Ganschow S. Wenner Y.-M. Chiang J. Keckes J. Fleig D. Rettenwander Nat. Commun. 14 2023 2432 V. Reisecker, F. Flatscher, L. Porz, C. Fincher, J. Todt, I. Hanghofer, V. Hennige, M. Linares-Moreau, P. Falcaro, S. Ganschow, S. Wenner, Y.-M. Chiang, J. Keckes, J. Fleig, D. Rettenwander, Nat. Commun., 2023, 14, 2432. 57 S.-Y. Ham H. Yang O. Nunez-cuacuas D.H.S. Tan Y.-T. Chen G. Deysher A. Cronk P. Ridley J.-M. Doux E.A. Wu J. Jang Y.S. Meng Energy Storage Mater. 55 2023 455 462 S.-Y. Ham, H. Yang, O. Nunez-cuacuas, D. H. S. Tan, Y.-T. Chen, G. Deysher, A. Cronk, P. Ridley, J.-M. Doux, E. A. Wu, J. Jang, Y. S. Meng, Energy Storage Mater., 2023, 55, 455–462. 58 Y. Chen R. Ren Z. Wen S. Ci J. Chang S. Mao J. Chen Nano Energy 47 2018 66 73 Y. Chen, R. Ren, Z. Wen, S. Ci, J. Chang, S. Mao, J. Chen, Nano Energy, 2018, 47, 66–73. 59 A. Hankin J.C. Alexander G.H. Kelsall Phys. Chem. Chem. Phys. 16 2014 16176 16186 A. Hankin, J. C. Alexander, G. H. Kelsall, Phys. Chem. Chem. Phys., 2014, 16, 16176–16186. 60 S. Harrison M. Hayne Sci. Rep. 7 2017 11638 S. Harrison, M. Hayne, Sci. Rep., 2017, 7, 11638. 61 S. Fu C. Peng Y. Luo L. Cheng X. Yang Z. Jiao J. Colloid Interface Sci. 664 2024 349 359 S. Fu, C. Peng, Y. Luo, L. Cheng, X. Yang, Z. Jiao, J. Colloid Interface Sci., 2024, 664, 349–359. 62 Z. Zhong P. Hansmann Phys. Rev. X 7 2017 011023 Z. Zhong, P. Hansmann, Phys. Rev. X, 2017, 7, 011023. 63 L. Tian X. Guan Y. Dong S. Zong A. Dai Z. Zhang L. Guo Environ. Chem. Lett. 21 2023 1257 1264 L. Tian, X. Guan, Y. Dong, S. Zong, A. Dai, Z. Zhang, L. Guo, Environ. Chem. Lett., 2023, 21, 1257–1264. 64 R. Ren G. Liu J.Y. Kim R.E.A. Ardhi M.X. Tran W. Yang J.K. Lee Appl. Catal. B 306 2022 121096 R. Ren, G. Liu, J. Y. Kim, R. E. A. Ardhi, M. X. Tran, W. Yang, J. K. Lee, Appl. Catal. B, 2022, 306, 121096. 65 Y. Ren D. Zeng W.J. Ong Chin. J. Catal. 40 2019 289 319 Y. Ren, D. Zeng, W. J. Ong, Chin. J. Catal., 2019, 40, 289–319. 66 H. Li B. Sun F. Yang Z. Wang Y. Xu G. Tian K. Pan B. Jiang W. Zhou RSC Adv. 9 2019 7870 7877 H. Li, B. Sun, F. Yang, Z. Wang, Y. Xu, G. Tian, K. Pan, B. Jiang, W. Zhou, RSC Adv., 2019, 9, 7870–7877. 67 Z. Yin R. He H. Xue J. Chen Y. Wang X. Ye N. Xu J. Qiao H. Huang Energy Mater. 2 2022 200021 Z. Yin, R. He, H. Xue, J. Chen, Y. Wang, X. Ye, N. Xu, J. Qiao, H. Huang, Energy Mater., 2022, 2, 200021.",
      "scopus-id": "105009791647",
      "coredata": {
        "eid": "1-s2.0-S1872206725647048",
        "dc:description": "The sluggish kinetics of the oxygen reduction reaction (ORR) and high over potential of oxygen evolution reaction (OER) are big challenges in the development of high-performance zinc-air batteries (ZABs) and fuel cells. In this work, we report a rational design and a simple fabrication strategy of a photo-enhanced Co single-atom catalyst (SAC) comprising g-C3N4 coupled with cobalt-nitrogen-doped hierarchical mesoporous carbon (Co-N/MPC), forming a staggered p-n heterojunction that effectively improves charge separation and enhances electrocatalytic activity. The incorporation of Co SACs and g-C3N4 synergistically optimizes the photogenerated electron-hole pair separation, significantly boosting the intrinsic ORR-OER duplex activity. Under illumination, g-C3N4@Co-N/MPC exhibits an outstanding ORR half-wave potential (E 1/2) of 0.841 V (vs. RHE) in 0.1 mol L–1 KOH and a low OER overpotential of 497.4 mV (vs. RHE) at 10 mA cm–2 in 1 mol L–1 KOH. Notably, the catalyst achieves an exceptional peak power density of 850.7 mW cm–2 in ZABs and of 411 mW cm–2 even in H2-air fuel cell. In addition, g-C3N4@Co-N/MPC-based ZABs also show remarkable cycling stability exceeding 250 h. The advanced photo-induced charge separation at the p-n heterojunction facilitates faster electron transfer kinetics, and the mass transport owing to hierarchical mesoporous structure of Co-N-C, thereby reducing the overpotential and enhancing the overall energy conversion efficiency. This work provides a new perspective on designing next-generation of single-atom dispersed oxygen reaction catalysts, paving the way for high-performance photo-enhanced energy storage and conversion systems.",
        "openArchiveArticle": "false",
        "prism:coverDate": "2025-06-30",
        "openaccessUserLicense": null,
        "prism:aggregationType": "Journal",
        "prism:url": "https://api.elsevier.com/content/article/pii/S1872206725647048",
        "dc:creator": [
          {
            "@_fa": "true",
            "$": "Wang, Zhaodi"
          },
          {
            "@_fa": "true",
            "$": "Zhang, Yang"
          },
          {
            "@_fa": "true",
            "$": "Zhang, Junxuan"
          },
          {
            "@_fa": "true",
            "$": "Xu, Nengneng"
          },
          {
            "@_fa": "true",
            "$": "Lu, Tuo"
          },
          {
            "@_fa": "true",
            "$": "Zhuang, Biyan"
          },
          {
            "@_fa": "true",
            "$": "Liu, Guicheng"
          },
          {
            "@_fa": "true",
            "$": "Yang, Woochul"
          },
          {
            "@_fa": "true",
            "$": "Lei, Hao"
          },
          {
            "@_fa": "true",
            "$": "Tian, Binglun"
          },
          {
            "@_fa": "true",
            "$": "Qiao, Jinli"
          }
        ],
        "link": [
          {
            "@_fa": "true",
            "@rel": "self",
            "@href": "https://api.elsevier.com/content/article/pii/S1872206725647048"
          },
          {
            "@_fa": "true",
            "@rel": "scidir",
            "@href": "https://www.sciencedirect.com/science/article/pii/S1872206725647048"
          }
        ],
        "dc:format": "application/json",
        "openaccessType": null,
        "pii": "S1872-2067(25)64704-8",
        "prism:volume": "73",
        "prism:publisher": "Dalian Institute of Chemical Physics, the Chinese Academy of Sciences. Published by Elsevier B.V. All rights are reserved, including those for text and data mining, AI training, and similar technologies.",
        "dc:title": "Photo-enhanced Co single-atom catalyst with a staggered p-n heterojunction: unraveling its high oxygen catalytic performance in zinc-air batteries and fuel cells",
        "prism:copyright": "Copyright © 2025 Dalian Institute of Chemical Physics, the Chinese Academy of Sciences. Published by Elsevier B.V. All rights are reserved, including those for text and data mining, AI training, and similar technologies.",
        "openaccess": "0",
        "prism:issn": "18722067",
        "dcterms:subject": [
          {
            "@_fa": "true",
            "$": "Co single-atom"
          },
          {
            "@_fa": "true",
            "$": "Hierarchical mesoporous carbon"
          },
          {
            "@_fa": "true",
            "$": "Photo-enhancement"
          },
          {
            "@_fa": "true",
            "$": "p-n Heterojunction"
          },
          {
            "@_fa": "true",
            "$": "Oxygen catalytic reaction"
          }
        ],
        "openaccessArticle": "false",
        "prism:publicationName": "Chinese Journal of Catalysis",
        "openaccessSponsorType": null,
        "prism:pageRange": "311-321",
        "prism:endingPage": "321",
        "pubType": "fla",
        "prism:coverDisplayDate": "June 2025",
        "prism:doi": "10.1016/S1872-2067(25)64704-8",
        "prism:startingPage": "311",
        "dc:identifier": "doi:10.1016/S1872-2067(25)64704-8",
        "openaccessSponsorName": null
      },
      "objects": {
        "object": [
          {
            "@category": "standard",
            "@height": "143",
            "@width": "301",
            "@_fa": "true",
            "$": "https://api.elsevier.com/content/object/eid/1-s2.0-S1872206725647048-fx1.jpg?httpAccept=%2A%2F%2A",
            "@multimediatype": "JPEG image file",
            "@type": "IMAGE-DOWNSAMPLED",
            "@size": "19123",
            "@ref": "fx1",
            "@mimetype": "image/jpeg"
          },
          {
            "@category": "standard",
            "@height": "366",
            "@width": "522",
            "@_fa": "true",
            "$": "https://api.elsevier.com/content/object/eid/1-s2.0-S1872206725647048-gr1.jpg?httpAccept=%2A%2F%2A",
            "@multimediatype": "JPEG image file",
            "@type": "IMAGE-DOWNSAMPLED",
            "@size": "84499",
            "@ref": "gr1",
            "@mimetype": "image/jpeg"
          },
          {
            "@category": "standard",
            "@height": "519",
            "@width": "638",
            "@_fa": "true",
            "$": "https://api.elsevier.com/content/object/eid/1-s2.0-S1872206725647048-gr2.jpg?httpAccept=%2A%2F%2A",
            "@multimediatype": "JPEG image file",
            "@type": "IMAGE-DOWNSAMPLED",
            "@size": "140367",
            "@ref": "gr2",
            "@mimetype": "image/jpeg"
          },
          {
            "@category": "standard",
            "@height": "536",
            "@width": "687",
            "@_fa": "true",
            "$": "https://api.elsevier.com/content/object/eid/1-s2.0-S1872206725647048-gr3.jpg?httpAccept=%2A%2F%2A",
            "@multimediatype": "JPEG image file",
            "@type": "IMAGE-DOWNSAMPLED",
            "@size": "151748",
            "@ref": "gr3",
            "@mimetype": "image/jpeg"
          },
          {
            "@category": "standard",
            "@height": "315",
            "@width": "579",
            "@_fa": "true",
            "$": "https://api.elsevier.com/content/object/eid/1-s2.0-S1872206725647048-gr4.jpg?httpAccept=%2A%2F%2A",
            "@multimediatype": "JPEG image file",
            "@type": "IMAGE-DOWNSAMPLED",
            "@size": "60144",
            "@ref": "gr4",
            "@mimetype": "image/jpeg"
          },
          {
            "@category": "standard",
            "@height": "456",
            "@width": "609",
            "@_fa": "true",
            "$": "https://api.elsevier.com/content/object/eid/1-s2.0-S1872206725647048-gr5.jpg?httpAccept=%2A%2F%2A",
            "@multimediatype": "JPEG image file",
            "@type": "IMAGE-DOWNSAMPLED",
            "@size": "104402",
            "@ref": "gr5",
            "@mimetype": "image/jpeg"
          },
          {
            "@category": "thumbnail",
            "@height": "104",
            "@width": "219",
            "@_fa": "true",
            "$": "https://api.elsevier.com/content/object/eid/1-s2.0-S1872206725647048-fx1.sml?httpAccept=%2A%2F%2A",
            "@multimediatype": "GIF image file",
            "@type": "IMAGE-THUMBNAIL",
            "@size": "8685",
            "@ref": "fx1",
            "@mimetype": "image/gif"
          },
          {
            "@category": "thumbnail",
            "@height": "154",
            "@width": "219",
            "@_fa": "true",
            "$": "https://api.elsevier.com/content/object/eid/1-s2.0-S1872206725647048-gr1.sml?httpAccept=%2A%2F%2A",
            "@multimediatype": "GIF image file",
            "@type": "IMAGE-THUMBNAIL",
            "@size": "20973",
            "@ref": "gr1",
            "@mimetype": "image/gif"
          },
          {
            "@category": "thumbnail",
            "@height": "164",
            "@width": "202",
            "@_fa": "true",
            "$": "https://api.elsevier.com/content/object/eid/1-s2.0-S1872206725647048-gr2.sml?httpAccept=%2A%2F%2A",
            "@multimediatype": "GIF image file",
            "@type": "IMAGE-THUMBNAIL",
            "@size": "15347",
            "@ref": "gr2",
            "@mimetype": "image/gif"
          },
          {
            "@category": "thumbnail",
            "@height": "164",
            "@width": "210",
            "@_fa": "true",
            "$": "https://api.elsevier.com/content/object/eid/1-s2.0-S1872206725647048-gr3.sml?httpAccept=%2A%2F%2A",
            "@multimediatype": "GIF image file",
            "@type": "IMAGE-THUMBNAIL",
            "@size": "15156",
            "@ref": "gr3",
            "@mimetype": "image/gif"
          },
          {
            "@category": "thumbnail",
            "@height": "119",
            "@width": "219",
            "@_fa": "true",
            "$": "https://api.elsevier.com/content/object/eid/1-s2.0-S1872206725647048-gr4.sml?httpAccept=%2A%2F%2A",
            "@multimediatype": "GIF image file",
            "@type": "IMAGE-THUMBNAIL",
            "@size": "8886",
            "@ref": "gr4",
            "@mimetype": "image/gif"
          },
          {
            "@category": "thumbnail",
            "@height": "164",
            "@width": "219",
            "@_fa": "true",
            "$": "https://api.elsevier.com/content/object/eid/1-s2.0-S1872206725647048-gr5.sml?httpAccept=%2A%2F%2A",
            "@multimediatype": "GIF image file",
            "@type": "IMAGE-THUMBNAIL",
            "@size": "13735",
            "@ref": "gr5",
            "@mimetype": "image/gif"
          },
          {
            "@category": "high",
            "@height": "633",
            "@width": "1333",
            "@_fa": "true",
            "$": "https://api.elsevier.com/content/object/eid/1-s2.0-S1872206725647048-fx1_lrg.jpg?httpAccept=%2A%2F%2A",
            "@multimediatype": "JPEG image file",
            "@type": "IMAGE-HIGH-RES",
            "@size": "172474",
            "@ref": "fx1",
            "@mimetype": "image/jpeg"
          },
          {
            "@category": "high",
            "@height": "973",
            "@width": "1386",
            "@_fa": "true",
            "$": "https://api.elsevier.com/content/object/eid/1-s2.0-S1872206725647048-gr1_lrg.jpg?httpAccept=%2A%2F%2A",
            "@multimediatype": "JPEG image file",
            "@type": "IMAGE-HIGH-RES",
            "@size": "494179",
            "@ref": "gr1",
            "@mimetype": "image/jpeg"
          },
          {
            "@category": "high",
            "@height": "1377",
            "@width": "1694",
            "@_fa": "true",
            "$": "https://api.elsevier.com/content/object/eid/1-s2.0-S1872206725647048-gr2_lrg.jpg?httpAccept=%2A%2F%2A",
            "@multimediatype": "JPEG image file",
            "@type": "IMAGE-HIGH-RES",
            "@size": "651549",
            "@ref": "gr2",
            "@mimetype": "image/jpeg"
          },
          {
            "@category": "high",
            "@height": "1422",
            "@width": "1824",
            "@_fa": "true",
            "$": "https://api.elsevier.com/content/object/eid/1-s2.0-S1872206725647048-gr3_lrg.jpg?httpAccept=%2A%2F%2A",
            "@multimediatype": "JPEG image file",
            "@type": "IMAGE-HIGH-RES",
            "@size": "669841",
            "@ref": "gr3",
            "@mimetype": "image/jpeg"
          },
          {
            "@category": "high",
            "@height": "836",
            "@width": "1539",
            "@_fa": "true",
            "$": "https://api.elsevier.com/content/object/eid/1-s2.0-S1872206725647048-gr4_lrg.jpg?httpAccept=%2A%2F%2A",
            "@multimediatype": "JPEG image file",
            "@type": "IMAGE-HIGH-RES",
            "@size": "233565",
            "@ref": "gr4",
            "@mimetype": "image/jpeg"
          },
          {
            "@category": "high",
            "@height": "1212",
            "@width": "1619",
            "@_fa": "true",
            "$": "https://api.elsevier.com/content/object/eid/1-s2.0-S1872206725647048-gr5_lrg.jpg?httpAccept=%2A%2F%2A",
            "@multimediatype": "JPEG image file",
            "@type": "IMAGE-HIGH-RES",
            "@size": "468036",
            "@ref": "gr5",
            "@mimetype": "image/jpeg"
          },
          {
            "@category": "standard",
            "@_fa": "true",
            "$": "https://api.elsevier.com/content/object/eid/1-s2.0-S1872206725647048-mmc1.pdf?httpAccept=%2A%2F%2A",
            "@multimediatype": "Acrobat PDF file",
            "@type": "APPLICATION",
            "@size": "3970166",
            "@ref": "mmc1",
            "@mimetype": "application/pdf"
          }
        ]
      },
      "link": {
        "@rel": "abstract",
        "@href": "https://api.elsevier.com/content/abstract/scopus_id/105009791647"
      }
    }
  }
}