{
  "metadata": {
    "title": "Novel materials and techniques for photocatalytic water splitting developed by Professor Kazunari Domen",
    "authors": "; ; ",
    "journal": "Chinese Journal of Catalysis",
    "date": "2025-01-31",
    "doi": "10.1016/S1872-2067(24)60152-X",
    "abstract": "",
    "uri": "https://api.elsevier.com/content/article/pii/S187220672460152X",
    "pii": "S187220672460152X"
  },
  "fulltext": {
    "full-text-retrieval-response": {
      "scopus-eid": "2-s2.0-85214326386",
      "originalText": "serial JL 273538 291210 291744 291809 31 Chinese Journal of Catalysis CHINESEJOURNALCATALYSIS 2025-01-09 2025-01-09 2025-01-09 2025-01-09 2025-01-09T15:56:16 1-s2.0-S187220672460152X S1872-2067(24)60152-X S187220672460152X 10.1016/S1872-2067(24)60152-X S300 S300.1 FULL-TEXT 1-s2.0-S1872206725X00024 2025-05-19T22:09:45.313544Z 0 0 20250101 20250131 2025 2025-01-09T17:21:34.21815Z absattachment articleinfo articletitlenorm authfirstinitialnorm authfirstsurnamenorm cid cids contenttype copyright crossmark dateloaded dateloadedtxt datesearch datesort dateupdated dco docsubtype doctype doi eid ewtransactionid hubeid indexeddate issn issnnorm itemstage itemtransactionid itemweight openaccess openarchive pg pgfirst pglast pii piinorm pubdateend pubdatestart pubdatetxt pubyr sortorder srctitle srctitlenorm srctype ssids alllist content subj subheadings suppl tomb volfirst volissue volumelist webpdf webpdfpagecount yearnav figure table body acknowledge affil articletitle auth authfirstini authfull authkeywords authlast footnotes primabst pubtype ref specialabst vitae 1872-2067 18722067 true 68 68 C Volume 68 1 1 50 1 50 202501 January 2025 2025-01-01 2025-01-31 2025 article rev Copyright © 2025 Dalian Institute of Chemical Physics, the Chinese Academy of Sciences. Published by Elsevier B.V. All rights are reserved, including those for text and data mining, AI training, and similar technologies. NOVELMATERIALSTECHNIQUESFORPHOTOCATALYTICWATERSPLITTINGDEVELOPEDBYPROFESSORKAZUNARIDOMEN WU Y 1 Introduction 2 Innovative materials for photocatalytic water splitting 2.1 Oxide photocatalysts 2.1.1 SrTiO3 2.1.2 Layered structure oxides 2.2 Visible-light-responsive photocatalysts 2.2.1 TaON0020and Ta3N5 2.2.2 d0-metal-based oxynitrides 2.2.3 d10-metal-based (oxy)nitrides 2.2.4 Oxysulfides 3 Advanced methodological strategies and techniques in photocatalysis 3.1 Cocatalyst modification 3.1.1 Deposition methods 3.1.2 Co-deposition of different cocatalysts 3.1.3 Surface modification for HEC 3.1.4 Two-component cocatalysts 3.2 Z-scheme system 3.2.1 Early works 3.2.2 Z-scheme water splitting using narrow bandgap semiconductors 3.3 Preparation/fabrication techniques 3.3.1 Synthesis methods 3.3.2 Particle transfer method 3.3.3 Film transfer method 3.3.4 Roll-press method 3.3.5 Photocatalyst sheets 3.3.6 Panel and solar H2 production farm 3.4 Spectroscopy characterizations 3.4.1 Infrared spectroscopy for catalysts 3.4.2 Sum-frequency generation spectroscopy 3.4.3 Mechanism research 4 International collaborations 5 Conclusions and outlooks Acknowledgements References GREEN 2016 23 34 M LEWIS 2006 15729 15735 N GOLDEMBERG 2000 J WORLDENERGYASSESSMENTENERGYCHALLENGESUSTAINABILITYOVERVIEW SHANER 2016 2354 2371 M CHUEH 2010 1797 1801 W MUHICH 2013 540 542 C GALVEZ 2008 3544 3550 M PIHOSH 2023 2301327 Y CHENG 2018 1795 1800 W SAKAI 2013 12313 12316 T HEYDUK 2001 1639 1641 A GOTO 2018 509 520 Y WANG 2016 611 615 Q JIA 2016 13237 J NISHIYAMA 2021 304 307 H MAEDA 2005 8286 8287 K MAEDA 2006 295 K WANG 2020 703 710 Q WANG 2021 9327 9335 S ARAKAWA 2000 145 152 H FUJISHIMA 1972 37 38 A LI 2015 2377 2382 R ROYER 2014 10292 10368 S DOMEN 1980 543 544 K DOMEN 1982 433 434 K DOMEN 1982 3657 3661 K DOMEN 1986 92 98 K KIBRIA 2013 7886 7893 M KIBRIA 2014 3825 M QI 2018 579 585 Y LIU 2023 e202304694 M DING 2021 808 816 Q ANDERSEN 1990 137 146 J AVUDAITHAI 1987 641 650 M KUDO 1988 296 301 A WAGNER 1980 462 474 F LIU 1986 101 109 W TAKATA 2009 19386 19388 T YANG 2008 638 641 H LI 2013 1432 R HAM 2016 3027 3033 Y CHIANG 2018 2782 2788 T YAMAKATA 2015 168 175 A ZHAO 2019 1385 1395 Z DOMEN 1986 292 295 K TAKATA 2020 411 414 T DOMEN 1986 356 357 K OSHIMA 2015 2698 2702 T TAKATA 1997 1063 1064 T KUDO 1989 337 352 A LAGALY 1976 1513 1518 G DOMEN 1986 1706 1707 K KUDO 1988 67 76 A DOMEN 1993 479 486 K DOMEN 1990 77 84 K EBINA 2005 17212 17216 Y TAKATA 1997 45 49 T IKEDA 1998 72 77 S ABE 2013 16872 16884 R NISHIOKA 2022 eadc9115 S KASAHARA 2003 791 797 A ZONG 2008 7176 7177 X YANG 2012 151 157 J KUDO 2007 104 110 A LIU 2010 831 843 G ASAI 2014 2543 2546 R IWASE 2021 10331 10334 A JANSEN 2000 980 982 M PAN 2022 265 297 Z ULTRATHINOXIDELAYERSFORSOLARELECTROCATALYTICSYSTEMS LI 2022 10179 10185 H NISHIMAE 2023 6299 6310 S XU 2015 7191 7194 J LIU 2024 10561 10567 X HIGASHI 2008 1315 1321 M ARAI 2006 796 797 N LIU 2022 14637 14646 K MAEDA 2010 4096 4099 K MAEDA 2010 7750 7759 K MAEDA 2006 7806 7809 K XIONG 2014 325 328 A SATO 2005 4150 4151 J LEE 2006 17563 17569 Y THAMINIMULLA 2000 362 365 C SAYAMA 1990 541 547 K PAN 2015 2955 2959 C PAN 2016 4544 4552 C PAN 2016 1854 1862 C CHEN 2023 3839 3843 K SHEARER 2020 112757 C WANG 2018 756 763 Z XIAO 2022 e202116573 J WANG 2019 827 832 Q MAEDA 2013 4986 4991 K LEE 2007 2120 2127 Y LEE 2006 1042 1048 Y WANG 2008 134 136 X HITOKI 2002 1698 1699 G YASHIMA 2007 588 593 M HITOKI 2002 736 737 G CHUN 2003 1798 1803 W TAKATA 2007 13 25 T MA 2012 19993 19996 S MAEDA 2008 927 937 K SEO 2015 12780 12783 J XIAO 2021 10059 10064 J CHEN 2015 8498 8501 S QI 2024 193 203 Y QI 2022 484 Y NURLAELA 2016 18 E CHEN 2016 77 83 S CHEN 2015 3047 3051 S DONG 2019 1808185 B TAKATA 2016 31 37 T KASAHARA 2002 6750 6753 A YASHIMA 2010 4704 4706 M ZHANG 2012 8348 8351 F HISATOMI 2018 3918 3925 T MATSUKAWA 2014 1038 1041 M HIGASHI 2008 120 123 M HIGASHI 2009 1543 1549 M MATOBA 2011 14731 14735 T LUO 2020 255 261 Y WANG 2021 1005 Z XIAO 2023 8030 J SIRITANARATKUL 2011 74 78 B MISEKI 2009 306 314 Y HISATOMI 2013 3595 3599 T INOUE 2009 364 386 Y MAEDA 2007 4749 4755 K MAEDA 2007 1004 1010 K ARAI 2007 407 413 N MAEDA 2007 7851 7861 K MAEDA 2005 20504 20510 K MAEDA 2008 198 204 K NAKAMURA 1998 956 961 S TSUKAZAKI 2005 42 46 A SCHULZ 1977 815 819 H GARCIAMARTINEZ 1993 442 449 O YOSHIDA 2010 15510 15515 M TESSIER 2009 8526 8531 F KAMATA 2009 90 94 K GAO 2003 154 158 L ABE 2004 954 955 R ISHIKAWA 2002 13547 13553 A YASHIMA 2008 291 298 M LI 2013 376 382 R ZHANG 2010 7313 7315 F ZHANG 2012 253 258 F ZHANG 2011 1 7 F MA 2018 13492 13499 G ZHAO 2014 12051 12056 W LIN 2024 397 L ISHIKAWA 2004 2637 2642 A MA 2016 3892 3896 G LIN 2024 1612 1620 L NAKABAYASHI 2023 7887 7893 M ZHANG 2024 4068 4077 J MEIGNEN 2004 2810 2817 V SUZUKI 2012 15475 15481 T MA 2015 4302 4305 G SONG 2019 1906 1910 Z XIAO 2021 27485 27492 Q SUN 2018 1690 1696 S NANDY 2023 1641 1651 S CHEN 2023 3285 3294 S KATAYAMA 2010 275 278 M LIU 2014 2239 2242 J MA 2015 4513 4518 G LIU 2016 4848 4854 J KRAEUTLER 1978 4317 4318 B MAEDA 2010 5858 5868 K ZHOU 2015 29076 29097 N YOSHIDA 2023 e202312938 H PAN 2021 230 236 Z GRIMM 2012 23569 23576 R LI 2018 1704179 D PAN 2019 850 864 Z YOSHIDA 2009 10151 10157 M CHOWDHURY 2018 1707 F MA 2012 8390 S CHEN 2018 8238 8262 R MU 2016 2463 2469 L LIU 2011 6763 G PAN 2011 2133 2137 J KATO 2001 4285 4292 H ISHIHARA 1999 1 3 T MULLER 1899 469 473 E ENDRODI 2017 108 122 B QURESHI 2017 8079 8088 M HOFFMANN 1995 69 96 M TAKATA 2015 9627 9634 T MAEDA 2006 303 308 K GODIN 2018 7546 7555 R MAEDA 2006 13107 13112 K NAKAMURA 2015 1001 1003 A WANG 2020 919 985 Q ABE 2011 1000 1030 R WANG 2018 5201 5241 Y KUDO 2011 32 38 A BARD 1979 59 75 A SAYAMA 1997 387 391 K SAYAMA 2001 2416 2417 K ABE 2001 339 344 R ABE 2005 16052 16061 R OHNO 1997 6415 6419 T ABE 2005 3829 3831 R ABE 2011 228 237 R HIGASHI 2007 138 139 M SASAKI 2009 17536 17542 Y IWASE 2011 11054 11057 A LIN 2024 14829 14834 L PAN 2016 7188 7196 Z WANG 2015 308 315 Q WANG 2017 1675 1683 Q WANG 2018 2667 2680 Q CHEN 2021 10633 10641 S ISHIKAWA 2003 4442 4446 A PAN 2021 225 234 Z LIN 2023 e202310607 L NODA 2008 5361 5367 Y WANG 2013 11252 11256 D WANG 2014 4144 4150 Q PAN 2016 26 33 Z PAN 2024 e202414628 Z KAKIHANA 2000 27 31 M KAKIHANA 2009 857 862 M IWASHINA 2011 13272 13275 K ITO 2007 603 612 S FAN 2007 893 897 S HIGASHI 2012 6968 6971 M MAEDA 2011 12334 12337 K ABE 2005 1162 1163 R HIGASHI 2011 4138 4147 M MINEGISHI 2013 1120 1124 T WARREN 2013 842 849 S UEDA 2015 2227 2230 K HIGASHI 2013 10238 10241 M ZHONG 2015 5053 5060 M ZHONG 2016 9858 9864 M LI 2013 125 131 Y PINAUD 2014 1576 1582 B LIU 2016 1327 1334 G LI 2013 2566 Y HARA 2003 13441 13445 M WANG 2016 5821 5826 C WANG 2016 13837 13843 C XIAO 2019 19407 19414 X WANG 2016 4391 4399 Z JIA 2014 1513 1519 Q EBIHARA 2021 3716 M WANG 2017 491 504 Q WANG 2022 633 641 Q PAN 2016 7011 7019 Z ANDREI 2022 3376 3386 V PINAUD 2013 1983 B EISCHENS 1958 1 56 R LITTLE 1967 279C L MARUYA 2006 667 671 K ARAI 2006 349 353 T LI 1989 1451 1461 C LI 1989 929 943 C KINOSHITA 1986 2269 2276 N SAKATA 1987 2765 2772 Y SAKATA 1989 711 714 Y WAKABAYASHI 1993 10761 10768 F WAKABAYASHI 1995 10573 10580 F WAKABAYASHI 1995 14805 14812 F WAKABAYASHI 1996 4154 4159 F KONDO 2005 10969 10972 J KONDO 2010 20107 20113 J VANSANTEN 1995 637 660 R DOMEN 1987 5288 5289 K DOMEN 1987 1484 1487 K HUANG 1994 3973 3981 J SHEN 2006 1140 1154 Y AKAMATSU 1991 175 178 N YAMAMOTO 1997 4734 4744 H KUBOTA 2007 17 27 J BANDARA 1998 5951 5954 A CHABAL 1988 211 357 Y CHUANG 1983 1 105 T HEILWEIL 1989 143 171 E KUBOTA 1993 273 276 J FUJINO 1996 279 288 T NOGUCHI 2005 17217 17223 H ESCHENBACHER 2023 1202 1216 R YAMAKATA 1999 73 82 A ENDO 2001 1573 1577 M KUBOTA 1997 548 551 J CHEN 2008 12477 12485 J SCHWARZ 2017 28317 28327 M CHEN 2009 4580 4581 J YOSHIDA 2009 13218 13219 M LU 2011 23902 23907 X SAMJESKE 2009 10222 10228 G YAMAKATA 2014 23897 23906 A COOPER 2018 20642 20652 J YAMAKATA 2011 11351 11357 A YAMAKATA 2003 14383 14387 A YAMAKATA 2001 7258 7262 A LIU 2022 1034 T PAN 2022 14727 14734 Z NANDAL 2020 9194 9201 V PIHOSH 2020 1519 1530 Y PIHOSH 2020 2492 2497 Y NANDAL 2021 4038 4047 V NANDAL 2021 7055 V HIGASHI 2023 e202204058 T MURTHY 2023 2302064 D CHUGENJI 2022 17485 17495 T LEI 2006 322 329 Z LIU 2004 2192 2193 M KIM 2013 2681 J KIM 2013 5375 5383 E KIM 2016 61 66 J WANG 2009 76 80 X WANG 2009 1680 1681 X ZHANG 2010 441 444 J ZHANG 2011 675 678 J DIONIGI 2012 26 31 F DIONIGI 2011 2937 2942 F MOSS 2021 511 517 B XIAO 2022 7769 Y FU 2022 729 J XIAO 2020 932 940 Y LI 2023 e202313537 R LI 2022 24247 24257 R CHEN 2011 3 16 Z MAEDA 2010 2655 2661 K FENG 2022 2200180 C WANG 2014 5234 5244 H DALLE 2019 2752 2875 K HUTTON 2016 16722 16730 G LI 2023 80 88 Z ZHANG 2023 2200180 Y ZANG 2023 24618 24628 Z HOU 2024 1342 M GAO 2024 6268 6278 Y MTANGI 2015 4916 4922 W WUX2025X1 WUX2025X1X50 WUX2025X1XY WUX2025X1X50XY 2027-01-09T00:00:00.000Z http://vtw.elsevier.com/content/oragreement/15789 NR_JUSTICE publishAcceptedManuscriptIndexable http://www.elsevier.com/open-access/userlicense/1.0/ 2027-01-09T00:00:00.000Z http://creativecommons.org/licenses/by-nc-nd/4.0/ item S1872-2067(24)60152-X S187220672460152X 1-s2.0-S187220672460152X 10.1016/S1872-2067(24)60152-X 273538 2025-05-19T22:09:45.313544Z 2025-01-01 2025-01-31 1-s2.0-S187220672460152X-main.pdf https://s3-eu-west-1.amazonaws.com/prod-ucs-content-store-eu-west/content/pii:S187220672460152X/MAIN/application/pdf/44d258c927253b6e14cab76565ede923/main.pdf main.pdf pdf true 4895938 MAIN 50 1-s2.0-S187220672460152X-main_1.png https://s3-eu-west-1.amazonaws.com/prod-ucs-content-store-eu-west/content/pii:S187220672460152X/PREVIEW/image/png/1bfa51137c6284d5e831dc57dee11843/main_1.png main_1.png png 49963 849 656 IMAGE-WEB-PDF 1 1-s2.0-S187220672460152X-fx1.jpg https://s3-eu-west-1.amazonaws.com/prod-ucs-content-store-eu-west/content/pii:S187220672460152X/fx1/DOWNSAMPLED/image/jpeg/f648831aeef50a51badcf6a4751e7a33/fx1.jpg fx1 true fx1.jpg jpg 35525 245 274 IMAGE-DOWNSAMPLED 1-s2.0-S187220672460152X-fx2.jpg https://s3-eu-west-1.amazonaws.com/prod-ucs-content-store-eu-west/content/pii:S187220672460152X/fx2/DOWNSAMPLED/image/jpeg/febf8e2d5f1e7e826e76fda49c472364/fx2.jpg fx2 fx2.jpg jpg 9198 182 148 IMAGE-DOWNSAMPLED 1-s2.0-S187220672460152X-fx3.jpg https://s3-eu-west-1.amazonaws.com/prod-ucs-content-store-eu-west/content/pii:S187220672460152X/fx3/MAIN/image/jpeg/68156f9e3c123ae34624a27be4071409/fx3.jpg fx3 fx3.jpg jpg 13157 190 143 IMAGE-DOWNSAMPLED 1-s2.0-S187220672460152X-gr1.jpg https://s3-eu-west-1.amazonaws.com/prod-ucs-content-store-eu-west/content/pii:S187220672460152X/gr1/DOWNSAMPLED/image/jpeg/f071c6c35c1567ff343a7cffa2affeaa/gr1.jpg gr1 gr1.jpg jpg 62638 479 605 IMAGE-DOWNSAMPLED 1-s2.0-S187220672460152X-gr10.jpg https://s3-eu-west-1.amazonaws.com/prod-ucs-content-store-eu-west/content/pii:S187220672460152X/gr10/DOWNSAMPLED/image/jpeg/4606bd3e47ddc6784312d06698a0b1d2/gr10.jpg gr10 gr10.jpg jpg 93657 618 632 IMAGE-DOWNSAMPLED 1-s2.0-S187220672460152X-gr11.jpg https://s3-eu-west-1.amazonaws.com/prod-ucs-content-store-eu-west/content/pii:S187220672460152X/gr11/DOWNSAMPLED/image/jpeg/42e45f7dcd1b3e3796250c3bcd49c360/gr11.jpg gr11 gr11.jpg jpg 63190 473 632 IMAGE-DOWNSAMPLED 1-s2.0-S187220672460152X-gr12.jpg https://s3-eu-west-1.amazonaws.com/prod-ucs-content-store-eu-west/content/pii:S187220672460152X/gr12/DOWNSAMPLED/image/jpeg/c3947aff306cdb7cc3e90ef7339fd14b/gr12.jpg gr12 gr12.jpg jpg 68103 447 563 IMAGE-DOWNSAMPLED 1-s2.0-S187220672460152X-gr13.jpg https://s3-eu-west-1.amazonaws.com/prod-ucs-content-store-eu-west/content/pii:S187220672460152X/gr13/DOWNSAMPLED/image/jpeg/16d3f7b5dddc2c7fadc706d58bd2bfb5/gr13.jpg gr13 gr13.jpg jpg 49476 398 513 IMAGE-DOWNSAMPLED 1-s2.0-S187220672460152X-gr14.jpg https://s3-eu-west-1.amazonaws.com/prod-ucs-content-store-eu-west/content/pii:S187220672460152X/gr14/DOWNSAMPLED/image/jpeg/5455f2edf3c7b9cdcdaff6b81ff27bdd/gr14.jpg gr14 gr14.jpg jpg 70070 411 762 IMAGE-DOWNSAMPLED 1-s2.0-S187220672460152X-gr15.jpg https://s3-eu-west-1.amazonaws.com/prod-ucs-content-store-eu-west/content/pii:S187220672460152X/gr15/DOWNSAMPLED/image/jpeg/c2c655667eb90f1d0a955e384272096c/gr15.jpg gr15 gr15.jpg jpg 21143 194 369 IMAGE-DOWNSAMPLED 1-s2.0-S187220672460152X-gr16.jpg https://s3-eu-west-1.amazonaws.com/prod-ucs-content-store-eu-west/content/pii:S187220672460152X/gr16/DOWNSAMPLED/image/jpeg/71d672fb300aa5b3341f978a6d11e61a/gr16.jpg gr16 gr16.jpg jpg 74260 500 646 IMAGE-DOWNSAMPLED 1-s2.0-S187220672460152X-gr17.jpg https://s3-eu-west-1.amazonaws.com/prod-ucs-content-store-eu-west/content/pii:S187220672460152X/gr17/DOWNSAMPLED/image/jpeg/4f572a9de812ed90da7f09e683929a34/gr17.jpg gr17 gr17.jpg jpg 79529 496 576 IMAGE-DOWNSAMPLED 1-s2.0-S187220672460152X-gr18.jpg https://s3-eu-west-1.amazonaws.com/prod-ucs-content-store-eu-west/content/pii:S187220672460152X/gr18/DOWNSAMPLED/image/jpeg/7dabeab733f39a0a6aaf82ed64b839bc/gr18.jpg gr18 gr18.jpg jpg 68966 551 523 IMAGE-DOWNSAMPLED 1-s2.0-S187220672460152X-gr19.jpg https://s3-eu-west-1.amazonaws.com/prod-ucs-content-store-eu-west/content/pii:S187220672460152X/gr19/DOWNSAMPLED/image/jpeg/b17c45c0e444b04ea31ee91bfca1cf64/gr19.jpg gr19 gr19.jpg jpg 148947 763 742 IMAGE-DOWNSAMPLED 1-s2.0-S187220672460152X-gr2.jpg https://s3-eu-west-1.amazonaws.com/prod-ucs-content-store-eu-west/content/pii:S187220672460152X/gr2/DOWNSAMPLED/image/jpeg/18aba6b4c64512b4be1341a47a736720/gr2.jpg gr2 gr2.jpg jpg 19565 215 339 IMAGE-DOWNSAMPLED 1-s2.0-S187220672460152X-gr20.jpg https://s3-eu-west-1.amazonaws.com/prod-ucs-content-store-eu-west/content/pii:S187220672460152X/gr20/DOWNSAMPLED/image/jpeg/07584769d8662ce99868acd4fcd8f095/gr20.jpg gr20 gr20.jpg jpg 56679 276 595 IMAGE-DOWNSAMPLED 1-s2.0-S187220672460152X-gr21.jpg https://s3-eu-west-1.amazonaws.com/prod-ucs-content-store-eu-west/content/pii:S187220672460152X/gr21/DOWNSAMPLED/image/jpeg/a3f586aa3c3739ed55c2aa937418e8bf/gr21.jpg gr21 gr21.jpg jpg 59428 271 603 IMAGE-DOWNSAMPLED 1-s2.0-S187220672460152X-gr22.jpg https://s3-eu-west-1.amazonaws.com/prod-ucs-content-store-eu-west/content/pii:S187220672460152X/gr22/DOWNSAMPLED/image/jpeg/450022bc386a0fc449fcc4b0d543614e/gr22.jpg gr22 gr22.jpg jpg 44134 234 744 IMAGE-DOWNSAMPLED 1-s2.0-S187220672460152X-gr23.jpg https://s3-eu-west-1.amazonaws.com/prod-ucs-content-store-eu-west/content/pii:S187220672460152X/gr23/DOWNSAMPLED/image/jpeg/1e88e0b569cd7a019dfc1e9267d4c98b/gr23.jpg gr23 gr23.jpg jpg 83013 608 577 IMAGE-DOWNSAMPLED 1-s2.0-S187220672460152X-gr24.jpg https://s3-eu-west-1.amazonaws.com/prod-ucs-content-store-eu-west/content/pii:S187220672460152X/gr24/DOWNSAMPLED/image/jpeg/a6105131474c0969e109129a07107787/gr24.jpg gr24 gr24.jpg jpg 72052 581 363 IMAGE-DOWNSAMPLED 1-s2.0-S187220672460152X-gr25.jpg https://s3-eu-west-1.amazonaws.com/prod-ucs-content-store-eu-west/content/pii:S187220672460152X/gr25/DOWNSAMPLED/image/jpeg/1a2f68a5ae36c15a77d6c642ed769593/gr25.jpg gr25 gr25.jpg jpg 49739 643 368 IMAGE-DOWNSAMPLED 1-s2.0-S187220672460152X-gr26.jpg https://s3-eu-west-1.amazonaws.com/prod-ucs-content-store-eu-west/content/pii:S187220672460152X/gr26/DOWNSAMPLED/image/jpeg/22100d14e8ab768edd089578ead4bc83/gr26.jpg gr26 gr26.jpg jpg 63263 503 508 IMAGE-DOWNSAMPLED 1-s2.0-S187220672460152X-gr27.jpg https://s3-eu-west-1.amazonaws.com/prod-ucs-content-store-eu-west/content/pii:S187220672460152X/gr27/DOWNSAMPLED/image/jpeg/82dd1047e7456d58f50785902fc0ead0/gr27.jpg gr27 gr27.jpg jpg 50114 518 354 IMAGE-DOWNSAMPLED 1-s2.0-S187220672460152X-gr28.jpg https://s3-eu-west-1.amazonaws.com/prod-ucs-content-store-eu-west/content/pii:S187220672460152X/gr28/DOWNSAMPLED/image/jpeg/4052a3200200298375c0aaff5560109a/gr28.jpg gr28 gr28.jpg jpg 77835 470 502 IMAGE-DOWNSAMPLED 1-s2.0-S187220672460152X-gr3.jpg https://s3-eu-west-1.amazonaws.com/prod-ucs-content-store-eu-west/content/pii:S187220672460152X/gr3/DOWNSAMPLED/image/jpeg/a46aafb2a3d2b94ebb81027d875c2cc6/gr3.jpg gr3 gr3.jpg jpg 86949 471 676 IMAGE-DOWNSAMPLED 1-s2.0-S187220672460152X-gr4.jpg https://s3-eu-west-1.amazonaws.com/prod-ucs-content-store-eu-west/content/pii:S187220672460152X/gr4/DOWNSAMPLED/image/jpeg/8e8b4337b59506f1cbf5570168b13882/gr4.jpg gr4 gr4.jpg jpg 83036 233 771 IMAGE-DOWNSAMPLED 1-s2.0-S187220672460152X-gr5.jpg https://s3-eu-west-1.amazonaws.com/prod-ucs-content-store-eu-west/content/pii:S187220672460152X/gr5/DOWNSAMPLED/image/jpeg/bdb44a63ed0d5f6c7c6c5b0823a418da/gr5.jpg gr5 gr5.jpg jpg 66550 285 768 IMAGE-DOWNSAMPLED 1-s2.0-S187220672460152X-gr6.jpg https://s3-eu-west-1.amazonaws.com/prod-ucs-content-store-eu-west/content/pii:S187220672460152X/gr6/DOWNSAMPLED/image/jpeg/1d8f8b95d721e62a2f00889d55914d37/gr6.jpg gr6 gr6.jpg jpg 124752 537 688 IMAGE-DOWNSAMPLED 1-s2.0-S187220672460152X-gr7.jpg https://s3-eu-west-1.amazonaws.com/prod-ucs-content-store-eu-west/content/pii:S187220672460152X/gr7/DOWNSAMPLED/image/jpeg/0b8f5620f5d107861ec5848086b3d199/gr7.jpg gr7 gr7.jpg jpg 64334 205 672 IMAGE-DOWNSAMPLED 1-s2.0-S187220672460152X-gr8.jpg https://s3-eu-west-1.amazonaws.com/prod-ucs-content-store-eu-west/content/pii:S187220672460152X/gr8/DOWNSAMPLED/image/jpeg/339d2fcac1bcb5e22c2373968decfb0f/gr8.jpg gr8 gr8.jpg jpg 52770 384 516 IMAGE-DOWNSAMPLED 1-s2.0-S187220672460152X-gr9.jpg https://s3-eu-west-1.amazonaws.com/prod-ucs-content-store-eu-west/content/pii:S187220672460152X/gr9/DOWNSAMPLED/image/jpeg/323297c9af1bc3f4135eebe37d49d276/gr9.jpg gr9 gr9.jpg jpg 85916 483 674 IMAGE-DOWNSAMPLED 1-s2.0-S187220672460152X-fx1.sml https://s3-eu-west-1.amazonaws.com/prod-ucs-content-store-eu-west/content/pii:S187220672460152X/fx1/THUMBNAIL/image/gif/c764f8f25f013116ac1300ced88ffc95/fx1.sml fx1 true fx1.sml sml 20149 163 183 IMAGE-THUMBNAIL 1-s2.0-S187220672460152X-fx2.sml https://s3-eu-west-1.amazonaws.com/prod-ucs-content-store-eu-west/content/pii:S187220672460152X/fx2/THUMBNAIL/image/gif/41d26aaed8bc3772a5217e88cbeb3ffe/fx2.sml fx2 fx2.sml sml 14953 164 133 IMAGE-THUMBNAIL 1-s2.0-S187220672460152X-fx3.sml https://s3-eu-west-1.amazonaws.com/prod-ucs-content-store-eu-west/content/pii:S187220672460152X/fx3/THUMBNAIL/image/gif/6bd907e616d06b5bda540694d814e39c/fx3.sml fx3 fx3.sml sml 17209 164 123 IMAGE-THUMBNAIL 1-s2.0-S187220672460152X-gr1.sml https://s3-eu-west-1.amazonaws.com/prod-ucs-content-store-eu-west/content/pii:S187220672460152X/gr1/THUMBNAIL/image/gif/44967c0769272e01e6969528f67d498e/gr1.sml gr1 gr1.sml sml 11595 164 207 IMAGE-THUMBNAIL 1-s2.0-S187220672460152X-gr10.sml https://s3-eu-west-1.amazonaws.com/prod-ucs-content-store-eu-west/content/pii:S187220672460152X/gr10/THUMBNAIL/image/gif/7e85396584d0459a96639ef67f757490/gr10.sml gr10 gr10.sml sml 10456 164 168 IMAGE-THUMBNAIL 1-s2.0-S187220672460152X-gr11.sml https://s3-eu-west-1.amazonaws.com/prod-ucs-content-store-eu-west/content/pii:S187220672460152X/gr11/THUMBNAIL/image/gif/bc290e476ab2558e1f82ad63e009117f/gr11.sml gr11 gr11.sml sml 11923 164 219 IMAGE-THUMBNAIL 1-s2.0-S187220672460152X-gr12.sml https://s3-eu-west-1.amazonaws.com/prod-ucs-content-store-eu-west/content/pii:S187220672460152X/gr12/THUMBNAIL/image/gif/7bf96807aa590aa82dda30d0bf7398b8/gr12.sml gr12 gr12.sml sml 16598 164 206 IMAGE-THUMBNAIL 1-s2.0-S187220672460152X-gr13.sml https://s3-eu-west-1.amazonaws.com/prod-ucs-content-store-eu-west/content/pii:S187220672460152X/gr13/THUMBNAIL/image/gif/34f67af4faf0faf64f292cd86ec9b8cb/gr13.sml gr13 gr13.sml sml 10492 164 211 IMAGE-THUMBNAIL 1-s2.0-S187220672460152X-gr14.sml https://s3-eu-west-1.amazonaws.com/prod-ucs-content-store-eu-west/content/pii:S187220672460152X/gr14/THUMBNAIL/image/gif/995b1e85d7a532a5eab81f8678685735/gr14.sml gr14 gr14.sml sml 6939 118 219 IMAGE-THUMBNAIL 1-s2.0-S187220672460152X-gr15.sml https://s3-eu-west-1.amazonaws.com/prod-ucs-content-store-eu-west/content/pii:S187220672460152X/gr15/THUMBNAIL/image/gif/74060001a3961703ff6c60c1e75b619a/gr15.sml gr15 gr15.sml sml 7228 115 219 IMAGE-THUMBNAIL 1-s2.0-S187220672460152X-gr16.sml https://s3-eu-west-1.amazonaws.com/prod-ucs-content-store-eu-west/content/pii:S187220672460152X/gr16/THUMBNAIL/image/gif/7783e83a1f96885f380d98fdc7263751/gr16.sml gr16 gr16.sml sml 11721 164 212 IMAGE-THUMBNAIL 1-s2.0-S187220672460152X-gr17.sml https://s3-eu-west-1.amazonaws.com/prod-ucs-content-store-eu-west/content/pii:S187220672460152X/gr17/THUMBNAIL/image/gif/5bc2b50928e690850aba093fbb196105/gr17.sml gr17 gr17.sml sml 9871 164 190 IMAGE-THUMBNAIL 1-s2.0-S187220672460152X-gr18.sml https://s3-eu-west-1.amazonaws.com/prod-ucs-content-store-eu-west/content/pii:S187220672460152X/gr18/THUMBNAIL/image/gif/e94ca69b77a96c4a084587ac96a230ed/gr18.sml gr18 gr18.sml sml 8296 163 155 IMAGE-THUMBNAIL 1-s2.0-S187220672460152X-gr19.sml https://s3-eu-west-1.amazonaws.com/prod-ucs-content-store-eu-west/content/pii:S187220672460152X/gr19/THUMBNAIL/image/gif/754813de7a0f4bc581397f025ccfc7eb/gr19.sml gr19 gr19.sml sml 9052 164 159 IMAGE-THUMBNAIL 1-s2.0-S187220672460152X-gr2.sml https://s3-eu-west-1.amazonaws.com/prod-ucs-content-store-eu-west/content/pii:S187220672460152X/gr2/THUMBNAIL/image/gif/cd4b88cd610d5622334150ca6d4548d9/gr2.sml gr2 gr2.sml sml 9697 139 219 IMAGE-THUMBNAIL 1-s2.0-S187220672460152X-gr20.sml https://s3-eu-west-1.amazonaws.com/prod-ucs-content-store-eu-west/content/pii:S187220672460152X/gr20/THUMBNAIL/image/gif/b68ecbc592b5595c8ccf6b87f0d36b40/gr20.sml gr20 gr20.sml sml 9910 102 219 IMAGE-THUMBNAIL 1-s2.0-S187220672460152X-gr21.sml https://s3-eu-west-1.amazonaws.com/prod-ucs-content-store-eu-west/content/pii:S187220672460152X/gr21/THUMBNAIL/image/gif/2ddb78c721265ab07ae55dd6e3a00c95/gr21.sml gr21 gr21.sml sml 8958 98 219 IMAGE-THUMBNAIL 1-s2.0-S187220672460152X-gr22.sml https://s3-eu-west-1.amazonaws.com/prod-ucs-content-store-eu-west/content/pii:S187220672460152X/gr22/THUMBNAIL/image/gif/30106fae201d587e21b2e0f10cdc3e5b/gr22.sml gr22 gr22.sml sml 5408 69 219 IMAGE-THUMBNAIL 1-s2.0-S187220672460152X-gr23.sml https://s3-eu-west-1.amazonaws.com/prod-ucs-content-store-eu-west/content/pii:S187220672460152X/gr23/THUMBNAIL/image/gif/75d767372e8f14de914fdfba748d0e9b/gr23.sml gr23 gr23.sml sml 9733 164 156 IMAGE-THUMBNAIL 1-s2.0-S187220672460152X-gr24.sml https://s3-eu-west-1.amazonaws.com/prod-ucs-content-store-eu-west/content/pii:S187220672460152X/gr24/THUMBNAIL/image/gif/daf063f4ee8021723345b779ee02fd04/gr24.sml gr24 gr24.sml sml 10995 163 102 IMAGE-THUMBNAIL 1-s2.0-S187220672460152X-gr25.sml https://s3-eu-west-1.amazonaws.com/prod-ucs-content-store-eu-west/content/pii:S187220672460152X/gr25/THUMBNAIL/image/gif/0100e90ae316fae37eb65434a1e0a3d2/gr25.sml gr25 gr25.sml sml 5009 164 94 IMAGE-THUMBNAIL 1-s2.0-S187220672460152X-gr26.sml https://s3-eu-west-1.amazonaws.com/prod-ucs-content-store-eu-west/content/pii:S187220672460152X/gr26/THUMBNAIL/image/gif/5be68c1269a8d89834e4d270c9b969f4/gr26.sml gr26 gr26.sml sml 9291 163 165 IMAGE-THUMBNAIL 1-s2.0-S187220672460152X-gr27.sml https://s3-eu-west-1.amazonaws.com/prod-ucs-content-store-eu-west/content/pii:S187220672460152X/gr27/THUMBNAIL/image/gif/686cf906004c0f89748faa98b238cc82/gr27.sml gr27 gr27.sml sml 7113 164 112 IMAGE-THUMBNAIL 1-s2.0-S187220672460152X-gr28.sml https://s3-eu-west-1.amazonaws.com/prod-ucs-content-store-eu-west/content/pii:S187220672460152X/gr28/THUMBNAIL/image/gif/aba1a56a9e66922fbe7ea11df8c337db/gr28.sml gr28 gr28.sml sml 10637 164 175 IMAGE-THUMBNAIL 1-s2.0-S187220672460152X-gr3.sml https://s3-eu-west-1.amazonaws.com/prod-ucs-content-store-eu-west/content/pii:S187220672460152X/gr3/THUMBNAIL/image/gif/d38ff7348fec61f64a8993627b422507/gr3.sml gr3 gr3.sml sml 16436 153 219 IMAGE-THUMBNAIL 1-s2.0-S187220672460152X-gr4.sml https://s3-eu-west-1.amazonaws.com/prod-ucs-content-store-eu-west/content/pii:S187220672460152X/gr4/THUMBNAIL/image/gif/6c73e4ef676ca57308c9bd85e5bbf1a3/gr4.sml gr4 gr4.sml sml 7801 66 219 IMAGE-THUMBNAIL 1-s2.0-S187220672460152X-gr5.sml https://s3-eu-west-1.amazonaws.com/prod-ucs-content-store-eu-west/content/pii:S187220672460152X/gr5/THUMBNAIL/image/gif/c57ab482df9fb244ea8fc834a9ddaa39/gr5.sml gr5 gr5.sml sml 7177 81 219 IMAGE-THUMBNAIL 1-s2.0-S187220672460152X-gr6.sml https://s3-eu-west-1.amazonaws.com/prod-ucs-content-store-eu-west/content/pii:S187220672460152X/gr6/THUMBNAIL/image/gif/fd0ff8f2aa1ce5290490bce681b9d818/gr6.sml gr6 gr6.sml sml 15806 164 210 IMAGE-THUMBNAIL 1-s2.0-S187220672460152X-gr7.sml https://s3-eu-west-1.amazonaws.com/prod-ucs-content-store-eu-west/content/pii:S187220672460152X/gr7/THUMBNAIL/image/gif/55bb39ea1e1ab8fd521e8c15f32cc968/gr7.sml gr7 gr7.sml sml 8937 67 219 IMAGE-THUMBNAIL 1-s2.0-S187220672460152X-gr8.sml https://s3-eu-west-1.amazonaws.com/prod-ucs-content-store-eu-west/content/pii:S187220672460152X/gr8/THUMBNAIL/image/gif/54857ba585b90569f0abda8b71ac1857/gr8.sml gr8 gr8.sml sml 13562 163 219 IMAGE-THUMBNAIL 1-s2.0-S187220672460152X-gr9.sml https://s3-eu-west-1.amazonaws.com/prod-ucs-content-store-eu-west/content/pii:S187220672460152X/gr9/THUMBNAIL/image/gif/e38c777be6423c22bf8a15345e19f470/gr9.sml gr9 gr9.sml sml 11437 157 219 IMAGE-THUMBNAIL 1-s2.0-S187220672460152X-fx1_lrg.jpg https://s3-eu-west-1.amazonaws.com/prod-ucs-content-store-eu-west/content/pii:S187220672460152X/HIGHRES/image/jpeg/26ef7f0ccb310af284bf2431eb833f3b/fx1_lrg.jpg fx1 true fx1_lrg.jpg jpg 169393 651 729 IMAGE-HIGH-RES 1-s2.0-S187220672460152X-fx2_lrg.jpg https://s3-eu-west-1.amazonaws.com/prod-ucs-content-store-eu-west/content/pii:S187220672460152X/HIGHRES/image/jpeg/f1a24bf9941b8ef5e8ad10aa2d762aee/fx2_lrg.jpg fx2 fx2_lrg.jpg jpg 41754 485 394 IMAGE-HIGH-RES 1-s2.0-S187220672460152X-fx3_lrg.jpg https://s3-eu-west-1.amazonaws.com/prod-ucs-content-store-eu-west/content/pii:S187220672460152X/HIGHRES/image/jpeg/a830d5fff83cedaffc5ae81ac6a7ef10/fx3_lrg.jpg fx3 fx3_lrg.jpg jpg 77610 508 382 IMAGE-HIGH-RES 1-s2.0-S187220672460152X-gr1_lrg.jpg https://s3-eu-west-1.amazonaws.com/prod-ucs-content-store-eu-west/content/pii:S187220672460152X/HIGHRES/image/jpeg/95f1a52def6dc46cb0f1a2cdf8144bbd/gr1_lrg.jpg gr1 gr1_lrg.jpg jpg 272248 1274 1608 IMAGE-HIGH-RES 1-s2.0-S187220672460152X-gr10_lrg.jpg https://s3-eu-west-1.amazonaws.com/prod-ucs-content-store-eu-west/content/pii:S187220672460152X/HIGHRES/image/jpeg/76268e972000d461456273faf1c752f8/gr10_lrg.jpg gr10 gr10_lrg.jpg jpg 406560 1642 1680 IMAGE-HIGH-RES 1-s2.0-S187220672460152X-gr11_lrg.jpg https://s3-eu-west-1.amazonaws.com/prod-ucs-content-store-eu-west/content/pii:S187220672460152X/HIGHRES/image/jpeg/083b48957a303ac367f864637687a817/gr11_lrg.jpg gr11 gr11_lrg.jpg jpg 283659 1256 1679 IMAGE-HIGH-RES 1-s2.0-S187220672460152X-gr12_lrg.jpg https://s3-eu-west-1.amazonaws.com/prod-ucs-content-store-eu-west/content/pii:S187220672460152X/HIGHRES/image/jpeg/0cfbf8ce694dd7b240164a92e1668731/gr12_lrg.jpg gr12 gr12_lrg.jpg jpg 294312 1188 1495 IMAGE-HIGH-RES 1-s2.0-S187220672460152X-gr13_lrg.jpg https://s3-eu-west-1.amazonaws.com/prod-ucs-content-store-eu-west/content/pii:S187220672460152X/HIGHRES/image/jpeg/9789ea1465e0e768aa7e771297520a03/gr13_lrg.jpg gr13 gr13_lrg.jpg jpg 194137 1058 1364 IMAGE-HIGH-RES 1-s2.0-S187220672460152X-gr14_lrg.jpg https://s3-eu-west-1.amazonaws.com/prod-ucs-content-store-eu-west/content/pii:S187220672460152X/HIGHRES/image/jpeg/145a8b276119709ff0476d44d12720f3/gr14_lrg.jpg gr14 gr14_lrg.jpg jpg 267279 1093 2024 IMAGE-HIGH-RES 1-s2.0-S187220672460152X-gr15_lrg.jpg https://s3-eu-west-1.amazonaws.com/prod-ucs-content-store-eu-west/content/pii:S187220672460152X/HIGHRES/image/jpeg/56a35faa3912381957a3db761b27a957/gr15_lrg.jpg gr15 gr15_lrg.jpg jpg 72308 515 980 IMAGE-HIGH-RES 1-s2.0-S187220672460152X-gr16_lrg.jpg https://s3-eu-west-1.amazonaws.com/prod-ucs-content-store-eu-west/content/pii:S187220672460152X/DOWNSAMPLED/image/jpeg/394d0b7bc6d9634d546c87ea9c968f59/gr16_lrg.jpg gr16 gr16_lrg.jpg jpg 298245 1330 1717 IMAGE-HIGH-RES 1-s2.0-S187220672460152X-gr17_lrg.jpg https://s3-eu-west-1.amazonaws.com/prod-ucs-content-store-eu-west/content/pii:S187220672460152X/PUBMED/image/jpeg/8bc3c08397bd159e7248ff1ded5b99aa/gr17_lrg.jpg gr17 gr17_lrg.jpg jpg 272416 1319 1531 IMAGE-HIGH-RES 1-s2.0-S187220672460152X-gr18_lrg.jpg https://s3-eu-west-1.amazonaws.com/prod-ucs-content-store-eu-west/content/pii:S187220672460152X/HIGHRES/image/jpeg/5509f3db21fca3ef598c278cfa3682fd/gr18_lrg.jpg gr18 gr18_lrg.jpg jpg 312115 1464 1390 IMAGE-HIGH-RES 1-s2.0-S187220672460152X-gr19_lrg.jpg https://s3-eu-west-1.amazonaws.com/prod-ucs-content-store-eu-west/content/pii:S187220672460152X/HIGHRES/image/jpeg/cc6b3f68ae8ddd6efa728897602d93f7/gr19_lrg.jpg gr19 gr19_lrg.jpg jpg 622536 2027 1970 IMAGE-HIGH-RES 1-s2.0-S187220672460152X-gr2_lrg.jpg https://s3-eu-west-1.amazonaws.com/prod-ucs-content-store-eu-west/content/pii:S187220672460152X/HIGHRES/image/jpeg/1b51640cdf2e0fdab5c32c725f54a299/gr2_lrg.jpg gr2 gr2_lrg.jpg jpg 77180 570 900 IMAGE-HIGH-RES 1-s2.0-S187220672460152X-gr20_lrg.jpg https://s3-eu-west-1.amazonaws.com/prod-ucs-content-store-eu-west/content/pii:S187220672460152X/HIGHRES/image/jpeg/6b9f7a7a4790e6c4494848e6b5c6cd46/gr20_lrg.jpg gr20 gr20_lrg.jpg jpg 233501 733 1581 IMAGE-HIGH-RES 1-s2.0-S187220672460152X-gr21_lrg.jpg https://s3-eu-west-1.amazonaws.com/prod-ucs-content-store-eu-west/content/pii:S187220672460152X/HIGHRES/image/jpeg/3952a9f6d3d07dfe8e786ac196a2cdf5/gr21_lrg.jpg gr21 gr21_lrg.jpg jpg 267073 720 1603 IMAGE-HIGH-RES 1-s2.0-S187220672460152X-gr22_lrg.jpg https://s3-eu-west-1.amazonaws.com/prod-ucs-content-store-eu-west/content/pii:S187220672460152X/HIGHRES/image/jpeg/f245f3dee53849145417d95498178d35/gr22_lrg.jpg gr22 gr22_lrg.jpg jpg 174083 622 1976 IMAGE-HIGH-RES 1-s2.0-S187220672460152X-gr23_lrg.jpg https://s3-eu-west-1.amazonaws.com/prod-ucs-content-store-eu-west/content/pii:S187220672460152X/HIGHRES/image/jpeg/ca73fc3f2cc5c3e0bda65e3cdfef8986/gr23_lrg.jpg gr23 gr23_lrg.jpg jpg 359068 1613 1532 IMAGE-HIGH-RES 1-s2.0-S187220672460152X-gr24_lrg.jpg https://s3-eu-west-1.amazonaws.com/prod-ucs-content-store-eu-west/content/pii:S187220672460152X/HIGHRES/image/jpeg/71bfde243426d1e2c51542d965c2914a/gr24_lrg.jpg gr24 gr24_lrg.jpg jpg 322289 1544 965 IMAGE-HIGH-RES 1-s2.0-S187220672460152X-gr25_lrg.jpg https://s3-eu-west-1.amazonaws.com/prod-ucs-content-store-eu-west/content/pii:S187220672460152X/HIGHRES/image/jpeg/9ac617458ef96f2d3949b0af00125e31/gr25_lrg.jpg gr25 gr25_lrg.jpg jpg 173842 1707 977 IMAGE-HIGH-RES 1-s2.0-S187220672460152X-gr26_lrg.jpg https://s3-eu-west-1.amazonaws.com/prod-ucs-content-store-eu-west/content/pii:S187220672460152X/HIGHRES/image/jpeg/49c8e17cadda2606d9a160710bcb57ae/gr26_lrg.jpg gr26 gr26_lrg.jpg jpg 261430 1336 1349 IMAGE-HIGH-RES 1-s2.0-S187220672460152X-gr27_lrg.jpg https://s3-eu-west-1.amazonaws.com/prod-ucs-content-store-eu-west/content/pii:S187220672460152X/HIGHRES/image/jpeg/f6ac8e56ce7372ae024d7d18cbdbfe3e/gr27_lrg.jpg gr27 gr27_lrg.jpg jpg 199418 1376 941 IMAGE-HIGH-RES 1-s2.0-S187220672460152X-gr28_lrg.jpg https://s3-eu-west-1.amazonaws.com/prod-ucs-content-store-eu-west/content/pii:S187220672460152X/HIGHRES/image/jpeg/5e8fa27a2f527a26835c18a42ba7db95/gr28_lrg.jpg gr28 gr28_lrg.jpg jpg 314432 1249 1333 IMAGE-HIGH-RES 1-s2.0-S187220672460152X-gr3_lrg.jpg https://s3-eu-west-1.amazonaws.com/prod-ucs-content-store-eu-west/content/pii:S187220672460152X/HIGHRES/image/jpeg/f1fcbd062cd25a2f4492dcd8dfd3f012/gr3_lrg.jpg gr3 gr3_lrg.jpg jpg 435902 1253 1797 IMAGE-HIGH-RES 1-s2.0-S187220672460152X-gr4_lrg.jpg https://s3-eu-west-1.amazonaws.com/prod-ucs-content-store-eu-west/content/pii:S187220672460152X/HIGHRES/image/jpeg/e981e98dfc593bfc1c5b4702a7612c37/gr4_lrg.jpg gr4 gr4_lrg.jpg jpg 374978 619 2048 IMAGE-HIGH-RES 1-s2.0-S187220672460152X-gr5_lrg.jpg https://s3-eu-west-1.amazonaws.com/prod-ucs-content-store-eu-west/content/pii:S187220672460152X/HIGHRES/image/jpeg/f1ba0331fea04f1b0e40c7e8950a9df4/gr5_lrg.jpg gr5 gr5_lrg.jpg jpg 272005 756 2039 IMAGE-HIGH-RES 1-s2.0-S187220672460152X-gr6_lrg.jpg https://s3-eu-west-1.amazonaws.com/prod-ucs-content-store-eu-west/content/pii:S187220672460152X/HIGHRES/image/jpeg/c9b073bf7b18a39cd6ff654c1397349d/gr6_lrg.jpg gr6 gr6_lrg.jpg jpg 553552 1427 1828 IMAGE-HIGH-RES 1-s2.0-S187220672460152X-gr7_lrg.jpg https://s3-eu-west-1.amazonaws.com/prod-ucs-content-store-eu-west/content/pii:S187220672460152X/HIGHRES/image/jpeg/085fbb7353a4b98d6c9dcdace5aabd02/gr7_lrg.jpg gr7 gr7_lrg.jpg jpg 285209 545 1786 IMAGE-HIGH-RES 1-s2.0-S187220672460152X-gr8_lrg.jpg https://s3-eu-west-1.amazonaws.com/prod-ucs-content-store-eu-west/content/pii:S187220672460152X/HIGHRES/image/jpeg/28716b200c8ea13d3eeea8d01a99da63/gr8_lrg.jpg gr8 gr8_lrg.jpg jpg 219621 1020 1372 IMAGE-HIGH-RES 1-s2.0-S187220672460152X-gr9_lrg.jpg https://s3-eu-west-1.amazonaws.com/prod-ucs-content-store-eu-west/content/pii:S187220672460152X/HIGHRES/image/jpeg/b27bb7fea1ba2077e02607db0388ae0b/gr9_lrg.jpg gr9 gr9_lrg.jpg jpg 345947 1284 1790 IMAGE-HIGH-RES 1-s2.0-S187220672460152X-am.pdf am am.pdf pdf 4935177 AAM-PDF https://s3-eu-west-1.amazonaws.com/prod-ucs-content-store-eu-west/content/egi:106BH8CWHP0/MAIN/application/pdf/4c107cb84490f803228deb1ed540a428/am.pdf CHNJC 60152 S1872-2067(24)60152-X 10.1016/S1872-2067(24)60152-X Dalian Institute of Chemical Physics, the Chinese Academy of Sciences Fig. 1 Three most studied routes for solar hydrogen production via water splitting: photocatalytic (PC), photoelectrochemical (PEC), and photovoltaic-driven electrocatalytic (PV-E) processes. Fig. 2 Diagram showing photocatalytic water splitting to produce H2 and O2 based on one-step excitation. CB: conduction band; VB: valence band; HEC: H2 evolution cocatalyst; OEC: O2 evolution cocatalyst. Fig. 3 SEM images of SrTiO3 particles: (a) SrTiO3 (STO) (pristine), (b) SrTiO3 synthesized in yttria crucibles using SrCl2 as flux (flux-Y), and (c) SrTiO3 synthesized in alumina crucibles using SrCl2 as flux (flux-Al). (d) Water splitting activities of various SrTiO3 photocatalysts. Reaction conditions: 0.1 g catalyst, Rh2−y Cr y O3 as the cocatalyst (Rh 0.1 wt%, Cr 0.1 wt%), 300 W Xe lamp irradiation (λ > 300 nm). Reprinted with permission from Ref. [41]. Copyright 2016, The Royal Society of Chemistry. (e) Schematic energy diagrams for SrTiO3 and SrTiO3:Al, illustrating the effect of Al3+ on Ti3+ sites and electron/hole recombination. Reprinted with permission from Ref. [44]. Copyright 2019, The Royal Society of Chemistry. Fig. 4 Structural illustration of (a) K4Nb6O17 with a typical layered structure. (b) Spatially separated reaction sites on Rb2La2Ti3O10. Reproduced with permission from Ref. [49]. Copyright 1997, American Chemical Society. (c) Illustration of the charge transfer mechanism in K4Nb6O17 layered structure with the incorporation of confined cocatalysts, permitting the desired HER and impeding the unfavorable backward reaction. Reproduced with permission from Ref. [50]. Copyright 1989, Academic Press Inc. Fig. 5 Band diagrams of representative photocatalysts developed by the Domen team. Fig. 6 (a) Refined crystal structure of the TaON photocatalyst. Brown, red, and gray spheres denote Ta, O, and N atoms, respectively. Reprinted with permission from Ref. [98]. Copyright 2007, American Chemical Society. (b) Schematic band structures of Ta2O5, TaON, and Ta3N5. Reproduced with permission from Ref. [100]. Copyright 2003, American Chemical Society. (c) Colorized and magnified annular dark field scanning transmission electron microscopy (ADF-STEM) images of a Ta3N5 nanorod in Ta3N5/KTaO3 viewed from the [001] direction of the Ta3N5. (d) Time courses of gas evolution during overall water splitting over Rh/Cr2O3-modified Ta3N5/KTaO3 under simulated sunlight irradiation (AM 1.5G, 100 mW/cm2). Reprinted with permission from Ref. [90]. Copyright 2018, Springer Nature Limited. Fig. 7 (a) Unit-cell for the Imma LaTiO2N crystal structure. (b) Total and partial density of states for LaTiO2N computed from DFT calculations. Left-to-right: Refined crystal structure, maximum-entropy method computed electron-density and DFT calculated valence electron-density distributions for LaTiO2N on bc plane (c) and ac plane (d). Reprinted with permission from Ref. [115]. Copyright 2010, The Royal Society of Chemistry. Fig. 8 (a) Flux-assisted synthesis procedure for BaTaO2N synthesis of the obtained BaTaO2N (BTON) crystals, with insets showing the SEM image, TEM image, and selected area electron diffraction (SAED) patterns. XRD patterns (b) and the H2 evolution rates (c) of BTON prepared using various flux agents: BTON (KCl), BTON (RbCl), BTON (CsCl), and BTON (BaCl2). Reaction conditions: 0.1 wt% Pt-modified BTON 0.1 g; ultrapure water 150 mL; 10 vol% CH3OH; 300 W Xe lamp (λ > 420 nm). Reprinted with permission from Ref. [122]. Copyright 2020, American Chemical Society. Fig. 9 Powder XRD patterns (a) and UV-visible diffuse reflectance spectra (b) for (Ga1–x Zn x )(N1–x O x ) solid solutions (x = 0–1). Reprinted with permission from Ref. [132]. Copyright 2007, American Chemical Society. (c) Schematic band structures of GaN and (Ga1–x Zn x )(N1–x O x ) with x = 0.05−0.22. Reproduced with permission from Ref. [133]. Copyright 2005, American Chemical Society. (d) Time course of overall water splitting under visible light (λ > 400 nm) over the photocatalyst RuO2/(Ga1−x Zn x )(N1−x O x ) before (left) and after (right) post-calcination. Reprinted with permission from Ref. [134]. Copyright 2008, Elsevier Inc. Fig. 10 Crystal structure (a), band dispersion and density of states (b), SEM image (c), and UV-visible diffuse reflectance spectra (d) for Sm2Ti2S2O5. Reprinted with permission from Ref. [144]. Copyright 2002, American Chemical Society. Fig. 11 (a) SEM image of prepared Y2Ti2S2O5 powder. (b) UV-visible diffuse reflectance spectra and photograph for Y2Ti2S2O5. (c) Schematic band structure diagram for Y2Ti2S2O5. (d) Time course of overall water splitting on Cr2O3/Rh/IrO2-modified Y2Ti2S2O5 in distilled water buffered by La2O3 (pH = 8.5) under simulated sunlight (AM 1.5G). Reprinted with permission from Ref. [92]. Copyright 2019, Springer Nature Limited. Fig. 12 TEM images of GaN:ZnO modified with Rh/Cr2O3 (core/shell) (a) and Mn3O4 (b) nanoparticles. (c) The mechanism for visible-light-driven overall water splitting on Mn3O4 and Rh/Cr2O3 modified GaN:ZnO solid solution. (d) Time courses of the gas production using modified GaN:ZnO under visible light irradiation (λ > 420 nm). Rh, Cr, and Mn loading amounts: 0.75 wt%, 0.31 wt%, and 0.05 wt%, respectively. Reprinted with permission from Ref. [77]. Copyright 2010, Wiley-VCH Verlag GmbH & Co. KGaA, Weinheim. Fig. 13 (a) Mechanism of the optimized HER and OER cocatalysts modification for SrTiO3:Al photocatalyst. (b) A photograph of Rh(0.1 wt%)/Cr2O3(0.05 wt%)/CoOOH(0.05 wt%) loaded SrTiO3:Al. (c) Comparison of the H2 and O2 evolution on SrTiO3:Al with various modifications during photoirradiation. Left, loaded with Rh(0.1 wt%)/Cr2O3(0.05 wt%) by two-step photodeposition. Middle, loaded with Rh(0.1 wt%)/Cr2O3(0.05 wt%)/CoOOH(0.05 wt%) by three-step photodeposition. Right, loaded with Rh(0.1 wt%)-Cr(0.1 wt%) oxide by co-impregnation. (d) Ultraviolet-visible diffuse reflectance spectrum of bare SrTiO3:Al (black solid line) and the wavelength dependence of EQE during water splitting on Rh/Cr2O3/CoOOH-loaded SrTiO3:Al (red dots). Reprinted with permission from Ref. [46]. Copyright 2020, Springer Nature Limited. Fig. 14 Schematic reaction mechanism of photocatalytic overall water splitting on photocatalysts modified with (a) NiO, (b) core/shell Cr2O3/Rh cocatalysts, and (c) a-TiO2/Rh2–y Cr y O3. Fig. 15 Gas evolution during water splitting on (a) Rh2–y Cr y O3/ LaMg1/3Ta2/3O2N and (b) a-TiO2/Rh2–y Cr y O3/LaMg1/3Ta2/3O2N. Reprinted with permission from Ref. [85]. Copyright 2015, Wiley-VCH Verlag GmbH & Co. KGaA, Weinheim. Fig. 16 (a) Schematic illustration of Z-scheme water splitting, incorporating an HEP, an OEP, and a redox shuttle. (b) Schematic illustration of Z-scheme water splitting comprising Pt/ZrO2/TaON as HEP, Pt/WO3 as OEP, and IO3 −/I− as the redox mediator, showing the forward and suppressed backward electron transfer pathways in this configuration. Fig. 17 (a) Schematic diagram for a Z-scheme system using reduced graphene oxide (RGO) as the solid-state electron mediator combining the Cr2O3/Pt/IrO2/Sm2Ti2O5S2 HEP and CoO x /BiVO4 OEP. (b) AQY values of the Z-scheme system under 8.5 and 9.0 kPa Ar background pressure at different wavelengths along with the DRS data for the Sm2Ti2O5S2 and BiVO4. (c) Time courses of gas evolution from the Z-scheme system over time at different Ar background pressures, under light irradiation produced by an AM 1.5G solar simulator. Reprinted with permission from Ref. [152]. Copyright 2024, Springer Nature Limited. Fig. 18 (a) Preparation processes of core/shell SiO2|Ta3N5 photocatalyst with spatially separated cocatalysts. Time-dependent photocatalytic performance under visible light (λ > 420 nm) in the presence of sacrificial reagents: H2 evolution in 20 vol% methanol solution (b) and O2 evolution in 0.02 mol/L silver nitrate medium (c). TPS and TS represents Ta3N5/Pt|SiO2 and Ta3N5|SiO2 core/shells, respectively. Reprinted with permission from Ref. [221]. Copyright 2013, John Wiley & Sons, Ltd. Fig. 19 Illustration showing the preparation of (a) a photoelectrode and (b) a photocatalyst sheet using the particle transfer method, and photoelectrodes prepared using (c) the film transfer method and (d) the roll-pressing method, and a photocatalyst sheet using (e) the screen-printing method. Fig. 20 (a) I-E curve of a Co/BaTaO2N|Ta|Ti photoelectrode prepared by particle transfer, under simulated AM 1.5G light in 0.2 mol/L potassium phosphate aqueous solution (pH adjusted to 13). The applied potential was swept at +10 mV/s under intermittent irradiation with a period of 2 s. (b) I-t curve of the Co/BaTaO2N|Ta|Ti photoelectrode at 0.8 V vs. RHE under simulated AM 1.5G light, with CrO x -coated Pt mesh as the counter electrode. Reprinted with permission from Ref. [236]. Copyright 2015, American Chemical Society. Fig. 21 (a) Time course of gas evolution of the Ta3N5(570 nm)|Ta|Ti photoanode held at 1.23 V vs. RHE and a Pt counter electrode, respectively, under simulated AM 1.5G light. Solid lines denote the total charges estimated from the photocurrent. Reprinted with permission from Ref. [245]. Copyright 2016, The Royal Society of Chemistry. (b) Current-potential curves obtained from Ta3N5|Ta|Ti and Ta3N5|NbN x |Ta|Ti photoelectrodes with different NbN x interlayer thicknesses (KPi, 0.5 mol/L, pH 13, AM 1.5G light). Reprinted with permission from Ref. [246]. Copyright 2016, The Royal Society of Chemistry. Fig. 22 (a) The schematic of overall water splitting on the Ru-modified SrTiO3:La,Rh|Au|BiVO4:Mo sheet. (b) Time courses of the evolved gases for overall water splitting on a Cr2O3/Ru-modified SrTiO3:La,Rh|Au|BiVO4:Mo sheet under simulated sunlight (AM 1.5G) at 288 K and 5 kPa (open symbols) and 331 K and 10 kPa (closed symbols). Reprinted with permission from Ref. [13]. Copyright 2016, Macmillan Publishers Limited. Fig. 23 (a) Schematics of 1 × 1 m water splitting panel containing nine photocatalyst sheets in size of 33 × 33 cm2. (b) A photocatalyst sheets each 33 × 33 cm2. Reaction time courses of 5 × 5 cm2 SrTiO3:Al panel loaded with Rh2−y Cr y O3 and CoO y with the light source of (c) 300 W Xe lamp (λ = 300–500 nm) and (d) simulated sunlight (AM 1.5G). Reprinted with permission from Ref. [12]. Copyright 2017, Elsevier Inc. Fig. 24 (a) A photographic image of a panel reactor unit (625 cm2). (b) An overhead view of the 100-m2 solar hydrogen production system consisting of 1600-panel reactor units (625 cm2 each unit) and a hut housing a gas separation facility (yellow box). (c) The variations of solar illumination intensity (red) and the gas evolution rate in the water-splitting panel reactor (grey). Reprinted with permission from Ref. [15]. Copyright 2021, Springer Nature Limited. Fig. 25 IR spectra of ethanol adsorbed on mordenite at 453 K immediately following ethanol adsorption (a) and 10 min later (b). (c) Mechanisms of intermediate investigation (in green) and ethanol dehydration process (in yellow) on zeolites. Reproduced with permission from Ref. [269]. Copyright 2005, American Chemical Society. Fig. 26 (a) Schematic of time-resolved SFG spectroscopy. (b) The non-resonant pulses excite the electrons of the metal substrate directly, leading to a high transient electronic temperature over a few picoseconds. Reproduced with permission from Ref. [278]. Copyright 2007, Springer-Verlag. (c) An energy scheme was postulated to reveal the laser-induced transformation of different types of formate on the NiO(111) surface, thereby inducing the temperature jump. Reprinted with permission from Ref. [279]. Copyright 1998, American Chemical Society. Fig. 27 Pressure-dependent IRA spectra of ethylene adsorbed on bare Pt(111) at 150 K (a–c) and of ethylidyne-covered Pt(111) at 150 K (d−f). (g,h) IRA spectra on Pt(111) at 150 K in the presence of a 1:1 mixture of ethylene and hydrogen. The indicated pressure is the partial pressure of ethylene. Reproduced with permission from Ref. [289]. Copyright 1997, Elsevier Science B.V. Fig. 28 (a) Schematic illustration of optical geometry and spectro-electrochemical cell for in situ ATR-SEIRAS measurements. (b) Potential-dependent SEIRA spectra of adsorbed CO on Pt Cocatalyst. Reprinted with permission from Ref. [293]. Copyright 2009, American Chemical Society. (c) Schematic illustration of charge-carrier behavior over CoO x -loaded LaTiO2N and the corresponding Femtosecond to second time-resolved visible to mid-infrared absorption spectra (d). Reprinted with permission from Ref. [296]. Copyright 2014, American Chemical Society. Table 1 Overview of solar fuel systems: Key technical attributes and challenges. Approach Advantage Challenge Example STH Ref. Natural photosynthesis high scalability low efficiency plants and algae typically < 0.5% Two-step thermochemical reactions lower reaction temperature compared to direct thermolysis; flexible reoxidation timing, performed at night or as needed precise control of reaction conditions low efficiency porous monolithic CeO2 in an advanced solar-cavity receiver reactor maximum 0.7% for over 500 cycles [5] PV-E high efficiency simple to optimize use of commercial materials high cost complex structure relatively low scalability InGaP/GaAs/GaInNAsSb solar cell + polymer electrolyte membrane (PEM) electrolyzer maximum 30% for the first 48 hours [14] PEC relative high efficiency simple to optimize utilization of semiconductor-liquid junctions relative high cost low stability low scalability RuO2|GaAs/GaInAs/GaInP/AlInP|anatase TiO2/Rh|electrolyte maximum 19% for 2 hours [9] Homogenous PC system bio-mimetic and bio-inspired high activity per active site low cost organic solvent sacrificial reagent soluble redox mediator low stability two-electron mixed-valence dirhodium compound, Eosin Y with hydrogenase — [10, 11] Heterogeneous PC system low cost high scalability simplicity low efficiency cocatalyst-modified SrTiO3:Al maximum 0.76% for 1600 hours, 100 m2 [15] Table 2 A summary of the representative photocatalytic systems developed by Professor Kazunari Domen and his team for one-step overall water splitting. Photocatalyst Surface modification Reaction medium Light source Gas evolution rate Efficiency a Duration (stability) b Ref. H2 O2 BaTaO2N:Mg Na-Rh/Cr2O3/IrO2 water 300 W Xe lamp (λ > 420 nm) 2 μmol/h 1 μmol/h AQY: 0.08% (420 nm) STH: 0.0004% (0.92 Sun) 30 h (~99%) [70] BaTaO2N Rh/Cr2O3/IrO2 water 300 W Xe lamp (AM 1.5G) ~0.27 μmol/h ~0.13 μmol/h AQY: 0.1% (400 nm) STH: 0.0005% (1 Sun) 15 h (~86%) [71] CaTaO2N RhCrO y water 300 W Xe lamp (λ > 300 nm) ~1.3 μmol/h ~0.6 μmol/h AQY: 0.003% (440 nm) 30 h (~86%) [72] CaTaO2N Ru/Cr2O3/Ir water 300 W Xe lamp (λ > 420 nm) 4.92 μmol/h 2.12 μmol/h AQY: 0.45% (420 nm) STH: 0.012% (1 Sun) 20 h (~70%) [73] Cs2La2Ti3O10 Ni/NiO water 450 W mercury lamp 700 μmol/h 340 μmol/h [49] Cs1.5La2Ti2.5Nb0.5O10 Ni/NiO water 450 W mercury lamp 540 μmol/h 265 μmol/h [49] CsLa2Ti2NbO10 Ni/NiO water 450 W mercury lamp 115 μmol/h 50 μmol/h [49] Dy2Ti2O7 NiO x water 400 W mercury lamp ~160.3 μmol/h ~72.6 μmol/h [74] Er2Ti2O7 NiO x water 400 W mercury lamp ~419.2 μmol/h ~184.9 μmol/h [74] Eu2Ti2O7 NiO x water 400 W mercury lamp ~17.8 μmol/h ~6.8 μmol/h [74] GaN:Mg RuO2 water 450 W mercury lamp ~670 μmol/h ~280 μmol/h 21 h (~99%) [75] GaN:ZnO Rh/Cr2O3/IrO2 water (H2SO4, pH 4) 300 W Xe lamp (λ > 420 nm) 14 μmol/h 7.1 μmol/h STH: 0.0125% (1 Sun) 5 h [76] GaN:ZnO RuO2 water (H2SO4, pH 3) 450 W mercury lamp (visible) ~58 μmol/h ~30 μmol/h AQY: 0.14% (300–480 nm) 15 h (~98%) [16] GaN:ZnO Rh/Cr2O3/Mn3O4 water 300 W Xe lamp (λ > 420 nm) ~11.2 μmol/h ~4.9 μmol/h 12 h [77] GaN:ZnO Rh/Cr2O3 (ads.) water 450 W mercury lamp (λ > 400 nm) 426 μmol/h 213 μmol/h 8 h (~99%) [78] (Ga1−x Zn x )(N1−x O x ) Rh-Cr water (H2SO4, pH 4.5) 450 W mercury lamp ~320 μmol/h ~150 μmol/h AQY: 2.5% (430 nm) 35 h (~97%) [17] (Ga1−x Zn x )(N1−x O x ) RuO2 water (H2SO4, pH 3) 450 W mercury lamp 58 μmol/h 29 μmol/h AQY: 0.23% (420 nm) [16] (Ga1−x Zn x )(N1−x O x ) Rh/Cr2O3 water 450 W mercury lamp (λ > 400 nm) ~175.1 μmol/h ~139 μmol/h 4 h [79] (Ga1−x Zn x )(N1−x O x ) Rh2−y Cr y O3/SiO2 water 300 W Xe lamp (λ > 300 nm) ~130.7 μmol/h ~57.7 μmol/h 7 h [80] Gd2Ti2O7 NiO x water 400 W mercury lamp ~446.6 μmol/h ~228.8 μmol/h [74] β-Ge3N4 RuO2 water (H2SO4, pH 0) 450 W mercury lamp 467 μmol/h ~233 μmol/h 25 h [81] β-Ge3N4 (NH3) RuO2 water 450 W mercury lamp 1100 μmol/h 550 μmol/h AQY: 7.0% (300 nm) 5 h [82] Ho2Ti2O7 NiO x water 400 W mercury lamp ~564.4 μmol/h ~253.4 μmol/h [74] K2La2Ti3O10 Ni/NiO water (0.1 mol/L KOH) 450 W mercury lamp 444 μmol/h 221 μmol/h 10 h (~99%) [57] K2La2Ti3O10 Cr/Ni water (0.1 mol/L KOH) 450 W mercury lamp 885 μmol/h 442 μmol/h 124 h (~40%) [83] K4Nb6O17 Ni/NiO water 450 W mercury lamp 63 μmol/h 31 μmol/h AQY: 3.5% (330 nm) 50 h (~86%) [55] K4Nb6O17 NiO water (pH 9.7) 450 W mercury lamp 124 μmol/h 62 μmol/h AQY: 5.2% (330 nm) 5 h [84] K2Rb2Nb6O17 NiO water (pH 9.7) 450 W mercury lamp 78 μmol/h 39 μmol/h AQY: 3.3% (330 nm) 5 h [84] LaMg1/3Ta2/3O 2 N TiOXH/SiOXH/RhCrO y water 300 W Xe lamp (λ > 300 nm) ~3.6 μmol/h ~1.8 μmol/h AQY: 0.3% (440 nm) 22 h (~98%) [85] LaMg1/3Ta2/3O 2 N TiO2/RhCrO y water 300 W Xe lamp (λ > 300 nm) ~1.9 μmol/h ~0.9 μmol/h 5 h [86] LaMg1/3Ta2/3O 2 N RhCrO y /SiO2/TiO2 water 300 W Xe lamp (λ > 300 nm) 22 μmol/h 11 μmol/h AQY: 0.18% (430 nm) 27 h (~99%) [87] Lu2Ti2O7 NiO x water 400 W mercury lamp ~58.9 μmol/h ~21.9 μmol/h [74] Rb2La2Ti3O10 Ni/NiO water (0.1 mol/L RbOH) 450 W mercury lamp 869 μmol/h 430 μmol/h 30 h (~87%) [49] Rb1.5La2Ti2.5Nb0.5O10 Ni/NiO water (0.1 mol/L RbOH) 450 W mercury lamp 725 μmol/h 358 μmol/h [49] RbLa2Ti2NbO10 Ni/NiO water (0.1 mol/L RbOH) 450 W mercury lamp 79 μmol/h 30 μmol/h [49] Rb4Nb6O17 NiO water (pH 9.7) 450 W mercury lamp 228 μmol/h 110 μmol/h AQY: 10.0% (330 nm) 30 h (~91%) [84] SrTaO2N CrO y /Ru/IrO2 water (NaOH, pH 8) 300 W Xe lamp (λ > 420 nm) 9.1 μmol/h 3.0 μmol/h AQY: 0.34% (420 nm) STH: ~0.0055% (1 Sun) 18 h (~65%) [88] SrTiO3 NiO x water vapor 450 W mercury lamp 4.4 μL/h 2.2 μL/h [24] SrTiO3 Ni/NiO water 450 W mercury lamp 24.4 μmol/h 10.6 μmol/h 60 h (~95%) [27] SrTiO3 NiO x water (5 mol/L OH−) 450 W mercury lamp 24 μmol/h ~12 μmol/h [25] SrTiO3 Rh2O3/Cr2O3 water 450 W mercury lamp ~400 μmol/h ~200 μmol/h 5 h [38] SrTiO3:Al Rh2−y Cr y O3 water 300 W Xe lamp (λ > 300 nm) 550 μmol/h 280 μmol/h AQY: 30% (360 nm) 5 h [41] SrTiO3:Al MoO x /RhCrO y water 300 W Xe lamp (300–500 nm) ~1.8 mmol/h ~0.9 mmol/h AQY: 60% (365 nm) 16 h (~91%) [42] SrTiO3:Al Rh/Cr2O3/CoOOH water 300 W Xe lamp (full arc) 3.54 mmol/h 1.78 mmol/h EQE: 95.7% (350 nm) STH: 0.65% (1 Sun) 12.5 (~94%) [46] SrTiO3:Al RhCrO y /CoO y water vapor 20 mW UV LED (365 nm) ~0.9 μmol/h ~0.4 μmol/h AQY: 0.86% (365 nm) 6 h [89] SrTiO3:Al [100 m2 panel] Rh2−y Cr y O3/CoO x water Natural sunlight oxyhydrogen: 568 mL/min STH: 0.76% 1600 h (~79%) [15] SrTiO3:Ga Rh2O3/Cr2O3 water 450 W mercury lamp ~4.3 mmol/h ~2.2 mmol/h 2 h [38] SrTiO3:Ga, La Rh2O3/Cr2O3 water 450 W mercury lamp ~1200 μmol/h ~600 μmol/h 2 h [38] SrTiO3:La Rh2O3/Cr2O3 water 450 W mercury lamp ~100 μmol/h ~50 μmol/h 5 h [38] SrTiO3:Na Rh2O3/Cr2O3 water 450 W mercury lamp ~10.1 mmol/h ~5.2 mmol/h 1.5 h [38] SrTiO3:Na, Ta Rh2O3/Cr2O3 water 450 W mercury lamp ~400 μmol/h ~200 μmol/h 5 h [38] SrTiO3:Ta Rh2O3/Cr2O3 water 450 W mercury lamp ~200 μmol/h ~100 μmol/h 5 h [38] Ta3N5 Rh/Cr2O3 water 300 W Xe lamp (λ > 420 nm) ~10.9 μmol/h ~4.8 μmol/h AQY: 2.2% (320 nm) STH: 0.014% (1 Sun) 15 h (~90%) [90] TaON:Zr Ru/Cr2O3/IrO2 water (NaOH, pH 8.0) 300 W Xe lamp (λ > 380 nm) ~13.7 μmol/h ~ 6.3 μmol/h AQY: 0.81% (365 nm) STH: 0.009% (0.8 Sun) 24 h (82%) [91] Tm2Ti2O7 NiO x water 400 W mercury lamp ~237.0 μmol/h ~106.9 μmol/h [74] Yb2Ti2O7 NiO x water 400 W mercury lamp ~198.6 μmol/h ~94.5 μmol/h [74] Y2Ti2O5S2 IrO2/Rh/Cr2O3 water (La2O3, pH 8.5) 300 W Xe lamp (λ > 420 nm) ~6.4 μmol/h ~3.2 μmol/h AQY: 0.36% (420 nm) STH: 0.007% (1 Sun) 20 h (~81%) [92] ZrO2:TaON IrO2/Cr2O3/RuO x water 450 W mercury lamp (visible) ~3.0 μmol/h ~1.4 μmol/h AQY: ~0.1% (420 nm) 16 h [93] (Zn1+x Ge)(N2O x ) Rh2−y Cr y O3 water 300 W Xe lamp (λ > 420 nm) 11.1 μmol/h 5.4 μmol/h AQY: 0.20% (420 nm) 50 h (~87%) [94] (Zn1.44Ge)(N2O0.44) RuO2 Water 420 W mercury lamp (visible) 14.2 μmol/h 7.4 μmol/h 10 h (~99%) [95] (Zn1.44Ge)(N2O0.44) Rh y Cr2−y O3 water 450 W mercury lamp (λ > 400 nm) ~520.6 μmol/h ~262.7 μmol/h AQY: 2.0% (430 nm) [96] a Efficiency is reported according to AQY (apparent quantum yield), EQE (external quantum efficiency), and/or STH (solar-to-hydrogen conversion efficiency). b Stability is calculated based on the retained photocatalytic activity at a prolonged duration with respect to the initial performance. Table 3 A summary of the two-step photoexcitation (Z-scheme) systems developed by Professor Kazunari Domen and his team for photocatalytic overall water splitting, achieved without the use of sacrificial reagents. Photocatalytic system Surface modification Reaction medium Light source Gas evolution rate Efficiency b Duration (stability)c Ref. HEP OEP Mediator H2 O2 BaTaO2N WO3 IO3 −/I− Pt water (5 mmol/L NaI) 300 W Xe lamp (> 420 nm) ~6.6 μmol/h ~3.1 μmol/h AQY: 0.1% (430 nm) 50 h (~54%) [120] BaTaO2N- RbCl WO3 IO3 −/I− Pt/PtO x water (1 mmol/L NaI) 300 W Xe lamp (> 420 nm) ~242 μmol/h ~114 μmol/h AQY: 4.0% (420 nm) STH: 0.24% 10 h [123] CaTaO2N WO3 IO3 −/I− Pt water (5 mmol/L NaI) 300 W Xe lamp (> 420 nm) ~4.3 μmol/h ~2.0 μmol/h 16 h (~97%) [119] LaMg1/3Ta2/3O2N BiVO4:Mo Au RhCrO x /TiO2 water 300 W Xe lamp (> 420 nm) ~1.1 μmol/h ~0.6 μmol/h AQY: 0.07% (418 nm) STH: 0.001% (1 Sun) 8 h [212] La5Ti2AgS5O7 WO3: H+,Cs+ IO3 −/I− Pt/NiS/PtO x water (2.5 mmol/L NaI) 300 W Xe lamp (> 420 nm) 11.1 μmol/h 5.4 μmol/h AQY: 0.12% (420 nm) 11 h (~61%) [161] La5Ti2AgS5O7 WO3: H+,Cs+ IO3 −/I− Pt/PtO x water (2.5 mmol/L NaI) 300 W Xe lamp (> 420 nm) 5.6 μmol/h 2.6 μmol/h [161] La5Ti2AgS5O7 WO3: H+,Cs+ IO3 −/I− NiS/PtO x water (2.5 mmol/L NaI) 300 W Xe lamp (> 420 nm) 2.3 μmol/h 1.1 μmol/h [161] La5Ti2Cu0.9Ag0.1S5O7 WO3: H+,Cs+ IO3 −/I− Pt/NiS/PtO x water (2.5 mmol/L NaI) 300 W Xe lamp (> 420 nm) 3.7 μmol/h 1.8 μmol/h [161] La5Ti2Cu0.9Ag0.1S5O7:Ga WO3: H+,Cs+ IO3 −/I− Pt/NiS/PtO x water (2.5 mmol/L NaI) 300 W Xe lamp (> 420 nm) 1.9 μmol/h 0.9 μmol/h [161] La5Ti2Cu0.9Ag0.1S5O7:Ga WO3: H+,Cs+ IO3 −/I− Rh/Cr2O3/PtO x water (15 mmol/L NaI, H2SO4, pH 4) 300 W Xe lamp (> 420 nm) ~30.9 μmol/h ~14.2 μmol/h AQY: 2.4% (420 nm) 9 h (~80%) [162] La5Ti2Cu0.9Ag0.1S5O7:Ga LaTiO2N Au Rh/CoO x water (NaOH, pH 11.0) 300 W Xe lamp (> 420 nm) ~0.51 μmol/h ~0.18 μmol/h AQY: 0.04% (420 nm) 22 h (~55%) [117] La5Ti2Cu0.9Ag0.1S5O7:Ga BiVO4 Au Rh/Cr2O3 water 300 W Xe lamp (> 420 nm) 22.0 μmol/h 11.0 μmol/h AQY: 3.2% (420 nm) STH: 0.11% (1 Sun) 12 h (~99%) [163] La5Ti2Cu0.9Ag0.1S5O7:Ga BiVO4:Mo Au Rh/Cr2O3/CoO x water 300 W Xe lamp (> 420 nm) ~75.6 μmol/h ~35.0 μmol/h AQY: 11.8% (420 nm) STH: 0.4% (1 Sun) 8 h [165] La5Ti2Cu0.9Ag0.1S5O7:Mg,Al BiVO4:Mo Au CoO x /Cr2O3/Rh water 300 W Xe lamp (> 420 nm) ~97.5 μmol/h ~49.5 μmol/h AQY: 16.3% (420 nm) STH: 0.67% (1 Sun) 20 h (~94%) [164] La5Ti2Cu0.9Ag0.1S5O7:Mg,Al BiVO4:Mo Au CoO x /Cr2O3/Rh/SiO2 water 300 W Xe lamp (> 420 nm) ~52.3 μmol/h ~23.7 μmol/h AQY: 9.7% (420 nm) STH: 0.41% (1 Sun) 4 h [164] La5Ti2CuS5O7 WO3: H+, Cs+ IO3 −/I− Pt/PtO x water (2.5 mmol/L NaI, pH 6.5) 300 W Xe lamp (> 420 nm) 1.1 μmol/h 0.3 μmol/h 60 h (~70%) [154] La5Ti2CuS5O7 WO3: H+,Cs+ IO3 −/I− Pt/NiS/PtO x water (2.5 mmol/L NaI) 300 W Xe lamp (> 420 nm) 7.5 μmol/h 3.7 μmol/h 4 h [161] La5Ti2CuS5O7 BiVO4 Au Rh/Cr2O3 Water 300 W Xe lamp (> 420 nm) 4.7 μmol/h 2.3 μmol/h 6 h [163] La6Ti2S8O5 WO3: H+,Cs+ IO3 −/I− Rh/PtO x Water (2.5 mmol/L NaI, pH 6.5) 300 W Xe lamp (> 420 nm) 0.3 μmol/h 0.1 μmol/h 10 h [154] MgTa2O6–x N y :TaON BiVO4 Fe3+/Fe2+ Rh/Cr water (25 mmol/L Na3PO4, pH 6.0, 10 mmol/L K4[Fe(CN)6]) 300 W Xe lamp (> 420 nm) ~160 μmol/h ~80 μmol/h AQY: ~12.3% (420 nm) 4 h [108] MgTa2O6–x N y :TaON WO3 IO3 −/I− Pt/PtO x water (1 mmol/L NaI) 300 W Xe lamp (> 420 nm) 108.3 μmol/h 55.3 μmol/h AQY: 6.8% (420 nm) [106] Sm2Ti2S2O5 TiO2 IO3 −/I− Pt water (50 mmol/L NaI, pH 12) 420 W mercury lamp 9.0 μmol/h 3.2 μmol/h 14 h (~38%) [151] Sm2Ti2S2O5 BiVO4 Co/Cr/Pt/Ir water 300 W Xe lamp (> 420 nm) 1.6 μmol/h 0.8 μmol/h [211] Sm2Ti2S2O5 BiVO4 Fe3+/Fe2+ Co/Cr/Pt/Ir water (2 mmol/L FeCl3, pH 2.3) 300 W Xe lamp (> 420 nm) 114.7 μmol/h 54.6 μmol/h [211] Sm2Ti2S2O5 BiVO4 reduced graphene oxide Co/Cr/Pt/Ir water 300 W Xe lamp (> 420 nm) 169 μmol/h 74 μmol/h [211] Sm2Ti2S2O5 BiVO4 Carbon nanotubes Co/Cr/Pt/Ir water 300 W Xe lamp (> 420 nm) 175 μmol/h 75 μmol/h AQY: 5.1% (420 nm) STH: 0.16% (1 Sun) 84 h (~82%) [211] Sm2Ti2S2O5 BiVO4 rGO Cr2O3/Pt/IrO2/CoO x water 300 W Xe lamp (> 420 nm) 240 μmol/h 115 μmol/h AQY: 7.0% (420 nm) STH: 0.22% (1 Sun) 108 h (~81%) [152] Sm2Ti2S2O5 WO3: H+,Cs+ IO3 −/I− Pt/IrO2/PtO x water (2.5 mmol/L NaI, pH 6.5) 300 W Xe lamp (> 420 nm) 4.1 μmol/h 1.6 μmol/h 10 h [154] SrTaO2N BiVO4 Fe3+/Fe2+ Pt/Cr2O3/Ir-FeCoO x water (25 mmol/L Na3PO4, pH 6.0, 5 mmol/L K4[Fe(CN)6]) 300 W Xe lamp (AM 1.5G) ~17.8 μmol/h ~7.7 μmol/h AQY: 4.0% (420 nm) STH: 0.15% (0.87 Sun) 33 h (~92%) [124] SrTiO3:Rh GaN:ZnO Fe3+/Fe2+ Ru/Au/IrO2 water (2 mmol/L FeCl3, H2SO4, pH 2.75) 300 W Xe lamp (> 420 nm) 38 μmol/h 17.8 μmol/h STH: 0.037% (1 Sun) 100 h (~92%) [76] SrTiO3:La,Rh BiVO4:Mo Au Ru/RuO x water 300 W Xe lamp (> 420 nm) ~94.1 μmol/h ~46.2 μmol/h AQY: 30% (419 nm) STH: 1.1% (1 Sun) 13 h (~99%) [13] SrTiO3:La,Rh BiVO4:Mo Au Ru/RuO x water 300 W Xe lamp (> 420 nm) 4.0 μmol/(h·cm2) 2.0 μmol/(h·cm2) AQY: 5.9% (418 nm) STH: 0.2% (0.9 Sun) 8 h [213] SrTiO3:La,Rh BiVO4:Mo C Ru/RuO x water 300 W Xe lamp (> 420 nm) 8.6 μmol/(h·cm2) 4.4 μmol/(h·cm2) AQY: 26% (419 nm) STH: 1.0% (1 Sun) 17 h (~99%) [214] SrTiO3:La,Rh BiVO4:Mo C Ru/RuO x water (pH 3.5) 300 W Xe lamp (> 420 nm) 11 μmol/(h·cm2) 5.5 μmol/(h·cm2) [214] SrTiO3:Rh BiVO4:Mo ITO Ru/RuO x water 300 W Xe lamp (> 420 nm) 6.5 μmol/(h·cm2) 3.2 μmol/(h·cm2) AQY: 10.2% (420 nm) STH: 0.4% (1 Sun) 48 h (~84%) [215] TaON BiVO4 Fe3+/Fe2+ Rh y Cr2–y O3/Ir/IrO2 water (25 mmol/L Na3PO4, pH 6.0, 10 mmol/L K4[Fe(CN)6]) 300 W Xe lamp (> 420 nm) ~200 μmol/h ~100 μmol/h AQY: 16.9% (420 nm) STH: 0.8% (1 Sun) 4.5 h (~98%) [107] TaON WO3 IO3 −/I− Pt/PtO x water (1 mmol/L NaI) 300 W Xe lamp (> 420 nm) 15.6 μmol/h 7.5 μmol/h [106] TaON WO3 IO3 −/I− Pt water (5 mmol/L NaI) 300 W Xe lamp (> 400 nm) 24 μmol/h 12 μmol/h AQY: 0.4% (420 nm) 100 h [206] TaON WO3 IO3 −/I− Pt/PtO x water (5 mmol/L NaI, pH 6.5) 300 W Xe lamp (> 400 nm) ~18.7 μmol/h ~8.5 μmol/h AQY: 0.5% (420 nm) 19 h (~99%) [207] TaON TaON IO3 −/I− Pt/RuO2 water (1 mmol/L NaI) 300 W Xe lamp (> 420 nm) ~7.2 μmol/h ~2.8 μmol/h AQY: ~0.1% (420 nm) 10 h (~43 %) [208] TiO2 (anatase) TiO2 (rutile) IO3 −/I− Pt water (0.1 mol/L NaI, pH 11) 400 mercury lamp ~141.8 μmol/h ~70.9 μmol/h 20 h (~98%) [203] (ZnSe)0.5(CuGa2.5Se4.25)0.5 BiVO4:Mo Au Pt/CdS/TiO2 Water 300 W Xe lamp (> 420 nm) 12 μmol/h 6 μmol/h AQY: 1.5% (420 nm) 5 h [216] m-ZrO2:TaON WO3 IO3 −/I− Pt water (1 mmol/L IO3 −/I−) 300 W Xe lamp (> 420 nm) ~4.2 μmol/h ~1.36 μmol/h 40 h (~ 99%) [103] ZrO2:TaON BiVO4 Fe3+/Fe2+ Rh/Cr water (25 mmol/L Na3PO4, pH 6.0, 10 mmol/L K4[Fe(CN)6]) 300 W Xe lamp (> 420 nm) ~160 μmol/h ~80 μmol/h AQY: 12.3% (420 nm) STH: 0.6% (1 Sun) 50 h (~98%) [108] ZrO2:TaON WO3 IO3 −/I− Pt water (1.0 mmol/L NaI) 300 W Xe lamp (> 420 nm) 32.6 μmol/h 15.6 μmol/h AQY: 6.3% (420 nm) 10 h (~90%) [171] aEfficiency is reported according to AQY (apparent quantum yield), EQE (external quantum efficiency), and/or STH (solar-to-hydrogen conversion efficiency) b Stability is calculated based on the retained photocatalytic activity at a prolonged duration with respect to the initial performance. Table 4 Strategies typically employed by Domen's team to enhance photocatalytic performance. Strategy Description Doping introducing bandgap narrowing through interactions of cation states with valence or conduction bands, or creating intrabandgap levels; suppressing the formation of “killer defects” (enhancing ηabsorption and ηseparation) (Oxy)nitride and oxysulfide modifying the VB by incorporating N 2p or S 2p anions, leading to a narrowed bandgap (enhancing ηabsorption) Solid solution adjusting bandgaps and energy levels by varying the ratios of wide- and narrow-bandgap semiconductors (enhancing ηabsorption) Z-scheme system utilizing a two-step photoexcitation process with an HEP and an OEP, both with narrow bandgaps (enhancing ηabsorption and ηseparation) Flux treatment tailoring crystallinity and grain boundary structure to limit defect formation (enhancing ηseparation) Combination of different cocatalyst deposition methods enhancing cocatalyst dispersion and creating additional active sites (enhancing ηseparation and ηreaction) Co-deposition of HEC and OEC promoting charge separation by providing both reductive and oxidative active sites; spatially separating HEC and OEC through facet engineering (enhancing ηseparation and ηreaction) Two-component cocatalysts improving charge transport from the light absorber to the cocatalyst (enhancing ηseparation and ηreaction) Surface modification for HEC and photocatalyst effectively suppressing back reactions on the surface of HEC and light absorbers (enhancing ηreaction) Particle transfer method effectively facilitating charge separation and transfer between HEP and OEP in a Z-scheme configuration, or between the photocatalyst and the substrate in a photoelectrode (enhancing ηseparation) Available online 10 January 2025 Review Novel materials and techniques for photocatalytic water splitting developed by Professor Kazunari Domen Yaqiang Wu a b 1 Jianuo Li a 1 Wei-Kean Chong c 1 Zhenhua Pan d * Qian Wang a e * Dedicated to Prof. K. Domen on the occasion of his 70th birthday. a Graduate School of Engineering, Nagoya University, Furo-cho, Chikusa-ku, Nagoya 464-8603, Japan Graduate School of Engineering Nagoya University Furo-cho Chikusa-ku Nagoya 464-8603 Japan Graduate School of Engineering, Nagoya University, Furo-cho, Chikusa-ku, Nagoya 464-8603, Japan b State Key Laboratory of Crystal Materials, Institute of Crystal Materials, Shandong University, Jinan 250100, Shandong, China State Key Laboratory of Crystal Materials Institute of Crystal Materials Shandong University Jinan Shandong 250100 China State Key Laboratory of Crystal Materials, Institute of Crystal Materials, Shandong University, Jinan 250100, Shandong, China c Multidisciplinary Platform of Advanced Engineering, Department of Chemical Engineering, School of Engineering, Monash University Malaysia, Jalan Lagoon Selatan, 47500 Bandar Sunway, Selangor, Malaysia Multidisciplinary Platform of Advanced Engineering Department of Chemical Engineering School of Engineering Monash University Malaysia Jalan Lagoon Selatan Bandar Sunway Selangor 47500 Malaysia Multidisciplinary Platform of Advanced Engineering, Department of Chemical Engineering, School of Engineering, Monash University Malaysia, Jalan Lagoon Selatan, 47500 Bandar Sunway, Selangor, Malaysia d Department of Applied Chemistry, Graduate School of Engineering, University of Hyogo, Himeji, Hyogo 671-2280, Japan Department of Applied Chemistry Graduate School of Engineering University of Hyogo Himeji Hyogo 671-2280 Japan Department of Applied Chemistry, Graduate School of Engineering, University of Hyogo, Himeji, Hyogo 671-2280, Japan e Institute for Advanced Research, Nagoya University, Furo-cho, Chikusa-ku, Nagoya 464-8601, Japan Institute for Advanced Research Nagoya University Furo-cho Chikusa-ku Nagoya 464-8601 Japan Institute for Advanced Research, Nagoya University, Furo-cho, Chikusa-ku, Nagoya 464-8601, Japan * Corresponding author. 1 Contributed equally to this work. ABSTRACT Professor Kazunari Domen at the Shinshu University and the University of Tokyo has pioneered materials and techniques for solar-driven water splitting using photocatalysts, a promising technology for contributing to the construction of a sustainable and carbon-neutral society. In this paper, we summarize his groundbreaking contributions to photocatalytic water splitting and, more broadly, photocatalytic research. We highlight various novel functional photocatalytic materials, including oxides, (oxy)nitrides, and oxysulfides, along with innovative techniques such as cocatalyst engineering and Z-scheme system construction developed by the Domen Group. His team has also pioneered readily accessible and cost-effective photo(electro)chemical device fabrication methods, such as the particle-transfer method and thin-film-transfer method. Furthermore, their research has made significant contributions to understanding the (photo)catalytic mechanisms using advanced characterization techniques. Together with his research team, Professor Domen has set many milestones in the field of photocatalytic overall water splitting, notably demonstrating the first scalable and stable 100 m2 solar H2 production system using only water and sunlight. His work has revealed the potential for practical solar H2 production from water and sunlight, and highlighted the application of fundamental principles, combined with chemical and materials science tools, to design effective photocatalytic systems. Through this review, we focus on his research and the foundational design principles that can inspire the development of efficient photocatalytic systems for water splitting and solar fuel production. By building on his contributions, we anticipate a significant impact on addressing major global energy challenges. Graphical Abstract This Review highlights the innovative materials and versatile techniques pioneered by Professor Domen and his research team, which hold great promise for advancing photocatalytic processes and accelerating progress in solar fuel production. Keywords Photocatalysis Water splitting Solar H2 production Solar energy conversion Artificial photosynthesis 1 Introduction Harnessing energy directly from sunlight offers an ideal solution for meeting clean energy needs with minimal environmental impact. Solar energy is distributed and virtually inexhaustible. However, given the intermittency of sunlight, for solar energy to serve as a primary energy source, it must be stored and dispatched as electricity, heat or fuel on demand to end users. The key challenge in converting solar energy into electricity lies in significantly reducing the cost per watt of electricity produced. Over the past decade, substantial cost reductions in photovoltaic technology have driven a rapid increase in adoption, positioning photovoltaics as one of the most cost-effective future electricity generation options. As the industry evolves, it has become evident that area-related expenses such as those associated with encapsulation and installation are now a significant part of the total costs in photovoltaic power production, a trend likely to continue [1]. Enhancing energy conversion efficiency directly lowers these costs. However, without cost-effective energy storage solutions, solar electricity cannot serve as a primary energy source due to fluctuations in sunlight availability. While batteries could theoretically store this electricity, battery technologies are currently not affordable enough to meet long-term cost-per-watt goals across a solar device's 30-year lifespan [2]. Natural photosynthesis is relatively inefficient when considered on an annual average per unit area of sunlight received. For instance, switchgrass, one of the fastest-growing crops, stores energy in biomass at an average rate of only 1 W m–2 per year [3]. Biofuels derived from plants have the potential to contribute significantly to liquid fuel supplies for transportation, yet improving energy conversion and storage efficiency is crucial. This would help minimize land use as a limiting factor in harnessing solar energy and storing it in chemical bonds. A promising approach is to develop artificial photosynthetic systems with efficiencies surpassing those of plants or algae. In artificial photosynthesis, the initial steps involve converting sunlight into heat or electrical current. Similar to how the phosphate bond in ATP is a crucial energy unit in biological systems, the H–H bond in hydrogen (H2) holds promise as a key energy source for a carbon-neutral society. To unlock this potential, H2 must be extracted from its stable source, water. This involves utilizing solar energy to drive the thermodynamically uphill process of water splitting, thereby producing H2 and generating oxygen (O2) as a byproduct. This process is becoming increasingly vital since hydrogen not only provides a high-energy, carbon-free transportation fuel but also functions as an energy storage medium, helping to mitigate the variability of solar power generation [4]. Solar-driven water splitting can also be achieved using solar thermal energy to drive the reaction. For instance, a solar-to-hydrogen (STH) efficiency of 0.7% was reported with porous monolithic CeO2 in an advanced solar-cavity receiver reactor, utilizing two-step thermochemical reactions [5]. This process involves metal oxide-based solar thermal water-splitting cycles, where hydrogen is generated through sequential high-temperature reduction and water reoxidation of a metal oxide. Since only the reduction step is endothermic, the second reoxidation step can be performed at night or when needed. Additionally, these two-step thermochemical reactions, operating at more practical reduction temperatures (1200–1500 °C) compared to direct thermolysis (> 2700 °C), offer a more feasible approach [6]. However, these systems require solar concentrators to focus thermal energy and generate high temperatures above 1000 °C. To realize the theoretical maximum STH efficiency of 20%–40% [7], further optimization of operating conditions such as heat recovery, temperature, pressure, and solar irradiation concentration is needed. Using semiconductors to capture and store solar energy in simple chemical forms, H2, offers another approach for scalable grid solar energy storage and utilization technology. This approach begins by converting solar energy into electricity or wireless current to drive a redox reaction. Solar H2 production from water is typically carried out using three main system configurations: photovoltaic modules connected to discrete electrolyzers (PV-E), photoelectrochemical (PEC) cells, and photocatalysis (PC), as shown in Fig. 1 . An overview of these typical solar fuel systems including key technical attributes and challenges are listed in Table 1 . PV-E can be achieved by connecting commercial photovoltaic modules directly to electrolyzers and/or catalytic electrodes. PEC systems are attractive for water splitting because they enable the water splitting reaction to occur directly at the semiconductor surface, allowing for the easy creation of an electric field at the semiconductor/liquid junction. The separated light collection structure in PV-E (spatially separated PV device with electrocatalysts) and PEC (separated photocathode and photoanode for producing H2 and O2, respectively) offer convenience for the modulation and optimization of each component. Additionally, the successful research and development have enabled their STH efficiencies to reach over 19% [8,9]. However, rigorous economic analyses indicated that achieving STH efficiencies greater than 20% with current embodiments of PV-E and PEC devices was not sufficient to achieve H2 competitive with fossil-fuel-derived hydrogen at the production cost, primarily due to high costs associated with panel mounting materials and labor expense [4]. Photocatalytic H2 production from water can be realized using homogeneous systems that involve an organic sensitizer (e.g., dye) and molecular catalysts/enzymes in solution [10,11]. However, these multicomponent systems typically require sacrificial chemical reductants and a soluble redox mediator to transfer electrons from the light absorber to the catalyst. Additionally, the stability is a significant obstacle to the durability of their performance in aqueous solution and O2-rich atmosphere. An alternative approach involves using particles of inorganic semiconductors in conjunction with heterogeneous cocatalysts, which have been demonstrated to act as photocatalytic water-splitting systems. These systems are projected to be simpler and more cost-effective than the PV-E and PEC cells, as solar energy collection and conversion can be performed on a single particle. Fig. 2 illustrates a typical semiconductor particle with a hydrogen evolution cocatalyst (HEC) and an oxygen evolution cocatalyst (OEC) on its surface, which serves as a photocatalyst for overall water splitting. The overall transformation is a multielectron process driven by photocatalysts and light, comprising three key processes: (1) photon absorption, where photons with energy greater than the semiconductor bandgap excite electrons from the valence band (VB) to the conduction band (CB), generating electron (e–)/hole (h+) pairs; (2) separation of the photoexcited carriers into free carriers, followed by their migration to the active sites on the particle surface; and (3) initiation of redox reactions at the active sites, where the accumulated charges, with the aid of cocatalysts, drive the production of H2 and O2. The reactions involved in overall water splitting are summarized below: Hydrogen evolution reaction (HER): (1.1) 2H+ + 2e– → H2 (0 V vs. NHE at pH 0) Oxygen evolution reaction (OER): (1.2) H2O → 1/2O2 + 2e– + 2H+ (1.23 V vs. NHE at pH 0) (1.3) Overall reaction: H2O → H2 + 1/2O2 (ΔE = 1.23 V; ΔG = 237.2 kJ/mol at 298 K and 1 atm) Therefore, the overall solar energy conversion efficiency, STH, reflects the efficiencies of three processes and is expressed as follows: (1.4) STH = η absorption × η separation × η reaction Here: Photon absorption efficiency (η absorption): The fraction of electron-hole pairs generated by the incident photon flux. Carrier separation efficiency (η separation): The fraction of photogenerated charge carriers successfully separated and migrated to the solid-liquid interface. Redox reaction efficiency (η reaction): The efficiency with which the surface reactions involving the charge carriers occur at the solid-liquid interface. Because the HER and OER take place in close spatiotemporal proximity on individual photocatalyst particles, the need for supporting electrolytes, pH-buffer reagents, and vigorous circulation of the electrolyte solution to minimize solution resistance and concentration overpotentials in common PV-E and PEC systems can be avoided. This approach also eliminates the need for expensive membranes required to separate the anolyte and catholyte [12]. Therefore, the photocatalytic system is readily scalable at a relatively low cost without severe deterioration in its activity [12,13]. These merits of photocatalytic systems enable an estimated average cost of H2 production in the range of 1.6–3.5 $/kg, assuming STH efficiencies of 5%–10% and a system lifetime of 5 years [4]. These costs align with the target H2 price of 2.00–4.00 $/kg set by the United States Department of Energy. However, photocatalytic water splitting using particulate photocatalysts, especially with a single light absorber, encounters significant thermodynamic and kinetic barriers to chemical bond-making and -breaking processes, which involve multi-electron transfer coupled with proton transfer. A key research goal is to develop an efficient and stable photocatalytic system capable of cost-effective water splitting on a scale required to meet global energy demands, i.e., in the range of tens of terawatts. Professor Kazunari Domen is an eminent figure in the field of photocatalytic water splitting with a wealth of knowledge and expertise. He started the research on photocatalytic water splitting during his PhD study at The University of Tokyo, Japan in the 1980s. He has dedicated his career to advancing this technology for over 40 years, with his research interests encompassing a broad range including, but not limited to, material development, technology innovation, mechanism study, and practical application demonstration. Professor Domen has led his team to significant advancements in this field, aiming to design and develop effective photocatalytic water-splitting systems for practical solar hydrogen production. Here are some highlights of his research: (1) Exploration of novel photocatalytic materials, including light absorbers (such as visible-light-driven oxides, nitrides, oxynitrides, and oxysulfides) and cocatalysts (exemplified by core-shell structured cocatalysts). The Domen team reported various novel examples of achieving overall water splitting using a single visible-light-responsive photocatalyst, marking the beginning of a new era in artificial photosynthesis [16,17]. (2) Achievement of evolutionary and revolutionary performance improvements through various strategies, such as deposition and modulation of cocatalysts, surface modification, and construction of Z-scheme systems. These strategies have been widely used in various photocatalytic reactions, including water splitting and CO2 reduction [18,19]. (3) Utilization of advanced techniques and fruitful collaboration to enhance scientific understanding of (photo)catalytic processes, including transmission infrared (IR), infrared reflection absorption spectroscopy (IRAS), interfacial sum-frequency generation spectroscopy (SFG), and transient absorption spectroscopy (TAS). (4) Substantial progress in demonstrating the practical application viability of cost-effective photocatalytic water splitting technology. This involves designing and expanding photocatalyst sheets and panels aimed at large-scale H2 production. Although recently there has been a tremendous explosion of work in this field, the Domen team remains at the forefront of photocatalytic water splitting, consistently setting new records and benchmarks. In this Review, we use the Domen team's work as an example and adopt a historical approach to detail how they have developed effective photocatalytic materials and systems. The novel materials are enhanced through innovative strategies to address common challenges in photocatalysis—specifically, the limited solar energy harvesting ability, the rapid recombination of photogenerated carriers, and the sluggish kinetics of surface redox reactions—thereby improving η absorption, η separation and η reaction, and thus overall STH efficiency. These versatile and insightful materials and techniques pioneered by the Domen team hold promise for advancing various photocatalytic processes and accelerating progress in solar fuel production. More importantly, by reviewing the work of this esteemed scientist and exploring how the Domen team tailors photocatalytic materials and optimizes system performance, we aim to understand the fundamental principles governing these materials and the rationale behind future design and development. This overview highlights both past and current research, as well as the promising future perspectives made possible by the exciting developments of his team. 2 Innovative materials for photocatalytic water splitting 2.1 Oxide photocatalysts To drive photocatalytic water splitting, a photovoltage of > 1.23 V is required (Fig. 2). Therefore, at the early stage of this research field, wide-bandgap photocatalysts exemplified by oxides have been widely studied [20]. As Fujishima and Honda reported their pioneering PEC system using a TiO2 photoanode connected to a Pt cathode for water splitting under light irradiation with an external bias [21], it was expected that photocatalytic water splitting could be achieved by loading the counter electrode catalysts, Pt, on TiO2 particles. However, researchers encounter challenges with this approach for two main reasons with commonly used anatase-type TiO2 particles [22]: (1) Multiple deep trapped states were located above the VB of anatase TiO2, reducing the oxidative potential of photogenerated holes; (2) The Pt cocatalyst tends to promote undesired backward reactions, i.e., O2 reduction and the recombination of H2 and O2. The first issue is intrinsic to TiO2, promoting researchers to explore new materials as photocatalysts, such as SrTiO3, which was originally reported by M. S. Wrighton as a photoanode to split water without any external bias, and layer-structured oxides. 2.1.1 SrTiO3 Domen started his research of using SrTiO3 as a photocatalyst when he was a PhD student at Tamaru Group, the University of Tokyo. SrTiO3 is a typical perovskite oxide with Sr2+ coordinating to 12 oxygen atoms and Ti4+ coordinating to 6 oxygen atoms, wherein eight TiO6 octahedra with shared corners formed the three-dimensional framework of a cubic cell, the center of which is occupied by Sr2+ cation [23]. In 1980, using a glass-made closed-circulation reaction system–still widely adopted in the current photo(electro)catalytic research–he confirmed photocatalytic water vapor cleavage over NiO x -loaded SrTiO3 [24]. His further research revealed that the NiO x -loaded SrTiO3 in suspension could also decompose liquid water, and achieved photocatalytic water splitting (i.e. splitting water into H2 and O2 with a molar ratio of 2:1 without external bias) for the first time [25]. The success in splitting water using the above system was largely attributed to the unique structure of NiO x cocatalyst. Initially, Domen intended to construct an intimate p-n junction between NiO and SrTiO3 by first reducing Ni2+ ions to metallic Ni with H2 and subsequently fully oxidizing metallic Ni into a p-type NiO with O2. By constructing an intimate NiO/SrTiO3 junction, the charge separation in SrTiO3 was supposed to be significantly improved. However, experiments revealed that fully converting metallic Ni to NiO under high-temperature oxidation did not produce an active sample as expected. In contrast, partially oxidizing Ni to NiO was confirmed to be the key to activating the samples. Subsequent studies utilizing X-ray photoemission (XPS) and Extended X-ray absorption fine structure (EXAFS) revealed that NiO x obtained through reduction and partial oxidation processes exhibited a core/shell structure. In this structure, the NiO shell was permeable to small molecules/ions such as H+ and H2, but not to O2, while the Ni core worked as an active site for HER [26,27]. Though the preparation of a NiO shell is not universal, and the Ni core is not as active as noble metals like Pt for catalyzing HER, the development of core/shell Ni/NiO shows a clear way to suppress the backward reactions during photocatalytic water splitting. This pioneering invention inspired the development of Cr2O3 and amorphous TiO2 (a-TiO2) shells, which are widely applied in current photocatalytic systems [28–32]. The details will be discussed in Section 3.1.3. In the early years, despite optimizing cocatalyst loading methods and SrTiO3 synthesis, the activity of SrTiO3 for photocatalytic water splitting remained quite low, as reflected by its quantum efficiency <1% [27,33–37]. Considering charge separation in the bulk was critical for the photocatalytic performance at this stage, Domen et al. [38] applied defect engineering to SrTiO3 by employing aliovalent-metal-ion doping. They discovered that the low-valent cation doping, i.e., p-type doping with Na+ into Sr2+ or Ga3+ into Ti4+, efficiently enhanced photocatalysis by introducing oxygen vacancies and reducing Ti3+ defects. In contrast, the high-valent doping, i.e., n-type doping with La3+ into Sr2+ or Ta5+ into Ti4+, suppressed photocatalytic water splitting. This doping engineering with metal ions was proved to improve the electronic structure of SrTiO3 without introducing mid-gap energy levels. By combining metal-ion doping with the recently developed facet engineering [39,40], Domen et al. [39–42] developed highly crystallized, faceted Al-doped SrTiO3 (SrTiO3:Al) through a reaction between SrTiO3 and Al2O3 in SrCl2 flux, resulting in modified morphology and enhanced photocatalytic activities, as shown in Fig. 3 . In such synthesis, the crystallinity and particle size of SrTiO3 increased following the SrCl2 flux treatment. The morphology changed from irregular shapes with particle sizes of hundred nanometers to truncated cubic shapes with particle sizes of 0.2–2 μm. When Al2O3 was intentionally added to SrCl2 flux (at a 1:100 molar ratio), the particles became nearly uniform, with their size reduced to a few hundred nanometers in diameter. TAS revealed that SrTiO3:Al contained energy states near the CB and VB, while eliminating the sub-band gap states observed in pristine SrTiO3 [43,44]. During the photocatalytic reaction, the photogenerated electrons were shallowly trapped by the extrinsic states near the CB, permitting the re-excitation to the high-energy CB for the subsequent transfer to the cocatalysts. Concurrently, the shallowly trapped photogenerated holes near the VB migrate to the adjacent cocatalysts to facilitate surface reactions. As a result, an apparent quantum efficiency (AQY) of SrTiO3:Al reached 30% at 360 nm, while this value was at the level of ~1% in the previous studies [25,26,35,45]. In subsequent years, the photocatalytic activity of SrTiO3:Al was further enhanced through optimized cocatalyst loading. For example, co-loading MoO x and Rh2–y Cr y O3 on SrTiO3:Al achieved an AQY of 56% at 365 nm [12,42]. Remarkably, when Cr2O3/Rh as HEC and CoOOH as OEC were selectively loaded on the reductive ({100}) and oxidative ({110}) facets of SrTiO3:Al, respectively, the AQY approached the theoretically maximum of 100% at 350–360 nm [46]. SrTiO3 has a wide bandgap of ~3.2 eV, which restricts its absorption to high-energy ultraviolet light, which constitutes only a small portion of the solar spectrum. Nonetheless, advances in SrTiO3 mark a groundbreaking approach to activating photocatalysts. Additionally, SrTiO3 serves as an ideal model for studying the mechanism of photocatalytic water splitting. 2.1.2 Layered structure oxides Metal oxides with a layered structure (Fig. 4(a) ) are another typical type of UV-responsive photocatalysts capable of splitting water. The layered structure benefits photocatalytic water splitting in several ways [47,48]: (1) The redox sites could be located within the space-confined interlayers, reducing the migration distance of charge carriers to the reaction sites; (2) As the reaction sites for H2 and O2 evolution can be spatially separated, the possibility of H2-O2 recombination is reduced, as shown in Fig. 4(b)); (3) Cocatalysts, such as Ni and Pt nanoclusters, can be intercalated into the interlayer space, which is negatively charged (Fig. 4(c)). The negative electric field facilitates the diffusion of H+ towards the cocatalyst for H2 evolution while inhibiting the diffusion of O2, thereby suppressing backward reactions. In 1986, Domen et al. [47] reported K4Nb6O17 as the first layered structure photocatalyst for H2 evolution using methanol as an electron donor. This material features two types of interlayers in the structure: one containing H2O molecules and K+ ions (interlayer I), and the other one containing only K+ ions without H2O molecules (interlayer II) in water vapor. A notable characteristic of K4Nb6O17 is that the K+ ions between the niobium oxide layers can be replaced with other cations, such as protons and various metal ions [51]. Domen et al. [52] discovered that the K+ exchanging with H+, Cr3+ or Fe3+ promoted the photocatalytic H2 evolution activity of K4Nb6O17 from an aqueous methanol solution while exchanging with Co2+, Ni2+ or Cu2+ had a negative effect. In particular, H+-exchanged K4Nb6O17 showed a H2 evolution activity with an AQY of 50% at 330 nm in a methanol aqueous solution. The effective separation of electrons and holes was likely due to the electrostatic gradient within the niobate sheet, caused by the differing locations of K+ and H+ ions between interlayers I and II [50]. Furthermore, K4Nb6O17 demonstrated the ability to perform photocatalytic water splitting even without the assistance of cocatalysts, although its activity was significantly lower, being 9 times less than that of the sample loaded with Ni metal nanoparticle cocatalyst [53]. It was found that the photocatalytic activity was sensitive to the loading amount of Ni, showing a downtrend in the range of 0.1 wt%–20 wt%, as only ultrafine Ni clusters smaller than 5 Å can be accommodated within interlayer I of K4Nb6O17 [38]. When the Ni loading exceeded 0.1 wt%, the Ni metal clusters formed from the reduction of Ni2+ ions became larger than the interlayer spacing, leading to the destruction of the layered structure. Inspired by the development of K4Nb6O17, the family of layered perovskite-type compounds with a formula of A′[A 2 B 3O10] (A′ = K, Rb, Cs; A = Ca, Pb; B = Nb, Ta, etc.) (Dion-Jacobson phase) and A′2[A 2 B 3O10] (A′ = K, Rb; A = La; B = Ti) (Ruddlesden-Popper phase) was also investigated for photocatalytic water splitting. The Dion-Jacobson phase did not hydrate in air, while the Ruddlesden-Popper phase did. After the H+ exchange reaction, both types of layered perovskites showed high photocatalytic activity for H2 evolution in the presence of sacrificial reagents such as methanol [54,55]. However, H+-exchanged forms of both layered perovskites could not achieve the overall water-splitting reaction. In contrast, K2La2Ti3O10 and Rb2La2Ti3O10, which contain alkaline metal cations in the interlayer and spontaneously hydrate in air and/or in an aqueous solution, achieved the overall water-splitting reaction after NiO/Ni cocatalyst loading. Notably, although the Domen team could not develop a Dion-Jacobson phase photocatalyst to split water, Ebina et al. [56] at the National Institute for Materials Science (Japan) succeeded in this by exfoliating KCa2Nb3O10. At the same time, Ruddlesden-Popper phase K2La2Ti3O10 and Rb2La2Ti3O10, consisting of negatively charged titanlanthanate perovskite layers and interlayer potassium ions, have been reported by Domen et al. [49,57,58] for photocatalytic overall water splitting in aqueous alkaline solution after loading NiO/Ni cocatalyst. Different from K4Nb6O17, K2La2Ti3O10 contained reaction sites for OER located in the interlayer space, and Ni particles functioned as the reaction sites for HER on the external surface probably due to the difference of the mobilities between photoexcited electrons and holes [57]. Though the layered structure photocatalysts with large bandgaps (~3.3 eV) are responsive to only UV, they can be applied for constructing Z-scheme systems for water splitting under visible light irradiation upon dye-sensitization [59,60]. For example, Abe et al. [59] reported that the dye (coumarin or carbazole)-sensitized, Pt-loaded K4Nb6O17 as the H2 evolution photocatalyst (HEP) combined with IrO2/Pt-loaded WO3 as the O2 evolution photocatalyst (OEP), constructing a Z-scheme system mediated by I3 −/I− redox for overall water splitting under visible-light irradiation (λ > 410 nm). In this system, Pt cocatalyst was confined in the interlayer of K4Nb6O17, allowing the H2 evolution at Pt sites while inhibiting the approaching of I3 − due to the electrostatic repulsion between I3 − and negatively charged (Nb6O17)4 − layers. Furthermore, Maeda et al. [60] reported the dye (Ru complex)-sensitized layered HCa2Nb3O10, modified with Al2O3 and poly(styrenesulfonate) layers, functioned as the HEP in a Z-scheme system in combination with PtO x /H-Cs-WO3 as OEP. In this system, backward electron transfer in two paths, i.e., the excited electrons in the CB of the HEP to surface adsorbed oxidized Ru complex, and to the oxidation product of I3 − in solution, were significantly suppressed by Al2O3 and poly(styrenesulfonate) modification, respectively, resulting in the enhancement of STH to 0.12%. 2.2 Visible-light-responsive photocatalysts Investigating oxide photocatalysts exemplified by SrTiO3 has verified the technical feasibility of photocatalytic water splitting without the need for sacrificial reagents. However, these oxide photocatalysts often compromise their light absorption capacity to achieve a high driving force necessary for redox reactions. Taking SrTiO3:Al as an example, despite advancements in the material design that have enabled a quantum efficiency of 100% at ~360 nm for water splitting, its limited light absorption in the UV region restricts the STH efficiency to less than 1%. To effectively harness the solar spectrum and make photocatalytic water splitting viable on a practical scale, it is crucial to develop visible-light-responsive photocatalysts, particularly those that can respond to wavelengths up to 600 nm [61]. In the early development of visible-light-responsive photocatalysts, cadmium chalcogens, and their solid solutions, for example, CdS with intrinsic narrow bandgaps gained significant attention [62,63]. However, these materials tend to favor photocorrosion over O2 evolution on the oxidation side, making reliable photocatalytic water splitting challenging. Another strategy for developing visible-light-driven photocatalysts involves doping oxide photocatalysts with metal ions (e.g., Cr3+, Rh3+) [64] and non-metal ions (e.g., N3−, S2−) [65]. In this approach, dopants induce visible-light absorption by creating discrete energy levels within the forbidden band of the host photocatalysts. However, this method often results in a relatively slow migration of photogenerated charge carriers. Moreover, dopants can disrupt the charge balance and crystal structure of the host materials, forming defects that serve as charge recombination centers. Due to these disadvantages, most visible-light-responsive photocatalysts produced by doping have been effective only for H2 and/or O2 evolution in the presence of sacrificial reagents. Only a few exceptions, such as Sb and Rh co-doped SrTiO3 as well as Ir and La co-doped KTaO3, have been reported to achieve photocatalytic water splitting without sacrificial reagents [66,67]. Most oxide photocatalysts have a CB potential just above the H2 evolution potential (E(H+/H2), Fig. 2), but their VB potentials are far below the O2 evolution potential (E(O2/H2O)), leading to a large bandgap. With this in mind, Domen et al. attempted to develop new visible-light-responsive photocatalysts by tuning the VB position while maintaining the CB position. They noticed that the potentials of N 2p and S 3p orbitals are more negative than that of O 2p orbitals and certain transition metal-based oxynitride materials had been reported as non-toxic pigments [68]. Based on this observation, Domen et al. proposed the development of (oxy)nitride and oxysulfide photocatalysts, which were supposedly ideal candidates for photocatalytic water splitting under visible light. However, the introduction of N 2p and S 3p orbitals into the VB can cause stability issues for photocatalysts. Specifically, water oxidation for O2 evolution may compete with the photocorrosion of N3− or S2− ions. The photocorrosion can be suppressed by loading cocatalysts, such as CoO x , or applying a protective layer, like amorphous TiO2, as discussed in the following context. Strategies for protecting (oxy)nitrides and oxysulfides during photocatalytic water splitting have also been detailed in our previous review paper [69]. The band diagrams of representative photocatalysts developed by the Domen team and their typical photocatalytic activity for one-step overall water splitting to produce both H2 and O2 are summarized in Fig. 5 and Table 2 , respectively. 2.2.1 TaON0020and Ta3N5 In 2002, Domen and his team [97] began exploring visible-light-responsive photocatalysts, focusing on tantalum-based (oxy)nitrides. Their initial breakthrough came with the development of the TaON photocatalyst, which they reported could drive OER using Ag+ as an electron acceptor under visible light irradiation (420 < λ < 500 nm). The TaON material has a baddeleyite-type structure, with the occupational ordering of anions in alternating layers of NTa4 and OTa3 along the [100] direction, as shown in Fig. 6(a) . In this structure, each NTa4 tetrahedron is connected to four corner-shared NTa4, four edge-shared NTa4, two corner-shared OTa3, and one edge-shared OTa3. Conversely, each OTa3 triangle is linked with twelve corner-shared NTa4, one edge-shared NTa4, three corner-shared OTa3, and one edge-shared OTa3 [98]. The TaON particles were synthesized by annealing Ta2O5 in an NH3 flow. This process replaced some of the O2− ions in Ta2O5 with N3−, resulting in a VB composed mainly of N 2p with a minor contribution from O 2p orbitals and thus a reduced bandgap of 2.5 eV (λ < 500 nm), compared to the larger bandgap of Ta2O5 (3.9 eV) (Fig. 6(b)). Later that same year, the Domen team [99] introduced tantalum nitride, Ta3N5, which exhibited a higher degree of nitridation compared to TaON and was capable of both H2 and O2 evolution in the presence of sacrificial reagents. Ta3N5 comprises edge-shared TaN6 octahedral units, where each tantalum atom is coordinated with six nitrogen atoms, and the nitrogen atoms are three- or four-fold coordination. Since the VB of Ta3N5 consisted of only N 2p orbitals, its bandgap further decreased to 2.1 eV (λ < 600 nm). To guide the development of (oxy)nitrides, Domen et al. [100] conducted detailed studies of the electronic structures of Ta2O5, TaON, and Ta3N5 using ultraviolet photoelectron spectroscopy (UPS) and electrochemical analyses. They found that while the conduction band minimum (CBM) positions of Ta2O5, TaON, and Ta3N5 were relatively similar, there was a significant variation in their valence band maximum (VBM) positions. The potential energy differences with respect to O2/H2O decreased in the order of Ta2O5 < TaON < Ta3N5. The bandgap energies were determined to be 3.9, 2.4, and 2.1 eV, respectively, as shown in Fig. 6(b). These experimental findings aligned with density functional theory (DFT) calculations and neutron and synchrotron diffraction analyses, which revealed that the CBs of these materials primarily consisted of Ta 5d orbitals, while their VBs were mainly composed of O 2p, O 2p + N 2p, and N 2p orbitals for Ta2O5, TaON and Ta3N5, respectively [98]. These electronic analyses confirmed that TaON and Ta3N5, with their visible light absorption ability, are thermodynamically suitable for photocatalytic water splitting. In the following years, various optimizations in synthesis methods and modifications, including surface passivation, defect engineering, and elemental doping, were applied to enhance the photocatalytic performance of Ta3N5 and TaON for HER or/and OER [101,102]. Particularly, surface modification with thermally stable ZrO2 nanoparticles (10–30 nm) as the protectors effectively inhibited the formation of Ta4+ (or Ta3+) which typically results from the reduction of Ta5+ during nitridation. Such surface modification effectively reduced defect density in TaON, thereby more than doubling its activity for HER [103]. Subsequent studies revealed that doping Zr4+ into TaON or Ta3N5 produced similar benefits as ZrO2 surface modification. Furthermore, co-doping with Zr and Mg reduced defect density while simultaneously modulating the surface properties [104,105], leading to an increase in electron concentration and extended the lifetimes of photogenerated carriers. When Pt cocatalyst was loaded on Zr and Mg co-doped Ta3N5, the H2 evolution rate was increased 45-fold compared to pristine Ta3N5 [105]. At this stage of research, as improvements were made to TaON and Ta3N5 for sacrificial HER or OER, these materials were used to construct Z-scheme systems for overall water splitting. For example, a Z-scheme system combing ZrO2-modified TaON (HEP), WO3 (OEP), and I−/IO3 − (redox mediator) achieved a recorded AQY of 6.3% at 420 nm at that time. The remarkable performance of TaON for HER attracted further attention from other researcher groups, leading to subsequent studies that increased the AQY at 420 nm to more than 10% [106–108]. TaON is capable of evolving both H2 and O2 in the presence of electron donor and acceptor, respectively, making them promising candidates for non-sacrificial water splitting once charge-separation efficiency and surface catalysis are improved. In 2013, Domen et al. [93] reported the first instance of using ZrO2-modified TaON for photocatalytic water splitting, where core/shell-structured RuO x /Cr2O3 nanoparticles and colloidal IrO2 were co-loaded to facilitate HER and OER, respectively. These cocatalysts were effective in extracting electrons and holes from TaON, promoting surface reactions. However, the random loading of these cocatalysts on TaON may cause charge recombination, resulting in low water splitting activity, with an AQY of < 0.1% at 420 nm. Subsequent improvements were made by reducing the particle size of TaON and lowering its defect densities. This was achieved by using amorphous Ta2O5·3.3 H2O nanoparticles as a new precursor for synthesis, alongside Zr doping and optimized nitridation conditions. As a result, the water-splitting activity was enhanced by an order of magnitude [91]. TaON was among the first oxynitrides studied due to its relatively large bandgap, which provides a strong driving force for charge separation. Consequently, TaON exhibits the highest H2 and O2 evolution activities among oxynitrides. However, its wide bandgap limits its ability to absorb sunlight with wavelengths shorter than 500 nm, resulting in a theoretical maximum STH efficiency of ~8%. Additionally, TaON is a transitional phase between Ta2O5 and Ta3N5, often leading to impurity formation during synthesis. These limitations have shifted subsequent research towards Ta3N5, which offers a narrower bandgap and simpler synthesis methods. For Ta3N5, the long-term nitridation process often leads to aggregated polycrystalline particles [109], which contain numerous grain boundaries and defects that act as recombination and trapping centers for photogenerated electrons and holes. Consequently, despite the activity of Ta3N5 for sacrificial H2 and O2 evolution, its water-splitting activity remained negligible [110–112]. To address these challenges, Domen et al. [90] developed a new approach to preparing Ta3N5. This method involved the in situ growth of Ta3N5 nanorods on a lattice-matched cubic KTaO3 template. During nitridation, K+ in the edges of cubic KTaO3 slowly evaporated and the remaining TaO x was rapidly converted to single-crystalline Ta3N5 nanorods without grain boundaries, as shown in Fig. 6(c). By shortening the nitridation time, the Ta3N5 nanorods avoided prolonged exposure to the highly reductive NH3 atmosphere, thereby reducing the formation of defects and the presence of Ta4+ and Ta3+ species. These single-crystal Ta3N5 nanorods were active for photocatalytic water splitting (Fig. 6(d)), achieving an AQY of 2.2% at 320 nm (± 25 nm). 2.2.2 d0-metal-based oxynitrides Perovskite oxides with an ABO3 structure provide an ideal template for developing oxynitrides because the valence variation resulting from substituting O2− with N3− can be balanced by adjusting the metal valences at the A and B sites. With this train of thought, Domen et al. [113] developed a series of perovskite-type oxynitrides with structures of ABO2N or ABON2, incorporating elements such as La3+, Ca2+, Sr2+ and Ba2+ at the A site, and Ti4+, Nb5+ and Ta5+ at the B site. These photocatalysts, including LaTiO2N, BaTiO2N, BaTaO2N, CaNbO2N and LaMg1/3Ta2/3O2N, have been confirmed to be responsive to visible light and thermodynamically suitable for water splitting. Domen and his team first reported the LaTiO2N for photocatalytic HER and OER in the presence of sacrificial reagents under visible-light irradiation (420 < λ < 600 nm) [114]. As shown in Fig. 7 , the LaTiO2N consists of TiO x N y octahedral (x + y = 6) frameworks with La3+ located in the center space, surrounded by eight TiO x N y octahedra. The band structure of LaTiO2N aligns with the characteristics of transition metal-based oxynitride materials discussed earlier, where the VB is composed primarily of N 2p orbitals and a minority of O 2p orbitals, while the CB consists of empty Ti 3d orbitals [61]. This structure results in a narrow bandgap, corresponding to a light absorption edge wavelength of ~600 nm [115]. Despite its advanced structure, LaTiO2N showed minimal activity for HER, probably because its CB composed of Ti 3d orbitals is only slightly above E(H+/H2) [114]. Conversely, LaTiO2N has proven to be one of the most active oxynitrides for OER. By nitridating mesoporous and microporous single-crystalline La2Ti2O7, which was obtained through a flux method, and being loaded with CoO x by post-nitridation, LaTiO2N stably evolved O2 from Ag+ aqueous solution with an AQY of 27.1 ± 2.6% at 440 nm [116]. Leveraging its remarkable OER performance, LaTiO2N was incorporated into a photocatalyst sheet for Z-scheme overall water splitting [117]. The activities of LaTiO2N for both HER and OER were further enhanced by removing the disordered surface layer using aqua regia [118]. This etching treatment eliminated surface defects in LaTiO2N, facilitating intimate contact with cocatalysts. However, this photocatalyst has not yet achieved water splitting, probably due to the unbalanced activities for H2 and O2 evolution. In comparison with LaTiO2N, ATaO2N (A = Ca, Sr, Ba) oxynitrides possess more negative CBs consisting of Ta 5d orbitals, which contribute to their decent activities for HER from sacrificial methanol aqueous solutions. Among these, CaTaO2N and BaTaO2N have demonstrated stable water-splitting capabilities in Z-scheme systems when combined with WO3 as an OEP and I−/IO3 − as a shuttle redox [119,120]. BaTaO2N, in particular, has garnered significant attention in subsequent studies due to its long light absorption edge of ~660 nm and relatively high stability. For instance, the forming of BaTaO2N-BaZrO3 solid solution was shown to enhance charge separation and reduce defect density, leading to a 9-fold increase in HER when using an electron donor [121]. Notably, even without forming a solid solution, a well-defined BaTaO2N photocatalyst can be prepared by adding BaCO3 into the precursors and using RbCl as a flux agent (Fig. 8 ). This synthesis method effectively suppressed the formation of impurities such as the Ta3N5 phase, and reduced defects like Ta4+ species and anion vacancies. The obtained BaTaO2N consisted of single-crystalline particles with exposed {100} and {110} facets, which facilitated efficient spatial charge separation [122]. When Pt was loaded as an HEC using a stepwise impregnation-photodeposition method, BaTaO2N evolved H2 from a methanol aqueous solution with an AQY of 6.8% at 420 nm. Additionally, in a Z-scheme water-splitting system (Pt/BaTaO2N|IO3 −/I−|PtO x /WO3), an STH of 0.24% was achieved [123]. While using flux-assisted nitridation is an effective approach for obtaining faceted and single-crystalline particles, this process typically results in particles with micrometers-scale sizes, which increases the migration distance of charge carriers to the surface for redox reactions. To address this challenge, Domen and his team optimized the precursor recipe, successfully reducing the particle size while maintaining the high crystallinity of perovskite-type photocatalysts [124]. By thermally nitriding a mixture of tantalum disulfide, metal hydroxides (A(OH)2), and molten-salt fluxes (e.g., SrCl2), they synthesized ATaO2N (A = Sr, Ca, Ba) single-nanocrystalline particles with sizes in the tens of nanometers. These particles exhibited excellent crystallinity and a tunable long-wavelength light response. Taking SrTaO2N as an example, after loading a Cr2O3/Ir-Pt cocatalyst to promote both reduction and oxidation reactions, the photocatalytic HER activity increased by two orders of magnitude. Furthermore, Z-scheme water splitting (Cr2O3/Ir-Pt/SrTaO2N|[Fe(CN)6]3−/ [Fe(CN)6]4−|Ir-CoFeO x /BiVO4) was first realized using this material, with an STH of 0.15% [124]. In addition to their use in sacrificial H2/O2 evolution and Z-scheme water splitting, ATaO2N oxynitrides have also been explored for one-step photoexcitation water splitting. The first successful example was a solid solution perovskite-type material, LaMg x Ta1−x O1+3x N2−3x (x ≥ 1/3), in which Ta5+ ions were stabilized by Mg2+ on the same site [85]. This material represents the first photocatalyst in the 600-nm class capable of one-step photoexcitation water splitting. To mitigate photocorrosion, LaMg x Ta1−x O1+3x N2−3x required protection with an amorphous TiO2 (a-TiO2) layer. The absence of an OEC in this system likely contributed to the limited AQY of 0.18% at 440 nm [85–87]. Similar strategies for cocatalyst loading and surface coating were applied to CaTaO2N [72]. Although one-step photoexcitation water splitting was also realized with this material, its effectiveness was constrained by its relatively short light-absorption edge wavelength of ~510 nm [72,73]. The development of LaMg x Ta1−x O1+3x N2−3x (x ≥ 1/3) demonstrates the potential of doping ATaO2N oxynitrides with aliovalent cations at the Ta sites to enhance their photocatalytic performance. By combining Mg doping with flux-assisted nitridation using RbCl, as mentioned in the previous paragraph, single-crystal Mg-doped BaTaO2N (BaTaO2N:Mg) particles were obtained, exhibiting increased charge densities, prolonged carrier lifetimes, and improved surface properties. With the loading of Rh/Cr2O3 and IrO2 cocatalysts, BaTaO2N:Mg successfully achieved one-step photoexcitation water splitting under visible light irradiation (λ > 420 nm), though the STH remained low at 4 × 10−4% [70]. Additionally, the use of amorphous Ta2O5·3H2O as a precursor, known for its advantages in activating TaON, was extended to synthesize BaTaO2N in combination with BaCO3. This recipe reduced the nitridation time to obtain crystallized BaTaO2N, thereby reducing the defect density. Modified with Rh (or Ru), Cr2O3, and IrO2 cocatalysts, this obtained BaTaO2N was capable of one-step photoexcitation water splitting, achieving an AQY and STH of 0.1% (420 nm) and 5 × 10–4%, respectively [71]. In light of these advancements, the synthesis of SrTaO2N, previously thought to be unstable, was revisited. Single-crystallized SrTaO2N was successfully obtained by nitriding SrCl2 and Ta2O5 with a NaOH additive. This method suppressed defect formation, allowing SrTaO2N to be active for one-step photoexcitation water splitting [88]. In comparison to ATaO2N oxynitrides, their niobium analogues, ANbO2N, exhibit broader light absorption spectra, with edge wavelengths of 600–750 nm [125,126]. Among these, CaNbO2N has demonstrated photocatalytic activity for both H2 and O2 evolution in aqueous solutions when using electron donors and acceptors, respectively. BaNbO2N, despite the longest light-adsorption-edge wavelength of ~740 nm, initially showed no activity for H2 or O2 production. However, upon loading Pt and CoO x cocatalysts, BaNbO2N became effective for sacrificial H2 and O2 evolution, respectively. In addition, adding BaCO3 into the Ba5Nb4O15 precursor improved the crystallinity and uniformity of BaNbO2N [127]. 2.2.3 d10-metal-based (oxy)nitrides The previous section discussed oxynitride photocatalysts based on transition metals with a d 0 electronic configuration. In these materials, the structural distortion of octahedral M(O/N)6, where M is the core transition metal ion, significantly impacts electronic delocalization and photocatalytic activity. Metals with an occupied d orbital, i.e., d 10 configuration, exhibit similar behavior to the d 0 configuration from a quantum chemistry perspective [128]. However, there are distinct differences in their band structures. For a d 0-type photocatalyst, the CB typically consists solely of d orbitals of the transition metal (e.g., Ta 4d for Ta3N5). In contrast, d 10-type photocatalysts often feature CB made up of sp orbitals from the metal (e.g., Ga 4s4p for GaN). The broad sp orbitals cause significant dispersion of the CB in d 10-type photocatalyst, which possibly provokes high mobility of photogenerated electrons. Consequently, the d 10-based materials offer unique advantages and potential for photocatalysis [128]. Domen et al. [81] began their investigation by exploring typical d 10-metal nitrides, such as GaN and Ge3N4 as photocatalysts. In 2005, his group reported the use of RuO2-loaded β-Ge3N4 as a photocatalyst for overall water splitting, producing both H2 and O2. This achievement makes the first successful demonstration of photocatalytic overall water splitting with a non-oxide material, highlighting the potential of this new class of photocatalysts [81,82,129]. Additionally, (Zn2+ or Mg2+)-doped GaN, when loaded with RuO2, was also found to be active for overall water splitting [75]. Notably, only GaN doped with divalent metal ions was active for overall water splitting, while doping with tetravalent metal ions (e.g., Si4+, Ge4+) did not yield similar results. This suggests that the p-type properties of GaN, which influence the concentration and mobility of holes, played a decisive role in its photocatalytic activity. Following these developments, Domen et al. [130] also achieved overall water splitting using undoped GaN microcrystals modified with Rh2–y Cr y O3 as a HEC, exhibiting an AQY of ca. 0.7% under 320 nm monochromatic light, thanks to the high crystallinity of the as-prepared GaN and the careful selection of cocatalysts [131]. Though β-Ge3N4 and GaN, after various modifications, were developed for water splitting, the large bandgaps (> 3 eV) limited their activity to UV irradiation. In 2005, Domen et al. [16,133] discovered that the solid solution of GaN and ZnO, denoted as (Ga1−x Zn x )(N1−x O x ), exhibited visible-light responsiveness and was active for overall water splitting when loaded with RuO2, despite both GaN and ZnO being UV-responsive on their own [135,136]. The wurtzite structure and similar lattice parameters of GaN and ZnO enabled the formation of this solid solution, with the X-ray diffraction (XRD) patterns showing shifts to lower angles (Fig. 9(a) ) and the light absorption edge shifting from 440 to 500 nm with varying x values (from 0.05 to 0.42) (Fig. 9(b)) [61,137,138]. Initially, the bandgap narrowing was ascribed to p-d repulsion between Zn 3d and N 2p electrons in the upper part of the VB dominated by GaN [16,133]. More detailed investigations using photoluminescence spectroscopy and DFT calculations revealed that Zn atoms introduced acceptor levels just above the VB, while O atoms contributed donor levels just below the VB. This provides abundant electrons that could occupy the Zn-acceptor levels, resulting in visible-light absorption of this solid solution due to the electron transition from the Zn acceptor levels to the CB consisting of Ga 4s and 4p orbitals (Fig. 9(c)) [139]. (Ga1−x Zn x )(N1−x O x ) loaded with Rh2−y Cr y O3 nanoparticles proved to be a stable photocatalyst for overall water splitting under visible light [17], probably because the holes were accumulated on Zn acceptor level rather than N 2p orbitals. The highest photocatalytic activity was obtained when x was 0.12 and the nitridation time lasted for 15 h, with an AQY of ~6% at 420−440 nm (Fig. 9(d)) [134]. Increasing ZnO concentration in the solid solution expanded the light absorption spectrum but significantly reduced the photocatalytic activity [76]. The solid solution (Zn1+x Ge)(N2O x ) of ZnGeN2 and ZnO, synthesized by the nitridation of ZnO and GeO2, is another stable photocatalyst for overall water splitting under visible light (λ < 500 nm) [94,95,140]. This material features a wurtzite structure with the space group P63 mc, where oxygen substitutes for nitrogen in the crystal lattice. These materials exhibit visible light absorption capabilities, with bandgaps ranging from 2.5 to 2.7 eV, which depend on the composition and preparation conditions. These values were notably smaller than those of ZnGeN2 (~3.3 eV) and ZnO (~3.2 eV). The reduction in bandgap is attributed to the large VB dispersion and elevation of the VBM, which originated from the energy differences between O 2p and N 2p orbitals, as well as p-d repulsion between Zn 3d and N 2p-O 2p electrons in the upper VB. Upon loading with RuO2, (Zn1+x Ge)(N2O x ) was active for overall water splitting under visible light (λ < 500 nm). The activity was further improved through composition optimization and modification with Rh2−y Cr y O3, resulting in Rh2−y Cr y O3/(Zn1.44Ge)(N2.08O0.38) with an AQY of ~0.2% at 420 nm [94]. The two solid solutions, (Ga1−x Zn x )(N1−x O x ) and (Zn1+x Ge)(N2O x ), were visible-light responsive and active for overall water splitting; however, their light-absorption-edge were limited to wavelengths < 500 nm. To broaden the light-absorption spectrum to ~600 nm, Domen et al. [141] developed a Ga-Zn-In-O-N compound by incorporating InN (~1 eV) into (Ga1−x Zn x )(N1−x O x ). Although the as-prepared Ga-Zn-In-O-N compound exhibited a wurtzite structure, it was classified as a mixed nitride rather than a solid solution. The complete nitridation of the precursor mixture (GaN, ZnO, and InN) was challenging due to the thermal instability of InN at high temperatures and insufficient reactivity at low temperatures [142]. As a result, the Ga-Zn-In-O-N nitride, when loaded with Rh and CoO x as cocatalysts, was capable of producing H2 and O2 from water in the presence of sacrificial reagents but remained inactive for overall water splitting. 2.2.4 Oxysulfides Pyrochlore-structure A 2Ti2O7 (A = Y, Ln (Pr, Nd, Sm, Gd, Tb, Dy, Ho and Er)) semiconductors have been explored for photocatalytic water splitting under UV irradiation [74,143]. By using A2Ti2O7 materials as a template and substituting two O2− ions with two S2− ions, Domen et al. [61] developed a series of visible-light-harvesting titanium-based oxysulfides (A2Ti2O5S2). Unlike typical metal-chalcogenide photocatalysts like CdS, A2Ti2O5S2 features a VB composed of S 3p and O 2p orbitals. This composition not only provides visible light absorption ability but also contributes to better resistance against photocorrosion, with the ability to oxidize water to O2. In 2002, Sm2Ti2S2O5 was reported for its light response up to 600−650 nm and its photocatalytic activity for HER and OER from sacrificial solutions [144]. This material belongs to the I4/mmm crystallographic group and features a Ruddlesden-Popper-type layered perovskite structure, in which the layers are composed of S-(TiO2)-O-(TiO2)-S double octahedra (Fig. 10(a) ). DFT calculations indicated that the VB is made up of hybridized O 2p and S 3p orbitals as well as localized Sm 4f orbitals, while the CB consists of Ti 3d orbitals and Sm 4f orbitals (Fig. 10(b)) [144,145]. Subsequent studies focused on optimizing cocatalyst loading, surface treatment, and synthetic conditions to adjust the crystal morphology and reduce defect density. For example, CoO x deposition, converted from previously sulfurized CoS x through calcination in air, reduced defect site formation and improved charge separation for OER [146]. Ag2S nanoparticles were demonstrated to dramatically boost photo-oxidation reaction by forming a heterojunction with Sm2Ti2S2O5 [147,148]. Mg2+ doping into Ti4+ sites inhibited the formation of Ti3+ defects and improved HER activity [149]. Morphology control, crystallinity improvement, and surface defects removal were achieved by flux-assisted synthesis and post-treatment etching process, leading to improved photocatalytic performance [150,151]. After optimization, Sm2Ti2S2O5 emerged as one of the most active photocatalysts for H2 evolution and was used in Z-scheme water splitting as an HEP, in combination with an OEP such as WO3 or BiVO4 [150,151]. For instance, a Z-scheme system consisting of Cr2O3/Pt/IrO2/Sm2Ti2O5S2 as HEP, CoO x /BiVO4 as OEP, and reduced graphene oxide as the solid-state electron mediator achieved stable water splitting for over 100 hours with an STH of 0.22% [152]. Along with Sm2Ti2O5S2, other isologues in the Ln2Ti2O5S2 series (Ln = Pr, Nd, Gd, Tb, Dy, Ho, and Er) were also investigated for photocatalysis [153]. The photocatalytic performance of these materials depends largely on their band structure and defect density, such as sulfur vacancies and reduced Ti3+ species. Among them, Gd2Ti2O5S2 exhibited the highest photocatalytic activities for both HER and OER in sacrificial solutions. Initially, the AQY was only about 0.1% in the visible light region. Subsequent improvements, including flux-assisted synthesis and post-etching process, yielded plate-like, single-crystal Gd2Ti2O5S2 particles with well-ordered surfaces. Additionally, ultrafine Pt-IrO x composite particles were deposited on Gd2Ti2O5S2 via microwave heating, ensuring intimate contact. This enhanced photocatalyst showed an impressive AQY of 30% at 420 nm for H2 production from aqueous methanol solution [152,154]. In 2019, Domen et al. [92] achieved one-step photoexcitation water splitting with Y2Ti2O5S2, a photocatalyst notable for its extended light-absorption-edge wavelength, which was the longest among photocatalysts capable of water splitting at that time. The material was synthesized via a solid-state reaction under a sulfur-vapor atmosphere in a sealed quartz tube. As illustrated in Fig. 11 , the prolonged reaction (~100 h) resulted in large particles (~10 µm) mainly composed of secondary particles (~1–2 µm). Y2Ti2O5S2 exhibits a narrow bandgap of 1.9 eV and a broad light absorption range of up to 650 nm. As the band edge of Y2Ti2O5S2 was not pinned by hydroxyl radical, its CB and VB potentials relative to E(H+/H2) and E(O2/H2O) were independent of the pH of the reactant solution [144], making it suitable for both HER and OER at pH 9. After loading Cr2O3/Rh and IrO2 to promote H2 and O2 evolution, respectively, Y2Ti2O5S2 was capable of driving one-step photoexcited water splitting. Though the STH was still low (~0.007%), significantly below the theoretical maximum value of ~20%, Y2Ti2O5S2 stands out as a cost-effective photocatalyst due to the absence of expensive elements. To improve the synthesis of Y2Ti2O5S2, the defect states and phase formation mechanism were studied in detail [155]. It was found that Y2Ti2O5S2 was not directly formed from starting precursors but via intermediated phases such as Y2Ti2O7, Y2O2S, and TiS2 during the synthesis. The stepwise phase generation might be responsible for the formation of grain boundaries and secondary particles. Additionally, increasing the heating rate tended to reduce the particle size and suppress impurity formation. Based on this study, flux-assisted synthesis was employed to refine the morphology and crystallinity of Y2Ti2O5S2. Using a MgCl2-CaCl2 mixture as flux produced 2D sheet-structured Y2Ti2O5S2 with radial sizes of several micrometers and thicknesses of a few nanometers [156]. However, the incorporation of Mg2+ ions during the synthesis led to planar defects composed of S-Mg-S layers, which acted as the charge recombination centers. Eliminating the planar defects by using only CaCl2 as flux resulted in single-crystalline Y2Ti2O5S2 nanosheets with dimensions of 3−6 µm in-plane and thicknesses of ~0.1 µm [157]. More importantly, these nanosheets exposed {001} and {101} facets in the plane and edge positions, respectively. The structure facilitated anisotropic charge migration and the facet-selective photodeposition of cocatalysts. With these improvements, Y2Ti2O5S2 achieved an AQY of 18.2% at 420 nm for photocatalytic HER in the aqueous solution containing Na2S/Na2SO3 as the hole scavengers. La5Ti2 MS5O7 (M = Cu, Ag) is another class of oxysulfides that contain only fragments of layers in structure rather than complete layered perovskite. Both La5Ti2CuS5O7 and La5Ti2AgS5O7 are visible-light responsive, with a bandgap of 1.90 and 2.25 eV, respectively [158]. DFT calculations revealed that their CBs are composed of Ti 3d orbitals, while the compositions of VBs differ: La5Ti2CuS5O7 features hybrid Cu 3d and S 3p orbitals, whereas La5Ti2AgS5O7 has only S 3p orbitals [159]. Similar to A2Ti2O5S2-type oxysulfides, La5Ti2AgS5O7 is a n-type semiconductor. In contrast, La5Ti2CuS5O7 exhibits weak p-type behavior due to the presence of Cu energy states acting as acceptor levels above the VB. Interestingly, La5Ti2MS5O7 particles exhibit a rod-like structure, with the CB and VB spatially localized along one-dimensional chains made of Ti(O,S)6 octahedra and MS2 tetrahedra, respectively [159]. These one-dimensional chains are aligned along the long axis of each rod-like particle, promoting one-dimensional charge migration in the same direction [160]. Due to the similar ionic sizes of Ag+ and Cu+, La5Ti2MS5O7 can form a solid solution, La5Ti2Cu x Ag1–x S5O7 (x = 0–1), with a bandgap ranging from 2.25 to 1.65 eV. The most extensively investigated solid solution, La5Ti2Cu0.9Ag0.1S5O7, has a bandgap of 1.75 eV and properties similar to La5Ti2CuS5O7. As the CBs of La5Ti2MS5O7 and its solid solution are positioned above E(H+/H2), and their VBs are just below E(O2/H2O), they are primarily investigated as a photocatalyst for HER [161,162]. For example, La5Ti2AgS5O7 used as an HEP in conjunction with WO3 as an OEP and an I3 −/I− redox couple as a shuttle mediator, achieved Z-scheme water splitting with an AQY of 0.12% at 420 nm [161]. Additionally, La5Ti2CuS5O7 and La5Ti2Cu0.9Ag0.1S5O7 were further applied in photocatalyst sheets (a type of microscopic tandem cell) for Z-scheme water splitting [163–165]. After careful cocatalyst engineering, the La5Ti2Cu0.9Ag0.1S5O7: Ga|Au|BiVO4:Mo sheet achieved an AQY of 11.8% at 420 nm and an STH of 0.4% at 301 K and 4 kPa [165]. Given their p-type semiconductor characteristics and long absorption-edge wavelengths, La5Ti2CuS5O7 and La5Ti2Cu0.9Ag0.1S5O7 are also widely applied as photocathodes for PEC water splitting [159,166–169]. With various modifications, including cocatalysts loading, element doping, morphology control, and surface protection, these photocathodes have achieved onset potentials as positive as +0.9 V vs. a reversible hydrogen electrode (RHE), although their current densities at 0 V vs. RHE were around 1 mA/cm2. 3 Advanced methodological strategies and techniques in photocatalysis 3.1 Cocatalyst modification 3.1.1 Deposition methods In 1978, Kraeutler et al. [170] reported the in situ photodeposition of Pt nanoparticles on the surface of the anatase-TiO2 using hexachloroplatinic acid (H2PtCl6) as the precursor and acetate as the sacrificial reagent. During this process, photo-induced electrons reduce the metal ions in the solution, forming metallic nanoparticles on the semiconductor surface, while the holes oxidize acetate to evolve CO2. These Pt nanoparticles not only functioned as active sites for catalytic reactions but also played a crucial role in suppressing electron-hole recombination by providing a carrier sink for rapid transfer [171,172]. In situ photodeposition allows for the selective loading of cocatalysts at reaction sites without requiring the activation step that is often necessary for cocatalysts loaded by impregnation. However, in situ photodeposition reactions at the surfaces or interfaces of materials are highly sensitive to the exposed surface atomic structures and their corresponding physicochemical properties. This sensitivity can result in unreliable processes, potentially leading to weak cocatalyst/semiconductor contact, which hampers efficient charge separation and transfer. Additionally, it sometimes formed larger cocatalyst particles with a lower specific surface area, thereby reducing the number of active sites [173]. To address the challenges associated with in situ photodeposition, Domen et al. [123] proposed an innovative approach that combines the impregnation and photodeposition methods for cocatalyst loading. The impregnation method typically disperses cocatalysts randomly on the photocatalyst surface, yet the cocatalysts require activation, such as reduction or oxidation, to gain high activities. In this approach, a photocatalyst like BaTaO2N was initially loaded with Pt cocatalysts using the impregnation method (Pt(imp)/BaTaO2N), followed by heat treatment under a H2 reduction atmosphere to form metallic Pt nanoparticles. Subsequently, photoreduction was employed to deposit additional Pt onto the Pt(imp)/BaTaO2N in the presence of methanol as an electron donor. This process aimed to improve Pt dispersion and create more active sites. The H2 evolution rates of the samples loaded Pt by impregnation (Pt(imp)/BaTaO2N), photodeposition (Pt(pd)/BaTaO2N), and the combination of impregnation and photodeposition (Pt(imp + pd)/BaTaO2N) were compared under visible light irradiation in an aqueous solution containing methanol as the electron donor, with the optimal Pt loading of 0.1 wt% for Pt(imp) and 0.2 wt% for Pt(pd). The AQY of (Pt(imp + pd)/BaTaO2N) was significantly enhanced by over 100 times compared to bare BaTaO2N, reaching 6.8% at a wavelength of 420 nm. Furthermore, when this optimized sample was used as the HEP in a Z-scheme water splitting system, combined with WO3 as the OEP and IO3 −/I− as a redox mediator, simultaneous evolution of H2 and O2 was achieved with an STH of 0.24%. Such a two-step cocatalyst deposition method has proven to be versatile. For instance, the Rh(imp + pd)/Ga-La5Ti2Cu0.9Ag0.1O7S5 sample was observed to produce nearly four times as much H2 as the Rh(pd)/Ga-LTCA sample under the same reaction conditions [174]. 3.1.2 Co-deposition of different cocatalysts During photocatalytic water splitting, asymmetric band bending within photocatalysts directs the movement of photogenerated electrons and holes toward the reductive and oxidative sites, respectively. At these reaction sites, water undergoes reduction to H2 and oxidation to O2, following typical electrochemical processes for hydrogen and oxygen evolution on metals or metal oxides [40,175,176]. In photocatalyst particles with irregular morphology, this asymmetric band bending is induced by loading cocatalysts with a Fermi level or work function different from that of the photocatalyst particles [177]. The effect can be intensified through facet engineering, which exposes crystal facets with varying surface potentials [40]. For optimal efficiency, cocatalysts for H2 and O2 evolution should be selectively loaded onto the corresponding reductive and oxidative crystal facets. This approach enhances asymmetric band bending, promoting charge separation and catalyzing surface reactions effectively. Early research in photocatalytic water splitting primarily focused on loading a single cocatalyst to function as either the H2 or O2 evolution site. Effectively co-depositing both HEC and OEC on a single particle proved challenging, as different cocatalysts can interfere with each other's activity. Domen et al. [77] reported the first example of successful co-deposition of HEC and OEC for effective photocatalytic overall water splitting. In their study, the core/shell structured Rh/Cr2O3 and Mn3O4 nanoparticles were loaded on GaN:ZnO photocatalyst serving as HEC and OEC, respectively. The amorphous Cr2O3 shells effectively suppress the backward reaction, which will be discussed in detail in Section 3.1.3 [178]. As shown in Fig. 12 , the photocatalytic activity for overall water splitting using GaN:ZnO co-loaded with core/shell Rh/Cr2O3 and Mn3O4 was greatly enhanced under visible light irradiation, compared to the sample loaded solely with Rh/Cr2O3 or Mn3O4. The H2 and O2 production rates improved with increasing the amount of Mn3O4 loading, reaching a maximum at 0.05 wt% (relative to the photocatalyst amount), beyond which the water splitting performance declined. The majority of photocatalysts require cocatalysts to drive the H2 and O2 evolution reactions efficiently because the reactions on semiconductors otherwise proceed slowly. The co-loading of OEC and HEC promotes charge separation and provides active sites for both H2 and O2 evolution reactions. This approach represents an effective strategy for enhancing photocatalytic performance and is sometimes indispensable for achieving overall water splitting. The development of co-loading HEC and OEC represents a significant milestone in this field, facilitating the development of new materials for enhanced overall water splitting. It has been successfully employed in various photocatalysts, enabling them to produce both H2 and O2 from water without the need for sacrificial reagents, including TaON, SrTaO2N, Y2Ti2O5S2, as well as the multi-band InGaN nanosheet photochemical diode [88,91–93,179]. The co-loading of different cocatalysts for different redox reactions has shown remarkable versatility, proving effective not only for H2 and O2 evolution reactions but also for other types of reactions [19,180]. For instance, in a visible-light-driven water oxidation reaction using a WO3 photocatalyst in the presence of IO3 − as an electron acceptor, PtO x and RuO2 were co-loaded as cocatalysts. PtO x facilitated the IO3 − reduction reaction to produce I−, while RuO2 promoted the water-to-O2 conversion [180]. Upon the additional loading of RuO2 as the OEC, the O2 evolution rate increased by nearly twice compared to PtO x /WO3. Similar to the co-loading of Rh/Cr2O3 and Mn3O4 on GaN:ZnO, the optimal loading amount of RuO2 on the PtO x (0.5 wt%)/WO3 sample was very small (0.001 wt%). This further supports the observation that the optimal loading amount of a secondary cocatalyst is relatively low, which appears to be a common trend in photocatalysts modified with two different cocatalysts. Photoelectrochemical analyses revealed that the performance of PtO x /WO3 in reducing IO3 − was slightly degraded after co-loading even a small amount of RuO2 (0.001 wt%). With a further increase in the RuO2 co-loading amount, the photoelectrode performance decreased significantly. Therefore, the loading amount of OEC is key to successful co-loading; typically, a small amount of OEC is sufficient to provide oxidation active sites without dramatically compromising the HEC performance. Apparently, the synergistic interaction and spatial segregation of HEC and OEC are crucial for facilitating effective overall water splitting via photocatalysis. Employing facet engineering to direct OEC and HEC to their respective active sites represents an elegant strategy for controlling cocatalyst spatial distribution. The process of photodeposition was observed to cause selective migration of photoexcited electrons and holes to different facets of the photocatalysts, influenced by the active sites and electronic energy levels on different facets [88,91–93]. Li et al. [181,182] demonstrated spatial separation of reduction and oxidation sites on 18-facet SrTiO3 nanocrystals. By optimizing Pt HEC loading on {001} facets and Co3O4 OEC on {110} facets of SrTiO3, they achieved a 5-fold increase in the AQY for photocatalytic water splitting compared to 6-facet SrTiO3 with isotropic facets. The enhanced photocatalytic activity can be attributed to the improved net driving force for charge separation, facilitated by the different built-in electric fields at distinct facets, and the increased symmetry of the surface electric fields due to the asymmetric assembly of cocatalysts. Subsequently, Domen et al. [46] applied a similar strategy to that used by Li et al. [182] for SrTiO3:Al. This involved the selective photodeposition of cocatalysts—Rh/Cr2O3 as the HEC and CoOOH as the OEC—on different crystal facets. This approach utilized anisotropic charge transport, leveraging a charge rectification effect within the photocatalyst particles induced by an internal electric field. As a result, the Rh/Cr2O3 HEC was deposited via reduction on {100} facets, while the CoOOH OEC was deposited via oxidation on {110} facets and adjacent surfaces that collect holes (Fig. 13 ). As a result, the water-splitting reaction was remarkably enhanced, allowing multiple consecutive forward charge transfers without backward charge transfer (Fig. 13(c)). The SrTiO3:Al co-loaded with Rh/Cr2O3 and CoOOH achieved an external quantum efficiency of up to 96% at 350−360 nm (Fig. 13(d)), corresponding to near unity internal quantum efficiency. This study illustrates the potential to eliminate charge recombination through smart and deliberate material design, providing valuable insights for future advancements in this field of research [39,183,184]. 3.1.3 Surface modification for HEC Backward reactions involving molecular oxygen, such as the production of water from generated H2 and O2, as well as the oxygen reduction reaction, present significant challenges during the simultaneous production of H2 and O2 via water-splitting reactions. Additionally, many effective HECs, exemplified by Pt, also effectively catalyze the oxygen reduction reaction through electrocatalytic means. Because the distance between H2 and O2 evolution sites on a photocatalyst particle typically spans several tens of nanometers, the H2 evolution reaction on HEC competes with the backward reaction. Therefore, it is vital to suppress these backward reactions to achieve efficient overall water splitting. To address this issue, Domen team developed an effective strategy by coating the co-catalyst and/or photocatalyst with an oxide layer that functions as a molecular sieve. This coating helps to selectively control the interactions at the interface, improving the overall performance and stability of the photocatalytic system. The first core-shell-structured cocatalyst, NiO/Ni, where the metallic HEC (Ni) was covered by a thin layer of metal oxide (NiO), was reported by Domen et al. [27,45] in the 1980s. They used the impregnation method to deposit NiO onto SrTiO3 particles, resulting in a core/shell Ni/NiO core-shell structure after undergoing reduction and reoxidation treatments (Fig. 14(a) ). Upon calcination of the Ni(NO3)2-SrTiO3 mixture, prepared through impregnation in air, NiO became the predominant species on the SrTiO3 surface, exhibiting negligible activity for water splitting. Reduction with H2 converted NiO primarily to metallic Ni, but the catalyst remained ineffective, with no observable oxygen evolution. Subsequent reoxidation with O2 resulted in the formation of a NiO/Ni cocatalyst with a core-shell structure, which was then capable of decomposing water into H2 and O2 under light irradiation. However, excessive reoxidation at high temperatures caused the metallic Ni to dissipate from the SrTiO3 surface, leaving behind NiO with greatly reduced activity. This highlights the critical role of the structure and valence state of Ni species loaded onto the SrTiO3 surface in determining its photocatalytic activity for the overall water-splitting reaction. During photocatalytic water splitting, the metallic Ni core received electrons from the CB of SrTiO3, providing active sites for HER. Simultaneously, the NiO shell effectively shielded the Ni core from oxygen, thereby preventing backward reactions. Notably, although NiO-loaded SrTiO3 exhibited lower activity for overall water splitting than NiO/Ni-modified SrTiO3, NiO itself is a potent cocatalyst that significantly enhances the activity of some photocatalysts, such as NaTaO3 and KTaO3 [185,186]. One of its notable advantages is its inertness towards the typical backward reaction of water splitting compared to noble metals. However, not all metal species can form permselective thin oxide layers through reduction and reoxidation treatments. Therefore, there is a need to develop universally applicable permselective oxide layers. In industrial electrolysis processes for producing NaClO3 from aqueous salt solutions [187,188], which involve creating a Cr(OH)3·nH2O film that selectively blocks the permeation of large O2 molecules while allowing the passage of protons, water, and H2. Domen et al. [79] examined mixed oxide as cocatalysts and occasionally found that Cr2O3 when co-loaded with other metal oxides, worked as a permselective layer for cocatalysts. This topic will be discussed in more detail later. They in situ photodeposited the Cr2O3 (or Cr(OH)3·nH2O) layer using K2CrO4 as a precursor, covering noble metals (such as Ru, Rh, Pt, and Pd) or metal oxide cocatalysts (such as NiO x , RuO2, and Rh2O3) and to form a core-shell structure [78]. The role of the Cr2O3 layer in photocatalytic water splitting was examined through electrochemical experiments and in situ IRAS measurements. As illustrated in Fig. 14(b), the results confirmed that Cr2O3 acted as a permselective layer, allowing the diffusion of protons and H2 while inhibiting the movement of O2. A subsequent study by Takanabe et al. [189] demonstrated that the Cr2O3 layer was also impermeable to ferricyanide, IO3 –, S2O8 2–, H2O2, and gaseous CO. The surfaces of some photocatalysts, exemplified by LaMg1/3Ta2/3O2N, can also facilitate the backward reactions of water splitting. Applying a Cr2O3 layer to Rh2–y Cr y O3/LaMg1/3Ta2/3O2N was ineffective because this layer was selectively deposited only on the Rh2–y Cr y O3 HEC and not on the LaMg1/3Ta2/3O2N surface [85,190]. As a result, severe backward reactions could still occur on the photocatalyst surface (Fig. 15(a) ), leading to the evolution of H2 and O2 via water splitting in a non-stoichiometric ratio. To address this issue, Domen et al. [85] developed the use of an amorphous TiO2 layer (a-TiO2) as a new permselective layer on Rh2–y Cr y O3-loaded LaMg1/3Ta2/3O2N. This approach successfully achieved the steady evolution of H2 and O2 through overall water splitting in an expected 2:1 ratio (Fig. 15(b)). The a-TiO2 layer did not function as a photocatalyst or an electron/hole-transport layer [191]. The H2O molecules and H+ ions in the hydrated a-TiO2 layer acted as reactants during water splitting. H2 and O2 molecules generated on the cocatalyst/photocatalyst were transported across the flexible a-TiO2 layer driven by a pressure gradient. However, the reverse transport of H2 and O2 was not possible due to the higher pressure beneath the oxide layer. This mechanism prevented both O2 reduction and water formation from H2 and O2 (Fig. 14(c)). While an accumulation of H2 at the cocatalyst/photocatalyst interface may increase the overpotential for H2 evolution, slightly decreasing water splitting activity, it did not lead to H2 oxidation on the cocatalyst, as the cocatalyst functioned as a reduction site. Additionally, the high polarity and hydrophilicity of a-TiO2 improved reaction selectivity by suppressing the transfer of less polar (i.e., less hydrophilic) molecules, such as O2, from the reaction solution to the cocatalyst/photocatalyst surface. Oxyhydroxides of additional group IV and V transition metals, such as Zr, Ta, and Nb, also showed the potential to act as permselective amorphous layers akin to a-TiO2, although their effectiveness in enhancing photocatalytic activities varied. In addition to inhibiting the backward reactions, these amorphous layers help stabilize LaMg1/3Ta2/3O2N by preventing self-corrosion. It is believed that the layers facilitate h+ injection into oxygen species within the amorphous layer (i.e. OH groups or hydrated water), thereby suppressing the excessive accumulation of h+ in the nitrogen species on the LaMg1/3Ta2/3O2N surface. 3.1.4 Two-component cocatalysts Pt is widely used as a cocatalyst for H2 evolution on photocatalysts in the presence of electron donors. However, its catalytic activity for backward reactions makes Pt unsuitable for overall water splitting on single particles. In an early study, Domen et al. [83] discovered that the overall photocatalytic water-splitting performance was slightly enhanced after adding Cr to NiO x -loaded K2La2Ti3O10 through the impregnation method. Building on these findings, in 2006, they developed two-component cocatalysts comprising Cr combined with another transition metal, such as Ni, Ru, Rh, Ir, and Pt, to enhance the efficiency of photocatalytic water splitting using (Ga1–x Zn x )(N1–x O x ) photocatalysts [192]. The photocatalytic overall water-splitting activity was significantly enhanced by two orders of magnitude with the introduction of the Rh2–y Cr y O3 cocatalyst compared to using Rh alone. Interestingly, although loading (Ga1–x Zn x )(N1–x O x ) with Fe, Co, Cu, Pd, or Ag alone was not active for overall water splitting, co-loading Cr with one of these otherwise inactive metals resulted in measurable photocatalytic activity. This result indicates that co-loading Cr facilitated charge transfer from the photocatalyst bulk to the cocatalyst and/or to create catalytic sites on the cocatalyst surface. Rh2–y Cr y O3 has been demonstrated as an effective H2 evolution promoter on various photocatalysts including (Ga1–x Zn x )(N1–x O x ), ZnNb2O6, β-Ge3N4, and β-Ga2O3, as evidenced by the higher H2 production rate compared to samples loaded solely with Ni, Rh, RuO2, NiO or left unloaded. The co-loading of Cr was effective not only for enhancing the water-splitting rate but also for suppressing the deactivation of the Ni catalyst, whose chemical states changed during the reaction. Note that the optimal Cr loading varies with the co-loaded transition metal. For example, the optimal Cr amount in Ni (1.25 wt%)-Cr on (Ga1–x Zn x )(N1–x O x ) was 0.125 wt%, while for Rh (1 wt%)-Cr, it was 1.5 wt%. The optimal Cr/metal ratio is also affected by the base photocatalyst; for instance, the Cr optimal amount in Ni (3 wt%)-Cr on K2La2Ti3O10 changed to 0.5 wt%. Studies using time-resolved photoluminescence and transient absorbance spectroscopies have elucidated the charge carrier dynamics of Rh2–y Cr y O3/(Ga1–x Zn x )(N1–x O x ), revealing efficient electron transfer from (Ga1–x Zn x )(N1–x O x ) to Rh2–y Cr y O3 within sub-microsecond timescales [193]. This process is crucial for reducing the electron concentration within (Ga1–x Zn x )(N1–x O x ) and promoting hole accumulation. Importantly, the rates of H2 and O2 evolution from water using Rh2–y Cr y O3-loaded (Ga1–x Zn x )(N1–x O x ) remained nearly unchanged under varying background reaction pressures and in the presence of O2 gas. This indicates that Rh2–y Cr y O3 acted as a cocatalyst for H2 production from protons without facilitating the oxygen reduction reaction [194]. The mechanism behind the oxygen reduction reaction resistance of Rh2–y Cr y O3 has not been fully elucidated. One proposed explanation suggests that within the microstructure of Rh2–y Cr y O3 nanoparticles, Rh species are encapsulated with a thin CrO x overlayer. This overlayer acts to inhibit the reaction of O2 and H2 on Rh species, thereby preventing the consumption of H2 and inhibiting the O2 reduction [89]. Since then, the Rh2–y Cr y O3 cocatalyst has been widely employed on various photocatalyst surfaces, including GaN [130], Ca2Nb2O7 [195], (Zn1+x Ge)(N2O x ) [96], LaMg x Ta1–x O1+3x , and SrTiO3 [12], to facilitate the cleavage of water into H2 and O2. Incorporating Rh2–y Cr y O3 onto the surface of Al-doped SrTiO3 notably enhanced its water-splitting activity, achieving an AQY of 56% ± 3% within the wavelength of 365 nm and an STH of 0.4%. 3.2 Z-scheme system 3.2.1 Early works The photocatalytic overall water-splitting process is a thermodynamically uphill reaction, involving a significant increase in Gibbs free energy (237 kJ/mol at 298 K and 1 atm). This makes it challenging to produce both H2 and O2 simultaneously from water under visible light irradiation using a single photocatalyst. To date, the number of such photocatalysts is still limited [196]. An alternative approach involves constructing a Z-scheme system inspired by the two-step photoexcitation process found in natural photosynthesis in green plants. This Z-scheme photocatalysis system comprises a HEP, an OEP, and typically a shuttle redox couple (electron donor (D)/electron acceptor (A)) to mediate electron transfer between these two photocatalysts, as illustrated in Fig. 16(a) . In such a Z-scheme system, both the HEP and OEP generate electrons and holes upon light absorption. The electrons in HEP reduce water to H2, while the holes oxidize the electron donor (D) of the redox couple, producing the electron acceptor (A) as an oxidation product. Conversely, the holes in the VB of OEP oxidize water, generating O2 and reducing the electron acceptor (A) back to electron donor (D), achieving the overall water-splitting reaction [197–199]. The Z-scheme system effectively balances the need for a wide bandgap to drive water splitting with the requirement for visible light absorption to effectively utilize solar energy. This approach also allows for the use of semiconductors with suitable water reduction or oxidation potentials, thereby reducing both the energy needed for each reaction and the material requirements. The concept of a “dual n-type semiconductor model” based on two-step photoexcitation and the use of a redox couple as the electron transport chain was proposed by Bard in 1979 [200]. However, validating Z-scheme water-splitting systems has been challenging for a long time, primarily due to mismatches between the HEP and OEP, as well as between these photocatalysts and the redox mediators. Additionally, issues arise from side and backward reactions caused by these redox species. A prototype for Z-scheme photocatalytic water splitting was achieved by Sayama et al. [201] in 1997. In this study, RuO2-loaded WO3 served as the OEP, producing O2 from water in the presence of Fe3+ ions as electron acceptors. Simultaneously, H2 was generated by reducing protons in a photochemical process facilitated by the excitation of Fe2+ ions under UV light, accompanied by the oxidation of Fe2+ to form Fe3+. Stoichiometric evolution of H2 and O2 from water was achieved using this Z-scheme approach, despite employing only one photocatalyst combined with a photochemical process. In 2001, the first Z-scheme system employing dual photocatalytic blocks was developed by the same group [202]. It utilized Cr and Ta co-doped SrTiO3 as HEP, WO3 as OEP, and IO3 −/I− as a redox mediator, achieving an AQY of approximately 0.1% at 420 nm for overall water splitting. Inspired by such progress, Domen and his team [203,204] successfully developed effective photocatalytic Z-scheme water-splitting systems using various semiconductors. They discovered that the preferential selectivity of a photocatalyst towards water oxidation or reduction reaction was a key factor in establishing an effective Z-scheme system. For instance, Abe et al. [197] found that rutile TiO2 selectively adsorbed IO3 − while inhibiting the absorption of I−, leading to the selective oxidation of water over I− oxidation. Similar adsorption preferences were observed for Fe3+ ions on rutile TiO2, which favored water oxidation to produce O2 even in the presence of electron donors Fe2+. This preference arose because Fe3+ ions were more readily adsorbed on TiO2 compared to Fe2+ ions, thereby facilitating efficient water oxidation [205]. These findings highlight the importance of semiconductor photocatalyst surface states and their adsorption selectivity for redox ions in determining the performance of photocatalytic water-splitting reactions. 3.2.2 Z-scheme water splitting using narrow bandgap semiconductors Domen and his team utilized various (oxy)nitrides and oxysulfides with narrow bandgaps as photocatalysts in the Z-scheme for water splitting, aiming to enhance the effective utilization of visible light. The first instance of employing an oxynitride photocatalyst for Z-scheme water splitting was reported in 2002, utilizing Pt-loaded TaON as the HEP, Pt-loaded WO3 as the OEP, and IO3 −/I− as the shuttle redox couple [206]. Shortly thereafter, partially oxidized PtO x was introduced onto WO3 as a cocatalyst to enhance the reduction of IO3 −, thereby promoting O2 evolution. This modification resulted in achieving an AQY of approximately 0.4% at 420 nm in the established (Pt/TaON)|(IO3 −/I−)|(PtO x /WO3) Z-scheme system [207]. In 2010, Domen et al. [171] reported significant advancements in Z-scheme water-splitting systems using an efficient ZrO2/TaON HEP. They successfully suppressed electron-hole recombination in TaON through ZrO2 modification [103], pairing it with various OEPs such as Pt/WO3, rutile TiO2, RuO2/TaON, or BiVO4, along with shuttle redox mediators (IO3 −/I− or Fe3+/Fe2+). Their study highlights the critical importance of facilitating both proton reduction and oxidation of electron-donating ions on ZrO2/TaON for achieving effective overall water splitting. Thus, precise modification with cocatalysts and control of reaction conditions is vital. Among the combinations tested, Pt/ZrO2/TaON|IO3 −/I−|Pt/WO3 exhibited the highest activity because these components effectively drove forward reactions involving the redox couple (e.g., oxidation of I− on Pt/ZrO2/TaON and reduction of IO3 − on Pt/WO3), thereby minimizing undesired backward reactions, as illustrated in Fig. 16(b). Under optimal conditions, the system achieved an AQY of 6.3% at 420.5 nm, setting a new benchmark for visible-light-driven Z-scheme water splitting using particulate photocatalysts at that time. The performance of the system was further improved in subsequent work by Zhang and Li et al. [106] by replacing ZrO2/TaON with a MgTa2O6–x N y /TaON heterostructure as the HEP, achieving an AQY of 6.8% at 420 nm, setting a new record for Z-scheme overall water splitting in powder suspension form at that time. Domen et al. [120] demonstrated the versatility of the Z-scheme system construction strategy by successfully applying a series of perovskite-type mixed tantalum oxynitrides, specifically ATaO2N (where A = Ca, Sr, Ba) with the light absorption edges of 520, 600, and 660 nm, respectively. For instance, utilizing Pt/BaTaO2N as the HEP in conjunction with PtO x /WO3 as the OEP, and the IO3 −/I− redox couple, enabled the first realization of Z-scheme water splitting with a light-response range extending to 600 nm for HER. In Domen's recent research, single nanocrystals of ATaO2N (A = Sr, Ca, Ba) with excellent crystallinity and tunable long-wavelength responsiveness were successfully synthesized through thermal nitridation of mixtures of tantalum disulfide, metal hydroxides (A(OH)2), and molten-salt fluxes (e.g., SrCl2) as precursors [208]. These nanocrystals exhibited enhanced photocatalytic H2 or O2 evolution in the presence of sacrificial reagents, positioning them as promising candidates for developing Z-scheme water-splitting systems. For example, after modifying SrTaO2N with Ir-Pt alloy/Cr2O3 and combining it with Ir-CoFeO x /BiVO4 OEP and [Fe(CN)6]3−/[Fe(CN)6]4− redox mediator, an STH of 0.15% was achieved in a Z-scheme overall water splitting process [124]. Domen team emphasized the crucial role of cocatalyst modification in enhancing selectivity towards desired reactions. For instance, when TaON was exposed to an aqueous solution containing IO3 − under visible light irradiation, minimal O2 evolution occurred due to the preferential oxidation of I−, which was produced through the reduction of IO3 −. However, upon loading RuO2 nanoparticles onto the surface of TaON, the rate of O2 evolution was dramatically enhanced in aqueous IO3 − solution. Interestingly, RuO2/TaON exhibited reduced performance for OER in the presence of Ag+ as the electron acceptor compared to bare TaON, indicating that RuO2 primarily suppresses I− oxidation, thereby effectively improving its selectivity towards water oxidation [208]. Basis on it, the Pt/TaON and RuO2/TaON photocatalysts were employed as HEP and OEP, respectively, and were found to enable simultaneous evolution of H2 and O2 in an aqueous NaI solution under visible light (λ > 420 nm). In 2013, Domen et al. [151] pioneered the use of an oxysulfide capable of absorbing light up to approximately 650 nm for Z-scheme water splitting. Pt-loaded Sm2Ti2S2O5 suspended with rutile TiO2 (OEP) in an aqueous NaI solution successfully split water into H2 and O2 under UV irradiation (λ > 300 nm). Visible light-driven Z-scheme water splitting into H2 and O2 was achieved by replacing TiO2 with WO3, which was responsive to visible light, and using I3 −/I− as a shuttle electron mediator. The WO3 was treated with H+ and Cs+ and loaded with PtO x as the cocatalyst for I3 − reduction to I− [154]. Additionally, various other narrow-bandgap oxysulfide photocatalysts with HER activity, such as La5Ti2CuS5O7 and La6Ti2S8O5, have also been demonstrated to function effectively as HEP in similar Z-scheme water splitting systems. Redox mediators present in the reaction solution can induce side reactions, such as the reduction of oxidized mediators on the HEP and the oxidation of reduced mediators on the OEP (Fig. 16(b)), potentially leading to low water splitting efficiency. Therefore, a redox-mediator-free Z-scheme water-splitting system is highly desirable [209]. In such systems, achieving efficient electron transfer from the OEP to the HEP is crucial. To address this, solid-state electron mediators such as reduced graphene oxide (RGO), carbon, Au, and indium tin oxide (ITO) have been employed [196,198]. The first example was reported by Kudo et al. [210], who achieved Z-scheme overall water splitting by using RGO as a bridge to facilitate interparticle electron transfer between the HEP (Ru/SrTiO3:Rh) and the OEP (BiVO4). More recently, Domen et al. [152] employed the RGO as a solid-state mediator to enhance electron transfer between a HEP composed of Cr2O3/Pt/IrO2-loaded Sm2Ti2O5S2 and a CoO x -loaded BiVO4 OEP. This approach marked a significant advancement in photocatalytic overall water splitting performance compared to previous powder suspension systems using redox couples [151,154], achieved an AQY of 7.0% at 420 nm and an STH of 0.22% (Fig. 17 ). Subsequently, it was demonstrated that carbon nanotubes are also effective as solid-state mediators in the Cr2O3/Pt/Sm2Ti2O5S2/IrO2|carbon nanotube|CoO x /BiVO4 system for photocatalytic overall water splitting in a Z-scheme configuration. Based on the high stability and excellent charge transfer characteristics of carbon nanotubes, stoichiometric amounts of H2 and O2 evolved at near-ambient pressure, achieving an STH of 0.15% [211]. While solid-state mediators generally facilitate interparticle electron transfer, they can also lead to photoexcited electron-hole recombination and undesired back reactions, such as the oxygen reduction reaction, occurring on their surfaces. The representative Z-scheme water-splitting systems developed by the Domen team are summarized in Table 3 . 3.3 Preparation/fabrication techniques 3.3.1 Synthesis methods The structural and electronic properties of a photocatalyst, including its morphology, crystallinity, and defect density, are significantly influenced by the synthesis method. To prepare visible-light-responsive (oxy)nitride and (oxy)sulfide photocatalysts, Domen et al. [100,114] developed thermal nitridation/ sulfurization processes, as well as sealed-tube reactions. During thermal nitridation/sulfurization, the oxide precursor is annealed in a flow of NH3 or H2S, typically yielding single-phase and crystalline (oxy)nitride photocatalysts such as TaON and LaTiO2N. However, (oxy)sulfide photocatalysts, such as Y2Ti2O5S2 and La5Ti2Cu0.9Ag0.1O7S5, are often produced with impurities [174,217,218]. The highly reductive nature of H2S during thermal sulfurization necessitates precise control of the reaction time to avoid low crystallinity in the products. A common challenge in thermal nitridation and sulfurization is achieving stoichiometric products due to deficiencies in nitrogen or sulfur. In contrast, sealed-tube reactions, where stoichiometric precursors undergo a long-term solid-state reaction in an oxygen-free environment, are more effective in producing stoichiometric products [92,167]. However, this method, which typically involves high temperatures (e.g., 1000 °C) for extended periods (e.g., 100 h), often results in microscale, polycrystalline particles with structural defects, which are less ideal for photocatalytic applications. Moreover, sealed-tube reactions are more commonly used for synthesizing (oxy)sulfides than (oxy)nitrides, as stable nitride precursors are often unavailable [76]. To improve the crystallinity and control the morphology of the products, molten fluxes can be employed to assist the synthesis processes [70,88,91,105]. The flux, typically composed of alkaline or alkaline earth salt mixtures, is removed through post-washing. For instance, using CaCl2 as a flux in sealed-tube reactions significantly reduced the preparation time of Y2Ti2O5S2 compared to solid-state reactions [219]. The resulting Y2Ti2O5S2 exhibited smaller particle size and improved crystallinity, which enhanced both H2 and O2 evolution. The choice of flux is crucial to prevent impurity formation; for example, CsCl was avoided in the preparation of Y2Ti2O5S2 because alkali metal ions can easily intercalate into the Y2Ti2O5S2 structure. Template-assisted methods have also been explored to prepare photocatalyst particles with unique shapes [220,221]. As illustrated in Fig. 18(a) , Pt was first deposited on SiO2 particles, followed by the coating of Ta2O5 on Pt/SiO2 using a sol-gel method. After nitridation, Ta2O5 was converted to Ta3N5, and IrO2 or CoO x was deposited on the Ta3N5 surface via adsorption or impregnation. This resulted in a core/shell SiO2/Ta3N5 structure, with Pt nanoparticles on the inner Ta3N5 shell surface acting as an electron collector and IrO2 or CoO x on the outer shell surface serving as a hole collector. This core/shell structure provided a larger surface area and more active sites compared to a bulk structure. Furthermore, the spatial separation of cocatalysts promoted the separation and migration of photogenerated electrons and holes to the inner and outer surfaces, respectively, thereby reducing charge recombination and backward reactions. Although the core/shell SiO2/Ta3N5 structure with spatially separated cocatalysts significantly improved sacrificial H2 and O2 evolution (Figs. 18(b,c)), it was still limited in its ability to perform overall water splitting, likely due to the suboptimal chemical properties of the components used in its preparation. In addition to thermal nitridation/sulfurization and sealed-tube reactions, the crystal structure, morphology, and stoichiometry of oxide precursors significantly influence the photocatalytic activities of (oxy)nitride and (oxy)sulfide photocatalysts. In the Domen group, oxide precursors are typically synthesized using solid-state reactions, polymerized complex method, or a homogeneous precipitation method [85,87,222–224]. The solid-state reaction involves mixing metal oxides or salts and heating them at high temperatures to promote diffusion and reaction, leading to the formation of the desired oxide. This method is advantageous for its simplicity and the production of highly crystalline materials; however, achieving uniformity can be challenging, and the resulting particles exhibit noticeable grain boundaries. The polymerized complex method forms a polymeric network from metal ions and organic ligands, which decomposes upon calcination to produce oxides with controlled crystallinity and particle size [225,226]. This method is beneficial for producing nanoscale oxides with high surface areas, and critical for enhancing photocatalytic performance, though it may leave behind residual carbon impurities. The homogeneous precipitation method involves the gradual release of precipitating agents, such as NaOH, to form metal hydroxide mixtures in solution. These mixtures are then thoroughly washed to remove alkaline metal ions. Upon calcination, these intermediates decompose into oxides with fine particle sizes and uniform distribution. This method is particularly effective for synthesizing oxides with tailored stoichiometry and morphology, which are essential for optimizing the photocatalytic properties of the final (oxy)nitride or (oxy)sulfide materials. 3.3.2 Particle transfer method PEC cells designed for water splitting require semiconductor materials that efficiently capture a wide spectrum of solar radiation, enable rapid charge transfer at the semiconductor/liquid interface, and exhibit long-term stability. To meet these criteria, effective setups often adopt a multilayer film configuration where light-absorbing and surface production materials are similar to those used in solar cells, but submerged within an aqueous electrolyte [9]. Therefore, solar PEC water splitting faces challenges before solar hydrogen can compete with fossil fuels on a cost-per-energy basis. Substantial effort has been devoted to the fabrication of photoelectrodes based on cost-effective and high-crystallinity semiconductor powders, which can typically be synthesized on a large scale easily, such as squeegeeing [227], screen-printing [228], spraying [229] and electrophoretic deposition [230,231]. However, the photoelectrodes produced in this manner suffer from inefficient electronic contact between semiconductor particles and conductive substrates, resulting in high resistance and low photocurrent. To overcome these challenges and improve PEC performance and mechanical strength, “post-necking” treatment is commonly employed [232,233]. For instance, Abe et al. [234,235] utilized TiCl4 and heat treatments to form TiO2 between TaON particles, thereby bridging the particles and enhancing the interparticle electron transport. Nonetheless, this approach is not always practical, as identifying a suitable “post-necking” material and procedure for a specific photoelectrode material can be challenging. Moreover, the formation of multilayers of semiconductor particles increases the number of boundaries for carrier migration, which can hinder performance. To overcome these challenges, Domen et al. [234] pioneered the particle transfer method. This innovative technique is straightforward, versatile, and scalable, offering an alternative approach to traditional photoelectrode fabrication methods. The particle transfer method, illustrated in Fig. 19(a) , uses LaTiO2N as an example. Initially, LaTiO2N particles suspended in isopropanol are drop-casted on a glass substrate and dried. A thin metal layer (100–300 nm) is then coated on the particle layer using the radio-frequency magnetron sputtering method, ensuring ohmic contact with the semiconductors. Subsequently, another metal film, a few microns thick, is deposited using the sputtering method to provide sufficient conductivity and mechanical strength. A second glass substrate is then bonded to the layers with epoxy resin, after which the first glass layer is peeled off. Finally, excess particle layers are removed through ultrasonication in water, leaving only a monolayer of particles remaining on the surface. This method significantly improved the electrical contact between the substrate with semiconductor particles, reducing the barrier to charge transfer. Metals with high tolerance to aqueous electrolytes across a wide pH range, such as Ta, Nb, Ti, and Zr, are commonly used as contact and conductor layers [201]. In this study, the IrO2-loaded LaTiO2N photoanode, utilizing Ta as the contact layer and Ti as the conductor layer, achieved the highest photocurrent among the photoelectrodes examined using various contact and conductor layers (e.g., Ta, Nb, Ti, and Zr). Furthermore, the photocurrent was significantly enhanced compared to LaTiO2N electrodes prepared using a conventional simple coating of LaTiO2N particles on a fluorine-doped tin oxide (FTO) substrate. Gas product analysis showed a Faradaic efficiency of approximately 100% for OER using the LaTiO2N photoanode prepared via the particle transfer method. The particle transfer method has been demonstrated as an effective and versatile approach for preparing efficient photoelectrodes, including both photoanodes and photocathodes. For instance, La5Ti2CuS5O7 photocathodes prepared using the particle transfer method with a Pt contact layer and an Au conductor layer exhibited photocathodic currents at 0 V vs. RHE ten times greater than those of samples fabricated via pulsed laser deposition methods [167]. Similarly, the Co-loaded BaTaO2N photoanode coated with Ta|Ti metal films as contact and conductor layers, achieved a half-cell STH efficiency of 0.7% at 1.0 V vs. RHE under simulated sunlight irradiation (AM 1.5G, 100 mW/cm2) [236], as shown in Fig. 20(a) . This efficiency represented an order of magnitude improvement over previous reports for BaTaO2N prepared using a combination of electrophoretic deposition and post-necking methods [237]. The Faradaic efficiency of this PEC system for OER remained nearly 100% over 6 h (Fig. 20(b)). Apart from its application in fabricating photoelectrodes for HER or OER, the particle transfer method has been extended to establish scalable photocatalyst sheets for solar-light-driven overall water splitting, which will be discussed in Section 3.3.5 [13]. The particle transfer method ingeniously bridges two distinct worlds: particulate photocatalysts and compact, panel-structured photoelectrodes, making it possible to integrate cost-effective and mass-produced photocatalyst powders into efficient PEC systems. Traditional photoelectrodes made from semiconductor powders typically suffer from low photocurrents due to poor contact between the semiconductor and substrate, which leads to significant charge carrier recombination. This method addresses that challenge by fixing photocatalyst particles onto a conductive layer, forming a single layer of photocatalyst with an Ohmic contact at the semiconductor/metal interface and thus enhancing carrier extraction and significantly reducing recombination. The particle transfer method has revolutionized the development of advanced photoelectrodes, particularly benefiting the fabrication of electrodes made from complex semiconductors like oxynitrides and oxysulfides, which are challenging to produce as thin films using traditional techniques. Photoelectrodes fabricated using the particle transfer method have demonstrated performance on par with those made from uniform thin films. For example, a BiVO4 photoanode modified with NiO and CoO x prepared using the particle transfer method, showed similar water oxidation performance for oxygen production as photoelectrodes grown directly on FTO substrates via chemical reactions, achieving a half-cell STH of 1.5% [238,239]. However, due to the single-layer structure of these semiconductors, the light absorption capacity of samples produced via the particle transfer method can be limited, much like in thin-film photoelectrodes. Optimizing the thickness of these layers remains a significant challenge. 3.3.3 Film transfer method The n-type T3N5 semiconductor shows promise as a photoanode for PEC water oxidation due to its simple composition, narrow bandgap (2.1 eV), and suitable band structure. However, powder-based T3N5 photoanodes prepared by electrophoretic deposition suffer from inefficient electronic contact between the thick semiconductor particles and the conductive substrates at the interface [240,241]. Alternatively, Ta3N5 photoelectrodes, when grown as thin films or nanorods on conductive substrates like Ta foil, have shown improved PEC performance [242,243]. Nonetheless, Ta substrates proved to be non-durable under high-temperature treatments when researchers attempted to adjust film thickness and fabricate multiple-layer structures to enhance PEC activity [240,241,244]. Inspired by the particle transfer method used to assemble particulate semiconductors into photoelectrodes, Domen et al. [240,241] introduced a thin film transfer technique for fabricating Ta3N5 photoanodes. This method allowed for precise control over film thickness and optimization of synthesis conditions. The procedure of the film transfer method is shown in Fig. 19(c). Thin Ta films, for example, 570 nm thick, are deposited onto Si substrates using radio-frequency magnetron sputtering at a substrate temperature of 500 °C. After deposition, the Ta|Si samples undergo oxidation at 700 °C for 2 h in air to form Ta2O5 films. Subsequently, the Ta2O5|Si are nitride in gaseous NH3 at 900 °C for 2 h to produce Ta3N5 thin films on the Si substrates. Following this, layers of Ta (150 nm) and Ti (approximately 5 μm) are sputtered onto the as-nitrided Ta3N5 thin films. Finally, the Ta3N5|Ta|Ti films are successfully peeled away from the Si substrates using mechanical exfoliation [240,241]. The resulting porous Ta3N5 films can be uniformly transferred from the Si substrates by the Ta|Ti layers and form an intimate ohmic contact with the metal layer. The Faradaic efficiency of the Ta3N5|Ta|Ti film for PEC water oxidation under AM 1.5G simulated sunlight was confirmed to be nearly 100% through quantification of the evolved O2 (Fig. 21 (a) ). The thin film transfer method enables precise control over the thickness of Ta3N5 films and the formation of multilayer structures within the Ta3N5 film. For example, by introducing a niobium nitride (NbN x ) layer at the interface between the Ta3N5 film and the conductive substrate (Ta|Ti) using this technique, the photocurrent density at 1.23 V vs. RHE was enhanced compared to a Ta3N5|Ta|Ti photoelectrode. The introduction of the NbN x layer facilitated the formation of a 200 nm thick oriented Ta3N5 grain layer near the interlayer, thereby enhancing electron transport throughout the Ta3N5 film (Fig. 21(b)) [246]. These studies offer a method for preparing standalone film-structured photoelectrodes, which can be used in a range of applications, including the development of flexible or floating devices for future needs. The films can also be integrated with various substrates, such as solar cells to create “artificial leaf” devices or with photocathodes to fabricate wireless PEC cells. Nonetheless, the application of the film transfer method is currently limited to simple compounds due to the specialized film preparation process. To date, Ta3N5 photoanodes are the only examples reported using this technique, highlighting the need for modifications in the synthesis to enhance its versatility. 3.3.4 Roll-press method Domen et al. [247], in collaboration with Watanabe from Meiji University, developed another cost-effective, vacuum-free, readily accessible, and scalable approach known as the roll-press method for fixing particulate semiconductor powder and forming photoelectrodes. Taking the preparation of Ta3N5|Ti (Ta3N5 photoelectrode on metal Ti substrate) photoanode as an example, Ta3N5 particles are first coated on a Ti foil through a drop-casting process, followed by drying in the air (Fig. 19(d)). Subsequently, a roll-press process is conducted using two cylindrical rollers rotating against each other at a specific force and rolling speed. The roll-press method is able to control the amount of the semiconductor powder on the photoelectrodes by adjusting the processing amount of the particles and roll-press force. The crystallinity of Ta3N5 particles was preserved when applying a moderate roll-press force (below 10 kN). Photoanodes made of Co-Pi-decorated Ta3N5|Ti using the roll-press method exhibited higher photocurrent densities compared to those prepared using conventional coating methods with post-necking treatment. This highlights the roll-press method is a promising approach for fabricating photoelectrodes from temperature-sensitive semiconductors. Importantly, the Co-Pi/Ta3N5|Ti photoelectrodes scaled up to 3 × 20 cm2 using the roll-press process showed PEC performance in OER comparable to smaller-sized samples (1 × 2 cm2). This performance was also comparable to Co(OH) x /Ta3N5|Nb|Ti photoelectrodes fabricated using the thin film transfer method [245]. The roll-press method offers an affordable, straightforward, and commercially viable approach for fabricating photoelectrodes and photocatalytic sheets. It is particularly advantageous for industrial production due to its low energy consumption and the absence of vacuum processes. However, the performance of photoelectrodes produced by this method currently falls short compared to those made using the particle transfer method [247,248], likely due to insufficient contact between the substrate and semiconductors. Despite being superior to photoelectrodes made using conventional coating methods with post-necking treatment, further optimizations are required. Future work should focus on improving particle size, adjusting the exposure facets of the particulate semiconductors, and refining the atmosphere and temperature conditions during the roll-press process to enhance performance. 3.3.5 Photocatalyst sheets Redox-mediator-free Z-scheme systems can be established by aggregating photocatalyst particles through pH adjustment, which generates attractive electrostatic forces between them [192]. However, despite this approach, the contact between photocatalysts often remains inadequate for efficient interparticle charge transfer, leading to performance that lags behind redox-containing Z-scheme systems. While enhancing interparticle charge transfer through composite combinations of photocatalysts, such as growing one type onto another or annealing their mixture, may seem promising, these methods frequently compromise the photocatalytic activity of each component, ultimately leading to Z-scheme systems that demonstrate only moderate performance [249]. This type of Z-scheme system can be likened to micro-sized parallel p|n photoelectrodes, where efficient operation requires HEPs and OEPs to be p- and n-type semiconductors, respectively. Furthermore, their cathodic and anodic photocurrents must overlap at a specific potential to achieve unbiased water splitting. All-solid-state Z-scheme systems employing materials like RGO or ITO as interparticle mediators have been developed to connect HEP (e.g., metal-doped SrTiO3) and OEP (e.g., BiVO4) [210,250]. However, interparticle charge transfer remains limited due to weak physical contact between photocatalysts and the solid mediator, typically achieved through adsorption or compression. To overcome these hurdles, the Domen group has developed photocatalyst sheets fixing HEP and OEP particles onto a conductive layer to improve the contacts between photocatalysts and the solid mediator. The photocatalyst sheet was developed based on the particle transfer method (Fig. 19(b)) [13]. The process begins by mixing HEP and OEP powder in suspension and drop-casting them onto a glass substrate. Subsequently, a thin conductive layer (c.a. 300 nm), such as Au, is deposited onto the photocatalyst layer using vacuum vapor deposition or sputtering. Finally, the conductive layer with immobilized photocatalysts is peeled off from the primary glass plate by attaching it to another glass plate. This approach facilitates an intimate mechanical and electrical connection between the photocatalysts and the conductive layer, leading to enhanced charge transfer efficiency within the Z-scheme system. Additionally, the micrometer-scale spacing between photocatalysts effectively minimizes solution resistance and concentration overpotentials. Therefore, unlike redox-mediator-free powder suspension Z-scheme systems, the photocatalytic activity of these photocatalyst sheets remained nearly unaffected by the pH of the reaction solution [213,251]. This suggests that electron transfer predominantly occurred through the conductive layer rather than through particle aggregates. The conductive layer effectively bridged the HEP and OEP, prompting efficient electron transfer and thus enhancing overall water-splitting activity. For instance, a photocatalyst sheet comprising La,Rh-codoped SrTiO3 and Mo-doped BiVO4 on an Au or C layer achieved an STH of above 1.0% with an AQY exceeding 30% at 420 nm in pure water (Fig. 22 ) [13,214], which was the new benchmark for sunlight-driven photocatalytic water splitting at that time. Domen et al. [215], in collaboration with TOTO Ltd., have also developed printable photocatalyst sheets for efficient and scalable photocatalytic pure water splitting, as illustrated in Fig. 19(e). These sheets utilized SrTiO3:La,Rh as the HEP, BiVO4 as the OEP, and nanoparticulate Au or ITO as the conductive mediator. The sheets with large active areas (30 × 30 cm), were easily prepared via screen printing technique. Compared to systems using Au nanoparticles as the conductive mediator, SrTiO3:La,Rh|ITO|BiVO4 sheets leverage the unique properties of ITO nanoparticles, such as high visible light transparency and low electrochemical activity during oxygen reduction. Consequently, printable SrTiO3:La,Rh|ITO|BiVO4 sheets achieved water decomposition with an STH efficiency of 0.4%, demonstrating effective solar hydrogen production without the need for vacuum processes for device preparation. The design of the photocatalyst sheet enables the application of various photocatalysts in constructing Z-scheme systems, as the choice of materials is not restricted by surface charge considerations at the working pH. This capability has facilitated the demonstration of Z-scheme overall water splitting using a variety of narrow bandgap photocatalysts, including La5Ti2Cu0.9Ag0.1O7S5, LaMg1/3Ta2/3O2N, and (ZnSe)0.5(CuGa2.5Se4.25)0.5, within a photocatalyst sheet configuration [164,165,212,216]. The application of such sheets has been easily extended to other photosynthetic processes, such as CO2 reduction, by replacing the HEC with CO2 reduction cocatalysts [18,252]. This broadens the scope of photocatalyst sheet technology beyond water splitting, showcasing its potential in sustainable energy and environmental applications. The standalone and wireless photocatalyst sheet systems offer a unique hybrid of conventional Z-scheme photocatalytic and photoelectrochemical systems, combining the best features of both approaches: (1) the low-cost advantage of synthesizing photocatalyst powders and close proximity of reduction and oxidation reactions. This minimizes pH gradients and IR drops, allowing for their operation with high efficiency in pure water without requiring pH adjustments, redox mediators, electrolytes, or buffering agents. As a result, these sheets demonstrate comparable water-splitting activity in pure water, irrespective of their size; (2) the effective contact between the semiconductor and the conductive layer, akin to photoelectrodes, promotes electron transfer between H2 and O2 evolution photocatalysts, significantly enhancing water-splitting performance compared to powder suspension systems. One notable example of this design is a photocatalyst sheet using two n-type materials, which stands apart from typical PEC cells and Z-scheme systems with composite combinations of an HEP and an OEP [212,253]. In this case, RhCrO x /LaMg1/3Ta2/3O2N serves as the HEP and BiVO4:Mo acts as the OEP, both in contact with a gold layer (RhCrO x /LaMg1/3Ta2/3O2N|Au|BiVO4:Mo sheet). Given that LaMg1/3Ta2/3O2N is a photocatalyst capable of splitting water into H2 and O2 on its own, the success of this sheet design is possibly attributed to the unique band bending of LaMg1/3Ta2/3O2N, which facilitates effective electron transfer to the RhCrO x HEC. Nonetheless, as with photoelectrodes fabricated using the particle transfer method, the semiconductor particle layer on these high-performing photocatalyst sheets remains thin, limiting their light absorption capacity. Techniques such as drop-casting and screen printing, which incorporate conductive nanoparticles as electron transfer mediators, can increase the particle layer thickness and improve light harvesting. However, the water-splitting performance is still lower than that obtained using the particle transfer method, primarily due to light shielding by the nanoparticles and less effective contact between the semiconductors and the conductive mediator. Further optimization and modification are needed to overcome these challenges. 3.3.6 Panel and solar H2 production farm Photocatalytic water splitting has conventionally been achieved using powder suspensions, where functional photocatalyst powders are often dispersed in reaction solutions and stirred to ensure sufficient mass transfer. However, using such suspensions presents challenges in terms of dispersal, separation, and scalability for large-scale, real-world applications. To address these issues, researchers have shifted towards fabricating water splitting panels where the photocatalytic powder is securely fixed onto specific substrates [254]. This approach not only resolves issues related to dispersion and recycling but also simplifies sample handling in practical operations [254]. Moreover, economic analyses suggest that designing photocatalyst panels to efficiently track the sun and maximizing the direct radiation capture throughout the day, could offer cost advantages over fixed panel arrays [255]. The first example of a photocatalyst sheet for overall water splitting was reported by Domen et al. [80] using Rh2−y Cr y O3/(Ga1−x Zn x )(N1−x O x ) photocatalyst in 2013. The photocatalyst panel was fabricated by simply drop-casting Rh2−y Cr y O3/(Ga1−x Zn x )(N1−x O x ) powder onto a 5 × 5 cm2 flat frosted glass plate. To enhance mass transport, including water reactant and produced gas, micrometer-sized SiO2 was added to the photocatalyst ink before drop-casting. This addition increased the porosity of the photocatalyst layer, allowing more efficient mass diffusion through the layer. Incorporating SiO2 during the preparation of the Rh2−y Cr y O3/(Ga1−x Zn x )(N1−x O x ) sheet was crucial for maintaining the inherent activity of the powder suspension. In 2018, Domen et al. [12] developed a scalable water splitting panel reactor for photocatalytic overall water splitting. As shown in Fig. 23 , the 1 × 1 m2 reactor comprises photocatalyst sheets fabricated by drop-casting Rh2−y Cr y O3-loaded SrTiO3:Al particles onto glass plates, housed within an outer frame made of acrylic plates. The water splitting panel demonstrated water-splitting activity comparable to that of the powder suspension by using SiO2 nanoparticles (ca. 20 nm in diameter) as an inorganic binder to securely fix the photocatalyst layer onto the substrate. The water splitting panel was tilted at an angle of 10°–20° to ensure the prompt release of evolved gases and to optimize the acceptance angle for sunlight. A hydrophilic window was found to be effective in preventing the accumulation of an explosive H2 and O2 gas mixture within the panel. A water layer depth of 1 mm was sufficient for releasing gas bubbles and ensuring optimal performance, even under elevated light intensity. Importantly, even at such a large scale (1 × 1 m2) and ambient pressure, the intrinsic activity of the Rh2−y Cr y O3-loaded SrTiO3:Al photocatalyst was retained without deterioration, achieving an STH of 0.4% under natural sunlight irradiation (Figs. 23(c) and (d)). This work represents a breakthrough in photocatalytic water splitting, demonstrating that the concept of a water splitting panel is a viable means for large-scale, low-cost renewable solar H2 production. Photocatalytic water splitting panels can essentially be arranged in arrays for scalable solar H2 production farms. Extending from the 1 m2 panel reactor, Domen team reported the safe operation of a 100 m2 array of photocatalyst panels over several months [15]. As depicted in Fig. 24 , the 100 m2 scale prototype for photocatalytic solar-driven H2 production consists of 1600 reactor units arranged in series and was built at the Kakioka Research Facility within the University of Tokyo. Each reactor unit features a light-absorbing area of 625 cm2, with a 0.1 mm gap between the ultraviolet-transparent glass window to minimize water loading and prevent ignition of the gas mixture. In this system, polyurethane tubes are utilized to facilitate gas and water transport. The photocatalyst water-splitting panels were fabricated by spraying a slurry of Rh2–y Cr y O3/CoO x -loaded SrTiO3:Al particles, colloidal silica, and calcium chloride, onto flat and clear glass sheets. The 100-m2 solar H2 production farm achieved H2 generation under natural sunlight conditions, enabling an STH efficiency of 0.76% during optimal summer sunshine conditions. The gaseous oxyhydrogen product from the 100-m2 photocatalyst panel reactor was fed to a gas-separating membrane unit via gas collection and transportation tubes, recycling 73% produced hydrogen recovery using a commercial membrane. Domen and his team demonstrated solar hydrogen production through photocatalytic water splitting, including the safe separation of H2 from the moist gas mixture, to operate reliably over several months. These achievements mark a significant milestone in the field, representing the first demonstration of real-world hydrogen production through photocatalytic overall water splitting at a scale of 100 m2. It stands as the largest solar hydrogen production unit to date, with potential for further scaling without efficiency degradation. 3.4 Spectroscopy characterizations 3.4.1 Infrared spectroscopy for catalysts Infrared (IR) spectroscopy has been extensively used since the 1960s to investigate surface-adsorbed species on solid catalysts, providing insights into reaction processes and mechanisms [256,257]. Domen started his research on IR spectroscopy at the Tokyo Institute of Technology in the early 1980s and co-worked with Takaharu Onishi. His early works primarily focused on studying the adsorption and desorption of intermediates on solid catalysts during CO hydrogenation (CO-H2) reaction. For instance, studies on the CO-H2 reaction over ZrO2 revealed that the selectivity for methanol and isobutene formation varied with temperature [258]. The addition of In2O3 to CeO2 improved the CO-H2 reaction activity and increased selectivity for ethene while suppressing alkene formation [259]. Fourier-transform IR (FT-IR) analysis of intermediate species during CO adsorption on partially reduced CeO2 showed the information of a formyl intermediate, with the formation of carbonate-like species being inhibited [260]. It was also confirmed that CO adsorption was influenced by the degree of dehydroxylation on the CeO2 surface [261]. The adsorption of nitrogen species on materials such as Al2O3, TiO2, and ZrO2 was also studied using IR spectroscopy at a liquid-N2 temperature. It was observed that hydrogen adsorption affected the adsorption behavior of dinitrogen species on an alumina-supported cobalt catalyst [262]. Additional studies on TiO2 and ZrO2 revealed that dinitrogen was adsorbed at strong sites, while dihydrogen was adsorbed at weaker sites [263,264]. Zeolites, with their unique porous structures and abundant active sites, are crucial for various catalytic reactions. Domen et al. [265] utilized FT-IR spectroscopy to investigate the interaction between small molecules and zeolites by probing nonpolar molecules. They were the first to demonstrate that dinitrogen species can serve as a probe for acidic sites of zeolites. Specifically, N2 species adsorbed onto Brönsted and Lewis acid sites of H-mordenite, producing detectable ν(NN) vibration. Further studies revealed that CO could also act as a probe for active sites in H-form zeolites because it exhibited distinct behaviors when interacting with Brönsted acid sites, Lewis acid sites, and acidic-OH sites [266]. Additionally, the adsorption of H2, O2, and rare gases (He, Ar, Kr, and Xe) at low temperatures was examined using transmission FT-IR spectroscopy, with band shifts correlated to the number of strong acid sites in the zeolites [267,268]. Building on the foundational studies, Domen et al. [269,270] advanced their research to explore intermediates and processes involved in various catalytic reactions on zeolite surfaces. For example, they investigated the dehydration of ethanol using time-resolved IR spectroscopy, as shown in Fig. 25 [269]. The absorption bands at 3500 and 3000−1300 cm−1 were attributed to the alcohol-OH and zeolite-OH, respectively, both of which were in a hydrogen-bonded state. After a 10-min reaction, the disappearance of the absorption band corresponding to hydrogen-bonded acidic OH groups indicated the desorption of ethanol and water molecules (Fig. 25(b)). Concurrently, the appearance of isolated acidic OH groups suggested the consumption of acidic protons on the zeolite. Considering the absence of water produced from ethanol dehydration, the consumption of acidic OH groups, and the presence of ethyl groups, the stable intermediate for ethanol dehydration on zeolites was confirmed as an ethoxy group. These ethoxy species remained stable and were not replaced even when exposed to isotopic d 6-ethanol (Fig. 25(c)). In contrast, molecularly adsorbed ethanol species were replaced and decomposed at higher temperatures into gaseous ethene and acidic OH groups. These findings confirmed that ethanol dehydration on zeolites proceeds through a stable covalent intermediate at the solid-gas interface, as the process shown in Fig. 25(c) [271]. 3.4.2 Sum-frequency generation spectroscopy During his time as a visiting scholar at Dr. Chuang's lab, Domen focused on surface photochemistry using a UV laser, a powerful tool for examining the electronic state excitation dynamics of adsorbed species [272]. Domen's research highlighted the characteristic electronic excitation effects, providing evidence of molecular selectivity in photo-desorption, which was linked to fragmentation and explosive desorption behavior observed at high surface coverages. His study employed an ultra-high chamber consisting of XPS, thermal desorption spectroscopy (TDS), and time-of-flight mass spectrometry (TOFMS). TDS and XPS were used to access surface coverage and the adsorption characteristics. Domen also investigated the photodissociation and desorption mechanisms of CH2I2 adsorbed on the surfaces of Al2O3 and Ag under electronic excitation [273]. His findings revealed that most excited molecules beneath the surface could not dissociate owing to repulsive interactions and collisions with neighboring molecules when the CH2I–I bond distance increased in the excited state. Inspired by the pioneering research of Professor Shen [274,275], Domen began researching infrared-visible sum-frequency generation (SFG) in surface and interface chemistry based on ultrashort vibrational spectroscopies in the 1990s. This technique, illustrated in Fig. 26 , involves irradiating a surface with simultaneous intense visible and infrared pulses. The emitted SFG light, which results from the sum of the wavenumber vectors of the pulses, increases sharply if the infrared pulse frequency resonates with surface vibrations. This sharp increase allows for the vibrational spectrum to be obtained by scanning the infrared frequency. The sensitivity and surface specificity of SFG make it an ideal tool for studying thin films. In 1991, Domen published his first study using SFG, focusing on the anisotropic orientation of Langmuir-Blodgett (LB) films of cadmium arachidate on fused silica [276]. He subsequently applied SFG spectroscopy combined with temperature-programmed desorption to investigate the variation of the MgO (001) surface during formic acid adsorption and thermal desorption [277]. Due to the insulating and nonmetallic properties of MgO (001), studying its surface with vibrational spectroscopies presented challenges. Domen demonstrated that SFG spectroscopy with high selectivity could detect molecular vibrations specific to adsorbed formic acid and its decomposition directly on the MgO (001) surface, offering valuable insights into controlling chemical reactions on MgO surfaces, particularly those involving surface defects. SFG spectroscopy offers ultra-short time resolution due to the picosecond timescale of the pulsed laser. Domen observed that exposure to near-infrared pulses induced a transient temperature jump at the surface (Fig. 26) [278]. Leveraging this phenomenon, he explored the decomposition of formate on the NiO(111) surface by identifying short-lived reactive intermediates using picosecond temperature jump (ps-T jump) techniques [279]. The research provided deep insights into the surface chemistry of NiO(111), particularly in understanding how reactive intermediates influence the decomposition reactions at the atomic level. Uncovering the vibrational relaxation of surface molecules is crucial for understanding how molecules interact with surfaces on a microscopic level, such as through chemisorption, diffusion, and desorption during chemical reactions. These insights help researchers assess the accuracy of theoretical models related to vibration relaxation and energy transfer at interfaces [280,281]. Time-resolved infrared spectroscopy is particularly effective for such analyses [282]. In this context, Domen et al. [283] conducted a series of studies focusing on the vibrational dynamics of hydroxyl groups on zeolites, specifically Y-type and mordenite. They measured the population lifetime using a pump-probe method, where the adsorbate was excited to a vibrational mode with a tuned intense IR laser pulse, and the recovery of the ground-state population was monitored with time-delayed probe pulses. The relaxation lifetimes of the OH (v = 1) groups of Y-type zeolites were observed to be 180 ± 12 and 63 ± 14 ps, corresponding to OH stretching bands at 3625 and 3540 cm–1, respectively. Additionally, the decay time of the transient hot band absorption at 3457 cm–1 (v = 2 ← 1) on the surface of OH groups of mordenite was confirmed by pumping the fundamental band at 3608 cm–1. The measured decay time was 154 ± 18 ps, consistent with the 161 ± 18 ps obtained from the bleaching experiment of the fundamental band. Subsequently, Domen et al. [284] conducted the tunable IR pump-probe experiments to investigate the vibrational relaxation rates (v = 1 ← 0) of the OH stretching mode of Brönsted acidic hydroxyl group in a mordenite-type zeolite interacting with molecular adsorbates such as He, Ar, Kr, and Xe. Based on the experimental results, they used a simple linear chain model to study the mechanism behind the improved relaxation rate. Further advancing their research, Domen et al. [285] examined the reaction dynamics of highly thermodynamic stable trans-2-butene adsorbed to acidic hydroxyl groups on the surface of ferrierite zeolite. Previous studies had identified species reacting with another molecule after proton transfer from zeolite at around 300 K using typical vibrational analyses, but short-lived monomolecular intermediates formed at the early stages of the reaction had not been directly observed. Domen et al. [285] were the first to obtain transient absorption spectra for the trans-2-butene/zeolite system by employing picosecond IR laser spectroscopy in the period immediately after exciting the OH (OD) stretching mode with an intensive IR pulse. This allowed them to study the lifetime of short-lived intermediate species and elucidate their forming mechanisms. Domen et al. [286] later expanded their research to study catalytic reactions on single-crystalline metal surfaces using IRAS and SFG spectroscopy. These techniques, unlike conventional electron spectroscopy and microscopy, can be conducted under ambient conditions, allowing for observations under in situ and Operando conditions. Typically, physisorbed π-bonded ethylene can only exist below 54 K under vacuum conditions. However, under vacuum, the adsorbed ethylene coordinated on Pt(111) through a di-σ-bond remained stable up to 250 K, after which it decomposed to ethylidyne above 250 K (Fig. 27 ) [287–289]. Subsequent studies utilizing ultrafast vibrational spectroscopy have validated this pioneering research by Domen et al. [178,290–292]. 3.4.3 Mechanism research Photocatalytic systems often include cocatalysts to facilitate surface reactions. Understanding the interfacial charge transfer between the photocatalyst and cocatalyst, as well as the surface potential of the cocatalyst, is critical for elucidating reaction mechanisms and improving the system efficiency. To monitor the potential of cocatalysts like Pt on a photocatalyst, Domen et al. [293,294] used CO as a probe molecule and gathered vibrational data through in situ attenuated total reflection surface-enhanced infrared absorption spectroscopy (ATR-SEIRAS, Fig. 28(a) ). In this approach, CO molecules adsorbed on the cocatalyst exhibit a frequency shift in the C–O stretching vibration, which reveals the potential at the adsorption site. This shift occurs due to electron transfer to the 2π* orbital of CO and/or an electrochemical Stark effect (Fig. 28(b)) [295]. Initially, this technique was applied to a n-type GaN substrate loaded with Pt particles, demonstrating that the CO peak shifts observed through ATR-SEIRAS were directly linked to potential variations caused by photoexcitation [293]. This study further uncovered that the Schottky barrier between GaN and Pt limited electron accumulation in Pt due to the competitive transfer of electrons and holes from GaN to Pt. Expanding on this model, the technique was applied to particulate photocatalysts, including Pt-loaded GaN:ZnO, TaON, and LaTiO2N particles under in situ conditions [294]. For Pt-loaded GaN:ZnO and TaON, the C–O stretching vibration of adsorbed CO shifted to a lower frequency under visible light irradiation, signaling electron accumulation on the Pt cocatalyst. In contrast, no frequency shift was detected on Pt-loaded LaTiO2N. These findings were strongly correlated with the photocatalytic H2 evolution activities of these materials. Further studies revealed that the poor charge transfer between LaTiO2N and Pt, leading to minimal photocatalytic H2 evolution, was attributed to a defective surface layer on LaTiO2N [118]. Removal of this defective surface layer significantly enhanced the photocatalytic activities of LaTiO2N. Effective separation of photogenerated charge carriers in photocatalysts is crucial, as it directly impacts their ability to transfer to cocatalysts, a process that competes with charge recombination. To study charge-carrier dynamics in photocatalysts, various transient optical spectroscopies, such as photoemission and absorption spectroscopies, have been developed. Among these, transient absorption spectroscopy stands out for its broad applicability across all relevant timescales for charge carriers. This technique, especially when using a pump-probe method, is sensitive to both radiative and non-radiative decay processes [297]. In a collaboration study between Domen and Yamakata [298], time-resolved infrared absorption spectroscopy (TR-IR) was developed to investigate charge-carrier dynamics in semiconductor materials. IR absorption was selected because the absorption coefficient for photogenerated electrons increases as the probe light wavelength extends from the visible to IR region. This is particularly important because free or shallowly trapped electrons, which are closely associated with photocatalytic processes, generate structureless broad absorption in the mid-IR region [299,300]. Furthermore, IR absorption is not affected by the visible light emission from charge recombination, making it a reliable method for studying these dynamics. In addition to the qualitative analyses, semi-quantitative analysis based on TR-IR is also possible. By comparing the absorption intensities of free or shallowly trapped electrons in photocatalysts with and without a cocatalyst, researchers can determine the proportion of electrons captured by the cocatalyst. TR-IR was first validated by studying the potential-dependent charge-recombination kinetics in n- and p-type GaN photoelectrodes, where the steady-state reaction efficiency was correlated with the number of electrons that survived in the millisecond range. Since photogenerated holes often produce absorption bands in the visible region, time-resolved absorption spectroscopy was extended to cover the visible to mid-IR regions (TR-vis/IR)) [296]. This range, from 400 nm to 10 µm, spans an energy level from 0.1 to 3.1 eV, enabling detailed analysis of energy states associated with charge-carrier trapping (Fig. 28(c)). Applying the TR-vis/IR method to Pt or/and CoO x -loaded LaTiO2N photocatalyst clarified the multiple roles of cocatalysts. For example, while Pt was found to extract electrons from LaTiO2N, this process took tens of microseconds due to deep-trapping effects. In contrast, CoO x rapidly captured holes within a few picoseconds and allowed long-lived electrons to survive, as CoO x could partially passivate surface defects and improve electronic properties. Analyses also unexpectedly revealed that high-loading amounts of both Pt and CoO x led to undesirable charge recombination. These findings promoted more careful selection of cocatalysts and their loading conditions in subsequent studies [88,105,123,173,224]. Although co-loading both Pt (HEC) and CoO x (OEC) on LaTiO2N was expected to facilitate both electron and hole transfer to reaction sites, TR-vis/IR analysis showed that when Pt and CoO x were deposited in close proximity, a new, unfavorable recombination process was induced, reducing the steady-state activity. To optimize the co-loading strategies, later studies confirmed that the loading amount of cocatalysts, particularly OEC, should be minimized, or the HEC and OEC should be spatially separated on different crystal facets [40,77,301,302]. Given the effectiveness of TR-vis/IR as a tool for analyzing the charge-carrier dynamics, this method has been applied to various photocatalysts, including SrTiO3, BaTaO2N, SrTaO2N, among others, and facilitating their optimization [71,88,91,105,124,152,162]. Since photocatalyst particles generally have rough surfaces with strong light scattering, transient diffuse reflectance spectroscopy (TDRS) was employed to detect transient absorption signals and investigate charge-carrier dynamics. To enhance the analytical power of TDRS, it was coupled with theoretical modeling and numerical simulation based on DFT and COMSOL Multiphysics. This combined approach has proven to be a powerful tool for uncovering the physical mechanisms behind charge-carrier dynamics and extracting critical parameters, such as doping density, which are often challenging to accurately measure using conventional methods [46,303–310]. This methodology was particularly effective when applied to cutting-edge photocatalysts, such as Y2Ti2O5S2 and SrTiO3:Al [46,92]. For instance, studies on Y2Ti2O5S2 revealed that factors including particle size, donor density, and trap density significantly influenced bimolecular recombination, trapping and de-trapping processes. This led to the introduction of optimized design strategies that balance particle size, doping density, and tail-trap states to achieve high quantum efficiency in water splitting [307]. Similarly, analyses on SrTiO3:Al showed that Al doping reduced the intrinsic n-type doping density, significantly prolonging bulk carrier lifetime and diffusion length [309]. Rapid electron extraction by a cocatalyst, exemplified by Rh, just before charge carriers decay, resulted in extraordinary quantum efficiency for water splitting. This comprehensive approach, which links material and electronic properties with carrier dynamics and photocatalytic activities, is expected to drive the design of novel photocatalysts for efficient solar-fuel production in the future. 4 International collaborations Artificial photosynthesis using photocatalysts and photoelectrodes represents a promising pathway toward achieving carbon neutrality, a challenging yet crucial goal for researchers worldwide. Recognizing the importance and broad applicability of this research area, Professor Domen has actively engaged in international collaborations. Between 2010 and 2015, Domen et al. [106,146,311–315] worked closely with Can Li from the Dalian Institute of Chemical Physics and Jae Sung Lee from the Ulsan National Institute of Science and Technology under the A3 Foresight Program supported by the Japan Society for the Promotion of Science. This collaboration has continued, advancing the development of novel photocatalysts and photoelectrodes for water splitting. Notable achievements include the development of the MgTa2O6–x N y /TaON heterostructure for hydrogen evolution, a composite photocatalyst used in Z-scheme water splitting with a recorded AQY of 6.8% at 420 nm at that time. Additionally, a tandem cell combining the NiOOH/FeOOH/BiVO4:Mo photoanode from Lee's group and the Pt/CdS/CuGa3Se5/ (Ag,Cu)GaSe2 photocathode from Domen's group achieved a remarkable STH of 0.67% over 2 h without degradation [315]. While the Domen team's primary focus has been on inorganic semiconductors including oxides, (oxy)nitrides, and (oxy)sulfides, they have also significantly contributed to the development of organic photocatalysts. Collaborations with Markus Antonietti from the Fritz-Haber-Institute of the Max-Planck-Society and Xinchen Wang from Fuzhou University led to the development of polymeric carbon nitride for photocatalytic water splitting [316–319]. This material, notable for its chemical and thermal stability, represents the first artificial conjugated polymer semiconductors for artificial photosynthesis. To understand the complex physical and chemical processes involved in photocatalysis, Domen has partnered with Ib Chorkendorff from the Technical University of Denmark to investigate the operational mechanisms of photocatalysts using silicon-based µ-reactors. Their research revealed the importance of suppressing backward reactions on cocatalysts with a Cr2O3 layer [320,321]. In a similar vein, collaboration with James Robert Durrant from Imperial College London focused on developing an operational model for SrTiO3:Rh and SrTiO3:La,Rh, by integrating in situ spectroelectrochemical measurements with density functional theory and photoelectron spectroscopy [322]. Throughout his research career, Professor Domen has collaborated extensively with researchers from China, many of whom have become outstanding independent scholars upon returning to their home country and continue to work with him. For instance, Fuxiang Zhang from the Dalian Institute of Chemical Physics has advanced (oxy)nitride photocatalysts for water splitting [107,108]. Recent collaborative work with Domen has utilized strong metal-support interactions to enhance photocatalytic performance, resulting in a suspended photocatalytic Z-scheme water-splitting system comprising TaON and BiVO4 with a benchmarking AQY of 16.9% at 420 nm at room temperature [107]. In collaboration with Yanbo Li from the University of Electronic Science and Technology of China, Domen et al. [323–325] have developed well-defined Ta3N5 photoanodes and yielded a half-cell STH of 4.07%. Li's group has also employed temperature/power-dependent and time-resolved photoluminescence spectroscopies to explore the electronic structures and carrier dynamics of photocatalysts like Y2Ti2O5S2 from Domen's group [326,327], providing valuable insights into design principles for efficient water-splitting photocatalysts. Professor Domen also extends his research to other photosynthetic processes, such as CO2 reduction and H2O2 generation. For instance, in a collaborative effort with Erwin Reisner at the University of Cambridge, they combined the SrTiO3:La,Rh|Au|BiVO4:Mo photocatalyst sheet with the phosphonated cobalt bis(terpyridine) molecular catalyst to achieve CO2 reduction to formate in aqueous solution. This system demonstrated a solar energy conversion efficiency of approximately 0.08% with a selectivity to formate of 97% [18]. Additionally, by utilizing faceted BiVO4 particles developed by Domen's group, Chiheng Chuat Zhejiang University applied advanced cocatalyst engineering to create an efficient and stable inorganic system for H2O2 photosynthesis [301]. 5 Conclusions and outlooks Professor Domen and his team have devoted considerable efforts to exploring effective photocatalytic systems for solar hydrogen production via water splitting. Their work has led to high levels of photocatalytic performance, continuously setting new benchmarks in the field. Such research laid the scientific foundations and design principles for highly efficient photocatalytic systems and also highlighted that meeting a substantial portion of humanity's energy needs will require breakthroughs in materials development, tightly integrated with advances in device design and engineering. The strategies typically employed by the Domen team to enhance photocatalytic performance are summarized in Table 4 . Enhancing η absorption: to enable the practical application of photocatalytic materials, improving η absorption is essential. In response to this challenge, Domen and his team have focused on developing novel photocatalysts, including oxides, (oxy)nitrides, and oxysulfides, that can harvest visible light while maintaining relatively good stability in aqueous solutions. These materials have shown promising photocatalytic activity for HER, OER, and overall water splitting. For metal oxides with valence bands composed of O 2p orbitals, achieving both H2 and O2 production requires a bandgap energy exceeding 3 eV, allowing the oxide to span the potentials necessary for proton reduction and water oxidation. By adjusting the valence band potential using p orbitals, specifically N 2p or S 2p orbitals, to form (oxy)nitrides and (oxy)sulfides, the Domen team has successfully narrowed the bandgap. Many of these materials can absorb light with wavelengths up to 600 nm or even longer. However, one of the major challenges in achieving overall water splitting with materials other than oxides, such as (oxy)nitrides and (oxy)sulfides, is self-photocorrosion, which leads to low stability during the photocatalytic reaction. To address this issue, surface loading with OECs may be necessary to suppress the oxidation of lattice nitrogen and sulfur ions, ensuring stable water oxidation to O2. Doping, by introducing foreign elements into host materials, is another effective strategy to shift the optical response towards the visible light region. However, dopants can also act as recombination centers for photoexcited carriers, reducing photocatalytic activity. Therefore, it is crucial to carefully control the choice of dopants, the doping concentration, and the method of doping to optimize performance. Solid solutions of isostructural semiconductors offer significant advantages, as these mixtures readily undergo orbital hybridization between different atoms and/or distortions of metal-oxygen octahedral or tetrahedral units, resulting in modifications to their band structures. The bandgaps and energy levels of these materials can be continuously adjusted by varying the contributions of wide- and narrow-bandgap semiconductors. This solid-solution approach has enabled precise control over the bandgaps and band-edge positions of semiconductors designed for single-photoexcitation water splitting. Enhancing η separation: Developing efficient photocatalysts requires optimizing light absorption without sacrificing charge separation. In this context, Domen and his team have implemented several strategies to enhance photocatalytic performance, including defect engineering, cocatalyst engineering, and facet control. A major challenge in achieving high photocatalytic efficiency is the significant charge recombination that occurs at defect sites. The addition of a salt mixture in the material synthesis process, such as NaCl/KCl, has been shown to improve crystallinity, modify grain boundary structures, and reduce defect formation. This molten salt synthesis method has been successfully applied to produce photocatalysts with high crystallinity and fewer defects. The photocatalytic performance of particulate semiconductors is also highly dependent on their crystal planes, as surface reactions are sensitive to the atomic structures and physicochemical properties of the exposed surfaces. Spatial charge separation has been observed in several single crystals across different exposed facets. Creating nanoscale and microscale junctions with built-in electric fields offers a potential approach to further enhance charge separation and improve overall performance. Enhancing η reaction: The kinetics of the OER and HER play a critical role in determining photocatalytic performance. The thermodynamically uphill water-splitting reaction, characterized by high activation energy or overpotential, often results in low activity. This is especially true for the OER, where the multistep proton-coupled electron transfer process is kinetically slow. To address these limitations, cocatalysts are commonly employed to efficiently extract photogenerated charge carriers and drive redox reactions. The activity of OECs and HECs depends on several factors, including cocatalyst loading, particle size, structure, composition, and the interface between the cocatalyst and semiconductor. Domen's work demonstrated that precise control and optimization of these variables are essential for enhancing performance. Back reactions involving molecular oxygen, such as the oxygen reduction reaction and water formation from the evolved hydrogen and oxygen, are common challenges during simultaneous stoichiometric H2 and O2 generation in overall water splitting. These reactions must be suppressed. A surface modification strategy, which involves covering noble metal cocatalysts with an amorphous (oxy)-hydroxide layer, has been shown to effectively inhibit back reactions on the cocatalyst without affecting hydrogen evolution. By combining these strategies, more efficient cocatalyst materials for overall water splitting have been developed. Mechanism investigation: Domen's contributions have been pivotal in deepening the understanding of photocatalytic systems. Through the use of advanced spectroscopic techniques, such as ATR-SEIRAS and TR-IR, Domen and his collaborators have gained critical insights into the intrinsic carrier properties of semiconductors and the interfacial charge transfer processes between photocatalysts and surface decorations. Their research has clarified the roles of surface potentials and charge-carrier dynamics in enhancing photocatalytic activity. It also highlights the importance of optimizing cocatalyst loading and spatial arrangement, which significantly affects charge separation and recombination, thereby improving photocatalytic performance. Additionally, the integration of theoretical modeling with experimental data has been a central component of his approach, facilitating the extraction of key parameters and the development of more efficient photocatalysts for solar hydrogen production. Device design for future practical applications: The device design has shifted over the past decade, with solar fuel production technologies advancing toward integrated, compact, and panel-structured systems that are better suited for widespread use [254]. Professor Domen has consistently focused on the practical application of his research, leading his team in the development of cost-effective water-splitting systems and versatile technologies for fabricating simple yet efficient photo(electro)chemical devices. His innovative methods include particle-transfer techniques, rolling-press methods, and screen-printing approaches for preparing photoelectrodes and photocatalyst sheets from photocatalyst particles. These technologies combine the advantages of both PEC and PC systems, offering the high efficiency of PEC systems along with the simplicity, scalability, and low-cost potential of photocatalysts. Future development: Technoeconomic analysis suggested that the target for solar energy conversion efficiency in particulate photocatalytic water splitting for solar H2 production should be set at 5%–10% in the next phase. Attaining this efficiency range is crucial for making solar H2 production economically viable at a large scale, enabling the technology to compete with other renewable energy sources and address the growing demand for sustainable energy solutions. To achieve this critical STH threshold, future research and development should focus on exploring and optimizing photocatalyst materials, enhancing reaction systems, and scaling up production processes. It has been suggested that photocatalytic evaluation can begin if the material has a bandgap within the range of 1.5–2.5 eV [328]. Otherwise, a photon collection strategy must be employed to effectively harvest visible light without compromising charge separation efficiency. Bandgap modulation and tuning of band-edge positions can be achieved through doping and the formation of solid solutions. However, the doping level and the ratio of the two isostructural materials must be precisely controlled to prevent the formation of deep trapping and recombination sites for photoexcited carriers. Despite significant challenges, such as the presence of numerous defects and the competitive self-oxidation of (oxy)nitrides and (oxy)sulfides, it remains essential to prioritize the development of these visible-light-driven photocatalysts. This focus is necessary because UV light accounts for only a small portion of solar radiation. Achieving the target STH of 5%–10% is unattainable with most photocatalysts that primarily absorb UV light, such as many oxides, even with a QE of 100% and without considering entropic losses. To reach the STH target of 10%, the absorption edge of photocatalyst must extend beyond 520 nm, which corresponds to a bandgap smaller than 2.4 eV [329]. Constructing a Z-scheme system is an alternative approach for efficient sunlight capture. Current Z-scheme designs often focus on effective interparticle electron transfer but may overlook mismatches in the band structures of the HEP and the OEP. For instance, in a typical Z-scheme setup using SrTiO3:La,Rh and BiVO4, both with a bandgap of 2.4 eV, the maximum theoretical STH efficiency is approximately 5% [255]. This value is consistent whether the materials are used in a powder suspension form or a photocatalytic sheet configuration, similar to that achieved with side-by-side PEC cell configurations. With particulate panel technology, improved solar utilization and higher water-splitting efficiency could be realized by designing a new Z-scheme system where the photocatalysts are stacked. In a dual-stacked absorber configuration, photons with energy lower than the bandgap of the top absorber are transmitted to the bottom absorber. For such a dual-stacked system, the maximum theoretical STH efficiency is 22.8%, achievable with bottom and top photoabsorber bandgaps of 1.23 and 1.84 eV, respectively [255]. To develop materials with high crystallinity and low defect density, several synthesis challenges must be addressed. First, ensuring that metal ions in the precursor materials are in the correct chemical valence states is vital for forming a well-ordered crystal structure. Second, maintaining stoichiometric balance in the final product is essential, as deviations can introduce defects and non-uniformities, reducing crystallinity and increasing defect density. Finally, optimizing synthesis conditions-such as temperature, atmosphere, and reaction time—helps minimize defects and promote crystal growth. Careful control over these factors is key to produce materials that exhibit both high crystallinity and low defect density, which are critical for enhancing the performance of photocatalytic and other functional materials. Apart from the strategies developed by the Domen team, such as defect engineering and facet control, several other approaches have been explored to enhance charge separation and migration. These include reducing photocatalyst particle size or creating core-shell structures to shorten charge carrier migration distances, forming junctions between metals and semiconductors, between semiconductors with different bandgaps, and between electrolytes and semiconductors. Additionally, introducing specific functional groups onto the surface has been shown to improve performance. These methods have been detailed in previous reviews [196,330,331]. In plants, specialized catalytic sites are dedicated to both CO2 reduction and water oxidation, effectively preventing the recombination of photoexcited carriers and accelerating redox reactions. Studying these natural systems is crucial for understanding the fundamental aspects of photosynthesis and for developing processes for artificial photosynthesis and commodity manufacturing. To achieve efficient photosynthesis, electrons must participate in multielectron charge transfer processes to initiate reduction reactions or be transferred to electron-accepting entities. Most photocatalysts need cocatalysts to drive these reactions effectively, as semiconductor-based reactions typically proceed slowly on their own. Therefore, it may be necessary to load both OECs and HECs on a single particle. In such configurations, synergistic interactions and the spatial separation of OECs and HECs are critical. Facet engineering, which directs OECs and HECs to their respective sites, is a sophisticated approach to managing the spatial separation of cocatalysts and could lead to the development of more effective materials for overall water splitting. Recently, hybrid systems, such as enzymes and molecular complexes inspired by nature, have been explored as alternatives to inorganic nanoparticles for use as cocatalysts in semiconductor-based photocatalytic reactions. These hybrid cocatalysts are expected to provide more active sites for catalysis compared to nanoparticulate cocatalysts [332,333]. Despite the extensive development of electrochemical catalysts for HER and OER, only a limited number of cocatalysts, such as RuO x , NiO x , and RhCrO x , have demonstrated the ability to effectively decompose water into hydrogen and oxygen. Integrating these catalytic technologies from electrocatalysis into photocatalytic systems remains challenging. This is because loading electrochemical catalysts onto photocatalysts is limited by preparation methods. Without careful adjustment, the energetics at the photocatalyst/electrochemical catalyst interfaces often result in severe charge recombination. However, recent research has shown that depositing Al2O3 onto Rh cocatalysts in GaN-ZnO systems via atomic layer deposition (ALD) can significantly inhibit reverse reactions, thereby improving photocatalytic water splitting activity by over an order of magnitude [334]. Although ALD is traditionally used for depositing protective oxide layers with precise atomic-level control in solar cells and (photo)electrode films, its application to photocatalytic powder systems has been challenging. This work demonstrates the feasibility of applying various effective strategies used to optimize solar cells and (photo)electrodes such as regulating the interfacial microenvironment and the electron spin-orbital [335–339], to improve the photocatalytic systems. Furthermore, the use of 1D/2D and nanoscale multicomponent materials is becoming increasingly prevalent, as nanostructured photocatalysts offer enhanced performance due to shortened carrier diffusion paths and precise material combinations at the nanoscale. Solar energy systems generally garner strong support from technologists, regulators, politicians, and environmental groups. Achieving a sustainable solution for global energy demands will necessitate not only enhanced energy efficiency and innovative approaches to existing carbon-based fuels but also a significant expansion of carbon-neutral energy sources. Professor Domen's research spans multiple fields, including photocatalysis engineering, semiconductor physics, (photo)electrochemistry, and spectroscopy. His work integrates laboratory studies, simulations, observations and characterizations to develop versatile materials and strategies for photocatalytic research. While his research is centered on water splitting, the materials and techniques he has developed have potential applications beyond this, including CO2 reduction, N2 fixation, photo-reforming, and organic transformations. However, these broader applications have been less explored with the materials and methods developed by his team. Most importantly, Professor Domen's contributions extend well beyond the laboratory. His efforts focus on translating fundamental research into practical applications, bridging the gap between scientific discovery and real-world implementation. His vision includes harnessing solar energy to tackle global energy challenges and contribute to a more sustainable and resilient future. Through his pioneering work, he has inspired a new generation of researchers to push the boundaries of photocatalysis and solar energy utilization. As Professor Domen celebrates his 70th birthday, we celebrate his ongoing innovative research in photocatalytic water splitting. We hope that his vision of producing green hydrogen through this technology will soon come to fruition. We also wish for sustained harmony among research, engineering, and manufacturing efforts, leading to sunlight becoming a primary, cost-effective contributor to a sustainable global energy system. Acknowledgements This work was financially supported by the Artificial Photosynthesis Project of the New Energy and Industrial Technology Development Organization (NEDO), the JST Fusion Oriented Research for disruptive Science and Technology Program (JPMJFR213D), and JSPS KAKENHI (JP24K17774). Q.W. and Z.P. gratefully acknowledge Professor Domen for his guidance during their PhD studies at the University of Tokyo, as well as for his ongoing support, encouragement, and mentorship. References 1 M.A. Green S.P. Bremner Nat. Mater. 16 2016 23 34 M. A. Green, S. P. Bremner, Nat. Mater., 2016, 16, 23–34. 2 N.S. Lewis D.G. Nocera Proc. Natl. Acad. Sci. U. S. A. 103 2006 15729 15735 N. S. Lewis, D. G. Nocera, Proc. Natl. Acad. Sci. U. S. A., 2006, 103, 15729–15735. 3 J. Goldemberg World energy assessment. Energy and the challenge of sustainability: Overview 2000 United Nations Development Programme New York J. Goldemberg, World energy assessment. Energy and the challenge of sustainability: Overview, United Nations Development Programme, New York, 2000. 4 M.R. Shaner H.A. Atwater N.S. Lewis E.W. McFarland Energy Environ. Sci. 9 2016 2354 2371 M. R. Shaner, H. A. Atwater, N. S. Lewis, E. W. McFarland, Energy Environ. Sci., 2016, 9, 2354–2371. 5 W.C. Chueh C. Falter M. Abbott D. Scipio P. Furler S.M. Haile A. Steinfeld Science 330 2010 1797 1801 W. C. Chueh, C. Falter, M. Abbott, D. Scipio, P. Furler, S. M. Haile, A. Steinfeld, Science, 2010, 330, 1797–1801. 6 C.L. Muhich B.W. Evanko K.C. Weston P. Lichty X. Liang J. Martinek C.B. Musgrave A.W. Weimer Science 341 2013 540 542 C. L. Muhich, B. W. Evanko, K. C. Weston, P. Lichty, X. Liang, J. Martinek, C. B. Musgrave, A. W. Weimer, Science, 2013, 341, 540–542. 7 M.E. Gálvez P.G. Loutzenhiser I. Hischier A. Steinfeld Energy Fuels 22 2008 3544 3550 M. E. Gálvez, P. G. Loutzenhiser, I. Hischier, A. Steinfeld, Energy Fuels, 2008, 22, 3544–3550. 8 Y. Pihosh V. Nandal T. Higashi R. Shoji R. Bekarevich H. Nishiyama T. Yamada V. Nicolosi T. Hisatomi H. Matsuzaki K. Seki K. Domen Adv. Energy Mater. 13 2023 2301327 Y. Pihosh, V. Nandal, T. Higashi, R. Shoji, R. Bekarevich, H. Nishiyama, T. Yamada, V. Nicolosi, T. Hisatomi, H. Matsuzaki, K. Seki, K. Domen, Adv. Energy Mater., 2023, 13, 2301327. 9 W.-H. Cheng M.H. Richter M.M. May J. Ohlmann D. Lackner F. Dimroth T. Hannappel H.A. Atwater H.-J. Lewerenz ACS Energy Lett. 3 2018 1795 1800 W.-H. Cheng, M. H. Richter, M. M. May, J. Ohlmann, D. Lackner, F. Dimroth, T. Hannappel, H. A. Atwater, H.-J. Lewerenz, ACS Energy Lett., 2018, 3, 1795–1800. 10 T. Sakai D. Mersch E. Reisner Angew. Chem. Int. Ed. 52 2013 12313 12316 T. Sakai, D. Mersch, E. Reisner, Angew. Chem. Int. Ed., 2013, 52, 12313–12316. 11 A.F. Heyduk D.G. Nocera Science 293 2001 1639 1641 A. F. Heyduk, D. G. Nocera, Science, 2001, 293, 1639–1641. 12 Y. Goto T. Hisatomi Q. Wang T. Higashi K. Ishikiriyama T. Maeda Y. Sakata S. Okunaka H. Tokudome M. Katayama S. Akiyama H. Nishiyama Y. Inoue T. Takewaki T. Setoyama T. Minegishi T. Takata T. Yamada K. Domen Joule 2 2018 509 520 Y. Goto, T. Hisatomi, Q. Wang, T. Higashi, K. Ishikiriyama, T. Maeda, Y. Sakata, S. Okunaka, H. Tokudome, M. Katayama, S. Akiyama, H. Nishiyama, Y. Inoue, T. Takewaki, T. Setoyama, T. Minegishi, T. Takata, T. Yamada, K. Domen, Joule, 2018, 2, 509–520. 13 Q. Wang T. Hisatomi Q. Jia H. Tokudome M. Zhong C. Wang Z. Pan T. Takata M. Nakabayashi N. Shibata Y. Li I.D. Sharp A. Kudo T. Yamada K. Domen Nat. Mater. 15 2016 611 615 Q. Wang, T. Hisatomi, Q. Jia, H. Tokudome, M. Zhong, C. Wang, Z. Pan, T. Takata, M. Nakabayashi, N. Shibata, Y. Li, I. D. Sharp, A. Kudo, T. Yamada, K. Domen, Nat. Mater., 2016, 15, 611–615. 14 J. Jia L.C. Seitz J.D. Benck Y. Huo Y. Chen J.W. Ng T. Bilir J.S. Harris T.F. Jaramillo Nat. Commun. 7 2016 13237 J. Jia, L. C. Seitz, J. D. Benck, Y. Huo, Y. Chen, J. W. Ng, T. Bilir, J. S. Harris, T. F. Jaramillo, Nat. Commun., 2016, 7, 13237. 15 H. Nishiyama T. Yamada M. Nakabayashi Y. Maehara M. Yamaguchi Y. Kuromiya Y. Nagatsuma H. Tokudome S. Akiyama T. Watanabe R. Narushima S. Okunaka N. Shibata T. Takata T. Hisatomi K. Domen Nature 598 2021 304 307 H. Nishiyama, T. Yamada, M. Nakabayashi, Y. Maehara, M. Yamaguchi, Y. Kuromiya, Y. Nagatsuma, H. Tokudome, S. Akiyama, T. Watanabe, R. Narushima, S. Okunaka, N. Shibata, T. Takata, T. Hisatomi, K. Domen, Nature, 2021, 598, 304–307. 16 K. Maeda T. Takata M. Hara N. Saito Y. Inoue H. Kobayashi K. Domen J. Am. Chem. Soc. 127 2005 8286 8287 K. Maeda, T. Takata, M. Hara, N. Saito, Y. Inoue, H. Kobayashi, K. Domen, J. Am. Chem. Soc., 2005, 127, 8286–8287. 17 K. Maeda K. Teramura D. Lu T. Takata N. Saito Y. Inoue K. Domen Nature 440 2006 295 K. Maeda, K. Teramura, D. Lu, T. Takata, N. Saito, Y. Inoue, K. Domen, Nature, 2006, 440, 295–295. 18 Q. Wang J. Warnan S. Rodríguez-Jiménez J.J. Leung S. Kalathil V. Andrei K. Domen E. Reisner Nat. Energy 5 2020 703 710 Q. Wang, J. Warnan, S. Rodríguez-Jiménez, J. J. Leung, S. Kalathil, V. Andrei, K. Domen, E. Reisner, Nat. Energy, 2020, 5, 703–710. 19 S. Wang K. Teramura T. Hisatomi K. Domen H. Asakura S. Hosokawa T. Tanaka ACS Sustain. Chem. Eng. 9 2021 9327 9335 S. Wang, K. Teramura, T. Hisatomi, K. Domen, H. Asakura, S. Hosokawa, T. Tanaka, ACS Sustain. Chem. Eng., 2021, 9, 9327–9335. 20 H. Arakawa K. Sayama Res. Chem. Intermed. 26 2000 145 152 H. Arakawa, K. Sayama, Res. Chem. Intermed., 2000, 26, 145–152. 21 A. Fujishima K. Honda Nature 238 1972 37 38 A. Fujishima, K. Honda, Nature, 1972, 238, 37–38. 22 R. Li Y. Weng X. Zhou X. Wang Y. Mi R. Chong H. Han C. Li Energy Environ. Sci. 8 2015 2377 2382 R. Li, Y. Weng, X. Zhou, X. Wang, Y. Mi, R. Chong, H. Han, C. Li, Energy Environ. Sci., 2015, 8, 2377–2382. 23 S. Royer D. Duprez F. Can X. Courtois C. Batiot-Dupeyrat S. Laassiri H. Alamdari Chem. Rev. 114 2014 10292 10368 S. Royer, D. Duprez, F. Can, X. Courtois, C. Batiot-Dupeyrat, S. Laassiri, H. Alamdari, Chem. Rev., 2014, 114, 10292–10368. 24 K. Domen S. Naito M. Soma T. Onishi K. Tamaru J. Chem. Soc. Chem. Commun. 1980 543 544 K. Domen, S. Naito, M. Soma, T. Onishi, K. Tamaru, J. Chem. Soc. Chem. Commun., 1980, 543–544. 25 K. Domen S. Naito T. Onishi K. Tamaru Chem. Phys. Lett. 92 1982 433 434 K. Domen, S. Naito, T. Onishi, K. Tamaru, Chem. Phys. Lett., 1982, 92, 433–434. 26 K. Domen S. Naito T. Onishi K. Tamaru M. Soma J. Phys. Chem. 86 1982 3657 3661 K. Domen, S. Naito, T. Onishi, K. Tamaru, M. Soma, J. Phys. Chem., 1982, 86, 3657–3661. 27 K. Domen A. Kudo T. Onishi J. Catal. 102 1986 92 98 K. Domen, A. Kudo, T. Onishi, J. Catal., 1986, 102, 92–98. 28 M.G. Kibria H.P. Nguyen K. Cui S. Zhao D. Liu H. Guo M.L. Trudeau S. Paradis A.R. Hakima Z. Mi ACS Nano 7 2013 7886 7893 M. G. Kibria, H. P. Nguyen, K. Cui, S. Zhao, D. Liu, H. Guo, M. L. Trudeau, S. Paradis, A. R. Hakima, Z. Mi, ACS Nano, 2013, 7, 7886–7893. 29 M.G. Kibria S. Zhao F.A. Chowdhury Q. Wang H.P. Nguyen M.L. Trudeau H. Guo Z. Mi Nat. Commun. 5 2014 3825 M. G. Kibria, S. Zhao, F. A. Chowdhury, Q. Wang, H. P. Nguyen, M. L. Trudeau, H. Guo, Z. Mi, Nat. Commun., 2014, 5, 3825. 30 Y. Qi S. Chen J. Cui Z. Wang F. Zhang C. Li Appl. Catal. B 224 2018 579 585 Y. Qi, S. Chen, J. Cui, Z. Wang, F. Zhang, C. Li, Appl. Catal. B, 2018, 224, 579–585. 31 M. Liu G. Zhang X. Liang Z. Pan D. Zheng S. Wang Z. Yu Y. Hou X. Wang Angew. Chem. Int. Ed. 62 2023 e202304694 M. Liu, G. Zhang, X. Liang, Z. Pan, D. Zheng, S. Wang, Z. Yu, Y. Hou, X. Wang, Angew. Chem. Int. Ed., 2023, 62, e202304694. 32 Q. Ding T. Chen Z. Li Z. Feng X. Wang Chin. J. Catal. 42 2021 808 816 Q. Ding, T. Chen, Z. Li, Z. Feng, X. Wang, Chin. J. Catal., 2021, 42, 808–816. 33 J.E.T. Andersen P.J. Møller Thin Solid Films 186 1990 137 146 J. E. T. Andersen, P. J. Møller, Thin Solid Films, 1990, 186, 137–146. 34 M. Avudaithai T.R.N. Kutty Mater. Res. Bull. 22 1987 641 650 M. Avudaithai, T. R. N. Kutty, Mater. Res. Bull., 1987, 22, 641–650. 35 A. Kudo A. Tanaka K. Domen T. Onishi J. Catal. 111 1988 296 301 A. Kudo, A. Tanaka, K. Domen, T. Onishi, J. Catal., 1988, 111, 296–301. 36 F.T. Wagner S. Ferrer G.A. Somorjai Surf. Sci. 101 1980 462 474 F. T. Wagner, S. Ferrer, G. A. Somorjai, Surf. Sci., 1980, 101, 462–474. 37 W. Liu D. Wang T. Li Hydrogen Systems 1986 101 109 W. Liu, D. Wang, T. Li, Hydrogen Systems, 1986, 101–109. 38 T. Takata K. Domen J. Phys. Chem. C 113 2009 19386 19388 T. Takata, K. Domen, J. Phys. Chem. C, 2009, 113, 19386–19388. 39 H.G. Yang C.H. Sun S.Z. Qiao J. Zou G. Liu S.C. Smith H.M. Cheng G.Q. Lu Nature 453 2008 638 641 H. G. Yang, C. H. Sun, S. Z. Qiao, J. Zou, G. Liu, S. C. Smith, H. M. Cheng, G. Q. Lu, Nature, 2008, 453, 638–641. 40 R. Li F. Zhang D. Wang J. Yang M. Li J. Zhu X. Zhou H. Han C. Li Nat. Commun. 4 2013 1432 R. Li, F. Zhang, D. Wang, J. Yang, M. Li, J. Zhu, X. Zhou, H. Han, C. Li, Nat. Commun., 2013, 4, 1432. 41 Y. Ham T. Hisatomi Y. Goto Y. Moriya Y. Sakata A. Yamakata J. Kubota K. Domen J. Mater. Chem. A 4 2016 3027 3033 Y. Ham, T. Hisatomi, Y. Goto, Y. Moriya, Y. Sakata, A. Yamakata, J. Kubota, K. Domen, J. Mater. Chem. A, 2016, 4, 3027–3033. 42 T.H. Chiang H. Lyu T. Hisatomi Y. Goto T. Takata M. Katayama T. Minegishi K. Domen ACS Catal. 8 2018 2782 2788 T. H. Chiang, H. Lyu, T. Hisatomi, Y. Goto, T. Takata, M. Katayama, T. Minegishi, K. Domen, ACS Catal., 2018, 8, 2782–2788. 43 A. Yamakata H. Yeilin M. Kawaguchi T. Hisatomi J. Kubota Y. Sakata K. Domen J. Photochem. Photobiol. A 313 2015 168 175 A. Yamakata, H. Yeilin, M. Kawaguchi, T. Hisatomi, J. Kubota, Y. Sakata, K. Domen, J. Photochem. Photobiol. A, 2015, 313, 168–175. 44 Z. Zhao R.V. Goncalves S.K. Barman E.J. Willard E. Byle R. Perry Z. Wu M.N. Huda A.J. Moulé F.E. Osterloh Energy Environ. Sci. 12 2019 1385 1395 Z. Zhao, R. V. Goncalves, S. K. Barman, E. J. Willard, E. Byle, R. Perry, Z. Wu, M. N. Huda, A. J. Moulé, F. E. Osterloh, Energy Environ. Sci., 2019, 12, 1385–1395. 45 K. Domen A. Kudo T. Onishi N. Kosugi H. Kuroda J. Phys. Chem. 90 1986 292 295 K. Domen, A. Kudo, T. Onishi, N. Kosugi, H. Kuroda, J. Phys. Chem., 1986, 90, 292–295. 46 T. Takata J. Jiang Y. Sakata M. Nakabayashi N. Shibata V. Nandal K. Seki T. Hisatomi K. Domen Nature 581 2020 411 414 T. Takata, J. Jiang, Y. Sakata, M. Nakabayashi, N. Shibata, V. Nandal, K. Seki, T. Hisatomi, K. Domen, Nature, 2020, 581, 411–414. 47 K. Domen A. Kudo A. Shinozaki A. Tanaka K.-i. Maruya T. Onishi J. Chem. Soc., Chem. Commun. 1986 356 357 K. Domen, A. Kudo, A. Shinozaki, A. Tanaka, K.-i. Maruya, T. Onishi, J. Chem. Soc., Chem. Commun., 1986, 356–357. 48 T. Oshima D. Lu O. Ishitani K. Maeda Angew. Chem. Int. Ed. 54 2015 2698 2702 T. Oshima, D. Lu, O. Ishitani, K. Maeda, Angew. Chem. Int. Ed., 2015, 54, 2698–2702. 49 T. Takata Y. Furumi K. Shinohara A. Tanaka M. Hara J.N. Kondo K. Domen Chem. Mater. 9 1997 1063 1064 T. Takata, Y. Furumi, K. Shinohara, A. Tanaka, M. Hara, J. N. Kondo, K. Domen, Chem. Mater., 1997, 9, 1063–1064. 50 A. Kudo K. Sayama A. Tanaka K. Asakura K. Domen K. Maruya T. Onishi J. Catal. 120 1989 337 352 A. Kudo, K. Sayama, A. Tanaka, K. Asakura, K. Domen, K. Maruya, T. Onishi, J. Catal., 1989, 120, 337–352. 51 G. Lagaly K. Beneke J. Inorg. Nucl. Chem. 38 1976 1513 1518 G. Lagaly, K. Beneke, J. Inorg. Nucl. Chem., 1976, 38, 1513–1518. 52 K. Domen A. Kudo M. Shibata A. Tanaka K.-I. Maruya T. Onishi J. Chem. Soc., Chem. Commun. 1986 1706 1707 K. Domen, A. Kudo, M. Shibata, A. Tanaka, K.-I. Maruya, T. Onishi, J. Chem. Soc., Chem. Commun., 1986, 1706–1707. 53 A. Kudo A. Tanaka K. Domen K. Maruya K. Aika T. Onishi J. Catal. 111 1988 67 76 A. Kudo, A. Tanaka, K. Domen, K. Maruya, K. Aika, T. Onishi, J. Catal., 1988, 111, 67–76. 54 K. Domen Y. Ebina T. Sekine A. Tanaka J. Kondo C. Hirose Catal. Today 16 1993 479 486 K. Domen, Y. Ebina, T. Sekine, A. Tanaka, J. Kondo, C. Hirose, Catal. Today, 1993, 16, 479–486. 55 K. Domen A. Kudo A. Tanaka T. Onishi Catal. Today 8 1990 77 84 K. Domen, A. Kudo, A. Tanaka, T. Onishi, Catal. Today, 1990, 8, 77–84. 56 Y. Ebina N. Sakai T. Sasaki J. Phys. Chem. B 109 2005 17212 17216 Y. Ebina, N. Sakai, T. Sasaki, J. Phys. Chem. B, 2005, 109, 17212–17216. 57 T. Takata K. Shinohara A. Tanaka M. Hara J.N. Kondo K. Domen J. Photochem. Photobiol. A 106 1997 45 49 T. Takata, K. Shinohara, A. Tanaka, M. Hara, J. N. Kondo, K. Domen, J. Photochem. Photobiol. A, 1997, 106, 45–49. 58 S. Ikeda M. Hara J.N. Kondo K. Domen H. Takahashi T. Okubo M. Kakihana Chem. Mater. 10 1998 72 77 S. Ikeda, M. Hara, J. N. Kondo, K. Domen, H. Takahashi, T. Okubo, M. Kakihana, Chem. Mater., 1998, 10, 72–77. 59 R. Abe K. Shinmei N. Koumura K. Hara B. Ohtani J. Am. Chem. Soc. 135 2013 16872 16884 R. Abe, K. Shinmei, N. Koumura, K. Hara, B. Ohtani, J. Am. Chem. Soc., 2013, 135, 16872–16884. 60 S. Nishioka K. Hojo L. Xiao T. Gao Y. Miseki S. Yasuda T. Yokoi K. Sayama T.E. Mallouk K. Maeda Sci. Adv. 8 2022 eadc9115 S. Nishioka, K. Hojo, L. Xiao, T. Gao, Y. Miseki, S. Yasuda, T. Yokoi, K. Sayama, T. E. Mallouk, K. Maeda, Sci. Adv., 2022, 8, eadc9115. 61 A. Kasahara K. Nukumizu T. Takata J.N. Kondo M. Hara H. Kobayashi K. Domen J. Phys. Chem. B 107 2003 791 797 A. Kasahara, K. Nukumizu, T. Takata, J. N. Kondo, M. Hara, H. Kobayashi, K. Domen, J. Phys. Chem. B, 2003, 107, 791–797. 62 X. Zong H. Yan G. Wu G. Ma F. Wen L. Wang C. Li J. Am. Chem. Soc. 130 2008 7176 7177 X. Zong, H. Yan, G. Wu, G. Ma, F. Wen, L. Wang, C. Li, J. Am. Chem. Soc., 2008, 130, 7176–7177. 63 J. Yang H. Yan X. Wang F. Wen Z. Wang D. Fan J. Shi C. Li J. Catal. 290 2012 151 157 J. Yang, H. Yan, X. Wang, F. Wen, Z. Wang, D. Fan, J. Shi, C. Li, J. Catal., 2012, 290, 151–157. 64 A. Kudo R. Niishiro A. Iwase H. Kato Chem. Phys. 339 2007 104 110 A. Kudo, R. Niishiro, A. Iwase, H. Kato, Chem. Phys., 2007, 339, 104–110. 65 G. Liu L. Wang H.G. Yang H.-M. Cheng G.Q. Lu J. Mater. Chem. 20 2010 831 843 G. Liu, L. Wang, H. G. Yang, H.-M. Cheng, G. Q. Lu, J. Mater. Chem., 2010, 20, 831–843. 66 R. Asai H. Nemoto Q. Jia K. Saito A. Iwase A. Kudo Chem. Commun. 50 2014 2543 2546 R. Asai, H. Nemoto, Q. Jia, K. Saito, A. Iwase, A. Kudo, Chem. Commun., 2014, 50, 2543–2546. 67 A. Iwase H. Misono Chem. Commun. 57 2021 10331 10334 A. Iwase, H. Misono, Chem. Commun., 2021, 57, 10331–10334. 68 M. Jansen H.P. Letschert Nature 404 2000 980 982 M. Jansen, H. P. Letschert, Nature, 2000, 404, 980–982. 69 Z. Pan T. Hisatomi K. Domen H. Frei D. Esposito Ultrathin Oxide Layers for Solar and Electrocatalytic Systems 2022 The Royal Society of Chemistry Cambridge 265 297 Z. Pan, T. Hisatomi, K. Domen, in: H. Frei, D. Esposito ed., Ultrathin Oxide Layers for Solar and Electrocatalytic Systems, The Royal Society of Chemistry, Cambridge, 2022, 265-297. 70 H. Li J. Xiao J.J.M. Vequizo T. Hisatomi M. Nakabayashi Z. Pan N. Shibata A. Yamakata T. Takata K. Domen ACS Catal. 12 2022 10179 10185 H. Li, J. Xiao, J. J. M. Vequizo, T. Hisatomi, M. Nakabayashi, Z. Pan, N. Shibata, A. Yamakata, T. Takata, K. Domen, ACS Catal., 2022, 12, 10179–10185. 71 S. Nishimae J.J.M. Vequizo Y. Inoue A. Yamakata M. Nakabayashi T. Higashi K. Domen J. Mater. Chem. A 11 2023 6299 6310 S. Nishimae, J. J. M. Vequizo, Y. Inoue, A. Yamakata, M. Nakabayashi, T. Higashi, K. Domen, J. Mater. Chem. A, 2023, 11, 6299–6310. 72 J. Xu C. Pan T. Takata K. Domen Chem. Commun. 51 2015 7191 7194 J. Xu, C. Pan, T. Takata, K. Domen, Chem. Commun., 2015, 51, 7191–7194. 73 X. Liu L. Yan W. Li K. Chen F. Wang J. Xiao T. Hisatomi T. Takata K. Domen ACS Catal. 2024 10561 10567 X. Liu, L. Yan, W. Li, K. Chen, F. Wang, J. Xiao, T. Hisatomi, T. Takata, K. Domen, ACS Catal., 2024, 10561–10567. 74 M. Higashi R. Abe H. Sugihara K. Domen Bull. Chem. Soc. Jpn. 81 2008 1315 1321 M. Higashi, R. Abe, H. Sugihara, K. Domen, Bull. Chem. Soc. Jpn., 2008, 81, 1315–1321. 75 N. Arai N. Saito H. Nishiyama Y. Inoue K. Domen K. Sato Chem. Lett. 35 2006 796 797 N. Arai, N. Saito, H. Nishiyama, Y. Inoue, K. Domen, K. Sato, Chem. Lett., 2006, 35, 796–797. 76 K. Liu B. Zhang J. Zhang W. Lin J. Wang Y. Xu Y. Xiang T. Hisatomi K. Domen G. Ma ACS Catal. 12 2022 14637 14646 K. Liu, B. Zhang, J. Zhang, W. Lin, J. Wang, Y. Xu, Y. Xiang, T. Hisatomi, K. Domen, G. Ma, ACS Catal., 2022, 12, 14637–14646. 77 K. Maeda A. Xiong T. Yoshinaga T. Ikeda N. Sakamoto T. Hisatomi M. Takashima D. Lu M. Kanehara T. Setoyama T. Teranishi K. Domen Angew. Chem. Int. Ed. 49 2010 4096 4099 K. Maeda, A. Xiong, T. Yoshinaga, T. Ikeda, N. Sakamoto, T. Hisatomi, M. Takashima, D. Lu, M. Kanehara, T. Setoyama, T. Teranishi, K. Domen, Angew. Chem. Int. Ed., 2010, 49, 4096–4099. 78 K. Maeda N. Sakamoto T. Ikeda H. Ohtsuka A. Xiong D. Lu M. Kanehara T. Teranishi K. Domen Chem. Eur. J. 16 2010 7750 7759 K. Maeda, N. Sakamoto, T. Ikeda, H. Ohtsuka, A. Xiong, D. Lu, M. Kanehara, T. Teranishi, K. Domen, Chem. Eur. J., 2010, 16, 7750–7759. 79 K. Maeda K. Teramura D. Lu N. Saito Y. Inoue K. Domen Angew. Chem. Int. Ed. 45 2006 7806 7809 K. Maeda, K. Teramura, D. Lu, N. Saito, Y. Inoue, K. Domen, Angew. Chem. Int. Ed., 2006, 45, 7806–7809. 80 A. Xiong G. Ma K. Maeda T. Takata T. Hisatomi T. Setoyama J. Kubota K. Domen Catal. Sci. Technol. 4 2014 325 328 A. Xiong, G. Ma, K. Maeda, T. Takata, T. Hisatomi, T. Setoyama, J. Kubota, K. Domen, Catal. Sci. Technol., 2014, 4, 325–328. 81 J. Sato N. Saito Y. Yamada K. Maeda T. Takata J.N. Kondo M. Hara H. Kobayashi K. Domen Y. Inoue J. Am. Chem. Soc. 127 2005 4150 4151 J. Sato, N. Saito, Y. Yamada, K. Maeda, T. Takata, J. N. Kondo, M. Hara, H. Kobayashi, K. Domen, Y. Inoue, J. Am. Chem. Soc., 2005, 127, 4150–4151. 82 Y. Lee T. Watanabe T. Takata M. Hara M. Yoshimura K. Domen J. Phys. Chem. B 110 2006 17563 17569 Y. Lee, T. Watanabe, T. Takata, M. Hara, M. Yoshimura, K. Domen, J. Phys. Chem. B, 2006, 110, 17563–17569. 83 C.T.K. Thaminimulla T. Takata M. Hara J.N. Kondo K. Domen J. Catal. 196 2000 362 365 C. T. K. Thaminimulla, T. Takata, M. Hara, J. N. Kondo, K. Domen, J. Catal., 2000, 196, 362–365. 84 K. Sayama A. Tanaka K. Domen K. Maruya T. Onishi J. Catal. 124 1990 541 547 K. Sayama, A. Tanaka, K. Domen, K. Maruya, T. Onishi, J. Catal., 1990, 124, 541–547. 85 C. Pan T. Takata M. Nakabayashi T. Matsumoto N. Shibata Y. Ikuhara K. Domen Angew. Chem. Int. Ed. 54 2015 2955 2959 C. Pan, T. Takata, M. Nakabayashi, T. Matsumoto, N. Shibata, Y. Ikuhara, K. Domen, Angew. Chem. Int. Ed., 2015, 54, 2955–2959. 86 C. Pan T. Takata K. Kumamoto S.S. Khine Ma K. Ueda T. Minegishi M. Nakabayashi T. Matsumoto N. Shibata Y. Ikuhara K. Domen J. Mater. Chem. A 4 2016 4544 4552 C. Pan, T. Takata, K. Kumamoto, S. S. Khine Ma, K. Ueda, T. Minegishi, M. Nakabayashi, T. Matsumoto, N. Shibata, Y. Ikuhara, K. Domen, J. Mater. Chem. A, 2016, 4, 4544–4552. 87 C. Pan T. Takata K. Domen Chem. Eur. J. 22 2016 1854 1862 C. Pan, T. Takata, K. Domen, Chem. Eur. J., 2016, 22, 1854–1862. 88 K. Chen J. Xiao J.J.M. Vequizo T. Hisatomi Y. Ma M. Nakabayashi T. Takata A. Yamakata N. Shibata K. Domen J. Am. Chem. Soc. 145 2023 3839 3843 K. Chen, J. Xiao, J. J. M. Vequizo, T. Hisatomi, Y. Ma, M. Nakabayashi, T. Takata, A. Yamakata, N. Shibata, K. Domen, J. Am. Chem. Soc., 2023, 145, 3839–3843. 89 C.J. Shearer T. Hisatomi K. Domen G.F. Metha J. Photochem. Photobiol. A 401 2020 112757 C. J. Shearer, T. Hisatomi, K. Domen, G. F. Metha, J. Photochem. Photobiol. A, 2020, 401, 112757. 90 Z. Wang Y. Inoue T. Hisatomi R. Ishikawa Q. Wang T. Takata S. Chen N. Shibata Y. Ikuhara K. Domen Nat. Catal. 1 2018 756 763 Z. Wang, Y. Inoue, T. Hisatomi, R. Ishikawa, Q. Wang, T. Takata, S. Chen, N. Shibata, Y. Ikuhara, K. Domen, Nat. Catal., 2018, 1, 756–763. 91 J. Xiao S. Nishimae J.J.M. Vequizo M. Nakabayashi T. Hisatomi H. Li L. Lin N. Shibata A. Yamakata Y. Inoue K. Domen Angew. Chem. Int. Ed. 61 2022 e202116573 J. Xiao, S. Nishimae, J. J. M. Vequizo, M. Nakabayashi, T. Hisatomi, H. Li, L. Lin, N. Shibata, A. Yamakata, Y. Inoue, K. Domen, Angew. Chem. Int. Ed., 2022, 61, e202116573. 92 Q. Wang M. Nakabayashi T. Hisatomi S. Sun S. Akiyama Z. Wang Z. Pan X. Xiao T. Watanabe T. Yamada N. Shibata T. Takata K. Domen Nat. Mater. 18 2019 827 832 Q. Wang, M. Nakabayashi, T. Hisatomi, S. Sun, S. Akiyama, Z. Wang, Z. Pan, X. Xiao, T. Watanabe, T. Yamada, N. Shibata, T. Takata, K. Domen, Nat. Mater., 2019, 18, 827–832. 93 K. Maeda D. Lu K. Domen Chem. Eur. J. 19 2013 4986 4991 K. Maeda, D. Lu, K. Domen, Chem. Eur. J., 2013, 19, 4986–4991. 94 Y. Lee K. Teramura M. Hara K. Domen Chem. Mater. 19 2007 2120 2127 Y. Lee, K. Teramura, M. Hara, K. Domen, Chem. Mater., 2007, 19, 2120–2127. 95 Y. Lee H. Terashima Y. Shimodaira K. Teramura M. Hara H. Kobayashi K. Domen M. Yashima J. Phys. Chem. C 111 2006 1042 1048 Y. Lee, H. Terashima, Y. Shimodaira, K. Teramura, M. Hara, H. Kobayashi, K. Domen, M. Yashima, J. Phys. Chem. C, 2006, 111, 1042–1048. 96 X. Wang K. Maeda Y. Lee K. Domen Chem. Phys. Lett. 457 2008 134 136 X. Wang, K. Maeda, Y. Lee, K. Domen, Chem. Phys. Lett., 2008, 457, 134–136. 97 G. Hitoki T. Takata J.N. Kondo M. Hara H. Kobayashi K. Domen Chem. Commun. 2002 1698 1699 G. Hitoki, T. Takata, J. N. Kondo, M. Hara, H. Kobayashi, K. Domen, Chem. Commun., 2002, 1698–1699. 98 M. Yashima Y. Lee K. Domen Chem. Mater. 19 2007 588 593 M. Yashima, Y. Lee, K. Domen, Chem. Mater., 2007, 19, 588–593. 99 G. Hitoki A. Ishikawa T. Takata J.N. Kondo M. Hara K. Domen Chem. Lett. 31 2002 736 737 G. Hitoki, A. Ishikawa, T. Takata, J. N. Kondo, M. Hara, K. Domen, Chem. Lett., 2002, 31, 736–737. 100 W.-J. Chun A. Ishikawa H. Fujisawa T. Takata J.N. Kondo M. Hara M. Kawai Y. Matsumoto K. Domen J. Phys. Chem. B 107 2003 1798 1803 W.-J. Chun, A. Ishikawa, H. Fujisawa, T. Takata, J. N. Kondo, M. Hara, M. Kawai, Y. Matsumoto, K. Domen, J. Phys. Chem. B, 2003, 107, 1798–1803. 101 T. Takata G. Hitoki J.N. Kondo M. Hara H. Kobayashi K. Domen Res. Chem. Intermed. 33 2007 13 25 T. Takata, G. Hitoki, J. N. Kondo, M. Hara, H. Kobayashi, K. Domen, Res. Chem. Intermed., 2007, 33, 13–25. 102 S.S. Ma T. Hisatomi K. Maeda Y. Moriya K. Domen J. Am. Chem. Soc. 134 2012 19993 19996 S. S. Ma, T. Hisatomi, K. Maeda, Y. Moriya, K. Domen, J. Am. Chem. Soc., 2012, 134, 19993–19996. 103 K. Maeda H. Terashima K. Kase M. Higashi M. Tabata K. Domen Bull. Chem. Soc. Jpn. 81 2008 927 937 K. Maeda, H. Terashima, K. Kase, M. Higashi, M. Tabata, K. Domen, Bull. Chem. Soc. Jpn., 2008, 81, 927–937. 104 J. Seo T. Takata M. Nakabayashi T. Hisatomi N. Shibata T. Minegishi K. Domen J. Am. Chem. Soc. 137 2015 12780 12783 J. Seo, T. Takata, M. Nakabayashi, T. Hisatomi, N. Shibata, T. Minegishi, K. Domen, J. Am. Chem. Soc., 2015, 137, 12780–12783. 105 J. Xiao J.J.M. Vequizo T. Hisatomi J. Rabeah M. Nakabayashi Z. Wang Q. Xiao H. Li Z. Pan M. Krause N. Yin G. Smith N. Shibata A. Bruckner A. Yamakata T. Takata K. Domen J. Am. Chem. Soc. 143 2021 10059 10064 J. Xiao, J. J. M. Vequizo, T. Hisatomi, J. Rabeah, M. Nakabayashi, Z. Wang, Q. Xiao, H. Li, Z. Pan, M. Krause, N. Yin, G. Smith, N. Shibata, A. Bruckner, A. Yamakata, T. Takata, K. Domen, J. Am. Chem. Soc., 2021, 143, 10059–10064. 106 S. Chen Y. Qi T. Hisatomi Q. Ding T. Asai Z. Li S.S. Ma F. Zhang K. Domen C. Li Angew. Chem. Int. Ed. 54 2015 8498 8501 S. Chen, Y. Qi, T. Hisatomi, Q. Ding, T. Asai, Z. Li, S. S. Ma, F. Zhang, K. Domen, C. Li, Angew. Chem. Int. Ed., 2015, 54, 8498–8501. 107 Y. Qi B. Zhang G. Zhang Z. Zheng T. Xie S. Chen G. Ma C. Li K. Domen F. Zhang Joule 8 2024 193 203 Y. Qi, B. Zhang, G. Zhang, Z. Zheng, T. Xie, S. Chen, G. Ma, C. Li, K. Domen, F. Zhang, Joule, 2024, 8, 193–203. 108 Y. Qi J. Zhang Y. Kong Y. Zhao S. Chen D. Li W. Liu Y. Chen T. Xie J. Cui C. Li K. Domen F. Zhang Nat. Commun. 13 2022 484 Y. Qi, J. Zhang, Y. Kong, Y. Zhao, S. Chen, D. Li, W. Liu, Y. Chen, T. Xie, J. Cui, C. Li, K. Domen, F. Zhang, Nat. Commun., 2022, 13, 484. 109 E. Nurlaela A. Ziani K. Takanabe Mater. Renewable Sustainable Energy 5 2016 18 E. Nurlaela, A. Ziani, K. Takanabe, Mater. Renewable Sustainable Energy, 2016, 5, 18. 110 S. Chen Y. Qi Q. Ding Z. Li J. Cui F. Zhang C. Li J. Catal. 339 2016 77 83 S. Chen, Y. Qi, Q. Ding, Z. Li, J. Cui, F. Zhang, C. Li, J. Catal., 2016, 339, 77–83. 111 S. Chen S. Shen G. Liu Y. Qi F. Zhang C. Li Angew. Chem. Int. Ed. 54 2015 3047 3051 S. Chen, S. Shen, G. Liu, Y. Qi, F. Zhang, C. Li, Angew. Chem. Int. Ed., 2015, 54, 3047–3051. 112 B. Dong J. Cui Y. Gao Y. Qi F. Zhang C. Li Adv. Mater. 31 2019 1808185 B. Dong, J. Cui, Y. Gao, Y. Qi, F. Zhang, C. Li, Adv. Mater., 2019, 31, 1808185. 113 T. Takata C. Pan K. Domen ChemElectroChem 3 2016 31 37 T. Takata, C. Pan, K. Domen, ChemElectroChem, 2016, 3, 31–37. 114 A. Kasahara K. Nukumizu G. Hitoki T. Takata J.N. Kondo M. Hara H. Kobayashi K. Domen J. Phys. Chem. A 106 2002 6750 6753 A. Kasahara, K. Nukumizu, G. Hitoki, T. Takata, J. N. Kondo, M. Hara, H. Kobayashi, K. Domen, J. Phys. Chem. A, 2002, 106, 6750–6753. 115 M. Yashima M. Saito H. Nakano T. Takata K. Ogisu K. Domen Chem. Commun. 46 2010 4704 4706 M. Yashima, M. Saito, H. Nakano, T. Takata, K. Ogisu, K. Domen, Chem. Commun., 2010, 46, 4704–4706. 116 F. Zhang A. Yamakata K. Maeda Y. Moriya T. Takata J. Kubota K. Teshima S. Oishi K. Domen J. Am. Chem. Soc. 134 2012 8348 8351 F. Zhang, A. Yamakata, K. Maeda, Y. Moriya, T. Takata, J. Kubota, K. Teshima, S. Oishi, K. Domen, J. Am. Chem. Soc., 2012, 134, 8348–8351. 117 T. Hisatomi T. Yamamoto Q. Wang T. Nakanishi T. Higashi M. Katayama T. Minegishi K. Domen Catal. Sci. Technol. 8 2018 3918 3925 T. Hisatomi, T. Yamamoto, Q. Wang, T. Nakanishi, T. Higashi, M. Katayama, T. Minegishi, K. Domen, Catal. Sci. Technol., 2018, 8, 3918–3925. 118 M. Matsukawa R. Ishikawa T. Hisatomi Y. Moriya N. Shibata J. Kubota Y. Ikuhara K. Domen Nano Lett. 14 2014 1038 1041 M. Matsukawa, R. Ishikawa, T. Hisatomi, Y. Moriya, N. Shibata, J. Kubota, Y. Ikuhara, K. Domen, Nano Lett., 2014, 14, 1038–1041. 119 M. Higashi R. Abe K. Teramura T. Takata B. Ohtani K. Domen Chem. Phys. Lett. 452 2008 120 123 M. Higashi, R. Abe, K. Teramura, T. Takata, B. Ohtani, K. Domen, Chem. Phys. Lett., 2008, 452, 120–123. 120 M. Higashi R. Abe T. Takata K. Domen Chem. Mater. 21 2009 1543 1549 M. Higashi, R. Abe, T. Takata, K. Domen, Chem. Mater., 2009, 21, 1543–1549. 121 T. Matoba K. Maeda K. Domen Chem. Eur. J. 17 2011 14731 14735 T. Matoba, K. Maeda, K. Domen, Chem. Eur. J., 2011, 17, 14731–14735. 122 Y. Luo Z. Wang S. Suzuki K. Yubuta N. Kariya T. Hisatomi K. Domen K. Teshima Cryst. Growth Des. 20 2020 255 261 Y. Luo, Z. Wang, S. Suzuki, K. Yubuta, N. Kariya, T. Hisatomi, K. Domen, K. Teshima, Cryst. Growth Des., 2020, 20, 255–261. 123 Z. Wang Y. Luo T. Hisatomi J.J.M. Vequizo S. Suzuki S. Chen M. Nakabayashi L. Lin Z. Pan N. Kariya A. Yamakata N. Shibata T. Takata K. Teshima K. Domen Nat. Commun. 12 2021 1005 Z. Wang, Y. Luo, T. Hisatomi, J. J. M. Vequizo, S. Suzuki, S. Chen, M. Nakabayashi, L. Lin, Z. Pan, N. Kariya, A. Yamakata, N. Shibata, T. Takata, K. Teshima, K. Domen, Nat. Commun., 2021, 12, 1005. 124 J. Xiao M. Nakabayashi T. Hisatomi J.J.M. Vequizo W. Li K. Chen X. Tao A. Yamakata N. Shibata T. Takata Y. Inoue K. Domen Nat. Commun. 14 2023 8030 J. Xiao, M. Nakabayashi, T. Hisatomi, J. J. M. Vequizo, W. Li, K. Chen, X. Tao, A. Yamakata, N. Shibata, T. Takata, Y. Inoue, K. Domen, Nat. Commun., 2023, 14, 8030. 125 B. Siritanaratkul K. Maeda T. Hisatomi K. Domen ChemSusChem 4 2011 74 78 B. Siritanaratkul, K. Maeda, T. Hisatomi, K. Domen, ChemSusChem, 2011, 4, 74–78. 126 Y. Miseki H. Kato A. Kudo Energy Environ. Sci. 2 2009 306 314 Y. Miseki, H. Kato, A. Kudo, Energy Environ. Sci., 2009, 2, 306–314. 127 T. Hisatomi C. Katayama Y. Moriya T. Minegishi M. Katayama H. Nishiyama T. Yamada K. Domen Energy Environ. Sci. 6 2013 3595 3599 T. Hisatomi, C. Katayama, Y. Moriya, T. Minegishi, M. Katayama, H. Nishiyama, T. Yamada, K. Domen, Energy Environ. Sci., 2013, 6, 3595–3599. 128 Y. Inoue Energy Environ. Sci. 2 2009 364 386 Y. Inoue, Energy Environ. Sci., 2009, 2, 364–386. 129 K. Maeda N. Saito D. Lu Y. Inoue K. Domen J. Phys. Chem. C 111 2007 4749 4755 K. Maeda, N. Saito, D. Lu, Y. Inoue, K. Domen, J. Phys. Chem. C, 2007, 111, 4749–4755. 130 K. Maeda K. Teramura N. Saito Y. Inoue K. Domen Bull. Chem. Soc. Jpn. 80 2007 1004 1010 K. Maeda, K. Teramura, N. Saito, Y. Inoue, K. Domen, Bull. Chem. Soc. Jpn., 2007, 80, 1004–1010. 131 N. Arai N. Saito H. Nishiyama K. Domen H. Kobayashi K. Sato Y. Inoue Catal. Today 129 2007 407 413 N. Arai, N. Saito, H. Nishiyama, K. Domen, H. Kobayashi, K. Sato, Y. Inoue, Catal. Today, 2007, 129, 407–413. 132 K. Maeda K. Domen J. Phys. Chem. C 111 2007 7851 7861 K. Maeda, K. Domen, J. Phys. Chem. C, 2007, 111, 7851–7861. 133 K. Maeda K. Teramura T. Takata M. Hara N. Saito K. Toda Y. Inoue H. Kobayashi K. Domen J. Phys. Chem. B 109 2005 20504 20510 K. Maeda, K. Teramura, T. Takata, M. Hara, N. Saito, K. Toda, Y. Inoue, H. Kobayashi, K. Domen, J. Phys. Chem. B, 2005, 109, 20504–20510. 134 K. Maeda K. Teramura K. Domen J. Catal. 254 2008 198 204 K. Maeda, K. Teramura, K. Domen, J. Catal., 2008, 254, 198–204. 135 S. Nakamura Science 281 1998 956 961 S. Nakamura, Science, 1998, 281, 956–961. 136 A. Tsukazaki A. Ohtomo T. Onuma M. Ohtani T. Makino M. Sumiya K. Ohtani S.F. Chichibu S. Fuke Y. Segawa H. Ohno H. Koinuma M. Kawasaki Nat. Mater. 4 2005 42 46 A. Tsukazaki, A. Ohtomo, T. Onuma, M. Ohtani, T. Makino, M. Sumiya, K. Ohtani, S. F. Chichibu, S. Fuke, Y. Segawa, H. Ohno, H. Koinuma, M. Kawasaki, Nat. Mater., 2005, 4, 42–46. 137 H. Schulz K.H. Thiemann Solid State Commun. 23 1977 815 819 H. Schulz, K. H. Thiemann, Solid State Commun., 1977, 23, 815–819. 138 O. García-Martínez R.M. Rojas E. Vila J.L.M. de Vidales Solid State Ion. 63–65 1993 442 449 O. García-Martínez, R. M. Rojas, E. Vila, J. L. M. de Vidales, Solid State Ion., 1993, 63–65, 442–449. 139 M. Yoshida T. Hirai K. Maeda N. Saito J. Kubota H. Kobayashi Y. Inoue K. Domen J. Phys. Chem. C 114 2010 15510 15515 M. Yoshida, T. Hirai, K. Maeda, N. Saito, J. Kubota, H. Kobayashi, Y. Inoue, K. Domen, J. Phys. Chem. C, 2010, 114, 15510–15515. 140 F. Tessier P. Maillard Y. Lee C. Bleugat K. Domen J. Phys. Chem. C 113 2009 8526 8531 F. Tessier, P. Maillard, Y. Lee, C. Bleugat, K. Domen, J. Phys. Chem. C, 2009, 113, 8526–8531. 141 K. Kamata K. Maeda D. Lu Y. Kako K. Domen Chem. Phys. Lett. 470 2009 90 94 K. Kamata, K. Maeda, D. Lu, Y. Kako, K. Domen, Chem. Phys. Lett., 2009, 470, 90–94. 142 L. Gao Q. Zhang J. Li J. Mater. Chem. 13 2003 154 158 L. Gao, Q. Zhang, J. Li, J. Mater. Chem., 2003, 13, 154–158. 143 R. Abe M. Higashi Z. Zou K. Sayama Y. Abe Chem. Lett. 33 2004 954 955 R. Abe, M. Higashi, Z. Zou, K. Sayama, Y. Abe, Chem. Lett., 2004, 33, 954–955. 144 A. Ishikawa T. Takata J.N. Kondo M. Hara H. Kobayashi K. Domen J. Am. Chem. Soc. 124 2002 13547 13553 A. Ishikawa, T. Takata, J. N. Kondo, M. Hara, H. Kobayashi, K. Domen, J. Am. Chem. Soc., 2002, 124, 13547–13553. 145 M. Yashima K. Ogisu K. Domen Acta. Crystalloger. B 64 2008 291 298 M. Yashima, K. Ogisu, K. Domen, Acta. Crystalloger. B, 2008, 64, 291–298. 146 R. Li Z. Chen W. Zhao F. Zhang K. Maeda B. Huang S. Shen K. Domen C. Li J. Phys. Chem. C 117 2013 376 382 R. Li, Z. Chen, W. Zhao, F. Zhang, K. Maeda, B. Huang, S. Shen, K. Domen, C. Li, J. Phys. Chem. C, 2013, 117, 376–382. 147 F. Zhang K. Maeda T. Takata K. Domen Chem. Commun. 46 2010 7313 7315 F. Zhang, K. Maeda, T. Takata, K. Domen, Chem. Commun., 2010, 46, 7313–7315. 148 F. Zhang K. Maeda T. Takata T. Hisatomi K. Domen Catal. Today 185 2012 253 258 F. Zhang, K. Maeda, T. Takata, T. Hisatomi, K. Domen, Catal. Today, 2012, 185, 253–258. 149 F. Zhang K. Maeda T. Takata K. Domen J. Catal. 280 2011 1 7 F. Zhang, K. Maeda, T. Takata, K. Domen, J. Catal., 2011, 280, 1–7. 150 G. Ma Y. Kuang D.H.K. Murthy T. Hisatomi J. Seo S. Chen H. Matsuzaki Y. Suzuki M. Katayama T. Minegishi K. Seki A. Furube K. Domen J. Phys. Chem. C 122 2018 13492 13499 G. Ma, Y. Kuang, D. H. K. Murthy, T. Hisatomi, J. Seo, S. Chen, H. Matsuzaki, Y. Suzuki, M. Katayama, T. Minegishi, K. Seki, A. Furube, K. Domen, J. Phys. Chem. C, 2018, 122, 13492–13499. 151 W. Zhao K. Maeda F. Zhang T. Hisatomi K. Domen Phys. Chem. Chem. Phys. 16 2014 12051 12056 W. Zhao, K. Maeda, F. Zhang, T. Hisatomi, K. Domen, Phys. Chem. Chem. Phys., 2014, 16, 12051–12056. 152 L. Lin Y. Ma J.J.M. Vequizo M. Nakabayashi C. Gu X. Tao H. Yoshida Y. Pihosh Y. Nishina A. Yamakata N. Shibata T. Hisatomi T. Takata K. Domen Nat. Commun. 15 2024 397 L. Lin, Y. Ma, J. J. M. Vequizo, M. Nakabayashi, C. Gu, X. Tao, H. Yoshida, Y. Pihosh, Y. Nishina, A. Yamakata, N. Shibata, T. Hisatomi, T. Takata, K. Domen, Nat. Commun., 2024, 15, 397. 153 A. Ishikawa T. Takata T. Matsumura J.N. Kondo M. Hara H. Kobayashi K. Domen J. Phys. Chem. B 108 2004 2637 2642 A. Ishikawa, T. Takata, T. Matsumura, J. N. Kondo, M. Hara, H. Kobayashi, K. Domen, J. Phys. Chem. B, 2004, 108, 2637–2642. 154 G. Ma S. Chen Y. Kuang S. Akiyama T. Hisatomi M. Nakabayashi N. Shibata M. Katayama T. Minegishi K. Domen J. Phys. Chem. Lett. 7 2016 3892 3896 G. Ma, S. Chen, Y. Kuang, S. Akiyama, T. Hisatomi, M. Nakabayashi, N. Shibata, M. Katayama, T. Minegishi, K. Domen, J. Phys. Chem. Lett., 2016, 7, 3892–3896. 155 L. Lin M. Nakabayashi D. Lu T. Hisatomi T. Takata K. Domen Chem. Mater. 36 2024 1612 1620 L. Lin, M. Nakabayashi, D. Lu, T. Hisatomi, T. Takata, K. Domen, Chem. Mater., 2024, 36, 1612–1620. 156 M. Nakabayashi K. Nishiguchi X. Liang T. Hisatomi T. Takata T. Tsuchimochi N. Shibata K. Domen S.L. Ten-no J. Phys. Chem. C 127 2023 7887 7893 M. Nakabayashi, K. Nishiguchi, X. Liang, T. Hisatomi, T. Takata, T. Tsuchimochi, N. Shibata, K. Domen, S. L. Ten-no, J. Phys. Chem. C, 2023, 127, 7887–7893. 157 J. Zhang K. Liu B. Zhang J. Zhang M. Liu Y. Xu K. Shi H. Wang Z. Zhang P. Zhou G. Ma J. Am. Chem. Soc. 146 2024 4068 4077 J. Zhang, K. Liu, B. Zhang, J. Zhang, M. Liu, Y. Xu, K. Shi, H. Wang, Z. Zhang, P. Zhou, G. Ma, J. Am. Chem. Soc., 2024, 146, 4068–4077. 158 V. Meignen L. Cario A. Lafond Y. Moëlo C. Guillot-Deudon A. Meerschaut J. Solid State Chem. 177 2004 2810 2817 V. Meignen, L. Cario, A. Lafond, Y. Moëlo, C. Guillot-Deudon, A. Meerschaut, J. Solid State Chem., 2004, 177, 2810–2817. 159 T. Suzuki T. Hisatomi K. Teramura Y. Shimodaira H. Kobayashi K. Domen Phys. Chem. Chem. Phys. 14 2012 15475 15481 T. Suzuki, T. Hisatomi, K. Teramura, Y. Shimodaira, H. Kobayashi, K. Domen, Phys. Chem. Chem. Phys., 2012, 14, 15475–15481. 160 G. Ma J. Liu T. Hisatomi T. Minegishi Y. Moriya M. Iwase H. Nishiyama M. Katayama T. Yamada K. Domen Chem. Commun. 51 2015 4302 4305 G. Ma, J. Liu, T. Hisatomi, T. Minegishi, Y. Moriya, M. Iwase, H. Nishiyama, M. Katayama, T. Yamada, K. Domen, Chem. Commun., 2015, 51, 4302–4305. 161 Z. Song T. Hisatomi S. Chen Q. Wang G. Ma S. Li X. Zhu S. Sun K. Domen ChemSusChem 12 2019 1906 1910 Z. Song, T. Hisatomi, S. Chen, Q. Wang, G. Ma, S. Li, X. Zhu, S. Sun, K. Domen, ChemSusChem, 2019, 12, 1906–1910. 162 Q. Xiao J. Xiao J.J.M. Vequizo T. Hisatomi M. Nakabayashi S. Chen Z. Pan L. Lin N. Shibata A. Yamakata T. Takata K. Domen J. Mater. Chem. A 9 2021 27485 27492 Q. Xiao, J. Xiao, J. J. M. Vequizo, T. Hisatomi, M. Nakabayashi, S. Chen, Z. Pan, L. Lin, N. Shibata, A. Yamakata, T. Takata, K. Domen, J. Mater. Chem. A, 2021, 9, 27485–27492. 163 S. Sun T. Hisatomi Q. Wang S. Chen G. Ma J. Liu S. Nandy T. Minegishi M. Katayama K. Domen ACS Catal. 8 2018 1690 1696 S. Sun, T. Hisatomi, Q. Wang, S. Chen, G. Ma, J. Liu, S. Nandy, T. Minegishi, M. Katayama, K. Domen, ACS Catal., 2018, 8, 1690–1696. 164 S. Nandy T. Hisatomi M. Nakabayashi H. Li X. Wang N. Shibata T. Takata K. Domen Joule 7 2023 1641 1651 S. Nandy, T. Hisatomi, M. Nakabayashi, H. Li, X. Wang, N. Shibata, T. Takata, K. Domen, Joule, 2023, 7, 1641–1651. 165 S. Chen S. Nandy J.J.M. Vequizo T. Hisatomi M. Nakabayashi Z. Pan Q. Xiao Z. Wang L. Lin S. Sun K. Kato A. Yamakata N. Shibata T. Takata F. Zhang K. Domen ACS Catal. 13 2023 3285 3294 S. Chen, S. Nandy, J. J. M. Vequizo, T. Hisatomi, M. Nakabayashi, Z. Pan, Q. Xiao, Z. Wang, L. Lin, S. Sun, K. Kato, A. Yamakata, N. Shibata, T. Takata, F. Zhang, K. Domen, ACS Catal., 2023, 13, 3285–3294. 166 M. Katayama D. Yokoyama Y. Maeda Y. Ozaki M. Tabata Y. Matsumoto A. Ishikawa J. Kubota K. Domen Mater. Sci. Eng. B 173 2010 275 278 M. Katayama, D. Yokoyama, Y. Maeda, Y. Ozaki, M. Tabata, Y. Matsumoto, A. Ishikawa, J. Kubota, K. Domen, Mater. Sci. Eng. B, 2010, 173, 275–278. 167 J. Liu T. Hisatomi G. Ma A. Iwanaga T. Minegishi Y. Moriya M. Katayama J. Kubota K. Domen Energy Environ. Sci. 7 2014 2239 2242 J. Liu, T. Hisatomi, G. Ma, A. Iwanaga, T. Minegishi, Y. Moriya, M. Katayama, J. Kubota, K. Domen, Energy Environ. Sci., 2014, 7, 2239–2242. 168 G. Ma Y. Suzuki R.B. Singh A. Iwanaga Y. Moriya T. Minegishi J. Liu T. Hisatomi H. Nishiyama M. Katayama K. Seki A. Furube T. Yamada K. Domen Chem. Sci. 6 2015 4513 4518 G. Ma, Y. Suzuki, R. B. Singh, A. Iwanaga, Y. Moriya, T. Minegishi, J. Liu, T. Hisatomi, H. Nishiyama, M. Katayama, K. Seki, A. Furube, T. Yamada, K. Domen, Chem. Sci., 2015, 6, 4513–4518. 169 J. Liu T. Hisatomi M. Katayama T. Minegishi J. Kubota K. Domen J. Mater. Chem. A 4 2016 4848 4854 J. Liu, T. Hisatomi, M. Katayama, T. Minegishi, J. Kubota, K. Domen, J. Mater. Chem. A, 2016, 4, 4848–4854. 170 B. Kraeutler A.J. Bard J. Am. Chem. Soc. 100 1978 4317 4318 B. Kraeutler, A. J. Bard, J. Am. Chem. Soc., 1978, 100, 4317–4318. 171 K. Maeda M. Higashi D. Lu R. Abe K. Domen J. Am. Chem. Soc. 132 2010 5858 5868 K. Maeda, M. Higashi, D. Lu, R. Abe, K. Domen, J. Am. Chem. Soc., 2010, 132, 5858–5868. 172 N. Zhou V. López-Puente Q. Wang L. Polavarapu I. Pastoriza-Santos Q.-H. Xu RSC Adv. 5 2015 29076 29097 N. Zhou, V. López-Puente, Q. Wang, L. Polavarapu, I. Pastoriza-Santos, Q.-H. Xu, RSC Adv., 2015, 5, 29076–29097. 173 H. Yoshida Z. Pan R. Shoji V. Nandal H. Matsuzaki K. Seki L. Lin M. Kaneko T. Fukui K. Yamashita T. Takata T. Hisatomi K. Domen Angew. Chem. Int. Ed. 62 2023 e202312938 H. Yoshida, Z. Pan, R. Shoji, V. Nandal, H. Matsuzaki, K. Seki, L. Lin, M. Kaneko, T. Fukui, K. Yamashita, T. Takata, T. Hisatomi, K. Domen, Angew. Chem. Int. Ed., 2023, 62, e202312938. 174 Z. Pan Q. Xiao S. Chen Z. Wang L. Lin M. Nakabayashi N. Shibata T. Takata T. Hisatomi K. Domen J. Catal. 399 2021 230 236 Z. Pan, Q. Xiao, S. Chen, Z. Wang, L. Lin, M. Nakabayashi, N. Shibata, T. Takata, T. Hisatomi, K. Domen, J. Catal., 2021, 399, 230–236. 175 R.L. Grimm M.J. Bierman L.E. O’Leary N.C. Strandwitz B.S. Brunschwig N.S. Lewis J. Phys. Chem. C 116 2012 23569 23576 R. L. Grimm, M. J. Bierman, L. E. O’Leary, N. C. Strandwitz, B. S. Brunschwig, N. S. Lewis, J. Phys. Chem. C, 2012, 116, 23569–23576. 176 D. Li J. Shi C. Li Small 14 2018 1704179 D. Li, J. Shi, C. Li, Small, 2018, 14, 1704179. 177 Z. Pan J.A. Röhr Z. Ye Z.S. Fishman Q. Zhu X. Shen S. Hu Sustainable Energy Fuels 3 2019 850 864 Z. Pan, J. A. Röhr, Z. Ye, Z. S. Fishman, Q. Zhu, X. Shen, S. Hu, Sustainable Energy Fuels, 2019, 3, 850–864. 178 M. Yoshida K. Takanabe K. Maeda A. Ishikawa J. Kubota Y. Sakata Y. Ikezawa K. Domen J. Phys. Chem. C 113 2009 10151 10157 M. Yoshida, K. Takanabe, K. Maeda, A. Ishikawa, J. Kubota, Y. Sakata, Y. Ikezawa, K. Domen, J. Phys. Chem. C, 2009, 113, 10151–10157. 179 F.A. Chowdhury M.L. Trudeau H. Guo Z. Mi Nat. Commun. 9 2018 1707 F. A. Chowdhury, M. L. Trudeau, H. Guo, Z. Mi, Nat. Commun., 2018, 9, 1707. 180 S.S.K. Ma K. Maeda R. Abe K. Domen Energy Environ. Sci. 5 2012 8390 S. S. K. Ma, K. Maeda, R. Abe, K. Domen, Energy Environ. Sci., 2012, 5, 8390. 181 R. Chen F. Fan T. Dittrich C. Li Chem. Soc. Rev. 47 2018 8238 8262 R. Chen, F. Fan, T. Dittrich, C. Li, Chem. Soc. Rev., 2018, 47, 8238–8262. 182 L. Mu Y. Zhao A. Li S. Wang Z. Wang J. Yang Y. Wang T. Liu R. Chen J. Zhu F. Fan R. Li C. Li Energy Environ. Sci. 9 2016 2463 2469 L. Mu, Y. Zhao, A. Li, S. Wang, Z. Wang, J. Yang, Y. Wang, T. Liu, R. Chen, J. Zhu, F. Fan, R. Li, C. Li, Energy Environ. Sci., 2016, 9, 2463–2469. 183 G. Liu J.C. Yu G.Q.M. Lu H.-M. Cheng Chem. Commun. 47 2011 6763 G. Liu, J. C. Yu, G. Q. M. Lu, H.-M. Cheng, Chem. Commun., 2011, 47, 6763. 184 J. Pan G. Liu G.Q.M. Lu H.M. Cheng Angew. Chem. Int. Ed. 50 2011 2133 2137 J. Pan, G. Liu, G. Q. M. Lu, H. M. Cheng, Angew. Chem. Int. Ed., 2011, 50, 2133–2137. 185 H. Kato A. Kudo J. Phys. Chem. B 105 2001 4285 4292 H. Kato, A. Kudo, J. Phys. Chem. B, 2001, 105, 4285–4292. 186 T. Ishihara H. Nishiguchi K. Fukamachi Y. Takita J. Phys. Chem. B 103 1999 1 3 T. Ishihara, H. Nishiguchi, K. Fukamachi, Y. Takita, J. Phys. Chem. B, 1999, 103, 1–3. 187 E. Müller Zeitschrift für Elektrochemie 5 1899 469 473 E. Müller, Zeitschrift für Elektrochemie, 1899, 5, 469–473. 188 B. Endrődi N. Simic M. Wildlock A. Cornell Electrochim. Acta 234 2017 108 122 B. Endrődi, N. Simic, M. Wildlock, A. Cornell, Electrochim. Acta, 2017, 234, 108–122. 189 M. Qureshi T. Shinagawa N. Tsiapis K. Takanabe ACS Sustain. Chem. Eng. 5 2017 8079 8088 M. Qureshi, T. Shinagawa, N. Tsiapis, K. Takanabe, ACS Sustain. Chem. Eng., 2017, 5, 8079–8088. 190 M.R. Hoffmann S.T. Martin W. Choi D.W. Bahnemann Chem. Rev. 95 1995 69 96 M. R. Hoffmann, S. T. Martin, W. Choi, D. W. Bahnemann, Chem. Rev., 1995, 95, 69–96. 191 T. Takata C. Pan M. Nakabayashi N. Shibata K. Domen J. Am. Chem. Soc. 137 2015 9627 9634 T. Takata, C. Pan, M. Nakabayashi, N. Shibata, K. Domen, J. Am. Chem. Soc., 2015, 137, 9627–9634. 192 K. Maeda K. Teramura N. Saito Y. Inoue K. Domen J. Catal. 243 2006 303 308 K. Maeda, K. Teramura, N. Saito, Y. Inoue, K. Domen, J. Catal., 2006, 243, 303–308. 193 R. Godin T. Hisatomi K. Domen J.R. Durrant Chem. Sci. 9 2018 7546 7555 R. Godin, T. Hisatomi, K. Domen, J. R. Durrant, Chem. Sci., 2018, 9, 7546–7555. 194 K. Maeda K. Teramura H. Masuda T. Takata N. Saito Y. Inoue K. Domen J. Phys. Chem. B 110 2006 13107 13112 K. Maeda, K. Teramura, H. Masuda, T. Takata, N. Saito, Y. Inoue, K. Domen, J. Phys. Chem. B, 2006, 110, 13107–13112. 195 A. Nakamura O. Tomita M. Higashi S. Hosokawa T. Tanaka R. Abe Chem. Lett. 44 2015 1001 1003 A. Nakamura, O. Tomita, M. Higashi, S. Hosokawa, T. Tanaka, R. Abe, Chem. Lett., 2015, 44, 1001–1003. 196 Q. Wang K. Domen Chem. Rev. 120 2020 919 985 Q. Wang, K. Domen, Chem. Rev., 2020, 120, 919–985. 197 R. Abe Bull. Chem. Soc. Jpn. 84 2011 1000 1030 R. Abe, Bull. Chem. Soc. Jpn., 2011, 84, 1000–1030. 198 Y. Wang H. Suzuki J. Xie O. Tomita D.J. Martin M. Higashi D. Kong R. Abe J. Tang Chem. Rev. 118 2018 5201 5241 Y. Wang, H. Suzuki, J. Xie, O. Tomita, D. J. Martin, M. Higashi, D. Kong, R. Abe, J. Tang, Chem. Rev., 2018, 118, 5201–5241. 199 A. Kudo MRS Bull. 36 2011 32 38 A. Kudo, MRS Bull., 2011, 36, 32–38. 200 A.J. Bard J. Photochem. 10 1979 59 75 A. J. Bard, J. Photochem., 1979, 10, 59–75. 201 K. Sayama R. Yoshida H. Kusama K. Okabe Y. Abe H. Arakawa Chem. Phys. Lett. 277 1997 387 391 K. Sayama, R. Yoshida, H. Kusama, K. Okabe, Y. Abe, H. Arakawa, Chem. Phys. Lett., 1997, 277, 387–391. 202 K. Sayama K. Mukasa R. Abe Y. Abe H. Arakawa Chem. Commun. 2001 2416 2417 K. Sayama, K. Mukasa, R. Abe, Y. Abe, H. Arakawa, Chem. Commun., 2001, 2416–2417. 203 R. Abe K. Sayama K. Domen H. Arakawa Chem. Phys. Lett. 344 2001 339 344 R. Abe, K. Sayama, K. Domen, H. Arakawa, Chem. Phys. Lett., 2001, 344, 339–344. 204 R. Abe K. Sayama H. Sugihara J. Phys. Chem. B 109 2005 16052 16061 R. Abe, K. Sayama, H. Sugihara, J. Phys. Chem. B, 2005, 109, 16052–16061. 205 T. Ohno D. Haga K. Fujihara K. Kaizaki M. Matsumura J. Phys. Chem. B 101 1997 6415 6419 T. Ohno, D. Haga, K. Fujihara, K. Kaizaki, M. Matsumura, J. Phys. Chem. B, 1997, 101, 6415–6419. 206 R. Abe T. Takata H. Sugihara K. Domen Chem. Commun. 2005 3829 3831 R. Abe, T. Takata, H. Sugihara, K. Domen, Chem. Commun., 2005, 3829–3831. 207 R. Abe M. Higashi K. Domen ChemSusChem 4 2011 228 237 R. Abe, M. Higashi, K. Domen, ChemSusChem, 2011, 4, 228–237. 208 M. Higashi R. Abe A. Ishikawa T. Takata B. Ohtani K. Domen Chem. Lett. 37 2007 138 139 M. Higashi, R. Abe, A. Ishikawa, T. Takata, B. Ohtani, K. Domen, Chem. Lett., 2007, 37, 138–139. 209 Y. Sasaki H. Nemoto K. Saito A. Kudo J. Phys. Chem. C 113 2009 17536 17542 Y. Sasaki, H. Nemoto, K. Saito, A. Kudo, J. Phys. Chem. C, 2009, 113, 17536–17542. 210 A. Iwase Y.H. Ng Y. Ishiguro A. Kudo R. Amal J. Am. Chem. Soc. 133 2011 11054 11057 A. Iwase, Y. H. Ng, Y. Ishiguro, A. Kudo, R. Amal, J. Am. Chem. Soc., 2011, 133, 11054–11057. 211 L. Lin Y. Ma N. Zettsu J.J.M. Vequizo C. Gu A. Yamakata T. Hisatomi T. Takata K. Domen J. Am. Chem. Soc. 146 2024 14829 14834 L. Lin, Y. Ma, N. Zettsu, J. J. M. Vequizo, C. Gu, A. Yamakata, T. Hisatomi, T. Takata, K. Domen, J. Am. Chem. Soc., 2024, 146, 14829–14834. 212 Z. Pan T. Hisatomi Q. Wang S. Chen M. Nakabayashi N. Shibata C. Pan T. Takata M. Katayama T. Minegishi A. Kudo K. Domen ACS Catal. 6 2016 7188 7196 Z. Pan, T. Hisatomi, Q. Wang, S. Chen, M. Nakabayashi, N. Shibata, C. Pan, T. Takata, M. Katayama, T. Minegishi, A. Kudo, K. Domen, ACS Catal., 2016, 6, 7188–7196. 213 Q. Wang Y. Li T. Hisatomi M. Nakabayashi N. Shibata J. Kubota K. Domen J. Catal. 328 2015 308 315 Q. Wang, Y. Li, T. Hisatomi, M. Nakabayashi, N. Shibata, J. Kubota, K. Domen, J. Catal., 2015, 328, 308–315. 214 Q. Wang T. Hisatomi Y. Suzuki Z. Pan J. Seo M. Katayama T. Minegishi H. Nishiyama T. Takata K. Seki A. Kudo T. Yamada K. Domen J. Am. Chem. Soc. 139 2017 1675 1683 Q. Wang, T. Hisatomi, Y. Suzuki, Z. Pan, J. Seo, M. Katayama, T. Minegishi, H. Nishiyama, T. Takata, K. Seki, A. Kudo, T. Yamada, K. Domen, J. Am. Chem. Soc., 2017, 139, 1675–1683. 215 Q. Wang S. Okunaka H. Tokudome T. Hisatomi M. Nakabayashi N. Shibata T. Yamada K. Domen Joule 2 2018 2667 2680 Q. Wang, S. Okunaka, H. Tokudome, T. Hisatomi, M. Nakabayashi, N. Shibata, T. Yamada, K. Domen, Joule, 2018, 2, 2667–2680. 216 S. Chen J.J.M. Vequizo Z. Pan T. Hisatomi M. Nakabayashi L. Lin Z. Wang K. Kato A. Yamakata N. Shibata T. Takata T. Yamada K. Domen J. Am. Chem. Soc. 143 2021 10633 10641 S. Chen, J. J. M. Vequizo, Z. Pan, T. Hisatomi, M. Nakabayashi, L. Lin, Z. Wang, K. Kato, A. Yamakata, N. Shibata, T. Takata, T. Yamada, K. Domen, J. Am. Chem. Soc., 2021, 143, 10633–10641. 217 A. Ishikawa Y. Yamada T. Takata J.N. Kondo M. Hara H. Kobayashi K. Domen Chem. Mater. 15 2003 4442 4446 A. Ishikawa, Y. Yamada, T. Takata, J. N. Kondo, M. Hara, H. Kobayashi, K. Domen, Chem. Mater., 2003, 15, 4442–4446. 218 Z. Pan H. Yoshida L. Lin Q. Xiao M. Nakabayashi N. Shibata T. Takata T. Hisatomi K. Domen Res. Chem. Intermed. 47 2021 225 234 Z. Pan, H. Yoshida, L. Lin, Q. Xiao, M. Nakabayashi, N. Shibata, T. Takata, T. Hisatomi, K. Domen, Res. Chem. Intermed., 2021, 47, 225–234. 219 L. Lin P. Kaewdee V. Nandal R. Shoji H. Matsuzaki K. Seki M. Nakabayashi N. Shibata X. Tao X. Liang Y. Ma T. Hisatomi T. Takata K. Domen Angew. Chem. Int. Ed. 62 2023 e202310607 L. Lin, P. Kaewdee, V. Nandal, R. Shoji, H. Matsuzaki, K. Seki, M. Nakabayashi, N. Shibata, X. Tao, X. Liang, Y. Ma, T. Hisatomi, T. Takata, K. Domen, Angew. Chem. Int. Ed., 2023, 62, e202310607. 220 Y. Noda B. Lee K. Domen J.N. Kondo Chem. Mater. 20 2008 5361 5367 Y. Noda, B. Lee, K. Domen, J. N. Kondo, Chem. Mater., 2008, 20, 5361–5367. 221 D. Wang T. Hisatomi T. Takata C. Pan M. Katayama J. Kubota K. Domen Angew. Chem. Int. Ed. 52 2013 11252 11256 D. Wang, T. Hisatomi, T. Takata, C. Pan, M. Katayama, J. Kubota, K. Domen, Angew. Chem. Int. Ed., 2013, 52, 11252–11256. 222 Q. Wang T. Hisatomi S.S.K. Ma Y. Li K. Domen Chem. Mater. 26 2014 4144 4150 Q. Wang, T. Hisatomi, S. S. K. Ma, Y. Li, K. Domen, Chem. Mater., 2014, 26, 4144–4150. 223 Z. Pan T. Hisatomi Q. Wang M. Nakabayashi N. Shibata C. Pan T. Takata K. Domen Appl. Catal. A 521 2016 26 33 Z. Pan, T. Hisatomi, Q. Wang, M. Nakabayashi, N. Shibata, C. Pan, T. Takata, K. Domen, Appl. Catal. A, 2016, 521, 26–33. 224 Z. Pan J.J.M. Vequizo H. Yoshida J. Li X. Zheng C. Chu Q. Wang M. Cai S. Sun K. Katayama A. Yamakata K. Domen Angew. Chem. Int. Ed. 2024 e202414628 Z. Pan, J. J. M. Vequizo, H. Yoshida, J. Li, X. Zheng, C. Chu, Q. Wang, M. Cai, S. Sun, K. Katayama, A. Yamakata, K. Domen, Angew. Chem. Int. Ed., 2024, e202414628. 225 M. Kakihana K. Domen MRS Bull. 25 2000 27 31 M. Kakihana, K. Domen, MRS Bull., 2000, 25, 27–31. 226 M. Kakihana J. Ceram. Soc. Jpn. 117 2009 857 862 M. Kakihana, J. Ceram. Soc. Jpn., 2009, 117, 857–862. 227 K. Iwashina A. Kudo J. Am. Chem. Soc. 133 2011 13272 13275 K. Iwashina, A. Kudo, J. Am. Chem. Soc., 2011, 133, 13272–13275. 228 S. Ito P. Chen P. Comte M.K. Nazeeruddin P. Liska P. Péchy M. Grätzel Prog. Photovolt. 15 2007 603 612 S. Ito, P. Chen, P. Comte, M. K. Nazeeruddin, P. Liska, P. Péchy, M. Grätzel, Prog. Photovolt., 2007, 15, 603–612. 229 S.-Q. Fan C.-J. Li G.-J. Yang L.-Z. Zhang J.-C. Gao Y.-X. Xi J. Therm. Spray Technol. 16 2007 893 897 S.-Q. Fan, C.-J. Li, G.-J. Yang, L.-Z. Zhang, J.-C. Gao, Y.-X. Xi, J. Therm. Spray Technol., 2007, 16, 893–897. 230 M. Higashi K. Domen R. Abe J. Am. Chem. Soc. 134 2012 6968 6971 M. Higashi, K. Domen, R. Abe, J. Am. Chem. Soc., 2012, 134, 6968–6971. 231 K. Maeda M. Higashi B. Siritanaratkul R. Abe K. Domen J. Am. Chem. Soc. 133 2011 12334 12337 K. Maeda, M. Higashi, B. Siritanaratkul, R. Abe, K. Domen, J. Am. Chem. Soc., 2011, 133, 12334–12337. 232 R. Abe T. Takata H. Sugihara K. Domen Chem. Lett. 34 2005 1162 1163 R. Abe, T. Takata, H. Sugihara, K. Domen, Chem. Lett., 2005, 34, 1162–1163. 233 M. Higashi K. Domen R. Abe Energy Environ. Sci. 4 2011 4138 4147 M. Higashi, K. Domen, R. Abe, Energy Environ. Sci., 2011, 4, 4138–4147. 234 T. Minegishi N. Nishimura J. Kubota K. Domen Chem. Sci. 4 2013 1120 1124 T. Minegishi, N. Nishimura, J. Kubota, K. Domen, Chem. Sci., 2013, 4, 1120–1124. 235 S.C. Warren K. Voitchovsky H. Dotan C.M. Leroy M. Cornuz F. Stellacci C. Hebert A. Rothschild M. Gratzel Nat. Mater. 12 2013 842 849 S. C. Warren, K. Voitchovsky, H. Dotan, C. M. Leroy, M. Cornuz, F. Stellacci, C. Hebert, A. Rothschild, M. Gratzel, Nat. Mater., 2013, 12, 842–849. 236 K. Ueda T. Minegishi J. Clune M. Nakabayashi T. Hisatomi H. Nishiyama M. Katayama N. Shibata J. Kubota T. Yamada K. Domen J. Am. Chem. Soc. 137 2015 2227 2230 K. Ueda, T. Minegishi, J. Clune, M. Nakabayashi, T. Hisatomi, H. Nishiyama, M. Katayama, N. Shibata, J. Kubota, T. Yamada, K. Domen, J. Am. Chem. Soc., 2015, 137, 2227–2230. 237 M. Higashi K. Domen R. Abe J. Am. Chem. Soc. 135 2013 10238 10241 M. Higashi, K. Domen, R. Abe, J. Am. Chem. Soc., 2013, 135, 10238–10241. 238 M. Zhong T. Hisatomi Y. Kuang J. Zhao M. Liu A. Iwase Q. Jia H. Nishiyama T. Minegishi M. Nakabayashi N. Shibata R. Niishiro C. Katayama H. Shibano M. Katayama A. Kudo T. Yamada K. Domen J. Am. Chem. Soc. 137 2015 5053 5060 M. Zhong, T. Hisatomi, Y. Kuang, J. Zhao, M. Liu, A. Iwase, Q. Jia, H. Nishiyama, T. Minegishi, M. Nakabayashi, N. Shibata, R. Niishiro, C. Katayama, H. Shibano, M. Katayama, A. Kudo, T. Yamada, K. Domen, J. Am. Chem. Soc., 2015, 137, 5053–5060. 239 M. Zhong T. Hisatomi T. Minegishi H. Nishiyama M. Katayama T. Yamada K. Domen J. Mater. Chem. A 4 2016 9858 9864 M. Zhong, T. Hisatomi, T. Minegishi, H. Nishiyama, M. Katayama, T. Yamada, K. Domen, J. Mater. Chem. A, 2016, 4, 9858–9864. 240 Y. Li T. Takata D. Cha K. Takanabe T. Minegishi J. Kubota K. Domen Adv. Mater. 25 2013 125 131 Y. Li, T. Takata, D. Cha, K. Takanabe, T. Minegishi, J. Kubota, K. Domen, Adv. Mater., 2013, 25, 125–131. 241 B.A. Pinaud A. Vailionis T.F. Jaramillo Chem. Mater. 26 2014 1576 1582 B. A. Pinaud, A. Vailionis, T. F. Jaramillo, Chem. Mater., 2014, 26, 1576–1582. 242 G. Liu S. Ye P. Yan F. Xiong P. Fu Z. Wang Z. Chen J. Shi C. Li Energy Environ. Sci. 9 2016 1327 1334 G. Liu, S. Ye, P. Yan, F. Xiong, P. Fu, Z. Wang, Z. Chen, J. Shi, C. Li, Energy Environ. Sci., 2016, 9, 1327–1334. 243 Y. Li L. Zhang A. Torres-Pardo J.M. González-Calbet Y. Ma P. Oleynikov O. Terasaki S. Asahina M. Shima D. Cha L. Zhao K. Takanabe J. Kubota K. Domen Nat. Commun. 4 2013 2566 Y. Li, L. Zhang, A. Torres-Pardo, J. M. González-Calbet, Y. Ma, P. Oleynikov, O. Terasaki, S. Asahina, M. Shima, D. Cha, L. Zhao, K. Takanabe, J. Kubota, K. Domen, Nat. Commun., 2013, 4, 2566. 244 M. Hara E. Chiba A. Ishikawa T. Takata J.N. Kondo K. Domen J. Phys. Chem. B 107 2003 13441 13445 M. Hara, E. Chiba, A. Ishikawa, T. Takata, J. N. Kondo, K. Domen, J. Phys. Chem. B, 2003, 107, 13441–13445. 245 C. Wang T. Hisatomi T. Minegishi M. Nakabayashi N. Shibata M. Katayama K. Domen Chem. Sci. 7 2016 5821 5826 C. Wang, T. Hisatomi, T. Minegishi, M. Nakabayashi, N. Shibata, M. Katayama, K. Domen, Chem. Sci., 2016, 7, 5821–5826. 246 C. Wang T. Hisatomi T. Minegishi M. Nakabayashi N. Shibata M. Katayama K. Domen J. Mater. Chem. A 4 2016 13837 13843 C. Wang, T. Hisatomi, T. Minegishi, M. Nakabayashi, N. Shibata, M. Katayama, K. Domen, J. Mater. Chem. A, 2016, 4, 13837–13843. 247 X. Xiao M. Iwase G. Yin M. Nakabayashi T. Higashi N. Shibata K. Domen T. Watanabe ACS Sustainable Chem. Eng. 7 2019 19407 19414 X. Xiao, M. Iwase, G. Yin, M. Nakabayashi, T. Higashi, N. Shibata, K. Domen, T. Watanabe, ACS Sustainable Chem. Eng., 2019, 7, 19407–19414. 248 Z. Wang Y. Qi C. Ding D. Fan G. Liu Y. Zhao C. Li Chem. Sci. 7 2016 4391 4399 Z. Wang, Y. Qi, C. Ding, D. Fan, G. Liu, Y. Zhao, C. Li, Chem. Sci., 2016, 7, 4391–4399. 249 Q. Jia A. Iwase A. Kudo Chem. Sci. 5 2014 1513 1519 Q. Jia, A. Iwase, A. Kudo, Chem. Sci., 2014, 5, 1513–1519. 250 M. Ebihara T. Ikeda S. Okunaka H. Tokudome K. Domen K. Katayama Nat. Commun. 12 2021 3716 M. Ebihara, T. Ikeda, S. Okunaka, H. Tokudome, K. Domen, K. Katayama, Nat. Commun., 2021, 12, 3716. 251 Q. Wang T. Hisatomi M. Katayama T. Takata T. Minegishi A. Kudo T. Yamada K. Domen Faraday Discuss. 197 2017 491 504 Q. Wang, T. Hisatomi, M. Katayama, T. Takata, T. Minegishi, A. Kudo, T. Yamada, K. Domen, Faraday Discuss., 2017, 197, 491–504. 252 Q. Wang S. Kalathil C. Pornrungroj C.D. Sahm E. Reisner Nat. Catal. 5 2022 633 641 Q. Wang, S. Kalathil, C. Pornrungroj, C. D. Sahm, E. Reisner, Nat. Catal., 2022, 5, 633–641. 253 Z. Pan T. Hisatomi Q. Wang S. Chen A. Iwase M. Nakabayashi N. Shibata T. Takata M. Katayama T. Minegishi A. Kudo K. Domen Adv. Funct. Mater. 26 2016 7011 7019 Z. Pan, T. Hisatomi, Q. Wang, S. Chen, A. Iwase, M. Nakabayashi, N. Shibata, T. Takata, M. Katayama, T. Minegishi, A. Kudo, K. Domen, Adv. Funct. Mater., 2016, 26, 7011–7019. 254 V. Andrei Q. Wang T. Uekert S. Bhattacharjee E. Reisner Acc. Chem. Res. 55 2022 3376 3386 V. Andrei, Q. Wang, T. Uekert, S. Bhattacharjee, E. Reisner, Acc. Chem. Res., 2022, 55, 3376–3386. 255 B.A. Pinaud J.D. Benck L.C. Seitz A.J. Forman Z. Chen T.G. Deutsch B.D. James K.N. Baum G.N. Baum S. Ardo H. Wang E. Miller T.F. Jaramillo Energy Environ. Sci. 6 2013 1983 B. A. Pinaud, J. D. Benck, L. C. Seitz, A. J. Forman, Z. Chen, T. G. Deutsch, B. D. James, K. N. Baum, G. N. Baum, S. Ardo, H. Wang, E. Miller, T. F. Jaramillo, Energy Environ. Sci., 2013, 6, 1983. 256 R.P. Eischens W.A. Pliskin Adv. Catal. 10 1958 1 56 R. P. Eischens, W. A. Pliskin, Adv. Catal., 1958, 10, 1–56. 257 L.H. Little H.W. Salzberg J. Electrochem. Soc. 114 1967 279C L. H. Little, H. W. Salzberg, J. Electrochem. Soc., 1967, 114, 279C. 258 K.-i. Maruya T. Maehashi T. Haraoka S. Narui Y. Asakawa K. Domen T. Onishi Bull. Chem. Soc. Jpn. 61 2006 667 671 K.-i. Maruya, T. Maehashi, T. Haraoka, S. Narui, Y. Asakawa, K. Domen, T. Onishi, Bull. Chem. Soc. Jpn., 2006, 61, 667–671. 259 T. Arai K.-I. Maruya K. Domen T. Onishi Bull. Chem. Soc. Jpn. 62 2006 349 353 T. Arai, K.-I. Maruya, K. Domen, T. Onishi, Bull. Chem. Soc. Jpn., 2006, 62, 349–353. 260 C. Li Y. Sakata T. Arai K. Domen K.-i. Maruya T. Onishi J. Chem. Soc., Faraday Trans. 1 85 1989 1451 1461 C. Li, Y. Sakata, T. Arai, K. Domen, K.-i. Maruya, T. Onishi, J. Chem. Soc., Faraday Trans. 1, 1989, 85, 1451–1461. 261 C. Li Y. Sakata T. Arai K. Domen K.-i. Maruya T. Onishi J. Chem. Soc., Faraday Trans. 1 85 1989 929 943 C. Li, Y. Sakata, T. Arai, K. Domen, K.-i. Maruya, T. Onishi, J. Chem. Soc., Faraday Trans. 1, 1989, 85, 929–943. 262 N. Kinoshita K. Kido K. Domen K.-i. Aika T. Onishi J. Chem. Soc., Faraday Trans. 1 82 1986 2269 2276 N. Kinoshita, K. Kido, K. Domen, K.-i. Aika, T. Onishi, J. Chem. Soc., Faraday Trans. 1, 1986, 82, 2269–2276. 263 Y. Sakata N. Kinoshita K. Domen T. Onishi J. Chem. Soc., Faraday Trans. 1 83 1987 2765 2772 Y. Sakata, N. Kinoshita, K. Domen, T. Onishi, J. Chem. Soc., Faraday Trans. 1, 1987, 83, 2765–2772. 264 Y. Sakata H. Abe J. Kondo K.-I. Maruya K. Domen T. Onishi Chem. Lett. 1989 711 714 Y. Sakata, H. Abe, J. Kondo, K.-I. Maruya, K. Domen, T. Onishi, Chem. Lett., 1989, 711–714. 265 F. Wakabayashi J. Kondo A. Wada K. Domen C. Hirose J. Phys. Chem. 97 1993 10761 10768 F. Wakabayashi, J. Kondo, A. Wada, K. Domen, C. Hirose, J. Phys. Chem., 1993, 97, 10761–10768. 266 F. Wakabayashi J.N. Kondo K. Domen C. Hirose J. Phys. Chem. 99 1995 10573 10580 F. Wakabayashi, J. N. Kondo, K. Domen, C. Hirose, J. Phys. Chem., 1995, 99, 10573–10580. 267 F. Wakabayashi T. Fujino J.N. Kondo K. Domen C. Hirose J. Phys. Chem. 99 1995 14805 14812 F. Wakabayashi, T. Fujino, J. N. Kondo, K. Domen, C. Hirose, J. Phys. Chem., 1995, 99, 14805–14812. 268 F. Wakabayashi J.N. Kondo K. Domen C. Hirose J. Phys. Chem. 100 1996 4154 4159 F. Wakabayashi, J. N. Kondo, K. Domen, C. Hirose, J. Phys. Chem., 1996, 100, 4154–4159. 269 J.N. Kondo K. Ito E. Yoda F. Wakabayashi K. Domen J. Phys. Chem. B 109 2005 10969 10972 J. N. Kondo, K. Ito, E. Yoda, F. Wakabayashi, K. Domen, J. Phys. Chem. B, 2005, 109, 10969–10972. 270 J.N. Kondo D. Nishioka H. Yamazaki J. Kubota K. Domen T. Tatsumi J. Phys. Chem. C 114 2010 20107 20113 J. N. Kondo, D. Nishioka, H. Yamazaki, J. Kubota, K. Domen, T. Tatsumi, J. Phys. Chem. C, 2010, 114, 20107–20113. 271 R.A. van Santen G.J. Kramer Chem. Rev. 95 1995 637 660 R. A. van Santen, G. J. Kramer, Chem. Rev., 1995, 95, 637–660. 272 K. Domen T.J. Chuang J. Am. Chem. Soc. 109 1987 5288 5289 K. Domen, T. J. Chuang, J. Am. Chem. Soc., 1987, 109, 5288–5289. 273 K. Domen T.J. Chuang Phys. Rev. Lett. 59 1987 1484 1487 K. Domen, T. J. Chuang, Phys. Rev. Lett., 1987, 59, 1484–1487. 274 J.Y. Huang Y.R. Shen Phys. Rev. A 49 1994 3973 3981 J. Y. Huang, Y. R. Shen, Phys. Rev. A, 1994, 49, 3973–3981. 275 Y.R. Shen V. Ostroverkhov Chem. Rev. 106 2006 1140 1154 Y. R. Shen, V. Ostroverkhov, Chem. Rev., 2006, 106, 1140–1154. 276 N. Akamatsu K. Domen C. Hirose T. Onishi H. Shimizu K. Masutani Chem. Phys. Lett. 181 1991 175 178 N. Akamatsu, K. Domen, C. Hirose, T. Onishi, H. Shimizu, K. Masutani, Chem. Phys. Lett., 1991, 181, 175–178. 277 H. Yamamoto N. Watanabe A. Wada K. Domen C. Hirose J. Chem. Phys. 106 1997 4734 4744 H. Yamamoto, N. Watanabe, A. Wada, K. Domen, C. Hirose, J. Chem. Phys., 1997, 106, 4734–4744. 278 J. Kubota K. Domen Anal. Bioanal. Chem. 388 2007 17 27 J. Kubota, K. Domen, Anal. Bioanal. Chem., 2007, 388, 17–27. 279 A. Bandara J. Kubota K. Onda A. Wada S.S. Kano K. Domen C. Hirose J. Phys. Chem. B 102 1998 5951 5954 A. Bandara, J. Kubota, K. Onda, A. Wada, S. S. Kano, K. Domen, C. Hirose, J. Phys. Chem. B, 1998, 102, 5951–5954. 280 Y.J. Chabal Surf. Sci. Rep. 8 1988 211 357 Y. J. Chabal, Surf. Sci. Rep., 1988, 8, 211–357. 281 T.J. Chuang Surf. Sci. Rep. 3 1983 1 105 T. J. Chuang, Surf. Sci. Rep., 1983, 3, 1–105. 282 E.J. Heilweil M.P. Casassa R.R. Cavanagh J.C. Stephenson Annu. Rev. Phys. Chem. 40 1989 143 171 E. J. Heilweil, M. P. Casassa, R. R. Cavanagh, J. C. Stephenson, Annu. Rev. Phys. Chem., 1989, 40, 143–171. 283 J. Kubota M. Furuki Y. Goto J. Kondo A. Wada K. Domen C. Hirose Chem. Phys. Lett. 204 1993 273 276 J. Kubota, M. Furuki, Y. Goto, J. Kondo, A. Wada, K. Domen, C. Hirose, Chem. Phys. Lett., 1993, 204, 273–276. 284 T. Fujino M. Furuki M. Kashitani K. Onda J. Kubota J.N. Kondo A. Wada K. Domen C. Hirose F. Wakabayashi M. Ishida F. Goto S.S. Kano J. Chem. Phys. 105 1996 279 288 T. Fujino, M. Furuki, M. Kashitani, K. Onda, J. Kubota, J. N. Kondo, A. Wada, K. Domen, C. Hirose, F. Wakabayashi, M. Ishida, F. Goto, S. S. Kano, J. Chem. Phys., 1996, 105, 279–288. 285 H. Noguchi E. Yoda N. Ishizawa J.N. Kondo A. Wada H. Kobayashi K. Domen J. Phys. Chem. B 109 2005 17217 17223 H. Noguchi, E. Yoda, N. Ishizawa, J. N. Kondo, A. Wada, H. Kobayashi, K. Domen, J. Phys. Chem. B, 2005, 109, 17217–17223. 286 R. Eschenbacher S. Trzeciak C. Schuschke S. Schötz C. Hohner D. Blaumeiser D. Zahn T. Retzer J. Libuda Top. Catal. 66 2023 1202 1216 R. Eschenbacher, S. Trzeciak, C. Schuschke, S. Schötz, C. Hohner, D. Blaumeiser, D. Zahn, T. Retzer, J. Libuda, Top. Catal., 2023, 66, 1202–1216. 287 A. Yamakata J. Kubota J.N. Kondo C. Hirose K. Domen F. Wakabayashi K. Tamaru J. Mol. Catal. A 141 1999 73 82 A. Yamakata, J. Kubota, J. N. Kondo, C. Hirose, K. Domen, F. Wakabayashi, K. Tamaru, J. Mol. Catal. A, 1999, 141, 73–82. 288 M. Endo T. Matsumoto J. Kubota K. Domen C. Hirose J. Phys. Chem. B 105 2001 1573 1577 M. Endo, T. Matsumoto, J. Kubota, K. Domen, C. Hirose, J. Phys. Chem. B, 2001, 105, 1573–1577. 289 J. Kubota T. Ohtani J.N. Kondo C. Hirose K. Domen Appl. Surf. Sci. 121–122 1997 548 551 J. Kubota, T. Ohtani, J. N. Kondo, C. Hirose, K. Domen, Appl. Surf. Sci., 1997, 121–122, 548–551. 290 J. Chen J. Kubota A. Wada J.N. Kondo K. Domen J. Phys. Chem. C 112 2008 12477 12485 J. Chen, J. Kubota, A. Wada, J. N. Kondo, K. Domen, J. Phys. Chem. C, 2008, 112, 12477–12485. 291 M. Schwarz C. Hohner S. Mohr J. Libuda J. Phys. Chem. C 121 2017 28317 28327 M. Schwarz, C. Hohner, S. Mohr, J. Libuda, J. Phys. Chem. C, 2017, 121, 28317–28327. 292 J. Chen J. Kubota A. Wada J.N. Kondo K. Domen J. Am. Chem. Soc. 131 2009 4580 4581 J. Chen, J. Kubota, A. Wada, J. N. Kondo, K. Domen, J. Am. Chem. Soc., 2009, 131, 4580–4581. 293 M. Yoshida A. Yamakata K. Takanabe J. Kubota M. Osawa K. Domen J. Am. Chem. Soc. 131 2009 13218 13219 M. Yoshida, A. Yamakata, K. Takanabe, J. Kubota, M. Osawa, K. Domen, J. Am. Chem. Soc., 2009, 131, 13218–13219. 294 X. Lu A. Bandara M. Katayama A. Yamakata J. Kubota K. Domen J. Phys. Chem. C 115 2011 23902 23907 X. Lu, A. Bandara, M. Katayama, A. Yamakata, J. Kubota, K. Domen, J. Phys. Chem. C, 2011, 115, 23902–23907. 295 G. Samjeské K.I. Komatsu M. Osawa J. Phys. Chem. C 113 2009 10222 10228 G. Samjeské, K.I. Komatsu, M. Osawa, J. Phys. Chem. C, 2009, 113, 10222–10228. 296 A. Yamakata M. Kawaguchi N. Nishimura T. Minegishi J. Kubota K. Domen J. Phys. Chem. C 118 2014 23897 23906 A. Yamakata, M. Kawaguchi, N. Nishimura, T. Minegishi, J. Kubota, K. Domen, J. Phys. Chem. C, 2014, 118, 23897–23906. 297 J.K. Cooper S.E. Reyes-Lillo L.H. Hess C.-M. Jiang J.B. Neaton I.D. Sharp J. Phys. Chem. C 122 2018 20642 20652 J. K. Cooper, S. E. Reyes-Lillo, L. H. Hess, C.-M. Jiang, J. B. Neaton, I. D. Sharp, J. Phys. Chem. C, 2018, 122, 20642–20652. 298 A. Yamakata M. Yoshida J. Kubota M. Osawa K. Domen J. Am. Chem. Soc. 133 2011 11351 11357 A. Yamakata, M. Yoshida, J. Kubota, M. Osawa, K. Domen, J. Am. Chem. Soc., 2011, 133, 11351–11357. 299 A. Yamakata T.-A. Ishibashi H. Kato A. Kudo H. Onishi J. Phys. Chem. B 107 2003 14383 14387 A. Yamakata, T.-A. Ishibashi, H. Kato, A. Kudo, H. Onishi, J. Phys. Chem. B, 2003, 107, 14383–14387. 300 A. Yamakata T.-A. Ishibashi H. Onishi J. Phys. Chem. B 105 2001 7258 7262 A. Yamakata, T.-A. Ishibashi, H. Onishi, J. Phys. Chem. B, 2001, 105, 7258–7262. 301 T. Liu Z. Pan J.J.M. Vequizo K. Kato B. Wu A. Yamakata K. Katayama B. Chen C. Chu K. Domen Nat. Commun. 13 2022 1034 T. Liu, Z. Pan, J. J. M. Vequizo, K. Kato, B. Wu, A. Yamakata, K. Katayama, B. Chen, C. Chu, K. Domen, Nat. Commun., 2022, 13, 1034. 302 Z. Pan V. Nandal Y. Pihosh T. Higashi T. Liu J.A. Röhr K. Seki C. Chu K. Domen K. Katayama ACS Catal. 12 2022 14727 14734 Z. Pan, V. Nandal, Y. Pihosh, T. Higashi, T. Liu, J. A. Röhr, K. Seki, C. Chu, K. Domen, K. Katayama, ACS Catal., 2022, 12, 14727–14734. 303 V. Nandal Y. Suzuki H. Kobayashi K. Domen K. Seki J. Mater. Chem. A 8 2020 9194 9201 V. Nandal, Y. Suzuki, H. Kobayashi, K. Domen, K. Seki, J. Mater. Chem. A, 2020, 8, 9194–9201. 304 Y. Pihosh T. Minegishi V. Nandal T. Higashi M. Katayama T. Yamada Y. Sasaki K. Seki Y. Suzuki M. Nakabayashi M. Sugiyama K. Domen Energy Environ. Sci. 13 2020 1519 1530 Y. Pihosh, T. Minegishi, V. Nandal, T. Higashi, M. Katayama, T. Yamada, Y. Sasaki, K. Seki, Y. Suzuki, M. Nakabayashi, M. Sugiyama, K. Domen, Energy Environ. Sci., 2020, 13, 1519–1530. 305 Y. Pihosh V. Nandal T. Minegishi M. Katayama T. Yamada K. Seki M. Sugiyama K. Domen ACS Energy Lett. 5 2020 2492 2497 Y. Pihosh , V. Nandal, T. Minegishi, M. Katayama, T. Yamada, K. Seki, M. Sugiyama, K. Domen, ACS Energy Lett., 2020, 5, 2492–2497. 306 V. Nandal Y. Pihosh T. Higashi T. Minegishi T. Yamada K. Seki M. Sugiyama K. Domen Energy Environ. Sci. 14 2021 4038 4047 V. Nandal, Y. Pihosh, T. Higashi, T. Minegishi, T. Yamada, K. Seki, M. Sugiyama, K. Domen, Energy Environ. Sci., 2021, 14, 4038–4047. 307 V. Nandal R. Shoji H. Matsuzaki A. Furube L. Lin T. Hisatomi M. Kaneko K. Yamashita K. Domen K. Seki Nat. Commun. 12 2021 7055 V. Nandal, R. Shoji, H. Matsuzaki, A. Furube, L. Lin, T. Hisatomi, M. Kaneko, K. Yamashita, K. Domen, K. Seki, Nat. Commun., 2021, 12, 7055. 308 T. Higashi K. Seki Y. Sasaki Y. Pihosh V. Nandal M. Nakabayashi N. Shibata K. Domen Chem. Eur. J. 29 2023 e202204058 T. Higashi, K. Seki, Y. Sasaki, Y. Pihosh, V. Nandal, M. Nakabayashi, N. Shibata, K. Domen, Chem. Eur. J., 2023, 29, e202204058. 309 D.H.K. Murthy V. Nandal A. Furube K. Seki R. Katoh H. Lyu T. Hisatomi K. Domen H. Matsuzaki Adv. Energy Mater. 13 2023 2302064 D. H. K. Murthy, V. Nandal, A. Furube, K. Seki, R. Katoh, H. Lyu, T. Hisatomi, K. Domen, H. Matsuzaki, Adv. Energy Mater., 2023, 13, 2302064. 310 T. Chugenji Z. Pan V. Nandal K. Seki K. Domen K. Katayama Phys. Chem. Chem. Phys. 24 2022 17485 17495 T. Chugenji, Z. Pan, V. Nandal, K. Seki, K. Domen, K. Katayama, Phys. Chem. Chem. Phys., 2022, 24, 17485–17495. 311 Z. Lei G. Ma M. Liu W. You H. Yan G. Wu T. Takata M. Hara K. Domen C. Li J. Catal. 237 2006 322 329 Z. Lei, G. Ma, M. Liu, W. You, H. Yan, G. Wu, T. Takata, M. Hara, K. Domen, C. Li, J. Catal., 2006, 237, 322–329. 312 M. Liu W. You Z. Lei G. Zhou J. Yang G. Wu G. Ma G. Luan T. Takata M. Hara K. Domen C. Li Chem. Commun. 2004 2192 2193 M. Liu, W. You, Z. Lei, G. Zhou, J. Yang, G. Wu, G. Ma, G. Luan, T. Takata, M. Hara, K. Domen, C. Li, Chem. Commun., 2004, 2192–2193. 313 J.Y. Kim G. Magesh D.H. Youn J.-W. Jang J. Kubota K. Domen J.S. Lee Sci. Rep. 3 2013 2681 J. Y. Kim, G. Magesh, D. H. Youn, J.-W. Jang, J. Kubota, K. Domen, J. S. Lee, Sci. Rep., 2013, 3, 2681. 314 E.S. Kim N. Nishimura G. Magesh J.Y. Kim J.-W. Jang H. Jun J. Kubota K. Domen J.S. Lee J. Am. Chem. Soc. 135 2013 5375 5383 E. S. Kim, N. Nishimura, G. Magesh, J. Y. Kim, J.-W. Jang, H. Jun, J. Kubota, K. Domen, J. S. Lee, J. Am. Chem. Soc., 2013, 135, 5375–5383. 315 J.H. Kim H. Kaneko T. Minegishi J. Kubota K. Domen J.S. Lee ChemSusChem 9 2016 61 66 J. H. Kim, H. Kaneko, T. Minegishi, J. Kubota, K. Domen, J. S. Lee, ChemSusChem, 2016, 9, 61–66. 316 X. Wang K. Maeda A. Thomas K. Takanabe G. Xin J.M. Carlsson K. Domen M. Antonietti Nat. Mater. 8 2009 76 80 X. Wang, K. Maeda, A. Thomas, K. Takanabe, G. Xin, J. M. Carlsson, K. Domen, M. Antonietti, Nat. Mater., 2009, 8, 76–80. 317 X. Wang K. Maeda X. Chen K. Takanabe K. Domen Y. Hou X. Fu M. Antonietti J. Am. Chem. Soc. 131 2009 1680 1681 X. Wang, K. Maeda, X. Chen, K. Takanabe, K. Domen, Y. Hou, X. Fu, M. Antonietti, J. Am. Chem. Soc., 2009, 131, 1680–1681. 318 J. Zhang X. Chen K. Takanabe K. Maeda K. Domen J.D. Epping X. Fu M. Antonietti X. Wang Angew. Chem. Int. Ed. 49 2010 441 444 J. Zhang, X. Chen , K. Takanabe, K. Maeda, K. Domen, J. D. Epping, X. Fu, M. Antonietti, X. Wang, Angew. Chem. Int. Ed., 2010, 49, 441–444. 319 J. Zhang J. Sun K. Maeda K. Domen P. Liu M. Antonietti X. Fu X. Wang Energy Environ. Sci. 4 2011 675 678 J. Zhang, J. Sun, K. Maeda, K. Domen, P. Liu, M. Antonietti, X. Fu, X. Wang, Energy Environ. Sci., 2011, 4, 675–678. 320 F. Dionigi P.C.K. Vesborg T. Pedersen O. Hansen S. Dahl A. Xiong K. Maeda K. Domen I. Chorkendorff J. Catal. 292 2012 26 31 F. Dionigi, P. C. K. Vesborg, T. Pedersen, O. Hansen, S. Dahl, A. Xiong, K. Maeda, K. Domen, I. Chorkendorff, J. Catal., 2012, 292, 26–31. 321 F. Dionigi P.C.K. Vesborg T. Pedersen O. Hansen S. Dahl A. Xiong K. Maeda K. Domen I. Chorkendorff Energy Environ. Sci. 4 2011 2937 2942 F. Dionigi, P. C. K. Vesborg, T. Pedersen, O. Hansen, S. Dahl, A. Xiong, K. Maeda, K. Domen, I. Chorkendorff, Energy Environ. Sci., 2011, 4, 2937–2942. 322 B. Moss Q. Wang K.T. Butler R. Grau-Crespo S. Selim A. Regoutz T. Hisatomi R. Godin D.J. Payne A. Kafizas K. Domen L. Steier J.R. Durrant Nat. Mater. 20 2021 511 517 B. Moss, Q. Wang, K. T. Butler, R. Grau-Crespo, S. Selim, A. Regoutz, T. Hisatomi, R. Godin, D. J. Payne, A. Kafizas, K. Domen, L. Steier, J. R. Durrant, Nat. Mater., 2021, 20, 511–517. 323 Y. Xiao Z. Fan M. Nakabayashi Q. Li L. Zhou Q. Wang C. Li N. Shibata K. Domen Y. Li Nat. Commun. 13 2022 7769 Y. Xiao, Z. Fan, M. Nakabayashi, Q. Li, L. Zhou, Q. Wang, C. Li, N. Shibata, K. Domen, Y. Li, Nat. Commun., 2022, 13, 7769. 324 J. Fu Z. Fan M. Nakabayashi H. Ju N. Pastukhova Y. Xiao C. Feng N. Shibata K. Domen Y. Li Nat. Commun. 13 2022 729 J. Fu, Z. Fan, M. Nakabayashi, H. Ju, N. Pastukhova, Y. Xiao, C. Feng, N. Shibata, K. Domen, Y. Li, Nat. Commun., 2022, 13, 729. 325 Y. Xiao C. Feng J. Fu F. Wang C. Li V.F. Kunzelmann C.-M. Jiang M. Nakabayashi N. Shibata I.D. Sharp K. Domen Y. Li Nat. Catal. 3 2020 932 940 Y. Xiao, C. Feng, J. Fu, F. Wang, C. Li, V. F. Kunzelmann, C.-M. Jiang, M. Nakabayashi, N. Shibata, I. D. Sharp, K. Domen, Y. Li, Nat. Catal., 2020, 3, 932–940. 326 R. Li T. Takata B. Zhang C. Feng Q. Wu C. Cui Z. Zhang K. Domen Y. Li Angew. Chem. Int. Ed. 62 2023 e202313537 R. Li, T. Takata, B. Zhang, C. Feng, Q. Wu, C. Cui, Z. Zhang, K. Domen, Y. Li, Angew. Chem. Int. Ed., 2023, 62, e202313537. 327 R. Li Z. Zha Y. Zhang M. Yang L. Lin Q. Wang T. Hisatomi M. Nakabayashi N. Shibata K. Domen Y. Li J. Mater. Chem. A 10 2022 24247 24257 R. Li, Z. Zha, Y. Zhang, M. Yang, L. Lin, Q. Wang, T. Hisatomi, M. Nakabayashi, N. Shibata, K. Domen, Y. Li, J. Mater. Chem. A, 2022, 10, 24247–24257. 328 Z. Chen T.F. Jaramillo T.G. Deutsch A. Kleiman-Shwarsctein A.J. Forman N. Gaillard R. Garland K. Takanabe C. Heske M. Sunkara E.W. McFarland K. Domen E.L. Miller J.A. Turner H.N. Dinh J. Mater. Res. 25 2011 3 16 Z. Chen, T. F. Jaramillo, T. G. Deutsch, A. Kleiman-Shwarsctein, A. J. Forman, N. Gaillard, R. Garland, K. Takanabe, C. Heske, M. Sunkara, E. W. McFarland, K. Domen, E. L. Miller, J. A. Turner, H. N. Dinh, J. Mater. Res., 2011, 25, 3–16. 329 K. Maeda K. Domen J. Phys. Chem. Lett. 1 2010 2655 2661 K. Maeda, K. Domen, J. Phys. Chem. Lett., 2010, 1, 2655–2661. 330 C. Feng Z.P. Wu K.W. Huang J. Ye H. Zhang Adv. Mater. 34 2022 2200180 C. Feng, Z. P. Wu, K. W. Huang, J. Ye, H. Zhang, Adv. Mater., 2022, 34, 2200180. 331 H. Wang L. Zhang Z. Chen J. Hu S. Li Z. Wang J. Liu X. Wang Chem. Soc. Rev. 43 2014 5234 5244 H. Wang, L. Zhang, Z. Chen, J. Hu, S. Li, Z. Wang, J. Liu, X. Wang, Chem. Soc. Rev., 2014, 43, 5234–5244. 332 K.E. Dalle J. Warnan J.J. Leung B. Reuillard I.S. Karmel E. Reisner Chem. Rev. 119 2019 2752 2875 K. E. Dalle, J. Warnan, J. J. Leung, B. Reuillard, I. S. Karmel, E. Reisner, Chem. Rev., 2019, 119, 2752–2875. 333 G.A. Hutton B. Reuillard B.C. Martindale C.A. Caputo C.W. Lockwood J.N. Butt E. Reisner J. Am. Chem. Soc. 138 2016 16722 16730 G. A. Hutton, B. Reuillard, B. C. Martindale, C. A. Caputo, C. W. Lockwood, J. N. Butt, E. Reisner, J. Am. Chem. Soc., 2016, 138, 16722–16730. 334 Z. Li R. Li H. Jing J. Xiao H. Xie F. Hong N. Ta X. Zhang J. Zhu C. Li Nat. Catal. 6 2023 80 88 Z. Li, R. Li, H. Jing, J. Xiao, H. Xie, F. Hong, N. Ta, X. Zhang, J. Zhu, C. Li, Nat. Catal., 2023, 6, 80–88. 335 Y. Zhang S. Chen Y. Zhang R. Li B. Zhao T. Peng Adv. Mater. 35 2023 2200180 Y. Zhang, S. Chen, Y. Zhang, R. Li, B. Zhao, T. Peng, Adv. Mater., 2023, 35, 2200180. 336 Z. Zang Y. Ren X. Li Y. Cheng L. Li X. Yu X. Yang Z. Lu X. Zhang H. Liu J. Mater. Chem. A 11 2023 24618 24628 Z. Zang, Y. Ren, X. Li, Y. Cheng, L. Li, X. Yu, X. Yang, Z. Lu, X. Zhang, H. Liu, J. Mater. Chem. A, 2023, 11, 24618–24628. 337 M. Hou L. Zheng D. Zhao X. Tan W. Feng J. Fu T. Wei M. Cao J. Zhang C. Chen Nat. Commun. 15 2024 1342 M. Hou, L. Zheng, D. Zhao, X. Tan, W. Feng, J. Fu, T. Wei, M. Cao, J. Zhang, C. Chen, Nat. Commun., 2024, 15, 1342. 338 Y. Gao M. Zhang Q. Zhao W. Liu L. Zheng J. Ouyang N. Na Energy Environ. Sci. 17 2024 6268 6278 Y. Gao, M. Zhang, Q. Zhao, W. Liu, L. Zheng, J. Ouyang, N. Na, Energy Environ. Sci., 2024, 17, 6268–6278. 339 W. Mtangi V. Kiran C. Fontanesi R. Naaman J. Phys. Chem. Lett. 6 2015 4916 4922 W. Mtangi, V. Kiran, C. Fontanesi, R. Naaman, J. Phys. Chem. Lett., 2015, 6, 4916–4922. Zhenhua Pan (Associate Professor at Department of Applied Chemistry, Graduation School of Engineering, University of Hyogo, Japan) earned his Ph.D. from the University of Tokyo under the supervision of Prof. Kazunari Domen in 2016. In April 2020, he became an assistant professor in the Katayama Lab at Chuo University. In April 2024, he started his own lab at the University of Hyogo as an associate professor. His research focuses on the development of wide-spectrum-responsive photocatalysts for artificial photosynthesis, the investigation of photochemical processes in photocatalytic reactions, and the creation of scalable photocatalyst panels. Qian Wang (Associate Professor at Nagoya University, Japan) obtained her PhD in 2014 from the University of Tokyo under the supervision of Professor Kazunari Domen, followed by postdoctoral research at the same institution. In 2018, she was awarded the Marie Sklodowska-Curie Research Fellowship and joined the Reisner Group at the University of Cambridge. Since joining Nagoya University as an Associate Professor in May 2021, she has established her research group focused on developing innovative materials, strategies, and technologies for solar energy storage through artificial photosynthesis, with the goal of producing renewable fuels.",
      "scopus-id": "85214326386",
      "coredata": {
        "eid": "1-s2.0-S187220672460152X",
        "dc:description": "ABSTRACT Professor Kazunari Domen at the Shinshu University and the University of Tokyo has pioneered materials and techniques for solar-driven water splitting using photocatalysts, a promising technology for contributing to the construction of a sustainable and carbon-neutral society. In this paper, we summarize his groundbreaking contributions to photocatalytic water splitting and, more broadly, photocatalytic research. We highlight various novel functional photocatalytic materials, including oxides, (oxy)nitrides, and oxysulfides, along with innovative techniques such as cocatalyst engineering and Z-scheme system construction developed by the Domen Group. His team has also pioneered readily accessible and cost-effective photo(electro)chemical device fabrication methods, such as the particle-transfer method and thin-film-transfer method. Furthermore, their research has made significant contributions to understanding the (photo)catalytic mechanisms using advanced characterization techniques. Together with his research team, Professor Domen has set many milestones in the field of photocatalytic overall water splitting, notably demonstrating the first scalable and stable 100 m2 solar H2 production system using only water and sunlight. His work has revealed the potential for practical solar H2 production from water and sunlight, and highlighted the application of fundamental principles, combined with chemical and materials science tools, to design effective photocatalytic systems. Through this review, we focus on his research and the foundational design principles that can inspire the development of efficient photocatalytic systems for water splitting and solar fuel production. By building on his contributions, we anticipate a significant impact on addressing major global energy challenges.",
        "openArchiveArticle": "false",
        "prism:coverDate": "2025-01-31",
        "openaccessUserLicense": null,
        "prism:aggregationType": "Journal",
        "prism:url": "https://api.elsevier.com/content/article/pii/S187220672460152X",
        "dc:creator": [
          {
            "@_fa": "true",
            "$": "Wu, Yaqiang"
          },
          {
            "@_fa": "true",
            "$": "Li, Jianuo"
          },
          {
            "@_fa": "true",
            "$": "Chong, Wei-Kean"
          },
          {
            "@_fa": "true",
            "$": "Pan, Zhenhua"
          },
          {
            "@_fa": "true",
            "$": "Wang, Qian"
          }
        ],
        "link": [
          {
            "@_fa": "true",
            "@rel": "self",
            "@href": "https://api.elsevier.com/content/article/pii/S187220672460152X"
          },
          {
            "@_fa": "true",
            "@rel": "scidir",
            "@href": "https://www.sciencedirect.com/science/article/pii/S187220672460152X"
          }
        ],
        "dc:format": "application/json",
        "openaccessType": null,
        "pii": "S1872-2067(24)60152-X",
        "prism:volume": "68",
        "prism:publisher": "Dalian Institute of Chemical Physics, the Chinese Academy of Sciences. Published by Elsevier B.V. All rights are reserved, including those for text and data mining, AI training, and similar technologies.",
        "dc:title": "Novel materials and techniques for photocatalytic water splitting developed by Professor Kazunari Domen",
        "prism:copyright": "Copyright © 2025 Dalian Institute of Chemical Physics, the Chinese Academy of Sciences. Published by Elsevier B.V. All rights are reserved, including those for text and data mining, AI training, and similar technologies.",
        "openaccess": "0",
        "prism:issn": "18722067",
        "dcterms:subject": [
          {
            "@_fa": "true",
            "$": "Photocatalysis"
          },
          {
            "@_fa": "true",
            "$": "Water splitting"
          },
          {
            "@_fa": "true",
            "$": "Solar H2 production"
          },
          {
            "@_fa": "true",
            "$": "Solar energy conversion"
          },
          {
            "@_fa": "true",
            "$": "Artificial photosynthesis"
          }
        ],
        "openaccessArticle": "false",
        "prism:publicationName": "Chinese Journal of Catalysis",
        "openaccessSponsorType": null,
        "prism:pageRange": "1-50",
        "prism:endingPage": "50",
        "pubType": "rev",
        "prism:coverDisplayDate": "January 2025",
        "prism:doi": "10.1016/S1872-2067(24)60152-X",
        "prism:startingPage": "1",
        "dc:identifier": "doi:10.1016/S1872-2067(24)60152-X",
        "openaccessSponsorName": null
      },
      "objects": {
        "object": [
          {
            "@category": "standard",
            "@height": "245",
            "@width": "274",
            "@_fa": "true",
            "$": "https://api.elsevier.com/content/object/eid/1-s2.0-S187220672460152X-fx1.jpg?httpAccept=%2A%2F%2A",
            "@multimediatype": "JPEG image file",
            "@type": "IMAGE-DOWNSAMPLED",
            "@size": "35525",
            "@ref": "fx1",
            "@mimetype": "image/jpeg"
          },
          {
            "@category": "standard",
            "@height": "182",
            "@width": "148",
            "@_fa": "true",
            "$": "https://api.elsevier.com/content/object/eid/1-s2.0-S187220672460152X-fx2.jpg?httpAccept=%2A%2F%2A",
            "@multimediatype": "JPEG image file",
            "@type": "IMAGE-DOWNSAMPLED",
            "@size": "9198",
            "@ref": "fx2",
            "@mimetype": "image/jpeg"
          },
          {
            "@category": "standard",
            "@height": "190",
            "@width": "143",
            "@_fa": "true",
            "$": "https://api.elsevier.com/content/object/eid/1-s2.0-S187220672460152X-fx3.jpg?httpAccept=%2A%2F%2A",
            "@multimediatype": "JPEG image file",
            "@type": "IMAGE-DOWNSAMPLED",
            "@size": "13157",
            "@ref": "fx3",
            "@mimetype": "image/jpeg"
          },
          {
            "@category": "standard",
            "@height": "479",
            "@width": "605",
            "@_fa": "true",
            "$": "https://api.elsevier.com/content/object/eid/1-s2.0-S187220672460152X-gr1.jpg?httpAccept=%2A%2F%2A",
            "@multimediatype": "JPEG image file",
            "@type": "IMAGE-DOWNSAMPLED",
            "@size": "62638",
            "@ref": "gr1",
            "@mimetype": "image/jpeg"
          },
          {
            "@category": "standard",
            "@height": "618",
            "@width": "632",
            "@_fa": "true",
            "$": "https://api.elsevier.com/content/object/eid/1-s2.0-S187220672460152X-gr10.jpg?httpAccept=%2A%2F%2A",
            "@multimediatype": "JPEG image file",
            "@type": "IMAGE-DOWNSAMPLED",
            "@size": "93657",
            "@ref": "gr10",
            "@mimetype": "image/jpeg"
          },
          {
            "@category": "standard",
            "@height": "473",
            "@width": "632",
            "@_fa": "true",
            "$": "https://api.elsevier.com/content/object/eid/1-s2.0-S187220672460152X-gr11.jpg?httpAccept=%2A%2F%2A",
            "@multimediatype": "JPEG image file",
            "@type": "IMAGE-DOWNSAMPLED",
            "@size": "63190",
            "@ref": "gr11",
            "@mimetype": "image/jpeg"
          },
          {
            "@category": "standard",
            "@height": "447",
            "@width": "563",
            "@_fa": "true",
            "$": "https://api.elsevier.com/content/object/eid/1-s2.0-S187220672460152X-gr12.jpg?httpAccept=%2A%2F%2A",
            "@multimediatype": "JPEG image file",
            "@type": "IMAGE-DOWNSAMPLED",
            "@size": "68103",
            "@ref": "gr12",
            "@mimetype": "image/jpeg"
          },
          {
            "@category": "standard",
            "@height": "398",
            "@width": "513",
            "@_fa": "true",
            "$": "https://api.elsevier.com/content/object/eid/1-s2.0-S187220672460152X-gr13.jpg?httpAccept=%2A%2F%2A",
            "@multimediatype": "JPEG image file",
            "@type": "IMAGE-DOWNSAMPLED",
            "@size": "49476",
            "@ref": "gr13",
            "@mimetype": "image/jpeg"
          },
          {
            "@category": "standard",
            "@height": "411",
            "@width": "762",
            "@_fa": "true",
            "$": "https://api.elsevier.com/content/object/eid/1-s2.0-S187220672460152X-gr14.jpg?httpAccept=%2A%2F%2A",
            "@multimediatype": "JPEG image file",
            "@type": "IMAGE-DOWNSAMPLED",
            "@size": "70070",
            "@ref": "gr14",
            "@mimetype": "image/jpeg"
          },
          {
            "@category": "standard",
            "@height": "194",
            "@width": "369",
            "@_fa": "true",
            "$": "https://api.elsevier.com/content/object/eid/1-s2.0-S187220672460152X-gr15.jpg?httpAccept=%2A%2F%2A",
            "@multimediatype": "JPEG image file",
            "@type": "IMAGE-DOWNSAMPLED",
            "@size": "21143",
            "@ref": "gr15",
            "@mimetype": "image/jpeg"
          },
          {
            "@category": "standard",
            "@height": "500",
            "@width": "646",
            "@_fa": "true",
            "$": "https://api.elsevier.com/content/object/eid/1-s2.0-S187220672460152X-gr16.jpg?httpAccept=%2A%2F%2A",
            "@multimediatype": "JPEG image file",
            "@type": "IMAGE-DOWNSAMPLED",
            "@size": "74260",
            "@ref": "gr16",
            "@mimetype": "image/jpeg"
          },
          {
            "@category": "standard",
            "@height": "496",
            "@width": "576",
            "@_fa": "true",
            "$": "https://api.elsevier.com/content/object/eid/1-s2.0-S187220672460152X-gr17.jpg?httpAccept=%2A%2F%2A",
            "@multimediatype": "JPEG image file",
            "@type": "IMAGE-DOWNSAMPLED",
            "@size": "79529",
            "@ref": "gr17",
            "@mimetype": "image/jpeg"
          },
          {
            "@category": "standard",
            "@height": "551",
            "@width": "523",
            "@_fa": "true",
            "$": "https://api.elsevier.com/content/object/eid/1-s2.0-S187220672460152X-gr18.jpg?httpAccept=%2A%2F%2A",
            "@multimediatype": "JPEG image file",
            "@type": "IMAGE-DOWNSAMPLED",
            "@size": "68966",
            "@ref": "gr18",
            "@mimetype": "image/jpeg"
          },
          {
            "@category": "standard",
            "@height": "763",
            "@width": "742",
            "@_fa": "true",
            "$": "https://api.elsevier.com/content/object/eid/1-s2.0-S187220672460152X-gr19.jpg?httpAccept=%2A%2F%2A",
            "@multimediatype": "JPEG image file",
            "@type": "IMAGE-DOWNSAMPLED",
            "@size": "148947",
            "@ref": "gr19",
            "@mimetype": "image/jpeg"
          },
          {
            "@category": "standard",
            "@height": "215",
            "@width": "339",
            "@_fa": "true",
            "$": "https://api.elsevier.com/content/object/eid/1-s2.0-S187220672460152X-gr2.jpg?httpAccept=%2A%2F%2A",
            "@multimediatype": "JPEG image file",
            "@type": "IMAGE-DOWNSAMPLED",
            "@size": "19565",
            "@ref": "gr2",
            "@mimetype": "image/jpeg"
          },
          {
            "@category": "standard",
            "@height": "276",
            "@width": "595",
            "@_fa": "true",
            "$": "https://api.elsevier.com/content/object/eid/1-s2.0-S187220672460152X-gr20.jpg?httpAccept=%2A%2F%2A",
            "@multimediatype": "JPEG image file",
            "@type": "IMAGE-DOWNSAMPLED",
            "@size": "56679",
            "@ref": "gr20",
            "@mimetype": "image/jpeg"
          },
          {
            "@category": "standard",
            "@height": "271",
            "@width": "603",
            "@_fa": "true",
            "$": "https://api.elsevier.com/content/object/eid/1-s2.0-S187220672460152X-gr21.jpg?httpAccept=%2A%2F%2A",
            "@multimediatype": "JPEG image file",
            "@type": "IMAGE-DOWNSAMPLED",
            "@size": "59428",
            "@ref": "gr21",
            "@mimetype": "image/jpeg"
          },
          {
            "@category": "standard",
            "@height": "234",
            "@width": "744",
            "@_fa": "true",
            "$": "https://api.elsevier.com/content/object/eid/1-s2.0-S187220672460152X-gr22.jpg?httpAccept=%2A%2F%2A",
            "@multimediatype": "JPEG image file",
            "@type": "IMAGE-DOWNSAMPLED",
            "@size": "44134",
            "@ref": "gr22",
            "@mimetype": "image/jpeg"
          },
          {
            "@category": "standard",
            "@height": "608",
            "@width": "577",
            "@_fa": "true",
            "$": "https://api.elsevier.com/content/object/eid/1-s2.0-S187220672460152X-gr23.jpg?httpAccept=%2A%2F%2A",
            "@multimediatype": "JPEG image file",
            "@type": "IMAGE-DOWNSAMPLED",
            "@size": "83013",
            "@ref": "gr23",
            "@mimetype": "image/jpeg"
          },
          {
            "@category": "standard",
            "@height": "581",
            "@width": "363",
            "@_fa": "true",
            "$": "https://api.elsevier.com/content/object/eid/1-s2.0-S187220672460152X-gr24.jpg?httpAccept=%2A%2F%2A",
            "@multimediatype": "JPEG image file",
            "@type": "IMAGE-DOWNSAMPLED",
            "@size": "72052",
            "@ref": "gr24",
            "@mimetype": "image/jpeg"
          },
          {
            "@category": "standard",
            "@height": "643",
            "@width": "368",
            "@_fa": "true",
            "$": "https://api.elsevier.com/content/object/eid/1-s2.0-S187220672460152X-gr25.jpg?httpAccept=%2A%2F%2A",
            "@multimediatype": "JPEG image file",
            "@type": "IMAGE-DOWNSAMPLED",
            "@size": "49739",
            "@ref": "gr25",
            "@mimetype": "image/jpeg"
          },
          {
            "@category": "standard",
            "@height": "503",
            "@width": "508",
            "@_fa": "true",
            "$": "https://api.elsevier.com/content/object/eid/1-s2.0-S187220672460152X-gr26.jpg?httpAccept=%2A%2F%2A",
            "@multimediatype": "JPEG image file",
            "@type": "IMAGE-DOWNSAMPLED",
            "@size": "63263",
            "@ref": "gr26",
            "@mimetype": "image/jpeg"
          },
          {
            "@category": "standard",
            "@height": "518",
            "@width": "354",
            "@_fa": "true",
            "$": "https://api.elsevier.com/content/object/eid/1-s2.0-S187220672460152X-gr27.jpg?httpAccept=%2A%2F%2A",
            "@multimediatype": "JPEG image file",
            "@type": "IMAGE-DOWNSAMPLED",
            "@size": "50114",
            "@ref": "gr27",
            "@mimetype": "image/jpeg"
          },
          {
            "@category": "standard",
            "@height": "470",
            "@width": "502",
            "@_fa": "true",
            "$": "https://api.elsevier.com/content/object/eid/1-s2.0-S187220672460152X-gr28.jpg?httpAccept=%2A%2F%2A",
            "@multimediatype": "JPEG image file",
            "@type": "IMAGE-DOWNSAMPLED",
            "@size": "77835",
            "@ref": "gr28",
            "@mimetype": "image/jpeg"
          },
          {
            "@category": "standard",
            "@height": "471",
            "@width": "676",
            "@_fa": "true",
            "$": "https://api.elsevier.com/content/object/eid/1-s2.0-S187220672460152X-gr3.jpg?httpAccept=%2A%2F%2A",
            "@multimediatype": "JPEG image file",
            "@type": "IMAGE-DOWNSAMPLED",
            "@size": "86949",
            "@ref": "gr3",
            "@mimetype": "image/jpeg"
          },
          {
            "@category": "standard",
            "@height": "233",
            "@width": "771",
            "@_fa": "true",
            "$": "https://api.elsevier.com/content/object/eid/1-s2.0-S187220672460152X-gr4.jpg?httpAccept=%2A%2F%2A",
            "@multimediatype": "JPEG image file",
            "@type": "IMAGE-DOWNSAMPLED",
            "@size": "83036",
            "@ref": "gr4",
            "@mimetype": "image/jpeg"
          },
          {
            "@category": "standard",
            "@height": "285",
            "@width": "768",
            "@_fa": "true",
            "$": "https://api.elsevier.com/content/object/eid/1-s2.0-S187220672460152X-gr5.jpg?httpAccept=%2A%2F%2A",
            "@multimediatype": "JPEG image file",
            "@type": "IMAGE-DOWNSAMPLED",
            "@size": "66550",
            "@ref": "gr5",
            "@mimetype": "image/jpeg"
          },
          {
            "@category": "standard",
            "@height": "537",
            "@width": "688",
            "@_fa": "true",
            "$": "https://api.elsevier.com/content/object/eid/1-s2.0-S187220672460152X-gr6.jpg?httpAccept=%2A%2F%2A",
            "@multimediatype": "JPEG image file",
            "@type": "IMAGE-DOWNSAMPLED",
            "@size": "124752",
            "@ref": "gr6",
            "@mimetype": "image/jpeg"
          },
          {
            "@category": "standard",
            "@height": "205",
            "@width": "672",
            "@_fa": "true",
            "$": "https://api.elsevier.com/content/object/eid/1-s2.0-S187220672460152X-gr7.jpg?httpAccept=%2A%2F%2A",
            "@multimediatype": "JPEG image file",
            "@type": "IMAGE-DOWNSAMPLED",
            "@size": "64334",
            "@ref": "gr7",
            "@mimetype": "image/jpeg"
          },
          {
            "@category": "standard",
            "@height": "384",
            "@width": "516",
            "@_fa": "true",
            "$": "https://api.elsevier.com/content/object/eid/1-s2.0-S187220672460152X-gr8.jpg?httpAccept=%2A%2F%2A",
            "@multimediatype": "JPEG image file",
            "@type": "IMAGE-DOWNSAMPLED",
            "@size": "52770",
            "@ref": "gr8",
            "@mimetype": "image/jpeg"
          },
          {
            "@category": "standard",
            "@height": "483",
            "@width": "674",
            "@_fa": "true",
            "$": "https://api.elsevier.com/content/object/eid/1-s2.0-S187220672460152X-gr9.jpg?httpAccept=%2A%2F%2A",
            "@multimediatype": "JPEG image file",
            "@type": "IMAGE-DOWNSAMPLED",
            "@size": "85916",
            "@ref": "gr9",
            "@mimetype": "image/jpeg"
          },
          {
            "@category": "thumbnail",
            "@height": "163",
            "@width": "183",
            "@_fa": "true",
            "$": "https://api.elsevier.com/content/object/eid/1-s2.0-S187220672460152X-fx1.sml?httpAccept=%2A%2F%2A",
            "@multimediatype": "GIF image file",
            "@type": "IMAGE-THUMBNAIL",
            "@size": "20149",
            "@ref": "fx1",
            "@mimetype": "image/gif"
          },
          {
            "@category": "thumbnail",
            "@height": "164",
            "@width": "133",
            "@_fa": "true",
            "$": "https://api.elsevier.com/content/object/eid/1-s2.0-S187220672460152X-fx2.sml?httpAccept=%2A%2F%2A",
            "@multimediatype": "GIF image file",
            "@type": "IMAGE-THUMBNAIL",
            "@size": "14953",
            "@ref": "fx2",
            "@mimetype": "image/gif"
          },
          {
            "@category": "thumbnail",
            "@height": "164",
            "@width": "123",
            "@_fa": "true",
            "$": "https://api.elsevier.com/content/object/eid/1-s2.0-S187220672460152X-fx3.sml?httpAccept=%2A%2F%2A",
            "@multimediatype": "GIF image file",
            "@type": "IMAGE-THUMBNAIL",
            "@size": "17209",
            "@ref": "fx3",
            "@mimetype": "image/gif"
          },
          {
            "@category": "thumbnail",
            "@height": "164",
            "@width": "207",
            "@_fa": "true",
            "$": "https://api.elsevier.com/content/object/eid/1-s2.0-S187220672460152X-gr1.sml?httpAccept=%2A%2F%2A",
            "@multimediatype": "GIF image file",
            "@type": "IMAGE-THUMBNAIL",
            "@size": "11595",
            "@ref": "gr1",
            "@mimetype": "image/gif"
          },
          {
            "@category": "thumbnail",
            "@height": "164",
            "@width": "168",
            "@_fa": "true",
            "$": "https://api.elsevier.com/content/object/eid/1-s2.0-S187220672460152X-gr10.sml?httpAccept=%2A%2F%2A",
            "@multimediatype": "GIF image file",
            "@type": "IMAGE-THUMBNAIL",
            "@size": "10456",
            "@ref": "gr10",
            "@mimetype": "image/gif"
          },
          {
            "@category": "thumbnail",
            "@height": "164",
            "@width": "219",
            "@_fa": "true",
            "$": "https://api.elsevier.com/content/object/eid/1-s2.0-S187220672460152X-gr11.sml?httpAccept=%2A%2F%2A",
            "@multimediatype": "GIF image file",
            "@type": "IMAGE-THUMBNAIL",
            "@size": "11923",
            "@ref": "gr11",
            "@mimetype": "image/gif"
          },
          {
            "@category": "thumbnail",
            "@height": "164",
            "@width": "206",
            "@_fa": "true",
            "$": "https://api.elsevier.com/content/object/eid/1-s2.0-S187220672460152X-gr12.sml?httpAccept=%2A%2F%2A",
            "@multimediatype": "GIF image file",
            "@type": "IMAGE-THUMBNAIL",
            "@size": "16598",
            "@ref": "gr12",
            "@mimetype": "image/gif"
          },
          {
            "@category": "thumbnail",
            "@height": "164",
            "@width": "211",
            "@_fa": "true",
            "$": "https://api.elsevier.com/content/object/eid/1-s2.0-S187220672460152X-gr13.sml?httpAccept=%2A%2F%2A",
            "@multimediatype": "GIF image file",
            "@type": "IMAGE-THUMBNAIL",
            "@size": "10492",
            "@ref": "gr13",
            "@mimetype": "image/gif"
          },
          {
            "@category": "thumbnail",
            "@height": "118",
            "@width": "219",
            "@_fa": "true",
            "$": "https://api.elsevier.com/content/object/eid/1-s2.0-S187220672460152X-gr14.sml?httpAccept=%2A%2F%2A",
            "@multimediatype": "GIF image file",
            "@type": "IMAGE-THUMBNAIL",
            "@size": "6939",
            "@ref": "gr14",
            "@mimetype": "image/gif"
          },
          {
            "@category": "thumbnail",
            "@height": "115",
            "@width": "219",
            "@_fa": "true",
            "$": "https://api.elsevier.com/content/object/eid/1-s2.0-S187220672460152X-gr15.sml?httpAccept=%2A%2F%2A",
            "@multimediatype": "GIF image file",
            "@type": "IMAGE-THUMBNAIL",
            "@size": "7228",
            "@ref": "gr15",
            "@mimetype": "image/gif"
          },
          {
            "@category": "thumbnail",
            "@height": "164",
            "@width": "212",
            "@_fa": "true",
            "$": "https://api.elsevier.com/content/object/eid/1-s2.0-S187220672460152X-gr16.sml?httpAccept=%2A%2F%2A",
            "@multimediatype": "GIF image file",
            "@type": "IMAGE-THUMBNAIL",
            "@size": "11721",
            "@ref": "gr16",
            "@mimetype": "image/gif"
          },
          {
            "@category": "thumbnail",
            "@height": "164",
            "@width": "190",
            "@_fa": "true",
            "$": "https://api.elsevier.com/content/object/eid/1-s2.0-S187220672460152X-gr17.sml?httpAccept=%2A%2F%2A",
            "@multimediatype": "GIF image file",
            "@type": "IMAGE-THUMBNAIL",
            "@size": "9871",
            "@ref": "gr17",
            "@mimetype": "image/gif"
          },
          {
            "@category": "thumbnail",
            "@height": "163",
            "@width": "155",
            "@_fa": "true",
            "$": "https://api.elsevier.com/content/object/eid/1-s2.0-S187220672460152X-gr18.sml?httpAccept=%2A%2F%2A",
            "@multimediatype": "GIF image file",
            "@type": "IMAGE-THUMBNAIL",
            "@size": "8296",
            "@ref": "gr18",
            "@mimetype": "image/gif"
          },
          {
            "@category": "thumbnail",
            "@height": "164",
            "@width": "159",
            "@_fa": "true",
            "$": "https://api.elsevier.com/content/object/eid/1-s2.0-S187220672460152X-gr19.sml?httpAccept=%2A%2F%2A",
            "@multimediatype": "GIF image file",
            "@type": "IMAGE-THUMBNAIL",
            "@size": "9052",
            "@ref": "gr19",
            "@mimetype": "image/gif"
          },
          {
            "@category": "thumbnail",
            "@height": "139",
            "@width": "219",
            "@_fa": "true",
            "$": "https://api.elsevier.com/content/object/eid/1-s2.0-S187220672460152X-gr2.sml?httpAccept=%2A%2F%2A",
            "@multimediatype": "GIF image file",
            "@type": "IMAGE-THUMBNAIL",
            "@size": "9697",
            "@ref": "gr2",
            "@mimetype": "image/gif"
          },
          {
            "@category": "thumbnail",
            "@height": "102",
            "@width": "219",
            "@_fa": "true",
            "$": "https://api.elsevier.com/content/object/eid/1-s2.0-S187220672460152X-gr20.sml?httpAccept=%2A%2F%2A",
            "@multimediatype": "GIF image file",
            "@type": "IMAGE-THUMBNAIL",
            "@size": "9910",
            "@ref": "gr20",
            "@mimetype": "image/gif"
          },
          {
            "@category": "thumbnail",
            "@height": "98",
            "@width": "219",
            "@_fa": "true",
            "$": "https://api.elsevier.com/content/object/eid/1-s2.0-S187220672460152X-gr21.sml?httpAccept=%2A%2F%2A",
            "@multimediatype": "GIF image file",
            "@type": "IMAGE-THUMBNAIL",
            "@size": "8958",
            "@ref": "gr21",
            "@mimetype": "image/gif"
          },
          {
            "@category": "thumbnail",
            "@height": "69",
            "@width": "219",
            "@_fa": "true",
            "$": "https://api.elsevier.com/content/object/eid/1-s2.0-S187220672460152X-gr22.sml?httpAccept=%2A%2F%2A",
            "@multimediatype": "GIF image file",
            "@type": "IMAGE-THUMBNAIL",
            "@size": "5408",
            "@ref": "gr22",
            "@mimetype": "image/gif"
          },
          {
            "@category": "thumbnail",
            "@height": "164",
            "@width": "156",
            "@_fa": "true",
            "$": "https://api.elsevier.com/content/object/eid/1-s2.0-S187220672460152X-gr23.sml?httpAccept=%2A%2F%2A",
            "@multimediatype": "GIF image file",
            "@type": "IMAGE-THUMBNAIL",
            "@size": "9733",
            "@ref": "gr23",
            "@mimetype": "image/gif"
          },
          {
            "@category": "thumbnail",
            "@height": "163",
            "@width": "102",
            "@_fa": "true",
            "$": "https://api.elsevier.com/content/object/eid/1-s2.0-S187220672460152X-gr24.sml?httpAccept=%2A%2F%2A",
            "@multimediatype": "GIF image file",
            "@type": "IMAGE-THUMBNAIL",
            "@size": "10995",
            "@ref": "gr24",
            "@mimetype": "image/gif"
          },
          {
            "@category": "thumbnail",
            "@height": "164",
            "@width": "94",
            "@_fa": "true",
            "$": "https://api.elsevier.com/content/object/eid/1-s2.0-S187220672460152X-gr25.sml?httpAccept=%2A%2F%2A",
            "@multimediatype": "GIF image file",
            "@type": "IMAGE-THUMBNAIL",
            "@size": "5009",
            "@ref": "gr25",
            "@mimetype": "image/gif"
          },
          {
            "@category": "thumbnail",
            "@height": "163",
            "@width": "165",
            "@_fa": "true",
            "$": "https://api.elsevier.com/content/object/eid/1-s2.0-S187220672460152X-gr26.sml?httpAccept=%2A%2F%2A",
            "@multimediatype": "GIF image file",
            "@type": "IMAGE-THUMBNAIL",
            "@size": "9291",
            "@ref": "gr26",
            "@mimetype": "image/gif"
          },
          {
            "@category": "thumbnail",
            "@height": "164",
            "@width": "112",
            "@_fa": "true",
            "$": "https://api.elsevier.com/content/object/eid/1-s2.0-S187220672460152X-gr27.sml?httpAccept=%2A%2F%2A",
            "@multimediatype": "GIF image file",
            "@type": "IMAGE-THUMBNAIL",
            "@size": "7113",
            "@ref": "gr27",
            "@mimetype": "image/gif"
          },
          {
            "@category": "thumbnail",
            "@height": "164",
            "@width": "175",
            "@_fa": "true",
            "$": "https://api.elsevier.com/content/object/eid/1-s2.0-S187220672460152X-gr28.sml?httpAccept=%2A%2F%2A",
            "@multimediatype": "GIF image file",
            "@type": "IMAGE-THUMBNAIL",
            "@size": "10637",
            "@ref": "gr28",
            "@mimetype": "image/gif"
          },
          {
            "@category": "thumbnail",
            "@height": "153",
            "@width": "219",
            "@_fa": "true",
            "$": "https://api.elsevier.com/content/object/eid/1-s2.0-S187220672460152X-gr3.sml?httpAccept=%2A%2F%2A",
            "@multimediatype": "GIF image file",
            "@type": "IMAGE-THUMBNAIL",
            "@size": "16436",
            "@ref": "gr3",
            "@mimetype": "image/gif"
          },
          {
            "@category": "thumbnail",
            "@height": "66",
            "@width": "219",
            "@_fa": "true",
            "$": "https://api.elsevier.com/content/object/eid/1-s2.0-S187220672460152X-gr4.sml?httpAccept=%2A%2F%2A",
            "@multimediatype": "GIF image file",
            "@type": "IMAGE-THUMBNAIL",
            "@size": "7801",
            "@ref": "gr4",
            "@mimetype": "image/gif"
          },
          {
            "@category": "thumbnail",
            "@height": "81",
            "@width": "219",
            "@_fa": "true",
            "$": "https://api.elsevier.com/content/object/eid/1-s2.0-S187220672460152X-gr5.sml?httpAccept=%2A%2F%2A",
            "@multimediatype": "GIF image file",
            "@type": "IMAGE-THUMBNAIL",
            "@size": "7177",
            "@ref": "gr5",
            "@mimetype": "image/gif"
          },
          {
            "@category": "thumbnail",
            "@height": "164",
            "@width": "210",
            "@_fa": "true",
            "$": "https://api.elsevier.com/content/object/eid/1-s2.0-S187220672460152X-gr6.sml?httpAccept=%2A%2F%2A",
            "@multimediatype": "GIF image file",
            "@type": "IMAGE-THUMBNAIL",
            "@size": "15806",
            "@ref": "gr6",
            "@mimetype": "image/gif"
          },
          {
            "@category": "thumbnail",
            "@height": "67",
            "@width": "219",
            "@_fa": "true",
            "$": "https://api.elsevier.com/content/object/eid/1-s2.0-S187220672460152X-gr7.sml?httpAccept=%2A%2F%2A",
            "@multimediatype": "GIF image file",
            "@type": "IMAGE-THUMBNAIL",
            "@size": "8937",
            "@ref": "gr7",
            "@mimetype": "image/gif"
          },
          {
            "@category": "thumbnail",
            "@height": "163",
            "@width": "219",
            "@_fa": "true",
            "$": "https://api.elsevier.com/content/object/eid/1-s2.0-S187220672460152X-gr8.sml?httpAccept=%2A%2F%2A",
            "@multimediatype": "GIF image file",
            "@type": "IMAGE-THUMBNAIL",
            "@size": "13562",
            "@ref": "gr8",
            "@mimetype": "image/gif"
          },
          {
            "@category": "thumbnail",
            "@height": "157",
            "@width": "219",
            "@_fa": "true",
            "$": "https://api.elsevier.com/content/object/eid/1-s2.0-S187220672460152X-gr9.sml?httpAccept=%2A%2F%2A",
            "@multimediatype": "GIF image file",
            "@type": "IMAGE-THUMBNAIL",
            "@size": "11437",
            "@ref": "gr9",
            "@mimetype": "image/gif"
          },
          {
            "@category": "high",
            "@height": "651",
            "@width": "729",
            "@_fa": "true",
            "$": "https://api.elsevier.com/content/object/eid/1-s2.0-S187220672460152X-fx1_lrg.jpg?httpAccept=%2A%2F%2A",
            "@multimediatype": "JPEG image file",
            "@type": "IMAGE-HIGH-RES",
            "@size": "169393",
            "@ref": "fx1",
            "@mimetype": "image/jpeg"
          },
          {
            "@category": "high",
            "@height": "485",
            "@width": "394",
            "@_fa": "true",
            "$": "https://api.elsevier.com/content/object/eid/1-s2.0-S187220672460152X-fx2_lrg.jpg?httpAccept=%2A%2F%2A",
            "@multimediatype": "JPEG image file",
            "@type": "IMAGE-HIGH-RES",
            "@size": "41754",
            "@ref": "fx2",
            "@mimetype": "image/jpeg"
          },
          {
            "@category": "high",
            "@height": "508",
            "@width": "382",
            "@_fa": "true",
            "$": "https://api.elsevier.com/content/object/eid/1-s2.0-S187220672460152X-fx3_lrg.jpg?httpAccept=%2A%2F%2A",
            "@multimediatype": "JPEG image file",
            "@type": "IMAGE-HIGH-RES",
            "@size": "77610",
            "@ref": "fx3",
            "@mimetype": "image/jpeg"
          },
          {
            "@category": "high",
            "@height": "1274",
            "@width": "1608",
            "@_fa": "true",
            "$": "https://api.elsevier.com/content/object/eid/1-s2.0-S187220672460152X-gr1_lrg.jpg?httpAccept=%2A%2F%2A",
            "@multimediatype": "JPEG image file",
            "@type": "IMAGE-HIGH-RES",
            "@size": "272248",
            "@ref": "gr1",
            "@mimetype": "image/jpeg"
          },
          {
            "@category": "high",
            "@height": "1642",
            "@width": "1680",
            "@_fa": "true",
            "$": "https://api.elsevier.com/content/object/eid/1-s2.0-S187220672460152X-gr10_lrg.jpg?httpAccept=%2A%2F%2A",
            "@multimediatype": "JPEG image file",
            "@type": "IMAGE-HIGH-RES",
            "@size": "406560",
            "@ref": "gr10",
            "@mimetype": "image/jpeg"
          },
          {
            "@category": "high",
            "@height": "1256",
            "@width": "1679",
            "@_fa": "true",
            "$": "https://api.elsevier.com/content/object/eid/1-s2.0-S187220672460152X-gr11_lrg.jpg?httpAccept=%2A%2F%2A",
            "@multimediatype": "JPEG image file",
            "@type": "IMAGE-HIGH-RES",
            "@size": "283659",
            "@ref": "gr11",
            "@mimetype": "image/jpeg"
          },
          {
            "@category": "high",
            "@height": "1188",
            "@width": "1495",
            "@_fa": "true",
            "$": "https://api.elsevier.com/content/object/eid/1-s2.0-S187220672460152X-gr12_lrg.jpg?httpAccept=%2A%2F%2A",
            "@multimediatype": "JPEG image file",
            "@type": "IMAGE-HIGH-RES",
            "@size": "294312",
            "@ref": "gr12",
            "@mimetype": "image/jpeg"
          },
          {
            "@category": "high",
            "@height": "1058",
            "@width": "1364",
            "@_fa": "true",
            "$": "https://api.elsevier.com/content/object/eid/1-s2.0-S187220672460152X-gr13_lrg.jpg?httpAccept=%2A%2F%2A",
            "@multimediatype": "JPEG image file",
            "@type": "IMAGE-HIGH-RES",
            "@size": "194137",
            "@ref": "gr13",
            "@mimetype": "image/jpeg"
          },
          {
            "@category": "high",
            "@height": "1093",
            "@width": "2024",
            "@_fa": "true",
            "$": "https://api.elsevier.com/content/object/eid/1-s2.0-S187220672460152X-gr14_lrg.jpg?httpAccept=%2A%2F%2A",
            "@multimediatype": "JPEG image file",
            "@type": "IMAGE-HIGH-RES",
            "@size": "267279",
            "@ref": "gr14",
            "@mimetype": "image/jpeg"
          },
          {
            "@category": "high",
            "@height": "515",
            "@width": "980",
            "@_fa": "true",
            "$": "https://api.elsevier.com/content/object/eid/1-s2.0-S187220672460152X-gr15_lrg.jpg?httpAccept=%2A%2F%2A",
            "@multimediatype": "JPEG image file",
            "@type": "IMAGE-HIGH-RES",
            "@size": "72308",
            "@ref": "gr15",
            "@mimetype": "image/jpeg"
          },
          {
            "@category": "high",
            "@height": "1330",
            "@width": "1717",
            "@_fa": "true",
            "$": "https://api.elsevier.com/content/object/eid/1-s2.0-S187220672460152X-gr16_lrg.jpg?httpAccept=%2A%2F%2A",
            "@multimediatype": "JPEG image file",
            "@type": "IMAGE-HIGH-RES",
            "@size": "298245",
            "@ref": "gr16",
            "@mimetype": "image/jpeg"
          },
          {
            "@category": "high",
            "@height": "1319",
            "@width": "1531",
            "@_fa": "true",
            "$": "https://api.elsevier.com/content/object/eid/1-s2.0-S187220672460152X-gr17_lrg.jpg?httpAccept=%2A%2F%2A",
            "@multimediatype": "JPEG image file",
            "@type": "IMAGE-HIGH-RES",
            "@size": "272416",
            "@ref": "gr17",
            "@mimetype": "image/jpeg"
          },
          {
            "@category": "high",
            "@height": "1464",
            "@width": "1390",
            "@_fa": "true",
            "$": "https://api.elsevier.com/content/object/eid/1-s2.0-S187220672460152X-gr18_lrg.jpg?httpAccept=%2A%2F%2A",
            "@multimediatype": "JPEG image file",
            "@type": "IMAGE-HIGH-RES",
            "@size": "312115",
            "@ref": "gr18",
            "@mimetype": "image/jpeg"
          },
          {
            "@category": "high",
            "@height": "2027",
            "@width": "1970",
            "@_fa": "true",
            "$": "https://api.elsevier.com/content/object/eid/1-s2.0-S187220672460152X-gr19_lrg.jpg?httpAccept=%2A%2F%2A",
            "@multimediatype": "JPEG image file",
            "@type": "IMAGE-HIGH-RES",
            "@size": "622536",
            "@ref": "gr19",
            "@mimetype": "image/jpeg"
          },
          {
            "@category": "high",
            "@height": "570",
            "@width": "900",
            "@_fa": "true",
            "$": "https://api.elsevier.com/content/object/eid/1-s2.0-S187220672460152X-gr2_lrg.jpg?httpAccept=%2A%2F%2A",
            "@multimediatype": "JPEG image file",
            "@type": "IMAGE-HIGH-RES",
            "@size": "77180",
            "@ref": "gr2",
            "@mimetype": "image/jpeg"
          },
          {
            "@category": "high",
            "@height": "733",
            "@width": "1581",
            "@_fa": "true",
            "$": "https://api.elsevier.com/content/object/eid/1-s2.0-S187220672460152X-gr20_lrg.jpg?httpAccept=%2A%2F%2A",
            "@multimediatype": "JPEG image file",
            "@type": "IMAGE-HIGH-RES",
            "@size": "233501",
            "@ref": "gr20",
            "@mimetype": "image/jpeg"
          },
          {
            "@category": "high",
            "@height": "720",
            "@width": "1603",
            "@_fa": "true",
            "$": "https://api.elsevier.com/content/object/eid/1-s2.0-S187220672460152X-gr21_lrg.jpg?httpAccept=%2A%2F%2A",
            "@multimediatype": "JPEG image file",
            "@type": "IMAGE-HIGH-RES",
            "@size": "267073",
            "@ref": "gr21",
            "@mimetype": "image/jpeg"
          },
          {
            "@category": "high",
            "@height": "622",
            "@width": "1976",
            "@_fa": "true",
            "$": "https://api.elsevier.com/content/object/eid/1-s2.0-S187220672460152X-gr22_lrg.jpg?httpAccept=%2A%2F%2A",
            "@multimediatype": "JPEG image file",
            "@type": "IMAGE-HIGH-RES",
            "@size": "174083",
            "@ref": "gr22",
            "@mimetype": "image/jpeg"
          },
          {
            "@category": "high",
            "@height": "1613",
            "@width": "1532",
            "@_fa": "true",
            "$": "https://api.elsevier.com/content/object/eid/1-s2.0-S187220672460152X-gr23_lrg.jpg?httpAccept=%2A%2F%2A",
            "@multimediatype": "JPEG image file",
            "@type": "IMAGE-HIGH-RES",
            "@size": "359068",
            "@ref": "gr23",
            "@mimetype": "image/jpeg"
          },
          {
            "@category": "high",
            "@height": "1544",
            "@width": "965",
            "@_fa": "true",
            "$": "https://api.elsevier.com/content/object/eid/1-s2.0-S187220672460152X-gr24_lrg.jpg?httpAccept=%2A%2F%2A",
            "@multimediatype": "JPEG image file",
            "@type": "IMAGE-HIGH-RES",
            "@size": "322289",
            "@ref": "gr24",
            "@mimetype": "image/jpeg"
          },
          {
            "@category": "high",
            "@height": "1707",
            "@width": "977",
            "@_fa": "true",
            "$": "https://api.elsevier.com/content/object/eid/1-s2.0-S187220672460152X-gr25_lrg.jpg?httpAccept=%2A%2F%2A",
            "@multimediatype": "JPEG image file",
            "@type": "IMAGE-HIGH-RES",
            "@size": "173842",
            "@ref": "gr25",
            "@mimetype": "image/jpeg"
          },
          {
            "@category": "high",
            "@height": "1336",
            "@width": "1349",
            "@_fa": "true",
            "$": "https://api.elsevier.com/content/object/eid/1-s2.0-S187220672460152X-gr26_lrg.jpg?httpAccept=%2A%2F%2A",
            "@multimediatype": "JPEG image file",
            "@type": "IMAGE-HIGH-RES",
            "@size": "261430",
            "@ref": "gr26",
            "@mimetype": "image/jpeg"
          },
          {
            "@category": "high",
            "@height": "1376",
            "@width": "941",
            "@_fa": "true",
            "$": "https://api.elsevier.com/content/object/eid/1-s2.0-S187220672460152X-gr27_lrg.jpg?httpAccept=%2A%2F%2A",
            "@multimediatype": "JPEG image file",
            "@type": "IMAGE-HIGH-RES",
            "@size": "199418",
            "@ref": "gr27",
            "@mimetype": "image/jpeg"
          },
          {
            "@category": "high",
            "@height": "1249",
            "@width": "1333",
            "@_fa": "true",
            "$": "https://api.elsevier.com/content/object/eid/1-s2.0-S187220672460152X-gr28_lrg.jpg?httpAccept=%2A%2F%2A",
            "@multimediatype": "JPEG image file",
            "@type": "IMAGE-HIGH-RES",
            "@size": "314432",
            "@ref": "gr28",
            "@mimetype": "image/jpeg"
          },
          {
            "@category": "high",
            "@height": "1253",
            "@width": "1797",
            "@_fa": "true",
            "$": "https://api.elsevier.com/content/object/eid/1-s2.0-S187220672460152X-gr3_lrg.jpg?httpAccept=%2A%2F%2A",
            "@multimediatype": "JPEG image file",
            "@type": "IMAGE-HIGH-RES",
            "@size": "435902",
            "@ref": "gr3",
            "@mimetype": "image/jpeg"
          },
          {
            "@category": "high",
            "@height": "619",
            "@width": "2048",
            "@_fa": "true",
            "$": "https://api.elsevier.com/content/object/eid/1-s2.0-S187220672460152X-gr4_lrg.jpg?httpAccept=%2A%2F%2A",
            "@multimediatype": "JPEG image file",
            "@type": "IMAGE-HIGH-RES",
            "@size": "374978",
            "@ref": "gr4",
            "@mimetype": "image/jpeg"
          },
          {
            "@category": "high",
            "@height": "756",
            "@width": "2039",
            "@_fa": "true",
            "$": "https://api.elsevier.com/content/object/eid/1-s2.0-S187220672460152X-gr5_lrg.jpg?httpAccept=%2A%2F%2A",
            "@multimediatype": "JPEG image file",
            "@type": "IMAGE-HIGH-RES",
            "@size": "272005",
            "@ref": "gr5",
            "@mimetype": "image/jpeg"
          },
          {
            "@category": "high",
            "@height": "1427",
            "@width": "1828",
            "@_fa": "true",
            "$": "https://api.elsevier.com/content/object/eid/1-s2.0-S187220672460152X-gr6_lrg.jpg?httpAccept=%2A%2F%2A",
            "@multimediatype": "JPEG image file",
            "@type": "IMAGE-HIGH-RES",
            "@size": "553552",
            "@ref": "gr6",
            "@mimetype": "image/jpeg"
          },
          {
            "@category": "high",
            "@height": "545",
            "@width": "1786",
            "@_fa": "true",
            "$": "https://api.elsevier.com/content/object/eid/1-s2.0-S187220672460152X-gr7_lrg.jpg?httpAccept=%2A%2F%2A",
            "@multimediatype": "JPEG image file",
            "@type": "IMAGE-HIGH-RES",
            "@size": "285209",
            "@ref": "gr7",
            "@mimetype": "image/jpeg"
          },
          {
            "@category": "high",
            "@height": "1020",
            "@width": "1372",
            "@_fa": "true",
            "$": "https://api.elsevier.com/content/object/eid/1-s2.0-S187220672460152X-gr8_lrg.jpg?httpAccept=%2A%2F%2A",
            "@multimediatype": "JPEG image file",
            "@type": "IMAGE-HIGH-RES",
            "@size": "219621",
            "@ref": "gr8",
            "@mimetype": "image/jpeg"
          },
          {
            "@category": "high",
            "@height": "1284",
            "@width": "1790",
            "@_fa": "true",
            "$": "https://api.elsevier.com/content/object/eid/1-s2.0-S187220672460152X-gr9_lrg.jpg?httpAccept=%2A%2F%2A",
            "@multimediatype": "JPEG image file",
            "@type": "IMAGE-HIGH-RES",
            "@size": "345947",
            "@ref": "gr9",
            "@mimetype": "image/jpeg"
          },
          {
            "@category": "standard",
            "@_fa": "true",
            "$": "https://api.elsevier.com/content/object/eid/1-s2.0-S187220672460152X-am.pdf?httpAccept=%2A%2F%2A",
            "@multimediatype": "Acrobat PDF file",
            "@type": "AAM-PDF",
            "@size": "4935177",
            "@ref": "am",
            "@mimetype": "application/pdf"
          }
        ]
      },
      "link": {
        "@rel": "abstract",
        "@href": "https://api.elsevier.com/content/abstract/scopus_id/85214326386"
      }
    }
  }
}