{
  "metadata": {
    "title": "Developing a stable and high-performance W-CoMnP electrocatalyst by mitigating the Jahn-Teller effect through W doping strategy",
    "authors": "; ; ",
    "journal": "Chinese Journal of Catalysis",
    "date": "2025-07-31",
    "doi": "10.1016/S1872-2067(25)64669-9",
    "abstract": "",
    "uri": "https://api.elsevier.com/content/article/pii/S1872206725646699",
    "pii": "S1872206725646699"
  },
  "fulltext": {
    "full-text-retrieval-response": {
      "scopus-eid": "2-s2.0-105011266476",
      "originalText": "serial JL 273538 291210 291744 291809 31 Chinese Journal of Catalysis CHINESEJOURNALCATALYSIS 2025-07-24 2025-07-24 2025-07-24 2025-07-24 2025-07-24T19:56:18 1-s2.0-S1872206725646699 S1872-2067(25)64669-9 S1872206725646699 10.1016/S1872-2067(25)64669-9 S300 S300.1 FULL-TEXT 1-s2.0-S1872206725X00085 2025-07-29T09:43:38.68432Z 0 0 20250701 20250731 2025 2025-07-24T20:03:27.509224Z absattachment articleinfo articletitlenorm authfirstinitialnorm authfirstsurnamenorm cid cids contenttype copyright crossmark dateloaded dateloadedtxt datesearch datesort dateupdated dco docsubtype doctype doi eid ewtransactionid hubeid indexeddate issn issnnorm itemstage itemtransactionid itemweight openaccess openarchive pg pgfirst pglast pii piinorm pubdateend pubdatestart pubdatetxt pubyr sortorder srctitle srctitlenorm srctype ssids alllist content subj subheadings suppl tomb volfirst volissue volumelist webpdf webpdfpagecount yearnav figure e-component body affil appendices articletitle auth authfirstini authfull authkeywords authlast grantnumber grantsponsor primabst pubtype ref specialabst 1872-2067 18722067 true 74 74 C Volume 74 20 264 278 264 278 202507 July 2025 2025-07-01 2025-07-31 2025 article fla Copyright © 2025 Dalian Institute of Chemical Physics, the Chinese Academy of Sciences. Published by Elsevier B.V. All rights are reserved, including those for text and data mining, AI training, and similar technologies. DEVELOPINGASTABLEHIGHPERFORMANCEWCOMNPELECTROCATALYSTBYMITIGATINGJAHNTELLEREFFECTTHROUGHWDOPINGSTRATEGY AN B 1 Introduction 2 Experimental 2.1 Synthesis of W-CoMn precursor 2.2 Synthesis of W-CoMnP catalyst 2.3 Preparation of W-CoMnP electrode 2.4 Characterizations 2.5 Testing of AEM system 3 Results and discussion 3.1 Characterization of as-prepared samples 3.2 Electrocatalytic hydrogen evolution performance 3.3 Electrocatalytic oxygen evolution performance 3.4 Overall water splitting performance 3.5 Testing of AEM system performance 3.6 Electrocatalytic mechanism investigation 4 Conclusions Electronic supporting information Supplementary Material References WANG 2022 1295 1305 A LI 2022 2200733 S JIANG 2022 4367 4374 J LI 2021 1897 1927 S SUEN 2017 337 365 N SU 2023 7 49 H LAI 2024 2409031 K SUN 2024 124302 Y SUN 2025 124907 Y LIU 2024 228 238 W DONG 2024 155102 J DONG 2024 127017 J CHEN 2021 101345 N LI 2024 100472 L LIU 2025 158932 W GE 2024 2411024 Z LI 2022 4761 4765 X CHEN 2021 1063 1072 J OUYANG 2019 4923 4928 T WAN 2024 3396 3408 L DUAN 2024 e202413653 Y ZHANG 2023 146576 J PARK 2019 158 166 J YU 2019 244 276 P DU 2018 21617 21624 H OWENSBAIRD 2018 7298 7311 B HUA 2019 1 6 Y LI 2016 4006 4009 D LIU 2021 1511 1527 S YANG 2024 109570 P NADERI 2023 141088 L LIU 2018 455 461 Q SUN 2020 2001484 X AN 2020 21770 21779 B KUREK 2017 3901 3905 M GU 2020 123454 J PI 2016 19779 19786 M AN 2024 149903 B ZHANG 2014 14354 14359 Y LI 2023 1171 1180 J HONG 2023 139036 X ROH 2021 120434 H LOH 2024 37 85 J GUO 2024 21 53 Y ZHAO 2024 269 280 T XUE 2023 6 16 Q TONG 2021 130455 X AN 2024 113 125 B GUO 2024 2400975 L CHEMELEWSKI 2014 2843 2850 W LOUIE 2013 12329 12337 M XUE 2020 28288 28297 N CHEN 2023 1116 1122 J LI 2023 140292 L LAN 2022 132886 B AHSAN 2024 2402275 M ZHENG 2024 2400461 Y ANX2025X264 ANX2025X264X278 ANX2025X264XB ANX2025X264X278XB 2027-07-24T00:00:00.000Z 2027-07-24T00:00:00.000Z http://creativecommons.org/licenses/by-nc-nd/4.0/ 2025-07-26T01:14:00.544Z http://vtw.elsevier.com/data/voc/AddOnTypes/50.7/aggregated-refined National Natural Science Foundation of China 52473327 51572295 21273285 NSFC National Natural Science Foundation of China http://data.elsevier.com/vocabulary/SciValFunders/501100001809 http://sws.geonames.org/1814991/ National Key R&amp;D Program of China 2021YFA1501300 2019YFC1907602 NKRDPC National Key Research and Development Program of China http://data.elsevier.com/vocabulary/SciValFunders/501100012166 http://sws.geonames.org/1814991/ This work was supported by the National Natural Science Foundation of China (52473327, 51572295, 21273285), and the National Key R&amp;D Program of China (2021YFA1501300, 2019YFC1907602). item S1872-2067(25)64669-9 S1872206725646699 1-s2.0-S1872206725646699 10.1016/S1872-2067(25)64669-9 273538 2025-07-24T19:03:27.509224Z 2025-07-01 2025-07-31 1-s2.0-S1872206725646699-main.pdf https://s3-eu-west-1.amazonaws.com/prod-ucs-content-store-eu-west/content/pii:S1872206725646699/MAIN/application/pdf/b9b9d350fa0de3928b477847e16c6956/main.pdf main.pdf pdf true 5331428 MAIN 15 1-s2.0-S1872206725646699-main_1.png https://s3-eu-west-1.amazonaws.com/prod-ucs-content-store-eu-west/content/pii:S1872206725646699/PREVIEW/image/png/7f85f91c558c6f9a0daeb0f873494275/main_1.png main_1.png png 60404 928 656 IMAGE-WEB-PDF 1 1-s2.0-S1872206725646699-fx1.jpg https://s3-eu-west-1.amazonaws.com/prod-ucs-content-store-eu-west/content/pii:S1872206725646699/fx1/DOWNSAMPLED/image/jpeg/db409eedd16460265034d26ca74f2bd3/fx1.jpg fx1 true fx1.jpg jpg 22848 139 301 IMAGE-DOWNSAMPLED 1-s2.0-S1872206725646699-gr1.jpg https://s3-eu-west-1.amazonaws.com/prod-ucs-content-store-eu-west/content/pii:S1872206725646699/gr1/DOWNSAMPLED/image/jpeg/992b5d4469ac1f836c8cc5eddd2c7fce/gr1.jpg gr1 gr1.jpg jpg 92336 472 373 IMAGE-DOWNSAMPLED 1-s2.0-S1872206725646699-gr10.jpg https://s3-eu-west-1.amazonaws.com/prod-ucs-content-store-eu-west/content/pii:S1872206725646699/gr10/THUMBNAIL/image/jpeg/4c4f9775dc0e282c425ae61b38e184e1/gr10.jpg gr10 gr10.jpg jpg 22788 139 343 IMAGE-DOWNSAMPLED 1-s2.0-S1872206725646699-gr2.jpg https://s3-eu-west-1.amazonaws.com/prod-ucs-content-store-eu-west/content/pii:S1872206725646699/gr2/HIGHRES/image/jpeg/0fe3d2100fad771f72e5687b8fc41366/gr2.jpg gr2 gr2.jpg jpg 154220 515 660 IMAGE-DOWNSAMPLED 1-s2.0-S1872206725646699-gr3.jpg https://s3-eu-west-1.amazonaws.com/prod-ucs-content-store-eu-west/content/pii:S1872206725646699/gr3/THUMBNAIL/image/jpeg/df42fa6f2cfa0d0902a1a65105b90747/gr3.jpg gr3 gr3.jpg jpg 122538 504 693 IMAGE-DOWNSAMPLED 1-s2.0-S1872206725646699-gr4.jpg https://s3-eu-west-1.amazonaws.com/prod-ucs-content-store-eu-west/content/pii:S1872206725646699/gr4/DOWNSAMPLED/image/jpeg/ae1cc1a87a7b7253409e0c0b9188548d/gr4.jpg gr4 gr4.jpg jpg 125826 521 714 IMAGE-DOWNSAMPLED 1-s2.0-S1872206725646699-gr5.jpg https://s3-eu-west-1.amazonaws.com/prod-ucs-content-store-eu-west/content/pii:S1872206725646699/gr5/DOWNSAMPLED/image/jpeg/a8459e21146eb77a998eaf24dfc0f411/gr5.jpg gr5 gr5.jpg jpg 56549 318 458 IMAGE-DOWNSAMPLED 1-s2.0-S1872206725646699-gr6.jpg https://s3-eu-west-1.amazonaws.com/prod-ucs-content-store-eu-west/content/pii:S1872206725646699/gr6/THUMBNAIL/image/jpeg/5c72809cdf3be1b85f6db030fe0c8565/gr6.jpg gr6 gr6.jpg jpg 82412 419 614 IMAGE-DOWNSAMPLED 1-s2.0-S1872206725646699-gr7.jpg https://s3-eu-west-1.amazonaws.com/prod-ucs-content-store-eu-west/content/pii:S1872206725646699/gr7/DOWNSAMPLED/image/jpeg/08b8287cc2f1987842231058d41b0d31/gr7.jpg gr7 gr7.jpg jpg 133737 676 493 IMAGE-DOWNSAMPLED 1-s2.0-S1872206725646699-gr8.jpg https://s3-eu-west-1.amazonaws.com/prod-ucs-content-store-eu-west/content/pii:S1872206725646699/gr8/DOWNSAMPLED/image/jpeg/728050a6ea42ea820f1f453df1ad2605/gr8.jpg gr8 gr8.jpg jpg 130660 557 647 IMAGE-DOWNSAMPLED 1-s2.0-S1872206725646699-gr9.jpg https://s3-eu-west-1.amazonaws.com/prod-ucs-content-store-eu-west/content/pii:S1872206725646699/gr9/DOWNSAMPLED/image/jpeg/c2688db81f0bff633f066f276f9b143e/gr9.jpg gr9 gr9.jpg jpg 174623 768 704 IMAGE-DOWNSAMPLED 1-s2.0-S1872206725646699-fx1.sml https://s3-eu-west-1.amazonaws.com/prod-ucs-content-store-eu-west/content/pii:S1872206725646699/fx1/THUMBNAIL/image/gif/e11906b170ccad9d8edbeb52312f332d/fx1.sml fx1 true fx1.sml sml 9495 101 219 IMAGE-THUMBNAIL 1-s2.0-S1872206725646699-gr1.sml https://s3-eu-west-1.amazonaws.com/prod-ucs-content-store-eu-west/content/pii:S1872206725646699/gr1/THUMBNAIL/image/gif/37a6438e5d6cfd12ff5895122edfdf16/gr1.sml gr1 gr1.sml sml 17596 163 129 IMAGE-THUMBNAIL 1-s2.0-S1872206725646699-gr10.sml https://s3-eu-west-1.amazonaws.com/prod-ucs-content-store-eu-west/content/pii:S1872206725646699/gr10/THUMBNAIL/image/gif/10ecf7eb2028b60a5ac6ba5d03de4da6/gr10.sml gr10 gr10.sml sml 7264 88 219 IMAGE-THUMBNAIL 1-s2.0-S1872206725646699-gr2.sml https://s3-eu-west-1.amazonaws.com/prod-ucs-content-store-eu-west/content/pii:S1872206725646699/gr2/THUMBNAIL/image/gif/7b5940458c9b039bfec55b59e6974238/gr2.sml gr2 gr2.sml sml 14358 164 210 IMAGE-THUMBNAIL 1-s2.0-S1872206725646699-gr3.sml https://s3-eu-west-1.amazonaws.com/prod-ucs-content-store-eu-west/content/pii:S1872206725646699/gr3/THUMBNAIL/image/gif/36e9549cba0225b20db5f25d4596c8f2/gr3.sml gr3 gr3.sml sml 12598 159 219 IMAGE-THUMBNAIL 1-s2.0-S1872206725646699-gr4.sml https://s3-eu-west-1.amazonaws.com/prod-ucs-content-store-eu-west/content/pii:S1872206725646699/gr4/THUMBNAIL/image/gif/9159eab35f2c9218b2028c405d341daf/gr4.sml gr4 gr4.sml sml 12439 160 219 IMAGE-THUMBNAIL 1-s2.0-S1872206725646699-gr5.sml https://s3-eu-west-1.amazonaws.com/prod-ucs-content-store-eu-west/content/pii:S1872206725646699/gr5/THUMBNAIL/image/gif/114514fa9035f6ad5e671ac5eb8b77c4/gr5.sml gr5 gr5.sml sml 10444 152 219 IMAGE-THUMBNAIL 1-s2.0-S1872206725646699-gr6.sml https://s3-eu-west-1.amazonaws.com/prod-ucs-content-store-eu-west/content/pii:S1872206725646699/gr6/DOWNSAMPLED/image/gif/a7dae3b56b21e98428b342365bcdfc03/gr6.sml gr6 gr6.sml sml 11609 149 219 IMAGE-THUMBNAIL 1-s2.0-S1872206725646699-gr7.sml https://s3-eu-west-1.amazonaws.com/prod-ucs-content-store-eu-west/content/pii:S1872206725646699/gr7/THUMBNAIL/image/gif/81696bbf4ad32955e7b553c57f0e8aa8/gr7.sml gr7 gr7.sml sml 11062 163 119 IMAGE-THUMBNAIL 1-s2.0-S1872206725646699-gr8.sml https://s3-eu-west-1.amazonaws.com/prod-ucs-content-store-eu-west/content/pii:S1872206725646699/gr8/THUMBNAIL/image/gif/1fd7b34ee66a6f630007579031dad04f/gr8.sml gr8 gr8.sml sml 11870 163 190 IMAGE-THUMBNAIL 1-s2.0-S1872206725646699-gr9.sml https://s3-eu-west-1.amazonaws.com/prod-ucs-content-store-eu-west/content/pii:S1872206725646699/gr9/THUMBNAIL/image/gif/76cf93b1e6420c31b1099623ee23f2ad/gr9.sml gr9 gr9.sml sml 9938 164 150 IMAGE-THUMBNAIL 1-s2.0-S1872206725646699-fx1_lrg.jpg https://s3-eu-west-1.amazonaws.com/prod-ucs-content-store-eu-west/content/pii:S1872206725646699/HIGHRES/image/jpeg/a08b44205c81859a418d203a1663e248/fx1_lrg.jpg fx1 true fx1_lrg.jpg jpg 89885 370 800 IMAGE-HIGH-RES 1-s2.0-S1872206725646699-gr1_lrg.jpg https://s3-eu-west-1.amazonaws.com/prod-ucs-content-store-eu-west/content/pii:S1872206725646699/HIGHRES/image/jpeg/7a32406f0e9b21df28aae502654bc0a6/gr1_lrg.jpg gr1 gr1_lrg.jpg jpg 501648 1255 991 IMAGE-HIGH-RES 1-s2.0-S1872206725646699-gr10_lrg.jpg https://s3-eu-west-1.amazonaws.com/prod-ucs-content-store-eu-west/content/pii:S1872206725646699/DOWNSAMPLED/image/jpeg/ac42c4762bf74f89bca6103e05340e74/gr10_lrg.jpg gr10 gr10_lrg.jpg jpg 81501 368 911 IMAGE-HIGH-RES 1-s2.0-S1872206725646699-gr2_lrg.jpg https://s3-eu-west-1.amazonaws.com/prod-ucs-content-store-eu-west/content/pii:S1872206725646699/HIGHRES/image/jpeg/3d47afa06cc0fb3799c4559be35fae08/gr2_lrg.jpg gr2 gr2_lrg.jpg jpg 622975 1368 1753 IMAGE-HIGH-RES 1-s2.0-S1872206725646699-gr3_lrg.jpg https://s3-eu-west-1.amazonaws.com/prod-ucs-content-store-eu-west/content/pii:S1872206725646699/DOWNSAMPLED/image/jpeg/dd809435299bf22453fe45fdc4825649/gr3_lrg.jpg gr3 gr3_lrg.jpg jpg 494584 1337 1840 IMAGE-HIGH-RES 1-s2.0-S1872206725646699-gr4_lrg.jpg https://s3-eu-west-1.amazonaws.com/prod-ucs-content-store-eu-west/content/pii:S1872206725646699/HIGHRES/image/jpeg/ef0af2f3eac83eaaf55faceeec0df4db/gr4_lrg.jpg gr4 gr4_lrg.jpg jpg 492661 1383 1896 IMAGE-HIGH-RES 1-s2.0-S1872206725646699-gr5_lrg.jpg https://s3-eu-west-1.amazonaws.com/prod-ucs-content-store-eu-west/content/pii:S1872206725646699/DOWNSAMPLED/image/jpeg/c42a57323299605e0202fcb956575b14/gr5_lrg.jpg gr5 gr5_lrg.jpg jpg 238959 845 1218 IMAGE-HIGH-RES 1-s2.0-S1872206725646699-gr6_lrg.jpg https://s3-eu-west-1.amazonaws.com/prod-ucs-content-store-eu-west/content/pii:S1872206725646699/HIGHRES/image/jpeg/db2ae383fc5aab772ab433e9b162d4a8/gr6_lrg.jpg gr6 gr6_lrg.jpg jpg 325357 1112 1631 IMAGE-HIGH-RES 1-s2.0-S1872206725646699-gr7_lrg.jpg https://s3-eu-west-1.amazonaws.com/prod-ucs-content-store-eu-west/content/pii:S1872206725646699/MAIN/image/jpeg/416b73bca91f71f0505e94bd22dc3e59/gr7_lrg.jpg gr7 gr7_lrg.jpg jpg 546921 1796 1309 IMAGE-HIGH-RES 1-s2.0-S1872206725646699-gr8_lrg.jpg https://s3-eu-west-1.amazonaws.com/prod-ucs-content-store-eu-west/content/pii:S1872206725646699/HIGHRES/image/jpeg/9ca03ddd5e49ddf79fe3e5ca8235e1a1/gr8_lrg.jpg gr8 gr8_lrg.jpg jpg 510252 1479 1719 IMAGE-HIGH-RES 1-s2.0-S1872206725646699-gr9_lrg.jpg https://s3-eu-west-1.amazonaws.com/prod-ucs-content-store-eu-west/content/pii:S1872206725646699/HIGHRES/image/jpeg/7807e014098ad16ddf1eccf565b8b5bc/gr9_lrg.jpg gr9 gr9_lrg.jpg jpg 684256 2040 1870 IMAGE-HIGH-RES 1-s2.0-S1872206725646699-mmc1.pdf https://s3-eu-west-1.amazonaws.com/prod-ucs-content-store-eu-west/content/pii:S1872206725646699/mmc1/MAIN/application/pdf/28ea35fdb8cbf4c5718e12602db38eeb/mmc1.pdf mmc1 mmc1.pdf pdf false 15720506 APPLICATION CHNJC 64669 S1872-2067(25)64669-9 10.1016/S1872-2067(25)64669-9 Dalian Institute of Chemical Physics, the Chinese Academy of Sciences Fig. 1 (a) Process flowchart for preparing W-CoMnP. (b) SEM image of W-CoMnP. (c) TEM images of W-CoMnP; (d–f) high resolution HRTEM images of W-CoMnP. (g) SAED image of W-CoMnP. (h–o) EDS elemental mapping images for C, N, O, Co, Mn, P and W separately. Fig. 2 XRD patterns of W-CoMnP (a), MnP and CoP3 (b), W-MnP and W-CoP3 (c). (d) Raman spectra of W-CoMnP and CoMnP. (e) Infrared spectra of W-CoMnP and CoMnP. (f) SBET image of W-CoMnP and CoMnP. (g) Comparison graph of Co XPS peaks. (h) Comparison graph of Mn XPS peaks. (i) Comparison graph of P XPS peaks. Fig. 3 (a) The LSV curves of W-CoMnP, CoMnP, W-CoP3, W-MnP, CoP3, MnP and CG. (b) Tafel slops of W-CoMnP, W-CoMnP, W-CoP3, W-MnP, CoP3, MnP and CG. (c) Relevant overpotentials at η 10, η 50 and η 100 of the samples. (d) EIS Impedance of the prepared catalyst. (e) Double layer capacitance C dl curves. (f) HER stability test of W-CoMnP. (g) Comparison of HER performance with other catalysts. (h) Comparison of HER LSV before and after stability testing. Fig. 4 (a) LSV curves of W-CoMnP, CoMnP, W-CoP3, W-MnP, CoP3, MnP and CG. (b) Tafel slops of W-CoMnP, W-CoMnP, W-CoP3, W-MnP, CoP3, MnP and CG. (c) Relevant overpotentials at η 50, η 100 and η 150 of the samples. (d) EIS Impedance of the prepared catalyst. (e) Double layer capacitance C dl curves. (f) OER stability test of W-CoMnP. (g) Comparison of OER performance with other catalysts. (h) Comparison of OER LSV before and after stability testing. Fig. 5 (a) Overall water splitting LSV curves of as-prepared catalysts at 1 mol/L KOH. (b) Activity comparison with other electrocatalysts. (c) XRD pattern of W-CoMnP recovered for OER reaction. Fig. 6 (a) Structural diagram of AEM equipment. (b) Conductivity of W-CoMnP. (c) Internal diagram of AEM equipment electrolysis water operation. (d) LSV curves of catalysts at 1 mol/L KOH in AEM equipment. Fig. 7 (a) In situ Raman spectra of W-CoMnP in 1 mol/L NaOH. (b) In situ Raman spectroscopy, peak information of W-CoMnP. (c) Explanation of the formation of CoOOH. (d) Schematic representation of the electronic coupling between Co and Mn in W-CoMnP. Fig. 8 (a) Free energy diagram of HER intermediates at different U values. (b) The reaction pathway of the HER process (U = 0); image is most likely OER mechanism. Gibbs free energy profiles along the reaction pathway of CoMnP (c) and W-CoMnP (d). The differential charge density diagram of W-CoMnP catalyzer (yellow: loss electrons, blue: obtain electrons) of top (e) and slide (f). (g) Schematic diagram of OER process. Fig. 9 Density of states projected on the d-states of Co in W-CoMnP (a), Mn in W-CoMnP (b), Co in CoMnP (c), and Mn in CoMnP (d). Dashed-dotted lines and the numbers show the position of d-band center. E g density of states projected on the d-states of Co in W-CoMnP(e), Mn in W-CoMnP (f), Co in CoMnP (g), and Mn in CoMnP (h). (i) The atomic structure of Mn and its typical valence states in cathode materials. (j) Schematic diagrams of Mn 3d orbitals with high-/low-spin Mn3+ ions. (k) Schematic diagram of octahedral Mn based material before and after J-T distortion. (l) The molecular orbital energy diagram of the octahedral Mn based material and the electronic orbitals of Mn2+/Mn3+/Mn4+ ions. Fig. 10 The trade-off between CoNi based catalysts and Mn based catalysts. This work was supported by the National Natural Science Foundation of China (52473327, 51572295, 21273285), and the National Key R&D Program of China (2021YFA1501300, 2019YFC1907602). Available online 20 July 2025 Article Developing a stable and high-performance W-CoMnP electrocatalyst by mitigating the Jahn-Teller effect through W doping strategy Bohan An a b Xin Li a b Weilong Liu a b Jipeng Dong a b Ruichao Bian a b Luyao Zhang a b Ning Li a b Yangqin Gao a b Lei Ge a b * a State Key Laboratory of Heavy Oil Processing, College of New Energy and Materials, China University of Petroleum Beijing, Beijing 102249, China State Key Laboratory of Heavy Oil Processing College of New Energy and Materials China University of Petroleum Beijing Beijing 102249 China State Key Laboratory of Heavy Oil Processing, College of New Energy and Materials, China University of Petroleum Beijing, Beijing 102249, China b Department of Materials Science and Engineering, College of New Energy and Materials, China University of Petroleum Beijing, Beijing 102249, China Department of Materials Science and Engineering College of New Energy and Materials China University of Petroleum Beijing Beijing 102249 China Department of Materials Science and Engineering, College of New Energy and Materials, China University of Petroleum Beijing, Beijing 102249, China * Corresponding author Manganese-based materials are influenced by the Jahn-Teller effect, causing the spontaneous dismutation of Mn3+ (2Mn3+ → Mn2+ + Mn4+) and the dissolution of Mn2+, which often results in diminished activity. This study uniquely employs a W doping strategy to suppress this effect. Externally, a simple template-free method was initially used to prepare cobalt- and manganese-based precursors, followed by a W doping process during the synthesis of transition bimetallic phosphides. Ultimately, W-doped bimetallic phosphides (W-CoMnP) were obtained. The W-CoMnP material demonstrates excellent HER and OER performance with low overpotentials of 95 mV (η₁₀ HER) and 225 mV (η₅₀ OER), and can achieve overall water splitting at a voltage of 1.52 V while maintaining stable cycling for 24 h. To enable commercial application, W-CoMnP was incorporated into an anion exchange membrane (AEM) electrolysis water device, demonstrating continuous and stable hydrogen production under ambient temperature conditions. This study offers a promising strategy for the future development of catalysts for AEM electrolysis water devices. Graphical Abstract A simple and effective strategy was developed to reduce the Jahn-Teller effect and improve the electrocatalytic performance of Mn-based catalysts. W-MnCoP has the ability of a bifunctional catalyst and can achieve stable operation at 1.52 V for 24 h. Keywords Bimetallic phosphide Density functional theory calculation Jiang-Taylor effect W doping Anion exchange membrane water electrolysis device 1 Introduction The urgent need to explore clean and sustainable energy stem from the increasingly serious energy problem and the environmental damage caused by excessive use of fossil fuels [ 1–3 ]. Hydrogen has many advantages, including zero pollution emissions and higher utilization efficiency, and is considered one of the most promising alternative fuels to traditional fossil fuels [ 4 ]. Hydrogen is a remarkable energy carrier. The most widely used hydrogen production process is hydrocarbon reforming [ 5,6 ]. However, the disadvantage of this method is that burning fossil fuels releases a large amount of carbon dioxide into the atmosphere [ 6 ]. The electrochemical water splitting using solar energy and industrial surplus electricity provides an effective way to produce high-purity hydrogen gas due to its efficient use of energy and environmental protection concept [ 7–9 ]. Electrolysis of water to produce hydrogen can be divided into cathodic hydrogen evolution reaction (HER) and anodic oxygen evolution reaction (OER) [ 10 ]. However, during the experimental process, due to the 4-electron reaction involved in OER, the reaction was slow, severely limiting the practical application of electrochemical water splitting [ 10–12 ]. In order to improve the huge reaction barrier of OER in the electrolysis process and ensure the smooth progress of the HER reaction, the development of efficient bifunctional catalysts has become a research hotspot for electrolysis water catalysts. At present, membrane water electrolysis (WE) systems, such as proton exchange membranes (PEM) and anion exchange membranes (AEM), have become a popular field for hydrogen production through electrolysis of water due to their compact and sustainable hydrogen production processes, which meet the requirements of economic commercialization [ 13–15 ]. AEM technology has significant potential for application in energy storage and conversion, especially in the fields of hydrogen energy and fuel cells. Compared with traditional proton exchange membranes (PEM), AEM exhibits superior characteristics in the following key aspects [ 16–19 ]: (1) Cost reduction: Traditional proton exchange membrane fuel cells typically use expensive precious metal catalysts such as platinum, while AEM can use non precious metal catalysts such as nickel, cobalt, etc. at lower temperatures, significantly reducing the system's cost. Therefore, AEM technology can help promote the commercialization of hydrogen fuel cells, especially in cost sensitive application scenarios. (2) Improve energy efficiency: Compared to PEM batteries, AEM batteries are typically able to operate over a wider pH range, which allows AEM to use alkaline media. This not only helps improve the efficiency of the battery, but also expands its application range, including working in some extreme environments. (3) Supporting renewable energy: Due to the stable operation of AEM batteries in highly alkaline environments, it provides a new solution for the storage and conversion of renewable energy, especially in the storage of volatile energy sources such as solar and wind energy. AEM technology offers new possibilities. Based on the above advantages, it can be concluded that. As a trend in future technological development, AEM (Anion Exchange Membrane) has broad application prospects and unique advantages. It has enormous potential for application in energy conversion, environmental protection and sustainable development, which can reduce costs, improve efficiency, support the development of green energy and help solve global environmental problems. With the advancement of materials science, catalyst technology and battery technology, the performance and application areas of AEM will continue to expand, becoming one of the important directions for future development. To achieve future hydrogen production through water electrolysis, many studies focus research on AEM systems, and a feasible AEM system must operate under optimized battery voltage, current density and temperature conditions. In addition, it is necessary to consider attenuation issues during the preparation process, such as damage to AEM components (such as membranes and catalysts) under harsh operating conditions; Especially the deactivation of catalysts, severe damage to surface atomic structure and composition leading to catalyst deactivation and lower AEM efficiency [ 15 ]. The ideal catalyst should maintain stability under thermodynamic and electrochemical (EC) conditions, as well as acidic or alkaline conditions [ 20 ]. For long-term steady-state catalysis, precious metal materials such as RuO2 [ 21 ], Pt [ 22 ], IrO2 [ 23 ] etc. with high catalytic activity are often selected in industry. However, the production of these precious metal-based catalysts is scarce, resulting in high costs and hindering their widespread commercialization [ 20 ]. In addition, traditional metal-based materials cannot exhibit significant electrolyte activity for both HER and OER simultaneously, resulting in low energy utilization efficiency and high manufacturing costs. Therefore, developing efficient, low-cost and stable bifunctional catalysts has become an inevitable research trend [ 24,25 ]. At present, due to the unique Pt like electronic structure and cost-effectiveness of transition metal phosphides (TMPs) as well as their inherent HER and OER catalytic activity, they can be used as electrocatalysts for overall water splitting [ 26 ]. Among numerous transition metal phosphides (TMPs), cobalt based TMP catalysts such as CoP and Co2P [ 27 ] have attracted the attention of numerous researchers due to their low overpotential and good stability. However, considering further practical applications, the electrolytic water performance of cobalt based TMP still needs further improvement. To resolve this situation, Co based materials combine with Mn elements to form CoMnP nanostructures, which exhibit high catalytic activity by reducing their size and uniformly dispersing [ 28 ]. However, the inherent Jahn Teller effect of Mn based materials leads to spontaneous dismutation reaction of Mn3+(2Mn3+ → Mn2+ + Mn4+) and dissolution of Mn2+, ultimately resulting in structural deterioration and decreased activity [ 29–31 ]. These disadvantages are particularly severe in electrocatalytic performance. To solve the above problems, the W doping method can be adopted to suppress the Jahn Teller effect. In addition, W is considered the best ideal promoter for improving the catalytic performance of electrocatalysts, as it can generate a large number of free charge carriers near Fermi level to regulate electron orbits, thereby possessing excellent charge transfer ability. Therefore, doping W into TMPs is expected to become a profitable challenge for achieving electron redistribution, which can help improve material performance at high current densities. In this study, W-doped bimetallic phosphides were designed and synthesized from the MOF structure to achieve precise synergistic effects of charge modulation and electron redistribution. The bimetallic center leads to a significant improvement in catalytic performance. Specifically, a CoMn precursor doped with W was obtained through a one-step solvothermal epitaxial growth process. Finally, W-doped bimetallic phosphides were prepared using in-situ phosphorization strategy. The phase conjugation of two metal phosphides and the synergistic effect of metal centers have a regulatory effect on electronic distribution, while exhibiting a larger specific surface area and exposing more active sites. Jahn Teller effect was successfully suppressed. W-CoMnP material has excellent HER and OER activity, exhibiting low overpotentials of 95 mV (η 10, HER) and 225 mV (η 50, OER), and can achieve overall water splitting at a voltage of 1.52 V as well as stable cycling for 24 h. The W-CoMnP material was assembled into AEM electrolysis water device, and continuous and stable hydrogen production can be achieved under normal temperature conditions. Detailed theoretical research and calculation results also demonstrate that the synergistic effect between Mn and Co ions can effectively reduce the energy barrier in the rate determining step (RDS), thereby improving the catalytic activity and reducing the OER activation energy (E a). 2 Experimental 2.1 Synthesis of W-CoMn precursor All compounds are purchased and used directly without additional purification. Firstly, add 5 mmol (1.25 g) of cobalt acetate tetrahydrate, 5 mmol (0.63 g) of anhydrous manganese chloride, and 5 mmol (0.3 g) of urea, and stir rapidly in 60 mL of ethanol. After the powder dissolves, add 0.02 g of ammonium metatungstate and continue stirring. Keep the mixture at room temperature for 24 h. Then heat the solution to 90 °C and maintain it at that temperature for 10 h, collect the blue powder, and dry it in a vacuum drying oven at 70 °C for 12 h. The blue powder is a precursor of W-CoMn (Fig. S1), The SEM and TEM images of W-CoMn Precursor are shown in Fig. S2. 2.2 Synthesis of W-CoMnP catalyst The W-CoMn precursor and NaH2PO2·H2O are placed at both ends of the pipeline equipment in a ratio of 1:10, with NaH2PO2·H2O located on the upstream side. The experimental phosphating process is as follows: under continuous protective gas conditions, the temperature is maintained at 400 °C, the heating rate is maintained at 2 °C/min, and the duration is 2 h. Finally, the prepared sample was repeatedly washed with alcohol (CH3CH2OH) to remove unreacted substances and impurities. Finally, the sample was dried overnight in a vacuum environment to obtain the target catalyst W-CoMnP. The preparation process of other comparative samples can be found in the supporting information. 2.3 Preparation of W-CoMnP electrode To prepare the electrode, conductive glass (CG) was subjected to ultrasonic treatment in hydrochloric acid (HCl, 1 mol/L) for 15 min, followed by rinsing with pure water and alcohol for 15 min to clean the surface. In the next step, 5 mg of the target sample (presumably W-CoMnP electrode material), 40 μL Nafion (5 wt%) and 960 μL alcohol were ultrasonic mixed. After obtaining a uniform mixture, the mixture droplets of 10 μL were applied to the clean conductive glass surface. After the solution was dried, the resulting product was W-CoMnP Electrodes. The coating area on the conductive glass was determined to be 1 × 1 cm2, the calculated loading capacity should be approximately 0.05 mg/cm2. 2.4 Characterizations The crystallographic characterization of all samples was investigated by X-ray diffractometer (XRD) (Cu-Kα radiation, λ = 1.5406 Å) with a 2θ range of 10° to 90° and a scan rate of 5° min-1. Morphological characterization of the electrodes was carried out by using a FEI Quanta 200 F emission scanning electron microscope (SEM) with an accelerating voltage of 20 kV. The morphologies of the catalysts were analyzed by FEI Tecnai G2 F20 transmission electron microscope (TEM) and HRTEM imaging. X-ray photoelectron spectroscopy (XPS) measurements were performed on a spectrometer PHI 5300 ESCA, using a Mg Kα monochromator calibrated with the C1s peak (284.8 eV) to provide incident photon energy. In addition, the electrodes were also carried out on a Raman spectrometer (λ = 532 nm). Raman spectroscopy can be used for qualitative or quantitative analysis of the composition and structure of samples, and is often used for the characterization of organic compounds and carbon materials. The LabRAM HR-800 micro laser confocal Raman spectrometer produced by HORIBA Jobin Yvon company was used to collect Raman spectra of samples with a laser wavelength of 532 nm. The test sample was placed on a glass slide for testing. Fourier transform infrared (FT-IR) spectroscopy was applied to analyze the functional groups of polymer electrolytes. Avatar370 FT-IR infrared spectrometer was used, which had a scanning range of 400–4000 cm–1 and a resolution of 2 cm–1. Sample preparation: the sample and potassium bromide were mixed and grinded by the compression method to prepare discs for testing. 2.5 Testing of AEM system Loading the target catalyst into the AEM device, the system composed of the catalyst and the AEM device is called the AEM electrolysis cell system. The electrochemical analysis of the AEM electrolytic cell system was conducted using the Shanghai Chenhua Electrochemical Workstation (CHI760EB16091). The AEM electrolytic cell consists of a cathode (electrode size 1 cm × 1 cm), an anode (electrode size 1 cm × 1 cm), a gas diffusion layer, a titanium channel, an anion exchange membrane (AEM type, model sustaining X37-50 Grade T), and an end plate. The anode and cathode electrolytes are both 1 mol/L KOH solutions, which are supplied to the AEM electrolysis cell at a rate of 50 mL/min through a peristaltic pump (LaN1-III/EasyPumpV, Shenchen Pump Industry). The working temperature of AEM electrolytic cell is 60 °C. During the LSV polarization curve testing process, the voltage is controlled within the range of 1.0 to 2.0 V, and the scan rate is 5 mV/s. In the electrochemical impedance spectroscopy (EIS) testing process, the frequency range is controlled between 100 kHz and 0.1 Hz, and the resistance of the AEM electrolytic cell system is finally obtained by a constant voltage and an amplitude of 50 mV. The stability test of the AEM electrolytic cell system is conducted at a constant current of 0.5 A/cm2. 3 Results and discussion 3.1 Characterization of as-prepared samples W-CoMnP Sample was synthesized through a two-step process, including precursor synthesis and final material phosphating. Firstly, W-CoMn was synthesized using a hot stirring method under air conditions. Then, PH3 steam was use as the phosphorus source. Phosphating treatment was performed on the precursor to obtain W-CoMnP heterostructure (Fig. 1(a) ). To ensure the clarity of the sample, it was repeatedly washed with hydrochloric acid to remove impurities and purify the W-CoMnP catalyst. As shown in the TEM and SEM images (Figs. 1(b), 1(c), and S3), it can be observed that the W-CoMnP samples are densely clustered together with a large number of electrochemically active sites exposed on their surfaces (Figs. 1(d)–(f)). In addition, selected area electron diffraction (SAED) patterns relative to lattice points can be observed (Fig. 1(g)) with spacing corresponding to the (220) plane of MnP, the (212) plane of Co0.2Mn0.8P and the (211), (220) planes of CoP3, further confirming the successful synthesis of the target product (Figs. 1(d)–(f)). It can also be observed that there are a large number of heterojunction structure at the junctions of different materials. In addition, the results of TEM energy dispersive spectroscopy (TEM EDS) confirmed the coexistence of C, N, O, Co, Mn, P, and W elements in the W-CoMnP (Figs. 1(h)–(o) and Fig. S4). Moreover, after the addition of small amount of W source, no corresponding crystal form was formed, the cluster structure and internal crystal form of the original CoMnP sample were not destroyed (Figs. S5 and S6), it can be inferred that W has been successfully doped into the CoMnP sample. Based on the XRD results (Fig. 2(a) ), the synthesis of the target product can be determined by comparing it with the standard card. According to the intensity of diffraction peaks, the sample contains a large amount of Co0.2Mn0.8P, CoP3, and MnP components. The XRD peaks of the target sample product appear in 32.1°, 36.5°, 47.6°, and 55.2°, which correspond to the (011), (111), (211), and (212) planes of the Co0.2Mn0.8P crystal (PDF#78-0030) [ 31 ]. The XRD peaks at 23.1°, 28.3°, 32.8°, 36.8°, and 53.1° can be labeled as the (200), (211), (220), (013), and (420) crystal planes of CoP3 phase (PDF#73-1239) [ 32 ]. The XRD peaks at 32.1°, 36.4°, 46.2°,and 54.8° can be labeled as the (101), (111), (220), and (301) crystal planes of MnP phase (PDF#73-1239) [ 33 ]. Comparative samples were prepared by controlling variables (Figs. 2(b) and 2(c)), W-CoP3 and CoP3 material were synthesized by direct phosphorization of W-Co precursor and Co precursor. Directly phosphorize W-Mn precursor and Mn precursor to obtain W-MnP and MnP. Each sample is matched with the corresponding PDF card. Due to the low synthesis temperature, weak XRD peaks will appear at a lower synthesis temperature (400 °C). The XRD patterns confirm the successful synthesis of the target catalyst (W-CoMnP). Various techniques such as Raman spectroscopy, XPS and TEM will be further applied to confirm the presence of W-CoMnP. Meanwhile, as shown in Fig. 2(d), the sample was further analyzed by Raman spectroscopy. It has two different peaks at approximately 1359 and 1581 cm–1, indicating disordered carbon (D band) and graphitized carbon (G band), respectively, while an increase in I G/I D values indicates the presence of more defects on the surface, which is more favorable for catalytic reactions [ 34 ]. Through infrared analysis, it can be found that the carbon materials inside W-CoMnP and CoMnP are both in an inorganic state with similar compositions and no other impurities present (Fig. 2(e)) [ 35 ]. In the nitrogen adsorption desorption isotherm shown in Fig. 2(f), although the specific surface area of W-CoMnP sample is not as large as that of undoped sample, the decrease is very limited, and it still has a large specific surface area [ 34,36 ]. The composition and chemical states of W-CoMnP were studied using XPS. By comparing with W-CoMnP and CoMnP samples (Fig. S7), W-doped sample did not cause damage to its internal orbitals. XPS investigation scanning spectra show the presence of Co, Mn, C, N, O, and P elements in the sample [ 37 ]. As shown in Fig. S8(a), the three fitted peaks of W-CoMnP sample at 284.6, 285.3, and 288.5 eV can be attributed to the C-C, C–N, and C–O bonds of the C species [ 37,38 ]. The overall fitting peak of W-CoMnP is similar to that of CoMnP (Figs. S8(a) and S9(a)), except for a slight increase in C-N signal. It can be concluded that W doping facilitates C-N transfer, thereby improving the behavior of the carbon skeleton. The small amount of N element in cobalt nitrate will form electrophilic carbon atoms and nucleophilic N atoms with the C source in urea, forming C-N bonds. In Fig. S8(b), the N1s peak of W-CoMnP can be considered as pyridine N (399.3 eV), pyrrole N (401.4 eV), and graphite N (407.7 eV) [ 39 ]. In fact, graphene N can increase the graphite conductivity of the carbon skeleton. On the other hand, the improvement in its electrocatalytic performance can be attributed to higher binding energy of pyridine N. On the contrary, the pyridine N signal in CoMnP is much weaker (Fig. S9(b)). Graphene nitrogen enhances the conductivity of the carbon skeleton, while pyridine nitrogen exhibits the highest binding energy, making it easy to enhance its electrocatalytic performance. In contrast, the fitting peak signal of CoMnP is weaker. Due to the enhanced interaction between the two metal phosphides in W-CoMnP by W doping, the orbital electrons in W-CoMnP are redistributed, resulting in the formation of hydroxyl oxides on the surface that are more conducive to electrocatalysis under alkaline conditions. Based on the element content in Table S1 and Figs. S8(c) and S9(c), it is inferred that the sample has formed slight oxidation on the surface, which will not damage the structure of the sample. For the Co 2p 3/2 orbits, the XPS peak can be roughly divided into three different XPS peaks, which are related to Co-P, Co-PO x , and their vibrational satellite peaks (Fig. 2(g)) [ 40 ]. The W-CoMnP XPS spectrum of Co (Figure S8e) has three XPS peaks, including Co–P bonds (780.4 and 793.4 eV), Co-PO x bonds (781.6 and 797.8 eV), and other satellite signals (785.8 and 803.1 eV). The Co peaks of CoMnP (Fig. S9e) are related to Co–P bonds (778.4 and 793.4 eV), Co–PO x bonds (781.3 and 797.3 eV) and satellite signals (785.5 and 802.2 eV), respectively. In summary, compared with CoMnP, Co 2p 3/2 and 2p 1/2 in W-CoMnP samples are affected by W source doping, and their XPS peaks shift to the higher binding energies, indicating that the orbital energy is increasing. When the electrophilic reagent W approaches, the electron cloud is more easily polarized, which helps to generate transition states that are more favorable for the reaction. Meanwhile, the intermediate ions generated after being attacked by electrophilic reagents are more stable, and correspondingly, the energy barrier of the reaction transition state is lower, making it more prone to electrophilic addition. The Mn XPS peak of W-CoMnP in Fig. 2(h) is similar to the XPS peak of CoMnP. The high-resolution Mn XPS spectrum shows four peaks, namely Mn 2p 3/2, Mn 2p 1/2, Mn-P, and other satellite peaks (Fig. S8(f)) [ 41 ]. The high-resolution spectrum of Mn 2p in W-CoMnP indicates that these four peaks are Mn 2p 3/2 (641.3 eV), Mn 2p 1/2 (653.7 eV), Mn-P (642.9 eV), and two unstable satellite peaks (646.1 and 655.3 eV) (Fig. S8(f)). The Mn XPS spectrum of CoMnP also includes Mn 2p 3/2 (641.1 eV), Mn 2p 1/2 (653.5 eV), Mn-P (642.5 eV), and two unstable satellite peaks (645.8 and 653.5 eV) (Fig. S9(f)). In summary, compared with CoMnP, Mn 2p 3/2 and 2p 1/2 in W-CoMnP samples are also affected by W source doping, and their XPS peaks shift to the higher binding energies. It is worth noting that Mn3+ directive forms Mn–P bonds in the sample, which contributes to the electrocatalytic performance of manganese-based materials. As shown in Fig. 2(i), the P3– metal phosphorus bonds at 129.9 and 133.5 eV belong to the 2p 3/2 and 2p 1/2 orbits of the W-CoMnP sample (Fig. S8(d)), which may be related to the active center of the material [ 42 ]. The peak of 134.4 eV can be attributed to the by-products generated by the surface oxidation of W-CoMnP, which contains oxidized P–O bond (PO4 3–) substances on its surface due to exposure to air [ 42 ]. The P-XPS spectrum of CoMnP also has three characteristic peaks (2p 3/2 orbital 129.9 eV, 2p 1/2 orbital 133.5 eV, and P–O bond 134.1 eV) (Fig. S9(d)). By comparing the two, it can be found that under the influence of W doping, due to the positive shift of Mn orbitals, Co orbitals and P orbitals, the valence state of the element increases, and the chemical bonds tend towards the positive electrode, thereby releasing more low state orbitals for electron transfer. Due to the low doping concentration of tungsten, the relative intensity of the W 4f peak may be relatively weak, but the presence of W can still be confirmed by comparing the XPS peaks of other elements (such as C, O, N, etc.). In the analysis of the high-resolution W XPS spectrum shown in Fig. S10, the metal W of the oxide is W6+, and the W 4f peak is generally located at 35 eV, which is significantly different from it. Therefore, it can be inferred that the doped W presents in metallic state (W0), which further proves the successful doping of W source into W-CoMnP sample and the occurrence of negative shift [ 37 ]. The same results all support the influence of W source doping, which enhances the electrocatalytic activity. 3.2 Electrocatalytic hydrogen evolution performance Using a standard 1 mol/L KOH ternary electrode device to evaluate the HER performance of the material. Through comparative testing of W-CoMnP, CoMnP, W-CoP3, W-MnP, CoP3, MnP, and CG electrodes (Figs. 3(a), 3(c) and S11(a)). The W-CoMnP catalyst illustrates the most excellent LSV curve. The HER performance of W-CoMnP electrode is 95 mV (η 10), 156 mV (η 50), and 189 mV (η 100). In addition, it has been verified that the performance of W-CoMnP electrode in alkaline medium is superior to previously reported materials (Fig. 3(g)). The Tafel slope of the Volmer Tafel mechanism W-CoMnP electrode is 65.7 mV/dec (Fig. 3(b)), which is much lower than the Tafel slope of the CoMnP electrode (73.5 mV/dec) and other electrodes. Electrochemical impedance spectroscopy is used to examine reaction kinetics (EIS). Compared with other electrodes, the W-CoMnP electrode presents significantly lower transfer resistance (R ct = 2 Ω) (Fig. 3(d)), indicating that W doping can improve charge transfer and enhance the electrochemical kinetics of the material. Compared with other electrodes, W-CoMnP demonstrates the highest standardized ESCA activity and HER activity. The C dl curves of W-CoMnP are shown in Fig. 3(e), and the C dl (12.39 mF/cm2) of the electrode is the highest in all the samples, indicating that the addition of W source generates more active sites, which is consistent with the HER performance (Fig. 3(a)). While ensuring high HER activity of the material, stability tests were conducted on the catalyst, and after 48 h of testing, the sample still maintained 76.8% activity (Fig. 3(f)). Finally, CV cycling and LSV curve methods were used to evaluate the W-CoMnP electrode (Figs. S12 and S13). After the CV cycle, the W-CoMnP electrode curve clearly shows a slight decrease in catalytic efficiency. Even after 20 h of operation, the decrease in current density can be ignored, as shown in the LSV curve of the W-CoMnP electrode (Fig. 3(h)). The stability experiments further confirmed the excellent sustain of W-CoMnP. 3.3 Electrocatalytic oxygen evolution performance To confirm the dual functional properties of the material, OER performance tests were conducted on the as-prepared electrodes. The electrode W-CoMnP presents the lowest initial position of 225 mV (η50), indicating that it also has excellent OER capability (Fig. 4(a) ). As shown in Figs. 4(c) and S11(b), W-CoMnP has the lowest overpotentials compared to CoMnP (256, 267, and 275 mV) and W-CoP3 (264, 272, and 277 mV) with overpotentials of 225 (η 50), 245 (η 100), and 252 mV (η 150) (W-CoMnP), respectively. The W-CoMnP electrode illustrates an optimal Tafel slope of 71.2 mV/dec (Fig. 4(b)), demonstrating excellent OER kinetics compared to CoMnP (82.7 mV/dec). Meanwhile, the electrocatalytic performance of W-doped materials is better than that of undoped CoMnP sample, indicating that W doping can effectively enhance the electrocatalytic performance of the W-CoMnP electrode (Fig. 4(c)). From the perspective of electrochemical impedance, the W-CoMnP catalyst demonstrates significantly lower transfer resistance (R ct = 2 Ω) compared to other electrodes (Fig. 4(d)). From the C dl curves, it can be seen that the performance of the W-CoMnP electrode (8.45 mF/cm2) is superior to that of the CoMnP electrode's C dl (6.91 mF/cm) (Fig. 4(e)). This result indicates that the W-CoMnP electrode generates more active catalytic sites. Therefore, the W doped sample has strong OER sustainability (Fig. 4(f)). Based on ESCA results, the standardized concentration of W-CoMnP specific activity is higher than that of W-CoP3 and W-MnP (Fig. 4(e)). The TOF value of W-CoMnP electrode is also higher than that of other electrodes under the same overpotential (Figs. S15 and S16). These findings indicate that both OER activity and active sites increase with the doping of W source. After CV cycling, the current density of W-CoMnP catalyst did not significantly decrease, indicating its excellent OER stability (Fig. 4(h)). In comparison with other electrodes (Fig. 4(g)), the W-CoMnP structure exhibits good OER stability at low current densities. However, at high current densities, the HER and OER stability of the material is low (Fig. S17). Samples doped with tungsten can enhance the sustainability of OER through the following three strategies [ 43–48 ]: (1) Enhanced catalytic activity: Tungsten is a transition metal with high electronegativity and strong chemical stability, which gives it excellent electron transfer ability in catalytic reactions. The addition of tungsten can improve the electronic structure of the catalyst, thereby enhancing its catalytic activity for OER reaction. The addition of tungsten usually affects the valence band and conductivity of the material, allowing the catalyst to more effectively promote the generation of oxygen molecules; (2) Improve stability: OER is a complex reaction involving multiple electron transfers, which is often accompanied by corrosion and degradation of the catalyst. Tungsten has strong oxidation resistance and corrosion resistance, which can enhance the chemical stability of catalysts at high potentials. Therefore, tungsten doped catalysts usually exhibit good stability during long-term operation, reducing catalyst deactivation and improving the sustainability of the reaction; (3) Adjusting surface structure: The addition of tungsten can regulate the electron density and geometric structure of the catalyst surface, optimizing the distribution of active sites. This phenomenon can enhance the interaction between the catalyst and reactants, reduce the activation energy of oxygen evolution reaction, and thus improve the reaction efficiency. 3.4 Overall water splitting performance Due to the dual functionality of HER and OER in the alkaline medium of W-CoMnP electrode, two identical W-CoMnP electrodes were used to create a dual electrode electrolysis cell for complete water splitting performance testing. Compared with other electrodes, W-CoMnP only requires 1.52 V (η 10) (Figs. 5(a) and S18). Compared with most reported electrocatalysts used in alkaline media, this result makes it a superior electrocatalyst (Fig. 5(b)). After completing all electrochemical tests, the W-CoMnP sample remains stable (Figs. S19 and S20) as evidenced by the XRD characterization results (Fig. 5(c)) and the overall stability of the structure, further supporting the stability of the sample. Furthermore, after continuous operation at 1.52 V voltage for 24 h, W-CoMnP/GC demonstrates excellent stability with the test current decreasing from 20 mA/cm2 to 17.08 mA/cm2 (Fig. 5(d)). Finally, compared with the bifunctional catalysts described in the supporting literatures (Table S2), the W-CoMnP electrode displays excellent HER and OER performance in alkaline media with low electrode potential, high current density and long-term sustainability. In order to verify the Jahn Teller effect and the dissolution phenomenon of Mn2+ in Mn based electrocatalysts, XPS tests before and after the electrocatalytic reaction of the catalyst were conducted (Figs. S21–S23). By comparison, it can be found that the orbital peaks of other elements change very little before and after the reaction, while the Mn element shows a significant peak change compared to the orbital peaks before the reaction, which is the manifestation of the dissolution of Mn2+ in Mn based electrocatalysts. The dissolution of Mn2+ may affect the stability of the catalyst. The effectiveness of manganese-based catalysts usually depends on the stable presence of manganese on the catalyst surface. If Mn2+ dissolves too much, it can lead to catalyst deactivation. After Mn2+ dissolves, it may not be able to return to the catalytic reaction, thereby reducing the catalytic efficiency. Meanwhile, in the oxygen reduction reaction (ORR), the different oxidation states of manganese may have a significant impact on catalytic activity. If Mn2+ dissolves, the catalyst may lose its original efficient catalytic activity. 3.5 Testing of AEM system performance Before conducting AEM testing, the conductivity of the sample should be tested first (Fig. S24). Through testing (Figs. 6(b) and S25), it is shown that the W-CoMnP electrode has good conductivity and fully meets the conditions for application in dual electrode electrolysis cells. Later, in order to evaluate the hydrogen production capacity of the as-prepared catalyst under industrial conditions, the W-CoMnP catalyst was sprayed on foam nickel (1 × 1 cm2) as anode and cathode. PAP-TP-85 was used as anion exchange membrane, and it was assembled with the gas diffusion layer, titanium flow channel and end plate for AEMWE test (Figs. 6(a) and (c)). As shown in Fig. 6(d), the polarization curve of the AEMWE system catalyzed by W-CoMnP under 60 °C and 1 mol/L KOH conditions is 144.7 mA/cm2 at a voltage of 1.8 V, which is much higher than the current density of 36.5 mA/cm2 in the NF || NF system. At the same time, the catalyst can be tested for stability under AEMWE system and 1 mol/L KOH conditions (Fig. S26) [ 49 ]. This phenomenon indicates that the W-CoMnP catalyst can improve catalytic performance and can economically and efficiently produce hydrogen under industrial conditions. 3.6 Electrocatalytic mechanism investigation In order to conduct detailed theoretical calculations, it is necessary to determine the catalytic core of the electrocatalyst and the final product in electrocatalysis. In-situ Raman analysis was conducted using a self-made three electrode battery to determine the catalytic center and investigate the structural evolution during electrochemical activation. As shown in Fig. 7(a) , Raman spectra of W-CoMnP samples soaked in 1.0 mol/L NaOH solution were recorded at different voltages. During the application of voltage, the peak of W-CoMnP's Raman spectrum is caused by Co–O vibration, and its amorphous CoOOH peaks appear at 507.9 and 583.2 cm–1 [ 50,51 ]. This phenomenon also indicates that Co atoms on the surface of the material react with water molecules and oxygen in the atmosphere, ultimately forming the hydroxide oxide CoOOH. Applying voltage to the electrode will enhance the peak value of CoOOH. This result demonstrate that the potential provided to the electrode can accelerate the interaction between surface Co and OH–, oxygen or water. It is worth noting that the peaks at 507.9 and 583.2 cm–1 are attributed to CoOOH. When no voltage is applied, the peak value of CoOOH weakens; this peak is more pronounced and dominates at a potential of 1.5 V. When the applied potential decreases in sequence, the intensity of the peak also decreases again, indicating that the process is cyclically reversible [ 50 ]. Under the same testing conditions, analysis of the sample under a voltage of 1.5 V (Fig. 7(b)) reveals that the internal peaks contain more information (CoO2 at 457.7 cm–1, CoO at 640.1 cm–1, and Co3O4 at 721.2 cm–1). Based on the peak strength and peak area, it can be determined that the hydroxyl oxide CoOOH has a significant impact on the sample. Thus, the formation process of surface CoOOH was simulated (Fig. 7(c)). During the initial soaking process in alkaline solution, Co2+ ions and OH– ions on the surface of the material form a layered structure through hydrogen bonding. During electrochemical testing, layered cobalt hydroxide undergoes an oxidation reaction, resulting in a structural change and the formation of a new metastable hydroxide, namely cobalt hydroxide (CoOOH). Cobalt hydroxide is more active than cobalt oxide and is more suitable for electrocatalytic reactions under alkaline conditions. According to the crystal field theory [ 2 ], the valence electron configuration of Co is 3d and it has a high spin state (Fig. 7(d)). Therefore, it has unpaired electrons on the π-symmetric (t 2g) d orbital. In theory, it interacts with the orbital electrons of P through π symmetry. The e–1-e–1 repulsion is the main interaction between Mn2+/3+ species and P-orbital electrons, as the t 2g -d orbitals of low spin Mn2+ are completely occupied by electrons [ 2,38,51 ]. After coupling with Co and Mn2+, the e–1-e–1 repulsion between the orbital electrons of Mn2+ and P can be enhanced by Co–P to increase π symmetry. The result can accelerate the transfer of electrons on the catalyst surface and lead to negative orbital deviation, which can also be detected by XPS technology. To demonstrate the excellent electrocatalytic performance of W-CoMnP material, DFT calculations were conducted. Before calculation, the target samples were firstly constructed and optimized (Figs. S27 and S28) [ 52 ]. Typically, ideal HER catalysts have the lowest |ΔG H| values [ 38,52 ]. In Fig. 8(a) , the DFT calculation results indicate that compared to the other sample, W-CoMnP has only a weaker |ΔG H| energy (0.14 eV) than RuO2. By calculating and analyzing the adsorption free energies of OH*, OOH*, and O* in the basic structural processes, the potential Co and Mn active sites on the surface of W-CoMnP nanoclusters are elucidated using DFT method. For discrete units, Co is more likely to act as an active site. Fig. 8(b) depicts the optimized geometric models of W-CoMnP and the water oxidation process of CoMnP, indicating that OER is the key factor determining the reaction rate. The adsorption energy of intermediates made from oxygen is an objective benchmark for understanding the activity of the entire process of the OER mechanism (Fig. 8(g)). By utilizing the adsorption energy of intermediates generated by oxygen, it can be objectively revealed the activity of the entire process in the OER mechanism, and the entire process can be simulated. It is worth noting that the adsorption capacity of OER under intermediate conditions is inversely proportional to the energy barrier (ΔG) [ 52 ]. The process energy barriers of different materials under different U conditions are shown in Fig. 8. Compared with other materials, it is evident that W-CoMnP can successfully alter the four step G value (Fig. 8(c) and (d)). When the applied potential is 1.5 V, the absorption capacity of O* and OH* increases, resulting in a decrease in the ΔG value of W-CoMnP. The fourth process of CoMnP is the rate determining step (RDS). Due to the poor affinity of OOH* intermediates for Co site adsorption, the energy barrier (1.7 eV) for OOH* conversion to O2 is higher. However, the RDS energy barrier of W-CoMnP decreased to 1.5 eV, increasing the OOH* adsorption and lowering the energy threshold. According to theoretical evaluations, W doping can successfully reduce the energy barrier generated by intermediate states, improve OER activity and enhance mass transfer efficiency. These theoretical findings are similar to the experimental results. In order to gain a deeper understanding of the changes in interface electron distribution between OER intermediates and Co sites throughout the entire OER process, it is necessary to explore the direction of OOH* electron transfer [ 52,53 ]. When the two elements (Mn, P) coordinate with Co, electrons are more likely to move from Mn and P atoms to Co atoms due to the reason that their electronegativity is lower than that of Co. The 3D charge density difference plots in Figs. 8(e) and (f) further support this result, the positive charge of the P atom indicates that Co and Mn can capture electrons during the OER process. When W is doped into CoMnP structure, more electrons will rise from the metal reaction sites, attracting high valence metal species as active sites and accelerating the process of O2 production. Meanwhile, some electrons transfer from metal atoms to the generated OOH*. By comparison, it can be observed that the d-band centers of Co and Mn in samples with and without W doping have changed as shown in Figs. 9(a)–(d) . It is worth noting that compared to CoMnP without W doping, a rightward shift in the center of the Co atomic d-band can be observed in W-CoMnP sample. In the same situation, a significant rightward shift of the d-band center of Mn atoms remains unchanged. This phenomenon also indicates that the significant reaction rate of W-CoMnP is closely related to its increased adsorption affinity for intermediates. In the oxygen evolution reaction (OER) process, the external conditions of surface-active sites play a crucial role in promoting electron conversion and are largely influenced by their interaction with oxygen-containing intermediates. By integrating the projected density of states (PDOS) in W-CoMnP and CoMnP into the Fermi energy, the binding strength can be accurately analyzed [ 9,54 ]. As is well known, the ƒe value obtained by projecting the unsaturated coordination state is one of the key parameters for measuring OER activity. The calculated values of Co and Mn in the bimetallic phosphides W-CoMnP and CoMnP are 2.74, 2.43, 3.57 and 3.75, respectively (Figs. 9(e)–(h)). Excessive ƒe can lead to strong binding between W-CoMnP and oxygen-containing intermediates, resulting in a decrease in catalytic performance. On the contrary, lower ƒe will lead to weakened binding, which is also detrimental to catalytic efficiency. Therefore, having a suitable ƒe is the key to improve catalytic ability. Compared with CoMnP, the bimetallic phosphide W-CoMnP doped with W source exhibits excellent catalytic performance (Figs. 9(e)–(h)). For W-CoMnP, appropriately reducing the ƒe value not only ensures the binding between the catalyst and the intermediate, but also does not affect its catalytic performance after detachment. To gain a more thorough understanding of the electrocatalytic mechanism of W-CoMnP and to analyze its superior catalytic performance, DFT calculations were carried out on the target catalyst as well as other comparative samples. The corresponding results clearly indicate that compared with Mn3+ (Figs. 8(e) and (f)), Co2+ has more unfilled semi full orbitals, indicating that the interaction between Co and OER intermediates in W-CoMnP catalyst is more active. Clearly, upon the formation of nanoclusters, W-CoMnP tends to redistribute and accumulate electrons in the P 3p orbitals near the Co atoms, while fewer electrons are present around the P atoms due to Co's higher electronegativity, which causes this specific electron distribution. As a result of this characteristic, the metal atoms can attain higher valence states. The XPS results show that the orbital peaks of Co 2p 3/2 and 2p 1/2 are more prominent, which improved the overall water splitting efficiency. As one of the 3d orbital metals, Mn has various valence state changes with electrochemical activity typically occurring between +2 and +4 valences. The electronic configuration changes of Mn0/Mn2+/Mn3+/Mn4+ are shown in Fig. 9(k). The Mn-based catalyst, which shows relatively good performance in calculations, cannot maintain stability over long periods during electrochemical testing, primarily due to the Jahn-Teller effect. This effect, first introduced by Jahn and Teller in 1937, demonstrates that in degenerate electronic states, nonlinear molecular systems can experience persistent instability, leading to the elimination of degeneracy and the formation of new systems with lower symmetry and energy [ 29 ]. In nonlinear fields, octahedral Mn-based materials typically exhibit high-spin states of Mn3+, which have notable magnetism and cause pronounced Jahn-Teller distortions along the material's long axis (Fig. 9(i)). To alleviate degeneracy, octahedral complexes will undergo twisting along the z-axis. This phenomenon is observed in metal complexes with d orbitals, where degeneracy occurs when electrons occupy different orbitals that may possess the same or similar energy levels. In contrast to Mn3+ cations, Co and Ni cations do not exhibit selective Jahn-Teller distortions, which can be attributed to the serrated Jahn-Teller ordering along the elongated axis of Mn-based materials or the lack of electrons in the eg orbitals within the frameworks of Ni and Co-based materials [ 55 ]. Considering the influence of the electronic structure of materials, for 3d transition metals like Mn, the 3d orbitals are split into doubly degenerate eg orbitals (dx 2 -y 2 and dz 2) and triply degenerate t 2g orbitals (dxy , dxz , and dyz ) (Fig. 9(l)). In high-spin Mn3+ cations (t 2g 3 eg 1) within Mn-based materials, only one electron occupies an eg orbital (eg 1). The electrons on the dx 2- y 2 and dz 2 orbitals will cause varying degrees of shielding effects on the Mn nuclei in different directions [ 29,55–57 ]. In this configuration, the overall d orbital no longer matches the symmetry of the octahedron, resulting in instability of the central Mn3+ cation. The Mn3+ cation triggers a significant Jahn-Teller effect, leading to noticeable distortions in the local lattice structure and reducing electrochemical stability. A key approach to reduce Jahn-Teller distortion and improve the stability of Mn-based materials is by controlling the spin state (S) of Mn3+ ions. In the case of Mn3+, two possible spin configurations in W-CoMnP can occur: the high-spin state (t 2g 3 eg 1, S = 2) and the low-spin state (t 2g 4 eg 0, S = 1). Doping with W induces a transition of the Mn electron spin state to a low-spin configuration, where the Mn3+ electrons fully occupy all the t2g energy levels and transfer spin-reducing electrons (Fig. 9(j)). This effectively suppresses the Jahn-Teller effect of Mn3+ in CoMnP, allowing the material to display its catalytic properties. Experimental data and density functional theory (DFT) calculations jointly confirm that bimetallic phosphide nanocluster materials exhibit significant heterojunction behavior at higher electron density concentrations. This performance profoundly affects the electronic structure of W-CoMnP and is also an important manifestation of improving catalyst performance. Specifically, this modulation leads to the formation of coordination unsaturated Co and Mn atoms in the material matrix, which in turn become key sites for oxygen molecule capture, promoting the favorable synthesis of O–O bonds, which is a critical step in the oxygen evolution reaction (OER). Subsequently, the released O* atoms were captured by Co atoms embedded in the W-CoMnP lattice. By coordinating with adjacent Co atoms, the captured O* atoms exhibit active Co catalytic centers, particularly in higher spin electron states. Bader charge analysis supplemented these findings, indicating that throughout the OER process, the Co catalytic center gradually shifted towards higher oxidation states. The selective capture of OOH* intermediates from alkaline solutions is attributed to the presence of low-energy 3d orbitals that accommodate unpaired spin electrons. In the process of balancing CoNi-based catalysts and Mn-based catalysts (Fig. 10 ), Mn-based catalysts have multiple advantages of their own, however the Jahn Teller effect of Mn is a key issue restricting their development. Doping with metal W can effectively improve suppress the Jahn Teller effect and provide a new idea for designing Mn-based non precious metal water electrolysis catalysts. 4 Conclusions Overall, W-doped CoMn bimetallic phosphides can efficiently enhance the HER and OER electrocatalytic performance. Due to the doping of W source, the Jiang Taylor effect of Mn can be effectively suppressed, enhancing the stability of W-CoMnP material. Meanwhile, using in-situ Raman spectroscopy, it can be found that CoOOH is formed on the surface of the material during water electrolysis, which promotes the rearrangement and localization of electrons. At the same time, the negative shift of the d-band center of the active metal site in the medium optimizes the binding strength with HER related intermediates. The results indicate that under 1 mol/L KOH, W-CoMnP only requires a HER overpotential of 95 mV (η 10) and an OER overpotential of 225 mV (η 50). When W-CoMnP is used for overall water decomposition, it exhibits excellent stability, requiring just only 1.5 V (η 10). This work provides a new approach for the rational design and development of economically efficient bifunctional electrocatalysts, which has great practical value. Electronic supporting information Supporting information is available in the online version of this article. Conflicts of interest The authors declare no conflict of interest. Supplementary Material Supplementary appendix References 1 A. Wang L. Zhang X. Li Y. Gao N. Li G. Lu L. Ge Chin. J. Catal. 43 2022 1295 1305 A. Wang, L. Zhang, X. Li, Y. Gao, N. Li, G. Lu, L. Ge. Chin. J. Catal., 2022, 43, 1295–1305. 2 S. Li L. Wang H. Su A.N. Hong Y. Wang H. Yang L. Ge W. Song J. Liu T. Ma X. Bu P. Feng Adv. Funct. Mater. 32 2022 2200733 S. Li, L. Wang, H. Su, A.N. Hong, Y. Wang, H. Yang, L. Ge, W. Song, J. Liu, T. Ma, X. Bu, P. Feng, Adv. Funct. Mater., 2022, 32, 2200733. 3 J. Jiang F. Li H. Su Y. Gao N. Li L. Ge Chin. Chem. Lett. 33 2022 4367 4374 J. Jiang, F. Li, H. Su, Y. Gao, N. Li, L. Ge, Chin. Chem. Lett., 2022, 33, 4367–4374. 4 S. Li Y. Gao N. Li L. Ge X. Bu P. Feng Energy Environ. Sci. 14 2021 1897 1927 S. Li, Y. Gao, N. Li, L. Ge, X. Bu, P. Feng, Energy Environ. Sci., 2021, 14, 1897–1927. 5 N.T. Suen S.F. Hung Q. Quan N. Zhang Y.J. Xu H.M. Chen Chem. Soc. Rev. 46 2017 337 365 N. T. Suen, S. F. Hung, Q. Quan, N. Zhang, Y. J. Xu, H. M. Chen, Chem. Soc. Rev., 2017, 46, 337–365. 6 H. Su J. Jiang S. Song B. An N. Li Y. Gao L. Ge Chin. J. Catal. 44 2023 7 49 H. Su, J. Jiang, S. Song, B. An, N. Li, Y. Gao, L. Ge, Chin. J. Catal., 2023, 44, 7–49. 7 K. Lai Y. Sun N. Li Y. Gao H. Li L. Ge T. Ma Adv. Funct. Mater. 2024 2409031 K. Lai, Y. Sun, N. Li, Y. Gao, H. Li, L. Ge, T. Ma, Adv. Funct. Mater., 2024, 2409031. 8 Y. Sun K. Lai N. Li Y. Gao L. Ge Appl. Catal. B 357 2024 124302 Y. Sun, K. Lai, N. Li, Y. Gao, L. Ge, Appl. Catal. B, 2024, 357, 124302. 9 Y. Sun K. Lai X. Shi N. Li Y. Gao L. Ge Appl. Catal. B 365 2025 124907 Y. Sun, K. Lai, X. Shi, N. Li, Y. Gao, L. Ge, Appl. Catal. B, 2025, 365, 124907. 10 W. Liu J. Dong B. An H. Su Z. Teng N. Li Y. Gao L. Ge J. Colloid Interface Sci. 673 2024 228 238 W. Liu, J. Dong, B. An, H. Su, Z. Teng, N. Li, Y. Gao, L. Ge, J. Colloid Interface Sci., 2024, 673, 228–238. 11 J. Dong B. An W. Liu H. Su N. Li Y. Gao L. Ge Chem. Eng. J. 498 2024 155102 J. Dong, B. An, W. Liu, H. Su, N. Li, Y. Gao, L. Ge, Chem. Eng. J., 2024, 498, 155102. 12 J. Dong W. Liu B. An H. Su L. Zhang N. Li Y. Gao L. Ge Sep. Purif. Technol. 342 2024 127017 J. Dong, W. Liu, B. An, H. Su, L. Zhang, N. Li, Y. Gao, L. Ge, Sep. Purif. Technol., 2024, 342, 127017. 13 N. Chen Y.M. Lee Prog. Polym. Sci. 113 2021 101345 N. Chen, Y. M. Lee, Prog. Polym. Sci., 2021, 113, 101345. 14 L. Li J. Su Y. Qiu N. Li Y. Gao L. Ge Chin. J. Struct. Chem. 43 2024 100472 L. Li, J. Su, Y. Qiu, N. Li, Y. Gao, L. Ge, Chin. J. Struct. Chem., 2024, 43,100472. 15 W. Liu Z. Teng B. An J. Dong N. Li Y. Gao L. Ge Chem. Eng. J. 504 2025 158932 W. Liu, Z. Teng, B. An, J. Dong, N. Li, Y. Gao, L. Ge, Chem. Eng. J., 2025, 504, 158932. 16 Z. Ge J. Li H. Zhang C. Liu G. Che Z. Liu Adv. Funct. Mater. 34 2024 2411024 Z. Ge, J. Li, H. Zhang, C. Liu, G. Che, Z. Liu, Adv. Funct. Mater., 2024, 34, 2411024. 17 X. Li L. Zheng S. Liu T. Ouyang S. Ye Z. Liu Chin. Chem. Lett. 33 2022 4761 4765 X. Li, L. Zheng, S. Liu, T. Ouyang, S. Ye, Z. Liu, Chin. Chem. Lett., 2022, 33, 4761–4765. 18 J. Chen Q. Long K. Xiao T. Ouyang N. Li S. Ye Z. Liu Sci. Bull. 66 2021 1063 1072 J. Chen, Q. Long, K. Xiao, T. Ouyang, N. Li, S. Ye, Z. Liu, Sci. Bull., 2021, 66, 1063–1072. 19 T. Ouyang Y. Ye C. Wu K. Xiao Z. Liu Angew. Chem. Int. Ed. 58 2019 4923 4928 T. Ouyang, Y. Ye, C. Wu, K. Xiao, Z. Liu, Angew. Chem. Int. Ed., 2019, 58, 4923–4928. 20 L. Wan J. Liu D. Lin Z. Xu Y. Zhen M. Pang Q. Xu B. Wang Energy Environ. Sci. 17 2024 3396 3408 L. Wan, J. Liu, D. Lin, Z. Xu, Y. Zhen, M. Pang, Q. Xu, B. Wang, Energy Environ. Sci., 2024, 17, 3396–3408. 21 Y. Duan L.L. Wang W.X. Zheng X.L. Zhang X.R. Wang G.J. Feng Z.Y. Yu T.B. Lu Angew. Chem. Int. Ed. 63 2024 e202413653 Y. Duan, L. L. Wang, W. X. Zheng, X. L. Zhang, X. R. Wang, G. J. Feng, Z. Y. Yu, T. B. Lu, Angew. Chem. Int. Ed., 2024, 63, e202413653. 22 J. Zhang M. Yang X. Zhu J. Dang J. Ma B. Liu T. Huang M. Ouyang F. Yang Chem. Eng. J. 476 2023 146576 J. Zhang, M. Yang, X. Zhu, J. Dang, J. Ma, B. Liu, T. Huang, M. Ouyang, F. Yang, Chem. Eng. J., 2023, 476, 146576. 23 J.E. Park S. Kim O.-H. Kim C.-Y. Ahn M.-J. Kim S.Y. Kang T.I. Jeon J.-G. Shim D.W. Lee J.H. Lee Y.-H. Cho Y.-E. Sung Nano Energy 58 2019 158 166 J. E. Park, S. Kim, O.-H. Kim, C.-Y. Ahn, M.-J. Kim, S. Y. Kang, T. I. Jeon, J.-G. Shim, D.W. Lee, J. H. Lee, Y.-H. Cho, Y.-E. Sung, Nano Energy, 2019, 58, 158–166. 24 P. Yu F. Wang T.A. Shifa X. Zhan X. Lou F. Xia J. He Nano Energy 58 2019 244 276 P. Yu, F. Wang, T. A. Shifa, X. Zhan, X. Lou, F. Xia, J. He, Nano Energy, 2019, 58, 244–276. 25 H. Du R.M. Kong X. Guo F. Qu J. Li Nanoscale 10 2018 21617 21624 H. Du, R. M. Kong, X. Guo, F. Qu, J. Li, Nanoscale, 2018, 10, 21617–21624. 26 B. Owens-Baird Y.V. Kolen’ko K. Kovnir Chem. Eur. J. 24 2018 7298 7311 B. Owens-Baird, Y. V. Kolen’ko, K. Kovnir, Chem. Eur. J., 2018, 24, 7298–7311. 27 Y. Hua Q. Xu Y. Hu H. Jiang C. Li J. Energy Chem. 37 2019 1 6 Y. Hua, Q. Xu, Y. Hu, H. Jiang, C. Li, J. Energy Chem., 2019, 37, 1–6. 28 D. Li H. Baydoun C.N. Verani S.L. Brock J. Am. Chem. Soc. 138 2016 4006 4009 D. Li, H. Baydoun, C. N. Verani, S. L. Brock, J. Am. Chem. Soc., 2016, 138, 4006–4009. 29 S. Liu B. Wang X. Zhang S. Zhao Z. Zhang H. Yu Matter 4 2021 1511 1527 S. Liu, B. Wang, X. Zhang, S. Zhao, Z. Zhang, H. Yu, Matter, 2021, 4, 1511–1527. 30 P. Yang D. Gao Y. Yang Z. Jia Y. Li J. Xia D. Yi X. Wang Y. Yang Nano Energy 125 2024 109570 P. Yang, D. Gao, Y. Yang, Z. Jia, Y. Li, J. Xia, D. Yi, X. Wang, Y. Yang, Nano Energy, 2024, 125, 109570. 31 L. Naderi S. Shahrokhian Chem. Eng. J. 456 2023 141088 L. Naderi, S. Shahrokhian, Chem. Eng. J., 2023, 456, 141088. 32 Q. Liu Y. Luo W. Chen Y. Yan L. Xue W. Zhang Chem. Eng. J. 347 2018 455 461 Q. Liu, Y. Luo, W. Chen, Y. Yan, L. Xue, W. Zhang, Chem. Eng. J., 2018, 347, 455–461. 33 X. Sun S. Zhao A. Bachmatiuk M.H. Rummeli S. Gorantla M. Zeng L. Fu Small 16 2020 2001484 X. Sun, S. Zhao, A. Bachmatiuk, M. H. Rummeli, S. Gorantla, M. Zeng, L. Fu, Small, 2020, 16, 2001484. 34 B. An J. Li X. Wu W. Li Y. Li L. Sun H. Mi Q. Zhang C. He X. Ren Nanoscale 12 2020 21770 21779 B. An, J. Li, X. Wu, W. Li, Y. Li, L. Sun, H. Mi, Q. Zhang, C. He, X. Ren, Nanoscale, 2020, 12, 21770–21779. 35 M. Kurek M. Carnoy P.E. Larsen L.H. Nielsen O. Hansen T. Rades S. Schmid A. Boisen Angew. Chem. Int. Ed. 56 2017 3901 3905 M. Kurek, M. Carnoy, P. E. Larsen, L. H. Nielsen, O. Hansen, T. Rades, S. Schmid, A. Boisen, Angew. Chem. Int. Ed., 2017, 56, 3901–3905. 36 J. Gu L. Sun Y. Zhang Q. Zhang X. Li H. Si Y. Shi C. Sun Y. Gong Y. Zhang Chem. Eng. J. 385 2020 123454 J. Gu, L. Sun, Y. Zhang, Q. Zhang, X. Li, H. Si, Y. Shi, C. Sun, Y. Gong, Y. Zhang, Chem. Eng. J., 2020, 385, 123454. 37 M. Pi T. Wu D. Zhang S. Chen S. Wang Nanoscale 8 2016 19779 19786 M. Pi, T. Wu, D. Zhang, S. Chen, S. Wang, Nanoscale, 2016, 8, 19779–19786. 38 B. An R. Bian J. Dong W. Liu H. Su N. Li Y. Gao L. Ge Chem. Eng. J. 485 2024 149903 B. An, R. Bian, J. Dong, W. Liu, H. Su, N. Li, Y. Gao, L. Ge, Chem. Eng. J., 2024, 485, 149903. 39 Y.Z. Zhang Y. Wang Y.L. Xie T. Cheng W.Y. Lai H. Pang W. Huang Nanoscale 6 2014 14354 14359 Y. Z. Zhang, Y. Wang, Y. L. Xie, T. Cheng, W. Y. Lai, H. Pang, W. Huang, Nanoscale, 2014, 6, 14354–14359. 40 J. Li F. Dou J. Gong Y. Gao Y. Hua K. Sielicki D. Zhang E. Mijowska X. Chen ACS Appl. Nano Mater. 6 2023 1171 1180 J. Li, F. Dou, J. Gong, Y. Gao, Y. Hua, K. Sielicki, D. Zhang, E. Mijowska, X. Chen, ACS Appl. Nano Mater., 2023, 6, 1171–1180. 41 X. Hong C. Deng G. Wang X. Wang W. Dong Chem. Eng. J. 451 2023 139036 X. Hong, C. Deng, G. Wang, X. Wang, W. Dong, Chem. Eng. J., 2023, 451, 139036. 42 H. Roh H. Jung H. Choi J.W. Han T. Park S. Kim K. Yong Appl. Catal. B 297 2021 120434 H. Roh, H. Jung, H. Choi, J.W. Han, T. Park, S. Kim, K. Yong, Appl. Catal. B, 2021, 297, 120434. 43 J. Loh J. Foo F. Yap H. Liang W. Ong Chin. J. Catal. 58 2024 37 85 J. Loh, J. Foo, F. Yap, H. Liang, W. Ong, Chin. J. Catal., 2024, 58, 37–85. 44 Y. Guo S. Li W. Abebe J. Wang L. Shi D. Liu S. Zhao Chin. J. Catal. 67 2024 21 53 Y. Guo, S. Li, W. Abebe, J. Wang, L. Shi, D. Liu, S. Zhao, Chin. J. Catal., 2024, 67, 21–53. 45 T. Zhao B. Gong G. Xu J. Jiang L. Zhang Chin. J. Catal. 61 2024 269 280 T. Zhao, B. Gong, G. Xu, J. Jiang, L. Zhang, Chin. J. Catal., 2024, 61, 269–280. 46 Q. Xue Z. Wang Y. Ding F. Li Y. Chen Chin. J. Catal. 45 2023 6 16 Q. Xue, Z. Wang, Y. Ding, F. Li, Y. Chen, Chin. J. Catal., 2023, 45, 6–16. 47 X. Tong Y. Li N. Pang Y. Qu C. Yan D. Xiong S. Xu L. Wang P.K. Chu Chem. Eng. J. 425 2021 130455 X. Tong, Y. Li, N. Pang, Y. Qu, C. Yan, D. Xiong, S. Xu, L. Wang, P. K. Chu, Chem. Eng. J., 2021, 425, 130455. 48 B. An W. Liu J. Dong N. Li Y. Gao L. Ge Chin. J. Catal. 65 2024 113 125 B. An, W. Liu, J. Dong, N. Li, Y. Gao, L. Ge, Chin. J. Catal., 2024, 65, 113–125. 49 L. Guo J. Chi T. Cui J. Zhu Y. Xia H. Guo J. Lai L. Wang Adv. Energy Mater. 31 2024 2400975 L. Guo, J. Chi, T. Cui, J. Zhu, Y. Xia, H. Guo, J. Lai, L. Wang, Adv. Energy Mater., 2024, 31, 2400975. 50 W.D. Chemelewski H.C. Lee J.F. Lin A.J. Bard C.B. Mullins J. Am. Chem. Soc. 136 2014 2843 2850 W. D. Chemelewski, H. C. Lee, J. F. Lin, A. J. Bard, C. B. Mullins, J. Am. Chem. Soc., 2014, 136, 2843–2850. 51 M.W. Louie A.T. Bell J. Am. Chem. Soc. 135 2013 12329 12337 M. W. Louie, A. T. Bell, J. Am. Chem. Soc., 2013, 135, 12329–12337. 52 N. Xue Z. Lin P. Li P. Diao Q. Zhang ACS Appl. Mater. Interfaces 12 2020 28288 28297 N. Xue, Z. Lin, P. Li, P. Diao, Q. Zhang, ACS Appl. Mater. Interfaces, 2020, 12, 28288–28297. 53 J. Chen L. Zhang J. Li X. He Y. Zheng S. Sun X. Fang D. Zheng Y. Luo Y. Wang J. Zhang L. Xie Z. Cai Y. Sun A.A. Alshehri Q. Kong C. Tang X. Sun J. Mater. Chem. A 11 2023 1116 1122 J. Chen, L. Zhang, J. Li, X. He, Y. Zheng, S. Sun, X. Fang, D. Zheng, Y. Luo, Y. Wang, J. Zhang, L. Xie, Z. Cai, Y. Sun, A. A. Alshehri, Q. Kong, C. Tang, X. Sun, J. Mater. Chem. A, 2023, 11, 1116–1122. 54 L. Li L. Zhang L. Gou S. Wei X. Hou L. Wu Chem. Eng. J. 454 2023 140292 L. Li, L. Zhang, L. Gou, S. Wei, X. Hou, L. Wu, Chem. Eng. J., 2023, 454, 140292. 55 B. Lan Y. Xiang X. Luo D. Wu L. Zhang J. Duan M. Guo Y. Ito Y. Liu Chem. Eng. J. 430 2022 132886 B. Lan, Y. Xiang, X. Luo, D. Wu, L. Zhang, J. Duan, M. Guo, Y. Ito, Y. Liu, Chem. Eng. J., 2022, 430, 132886. 56 M.T. Ahsan Z. Ali D. Qiu B. Zhang J.J. Wang Y. Hou Small 20 2024 2402275 M. T. Ahsan, Z. Ali, D. Qiu, B. Zhang, J. J. Wang, Y. Hou, Small, 2024, 20, 2402275. 57 Y. Zheng H. Xie J. Li K.S. Hui Z. Yu H. Xu D.A. Dinh Z. Ye C. Zha K.N. Hui Adv. Energy Mater. 14 2024 2400461 Y. Zheng, H. Xie, J. Li, K. S. Hui, Z. Yu, H. Xu, D. A. Dinh, Z. Ye, C. Zha, K. N. Hui, Adv. Energy Mater., 2024, 14, 2400461.",
      "scopus-id": "105011266476",
      "coredata": {
        "eid": "1-s2.0-S1872206725646699",
        "dc:description": "Manganese-based materials are influenced by the Jahn-Teller effect, causing the spontaneous dismutation of Mn3+ (2Mn3+ → Mn2+ + Mn4+) and the dissolution of Mn2+, which often results in diminished activity. This study uniquely employs a W doping strategy to suppress this effect. Externally, a simple template-free method was initially used to prepare cobalt- and manganese-based precursors, followed by a W doping process during the synthesis of transition bimetallic phosphides. Ultimately, W-doped bimetallic phosphides (W-CoMnP) were obtained. The W-CoMnP material demonstrates excellent HER and OER performance with low overpotentials of 95 mV (η₁₀ HER) and 225 mV (η₅₀ OER), and can achieve overall water splitting at a voltage of 1.52 V while maintaining stable cycling for 24 h. To enable commercial application, W-CoMnP was incorporated into an anion exchange membrane (AEM) electrolysis water device, demonstrating continuous and stable hydrogen production under ambient temperature conditions. This study offers a promising strategy for the future development of catalysts for AEM electrolysis water devices.",
        "openArchiveArticle": "false",
        "prism:coverDate": "2025-07-31",
        "openaccessUserLicense": null,
        "prism:aggregationType": "Journal",
        "prism:url": "https://api.elsevier.com/content/article/pii/S1872206725646699",
        "dc:creator": [
          {
            "@_fa": "true",
            "$": "An, Bohan"
          },
          {
            "@_fa": "true",
            "$": "Li, Xin"
          },
          {
            "@_fa": "true",
            "$": "Liu, Weilong"
          },
          {
            "@_fa": "true",
            "$": "Dong, Jipeng"
          },
          {
            "@_fa": "true",
            "$": "Bian, Ruichao"
          },
          {
            "@_fa": "true",
            "$": "Zhang, Luyao"
          },
          {
            "@_fa": "true",
            "$": "Li, Ning"
          },
          {
            "@_fa": "true",
            "$": "Gao, Yangqin"
          },
          {
            "@_fa": "true",
            "$": "Ge, Lei"
          }
        ],
        "link": [
          {
            "@_fa": "true",
            "@rel": "self",
            "@href": "https://api.elsevier.com/content/article/pii/S1872206725646699"
          },
          {
            "@_fa": "true",
            "@rel": "scidir",
            "@href": "https://www.sciencedirect.com/science/article/pii/S1872206725646699"
          }
        ],
        "dc:format": "application/json",
        "openaccessType": null,
        "pii": "S1872-2067(25)64669-9",
        "prism:volume": "74",
        "prism:publisher": "Dalian Institute of Chemical Physics, the Chinese Academy of Sciences. Published by Elsevier B.V. All rights are reserved, including those for text and data mining, AI training, and similar technologies.",
        "dc:title": "Developing a stable and high-performance W-CoMnP electrocatalyst by mitigating the Jahn-Teller effect through W doping strategy",
        "prism:copyright": "Copyright © 2025 Dalian Institute of Chemical Physics, the Chinese Academy of Sciences. Published by Elsevier B.V. All rights are reserved, including those for text and data mining, AI training, and similar technologies.",
        "openaccess": "0",
        "prism:issn": "18722067",
        "dcterms:subject": [
          {
            "@_fa": "true",
            "$": "Bimetallic phosphide"
          },
          {
            "@_fa": "true",
            "$": "Density functional theory calculation"
          },
          {
            "@_fa": "true",
            "$": "Jiang-Taylor effect"
          },
          {
            "@_fa": "true",
            "$": "W doping"
          },
          {
            "@_fa": "true",
            "$": "Anion exchange membrane water electrolysis device"
          }
        ],
        "openaccessArticle": "false",
        "prism:publicationName": "Chinese Journal of Catalysis",
        "openaccessSponsorType": null,
        "prism:pageRange": "264-278",
        "prism:endingPage": "278",
        "pubType": "fla",
        "prism:coverDisplayDate": "July 2025",
        "prism:doi": "10.1016/S1872-2067(25)64669-9",
        "prism:startingPage": "264",
        "dc:identifier": "doi:10.1016/S1872-2067(25)64669-9",
        "openaccessSponsorName": null
      },
      "objects": {
        "object": [
          {
            "@category": "standard",
            "@height": "139",
            "@width": "301",
            "@_fa": "true",
            "$": "https://api.elsevier.com/content/object/eid/1-s2.0-S1872206725646699-fx1.jpg?httpAccept=%2A%2F%2A",
            "@multimediatype": "JPEG image file",
            "@type": "IMAGE-DOWNSAMPLED",
            "@size": "22848",
            "@ref": "fx1",
            "@mimetype": "image/jpeg"
          },
          {
            "@category": "standard",
            "@height": "472",
            "@width": "373",
            "@_fa": "true",
            "$": "https://api.elsevier.com/content/object/eid/1-s2.0-S1872206725646699-gr1.jpg?httpAccept=%2A%2F%2A",
            "@multimediatype": "JPEG image file",
            "@type": "IMAGE-DOWNSAMPLED",
            "@size": "92336",
            "@ref": "gr1",
            "@mimetype": "image/jpeg"
          },
          {
            "@category": "standard",
            "@height": "139",
            "@width": "343",
            "@_fa": "true",
            "$": "https://api.elsevier.com/content/object/eid/1-s2.0-S1872206725646699-gr10.jpg?httpAccept=%2A%2F%2A",
            "@multimediatype": "JPEG image file",
            "@type": "IMAGE-DOWNSAMPLED",
            "@size": "22788",
            "@ref": "gr10",
            "@mimetype": "image/jpeg"
          },
          {
            "@category": "standard",
            "@height": "515",
            "@width": "660",
            "@_fa": "true",
            "$": "https://api.elsevier.com/content/object/eid/1-s2.0-S1872206725646699-gr2.jpg?httpAccept=%2A%2F%2A",
            "@multimediatype": "JPEG image file",
            "@type": "IMAGE-DOWNSAMPLED",
            "@size": "154220",
            "@ref": "gr2",
            "@mimetype": "image/jpeg"
          },
          {
            "@category": "standard",
            "@height": "504",
            "@width": "693",
            "@_fa": "true",
            "$": "https://api.elsevier.com/content/object/eid/1-s2.0-S1872206725646699-gr3.jpg?httpAccept=%2A%2F%2A",
            "@multimediatype": "JPEG image file",
            "@type": "IMAGE-DOWNSAMPLED",
            "@size": "122538",
            "@ref": "gr3",
            "@mimetype": "image/jpeg"
          },
          {
            "@category": "standard",
            "@height": "521",
            "@width": "714",
            "@_fa": "true",
            "$": "https://api.elsevier.com/content/object/eid/1-s2.0-S1872206725646699-gr4.jpg?httpAccept=%2A%2F%2A",
            "@multimediatype": "JPEG image file",
            "@type": "IMAGE-DOWNSAMPLED",
            "@size": "125826",
            "@ref": "gr4",
            "@mimetype": "image/jpeg"
          },
          {
            "@category": "standard",
            "@height": "318",
            "@width": "458",
            "@_fa": "true",
            "$": "https://api.elsevier.com/content/object/eid/1-s2.0-S1872206725646699-gr5.jpg?httpAccept=%2A%2F%2A",
            "@multimediatype": "JPEG image file",
            "@type": "IMAGE-DOWNSAMPLED",
            "@size": "56549",
            "@ref": "gr5",
            "@mimetype": "image/jpeg"
          },
          {
            "@category": "standard",
            "@height": "419",
            "@width": "614",
            "@_fa": "true",
            "$": "https://api.elsevier.com/content/object/eid/1-s2.0-S1872206725646699-gr6.jpg?httpAccept=%2A%2F%2A",
            "@multimediatype": "JPEG image file",
            "@type": "IMAGE-DOWNSAMPLED",
            "@size": "82412",
            "@ref": "gr6",
            "@mimetype": "image/jpeg"
          },
          {
            "@category": "standard",
            "@height": "676",
            "@width": "493",
            "@_fa": "true",
            "$": "https://api.elsevier.com/content/object/eid/1-s2.0-S1872206725646699-gr7.jpg?httpAccept=%2A%2F%2A",
            "@multimediatype": "JPEG image file",
            "@type": "IMAGE-DOWNSAMPLED",
            "@size": "133737",
            "@ref": "gr7",
            "@mimetype": "image/jpeg"
          },
          {
            "@category": "standard",
            "@height": "557",
            "@width": "647",
            "@_fa": "true",
            "$": "https://api.elsevier.com/content/object/eid/1-s2.0-S1872206725646699-gr8.jpg?httpAccept=%2A%2F%2A",
            "@multimediatype": "JPEG image file",
            "@type": "IMAGE-DOWNSAMPLED",
            "@size": "130660",
            "@ref": "gr8",
            "@mimetype": "image/jpeg"
          },
          {
            "@category": "standard",
            "@height": "768",
            "@width": "704",
            "@_fa": "true",
            "$": "https://api.elsevier.com/content/object/eid/1-s2.0-S1872206725646699-gr9.jpg?httpAccept=%2A%2F%2A",
            "@multimediatype": "JPEG image file",
            "@type": "IMAGE-DOWNSAMPLED",
            "@size": "174623",
            "@ref": "gr9",
            "@mimetype": "image/jpeg"
          },
          {
            "@category": "thumbnail",
            "@height": "101",
            "@width": "219",
            "@_fa": "true",
            "$": "https://api.elsevier.com/content/object/eid/1-s2.0-S1872206725646699-fx1.sml?httpAccept=%2A%2F%2A",
            "@multimediatype": "GIF image file",
            "@type": "IMAGE-THUMBNAIL",
            "@size": "9495",
            "@ref": "fx1",
            "@mimetype": "image/gif"
          },
          {
            "@category": "thumbnail",
            "@height": "163",
            "@width": "129",
            "@_fa": "true",
            "$": "https://api.elsevier.com/content/object/eid/1-s2.0-S1872206725646699-gr1.sml?httpAccept=%2A%2F%2A",
            "@multimediatype": "GIF image file",
            "@type": "IMAGE-THUMBNAIL",
            "@size": "17596",
            "@ref": "gr1",
            "@mimetype": "image/gif"
          },
          {
            "@category": "thumbnail",
            "@height": "88",
            "@width": "219",
            "@_fa": "true",
            "$": "https://api.elsevier.com/content/object/eid/1-s2.0-S1872206725646699-gr10.sml?httpAccept=%2A%2F%2A",
            "@multimediatype": "GIF image file",
            "@type": "IMAGE-THUMBNAIL",
            "@size": "7264",
            "@ref": "gr10",
            "@mimetype": "image/gif"
          },
          {
            "@category": "thumbnail",
            "@height": "164",
            "@width": "210",
            "@_fa": "true",
            "$": "https://api.elsevier.com/content/object/eid/1-s2.0-S1872206725646699-gr2.sml?httpAccept=%2A%2F%2A",
            "@multimediatype": "GIF image file",
            "@type": "IMAGE-THUMBNAIL",
            "@size": "14358",
            "@ref": "gr2",
            "@mimetype": "image/gif"
          },
          {
            "@category": "thumbnail",
            "@height": "159",
            "@width": "219",
            "@_fa": "true",
            "$": "https://api.elsevier.com/content/object/eid/1-s2.0-S1872206725646699-gr3.sml?httpAccept=%2A%2F%2A",
            "@multimediatype": "GIF image file",
            "@type": "IMAGE-THUMBNAIL",
            "@size": "12598",
            "@ref": "gr3",
            "@mimetype": "image/gif"
          },
          {
            "@category": "thumbnail",
            "@height": "160",
            "@width": "219",
            "@_fa": "true",
            "$": "https://api.elsevier.com/content/object/eid/1-s2.0-S1872206725646699-gr4.sml?httpAccept=%2A%2F%2A",
            "@multimediatype": "GIF image file",
            "@type": "IMAGE-THUMBNAIL",
            "@size": "12439",
            "@ref": "gr4",
            "@mimetype": "image/gif"
          },
          {
            "@category": "thumbnail",
            "@height": "152",
            "@width": "219",
            "@_fa": "true",
            "$": "https://api.elsevier.com/content/object/eid/1-s2.0-S1872206725646699-gr5.sml?httpAccept=%2A%2F%2A",
            "@multimediatype": "GIF image file",
            "@type": "IMAGE-THUMBNAIL",
            "@size": "10444",
            "@ref": "gr5",
            "@mimetype": "image/gif"
          },
          {
            "@category": "thumbnail",
            "@height": "149",
            "@width": "219",
            "@_fa": "true",
            "$": "https://api.elsevier.com/content/object/eid/1-s2.0-S1872206725646699-gr6.sml?httpAccept=%2A%2F%2A",
            "@multimediatype": "GIF image file",
            "@type": "IMAGE-THUMBNAIL",
            "@size": "11609",
            "@ref": "gr6",
            "@mimetype": "image/gif"
          },
          {
            "@category": "thumbnail",
            "@height": "163",
            "@width": "119",
            "@_fa": "true",
            "$": "https://api.elsevier.com/content/object/eid/1-s2.0-S1872206725646699-gr7.sml?httpAccept=%2A%2F%2A",
            "@multimediatype": "GIF image file",
            "@type": "IMAGE-THUMBNAIL",
            "@size": "11062",
            "@ref": "gr7",
            "@mimetype": "image/gif"
          },
          {
            "@category": "thumbnail",
            "@height": "163",
            "@width": "190",
            "@_fa": "true",
            "$": "https://api.elsevier.com/content/object/eid/1-s2.0-S1872206725646699-gr8.sml?httpAccept=%2A%2F%2A",
            "@multimediatype": "GIF image file",
            "@type": "IMAGE-THUMBNAIL",
            "@size": "11870",
            "@ref": "gr8",
            "@mimetype": "image/gif"
          },
          {
            "@category": "thumbnail",
            "@height": "164",
            "@width": "150",
            "@_fa": "true",
            "$": "https://api.elsevier.com/content/object/eid/1-s2.0-S1872206725646699-gr9.sml?httpAccept=%2A%2F%2A",
            "@multimediatype": "GIF image file",
            "@type": "IMAGE-THUMBNAIL",
            "@size": "9938",
            "@ref": "gr9",
            "@mimetype": "image/gif"
          },
          {
            "@category": "high",
            "@height": "370",
            "@width": "800",
            "@_fa": "true",
            "$": "https://api.elsevier.com/content/object/eid/1-s2.0-S1872206725646699-fx1_lrg.jpg?httpAccept=%2A%2F%2A",
            "@multimediatype": "JPEG image file",
            "@type": "IMAGE-HIGH-RES",
            "@size": "89885",
            "@ref": "fx1",
            "@mimetype": "image/jpeg"
          },
          {
            "@category": "high",
            "@height": "1255",
            "@width": "991",
            "@_fa": "true",
            "$": "https://api.elsevier.com/content/object/eid/1-s2.0-S1872206725646699-gr1_lrg.jpg?httpAccept=%2A%2F%2A",
            "@multimediatype": "JPEG image file",
            "@type": "IMAGE-HIGH-RES",
            "@size": "501648",
            "@ref": "gr1",
            "@mimetype": "image/jpeg"
          },
          {
            "@category": "high",
            "@height": "368",
            "@width": "911",
            "@_fa": "true",
            "$": "https://api.elsevier.com/content/object/eid/1-s2.0-S1872206725646699-gr10_lrg.jpg?httpAccept=%2A%2F%2A",
            "@multimediatype": "JPEG image file",
            "@type": "IMAGE-HIGH-RES",
            "@size": "81501",
            "@ref": "gr10",
            "@mimetype": "image/jpeg"
          },
          {
            "@category": "high",
            "@height": "1368",
            "@width": "1753",
            "@_fa": "true",
            "$": "https://api.elsevier.com/content/object/eid/1-s2.0-S1872206725646699-gr2_lrg.jpg?httpAccept=%2A%2F%2A",
            "@multimediatype": "JPEG image file",
            "@type": "IMAGE-HIGH-RES",
            "@size": "622975",
            "@ref": "gr2",
            "@mimetype": "image/jpeg"
          },
          {
            "@category": "high",
            "@height": "1337",
            "@width": "1840",
            "@_fa": "true",
            "$": "https://api.elsevier.com/content/object/eid/1-s2.0-S1872206725646699-gr3_lrg.jpg?httpAccept=%2A%2F%2A",
            "@multimediatype": "JPEG image file",
            "@type": "IMAGE-HIGH-RES",
            "@size": "494584",
            "@ref": "gr3",
            "@mimetype": "image/jpeg"
          },
          {
            "@category": "high",
            "@height": "1383",
            "@width": "1896",
            "@_fa": "true",
            "$": "https://api.elsevier.com/content/object/eid/1-s2.0-S1872206725646699-gr4_lrg.jpg?httpAccept=%2A%2F%2A",
            "@multimediatype": "JPEG image file",
            "@type": "IMAGE-HIGH-RES",
            "@size": "492661",
            "@ref": "gr4",
            "@mimetype": "image/jpeg"
          },
          {
            "@category": "high",
            "@height": "845",
            "@width": "1218",
            "@_fa": "true",
            "$": "https://api.elsevier.com/content/object/eid/1-s2.0-S1872206725646699-gr5_lrg.jpg?httpAccept=%2A%2F%2A",
            "@multimediatype": "JPEG image file",
            "@type": "IMAGE-HIGH-RES",
            "@size": "238959",
            "@ref": "gr5",
            "@mimetype": "image/jpeg"
          },
          {
            "@category": "high",
            "@height": "1112",
            "@width": "1631",
            "@_fa": "true",
            "$": "https://api.elsevier.com/content/object/eid/1-s2.0-S1872206725646699-gr6_lrg.jpg?httpAccept=%2A%2F%2A",
            "@multimediatype": "JPEG image file",
            "@type": "IMAGE-HIGH-RES",
            "@size": "325357",
            "@ref": "gr6",
            "@mimetype": "image/jpeg"
          },
          {
            "@category": "high",
            "@height": "1796",
            "@width": "1309",
            "@_fa": "true",
            "$": "https://api.elsevier.com/content/object/eid/1-s2.0-S1872206725646699-gr7_lrg.jpg?httpAccept=%2A%2F%2A",
            "@multimediatype": "JPEG image file",
            "@type": "IMAGE-HIGH-RES",
            "@size": "546921",
            "@ref": "gr7",
            "@mimetype": "image/jpeg"
          },
          {
            "@category": "high",
            "@height": "1479",
            "@width": "1719",
            "@_fa": "true",
            "$": "https://api.elsevier.com/content/object/eid/1-s2.0-S1872206725646699-gr8_lrg.jpg?httpAccept=%2A%2F%2A",
            "@multimediatype": "JPEG image file",
            "@type": "IMAGE-HIGH-RES",
            "@size": "510252",
            "@ref": "gr8",
            "@mimetype": "image/jpeg"
          },
          {
            "@category": "high",
            "@height": "2040",
            "@width": "1870",
            "@_fa": "true",
            "$": "https://api.elsevier.com/content/object/eid/1-s2.0-S1872206725646699-gr9_lrg.jpg?httpAccept=%2A%2F%2A",
            "@multimediatype": "JPEG image file",
            "@type": "IMAGE-HIGH-RES",
            "@size": "684256",
            "@ref": "gr9",
            "@mimetype": "image/jpeg"
          },
          {
            "@category": "standard",
            "@_fa": "true",
            "$": "https://api.elsevier.com/content/object/eid/1-s2.0-S1872206725646699-mmc1.pdf?httpAccept=%2A%2F%2A",
            "@multimediatype": "Acrobat PDF file",
            "@type": "APPLICATION",
            "@size": "15720506",
            "@ref": "mmc1",
            "@mimetype": "application/pdf"
          }
        ]
      },
      "link": {
        "@rel": "abstract",
        "@href": "https://api.elsevier.com/content/abstract/scopus_id/105011266476"
      }
    }
  }
}