{
  "metadata": {
    "title": "Induced growth of Fe-N<ce:inf loc=post><ce:italic>x</ce:italic></ce:inf> active sites using carbon templates",
    "authors": "; ; ",
    "journal": "Chinese Journal of Catalysis",
    "date": "2018-08-31",
    "doi": "10.1016/S1872-2067(18)63107-9",
    "abstract": "",
    "uri": "https://api.elsevier.com/content/article/pii/S1872206718631079",
    "pii": "S1872206718631079"
  },
  "fulltext": {
    "full-text-retrieval-response": {
      "scopus-eid": "2-s2.0-85049532719",
      "originalText": "serial JL 273538 291210 291744 291809 31 Chinese Journal of Catalysis CHINESEJOURNALCATALYSIS 2018-07-09 2018-07-09 2018-07-09 2018-07-09 2018-07-09T20:04:52 1-s2.0-S1872206718631079 S1872-2067(18)63107-9 S1872206718631079 10.1016/S1872-2067(18)63107-9 S300 S300.1 FULL-TEXT 1-s2.0-S1872206718X00102 2018-07-09T21:08:47.932279Z 0 0 20180801 20180831 2018 2018-07-09T20:27:58.60023Z absattachment articleinfo articletitlenorm authfirstinitialnorm authfirstsurnamenorm cid cids contenttype copyright crossmark dateloaded dateloadedtxt datesearch datesort dateupdated dco docsubtype doctype doi eid ewtransactionid hubeid indexeddate issfirst issn issnnorm issuelist itemstage itemtransactionid itemweight openaccess openarchive pg pgfirst pglast pii piinorm pubdateend pubdatestart pubdatetxt pubyr sortorder srctitle srctitlenorm srctype ssids alllist content subj subheadings tomb volfirst volissue volumelist webpdf webpdfpagecount yearnav figure table e-component body affil appendices articletitle auth authfirstini authfull authkeywords authlast grantnumber grantsponsor primabst pubtype ref specialabst 1872-2067 18722067 true 39 39 8 8 Volume 39, Issue 8 17 1427 1435 1427 1435 201808 August 2018 2018-08-01 2018-08-31 2018 article fla Copyright © 2018 Dalian Institute of Chemical Physics, the Chinese Academy of Sciences. Published by Elsevier B.V. All rights reserved. INDUCEDGROWTHFENXACTIVESITESUSINGCARBONTEMPLATES ZHANG S 1 Introduction 2 Experimental 2.1 Preparation and characterization of the catalysts 2.2 Electrochemical measurements 2.3 Calculation of the specific activity, mass activity, and turnover frequency 3 Results and discussion 4 Conclusions Supplementary Material References SHAO 2016 3594 3657 M WANG 2017 6144 6149 W WANG 2016 12768 12773 W XIE 2016 39 47 Y JIA 2017 7893 7903 Q LI 2017 1384 1387 J LI 2016 2418 2432 J BYON 2011 21437 21445 H ZHANG 2013 3302 3308 S ZHANG 2013 18482 18490 S LIU 2014 147 153 S ZHU 2014 10673 10677 Y DOMINGUEZ 2015 24487 24494 C FERRANDON 2012 16001 16013 M GUMECI 2015 21494 21500 C CAO 2013 2076 R WEI 2014 6659 6663 P ZHANG 2015 10013 10019 S CHEON 2013 2715 J GONG 2009 760 764 K WU 2013 1878 1889 G ZHANG 2015 10851 10857 J WANG 2017 7641 7649 M HE 2017 1930 1934 D LIU 2012 313 320 Q CHEN 2016 1922 1930 C PANOMSUWAN 2016 114553 114559 G CHEN 2017 201 209 Y KRAMM 2011 23417 23427 U PEREZALONSO 2016 204 211 F SUN 2017 51 55 T GU 2016 539 548 L SHI 2016 1103 1108 W CHEN 2016 1166 1171 Y KONG 2017 951 969 J CHEN 2017 673 682 C DENG 2013 371 375 D DODELET 2014 1866 1867 J HU 2014 3675 3679 Y WU 2015 8179 8183 Z YANG 2015 1436 1439 W SA 2016 15046 15056 Y TESSONNIER 2011 824 847 J WU 2006 164 170 X SUMPTER 2009 97 118 B LIANG 2013 16002 16005 H ZHANGX2018X1427 ZHANGX2018X1427X1435 ZHANGX2018X1427XS ZHANGX2018X1427X1435XS 2020-07-09T00:00:00.000Z 2020-07-09T00:00:00.000Z item S1872-2067(18)63107-9 S1872206718631079 1-s2.0-S1872206718631079 10.1016/S1872-2067(18)63107-9 273538 2018-07-09T19:27:58.60023Z 2018-08-01 2018-08-31 1-s2.0-S1872206718631079-main.pdf https://s3-eu-west-1.amazonaws.com/prod-ucs-content-store-eu-west/content/pii:S1872206718631079/MAIN/application/pdf/fd51da12f9b97d77b9a58eb412b9f50f/main.pdf https://s3.amazonaws.com/prod-ucs-content-store-us-east/content/pii:S1872206718631079/MAIN/application/pdf/fd51da12f9b97d77b9a58eb412b9f50f/main.pdf main.pdf pdf true 1752301 MAIN 9 1-s2.0-S1872206718631079-main_1.png https://s3-eu-west-1.amazonaws.com/prod-ucs-content-store-eu-west/content/pii:S1872206718631079/PREVIEW/image/png/a6363313c17a47ca412ceecdd08a1926/main_1.png https://s3.amazonaws.com/prod-ucs-content-store-us-east/content/pii:S1872206718631079/PREVIEW/image/png/a6363313c17a47ca412ceecdd08a1926/main_1.png main_1.png png 49232 849 656 IMAGE-WEB-PDF 1 1-s2.0-S1872206718631079-fx1.sml https://s3-eu-west-1.amazonaws.com/prod-ucs-content-store-eu-west/content/pii:S1872206718631079/fx1/THUMBNAIL/image/gif/76257529941223ea0951b31244b4c656/fx1.sml https://s3.amazonaws.com/prod-ucs-content-store-us-east/content/pii:S1872206718631079/fx1/THUMBNAIL/image/gif/76257529941223ea0951b31244b4c656/fx1.sml fx1 true fx1.sml sml 18125 162 219 IMAGE-THUMBNAIL 1-s2.0-S1872206718631079-gr1.sml https://s3-eu-west-1.amazonaws.com/prod-ucs-content-store-eu-west/content/pii:S1872206718631079/gr1/THUMBNAIL/image/gif/60a756826061ffc55935c42a2e84bc3a/gr1.sml https://s3.amazonaws.com/prod-ucs-content-store-us-east/content/pii:S1872206718631079/gr1/THUMBNAIL/image/gif/60a756826061ffc55935c42a2e84bc3a/gr1.sml gr1 gr1.sml sml 10122 40 219 IMAGE-THUMBNAIL 1-s2.0-S1872206718631079-gr2.sml https://s3-eu-west-1.amazonaws.com/prod-ucs-content-store-eu-west/content/pii:S1872206718631079/gr2/THUMBNAIL/image/gif/91a05386a0ec0d420c777009314aefe2/gr2.sml https://s3.amazonaws.com/prod-ucs-content-store-us-east/content/pii:S1872206718631079/gr2/THUMBNAIL/image/gif/91a05386a0ec0d420c777009314aefe2/gr2.sml gr2 gr2.sml sml 9616 110 219 IMAGE-THUMBNAIL 1-s2.0-S1872206718631079-gr3.sml https://s3-eu-west-1.amazonaws.com/prod-ucs-content-store-eu-west/content/pii:S1872206718631079/gr3/THUMBNAIL/image/gif/3c5a01f748f8487ec2acd9049e965f46/gr3.sml https://s3.amazonaws.com/prod-ucs-content-store-us-east/content/pii:S1872206718631079/gr3/THUMBNAIL/image/gif/3c5a01f748f8487ec2acd9049e965f46/gr3.sml gr3 gr3.sml sml 13112 153 219 IMAGE-THUMBNAIL 1-s2.0-S1872206718631079-gr4.sml https://s3-eu-west-1.amazonaws.com/prod-ucs-content-store-eu-west/content/pii:S1872206718631079/gr4/THUMBNAIL/image/gif/5758d995704d14aa6abd98117ec20c53/gr4.sml https://s3.amazonaws.com/prod-ucs-content-store-us-east/content/pii:S1872206718631079/gr4/THUMBNAIL/image/gif/5758d995704d14aa6abd98117ec20c53/gr4.sml gr4 gr4.sml sml 15761 164 209 IMAGE-THUMBNAIL 1-s2.0-S1872206718631079-gr5.sml https://s3-eu-west-1.amazonaws.com/prod-ucs-content-store-eu-west/content/pii:S1872206718631079/gr5/THUMBNAIL/image/gif/84b34f415662279892a201e1a4fe5d64/gr5.sml https://s3.amazonaws.com/prod-ucs-content-store-us-east/content/pii:S1872206718631079/gr5/THUMBNAIL/image/gif/84b34f415662279892a201e1a4fe5d64/gr5.sml gr5 gr5.sml sml 9973 79 219 IMAGE-THUMBNAIL 1-s2.0-S1872206718631079-gr6.sml https://s3-eu-west-1.amazonaws.com/prod-ucs-content-store-eu-west/content/pii:S1872206718631079/gr6/THUMBNAIL/image/gif/39234a03b33d79c315e3e67ea81dd5d8/gr6.sml https://s3.amazonaws.com/prod-ucs-content-store-us-east/content/pii:S1872206718631079/gr6/THUMBNAIL/image/gif/39234a03b33d79c315e3e67ea81dd5d8/gr6.sml gr6 gr6.sml sml 6603 79 219 IMAGE-THUMBNAIL 1-s2.0-S1872206718631079-gr7.sml https://s3-eu-west-1.amazonaws.com/prod-ucs-content-store-eu-west/content/pii:S1872206718631079/gr7/THUMBNAIL/image/gif/15e69d353350977ba209b6a969b10e5b/gr7.sml https://s3.amazonaws.com/prod-ucs-content-store-us-east/content/pii:S1872206718631079/gr7/THUMBNAIL/image/gif/15e69d353350977ba209b6a969b10e5b/gr7.sml gr7 gr7.sml sml 8157 57 219 IMAGE-THUMBNAIL 1-s2.0-S1872206718631079-fx1.jpg https://s3-eu-west-1.amazonaws.com/prod-ucs-content-store-eu-west/content/pii:S1872206718631079/fx1/DOWNSAMPLED/image/jpeg/4ba968a793163b9640b84a1fb557e350/fx1.jpg https://s3.amazonaws.com/prod-ucs-content-store-us-east/content/pii:S1872206718631079/fx1/DOWNSAMPLED/image/jpeg/4ba968a793163b9640b84a1fb557e350/fx1.jpg fx1 true fx1.jpg jpg 40160 223 301 IMAGE-DOWNSAMPLED 1-s2.0-S1872206718631079-gr1.jpg https://s3-eu-west-1.amazonaws.com/prod-ucs-content-store-eu-west/content/pii:S1872206718631079/gr1/DOWNSAMPLED/image/jpeg/a7e12a903ccd5f817f7608a3ffe6dd78/gr1.jpg https://s3.amazonaws.com/prod-ucs-content-store-us-east/content/pii:S1872206718631079/gr1/DOWNSAMPLED/image/jpeg/a7e12a903ccd5f817f7608a3ffe6dd78/gr1.jpg gr1 gr1.jpg jpg 52663 140 765 IMAGE-DOWNSAMPLED 1-s2.0-S1872206718631079-gr2.jpg https://s3-eu-west-1.amazonaws.com/prod-ucs-content-store-eu-west/content/pii:S1872206718631079/gr2/DOWNSAMPLED/image/jpeg/63097011b98faa23daefe5edb709f431/gr2.jpg https://s3.amazonaws.com/prod-ucs-content-store-us-east/content/pii:S1872206718631079/gr2/DOWNSAMPLED/image/jpeg/63097011b98faa23daefe5edb709f431/gr2.jpg gr2 gr2.jpg jpg 84747 380 754 IMAGE-DOWNSAMPLED 1-s2.0-S1872206718631079-gr3.jpg https://s3-eu-west-1.amazonaws.com/prod-ucs-content-store-eu-west/content/pii:S1872206718631079/gr3/DOWNSAMPLED/image/jpeg/25bfa20901d20f82dd729f10292ac672/gr3.jpg https://s3.amazonaws.com/prod-ucs-content-store-us-east/content/pii:S1872206718631079/gr3/DOWNSAMPLED/image/jpeg/25bfa20901d20f82dd729f10292ac672/gr3.jpg gr3 gr3.jpg jpg 46690 252 361 IMAGE-DOWNSAMPLED 1-s2.0-S1872206718631079-gr4.jpg https://s3-eu-west-1.amazonaws.com/prod-ucs-content-store-eu-west/content/pii:S1872206718631079/gr4/DOWNSAMPLED/image/jpeg/412cce8b368eca80aabd846d8117dc8d/gr4.jpg https://s3.amazonaws.com/prod-ucs-content-store-us-east/content/pii:S1872206718631079/gr4/DOWNSAMPLED/image/jpeg/412cce8b368eca80aabd846d8117dc8d/gr4.jpg gr4 gr4.jpg jpg 126441 538 687 IMAGE-DOWNSAMPLED 1-s2.0-S1872206718631079-gr5.jpg https://s3-eu-west-1.amazonaws.com/prod-ucs-content-store-eu-west/content/pii:S1872206718631079/gr5/DOWNSAMPLED/image/jpeg/1ece5135b26548f307f512ec669861bd/gr5.jpg https://s3.amazonaws.com/prod-ucs-content-store-us-east/content/pii:S1872206718631079/gr5/DOWNSAMPLED/image/jpeg/1ece5135b26548f307f512ec669861bd/gr5.jpg gr5 gr5.jpg jpg 75770 277 766 IMAGE-DOWNSAMPLED 1-s2.0-S1872206718631079-gr6.jpg https://s3-eu-west-1.amazonaws.com/prod-ucs-content-store-eu-west/content/pii:S1872206718631079/gr6/DOWNSAMPLED/image/jpeg/43040e1b5caac740c0a9daf5367a7c0a/gr6.jpg https://s3.amazonaws.com/prod-ucs-content-store-us-east/content/pii:S1872206718631079/gr6/DOWNSAMPLED/image/jpeg/43040e1b5caac740c0a9daf5367a7c0a/gr6.jpg gr6 gr6.jpg jpg 39568 258 713 IMAGE-DOWNSAMPLED 1-s2.0-S1872206718631079-gr7.jpg https://s3-eu-west-1.amazonaws.com/prod-ucs-content-store-eu-west/content/pii:S1872206718631079/gr7/DOWNSAMPLED/image/jpeg/efd7a3fbd6270f1897d7949caab0dcd9/gr7.jpg https://s3.amazonaws.com/prod-ucs-content-store-us-east/content/pii:S1872206718631079/gr7/DOWNSAMPLED/image/jpeg/efd7a3fbd6270f1897d7949caab0dcd9/gr7.jpg gr7 gr7.jpg jpg 24946 95 367 IMAGE-DOWNSAMPLED 1-s2.0-S1872206718631079-fx1_lrg.jpg https://s3-eu-west-1.amazonaws.com/prod-ucs-content-store-eu-west/content/pii:S1872206718631079/fx1/HIGHRES/image/jpeg/7b89b62536c8458c4f4fc4a84ee701eb/fx1_lrg.jpg https://s3.amazonaws.com/prod-ucs-content-store-us-east/content/pii:S1872206718631079/fx1/HIGHRES/image/jpeg/7b89b62536c8458c4f4fc4a84ee701eb/fx1_lrg.jpg fx1 true fx1_lrg.jpg jpg 122121 592 800 IMAGE-HIGH-RES 1-s2.0-S1872206718631079-gr1_lrg.jpg https://s3-eu-west-1.amazonaws.com/prod-ucs-content-store-eu-west/content/pii:S1872206718631079/gr1/HIGHRES/image/jpeg/ca06e7aa1bded9fe0cecbc46ce556335/gr1_lrg.jpg https://s3.amazonaws.com/prod-ucs-content-store-us-east/content/pii:S1872206718631079/gr1/HIGHRES/image/jpeg/ca06e7aa1bded9fe0cecbc46ce556335/gr1_lrg.jpg gr1 gr1_lrg.jpg jpg 219861 373 2032 IMAGE-HIGH-RES 1-s2.0-S1872206718631079-gr2_lrg.jpg https://s3-eu-west-1.amazonaws.com/prod-ucs-content-store-eu-west/content/pii:S1872206718631079/gr2/HIGHRES/image/jpeg/5e6f69b482635fdefa86d38bb3cbd52c/gr2_lrg.jpg https://s3.amazonaws.com/prod-ucs-content-store-us-east/content/pii:S1872206718631079/gr2/HIGHRES/image/jpeg/5e6f69b482635fdefa86d38bb3cbd52c/gr2_lrg.jpg gr2 gr2_lrg.jpg jpg 336777 1009 2003 IMAGE-HIGH-RES 1-s2.0-S1872206718631079-gr3_lrg.jpg https://s3-eu-west-1.amazonaws.com/prod-ucs-content-store-eu-west/content/pii:S1872206718631079/gr3/HIGHRES/image/jpeg/25ffb6cb4d9c454b4bb640d5759c0bcf/gr3_lrg.jpg https://s3.amazonaws.com/prod-ucs-content-store-us-east/content/pii:S1872206718631079/gr3/HIGHRES/image/jpeg/25ffb6cb4d9c454b4bb640d5759c0bcf/gr3_lrg.jpg gr3 gr3_lrg.jpg jpg 151176 669 960 IMAGE-HIGH-RES 1-s2.0-S1872206718631079-gr4_lrg.jpg https://s3-eu-west-1.amazonaws.com/prod-ucs-content-store-eu-west/content/pii:S1872206718631079/gr4/HIGHRES/image/jpeg/ea5461bb91562e06c4d07469edd64903/gr4_lrg.jpg https://s3.amazonaws.com/prod-ucs-content-store-us-east/content/pii:S1872206718631079/gr4/HIGHRES/image/jpeg/ea5461bb91562e06c4d07469edd64903/gr4_lrg.jpg gr4 gr4_lrg.jpg jpg 506476 1430 1826 IMAGE-HIGH-RES 1-s2.0-S1872206718631079-gr5_lrg.jpg https://s3-eu-west-1.amazonaws.com/prod-ucs-content-store-eu-west/content/pii:S1872206718631079/gr5/HIGHRES/image/jpeg/de416f44bfcbfebe036e0b221a318e8d/gr5_lrg.jpg https://s3.amazonaws.com/prod-ucs-content-store-us-east/content/pii:S1872206718631079/gr5/HIGHRES/image/jpeg/de416f44bfcbfebe036e0b221a318e8d/gr5_lrg.jpg gr5 gr5_lrg.jpg jpg 295212 736 2036 IMAGE-HIGH-RES 1-s2.0-S1872206718631079-gr6_lrg.jpg https://s3-eu-west-1.amazonaws.com/prod-ucs-content-store-eu-west/content/pii:S1872206718631079/gr6/HIGHRES/image/jpeg/bd617e7887d8b0a1521abdb36b8fbc34/gr6_lrg.jpg https://s3.amazonaws.com/prod-ucs-content-store-us-east/content/pii:S1872206718631079/gr6/HIGHRES/image/jpeg/bd617e7887d8b0a1521abdb36b8fbc34/gr6_lrg.jpg gr6 gr6_lrg.jpg jpg 122743 687 1895 IMAGE-HIGH-RES 1-s2.0-S1872206718631079-gr7_lrg.jpg https://s3-eu-west-1.amazonaws.com/prod-ucs-content-store-eu-west/content/pii:S1872206718631079/gr7/HIGHRES/image/jpeg/47a40015a034dc3d40cf2aa01453eff9/gr7_lrg.jpg https://s3.amazonaws.com/prod-ucs-content-store-us-east/content/pii:S1872206718631079/gr7/HIGHRES/image/jpeg/47a40015a034dc3d40cf2aa01453eff9/gr7_lrg.jpg gr7 gr7_lrg.jpg jpg 64009 252 976 IMAGE-HIGH-RES 1-s2.0-S1872206718631079-mmc1.pdf https://s3-eu-west-1.amazonaws.com/prod-ucs-content-store-eu-west/content/pii:S1872206718631079/mmc1/MAIN/application/pdf/dcf743c57d9f8b554e650f59d9c59b63/mmc1.pdf https://s3.amazonaws.com/prod-ucs-content-store-us-east/content/pii:S1872206718631079/mmc1/MAIN/application/pdf/dcf743c57d9f8b554e650f59d9c59b63/mmc1.pdf mmc1 mmc1.pdf pdf false 204275 APPLICATION CHNJC 63107 S1872-2067(18)63107-9 10.1016/S1872-2067(18)63107-9 Dalian Institute of Chemical Physics, the Chinese Academy of Sciences Fig. 1 SEM (a) and TEM (b) images of FeN-CNT/CS; SEM image of FeN-CNT (c); TEM image of N-CS (d). Fig. 2 (a) Polarization curves for the ORR activities of FeN-CNT/CS, FeN-CNT, and N-CS. (b) K-L plots of FeN-CNT/CS at different potentials relative to Pt/C at 0.8 V. (c) RRDE experiments and (d) electron transfer number and H2O2 yield of the FeN-CNT/CS catalyst. (e) Chronoamperometry and (f) ORR polarization curves of FeN-CNT/CS in the absence and presence of 0.1 mol/L methanol relative to Pt/C. All measurements were performed at an electrode rotation speed of 1600 r/min in oxygen-saturated 0.1 mol/L KOH. Fig. 3 XRD patterns of FeN-CNT/CS, FeN-CNT, and N-CS. Fig. 4 N 1s XPS spectra of FeN-CNT/CS (a), FeN-CNT (b), and N-CS (c); (d) Fe 2p XPS spectra of FeN-CNT/CS and FeN-CNT. Fig. 5 57Fe Mössbauer spectra of FeN-CNT/CS (a) and FeN-CNT (b). Fig. 6 (a) The mass activities of FeN-CNT/CS, FeN-CNT, and N-CS. (b) The calculated TOFs for FeN-CNT/CS and FeN-CNT per possible active site at 0.75 V (vs. RHE) in alkaline media. Scheme 1 Synthetic scheme for the preparation of FeN-CNT/CS and FeN-CNT Fe-N x doped catalysts. Table 1 The BSA and TPV values determined from the N2 adsorption-desorption isotherms, and the N and Fe speciation results from XPS analysis for the three different nanocarbons. Sample S BET (m2/g) Total pore volume (cm3/g) N (at%) Fe (at%) Pyridinic N Pyrrolic N Quaternary N “N–O” Fe0 Fe2+/3+ FeN-CNT/CS 177 0.41 0.59 0.25 0.12 0.14 0.097 0.296 FeN-CNT 68 0.21 1.79 1.29 0.96 0.44 0.660 0.780 N-CS 160 0.36 0.37 0.18 0.06 0.08 / / Table 2 Mössbauer parameters for the fitted lines and their assignments of FeN-CNT/CS and FeN-CNT. Sample δiso E Q H 0 Real area A (%) Assignment Ref. FeN-CNT/CS Singlet −0.09 0.00 0.00 15.8 Superparamagnetic [9,14,29,42] Doublet1 1.01 1.57 0.00 23.6 Fe-N4 [9,14,42] Doublet2 −0.76 2.14 0.00 2.3 Fe-N4 [9,14,42] Sextet1 −0.004 0.03 32.61 8.7 α-Fe [9,42] Sextet2 0.17 3.99 15.53 49.64 Fe-nitrides [9,14,29] FeN-CNT Singlet −0.08 0.00 0.00 23.2 Superparamagnetic [9,14,29,42] Doublet1 0.39 0.94 0.00 1.8 Fe-N4 [9,14,42] Doublet2 1.05 1.71 0.00 8.3 Fe-N4 [9,14,42] Sextet1 0.002 0.01 32.40 46.2 α-Fe [9,42] Sextet2 0.36 −0.28 24.20 5.7 Fe-nitrides [9,14,29] Sextet3 0.24 0.10 20.20 14.8 Fe-carbides [9,14,42] This work was supported by the National Natural Science Foundation of China (21606149, 2163308), the China Postdoctoral Science Foundation (2016M591678), the Shanghai Rising-Star Program (18QB1404400), and the Shanghai Scientific Research Project (18511110803). Published 5 August 2018 Article Induced growth of Fe-N x active sites using carbon templates Shiming Zhang a b c Heyou Zhang b Weimin Zhang a Xianxia Yuan a Shengli Chen b * Zi-Feng Ma a c # a Department of Chemical Engineering, Shanghai Electrochemical Energy Devices Research Center, Shanghai Jiao Tong University, Shanghai 200240, China Department of Chemical Engineering Shanghai Electrochemical Energy Devices Research Center Shanghai Jiao Tong University Shanghai 200240 China b College of Chemistry and Molecular Sciences, Hubei Key Laboratory of Electrochemical Power Sources, Key Laboratory of Analytical Chemistry for Biology and Medicine (Ministry of Education), Wuhan University, Wuhan 430072, Hubei, China College of Chemistry and Molecular Sciences Hubei Key Laboratory of Electrochemical Power Sources Key Laboratory of Analytical Chemistry for Biology and Medicine (Ministry of Education) Wuhan University Wuhan Hubei 430072 China c Sinopoly Battery Research Center, Shanghai Sinopoly Jiahua Battery Technology Co., Ltd., Shanghai 200241, China Sinopoly Battery Research Center Shanghai Sinopoly Jiahua Battery Technology Co., Ltd. Shanghai 200241 China * Corresponding author. Tel/Fax: +86-27-68754693 Tel/Fax: +86-27-68754693 # Corresponding author. Tel: +86-21-54742894; Fax: +86-21-54741297 Tel: +86-21-54742894; Fax: +86-21-54741297 Highly active Fe-N x sites that effectively improve the performance of non-precious metal electrocatalysts for oxygen reduction reactions (ORRs) are desirable. Herein, we propose a strategy for introducing a carbon template into a melamine/Fe-salt mixture to inductively generate highly active Fe-N x sites for ORR. Using 57Fe Mössbauer spectroscopy, X-ray photoelectron spectroscopy, and X-ray diffraction, we studied the structural composition of the Fe and N co-doped carbon catalysts. Interestingly, the results showed that this system not only converted inactive Fe and Fe-carbides into active Fe-N4 and other Fe-nitrides, but also improved their intrinsic activities. Graphical Abstract Introduction of a carbon nanosphere template (CS) into a melamine/Fe-salt mixture resulted in the in situ growth of uniform nanotubes on the skin of the CS. Using this method, we successfully constructed binary FeN-CNT/CS in which the formation of highly dense Fe-N x active sites is promoted instead of Fe and Fe-carbides in FeN-CNT. Importantly, the intrinsic ORR activities of the Fe-N x sites were also improved. Keywords Oxygen reduction reaction Non-precious-metal electrocatalyst Fe-N x Induced growth Carbon template 1 Introduction Polymer electrolyte fuel cells (PEFCs) are one of the most promising candidates for clean electricity generation technologies; they have attracted increasing attention because of the limited supply of fossil fuel resources and environmental pollution caused by traditional energy production methods [1]. The catalytic species at the PEFC cathode typically includes Pt, which has a low natural abundance resulting in a significant restriction of the ability to meet global market demand; thus, non-precious metal catalyst alternatives are highly desired. To date, Fe-N x doped carbons (Fe-N/C) are considered to be the most promising potential alternatives to Pt and its alloys as ORR catalysts at the cathodes of PEFCs [1–7]. Therefore, Fe-N/C catalysts with superior catalytic activities are being actively pursued through a variety of strategies; these include: (1) adjusting the type and amount of Fe compound [8–11] and N source [11–13]; (2) altering the synthetic conditions, e.g., tuning the temperature [9,10,14] and pressure [15] of pyrolysis methods as well as investigating non-pyrolyzing routes such as axial ligand tethering [16], covalent grafting [17], and ball-milling [18]; (3) forming nanostructures, such as core-shell nanoparticles [18], ordered mesoporous carbons [19], arrays [20], thin graphene sheets [14,21,22], and amorphous carbon spheres [23]; (4) building composites including binary materials, such as graphene/carbon nanotubes [9], graphene/carbon black [24,25], graphene nanoribbons/carbon nanotubes [26], and carbon nanoparticles/carbon nanofibers [27], and ternary hybrids, such as carbon nanospheres/carbon nanotubes/graphene sheets [10]; (5) introducing post-processing, such as acid-washing [14,19–21], pore-forming [28], and reheating [28,29]; and (6) designing different typical Fe phases [29–31] to regulate the generation of Fe-nitrides, Fe-carbides, and Fe-nanoparticles. All these efforts are aimed at enhancing the ORR catalytic activities of the compounds. Concurrently, significant progress has been made in identifying the detailed compositions of the Fe-based species through spectroscopic studies. A growing body of work suggests that the mode of Fe-N x coordination plays a key role in promoting the electrocatalytic performance for ORR [7–36]. Moreover, it should be noted that Fe and Fe carbides have recently been identified as possible active species [37–42]. For example, adjacent Fe-carbides particles can boost the ORR activity of Fe-N x sites [41,42], and Fe nanoparticles encapsulated in CNTs can modify the electronic structure of the carbon atoms [31], thereby indirectly participating in electrocatalysis. However, the extent of the role of Fe remains controversial, although it is clear that their ORR activity is inferior to that of the Fe-N x sites [29–31]. Further, in-depth studies focused on the Fe-N x species have revealed that Fe-N4, and/or other Fe-nitrides, may be the primary contributors to the electrocatalytic performance of Fe-N/C catalysts. This information provides direction for the development of highly active ORR electrocatalysts. However, there is yet to be a rational strategy for the preferential induction of dense growth of highly active Fe-N x sites. In this work, we suggest the following effective solution for inducing the formation of Fe-N x active sites: Introducing a carbon template into the precursor mixture containing melamine and Fe salts results in preferential generation of active Fe-N x sites rather than inactive Fe and Fe-carbide compounds. This was confirmed through X-ray diffraction (XRD), X-ray photoelectron spectroscopy (XPS), and Mössbauer spectroscopy characterization. This method enhances the intrinsic ORR activities of the active species. 2 Experimental 2.1 Preparation and characterization of the catalysts In brief, the carbon catalysts are synthesized via heat-treatment of the precursor mixtures. To generate the binary FeN carbon nanotube/carbon nanosphere (CNT/CS) catalyst, we first dispersed 4 g of melamine and 20 mg of FeSO4·7H2O into 50 mL of deionized water with vigorous ultrasonication. After addition of the CS template (typically 50 mg), the Fe salts and melamine molecules preferentially absorb onto the surface of the CS agglomerations. After thoroughly blending the precursor mixture, it was dried in a rotary evaporator at 60 °C and then heated at 900 °C for 1 h in a tube furnace under ultrapure argon. Using suitable analogous procedures, FeN-CNT and N-CS were also obtained. The 57Fe Mössbauer spectra were recorded at room temperature using an MS 500 instrument (Oxford Instruments, U.K.), and the data were fitted using Reciol software. XPS measurements were performed on a Kratos Ltd. XSAM-800 spectrometer with Mg Kα radiation, and the data were fitted via Gaussian/Lorentzian fitting using XPSPEAK41 software. XRD patterns of the catalysts were obtained using an XRD-6000 X-ray diffractometer (Shimadzu) with a Cu Kα radiation source operating at 40 kV and 30 mA. Scanning electron microscopy (SEM) images were obtained using a field-emission S-4800 microscope (HITACHI). Transmission electron microscopy (TEM) images were obtained using a JEM-2100F microscope. N2 adsorption isotherms of the catalysts were recorded using an ASAP2020 surface area and porosity analyzer (Micromeritics, USA). 2.2 Electrochemical measurements Electrochemical experiments were performed using a CHI 440 electrochemical workstation and rotator in a standard three-electrode cell using a Pt foil counter electrode. The ORR tests were performed in O2-saturated electrolytes at a potential scan rate of 5 mV/s, and CV curves were scanned in Ar-saturated electrolytes at a potential scan rate of 100 mV/s. The catalyst loadings were 0.6 and 0.1 mg/cm2 for the prepared catalysts and 20 wt% Pt/C, respectively. To calibrate the reference electrodes to the reversible hydrogen electrode (RHE) scale, the RHE zero potential was estimated from the value at which the current crosses zero by measuring the polarization curves of the hydrogen electrode reactions on the Pt/C-loaded electrode in electrolytes saturated with H2. The calibration values were E(RHE) = E(reference) + xV, where x equals 0.915 and 0.32 in alkaline and acid solutions, respectively. A rotating ring-disk electrode (RRDE) was used as the working electrode. The electron transfer numbers (n) and peroxide yields were calculated based on the following equations: (1) n = 4I D/(I D + I R/N) (2) HO2 − (%) = 200I R/(N × I D + I R), where I D and I R represent the disk and ring currents, respectively, and N is the current collection efficiency of the Pt ring (0.25 in our system). 2.3 Calculation of the specific activity, mass activity, and turnover frequency The specific activities (SAs), mass activities (MAs), and turnover frequencies (TOFs) of the catalysts were calculated using the following equations: (3) SA (A/C) = jk/ECSA (4) MA (A/g) = jk/m catalyst (5) TOF (A/site) = MA/[(C Fe,XPS × A Fe-Nx,Mössbauer) × NA/M carbon] respectively, where jk, ECSA, m catalyst, C Fe,XPS, A Fe-Nx,Mössbauer, and NA represent the kinetic current density, electrochemical surface area, catalyst loading, Fe atomic percent in the catalyst (determined by XPS), area percent of Fe-N x species (determined from the Mössbauer spectra), Avogadro's constant (6.02 × 1023), and atomic weight of carbon (12.01 amu). 3 Results and discussion Preparation of the Fe-N x doped carbon catalysts begins with thermal annealing of the melamine in the presence of Fe salts. In a typical procedure, as is schematically illustrated in Scheme 1 , melamine was mixed with the Fe salts and Vulcan XC-72 CSs to form a homogeneous mixture. Through the adsorption interactions, the Fe salts and N-rich melamine effectively disperse on the surface of the CS template, thus facilitating uniform nucleation and growth of the carbon nanotubes and Fe-N x species via pyrogenation. Concurrently, the nitrogen species (e.g., NH3) formed during decomposition of the melamine precursor attacks the CS agglomerations to produce N (and Fe-N x ) doping. The morphology of the resultant FeN-CNT/CS catalyst is shown in Fig. 1(a) and (b). As is evident from the SEM results (Fig. 1(a)), the nanotubes, which were uniformly ~30–40 nm diametral, were interspersed among the CS agglomerations, resulting in a picture reminiscent of earthworms loosening the soil. This structure should produce a porous carbon, which is necessary for good dispersion of the Fe-Nx species and the activity of the catalytic reaction. Furthermore, the TEM results (Fig. 1(b)) show that the bamboo-like nanotubes possess the characteristic peapod-like structures of the bean-like Fe-based nanoparticles embedded within them. Additionally, the dark area on the surface of the CS in Fig. 1(b) is the nucleation zone for the Fe-based nanoparticles, which could correspond to the headwaters or roots of the carbon nanotubes. However, removal of the CS template resulted in an accumulation of the different types of nanotubes, i.e., thick/thin, long/short, and traditional/bamboo-like nanotubes, as is evident from the SEM picture in Fig. 1(c). Many studies have reported on the synthetic methods and possible growth mechanisms of carbon nanotubes [43–45]. The primary growth models that have been proposed include tip-growth and base-growth mechanisms. The variety of types of nanotubes in FeN-CNT suggests that both growth models occur; this is very similar to the results reported by Wu et al. [44]. The irregular morphology might be also ascribed to the presence of a variety of Fe-based nanoparticle catalysts. Introduction of the CS template results in uniform adsorption of Fe salts and N-rich melamine on its surface, which leads to uniform nucleation of Fe-based nanoparticles. Accordingly, uniform growth of nanotubes occurred in FeN-CNT/CS. Although the growth mechanism is not completely clear, it is evident that the presence of N causes the formation of bamboo-type morphologies [45]. Only mixing melamine with CS in the absence of Fe salts, N-doping occurred but the topography of N-CS kept the same as CS (Fig. 1(d)). From these results, it is evident that there is an effective synergy between the nanotubes and CS in FeN-CNT/CS, suggesting that the CS template is important for the formation of Fe-N x active sites and promotion of ORR performance. The ORR activities of the catalysts were evaluated using rotating-disk electrode (RDE) and RRDE measurements in alkaline media. As shown in Fig. 2(a) , FeN-CNT/CS, which has a half-wave potential of 0.78 V, clearly demonstrates a higher ORR activity than FeN-CNT and N-CS. Although the onset potentials of FeN-CNT and FeN-CNT/CS are similar, FeN-CNT delivered a lower current density in the fuel cell operating range (~0.6–0.8 V), which confirms the importance of the CS template in improving the ORR activity. Accordingly, we investigated the effects of CS addition on the structure and activity of catalysts: Slightly adjusting the CS ratio in the precursor did not significantly affect the morphology nor electrochemical activity of the formed binary composites. However, reducing the amount of CS reduces the yield, while adding excess CS template generates N-CS (or even CS) with an aggregated morphology and dramatically decreased the ORR activity. For the ORR, a four-electron pathway, which occurs at Pt-based catalysts, is desirable. From Fig. 2(b), we determined that the Koutecky-Levich (K-L) plots of the two catalysts had very similar slopes, indicating that FeN-CNT/CS also favors a four-electron pathway. Furthermore, the disk and ring currents of FeN-CNT/CS were obtained using RRDE measurements (Fig. 2(c)). From these values, we calculated an electron transfer number of ~4 (i.e., >3.98) and a very low H2O2 yield (<1%) over the entire potential region (Fig. 2(d)); these results indicate a high selectivity for the four-electron reduction of oxygen. In addition, FeN-CNT/CS showed superior durability than commercial Pt/C, as evidenced by the chronoamperometric curves at the potential of 0.7 V (vs. RHE) shown in Fig. 2(e). Moreover, the methanol tolerance of FeN-CNT/CS was investigated in a 0.1 mol/L KOH solution containing methanol. From the results shown in Fig. 2(f), it is evident that the ORR polarization curves at the FeN-CNT/CS electrode were almost equivalent in the presence and absence of methanol. This differs significantly from the results for the Pt/C electrode, which showed a dramatic decrease in ORR activity after the addition of methanol. The merits of avoiding the “crossover” issue make this catalyst very promising for direct methanol fuel cell applications. N2 adsorption/desorption isotherms and the Barrett-Joyner-Halenda (BJH) pore-size distribution (Fig. S1) are key to elucidating the structures of the formed nanocarbons. The pore sizes of the samples containing nanotubes (i.e., FeN-CNT/CS and FeN-CNT) are in the range of ~0–100 nm; in comparison, the pore sizes of N-CS are in the range of ~50–1000 nm. Therefore, the Brunauer-Emmett-Teller (BET) surface areas (BSAs) and total pore volumes (TPVs) of FeN-CNT/CS and FeN-CNT can be attributed to the mesoscale pores. Table 1 shows that the BSA and TPV values of FeN-CNT/CS are 177 m2/g and 0.41 cm3/g, respectively, which facilitate the dispersion of the Fe-N x species. Both the single materials provided lower BSA and TPV values: 68 m2/g and 0.21 cm3/g, respectively, for FeN-CNT and 160 m2/g and 0.36 cm3/g, respectively, for N-CS. From these results, it is reasonable to propose that there is an effective synergy between the nanotubes and CS in FeN-CNT/CS that does not occur in the absence of either component. This supports that the CS template promotes both the formation of Fe-N x active sites and ORR performance. For non-precious metal electrocatalysts, it is well-known that the types of Fe-N x species and doping density play a crucial role in enhancing the ORR activity. In the following sections, we will discuss, in detail, the inductive effect of the CS template on the growth of Fe-N x active sites using XRD, XPS, and 57Fe Mössbauer spectroscopy to analyze the elemental and structural compositions of the prepared catalysts. As shown in Fig. 3 , the XRD patterns can be used to compare the compositions of the three catalysts. Clearly, the C(002) characteristic peak of FeN-CNT/CS combines with those of FeN-CNT and N-CS, which indicates successful in situ growth of nanotubes on the CS template, as seen in Fig. 1(b). Additionally, it is evident that the conspicuous metallic Fe and Fe-carbides are present in FeN-CNT. Given that the type of Fe-N x species formed, especially non-crystalline Fe-N4, is not evident in the XRD pattern, it is likely that it is the dominant Fe-N x species in FeN-CNT/CS. Thus, adding the CS template to the melamine/Fe-salt mixture promoted Fe-N x coordination. Furthermore, XPS characterizations were performed to analyze the bonding configurations of N and Fe. From the high resolution XPS spectra of N 1s and Fe 2p shown in Fig. 4 , the N 1s spectra can be deconvoluted into pyridinic-N (~398.3 eV), pyrrolic-N (~400.2 eV), quaternary-N (~401.4 eV), and “N–O” (~403.1 eV) and the Fe 2p spectra can be fitted with zero-valent iron (Fe0) and oxidation iron (Fe2+/3+). It is worth mentioning that the pyridinic-N peak in XPS may also include contributions from Fe-N x because of their negligible bonding energy difference [46]. As summarized in Table 1, the total surface N contents of FeN-CNT/CS, FeN-CNT, and N-CS were 1.1, 4.5, and 0.7 at%, respectively. Although the N content of FeN-CNT is more than four times that of FeN-CNT/CS, the ORR activity of FeN-CNT is inferior. Moreover, the N content of N-CS is similar to that of FeN-CNT/CS but it has the lowest ORR performance. Regardless, introducing Fe resulted in an immediate increase in the ORR activity even at low Fe contents of 0.39 and 1.44 at% for FeN-CNT/CS and FeN-CNT, respectively. These results confirm that the formed Fe-N x species are highly active for ORR, which keeps consistence with that of the previous reports [7–36]. Interestingly, the addition of the CS template affects the oxidation state of Fe: The proportion of Fe0 in FeN-CNT/CS (0.097 at%) is significantly lower than that in FeN-CNT (~0.66 at%). That is, the CS template induces the formation of oxidized Fe2+/3+, which can further couple with N to form the various Fe-N x species. To identify the compositions of the Fe-N x species, 57Fe Mössbauer spectra were obtained. As can be clearly seen in Fig. 5 , the Mössbauer spectra feature singlet, doublet, and sextet signals; the assignments are given in Table 2 . Generally, singlets indicate superparamagnetic Fe and Sextet1 corresponds to α-Fe. Together, these signals comprise ~70% of the Fe in FeN-CNT but only ~25% in FeN-CNT/CS. Additionally, the Fe-carbides in FeN-CNT, as represented by Sextet3, are not evident in FeN-CNT/CS. Surprisingly, the proportion of the total Fe-N x species (Fe-N4 and other Fe-nitrides) represented by the two doublets and Sextet2 is much higher in FeN-CNT/CS (~75%) than in FeN-CNT (~15%). All the results suggest that the addition of the CS template to the melamine/Fe-salt mixture greatly reduces the content of metallic Fe and Fe-carbides by inducing the growth of Fe-N x species including Fe-N4 and other Fe-nitrides. Finally, in FeN-CNT/CS, the ORR active Fe-N x sites are dominant. The SA can be used to elucidate the differences in electrocatalyst activities. We estimated the electrochemical surface area (ECSA) from the CV curves (Fig. S2(a)) in acid media; the results were 10.8, 18.2, and 4.8 C/g for FeN-CNT/CS, FeN-CNT, and N-CS, respectively, as shown in Table S1. FeN-CNT/CS shows a lower ECSA than FeN-CNT, although FeN-CNT/CS has a higher BSA (177 m2/g) than FeN-CNT (68 m2/g) (Table 1). These results suggest that the high N-doping of 4.48 at% in FeN-CNT is due to its high ECSA. Furthermore, we calculated the kinetic current density (j k) from the polarization curves acquired in acid (Fig. S2(b)) and alkaline (Fig. 2(a)) solutions. By normalizing the j k, which represents the electrochemical activity, with the ECSA, we obtained SA values for FeN-CNT/CS, FeN-CNT, and N-CS (Table S1) of 0.448, 0.313, and 0.19 A/C, respectively, at 0.7 V (vs. RHE) in the acid media and 1.562, 0.639, and 0.152 A/C, respectively, at 0.75 V (vs. RHE) in the alkaline media. FeN-CNT/CS shows the highest SA, suggesting that the growth of Fe-N x species that is induced by the CS template plays a vital role in enhancing its catalytic activity. Next, we calculated the MAs of the catalysts by normalizing the j k at 0.75 V (vs. RHE) with the catalyst mass in the alkaline media. As shown in Fig. 6(a) , FeN-CNT/CS has the highest MA even though FeN-CNT contains the most N, while that of N-CS is negligible; this indicates that the ORR activity is primarily derived from the highly active Fe-N x sites. By combining the MA with the Mössbauer spectra and XPS results, the TOFs were calculated to determine the intrinsic activity per active site [42]. Although we propose that the doublets in Mössbauer spectra represent the ORR active sites, TOFs were calculated assuming both the doublets (D1+D2) and all the possible Fe-N x species (D1+D2+S2) were active sites. The results were 33.04 × 10−20 and 11.03 × 10−20 A/site for FeN-CNT/CS and 15.93 × 10−20 and 10.18 × 10−20 A/site for FeN-CNT, as displayed in Fig. 6(b). Both methods of calculation revealed that the TOF of FeN-CNT/CS is higher than that of FeN-CNT, implying that the CS template significantly promotes the activities of the Fe-N x sites. The results show that the introduction of the CS template into the melamine/Fe-salt mixture not only promotes the conversion of the inactive Fe and Fe-carbide sites into active Fe-N x sites but also essentially enhances the catalytic activities of the Fe-N x sites. 4 Conclusions In summary, we confirmed the effectiveness of introducing a carbon template into the melamine/Fe-salt mixture to preferentially create catalytically active Fe-N x sites for ORR. Characterization of the compounds provides evidence that the template facilitates the uniform nucleation of Fe-N x species and the growth of nanotubes on the skin of carbons. The introduction of the carbon template significantly suppresses the formation of inactive Fe-based particles (i.e., metallic Fe and Fe-carbides) and changes the coupling of Fe and N to induce the growth of ORR-active Fe-N x species including Fe-N4 and other Fe-nitrides. In addition, their intrinsic activities were significantly enhanced. We believe that this work provides an important strategy for promoting the dense-doping of highly active Fe-N x sites. Supplementary Material Supplementary appendix References 1 M. Shao Q. Chang J.P. Dodelet R. Chenitz Chem. Rev. 116 2016 3594 3657 2 W. Wang W. Chen P. Miao J. Luo Z. Wei S. Chen ACS Catal. 7 2017 6144 6149 3 W. Wang J. Luo W.H. Chen J. Li W. Xing S. Chen J. Mater. Chem. A 4 2016 12768 12773 4 Y. Xie W. Zhang S. Gu Y. Yan Z.F. Ma Chin. J. Chem. Eng. 24 2016 39 47 5 Q. Jia S. Ghoshal J. Li W. Liang G. Meng H. Che S. Zhang Z.F. Ma S. Mukerjee J. Am. Chem. Soc. 139 2017 7893 7903 6 J. Li A. Alsudairi Z.F. Ma S. Mukerjee Q. Jia J. Am. Chem. Soc. 139 2017 1384 1387 7 J. Li S. Ghoshal W. Liang M.T. Sougrati F. Jaouen B. Halevi S. McKinney G. McCool C. Ma X. Yuan Z.F. Ma S. Mukerjee Q. Jia Energy Environ. Sci. 9 2016 2418 2432 8 H.R. Byon J. Suntivich E.J. Crumlin S.H. Yang Phys. Chem. Chem. Phys. 13 2011 21437 21445 9 S. Zhang H. Zhang Q. Liu S. Chen J. Mater. Chem. A 1 2013 3302 3308 10 S. Zhang B. Liu S. Chen Phys. Chem. Chem. Phys. 15 2013 18482 18490 11 S.H. Liu J.R. Wu Electrochim. Acta 135 2014 147 153 12 Y. Zhu B. Zhang X. Liu D.W. Wang D.S. Su Angew. Chem. Int. Ed. 53 2014 10673 10677 13 C. Domínguez F.J. Pérez-Alonso M.A. Salam S.A. Al-Thabaiti M.A. Peña L. Barrioa S. Rojas J. Mater. Chem. A 3 2015 24487 24494 14 M. Ferrandon A.J. Kropf D.J. Myers K. Artyushkova U. Kramm P. Bogdanoff G. Wu C.M. Johnston P. Zelenay J. Phys. Chem. C 116 2012 16001 16013 15 C. Gumeci N. Leonard Y. Liu S. McKinney B. Halevib S.C. Barton J. Mater. Chem. A 3 2015 21494 21500 16 R. Cao R. Thapa H. Kim X. Xu M.G. Kim Q. Li N. Park M. Liu J. Cho Nat. Commun. 4 2013 2076 17 P.J. Wei G.Q. Yu Y. Naruta J.G. Liu Angew. Chem. Int. Ed. 53 2014 6659 6663 18 S. Zhang H. Zhang X. Hua S. Chen J. Mater. Chem. A 3 2015 10013 10019 19 J.Y. Cheon T. Kim Y. Choi H.Y. Jeong M.G. Kim Y.J. Sa J. Kim Z. Lee T.H. Yang K. Kwon O. Terasaki G.G. Park R.R. Adzic S.H. Joo Sci. Rep. 3 2013 2715 20 K. Gong F. Du Z. Xia M. Durstock L. Dai Science 323 2009 760 764 21 G. Wu P. Zelenay Acc. Chem. Res. 46 2013 1878 1889 22 J. Zhang Q. Li H. Wu C. Zhang K. Cheng H. Zhou M. Pan S. Mu J. Mater. Chem. A 3 2015 10851 10857 23 M. Wang Y. Yang X. Liu Z. Pu Z. Kou P. Zhu S. Mu Nanoscale 9 2017 7641 7649 24 D. He Y. Xiong J. Yang X. Chen Z. Deng M. Pan Y. Li S. Mu J. Mater. Chem. A 5 2017 1930 1934 25 Q. Liu H. Zhang H. Zhong S. Zhang S. Chen Electrochim. Acta 81 2012 313 320 26 C. Chen X. Zhang Z.Y. Zhou X.D. Yang X.S. Zhang S.G. Sun Electrochim. Acta 222 2016 1922 1930 27 G. Panomsuwan N. Saitobcd T. Ishizaki RSC Adv. 6 2016 114553 114559 28 Y. Chen R. Gokhale A. Serov K. Artyushkova P. Atanassov Nano Energy 38 2017 201 209 29 U.I. Kramm I. Herrmann-Geppert P. Bogdanoff S. Fiechter J. Phys. Chem. C 115 2011 23417 23427 30 F.J. Pérez-Alonso C. Domínguez S.A. Al-Thabaiti A.O. Al-Youbi M. Abdel Salam A.A. Alshehri M. Retuerto M.A. Peña S. Rojas J. Power Sources 327 2016 204 211 31 T. Sun Y. Jiang Q. Wu L. Du Z. Zhang L. Yang X. Wang Z. Hu Catal. Sci. Technol. 7 2017 51 55 32 L. Gu L. Jiang X. Li J. Jin J. Wang G. Sun Chin. J. Catal. 37 2016 539 548 33 W. Shi Y.C. Wang C. Chen X.D. Yang Z.Y. Zhou S.G. Sun Chin. J. Catal. 37 2016 1103 1108 34 Y. Chen X. Hua S. Chen Chin. J. Catal. 37 2016 1166 1171 35 J. Kong W. Cheng Chin. J. Catal. 38 2017 951 969 36 C. Chen Z. Zhou Y. Wang X. Zhang X. Yang X. Zhang S. Sun Chin. J. Catal. 38 2017 673 682 37 D. Deng L. Yu X. Chen G. Wang L. Jin X. Pan J. Deng G. Sun X. Bao Angew. Chem. Int. Ed. 52 2013 371 375 38 J.P. Dodelet R. Chenitz L. Yang M. Lefèvre ChemCatChem 6 2014 1866 1867 39 Y. Hu J.O. Jensen W. Zhang L.N. Cleemann W. Xing N.J. Bjerrum Q. Li Angew. Chem. Int. Ed. 53 2014 3675 3679 40 Z.Y. Wu X.X. Xu B.C. Hu H.W. Liang Y. Lin L.F. Chen S.H. Yu Angew. Chem. Int. Ed. 54 2015 8179 8183 41 W. Yang X. Liu X. Yue J. Jia S. Guo J. Am. Chem. Soc. 137 2015 1436 1439 42 Y.J. Sa D.J. Seo J. Woo J.T. Lim J.Y. Cheon S.Y. Yang J.M. Lee D. Kang T.J. Shin H.S. Shin H.Y. Jeong C.S. Kim M.G. Kim T.Y. Kim S.H. Joo J. Am. Chem. Soc. 138 2016 15046 15056 43 J.P. Tessonnier D.S. Su ChemSusChem 4 2011 824 847 44 X. Wu Y. Tao Y. Lu L. Dong Z. Hu Diam. Relat. Mater. 15 2006 164 170 45 B.G. Sumpter J. Huang V. Meunier J.M. Romo-Herrera E. Cruz-Silva H. Terrones M. Terrones Int. J. Quantum Chem. 109 2009 97 118 46 H.W. Liang W. Wei Z.S. Wu X. Feng K. Müllen J. Am. Chem. Soc. 135 2013 16002 16005",
      "scopus-id": "85049532719",
      "coredata": {
        "eid": "1-s2.0-S1872206718631079",
        "dc:description": "Highly active Fe-N x sites that effectively improve the performance of non-precious metal electrocatalysts for oxygen reduction reactions (ORRs) are desirable. Herein, we propose a strategy for introducing a carbon template into a melamine/Fe-salt mixture to inductively generate highly active Fe-N x sites for ORR. Using 57Fe Mössbauer spectroscopy, X-ray photoelectron spectroscopy, and X-ray diffraction, we studied the structural composition of the Fe and N co-doped carbon catalysts. Interestingly, the results showed that this system not only converted inactive Fe and Fe-carbides into active Fe-N4 and other Fe-nitrides, but also improved their intrinsic activities.",
        "openArchiveArticle": "false",
        "prism:coverDate": "2018-08-31",
        "openaccessUserLicense": null,
        "prism:aggregationType": "Journal",
        "prism:url": "https://api.elsevier.com/content/article/pii/S1872206718631079",
        "dc:creator": [
          {
            "@_fa": "true",
            "$": "Zhang, Shiming"
          },
          {
            "@_fa": "true",
            "$": "Zhang, Heyou"
          },
          {
            "@_fa": "true",
            "$": "Zhang, Weimin"
          },
          {
            "@_fa": "true",
            "$": "Yuan, Xianxia"
          },
          {
            "@_fa": "true",
            "$": "Chen, Shengli"
          },
          {
            "@_fa": "true",
            "$": "Ma, Zi-Feng"
          }
        ],
        "link": [
          {
            "@_fa": "true",
            "@rel": "self",
            "@href": "https://api.elsevier.com/content/article/pii/S1872206718631079"
          },
          {
            "@_fa": "true",
            "@rel": "scidir",
            "@href": "https://www.sciencedirect.com/science/article/pii/S1872206718631079"
          }
        ],
        "dc:format": "application/json",
        "openaccessType": null,
        "pii": "S1872-2067(18)63107-9",
        "prism:volume": "39",
        "prism:publisher": "Dalian Institute of Chemical Physics, the Chinese Academy of Sciences. Published by Elsevier B.V.",
        "dc:title": "Induced growth of Fe-N x active sites using carbon templates",
        "prism:copyright": "Copyright © 2018 Dalian Institute of Chemical Physics, the Chinese Academy of Sciences. Published by Elsevier B.V. All rights reserved.",
        "openaccess": "0",
        "prism:issn": "18722067",
        "prism:issueIdentifier": "8",
        "dcterms:subject": [
          {
            "@_fa": "true",
            "$": "Oxygen reduction reaction"
          },
          {
            "@_fa": "true",
            "$": "Non-precious-metal electrocatalyst"
          },
          {
            "@_fa": "true",
            "$": "Fe-N x"
          },
          {
            "@_fa": "true",
            "$": "Induced growth"
          },
          {
            "@_fa": "true",
            "$": "Carbon template"
          }
        ],
        "openaccessArticle": "false",
        "prism:publicationName": "Chinese Journal of Catalysis",
        "prism:number": "8",
        "openaccessSponsorType": null,
        "prism:pageRange": "1427-1435",
        "prism:endingPage": "1435",
        "pubType": "fla",
        "prism:coverDisplayDate": "August 2018",
        "prism:doi": "10.1016/S1872-2067(18)63107-9",
        "prism:startingPage": "1427",
        "dc:identifier": "doi:10.1016/S1872-2067(18)63107-9",
        "openaccessSponsorName": null
      },
      "objects": {
        "object": [
          {
            "@category": "thumbnail",
            "@height": "162",
            "@width": "219",
            "@_fa": "true",
            "$": "https://api.elsevier.com/content/object/eid/1-s2.0-S1872206718631079-fx1.sml?httpAccept=%2A%2F%2A",
            "@multimediatype": "GIF image file",
            "@type": "IMAGE-THUMBNAIL",
            "@size": "18125",
            "@ref": "fx1",
            "@mimetype": "image/gif"
          },
          {
            "@category": "thumbnail",
            "@height": "40",
            "@width": "219",
            "@_fa": "true",
            "$": "https://api.elsevier.com/content/object/eid/1-s2.0-S1872206718631079-gr1.sml?httpAccept=%2A%2F%2A",
            "@multimediatype": "GIF image file",
            "@type": "IMAGE-THUMBNAIL",
            "@size": "10122",
            "@ref": "gr1",
            "@mimetype": "image/gif"
          },
          {
            "@category": "thumbnail",
            "@height": "110",
            "@width": "219",
            "@_fa": "true",
            "$": "https://api.elsevier.com/content/object/eid/1-s2.0-S1872206718631079-gr2.sml?httpAccept=%2A%2F%2A",
            "@multimediatype": "GIF image file",
            "@type": "IMAGE-THUMBNAIL",
            "@size": "9616",
            "@ref": "gr2",
            "@mimetype": "image/gif"
          },
          {
            "@category": "thumbnail",
            "@height": "153",
            "@width": "219",
            "@_fa": "true",
            "$": "https://api.elsevier.com/content/object/eid/1-s2.0-S1872206718631079-gr3.sml?httpAccept=%2A%2F%2A",
            "@multimediatype": "GIF image file",
            "@type": "IMAGE-THUMBNAIL",
            "@size": "13112",
            "@ref": "gr3",
            "@mimetype": "image/gif"
          },
          {
            "@category": "thumbnail",
            "@height": "164",
            "@width": "209",
            "@_fa": "true",
            "$": "https://api.elsevier.com/content/object/eid/1-s2.0-S1872206718631079-gr4.sml?httpAccept=%2A%2F%2A",
            "@multimediatype": "GIF image file",
            "@type": "IMAGE-THUMBNAIL",
            "@size": "15761",
            "@ref": "gr4",
            "@mimetype": "image/gif"
          },
          {
            "@category": "thumbnail",
            "@height": "79",
            "@width": "219",
            "@_fa": "true",
            "$": "https://api.elsevier.com/content/object/eid/1-s2.0-S1872206718631079-gr5.sml?httpAccept=%2A%2F%2A",
            "@multimediatype": "GIF image file",
            "@type": "IMAGE-THUMBNAIL",
            "@size": "9973",
            "@ref": "gr5",
            "@mimetype": "image/gif"
          },
          {
            "@category": "thumbnail",
            "@height": "79",
            "@width": "219",
            "@_fa": "true",
            "$": "https://api.elsevier.com/content/object/eid/1-s2.0-S1872206718631079-gr6.sml?httpAccept=%2A%2F%2A",
            "@multimediatype": "GIF image file",
            "@type": "IMAGE-THUMBNAIL",
            "@size": "6603",
            "@ref": "gr6",
            "@mimetype": "image/gif"
          },
          {
            "@category": "thumbnail",
            "@height": "57",
            "@width": "219",
            "@_fa": "true",
            "$": "https://api.elsevier.com/content/object/eid/1-s2.0-S1872206718631079-gr7.sml?httpAccept=%2A%2F%2A",
            "@multimediatype": "GIF image file",
            "@type": "IMAGE-THUMBNAIL",
            "@size": "8157",
            "@ref": "gr7",
            "@mimetype": "image/gif"
          },
          {
            "@category": "standard",
            "@height": "223",
            "@width": "301",
            "@_fa": "true",
            "$": "https://api.elsevier.com/content/object/eid/1-s2.0-S1872206718631079-fx1.jpg?httpAccept=%2A%2F%2A",
            "@multimediatype": "JPEG image file",
            "@type": "IMAGE-DOWNSAMPLED",
            "@size": "40160",
            "@ref": "fx1",
            "@mimetype": "image/jpeg"
          },
          {
            "@category": "standard",
            "@height": "140",
            "@width": "765",
            "@_fa": "true",
            "$": "https://api.elsevier.com/content/object/eid/1-s2.0-S1872206718631079-gr1.jpg?httpAccept=%2A%2F%2A",
            "@multimediatype": "JPEG image file",
            "@type": "IMAGE-DOWNSAMPLED",
            "@size": "52663",
            "@ref": "gr1",
            "@mimetype": "image/jpeg"
          },
          {
            "@category": "standard",
            "@height": "380",
            "@width": "754",
            "@_fa": "true",
            "$": "https://api.elsevier.com/content/object/eid/1-s2.0-S1872206718631079-gr2.jpg?httpAccept=%2A%2F%2A",
            "@multimediatype": "JPEG image file",
            "@type": "IMAGE-DOWNSAMPLED",
            "@size": "84747",
            "@ref": "gr2",
            "@mimetype": "image/jpeg"
          },
          {
            "@category": "standard",
            "@height": "252",
            "@width": "361",
            "@_fa": "true",
            "$": "https://api.elsevier.com/content/object/eid/1-s2.0-S1872206718631079-gr3.jpg?httpAccept=%2A%2F%2A",
            "@multimediatype": "JPEG image file",
            "@type": "IMAGE-DOWNSAMPLED",
            "@size": "46690",
            "@ref": "gr3",
            "@mimetype": "image/jpeg"
          },
          {
            "@category": "standard",
            "@height": "538",
            "@width": "687",
            "@_fa": "true",
            "$": "https://api.elsevier.com/content/object/eid/1-s2.0-S1872206718631079-gr4.jpg?httpAccept=%2A%2F%2A",
            "@multimediatype": "JPEG image file",
            "@type": "IMAGE-DOWNSAMPLED",
            "@size": "126441",
            "@ref": "gr4",
            "@mimetype": "image/jpeg"
          },
          {
            "@category": "standard",
            "@height": "277",
            "@width": "766",
            "@_fa": "true",
            "$": "https://api.elsevier.com/content/object/eid/1-s2.0-S1872206718631079-gr5.jpg?httpAccept=%2A%2F%2A",
            "@multimediatype": "JPEG image file",
            "@type": "IMAGE-DOWNSAMPLED",
            "@size": "75770",
            "@ref": "gr5",
            "@mimetype": "image/jpeg"
          },
          {
            "@category": "standard",
            "@height": "258",
            "@width": "713",
            "@_fa": "true",
            "$": "https://api.elsevier.com/content/object/eid/1-s2.0-S1872206718631079-gr6.jpg?httpAccept=%2A%2F%2A",
            "@multimediatype": "JPEG image file",
            "@type": "IMAGE-DOWNSAMPLED",
            "@size": "39568",
            "@ref": "gr6",
            "@mimetype": "image/jpeg"
          },
          {
            "@category": "standard",
            "@height": "95",
            "@width": "367",
            "@_fa": "true",
            "$": "https://api.elsevier.com/content/object/eid/1-s2.0-S1872206718631079-gr7.jpg?httpAccept=%2A%2F%2A",
            "@multimediatype": "JPEG image file",
            "@type": "IMAGE-DOWNSAMPLED",
            "@size": "24946",
            "@ref": "gr7",
            "@mimetype": "image/jpeg"
          },
          {
            "@category": "high",
            "@height": "592",
            "@width": "800",
            "@_fa": "true",
            "$": "https://api.elsevier.com/content/object/eid/1-s2.0-S1872206718631079-fx1_lrg.jpg?httpAccept=%2A%2F%2A",
            "@multimediatype": "JPEG image file",
            "@type": "IMAGE-HIGH-RES",
            "@size": "122121",
            "@ref": "fx1",
            "@mimetype": "image/jpeg"
          },
          {
            "@category": "high",
            "@height": "373",
            "@width": "2032",
            "@_fa": "true",
            "$": "https://api.elsevier.com/content/object/eid/1-s2.0-S1872206718631079-gr1_lrg.jpg?httpAccept=%2A%2F%2A",
            "@multimediatype": "JPEG image file",
            "@type": "IMAGE-HIGH-RES",
            "@size": "219861",
            "@ref": "gr1",
            "@mimetype": "image/jpeg"
          },
          {
            "@category": "high",
            "@height": "1009",
            "@width": "2003",
            "@_fa": "true",
            "$": "https://api.elsevier.com/content/object/eid/1-s2.0-S1872206718631079-gr2_lrg.jpg?httpAccept=%2A%2F%2A",
            "@multimediatype": "JPEG image file",
            "@type": "IMAGE-HIGH-RES",
            "@size": "336777",
            "@ref": "gr2",
            "@mimetype": "image/jpeg"
          },
          {
            "@category": "high",
            "@height": "669",
            "@width": "960",
            "@_fa": "true",
            "$": "https://api.elsevier.com/content/object/eid/1-s2.0-S1872206718631079-gr3_lrg.jpg?httpAccept=%2A%2F%2A",
            "@multimediatype": "JPEG image file",
            "@type": "IMAGE-HIGH-RES",
            "@size": "151176",
            "@ref": "gr3",
            "@mimetype": "image/jpeg"
          },
          {
            "@category": "high",
            "@height": "1430",
            "@width": "1826",
            "@_fa": "true",
            "$": "https://api.elsevier.com/content/object/eid/1-s2.0-S1872206718631079-gr4_lrg.jpg?httpAccept=%2A%2F%2A",
            "@multimediatype": "JPEG image file",
            "@type": "IMAGE-HIGH-RES",
            "@size": "506476",
            "@ref": "gr4",
            "@mimetype": "image/jpeg"
          },
          {
            "@category": "high",
            "@height": "736",
            "@width": "2036",
            "@_fa": "true",
            "$": "https://api.elsevier.com/content/object/eid/1-s2.0-S1872206718631079-gr5_lrg.jpg?httpAccept=%2A%2F%2A",
            "@multimediatype": "JPEG image file",
            "@type": "IMAGE-HIGH-RES",
            "@size": "295212",
            "@ref": "gr5",
            "@mimetype": "image/jpeg"
          },
          {
            "@category": "high",
            "@height": "687",
            "@width": "1895",
            "@_fa": "true",
            "$": "https://api.elsevier.com/content/object/eid/1-s2.0-S1872206718631079-gr6_lrg.jpg?httpAccept=%2A%2F%2A",
            "@multimediatype": "JPEG image file",
            "@type": "IMAGE-HIGH-RES",
            "@size": "122743",
            "@ref": "gr6",
            "@mimetype": "image/jpeg"
          },
          {
            "@category": "high",
            "@height": "252",
            "@width": "976",
            "@_fa": "true",
            "$": "https://api.elsevier.com/content/object/eid/1-s2.0-S1872206718631079-gr7_lrg.jpg?httpAccept=%2A%2F%2A",
            "@multimediatype": "JPEG image file",
            "@type": "IMAGE-HIGH-RES",
            "@size": "64009",
            "@ref": "gr7",
            "@mimetype": "image/jpeg"
          },
          {
            "@category": "standard",
            "@_fa": "true",
            "$": "https://api.elsevier.com/content/object/eid/1-s2.0-S1872206718631079-mmc1.pdf?httpAccept=%2A%2F%2A",
            "@multimediatype": "Acrobat PDF file",
            "@type": "APPLICATION",
            "@size": "204275",
            "@ref": "mmc1",
            "@mimetype": "application/pdf"
          }
        ]
      },
      "link": {
        "@rel": "abstract",
        "@href": "https://api.elsevier.com/content/abstract/scopus_id/85049532719"
      }
    }
  }
}