{
  "metadata": {
    "title": "Progress in research on Li–CO<ce:inf loc=post>2</ce:inf> batteries: Mechanism, catalyst and performance",
    "authors": "; ; ",
    "journal": "Chinese Journal of Catalysis",
    "date": "2016-07-31",
    "doi": "10.1016/S1872-2067(15)61125-1",
    "abstract": "",
    "uri": "https://api.elsevier.com/content/article/pii/S1872206715611251",
    "pii": "S1872206715611251"
  },
  "fulltext": {
    "full-text-retrieval-response": {
      "scopus-eid": "2-s2.0-84975141238",
      "originalText": "serial JL 273538 291210 291744 291809 31 Chinese Journal of Catalysis CHINESEJOURNALCATALYSIS 2016-06-23 2016-06-23 2016-06-23 2016-06-23 2016-06-23T21:09:12 1-s2.0-S1872206715611251 S1872-2067(15)61125-1 S1872206715611251 10.1016/S1872-2067(15)61125-1 S300 S300.1 FULL-TEXT 1-s2.0-S1872206716X00071 2025-07-16T18:08:06.525296Z 0 0 20160701 20160731 2016 2016-06-23T21:26:00.809268Z absattachment articleinfo articletitlenorm authfirstinitialnorm authfirstsurnamenorm cid cids contenttype copyright crossmark dateloaded dateloadedtxt datesearch datesort dateupdated dco docsubtype doctype doi eid ewtransactionid hubeid indexeddate issfirst issn issnnorm issuelist itemstage itemtransactionid itemweight openaccess openarchive pg pgfirst pglast pii piinorm pubdateend pubdatestart pubdatetxt pubyr sortorder srctitle srctitlenorm srctype ssids alllist content subj subheadings tomb volfirst volissue volumelist webpdf webpdfpagecount yearnav figure table body mmlmath affil articletitle auth authfirstini authfull authkeywords authlast grantnumber grantsponsor primabst pubtype ref specialabst 1872-2067 18722067 true 37 37 7 7 Volume 37, Issue 7 5 1016 1024 1016 1024 201607 July 2016 2016-07-01 2016-07-31 2016 article rev Copyright © 2016 Dalian Institute of Chemical Physics, the Chinese Academy of Sciences. Published by Elsevier B.V. All rights reserved. PROGRESSINRESEARCHLICO2BATTERIESMECHANISMCATALYSTPERFORMANCE LI X 1 Introduction 2 Reaction mechanism on cathodes 3 Factors affecting the properties of Li–CO2 batteries 3.1 Benefit of higher temperature 3.2 Mixed CO2/O2 as the active gas 3.3 Stability of electrolytes 3.4 Diversity of cathodes for Li–CO2 batteries 3.4.1 Ketjen black 3.4.2 Graphene 3.4.3 Carbon nanotubes (CNTs) 4 Conclusions and perspective References WEISZ 2004 18 20 P GOUGH 2008 155 168 C LUBY 2007 40 50 P BALAT 2007 357 392 H BRUCE 2012 19 29 P LESKES 2012 8560 8563 M BLACK 2012 2902 2905 R HARTMANN 2013 228 232 P NAM 2001 A220 A223 S MEINI 2012 A45 A48 S SHUI 2013 2255 J ZHANG 2013 1817 T LIM 2015 9663 9667 H CHRISTENSEN 2012 R1 R30 J WADHAWAN 2001 10659 10668 J YANG 2016 1650 1654 S XU 2011 9631 9639 W AURBACH 1992 451 471 D TAKECHI 2011 3463 3465 K MCCLOSKEY 2012 997 1001 B THOTIYL 2013 494 500 M ITKIS 2013 4697 4701 D ZHANG 2015 6550 6553 Z GOWDA 2013 276 279 S FENG 2016 1502303 N VETTER 1967 47 59 K CHASE 1998 i ii M LIU 2014 677 681 Y LING 2014 26591 26598 C XU 2013 6656 6660 S LIM 2013 9733 9742 H LIU 2015 17307 17310 Y GARCIALASTRA 2013 5568 5577 J YOO 2014 11798 11801 E ZHANG 2012 8508 8514 W LI 2011 9438 9440 Y XIAO 2011 5071 5078 J WU 2012 9764 9776 G ZHANG 2015 14636 14639 X MI 2014 18746 18753 R LIU 2010 E28 E62 C NOEROCHIM 2010 314 320 L PENG 2012 563 566 Z WANG 2015 23876 23884 G QIU 2016 2713 2716 F JIANG 2016 e239 J FENG 2015 600 602 N HE 2016 1267 1280 P LIX2016X1016 LIX2016X1016X1024 LIX2016X1016XX LIX2016X1016X1024XX 2018-06-23T00:00:00Z http://creativecommons.org/licenses/by-nc-nd/4.0/ 2021-03-14T23:34:59.485Z http://vtw.elsevier.com/data/voc/AddOnTypes/50.7/nlp National Natural Science Foundation of China 21403107 21373111 NSFC National Natural Science Foundation of China http://data.elsevier.com/vocabulary/SciValFunders/501100001809 http://sws.geonames.org/1814991/ PAPD of Jiangsu Higher Education Institutions PAPD Priority Academic Program Development of Jiangsu Higher Education Institutions http://data.elsevier.com/vocabulary/SciValFunders/501100012246 http://sws.geonames.org/1814991/ Natural Science Foundation of Jiangsu Province of China BK20140055 Natural Science Foundation of Jiangsu Province http://data.elsevier.com/vocabulary/SciValFunders/501100004608 http://sws.geonames.org/1814991/ National Basic Research Program of China 2014CB932303 2014CB932302 NKRDPC National Key Research and Development Program of China http://data.elsevier.com/vocabulary/SciValFunders/501100012166 http://sws.geonames.org/1814991/ Specialized Research Fund for the Doctoral Program of Higher Education of China 20120091120022 SRFDP Specialized Research Fund for the Doctoral Program of Higher Education of China http://data.elsevier.com/vocabulary/SciValFunders/501100013286 http://sws.geonames.org/1814991/ Union of Industry-Study-Research of Jiangsu Province BY2015069-01 This work was supported by the National Basic Research Program of China (973 Program, 2014CB932302, 2014CB932303), the National Natural Science Foundation of China (21403107, 21373111), Natural Science Foundation of Jiangsu Province of China (BK20140055), Specialized Research Fund for the Doctoral Program of Higher Education of China (20120091120022), PAPD of Jiangsu Higher Education Institutions, and the Project on Union of Industry-Study-Research of Jiangsu Province (BY2015069-01). item S1872-2067(15)61125-1 S1872206715611251 1-s2.0-S1872206715611251 10.1016/S1872-2067(15)61125-1 273538 2016-06-23T16:26:00.809268-04:00 2016-07-01 2016-07-31 1-s2.0-S1872206715611251-main.pdf https://s3-eu-west-1.amazonaws.com/prod-ucs-content-store-eu-west/content/pii:S1872206715611251/MAIN/application/pdf/35c2cf324331f1196e2a57f18a4d9bdd/main.pdf https://s3.amazonaws.com/prod-ucs-content-store-us-east/content/pii:S1872206715611251/MAIN/application/pdf/35c2cf324331f1196e2a57f18a4d9bdd/main.pdf main.pdf pdf true 2945263 MAIN 9 1-s2.0-S1872206715611251-main_1.png https://s3-eu-west-1.amazonaws.com/prod-ucs-content-store-eu-west/content/pii:S1872206715611251/PREVIEW/image/png/936bed782ab6411a9279c88effa18b3c/main_1.png https://s3.amazonaws.com/prod-ucs-content-store-us-east/content/pii:S1872206715611251/PREVIEW/image/png/936bed782ab6411a9279c88effa18b3c/main_1.png main_1.png png 53021 849 656 IMAGE-WEB-PDF 1 1-s2.0-S1872206715611251-fx1.sml https://s3-eu-west-1.amazonaws.com/prod-ucs-content-store-eu-west/content/pii:S1872206715611251/fx1/THUMBNAIL/image/gif/28a63897b835178bb0682be219634045/fx1.sml https://s3.amazonaws.com/prod-ucs-content-store-us-east/content/pii:S1872206715611251/fx1/THUMBNAIL/image/gif/28a63897b835178bb0682be219634045/fx1.sml fx1 true fx1.sml sml 21738 162 219 IMAGE-THUMBNAIL 1-s2.0-S1872206715611251-gr1.sml https://s3-eu-west-1.amazonaws.com/prod-ucs-content-store-eu-west/content/pii:S1872206715611251/gr1/THUMBNAIL/image/gif/a365c792d335920695cba388bdcddda3/gr1.sml https://s3.amazonaws.com/prod-ucs-content-store-us-east/content/pii:S1872206715611251/gr1/THUMBNAIL/image/gif/a365c792d335920695cba388bdcddda3/gr1.sml gr1 gr1.sml sml 11408 164 204 IMAGE-THUMBNAIL 1-s2.0-S1872206715611251-gr10.sml https://s3-eu-west-1.amazonaws.com/prod-ucs-content-store-eu-west/content/pii:S1872206715611251/gr10/THUMBNAIL/image/gif/9d1ac6d6c3fd4ce245d46fa91fba97a2/gr10.sml https://s3.amazonaws.com/prod-ucs-content-store-us-east/content/pii:S1872206715611251/gr10/THUMBNAIL/image/gif/9d1ac6d6c3fd4ce245d46fa91fba97a2/gr10.sml gr10 gr10.sml sml 9276 164 76 IMAGE-THUMBNAIL 1-s2.0-S1872206715611251-gr2.sml https://s3-eu-west-1.amazonaws.com/prod-ucs-content-store-eu-west/content/pii:S1872206715611251/gr2/THUMBNAIL/image/gif/30091bb353e9a79b3b63c2bc0a7b42a4/gr2.sml https://s3.amazonaws.com/prod-ucs-content-store-us-east/content/pii:S1872206715611251/gr2/THUMBNAIL/image/gif/30091bb353e9a79b3b63c2bc0a7b42a4/gr2.sml gr2 gr2.sml sml 11189 164 209 IMAGE-THUMBNAIL 1-s2.0-S1872206715611251-gr3.sml https://s3-eu-west-1.amazonaws.com/prod-ucs-content-store-eu-west/content/pii:S1872206715611251/gr3/THUMBNAIL/image/gif/01ea9cbcd9e5f141f4c408678a02c288/gr3.sml https://s3.amazonaws.com/prod-ucs-content-store-us-east/content/pii:S1872206715611251/gr3/THUMBNAIL/image/gif/01ea9cbcd9e5f141f4c408678a02c288/gr3.sml gr3 gr3.sml sml 14655 164 186 IMAGE-THUMBNAIL 1-s2.0-S1872206715611251-gr4.sml https://s3-eu-west-1.amazonaws.com/prod-ucs-content-store-eu-west/content/pii:S1872206715611251/gr4/THUMBNAIL/image/gif/22de2c82cdaf9c990e3719696b911d0b/gr4.sml https://s3.amazonaws.com/prod-ucs-content-store-us-east/content/pii:S1872206715611251/gr4/THUMBNAIL/image/gif/22de2c82cdaf9c990e3719696b911d0b/gr4.sml gr4 gr4.sml sml 15966 154 219 IMAGE-THUMBNAIL 1-s2.0-S1872206715611251-gr5.sml https://s3-eu-west-1.amazonaws.com/prod-ucs-content-store-eu-west/content/pii:S1872206715611251/gr5/THUMBNAIL/image/gif/fc5033663cd7c7c703234535f5a5fd8d/gr5.sml https://s3.amazonaws.com/prod-ucs-content-store-us-east/content/pii:S1872206715611251/gr5/THUMBNAIL/image/gif/fc5033663cd7c7c703234535f5a5fd8d/gr5.sml gr5 gr5.sml sml 17326 161 219 IMAGE-THUMBNAIL 1-s2.0-S1872206715611251-gr6.sml https://s3-eu-west-1.amazonaws.com/prod-ucs-content-store-eu-west/content/pii:S1872206715611251/gr6/THUMBNAIL/image/gif/4ab87549a62940a81670f6d027c3de38/gr6.sml https://s3.amazonaws.com/prod-ucs-content-store-us-east/content/pii:S1872206715611251/gr6/THUMBNAIL/image/gif/4ab87549a62940a81670f6d027c3de38/gr6.sml gr6 gr6.sml sml 15151 162 219 IMAGE-THUMBNAIL 1-s2.0-S1872206715611251-gr7.sml https://s3-eu-west-1.amazonaws.com/prod-ucs-content-store-eu-west/content/pii:S1872206715611251/gr7/THUMBNAIL/image/gif/e6ca309e8bf275e9b0262b310c2d18e1/gr7.sml https://s3.amazonaws.com/prod-ucs-content-store-us-east/content/pii:S1872206715611251/gr7/THUMBNAIL/image/gif/e6ca309e8bf275e9b0262b310c2d18e1/gr7.sml gr7 gr7.sml sml 13498 109 219 IMAGE-THUMBNAIL 1-s2.0-S1872206715611251-gr8.sml https://s3-eu-west-1.amazonaws.com/prod-ucs-content-store-eu-west/content/pii:S1872206715611251/gr8/THUMBNAIL/image/gif/5a1321f0959c7f865f34ac481665714c/gr8.sml https://s3.amazonaws.com/prod-ucs-content-store-us-east/content/pii:S1872206715611251/gr8/THUMBNAIL/image/gif/5a1321f0959c7f865f34ac481665714c/gr8.sml gr8 gr8.sml sml 20587 160 219 IMAGE-THUMBNAIL 1-s2.0-S1872206715611251-gr9.sml https://s3-eu-west-1.amazonaws.com/prod-ucs-content-store-eu-west/content/pii:S1872206715611251/gr9/THUMBNAIL/image/gif/65c91d8ea278958b5ec8daaeda62ca38/gr9.sml https://s3.amazonaws.com/prod-ucs-content-store-us-east/content/pii:S1872206715611251/gr9/THUMBNAIL/image/gif/65c91d8ea278958b5ec8daaeda62ca38/gr9.sml gr9 gr9.sml sml 23497 105 219 IMAGE-THUMBNAIL 1-s2.0-S1872206715611251-fx1.jpg https://s3-eu-west-1.amazonaws.com/prod-ucs-content-store-eu-west/content/pii:S1872206715611251/fx1/DOWNSAMPLED/image/jpeg/4a9f3080f7ff304f3a826af56206b7f0/fx1.jpg https://s3.amazonaws.com/prod-ucs-content-store-us-east/content/pii:S1872206715611251/fx1/DOWNSAMPLED/image/jpeg/4a9f3080f7ff304f3a826af56206b7f0/fx1.jpg fx1 true fx1.jpg jpg 38869 222 301 IMAGE-DOWNSAMPLED 1-s2.0-S1872206715611251-gr1.jpg https://s3-eu-west-1.amazonaws.com/prod-ucs-content-store-eu-west/content/pii:S1872206715611251/gr1/DOWNSAMPLED/image/jpeg/f00fb47b4a67e9182f8d717971f99585/gr1.jpg https://s3.amazonaws.com/prod-ucs-content-store-us-east/content/pii:S1872206715611251/gr1/DOWNSAMPLED/image/jpeg/f00fb47b4a67e9182f8d717971f99585/gr1.jpg gr1 gr1.jpg jpg 27506 209 261 IMAGE-DOWNSAMPLED 1-s2.0-S1872206715611251-gr10.jpg https://s3-eu-west-1.amazonaws.com/prod-ucs-content-store-eu-west/content/pii:S1872206715611251/gr10/DOWNSAMPLED/image/jpeg/6eb732adc3e16d3914c179c836fbf474/gr10.jpg https://s3.amazonaws.com/prod-ucs-content-store-us-east/content/pii:S1872206715611251/gr10/DOWNSAMPLED/image/jpeg/6eb732adc3e16d3914c179c836fbf474/gr10.jpg gr10 gr10.jpg jpg 59805 634 294 IMAGE-DOWNSAMPLED 1-s2.0-S1872206715611251-gr2.jpg https://s3-eu-west-1.amazonaws.com/prod-ucs-content-store-eu-west/content/pii:S1872206715611251/gr2/DOWNSAMPLED/image/jpeg/d779a1ba4373e438f2e7a1de81615bd6/gr2.jpg https://s3.amazonaws.com/prod-ucs-content-store-us-east/content/pii:S1872206715611251/gr2/DOWNSAMPLED/image/jpeg/d779a1ba4373e438f2e7a1de81615bd6/gr2.jpg gr2 gr2.jpg jpg 27024 236 301 IMAGE-DOWNSAMPLED 1-s2.0-S1872206715611251-gr3.jpg https://s3-eu-west-1.amazonaws.com/prod-ucs-content-store-eu-west/content/pii:S1872206715611251/gr3/DOWNSAMPLED/image/jpeg/9abba6a0aab6527eaa61c6f4099b3d9a/gr3.jpg https://s3.amazonaws.com/prod-ucs-content-store-us-east/content/pii:S1872206715611251/gr3/DOWNSAMPLED/image/jpeg/9abba6a0aab6527eaa61c6f4099b3d9a/gr3.jpg gr3 gr3.jpg jpg 40277 280 318 IMAGE-DOWNSAMPLED 1-s2.0-S1872206715611251-gr4.jpg https://s3-eu-west-1.amazonaws.com/prod-ucs-content-store-eu-west/content/pii:S1872206715611251/gr4/DOWNSAMPLED/image/jpeg/ed5f1068b2eb33561e07515f4bead757/gr4.jpg https://s3.amazonaws.com/prod-ucs-content-store-us-east/content/pii:S1872206715611251/gr4/DOWNSAMPLED/image/jpeg/ed5f1068b2eb33561e07515f4bead757/gr4.jpg gr4 gr4.jpg jpg 48394 237 337 IMAGE-DOWNSAMPLED 1-s2.0-S1872206715611251-gr5.jpg https://s3-eu-west-1.amazonaws.com/prod-ucs-content-store-eu-west/content/pii:S1872206715611251/gr5/DOWNSAMPLED/image/jpeg/5e95ed84aec5004d06acbe4b499da890/gr5.jpg https://s3.amazonaws.com/prod-ucs-content-store-us-east/content/pii:S1872206715611251/gr5/DOWNSAMPLED/image/jpeg/5e95ed84aec5004d06acbe4b499da890/gr5.jpg gr5 gr5.jpg jpg 47625 228 310 IMAGE-DOWNSAMPLED 1-s2.0-S1872206715611251-gr6.jpg https://s3-eu-west-1.amazonaws.com/prod-ucs-content-store-eu-west/content/pii:S1872206715611251/gr6/DOWNSAMPLED/image/jpeg/7b12a6878691100c6180bb5e4d776c08/gr6.jpg https://s3.amazonaws.com/prod-ucs-content-store-us-east/content/pii:S1872206715611251/gr6/DOWNSAMPLED/image/jpeg/7b12a6878691100c6180bb5e4d776c08/gr6.jpg gr6 gr6.jpg jpg 46746 262 354 IMAGE-DOWNSAMPLED 1-s2.0-S1872206715611251-gr7.jpg https://s3-eu-west-1.amazonaws.com/prod-ucs-content-store-eu-west/content/pii:S1872206715611251/gr7/DOWNSAMPLED/image/jpeg/830b1d7bc2473db7e04d47a795834fff/gr7.jpg https://s3.amazonaws.com/prod-ucs-content-store-us-east/content/pii:S1872206715611251/gr7/DOWNSAMPLED/image/jpeg/830b1d7bc2473db7e04d47a795834fff/gr7.jpg gr7 gr7.jpg jpg 99780 377 754 IMAGE-DOWNSAMPLED 1-s2.0-S1872206715611251-gr8.jpg https://s3-eu-west-1.amazonaws.com/prod-ucs-content-store-eu-west/content/pii:S1872206715611251/gr8/DOWNSAMPLED/image/jpeg/8a27c3e1f8d008da32f8999416d2581a/gr8.jpg https://s3.amazonaws.com/prod-ucs-content-store-us-east/content/pii:S1872206715611251/gr8/DOWNSAMPLED/image/jpeg/8a27c3e1f8d008da32f8999416d2581a/gr8.jpg gr8 gr8.jpg jpg 54274 247 338 IMAGE-DOWNSAMPLED 1-s2.0-S1872206715611251-gr9.jpg https://s3-eu-west-1.amazonaws.com/prod-ucs-content-store-eu-west/content/pii:S1872206715611251/gr9/DOWNSAMPLED/image/jpeg/183a002aa88e767beb0dea02ece344ed/gr9.jpg https://s3.amazonaws.com/prod-ucs-content-store-us-east/content/pii:S1872206715611251/gr9/DOWNSAMPLED/image/jpeg/183a002aa88e767beb0dea02ece344ed/gr9.jpg gr9 gr9.jpg jpg 39055 161 337 IMAGE-DOWNSAMPLED 1-s2.0-S1872206715611251-si1.gif https://s3-eu-west-1.amazonaws.com/prod-ucs-content-store-eu-west/content/pii:S1872206715611251/STRIPIN/image/gif/9e27f12e0fcda99992e4a6729fc2618a/si1.gif https://s3.amazonaws.com/prod-ucs-content-store-us-east/content/pii:S1872206715611251/STRIPIN/image/gif/9e27f12e0fcda99992e4a6729fc2618a/si1.gif si1 si1.gif gif 1233 19 365 ALTIMG 1-s2.0-S1872206715611251-si2.gif https://s3-eu-west-1.amazonaws.com/prod-ucs-content-store-eu-west/content/pii:S1872206715611251/STRIPIN/image/gif/cbf6b8c2419686361239fc913f976e42/si2.gif https://s3.amazonaws.com/prod-ucs-content-store-us-east/content/pii:S1872206715611251/STRIPIN/image/gif/cbf6b8c2419686361239fc913f976e42/si2.gif si2 si2.gif gif 1494 19 460 ALTIMG 1-s2.0-S1872206715611251-si3.gif https://s3-eu-west-1.amazonaws.com/prod-ucs-content-store-eu-west/content/pii:S1872206715611251/STRIPIN/image/gif/ed387a670d34161d58db317da19ac067/si3.gif https://s3.amazonaws.com/prod-ucs-content-store-us-east/content/pii:S1872206715611251/STRIPIN/image/gif/ed387a670d34161d58db317da19ac067/si3.gif si3 si3.gif gif 368 19 109 ALTIMG 1-s2.0-S1872206715611251-si4.gif https://s3-eu-west-1.amazonaws.com/prod-ucs-content-store-eu-west/content/pii:S1872206715611251/STRIPIN/image/gif/b14d8ccb6413d8e0471e361f2dc9a0f9/si4.gif https://s3.amazonaws.com/prod-ucs-content-store-us-east/content/pii:S1872206715611251/STRIPIN/image/gif/b14d8ccb6413d8e0471e361f2dc9a0f9/si4.gif si4 si4.gif gif 444 19 132 ALTIMG 1-s2.0-S1872206715611251-si5.gif https://s3-eu-west-1.amazonaws.com/prod-ucs-content-store-eu-west/content/pii:S1872206715611251/STRIPIN/image/gif/858d9b81226be10082dbe2dba7d40abc/si5.gif https://s3.amazonaws.com/prod-ucs-content-store-us-east/content/pii:S1872206715611251/STRIPIN/image/gif/858d9b81226be10082dbe2dba7d40abc/si5.gif si5 si5.gif gif 770 19 233 ALTIMG 1-s2.0-S1872206715611251-si6.gif https://s3-eu-west-1.amazonaws.com/prod-ucs-content-store-eu-west/content/pii:S1872206715611251/STRIPIN/image/gif/84f7549e842c98463eb249692662c4e1/si6.gif https://s3.amazonaws.com/prod-ucs-content-store-us-east/content/pii:S1872206715611251/STRIPIN/image/gif/84f7549e842c98463eb249692662c4e1/si6.gif si6 si6.gif gif 522 16 146 ALTIMG 1-s2.0-S1872206715611251-si7.gif https://s3-eu-west-1.amazonaws.com/prod-ucs-content-store-eu-west/content/pii:S1872206715611251/STRIPIN/image/gif/98d5537024d5957a4a209e02a838cfb5/si7.gif https://s3.amazonaws.com/prod-ucs-content-store-us-east/content/pii:S1872206715611251/STRIPIN/image/gif/98d5537024d5957a4a209e02a838cfb5/si7.gif si7 si7.gif gif 559 19 176 ALTIMG CHNJC 61125 S1872-2067(15)61125-1 10.1016/S1872-2067(15)61125-1 Dalian Institute of Chemical Physics, the Chinese Academy of Sciences Fig. 1 Comparison of equilibrium potential with actual discharge potential. Reprinted with permission from Ref. [30]. Copyright 2013, Royal Society of Chemistry. Fig. 2 Galvanostatic discharge curves of Li−CO2 cells operated at various temperatures. Reprinted with permission from Ref. [30]. Copyright 2013, Royal Society of Chemistry. Fig. 3 Discharge curves of the Li–O2/CO2 batteries with various ratio of CO2 in O2/CO2 mixed gas at 25 °C (current density 0.2 mA/cm2). Reprinted with permission from Ref. [19]. Copyright 2011, Royal Society of Chemistry. Fig. 4 Activation barrier and binding reaction energy from discrete Fourier Transform (DFT) calculations at the initial complex formation (ICF) step with the use of ethylene carbonate (EC) (a), DMSO (b), and dimethyl ether (DME) (c) electrolytes. Reprinted with permission from Ref. [31]. Copyright 2013, American Chemical Society. Fig. 5 DFT predicted trend of activation barrier (ΔE ‡ , dashed) and binding reaction energy (ΔE, solid) plotted against (dielectric constant)−1 for the ICF steps of the two reactions. Reprinted with permission from Ref. [31]. Copyright 2013, American Chemical Society. Fig. 6 Charge-discharge curves of the Li−O2 battery, Li−CO2/O2 (2: 1 in volume ratio) battery and Li−CO2 battery. Reprinted with permission from Ref. [28]. Copyright 2014, Royal Society of Chemistry. Fig. 7 Charge-discharge voltage profiles, differential capacity curve, and voltage hysteresis curves of the Li−CO2/O2 (2:1) and the Li−CO2 battery. Reprinted with permission from Ref. [28]. Copyright 2014, Royal Society of Chemistry. Fig. 8 (a) Cyclic voltammetry (CV) curves of batteries. (b) Initial discharge curves of the batteries. Curtailing capacity of 1000 mAh/g at current densities of 50 mA/g (c) and 100 mA/g (d). Reprinted with permission from Ref. [23]. Copyright 2015, Wiley VCH. Fig. 9 SEM (a) and TEM (b) images of the CNTs. Inset of (b) is the HRTEM image. Reprinted with permission from Ref. [39]. Copyright 2015, Royal Society of Chemistry. Fig. 10 (a) Initial discharge curves of CNT cathodes at 50 and 100 mA/g. Recycling performance of the Li−CO2 batteries at 50 mA/g (b) and 100 mA/g (c) under a cutoff capacity of 1000 mAh/g. Reprinted with permission from Ref. [39]. Copyright 2015, Royal Society of Chemistry. Table 1 Possible reactions of Li2CO3 formation [25]. Number Possible reactions ΔG/(kJ/mol) 1 Li2O2 + electrolyte → Li2CO3 Uncertain 2 Li2O2 + C + 1/2O2 → Li2CO3 −561.0 3 2Li2O2 + C → Li2O + Li2CO3 −551.2 4 2Li2O2 + 2CO2 → 2Li2CO3 + O2 −333.3 5 4Li + 3CO2 → 2Li2CO3 + C −1081.0 Table 2 Possible reactions or pathways of Li2CO3 decomposition [25]. Number Possible mechanisms or paths E°/V 6 Li2CO3 → CO2 + 1/2O2 + 2Li+ + 2e− 3.82 7 Li2CO3 + 1/2C → 3/2CO2 + 2Li+ + 2e− 2.80 8 Li2CO3 + electrolyte → Unknown Uncertain Table 3 Summary of cathode catalysts for Li–CO2 batteries. Cathode catalyst Discharge capacity (mAh/g) Applied current Working gas (ratio by volume) Working temperature (°C) Electrolyte Efficiency (%) Ref. Ketjen black ∼5800 0.2 mA/cm2 CO2:O2 = 2:1 25 LiTFSI dissolved in EC/DEC Unknown [19] 66 0.2 mA/cm2 Prue CO2 25 LiTFSI dissolved in EC/DEC Unknown [19] 1880 30 mA/g CO2:O2 = 2:1 25 LiCF3SO3 dissolved in TEGDME ∼98.6 [28] 1032 30 mA/g Prue CO2 25 LiCF3SO3 dissolved in TEGDME ∼96.2 [28] ∼2400 0.4 mA/cm2 CO2:O2 = 1:1 25 TBAPF6 dissolved in DMSO Unknown [31] ∼2200 0.4 mA/cm2 CO2:O2 = 9:1 25 TBAPF6 dissolved in DMSO Unknown [31] ∼2050 0.4 mA/cm2 CO2:O2 = 1:1 25 TBAPF6 dissolved in DME Unknown [31] ∼3800 0.4 mA/cm2 CO2:O2 = 9:1 25 TBAPF6 dissolved in DME Unknown [31] Graphene 14722 50 mA/g Prue CO2 25 LiTFSI dissolved in TEGDME ∼40 [23] 6600 100 mA/g Prue CO2 25 LiTFSI dissolved in TEGDME ∼36 [23] Super P ∼0 0.05 mA/cm2 Prue CO2 25 LiTFSI dissolved in [bmim][Tf2N] Unknown [30] High surface area carbon ∼750 0.05 mA/cm2 Prue CO2 25 LiTFSI dissolved in [bmim][Tf2N] Unknown [30] Blending conductive carbon ∼2000 0.05 mA/cm2 Prue CO2 60 LiTFSI dissolved in [bmim][Tf2N] Unknown [30] ∼2800 0.05 mA/cm2 Prue CO2 80 LiTFSI dissolved in [bmim][Tf2N] Unknown [30] ∼3800 0.05 mA/cm2 Prue CO2 100 LiTFSI dissolved in [bmim][Tf2N] Unknown [30] CNTs 8379 50 mA/g Prue CO2 25 LiTFSI dissolved in TEGDME Unknown [39] 5786 100 mA/g Prue CO2 25 LiTFSI dissolved in TEGDME Unknown [39] Porous Au ∼220 30 mA/g Prue CO2 25 LiCF3SO3 dissolved in TEGDME ∼98 [23] Published 5 July 2016 This work was supported by the National Basic Research Program of China (973 Program, 2014CB932302, 2014CB932303), the National Natural Science Foundation of China (21403107, 21373111), Natural Science Foundation of Jiangsu Province of China (BK20140055), Specialized Research Fund for the Doctoral Program of Higher Education of China (20120091120022), PAPD of Jiangsu Higher Education Institutions, and the Project on Union of Industry-Study-Research of Jiangsu Province (BY2015069-01). Review (Special Issue on Electrocatalysis Transformation) Progress in research on Li–CO2 batteries: Mechanism, catalyst and performance Xiang Li a Sixie Yang a Ningning Feng a Ping He a * Haoshen Zhou a b # a Center of Energy Storage Materials & Technology, College of Engineering and Applied Sciences, National Laboratory of Solid State Microstructures, and Collaborative Innovation Center of Advanced Microstructures, Nanjing University, Nanjing 210093, Jiangsu, China Center of Energy Storage Materials & Technology College of Engineering and Applied Sciences National Laboratory of Solid State Microstructures Collaborative Innovation Center of Advanced Microstructures Nanjing University Nanjing Jiangsu 210093 China b Energy Technology Research Institute, National Institute of Advanced Industrial Science and Technology (AIST), Umezono 1-1-1, Tsukuba 305-8568, Japan Energy Technology Research Institute National Institute of Advanced Industrial Science and Technology (AIST) Umezono 1-1-1 Tsukuba 305-8568 Japan * Corresponding author Corresponding author # Corresponding author Corresponding author Rechargeable Li–CO2 batteries provide a promising new approach for carbon capture and energy storage technology. However, their practical application is limited by many challenges despite much progress in this technology. Recent development in Li–CO2 batteries is presented. The reaction mechanism with an air cathode, operating temperatures used, electrochemical performance under different CO2 concentrations, stability of the battery in different electrolytes, and utilization of different cathode materials were emphasized. At last, challenges and perspectives were also presented. This review provides a deep understanding of Li–CO2 batteries and offers important guidelines for developing reversible and high efficiency Li–CO2 batteries. Graphical Abstract The Li–CO2 battery system is a promising potential technology for CO2 capture and next-generation energy storage. It is indispensable to understand these fundamental issues including organic electrolyte, cathode catalysts, and reaction mechanisms. Keywords Lithium carbon dioxide batteries Reaction mechanism on cathode Catalyst design Carbon capture 1 Introduction The total energy consumption worldwide is currently at 14 TW per year. Even it is projected to roughly triple by 2050 [1]. In 2009, close to 83% of current energy needs was met by the combustion of fossil fuels (e.g. coal, natural gas, and petroleum products). These fuels emit large amounts of CO2 which is a leading greenhouse gas. CO2 emission is now thousands of metric tons per year. Coal-fired power plants provide the largest CO2 production [2–4]. Therefore, effective measures should be implemented to alleviate CO2 emission. Several eco-friendly and high energy density battery systems, such as Li–ion or Li–air batteries, have been developed to substitute traditional fossil fuels. Unfortunately, the energy limits of prevailing Li–ion batteries are insufficient to meet the demands of smart grids and electric vehicles for long distance transportation. Li–O2 batteries were developed which can deliver a gravimetric energy density of ∼3500 Wh/kg (from a simple reaction of Li with O2) which is substantially higher than other systems (e.g., ∼350 Wh/kg for a graphite/LiCoO2 system) [5–8]. Recent studies have illustrated that the Li–air batteries can be made to sustain several hundreds of cycles by using a stable electrolyte, highly efficient catalyst, and optimized battery design. Despite these advances, the development of Li−air batteries is still relatively new. These batteries are limited by poor knowledge of their reaction mechanism and practical issues such as poor recyclability, high polarization, and low rate capability. Furthermore, the effect of the presence of non-O2 components in air on the reaction mechanism in Li–air batteries remains unknown because previous studies were conducted in pure O2. The influence of the other constituents of air (N2, Ar, H2O, and CO2) on the operation of the Li–air battery should be elucidated to develop the Li–air battery technology for ambient conditions. Although N2 and noble gases, such as Ar are more abundant in ambient air, the conventional cathode voltage of ∼3 V cannot activate electrochemical reactions involving these gases and Li. For example, the formation potential is 0.444 V for the following reaction, where Δf G° is standard Gibbs free energy: 3 Li + 1 / 2 N 2 → Li 3 N [ Δ f G o ( Li 3 N ) = − 42.89 kJ / mol ] [9]. H2O is another component of air, accounting for 1.6 vol% in ambient air at 25 °C and 50% relative humidity (RH) [10]. Battery performance will deteriorate in the presence of water due to the corrosion of Li metal [11] and Li2O2 [7–12]. Moreover, SO2 is a component of polluted air and an inherently harmful gas. A Li–SO2 battery has been used in military and aerospace applications. However, the emission of SO2 gas into the atmosphere will be undesirable when the battery is charged [13]. So the Li–SO2 battery is still highly restricted for civil use. In contrast, CO2 can undergo electrochemical reactions with Li (some involving O2 as well). The voltage for the formation of Li2CO3 is 3.82 V for the following reaction: 2 Li + 1 / 2 O 2 + CO 2 → Li 2 CO 3 ( Δ f G o ( Li 2 CO 3 ) = − 566.10 kJ / mol ) Moreover, Li2CO3 is more chemically stable than Li2O2 (Δf G°(Li2O2) = −285.60 kJ/mol). The difference in chemical stability implies that Li2O2 is easily converted into Li2CO3 in the presence of CO2 because of the thermodynamic driving force [14]. Furthermore, the high solubility of CO2 gas in organic electrolytes (∼50 times higher than O2) [15] results in the high possibility of CO2 participation in battery reactions although the CO2 content in air is only 0.03 vol% [10]. Thus, the reactions involving CO2 and the chemistry of Li2CO3 in a Li–air battery must be elucidated. CO2 would have the most influence on the chemistry of Li−air batteries among the various constituents of air when moisture is removed by waterproof films. CO2 is the working gas in Li−CO2 batteries. Thus, exploring Li−CO2 batteries is necessary. 2 Reaction mechanism on cathodes The formation and decomposition mechanism of Li2CO3 has received much attention in recent years. Two conditions, namely, CO2/O2 mixture or pure CO2 as working gas, have to be discussed when it comes to the reaction mechanism in a Li–CO2 battery. For the mechanism in CO2/O2 mixture gas, We [16] explored the electrochemical reaction mechanism of a Li–CO2/O2 battery with the gaseous tracer technique. An oxygen molecule is believed to be reduced to form a superoxide radical anion (O2 •−) after extracting one electron from the carbon air electrode in the presence of O2. (1) O 2 + e − → O 2 • − (2) O 2 • − + Li + → LiO 2 (3) O 2 • − + solvent → ( solvent − O 2 ) • − (4) 2 LiO 2 → Li 2 O 2 + O 2 (5) LiO 2 + Li + + e − → Li 2 O 2 The resultant O2 •− can coordinate with one Li+ to form an intermediate product, LiO2 (Eq. (2)), precipitate on the air cathode, and/or attack a solvent molecule by the nucleophilic mechanism (Eq. (3)) [17]. Eqs. (2) and (3) are competitive depending on the stability of the solvent molecules in the vicinity of O2 •−. LiO2 is not thermodynamically stable and would convert to Li2O2 through either a chemical (Eq. (4)) and/or an electrochemical pathway (Eq. (5)). Auerbach et al. [18] suggested that Li2O2 was formed by the reaction of Li+ and a peroxide anion (O2 2−), which was formed through the disproportionation and/or electrochemical reaction of superoxide radical anions. On the one hand, CO2 is highly soluble in aprotic solvents and can easily react with the intermediate species O2 •− to finally generate Li2CO3 [19]. On the other hand, Li2O2 prefers to form Li2CO3. The presence of Li2CO3 at cathodes mainly originated from the decomposition of the organic electrolyte[20], oxidation of carbon-based cathode [20–22], reactions between Li2O2 or Li and residual CO2 from ambient air, as summarized in Table 1 [23–24]. For the mechanism in pure CO2 gas, reversible Li2CO3 has also been confirmed as the final product [23]. A “thermal trigger” region was observed in a Li–CO2 battery from 40 to 60 °C in which the discharge potential changed obviously (Fig. 1 ). The potential of a Li–CO2 cell can be estimated from the electrochemical reactions using the formula E = −ΔG/zF [26], where ΔG is the change in Gibbs free energy, z represents the number of electrons transferred per mole of product, and F is the Faraday constant. The cell potential was estimated based on the thermodynamic data [27]. In Fig. 1, this is the dashed line assuming that the simplest known reaction between Li and CO2, 2Li + 2CO2 → Li2CO3 + CO, dominates the discharge process. The measured cell potential initially approaches the calculated equilibrium potential, but then surpassed it. According to Tafel theory, the actual discharge potential cannot exceed the theoretical equilibrium potential, which implied that the proposed reaction is incorrect. Moreover, differential electrochemical mass spectrometry (DEMS) indicated that CO was not a reaction product. Thus, the reaction 4Li + 3CO2 → 2Li2CO3 + C was considered (No. 5 in Table 1). The cell potential estimated based on this reaction is shown in Fig. 1 as the dotted line. The measured cell discharge potentials at elevated temperature were consistently lower than the equilibrium potentials, which implied that this reaction was relevant to the discharging mechanism of the Li–CO2 battery. Carbon is another discharge product besides Li2CO3 from reaction No. 5 in Table 1. Porous gold was used as a cathode in the Li–CO2 battery to confirm the existence of carbon [28]. The discharge and charge curves of the Li–CO2 battery with porous gold as cathode were similar to the battery with Ketjen black (KB) as cathode. Amorphous carbon was observed by surface-enhanced Raman spectroscopy and electron energy loss spectroscopy. Whether the reaction mechanism is the same in Li–CO2 batteries with porous Au and KB as the cathode is unclear. Thus, the results with porous Au as the cathode were used as the reference. The formation mechanism of Li2CO3 is relatively clear compared to the decomposition mechanism. A mechanism of Li2CO3 reversible decomposition remains unclear. The possible reactions of Li2CO3 decomposition are displayed in Table 2 [29]. Further studies should be performed to elucidate the decomposition mechanism to enhance the understanding of Li–CO2 batteries. 3 Factors affecting the properties of Li–CO2 batteries The performance of a battery is affected by many factors such as operating temperature, active gas, electrolytes, and cathode materials. 3.1 Benefit of higher temperature The performance of a Li–CO2 battery can be affected by the temperature. A Li–CO2 battery that consumes pure CO2 gas exhibited a high discharge capacity of 2500 mAh/g at moderate temperature [30]. Fig. 2 shows the galvanostatic discharge curves of Li–CO2 batteries at different temperatures in the range of 60–100 °C at a fixed current density of 0.05 mA/cm2 and final potential of 2 V. The discharge potential increased with increasing temperature. A high operating temperature presents at least two beneficial effects. The higher temperature increases the solubility of Li2CO3 in the electrolyte and reduces its deposition on the electrode. Meanwhile, a higher temperature also reduces the transport barrier at the cathode-electrolyte interface. However, these data were obtained in the first discharge process, and changes in the performance in later cycles are not known. 3.2 Mixed CO2/O2 as the active gas Aside from pure CO2, mixed CO2/O2 is also used as the active gas. Takechi et al. [19] first reported the application of a CO2/O2 mixed gas (from 0% to 100% volume CO2) as the active material for Li–CO2/O2 batteries. The system using a mixed gas of CO2 and O2 delivered a very high discharge capacity which was three times that of a non-aqueous Li–O2 battery. The discharge profiles of the batteries with different CO2 concentrations are shown in Fig. 3 . The Li–O2/CO2 battery (CO2 ratio was 50%) had triple the discharge capacity compared with the Li–O2 battery. Only a small capacity (66 mAh/g) was obtained when pure CO2 was applied in the battery, contrary to the report by Liu et al. [28]. This difference may be due to the difference in the types of cathodes and electrolytes used. The inset showed the relative discharge capacities of the Li–O2/CO2 battery with various CO2 ratios in the mixed gas. The discharge capacity of the battery with 10% CO2 in the mixed gas was the highest and was twice that of the standard Li–O2 battery. Meanwhile, 30% CO2 enhanced the performance of Li–O2/CO2 battery by almost three times that of the Li–O2 battery. The appropriate CO2 ratio to get the maximum capacity was from 30% to 70%. The capacity was dramatically reduced when the CO2 ratio was higher than 80%. In contrast, the battery can operate well in pure CO2 with different cathode materials. A reasonable explanation for the mechanism with these cathode materials remains to be established. Further work that elucidates the mechanism and properties of the Li–O2/CO2 batteries should be conducted to further improve the performance of the battery. 3.3 Stability of electrolytes Lim et al. [31] investigated the reaction mechanism in the Li–O2/CO2 cell for various electrolyte conditions using quantum mechanical simulations combined with experimental verification. The subtle balance among the various reaction pathways can be modified by electrolyte solvation. Thus, a low dielectric electrolyte primarily forms Li2O2, while a high dielectric electrolyte is effective in electrochemically activating CO2 and yielding only Li2CO3. A high dielectric medium, such as dimethyl sulfoxide (DMSO), can result in the reversible reaction of Li2CO3 over multiple cycles which may be due to minimizing side reactions. The first reaction step can be reasonably taken to be an “oxygen reduction reaction step”. A radical nucleophile reagent is created after the capture of an electron by the O2 molecule at the cathode. O2 − then reacts vigorously with a neutral or charged species in the battery, such as CO2, Li+ or electrolyte. Fig. 4 illustrates the possible reaction pathways for the initial complex formation. This includes the reaction energy (ΔE) and the activation barrier for the reaction in the three electrolytes (EC, DMSO, and DME). The reaction of O2 − with CO2 in EC is more favored both thermodynamically and kinetically than its reaction with Li+ (Fig. 4(a)). However, a ring-opening reaction for O2 − with EC (ΔE = −29.7 kJ/mol) is the most thermodynamically favored, from considering the surrounding electrolyte. Thus, although the activation barrier for reaction 2.3 is higher than reaction 2.2 (Fig. 4), the final resulting of reaction 2.3 is expected to drive the reaction pathway because of higher stability, However, the ring-opening reaction is not the most favored reaction in the DMSO (Fig. 4(b)) or DME (Fig. 4(c)) electrolytes. O2 − preferentially reacts with CO2 over Li+ in DMSO. In contrast, the reaction of O2 − with Li+ is much more likely than the others in DME (Fig. 1(c)). The DFT results for other organic solvents are exhibited in Fig. 5 . The reaction energies decrease linearly with the increase of the inverse of the dielectric constant of the electrolyte, particularly for reaction 2.1. The effect by the dielectric constant is much less for the reaction of O2 − with CO2. The contrasting behavior of these two reactions implied that O2 − was more likely to react with CO2 in a high dielectric solvent and with Li+ in a low dielectric solvent in Li−O2/CO2 batteries. The possible discharge products in Li–O2/CO2 batteries are Li2O2 and Li2CO3. Thus, DMSO is a good choice for Li–O2/CO2 as the electrolyte. The effect of the electrolyte on Li−pure CO2, however, should still be investigated. In addition, solid state electrolytes can be considered for use in Li–CO2 batteries because of their good recycling performance [32]. 3.4 Diversity of cathodes for Li–CO2 batteries 3.4.1 Ketjen black Ketjen black is usually used as a cathode in Li–CO2 batteries because of its excellent electrical conductivity, chain configuration, small particles and wide size distributions. Liu et al. [28] reported rechargeable Li–CO2/O2 (2:1) and Li–CO2 batteries using KB as the cathode and the catalyst operated at room temperature. The profiles of charge and discharge are shown in Fig. 6 . The discharge profiles of the three batteries are similar. The Li–CO2/O2 (2:1) battery showed the highest discharge voltage at 2.75 V versus Li+/Li. The Li–O2 system showed a slope, while the other two systems mainly demonstrated a high charging plateau above 4.0 V versus Li+/Li. This result implied a higher polarization of CO2−based batteries during charging. This characteristic may be caused by thermodynamic or kinetic factors, and needs future clarification. The charge and discharge profiles, differential capacities, and polarization voltage of the Li–CO2/O2 (2:1) battery are shown in Fig. 7 (a)–(c). Those for the Li–CO2 battery are shown in Fig. 7(d)−(f). Li2O2 has a low conductivity. Garcia-Lastra et al. [33] showed that the charge transport of Li2CO3 was even poorer than that of Li2O2. The Li−CO2 battery can operate reversibly, and the charging platform voltages were not higher than 4.3 V in the first five cycles. The round-trip efficiency of the Li–CO2/O2 (2:1) battery was 66.7% (the value is 66.3% for the Li–CO2 battery). The polarization of the Li–CO2 battery was slightly larger than that of the Li–CO2/O2 (2:1) battery. The battery can operate over tens of cycles without a catalyst and special cathode material at high CO2 concentrations. 3.4.2 Graphene Graphene has attracted much attention as an ideal cathode material for Li–O2 batteries because of high electrical conductivity, large surface area, and high electrochemical stability. This material can play an important role in Li–CO2 batteries because it also provides efficient diffusion channels, enough space, and active sites [34–37]. Zhang et al. [23] first intro duced graphene into Li–CO2 batteries. Fig. 8(a) displays the CV data to explore the catalytic activity of graphene and shows the evident cathodic and anodic peaks under CO2 atmosphere. The graphene cathode delivered capacities of 14722 mAh/g and 6600 mAh/g (Fig. 8(b)) at a current densities of 50 mA/g and 100 mA/g, respectively. A stable discharge platform of 2.77 V was observed, which was extremely close to the equilibrium voltage of Li–CO2 batteries [30]. The results indeed were greatly improved compared with those based on KB. The system exhibited a small discharge capacity when the working gas was Ar. The batteries showed good recycling performance over 20 cycles and the overpotential increased with cycle, which was attributed to the accumulation of inactive Li2CO3. Previous reports showed that Li–CO2 batteries could only operate at high temperatures [30] or at a low current density (30 mA/g) [28]. Graphene showed a relatively good performance but the instability of the battery system caused by the increased overpotential after 20 cycles needs further improvement. Additionally, the calculated voltage of the reaction 4Li + 3CO2 = C + 2Li2CO3 is 2.66 V, which was roughly consistent with the experimental data (2.8 V). Thus, this reaction can occur. A Pt net was used as the cathode to confirm the presence of carbon by electron energy loss spectroscopy. Whether the reaction mechanism is the same as that for Li–CO2 batteries with a Pt net or graphene as the cathode remains ambiguous. Thus, the introduction of a Pt net was only used to confirm the presence of carbon as a reference. Although graphene cathodes have exhibited excellent electrochemical activity in Li–CO2 batteries, their kinetic parameters still have to be much improved to enhance the efficiency of Li–O2 batteries [34–38]. 3.4.3 Carbon nanotubes (CNTs) Similar to graphene, CNTs with a high electrical conductivity, large surface area, abundant channels, porosity, and 3D characteristics are considered to facilitate the transport of both electrons and gases, as well as the deposition of discharge products. Thus, CNTs were selected as cathode materials to enhance the electrochemical process and cycling stability of rechargeable Li–CO2 batteries [39]. The SEM and TEM images of the CNTs are shown in Fig. 9 . The tubes stacked together and formed numerous pores and channels, which benefit the diffusion of CO2 and electrolytes. The inset showed that the wall thickness of the CNTs was approximately 5 nm. The first discharge curves of the batteries were evaluated in the voltage range of 2.2−4.3 V. The discharge capacities were obtained at current densities of 50 mA/g and 100 mA/g normalized to the weight of the CNTs. This is shown in Fig. 10(a) . A low over-potential of 0.13 V can be clearly observed in Fig. 10(b) with a cut-off capacity of 1000 mAh/g at 50 mA/g, indicating the high electrochemical activity of CNTs cathodes. The lower discharge plateau appeared in Fig. 10(c) at 100 mA/g which may be attributed to the Ohmic resistance of the batteries. They also thought that CNT cathodes enhanced the performances of the Li–CO2 batteries because of their structural advantages. First, the good electrical conductivity of 1D CNTs is convenient for electron transport [40]. Second, the 3D networks formed from stackable and interlaced carbon nanotubes not only favorably allow electron transport in every direction [41], but also have more space for the deposition of discharged products. The space in the networks facilitates the transport of CO2 and Li ions [42]. Moreover, other than layered graphene, which can only deposit Li2CO3 on the surface, excessive Li2CO3 prevents the transport of electrons. CNT cathodes can deposit Li2CO3 in their whole 3D networks and endow the batteries with improved recycling capability. Due to the considerable performance of the Li–CO2 batteries, these batteries were extensively investigated before their commercialization [43]. This work can promote the realization of true Li–air batteries. However, few reports on the application of metal catalysts in Li–CO2 batteries are available. Wang et al. [44] clarified the effect of reducing parasitic reactions using a highly efficient Au/δ-MnO2 catalytic electrode. TiC [45] and 3D porous Ru [46] were also used to reduce the polarization voltage. Introduction of soluble catalysts are a new approach to improve the round-trip efficiency of the battery [47]. Until now, carbon materials are commonly used as the cathode because of their superior electrical conductivity and high surface area. However, the reaction mechanism when charging the battery is unclear. A noble metal is expensive and difficult to fabricate as a porous electrode with high surface area, but it can reduce parasitic reactions and polarization. Moreover, the mechanism is easier to elucidate with a noble metal. Therefore, identifying new catalysts should be prioritized in Li–CO2 batteries. Transition metal oxides are effective catalysts in lithium secondary batteries. Carbon/metal oxide compositions may be suitable as cathodic catalysts for Li–CO2 batteries. A summary of cathode catalysts for Li–CO2 batteries is illustrated in Table 3 . The deposition of Li2CO3 on the surface of the cathode will deteriorate the performance of the batteries. Li–CO2 batteries with hybrid electrolytes [48] should be designed and studied in the future to prevent rapid blocking of the solid electrode surface by Li2CO3. 4 Conclusions and perspective Recent studies on the reaction mechanism, electrolyte, working gas, operating temperature, and different cathode materials for Li–CO2 batteries were reviewed. Superoxide radicals anion (O2 −) generated during discharge chemically attack carbonate electrolyte solvents when a CO2/O2 mixed gas is used. However, ether-based, amide-based, and DMSO electrolytes are reasonably stable against the superoxide during discharge. The use of a high dielectric electrolyte helps preserve the reversible reaction of Li2CO3 by electrochemically activating CO2. Thus, DMSO is the optimal electrolyte for a Li–CO2 battery. The properties of the battery can be improved by using a mixed gas of O2 and CO2 as the working gas. The capacity was improved in the range of 30%−70% CO2. A high temperature improved the capacity of the battery. CNTs and graphene as air cathodes of the Li–CO2 battery delivered a high discharge capacity and sustained stable recyclability. These materials have excellent electrical conductivity, a porous structure, and catalytic activity, and they can be used as references. In addition, adopting noble metal or soluble catalysts is a new approach to improve the round-trip efficiency of the battery. Li–CO2 batteries with hybrid electrolytes should be designed and studied in the future. The reaction mechanism in the battery is still unclear, especially for the charging process, and should receive attention in future investigations. This paper reviewed recent progress on stable Li–CO2 batteries. Li–CO2 batteries provide a promising new approach for CO2 capture and generation of electrical energy. However, the reaction mechanism, thermodynamic and kinetic properties are still unknown and require further investigation. A better understanding of the electrochemical mechanism in Li–CO2 systems is important. A stable Li–CO2 system depends on finding stable electrolytes and effective catalysts to reduce the discharge/charge over-potential and improve energy efficiency. References 1 P. Weisz Phys. Today 57 2004 18 20 2 C. Gough Int. J. Greenhouse Gas Control 2 2008 155 168 3 P. Luby M.R. Susta Power 151 2007 40 50 4 H. Balat C. Oz Energy Explor. Exploit. 25 2007 357 392 5 P.G. Bruce S.A. Freunberger L.J. Hardwick J.M. Tarascon Nat. Mater. 11 2012 19 29 6 M. Leskes N.E. Drewett L.J. Hardwick P.G. Bruce G.R. Goward C.P. Grey Angew. Chem. Int. Ed. 51 2012 8560 8563 7 R. Black S.H. Oh J.H. Lee T. Yim B. Adams L.F. Nazar J. Am. Chem. Soc. 134 2012 2902 2905 8 P. Hartmann C.L. Bender M. Vracar A.K. Durr A. Garsuch J. Janek P. Adelhelm Nat. Mater. 12 2013 228 232 9 S.C. Nam Y.S. Yoon W.I. Cho B.W. Cho H.S. Chun K.S. Yun J. Electrochem. Soc. 148 2001 A220 A223 10 S. Meini M. Piana N. Tsiouvaras A. Garsuch H.A. Gasteiger Electrochem. Solid State Lett. 15 2012 A45 A48 11 J.L. Shui J.S. Okasinski P. Kenesei H.A. Dobbs D. Zhao J.D. Almer D.J. Liu Nat. Commun. 4 2013 2255 12 T. Zhang H.S. Zhou Nat. Commun. 4 2013 1817 13 H.D. Lim H. Park H. Kim J. Kim B. Lee Y. Bae H. Gwon K. Kang Angew. Chem. Int. Ed. 54 2015 9663 9667 14 J. Christensen P. Albertus R.S. Sanchez-Carrera T. Lohmann B. Kozinsky R. Liedtke J. Ahmed A. Kojic J. Electrochem. Soc. 159 2012 R1 R30 15 J.D. Wadhawan P.J. Welford E. Maisonhaute V. Climent N.S. Lawrence R.G. Compton H.B. McPeak C.E.W. Hahn J. Phys. Chem. B 105 2001 10659 10668 16 S.X. Yang P. He H.S. Zhou Energy Environ. Sci. 9 2016 1650 1654 17 W. Xu K. Xu V.V. Viswanathan S.A. Towne J.S. Hardy J. Xiao Z.M. Nie D.H. Hu D.Y. Wang J.G. Zhang J. Power Sources 196 2011 9631 9639 18 D. Aurbach Y. Gofer M. Ben-Zion P. Aped J. Electroanal. Chem. 339 1992 451 471 19 K. Takechi T. Shiga T. Asaoka Chem. Commun. 47 2011 3463 3465 20 B.D. McCloskey A. Speidel R. Scheffler D.C. Miller V. Viswanathan J.S. Hummelshoj J.K. Norskov A.C. Luntz J. Phys. Chem. Lett. 3 2012 997 1001 21 M.M.O. Thotiyl S.A. Freunberger Z.Q. Peng P.G. Bruce J. Am. Chem. Soc. 135 2013 494 500 22 D.M. Itkis D.A. Semenenko E.Y. Kataev A.I. Belova V.S. Neudachina A.P. Sirotina M. Havecker D. Teschner A. Knop-Gericke P. Dudin A. Barinov E.A. Goodilin Y. Shao-Horn L.V. Yashina Nano Lett. 13 2013 4697 4701 23 Z. Zhang Q. Zhang Y.A. Chen J. Bao X.L. Zhou Z.J. Xie J.P. Wei Z. Zhou Angew. Chem. Int. Ed. 54 2015 6550 6553 24 S.R. Gowda A. Brunet G.M. Wallraff B.D. McCloskey J. Phys. Chem. Lett. 4 2013 276 279 25 N.N. Feng P. He H.S. Zhou Adv. Energy Mater. 6 2016 1502303 26 K.J. Vetter Z. Phys. Chem. 52 1967 47 59 27 M.W. Chase J. Phys. Chem. Ref. Data 27 1998 i ii 28 Y.L. Liu R. Wang Y.C. Lyu H. Li L.Q. Chen Energy Environ. Sci. 7 2014 677 681 29 C. Ling R.G. Zhang K. Takechi F. Mizuno J. Phys. Chem. C 118 2014 26591 26598 30 S.M. Xu S.K. Das L.A. Archer RSC Adv. 3 2013 6656 6660 31 H.K. Lim H.D. Lim K.Y. Park D.H. Seo H. Gwon J. Hong W.A. Goddard H. Kim K. Kang J. Am. Chem. Soc. 135 2013 9733 9742 32 Y.J. Liu B.J. Li H. Kitaura X.P. Zhang M. Han P. He H.S. Zhou ACS Appl. Mater. Inter. 7 2015 17307 17310 33 J.M. Garcia-Lastra J.S.G. Myrdal R. Christensen K.S. Thygesen T. Vegge J. Phys. Chem. C 117 2013 5568 5577 34 E.J. Yoo H.S. Zhou RSC Adv. 4 2014 11798 11801 35 W.Y. Zhang Y. Zeng C. Xu H.T. Tan W.L. Liu J.X. Zhu N. Xiao H.H. Hng J. Ma H.E. Hoster R. Yazami Q.Y. Yan RSC Adv. 2 2012 8508 8514 36 Y.L. Li J.J. Wang X.F. Li D.S. Geng R.Y. Li X.L. Sun Chem. Commun. 47 2011 9438 9440 37 J. Xiao D.H. Mei X.L. Li W. Xu D.Y. Wang G.L. Graff W.D. Bennett Z.M. Nie L.V. Saraf I.A. Aksay J. Liu J.G. Zhang Nano Lett. 11 2011 5071 5078 38 G. Wu N.H. Mack W. Gao S.G. Ma R.Q. Zhong J.T. Han J.K. Baldwin P. Zelenay ACS Nano 6 2012 9764 9776 39 X. Zhang Q. Zhang Z. Zhang Y.N. Chen Z.J. Xie J.P. Wei Z. Zhou Chem. Commun. 51 2015 14636 14639 40 R. Mi S.M. Li X.C. Liu L.M. Liu Y.C. Li J. Mei Y.G. Chen H. Liu H. Wang H. Yan W.M. Lau J. Mater. Chem. A 2 2014 18746 18753 41 C. Liu F. Li L.P. Ma H.M. Cheng Adv. Mater. 22 2010 E28 E62 42 L. Noerochim J.Z. Wang S.L. Chou H.J. Li H.K. Liu Electrochim. Acta 56 2010 314 320 43 Z.Q. Peng S.A. Freunberger Y.H. Chen P.G. Bruce Science 337 2012 563 566 44 G.Q. Wang L.L. Huang S.Y. Liu J. Xie S.C. Zhang P.Y. Zhe G.S. Cao X.B. Zhao ACS Appl. Mater. Inter. 7 2015 23876 23884 45 F.L. Qiu P. He J. Jiang X.P. Zhang S.F. Tong H.S. Zhou Chem. Commun. 52 2016 2713 2716 46 J. Jiang P. He S.F. Tong M.B. Zheng Z.X. Lin X.P. Zhang Y. Shi H.S. Zhou NPG Asia Mater. 8 2016 e239 47 N.N. Feng P. He H.S. Zhou ChemSusChem 8 2015 600 602 48 P. He T. Zhang J. Jiang H.S. Zhou J. Phys. Chem. Lett. 7 2016 1267 1280",
      "scopus-id": "84975141238",
      "coredata": {
        "eid": "1-s2.0-S1872206715611251",
        "dc:description": "Rechargeable Li–CO2 batteries provide a promising new approach for carbon capture and energy storage technology. However, their practical application is limited by many challenges despite much progress in this technology. Recent development in Li–CO2 batteries is presented. The reaction mechanism with an air cathode, operating temperatures used, electrochemical performance under different CO2 concentrations, stability of the battery in different electrolytes, and utilization of different cathode materials were emphasized. At last, challenges and perspectives were also presented. This review provides a deep understanding of Li–CO2 batteries and offers important guidelines for developing reversible and high efficiency Li–CO2 batteries.",
        "openArchiveArticle": "false",
        "prism:coverDate": "2016-07-31",
        "openaccessUserLicense": null,
        "prism:aggregationType": "Journal",
        "prism:url": "https://api.elsevier.com/content/article/pii/S1872206715611251",
        "dc:creator": [
          {
            "@_fa": "true",
            "$": "Li, Xiang"
          },
          {
            "@_fa": "true",
            "$": "Yang, Sixie"
          },
          {
            "@_fa": "true",
            "$": "Feng, Ningning"
          },
          {
            "@_fa": "true",
            "$": "He, Ping"
          },
          {
            "@_fa": "true",
            "$": "Zhou, Haoshen"
          }
        ],
        "link": [
          {
            "@_fa": "true",
            "@rel": "self",
            "@href": "https://api.elsevier.com/content/article/pii/S1872206715611251"
          },
          {
            "@_fa": "true",
            "@rel": "scidir",
            "@href": "https://www.sciencedirect.com/science/article/pii/S1872206715611251"
          }
        ],
        "dc:format": "application/json",
        "openaccessType": null,
        "pii": "S1872-2067(15)61125-1",
        "prism:volume": "37",
        "prism:publisher": "Dalian Institute of Chemical Physics, the Chinese Academy of Sciences. Published by Elsevier B.V.",
        "dc:title": "Progress in research on Li–CO2 batteries: Mechanism, catalyst and performance",
        "prism:copyright": "Copyright © 2016 Dalian Institute of Chemical Physics, the Chinese Academy of Sciences. Published by Elsevier B.V. All rights reserved.",
        "openaccess": "0",
        "prism:issn": "18722067",
        "prism:issueIdentifier": "7",
        "dcterms:subject": [
          {
            "@_fa": "true",
            "$": "Lithium carbon dioxide batteries"
          },
          {
            "@_fa": "true",
            "$": "Reaction mechanism on cathode"
          },
          {
            "@_fa": "true",
            "$": "Catalyst design"
          },
          {
            "@_fa": "true",
            "$": "Carbon capture"
          }
        ],
        "openaccessArticle": "false",
        "prism:publicationName": "Chinese Journal of Catalysis",
        "prism:number": "7",
        "openaccessSponsorType": null,
        "prism:pageRange": "1016-1024",
        "prism:endingPage": "1024",
        "pubType": "rev",
        "prism:coverDisplayDate": "July 2016",
        "prism:doi": "10.1016/S1872-2067(15)61125-1",
        "prism:startingPage": "1016",
        "dc:identifier": "doi:10.1016/S1872-2067(15)61125-1",
        "openaccessSponsorName": null
      },
      "objects": {
        "object": [
          {
            "@category": "thumbnail",
            "@height": "162",
            "@width": "219",
            "@_fa": "true",
            "$": "https://api.elsevier.com/content/object/eid/1-s2.0-S1872206715611251-fx1.sml?httpAccept=%2A%2F%2A",
            "@multimediatype": "GIF image file",
            "@type": "IMAGE-THUMBNAIL",
            "@size": "21738",
            "@ref": "fx1",
            "@mimetype": "image/gif"
          },
          {
            "@category": "thumbnail",
            "@height": "164",
            "@width": "204",
            "@_fa": "true",
            "$": "https://api.elsevier.com/content/object/eid/1-s2.0-S1872206715611251-gr1.sml?httpAccept=%2A%2F%2A",
            "@multimediatype": "GIF image file",
            "@type": "IMAGE-THUMBNAIL",
            "@size": "11408",
            "@ref": "gr1",
            "@mimetype": "image/gif"
          },
          {
            "@category": "thumbnail",
            "@height": "164",
            "@width": "76",
            "@_fa": "true",
            "$": "https://api.elsevier.com/content/object/eid/1-s2.0-S1872206715611251-gr10.sml?httpAccept=%2A%2F%2A",
            "@multimediatype": "GIF image file",
            "@type": "IMAGE-THUMBNAIL",
            "@size": "9276",
            "@ref": "gr10",
            "@mimetype": "image/gif"
          },
          {
            "@category": "thumbnail",
            "@height": "164",
            "@width": "209",
            "@_fa": "true",
            "$": "https://api.elsevier.com/content/object/eid/1-s2.0-S1872206715611251-gr2.sml?httpAccept=%2A%2F%2A",
            "@multimediatype": "GIF image file",
            "@type": "IMAGE-THUMBNAIL",
            "@size": "11189",
            "@ref": "gr2",
            "@mimetype": "image/gif"
          },
          {
            "@category": "thumbnail",
            "@height": "164",
            "@width": "186",
            "@_fa": "true",
            "$": "https://api.elsevier.com/content/object/eid/1-s2.0-S1872206715611251-gr3.sml?httpAccept=%2A%2F%2A",
            "@multimediatype": "GIF image file",
            "@type": "IMAGE-THUMBNAIL",
            "@size": "14655",
            "@ref": "gr3",
            "@mimetype": "image/gif"
          },
          {
            "@category": "thumbnail",
            "@height": "154",
            "@width": "219",
            "@_fa": "true",
            "$": "https://api.elsevier.com/content/object/eid/1-s2.0-S1872206715611251-gr4.sml?httpAccept=%2A%2F%2A",
            "@multimediatype": "GIF image file",
            "@type": "IMAGE-THUMBNAIL",
            "@size": "15966",
            "@ref": "gr4",
            "@mimetype": "image/gif"
          },
          {
            "@category": "thumbnail",
            "@height": "161",
            "@width": "219",
            "@_fa": "true",
            "$": "https://api.elsevier.com/content/object/eid/1-s2.0-S1872206715611251-gr5.sml?httpAccept=%2A%2F%2A",
            "@multimediatype": "GIF image file",
            "@type": "IMAGE-THUMBNAIL",
            "@size": "17326",
            "@ref": "gr5",
            "@mimetype": "image/gif"
          },
          {
            "@category": "thumbnail",
            "@height": "162",
            "@width": "219",
            "@_fa": "true",
            "$": "https://api.elsevier.com/content/object/eid/1-s2.0-S1872206715611251-gr6.sml?httpAccept=%2A%2F%2A",
            "@multimediatype": "GIF image file",
            "@type": "IMAGE-THUMBNAIL",
            "@size": "15151",
            "@ref": "gr6",
            "@mimetype": "image/gif"
          },
          {
            "@category": "thumbnail",
            "@height": "109",
            "@width": "219",
            "@_fa": "true",
            "$": "https://api.elsevier.com/content/object/eid/1-s2.0-S1872206715611251-gr7.sml?httpAccept=%2A%2F%2A",
            "@multimediatype": "GIF image file",
            "@type": "IMAGE-THUMBNAIL",
            "@size": "13498",
            "@ref": "gr7",
            "@mimetype": "image/gif"
          },
          {
            "@category": "thumbnail",
            "@height": "160",
            "@width": "219",
            "@_fa": "true",
            "$": "https://api.elsevier.com/content/object/eid/1-s2.0-S1872206715611251-gr8.sml?httpAccept=%2A%2F%2A",
            "@multimediatype": "GIF image file",
            "@type": "IMAGE-THUMBNAIL",
            "@size": "20587",
            "@ref": "gr8",
            "@mimetype": "image/gif"
          },
          {
            "@category": "thumbnail",
            "@height": "105",
            "@width": "219",
            "@_fa": "true",
            "$": "https://api.elsevier.com/content/object/eid/1-s2.0-S1872206715611251-gr9.sml?httpAccept=%2A%2F%2A",
            "@multimediatype": "GIF image file",
            "@type": "IMAGE-THUMBNAIL",
            "@size": "23497",
            "@ref": "gr9",
            "@mimetype": "image/gif"
          },
          {
            "@category": "standard",
            "@height": "222",
            "@width": "301",
            "@_fa": "true",
            "$": "https://api.elsevier.com/content/object/eid/1-s2.0-S1872206715611251-fx1.jpg?httpAccept=%2A%2F%2A",
            "@multimediatype": "JPEG image file",
            "@type": "IMAGE-DOWNSAMPLED",
            "@size": "38869",
            "@ref": "fx1",
            "@mimetype": "image/jpeg"
          },
          {
            "@category": "standard",
            "@height": "209",
            "@width": "261",
            "@_fa": "true",
            "$": "https://api.elsevier.com/content/object/eid/1-s2.0-S1872206715611251-gr1.jpg?httpAccept=%2A%2F%2A",
            "@multimediatype": "JPEG image file",
            "@type": "IMAGE-DOWNSAMPLED",
            "@size": "27506",
            "@ref": "gr1",
            "@mimetype": "image/jpeg"
          },
          {
            "@category": "standard",
            "@height": "634",
            "@width": "294",
            "@_fa": "true",
            "$": "https://api.elsevier.com/content/object/eid/1-s2.0-S1872206715611251-gr10.jpg?httpAccept=%2A%2F%2A",
            "@multimediatype": "JPEG image file",
            "@type": "IMAGE-DOWNSAMPLED",
            "@size": "59805",
            "@ref": "gr10",
            "@mimetype": "image/jpeg"
          },
          {
            "@category": "standard",
            "@height": "236",
            "@width": "301",
            "@_fa": "true",
            "$": "https://api.elsevier.com/content/object/eid/1-s2.0-S1872206715611251-gr2.jpg?httpAccept=%2A%2F%2A",
            "@multimediatype": "JPEG image file",
            "@type": "IMAGE-DOWNSAMPLED",
            "@size": "27024",
            "@ref": "gr2",
            "@mimetype": "image/jpeg"
          },
          {
            "@category": "standard",
            "@height": "280",
            "@width": "318",
            "@_fa": "true",
            "$": "https://api.elsevier.com/content/object/eid/1-s2.0-S1872206715611251-gr3.jpg?httpAccept=%2A%2F%2A",
            "@multimediatype": "JPEG image file",
            "@type": "IMAGE-DOWNSAMPLED",
            "@size": "40277",
            "@ref": "gr3",
            "@mimetype": "image/jpeg"
          },
          {
            "@category": "standard",
            "@height": "237",
            "@width": "337",
            "@_fa": "true",
            "$": "https://api.elsevier.com/content/object/eid/1-s2.0-S1872206715611251-gr4.jpg?httpAccept=%2A%2F%2A",
            "@multimediatype": "JPEG image file",
            "@type": "IMAGE-DOWNSAMPLED",
            "@size": "48394",
            "@ref": "gr4",
            "@mimetype": "image/jpeg"
          },
          {
            "@category": "standard",
            "@height": "228",
            "@width": "310",
            "@_fa": "true",
            "$": "https://api.elsevier.com/content/object/eid/1-s2.0-S1872206715611251-gr5.jpg?httpAccept=%2A%2F%2A",
            "@multimediatype": "JPEG image file",
            "@type": "IMAGE-DOWNSAMPLED",
            "@size": "47625",
            "@ref": "gr5",
            "@mimetype": "image/jpeg"
          },
          {
            "@category": "standard",
            "@height": "262",
            "@width": "354",
            "@_fa": "true",
            "$": "https://api.elsevier.com/content/object/eid/1-s2.0-S1872206715611251-gr6.jpg?httpAccept=%2A%2F%2A",
            "@multimediatype": "JPEG image file",
            "@type": "IMAGE-DOWNSAMPLED",
            "@size": "46746",
            "@ref": "gr6",
            "@mimetype": "image/jpeg"
          },
          {
            "@category": "standard",
            "@height": "377",
            "@width": "754",
            "@_fa": "true",
            "$": "https://api.elsevier.com/content/object/eid/1-s2.0-S1872206715611251-gr7.jpg?httpAccept=%2A%2F%2A",
            "@multimediatype": "JPEG image file",
            "@type": "IMAGE-DOWNSAMPLED",
            "@size": "99780",
            "@ref": "gr7",
            "@mimetype": "image/jpeg"
          },
          {
            "@category": "standard",
            "@height": "247",
            "@width": "338",
            "@_fa": "true",
            "$": "https://api.elsevier.com/content/object/eid/1-s2.0-S1872206715611251-gr8.jpg?httpAccept=%2A%2F%2A",
            "@multimediatype": "JPEG image file",
            "@type": "IMAGE-DOWNSAMPLED",
            "@size": "54274",
            "@ref": "gr8",
            "@mimetype": "image/jpeg"
          },
          {
            "@category": "standard",
            "@height": "161",
            "@width": "337",
            "@_fa": "true",
            "$": "https://api.elsevier.com/content/object/eid/1-s2.0-S1872206715611251-gr9.jpg?httpAccept=%2A%2F%2A",
            "@multimediatype": "JPEG image file",
            "@type": "IMAGE-DOWNSAMPLED",
            "@size": "39055",
            "@ref": "gr9",
            "@mimetype": "image/jpeg"
          },
          {
            "@category": "thumbnail",
            "@height": "19",
            "@width": "365",
            "@_fa": "true",
            "$": "https://api.elsevier.com/content/object/eid/1-s2.0-S1872206715611251-si1.gif?httpAccept=%2A%2F%2A",
            "@multimediatype": "GIF image file",
            "@type": "ALTIMG",
            "@size": "1233",
            "@ref": "si1",
            "@mimetype": "image/gif"
          },
          {
            "@category": "thumbnail",
            "@height": "19",
            "@width": "460",
            "@_fa": "true",
            "$": "https://api.elsevier.com/content/object/eid/1-s2.0-S1872206715611251-si2.gif?httpAccept=%2A%2F%2A",
            "@multimediatype": "GIF image file",
            "@type": "ALTIMG",
            "@size": "1494",
            "@ref": "si2",
            "@mimetype": "image/gif"
          },
          {
            "@category": "thumbnail",
            "@height": "19",
            "@width": "109",
            "@_fa": "true",
            "$": "https://api.elsevier.com/content/object/eid/1-s2.0-S1872206715611251-si3.gif?httpAccept=%2A%2F%2A",
            "@multimediatype": "GIF image file",
            "@type": "ALTIMG",
            "@size": "368",
            "@ref": "si3",
            "@mimetype": "image/gif"
          },
          {
            "@category": "thumbnail",
            "@height": "19",
            "@width": "132",
            "@_fa": "true",
            "$": "https://api.elsevier.com/content/object/eid/1-s2.0-S1872206715611251-si4.gif?httpAccept=%2A%2F%2A",
            "@multimediatype": "GIF image file",
            "@type": "ALTIMG",
            "@size": "444",
            "@ref": "si4",
            "@mimetype": "image/gif"
          },
          {
            "@category": "thumbnail",
            "@height": "19",
            "@width": "233",
            "@_fa": "true",
            "$": "https://api.elsevier.com/content/object/eid/1-s2.0-S1872206715611251-si5.gif?httpAccept=%2A%2F%2A",
            "@multimediatype": "GIF image file",
            "@type": "ALTIMG",
            "@size": "770",
            "@ref": "si5",
            "@mimetype": "image/gif"
          },
          {
            "@category": "thumbnail",
            "@height": "16",
            "@width": "146",
            "@_fa": "true",
            "$": "https://api.elsevier.com/content/object/eid/1-s2.0-S1872206715611251-si6.gif?httpAccept=%2A%2F%2A",
            "@multimediatype": "GIF image file",
            "@type": "ALTIMG",
            "@size": "522",
            "@ref": "si6",
            "@mimetype": "image/gif"
          },
          {
            "@category": "thumbnail",
            "@height": "19",
            "@width": "176",
            "@_fa": "true",
            "$": "https://api.elsevier.com/content/object/eid/1-s2.0-S1872206715611251-si7.gif?httpAccept=%2A%2F%2A",
            "@multimediatype": "GIF image file",
            "@type": "ALTIMG",
            "@size": "559",
            "@ref": "si7",
            "@mimetype": "image/gif"
          }
        ]
      },
      "link": {
        "@rel": "abstract",
        "@href": "https://api.elsevier.com/content/abstract/scopus_id/84975141238"
      }
    }
  }
}