{
  "metadata": {
    "title": "Heterostructuring 2D TiO<ce:inf loc=post>2</ce:inf> nanosheets <ce:italic>in situ</ce:italic> grown on Ti<ce:inf loc=post>3</ce:inf>C<ce:inf loc=post>2</ce:inf>T<ce:inf loc=post><ce:italic>x</ce:italic></ce:inf> MXene to improve the electrocatalytic nitrogen reduction",
    "authors": "; ; ",
    "journal": "Chinese Journal of Catalysis",
    "date": "2022-07-31",
    "doi": "10.1016/S1872-2067(21)64020-2",
    "abstract": "",
    "uri": "https://api.elsevier.com/content/article/pii/S1872206721640202",
    "pii": "S1872206721640202"
  },
  "fulltext": {
    "full-text-retrieval-response": {
      "scopus-eid": "2-s2.0-85130444365",
      "originalText": "serial JL 273538 291210 291744 291809 31 Chinese Journal of Catalysis CHINESEJOURNALCATALYSIS 2022-05-21 2022-05-21 2022-05-21 2022-05-21 2022-06-24T19:57:21 1-s2.0-S1872206721640202 S1872-2067(21)64020-2 S1872206721640202 10.1016/S1872-2067(21)64020-2 S300 S300.2 FULL-TEXT 1-s2.0-S1872206722X00077 2022-06-24T20:36:00.883086Z 0 0 20220701 20220731 2022 2022-05-21T16:03:52.482897Z absattachment articleinfo articletitlenorm authfirstinitialnorm authfirstsurnamenorm cid cids contenttype copyright crossmark dateloaded dateloadedtxt datesearch datesort dateupdated dco docsubtype doctype doi eid ewtransactionid hubeid indexeddate issfirst issn issnnorm issuelist itemstage itemtransactionid itemweight openaccess openarchive pg pgfirst pglast pii piinorm pubdateend pubdatestart pubdatetxt pubyr sortorder srctitle srctitlenorm srctype ssids alllist content subj subheadings tomb volfirst volissue volumelist webpdf webpdfpagecount yearnav figure e-component body affil appendices articletitle auth authfirstini authfull authkeywords authlast primabst pubtype ref specialabst 1872-2067 18722067 true 43 43 7 7 Volume 43, Issue 7 33 1937 1944 1937 1944 202207 July 2022 2022-07-01 2022-07-31 2022 article fla Copyright © 2022 Dalian Institute of Chemical Physics, the Chinese Academy of Sciences. Published by Elsevier B.V. All rights reserved. HETEROSTRUCTURING2DTIO2NANOSHEETSINSITUGROWNTI3C2TXMXENEIMPROVEELECTROCATALYTICNITROGENREDUCTION QIAN X 1 Introduction 2 Results and discussion 3 Conclusions Supplementary Material References WAN 2019 69 90 Y HUANG 2021 1160 1167 B HE 2019 7311 7317 C LIU 2019 2884 2888 C LV 2019 12627 12634 J LI 2021 1755 1762 L AZOFRA 2016 2545 2549 L YU 2019 1905665 B XU 2021 e12122 X WANG 2019 9464 9469 Y WANG 2021 1024 1029 T ZHANG 2020 10888 10893 L LIU 2019 18903 18907 Y MA 2020 2002177 Y REN 2019 116 121 X LI 2019 2902 2908 L BAO 2017 1604799 D SHI 2017 1606550 M FANG 2019 1803406 Y WU 2019 18449 18453 T LIU 2020 1907690 Y GUO 2019 5658 5716 W ZHAO 2019 1802109 Y WANG 2020 118892 H QU 2021 288 296 J SU 2020 20411 20416 H SUN 2021 127177 B LI 2020 227481 J XU 2020 26060 26067 X NAGUIB 2011 4248 4253 M LUKATSKAYA 2013 1502 1505 M YANG 2018 165 172 C LI 2019 41440 41447 Y QIN 2021 1524 1527 Y MYTRAN 2021 148023 N LI 2019 63 Y LI 2019 12 20 Y LOW 2018 255 266 J GAO 2015 62 64 Y MIAO 2020 146929 Z YUAN 2020 21666 21675 Z CHEN 2021 1602 1614 L HUANG 2020 13679 13684 T LIU 2019 3898 S LIU 2018 1186 1191 Y YU 2018 1610 1622 X LIU 2019 16439 16444 Y QIANX2022X1937 QIANX2022X1937X1944 QIANX2022X1937XX QIANX2022X1937X1944XX 2024-05-21T00:00:00.000Z 2024-05-21T00:00:00.000Z http://creativecommons.org/licenses/by-nc-nd/4.0/ 0 item S1872-2067(21)64020-2 S1872206721640202 1-s2.0-S1872206721640202 10.1016/S1872-2067(21)64020-2 273538 2022-06-24T20:36:00.883086Z 2022-07-01 2022-07-31 1-s2.0-S1872206721640202-main.pdf https://s3-eu-west-1.amazonaws.com/prod-ucs-content-store-eu-west/content/pii:S1872206721640202/MAIN/application/pdf/c87ac90411df5c43989350a338aa4f02/main.pdf main.pdf pdf true 6379807 MAIN 8 1-s2.0-S1872206721640202-main_1.png https://s3-eu-west-1.amazonaws.com/prod-ucs-content-store-eu-west/content/pii:S1872206721640202/PREVIEW/image/png/081be675342039104e0b2c2b251d8730/main_1.png main_1.png png 53889 849 656 IMAGE-WEB-PDF 1 1-s2.0-S1872206721640202-gr1.jpg https://s3-eu-west-1.amazonaws.com/prod-ucs-content-store-eu-west/content/pii:S1872206721640202/gr1/THUMBNAIL/image/jpeg/e1c3909f7c0a8e2437186583bc7b312a/gr1.jpg gr1 gr1.jpg jpg 22575 227 244 IMAGE-DOWNSAMPLED 1-s2.0-S1872206721640202-gr2.jpg https://s3-eu-west-1.amazonaws.com/prod-ucs-content-store-eu-west/content/pii:S1872206721640202/gr2/DOWNSAMPLED/image/jpeg/cc7850734c8ebb8fad4a3f73aef907a3/gr2.jpg gr2 gr2.jpg jpg 38155 314 358 IMAGE-DOWNSAMPLED 1-s2.0-S1872206721640202-gr3.jpg https://s3-eu-west-1.amazonaws.com/prod-ucs-content-store-eu-west/content/pii:S1872206721640202/gr3/HIGHRES/image/jpeg/93d6c4d6f5cdaef5861b72cdf1f689c9/gr3.jpg gr3 gr3.jpg jpg 62252 372 369 IMAGE-DOWNSAMPLED 1-s2.0-S1872206721640202-gr4.jpg https://s3-eu-west-1.amazonaws.com/prod-ucs-content-store-eu-west/content/pii:S1872206721640202/gr4/DOWNSAMPLED/image/jpeg/942d7e33a2d2ec70bef44855dcc03f5c/gr4.jpg gr4 gr4.jpg jpg 48353 281 358 IMAGE-DOWNSAMPLED 1-s2.0-S1872206721640202-gr5.jpg https://s3-eu-west-1.amazonaws.com/prod-ucs-content-store-eu-west/content/pii:S1872206721640202/gr5/DOWNSAMPLED/image/jpeg/0d8a9953cff440f44f3919105fa429d9/gr5.jpg gr5 gr5.jpg jpg 42619 291 364 IMAGE-DOWNSAMPLED 1-s2.0-S1872206721640202-gr6.jpg https://s3-eu-west-1.amazonaws.com/prod-ucs-content-store-eu-west/content/pii:S1872206721640202/gr6/DOWNSAMPLED/image/jpeg/d9c13c57cdc10e1d94718b891d6ea678/gr6.jpg gr6 gr6.jpg jpg 101261 423 535 IMAGE-DOWNSAMPLED 1-s2.0-S1872206721640202-gr7.jpg https://s3-eu-west-1.amazonaws.com/prod-ucs-content-store-eu-west/content/pii:S1872206721640202/gr7/DOWNSAMPLED/image/jpeg/6abb0e5deaea36a2c2abd798c37cc4ab/gr7.jpg gr7 gr7.jpg jpg 17394 102 374 IMAGE-DOWNSAMPLED 1-s2.0-S1872206721640202-grap.jpg https://s3-eu-west-1.amazonaws.com/prod-ucs-content-store-eu-west/content/pii:S1872206721640202/grap/DOWNSAMPLED/image/jpeg/8c5ef95f9fe394f67a9e2df00ec0a0ea/grap.jpg grap true grap.jpg jpg 25574 245 269 IMAGE-DOWNSAMPLED 1-s2.0-S1872206721640202-gr1.sml https://s3-eu-west-1.amazonaws.com/prod-ucs-content-store-eu-west/content/pii:S1872206721640202/gr1/HIGHRES/image/gif/631352bb6cec72938013118785274b1b/gr1.sml gr1 gr1.sml sml 7403 164 176 IMAGE-THUMBNAIL 1-s2.0-S1872206721640202-gr2.sml https://s3-eu-west-1.amazonaws.com/prod-ucs-content-store-eu-west/content/pii:S1872206721640202/gr2/THUMBNAIL/image/gif/5414f46db8df09b75d2aba0ebd5e277d/gr2.sml gr2 gr2.sml sml 8973 164 187 IMAGE-THUMBNAIL 1-s2.0-S1872206721640202-gr3.sml https://s3-eu-west-1.amazonaws.com/prod-ucs-content-store-eu-west/content/pii:S1872206721640202/gr3/THUMBNAIL/image/gif/ad792ee6a4ea27ab38398b7eed3ceb66/gr3.sml gr3 gr3.sml sml 22159 163 162 IMAGE-THUMBNAIL 1-s2.0-S1872206721640202-gr4.sml https://s3-eu-west-1.amazonaws.com/prod-ucs-content-store-eu-west/content/pii:S1872206721640202/gr4/THUMBNAIL/image/gif/7b3bd7032a8a752b618a31d36341fadb/gr4.sml gr4 gr4.sml sml 13209 164 209 IMAGE-THUMBNAIL 1-s2.0-S1872206721640202-gr5.sml https://s3-eu-west-1.amazonaws.com/prod-ucs-content-store-eu-west/content/pii:S1872206721640202/gr5/THUMBNAIL/image/gif/d143bf4436116c036dfa0e47a4bfeabc/gr5.sml gr5 gr5.sml sml 11525 164 205 IMAGE-THUMBNAIL 1-s2.0-S1872206721640202-gr6.sml https://s3-eu-west-1.amazonaws.com/prod-ucs-content-store-eu-west/content/pii:S1872206721640202/gr6/THUMBNAIL/image/gif/4e7b1cfa79eee592baaab3c31b2e3fe0/gr6.sml gr6 gr6.sml sml 14972 164 207 IMAGE-THUMBNAIL 1-s2.0-S1872206721640202-gr7.sml https://s3-eu-west-1.amazonaws.com/prod-ucs-content-store-eu-west/content/pii:S1872206721640202/gr7/THUMBNAIL/image/gif/51521018d83fae8f9154d50c3df9ad03/gr7.sml gr7 gr7.sml sml 9218 60 219 IMAGE-THUMBNAIL 1-s2.0-S1872206721640202-grap.sml https://s3-eu-west-1.amazonaws.com/prod-ucs-content-store-eu-west/content/pii:S1872206721640202/grap/MAIN/image/gif/4271f750c52ca3c002cf54c553aefa3f/grap.sml grap true grap.sml sml 9610 164 180 IMAGE-THUMBNAIL 1-s2.0-S1872206721640202-gr1_lrg.jpg https://s3-eu-west-1.amazonaws.com/prod-ucs-content-store-eu-west/content/pii:S1872206721640202/HIGHRES/image/jpeg/929acf6612efd83a7d8675a3a5ce0940/gr1_lrg.jpg gr1 gr1_lrg.jpg jpg 97460 605 650 IMAGE-HIGH-RES 1-s2.0-S1872206721640202-gr2_lrg.jpg https://s3-eu-west-1.amazonaws.com/prod-ucs-content-store-eu-west/content/pii:S1872206721640202/HIGHRES/image/jpeg/73a6e91482ff0c811a348c75174fd810/gr2_lrg.jpg gr2 gr2_lrg.jpg jpg 173917 836 952 IMAGE-HIGH-RES 1-s2.0-S1872206721640202-gr3_lrg.jpg https://s3-eu-west-1.amazonaws.com/prod-ucs-content-store-eu-west/content/pii:S1872206721640202/HIGHRES/image/jpeg/1b1abaed98c3e31cb16c0064b0754abd/gr3_lrg.jpg gr3 gr3_lrg.jpg jpg 340526 990 982 IMAGE-HIGH-RES 1-s2.0-S1872206721640202-gr4_lrg.jpg https://s3-eu-west-1.amazonaws.com/prod-ucs-content-store-eu-west/content/pii:S1872206721640202/HIGHRES/image/jpeg/110cf1fbd6dbf10b794374dd5a81c167/gr4_lrg.jpg gr4 gr4_lrg.jpg jpg 221067 747 951 IMAGE-HIGH-RES 1-s2.0-S1872206721640202-gr5_lrg.jpg https://s3-eu-west-1.amazonaws.com/prod-ucs-content-store-eu-west/content/pii:S1872206721640202/HIGHRES/image/jpeg/d34bebc03d2b5bcd563703be69a05c7b/gr5_lrg.jpg gr5 gr5_lrg.jpg jpg 183464 775 969 IMAGE-HIGH-RES 1-s2.0-S1872206721640202-gr6_lrg.jpg https://s3-eu-west-1.amazonaws.com/prod-ucs-content-store-eu-west/content/pii:S1872206721640202/MAIN/image/jpeg/fbd61f726528ba8409f20d27f0e239d5/gr6_lrg.jpg gr6 gr6_lrg.jpg jpg 457022 1124 1422 IMAGE-HIGH-RES 1-s2.0-S1872206721640202-gr7_lrg.jpg https://s3-eu-west-1.amazonaws.com/prod-ucs-content-store-eu-west/content/pii:S1872206721640202/DOWNSAMPLED/image/jpeg/557299ba1e719989b8da1fe28a8e7879/gr7_lrg.jpg gr7 gr7_lrg.jpg jpg 82752 271 993 IMAGE-HIGH-RES 1-s2.0-S1872206721640202-grap_lrg.jpg https://s3-eu-west-1.amazonaws.com/prod-ucs-content-store-eu-west/content/pii:S1872206721640202/HIGHRES/image/jpeg/b242bc405975046fb796f42727594325/grap_lrg.jpg grap true grap_lrg.jpg jpg 108381 651 716 IMAGE-HIGH-RES 1-s2.0-S1872206721640202-mmc1.pdf https://s3-eu-west-1.amazonaws.com/prod-ucs-content-store-eu-west/content/pii:S1872206721640202/mmc1/MAIN/application/pdf/6735423bd37cdd7085f60583bb1eb422/mmc1.pdf mmc1 mmc1.pdf pdf false 2329397 APPLICATION CHNJC 64020 S1872-2067(21)64020-2 10.1016/S1872-2067(21)64020-2 Dalian Institute of Chemical Physics, the Chinese Academy of Sciences Fig. 1 XRD patterns of Ti3AlC2, Ti3C2T x MXene, and TiO2/Ti3C2T x MXene composites. Fig. 2 Fully scanned (a), Ti 2p (b), C 1s (c), and O 1s (d) XPS spectra of TiO2/Ti3C2T x MXene composites. Fig. 3 (a) SEM images of Ti3C2T x MXene; SEM (b), TEM (c), and HRTEM (d) images of TiO2/Ti3C2T x MXene. (e) Elemental mapping images of C, Ti, and O in TiO2/Ti3C2T x MXene composites. Fig. 4 (a) The dependence of current density on time for TiO2/Ti3C2T x MXene. (b) Average NH3 yields and FEs. (c) UV-Vis spectra of TiO2/Ti3C2T x MXene composites as a catalyst at different potentials. (d) NH3 yields rate and FEs at the applied potentials on TiO2/Ti3C2T x MXene, Ti3C2T x MXene, and pure TiO2 NSs. The error bars represent the standard deviation of three independent experiments. The specific error values of the NH3 yields are shown in Table S2. Fig. 5 (a) NH3 yields and FEs at −0.95 V during six consecutive cycling tests. (b) Chronoamperometry curve of TiO2/Ti3C2T x MXene composites after electrolysis at −0.95 V for 12 h. (c) NH3 yields and FEs of TiO2/Ti3C2T x MXene composites under different N2 flow rates. (d) 1H NMR spectra of 14NH4 + and 15NH4 + yielded from NRR tests (at −0.95 V) using 14N2 and 15N2 as the N2 source, respectively. Fig. 6 (a) The adsorption geometries of *NN, *NNH, *NHNH, *NHNH2, *NH2NH2, and *NH2 intermediates on TiO2/Ti3C2T x MXene composites surface along the alternating pathway. An asterisk (*) denotes the adsorption site. Cyan, navy blue, brown, red, and white spheres represent Ti, N, C, O, and H atoms, respectively. (b) Reaction free energy pathways of NRR on TiO2/Ti3C2T x MXene composites. (c) Free energy diagram of the NRR along the alternating pathway on TiO2/Ti3C2T x MXene composites and pure TiO2, respectively. Scheme 1 Schematic illustration of the synthesis of TiO2/Ti3C2T x MXene composites. This work was supported by the National Natural Science Foundation of China (51872173), Taishan Scholar Foundation of Shandong Province (tsqn201812068), Youth Innovation Technology Project of Higher School in Shandong Province (2019KJA013), Science and Technology Special Project of Qingdao City (20-3-4-3-nsh), the Opening Fund of State Key Laboratory of Heavy Oil Processing (SKLOP202002006), Innovation and Technology Commission of the Hong Kong Special Administrative Region (ITC-CNERC14EG03), Hong Kong Scholars Program (XJ2019042). Available online 20 May 2022 Article Heterostructuring 2D TiO2 nanosheets in situ grown on Ti3C2T x MXene to improve the electrocatalytic nitrogen reduction Xiu Qian a Yanjiao Wei a Mengjie Sun a Ye Han a * Xiaoli Zhang d Jian Tian a b # Minhua Shao b c $ a School of Materials Science and Engineering, Shandong University of Science and Technology, Qingdao 266590, Shandong, China School of Materials Science and Engineering Shandong University of Science and Technology Qingdao Shandong 266590 China School of Materials Science and Engineering, Shandong University of Science and Technology, Qingdao 266590, Shandong, China b Department of Chemical and Biological Engineering, The Hong Kong University of Science and Technology, Clear Water Bay, Kowloon, Hong Kong, China Department of Chemical and Biological Engineering The Hong Kong University of Science and Technology Clear Water Bay Kowloon Hong Kong China Department of Chemical and Biological Engineering, The Hong Kong University of Science and Technology, Clear Water Bay, Kowloon, Hong Kong, China c Energy Institute, and Chinese National Engineering Research Center for Control & Treatment of Heavy Metal Pollution, The Hong Kong University of Science and Technology, Clear Water Bay, Kowloon, Hong Kong, China Energy Institute, and Chinese National Engineering Research Center for Control & Treatment of Heavy Metal Pollution The Hong Kong University of Science and Technology Clear Water Bay Kowloon Hong Kong China Energy Institute, and Chinese National Engineering Research Center for Control & Treatment of Heavy Metal Pollution, The Hong Kong University of Science and Technology, Clear Water Bay, Kowloon, Hong Kong, China d School of Materials Science and Engineering, Zhengzhou University, Zhengzhou 450001, Henan, China School of Materials Science and Engineering Zhengzhou University Zhengzhou Henan 450001 China School of Materials Science and Engineering, Zhengzhou University, Zhengzhou 450001, Henan, China * Corresponding author # Corresponding author $ Corresponding author In this study, TiO2 nanosheets (NSs) grown in situ on extremely conductive Ti3C2T x MXene to form TiO2/Ti3C2T x MXene composites with abundant active sites are proposed to effectively achieve electrocatalytic NH3 synthesis. Electron transfer can be promoted by Ti3C2T x MXene with high conductivity. Meanwhile, the TiO2 NSs in-situ formation can not only avoid Ti3C2T x MXene microstacking but also enhance the surface specific area of Ti3C2T x MXene. The TiO2/Ti3C2T x MXene catalyst reaches a high Faradaic efficiency (FE) of 44.68% at −0.75 V vs. RHE and a large NH3 yield of 44.17 µg h−1 mg−1 cat. at −0.95 V, with strong electrochemical durability. 15N isotopic labeling experiments imply that the N in the produced NH3 originated from the N2 of the electrolyte. DFT calculations were conducted to determine the possible NRR reaction pathways for TiO2/Ti3C2T x MXene composites. MXene catalysts combined with other materials have been rationally designed for efficient ammonia production under ambient conditions. Graphical Abstract TiO2/Ti3C2T x MXene was prepared through the in situ growth of TiO2 nanosheets (NSs) on extremely conductive Ti3C2T x MXene, which exhibited an excellent electrochemical activity for NRR (NH3 yield of 44.17 µg h−1 mg−1 cat.). Keywords Electrocatalyst N2 reduction reaction TiO2 nanosheet Ti3C2T x MXene In-situ growth 1 Introduction As an essential activated nitrogen source, NH3 plays a vital role in polymers, textile industries, industrial manufacturing, and agricultural cultivation [1,2]. Owing to its considerable hydrogen capacity and high energy density [3], NH3 is one of the greenest and most ideal energy carriers, even as a substitute for H2 in the future energy economy, and it has also been considered a carbon-neutral energy-intensive carrier that will greatly promote the global carbon cycle [4]. Abundant nitrogen (N2) is the main raw material for synthesizing NH3, but the extremely high cleavage energy of N≡N triple bonds makes the nitrogen reduction reaction (NRR) extremely difficult [5,6]. Currently, NH3 production is mainly achieved using the Haber-Bosch method, which consumes high energy [7]. Therefore, the design of a sustainable approach to the N2-fixation strategy operated under mild pressure and temperature is needed [8–11]. The electrocatalytic NRR is a potential substitute for the Haber-Bosch method for NH3 synthesis because it can operate under ambient conditions and uses renewable raw materials such as N2 and water [12–16]. To date, although noble metals have exhibited an excellent electrocatalytic NRR activity, their high cost and low abundance limit their wide applications [17,18]. Research on NRR electrocatalysts has recently shifted to inexpensive and abundant transition metal oxides, including Cr2O3, Nb2O5, α-Fe2O3, MoO3, Fe3O4, Fe2O3, TiO2-rGO, α-Fe@Fe3O4, Bi4V2O11/CeO2, Fe/Fe3O4, and TiO2/Ti [19–21]. It is necessary to develop an ideal electrocatalyst that simultaneously meets the requirements of a high NH3 yield, remarkable selectivity, strong durability, and energy saving [22,23]. As an emerging 2D material, the chemical formula of MXene can be recorded as M n+1X n T x (n = 1, 2, and 3), where “M” represents transition metals (such as V, Ta, Mo, Ti, and Nb), whereas “X” indicates N or C or CN, and “T x ” presents surface functional groups (such as –O, –F, and –OH) [24,25]. Owing to its unique layered structure, excellent conductivity, flexibility, and hydrophilic surface, MXene has shown remarkable applications in catalysis, supercapacitors, biosensors, electronic devices, electromagnetic wave absorption, lithium-ion batteries, and energy storage fields. Owing to its remarkable conductivity and stability, Ti3C2T x MXene has proven to be a promising NRR catalyst based on theoretical calculations and experimental results [25]. However, to meet the demands of the NH3 industry, there is still a large gap to be filled in terms of both NH3 yield and NRR selectivity prior to practical application [15,26]. The lamellar structure of MXene is easy to stack, which reduces the specific surface area and affects the diffusion of ions between layers, resulting in a decrease in the electrochemical performance. An effective method to reduce the stacking of layers is to assemble them with other materials. The edge Ti atoms on the surface of Ti3C2T x MXene can serve as nucleation sites to generate relatively stable TiO2; thus, a heterojunction structure of TiO2 nanosheets (NSs) distributed in 2D Ti3C2T x MXene (TiO2/Ti3C2T x MXene) can easily be formed. Herein, TiO2 nanosheets were generated in situ on Ti3C2T x MXene to form TiO2/Ti3C2T x MXene composites through a one-step hydrothermal process. The TiO2/Ti3C2T x MXene catalyst achieved an NH3 yield of 44.17 µg h−1 mg−1 cat. at −0.95 V and an FE of 44.68% at −0.75 V, which are better than pure Ti3C2T x MXene (NH3 yield of 23.61 µg h−1 mg−1 cat., FE of 5.10%) and pure TiO2 NSs (NH3 yield of 26.23 µg h−1 mg−1 cat., FE of 1.54%), together with an excellent stability and durability. 2 Results and discussion Scheme 1 shows the preparation process for TiO2/Ti3C2T x MXene composites. Initially, through the selective etching of the Al layers of Ti3AlC2, multilayer Ti3C2T x MXene was obtained through the previously reported HF etching method [27,28]. Later, because the edge Ti atoms on the Ti3C2T x MXene surface can serve as nucleating sites to generate relatively stable TiO2, the TiO2 nanosheets generated in situ on the layered Ti3C2T x MXene (TiO2/Ti3C2T x MXene) were prepared through a one-step hydrothermal oxidation treatment of Ti3C2T x MXene with the assistance of HCl and NaBF4. Fig. 1 shows the X-ray diffraction (XRD) patterns of the samples. The Ti3AlC2 presents an excellent crystallinity (curve green), and the most intense peak at ~38.77° corresponds to the (104) plane of Ti3AlC2 (JCPDS No. 52-0875) [29]. After etching Al layers with HF, the strongest peak of Ti3AlC2 at 38.77° entirely disappears (curve orange). In addition, the (004) plane of Ti3AlC2 at 19.07° is broadened, owing to the interlayer spacing extension, indicating that the Al layers are successfully removed and Ti3C2T x MXene is formed [30,31]. Compared with an untreated Ti3C2T x MXene sample, the diffraction peaks of anatase TiO2 are observed after the hydrothermal oxidation of Ti3C2T x MXene (curve purple, JCPDS No. 21-1272) [32], which proves the successful generation of TiO2 NSs on Ti3C2T x MXene. As shown in the full-scale XPS survey spectrum (Fig. 2(a) ), Ti, C, and O can be seen in the TiO2/Ti3C2T x MXene composites, where the F element is ascribed to the F− ions from the HF solution physically adsorbed on the composites. Figs. 2(b)–(d) show the XPS analysis of O, C, and Ti from the TiO2/Ti3C2T x MXene composites. The Ti 2p spectrum of TiO2/Ti3C2T x MXene is deconvoluted into four peaks (Fig. 2(b)), in which 458.10 (Ti 2p 1/2) and 453.85 (Ti 2p 3/2) eV can be assigned to the Ti–C bonds of Ti3C2T x MXene, whereas the other two peaks at 463.75 eV (Ti 2p 1/2) and 456.60 eV (Ti 2p 3/2) are ascribed to the lattice Ti–O bonds of TiO2 [33,34]. The simultaneous existence of Ti–C bonds and Ti–O bonds proves the successful preparation of the TiO2/Ti3C2T x MXene composites. For the C 1s spectrum (Fig. 2(c)), the three peaks at 287.60, 283.65, and 280.20 eV are ascribed to the C–O–C, C–C, and C–Ti bonds, respectively [35,36]. In addition, for the O 1s spectrum of TiO2/Ti3C2T x MXene composites (Fig. 2(d)), three peaks at 529.15, 530.79, and 532.38 eV were detected, corresponding to the O-Ti, C-Ti-O x , and surface hydroxyl groups (–OH), respectively [32,37,38]. The morphologies and microscopic structures of Ti3C2T x MXene and TiO2/Ti3C2T x MXene were further elucidated using SEM and TEM, respectively. The morphology of bulk Ti3AlC2 was clearly observed using SEM (Fig. S1). As shown in Fig. 3(a) , the typical exfoliated 2D morphology of Ti3C2T x MXene can be determined through SEM characterization by etching the Al layer of bulk Ti3AlC2 with HF [39]. Because MXene contains thermodynamically stable edge transition metal atoms, after the hydrothermal oxidation of Ti3C2T x MXenes with HCl and NaBF4, the layered Ti3C2T x MXene offers Ti sources for the generation of TiO2, thus enabling TiO2 NSs to cross the Ti3C2T x MXene layer and form TiO2/Ti3C2T x MXene composites. It can be clearly seen from Fig. 3(b) that many nanosheets are formed on the surface of Ti3C2T x MXene, indicating that the TiO2 NSs were successfully grown on the surface of Ti3C2T x MXene. These nanosheets are anatase TiO2 with exposed (101) surfaces [17]. More importantly, the TiO2 NSs uniformly distributed around the layered Ti3C2T x MXene can provide more active sites for the NRR, which is beneficial for improving the electrocatalytic performance. To investigate the effect of active sites on the NRR, we conducted a BET analysis and electrochemical surface area (ESCA) measurements. TiO2/Ti3C2T x MXene presents a larger BET surface area (14.72 m2 g−1) than Ti3C2T x MXene (1.98 m2 g−1) and pure TiO2 NSs (10.197 m2 g−1) (Fig. S2), and the ECSA of TiO2/Ti3C2T x MXene is 0.3826 cm2, which is better than that of TiO2 NSs (0.0028 cm2) and Ti3C2T x MXene (0.301 cm2), suggesting that TiO2/Ti3C2T x MXene possesses more active sites (Fig. S3). In addition, the heterostructure formed by TiO2 and Ti3C2T x MXene was beneficial for the ions between layers. The enhanced electrical conductivity was confirmed through electrochemical impedance spectroscopy (EIS) spectra in the NRR (Fig. S4). In Nyquist plots, a small arc radius represents a small charge-transfer resistance. As shown in Fig. S4, compared with TiO2, a smaller arc radius was obtained for TiO2/Ti3C2T x MXene, which proves that the heterostructure formed by TiO2 NSs and Ti3C2T x MXene promotes electron transfer. TEM images further confirmed the morphology and microscopic structure of TiO2/Ti3C2T x MXene composites. It can be observed that square TiO2 was interspersed in the large-layered Ti3C2T x MXene in the TiO2/Ti3C2T x MXene composites (Fig. 3(c)). As shown in Fig. 3(d), two types of lattice fringes can be clearly observed in the TiO2/Ti3C2T x MXene composites, one with a lattice spacing of 0.23 nm resulting from the (103) crystal facet of Ti3C2T x MXene, and the other with an interplanar spacing of 0.35 nm accurately assigned to the (101) lattice of anatase TiO2 [40–42]. Lattice fringes of Ti3C2T x MXene and TiO2 were clearly observed, indicating that TiO2/Ti3C2T x MXene composites were successfully prepared. The selected-area TEM image and corresponding EDX mapping images (Fig. 3(e)) imply the homogenous distribution of Ti, C, and O, which is consistent with the XPS survey spectrum (Fig. 2(a)). To test the NRR activity of TiO2/Ti3C2T x MXene composites, electrochemical measurements were conducted under ambient conditions in 0.1 mol/L Na2SO4 (pH = 6) with an H-type electrolytic cell by separating a Nafion membrane [43]. The experimental apparatus used for electrocatalysis of the NRR is shown in Fig. S5. First, the LSV curves of TiO2/Ti3C2T x MXene were operated at a sweep rate of 5 mV s−1 under Ar- and N2-saturated 0.1 mol/L Na2SO4 solution, respectively (Fig. S6). A higher current density was observed in the N2-saturated solution than in the Ar-saturated solution, implying that N2 can be reduced to NH3 by the as-prepared TiO2/Ti3C2T x MXene catalyst. As shown in the inset in Fig. S6, the difference in the current density is particularly noticeable from −0.7 to −1.0 V vs. RHE, indicating the possible activity of a TiO2/Ti3C2T x MXene catalyst for N2 electroreduction. As shown in the chronoamperometry curves (Fig. 4(a) ), the current density increased with an increase in the potentials from −0.75 to −1.0 V vs. RHE. The current density is stable and scarcely alters from −0.75 to −0.95 V, indicating an excellent durability. However, the I-t curve at −1.0 V violently vibrates owing to the formation of H2 gas. The UV-Vis absorption spectra of various concentrations of a standard NH3 solution and the corresponding calibration curves (y = 0.509x + 0.105, R 2 = 0.999) for NH3 quantification are shown in Fig. S7. The NH4 + concentration was quantified using the calibrated indophenol-blue method [44]. The average NH3 yield and FE of TiO2/Ti3C2T x MXene at different applied potentials are shown in Fig. 4(b). After electrolysis of TiO2/Ti3C2T x MXene as the catalyst for 2 h, the highest absorbance appears at −0.95 V at 655 nm, suggesting the highest ammonia yield (Fig. 4(c)). The highest NH3 yield can be realized at −0.95 V, where the value is 44.17 µg h−1 mg−1 cat., suggesting that TiO2/Ti3C2T x MXene exhibits an advanced NRR performance among the reported MXene-based electrocatalysts (Table S1). The NH3 yields increase with a negatively applied potential until −0.95 V, and then gradually decrease. When the potential is more negative (−1.00 V), the NH3 yields decrease owing to the increased HER [45], thus taking up the active sites on the electrocatalyst surface. The FE gradually decreases when the applied potential becomes more negative. The highest FE value (44.68%) can be achieved at −0.75 V. In fact, the current density increases significantly with increasingly applied potentials because of the dominance of the HER at higher overpotentials, which results in a decrease in FEs (Fig. 4(a)). The highest ammonia yield rate is as high as 44.17 µg h−1 mg−1 cat. at −0.95 V, whereas the FE for TiO2/Ti3C2T x MXene at −0.95 V is low. A reasonable explanation for this is that the solubility of N2 in water is extremely low, and the NRR is controlled through N2 diffusion in this system. At higher negative potentials, the surface of TiO2/Ti3C2T x MXene is primarily occupied by the generated H molecules because of the dominance of the HER, which prevents N2 from transferring to the surface of TiO2/Ti3C2T x MXene, thereby limiting the electrocatalytic NRR activity. The NRR electrocatalytic activities of Ti3C2T x MXene and pure TiO2 NSs on a GCE were also studied for comparison. After 2 h of electrolysis using pure TiO2 NSs and pure Ti3C2T x MXene as the catalysts, the average NH3 yield and the corresponding FE at −0.95 V are measured (Fig. 4(d)). The NH3 yields and FEs of TiO2 (NH3 yield of 34.11 µg mg−1 cat. h−1; FE of 3.71% at −0.95 vs. RHE) and Ti3C2T x MXene (NH3 yield of 34.55 µg mg−1 cat. h−1; FE of 5.59% at −0.95 vs. RHE) were lower than those of TiO2/Ti3C2T x MXene (NH3 yield of 44.17 µg mg−1 cat. h−1; FE of 5.97% at −0.95 vs. RHE). Moreover, NRR tests were carried out for a simple mixture of TiO2 NSs and Ti3C2T x MXene, and its NH3 yield and FE were lower than those of the TiO2/Ti3C2T x MXene composites (Fig. S8). The comparison experiments show that TiO2/Ti3C2T x MXene presents a more improved NRR property than pure TiO2 NSs, pure Ti3C2T x MXene, and a simple mixture of TiO2 NSs and Ti3C2T x MXene, which proves that the improvement of the NRR performance is due to the structural advantages of the self-growth of TiO2 NSs. Stability is a key factor in estimating the NRR activity of electrocatalysts. The results of the recycling experiment (Fig. 5(a) ) indicated that TiO2/Ti3C2T x MXene presents a relatively stable NRR property. Successive electrolysis for 12 h at a constant potential of −0.95 V results in only a small current density loss and unremarkable decay of the NH3 yield and FE (Figs. 5(b) and S9), indicating that TiO2/Ti3C2T x MXene exhibits superior long-term electrochemical durability during the NRR process. The XRD analysis after NRR electrolysis (Fig. S10) demonstrates that this catalyst exhibits no change in the crystalline phase after NRR electrolysis, implying that it is extremely stable during the NRR process. SEM images (Fig. S11) also showed that the morphology of TiO2/Ti3C2T x MXene remained unchanged after NRR electrolysis. Therefore, the as-prepared TiO2/Ti3C2T x MXene was a highly stable NRR electrocatalyst. In addition, the approximately unchanged NH3 yields and FEs were unaffected by the variation in N2 flow rates, suggesting that the N2 flow is not a step that determines the reaction rate in this electrocatalytic process (Fig. 5(c)). Isotope labeling experiments were conducted to elucidate the origin of ammonia. The 1H NMR spectrum shows a specific double peak for 15NH4 + and three 14NH4 + signals (Fig. 5(d)) using 14N2 and 15N2 as N2 sources, respectively, indicating that the detected NH3 was generated through an electrocatalytic N2 reduction. Furthermore, N2H4, regarded as a possible by-product, was determined using the Chrisp-Watt method. A standard calibration curve for the N2H4 assay is shown in Fig. S12. The UV-Vis absorption spectrum of the electrolytes after NRR at −0.95 V is provided in Fig. S13 [46]. As indicated, N2H4 cannot be clearly distinguished in the N2-saturated electrolyte, suggesting that the TiO2/Ti3C2T x MXene catalyst exhibited an excellent selectivity for NH3 production. To confirm that NH3 is produced by the NRR of TiO2/Ti3C2T x MXene rather than from the environment, instruments, or reactants, we conducted control experiments in which only one parameter was changed and the other conditions were kept unchanged [24,47]. Before the test, N2 was sufficiently purified, which was purged through a 1 mmol/L H2SO4 solution, followed by 0.1 mol/L KOH to eliminate possible NH3 and NO x impurities in all measurements conducted in this study. The pretreated N2 was bubbled into a cathode chamber for 30 min, and no obvious UV-Vis absorption spectrum of the electrolytes for NH3 was observed using the indophenol blue method, indicating that the experiment results were barely affected by the supplied gas (Fig. S14). Electrolysis was also carried out in an Ar-saturated electrolyte at −0.95 V for 2 h, and the corresponding UV-Vis absorption spectrum (Fig. S15) is extremely close to that of a blank electrolyte, indicating that the formation of NH3 is neither from the self-electrolysis of the catalysts nor the contamination of the electrolytes. To further confirm that NH3 is produced through the NRR of TiO2/Ti3C2T x MXene, we also carry out the test in a N2-saturated solution under an open circuit potential at −0.95 V for 2 h (curved black line in Fig. S16), indicating that almost no NH3 is detected. To exclude the catalytic performance of a glassy carbon electrode, we applied a N2 electrocatalysis over the electrode at −0.95 V; in addition, the production of NH3 also cannot be determined, indicating that it has no contribution to the NRR performance (curved red line in Fig. S16). These results indicate that the detected NH3 was fully produced by the NRR. The contribution of the self-electrolysis of catalysts, contamination of electrolytes, and the surrounding environment are almost negligible in the laboratory. Density functional theory (DFT) calculations were conducted to further investigate the possible NRR pathways in TiO2/Ti3C2T x MXene composites. The stable adsorption models of the NRR on pure TiO2 and the TiO2/Ti3C2T x MXene composites are shown in Fig. S17. The NRR kinetic pathway was investigated based on the calculated Gibbs free energy (ΔG) diagrams. Two possible NRR pathways were proposed: the distal and alternative pathways (Figs. 6(a) and (b) ). The adsorption geometries of other important intermediates are shown in Figs. S18 and S19. Therefore, the NRR pathways on the pure TiO2 and TiO2/Ti3C2T x MXene composites were evaluated using DFT. It can be seen that the energetically most difficult step or potential-determining step (PDS) corresponds to hydrogenation of adsorbed *NNH2 to form an *N intermediate (Figs. S20 and S21). In the distal pathways, the *NNH2 into *N process is an uphill pathway with ΔG = 5.08 eV on the pure TiO2 surface. However, the free energy decreases to approximately 2.75 eV on TiO2/Ti3C2T x MXene composites. This indicates that the TiO2/Ti3C2T x MXene composites are predicted to be more active in the NRR than pure TiO2. As shown in Fig. 6(b), the hydrogenation of *NNH proceeds through two pathways: *NNH → *NNH2 and *NNH → *NHNH. For an alternative pathway, the *NHNH into *NHNH2 process is a downhill pathway with ΔG = −1.33 eV, which is lower than that of the distal pathway (*NNH2 into *N) with ΔG = 2.75 eV. The adsorption geometries of the intermediates on the TiO2/Ti3C2T x MXene composite surface along the alternating pathway are shown in Fig. 6(a). The above calculations reveal that the alternative pathway has been proved to be more energetically preferable over a distal pathway. As an alternative pathway, PDS is the formation of NH3 (1.36 eV) (Fig. 6(c)). Overall, our calculation results show that the addition of Ti3C2T x MXene into TiO2/Ti3C2T x MXene composites can increase the electrocatalytic efficiency for the NRR. 3 Conclusions In conclusion, we designed a novel TiO2/Ti3C2T x MXene composite and demonstrated that the composite has a high NRR activity in neutral media under ambient conditions. The TiO2/Ti3C2T x MXene catalyst could obtain a larger NH3 yield of 44.17 µg h−1 mg−1 cat. at −0.95 V vs. RHE and higher Faradaic efficiency (FE) of 44.68% at −0.75 V than those of pure Ti3C2T x and pure TiO2. In addition, the prepared catalysts exhibit remarkable selectivity and stability. The outstanding NRR activity can be ascribed to the following reasons: (1) The heterostructure formed by TiO2 NSs and Ti3C2T x MXene not only facilitates carrier transport in between but also avoids the microscopic stacking of Ti3C2T x MXene, which leads to rapid reaction kinetics at the heterogeneous interface. (2) The BET specific area of TiO2/Ti3C2T x MXene is larger than that of Ti3C2T x MXene owing to the generation of TiO2 NSs. Furthermore, the results of the isotope labeling experiment showed that the detected NH3 originated from the NRR and not from NO3 − or NH3 contaminants. DFT calculations showed that TiO2 NSs supported on Ti3C2T x MXene effectively enhanced the NRR performance owing to their stronger adsorption and lower energy barrier. Electronic supporting information Supporting information is available in the online version of this article. Supplementary Material Supplementary appendix References 1 Y. Wan J. Xu R. Lv Mater. Today 27 2019 69 90 Y. Wan, J. Xu, R. Lv, Mater. Today, 2019, 27, 69–90. 2 B. Huang Y.F. Wu B.B. Chen Y. Qian N.G. Zhou N. Li Chin. J. Catal. 42 2021 1160 1167 B. Huang, Y. F. Wu, B. B. Chen, Y. Qian, N. G. Zhou, N. Li, Chin. J. Catal., 2021, 42, 1160–1167. 3 C. He Z.-Y. Wu L. Zhao M. Ming Y. Zhang Y. Yi J.-S. Hu ACS Catal. 9 2019 7311 7317 C. He, Z.-Y. Wu, L. Zhao, M. Ming, Y. Zhang, Y. Yi, J.-S. Hu, ACS Catal., 2019, 9, 7311–7317. 4 C. Liu Q. Li C. Wu J. Zhang Y. Jin D.R. MacFarlane C. Sun J. Am. Chem. Soc. 141 2019 2884 2888 C. Liu, Q. Li, C. Wu, J. Zhang, Y. Jin, D. R. MacFarlane, C. Sun, J. Am. Chem. Soc., 2019, 141, 2884–2888. 5 J. Lv S. Wu Z. Tian Y. Ye J. Liu C. Liang J. Mater. Chem. A 7 2019 12627 12634 J. Lv, S. Wu, Z. Tian, Y. Ye, J. Liu, C. Liang, J. Mater. Chem. A, 2019, 7, 12627–12634. 6 L. Li H.J. Chen L. Li B.H. Li Q.B. Wu C.H. Cui B. Deng Y.L. Luo Q. Liu T.S. Li F. Zhang A.M. Asiri Z.-S. Feng Y. Wang X.P. Sun Chin. J. Catal. 42 2021 1755 1762 L. Li, H. J. Chen, L. Li, B. H. Li, Q. B. Wu, C. H. Cui, B. Deng, Y. L. Luo, Q. Liu, T. S. Li, F. Zhang, A. M. Asiri, Z.-S. Feng, Y. Wang, X. P. Sun, Chin. J. Catal., 2021, 42, 1755–1762. 7 L.M. Azofra N. Li D.R. MacFarlane C. Sun Energy Environ. Sci. 9 2016 2545 2549 L. M. Azofra, N. Li, D. R. MacFarlane, C. Sun, Energy Environ. Sci., 2016, 9, 2545–2549. 8 B. Yu H. Li J. White S. Donne J. Yi S. Xi Y. Fu G. Henkelman H. Yu Z. Chen T. Ma Adv. Funct. Mater. 30 2019 1905665 B. Yu, H. Li, J. White, S. Donne, J. Yi, S. Xi, Y. Fu, G. Henkelman, H. Yu, Z. Chen, T. Ma, Adv. Funct. Mater., 2019, 30, 1905665. 9 X. Xu Y. Wang X. Chen X. Qian Z. Liang H. Cui J. Tian M.H. Shao EcoMat 3 2021 e12122 X. Xu, Y. Wang, X. Chen, X. Qian, Z. Liang, H. Cui, J. Tian, M. H. Shao, EcoMat, 2021, 3, e12122. 10 Y. Wang M.M. Shi D. Bao F.L. Meng Q. Zhang Y.T. Zhou K.H. Liu Y. Zhang J.Z. Wang Z.W. Chen D.P. Liu Z. Jiang M. Luo L. Gu Q.H. Zhang X.Z. Cao Y. Yao M.H. Shao Y. Zhang X.B. Zhang J.G. Chen J.M. Yan Q. Jiang Angew. Chem. Int. Ed. 58 2019 9464 9469 Y. Wang, M. M. Shi, D. Bao, F. L. Meng, Q. Zhang, Y. T. Zhou, K. H. Liu, Y. Zhang, J. Z. Wang, Z. W. Chen, D. P. Liu, Z. Jiang, M. Luo, L. Gu, Q. H. Zhang, X. Z. Cao, Y. Yao, M. H. Shao, Y. Zhang, X. B. Zhang, J. G. Chen, J. M. Yan, Q. Jiang, Angew. Chem. Int. Ed., 2019, 58, 9464–9469. 11 T. Wang S.X. Li B.L. He X.J. Zhu Y.L. Luo Q. Liu T.S. Li S.Y. Lu C. Ye A.M. Asiri X.P. Sun Chin. J. Catal. 42 2021 1024 1029 T. Wang, S. X. Li, B. L. He, X. J. Zhu, Y. L. Luo, Q. Liu, T. S. Li, S. Y. Lu, C. Ye, A. M. Asiri, X. P. Sun, Chin. J. Catal., 2021, 42, 1024–1029. 12 L. Zhang M. Cong X. Ding Y. Jin F. Xu Y. Wang L. Chen L. Zhang Angew. Chem. Int. Ed. 59 2020 10888 10893 L. Zhang, M. Cong, X. Ding, Y. Jin, F. Xu, Y. Wang, L. Chen, L. Zhang, Angew. Chem. Int. Ed., 2020, 59, 10888–10893. 13 Y.T. Liu X. Chen J. Yu B. Ding Angew. Chem. Int. Ed. 58 2019 18903 18907 Y. T. Liu, X. Chen, J. Yu, B. Ding, Angew. Chem. Int. Ed., 2019, 58, 18903–18907. 14 Y. Ma T. Yang H. Zou W. Zang Z. Kou L. Mao Y. Feng L. Shen S.J. Pennycook L. Duan X. Li J. Wang Adv. Mater. 32 2020 2002177 Y. Ma, T. Yang, H. Zou, W. Zang, Z. Kou, L. Mao, Y. Feng, L. Shen, S. J. Pennycook, L. Duan, X. Li, J. Wang, Adv. Mater., 2020, 32, 2002177. 15 X. Ren J. Zhao Q. Wei Y. Ma H. Guo Q. Liu Y. Wang G. Cui A.M. Asiri B. Li B. Tang X. Sun ACS Cent. Sci. 5 2019 116 121 X. Ren, J. Zhao, Q. Wei, Y. Ma, H. Guo, Q. Liu, Y. Wang, G. Cui, A. M. Asiri, B. Li, B. Tang, X. Sun, ACS Cent. Sci., 2019, 5, 116–121. 16 L. Li C. Tang B. Xia H. Jin Y. Zheng S.-Z. Qiao ACS Catal. 9 2019 2902 2908 L. Li, C. Tang, B. Xia, H. Jin, Y. Zheng, S.-Z. Qiao, ACS Catal., 2019, 9, 2902–2908. 17 D. Bao Q. Zhang F.L. Meng H.X. Zhong M.M. Shi Y. Zhang J.M. Yan Q. Jiang X.B. Zhang Adv. Mater. 29 2017 1604799 D. Bao, Q. Zhang, F. L. Meng, H. X. Zhong, M. M. Shi, Y. Zhang, J. M. Yan, Q. Jiang, X. B. Zhang, Adv. Mater., 2017, 29, 1604799. 18 M.M. Shi D. Bao B.R. Wulan Y.H. Li Y.F. Zhang J.M. Yan Q. Jiang Adv. Mater. 29 2017 1606550 M. M. Shi, D. Bao, B. R. Wulan, Y. H. Li, Y. F. Zhang, J. M. Yan, Q. Jiang, Adv. Mater., 2017, 29, 1606550. 19 Y. Fang Z. Liu J. Han Z. Jin Y. Han F. Wang Y. Niu Y. Wu Y. Xu Adv. Energy Mater. 9 2019 1803406 Y. Fang, Z. Liu, J. Han, Z. Jin, Y. Han, F. Wang, Y. Niu, Y. Wu, Y. Xu, Adv. Energy Mater., 2019, 9, 1803406. 20 T. Wu X. Zhu Z. Xing S. Mou C. Li Y. Qiao Q. Liu Y. Luo X. Shi Y. Zhang X. Sun Angew. Chem. Int. Ed. 58 2019 18449 18453 T. Wu, X. Zhu, Z. Xing, S. Mou, C. Li, Y. Qiao, Q. Liu, Y. Luo, X. Shi, Y. Zhang, X. Sun, Angew. Chem. Int. Ed., 2019, 58, 18449–18453. 21 Y. Liu Q. Li X. Guo X. Kong J. Ke M. Chi Q. Li Z. Geng J. Zeng Adv. Mater. 32 2020 1907690 Y. Liu, Q. Li, X. Guo, X. Kong, J. Ke, M. Chi, Q. Li, Z. Geng, J. Zeng, Adv. Mater., 2020, 32, 1907690. 22 W. Guo K. Zhang Z. Liang R. Zou Q. Xu Chem. Soc. Rev. 48 2019 5658 5716 W. Guo, K. Zhang, Z. Liang, R. Zou, Q. Xu, Chem. Soc. Rev., 2019, 48, 5658–5716. 23 Y. Zhao R. Shi X. Bian C. Zhou Y. Zhao S. Zhang F. Wu G.I.N. Waterhouse L.Z. Wu C.H. Tung T. Zhang Adv. Sci. 6 2019 1802109 Y. Zhao, R. Shi, X. Bian, C. Zhou, Y. Zhao, S. Zhang, F. Wu, G. I. N. Waterhouse, L. Z. Wu, C. H. Tung, T. Zhang, Adv. Sci., 2019, 6, 1802109. 24 H. Wang J. Si T. Zhang Y. Li B. Yang Z. Li J. Chen Z. Wen C. Yuan L. Lei Y. Hou Appl. Catal. B 270 2020 118892 H. Wang, J. Si, T. Zhang, Y. Li, B. Yang, Z. Li, J. Chen, Z. Wen, C. Yuan, L. Lei, Y. Hou, Appl. Catal. B, 2020, 270, 118892. 25 J.L. Qu J.W. Xiao H.T. Chen X.P. Liu T.S. Wang Q.F. Zhang Chin. J. Catal. 42 2021 288 296 J. L. Qu, J. W. Xiao, H. T. Chen, X. P. Liu, T. S. Wang, Q. F. Zhang, Chin. J. Catal., 2021, 42, 288–296. 26 H. Su L. Chen Y. Chen R. Si Y. Wu X. Wu Z. Geng W. Zhang J. Zeng Angew. Chem. Int. Ed. 59 2020 20411 20416 H. Su, L. Chen, Y. Chen, R. Si, Y. Wu, X. Wu, Z. Geng, W. Zhang, J. Zeng, Angew. Chem. Int. Ed., 2020, 59, 20411–20416. 27 B. Sun P. Qiu Z. Liang Y. Xue X. Zhang L. Yang H. Cui J. Tian Chem. Eng. J. 406 2021 127177 B. Sun, P. Qiu, Z. Liang, Y. Xue, X. Zhang, L. Yang, H. Cui, J. Tian, Chem. Eng. J., 2021, 406, 127177. 28 J. Li B. Rui W. Wei P. Nie L. Chang Z. Le M. Liu H. Wang L. Wang X. Zhang J. Power Sources 449 2020 227481 J. Li, B. Rui, W. Wei, P. Nie, L. Chang, Z. Le, M. Liu, H. Wang, L. Wang, X. Zhang, J. Power Sources, 2020, 449, 227481. 29 X. Xu B. Sun Z. Liang H. Cui J. Tian ACS Appl. Mater. Interfaces 12 2020 26060 26067 X. Xu, B. Sun, Z. Liang, H. Cui, J. Tian, ACS Appl. Mater. Interfaces, 2020, 12, 26060–26067. 30 M. Naguib M. Kurtoglu V. Presser J. Lu J. Niu M. Heon L. Hultman Y. Gogotsi M.W. Barsoum Adv. Mater. 23 2011 4248 4253 M. Naguib, M. Kurtoglu, V. Presser, J. Lu, J. Niu, M. Heon, L. Hultman, Y. Gogotsi, M. W. Barsoum, Adv. Mater., 2011, 23, 4248–53. 31 M.R. Lukatskaya O. Mashtalir C.E. Ren Y. Dall'Agnese P. Rozier P.L. Taberna M. Naguib P. Simon M.W. Barsoum Y. Gogotsi Science 341 2013 1502 1505 M. R. Lukatskaya, O. Mashtalir, C. E. Ren, Y. Dall'Agnese, P. Rozier, P. L. Taberna, M. Naguib, P. Simon, M. W. Barsoum, Y. Gogotsi, Science, 2013, 341, 1502–1505. 32 C. Yang Y. Liu X. Sun Y. Zhang L. Hou Q. Zhang C. Yuan Electrochim. Acta 271 2018 165 172 C. Yang, Y. Liu, X. Sun, Y. Zhang, L. Hou, Q. Zhang, C. Yuan, Electrochim. Acta, 2018, 271, 165–172. 33 Y. Li L. Ding Y. Guo Z. Liang H. Cui J. Tian ACS Appl. Mater. Interfaces 11 2019 41440 41447 Y. Li, L. Ding, Y. Guo, Z. Liang, H. Cui, J. Tian, ACS Appl. Mater. Interfaces, 2019, 11, 41440–41447. 34 Y. Qin Y. Guo Z. Liang Y. Xue X. Zhang L. Yang J. Tian Chin. Chem. Lett. 32 2021 1524 1527 Y. Qin, Y. Guo, Z. Liang, Y. Xue, X. Zhang, L. Yang, J. Tian, Chin. Chem. Lett., 2021, 32, 1524–1527. 35 N. My Tran Q. Thanh Hoai Ta J.-S. Noh Appl. Surf. Sci. 538 2021 148023 N. My Tran, Q. Thanh Hoai Ta, J.-S. Noh, Appl. Surf. Sci., 2021, 538, 148023. 36 Y. Li L. Ding S. Yin Z. Liang Y. Xue X. Wang H. Cui J. Tian Nano-Micro Lett. 12 2019 63 Y. Li, L. Ding, S. Yin, Z. Liang, Y. Xue, X. Wang, H. Cui, J. Tian, Nano-Micro Lett., 2019, 12, 63. 37 Y. Li Z. Yin G. Ji Z. Liang Y. Xue Y. Guo J. Tian X. Wang H. Cui Appl. Catal. B 246 2019 12 20 Y. Li, Z. Yin, G. Ji, Z. Liang, Y. Xue, Y. Guo, J. Tian, X. Wang, H. Cui, Appl. Catal. B, 2019, 246, 12–20. 38 J. Low L. Zhang T. Tong B. Shen J. Yu J. Catal. 361 2018 255 266 J. Low, L. Zhang, T. Tong, B. Shen, J. Yu, J. Catal., 2018, 361, 255–266. 39 Y. Gao L. Wang A. Zhou Z. Li J. Chen H. Bala Q. Hu X. Cao Mater. Lett. 150 2015 62 64 Y. Gao, L. Wang, A. Zhou, Z. Li, J. Chen, H. Bala, Q. Hu, X. Cao, Mater. Lett., 2015, 150, 62–64. 40 Z. Miao G. Wang X. Zhang X. Dong Appl. Surf. Sci. 528 2020 146929 Z. Miao, G. Wang, X. Zhang, X. Dong, Appl. Surf. Sci., 2020, 528, 146929. 41 Z. Yuan Y. Fan Y. Chen X. Liu B. Liu S. Han Int. J. Hydrogen Energy 45 2020 21666 21675 Z. Yuan, Y. Fan, Y. Chen, X. Liu, B. Liu, S. Han, Int. J. Hydrogen Energy, 2020, 45, 21666–21675. 42 L. Chen K. Huang Q. Xie S. Lam J.-C. Sin T. Su H. Ji Z.-Z. Qin Catal. Sci. Technol. 11 2021 1602 1614 L. Chen, K. Huang, Q. Xie, S. Lam, J.-C. Sin, T. Su, H. Ji, Z.-Z. Qin, Catal. Sci. Technol., 2021, 11, 1602–1614. 43 T. Huang Z. Liu Y. Zhang F. Wang J. Wen C. Wang M. Hossain Q. Xie S. Yao Y. Wu J. Mater. Chem. A 8 2020 13679 13684 T. Huang, Z. Liu, Y. Zhang, F. Wang, J. Wen, C. Wang, M. Hossain, Q. Xie, S. Yao, Y. Wu, J. Mater. Chem. A, 2020, 8, 13679–13684. 44 S. Liu M. Wang T. Qian H. Ji J. Liu C. Yan Nat. Commun. 10 2019 3898 S. Liu, M. Wang, T. Qian, H. Ji, J. Liu, C. Yan, Nat. Commun., 2019, 10, 3898. 45 Y. Liu Y. Su X. Quan X. Fan S. Chen H. Yu H. Zhao Y. Zhang J. Zhao ACS Catal. 8 2018 1186 1191 Y. Liu, Y. Su, X. Quan, X. Fan, S. Chen, H. Yu, H. Zhao, Y. Zhang, J. Zhao, ACS Catal., 2018, 8, 1186–1191. 46 X. Yu P. Han Z. Wei L. Huang Z. Gu S. Peng J. Ma G. Zheng Joule 2 2018 1610 1622 X. Yu, P. Han, Z. Wei, L. Huang, Z. Gu, S. Peng, J. Ma, G. Zheng, Joule, 2018, 2, 1610–1622. 47 Y.T. Liu D. Li J. Yu B. Ding Angew. Chem. Int. Ed. 58 2019 16439 16444 Y. T. Liu, D. Li, J. Yu, B. Ding, Angew. Chem. Int. Ed., 2019, 58, 16439–16444.",
      "scopus-id": "85130444365",
      "coredata": {
        "eid": "1-s2.0-S1872206721640202",
        "dc:description": "In this study, TiO2 nanosheets (NSs) grown in situ on extremely conductive Ti3C2T x MXene to form TiO2/Ti3C2T x MXene composites with abundant active sites are proposed to effectively achieve electrocatalytic NH3 synthesis. Electron transfer can be promoted by Ti3C2T x MXene with high conductivity. Meanwhile, the TiO2 NSs in-situ formation can not only avoid Ti3C2T x MXene microstacking but also enhance the surface specific area of Ti3C2T x MXene. The TiO2/Ti3C2T x MXene catalyst reaches a high Faradaic efficiency (FE) of 44.68% at −0.75 V vs. RHE and a large NH3 yield of 44.17 µg h−1 mg−1 cat. at −0.95 V, with strong electrochemical durability. 15N isotopic labeling experiments imply that the N in the produced NH3 originated from the N2 of the electrolyte. DFT calculations were conducted to determine the possible NRR reaction pathways for TiO2/Ti3C2T x MXene composites. MXene catalysts combined with other materials have been rationally designed for efficient ammonia production under ambient conditions.",
        "openArchiveArticle": "false",
        "prism:coverDate": "2022-07-31",
        "openaccessUserLicense": null,
        "prism:aggregationType": "Journal",
        "prism:url": "https://api.elsevier.com/content/article/pii/S1872206721640202",
        "dc:creator": [
          {
            "@_fa": "true",
            "$": "Qian, Xiu"
          },
          {
            "@_fa": "true",
            "$": "Wei, Yanjiao"
          },
          {
            "@_fa": "true",
            "$": "Sun, Mengjie"
          },
          {
            "@_fa": "true",
            "$": "Han, Ye"
          },
          {
            "@_fa": "true",
            "$": "Zhang, Xiaoli"
          },
          {
            "@_fa": "true",
            "$": "Tian, Jian"
          },
          {
            "@_fa": "true",
            "$": "Shao, Minhua"
          }
        ],
        "link": [
          {
            "@_fa": "true",
            "@rel": "self",
            "@href": "https://api.elsevier.com/content/article/pii/S1872206721640202"
          },
          {
            "@_fa": "true",
            "@rel": "scidir",
            "@href": "https://www.sciencedirect.com/science/article/pii/S1872206721640202"
          }
        ],
        "dc:format": "application/json",
        "openaccessType": null,
        "pii": "S1872-2067(21)64020-2",
        "prism:volume": "43",
        "prism:publisher": "Dalian Institute of Chemical Physics, the Chinese Academy of Sciences. Published by Elsevier B.V.",
        "dc:title": "Heterostructuring 2D TiO2 nanosheets in situ grown on Ti3C2T x MXene to improve the electrocatalytic nitrogen reduction",
        "prism:copyright": "Copyright © 2022 Dalian Institute of Chemical Physics, the Chinese Academy of Sciences. Published by Elsevier B.V. All rights reserved.",
        "openaccess": "0",
        "prism:issn": "18722067",
        "prism:issueIdentifier": "7",
        "dcterms:subject": [
          {
            "@_fa": "true",
            "$": "Electrocatalyst"
          },
          {
            "@_fa": "true",
            "$": "N2 reduction reaction"
          },
          {
            "@_fa": "true",
            "$": "TiO2 nanosheet"
          },
          {
            "@_fa": "true",
            "$": "Ti3C2T x MXene"
          },
          {
            "@_fa": "true",
            "$": "In-situ growth"
          }
        ],
        "openaccessArticle": "false",
        "prism:publicationName": "Chinese Journal of Catalysis",
        "prism:number": "7",
        "openaccessSponsorType": null,
        "prism:pageRange": "1937-1944",
        "prism:endingPage": "1944",
        "pubType": "fla",
        "prism:coverDisplayDate": "July 2022",
        "prism:doi": "10.1016/S1872-2067(21)64020-2",
        "prism:startingPage": "1937",
        "dc:identifier": "doi:10.1016/S1872-2067(21)64020-2",
        "openaccessSponsorName": null
      },
      "objects": {
        "object": [
          {
            "@category": "standard",
            "@height": "227",
            "@width": "244",
            "@_fa": "true",
            "$": "https://api.elsevier.com/content/object/eid/1-s2.0-S1872206721640202-gr1.jpg?httpAccept=%2A%2F%2A",
            "@multimediatype": "JPEG image file",
            "@type": "IMAGE-DOWNSAMPLED",
            "@size": "22575",
            "@ref": "gr1",
            "@mimetype": "image/jpeg"
          },
          {
            "@category": "standard",
            "@height": "314",
            "@width": "358",
            "@_fa": "true",
            "$": "https://api.elsevier.com/content/object/eid/1-s2.0-S1872206721640202-gr2.jpg?httpAccept=%2A%2F%2A",
            "@multimediatype": "JPEG image file",
            "@type": "IMAGE-DOWNSAMPLED",
            "@size": "38155",
            "@ref": "gr2",
            "@mimetype": "image/jpeg"
          },
          {
            "@category": "standard",
            "@height": "372",
            "@width": "369",
            "@_fa": "true",
            "$": "https://api.elsevier.com/content/object/eid/1-s2.0-S1872206721640202-gr3.jpg?httpAccept=%2A%2F%2A",
            "@multimediatype": "JPEG image file",
            "@type": "IMAGE-DOWNSAMPLED",
            "@size": "62252",
            "@ref": "gr3",
            "@mimetype": "image/jpeg"
          },
          {
            "@category": "standard",
            "@height": "281",
            "@width": "358",
            "@_fa": "true",
            "$": "https://api.elsevier.com/content/object/eid/1-s2.0-S1872206721640202-gr4.jpg?httpAccept=%2A%2F%2A",
            "@multimediatype": "JPEG image file",
            "@type": "IMAGE-DOWNSAMPLED",
            "@size": "48353",
            "@ref": "gr4",
            "@mimetype": "image/jpeg"
          },
          {
            "@category": "standard",
            "@height": "291",
            "@width": "364",
            "@_fa": "true",
            "$": "https://api.elsevier.com/content/object/eid/1-s2.0-S1872206721640202-gr5.jpg?httpAccept=%2A%2F%2A",
            "@multimediatype": "JPEG image file",
            "@type": "IMAGE-DOWNSAMPLED",
            "@size": "42619",
            "@ref": "gr5",
            "@mimetype": "image/jpeg"
          },
          {
            "@category": "standard",
            "@height": "423",
            "@width": "535",
            "@_fa": "true",
            "$": "https://api.elsevier.com/content/object/eid/1-s2.0-S1872206721640202-gr6.jpg?httpAccept=%2A%2F%2A",
            "@multimediatype": "JPEG image file",
            "@type": "IMAGE-DOWNSAMPLED",
            "@size": "101261",
            "@ref": "gr6",
            "@mimetype": "image/jpeg"
          },
          {
            "@category": "standard",
            "@height": "102",
            "@width": "374",
            "@_fa": "true",
            "$": "https://api.elsevier.com/content/object/eid/1-s2.0-S1872206721640202-gr7.jpg?httpAccept=%2A%2F%2A",
            "@multimediatype": "JPEG image file",
            "@type": "IMAGE-DOWNSAMPLED",
            "@size": "17394",
            "@ref": "gr7",
            "@mimetype": "image/jpeg"
          },
          {
            "@category": "standard",
            "@height": "245",
            "@width": "269",
            "@_fa": "true",
            "$": "https://api.elsevier.com/content/object/eid/1-s2.0-S1872206721640202-grap.jpg?httpAccept=%2A%2F%2A",
            "@multimediatype": "JPEG image file",
            "@type": "IMAGE-DOWNSAMPLED",
            "@size": "25574",
            "@ref": "grap",
            "@mimetype": "image/jpeg"
          },
          {
            "@category": "thumbnail",
            "@height": "164",
            "@width": "176",
            "@_fa": "true",
            "$": "https://api.elsevier.com/content/object/eid/1-s2.0-S1872206721640202-gr1.sml?httpAccept=%2A%2F%2A",
            "@multimediatype": "GIF image file",
            "@type": "IMAGE-THUMBNAIL",
            "@size": "7403",
            "@ref": "gr1",
            "@mimetype": "image/gif"
          },
          {
            "@category": "thumbnail",
            "@height": "164",
            "@width": "187",
            "@_fa": "true",
            "$": "https://api.elsevier.com/content/object/eid/1-s2.0-S1872206721640202-gr2.sml?httpAccept=%2A%2F%2A",
            "@multimediatype": "GIF image file",
            "@type": "IMAGE-THUMBNAIL",
            "@size": "8973",
            "@ref": "gr2",
            "@mimetype": "image/gif"
          },
          {
            "@category": "thumbnail",
            "@height": "163",
            "@width": "162",
            "@_fa": "true",
            "$": "https://api.elsevier.com/content/object/eid/1-s2.0-S1872206721640202-gr3.sml?httpAccept=%2A%2F%2A",
            "@multimediatype": "GIF image file",
            "@type": "IMAGE-THUMBNAIL",
            "@size": "22159",
            "@ref": "gr3",
            "@mimetype": "image/gif"
          },
          {
            "@category": "thumbnail",
            "@height": "164",
            "@width": "209",
            "@_fa": "true",
            "$": "https://api.elsevier.com/content/object/eid/1-s2.0-S1872206721640202-gr4.sml?httpAccept=%2A%2F%2A",
            "@multimediatype": "GIF image file",
            "@type": "IMAGE-THUMBNAIL",
            "@size": "13209",
            "@ref": "gr4",
            "@mimetype": "image/gif"
          },
          {
            "@category": "thumbnail",
            "@height": "164",
            "@width": "205",
            "@_fa": "true",
            "$": "https://api.elsevier.com/content/object/eid/1-s2.0-S1872206721640202-gr5.sml?httpAccept=%2A%2F%2A",
            "@multimediatype": "GIF image file",
            "@type": "IMAGE-THUMBNAIL",
            "@size": "11525",
            "@ref": "gr5",
            "@mimetype": "image/gif"
          },
          {
            "@category": "thumbnail",
            "@height": "164",
            "@width": "207",
            "@_fa": "true",
            "$": "https://api.elsevier.com/content/object/eid/1-s2.0-S1872206721640202-gr6.sml?httpAccept=%2A%2F%2A",
            "@multimediatype": "GIF image file",
            "@type": "IMAGE-THUMBNAIL",
            "@size": "14972",
            "@ref": "gr6",
            "@mimetype": "image/gif"
          },
          {
            "@category": "thumbnail",
            "@height": "60",
            "@width": "219",
            "@_fa": "true",
            "$": "https://api.elsevier.com/content/object/eid/1-s2.0-S1872206721640202-gr7.sml?httpAccept=%2A%2F%2A",
            "@multimediatype": "GIF image file",
            "@type": "IMAGE-THUMBNAIL",
            "@size": "9218",
            "@ref": "gr7",
            "@mimetype": "image/gif"
          },
          {
            "@category": "thumbnail",
            "@height": "164",
            "@width": "180",
            "@_fa": "true",
            "$": "https://api.elsevier.com/content/object/eid/1-s2.0-S1872206721640202-grap.sml?httpAccept=%2A%2F%2A",
            "@multimediatype": "GIF image file",
            "@type": "IMAGE-THUMBNAIL",
            "@size": "9610",
            "@ref": "grap",
            "@mimetype": "image/gif"
          },
          {
            "@category": "high",
            "@height": "605",
            "@width": "650",
            "@_fa": "true",
            "$": "https://api.elsevier.com/content/object/eid/1-s2.0-S1872206721640202-gr1_lrg.jpg?httpAccept=%2A%2F%2A",
            "@multimediatype": "JPEG image file",
            "@type": "IMAGE-HIGH-RES",
            "@size": "97460",
            "@ref": "gr1",
            "@mimetype": "image/jpeg"
          },
          {
            "@category": "high",
            "@height": "836",
            "@width": "952",
            "@_fa": "true",
            "$": "https://api.elsevier.com/content/object/eid/1-s2.0-S1872206721640202-gr2_lrg.jpg?httpAccept=%2A%2F%2A",
            "@multimediatype": "JPEG image file",
            "@type": "IMAGE-HIGH-RES",
            "@size": "173917",
            "@ref": "gr2",
            "@mimetype": "image/jpeg"
          },
          {
            "@category": "high",
            "@height": "990",
            "@width": "982",
            "@_fa": "true",
            "$": "https://api.elsevier.com/content/object/eid/1-s2.0-S1872206721640202-gr3_lrg.jpg?httpAccept=%2A%2F%2A",
            "@multimediatype": "JPEG image file",
            "@type": "IMAGE-HIGH-RES",
            "@size": "340526",
            "@ref": "gr3",
            "@mimetype": "image/jpeg"
          },
          {
            "@category": "high",
            "@height": "747",
            "@width": "951",
            "@_fa": "true",
            "$": "https://api.elsevier.com/content/object/eid/1-s2.0-S1872206721640202-gr4_lrg.jpg?httpAccept=%2A%2F%2A",
            "@multimediatype": "JPEG image file",
            "@type": "IMAGE-HIGH-RES",
            "@size": "221067",
            "@ref": "gr4",
            "@mimetype": "image/jpeg"
          },
          {
            "@category": "high",
            "@height": "775",
            "@width": "969",
            "@_fa": "true",
            "$": "https://api.elsevier.com/content/object/eid/1-s2.0-S1872206721640202-gr5_lrg.jpg?httpAccept=%2A%2F%2A",
            "@multimediatype": "JPEG image file",
            "@type": "IMAGE-HIGH-RES",
            "@size": "183464",
            "@ref": "gr5",
            "@mimetype": "image/jpeg"
          },
          {
            "@category": "high",
            "@height": "1124",
            "@width": "1422",
            "@_fa": "true",
            "$": "https://api.elsevier.com/content/object/eid/1-s2.0-S1872206721640202-gr6_lrg.jpg?httpAccept=%2A%2F%2A",
            "@multimediatype": "JPEG image file",
            "@type": "IMAGE-HIGH-RES",
            "@size": "457022",
            "@ref": "gr6",
            "@mimetype": "image/jpeg"
          },
          {
            "@category": "high",
            "@height": "271",
            "@width": "993",
            "@_fa": "true",
            "$": "https://api.elsevier.com/content/object/eid/1-s2.0-S1872206721640202-gr7_lrg.jpg?httpAccept=%2A%2F%2A",
            "@multimediatype": "JPEG image file",
            "@type": "IMAGE-HIGH-RES",
            "@size": "82752",
            "@ref": "gr7",
            "@mimetype": "image/jpeg"
          },
          {
            "@category": "high",
            "@height": "651",
            "@width": "716",
            "@_fa": "true",
            "$": "https://api.elsevier.com/content/object/eid/1-s2.0-S1872206721640202-grap_lrg.jpg?httpAccept=%2A%2F%2A",
            "@multimediatype": "JPEG image file",
            "@type": "IMAGE-HIGH-RES",
            "@size": "108381",
            "@ref": "grap",
            "@mimetype": "image/jpeg"
          },
          {
            "@category": "standard",
            "@_fa": "true",
            "$": "https://api.elsevier.com/content/object/eid/1-s2.0-S1872206721640202-mmc1.pdf?httpAccept=%2A%2F%2A",
            "@multimediatype": "Acrobat PDF file",
            "@type": "APPLICATION",
            "@size": "2329397",
            "@ref": "mmc1",
            "@mimetype": "application/pdf"
          }
        ]
      },
      "link": {
        "@rel": "abstract",
        "@href": "https://api.elsevier.com/content/abstract/scopus_id/85130444365"
      }
    }
  }
}