{
  "metadata": {
    "title": "Recent advances in the rational design of electrocatalysts towards the oxygen reduction reaction",
    "authors": "; ",
    "journal": "Chinese Journal of Catalysis",
    "date": "2017-06-30",
    "doi": "10.1016/S1872-2067(17)62801-8",
    "abstract": "",
    "uri": "https://api.elsevier.com/content/article/pii/S1872206717628018",
    "pii": "S1872206717628018"
  },
  "fulltext": {
    "full-text-retrieval-response": {
      "scopus-eid": "2-s2.0-85020912433",
      "originalText": "serial JL 273538 291210 291744 291809 31 Chinese Journal of Catalysis CHINESEJOURNALCATALYSIS 2017-06-16 2017-06-16 2017-06-16 2017-06-16 2018-10-06T00:01:34 1-s2.0-S1872206717628018 S1872-2067(17)62801-8 S1872206717628018 10.1016/S1872-2067(17)62801-8 S300 S300.2 FULL-TEXT 1-s2.0-S1872206717X00089 2018-10-06T00:08:53.178715Z 0 0 20170601 20170630 2017 2017-06-16T14:45:11.948784Z absattachment articleinfo articletitlenorm authfirstinitialnorm authfirstsurnamenorm cid cids contenttype copyright crossmark dateloaded dateloadedtxt datesearch datesort dateupdated dco docsubtype doctype doi eid ewtransactionid hubeid indexeddate issfirst issn issnnorm issuelist itemstage itemtransactionid itemweight openaccess openarchive pg pgfirst pglast pii piinorm pubdateend pubdatestart pubdatetxt pubyr sortorder srctitle srctitlenorm srctype ssids alllist content subj subheadings tomb volfirst volissue volumelist webpdf webpdfpagecount yearnav figure table body mmlmath affil articletitle auth authfirstini authfull authkeywords authlast grantnumber grantsponsor primabst pubtype ref specialabst 1872-2067 18722067 true 38 38 6 6 Volume 38, Issue 6 2 951 969 951 969 201706 June 2017 2017-06-01 2017-06-30 2017 article rev Copyright © 2017 Dalian Institute of Chemical Physics, the Chinese Academy of Sciences. Published by Elsevier B.V. All rights reserved. RECENTADVANCESINRATIONALDESIGNELECTROCATALYSTSTOWARDSOXYGENREDUCTIONREACTION KONG J 1 Introduction 2 Molecule-based electrocatalysts for the ORR 2.1 Molecule-based electrocatalysts with N4-macrocycles 2.2 Molecule-based electrocatalysts with non-macrocyclic chelating ligands 2.3 Pyrolysis for molecule-based electrocatalysts 3 Metal-oxide-based electrocatalysts for the ORR 4 Metal-nanomaterial-based electrocatalysts for the ORR 4.1 Shape and size control of metal-based NPs 4.2 Use of non-Pt noble-metal NPs in advanced electrocatalysts 4.3 Other transition-metal-based nanostructural catalysts 5 Two-dimensional electrocatalysts for the ORR 6 ORR electrocatalysts based on other porous carbon structures 7 Conclusions and future perspectives References WINTER 2004 4245 4270 M DAI 2015 4823 4892 L SHAO 2016 3594 3657 M YANG 2013 1986 1991 L GASTEIGER 2009 48 49 H THORSETH 2013 130 139 M GEWIRTH 2010 3557 3566 A BORUP 2007 3904 3951 R LIU 2015 1167 1192 J SEALY 2008 65 68 C GONG 2009 760 764 K WANG 2015 3433 3467 Y JASINSKI 1964 1212 1213 R STAMENKOVIC 2007 241 247 V JIANG 2009 4953 4956 S WANG 2012 81 87 D JAOUEN 2011 114 130 F CHEN 2011 3167 3192 Z WU 2011 443 447 G BING 2010 2184 2202 Y GUO 2013 8526 8544 S DU 2016 1049 1061 C TANG 2012 784 797 Y TANG 2013 120 123 Y TANG 2013 3125 3132 Y JIANG 2015 175 180 L ZHOU 2014 1301523 X XIE 2013 10112 10114 X JIN 2014 920 926 Q CHEN 2016 633 640 Y RAMASWAMY 2013 15443 15449 N BEZERRA 2008 7703 7710 C WANG 2013 381 389 J BEZERRA 2008 4937 4951 C WU 2011 18856 18862 J ZHANG 2010 2900 2903 H YU 2009 705 711 E BIRRY 2011 1505 1511 L BARANTON 2005 223 234 S FENG 2008 1792 1806 Y JAHAN 2012 6707 6713 M WIESENER 1989 457 K CHANG 2004 10013 10020 C FUKUZUMI 2004 10441 10449 S GASTEIGER 2005 9 35 H LEFEVRE 2009 71 74 M CHUNG 2010 1792 1795 H DOMBROVSKIS 2016 4 22 J KRAMM 2011 B69 B78 U ZHANG 2013 814 819 L CAO 2013 2076 R HIJAZI 2014 6348 6354 I MA 2015 53 57 W LU 2015 4954 4959 G ZHU 2014 10673 10677 Y WANG 2013 381 389 J REN 2016 33302 33307 C LAROUCHE 2014 170 182 N BANHAM 2015 334 348 D FAUBERT 1996 1689 1701 G FIECHTER 2013 S FUELCELLSSELECTEDENTRIESENCYCLOPEDIASUSTAINABILITYSCIENCETECHNOLOGY LI 2016 1562 1568 X ZHANG 2016 1275 1282 T BAI 2016 1127 1133 Y BAKER 2008 6906 6919 R TANG 2013 5585 5589 H LIU 2011 10372 10375 R NIE 2015 2168 2201 Y SUN 2015 1250 1269 M FARMER 2010 933 936 J ZHANG 2014 2535 2558 Z CHENG 2013 2474 2477 F TAN 2012 4584 4591 Y GORLIN 2010 13612 13614 Y LEE 2011 5362 5366 J LIANG 2011 780 786 Y LIANG 2012 15849 15857 Y SAVINELL 2011 501 R TAKASU 2009 248 252 Y SUNTIVICH 2011 546 550 J JIN 2013 225 230 C ISHIHARA 2015 7643 7647 A LIANG 2012 3517 3523 Y ZHANG 2013 8643 8647 G SEO 2014 895 898 J ISHIHARA 2014 A TRANSITIONMETALOXIDESCARBIDESNITRIDESOXYNITRIDESCARBONITRIDESFORO2REDUCTIONREACTIONELECTROCATALYSTSFORACIDPEMFUELCELLS TAN 2011 268 S NG 2012 925 934 K NG 2012 105602 K PEREZALONSO 2012 4641 4643 F WANG 2011 1355 1359 C WU 2012 11880 11883 J WANG 2012 891 898 C WANG 2008 3588 3591 C TIAN 2007 732 735 N STAMENKOVIC 2007 493 497 V SASAKI 2012 1115 K STEPHENS 2012 341 346 I XIE 2014 3570 3576 S GENORIO 2011 5468 5472 B SNYDER 2013 5494 5501 J HU 2005 2164 X CHENG 2005 19213 19218 W CHENG 2004 127 131 W ATAEEESFAHANI 2010 3684 3686 H CHENG 2003 2495 2501 W CHENG 2003 449 452 W GUO 2014 15026 15033 S SEROV 2012 53 56 A ZHU 2016 517 531 C LIANG 2013 16002 16005 H KONG 2014 1793 1800 A YANG 2012 205 211 Z WANG 2012 4209 4212 S CHEN 2010 7492 7494 J LI 2014 1378 1386 Q YIN 2014 2930 2937 H MENG 2016 2445 2457 J NOVOSELOV 2004 666 669 K FAN 2015 7407 7418 X CHENG 2016 13881 13889 Y JIN 2013 12170 12177 C CI 2010 430 L ZHANG 2011 11170 11176 L LEE 2015 1799 1810 I WANG 2014 509 513 Z LIU 2016 1119 1126 J PARVEZ 2012 9541 9550 K WANG 2011 7625 7651 Y MEYERS 2006 A1432 A1442 J CHUA 2016 5724 5734 X ROWLEYNEALE 2016 14767 14777 S YUAN 2016 6858 6863 K JI 2015 1 9 X ZHOU 2015 3343 3350 X ZHU 2016 517 531 C YE 2014 6905 6909 T LIN 2015 3431 3436 Q TITIRICI 2012 6796 6822 M HU 2010 813 828 B CHEN 2014 4095 4103 P PAN 2014 8 15 F XU 2012 5333 5339 J KONGX2017X951 KONGX2017X951X969 KONGX2017X951XJ KONGX2017X951X969XJ 2019-06-16T00:00:00.000Z UnderEmbargo http://creativecommons.org/licenses/by-nc-nd/4.0/ item S1872-2067(17)62801-8 S1872206717628018 1-s2.0-S1872206717628018 10.1016/S1872-2067(17)62801-8 273538 2018-10-06T00:08:53.178715Z 2017-06-01 2017-06-30 1-s2.0-S1872206717628018-main.pdf https://s3-eu-west-1.amazonaws.com/prod-ucs-content-store-eu-west/content/pii:S1872206717628018/MAIN/application/pdf/dc9618b7aba86ddc5dd310eec394c046/main.pdf https://s3.amazonaws.com/prod-ucs-content-store-us-east/content/pii:S1872206717628018/MAIN/application/pdf/dc9618b7aba86ddc5dd310eec394c046/main.pdf main.pdf pdf true 16145074 MAIN 19 1-s2.0-S1872206717628018-main_1.png https://s3-eu-west-1.amazonaws.com/prod-ucs-content-store-eu-west/content/pii:S1872206717628018/PREVIEW/image/png/227419d54142942958ec97cb7bb828be/main_1.png https://s3.amazonaws.com/prod-ucs-content-store-us-east/content/pii:S1872206717628018/PREVIEW/image/png/227419d54142942958ec97cb7bb828be/main_1.png main_1.png png 46920 849 656 IMAGE-WEB-PDF 1 1-s2.0-S1872206717628018-fx1.sml https://s3-eu-west-1.amazonaws.com/prod-ucs-content-store-eu-west/content/pii:S1872206717628018/fx1/THUMBNAIL/image/gif/8bfb66cc18e91cf938648ea055b82e47/fx1.sml https://s3.amazonaws.com/prod-ucs-content-store-us-east/content/pii:S1872206717628018/fx1/THUMBNAIL/image/gif/8bfb66cc18e91cf938648ea055b82e47/fx1.sml fx1 true fx1.sml sml 25306 164 201 IMAGE-THUMBNAIL 1-s2.0-S1872206717628018-gr1.sml https://s3-eu-west-1.amazonaws.com/prod-ucs-content-store-eu-west/content/pii:S1872206717628018/gr1/THUMBNAIL/image/gif/476feecc452f6d488220deba0bec0099/gr1.sml https://s3.amazonaws.com/prod-ucs-content-store-us-east/content/pii:S1872206717628018/gr1/THUMBNAIL/image/gif/476feecc452f6d488220deba0bec0099/gr1.sml gr1 gr1.sml sml 11998 164 188 IMAGE-THUMBNAIL 1-s2.0-S1872206717628018-gr10.sml https://s3-eu-west-1.amazonaws.com/prod-ucs-content-store-eu-west/content/pii:S1872206717628018/gr10/THUMBNAIL/image/gif/44444e5301b477baa2471d3043438442/gr10.sml https://s3.amazonaws.com/prod-ucs-content-store-us-east/content/pii:S1872206717628018/gr10/THUMBNAIL/image/gif/44444e5301b477baa2471d3043438442/gr10.sml gr10 gr10.sml sml 19597 116 219 IMAGE-THUMBNAIL 1-s2.0-S1872206717628018-gr11.sml https://s3-eu-west-1.amazonaws.com/prod-ucs-content-store-eu-west/content/pii:S1872206717628018/gr11/THUMBNAIL/image/gif/77647322bf193595105db3760bec098c/gr11.sml https://s3.amazonaws.com/prod-ucs-content-store-us-east/content/pii:S1872206717628018/gr11/THUMBNAIL/image/gif/77647322bf193595105db3760bec098c/gr11.sml gr11 gr11.sml sml 22534 114 219 IMAGE-THUMBNAIL 1-s2.0-S1872206717628018-gr12.sml https://s3-eu-west-1.amazonaws.com/prod-ucs-content-store-eu-west/content/pii:S1872206717628018/gr12/THUMBNAIL/image/gif/6e61f031b641c4a83751cbc46c19b3f9/gr12.sml https://s3.amazonaws.com/prod-ucs-content-store-us-east/content/pii:S1872206717628018/gr12/THUMBNAIL/image/gif/6e61f031b641c4a83751cbc46c19b3f9/gr12.sml gr12 gr12.sml sml 23766 137 219 IMAGE-THUMBNAIL 1-s2.0-S1872206717628018-gr2.sml https://s3-eu-west-1.amazonaws.com/prod-ucs-content-store-eu-west/content/pii:S1872206717628018/gr2/THUMBNAIL/image/gif/0ffabd99db337d032e7ba46a72e92378/gr2.sml https://s3.amazonaws.com/prod-ucs-content-store-us-east/content/pii:S1872206717628018/gr2/THUMBNAIL/image/gif/0ffabd99db337d032e7ba46a72e92378/gr2.sml gr2 gr2.sml sml 16723 128 219 IMAGE-THUMBNAIL 1-s2.0-S1872206717628018-gr3.sml https://s3-eu-west-1.amazonaws.com/prod-ucs-content-store-eu-west/content/pii:S1872206717628018/gr3/THUMBNAIL/image/gif/0cf3201c13f2f84aaefefd0677b6554f/gr3.sml https://s3.amazonaws.com/prod-ucs-content-store-us-east/content/pii:S1872206717628018/gr3/THUMBNAIL/image/gif/0cf3201c13f2f84aaefefd0677b6554f/gr3.sml gr3 gr3.sml sml 20317 127 219 IMAGE-THUMBNAIL 1-s2.0-S1872206717628018-gr4.sml https://s3-eu-west-1.amazonaws.com/prod-ucs-content-store-eu-west/content/pii:S1872206717628018/gr4/THUMBNAIL/image/gif/50348f947d0260b804b5746306ff654c/gr4.sml https://s3.amazonaws.com/prod-ucs-content-store-us-east/content/pii:S1872206717628018/gr4/THUMBNAIL/image/gif/50348f947d0260b804b5746306ff654c/gr4.sml gr4 gr4.sml sml 20738 131 219 IMAGE-THUMBNAIL 1-s2.0-S1872206717628018-gr5.sml https://s3-eu-west-1.amazonaws.com/prod-ucs-content-store-eu-west/content/pii:S1872206717628018/gr5/THUMBNAIL/image/gif/cf5dc1dc3544cf9b1aa713bb28af0f3d/gr5.sml https://s3.amazonaws.com/prod-ucs-content-store-us-east/content/pii:S1872206717628018/gr5/THUMBNAIL/image/gif/cf5dc1dc3544cf9b1aa713bb28af0f3d/gr5.sml gr5 gr5.sml sml 16545 96 219 IMAGE-THUMBNAIL 1-s2.0-S1872206717628018-gr6.sml https://s3-eu-west-1.amazonaws.com/prod-ucs-content-store-eu-west/content/pii:S1872206717628018/gr6/THUMBNAIL/image/gif/4939fe11aeee558e6ce1bb0deb051ad0/gr6.sml https://s3.amazonaws.com/prod-ucs-content-store-us-east/content/pii:S1872206717628018/gr6/THUMBNAIL/image/gif/4939fe11aeee558e6ce1bb0deb051ad0/gr6.sml gr6 gr6.sml sml 14573 79 219 IMAGE-THUMBNAIL 1-s2.0-S1872206717628018-gr7.sml https://s3-eu-west-1.amazonaws.com/prod-ucs-content-store-eu-west/content/pii:S1872206717628018/gr7/THUMBNAIL/image/gif/ab8a6a9ab375e730bdbfa7529e4ae49d/gr7.sml https://s3.amazonaws.com/prod-ucs-content-store-us-east/content/pii:S1872206717628018/gr7/THUMBNAIL/image/gif/ab8a6a9ab375e730bdbfa7529e4ae49d/gr7.sml gr7 gr7.sml sml 27974 163 187 IMAGE-THUMBNAIL 1-s2.0-S1872206717628018-gr8.sml https://s3-eu-west-1.amazonaws.com/prod-ucs-content-store-eu-west/content/pii:S1872206717628018/gr8/THUMBNAIL/image/gif/07c6a3c434fd455f8194950707216d53/gr8.sml https://s3.amazonaws.com/prod-ucs-content-store-us-east/content/pii:S1872206717628018/gr8/THUMBNAIL/image/gif/07c6a3c434fd455f8194950707216d53/gr8.sml gr8 gr8.sml sml 11021 80 219 IMAGE-THUMBNAIL 1-s2.0-S1872206717628018-gr9.sml https://s3-eu-west-1.amazonaws.com/prod-ucs-content-store-eu-west/content/pii:S1872206717628018/gr9/THUMBNAIL/image/gif/2b466e9c61b197546fe96fd53dc8d03b/gr9.sml https://s3.amazonaws.com/prod-ucs-content-store-us-east/content/pii:S1872206717628018/gr9/THUMBNAIL/image/gif/2b466e9c61b197546fe96fd53dc8d03b/gr9.sml gr9 gr9.sml sml 23557 163 219 IMAGE-THUMBNAIL 1-s2.0-S1872206717628018-fx1.jpg https://s3-eu-west-1.amazonaws.com/prod-ucs-content-store-eu-west/content/pii:S1872206717628018/fx1/DOWNSAMPLED/image/jpeg/5b417c17689464d76cf6ccaccb45bf68/fx1.jpg https://s3.amazonaws.com/prod-ucs-content-store-us-east/content/pii:S1872206717628018/fx1/DOWNSAMPLED/image/jpeg/5b417c17689464d76cf6ccaccb45bf68/fx1.jpg fx1 true fx1.jpg jpg 57370 245 301 IMAGE-DOWNSAMPLED 1-s2.0-S1872206717628018-gr1.jpg https://s3-eu-west-1.amazonaws.com/prod-ucs-content-store-eu-west/content/pii:S1872206717628018/gr1/DOWNSAMPLED/image/jpeg/f46190a8ac57b003464aefc786a5d231/gr1.jpg https://s3.amazonaws.com/prod-ucs-content-store-us-east/content/pii:S1872206717628018/gr1/DOWNSAMPLED/image/jpeg/f46190a8ac57b003464aefc786a5d231/gr1.jpg gr1 gr1.jpg jpg 39873 299 344 IMAGE-DOWNSAMPLED 1-s2.0-S1872206717628018-gr10.jpg https://s3-eu-west-1.amazonaws.com/prod-ucs-content-store-eu-west/content/pii:S1872206717628018/gr10/DOWNSAMPLED/image/jpeg/99c89c81696926ee9bdb365cc2dc8776/gr10.jpg https://s3.amazonaws.com/prod-ucs-content-store-us-east/content/pii:S1872206717628018/gr10/DOWNSAMPLED/image/jpeg/99c89c81696926ee9bdb365cc2dc8776/gr10.jpg gr10 gr10.jpg jpg 122844 345 653 IMAGE-DOWNSAMPLED 1-s2.0-S1872206717628018-gr11.jpg https://s3-eu-west-1.amazonaws.com/prod-ucs-content-store-eu-west/content/pii:S1872206717628018/gr11/DOWNSAMPLED/image/jpeg/5bee582d6c471e583022f1ef1c315467/gr11.jpg https://s3.amazonaws.com/prod-ucs-content-store-us-east/content/pii:S1872206717628018/gr11/DOWNSAMPLED/image/jpeg/5bee582d6c471e583022f1ef1c315467/gr11.jpg gr11 gr11.jpg jpg 113220 353 678 IMAGE-DOWNSAMPLED 1-s2.0-S1872206717628018-gr12.jpg https://s3-eu-west-1.amazonaws.com/prod-ucs-content-store-eu-west/content/pii:S1872206717628018/gr12/DOWNSAMPLED/image/jpeg/8ff3d9a99d50b447f9b20bc2add713a0/gr12.jpg https://s3.amazonaws.com/prod-ucs-content-store-us-east/content/pii:S1872206717628018/gr12/DOWNSAMPLED/image/jpeg/8ff3d9a99d50b447f9b20bc2add713a0/gr12.jpg gr12 gr12.jpg jpg 89046 376 602 IMAGE-DOWNSAMPLED 1-s2.0-S1872206717628018-gr2.jpg https://s3-eu-west-1.amazonaws.com/prod-ucs-content-store-eu-west/content/pii:S1872206717628018/gr2/DOWNSAMPLED/image/jpeg/4b02f7374452ca40b61f36da41655a90/gr2.jpg https://s3.amazonaws.com/prod-ucs-content-store-us-east/content/pii:S1872206717628018/gr2/DOWNSAMPLED/image/jpeg/4b02f7374452ca40b61f36da41655a90/gr2.jpg gr2 gr2.jpg jpg 71495 328 562 IMAGE-DOWNSAMPLED 1-s2.0-S1872206717628018-gr3.jpg https://s3-eu-west-1.amazonaws.com/prod-ucs-content-store-eu-west/content/pii:S1872206717628018/gr3/DOWNSAMPLED/image/jpeg/e0acbaba87a7dfa276dc4a1177f8f666/gr3.jpg https://s3.amazonaws.com/prod-ucs-content-store-us-east/content/pii:S1872206717628018/gr3/DOWNSAMPLED/image/jpeg/e0acbaba87a7dfa276dc4a1177f8f666/gr3.jpg gr3 gr3.jpg jpg 88577 374 647 IMAGE-DOWNSAMPLED 1-s2.0-S1872206717628018-gr4.jpg https://s3-eu-west-1.amazonaws.com/prod-ucs-content-store-eu-west/content/pii:S1872206717628018/gr4/DOWNSAMPLED/image/jpeg/d3ebfb6a5341bf11902285d4bf4bb846/gr4.jpg https://s3.amazonaws.com/prod-ucs-content-store-us-east/content/pii:S1872206717628018/gr4/DOWNSAMPLED/image/jpeg/d3ebfb6a5341bf11902285d4bf4bb846/gr4.jpg gr4 gr4.jpg jpg 101295 371 623 IMAGE-DOWNSAMPLED 1-s2.0-S1872206717628018-gr5.jpg https://s3-eu-west-1.amazonaws.com/prod-ucs-content-store-eu-west/content/pii:S1872206717628018/gr5/DOWNSAMPLED/image/jpeg/324db9f263f7ef4c02fd883beabb8901/gr5.jpg https://s3.amazonaws.com/prod-ucs-content-store-us-east/content/pii:S1872206717628018/gr5/DOWNSAMPLED/image/jpeg/324db9f263f7ef4c02fd883beabb8901/gr5.jpg gr5 gr5.jpg jpg 78989 296 674 IMAGE-DOWNSAMPLED 1-s2.0-S1872206717628018-gr6.jpg https://s3-eu-west-1.amazonaws.com/prod-ucs-content-store-eu-west/content/pii:S1872206717628018/gr6/DOWNSAMPLED/image/jpeg/7f3281253b256e6dc1b0fdd7fdd35dbb/gr6.jpg https://s3.amazonaws.com/prod-ucs-content-store-us-east/content/pii:S1872206717628018/gr6/DOWNSAMPLED/image/jpeg/7f3281253b256e6dc1b0fdd7fdd35dbb/gr6.jpg gr6 gr6.jpg jpg 85553 274 759 IMAGE-DOWNSAMPLED 1-s2.0-S1872206717628018-gr7.jpg https://s3-eu-west-1.amazonaws.com/prod-ucs-content-store-eu-west/content/pii:S1872206717628018/gr7/DOWNSAMPLED/image/jpeg/44e419a335cc91bf935e37bfc5a6d466/gr7.jpg https://s3.amazonaws.com/prod-ucs-content-store-us-east/content/pii:S1872206717628018/gr7/DOWNSAMPLED/image/jpeg/44e419a335cc91bf935e37bfc5a6d466/gr7.jpg gr7 gr7.jpg jpg 160207 548 627 IMAGE-DOWNSAMPLED 1-s2.0-S1872206717628018-gr8.jpg https://s3-eu-west-1.amazonaws.com/prod-ucs-content-store-eu-west/content/pii:S1872206717628018/gr8/DOWNSAMPLED/image/jpeg/fc60d242518558876aa88d8e4a1e1dca/gr8.jpg https://s3.amazonaws.com/prod-ucs-content-store-us-east/content/pii:S1872206717628018/gr8/DOWNSAMPLED/image/jpeg/fc60d242518558876aa88d8e4a1e1dca/gr8.jpg gr8 gr8.jpg jpg 57053 224 612 IMAGE-DOWNSAMPLED 1-s2.0-S1872206717628018-gr9.jpg https://s3-eu-west-1.amazonaws.com/prod-ucs-content-store-eu-west/content/pii:S1872206717628018/gr9/DOWNSAMPLED/image/jpeg/92665a4304c1d84b6f256104c0c79ae6/gr9.jpg https://s3.amazonaws.com/prod-ucs-content-store-us-east/content/pii:S1872206717628018/gr9/DOWNSAMPLED/image/jpeg/92665a4304c1d84b6f256104c0c79ae6/gr9.jpg gr9 gr9.jpg jpg 109640 481 648 IMAGE-DOWNSAMPLED 1-s2.0-S1872206717628018-fx1_lrg.jpg https://s3-eu-west-1.amazonaws.com/prod-ucs-content-store-eu-west/content/pii:S1872206717628018/fx1/HIGHRES/image/jpeg/145a8705eff47f25b3a732089233d8f2/fx1_lrg.jpg https://s3.amazonaws.com/prod-ucs-content-store-us-east/content/pii:S1872206717628018/fx1/HIGHRES/image/jpeg/145a8705eff47f25b3a732089233d8f2/fx1_lrg.jpg fx1 true fx1_lrg.jpg jpg 188912 651 800 IMAGE-HIGH-RES 1-s2.0-S1872206717628018-gr1_lrg.jpg https://s3-eu-west-1.amazonaws.com/prod-ucs-content-store-eu-west/content/pii:S1872206717628018/gr1/HIGHRES/image/jpeg/8336e731aa8824c92d22f30b21fbf0e3/gr1_lrg.jpg https://s3.amazonaws.com/prod-ucs-content-store-us-east/content/pii:S1872206717628018/gr1/HIGHRES/image/jpeg/8336e731aa8824c92d22f30b21fbf0e3/gr1_lrg.jpg gr1 gr1_lrg.jpg jpg 113878 795 914 IMAGE-HIGH-RES 1-s2.0-S1872206717628018-gr10_lrg.jpg https://s3-eu-west-1.amazonaws.com/prod-ucs-content-store-eu-west/content/pii:S1872206717628018/gr10/HIGHRES/image/jpeg/3d6e2393752d1f818b28225530323107/gr10_lrg.jpg https://s3.amazonaws.com/prod-ucs-content-store-us-east/content/pii:S1872206717628018/gr10/HIGHRES/image/jpeg/3d6e2393752d1f818b28225530323107/gr10_lrg.jpg gr10 gr10_lrg.jpg jpg 465956 916 1734 IMAGE-HIGH-RES 1-s2.0-S1872206717628018-gr11_lrg.jpg https://s3-eu-west-1.amazonaws.com/prod-ucs-content-store-eu-west/content/pii:S1872206717628018/gr11/HIGHRES/image/jpeg/935ea347fa9a83a2cad236ad87730646/gr11_lrg.jpg https://s3.amazonaws.com/prod-ucs-content-store-us-east/content/pii:S1872206717628018/gr11/HIGHRES/image/jpeg/935ea347fa9a83a2cad236ad87730646/gr11_lrg.jpg gr11 gr11_lrg.jpg jpg 451909 937 1802 IMAGE-HIGH-RES 1-s2.0-S1872206717628018-gr12_lrg.jpg https://s3-eu-west-1.amazonaws.com/prod-ucs-content-store-eu-west/content/pii:S1872206717628018/gr12/HIGHRES/image/jpeg/d3eadc1643603a537131cdff19336b65/gr12_lrg.jpg https://s3.amazonaws.com/prod-ucs-content-store-us-east/content/pii:S1872206717628018/gr12/HIGHRES/image/jpeg/d3eadc1643603a537131cdff19336b65/gr12_lrg.jpg gr12 gr12_lrg.jpg jpg 317844 1000 1599 IMAGE-HIGH-RES 1-s2.0-S1872206717628018-gr2_lrg.jpg https://s3-eu-west-1.amazonaws.com/prod-ucs-content-store-eu-west/content/pii:S1872206717628018/gr2/HIGHRES/image/jpeg/b801383d8c7af12ea6de56219284c1bd/gr2_lrg.jpg https://s3.amazonaws.com/prod-ucs-content-store-us-east/content/pii:S1872206717628018/gr2/HIGHRES/image/jpeg/b801383d8c7af12ea6de56219284c1bd/gr2_lrg.jpg gr2 gr2_lrg.jpg jpg 243678 871 1493 IMAGE-HIGH-RES 1-s2.0-S1872206717628018-gr3_lrg.jpg https://s3-eu-west-1.amazonaws.com/prod-ucs-content-store-eu-west/content/pii:S1872206717628018/gr3/HIGHRES/image/jpeg/380da50063ae2baba85b054c4a40375a/gr3_lrg.jpg https://s3.amazonaws.com/prod-ucs-content-store-us-east/content/pii:S1872206717628018/gr3/HIGHRES/image/jpeg/380da50063ae2baba85b054c4a40375a/gr3_lrg.jpg gr3 gr3_lrg.jpg jpg 350964 994 1718 IMAGE-HIGH-RES 1-s2.0-S1872206717628018-gr4_lrg.jpg https://s3-eu-west-1.amazonaws.com/prod-ucs-content-store-eu-west/content/pii:S1872206717628018/gr4/HIGHRES/image/jpeg/20b8c670891f578bd838cd4e2f5df354/gr4_lrg.jpg https://s3.amazonaws.com/prod-ucs-content-store-us-east/content/pii:S1872206717628018/gr4/HIGHRES/image/jpeg/20b8c670891f578bd838cd4e2f5df354/gr4_lrg.jpg gr4 gr4_lrg.jpg jpg 380242 987 1656 IMAGE-HIGH-RES 1-s2.0-S1872206717628018-gr5_lrg.jpg https://s3-eu-west-1.amazonaws.com/prod-ucs-content-store-eu-west/content/pii:S1872206717628018/gr5/HIGHRES/image/jpeg/a31d2cbb39926aa05197d022a15abb12/gr5_lrg.jpg https://s3.amazonaws.com/prod-ucs-content-store-us-east/content/pii:S1872206717628018/gr5/HIGHRES/image/jpeg/a31d2cbb39926aa05197d022a15abb12/gr5_lrg.jpg gr5 gr5_lrg.jpg jpg 282392 786 1792 IMAGE-HIGH-RES 1-s2.0-S1872206717628018-gr6_lrg.jpg https://s3-eu-west-1.amazonaws.com/prod-ucs-content-store-eu-west/content/pii:S1872206717628018/gr6/HIGHRES/image/jpeg/c829bb945d1554cf2f118038ef11b79f/gr6_lrg.jpg https://s3.amazonaws.com/prod-ucs-content-store-us-east/content/pii:S1872206717628018/gr6/HIGHRES/image/jpeg/c829bb945d1554cf2f118038ef11b79f/gr6_lrg.jpg gr6 gr6_lrg.jpg jpg 318602 728 2017 IMAGE-HIGH-RES 1-s2.0-S1872206717628018-gr7_lrg.jpg https://s3-eu-west-1.amazonaws.com/prod-ucs-content-store-eu-west/content/pii:S1872206717628018/gr7/HIGHRES/image/jpeg/6fa088f02a24e569041120249dc783ed/gr7_lrg.jpg https://s3.amazonaws.com/prod-ucs-content-store-us-east/content/pii:S1872206717628018/gr7/HIGHRES/image/jpeg/6fa088f02a24e569041120249dc783ed/gr7_lrg.jpg gr7 gr7_lrg.jpg jpg 636868 1457 1667 IMAGE-HIGH-RES 1-s2.0-S1872206717628018-gr8_lrg.jpg https://s3-eu-west-1.amazonaws.com/prod-ucs-content-store-eu-west/content/pii:S1872206717628018/gr8/HIGHRES/image/jpeg/cb66c7214eb083df857bfff358c3c2c0/gr8_lrg.jpg https://s3.amazonaws.com/prod-ucs-content-store-us-east/content/pii:S1872206717628018/gr8/HIGHRES/image/jpeg/cb66c7214eb083df857bfff358c3c2c0/gr8_lrg.jpg gr8 gr8_lrg.jpg jpg 193192 595 1625 IMAGE-HIGH-RES 1-s2.0-S1872206717628018-gr9_lrg.jpg https://s3-eu-west-1.amazonaws.com/prod-ucs-content-store-eu-west/content/pii:S1872206717628018/gr9/HIGHRES/image/jpeg/2282b9cb9111d68633517de9c661cfd1/gr9_lrg.jpg https://s3.amazonaws.com/prod-ucs-content-store-us-east/content/pii:S1872206717628018/gr9/HIGHRES/image/jpeg/2282b9cb9111d68633517de9c661cfd1/gr9_lrg.jpg gr9 gr9_lrg.jpg jpg 428090 1277 1721 IMAGE-HIGH-RES 1-s2.0-S1872206717628018-si1.gif https://s3-eu-west-1.amazonaws.com/prod-ucs-content-store-eu-west/content/pii:S1872206717628018/STRIPIN/image/gif/20590c5359a6116e2b317dde6d8e2a70/si1.gif https://s3.amazonaws.com/prod-ucs-content-store-us-east/content/pii:S1872206717628018/STRIPIN/image/gif/20590c5359a6116e2b317dde6d8e2a70/si1.gif si1 si1.gif gif 731 16 244 ALTIMG 1-s2.0-S1872206717628018-si2.gif https://s3-eu-west-1.amazonaws.com/prod-ucs-content-store-eu-west/content/pii:S1872206717628018/STRIPIN/image/gif/897c65b8a564ca10b7ec70a545fe3668/si2.gif https://s3.amazonaws.com/prod-ucs-content-store-us-east/content/pii:S1872206717628018/STRIPIN/image/gif/897c65b8a564ca10b7ec70a545fe3668/si2.gif si2 si2.gif gif 1217 14 287 ALTIMG CHNJC 62801 S1872-2067(17)62801-8 10.1016/S1872-2067(17)62801-8 Dalian Institute of Chemical Physics, the Chinese Academy of Sciences Fig. 1 Representation of a fuel cell showing the continuous supply of reactants (hydrogen at the anode and oxygen at the cathode) and redox reactions in the cell. Fig. 2 Left: Schematic diagram of the selected molecular structure of metal porphyrins. Right: (a) Cyclic voltammograms of oxygen reduction on the (Fe–TCPP) n MOF with different weight percentage (wt%) of graphene; (b) Cyclic voltammograms of oxygen reduction on different modified electrodes in 0.1 mol/L KOH O2-saturated at a scan rate of 50 mV/s. The right is reprinted with permission from Ref. [41] © 2012, American Chemical Society. Fig. 3 (a) SEM image of urchin-like LSM powders; (b) Schematic diagram of the growth of the urchin-like nanostructure; (c) Disk current density (i d) on the urchin-like LSM/C electrode during the ORR in O2-saturated 0.1 mol/L KOH solution; (d) ORR at 2500 r/min in the same solution catalysed by the urchin-like LSM, regular LSM and Pt/C electrocatalysts. Reproduced with permission from Ref. [81] © 2013, Elsevier B.V. Fig. 4 TEM and SEM images of Au NP and Au-NP-modified electrodes; Modification procedures and current-voltage curves of ITO/APTMS/PSS/Au NP electrodes (APTMS = (3-aminopropyl)trimethoxysilane, PSS = poly(sodium 4-styrenesulfonate). Reproduced with permission from Ref. [25] © 2013, American Chemical Society. Fig. 5 (a) ORR catalytic mechanism on metal NPs; (b) TEM image of Au/Cu40Pd60; ORR polarization curves (c) and summary of ORR mass activity (d) for Ag/Cu37Pd63 and Au/Cu40Pd60 in O2-saturated 0.1 mol/L KOH solution at −0.1 V and 20 °C. Scan rate: 10 mV/s. Rotation rate: 1600 r/min. (e) ORR polarization curves of Au/Cu40Pd60 NPs at different rotation rates. (f) K-L plots of the ORR from Au/Cu40Pd60 NPs. Reproduced with permission from Ref. [108] © 2014, American Chemical Society. Fig. 6 Left: Schematics of the formation of shrinkable metal-oxide wire-in-tube (I) and tube-in-tube nanotubes (II); Right: SEM images of shrinkable CoMn2O4 wire-in-tube (a) and tube-in-tube (b) nanotubes; Schematic illustration of shrinkable tube-in-tube nanotubes with efficient O2 diffusion and fast mass transport in the ORR (c); LSV (linear sweep voltammetry) curves of different nanotubes in O2-saturated 0.1 mol/L KOH at 5 mV/s (d). Reproduced with permission from Ref. [112] © 2016, Tsinghua University Press and Springer-Verlag Berlin Heidelberg. Fig. 7 General synthetic procedure of a metal-oxide@MnO x core-shell and the confinement of ultrafine NiO within amorphous MnO x . The insert shows LSV curves for the ORR and OER on metal-oxide@MnO x structures at a scan rate of 10 mV/s and rotation rate of 1600 r/min. Reproduced with permission from Ref. [121] © 2016, The Royal Society of Chemistry. Fig. 8 Doping of a graphitic carbon structure with heteroatoms to develop different constructions. Fig. 9 (a) Low-magnification TEM images of the Co3O4=N–rmGO hybrid (reduced mildly oxidized graphene oxide (rmGO)); (b) Chronoamperometric responses (percentage of current retained versus operation time) of the Co3O4=N–rmGO hybrid and Pt/C on carbon-fibre-paper electrodes kept at 0.70 V versus RHE in O2-saturated KOH electrolytes (1 mol/L); Rotating-disk voltammograms of the Co3O4=rmGO hybrid (c) and Co3O4=N–rmGO hybrid (d) in O2-saturated 0.1 mol/L KOH with a sweep rate of 5 mV/s at the different rotation rates indicated. Insets in (c) and (d) show corresponding K-L plots at different potentials. Reproduced with permission from Ref. [76] © 2011, Macmillan Publishers Limited. Fig. 10 (a) ORR process taking place at the surface of the M–CMP–T hybrids under an alkaline condition; (b) Current-voltage curves for N2- and O2-saturated 0.1 mol/L KOH; (c) LSV curves at different rotation rates in O2-saturated 0.1-mol/L KOH at 5 mV/s (inset: K-L plots); (d) RRDE curve for a rotation speed of 1600 r/min (inset: calculated electron transfer number (n) against the potential); (e) LSV curves at 1600 r/min and a scan rate of 5 mV/s; (f) Galvanostatic charge/discharge curves at a current density of 0.2 A/g. Reprinted with permission from Ref. [133] © 2016, Wiley-VCH Verlag GmbH & Co. KGaA, Weinheim. Fig. 11 (a) Polarization curves of various electrocatalysts on glassy carbon electrodes and the chronoamperometric response (i–t) at 0.4 V vs. RHE in different electrolytes corresponding to electrochemical activity and stability of the catalysts, respectively; (b) Compositional line profile across the CNF@NG; (c) Scheme of the CNF@NG vein-leaf complex structure for enhancing electron transfer; (d) EIS spectra of CNF@NG, NG and CNF in O2-saturated 0.1 mol/L KOH solution; (e) Scheme of the complex interpenetrated three-dimensional network structure of CNF@NG, which facilitates the mass transfer. Reproduced with permission from Ref. [137] © 2014, Wiley-VCH Verlag GmbH & Co. KGaA, Weinheim. Fig. 12 (a) Preparation of the nitrogen-doped nanoporous carbon nanosheet NCS-800 from the plant Typha orientalis; (b) SEM images of NCS-800; (c) rotating-disk-electrode voltammograms in O2-saturated 0.1 mol/L KOH solution at room temperature for NCS-800 and Pt/C. Reproduced with permission from Ref. [143] © 2014, The Royal Society of Chemistry. Table 1 Electrochemical reactions for the ORR under different conditions. Media Acidic Alkaline Electrochemical reactions anode H2 – 2e− = 2H+ (2) H2 – 2e− = 2H+ (6) cathode O2 + 2H+ + 2e− = H2O2 (3) O2 + H2O + 2e− = HO2 − + OH− (7) H2O2 + 2H+ + 2e− = 2H2O (4) HO2 − + H2O + 2e− = 3OH− (8) overall O2 + 4H+ + 4e− = 2H2O (5) O2 + 2H2O + 4e− = 4OH− (9) Published 5 June 2017 This work was supported by the Australian Research Councile Discovery Projects (DP140100052, DP150103750), Advanced Study and Training Program of Jiangsu Vocational Education (2016TDFX013), High Level Talent Fund of Yancheng Vocational Institute of Health Sciences and Scientific Innovation Team Project of Yancheng Vocational Institute of Health Sciences. Review (Special Issue on Nanoscience and Catalysis) Recent advances in the rational design of electrocatalysts towards the oxygen reduction reaction Jianfei Kong a * Wenlong Cheng b c # a Yancheng Vocational Institute of Health Sciences, Yancheng 224000, Jiangsu, China Yancheng Vocational Institute of Health Sciences Yancheng Jiangsu 224000 China b Department of Chemical Engineering, Faculty of Engineering, Monash University, Clayton, VIC 3800, Australia Department of Chemical Engineering Faculty of Engineering Monash University Clayton VIC 3800 Australia c Melbourne Centre for Nanofabrication, Clayton, VIC 3168, Australia Melbourne Centre for Nanofabrication Clayton VIC 3168 Australia * Corresponding author. Tel: +86-515-88588630; Fax: +86-515-88159499 Corresponding author Tel: +86-515-88588630 Fax: +86-515-88159499 # Corresponding author. Tel: +61-3-99053147; Fax: +61-3-99055686 Corresponding author Tel: +61-3-99053147 Fax: +61-3-99055686 The quest for low-cost yet efficient non-Pt electrocatalysts for the oxygen reduction reaction (ORR) has become one of the main focuses of research in the field of catalysis, which has implications for the development of the next generation of greener fuel cells. Here, we comprehensively describe the ‘big picture’ of recent advances made in the rational design of ORR electrocatalysts, including molecule-based, metal-oxide-based, metal-nanomaterial-based and two-dimensional electrocatalysts. Transition metals can fabricate molecular electrocatalysts with N4-macrocycles such as porphyrin-class compounds and the so-formed M–N–C active centre plays a crucial role in determining the catalytic performances towards the ORR. Group-IV and -V Transition metal oxides represent another class of promising alternative of Pt-based catalysts for the ORR which catalytic activity largely depends on the surface structure and the introduction of surface defects. Recent advances in synthesis of metallic nanoparticles (NPs) allow for precise control over particle sizes and shapes and the crystalline facets exposed to enhance the ORR performance of electrocatalysts. Two-dimensional materials such as functionalized grapheme or MoS2 are emerging as novel electrocatalysts for the ORR. This review covers various aspects towards the design of future ORR electrocatalysts, including the catalytic performance, stability, durability and cost. Some novel electrocatalysts even surpass commercial Pt/C systems, demonstrating their potential to be alternatives in industrial applications. Despite the encouraging progress, challenges, which are also described, remain to be overcome before the real-world application of novel ORR electrocatalysts. Graphical Abstract This review gives a comprehensive overview of recent progress in the search of non-Pt electrocatalysts towards the oxygen reduction reaction, including molecules, metal oxides, metal nanomaterials and two-dimensional materials. Keywords Oxygen reduction reaction Electrocatalyst Nanomaterial Molecular electrocatalyt Two-dimensional material 1 Introduction As an ideal primary-energy device that can directly convert chemical fuels into electricity through electrochemical processes, fuel cells use hydrogen or hydrocarbon fuels in which the chemical energy stored is greater than that in common battery materials and they can be operated at close to room temperature [1]. Fuel cells are thus considered a promising replacement of traditional energy solutions in terms of providing clean, steady and sustainable power to meet the rising global energy demand [2]. It is expected that highly efficient fuel cells will come into widespread commercial use in the areas of transportation and stationary and portable power generation [3]. When hydrogen fuel is used, water is the only by-product and there is no carbon footprint on the environment. A typical H2–O2 fuel cell follows the reaction (1) H 2 + 1 / 2 O 2 = H 2 O E ° = 1.229 V As shown in Fig. 1 , H2 is oxidized at the anode while O2 is reduced at the cathode, and current thus flows through the circuit [4]. A hydrogen fuel cell can work under alkaline or acidic conditions. In comparison with the hydrogen oxidation reaction, the oxygen reduction reaction (ORR) has much slower kinetics for either alkaline or acidic media [1]. As summarized in Table 1 , in acid media, the ORR can proceed by a direct four-electron and four-proton reaction with O2 to yield H2O, or can proceed by consecutive two-electron and two-proton steps to yield H2O2 followed by H2O. In basic media, the four-electron direct reduction produces four equivalents of hydroxide, while the two-electron reduced product is one equivalent of hydroxide and one hydroperoxyl anion. The hydroperoxyl anion can then be further reduced by two electrons to three hydroxide ions. The performances and costs of fuel cells therefore largely depend on the ORR electrocatalysts used [5]. Besides slow kinetics, a substantial overpotential arises from the high bond strength of the dioxygen double bond (498 kJ), which prevents the full delivery of the predicted 1.229 V for a hydrogen fuel cell [6]. Platinum (Pt) has an overpotential of ∼300 mV for the ORR, and has been regarded as the most promising and practical ORR catalyst for hydrogen fuel cells [7]. However, the scarcity and high cost of Pt are primary barriers in the commercial world [8–10]. In addition, the Pt-based electrode suffers from other issues, including poor long-term stability and the tendency to be deactivated by a catalyst poisoner (e.g., CO) [1,2,11,12]. Attempts to reduce/replace Pt for the electrochemical reduction of oxygen in fuel cells began in the 1960s [13] and have been increasing intensively in recent decades. Even though the amount of Pt needed to achieve the desired catalytic effect can now be reduced by using Pt alloys [14,15] or making core-shell structures with supporting materials [16], the commercial scale-up of production at low cost remains challenging. In this context, much recent effort has been devoted to developing alternative ORR electrocatalysts, including molecular electrocatalysts [5,17–19], metal-nanomaterial-based electrocatalysts [20–25], metal-oxide-based electrocatalysts [2,26] and newly emerging two-dimensional electrocatalysts [27–30]. Although a few outstanding review papers have been published in the field of ORR electrocatalysts recently [2,3,6,12,21–23], a comprehensive coverage of various facets, particularly those investigated in the past 10 years, is still lacking. The purpose of this review is to give a comprehensive picture of state-of-the-art non-Pt ORR electrocatalysts. The review covers recent developments of various materials used, compares the pros and cons of each material selection, and projects future directions of the development of ORR electrocatalysts. 2 Molecule-based electrocatalysts for the ORR There have been numerous studies on transition-metal organic complexes as ORR catalyst alternatives since the investigation of transition-metal macrocyclic complexes in the 1960s [13]. Subsequently, the drive to replace expensive noble Pt catalysts for the ORR has led to a large number of molecular electrocatalysts comprising transition metal ions combining with nitrogen functional groups on carbonaceous supports [31]. The performance of these catalysts is directly related to the preparation conditions, such as the synthesis method, metal precursor, ligand structure and carbon support, because nitrogen-containing precursors as well as the metal centre play important roles in forming an active catalyst [32,33]. Later studies have indicated that the pyrolysis of these transition-metal macrocycles can generally improve both the activity and stability of the electrocatalysts [34,35]. 2.1 Molecule-based electrocatalysts with N4-macrocycles Research on metal complexes as oxygen reduction catalysts has produced metal macrocycle compounds with many different structures that can promote catalysis for the ORR in acidic, alkaline and neutral conditions [34,36]. The higher ORR catalytic activity has been found to be apt to the transition-metal centre (especially Co or Fe) in N4-macrocycles, such as porphyrin-class compounds; e.g., tetramethoxyphenyl-porphyrin, tetraphenylporphyrin, phthalocyanine (Pc) and tetraazaannulene (TCPP) [37–41]. The typical schematic diagram of metal porphyrin structures in Fig. 2 has a central metal M that is bonded with four nitrogen atoms. In principle, M (e.g., Fe, Co, Ni or Cu), N (porphyrin derivatives or other nitrogen-containing macrocycles) and C (carbon support) are necessary for there to be an active site of a molecular ORR electrocatalyst. The activity of the central transition metal ion in macrocycles largely depends on the electronic structure and interactions between the metal and ligands. The metal redox potential is also an important parameter determining the catalytic activity towards the ORR. Early investigations reported the order of catalytic activities for the ORR as Fe > Co > Ni > Cu ≈ Mn [42]. Consequently, the transition-metal macrocycles have been extensively studied from the synthetic route to the electrocatalytic mechanism, especially for porphyrin-based compounds where M = Fe or Co. These metal-porphyrin-type complexes, whether mono- or dinuclear, have been found to enhance the ORR efficiently but via a different mechanism. For instance, reactivity studies for the disproportionation of hydrogen peroxide revealed that O–O bond activation can be enhanced by introducing a proton-transfer component. Dicobalt(II) cofacial bisporphyrins can catalyse such proton-coupled ORR reduces O2 with a four-electron pathway direct produce water at 80% selectivity [43]. While in the presence of another cobalt porphyrin complex, it has been found that O2 is reduced via a two-electron scheme in which H2O2 is a product [44]. A real alternative to Pt must have at least 1/10 of the volumetric activity of Pt/C because even this activity barely meets the requirement for automotive applications [45]. Only since 2005 have several breakthroughs led to advances in reaching satisfactory activity of metal-containing molecular catalysts [46,47]. Recently, combining ready-made metal macrocycles with a carbon support seems to be a typical procedure in the preparation of catalysts for an ORR catalytic of this kind [48]. Normally used carbon supports include carbon blacks [49], mesoporous carbons [50] and carbon nanotubes (CNTs) [51]. In 2012, a metalloporphyrin metal-organic framework (MOF) with enhanced catalytic activity for the ORR was synthesized from iron porphyrin and the electrochemical property was investigated as a function of the weight percentage of the functionalized carbon support added to the iron–porphyrin framework [41]. Results showed that the addition of carbon support affected the crystallization process of iron porphyrin in the MOF, increased the porosity and improves the electrochemical charge transfer ability. The carbon–metalloporphyrin hybrid has a facile four-electron pathway for the ORR with catalytic activity comparable to that of Pt/C and is thus a promising Pt-free cathode in an alkaline direct methanol fuel cell. In 2014, a covalent network of porphyrins around multi-walled carbon nanotube (MWNT) surfaces was reported. Cobalt(II) meso-tetraethynylporphyrins are arranged on the nanotube sidewalls through adsorption followed by the dimerization of the triple bonds via Hay coupling [52]. The network is stabi lized by multiple π-stacking interactions between the porphyrins and nanotube and by the covalent links between the porphyrins. The nanotube hybrids have been fully characterized and tested as the supported catalyst for the ORR under acidic conditions. Interestingly, compared with similar systems in which monomeric porphyrins are simply physisorbed, MWNT–CoP hybrids have a higher ORR activity associated with a four-electron process, corresponding to the complete reduction of oxygen into water. This is confirmed by the number of electrons (n) involved in the ORR being estimated as 3.82 from rotating ring-disk electrode (RRDE) measurements at −0.05 V vs Ag/AgCl. In 2015, Mao and coworkers [53] reported the novel efficient electrocatalyst Co-COF-900, synthesized by pyrolysis in the cobalt covalent organic framework. Results show that O2 is reduced at −0.50 V to produce HO2 − and O2 − as the intermediate and both the potential and current responses for the ORR are close to those of commercially available 20% Pt/C. Moreover, from RRDE voltammograms, n is calculated to be 3.86 at −0.15 V, suggesting that an almost-four-electron reduction process essentially occurs in the ORR with Co-COF-900 as the catalyst in alkaline media. In addition, there are alternative approaches for the preparation of the macrocyclic ORR catalyst; e.g., a conjugated Co(II)porphyrinylene-ethynylene-based MOF has been reported and interestingly shows good activity in both alkaline and acidic media [54]. A heterogeneous electrocatalyst containing both FeS and Fe3C phases for which o,m,p-phenylenediamine is used as a nitrogen precursor has been reported [55]. Only a small shift (39 mV) in the half-wave potential is observed after the electrocatalysts have been operated for 5000 cycles. The electrocatalytically active site is identified to be Fe–N6 complexes ([FeIII(porphyrin)(pyridine)2]), and the two pyridines are believed to play an important role in the catalytic mechanism. 2.2 Molecule-based electrocatalysts with non-macrocyclic chelating ligands Since some non-macrocycles, chelating ligands have a coordination chemistry similar to that of N4-macrocycle members and it stands to reason that they have reasonable ORR activity. Recently, a series of Cu complexes, including 1,10-phenanthrolines, tris(2-pyridyl)amine triazoles and porphyrins and amino-alkyl ligands, were surveyed [6]. It was found that catalysts with alkyl ligands usually perform poorly owing to their poor electronic conductivity. The forced square planar geometry of the Cu centre and porphyrins also hinders the reactivity performance because open coordination sites are only available above and below the Cu–N4 plane. Even though Cu complexes with pyridine, imidazole, pyrrole and triazole ligands appear to have much better activity, they face the same obstacle as transition metals other than Co and Fe in that they have much worse overall activity than Pt/C. In 2013, a series of Fe—N—C catalysts was developed by preparing iron-2,6-bis(2-pyridyl)-pyridine (Fe-TPY) complexes and then treating at 600–900 °C [56]. The optimal Fe loading with the highest potential at 0.5 mA/cm2 is 5 wt% while the optimal Fe-to-TPY ratio was determined as 1:5. Electrochemical experiments were carried in an O2-saturated 0.5 mol/L H2SO4 solution and the overall electron transfer number for the catalysed ORR was calculated from the results to be 3.7. In testing on a fuel-cell test station, the open-circuit voltage was recorded as 0.75 V at a cell voltage of 0.21 V, while the current density was 0.38 A/cm2 with a maximum power density of 0.08 W/cm2. A series of ORR catalysts was fabricated in 2016 by loading 1,10-phenanthroline–cobalt(II) metal complex onto reduced graphene oxide (rGO) surfaces via π–π interaction [57]. The introduction of the N-substituent of 1,10-phenanthroline highly boosted the catalytic activity of the metal complex in terms of the half-wave potential (E 1/2) and kinetic current density (J K), owing to the downshift of the orbital energy level for the central Co(II) arising from the electron-withdrawing effect of N on 1,10-phenanthroline. The average n values for Co complexes reached 3.4–4.0, suggesting that the Co(II)–N4 structure acts as the active centre of electrocatalysts and is responsible for the highly efficient four-electron pathway, corresponding to the complete reduction of molecular oxygen to OH− in alkaline solution. The mechanism for the ORR was found to proceed through a single-cobalt-centre-mediated reduction process. 2.3 Pyrolysis for molecule-based electrocatalysts Instability in an acidic environment has been problematic for molecule-based electrocatalysts used in ORR since their discovery in the 1960s [13]. Although the stability of these catalysts has greatly improved in recent years, a ∼20% loss in performance is still common within the first several hours of operation [58]. This loss in performance is somehow attributed to the oxidative cross-linking of macrocycles, which slowly leach out for some metal centres because of the acidic electrolyte and the oxidative degradation of the macrocycle by H2O2 generated during the ORR [59]. In the 1990s, several groups found that both the activities and stabilities of catalysts improved after heat treating Co- and Fe-based tetraphenylporphyrins at 100–1100 °C under Ar [60]. Since then, a broad range of methodologies and materials have been employed to produce active ORR catalysts via heat treatment, and pyrolysis has been considered until now to be a general procedure for preparing metal-based electrocatalysts for the ORR. Despite the remaining difficulties in discerning the controlling parameters when preparing active catalysts, there is good agreement in the literature that the original metal–ligand structure can be replaced by a class of promising metal containing catalysts (M–N x –C) through pyrolysis. With a typical M–N x –C active site, where M is a 3d transition metal (e.g., Fe or Co) and x = 1–4, both the activity and stability can benefit from these electrocatalysts [61–64]. Besides the pyrolysis of premade carbon-supported nitrogen-containing metal complexes, M–N x –C catalysts can also be prepared by the pyrolysis of a mixture of small molecular precursors [65]. In recent years, there have been an increasing number of studies on using small molecular precursors instead of ready-made transition-metal complexes as the starting material with which to prepare an M–N–C catalyst. Although the pyrolyzed process generally has advantages including superior catalyst activity and stability, it is difficult to understand the chemical nature of the active ORR catalytic sites in this case owing to the less-controllable synthetic route. Therefore, the ORR performance of these M–N–C catalysts can only be empirically determined by the type of N-containing molecules and transition metals used, and the catalysts are thus difficult to tune [21]. It is therefore worth mentioning recent works on Co/Fe-based N4-macrocycle catalysts exhibiting high catalytic activity and stability in which the active structure is clearer owing to the avoidance of the pyrolysis step in preparation [52,66,67]. 3 Metal-oxide-based electrocatalysts for the ORR Many transition metal oxides, particularly group-IV and -V metal oxides, are another important category of promising non-precious-metal catalysts for the ORR in both acidic [2] and alkaline [68] solutions; e.g., MnO x , CoO x , TiO x , ZrO x and IrO x . Applications of transition-metal oxides to the ORR have been pioneered in the last decade mainly owing to (1) the abundant hydroxyl groups on the surfaces of transition-metal oxides convenient for further functionalization [69], (2) the strong interactions between crystalline constructions of transition-metal oxides helping prevent the aggregation of small metal particles [70] and (3) the obviously higher alkaline corrosion resistance compared with the resistances of noble metals and carbon-based materials [71]. A large family of transition-metal oxides is used as ORR electrocatalysts and has been intensively studied in various fields. For instance, manganese oxides (MnO x ), including MnO, MnO2, Mn3O4, MnOOH, Mn2O3 and Mn5O8, have been identified as highly active ORR catalysts [72,73]. Although their catalytic activity for the ORR can benefit from oxygen defects in crystalline MnO x , their practical application to fuel cells is limited by their poor electrical conductivity (10−6–10−5 S/cm) [74]. This problem can be partly solved by coating MnO x onto functional materials with high conductivity, such as carbon. Ketjenblack-carbon-supported MnO x nanowires have been shown to be highly active electrocatalysts for the ORR in alkaline solution owing to the abundant active sites for oxygen adsorption and other microscopic features [75]. Recently, it was also found that the covalent hybridization of cobalt oxides, such as Co3O4 and CoO, with graphene oxide or CNTs greatly enhanced ORR activity [76,77]. The high catalytic activity of carbon-supported oxide nanoparticles (NPs) may be facilitated by the strong coupling between oxide NPs and the carbon support. The introduction of surface defects due to metal oxides is believed to be a main reason for the enhanced ORR catalytic activity [2], and the ORR activity on metal oxides therefore largely depends on the surface structure. In recent years, great attention has been paid to the perovskite family of oxides with the general formula ABO x [78]. For instance, the ORR activity of pure TiO x was found to be enhanced by adding certain amounts of Zr and Ta to TiO x to form binary oxides, such as Ti0.7Zr0.3O x and Ti0.5Ta0.5O x , and an improvement in ORR activity was also observed for Ru–LaO x and Ir–VO x binary oxides relative to the corresponding original metal oxide films [79]. This is probably due to the obviously higher surface area of binary oxides while the specific mechanisms underlying this activity enhancement are still not clear. The Ba0.5Sr0.5Co0.8Fe0.2O x -based perovskite oxide was highlighted in 2011 as a competitive candidate of the bifunctional catalyst in ORR catalysis [80]. As a mixed electronic and ionic conductor serving as an intermediate-temperature solid-oxide-fuel-cell cathode material, it facilitates the movement of oxygen anions with fast oxygen exchange kinetics and ionic conductivity. Because MnO x effectively catalyses the disproportionation reaction of HO2 − to H2O, it is possible to catalyse the four-electron reduction of oxygen upon the combination of MnO x with another material active for the two-electron reduction of oxygen to peroxide. As shown in Fig. 3 , an urchin-like La0.8Sr0.2MnO3 (LSM) perovskite oxide was synthesized in 2013 with urea as a precipitator via the coprecipitation method [81]. Its electrochemical measurements were recorded in a N2-saturated 0.1mol/L KOH solution. When compared with pure carbon, the high activity of the urchin-like LSM/C for the ORR is clearly seen in Fig. 3(c), suggesting that the O2 reduction reaction proceeds predominantly by four-electron reduction directly to OH−, which is further supported by Koutecky-Levich (K-L) plots. The experimental results in Fig. 3(d) show that the diffusion-limiting current density of the LSM is about twice that of the regular LSM electrocatalyst. Moreover, this LSM perovskite oxide can be used as a bifunctional catalyst for the ORR and oxygen evolution reaction (OER). Tuning the crystalline shape, size or components has been demonstrated to be a useful way of improving the catalytic activities of metal oxides [82]. In 2012, strong covalent coupling between oxide NPs and graphene oxide sheets was verified in the MnCo2O4–N-doped graphene hybrid developed as a highly efficient ORR electrocatalyst in alkaline conditions [83]. Mn substitution was found to increase the activity of catalytic sites of the hybrid material, further improving the ORR activity relative to that for the pure Co3O4–N species. At the same mass loading, the MnCo2O4–N-doped graphene hybrid exhibits both better catalytic activity and better stability than Pt/C in terms of ORR current density at a potential less than 0.75 V vs. the reversible hydrogen electrode (RHE). It is highly desirable but challenging to develop a highly active and durable bifunctional electrocatalyst for the reversible ORR. Novel tube-in-tube nanostructures were successfully synthesized in 2013 for many binary and ternary metal oxides with the carbon nanofiber template; e.g., MCo2O4, where M = Zn, Co, Mn and Ni, and Mn2O3, Co3O4, NiO and Fe2O3 [84]. The MnCo2O4 tube-in-tube structure has an ORR onset potential of about −0.23 V (vs. Ag/AgCl) with the peak current appearing at about −0.43 V. The electron transfer number (n) is derived from the slopes of K-L plots and calculated to be 3.8 throughout the investigated potential range, which suggests that a four-electron reduction mechanism is involved. It is worth mentioning that for these interesting tubular structures of mixed metal oxides without any carbon additive as electrocatalysts for the ORR, the experimental results show remarkable limiting current density that is comparable to that of the same metal oxide with graphene hybrid materials in KOH solution. In 2014, monodispersed metal oxide NPs, including NbO x , ZrO x and TaO x , deposited on carbon black were prepared [85]. The particle sizes of the metal oxides could be well controlled from 1 to 14 nm by adjusting the deposition conditions. Electrochemical measurements suggest that smaller particles have much higher ORR activities than their bulky particles/films, mainly owing to increased surface areas and densities of surface defects and better electrical conductivities. Besides directly serving as ORR catalysts, many metal oxides, particularly group-IV and -V metal oxides, are chemically stable in acidic electrolytes and have been proposed as catalyst supports to replace carbon. Their associated problems are low electrical conductivity and a lack of adsorption sites for oxygen species on metal oxide surfaces, resulting in extremely low ORR activity in their bulk form. Extensive efforts have been made to solve these issues by surface modification, doping, alloying and forming highly dispersed nanoparticles [86]. 4 Metal-nanomaterial-based electrocatalysts for the ORR Along with tremendous progress made in rational wet chemically synthesis, numerous monodisperse metallic NPs have been obtained with controlled sizes and shapes. Masses of high-quality NPs have high electrocatalytic ORR activity and a structure that is tuneable employing various synthetic methodologies and methods [23,87]. To integrate these metal-containing NPs into an electrocatalytic system, a prerequisite step in which the NPs are immobilized onto a bulk conductive electrode surface is usually performed via drop-casting, chemical self-assembly or other method [88,89]. A successful modification might allow researchers not only to enhance the performance of the resulting devices but also to accurately characterize the electrochemical properties of NPs [23]. 4.1 Shape and size control of metal-based NPs Shape-controlled synthesis offers the advantage of tailoring the active facets of electrocatalysts and maximizing the catalytic active areas, and thus minimizing costs especially for the precious metals used. The successful synthesis of monodisperse NPs allows further study of the size, shape and composition effects on catalysis for the ORR [21]. For instance, studies on single-component Pt NPs have shown that their ORR catalysis is NP-size dependent; among Pt NPs of different size, the smallest (ca. 3 nm) has the best activity [90]. In 2011, monodisperse 5-nm FePt3, CoPt3 and NiPt3 NPs were synthesized and found to have much higher activity for the ORR than Pt [91]. Moreover, the catalytic performance of MPt3 NPs has a volcano-type dependence on the type of M employed, and CoPt3 NPs have the highest specific and mass activity among the three alloy NP catalysts. In 2012, to test the shape effect on the NP catalysis for the ORR, 13-nm icosahedral NiPt3 NPs were synthesized by the coreduction of [Pt(acac)2] and [Ni(acac)2] [92]. Their ORR specific activity is about 50% higher than that of octahedral NiPt3 NPs, revealing that surface strain plays an essential role in their ORR enhancement. As the only practical electrocatalysts for cathode materials in fuel cells, Pt-based catalysts are expensive and scarce owing to the low abundance of Pt in the Earth's crust. Furthermore, Pt NPs are subject to dissolution, coalescence and poisoning under fuel-cell reaction conditions, which reduces both the active catalyst surface area and the catalytic efficiency for the ORR [21]. In recent decades, many efforts and achievements have been made in dealing with these challenges [20,68] employing different approaches. (1) Nanostructures have been constructed and the exposed facet of Pt NPs has been controlled to increase the catalytic efficiency [93]. It has been reported that 7-nm Pt nanocubes have much higher activities than Pt NPs of other shape in catalysing the ORR in H2SO4 [94], suggesting that the shape-dependent ORR activity of Pt NPs depends on the adsorption of sulphate ions on Pt(111) and (100) facets. Moreover, the onset potential gain for 7-nm Pt nanocubes is nearly 50 mV relative to other Pt NPs, while the current density is about four times that of Pt nanocubes of other size at the half-wave potential. It has also been found that Pt nanocubes with exposed high-index planes ({730}, {210} and {520} facets) have efficiency per unit surface area 2–4 times that for low-index planes, such as {111} and {100} [95]. However, the surface structures of such NPs are unstable during the catalysis of ORR reactions, especially in the case of structures with high-index planes [96]. (2) Pt has been alloyed with another metal to generate multimetallic nanocrystals and thus reduce the amount of Pt used. Moreover, the activity and stability of alloyed NPs catalysts has often been found to be better than those of pure Pt NPs owing to the construction of different structures, such as core-shells, branches and anisotropic structures [97]. A Pt-skeleton nanostructure can be obtained by pretreating the mother Pt alloy in an acidified solution or by dealloying via cyclic voltammetry to dissolve the non-noble three-dimensional transition metal and obtain an atomically rough surface composed of Pt atoms, which maintains favourable ORR catalytic properties [98]. In 2014, a versatile route for depositing ultrathin Pt nanocrystal shells demonstrated that the introduction of the Pt precursor at a relatively slow rate and high temperature allowed the deposition of Pt atoms to spread across the entire surface of a Pd nanocube, which generates a uniform shell. The number of Pt atomic layers on each Pd cubic seed could be precisely controlled by simply adjusting the amount of Pt precursor introduced into the reaction solution [99]. (3) Modifying Pt NP surfaces may further improve their operation in the ORR system. The improvement is determined by different functional modification species, such as metal clusters, molecules, ions and organic and inorganic compounds [68]. For instance, the ORR activity on cyanide-functionalized Pt{111} facets in H2SO4/H3PO4 electrolytes is 10–25 times that of the naked Pt{111} facets, where cyanide adsorbed on the Pt surface acts as a third body and consequently selectively blocks the adsorption of sulfuric and phosphoric acid anions [100]. In 2013, a hydrophobic, protic-ionic-liquid-encapsulated Ni–Pt porous NP catalyst supported on carbon was synthesized [101]. With the unique structure, the high O2 solubility of the ionic liquid is in conjunction with the confined environment of the pores, which is consistent with an increased residence time. The half-cell specific activity of this catalyst is found to be an order of magnitude higher than that of commercial Pt/C under the same test conditions. 4.2 Use of non-Pt noble-metal NPs in advanced electrocatalysts As mentioned above, great progress has been made toward reducing or replacing the scarce Pt used in electrocatalysts, with non-Pt noble metals considered promising high-performance catalysts for the ORR. Herein we use Au NPs as an example catalyst. In the last several years, Au NPs have been used in advanced electrocatalysts for the ORR with both flexibility and stability [24,25]. In general, shape-controlled monodisperse Au NPs can be generated employing a seed-mediated approach or one-pot synthesis [102–105]. For nanosized Au NPs, the most attractive and investigated electrochemical property is the size-/shape-dependent response towards the ORR [23]. In 2013, Cheng and coworkers reported on a general method of fabricating lightweight and mechanically flexible electrodes from either free-standing monolayered Au nanorod (NR) superlattices [89] or Au NRs three-dimensionally distributed throughout a paper matrix [24]. Flexible NR electrodes were fabricated via the dexterous self-assembly of Au NRs on sheets of tissue paper that have highly electroactive areas. The three-dimensional close-packed assembly is made uniform across the entire paper sheet to provide high conductivity, which leads to greatly enhanced electrocatalysis towards the ORR and methanol oxidation reaction (MOR) when compared with conventional Au disk electrodes. Remarkably, their conductivity is almost unaffected by repeated bending from −180° to 180°, which suggests that repeated bending does not break the NR electrodes. The electrocatalytic current density for ORR reactions on the NR electrodes is about 30 times that for Au disk electrodes under identical conditions. Around the same time, a robust chemical-tethering approach of immobilizing Au NPs onto indium tin oxide (ITO) glass electrode surfaces was reported by the same group [25]. As shown in Fig. 4 , monodisperse 20-nm nanospheres (NS20s), 45-nm nanospheres (NS45s) and 20-nm × 63-nm NRs have been chemically attached to an ITO surface to form submonolayers without any aggregation, and their size- and shape-dependent electrocatalysis toward the MOR and ORR have been systematically investigated. Results indicate strong electrocatalytic activities toward both the MOR and ORR for all three types of NP-modified ITO electrodes, while the mass current densities highly depend on the particle size and shape; i.e., smaller particles lead to higher catalytic current densities per unit mass because of the greater surface-to-volume ratio. All three types of NP-modified electrodes are virtually indefinitely stable during ORR reactions without observable aggregation. More interestingly, such a chemical modification strategy (e.g., immobilizing NPs onto a bulk conductive electrode surface [106,107]) may serve as a general route to fabricating highly stable, customizable electrocatalytic electrodes for a wide spectrum of applications in the fields of sensors and fuel cells. In 2014, Guo and coworkers [108] made calculations based on density functional theory to predict that core/shell Au/CuPd NPs with a 0.8- or 1.2-nm CuPd2 shell have similar surface strains and compositions and may surpass Pt in catalysing the ORR. Monodisperse M/CuPd NPs have been synthesized by the coreduction of palladium acetylacetonate and copper acetylacetonate in the presence of Ag (or Au) NPs with controlled shell thicknesses. The catalysis for the ORR has been evaluated in 0.1 mol/L KOH solution. Ag/Cu37Pd63 and Au/Cu40Pd60 catalysts with 0.75- and 1.1-nm shells are predicted to be more efficient than commercial Pt catalyst. Results shows their mass activity reaching 0.20 A/mg of noble metal at −0.1 V vs Ag/AgCl in 4 mol/L KCl, which is more than 3 times the activity for commercial Pt (0.06 A/mg Pt). Fig. 5 summarizes the performance of the catalysts. 4.3 Other transition-metal-based nanostructural catalysts Morphology catalyst layers have mass transport limitations. Specifically, it has been demonstrated that optimizing the thickness and porosity of the catalyst using metal-containing NPs at the cathode can affect the performance of ORR catalysts [89,109]. Transition-metal–nitrogen–carbon (M–N–C)-containing nanomaterials have thus been recognized as another promising alternative class of Pt catalysts for the ORR owing to their high activity in both alkaline and acidic electrolytes. Although the nature of the active sites in M–N–C catalysts is still not fully understood, in general both the M–N moieties and the nitrogen dopants within the carbon matrix are of great importance for the enhanced ORR [110]. For instance, the specific surface area and the structure of the catalysts largely determine the accessibility of the active sites and thus the eventual electrocatalytic performance. Silica NPs are often used as rigid templates with which to fabricate porous M–N–C catalysts during carbonization with appropriate metal and nitrogen precursors, before the template is removed to give different types of porous nanoscale features. In 2013, different nanostructures were prepared from similar silica NP templates, including interconnected vesicle-like frameworks, a linear array of mesoporous structures and nanosheet-like structures [111]. A high N/Co content and abundant active sites with a homogeneous distribution were revealed for these samples. One of the samples has obviously higher activity for the ORR in an acidic medium, indicating a larger Brunauer-Emmett-Teller (BET) surface area and well-defined porous structure, and the mesopore size thus plays an important role in improving the ORR performance. In 2014, a series of novel micro-mesoporous Fe–N–C catalysts were directly synthesized by the simple pyrolysis of different nitrogen heterocyclic compounds and iron chlorides using the same hard template [112]. It was revealed that the sample synthesized by annealing 2,2-bipyridine and Fe chelates at 900 °C had the most positive ORR onset and half-wave potential in both acid and alkaline media. The best ORR performance probably arises from the optimized balance between the active site density and capability of mass and charge transport. Carbon nanomaterials, such as nitrogen-doped CNTs, carbon nanocapsules and graphene, have been found to be highly active for the ORR [113,114]. It is thus believed that the activities of transition-metal NPs can be further improved by combining the NPs with nanocarbon structures, thereby forming enhanced ORR catalysts. In 2010, Chen et al. [115] reported the direct synthesis of TiN NPs on carbon black using a mesoporous graphite-like composite as a template. The BET surface area and pore volume of the sample were 194 m2/g and 0.64 cm3/g, respectively. The so-prepared catalyst for the ORR was examined in 0.1 mol/L H2SO4. An onset potential of 0.84 V vs. RHE was observed with a high cathodic current associated with the ORR. The carbon-black-supported electrocatalyst had constant ORR performance during 1000 cycles of charging–discharging treatment at 0.6–1.0 V vs. RHE under a N2 atmosphere, which indicates high durability of the materials as cathode catalysts. In 2014, a Co-containing MOF with polyhedral cages was used as a template during the preparation of porous Fe–N–C catalysts in which Fe–N active sites were accurately fabricated with nitrogen-doped graphene (NG) nanocomposites [116]. Although the original MOF structure could not be obtained after pyrolysis, it is important to generate graphitic carbon materials with a large surface area and porous feature, accommodating a high density of catalytic sites. The resultant N–Fe catalysts with an abundant graphene structure from the MOF has superior ORR activity in both aqueous and nonaqueous solutions. In 2014, NGA-supported Fe x N NPs were prepared via the hydrothermal assembly of GO and FePc and used as efficient ORR catalysts [117]. FeN is rich in nitrogen and therefore generates Fe–N–C structures more efficiently for maximizing the density of M–N–C active sites on a graphene surface. In addition to having small size, FeN NPs facilitate the evolution of Fe–N–C sites owing to the effective interface effect, and thus provide excellent catalytic activity for the ORR that surpasses that of commercial Pt/C. In 2016, Guo and coworkers [118] developed a facile controllable synthesis of complex-metal-oxide multilevel nanotubes with tuneable interior structures. As shown in Fig. 6 , this interface-modulated approach can be effectively applied to fabricate wire-in-tube and tube-in-tube nanotubes of various metal oxides through electrospinning followed by controlled heat treatment. Scanning electron microscope (SEM) and transmission electron microscope (TEM) images indicate that the multilevel nanotubes consist of outer shrinkable tubes having a diameter of ∼200 nm with inner thin wires (∼40 nm in diameter) or inner tubes (∼110 nm in diameter, ∼10 nm in wall thickness) for wire-in-tube or tube-in-tube nanotubes, respectively. All the multilevel nanotubes have ORR activity probably owing to their large specific surface area and mass transport, which are suitable for the ORR. Moreover, shrinkable CoMn2O4 tube-in-tube nanotubes have both excellent electrochemical activity and stability. When acting as an ORR catalyst, CoMn2O4 tube-in-tube nanotubes have excellent stability with about 92% current retention after 30,000 s, which is higher than that of commercial Pt/C (81%). 5 Two-dimensional electrocatalysts for the ORR Graphene is structured as single-layer graphite of two-dimensional sp 2 carbon atoms with close-packed conjugated hexagonal lattices, and has attracted much attention from researchers since its rediscovery in 2004 [119]. There is no doubt that the rediscovery of graphene opens a new period in the development of many scientific fields including catalysis [69]. Electrocatalysts for the ORR also greatly benefit from its unique structure and properties, such as huge surface area, ultrahigh electrical conductivity and excellent chemical stability. Moreover, transition-metal-containing cocatalysts can be immobilized on graphene by intermolecular interactions of the defects and functional groups present on graphene's surface, contributing to improved stability and catalytic activity. Although different kinds of catalyst supports have been explored in the last several years, to the best of our knowledge, the most popular and practical electrocatalysts for the ORR are still graphene-based-material-supported catalysts, despite graphene-based material not having all the properties of an ideal supporting material for fuel-cell ORR electrocatalysts. In 2012, a graphene-metalloporphyrin MOF with enhanced catalytic activity for the ORR was synthesized by reacting pyridine-functionalized graphene with iron porphyrin [41]. The cited work points to the use of bifunctionalized rGO as building blocks in MOF synthesis and as a structural reinforcement filler that can extend and enhance the functionalities of the MOF by affecting the crystallization process of the MOF and enhancing the electrocatalytic properties of the composite. The rGO and pyridinium linker act synergistically with the iron-porphyrin catalysts to provide a facile four-electron ORR pathway with a much higher selectivity for the ORR and weaker methanol crossover effects compared with Pt catalyst. In 2015, via direct reaction between iron group metals (i.e., Fe, Co and Ni) and a carbon source, a series of transition-metal carbide nanocrystalline M3C (M: Fe, Co, Ni) encapsulated in graphitic shells supported with vertically aligned graphene nanoribbons (GNRs) was synthesized [120]. Hot-filament chemical vapor deposition and a direct reaction are advantageous in obtaining high-purity carbide nanocrystals at relatively low temperature. The M3C GNRs have superior electrocatalytic activity for the ORR, including a low Tafel slope (39, 41 and 45 mV/dec for Fe3C GNRs, Co3C GNRs and Ni3C GNRs, respectively), positive onset potential (∼0.8 V), high electron transfer number (∼4) and long-term stability (no obvious drop after testing for 20,000 s). In 2016, Jiang and coworkers [121] developed a new class of bifunctional oxygen electrocatalysts based on ultrafine transition-metal-oxide NPs, such as NiO, FeO and NiFeO, embedded in an amorphous MnO x shell, where the embedded NP core contributes to the high OER activity and the porous amorphous MnO x shell functions as an effective ORR catalyst and provides effective structural confinement of the metal-oxide NP core. The synthetic route of the core-shell structure was shown in Fig. 7 , the best performance was obtained for NiFeO@MnO x , which had a potential gap, ΔE, of 0.798 V that provided a current of 3 mA/cm2 for the ORR and 5 mA/cm2 for the OER in 0.1 mol/L KOH solution, better than gaps for Ir/C (0.924 V) and Pt/C (1.031 V). Most importantly, NiFeO@MnO x has superior stability owing to the outstanding structural confinement effect of the amorphous MnO x , achieving ΔE of 0.881 V after 300 cycles, better than the 1.093 V obtained for state-of-the-art Ir–Pt/C oxygen electrocatalysts. Templates play an important role in determining the performance of electrocatalysts for the ORR in many cases, but not always. In 2013, a facile template-free coprecipitation route was designed for the fabrication of well-ordered NiCo2O4 spinel nanowire arrays [122]. The as-prepared NiCo2O4 spinel nanowire arrays have been characterized by X-ray diffraction (XRD), SEM, TEM, BET, and X-ray photoelectron spectroscopy (XPS) analyses. BET results show that NiCo2O4 spinel nanowire arrays have a mesoporous (ca. 8 nm) structure and a high specific surface area of 124 m2/g. The catalytic activity of NiCo2O4 spinel nanowire arrays for the ORR in 0.1 mol/L KOH solution has been studied using an RRDE. RRDE results show that the NiCo2O4 spinel nanowire array catalyst has excellent catalytic activity for the ORR. The ORR mainly favours a direct four-electron pathway, which is close to the behaviour of the Pt/C (20 wt% Pt on carbon) electrocatalyst under the same test conditions. Chronoamperometric and cyclic voltammogram tests show that the NiCo2O4 spinel nanowire array catalyst has excellent stability and reversibility for the ORR. Recent experimental and theoretical studies on graphene doping revealed the possibility of making p- and n-type semiconductors by substituting C atoms with heteroatoms (e.g., B, N, F, P and S) [123–127]. As shown in Fig. 8 , the doped heteroatoms can modify the electronic band structure of graphene and consequently tune the mechanical properties and electrocatalytic activity. In 2011, Liang and coworkers [76] reported a hybrid material consisting of Co3O4 nanocrystals grown on rGO as a high-performance bifunctional catalyst for the ORR. As suggested in Fig. 9 , although Co3O4 or graphene oxide alone has little catalytic activity, their hybrid has surprisingly high ORR activity that is further enhanced by the nitrogen doping of graphene. A more-positive ORR peak potential and a higher peak current are observed for the Co3O4=N-doped graphene hybrid, which has catalytic activity similar to that of freshly loaded Pt/C catalyst in terms of current density in KOH (1–6 mol/L) electrolyte solutions. The observations are in good agreement with calculation results indicating that the ORR catalysed by NG–Co3O4 is a four-electron process. The hybrid also has superior durability relative to Pt/C catalyst in 0.1–6-mol/L KOH, with little decay in ORR activity over 25,000 s of continuous operation while the Pt/C catalyst exhibited a 20%–48% decrease in activity. Moreover, the same hybrid is highly active for the OER, meaning it is a high-performance non-precious-metal-based bicatalyst for the ORR and OER. The unusual catalytic activity arises from synergetic chemical coupling effects between Co3O4 and graphene. In 2012, a cost-effective synthesis of NG was developed using cyanamide as a nitrogen source and graphene oxide as a precursor, which led to high and controllable nitrogen contents (4.0% to 12.0%) after pyrolysis [128]. NG thermally treated at 900 °C has a stable methanol crossover effect, high current density (6.67 mA/cm2) and high durability (∼87% after 10,000 cycles) when catalysing the ORR in alkaline solution. Furthermore, Fe NPs can be incorporated into NG with the aid of Fe(III) chloride in the synthetic process. This allows one to examine the effect of non-noble metals on the electrocatalytic performance. Remarkably, NG supported with 5 wt% Fe NPs has an excellent methanol crossover effect and high current density (8.20 mA/cm2) in an alkaline solution. Moreover, Fe-incorporated NG has an almost-four-electron transfer process and superior stability in both alkaline (∼94%) and acidic (∼85%) solutions, thus outperforming Pt- and NG-based catalysts. Although electrocatalysts supported by graphene have been shown to work in fuel cells with reasonable performance, they unfortunately also have intrinsic drawbacks; e.g., carbon supports are not stable enough for these practical catalysts in a fuel cell, which hinders commercialization [68,129]. Carbon corrosion at high electrode potentials or high temperature in the presence of oxygen has been identified to be the major contributor to catalyst failure. In fact, as shown by Eq. (10), carbon corrosion is thermodynamically possible above 0.207 V versus the standard hydrogen electrode [130], which results in the separation of the metal-containing active site from the carbon support and consequent performance loss and thus the low durability of fuel cells. There is thus great interest in exploring stable alternatives as a replacement of carbon materials for the catalyst support. (10) C + 2 H 2 O = CO 2 + 4 H + + 4 e - E ° = 0.207 V Besides graphene, an increasing number of two-dimensional nanomaterials have attracted tremendous attention in recent years. Among these two-dimensional materials, transition-metal dichalcogenides (TMDs) with a layered structure similar to that of graphite are a focus of research [131]. Most layered TMDs have the composition MX2 (M = transition metal; X = chalcogen, S, Se, Te). Because of the low electrical conductivity and low surface-to-volume ratio of the bulk form, extensive efforts have been made to enhance the ORR performance by surface modification, doping and forming highly dispersed NPs [86]. Additionally, recent interest has been directed towards two-dimensional MoS2 in which highly defected sheets afford great catalytic activity owing to the larger number of exposed edges [132]. In 2016, Chua et. al. [131] investigated the effect of doping with p-dopants Nb and Ta on bulk TMDs (MoS2 and WS2) and its effect on the ORR. All the materials were found to be more catalytic with a more positive onset potential in comparison with bare GC (glassy carbon). The WS2 group of materials appears to underperform in comparison with the MoS2 group of materials in terms of catalytic efficiencies for the ORR, with the undoped MoS2 having the most positive onset potential for the ORR (0.78 V versus RHE). Unfortunately, doping with Ta or Nb does not obviously enhance the catalysis of the TMD for the ORR [131]. However, other works obtained positive results; a series of sandwich-like conjugated nanosheets was successfully developed using 4-iodophenyl-functionalized MoS2 as a template [133]. Following direct pyrolysis, two-dimensional MoS2/nitrogen-doped porous carbon (M–CMP–T) hybrids were obtained with large specific surface areas and hierarchical porous structures. In these hybrids, both sides of the single-layer MoS2 nanosheets are uniformly decorated with nitrogen-doped porous carbon layers for good interfacial contact. M–CMP–T hybrids have been used for the electrochemical catalysed ORR with high activity and selectivity and for the construction of excellently performing supercapacitors. As shown in Fig. 10 , the electron transfer number per oxygen molecule (n) for the ORR was calculated from the LSV curves at different rotation rates (400–1600 r/min) and potentials (–0.4 to −0.9 V) using the K-L equation. The K-L plots show a good linearity for all potentials. These results indicate a lower energy consumption and operation voltage for M–CMP–T hybrids in comparison with corresponding MoS2-free counterparts. 6 ORR electrocatalysts based on other porous carbon structures Porous materials can provide large catalytic surface areas and facilitate electron transfer near the electrode surface. While two-dimensional electrocatalysts are a hot spot of research in the field of ORR electrocatalysis as mentioned in the last section, the two-dimensional materials tend to agglomeration on the electrode surface owing to strong π–π stacking and van der Waals interactions, thus reducing the surface area of the electrode, hindering electrolyte diffusion, slowing the electrochemical reaction rate and consequently limiting practical application in energy devices [134]. Porous materials have the potential to circumvent this limitation [135]. The three-dimensional porous morphology of carbon-based materials is promising in terms of raising the ORR performance via enhanced mass transfer and electron transfer reactions. Three-dimensional nanoarchitectures provide a high BET surface area and abundant active sites that are vital for good electrocatalytic performance, further accelerating ORR reaction kinetics [136]. Similar to the case of doping graphene, the combination of the three-dimensional porous carbon nanostructures with different active components provides opportunities to enhance ORR activity and durability. In 2014, Ye et. al. [137] reported a novel vein-leaf-type three-dimensional structure CNF@NG composed of carbon nanofibers and NG linked by carbon–carbon bonds as shown in Fig. 11 . CNF@NG has current density of 5.0 mA/cm2 at 0.4 V vs. RHE, which is much higher than values for NG (2.5 mA/cm2), CNF + NG (1.4 mA/cm2) and CNF (1.2 mA/cm2). The onset potential on CNF@NG is 0.93 V vs. RHE, which is only ca. 0.1 V more negative than that on the commercial Pt/C catalyst, demonstrating the excellent electrocatalytic activity of CNF@NG. Moreover, CNF@NG has E 1/2 of 0.80 V vs. RHE, making it one of the most active metal-free ORR catalysts. The electron transfer numbers (n) are calculated based on Koutecky-Levich (K-L) plots as being between 3.6 and 4.0 over the potential range of 0.2 to 0.7 V vs RHE, indicating a more efficient 4e−-dominated ORR process, with a performance approaching that of Pt/C catalysts. As shown in Fig. 11, such an interconnected three-dimensional network facilitates both the electron transfer and mass diffusion for electrochemical reactions. Besides this, transition-metal (especially Fe or Co)–nitrogen–carbon containing materials have been recognized as another promising class of porous carbon-based electrocatalysts for the ORR because of their high ORR activity in both alkaline and acidic electrolytes. In 2015, Lin and coworkers [138] reported the design and synthesis of a new family of non-precious metal catalysts termed heterometalloporphyrins. Two types of porphyrinic monomers are first made via porphyrin synthesis, which is followed by metallization with Fe or Co. Subsequent carbonization is performed to convert the porous and robust polymers into heterometalloporphyrinic carbons. During cyclic voltammetry measurements in 0.1 mol/L KOH solution, the Co-incorporated and Fe-incorporated samples have highly positive ORR potentials of 0.83 and 0.86 V versus RHE, respectively. Porous carbon-based materials can be derived from biomass that is readily available to provide inexpensive and renewable carbon precursors. Several successful demonstrations have shown how to synthesize unique porous carbon nanomaterials from natural biomass [110,127,139,140]. With high specific surface area, large pore volume and good conductivity, these biomass-derived functional nanomaterials have great potential for electrochemical applications. In 2014, Chen et. al. [141] reported novel nitrogen-doped nanoporous carbon nanosheets derived from a conveniently available plant, Typha orientalis. As shown in Fig. 12 , the preparation of the sample involves a facile hydrothermal process at low temperature followed by annealing in a NH3 atmosphere. Among all products, N-doped nanoporous carbon nanosheets NCS-850 has the highest surface area of 898 m2/g and the largest total pore volume of 0.52 cm3/g according to XPS characterization. The XRD patterns indicate the amorphous nature of carbon in the products. Rotating-disk-electrode and RRDE measurements were made to investigate the ORR activities. The NCS electrode reveals a four-electron pathway for the ORR with high current, with NCS-800 having the highest onset potential and reduction current. The durability of the catalysts was examined as shown Fig. 12 according to the current-time (i–t) chronoamperometric response of the NCS-800 and Pt/C electrodes at 0.10 V (vs. RHE) in O2-saturated 0.1 mol/L KOH at a rotation rate of 800 r/min. After 10,000 s, the commercial Pt/C suffered a 23.3% decrease in current density, while NCS-800 had a 16.0% loss in current density. In 2014, Pan et al. [142] demonstrated another successful example of metal-free nitrogen-doped porous carbon nanosheets derived from biomass. Dead ginkgo leaves were used as precursors and annealed in a tube furnace at 1100 °C for 5 h under Ar flow to produce a carbonized sample with a high surface area of 1436.02 m2/g. The net peak current density reached about 3.26 mA/cm2, which is higher than that without NH3 post-treatment. Furthermore, the value of E 1/2 is close to that at the Pt/C electrode (–0.154 V vs. −0.135 V, ΔE 1/2 = 19 mV). 7 Conclusions and future perspectives This review recounted recent advances in the development of non-Pt electrocatalysts covering a broad spectrum of material selections ranging from molecular materials to metal oxides to metallic nanomaterials to novel two-dimensional materials. For molecular electrocatalysts, the M–N–C active centre plays a crucial role in governing the catalytic performances towards the ORR, which has been shown to be affected by the synthesis method and choices of metal precursors, ligand structure and carbon support. Studies also indicate that pyrolysis improves both the activity and stability of transition-metal macrocycle-based electrocatalysts. However, this technique is disruptive and has poor repeatability towards controlling active sites, while the underlying mechanisms are also poorly understood. Transition metal oxides, particularly group-IV and -V metal oxides, represent another class of promising alternative of Pt-based catalysts for the ORR. Their catalytic activity largely depends on the surface structure and the introduction of surface defects constitutes a dominant strategy for the enhanced ORR catalytic activities in both acidic and alkaline solutions. However, there are issues of low electrical conductivity and a lack of adsorption sites for oxygen species on the metal oxide surfaces, which results in extremely low ORR activity for the bulk form. Recent advances have demonstrated solutions involving surface modification, doping, alloying and forming highly dispersed NPs. Important advances in the wet-chemistry synthesis of metallic NPs allow for precise control over particle sizes and shapes and the crystalline facets exposed. This has led to better understanding of designer metallic nanocatalysts. Some optimized systems outperform commercial Pt/C catalysts albeit the long-term stability in a real-world environment has yet to be validated. It is noted that two-dimensional materials are emerging as novel electrocatalysts for the ORR. In particular, functionalized transition-metal dichalcogenides (e.g., MoS2) have outstanding catalytic performances. Another aspect for a practical ORR catalyst is the supporting material, which affects the electrocatalysis performance. Until now, the most commonly used supporting substrates for the ORR have been carbon-based materials that suffer from corrosion. Proton exchange membrane fuel cells (PEMFCs) are electrochemical devices that can efficiently convert chemical energy directly into electrical energy. In a typical practical PEMFC, the membrane electrode assembly contains the anode and cathode, both of which conduct electrons, and reactants; e.g., protons in acidic conditions and hydroxide ions in alkaline conditions. At the anode, the fuel (typically H2) is oxidized to form protons and electrons. At the cathode, oxygen is reduced to form H2O. Because the ORR is ∼5 times slower than the hydrogen evolution reaction (HER), the ORR electrocatalysts inside the cathode catalyst layers are considered to be the most critical components for fuel cell performance [59]. Currently, the state-of-the-art and most practical electrocatalysts for PEMFCs are still carbon-supported Pt catalysts [27]. Although most examples reviewed here concern results obtained without realistic devices, several demonstrations in recent decades have shown volumetric activity and stability comparable to that of the commercial Pt/C [76,81,118,121,143]. Although the novel catalysts discussed here have still not reached the commercialization stage, recent rapid progress suggests their potential use in the near future. In particular, improvement in the rational design and synthesis of various nanostructured ORR catalysts with controllable size, shape, composition, and surface morphology has provided important insights into the nature of the catalytic activity and stability. Scalable synthesis and real-world evaluation may be the focus in the next stage of development. References 1 M. Winter R.J. Brodd Chem. Rev. 104 2004 4245 4270 2 L.M. Dai Y.H. Xue L.T. Qu H.J. Choi J.B. Baek Chem. Rev. 115 2015 4823 4892 3 M.H. Shao Q.W. Chang J.P. Dodelet R. Chenitz Chem. Rev. 116 2016 3594 3657 4 L.J. Yang Y. Zhao S. Chen Q. Wu X.Z. Wang Z. Hu Chin. J. Catal. 34 2013 1986 1991 5 H.A. Gasteiger N.M. Markovic Science 324 2009 48 49 6 M.A. Thorseth C.E. Tornow E.C.M. Tse A.A. Gewirth Coord. Chem. Rev. 257 2013 130 139 7 A.A. Gewirth M.S. Thorum Inorg. Chem. 49 2010 3557 3566 8 R. Borup J. Meyers B. Pivovar Y.S. Kim R. Mukundan N. Garland D. Myers M. Wilson F. Garzon D. Wood P. Zelenay K. More K. Stroh T. Zawodzinski J. Boncella J.E. McGrath M. Inaba K. Miyatake M. Hori K. Ota Z. Ogumi S. Miyata A. Nishikata Z. Siroma Y. Uchimoto K. Yasuda K. Kimijima N. Iwashita Chem. Rev. 107 2007 3904 3951 9 J. Liu E.L. Li M.B. Ruan P. Song W.L. Xu Catalysts 5 2015 1167 1192 10 C. Sealy Mater. Today 11 2008 65 68 11 K.P. Gong F. Du Z.H. Xia M. Durstock L.M. Dai Science 323 2009 760 764 12 Y.J. Wang N.N. Zhao B.Z. Fang H. Li X.T. Bi H.J. Wang Chem. Rev. 115 2015 3433 3467 13 R.J. Jasinski Nature 201 1964 1212 1213 14 V.R. Stamenkovic B.S. Mun M. Arenz K.J.J. Mayrhofer C.A. Lucas G.F. Wang P.N. Ross N.M. Markovic Nat. Mater. 6 2007 241 247 15 S.J. Jiang Y.W. Ma G.Q. Jian H.S. Tao X.Z. Wang Y.N. Fan Y.N. Lu Z. Hu Y. Chen Adv. Mater. 21 2009 4953 4956 16 D.L. Wang H.L. Xin R. Hovden H.S. Wang Y.C. Yu D.A. Muller F.J. Di Salvo H.D. Abruna Nat. Mater. 12 2012 81 87 17 F. Jaouen E. Proietti M. Lefevre R. Chenitz J.P. Dodelet G. Wu H.T. Chung C.M. Johnston P. Zelenay Energy Environ. Sci. 4 2011 114 130 18 Z.W. Chen D. Higgins A.P. Yu L. Zhang J.J. Zhang Energy Environ. Sci. 4 2011 3167 3192 19 G. Wu K.L. More C.M. Johnston P. Zelenay Science 332 2011 443 447 20 Y.H. Bing H.S. Liu L. Zhang D. Ghosh J.J. Zhang Chem. Soc. Rev. 39 2010 2184 2202 21 S.J. Guo S. Zhang S.H. Sun Angew. Chem. Int. Ed. 52 2013 8526 8544 22 C. Du X.H. Gao W. Chen Chin. J. Catal. 37 2016 1049 1061 23 Y. Tang W.L. Cheng Sci. Adv. Mater. 4 2012 784 797 24 Y. Tang K.C. Ng Y. Chen W.L. Cheng Electrochem. Commun. 27 2013 120 123 25 Y. Tang W.L. Cheng Langmuir 29 2013 3125 3132 26 L.H. Jiang Q.W. Tang J. Liu G.Q. Sun Chin. J. Catal. 36 2015 175 180 27 X.J. Zhou J.L. Qiao L. Yang J.J. Zhang Adv. Energy Mater. 4 2014 1301523 28 X.H. Xie S.G. Chen W. Ding Y. Nie Z.D. Wei Chem. Commun. 49 2013 10112 10114 29 Q. Jin L.K. Pei Y.X. Hu J. Du X.P. Han F.Y. Cheng J. Chen Acta Chim. Sinica 72 2014 920 926 30 Y.L. Chen L. Song H. Guo H.R. Xue T. Wang P. He J.P. He Chinese J. Inorg. Chem. 32 4 2016 633 640 31 N. Ramaswamy U. Tylus Q. Jia S. Mukerjee J. Am. Chem. Soc. 135 2013 15443 15449 32 C.W.B. Bezerra L. Zhang K. Lee H.S. Liu J.L. Zhang Z. Shi A.L.B. Marques E.P. Marques S.H. Wu J.J. Zhang Electrochim. Acta 53 2008 7703 7710 33 J.T. Wang S. Li G.W. Zhu W. Zhao R.X. Chen M. Pan J. Power Sources 240 2013 381 389 34 C.W.B. Bezerra L. Zhang K. Lee H.S. Liu A.L.B. Marques E.P. Marques H.J. Wang J.J. Zhang J. Electrochim. Acta 53 2008 4937 4951 35 J. Wu W.M. Li D. Higgins Z.W. Chen J. Phys. Chem. C 115 2011 18856 18862 36 H.J. Zhang X.X. Yuan L.L. Sun X. Zeng Q.Z. Jiang Z.P. Shao Z.F. Ma Int. J. Hydrogen Energy 35 2010 2900 2903 37 E.H. Yu S.A. Cheng B.E. Logan K. Scott J. Appl. Electrochem. 39 2009 705 711 38 L. Birry P. Mehta F. Jaouen J.P. Dodelet S.R. Guiot B. Tartakovsky Electrochim. Acta 56 2011 1505 1511 39 S. Baranton C. Coutanceau C. Roux F. Hahn J.M. Leger J. Electroanal. Chem. 577 2005 223 234 40 Y. Feng A.V. Nicolas Phys. Status Sol. B 245 2008 1792 1806 41 M. Jahan Q.L. Bao K.P. Loh J. Am. Chem. Soc. 134 2012 6707 6713 42 K. Wiesener D. Ohms V. Neumann R. Franke Mater. Chem. Phys. 22 1989 457 43 C.J. Chang Z.H. Loh C.N. Shi F.C. Anson D.G. Nocera J. Am. Chem. Soc. 126 2004 10013 10020 44 S. Fukuzumi K. Okamoto C.P. Gros R. Guilard J. Am. Chem. Soc. 126 2004 10441 10449 45 H.A. Gasteiger S.S. Kocha B. Sompalli F.T. Wagner Appl. Catal. B Environ. 56 2005 9 35 46 M. Lefevre E. Proietti F. Jaouen J.P. Dodelet Science 324 2009 71 74 47 H.T. Chung C.M. Johnston K. Artyushkova M. Ferrandon D.J. Myers P. Zelenay Electrochem. Commun. 12 2010 1792 1795 48 J.K. Dombrovskis A.E.C. Palmqvist Fuel Cells 16 2016 4 22 49 U.I. Kramm I. Abs-Wurmbach I. Herrmann-Geppert J. Radnik S. Fiechter P. Bogdanoff J. Electrochem. Soc. 158 2011 B69 B78 50 L. Zhang J. Kim E. Dy S. Ban K.C. Tsay H. Kawai Z. Shi J.J. Zhang Electrochim. Acta 108 2013 814 819 51 R.G. Cao R. Thapa H. Kim X.D. Xu M.G. Kim Q. Li N. Park M.L. Liu J. Cho Nat. Commun. 4 2013 2076 52 I. Hijazi T. Bourgeteau R. Cornut A. Morozan A. Filoramo J. Leroy V. Derycke B. Jousselme S. Campidelli J. Am. Chem. Soc. 136 2014 6348 6354 53 W.J. Ma P. Yu T. Ohsaka L.Q. Mao Electrochem. Commun. 52 2015 53 57 54 G.L. Lu H.S. Yang Y.L. Zhu T. Huggins Z.J. Ren Z.N. Liu W. Zhang J. Mater. Chem. A 3 2015 4954 4959 55 Y.S. Zhu B.S. Zhang X. Liu D.W. Wang D.S. Su Angew. Chem. Int. Ed. 53 2014 10673 10677 56 J.T. Wang S. Li G.W. Zhu W. Zhao R.X. Chen M. Pan J. Power Sources 240 2013 381 389 57 C.C. Ren H.B. Li R. Li S.L. Xu D.H. Wei W.J. Kang L. Wang L.P. Jia B.C. Yang J.F. Liu RSC Adv. 6 2016 33302 33307 58 N. Larouche R. Chenitz M. Lefevre E. Proietti J.P. Dodelet Electrochim. Acta 115 2014 170 182 59 D. Banham S. Ye K. Pei J.I. Ozaki T. Kishimoto Y. Imashiro J. Power Sources 285 2015 334 348 60 G. Faubert G. Lalande R. Cote D. Guay J.P. Dodelet L.T. Weng P. Bertrand G. Denes Electrochim. Acta 41 1996 1689 1701 61 S. Fiechter Fuel Cells: Selected Entries from the Encyclopedia of Sustainability Science and Technology K.D. Kreuer 2013 Springer Berlin 62 X.H. Li K. Wan Q.B. Liu J.H. Piao Y.Y. Zheng Z.X. Liang Chin. J. Catal. 37 2016 1562 1568 63 T.T. Zhang C.S. He L.B. Li Y.Q. Lin Chin. J. Catal. 37 2016 1275 1282 64 Y.Z. Bai B.L. Yi J. Li S.F. Jiang H.J. Zhang Z.G. Shao Y.J. Song Chin. J. Catal. 37 2016 1127 1133 65 R. Baker D.P. Wilkinson J.J. Zhang Electrochim. Acta 53 2008 6906 6919 66 H.J. Tang H.J. Yin J.Y. Wang N.L. Yang D. Wang Z.Y. Tang Angew. Chem. Int. Ed. 52 2013 5585 5589 67 R.L. Liu C. von Malotki L. Arnold N. Koshino H. Higashimura M. Baumgarten K. Mullen J. Am. Chem. Soc. 133 2011 10372 10375 68 Y. Nie L. Li Z.D. Wei Chem. Soc. Rev. 44 2015 2168 2201 69 M. Sun H.J. Liu Y. Liu J.H. Qu J.H. Li Nanoscale 7 2015 1250 1269 70 J.A. Farmer C.T. Campbell Science 329 2010 933 936 71 Z.H. Zhang J. Liu J.J. Gu L. Su L.F. Cheng Energy Environ. Sci. 7 2014 2535 2558 72 F.Y. Cheng T.R. Zhang Y. Zhang J. Du X.P. Han J. Chen Angew. Chem. Int. Ed. 52 2013 2474 2477 73 Y.M. Tan C.F. Xu G.X. Chen X.L. Fang N.F. Zheng Q.J. Xie Adv. Funct. Mater. 22 2012 4584 4591 74 Y. Gorlin T. Jaramillo J. Am. Chem. Soc. 132 2010 13612 13614 75 J.S. Lee G.S. Park H.I. Lee S.T. Kim R.G. Cao M.L. Liu J. Cho Nano Lett. 11 2011 5362 5366 76 Y.Y. Liang Y.G. Li H.L. Wang J.G. Zhou J. Wang T. Regier H.J. Dai Nat. Mater. 10 2011 780 786 77 Y.Y. Liang H.L. Wang P. Diao W. Chang G.S. Hong Y.G. Li M. Gong L.M. Xie J.G. Zhou J. Wang T.Z. Regier F. Wei H.J. Dai J. Am. Chem. Soc. 134 2012 15849 15857 78 R.F. Savinell Nat. Chem. 3 2011 501 79 Y. Takasu K. Oohori N. Yoshinaga W. Sugimoto Catal. Today 146 2009 248 252 80 J. Suntivich H.A. Gasteige N. Yabuuchi H. Nakanishi J.B. Goodenough Y. Snao-Horn Nat. Chem. 3 2011 546 550 81 C. Jin X.C. Cao L.Y. Zhang C. Zhang R.Z. Yang J. Power Sources 241 2013 225 230 82 A. Ishihara M. Chisaka Y. Ohgi K. Matsuzawa S. Mitsushima K. Ota Phys. Chem. Chem. Phys. 17 2015 7643 7647 83 Y.Y. Liang H.L. Wang J.G. Zhou Y.G. Li J. Wang T. Regier H.J. Dai J. Am. Chem. Soc. 134 2012 3517 3523 84 G.Q. Zhang B.Y. Xia C. Xiao L. Yu X. Wang Y. Xie X.W. Lou Angew. Chem. Int. Ed. 52 2013 8643 8647 85 J. Seo D. Cha K. Takanabe J. Kubota K. Domen Phys. Chem. Chem. Phys. 16 2014 895 898 86 A.P. Ishihara H. Imai K.I. Ota Transition Metal Oxides, Carbides, Nitrides, Oxynitrides, and Carbonitrides for O2 Reduction Reaction Electrocatalysts for Acid PEM Fuel Cells 2014 Wiley-VCH Verlag GmbH & Co. KgaA NewYork 87 S.J. Tan M.J. Campolongo D. Luo W.L. Cheng Nat. Nanotechnol. 6 2011 268 88 K.C. Ng I.B. Udagedara I.D. Rukhlenko Y. Chen Y. Tang M. Premaratne W.L. Cheng ACS Nano 6 2012 925 934 89 K.C. Ng W.L. Cheng Nanotechnology 23 2012 105602 90 F.J. Perez-Alonso D.N. McCarthy A. Nierhoff P. Hernandez-Fernandez C. Strebel I.E.L. Stephens J.H. Nielsen I. Chorkendorff Angew. Chem. Int. Ed. 51 2012 4641 4643 91 C. Wang M.F. Chi D.G. Li D. van der Vliet G.F. Wang Q.Y. Lin J.F. Mitchell K.L. More N.M. Markovic V.R. Stamenkovic ACS Catal. 1 2011 1355 1359 92 J.B. Wu L. Qi H.J. You A. Gross J. Li H. Yang J. Am. Chem. Soc. 134 2012 11880 11883 93 C. Wang N.M. Markovic V.R. Stamenkovic ACS Catal. 2 2012 891 898 94 C. Wang H. Daimon T. Onodera T. Koda S.H. Sun Angew. Chem. Int. Ed. 47 2008 3588 3591 95 N. Tian Z.Y. Zhou S.G. Sun Y. Ding L.W. Zhong Science 316 2007 732 735 96 V.R. Stamenkovic B. Fowler B.S. Mun G.F. Wang P.N. Ross C.A. Lucas N.M. Markovic Science 315 2007 493 497 97 K. Sasaki H. Naohara Y.M. Choi Y. Cai W.F. Chen P. Liu R.R. Adzic Nat. Commun. 3 2012 1115 98 I.E.L. Stephens A.S. Bondarenko L. Bech I. Chorkendorff ChemCatChem 4 2012 341 346 99 S.F. Xie S.I. Choi N. Lu L.T. Roling J.A. Herron L. Zhang J. Park J.G. Wang M.J. Kim Z.X. Xie M. Mavrikakis Y.N. Xia Nano Lett. 14 2014 3570 3576 100 B. Genorio R. Subbaraman D. Strmcnik D. Tripkovic V.R. Stamenkovic N.M. Markovic Angew. Chem. Int. Ed. 50 2011 5468 5472 101 J. Snyder K. Livi J. Erlebacher Adv. Funct. Mater. 23 2013 5494 5501 102 X.G. Hu W.L. Cheng T. Wang E.K. Wang S.J. Dong Nanotechnology 16 2005 2164 103 W.L. Cheng S.J. Dong E.K. Wang J. Phys. Chem. B 109 2005 19213 19218 104 W.L. Cheng X.J. Han E. Wang S.J. Dong Electroanalysis 16 2004 127 131 105 H. Ataee-Esfahani L. Wang Y. Yamauchi Chem. Commun. 46 2010 3684 3686 106 W.L. Cheng S.J. Dong E. Wang Chem. Mater. 15 2003 2495 2501 107 W.L. Cheng S.J. Dong E.K. Wang Angew. Chem. Int. Ed. 42 2003 449 452 108 S.J. Guo X. Zhang W.L. Zhu K. He D. Su A. Mendoza-Garcia S.F. Ho G. Lu S.H. Sun J. Am. Chem. Soc. 136 2014 15026 15033 109 A. Serov M.H. Robson B. Halevi K. Artyushkova P. Atanassov Electrochem. Commun. 22 2012 53 56 110 C.Z. Zhu H. Li S.F. Fu D. Du Y.H. Lin Chem. Soc. Rev. 45 2016 517 531 111 H.W. Liang W. Wei Z.S. Wu X.L. Feng K. Muellen J. Am. Chem. Soc. 135 2013 16002 16005 112 A.G. Kong X.F. Zhu Z. Han Y.Y. Yu Y.B. Zhang B. Dong Y.K. Shan ACS Catal. 4 2014 1793 1800 113 Z. Yang Z. Yao G.F. Li G.Y. Fang H.G. Nie Z. Liu X.M. Zhou X.A. Chen S.M. Huang ACS Nano 6 2012 205 211 114 S.Y. Wang L.P. Zhang Z.H. Xia A. Roy D.W. Chang J.B. Baek L.M. Dai Angew. Chem. Int. Ed. 51 2012 4209 4212 115 J. Chen K. Takanabe R. Ohnishi D.L. Lu S. Okada H. Hatasawa H. Morioka M. Antonietti J. Kubotaa K. Domen Chem. Commun. 46 2010 7492 7494 116 Q. Li P. Xu W. Gao S.G. Ma G.Q. Zhang R.G. Cao J. Cho H.L. Wang G. Wu Adv. Mater. 26 2014 1378 1386 117 H. Yin C.Z. Zhang F. Liu Y.L. Hou Adv. Funct. Mater. 24 2014 2930 2937 118 J.S. Meng C.J. Niu X. Liu Z.A. Liu H.L. Chen X.P. Wang J.T. Li W. Chen X.F. Guo L.Q. Mai Nano Res. 9 2016 2445 2457 119 K.S. Novoselov A.K. Geim S.V. Morozov D. Jiang Y. Zhang S.V. Dubonos I.V. Grigorieva A.A. Firsov Science 306 2004 666 669 120 X.J. Fan Z.W. Peng R.Q. Ye H.Q. Zhou X. Guo ACS Nano 9 2015 7407 7418 121 Y. Cheng S. Dou M. Saunders J. Zhang J. Pan S.Y. Wang S.P. Jiang J. Mater. Chem. A 4 2016 13881 13889 122 C. Jin F.L. Lu X.C. Cao Z.R. Yang R.Z. Yang J. Mater. Chem. A 1 2013 12170 12177 123 L. Ci L. Song C.H. Jin D. Jariwala D.X. Wu Y.J. Li A. Srivastava Z.F. Wang K. Storr L. Balicas F. Liu P.M. Ajayan Nat. Mater. 9 2010 430 124 L.P. Zhang Z.H. Xia J. Phys. Chem. C 115 2011 11170 11176 125 I. Lee J.B. Joo M. Shokouhimehr Chin. J. Catal. 36 2015 1799 1810 126 Z.W. Wang B. Li Y.C. Xin J.G. Liu Y.F. Yao Z.G. Zou Chin. J. Catal. 35 2014 509 513 127 J. Liu P. Song M.B. Ruan W.L. Xu Chin. J. Catal. 37 2016 1119 1126 128 K. Parvez S.B. Yang Y. Hernandez A. Winter A. Turchanin X.L. Feng K. Mullen ACS Nano 2012 9541 9550 129 Y.J. Wang D.P. Wilkinson J.J. Zhang Chem. Rev. 111 2011 7625 7651 130 J.P. Meyers R.M. Darling J. Electrochem. Soc. 153 2006 A1432 A1442 131 X.J. Chua J. Luxa A.Y.S. Eng S.M. Tan Z. Sofer M. Pumera ACS Catal. 6 2016 5724 5734 132 S.J. Rowley-Neale J.M. Fearn D.A.C. Brownson G.C. Smith X.B. Ji C.E. Banks Nanoscale 8 2016 14767 14777 133 K. Yuan X.D. Zhuang H.Y. Fu G. Brunklaus M. Forster Y.W. Chen X.L. Feng U. Scherf Angew. Chem. Int. Ed. 55 2016 6858 6863 134 X. Ji X. Zhang X.W. Zhang J. Nanomater. 2015 1 9 135 X.J. Zhou Z.Y. Bai M.J. Wu J.L. Qiao Z.W. Chen J. Mater. Chem. A 3 2015 3343 3350 136 C.Z. Zhu H. Li S.F. Fu D. Du Y.H. Lin Chem. Soc. Rev. 45 2016 517 531 137 T.N. Ye L.B. Lv X.H. Li M. Xu J.S. Chen Angew. Chem. Int. Ed. 53 2014 6905 6909 138 Q.P. Lin A.G. Kong C.Y. Mao F. Bu P.Y. Feng X.H. Bu Adv. Mater. 27 2015 3431 3436 139 M.M. Titirici R.J. White C. Falco M. Sevilla Energy Environ. Sci. 5 2012 6796 6822 140 B. Hu K. Wang L.H. Wu S.H. Yu M. Antonietti M.M. Titirici Adv. Mater. 22 2010 813 828 141 P. Chen L.K. Wang G. Wang M.R. Gao J. Ge W.J. Yuan Y.H. Shen A.J. Xie S.H. Yu Energy Environ. Sci. 7 2014 4095 4103 142 F.P. Pan Z.Y. Cao Q.P. Zhao H.Y. Liang J.Y. Zhang J. Power Sources 272 2014 8 15 143 J.B. Xu P. Gao T.S. Zhao Energy Environ. Sci. 5 2012 5333 5339",
      "scopus-id": "85020912433",
      "coredata": {
        "eid": "1-s2.0-S1872206717628018",
        "dc:description": "The quest for low-cost yet efficient non-Pt electrocatalysts for the oxygen reduction reaction (ORR) has become one of the main focuses of research in the field of catalysis, which has implications for the development of the next generation of greener fuel cells. Here, we comprehensively describe the ‘big picture’ of recent advances made in the rational design of ORR electrocatalysts, including molecule-based, metal-oxide-based, metal-nanomaterial-based and two-dimensional electrocatalysts. Transition metals can fabricate molecular electrocatalysts with N4-macrocycles such as porphyrin-class compounds and the so-formed M–N–C active centre plays a crucial role in determining the catalytic performances towards the ORR. Group-IV and -V Transition metal oxides represent another class of promising alternative of Pt-based catalysts for the ORR which catalytic activity largely depends on the surface structure and the introduction of surface defects. Recent advances in synthesis of metallic nanoparticles (NPs) allow for precise control over particle sizes and shapes and the crystalline facets exposed to enhance the ORR performance of electrocatalysts. Two-dimensional materials such as functionalized grapheme or MoS2 are emerging as novel electrocatalysts for the ORR. This review covers various aspects towards the design of future ORR electrocatalysts, including the catalytic performance, stability, durability and cost. Some novel electrocatalysts even surpass commercial Pt/C systems, demonstrating their potential to be alternatives in industrial applications. Despite the encouraging progress, challenges, which are also described, remain to be overcome before the real-world application of novel ORR electrocatalysts.",
        "openArchiveArticle": "false",
        "prism:coverDate": "2017-06-30",
        "openaccessUserLicense": null,
        "prism:aggregationType": "Journal",
        "prism:url": "https://api.elsevier.com/content/article/pii/S1872206717628018",
        "dc:creator": [
          {
            "@_fa": "true",
            "$": "Kong, Jianfei"
          },
          {
            "@_fa": "true",
            "$": "Cheng, Wenlong"
          }
        ],
        "link": [
          {
            "@_fa": "true",
            "@rel": "self",
            "@href": "https://api.elsevier.com/content/article/pii/S1872206717628018"
          },
          {
            "@_fa": "true",
            "@rel": "scidir",
            "@href": "https://www.sciencedirect.com/science/article/pii/S1872206717628018"
          }
        ],
        "dc:format": "application/json",
        "openaccessType": null,
        "pii": "S1872-2067(17)62801-8",
        "prism:volume": "38",
        "prism:publisher": "Dalian Institute of Chemical Physics, the Chinese Academy of Sciences. Published by Elsevier B.V.",
        "dc:title": "Recent advances in the rational design of electrocatalysts towards the oxygen reduction reaction",
        "prism:copyright": "Copyright © 2017 Dalian Institute of Chemical Physics, the Chinese Academy of Sciences. Published by Elsevier B.V. All rights reserved.",
        "openaccess": "0",
        "prism:issn": "18722067",
        "prism:issueIdentifier": "6",
        "dcterms:subject": [
          {
            "@_fa": "true",
            "$": "Oxygen reduction reaction"
          },
          {
            "@_fa": "true",
            "$": "Electrocatalyst"
          },
          {
            "@_fa": "true",
            "$": "Nanomaterial"
          },
          {
            "@_fa": "true",
            "$": "Molecular electrocatalyt"
          },
          {
            "@_fa": "true",
            "$": "Two-dimensional material"
          }
        ],
        "openaccessArticle": "false",
        "prism:publicationName": "Chinese Journal of Catalysis",
        "prism:number": "6",
        "openaccessSponsorType": null,
        "prism:pageRange": "951-969",
        "prism:endingPage": "969",
        "pubType": "rev",
        "prism:coverDisplayDate": "June 2017",
        "prism:doi": "10.1016/S1872-2067(17)62801-8",
        "prism:startingPage": "951",
        "dc:identifier": "doi:10.1016/S1872-2067(17)62801-8",
        "openaccessSponsorName": null
      },
      "objects": {
        "object": [
          {
            "@category": "thumbnail",
            "@height": "164",
            "@width": "201",
            "@_fa": "true",
            "$": "https://api.elsevier.com/content/object/eid/1-s2.0-S1872206717628018-fx1.sml?httpAccept=%2A%2F%2A",
            "@multimediatype": "GIF image file",
            "@type": "IMAGE-THUMBNAIL",
            "@size": "25306",
            "@ref": "fx1",
            "@mimetype": "image/gif"
          },
          {
            "@category": "thumbnail",
            "@height": "164",
            "@width": "188",
            "@_fa": "true",
            "$": "https://api.elsevier.com/content/object/eid/1-s2.0-S1872206717628018-gr1.sml?httpAccept=%2A%2F%2A",
            "@multimediatype": "GIF image file",
            "@type": "IMAGE-THUMBNAIL",
            "@size": "11998",
            "@ref": "gr1",
            "@mimetype": "image/gif"
          },
          {
            "@category": "thumbnail",
            "@height": "116",
            "@width": "219",
            "@_fa": "true",
            "$": "https://api.elsevier.com/content/object/eid/1-s2.0-S1872206717628018-gr10.sml?httpAccept=%2A%2F%2A",
            "@multimediatype": "GIF image file",
            "@type": "IMAGE-THUMBNAIL",
            "@size": "19597",
            "@ref": "gr10",
            "@mimetype": "image/gif"
          },
          {
            "@category": "thumbnail",
            "@height": "114",
            "@width": "219",
            "@_fa": "true",
            "$": "https://api.elsevier.com/content/object/eid/1-s2.0-S1872206717628018-gr11.sml?httpAccept=%2A%2F%2A",
            "@multimediatype": "GIF image file",
            "@type": "IMAGE-THUMBNAIL",
            "@size": "22534",
            "@ref": "gr11",
            "@mimetype": "image/gif"
          },
          {
            "@category": "thumbnail",
            "@height": "137",
            "@width": "219",
            "@_fa": "true",
            "$": "https://api.elsevier.com/content/object/eid/1-s2.0-S1872206717628018-gr12.sml?httpAccept=%2A%2F%2A",
            "@multimediatype": "GIF image file",
            "@type": "IMAGE-THUMBNAIL",
            "@size": "23766",
            "@ref": "gr12",
            "@mimetype": "image/gif"
          },
          {
            "@category": "thumbnail",
            "@height": "128",
            "@width": "219",
            "@_fa": "true",
            "$": "https://api.elsevier.com/content/object/eid/1-s2.0-S1872206717628018-gr2.sml?httpAccept=%2A%2F%2A",
            "@multimediatype": "GIF image file",
            "@type": "IMAGE-THUMBNAIL",
            "@size": "16723",
            "@ref": "gr2",
            "@mimetype": "image/gif"
          },
          {
            "@category": "thumbnail",
            "@height": "127",
            "@width": "219",
            "@_fa": "true",
            "$": "https://api.elsevier.com/content/object/eid/1-s2.0-S1872206717628018-gr3.sml?httpAccept=%2A%2F%2A",
            "@multimediatype": "GIF image file",
            "@type": "IMAGE-THUMBNAIL",
            "@size": "20317",
            "@ref": "gr3",
            "@mimetype": "image/gif"
          },
          {
            "@category": "thumbnail",
            "@height": "131",
            "@width": "219",
            "@_fa": "true",
            "$": "https://api.elsevier.com/content/object/eid/1-s2.0-S1872206717628018-gr4.sml?httpAccept=%2A%2F%2A",
            "@multimediatype": "GIF image file",
            "@type": "IMAGE-THUMBNAIL",
            "@size": "20738",
            "@ref": "gr4",
            "@mimetype": "image/gif"
          },
          {
            "@category": "thumbnail",
            "@height": "96",
            "@width": "219",
            "@_fa": "true",
            "$": "https://api.elsevier.com/content/object/eid/1-s2.0-S1872206717628018-gr5.sml?httpAccept=%2A%2F%2A",
            "@multimediatype": "GIF image file",
            "@type": "IMAGE-THUMBNAIL",
            "@size": "16545",
            "@ref": "gr5",
            "@mimetype": "image/gif"
          },
          {
            "@category": "thumbnail",
            "@height": "79",
            "@width": "219",
            "@_fa": "true",
            "$": "https://api.elsevier.com/content/object/eid/1-s2.0-S1872206717628018-gr6.sml?httpAccept=%2A%2F%2A",
            "@multimediatype": "GIF image file",
            "@type": "IMAGE-THUMBNAIL",
            "@size": "14573",
            "@ref": "gr6",
            "@mimetype": "image/gif"
          },
          {
            "@category": "thumbnail",
            "@height": "163",
            "@width": "187",
            "@_fa": "true",
            "$": "https://api.elsevier.com/content/object/eid/1-s2.0-S1872206717628018-gr7.sml?httpAccept=%2A%2F%2A",
            "@multimediatype": "GIF image file",
            "@type": "IMAGE-THUMBNAIL",
            "@size": "27974",
            "@ref": "gr7",
            "@mimetype": "image/gif"
          },
          {
            "@category": "thumbnail",
            "@height": "80",
            "@width": "219",
            "@_fa": "true",
            "$": "https://api.elsevier.com/content/object/eid/1-s2.0-S1872206717628018-gr8.sml?httpAccept=%2A%2F%2A",
            "@multimediatype": "GIF image file",
            "@type": "IMAGE-THUMBNAIL",
            "@size": "11021",
            "@ref": "gr8",
            "@mimetype": "image/gif"
          },
          {
            "@category": "thumbnail",
            "@height": "163",
            "@width": "219",
            "@_fa": "true",
            "$": "https://api.elsevier.com/content/object/eid/1-s2.0-S1872206717628018-gr9.sml?httpAccept=%2A%2F%2A",
            "@multimediatype": "GIF image file",
            "@type": "IMAGE-THUMBNAIL",
            "@size": "23557",
            "@ref": "gr9",
            "@mimetype": "image/gif"
          },
          {
            "@category": "standard",
            "@height": "245",
            "@width": "301",
            "@_fa": "true",
            "$": "https://api.elsevier.com/content/object/eid/1-s2.0-S1872206717628018-fx1.jpg?httpAccept=%2A%2F%2A",
            "@multimediatype": "JPEG image file",
            "@type": "IMAGE-DOWNSAMPLED",
            "@size": "57370",
            "@ref": "fx1",
            "@mimetype": "image/jpeg"
          },
          {
            "@category": "standard",
            "@height": "299",
            "@width": "344",
            "@_fa": "true",
            "$": "https://api.elsevier.com/content/object/eid/1-s2.0-S1872206717628018-gr1.jpg?httpAccept=%2A%2F%2A",
            "@multimediatype": "JPEG image file",
            "@type": "IMAGE-DOWNSAMPLED",
            "@size": "39873",
            "@ref": "gr1",
            "@mimetype": "image/jpeg"
          },
          {
            "@category": "standard",
            "@height": "345",
            "@width": "653",
            "@_fa": "true",
            "$": "https://api.elsevier.com/content/object/eid/1-s2.0-S1872206717628018-gr10.jpg?httpAccept=%2A%2F%2A",
            "@multimediatype": "JPEG image file",
            "@type": "IMAGE-DOWNSAMPLED",
            "@size": "122844",
            "@ref": "gr10",
            "@mimetype": "image/jpeg"
          },
          {
            "@category": "standard",
            "@height": "353",
            "@width": "678",
            "@_fa": "true",
            "$": "https://api.elsevier.com/content/object/eid/1-s2.0-S1872206717628018-gr11.jpg?httpAccept=%2A%2F%2A",
            "@multimediatype": "JPEG image file",
            "@type": "IMAGE-DOWNSAMPLED",
            "@size": "113220",
            "@ref": "gr11",
            "@mimetype": "image/jpeg"
          },
          {
            "@category": "standard",
            "@height": "376",
            "@width": "602",
            "@_fa": "true",
            "$": "https://api.elsevier.com/content/object/eid/1-s2.0-S1872206717628018-gr12.jpg?httpAccept=%2A%2F%2A",
            "@multimediatype": "JPEG image file",
            "@type": "IMAGE-DOWNSAMPLED",
            "@size": "89046",
            "@ref": "gr12",
            "@mimetype": "image/jpeg"
          },
          {
            "@category": "standard",
            "@height": "328",
            "@width": "562",
            "@_fa": "true",
            "$": "https://api.elsevier.com/content/object/eid/1-s2.0-S1872206717628018-gr2.jpg?httpAccept=%2A%2F%2A",
            "@multimediatype": "JPEG image file",
            "@type": "IMAGE-DOWNSAMPLED",
            "@size": "71495",
            "@ref": "gr2",
            "@mimetype": "image/jpeg"
          },
          {
            "@category": "standard",
            "@height": "374",
            "@width": "647",
            "@_fa": "true",
            "$": "https://api.elsevier.com/content/object/eid/1-s2.0-S1872206717628018-gr3.jpg?httpAccept=%2A%2F%2A",
            "@multimediatype": "JPEG image file",
            "@type": "IMAGE-DOWNSAMPLED",
            "@size": "88577",
            "@ref": "gr3",
            "@mimetype": "image/jpeg"
          },
          {
            "@category": "standard",
            "@height": "371",
            "@width": "623",
            "@_fa": "true",
            "$": "https://api.elsevier.com/content/object/eid/1-s2.0-S1872206717628018-gr4.jpg?httpAccept=%2A%2F%2A",
            "@multimediatype": "JPEG image file",
            "@type": "IMAGE-DOWNSAMPLED",
            "@size": "101295",
            "@ref": "gr4",
            "@mimetype": "image/jpeg"
          },
          {
            "@category": "standard",
            "@height": "296",
            "@width": "674",
            "@_fa": "true",
            "$": "https://api.elsevier.com/content/object/eid/1-s2.0-S1872206717628018-gr5.jpg?httpAccept=%2A%2F%2A",
            "@multimediatype": "JPEG image file",
            "@type": "IMAGE-DOWNSAMPLED",
            "@size": "78989",
            "@ref": "gr5",
            "@mimetype": "image/jpeg"
          },
          {
            "@category": "standard",
            "@height": "274",
            "@width": "759",
            "@_fa": "true",
            "$": "https://api.elsevier.com/content/object/eid/1-s2.0-S1872206717628018-gr6.jpg?httpAccept=%2A%2F%2A",
            "@multimediatype": "JPEG image file",
            "@type": "IMAGE-DOWNSAMPLED",
            "@size": "85553",
            "@ref": "gr6",
            "@mimetype": "image/jpeg"
          },
          {
            "@category": "standard",
            "@height": "548",
            "@width": "627",
            "@_fa": "true",
            "$": "https://api.elsevier.com/content/object/eid/1-s2.0-S1872206717628018-gr7.jpg?httpAccept=%2A%2F%2A",
            "@multimediatype": "JPEG image file",
            "@type": "IMAGE-DOWNSAMPLED",
            "@size": "160207",
            "@ref": "gr7",
            "@mimetype": "image/jpeg"
          },
          {
            "@category": "standard",
            "@height": "224",
            "@width": "612",
            "@_fa": "true",
            "$": "https://api.elsevier.com/content/object/eid/1-s2.0-S1872206717628018-gr8.jpg?httpAccept=%2A%2F%2A",
            "@multimediatype": "JPEG image file",
            "@type": "IMAGE-DOWNSAMPLED",
            "@size": "57053",
            "@ref": "gr8",
            "@mimetype": "image/jpeg"
          },
          {
            "@category": "standard",
            "@height": "481",
            "@width": "648",
            "@_fa": "true",
            "$": "https://api.elsevier.com/content/object/eid/1-s2.0-S1872206717628018-gr9.jpg?httpAccept=%2A%2F%2A",
            "@multimediatype": "JPEG image file",
            "@type": "IMAGE-DOWNSAMPLED",
            "@size": "109640",
            "@ref": "gr9",
            "@mimetype": "image/jpeg"
          },
          {
            "@category": "high",
            "@height": "651",
            "@width": "800",
            "@_fa": "true",
            "$": "https://api.elsevier.com/content/object/eid/1-s2.0-S1872206717628018-fx1_lrg.jpg?httpAccept=%2A%2F%2A",
            "@multimediatype": "JPEG image file",
            "@type": "IMAGE-HIGH-RES",
            "@size": "188912",
            "@ref": "fx1",
            "@mimetype": "image/jpeg"
          },
          {
            "@category": "high",
            "@height": "795",
            "@width": "914",
            "@_fa": "true",
            "$": "https://api.elsevier.com/content/object/eid/1-s2.0-S1872206717628018-gr1_lrg.jpg?httpAccept=%2A%2F%2A",
            "@multimediatype": "JPEG image file",
            "@type": "IMAGE-HIGH-RES",
            "@size": "113878",
            "@ref": "gr1",
            "@mimetype": "image/jpeg"
          },
          {
            "@category": "high",
            "@height": "916",
            "@width": "1734",
            "@_fa": "true",
            "$": "https://api.elsevier.com/content/object/eid/1-s2.0-S1872206717628018-gr10_lrg.jpg?httpAccept=%2A%2F%2A",
            "@multimediatype": "JPEG image file",
            "@type": "IMAGE-HIGH-RES",
            "@size": "465956",
            "@ref": "gr10",
            "@mimetype": "image/jpeg"
          },
          {
            "@category": "high",
            "@height": "937",
            "@width": "1802",
            "@_fa": "true",
            "$": "https://api.elsevier.com/content/object/eid/1-s2.0-S1872206717628018-gr11_lrg.jpg?httpAccept=%2A%2F%2A",
            "@multimediatype": "JPEG image file",
            "@type": "IMAGE-HIGH-RES",
            "@size": "451909",
            "@ref": "gr11",
            "@mimetype": "image/jpeg"
          },
          {
            "@category": "high",
            "@height": "1000",
            "@width": "1599",
            "@_fa": "true",
            "$": "https://api.elsevier.com/content/object/eid/1-s2.0-S1872206717628018-gr12_lrg.jpg?httpAccept=%2A%2F%2A",
            "@multimediatype": "JPEG image file",
            "@type": "IMAGE-HIGH-RES",
            "@size": "317844",
            "@ref": "gr12",
            "@mimetype": "image/jpeg"
          },
          {
            "@category": "high",
            "@height": "871",
            "@width": "1493",
            "@_fa": "true",
            "$": "https://api.elsevier.com/content/object/eid/1-s2.0-S1872206717628018-gr2_lrg.jpg?httpAccept=%2A%2F%2A",
            "@multimediatype": "JPEG image file",
            "@type": "IMAGE-HIGH-RES",
            "@size": "243678",
            "@ref": "gr2",
            "@mimetype": "image/jpeg"
          },
          {
            "@category": "high",
            "@height": "994",
            "@width": "1718",
            "@_fa": "true",
            "$": "https://api.elsevier.com/content/object/eid/1-s2.0-S1872206717628018-gr3_lrg.jpg?httpAccept=%2A%2F%2A",
            "@multimediatype": "JPEG image file",
            "@type": "IMAGE-HIGH-RES",
            "@size": "350964",
            "@ref": "gr3",
            "@mimetype": "image/jpeg"
          },
          {
            "@category": "high",
            "@height": "987",
            "@width": "1656",
            "@_fa": "true",
            "$": "https://api.elsevier.com/content/object/eid/1-s2.0-S1872206717628018-gr4_lrg.jpg?httpAccept=%2A%2F%2A",
            "@multimediatype": "JPEG image file",
            "@type": "IMAGE-HIGH-RES",
            "@size": "380242",
            "@ref": "gr4",
            "@mimetype": "image/jpeg"
          },
          {
            "@category": "high",
            "@height": "786",
            "@width": "1792",
            "@_fa": "true",
            "$": "https://api.elsevier.com/content/object/eid/1-s2.0-S1872206717628018-gr5_lrg.jpg?httpAccept=%2A%2F%2A",
            "@multimediatype": "JPEG image file",
            "@type": "IMAGE-HIGH-RES",
            "@size": "282392",
            "@ref": "gr5",
            "@mimetype": "image/jpeg"
          },
          {
            "@category": "high",
            "@height": "728",
            "@width": "2017",
            "@_fa": "true",
            "$": "https://api.elsevier.com/content/object/eid/1-s2.0-S1872206717628018-gr6_lrg.jpg?httpAccept=%2A%2F%2A",
            "@multimediatype": "JPEG image file",
            "@type": "IMAGE-HIGH-RES",
            "@size": "318602",
            "@ref": "gr6",
            "@mimetype": "image/jpeg"
          },
          {
            "@category": "high",
            "@height": "1457",
            "@width": "1667",
            "@_fa": "true",
            "$": "https://api.elsevier.com/content/object/eid/1-s2.0-S1872206717628018-gr7_lrg.jpg?httpAccept=%2A%2F%2A",
            "@multimediatype": "JPEG image file",
            "@type": "IMAGE-HIGH-RES",
            "@size": "636868",
            "@ref": "gr7",
            "@mimetype": "image/jpeg"
          },
          {
            "@category": "high",
            "@height": "595",
            "@width": "1625",
            "@_fa": "true",
            "$": "https://api.elsevier.com/content/object/eid/1-s2.0-S1872206717628018-gr8_lrg.jpg?httpAccept=%2A%2F%2A",
            "@multimediatype": "JPEG image file",
            "@type": "IMAGE-HIGH-RES",
            "@size": "193192",
            "@ref": "gr8",
            "@mimetype": "image/jpeg"
          },
          {
            "@category": "high",
            "@height": "1277",
            "@width": "1721",
            "@_fa": "true",
            "$": "https://api.elsevier.com/content/object/eid/1-s2.0-S1872206717628018-gr9_lrg.jpg?httpAccept=%2A%2F%2A",
            "@multimediatype": "JPEG image file",
            "@type": "IMAGE-HIGH-RES",
            "@size": "428090",
            "@ref": "gr9",
            "@mimetype": "image/jpeg"
          },
          {
            "@category": "thumbnail",
            "@height": "16",
            "@width": "244",
            "@_fa": "true",
            "$": "https://api.elsevier.com/content/object/eid/1-s2.0-S1872206717628018-si1.gif?httpAccept=%2A%2F%2A",
            "@multimediatype": "GIF image file",
            "@type": "ALTIMG",
            "@size": "731",
            "@ref": "si1",
            "@mimetype": "image/gif"
          },
          {
            "@category": "thumbnail",
            "@height": "14",
            "@width": "287",
            "@_fa": "true",
            "$": "https://api.elsevier.com/content/object/eid/1-s2.0-S1872206717628018-si2.gif?httpAccept=%2A%2F%2A",
            "@multimediatype": "GIF image file",
            "@type": "ALTIMG",
            "@size": "1217",
            "@ref": "si2",
            "@mimetype": "image/gif"
          }
        ]
      },
      "link": {
        "@rel": "abstract",
        "@href": "https://api.elsevier.com/content/abstract/scopus_id/85020912433"
      }
    }
  }
}