{
  "metadata": {
    "title": "One-pot hydrothermal synthesis of willow branch-shaped MoS<ce:inf loc=post>2</ce:inf>/CdS heterojunctions for photocatalytic H<ce:inf loc=post>2</ce:inf> production under visible light irradiation",
    "authors": "; ; ",
    "journal": "Chinese Journal of Catalysis",
    "date": "2019-03-31",
    "doi": "10.1016/S1872-2067(18)63178-X",
    "abstract": "",
    "uri": "https://api.elsevier.com/content/article/pii/S187220671863178X",
    "pii": "S187220671863178X"
  },
  "fulltext": {
    "full-text-retrieval-response": {
      "scopus-eid": "2-s2.0-85068580170",
      "originalText": "serial JL 273538 291210 291744 291809 31 Chinese Journal of Catalysis CHINESEJOURNALCATALYSIS 2019-03-05 2019-03-05 2019-03-05 2019-03-05 2019-03-05T19:55:27 1-s2.0-S187220671863178X S1872-2067(18)63178-X S187220671863178X 10.1016/S1872-2067(18)63178-X S300 S300.1 FULL-TEXT 1-s2.0-S1872206719X00030 2019-03-05T22:32:50.692876Z 0 0 20190301 20190331 2019 2019-03-05T22:36:05.629703Z absattachment articleinfo articletitlenorm authfirstinitialnorm authfirstsurnamenorm cid cids contenttype copyright crossmark dateloaded dateloadedtxt datesearch datesort dateupdated dco docsubtype doctype doi eid ewtransactionid hubeid indexeddate issfirst issn issnnorm issuelist itemstage itemtransactionid itemweight openaccess openarchive pg pgfirst pglast pii piinorm pubdateend pubdatestart pubdatetxt pubyr sortorder srctitle srctitlenorm srctype ssids alllist content subj subheadings tomb volfirst volissue volumelist webpdf webpdfpagecount yearnav figure body mmlmath affil articletitle auth authfirstini authfull authkeywords authlast grantnumber grantsponsor primabst pubtype ref specialabst 1872-2067 18722067 true 40 40 3 3 Volume 40, Issue 3 10 371 379 371 379 201903 March 2019 2019-03-01 2019-03-31 2019 article fla Copyright © 2019 Dalian Institute of Chemical Physics, the Chinese Academy of Sciences. Published by Elsevier B.V. All rights reserved. ONEPOTHYDROTHERMALSYNTHESISWILLOWBRANCHSHAPEDMOS2CDSHETEROJUNCTIONSFORPHOTOCATALYTICH2PRODUCTIONUNDERVISIBLELIGHTIRRADIATION ZHANG Z 1 Introduction 2 Experimental 2.1 Sample preparation 2.2 Characterization 2.3 Photocatalytic activity measurements 3 Results and discussion 4 Conclusions References LI 2016 2603 2636 X CHEN 2017 296 304 F HE 2017 240 252 K SIMON 2014 1013 1018 T WU 2015 10224 10230 K WILKER 2014 4316 4324 M CHEN 2015 1210 1214 J WANG 2018 561 569 P WANG 2017 662 668 Q YU 2016 3722 3730 H MARSCHALL 2014 2421 2440 R LI 2017 6958 6968 Q LI 2015 1500010 Q ZHANG 2016 101 107 J MA 2016 820 824 B LI 2018 437 442 J MA 2017 1970 1980 S XING 2017 1702624 M SHENG 2018 613 623 W CHEN 2018 841 848 Z HU 2013 5636 5639 Y MA 2016 2284 2293 X SHI 2018 1705941 R YANG 2017 6950 6958 Y ZHANG 2017 23635 23646 S ZHENG 2016 2648 2654 W XIE 2016 3588 3598 J ZHANG 2015 3140 3148 Y FU 2017 2160 2170 Y QIAO 2018 12375 12384 X LIANG 2017 1601208 J CHAO 2017 1700234 Y QIAO 2016 11631 11636 X QIAO 2016 241 245 X QIAO 2017 3538 3547 X ZONG 2008 7176 7177 X CHANG 2014 7078 7087 K LIANG 2018 6084 6089 J CHAI 2017 2067 2075 B CHAVA 2018 240 248 R CHAI 2018 523 530 B ZHAO 2016 242 252 W HAN 2017 298 304 B YIN 2016 15258 15266 X SHANG 2016 1501241 L HUANG 2014 10673 10679 Y CHANG 2014 7078 7087 K YUAN 2016 532 541 Y ZHANG 2015 12193 12202 N KUMAR 2017 7651 7658 D XIE 2013 17881 17888 J CUI 2015 2305 2313 S WU 2017 955 963 A HUANG 2017 514 522 Q MA 2017 580 591 S LI 2011 10878 10884 Q YU 2011 3491 3501 J MIN 2014 2578 2584 Y LEI 2017 456 464 Y QIN 2017 374 380 N QIAO 2018 X TIAN 2018 17086 17094 F ZHANGX2019X371 ZHANGX2019X371X379 ZHANGX2019X371XZ ZHANGX2019X371X379XZ 2021-03-05T00:00:00.000Z 2021-03-05T00:00:00.000Z item S1872-2067(18)63178-X S187220671863178X 1-s2.0-S187220671863178X 10.1016/S1872-2067(18)63178-X 273538 2019-03-05T21:36:05.629703Z 2019-03-01 2019-03-31 1-s2.0-S187220671863178X-main.pdf https://s3.amazonaws.com/prod-ucs-content-store-us-east/content/pii:S187220671863178X/MAIN/application/pdf/5944c040c42be2b0f33e00c547c088f3/main.pdf main.pdf pdf true 1569359 MAIN 9 1-s2.0-S187220671863178X-main_1.png https://s3.amazonaws.com/prod-ucs-content-store-us-east/content/pii:S187220671863178X/PREVIEW/image/png/19e0aea61acd5bbb627197b6eaae3085/main_1.png main_1.png png 49294 849 656 IMAGE-WEB-PDF 1 1-s2.0-S187220671863178X-fx1.sml https://s3.amazonaws.com/prod-ucs-content-store-us-east/content/pii:S187220671863178X/fx1/THUMBNAIL/image/gif/679c466e939cf88c9ca9d2bdd0ce101b/fx1.sml fx1 true fx1.sml sml 28357 147 219 IMAGE-THUMBNAIL 1-s2.0-S187220671863178X-gr1.sml https://s3.amazonaws.com/prod-ucs-content-store-us-east/content/pii:S187220671863178X/gr1/THUMBNAIL/image/gif/bac0991eef17027376ea3e6addebade1/gr1.sml gr1 gr1.sml sml 17544 154 219 IMAGE-THUMBNAIL 1-s2.0-S187220671863178X-gr2.sml https://s3.amazonaws.com/prod-ucs-content-store-us-east/content/pii:S187220671863178X/gr2/THUMBNAIL/image/gif/76d0e8518b72107ec0fa74efa1653435/gr2.sml gr2 gr2.sml sml 26501 109 219 IMAGE-THUMBNAIL 1-s2.0-S187220671863178X-gr3.sml https://s3.amazonaws.com/prod-ucs-content-store-us-east/content/pii:S187220671863178X/gr3/THUMBNAIL/image/gif/6e63a00286bdecdc2bcbe2ff303631b3/gr3.sml gr3 gr3.sml sml 30629 164 175 IMAGE-THUMBNAIL 1-s2.0-S187220671863178X-gr4.sml https://s3.amazonaws.com/prod-ucs-content-store-us-east/content/pii:S187220671863178X/gr4/THUMBNAIL/image/gif/72eb6cd4373d97c5a8bea5c3df3a83e2/gr4.sml gr4 gr4.sml sml 15810 164 213 IMAGE-THUMBNAIL 1-s2.0-S187220671863178X-gr5.sml https://s3.amazonaws.com/prod-ucs-content-store-us-east/content/pii:S187220671863178X/gr5/THUMBNAIL/image/gif/ea9188689d79178e3d512d2dccc494d2/gr5.sml gr5 gr5.sml sml 9934 80 219 IMAGE-THUMBNAIL 1-s2.0-S187220671863178X-gr6.sml https://s3.amazonaws.com/prod-ucs-content-store-us-east/content/pii:S187220671863178X/gr6/THUMBNAIL/image/gif/fdd90213263c181a11d8afb8e9f4890e/gr6.sml gr6 gr6.sml sml 9528 83 219 IMAGE-THUMBNAIL 1-s2.0-S187220671863178X-gr7.sml https://s3.amazonaws.com/prod-ucs-content-store-us-east/content/pii:S187220671863178X/gr7/THUMBNAIL/image/gif/3bd76e1a01fc0bc5cd26b53660384fae/gr7.sml gr7 gr7.sml sml 11304 154 219 IMAGE-THUMBNAIL 1-s2.0-S187220671863178X-gr8.sml https://s3.amazonaws.com/prod-ucs-content-store-us-east/content/pii:S187220671863178X/gr8/THUMBNAIL/image/gif/b2869bf3fe30edcf57801261e5002d92/gr8.sml gr8 gr8.sml sml 8716 49 219 IMAGE-THUMBNAIL 1-s2.0-S187220671863178X-gr9.sml https://s3.amazonaws.com/prod-ucs-content-store-us-east/content/pii:S187220671863178X/gr9/THUMBNAIL/image/gif/e774b6e11cce90103af163bd8bee2549/gr9.sml gr9 gr9.sml sml 17209 164 155 IMAGE-THUMBNAIL 1-s2.0-S187220671863178X-fx1.jpg https://s3.amazonaws.com/prod-ucs-content-store-us-east/content/pii:S187220671863178X/fx1/DOWNSAMPLED/image/jpeg/e903bafa5691e114ccb329cf4b518dee/fx1.jpg fx1 true fx1.jpg jpg 41958 202 301 IMAGE-DOWNSAMPLED 1-s2.0-S187220671863178X-gr1.jpg https://s3.amazonaws.com/prod-ucs-content-store-us-east/content/pii:S187220671863178X/gr1/DOWNSAMPLED/image/jpeg/99920d33d66a344db2f07b26698674d2/gr1.jpg gr1 gr1.jpg jpg 62123 243 346 IMAGE-DOWNSAMPLED 1-s2.0-S187220671863178X-gr2.jpg https://s3.amazonaws.com/prod-ucs-content-store-us-east/content/pii:S187220671863178X/gr2/DOWNSAMPLED/image/jpeg/37936232b6781883770b6ae1e43bbb00/gr2.jpg gr2 gr2.jpg jpg 55417 187 374 IMAGE-DOWNSAMPLED 1-s2.0-S187220671863178X-gr3.jpg https://s3.amazonaws.com/prod-ucs-content-store-us-east/content/pii:S187220671863178X/gr3/DOWNSAMPLED/image/jpeg/0aebac5c2e5832a46d20a17130495a70/gr3.jpg gr3 gr3.jpg jpg 79337 350 374 IMAGE-DOWNSAMPLED 1-s2.0-S187220671863178X-gr4.jpg https://s3.amazonaws.com/prod-ucs-content-store-us-east/content/pii:S187220671863178X/gr4/DOWNSAMPLED/image/jpeg/11d0f56511ca1ea3d8114b4abe43b6ec/gr4.jpg gr4 gr4.jpg jpg 104407 526 683 IMAGE-DOWNSAMPLED 1-s2.0-S187220671863178X-gr5.jpg https://s3.amazonaws.com/prod-ucs-content-store-us-east/content/pii:S187220671863178X/gr5/DOWNSAMPLED/image/jpeg/c43d734f0927746f0d301eb091f20cf7/gr5.jpg gr5 gr5.jpg jpg 76459 275 756 IMAGE-DOWNSAMPLED 1-s2.0-S187220671863178X-gr6.jpg https://s3.amazonaws.com/prod-ucs-content-store-us-east/content/pii:S187220671863178X/gr6/DOWNSAMPLED/image/jpeg/584dfaff2efe02e5c626fa9e44a1fc37/gr6.jpg gr6 gr6.jpg jpg 63188 284 752 IMAGE-DOWNSAMPLED 1-s2.0-S187220671863178X-gr7.jpg https://s3.amazonaws.com/prod-ucs-content-store-us-east/content/pii:S187220671863178X/gr7/DOWNSAMPLED/image/jpeg/97db5f1bd2ef92c5eca8cce240e38fe7/gr7.jpg gr7 gr7.jpg jpg 34378 227 323 IMAGE-DOWNSAMPLED 1-s2.0-S187220671863178X-gr8.jpg https://s3.amazonaws.com/prod-ucs-content-store-us-east/content/pii:S187220671863178X/gr8/DOWNSAMPLED/image/jpeg/23d23af48454a2e8533dc7e3ce17daa3/gr8.jpg gr8 gr8.jpg jpg 64786 167 751 IMAGE-DOWNSAMPLED 1-s2.0-S187220671863178X-gr9.jpg https://s3.amazonaws.com/prod-ucs-content-store-us-east/content/pii:S187220671863178X/gr9/DOWNSAMPLED/image/jpeg/e4c33670108927a059c1430f439bca26/gr9.jpg gr9 gr9.jpg jpg 95089 598 565 IMAGE-DOWNSAMPLED 1-s2.0-S187220671863178X-fx1_lrg.jpg https://s3.amazonaws.com/prod-ucs-content-store-us-east/content/pii:S187220671863178X/fx1/HIGHRES/image/jpeg/f0c83f3cfeb7aec531502360be35be61/fx1_lrg.jpg fx1 true fx1_lrg.jpg jpg 140953 538 800 IMAGE-HIGH-RES 1-s2.0-S187220671863178X-gr1_lrg.jpg https://s3.amazonaws.com/prod-ucs-content-store-us-east/content/pii:S187220671863178X/gr1/HIGHRES/image/jpeg/3c62dbf6e6ff1f6679f124e94166da08/gr1_lrg.jpg gr1 gr1_lrg.jpg jpg 184876 647 920 IMAGE-HIGH-RES 1-s2.0-S187220671863178X-gr2_lrg.jpg https://s3.amazonaws.com/prod-ucs-content-store-us-east/content/pii:S187220671863178X/gr2/HIGHRES/image/jpeg/b16c10c54f82d4655cdd2bcbd41d1765/gr2_lrg.jpg gr2 gr2_lrg.jpg jpg 252392 496 993 IMAGE-HIGH-RES 1-s2.0-S187220671863178X-gr3_lrg.jpg https://s3.amazonaws.com/prod-ucs-content-store-us-east/content/pii:S187220671863178X/gr3/HIGHRES/image/jpeg/b1fa6276d31121d6cc821f2e1334b531/gr3_lrg.jpg gr3 gr3_lrg.jpg jpg 480739 930 993 IMAGE-HIGH-RES 1-s2.0-S187220671863178X-gr4_lrg.jpg https://s3.amazonaws.com/prod-ucs-content-store-us-east/content/pii:S187220671863178X/gr4/HIGHRES/image/jpeg/8855bb4c6f9dfec00b4e9fef1eb27fce/gr4_lrg.jpg gr4 gr4_lrg.jpg jpg 405551 1398 1815 IMAGE-HIGH-RES 1-s2.0-S187220671863178X-gr5_lrg.jpg https://s3.amazonaws.com/prod-ucs-content-store-us-east/content/pii:S187220671863178X/gr5/HIGHRES/image/jpeg/8da5157fb3b1b40d5e6d00667d7b880a/gr5_lrg.jpg gr5 gr5_lrg.jpg jpg 271792 732 2009 IMAGE-HIGH-RES 1-s2.0-S187220671863178X-gr6_lrg.jpg https://s3.amazonaws.com/prod-ucs-content-store-us-east/content/pii:S187220671863178X/gr6/HIGHRES/image/jpeg/c028fa8ce547f029539006c335ef258d/gr6_lrg.jpg gr6 gr6_lrg.jpg jpg 220475 754 1998 IMAGE-HIGH-RES 1-s2.0-S187220671863178X-gr7_lrg.jpg https://s3.amazonaws.com/prod-ucs-content-store-us-east/content/pii:S187220671863178X/gr7/HIGHRES/image/jpeg/b7bfe5697f49f84a5ce7d729473b1e4b/gr7_lrg.jpg gr7 gr7_lrg.jpg jpg 79193 604 859 IMAGE-HIGH-RES 1-s2.0-S187220671863178X-gr8_lrg.jpg https://s3.amazonaws.com/prod-ucs-content-store-us-east/content/pii:S187220671863178X/gr8/HIGHRES/image/jpeg/4e73a5335fe9d0835fe5bed0ab096289/gr8_lrg.jpg gr8 gr8_lrg.jpg jpg 231160 444 1994 IMAGE-HIGH-RES 1-s2.0-S187220671863178X-gr9_lrg.jpg https://s3.amazonaws.com/prod-ucs-content-store-us-east/content/pii:S187220671863178X/gr9/HIGHRES/image/jpeg/3581ab8ec7270d79b59645815d2ee37e/gr9_lrg.jpg gr9 gr9_lrg.jpg jpg 318676 1588 1501 IMAGE-HIGH-RES 1-s2.0-S187220671863178X-si1.gif https://s3.amazonaws.com/prod-ucs-content-store-us-east/content/pii:S187220671863178X/STRIPIN/image/gif/b04dd95bc14ef45688c6e89fa79ce2e5/si1.gif si1 si1.gif gif 2677 74 340 ALTIMG CHNJC 63178 S1872-2067(18)63178-X 10.1016/S1872-2067(18)63178-X Dalian Institute of Chemical Physics, the Chinese Academy of Sciences Fig 1. XRD patterns of all samples, together with standard diffraction patterns of CdS and MoS2/CdS composites. Fig 2. SEM images of (a) MC-0, (b) MC-1, (c) MC-2, (d) MC-5, (e) MC-10, and (f) MC-20. Fig 3. (a) TEM images of MC-5; (b) Photograph of willow branch; (c, d) HRTEM images of MC-5; (e) TEM image and corresponding elemental mappings of (f) Cd, (g) Mo, and (h) S. Fig 4. (a) XPS survey spectrum of MC-5 sample; (b) Cd 3d, (c) Mo 3d, and (d) S 2p high-resolution XPS spectra of MC-5. Fig 5. Nitrogen adsorption-desorption isotherms (a) and corresponding pore size distributions (b) of the MC-0, MC-5, and MC-20 samples. Fig 6. (a) UV-vis-NIR spectra of the as-prepared samples; (b) Estimation of band gap values of (a) MC-0 and (b) MoS2 from the (αhv)1/n vs. hv plots. Fig 7. Comparison of photocatalytic H2 evolution activity of willow branch-shaped MoS2/CdS heterojunctions and physically mixed MoS2/CdS composite under visible light irradiation. Fig 8. (a) Room-temperature PL spectra of all as-prepared samples (λ Ex = 434 nm); (b) transient photocurrent response and (c) electrochemical impedance spectra of MC-0, MC-5, and MC-20. Fig 9. (a, b) Mott-Schottky plots of MC-0 and MoS2, used for determining the flat-band potentials; (c) Schematic illustration of proposed mechanism for the enhanced photocatalytic H2 evolution. Published 5 March 2019 This work was supported by the National Natural Science Foundation of China (51502155, 51572152, 21673127, 21671119), the Research Project of Hubei Provincial Department of Education (D20151203), and the State Key Laboratory of Structural Chemistry, Fujian Institute of Research on the Structure of Matter, Chinese Academy of Sciences (20170020). Article One-pot hydrothermal synthesis of willow branch-shaped MoS2/CdS heterojunctions for photocatalytic H2 production under visible light irradiation Zhen-Wei Zhang Qiu-Hao Li Xiu-Qing Qiao * Dongfang Hou Dong-Sheng Li # College of Materials and Chemical Engineering, Hubei Provincial Collaborative Innovation Center for New Energy Microgrid, Key Laboratory of Inorganic Nonmetallic Crystalline and Energy Conversion Materials, China Three Gorges University, Yichang 443002, Hubei, China College of Materials and Chemical Engineering Hubei Provincial Collaborative Innovation Center for New Energy Microgrid Key Laboratory of Inorganic Nonmetallic Crystalline and Energy Conversion Materials China Three Gorges University Yichang Hubei 443002 China * Corresponding author. Fax: +86-717-6397506 Fax: +86-717-6397506 # Corresponding author. Fax: +86-717-6397506 Fax: +86-717-6397506 Willow branch-shaped MoS2/CdS heterojunctions are successfully synthesized for the first time by a facile one-pot hydrothermal method. The as-prepared samples were characterized by X-ray diffraction, X-ray photoelectron spectroscopy, scanning electron microscopy, transmission electron microscopy, nitrogen adsorption-desorption measurements, diffuse reflectance spectroscopy, and photoelectrochemical and photoluminescence spectroscopy tests. The photocatalytic hydrogen evolution activities of the samples were evaluated under visible light irradiation. The resulting MoS2/CdS heterojunctions exhibit a much improved photocatalytic hydrogen evolution activity than that obtained with CdS and MoS2. In particular, the optimized MC-5 (5 at.% MoS2/CdS) photocatalyst achieved the highest hydrogen production rate of 250.8 μmol h-1, which is 28 times higher than that of pristine CdS. The apparent quantum efficiency (AQE) at 420 nm was 3.66%. Further detailed characterizations revealed that the enhanced photocatalytic activity of the MoS2/CdS heterojunctions could be attributed to the efficient transfer and separation of photogenerated charge carriers resulting from the core-shell structure and the close contact between MoS2 nanosheets and CdS single-crystal nanorods, as well as to increased visible light absorption. A tentative mechanism for photocatalytic H2 evolution by MoS2/CdS heterojunctions was proposed. This work will open up new opportunities for developing more efficient photocatalysts for water splitting. Graphical abstract Novel willow branch-shaped MoS2/CdS heterojunctions synthesized via a one-pot hydrothermal method show excellent photocatalytic H2 evolution activity. Keywords CdS MoS2 Photocatalysis Water splitting H2 evolution Heterojunction Core-shell structure Visible light 1 Introduction Since photoelectrochemical water splitting was first reported by Fujishima and Honda in 1972, photocatalytic water splitting into hydrogen using semiconductor photocatalysts and solar energy has been considered as one of the most promising approaches to cope with the global energy crisis and environmental pollution issues. Various semiconductor materials have been developed for photocatalytic hydrogen evolution applications [1]. However, their practical use in water splitting is still limited by several intrinsic disadvantages such as poor visible light harvesting, low activity, and high cost. Therefore, the identification of more efficient photocatalysts for hydrogen production is still a task of great importance. Considerable efforts have been devoted to exploring new visible-light-driven photocatalysts or to promoting the separation of photogenerated charge carriers by modifying the photocatalysts [2,3]. CdS, a semiconductor with appropriate band gap (~2.4 eV) for effective visible light absorption and suitable photoredox potentials for H+ reduction, has emerged as the most promising visible light photocatalysts for hydrogen generation [4–7]. However, the application of pristine CdS photocatalysts is severely limited by rapid recombination of electrons and holes [8–10]. In addition, the photocorrosion of CdS caused by the oxidation of photogenerated holes results in poor stability in aqueous solutions [11–13]. Therefore, various modification strategies have been developed to enhance the performance of CdS photocatalysts [14], including loading co-catalysts [15–17], forming heterojunctions [18–20], introducing surface modifications [21], and doping with metal [22] or nonmetal [23] elements. Among these strategies, coupling with co-catalysts has been proved to be an effective approach for improving the photocatalytic performance [24–26]. In general, noble metals such as Pt, Au, and Ag have been used as efficient co-catalysts to enhance the photocatalytic H2 evolution rate. However, the practical application of these metals is severely hampered by their limited availability and high cost. Therefore, developing inexpensive, earth-abundant, and efficient co-catalysts, especially non-precious metal-based ones, is a highly desirable goal. MoS2, a two-dimensional transition metal dichalcogenide (TMD) with unique layered structure and special properties, has attracted considerable scientific interest in various applications such as electrocatalysts [27], photocatalysts [24,28,29], sensors [30], supercapacitors [31], batteries [32], and adsorbents [33–35]. Recently, several reports have indicated that MoS2 could act as an effective co-catalyst for photocatalytic hydrogen production and organic pollutant degradation under visible light irradiation [36–41]. For example, Yang et al. [24] fabricated a multilayered MoS2-coated CdS@MoS2 core-shell structure, which presented remarkable hydrogen production activity and high durability under visible light irradiation. Zhao et al. [42] synthesized an n-BiVO4@p-MoS2 heterojunction photocatalyst with excellent performance in the photocatalytic reduction of Cr6+ and oxidation of crystal violet (CV) under visible light irradiation. Zhang et al. [25] reported the preparation of CdS@MoS2 irregular nanospheres for efficient photocatalytic hydrogen evolution. Qin et al. used an electrospinning-mediated photodeposition method to fabricate MoS2/CdS-TiO2 nanofibers, which showed good performance in photocatalytic hydrogen evolution. Exciting advances have been made in the synthesis of MoS2/CdS nanostructures with fascinating morphologies, including nanowires [24,43], nanorods [44], and nanospheres [25]. However, the development of novel MoS2/CdS nanostructures with unique morphology is still a task of great importance. In addition, most of the reported synthesis procedures include two or more complicated steps, which limit large-scale production of photocatalysts. Therefore, developing a facile, mild, and cost-effective approach for the synthesis of MoS2/CdS nanostructures with unique morphology is a highly desirable goal. Herein, we designed and fabricated a new willow branch-shaped MoS2/CdS photocatalyst through a facile one-pot hydrothermal method. We tested the photocatalytic hydrogen evolution activity under visible light irradiation of MoS2/CdS heterojunctions with different molar ratios of MoS2 and CdS. The as-prepared MoS2/CdS heterojunctions exhibited a remarkably improved photocatalytic activity under visible light irradiation. The optimized 1 at% MoS2/CdS sample showed the highest H2 production rate, 250.8 μmol h-1, which is about 28 times higher than that of pristine CdS. Detailed experiments showed that the extended and intimate interfacial contact between MoS2 and CdS can promote the transfer and reduce the recombination of photogenerated charge carries. This work provides a simple method for the facile synthesis of novel MoS2/CdS materials. 2 Experimental 2.1 Sample preparation Willow branch-shaped MoS2/CdS heterojunctions were prepared by a facile one-pot hydrothermal method. In a typical procedure, 5 mmol of Cd(NO3)2·4H2O, a given amount of Na2MoO4·2H2O, and 15 mmol of CH4N2S were added into 35 mL of deionized water under stirring at room temperature. Then, the mixture was transferred into a 50 mL Teflon-lined stainless steel autoclave and heated at 220 °C for 24 h. After the reaction, the precipitates were collected and washed several times with ultrapure water and absolute ethanol. After drying in a vacuum oven at 60 °C, willow branch-shaped MoS2/CdS samples were obtained. The MoS2 loading could be easily adjusted by changing the amount of Na2MoO4·2H2O. A series of MoS2/CdS heterojunctions with different Mo:Cd molar ratios (0, 0.01, 0.02, 0.05, 0.1, and 0.2) were prepared and labeled MC-0, MC-1, MC-2, MC-5, MC-10, and MC-20, respectively. Pure MoS2 was also synthesized using the same procedure, except that no CdS was added. In addition, an MC-m sample was obtained by physical mixing of MoS2 and CdS to illustrate the advantages of the one-pot hydrothermal method. 2.2 Characterization The crystal structures of the as-prepared products were investigated by powder X-ray diffraction (XRD) measurements performed on a Rigaku D/max-2200/PC instrument using Cu Kα radiation (40 kV). X-ray photoelectron spectroscopy (XPS) experiments were conducted on an ESCALAB 250 X-ray photoelectron spectrometer in an ion-pumped chamber. The morphologies of the samples were characterized by field-emission scanning electron microscopy (FESEM) using a JEOL JSM7500F instrument. Transmission electron microscopy (TEM) measurements were conducted on a Tecnai G2 F20 S-TWIN instrument with a field emission gun at 20 kV. The Brunauer-Emmett-Teller (BET) specific surface areas were measured at -196 °C on a Gold APP Vsorb 2800 system. The Barrett-Joyner-Halenda (BJH) method was adopted to calculate the pore size distribution from the desorption branch of the isotherms. UV-vis diffuse reflection spectroscopy (DRS) measurements were performed using a Shimadzu UV-vis 2550 (Japan) spectrophotometer. Photoluminescence (PL) spectra were measured at room temperature using an LS55 (Perkin-Elmer, USA) fluorescence spectrometer. Transient photocurrent, electrochemical impedance spectroscopy (EIS), and Mott-Schottky (M-S) measurements were performed on an electrochemical workstation (CHI 660e) under UV-visible light irradiation using a standard three-electrode system. A 300 W Xe lamp and a 0.5 mol/L Na2SO4 solution were used as the light source and electrolyte, respectively. 2.3 Photocatalytic activity measurements Photocatalytic hydrogen evolution activities of all samples were evaluated under visible light irradiation in a 250 mL top-irradiation quartz reactor at room temperature. A 300 W xenon lamp with a 420 nm cut-off filter was chosen as the visible light source. In the photocatalytic hydrogen evolution tests, 80 mg of photocatalyst was dispersed in 80 mL of mixed aqueous solution containing 8 mL lactic acid, serving as the sacrificial agent. A continuous magnetic stirrer was applied to keep the photocatalyst in suspended form during the complete experiment. Before irradiation, the reaction system was pumped to vacuum to ensure that it was held under anaerobic conditions. The evolved hydrogen was analyzed using a gas chromatograph equipped with a thermal conductivity detector (TCD, GC-9700, China; molecular sieve 5 Å column, N2 carrier). The apparent quantum efficiency (AQE) of 80 mg of catalyst for H2 evolution was measured with the same experimental setup. A 300 W Xe lamp equipped with a band-pass filter (420 nm) was used as the light source. The average intensity of the irradiation was determined by an irradiatometer (FZ-A, Beijing Normal University Optical Instrument). The AQE was calculated according to the following equation: Quantum yield = number of reacted electrons number of incident photons × 100 % = 2 × number of evolved H 2 molecules number of incident photons × 100 % 3 Results and discussion Powder XRD analysis was carried out to investigate the crystal structures and phase composition of the obtained CdS and MoS2/CdS composites, as shown in Fig. 1 . All samples possess similar XRD patterns. The main diffraction peaks at 24.8°, 26.5°, 28.2°, 43.7°, 47.8°, and 51.8° can be readily indexed to the hexagonal phase of CdS (JCPDF No. 41-1049) [18,45]. No obvious diffraction peaks of MoS2 are observed for the MoS2/CdS samples, probably because of the ultrathin structure, low content, and low crystallinity of MoS2 [46–51]. The morphology and structure of pure CdS and MoS2/CdS composites were investigated by FESEM and TEM experiments, respectively. The SEM images in Fig. 2 show that all samples exhibit similar willow branch morphologies. This shows that the introduction of the Mo source has no effect on the morphology of CdS, so that uniform MoS2/CdS composites with different molar ratios can be produced by the strategy proposed in this work. The TEM image of the MC-5 sample in Fig. 3a reveals that the willow branch-shaped MoS2/CdS composite consists of rod-like subunits. The high-resolution TEM (HRTEM) images (Fig. 3c and 3d) reveal that ultrathin MoS2 nanosheets are coated on the CdS nanorods. The one-pot hydrothermal method adopted in this work contributes to create an intimate contact between MoS2 and CdS, which facilitates the electron transfer. The measured interlayer lattice spacing of 0.68 nm can be assigned to the (002) crystal planes of MoS2. This few-layer and partially covered MoS2 structure may allow taking full advantage of the favorable features of both MoS2 and CdS components and can facilitate the photocatalytic H2 evolution. The diffraction spots in the inset of Fig. 3c reveal the single-crystalline nature of CdS, which may contribute to the electron transport and reduce the bulk recombination. The corresponding energy-dispersive X-ray spectroscopy (EDX) elemental mappings of Cd, Mo, and S in Fig. 3e-3h confirm the homogeneous dispersion of Cd, Mo, and S, denoting a uniform coating of MoS2 nanosheets over CdS single crystals. The chemical composition and valence states of the elements present in the MC-5 sample were investigated by XPS. The XPS survey spectrum of the MC-5 sample in Fig. 4a clearly shows the existence of Cd, Mo, S, and O, along with trace amounts of C. The high-resolution XPS spectrum of Cd in Fig. 4b shows two peaks at 411.5 and 404.7 eV, which can be assigned to the characteristic binding energies of Cd 3d 3/2 and Cd 3d 5/2, respectively, in CdS [44]. The XPS spectrum of Mo 3d in Fig. 4c, with two peaks at 231.2 and 227.9 eV, is consistent with the binding energies of 3d 3/2 and 3d 5/2 of Mo4+ in MoS2, respectively [35]. In addition, the two peaks centered at about 235.1 and 232.0 eV can be attributed to the +6 oxidation state of Mo [52], which is likely formed by the partial oxidation of MoS2 or through the incorporation of O elements [46]. The observed peak at 225.9 eV matches well with the binding energy of S 2s in sulfides. The two peaks at 162.5 and 161.2 eV in the S 2p spectrum can be assigned to the S 2p 1/2 and S 2p 3/2 levels of S2-, respectively (Fig. 4d) [53]. The XPS results thus further confirm the presence of MoS2 in the obtained MoS2/CdS sample. Moreover, the BET surface area and pore structure of MC-0, MC-5, and MC-20 were determined by N2 adsorption-desorption isotherms at -196 °C, and are shown in Fig. 5 . The three samples exhibited similar type V isotherms with H3 hysteresis loops, denoting a mesoporous structure. The BET surface area of MC-5 was calculated to be 8.3 m2 g-1, which is higher than that of MC-0 (6.2 m2 g-1) and MC-20 (4.6 m2 g-1). The increase in the BET surface area of MC-5 can be attributed to the ultrathin MoS2 nanosheets on the surface of CdS [54,55]. However, as more MoS2 was introduced in the sample (MC-20), the agglomeration of ultrathin nanosheets reduced the surface area of the heterojunction. The pore size distribution curves in Fig. 5b indicate that the CdS and MoS2/CdS heterojunctions are rich in pores with sizes between 2 and 100 nm, showing the presence of well-developed mesoporous and macroporous structures in the samples. The MC-5 nanostructure with core-shell morphology shows a dramatically increased pore volume, which may facilitate the diffusion of reactants and improve the photocatalytic H2 evolution activity. The special core-shell structure is beneficial for improving the optical performance [24]. Fig. 6a shows the UV-vis-near-infrared (NIR) DRS spectra of the as-prepared MC-0, MC-5, MC-20, and pure MoS2 samples. A significant band gap absorption at wavelengths shorter than 520 nm was observed for the pure CdS (MC-0) sample. Coating with MoS2 resulted in an apparent enhancement of the visible light absorption from 520 to 800 nm. The band gap of pristine CdS and MoS2 can be calculated from the UV-vis DRS curves according to the formula: (αhυ) n = A(hυ-E g) where α is the absorption coefficient, h is the Planck’s constant, υ is the frequency of the incident light, A is a constant, E g is the band gap energy, and n = 1/2 or 2 for indirect or direct band gap semiconductors, respectively. The corresponding Kubelka-Munk-transformed reflectance spectra are shown in Fig. 6b. The obtained E g values for CdS and MoS2 are 2.30 and 1.31 eV, respectively. Obviously, the narrow band gap of MoS2 improves the visible and near-infrared absorption of MoS2/CdS heterojunctions. The enhanced light absorption of MoS2/CdS heterojunctions is expected to favor the formation of a higher number of photogenerated electrons available for the photocatalytic H2 evolution reaction. Photocatalytic H2 generation activities of all samples without noble metal co-catalysts were evaluated under visible light illumination (λ ≥ 420 nm), using lactic acid (10 vol%) as scavenger. Fig. 7 compares the average photocatalytic H2 evolution rate of MoS2/CdS core-shell heterojunctions with different molar ratios of MoS2 and CdS. No H2 was detected when only MoS2 was used as catalyst, suggesting that MoS2 is inactive for photocatalytic H2 evolution. Bare CdS exhibits very low catalytic activity, owing to the fast recombination of photogenerated electron-hole pairs. However, all MoS2/CdS heterojunctions exhibit a much higher photocatalytic H2 generation rate, with the MC-5 sample reaching the maximum value of 250.8 μmol h-1, which is about 28 times higher than that of bare CdS (9.1 μmol h-1). The calculated AQE is ~3.66% at 420 nm. Further increasing the MoS2 amount results in a decreased H2 evolution rate. For example, when the molar ratio of MoS2 reaches 20 at% (MC-20), the average H2 evolution rate decreases to 107.6 μmol h-1 . This may be due to the “shielding effect”, i.e., excessive MoS2 may block the light absorption of CdS and prevent the effective contact between active sites and reactants [54,56,57]. The core-shell structure formed by MoS2 and CdS may promote the separation and transfer of photogenerated charge carriers, resulting in an enhancement of the photocatalytic H2 evolution activity. Moreover, the physically mixed MoS2/CdS composite (MC-m) shows a much lower photocatalytic H2 evolution activity, further illustrating the advantages of the unique core-shell structure developed in this work. To further investigate the improvement in the photocatalytic activity of MoS2/CdS heterojunctions, their charge separation and transfer behavior were investigated by photoelectrochemical tests. Fig. 8a presents the PL spectra of all samples. It is generally accepted that the PL emission results from the recombination of free charge carriers [43]. In the case of the MC-0 sample, the strongest emission band at 533 nm is attributed to the near-band-edge emission of CdS. The strong intensity is due to the fast recombination of photogenerated charge carriers. The obvious decrease in the PL intensities of MoS2/CdS heterojunctions reflects their efficient transfer and separation of photoinduced electron-hole pairs [58]. MC-5 shows the lowest emission intensity among all samples, denoting its highest charge transfer efficiency and lowest electron-hole recombination rate. The efficient separation of photogenerated electrons and holes was further evidenced by transient photocurrent response analysis. As shown in Fig. 8b, MC-0 (pure CdS) exhibits a much lower photocurrent density because of its high electron-hole recombination rate. The MC-5 photocatalyst exhibits a higher photocurrent density than CdS and MC-20, suggesting a more efficient separation of photoexcited electron-hole pairs [25,59]. The efficient migration and separation of charge carriers is further supported by the EIS measurements. The EIS Nyquist plots of pure CdS, MC-5, and MC-20 in Fig. 8c reveal that the arc radius corresponding to the three electrodes decreases in the order MC-5 < MC-20 < MC-0 under visible light illumination. Generally, a smaller arc diameter in the EIS spectrum indicates a lower electron-transfer resistance and a more efficient transfer and separation of photogenerated charge carriers. Hence, the MC-5 sample is the most effective at promoting the transfer and separation of photogenerated charges [60]. The more efficient separation of photogenerated charge carriers in MC-5, associated with the intimate contact between MoS2 and CdS, results in its superior performance in the photocatalytic H2 evolution. In addition, the Mott-Schottky analysis was employed to determine the conduction and flat band potentials of CdS and MoS2. It is well known that the type of semiconductor can be determined from the slope of the Mott-Schottky plot [61]. The positive slopes of the Mott-Schottky plots shown in Fig. 9a and 9b indicate that both the CdS and MoS2 materials investigated in this work are n-type semiconductors. The flat band potentials (vs. saturated calomel electrode, SCE) of CdS and MoS2, obtained from the Mott-Schottky plots, are approximately equal to -1.35 and -0.64 V, respectively. The conduction band (CB) potential (E VB) of an n-type semiconductor is known to be approximately equal to the flat-band potential [62]. Thus, the estimated conduction band potentials (vs. normal hydrogen electrode, NHE) of CdS and MoS2 are -1.11 and -0.4 V, respectively. Moreover, the valence band potential (E VB) can be estimated by the following equation: E VB = E CB + E g Taking into account the DRS results, the E VB values of CdS and MoS2 were calculated to be 1.19 and 0.91 V, respectively. The overall energy band structure of the MoS2/CdS heterojunctions is displayed in Fig. 9c. Based on the analyses discussed above, we can propose a tentative mechanism for the enhanced photocatalytic H2 production of willow branch-shaped MoS2/CdS heterojunctions. Under visible light irradiation, most of the photogenerated electrons and holes will recombine in pure CdS, and only a small fraction will participate in the photocatalytic reaction, leading to a lower H2 evolution activity. After the formation of MoS2/CdS heterojunctions, electrons generated in CdS will transfer from the CB of CdS to MoS2, owing to their matching energy band potentials, and will then be captured by H+ to form H2. Moreover, the intimate junction formed between MoS2 and CdS through the one-step method can effectively assist the transfer of electrons. As a consequence, charge recombination will be substantially reduced, enhancing the photocatalytic activity. In addition, the increased visible light absorption will promote the production of photogenerated electrons and holes, as evidenced by the transient photocurrent response and PL spectra; this is also an essential factor promoting the photocatalytic activity. Therefore, these effects considerably enhance the photocatalytic H2 evolution activity of MoS2/CdS heterojunctions under visible light irradiation. 4 Conclusions Novel willow branch-shaped MoS2/CdS heterojunctions were prepared through a facile one-pot hydrothermal method for the first time. The MC-5 sample showed the highest photocatalytic H2 generation efficiency under visible light irradiation (250.8 μmol h-1), which is about 28 times higher than that of pure CdS. The higher hydrogen generation efficiency of MC-5 can be attributed to its increased visible light absorption, accelerated charge transport, and suppressed charge recombination. This work thus introduces a potentially effective photocatalyst for solar energy conversion. References 1 X. Li J. Yu M. Jaroniec Chem. Soc. Rev. 45 2016 2603 2636 2 F. Chen H. Yang X. Wang H. Yu Chin. J. Catal. 38 2017 296 304 3 K. He J. Xie X. Luo J. Wen S. Ma X. Li Y. Fang X. Zhang Chin. J. Catal. 38 2017 240 252 4 T. Simon N. Bouchonville M.J. Berr A. Vaneski A. Adrovic D. Volbers R. Wyrwich M. Doblinger A.S. Susha A.L. Rogach F. Jackel J.K. Stolarczyk J. Feldmann Nat. Mater. 13 2014 1013 1018 5 K.F. Wu Y.L. Du H. Tang Z. Chen T. Lian J. Am. Chem. Soc. 137 2015 10224 10230 6 M.B. Wilker K.E. Shinopoulos K.A. Brown D.W. Mulder P.W. King G. Dukovic J. Am. Chem. Soc. 136 2014 4316 4324 7 J. Chen X.L. Wu L. Yin B. Li X. Hong Z. Fan B. Chen C. Xue H. Zhang Angew. Chem. Int. Ed. 54 2015 1210 1214 8 P. Wang Y. Sheng F. Wang H. Yu Appl. Catal. B 220 2018 561 569 9 Q. Wang J. Lian Q. Ma S. Zhang J. He J. Zhong J. Li H. Huang B. Su Catal. Today 281 2017 662 668 10 H. Yu X. Huang P. Wang J. Yu J. Phys. Chem. C 120 2016 3722 3730 11 R. Marschall Adv. Funct. Mater. 24 2014 2421 2440 12 Q. Li Z. Guan D. Wu X. Zhao S. Bao B. Tian J. Zhang ACS. Sustain. Chem. Eng. 5 2017 6958 6968 13 Q. Li X. Li S. Wageh A.A. Al-Ghamdi J. Yu Adv. Energy Mater. 5 2015 1500010 14 J. Zhang S. Wageh A.A. Al-Ghamdi J. Yu Appl. Catal. B 192 2016 101 107 15 B. Ma H. Xu K. Lin J. Li H. Zhan W. Liu C. Li ChemSusChem 9 2016 820 824 16 J. Li Y. Peng X. Qian J. Lin Appl. Surf. Sci. 452 2018 437 442 17 S. Ma X. Xu J. Xie X. Li Chin. J. Catal. 38 2017 1970 1980 18 M. Xing B. Qiu M. Du Q. Zhu L. Wang J. Zhang Adv. Funct. Mater. 27 2017 1702624 19 W. Sheng Y. Song M. Dou J. Ji F. Wang Appl. Surf. Sci. 436 2018 613 623 20 Z. Chen C. Feng W. Li Z. Sun J. Hou X. Li L. Xu M. Sun Y. Bu Chin. J. Catal. 39 2018 841 848 21 Y. Hu X. Gao L. Yu Y. Wang J. Ning S. Xu X.W. Lou Angew. Chem. Int. Ed. 52 2013 5636 5639 22 X. Ma J. Li C. An J. Feng Y. Chi J. Liu J. Zhang Y. Sun Nano Res. 9 2016 2284 2293 23 R. Shi H.F. Ye F. Liang Z. Wang K. Li Y. Weng Z. Lin W.F. Fu C.M. Che Y. Chen Adv. Mater. 30 2018 1705941 24 Y. Yang Y. Zhang Z. Fang L. Zhang Z. Zheng Z. Wang W. Feng S. Weng S. Zhang P. Liu ACS Appl. Mater. Interfaces 9 2017 6950 6958 25 S. Zhang H. Yang H. Gao R. Cao J. Huang X. Xu ACS Appl. Mater. Interfaces 9 2017 23635 23646 26 W. Zheng W. Feng X. Zhang X. Chen G. Liu Y. Qiu T. Hasan P. Tan P.A. Hu Adv. Funct. Mater. 26 2016 2648 2654 27 J. Xie Y. Xie Chem. Eur. J. 22 2016 3588 3598 28 Y. Zhang L. Zuo Y. Huang L. Zhang F. Lai W. Fan T. Liu ACS Sustain. Chem. Eng. 3 2015 3140 3148 29 Y. Fu Z. Li Q. Liu X. Yang H. Tang Chin. J. Catal. 38 2017 2160 2170 30 X.Q. Qiao Z.W. Zhang D.F. Hou D.S. Li Y.L. Liu Y.Q. Lan J. Zhang P.Y. Feng X.H. Bu ACS Sustain. Chem. Eng. 6 2018 12375 12384 31 J. Liang G. Zhu C. Wang Y. Wang H. Zhu Y. Hu H. Lv R. Chen L. Ma T. Chen Z. Jin J. Liu Adv. Energy Mater. 7 2017 1601208 32 Y. Chao R. Jalili Y. Ge C. Wang T. Zheng K. Shu G.G. Wallace Adv. Funct. Mater. 27 2017 1700234 33 X.Q. Qiao F.C. Hu F.Y. Tian D.F. Hou D.S. Li RSC Adv. 6 2016 11631 11636 34 X.Q. Qiao F.C. Hu D.F. Hou D.S. Li Mater. Lett. 169 2016 241 245 35 X.Q. Qiao Z.W. Zhang F.Y. Tian D.F. Hou Z.F. Tian D.S. Li Q.C. Zhang Cryst. Growth Des. 17 2017 3538 3547 36 X. Zong H. Yan G. Wu G. Ma F. Wen L. Wang C. Li J. Am. Chem. Soc. 130 2008 7176 7177 37 K. Chang Z. Mei T. Wang Q. Kang S. Ouyang J. Ye ACS Nano 8 2014 7078 7087 38 J. Liang C. Wang P. Zhao Y. Wang L. Ma G. Zhu Y. Hu Z. Lu Z. Xu Y. Ma T. Chen Z. Tie J. Liu Z. Jin ACS Appl. Mater. Interfaces 10 2018 6084 6089 39 B. Chai C. Liu C. Wang J. Yan Z. Ren Chin. J. Catal. 38 2017 2067 2075 40 R.K. Chava J.Y. Do M. Kang Appl. Surf. Sci. 433 2018 240 248 41 B. Chai M. Xu J. Yan Z. Ren Appl. Surf. Sci. 430 2018 523 530 42 W. Zhao Y. Liu Z. Wei S. Yang H. He C. Sun Appl. Catal. B 185 2016 242 252 43 B. Han S. Liu N. Zhang Y.-J. Xu Z.-R. Tang Appl. Catal. B 202 2017 298 304 44 X.L. Yin L.L. Li W.J. Jiang Y. Zhang X. Zhang L.J. Wan J.S. Hu ACS Appl. Mater. Interfaces 8 2016 15258 15266 45 L. Shang B. Tong H. Yu G.I.N. Waterhouse C. Zhou Y. Zhao M. Tahir L.Z. Wu C.H. Tung T. Zhang Adv. Energy Mater. 6 2016 1501241 46 Y.P. Huang Y.E. Miao L.S. Zhang W.W. Tjiu J.S. Pan T.X. Liu Nanoscale 6 2014 10673 10679 47 K. Chang Z.W. Mei T. Wang Q. Kang S.X. Ouyang J.H. Ye ACS Nano 8 2014 7078 7087 48 Y.J. Yuan Z.J. Ye H.W. Lu B. Hu Y.H. Li D.Q. Chen J.S. Zhong Z.T. Yu Z.G. Zou ACS Catal. 6 2016 532 541 49 N. Zhang S. Gan T. Wu W. Ma D. Han L. Niu ACS Appl. Mater. Interfaces 7 2015 12193 12202 50 D.P. Kumar M.I. Song S. Hong E.H. Kim M. Gopannagari D.A. Reddy T.K. Kim ACS Sustain. Chem. Eng. 5 2017 7651 7658 51 J. Xie J. Zhang S. Li F. Grote X. Zhang H. Zhang R. Wang Y. Lei B. Pan Y. Xie J. Am. Chem. Soc. 135 2013 17881 17888 52 S.M. Cui Z.H. Wen X.K. Huang J.B. Chang J.H. Chen Small 11 2015 2305 2313 53 A. Wu C. Tian Y. Jiao Q. Yan G. Yang H. Fu Appl. Catal. B 203 2017 955 963 54 Q.Z. Huang Y. Xiong Q. Zhang H.C. Yao Z.J. Li Appl. Catal. B 209 2017 514 522 55 S. Ma J. Xie J. Wen K. He X. Li W. Liu X. Zhang Appl. Surf. Sci. 391 2017 580 591 56 Q. Li B. Guo J.G. Yu J.R. Ran B.H. Zhang H.J. Yan J.R. Gong J. Am. Chem. Soc. 133 2011 10878 10884 57 J.G. Yu T.T. Ma S.W. Liu Phys. Chem. Chem. Phys. 13 2011 3491 3501 58 Y. Min G. He Q. Xu Y. Chen J. Mater. Chem. A 2 2014 2578 2584 59 Y. Lei J. Hou F. Wang X. Ma Z. Jin J. Xu S. Min Appl. Surf. Sci. 420 2017 456 464 60 N. Qin J. Xiong R. Liang Y. Liu S. Zhang Y. Li Z. Li L. Wu Appl. Catal. B 202 2017 374 380 61 X.Q. Qiao Z.W. Zhang Q.H. Li D.F. Hou Q.C. Zhang J. Zhang D.S. Li P.Y. Feng X.H. Bu J. Mater. Chem. A 2018 DOI: 10.1039/C8TA08294D 62 F.Y. Tian D.F. Hou F. Tang M. Deng X.Q. Qiao Q.C. Zhang T. Wu D.S. Li J. Mater. Chem. A 6 2018 17086 17094",
      "scopus-id": "85068580170",
      "coredata": {
        "eid": "1-s2.0-S187220671863178X",
        "dc:description": "Willow branch-shaped MoS2/CdS heterojunctions are successfully synthesized for the first time by a facile one-pot hydrothermal method. The as-prepared samples were characterized by X-ray diffraction, X-ray photoelectron spectroscopy, scanning electron microscopy, transmission electron microscopy, nitrogen adsorption-desorption measurements, diffuse reflectance spectroscopy, and photoelectrochemical and photoluminescence spectroscopy tests. The photocatalytic hydrogen evolution activities of the samples were evaluated under visible light irradiation. The resulting MoS2/CdS heterojunctions exhibit a much improved photocatalytic hydrogen evolution activity than that obtained with CdS and MoS2. In particular, the optimized MC-5 (5 at.% MoS2/CdS) photocatalyst achieved the highest hydrogen production rate of 250.8 μmol h-1, which is 28 times higher than that of pristine CdS. The apparent quantum efficiency (AQE) at 420 nm was 3.66%. Further detailed characterizations revealed that the enhanced photocatalytic activity of the MoS2/CdS heterojunctions could be attributed to the efficient transfer and separation of photogenerated charge carriers resulting from the core-shell structure and the close contact between MoS2 nanosheets and CdS single-crystal nanorods, as well as to increased visible light absorption. A tentative mechanism for photocatalytic H2 evolution by MoS2/CdS heterojunctions was proposed. This work will open up new opportunities for developing more efficient photocatalysts for water splitting.",
        "openArchiveArticle": "false",
        "prism:coverDate": "2019-03-31",
        "openaccessUserLicense": null,
        "prism:aggregationType": "Journal",
        "prism:url": "https://api.elsevier.com/content/article/pii/S187220671863178X",
        "dc:creator": [
          {
            "@_fa": "true",
            "$": "Zhang, Zhen-Wei"
          },
          {
            "@_fa": "true",
            "$": "Li, Qiu-Hao"
          },
          {
            "@_fa": "true",
            "$": "Qiao, Xiu-Qing"
          },
          {
            "@_fa": "true",
            "$": "Hou, Dongfang"
          },
          {
            "@_fa": "true",
            "$": "Li, Dong-Sheng"
          }
        ],
        "link": [
          {
            "@_fa": "true",
            "@rel": "self",
            "@href": "https://api.elsevier.com/content/article/pii/S187220671863178X"
          },
          {
            "@_fa": "true",
            "@rel": "scidir",
            "@href": "https://www.sciencedirect.com/science/article/pii/S187220671863178X"
          }
        ],
        "dc:format": "application/json",
        "openaccessType": null,
        "pii": "S1872-2067(18)63178-X",
        "prism:volume": "40",
        "prism:publisher": "Dalian Institute of Chemical Physics, the Chinese Academy of Sciences. Published by Elsevier B.V.",
        "dc:title": "One-pot hydrothermal synthesis of willow branch-shaped MoS2/CdS heterojunctions for photocatalytic H2 production under visible light irradiation",
        "prism:copyright": "Copyright © 2019 Dalian Institute of Chemical Physics, the Chinese Academy of Sciences. Published by Elsevier B.V. All rights reserved.",
        "openaccess": "0",
        "prism:issn": "18722067",
        "prism:issueIdentifier": "3",
        "dcterms:subject": [
          {
            "@_fa": "true",
            "$": "CdS"
          },
          {
            "@_fa": "true",
            "$": "MoS2"
          },
          {
            "@_fa": "true",
            "$": "Photocatalysis"
          },
          {
            "@_fa": "true",
            "$": "Water splitting"
          },
          {
            "@_fa": "true",
            "$": "H2 evolution"
          },
          {
            "@_fa": "true",
            "$": "Heterojunction"
          },
          {
            "@_fa": "true",
            "$": "Core-shell structure"
          },
          {
            "@_fa": "true",
            "$": "Visible light"
          }
        ],
        "openaccessArticle": "false",
        "prism:publicationName": "Chinese Journal of Catalysis",
        "prism:number": "3",
        "openaccessSponsorType": null,
        "prism:pageRange": "371-379",
        "prism:endingPage": "379",
        "pubType": "fla",
        "prism:coverDisplayDate": "March 2019",
        "prism:doi": "10.1016/S1872-2067(18)63178-X",
        "prism:startingPage": "371",
        "dc:identifier": "doi:10.1016/S1872-2067(18)63178-X",
        "openaccessSponsorName": null
      },
      "objects": {
        "object": [
          {
            "@category": "thumbnail",
            "@height": "147",
            "@width": "219",
            "@_fa": "true",
            "$": "https://api.elsevier.com/content/object/eid/1-s2.0-S187220671863178X-fx1.sml?httpAccept=%2A%2F%2A",
            "@multimediatype": "GIF image file",
            "@type": "IMAGE-THUMBNAIL",
            "@size": "28357",
            "@ref": "fx1",
            "@mimetype": "image/gif"
          },
          {
            "@category": "thumbnail",
            "@height": "154",
            "@width": "219",
            "@_fa": "true",
            "$": "https://api.elsevier.com/content/object/eid/1-s2.0-S187220671863178X-gr1.sml?httpAccept=%2A%2F%2A",
            "@multimediatype": "GIF image file",
            "@type": "IMAGE-THUMBNAIL",
            "@size": "17544",
            "@ref": "gr1",
            "@mimetype": "image/gif"
          },
          {
            "@category": "thumbnail",
            "@height": "109",
            "@width": "219",
            "@_fa": "true",
            "$": "https://api.elsevier.com/content/object/eid/1-s2.0-S187220671863178X-gr2.sml?httpAccept=%2A%2F%2A",
            "@multimediatype": "GIF image file",
            "@type": "IMAGE-THUMBNAIL",
            "@size": "26501",
            "@ref": "gr2",
            "@mimetype": "image/gif"
          },
          {
            "@category": "thumbnail",
            "@height": "164",
            "@width": "175",
            "@_fa": "true",
            "$": "https://api.elsevier.com/content/object/eid/1-s2.0-S187220671863178X-gr3.sml?httpAccept=%2A%2F%2A",
            "@multimediatype": "GIF image file",
            "@type": "IMAGE-THUMBNAIL",
            "@size": "30629",
            "@ref": "gr3",
            "@mimetype": "image/gif"
          },
          {
            "@category": "thumbnail",
            "@height": "164",
            "@width": "213",
            "@_fa": "true",
            "$": "https://api.elsevier.com/content/object/eid/1-s2.0-S187220671863178X-gr4.sml?httpAccept=%2A%2F%2A",
            "@multimediatype": "GIF image file",
            "@type": "IMAGE-THUMBNAIL",
            "@size": "15810",
            "@ref": "gr4",
            "@mimetype": "image/gif"
          },
          {
            "@category": "thumbnail",
            "@height": "80",
            "@width": "219",
            "@_fa": "true",
            "$": "https://api.elsevier.com/content/object/eid/1-s2.0-S187220671863178X-gr5.sml?httpAccept=%2A%2F%2A",
            "@multimediatype": "GIF image file",
            "@type": "IMAGE-THUMBNAIL",
            "@size": "9934",
            "@ref": "gr5",
            "@mimetype": "image/gif"
          },
          {
            "@category": "thumbnail",
            "@height": "83",
            "@width": "219",
            "@_fa": "true",
            "$": "https://api.elsevier.com/content/object/eid/1-s2.0-S187220671863178X-gr6.sml?httpAccept=%2A%2F%2A",
            "@multimediatype": "GIF image file",
            "@type": "IMAGE-THUMBNAIL",
            "@size": "9528",
            "@ref": "gr6",
            "@mimetype": "image/gif"
          },
          {
            "@category": "thumbnail",
            "@height": "154",
            "@width": "219",
            "@_fa": "true",
            "$": "https://api.elsevier.com/content/object/eid/1-s2.0-S187220671863178X-gr7.sml?httpAccept=%2A%2F%2A",
            "@multimediatype": "GIF image file",
            "@type": "IMAGE-THUMBNAIL",
            "@size": "11304",
            "@ref": "gr7",
            "@mimetype": "image/gif"
          },
          {
            "@category": "thumbnail",
            "@height": "49",
            "@width": "219",
            "@_fa": "true",
            "$": "https://api.elsevier.com/content/object/eid/1-s2.0-S187220671863178X-gr8.sml?httpAccept=%2A%2F%2A",
            "@multimediatype": "GIF image file",
            "@type": "IMAGE-THUMBNAIL",
            "@size": "8716",
            "@ref": "gr8",
            "@mimetype": "image/gif"
          },
          {
            "@category": "thumbnail",
            "@height": "164",
            "@width": "155",
            "@_fa": "true",
            "$": "https://api.elsevier.com/content/object/eid/1-s2.0-S187220671863178X-gr9.sml?httpAccept=%2A%2F%2A",
            "@multimediatype": "GIF image file",
            "@type": "IMAGE-THUMBNAIL",
            "@size": "17209",
            "@ref": "gr9",
            "@mimetype": "image/gif"
          },
          {
            "@category": "standard",
            "@height": "202",
            "@width": "301",
            "@_fa": "true",
            "$": "https://api.elsevier.com/content/object/eid/1-s2.0-S187220671863178X-fx1.jpg?httpAccept=%2A%2F%2A",
            "@multimediatype": "JPEG image file",
            "@type": "IMAGE-DOWNSAMPLED",
            "@size": "41958",
            "@ref": "fx1",
            "@mimetype": "image/jpeg"
          },
          {
            "@category": "standard",
            "@height": "243",
            "@width": "346",
            "@_fa": "true",
            "$": "https://api.elsevier.com/content/object/eid/1-s2.0-S187220671863178X-gr1.jpg?httpAccept=%2A%2F%2A",
            "@multimediatype": "JPEG image file",
            "@type": "IMAGE-DOWNSAMPLED",
            "@size": "62123",
            "@ref": "gr1",
            "@mimetype": "image/jpeg"
          },
          {
            "@category": "standard",
            "@height": "187",
            "@width": "374",
            "@_fa": "true",
            "$": "https://api.elsevier.com/content/object/eid/1-s2.0-S187220671863178X-gr2.jpg?httpAccept=%2A%2F%2A",
            "@multimediatype": "JPEG image file",
            "@type": "IMAGE-DOWNSAMPLED",
            "@size": "55417",
            "@ref": "gr2",
            "@mimetype": "image/jpeg"
          },
          {
            "@category": "standard",
            "@height": "350",
            "@width": "374",
            "@_fa": "true",
            "$": "https://api.elsevier.com/content/object/eid/1-s2.0-S187220671863178X-gr3.jpg?httpAccept=%2A%2F%2A",
            "@multimediatype": "JPEG image file",
            "@type": "IMAGE-DOWNSAMPLED",
            "@size": "79337",
            "@ref": "gr3",
            "@mimetype": "image/jpeg"
          },
          {
            "@category": "standard",
            "@height": "526",
            "@width": "683",
            "@_fa": "true",
            "$": "https://api.elsevier.com/content/object/eid/1-s2.0-S187220671863178X-gr4.jpg?httpAccept=%2A%2F%2A",
            "@multimediatype": "JPEG image file",
            "@type": "IMAGE-DOWNSAMPLED",
            "@size": "104407",
            "@ref": "gr4",
            "@mimetype": "image/jpeg"
          },
          {
            "@category": "standard",
            "@height": "275",
            "@width": "756",
            "@_fa": "true",
            "$": "https://api.elsevier.com/content/object/eid/1-s2.0-S187220671863178X-gr5.jpg?httpAccept=%2A%2F%2A",
            "@multimediatype": "JPEG image file",
            "@type": "IMAGE-DOWNSAMPLED",
            "@size": "76459",
            "@ref": "gr5",
            "@mimetype": "image/jpeg"
          },
          {
            "@category": "standard",
            "@height": "284",
            "@width": "752",
            "@_fa": "true",
            "$": "https://api.elsevier.com/content/object/eid/1-s2.0-S187220671863178X-gr6.jpg?httpAccept=%2A%2F%2A",
            "@multimediatype": "JPEG image file",
            "@type": "IMAGE-DOWNSAMPLED",
            "@size": "63188",
            "@ref": "gr6",
            "@mimetype": "image/jpeg"
          },
          {
            "@category": "standard",
            "@height": "227",
            "@width": "323",
            "@_fa": "true",
            "$": "https://api.elsevier.com/content/object/eid/1-s2.0-S187220671863178X-gr7.jpg?httpAccept=%2A%2F%2A",
            "@multimediatype": "JPEG image file",
            "@type": "IMAGE-DOWNSAMPLED",
            "@size": "34378",
            "@ref": "gr7",
            "@mimetype": "image/jpeg"
          },
          {
            "@category": "standard",
            "@height": "167",
            "@width": "751",
            "@_fa": "true",
            "$": "https://api.elsevier.com/content/object/eid/1-s2.0-S187220671863178X-gr8.jpg?httpAccept=%2A%2F%2A",
            "@multimediatype": "JPEG image file",
            "@type": "IMAGE-DOWNSAMPLED",
            "@size": "64786",
            "@ref": "gr8",
            "@mimetype": "image/jpeg"
          },
          {
            "@category": "standard",
            "@height": "598",
            "@width": "565",
            "@_fa": "true",
            "$": "https://api.elsevier.com/content/object/eid/1-s2.0-S187220671863178X-gr9.jpg?httpAccept=%2A%2F%2A",
            "@multimediatype": "JPEG image file",
            "@type": "IMAGE-DOWNSAMPLED",
            "@size": "95089",
            "@ref": "gr9",
            "@mimetype": "image/jpeg"
          },
          {
            "@category": "high",
            "@height": "538",
            "@width": "800",
            "@_fa": "true",
            "$": "https://api.elsevier.com/content/object/eid/1-s2.0-S187220671863178X-fx1_lrg.jpg?httpAccept=%2A%2F%2A",
            "@multimediatype": "JPEG image file",
            "@type": "IMAGE-HIGH-RES",
            "@size": "140953",
            "@ref": "fx1",
            "@mimetype": "image/jpeg"
          },
          {
            "@category": "high",
            "@height": "647",
            "@width": "920",
            "@_fa": "true",
            "$": "https://api.elsevier.com/content/object/eid/1-s2.0-S187220671863178X-gr1_lrg.jpg?httpAccept=%2A%2F%2A",
            "@multimediatype": "JPEG image file",
            "@type": "IMAGE-HIGH-RES",
            "@size": "184876",
            "@ref": "gr1",
            "@mimetype": "image/jpeg"
          },
          {
            "@category": "high",
            "@height": "496",
            "@width": "993",
            "@_fa": "true",
            "$": "https://api.elsevier.com/content/object/eid/1-s2.0-S187220671863178X-gr2_lrg.jpg?httpAccept=%2A%2F%2A",
            "@multimediatype": "JPEG image file",
            "@type": "IMAGE-HIGH-RES",
            "@size": "252392",
            "@ref": "gr2",
            "@mimetype": "image/jpeg"
          },
          {
            "@category": "high",
            "@height": "930",
            "@width": "993",
            "@_fa": "true",
            "$": "https://api.elsevier.com/content/object/eid/1-s2.0-S187220671863178X-gr3_lrg.jpg?httpAccept=%2A%2F%2A",
            "@multimediatype": "JPEG image file",
            "@type": "IMAGE-HIGH-RES",
            "@size": "480739",
            "@ref": "gr3",
            "@mimetype": "image/jpeg"
          },
          {
            "@category": "high",
            "@height": "1398",
            "@width": "1815",
            "@_fa": "true",
            "$": "https://api.elsevier.com/content/object/eid/1-s2.0-S187220671863178X-gr4_lrg.jpg?httpAccept=%2A%2F%2A",
            "@multimediatype": "JPEG image file",
            "@type": "IMAGE-HIGH-RES",
            "@size": "405551",
            "@ref": "gr4",
            "@mimetype": "image/jpeg"
          },
          {
            "@category": "high",
            "@height": "732",
            "@width": "2009",
            "@_fa": "true",
            "$": "https://api.elsevier.com/content/object/eid/1-s2.0-S187220671863178X-gr5_lrg.jpg?httpAccept=%2A%2F%2A",
            "@multimediatype": "JPEG image file",
            "@type": "IMAGE-HIGH-RES",
            "@size": "271792",
            "@ref": "gr5",
            "@mimetype": "image/jpeg"
          },
          {
            "@category": "high",
            "@height": "754",
            "@width": "1998",
            "@_fa": "true",
            "$": "https://api.elsevier.com/content/object/eid/1-s2.0-S187220671863178X-gr6_lrg.jpg?httpAccept=%2A%2F%2A",
            "@multimediatype": "JPEG image file",
            "@type": "IMAGE-HIGH-RES",
            "@size": "220475",
            "@ref": "gr6",
            "@mimetype": "image/jpeg"
          },
          {
            "@category": "high",
            "@height": "604",
            "@width": "859",
            "@_fa": "true",
            "$": "https://api.elsevier.com/content/object/eid/1-s2.0-S187220671863178X-gr7_lrg.jpg?httpAccept=%2A%2F%2A",
            "@multimediatype": "JPEG image file",
            "@type": "IMAGE-HIGH-RES",
            "@size": "79193",
            "@ref": "gr7",
            "@mimetype": "image/jpeg"
          },
          {
            "@category": "high",
            "@height": "444",
            "@width": "1994",
            "@_fa": "true",
            "$": "https://api.elsevier.com/content/object/eid/1-s2.0-S187220671863178X-gr8_lrg.jpg?httpAccept=%2A%2F%2A",
            "@multimediatype": "JPEG image file",
            "@type": "IMAGE-HIGH-RES",
            "@size": "231160",
            "@ref": "gr8",
            "@mimetype": "image/jpeg"
          },
          {
            "@category": "high",
            "@height": "1588",
            "@width": "1501",
            "@_fa": "true",
            "$": "https://api.elsevier.com/content/object/eid/1-s2.0-S187220671863178X-gr9_lrg.jpg?httpAccept=%2A%2F%2A",
            "@multimediatype": "JPEG image file",
            "@type": "IMAGE-HIGH-RES",
            "@size": "318676",
            "@ref": "gr9",
            "@mimetype": "image/jpeg"
          },
          {
            "@category": "thumbnail",
            "@height": "74",
            "@width": "340",
            "@_fa": "true",
            "$": "https://api.elsevier.com/content/object/eid/1-s2.0-S187220671863178X-si1.gif?httpAccept=%2A%2F%2A",
            "@multimediatype": "GIF image file",
            "@type": "ALTIMG",
            "@size": "2677",
            "@ref": "si1",
            "@mimetype": "image/gif"
          }
        ]
      },
      "link": {
        "@rel": "abstract",
        "@href": "https://api.elsevier.com/content/abstract/scopus_id/85068580170"
      }
    }
  }
}